STDOUT:
Results will be saved in /home/philip/projects/ltspice_examples_code_repo/Circuit-Completion-Using-GNNs/component_classification_with_link_prediction_head/evaluation/FEGIN/results/model_FEGIN_dataset_ltspice_examples
Command line input: python main.py --data ltspice_examples --representation component_net --model FEGIN --layers 5 --hiddens 16 --batch_size 256 --lr 0.001 --emb_size 512 --epochs 100 --save_appendix component_net_L5_H16_BS256_LR0.001_E512 --no_val
 is saved.
-----
ltspice_examples - FEGIN
Using 5 layers, 16 hidden units, h = 2
Loading component_net representation dataset
ENTERED
Training FEGIN on component_net representation
Train: 3558, Test: 846
##################ITERATION #0 ****************************************
 epoch: 0, train_loss: 1.4114, test_loss: 1.4057, test_f1: 0.1004
 epoch: 1, train_loss: 1.3882, test_loss: 1.3946, test_f1: 0.1004
 epoch: 2, train_loss: 1.3664, test_loss: 1.3770, test_f1: 0.2183
 epoch: 3, train_loss: 1.3428, test_loss: 1.3427, test_f1: 0.2899
 epoch: 4, train_loss: 1.3150, test_loss: 1.3111, test_f1: 0.2768
 epoch: 5, train_loss: 1.2874, test_loss: 1.2823, test_f1: 0.2810
 epoch: 6, train_loss: 1.2720, test_loss: 1.2599, test_f1: 0.2809
 epoch: 7, train_loss: 1.2558, test_loss: 1.2388, test_f1: 0.3312
 epoch: 8, train_loss: 1.2418, test_loss: 1.2264, test_f1: 0.3317
 epoch: 9, train_loss: 1.2301, test_loss: 1.2131, test_f1: 0.2961
 epoch: 10, train_loss: 1.2221, test_loss: 1.2015, test_f1: 0.3082
 epoch: 11, train_loss: 1.2110, test_loss: 1.1901, test_f1: 0.3547
 epoch: 12, train_loss: 1.2075, test_loss: 1.1782, test_f1: 0.3615
 epoch: 13, train_loss: 1.1912, test_loss: 1.1672, test_f1: 0.3408
 epoch: 14, train_loss: 1.1802, test_loss: 1.1541, test_f1: 0.3420
 epoch: 15, train_loss: 1.1672, test_loss: 1.1429, test_f1: 0.3422
 epoch: 16, train_loss: 1.1608, test_loss: 1.1261, test_f1: 0.3592
 epoch: 17, train_loss: 1.1479, test_loss: 1.1083, test_f1: 0.3736
 epoch: 18, train_loss: 1.1322, test_loss: 1.1080, test_f1: 0.4152
 epoch: 19, train_loss: 1.1297, test_loss: 1.0989, test_f1: 0.3509
 epoch: 20, train_loss: 1.1285, test_loss: 1.0804, test_f1: 0.3747
 epoch: 21, train_loss: 1.1044, test_loss: 1.0639, test_f1: 0.3767
 epoch: 22, train_loss: 1.0884, test_loss: 1.0579, test_f1: 0.3805
 epoch: 23, train_loss: 1.0916, test_loss: 1.0526, test_f1: 0.4357
 epoch: 24, train_loss: 1.0843, test_loss: 1.0392, test_f1: 0.4709
 epoch: 25, train_loss: 1.0671, test_loss: 1.0283, test_f1: 0.4731
 epoch: 26, train_loss: 1.0659, test_loss: 1.0148, test_f1: 0.4955
 epoch: 27, train_loss: 1.0434, test_loss: 1.0065, test_f1: 0.5053
 epoch: 28, train_loss: 1.0398, test_loss: 0.9956, test_f1: 0.5103
 epoch: 29, train_loss: 1.0272, test_loss: 1.0024, test_f1: 0.5084
 epoch: 30, train_loss: 1.0110, test_loss: 0.9837, test_f1: 0.5022
 epoch: 31, train_loss: 1.0167, test_loss: 0.9798, test_f1: 0.5011
 epoch: 32, train_loss: 1.0021, test_loss: 0.9607, test_f1: 0.5605
 epoch: 33, train_loss: 0.9944, test_loss: 0.9621, test_f1: 0.4991
 epoch: 34, train_loss: 0.9856, test_loss: 0.9673, test_f1: 0.4933
 epoch: 35, train_loss: 0.9807, test_loss: 0.9454, test_f1: 0.5001
 epoch: 36, train_loss: 0.9637, test_loss: 0.9485, test_f1: 0.5477
 epoch: 37, train_loss: 0.9663, test_loss: 0.9369, test_f1: 0.5377
 epoch: 38, train_loss: 0.9591, test_loss: 0.9331, test_f1: 0.5137
 epoch: 39, train_loss: 0.9541, test_loss: 0.9347, test_f1: 0.5511
 epoch: 40, train_loss: 0.9421, test_loss: 0.9332, test_f1: 0.5535
 epoch: 41, train_loss: 0.9452, test_loss: 0.9208, test_f1: 0.5664
 epoch: 42, train_loss: 0.9300, test_loss: 0.9108, test_f1: 0.5616
 epoch: 43, train_loss: 0.9390, test_loss: 0.9302, test_f1: 0.5446
 epoch: 44, train_loss: 0.9339, test_loss: 0.9195, test_f1: 0.5575
 epoch: 45, train_loss: 0.9381, test_loss: 0.9290, test_f1: 0.5442
 epoch: 46, train_loss: 0.9252, test_loss: 0.9261, test_f1: 0.5460
 epoch: 47, train_loss: 0.9148, test_loss: 0.9043, test_f1: 0.5616
 epoch: 48, train_loss: 0.9157, test_loss: 0.9137, test_f1: 0.5542
 epoch: 49, train_loss: 0.9157, test_loss: 0.9052, test_f1: 0.5832
 epoch: 50, train_loss: 0.9145, test_loss: 0.9249, test_f1: 0.5536
 epoch: 51, train_loss: 0.8933, test_loss: 0.9016, test_f1: 0.5633
 epoch: 52, train_loss: 0.8927, test_loss: 0.8965, test_f1: 0.5673
 epoch: 53, train_loss: 0.8834, test_loss: 0.9015, test_f1: 0.5725
 epoch: 54, train_loss: 0.8847, test_loss: 0.9005, test_f1: 0.5748
 epoch: 55, train_loss: 0.8968, test_loss: 0.9288, test_f1: 0.5664
 epoch: 56, train_loss: 0.8927, test_loss: 0.9151, test_f1: 0.5622
 epoch: 57, train_loss: 0.8876, test_loss: 0.9105, test_f1: 0.5642
 epoch: 58, train_loss: 0.8743, test_loss: 0.9260, test_f1: 0.5644
 epoch: 59, train_loss: 0.8700, test_loss: 0.9275, test_f1: 0.5708
 epoch: 60, train_loss: 0.8743, test_loss: 0.9374, test_f1: 0.5614
 epoch: 61, train_loss: 0.8688, test_loss: 0.9075, test_f1: 0.5779
 epoch: 62, train_loss: 0.8711, test_loss: 0.9052, test_f1: 0.5832
 epoch: 63, train_loss: 0.8669, test_loss: 0.9301, test_f1: 0.5676
 epoch: 64, train_loss: 0.8719, test_loss: 0.9331, test_f1: 0.5814
 epoch: 65, train_loss: 0.8665, test_loss: 0.9331, test_f1: 0.5838
 epoch: 66, train_loss: 0.8671, test_loss: 0.9092, test_f1: 0.5721
 epoch: 67, train_loss: 0.8661, test_loss: 0.9056, test_f1: 0.5887
 epoch: 68, train_loss: 0.8608, test_loss: 0.9399, test_f1: 0.5610
 epoch: 69, train_loss: 0.8663, test_loss: 0.9187, test_f1: 0.5726
 epoch: 70, train_loss: 0.8585, test_loss: 0.9284, test_f1: 0.5754
 epoch: 71, train_loss: 0.8615, test_loss: 0.9032, test_f1: 0.5858
 epoch: 72, train_loss: 0.8551, test_loss: 0.8984, test_f1: 0.5601
 epoch: 73, train_loss: 0.8434, test_loss: 0.9142, test_f1: 0.5512
 epoch: 74, train_loss: 0.8570, test_loss: 0.9217, test_f1: 0.5453
 epoch: 75, train_loss: 0.8530, test_loss: 0.9036, test_f1: 0.5492
 epoch: 76, train_loss: 0.8513, test_loss: 0.9356, test_f1: 0.5503
 epoch: 77, train_loss: 0.8532, test_loss: 0.9356, test_f1: 0.5379
 epoch: 78, train_loss: 0.8391, test_loss: 0.9371, test_f1: 0.5644
 epoch: 79, train_loss: 0.8453, test_loss: 0.9485, test_f1: 0.5754
 epoch: 80, train_loss: 0.8515, test_loss: 0.9292, test_f1: 0.5578
 epoch: 81, train_loss: 0.8455, test_loss: 0.9260, test_f1: 0.5791
 epoch: 82, train_loss: 0.8438, test_loss: 0.9202, test_f1: 0.5767
 epoch: 83, train_loss: 0.8427, test_loss: 0.9570, test_f1: 0.5773
 epoch: 84, train_loss: 0.8431, test_loss: 0.9049, test_f1: 0.5821
 epoch: 85, train_loss: 0.8406, test_loss: 0.9409, test_f1: 0.5584
 epoch: 86, train_loss: 0.8369, test_loss: 0.9024, test_f1: 0.5746
 epoch: 87, train_loss: 0.8278, test_loss: 0.9311, test_f1: 0.5542
 epoch: 88, train_loss: 0.8347, test_loss: 0.9396, test_f1: 0.5721
 epoch: 89, train_loss: 0.8437, test_loss: 0.9035, test_f1: 0.5801
 epoch: 90, train_loss: 0.8444, test_loss: 0.8980, test_f1: 0.5753
 epoch: 91, train_loss: 0.8231, test_loss: 0.9064, test_f1: 0.5872
 epoch: 92, train_loss: 0.8346, test_loss: 0.9171, test_f1: 0.5798
 epoch: 93, train_loss: 0.8358, test_loss: 0.9160, test_f1: 0.5853
 epoch: 94, train_loss: 0.8388, test_loss: 0.8917, test_f1: 0.5768
 epoch: 95, train_loss: 0.8310, test_loss: 0.8973, test_f1: 0.5929
 epoch: 96, train_loss: 0.8261, test_loss: 0.9036, test_f1: 0.5849
 epoch: 97, train_loss: 0.8230, test_loss: 0.9146, test_f1: 0.5670
 epoch: 98, train_loss: 0.8200, test_loss: 0.9137, test_f1: 0.5673
 epoch: 99, train_loss: 0.8180, test_loss: 0.9235, test_f1: 0.5793
##################ITERATION #1 ****************************************
 epoch: 0, train_loss: 1.3794, test_loss: 1.3749, test_f1: 0.2251
 epoch: 1, train_loss: 1.2806, test_loss: 1.3295, test_f1: 0.2270
 epoch: 2, train_loss: 1.2571, test_loss: 1.2914, test_f1: 0.2270
 epoch: 3, train_loss: 1.2209, test_loss: 1.2534, test_f1: 0.2701
 epoch: 4, train_loss: 1.1992, test_loss: 1.1874, test_f1: 0.3611
 epoch: 5, train_loss: 1.1783, test_loss: 1.1401, test_f1: 0.4062
 epoch: 6, train_loss: 1.1498, test_loss: 1.1031, test_f1: 0.4212
 epoch: 7, train_loss: 1.1230, test_loss: 1.0743, test_f1: 0.4382
 epoch: 8, train_loss: 1.0947, test_loss: 1.0460, test_f1: 0.4542
 epoch: 9, train_loss: 1.0703, test_loss: 1.0220, test_f1: 0.4349
 epoch: 10, train_loss: 1.0498, test_loss: 1.0111, test_f1: 0.4610
 epoch: 11, train_loss: 1.0322, test_loss: 0.9936, test_f1: 0.4561
 epoch: 12, train_loss: 1.0217, test_loss: 0.9824, test_f1: 0.4627
 epoch: 13, train_loss: 1.0110, test_loss: 0.9892, test_f1: 0.4518
 epoch: 14, train_loss: 1.0013, test_loss: 0.9804, test_f1: 0.4512
 epoch: 15, train_loss: 0.9966, test_loss: 0.9721, test_f1: 0.4841
 epoch: 16, train_loss: 0.9727, test_loss: 0.9704, test_f1: 0.4658
 epoch: 17, train_loss: 0.9797, test_loss: 0.9591, test_f1: 0.4630
 epoch: 18, train_loss: 0.9667, test_loss: 0.9576, test_f1: 0.4606
 epoch: 19, train_loss: 0.9559, test_loss: 0.9522, test_f1: 0.4668
 epoch: 20, train_loss: 0.9486, test_loss: 0.9615, test_f1: 0.4930
 epoch: 21, train_loss: 0.9401, test_loss: 0.9533, test_f1: 0.4715
 epoch: 22, train_loss: 0.9476, test_loss: 0.9684, test_f1: 0.4737
 epoch: 23, train_loss: 0.9349, test_loss: 0.9939, test_f1: 0.4751
 epoch: 24, train_loss: 0.9263, test_loss: 0.9598, test_f1: 0.4830
 epoch: 25, train_loss: 0.9173, test_loss: 0.9453, test_f1: 0.4962
 epoch: 26, train_loss: 0.8982, test_loss: 0.9346, test_f1: 0.5130
 epoch: 27, train_loss: 0.9136, test_loss: 0.9268, test_f1: 0.5064
 epoch: 28, train_loss: 0.9150, test_loss: 0.9494, test_f1: 0.4786
 epoch: 29, train_loss: 0.9115, test_loss: 0.9472, test_f1: 0.5133
 epoch: 30, train_loss: 0.9065, test_loss: 0.9613, test_f1: 0.4849
 epoch: 31, train_loss: 0.8848, test_loss: 0.9496, test_f1: 0.4961
 epoch: 32, train_loss: 0.8998, test_loss: 0.9437, test_f1: 0.5072
 epoch: 33, train_loss: 0.8894, test_loss: 0.9519, test_f1: 0.5135
 epoch: 34, train_loss: 0.8827, test_loss: 0.9518, test_f1: 0.5149
 epoch: 35, train_loss: 0.8914, test_loss: 0.9454, test_f1: 0.5144
 epoch: 36, train_loss: 0.8856, test_loss: 0.9363, test_f1: 0.5183
 epoch: 37, train_loss: 0.8751, test_loss: 0.9427, test_f1: 0.5173
 epoch: 38, train_loss: 0.8704, test_loss: 0.9711, test_f1: 0.5001
 epoch: 39, train_loss: 0.8761, test_loss: 0.9510, test_f1: 0.5201
 epoch: 40, train_loss: 0.8622, test_loss: 0.9530, test_f1: 0.5105
 epoch: 41, train_loss: 0.8651, test_loss: 0.9674, test_f1: 0.5206
 epoch: 42, train_loss: 0.8740, test_loss: 0.9394, test_f1: 0.5171
 epoch: 43, train_loss: 0.8598, test_loss: 0.9668, test_f1: 0.5226
 epoch: 44, train_loss: 0.8618, test_loss: 0.9421, test_f1: 0.5209
 epoch: 45, train_loss: 0.8509, test_loss: 0.9576, test_f1: 0.5305
 epoch: 46, train_loss: 0.8548, test_loss: 0.9446, test_f1: 0.5223
 epoch: 47, train_loss: 0.8468, test_loss: 0.9564, test_f1: 0.5193
 epoch: 48, train_loss: 0.8384, test_loss: 0.9361, test_f1: 0.5342
 epoch: 49, train_loss: 0.8432, test_loss: 0.9513, test_f1: 0.5195
 epoch: 50, train_loss: 0.8380, test_loss: 0.9673, test_f1: 0.5104
 epoch: 51, train_loss: 0.8350, test_loss: 0.9349, test_f1: 0.5383
 epoch: 52, train_loss: 0.8252, test_loss: 0.9343, test_f1: 0.5416
 epoch: 53, train_loss: 0.8250, test_loss: 0.9344, test_f1: 0.5429
 epoch: 54, train_loss: 0.8203, test_loss: 0.9325, test_f1: 0.5421
 epoch: 55, train_loss: 0.8316, test_loss: 0.9339, test_f1: 0.5288
 epoch: 56, train_loss: 0.8200, test_loss: 0.9493, test_f1: 0.5326
 epoch: 57, train_loss: 0.8319, test_loss: 0.9472, test_f1: 0.5380
 epoch: 58, train_loss: 0.8132, test_loss: 0.9550, test_f1: 0.5281
 epoch: 59, train_loss: 0.8265, test_loss: 0.9410, test_f1: 0.5369
 epoch: 60, train_loss: 0.8088, test_loss: 0.9630, test_f1: 0.5287
 epoch: 61, train_loss: 0.8104, test_loss: 0.9461, test_f1: 0.5433
 epoch: 62, train_loss: 0.8188, test_loss: 0.9499, test_f1: 0.5291
 epoch: 63, train_loss: 0.8143, test_loss: 0.9381, test_f1: 0.5414
 epoch: 64, train_loss: 0.8100, test_loss: 0.9573, test_f1: 0.5362
 epoch: 65, train_loss: 0.8094, test_loss: 0.9446, test_f1: 0.5402
 epoch: 66, train_loss: 0.8140, test_loss: 0.9439, test_f1: 0.5379
 epoch: 67, train_loss: 0.8024, test_loss: 0.9545, test_f1: 0.5450
 epoch: 68, train_loss: 0.7996, test_loss: 0.9485, test_f1: 0.5380
 epoch: 69, train_loss: 0.8094, test_loss: 0.9342, test_f1: 0.5494
 epoch: 70, train_loss: 0.7955, test_loss: 0.9394, test_f1: 0.5431
 epoch: 71, train_loss: 0.8033, test_loss: 0.9483, test_f1: 0.5387
 epoch: 72, train_loss: 0.8131, test_loss: 0.9467, test_f1: 0.5349
 epoch: 73, train_loss: 0.8035, test_loss: 0.9454, test_f1: 0.5397
 epoch: 74, train_loss: 0.8036, test_loss: 0.9415, test_f1: 0.5385
 epoch: 75, train_loss: 0.8132, test_loss: 0.9423, test_f1: 0.5341
 epoch: 76, train_loss: 0.8012, test_loss: 0.9490, test_f1: 0.5380
 epoch: 77, train_loss: 0.8022, test_loss: 0.9416, test_f1: 0.5443
 epoch: 78, train_loss: 0.8075, test_loss: 0.9436, test_f1: 0.5380
 epoch: 79, train_loss: 0.7996, test_loss: 0.9524, test_f1: 0.5349
 epoch: 80, train_loss: 0.8044, test_loss: 0.9517, test_f1: 0.5480
 epoch: 81, train_loss: 0.8063, test_loss: 0.9445, test_f1: 0.5489
 epoch: 82, train_loss: 0.8014, test_loss: 0.9385, test_f1: 0.5435
 epoch: 83, train_loss: 0.7959, test_loss: 0.9470, test_f1: 0.5397
 epoch: 84, train_loss: 0.7914, test_loss: 0.9369, test_f1: 0.5402
 epoch: 85, train_loss: 0.8020, test_loss: 0.9458, test_f1: 0.5410
 epoch: 86, train_loss: 0.7911, test_loss: 0.9545, test_f1: 0.5343
 epoch: 87, train_loss: 0.7907, test_loss: 0.9564, test_f1: 0.5474
 epoch: 88, train_loss: 0.7949, test_loss: 0.9606, test_f1: 0.5354
 epoch: 89, train_loss: 0.7768, test_loss: 0.9444, test_f1: 0.5411
 epoch: 90, train_loss: 0.7798, test_loss: 0.9454, test_f1: 0.5367
 epoch: 91, train_loss: 0.7787, test_loss: 0.9364, test_f1: 0.5398
 epoch: 92, train_loss: 0.7838, test_loss: 0.9478, test_f1: 0.5457
 epoch: 93, train_loss: 0.7812, test_loss: 0.9658, test_f1: 0.5507
 epoch: 94, train_loss: 0.7888, test_loss: 0.9661, test_f1: 0.5440
 epoch: 95, train_loss: 0.7836, test_loss: 0.9644, test_f1: 0.5484
 epoch: 96, train_loss: 0.7865, test_loss: 0.9450, test_f1: 0.5494
 epoch: 97, train_loss: 0.7741, test_loss: 0.9436, test_f1: 0.5534
 epoch: 98, train_loss: 0.7837, test_loss: 0.9317, test_f1: 0.5462
 epoch: 99, train_loss: 0.7788, test_loss: 0.9508, test_f1: 0.5460
##################ITERATION #2 ****************************************
 epoch: 0, train_loss: 1.3205, test_loss: 1.3530, test_f1: 0.2270
 epoch: 1, train_loss: 1.2666, test_loss: 1.3393, test_f1: 0.2270
 epoch: 2, train_loss: 1.2351, test_loss: 1.3064, test_f1: 0.2270
 epoch: 3, train_loss: 1.2121, test_loss: 1.2311, test_f1: 0.3176
 epoch: 4, train_loss: 1.1925, test_loss: 1.1782, test_f1: 0.3802
 epoch: 5, train_loss: 1.1622, test_loss: 1.1248, test_f1: 0.4012
 epoch: 6, train_loss: 1.1534, test_loss: 1.0926, test_f1: 0.4146
 epoch: 7, train_loss: 1.1290, test_loss: 1.0660, test_f1: 0.4356
 epoch: 8, train_loss: 1.1107, test_loss: 1.0576, test_f1: 0.4457
 epoch: 9, train_loss: 1.0919, test_loss: 1.0264, test_f1: 0.4572
 epoch: 10, train_loss: 1.0765, test_loss: 1.0257, test_f1: 0.4875
 epoch: 11, train_loss: 1.0617, test_loss: 1.0175, test_f1: 0.4754
 epoch: 12, train_loss: 1.0507, test_loss: 1.0023, test_f1: 0.4715
 epoch: 13, train_loss: 1.0246, test_loss: 1.0016, test_f1: 0.5035
 epoch: 14, train_loss: 1.0238, test_loss: 0.9704, test_f1: 0.4920
 epoch: 15, train_loss: 1.0017, test_loss: 0.9721, test_f1: 0.4873
 epoch: 16, train_loss: 0.9957, test_loss: 0.9719, test_f1: 0.4859
 epoch: 17, train_loss: 0.9847, test_loss: 0.9448, test_f1: 0.5056
 epoch: 18, train_loss: 0.9649, test_loss: 0.9506, test_f1: 0.5138
 epoch: 19, train_loss: 0.9622, test_loss: 0.9380, test_f1: 0.5014
 epoch: 20, train_loss: 0.9526, test_loss: 0.9405, test_f1: 0.5036
 epoch: 21, train_loss: 0.9540, test_loss: 0.9419, test_f1: 0.5098
 epoch: 22, train_loss: 0.9359, test_loss: 0.9282, test_f1: 0.5039
 epoch: 23, train_loss: 0.9319, test_loss: 0.9439, test_f1: 0.5050
 epoch: 24, train_loss: 0.9246, test_loss: 0.9377, test_f1: 0.5071
 epoch: 25, train_loss: 0.9193, test_loss: 0.9362, test_f1: 0.5103
 epoch: 26, train_loss: 0.9160, test_loss: 0.9283, test_f1: 0.5139
 epoch: 27, train_loss: 0.9062, test_loss: 0.9365, test_f1: 0.5109
 epoch: 28, train_loss: 0.9029, test_loss: 0.9327, test_f1: 0.5180
 epoch: 29, train_loss: 0.8934, test_loss: 0.9310, test_f1: 0.5224
 epoch: 30, train_loss: 0.9009, test_loss: 0.9348, test_f1: 0.5022
 epoch: 31, train_loss: 0.9002, test_loss: 0.9560, test_f1: 0.5017
 epoch: 32, train_loss: 0.8827, test_loss: 0.9320, test_f1: 0.5418
 epoch: 33, train_loss: 0.8818, test_loss: 0.9339, test_f1: 0.5294
 epoch: 34, train_loss: 0.8889, test_loss: 0.9146, test_f1: 0.5321
 epoch: 35, train_loss: 0.8846, test_loss: 0.9408, test_f1: 0.5228
 epoch: 36, train_loss: 0.8788, test_loss: 0.9364, test_f1: 0.5182
 epoch: 37, train_loss: 0.8882, test_loss: 0.9393, test_f1: 0.5270
 epoch: 38, train_loss: 0.8695, test_loss: 0.9408, test_f1: 0.5311
 epoch: 39, train_loss: 0.8717, test_loss: 0.9369, test_f1: 0.5262
 epoch: 40, train_loss: 0.8618, test_loss: 0.9501, test_f1: 0.5281
 epoch: 41, train_loss: 0.8699, test_loss: 0.9326, test_f1: 0.5247
 epoch: 42, train_loss: 0.8678, test_loss: 0.9466, test_f1: 0.5336
 epoch: 43, train_loss: 0.8686, test_loss: 0.9356, test_f1: 0.5266
 epoch: 44, train_loss: 0.8605, test_loss: 0.9381, test_f1: 0.5384
 epoch: 45, train_loss: 0.8567, test_loss: 0.9508, test_f1: 0.5233
 epoch: 46, train_loss: 0.8688, test_loss: 0.9383, test_f1: 0.5282
 epoch: 47, train_loss: 0.8484, test_loss: 0.9355, test_f1: 0.5442
 epoch: 48, train_loss: 0.8561, test_loss: 0.9485, test_f1: 0.5335
 epoch: 49, train_loss: 0.8494, test_loss: 0.9510, test_f1: 0.5473
 epoch: 50, train_loss: 0.8481, test_loss: 0.9301, test_f1: 0.5330
 epoch: 51, train_loss: 0.8442, test_loss: 0.9449, test_f1: 0.5372
 epoch: 52, train_loss: 0.8333, test_loss: 0.9396, test_f1: 0.5467
 epoch: 53, train_loss: 0.8431, test_loss: 0.9468, test_f1: 0.5401
 epoch: 54, train_loss: 0.8252, test_loss: 0.9406, test_f1: 0.5404
 epoch: 55, train_loss: 0.8270, test_loss: 0.9370, test_f1: 0.5366
 epoch: 56, train_loss: 0.8309, test_loss: 0.9361, test_f1: 0.5439
 epoch: 57, train_loss: 0.8272, test_loss: 0.9362, test_f1: 0.5361
 epoch: 58, train_loss: 0.8273, test_loss: 0.9508, test_f1: 0.5339
 epoch: 59, train_loss: 0.8146, test_loss: 0.9459, test_f1: 0.5316
 epoch: 60, train_loss: 0.8312, test_loss: 0.9553, test_f1: 0.5316
 epoch: 61, train_loss: 0.8188, test_loss: 0.9586, test_f1: 0.5311
 epoch: 62, train_loss: 0.8194, test_loss: 0.9570, test_f1: 0.5339
 epoch: 63, train_loss: 0.8201, test_loss: 0.9536, test_f1: 0.5355
 epoch: 64, train_loss: 0.8250, test_loss: 0.9557, test_f1: 0.5400
 epoch: 65, train_loss: 0.8115, test_loss: 0.9569, test_f1: 0.5465
 epoch: 66, train_loss: 0.8166, test_loss: 0.9632, test_f1: 0.5424
 epoch: 67, train_loss: 0.8192, test_loss: 0.9626, test_f1: 0.5336
 epoch: 68, train_loss: 0.8213, test_loss: 0.9629, test_f1: 0.5460
 epoch: 69, train_loss: 0.8269, test_loss: 0.9737, test_f1: 0.5411
 epoch: 70, train_loss: 0.8207, test_loss: 0.9506, test_f1: 0.5505
 epoch: 71, train_loss: 0.8216, test_loss: 0.9507, test_f1: 0.5332
 epoch: 72, train_loss: 0.8233, test_loss: 0.9416, test_f1: 0.5452
 epoch: 73, train_loss: 0.8176, test_loss: 0.9587, test_f1: 0.5435
 epoch: 74, train_loss: 0.8050, test_loss: 0.9735, test_f1: 0.5362
 epoch: 75, train_loss: 0.8080, test_loss: 0.9592, test_f1: 0.5378
 epoch: 76, train_loss: 0.8079, test_loss: 0.9620, test_f1: 0.5403
 epoch: 77, train_loss: 0.8141, test_loss: 0.9656, test_f1: 0.5391
 epoch: 78, train_loss: 0.7984, test_loss: 0.9641, test_f1: 0.5402
 epoch: 79, train_loss: 0.8147, test_loss: 0.9719, test_f1: 0.5309
 epoch: 80, train_loss: 0.8143, test_loss: 0.9788, test_f1: 0.5368
 epoch: 81, train_loss: 0.7926, test_loss: 0.9720, test_f1: 0.5360
 epoch: 82, train_loss: 0.8004, test_loss: 0.9727, test_f1: 0.5308
 epoch: 83, train_loss: 0.8073, test_loss: 0.9887, test_f1: 0.5351
 epoch: 84, train_loss: 0.7932, test_loss: 0.9721, test_f1: 0.5315
 epoch: 85, train_loss: 0.7975, test_loss: 0.9612, test_f1: 0.5403
 epoch: 86, train_loss: 0.8001, test_loss: 0.9764, test_f1: 0.5467
 epoch: 87, train_loss: 0.7980, test_loss: 0.9772, test_f1: 0.5337
 epoch: 88, train_loss: 0.8054, test_loss: 0.9689, test_f1: 0.5318
 epoch: 89, train_loss: 0.8064, test_loss: 0.9960, test_f1: 0.5220
 epoch: 90, train_loss: 0.8029, test_loss: 0.9918, test_f1: 0.5316
 epoch: 91, train_loss: 0.8086, test_loss: 0.9869, test_f1: 0.5435
 epoch: 92, train_loss: 0.8064, test_loss: 0.9900, test_f1: 0.5399
 epoch: 93, train_loss: 0.7927, test_loss: 0.9862, test_f1: 0.5329
 epoch: 94, train_loss: 0.8036, test_loss: 0.9708, test_f1: 0.5387
 epoch: 95, train_loss: 0.7996, test_loss: 0.9594, test_f1: 0.5379
 epoch: 96, train_loss: 0.7942, test_loss: 0.9828, test_f1: 0.5315
 epoch: 97, train_loss: 0.7839, test_loss: 0.9777, test_f1: 0.5501
 epoch: 98, train_loss: 0.7895, test_loss: 0.9777, test_f1: 0.5376
 epoch: 99, train_loss: 0.7955, test_loss: 0.9745, test_f1: 0.5399
##################ITERATION #3 ****************************************
 epoch: 0, train_loss: 1.3302, test_loss: 1.3071, test_f1: 0.2270
 epoch: 1, train_loss: 1.2350, test_loss: 1.2901, test_f1: 0.2270
 epoch: 2, train_loss: 1.2048, test_loss: 1.2492, test_f1: 0.2883
 epoch: 3, train_loss: 1.1839, test_loss: 1.1816, test_f1: 0.3673
 epoch: 4, train_loss: 1.1570, test_loss: 1.1156, test_f1: 0.4198
 epoch: 5, train_loss: 1.1289, test_loss: 1.0766, test_f1: 0.4191
 epoch: 6, train_loss: 1.1095, test_loss: 1.0590, test_f1: 0.4336
 epoch: 7, train_loss: 1.0849, test_loss: 1.0380, test_f1: 0.4599
 epoch: 8, train_loss: 1.0767, test_loss: 1.0251, test_f1: 0.4642
 epoch: 9, train_loss: 1.0503, test_loss: 1.0198, test_f1: 0.4747
 epoch: 10, train_loss: 1.0396, test_loss: 1.0242, test_f1: 0.4722
 epoch: 11, train_loss: 1.0410, test_loss: 1.0066, test_f1: 0.4557
 epoch: 12, train_loss: 1.0315, test_loss: 0.9966, test_f1: 0.4825
 epoch: 13, train_loss: 1.0235, test_loss: 0.9997, test_f1: 0.4815
 epoch: 14, train_loss: 1.0080, test_loss: 1.0215, test_f1: 0.4832
 epoch: 15, train_loss: 0.9996, test_loss: 1.0031, test_f1: 0.4933
 epoch: 16, train_loss: 0.9967, test_loss: 0.9990, test_f1: 0.4707
 epoch: 17, train_loss: 0.9784, test_loss: 1.0072, test_f1: 0.4878
 epoch: 18, train_loss: 0.9779, test_loss: 0.9926, test_f1: 0.5225
 epoch: 19, train_loss: 0.9767, test_loss: 1.0024, test_f1: 0.5039
 epoch: 20, train_loss: 0.9706, test_loss: 1.0402, test_f1: 0.4775
 epoch: 21, train_loss: 0.9702, test_loss: 1.0280, test_f1: 0.5052
 epoch: 22, train_loss: 0.9567, test_loss: 0.9976, test_f1: 0.4914
 epoch: 23, train_loss: 0.9584, test_loss: 1.0052, test_f1: 0.5053
 epoch: 24, train_loss: 0.9484, test_loss: 0.9946, test_f1: 0.4963
 epoch: 25, train_loss: 0.9374, test_loss: 1.0015, test_f1: 0.5395
 epoch: 26, train_loss: 0.9518, test_loss: 1.0343, test_f1: 0.4845
 epoch: 27, train_loss: 0.9419, test_loss: 0.9979, test_f1: 0.5126
 epoch: 28, train_loss: 0.9247, test_loss: 0.9955, test_f1: 0.5181
 epoch: 29, train_loss: 0.9330, test_loss: 1.0190, test_f1: 0.5043
 epoch: 30, train_loss: 0.9337, test_loss: 0.9849, test_f1: 0.5352
 epoch: 31, train_loss: 0.9345, test_loss: 1.0089, test_f1: 0.5227
 epoch: 32, train_loss: 0.9134, test_loss: 1.0088, test_f1: 0.5171
 epoch: 33, train_loss: 0.9106, test_loss: 0.9902, test_f1: 0.5366
 epoch: 34, train_loss: 0.9092, test_loss: 0.9873, test_f1: 0.5144
 epoch: 35, train_loss: 0.9028, test_loss: 0.9858, test_f1: 0.5213
 epoch: 36, train_loss: 0.8995, test_loss: 0.9824, test_f1: 0.5195
 epoch: 37, train_loss: 0.8908, test_loss: 0.9916, test_f1: 0.5144
 epoch: 38, train_loss: 0.9054, test_loss: 0.9677, test_f1: 0.5094
 epoch: 39, train_loss: 0.8910, test_loss: 0.9681, test_f1: 0.5417
 epoch: 40, train_loss: 0.8885, test_loss: 0.9909, test_f1: 0.5059
 epoch: 41, train_loss: 0.8846, test_loss: 0.9993, test_f1: 0.5141
 epoch: 42, train_loss: 0.8882, test_loss: 0.9769, test_f1: 0.5157
 epoch: 43, train_loss: 0.8853, test_loss: 0.9793, test_f1: 0.5308
 epoch: 44, train_loss: 0.8891, test_loss: 0.9835, test_f1: 0.5187
 epoch: 45, train_loss: 0.8802, test_loss: 0.9870, test_f1: 0.5139
 epoch: 46, train_loss: 0.8798, test_loss: 0.9815, test_f1: 0.5113
 epoch: 47, train_loss: 0.8837, test_loss: 0.9590, test_f1: 0.5130
 epoch: 48, train_loss: 0.8676, test_loss: 0.9780, test_f1: 0.5297
 epoch: 49, train_loss: 0.8656, test_loss: 0.9838, test_f1: 0.5171
 epoch: 50, train_loss: 0.8779, test_loss: 1.0019, test_f1: 0.5168
 epoch: 51, train_loss: 0.8701, test_loss: 0.9772, test_f1: 0.5276
 epoch: 52, train_loss: 0.8676, test_loss: 0.9875, test_f1: 0.5324
 epoch: 53, train_loss: 0.8577, test_loss: 0.9752, test_f1: 0.5288
 epoch: 54, train_loss: 0.8619, test_loss: 0.9746, test_f1: 0.5202
 epoch: 55, train_loss: 0.8541, test_loss: 0.9752, test_f1: 0.5239
 epoch: 56, train_loss: 0.8633, test_loss: 0.9768, test_f1: 0.5289
 epoch: 57, train_loss: 0.8501, test_loss: 0.9711, test_f1: 0.5233
 epoch: 58, train_loss: 0.8493, test_loss: 0.9736, test_f1: 0.5193
 epoch: 59, train_loss: 0.8535, test_loss: 0.9869, test_f1: 0.5247
 epoch: 60, train_loss: 0.8529, test_loss: 0.9881, test_f1: 0.5296
 epoch: 61, train_loss: 0.8555, test_loss: 0.9726, test_f1: 0.5287
 epoch: 62, train_loss: 0.8478, test_loss: 0.9727, test_f1: 0.5323
 epoch: 63, train_loss: 0.8387, test_loss: 0.9760, test_f1: 0.5276
 epoch: 64, train_loss: 0.8416, test_loss: 0.9746, test_f1: 0.5318
 epoch: 65, train_loss: 0.8394, test_loss: 0.9759, test_f1: 0.5264
 epoch: 66, train_loss: 0.8471, test_loss: 0.9701, test_f1: 0.5249
 epoch: 67, train_loss: 0.8491, test_loss: 0.9802, test_f1: 0.5309
 epoch: 68, train_loss: 0.8267, test_loss: 0.9856, test_f1: 0.5279
 epoch: 69, train_loss: 0.8405, test_loss: 0.9922, test_f1: 0.5202
 epoch: 70, train_loss: 0.8348, test_loss: 0.9787, test_f1: 0.5426
 epoch: 71, train_loss: 0.8381, test_loss: 0.9747, test_f1: 0.5337
 epoch: 72, train_loss: 0.8272, test_loss: 0.9850, test_f1: 0.5257
 epoch: 73, train_loss: 0.8276, test_loss: 0.9860, test_f1: 0.5270
 epoch: 74, train_loss: 0.8361, test_loss: 0.9805, test_f1: 0.5390
 epoch: 75, train_loss: 0.8309, test_loss: 0.9872, test_f1: 0.5387
 epoch: 76, train_loss: 0.8334, test_loss: 0.9855, test_f1: 0.5360
 epoch: 77, train_loss: 0.8278, test_loss: 0.9852, test_f1: 0.5305
 epoch: 78, train_loss: 0.8257, test_loss: 0.9906, test_f1: 0.5416
 epoch: 79, train_loss: 0.8202, test_loss: 0.9824, test_f1: 0.5361
 epoch: 80, train_loss: 0.8309, test_loss: 1.0052, test_f1: 0.5275
 epoch: 81, train_loss: 0.8176, test_loss: 0.9890, test_f1: 0.5360
 epoch: 82, train_loss: 0.8146, test_loss: 0.9925, test_f1: 0.5331
 epoch: 83, train_loss: 0.8216, test_loss: 0.9920, test_f1: 0.5406
 epoch: 84, train_loss: 0.8220, test_loss: 0.9986, test_f1: 0.5365
 epoch: 85, train_loss: 0.8256, test_loss: 0.9872, test_f1: 0.5463
 epoch: 86, train_loss: 0.8171, test_loss: 0.9835, test_f1: 0.5359
 epoch: 87, train_loss: 0.8219, test_loss: 0.9771, test_f1: 0.5402
 epoch: 88, train_loss: 0.8310, test_loss: 0.9817, test_f1: 0.5393
 epoch: 89, train_loss: 0.8228, test_loss: 0.9856, test_f1: 0.5403
 epoch: 90, train_loss: 0.8223, test_loss: 0.9814, test_f1: 0.5392
 epoch: 91, train_loss: 0.8181, test_loss: 0.9878, test_f1: 0.5502
 epoch: 92, train_loss: 0.8235, test_loss: 0.9890, test_f1: 0.5601
 epoch: 93, train_loss: 0.8118, test_loss: 1.0063, test_f1: 0.5360
 epoch: 94, train_loss: 0.8142, test_loss: 0.9926, test_f1: 0.5456
 epoch: 95, train_loss: 0.8164, test_loss: 1.0052, test_f1: 0.5516
 epoch: 96, train_loss: 0.8189, test_loss: 1.0052, test_f1: 0.5523
 epoch: 97, train_loss: 0.8100, test_loss: 1.0120, test_f1: 0.5358
 epoch: 98, train_loss: 0.8107, test_loss: 1.0012, test_f1: 0.5348
 epoch: 99, train_loss: 0.8189, test_loss: 0.9989, test_f1: 0.5462
##################ITERATION #4 ****************************************
 epoch: 0, train_loss: 1.2974, test_loss: 1.3507, test_f1: 0.2270
 epoch: 1, train_loss: 1.2261, test_loss: 1.3264, test_f1: 0.2270
 epoch: 2, train_loss: 1.2121, test_loss: 1.2782, test_f1: 0.2270
 epoch: 3, train_loss: 1.1835, test_loss: 1.2234, test_f1: 0.2295
 epoch: 4, train_loss: 1.1641, test_loss: 1.2236, test_f1: 0.3115
 epoch: 5, train_loss: 1.1444, test_loss: 1.1307, test_f1: 0.4129
 epoch: 6, train_loss: 1.1249, test_loss: 1.0836, test_f1: 0.4583
 epoch: 7, train_loss: 1.1199, test_loss: 1.0666, test_f1: 0.4668
 epoch: 8, train_loss: 1.1045, test_loss: 1.0449, test_f1: 0.4821
 epoch: 9, train_loss: 1.0859, test_loss: 1.0375, test_f1: 0.4899
 epoch: 10, train_loss: 1.0687, test_loss: 1.0254, test_f1: 0.4695
 epoch: 11, train_loss: 1.0543, test_loss: 1.0205, test_f1: 0.4725
 epoch: 12, train_loss: 1.0441, test_loss: 0.9895, test_f1: 0.5103
 epoch: 13, train_loss: 1.0425, test_loss: 0.9863, test_f1: 0.4868
 epoch: 14, train_loss: 1.0268, test_loss: 0.9799, test_f1: 0.5048
 epoch: 15, train_loss: 1.0150, test_loss: 0.9689, test_f1: 0.5034
 epoch: 16, train_loss: 1.0032, test_loss: 0.9838, test_f1: 0.4955
 epoch: 17, train_loss: 0.9896, test_loss: 0.9538, test_f1: 0.5170
 epoch: 18, train_loss: 0.9835, test_loss: 0.9540, test_f1: 0.5077
 epoch: 19, train_loss: 0.9763, test_loss: 0.9341, test_f1: 0.5071
 epoch: 20, train_loss: 0.9716, test_loss: 0.9604, test_f1: 0.5274
 epoch: 21, train_loss: 0.9598, test_loss: 0.9341, test_f1: 0.5138
 epoch: 22, train_loss: 0.9537, test_loss: 0.9380, test_f1: 0.5315
 epoch: 23, train_loss: 0.9489, test_loss: 0.9371, test_f1: 0.5488
 epoch: 24, train_loss: 0.9380, test_loss: 0.9340, test_f1: 0.5495
 epoch: 25, train_loss: 0.9309, test_loss: 0.9009, test_f1: 0.5293
 epoch: 26, train_loss: 0.9197, test_loss: 0.9038, test_f1: 0.5333
 epoch: 27, train_loss: 0.9287, test_loss: 0.9476, test_f1: 0.5303
 epoch: 28, train_loss: 0.9277, test_loss: 0.9577, test_f1: 0.5207
 epoch: 29, train_loss: 0.9286, test_loss: 0.9300, test_f1: 0.5485
 epoch: 30, train_loss: 0.9149, test_loss: 0.9303, test_f1: 0.5484
 epoch: 31, train_loss: 0.9114, test_loss: 0.9617, test_f1: 0.5007
 epoch: 32, train_loss: 0.9107, test_loss: 0.9555, test_f1: 0.5333
 epoch: 33, train_loss: 0.8900, test_loss: 0.9564, test_f1: 0.5356
 epoch: 34, train_loss: 0.8843, test_loss: 0.9508, test_f1: 0.5532
 epoch: 35, train_loss: 0.8849, test_loss: 0.9204, test_f1: 0.5498
 epoch: 36, train_loss: 0.8928, test_loss: 0.9407, test_f1: 0.5545
 epoch: 37, train_loss: 0.8813, test_loss: 0.9386, test_f1: 0.5550
 epoch: 38, train_loss: 0.8787, test_loss: 0.9247, test_f1: 0.5534
 epoch: 39, train_loss: 0.8957, test_loss: 0.9568, test_f1: 0.5402
 epoch: 40, train_loss: 0.8714, test_loss: 0.9357, test_f1: 0.5484
 epoch: 41, train_loss: 0.8800, test_loss: 0.9867, test_f1: 0.5115
 epoch: 42, train_loss: 0.8678, test_loss: 0.9675, test_f1: 0.5276
 epoch: 43, train_loss: 0.8658, test_loss: 0.9785, test_f1: 0.5230
 epoch: 44, train_loss: 0.8711, test_loss: 0.9480, test_f1: 0.5253
 epoch: 45, train_loss: 0.8570, test_loss: 0.9358, test_f1: 0.5328
 epoch: 46, train_loss: 0.8545, test_loss: 0.9484, test_f1: 0.5466
 epoch: 47, train_loss: 0.8504, test_loss: 0.9569, test_f1: 0.5384
 epoch: 48, train_loss: 0.8460, test_loss: 0.9569, test_f1: 0.5583
 epoch: 49, train_loss: 0.8572, test_loss: 0.9499, test_f1: 0.5612
 epoch: 50, train_loss: 0.8375, test_loss: 0.9513, test_f1: 0.5408
 epoch: 51, train_loss: 0.8325, test_loss: 0.9519, test_f1: 0.5515
 epoch: 52, train_loss: 0.8344, test_loss: 0.9552, test_f1: 0.5654
 epoch: 53, train_loss: 0.8325, test_loss: 0.9496, test_f1: 0.5652
 epoch: 54, train_loss: 0.8346, test_loss: 0.9476, test_f1: 0.5586
 epoch: 55, train_loss: 0.8388, test_loss: 0.9499, test_f1: 0.5439
 epoch: 56, train_loss: 0.8330, test_loss: 0.9454, test_f1: 0.5553
 epoch: 57, train_loss: 0.8342, test_loss: 0.9465, test_f1: 0.5400
 epoch: 58, train_loss: 0.8247, test_loss: 0.9435, test_f1: 0.5509
 epoch: 59, train_loss: 0.8211, test_loss: 0.9474, test_f1: 0.5405
 epoch: 60, train_loss: 0.8197, test_loss: 0.9479, test_f1: 0.5624
 epoch: 61, train_loss: 0.8258, test_loss: 0.9599, test_f1: 0.5325
 epoch: 62, train_loss: 0.8209, test_loss: 0.9463, test_f1: 0.5464
 epoch: 63, train_loss: 0.8151, test_loss: 0.9563, test_f1: 0.5530
 epoch: 64, train_loss: 0.8243, test_loss: 0.9629, test_f1: 0.5533
 epoch: 65, train_loss: 0.8220, test_loss: 0.9500, test_f1: 0.5543
 epoch: 66, train_loss: 0.8157, test_loss: 0.9599, test_f1: 0.5414
 epoch: 67, train_loss: 0.8108, test_loss: 0.9610, test_f1: 0.5452
 epoch: 68, train_loss: 0.8107, test_loss: 0.9435, test_f1: 0.5638
 epoch: 69, train_loss: 0.8226, test_loss: 0.9470, test_f1: 0.5615
 epoch: 70, train_loss: 0.8189, test_loss: 0.9547, test_f1: 0.5625
 epoch: 71, train_loss: 0.8114, test_loss: 0.9451, test_f1: 0.5465
 epoch: 72, train_loss: 0.8173, test_loss: 0.9606, test_f1: 0.5616
 epoch: 73, train_loss: 0.8055, test_loss: 0.9609, test_f1: 0.5608
 epoch: 74, train_loss: 0.8184, test_loss: 0.9554, test_f1: 0.5472
 epoch: 75, train_loss: 0.8121, test_loss: 0.9604, test_f1: 0.5484
 epoch: 76, train_loss: 0.8057, test_loss: 0.9524, test_f1: 0.5461
 epoch: 77, train_loss: 0.8024, test_loss: 0.9493, test_f1: 0.5549
 epoch: 78, train_loss: 0.8039, test_loss: 0.9647, test_f1: 0.5423
 epoch: 79, train_loss: 0.7981, test_loss: 0.9596, test_f1: 0.5589
 epoch: 80, train_loss: 0.7952, test_loss: 0.9699, test_f1: 0.5691
 epoch: 81, train_loss: 0.8036, test_loss: 0.9646, test_f1: 0.5567
 epoch: 82, train_loss: 0.8043, test_loss: 0.9728, test_f1: 0.5688
 epoch: 83, train_loss: 0.8050, test_loss: 0.9601, test_f1: 0.5684
 epoch: 84, train_loss: 0.8003, test_loss: 0.9610, test_f1: 0.5510
 epoch: 85, train_loss: 0.8021, test_loss: 0.9638, test_f1: 0.5484
 epoch: 86, train_loss: 0.8004, test_loss: 0.9517, test_f1: 0.5586
 epoch: 87, train_loss: 0.7987, test_loss: 0.9555, test_f1: 0.5635
 epoch: 88, train_loss: 0.7836, test_loss: 0.9618, test_f1: 0.5581
 epoch: 89, train_loss: 0.8064, test_loss: 0.9726, test_f1: 0.5698
 epoch: 90, train_loss: 0.8098, test_loss: 0.9650, test_f1: 0.5850
 epoch: 91, train_loss: 0.8005, test_loss: 0.9482, test_f1: 0.5701
 epoch: 92, train_loss: 0.7917, test_loss: 0.9684, test_f1: 0.5701
 epoch: 93, train_loss: 0.8020, test_loss: 0.9701, test_f1: 0.5480
 epoch: 94, train_loss: 0.7889, test_loss: 0.9586, test_f1: 0.5507
 epoch: 95, train_loss: 0.7863, test_loss: 0.9592, test_f1: 0.5775
 epoch: 96, train_loss: 0.7985, test_loss: 0.9637, test_f1: 0.5738
 epoch: 97, train_loss: 0.7922, test_loss: 0.9649, test_f1: 0.5450
 epoch: 98, train_loss: 0.7947, test_loss: 0.9793, test_f1: 0.5440
 epoch: 99, train_loss: 0.7838, test_loss: 0.9616, test_f1: 0.5564
##################ITERATION #5 ****************************************
 epoch: 0, train_loss: 1.3313, test_loss: 1.3425, test_f1: 0.2270
 epoch: 1, train_loss: 1.2093, test_loss: 1.3059, test_f1: 0.2270
 epoch: 2, train_loss: 1.1829, test_loss: 1.2441, test_f1: 0.2270
 epoch: 3, train_loss: 1.1469, test_loss: 1.1437, test_f1: 0.3596
 epoch: 4, train_loss: 1.1239, test_loss: 1.0950, test_f1: 0.4371
 epoch: 5, train_loss: 1.1024, test_loss: 1.0545, test_f1: 0.4403
 epoch: 6, train_loss: 1.0761, test_loss: 1.0278, test_f1: 0.4409
 epoch: 7, train_loss: 1.0619, test_loss: 1.0301, test_f1: 0.4451
 epoch: 8, train_loss: 1.0497, test_loss: 1.0072, test_f1: 0.4524
 epoch: 9, train_loss: 1.0418, test_loss: 1.0090, test_f1: 0.4523
 epoch: 10, train_loss: 1.0148, test_loss: 0.9945, test_f1: 0.4597
 epoch: 11, train_loss: 1.0172, test_loss: 0.9995, test_f1: 0.4503
 epoch: 12, train_loss: 1.0147, test_loss: 0.9966, test_f1: 0.4615
 epoch: 13, train_loss: 0.9997, test_loss: 1.0043, test_f1: 0.4707
 epoch: 14, train_loss: 0.9886, test_loss: 1.0009, test_f1: 0.4617
 epoch: 15, train_loss: 0.9938, test_loss: 0.9857, test_f1: 0.4722
 epoch: 16, train_loss: 0.9818, test_loss: 1.0038, test_f1: 0.4579
 epoch: 17, train_loss: 0.9819, test_loss: 0.9890, test_f1: 0.4827
 epoch: 18, train_loss: 0.9825, test_loss: 0.9912, test_f1: 0.4935
 epoch: 19, train_loss: 0.9819, test_loss: 0.9666, test_f1: 0.5054
 epoch: 20, train_loss: 0.9706, test_loss: 0.9997, test_f1: 0.4699
 epoch: 21, train_loss: 0.9596, test_loss: 0.9709, test_f1: 0.5092
 epoch: 22, train_loss: 0.9611, test_loss: 0.9843, test_f1: 0.5125
 epoch: 23, train_loss: 0.9454, test_loss: 0.9755, test_f1: 0.4899
 epoch: 24, train_loss: 0.9531, test_loss: 0.9756, test_f1: 0.5123
 epoch: 25, train_loss: 0.9437, test_loss: 0.9836, test_f1: 0.5074
 epoch: 26, train_loss: 0.9317, test_loss: 0.9737, test_f1: 0.5177
 epoch: 27, train_loss: 0.9473, test_loss: 0.9804, test_f1: 0.5215
 epoch: 28, train_loss: 0.9332, test_loss: 0.9739, test_f1: 0.5224
 epoch: 29, train_loss: 0.9300, test_loss: 0.9723, test_f1: 0.5186
 epoch: 30, train_loss: 0.9202, test_loss: 0.9889, test_f1: 0.5193
 epoch: 31, train_loss: 0.9219, test_loss: 0.9799, test_f1: 0.5240
 epoch: 32, train_loss: 0.9223, test_loss: 0.9775, test_f1: 0.5098
 epoch: 33, train_loss: 0.9160, test_loss: 0.9871, test_f1: 0.5177
 epoch: 34, train_loss: 0.9190, test_loss: 0.9915, test_f1: 0.5118
 epoch: 35, train_loss: 0.9042, test_loss: 0.9725, test_f1: 0.5325
 epoch: 36, train_loss: 0.9155, test_loss: 0.9687, test_f1: 0.5263
 epoch: 37, train_loss: 0.8979, test_loss: 0.9748, test_f1: 0.5258
 epoch: 38, train_loss: 0.9127, test_loss: 0.9810, test_f1: 0.5387
 epoch: 39, train_loss: 0.9092, test_loss: 0.9911, test_f1: 0.5225
 epoch: 40, train_loss: 0.9038, test_loss: 0.9953, test_f1: 0.5196
 epoch: 41, train_loss: 0.8960, test_loss: 0.9938, test_f1: 0.5169
 epoch: 42, train_loss: 0.9044, test_loss: 1.0093, test_f1: 0.5245
 epoch: 43, train_loss: 0.8938, test_loss: 0.9864, test_f1: 0.5230
 epoch: 44, train_loss: 0.8869, test_loss: 0.9874, test_f1: 0.5316
 epoch: 45, train_loss: 0.8778, test_loss: 0.9793, test_f1: 0.5354
 epoch: 46, train_loss: 0.8804, test_loss: 0.9711, test_f1: 0.5355
 epoch: 47, train_loss: 0.8859, test_loss: 0.9909, test_f1: 0.5285
 epoch: 48, train_loss: 0.8831, test_loss: 0.9974, test_f1: 0.5359
 epoch: 49, train_loss: 0.8872, test_loss: 0.9750, test_f1: 0.5381
 epoch: 50, train_loss: 0.8733, test_loss: 0.9801, test_f1: 0.5372
 epoch: 51, train_loss: 0.8664, test_loss: 1.0015, test_f1: 0.5323
 epoch: 52, train_loss: 0.8602, test_loss: 0.9772, test_f1: 0.5382
 epoch: 53, train_loss: 0.8666, test_loss: 0.9915, test_f1: 0.5308
 epoch: 54, train_loss: 0.8555, test_loss: 0.9853, test_f1: 0.5347
 epoch: 55, train_loss: 0.8668, test_loss: 0.9798, test_f1: 0.5345
 epoch: 56, train_loss: 0.8601, test_loss: 0.9860, test_f1: 0.5334
 epoch: 57, train_loss: 0.8462, test_loss: 0.9813, test_f1: 0.5363
 epoch: 58, train_loss: 0.8468, test_loss: 0.9775, test_f1: 0.5350
 epoch: 59, train_loss: 0.8530, test_loss: 0.9808, test_f1: 0.5407
 epoch: 60, train_loss: 0.8462, test_loss: 0.9879, test_f1: 0.5346
 epoch: 61, train_loss: 0.8634, test_loss: 0.9781, test_f1: 0.5338
 epoch: 62, train_loss: 0.8567, test_loss: 0.9899, test_f1: 0.5310
 epoch: 63, train_loss: 0.8571, test_loss: 0.9942, test_f1: 0.5333
 epoch: 64, train_loss: 0.8588, test_loss: 0.9946, test_f1: 0.5424
 epoch: 65, train_loss: 0.8431, test_loss: 0.9860, test_f1: 0.5362
 epoch: 66, train_loss: 0.8464, test_loss: 0.9865, test_f1: 0.5387
 epoch: 67, train_loss: 0.8454, test_loss: 1.0033, test_f1: 0.5382
 epoch: 68, train_loss: 0.8474, test_loss: 0.9924, test_f1: 0.5350
 epoch: 69, train_loss: 0.8401, test_loss: 1.0020, test_f1: 0.5340
 epoch: 70, train_loss: 0.8460, test_loss: 1.0001, test_f1: 0.5341
 epoch: 71, train_loss: 0.8390, test_loss: 1.0049, test_f1: 0.5311
 epoch: 72, train_loss: 0.8320, test_loss: 0.9834, test_f1: 0.5340
 epoch: 73, train_loss: 0.8308, test_loss: 1.0144, test_f1: 0.5389
 epoch: 74, train_loss: 0.8358, test_loss: 0.9962, test_f1: 0.5429
 epoch: 75, train_loss: 0.8372, test_loss: 1.0002, test_f1: 0.5237
 epoch: 76, train_loss: 0.8365, test_loss: 1.0043, test_f1: 0.5309
 epoch: 77, train_loss: 0.8353, test_loss: 0.9975, test_f1: 0.5440
 epoch: 78, train_loss: 0.8313, test_loss: 0.9899, test_f1: 0.5356
 epoch: 79, train_loss: 0.8422, test_loss: 1.0002, test_f1: 0.5252
 epoch: 80, train_loss: 0.8291, test_loss: 0.9977, test_f1: 0.5371
 epoch: 81, train_loss: 0.8395, test_loss: 0.9971, test_f1: 0.5355
 epoch: 82, train_loss: 0.8322, test_loss: 0.9866, test_f1: 0.5362
 epoch: 83, train_loss: 0.8179, test_loss: 1.0026, test_f1: 0.5382
 epoch: 84, train_loss: 0.8234, test_loss: 1.0072, test_f1: 0.5334
 epoch: 85, train_loss: 0.8309, test_loss: 1.0042, test_f1: 0.5323
 epoch: 86, train_loss: 0.8352, test_loss: 1.0058, test_f1: 0.5266
 epoch: 87, train_loss: 0.8242, test_loss: 1.0133, test_f1: 0.5383
 epoch: 88, train_loss: 0.8257, test_loss: 1.0055, test_f1: 0.5221
 epoch: 89, train_loss: 0.8253, test_loss: 0.9898, test_f1: 0.5314
 epoch: 90, train_loss: 0.8275, test_loss: 0.9912, test_f1: 0.5347
 epoch: 91, train_loss: 0.8230, test_loss: 1.0122, test_f1: 0.5211
 epoch: 92, train_loss: 0.8185, test_loss: 1.0089, test_f1: 0.5256
 epoch: 93, train_loss: 0.8115, test_loss: 1.0150, test_f1: 0.5366
 epoch: 94, train_loss: 0.8279, test_loss: 1.0031, test_f1: 0.5325
 epoch: 95, train_loss: 0.8204, test_loss: 1.0012, test_f1: 0.5429
 epoch: 96, train_loss: 0.8127, test_loss: 0.9909, test_f1: 0.5388
 epoch: 97, train_loss: 0.8178, test_loss: 1.0072, test_f1: 0.5335
 epoch: 98, train_loss: 0.8114, test_loss: 1.0100, test_f1: 0.5300
 epoch: 99, train_loss: 0.8219, test_loss: 1.0031, test_f1: 0.5330
##################ITERATION #6 ****************************************
 epoch: 0, train_loss: 1.3943, test_loss: 1.3035, test_f1: 0.2270
 epoch: 1, train_loss: 1.2397, test_loss: 1.2798, test_f1: 0.2270
 epoch: 2, train_loss: 1.2041, test_loss: 1.2292, test_f1: 0.2444
 epoch: 3, train_loss: 1.1638, test_loss: 1.1661, test_f1: 0.2844
 epoch: 4, train_loss: 1.1424, test_loss: 1.1053, test_f1: 0.3892
 epoch: 5, train_loss: 1.1207, test_loss: 1.0569, test_f1: 0.4301
 epoch: 6, train_loss: 1.0947, test_loss: 1.0208, test_f1: 0.4589
 epoch: 7, train_loss: 1.0917, test_loss: 1.0086, test_f1: 0.4778
 epoch: 8, train_loss: 1.0542, test_loss: 0.9913, test_f1: 0.4646
 epoch: 9, train_loss: 1.0476, test_loss: 0.9778, test_f1: 0.4579
 epoch: 10, train_loss: 1.0373, test_loss: 0.9765, test_f1: 0.4643
 epoch: 11, train_loss: 1.0165, test_loss: 0.9662, test_f1: 0.4945
 epoch: 12, train_loss: 1.0007, test_loss: 0.9660, test_f1: 0.4833
 epoch: 13, train_loss: 1.0039, test_loss: 0.9752, test_f1: 0.4702
 epoch: 14, train_loss: 0.9975, test_loss: 0.9559, test_f1: 0.4995
 epoch: 15, train_loss: 0.9877, test_loss: 0.9444, test_f1: 0.5007
 epoch: 16, train_loss: 0.9739, test_loss: 0.9416, test_f1: 0.5090
 epoch: 17, train_loss: 0.9657, test_loss: 0.9339, test_f1: 0.5105
 epoch: 18, train_loss: 0.9698, test_loss: 0.9428, test_f1: 0.4954
 epoch: 19, train_loss: 0.9653, test_loss: 0.9248, test_f1: 0.5116
 epoch: 20, train_loss: 0.9567, test_loss: 0.9432, test_f1: 0.4991
 epoch: 21, train_loss: 0.9580, test_loss: 0.9526, test_f1: 0.5080
 epoch: 22, train_loss: 0.9556, test_loss: 0.9506, test_f1: 0.4896
 epoch: 23, train_loss: 0.9361, test_loss: 0.9665, test_f1: 0.4785
 epoch: 24, train_loss: 0.9470, test_loss: 0.9252, test_f1: 0.4950
 epoch: 25, train_loss: 0.9367, test_loss: 0.9442, test_f1: 0.4949
 epoch: 26, train_loss: 0.9367, test_loss: 0.9549, test_f1: 0.5100
 epoch: 27, train_loss: 0.9291, test_loss: 0.9448, test_f1: 0.5136
 epoch: 28, train_loss: 0.9380, test_loss: 0.9439, test_f1: 0.4974
 epoch: 29, train_loss: 0.9269, test_loss: 0.9402, test_f1: 0.5047
 epoch: 30, train_loss: 0.9154, test_loss: 0.9440, test_f1: 0.5138
 epoch: 31, train_loss: 0.9189, test_loss: 0.9327, test_f1: 0.5020
 epoch: 32, train_loss: 0.9126, test_loss: 0.9492, test_f1: 0.5079
 epoch: 33, train_loss: 0.9141, test_loss: 0.9573, test_f1: 0.4898
 epoch: 34, train_loss: 0.9132, test_loss: 0.9351, test_f1: 0.5140
 epoch: 35, train_loss: 0.9012, test_loss: 0.9442, test_f1: 0.5047
 epoch: 36, train_loss: 0.9041, test_loss: 0.9429, test_f1: 0.5095
 epoch: 37, train_loss: 0.9018, test_loss: 0.9514, test_f1: 0.4966
 epoch: 38, train_loss: 0.8983, test_loss: 0.9677, test_f1: 0.4903
 epoch: 39, train_loss: 0.9014, test_loss: 0.9475, test_f1: 0.5117
 epoch: 40, train_loss: 0.8990, test_loss: 0.9440, test_f1: 0.5085
 epoch: 41, train_loss: 0.8904, test_loss: 0.9589, test_f1: 0.4851
 epoch: 42, train_loss: 0.9013, test_loss: 0.9625, test_f1: 0.5021
 epoch: 43, train_loss: 0.8904, test_loss: 0.9535, test_f1: 0.4938
 epoch: 44, train_loss: 0.8945, test_loss: 0.9394, test_f1: 0.5109
 epoch: 45, train_loss: 0.8822, test_loss: 0.9546, test_f1: 0.4965
 epoch: 46, train_loss: 0.8783, test_loss: 0.9561, test_f1: 0.4889
 epoch: 47, train_loss: 0.8743, test_loss: 0.9524, test_f1: 0.5070
 epoch: 48, train_loss: 0.8876, test_loss: 0.9580, test_f1: 0.4965
 epoch: 49, train_loss: 0.8849, test_loss: 0.9858, test_f1: 0.5046
 epoch: 50, train_loss: 0.8900, test_loss: 0.9556, test_f1: 0.4904
 epoch: 51, train_loss: 0.8730, test_loss: 0.9678, test_f1: 0.4946
 epoch: 52, train_loss: 0.8854, test_loss: 0.9531, test_f1: 0.4931
 epoch: 53, train_loss: 0.8565, test_loss: 0.9549, test_f1: 0.5035
 epoch: 54, train_loss: 0.8637, test_loss: 0.9743, test_f1: 0.4858
 epoch: 55, train_loss: 0.8721, test_loss: 0.9599, test_f1: 0.5003
 epoch: 56, train_loss: 0.8707, test_loss: 0.9557, test_f1: 0.4971
 epoch: 57, train_loss: 0.8662, test_loss: 0.9691, test_f1: 0.4876
 epoch: 58, train_loss: 0.8572, test_loss: 0.9719, test_f1: 0.4915
 epoch: 59, train_loss: 0.8594, test_loss: 0.9619, test_f1: 0.4931
 epoch: 60, train_loss: 0.8488, test_loss: 0.9591, test_f1: 0.4986
 epoch: 61, train_loss: 0.8528, test_loss: 0.9663, test_f1: 0.4904
 epoch: 62, train_loss: 0.8533, test_loss: 0.9748, test_f1: 0.4924
 epoch: 63, train_loss: 0.8477, test_loss: 0.9763, test_f1: 0.4977
 epoch: 64, train_loss: 0.8503, test_loss: 0.9814, test_f1: 0.4985
 epoch: 65, train_loss: 0.8487, test_loss: 0.9655, test_f1: 0.5110
 epoch: 66, train_loss: 0.8661, test_loss: 0.9676, test_f1: 0.4997
 epoch: 67, train_loss: 0.8560, test_loss: 0.9800, test_f1: 0.4963
 epoch: 68, train_loss: 0.8516, test_loss: 0.9743, test_f1: 0.5009
 epoch: 69, train_loss: 0.8470, test_loss: 0.9629, test_f1: 0.4965
 epoch: 70, train_loss: 0.8521, test_loss: 0.9733, test_f1: 0.5017
 epoch: 71, train_loss: 0.8422, test_loss: 0.9817, test_f1: 0.4865
 epoch: 72, train_loss: 0.8477, test_loss: 0.9546, test_f1: 0.4934
 epoch: 73, train_loss: 0.8510, test_loss: 0.9669, test_f1: 0.4901
 epoch: 74, train_loss: 0.8354, test_loss: 0.9842, test_f1: 0.4853
 epoch: 75, train_loss: 0.8381, test_loss: 0.9877, test_f1: 0.4853
 epoch: 76, train_loss: 0.8352, test_loss: 0.9725, test_f1: 0.4965
 epoch: 77, train_loss: 0.8402, test_loss: 0.9746, test_f1: 0.4952
 epoch: 78, train_loss: 0.8447, test_loss: 0.9752, test_f1: 0.4917
 epoch: 79, train_loss: 0.8309, test_loss: 0.9567, test_f1: 0.5003
 epoch: 80, train_loss: 0.8378, test_loss: 0.9675, test_f1: 0.4934
 epoch: 81, train_loss: 0.8298, test_loss: 0.9654, test_f1: 0.4924
 epoch: 82, train_loss: 0.8419, test_loss: 0.9754, test_f1: 0.4986
 epoch: 83, train_loss: 0.8374, test_loss: 0.9642, test_f1: 0.5044
 epoch: 84, train_loss: 0.8350, test_loss: 0.9876, test_f1: 0.4918
 epoch: 85, train_loss: 0.8343, test_loss: 0.9934, test_f1: 0.4935
 epoch: 86, train_loss: 0.8354, test_loss: 1.0004, test_f1: 0.4955
 epoch: 87, train_loss: 0.8282, test_loss: 0.9719, test_f1: 0.5041
 epoch: 88, train_loss: 0.8252, test_loss: 0.9837, test_f1: 0.4905
 epoch: 89, train_loss: 0.8178, test_loss: 0.9826, test_f1: 0.5042
 epoch: 90, train_loss: 0.8185, test_loss: 0.9769, test_f1: 0.5059
 epoch: 91, train_loss: 0.8171, test_loss: 0.9884, test_f1: 0.4984
 epoch: 92, train_loss: 0.8196, test_loss: 1.0020, test_f1: 0.4964
 epoch: 93, train_loss: 0.8176, test_loss: 0.9873, test_f1: 0.5104
 epoch: 94, train_loss: 0.8279, test_loss: 0.9801, test_f1: 0.4904
 epoch: 95, train_loss: 0.8247, test_loss: 0.9846, test_f1: 0.4974
 epoch: 96, train_loss: 0.8192, test_loss: 0.9724, test_f1: 0.5099
 epoch: 97, train_loss: 0.8170, test_loss: 0.9691, test_f1: 0.5123
 epoch: 98, train_loss: 0.8187, test_loss: 0.9912, test_f1: 0.4919
 epoch: 99, train_loss: 0.8273, test_loss: 1.0204, test_f1: 0.4935
##################ITERATION #7 ****************************************
 epoch: 0, train_loss: 1.3884, test_loss: 1.3394, test_f1: 0.2270
 epoch: 1, train_loss: 1.2520, test_loss: 1.3118, test_f1: 0.2270
 epoch: 2, train_loss: 1.2096, test_loss: 1.2103, test_f1: 0.3097
 epoch: 3, train_loss: 1.1844, test_loss: 1.1244, test_f1: 0.3328
 epoch: 4, train_loss: 1.1527, test_loss: 1.0875, test_f1: 0.4147
 epoch: 5, train_loss: 1.1399, test_loss: 1.0625, test_f1: 0.4012
 epoch: 6, train_loss: 1.1093, test_loss: 1.0408, test_f1: 0.4276
 epoch: 7, train_loss: 1.1081, test_loss: 1.0314, test_f1: 0.4180
 epoch: 8, train_loss: 1.0866, test_loss: 1.0294, test_f1: 0.4310
 epoch: 9, train_loss: 1.0702, test_loss: 1.0232, test_f1: 0.4523
 epoch: 10, train_loss: 1.0531, test_loss: 1.0121, test_f1: 0.4290
 epoch: 11, train_loss: 1.0360, test_loss: 0.9861, test_f1: 0.4490
 epoch: 12, train_loss: 1.0251, test_loss: 0.9969, test_f1: 0.4516
 epoch: 13, train_loss: 1.0085, test_loss: 0.9898, test_f1: 0.4565
 epoch: 14, train_loss: 1.0011, test_loss: 0.9776, test_f1: 0.4676
 epoch: 15, train_loss: 1.0022, test_loss: 0.9619, test_f1: 0.4606
 epoch: 16, train_loss: 0.9801, test_loss: 0.9624, test_f1: 0.4587
 epoch: 17, train_loss: 0.9853, test_loss: 0.9623, test_f1: 0.4558
 epoch: 18, train_loss: 0.9788, test_loss: 0.9731, test_f1: 0.4812
 epoch: 19, train_loss: 0.9715, test_loss: 0.9704, test_f1: 0.4543
 epoch: 20, train_loss: 0.9538, test_loss: 0.9468, test_f1: 0.4639
 epoch: 21, train_loss: 0.9612, test_loss: 0.9632, test_f1: 0.4580
 epoch: 22, train_loss: 0.9449, test_loss: 0.9491, test_f1: 0.4811
 epoch: 23, train_loss: 0.9402, test_loss: 0.9605, test_f1: 0.4843
 epoch: 24, train_loss: 0.9383, test_loss: 0.9484, test_f1: 0.4698
 epoch: 25, train_loss: 0.9332, test_loss: 0.9793, test_f1: 0.4728
 epoch: 26, train_loss: 0.9308, test_loss: 0.9366, test_f1: 0.4817
 epoch: 27, train_loss: 0.9200, test_loss: 0.9324, test_f1: 0.4960
 epoch: 28, train_loss: 0.9281, test_loss: 1.0048, test_f1: 0.4831
 epoch: 29, train_loss: 0.9086, test_loss: 0.9726, test_f1: 0.4766
 epoch: 30, train_loss: 0.9101, test_loss: 0.9516, test_f1: 0.5052
 epoch: 31, train_loss: 0.8973, test_loss: 0.9359, test_f1: 0.5042
 epoch: 32, train_loss: 0.9097, test_loss: 0.9553, test_f1: 0.4965
 epoch: 33, train_loss: 0.8978, test_loss: 0.9627, test_f1: 0.4976
 epoch: 34, train_loss: 0.8909, test_loss: 0.9628, test_f1: 0.4952
 epoch: 35, train_loss: 0.8967, test_loss: 0.9700, test_f1: 0.5009
 epoch: 36, train_loss: 0.8916, test_loss: 0.9819, test_f1: 0.4982
 epoch: 37, train_loss: 0.8976, test_loss: 0.9308, test_f1: 0.5073
 epoch: 38, train_loss: 0.8942, test_loss: 0.9805, test_f1: 0.5255
 epoch: 39, train_loss: 0.8850, test_loss: 0.9489, test_f1: 0.5165
 epoch: 40, train_loss: 0.8833, test_loss: 0.9813, test_f1: 0.4956
 epoch: 41, train_loss: 0.8943, test_loss: 0.9560, test_f1: 0.5082
 epoch: 42, train_loss: 0.8820, test_loss: 0.9635, test_f1: 0.5071
 epoch: 43, train_loss: 0.8883, test_loss: 0.9574, test_f1: 0.5358
 epoch: 44, train_loss: 0.8774, test_loss: 0.9571, test_f1: 0.5288
 epoch: 45, train_loss: 0.8617, test_loss: 0.9254, test_f1: 0.5294
 epoch: 46, train_loss: 0.8684, test_loss: 0.9877, test_f1: 0.5030
 epoch: 47, train_loss: 0.8699, test_loss: 0.9665, test_f1: 0.5191
 epoch: 48, train_loss: 0.8669, test_loss: 0.9666, test_f1: 0.5393
 epoch: 49, train_loss: 0.8588, test_loss: 0.9332, test_f1: 0.5464
 epoch: 50, train_loss: 0.8511, test_loss: 0.9541, test_f1: 0.5235
 epoch: 51, train_loss: 0.8464, test_loss: 0.9362, test_f1: 0.5362
 epoch: 52, train_loss: 0.8394, test_loss: 0.9522, test_f1: 0.5442
 epoch: 53, train_loss: 0.8466, test_loss: 0.9575, test_f1: 0.5311
 epoch: 54, train_loss: 0.8262, test_loss: 0.9421, test_f1: 0.5340
 epoch: 55, train_loss: 0.8490, test_loss: 0.9449, test_f1: 0.5425
 epoch: 56, train_loss: 0.8402, test_loss: 0.9417, test_f1: 0.5405
 epoch: 57, train_loss: 0.8413, test_loss: 0.9576, test_f1: 0.5295
 epoch: 58, train_loss: 0.8235, test_loss: 0.9550, test_f1: 0.5164
 epoch: 59, train_loss: 0.8375, test_loss: 0.9786, test_f1: 0.5136
 epoch: 60, train_loss: 0.8202, test_loss: 0.9580, test_f1: 0.5352
 epoch: 61, train_loss: 0.8270, test_loss: 0.9611, test_f1: 0.5424
 epoch: 62, train_loss: 0.8314, test_loss: 0.9616, test_f1: 0.5406
 epoch: 63, train_loss: 0.8256, test_loss: 0.9523, test_f1: 0.5412
 epoch: 64, train_loss: 0.8334, test_loss: 0.9580, test_f1: 0.5395
 epoch: 65, train_loss: 0.8293, test_loss: 0.9593, test_f1: 0.5339
 epoch: 66, train_loss: 0.8201, test_loss: 0.9571, test_f1: 0.5251
 epoch: 67, train_loss: 0.8185, test_loss: 0.9565, test_f1: 0.5458
 epoch: 68, train_loss: 0.8173, test_loss: 0.9656, test_f1: 0.5333
 epoch: 69, train_loss: 0.8139, test_loss: 0.9539, test_f1: 0.5250
 epoch: 70, train_loss: 0.8194, test_loss: 0.9827, test_f1: 0.5489
 epoch: 71, train_loss: 0.8131, test_loss: 0.9900, test_f1: 0.5309
 epoch: 72, train_loss: 0.8078, test_loss: 0.9544, test_f1: 0.5307
 epoch: 73, train_loss: 0.8115, test_loss: 0.9514, test_f1: 0.5340
 epoch: 74, train_loss: 0.8069, test_loss: 0.9673, test_f1: 0.5413
 epoch: 75, train_loss: 0.8109, test_loss: 0.9668, test_f1: 0.5477
 epoch: 76, train_loss: 0.8229, test_loss: 0.9566, test_f1: 0.5185
 epoch: 77, train_loss: 0.8051, test_loss: 0.9595, test_f1: 0.5358
 epoch: 78, train_loss: 0.8064, test_loss: 0.9709, test_f1: 0.5250
 epoch: 79, train_loss: 0.8130, test_loss: 0.9572, test_f1: 0.5381
 epoch: 80, train_loss: 0.8088, test_loss: 0.9711, test_f1: 0.5444
 epoch: 81, train_loss: 0.8046, test_loss: 0.9621, test_f1: 0.5339
 epoch: 82, train_loss: 0.8048, test_loss: 0.9653, test_f1: 0.5359
 epoch: 83, train_loss: 0.8014, test_loss: 0.9730, test_f1: 0.5371
 epoch: 84, train_loss: 0.7989, test_loss: 0.9600, test_f1: 0.5493
 epoch: 85, train_loss: 0.7806, test_loss: 0.9578, test_f1: 0.5528
 epoch: 86, train_loss: 0.7969, test_loss: 0.9636, test_f1: 0.5275
 epoch: 87, train_loss: 0.7903, test_loss: 0.9788, test_f1: 0.5380
 epoch: 88, train_loss: 0.7771, test_loss: 0.9620, test_f1: 0.5425
 epoch: 89, train_loss: 0.7934, test_loss: 0.9676, test_f1: 0.5472
 epoch: 90, train_loss: 0.7947, test_loss: 0.9688, test_f1: 0.5431
 epoch: 91, train_loss: 0.8037, test_loss: 0.9539, test_f1: 0.5540
 epoch: 92, train_loss: 0.7869, test_loss: 0.9836, test_f1: 0.5371
 epoch: 93, train_loss: 0.7905, test_loss: 0.9554, test_f1: 0.5418
 epoch: 94, train_loss: 0.7907, test_loss: 0.9696, test_f1: 0.5361
 epoch: 95, train_loss: 0.7848, test_loss: 0.9674, test_f1: 0.5463
 epoch: 96, train_loss: 0.7957, test_loss: 0.9697, test_f1: 0.5442
 epoch: 97, train_loss: 0.7814, test_loss: 0.9708, test_f1: 0.5627
 epoch: 98, train_loss: 0.7753, test_loss: 0.9708, test_f1: 0.5397
 epoch: 99, train_loss: 0.7725, test_loss: 0.9706, test_f1: 0.5465
##################ITERATION #8 ****************************************
 epoch: 0, train_loss: 1.6627, test_loss: 1.4721, test_f1: 0.2270
 epoch: 1, train_loss: 1.3300, test_loss: 1.3915, test_f1: 0.2270
 epoch: 2, train_loss: 1.2494, test_loss: 1.3050, test_f1: 0.2709
 epoch: 3, train_loss: 1.2162, test_loss: 1.2550, test_f1: 0.2807
 epoch: 4, train_loss: 1.1982, test_loss: 1.2005, test_f1: 0.3372
 epoch: 5, train_loss: 1.1691, test_loss: 1.1148, test_f1: 0.4210
 epoch: 6, train_loss: 1.1503, test_loss: 1.0936, test_f1: 0.4427
 epoch: 7, train_loss: 1.1371, test_loss: 1.0706, test_f1: 0.4539
 epoch: 8, train_loss: 1.1202, test_loss: 1.0506, test_f1: 0.4681
 epoch: 9, train_loss: 1.1066, test_loss: 1.0418, test_f1: 0.4554
 epoch: 10, train_loss: 1.0950, test_loss: 1.0244, test_f1: 0.4702
 epoch: 11, train_loss: 1.0763, test_loss: 1.0216, test_f1: 0.4638
 epoch: 12, train_loss: 1.0668, test_loss: 1.0121, test_f1: 0.4679
 epoch: 13, train_loss: 1.0566, test_loss: 1.0084, test_f1: 0.4680
 epoch: 14, train_loss: 1.0488, test_loss: 1.0044, test_f1: 0.4590
 epoch: 15, train_loss: 1.0394, test_loss: 1.0168, test_f1: 0.4544
 epoch: 16, train_loss: 1.0304, test_loss: 0.9863, test_f1: 0.4704
 epoch: 17, train_loss: 1.0248, test_loss: 0.9931, test_f1: 0.4561
 epoch: 18, train_loss: 1.0187, test_loss: 1.0015, test_f1: 0.4504
 epoch: 19, train_loss: 1.0109, test_loss: 0.9868, test_f1: 0.4644
 epoch: 20, train_loss: 1.0048, test_loss: 1.0054, test_f1: 0.4575
 epoch: 21, train_loss: 0.9984, test_loss: 0.9914, test_f1: 0.4668
 epoch: 22, train_loss: 0.9948, test_loss: 0.9802, test_f1: 0.4627
 epoch: 23, train_loss: 0.9766, test_loss: 0.9950, test_f1: 0.4525
 epoch: 24, train_loss: 0.9869, test_loss: 0.9877, test_f1: 0.4601
 epoch: 25, train_loss: 0.9814, test_loss: 0.9804, test_f1: 0.4871
 epoch: 26, train_loss: 0.9671, test_loss: 0.9669, test_f1: 0.4783
 epoch: 27, train_loss: 0.9610, test_loss: 0.9626, test_f1: 0.5027
 epoch: 28, train_loss: 0.9641, test_loss: 0.9788, test_f1: 0.5156
 epoch: 29, train_loss: 0.9529, test_loss: 0.9462, test_f1: 0.5000
 epoch: 30, train_loss: 0.9581, test_loss: 0.9986, test_f1: 0.4927
 epoch: 31, train_loss: 0.9515, test_loss: 0.9478, test_f1: 0.4841
 epoch: 32, train_loss: 0.9520, test_loss: 0.9626, test_f1: 0.4744
 epoch: 33, train_loss: 0.9470, test_loss: 0.9670, test_f1: 0.4705
 epoch: 34, train_loss: 0.9536, test_loss: 0.9457, test_f1: 0.5279
 epoch: 35, train_loss: 0.9446, test_loss: 0.9698, test_f1: 0.4788
 epoch: 36, train_loss: 0.9381, test_loss: 0.9594, test_f1: 0.4751
 epoch: 37, train_loss: 0.9337, test_loss: 0.9652, test_f1: 0.4865
 epoch: 38, train_loss: 0.9411, test_loss: 0.9745, test_f1: 0.5007
 epoch: 39, train_loss: 0.9340, test_loss: 0.9542, test_f1: 0.5058
 epoch: 40, train_loss: 0.9278, test_loss: 0.9748, test_f1: 0.5137
 epoch: 41, train_loss: 0.9306, test_loss: 0.9782, test_f1: 0.5111
 epoch: 42, train_loss: 0.9414, test_loss: 0.9688, test_f1: 0.5041
 epoch: 43, train_loss: 0.9248, test_loss: 0.9882, test_f1: 0.4931
 epoch: 44, train_loss: 0.9240, test_loss: 1.0173, test_f1: 0.5053
 epoch: 45, train_loss: 0.9184, test_loss: 0.9468, test_f1: 0.5336
 epoch: 46, train_loss: 0.9210, test_loss: 0.9677, test_f1: 0.5288
 epoch: 47, train_loss: 0.9101, test_loss: 0.9477, test_f1: 0.5406
 epoch: 48, train_loss: 0.9068, test_loss: 0.9709, test_f1: 0.5556
 epoch: 49, train_loss: 0.9162, test_loss: 0.9669, test_f1: 0.5270
 epoch: 50, train_loss: 0.8981, test_loss: 0.9860, test_f1: 0.5533
 epoch: 51, train_loss: 0.8930, test_loss: 0.9820, test_f1: 0.5449
 epoch: 52, train_loss: 0.8901, test_loss: 0.9714, test_f1: 0.5435
 epoch: 53, train_loss: 0.8900, test_loss: 0.9746, test_f1: 0.5422
 epoch: 54, train_loss: 0.8853, test_loss: 1.0010, test_f1: 0.5170
 epoch: 55, train_loss: 0.9004, test_loss: 0.9883, test_f1: 0.5303
 epoch: 56, train_loss: 0.8854, test_loss: 0.9796, test_f1: 0.5338
 epoch: 57, train_loss: 0.8855, test_loss: 0.9767, test_f1: 0.5191
 epoch: 58, train_loss: 0.8869, test_loss: 0.9854, test_f1: 0.5095
 epoch: 59, train_loss: 0.8847, test_loss: 0.9753, test_f1: 0.5365
 epoch: 60, train_loss: 0.8819, test_loss: 0.9718, test_f1: 0.5293
 epoch: 61, train_loss: 0.8823, test_loss: 0.9759, test_f1: 0.5128
 epoch: 62, train_loss: 0.8824, test_loss: 0.9715, test_f1: 0.5249
 epoch: 63, train_loss: 0.8785, test_loss: 0.9802, test_f1: 0.5212
 epoch: 64, train_loss: 0.8822, test_loss: 0.9835, test_f1: 0.5117
 epoch: 65, train_loss: 0.8851, test_loss: 0.9868, test_f1: 0.5269
 epoch: 66, train_loss: 0.8744, test_loss: 0.9742, test_f1: 0.5459
 epoch: 67, train_loss: 0.8715, test_loss: 0.9599, test_f1: 0.5217
 epoch: 68, train_loss: 0.8686, test_loss: 0.9598, test_f1: 0.5293
 epoch: 69, train_loss: 0.8678, test_loss: 0.9654, test_f1: 0.5198
 epoch: 70, train_loss: 0.8651, test_loss: 0.9599, test_f1: 0.5399
 epoch: 71, train_loss: 0.8772, test_loss: 0.9896, test_f1: 0.5346
 epoch: 72, train_loss: 0.8681, test_loss: 0.9690, test_f1: 0.5273
 epoch: 73, train_loss: 0.8664, test_loss: 0.9684, test_f1: 0.5470
 epoch: 74, train_loss: 0.8612, test_loss: 0.9727, test_f1: 0.5276
 epoch: 75, train_loss: 0.8604, test_loss: 0.9632, test_f1: 0.5241
 epoch: 76, train_loss: 0.8569, test_loss: 0.9705, test_f1: 0.5194
 epoch: 77, train_loss: 0.8614, test_loss: 0.9565, test_f1: 0.5277
 epoch: 78, train_loss: 0.8712, test_loss: 0.9564, test_f1: 0.5351
 epoch: 79, train_loss: 0.8635, test_loss: 0.9963, test_f1: 0.5207
 epoch: 80, train_loss: 0.8532, test_loss: 0.9939, test_f1: 0.5282
 epoch: 81, train_loss: 0.8639, test_loss: 0.9731, test_f1: 0.5418
 epoch: 82, train_loss: 0.8602, test_loss: 0.9633, test_f1: 0.5633
 epoch: 83, train_loss: 0.8608, test_loss: 0.9691, test_f1: 0.5363
 epoch: 84, train_loss: 0.8545, test_loss: 0.9699, test_f1: 0.5417
 epoch: 85, train_loss: 0.8514, test_loss: 0.9686, test_f1: 0.5270
 epoch: 86, train_loss: 0.8522, test_loss: 0.9940, test_f1: 0.5325
 epoch: 87, train_loss: 0.8598, test_loss: 0.9598, test_f1: 0.5450
 epoch: 88, train_loss: 0.8514, test_loss: 0.9679, test_f1: 0.5531
 epoch: 89, train_loss: 0.8545, test_loss: 0.9699, test_f1: 0.5492
 epoch: 90, train_loss: 0.8545, test_loss: 0.9757, test_f1: 0.5382
 epoch: 91, train_loss: 0.8515, test_loss: 0.9964, test_f1: 0.5414
 epoch: 92, train_loss: 0.8438, test_loss: 0.9761, test_f1: 0.5433
 epoch: 93, train_loss: 0.8496, test_loss: 0.9934, test_f1: 0.5412
 epoch: 94, train_loss: 0.8388, test_loss: 0.9590, test_f1: 0.5491
 epoch: 95, train_loss: 0.8332, test_loss: 0.9737, test_f1: 0.5441
 epoch: 96, train_loss: 0.8407, test_loss: 0.9714, test_f1: 0.5453
 epoch: 97, train_loss: 0.8300, test_loss: 0.9567, test_f1: 0.5691
 epoch: 98, train_loss: 0.8447, test_loss: 0.9695, test_f1: 0.5559
 epoch: 99, train_loss: 0.8469, test_loss: 0.9952, test_f1: 0.5431
##################ITERATION #9 ****************************************
 epoch: 0, train_loss: 1.4784, test_loss: 1.3272, test_f1: 0.2270
 epoch: 1, train_loss: 1.2622, test_loss: 1.3513, test_f1: 0.2270
 epoch: 2, train_loss: 1.2246, test_loss: 1.3503, test_f1: 0.2622
 epoch: 3, train_loss: 1.1999, test_loss: 1.2760, test_f1: 0.3468
 epoch: 4, train_loss: 1.1809, test_loss: 1.1229, test_f1: 0.4302
 epoch: 5, train_loss: 1.1566, test_loss: 1.0784, test_f1: 0.4335
 epoch: 6, train_loss: 1.1382, test_loss: 1.0585, test_f1: 0.4495
 epoch: 7, train_loss: 1.1108, test_loss: 1.0341, test_f1: 0.4578
 epoch: 8, train_loss: 1.1050, test_loss: 1.0190, test_f1: 0.4563
 epoch: 9, train_loss: 1.0932, test_loss: 1.0241, test_f1: 0.4450
 epoch: 10, train_loss: 1.0727, test_loss: 1.0092, test_f1: 0.4451
 epoch: 11, train_loss: 1.0640, test_loss: 0.9983, test_f1: 0.4503
 epoch: 12, train_loss: 1.0632, test_loss: 0.9904, test_f1: 0.4657
 epoch: 13, train_loss: 1.0507, test_loss: 0.9687, test_f1: 0.4651
 epoch: 14, train_loss: 1.0348, test_loss: 0.9836, test_f1: 0.4608
 epoch: 15, train_loss: 1.0156, test_loss: 0.9714, test_f1: 0.4664
 epoch: 16, train_loss: 1.0119, test_loss: 0.9988, test_f1: 0.4549
 epoch: 17, train_loss: 1.0069, test_loss: 0.9543, test_f1: 0.4518
 epoch: 18, train_loss: 1.0084, test_loss: 0.9492, test_f1: 0.4556
 epoch: 19, train_loss: 1.0023, test_loss: 0.9952, test_f1: 0.4705
 epoch: 20, train_loss: 0.9846, test_loss: 0.9910, test_f1: 0.4705
 epoch: 21, train_loss: 0.9904, test_loss: 0.9799, test_f1: 0.4759
 epoch: 22, train_loss: 0.9890, test_loss: 0.9778, test_f1: 0.4820
 epoch: 23, train_loss: 0.9739, test_loss: 1.0289, test_f1: 0.4755
 epoch: 24, train_loss: 0.9647, test_loss: 1.0089, test_f1: 0.4786
 epoch: 25, train_loss: 0.9677, test_loss: 0.9963, test_f1: 0.4849
 epoch: 26, train_loss: 0.9677, test_loss: 0.9935, test_f1: 0.4825
 epoch: 27, train_loss: 0.9698, test_loss: 0.9659, test_f1: 0.4927
 epoch: 28, train_loss: 0.9625, test_loss: 0.9413, test_f1: 0.4932
 epoch: 29, train_loss: 0.9552, test_loss: 0.9899, test_f1: 0.4871
 epoch: 30, train_loss: 0.9589, test_loss: 1.0270, test_f1: 0.4951
 epoch: 31, train_loss: 0.9460, test_loss: 1.0053, test_f1: 0.5011
 epoch: 32, train_loss: 0.9349, test_loss: 1.0024, test_f1: 0.5108
 epoch: 33, train_loss: 0.9445, test_loss: 1.0093, test_f1: 0.5265
 epoch: 34, train_loss: 0.9383, test_loss: 0.9690, test_f1: 0.5322
 epoch: 35, train_loss: 0.9307, test_loss: 0.9925, test_f1: 0.5221
 epoch: 36, train_loss: 0.9270, test_loss: 1.0059, test_f1: 0.5215
 epoch: 37, train_loss: 0.9134, test_loss: 0.9761, test_f1: 0.5312
 epoch: 38, train_loss: 0.9207, test_loss: 0.9981, test_f1: 0.5119
 epoch: 39, train_loss: 0.9240, test_loss: 0.9781, test_f1: 0.5282
 epoch: 40, train_loss: 0.9133, test_loss: 0.9814, test_f1: 0.5212
 epoch: 41, train_loss: 0.9125, test_loss: 0.9705, test_f1: 0.5269
 epoch: 42, train_loss: 0.9079, test_loss: 0.9654, test_f1: 0.5154
 epoch: 43, train_loss: 0.9227, test_loss: 0.9623, test_f1: 0.5318
 epoch: 44, train_loss: 0.9050, test_loss: 0.9374, test_f1: 0.5191
 epoch: 45, train_loss: 0.8904, test_loss: 0.9996, test_f1: 0.5093
 epoch: 46, train_loss: 0.8914, test_loss: 0.9140, test_f1: 0.5112
 epoch: 47, train_loss: 0.9023, test_loss: 1.0037, test_f1: 0.5156
 epoch: 48, train_loss: 0.9007, test_loss: 0.9904, test_f1: 0.5183
 epoch: 49, train_loss: 0.9074, test_loss: 0.9768, test_f1: 0.5180
 epoch: 50, train_loss: 0.8942, test_loss: 0.9857, test_f1: 0.5172
 epoch: 51, train_loss: 0.8943, test_loss: 0.9891, test_f1: 0.5264
 epoch: 52, train_loss: 0.8786, test_loss: 1.0023, test_f1: 0.5135
 epoch: 53, train_loss: 0.8748, test_loss: 1.0001, test_f1: 0.5101
 epoch: 54, train_loss: 0.8820, test_loss: 0.9896, test_f1: 0.5179
 epoch: 55, train_loss: 0.8802, test_loss: 0.9816, test_f1: 0.5162
 epoch: 56, train_loss: 0.8663, test_loss: 0.9933, test_f1: 0.5163
 epoch: 57, train_loss: 0.8724, test_loss: 1.0010, test_f1: 0.5172
 epoch: 58, train_loss: 0.8722, test_loss: 1.0076, test_f1: 0.5118
 epoch: 59, train_loss: 0.8593, test_loss: 0.9937, test_f1: 0.5089
 epoch: 60, train_loss: 0.8678, test_loss: 0.9930, test_f1: 0.5075
 epoch: 61, train_loss: 0.8651, test_loss: 1.0011, test_f1: 0.5142
 epoch: 62, train_loss: 0.8709, test_loss: 1.0050, test_f1: 0.5167
 epoch: 63, train_loss: 0.8517, test_loss: 0.9969, test_f1: 0.5139
 epoch: 64, train_loss: 0.8622, test_loss: 0.9838, test_f1: 0.5116
 epoch: 65, train_loss: 0.8479, test_loss: 0.9802, test_f1: 0.5187
 epoch: 66, train_loss: 0.8530, test_loss: 0.9826, test_f1: 0.5128
 epoch: 67, train_loss: 0.8589, test_loss: 0.9817, test_f1: 0.5131
 epoch: 68, train_loss: 0.8615, test_loss: 0.9774, test_f1: 0.5255
 epoch: 69, train_loss: 0.8568, test_loss: 0.9738, test_f1: 0.5219
 epoch: 70, train_loss: 0.8655, test_loss: 1.0080, test_f1: 0.5170
 epoch: 71, train_loss: 0.8530, test_loss: 0.9979, test_f1: 0.5126
 epoch: 72, train_loss: 0.8454, test_loss: 1.0061, test_f1: 0.5326
 epoch: 73, train_loss: 0.8662, test_loss: 1.0099, test_f1: 0.5128
 epoch: 74, train_loss: 0.8588, test_loss: 0.9941, test_f1: 0.5286
 epoch: 75, train_loss: 0.8584, test_loss: 1.0110, test_f1: 0.5160
 epoch: 76, train_loss: 0.8513, test_loss: 0.9884, test_f1: 0.5265
 epoch: 77, train_loss: 0.8616, test_loss: 0.9965, test_f1: 0.5189
 epoch: 78, train_loss: 0.8556, test_loss: 1.0029, test_f1: 0.5119
 epoch: 79, train_loss: 0.8512, test_loss: 1.0085, test_f1: 0.5152
 epoch: 80, train_loss: 0.8366, test_loss: 0.9845, test_f1: 0.5313
 epoch: 81, train_loss: 0.8340, test_loss: 1.0139, test_f1: 0.5243
 epoch: 82, train_loss: 0.8415, test_loss: 1.0280, test_f1: 0.5115
 epoch: 83, train_loss: 0.8401, test_loss: 0.9906, test_f1: 0.5247
 epoch: 84, train_loss: 0.8472, test_loss: 0.9881, test_f1: 0.5189
 epoch: 85, train_loss: 0.8428, test_loss: 1.0037, test_f1: 0.5140
 epoch: 86, train_loss: 0.8419, test_loss: 0.9965, test_f1: 0.5272
 epoch: 87, train_loss: 0.8389, test_loss: 1.0197, test_f1: 0.5089
 epoch: 88, train_loss: 0.8257, test_loss: 1.0017, test_f1: 0.5128
 epoch: 89, train_loss: 0.8316, test_loss: 0.9953, test_f1: 0.5166
 epoch: 90, train_loss: 0.8336, test_loss: 0.9143, test_f1: 0.5182
 epoch: 91, train_loss: 0.8368, test_loss: 0.9659, test_f1: 0.5203
 epoch: 92, train_loss: 0.8296, test_loss: 0.9922, test_f1: 0.5189
 epoch: 93, train_loss: 0.8271, test_loss: 1.0073, test_f1: 0.5396
 epoch: 94, train_loss: 0.8377, test_loss: 0.9875, test_f1: 0.5250
 epoch: 95, train_loss: 0.8361, test_loss: 1.0287, test_f1: 0.5195
 epoch: 96, train_loss: 0.8232, test_loss: 1.0084, test_f1: 0.5093
 epoch: 97, train_loss: 0.8320, test_loss: 1.0040, test_f1: 0.5245
 epoch: 98, train_loss: 0.8255, test_loss: 1.0159, test_f1: 0.5170
 epoch: 99, train_loss: 0.8353, test_loss: 1.0145, test_f1: 0.5202

Training completed in 424.64 seconds
Best F1: 0.5929 at epoch 95
Mean F1 across iterations: 0.5571  0.0215
========================FINAL RESULTS================================
FEGIN weighted F1: 0.5929  0.0215
python main.py --data ltspice_examples --representation component_net --model FEGIN --layers 5 --hiddens 16 --batch_size 256 --lr 0.001 --emb_size 512 --epochs 100 --save_appendix component_net_L5_H16_BS256_LR0.001_E512 --no_val
-----



STDERR:
  File "main.py", line 370, in <module>
    main()
  File "main.py", line 254, in main
    dataset = dataset_class(
  File "/home/philip/projects/ltspice_examples_code_repo/Circuit-Completion-Using-GNNs/component_classification_with_link_prediction_head/evaluation/FEGIN/kernel/circuit_datasets.py", line 15, in __init__
    self.data, self.slices = torch.load(self.processed_paths[0])
  File "/home/philip/.local/lib/python3.8/site-packages/torch/serialization.py", line 1040, in load
    warnings.warn(
  File "/usr/lib/python3.8/warnings.py", line 109, in _showwarnmsg
    sw(msg.message, msg.category, msg.filename, msg.lineno,
  File "main.py", line 47, in warn_with_traceback
    traceback.print_stack(file=log)
/home/philip/projects/ltspice_examples_code_repo/Circuit-Completion-Using-GNNs/component_classification_with_link_prediction_head/evaluation/FEGIN/kernel/circuit_datasets.py:15: FutureWarning: You are using `torch.load` with `weights_only=False` (the current default value), which uses the default pickle module implicitly. It is possible to construct malicious pickle data which will execute arbitrary code during unpickling (See https://github.com/pytorch/pytorch/blob/main/SECURITY.md#untrusted-models for more details). In a future release, the default value for `weights_only` will be flipped to `True`. This limits the functions that could be executed during unpickling. Arbitrary objects will no longer be allowed to be loaded via this mode unless they are explicitly allowlisted by the user via `torch.serialization.add_safe_globals`. We recommend you start setting `weights_only=True` for any use case where you don't have full control of the loaded file. Please open an issue on GitHub for any issues related to this experimental feature.
  self.data, self.slices = torch.load(self.processed_paths[0])
