STDOUT:
Results will be saved in /home/philip/projects/ltspice_examples_code_repo/Circuit-Completion-Using-GNNs/component_classification_with_link_prediction_head/evaluation/FEGIN/results/model_FEGIN_dataset_ltspice_demos
Command line input: python main.py --data ltspice_demos --representation component_net --model FEGIN --layers 2 --hiddens 16 --batch_size 32 --lr 0.001 --emb_size 250 --epochs 100 --save_appendix component_net_L2_H16_BS32_LR0.001_E250 --no_val
 is saved.
-----
ltspice_demos - FEGIN
Using 2 layers, 16 hidden units, h = 2
Loading component_net representation dataset
ENTERED
Training FEGIN on component_net representation
Train: 1565, Test: 383
##################ITERATION #0 ****************************************
 epoch: 0, train_loss: 1.3694, test_loss: 1.3484, test_f1: 0.1365
 epoch: 1, train_loss: 1.2772, test_loss: 1.2921, test_f1: 0.2280
 epoch: 2, train_loss: 1.2216, test_loss: 1.2612, test_f1: 0.3204
 epoch: 3, train_loss: 1.1858, test_loss: 1.2332, test_f1: 0.3227
 epoch: 4, train_loss: 1.1679, test_loss: 1.2119, test_f1: 0.3237
 epoch: 5, train_loss: 1.1359, test_loss: 1.1797, test_f1: 0.3584
 epoch: 6, train_loss: 1.1083, test_loss: 1.1655, test_f1: 0.4267
 epoch: 7, train_loss: 1.0850, test_loss: 1.1723, test_f1: 0.4187
 epoch: 8, train_loss: 1.0455, test_loss: 1.1657, test_f1: 0.4154
 epoch: 9, train_loss: 1.0484, test_loss: 1.1593, test_f1: 0.4054
 epoch: 10, train_loss: 1.0325, test_loss: 1.1557, test_f1: 0.4238
 epoch: 11, train_loss: 1.0278, test_loss: 1.1525, test_f1: 0.4288
 epoch: 12, train_loss: 1.0152, test_loss: 1.1370, test_f1: 0.4258
 epoch: 13, train_loss: 1.0083, test_loss: 1.1236, test_f1: 0.4113
 epoch: 14, train_loss: 1.0059, test_loss: 1.1383, test_f1: 0.4264
 epoch: 15, train_loss: 1.0015, test_loss: 1.1351, test_f1: 0.4250
 epoch: 16, train_loss: 0.9836, test_loss: 1.1047, test_f1: 0.4425
 epoch: 17, train_loss: 0.9929, test_loss: 1.1017, test_f1: 0.4343
 epoch: 18, train_loss: 0.9719, test_loss: 1.1029, test_f1: 0.4624
 epoch: 19, train_loss: 0.9837, test_loss: 1.0867, test_f1: 0.4663
 epoch: 20, train_loss: 0.9781, test_loss: 1.0857, test_f1: 0.4671
 epoch: 21, train_loss: 0.9659, test_loss: 1.0809, test_f1: 0.4584
 epoch: 22, train_loss: 0.9641, test_loss: 1.0581, test_f1: 0.4611
 epoch: 23, train_loss: 0.9533, test_loss: 1.0747, test_f1: 0.4471
 epoch: 24, train_loss: 0.9655, test_loss: 1.1245, test_f1: 0.5010
 epoch: 25, train_loss: 0.9637, test_loss: 1.0677, test_f1: 0.4619
 epoch: 26, train_loss: 0.9486, test_loss: 1.0718, test_f1: 0.4842
 epoch: 27, train_loss: 0.9399, test_loss: 1.0776, test_f1: 0.4894
 epoch: 28, train_loss: 0.9491, test_loss: 1.0991, test_f1: 0.4934
 epoch: 29, train_loss: 0.9425, test_loss: 1.1253, test_f1: 0.4845
 epoch: 30, train_loss: 0.9394, test_loss: 1.0715, test_f1: 0.4941
 epoch: 31, train_loss: 0.9266, test_loss: 1.0368, test_f1: 0.5018
 epoch: 32, train_loss: 0.9309, test_loss: 1.0632, test_f1: 0.5160
 epoch: 33, train_loss: 0.9384, test_loss: 1.0505, test_f1: 0.5137
 epoch: 34, train_loss: 0.9213, test_loss: 1.0585, test_f1: 0.5020
 epoch: 35, train_loss: 0.9189, test_loss: 1.0777, test_f1: 0.5194
 epoch: 36, train_loss: 0.9040, test_loss: 1.0869, test_f1: 0.5273
 epoch: 37, train_loss: 0.9119, test_loss: 1.0709, test_f1: 0.5201
 epoch: 38, train_loss: 0.9148, test_loss: 1.0527, test_f1: 0.5596
 epoch: 39, train_loss: 0.9079, test_loss: 1.0430, test_f1: 0.5277
 epoch: 40, train_loss: 0.9088, test_loss: 1.1024, test_f1: 0.5147
 epoch: 41, train_loss: 0.9068, test_loss: 1.0680, test_f1: 0.5104
 epoch: 42, train_loss: 0.9020, test_loss: 1.0535, test_f1: 0.5434
 epoch: 43, train_loss: 0.9034, test_loss: 1.0476, test_f1: 0.5523
 epoch: 44, train_loss: 0.9157, test_loss: 1.0752, test_f1: 0.5314
 epoch: 45, train_loss: 0.9103, test_loss: 1.0624, test_f1: 0.5617
 epoch: 46, train_loss: 0.8993, test_loss: 1.1029, test_f1: 0.5658
 epoch: 47, train_loss: 0.9119, test_loss: 1.0621, test_f1: 0.5520
 epoch: 48, train_loss: 0.9149, test_loss: 1.0728, test_f1: 0.5342
 epoch: 49, train_loss: 0.9209, test_loss: 1.1148, test_f1: 0.5526
 epoch: 50, train_loss: 0.9028, test_loss: 1.0470, test_f1: 0.5566
 epoch: 51, train_loss: 0.8974, test_loss: 1.0514, test_f1: 0.5443
 epoch: 52, train_loss: 0.8742, test_loss: 1.0530, test_f1: 0.5336
 epoch: 53, train_loss: 0.8932, test_loss: 1.0522, test_f1: 0.5640
 epoch: 54, train_loss: 0.8880, test_loss: 1.0658, test_f1: 0.5540
 epoch: 55, train_loss: 0.8757, test_loss: 1.0578, test_f1: 0.5577
 epoch: 56, train_loss: 0.8776, test_loss: 1.0673, test_f1: 0.5620
 epoch: 57, train_loss: 0.8774, test_loss: 1.0486, test_f1: 0.5801
 epoch: 58, train_loss: 0.8769, test_loss: 1.0530, test_f1: 0.5428
 epoch: 59, train_loss: 0.8663, test_loss: 1.0374, test_f1: 0.5550
 epoch: 60, train_loss: 0.8715, test_loss: 1.0686, test_f1: 0.5712
 epoch: 61, train_loss: 0.8664, test_loss: 1.0594, test_f1: 0.5721
 epoch: 62, train_loss: 0.8766, test_loss: 1.0515, test_f1: 0.5779
 epoch: 63, train_loss: 0.8744, test_loss: 1.0331, test_f1: 0.5706
 epoch: 64, train_loss: 0.8597, test_loss: 1.0671, test_f1: 0.5460
 epoch: 65, train_loss: 0.8789, test_loss: 1.0499, test_f1: 0.5808
 epoch: 66, train_loss: 0.8905, test_loss: 1.0628, test_f1: 0.5731
 epoch: 67, train_loss: 0.8629, test_loss: 1.0436, test_f1: 0.5772
 epoch: 68, train_loss: 0.8778, test_loss: 1.0608, test_f1: 0.5848
 epoch: 69, train_loss: 0.8649, test_loss: 1.0423, test_f1: 0.5681
 epoch: 70, train_loss: 0.8460, test_loss: 1.0403, test_f1: 0.5683
 epoch: 71, train_loss: 0.8669, test_loss: 1.0609, test_f1: 0.5793
 epoch: 72, train_loss: 0.8774, test_loss: 1.0590, test_f1: 0.5763
 epoch: 73, train_loss: 0.8775, test_loss: 1.0438, test_f1: 0.5847
 epoch: 74, train_loss: 0.8648, test_loss: 1.0317, test_f1: 0.5865
 epoch: 75, train_loss: 0.8530, test_loss: 1.0636, test_f1: 0.5766
 epoch: 76, train_loss: 0.8489, test_loss: 1.0597, test_f1: 0.5942
 epoch: 77, train_loss: 0.8782, test_loss: 1.0774, test_f1: 0.5786
 epoch: 78, train_loss: 0.8573, test_loss: 1.0515, test_f1: 0.5622
 epoch: 79, train_loss: 0.8383, test_loss: 1.0572, test_f1: 0.5789
 epoch: 80, train_loss: 0.8539, test_loss: 1.0510, test_f1: 0.5941
 epoch: 81, train_loss: 0.8566, test_loss: 1.0807, test_f1: 0.5837
 epoch: 82, train_loss: 0.8575, test_loss: 1.0851, test_f1: 0.5684
 epoch: 83, train_loss: 0.8549, test_loss: 1.0571, test_f1: 0.5804
 epoch: 84, train_loss: 0.8559, test_loss: 1.0828, test_f1: 0.5752
 epoch: 85, train_loss: 0.8498, test_loss: 1.0536, test_f1: 0.5970
 epoch: 86, train_loss: 0.8545, test_loss: 1.0645, test_f1: 0.5851
 epoch: 87, train_loss: 0.8464, test_loss: 1.0602, test_f1: 0.5655
 epoch: 88, train_loss: 0.8327, test_loss: 1.0475, test_f1: 0.5673
 epoch: 89, train_loss: 0.8365, test_loss: 1.0324, test_f1: 0.5955
 epoch: 90, train_loss: 0.8506, test_loss: 1.0345, test_f1: 0.5993
 epoch: 91, train_loss: 0.8561, test_loss: 1.0481, test_f1: 0.5967
 epoch: 92, train_loss: 0.8483, test_loss: 1.0358, test_f1: 0.5880
 epoch: 93, train_loss: 0.8540, test_loss: 1.0418, test_f1: 0.6032
 epoch: 94, train_loss: 0.8302, test_loss: 1.0560, test_f1: 0.5870
 epoch: 95, train_loss: 0.8354, test_loss: 1.0263, test_f1: 0.6041
 epoch: 96, train_loss: 0.8402, test_loss: 1.0173, test_f1: 0.6047
 epoch: 97, train_loss: 0.8223, test_loss: 1.0193, test_f1: 0.5922
 epoch: 98, train_loss: 0.8298, test_loss: 1.0226, test_f1: 0.5975
 epoch: 99, train_loss: 0.8379, test_loss: 1.0323, test_f1: 0.6056
##################ITERATION #1 ****************************************
 epoch: 0, train_loss: 1.3025, test_loss: 1.2746, test_f1: 0.2336
 epoch: 1, train_loss: 1.1536, test_loss: 1.2009, test_f1: 0.3558
 epoch: 2, train_loss: 1.1182, test_loss: 1.1586, test_f1: 0.4116
 epoch: 3, train_loss: 1.0802, test_loss: 1.1497, test_f1: 0.4369
 epoch: 4, train_loss: 1.0729, test_loss: 1.1308, test_f1: 0.4317
 epoch: 5, train_loss: 1.0443, test_loss: 1.1456, test_f1: 0.4137
 epoch: 6, train_loss: 1.0265, test_loss: 1.1310, test_f1: 0.4408
 epoch: 7, train_loss: 1.0178, test_loss: 1.1260, test_f1: 0.4605
 epoch: 8, train_loss: 1.0021, test_loss: 1.1239, test_f1: 0.4571
 epoch: 9, train_loss: 0.9903, test_loss: 1.1426, test_f1: 0.4598
 epoch: 10, train_loss: 1.0018, test_loss: 1.1238, test_f1: 0.4562
 epoch: 11, train_loss: 0.9912, test_loss: 1.1153, test_f1: 0.4684
 epoch: 12, train_loss: 0.9947, test_loss: 1.0866, test_f1: 0.4764
 epoch: 13, train_loss: 0.9830, test_loss: 1.1196, test_f1: 0.4806
 epoch: 14, train_loss: 0.9754, test_loss: 1.0823, test_f1: 0.4905
 epoch: 15, train_loss: 0.9676, test_loss: 1.1042, test_f1: 0.4935
 epoch: 16, train_loss: 0.9689, test_loss: 1.0822, test_f1: 0.4835
 epoch: 17, train_loss: 0.9643, test_loss: 1.0844, test_f1: 0.5213
 epoch: 18, train_loss: 0.9657, test_loss: 1.0835, test_f1: 0.4972
 epoch: 19, train_loss: 0.9669, test_loss: 1.0925, test_f1: 0.4907
 epoch: 20, train_loss: 0.9587, test_loss: 1.0799, test_f1: 0.4959
 epoch: 21, train_loss: 0.9550, test_loss: 1.0710, test_f1: 0.5025
 epoch: 22, train_loss: 0.9341, test_loss: 1.0574, test_f1: 0.5002
 epoch: 23, train_loss: 0.9364, test_loss: 1.0809, test_f1: 0.5015
 epoch: 24, train_loss: 0.9331, test_loss: 1.0685, test_f1: 0.4958
 epoch: 25, train_loss: 0.9260, test_loss: 1.0583, test_f1: 0.5232
 epoch: 26, train_loss: 0.9341, test_loss: 1.0507, test_f1: 0.5153
 epoch: 27, train_loss: 0.9276, test_loss: 1.0736, test_f1: 0.5015
 epoch: 28, train_loss: 0.9217, test_loss: 1.0544, test_f1: 0.5130
 epoch: 29, train_loss: 0.9117, test_loss: 1.0796, test_f1: 0.5036
 epoch: 30, train_loss: 0.9140, test_loss: 1.0696, test_f1: 0.5078
 epoch: 31, train_loss: 0.9022, test_loss: 1.0307, test_f1: 0.5289
 epoch: 32, train_loss: 0.9155, test_loss: 1.0300, test_f1: 0.5409
 epoch: 33, train_loss: 0.9013, test_loss: 1.0665, test_f1: 0.5221
 epoch: 34, train_loss: 0.9054, test_loss: 1.0577, test_f1: 0.5392
 epoch: 35, train_loss: 0.9080, test_loss: 1.0379, test_f1: 0.5600
 epoch: 36, train_loss: 0.9122, test_loss: 1.0294, test_f1: 0.5330
 epoch: 37, train_loss: 0.8989, test_loss: 1.0217, test_f1: 0.5301
 epoch: 38, train_loss: 0.8969, test_loss: 1.0260, test_f1: 0.5379
 epoch: 39, train_loss: 0.8994, test_loss: 1.0120, test_f1: 0.5466
 epoch: 40, train_loss: 0.8960, test_loss: 1.0243, test_f1: 0.5416
 epoch: 41, train_loss: 0.8932, test_loss: 0.9816, test_f1: 0.5412
 epoch: 42, train_loss: 0.8781, test_loss: 0.9999, test_f1: 0.5439
 epoch: 43, train_loss: 0.8743, test_loss: 0.9973, test_f1: 0.5614
 epoch: 44, train_loss: 0.8817, test_loss: 0.9994, test_f1: 0.5624
 epoch: 45, train_loss: 0.8877, test_loss: 0.9894, test_f1: 0.5411
 epoch: 46, train_loss: 0.8640, test_loss: 0.9840, test_f1: 0.5415
 epoch: 47, train_loss: 0.8743, test_loss: 1.0025, test_f1: 0.5504
 epoch: 48, train_loss: 0.8691, test_loss: 0.9974, test_f1: 0.5332
 epoch: 49, train_loss: 0.8577, test_loss: 0.9946, test_f1: 0.5447
 epoch: 50, train_loss: 0.8723, test_loss: 0.9633, test_f1: 0.5419
 epoch: 51, train_loss: 0.8479, test_loss: 0.9820, test_f1: 0.5454
 epoch: 52, train_loss: 0.8487, test_loss: 1.0130, test_f1: 0.5378
 epoch: 53, train_loss: 0.8296, test_loss: 0.9730, test_f1: 0.5639
 epoch: 54, train_loss: 0.8361, test_loss: 0.9771, test_f1: 0.5668
 epoch: 55, train_loss: 0.8272, test_loss: 0.9753, test_f1: 0.5552
 epoch: 56, train_loss: 0.8448, test_loss: 0.9872, test_f1: 0.5476
 epoch: 57, train_loss: 0.8343, test_loss: 0.9637, test_f1: 0.5842
 epoch: 58, train_loss: 0.8276, test_loss: 0.9798, test_f1: 0.5413
 epoch: 59, train_loss: 0.8331, test_loss: 0.9866, test_f1: 0.5523
 epoch: 60, train_loss: 0.8390, test_loss: 0.9978, test_f1: 0.5409
 epoch: 61, train_loss: 0.8238, test_loss: 0.9724, test_f1: 0.5549
 epoch: 62, train_loss: 0.8236, test_loss: 1.0019, test_f1: 0.5305
 epoch: 63, train_loss: 0.8286, test_loss: 0.9794, test_f1: 0.5746
 epoch: 64, train_loss: 0.8401, test_loss: 0.9902, test_f1: 0.5661
 epoch: 65, train_loss: 0.8184, test_loss: 0.9668, test_f1: 0.5812
 epoch: 66, train_loss: 0.8080, test_loss: 0.9676, test_f1: 0.5783
 epoch: 67, train_loss: 0.8111, test_loss: 1.0444, test_f1: 0.5426
 epoch: 68, train_loss: 0.8011, test_loss: 1.0396, test_f1: 0.5284
 epoch: 69, train_loss: 0.8214, test_loss: 1.0006, test_f1: 0.5491
 epoch: 70, train_loss: 0.8080, test_loss: 1.0251, test_f1: 0.5416
 epoch: 71, train_loss: 0.8042, test_loss: 0.9930, test_f1: 0.5512
 epoch: 72, train_loss: 0.8100, test_loss: 1.0334, test_f1: 0.5576
 epoch: 73, train_loss: 0.8118, test_loss: 1.0325, test_f1: 0.5618
 epoch: 74, train_loss: 0.8032, test_loss: 1.0367, test_f1: 0.5599
 epoch: 75, train_loss: 0.8158, test_loss: 1.0705, test_f1: 0.5284
 epoch: 76, train_loss: 0.8046, test_loss: 1.0117, test_f1: 0.5538
 epoch: 77, train_loss: 0.7977, test_loss: 0.9793, test_f1: 0.5796
 epoch: 78, train_loss: 0.7955, test_loss: 1.0128, test_f1: 0.5336
 epoch: 79, train_loss: 0.7964, test_loss: 1.0811, test_f1: 0.5165
 epoch: 80, train_loss: 0.8110, test_loss: 0.9885, test_f1: 0.5765
 epoch: 81, train_loss: 0.8040, test_loss: 1.0775, test_f1: 0.5071
 epoch: 82, train_loss: 0.8078, test_loss: 1.1002, test_f1: 0.5616
 epoch: 83, train_loss: 0.7947, test_loss: 1.0493, test_f1: 0.5322
 epoch: 84, train_loss: 0.7917, test_loss: 1.0856, test_f1: 0.5511
 epoch: 85, train_loss: 0.7818, test_loss: 1.0520, test_f1: 0.5389
 epoch: 86, train_loss: 0.7851, test_loss: 1.1138, test_f1: 0.5212
 epoch: 87, train_loss: 0.7703, test_loss: 0.9884, test_f1: 0.5407
 epoch: 88, train_loss: 0.7944, test_loss: 1.0341, test_f1: 0.5512
 epoch: 89, train_loss: 0.7836, test_loss: 1.0597, test_f1: 0.5264
 epoch: 90, train_loss: 0.7780, test_loss: 1.0651, test_f1: 0.5444
 epoch: 91, train_loss: 0.7773, test_loss: 1.1241, test_f1: 0.5236
 epoch: 92, train_loss: 0.7704, test_loss: 1.1542, test_f1: 0.5064
 epoch: 93, train_loss: 0.7699, test_loss: 1.1509, test_f1: 0.5363
 epoch: 94, train_loss: 0.7475, test_loss: 1.1038, test_f1: 0.5189
 epoch: 95, train_loss: 0.7689, test_loss: 1.1269, test_f1: 0.4764
 epoch: 96, train_loss: 0.7552, test_loss: 1.0354, test_f1: 0.5556
 epoch: 97, train_loss: 0.7695, test_loss: 1.1467, test_f1: 0.5369
 epoch: 98, train_loss: 0.7632, test_loss: 1.1440, test_f1: 0.5155
 epoch: 99, train_loss: 0.7649, test_loss: 1.1175, test_f1: 0.5325
##################ITERATION #2 ****************************************
 epoch: 0, train_loss: 1.2449, test_loss: 1.2066, test_f1: 0.3623
 epoch: 1, train_loss: 1.1250, test_loss: 1.1477, test_f1: 0.4288
 epoch: 2, train_loss: 1.0893, test_loss: 1.1056, test_f1: 0.4671
 epoch: 3, train_loss: 1.0500, test_loss: 1.0813, test_f1: 0.4725
 epoch: 4, train_loss: 1.0292, test_loss: 1.0730, test_f1: 0.4937
 epoch: 5, train_loss: 1.0086, test_loss: 1.0870, test_f1: 0.4834
 epoch: 6, train_loss: 0.9924, test_loss: 1.0706, test_f1: 0.4941
 epoch: 7, train_loss: 0.9750, test_loss: 1.0744, test_f1: 0.5153
 epoch: 8, train_loss: 0.9682, test_loss: 1.0943, test_f1: 0.4387
 epoch: 9, train_loss: 0.9742, test_loss: 1.0513, test_f1: 0.5122
 epoch: 10, train_loss: 0.9496, test_loss: 1.0595, test_f1: 0.5051
 epoch: 11, train_loss: 0.9419, test_loss: 1.0376, test_f1: 0.4844
 epoch: 12, train_loss: 0.9396, test_loss: 1.0220, test_f1: 0.5279
 epoch: 13, train_loss: 0.9276, test_loss: 1.0410, test_f1: 0.4872
 epoch: 14, train_loss: 0.9274, test_loss: 1.0584, test_f1: 0.4819
 epoch: 15, train_loss: 0.9270, test_loss: 1.0296, test_f1: 0.4846
 epoch: 16, train_loss: 0.9257, test_loss: 1.0108, test_f1: 0.5568
 epoch: 17, train_loss: 0.9044, test_loss: 1.0490, test_f1: 0.5274
 epoch: 18, train_loss: 0.9069, test_loss: 1.0120, test_f1: 0.5393
 epoch: 19, train_loss: 0.8956, test_loss: 1.0208, test_f1: 0.5394
 epoch: 20, train_loss: 0.8884, test_loss: 1.0244, test_f1: 0.5686
 epoch: 21, train_loss: 0.8681, test_loss: 1.0019, test_f1: 0.5563
 epoch: 22, train_loss: 0.8773, test_loss: 1.0121, test_f1: 0.5502
 epoch: 23, train_loss: 0.8795, test_loss: 1.0116, test_f1: 0.5598
 epoch: 24, train_loss: 0.8621, test_loss: 0.9856, test_f1: 0.5772
 epoch: 25, train_loss: 0.8580, test_loss: 0.9856, test_f1: 0.5828
 epoch: 26, train_loss: 0.8456, test_loss: 0.9927, test_f1: 0.5742
 epoch: 27, train_loss: 0.8544, test_loss: 1.0034, test_f1: 0.5708
 epoch: 28, train_loss: 0.8391, test_loss: 0.9992, test_f1: 0.5634
 epoch: 29, train_loss: 0.8354, test_loss: 1.0383, test_f1: 0.5706
 epoch: 30, train_loss: 0.8230, test_loss: 0.9783, test_f1: 0.5625
 epoch: 31, train_loss: 0.8368, test_loss: 1.0184, test_f1: 0.5342
 epoch: 32, train_loss: 0.8313, test_loss: 0.9907, test_f1: 0.5832
 epoch: 33, train_loss: 0.8291, test_loss: 1.0191, test_f1: 0.5602
 epoch: 34, train_loss: 0.8222, test_loss: 1.0272, test_f1: 0.5653
 epoch: 35, train_loss: 0.8103, test_loss: 0.9959, test_f1: 0.4608
 epoch: 36, train_loss: 0.8131, test_loss: 1.0247, test_f1: 0.5709
 epoch: 37, train_loss: 0.8043, test_loss: 1.0032, test_f1: 0.5580
 epoch: 38, train_loss: 0.8019, test_loss: 0.9933, test_f1: 0.5582
 epoch: 39, train_loss: 0.8009, test_loss: 1.0328, test_f1: 0.5590
 epoch: 40, train_loss: 0.7817, test_loss: 1.0184, test_f1: 0.5148
 epoch: 41, train_loss: 0.7792, test_loss: 1.0119, test_f1: 0.5716
 epoch: 42, train_loss: 0.7858, test_loss: 1.0189, test_f1: 0.5656
 epoch: 43, train_loss: 0.7807, test_loss: 1.0146, test_f1: 0.5638
 epoch: 44, train_loss: 0.8027, test_loss: 1.0236, test_f1: 0.5278
 epoch: 45, train_loss: 0.8020, test_loss: 1.0062, test_f1: 0.5530
 epoch: 46, train_loss: 0.7782, test_loss: 1.0210, test_f1: 0.5764
 epoch: 47, train_loss: 0.7820, test_loss: 1.0232, test_f1: 0.5536
 epoch: 48, train_loss: 0.7783, test_loss: 1.0003, test_f1: 0.5443
 epoch: 49, train_loss: 0.7706, test_loss: 1.0418, test_f1: 0.5484
 epoch: 50, train_loss: 0.7723, test_loss: 1.0268, test_f1: 0.5563
 epoch: 51, train_loss: 0.7628, test_loss: 1.0283, test_f1: 0.5574
 epoch: 52, train_loss: 0.7530, test_loss: 1.0406, test_f1: 0.5376
 epoch: 53, train_loss: 0.7681, test_loss: 1.0403, test_f1: 0.5234
 epoch: 54, train_loss: 0.7570, test_loss: 1.0361, test_f1: 0.5541
 epoch: 55, train_loss: 0.7634, test_loss: 1.0308, test_f1: 0.5636
 epoch: 56, train_loss: 0.7434, test_loss: 1.0332, test_f1: 0.5463
 epoch: 57, train_loss: 0.7651, test_loss: 1.0499, test_f1: 0.5660
 epoch: 58, train_loss: 0.7553, test_loss: 1.0282, test_f1: 0.5512
 epoch: 59, train_loss: 0.7421, test_loss: 1.0599, test_f1: 0.5677
 epoch: 60, train_loss: 0.7627, test_loss: 1.0432, test_f1: 0.5678
 epoch: 61, train_loss: 0.7541, test_loss: 1.0399, test_f1: 0.5510
 epoch: 62, train_loss: 0.7438, test_loss: 1.0430, test_f1: 0.5569
 epoch: 63, train_loss: 0.7605, test_loss: 1.0531, test_f1: 0.5477
 epoch: 64, train_loss: 0.7455, test_loss: 1.0407, test_f1: 0.5469
 epoch: 65, train_loss: 0.7419, test_loss: 1.0323, test_f1: 0.5597
 epoch: 66, train_loss: 0.7442, test_loss: 1.0319, test_f1: 0.5706
 epoch: 67, train_loss: 0.7419, test_loss: 1.0544, test_f1: 0.5552
 epoch: 68, train_loss: 0.7433, test_loss: 1.0397, test_f1: 0.5534
 epoch: 69, train_loss: 0.7443, test_loss: 1.0425, test_f1: 0.5502
 epoch: 70, train_loss: 0.7290, test_loss: 1.0722, test_f1: 0.5531
 epoch: 71, train_loss: 0.7427, test_loss: 1.0995, test_f1: 0.5482
 epoch: 72, train_loss: 0.7377, test_loss: 1.0786, test_f1: 0.5553
 epoch: 73, train_loss: 0.7451, test_loss: 1.0736, test_f1: 0.5462
 epoch: 74, train_loss: 0.7334, test_loss: 1.0751, test_f1: 0.5749
 epoch: 75, train_loss: 0.7160, test_loss: 1.0642, test_f1: 0.5583
 epoch: 76, train_loss: 0.7265, test_loss: 1.0599, test_f1: 0.5715
 epoch: 77, train_loss: 0.7209, test_loss: 1.0875, test_f1: 0.5468
 epoch: 78, train_loss: 0.7338, test_loss: 1.0668, test_f1: 0.5585
 epoch: 79, train_loss: 0.7423, test_loss: 1.0249, test_f1: 0.5818
 epoch: 80, train_loss: 0.7274, test_loss: 1.0773, test_f1: 0.5482
 epoch: 81, train_loss: 0.7296, test_loss: 1.0451, test_f1: 0.5510
 epoch: 82, train_loss: 0.7334, test_loss: 1.0776, test_f1: 0.5532
 epoch: 83, train_loss: 0.7212, test_loss: 1.0343, test_f1: 0.5851
 epoch: 84, train_loss: 0.7353, test_loss: 1.0590, test_f1: 0.5436
 epoch: 85, train_loss: 0.7227, test_loss: 1.0491, test_f1: 0.5481
 epoch: 86, train_loss: 0.7026, test_loss: 1.0511, test_f1: 0.5599
 epoch: 87, train_loss: 0.7337, test_loss: 1.0389, test_f1: 0.5930
 epoch: 88, train_loss: 0.7141, test_loss: 1.0289, test_f1: 0.5728
 epoch: 89, train_loss: 0.7100, test_loss: 1.0832, test_f1: 0.5446
 epoch: 90, train_loss: 0.7250, test_loss: 1.0513, test_f1: 0.5472
 epoch: 91, train_loss: 0.7082, test_loss: 1.0887, test_f1: 0.5580
 epoch: 92, train_loss: 0.7308, test_loss: 1.0752, test_f1: 0.5751
 epoch: 93, train_loss: 0.7090, test_loss: 1.0786, test_f1: 0.6063
 epoch: 94, train_loss: 0.7247, test_loss: 1.0452, test_f1: 0.5589
 epoch: 95, train_loss: 0.7079, test_loss: 1.0563, test_f1: 0.5869
 epoch: 96, train_loss: 0.7097, test_loss: 1.0343, test_f1: 0.5746
 epoch: 97, train_loss: 0.7261, test_loss: 1.0480, test_f1: 0.5618
 epoch: 98, train_loss: 0.7214, test_loss: 1.0396, test_f1: 0.5850
 epoch: 99, train_loss: 0.7048, test_loss: 1.0728, test_f1: 0.5747
##################ITERATION #3 ****************************************
 epoch: 0, train_loss: 1.3383, test_loss: 1.3174, test_f1: 0.2339
 epoch: 1, train_loss: 1.1801, test_loss: 1.2199, test_f1: 0.2785
 epoch: 2, train_loss: 1.1429, test_loss: 1.1807, test_f1: 0.3511
 epoch: 3, train_loss: 1.1120, test_loss: 1.1511, test_f1: 0.3976
 epoch: 4, train_loss: 1.0922, test_loss: 1.1302, test_f1: 0.4187
 epoch: 5, train_loss: 1.0838, test_loss: 1.1204, test_f1: 0.4006
 epoch: 6, train_loss: 1.0577, test_loss: 1.1133, test_f1: 0.3898
 epoch: 7, train_loss: 1.0485, test_loss: 1.1088, test_f1: 0.4005
 epoch: 8, train_loss: 1.0223, test_loss: 1.0864, test_f1: 0.3945
 epoch: 9, train_loss: 1.0296, test_loss: 1.0702, test_f1: 0.4414
 epoch: 10, train_loss: 1.0056, test_loss: 1.0653, test_f1: 0.4583
 epoch: 11, train_loss: 1.0005, test_loss: 1.0743, test_f1: 0.4437
 epoch: 12, train_loss: 0.9957, test_loss: 1.0644, test_f1: 0.4660
 epoch: 13, train_loss: 1.0010, test_loss: 1.0626, test_f1: 0.4542
 epoch: 14, train_loss: 0.9776, test_loss: 1.0633, test_f1: 0.4667
 epoch: 15, train_loss: 0.9702, test_loss: 1.0543, test_f1: 0.4401
 epoch: 16, train_loss: 0.9663, test_loss: 1.0466, test_f1: 0.4756
 epoch: 17, train_loss: 0.9581, test_loss: 1.0586, test_f1: 0.4622
 epoch: 18, train_loss: 0.9565, test_loss: 1.0358, test_f1: 0.5305
 epoch: 19, train_loss: 0.9512, test_loss: 1.0579, test_f1: 0.4941
 epoch: 20, train_loss: 0.9561, test_loss: 1.0332, test_f1: 0.5475
 epoch: 21, train_loss: 0.9357, test_loss: 1.0306, test_f1: 0.5461
 epoch: 22, train_loss: 0.9376, test_loss: 1.0578, test_f1: 0.4745
 epoch: 23, train_loss: 0.9412, test_loss: 1.0266, test_f1: 0.5648
 epoch: 24, train_loss: 0.9221, test_loss: 1.0398, test_f1: 0.5396
 epoch: 25, train_loss: 0.9314, test_loss: 1.0441, test_f1: 0.5394
 epoch: 26, train_loss: 0.9202, test_loss: 1.0315, test_f1: 0.5526
 epoch: 27, train_loss: 0.9090, test_loss: 1.0309, test_f1: 0.5722
 epoch: 28, train_loss: 0.9114, test_loss: 1.0247, test_f1: 0.5459
 epoch: 29, train_loss: 0.9123, test_loss: 1.0363, test_f1: 0.5290
 epoch: 30, train_loss: 0.8946, test_loss: 1.0506, test_f1: 0.5518
 epoch: 31, train_loss: 0.9046, test_loss: 1.0709, test_f1: 0.5168
 epoch: 32, train_loss: 0.9139, test_loss: 1.0794, test_f1: 0.5067
 epoch: 33, train_loss: 0.9066, test_loss: 1.0617, test_f1: 0.5171
 epoch: 34, train_loss: 0.8956, test_loss: 1.0749, test_f1: 0.5108
 epoch: 35, train_loss: 0.8991, test_loss: 1.0804, test_f1: 0.5360
 epoch: 36, train_loss: 0.9045, test_loss: 1.0309, test_f1: 0.5353
 epoch: 37, train_loss: 0.8961, test_loss: 1.1162, test_f1: 0.5142
 epoch: 38, train_loss: 0.8782, test_loss: 1.0626, test_f1: 0.5318
 epoch: 39, train_loss: 0.8848, test_loss: 1.1035, test_f1: 0.5401
 epoch: 40, train_loss: 0.8812, test_loss: 1.0826, test_f1: 0.5290
 epoch: 41, train_loss: 0.8854, test_loss: 1.0509, test_f1: 0.5153
 epoch: 42, train_loss: 0.8748, test_loss: 1.1265, test_f1: 0.5180
 epoch: 43, train_loss: 0.8787, test_loss: 1.1003, test_f1: 0.4960
 epoch: 44, train_loss: 0.8692, test_loss: 1.1711, test_f1: 0.5388
 epoch: 45, train_loss: 0.8703, test_loss: 1.0063, test_f1: 0.5508
 epoch: 46, train_loss: 0.8632, test_loss: 1.0187, test_f1: 0.5271
 epoch: 47, train_loss: 0.8507, test_loss: 1.0197, test_f1: 0.5624
 epoch: 48, train_loss: 0.8711, test_loss: 1.0177, test_f1: 0.5473
 epoch: 49, train_loss: 0.8490, test_loss: 1.0106, test_f1: 0.5731
 epoch: 50, train_loss: 0.8696, test_loss: 1.0347, test_f1: 0.5484
 epoch: 51, train_loss: 0.8559, test_loss: 1.0156, test_f1: 0.5601
 epoch: 52, train_loss: 0.8261, test_loss: 1.0278, test_f1: 0.5444
 epoch: 53, train_loss: 0.8420, test_loss: 1.0293, test_f1: 0.5548
 epoch: 54, train_loss: 0.8224, test_loss: 1.0354, test_f1: 0.5507
 epoch: 55, train_loss: 0.8280, test_loss: 1.0763, test_f1: 0.5482
 epoch: 56, train_loss: 0.8266, test_loss: 1.0250, test_f1: 0.5506
 epoch: 57, train_loss: 0.8224, test_loss: 1.0384, test_f1: 0.5408
 epoch: 58, train_loss: 0.8326, test_loss: 1.0345, test_f1: 0.5427
 epoch: 59, train_loss: 0.8259, test_loss: 1.0257, test_f1: 0.5333
 epoch: 60, train_loss: 0.8219, test_loss: 1.0656, test_f1: 0.5487
 epoch: 61, train_loss: 0.8274, test_loss: 1.0214, test_f1: 0.5556
 epoch: 62, train_loss: 0.8258, test_loss: 1.0442, test_f1: 0.5587
 epoch: 63, train_loss: 0.8220, test_loss: 1.0458, test_f1: 0.5625
 epoch: 64, train_loss: 0.8024, test_loss: 1.0312, test_f1: 0.5640
 epoch: 65, train_loss: 0.7905, test_loss: 1.0043, test_f1: 0.5550
 epoch: 66, train_loss: 0.8195, test_loss: 1.0038, test_f1: 0.5535
 epoch: 67, train_loss: 0.8329, test_loss: 1.0753, test_f1: 0.5529
 epoch: 68, train_loss: 0.8061, test_loss: 0.9896, test_f1: 0.5953
 epoch: 69, train_loss: 0.8105, test_loss: 1.0020, test_f1: 0.5725
 epoch: 70, train_loss: 0.8003, test_loss: 1.0248, test_f1: 0.5568
 epoch: 71, train_loss: 0.8197, test_loss: 1.0221, test_f1: 0.5579
 epoch: 72, train_loss: 0.8083, test_loss: 0.9818, test_f1: 0.5827
 epoch: 73, train_loss: 0.8123, test_loss: 1.0367, test_f1: 0.5457
 epoch: 74, train_loss: 0.8048, test_loss: 1.0010, test_f1: 0.5772
 epoch: 75, train_loss: 0.7977, test_loss: 1.0145, test_f1: 0.5845
 epoch: 76, train_loss: 0.8019, test_loss: 0.9791, test_f1: 0.5877
 epoch: 77, train_loss: 0.8132, test_loss: 1.0367, test_f1: 0.5634
 epoch: 78, train_loss: 0.7953, test_loss: 0.9756, test_f1: 0.5516
 epoch: 79, train_loss: 0.7998, test_loss: 1.0079, test_f1: 0.5663
 epoch: 80, train_loss: 0.7853, test_loss: 0.9782, test_f1: 0.5719
 epoch: 81, train_loss: 0.7955, test_loss: 0.9885, test_f1: 0.5843
 epoch: 82, train_loss: 0.7740, test_loss: 0.9928, test_f1: 0.5670
 epoch: 83, train_loss: 0.8063, test_loss: 1.0241, test_f1: 0.5583
 epoch: 84, train_loss: 0.7765, test_loss: 0.9875, test_f1: 0.5623
 epoch: 85, train_loss: 0.7802, test_loss: 1.0227, test_f1: 0.5612
 epoch: 86, train_loss: 0.7858, test_loss: 0.9785, test_f1: 0.5978
 epoch: 87, train_loss: 0.7791, test_loss: 1.0173, test_f1: 0.5490
 epoch: 88, train_loss: 0.7752, test_loss: 1.0264, test_f1: 0.5652
 epoch: 89, train_loss: 0.7862, test_loss: 1.0061, test_f1: 0.5640
 epoch: 90, train_loss: 0.7769, test_loss: 0.9869, test_f1: 0.5960
 epoch: 91, train_loss: 0.7784, test_loss: 0.9875, test_f1: 0.5937
 epoch: 92, train_loss: 0.7817, test_loss: 1.0253, test_f1: 0.5934
 epoch: 93, train_loss: 0.7720, test_loss: 1.0061, test_f1: 0.5837
 epoch: 94, train_loss: 0.7655, test_loss: 1.0031, test_f1: 0.5827
 epoch: 95, train_loss: 0.7723, test_loss: 0.9643, test_f1: 0.5992
 epoch: 96, train_loss: 0.7749, test_loss: 0.9993, test_f1: 0.5563
 epoch: 97, train_loss: 0.7521, test_loss: 0.9981, test_f1: 0.6028
 epoch: 98, train_loss: 0.7849, test_loss: 0.9718, test_f1: 0.5953
 epoch: 99, train_loss: 0.7874, test_loss: 0.9799, test_f1: 0.5834
##################ITERATION #4 ****************************************
 epoch: 0, train_loss: 1.3160, test_loss: 1.2764, test_f1: 0.2281
 epoch: 1, train_loss: 1.2115, test_loss: 1.2150, test_f1: 0.3260
 epoch: 2, train_loss: 1.1714, test_loss: 1.1881, test_f1: 0.3177
 epoch: 3, train_loss: 1.1525, test_loss: 1.1657, test_f1: 0.3887
 epoch: 4, train_loss: 1.1308, test_loss: 1.1305, test_f1: 0.4610
 epoch: 5, train_loss: 1.1188, test_loss: 1.1144, test_f1: 0.4928
 epoch: 6, train_loss: 1.0814, test_loss: 1.1133, test_f1: 0.4495
 epoch: 7, train_loss: 1.0568, test_loss: 1.1109, test_f1: 0.4670
 epoch: 8, train_loss: 1.0506, test_loss: 1.0676, test_f1: 0.4961
 epoch: 9, train_loss: 1.0359, test_loss: 1.0971, test_f1: 0.4530
 epoch: 10, train_loss: 1.0288, test_loss: 1.0715, test_f1: 0.4795
 epoch: 11, train_loss: 1.0230, test_loss: 1.0671, test_f1: 0.4960
 epoch: 12, train_loss: 0.9893, test_loss: 1.0526, test_f1: 0.4949
 epoch: 13, train_loss: 0.9849, test_loss: 1.0312, test_f1: 0.4425
 epoch: 14, train_loss: 0.9699, test_loss: 1.0303, test_f1: 0.5313
 epoch: 15, train_loss: 0.9597, test_loss: 1.0383, test_f1: 0.5092
 epoch: 16, train_loss: 0.9702, test_loss: 1.0178, test_f1: 0.4401
 epoch: 17, train_loss: 0.9534, test_loss: 1.0164, test_f1: 0.5286
 epoch: 18, train_loss: 0.9415, test_loss: 1.0434, test_f1: 0.4973
 epoch: 19, train_loss: 0.9579, test_loss: 0.9947, test_f1: 0.4682
 epoch: 20, train_loss: 0.9387, test_loss: 1.0346, test_f1: 0.5080
 epoch: 21, train_loss: 0.9402, test_loss: 1.0045, test_f1: 0.5329
 epoch: 22, train_loss: 0.9382, test_loss: 1.0041, test_f1: 0.5499
 epoch: 23, train_loss: 0.9207, test_loss: 1.0089, test_f1: 0.5415
 epoch: 24, train_loss: 0.9229, test_loss: 1.0001, test_f1: 0.5331
 epoch: 25, train_loss: 0.9257, test_loss: 0.9899, test_f1: 0.5468
 epoch: 26, train_loss: 0.9199, test_loss: 0.9936, test_f1: 0.5464
 epoch: 27, train_loss: 0.9143, test_loss: 0.9868, test_f1: 0.5492
 epoch: 28, train_loss: 0.9208, test_loss: 0.9856, test_f1: 0.5482
 epoch: 29, train_loss: 0.9178, test_loss: 0.9992, test_f1: 0.5371
 epoch: 30, train_loss: 0.9210, test_loss: 0.9997, test_f1: 0.5183
 epoch: 31, train_loss: 0.9097, test_loss: 0.9998, test_f1: 0.5233
 epoch: 32, train_loss: 0.9067, test_loss: 0.9990, test_f1: 0.5409
 epoch: 33, train_loss: 0.8918, test_loss: 1.0024, test_f1: 0.5358
 epoch: 34, train_loss: 0.8924, test_loss: 0.9929, test_f1: 0.5425
 epoch: 35, train_loss: 0.8983, test_loss: 0.9921, test_f1: 0.5402
 epoch: 36, train_loss: 0.9091, test_loss: 0.9946, test_f1: 0.5635
 epoch: 37, train_loss: 0.9015, test_loss: 0.9857, test_f1: 0.5739
 epoch: 38, train_loss: 0.8876, test_loss: 0.9941, test_f1: 0.5527
 epoch: 39, train_loss: 0.8919, test_loss: 0.9891, test_f1: 0.5701
 epoch: 40, train_loss: 0.8802, test_loss: 0.9829, test_f1: 0.5426
 epoch: 41, train_loss: 0.8765, test_loss: 0.9816, test_f1: 0.5339
 epoch: 42, train_loss: 0.8820, test_loss: 0.9849, test_f1: 0.5221
 epoch: 43, train_loss: 0.8724, test_loss: 0.9784, test_f1: 0.5802
 epoch: 44, train_loss: 0.8706, test_loss: 0.9789, test_f1: 0.5692
 epoch: 45, train_loss: 0.8695, test_loss: 0.9831, test_f1: 0.5455
 epoch: 46, train_loss: 0.8604, test_loss: 0.9914, test_f1: 0.5811
 epoch: 47, train_loss: 0.8595, test_loss: 0.9787, test_f1: 0.5493
 epoch: 48, train_loss: 0.8425, test_loss: 0.9724, test_f1: 0.5962
 epoch: 49, train_loss: 0.8742, test_loss: 0.9727, test_f1: 0.5530
 epoch: 50, train_loss: 0.8352, test_loss: 0.9604, test_f1: 0.5799
 epoch: 51, train_loss: 0.8372, test_loss: 0.9615, test_f1: 0.5717
 epoch: 52, train_loss: 0.8216, test_loss: 0.9683, test_f1: 0.5828
 epoch: 53, train_loss: 0.8383, test_loss: 0.9698, test_f1: 0.5822
 epoch: 54, train_loss: 0.8116, test_loss: 0.9603, test_f1: 0.6015
 epoch: 55, train_loss: 0.8256, test_loss: 0.9622, test_f1: 0.6099
 epoch: 56, train_loss: 0.8194, test_loss: 0.9549, test_f1: 0.5988
 epoch: 57, train_loss: 0.8124, test_loss: 0.9534, test_f1: 0.6053
 epoch: 58, train_loss: 0.8062, test_loss: 0.9624, test_f1: 0.6029
 epoch: 59, train_loss: 0.8080, test_loss: 0.9729, test_f1: 0.5875
 epoch: 60, train_loss: 0.8079, test_loss: 0.9511, test_f1: 0.5989
 epoch: 61, train_loss: 0.8144, test_loss: 0.9448, test_f1: 0.6203
 epoch: 62, train_loss: 0.8106, test_loss: 0.9397, test_f1: 0.6144
 epoch: 63, train_loss: 0.8023, test_loss: 0.9547, test_f1: 0.5807
 epoch: 64, train_loss: 0.8130, test_loss: 0.9382, test_f1: 0.6120
 epoch: 65, train_loss: 0.8022, test_loss: 0.9511, test_f1: 0.6143
 epoch: 66, train_loss: 0.8068, test_loss: 0.9279, test_f1: 0.6366
 epoch: 67, train_loss: 0.7994, test_loss: 0.9988, test_f1: 0.5751
 epoch: 68, train_loss: 0.8065, test_loss: 0.9297, test_f1: 0.6148
 epoch: 69, train_loss: 0.7738, test_loss: 0.9418, test_f1: 0.6055
 epoch: 70, train_loss: 0.7946, test_loss: 0.9369, test_f1: 0.6057
 epoch: 71, train_loss: 0.7838, test_loss: 0.9569, test_f1: 0.6159
 epoch: 72, train_loss: 0.7984, test_loss: 0.9525, test_f1: 0.6015
 epoch: 73, train_loss: 0.7745, test_loss: 0.9362, test_f1: 0.6220
 epoch: 74, train_loss: 0.7731, test_loss: 0.9400, test_f1: 0.6213
 epoch: 75, train_loss: 0.7602, test_loss: 0.9522, test_f1: 0.6265
 epoch: 76, train_loss: 0.7847, test_loss: 0.9505, test_f1: 0.6050
 epoch: 77, train_loss: 0.7829, test_loss: 0.9341, test_f1: 0.6251
 epoch: 78, train_loss: 0.7605, test_loss: 0.9615, test_f1: 0.5921
 epoch: 79, train_loss: 0.7757, test_loss: 0.9516, test_f1: 0.6170
 epoch: 80, train_loss: 0.7536, test_loss: 0.9573, test_f1: 0.6258
 epoch: 81, train_loss: 0.7607, test_loss: 0.9390, test_f1: 0.6067
 epoch: 82, train_loss: 0.7795, test_loss: 0.9445, test_f1: 0.6192
 epoch: 83, train_loss: 0.7730, test_loss: 0.9853, test_f1: 0.5938
 epoch: 84, train_loss: 0.7528, test_loss: 0.9355, test_f1: 0.6110
 epoch: 85, train_loss: 0.7417, test_loss: 0.9566, test_f1: 0.5765
 epoch: 86, train_loss: 0.7572, test_loss: 0.9453, test_f1: 0.6321
 epoch: 87, train_loss: 0.7406, test_loss: 0.9399, test_f1: 0.6145
 epoch: 88, train_loss: 0.7529, test_loss: 0.9310, test_f1: 0.6252
 epoch: 89, train_loss: 0.7385, test_loss: 0.9675, test_f1: 0.5948
 epoch: 90, train_loss: 0.7560, test_loss: 1.0116, test_f1: 0.5896
 epoch: 91, train_loss: 0.7372, test_loss: 0.9356, test_f1: 0.5938
 epoch: 92, train_loss: 0.7337, test_loss: 0.9503, test_f1: 0.6246
 epoch: 93, train_loss: 0.7422, test_loss: 0.9333, test_f1: 0.6212
 epoch: 94, train_loss: 0.7425, test_loss: 0.9496, test_f1: 0.6069
 epoch: 95, train_loss: 0.7318, test_loss: 0.9449, test_f1: 0.6362
 epoch: 96, train_loss: 0.7328, test_loss: 0.9372, test_f1: 0.5964
 epoch: 97, train_loss: 0.7273, test_loss: 0.9351, test_f1: 0.6278
 epoch: 98, train_loss: 0.7189, test_loss: 0.9491, test_f1: 0.6103
 epoch: 99, train_loss: 0.7208, test_loss: 0.9389, test_f1: 0.5880
##################ITERATION #5 ****************************************
 epoch: 0, train_loss: 1.3323, test_loss: 1.3011, test_f1: 0.2414
 epoch: 1, train_loss: 1.1676, test_loss: 1.1886, test_f1: 0.4090
 epoch: 2, train_loss: 1.0991, test_loss: 1.1555, test_f1: 0.4664
 epoch: 3, train_loss: 1.0954, test_loss: 1.1077, test_f1: 0.4823
 epoch: 4, train_loss: 1.0740, test_loss: 1.1276, test_f1: 0.4988
 epoch: 5, train_loss: 1.0386, test_loss: 1.0926, test_f1: 0.4772
 epoch: 6, train_loss: 1.0255, test_loss: 1.0995, test_f1: 0.4813
 epoch: 7, train_loss: 1.0176, test_loss: 1.1118, test_f1: 0.4822
 epoch: 8, train_loss: 1.0131, test_loss: 1.0976, test_f1: 0.4850
 epoch: 9, train_loss: 1.0242, test_loss: 1.0612, test_f1: 0.5032
 epoch: 10, train_loss: 1.0076, test_loss: 1.0906, test_f1: 0.4842
 epoch: 11, train_loss: 0.9880, test_loss: 1.0708, test_f1: 0.4566
 epoch: 12, train_loss: 0.9903, test_loss: 1.0709, test_f1: 0.5040
 epoch: 13, train_loss: 0.9716, test_loss: 1.0687, test_f1: 0.4898
 epoch: 14, train_loss: 0.9766, test_loss: 1.0741, test_f1: 0.4665
 epoch: 15, train_loss: 0.9828, test_loss: 1.0655, test_f1: 0.5142
 epoch: 16, train_loss: 0.9644, test_loss: 1.0486, test_f1: 0.5171
 epoch: 17, train_loss: 0.9616, test_loss: 1.0818, test_f1: 0.5165
 epoch: 18, train_loss: 0.9557, test_loss: 1.0780, test_f1: 0.5071
 epoch: 19, train_loss: 0.9573, test_loss: 1.0409, test_f1: 0.5239
 epoch: 20, train_loss: 0.9475, test_loss: 1.0564, test_f1: 0.5278
 epoch: 21, train_loss: 0.9454, test_loss: 1.0345, test_f1: 0.5420
 epoch: 22, train_loss: 0.9490, test_loss: 1.0567, test_f1: 0.5311
 epoch: 23, train_loss: 0.9399, test_loss: 1.0595, test_f1: 0.5313
 epoch: 24, train_loss: 0.9343, test_loss: 1.0566, test_f1: 0.5544
 epoch: 25, train_loss: 0.9274, test_loss: 1.0431, test_f1: 0.5492
 epoch: 26, train_loss: 0.9251, test_loss: 1.0236, test_f1: 0.5481
 epoch: 27, train_loss: 0.9304, test_loss: 1.0381, test_f1: 0.5281
 epoch: 28, train_loss: 0.9170, test_loss: 1.0096, test_f1: 0.5242
 epoch: 29, train_loss: 0.9204, test_loss: 0.9898, test_f1: 0.5599
 epoch: 30, train_loss: 0.9167, test_loss: 1.0060, test_f1: 0.5425
 epoch: 31, train_loss: 0.9094, test_loss: 1.0059, test_f1: 0.5564
 epoch: 32, train_loss: 0.9007, test_loss: 1.0100, test_f1: 0.5605
 epoch: 33, train_loss: 0.8928, test_loss: 1.0246, test_f1: 0.5772
 epoch: 34, train_loss: 0.8998, test_loss: 1.0092, test_f1: 0.5522
 epoch: 35, train_loss: 0.8880, test_loss: 1.0123, test_f1: 0.5527
 epoch: 36, train_loss: 0.8824, test_loss: 0.9940, test_f1: 0.5601
 epoch: 37, train_loss: 0.8930, test_loss: 1.0247, test_f1: 0.5503
 epoch: 38, train_loss: 0.8807, test_loss: 1.0278, test_f1: 0.5546
 epoch: 39, train_loss: 0.8733, test_loss: 1.0535, test_f1: 0.5707
 epoch: 40, train_loss: 0.8787, test_loss: 0.9787, test_f1: 0.5657
 epoch: 41, train_loss: 0.8809, test_loss: 1.0365, test_f1: 0.5290
 epoch: 42, train_loss: 0.8576, test_loss: 1.0137, test_f1: 0.5568
 epoch: 43, train_loss: 0.8788, test_loss: 1.0031, test_f1: 0.5387
 epoch: 44, train_loss: 0.8947, test_loss: 1.0722, test_f1: 0.5205
 epoch: 45, train_loss: 0.8751, test_loss: 1.0036, test_f1: 0.5400
 epoch: 46, train_loss: 0.8702, test_loss: 1.0070, test_f1: 0.5350
 epoch: 47, train_loss: 0.8665, test_loss: 1.0587, test_f1: 0.5570
 epoch: 48, train_loss: 0.8591, test_loss: 1.0040, test_f1: 0.5317
 epoch: 49, train_loss: 0.8584, test_loss: 0.9850, test_f1: 0.5560
 epoch: 50, train_loss: 0.8471, test_loss: 1.0035, test_f1: 0.5478
 epoch: 51, train_loss: 0.8398, test_loss: 1.0039, test_f1: 0.5653
 epoch: 52, train_loss: 0.8498, test_loss: 1.0367, test_f1: 0.5432
 epoch: 53, train_loss: 0.8355, test_loss: 0.9874, test_f1: 0.5687
 epoch: 54, train_loss: 0.8274, test_loss: 1.0088, test_f1: 0.5582
 epoch: 55, train_loss: 0.8448, test_loss: 0.9950, test_f1: 0.5562
 epoch: 56, train_loss: 0.8399, test_loss: 1.0064, test_f1: 0.5572
 epoch: 57, train_loss: 0.8208, test_loss: 0.9823, test_f1: 0.5516
 epoch: 58, train_loss: 0.8518, test_loss: 0.9951, test_f1: 0.5740
 epoch: 59, train_loss: 0.8375, test_loss: 0.9979, test_f1: 0.5669
 epoch: 60, train_loss: 0.8380, test_loss: 1.0053, test_f1: 0.5576
 epoch: 61, train_loss: 0.8256, test_loss: 0.9891, test_f1: 0.5677
 epoch: 62, train_loss: 0.8321, test_loss: 1.0059, test_f1: 0.5669
 epoch: 63, train_loss: 0.8247, test_loss: 1.0262, test_f1: 0.5628
 epoch: 64, train_loss: 0.8321, test_loss: 0.9925, test_f1: 0.5845
 epoch: 65, train_loss: 0.8321, test_loss: 1.0020, test_f1: 0.5637
 epoch: 66, train_loss: 0.8116, test_loss: 0.9794, test_f1: 0.5730
 epoch: 67, train_loss: 0.8283, test_loss: 0.9884, test_f1: 0.5572
 epoch: 68, train_loss: 0.8314, test_loss: 1.0042, test_f1: 0.5829
 epoch: 69, train_loss: 0.8158, test_loss: 0.9958, test_f1: 0.5721
 epoch: 70, train_loss: 0.8042, test_loss: 0.9918, test_f1: 0.5887
 epoch: 71, train_loss: 0.8240, test_loss: 0.9879, test_f1: 0.5780
 epoch: 72, train_loss: 0.8201, test_loss: 1.0071, test_f1: 0.5722
 epoch: 73, train_loss: 0.8100, test_loss: 1.0003, test_f1: 0.5551
 epoch: 74, train_loss: 0.7998, test_loss: 1.0208, test_f1: 0.5624
 epoch: 75, train_loss: 0.8145, test_loss: 0.9871, test_f1: 0.5822
 epoch: 76, train_loss: 0.8146, test_loss: 0.9820, test_f1: 0.5771
 epoch: 77, train_loss: 0.7944, test_loss: 0.9608, test_f1: 0.5904
 epoch: 78, train_loss: 0.8009, test_loss: 1.0018, test_f1: 0.5604
 epoch: 79, train_loss: 0.8049, test_loss: 0.9677, test_f1: 0.5716
 epoch: 80, train_loss: 0.8080, test_loss: 0.9976, test_f1: 0.6067
 epoch: 81, train_loss: 0.8159, test_loss: 0.9797, test_f1: 0.5764
 epoch: 82, train_loss: 0.8042, test_loss: 1.0148, test_f1: 0.5733
 epoch: 83, train_loss: 0.8068, test_loss: 0.9711, test_f1: 0.5799
 epoch: 84, train_loss: 0.8042, test_loss: 0.9933, test_f1: 0.5781
 epoch: 85, train_loss: 0.8011, test_loss: 0.9925, test_f1: 0.5838
 epoch: 86, train_loss: 0.7946, test_loss: 1.0033, test_f1: 0.5934
 epoch: 87, train_loss: 0.7995, test_loss: 0.9571, test_f1: 0.5991
 epoch: 88, train_loss: 0.7894, test_loss: 1.0061, test_f1: 0.5926
 epoch: 89, train_loss: 0.8010, test_loss: 0.9632, test_f1: 0.5933
 epoch: 90, train_loss: 0.7877, test_loss: 0.9768, test_f1: 0.5840
 epoch: 91, train_loss: 0.7923, test_loss: 0.9871, test_f1: 0.5753
 epoch: 92, train_loss: 0.7805, test_loss: 0.9956, test_f1: 0.5730
 epoch: 93, train_loss: 0.7856, test_loss: 0.9765, test_f1: 0.5884
 epoch: 94, train_loss: 0.7651, test_loss: 1.0069, test_f1: 0.5872
 epoch: 95, train_loss: 0.7891, test_loss: 0.9912, test_f1: 0.5819
 epoch: 96, train_loss: 0.7764, test_loss: 1.0138, test_f1: 0.5854
 epoch: 97, train_loss: 0.7688, test_loss: 0.9979, test_f1: 0.6083
 epoch: 98, train_loss: 0.7533, test_loss: 1.0028, test_f1: 0.5744
 epoch: 99, train_loss: 0.7739, test_loss: 0.9977, test_f1: 0.6224
##################ITERATION #6 ****************************************
 epoch: 0, train_loss: 1.2397, test_loss: 1.2161, test_f1: 0.3496
 epoch: 1, train_loss: 1.1032, test_loss: 1.1063, test_f1: 0.4272
 epoch: 2, train_loss: 1.0842, test_loss: 1.0964, test_f1: 0.4320
 epoch: 3, train_loss: 1.0478, test_loss: 1.0945, test_f1: 0.4524
 epoch: 4, train_loss: 1.0345, test_loss: 1.0612, test_f1: 0.4864
 epoch: 5, train_loss: 1.0022, test_loss: 1.0726, test_f1: 0.4789
 epoch: 6, train_loss: 0.9826, test_loss: 1.0590, test_f1: 0.4685
 epoch: 7, train_loss: 0.9961, test_loss: 1.0614, test_f1: 0.4788
 epoch: 8, train_loss: 0.9808, test_loss: 1.0509, test_f1: 0.4889
 epoch: 9, train_loss: 0.9713, test_loss: 1.0530, test_f1: 0.5455
 epoch: 10, train_loss: 0.9332, test_loss: 1.0546, test_f1: 0.5210
 epoch: 11, train_loss: 0.9474, test_loss: 1.0608, test_f1: 0.5135
 epoch: 12, train_loss: 0.9452, test_loss: 1.0332, test_f1: 0.5023
 epoch: 13, train_loss: 0.9332, test_loss: 1.0822, test_f1: 0.5096
 epoch: 14, train_loss: 0.9347, test_loss: 1.0403, test_f1: 0.5192
 epoch: 15, train_loss: 0.9129, test_loss: 1.0493, test_f1: 0.5051
 epoch: 16, train_loss: 0.9264, test_loss: 1.0230, test_f1: 0.5682
 epoch: 17, train_loss: 0.9061, test_loss: 1.0568, test_f1: 0.5249
 epoch: 18, train_loss: 0.9153, test_loss: 1.0539, test_f1: 0.4858
 epoch: 19, train_loss: 0.8944, test_loss: 1.0510, test_f1: 0.5044
 epoch: 20, train_loss: 0.8953, test_loss: 1.0291, test_f1: 0.5218
 epoch: 21, train_loss: 0.8829, test_loss: 1.0507, test_f1: 0.5208
 epoch: 22, train_loss: 0.8996, test_loss: 1.1104, test_f1: 0.4645
 epoch: 23, train_loss: 0.8831, test_loss: 1.1035, test_f1: 0.4610
 epoch: 24, train_loss: 0.8855, test_loss: 1.0609, test_f1: 0.4788
 epoch: 25, train_loss: 0.8683, test_loss: 1.0149, test_f1: 0.5530
 epoch: 26, train_loss: 0.8690, test_loss: 1.0544, test_f1: 0.5297
 epoch: 27, train_loss: 0.8598, test_loss: 1.0672, test_f1: 0.4534
 epoch: 28, train_loss: 0.8623, test_loss: 1.1020, test_f1: 0.4848
 epoch: 29, train_loss: 0.8658, test_loss: 1.0213, test_f1: 0.4966
 epoch: 30, train_loss: 0.8508, test_loss: 1.0501, test_f1: 0.4919
 epoch: 31, train_loss: 0.8339, test_loss: 1.0643, test_f1: 0.4925
 epoch: 32, train_loss: 0.8392, test_loss: 1.0947, test_f1: 0.4726
 epoch: 33, train_loss: 0.8524, test_loss: 1.0297, test_f1: 0.5152
 epoch: 34, train_loss: 0.8301, test_loss: 1.0259, test_f1: 0.5130
 epoch: 35, train_loss: 0.8417, test_loss: 1.0386, test_f1: 0.5000
 epoch: 36, train_loss: 0.8349, test_loss: 1.0810, test_f1: 0.4857
 epoch: 37, train_loss: 0.8259, test_loss: 1.0277, test_f1: 0.5086
 epoch: 38, train_loss: 0.8269, test_loss: 1.0311, test_f1: 0.5291
 epoch: 39, train_loss: 0.8296, test_loss: 1.0494, test_f1: 0.4991
 epoch: 40, train_loss: 0.8208, test_loss: 1.0356, test_f1: 0.5210
 epoch: 41, train_loss: 0.8215, test_loss: 1.0667, test_f1: 0.5070
 epoch: 42, train_loss: 0.8246, test_loss: 1.0343, test_f1: 0.4923
 epoch: 43, train_loss: 0.8125, test_loss: 1.0341, test_f1: 0.5465
 epoch: 44, train_loss: 0.8102, test_loss: 1.0275, test_f1: 0.4996
 epoch: 45, train_loss: 0.7980, test_loss: 1.0249, test_f1: 0.5314
 epoch: 46, train_loss: 0.8086, test_loss: 1.0354, test_f1: 0.5035
 epoch: 47, train_loss: 0.8078, test_loss: 1.0090, test_f1: 0.5428
 epoch: 48, train_loss: 0.7967, test_loss: 1.0129, test_f1: 0.5200
 epoch: 49, train_loss: 0.7973, test_loss: 1.0712, test_f1: 0.4663
 epoch: 50, train_loss: 0.8075, test_loss: 1.0613, test_f1: 0.5192
 epoch: 51, train_loss: 0.8086, test_loss: 1.0165, test_f1: 0.5487
 epoch: 52, train_loss: 0.7989, test_loss: 1.0086, test_f1: 0.5344
 epoch: 53, train_loss: 0.7757, test_loss: 1.0176, test_f1: 0.5430
 epoch: 54, train_loss: 0.7728, test_loss: 1.0251, test_f1: 0.5326
 epoch: 55, train_loss: 0.7910, test_loss: 1.0233, test_f1: 0.5412
 epoch: 56, train_loss: 0.7630, test_loss: 1.0300, test_f1: 0.5347
 epoch: 57, train_loss: 0.7796, test_loss: 1.0147, test_f1: 0.5359
 epoch: 58, train_loss: 0.7938, test_loss: 1.0141, test_f1: 0.5418
 epoch: 59, train_loss: 0.7676, test_loss: 1.0232, test_f1: 0.5432
 epoch: 60, train_loss: 0.7671, test_loss: 1.0228, test_f1: 0.5431
 epoch: 61, train_loss: 0.7656, test_loss: 1.0278, test_f1: 0.5118
 epoch: 62, train_loss: 0.7737, test_loss: 1.0242, test_f1: 0.5072
 epoch: 63, train_loss: 0.7620, test_loss: 1.0277, test_f1: 0.5348
 epoch: 64, train_loss: 0.7784, test_loss: 1.0221, test_f1: 0.5619
 epoch: 65, train_loss: 0.7833, test_loss: 1.0110, test_f1: 0.5780
 epoch: 66, train_loss: 0.7733, test_loss: 1.0147, test_f1: 0.5439
 epoch: 67, train_loss: 0.7616, test_loss: 1.0136, test_f1: 0.5628
 epoch: 68, train_loss: 0.7559, test_loss: 1.0186, test_f1: 0.5631
 epoch: 69, train_loss: 0.7444, test_loss: 1.0143, test_f1: 0.5700
 epoch: 70, train_loss: 0.7535, test_loss: 1.0090, test_f1: 0.5349
 epoch: 71, train_loss: 0.7677, test_loss: 1.0155, test_f1: 0.5457
 epoch: 72, train_loss: 0.7581, test_loss: 1.0343, test_f1: 0.5320
 epoch: 73, train_loss: 0.7567, test_loss: 1.0249, test_f1: 0.5559
 epoch: 74, train_loss: 0.7632, test_loss: 1.0165, test_f1: 0.5800
 epoch: 75, train_loss: 0.7474, test_loss: 1.0191, test_f1: 0.5074
 epoch: 76, train_loss: 0.7608, test_loss: 1.0212, test_f1: 0.5816
 epoch: 77, train_loss: 0.7573, test_loss: 1.0225, test_f1: 0.5961
 epoch: 78, train_loss: 0.7613, test_loss: 1.0299, test_f1: 0.5623
 epoch: 79, train_loss: 0.7600, test_loss: 1.0241, test_f1: 0.5755
 epoch: 80, train_loss: 0.7577, test_loss: 1.0267, test_f1: 0.5633
 epoch: 81, train_loss: 0.7596, test_loss: 1.0151, test_f1: 0.5854
 epoch: 82, train_loss: 0.7406, test_loss: 1.0250, test_f1: 0.5499
 epoch: 83, train_loss: 0.7623, test_loss: 1.0076, test_f1: 0.5617
 epoch: 84, train_loss: 0.7463, test_loss: 1.0224, test_f1: 0.5933
 epoch: 85, train_loss: 0.7411, test_loss: 1.0382, test_f1: 0.5290
 epoch: 86, train_loss: 0.7495, test_loss: 1.0228, test_f1: 0.5671
 epoch: 87, train_loss: 0.7431, test_loss: 1.0287, test_f1: 0.5389
 epoch: 88, train_loss: 0.7270, test_loss: 1.0392, test_f1: 0.5588
 epoch: 89, train_loss: 0.7525, test_loss: 1.0263, test_f1: 0.5592
 epoch: 90, train_loss: 0.7547, test_loss: 1.0205, test_f1: 0.5796
 epoch: 91, train_loss: 0.7427, test_loss: 1.0043, test_f1: 0.5700
 epoch: 92, train_loss: 0.7361, test_loss: 1.0115, test_f1: 0.5707
 epoch: 93, train_loss: 0.7579, test_loss: 1.0285, test_f1: 0.5710
 epoch: 94, train_loss: 0.7362, test_loss: 1.0145, test_f1: 0.5407
 epoch: 95, train_loss: 0.7372, test_loss: 1.0046, test_f1: 0.5992
 epoch: 96, train_loss: 0.7340, test_loss: 1.0030, test_f1: 0.5980
 epoch: 97, train_loss: 0.7452, test_loss: 1.0209, test_f1: 0.5602
 epoch: 98, train_loss: 0.7361, test_loss: 1.0232, test_f1: 0.6039
 epoch: 99, train_loss: 0.7484, test_loss: 1.0413, test_f1: 0.5745
##################ITERATION #7 ****************************************
 epoch: 0, train_loss: 1.4305, test_loss: 1.2766, test_f1: 0.3321
 epoch: 1, train_loss: 1.1950, test_loss: 1.1986, test_f1: 0.4117
 epoch: 2, train_loss: 1.1563, test_loss: 1.1892, test_f1: 0.4140
 epoch: 3, train_loss: 1.1211, test_loss: 1.1677, test_f1: 0.4078
 epoch: 4, train_loss: 1.1046, test_loss: 1.1559, test_f1: 0.4172
 epoch: 5, train_loss: 1.1008, test_loss: 1.1110, test_f1: 0.4380
 epoch: 6, train_loss: 1.0712, test_loss: 1.1052, test_f1: 0.4510
 epoch: 7, train_loss: 1.0723, test_loss: 1.0789, test_f1: 0.4979
 epoch: 8, train_loss: 1.0516, test_loss: 1.0519, test_f1: 0.5011
 epoch: 9, train_loss: 1.0442, test_loss: 1.0524, test_f1: 0.5080
 epoch: 10, train_loss: 1.0078, test_loss: 1.0546, test_f1: 0.5261
 epoch: 11, train_loss: 1.0129, test_loss: 1.0286, test_f1: 0.5327
 epoch: 12, train_loss: 1.0121, test_loss: 1.0029, test_f1: 0.5331
 epoch: 13, train_loss: 0.9909, test_loss: 1.0119, test_f1: 0.5383
 epoch: 14, train_loss: 0.9838, test_loss: 1.0229, test_f1: 0.5261
 epoch: 15, train_loss: 0.9908, test_loss: 0.9995, test_f1: 0.5085
 epoch: 16, train_loss: 0.9696, test_loss: 1.0009, test_f1: 0.4998
 epoch: 17, train_loss: 0.9515, test_loss: 1.0051, test_f1: 0.5378
 epoch: 18, train_loss: 0.9487, test_loss: 0.9820, test_f1: 0.5373
 epoch: 19, train_loss: 0.9502, test_loss: 0.9875, test_f1: 0.5268
 epoch: 20, train_loss: 0.9351, test_loss: 0.9893, test_f1: 0.5018
 epoch: 21, train_loss: 0.9487, test_loss: 0.9928, test_f1: 0.5376
 epoch: 22, train_loss: 0.9165, test_loss: 0.9889, test_f1: 0.5230
 epoch: 23, train_loss: 0.9081, test_loss: 0.9826, test_f1: 0.5264
 epoch: 24, train_loss: 0.9116, test_loss: 0.9847, test_f1: 0.5397
 epoch: 25, train_loss: 0.9108, test_loss: 0.9701, test_f1: 0.5332
 epoch: 26, train_loss: 0.9053, test_loss: 0.9842, test_f1: 0.5248
 epoch: 27, train_loss: 0.8994, test_loss: 0.9997, test_f1: 0.5155
 epoch: 28, train_loss: 0.8967, test_loss: 0.9801, test_f1: 0.5389
 epoch: 29, train_loss: 0.8847, test_loss: 1.0054, test_f1: 0.5159
 epoch: 30, train_loss: 0.8746, test_loss: 0.9920, test_f1: 0.5266
 epoch: 31, train_loss: 0.8850, test_loss: 0.9933, test_f1: 0.5189
 epoch: 32, train_loss: 0.8765, test_loss: 0.9785, test_f1: 0.5200
 epoch: 33, train_loss: 0.8734, test_loss: 1.0019, test_f1: 0.4991
 epoch: 34, train_loss: 0.8737, test_loss: 0.9958, test_f1: 0.5103
 epoch: 35, train_loss: 0.8385, test_loss: 0.9873, test_f1: 0.5369
 epoch: 36, train_loss: 0.8610, test_loss: 1.0121, test_f1: 0.5235
 epoch: 37, train_loss: 0.8473, test_loss: 0.9987, test_f1: 0.5493
 epoch: 38, train_loss: 0.8386, test_loss: 1.0311, test_f1: 0.5223
 epoch: 39, train_loss: 0.8538, test_loss: 1.0129, test_f1: 0.5011
 epoch: 40, train_loss: 0.8568, test_loss: 1.0530, test_f1: 0.5113
 epoch: 41, train_loss: 0.8650, test_loss: 1.0038, test_f1: 0.5533
 epoch: 42, train_loss: 0.8240, test_loss: 1.0223, test_f1: 0.5168
 epoch: 43, train_loss: 0.8453, test_loss: 1.0088, test_f1: 0.5256
 epoch: 44, train_loss: 0.8305, test_loss: 1.0625, test_f1: 0.5428
 epoch: 45, train_loss: 0.8381, test_loss: 1.0219, test_f1: 0.5291
 epoch: 46, train_loss: 0.8437, test_loss: 1.0471, test_f1: 0.5028
 epoch: 47, train_loss: 0.8156, test_loss: 1.0902, test_f1: 0.5172
 epoch: 48, train_loss: 0.8390, test_loss: 1.0541, test_f1: 0.5172
 epoch: 49, train_loss: 0.8246, test_loss: 1.0201, test_f1: 0.5047
 epoch: 50, train_loss: 0.7995, test_loss: 1.0720, test_f1: 0.5041
 epoch: 51, train_loss: 0.8108, test_loss: 1.0511, test_f1: 0.5233
 epoch: 52, train_loss: 0.7979, test_loss: 1.0319, test_f1: 0.5485
 epoch: 53, train_loss: 0.8130, test_loss: 1.0301, test_f1: 0.5158
 epoch: 54, train_loss: 0.8035, test_loss: 1.0375, test_f1: 0.5184
 epoch: 55, train_loss: 0.8067, test_loss: 1.0400, test_f1: 0.5406
 epoch: 56, train_loss: 0.8136, test_loss: 1.0341, test_f1: 0.5247
 epoch: 57, train_loss: 0.8083, test_loss: 1.0538, test_f1: 0.5245
 epoch: 58, train_loss: 0.7946, test_loss: 1.0570, test_f1: 0.5484
 epoch: 59, train_loss: 0.7869, test_loss: 1.0278, test_f1: 0.5564
 epoch: 60, train_loss: 0.7970, test_loss: 1.0384, test_f1: 0.5417
 epoch: 61, train_loss: 0.7905, test_loss: 1.0251, test_f1: 0.5446
 epoch: 62, train_loss: 0.7877, test_loss: 1.0455, test_f1: 0.5722
 epoch: 63, train_loss: 0.7863, test_loss: 1.0513, test_f1: 0.5342
 epoch: 64, train_loss: 0.7774, test_loss: 1.0683, test_f1: 0.5599
 epoch: 65, train_loss: 0.7956, test_loss: 1.0380, test_f1: 0.5355
 epoch: 66, train_loss: 0.7828, test_loss: 1.0246, test_f1: 0.5331
 epoch: 67, train_loss: 0.7808, test_loss: 1.0449, test_f1: 0.5598
 epoch: 68, train_loss: 0.7827, test_loss: 1.0323, test_f1: 0.5471
 epoch: 69, train_loss: 0.7667, test_loss: 1.0834, test_f1: 0.5440
 epoch: 70, train_loss: 0.7698, test_loss: 1.0759, test_f1: 0.5247
 epoch: 71, train_loss: 0.7842, test_loss: 1.0586, test_f1: 0.5518
 epoch: 72, train_loss: 0.7852, test_loss: 1.0528, test_f1: 0.5374
 epoch: 73, train_loss: 0.7787, test_loss: 1.0653, test_f1: 0.5478
 epoch: 74, train_loss: 0.7882, test_loss: 1.0826, test_f1: 0.5603
 epoch: 75, train_loss: 0.7770, test_loss: 1.0742, test_f1: 0.5280
 epoch: 76, train_loss: 0.7718, test_loss: 1.0682, test_f1: 0.5342
 epoch: 77, train_loss: 0.7783, test_loss: 1.0616, test_f1: 0.5418
 epoch: 78, train_loss: 0.7701, test_loss: 1.0655, test_f1: 0.5553
 epoch: 79, train_loss: 0.7665, test_loss: 1.0530, test_f1: 0.5351
 epoch: 80, train_loss: 0.7853, test_loss: 1.0456, test_f1: 0.5600
 epoch: 81, train_loss: 0.7650, test_loss: 1.0730, test_f1: 0.5475
 epoch: 82, train_loss: 0.7591, test_loss: 1.0863, test_f1: 0.5253
 epoch: 83, train_loss: 0.7596, test_loss: 1.0428, test_f1: 0.5702
 epoch: 84, train_loss: 0.7698, test_loss: 1.0310, test_f1: 0.5601
 epoch: 85, train_loss: 0.7641, test_loss: 1.0435, test_f1: 0.5485
 epoch: 86, train_loss: 0.7739, test_loss: 1.0637, test_f1: 0.5555
 epoch: 87, train_loss: 0.7520, test_loss: 1.0732, test_f1: 0.5711
 epoch: 88, train_loss: 0.7599, test_loss: 1.0561, test_f1: 0.5545
 epoch: 89, train_loss: 0.7550, test_loss: 1.0753, test_f1: 0.5748
 epoch: 90, train_loss: 0.7535, test_loss: 1.0691, test_f1: 0.5360
 epoch: 91, train_loss: 0.7634, test_loss: 1.0584, test_f1: 0.5521
 epoch: 92, train_loss: 0.7701, test_loss: 1.0466, test_f1: 0.5608
 epoch: 93, train_loss: 0.7581, test_loss: 1.1018, test_f1: 0.5497
 epoch: 94, train_loss: 0.7628, test_loss: 1.0862, test_f1: 0.5545
 epoch: 95, train_loss: 0.7593, test_loss: 1.0983, test_f1: 0.5519
 epoch: 96, train_loss: 0.7416, test_loss: 1.0574, test_f1: 0.5684
 epoch: 97, train_loss: 0.7464, test_loss: 1.0997, test_f1: 0.5345
 epoch: 98, train_loss: 0.7603, test_loss: 1.0836, test_f1: 0.5646
 epoch: 99, train_loss: 0.7435, test_loss: 1.0883, test_f1: 0.5453
##################ITERATION #8 ****************************************
 epoch: 0, train_loss: 1.4397, test_loss: 1.2720, test_f1: 0.3323
 epoch: 1, train_loss: 1.1777, test_loss: 1.2367, test_f1: 0.3776
 epoch: 2, train_loss: 1.1722, test_loss: 1.2593, test_f1: 0.3251
 epoch: 3, train_loss: 1.1218, test_loss: 1.1977, test_f1: 0.3829
 epoch: 4, train_loss: 1.1040, test_loss: 1.1741, test_f1: 0.3822
 epoch: 5, train_loss: 1.0747, test_loss: 1.1815, test_f1: 0.3987
 epoch: 6, train_loss: 1.0699, test_loss: 1.1715, test_f1: 0.4128
 epoch: 7, train_loss: 1.0518, test_loss: 1.1615, test_f1: 0.4375
 epoch: 8, train_loss: 1.0261, test_loss: 1.1334, test_f1: 0.4387
 epoch: 9, train_loss: 1.0184, test_loss: 1.1247, test_f1: 0.4269
 epoch: 10, train_loss: 1.0105, test_loss: 1.1284, test_f1: 0.4301
 epoch: 11, train_loss: 1.0032, test_loss: 1.1207, test_f1: 0.4394
 epoch: 12, train_loss: 0.9967, test_loss: 1.1140, test_f1: 0.4380
 epoch: 13, train_loss: 0.9608, test_loss: 1.1079, test_f1: 0.4697
 epoch: 14, train_loss: 0.9698, test_loss: 1.1069, test_f1: 0.4520
 epoch: 15, train_loss: 0.9812, test_loss: 1.1017, test_f1: 0.4559
 epoch: 16, train_loss: 0.9658, test_loss: 1.1149, test_f1: 0.4561
 epoch: 17, train_loss: 0.9510, test_loss: 1.0865, test_f1: 0.4726
 epoch: 18, train_loss: 0.9339, test_loss: 1.0884, test_f1: 0.4821
 epoch: 19, train_loss: 0.9269, test_loss: 1.0940, test_f1: 0.4804
 epoch: 20, train_loss: 0.9407, test_loss: 1.0748, test_f1: 0.4897
 epoch: 21, train_loss: 0.9204, test_loss: 1.0485, test_f1: 0.4853
 epoch: 22, train_loss: 0.9202, test_loss: 1.0900, test_f1: 0.4809
 epoch: 23, train_loss: 0.9120, test_loss: 1.0299, test_f1: 0.5033
 epoch: 24, train_loss: 0.9194, test_loss: 1.0395, test_f1: 0.4933
 epoch: 25, train_loss: 0.8894, test_loss: 1.0453, test_f1: 0.4946
 epoch: 26, train_loss: 0.8993, test_loss: 1.0643, test_f1: 0.4821
 epoch: 27, train_loss: 0.9009, test_loss: 1.0347, test_f1: 0.5083
 epoch: 28, train_loss: 0.8959, test_loss: 1.0769, test_f1: 0.4711
 epoch: 29, train_loss: 0.8929, test_loss: 1.0743, test_f1: 0.4894
 epoch: 30, train_loss: 0.8919, test_loss: 1.0522, test_f1: 0.4934
 epoch: 31, train_loss: 0.8879, test_loss: 1.0346, test_f1: 0.5057
 epoch: 32, train_loss: 0.8736, test_loss: 1.0304, test_f1: 0.5118
 epoch: 33, train_loss: 0.8754, test_loss: 1.0308, test_f1: 0.5108
 epoch: 34, train_loss: 0.8579, test_loss: 1.0468, test_f1: 0.4963
 epoch: 35, train_loss: 0.8653, test_loss: 1.0352, test_f1: 0.4843
 epoch: 36, train_loss: 0.8592, test_loss: 1.0160, test_f1: 0.4951
 epoch: 37, train_loss: 0.8532, test_loss: 1.1093, test_f1: 0.5127
 epoch: 38, train_loss: 0.8606, test_loss: 1.0493, test_f1: 0.5297
 epoch: 39, train_loss: 0.8484, test_loss: 1.0303, test_f1: 0.4844
 epoch: 40, train_loss: 0.8585, test_loss: 1.0187, test_f1: 0.4989
 epoch: 41, train_loss: 0.8461, test_loss: 0.9880, test_f1: 0.5321
 epoch: 42, train_loss: 0.8452, test_loss: 0.9884, test_f1: 0.5247
 epoch: 43, train_loss: 0.8402, test_loss: 1.0678, test_f1: 0.5288
 epoch: 44, train_loss: 0.8369, test_loss: 1.0527, test_f1: 0.4997
 epoch: 45, train_loss: 0.8442, test_loss: 1.0850, test_f1: 0.5292
 epoch: 46, train_loss: 0.8263, test_loss: 1.0326, test_f1: 0.5436
 epoch: 47, train_loss: 0.8300, test_loss: 1.0420, test_f1: 0.5477
 epoch: 48, train_loss: 0.8360, test_loss: 1.0189, test_f1: 0.5302
 epoch: 49, train_loss: 0.8187, test_loss: 1.0499, test_f1: 0.5355
 epoch: 50, train_loss: 0.8303, test_loss: 1.0722, test_f1: 0.5492
 epoch: 51, train_loss: 0.8148, test_loss: 1.0401, test_f1: 0.5485
 epoch: 52, train_loss: 0.8068, test_loss: 1.0119, test_f1: 0.5341
 epoch: 53, train_loss: 0.7980, test_loss: 1.0356, test_f1: 0.5323
 epoch: 54, train_loss: 0.7961, test_loss: 1.0285, test_f1: 0.5109
 epoch: 55, train_loss: 0.7966, test_loss: 1.0377, test_f1: 0.4989
 epoch: 56, train_loss: 0.7966, test_loss: 1.0610, test_f1: 0.5094
 epoch: 57, train_loss: 0.7975, test_loss: 1.0165, test_f1: 0.5464
 epoch: 58, train_loss: 0.8075, test_loss: 1.0338, test_f1: 0.5104
 epoch: 59, train_loss: 0.7972, test_loss: 1.0362, test_f1: 0.5227
 epoch: 60, train_loss: 0.7862, test_loss: 1.0339, test_f1: 0.5134
 epoch: 61, train_loss: 0.7972, test_loss: 1.0379, test_f1: 0.5302
 epoch: 62, train_loss: 0.7794, test_loss: 1.0251, test_f1: 0.5077
 epoch: 63, train_loss: 0.7916, test_loss: 1.0678, test_f1: 0.4949
 epoch: 64, train_loss: 0.7947, test_loss: 1.0466, test_f1: 0.5316
 epoch: 65, train_loss: 0.7905, test_loss: 1.0279, test_f1: 0.5235
 epoch: 66, train_loss: 0.7922, test_loss: 1.0543, test_f1: 0.5420
 epoch: 67, train_loss: 0.7856, test_loss: 1.0106, test_f1: 0.5231
 epoch: 68, train_loss: 0.7957, test_loss: 1.0252, test_f1: 0.5095
 epoch: 69, train_loss: 0.7706, test_loss: 1.0612, test_f1: 0.5049
 epoch: 70, train_loss: 0.7827, test_loss: 1.0733, test_f1: 0.5449
 epoch: 71, train_loss: 0.7885, test_loss: 1.0507, test_f1: 0.5355
 epoch: 72, train_loss: 0.7729, test_loss: 1.0372, test_f1: 0.5393
 epoch: 73, train_loss: 0.7720, test_loss: 1.0443, test_f1: 0.5242
 epoch: 74, train_loss: 0.7810, test_loss: 1.0578, test_f1: 0.5791
 epoch: 75, train_loss: 0.7921, test_loss: 1.0907, test_f1: 0.5255
 epoch: 76, train_loss: 0.7721, test_loss: 1.0459, test_f1: 0.5245
 epoch: 77, train_loss: 0.7694, test_loss: 1.0473, test_f1: 0.5386
 epoch: 78, train_loss: 0.7784, test_loss: 1.0223, test_f1: 0.5513
 epoch: 79, train_loss: 0.7671, test_loss: 1.0386, test_f1: 0.5174
 epoch: 80, train_loss: 0.7957, test_loss: 1.0613, test_f1: 0.5634
 epoch: 81, train_loss: 0.7613, test_loss: 1.0660, test_f1: 0.5273
 epoch: 82, train_loss: 0.7672, test_loss: 1.0602, test_f1: 0.5294
 epoch: 83, train_loss: 0.7665, test_loss: 1.0382, test_f1: 0.5431
 epoch: 84, train_loss: 0.7644, test_loss: 1.0465, test_f1: 0.5807
 epoch: 85, train_loss: 0.7621, test_loss: 1.0496, test_f1: 0.5451
 epoch: 86, train_loss: 0.7654, test_loss: 1.0183, test_f1: 0.5552
 epoch: 87, train_loss: 0.7499, test_loss: 1.0606, test_f1: 0.5435
 epoch: 88, train_loss: 0.7529, test_loss: 1.0411, test_f1: 0.5687
 epoch: 89, train_loss: 0.7494, test_loss: 1.0782, test_f1: 0.5630
 epoch: 90, train_loss: 0.7590, test_loss: 1.0433, test_f1: 0.5419
 epoch: 91, train_loss: 0.7592, test_loss: 1.0009, test_f1: 0.5380
 epoch: 92, train_loss: 0.7697, test_loss: 1.0399, test_f1: 0.5553
 epoch: 93, train_loss: 0.7482, test_loss: 1.0478, test_f1: 0.5188
 epoch: 94, train_loss: 0.7560, test_loss: 1.0302, test_f1: 0.5834
 epoch: 95, train_loss: 0.7526, test_loss: 1.0609, test_f1: 0.5701
 epoch: 96, train_loss: 0.7501, test_loss: 1.0178, test_f1: 0.5470
 epoch: 97, train_loss: 0.7466, test_loss: 1.0021, test_f1: 0.5755
 epoch: 98, train_loss: 0.7376, test_loss: 1.0416, test_f1: 0.5676
 epoch: 99, train_loss: 0.7609, test_loss: 1.0244, test_f1: 0.5520
##################ITERATION #9 ****************************************
 epoch: 0, train_loss: 1.5320, test_loss: 1.3184, test_f1: 0.3314
 epoch: 1, train_loss: 1.1894, test_loss: 1.3114, test_f1: 0.3699
 epoch: 2, train_loss: 1.1507, test_loss: 1.2467, test_f1: 0.4206
 epoch: 3, train_loss: 1.1055, test_loss: 1.1742, test_f1: 0.4283
 epoch: 4, train_loss: 1.0970, test_loss: 1.1428, test_f1: 0.4564
 epoch: 5, train_loss: 1.0636, test_loss: 1.1410, test_f1: 0.4651
 epoch: 6, train_loss: 1.0469, test_loss: 1.1342, test_f1: 0.4797
 epoch: 7, train_loss: 1.0267, test_loss: 1.1129, test_f1: 0.4966
 epoch: 8, train_loss: 1.0258, test_loss: 1.0966, test_f1: 0.5055
 epoch: 9, train_loss: 0.9973, test_loss: 1.1182, test_f1: 0.4731
 epoch: 10, train_loss: 0.9794, test_loss: 1.0838, test_f1: 0.5150
 epoch: 11, train_loss: 0.9782, test_loss: 1.0808, test_f1: 0.5019
 epoch: 12, train_loss: 0.9761, test_loss: 1.0689, test_f1: 0.5206
 epoch: 13, train_loss: 0.9773, test_loss: 1.0722, test_f1: 0.5278
 epoch: 14, train_loss: 0.9501, test_loss: 1.0794, test_f1: 0.5157
 epoch: 15, train_loss: 0.9554, test_loss: 1.0753, test_f1: 0.5180
 epoch: 16, train_loss: 0.9499, test_loss: 1.1075, test_f1: 0.4921
 epoch: 17, train_loss: 0.9403, test_loss: 1.0665, test_f1: 0.5181
 epoch: 18, train_loss: 0.9484, test_loss: 1.0414, test_f1: 0.5587
 epoch: 19, train_loss: 0.9330, test_loss: 1.0287, test_f1: 0.5462
 epoch: 20, train_loss: 0.9318, test_loss: 1.0525, test_f1: 0.5626
 epoch: 21, train_loss: 0.9284, test_loss: 1.1437, test_f1: 0.5146
 epoch: 22, train_loss: 0.9125, test_loss: 1.0829, test_f1: 0.5280
 epoch: 23, train_loss: 0.9178, test_loss: 1.0582, test_f1: 0.5159
 epoch: 24, train_loss: 0.9062, test_loss: 1.0621, test_f1: 0.5441
 epoch: 25, train_loss: 0.8832, test_loss: 1.0583, test_f1: 0.5223
 epoch: 26, train_loss: 0.8848, test_loss: 1.0441, test_f1: 0.5313
 epoch: 27, train_loss: 0.8835, test_loss: 1.0786, test_f1: 0.5425
 epoch: 28, train_loss: 0.8756, test_loss: 1.0257, test_f1: 0.5461
 epoch: 29, train_loss: 0.8675, test_loss: 1.0277, test_f1: 0.5500
 epoch: 30, train_loss: 0.8882, test_loss: 1.1438, test_f1: 0.5164
 epoch: 31, train_loss: 0.8710, test_loss: 1.0033, test_f1: 0.5413
 epoch: 32, train_loss: 0.8698, test_loss: 1.0366, test_f1: 0.5353
 epoch: 33, train_loss: 0.8860, test_loss: 1.0280, test_f1: 0.5361
 epoch: 34, train_loss: 0.8715, test_loss: 1.0217, test_f1: 0.5533
 epoch: 35, train_loss: 0.8456, test_loss: 1.0361, test_f1: 0.5413
 epoch: 36, train_loss: 0.8588, test_loss: 1.0740, test_f1: 0.5651
 epoch: 37, train_loss: 0.8563, test_loss: 1.0371, test_f1: 0.5298
 epoch: 38, train_loss: 0.8666, test_loss: 1.0461, test_f1: 0.5229
 epoch: 39, train_loss: 0.8435, test_loss: 1.0621, test_f1: 0.5215
 epoch: 40, train_loss: 0.8176, test_loss: 1.0459, test_f1: 0.5632
 epoch: 41, train_loss: 0.8480, test_loss: 1.0602, test_f1: 0.5143
 epoch: 42, train_loss: 0.8443, test_loss: 1.0330, test_f1: 0.5585
 epoch: 43, train_loss: 0.8234, test_loss: 1.0287, test_f1: 0.5381
 epoch: 44, train_loss: 0.8190, test_loss: 1.0846, test_f1: 0.5237
 epoch: 45, train_loss: 0.8260, test_loss: 1.0571, test_f1: 0.5479
 epoch: 46, train_loss: 0.8241, test_loss: 1.0247, test_f1: 0.5563
 epoch: 47, train_loss: 0.8199, test_loss: 1.0947, test_f1: 0.5553
 epoch: 48, train_loss: 0.8161, test_loss: 0.9968, test_f1: 0.5699
 epoch: 49, train_loss: 0.8152, test_loss: 1.0629, test_f1: 0.5183
 epoch: 50, train_loss: 0.8095, test_loss: 1.0498, test_f1: 0.5289
 epoch: 51, train_loss: 0.7931, test_loss: 1.0454, test_f1: 0.5271
 epoch: 52, train_loss: 0.7936, test_loss: 1.0270, test_f1: 0.5449
 epoch: 53, train_loss: 0.7859, test_loss: 1.0685, test_f1: 0.5163
 epoch: 54, train_loss: 0.8042, test_loss: 1.0126, test_f1: 0.5596
 epoch: 55, train_loss: 0.7928, test_loss: 1.0410, test_f1: 0.5213
 epoch: 56, train_loss: 0.7824, test_loss: 1.0276, test_f1: 0.5582
 epoch: 57, train_loss: 0.7804, test_loss: 1.0485, test_f1: 0.5252
 epoch: 58, train_loss: 0.7910, test_loss: 1.0598, test_f1: 0.5088
 epoch: 59, train_loss: 0.7699, test_loss: 1.0267, test_f1: 0.5436
 epoch: 60, train_loss: 0.7787, test_loss: 1.0622, test_f1: 0.5214
 epoch: 61, train_loss: 0.8002, test_loss: 1.0940, test_f1: 0.5248
 epoch: 62, train_loss: 0.7805, test_loss: 1.0140, test_f1: 0.5460
 epoch: 63, train_loss: 0.7769, test_loss: 1.0544, test_f1: 0.5449
 epoch: 64, train_loss: 0.7631, test_loss: 1.0525, test_f1: 0.5244
 epoch: 65, train_loss: 0.7733, test_loss: 1.0682, test_f1: 0.5636
 epoch: 66, train_loss: 0.7667, test_loss: 1.0701, test_f1: 0.5228
 epoch: 67, train_loss: 0.7724, test_loss: 1.0428, test_f1: 0.5665
 epoch: 68, train_loss: 0.7633, test_loss: 1.0493, test_f1: 0.5338
 epoch: 69, train_loss: 0.7610, test_loss: 1.0611, test_f1: 0.5912
 epoch: 70, train_loss: 0.7600, test_loss: 1.0766, test_f1: 0.5583
 epoch: 71, train_loss: 0.7643, test_loss: 1.0281, test_f1: 0.5814
 epoch: 72, train_loss: 0.7646, test_loss: 1.0424, test_f1: 0.5353
 epoch: 73, train_loss: 0.7512, test_loss: 1.1207, test_f1: 0.5254
 epoch: 74, train_loss: 0.7528, test_loss: 1.0349, test_f1: 0.5436
 epoch: 75, train_loss: 0.7492, test_loss: 1.0930, test_f1: 0.5293
 epoch: 76, train_loss: 0.7407, test_loss: 1.0197, test_f1: 0.5700
 epoch: 77, train_loss: 0.7554, test_loss: 1.0133, test_f1: 0.5489
 epoch: 78, train_loss: 0.7677, test_loss: 1.0643, test_f1: 0.5749
 epoch: 79, train_loss: 0.7385, test_loss: 1.0486, test_f1: 0.5730
 epoch: 80, train_loss: 0.7498, test_loss: 1.0414, test_f1: 0.5831
 epoch: 81, train_loss: 0.7426, test_loss: 1.0452, test_f1: 0.5648
 epoch: 82, train_loss: 0.7582, test_loss: 1.0867, test_f1: 0.5736
 epoch: 83, train_loss: 0.7360, test_loss: 1.0463, test_f1: 0.5627
 epoch: 84, train_loss: 0.7443, test_loss: 1.0873, test_f1: 0.5686
 epoch: 85, train_loss: 0.7539, test_loss: 0.9664, test_f1: 0.6066
 epoch: 86, train_loss: 0.7316, test_loss: 1.0107, test_f1: 0.5787
 epoch: 87, train_loss: 0.7295, test_loss: 1.0323, test_f1: 0.5718
 epoch: 88, train_loss: 0.7442, test_loss: 1.0376, test_f1: 0.5912
 epoch: 89, train_loss: 0.7197, test_loss: 1.0385, test_f1: 0.5769
 epoch: 90, train_loss: 0.7451, test_loss: 1.0858, test_f1: 0.5345
 epoch: 91, train_loss: 0.7417, test_loss: 1.0180, test_f1: 0.5686
 epoch: 92, train_loss: 0.7284, test_loss: 1.0425, test_f1: 0.5537
 epoch: 93, train_loss: 0.7369, test_loss: 1.0069, test_f1: 0.5552
 epoch: 94, train_loss: 0.7364, test_loss: 1.0244, test_f1: 0.5779
 epoch: 95, train_loss: 0.7441, test_loss: 1.0309, test_f1: 0.5858
 epoch: 96, train_loss: 0.7362, test_loss: 0.9989, test_f1: 0.5910
 epoch: 97, train_loss: 0.7474, test_loss: 1.0378, test_f1: 0.5676
 epoch: 98, train_loss: 0.7164, test_loss: 1.0243, test_f1: 0.5860
 epoch: 99, train_loss: 0.7256, test_loss: 1.0463, test_f1: 0.5839

Training completed in 497.81 seconds
Best F1: 0.6366 at epoch 66
Mean F1 across iterations: 0.6027  0.0175
========================FINAL RESULTS================================
FEGIN weighted F1: 0.6366  0.0175
python main.py --data ltspice_demos --representation component_net --model FEGIN --layers 2 --hiddens 16 --batch_size 32 --lr 0.001 --emb_size 250 --epochs 100 --save_appendix component_net_L2_H16_BS32_LR0.001_E250 --no_val
-----



STDERR:
  File "main.py", line 370, in <module>
    main()
  File "main.py", line 254, in main
    dataset = dataset_class(
  File "/home/philip/projects/ltspice_examples_code_repo/Circuit-Completion-Using-GNNs/component_classification_with_link_prediction_head/evaluation/FEGIN/kernel/circuit_datasets.py", line 15, in __init__
    self.data, self.slices = torch.load(self.processed_paths[0])
  File "/home/philip/.local/lib/python3.8/site-packages/torch/serialization.py", line 1040, in load
    warnings.warn(
  File "/usr/lib/python3.8/warnings.py", line 109, in _showwarnmsg
    sw(msg.message, msg.category, msg.filename, msg.lineno,
  File "main.py", line 47, in warn_with_traceback
    traceback.print_stack(file=log)
/home/philip/projects/ltspice_examples_code_repo/Circuit-Completion-Using-GNNs/component_classification_with_link_prediction_head/evaluation/FEGIN/kernel/circuit_datasets.py:15: FutureWarning: You are using `torch.load` with `weights_only=False` (the current default value), which uses the default pickle module implicitly. It is possible to construct malicious pickle data which will execute arbitrary code during unpickling (See https://github.com/pytorch/pytorch/blob/main/SECURITY.md#untrusted-models for more details). In a future release, the default value for `weights_only` will be flipped to `True`. This limits the functions that could be executed during unpickling. Arbitrary objects will no longer be allowed to be loaded via this mode unless they are explicitly allowlisted by the user via `torch.serialization.add_safe_globals`. We recommend you start setting `weights_only=True` for any use case where you don't have full control of the loaded file. Please open an issue on GitHub for any issues related to this experimental feature.
  self.data, self.slices = torch.load(self.processed_paths[0])
