STDOUT:
Results will be saved in /home/philip/projects/ltspice_examples_code_repo/Circuit-Completion-Using-GNNs/component_classification_with_link_prediction_head/evaluation/FEGIN/results/model_FEGIN_dataset_ltspice_demos
Command line input: python main.py --data ltspice_demos --representation component_pin_net --model FEGIN --layers 6 --hiddens 16 --batch_size 64 --lr 0.01 --emb_size 512 --epochs 100 --save_appendix component_pin_net_L6_H16_BS64_LR0.01_E512 --no_val
 is saved.
-----
ltspice_demos - FEGIN
Using 6 layers, 16 hidden units, h = 2
Loading component_pin_net representation dataset
ENTERED
Training FEGIN on component_pin_net representation
Train: 1565, Test: 383
##################ITERATION #0 ****************************************
 epoch: 0, train_loss: 1.2469, test_loss: 1.4820, test_f1: 0.2279
 epoch: 1, train_loss: 1.0553, test_loss: 1.1487, test_f1: 0.4078
 epoch: 2, train_loss: 1.0390, test_loss: 1.2264, test_f1: 0.4199
 epoch: 3, train_loss: 1.0146, test_loss: 1.1414, test_f1: 0.4434
 epoch: 4, train_loss: 1.0018, test_loss: 1.1220, test_f1: 0.4241
 epoch: 5, train_loss: 0.9888, test_loss: 1.0992, test_f1: 0.4253
 epoch: 6, train_loss: 0.9925, test_loss: 1.0570, test_f1: 0.4616
 epoch: 7, train_loss: 0.9945, test_loss: 1.0913, test_f1: 0.3549
 epoch: 8, train_loss: 0.9801, test_loss: 1.0856, test_f1: 0.4343
 epoch: 9, train_loss: 0.9831, test_loss: 1.0643, test_f1: 0.3423
 epoch: 10, train_loss: 0.9663, test_loss: 1.0735, test_f1: 0.5003
 epoch: 11, train_loss: 0.9537, test_loss: 1.0984, test_f1: 0.5075
 epoch: 12, train_loss: 0.9482, test_loss: 1.3825, test_f1: 0.4307
 epoch: 13, train_loss: 0.9408, test_loss: 1.1260, test_f1: 0.4648
 epoch: 14, train_loss: 0.9272, test_loss: 1.0114, test_f1: 0.5314
 epoch: 15, train_loss: 0.9165, test_loss: 0.9990, test_f1: 0.5739
 epoch: 16, train_loss: 0.9112, test_loss: 1.0841, test_f1: 0.4679
 epoch: 17, train_loss: 0.9174, test_loss: 1.1367, test_f1: 0.5308
 epoch: 18, train_loss: 0.8988, test_loss: 1.1164, test_f1: 0.4224
 epoch: 19, train_loss: 0.8940, test_loss: 1.1065, test_f1: 0.4331
 epoch: 20, train_loss: 0.8877, test_loss: 1.1793, test_f1: 0.4913
 epoch: 21, train_loss: 0.8878, test_loss: 1.0570, test_f1: 0.5375
 epoch: 22, train_loss: 0.8544, test_loss: 1.1487, test_f1: 0.5321
 epoch: 23, train_loss: 0.8454, test_loss: 1.1222, test_f1: 0.5278
 epoch: 24, train_loss: 0.8400, test_loss: 1.0238, test_f1: 0.4406
 epoch: 25, train_loss: 0.8395, test_loss: 1.0205, test_f1: 0.5649
 epoch: 26, train_loss: 0.8149, test_loss: 1.1121, test_f1: 0.5318
 epoch: 27, train_loss: 0.8425, test_loss: 1.4976, test_f1: 0.4440
 epoch: 28, train_loss: 0.8386, test_loss: 1.0026, test_f1: 0.5837
 epoch: 29, train_loss: 0.8303, test_loss: 0.9973, test_f1: 0.5858
 epoch: 30, train_loss: 0.8216, test_loss: 1.0400, test_f1: 0.5263
 epoch: 31, train_loss: 0.8339, test_loss: 1.1836, test_f1: 0.5291
 epoch: 32, train_loss: 0.8153, test_loss: 1.3861, test_f1: 0.4588
 epoch: 33, train_loss: 0.8129, test_loss: 1.1057, test_f1: 0.4409
 epoch: 34, train_loss: 0.8292, test_loss: 1.0394, test_f1: 0.5056
 epoch: 35, train_loss: 0.8313, test_loss: 1.1548, test_f1: 0.4846
 epoch: 36, train_loss: 0.7992, test_loss: 1.7392, test_f1: 0.4784
 epoch: 37, train_loss: 0.7737, test_loss: 1.4601, test_f1: 0.4935
 epoch: 38, train_loss: 0.7928, test_loss: 1.1806, test_f1: 0.4774
 epoch: 39, train_loss: 0.7831, test_loss: 1.1913, test_f1: 0.5310
 epoch: 40, train_loss: 0.7683, test_loss: 1.1043, test_f1: 0.4992
 epoch: 41, train_loss: 0.7467, test_loss: 1.1042, test_f1: 0.5340
 epoch: 42, train_loss: 0.7596, test_loss: 1.6331, test_f1: 0.4698
 epoch: 43, train_loss: 0.7521, test_loss: 1.0806, test_f1: 0.4962
 epoch: 44, train_loss: 0.7342, test_loss: 1.4839, test_f1: 0.4639
 epoch: 45, train_loss: 0.7728, test_loss: 1.2774, test_f1: 0.4485
 epoch: 46, train_loss: 0.7747, test_loss: 1.0431, test_f1: 0.5037
 epoch: 47, train_loss: 0.7864, test_loss: 1.8043, test_f1: 0.4617
 epoch: 48, train_loss: 0.7470, test_loss: 1.3577, test_f1: 0.5570
 epoch: 49, train_loss: 0.7507, test_loss: 1.9442, test_f1: 0.4239
 epoch: 50, train_loss: 0.7390, test_loss: 1.4401, test_f1: 0.5635
 epoch: 51, train_loss: 0.7204, test_loss: 1.2555, test_f1: 0.5648
 epoch: 52, train_loss: 0.6914, test_loss: 1.3375, test_f1: 0.5751
 epoch: 53, train_loss: 0.7099, test_loss: 1.1995, test_f1: 0.5791
 epoch: 54, train_loss: 0.6983, test_loss: 1.0666, test_f1: 0.5938
 epoch: 55, train_loss: 0.6975, test_loss: 1.1784, test_f1: 0.5795
 epoch: 56, train_loss: 0.7002, test_loss: 1.1721, test_f1: 0.5773
 epoch: 57, train_loss: 0.7090, test_loss: 1.0616, test_f1: 0.5239
 epoch: 58, train_loss: 0.6987, test_loss: 1.1738, test_f1: 0.6258
 epoch: 59, train_loss: 0.6690, test_loss: 1.2541, test_f1: 0.6133
 epoch: 60, train_loss: 0.6731, test_loss: 1.3819, test_f1: 0.5812
 epoch: 61, train_loss: 0.6806, test_loss: 1.4902, test_f1: 0.5630
 epoch: 62, train_loss: 0.6607, test_loss: 1.1113, test_f1: 0.6416
 epoch: 63, train_loss: 0.6675, test_loss: 1.5913, test_f1: 0.5847
 epoch: 64, train_loss: 0.6506, test_loss: 1.1518, test_f1: 0.5758
 epoch: 65, train_loss: 0.6664, test_loss: 1.8067, test_f1: 0.5731
 epoch: 66, train_loss: 0.6417, test_loss: 1.2488, test_f1: 0.5916
 epoch: 67, train_loss: 0.6480, test_loss: 1.7155, test_f1: 0.5954
 epoch: 68, train_loss: 0.6675, test_loss: 1.1199, test_f1: 0.6185
 epoch: 69, train_loss: 0.6694, test_loss: 1.1936, test_f1: 0.5900
 epoch: 70, train_loss: 0.6523, test_loss: 1.4135, test_f1: 0.5698
 epoch: 71, train_loss: 0.6665, test_loss: 2.0940, test_f1: 0.5719
 epoch: 72, train_loss: 0.6636, test_loss: 1.2854, test_f1: 0.6181
 epoch: 73, train_loss: 0.6627, test_loss: 1.5919, test_f1: 0.6140
 epoch: 74, train_loss: 0.6493, test_loss: 1.6533, test_f1: 0.6194
 epoch: 75, train_loss: 0.6594, test_loss: 1.5607, test_f1: 0.5784
 epoch: 76, train_loss: 0.6439, test_loss: 2.4122, test_f1: 0.5118
 epoch: 77, train_loss: 0.6849, test_loss: 1.1045, test_f1: 0.6345
 epoch: 78, train_loss: 0.6587, test_loss: 1.5326, test_f1: 0.5729
 epoch: 79, train_loss: 0.6329, test_loss: 1.3419, test_f1: 0.5920
 epoch: 80, train_loss: 0.6199, test_loss: 1.9581, test_f1: 0.5606
 epoch: 81, train_loss: 0.6226, test_loss: 1.3855, test_f1: 0.6106
 epoch: 82, train_loss: 0.6451, test_loss: 1.5337, test_f1: 0.5633
 epoch: 83, train_loss: 0.6549, test_loss: 1.9384, test_f1: 0.5545
 epoch: 84, train_loss: 0.6190, test_loss: 1.7487, test_f1: 0.6070
 epoch: 85, train_loss: 0.6155, test_loss: 1.3265, test_f1: 0.5927
 epoch: 86, train_loss: 0.6297, test_loss: 1.6232, test_f1: 0.5433
 epoch: 87, train_loss: 0.6246, test_loss: 1.3661, test_f1: 0.5941
 epoch: 88, train_loss: 0.6377, test_loss: 1.6197, test_f1: 0.5887
 epoch: 89, train_loss: 0.6418, test_loss: 1.8405, test_f1: 0.6420
 epoch: 90, train_loss: 0.6055, test_loss: 1.6657, test_f1: 0.5944
 epoch: 91, train_loss: 0.6399, test_loss: 2.6802, test_f1: 0.5203
 epoch: 92, train_loss: 0.6282, test_loss: 2.0660, test_f1: 0.5855
 epoch: 93, train_loss: 0.6340, test_loss: 1.6922, test_f1: 0.5567
 epoch: 94, train_loss: 0.6143, test_loss: 1.7685, test_f1: 0.5687
 epoch: 95, train_loss: 0.6033, test_loss: 1.8043, test_f1: 0.5956
 epoch: 96, train_loss: 0.6077, test_loss: 2.6027, test_f1: 0.5762
 epoch: 97, train_loss: 0.6166, test_loss: 1.0725, test_f1: 0.6037
 epoch: 98, train_loss: 0.6253, test_loss: 2.0676, test_f1: 0.4928
 epoch: 99, train_loss: 0.6227, test_loss: 1.8998, test_f1: 0.5901
##################ITERATION #1 ****************************************
 epoch: 0, train_loss: 1.1711, test_loss: 1.4301, test_f1: 0.1365
 epoch: 1, train_loss: 1.0715, test_loss: 1.3036, test_f1: 0.3537
 epoch: 2, train_loss: 1.0183, test_loss: 1.0936, test_f1: 0.4109
 epoch: 3, train_loss: 0.9805, test_loss: 1.1486, test_f1: 0.4307
 epoch: 4, train_loss: 0.9730, test_loss: 2.1056, test_f1: 0.3461
 epoch: 5, train_loss: 0.9586, test_loss: 1.2230, test_f1: 0.3984
 epoch: 6, train_loss: 0.9606, test_loss: 1.0071, test_f1: 0.5534
 epoch: 7, train_loss: 0.9349, test_loss: 1.1379, test_f1: 0.5393
 epoch: 8, train_loss: 0.9326, test_loss: 1.0061, test_f1: 0.5507
 epoch: 9, train_loss: 0.9147, test_loss: 1.0028, test_f1: 0.5708
 epoch: 10, train_loss: 0.9013, test_loss: 1.0997, test_f1: 0.4516
 epoch: 11, train_loss: 0.9209, test_loss: 0.9663, test_f1: 0.5597
 epoch: 12, train_loss: 0.8879, test_loss: 1.1094, test_f1: 0.5073
 epoch: 13, train_loss: 0.8805, test_loss: 1.0197, test_f1: 0.5588
 epoch: 14, train_loss: 0.8648, test_loss: 1.0309, test_f1: 0.5185
 epoch: 15, train_loss: 0.8661, test_loss: 1.0130, test_f1: 0.5631
 epoch: 16, train_loss: 0.8694, test_loss: 0.9863, test_f1: 0.5374
 epoch: 17, train_loss: 0.8577, test_loss: 1.0404, test_f1: 0.6082
 epoch: 18, train_loss: 0.8470, test_loss: 0.9748, test_f1: 0.4743
 epoch: 19, train_loss: 0.8414, test_loss: 1.0339, test_f1: 0.5701
 epoch: 20, train_loss: 0.8462, test_loss: 0.9717, test_f1: 0.5429
 epoch: 21, train_loss: 0.8391, test_loss: 1.0002, test_f1: 0.4580
 epoch: 22, train_loss: 0.8373, test_loss: 0.9657, test_f1: 0.5411
 epoch: 23, train_loss: 0.8217, test_loss: 1.0679, test_f1: 0.5666
 epoch: 24, train_loss: 0.8502, test_loss: 1.0031, test_f1: 0.5867
 epoch: 25, train_loss: 0.8323, test_loss: 0.9871, test_f1: 0.5829
 epoch: 26, train_loss: 0.8206, test_loss: 0.9677, test_f1: 0.5781
 epoch: 27, train_loss: 0.8285, test_loss: 1.0027, test_f1: 0.5015
 epoch: 28, train_loss: 0.8272, test_loss: 0.9871, test_f1: 0.5692
 epoch: 29, train_loss: 0.8290, test_loss: 0.9745, test_f1: 0.4748
 epoch: 30, train_loss: 0.8221, test_loss: 0.9536, test_f1: 0.5884
 epoch: 31, train_loss: 0.8229, test_loss: 0.9837, test_f1: 0.5174
 epoch: 32, train_loss: 0.8215, test_loss: 0.9424, test_f1: 0.5644
 epoch: 33, train_loss: 0.8180, test_loss: 0.9823, test_f1: 0.5822
 epoch: 34, train_loss: 0.8165, test_loss: 0.9853, test_f1: 0.4951
 epoch: 35, train_loss: 0.8142, test_loss: 1.0518, test_f1: 0.5325
 epoch: 36, train_loss: 0.7907, test_loss: 1.0040, test_f1: 0.5615
 epoch: 37, train_loss: 0.8089, test_loss: 0.9876, test_f1: 0.5915
 epoch: 38, train_loss: 0.7809, test_loss: 0.9271, test_f1: 0.5967
 epoch: 39, train_loss: 0.7985, test_loss: 1.0153, test_f1: 0.4902
 epoch: 40, train_loss: 0.7778, test_loss: 1.1484, test_f1: 0.5280
 epoch: 41, train_loss: 0.8047, test_loss: 0.9427, test_f1: 0.6113
 epoch: 42, train_loss: 0.7757, test_loss: 1.1651, test_f1: 0.4603
 epoch: 43, train_loss: 0.8059, test_loss: 1.3458, test_f1: 0.4512
 epoch: 44, train_loss: 0.7645, test_loss: 0.9303, test_f1: 0.6232
 epoch: 45, train_loss: 0.7697, test_loss: 1.0860, test_f1: 0.5711
 epoch: 46, train_loss: 0.7698, test_loss: 0.9950, test_f1: 0.5765
 epoch: 47, train_loss: 0.7864, test_loss: 1.4887, test_f1: 0.4264
 epoch: 48, train_loss: 0.7577, test_loss: 1.0082, test_f1: 0.4873
 epoch: 49, train_loss: 0.7996, test_loss: 0.9362, test_f1: 0.6233
 epoch: 50, train_loss: 0.7889, test_loss: 0.9207, test_f1: 0.6198
 epoch: 51, train_loss: 0.7563, test_loss: 0.9276, test_f1: 0.5524
 epoch: 52, train_loss: 0.7420, test_loss: 0.9653, test_f1: 0.5875
 epoch: 53, train_loss: 0.7307, test_loss: 0.9323, test_f1: 0.5853
 epoch: 54, train_loss: 0.7355, test_loss: 0.9808, test_f1: 0.4994
 epoch: 55, train_loss: 0.7263, test_loss: 0.9733, test_f1: 0.5759
 epoch: 56, train_loss: 0.7239, test_loss: 0.9897, test_f1: 0.5454
 epoch: 57, train_loss: 0.7103, test_loss: 1.0299, test_f1: 0.5828
 epoch: 58, train_loss: 0.7138, test_loss: 0.9619, test_f1: 0.5764
 epoch: 59, train_loss: 0.7128, test_loss: 1.0087, test_f1: 0.5693
 epoch: 60, train_loss: 0.7097, test_loss: 1.0047, test_f1: 0.5242
 epoch: 61, train_loss: 0.6878, test_loss: 1.0993, test_f1: 0.5431
 epoch: 62, train_loss: 0.7093, test_loss: 0.9998, test_f1: 0.5257
 epoch: 63, train_loss: 0.7060, test_loss: 0.9468, test_f1: 0.5923
 epoch: 64, train_loss: 0.7124, test_loss: 1.0774, test_f1: 0.5462
 epoch: 65, train_loss: 0.7157, test_loss: 1.0386, test_f1: 0.5675
 epoch: 66, train_loss: 0.6936, test_loss: 0.9602, test_f1: 0.6024
 epoch: 67, train_loss: 0.6773, test_loss: 1.0709, test_f1: 0.5703
 epoch: 68, train_loss: 0.7083, test_loss: 1.0238, test_f1: 0.5729
 epoch: 69, train_loss: 0.6946, test_loss: 1.0029, test_f1: 0.5656
 epoch: 70, train_loss: 0.6762, test_loss: 1.0879, test_f1: 0.5540
 epoch: 71, train_loss: 0.7088, test_loss: 1.0316, test_f1: 0.5580
 epoch: 72, train_loss: 0.6777, test_loss: 1.0309, test_f1: 0.5804
 epoch: 73, train_loss: 0.6806, test_loss: 1.1917, test_f1: 0.5280
 epoch: 74, train_loss: 0.6705, test_loss: 1.0475, test_f1: 0.5684
 epoch: 75, train_loss: 0.6657, test_loss: 1.1270, test_f1: 0.5674
 epoch: 76, train_loss: 0.6751, test_loss: 1.0615, test_f1: 0.5751
 epoch: 77, train_loss: 0.6830, test_loss: 1.0124, test_f1: 0.5405
 epoch: 78, train_loss: 0.6696, test_loss: 1.0351, test_f1: 0.5643
 epoch: 79, train_loss: 0.6419, test_loss: 1.1150, test_f1: 0.5781
 epoch: 80, train_loss: 0.6688, test_loss: 1.1936, test_f1: 0.5587
 epoch: 81, train_loss: 0.6750, test_loss: 1.1489, test_f1: 0.5501
 epoch: 82, train_loss: 0.6533, test_loss: 1.1662, test_f1: 0.5224
 epoch: 83, train_loss: 0.6612, test_loss: 1.5213, test_f1: 0.4791
 epoch: 84, train_loss: 0.6542, test_loss: 1.0805, test_f1: 0.5827
 epoch: 85, train_loss: 0.6535, test_loss: 1.1495, test_f1: 0.5681
 epoch: 86, train_loss: 0.6452, test_loss: 1.1599, test_f1: 0.5739
 epoch: 87, train_loss: 0.6498, test_loss: 1.1368, test_f1: 0.5706
 epoch: 88, train_loss: 0.6665, test_loss: 1.0487, test_f1: 0.5730
 epoch: 89, train_loss: 0.6388, test_loss: 1.0984, test_f1: 0.5622
 epoch: 90, train_loss: 0.6673, test_loss: 1.1195, test_f1: 0.5628
 epoch: 91, train_loss: 0.6488, test_loss: 1.1327, test_f1: 0.5709
 epoch: 92, train_loss: 0.6216, test_loss: 1.2024, test_f1: 0.6023
 epoch: 93, train_loss: 0.6400, test_loss: 1.1687, test_f1: 0.5766
 epoch: 94, train_loss: 0.6295, test_loss: 1.1711, test_f1: 0.5606
 epoch: 95, train_loss: 0.6253, test_loss: 1.3053, test_f1: 0.5284
 epoch: 96, train_loss: 0.6153, test_loss: 1.3174, test_f1: 0.5937
 epoch: 97, train_loss: 0.6352, test_loss: 1.1467, test_f1: 0.5697
 epoch: 98, train_loss: 0.6355, test_loss: 1.2009, test_f1: 0.5438
 epoch: 99, train_loss: 0.6347, test_loss: 1.2243, test_f1: 0.5928
##################ITERATION #2 ****************************************
 epoch: 0, train_loss: 1.1881, test_loss: 1.2792, test_f1: 0.3270
 epoch: 1, train_loss: 1.0542, test_loss: 1.0795, test_f1: 0.4719
 epoch: 2, train_loss: 1.0123, test_loss: 1.1350, test_f1: 0.4856
 epoch: 3, train_loss: 0.9809, test_loss: 1.0565, test_f1: 0.4572
 epoch: 4, train_loss: 0.9746, test_loss: 1.1342, test_f1: 0.4653
 epoch: 5, train_loss: 0.9504, test_loss: 1.1151, test_f1: 0.5268
 epoch: 6, train_loss: 0.9325, test_loss: 1.0887, test_f1: 0.5023
 epoch: 7, train_loss: 0.9346, test_loss: 1.0492, test_f1: 0.5349
 epoch: 8, train_loss: 0.9268, test_loss: 1.0321, test_f1: 0.4769
 epoch: 9, train_loss: 0.9338, test_loss: 1.0507, test_f1: 0.5251
 epoch: 10, train_loss: 0.8863, test_loss: 1.0991, test_f1: 0.4617
 epoch: 11, train_loss: 0.8711, test_loss: 1.1848, test_f1: 0.4771
 epoch: 12, train_loss: 0.8749, test_loss: 0.9578, test_f1: 0.4973
 epoch: 13, train_loss: 0.8446, test_loss: 1.1528, test_f1: 0.5158
 epoch: 14, train_loss: 0.8435, test_loss: 0.9628, test_f1: 0.5676
 epoch: 15, train_loss: 0.8279, test_loss: 0.9613, test_f1: 0.5987
 epoch: 16, train_loss: 0.8136, test_loss: 0.9721, test_f1: 0.5709
 epoch: 17, train_loss: 0.8413, test_loss: 0.9620, test_f1: 0.5654
 epoch: 18, train_loss: 0.7931, test_loss: 1.2004, test_f1: 0.5256
 epoch: 19, train_loss: 0.8075, test_loss: 1.0002, test_f1: 0.5803
 epoch: 20, train_loss: 0.8052, test_loss: 1.1046, test_f1: 0.4858
 epoch: 21, train_loss: 0.7879, test_loss: 0.9472, test_f1: 0.5148
 epoch: 22, train_loss: 0.7916, test_loss: 1.0193, test_f1: 0.5785
 epoch: 23, train_loss: 0.7933, test_loss: 1.2109, test_f1: 0.4369
 epoch: 24, train_loss: 0.7806, test_loss: 1.0206, test_f1: 0.5691
 epoch: 25, train_loss: 0.7768, test_loss: 0.9960, test_f1: 0.6336
 epoch: 26, train_loss: 0.7905, test_loss: 0.9940, test_f1: 0.5005
 epoch: 27, train_loss: 0.7781, test_loss: 0.9831, test_f1: 0.5728
 epoch: 28, train_loss: 0.7851, test_loss: 1.0431, test_f1: 0.5480
 epoch: 29, train_loss: 0.7823, test_loss: 1.4143, test_f1: 0.4503
 epoch: 30, train_loss: 0.7857, test_loss: 1.0816, test_f1: 0.5034
 epoch: 31, train_loss: 0.7517, test_loss: 0.9784, test_f1: 0.5829
 epoch: 32, train_loss: 0.7448, test_loss: 1.2337, test_f1: 0.5293
 epoch: 33, train_loss: 0.7559, test_loss: 1.1025, test_f1: 0.5228
 epoch: 34, train_loss: 0.7648, test_loss: 1.0833, test_f1: 0.5751
 epoch: 35, train_loss: 0.7471, test_loss: 1.1383, test_f1: 0.5169
 epoch: 36, train_loss: 0.7257, test_loss: 0.9622, test_f1: 0.6185
 epoch: 37, train_loss: 0.7418, test_loss: 0.9595, test_f1: 0.5751
 epoch: 38, train_loss: 0.7305, test_loss: 1.0122, test_f1: 0.5389
 epoch: 39, train_loss: 0.7362, test_loss: 1.0450, test_f1: 0.5916
 epoch: 40, train_loss: 0.7537, test_loss: 1.0850, test_f1: 0.5360
 epoch: 41, train_loss: 0.7441, test_loss: 0.9709, test_f1: 0.5749
 epoch: 42, train_loss: 0.7473, test_loss: 1.0031, test_f1: 0.5751
 epoch: 43, train_loss: 0.7441, test_loss: 0.9656, test_f1: 0.5936
 epoch: 44, train_loss: 0.7426, test_loss: 1.0831, test_f1: 0.5465
 epoch: 45, train_loss: 0.6954, test_loss: 1.0502, test_f1: 0.5399
 epoch: 46, train_loss: 0.7168, test_loss: 1.9672, test_f1: 0.3169
 epoch: 47, train_loss: 0.7138, test_loss: 1.0069, test_f1: 0.5701
 epoch: 48, train_loss: 0.7160, test_loss: 1.1641, test_f1: 0.5301
 epoch: 49, train_loss: 0.7179, test_loss: 1.0239, test_f1: 0.5860
 epoch: 50, train_loss: 0.7256, test_loss: 1.0949, test_f1: 0.5843
 epoch: 51, train_loss: 0.7035, test_loss: 1.0164, test_f1: 0.5459
 epoch: 52, train_loss: 0.6758, test_loss: 0.9989, test_f1: 0.6142
 epoch: 53, train_loss: 0.6681, test_loss: 1.0368, test_f1: 0.6051
 epoch: 54, train_loss: 0.6723, test_loss: 1.0122, test_f1: 0.5443
 epoch: 55, train_loss: 0.6421, test_loss: 1.0104, test_f1: 0.6237
 epoch: 56, train_loss: 0.6546, test_loss: 0.9901, test_f1: 0.6248
 epoch: 57, train_loss: 0.6478, test_loss: 0.9888, test_f1: 0.5957
 epoch: 58, train_loss: 0.6601, test_loss: 1.1063, test_f1: 0.6117
 epoch: 59, train_loss: 0.6511, test_loss: 1.0714, test_f1: 0.5853
 epoch: 60, train_loss: 0.6295, test_loss: 0.9181, test_f1: 0.6534
 epoch: 61, train_loss: 0.6502, test_loss: 1.0511, test_f1: 0.6209
 epoch: 62, train_loss: 0.6231, test_loss: 1.0686, test_f1: 0.6088
 epoch: 63, train_loss: 0.6245, test_loss: 1.0383, test_f1: 0.6115
 epoch: 64, train_loss: 0.6308, test_loss: 1.1054, test_f1: 0.6292
 epoch: 65, train_loss: 0.6400, test_loss: 1.1969, test_f1: 0.5383
 epoch: 66, train_loss: 0.6280, test_loss: 1.0107, test_f1: 0.6491
 epoch: 67, train_loss: 0.6215, test_loss: 1.0956, test_f1: 0.5512
 epoch: 68, train_loss: 0.6149, test_loss: 1.0795, test_f1: 0.6179
 epoch: 69, train_loss: 0.6420, test_loss: 1.0413, test_f1: 0.5648
 epoch: 70, train_loss: 0.6433, test_loss: 1.0963, test_f1: 0.6251
 epoch: 71, train_loss: 0.6308, test_loss: 1.1187, test_f1: 0.6112
 epoch: 72, train_loss: 0.6305, test_loss: 1.1256, test_f1: 0.5806
 epoch: 73, train_loss: 0.5957, test_loss: 1.2046, test_f1: 0.6062
 epoch: 74, train_loss: 0.6065, test_loss: 1.0378, test_f1: 0.6330
 epoch: 75, train_loss: 0.6029, test_loss: 1.0431, test_f1: 0.6332
 epoch: 76, train_loss: 0.6007, test_loss: 1.0128, test_f1: 0.6444
 epoch: 77, train_loss: 0.6007, test_loss: 1.2392, test_f1: 0.5961
 epoch: 78, train_loss: 0.5975, test_loss: 1.1214, test_f1: 0.5742
 epoch: 79, train_loss: 0.6364, test_loss: 0.9999, test_f1: 0.6378
 epoch: 80, train_loss: 0.6098, test_loss: 1.1320, test_f1: 0.5891
 epoch: 81, train_loss: 0.6209, test_loss: 1.1182, test_f1: 0.6196
 epoch: 82, train_loss: 0.6045, test_loss: 1.2060, test_f1: 0.6167
 epoch: 83, train_loss: 0.5836, test_loss: 0.9946, test_f1: 0.6548
 epoch: 84, train_loss: 0.5950, test_loss: 1.0705, test_f1: 0.6339
 epoch: 85, train_loss: 0.6057, test_loss: 1.0821, test_f1: 0.6197
 epoch: 86, train_loss: 0.5646, test_loss: 1.2466, test_f1: 0.5749
 epoch: 87, train_loss: 0.5868, test_loss: 1.0678, test_f1: 0.6526
 epoch: 88, train_loss: 0.5813, test_loss: 1.1941, test_f1: 0.6118
 epoch: 89, train_loss: 0.5774, test_loss: 1.2223, test_f1: 0.5943
 epoch: 90, train_loss: 0.5825, test_loss: 1.0697, test_f1: 0.6367
 epoch: 91, train_loss: 0.5977, test_loss: 1.2269, test_f1: 0.5810
 epoch: 92, train_loss: 0.6115, test_loss: 1.1312, test_f1: 0.6091
 epoch: 93, train_loss: 0.5809, test_loss: 1.2945, test_f1: 0.5739
 epoch: 94, train_loss: 0.5875, test_loss: 1.1822, test_f1: 0.6065
 epoch: 95, train_loss: 0.5714, test_loss: 1.2344, test_f1: 0.6214
 epoch: 96, train_loss: 0.5865, test_loss: 1.3390, test_f1: 0.5356
 epoch: 97, train_loss: 0.6011, test_loss: 1.0668, test_f1: 0.6401
 epoch: 98, train_loss: 0.6120, test_loss: 1.0946, test_f1: 0.6451
 epoch: 99, train_loss: 0.6002, test_loss: 1.0217, test_f1: 0.6266
##################ITERATION #3 ****************************************
 epoch: 0, train_loss: 1.1802, test_loss: 1.4470, test_f1: 0.1547
 epoch: 1, train_loss: 1.0573, test_loss: 1.1666, test_f1: 0.4373
 epoch: 2, train_loss: 1.0121, test_loss: 1.1207, test_f1: 0.4607
 epoch: 3, train_loss: 0.9948, test_loss: 1.0580, test_f1: 0.3686
 epoch: 4, train_loss: 0.9751, test_loss: 1.0499, test_f1: 0.5023
 epoch: 5, train_loss: 0.9551, test_loss: 1.0731, test_f1: 0.4603
 epoch: 6, train_loss: 0.9533, test_loss: 1.0768, test_f1: 0.4294
 epoch: 7, train_loss: 0.9398, test_loss: 1.6961, test_f1: 0.3728
 epoch: 8, train_loss: 0.9246, test_loss: 1.0138, test_f1: 0.4899
 epoch: 9, train_loss: 0.9041, test_loss: 1.0357, test_f1: 0.4612
 epoch: 10, train_loss: 0.8896, test_loss: 1.0010, test_f1: 0.5279
 epoch: 11, train_loss: 0.8981, test_loss: 1.0405, test_f1: 0.5083
 epoch: 12, train_loss: 0.8979, test_loss: 1.0100, test_f1: 0.5326
 epoch: 13, train_loss: 0.8615, test_loss: 0.9935, test_f1: 0.5484
 epoch: 14, train_loss: 0.8452, test_loss: 1.0282, test_f1: 0.5202
 epoch: 15, train_loss: 0.8537, test_loss: 1.0020, test_f1: 0.5448
 epoch: 16, train_loss: 0.8510, test_loss: 1.8548, test_f1: 0.4779
 epoch: 17, train_loss: 0.8215, test_loss: 1.0546, test_f1: 0.4890
 epoch: 18, train_loss: 0.8314, test_loss: 0.9887, test_f1: 0.5396
 epoch: 19, train_loss: 0.8154, test_loss: 0.9824, test_f1: 0.5628
 epoch: 20, train_loss: 0.8329, test_loss: 0.9963, test_f1: 0.5705
 epoch: 21, train_loss: 0.8058, test_loss: 1.0445, test_f1: 0.4544
 epoch: 22, train_loss: 0.7935, test_loss: 1.7873, test_f1: 0.4724
 epoch: 23, train_loss: 0.7998, test_loss: 1.1834, test_f1: 0.4185
 epoch: 24, train_loss: 0.7857, test_loss: 1.0520, test_f1: 0.5679
 epoch: 25, train_loss: 0.7614, test_loss: 1.1157, test_f1: 0.5593
 epoch: 26, train_loss: 0.8087, test_loss: 1.0117, test_f1: 0.5798
 epoch: 27, train_loss: 0.7994, test_loss: 1.2656, test_f1: 0.4902
 epoch: 28, train_loss: 0.7974, test_loss: 1.0350, test_f1: 0.5477
 epoch: 29, train_loss: 0.8073, test_loss: 1.0313, test_f1: 0.5759
 epoch: 30, train_loss: 0.7898, test_loss: 1.0850, test_f1: 0.5416
 epoch: 31, train_loss: 0.7745, test_loss: 1.7233, test_f1: 0.4576
 epoch: 32, train_loss: 0.8156, test_loss: 1.0471, test_f1: 0.4928
 epoch: 33, train_loss: 0.7908, test_loss: 1.3294, test_f1: 0.5046
 epoch: 34, train_loss: 0.7715, test_loss: 1.1023, test_f1: 0.4598
 epoch: 35, train_loss: 0.7833, test_loss: 1.0226, test_f1: 0.5887
 epoch: 36, train_loss: 0.7644, test_loss: 1.1710, test_f1: 0.5854
 epoch: 37, train_loss: 0.7956, test_loss: 1.0419, test_f1: 0.5592
 epoch: 38, train_loss: 0.7478, test_loss: 1.1162, test_f1: 0.5306
 epoch: 39, train_loss: 0.7545, test_loss: 1.0990, test_f1: 0.5432
 epoch: 40, train_loss: 0.7542, test_loss: 1.2093, test_f1: 0.5097
 epoch: 41, train_loss: 0.7545, test_loss: 1.0960, test_f1: 0.5444
 epoch: 42, train_loss: 0.7412, test_loss: 1.1845, test_f1: 0.4973
 epoch: 43, train_loss: 0.7352, test_loss: 1.3383, test_f1: 0.5039
 epoch: 44, train_loss: 0.7496, test_loss: 1.4673, test_f1: 0.5088
 epoch: 45, train_loss: 0.7225, test_loss: 1.1666, test_f1: 0.5148
 epoch: 46, train_loss: 0.7374, test_loss: 1.1868, test_f1: 0.5522
 epoch: 47, train_loss: 0.7494, test_loss: 1.0526, test_f1: 0.5163
 epoch: 48, train_loss: 0.7137, test_loss: 1.1122, test_f1: 0.5282
 epoch: 49, train_loss: 0.7038, test_loss: 1.3844, test_f1: 0.4881
 epoch: 50, train_loss: 0.7324, test_loss: 1.1126, test_f1: 0.5235
 epoch: 51, train_loss: 0.7258, test_loss: 1.1427, test_f1: 0.5805
 epoch: 52, train_loss: 0.6850, test_loss: 1.0535, test_f1: 0.5942
 epoch: 53, train_loss: 0.6933, test_loss: 1.1465, test_f1: 0.5383
 epoch: 54, train_loss: 0.6742, test_loss: 1.2605, test_f1: 0.5644
 epoch: 55, train_loss: 0.6478, test_loss: 1.1839, test_f1: 0.5902
 epoch: 56, train_loss: 0.6752, test_loss: 1.1225, test_f1: 0.5832
 epoch: 57, train_loss: 0.6789, test_loss: 1.1923, test_f1: 0.5813
 epoch: 58, train_loss: 0.6959, test_loss: 1.2384, test_f1: 0.5431
 epoch: 59, train_loss: 0.6757, test_loss: 1.2309, test_f1: 0.5639
 epoch: 60, train_loss: 0.6600, test_loss: 1.1505, test_f1: 0.5858
 epoch: 61, train_loss: 0.6648, test_loss: 1.2994, test_f1: 0.5594
 epoch: 62, train_loss: 0.6587, test_loss: 1.3173, test_f1: 0.5700
 epoch: 63, train_loss: 0.6604, test_loss: 1.1642, test_f1: 0.5835
 epoch: 64, train_loss: 0.6628, test_loss: 1.4086, test_f1: 0.5247
 epoch: 65, train_loss: 0.6485, test_loss: 1.2049, test_f1: 0.5827
 epoch: 66, train_loss: 0.6329, test_loss: 1.2266, test_f1: 0.5540
 epoch: 67, train_loss: 0.6406, test_loss: 1.1357, test_f1: 0.6061
 epoch: 68, train_loss: 0.6435, test_loss: 1.1253, test_f1: 0.5666
 epoch: 69, train_loss: 0.6370, test_loss: 1.4187, test_f1: 0.5128
 epoch: 70, train_loss: 0.6579, test_loss: 1.3449, test_f1: 0.5543
 epoch: 71, train_loss: 0.6365, test_loss: 1.4080, test_f1: 0.5398
 epoch: 72, train_loss: 0.6436, test_loss: 1.1915, test_f1: 0.5838
 epoch: 73, train_loss: 0.6247, test_loss: 1.5244, test_f1: 0.5750
 epoch: 74, train_loss: 0.6400, test_loss: 1.2582, test_f1: 0.5629
 epoch: 75, train_loss: 0.6443, test_loss: 1.2687, test_f1: 0.5959
 epoch: 76, train_loss: 0.6372, test_loss: 1.2519, test_f1: 0.5582
 epoch: 77, train_loss: 0.6409, test_loss: 1.2497, test_f1: 0.5499
 epoch: 78, train_loss: 0.6224, test_loss: 1.4664, test_f1: 0.5415
 epoch: 79, train_loss: 0.6225, test_loss: 1.2385, test_f1: 0.5621
 epoch: 80, train_loss: 0.6169, test_loss: 1.6210, test_f1: 0.5524
 epoch: 81, train_loss: 0.6098, test_loss: 1.3790, test_f1: 0.5665
 epoch: 82, train_loss: 0.6130, test_loss: 1.3254, test_f1: 0.5531
 epoch: 83, train_loss: 0.6072, test_loss: 1.2505, test_f1: 0.6033
 epoch: 84, train_loss: 0.6062, test_loss: 1.2577, test_f1: 0.6346
 epoch: 85, train_loss: 0.6244, test_loss: 1.5045, test_f1: 0.5355
 epoch: 86, train_loss: 0.6151, test_loss: 1.2341, test_f1: 0.5881
 epoch: 87, train_loss: 0.6129, test_loss: 1.3226, test_f1: 0.6083
 epoch: 88, train_loss: 0.5974, test_loss: 1.2624, test_f1: 0.5694
 epoch: 89, train_loss: 0.5945, test_loss: 1.1990, test_f1: 0.6030
 epoch: 90, train_loss: 0.5809, test_loss: 1.3419, test_f1: 0.5713
 epoch: 91, train_loss: 0.5952, test_loss: 1.1916, test_f1: 0.6316
 epoch: 92, train_loss: 0.5987, test_loss: 1.1920, test_f1: 0.6280
 epoch: 93, train_loss: 0.5835, test_loss: 1.5500, test_f1: 0.5529
 epoch: 94, train_loss: 0.6178, test_loss: 1.5329, test_f1: 0.5390
 epoch: 95, train_loss: 0.6108, test_loss: 1.3440, test_f1: 0.5976
 epoch: 96, train_loss: 0.5947, test_loss: 1.2819, test_f1: 0.5999
 epoch: 97, train_loss: 0.6370, test_loss: 1.3069, test_f1: 0.5794
 epoch: 98, train_loss: 0.6028, test_loss: 1.2363, test_f1: 0.5578
 epoch: 99, train_loss: 0.6048, test_loss: 1.2549, test_f1: 0.5422
##################ITERATION #4 ****************************************
 epoch: 0, train_loss: 1.1829, test_loss: 1.8257, test_f1: 0.1384
 epoch: 1, train_loss: 1.0275, test_loss: 1.0701, test_f1: 0.3555
 epoch: 2, train_loss: 1.0016, test_loss: 1.0892, test_f1: 0.4517
 epoch: 3, train_loss: 0.9888, test_loss: 1.0564, test_f1: 0.5143
 epoch: 4, train_loss: 0.9787, test_loss: 1.0798, test_f1: 0.4119
 epoch: 5, train_loss: 0.9534, test_loss: 1.0306, test_f1: 0.4909
 epoch: 6, train_loss: 0.9724, test_loss: 1.0442, test_f1: 0.4484
 epoch: 7, train_loss: 0.9562, test_loss: 1.0104, test_f1: 0.4357
 epoch: 8, train_loss: 0.9335, test_loss: 1.0874, test_f1: 0.5403
 epoch: 9, train_loss: 0.9423, test_loss: 1.0847, test_f1: 0.4937
 epoch: 10, train_loss: 0.9412, test_loss: 1.0919, test_f1: 0.5278
 epoch: 11, train_loss: 0.9176, test_loss: 0.9894, test_f1: 0.5414
 epoch: 12, train_loss: 0.9084, test_loss: 0.9853, test_f1: 0.4792
 epoch: 13, train_loss: 0.9039, test_loss: 1.1154, test_f1: 0.5448
 epoch: 14, train_loss: 0.8842, test_loss: 1.0003, test_f1: 0.5790
 epoch: 15, train_loss: 0.8767, test_loss: 1.0805, test_f1: 0.4586
 epoch: 16, train_loss: 0.8672, test_loss: 0.9785, test_f1: 0.5751
 epoch: 17, train_loss: 0.8559, test_loss: 1.1291, test_f1: 0.4748
 epoch: 18, train_loss: 0.8618, test_loss: 1.0501, test_f1: 0.5741
 epoch: 19, train_loss: 0.8880, test_loss: 1.0652, test_f1: 0.5552
 epoch: 20, train_loss: 0.8447, test_loss: 1.0949, test_f1: 0.5143
 epoch: 21, train_loss: 0.8362, test_loss: 0.9331, test_f1: 0.6022
 epoch: 22, train_loss: 0.8268, test_loss: 1.0177, test_f1: 0.5815
 epoch: 23, train_loss: 0.8144, test_loss: 1.0196, test_f1: 0.5770
 epoch: 24, train_loss: 0.7831, test_loss: 1.0797, test_f1: 0.5351
 epoch: 25, train_loss: 0.7797, test_loss: 0.9448, test_f1: 0.6117
 epoch: 26, train_loss: 0.8162, test_loss: 1.1151, test_f1: 0.5296
 epoch: 27, train_loss: 0.8124, test_loss: 0.9917, test_f1: 0.5554
 epoch: 28, train_loss: 0.8285, test_loss: 0.9996, test_f1: 0.5663
 epoch: 29, train_loss: 0.7915, test_loss: 0.9087, test_f1: 0.5967
 epoch: 30, train_loss: 0.7773, test_loss: 1.0499, test_f1: 0.5685
 epoch: 31, train_loss: 0.7578, test_loss: 0.9312, test_f1: 0.5553
 epoch: 32, train_loss: 0.7611, test_loss: 1.0756, test_f1: 0.5872
 epoch: 33, train_loss: 0.7873, test_loss: 1.1235, test_f1: 0.5827
 epoch: 34, train_loss: 0.7522, test_loss: 0.9715, test_f1: 0.5567
 epoch: 35, train_loss: 0.7544, test_loss: 1.0040, test_f1: 0.5839
 epoch: 36, train_loss: 0.7452, test_loss: 0.9774, test_f1: 0.5843
 epoch: 37, train_loss: 0.7658, test_loss: 0.9562, test_f1: 0.5877
 epoch: 38, train_loss: 0.7741, test_loss: 1.0621, test_f1: 0.5727
 epoch: 39, train_loss: 0.7636, test_loss: 0.9658, test_f1: 0.6121
 epoch: 40, train_loss: 0.7660, test_loss: 1.1513, test_f1: 0.5523
 epoch: 41, train_loss: 0.7694, test_loss: 0.9490, test_f1: 0.6002
 epoch: 42, train_loss: 0.7899, test_loss: 1.1253, test_f1: 0.5280
 epoch: 43, train_loss: 0.7896, test_loss: 1.0050, test_f1: 0.5452
 epoch: 44, train_loss: 0.7523, test_loss: 1.0399, test_f1: 0.5374
 epoch: 45, train_loss: 0.7359, test_loss: 1.1422, test_f1: 0.5427
 epoch: 46, train_loss: 0.7192, test_loss: 1.1477, test_f1: 0.6267
 epoch: 47, train_loss: 0.7383, test_loss: 0.9601, test_f1: 0.6031
 epoch: 48, train_loss: 0.7331, test_loss: 1.0344, test_f1: 0.5737
 epoch: 49, train_loss: 0.7227, test_loss: 1.1732, test_f1: 0.5084
 epoch: 50, train_loss: 0.7026, test_loss: 1.0287, test_f1: 0.5683
 epoch: 51, train_loss: 0.7086, test_loss: 1.1825, test_f1: 0.5272
 epoch: 52, train_loss: 0.6817, test_loss: 1.0283, test_f1: 0.5950
 epoch: 53, train_loss: 0.6530, test_loss: 1.0092, test_f1: 0.6205
 epoch: 54, train_loss: 0.6510, test_loss: 1.0464, test_f1: 0.6174
 epoch: 55, train_loss: 0.6537, test_loss: 0.9926, test_f1: 0.6465
 epoch: 56, train_loss: 0.6219, test_loss: 1.0230, test_f1: 0.6183
 epoch: 57, train_loss: 0.6674, test_loss: 1.0135, test_f1: 0.6352
 epoch: 58, train_loss: 0.6384, test_loss: 1.1026, test_f1: 0.5923
 epoch: 59, train_loss: 0.6502, test_loss: 1.0804, test_f1: 0.6119
 epoch: 60, train_loss: 0.6426, test_loss: 1.1369, test_f1: 0.6212
 epoch: 61, train_loss: 0.6407, test_loss: 1.0368, test_f1: 0.6062
 epoch: 62, train_loss: 0.6582, test_loss: 1.0829, test_f1: 0.5850
 epoch: 63, train_loss: 0.6359, test_loss: 0.9960, test_f1: 0.6439
 epoch: 64, train_loss: 0.6412, test_loss: 1.1884, test_f1: 0.5682
 epoch: 65, train_loss: 0.6486, test_loss: 1.1162, test_f1: 0.5990
 epoch: 66, train_loss: 0.6179, test_loss: 1.0770, test_f1: 0.6224
 epoch: 67, train_loss: 0.6257, test_loss: 1.0459, test_f1: 0.6051
 epoch: 68, train_loss: 0.6118, test_loss: 1.1649, test_f1: 0.5632
 epoch: 69, train_loss: 0.6445, test_loss: 1.2192, test_f1: 0.5803
 epoch: 70, train_loss: 0.6202, test_loss: 1.1295, test_f1: 0.5990
 epoch: 71, train_loss: 0.6335, test_loss: 1.3287, test_f1: 0.5329
 epoch: 72, train_loss: 0.6285, test_loss: 1.0996, test_f1: 0.6084
 epoch: 73, train_loss: 0.6092, test_loss: 1.1516, test_f1: 0.6076
 epoch: 74, train_loss: 0.6284, test_loss: 1.1173, test_f1: 0.6215
 epoch: 75, train_loss: 0.6206, test_loss: 1.1240, test_f1: 0.6002
 epoch: 76, train_loss: 0.6099, test_loss: 1.1243, test_f1: 0.6182
 epoch: 77, train_loss: 0.6299, test_loss: 1.1840, test_f1: 0.5982
 epoch: 78, train_loss: 0.6037, test_loss: 1.2214, test_f1: 0.5784
 epoch: 79, train_loss: 0.6004, test_loss: 1.0742, test_f1: 0.6364
 epoch: 80, train_loss: 0.6168, test_loss: 1.0799, test_f1: 0.6314
 epoch: 81, train_loss: 0.5907, test_loss: 1.1383, test_f1: 0.5960
 epoch: 82, train_loss: 0.5931, test_loss: 1.0639, test_f1: 0.6423
 epoch: 83, train_loss: 0.5752, test_loss: 1.2761, test_f1: 0.5397
 epoch: 84, train_loss: 0.5715, test_loss: 1.1138, test_f1: 0.6226
 epoch: 85, train_loss: 0.5792, test_loss: 1.1953, test_f1: 0.6076
 epoch: 86, train_loss: 0.6009, test_loss: 1.0864, test_f1: 0.6066
 epoch: 87, train_loss: 0.5969, test_loss: 1.2484, test_f1: 0.5851
 epoch: 88, train_loss: 0.6096, test_loss: 1.1732, test_f1: 0.6209
 epoch: 89, train_loss: 0.5692, test_loss: 1.2395, test_f1: 0.6230
 epoch: 90, train_loss: 0.5730, test_loss: 1.3896, test_f1: 0.5288
 epoch: 91, train_loss: 0.6129, test_loss: 1.0344, test_f1: 0.6218
 epoch: 92, train_loss: 0.5838, test_loss: 1.0742, test_f1: 0.6517
 epoch: 93, train_loss: 0.5793, test_loss: 1.2125, test_f1: 0.6179
 epoch: 94, train_loss: 0.5788, test_loss: 1.0405, test_f1: 0.6589
 epoch: 95, train_loss: 0.5620, test_loss: 1.2271, test_f1: 0.5853
 epoch: 96, train_loss: 0.5725, test_loss: 1.2211, test_f1: 0.5807
 epoch: 97, train_loss: 0.5740, test_loss: 1.0901, test_f1: 0.6602
 epoch: 98, train_loss: 0.5637, test_loss: 1.2098, test_f1: 0.6347
 epoch: 99, train_loss: 0.5798, test_loss: 1.2736, test_f1: 0.6265
##################ITERATION #5 ****************************************
 epoch: 0, train_loss: 1.1776, test_loss: 1.2545, test_f1: 0.4204
 epoch: 1, train_loss: 1.0380, test_loss: 1.1792, test_f1: 0.3977
 epoch: 2, train_loss: 0.9988, test_loss: 1.0273, test_f1: 0.5306
 epoch: 3, train_loss: 0.9932, test_loss: 1.0990, test_f1: 0.4638
 epoch: 4, train_loss: 0.9799, test_loss: 1.0354, test_f1: 0.5250
 epoch: 5, train_loss: 0.9753, test_loss: 1.0133, test_f1: 0.4982
 epoch: 6, train_loss: 0.9583, test_loss: 1.0393, test_f1: 0.5188
 epoch: 7, train_loss: 0.9472, test_loss: 0.9832, test_f1: 0.5319
 epoch: 8, train_loss: 0.9254, test_loss: 0.9981, test_f1: 0.4860
 epoch: 9, train_loss: 0.9156, test_loss: 1.0835, test_f1: 0.5318
 epoch: 10, train_loss: 0.9024, test_loss: 1.0421, test_f1: 0.4762
 epoch: 11, train_loss: 0.9013, test_loss: 1.0077, test_f1: 0.4996
 epoch: 12, train_loss: 0.8937, test_loss: 0.9968, test_f1: 0.5018
 epoch: 13, train_loss: 0.8653, test_loss: 1.0082, test_f1: 0.5486
 epoch: 14, train_loss: 0.8810, test_loss: 1.0094, test_f1: 0.5490
 epoch: 15, train_loss: 0.8701, test_loss: 1.0481, test_f1: 0.5225
 epoch: 16, train_loss: 0.8490, test_loss: 1.1114, test_f1: 0.4826
 epoch: 17, train_loss: 0.8543, test_loss: 1.0010, test_f1: 0.5837
 epoch: 18, train_loss: 0.8162, test_loss: 1.0317, test_f1: 0.5639
 epoch: 19, train_loss: 0.8577, test_loss: 1.0059, test_f1: 0.5428
 epoch: 20, train_loss: 0.8553, test_loss: 1.1154, test_f1: 0.5131
 epoch: 21, train_loss: 0.8198, test_loss: 1.3726, test_f1: 0.4268
 epoch: 22, train_loss: 0.8335, test_loss: 1.0479, test_f1: 0.5651
 epoch: 23, train_loss: 0.8144, test_loss: 0.9759, test_f1: 0.5504
 epoch: 24, train_loss: 0.8119, test_loss: 0.9900, test_f1: 0.5862
 epoch: 25, train_loss: 0.7872, test_loss: 1.0070, test_f1: 0.5656
 epoch: 26, train_loss: 0.7715, test_loss: 0.9913, test_f1: 0.5739
 epoch: 27, train_loss: 0.7859, test_loss: 1.0279, test_f1: 0.5522
 epoch: 28, train_loss: 0.7691, test_loss: 1.0517, test_f1: 0.5652
 epoch: 29, train_loss: 0.8119, test_loss: 1.1151, test_f1: 0.4882
 epoch: 30, train_loss: 0.7819, test_loss: 1.1545, test_f1: 0.5561
 epoch: 31, train_loss: 0.8576, test_loss: 1.3825, test_f1: 0.4690
 epoch: 32, train_loss: 0.8360, test_loss: 1.0542, test_f1: 0.5347
 epoch: 33, train_loss: 0.8039, test_loss: 1.0756, test_f1: 0.4836
 epoch: 34, train_loss: 0.7644, test_loss: 1.0521, test_f1: 0.4924
 epoch: 35, train_loss: 0.7681, test_loss: 0.9721, test_f1: 0.5255
 epoch: 36, train_loss: 0.7754, test_loss: 1.4109, test_f1: 0.4979
 epoch: 37, train_loss: 0.7637, test_loss: 1.0241, test_f1: 0.5708
 epoch: 38, train_loss: 0.7562, test_loss: 1.0183, test_f1: 0.5648
 epoch: 39, train_loss: 0.7518, test_loss: 1.1911, test_f1: 0.5004
 epoch: 40, train_loss: 0.7378, test_loss: 1.0268, test_f1: 0.5762
 epoch: 41, train_loss: 0.7638, test_loss: 1.2949, test_f1: 0.5373
 epoch: 42, train_loss: 0.7490, test_loss: 1.3305, test_f1: 0.5151
 epoch: 43, train_loss: 0.7393, test_loss: 1.1527, test_f1: 0.5660
 epoch: 44, train_loss: 0.7396, test_loss: 1.5573, test_f1: 0.4749
 epoch: 45, train_loss: 0.7435, test_loss: 1.0526, test_f1: 0.5370
 epoch: 46, train_loss: 0.7263, test_loss: 1.2448, test_f1: 0.5454
 epoch: 47, train_loss: 0.7170, test_loss: 1.4338, test_f1: 0.5371
 epoch: 48, train_loss: 0.7390, test_loss: 1.0691, test_f1: 0.5410
 epoch: 49, train_loss: 0.7516, test_loss: 1.0961, test_f1: 0.5102
 epoch: 50, train_loss: 0.7409, test_loss: 1.0954, test_f1: 0.5370
 epoch: 51, train_loss: 0.7093, test_loss: 1.1158, test_f1: 0.5579
 epoch: 52, train_loss: 0.6716, test_loss: 1.0901, test_f1: 0.5713
 epoch: 53, train_loss: 0.6673, test_loss: 1.1962, test_f1: 0.5674
 epoch: 54, train_loss: 0.6599, test_loss: 1.1047, test_f1: 0.5616
 epoch: 55, train_loss: 0.6627, test_loss: 1.2429, test_f1: 0.5735
 epoch: 56, train_loss: 0.6695, test_loss: 1.1503, test_f1: 0.5282
 epoch: 57, train_loss: 0.6754, test_loss: 1.2613, test_f1: 0.5400
 epoch: 58, train_loss: 0.6603, test_loss: 1.4005, test_f1: 0.5335
 epoch: 59, train_loss: 0.6483, test_loss: 1.4381, test_f1: 0.5330
 epoch: 60, train_loss: 0.6424, test_loss: 1.2612, test_f1: 0.5439
 epoch: 61, train_loss: 0.6527, test_loss: 1.2375, test_f1: 0.5668
 epoch: 62, train_loss: 0.6503, test_loss: 1.0857, test_f1: 0.5773
 epoch: 63, train_loss: 0.6414, test_loss: 1.3955, test_f1: 0.5405
 epoch: 64, train_loss: 0.6445, test_loss: 1.3552, test_f1: 0.5810
 epoch: 65, train_loss: 0.6410, test_loss: 1.2651, test_f1: 0.5905
 epoch: 66, train_loss: 0.6431, test_loss: 1.1985, test_f1: 0.5558
 epoch: 67, train_loss: 0.6589, test_loss: 1.1109, test_f1: 0.5597
 epoch: 68, train_loss: 0.6553, test_loss: 1.3345, test_f1: 0.5747
 epoch: 69, train_loss: 0.6402, test_loss: 1.4270, test_f1: 0.5673
 epoch: 70, train_loss: 0.6487, test_loss: 1.3119, test_f1: 0.5516
 epoch: 71, train_loss: 0.6457, test_loss: 1.2022, test_f1: 0.5902
 epoch: 72, train_loss: 0.6338, test_loss: 1.4782, test_f1: 0.5843
 epoch: 73, train_loss: 0.6158, test_loss: 1.3693, test_f1: 0.6224
 epoch: 74, train_loss: 0.6573, test_loss: 1.2436, test_f1: 0.5581
 epoch: 75, train_loss: 0.6328, test_loss: 1.5401, test_f1: 0.5037
 epoch: 76, train_loss: 0.6032, test_loss: 1.3440, test_f1: 0.6069
 epoch: 77, train_loss: 0.6225, test_loss: 1.1438, test_f1: 0.5966
 epoch: 78, train_loss: 0.6452, test_loss: 1.1907, test_f1: 0.6159
 epoch: 79, train_loss: 0.6214, test_loss: 1.1766, test_f1: 0.5833
 epoch: 80, train_loss: 0.5875, test_loss: 1.2557, test_f1: 0.5589
 epoch: 81, train_loss: 0.6101, test_loss: 1.5241, test_f1: 0.5438
 epoch: 82, train_loss: 0.5979, test_loss: 1.0853, test_f1: 0.6410
 epoch: 83, train_loss: 0.6228, test_loss: 1.1564, test_f1: 0.6374
 epoch: 84, train_loss: 0.5975, test_loss: 1.1673, test_f1: 0.6686
 epoch: 85, train_loss: 0.5830, test_loss: 1.2436, test_f1: 0.5935
 epoch: 86, train_loss: 0.5910, test_loss: 1.2550, test_f1: 0.5798
 epoch: 87, train_loss: 0.6167, test_loss: 1.4516, test_f1: 0.6037
 epoch: 88, train_loss: 0.5812, test_loss: 1.1901, test_f1: 0.6277
 epoch: 89, train_loss: 0.5758, test_loss: 1.3401, test_f1: 0.5923
 epoch: 90, train_loss: 0.5921, test_loss: 1.2773, test_f1: 0.5747
 epoch: 91, train_loss: 0.6030, test_loss: 1.3698, test_f1: 0.5906
 epoch: 92, train_loss: 0.6254, test_loss: 1.3990, test_f1: 0.5610
 epoch: 93, train_loss: 0.5899, test_loss: 1.3231, test_f1: 0.6013
 epoch: 94, train_loss: 0.5874, test_loss: 1.3659, test_f1: 0.5705
 epoch: 95, train_loss: 0.5827, test_loss: 1.3241, test_f1: 0.6021
 epoch: 96, train_loss: 0.5857, test_loss: 1.2125, test_f1: 0.6395
 epoch: 97, train_loss: 0.5868, test_loss: 1.3647, test_f1: 0.5678
 epoch: 98, train_loss: 0.6196, test_loss: 1.4189, test_f1: 0.5919
 epoch: 99, train_loss: 0.5896, test_loss: 1.2491, test_f1: 0.5800
##################ITERATION #6 ****************************************
 epoch: 0, train_loss: 1.2776, test_loss: 1.3901, test_f1: 0.1368
 epoch: 1, train_loss: 1.0534, test_loss: 1.2687, test_f1: 0.3283
 epoch: 2, train_loss: 1.0259, test_loss: 1.0846, test_f1: 0.5193
 epoch: 3, train_loss: 0.9881, test_loss: 1.0479, test_f1: 0.4581
 epoch: 4, train_loss: 0.9532, test_loss: 1.1000, test_f1: 0.5320
 epoch: 5, train_loss: 0.9497, test_loss: 1.1170, test_f1: 0.5027
 epoch: 6, train_loss: 0.9559, test_loss: 1.2456, test_f1: 0.4563
 epoch: 7, train_loss: 0.9390, test_loss: 1.1798, test_f1: 0.3836
 epoch: 8, train_loss: 0.9418, test_loss: 1.0281, test_f1: 0.4492
 epoch: 9, train_loss: 0.9176, test_loss: 1.0461, test_f1: 0.5209
 epoch: 10, train_loss: 0.8922, test_loss: 0.9969, test_f1: 0.5450
 epoch: 11, train_loss: 0.8565, test_loss: 1.0981, test_f1: 0.5202
 epoch: 12, train_loss: 0.8637, test_loss: 1.1037, test_f1: 0.4342
 epoch: 13, train_loss: 0.8714, test_loss: 1.0421, test_f1: 0.5006
 epoch: 14, train_loss: 0.8639, test_loss: 1.0704, test_f1: 0.4922
 epoch: 15, train_loss: 0.8770, test_loss: 1.0134, test_f1: 0.6001
 epoch: 16, train_loss: 0.8411, test_loss: 1.0392, test_f1: 0.5233
 epoch: 17, train_loss: 0.8273, test_loss: 1.0750, test_f1: 0.5140
 epoch: 18, train_loss: 0.8378, test_loss: 1.0393, test_f1: 0.5274
 epoch: 19, train_loss: 0.8388, test_loss: 1.0119, test_f1: 0.5322
 epoch: 20, train_loss: 0.8243, test_loss: 1.0363, test_f1: 0.5511
 epoch: 21, train_loss: 0.8347, test_loss: 1.1216, test_f1: 0.4580
 epoch: 22, train_loss: 0.8202, test_loss: 1.0827, test_f1: 0.5320
 epoch: 23, train_loss: 0.8094, test_loss: 1.0324, test_f1: 0.5440
 epoch: 24, train_loss: 0.8221, test_loss: 1.1273, test_f1: 0.4995
 epoch: 25, train_loss: 0.8063, test_loss: 1.0889, test_f1: 0.5085
 epoch: 26, train_loss: 0.8040, test_loss: 1.0630, test_f1: 0.5216
 epoch: 27, train_loss: 0.8204, test_loss: 0.9979, test_f1: 0.5886
 epoch: 28, train_loss: 0.7979, test_loss: 1.1604, test_f1: 0.5405
 epoch: 29, train_loss: 0.8041, test_loss: 1.4065, test_f1: 0.4486
 epoch: 30, train_loss: 0.8193, test_loss: 0.9700, test_f1: 0.5612
 epoch: 31, train_loss: 0.7851, test_loss: 1.0448, test_f1: 0.5892
 epoch: 32, train_loss: 0.8018, test_loss: 0.9769, test_f1: 0.6055
 epoch: 33, train_loss: 0.7717, test_loss: 1.0217, test_f1: 0.5632
 epoch: 34, train_loss: 0.7871, test_loss: 1.0698, test_f1: 0.5864
 epoch: 35, train_loss: 0.7865, test_loss: 1.3715, test_f1: 0.4617
 epoch: 36, train_loss: 0.7862, test_loss: 1.1071, test_f1: 0.5678
 epoch: 37, train_loss: 0.7861, test_loss: 1.0944, test_f1: 0.5587
 epoch: 38, train_loss: 0.7735, test_loss: 1.3452, test_f1: 0.5224
 epoch: 39, train_loss: 0.7854, test_loss: 2.9090, test_f1: 0.3438
 epoch: 40, train_loss: 0.8995, test_loss: 2.3690, test_f1: 0.4090
 epoch: 41, train_loss: 0.9064, test_loss: 0.9809, test_f1: 0.5543
 epoch: 42, train_loss: 0.8652, test_loss: 1.0890, test_f1: 0.5546
 epoch: 43, train_loss: 0.8892, test_loss: 1.2665, test_f1: 0.4538
 epoch: 44, train_loss: 0.8433, test_loss: 1.0065, test_f1: 0.5733
 epoch: 45, train_loss: 0.8406, test_loss: 1.0166, test_f1: 0.4743
 epoch: 46, train_loss: 0.8472, test_loss: 0.9588, test_f1: 0.5551
 epoch: 47, train_loss: 0.8386, test_loss: 1.0042, test_f1: 0.5429
 epoch: 48, train_loss: 0.8061, test_loss: 1.0417, test_f1: 0.5583
 epoch: 49, train_loss: 0.8006, test_loss: 0.9730, test_f1: 0.5923
 epoch: 50, train_loss: 0.7906, test_loss: 0.9931, test_f1: 0.6296
 epoch: 51, train_loss: 0.7652, test_loss: 0.9725, test_f1: 0.6293
 epoch: 52, train_loss: 0.7663, test_loss: 0.9341, test_f1: 0.6301
 epoch: 53, train_loss: 0.7490, test_loss: 1.0267, test_f1: 0.6094
 epoch: 54, train_loss: 0.7294, test_loss: 1.0399, test_f1: 0.5835
 epoch: 55, train_loss: 0.7462, test_loss: 0.9617, test_f1: 0.6395
 epoch: 56, train_loss: 0.7387, test_loss: 0.9672, test_f1: 0.6109
 epoch: 57, train_loss: 0.7216, test_loss: 0.9581, test_f1: 0.6238
 epoch: 58, train_loss: 0.7087, test_loss: 1.0340, test_f1: 0.5757
 epoch: 59, train_loss: 0.7232, test_loss: 1.0175, test_f1: 0.5652
 epoch: 60, train_loss: 0.7299, test_loss: 1.0129, test_f1: 0.5865
 epoch: 61, train_loss: 0.7129, test_loss: 1.0864, test_f1: 0.5741
 epoch: 62, train_loss: 0.7061, test_loss: 0.9817, test_f1: 0.6029
 epoch: 63, train_loss: 0.6952, test_loss: 0.9419, test_f1: 0.6045
 epoch: 64, train_loss: 0.6942, test_loss: 1.0675, test_f1: 0.5507
 epoch: 65, train_loss: 0.7068, test_loss: 0.9884, test_f1: 0.5837
 epoch: 66, train_loss: 0.6985, test_loss: 1.0156, test_f1: 0.5802
 epoch: 67, train_loss: 0.6988, test_loss: 0.9805, test_f1: 0.5561
 epoch: 68, train_loss: 0.7183, test_loss: 0.9369, test_f1: 0.6177
 epoch: 69, train_loss: 0.6905, test_loss: 1.0464, test_f1: 0.5709
 epoch: 70, train_loss: 0.7037, test_loss: 0.9638, test_f1: 0.6199
 epoch: 71, train_loss: 0.7065, test_loss: 1.1489, test_f1: 0.4968
 epoch: 72, train_loss: 0.6931, test_loss: 0.9804, test_f1: 0.5795
 epoch: 73, train_loss: 0.6767, test_loss: 1.2038, test_f1: 0.5379
 epoch: 74, train_loss: 0.6898, test_loss: 1.0824, test_f1: 0.5639
 epoch: 75, train_loss: 0.6968, test_loss: 0.9916, test_f1: 0.5863
 epoch: 76, train_loss: 0.6908, test_loss: 1.0767, test_f1: 0.5725
 epoch: 77, train_loss: 0.6907, test_loss: 1.0369, test_f1: 0.6006
 epoch: 78, train_loss: 0.6909, test_loss: 1.0505, test_f1: 0.6041
 epoch: 79, train_loss: 0.6682, test_loss: 1.0299, test_f1: 0.6372
 epoch: 80, train_loss: 0.6821, test_loss: 1.0714, test_f1: 0.5451
 epoch: 81, train_loss: 0.6570, test_loss: 1.0536, test_f1: 0.6089
 epoch: 82, train_loss: 0.6771, test_loss: 1.0743, test_f1: 0.5780
 epoch: 83, train_loss: 0.6570, test_loss: 1.0593, test_f1: 0.5870
 epoch: 84, train_loss: 0.6592, test_loss: 1.0670, test_f1: 0.6140
 epoch: 85, train_loss: 0.6422, test_loss: 1.0347, test_f1: 0.6144
 epoch: 86, train_loss: 0.6510, test_loss: 1.3575, test_f1: 0.5451
 epoch: 87, train_loss: 0.6690, test_loss: 1.0882, test_f1: 0.6148
 epoch: 88, train_loss: 0.6693, test_loss: 1.0583, test_f1: 0.6040
 epoch: 89, train_loss: 0.6480, test_loss: 1.1264, test_f1: 0.6131
 epoch: 90, train_loss: 0.6509, test_loss: 1.1269, test_f1: 0.5914
 epoch: 91, train_loss: 0.6370, test_loss: 1.2915, test_f1: 0.5480
 epoch: 92, train_loss: 0.6305, test_loss: 1.2552, test_f1: 0.5873
 epoch: 93, train_loss: 0.6335, test_loss: 1.0967, test_f1: 0.5981
 epoch: 94, train_loss: 0.6434, test_loss: 1.0775, test_f1: 0.6028
 epoch: 95, train_loss: 0.6576, test_loss: 1.0911, test_f1: 0.5927
 epoch: 96, train_loss: 0.6647, test_loss: 1.0932, test_f1: 0.6090
 epoch: 97, train_loss: 0.6344, test_loss: 1.0661, test_f1: 0.5706
 epoch: 98, train_loss: 0.6195, test_loss: 1.1608, test_f1: 0.5731
 epoch: 99, train_loss: 0.6193, test_loss: 1.0941, test_f1: 0.6536
##################ITERATION #7 ****************************************
 epoch: 0, train_loss: 1.1850, test_loss: 1.2640, test_f1: 0.3622
 epoch: 1, train_loss: 1.0413, test_loss: 1.1120, test_f1: 0.3799
 epoch: 2, train_loss: 1.0038, test_loss: 1.1351, test_f1: 0.5093
 epoch: 3, train_loss: 0.9832, test_loss: 1.1175, test_f1: 0.4876
 epoch: 4, train_loss: 0.9883, test_loss: 1.2358, test_f1: 0.3845
 epoch: 5, train_loss: 0.9779, test_loss: 1.0144, test_f1: 0.5230
 epoch: 6, train_loss: 0.9682, test_loss: 1.0350, test_f1: 0.5322
 epoch: 7, train_loss: 0.9577, test_loss: 1.0552, test_f1: 0.5003
 epoch: 8, train_loss: 0.9416, test_loss: 1.0147, test_f1: 0.5041
 epoch: 9, train_loss: 0.9215, test_loss: 1.2129, test_f1: 0.4850
 epoch: 10, train_loss: 0.9220, test_loss: 1.0273, test_f1: 0.5074
 epoch: 11, train_loss: 0.9154, test_loss: 1.0195, test_f1: 0.5251
 epoch: 12, train_loss: 0.9006, test_loss: 1.0254, test_f1: 0.5399
 epoch: 13, train_loss: 0.9001, test_loss: 1.1916, test_f1: 0.4494
 epoch: 14, train_loss: 0.8842, test_loss: 1.0716, test_f1: 0.5211
 epoch: 15, train_loss: 0.8758, test_loss: 0.9982, test_f1: 0.5759
 epoch: 16, train_loss: 0.8395, test_loss: 1.1286, test_f1: 0.4666
 epoch: 17, train_loss: 0.8545, test_loss: 0.9979, test_f1: 0.5483
 epoch: 18, train_loss: 0.8071, test_loss: 0.9858, test_f1: 0.5620
 epoch: 19, train_loss: 0.8395, test_loss: 1.6665, test_f1: 0.5245
 epoch: 20, train_loss: 0.8399, test_loss: 1.2192, test_f1: 0.5078
 epoch: 21, train_loss: 0.8475, test_loss: 1.1057, test_f1: 0.5476
 epoch: 22, train_loss: 0.8414, test_loss: 1.1827, test_f1: 0.4278
 epoch: 23, train_loss: 0.8512, test_loss: 1.1294, test_f1: 0.5759
 epoch: 24, train_loss: 0.8168, test_loss: 0.9504, test_f1: 0.5654
 epoch: 25, train_loss: 0.8109, test_loss: 1.1426, test_f1: 0.4692
 epoch: 26, train_loss: 0.7955, test_loss: 1.1784, test_f1: 0.5295
 epoch: 27, train_loss: 0.8007, test_loss: 1.6187, test_f1: 0.4738
 epoch: 28, train_loss: 0.8035, test_loss: 1.2268, test_f1: 0.4411
 epoch: 29, train_loss: 0.8153, test_loss: 1.1497, test_f1: 0.5194
 epoch: 30, train_loss: 0.7948, test_loss: 1.2738, test_f1: 0.4708
 epoch: 31, train_loss: 0.7946, test_loss: 1.0537, test_f1: 0.5202
 epoch: 32, train_loss: 0.7927, test_loss: 1.5093, test_f1: 0.4706
 epoch: 33, train_loss: 0.8067, test_loss: 1.1318, test_f1: 0.5517
 epoch: 34, train_loss: 0.7825, test_loss: 1.0368, test_f1: 0.6047
 epoch: 35, train_loss: 0.7903, test_loss: 1.0429, test_f1: 0.5522
 epoch: 36, train_loss: 0.7626, test_loss: 1.5585, test_f1: 0.4915
 epoch: 37, train_loss: 0.7775, test_loss: 1.0432, test_f1: 0.5083
 epoch: 38, train_loss: 0.7828, test_loss: 1.0167, test_f1: 0.5794
 epoch: 39, train_loss: 0.7700, test_loss: 1.5244, test_f1: 0.5121
 epoch: 40, train_loss: 0.7720, test_loss: 1.0147, test_f1: 0.5877
 epoch: 41, train_loss: 0.7586, test_loss: 1.0407, test_f1: 0.5435
 epoch: 42, train_loss: 0.7725, test_loss: 1.0049, test_f1: 0.5499
 epoch: 43, train_loss: 0.7339, test_loss: 1.2028, test_f1: 0.5305
 epoch: 44, train_loss: 0.7589, test_loss: 1.3992, test_f1: 0.5334
 epoch: 45, train_loss: 0.7847, test_loss: 1.1631, test_f1: 0.5055
 epoch: 46, train_loss: 0.7535, test_loss: 0.9568, test_f1: 0.5807
 epoch: 47, train_loss: 0.7271, test_loss: 1.0297, test_f1: 0.5626
 epoch: 48, train_loss: 0.7487, test_loss: 1.0028, test_f1: 0.5152
 epoch: 49, train_loss: 0.7530, test_loss: 1.1143, test_f1: 0.4957
 epoch: 50, train_loss: 0.7354, test_loss: 1.5519, test_f1: 0.4718
 epoch: 51, train_loss: 0.7361, test_loss: 0.9965, test_f1: 0.5684
 epoch: 52, train_loss: 0.7090, test_loss: 1.0032, test_f1: 0.5856
 epoch: 53, train_loss: 0.7077, test_loss: 0.9574, test_f1: 0.5948
 epoch: 54, train_loss: 0.7027, test_loss: 1.0145, test_f1: 0.5722
 epoch: 55, train_loss: 0.6907, test_loss: 1.0256, test_f1: 0.5844
 epoch: 56, train_loss: 0.6941, test_loss: 0.9367, test_f1: 0.6020
 epoch: 57, train_loss: 0.6883, test_loss: 1.1567, test_f1: 0.5668
 epoch: 58, train_loss: 0.6956, test_loss: 1.1586, test_f1: 0.5557
 epoch: 59, train_loss: 0.6939, test_loss: 1.1501, test_f1: 0.5716
 epoch: 60, train_loss: 0.6863, test_loss: 1.0421, test_f1: 0.5995
 epoch: 61, train_loss: 0.6664, test_loss: 1.0583, test_f1: 0.5946
 epoch: 62, train_loss: 0.6733, test_loss: 1.0998, test_f1: 0.5717
 epoch: 63, train_loss: 0.6656, test_loss: 1.1529, test_f1: 0.5339
 epoch: 64, train_loss: 0.6750, test_loss: 1.1595, test_f1: 0.5847
 epoch: 65, train_loss: 0.7087, test_loss: 1.0607, test_f1: 0.6002
 epoch: 66, train_loss: 0.7250, test_loss: 1.1679, test_f1: 0.5956
 epoch: 67, train_loss: 0.6672, test_loss: 1.1611, test_f1: 0.5662
 epoch: 68, train_loss: 0.6676, test_loss: 1.1032, test_f1: 0.6363
 epoch: 69, train_loss: 0.6538, test_loss: 1.0665, test_f1: 0.6126
 epoch: 70, train_loss: 0.6587, test_loss: 1.1245, test_f1: 0.5802
 epoch: 71, train_loss: 0.6564, test_loss: 1.0655, test_f1: 0.5837
 epoch: 72, train_loss: 0.6628, test_loss: 1.0010, test_f1: 0.6381
 epoch: 73, train_loss: 0.6475, test_loss: 1.3527, test_f1: 0.5643
 epoch: 74, train_loss: 0.6524, test_loss: 1.3017, test_f1: 0.5889
 epoch: 75, train_loss: 0.6554, test_loss: 1.1154, test_f1: 0.5975
 epoch: 76, train_loss: 0.6401, test_loss: 1.1152, test_f1: 0.6223
 epoch: 77, train_loss: 0.6364, test_loss: 1.2284, test_f1: 0.6413
 epoch: 78, train_loss: 0.6523, test_loss: 1.3240, test_f1: 0.5910
 epoch: 79, train_loss: 0.6597, test_loss: 1.2276, test_f1: 0.5895
 epoch: 80, train_loss: 0.6573, test_loss: 1.1466, test_f1: 0.5742
 epoch: 81, train_loss: 0.6313, test_loss: 1.1577, test_f1: 0.5961
 epoch: 82, train_loss: 0.6410, test_loss: 1.3341, test_f1: 0.5974
 epoch: 83, train_loss: 0.6136, test_loss: 1.2275, test_f1: 0.6358
 epoch: 84, train_loss: 0.6409, test_loss: 1.2517, test_f1: 0.5722
 epoch: 85, train_loss: 0.6211, test_loss: 1.1349, test_f1: 0.5935
 epoch: 86, train_loss: 0.6281, test_loss: 1.2522, test_f1: 0.5613
 epoch: 87, train_loss: 0.6094, test_loss: 1.1945, test_f1: 0.6070
 epoch: 88, train_loss: 0.6208, test_loss: 1.4106, test_f1: 0.5689
 epoch: 89, train_loss: 0.6267, test_loss: 1.2184, test_f1: 0.6303
 epoch: 90, train_loss: 0.6096, test_loss: 1.2344, test_f1: 0.6036
 epoch: 91, train_loss: 0.6002, test_loss: 1.1177, test_f1: 0.5666
 epoch: 92, train_loss: 0.6256, test_loss: 1.2575, test_f1: 0.5585
 epoch: 93, train_loss: 0.6298, test_loss: 1.3058, test_f1: 0.6100
 epoch: 94, train_loss: 0.6292, test_loss: 1.4455, test_f1: 0.5832
 epoch: 95, train_loss: 0.6129, test_loss: 1.1167, test_f1: 0.6375
 epoch: 96, train_loss: 0.5967, test_loss: 1.2195, test_f1: 0.5846
 epoch: 97, train_loss: 0.6046, test_loss: 1.1130, test_f1: 0.5732
 epoch: 98, train_loss: 0.6334, test_loss: 1.1757, test_f1: 0.6104
 epoch: 99, train_loss: 0.6036, test_loss: 1.3321, test_f1: 0.5592
##################ITERATION #8 ****************************************
 epoch: 0, train_loss: 1.1830, test_loss: 1.1785, test_f1: 0.3205
 epoch: 1, train_loss: 1.0240, test_loss: 1.1844, test_f1: 0.3625
 epoch: 2, train_loss: 0.9881, test_loss: 1.0537, test_f1: 0.4551
 epoch: 3, train_loss: 0.9698, test_loss: 1.0499, test_f1: 0.5096
 epoch: 4, train_loss: 0.9399, test_loss: 1.0701, test_f1: 0.4915
 epoch: 5, train_loss: 0.9284, test_loss: 1.0451, test_f1: 0.4974
 epoch: 6, train_loss: 0.9000, test_loss: 0.9671, test_f1: 0.5996
 epoch: 7, train_loss: 0.8793, test_loss: 1.0722, test_f1: 0.5413
 epoch: 8, train_loss: 0.8604, test_loss: 1.0028, test_f1: 0.5163
 epoch: 9, train_loss: 0.8481, test_loss: 0.9797, test_f1: 0.5305
 epoch: 10, train_loss: 0.8405, test_loss: 1.0242, test_f1: 0.5415
 epoch: 11, train_loss: 0.8335, test_loss: 2.3499, test_f1: 0.3857
 epoch: 12, train_loss: 0.8400, test_loss: 1.6347, test_f1: 0.4662
 epoch: 13, train_loss: 0.8187, test_loss: 1.1190, test_f1: 0.5447
 epoch: 14, train_loss: 0.7732, test_loss: 1.0512, test_f1: 0.5604
 epoch: 15, train_loss: 0.7895, test_loss: 2.3115, test_f1: 0.4086
 epoch: 16, train_loss: 0.7937, test_loss: 1.1780, test_f1: 0.4770
 epoch: 17, train_loss: 0.8228, test_loss: 1.0820, test_f1: 0.5626
 epoch: 18, train_loss: 0.8129, test_loss: 1.4999, test_f1: 0.4564
 epoch: 19, train_loss: 0.7986, test_loss: 1.0049, test_f1: 0.5697
 epoch: 20, train_loss: 0.7912, test_loss: 1.1854, test_f1: 0.5206
 epoch: 21, train_loss: 0.7768, test_loss: 1.0130, test_f1: 0.5566
 epoch: 22, train_loss: 0.7987, test_loss: 0.9933, test_f1: 0.5614
 epoch: 23, train_loss: 0.7490, test_loss: 1.1200, test_f1: 0.5147
 epoch: 24, train_loss: 0.7859, test_loss: 1.5399, test_f1: 0.3978
 epoch: 25, train_loss: 0.7656, test_loss: 1.2474, test_f1: 0.5359
 epoch: 26, train_loss: 0.7755, test_loss: 1.0587, test_f1: 0.5108
 epoch: 27, train_loss: 0.7616, test_loss: 1.1900, test_f1: 0.5223
 epoch: 28, train_loss: 0.7481, test_loss: 1.0150, test_f1: 0.5745
 epoch: 29, train_loss: 0.7426, test_loss: 1.3702, test_f1: 0.5162
 epoch: 30, train_loss: 0.7500, test_loss: 1.6935, test_f1: 0.4174
 epoch: 31, train_loss: 0.7814, test_loss: 1.7212, test_f1: 0.4388
 epoch: 32, train_loss: 0.7815, test_loss: 1.0376, test_f1: 0.5940
 epoch: 33, train_loss: 0.7857, test_loss: 1.1122, test_f1: 0.5096
 epoch: 34, train_loss: 0.7740, test_loss: 1.0228, test_f1: 0.5374
 epoch: 35, train_loss: 0.7779, test_loss: 1.2632, test_f1: 0.5260
 epoch: 36, train_loss: 0.7488, test_loss: 1.0704, test_f1: 0.5366
 epoch: 37, train_loss: 0.7429, test_loss: 1.1012, test_f1: 0.4863
 epoch: 38, train_loss: 0.7606, test_loss: 0.9952, test_f1: 0.5501
 epoch: 39, train_loss: 0.7374, test_loss: 1.1730, test_f1: 0.5723
 epoch: 40, train_loss: 0.7269, test_loss: 1.0246, test_f1: 0.5486
 epoch: 41, train_loss: 0.7369, test_loss: 1.2522, test_f1: 0.4662
 epoch: 42, train_loss: 0.7160, test_loss: 1.1649, test_f1: 0.5222
 epoch: 43, train_loss: 0.7265, test_loss: 1.6061, test_f1: 0.5121
 epoch: 44, train_loss: 0.7218, test_loss: 1.5403, test_f1: 0.5269
 epoch: 45, train_loss: 0.7209, test_loss: 1.0788, test_f1: 0.5841
 epoch: 46, train_loss: 0.7006, test_loss: 1.3374, test_f1: 0.5703
 epoch: 47, train_loss: 0.6978, test_loss: 1.1340, test_f1: 0.5495
 epoch: 48, train_loss: 0.7200, test_loss: 1.8708, test_f1: 0.4787
 epoch: 49, train_loss: 0.7200, test_loss: 1.1409, test_f1: 0.5292
 epoch: 50, train_loss: 0.7490, test_loss: 1.2212, test_f1: 0.5771
 epoch: 51, train_loss: 0.7056, test_loss: 1.0999, test_f1: 0.5833
 epoch: 52, train_loss: 0.6842, test_loss: 1.2879, test_f1: 0.5962
 epoch: 53, train_loss: 0.6642, test_loss: 1.1052, test_f1: 0.6176
 epoch: 54, train_loss: 0.6634, test_loss: 1.1907, test_f1: 0.5983
 epoch: 55, train_loss: 0.6709, test_loss: 1.3320, test_f1: 0.5533
 epoch: 56, train_loss: 0.6706, test_loss: 1.4637, test_f1: 0.4921
 epoch: 57, train_loss: 0.6651, test_loss: 1.1243, test_f1: 0.5804
 epoch: 58, train_loss: 0.6564, test_loss: 1.2502, test_f1: 0.5701
 epoch: 59, train_loss: 0.6348, test_loss: 1.6482, test_f1: 0.5050
 epoch: 60, train_loss: 0.6178, test_loss: 1.1956, test_f1: 0.5802
 epoch: 61, train_loss: 0.6481, test_loss: 1.7372, test_f1: 0.5630
 epoch: 62, train_loss: 0.6303, test_loss: 1.2834, test_f1: 0.6026
 epoch: 63, train_loss: 0.6244, test_loss: 1.3309, test_f1: 0.5623
 epoch: 64, train_loss: 0.6229, test_loss: 1.2453, test_f1: 0.6036
 epoch: 65, train_loss: 0.6284, test_loss: 1.5698, test_f1: 0.5778
 epoch: 66, train_loss: 0.6335, test_loss: 1.4068, test_f1: 0.5521
 epoch: 67, train_loss: 0.6102, test_loss: 1.3598, test_f1: 0.5232
 epoch: 68, train_loss: 0.6139, test_loss: 1.4631, test_f1: 0.5653
 epoch: 69, train_loss: 0.6402, test_loss: 1.5589, test_f1: 0.5675
 epoch: 70, train_loss: 0.6468, test_loss: 1.4837, test_f1: 0.5808
 epoch: 71, train_loss: 0.6444, test_loss: 1.2046, test_f1: 0.5503
 epoch: 72, train_loss: 0.6357, test_loss: 1.3648, test_f1: 0.5860
 epoch: 73, train_loss: 0.6171, test_loss: 1.5033, test_f1: 0.5855
 epoch: 74, train_loss: 0.6349, test_loss: 1.3192, test_f1: 0.6148
 epoch: 75, train_loss: 0.6101, test_loss: 1.2252, test_f1: 0.6130
 epoch: 76, train_loss: 0.6183, test_loss: 1.6819, test_f1: 0.5748
 epoch: 77, train_loss: 0.6135, test_loss: 1.2914, test_f1: 0.5902
 epoch: 78, train_loss: 0.6254, test_loss: 1.4102, test_f1: 0.5622
 epoch: 79, train_loss: 0.6322, test_loss: 1.2684, test_f1: 0.5743
 epoch: 80, train_loss: 0.6073, test_loss: 1.4623, test_f1: 0.5509
 epoch: 81, train_loss: 0.5829, test_loss: 1.2177, test_f1: 0.5977
 epoch: 82, train_loss: 0.5949, test_loss: 1.4343, test_f1: 0.5592
 epoch: 83, train_loss: 0.5976, test_loss: 1.6247, test_f1: 0.6088
 epoch: 84, train_loss: 0.6141, test_loss: 1.1340, test_f1: 0.6005
 epoch: 85, train_loss: 0.6082, test_loss: 1.5438, test_f1: 0.5492
 epoch: 86, train_loss: 0.6232, test_loss: 1.5775, test_f1: 0.5318
 epoch: 87, train_loss: 0.6326, test_loss: 1.3892, test_f1: 0.5537
 epoch: 88, train_loss: 0.5923, test_loss: 1.3275, test_f1: 0.5920
 epoch: 89, train_loss: 0.5909, test_loss: 1.6720, test_f1: 0.5847
 epoch: 90, train_loss: 0.5976, test_loss: 1.5128, test_f1: 0.5362
 epoch: 91, train_loss: 0.5969, test_loss: 1.7064, test_f1: 0.5763
 epoch: 92, train_loss: 0.5768, test_loss: 1.3629, test_f1: 0.5806
 epoch: 93, train_loss: 0.5659, test_loss: 1.5663, test_f1: 0.5953
 epoch: 94, train_loss: 0.5897, test_loss: 1.2897, test_f1: 0.6064
 epoch: 95, train_loss: 0.6082, test_loss: 1.6127, test_f1: 0.5848
 epoch: 96, train_loss: 0.5909, test_loss: 1.5769, test_f1: 0.5721
 epoch: 97, train_loss: 0.5815, test_loss: 1.3704, test_f1: 0.5562
 epoch: 98, train_loss: 0.5697, test_loss: 1.5207, test_f1: 0.5872
 epoch: 99, train_loss: 0.5824, test_loss: 1.4482, test_f1: 0.6025
##################ITERATION #9 ****************************************
 epoch: 0, train_loss: 1.2585, test_loss: 1.2814, test_f1: 0.1963
 epoch: 1, train_loss: 1.0694, test_loss: 1.1457, test_f1: 0.3893
 epoch: 2, train_loss: 1.0321, test_loss: 1.1062, test_f1: 0.3947
 epoch: 3, train_loss: 0.9960, test_loss: 1.1194, test_f1: 0.4192
 epoch: 4, train_loss: 0.9718, test_loss: 1.0892, test_f1: 0.4479
 epoch: 5, train_loss: 0.9588, test_loss: 1.0174, test_f1: 0.4629
 epoch: 6, train_loss: 0.9563, test_loss: 1.0185, test_f1: 0.5288
 epoch: 7, train_loss: 0.9433, test_loss: 1.0022, test_f1: 0.5156
 epoch: 8, train_loss: 0.9174, test_loss: 1.0577, test_f1: 0.4880
 epoch: 9, train_loss: 0.9237, test_loss: 1.0151, test_f1: 0.5554
 epoch: 10, train_loss: 0.9091, test_loss: 1.0410, test_f1: 0.4962
 epoch: 11, train_loss: 0.9041, test_loss: 1.0087, test_f1: 0.5323
 epoch: 12, train_loss: 0.8939, test_loss: 1.0018, test_f1: 0.5420
 epoch: 13, train_loss: 0.8807, test_loss: 1.1347, test_f1: 0.4646
 epoch: 14, train_loss: 0.8949, test_loss: 1.0285, test_f1: 0.5298
 epoch: 15, train_loss: 0.8752, test_loss: 0.9686, test_f1: 0.5447
 epoch: 16, train_loss: 0.8806, test_loss: 1.3449, test_f1: 0.4407
 epoch: 17, train_loss: 0.8514, test_loss: 0.9842, test_f1: 0.5440
 epoch: 18, train_loss: 0.8596, test_loss: 1.0421, test_f1: 0.5300
 epoch: 19, train_loss: 0.8549, test_loss: 0.9645, test_f1: 0.5483
 epoch: 20, train_loss: 0.8432, test_loss: 1.0972, test_f1: 0.5336
 epoch: 21, train_loss: 0.8358, test_loss: 1.0212, test_f1: 0.5211
 epoch: 22, train_loss: 0.8366, test_loss: 1.0305, test_f1: 0.5038
 epoch: 23, train_loss: 0.8609, test_loss: 0.9999, test_f1: 0.5400
 epoch: 24, train_loss: 0.8455, test_loss: 0.9905, test_f1: 0.5344
 epoch: 25, train_loss: 0.8577, test_loss: 1.4210, test_f1: 0.4879
 epoch: 26, train_loss: 0.8422, test_loss: 1.0003, test_f1: 0.5434
 epoch: 27, train_loss: 0.8196, test_loss: 1.0009, test_f1: 0.4903
 epoch: 28, train_loss: 0.8332, test_loss: 0.9790, test_f1: 0.5611
 epoch: 29, train_loss: 0.8057, test_loss: 0.9919, test_f1: 0.5469
 epoch: 30, train_loss: 0.8031, test_loss: 1.0610, test_f1: 0.5514
 epoch: 31, train_loss: 0.8155, test_loss: 0.9824, test_f1: 0.5440
 epoch: 32, train_loss: 0.8035, test_loss: 1.0097, test_f1: 0.5595
 epoch: 33, train_loss: 0.8178, test_loss: 1.3513, test_f1: 0.4346
 epoch: 34, train_loss: 0.8007, test_loss: 1.1756, test_f1: 0.5118
 epoch: 35, train_loss: 0.7688, test_loss: 1.1034, test_f1: 0.5438
 epoch: 36, train_loss: 0.7794, test_loss: 0.9862, test_f1: 0.5493
 epoch: 37, train_loss: 0.8006, test_loss: 1.1206, test_f1: 0.4856
 epoch: 38, train_loss: 0.7918, test_loss: 0.9914, test_f1: 0.5303
 epoch: 39, train_loss: 0.7957, test_loss: 1.0006, test_f1: 0.5752
 epoch: 40, train_loss: 0.7823, test_loss: 1.1298, test_f1: 0.5049
 epoch: 41, train_loss: 0.8028, test_loss: 1.1373, test_f1: 0.4209
 epoch: 42, train_loss: 0.7942, test_loss: 0.9732, test_f1: 0.5885
 epoch: 43, train_loss: 0.7778, test_loss: 1.0073, test_f1: 0.5456
 epoch: 44, train_loss: 0.8093, test_loss: 0.9781, test_f1: 0.5450
 epoch: 45, train_loss: 0.8115, test_loss: 1.0023, test_f1: 0.5885
 epoch: 46, train_loss: 0.7939, test_loss: 1.1987, test_f1: 0.5248
 epoch: 47, train_loss: 0.7848, test_loss: 1.5194, test_f1: 0.4563
 epoch: 48, train_loss: 0.7635, test_loss: 1.0167, test_f1: 0.5801
 epoch: 49, train_loss: 0.7790, test_loss: 1.1247, test_f1: 0.5249
 epoch: 50, train_loss: 0.7874, test_loss: 1.0073, test_f1: 0.5288
 epoch: 51, train_loss: 0.7506, test_loss: 1.0397, test_f1: 0.5519
 epoch: 52, train_loss: 0.7554, test_loss: 1.0233, test_f1: 0.5686
 epoch: 53, train_loss: 0.7382, test_loss: 1.0079, test_f1: 0.5823
 epoch: 54, train_loss: 0.7240, test_loss: 1.0532, test_f1: 0.5830
 epoch: 55, train_loss: 0.7164, test_loss: 1.0582, test_f1: 0.5317
 epoch: 56, train_loss: 0.6932, test_loss: 1.1363, test_f1: 0.5382
 epoch: 57, train_loss: 0.7112, test_loss: 1.1006, test_f1: 0.5253
 epoch: 58, train_loss: 0.7352, test_loss: 1.0411, test_f1: 0.5470
 epoch: 59, train_loss: 0.7279, test_loss: 1.0338, test_f1: 0.5814
 epoch: 60, train_loss: 0.7424, test_loss: 1.0537, test_f1: 0.6209
 epoch: 61, train_loss: 0.6989, test_loss: 1.0031, test_f1: 0.5753
 epoch: 62, train_loss: 0.7053, test_loss: 1.1630, test_f1: 0.5277
 epoch: 63, train_loss: 0.7134, test_loss: 0.9784, test_f1: 0.6064
 epoch: 64, train_loss: 0.7102, test_loss: 1.2263, test_f1: 0.5419
 epoch: 65, train_loss: 0.6933, test_loss: 1.1674, test_f1: 0.5523
 epoch: 66, train_loss: 0.6902, test_loss: 1.1320, test_f1: 0.5278
 epoch: 67, train_loss: 0.6932, test_loss: 1.1718, test_f1: 0.5894
 epoch: 68, train_loss: 0.6970, test_loss: 1.1539, test_f1: 0.5807
 epoch: 69, train_loss: 0.6989, test_loss: 1.2475, test_f1: 0.4727
 epoch: 70, train_loss: 0.6851, test_loss: 1.0849, test_f1: 0.5770
 epoch: 71, train_loss: 0.6959, test_loss: 1.0825, test_f1: 0.5693
 epoch: 72, train_loss: 0.6822, test_loss: 1.1054, test_f1: 0.5522
 epoch: 73, train_loss: 0.6909, test_loss: 1.1599, test_f1: 0.5620
 epoch: 74, train_loss: 0.6875, test_loss: 1.1391, test_f1: 0.5798
 epoch: 75, train_loss: 0.6927, test_loss: 1.1833, test_f1: 0.5319
 epoch: 76, train_loss: 0.6590, test_loss: 1.0872, test_f1: 0.5468
 epoch: 77, train_loss: 0.6672, test_loss: 1.2240, test_f1: 0.5960
 epoch: 78, train_loss: 0.7133, test_loss: 1.0466, test_f1: 0.5936
 epoch: 79, train_loss: 0.6851, test_loss: 1.1610, test_f1: 0.4784
 epoch: 80, train_loss: 0.6841, test_loss: 1.1359, test_f1: 0.5572
 epoch: 81, train_loss: 0.6524, test_loss: 1.1052, test_f1: 0.5912
 epoch: 82, train_loss: 0.6497, test_loss: 1.2012, test_f1: 0.5381
 epoch: 83, train_loss: 0.6629, test_loss: 1.1682, test_f1: 0.5690
 epoch: 84, train_loss: 0.6800, test_loss: 1.1044, test_f1: 0.5728
 epoch: 85, train_loss: 0.6505, test_loss: 1.2401, test_f1: 0.5719
 epoch: 86, train_loss: 0.6884, test_loss: 1.2227, test_f1: 0.5717
 epoch: 87, train_loss: 0.6539, test_loss: 1.1382, test_f1: 0.5897
 epoch: 88, train_loss: 0.6788, test_loss: 1.1051, test_f1: 0.5920
 epoch: 89, train_loss: 0.6684, test_loss: 1.2657, test_f1: 0.5647
 epoch: 90, train_loss: 0.6457, test_loss: 1.0643, test_f1: 0.5950
 epoch: 91, train_loss: 0.6687, test_loss: 1.1482, test_f1: 0.5767
 epoch: 92, train_loss: 0.6458, test_loss: 1.1928, test_f1: 0.5511
 epoch: 93, train_loss: 0.6401, test_loss: 1.1329, test_f1: 0.5805
 epoch: 94, train_loss: 0.6525, test_loss: 1.2695, test_f1: 0.5604
 epoch: 95, train_loss: 0.6460, test_loss: 1.5541, test_f1: 0.5331
 epoch: 96, train_loss: 0.6529, test_loss: 1.2775, test_f1: 0.5753
 epoch: 97, train_loss: 0.6610, test_loss: 1.0772, test_f1: 0.6087
 epoch: 98, train_loss: 0.6411, test_loss: 1.2934, test_f1: 0.5971
 epoch: 99, train_loss: 0.6258, test_loss: 1.1967, test_f1: 0.5757

Training completed in 527.53 seconds
Best F1: 0.6686 at epoch 84
Mean F1 across iterations: 0.6417  0.0167
========================FINAL RESULTS================================
FEGIN weighted F1: 0.6686  0.0167
python main.py --data ltspice_demos --representation component_pin_net --model FEGIN --layers 6 --hiddens 16 --batch_size 64 --lr 0.01 --emb_size 512 --epochs 100 --save_appendix component_pin_net_L6_H16_BS64_LR0.01_E512 --no_val
-----



STDERR:
  File "main.py", line 370, in <module>
    main()
  File "main.py", line 254, in main
    dataset = dataset_class(
  File "/home/philip/projects/ltspice_examples_code_repo/Circuit-Completion-Using-GNNs/component_classification_with_link_prediction_head/evaluation/FEGIN/kernel/circuit_datasets.py", line 15, in __init__
    self.data, self.slices = torch.load(self.processed_paths[0])
  File "/home/philip/.local/lib/python3.8/site-packages/torch/serialization.py", line 1040, in load
    warnings.warn(
  File "/usr/lib/python3.8/warnings.py", line 109, in _showwarnmsg
    sw(msg.message, msg.category, msg.filename, msg.lineno,
  File "main.py", line 47, in warn_with_traceback
    traceback.print_stack(file=log)
/home/philip/projects/ltspice_examples_code_repo/Circuit-Completion-Using-GNNs/component_classification_with_link_prediction_head/evaluation/FEGIN/kernel/circuit_datasets.py:15: FutureWarning: You are using `torch.load` with `weights_only=False` (the current default value), which uses the default pickle module implicitly. It is possible to construct malicious pickle data which will execute arbitrary code during unpickling (See https://github.com/pytorch/pytorch/blob/main/SECURITY.md#untrusted-models for more details). In a future release, the default value for `weights_only` will be flipped to `True`. This limits the functions that could be executed during unpickling. Arbitrary objects will no longer be allowed to be loaded via this mode unless they are explicitly allowlisted by the user via `torch.serialization.add_safe_globals`. We recommend you start setting `weights_only=True` for any use case where you don't have full control of the loaded file. Please open an issue on GitHub for any issues related to this experimental feature.
  self.data, self.slices = torch.load(self.processed_paths[0])
