STDOUT:
Results will be saved in /home/philip/projects/llm_inference_code_repo/Circuit-Completion-Using-GNNs/component_classification_with_link_prediction_head/evaluation/FEGIN/results/model_FEGIN_dataset_ltspice_examples
Command line input: python main.py --data ltspice_examples --representation component_component --model FEGIN --layers 2 --hiddens 128 --batch_size 256 --lr 0.0001 --emb_size 128 --epochs 100 --save_appendix component_component_L2_H128_BS256_LR0.0001_E128 --no_val
 is saved.
-----
ltspice_examples - FEGIN
Using 2 layers, 128 hidden units, h = 2
Loading component_component representation dataset
ENTERED
Training FEGIN on component_component representation
Train: 3556, Test: 845
##################ITERATION #0 ****************************************
 epoch: 0, train_loss: 1.3666, test_loss: 1.3634, test_f1: 0.2274
 epoch: 1, train_loss: 1.3494, test_loss: 1.3510, test_f1: 0.2274
 epoch: 2, train_loss: 1.3381, test_loss: 1.3373, test_f1: 0.2274
 epoch: 3, train_loss: 1.3248, test_loss: 1.3201, test_f1: 0.2274
 epoch: 4, train_loss: 1.3087, test_loss: 1.2997, test_f1: 0.2274
 epoch: 5, train_loss: 1.2917, test_loss: 1.2794, test_f1: 0.2274
 epoch: 6, train_loss: 1.2749, test_loss: 1.2601, test_f1: 0.2274
 epoch: 7, train_loss: 1.2581, test_loss: 1.2415, test_f1: 0.2300
 epoch: 8, train_loss: 1.2429, test_loss: 1.2245, test_f1: 0.2544
 epoch: 9, train_loss: 1.2277, test_loss: 1.2076, test_f1: 0.3011
 epoch: 10, train_loss: 1.2140, test_loss: 1.1910, test_f1: 0.3546
 epoch: 11, train_loss: 1.2006, test_loss: 1.1763, test_f1: 0.3674
 epoch: 12, train_loss: 1.1864, test_loss: 1.1616, test_f1: 0.3974
 epoch: 13, train_loss: 1.1695, test_loss: 1.1477, test_f1: 0.4194
 epoch: 14, train_loss: 1.1563, test_loss: 1.1348, test_f1: 0.4163
 epoch: 15, train_loss: 1.1419, test_loss: 1.1198, test_f1: 0.4235
 epoch: 16, train_loss: 1.1283, test_loss: 1.1071, test_f1: 0.4247
 epoch: 17, train_loss: 1.1170, test_loss: 1.0940, test_f1: 0.4267
 epoch: 18, train_loss: 1.1064, test_loss: 1.0823, test_f1: 0.4353
 epoch: 19, train_loss: 1.0958, test_loss: 1.0698, test_f1: 0.4359
 epoch: 20, train_loss: 1.0859, test_loss: 1.0607, test_f1: 0.4600
 epoch: 21, train_loss: 1.0734, test_loss: 1.0493, test_f1: 0.4379
 epoch: 22, train_loss: 1.0620, test_loss: 1.0430, test_f1: 0.4541
 epoch: 23, train_loss: 1.0514, test_loss: 1.0330, test_f1: 0.4510
 epoch: 24, train_loss: 1.0494, test_loss: 1.0198, test_f1: 0.4862
 epoch: 25, train_loss: 1.0334, test_loss: 1.0090, test_f1: 0.4842
 epoch: 26, train_loss: 1.0255, test_loss: 1.0013, test_f1: 0.4852
 epoch: 27, train_loss: 1.0174, test_loss: 0.9921, test_f1: 0.4814
 epoch: 28, train_loss: 1.0125, test_loss: 0.9897, test_f1: 0.4868
 epoch: 29, train_loss: 1.0009, test_loss: 0.9782, test_f1: 0.5020
 epoch: 30, train_loss: 0.9991, test_loss: 0.9713, test_f1: 0.4972
 epoch: 31, train_loss: 0.9873, test_loss: 0.9715, test_f1: 0.5012
 epoch: 32, train_loss: 0.9776, test_loss: 0.9637, test_f1: 0.5082
 epoch: 33, train_loss: 0.9641, test_loss: 0.9601, test_f1: 0.4907
 epoch: 34, train_loss: 0.9654, test_loss: 0.9492, test_f1: 0.5146
 epoch: 35, train_loss: 0.9505, test_loss: 0.9482, test_f1: 0.5101
 epoch: 36, train_loss: 0.9487, test_loss: 0.9454, test_f1: 0.5164
 epoch: 37, train_loss: 0.9398, test_loss: 0.9349, test_f1: 0.5114
 epoch: 38, train_loss: 0.9329, test_loss: 0.9399, test_f1: 0.5098
 epoch: 39, train_loss: 0.9228, test_loss: 0.9300, test_f1: 0.5282
 epoch: 40, train_loss: 0.9172, test_loss: 0.9318, test_f1: 0.5109
 epoch: 41, train_loss: 0.9134, test_loss: 0.9345, test_f1: 0.5231
 epoch: 42, train_loss: 0.9056, test_loss: 0.9289, test_f1: 0.5062
 epoch: 43, train_loss: 0.8978, test_loss: 0.9268, test_f1: 0.5219
 epoch: 44, train_loss: 0.8916, test_loss: 0.9351, test_f1: 0.5079
 epoch: 45, train_loss: 0.8842, test_loss: 0.9266, test_f1: 0.5161
 epoch: 46, train_loss: 0.8804, test_loss: 0.9257, test_f1: 0.5119
 epoch: 47, train_loss: 0.8729, test_loss: 0.9274, test_f1: 0.5167
 epoch: 48, train_loss: 0.8737, test_loss: 0.9277, test_f1: 0.5146
 epoch: 49, train_loss: 0.8649, test_loss: 0.9187, test_f1: 0.5288
 epoch: 50, train_loss: 0.8519, test_loss: 0.9182, test_f1: 0.5221
 epoch: 51, train_loss: 0.8545, test_loss: 0.9279, test_f1: 0.5160
 epoch: 52, train_loss: 0.8408, test_loss: 0.9269, test_f1: 0.5194
 epoch: 53, train_loss: 0.8400, test_loss: 0.9232, test_f1: 0.5264
 epoch: 54, train_loss: 0.8330, test_loss: 0.9158, test_f1: 0.5238
 epoch: 55, train_loss: 0.8334, test_loss: 0.9243, test_f1: 0.5204
 epoch: 56, train_loss: 0.8270, test_loss: 0.9283, test_f1: 0.5275
 epoch: 57, train_loss: 0.8232, test_loss: 0.9174, test_f1: 0.5249
 epoch: 58, train_loss: 0.8304, test_loss: 0.9234, test_f1: 0.5257
 epoch: 59, train_loss: 0.8210, test_loss: 0.9252, test_f1: 0.5299
 epoch: 60, train_loss: 0.8194, test_loss: 0.9225, test_f1: 0.5262
 epoch: 61, train_loss: 0.8111, test_loss: 0.9253, test_f1: 0.5247
 epoch: 62, train_loss: 0.8231, test_loss: 0.9266, test_f1: 0.5278
 epoch: 63, train_loss: 0.8143, test_loss: 0.9297, test_f1: 0.5333
 epoch: 64, train_loss: 0.8077, test_loss: 0.9291, test_f1: 0.5314
 epoch: 65, train_loss: 0.8119, test_loss: 0.9342, test_f1: 0.5310
 epoch: 66, train_loss: 0.8068, test_loss: 0.9429, test_f1: 0.5271
 epoch: 67, train_loss: 0.8074, test_loss: 0.9372, test_f1: 0.5317
 epoch: 68, train_loss: 0.8008, test_loss: 0.9332, test_f1: 0.5303
 epoch: 69, train_loss: 0.7990, test_loss: 0.9354, test_f1: 0.5293
 epoch: 70, train_loss: 0.7961, test_loss: 0.9401, test_f1: 0.5303
 epoch: 71, train_loss: 0.7878, test_loss: 0.9417, test_f1: 0.5290
 epoch: 72, train_loss: 0.7917, test_loss: 0.9418, test_f1: 0.5307
 epoch: 73, train_loss: 0.7900, test_loss: 0.9290, test_f1: 0.5325
 epoch: 74, train_loss: 0.7883, test_loss: 0.9396, test_f1: 0.5365
 epoch: 75, train_loss: 0.7790, test_loss: 0.9370, test_f1: 0.5405
 epoch: 76, train_loss: 0.7801, test_loss: 0.9440, test_f1: 0.5360
 epoch: 77, train_loss: 0.7761, test_loss: 0.9390, test_f1: 0.5335
 epoch: 78, train_loss: 0.7718, test_loss: 0.9463, test_f1: 0.5337
 epoch: 79, train_loss: 0.7727, test_loss: 0.9451, test_f1: 0.5364
 epoch: 80, train_loss: 0.7713, test_loss: 0.9438, test_f1: 0.5429
 epoch: 81, train_loss: 0.7624, test_loss: 0.9430, test_f1: 0.5459
 epoch: 82, train_loss: 0.7644, test_loss: 0.9431, test_f1: 0.5501
 epoch: 83, train_loss: 0.7611, test_loss: 0.9524, test_f1: 0.5419
 epoch: 84, train_loss: 0.7614, test_loss: 0.9552, test_f1: 0.5299
 epoch: 85, train_loss: 0.7510, test_loss: 0.9520, test_f1: 0.5407
 epoch: 86, train_loss: 0.7632, test_loss: 0.9485, test_f1: 0.5413
 epoch: 87, train_loss: 0.7576, test_loss: 0.9445, test_f1: 0.5436
 epoch: 88, train_loss: 0.7534, test_loss: 0.9632, test_f1: 0.5459
 epoch: 89, train_loss: 0.7411, test_loss: 0.9586, test_f1: 0.5489
 epoch: 90, train_loss: 0.7481, test_loss: 0.9505, test_f1: 0.5507
 epoch: 91, train_loss: 0.7434, test_loss: 0.9703, test_f1: 0.5480
 epoch: 92, train_loss: 0.7423, test_loss: 0.9704, test_f1: 0.5511
 epoch: 93, train_loss: 0.7354, test_loss: 0.9555, test_f1: 0.5456
 epoch: 94, train_loss: 0.7433, test_loss: 0.9556, test_f1: 0.5535
 epoch: 95, train_loss: 0.7287, test_loss: 0.9650, test_f1: 0.5482
 epoch: 96, train_loss: 0.7350, test_loss: 0.9578, test_f1: 0.5486
 epoch: 97, train_loss: 0.7283, test_loss: 0.9625, test_f1: 0.5623
 epoch: 98, train_loss: 0.7220, test_loss: 0.9638, test_f1: 0.5509
 epoch: 99, train_loss: 0.7193, test_loss: 0.9674, test_f1: 0.5590
##################ITERATION #1 ****************************************
 epoch: 0, train_loss: 1.3442, test_loss: 1.3418, test_f1: 0.2274
 epoch: 1, train_loss: 1.2965, test_loss: 1.3187, test_f1: 0.2274
 epoch: 2, train_loss: 1.2732, test_loss: 1.2858, test_f1: 0.2557
 epoch: 3, train_loss: 1.2519, test_loss: 1.2524, test_f1: 0.2879
 epoch: 4, train_loss: 1.2354, test_loss: 1.2240, test_f1: 0.3227
 epoch: 5, train_loss: 1.2209, test_loss: 1.2007, test_f1: 0.3606
 epoch: 6, train_loss: 1.2003, test_loss: 1.1803, test_f1: 0.4029
 epoch: 7, train_loss: 1.1864, test_loss: 1.1639, test_f1: 0.4203
 epoch: 8, train_loss: 1.1714, test_loss: 1.1501, test_f1: 0.4381
 epoch: 9, train_loss: 1.1576, test_loss: 1.1364, test_f1: 0.4374
 epoch: 10, train_loss: 1.1451, test_loss: 1.1237, test_f1: 0.4282
 epoch: 11, train_loss: 1.1257, test_loss: 1.1115, test_f1: 0.4269
 epoch: 12, train_loss: 1.1183, test_loss: 1.0976, test_f1: 0.4234
 epoch: 13, train_loss: 1.1031, test_loss: 1.0878, test_f1: 0.4311
 epoch: 14, train_loss: 1.0893, test_loss: 1.0764, test_f1: 0.4253
 epoch: 15, train_loss: 1.0814, test_loss: 1.0690, test_f1: 0.4339
 epoch: 16, train_loss: 1.0721, test_loss: 1.0598, test_f1: 0.4581
 epoch: 17, train_loss: 1.0549, test_loss: 1.0546, test_f1: 0.4441
 epoch: 18, train_loss: 1.0501, test_loss: 1.0466, test_f1: 0.4491
 epoch: 19, train_loss: 1.0381, test_loss: 1.0400, test_f1: 0.4533
 epoch: 20, train_loss: 1.0290, test_loss: 1.0308, test_f1: 0.4613
 epoch: 21, train_loss: 1.0225, test_loss: 1.0247, test_f1: 0.4513
 epoch: 22, train_loss: 1.0119, test_loss: 1.0134, test_f1: 0.4561
 epoch: 23, train_loss: 1.0005, test_loss: 1.0108, test_f1: 0.4669
 epoch: 24, train_loss: 0.9934, test_loss: 1.0017, test_f1: 0.4767
 epoch: 25, train_loss: 0.9882, test_loss: 0.9994, test_f1: 0.4778
 epoch: 26, train_loss: 0.9791, test_loss: 0.9934, test_f1: 0.4809
 epoch: 27, train_loss: 0.9726, test_loss: 0.9945, test_f1: 0.4823
 epoch: 28, train_loss: 0.9632, test_loss: 0.9973, test_f1: 0.4804
 epoch: 29, train_loss: 0.9577, test_loss: 0.9885, test_f1: 0.4799
 epoch: 30, train_loss: 0.9494, test_loss: 0.9859, test_f1: 0.4698
 epoch: 31, train_loss: 0.9360, test_loss: 0.9822, test_f1: 0.4750
 epoch: 32, train_loss: 0.9362, test_loss: 0.9835, test_f1: 0.4819
 epoch: 33, train_loss: 0.9260, test_loss: 0.9811, test_f1: 0.4872
 epoch: 34, train_loss: 0.9142, test_loss: 0.9896, test_f1: 0.4757
 epoch: 35, train_loss: 0.9196, test_loss: 0.9872, test_f1: 0.4796
 epoch: 36, train_loss: 0.9075, test_loss: 0.9817, test_f1: 0.4826
 epoch: 37, train_loss: 0.9082, test_loss: 0.9763, test_f1: 0.4867
 epoch: 38, train_loss: 0.8953, test_loss: 0.9835, test_f1: 0.4800
 epoch: 39, train_loss: 0.8818, test_loss: 0.9956, test_f1: 0.4764
 epoch: 40, train_loss: 0.8865, test_loss: 0.9859, test_f1: 0.4851
 epoch: 41, train_loss: 0.8824, test_loss: 0.9993, test_f1: 0.4801
 epoch: 42, train_loss: 0.8694, test_loss: 0.9794, test_f1: 0.4835
 epoch: 43, train_loss: 0.8714, test_loss: 0.9917, test_f1: 0.4929
 epoch: 44, train_loss: 0.8676, test_loss: 0.9731, test_f1: 0.4892
 epoch: 45, train_loss: 0.8676, test_loss: 1.0317, test_f1: 0.4786
 epoch: 46, train_loss: 0.8624, test_loss: 0.9943, test_f1: 0.4874
 epoch: 47, train_loss: 0.8442, test_loss: 0.9952, test_f1: 0.4759
 epoch: 48, train_loss: 0.8385, test_loss: 1.0064, test_f1: 0.4839
 epoch: 49, train_loss: 0.8346, test_loss: 0.9930, test_f1: 0.4804
 epoch: 50, train_loss: 0.8304, test_loss: 1.0084, test_f1: 0.4966
 epoch: 51, train_loss: 0.8271, test_loss: 0.9927, test_f1: 0.4842
 epoch: 52, train_loss: 0.8223, test_loss: 0.9913, test_f1: 0.4868
 epoch: 53, train_loss: 0.8157, test_loss: 1.0002, test_f1: 0.4879
 epoch: 54, train_loss: 0.8093, test_loss: 1.0037, test_f1: 0.4839
 epoch: 55, train_loss: 0.8116, test_loss: 1.0020, test_f1: 0.4797
 epoch: 56, train_loss: 0.8035, test_loss: 1.0111, test_f1: 0.4877
 epoch: 57, train_loss: 0.8074, test_loss: 1.0072, test_f1: 0.4853
 epoch: 58, train_loss: 0.8006, test_loss: 1.0041, test_f1: 0.4912
 epoch: 59, train_loss: 0.7927, test_loss: 1.0155, test_f1: 0.4871
 epoch: 60, train_loss: 0.7979, test_loss: 1.0029, test_f1: 0.4987
 epoch: 61, train_loss: 0.8033, test_loss: 1.0037, test_f1: 0.5037
 epoch: 62, train_loss: 0.7891, test_loss: 1.0069, test_f1: 0.4870
 epoch: 63, train_loss: 0.7856, test_loss: 1.0174, test_f1: 0.4943
 epoch: 64, train_loss: 0.7815, test_loss: 0.9964, test_f1: 0.5045
 epoch: 65, train_loss: 0.7842, test_loss: 0.9934, test_f1: 0.4901
 epoch: 66, train_loss: 0.7877, test_loss: 1.0060, test_f1: 0.4950
 epoch: 67, train_loss: 0.7732, test_loss: 1.0168, test_f1: 0.4897
 epoch: 68, train_loss: 0.7805, test_loss: 1.0072, test_f1: 0.4953
 epoch: 69, train_loss: 0.7701, test_loss: 1.0150, test_f1: 0.4939
 epoch: 70, train_loss: 0.7705, test_loss: 1.0208, test_f1: 0.4984
 epoch: 71, train_loss: 0.7709, test_loss: 1.0199, test_f1: 0.4958
 epoch: 72, train_loss: 0.7775, test_loss: 1.0177, test_f1: 0.4971
 epoch: 73, train_loss: 0.7650, test_loss: 1.0322, test_f1: 0.4954
 epoch: 74, train_loss: 0.7602, test_loss: 1.0190, test_f1: 0.4937
 epoch: 75, train_loss: 0.7626, test_loss: 1.0144, test_f1: 0.4938
 epoch: 76, train_loss: 0.7573, test_loss: 1.0257, test_f1: 0.4982
 epoch: 77, train_loss: 0.7520, test_loss: 1.0313, test_f1: 0.5025
 epoch: 78, train_loss: 0.7456, test_loss: 1.0252, test_f1: 0.4966
 epoch: 79, train_loss: 0.7457, test_loss: 1.0328, test_f1: 0.4992
 epoch: 80, train_loss: 0.7477, test_loss: 1.0348, test_f1: 0.4996
 epoch: 81, train_loss: 0.7355, test_loss: 1.0525, test_f1: 0.4975
 epoch: 82, train_loss: 0.7424, test_loss: 1.0320, test_f1: 0.5063
 epoch: 83, train_loss: 0.7401, test_loss: 1.0503, test_f1: 0.4915
 epoch: 84, train_loss: 0.7364, test_loss: 1.0540, test_f1: 0.5032
 epoch: 85, train_loss: 0.7306, test_loss: 1.0608, test_f1: 0.4887
 epoch: 86, train_loss: 0.7309, test_loss: 1.0759, test_f1: 0.4948
 epoch: 87, train_loss: 0.7294, test_loss: 1.0520, test_f1: 0.4951
 epoch: 88, train_loss: 0.7205, test_loss: 1.0488, test_f1: 0.4989
 epoch: 89, train_loss: 0.7323, test_loss: 1.0807, test_f1: 0.5095
 epoch: 90, train_loss: 0.7264, test_loss: 1.0679, test_f1: 0.4981
 epoch: 91, train_loss: 0.7248, test_loss: 1.0635, test_f1: 0.4983
 epoch: 92, train_loss: 0.7292, test_loss: 1.0652, test_f1: 0.4939
 epoch: 93, train_loss: 0.7160, test_loss: 1.0885, test_f1: 0.5011
 epoch: 94, train_loss: 0.7144, test_loss: 1.0612, test_f1: 0.5156
 epoch: 95, train_loss: 0.7172, test_loss: 1.0852, test_f1: 0.5069
 epoch: 96, train_loss: 0.7038, test_loss: 1.0861, test_f1: 0.4980
 epoch: 97, train_loss: 0.7070, test_loss: 1.0891, test_f1: 0.5185
 epoch: 98, train_loss: 0.7157, test_loss: 1.0776, test_f1: 0.5047
 epoch: 99, train_loss: 0.7037, test_loss: 1.0857, test_f1: 0.5073
##################ITERATION #2 ****************************************
 epoch: 0, train_loss: 1.3318, test_loss: 1.3199, test_f1: 0.2274
 epoch: 1, train_loss: 1.2662, test_loss: 1.2867, test_f1: 0.2274
 epoch: 2, train_loss: 1.2409, test_loss: 1.2486, test_f1: 0.2545
 epoch: 3, train_loss: 1.2221, test_loss: 1.2112, test_f1: 0.3250
 epoch: 4, train_loss: 1.1980, test_loss: 1.1836, test_f1: 0.3955
 epoch: 5, train_loss: 1.1869, test_loss: 1.1639, test_f1: 0.4376
 epoch: 6, train_loss: 1.1724, test_loss: 1.1496, test_f1: 0.4345
 epoch: 7, train_loss: 1.1576, test_loss: 1.1356, test_f1: 0.4256
 epoch: 8, train_loss: 1.1442, test_loss: 1.1218, test_f1: 0.4383
 epoch: 9, train_loss: 1.1301, test_loss: 1.1085, test_f1: 0.4541
 epoch: 10, train_loss: 1.1158, test_loss: 1.0984, test_f1: 0.4577
 epoch: 11, train_loss: 1.1080, test_loss: 1.0865, test_f1: 0.4603
 epoch: 12, train_loss: 1.0961, test_loss: 1.0725, test_f1: 0.4567
 epoch: 13, train_loss: 1.0837, test_loss: 1.0650, test_f1: 0.4669
 epoch: 14, train_loss: 1.0710, test_loss: 1.0583, test_f1: 0.4648
 epoch: 15, train_loss: 1.0666, test_loss: 1.0517, test_f1: 0.4600
 epoch: 16, train_loss: 1.0531, test_loss: 1.0420, test_f1: 0.4651
 epoch: 17, train_loss: 1.0384, test_loss: 1.0335, test_f1: 0.4737
 epoch: 18, train_loss: 1.0321, test_loss: 1.0207, test_f1: 0.4761
 epoch: 19, train_loss: 1.0224, test_loss: 1.0205, test_f1: 0.4804
 epoch: 20, train_loss: 1.0164, test_loss: 1.0128, test_f1: 0.4843
 epoch: 21, train_loss: 1.0108, test_loss: 1.0028, test_f1: 0.4930
 epoch: 22, train_loss: 0.9970, test_loss: 1.0019, test_f1: 0.4915
 epoch: 23, train_loss: 0.9880, test_loss: 0.9988, test_f1: 0.4959
 epoch: 24, train_loss: 0.9797, test_loss: 0.9939, test_f1: 0.4946
 epoch: 25, train_loss: 0.9650, test_loss: 0.9836, test_f1: 0.5058
 epoch: 26, train_loss: 0.9661, test_loss: 0.9881, test_f1: 0.4998
 epoch: 27, train_loss: 0.9510, test_loss: 0.9730, test_f1: 0.5121
 epoch: 28, train_loss: 0.9422, test_loss: 0.9795, test_f1: 0.5065
 epoch: 29, train_loss: 0.9350, test_loss: 0.9735, test_f1: 0.4985
 epoch: 30, train_loss: 0.9345, test_loss: 0.9686, test_f1: 0.4952
 epoch: 31, train_loss: 0.9191, test_loss: 0.9616, test_f1: 0.5016
 epoch: 32, train_loss: 0.9099, test_loss: 0.9662, test_f1: 0.5089
 epoch: 33, train_loss: 0.9018, test_loss: 0.9637, test_f1: 0.5153
 epoch: 34, train_loss: 0.9017, test_loss: 0.9617, test_f1: 0.5088
 epoch: 35, train_loss: 0.8891, test_loss: 0.9603, test_f1: 0.5103
 epoch: 36, train_loss: 0.8843, test_loss: 0.9535, test_f1: 0.5169
 epoch: 37, train_loss: 0.8810, test_loss: 0.9573, test_f1: 0.5248
 epoch: 38, train_loss: 0.8789, test_loss: 0.9741, test_f1: 0.5083
 epoch: 39, train_loss: 0.8673, test_loss: 0.9446, test_f1: 0.5187
 epoch: 40, train_loss: 0.8627, test_loss: 0.9670, test_f1: 0.5115
 epoch: 41, train_loss: 0.8562, test_loss: 0.9522, test_f1: 0.5205
 epoch: 42, train_loss: 0.8462, test_loss: 0.9674, test_f1: 0.5065
 epoch: 43, train_loss: 0.8407, test_loss: 0.9638, test_f1: 0.5107
 epoch: 44, train_loss: 0.8424, test_loss: 0.9494, test_f1: 0.5119
 epoch: 45, train_loss: 0.8312, test_loss: 0.9448, test_f1: 0.5206
 epoch: 46, train_loss: 0.8219, test_loss: 0.9563, test_f1: 0.5252
 epoch: 47, train_loss: 0.8073, test_loss: 0.9662, test_f1: 0.5225
 epoch: 48, train_loss: 0.8054, test_loss: 0.9712, test_f1: 0.5149
 epoch: 49, train_loss: 0.8048, test_loss: 0.9614, test_f1: 0.5218
 epoch: 50, train_loss: 0.7967, test_loss: 0.9737, test_f1: 0.5174
 epoch: 51, train_loss: 0.7878, test_loss: 0.9647, test_f1: 0.5315
 epoch: 52, train_loss: 0.7890, test_loss: 0.9646, test_f1: 0.5152
 epoch: 53, train_loss: 0.7881, test_loss: 0.9752, test_f1: 0.5157
 epoch: 54, train_loss: 0.7831, test_loss: 0.9690, test_f1: 0.5210
 epoch: 55, train_loss: 0.7827, test_loss: 0.9784, test_f1: 0.5148
 epoch: 56, train_loss: 0.7652, test_loss: 0.9791, test_f1: 0.5231
 epoch: 57, train_loss: 0.7733, test_loss: 0.9835, test_f1: 0.5209
 epoch: 58, train_loss: 0.7664, test_loss: 0.9839, test_f1: 0.5131
 epoch: 59, train_loss: 0.7722, test_loss: 0.9860, test_f1: 0.5125
 epoch: 60, train_loss: 0.7647, test_loss: 0.9818, test_f1: 0.5168
 epoch: 61, train_loss: 0.7648, test_loss: 1.0055, test_f1: 0.5165
 epoch: 62, train_loss: 0.7629, test_loss: 0.9869, test_f1: 0.5208
 epoch: 63, train_loss: 0.7565, test_loss: 0.9902, test_f1: 0.5306
 epoch: 64, train_loss: 0.7517, test_loss: 1.0050, test_f1: 0.5187
 epoch: 65, train_loss: 0.7476, test_loss: 0.9855, test_f1: 0.5151
 epoch: 66, train_loss: 0.7492, test_loss: 1.0106, test_f1: 0.5153
 epoch: 67, train_loss: 0.7553, test_loss: 0.9892, test_f1: 0.5237
 epoch: 68, train_loss: 0.7461, test_loss: 1.0060, test_f1: 0.5220
 epoch: 69, train_loss: 0.7341, test_loss: 0.9991, test_f1: 0.5224
 epoch: 70, train_loss: 0.7387, test_loss: 1.0245, test_f1: 0.5220
 epoch: 71, train_loss: 0.7405, test_loss: 1.0195, test_f1: 0.5190
 epoch: 72, train_loss: 0.7285, test_loss: 1.0061, test_f1: 0.5230
 epoch: 73, train_loss: 0.7289, test_loss: 1.0120, test_f1: 0.5243
 epoch: 74, train_loss: 0.7313, test_loss: 1.0126, test_f1: 0.5261
 epoch: 75, train_loss: 0.7188, test_loss: 1.0215, test_f1: 0.5194
 epoch: 76, train_loss: 0.7318, test_loss: 1.0439, test_f1: 0.5185
 epoch: 77, train_loss: 0.7260, test_loss: 1.0258, test_f1: 0.5147
 epoch: 78, train_loss: 0.7190, test_loss: 1.0396, test_f1: 0.5245
 epoch: 79, train_loss: 0.7234, test_loss: 1.0364, test_f1: 0.5207
 epoch: 80, train_loss: 0.7135, test_loss: 1.0201, test_f1: 0.5386
 epoch: 81, train_loss: 0.7293, test_loss: 1.0433, test_f1: 0.5325
 epoch: 82, train_loss: 0.7139, test_loss: 1.0501, test_f1: 0.5258
 epoch: 83, train_loss: 0.7120, test_loss: 1.0415, test_f1: 0.5274
 epoch: 84, train_loss: 0.7102, test_loss: 1.0371, test_f1: 0.5251
 epoch: 85, train_loss: 0.7144, test_loss: 1.0540, test_f1: 0.5270
 epoch: 86, train_loss: 0.7011, test_loss: 1.0697, test_f1: 0.5178
 epoch: 87, train_loss: 0.6937, test_loss: 1.0477, test_f1: 0.5276
 epoch: 88, train_loss: 0.7025, test_loss: 1.0626, test_f1: 0.5206
 epoch: 89, train_loss: 0.6978, test_loss: 1.0889, test_f1: 0.5179
 epoch: 90, train_loss: 0.6950, test_loss: 1.0562, test_f1: 0.5287
 epoch: 91, train_loss: 0.6939, test_loss: 1.0550, test_f1: 0.5265
 epoch: 92, train_loss: 0.6868, test_loss: 1.0745, test_f1: 0.5319
 epoch: 93, train_loss: 0.6886, test_loss: 1.0765, test_f1: 0.5306
 epoch: 94, train_loss: 0.6817, test_loss: 1.0746, test_f1: 0.5306
 epoch: 95, train_loss: 0.6730, test_loss: 1.0993, test_f1: 0.5250
 epoch: 96, train_loss: 0.6757, test_loss: 1.1097, test_f1: 0.5214
 epoch: 97, train_loss: 0.6872, test_loss: 1.1006, test_f1: 0.5342
 epoch: 98, train_loss: 0.6703, test_loss: 1.0826, test_f1: 0.5315
 epoch: 99, train_loss: 0.6706, test_loss: 1.1121, test_f1: 0.5267
##################ITERATION #3 ****************************************
 epoch: 0, train_loss: 1.2851, test_loss: 1.2983, test_f1: 0.2274
 epoch: 1, train_loss: 1.2193, test_loss: 1.2541, test_f1: 0.2556
 epoch: 2, train_loss: 1.1950, test_loss: 1.2067, test_f1: 0.3094
 epoch: 3, train_loss: 1.1815, test_loss: 1.1685, test_f1: 0.4165
 epoch: 4, train_loss: 1.1673, test_loss: 1.1380, test_f1: 0.4574
 epoch: 5, train_loss: 1.1524, test_loss: 1.1192, test_f1: 0.4688
 epoch: 6, train_loss: 1.1334, test_loss: 1.1062, test_f1: 0.4583
 epoch: 7, train_loss: 1.1292, test_loss: 1.0930, test_f1: 0.4663
 epoch: 8, train_loss: 1.1141, test_loss: 1.0815, test_f1: 0.4580
 epoch: 9, train_loss: 1.1004, test_loss: 1.0706, test_f1: 0.4595
 epoch: 10, train_loss: 1.0840, test_loss: 1.0601, test_f1: 0.4671
 epoch: 11, train_loss: 1.0776, test_loss: 1.0549, test_f1: 0.4622
 epoch: 12, train_loss: 1.0574, test_loss: 1.0418, test_f1: 0.4653
 epoch: 13, train_loss: 1.0583, test_loss: 1.0374, test_f1: 0.4667
 epoch: 14, train_loss: 1.0426, test_loss: 1.0270, test_f1: 0.4587
 epoch: 15, train_loss: 1.0407, test_loss: 1.0201, test_f1: 0.4619
 epoch: 16, train_loss: 1.0261, test_loss: 1.0164, test_f1: 0.4629
 epoch: 17, train_loss: 1.0175, test_loss: 1.0074, test_f1: 0.4713
 epoch: 18, train_loss: 1.0170, test_loss: 1.0040, test_f1: 0.4407
 epoch: 19, train_loss: 1.0027, test_loss: 0.9883, test_f1: 0.4788
 epoch: 20, train_loss: 0.9974, test_loss: 0.9958, test_f1: 0.4578
 epoch: 21, train_loss: 0.9839, test_loss: 0.9815, test_f1: 0.4891
 epoch: 22, train_loss: 0.9784, test_loss: 0.9819, test_f1: 0.4396
 epoch: 23, train_loss: 0.9704, test_loss: 0.9757, test_f1: 0.4730
 epoch: 24, train_loss: 0.9646, test_loss: 0.9672, test_f1: 0.4800
 epoch: 25, train_loss: 0.9552, test_loss: 0.9717, test_f1: 0.4656
 epoch: 26, train_loss: 0.9492, test_loss: 0.9586, test_f1: 0.4683
 epoch: 27, train_loss: 0.9490, test_loss: 0.9635, test_f1: 0.4730
 epoch: 28, train_loss: 0.9390, test_loss: 0.9660, test_f1: 0.4750
 epoch: 29, train_loss: 0.9345, test_loss: 0.9524, test_f1: 0.4959
 epoch: 30, train_loss: 0.9350, test_loss: 0.9569, test_f1: 0.5006
 epoch: 31, train_loss: 0.9254, test_loss: 0.9582, test_f1: 0.5077
 epoch: 32, train_loss: 0.9070, test_loss: 0.9541, test_f1: 0.4878
 epoch: 33, train_loss: 0.9090, test_loss: 0.9559, test_f1: 0.4838
 epoch: 34, train_loss: 0.9074, test_loss: 0.9537, test_f1: 0.4862
 epoch: 35, train_loss: 0.9042, test_loss: 0.9429, test_f1: 0.5035
 epoch: 36, train_loss: 0.9001, test_loss: 0.9511, test_f1: 0.4926
 epoch: 37, train_loss: 0.8882, test_loss: 0.9521, test_f1: 0.4944
 epoch: 38, train_loss: 0.8858, test_loss: 0.9511, test_f1: 0.4956
 epoch: 39, train_loss: 0.8768, test_loss: 0.9591, test_f1: 0.5105
 epoch: 40, train_loss: 0.8717, test_loss: 0.9487, test_f1: 0.5041
 epoch: 41, train_loss: 0.8684, test_loss: 0.9564, test_f1: 0.5224
 epoch: 42, train_loss: 0.8675, test_loss: 0.9561, test_f1: 0.5151
 epoch: 43, train_loss: 0.8662, test_loss: 0.9471, test_f1: 0.4898
 epoch: 44, train_loss: 0.8493, test_loss: 0.9485, test_f1: 0.5189
 epoch: 45, train_loss: 0.8529, test_loss: 0.9600, test_f1: 0.5028
 epoch: 46, train_loss: 0.8462, test_loss: 0.9486, test_f1: 0.5141
 epoch: 47, train_loss: 0.8523, test_loss: 0.9535, test_f1: 0.5145
 epoch: 48, train_loss: 0.8362, test_loss: 0.9512, test_f1: 0.5179
 epoch: 49, train_loss: 0.8350, test_loss: 0.9597, test_f1: 0.5226
 epoch: 50, train_loss: 0.8382, test_loss: 0.9526, test_f1: 0.5156
 epoch: 51, train_loss: 0.8257, test_loss: 0.9644, test_f1: 0.5233
 epoch: 52, train_loss: 0.8151, test_loss: 0.9599, test_f1: 0.5262
 epoch: 53, train_loss: 0.8191, test_loss: 0.9611, test_f1: 0.5149
 epoch: 54, train_loss: 0.8243, test_loss: 0.9591, test_f1: 0.5267
 epoch: 55, train_loss: 0.8146, test_loss: 0.9519, test_f1: 0.5232
 epoch: 56, train_loss: 0.8061, test_loss: 0.9541, test_f1: 0.5246
 epoch: 57, train_loss: 0.8010, test_loss: 0.9595, test_f1: 0.5270
 epoch: 58, train_loss: 0.8049, test_loss: 0.9578, test_f1: 0.5212
 epoch: 59, train_loss: 0.8138, test_loss: 0.9486, test_f1: 0.5342
 epoch: 60, train_loss: 0.7968, test_loss: 0.9558, test_f1: 0.5177
 epoch: 61, train_loss: 0.8012, test_loss: 0.9643, test_f1: 0.5234
 epoch: 62, train_loss: 0.8052, test_loss: 0.9618, test_f1: 0.5180
 epoch: 63, train_loss: 0.7919, test_loss: 0.9574, test_f1: 0.5127
 epoch: 64, train_loss: 0.7929, test_loss: 0.9558, test_f1: 0.5270
 epoch: 65, train_loss: 0.7870, test_loss: 0.9611, test_f1: 0.5299
 epoch: 66, train_loss: 0.7840, test_loss: 0.9633, test_f1: 0.5191
 epoch: 67, train_loss: 0.7818, test_loss: 0.9671, test_f1: 0.5157
 epoch: 68, train_loss: 0.7789, test_loss: 0.9760, test_f1: 0.5138
 epoch: 69, train_loss: 0.7856, test_loss: 0.9714, test_f1: 0.5256
 epoch: 70, train_loss: 0.7765, test_loss: 0.9593, test_f1: 0.5347
 epoch: 71, train_loss: 0.7782, test_loss: 0.9751, test_f1: 0.5214
 epoch: 72, train_loss: 0.7710, test_loss: 0.9552, test_f1: 0.5300
 epoch: 73, train_loss: 0.7788, test_loss: 0.9630, test_f1: 0.5293
 epoch: 74, train_loss: 0.7776, test_loss: 0.9604, test_f1: 0.5119
 epoch: 75, train_loss: 0.7667, test_loss: 0.9681, test_f1: 0.5244
 epoch: 76, train_loss: 0.7766, test_loss: 0.9619, test_f1: 0.5169
 epoch: 77, train_loss: 0.7623, test_loss: 0.9617, test_f1: 0.5291
 epoch: 78, train_loss: 0.7552, test_loss: 0.9675, test_f1: 0.5221
 epoch: 79, train_loss: 0.7578, test_loss: 0.9641, test_f1: 0.5302
 epoch: 80, train_loss: 0.7531, test_loss: 0.9654, test_f1: 0.5257
 epoch: 81, train_loss: 0.7509, test_loss: 0.9633, test_f1: 0.5279
 epoch: 82, train_loss: 0.7559, test_loss: 0.9717, test_f1: 0.5359
 epoch: 83, train_loss: 0.7478, test_loss: 0.9732, test_f1: 0.5279
 epoch: 84, train_loss: 0.7635, test_loss: 0.9799, test_f1: 0.5314
 epoch: 85, train_loss: 0.7495, test_loss: 0.9656, test_f1: 0.5335
 epoch: 86, train_loss: 0.7352, test_loss: 0.9670, test_f1: 0.5265
 epoch: 87, train_loss: 0.7394, test_loss: 0.9816, test_f1: 0.5292
 epoch: 88, train_loss: 0.7507, test_loss: 0.9801, test_f1: 0.5322
 epoch: 89, train_loss: 0.7348, test_loss: 0.9797, test_f1: 0.5328
 epoch: 90, train_loss: 0.7422, test_loss: 0.9868, test_f1: 0.5278
 epoch: 91, train_loss: 0.7433, test_loss: 0.9737, test_f1: 0.5409
 epoch: 92, train_loss: 0.7360, test_loss: 0.9951, test_f1: 0.5315
 epoch: 93, train_loss: 0.7296, test_loss: 0.9798, test_f1: 0.5291
 epoch: 94, train_loss: 0.7271, test_loss: 0.9984, test_f1: 0.5291
 epoch: 95, train_loss: 0.7298, test_loss: 0.9846, test_f1: 0.5314
 epoch: 96, train_loss: 0.7327, test_loss: 0.9792, test_f1: 0.5439
 epoch: 97, train_loss: 0.7255, test_loss: 1.0180, test_f1: 0.5095
 epoch: 98, train_loss: 0.7177, test_loss: 0.9856, test_f1: 0.5412
 epoch: 99, train_loss: 0.7169, test_loss: 0.9868, test_f1: 0.5327
##################ITERATION #4 ****************************************
 epoch: 0, train_loss: 1.2973, test_loss: 1.2832, test_f1: 0.2274
 epoch: 1, train_loss: 1.2310, test_loss: 1.2525, test_f1: 0.2555
 epoch: 2, train_loss: 1.2067, test_loss: 1.2172, test_f1: 0.2733
 epoch: 3, train_loss: 1.1867, test_loss: 1.1728, test_f1: 0.3737
 epoch: 4, train_loss: 1.1769, test_loss: 1.1378, test_f1: 0.4490
 epoch: 5, train_loss: 1.1613, test_loss: 1.1166, test_f1: 0.4478
 epoch: 6, train_loss: 1.1419, test_loss: 1.1032, test_f1: 0.4489
 epoch: 7, train_loss: 1.1347, test_loss: 1.0926, test_f1: 0.4454
 epoch: 8, train_loss: 1.1140, test_loss: 1.0806, test_f1: 0.4482
 epoch: 9, train_loss: 1.1087, test_loss: 1.0742, test_f1: 0.4501
 epoch: 10, train_loss: 1.1054, test_loss: 1.0677, test_f1: 0.4563
 epoch: 11, train_loss: 1.0853, test_loss: 1.0600, test_f1: 0.4522
 epoch: 12, train_loss: 1.0797, test_loss: 1.0500, test_f1: 0.4585
 epoch: 13, train_loss: 1.0732, test_loss: 1.0361, test_f1: 0.4515
 epoch: 14, train_loss: 1.0657, test_loss: 1.0312, test_f1: 0.4534
 epoch: 15, train_loss: 1.0557, test_loss: 1.0292, test_f1: 0.4576
 epoch: 16, train_loss: 1.0447, test_loss: 1.0193, test_f1: 0.4523
 epoch: 17, train_loss: 1.0370, test_loss: 1.0142, test_f1: 0.4501
 epoch: 18, train_loss: 1.0322, test_loss: 1.0087, test_f1: 0.4545
 epoch: 19, train_loss: 1.0284, test_loss: 1.0003, test_f1: 0.4727
 epoch: 20, train_loss: 1.0090, test_loss: 1.0016, test_f1: 0.4564
 epoch: 21, train_loss: 1.0062, test_loss: 0.9978, test_f1: 0.4577
 epoch: 22, train_loss: 1.0014, test_loss: 0.9941, test_f1: 0.4626
 epoch: 23, train_loss: 0.9915, test_loss: 0.9933, test_f1: 0.4647
 epoch: 24, train_loss: 0.9788, test_loss: 0.9889, test_f1: 0.4764
 epoch: 25, train_loss: 0.9714, test_loss: 0.9809, test_f1: 0.4881
 epoch: 26, train_loss: 0.9586, test_loss: 0.9725, test_f1: 0.4674
 epoch: 27, train_loss: 0.9606, test_loss: 0.9840, test_f1: 0.4680
 epoch: 28, train_loss: 0.9556, test_loss: 0.9851, test_f1: 0.4588
 epoch: 29, train_loss: 0.9403, test_loss: 0.9748, test_f1: 0.4670
 epoch: 30, train_loss: 0.9336, test_loss: 0.9752, test_f1: 0.4690
 epoch: 31, train_loss: 0.9273, test_loss: 0.9672, test_f1: 0.4836
 epoch: 32, train_loss: 0.9188, test_loss: 0.9714, test_f1: 0.4964
 epoch: 33, train_loss: 0.9202, test_loss: 0.9732, test_f1: 0.4921
 epoch: 34, train_loss: 0.9041, test_loss: 0.9711, test_f1: 0.4850
 epoch: 35, train_loss: 0.9063, test_loss: 0.9638, test_f1: 0.4845
 epoch: 36, train_loss: 0.8954, test_loss: 0.9699, test_f1: 0.4894
 epoch: 37, train_loss: 0.8833, test_loss: 0.9764, test_f1: 0.4876
 epoch: 38, train_loss: 0.8968, test_loss: 0.9763, test_f1: 0.4866
 epoch: 39, train_loss: 0.8819, test_loss: 0.9643, test_f1: 0.4989
 epoch: 40, train_loss: 0.8776, test_loss: 0.9699, test_f1: 0.4971
 epoch: 41, train_loss: 0.8712, test_loss: 0.9726, test_f1: 0.4975
 epoch: 42, train_loss: 0.8669, test_loss: 0.9611, test_f1: 0.4980
 epoch: 43, train_loss: 0.8647, test_loss: 0.9828, test_f1: 0.4804
 epoch: 44, train_loss: 0.8628, test_loss: 0.9882, test_f1: 0.4931
 epoch: 45, train_loss: 0.8485, test_loss: 0.9861, test_f1: 0.4888
 epoch: 46, train_loss: 0.8519, test_loss: 0.9697, test_f1: 0.4909
 epoch: 47, train_loss: 0.8474, test_loss: 0.9728, test_f1: 0.5015
 epoch: 48, train_loss: 0.8420, test_loss: 0.9912, test_f1: 0.5060
 epoch: 49, train_loss: 0.8333, test_loss: 1.0029, test_f1: 0.5023
 epoch: 50, train_loss: 0.8316, test_loss: 0.9809, test_f1: 0.4893
 epoch: 51, train_loss: 0.8204, test_loss: 0.9809, test_f1: 0.4831
 epoch: 52, train_loss: 0.8211, test_loss: 0.9886, test_f1: 0.4885
 epoch: 53, train_loss: 0.8108, test_loss: 0.9832, test_f1: 0.4907
 epoch: 54, train_loss: 0.8152, test_loss: 0.9816, test_f1: 0.4956
 epoch: 55, train_loss: 0.8054, test_loss: 0.9899, test_f1: 0.4950
 epoch: 56, train_loss: 0.8072, test_loss: 0.9899, test_f1: 0.4914
 epoch: 57, train_loss: 0.8023, test_loss: 0.9950, test_f1: 0.5003
 epoch: 58, train_loss: 0.8132, test_loss: 0.9869, test_f1: 0.4973
 epoch: 59, train_loss: 0.8047, test_loss: 1.0002, test_f1: 0.4981
 epoch: 60, train_loss: 0.8034, test_loss: 0.9993, test_f1: 0.4941
 epoch: 61, train_loss: 0.7998, test_loss: 0.9968, test_f1: 0.4931
 epoch: 62, train_loss: 0.7998, test_loss: 1.0008, test_f1: 0.4902
 epoch: 63, train_loss: 0.7864, test_loss: 0.9956, test_f1: 0.5031
 epoch: 64, train_loss: 0.7931, test_loss: 1.0152, test_f1: 0.5017
 epoch: 65, train_loss: 0.7840, test_loss: 1.0052, test_f1: 0.5004
 epoch: 66, train_loss: 0.7894, test_loss: 1.0106, test_f1: 0.5031
 epoch: 67, train_loss: 0.7795, test_loss: 1.0036, test_f1: 0.5052
 epoch: 68, train_loss: 0.7807, test_loss: 1.0171, test_f1: 0.4966
 epoch: 69, train_loss: 0.7874, test_loss: 1.0169, test_f1: 0.4902
 epoch: 70, train_loss: 0.7849, test_loss: 1.0079, test_f1: 0.5046
 epoch: 71, train_loss: 0.7781, test_loss: 1.0147, test_f1: 0.4986
 epoch: 72, train_loss: 0.7673, test_loss: 1.0105, test_f1: 0.5067
 epoch: 73, train_loss: 0.7708, test_loss: 1.0240, test_f1: 0.5066
 epoch: 74, train_loss: 0.7664, test_loss: 1.0201, test_f1: 0.5078
 epoch: 75, train_loss: 0.7674, test_loss: 1.0118, test_f1: 0.5170
 epoch: 76, train_loss: 0.7577, test_loss: 1.0232, test_f1: 0.5180
 epoch: 77, train_loss: 0.7652, test_loss: 1.0298, test_f1: 0.5098
 epoch: 78, train_loss: 0.7597, test_loss: 1.0363, test_f1: 0.5024
 epoch: 79, train_loss: 0.7608, test_loss: 1.0308, test_f1: 0.5047
 epoch: 80, train_loss: 0.7610, test_loss: 1.0408, test_f1: 0.5160
 epoch: 81, train_loss: 0.7587, test_loss: 1.0413, test_f1: 0.5064
 epoch: 82, train_loss: 0.7518, test_loss: 1.0328, test_f1: 0.5048
 epoch: 83, train_loss: 0.7533, test_loss: 1.0429, test_f1: 0.5012
 epoch: 84, train_loss: 0.7477, test_loss: 1.0685, test_f1: 0.5014
 epoch: 85, train_loss: 0.7447, test_loss: 1.0372, test_f1: 0.5018
 epoch: 86, train_loss: 0.7426, test_loss: 1.0431, test_f1: 0.5069
 epoch: 87, train_loss: 0.7317, test_loss: 1.0447, test_f1: 0.5109
 epoch: 88, train_loss: 0.7463, test_loss: 1.0540, test_f1: 0.5105
 epoch: 89, train_loss: 0.7417, test_loss: 1.0493, test_f1: 0.5076
 epoch: 90, train_loss: 0.7436, test_loss: 1.0494, test_f1: 0.5211
 epoch: 91, train_loss: 0.7355, test_loss: 1.0645, test_f1: 0.5011
 epoch: 92, train_loss: 0.7427, test_loss: 1.0741, test_f1: 0.4993
 epoch: 93, train_loss: 0.7259, test_loss: 1.0673, test_f1: 0.5164
 epoch: 94, train_loss: 0.7342, test_loss: 1.0698, test_f1: 0.5046
 epoch: 95, train_loss: 0.7346, test_loss: 1.0693, test_f1: 0.5025
 epoch: 96, train_loss: 0.7229, test_loss: 1.0734, test_f1: 0.5185
 epoch: 97, train_loss: 0.7242, test_loss: 1.0849, test_f1: 0.5036
 epoch: 98, train_loss: 0.7189, test_loss: 1.0845, test_f1: 0.4953
 epoch: 99, train_loss: 0.7179, test_loss: 1.0738, test_f1: 0.5056
##################ITERATION #5 ****************************************
 epoch: 0, train_loss: 1.3320, test_loss: 1.2813, test_f1: 0.2274
 epoch: 1, train_loss: 1.2467, test_loss: 1.2371, test_f1: 0.2960
 epoch: 2, train_loss: 1.2194, test_loss: 1.1969, test_f1: 0.3749
 epoch: 3, train_loss: 1.1973, test_loss: 1.1659, test_f1: 0.4273
 epoch: 4, train_loss: 1.1855, test_loss: 1.1461, test_f1: 0.4597
 epoch: 5, train_loss: 1.1672, test_loss: 1.1354, test_f1: 0.4465
 epoch: 6, train_loss: 1.1423, test_loss: 1.1236, test_f1: 0.4455
 epoch: 7, train_loss: 1.1246, test_loss: 1.1124, test_f1: 0.4436
 epoch: 8, train_loss: 1.1193, test_loss: 1.0998, test_f1: 0.4462
 epoch: 9, train_loss: 1.1024, test_loss: 1.0882, test_f1: 0.4485
 epoch: 10, train_loss: 1.0952, test_loss: 1.0790, test_f1: 0.4519
 epoch: 11, train_loss: 1.0843, test_loss: 1.0733, test_f1: 0.4469
 epoch: 12, train_loss: 1.0786, test_loss: 1.0653, test_f1: 0.4569
 epoch: 13, train_loss: 1.0640, test_loss: 1.0486, test_f1: 0.4602
 epoch: 14, train_loss: 1.0590, test_loss: 1.0423, test_f1: 0.4734
 epoch: 15, train_loss: 1.0422, test_loss: 1.0349, test_f1: 0.4672
 epoch: 16, train_loss: 1.0339, test_loss: 1.0313, test_f1: 0.4700
 epoch: 17, train_loss: 1.0321, test_loss: 1.0211, test_f1: 0.4665
 epoch: 18, train_loss: 1.0184, test_loss: 1.0187, test_f1: 0.4813
 epoch: 19, train_loss: 1.0135, test_loss: 1.0101, test_f1: 0.4767
 epoch: 20, train_loss: 1.0050, test_loss: 1.0020, test_f1: 0.4838
 epoch: 21, train_loss: 1.0051, test_loss: 1.0027, test_f1: 0.4759
 epoch: 22, train_loss: 0.9909, test_loss: 0.9990, test_f1: 0.4836
 epoch: 23, train_loss: 0.9780, test_loss: 0.9951, test_f1: 0.4773
 epoch: 24, train_loss: 0.9763, test_loss: 0.9979, test_f1: 0.4767
 epoch: 25, train_loss: 0.9713, test_loss: 0.9859, test_f1: 0.4874
 epoch: 26, train_loss: 0.9628, test_loss: 0.9731, test_f1: 0.4951
 epoch: 27, train_loss: 0.9587, test_loss: 0.9816, test_f1: 0.4804
 epoch: 28, train_loss: 0.9544, test_loss: 0.9819, test_f1: 0.4807
 epoch: 29, train_loss: 0.9409, test_loss: 0.9734, test_f1: 0.4962
 epoch: 30, train_loss: 0.9381, test_loss: 0.9754, test_f1: 0.4940
 epoch: 31, train_loss: 0.9271, test_loss: 0.9689, test_f1: 0.4934
 epoch: 32, train_loss: 0.9341, test_loss: 0.9696, test_f1: 0.4944
 epoch: 33, train_loss: 0.9198, test_loss: 0.9679, test_f1: 0.4929
 epoch: 34, train_loss: 0.9082, test_loss: 0.9536, test_f1: 0.4811
 epoch: 35, train_loss: 0.9071, test_loss: 0.9593, test_f1: 0.4950
 epoch: 36, train_loss: 0.9043, test_loss: 0.9637, test_f1: 0.4911
 epoch: 37, train_loss: 0.8931, test_loss: 0.9607, test_f1: 0.4916
 epoch: 38, train_loss: 0.8879, test_loss: 0.9527, test_f1: 0.5013
 epoch: 39, train_loss: 0.8847, test_loss: 0.9440, test_f1: 0.4758
 epoch: 40, train_loss: 0.8883, test_loss: 0.9634, test_f1: 0.4862
 epoch: 41, train_loss: 0.8842, test_loss: 0.9498, test_f1: 0.4947
 epoch: 42, train_loss: 0.8730, test_loss: 0.9589, test_f1: 0.4879
 epoch: 43, train_loss: 0.8671, test_loss: 0.9511, test_f1: 0.4864
 epoch: 44, train_loss: 0.8647, test_loss: 0.9680, test_f1: 0.4850
 epoch: 45, train_loss: 0.8588, test_loss: 0.9462, test_f1: 0.4820
 epoch: 46, train_loss: 0.8433, test_loss: 0.9586, test_f1: 0.4977
 epoch: 47, train_loss: 0.8418, test_loss: 0.9565, test_f1: 0.4886
 epoch: 48, train_loss: 0.8361, test_loss: 0.9544, test_f1: 0.5009
 epoch: 49, train_loss: 0.8419, test_loss: 0.9501, test_f1: 0.4833
 epoch: 50, train_loss: 0.8316, test_loss: 0.9534, test_f1: 0.4981
 epoch: 51, train_loss: 0.8179, test_loss: 0.9563, test_f1: 0.4900
 epoch: 52, train_loss: 0.8254, test_loss: 0.9575, test_f1: 0.4723
 epoch: 53, train_loss: 0.8151, test_loss: 0.9524, test_f1: 0.4765
 epoch: 54, train_loss: 0.8140, test_loss: 0.9503, test_f1: 0.4781
 epoch: 55, train_loss: 0.8216, test_loss: 0.9477, test_f1: 0.4823
 epoch: 56, train_loss: 0.8079, test_loss: 0.9540, test_f1: 0.4820
 epoch: 57, train_loss: 0.8068, test_loss: 0.9600, test_f1: 0.4790
 epoch: 58, train_loss: 0.7976, test_loss: 0.9598, test_f1: 0.4850
 epoch: 59, train_loss: 0.8034, test_loss: 0.9599, test_f1: 0.4858
 epoch: 60, train_loss: 0.8127, test_loss: 0.9608, test_f1: 0.4790
 epoch: 61, train_loss: 0.8000, test_loss: 0.9612, test_f1: 0.4828
 epoch: 62, train_loss: 0.7980, test_loss: 0.9561, test_f1: 0.4929
 epoch: 63, train_loss: 0.7963, test_loss: 0.9738, test_f1: 0.4818
 epoch: 64, train_loss: 0.7897, test_loss: 0.9571, test_f1: 0.4895
 epoch: 65, train_loss: 0.7817, test_loss: 0.9703, test_f1: 0.4826
 epoch: 66, train_loss: 0.7882, test_loss: 0.9739, test_f1: 0.4917
 epoch: 67, train_loss: 0.7866, test_loss: 0.9793, test_f1: 0.4895
 epoch: 68, train_loss: 0.7836, test_loss: 0.9798, test_f1: 0.4869
 epoch: 69, train_loss: 0.7767, test_loss: 0.9921, test_f1: 0.4747
 epoch: 70, train_loss: 0.7786, test_loss: 0.9829, test_f1: 0.4758
 epoch: 71, train_loss: 0.7738, test_loss: 0.9844, test_f1: 0.4792
 epoch: 72, train_loss: 0.7725, test_loss: 0.9737, test_f1: 0.4944
 epoch: 73, train_loss: 0.7585, test_loss: 0.9714, test_f1: 0.4772
 epoch: 74, train_loss: 0.7731, test_loss: 0.9780, test_f1: 0.4922
 epoch: 75, train_loss: 0.7572, test_loss: 0.9745, test_f1: 0.4940
 epoch: 76, train_loss: 0.7632, test_loss: 0.9724, test_f1: 0.4982
 epoch: 77, train_loss: 0.7543, test_loss: 0.9928, test_f1: 0.4765
 epoch: 78, train_loss: 0.7502, test_loss: 0.9757, test_f1: 0.4832
 epoch: 79, train_loss: 0.7576, test_loss: 0.9858, test_f1: 0.4812
 epoch: 80, train_loss: 0.7576, test_loss: 0.9888, test_f1: 0.4834
 epoch: 81, train_loss: 0.7596, test_loss: 1.0029, test_f1: 0.4892
 epoch: 82, train_loss: 0.7427, test_loss: 1.0007, test_f1: 0.4900
 epoch: 83, train_loss: 0.7518, test_loss: 0.9882, test_f1: 0.4813
 epoch: 84, train_loss: 0.7375, test_loss: 0.9864, test_f1: 0.4839
 epoch: 85, train_loss: 0.7564, test_loss: 0.9916, test_f1: 0.4855
 epoch: 86, train_loss: 0.7327, test_loss: 0.9856, test_f1: 0.4838
 epoch: 87, train_loss: 0.7420, test_loss: 0.9875, test_f1: 0.4805
 epoch: 88, train_loss: 0.7371, test_loss: 0.9878, test_f1: 0.4872
 epoch: 89, train_loss: 0.7397, test_loss: 1.0030, test_f1: 0.4822
 epoch: 90, train_loss: 0.7260, test_loss: 0.9865, test_f1: 0.4965
 epoch: 91, train_loss: 0.7326, test_loss: 0.9924, test_f1: 0.4869
 epoch: 92, train_loss: 0.7367, test_loss: 0.9976, test_f1: 0.5021
 epoch: 93, train_loss: 0.7126, test_loss: 0.9948, test_f1: 0.5086
 epoch: 94, train_loss: 0.7216, test_loss: 0.9973, test_f1: 0.4954
 epoch: 95, train_loss: 0.7292, test_loss: 0.9956, test_f1: 0.4893
 epoch: 96, train_loss: 0.7152, test_loss: 0.9962, test_f1: 0.5009
 epoch: 97, train_loss: 0.7179, test_loss: 1.0117, test_f1: 0.4997
 epoch: 98, train_loss: 0.7110, test_loss: 1.0157, test_f1: 0.5109
 epoch: 99, train_loss: 0.7155, test_loss: 0.9898, test_f1: 0.5100
##################ITERATION #6 ****************************************
 epoch: 0, train_loss: 1.3148, test_loss: 1.2985, test_f1: 0.2589
 epoch: 1, train_loss: 1.2444, test_loss: 1.2559, test_f1: 0.3251
 epoch: 2, train_loss: 1.2174, test_loss: 1.2072, test_f1: 0.3531
 epoch: 3, train_loss: 1.1849, test_loss: 1.1665, test_f1: 0.4255
 epoch: 4, train_loss: 1.1655, test_loss: 1.1376, test_f1: 0.4460
 epoch: 5, train_loss: 1.1501, test_loss: 1.1143, test_f1: 0.4578
 epoch: 6, train_loss: 1.1306, test_loss: 1.0987, test_f1: 0.4681
 epoch: 7, train_loss: 1.1287, test_loss: 1.0888, test_f1: 0.4666
 epoch: 8, train_loss: 1.1200, test_loss: 1.0780, test_f1: 0.4724
 epoch: 9, train_loss: 1.1110, test_loss: 1.0695, test_f1: 0.4628
 epoch: 10, train_loss: 1.0904, test_loss: 1.0613, test_f1: 0.4597
 epoch: 11, train_loss: 1.0795, test_loss: 1.0541, test_f1: 0.4616
 epoch: 12, train_loss: 1.0719, test_loss: 1.0494, test_f1: 0.4541
 epoch: 13, train_loss: 1.0640, test_loss: 1.0477, test_f1: 0.4627
 epoch: 14, train_loss: 1.0520, test_loss: 1.0408, test_f1: 0.4616
 epoch: 15, train_loss: 1.0483, test_loss: 1.0343, test_f1: 0.4678
 epoch: 16, train_loss: 1.0368, test_loss: 1.0253, test_f1: 0.4621
 epoch: 17, train_loss: 1.0208, test_loss: 1.0183, test_f1: 0.4599
 epoch: 18, train_loss: 1.0181, test_loss: 1.0211, test_f1: 0.4529
 epoch: 19, train_loss: 1.0131, test_loss: 1.0184, test_f1: 0.4633
 epoch: 20, train_loss: 1.0042, test_loss: 1.0066, test_f1: 0.4702
 epoch: 21, train_loss: 0.9907, test_loss: 1.0050, test_f1: 0.4617
 epoch: 22, train_loss: 0.9865, test_loss: 1.0029, test_f1: 0.4686
 epoch: 23, train_loss: 0.9748, test_loss: 0.9973, test_f1: 0.4593
 epoch: 24, train_loss: 0.9653, test_loss: 0.9938, test_f1: 0.4663
 epoch: 25, train_loss: 0.9523, test_loss: 0.9958, test_f1: 0.4781
 epoch: 26, train_loss: 0.9537, test_loss: 0.9774, test_f1: 0.4820
 epoch: 27, train_loss: 0.9526, test_loss: 0.9895, test_f1: 0.4799
 epoch: 28, train_loss: 0.9436, test_loss: 0.9914, test_f1: 0.4864
 epoch: 29, train_loss: 0.9383, test_loss: 1.0040, test_f1: 0.4688
 epoch: 30, train_loss: 0.9364, test_loss: 0.9780, test_f1: 0.4907
 epoch: 31, train_loss: 0.9265, test_loss: 0.9825, test_f1: 0.4854
 epoch: 32, train_loss: 0.9231, test_loss: 0.9882, test_f1: 0.4799
 epoch: 33, train_loss: 0.9187, test_loss: 0.9689, test_f1: 0.4894
 epoch: 34, train_loss: 0.9143, test_loss: 0.9780, test_f1: 0.4892
 epoch: 35, train_loss: 0.9076, test_loss: 0.9775, test_f1: 0.4895
 epoch: 36, train_loss: 0.8940, test_loss: 0.9784, test_f1: 0.4848
 epoch: 37, train_loss: 0.8954, test_loss: 0.9805, test_f1: 0.4957
 epoch: 38, train_loss: 0.8898, test_loss: 0.9854, test_f1: 0.4912
 epoch: 39, train_loss: 0.8809, test_loss: 0.9797, test_f1: 0.4923
 epoch: 40, train_loss: 0.8831, test_loss: 0.9955, test_f1: 0.4799
 epoch: 41, train_loss: 0.8802, test_loss: 0.9827, test_f1: 0.5097
 epoch: 42, train_loss: 0.8760, test_loss: 0.9743, test_f1: 0.5001
 epoch: 43, train_loss: 0.8663, test_loss: 0.9784, test_f1: 0.4957
 epoch: 44, train_loss: 0.8581, test_loss: 0.9669, test_f1: 0.4906
 epoch: 45, train_loss: 0.8550, test_loss: 0.9785, test_f1: 0.5077
 epoch: 46, train_loss: 0.8602, test_loss: 0.9724, test_f1: 0.5043
 epoch: 47, train_loss: 0.8442, test_loss: 0.9655, test_f1: 0.4856
 epoch: 48, train_loss: 0.8427, test_loss: 0.9963, test_f1: 0.4863
 epoch: 49, train_loss: 0.8458, test_loss: 0.9929, test_f1: 0.4835
 epoch: 50, train_loss: 0.8254, test_loss: 0.9841, test_f1: 0.4953
 epoch: 51, train_loss: 0.8228, test_loss: 0.9828, test_f1: 0.4963
 epoch: 52, train_loss: 0.8179, test_loss: 0.9886, test_f1: 0.4919
 epoch: 53, train_loss: 0.8253, test_loss: 0.9974, test_f1: 0.4866
 epoch: 54, train_loss: 0.8208, test_loss: 0.9933, test_f1: 0.4958
 epoch: 55, train_loss: 0.8216, test_loss: 0.9978, test_f1: 0.5002
 epoch: 56, train_loss: 0.8159, test_loss: 0.9955, test_f1: 0.4845
 epoch: 57, train_loss: 0.8126, test_loss: 0.9944, test_f1: 0.4954
 epoch: 58, train_loss: 0.8056, test_loss: 1.0017, test_f1: 0.4885
 epoch: 59, train_loss: 0.8123, test_loss: 0.9964, test_f1: 0.4932
 epoch: 60, train_loss: 0.8079, test_loss: 0.9977, test_f1: 0.5010
 epoch: 61, train_loss: 0.8039, test_loss: 0.9962, test_f1: 0.4946
 epoch: 62, train_loss: 0.8000, test_loss: 1.0013, test_f1: 0.4959
 epoch: 63, train_loss: 0.7919, test_loss: 1.0190, test_f1: 0.4800
 epoch: 64, train_loss: 0.8022, test_loss: 1.0071, test_f1: 0.4901
 epoch: 65, train_loss: 0.8031, test_loss: 1.0226, test_f1: 0.4882
 epoch: 66, train_loss: 0.7910, test_loss: 1.0124, test_f1: 0.4960
 epoch: 67, train_loss: 0.7875, test_loss: 1.0170, test_f1: 0.4931
 epoch: 68, train_loss: 0.7765, test_loss: 1.0127, test_f1: 0.4978
 epoch: 69, train_loss: 0.7807, test_loss: 1.0134, test_f1: 0.4933
 epoch: 70, train_loss: 0.7740, test_loss: 1.0246, test_f1: 0.5071
 epoch: 71, train_loss: 0.7758, test_loss: 1.0286, test_f1: 0.5023
 epoch: 72, train_loss: 0.7848, test_loss: 1.0316, test_f1: 0.4956
 epoch: 73, train_loss: 0.7714, test_loss: 1.0350, test_f1: 0.4939
 epoch: 74, train_loss: 0.7788, test_loss: 1.0176, test_f1: 0.4967
 epoch: 75, train_loss: 0.7831, test_loss: 1.0463, test_f1: 0.4805
 epoch: 76, train_loss: 0.7753, test_loss: 1.0344, test_f1: 0.4959
 epoch: 77, train_loss: 0.7681, test_loss: 1.0248, test_f1: 0.5075
 epoch: 78, train_loss: 0.7643, test_loss: 1.0303, test_f1: 0.4930
 epoch: 79, train_loss: 0.7674, test_loss: 1.0409, test_f1: 0.4888
 epoch: 80, train_loss: 0.7619, test_loss: 1.0461, test_f1: 0.4967
 epoch: 81, train_loss: 0.7621, test_loss: 1.0381, test_f1: 0.4907
 epoch: 82, train_loss: 0.7568, test_loss: 1.0454, test_f1: 0.4924
 epoch: 83, train_loss: 0.7525, test_loss: 1.0570, test_f1: 0.4758
 epoch: 84, train_loss: 0.7491, test_loss: 1.0577, test_f1: 0.4984
 epoch: 85, train_loss: 0.7516, test_loss: 1.0498, test_f1: 0.5003
 epoch: 86, train_loss: 0.7471, test_loss: 1.0505, test_f1: 0.5097
 epoch: 87, train_loss: 0.7483, test_loss: 1.0570, test_f1: 0.4858
 epoch: 88, train_loss: 0.7516, test_loss: 1.0636, test_f1: 0.4715
 epoch: 89, train_loss: 0.7393, test_loss: 1.0618, test_f1: 0.4987
 epoch: 90, train_loss: 0.7390, test_loss: 1.0488, test_f1: 0.5006
 epoch: 91, train_loss: 0.7333, test_loss: 1.0699, test_f1: 0.4854
 epoch: 92, train_loss: 0.7378, test_loss: 1.0888, test_f1: 0.4959
 epoch: 93, train_loss: 0.7317, test_loss: 1.0788, test_f1: 0.4982
 epoch: 94, train_loss: 0.7224, test_loss: 1.0838, test_f1: 0.4936
 epoch: 95, train_loss: 0.7415, test_loss: 1.0743, test_f1: 0.4919
 epoch: 96, train_loss: 0.7137, test_loss: 1.0961, test_f1: 0.4860
 epoch: 97, train_loss: 0.7270, test_loss: 1.0913, test_f1: 0.4839
 epoch: 98, train_loss: 0.7135, test_loss: 1.1043, test_f1: 0.4756
 epoch: 99, train_loss: 0.7285, test_loss: 1.0770, test_f1: 0.4859
##################ITERATION #7 ****************************************
 epoch: 0, train_loss: 1.3365, test_loss: 1.2877, test_f1: 0.2276
 epoch: 1, train_loss: 1.2497, test_loss: 1.2378, test_f1: 0.2889
 epoch: 2, train_loss: 1.2267, test_loss: 1.1878, test_f1: 0.3569
 epoch: 3, train_loss: 1.1879, test_loss: 1.1491, test_f1: 0.4390
 epoch: 4, train_loss: 1.1763, test_loss: 1.1224, test_f1: 0.4442
 epoch: 5, train_loss: 1.1536, test_loss: 1.1039, test_f1: 0.4535
 epoch: 6, train_loss: 1.1357, test_loss: 1.0872, test_f1: 0.4587
 epoch: 7, train_loss: 1.1227, test_loss: 1.0720, test_f1: 0.4558
 epoch: 8, train_loss: 1.1057, test_loss: 1.0607, test_f1: 0.4594
 epoch: 9, train_loss: 1.0997, test_loss: 1.0539, test_f1: 0.4543
 epoch: 10, train_loss: 1.0810, test_loss: 1.0381, test_f1: 0.4540
 epoch: 11, train_loss: 1.0706, test_loss: 1.0278, test_f1: 0.4459
 epoch: 12, train_loss: 1.0642, test_loss: 1.0201, test_f1: 0.4740
 epoch: 13, train_loss: 1.0529, test_loss: 1.0125, test_f1: 0.4802
 epoch: 14, train_loss: 1.0432, test_loss: 1.0096, test_f1: 0.4644
 epoch: 15, train_loss: 1.0272, test_loss: 0.9979, test_f1: 0.4822
 epoch: 16, train_loss: 1.0202, test_loss: 0.9940, test_f1: 0.4791
 epoch: 17, train_loss: 1.0099, test_loss: 0.9904, test_f1: 0.4784
 epoch: 18, train_loss: 1.0116, test_loss: 0.9793, test_f1: 0.4897
 epoch: 19, train_loss: 0.9967, test_loss: 0.9731, test_f1: 0.5038
 epoch: 20, train_loss: 0.9885, test_loss: 0.9763, test_f1: 0.4782
 epoch: 21, train_loss: 0.9859, test_loss: 0.9709, test_f1: 0.5082
 epoch: 22, train_loss: 0.9873, test_loss: 0.9638, test_f1: 0.5217
 epoch: 23, train_loss: 0.9708, test_loss: 0.9655, test_f1: 0.4819
 epoch: 24, train_loss: 0.9563, test_loss: 0.9586, test_f1: 0.4945
 epoch: 25, train_loss: 0.9547, test_loss: 0.9563, test_f1: 0.4998
 epoch: 26, train_loss: 0.9525, test_loss: 0.9542, test_f1: 0.5005
 epoch: 27, train_loss: 0.9556, test_loss: 0.9450, test_f1: 0.5189
 epoch: 28, train_loss: 0.9396, test_loss: 0.9469, test_f1: 0.4920
 epoch: 29, train_loss: 0.9422, test_loss: 0.9445, test_f1: 0.4999
 epoch: 30, train_loss: 0.9228, test_loss: 0.9462, test_f1: 0.5010
 epoch: 31, train_loss: 0.9176, test_loss: 0.9341, test_f1: 0.4943
 epoch: 32, train_loss: 0.9241, test_loss: 0.9438, test_f1: 0.4993
 epoch: 33, train_loss: 0.9141, test_loss: 0.9474, test_f1: 0.5098
 epoch: 34, train_loss: 0.8975, test_loss: 0.9366, test_f1: 0.5202
 epoch: 35, train_loss: 0.8939, test_loss: 0.9396, test_f1: 0.5181
 epoch: 36, train_loss: 0.8894, test_loss: 0.9494, test_f1: 0.5229
 epoch: 37, train_loss: 0.8803, test_loss: 0.9511, test_f1: 0.5137
 epoch: 38, train_loss: 0.8871, test_loss: 0.9439, test_f1: 0.5238
 epoch: 39, train_loss: 0.8789, test_loss: 0.9455, test_f1: 0.5295
 epoch: 40, train_loss: 0.8728, test_loss: 0.9593, test_f1: 0.5205
 epoch: 41, train_loss: 0.8600, test_loss: 0.9749, test_f1: 0.5222
 epoch: 42, train_loss: 0.8732, test_loss: 0.9537, test_f1: 0.5312
 epoch: 43, train_loss: 0.8572, test_loss: 0.9327, test_f1: 0.5245
 epoch: 44, train_loss: 0.8542, test_loss: 0.9330, test_f1: 0.5291
 epoch: 45, train_loss: 0.8506, test_loss: 0.9669, test_f1: 0.5296
 epoch: 46, train_loss: 0.8476, test_loss: 0.9798, test_f1: 0.5246
 epoch: 47, train_loss: 0.8376, test_loss: 0.9629, test_f1: 0.5178
 epoch: 48, train_loss: 0.8470, test_loss: 0.9494, test_f1: 0.5260
 epoch: 49, train_loss: 0.8278, test_loss: 0.9683, test_f1: 0.5144
 epoch: 50, train_loss: 0.8151, test_loss: 0.9611, test_f1: 0.5310
 epoch: 51, train_loss: 0.8261, test_loss: 0.9565, test_f1: 0.5402
 epoch: 52, train_loss: 0.8300, test_loss: 0.9771, test_f1: 0.5375
 epoch: 53, train_loss: 0.8023, test_loss: 0.9793, test_f1: 0.5338
 epoch: 54, train_loss: 0.8092, test_loss: 0.9753, test_f1: 0.5182
 epoch: 55, train_loss: 0.8048, test_loss: 0.9950, test_f1: 0.5279
 epoch: 56, train_loss: 0.7957, test_loss: 0.9768, test_f1: 0.5371
 epoch: 57, train_loss: 0.7977, test_loss: 0.9716, test_f1: 0.5309
 epoch: 58, train_loss: 0.8127, test_loss: 0.9745, test_f1: 0.5406
 epoch: 59, train_loss: 0.7948, test_loss: 0.9766, test_f1: 0.5398
 epoch: 60, train_loss: 0.7931, test_loss: 0.9776, test_f1: 0.5364
 epoch: 61, train_loss: 0.7998, test_loss: 0.9823, test_f1: 0.5314
 epoch: 62, train_loss: 0.7837, test_loss: 0.9840, test_f1: 0.5408
 epoch: 63, train_loss: 0.7917, test_loss: 0.9852, test_f1: 0.5409
 epoch: 64, train_loss: 0.7847, test_loss: 0.9759, test_f1: 0.5432
 epoch: 65, train_loss: 0.7819, test_loss: 0.9799, test_f1: 0.5360
 epoch: 66, train_loss: 0.7913, test_loss: 0.9936, test_f1: 0.5378
 epoch: 67, train_loss: 0.7745, test_loss: 0.9809, test_f1: 0.5364
 epoch: 68, train_loss: 0.7769, test_loss: 0.9746, test_f1: 0.5294
 epoch: 69, train_loss: 0.7764, test_loss: 0.9964, test_f1: 0.5355
 epoch: 70, train_loss: 0.7730, test_loss: 1.0080, test_f1: 0.5453
 epoch: 71, train_loss: 0.7605, test_loss: 0.9984, test_f1: 0.5378
 epoch: 72, train_loss: 0.7693, test_loss: 1.0095, test_f1: 0.5404
 epoch: 73, train_loss: 0.7725, test_loss: 1.0017, test_f1: 0.5366
 epoch: 74, train_loss: 0.7700, test_loss: 1.0021, test_f1: 0.5360
 epoch: 75, train_loss: 0.7607, test_loss: 1.0042, test_f1: 0.5419
 epoch: 76, train_loss: 0.7599, test_loss: 1.0024, test_f1: 0.5290
 epoch: 77, train_loss: 0.7776, test_loss: 1.0005, test_f1: 0.5391
 epoch: 78, train_loss: 0.7661, test_loss: 1.0035, test_f1: 0.5367
 epoch: 79, train_loss: 0.7540, test_loss: 1.0230, test_f1: 0.5429
 epoch: 80, train_loss: 0.7489, test_loss: 1.0258, test_f1: 0.5326
 epoch: 81, train_loss: 0.7471, test_loss: 1.0070, test_f1: 0.5379
 epoch: 82, train_loss: 0.7431, test_loss: 1.0012, test_f1: 0.5285
 epoch: 83, train_loss: 0.7359, test_loss: 0.9974, test_f1: 0.5465
 epoch: 84, train_loss: 0.7411, test_loss: 0.9913, test_f1: 0.5351
 epoch: 85, train_loss: 0.7414, test_loss: 1.0104, test_f1: 0.5308
 epoch: 86, train_loss: 0.7326, test_loss: 1.0262, test_f1: 0.5373
 epoch: 87, train_loss: 0.7377, test_loss: 1.0120, test_f1: 0.5342
 epoch: 88, train_loss: 0.7366, test_loss: 1.0282, test_f1: 0.5434
 epoch: 89, train_loss: 0.7387, test_loss: 1.0375, test_f1: 0.5349
 epoch: 90, train_loss: 0.7294, test_loss: 1.0452, test_f1: 0.5350
 epoch: 91, train_loss: 0.7308, test_loss: 1.0163, test_f1: 0.5399
 epoch: 92, train_loss: 0.7301, test_loss: 1.0323, test_f1: 0.5358
 epoch: 93, train_loss: 0.7204, test_loss: 1.0352, test_f1: 0.5374
 epoch: 94, train_loss: 0.7093, test_loss: 1.0469, test_f1: 0.5440
 epoch: 95, train_loss: 0.7377, test_loss: 1.0227, test_f1: 0.5385
 epoch: 96, train_loss: 0.7126, test_loss: 1.0273, test_f1: 0.5396
 epoch: 97, train_loss: 0.7078, test_loss: 1.0457, test_f1: 0.5350
 epoch: 98, train_loss: 0.7172, test_loss: 1.0490, test_f1: 0.5360
 epoch: 99, train_loss: 0.7215, test_loss: 1.0346, test_f1: 0.5396
##################ITERATION #8 ****************************************
 epoch: 0, train_loss: 1.3598, test_loss: 1.3389, test_f1: 0.2658
 epoch: 1, train_loss: 1.2597, test_loss: 1.2524, test_f1: 0.2589
 epoch: 2, train_loss: 1.2041, test_loss: 1.1931, test_f1: 0.3377
 epoch: 3, train_loss: 1.1743, test_loss: 1.1322, test_f1: 0.4619
 epoch: 4, train_loss: 1.1597, test_loss: 1.0931, test_f1: 0.4777
 epoch: 5, train_loss: 1.1556, test_loss: 1.0753, test_f1: 0.4705
 epoch: 6, train_loss: 1.1388, test_loss: 1.0665, test_f1: 0.4662
 epoch: 7, train_loss: 1.1136, test_loss: 1.0577, test_f1: 0.4714
 epoch: 8, train_loss: 1.1139, test_loss: 1.0521, test_f1: 0.4772
 epoch: 9, train_loss: 1.1011, test_loss: 1.0451, test_f1: 0.4722
 epoch: 10, train_loss: 1.0826, test_loss: 1.0403, test_f1: 0.4797
 epoch: 11, train_loss: 1.0757, test_loss: 1.0308, test_f1: 0.4843
 epoch: 12, train_loss: 1.0792, test_loss: 1.0219, test_f1: 0.4892
 epoch: 13, train_loss: 1.0696, test_loss: 1.0199, test_f1: 0.4984
 epoch: 14, train_loss: 1.0517, test_loss: 1.0167, test_f1: 0.4775
 epoch: 15, train_loss: 1.0372, test_loss: 1.0072, test_f1: 0.4781
 epoch: 16, train_loss: 1.0284, test_loss: 1.0040, test_f1: 0.4859
 epoch: 17, train_loss: 1.0293, test_loss: 1.0012, test_f1: 0.4841
 epoch: 18, train_loss: 1.0209, test_loss: 0.9982, test_f1: 0.4707
 epoch: 19, train_loss: 1.0064, test_loss: 0.9975, test_f1: 0.4617
 epoch: 20, train_loss: 1.0114, test_loss: 0.9881, test_f1: 0.4668
 epoch: 21, train_loss: 0.9933, test_loss: 0.9830, test_f1: 0.4613
 epoch: 22, train_loss: 0.9838, test_loss: 0.9896, test_f1: 0.4726
 epoch: 23, train_loss: 0.9788, test_loss: 0.9756, test_f1: 0.4792
 epoch: 24, train_loss: 0.9824, test_loss: 0.9854, test_f1: 0.4801
 epoch: 25, train_loss: 0.9728, test_loss: 0.9788, test_f1: 0.4884
 epoch: 26, train_loss: 0.9627, test_loss: 0.9715, test_f1: 0.4876
 epoch: 27, train_loss: 0.9636, test_loss: 0.9720, test_f1: 0.4860
 epoch: 28, train_loss: 0.9570, test_loss: 0.9791, test_f1: 0.4893
 epoch: 29, train_loss: 0.9374, test_loss: 0.9741, test_f1: 0.4873
 epoch: 30, train_loss: 0.9475, test_loss: 0.9711, test_f1: 0.4927
 epoch: 31, train_loss: 0.9307, test_loss: 0.9743, test_f1: 0.4967
 epoch: 32, train_loss: 0.9370, test_loss: 0.9734, test_f1: 0.4957
 epoch: 33, train_loss: 0.9174, test_loss: 0.9787, test_f1: 0.4977
 epoch: 34, train_loss: 0.9196, test_loss: 0.9720, test_f1: 0.4978
 epoch: 35, train_loss: 0.9179, test_loss: 0.9603, test_f1: 0.5040
 epoch: 36, train_loss: 0.9174, test_loss: 0.9792, test_f1: 0.5078
 epoch: 37, train_loss: 0.9072, test_loss: 0.9708, test_f1: 0.5175
 epoch: 38, train_loss: 0.9054, test_loss: 0.9686, test_f1: 0.5035
 epoch: 39, train_loss: 0.8980, test_loss: 0.9628, test_f1: 0.5094
 epoch: 40, train_loss: 0.8903, test_loss: 0.9654, test_f1: 0.5023
 epoch: 41, train_loss: 0.8896, test_loss: 0.9664, test_f1: 0.5090
 epoch: 42, train_loss: 0.8859, test_loss: 0.9612, test_f1: 0.5161
 epoch: 43, train_loss: 0.8707, test_loss: 0.9751, test_f1: 0.5072
 epoch: 44, train_loss: 0.8710, test_loss: 0.9651, test_f1: 0.5083
 epoch: 45, train_loss: 0.8739, test_loss: 0.9824, test_f1: 0.5194
 epoch: 46, train_loss: 0.8558, test_loss: 0.9833, test_f1: 0.5183
 epoch: 47, train_loss: 0.8504, test_loss: 0.9594, test_f1: 0.5140
 epoch: 48, train_loss: 0.8458, test_loss: 0.9762, test_f1: 0.5078
 epoch: 49, train_loss: 0.8483, test_loss: 0.9719, test_f1: 0.5220
 epoch: 50, train_loss: 0.8306, test_loss: 0.9741, test_f1: 0.5200
 epoch: 51, train_loss: 0.8412, test_loss: 0.9708, test_f1: 0.5078
 epoch: 52, train_loss: 0.8306, test_loss: 0.9716, test_f1: 0.5109
 epoch: 53, train_loss: 0.8222, test_loss: 0.9676, test_f1: 0.5158
 epoch: 54, train_loss: 0.8286, test_loss: 0.9642, test_f1: 0.5142
 epoch: 55, train_loss: 0.8228, test_loss: 0.9729, test_f1: 0.5115
 epoch: 56, train_loss: 0.8106, test_loss: 0.9860, test_f1: 0.5135
 epoch: 57, train_loss: 0.8156, test_loss: 0.9665, test_f1: 0.5199
 epoch: 58, train_loss: 0.8153, test_loss: 0.9647, test_f1: 0.5242
 epoch: 59, train_loss: 0.8040, test_loss: 0.9690, test_f1: 0.5098
 epoch: 60, train_loss: 0.8047, test_loss: 0.9706, test_f1: 0.5228
 epoch: 61, train_loss: 0.8031, test_loss: 0.9761, test_f1: 0.5144
 epoch: 62, train_loss: 0.7962, test_loss: 0.9764, test_f1: 0.5218
 epoch: 63, train_loss: 0.8034, test_loss: 0.9668, test_f1: 0.5224
 epoch: 64, train_loss: 0.7963, test_loss: 0.9788, test_f1: 0.5213
 epoch: 65, train_loss: 0.7941, test_loss: 0.9781, test_f1: 0.5155
 epoch: 66, train_loss: 0.7989, test_loss: 0.9783, test_f1: 0.5233
 epoch: 67, train_loss: 0.7937, test_loss: 0.9837, test_f1: 0.5120
 epoch: 68, train_loss: 0.7918, test_loss: 0.9840, test_f1: 0.5121
 epoch: 69, train_loss: 0.7773, test_loss: 0.9894, test_f1: 0.5133
 epoch: 70, train_loss: 0.7827, test_loss: 0.9853, test_f1: 0.5131
 epoch: 71, train_loss: 0.7850, test_loss: 0.9801, test_f1: 0.5178
 epoch: 72, train_loss: 0.7815, test_loss: 0.9768, test_f1: 0.5131
 epoch: 73, train_loss: 0.7773, test_loss: 0.9885, test_f1: 0.5119
 epoch: 74, train_loss: 0.7804, test_loss: 0.9817, test_f1: 0.5216
 epoch: 75, train_loss: 0.7783, test_loss: 0.9906, test_f1: 0.5195
 epoch: 76, train_loss: 0.7698, test_loss: 0.9836, test_f1: 0.5167
 epoch: 77, train_loss: 0.7704, test_loss: 0.9902, test_f1: 0.5355
 epoch: 78, train_loss: 0.7574, test_loss: 0.9898, test_f1: 0.5383
 epoch: 79, train_loss: 0.7612, test_loss: 0.9979, test_f1: 0.5158
 epoch: 80, train_loss: 0.7650, test_loss: 0.9908, test_f1: 0.5225
 epoch: 81, train_loss: 0.7610, test_loss: 0.9982, test_f1: 0.5366
 epoch: 82, train_loss: 0.7563, test_loss: 0.9953, test_f1: 0.5270
 epoch: 83, train_loss: 0.7498, test_loss: 1.0083, test_f1: 0.5336
 epoch: 84, train_loss: 0.7608, test_loss: 0.9993, test_f1: 0.5234
 epoch: 85, train_loss: 0.7515, test_loss: 0.9949, test_f1: 0.5293
 epoch: 86, train_loss: 0.7555, test_loss: 0.9942, test_f1: 0.5328
 epoch: 87, train_loss: 0.7446, test_loss: 0.9888, test_f1: 0.5304
 epoch: 88, train_loss: 0.7403, test_loss: 1.0107, test_f1: 0.5222
 epoch: 89, train_loss: 0.7276, test_loss: 0.9944, test_f1: 0.5322
 epoch: 90, train_loss: 0.7384, test_loss: 1.0014, test_f1: 0.5225
 epoch: 91, train_loss: 0.7427, test_loss: 1.0100, test_f1: 0.5408
 epoch: 92, train_loss: 0.7301, test_loss: 1.0009, test_f1: 0.5326
 epoch: 93, train_loss: 0.7266, test_loss: 1.0159, test_f1: 0.5273
 epoch: 94, train_loss: 0.7346, test_loss: 1.0069, test_f1: 0.5390
 epoch: 95, train_loss: 0.7242, test_loss: 0.9983, test_f1: 0.5312
 epoch: 96, train_loss: 0.7222, test_loss: 1.0013, test_f1: 0.5306
 epoch: 97, train_loss: 0.7165, test_loss: 1.0133, test_f1: 0.5321
 epoch: 98, train_loss: 0.7152, test_loss: 0.9956, test_f1: 0.5382
 epoch: 99, train_loss: 0.7181, test_loss: 1.0188, test_f1: 0.5321
##################ITERATION #9 ****************************************
 epoch: 0, train_loss: 1.3739, test_loss: 1.3026, test_f1: 0.2300
 epoch: 1, train_loss: 1.2693, test_loss: 1.2477, test_f1: 0.3098
 epoch: 2, train_loss: 1.2139, test_loss: 1.2034, test_f1: 0.3927
 epoch: 3, train_loss: 1.1907, test_loss: 1.1660, test_f1: 0.4331
 epoch: 4, train_loss: 1.1661, test_loss: 1.1316, test_f1: 0.4713
 epoch: 5, train_loss: 1.1495, test_loss: 1.0998, test_f1: 0.4790
 epoch: 6, train_loss: 1.1312, test_loss: 1.0800, test_f1: 0.4841
 epoch: 7, train_loss: 1.1202, test_loss: 1.0671, test_f1: 0.4778
 epoch: 8, train_loss: 1.0965, test_loss: 1.0544, test_f1: 0.4821
 epoch: 9, train_loss: 1.0982, test_loss: 1.0548, test_f1: 0.4779
 epoch: 10, train_loss: 1.0818, test_loss: 1.0414, test_f1: 0.4751
 epoch: 11, train_loss: 1.0640, test_loss: 1.0292, test_f1: 0.4809
 epoch: 12, train_loss: 1.0648, test_loss: 1.0252, test_f1: 0.4830
 epoch: 13, train_loss: 1.0445, test_loss: 1.0213, test_f1: 0.4756
 epoch: 14, train_loss: 1.0403, test_loss: 1.0229, test_f1: 0.4777
 epoch: 15, train_loss: 1.0293, test_loss: 1.0103, test_f1: 0.4786
 epoch: 16, train_loss: 1.0202, test_loss: 1.0044, test_f1: 0.4835
 epoch: 17, train_loss: 1.0096, test_loss: 1.0033, test_f1: 0.4815
 epoch: 18, train_loss: 1.0062, test_loss: 0.9923, test_f1: 0.4916
 epoch: 19, train_loss: 0.9925, test_loss: 1.0010, test_f1: 0.4827
 epoch: 20, train_loss: 0.9851, test_loss: 0.9938, test_f1: 0.4775
 epoch: 21, train_loss: 0.9762, test_loss: 0.9931, test_f1: 0.4906
 epoch: 22, train_loss: 0.9711, test_loss: 0.9852, test_f1: 0.4911
 epoch: 23, train_loss: 0.9661, test_loss: 0.9913, test_f1: 0.4863
 epoch: 24, train_loss: 0.9583, test_loss: 0.9892, test_f1: 0.4844
 epoch: 25, train_loss: 0.9542, test_loss: 0.9731, test_f1: 0.5002
 epoch: 26, train_loss: 0.9479, test_loss: 0.9759, test_f1: 0.4862
 epoch: 27, train_loss: 0.9403, test_loss: 0.9881, test_f1: 0.4899
 epoch: 28, train_loss: 0.9411, test_loss: 0.9784, test_f1: 0.4952
 epoch: 29, train_loss: 0.9357, test_loss: 0.9864, test_f1: 0.5073
 epoch: 30, train_loss: 0.9113, test_loss: 1.0022, test_f1: 0.4915
 epoch: 31, train_loss: 0.9189, test_loss: 0.9839, test_f1: 0.5050
 epoch: 32, train_loss: 0.9099, test_loss: 0.9802, test_f1: 0.5062
 epoch: 33, train_loss: 0.8998, test_loss: 0.9901, test_f1: 0.4894
 epoch: 34, train_loss: 0.8928, test_loss: 0.9999, test_f1: 0.4922
 epoch: 35, train_loss: 0.8878, test_loss: 1.0051, test_f1: 0.4984
 epoch: 36, train_loss: 0.8949, test_loss: 0.9873, test_f1: 0.4859
 epoch: 37, train_loss: 0.8853, test_loss: 1.0011, test_f1: 0.4919
 epoch: 38, train_loss: 0.8852, test_loss: 0.9886, test_f1: 0.5074
 epoch: 39, train_loss: 0.8602, test_loss: 0.9959, test_f1: 0.4917
 epoch: 40, train_loss: 0.8629, test_loss: 0.9905, test_f1: 0.4977
 epoch: 41, train_loss: 0.8540, test_loss: 1.0029, test_f1: 0.5090
 epoch: 42, train_loss: 0.8512, test_loss: 0.9993, test_f1: 0.5178
 epoch: 43, train_loss: 0.8420, test_loss: 0.9937, test_f1: 0.5181
 epoch: 44, train_loss: 0.8537, test_loss: 1.0051, test_f1: 0.5173
 epoch: 45, train_loss: 0.8458, test_loss: 1.0181, test_f1: 0.5111
 epoch: 46, train_loss: 0.8335, test_loss: 1.0061, test_f1: 0.5047
 epoch: 47, train_loss: 0.8299, test_loss: 1.0002, test_f1: 0.5104
 epoch: 48, train_loss: 0.8259, test_loss: 1.0137, test_f1: 0.5161
 epoch: 49, train_loss: 0.8160, test_loss: 1.0245, test_f1: 0.5225
 epoch: 50, train_loss: 0.8086, test_loss: 1.0002, test_f1: 0.5153
 epoch: 51, train_loss: 0.8090, test_loss: 1.0058, test_f1: 0.5197
 epoch: 52, train_loss: 0.8103, test_loss: 1.0142, test_f1: 0.5160
 epoch: 53, train_loss: 0.7994, test_loss: 1.0248, test_f1: 0.5187
 epoch: 54, train_loss: 0.7980, test_loss: 1.0301, test_f1: 0.5154
 epoch: 55, train_loss: 0.8063, test_loss: 1.0309, test_f1: 0.5158
 epoch: 56, train_loss: 0.7975, test_loss: 1.0314, test_f1: 0.5169
 epoch: 57, train_loss: 0.7890, test_loss: 1.0306, test_f1: 0.5187
 epoch: 58, train_loss: 0.7887, test_loss: 1.0320, test_f1: 0.5131
 epoch: 59, train_loss: 0.7799, test_loss: 1.0372, test_f1: 0.5178
 epoch: 60, train_loss: 0.7859, test_loss: 1.0361, test_f1: 0.5230
 epoch: 61, train_loss: 0.7755, test_loss: 1.0259, test_f1: 0.5155
 epoch: 62, train_loss: 0.7825, test_loss: 1.0289, test_f1: 0.5182
 epoch: 63, train_loss: 0.7625, test_loss: 1.0343, test_f1: 0.5249
 epoch: 64, train_loss: 0.7711, test_loss: 1.0303, test_f1: 0.5255
 epoch: 65, train_loss: 0.7783, test_loss: 1.0506, test_f1: 0.5232
 epoch: 66, train_loss: 0.7669, test_loss: 1.0510, test_f1: 0.5229
 epoch: 67, train_loss: 0.7658, test_loss: 1.0481, test_f1: 0.5159
 epoch: 68, train_loss: 0.7633, test_loss: 1.0527, test_f1: 0.5238
 epoch: 69, train_loss: 0.7602, test_loss: 1.0549, test_f1: 0.5228
 epoch: 70, train_loss: 0.7653, test_loss: 1.0481, test_f1: 0.5284
 epoch: 71, train_loss: 0.7562, test_loss: 1.0655, test_f1: 0.5199
 epoch: 72, train_loss: 0.7545, test_loss: 1.0692, test_f1: 0.5075
 epoch: 73, train_loss: 0.7456, test_loss: 1.0670, test_f1: 0.5227
 epoch: 74, train_loss: 0.7345, test_loss: 1.0705, test_f1: 0.5191
 epoch: 75, train_loss: 0.7521, test_loss: 1.0651, test_f1: 0.5120
 epoch: 76, train_loss: 0.7498, test_loss: 1.0767, test_f1: 0.5163
 epoch: 77, train_loss: 0.7305, test_loss: 1.0705, test_f1: 0.5117
 epoch: 78, train_loss: 0.7396, test_loss: 1.0701, test_f1: 0.5119
 epoch: 79, train_loss: 0.7316, test_loss: 1.0934, test_f1: 0.5086
 epoch: 80, train_loss: 0.7267, test_loss: 1.0843, test_f1: 0.5105
 epoch: 81, train_loss: 0.7304, test_loss: 1.0820, test_f1: 0.5153
 epoch: 82, train_loss: 0.7227, test_loss: 1.0883, test_f1: 0.5143
 epoch: 83, train_loss: 0.7246, test_loss: 1.0845, test_f1: 0.5124
 epoch: 84, train_loss: 0.7290, test_loss: 1.1043, test_f1: 0.5148
 epoch: 85, train_loss: 0.7335, test_loss: 1.0898, test_f1: 0.5084
 epoch: 86, train_loss: 0.7122, test_loss: 1.0940, test_f1: 0.5063
 epoch: 87, train_loss: 0.7143, test_loss: 1.0973, test_f1: 0.5153
 epoch: 88, train_loss: 0.7192, test_loss: 1.0953, test_f1: 0.5131
 epoch: 89, train_loss: 0.7157, test_loss: 1.0966, test_f1: 0.5096
 epoch: 90, train_loss: 0.7139, test_loss: 1.0973, test_f1: 0.5160
 epoch: 91, train_loss: 0.7089, test_loss: 1.0917, test_f1: 0.5094
 epoch: 92, train_loss: 0.7000, test_loss: 1.1069, test_f1: 0.5211
 epoch: 93, train_loss: 0.7014, test_loss: 1.1165, test_f1: 0.5120
 epoch: 94, train_loss: 0.6977, test_loss: 1.1175, test_f1: 0.5163
 epoch: 95, train_loss: 0.7110, test_loss: 1.1138, test_f1: 0.5141
 epoch: 96, train_loss: 0.6914, test_loss: 1.1255, test_f1: 0.5091
 epoch: 97, train_loss: 0.6956, test_loss: 1.1102, test_f1: 0.5112
 epoch: 98, train_loss: 0.6904, test_loss: 1.1195, test_f1: 0.5177
 epoch: 99, train_loss: 0.6880, test_loss: 1.1128, test_f1: 0.5241

Training completed in 548.92 seconds
Best F1: 0.5623 at epoch 97
Mean F1 across iterations: 0.5321  0.0163
========================FINAL RESULTS================================
FEGIN weighted F1: 0.5623  0.0163
python main.py --data ltspice_examples --representation component_component --model FEGIN --layers 2 --hiddens 128 --batch_size 256 --lr 0.0001 --emb_size 128 --epochs 100 --save_appendix component_component_L2_H128_BS256_LR0.0001_E128 --no_val
-----



STDERR:
  File "main.py", line 370, in <module>
    main()
  File "main.py", line 254, in main
    dataset = dataset_class(
  File "/home/philip/projects/llm_inference_code_repo/Circuit-Completion-Using-GNNs/component_classification_with_link_prediction_head/evaluation/FEGIN/kernel/circuit_datasets.py", line 15, in __init__
    self.data, self.slices = torch.load(self.processed_paths[0])
  File "/home/philip/.local/lib/python3.8/site-packages/torch/serialization.py", line 1040, in load
    warnings.warn(
  File "/usr/lib/python3.8/warnings.py", line 109, in _showwarnmsg
    sw(msg.message, msg.category, msg.filename, msg.lineno,
  File "main.py", line 47, in warn_with_traceback
    traceback.print_stack(file=log)
/home/philip/projects/llm_inference_code_repo/Circuit-Completion-Using-GNNs/component_classification_with_link_prediction_head/evaluation/FEGIN/kernel/circuit_datasets.py:15: FutureWarning: You are using `torch.load` with `weights_only=False` (the current default value), which uses the default pickle module implicitly. It is possible to construct malicious pickle data which will execute arbitrary code during unpickling (See https://github.com/pytorch/pytorch/blob/main/SECURITY.md#untrusted-models for more details). In a future release, the default value for `weights_only` will be flipped to `True`. This limits the functions that could be executed during unpickling. Arbitrary objects will no longer be allowed to be loaded via this mode unless they are explicitly allowlisted by the user via `torch.serialization.add_safe_globals`. We recommend you start setting `weights_only=True` for any use case where you don't have full control of the loaded file. Please open an issue on GitHub for any issues related to this experimental feature.
  self.data, self.slices = torch.load(self.processed_paths[0])
