STDOUT:
Results will be saved in /home/philip/projects/ltspice_examples_code_repo/Circuit-Completion-Using-GNNs/component_classification_with_link_prediction_head/evaluation/FEGIN/results/model_FEGIN_dataset_ltspice_examples
Command line input: python main.py --data ltspice_examples --representation component_net --model FEGIN --layers 6 --hiddens 64 --batch_size 256 --lr 0.0001 --emb_size 512 --epochs 100 --save_appendix component_net_L6_H64_BS256_LR0.0001_E512 --no_val
 is saved.
-----
ltspice_examples - FEGIN
Using 6 layers, 64 hidden units, h = 2
Loading component_net representation dataset
ENTERED
Training FEGIN on component_net representation
Train: 3558, Test: 846
##################ITERATION #0 ****************************************
 epoch: 0, train_loss: 1.3994, test_loss: 1.3987, test_f1: 0.0793
 epoch: 1, train_loss: 1.3881, test_loss: 1.3939, test_f1: 0.0793
 epoch: 2, train_loss: 1.3800, test_loss: 1.3857, test_f1: 0.0793
 epoch: 3, train_loss: 1.3715, test_loss: 1.3747, test_f1: 0.0793
 epoch: 4, train_loss: 1.3606, test_loss: 1.3573, test_f1: 0.1651
 epoch: 5, train_loss: 1.3490, test_loss: 1.3404, test_f1: 0.2122
 epoch: 6, train_loss: 1.3362, test_loss: 1.3235, test_f1: 0.2276
 epoch: 7, train_loss: 1.3220, test_loss: 1.3069, test_f1: 0.2589
 epoch: 8, train_loss: 1.3077, test_loss: 1.2900, test_f1: 0.3187
 epoch: 9, train_loss: 1.2934, test_loss: 1.2751, test_f1: 0.3326
 epoch: 10, train_loss: 1.2785, test_loss: 1.2617, test_f1: 0.3346
 epoch: 11, train_loss: 1.2651, test_loss: 1.2469, test_f1: 0.3188
 epoch: 12, train_loss: 1.2522, test_loss: 1.2324, test_f1: 0.3182
 epoch: 13, train_loss: 1.2415, test_loss: 1.2197, test_f1: 0.2908
 epoch: 14, train_loss: 1.2289, test_loss: 1.2073, test_f1: 0.2885
 epoch: 15, train_loss: 1.2188, test_loss: 1.1965, test_f1: 0.2911
 epoch: 16, train_loss: 1.2117, test_loss: 1.1842, test_f1: 0.2959
 epoch: 17, train_loss: 1.2015, test_loss: 1.1770, test_f1: 0.3041
 epoch: 18, train_loss: 1.1905, test_loss: 1.1623, test_f1: 0.3093
 epoch: 19, train_loss: 1.1789, test_loss: 1.1541, test_f1: 0.3202
 epoch: 20, train_loss: 1.1669, test_loss: 1.1417, test_f1: 0.3242
 epoch: 21, train_loss: 1.1597, test_loss: 1.1304, test_f1: 0.3397
 epoch: 22, train_loss: 1.1510, test_loss: 1.1231, test_f1: 0.3666
 epoch: 23, train_loss: 1.1374, test_loss: 1.1128, test_f1: 0.3892
 epoch: 24, train_loss: 1.1259, test_loss: 1.1022, test_f1: 0.4399
 epoch: 25, train_loss: 1.1156, test_loss: 1.0890, test_f1: 0.4417
 epoch: 26, train_loss: 1.1060, test_loss: 1.0780, test_f1: 0.4990
 epoch: 27, train_loss: 1.0981, test_loss: 1.0669, test_f1: 0.4616
 epoch: 28, train_loss: 1.0821, test_loss: 1.0610, test_f1: 0.5179
 epoch: 29, train_loss: 1.0723, test_loss: 1.0544, test_f1: 0.5200
 epoch: 30, train_loss: 1.0650, test_loss: 1.0439, test_f1: 0.5293
 epoch: 31, train_loss: 1.0527, test_loss: 1.0339, test_f1: 0.5219
 epoch: 32, train_loss: 1.0478, test_loss: 1.0219, test_f1: 0.5405
 epoch: 33, train_loss: 1.0331, test_loss: 1.0102, test_f1: 0.5341
 epoch: 34, train_loss: 1.0242, test_loss: 1.0015, test_f1: 0.5265
 epoch: 35, train_loss: 1.0124, test_loss: 0.9953, test_f1: 0.5334
 epoch: 36, train_loss: 1.0027, test_loss: 0.9861, test_f1: 0.5376
 epoch: 37, train_loss: 0.9947, test_loss: 0.9710, test_f1: 0.5439
 epoch: 38, train_loss: 0.9821, test_loss: 0.9675, test_f1: 0.5279
 epoch: 39, train_loss: 0.9732, test_loss: 0.9681, test_f1: 0.5428
 epoch: 40, train_loss: 0.9646, test_loss: 0.9539, test_f1: 0.5408
 epoch: 41, train_loss: 0.9579, test_loss: 0.9389, test_f1: 0.5559
 epoch: 42, train_loss: 0.9391, test_loss: 0.9493, test_f1: 0.5362
 epoch: 43, train_loss: 0.9267, test_loss: 0.9320, test_f1: 0.5507
 epoch: 44, train_loss: 0.9215, test_loss: 0.9278, test_f1: 0.5462
 epoch: 45, train_loss: 0.9134, test_loss: 0.9356, test_f1: 0.5437
 epoch: 46, train_loss: 0.9014, test_loss: 0.9101, test_f1: 0.5508
 epoch: 47, train_loss: 0.8918, test_loss: 0.9187, test_f1: 0.5443
 epoch: 48, train_loss: 0.8858, test_loss: 0.9003, test_f1: 0.5620
 epoch: 49, train_loss: 0.8801, test_loss: 0.9271, test_f1: 0.5401
 epoch: 50, train_loss: 0.8752, test_loss: 0.8950, test_f1: 0.5515
 epoch: 51, train_loss: 0.8637, test_loss: 0.9046, test_f1: 0.5518
 epoch: 52, train_loss: 0.8626, test_loss: 0.8998, test_f1: 0.5548
 epoch: 53, train_loss: 0.8557, test_loss: 0.8952, test_f1: 0.5581
 epoch: 54, train_loss: 0.8449, test_loss: 0.9004, test_f1: 0.5555
 epoch: 55, train_loss: 0.8580, test_loss: 0.8958, test_f1: 0.5499
 epoch: 56, train_loss: 0.8402, test_loss: 0.8947, test_f1: 0.5532
 epoch: 57, train_loss: 0.8420, test_loss: 0.9009, test_f1: 0.5498
 epoch: 58, train_loss: 0.8434, test_loss: 0.9053, test_f1: 0.5383
 epoch: 59, train_loss: 0.8385, test_loss: 0.8911, test_f1: 0.5556
 epoch: 60, train_loss: 0.8386, test_loss: 0.8983, test_f1: 0.5415
 epoch: 61, train_loss: 0.8202, test_loss: 0.8915, test_f1: 0.5487
 epoch: 62, train_loss: 0.8316, test_loss: 0.8909, test_f1: 0.5561
 epoch: 63, train_loss: 0.8208, test_loss: 0.8919, test_f1: 0.5588
 epoch: 64, train_loss: 0.8215, test_loss: 0.8948, test_f1: 0.5557
 epoch: 65, train_loss: 0.8207, test_loss: 0.8996, test_f1: 0.5401
 epoch: 66, train_loss: 0.8128, test_loss: 0.8938, test_f1: 0.5474
 epoch: 67, train_loss: 0.8027, test_loss: 0.8948, test_f1: 0.5496
 epoch: 68, train_loss: 0.8089, test_loss: 0.8980, test_f1: 0.5531
 epoch: 69, train_loss: 0.8070, test_loss: 0.8917, test_f1: 0.5493
 epoch: 70, train_loss: 0.8057, test_loss: 0.8991, test_f1: 0.5575
 epoch: 71, train_loss: 0.7946, test_loss: 0.9132, test_f1: 0.5486
 epoch: 72, train_loss: 0.8052, test_loss: 0.8846, test_f1: 0.5601
 epoch: 73, train_loss: 0.7955, test_loss: 0.9012, test_f1: 0.5475
 epoch: 74, train_loss: 0.8021, test_loss: 0.8920, test_f1: 0.5554
 epoch: 75, train_loss: 0.7992, test_loss: 0.8940, test_f1: 0.5585
 epoch: 76, train_loss: 0.7888, test_loss: 0.8999, test_f1: 0.5577
 epoch: 77, train_loss: 0.8096, test_loss: 0.9029, test_f1: 0.5561
 epoch: 78, train_loss: 0.7952, test_loss: 0.9123, test_f1: 0.5454
 epoch: 79, train_loss: 0.7966, test_loss: 0.8946, test_f1: 0.5473
 epoch: 80, train_loss: 0.7813, test_loss: 0.9061, test_f1: 0.5550
 epoch: 81, train_loss: 0.7852, test_loss: 0.9064, test_f1: 0.5576
 epoch: 82, train_loss: 0.7799, test_loss: 0.8920, test_f1: 0.5561
 epoch: 83, train_loss: 0.7877, test_loss: 0.8906, test_f1: 0.5576
 epoch: 84, train_loss: 0.7790, test_loss: 0.8883, test_f1: 0.5669
 epoch: 85, train_loss: 0.7871, test_loss: 0.9005, test_f1: 0.5561
 epoch: 86, train_loss: 0.7855, test_loss: 0.9004, test_f1: 0.5481
 epoch: 87, train_loss: 0.7659, test_loss: 0.8926, test_f1: 0.5599
 epoch: 88, train_loss: 0.7728, test_loss: 0.8983, test_f1: 0.5587
 epoch: 89, train_loss: 0.7668, test_loss: 0.9044, test_f1: 0.5544
 epoch: 90, train_loss: 0.7782, test_loss: 0.9053, test_f1: 0.5501
 epoch: 91, train_loss: 0.7671, test_loss: 0.9010, test_f1: 0.5517
 epoch: 92, train_loss: 0.7639, test_loss: 0.8909, test_f1: 0.5584
 epoch: 93, train_loss: 0.7623, test_loss: 0.9065, test_f1: 0.5290
 epoch: 94, train_loss: 0.7620, test_loss: 0.9114, test_f1: 0.5443
 epoch: 95, train_loss: 0.7657, test_loss: 0.8960, test_f1: 0.5528
 epoch: 96, train_loss: 0.7593, test_loss: 0.8962, test_f1: 0.5424
 epoch: 97, train_loss: 0.7562, test_loss: 0.9153, test_f1: 0.5444
 epoch: 98, train_loss: 0.7615, test_loss: 0.9129, test_f1: 0.5497
 epoch: 99, train_loss: 0.7566, test_loss: 0.9093, test_f1: 0.5513
##################ITERATION #1 ****************************************
 epoch: 0, train_loss: 1.3568, test_loss: 1.3846, test_f1: 0.1004
 epoch: 1, train_loss: 1.3236, test_loss: 1.3680, test_f1: 0.2300
 epoch: 2, train_loss: 1.3058, test_loss: 1.3344, test_f1: 0.2417
 epoch: 3, train_loss: 1.2872, test_loss: 1.3108, test_f1: 0.2461
 epoch: 4, train_loss: 1.2649, test_loss: 1.2758, test_f1: 0.2519
 epoch: 5, train_loss: 1.2471, test_loss: 1.2400, test_f1: 0.3215
 epoch: 6, train_loss: 1.2269, test_loss: 1.2099, test_f1: 0.3617
 epoch: 7, train_loss: 1.2133, test_loss: 1.1845, test_f1: 0.3781
 epoch: 8, train_loss: 1.1954, test_loss: 1.1613, test_f1: 0.3865
 epoch: 9, train_loss: 1.1783, test_loss: 1.1431, test_f1: 0.4049
 epoch: 10, train_loss: 1.1616, test_loss: 1.1181, test_f1: 0.4180
 epoch: 11, train_loss: 1.1449, test_loss: 1.0982, test_f1: 0.4222
 epoch: 12, train_loss: 1.1312, test_loss: 1.0853, test_f1: 0.4311
 epoch: 13, train_loss: 1.1094, test_loss: 1.0659, test_f1: 0.4414
 epoch: 14, train_loss: 1.0959, test_loss: 1.0512, test_f1: 0.4653
 epoch: 15, train_loss: 1.0796, test_loss: 1.0346, test_f1: 0.4641
 epoch: 16, train_loss: 1.0696, test_loss: 1.0204, test_f1: 0.4822
 epoch: 17, train_loss: 1.0488, test_loss: 1.0068, test_f1: 0.4908
 epoch: 18, train_loss: 1.0378, test_loss: 0.9974, test_f1: 0.5008
 epoch: 19, train_loss: 1.0286, test_loss: 0.9807, test_f1: 0.4980
 epoch: 20, train_loss: 1.0078, test_loss: 0.9709, test_f1: 0.4983
 epoch: 21, train_loss: 0.9977, test_loss: 0.9652, test_f1: 0.4897
 epoch: 22, train_loss: 0.9858, test_loss: 0.9527, test_f1: 0.4967
 epoch: 23, train_loss: 0.9773, test_loss: 0.9466, test_f1: 0.4998
 epoch: 24, train_loss: 0.9597, test_loss: 0.9347, test_f1: 0.5010
 epoch: 25, train_loss: 0.9501, test_loss: 0.9332, test_f1: 0.5006
 epoch: 26, train_loss: 0.9395, test_loss: 0.9318, test_f1: 0.4993
 epoch: 27, train_loss: 0.9316, test_loss: 0.9196, test_f1: 0.5073
 epoch: 28, train_loss: 0.9195, test_loss: 0.9144, test_f1: 0.5045
 epoch: 29, train_loss: 0.9103, test_loss: 0.9257, test_f1: 0.5064
 epoch: 30, train_loss: 0.8993, test_loss: 0.9211, test_f1: 0.5098
 epoch: 31, train_loss: 0.8971, test_loss: 0.8973, test_f1: 0.5186
 epoch: 32, train_loss: 0.8855, test_loss: 0.8931, test_f1: 0.5115
 epoch: 33, train_loss: 0.8623, test_loss: 0.8962, test_f1: 0.5206
 epoch: 34, train_loss: 0.8762, test_loss: 0.8933, test_f1: 0.5260
 epoch: 35, train_loss: 0.8630, test_loss: 0.9087, test_f1: 0.5136
 epoch: 36, train_loss: 0.8551, test_loss: 0.9045, test_f1: 0.5073
 epoch: 37, train_loss: 0.8513, test_loss: 0.9057, test_f1: 0.5106
 epoch: 38, train_loss: 0.8485, test_loss: 0.8907, test_f1: 0.5230
 epoch: 39, train_loss: 0.8377, test_loss: 0.8977, test_f1: 0.5188
 epoch: 40, train_loss: 0.8416, test_loss: 0.8857, test_f1: 0.5272
 epoch: 41, train_loss: 0.8337, test_loss: 0.8883, test_f1: 0.5181
 epoch: 42, train_loss: 0.8200, test_loss: 0.9078, test_f1: 0.5230
 epoch: 43, train_loss: 0.8150, test_loss: 0.8846, test_f1: 0.5231
 epoch: 44, train_loss: 0.8118, test_loss: 0.8907, test_f1: 0.5250
 epoch: 45, train_loss: 0.8188, test_loss: 0.9050, test_f1: 0.5286
 epoch: 46, train_loss: 0.7992, test_loss: 0.9129, test_f1: 0.5182
 epoch: 47, train_loss: 0.8112, test_loss: 0.8992, test_f1: 0.5275
 epoch: 48, train_loss: 0.7920, test_loss: 0.8881, test_f1: 0.5251
 epoch: 49, train_loss: 0.7982, test_loss: 0.9095, test_f1: 0.5226
 epoch: 50, train_loss: 0.7905, test_loss: 0.9042, test_f1: 0.5331
 epoch: 51, train_loss: 0.7857, test_loss: 0.9004, test_f1: 0.5192
 epoch: 52, train_loss: 0.7757, test_loss: 0.8813, test_f1: 0.5362
 epoch: 53, train_loss: 0.7799, test_loss: 0.8914, test_f1: 0.5290
 epoch: 54, train_loss: 0.7707, test_loss: 0.8999, test_f1: 0.5322
 epoch: 55, train_loss: 0.7660, test_loss: 0.8953, test_f1: 0.5279
 epoch: 56, train_loss: 0.7683, test_loss: 0.9008, test_f1: 0.5339
 epoch: 57, train_loss: 0.7678, test_loss: 0.8914, test_f1: 0.5323
 epoch: 58, train_loss: 0.7687, test_loss: 0.8941, test_f1: 0.5355
 epoch: 59, train_loss: 0.7637, test_loss: 0.8969, test_f1: 0.5349
 epoch: 60, train_loss: 0.7622, test_loss: 0.8887, test_f1: 0.5305
 epoch: 61, train_loss: 0.7594, test_loss: 0.9093, test_f1: 0.5254
 epoch: 62, train_loss: 0.7612, test_loss: 0.9034, test_f1: 0.5287
 epoch: 63, train_loss: 0.7598, test_loss: 0.8977, test_f1: 0.5326
 epoch: 64, train_loss: 0.7606, test_loss: 0.9130, test_f1: 0.5287
 epoch: 65, train_loss: 0.7539, test_loss: 0.8981, test_f1: 0.5391
 epoch: 66, train_loss: 0.7464, test_loss: 0.9070, test_f1: 0.5270
 epoch: 67, train_loss: 0.7405, test_loss: 0.8954, test_f1: 0.5408
 epoch: 68, train_loss: 0.7531, test_loss: 0.9145, test_f1: 0.5402
 epoch: 69, train_loss: 0.7545, test_loss: 0.9071, test_f1: 0.5497
 epoch: 70, train_loss: 0.7394, test_loss: 0.8998, test_f1: 0.5457
 epoch: 71, train_loss: 0.7403, test_loss: 0.9187, test_f1: 0.5406
 epoch: 72, train_loss: 0.7372, test_loss: 0.9102, test_f1: 0.5537
 epoch: 73, train_loss: 0.7390, test_loss: 0.9182, test_f1: 0.5438
 epoch: 74, train_loss: 0.7381, test_loss: 0.9168, test_f1: 0.5451
 epoch: 75, train_loss: 0.7282, test_loss: 0.9095, test_f1: 0.5472
 epoch: 76, train_loss: 0.7356, test_loss: 0.9128, test_f1: 0.5518
 epoch: 77, train_loss: 0.7305, test_loss: 0.9203, test_f1: 0.5519
 epoch: 78, train_loss: 0.7252, test_loss: 0.9143, test_f1: 0.5475
 epoch: 79, train_loss: 0.7290, test_loss: 0.9318, test_f1: 0.5435
 epoch: 80, train_loss: 0.7264, test_loss: 0.9214, test_f1: 0.5489
 epoch: 81, train_loss: 0.7189, test_loss: 0.9276, test_f1: 0.5491
 epoch: 82, train_loss: 0.7285, test_loss: 0.9198, test_f1: 0.5513
 epoch: 83, train_loss: 0.7230, test_loss: 0.9243, test_f1: 0.5552
 epoch: 84, train_loss: 0.7272, test_loss: 0.9267, test_f1: 0.5442
 epoch: 85, train_loss: 0.7190, test_loss: 0.9144, test_f1: 0.5510
 epoch: 86, train_loss: 0.7147, test_loss: 0.9100, test_f1: 0.5612
 epoch: 87, train_loss: 0.7212, test_loss: 0.9147, test_f1: 0.5567
 epoch: 88, train_loss: 0.7231, test_loss: 0.9261, test_f1: 0.5563
 epoch: 89, train_loss: 0.7146, test_loss: 0.9312, test_f1: 0.5487
 epoch: 90, train_loss: 0.7228, test_loss: 0.9226, test_f1: 0.5528
 epoch: 91, train_loss: 0.7083, test_loss: 0.9280, test_f1: 0.5446
 epoch: 92, train_loss: 0.7074, test_loss: 0.9336, test_f1: 0.5533
 epoch: 93, train_loss: 0.6996, test_loss: 0.9284, test_f1: 0.5489
 epoch: 94, train_loss: 0.7058, test_loss: 0.9185, test_f1: 0.5589
 epoch: 95, train_loss: 0.7122, test_loss: 0.9371, test_f1: 0.5502
 epoch: 96, train_loss: 0.7119, test_loss: 0.9452, test_f1: 0.5506
 epoch: 97, train_loss: 0.7094, test_loss: 0.9378, test_f1: 0.5533
 epoch: 98, train_loss: 0.7002, test_loss: 0.9380, test_f1: 0.5649
 epoch: 99, train_loss: 0.6948, test_loss: 0.9400, test_f1: 0.5633
##################ITERATION #2 ****************************************
 epoch: 0, train_loss: 1.3063, test_loss: 1.3572, test_f1: 0.2270
 epoch: 1, train_loss: 1.2662, test_loss: 1.3236, test_f1: 0.2270
 epoch: 2, train_loss: 1.2450, test_loss: 1.2967, test_f1: 0.2270
 epoch: 3, train_loss: 1.2274, test_loss: 1.2741, test_f1: 0.2435
 epoch: 4, train_loss: 1.2090, test_loss: 1.2289, test_f1: 0.3328
 epoch: 5, train_loss: 1.1915, test_loss: 1.1919, test_f1: 0.3931
 epoch: 6, train_loss: 1.1746, test_loss: 1.1513, test_f1: 0.4160
 epoch: 7, train_loss: 1.1561, test_loss: 1.1257, test_f1: 0.4297
 epoch: 8, train_loss: 1.1394, test_loss: 1.1040, test_f1: 0.4418
 epoch: 9, train_loss: 1.1181, test_loss: 1.0832, test_f1: 0.4476
 epoch: 10, train_loss: 1.1014, test_loss: 1.0626, test_f1: 0.4526
 epoch: 11, train_loss: 1.0858, test_loss: 1.0453, test_f1: 0.4579
 epoch: 12, train_loss: 1.0720, test_loss: 1.0259, test_f1: 0.4610
 epoch: 13, train_loss: 1.0532, test_loss: 1.0177, test_f1: 0.4543
 epoch: 14, train_loss: 1.0446, test_loss: 0.9979, test_f1: 0.4697
 epoch: 15, train_loss: 1.0255, test_loss: 0.9922, test_f1: 0.4680
 epoch: 16, train_loss: 1.0156, test_loss: 0.9812, test_f1: 0.4858
 epoch: 17, train_loss: 1.0049, test_loss: 0.9740, test_f1: 0.4932
 epoch: 18, train_loss: 0.9923, test_loss: 0.9605, test_f1: 0.4952
 epoch: 19, train_loss: 0.9829, test_loss: 0.9581, test_f1: 0.4854
 epoch: 20, train_loss: 0.9766, test_loss: 0.9521, test_f1: 0.4871
 epoch: 21, train_loss: 0.9603, test_loss: 0.9319, test_f1: 0.5001
 epoch: 22, train_loss: 0.9538, test_loss: 0.9404, test_f1: 0.4899
 epoch: 23, train_loss: 0.9559, test_loss: 0.9310, test_f1: 0.4891
 epoch: 24, train_loss: 0.9376, test_loss: 0.9210, test_f1: 0.5047
 epoch: 25, train_loss: 0.9305, test_loss: 0.9299, test_f1: 0.4999
 epoch: 26, train_loss: 0.9243, test_loss: 0.9250, test_f1: 0.4942
 epoch: 27, train_loss: 0.9143, test_loss: 0.9230, test_f1: 0.4960
 epoch: 28, train_loss: 0.9108, test_loss: 0.9328, test_f1: 0.4960
 epoch: 29, train_loss: 0.9083, test_loss: 0.9207, test_f1: 0.4995
 epoch: 30, train_loss: 0.9050, test_loss: 0.9208, test_f1: 0.5101
 epoch: 31, train_loss: 0.8974, test_loss: 0.9256, test_f1: 0.5106
 epoch: 32, train_loss: 0.8808, test_loss: 0.9240, test_f1: 0.5074
 epoch: 33, train_loss: 0.8771, test_loss: 0.9162, test_f1: 0.5084
 epoch: 34, train_loss: 0.8715, test_loss: 0.9211, test_f1: 0.5204
 epoch: 35, train_loss: 0.8701, test_loss: 0.9207, test_f1: 0.5116
 epoch: 36, train_loss: 0.8721, test_loss: 0.9127, test_f1: 0.5069
 epoch: 37, train_loss: 0.8599, test_loss: 0.9240, test_f1: 0.5199
 epoch: 38, train_loss: 0.8607, test_loss: 0.9112, test_f1: 0.5203
 epoch: 39, train_loss: 0.8616, test_loss: 0.9256, test_f1: 0.5144
 epoch: 40, train_loss: 0.8538, test_loss: 0.9257, test_f1: 0.5135
 epoch: 41, train_loss: 0.8481, test_loss: 0.9331, test_f1: 0.5222
 epoch: 42, train_loss: 0.8567, test_loss: 0.9285, test_f1: 0.5083
 epoch: 43, train_loss: 0.8329, test_loss: 0.9105, test_f1: 0.5202
 epoch: 44, train_loss: 0.8313, test_loss: 0.9156, test_f1: 0.5109
 epoch: 45, train_loss: 0.8338, test_loss: 0.9254, test_f1: 0.5145
 epoch: 46, train_loss: 0.8287, test_loss: 0.9205, test_f1: 0.5113
 epoch: 47, train_loss: 0.8204, test_loss: 0.9290, test_f1: 0.5183
 epoch: 48, train_loss: 0.8144, test_loss: 0.9310, test_f1: 0.5185
 epoch: 49, train_loss: 0.8147, test_loss: 0.9341, test_f1: 0.5276
 epoch: 50, train_loss: 0.8080, test_loss: 0.9417, test_f1: 0.5175
 epoch: 51, train_loss: 0.8048, test_loss: 0.9338, test_f1: 0.5087
 epoch: 52, train_loss: 0.7990, test_loss: 0.9234, test_f1: 0.5174
 epoch: 53, train_loss: 0.8055, test_loss: 0.9366, test_f1: 0.5224
 epoch: 54, train_loss: 0.8043, test_loss: 0.9297, test_f1: 0.5254
 epoch: 55, train_loss: 0.7972, test_loss: 0.9253, test_f1: 0.5209
 epoch: 56, train_loss: 0.7932, test_loss: 0.9393, test_f1: 0.5125
 epoch: 57, train_loss: 0.7899, test_loss: 0.9359, test_f1: 0.5236
 epoch: 58, train_loss: 0.7925, test_loss: 0.9274, test_f1: 0.5231
 epoch: 59, train_loss: 0.7870, test_loss: 0.9283, test_f1: 0.5303
 epoch: 60, train_loss: 0.7875, test_loss: 0.9334, test_f1: 0.5298
 epoch: 61, train_loss: 0.7924, test_loss: 0.9254, test_f1: 0.5232
 epoch: 62, train_loss: 0.7819, test_loss: 0.9243, test_f1: 0.5247
 epoch: 63, train_loss: 0.7851, test_loss: 0.9409, test_f1: 0.5225
 epoch: 64, train_loss: 0.7795, test_loss: 0.9388, test_f1: 0.5254
 epoch: 65, train_loss: 0.7818, test_loss: 0.9224, test_f1: 0.5324
 epoch: 66, train_loss: 0.7776, test_loss: 0.9317, test_f1: 0.5255
 epoch: 67, train_loss: 0.7763, test_loss: 0.9311, test_f1: 0.5319
 epoch: 68, train_loss: 0.7680, test_loss: 0.9315, test_f1: 0.5241
 epoch: 69, train_loss: 0.7739, test_loss: 0.9310, test_f1: 0.5318
 epoch: 70, train_loss: 0.7722, test_loss: 0.9327, test_f1: 0.5335
 epoch: 71, train_loss: 0.7695, test_loss: 0.9339, test_f1: 0.5224
 epoch: 72, train_loss: 0.7705, test_loss: 0.9305, test_f1: 0.5230
 epoch: 73, train_loss: 0.7659, test_loss: 0.9344, test_f1: 0.5205
 epoch: 74, train_loss: 0.7722, test_loss: 0.9395, test_f1: 0.5276
 epoch: 75, train_loss: 0.7577, test_loss: 0.9395, test_f1: 0.5312
 epoch: 76, train_loss: 0.7615, test_loss: 0.9280, test_f1: 0.5261
 epoch: 77, train_loss: 0.7587, test_loss: 0.9390, test_f1: 0.5302
 epoch: 78, train_loss: 0.7505, test_loss: 0.9466, test_f1: 0.5178
 epoch: 79, train_loss: 0.7588, test_loss: 0.9427, test_f1: 0.5136
 epoch: 80, train_loss: 0.7521, test_loss: 0.9421, test_f1: 0.5213
 epoch: 81, train_loss: 0.7526, test_loss: 0.9406, test_f1: 0.5329
 epoch: 82, train_loss: 0.7507, test_loss: 0.9442, test_f1: 0.5349
 epoch: 83, train_loss: 0.7511, test_loss: 0.9314, test_f1: 0.5289
 epoch: 84, train_loss: 0.7540, test_loss: 0.9466, test_f1: 0.5247
 epoch: 85, train_loss: 0.7493, test_loss: 0.9538, test_f1: 0.5092
 epoch: 86, train_loss: 0.7449, test_loss: 0.9415, test_f1: 0.5323
 epoch: 87, train_loss: 0.7405, test_loss: 0.9404, test_f1: 0.5264
 epoch: 88, train_loss: 0.7371, test_loss: 0.9382, test_f1: 0.5312
 epoch: 89, train_loss: 0.7453, test_loss: 0.9426, test_f1: 0.5243
 epoch: 90, train_loss: 0.7471, test_loss: 0.9449, test_f1: 0.5208
 epoch: 91, train_loss: 0.7328, test_loss: 0.9496, test_f1: 0.5342
 epoch: 92, train_loss: 0.7375, test_loss: 0.9487, test_f1: 0.5354
 epoch: 93, train_loss: 0.7351, test_loss: 0.9474, test_f1: 0.5356
 epoch: 94, train_loss: 0.7339, test_loss: 0.9436, test_f1: 0.5493
 epoch: 95, train_loss: 0.7419, test_loss: 0.9468, test_f1: 0.5314
 epoch: 96, train_loss: 0.7324, test_loss: 0.9569, test_f1: 0.5544
 epoch: 97, train_loss: 0.7338, test_loss: 0.9372, test_f1: 0.5320
 epoch: 98, train_loss: 0.7330, test_loss: 0.9357, test_f1: 0.5387
 epoch: 99, train_loss: 0.7358, test_loss: 0.9397, test_f1: 0.5377
##################ITERATION #3 ****************************************
 epoch: 0, train_loss: 1.3299, test_loss: 1.3917, test_f1: 0.0304
 epoch: 1, train_loss: 1.2807, test_loss: 1.3760, test_f1: 0.2425
 epoch: 2, train_loss: 1.2570, test_loss: 1.3223, test_f1: 0.3226
 epoch: 3, train_loss: 1.2318, test_loss: 1.2635, test_f1: 0.3140
 epoch: 4, train_loss: 1.2171, test_loss: 1.2169, test_f1: 0.3594
 epoch: 5, train_loss: 1.1962, test_loss: 1.1767, test_f1: 0.3907
 epoch: 6, train_loss: 1.1777, test_loss: 1.1428, test_f1: 0.4105
 epoch: 7, train_loss: 1.1548, test_loss: 1.1140, test_f1: 0.4338
 epoch: 8, train_loss: 1.1441, test_loss: 1.0954, test_f1: 0.4527
 epoch: 9, train_loss: 1.1272, test_loss: 1.0803, test_f1: 0.4620
 epoch: 10, train_loss: 1.1103, test_loss: 1.0630, test_f1: 0.4652
 epoch: 11, train_loss: 1.0916, test_loss: 1.0482, test_f1: 0.4728
 epoch: 12, train_loss: 1.0766, test_loss: 1.0301, test_f1: 0.4780
 epoch: 13, train_loss: 1.0592, test_loss: 1.0183, test_f1: 0.4721
 epoch: 14, train_loss: 1.0494, test_loss: 1.0052, test_f1: 0.4769
 epoch: 15, train_loss: 1.0346, test_loss: 0.9953, test_f1: 0.4771
 epoch: 16, train_loss: 1.0205, test_loss: 0.9836, test_f1: 0.4882
 epoch: 17, train_loss: 1.0148, test_loss: 0.9775, test_f1: 0.4878
 epoch: 18, train_loss: 1.0135, test_loss: 0.9818, test_f1: 0.4946
 epoch: 19, train_loss: 0.9957, test_loss: 0.9660, test_f1: 0.4947
 epoch: 20, train_loss: 0.9796, test_loss: 0.9586, test_f1: 0.4982
 epoch: 21, train_loss: 0.9863, test_loss: 0.9613, test_f1: 0.5028
 epoch: 22, train_loss: 0.9724, test_loss: 0.9544, test_f1: 0.5071
 epoch: 23, train_loss: 0.9678, test_loss: 0.9477, test_f1: 0.4966
 epoch: 24, train_loss: 0.9561, test_loss: 0.9472, test_f1: 0.5025
 epoch: 25, train_loss: 0.9500, test_loss: 0.9521, test_f1: 0.5021
 epoch: 26, train_loss: 0.9390, test_loss: 0.9469, test_f1: 0.5148
 epoch: 27, train_loss: 0.9303, test_loss: 0.9533, test_f1: 0.5076
 epoch: 28, train_loss: 0.9210, test_loss: 0.9264, test_f1: 0.5218
 epoch: 29, train_loss: 0.9164, test_loss: 0.9547, test_f1: 0.5034
 epoch: 30, train_loss: 0.9097, test_loss: 0.9248, test_f1: 0.5200
 epoch: 31, train_loss: 0.9061, test_loss: 0.9288, test_f1: 0.5262
 epoch: 32, train_loss: 0.9009, test_loss: 0.9250, test_f1: 0.5226
 epoch: 33, train_loss: 0.8927, test_loss: 0.9308, test_f1: 0.5134
 epoch: 34, train_loss: 0.8938, test_loss: 0.9415, test_f1: 0.5045
 epoch: 35, train_loss: 0.8948, test_loss: 0.9380, test_f1: 0.5018
 epoch: 36, train_loss: 0.8825, test_loss: 0.9387, test_f1: 0.5080
 epoch: 37, train_loss: 0.8731, test_loss: 0.9441, test_f1: 0.5046
 epoch: 38, train_loss: 0.8846, test_loss: 0.9191, test_f1: 0.5268
 epoch: 39, train_loss: 0.8651, test_loss: 0.9357, test_f1: 0.5107
 epoch: 40, train_loss: 0.8693, test_loss: 0.9178, test_f1: 0.5107
 epoch: 41, train_loss: 0.8527, test_loss: 0.9216, test_f1: 0.5129
 epoch: 42, train_loss: 0.8508, test_loss: 0.9270, test_f1: 0.5165
 epoch: 43, train_loss: 0.8533, test_loss: 0.9322, test_f1: 0.5129
 epoch: 44, train_loss: 0.8362, test_loss: 0.9241, test_f1: 0.4988
 epoch: 45, train_loss: 0.8400, test_loss: 0.9371, test_f1: 0.5156
 epoch: 46, train_loss: 0.8329, test_loss: 0.9445, test_f1: 0.4947
 epoch: 47, train_loss: 0.8335, test_loss: 0.9426, test_f1: 0.4998
 epoch: 48, train_loss: 0.8334, test_loss: 0.9381, test_f1: 0.5032
 epoch: 49, train_loss: 0.8313, test_loss: 0.9627, test_f1: 0.4948
 epoch: 50, train_loss: 0.8176, test_loss: 0.9536, test_f1: 0.4945
 epoch: 51, train_loss: 0.8241, test_loss: 0.9522, test_f1: 0.4976
 epoch: 52, train_loss: 0.8152, test_loss: 0.9490, test_f1: 0.5051
 epoch: 53, train_loss: 0.8043, test_loss: 0.9430, test_f1: 0.5048
 epoch: 54, train_loss: 0.8202, test_loss: 0.9392, test_f1: 0.5030
 epoch: 55, train_loss: 0.8037, test_loss: 0.9539, test_f1: 0.5024
 epoch: 56, train_loss: 0.8122, test_loss: 0.9494, test_f1: 0.5065
 epoch: 57, train_loss: 0.8073, test_loss: 0.9596, test_f1: 0.5041
 epoch: 58, train_loss: 0.8048, test_loss: 0.9565, test_f1: 0.5030
 epoch: 59, train_loss: 0.8082, test_loss: 0.9633, test_f1: 0.4999
 epoch: 60, train_loss: 0.8086, test_loss: 0.9638, test_f1: 0.5012
 epoch: 61, train_loss: 0.7987, test_loss: 0.9638, test_f1: 0.5022
 epoch: 62, train_loss: 0.7964, test_loss: 0.9625, test_f1: 0.4999
 epoch: 63, train_loss: 0.7903, test_loss: 0.9584, test_f1: 0.5045
 epoch: 64, train_loss: 0.8004, test_loss: 0.9631, test_f1: 0.5051
 epoch: 65, train_loss: 0.7824, test_loss: 0.9685, test_f1: 0.5133
 epoch: 66, train_loss: 0.7876, test_loss: 0.9745, test_f1: 0.5075
 epoch: 67, train_loss: 0.7894, test_loss: 0.9790, test_f1: 0.5101
 epoch: 68, train_loss: 0.7944, test_loss: 0.9706, test_f1: 0.5125
 epoch: 69, train_loss: 0.7848, test_loss: 0.9724, test_f1: 0.5082
 epoch: 70, train_loss: 0.7784, test_loss: 0.9679, test_f1: 0.5104
 epoch: 71, train_loss: 0.7877, test_loss: 0.9779, test_f1: 0.5035
 epoch: 72, train_loss: 0.7733, test_loss: 0.9694, test_f1: 0.5007
 epoch: 73, train_loss: 0.7842, test_loss: 0.9853, test_f1: 0.5061
 epoch: 74, train_loss: 0.7827, test_loss: 0.9839, test_f1: 0.5077
 epoch: 75, train_loss: 0.7760, test_loss: 0.9747, test_f1: 0.5120
 epoch: 76, train_loss: 0.7772, test_loss: 0.9853, test_f1: 0.5214
 epoch: 77, train_loss: 0.7703, test_loss: 0.9647, test_f1: 0.5125
 epoch: 78, train_loss: 0.7659, test_loss: 0.9687, test_f1: 0.5235
 epoch: 79, train_loss: 0.7743, test_loss: 0.9921, test_f1: 0.5057
 epoch: 80, train_loss: 0.7713, test_loss: 0.9851, test_f1: 0.5098
 epoch: 81, train_loss: 0.7750, test_loss: 0.9848, test_f1: 0.5110
 epoch: 82, train_loss: 0.7636, test_loss: 0.9752, test_f1: 0.5139
 epoch: 83, train_loss: 0.7684, test_loss: 0.9765, test_f1: 0.5285
 epoch: 84, train_loss: 0.7555, test_loss: 0.9814, test_f1: 0.5151
 epoch: 85, train_loss: 0.7579, test_loss: 0.9853, test_f1: 0.5240
 epoch: 86, train_loss: 0.7625, test_loss: 0.9929, test_f1: 0.5147
 epoch: 87, train_loss: 0.7630, test_loss: 0.9926, test_f1: 0.5078
 epoch: 88, train_loss: 0.7665, test_loss: 0.9993, test_f1: 0.5195
 epoch: 89, train_loss: 0.7581, test_loss: 0.9823, test_f1: 0.5171
 epoch: 90, train_loss: 0.7616, test_loss: 0.9888, test_f1: 0.5161
 epoch: 91, train_loss: 0.7532, test_loss: 0.9908, test_f1: 0.5304
 epoch: 92, train_loss: 0.7529, test_loss: 0.9970, test_f1: 0.5251
 epoch: 93, train_loss: 0.7516, test_loss: 0.9947, test_f1: 0.5358
 epoch: 94, train_loss: 0.7498, test_loss: 0.9986, test_f1: 0.5297
 epoch: 95, train_loss: 0.7529, test_loss: 0.9883, test_f1: 0.5272
 epoch: 96, train_loss: 0.7548, test_loss: 0.9865, test_f1: 0.5236
 epoch: 97, train_loss: 0.7575, test_loss: 0.9995, test_f1: 0.5423
 epoch: 98, train_loss: 0.7467, test_loss: 0.9939, test_f1: 0.5312
 epoch: 99, train_loss: 0.7453, test_loss: 0.9918, test_f1: 0.5229
##################ITERATION #4 ****************************************
 epoch: 0, train_loss: 1.2961, test_loss: 1.3888, test_f1: 0.0780
 epoch: 1, train_loss: 1.2319, test_loss: 1.3689, test_f1: 0.2472
 epoch: 2, train_loss: 1.2068, test_loss: 1.3281, test_f1: 0.3414
 epoch: 3, train_loss: 1.1800, test_loss: 1.2449, test_f1: 0.4009
 epoch: 4, train_loss: 1.1653, test_loss: 1.1727, test_f1: 0.4235
 epoch: 5, train_loss: 1.1395, test_loss: 1.1250, test_f1: 0.4371
 epoch: 6, train_loss: 1.1178, test_loss: 1.0948, test_f1: 0.4444
 epoch: 7, train_loss: 1.1053, test_loss: 1.0631, test_f1: 0.4508
 epoch: 8, train_loss: 1.0904, test_loss: 1.0410, test_f1: 0.4659
 epoch: 9, train_loss: 1.0801, test_loss: 1.0196, test_f1: 0.4707
 epoch: 10, train_loss: 1.0612, test_loss: 1.0087, test_f1: 0.4662
 epoch: 11, train_loss: 1.0519, test_loss: 1.0132, test_f1: 0.4711
 epoch: 12, train_loss: 1.0421, test_loss: 0.9968, test_f1: 0.4735
 epoch: 13, train_loss: 1.0295, test_loss: 0.9769, test_f1: 0.4766
 epoch: 14, train_loss: 1.0181, test_loss: 0.9837, test_f1: 0.4734
 epoch: 15, train_loss: 1.0067, test_loss: 0.9762, test_f1: 0.4719
 epoch: 16, train_loss: 0.9903, test_loss: 0.9615, test_f1: 0.4853
 epoch: 17, train_loss: 0.9855, test_loss: 0.9565, test_f1: 0.4896
 epoch: 18, train_loss: 0.9851, test_loss: 0.9656, test_f1: 0.4751
 epoch: 19, train_loss: 0.9707, test_loss: 0.9403, test_f1: 0.4897
 epoch: 20, train_loss: 0.9683, test_loss: 0.9484, test_f1: 0.4808
 epoch: 21, train_loss: 0.9630, test_loss: 0.9512, test_f1: 0.4831
 epoch: 22, train_loss: 0.9461, test_loss: 0.9467, test_f1: 0.4643
 epoch: 23, train_loss: 0.9448, test_loss: 0.9317, test_f1: 0.4976
 epoch: 24, train_loss: 0.9263, test_loss: 0.9335, test_f1: 0.5249
 epoch: 25, train_loss: 0.9301, test_loss: 0.9293, test_f1: 0.5135
 epoch: 26, train_loss: 0.9290, test_loss: 0.9439, test_f1: 0.5212
 epoch: 27, train_loss: 0.9241, test_loss: 0.9387, test_f1: 0.5083
 epoch: 28, train_loss: 0.9149, test_loss: 0.9167, test_f1: 0.5316
 epoch: 29, train_loss: 0.9150, test_loss: 0.9346, test_f1: 0.5189
 epoch: 30, train_loss: 0.9060, test_loss: 0.9193, test_f1: 0.5189
 epoch: 31, train_loss: 0.8882, test_loss: 0.9262, test_f1: 0.5216
 epoch: 32, train_loss: 0.9002, test_loss: 0.9316, test_f1: 0.5410
 epoch: 33, train_loss: 0.8842, test_loss: 0.9267, test_f1: 0.5342
 epoch: 34, train_loss: 0.8812, test_loss: 0.9271, test_f1: 0.5382
 epoch: 35, train_loss: 0.8742, test_loss: 0.9264, test_f1: 0.5255
 epoch: 36, train_loss: 0.8656, test_loss: 0.9096, test_f1: 0.5477
 epoch: 37, train_loss: 0.8648, test_loss: 0.9222, test_f1: 0.5371
 epoch: 38, train_loss: 0.8643, test_loss: 0.9262, test_f1: 0.5257
 epoch: 39, train_loss: 0.8543, test_loss: 0.9191, test_f1: 0.5409
 epoch: 40, train_loss: 0.8565, test_loss: 0.9261, test_f1: 0.5329
 epoch: 41, train_loss: 0.8554, test_loss: 0.9140, test_f1: 0.5347
 epoch: 42, train_loss: 0.8456, test_loss: 0.9156, test_f1: 0.5541
 epoch: 43, train_loss: 0.8392, test_loss: 0.9221, test_f1: 0.5491
 epoch: 44, train_loss: 0.8378, test_loss: 0.9262, test_f1: 0.5376
 epoch: 45, train_loss: 0.8419, test_loss: 0.9161, test_f1: 0.5346
 epoch: 46, train_loss: 0.8359, test_loss: 0.9303, test_f1: 0.5441
 epoch: 47, train_loss: 0.8372, test_loss: 0.9305, test_f1: 0.5353
 epoch: 48, train_loss: 0.8220, test_loss: 0.9288, test_f1: 0.5438
 epoch: 49, train_loss: 0.8234, test_loss: 0.9170, test_f1: 0.5276
 epoch: 50, train_loss: 0.8160, test_loss: 0.9225, test_f1: 0.5344
 epoch: 51, train_loss: 0.8204, test_loss: 0.9355, test_f1: 0.5426
 epoch: 52, train_loss: 0.8081, test_loss: 0.9296, test_f1: 0.5524
 epoch: 53, train_loss: 0.8138, test_loss: 0.9301, test_f1: 0.5386
 epoch: 54, train_loss: 0.7981, test_loss: 0.9274, test_f1: 0.5442
 epoch: 55, train_loss: 0.8001, test_loss: 0.9191, test_f1: 0.5583
 epoch: 56, train_loss: 0.8024, test_loss: 0.9243, test_f1: 0.5500
 epoch: 57, train_loss: 0.8008, test_loss: 0.9261, test_f1: 0.5371
 epoch: 58, train_loss: 0.8036, test_loss: 0.9284, test_f1: 0.5458
 epoch: 59, train_loss: 0.8015, test_loss: 0.9223, test_f1: 0.5459
 epoch: 60, train_loss: 0.7944, test_loss: 0.9240, test_f1: 0.5345
 epoch: 61, train_loss: 0.7867, test_loss: 0.9248, test_f1: 0.5363
 epoch: 62, train_loss: 0.7915, test_loss: 0.9333, test_f1: 0.5280
 epoch: 63, train_loss: 0.7888, test_loss: 0.9345, test_f1: 0.5474
 epoch: 64, train_loss: 0.7927, test_loss: 0.9292, test_f1: 0.5406
 epoch: 65, train_loss: 0.7832, test_loss: 0.9308, test_f1: 0.5480
 epoch: 66, train_loss: 0.7808, test_loss: 0.9382, test_f1: 0.5254
 epoch: 67, train_loss: 0.7857, test_loss: 0.9316, test_f1: 0.5432
 epoch: 68, train_loss: 0.7722, test_loss: 0.9344, test_f1: 0.5439
 epoch: 69, train_loss: 0.7865, test_loss: 0.9298, test_f1: 0.5333
 epoch: 70, train_loss: 0.7817, test_loss: 0.9337, test_f1: 0.5425
 epoch: 71, train_loss: 0.7717, test_loss: 0.9358, test_f1: 0.5441
 epoch: 72, train_loss: 0.7736, test_loss: 0.9334, test_f1: 0.5388
 epoch: 73, train_loss: 0.7771, test_loss: 0.9373, test_f1: 0.5418
 epoch: 74, train_loss: 0.7658, test_loss: 0.9382, test_f1: 0.5344
 epoch: 75, train_loss: 0.7633, test_loss: 0.9357, test_f1: 0.5438
 epoch: 76, train_loss: 0.7615, test_loss: 0.9366, test_f1: 0.5392
 epoch: 77, train_loss: 0.7553, test_loss: 0.9289, test_f1: 0.5376
 epoch: 78, train_loss: 0.7723, test_loss: 0.9324, test_f1: 0.5592
 epoch: 79, train_loss: 0.7654, test_loss: 0.9333, test_f1: 0.5529
 epoch: 80, train_loss: 0.7640, test_loss: 0.9289, test_f1: 0.5419
 epoch: 81, train_loss: 0.7641, test_loss: 0.9289, test_f1: 0.5509
 epoch: 82, train_loss: 0.7600, test_loss: 0.9401, test_f1: 0.5449
 epoch: 83, train_loss: 0.7577, test_loss: 0.9287, test_f1: 0.5480
 epoch: 84, train_loss: 0.7588, test_loss: 0.9294, test_f1: 0.5598
 epoch: 85, train_loss: 0.7576, test_loss: 0.9385, test_f1: 0.5502
 epoch: 86, train_loss: 0.7518, test_loss: 0.9366, test_f1: 0.5481
 epoch: 87, train_loss: 0.7461, test_loss: 0.9332, test_f1: 0.5538
 epoch: 88, train_loss: 0.7471, test_loss: 0.9346, test_f1: 0.5518
 epoch: 89, train_loss: 0.7483, test_loss: 0.9260, test_f1: 0.5487
 epoch: 90, train_loss: 0.7606, test_loss: 0.9362, test_f1: 0.5534
 epoch: 91, train_loss: 0.7420, test_loss: 0.9418, test_f1: 0.5438
 epoch: 92, train_loss: 0.7385, test_loss: 0.9386, test_f1: 0.5566
 epoch: 93, train_loss: 0.7535, test_loss: 0.9415, test_f1: 0.5375
 epoch: 94, train_loss: 0.7557, test_loss: 0.9407, test_f1: 0.5463
 epoch: 95, train_loss: 0.7518, test_loss: 0.9398, test_f1: 0.5455
 epoch: 96, train_loss: 0.7425, test_loss: 0.9546, test_f1: 0.5534
 epoch: 97, train_loss: 0.7495, test_loss: 0.9380, test_f1: 0.5439
 epoch: 98, train_loss: 0.7426, test_loss: 0.9448, test_f1: 0.5525
 epoch: 99, train_loss: 0.7474, test_loss: 0.9410, test_f1: 0.5630
##################ITERATION #5 ****************************************
 epoch: 0, train_loss: 1.2826, test_loss: 1.3388, test_f1: 0.2270
 epoch: 1, train_loss: 1.2064, test_loss: 1.3132, test_f1: 0.2295
 epoch: 2, train_loss: 1.1779, test_loss: 1.2477, test_f1: 0.2938
 epoch: 3, train_loss: 1.1560, test_loss: 1.1912, test_f1: 0.3672
 epoch: 4, train_loss: 1.1321, test_loss: 1.1405, test_f1: 0.4338
 epoch: 5, train_loss: 1.1143, test_loss: 1.0931, test_f1: 0.4537
 epoch: 6, train_loss: 1.0924, test_loss: 1.0527, test_f1: 0.4662
 epoch: 7, train_loss: 1.0835, test_loss: 1.0369, test_f1: 0.4965
 epoch: 8, train_loss: 1.0723, test_loss: 1.0225, test_f1: 0.5041
 epoch: 9, train_loss: 1.0540, test_loss: 1.0061, test_f1: 0.4973
 epoch: 10, train_loss: 1.0399, test_loss: 0.9991, test_f1: 0.5077
 epoch: 11, train_loss: 1.0292, test_loss: 0.9875, test_f1: 0.4953
 epoch: 12, train_loss: 1.0142, test_loss: 0.9761, test_f1: 0.5181
 epoch: 13, train_loss: 1.0100, test_loss: 0.9672, test_f1: 0.5084
 epoch: 14, train_loss: 1.0037, test_loss: 0.9628, test_f1: 0.5047
 epoch: 15, train_loss: 0.9864, test_loss: 0.9579, test_f1: 0.5268
 epoch: 16, train_loss: 0.9822, test_loss: 0.9483, test_f1: 0.5135
 epoch: 17, train_loss: 0.9672, test_loss: 0.9500, test_f1: 0.5204
 epoch: 18, train_loss: 0.9690, test_loss: 0.9463, test_f1: 0.5185
 epoch: 19, train_loss: 0.9434, test_loss: 0.9354, test_f1: 0.5291
 epoch: 20, train_loss: 0.9405, test_loss: 0.9355, test_f1: 0.5371
 epoch: 21, train_loss: 0.9346, test_loss: 0.9335, test_f1: 0.5383
 epoch: 22, train_loss: 0.9294, test_loss: 0.9289, test_f1: 0.5292
 epoch: 23, train_loss: 0.9265, test_loss: 0.9277, test_f1: 0.5454
 epoch: 24, train_loss: 0.9212, test_loss: 0.9300, test_f1: 0.5431
 epoch: 25, train_loss: 0.9127, test_loss: 0.9301, test_f1: 0.5378
 epoch: 26, train_loss: 0.9117, test_loss: 0.9212, test_f1: 0.5524
 epoch: 27, train_loss: 0.9055, test_loss: 0.9242, test_f1: 0.5389
 epoch: 28, train_loss: 0.9003, test_loss: 0.9243, test_f1: 0.5387
 epoch: 29, train_loss: 0.8881, test_loss: 0.9242, test_f1: 0.5396
 epoch: 30, train_loss: 0.8875, test_loss: 0.9167, test_f1: 0.5396
 epoch: 31, train_loss: 0.8857, test_loss: 0.9131, test_f1: 0.5396
 epoch: 32, train_loss: 0.8749, test_loss: 0.9184, test_f1: 0.5422
 epoch: 33, train_loss: 0.8652, test_loss: 0.9068, test_f1: 0.5458
 epoch: 34, train_loss: 0.8669, test_loss: 0.9109, test_f1: 0.5357
 epoch: 35, train_loss: 0.8699, test_loss: 0.9093, test_f1: 0.5437
 epoch: 36, train_loss: 0.8674, test_loss: 0.9238, test_f1: 0.5288
 epoch: 37, train_loss: 0.8543, test_loss: 0.9151, test_f1: 0.5381
 epoch: 38, train_loss: 0.8508, test_loss: 0.9105, test_f1: 0.5568
 epoch: 39, train_loss: 0.8521, test_loss: 0.8995, test_f1: 0.5500
 epoch: 40, train_loss: 0.8434, test_loss: 0.9020, test_f1: 0.5466
 epoch: 41, train_loss: 0.8376, test_loss: 0.9054, test_f1: 0.5485
 epoch: 42, train_loss: 0.8312, test_loss: 0.9015, test_f1: 0.5527
 epoch: 43, train_loss: 0.8300, test_loss: 0.9111, test_f1: 0.5312
 epoch: 44, train_loss: 0.8288, test_loss: 0.8987, test_f1: 0.5603
 epoch: 45, train_loss: 0.8202, test_loss: 0.8939, test_f1: 0.5656
 epoch: 46, train_loss: 0.8174, test_loss: 0.9082, test_f1: 0.5428
 epoch: 47, train_loss: 0.8072, test_loss: 0.9037, test_f1: 0.5557
 epoch: 48, train_loss: 0.8121, test_loss: 0.8978, test_f1: 0.5547
 epoch: 49, train_loss: 0.8081, test_loss: 0.9019, test_f1: 0.5580
 epoch: 50, train_loss: 0.7964, test_loss: 0.9141, test_f1: 0.5633
 epoch: 51, train_loss: 0.8073, test_loss: 0.9062, test_f1: 0.5691
 epoch: 52, train_loss: 0.7894, test_loss: 0.9111, test_f1: 0.5501
 epoch: 53, train_loss: 0.8021, test_loss: 0.9133, test_f1: 0.5574
 epoch: 54, train_loss: 0.7858, test_loss: 0.9093, test_f1: 0.5670
 epoch: 55, train_loss: 0.7928, test_loss: 0.9110, test_f1: 0.5716
 epoch: 56, train_loss: 0.7826, test_loss: 0.9066, test_f1: 0.5570
 epoch: 57, train_loss: 0.7941, test_loss: 0.9053, test_f1: 0.5625
 epoch: 58, train_loss: 0.7898, test_loss: 0.9083, test_f1: 0.5517
 epoch: 59, train_loss: 0.7771, test_loss: 0.9076, test_f1: 0.5650
 epoch: 60, train_loss: 0.7785, test_loss: 0.9050, test_f1: 0.5699
 epoch: 61, train_loss: 0.7765, test_loss: 0.9075, test_f1: 0.5651
 epoch: 62, train_loss: 0.7754, test_loss: 0.8996, test_f1: 0.5769
 epoch: 63, train_loss: 0.7855, test_loss: 0.9032, test_f1: 0.5775
 epoch: 64, train_loss: 0.7735, test_loss: 0.8985, test_f1: 0.5790
 epoch: 65, train_loss: 0.7726, test_loss: 0.9033, test_f1: 0.5693
 epoch: 66, train_loss: 0.7727, test_loss: 0.8956, test_f1: 0.5869
 epoch: 67, train_loss: 0.7732, test_loss: 0.9006, test_f1: 0.5829
 epoch: 68, train_loss: 0.7663, test_loss: 0.9058, test_f1: 0.5791
 epoch: 69, train_loss: 0.7701, test_loss: 0.9010, test_f1: 0.5801
 epoch: 70, train_loss: 0.7642, test_loss: 0.9014, test_f1: 0.5715
 epoch: 71, train_loss: 0.7639, test_loss: 0.9025, test_f1: 0.5725
 epoch: 72, train_loss: 0.7492, test_loss: 0.9023, test_f1: 0.5722
 epoch: 73, train_loss: 0.7614, test_loss: 0.9011, test_f1: 0.5831
 epoch: 74, train_loss: 0.7519, test_loss: 0.9048, test_f1: 0.5793
 epoch: 75, train_loss: 0.7569, test_loss: 0.8993, test_f1: 0.5846
 epoch: 76, train_loss: 0.7483, test_loss: 0.9039, test_f1: 0.5794
 epoch: 77, train_loss: 0.7586, test_loss: 0.9010, test_f1: 0.5870
 epoch: 78, train_loss: 0.7490, test_loss: 0.9051, test_f1: 0.5893
 epoch: 79, train_loss: 0.7486, test_loss: 0.9109, test_f1: 0.5715
 epoch: 80, train_loss: 0.7553, test_loss: 0.9095, test_f1: 0.5788
 epoch: 81, train_loss: 0.7565, test_loss: 0.9017, test_f1: 0.5715
 epoch: 82, train_loss: 0.7455, test_loss: 0.9038, test_f1: 0.5879
 epoch: 83, train_loss: 0.7431, test_loss: 0.9049, test_f1: 0.5885
 epoch: 84, train_loss: 0.7512, test_loss: 0.9181, test_f1: 0.5795
 epoch: 85, train_loss: 0.7362, test_loss: 0.9154, test_f1: 0.5721
 epoch: 86, train_loss: 0.7447, test_loss: 0.9043, test_f1: 0.5844
 epoch: 87, train_loss: 0.7358, test_loss: 0.9112, test_f1: 0.5834
 epoch: 88, train_loss: 0.7332, test_loss: 0.9138, test_f1: 0.5745
 epoch: 89, train_loss: 0.7247, test_loss: 0.9116, test_f1: 0.5701
 epoch: 90, train_loss: 0.7342, test_loss: 0.9128, test_f1: 0.5790
 epoch: 91, train_loss: 0.7319, test_loss: 0.9095, test_f1: 0.5792
 epoch: 92, train_loss: 0.7324, test_loss: 0.9152, test_f1: 0.5619
 epoch: 93, train_loss: 0.7391, test_loss: 0.8919, test_f1: 0.5997
 epoch: 94, train_loss: 0.7271, test_loss: 0.9004, test_f1: 0.5787
 epoch: 95, train_loss: 0.7254, test_loss: 0.9084, test_f1: 0.5773
 epoch: 96, train_loss: 0.7182, test_loss: 0.9076, test_f1: 0.5855
 epoch: 97, train_loss: 0.7240, test_loss: 0.9114, test_f1: 0.5737
 epoch: 98, train_loss: 0.7152, test_loss: 0.9163, test_f1: 0.5782
 epoch: 99, train_loss: 0.7171, test_loss: 0.9113, test_f1: 0.5784
##################ITERATION #6 ****************************************
 epoch: 0, train_loss: 1.2682, test_loss: 1.3527, test_f1: 0.2270
 epoch: 1, train_loss: 1.2074, test_loss: 1.3820, test_f1: 0.1807
 epoch: 2, train_loss: 1.1733, test_loss: 1.3041, test_f1: 0.3058
 epoch: 3, train_loss: 1.1537, test_loss: 1.2148, test_f1: 0.3543
 epoch: 4, train_loss: 1.1299, test_loss: 1.1646, test_f1: 0.3656
 epoch: 5, train_loss: 1.1094, test_loss: 1.1368, test_f1: 0.3778
 epoch: 6, train_loss: 1.0929, test_loss: 1.0795, test_f1: 0.4457
 epoch: 7, train_loss: 1.0803, test_loss: 1.0443, test_f1: 0.4574
 epoch: 8, train_loss: 1.0636, test_loss: 1.0186, test_f1: 0.4900
 epoch: 9, train_loss: 1.0493, test_loss: 1.0095, test_f1: 0.5044
 epoch: 10, train_loss: 1.0379, test_loss: 0.9992, test_f1: 0.4907
 epoch: 11, train_loss: 1.0252, test_loss: 1.0065, test_f1: 0.4732
 epoch: 12, train_loss: 1.0142, test_loss: 0.9955, test_f1: 0.4788
 epoch: 13, train_loss: 1.0038, test_loss: 0.9906, test_f1: 0.4977
 epoch: 14, train_loss: 0.9940, test_loss: 1.0047, test_f1: 0.4784
 epoch: 15, train_loss: 0.9880, test_loss: 0.9764, test_f1: 0.4974
 epoch: 16, train_loss: 0.9750, test_loss: 0.9750, test_f1: 0.4962
 epoch: 17, train_loss: 0.9666, test_loss: 0.9876, test_f1: 0.4943
 epoch: 18, train_loss: 0.9548, test_loss: 0.9635, test_f1: 0.5107
 epoch: 19, train_loss: 0.9474, test_loss: 0.9715, test_f1: 0.5015
 epoch: 20, train_loss: 0.9542, test_loss: 0.9713, test_f1: 0.5114
 epoch: 21, train_loss: 0.9390, test_loss: 0.9597, test_f1: 0.5062
 epoch: 22, train_loss: 0.9257, test_loss: 0.9635, test_f1: 0.5086
 epoch: 23, train_loss: 0.9261, test_loss: 0.9751, test_f1: 0.5048
 epoch: 24, train_loss: 0.9283, test_loss: 0.9614, test_f1: 0.5110
 epoch: 25, train_loss: 0.9081, test_loss: 0.9578, test_f1: 0.5099
 epoch: 26, train_loss: 0.9132, test_loss: 1.0029, test_f1: 0.4803
 epoch: 27, train_loss: 0.9103, test_loss: 0.9616, test_f1: 0.5202
 epoch: 28, train_loss: 0.8980, test_loss: 0.9466, test_f1: 0.5244
 epoch: 29, train_loss: 0.8933, test_loss: 0.9489, test_f1: 0.5240
 epoch: 30, train_loss: 0.8861, test_loss: 0.9532, test_f1: 0.5202
 epoch: 31, train_loss: 0.8783, test_loss: 0.9691, test_f1: 0.5220
 epoch: 32, train_loss: 0.8903, test_loss: 0.9588, test_f1: 0.5199
 epoch: 33, train_loss: 0.8748, test_loss: 0.9856, test_f1: 0.5063
 epoch: 34, train_loss: 0.8624, test_loss: 0.9536, test_f1: 0.5350
 epoch: 35, train_loss: 0.8702, test_loss: 0.9806, test_f1: 0.5118
 epoch: 36, train_loss: 0.8613, test_loss: 0.9670, test_f1: 0.5168
 epoch: 37, train_loss: 0.8596, test_loss: 0.9928, test_f1: 0.5149
 epoch: 38, train_loss: 0.8605, test_loss: 0.9514, test_f1: 0.5351
 epoch: 39, train_loss: 0.8509, test_loss: 1.0022, test_f1: 0.5033
 epoch: 40, train_loss: 0.8339, test_loss: 0.9827, test_f1: 0.5232
 epoch: 41, train_loss: 0.8404, test_loss: 1.0173, test_f1: 0.5128
 epoch: 42, train_loss: 0.8343, test_loss: 0.9716, test_f1: 0.5319
 epoch: 43, train_loss: 0.8296, test_loss: 0.9713, test_f1: 0.5354
 epoch: 44, train_loss: 0.8281, test_loss: 0.9789, test_f1: 0.5447
 epoch: 45, train_loss: 0.8193, test_loss: 0.9827, test_f1: 0.5328
 epoch: 46, train_loss: 0.8231, test_loss: 0.9781, test_f1: 0.5342
 epoch: 47, train_loss: 0.8099, test_loss: 0.9610, test_f1: 0.5332
 epoch: 48, train_loss: 0.8064, test_loss: 0.9723, test_f1: 0.5291
 epoch: 49, train_loss: 0.8078, test_loss: 0.9555, test_f1: 0.5520
 epoch: 50, train_loss: 0.8057, test_loss: 1.0155, test_f1: 0.5271
 epoch: 51, train_loss: 0.8032, test_loss: 0.9703, test_f1: 0.5444
 epoch: 52, train_loss: 0.7970, test_loss: 0.9841, test_f1: 0.5300
 epoch: 53, train_loss: 0.7913, test_loss: 0.9752, test_f1: 0.5418
 epoch: 54, train_loss: 0.7837, test_loss: 0.9900, test_f1: 0.5301
 epoch: 55, train_loss: 0.7886, test_loss: 0.9870, test_f1: 0.5365
 epoch: 56, train_loss: 0.7723, test_loss: 0.9726, test_f1: 0.5425
 epoch: 57, train_loss: 0.7754, test_loss: 0.9688, test_f1: 0.5525
 epoch: 58, train_loss: 0.7877, test_loss: 0.9823, test_f1: 0.5671
 epoch: 59, train_loss: 0.7814, test_loss: 0.9998, test_f1: 0.5431
 epoch: 60, train_loss: 0.7679, test_loss: 0.9653, test_f1: 0.5551
 epoch: 61, train_loss: 0.7716, test_loss: 0.9712, test_f1: 0.5598
 epoch: 62, train_loss: 0.7738, test_loss: 0.9842, test_f1: 0.5530
 epoch: 63, train_loss: 0.7677, test_loss: 0.9974, test_f1: 0.5616
 epoch: 64, train_loss: 0.7601, test_loss: 0.9855, test_f1: 0.5794
 epoch: 65, train_loss: 0.7810, test_loss: 0.9800, test_f1: 0.5713
 epoch: 66, train_loss: 0.7746, test_loss: 0.9791, test_f1: 0.5691
 epoch: 67, train_loss: 0.7728, test_loss: 0.9948, test_f1: 0.5359
 epoch: 68, train_loss: 0.7661, test_loss: 0.9799, test_f1: 0.5524
 epoch: 69, train_loss: 0.7574, test_loss: 0.9926, test_f1: 0.5563
 epoch: 70, train_loss: 0.7469, test_loss: 0.9863, test_f1: 0.5641
 epoch: 71, train_loss: 0.7593, test_loss: 0.9723, test_f1: 0.5802
 epoch: 72, train_loss: 0.7533, test_loss: 0.9759, test_f1: 0.5611
 epoch: 73, train_loss: 0.7490, test_loss: 0.9947, test_f1: 0.5552
 epoch: 74, train_loss: 0.7527, test_loss: 0.9871, test_f1: 0.5571
 epoch: 75, train_loss: 0.7523, test_loss: 0.9841, test_f1: 0.5742
 epoch: 76, train_loss: 0.7379, test_loss: 0.9804, test_f1: 0.5613
 epoch: 77, train_loss: 0.7490, test_loss: 0.9989, test_f1: 0.5596
 epoch: 78, train_loss: 0.7384, test_loss: 0.9977, test_f1: 0.5486
 epoch: 79, train_loss: 0.7422, test_loss: 0.9997, test_f1: 0.5609
 epoch: 80, train_loss: 0.7291, test_loss: 0.9960, test_f1: 0.5695
 epoch: 81, train_loss: 0.7392, test_loss: 1.0003, test_f1: 0.5683
 epoch: 82, train_loss: 0.7344, test_loss: 1.0077, test_f1: 0.5543
 epoch: 83, train_loss: 0.7390, test_loss: 1.0031, test_f1: 0.5609
 epoch: 84, train_loss: 0.7403, test_loss: 1.0167, test_f1: 0.5593
 epoch: 85, train_loss: 0.7375, test_loss: 1.0017, test_f1: 0.5672
 epoch: 86, train_loss: 0.7384, test_loss: 0.9923, test_f1: 0.5594
 epoch: 87, train_loss: 0.7184, test_loss: 0.9897, test_f1: 0.5713
 epoch: 88, train_loss: 0.7329, test_loss: 1.0073, test_f1: 0.5611
 epoch: 89, train_loss: 0.7239, test_loss: 1.0041, test_f1: 0.5791
 epoch: 90, train_loss: 0.7341, test_loss: 0.9989, test_f1: 0.5899
 epoch: 91, train_loss: 0.7180, test_loss: 1.0106, test_f1: 0.5810
 epoch: 92, train_loss: 0.7138, test_loss: 0.9948, test_f1: 0.5793
 epoch: 93, train_loss: 0.7170, test_loss: 0.9912, test_f1: 0.5744
 epoch: 94, train_loss: 0.7029, test_loss: 1.0117, test_f1: 0.5693
 epoch: 95, train_loss: 0.7159, test_loss: 1.0002, test_f1: 0.5952
 epoch: 96, train_loss: 0.7148, test_loss: 1.0159, test_f1: 0.5672
 epoch: 97, train_loss: 0.7240, test_loss: 1.0048, test_f1: 0.5834
 epoch: 98, train_loss: 0.7160, test_loss: 1.0053, test_f1: 0.5770
 epoch: 99, train_loss: 0.7140, test_loss: 1.0004, test_f1: 0.5771
##################ITERATION #7 ****************************************
 epoch: 0, train_loss: 1.2996, test_loss: 1.3928, test_f1: 0.2221
 epoch: 1, train_loss: 1.2281, test_loss: 1.3525, test_f1: 0.2805
 epoch: 2, train_loss: 1.2026, test_loss: 1.2845, test_f1: 0.3058
 epoch: 3, train_loss: 1.1756, test_loss: 1.2185, test_f1: 0.3404
 epoch: 4, train_loss: 1.1516, test_loss: 1.1751, test_f1: 0.3751
 epoch: 5, train_loss: 1.1339, test_loss: 1.1461, test_f1: 0.3912
 epoch: 6, train_loss: 1.1147, test_loss: 1.1355, test_f1: 0.3929
 epoch: 7, train_loss: 1.0938, test_loss: 1.0667, test_f1: 0.4789
 epoch: 8, train_loss: 1.0766, test_loss: 1.0327, test_f1: 0.4978
 epoch: 9, train_loss: 1.0701, test_loss: 1.0189, test_f1: 0.5094
 epoch: 10, train_loss: 1.0612, test_loss: 1.0009, test_f1: 0.5020
 epoch: 11, train_loss: 1.0433, test_loss: 0.9978, test_f1: 0.5244
 epoch: 12, train_loss: 1.0356, test_loss: 0.9787, test_f1: 0.5080
 epoch: 13, train_loss: 1.0242, test_loss: 0.9684, test_f1: 0.5300
 epoch: 14, train_loss: 1.0101, test_loss: 0.9688, test_f1: 0.5195
 epoch: 15, train_loss: 0.9973, test_loss: 0.9522, test_f1: 0.5395
 epoch: 16, train_loss: 0.9872, test_loss: 0.9376, test_f1: 0.5396
 epoch: 17, train_loss: 0.9861, test_loss: 0.9400, test_f1: 0.5291
 epoch: 18, train_loss: 0.9677, test_loss: 0.9274, test_f1: 0.5346
 epoch: 19, train_loss: 0.9658, test_loss: 0.9280, test_f1: 0.5388
 epoch: 20, train_loss: 0.9493, test_loss: 0.9240, test_f1: 0.5384
 epoch: 21, train_loss: 0.9508, test_loss: 0.9235, test_f1: 0.5448
 epoch: 22, train_loss: 0.9352, test_loss: 0.9075, test_f1: 0.5429
 epoch: 23, train_loss: 0.9344, test_loss: 0.9153, test_f1: 0.5414
 epoch: 24, train_loss: 0.9195, test_loss: 0.9065, test_f1: 0.5477
 epoch: 25, train_loss: 0.9212, test_loss: 0.9005, test_f1: 0.5427
 epoch: 26, train_loss: 0.9169, test_loss: 0.8977, test_f1: 0.5381
 epoch: 27, train_loss: 0.9094, test_loss: 0.8965, test_f1: 0.5552
 epoch: 28, train_loss: 0.9077, test_loss: 0.8999, test_f1: 0.5446
 epoch: 29, train_loss: 0.8905, test_loss: 0.8835, test_f1: 0.5434
 epoch: 30, train_loss: 0.8892, test_loss: 0.8962, test_f1: 0.5428
 epoch: 31, train_loss: 0.8927, test_loss: 0.8825, test_f1: 0.5481
 epoch: 32, train_loss: 0.8743, test_loss: 0.8846, test_f1: 0.5591
 epoch: 33, train_loss: 0.8833, test_loss: 0.8840, test_f1: 0.5508
 epoch: 34, train_loss: 0.8725, test_loss: 0.8716, test_f1: 0.5521
 epoch: 35, train_loss: 0.8674, test_loss: 0.9258, test_f1: 0.5265
 epoch: 36, train_loss: 0.8593, test_loss: 0.8677, test_f1: 0.5575
 epoch: 37, train_loss: 0.8597, test_loss: 0.8778, test_f1: 0.5653
 epoch: 38, train_loss: 0.8446, test_loss: 0.8768, test_f1: 0.5560
 epoch: 39, train_loss: 0.8580, test_loss: 0.8685, test_f1: 0.5756
 epoch: 40, train_loss: 0.8552, test_loss: 0.8736, test_f1: 0.5645
 epoch: 41, train_loss: 0.8460, test_loss: 0.8764, test_f1: 0.5781
 epoch: 42, train_loss: 0.8332, test_loss: 0.8662, test_f1: 0.5637
 epoch: 43, train_loss: 0.8308, test_loss: 0.8763, test_f1: 0.5599
 epoch: 44, train_loss: 0.8358, test_loss: 0.8846, test_f1: 0.5616
 epoch: 45, train_loss: 0.8159, test_loss: 0.8767, test_f1: 0.5612
 epoch: 46, train_loss: 0.8209, test_loss: 0.8712, test_f1: 0.5624
 epoch: 47, train_loss: 0.8078, test_loss: 0.8732, test_f1: 0.5643
 epoch: 48, train_loss: 0.8109, test_loss: 0.8699, test_f1: 0.5535
 epoch: 49, train_loss: 0.8111, test_loss: 0.8711, test_f1: 0.5714
 epoch: 50, train_loss: 0.8055, test_loss: 0.8601, test_f1: 0.5834
 epoch: 51, train_loss: 0.7970, test_loss: 0.8713, test_f1: 0.5722
 epoch: 52, train_loss: 0.7911, test_loss: 0.8615, test_f1: 0.5918
 epoch: 53, train_loss: 0.7912, test_loss: 0.8612, test_f1: 0.5843
 epoch: 54, train_loss: 0.7972, test_loss: 0.8549, test_f1: 0.5822
 epoch: 55, train_loss: 0.7774, test_loss: 0.8499, test_f1: 0.5943
 epoch: 56, train_loss: 0.7846, test_loss: 0.8629, test_f1: 0.5892
 epoch: 57, train_loss: 0.7897, test_loss: 0.8570, test_f1: 0.5960
 epoch: 58, train_loss: 0.7813, test_loss: 0.8667, test_f1: 0.5771
 epoch: 59, train_loss: 0.7792, test_loss: 0.8703, test_f1: 0.5862
 epoch: 60, train_loss: 0.7781, test_loss: 0.8684, test_f1: 0.5818
 epoch: 61, train_loss: 0.7754, test_loss: 0.8709, test_f1: 0.5781
 epoch: 62, train_loss: 0.7773, test_loss: 0.8664, test_f1: 0.5908
 epoch: 63, train_loss: 0.7721, test_loss: 0.8642, test_f1: 0.5857
 epoch: 64, train_loss: 0.7723, test_loss: 0.8754, test_f1: 0.5717
 epoch: 65, train_loss: 0.7686, test_loss: 0.8727, test_f1: 0.5760
 epoch: 66, train_loss: 0.7701, test_loss: 0.8664, test_f1: 0.5789
 epoch: 67, train_loss: 0.7731, test_loss: 0.8655, test_f1: 0.5704
 epoch: 68, train_loss: 0.7695, test_loss: 0.8626, test_f1: 0.5764
 epoch: 69, train_loss: 0.7615, test_loss: 0.8648, test_f1: 0.5911
 epoch: 70, train_loss: 0.7605, test_loss: 0.8743, test_f1: 0.5768
 epoch: 71, train_loss: 0.7578, test_loss: 0.8704, test_f1: 0.5755
 epoch: 72, train_loss: 0.7610, test_loss: 0.8688, test_f1: 0.5794
 epoch: 73, train_loss: 0.7449, test_loss: 0.8682, test_f1: 0.5728
 epoch: 74, train_loss: 0.7556, test_loss: 0.8715, test_f1: 0.5750
 epoch: 75, train_loss: 0.7599, test_loss: 0.8795, test_f1: 0.5808
 epoch: 76, train_loss: 0.7529, test_loss: 0.8657, test_f1: 0.5752
 epoch: 77, train_loss: 0.7505, test_loss: 0.8692, test_f1: 0.5693
 epoch: 78, train_loss: 0.7447, test_loss: 0.8644, test_f1: 0.5658
 epoch: 79, train_loss: 0.7421, test_loss: 0.8722, test_f1: 0.5750
 epoch: 80, train_loss: 0.7468, test_loss: 0.8739, test_f1: 0.5742
 epoch: 81, train_loss: 0.7500, test_loss: 0.8669, test_f1: 0.5885
 epoch: 82, train_loss: 0.7464, test_loss: 0.8719, test_f1: 0.5880
 epoch: 83, train_loss: 0.7403, test_loss: 0.8746, test_f1: 0.5778
 epoch: 84, train_loss: 0.7457, test_loss: 0.8735, test_f1: 0.5701
 epoch: 85, train_loss: 0.7480, test_loss: 0.8772, test_f1: 0.5620
 epoch: 86, train_loss: 0.7412, test_loss: 0.8706, test_f1: 0.5632
 epoch: 87, train_loss: 0.7289, test_loss: 0.8789, test_f1: 0.5802
 epoch: 88, train_loss: 0.7395, test_loss: 0.8760, test_f1: 0.5722
 epoch: 89, train_loss: 0.7275, test_loss: 0.8758, test_f1: 0.5603
 epoch: 90, train_loss: 0.7272, test_loss: 0.8710, test_f1: 0.5739
 epoch: 91, train_loss: 0.7378, test_loss: 0.8766, test_f1: 0.5639
 epoch: 92, train_loss: 0.7341, test_loss: 0.8827, test_f1: 0.5784
 epoch: 93, train_loss: 0.7267, test_loss: 0.8708, test_f1: 0.5834
 epoch: 94, train_loss: 0.7173, test_loss: 0.8637, test_f1: 0.5802
 epoch: 95, train_loss: 0.7200, test_loss: 0.8642, test_f1: 0.5732
 epoch: 96, train_loss: 0.7251, test_loss: 0.8725, test_f1: 0.5844
 epoch: 97, train_loss: 0.7204, test_loss: 0.8766, test_f1: 0.5700
 epoch: 98, train_loss: 0.7173, test_loss: 0.8838, test_f1: 0.5692
 epoch: 99, train_loss: 0.7159, test_loss: 0.8858, test_f1: 0.5704
##################ITERATION #8 ****************************************
 epoch: 0, train_loss: 1.3350, test_loss: 1.3240, test_f1: 0.2270
 epoch: 1, train_loss: 1.2451, test_loss: 1.3577, test_f1: 0.2114
 epoch: 2, train_loss: 1.2018, test_loss: 1.3045, test_f1: 0.2880
 epoch: 3, train_loss: 1.1823, test_loss: 1.2299, test_f1: 0.4009
 epoch: 4, train_loss: 1.1630, test_loss: 1.1683, test_f1: 0.4178
 epoch: 5, train_loss: 1.1445, test_loss: 1.1117, test_f1: 0.4376
 epoch: 6, train_loss: 1.1173, test_loss: 1.0708, test_f1: 0.4668
 epoch: 7, train_loss: 1.1040, test_loss: 1.0395, test_f1: 0.4523
 epoch: 8, train_loss: 1.0804, test_loss: 1.0252, test_f1: 0.4672
 epoch: 9, train_loss: 1.0734, test_loss: 1.0054, test_f1: 0.4821
 epoch: 10, train_loss: 1.0672, test_loss: 0.9958, test_f1: 0.4671
 epoch: 11, train_loss: 1.0592, test_loss: 0.9824, test_f1: 0.4853
 epoch: 12, train_loss: 1.0355, test_loss: 0.9785, test_f1: 0.4872
 epoch: 13, train_loss: 1.0308, test_loss: 0.9597, test_f1: 0.4962
 epoch: 14, train_loss: 1.0223, test_loss: 0.9480, test_f1: 0.4993
 epoch: 15, train_loss: 1.0139, test_loss: 0.9507, test_f1: 0.4954
 epoch: 16, train_loss: 1.0025, test_loss: 0.9441, test_f1: 0.4960
 epoch: 17, train_loss: 0.9868, test_loss: 0.9312, test_f1: 0.5008
 epoch: 18, train_loss: 0.9876, test_loss: 0.9386, test_f1: 0.5011
 epoch: 19, train_loss: 0.9773, test_loss: 0.9322, test_f1: 0.5048
 epoch: 20, train_loss: 0.9716, test_loss: 0.9251, test_f1: 0.5041
 epoch: 21, train_loss: 0.9561, test_loss: 0.9278, test_f1: 0.5014
 epoch: 22, train_loss: 0.9587, test_loss: 0.9169, test_f1: 0.5109
 epoch: 23, train_loss: 0.9542, test_loss: 0.9256, test_f1: 0.5137
 epoch: 24, train_loss: 0.9406, test_loss: 0.9169, test_f1: 0.5101
 epoch: 25, train_loss: 0.9320, test_loss: 0.9206, test_f1: 0.5145
 epoch: 26, train_loss: 0.9320, test_loss: 0.9279, test_f1: 0.5219
 epoch: 27, train_loss: 0.9210, test_loss: 0.9142, test_f1: 0.5109
 epoch: 28, train_loss: 0.9190, test_loss: 0.9144, test_f1: 0.5189
 epoch: 29, train_loss: 0.9130, test_loss: 0.9114, test_f1: 0.5082
 epoch: 30, train_loss: 0.9055, test_loss: 0.9143, test_f1: 0.5163
 epoch: 31, train_loss: 0.9059, test_loss: 0.9322, test_f1: 0.5101
 epoch: 32, train_loss: 0.9103, test_loss: 0.9252, test_f1: 0.5129
 epoch: 33, train_loss: 0.8934, test_loss: 0.9322, test_f1: 0.5040
 epoch: 34, train_loss: 0.8900, test_loss: 0.9316, test_f1: 0.5183
 epoch: 35, train_loss: 0.8789, test_loss: 0.9243, test_f1: 0.5187
 epoch: 36, train_loss: 0.8744, test_loss: 0.9144, test_f1: 0.5346
 epoch: 37, train_loss: 0.8836, test_loss: 0.9301, test_f1: 0.5084
 epoch: 38, train_loss: 0.8721, test_loss: 0.9289, test_f1: 0.5264
 epoch: 39, train_loss: 0.8737, test_loss: 0.9156, test_f1: 0.5239
 epoch: 40, train_loss: 0.8669, test_loss: 0.9212, test_f1: 0.5173
 epoch: 41, train_loss: 0.8716, test_loss: 0.9272, test_f1: 0.5343
 epoch: 42, train_loss: 0.8617, test_loss: 0.9331, test_f1: 0.5238
 epoch: 43, train_loss: 0.8590, test_loss: 0.9366, test_f1: 0.5237
 epoch: 44, train_loss: 0.8664, test_loss: 0.9640, test_f1: 0.5282
 epoch: 45, train_loss: 0.8493, test_loss: 0.9329, test_f1: 0.5293
 epoch: 46, train_loss: 0.8492, test_loss: 0.9274, test_f1: 0.5152
 epoch: 47, train_loss: 0.8461, test_loss: 0.9493, test_f1: 0.5343
 epoch: 48, train_loss: 0.8375, test_loss: 0.9237, test_f1: 0.5317
 epoch: 49, train_loss: 0.8336, test_loss: 0.9387, test_f1: 0.5333
 epoch: 50, train_loss: 0.8288, test_loss: 0.9141, test_f1: 0.5382
 epoch: 51, train_loss: 0.8237, test_loss: 0.9219, test_f1: 0.5320
 epoch: 52, train_loss: 0.8286, test_loss: 0.9251, test_f1: 0.5394
 epoch: 53, train_loss: 0.8283, test_loss: 0.9336, test_f1: 0.5315
 epoch: 54, train_loss: 0.8154, test_loss: 0.9304, test_f1: 0.5412
 epoch: 55, train_loss: 0.8258, test_loss: 0.9444, test_f1: 0.5292
 epoch: 56, train_loss: 0.8213, test_loss: 0.9435, test_f1: 0.5287
 epoch: 57, train_loss: 0.8236, test_loss: 0.9381, test_f1: 0.5344
 epoch: 58, train_loss: 0.8165, test_loss: 0.9343, test_f1: 0.5399
 epoch: 59, train_loss: 0.8168, test_loss: 0.9356, test_f1: 0.5332
 epoch: 60, train_loss: 0.8130, test_loss: 0.9371, test_f1: 0.5426
 epoch: 61, train_loss: 0.8140, test_loss: 0.9375, test_f1: 0.5405
 epoch: 62, train_loss: 0.8106, test_loss: 0.9347, test_f1: 0.5387
 epoch: 63, train_loss: 0.8046, test_loss: 0.9316, test_f1: 0.5352
 epoch: 64, train_loss: 0.8043, test_loss: 0.9451, test_f1: 0.5416
 epoch: 65, train_loss: 0.8014, test_loss: 0.9509, test_f1: 0.5428
 epoch: 66, train_loss: 0.8000, test_loss: 0.9353, test_f1: 0.5422
 epoch: 67, train_loss: 0.7976, test_loss: 0.9324, test_f1: 0.5459
 epoch: 68, train_loss: 0.8029, test_loss: 0.9361, test_f1: 0.5406
 epoch: 69, train_loss: 0.8014, test_loss: 0.9393, test_f1: 0.5530
 epoch: 70, train_loss: 0.8035, test_loss: 0.9404, test_f1: 0.5465
 epoch: 71, train_loss: 0.8054, test_loss: 0.9503, test_f1: 0.5494
 epoch: 72, train_loss: 0.7945, test_loss: 0.9325, test_f1: 0.5504
 epoch: 73, train_loss: 0.7912, test_loss: 0.9293, test_f1: 0.5455
 epoch: 74, train_loss: 0.7890, test_loss: 0.9387, test_f1: 0.5375
 epoch: 75, train_loss: 0.7943, test_loss: 0.9425, test_f1: 0.5619
 epoch: 76, train_loss: 0.7963, test_loss: 0.9409, test_f1: 0.5539
 epoch: 77, train_loss: 0.7937, test_loss: 0.9422, test_f1: 0.5370
 epoch: 78, train_loss: 0.7869, test_loss: 0.9403, test_f1: 0.5557
 epoch: 79, train_loss: 0.7855, test_loss: 0.9502, test_f1: 0.5558
 epoch: 80, train_loss: 0.7846, test_loss: 0.9463, test_f1: 0.5464
 epoch: 81, train_loss: 0.7851, test_loss: 0.9393, test_f1: 0.5508
 epoch: 82, train_loss: 0.7866, test_loss: 0.9353, test_f1: 0.5527
 epoch: 83, train_loss: 0.7805, test_loss: 0.9474, test_f1: 0.5499
 epoch: 84, train_loss: 0.7867, test_loss: 0.9463, test_f1: 0.5568
 epoch: 85, train_loss: 0.7813, test_loss: 0.9368, test_f1: 0.5456
 epoch: 86, train_loss: 0.7771, test_loss: 0.9452, test_f1: 0.5399
 epoch: 87, train_loss: 0.7708, test_loss: 0.9440, test_f1: 0.5444
 epoch: 88, train_loss: 0.7659, test_loss: 0.9390, test_f1: 0.5547
 epoch: 89, train_loss: 0.7828, test_loss: 0.9488, test_f1: 0.5515
 epoch: 90, train_loss: 0.7672, test_loss: 0.9468, test_f1: 0.5581
 epoch: 91, train_loss: 0.7734, test_loss: 0.9465, test_f1: 0.5490
 epoch: 92, train_loss: 0.7766, test_loss: 0.9405, test_f1: 0.5557
 epoch: 93, train_loss: 0.7682, test_loss: 0.9571, test_f1: 0.5517
 epoch: 94, train_loss: 0.7707, test_loss: 0.9483, test_f1: 0.5385
 epoch: 95, train_loss: 0.7621, test_loss: 0.9411, test_f1: 0.5543
 epoch: 96, train_loss: 0.7694, test_loss: 0.9483, test_f1: 0.5555
 epoch: 97, train_loss: 0.7662, test_loss: 0.9544, test_f1: 0.5472
 epoch: 98, train_loss: 0.7571, test_loss: 0.9497, test_f1: 0.5494
 epoch: 99, train_loss: 0.7617, test_loss: 0.9628, test_f1: 0.5582
##################ITERATION #9 ****************************************
 epoch: 0, train_loss: 1.3117, test_loss: 1.3754, test_f1: 0.2198
 epoch: 1, train_loss: 1.2177, test_loss: 1.3110, test_f1: 0.2270
 epoch: 2, train_loss: 1.1862, test_loss: 1.2367, test_f1: 0.3460
 epoch: 3, train_loss: 1.1556, test_loss: 1.1729, test_f1: 0.3712
 epoch: 4, train_loss: 1.1385, test_loss: 1.1086, test_f1: 0.4179
 epoch: 5, train_loss: 1.1174, test_loss: 1.0597, test_f1: 0.4409
 epoch: 6, train_loss: 1.0978, test_loss: 1.0379, test_f1: 0.4638
 epoch: 7, train_loss: 1.0772, test_loss: 1.0239, test_f1: 0.4851
 epoch: 8, train_loss: 1.0699, test_loss: 1.0190, test_f1: 0.4765
 epoch: 9, train_loss: 1.0510, test_loss: 1.0047, test_f1: 0.4892
 epoch: 10, train_loss: 1.0481, test_loss: 0.9983, test_f1: 0.4914
 epoch: 11, train_loss: 1.0313, test_loss: 0.9872, test_f1: 0.4879
 epoch: 12, train_loss: 1.0236, test_loss: 0.9844, test_f1: 0.4775
 epoch: 13, train_loss: 1.0078, test_loss: 0.9716, test_f1: 0.4902
 epoch: 14, train_loss: 1.0022, test_loss: 0.9704, test_f1: 0.4812
 epoch: 15, train_loss: 0.9957, test_loss: 0.9776, test_f1: 0.4704
 epoch: 16, train_loss: 0.9953, test_loss: 0.9604, test_f1: 0.4868
 epoch: 17, train_loss: 0.9740, test_loss: 0.9633, test_f1: 0.4855
 epoch: 18, train_loss: 0.9754, test_loss: 0.9631, test_f1: 0.4886
 epoch: 19, train_loss: 0.9673, test_loss: 0.9431, test_f1: 0.5108
 epoch: 20, train_loss: 0.9568, test_loss: 0.9510, test_f1: 0.5137
 epoch: 21, train_loss: 0.9597, test_loss: 0.9488, test_f1: 0.5193
 epoch: 22, train_loss: 0.9487, test_loss: 0.9543, test_f1: 0.5087
 epoch: 23, train_loss: 0.9431, test_loss: 0.9344, test_f1: 0.5239
 epoch: 24, train_loss: 0.9440, test_loss: 0.9693, test_f1: 0.5004
 epoch: 25, train_loss: 0.9383, test_loss: 0.9523, test_f1: 0.5169
 epoch: 26, train_loss: 0.9283, test_loss: 0.9501, test_f1: 0.5242
 epoch: 27, train_loss: 0.9184, test_loss: 0.9422, test_f1: 0.5326
 epoch: 28, train_loss: 0.9153, test_loss: 0.9431, test_f1: 0.5291
 epoch: 29, train_loss: 0.9282, test_loss: 0.9529, test_f1: 0.5202
 epoch: 30, train_loss: 0.9112, test_loss: 0.9554, test_f1: 0.5120
 epoch: 31, train_loss: 0.8984, test_loss: 0.9534, test_f1: 0.5260
 epoch: 32, train_loss: 0.8992, test_loss: 0.9426, test_f1: 0.5359
 epoch: 33, train_loss: 0.8985, test_loss: 0.9441, test_f1: 0.5353
 epoch: 34, train_loss: 0.8976, test_loss: 0.9402, test_f1: 0.5278
 epoch: 35, train_loss: 0.8836, test_loss: 0.9464, test_f1: 0.5206
 epoch: 36, train_loss: 0.8694, test_loss: 0.9451, test_f1: 0.5305
 epoch: 37, train_loss: 0.8815, test_loss: 0.9455, test_f1: 0.5328
 epoch: 38, train_loss: 0.8865, test_loss: 0.9528, test_f1: 0.5235
 epoch: 39, train_loss: 0.8749, test_loss: 0.9416, test_f1: 0.5261
 epoch: 40, train_loss: 0.8624, test_loss: 0.9403, test_f1: 0.5383
 epoch: 41, train_loss: 0.8719, test_loss: 0.9439, test_f1: 0.5352
 epoch: 42, train_loss: 0.8653, test_loss: 0.9394, test_f1: 0.5225
 epoch: 43, train_loss: 0.8574, test_loss: 0.9609, test_f1: 0.5182
 epoch: 44, train_loss: 0.8570, test_loss: 0.9450, test_f1: 0.5279
 epoch: 45, train_loss: 0.8570, test_loss: 0.9494, test_f1: 0.5364
 epoch: 46, train_loss: 0.8400, test_loss: 0.9607, test_f1: 0.5246
 epoch: 47, train_loss: 0.8485, test_loss: 0.9499, test_f1: 0.5296
 epoch: 48, train_loss: 0.8514, test_loss: 0.9522, test_f1: 0.5199
 epoch: 49, train_loss: 0.8301, test_loss: 0.9511, test_f1: 0.5420
 epoch: 50, train_loss: 0.8469, test_loss: 0.9310, test_f1: 0.5224
 epoch: 51, train_loss: 0.8359, test_loss: 0.9481, test_f1: 0.5190
 epoch: 52, train_loss: 0.8216, test_loss: 0.9535, test_f1: 0.5225
 epoch: 53, train_loss: 0.8228, test_loss: 0.9582, test_f1: 0.5281
 epoch: 54, train_loss: 0.8301, test_loss: 0.9585, test_f1: 0.5228
 epoch: 55, train_loss: 0.8143, test_loss: 0.9584, test_f1: 0.5334
 epoch: 56, train_loss: 0.8119, test_loss: 0.9563, test_f1: 0.5391
 epoch: 57, train_loss: 0.8186, test_loss: 0.9456, test_f1: 0.5448
 epoch: 58, train_loss: 0.8174, test_loss: 0.9511, test_f1: 0.5438
 epoch: 59, train_loss: 0.8073, test_loss: 0.9628, test_f1: 0.5388
 epoch: 60, train_loss: 0.8167, test_loss: 0.9566, test_f1: 0.5369
 epoch: 61, train_loss: 0.8115, test_loss: 0.9437, test_f1: 0.5406
 epoch: 62, train_loss: 0.8095, test_loss: 0.9531, test_f1: 0.5505
 epoch: 63, train_loss: 0.8083, test_loss: 0.9647, test_f1: 0.5527
 epoch: 64, train_loss: 0.8135, test_loss: 0.9437, test_f1: 0.5558
 epoch: 65, train_loss: 0.8078, test_loss: 0.9669, test_f1: 0.5404
 epoch: 66, train_loss: 0.8060, test_loss: 0.9599, test_f1: 0.5474
 epoch: 67, train_loss: 0.7957, test_loss: 0.9527, test_f1: 0.5429
 epoch: 68, train_loss: 0.7979, test_loss: 0.9529, test_f1: 0.5474
 epoch: 69, train_loss: 0.7884, test_loss: 0.9552, test_f1: 0.5550
 epoch: 70, train_loss: 0.7928, test_loss: 0.9576, test_f1: 0.5557
 epoch: 71, train_loss: 0.8059, test_loss: 0.9516, test_f1: 0.5580
 epoch: 72, train_loss: 0.7999, test_loss: 0.9580, test_f1: 0.5547
 epoch: 73, train_loss: 0.8004, test_loss: 0.9605, test_f1: 0.5583
 epoch: 74, train_loss: 0.7946, test_loss: 0.9598, test_f1: 0.5491
 epoch: 75, train_loss: 0.7938, test_loss: 0.9497, test_f1: 0.5541
 epoch: 76, train_loss: 0.8019, test_loss: 0.9484, test_f1: 0.5671
 epoch: 77, train_loss: 0.7892, test_loss: 0.9676, test_f1: 0.5568
 epoch: 78, train_loss: 0.7808, test_loss: 0.9655, test_f1: 0.5581
 epoch: 79, train_loss: 0.7766, test_loss: 0.9687, test_f1: 0.5682
 epoch: 80, train_loss: 0.7765, test_loss: 0.9715, test_f1: 0.5663
 epoch: 81, train_loss: 0.7785, test_loss: 0.9704, test_f1: 0.5632
 epoch: 82, train_loss: 0.7942, test_loss: 0.9776, test_f1: 0.5580
 epoch: 83, train_loss: 0.7748, test_loss: 0.9681, test_f1: 0.5720
 epoch: 84, train_loss: 0.7862, test_loss: 0.9619, test_f1: 0.5719
 epoch: 85, train_loss: 0.7760, test_loss: 0.9616, test_f1: 0.5767
 epoch: 86, train_loss: 0.7661, test_loss: 0.9503, test_f1: 0.5762
 epoch: 87, train_loss: 0.7730, test_loss: 0.9617, test_f1: 0.5642
 epoch: 88, train_loss: 0.7648, test_loss: 0.9606, test_f1: 0.5693
 epoch: 89, train_loss: 0.7640, test_loss: 0.9637, test_f1: 0.5683
 epoch: 90, train_loss: 0.7669, test_loss: 0.9675, test_f1: 0.5778
 epoch: 91, train_loss: 0.7765, test_loss: 0.9685, test_f1: 0.5756
 epoch: 92, train_loss: 0.7675, test_loss: 0.9687, test_f1: 0.5709
 epoch: 93, train_loss: 0.7616, test_loss: 0.9717, test_f1: 0.5846
 epoch: 94, train_loss: 0.7597, test_loss: 0.9765, test_f1: 0.5666
 epoch: 95, train_loss: 0.7679, test_loss: 0.9547, test_f1: 0.5746
 epoch: 96, train_loss: 0.7616, test_loss: 0.9801, test_f1: 0.5705
 epoch: 97, train_loss: 0.7578, test_loss: 0.9668, test_f1: 0.5805
 epoch: 98, train_loss: 0.7469, test_loss: 0.9590, test_f1: 0.5878
 epoch: 99, train_loss: 0.7495, test_loss: 0.9676, test_f1: 0.5803

Training completed in 429.47 seconds
Best F1: 0.5997 at epoch 93
Mean F1 across iterations: 0.5732  0.0189
========================FINAL RESULTS================================
FEGIN weighted F1: 0.5997  0.0189
python main.py --data ltspice_examples --representation component_net --model FEGIN --layers 6 --hiddens 64 --batch_size 256 --lr 0.0001 --emb_size 512 --epochs 100 --save_appendix component_net_L6_H64_BS256_LR0.0001_E512 --no_val
-----



STDERR:
  File "main.py", line 370, in <module>
    main()
  File "main.py", line 254, in main
    dataset = dataset_class(
  File "/home/philip/projects/ltspice_examples_code_repo/Circuit-Completion-Using-GNNs/component_classification_with_link_prediction_head/evaluation/FEGIN/kernel/circuit_datasets.py", line 15, in __init__
    self.data, self.slices = torch.load(self.processed_paths[0])
  File "/home/philip/.local/lib/python3.8/site-packages/torch/serialization.py", line 1040, in load
    warnings.warn(
  File "/usr/lib/python3.8/warnings.py", line 109, in _showwarnmsg
    sw(msg.message, msg.category, msg.filename, msg.lineno,
  File "main.py", line 47, in warn_with_traceback
    traceback.print_stack(file=log)
/home/philip/projects/ltspice_examples_code_repo/Circuit-Completion-Using-GNNs/component_classification_with_link_prediction_head/evaluation/FEGIN/kernel/circuit_datasets.py:15: FutureWarning: You are using `torch.load` with `weights_only=False` (the current default value), which uses the default pickle module implicitly. It is possible to construct malicious pickle data which will execute arbitrary code during unpickling (See https://github.com/pytorch/pytorch/blob/main/SECURITY.md#untrusted-models for more details). In a future release, the default value for `weights_only` will be flipped to `True`. This limits the functions that could be executed during unpickling. Arbitrary objects will no longer be allowed to be loaded via this mode unless they are explicitly allowlisted by the user via `torch.serialization.add_safe_globals`. We recommend you start setting `weights_only=True` for any use case where you don't have full control of the loaded file. Please open an issue on GitHub for any issues related to this experimental feature.
  self.data, self.slices = torch.load(self.processed_paths[0])
