STDOUT:
Results will be saved in /home/philip/projects/ltspice_examples_code_repo/Circuit-Completion-Using-GNNs/component_classification_with_link_prediction_head/evaluation/FEGIN/results/model_FEGIN_dataset_ltspice_examples
Command line input: python main.py --data ltspice_examples --representation component_pin --model FEGIN --layers 5 --hiddens 64 --batch_size 128 --lr 0.001 --emb_size 250 --epochs 100 --save_appendix component_pin_L5_H64_BS128_LR0.001_E250 --no_val
 is saved.
-----
ltspice_examples - FEGIN
Using 5 layers, 64 hidden units, h = 2
Loading component_pin representation dataset
ENTERED
Training FEGIN on component_pin representation
Train: 3560, Test: 848
##################ITERATION #0 ****************************************
 epoch: 0, train_loss: 1.2983, test_loss: 1.2794, test_f1: 0.2557
 epoch: 1, train_loss: 1.1565, test_loss: 1.2178, test_f1: 0.3046
 epoch: 2, train_loss: 1.0567, test_loss: 1.0522, test_f1: 0.4606
 epoch: 3, train_loss: 1.0050, test_loss: 1.0497, test_f1: 0.4582
 epoch: 4, train_loss: 0.9645, test_loss: 0.9772, test_f1: 0.5184
 epoch: 5, train_loss: 0.9381, test_loss: 0.9783, test_f1: 0.5364
 epoch: 6, train_loss: 0.9039, test_loss: 0.9721, test_f1: 0.4930
 epoch: 7, train_loss: 0.8804, test_loss: 0.9746, test_f1: 0.5172
 epoch: 8, train_loss: 0.8517, test_loss: 0.9876, test_f1: 0.5022
 epoch: 9, train_loss: 0.8484, test_loss: 0.9455, test_f1: 0.5358
 epoch: 10, train_loss: 0.8300, test_loss: 0.9556, test_f1: 0.5152
 epoch: 11, train_loss: 0.8167, test_loss: 0.9342, test_f1: 0.5137
 epoch: 12, train_loss: 0.7901, test_loss: 0.9688, test_f1: 0.5388
 epoch: 13, train_loss: 0.7771, test_loss: 0.8798, test_f1: 0.5555
 epoch: 14, train_loss: 0.7598, test_loss: 0.9796, test_f1: 0.5653
 epoch: 15, train_loss: 0.7525, test_loss: 1.0208, test_f1: 0.5534
 epoch: 16, train_loss: 0.7400, test_loss: 0.9473, test_f1: 0.5343
 epoch: 17, train_loss: 0.7387, test_loss: 1.0261, test_f1: 0.5244
 epoch: 18, train_loss: 0.7240, test_loss: 0.7677, test_f1: 0.5926
 epoch: 19, train_loss: 0.7002, test_loss: 0.8295, test_f1: 0.5858
 epoch: 20, train_loss: 0.6927, test_loss: 0.9777, test_f1: 0.5751
 epoch: 21, train_loss: 0.6967, test_loss: 0.9161, test_f1: 0.5713
 epoch: 22, train_loss: 0.6672, test_loss: 1.0126, test_f1: 0.5260
 epoch: 23, train_loss: 0.6657, test_loss: 0.9880, test_f1: 0.5453
 epoch: 24, train_loss: 0.6653, test_loss: 1.0571, test_f1: 0.5214
 epoch: 25, train_loss: 0.6352, test_loss: 0.9595, test_f1: 0.5944
 epoch: 26, train_loss: 0.6343, test_loss: 0.9643, test_f1: 0.5565
 epoch: 27, train_loss: 0.6569, test_loss: 0.9543, test_f1: 0.5780
 epoch: 28, train_loss: 0.6279, test_loss: 0.8781, test_f1: 0.6093
 epoch: 29, train_loss: 0.6290, test_loss: 0.9692, test_f1: 0.5844
 epoch: 30, train_loss: 0.6099, test_loss: 0.9783, test_f1: 0.5943
 epoch: 31, train_loss: 0.5830, test_loss: 0.9086, test_f1: 0.6079
 epoch: 32, train_loss: 0.6040, test_loss: 0.9174, test_f1: 0.6163
 epoch: 33, train_loss: 0.5883, test_loss: 0.9764, test_f1: 0.5976
 epoch: 34, train_loss: 0.5886, test_loss: 0.9237, test_f1: 0.5720
 epoch: 35, train_loss: 0.5869, test_loss: 0.9635, test_f1: 0.5957
 epoch: 36, train_loss: 0.5666, test_loss: 1.0761, test_f1: 0.5887
 epoch: 37, train_loss: 0.5441, test_loss: 1.0241, test_f1: 0.6025
 epoch: 38, train_loss: 0.5460, test_loss: 0.9476, test_f1: 0.6280
 epoch: 39, train_loss: 0.5334, test_loss: 0.9243, test_f1: 0.6324
 epoch: 40, train_loss: 0.5222, test_loss: 1.0371, test_f1: 0.6250
 epoch: 41, train_loss: 0.5252, test_loss: 1.0696, test_f1: 0.5853
 epoch: 42, train_loss: 0.5379, test_loss: 1.1145, test_f1: 0.6259
 epoch: 43, train_loss: 0.5342, test_loss: 0.9730, test_f1: 0.6137
 epoch: 44, train_loss: 0.5010, test_loss: 0.9594, test_f1: 0.6209
 epoch: 45, train_loss: 0.4839, test_loss: 0.9515, test_f1: 0.6335
 epoch: 46, train_loss: 0.4970, test_loss: 1.0478, test_f1: 0.6513
 epoch: 47, train_loss: 0.4772, test_loss: 1.0217, test_f1: 0.6354
 epoch: 48, train_loss: 0.4922, test_loss: 1.1238, test_f1: 0.6099
 epoch: 49, train_loss: 0.4739, test_loss: 1.1311, test_f1: 0.5805
 epoch: 50, train_loss: 0.4663, test_loss: 1.1614, test_f1: 0.6096
 epoch: 51, train_loss: 0.4409, test_loss: 0.9712, test_f1: 0.6782
 epoch: 52, train_loss: 0.4098, test_loss: 1.0587, test_f1: 0.6398
 epoch: 53, train_loss: 0.3832, test_loss: 1.0564, test_f1: 0.6365
 epoch: 54, train_loss: 0.3999, test_loss: 1.1395, test_f1: 0.6336
 epoch: 55, train_loss: 0.3892, test_loss: 1.2039, test_f1: 0.6464
 epoch: 56, train_loss: 0.3708, test_loss: 1.0878, test_f1: 0.6533
 epoch: 57, train_loss: 0.3757, test_loss: 1.1786, test_f1: 0.6296
 epoch: 58, train_loss: 0.3646, test_loss: 1.1928, test_f1: 0.6912
 epoch: 59, train_loss: 0.3769, test_loss: 1.1595, test_f1: 0.6337
 epoch: 60, train_loss: 0.3487, test_loss: 1.2221, test_f1: 0.6506
 epoch: 61, train_loss: 0.3582, test_loss: 1.1541, test_f1: 0.6900
 epoch: 62, train_loss: 0.3516, test_loss: 1.2714, test_f1: 0.6475
 epoch: 63, train_loss: 0.3396, test_loss: 1.2481, test_f1: 0.6547
 epoch: 64, train_loss: 0.3531, test_loss: 1.2890, test_f1: 0.6445
 epoch: 65, train_loss: 0.3294, test_loss: 1.2537, test_f1: 0.6538
 epoch: 66, train_loss: 0.3283, test_loss: 1.3176, test_f1: 0.6589
 epoch: 67, train_loss: 0.3416, test_loss: 1.2952, test_f1: 0.6316
 epoch: 68, train_loss: 0.3548, test_loss: 1.2204, test_f1: 0.6404
 epoch: 69, train_loss: 0.3361, test_loss: 1.3501, test_f1: 0.6484
 epoch: 70, train_loss: 0.3311, test_loss: 1.1476, test_f1: 0.6597
 epoch: 71, train_loss: 0.3202, test_loss: 1.3033, test_f1: 0.6431
 epoch: 72, train_loss: 0.3262, test_loss: 1.2546, test_f1: 0.6470
 epoch: 73, train_loss: 0.3049, test_loss: 1.2831, test_f1: 0.6803
 epoch: 74, train_loss: 0.3108, test_loss: 1.2325, test_f1: 0.6807
 epoch: 75, train_loss: 0.2929, test_loss: 1.3907, test_f1: 0.6138
 epoch: 76, train_loss: 0.2967, test_loss: 1.2489, test_f1: 0.6777
 epoch: 77, train_loss: 0.2894, test_loss: 1.5319, test_f1: 0.6793
 epoch: 78, train_loss: 0.2888, test_loss: 1.4431, test_f1: 0.6690
 epoch: 79, train_loss: 0.2871, test_loss: 1.4533, test_f1: 0.6356
 epoch: 80, train_loss: 0.2873, test_loss: 1.3198, test_f1: 0.6704
 epoch: 81, train_loss: 0.3185, test_loss: 1.5542, test_f1: 0.6221
 epoch: 82, train_loss: 0.2998, test_loss: 1.2947, test_f1: 0.6674
 epoch: 83, train_loss: 0.2826, test_loss: 1.5570, test_f1: 0.6477
 epoch: 84, train_loss: 0.2744, test_loss: 1.4299, test_f1: 0.6597
 epoch: 85, train_loss: 0.2637, test_loss: 1.5865, test_f1: 0.6240
 epoch: 86, train_loss: 0.2743, test_loss: 1.5471, test_f1: 0.6351
 epoch: 87, train_loss: 0.2596, test_loss: 1.6093, test_f1: 0.6296
 epoch: 88, train_loss: 0.2756, test_loss: 1.5224, test_f1: 0.6524
 epoch: 89, train_loss: 0.2777, test_loss: 1.5284, test_f1: 0.6631
 epoch: 90, train_loss: 0.2554, test_loss: 1.6354, test_f1: 0.6288
 epoch: 91, train_loss: 0.2420, test_loss: 1.6927, test_f1: 0.6360
 epoch: 92, train_loss: 0.2502, test_loss: 1.6428, test_f1: 0.6239
 epoch: 93, train_loss: 0.2587, test_loss: 1.5126, test_f1: 0.6563
 epoch: 94, train_loss: 0.2599, test_loss: 1.8153, test_f1: 0.6253
 epoch: 95, train_loss: 0.2646, test_loss: 1.8672, test_f1: 0.5854
 epoch: 96, train_loss: 0.2585, test_loss: 1.4894, test_f1: 0.6526
 epoch: 97, train_loss: 0.2584, test_loss: 1.5883, test_f1: 0.6238
 epoch: 98, train_loss: 0.2358, test_loss: 1.5559, test_f1: 0.6667
 epoch: 99, train_loss: 0.2415, test_loss: 1.6623, test_f1: 0.6532
##################ITERATION #1 ****************************************
 epoch: 0, train_loss: 1.2096, test_loss: 1.2209, test_f1: 0.2260
 epoch: 1, train_loss: 1.0485, test_loss: 1.0343, test_f1: 0.4111
 epoch: 2, train_loss: 0.9809, test_loss: 0.9810, test_f1: 0.4733
 epoch: 3, train_loss: 0.9408, test_loss: 0.9762, test_f1: 0.4765
 epoch: 4, train_loss: 0.9033, test_loss: 1.1476, test_f1: 0.4426
 epoch: 5, train_loss: 0.8643, test_loss: 0.9516, test_f1: 0.4920
 epoch: 6, train_loss: 0.8535, test_loss: 0.8242, test_f1: 0.5733
 epoch: 7, train_loss: 0.8415, test_loss: 0.8753, test_f1: 0.5341
 epoch: 8, train_loss: 0.8137, test_loss: 1.0739, test_f1: 0.4891
 epoch: 9, train_loss: 0.7917, test_loss: 0.8452, test_f1: 0.5598
 epoch: 10, train_loss: 0.7741, test_loss: 1.0408, test_f1: 0.5531
 epoch: 11, train_loss: 0.7742, test_loss: 0.8985, test_f1: 0.5558
 epoch: 12, train_loss: 0.7430, test_loss: 0.8456, test_f1: 0.5999
 epoch: 13, train_loss: 0.7568, test_loss: 1.0221, test_f1: 0.4854
 epoch: 14, train_loss: 0.7514, test_loss: 0.8326, test_f1: 0.5875
 epoch: 15, train_loss: 0.7355, test_loss: 1.2358, test_f1: 0.4550
 epoch: 16, train_loss: 0.7079, test_loss: 0.8861, test_f1: 0.5936
 epoch: 17, train_loss: 0.7013, test_loss: 0.8582, test_f1: 0.6041
 epoch: 18, train_loss: 0.6955, test_loss: 0.9082, test_f1: 0.5559
 epoch: 19, train_loss: 0.6879, test_loss: 0.8496, test_f1: 0.5955
 epoch: 20, train_loss: 0.6524, test_loss: 1.1971, test_f1: 0.5245
 epoch: 21, train_loss: 0.6832, test_loss: 0.8882, test_f1: 0.5908
 epoch: 22, train_loss: 0.6627, test_loss: 0.8979, test_f1: 0.5801
 epoch: 23, train_loss: 0.6381, test_loss: 0.8371, test_f1: 0.5981
 epoch: 24, train_loss: 0.6414, test_loss: 0.8760, test_f1: 0.6146
 epoch: 25, train_loss: 0.6261, test_loss: 0.8514, test_f1: 0.6071
 epoch: 26, train_loss: 0.6250, test_loss: 0.9510, test_f1: 0.5730
 epoch: 27, train_loss: 0.6220, test_loss: 0.8414, test_f1: 0.6265
 epoch: 28, train_loss: 0.6043, test_loss: 0.9079, test_f1: 0.6060
 epoch: 29, train_loss: 0.5976, test_loss: 0.9899, test_f1: 0.5937
 epoch: 30, train_loss: 0.6089, test_loss: 0.9025, test_f1: 0.5861
 epoch: 31, train_loss: 0.5916, test_loss: 0.7603, test_f1: 0.6424
 epoch: 32, train_loss: 0.5807, test_loss: 1.0880, test_f1: 0.5501
 epoch: 33, train_loss: 0.5910, test_loss: 0.8848, test_f1: 0.6155
 epoch: 34, train_loss: 0.5593, test_loss: 0.8296, test_f1: 0.6198
 epoch: 35, train_loss: 0.5511, test_loss: 0.9011, test_f1: 0.5751
 epoch: 36, train_loss: 0.5595, test_loss: 1.1258, test_f1: 0.5541
 epoch: 37, train_loss: 0.5473, test_loss: 1.0943, test_f1: 0.5613
 epoch: 38, train_loss: 0.5346, test_loss: 0.8525, test_f1: 0.6368
 epoch: 39, train_loss: 0.5284, test_loss: 1.0703, test_f1: 0.5867
 epoch: 40, train_loss: 0.5436, test_loss: 0.9115, test_f1: 0.6154
 epoch: 41, train_loss: 0.5193, test_loss: 1.0757, test_f1: 0.5708
 epoch: 42, train_loss: 0.4941, test_loss: 0.9978, test_f1: 0.6183
 epoch: 43, train_loss: 0.4933, test_loss: 1.0376, test_f1: 0.6216
 epoch: 44, train_loss: 0.4739, test_loss: 0.9525, test_f1: 0.6256
 epoch: 45, train_loss: 0.4967, test_loss: 0.9376, test_f1: 0.6118
 epoch: 46, train_loss: 0.4709, test_loss: 0.9468, test_f1: 0.6236
 epoch: 47, train_loss: 0.4754, test_loss: 0.9611, test_f1: 0.6037
 epoch: 48, train_loss: 0.4784, test_loss: 1.0878, test_f1: 0.5777
 epoch: 49, train_loss: 0.4742, test_loss: 1.0117, test_f1: 0.5798
 epoch: 50, train_loss: 0.4793, test_loss: 0.9826, test_f1: 0.6004
 epoch: 51, train_loss: 0.4365, test_loss: 0.9555, test_f1: 0.6183
 epoch: 52, train_loss: 0.4032, test_loss: 0.9646, test_f1: 0.6376
 epoch: 53, train_loss: 0.3785, test_loss: 1.0633, test_f1: 0.6035
 epoch: 54, train_loss: 0.3867, test_loss: 0.9705, test_f1: 0.6341
 epoch: 55, train_loss: 0.3779, test_loss: 0.9881, test_f1: 0.6381
 epoch: 56, train_loss: 0.3902, test_loss: 1.0396, test_f1: 0.6126
 epoch: 57, train_loss: 0.3834, test_loss: 1.0589, test_f1: 0.6225
 epoch: 58, train_loss: 0.3612, test_loss: 0.9974, test_f1: 0.6243
 epoch: 59, train_loss: 0.3780, test_loss: 1.0576, test_f1: 0.6327
 epoch: 60, train_loss: 0.3829, test_loss: 1.0377, test_f1: 0.6222
 epoch: 61, train_loss: 0.3452, test_loss: 1.1488, test_f1: 0.6087
 epoch: 62, train_loss: 0.3484, test_loss: 1.1610, test_f1: 0.6169
 epoch: 63, train_loss: 0.3393, test_loss: 1.1747, test_f1: 0.6341
 epoch: 64, train_loss: 0.3326, test_loss: 1.1609, test_f1: 0.6142
 epoch: 65, train_loss: 0.3444, test_loss: 1.0541, test_f1: 0.6367
 epoch: 66, train_loss: 0.3416, test_loss: 1.2859, test_f1: 0.6214
 epoch: 67, train_loss: 0.3291, test_loss: 1.2573, test_f1: 0.6261
 epoch: 68, train_loss: 0.3136, test_loss: 1.2278, test_f1: 0.6361
 epoch: 69, train_loss: 0.3183, test_loss: 1.2780, test_f1: 0.6119
 epoch: 70, train_loss: 0.3259, test_loss: 1.4234, test_f1: 0.6200
 epoch: 71, train_loss: 0.3187, test_loss: 1.1959, test_f1: 0.6260
 epoch: 72, train_loss: 0.3136, test_loss: 1.3120, test_f1: 0.6171
 epoch: 73, train_loss: 0.3325, test_loss: 1.2980, test_f1: 0.6206
 epoch: 74, train_loss: 0.3253, test_loss: 1.2275, test_f1: 0.6282
 epoch: 75, train_loss: 0.3178, test_loss: 1.6046, test_f1: 0.5646
 epoch: 76, train_loss: 0.3130, test_loss: 1.3352, test_f1: 0.6388
 epoch: 77, train_loss: 0.2976, test_loss: 1.3091, test_f1: 0.6512
 epoch: 78, train_loss: 0.2817, test_loss: 1.3675, test_f1: 0.6363
 epoch: 79, train_loss: 0.2998, test_loss: 1.4430, test_f1: 0.6227
 epoch: 80, train_loss: 0.2975, test_loss: 1.4169, test_f1: 0.6431
 epoch: 81, train_loss: 0.2863, test_loss: 1.3302, test_f1: 0.6364
 epoch: 82, train_loss: 0.2855, test_loss: 1.3359, test_f1: 0.6334
 epoch: 83, train_loss: 0.2794, test_loss: 1.2852, test_f1: 0.6501
 epoch: 84, train_loss: 0.2886, test_loss: 1.5502, test_f1: 0.6340
 epoch: 85, train_loss: 0.2798, test_loss: 1.4071, test_f1: 0.6459
 epoch: 86, train_loss: 0.2849, test_loss: 1.5401, test_f1: 0.6093
 epoch: 87, train_loss: 0.2762, test_loss: 1.3883, test_f1: 0.6093
 epoch: 88, train_loss: 0.2726, test_loss: 1.4995, test_f1: 0.6243
 epoch: 89, train_loss: 0.2732, test_loss: 1.5234, test_f1: 0.6274
 epoch: 90, train_loss: 0.2650, test_loss: 1.4881, test_f1: 0.6403
 epoch: 91, train_loss: 0.2606, test_loss: 1.4790, test_f1: 0.6323
 epoch: 92, train_loss: 0.2554, test_loss: 1.5775, test_f1: 0.6109
 epoch: 93, train_loss: 0.2733, test_loss: 1.5347, test_f1: 0.6260
 epoch: 94, train_loss: 0.2439, test_loss: 1.5753, test_f1: 0.6216
 epoch: 95, train_loss: 0.2481, test_loss: 1.5253, test_f1: 0.6327
 epoch: 96, train_loss: 0.2497, test_loss: 1.6343, test_f1: 0.6216
 epoch: 97, train_loss: 0.2419, test_loss: 1.5034, test_f1: 0.6545
 epoch: 98, train_loss: 0.2591, test_loss: 1.4835, test_f1: 0.6288
 epoch: 99, train_loss: 0.2327, test_loss: 1.5823, test_f1: 0.6413
##################ITERATION #2 ****************************************
 epoch: 0, train_loss: 1.1778, test_loss: 1.3429, test_f1: 0.2661
 epoch: 1, train_loss: 1.0157, test_loss: 1.2194, test_f1: 0.3130
 epoch: 2, train_loss: 0.9620, test_loss: 0.9638, test_f1: 0.5274
 epoch: 3, train_loss: 0.9151, test_loss: 0.9459, test_f1: 0.4843
 epoch: 4, train_loss: 0.8975, test_loss: 1.0223, test_f1: 0.4858
 epoch: 5, train_loss: 0.8612, test_loss: 1.3011, test_f1: 0.4683
 epoch: 6, train_loss: 0.8377, test_loss: 0.8615, test_f1: 0.5464
 epoch: 7, train_loss: 0.8110, test_loss: 0.9947, test_f1: 0.5408
 epoch: 8, train_loss: 0.8024, test_loss: 0.8859, test_f1: 0.5601
 epoch: 9, train_loss: 0.7874, test_loss: 0.8758, test_f1: 0.5616
 epoch: 10, train_loss: 0.7731, test_loss: 0.8946, test_f1: 0.5746
 epoch: 11, train_loss: 0.7513, test_loss: 0.7558, test_f1: 0.6169
 epoch: 12, train_loss: 0.7186, test_loss: 0.8503, test_f1: 0.5588
 epoch: 13, train_loss: 0.7130, test_loss: 1.0941, test_f1: 0.5043
 epoch: 14, train_loss: 0.6985, test_loss: 0.8530, test_f1: 0.6068
 epoch: 15, train_loss: 0.6829, test_loss: 0.8391, test_f1: 0.5811
 epoch: 16, train_loss: 0.6812, test_loss: 0.9302, test_f1: 0.5841
 epoch: 17, train_loss: 0.6652, test_loss: 0.7797, test_f1: 0.6230
 epoch: 18, train_loss: 0.6565, test_loss: 0.8940, test_f1: 0.5878
 epoch: 19, train_loss: 0.6471, test_loss: 0.9790, test_f1: 0.5733
 epoch: 20, train_loss: 0.6446, test_loss: 0.8499, test_f1: 0.5984
 epoch: 21, train_loss: 0.6398, test_loss: 0.9231, test_f1: 0.6202
 epoch: 22, train_loss: 0.6357, test_loss: 0.9423, test_f1: 0.6114
 epoch: 23, train_loss: 0.6198, test_loss: 0.8555, test_f1: 0.6270
 epoch: 24, train_loss: 0.5755, test_loss: 0.8204, test_f1: 0.6151
 epoch: 25, train_loss: 0.5902, test_loss: 0.8406, test_f1: 0.6187
 epoch: 26, train_loss: 0.5957, test_loss: 0.9384, test_f1: 0.5971
 epoch: 27, train_loss: 0.5872, test_loss: 0.8199, test_f1: 0.6355
 epoch: 28, train_loss: 0.5411, test_loss: 0.8720, test_f1: 0.6112
 epoch: 29, train_loss: 0.5578, test_loss: 0.9853, test_f1: 0.6151
 epoch: 30, train_loss: 0.5548, test_loss: 0.8276, test_f1: 0.6438
 epoch: 31, train_loss: 0.5234, test_loss: 0.9380, test_f1: 0.6309
 epoch: 32, train_loss: 0.5351, test_loss: 1.0137, test_f1: 0.6182
 epoch: 33, train_loss: 0.5310, test_loss: 0.8267, test_f1: 0.6363
 epoch: 34, train_loss: 0.5299, test_loss: 0.9590, test_f1: 0.6059
 epoch: 35, train_loss: 0.5094, test_loss: 0.9792, test_f1: 0.6351
 epoch: 36, train_loss: 0.5005, test_loss: 0.9995, test_f1: 0.6554
 epoch: 37, train_loss: 0.5095, test_loss: 0.9861, test_f1: 0.6190
 epoch: 38, train_loss: 0.5002, test_loss: 1.0339, test_f1: 0.6017
 epoch: 39, train_loss: 0.4816, test_loss: 0.9989, test_f1: 0.6422
 epoch: 40, train_loss: 0.4748, test_loss: 0.9900, test_f1: 0.6206
 epoch: 41, train_loss: 0.4533, test_loss: 0.9931, test_f1: 0.6280
 epoch: 42, train_loss: 0.4469, test_loss: 1.0773, test_f1: 0.6460
 epoch: 43, train_loss: 0.4500, test_loss: 1.0972, test_f1: 0.6309
 epoch: 44, train_loss: 0.4305, test_loss: 0.9603, test_f1: 0.6612
 epoch: 45, train_loss: 0.4188, test_loss: 1.0395, test_f1: 0.6655
 epoch: 46, train_loss: 0.4319, test_loss: 1.2652, test_f1: 0.6350
 epoch: 47, train_loss: 0.4280, test_loss: 1.0245, test_f1: 0.6623
 epoch: 48, train_loss: 0.4000, test_loss: 1.1486, test_f1: 0.6507
 epoch: 49, train_loss: 0.4200, test_loss: 1.1526, test_f1: 0.6550
 epoch: 50, train_loss: 0.3965, test_loss: 1.1327, test_f1: 0.6592
 epoch: 51, train_loss: 0.3600, test_loss: 1.1753, test_f1: 0.6589
 epoch: 52, train_loss: 0.3350, test_loss: 1.2253, test_f1: 0.6362
 epoch: 53, train_loss: 0.3520, test_loss: 1.1236, test_f1: 0.6732
 epoch: 54, train_loss: 0.3117, test_loss: 1.2273, test_f1: 0.6624
 epoch: 55, train_loss: 0.2987, test_loss: 1.2772, test_f1: 0.6799
 epoch: 56, train_loss: 0.2864, test_loss: 1.2204, test_f1: 0.6761
 epoch: 57, train_loss: 0.2976, test_loss: 1.2580, test_f1: 0.6349
 epoch: 58, train_loss: 0.2991, test_loss: 1.2614, test_f1: 0.6625
 epoch: 59, train_loss: 0.3045, test_loss: 1.3352, test_f1: 0.6448
 epoch: 60, train_loss: 0.2718, test_loss: 1.4171, test_f1: 0.6609
 epoch: 61, train_loss: 0.2819, test_loss: 1.3303, test_f1: 0.6534
 epoch: 62, train_loss: 0.2783, test_loss: 1.3618, test_f1: 0.6666
 epoch: 63, train_loss: 0.2668, test_loss: 1.4281, test_f1: 0.6626
 epoch: 64, train_loss: 0.2693, test_loss: 1.4857, test_f1: 0.6355
 epoch: 65, train_loss: 0.2626, test_loss: 1.3874, test_f1: 0.6625
 epoch: 66, train_loss: 0.2464, test_loss: 1.4785, test_f1: 0.6213
 epoch: 67, train_loss: 0.2639, test_loss: 1.4104, test_f1: 0.6412
 epoch: 68, train_loss: 0.2558, test_loss: 1.4992, test_f1: 0.6739
 epoch: 69, train_loss: 0.2567, test_loss: 1.3650, test_f1: 0.6712
 epoch: 70, train_loss: 0.2640, test_loss: 1.4476, test_f1: 0.6469
 epoch: 71, train_loss: 0.2359, test_loss: 1.5854, test_f1: 0.6336
 epoch: 72, train_loss: 0.2320, test_loss: 1.5242, test_f1: 0.6312
 epoch: 73, train_loss: 0.2281, test_loss: 1.5696, test_f1: 0.6592
 epoch: 74, train_loss: 0.2330, test_loss: 1.5856, test_f1: 0.6270
 epoch: 75, train_loss: 0.2436, test_loss: 1.6663, test_f1: 0.6578
 epoch: 76, train_loss: 0.2417, test_loss: 1.5477, test_f1: 0.6326
 epoch: 77, train_loss: 0.2118, test_loss: 1.7857, test_f1: 0.6349
 epoch: 78, train_loss: 0.2259, test_loss: 1.7020, test_f1: 0.5980
 epoch: 79, train_loss: 0.2228, test_loss: 1.7327, test_f1: 0.6332
 epoch: 80, train_loss: 0.2159, test_loss: 1.7018, test_f1: 0.6441
 epoch: 81, train_loss: 0.2266, test_loss: 1.6272, test_f1: 0.6481
 epoch: 82, train_loss: 0.2273, test_loss: 1.5713, test_f1: 0.6557
 epoch: 83, train_loss: 0.2189, test_loss: 1.6961, test_f1: 0.6783
 epoch: 84, train_loss: 0.2056, test_loss: 1.8195, test_f1: 0.6286
 epoch: 85, train_loss: 0.1971, test_loss: 1.8651, test_f1: 0.6285
 epoch: 86, train_loss: 0.1952, test_loss: 1.8375, test_f1: 0.6554
 epoch: 87, train_loss: 0.2044, test_loss: 1.8945, test_f1: 0.6516
 epoch: 88, train_loss: 0.1986, test_loss: 1.8415, test_f1: 0.6406
 epoch: 89, train_loss: 0.2015, test_loss: 1.8986, test_f1: 0.6369
 epoch: 90, train_loss: 0.1969, test_loss: 1.8725, test_f1: 0.6302
 epoch: 91, train_loss: 0.2159, test_loss: 1.7405, test_f1: 0.6611
 epoch: 92, train_loss: 0.1862, test_loss: 1.7801, test_f1: 0.6391
 epoch: 93, train_loss: 0.1775, test_loss: 1.8673, test_f1: 0.6403
 epoch: 94, train_loss: 0.1840, test_loss: 1.8868, test_f1: 0.6756
 epoch: 95, train_loss: 0.1865, test_loss: 1.8106, test_f1: 0.6403
 epoch: 96, train_loss: 0.1969, test_loss: 1.8894, test_f1: 0.6251
 epoch: 97, train_loss: 0.1811, test_loss: 2.0572, test_f1: 0.6267
 epoch: 98, train_loss: 0.1953, test_loss: 1.8116, test_f1: 0.6551
 epoch: 99, train_loss: 0.1886, test_loss: 1.9793, test_f1: 0.6349
##################ITERATION #3 ****************************************
 epoch: 0, train_loss: 1.2013, test_loss: 1.2489, test_f1: 0.2648
 epoch: 1, train_loss: 1.0422, test_loss: 0.9911, test_f1: 0.5065
 epoch: 2, train_loss: 0.9822, test_loss: 0.9879, test_f1: 0.5518
 epoch: 3, train_loss: 0.9361, test_loss: 0.9455, test_f1: 0.5153
 epoch: 4, train_loss: 0.9126, test_loss: 0.9269, test_f1: 0.5681
 epoch: 5, train_loss: 0.8879, test_loss: 0.9386, test_f1: 0.5436
 epoch: 6, train_loss: 0.8533, test_loss: 0.9588, test_f1: 0.5912
 epoch: 7, train_loss: 0.8646, test_loss: 0.9531, test_f1: 0.5707
 epoch: 8, train_loss: 0.8242, test_loss: 0.9523, test_f1: 0.5855
 epoch: 9, train_loss: 0.8177, test_loss: 0.9516, test_f1: 0.5450
 epoch: 10, train_loss: 0.7957, test_loss: 1.0167, test_f1: 0.5585
 epoch: 11, train_loss: 0.7857, test_loss: 0.9563, test_f1: 0.5632
 epoch: 12, train_loss: 0.7733, test_loss: 0.9586, test_f1: 0.5500
 epoch: 13, train_loss: 0.7432, test_loss: 0.9767, test_f1: 0.5907
 epoch: 14, train_loss: 0.7320, test_loss: 0.9809, test_f1: 0.5882
 epoch: 15, train_loss: 0.7211, test_loss: 0.9010, test_f1: 0.6008
 epoch: 16, train_loss: 0.7207, test_loss: 0.9375, test_f1: 0.5885
 epoch: 17, train_loss: 0.7153, test_loss: 0.9323, test_f1: 0.5690
 epoch: 18, train_loss: 0.7024, test_loss: 0.9044, test_f1: 0.5945
 epoch: 19, train_loss: 0.6912, test_loss: 0.8474, test_f1: 0.6174
 epoch: 20, train_loss: 0.6723, test_loss: 0.9177, test_f1: 0.6051
 epoch: 21, train_loss: 0.6763, test_loss: 0.9293, test_f1: 0.5864
 epoch: 22, train_loss: 0.6575, test_loss: 0.8773, test_f1: 0.6248
 epoch: 23, train_loss: 0.6531, test_loss: 0.8965, test_f1: 0.6166
 epoch: 24, train_loss: 0.6395, test_loss: 0.9552, test_f1: 0.5599
 epoch: 25, train_loss: 0.6317, test_loss: 0.9255, test_f1: 0.6203
 epoch: 26, train_loss: 0.6163, test_loss: 0.8927, test_f1: 0.6000
 epoch: 27, train_loss: 0.6111, test_loss: 0.8965, test_f1: 0.6180
 epoch: 28, train_loss: 0.5982, test_loss: 0.9026, test_f1: 0.6357
 epoch: 29, train_loss: 0.6199, test_loss: 0.9011, test_f1: 0.6022
 epoch: 30, train_loss: 0.6179, test_loss: 0.9083, test_f1: 0.6060
 epoch: 31, train_loss: 0.5880, test_loss: 1.0039, test_f1: 0.5887
 epoch: 32, train_loss: 0.5802, test_loss: 0.9456, test_f1: 0.6005
 epoch: 33, train_loss: 0.5532, test_loss: 0.8609, test_f1: 0.6549
 epoch: 34, train_loss: 0.5495, test_loss: 0.9217, test_f1: 0.6318
 epoch: 35, train_loss: 0.5554, test_loss: 0.9713, test_f1: 0.6484
 epoch: 36, train_loss: 0.5499, test_loss: 0.9187, test_f1: 0.6129
 epoch: 37, train_loss: 0.5460, test_loss: 0.9374, test_f1: 0.6316
 epoch: 38, train_loss: 0.5265, test_loss: 0.9738, test_f1: 0.6002
 epoch: 39, train_loss: 0.5270, test_loss: 0.9704, test_f1: 0.6144
 epoch: 40, train_loss: 0.5114, test_loss: 1.1371, test_f1: 0.6059
 epoch: 41, train_loss: 0.5123, test_loss: 0.8794, test_f1: 0.6174
 epoch: 42, train_loss: 0.4862, test_loss: 0.9354, test_f1: 0.6347
 epoch: 43, train_loss: 0.4985, test_loss: 0.9718, test_f1: 0.6283
 epoch: 44, train_loss: 0.4878, test_loss: 1.0252, test_f1: 0.6053
 epoch: 45, train_loss: 0.4913, test_loss: 1.0122, test_f1: 0.6099
 epoch: 46, train_loss: 0.4905, test_loss: 0.9694, test_f1: 0.5940
 epoch: 47, train_loss: 0.4677, test_loss: 1.0546, test_f1: 0.6231
 epoch: 48, train_loss: 0.4836, test_loss: 0.9910, test_f1: 0.6130
 epoch: 49, train_loss: 0.4802, test_loss: 1.0040, test_f1: 0.6042
 epoch: 50, train_loss: 0.4509, test_loss: 1.0178, test_f1: 0.6274
 epoch: 51, train_loss: 0.4176, test_loss: 0.8842, test_f1: 0.6720
 epoch: 52, train_loss: 0.3905, test_loss: 0.9967, test_f1: 0.6543
 epoch: 53, train_loss: 0.3776, test_loss: 0.9890, test_f1: 0.6476
 epoch: 54, train_loss: 0.3713, test_loss: 1.0522, test_f1: 0.6246
 epoch: 55, train_loss: 0.3854, test_loss: 1.0158, test_f1: 0.6371
 epoch: 56, train_loss: 0.3623, test_loss: 1.0396, test_f1: 0.6529
 epoch: 57, train_loss: 0.3466, test_loss: 1.0604, test_f1: 0.6410
 epoch: 58, train_loss: 0.3745, test_loss: 1.0727, test_f1: 0.6451
 epoch: 59, train_loss: 0.3515, test_loss: 1.0648, test_f1: 0.6502
 epoch: 60, train_loss: 0.3578, test_loss: 1.1017, test_f1: 0.6636
 epoch: 61, train_loss: 0.3563, test_loss: 1.0246, test_f1: 0.6758
 epoch: 62, train_loss: 0.3508, test_loss: 1.1635, test_f1: 0.6415
 epoch: 63, train_loss: 0.3435, test_loss: 1.0985, test_f1: 0.6795
 epoch: 64, train_loss: 0.3159, test_loss: 1.1387, test_f1: 0.6324
 epoch: 65, train_loss: 0.3281, test_loss: 1.0737, test_f1: 0.6868
 epoch: 66, train_loss: 0.3216, test_loss: 1.1743, test_f1: 0.6522
 epoch: 67, train_loss: 0.3149, test_loss: 1.1263, test_f1: 0.6574
 epoch: 68, train_loss: 0.3216, test_loss: 1.1680, test_f1: 0.6319
 epoch: 69, train_loss: 0.3223, test_loss: 1.1014, test_f1: 0.6533
 epoch: 70, train_loss: 0.3153, test_loss: 1.1771, test_f1: 0.6324
 epoch: 71, train_loss: 0.3132, test_loss: 1.1754, test_f1: 0.6326
 epoch: 72, train_loss: 0.3094, test_loss: 1.1260, test_f1: 0.6307
 epoch: 73, train_loss: 0.2939, test_loss: 1.1402, test_f1: 0.6455
 epoch: 74, train_loss: 0.2914, test_loss: 1.2930, test_f1: 0.6317
 epoch: 75, train_loss: 0.2900, test_loss: 1.2008, test_f1: 0.6664
 epoch: 76, train_loss: 0.2830, test_loss: 1.2491, test_f1: 0.6490
 epoch: 77, train_loss: 0.2913, test_loss: 1.1934, test_f1: 0.6563
 epoch: 78, train_loss: 0.2904, test_loss: 1.1855, test_f1: 0.6429
 epoch: 79, train_loss: 0.3036, test_loss: 1.1934, test_f1: 0.6511
 epoch: 80, train_loss: 0.2731, test_loss: 1.1911, test_f1: 0.6522
 epoch: 81, train_loss: 0.2883, test_loss: 1.1367, test_f1: 0.6576
 epoch: 82, train_loss: 0.3006, test_loss: 1.1545, test_f1: 0.6676
 epoch: 83, train_loss: 0.2687, test_loss: 1.2535, test_f1: 0.6256
 epoch: 84, train_loss: 0.2793, test_loss: 1.3208, test_f1: 0.6225
 epoch: 85, train_loss: 0.2554, test_loss: 1.1880, test_f1: 0.6547
 epoch: 86, train_loss: 0.2657, test_loss: 1.2896, test_f1: 0.6613
 epoch: 87, train_loss: 0.2596, test_loss: 1.3568, test_f1: 0.6135
 epoch: 88, train_loss: 0.2608, test_loss: 1.2576, test_f1: 0.6430
 epoch: 89, train_loss: 0.2659, test_loss: 1.2630, test_f1: 0.6361
 epoch: 90, train_loss: 0.2745, test_loss: 1.1889, test_f1: 0.6613
 epoch: 91, train_loss: 0.2508, test_loss: 1.3533, test_f1: 0.6389
 epoch: 92, train_loss: 0.2650, test_loss: 1.3259, test_f1: 0.6492
 epoch: 93, train_loss: 0.2459, test_loss: 1.2657, test_f1: 0.6557
 epoch: 94, train_loss: 0.2432, test_loss: 1.3896, test_f1: 0.6275
 epoch: 95, train_loss: 0.2567, test_loss: 1.3538, test_f1: 0.6666
 epoch: 96, train_loss: 0.2470, test_loss: 1.3121, test_f1: 0.6531
 epoch: 97, train_loss: 0.2522, test_loss: 1.2833, test_f1: 0.6484
 epoch: 98, train_loss: 0.2510, test_loss: 1.2749, test_f1: 0.6715
 epoch: 99, train_loss: 0.2430, test_loss: 1.2934, test_f1: 0.6534
##################ITERATION #4 ****************************************
 epoch: 0, train_loss: 1.2178, test_loss: 1.3873, test_f1: 0.2583
 epoch: 1, train_loss: 1.0298, test_loss: 1.0170, test_f1: 0.4725
 epoch: 2, train_loss: 0.9591, test_loss: 0.9536, test_f1: 0.4982
 epoch: 3, train_loss: 0.9149, test_loss: 0.9364, test_f1: 0.5115
 epoch: 4, train_loss: 0.8841, test_loss: 0.8787, test_f1: 0.5404
 epoch: 5, train_loss: 0.8496, test_loss: 0.8567, test_f1: 0.5688
 epoch: 6, train_loss: 0.8245, test_loss: 0.8976, test_f1: 0.5584
 epoch: 7, train_loss: 0.8168, test_loss: 0.8809, test_f1: 0.5806
 epoch: 8, train_loss: 0.7893, test_loss: 0.8514, test_f1: 0.5593
 epoch: 9, train_loss: 0.7892, test_loss: 0.9556, test_f1: 0.5412
 epoch: 10, train_loss: 0.7636, test_loss: 0.8348, test_f1: 0.5657
 epoch: 11, train_loss: 0.7384, test_loss: 0.8261, test_f1: 0.6011
 epoch: 12, train_loss: 0.7409, test_loss: 0.7967, test_f1: 0.5748
 epoch: 13, train_loss: 0.7317, test_loss: 0.8615, test_f1: 0.5928
 epoch: 14, train_loss: 0.7183, test_loss: 0.8407, test_f1: 0.5982
 epoch: 15, train_loss: 0.7041, test_loss: 0.7886, test_f1: 0.6207
 epoch: 16, train_loss: 0.6696, test_loss: 0.9200, test_f1: 0.5854
 epoch: 17, train_loss: 0.6764, test_loss: 0.7889, test_f1: 0.6149
 epoch: 18, train_loss: 0.6651, test_loss: 0.7312, test_f1: 0.6186
 epoch: 19, train_loss: 0.6464, test_loss: 0.7559, test_f1: 0.6219
 epoch: 20, train_loss: 0.6281, test_loss: 0.8085, test_f1: 0.6207
 epoch: 21, train_loss: 0.6376, test_loss: 0.8359, test_f1: 0.5671
 epoch: 22, train_loss: 0.6329, test_loss: 0.7604, test_f1: 0.6410
 epoch: 23, train_loss: 0.6223, test_loss: 0.8101, test_f1: 0.6330
 epoch: 24, train_loss: 0.6064, test_loss: 0.7818, test_f1: 0.6254
 epoch: 25, train_loss: 0.6191, test_loss: 0.8629, test_f1: 0.6266
 epoch: 26, train_loss: 0.5794, test_loss: 0.8173, test_f1: 0.6033
 epoch: 27, train_loss: 0.5959, test_loss: 0.8345, test_f1: 0.6092
 epoch: 28, train_loss: 0.5648, test_loss: 0.8280, test_f1: 0.6358
 epoch: 29, train_loss: 0.5538, test_loss: 0.8243, test_f1: 0.6247
 epoch: 30, train_loss: 0.5569, test_loss: 0.7759, test_f1: 0.6493
 epoch: 31, train_loss: 0.5550, test_loss: 0.8140, test_f1: 0.6406
 epoch: 32, train_loss: 0.5545, test_loss: 0.8667, test_f1: 0.6311
 epoch: 33, train_loss: 0.5252, test_loss: 0.8035, test_f1: 0.6443
 epoch: 34, train_loss: 0.5181, test_loss: 0.8602, test_f1: 0.6106
 epoch: 35, train_loss: 0.5190, test_loss: 0.8969, test_f1: 0.6259
 epoch: 36, train_loss: 0.5169, test_loss: 0.8490, test_f1: 0.6319
 epoch: 37, train_loss: 0.5057, test_loss: 0.9442, test_f1: 0.6215
 epoch: 38, train_loss: 0.4882, test_loss: 0.8374, test_f1: 0.6235
 epoch: 39, train_loss: 0.4724, test_loss: 0.7700, test_f1: 0.6926
 epoch: 40, train_loss: 0.4571, test_loss: 0.7668, test_f1: 0.6736
 epoch: 41, train_loss: 0.4836, test_loss: 0.8444, test_f1: 0.6418
 epoch: 42, train_loss: 0.4574, test_loss: 0.9485, test_f1: 0.6089
 epoch: 43, train_loss: 0.4723, test_loss: 0.9484, test_f1: 0.6429
 epoch: 44, train_loss: 0.4389, test_loss: 0.9470, test_f1: 0.6035
 epoch: 45, train_loss: 0.4492, test_loss: 0.9382, test_f1: 0.6293
 epoch: 46, train_loss: 0.4308, test_loss: 0.9611, test_f1: 0.6324
 epoch: 47, train_loss: 0.4307, test_loss: 0.9068, test_f1: 0.6220
 epoch: 48, train_loss: 0.4219, test_loss: 0.9078, test_f1: 0.6408
 epoch: 49, train_loss: 0.4163, test_loss: 0.9352, test_f1: 0.6396
 epoch: 50, train_loss: 0.4219, test_loss: 0.8894, test_f1: 0.6470
 epoch: 51, train_loss: 0.3719, test_loss: 0.9304, test_f1: 0.6510
 epoch: 52, train_loss: 0.3530, test_loss: 0.9702, test_f1: 0.6379
 epoch: 53, train_loss: 0.3427, test_loss: 1.0477, test_f1: 0.6244
 epoch: 54, train_loss: 0.3290, test_loss: 0.9720, test_f1: 0.6648
 epoch: 55, train_loss: 0.3290, test_loss: 0.9874, test_f1: 0.6551
 epoch: 56, train_loss: 0.3182, test_loss: 0.9838, test_f1: 0.6431
 epoch: 57, train_loss: 0.3154, test_loss: 1.0429, test_f1: 0.6557
 epoch: 58, train_loss: 0.3163, test_loss: 1.0173, test_f1: 0.6276
 epoch: 59, train_loss: 0.3086, test_loss: 1.0749, test_f1: 0.6385
 epoch: 60, train_loss: 0.3100, test_loss: 1.1186, test_f1: 0.6302
 epoch: 61, train_loss: 0.3022, test_loss: 1.0740, test_f1: 0.6391
 epoch: 62, train_loss: 0.3045, test_loss: 1.0349, test_f1: 0.6379
 epoch: 63, train_loss: 0.3127, test_loss: 1.0581, test_f1: 0.6602
 epoch: 64, train_loss: 0.3076, test_loss: 1.0775, test_f1: 0.6448
 epoch: 65, train_loss: 0.3064, test_loss: 1.0538, test_f1: 0.6570
 epoch: 66, train_loss: 0.3036, test_loss: 1.1528, test_f1: 0.6186
 epoch: 67, train_loss: 0.2798, test_loss: 1.0525, test_f1: 0.6693
 epoch: 68, train_loss: 0.2806, test_loss: 1.2161, test_f1: 0.6254
 epoch: 69, train_loss: 0.2936, test_loss: 1.0753, test_f1: 0.6618
 epoch: 70, train_loss: 0.2910, test_loss: 1.1927, test_f1: 0.6462
 epoch: 71, train_loss: 0.2793, test_loss: 1.1576, test_f1: 0.6371
 epoch: 72, train_loss: 0.2710, test_loss: 1.2048, test_f1: 0.6401
 epoch: 73, train_loss: 0.2708, test_loss: 1.2562, test_f1: 0.6411
 epoch: 74, train_loss: 0.2675, test_loss: 1.1310, test_f1: 0.6420
 epoch: 75, train_loss: 0.2702, test_loss: 1.2132, test_f1: 0.6268
 epoch: 76, train_loss: 0.2568, test_loss: 1.1989, test_f1: 0.6327
 epoch: 77, train_loss: 0.2603, test_loss: 1.1685, test_f1: 0.6522
 epoch: 78, train_loss: 0.2629, test_loss: 1.1037, test_f1: 0.6750
 epoch: 79, train_loss: 0.2429, test_loss: 1.2540, test_f1: 0.6550
 epoch: 80, train_loss: 0.2580, test_loss: 1.1858, test_f1: 0.6435
 epoch: 81, train_loss: 0.2468, test_loss: 1.1940, test_f1: 0.6422
 epoch: 82, train_loss: 0.2294, test_loss: 1.2633, test_f1: 0.6373
 epoch: 83, train_loss: 0.2444, test_loss: 1.2405, test_f1: 0.6393
 epoch: 84, train_loss: 0.2232, test_loss: 1.2688, test_f1: 0.6470
 epoch: 85, train_loss: 0.2534, test_loss: 1.1654, test_f1: 0.6547
 epoch: 86, train_loss: 0.2434, test_loss: 1.4255, test_f1: 0.5987
 epoch: 87, train_loss: 0.2414, test_loss: 1.1761, test_f1: 0.6604
 epoch: 88, train_loss: 0.2303, test_loss: 1.2624, test_f1: 0.6588
 epoch: 89, train_loss: 0.2277, test_loss: 1.2308, test_f1: 0.6472
 epoch: 90, train_loss: 0.2286, test_loss: 1.3810, test_f1: 0.6368
 epoch: 91, train_loss: 0.2468, test_loss: 1.3441, test_f1: 0.6584
 epoch: 92, train_loss: 0.2286, test_loss: 1.4000, test_f1: 0.6147
 epoch: 93, train_loss: 0.2171, test_loss: 1.3172, test_f1: 0.6392
 epoch: 94, train_loss: 0.2122, test_loss: 1.4464, test_f1: 0.6279
 epoch: 95, train_loss: 0.2028, test_loss: 1.3763, test_f1: 0.6567
 epoch: 96, train_loss: 0.2126, test_loss: 1.4266, test_f1: 0.6324
 epoch: 97, train_loss: 0.2058, test_loss: 1.3889, test_f1: 0.6222
 epoch: 98, train_loss: 0.2246, test_loss: 1.4193, test_f1: 0.6559
 epoch: 99, train_loss: 0.2152, test_loss: 1.4433, test_f1: 0.6519
##################ITERATION #5 ****************************************
 epoch: 0, train_loss: 1.2736, test_loss: 1.1774, test_f1: 0.3554
 epoch: 1, train_loss: 1.0470, test_loss: 1.1333, test_f1: 0.3925
 epoch: 2, train_loss: 0.9901, test_loss: 1.0015, test_f1: 0.5249
 epoch: 3, train_loss: 0.9599, test_loss: 0.9470, test_f1: 0.5578
 epoch: 4, train_loss: 0.9027, test_loss: 0.9280, test_f1: 0.5399
 epoch: 5, train_loss: 0.8970, test_loss: 0.9240, test_f1: 0.5616
 epoch: 6, train_loss: 0.8824, test_loss: 0.8949, test_f1: 0.5695
 epoch: 7, train_loss: 0.8611, test_loss: 0.9000, test_f1: 0.5758
 epoch: 8, train_loss: 0.8284, test_loss: 0.9223, test_f1: 0.5802
 epoch: 9, train_loss: 0.8272, test_loss: 0.8548, test_f1: 0.5912
 epoch: 10, train_loss: 0.8045, test_loss: 0.8578, test_f1: 0.5713
 epoch: 11, train_loss: 0.7797, test_loss: 0.8786, test_f1: 0.5848
 epoch: 12, train_loss: 0.7635, test_loss: 0.8979, test_f1: 0.5953
 epoch: 13, train_loss: 0.7727, test_loss: 0.8383, test_f1: 0.5854
 epoch: 14, train_loss: 0.7319, test_loss: 0.8228, test_f1: 0.6143
 epoch: 15, train_loss: 0.7254, test_loss: 0.8786, test_f1: 0.5813
 epoch: 16, train_loss: 0.7235, test_loss: 0.8946, test_f1: 0.5796
 epoch: 17, train_loss: 0.7297, test_loss: 0.8453, test_f1: 0.6021
 epoch: 18, train_loss: 0.7021, test_loss: 0.8236, test_f1: 0.6062
 epoch: 19, train_loss: 0.7045, test_loss: 0.8628, test_f1: 0.6028
 epoch: 20, train_loss: 0.6923, test_loss: 0.8914, test_f1: 0.6050
 epoch: 21, train_loss: 0.6652, test_loss: 0.8756, test_f1: 0.5995
 epoch: 22, train_loss: 0.6578, test_loss: 0.9383, test_f1: 0.5719
 epoch: 23, train_loss: 0.6494, test_loss: 0.8204, test_f1: 0.6412
 epoch: 24, train_loss: 0.6381, test_loss: 0.8300, test_f1: 0.6147
 epoch: 25, train_loss: 0.6371, test_loss: 0.8154, test_f1: 0.6313
 epoch: 26, train_loss: 0.6381, test_loss: 0.8300, test_f1: 0.6141
 epoch: 27, train_loss: 0.6347, test_loss: 0.7976, test_f1: 0.6521
 epoch: 28, train_loss: 0.6160, test_loss: 0.8873, test_f1: 0.6117
 epoch: 29, train_loss: 0.6026, test_loss: 0.8017, test_f1: 0.6372
 epoch: 30, train_loss: 0.5816, test_loss: 0.8295, test_f1: 0.6521
 epoch: 31, train_loss: 0.5915, test_loss: 0.8396, test_f1: 0.6596
 epoch: 32, train_loss: 0.5949, test_loss: 0.8123, test_f1: 0.6409
 epoch: 33, train_loss: 0.5570, test_loss: 0.8346, test_f1: 0.6460
 epoch: 34, train_loss: 0.5583, test_loss: 0.8312, test_f1: 0.6415
 epoch: 35, train_loss: 0.5497, test_loss: 0.8426, test_f1: 0.6375
 epoch: 36, train_loss: 0.5489, test_loss: 0.8001, test_f1: 0.6318
 epoch: 37, train_loss: 0.5516, test_loss: 0.8714, test_f1: 0.6122
 epoch: 38, train_loss: 0.5420, test_loss: 0.8056, test_f1: 0.6478
 epoch: 39, train_loss: 0.5220, test_loss: 0.7899, test_f1: 0.6683
 epoch: 40, train_loss: 0.5387, test_loss: 0.8011, test_f1: 0.6495
 epoch: 41, train_loss: 0.5362, test_loss: 0.7636, test_f1: 0.6759
 epoch: 42, train_loss: 0.5124, test_loss: 0.8721, test_f1: 0.6304
 epoch: 43, train_loss: 0.4987, test_loss: 0.7736, test_f1: 0.6850
 epoch: 44, train_loss: 0.5050, test_loss: 0.8359, test_f1: 0.6271
 epoch: 45, train_loss: 0.4689, test_loss: 1.1254, test_f1: 0.6088
 epoch: 46, train_loss: 0.4760, test_loss: 0.8142, test_f1: 0.6932
 epoch: 47, train_loss: 0.4794, test_loss: 0.8289, test_f1: 0.6594
 epoch: 48, train_loss: 0.4747, test_loss: 0.8360, test_f1: 0.6559
 epoch: 49, train_loss: 0.4665, test_loss: 0.8093, test_f1: 0.6552
 epoch: 50, train_loss: 0.4611, test_loss: 0.8828, test_f1: 0.6629
 epoch: 51, train_loss: 0.4313, test_loss: 0.8014, test_f1: 0.6763
 epoch: 52, train_loss: 0.3844, test_loss: 0.7701, test_f1: 0.6886
 epoch: 53, train_loss: 0.3777, test_loss: 0.8158, test_f1: 0.6721
 epoch: 54, train_loss: 0.3804, test_loss: 0.8848, test_f1: 0.6561
 epoch: 55, train_loss: 0.3928, test_loss: 0.8391, test_f1: 0.6921
 epoch: 56, train_loss: 0.3824, test_loss: 0.8916, test_f1: 0.6724
 epoch: 57, train_loss: 0.3632, test_loss: 0.9182, test_f1: 0.6731
 epoch: 58, train_loss: 0.3550, test_loss: 0.9649, test_f1: 0.6396
 epoch: 59, train_loss: 0.3482, test_loss: 0.9692, test_f1: 0.6765
 epoch: 60, train_loss: 0.3511, test_loss: 0.9390, test_f1: 0.6870
 epoch: 61, train_loss: 0.3674, test_loss: 0.9150, test_f1: 0.6726
 epoch: 62, train_loss: 0.3309, test_loss: 0.9818, test_f1: 0.6472
 epoch: 63, train_loss: 0.3411, test_loss: 1.0009, test_f1: 0.6447
 epoch: 64, train_loss: 0.3403, test_loss: 0.9591, test_f1: 0.6669
 epoch: 65, train_loss: 0.3400, test_loss: 0.9696, test_f1: 0.6749
 epoch: 66, train_loss: 0.3296, test_loss: 0.9531, test_f1: 0.6537
 epoch: 67, train_loss: 0.3487, test_loss: 0.9298, test_f1: 0.6723
 epoch: 68, train_loss: 0.3206, test_loss: 1.0544, test_f1: 0.6424
 epoch: 69, train_loss: 0.3185, test_loss: 0.9926, test_f1: 0.6981
 epoch: 70, train_loss: 0.3115, test_loss: 0.9526, test_f1: 0.6634
 epoch: 71, train_loss: 0.3133, test_loss: 1.0583, test_f1: 0.6637
 epoch: 72, train_loss: 0.3174, test_loss: 1.0261, test_f1: 0.6500
 epoch: 73, train_loss: 0.3041, test_loss: 1.0453, test_f1: 0.6746
 epoch: 74, train_loss: 0.3209, test_loss: 0.9531, test_f1: 0.6810
 epoch: 75, train_loss: 0.3127, test_loss: 1.0266, test_f1: 0.6767
 epoch: 76, train_loss: 0.3079, test_loss: 1.0502, test_f1: 0.6492
 epoch: 77, train_loss: 0.2881, test_loss: 0.9991, test_f1: 0.6835
 epoch: 78, train_loss: 0.2889, test_loss: 1.0129, test_f1: 0.6692
 epoch: 79, train_loss: 0.3137, test_loss: 0.9879, test_f1: 0.6523
 epoch: 80, train_loss: 0.2985, test_loss: 1.1298, test_f1: 0.6556
 epoch: 81, train_loss: 0.2960, test_loss: 1.0418, test_f1: 0.6678
 epoch: 82, train_loss: 0.2880, test_loss: 1.0472, test_f1: 0.7046
 epoch: 83, train_loss: 0.2784, test_loss: 1.1329, test_f1: 0.6742
 epoch: 84, train_loss: 0.3019, test_loss: 1.0126, test_f1: 0.6820
 epoch: 85, train_loss: 0.2763, test_loss: 1.1095, test_f1: 0.6488
 epoch: 86, train_loss: 0.2736, test_loss: 1.0720, test_f1: 0.6680
 epoch: 87, train_loss: 0.2861, test_loss: 1.0843, test_f1: 0.6764
 epoch: 88, train_loss: 0.2818, test_loss: 1.0357, test_f1: 0.6825
 epoch: 89, train_loss: 0.2761, test_loss: 1.0540, test_f1: 0.6693
 epoch: 90, train_loss: 0.2503, test_loss: 1.1209, test_f1: 0.6533
 epoch: 91, train_loss: 0.2509, test_loss: 1.1485, test_f1: 0.6527
 epoch: 92, train_loss: 0.2667, test_loss: 1.0322, test_f1: 0.6723
 epoch: 93, train_loss: 0.2559, test_loss: 1.0831, test_f1: 0.6778
 epoch: 94, train_loss: 0.2369, test_loss: 1.1127, test_f1: 0.6676
 epoch: 95, train_loss: 0.2507, test_loss: 1.1864, test_f1: 0.6472
 epoch: 96, train_loss: 0.2398, test_loss: 1.1572, test_f1: 0.6504
 epoch: 97, train_loss: 0.2438, test_loss: 1.2208, test_f1: 0.6560
 epoch: 98, train_loss: 0.2261, test_loss: 1.2160, test_f1: 0.6565
 epoch: 99, train_loss: 0.2364, test_loss: 1.2703, test_f1: 0.6346
##################ITERATION #6 ****************************************
 epoch: 0, train_loss: 1.2776, test_loss: 1.3164, test_f1: 0.2553
 epoch: 1, train_loss: 1.0636, test_loss: 1.0130, test_f1: 0.4919
 epoch: 2, train_loss: 0.9846, test_loss: 0.9538, test_f1: 0.5557
 epoch: 3, train_loss: 0.9539, test_loss: 0.9579, test_f1: 0.4898
 epoch: 4, train_loss: 0.9162, test_loss: 0.9704, test_f1: 0.5189
 epoch: 5, train_loss: 0.8953, test_loss: 0.9366, test_f1: 0.4985
 epoch: 6, train_loss: 0.8581, test_loss: 0.8815, test_f1: 0.5257
 epoch: 7, train_loss: 0.8547, test_loss: 0.8978, test_f1: 0.5626
 epoch: 8, train_loss: 0.8145, test_loss: 0.8314, test_f1: 0.5941
 epoch: 9, train_loss: 0.8137, test_loss: 0.9008, test_f1: 0.5724
 epoch: 10, train_loss: 0.7951, test_loss: 0.8635, test_f1: 0.5893
 epoch: 11, train_loss: 0.7836, test_loss: 0.8966, test_f1: 0.5561
 epoch: 12, train_loss: 0.7706, test_loss: 0.8188, test_f1: 0.6187
 epoch: 13, train_loss: 0.7650, test_loss: 0.8080, test_f1: 0.6015
 epoch: 14, train_loss: 0.7502, test_loss: 0.8912, test_f1: 0.5675
 epoch: 15, train_loss: 0.7264, test_loss: 0.8163, test_f1: 0.6344
 epoch: 16, train_loss: 0.7137, test_loss: 0.8685, test_f1: 0.6023
 epoch: 17, train_loss: 0.6964, test_loss: 0.8084, test_f1: 0.6046
 epoch: 18, train_loss: 0.7180, test_loss: 0.8255, test_f1: 0.6265
 epoch: 19, train_loss: 0.7007, test_loss: 0.8440, test_f1: 0.6179
 epoch: 20, train_loss: 0.6725, test_loss: 0.8666, test_f1: 0.6076
 epoch: 21, train_loss: 0.6718, test_loss: 0.8093, test_f1: 0.6172
 epoch: 22, train_loss: 0.6563, test_loss: 0.8263, test_f1: 0.6003
 epoch: 23, train_loss: 0.6562, test_loss: 0.8341, test_f1: 0.6252
 epoch: 24, train_loss: 0.6434, test_loss: 0.9020, test_f1: 0.5864
 epoch: 25, train_loss: 0.6452, test_loss: 0.8181, test_f1: 0.6100
 epoch: 26, train_loss: 0.6494, test_loss: 0.8171, test_f1: 0.6087
 epoch: 27, train_loss: 0.6121, test_loss: 0.8612, test_f1: 0.6066
 epoch: 28, train_loss: 0.6196, test_loss: 0.9084, test_f1: 0.5679
 epoch: 29, train_loss: 0.6210, test_loss: 0.9771, test_f1: 0.5815
 epoch: 30, train_loss: 0.5911, test_loss: 0.8579, test_f1: 0.6296
 epoch: 31, train_loss: 0.5993, test_loss: 0.8432, test_f1: 0.6353
 epoch: 32, train_loss: 0.5892, test_loss: 0.8040, test_f1: 0.6058
 epoch: 33, train_loss: 0.5830, test_loss: 0.7658, test_f1: 0.6285
 epoch: 34, train_loss: 0.5651, test_loss: 0.7805, test_f1: 0.6449
 epoch: 35, train_loss: 0.5629, test_loss: 1.1645, test_f1: 0.5505
 epoch: 36, train_loss: 0.5840, test_loss: 0.8244, test_f1: 0.6369
 epoch: 37, train_loss: 0.5601, test_loss: 0.8019, test_f1: 0.6558
 epoch: 38, train_loss: 0.5474, test_loss: 0.8603, test_f1: 0.6314
 epoch: 39, train_loss: 0.5462, test_loss: 0.7946, test_f1: 0.6370
 epoch: 40, train_loss: 0.5179, test_loss: 0.8373, test_f1: 0.6296
 epoch: 41, train_loss: 0.4977, test_loss: 0.9859, test_f1: 0.6180
 epoch: 42, train_loss: 0.5181, test_loss: 0.7961, test_f1: 0.6713
 epoch: 43, train_loss: 0.5274, test_loss: 0.8572, test_f1: 0.6651
 epoch: 44, train_loss: 0.5121, test_loss: 1.0115, test_f1: 0.6288
 epoch: 45, train_loss: 0.4999, test_loss: 0.8454, test_f1: 0.6537
 epoch: 46, train_loss: 0.4726, test_loss: 0.9025, test_f1: 0.6451
 epoch: 47, train_loss: 0.4905, test_loss: 1.0549, test_f1: 0.5986
 epoch: 48, train_loss: 0.4910, test_loss: 0.9509, test_f1: 0.5881
 epoch: 49, train_loss: 0.4618, test_loss: 1.0410, test_f1: 0.5994
 epoch: 50, train_loss: 0.4711, test_loss: 1.0117, test_f1: 0.6147
 epoch: 51, train_loss: 0.4394, test_loss: 0.8823, test_f1: 0.6509
 epoch: 52, train_loss: 0.4062, test_loss: 0.9362, test_f1: 0.6529
 epoch: 53, train_loss: 0.3999, test_loss: 0.9609, test_f1: 0.6416
 epoch: 54, train_loss: 0.3981, test_loss: 0.9242, test_f1: 0.6384
 epoch: 55, train_loss: 0.3974, test_loss: 0.9608, test_f1: 0.6227
 epoch: 56, train_loss: 0.3939, test_loss: 0.9587, test_f1: 0.6428
 epoch: 57, train_loss: 0.3868, test_loss: 1.0069, test_f1: 0.6305
 epoch: 58, train_loss: 0.3799, test_loss: 0.9031, test_f1: 0.6435
 epoch: 59, train_loss: 0.3924, test_loss: 0.8863, test_f1: 0.6451
 epoch: 60, train_loss: 0.3765, test_loss: 1.0178, test_f1: 0.6237
 epoch: 61, train_loss: 0.3664, test_loss: 0.9764, test_f1: 0.6604
 epoch: 62, train_loss: 0.3574, test_loss: 0.9779, test_f1: 0.6749
 epoch: 63, train_loss: 0.3530, test_loss: 0.9835, test_f1: 0.6503
 epoch: 64, train_loss: 0.3605, test_loss: 0.9899, test_f1: 0.6578
 epoch: 65, train_loss: 0.3584, test_loss: 0.9616, test_f1: 0.6607
 epoch: 66, train_loss: 0.3394, test_loss: 1.0401, test_f1: 0.6438
 epoch: 67, train_loss: 0.3533, test_loss: 1.0299, test_f1: 0.6545
 epoch: 68, train_loss: 0.3412, test_loss: 1.0666, test_f1: 0.6359
 epoch: 69, train_loss: 0.3343, test_loss: 1.0754, test_f1: 0.6367
 epoch: 70, train_loss: 0.3377, test_loss: 1.0206, test_f1: 0.6315
 epoch: 71, train_loss: 0.3451, test_loss: 1.0187, test_f1: 0.6453
 epoch: 72, train_loss: 0.3451, test_loss: 1.0908, test_f1: 0.6332
 epoch: 73, train_loss: 0.3307, test_loss: 1.0268, test_f1: 0.6551
 epoch: 74, train_loss: 0.3092, test_loss: 1.0483, test_f1: 0.6669
 epoch: 75, train_loss: 0.3253, test_loss: 1.1543, test_f1: 0.6455
 epoch: 76, train_loss: 0.3124, test_loss: 1.1766, test_f1: 0.6268
 epoch: 77, train_loss: 0.3249, test_loss: 1.1840, test_f1: 0.6379
 epoch: 78, train_loss: 0.3080, test_loss: 1.1718, test_f1: 0.6207
 epoch: 79, train_loss: 0.3228, test_loss: 1.1015, test_f1: 0.6446
 epoch: 80, train_loss: 0.3063, test_loss: 1.1027, test_f1: 0.6572
 epoch: 81, train_loss: 0.3074, test_loss: 1.0425, test_f1: 0.6558
 epoch: 82, train_loss: 0.3005, test_loss: 1.1697, test_f1: 0.6645
 epoch: 83, train_loss: 0.2962, test_loss: 1.1064, test_f1: 0.6516
 epoch: 84, train_loss: 0.2977, test_loss: 1.1142, test_f1: 0.6481
 epoch: 85, train_loss: 0.2765, test_loss: 1.1646, test_f1: 0.6632
 epoch: 86, train_loss: 0.3035, test_loss: 1.1509, test_f1: 0.6388
 epoch: 87, train_loss: 0.2963, test_loss: 1.0871, test_f1: 0.6382
 epoch: 88, train_loss: 0.2891, test_loss: 1.1230, test_f1: 0.6472
 epoch: 89, train_loss: 0.2765, test_loss: 1.1935, test_f1: 0.6419
 epoch: 90, train_loss: 0.2901, test_loss: 1.1943, test_f1: 0.6642
 epoch: 91, train_loss: 0.2845, test_loss: 1.1470, test_f1: 0.6698
 epoch: 92, train_loss: 0.2819, test_loss: 1.1521, test_f1: 0.6624
 epoch: 93, train_loss: 0.2681, test_loss: 1.2699, test_f1: 0.6222
 epoch: 94, train_loss: 0.2765, test_loss: 1.1907, test_f1: 0.6506
 epoch: 95, train_loss: 0.2854, test_loss: 1.2376, test_f1: 0.6013
 epoch: 96, train_loss: 0.2669, test_loss: 1.1310, test_f1: 0.6637
 epoch: 97, train_loss: 0.2844, test_loss: 1.2407, test_f1: 0.6231
 epoch: 98, train_loss: 0.2773, test_loss: 1.1661, test_f1: 0.6365
 epoch: 99, train_loss: 0.2521, test_loss: 1.2078, test_f1: 0.6580
##################ITERATION #7 ****************************************
 epoch: 0, train_loss: 1.3807, test_loss: 1.2735, test_f1: 0.2311
 epoch: 1, train_loss: 1.0775, test_loss: 0.9843, test_f1: 0.5052
 epoch: 2, train_loss: 1.0107, test_loss: 0.9321, test_f1: 0.5278
 epoch: 3, train_loss: 0.9813, test_loss: 0.8849, test_f1: 0.5815
 epoch: 4, train_loss: 0.9469, test_loss: 0.8768, test_f1: 0.5551
 epoch: 5, train_loss: 0.9242, test_loss: 0.9212, test_f1: 0.5712
 epoch: 6, train_loss: 0.9111, test_loss: 0.9300, test_f1: 0.5276
 epoch: 7, train_loss: 0.9057, test_loss: 0.8983, test_f1: 0.5891
 epoch: 8, train_loss: 0.8711, test_loss: 0.8787, test_f1: 0.5895
 epoch: 9, train_loss: 0.8488, test_loss: 0.8955, test_f1: 0.5749
 epoch: 10, train_loss: 0.8422, test_loss: 0.9000, test_f1: 0.5510
 epoch: 11, train_loss: 0.8258, test_loss: 0.8725, test_f1: 0.5952
 epoch: 12, train_loss: 0.7840, test_loss: 0.8547, test_f1: 0.5945
 epoch: 13, train_loss: 0.7830, test_loss: 0.8625, test_f1: 0.6248
 epoch: 14, train_loss: 0.7891, test_loss: 0.9155, test_f1: 0.6152
 epoch: 15, train_loss: 0.7743, test_loss: 0.8570, test_f1: 0.6201
 epoch: 16, train_loss: 0.7541, test_loss: 0.8633, test_f1: 0.6309
 epoch: 17, train_loss: 0.7379, test_loss: 0.8134, test_f1: 0.5888
 epoch: 18, train_loss: 0.7380, test_loss: 0.9264, test_f1: 0.5740
 epoch: 19, train_loss: 0.7128, test_loss: 0.9741, test_f1: 0.5581
 epoch: 20, train_loss: 0.7282, test_loss: 0.8630, test_f1: 0.5810
 epoch: 21, train_loss: 0.7078, test_loss: 0.8780, test_f1: 0.5866
 epoch: 22, train_loss: 0.6898, test_loss: 0.9005, test_f1: 0.6003
 epoch: 23, train_loss: 0.6629, test_loss: 0.8913, test_f1: 0.5975
 epoch: 24, train_loss: 0.6617, test_loss: 0.8430, test_f1: 0.6227
 epoch: 25, train_loss: 0.6773, test_loss: 0.7947, test_f1: 0.6414
 epoch: 26, train_loss: 0.6654, test_loss: 0.8096, test_f1: 0.6655
 epoch: 27, train_loss: 0.6397, test_loss: 0.9026, test_f1: 0.5891
 epoch: 28, train_loss: 0.6427, test_loss: 0.7894, test_f1: 0.6328
 epoch: 29, train_loss: 0.6351, test_loss: 0.7832, test_f1: 0.6360
 epoch: 30, train_loss: 0.6222, test_loss: 0.8421, test_f1: 0.6194
 epoch: 31, train_loss: 0.6150, test_loss: 0.8949, test_f1: 0.6272
 epoch: 32, train_loss: 0.5955, test_loss: 0.7684, test_f1: 0.6493
 epoch: 33, train_loss: 0.5945, test_loss: 0.9255, test_f1: 0.6113
 epoch: 34, train_loss: 0.5736, test_loss: 0.8551, test_f1: 0.6348
 epoch: 35, train_loss: 0.5843, test_loss: 1.0027, test_f1: 0.6093
 epoch: 36, train_loss: 0.5677, test_loss: 0.9004, test_f1: 0.6160
 epoch: 37, train_loss: 0.5665, test_loss: 0.8743, test_f1: 0.6368
 epoch: 38, train_loss: 0.5392, test_loss: 0.8346, test_f1: 0.6607
 epoch: 39, train_loss: 0.5412, test_loss: 0.8194, test_f1: 0.6583
 epoch: 40, train_loss: 0.5221, test_loss: 0.8240, test_f1: 0.6468
 epoch: 41, train_loss: 0.5228, test_loss: 0.8466, test_f1: 0.6577
 epoch: 42, train_loss: 0.5156, test_loss: 0.8310, test_f1: 0.6192
 epoch: 43, train_loss: 0.5092, test_loss: 0.8907, test_f1: 0.6371
 epoch: 44, train_loss: 0.5471, test_loss: 0.8833, test_f1: 0.6008
 epoch: 45, train_loss: 0.5226, test_loss: 0.8767, test_f1: 0.6525
 epoch: 46, train_loss: 0.5086, test_loss: 0.8265, test_f1: 0.6469
 epoch: 47, train_loss: 0.5072, test_loss: 0.8163, test_f1: 0.6689
 epoch: 48, train_loss: 0.4993, test_loss: 0.8598, test_f1: 0.6371
 epoch: 49, train_loss: 0.4960, test_loss: 0.8447, test_f1: 0.6531
 epoch: 50, train_loss: 0.4877, test_loss: 0.9367, test_f1: 0.5811
 epoch: 51, train_loss: 0.4655, test_loss: 0.8606, test_f1: 0.6444
 epoch: 52, train_loss: 0.4390, test_loss: 0.8581, test_f1: 0.6454
 epoch: 53, train_loss: 0.4206, test_loss: 0.8225, test_f1: 0.6778
 epoch: 54, train_loss: 0.4230, test_loss: 0.8319, test_f1: 0.6627
 epoch: 55, train_loss: 0.3994, test_loss: 0.8521, test_f1: 0.6684
 epoch: 56, train_loss: 0.4004, test_loss: 0.8777, test_f1: 0.6890
 epoch: 57, train_loss: 0.3976, test_loss: 0.8762, test_f1: 0.6601
 epoch: 58, train_loss: 0.3983, test_loss: 0.8824, test_f1: 0.6627
 epoch: 59, train_loss: 0.3838, test_loss: 0.9212, test_f1: 0.6721
 epoch: 60, train_loss: 0.3805, test_loss: 0.9036, test_f1: 0.6618
 epoch: 61, train_loss: 0.3916, test_loss: 0.9491, test_f1: 0.6486
 epoch: 62, train_loss: 0.3863, test_loss: 0.9150, test_f1: 0.6689
 epoch: 63, train_loss: 0.3768, test_loss: 0.9811, test_f1: 0.6612
 epoch: 64, train_loss: 0.3573, test_loss: 0.8930, test_f1: 0.6921
 epoch: 65, train_loss: 0.3801, test_loss: 1.0351, test_f1: 0.6623
 epoch: 66, train_loss: 0.3647, test_loss: 0.9512, test_f1: 0.6764
 epoch: 67, train_loss: 0.3655, test_loss: 0.9445, test_f1: 0.6789
 epoch: 68, train_loss: 0.3584, test_loss: 0.9974, test_f1: 0.6555
 epoch: 69, train_loss: 0.3743, test_loss: 1.0052, test_f1: 0.6622
 epoch: 70, train_loss: 0.3661, test_loss: 1.0573, test_f1: 0.6431
 epoch: 71, train_loss: 0.3486, test_loss: 0.9779, test_f1: 0.6728
 epoch: 72, train_loss: 0.3639, test_loss: 1.0875, test_f1: 0.6623
 epoch: 73, train_loss: 0.3337, test_loss: 1.0169, test_f1: 0.6501
 epoch: 74, train_loss: 0.3483, test_loss: 1.0010, test_f1: 0.6634
 epoch: 75, train_loss: 0.3450, test_loss: 1.0620, test_f1: 0.6814
 epoch: 76, train_loss: 0.3370, test_loss: 1.0133, test_f1: 0.6854
 epoch: 77, train_loss: 0.3220, test_loss: 1.0217, test_f1: 0.6752
 epoch: 78, train_loss: 0.3242, test_loss: 1.0325, test_f1: 0.7047
 epoch: 79, train_loss: 0.3300, test_loss: 1.0890, test_f1: 0.6670
 epoch: 80, train_loss: 0.3382, test_loss: 1.1054, test_f1: 0.6786
 epoch: 81, train_loss: 0.3286, test_loss: 1.1020, test_f1: 0.6477
 epoch: 82, train_loss: 0.3103, test_loss: 1.0402, test_f1: 0.6901
 epoch: 83, train_loss: 0.3110, test_loss: 1.0877, test_f1: 0.6833
 epoch: 84, train_loss: 0.2890, test_loss: 1.0217, test_f1: 0.6685
 epoch: 85, train_loss: 0.3038, test_loss: 1.0699, test_f1: 0.6921
 epoch: 86, train_loss: 0.2949, test_loss: 1.0985, test_f1: 0.6696
 epoch: 87, train_loss: 0.3077, test_loss: 1.0682, test_f1: 0.6933
 epoch: 88, train_loss: 0.3029, test_loss: 1.1010, test_f1: 0.6668
 epoch: 89, train_loss: 0.3072, test_loss: 1.1932, test_f1: 0.6457
 epoch: 90, train_loss: 0.2999, test_loss: 1.1465, test_f1: 0.6707
 epoch: 91, train_loss: 0.2893, test_loss: 1.1837, test_f1: 0.6399
 epoch: 92, train_loss: 0.2717, test_loss: 1.2567, test_f1: 0.6481
 epoch: 93, train_loss: 0.2705, test_loss: 1.1079, test_f1: 0.6711
 epoch: 94, train_loss: 0.2726, test_loss: 1.1724, test_f1: 0.6615
 epoch: 95, train_loss: 0.2703, test_loss: 1.1356, test_f1: 0.6752
 epoch: 96, train_loss: 0.2665, test_loss: 1.2121, test_f1: 0.6648
 epoch: 97, train_loss: 0.2783, test_loss: 1.2794, test_f1: 0.6648
 epoch: 98, train_loss: 0.2973, test_loss: 1.1273, test_f1: 0.6366
 epoch: 99, train_loss: 0.3052, test_loss: 1.1499, test_f1: 0.6783
##################ITERATION #8 ****************************************
 epoch: 0, train_loss: 1.3061, test_loss: 1.1954, test_f1: 0.2769
 epoch: 1, train_loss: 1.0245, test_loss: 1.0406, test_f1: 0.4370
 epoch: 2, train_loss: 0.9962, test_loss: 1.0135, test_f1: 0.5062
 epoch: 3, train_loss: 0.9485, test_loss: 0.9998, test_f1: 0.5355
 epoch: 4, train_loss: 0.9110, test_loss: 0.9680, test_f1: 0.5866
 epoch: 5, train_loss: 0.8992, test_loss: 1.0810, test_f1: 0.5215
 epoch: 6, train_loss: 0.8736, test_loss: 0.9621, test_f1: 0.5433
 epoch: 7, train_loss: 0.8558, test_loss: 1.1409, test_f1: 0.5136
 epoch: 8, train_loss: 0.8293, test_loss: 0.9551, test_f1: 0.5888
 epoch: 9, train_loss: 0.8271, test_loss: 0.9313, test_f1: 0.5903
 epoch: 10, train_loss: 0.7958, test_loss: 0.8968, test_f1: 0.6027
 epoch: 11, train_loss: 0.7785, test_loss: 0.8859, test_f1: 0.5844
 epoch: 12, train_loss: 0.7740, test_loss: 0.8936, test_f1: 0.6048
 epoch: 13, train_loss: 0.7702, test_loss: 1.0164, test_f1: 0.5844
 epoch: 14, train_loss: 0.7720, test_loss: 0.9432, test_f1: 0.5760
 epoch: 15, train_loss: 0.7549, test_loss: 0.9424, test_f1: 0.5981
 epoch: 16, train_loss: 0.7296, test_loss: 0.8853, test_f1: 0.6088
 epoch: 17, train_loss: 0.7280, test_loss: 0.8944, test_f1: 0.5952
 epoch: 18, train_loss: 0.7103, test_loss: 0.9170, test_f1: 0.5869
 epoch: 19, train_loss: 0.7086, test_loss: 0.9113, test_f1: 0.5769
 epoch: 20, train_loss: 0.7020, test_loss: 0.8378, test_f1: 0.6256
 epoch: 21, train_loss: 0.6822, test_loss: 0.8691, test_f1: 0.6166
 epoch: 22, train_loss: 0.6715, test_loss: 0.9129, test_f1: 0.5960
 epoch: 23, train_loss: 0.6663, test_loss: 0.9291, test_f1: 0.5823
 epoch: 24, train_loss: 0.6676, test_loss: 0.8744, test_f1: 0.6138
 epoch: 25, train_loss: 0.6494, test_loss: 0.9836, test_f1: 0.6047
 epoch: 26, train_loss: 0.6364, test_loss: 0.9536, test_f1: 0.6130
 epoch: 27, train_loss: 0.6291, test_loss: 0.8743, test_f1: 0.5993
 epoch: 28, train_loss: 0.6353, test_loss: 0.8148, test_f1: 0.6374
 epoch: 29, train_loss: 0.6215, test_loss: 0.9327, test_f1: 0.5890
 epoch: 30, train_loss: 0.6063, test_loss: 1.0081, test_f1: 0.5723
 epoch: 31, train_loss: 0.6037, test_loss: 0.8518, test_f1: 0.6434
 epoch: 32, train_loss: 0.5877, test_loss: 0.9283, test_f1: 0.6148
 epoch: 33, train_loss: 0.5916, test_loss: 0.8750, test_f1: 0.6275
 epoch: 34, train_loss: 0.5752, test_loss: 1.0834, test_f1: 0.5744
 epoch: 35, train_loss: 0.5663, test_loss: 1.1718, test_f1: 0.5789
 epoch: 36, train_loss: 0.5899, test_loss: 1.0023, test_f1: 0.6038
 epoch: 37, train_loss: 0.5650, test_loss: 0.8669, test_f1: 0.6200
 epoch: 38, train_loss: 0.5302, test_loss: 0.8720, test_f1: 0.6211
 epoch: 39, train_loss: 0.5289, test_loss: 0.9590, test_f1: 0.6111
 epoch: 40, train_loss: 0.5105, test_loss: 0.8407, test_f1: 0.6448
 epoch: 41, train_loss: 0.5279, test_loss: 0.8874, test_f1: 0.6507
 epoch: 42, train_loss: 0.5248, test_loss: 0.9963, test_f1: 0.6139
 epoch: 43, train_loss: 0.4915, test_loss: 0.9066, test_f1: 0.6340
 epoch: 44, train_loss: 0.5270, test_loss: 0.8840, test_f1: 0.6273
 epoch: 45, train_loss: 0.5016, test_loss: 1.0952, test_f1: 0.6145
 epoch: 46, train_loss: 0.5061, test_loss: 0.8866, test_f1: 0.6565
 epoch: 47, train_loss: 0.4922, test_loss: 1.0528, test_f1: 0.6333
 epoch: 48, train_loss: 0.4952, test_loss: 0.9197, test_f1: 0.6454
 epoch: 49, train_loss: 0.4888, test_loss: 1.0341, test_f1: 0.6076
 epoch: 50, train_loss: 0.4872, test_loss: 0.9017, test_f1: 0.6100
 epoch: 51, train_loss: 0.4405, test_loss: 0.9012, test_f1: 0.6684
 epoch: 52, train_loss: 0.4078, test_loss: 0.9765, test_f1: 0.6534
 epoch: 53, train_loss: 0.3989, test_loss: 0.8871, test_f1: 0.6704
 epoch: 54, train_loss: 0.3963, test_loss: 0.8965, test_f1: 0.6583
 epoch: 55, train_loss: 0.3973, test_loss: 0.9544, test_f1: 0.6806
 epoch: 56, train_loss: 0.3849, test_loss: 0.9747, test_f1: 0.6546
 epoch: 57, train_loss: 0.3999, test_loss: 0.9970, test_f1: 0.6579
 epoch: 58, train_loss: 0.4049, test_loss: 0.9904, test_f1: 0.6666
 epoch: 59, train_loss: 0.3658, test_loss: 0.9707, test_f1: 0.6782
 epoch: 60, train_loss: 0.3567, test_loss: 1.0550, test_f1: 0.6503
 epoch: 61, train_loss: 0.3701, test_loss: 0.9679, test_f1: 0.6645
 epoch: 62, train_loss: 0.3675, test_loss: 0.9569, test_f1: 0.6494
 epoch: 63, train_loss: 0.3677, test_loss: 1.0375, test_f1: 0.6555
 epoch: 64, train_loss: 0.3557, test_loss: 1.0056, test_f1: 0.6634
 epoch: 65, train_loss: 0.3748, test_loss: 1.0059, test_f1: 0.6840
 epoch: 66, train_loss: 0.3546, test_loss: 1.1024, test_f1: 0.6412
 epoch: 67, train_loss: 0.3478, test_loss: 1.0193, test_f1: 0.6643
 epoch: 68, train_loss: 0.3543, test_loss: 1.0047, test_f1: 0.6487
 epoch: 69, train_loss: 0.3431, test_loss: 1.0805, test_f1: 0.6475
 epoch: 70, train_loss: 0.3354, test_loss: 1.0840, test_f1: 0.6410
 epoch: 71, train_loss: 0.3264, test_loss: 1.0513, test_f1: 0.6625
 epoch: 72, train_loss: 0.3341, test_loss: 1.1114, test_f1: 0.6581
 epoch: 73, train_loss: 0.3314, test_loss: 0.9741, test_f1: 0.6840
 epoch: 74, train_loss: 0.3207, test_loss: 1.2007, test_f1: 0.6368
 epoch: 75, train_loss: 0.3349, test_loss: 1.0563, test_f1: 0.6461
 epoch: 76, train_loss: 0.3272, test_loss: 0.9922, test_f1: 0.6553
 epoch: 77, train_loss: 0.3374, test_loss: 1.1260, test_f1: 0.6383
 epoch: 78, train_loss: 0.3328, test_loss: 1.0803, test_f1: 0.6506
 epoch: 79, train_loss: 0.3276, test_loss: 1.0742, test_f1: 0.6702
 epoch: 80, train_loss: 0.3062, test_loss: 1.1004, test_f1: 0.6631
 epoch: 81, train_loss: 0.3216, test_loss: 1.2559, test_f1: 0.6526
 epoch: 82, train_loss: 0.3160, test_loss: 1.1595, test_f1: 0.6565
 epoch: 83, train_loss: 0.2889, test_loss: 1.1335, test_f1: 0.6472
 epoch: 84, train_loss: 0.3081, test_loss: 1.2199, test_f1: 0.6259
 epoch: 85, train_loss: 0.3070, test_loss: 1.0490, test_f1: 0.6749
 epoch: 86, train_loss: 0.2961, test_loss: 1.2049, test_f1: 0.6282
 epoch: 87, train_loss: 0.2963, test_loss: 1.1806, test_f1: 0.6464
 epoch: 88, train_loss: 0.2821, test_loss: 1.3338, test_f1: 0.6318
 epoch: 89, train_loss: 0.2808, test_loss: 1.2780, test_f1: 0.6424
 epoch: 90, train_loss: 0.2841, test_loss: 1.1447, test_f1: 0.6710
 epoch: 91, train_loss: 0.2756, test_loss: 1.2378, test_f1: 0.6352
 epoch: 92, train_loss: 0.2813, test_loss: 1.2145, test_f1: 0.6541
 epoch: 93, train_loss: 0.2663, test_loss: 1.2858, test_f1: 0.6278
 epoch: 94, train_loss: 0.2734, test_loss: 1.2004, test_f1: 0.6668
 epoch: 95, train_loss: 0.2828, test_loss: 1.2733, test_f1: 0.6250
 epoch: 96, train_loss: 0.2692, test_loss: 1.2733, test_f1: 0.6419
 epoch: 97, train_loss: 0.2651, test_loss: 1.1875, test_f1: 0.6463
 epoch: 98, train_loss: 0.2607, test_loss: 1.2710, test_f1: 0.6638
 epoch: 99, train_loss: 0.2603, test_loss: 1.2943, test_f1: 0.6246
##################ITERATION #9 ****************************************
 epoch: 0, train_loss: 1.5882, test_loss: 1.4009, test_f1: 0.2174
 epoch: 1, train_loss: 1.1207, test_loss: 1.0649, test_f1: 0.4843
 epoch: 2, train_loss: 1.0414, test_loss: 0.9483, test_f1: 0.4918
 epoch: 3, train_loss: 0.9857, test_loss: 0.9151, test_f1: 0.5395
 epoch: 4, train_loss: 0.9449, test_loss: 0.9190, test_f1: 0.5097
 epoch: 5, train_loss: 0.9387, test_loss: 0.9482, test_f1: 0.5458
 epoch: 6, train_loss: 0.9039, test_loss: 0.9417, test_f1: 0.5196
 epoch: 7, train_loss: 0.8978, test_loss: 0.9247, test_f1: 0.5217
 epoch: 8, train_loss: 0.8749, test_loss: 0.9704, test_f1: 0.5551
 epoch: 9, train_loss: 0.8633, test_loss: 0.9523, test_f1: 0.5611
 epoch: 10, train_loss: 0.8471, test_loss: 0.9518, test_f1: 0.5459
 epoch: 11, train_loss: 0.8278, test_loss: 0.9351, test_f1: 0.5263
 epoch: 12, train_loss: 0.8264, test_loss: 0.9331, test_f1: 0.5698
 epoch: 13, train_loss: 0.8119, test_loss: 0.8943, test_f1: 0.5753
 epoch: 14, train_loss: 0.7828, test_loss: 0.9248, test_f1: 0.5641
 epoch: 15, train_loss: 0.7876, test_loss: 0.9195, test_f1: 0.5755
 epoch: 16, train_loss: 0.7789, test_loss: 0.9267, test_f1: 0.5819
 epoch: 17, train_loss: 0.7619, test_loss: 0.8657, test_f1: 0.5928
 epoch: 18, train_loss: 0.7761, test_loss: 0.9813, test_f1: 0.5571
 epoch: 19, train_loss: 0.7620, test_loss: 0.9411, test_f1: 0.5399
 epoch: 20, train_loss: 0.7286, test_loss: 0.9438, test_f1: 0.5507
 epoch: 21, train_loss: 0.7332, test_loss: 1.7963, test_f1: 0.4187
 epoch: 22, train_loss: 0.7041, test_loss: 0.9294, test_f1: 0.5848
 epoch: 23, train_loss: 0.7108, test_loss: 0.9589, test_f1: 0.6072
 epoch: 24, train_loss: 0.7045, test_loss: 1.1005, test_f1: 0.5485
 epoch: 25, train_loss: 0.6903, test_loss: 0.8773, test_f1: 0.6152
 epoch: 26, train_loss: 0.6696, test_loss: 0.8437, test_f1: 0.6164
 epoch: 27, train_loss: 0.6573, test_loss: 0.8857, test_f1: 0.6425
 epoch: 28, train_loss: 0.6829, test_loss: 1.3096, test_f1: 0.5053
 epoch: 29, train_loss: 0.6507, test_loss: 0.9360, test_f1: 0.6154
 epoch: 30, train_loss: 0.6305, test_loss: 0.9610, test_f1: 0.5955
 epoch: 31, train_loss: 0.6246, test_loss: 1.0541, test_f1: 0.5864
 epoch: 32, train_loss: 0.6127, test_loss: 0.8857, test_f1: 0.6223
 epoch: 33, train_loss: 0.6133, test_loss: 0.9297, test_f1: 0.6110
 epoch: 34, train_loss: 0.6274, test_loss: 0.8865, test_f1: 0.6365
 epoch: 35, train_loss: 0.5902, test_loss: 0.8694, test_f1: 0.6756
 epoch: 36, train_loss: 0.6011, test_loss: 0.8957, test_f1: 0.6369
 epoch: 37, train_loss: 0.6076, test_loss: 0.9199, test_f1: 0.6370
 epoch: 38, train_loss: 0.5831, test_loss: 0.8545, test_f1: 0.6551
 epoch: 39, train_loss: 0.5755, test_loss: 0.8638, test_f1: 0.6660
 epoch: 40, train_loss: 0.5691, test_loss: 0.9914, test_f1: 0.6315
 epoch: 41, train_loss: 0.5614, test_loss: 0.8887, test_f1: 0.6562
 epoch: 42, train_loss: 0.5516, test_loss: 0.8550, test_f1: 0.6849
 epoch: 43, train_loss: 0.5394, test_loss: 0.8737, test_f1: 0.6609
 epoch: 44, train_loss: 0.5319, test_loss: 1.0865, test_f1: 0.5897
 epoch: 45, train_loss: 0.5299, test_loss: 0.8502, test_f1: 0.6535
 epoch: 46, train_loss: 0.5270, test_loss: 0.9346, test_f1: 0.6417
 epoch: 47, train_loss: 0.5221, test_loss: 0.9822, test_f1: 0.6650
 epoch: 48, train_loss: 0.5162, test_loss: 1.1711, test_f1: 0.6101
 epoch: 49, train_loss: 0.4992, test_loss: 0.9582, test_f1: 0.6724
 epoch: 50, train_loss: 0.5000, test_loss: 1.0621, test_f1: 0.6169
 epoch: 51, train_loss: 0.4696, test_loss: 0.8566, test_f1: 0.6891
 epoch: 52, train_loss: 0.4231, test_loss: 0.8823, test_f1: 0.6936
 epoch: 53, train_loss: 0.4131, test_loss: 0.8861, test_f1: 0.6950
 epoch: 54, train_loss: 0.4062, test_loss: 0.9585, test_f1: 0.6663
 epoch: 55, train_loss: 0.4047, test_loss: 0.9511, test_f1: 0.6798
 epoch: 56, train_loss: 0.4037, test_loss: 0.9227, test_f1: 0.6835
 epoch: 57, train_loss: 0.4015, test_loss: 0.9308, test_f1: 0.6954
 epoch: 58, train_loss: 0.4033, test_loss: 0.9294, test_f1: 0.7091
 epoch: 59, train_loss: 0.3953, test_loss: 1.0061, test_f1: 0.6509
 epoch: 60, train_loss: 0.3850, test_loss: 0.9360, test_f1: 0.6782
 epoch: 61, train_loss: 0.3747, test_loss: 1.0065, test_f1: 0.6748
 epoch: 62, train_loss: 0.3750, test_loss: 1.1427, test_f1: 0.6374
 epoch: 63, train_loss: 0.3724, test_loss: 1.0402, test_f1: 0.6668
 epoch: 64, train_loss: 0.3785, test_loss: 1.0257, test_f1: 0.6623
 epoch: 65, train_loss: 0.3839, test_loss: 0.9821, test_f1: 0.6799
 epoch: 66, train_loss: 0.3721, test_loss: 0.9757, test_f1: 0.6679
 epoch: 67, train_loss: 0.3717, test_loss: 1.0628, test_f1: 0.6782
 epoch: 68, train_loss: 0.3652, test_loss: 1.0766, test_f1: 0.6782
 epoch: 69, train_loss: 0.3588, test_loss: 1.0005, test_f1: 0.7235
 epoch: 70, train_loss: 0.3628, test_loss: 1.0871, test_f1: 0.6639
 epoch: 71, train_loss: 0.3330, test_loss: 1.0166, test_f1: 0.6879
 epoch: 72, train_loss: 0.3189, test_loss: 1.0061, test_f1: 0.6887
 epoch: 73, train_loss: 0.3339, test_loss: 1.1076, test_f1: 0.6535
 epoch: 74, train_loss: 0.3415, test_loss: 1.0671, test_f1: 0.6853
 epoch: 75, train_loss: 0.3317, test_loss: 1.1082, test_f1: 0.6607
 epoch: 76, train_loss: 0.3157, test_loss: 1.1126, test_f1: 0.6760
 epoch: 77, train_loss: 0.3440, test_loss: 1.1889, test_f1: 0.6630
 epoch: 78, train_loss: 0.3419, test_loss: 1.1467, test_f1: 0.6619
 epoch: 79, train_loss: 0.3217, test_loss: 1.2117, test_f1: 0.6383
 epoch: 80, train_loss: 0.3086, test_loss: 1.2344, test_f1: 0.6537
 epoch: 81, train_loss: 0.3065, test_loss: 1.1635, test_f1: 0.6871
 epoch: 82, train_loss: 0.2951, test_loss: 1.1373, test_f1: 0.6850
 epoch: 83, train_loss: 0.2994, test_loss: 1.1664, test_f1: 0.6758
 epoch: 84, train_loss: 0.2978, test_loss: 1.2168, test_f1: 0.6668
 epoch: 85, train_loss: 0.3092, test_loss: 1.2048, test_f1: 0.6802
 epoch: 86, train_loss: 0.2933, test_loss: 1.1746, test_f1: 0.6620
 epoch: 87, train_loss: 0.2790, test_loss: 1.3246, test_f1: 0.6315
 epoch: 88, train_loss: 0.2656, test_loss: 1.2661, test_f1: 0.6729
 epoch: 89, train_loss: 0.2694, test_loss: 1.1871, test_f1: 0.6804
 epoch: 90, train_loss: 0.2997, test_loss: 1.3059, test_f1: 0.6124
 epoch: 91, train_loss: 0.2783, test_loss: 1.2008, test_f1: 0.6811
 epoch: 92, train_loss: 0.2795, test_loss: 1.2020, test_f1: 0.6956
 epoch: 93, train_loss: 0.2688, test_loss: 1.2043, test_f1: 0.6723
 epoch: 94, train_loss: 0.2504, test_loss: 1.2945, test_f1: 0.6584
 epoch: 95, train_loss: 0.2598, test_loss: 1.2755, test_f1: 0.6707
 epoch: 96, train_loss: 0.2686, test_loss: 1.2002, test_f1: 0.7130
 epoch: 97, train_loss: 0.3021, test_loss: 1.2691, test_f1: 0.6779
 epoch: 98, train_loss: 0.2739, test_loss: 1.1978, test_f1: 0.6791
 epoch: 99, train_loss: 0.2607, test_loss: 1.2960, test_f1: 0.6646

Training completed in 545.84 seconds
Best F1: 0.7235 at epoch 69
Mean F1 across iterations: 0.6897  0.0179
========================FINAL RESULTS================================
FEGIN weighted F1: 0.7235  0.0179
python main.py --data ltspice_examples --representation component_pin --model FEGIN --layers 5 --hiddens 64 --batch_size 128 --lr 0.001 --emb_size 250 --epochs 100 --save_appendix component_pin_L5_H64_BS128_LR0.001_E250 --no_val
-----



STDERR:
  File "main.py", line 370, in <module>
    main()
  File "main.py", line 254, in main
    dataset = dataset_class(
  File "/home/philip/projects/ltspice_examples_code_repo/Circuit-Completion-Using-GNNs/component_classification_with_link_prediction_head/evaluation/FEGIN/kernel/circuit_datasets.py", line 15, in __init__
    self.data, self.slices = torch.load(self.processed_paths[0])
  File "/home/philip/.local/lib/python3.8/site-packages/torch/serialization.py", line 1040, in load
    warnings.warn(
  File "/usr/lib/python3.8/warnings.py", line 109, in _showwarnmsg
    sw(msg.message, msg.category, msg.filename, msg.lineno,
  File "main.py", line 47, in warn_with_traceback
    traceback.print_stack(file=log)
/home/philip/projects/ltspice_examples_code_repo/Circuit-Completion-Using-GNNs/component_classification_with_link_prediction_head/evaluation/FEGIN/kernel/circuit_datasets.py:15: FutureWarning: You are using `torch.load` with `weights_only=False` (the current default value), which uses the default pickle module implicitly. It is possible to construct malicious pickle data which will execute arbitrary code during unpickling (See https://github.com/pytorch/pytorch/blob/main/SECURITY.md#untrusted-models for more details). In a future release, the default value for `weights_only` will be flipped to `True`. This limits the functions that could be executed during unpickling. Arbitrary objects will no longer be allowed to be loaded via this mode unless they are explicitly allowlisted by the user via `torch.serialization.add_safe_globals`. We recommend you start setting `weights_only=True` for any use case where you don't have full control of the loaded file. Please open an issue on GitHub for any issues related to this experimental feature.
  self.data, self.slices = torch.load(self.processed_paths[0])
