STDOUT:
Results will be saved in /home/philip/projects/ltspice_examples_code_repo/Circuit-Completion-Using-GNNs/component_classification_with_link_prediction_head/evaluation/FEGIN/results/model_FEGIN_dataset_ltspice_examples
Command line input: python main.py --data ltspice_examples --representation component_pin --model FEGIN --layers 6 --hiddens 16 --batch_size 256 --lr 0.0001 --emb_size 512 --epochs 100 --save_appendix component_pin_L6_H16_BS256_LR0.0001_E512 --no_val
 is saved.
-----
ltspice_examples - FEGIN
Using 6 layers, 16 hidden units, h = 2
Loading component_pin representation dataset
ENTERED
Training FEGIN on component_pin representation
Train: 3560, Test: 848
##################ITERATION #0 ****************************************
 epoch: 0, train_loss: 1.4665, test_loss: 1.4547, test_f1: 0.0789
 epoch: 1, train_loss: 1.4638, test_loss: 1.4529, test_f1: 0.0789
 epoch: 2, train_loss: 1.4622, test_loss: 1.4514, test_f1: 0.0789
 epoch: 3, train_loss: 1.4605, test_loss: 1.4498, test_f1: 0.0789
 epoch: 4, train_loss: 1.4590, test_loss: 1.4484, test_f1: 0.0789
 epoch: 5, train_loss: 1.4574, test_loss: 1.4469, test_f1: 0.0789
 epoch: 6, train_loss: 1.4557, test_loss: 1.4453, test_f1: 0.0789
 epoch: 7, train_loss: 1.4542, test_loss: 1.4437, test_f1: 0.0789
 epoch: 8, train_loss: 1.4527, test_loss: 1.4422, test_f1: 0.0789
 epoch: 9, train_loss: 1.4508, test_loss: 1.4408, test_f1: 0.0789
 epoch: 10, train_loss: 1.4492, test_loss: 1.4395, test_f1: 0.0789
 epoch: 11, train_loss: 1.4478, test_loss: 1.4380, test_f1: 0.0789
 epoch: 12, train_loss: 1.4465, test_loss: 1.4365, test_f1: 0.0789
 epoch: 13, train_loss: 1.4449, test_loss: 1.4353, test_f1: 0.0789
 epoch: 14, train_loss: 1.4431, test_loss: 1.4337, test_f1: 0.0789
 epoch: 15, train_loss: 1.4413, test_loss: 1.4321, test_f1: 0.0789
 epoch: 16, train_loss: 1.4398, test_loss: 1.4307, test_f1: 0.0789
 epoch: 17, train_loss: 1.4381, test_loss: 1.4291, test_f1: 0.0789
 epoch: 18, train_loss: 1.4366, test_loss: 1.4276, test_f1: 0.0789
 epoch: 19, train_loss: 1.4349, test_loss: 1.4261, test_f1: 0.0789
 epoch: 20, train_loss: 1.4329, test_loss: 1.4246, test_f1: 0.0789
 epoch: 21, train_loss: 1.4315, test_loss: 1.4231, test_f1: 0.0789
 epoch: 22, train_loss: 1.4297, test_loss: 1.4215, test_f1: 0.0791
 epoch: 23, train_loss: 1.4283, test_loss: 1.4197, test_f1: 0.0794
 epoch: 24, train_loss: 1.4268, test_loss: 1.4183, test_f1: 0.0794
 epoch: 25, train_loss: 1.4248, test_loss: 1.4165, test_f1: 0.0829
 epoch: 26, train_loss: 1.4237, test_loss: 1.4151, test_f1: 0.1017
 epoch: 27, train_loss: 1.4214, test_loss: 1.4132, test_f1: 0.1180
 epoch: 28, train_loss: 1.4192, test_loss: 1.4115, test_f1: 0.1450
 epoch: 29, train_loss: 1.4171, test_loss: 1.4092, test_f1: 0.1610
 epoch: 30, train_loss: 1.4153, test_loss: 1.4073, test_f1: 0.1678
 epoch: 31, train_loss: 1.4126, test_loss: 1.4049, test_f1: 0.1682
 epoch: 32, train_loss: 1.4106, test_loss: 1.4024, test_f1: 0.1718
 epoch: 33, train_loss: 1.4077, test_loss: 1.3997, test_f1: 0.1884
 epoch: 34, train_loss: 1.4057, test_loss: 1.3968, test_f1: 0.1951
 epoch: 35, train_loss: 1.4006, test_loss: 1.3932, test_f1: 0.2001
 epoch: 36, train_loss: 1.3979, test_loss: 1.3898, test_f1: 0.2043
 epoch: 37, train_loss: 1.3929, test_loss: 1.3858, test_f1: 0.2018
 epoch: 38, train_loss: 1.3911, test_loss: 1.3817, test_f1: 0.1958
 epoch: 39, train_loss: 1.3858, test_loss: 1.3774, test_f1: 0.1957
 epoch: 40, train_loss: 1.3824, test_loss: 1.3730, test_f1: 0.1968
 epoch: 41, train_loss: 1.3769, test_loss: 1.3674, test_f1: 0.2007
 epoch: 42, train_loss: 1.3713, test_loss: 1.3622, test_f1: 0.2038
 epoch: 43, train_loss: 1.3654, test_loss: 1.3568, test_f1: 0.2040
 epoch: 44, train_loss: 1.3618, test_loss: 1.3512, test_f1: 0.2119
 epoch: 45, train_loss: 1.3546, test_loss: 1.3456, test_f1: 0.2530
 epoch: 46, train_loss: 1.3496, test_loss: 1.3397, test_f1: 0.2839
 epoch: 47, train_loss: 1.3445, test_loss: 1.3326, test_f1: 0.3058
 epoch: 48, train_loss: 1.3360, test_loss: 1.3263, test_f1: 0.2979
 epoch: 49, train_loss: 1.3335, test_loss: 1.3197, test_f1: 0.3181
 epoch: 50, train_loss: 1.3243, test_loss: 1.3137, test_f1: 0.3237
 epoch: 51, train_loss: 1.3204, test_loss: 1.3105, test_f1: 0.3053
 epoch: 52, train_loss: 1.3146, test_loss: 1.3076, test_f1: 0.3053
 epoch: 53, train_loss: 1.3176, test_loss: 1.3042, test_f1: 0.3189
 epoch: 54, train_loss: 1.3140, test_loss: 1.3006, test_f1: 0.3140
 epoch: 55, train_loss: 1.3133, test_loss: 1.2974, test_f1: 0.3072
 epoch: 56, train_loss: 1.3089, test_loss: 1.2945, test_f1: 0.3155
 epoch: 57, train_loss: 1.3036, test_loss: 1.2919, test_f1: 0.3109
 epoch: 58, train_loss: 1.3049, test_loss: 1.2894, test_f1: 0.3084
 epoch: 59, train_loss: 1.3014, test_loss: 1.2869, test_f1: 0.3003
 epoch: 60, train_loss: 1.2984, test_loss: 1.2839, test_f1: 0.3017
 epoch: 61, train_loss: 1.2960, test_loss: 1.2808, test_f1: 0.2925
 epoch: 62, train_loss: 1.2956, test_loss: 1.2787, test_f1: 0.2810
 epoch: 63, train_loss: 1.2950, test_loss: 1.2761, test_f1: 0.2772
 epoch: 64, train_loss: 1.2896, test_loss: 1.2733, test_f1: 0.2776
 epoch: 65, train_loss: 1.2871, test_loss: 1.2708, test_f1: 0.2763
 epoch: 66, train_loss: 1.2875, test_loss: 1.2690, test_f1: 0.2789
 epoch: 67, train_loss: 1.2831, test_loss: 1.2663, test_f1: 0.2782
 epoch: 68, train_loss: 1.2843, test_loss: 1.2643, test_f1: 0.2755
 epoch: 69, train_loss: 1.2845, test_loss: 1.2628, test_f1: 0.2633
 epoch: 70, train_loss: 1.2820, test_loss: 1.2608, test_f1: 0.2656
 epoch: 71, train_loss: 1.2790, test_loss: 1.2587, test_f1: 0.2603
 epoch: 72, train_loss: 1.2760, test_loss: 1.2570, test_f1: 0.2640
 epoch: 73, train_loss: 1.2760, test_loss: 1.2546, test_f1: 0.2621
 epoch: 74, train_loss: 1.2714, test_loss: 1.2524, test_f1: 0.2475
 epoch: 75, train_loss: 1.2722, test_loss: 1.2511, test_f1: 0.2649
 epoch: 76, train_loss: 1.2722, test_loss: 1.2493, test_f1: 0.2462
 epoch: 77, train_loss: 1.2698, test_loss: 1.2475, test_f1: 0.2478
 epoch: 78, train_loss: 1.2665, test_loss: 1.2455, test_f1: 0.2458
 epoch: 79, train_loss: 1.2669, test_loss: 1.2437, test_f1: 0.2468
 epoch: 80, train_loss: 1.2656, test_loss: 1.2434, test_f1: 0.2519
 epoch: 81, train_loss: 1.2586, test_loss: 1.2401, test_f1: 0.2463
 epoch: 82, train_loss: 1.2657, test_loss: 1.2389, test_f1: 0.2557
 epoch: 83, train_loss: 1.2635, test_loss: 1.2374, test_f1: 0.2579
 epoch: 84, train_loss: 1.2604, test_loss: 1.2361, test_f1: 0.2581
 epoch: 85, train_loss: 1.2620, test_loss: 1.2350, test_f1: 0.2536
 epoch: 86, train_loss: 1.2559, test_loss: 1.2336, test_f1: 0.2689
 epoch: 87, train_loss: 1.2549, test_loss: 1.2314, test_f1: 0.2681
 epoch: 88, train_loss: 1.2533, test_loss: 1.2302, test_f1: 0.2626
 epoch: 89, train_loss: 1.2478, test_loss: 1.2286, test_f1: 0.2656
 epoch: 90, train_loss: 1.2538, test_loss: 1.2278, test_f1: 0.2773
 epoch: 91, train_loss: 1.2494, test_loss: 1.2263, test_f1: 0.2738
 epoch: 92, train_loss: 1.2481, test_loss: 1.2248, test_f1: 0.2843
 epoch: 93, train_loss: 1.2494, test_loss: 1.2235, test_f1: 0.2877
 epoch: 94, train_loss: 1.2501, test_loss: 1.2227, test_f1: 0.2999
 epoch: 95, train_loss: 1.2477, test_loss: 1.2208, test_f1: 0.3028
 epoch: 96, train_loss: 1.2464, test_loss: 1.2195, test_f1: 0.3051
 epoch: 97, train_loss: 1.2389, test_loss: 1.2182, test_f1: 0.3022
 epoch: 98, train_loss: 1.2447, test_loss: 1.2171, test_f1: 0.3130
 epoch: 99, train_loss: 1.2412, test_loss: 1.2154, test_f1: 0.3189
##################ITERATION #1 ****************************************
 epoch: 0, train_loss: 1.4187, test_loss: 1.4119, test_f1: 0.0789
 epoch: 1, train_loss: 1.4161, test_loss: 1.4102, test_f1: 0.0789
 epoch: 2, train_loss: 1.4143, test_loss: 1.4080, test_f1: 0.0789
 epoch: 3, train_loss: 1.4127, test_loss: 1.4065, test_f1: 0.0789
 epoch: 4, train_loss: 1.4107, test_loss: 1.4047, test_f1: 0.0789
 epoch: 5, train_loss: 1.4084, test_loss: 1.4030, test_f1: 0.0789
 epoch: 6, train_loss: 1.4059, test_loss: 1.4011, test_f1: 0.0789
 epoch: 7, train_loss: 1.4022, test_loss: 1.3987, test_f1: 0.0789
 epoch: 8, train_loss: 1.3987, test_loss: 1.3958, test_f1: 0.0789
 epoch: 9, train_loss: 1.3954, test_loss: 1.3928, test_f1: 0.0789
 epoch: 10, train_loss: 1.3910, test_loss: 1.3889, test_f1: 0.0789
 epoch: 11, train_loss: 1.3878, test_loss: 1.3844, test_f1: 0.0789
 epoch: 12, train_loss: 1.3833, test_loss: 1.3798, test_f1: 0.0789
 epoch: 13, train_loss: 1.3777, test_loss: 1.3752, test_f1: 0.1490
 epoch: 14, train_loss: 1.3741, test_loss: 1.3707, test_f1: 0.1990
 epoch: 15, train_loss: 1.3672, test_loss: 1.3665, test_f1: 0.2570
 epoch: 16, train_loss: 1.3639, test_loss: 1.3623, test_f1: 0.2658
 epoch: 17, train_loss: 1.3595, test_loss: 1.3577, test_f1: 0.2676
 epoch: 18, train_loss: 1.3554, test_loss: 1.3532, test_f1: 0.2771
 epoch: 19, train_loss: 1.3505, test_loss: 1.3490, test_f1: 0.2736
 epoch: 20, train_loss: 1.3422, test_loss: 1.3449, test_f1: 0.2694
 epoch: 21, train_loss: 1.3369, test_loss: 1.3407, test_f1: 0.2714
 epoch: 22, train_loss: 1.3331, test_loss: 1.3362, test_f1: 0.2701
 epoch: 23, train_loss: 1.3295, test_loss: 1.3313, test_f1: 0.2744
 epoch: 24, train_loss: 1.3263, test_loss: 1.3266, test_f1: 0.2775
 epoch: 25, train_loss: 1.3207, test_loss: 1.3219, test_f1: 0.2728
 epoch: 26, train_loss: 1.3149, test_loss: 1.3174, test_f1: 0.2703
 epoch: 27, train_loss: 1.3077, test_loss: 1.3130, test_f1: 0.2663
 epoch: 28, train_loss: 1.3049, test_loss: 1.3090, test_f1: 0.2602
 epoch: 29, train_loss: 1.3031, test_loss: 1.3051, test_f1: 0.2568
 epoch: 30, train_loss: 1.2983, test_loss: 1.3014, test_f1: 0.2517
 epoch: 31, train_loss: 1.2934, test_loss: 1.2977, test_f1: 0.2561
 epoch: 32, train_loss: 1.2908, test_loss: 1.2943, test_f1: 0.2494
 epoch: 33, train_loss: 1.2876, test_loss: 1.2908, test_f1: 0.2526
 epoch: 34, train_loss: 1.2832, test_loss: 1.2863, test_f1: 0.2513
 epoch: 35, train_loss: 1.2799, test_loss: 1.2830, test_f1: 0.2496
 epoch: 36, train_loss: 1.2766, test_loss: 1.2801, test_f1: 0.2305
 epoch: 37, train_loss: 1.2731, test_loss: 1.2762, test_f1: 0.2310
 epoch: 38, train_loss: 1.2724, test_loss: 1.2731, test_f1: 0.2305
 epoch: 39, train_loss: 1.2661, test_loss: 1.2684, test_f1: 0.2324
 epoch: 40, train_loss: 1.2663, test_loss: 1.2649, test_f1: 0.2514
 epoch: 41, train_loss: 1.2664, test_loss: 1.2628, test_f1: 0.2513
 epoch: 42, train_loss: 1.2633, test_loss: 1.2611, test_f1: 0.2492
 epoch: 43, train_loss: 1.2609, test_loss: 1.2582, test_f1: 0.2496
 epoch: 44, train_loss: 1.2591, test_loss: 1.2548, test_f1: 0.2331
 epoch: 45, train_loss: 1.2531, test_loss: 1.2528, test_f1: 0.2289
 epoch: 46, train_loss: 1.2564, test_loss: 1.2512, test_f1: 0.2508
 epoch: 47, train_loss: 1.2537, test_loss: 1.2494, test_f1: 0.2534
 epoch: 48, train_loss: 1.2499, test_loss: 1.2466, test_f1: 0.2519
 epoch: 49, train_loss: 1.2510, test_loss: 1.2441, test_f1: 0.2626
 epoch: 50, train_loss: 1.2498, test_loss: 1.2422, test_f1: 0.2631
 epoch: 51, train_loss: 1.2475, test_loss: 1.2416, test_f1: 0.2580
 epoch: 52, train_loss: 1.2482, test_loss: 1.2404, test_f1: 0.2570
 epoch: 53, train_loss: 1.2430, test_loss: 1.2398, test_f1: 0.2561
 epoch: 54, train_loss: 1.2430, test_loss: 1.2391, test_f1: 0.2637
 epoch: 55, train_loss: 1.2430, test_loss: 1.2383, test_f1: 0.2633
 epoch: 56, train_loss: 1.2421, test_loss: 1.2377, test_f1: 0.2635
 epoch: 57, train_loss: 1.2423, test_loss: 1.2370, test_f1: 0.2642
 epoch: 58, train_loss: 1.2449, test_loss: 1.2355, test_f1: 0.2644
 epoch: 59, train_loss: 1.2394, test_loss: 1.2360, test_f1: 0.2643
 epoch: 60, train_loss: 1.2362, test_loss: 1.2350, test_f1: 0.2641
 epoch: 61, train_loss: 1.2368, test_loss: 1.2346, test_f1: 0.2636
 epoch: 62, train_loss: 1.2380, test_loss: 1.2345, test_f1: 0.2633
 epoch: 63, train_loss: 1.2370, test_loss: 1.2321, test_f1: 0.2639
 epoch: 64, train_loss: 1.2376, test_loss: 1.2320, test_f1: 0.2634
 epoch: 65, train_loss: 1.2345, test_loss: 1.2307, test_f1: 0.2640
 epoch: 66, train_loss: 1.2349, test_loss: 1.2296, test_f1: 0.2643
 epoch: 67, train_loss: 1.2345, test_loss: 1.2282, test_f1: 0.2678
 epoch: 68, train_loss: 1.2411, test_loss: 1.2279, test_f1: 0.2737
 epoch: 69, train_loss: 1.2291, test_loss: 1.2267, test_f1: 0.2705
 epoch: 70, train_loss: 1.2366, test_loss: 1.2265, test_f1: 0.2706
 epoch: 71, train_loss: 1.2332, test_loss: 1.2246, test_f1: 0.2744
 epoch: 72, train_loss: 1.2352, test_loss: 1.2239, test_f1: 0.2729
 epoch: 73, train_loss: 1.2337, test_loss: 1.2234, test_f1: 0.2710
 epoch: 74, train_loss: 1.2334, test_loss: 1.2228, test_f1: 0.2758
 epoch: 75, train_loss: 1.2303, test_loss: 1.2219, test_f1: 0.2751
 epoch: 76, train_loss: 1.2327, test_loss: 1.2221, test_f1: 0.2708
 epoch: 77, train_loss: 1.2264, test_loss: 1.2213, test_f1: 0.2723
 epoch: 78, train_loss: 1.2270, test_loss: 1.2212, test_f1: 0.2715
 epoch: 79, train_loss: 1.2316, test_loss: 1.2203, test_f1: 0.2707
 epoch: 80, train_loss: 1.2282, test_loss: 1.2193, test_f1: 0.2732
 epoch: 81, train_loss: 1.2260, test_loss: 1.2198, test_f1: 0.2717
 epoch: 82, train_loss: 1.2282, test_loss: 1.2187, test_f1: 0.2733
 epoch: 83, train_loss: 1.2262, test_loss: 1.2182, test_f1: 0.2727
 epoch: 84, train_loss: 1.2273, test_loss: 1.2174, test_f1: 0.2741
 epoch: 85, train_loss: 1.2278, test_loss: 1.2179, test_f1: 0.2728
 epoch: 86, train_loss: 1.2263, test_loss: 1.2166, test_f1: 0.2714
 epoch: 87, train_loss: 1.2272, test_loss: 1.2152, test_f1: 0.2757
 epoch: 88, train_loss: 1.2259, test_loss: 1.2151, test_f1: 0.2766
 epoch: 89, train_loss: 1.2264, test_loss: 1.2147, test_f1: 0.2743
 epoch: 90, train_loss: 1.2238, test_loss: 1.2140, test_f1: 0.2786
 epoch: 91, train_loss: 1.2249, test_loss: 1.2126, test_f1: 0.2796
 epoch: 92, train_loss: 1.2244, test_loss: 1.2129, test_f1: 0.2781
 epoch: 93, train_loss: 1.2259, test_loss: 1.2138, test_f1: 0.2797
 epoch: 94, train_loss: 1.2277, test_loss: 1.2154, test_f1: 0.2852
 epoch: 95, train_loss: 1.2242, test_loss: 1.2112, test_f1: 0.2800
 epoch: 96, train_loss: 1.2223, test_loss: 1.2117, test_f1: 0.2773
 epoch: 97, train_loss: 1.2193, test_loss: 1.2111, test_f1: 0.2789
 epoch: 98, train_loss: 1.2244, test_loss: 1.2123, test_f1: 0.2841
 epoch: 99, train_loss: 1.2148, test_loss: 1.2099, test_f1: 0.2774
##################ITERATION #2 ****************************************
 epoch: 0, train_loss: 1.3781, test_loss: 1.3783, test_f1: 0.0789
 epoch: 1, train_loss: 1.3744, test_loss: 1.3759, test_f1: 0.0789
 epoch: 2, train_loss: 1.3707, test_loss: 1.3727, test_f1: 0.1328
 epoch: 3, train_loss: 1.3685, test_loss: 1.3726, test_f1: 0.1655
 epoch: 4, train_loss: 1.3657, test_loss: 1.3695, test_f1: 0.2820
 epoch: 5, train_loss: 1.3634, test_loss: 1.3653, test_f1: 0.2680
 epoch: 6, train_loss: 1.3601, test_loss: 1.3605, test_f1: 0.2550
 epoch: 7, train_loss: 1.3564, test_loss: 1.3572, test_f1: 0.2308
 epoch: 8, train_loss: 1.3533, test_loss: 1.3539, test_f1: 0.2264
 epoch: 9, train_loss: 1.3500, test_loss: 1.3514, test_f1: 0.2262
 epoch: 10, train_loss: 1.3478, test_loss: 1.3485, test_f1: 0.2262
 epoch: 11, train_loss: 1.3453, test_loss: 1.3447, test_f1: 0.2262
 epoch: 12, train_loss: 1.3416, test_loss: 1.3420, test_f1: 0.2262
 epoch: 13, train_loss: 1.3376, test_loss: 1.3388, test_f1: 0.2260
 epoch: 14, train_loss: 1.3334, test_loss: 1.3358, test_f1: 0.2260
 epoch: 15, train_loss: 1.3321, test_loss: 1.3318, test_f1: 0.2260
 epoch: 16, train_loss: 1.3259, test_loss: 1.3281, test_f1: 0.2260
 epoch: 17, train_loss: 1.3217, test_loss: 1.3248, test_f1: 0.2260
 epoch: 18, train_loss: 1.3194, test_loss: 1.3207, test_f1: 0.2260
 epoch: 19, train_loss: 1.3141, test_loss: 1.3161, test_f1: 0.2260
 epoch: 20, train_loss: 1.3104, test_loss: 1.3114, test_f1: 0.2260
 epoch: 21, train_loss: 1.3056, test_loss: 1.3070, test_f1: 0.2260
 epoch: 22, train_loss: 1.2997, test_loss: 1.3027, test_f1: 0.2260
 epoch: 23, train_loss: 1.2942, test_loss: 1.2989, test_f1: 0.2260
 epoch: 24, train_loss: 1.2901, test_loss: 1.2937, test_f1: 0.2260
 epoch: 25, train_loss: 1.2842, test_loss: 1.2889, test_f1: 0.2260
 epoch: 26, train_loss: 1.2794, test_loss: 1.2835, test_f1: 0.2260
 epoch: 27, train_loss: 1.2748, test_loss: 1.2778, test_f1: 0.2260
 epoch: 28, train_loss: 1.2717, test_loss: 1.2739, test_f1: 0.2260
 epoch: 29, train_loss: 1.2665, test_loss: 1.2693, test_f1: 0.2260
 epoch: 30, train_loss: 1.2621, test_loss: 1.2655, test_f1: 0.2260
 epoch: 31, train_loss: 1.2600, test_loss: 1.2606, test_f1: 0.2260
 epoch: 32, train_loss: 1.2583, test_loss: 1.2569, test_f1: 0.2260
 epoch: 33, train_loss: 1.2522, test_loss: 1.2529, test_f1: 0.2260
 epoch: 34, train_loss: 1.2526, test_loss: 1.2492, test_f1: 0.2260
 epoch: 35, train_loss: 1.2477, test_loss: 1.2470, test_f1: 0.2260
 epoch: 36, train_loss: 1.2438, test_loss: 1.2435, test_f1: 0.2260
 epoch: 37, train_loss: 1.2404, test_loss: 1.2402, test_f1: 0.2262
 epoch: 38, train_loss: 1.2379, test_loss: 1.2371, test_f1: 0.2262
 epoch: 39, train_loss: 1.2374, test_loss: 1.2349, test_f1: 0.2272
 epoch: 40, train_loss: 1.2317, test_loss: 1.2315, test_f1: 0.2282
 epoch: 41, train_loss: 1.2295, test_loss: 1.2307, test_f1: 0.2264
 epoch: 42, train_loss: 1.2257, test_loss: 1.2277, test_f1: 0.2297
 epoch: 43, train_loss: 1.2239, test_loss: 1.2251, test_f1: 0.2289
 epoch: 44, train_loss: 1.2201, test_loss: 1.2228, test_f1: 0.2291
 epoch: 45, train_loss: 1.2165, test_loss: 1.2209, test_f1: 0.2329
 epoch: 46, train_loss: 1.2187, test_loss: 1.2187, test_f1: 0.2319
 epoch: 47, train_loss: 1.2182, test_loss: 1.2163, test_f1: 0.2335
 epoch: 48, train_loss: 1.2140, test_loss: 1.2134, test_f1: 0.2331
 epoch: 49, train_loss: 1.2114, test_loss: 1.2135, test_f1: 0.2358
 epoch: 50, train_loss: 1.2125, test_loss: 1.2118, test_f1: 0.2335
 epoch: 51, train_loss: 1.2089, test_loss: 1.2089, test_f1: 0.2350
 epoch: 52, train_loss: 1.2111, test_loss: 1.2090, test_f1: 0.2366
 epoch: 53, train_loss: 1.2055, test_loss: 1.2072, test_f1: 0.2350
 epoch: 54, train_loss: 1.2063, test_loss: 1.2069, test_f1: 0.2345
 epoch: 55, train_loss: 1.2085, test_loss: 1.2066, test_f1: 0.2356
 epoch: 56, train_loss: 1.2045, test_loss: 1.2046, test_f1: 0.2364
 epoch: 57, train_loss: 1.2015, test_loss: 1.2033, test_f1: 0.2362
 epoch: 58, train_loss: 1.2005, test_loss: 1.2030, test_f1: 0.2370
 epoch: 59, train_loss: 1.2069, test_loss: 1.2028, test_f1: 0.2356
 epoch: 60, train_loss: 1.2029, test_loss: 1.2016, test_f1: 0.2362
 epoch: 61, train_loss: 1.1989, test_loss: 1.2004, test_f1: 0.2368
 epoch: 62, train_loss: 1.2013, test_loss: 1.2001, test_f1: 0.2383
 epoch: 63, train_loss: 1.2003, test_loss: 1.2003, test_f1: 0.2375
 epoch: 64, train_loss: 1.1974, test_loss: 1.1990, test_f1: 0.2377
 epoch: 65, train_loss: 1.1967, test_loss: 1.1977, test_f1: 0.2370
 epoch: 66, train_loss: 1.1954, test_loss: 1.1965, test_f1: 0.2385
 epoch: 67, train_loss: 1.1964, test_loss: 1.1960, test_f1: 0.2385
 epoch: 68, train_loss: 1.1921, test_loss: 1.1954, test_f1: 0.2381
 epoch: 69, train_loss: 1.1903, test_loss: 1.1961, test_f1: 0.2385
 epoch: 70, train_loss: 1.2020, test_loss: 1.1957, test_f1: 0.2387
 epoch: 71, train_loss: 1.1910, test_loss: 1.1937, test_f1: 0.2381
 epoch: 72, train_loss: 1.1941, test_loss: 1.1928, test_f1: 0.2444
 epoch: 73, train_loss: 1.1928, test_loss: 1.1928, test_f1: 0.2436
 epoch: 74, train_loss: 1.1868, test_loss: 1.1915, test_f1: 0.2442
 epoch: 75, train_loss: 1.1874, test_loss: 1.1924, test_f1: 0.2441
 epoch: 76, train_loss: 1.1883, test_loss: 1.1891, test_f1: 0.2460
 epoch: 77, train_loss: 1.1878, test_loss: 1.1890, test_f1: 0.2502
 epoch: 78, train_loss: 1.1886, test_loss: 1.1888, test_f1: 0.2563
 epoch: 79, train_loss: 1.1839, test_loss: 1.1886, test_f1: 0.2561
 epoch: 80, train_loss: 1.1885, test_loss: 1.1879, test_f1: 0.2566
 epoch: 81, train_loss: 1.1843, test_loss: 1.1854, test_f1: 0.2496
 epoch: 82, train_loss: 1.1848, test_loss: 1.1846, test_f1: 0.2513
 epoch: 83, train_loss: 1.1808, test_loss: 1.1842, test_f1: 0.2560
 epoch: 84, train_loss: 1.1829, test_loss: 1.1844, test_f1: 0.2605
 epoch: 85, train_loss: 1.1825, test_loss: 1.1863, test_f1: 0.2565
 epoch: 86, train_loss: 1.1828, test_loss: 1.1824, test_f1: 0.2502
 epoch: 87, train_loss: 1.1841, test_loss: 1.1824, test_f1: 0.2587
 epoch: 88, train_loss: 1.1790, test_loss: 1.1814, test_f1: 0.2602
 epoch: 89, train_loss: 1.1784, test_loss: 1.1807, test_f1: 0.2598
 epoch: 90, train_loss: 1.1744, test_loss: 1.1811, test_f1: 0.2598
 epoch: 91, train_loss: 1.1787, test_loss: 1.1808, test_f1: 0.2542
 epoch: 92, train_loss: 1.1729, test_loss: 1.1799, test_f1: 0.2541
 epoch: 93, train_loss: 1.1758, test_loss: 1.1776, test_f1: 0.2559
 epoch: 94, train_loss: 1.1714, test_loss: 1.1789, test_f1: 0.2641
 epoch: 95, train_loss: 1.1763, test_loss: 1.1778, test_f1: 0.2701
 epoch: 96, train_loss: 1.1736, test_loss: 1.1766, test_f1: 0.2746
 epoch: 97, train_loss: 1.1737, test_loss: 1.1768, test_f1: 0.2734
 epoch: 98, train_loss: 1.1750, test_loss: 1.1762, test_f1: 0.2752
 epoch: 99, train_loss: 1.1738, test_loss: 1.1771, test_f1: 0.2776
##################ITERATION #3 ****************************************
 epoch: 0, train_loss: 1.3695, test_loss: 1.3708, test_f1: 0.2260
 epoch: 1, train_loss: 1.3656, test_loss: 1.3682, test_f1: 0.2260
 epoch: 2, train_loss: 1.3621, test_loss: 1.3663, test_f1: 0.2260
 epoch: 3, train_loss: 1.3596, test_loss: 1.3615, test_f1: 0.2260
 epoch: 4, train_loss: 1.3572, test_loss: 1.3596, test_f1: 0.2260
 epoch: 5, train_loss: 1.3543, test_loss: 1.3571, test_f1: 0.2260
 epoch: 6, train_loss: 1.3498, test_loss: 1.3525, test_f1: 0.2260
 epoch: 7, train_loss: 1.3465, test_loss: 1.3480, test_f1: 0.2260
 epoch: 8, train_loss: 1.3430, test_loss: 1.3442, test_f1: 0.2260
 epoch: 9, train_loss: 1.3392, test_loss: 1.3403, test_f1: 0.2260
 epoch: 10, train_loss: 1.3362, test_loss: 1.3362, test_f1: 0.2260
 epoch: 11, train_loss: 1.3313, test_loss: 1.3320, test_f1: 0.2260
 epoch: 12, train_loss: 1.3285, test_loss: 1.3274, test_f1: 0.2260
 epoch: 13, train_loss: 1.3224, test_loss: 1.3235, test_f1: 0.2260
 epoch: 14, train_loss: 1.3181, test_loss: 1.3199, test_f1: 0.2260
 epoch: 15, train_loss: 1.3138, test_loss: 1.3143, test_f1: 0.2260
 epoch: 16, train_loss: 1.3097, test_loss: 1.3096, test_f1: 0.2260
 epoch: 17, train_loss: 1.3049, test_loss: 1.3049, test_f1: 0.2260
 epoch: 18, train_loss: 1.3016, test_loss: 1.2998, test_f1: 0.2260
 epoch: 19, train_loss: 1.2956, test_loss: 1.2954, test_f1: 0.2260
 epoch: 20, train_loss: 1.2914, test_loss: 1.2911, test_f1: 0.2260
 epoch: 21, train_loss: 1.2873, test_loss: 1.2867, test_f1: 0.2260
 epoch: 22, train_loss: 1.2834, test_loss: 1.2821, test_f1: 0.2260
 epoch: 23, train_loss: 1.2821, test_loss: 1.2774, test_f1: 0.2260
 epoch: 24, train_loss: 1.2778, test_loss: 1.2737, test_f1: 0.2260
 epoch: 25, train_loss: 1.2756, test_loss: 1.2697, test_f1: 0.2260
 epoch: 26, train_loss: 1.2715, test_loss: 1.2650, test_f1: 0.2260
 epoch: 27, train_loss: 1.2693, test_loss: 1.2620, test_f1: 0.2260
 epoch: 28, train_loss: 1.2640, test_loss: 1.2579, test_f1: 0.2260
 epoch: 29, train_loss: 1.2643, test_loss: 1.2540, test_f1: 0.2260
 epoch: 30, train_loss: 1.2574, test_loss: 1.2510, test_f1: 0.2260
 epoch: 31, train_loss: 1.2554, test_loss: 1.2481, test_f1: 0.2260
 epoch: 32, train_loss: 1.2548, test_loss: 1.2453, test_f1: 0.2260
 epoch: 33, train_loss: 1.2548, test_loss: 1.2422, test_f1: 0.2260
 epoch: 34, train_loss: 1.2499, test_loss: 1.2392, test_f1: 0.2260
 epoch: 35, train_loss: 1.2467, test_loss: 1.2368, test_f1: 0.2260
 epoch: 36, train_loss: 1.2487, test_loss: 1.2347, test_f1: 0.2260
 epoch: 37, train_loss: 1.2442, test_loss: 1.2318, test_f1: 0.2260
 epoch: 38, train_loss: 1.2475, test_loss: 1.2293, test_f1: 0.2260
 epoch: 39, train_loss: 1.2387, test_loss: 1.2267, test_f1: 0.2260
 epoch: 40, train_loss: 1.2404, test_loss: 1.2261, test_f1: 0.2260
 epoch: 41, train_loss: 1.2380, test_loss: 1.2233, test_f1: 0.2260
 epoch: 42, train_loss: 1.2353, test_loss: 1.2215, test_f1: 0.2260
 epoch: 43, train_loss: 1.2370, test_loss: 1.2203, test_f1: 0.2260
 epoch: 44, train_loss: 1.2362, test_loss: 1.2189, test_f1: 0.2260
 epoch: 45, train_loss: 1.2350, test_loss: 1.2180, test_f1: 0.2260
 epoch: 46, train_loss: 1.2303, test_loss: 1.2158, test_f1: 0.2260
 epoch: 47, train_loss: 1.2339, test_loss: 1.2145, test_f1: 0.2260
 epoch: 48, train_loss: 1.2310, test_loss: 1.2132, test_f1: 0.2260
 epoch: 49, train_loss: 1.2286, test_loss: 1.2117, test_f1: 0.2260
 epoch: 50, train_loss: 1.2283, test_loss: 1.2093, test_f1: 0.2260
 epoch: 51, train_loss: 1.2275, test_loss: 1.2076, test_f1: 0.2260
 epoch: 52, train_loss: 1.2249, test_loss: 1.2076, test_f1: 0.2260
 epoch: 53, train_loss: 1.2239, test_loss: 1.2064, test_f1: 0.2260
 epoch: 54, train_loss: 1.2201, test_loss: 1.2054, test_f1: 0.2260
 epoch: 55, train_loss: 1.2224, test_loss: 1.2045, test_f1: 0.2260
 epoch: 56, train_loss: 1.2213, test_loss: 1.2032, test_f1: 0.2260
 epoch: 57, train_loss: 1.2197, test_loss: 1.2040, test_f1: 0.2260
 epoch: 58, train_loss: 1.2208, test_loss: 1.2029, test_f1: 0.2260
 epoch: 59, train_loss: 1.2171, test_loss: 1.2020, test_f1: 0.2260
 epoch: 60, train_loss: 1.2220, test_loss: 1.2009, test_f1: 0.2260
 epoch: 61, train_loss: 1.2208, test_loss: 1.2000, test_f1: 0.2260
 epoch: 62, train_loss: 1.2175, test_loss: 1.1999, test_f1: 0.2260
 epoch: 63, train_loss: 1.2192, test_loss: 1.1982, test_f1: 0.2260
 epoch: 64, train_loss: 1.2186, test_loss: 1.1975, test_f1: 0.2260
 epoch: 65, train_loss: 1.2158, test_loss: 1.1969, test_f1: 0.2260
 epoch: 66, train_loss: 1.2173, test_loss: 1.1971, test_f1: 0.2260
 epoch: 67, train_loss: 1.2163, test_loss: 1.1963, test_f1: 0.2260
 epoch: 68, train_loss: 1.2175, test_loss: 1.1943, test_f1: 0.2260
 epoch: 69, train_loss: 1.2146, test_loss: 1.1936, test_f1: 0.2260
 epoch: 70, train_loss: 1.2134, test_loss: 1.1928, test_f1: 0.2260
 epoch: 71, train_loss: 1.2153, test_loss: 1.1924, test_f1: 0.2260
 epoch: 72, train_loss: 1.2137, test_loss: 1.1926, test_f1: 0.2260
 epoch: 73, train_loss: 1.2158, test_loss: 1.1918, test_f1: 0.2260
 epoch: 74, train_loss: 1.2113, test_loss: 1.1915, test_f1: 0.2260
 epoch: 75, train_loss: 1.2115, test_loss: 1.1907, test_f1: 0.2260
 epoch: 76, train_loss: 1.2104, test_loss: 1.1889, test_f1: 0.2260
 epoch: 77, train_loss: 1.2096, test_loss: 1.1881, test_f1: 0.2260
 epoch: 78, train_loss: 1.2096, test_loss: 1.1870, test_f1: 0.2260
 epoch: 79, train_loss: 1.2092, test_loss: 1.1874, test_f1: 0.2260
 epoch: 80, train_loss: 1.2092, test_loss: 1.1866, test_f1: 0.2260
 epoch: 81, train_loss: 1.2069, test_loss: 1.1860, test_f1: 0.2260
 epoch: 82, train_loss: 1.2024, test_loss: 1.1852, test_f1: 0.2260
 epoch: 83, train_loss: 1.2043, test_loss: 1.1841, test_f1: 0.2260
 epoch: 84, train_loss: 1.2039, test_loss: 1.1832, test_f1: 0.2260
 epoch: 85, train_loss: 1.2062, test_loss: 1.1843, test_f1: 0.2260
 epoch: 86, train_loss: 1.2038, test_loss: 1.1834, test_f1: 0.2260
 epoch: 87, train_loss: 1.2059, test_loss: 1.1828, test_f1: 0.2260
 epoch: 88, train_loss: 1.2023, test_loss: 1.1818, test_f1: 0.2260
 epoch: 89, train_loss: 1.1996, test_loss: 1.1806, test_f1: 0.2260
 epoch: 90, train_loss: 1.2057, test_loss: 1.1792, test_f1: 0.2260
 epoch: 91, train_loss: 1.2002, test_loss: 1.1790, test_f1: 0.2260
 epoch: 92, train_loss: 1.2015, test_loss: 1.1795, test_f1: 0.2260
 epoch: 93, train_loss: 1.2020, test_loss: 1.1789, test_f1: 0.2260
 epoch: 94, train_loss: 1.2026, test_loss: 1.1773, test_f1: 0.2260
 epoch: 95, train_loss: 1.1991, test_loss: 1.1755, test_f1: 0.2260
 epoch: 96, train_loss: 1.1980, test_loss: 1.1759, test_f1: 0.2260
 epoch: 97, train_loss: 1.1978, test_loss: 1.1751, test_f1: 0.2260
 epoch: 98, train_loss: 1.1970, test_loss: 1.1752, test_f1: 0.2260
 epoch: 99, train_loss: 1.1952, test_loss: 1.1735, test_f1: 0.2260
##################ITERATION #4 ****************************************
 epoch: 0, train_loss: 1.3482, test_loss: 1.3619, test_f1: 0.2260
 epoch: 1, train_loss: 1.3423, test_loss: 1.3604, test_f1: 0.2260
 epoch: 2, train_loss: 1.3403, test_loss: 1.3569, test_f1: 0.2260
 epoch: 3, train_loss: 1.3355, test_loss: 1.3457, test_f1: 0.2260
 epoch: 4, train_loss: 1.3308, test_loss: 1.3354, test_f1: 0.2260
 epoch: 5, train_loss: 1.3281, test_loss: 1.3284, test_f1: 0.2260
 epoch: 6, train_loss: 1.3248, test_loss: 1.3247, test_f1: 0.2260
 epoch: 7, train_loss: 1.3206, test_loss: 1.3193, test_f1: 0.2260
 epoch: 8, train_loss: 1.3173, test_loss: 1.3152, test_f1: 0.2260
 epoch: 9, train_loss: 1.3122, test_loss: 1.3107, test_f1: 0.2260
 epoch: 10, train_loss: 1.3081, test_loss: 1.3056, test_f1: 0.2260
 epoch: 11, train_loss: 1.3052, test_loss: 1.3014, test_f1: 0.2260
 epoch: 12, train_loss: 1.3003, test_loss: 1.2976, test_f1: 0.2260
 epoch: 13, train_loss: 1.2977, test_loss: 1.2946, test_f1: 0.2260
 epoch: 14, train_loss: 1.2930, test_loss: 1.2903, test_f1: 0.2260
 epoch: 15, train_loss: 1.2883, test_loss: 1.2863, test_f1: 0.2260
 epoch: 16, train_loss: 1.2861, test_loss: 1.2818, test_f1: 0.2260
 epoch: 17, train_loss: 1.2818, test_loss: 1.2776, test_f1: 0.2260
 epoch: 18, train_loss: 1.2790, test_loss: 1.2737, test_f1: 0.2260
 epoch: 19, train_loss: 1.2767, test_loss: 1.2704, test_f1: 0.2260
 epoch: 20, train_loss: 1.2718, test_loss: 1.2656, test_f1: 0.2260
 epoch: 21, train_loss: 1.2680, test_loss: 1.2607, test_f1: 0.2260
 epoch: 22, train_loss: 1.2638, test_loss: 1.2563, test_f1: 0.2260
 epoch: 23, train_loss: 1.2565, test_loss: 1.2526, test_f1: 0.2260
 epoch: 24, train_loss: 1.2528, test_loss: 1.2469, test_f1: 0.2260
 epoch: 25, train_loss: 1.2526, test_loss: 1.2420, test_f1: 0.2260
 epoch: 26, train_loss: 1.2451, test_loss: 1.2367, test_f1: 0.2260
 epoch: 27, train_loss: 1.2436, test_loss: 1.2328, test_f1: 0.2260
 epoch: 28, train_loss: 1.2403, test_loss: 1.2286, test_f1: 0.2260
 epoch: 29, train_loss: 1.2366, test_loss: 1.2259, test_f1: 0.2260
 epoch: 30, train_loss: 1.2312, test_loss: 1.2210, test_f1: 0.2260
 epoch: 31, train_loss: 1.2318, test_loss: 1.2174, test_f1: 0.2260
 epoch: 32, train_loss: 1.2271, test_loss: 1.2158, test_f1: 0.2260
 epoch: 33, train_loss: 1.2231, test_loss: 1.2115, test_f1: 0.2260
 epoch: 34, train_loss: 1.2209, test_loss: 1.2085, test_f1: 0.2260
 epoch: 35, train_loss: 1.2233, test_loss: 1.2078, test_f1: 0.2260
 epoch: 36, train_loss: 1.2181, test_loss: 1.2051, test_f1: 0.2260
 epoch: 37, train_loss: 1.2164, test_loss: 1.2037, test_f1: 0.2260
 epoch: 38, train_loss: 1.2163, test_loss: 1.2001, test_f1: 0.2260
 epoch: 39, train_loss: 1.2142, test_loss: 1.1983, test_f1: 0.2260
 epoch: 40, train_loss: 1.2130, test_loss: 1.1966, test_f1: 0.2260
 epoch: 41, train_loss: 1.2104, test_loss: 1.1953, test_f1: 0.2260
 epoch: 42, train_loss: 1.2105, test_loss: 1.1931, test_f1: 0.2260
 epoch: 43, train_loss: 1.2090, test_loss: 1.1922, test_f1: 0.2260
 epoch: 44, train_loss: 1.2063, test_loss: 1.1912, test_f1: 0.2260
 epoch: 45, train_loss: 1.2037, test_loss: 1.1907, test_f1: 0.2260
 epoch: 46, train_loss: 1.2075, test_loss: 1.1894, test_f1: 0.2260
 epoch: 47, train_loss: 1.2057, test_loss: 1.1882, test_f1: 0.2260
 epoch: 48, train_loss: 1.2024, test_loss: 1.1857, test_f1: 0.2260
 epoch: 49, train_loss: 1.1983, test_loss: 1.1848, test_f1: 0.2260
 epoch: 50, train_loss: 1.2017, test_loss: 1.1836, test_f1: 0.2260
 epoch: 51, train_loss: 1.1989, test_loss: 1.1827, test_f1: 0.2260
 epoch: 52, train_loss: 1.1962, test_loss: 1.1824, test_f1: 0.2260
 epoch: 53, train_loss: 1.1969, test_loss: 1.1820, test_f1: 0.2260
 epoch: 54, train_loss: 1.1999, test_loss: 1.1818, test_f1: 0.2260
 epoch: 55, train_loss: 1.1953, test_loss: 1.1812, test_f1: 0.2260
 epoch: 56, train_loss: 1.1958, test_loss: 1.1804, test_f1: 0.2260
 epoch: 57, train_loss: 1.1951, test_loss: 1.1797, test_f1: 0.2260
 epoch: 58, train_loss: 1.1942, test_loss: 1.1792, test_f1: 0.2260
 epoch: 59, train_loss: 1.1913, test_loss: 1.1785, test_f1: 0.2260
 epoch: 60, train_loss: 1.1958, test_loss: 1.1781, test_f1: 0.2260
 epoch: 61, train_loss: 1.1906, test_loss: 1.1777, test_f1: 0.2260
 epoch: 62, train_loss: 1.1944, test_loss: 1.1775, test_f1: 0.2260
 epoch: 63, train_loss: 1.1959, test_loss: 1.1765, test_f1: 0.2260
 epoch: 64, train_loss: 1.1930, test_loss: 1.1758, test_f1: 0.2260
 epoch: 65, train_loss: 1.1903, test_loss: 1.1752, test_f1: 0.2260
 epoch: 66, train_loss: 1.1879, test_loss: 1.1755, test_f1: 0.2260
 epoch: 67, train_loss: 1.1919, test_loss: 1.1749, test_f1: 0.2260
 epoch: 68, train_loss: 1.1883, test_loss: 1.1743, test_f1: 0.2260
 epoch: 69, train_loss: 1.1889, test_loss: 1.1736, test_f1: 0.2260
 epoch: 70, train_loss: 1.1909, test_loss: 1.1730, test_f1: 0.2260
 epoch: 71, train_loss: 1.1877, test_loss: 1.1727, test_f1: 0.2260
 epoch: 72, train_loss: 1.1883, test_loss: 1.1717, test_f1: 0.2260
 epoch: 73, train_loss: 1.1894, test_loss: 1.1713, test_f1: 0.2260
 epoch: 74, train_loss: 1.1895, test_loss: 1.1708, test_f1: 0.2260
 epoch: 75, train_loss: 1.1882, test_loss: 1.1708, test_f1: 0.2260
 epoch: 76, train_loss: 1.1919, test_loss: 1.1707, test_f1: 0.2260
 epoch: 77, train_loss: 1.1898, test_loss: 1.1699, test_f1: 0.2260
 epoch: 78, train_loss: 1.1878, test_loss: 1.1699, test_f1: 0.2260
 epoch: 79, train_loss: 1.1876, test_loss: 1.1696, test_f1: 0.2260
 epoch: 80, train_loss: 1.1846, test_loss: 1.1690, test_f1: 0.2260
 epoch: 81, train_loss: 1.1891, test_loss: 1.1689, test_f1: 0.2260
 epoch: 82, train_loss: 1.1820, test_loss: 1.1686, test_f1: 0.2260
 epoch: 83, train_loss: 1.1842, test_loss: 1.1676, test_f1: 0.2260
 epoch: 84, train_loss: 1.1821, test_loss: 1.1670, test_f1: 0.2260
 epoch: 85, train_loss: 1.1867, test_loss: 1.1667, test_f1: 0.2260
 epoch: 86, train_loss: 1.1810, test_loss: 1.1664, test_f1: 0.2260
 epoch: 87, train_loss: 1.1801, test_loss: 1.1658, test_f1: 0.2260
 epoch: 88, train_loss: 1.1820, test_loss: 1.1653, test_f1: 0.2260
 epoch: 89, train_loss: 1.1794, test_loss: 1.1657, test_f1: 0.2260
 epoch: 90, train_loss: 1.1819, test_loss: 1.1653, test_f1: 0.2260
 epoch: 91, train_loss: 1.1785, test_loss: 1.1649, test_f1: 0.2260
 epoch: 92, train_loss: 1.1820, test_loss: 1.1646, test_f1: 0.2260
 epoch: 93, train_loss: 1.1806, test_loss: 1.1635, test_f1: 0.2260
 epoch: 94, train_loss: 1.1776, test_loss: 1.1628, test_f1: 0.2260
 epoch: 95, train_loss: 1.1798, test_loss: 1.1623, test_f1: 0.2260
 epoch: 96, train_loss: 1.1794, test_loss: 1.1619, test_f1: 0.2260
 epoch: 97, train_loss: 1.1787, test_loss: 1.1622, test_f1: 0.2260
 epoch: 98, train_loss: 1.1742, test_loss: 1.1614, test_f1: 0.2260
 epoch: 99, train_loss: 1.1763, test_loss: 1.1610, test_f1: 0.2311
##################ITERATION #5 ****************************************
 epoch: 0, train_loss: 1.3159, test_loss: 1.3337, test_f1: 0.2260
 epoch: 1, train_loss: 1.3113, test_loss: 1.3292, test_f1: 0.2260
 epoch: 2, train_loss: 1.3057, test_loss: 1.3244, test_f1: 0.2260
 epoch: 3, train_loss: 1.3003, test_loss: 1.3169, test_f1: 0.2260
 epoch: 4, train_loss: 1.2963, test_loss: 1.3081, test_f1: 0.2260
 epoch: 5, train_loss: 1.2921, test_loss: 1.3002, test_f1: 0.2260
 epoch: 6, train_loss: 1.2893, test_loss: 1.2939, test_f1: 0.2260
 epoch: 7, train_loss: 1.2850, test_loss: 1.2883, test_f1: 0.2260
 epoch: 8, train_loss: 1.2819, test_loss: 1.2836, test_f1: 0.2260
 epoch: 9, train_loss: 1.2785, test_loss: 1.2790, test_f1: 0.2260
 epoch: 10, train_loss: 1.2744, test_loss: 1.2736, test_f1: 0.2260
 epoch: 11, train_loss: 1.2715, test_loss: 1.2688, test_f1: 0.2260
 epoch: 12, train_loss: 1.2687, test_loss: 1.2651, test_f1: 0.2260
 epoch: 13, train_loss: 1.2614, test_loss: 1.2603, test_f1: 0.2260
 epoch: 14, train_loss: 1.2612, test_loss: 1.2552, test_f1: 0.2260
 epoch: 15, train_loss: 1.2551, test_loss: 1.2496, test_f1: 0.2260
 epoch: 16, train_loss: 1.2550, test_loss: 1.2454, test_f1: 0.2260
 epoch: 17, train_loss: 1.2483, test_loss: 1.2410, test_f1: 0.2260
 epoch: 18, train_loss: 1.2505, test_loss: 1.2375, test_f1: 0.2260
 epoch: 19, train_loss: 1.2447, test_loss: 1.2344, test_f1: 0.2260
 epoch: 20, train_loss: 1.2413, test_loss: 1.2301, test_f1: 0.2260
 epoch: 21, train_loss: 1.2344, test_loss: 1.2266, test_f1: 0.2260
 epoch: 22, train_loss: 1.2370, test_loss: 1.2232, test_f1: 0.2260
 epoch: 23, train_loss: 1.2370, test_loss: 1.2201, test_f1: 0.2260
 epoch: 24, train_loss: 1.2333, test_loss: 1.2175, test_f1: 0.2260
 epoch: 25, train_loss: 1.2280, test_loss: 1.2146, test_f1: 0.2260
 epoch: 26, train_loss: 1.2310, test_loss: 1.2121, test_f1: 0.2260
 epoch: 27, train_loss: 1.2223, test_loss: 1.2100, test_f1: 0.2260
 epoch: 28, train_loss: 1.2207, test_loss: 1.2065, test_f1: 0.2260
 epoch: 29, train_loss: 1.2236, test_loss: 1.2040, test_f1: 0.2260
 epoch: 30, train_loss: 1.2175, test_loss: 1.2014, test_f1: 0.2260
 epoch: 31, train_loss: 1.2133, test_loss: 1.1980, test_f1: 0.2260
 epoch: 32, train_loss: 1.2172, test_loss: 1.1958, test_f1: 0.2260
 epoch: 33, train_loss: 1.2148, test_loss: 1.1931, test_f1: 0.2260
 epoch: 34, train_loss: 1.2115, test_loss: 1.1910, test_f1: 0.2260
 epoch: 35, train_loss: 1.2090, test_loss: 1.1894, test_f1: 0.2260
 epoch: 36, train_loss: 1.2083, test_loss: 1.1875, test_f1: 0.2260
 epoch: 37, train_loss: 1.2014, test_loss: 1.1848, test_f1: 0.2260
 epoch: 38, train_loss: 1.1984, test_loss: 1.1821, test_f1: 0.2260
 epoch: 39, train_loss: 1.2022, test_loss: 1.1800, test_f1: 0.2260
 epoch: 40, train_loss: 1.1997, test_loss: 1.1784, test_f1: 0.2260
 epoch: 41, train_loss: 1.1987, test_loss: 1.1765, test_f1: 0.2260
 epoch: 42, train_loss: 1.1977, test_loss: 1.1740, test_f1: 0.2260
 epoch: 43, train_loss: 1.1903, test_loss: 1.1725, test_f1: 0.2260
 epoch: 44, train_loss: 1.1874, test_loss: 1.1708, test_f1: 0.2260
 epoch: 45, train_loss: 1.1901, test_loss: 1.1689, test_f1: 0.2286
 epoch: 46, train_loss: 1.1849, test_loss: 1.1666, test_f1: 0.2452
 epoch: 47, train_loss: 1.1870, test_loss: 1.1655, test_f1: 0.2790
 epoch: 48, train_loss: 1.1849, test_loss: 1.1634, test_f1: 0.3003
 epoch: 49, train_loss: 1.1809, test_loss: 1.1613, test_f1: 0.3146
 epoch: 50, train_loss: 1.1779, test_loss: 1.1599, test_f1: 0.3347
 epoch: 51, train_loss: 1.1800, test_loss: 1.1593, test_f1: 0.3347
 epoch: 52, train_loss: 1.1838, test_loss: 1.1586, test_f1: 0.3339
 epoch: 53, train_loss: 1.1762, test_loss: 1.1584, test_f1: 0.3297
 epoch: 54, train_loss: 1.1769, test_loss: 1.1574, test_f1: 0.3308
 epoch: 55, train_loss: 1.1734, test_loss: 1.1564, test_f1: 0.3298
 epoch: 56, train_loss: 1.1793, test_loss: 1.1556, test_f1: 0.3310
 epoch: 57, train_loss: 1.1712, test_loss: 1.1547, test_f1: 0.3342
 epoch: 58, train_loss: 1.1717, test_loss: 1.1537, test_f1: 0.3318
 epoch: 59, train_loss: 1.1698, test_loss: 1.1533, test_f1: 0.3345
 epoch: 60, train_loss: 1.1717, test_loss: 1.1527, test_f1: 0.3335
 epoch: 61, train_loss: 1.1730, test_loss: 1.1522, test_f1: 0.3358
 epoch: 62, train_loss: 1.1702, test_loss: 1.1507, test_f1: 0.3356
 epoch: 63, train_loss: 1.1696, test_loss: 1.1500, test_f1: 0.3346
 epoch: 64, train_loss: 1.1679, test_loss: 1.1494, test_f1: 0.3344
 epoch: 65, train_loss: 1.1729, test_loss: 1.1484, test_f1: 0.3354
 epoch: 66, train_loss: 1.1647, test_loss: 1.1475, test_f1: 0.3352
 epoch: 67, train_loss: 1.1672, test_loss: 1.1466, test_f1: 0.3342
 epoch: 68, train_loss: 1.1640, test_loss: 1.1460, test_f1: 0.3352
 epoch: 69, train_loss: 1.1696, test_loss: 1.1454, test_f1: 0.3352
 epoch: 70, train_loss: 1.1650, test_loss: 1.1450, test_f1: 0.3352
 epoch: 71, train_loss: 1.1614, test_loss: 1.1440, test_f1: 0.3352
 epoch: 72, train_loss: 1.1600, test_loss: 1.1433, test_f1: 0.3361
 epoch: 73, train_loss: 1.1596, test_loss: 1.1432, test_f1: 0.3381
 epoch: 74, train_loss: 1.1658, test_loss: 1.1432, test_f1: 0.3391
 epoch: 75, train_loss: 1.1568, test_loss: 1.1422, test_f1: 0.3381
 epoch: 76, train_loss: 1.1600, test_loss: 1.1410, test_f1: 0.3381
 epoch: 77, train_loss: 1.1550, test_loss: 1.1404, test_f1: 0.3381
 epoch: 78, train_loss: 1.1599, test_loss: 1.1401, test_f1: 0.3371
 epoch: 79, train_loss: 1.1610, test_loss: 1.1401, test_f1: 0.3391
 epoch: 80, train_loss: 1.1596, test_loss: 1.1396, test_f1: 0.3391
 epoch: 81, train_loss: 1.1559, test_loss: 1.1381, test_f1: 0.3391
 epoch: 82, train_loss: 1.1566, test_loss: 1.1378, test_f1: 0.3391
 epoch: 83, train_loss: 1.1540, test_loss: 1.1374, test_f1: 0.3371
 epoch: 84, train_loss: 1.1616, test_loss: 1.1373, test_f1: 0.3391
 epoch: 85, train_loss: 1.1527, test_loss: 1.1364, test_f1: 0.3391
 epoch: 86, train_loss: 1.1546, test_loss: 1.1361, test_f1: 0.3391
 epoch: 87, train_loss: 1.1507, test_loss: 1.1353, test_f1: 0.3391
 epoch: 88, train_loss: 1.1485, test_loss: 1.1344, test_f1: 0.3391
 epoch: 89, train_loss: 1.1534, test_loss: 1.1339, test_f1: 0.3400
 epoch: 90, train_loss: 1.1489, test_loss: 1.1339, test_f1: 0.3410
 epoch: 91, train_loss: 1.1503, test_loss: 1.1330, test_f1: 0.3391
 epoch: 92, train_loss: 1.1509, test_loss: 1.1325, test_f1: 0.3410
 epoch: 93, train_loss: 1.1501, test_loss: 1.1322, test_f1: 0.3400
 epoch: 94, train_loss: 1.1512, test_loss: 1.1312, test_f1: 0.3400
 epoch: 95, train_loss: 1.1451, test_loss: 1.1305, test_f1: 0.3429
 epoch: 96, train_loss: 1.1470, test_loss: 1.1302, test_f1: 0.3429
 epoch: 97, train_loss: 1.1440, test_loss: 1.1293, test_f1: 0.3429
 epoch: 98, train_loss: 1.1483, test_loss: 1.1291, test_f1: 0.3429
 epoch: 99, train_loss: 1.1463, test_loss: 1.1288, test_f1: 0.3429
##################ITERATION #6 ****************************************
 epoch: 0, train_loss: 1.3242, test_loss: 1.3296, test_f1: 0.2260
 epoch: 1, train_loss: 1.3180, test_loss: 1.3271, test_f1: 0.2260
 epoch: 2, train_loss: 1.3137, test_loss: 1.3282, test_f1: 0.2260
 epoch: 3, train_loss: 1.3106, test_loss: 1.3211, test_f1: 0.2260
 epoch: 4, train_loss: 1.3053, test_loss: 1.3135, test_f1: 0.2260
 epoch: 5, train_loss: 1.3022, test_loss: 1.3086, test_f1: 0.2260
 epoch: 6, train_loss: 1.2985, test_loss: 1.3052, test_f1: 0.2260
 epoch: 7, train_loss: 1.2952, test_loss: 1.3023, test_f1: 0.2260
 epoch: 8, train_loss: 1.2901, test_loss: 1.2989, test_f1: 0.2260
 epoch: 9, train_loss: 1.2887, test_loss: 1.2959, test_f1: 0.2260
 epoch: 10, train_loss: 1.2861, test_loss: 1.2927, test_f1: 0.2260
 epoch: 11, train_loss: 1.2841, test_loss: 1.2898, test_f1: 0.2260
 epoch: 12, train_loss: 1.2791, test_loss: 1.2864, test_f1: 0.2260
 epoch: 13, train_loss: 1.2759, test_loss: 1.2830, test_f1: 0.2260
 epoch: 14, train_loss: 1.2713, test_loss: 1.2802, test_f1: 0.2260
 epoch: 15, train_loss: 1.2690, test_loss: 1.2765, test_f1: 0.2260
 epoch: 16, train_loss: 1.2672, test_loss: 1.2734, test_f1: 0.2260
 epoch: 17, train_loss: 1.2629, test_loss: 1.2694, test_f1: 0.2260
 epoch: 18, train_loss: 1.2615, test_loss: 1.2661, test_f1: 0.2260
 epoch: 19, train_loss: 1.2572, test_loss: 1.2612, test_f1: 0.2260
 epoch: 20, train_loss: 1.2546, test_loss: 1.2576, test_f1: 0.2260
 epoch: 21, train_loss: 1.2506, test_loss: 1.2542, test_f1: 0.2260
 epoch: 22, train_loss: 1.2468, test_loss: 1.2501, test_f1: 0.2260
 epoch: 23, train_loss: 1.2463, test_loss: 1.2464, test_f1: 0.2260
 epoch: 24, train_loss: 1.2411, test_loss: 1.2422, test_f1: 0.2260
 epoch: 25, train_loss: 1.2412, test_loss: 1.2387, test_f1: 0.2260
 epoch: 26, train_loss: 1.2364, test_loss: 1.2358, test_f1: 0.2260
 epoch: 27, train_loss: 1.2382, test_loss: 1.2327, test_f1: 0.2260
 epoch: 28, train_loss: 1.2321, test_loss: 1.2271, test_f1: 0.2260
 epoch: 29, train_loss: 1.2288, test_loss: 1.2236, test_f1: 0.2260
 epoch: 30, train_loss: 1.2279, test_loss: 1.2202, test_f1: 0.2260
 epoch: 31, train_loss: 1.2260, test_loss: 1.2172, test_f1: 0.2260
 epoch: 32, train_loss: 1.2229, test_loss: 1.2152, test_f1: 0.2260
 epoch: 33, train_loss: 1.2247, test_loss: 1.2103, test_f1: 0.2260
 epoch: 34, train_loss: 1.2178, test_loss: 1.2076, test_f1: 0.2260
 epoch: 35, train_loss: 1.2165, test_loss: 1.2051, test_f1: 0.2260
 epoch: 36, train_loss: 1.2143, test_loss: 1.2027, test_f1: 0.2260
 epoch: 37, train_loss: 1.2149, test_loss: 1.2016, test_f1: 0.2260
 epoch: 38, train_loss: 1.2132, test_loss: 1.1993, test_f1: 0.2260
 epoch: 39, train_loss: 1.2099, test_loss: 1.1955, test_f1: 0.2260
 epoch: 40, train_loss: 1.2087, test_loss: 1.1936, test_f1: 0.2260
 epoch: 41, train_loss: 1.2092, test_loss: 1.1916, test_f1: 0.2260
 epoch: 42, train_loss: 1.2056, test_loss: 1.1902, test_f1: 0.2260
 epoch: 43, train_loss: 1.2002, test_loss: 1.1877, test_f1: 0.2260
 epoch: 44, train_loss: 1.1980, test_loss: 1.1859, test_f1: 0.2286
 epoch: 45, train_loss: 1.1990, test_loss: 1.1823, test_f1: 0.2311
 epoch: 46, train_loss: 1.1971, test_loss: 1.1813, test_f1: 0.2359
 epoch: 47, train_loss: 1.1958, test_loss: 1.1797, test_f1: 0.2429
 epoch: 48, train_loss: 1.1982, test_loss: 1.1772, test_f1: 0.2560
 epoch: 49, train_loss: 1.1901, test_loss: 1.1771, test_f1: 0.2699
 epoch: 50, train_loss: 1.1885, test_loss: 1.1723, test_f1: 0.2754
 epoch: 51, train_loss: 1.1871, test_loss: 1.1716, test_f1: 0.2825
 epoch: 52, train_loss: 1.1826, test_loss: 1.1696, test_f1: 0.2825
 epoch: 53, train_loss: 1.1836, test_loss: 1.1702, test_f1: 0.2808
 epoch: 54, train_loss: 1.1809, test_loss: 1.1695, test_f1: 0.2957
 epoch: 55, train_loss: 1.1812, test_loss: 1.1668, test_f1: 0.2957
 epoch: 56, train_loss: 1.1801, test_loss: 1.1661, test_f1: 0.2941
 epoch: 57, train_loss: 1.1828, test_loss: 1.1658, test_f1: 0.3018
 epoch: 58, train_loss: 1.1859, test_loss: 1.1651, test_f1: 0.3091
 epoch: 59, train_loss: 1.1790, test_loss: 1.1626, test_f1: 0.3105
 epoch: 60, train_loss: 1.1785, test_loss: 1.1616, test_f1: 0.3119
 epoch: 61, train_loss: 1.1766, test_loss: 1.1617, test_f1: 0.3173
 epoch: 62, train_loss: 1.1725, test_loss: 1.1595, test_f1: 0.3238
 epoch: 63, train_loss: 1.1758, test_loss: 1.1588, test_f1: 0.3250
 epoch: 64, train_loss: 1.1754, test_loss: 1.1586, test_f1: 0.3287
 epoch: 65, train_loss: 1.1731, test_loss: 1.1565, test_f1: 0.3275
 epoch: 66, train_loss: 1.1750, test_loss: 1.1554, test_f1: 0.3238
 epoch: 67, train_loss: 1.1706, test_loss: 1.1554, test_f1: 0.3311
 epoch: 68, train_loss: 1.1701, test_loss: 1.1535, test_f1: 0.3311
 epoch: 69, train_loss: 1.1676, test_loss: 1.1523, test_f1: 0.3323
 epoch: 70, train_loss: 1.1734, test_loss: 1.1512, test_f1: 0.3335
 epoch: 71, train_loss: 1.1664, test_loss: 1.1498, test_f1: 0.3323
 epoch: 72, train_loss: 1.1676, test_loss: 1.1488, test_f1: 0.3335
 epoch: 73, train_loss: 1.1643, test_loss: 1.1479, test_f1: 0.3381
 epoch: 74, train_loss: 1.1634, test_loss: 1.1475, test_f1: 0.3404
 epoch: 75, train_loss: 1.1659, test_loss: 1.1465, test_f1: 0.3426
 epoch: 76, train_loss: 1.1657, test_loss: 1.1472, test_f1: 0.3447
 epoch: 77, train_loss: 1.1644, test_loss: 1.1472, test_f1: 0.3447
 epoch: 78, train_loss: 1.1593, test_loss: 1.1460, test_f1: 0.3447
 epoch: 79, train_loss: 1.1581, test_loss: 1.1436, test_f1: 0.3426
 epoch: 80, train_loss: 1.1571, test_loss: 1.1422, test_f1: 0.3458
 epoch: 81, train_loss: 1.1591, test_loss: 1.1430, test_f1: 0.3458
 epoch: 82, train_loss: 1.1573, test_loss: 1.1421, test_f1: 0.3458
 epoch: 83, train_loss: 1.1553, test_loss: 1.1394, test_f1: 0.3458
 epoch: 84, train_loss: 1.1620, test_loss: 1.1386, test_f1: 0.3469
 epoch: 85, train_loss: 1.1544, test_loss: 1.1380, test_f1: 0.3479
 epoch: 86, train_loss: 1.1557, test_loss: 1.1360, test_f1: 0.3469
 epoch: 87, train_loss: 1.1481, test_loss: 1.1390, test_f1: 0.3490
 epoch: 88, train_loss: 1.1522, test_loss: 1.1397, test_f1: 0.3500
 epoch: 89, train_loss: 1.1541, test_loss: 1.1383, test_f1: 0.3490
 epoch: 90, train_loss: 1.1502, test_loss: 1.1357, test_f1: 0.3479
 epoch: 91, train_loss: 1.1521, test_loss: 1.1342, test_f1: 0.3476
 epoch: 92, train_loss: 1.1472, test_loss: 1.1334, test_f1: 0.3465
 epoch: 93, train_loss: 1.1453, test_loss: 1.1331, test_f1: 0.3500
 epoch: 94, train_loss: 1.1447, test_loss: 1.1311, test_f1: 0.3490
 epoch: 95, train_loss: 1.1501, test_loss: 1.1321, test_f1: 0.3486
 epoch: 96, train_loss: 1.1439, test_loss: 1.1310, test_f1: 0.3486
 epoch: 97, train_loss: 1.1474, test_loss: 1.1319, test_f1: 0.3510
 epoch: 98, train_loss: 1.1426, test_loss: 1.1309, test_f1: 0.3489
 epoch: 99, train_loss: 1.1413, test_loss: 1.1293, test_f1: 0.3497
##################ITERATION #7 ****************************************
 epoch: 0, train_loss: 1.3794, test_loss: 1.4125, test_f1: 0.0303
 epoch: 1, train_loss: 1.3693, test_loss: 1.4117, test_f1: 0.0303
 epoch: 2, train_loss: 1.3619, test_loss: 1.4087, test_f1: 0.0364
 epoch: 3, train_loss: 1.3555, test_loss: 1.4010, test_f1: 0.1617
 epoch: 4, train_loss: 1.3472, test_loss: 1.3882, test_f1: 0.1929
 epoch: 5, train_loss: 1.3406, test_loss: 1.3735, test_f1: 0.2103
 epoch: 6, train_loss: 1.3310, test_loss: 1.3603, test_f1: 0.2304
 epoch: 7, train_loss: 1.3257, test_loss: 1.3501, test_f1: 0.2338
 epoch: 8, train_loss: 1.3170, test_loss: 1.3370, test_f1: 0.2277
 epoch: 9, train_loss: 1.3055, test_loss: 1.3273, test_f1: 0.2286
 epoch: 10, train_loss: 1.2988, test_loss: 1.3156, test_f1: 0.2286
 epoch: 11, train_loss: 1.2902, test_loss: 1.3061, test_f1: 0.2286
 epoch: 12, train_loss: 1.2812, test_loss: 1.2954, test_f1: 0.2260
 epoch: 13, train_loss: 1.2803, test_loss: 1.2871, test_f1: 0.2260
 epoch: 14, train_loss: 1.2692, test_loss: 1.2773, test_f1: 0.2260
 epoch: 15, train_loss: 1.2626, test_loss: 1.2686, test_f1: 0.2260
 epoch: 16, train_loss: 1.2642, test_loss: 1.2620, test_f1: 0.2286
 epoch: 17, train_loss: 1.2570, test_loss: 1.2563, test_f1: 0.2286
 epoch: 18, train_loss: 1.2513, test_loss: 1.2506, test_f1: 0.2311
 epoch: 19, train_loss: 1.2417, test_loss: 1.2404, test_f1: 0.2311
 epoch: 20, train_loss: 1.2423, test_loss: 1.2376, test_f1: 0.2383
 epoch: 21, train_loss: 1.2386, test_loss: 1.2318, test_f1: 0.2560
 epoch: 22, train_loss: 1.2290, test_loss: 1.2203, test_f1: 0.2452
 epoch: 23, train_loss: 1.2263, test_loss: 1.2181, test_f1: 0.2680
 epoch: 24, train_loss: 1.2194, test_loss: 1.2075, test_f1: 0.2641
 epoch: 25, train_loss: 1.2158, test_loss: 1.2031, test_f1: 0.2661
 epoch: 26, train_loss: 1.2153, test_loss: 1.2011, test_f1: 0.2772
 epoch: 27, train_loss: 1.2110, test_loss: 1.1935, test_f1: 0.2772
 epoch: 28, train_loss: 1.2069, test_loss: 1.1947, test_f1: 0.3003
 epoch: 29, train_loss: 1.2071, test_loss: 1.1851, test_f1: 0.2972
 epoch: 30, train_loss: 1.2022, test_loss: 1.1856, test_f1: 0.3105
 epoch: 31, train_loss: 1.1967, test_loss: 1.1819, test_f1: 0.3105
 epoch: 32, train_loss: 1.1934, test_loss: 1.1789, test_f1: 0.3132
 epoch: 33, train_loss: 1.1885, test_loss: 1.1686, test_f1: 0.3105
 epoch: 34, train_loss: 1.1911, test_loss: 1.1674, test_f1: 0.3132
 epoch: 35, train_loss: 1.1871, test_loss: 1.1635, test_f1: 0.3212
 epoch: 36, train_loss: 1.1817, test_loss: 1.1609, test_f1: 0.3225
 epoch: 37, train_loss: 1.1794, test_loss: 1.1572, test_f1: 0.3225
 epoch: 38, train_loss: 1.1732, test_loss: 1.1535, test_f1: 0.3238
 epoch: 39, train_loss: 1.1730, test_loss: 1.1479, test_f1: 0.3250
 epoch: 40, train_loss: 1.1741, test_loss: 1.1479, test_f1: 0.3323
 epoch: 41, train_loss: 1.1660, test_loss: 1.1428, test_f1: 0.3323
 epoch: 42, train_loss: 1.1642, test_loss: 1.1392, test_f1: 0.3263
 epoch: 43, train_loss: 1.1633, test_loss: 1.1393, test_f1: 0.3370
 epoch: 44, train_loss: 1.1616, test_loss: 1.1334, test_f1: 0.3381
 epoch: 45, train_loss: 1.1631, test_loss: 1.1322, test_f1: 0.3432
 epoch: 46, train_loss: 1.1561, test_loss: 1.1300, test_f1: 0.3457
 epoch: 47, train_loss: 1.1520, test_loss: 1.1284, test_f1: 0.3491
 epoch: 48, train_loss: 1.1559, test_loss: 1.1250, test_f1: 0.3446
 epoch: 49, train_loss: 1.1438, test_loss: 1.1219, test_f1: 0.3516
 epoch: 50, train_loss: 1.1487, test_loss: 1.1203, test_f1: 0.3542
 epoch: 51, train_loss: 1.1437, test_loss: 1.1181, test_f1: 0.3553
 epoch: 52, train_loss: 1.1473, test_loss: 1.1173, test_f1: 0.3553
 epoch: 53, train_loss: 1.1473, test_loss: 1.1167, test_f1: 0.3542
 epoch: 54, train_loss: 1.1429, test_loss: 1.1164, test_f1: 0.3567
 epoch: 55, train_loss: 1.1371, test_loss: 1.1154, test_f1: 0.3594
 epoch: 56, train_loss: 1.1390, test_loss: 1.1140, test_f1: 0.3589
 epoch: 57, train_loss: 1.1451, test_loss: 1.1138, test_f1: 0.3583
 epoch: 58, train_loss: 1.1364, test_loss: 1.1124, test_f1: 0.3583
 epoch: 59, train_loss: 1.1418, test_loss: 1.1114, test_f1: 0.3583
 epoch: 60, train_loss: 1.1368, test_loss: 1.1100, test_f1: 0.3594
 epoch: 61, train_loss: 1.1348, test_loss: 1.1100, test_f1: 0.3605
 epoch: 62, train_loss: 1.1369, test_loss: 1.1081, test_f1: 0.3630
 epoch: 63, train_loss: 1.1331, test_loss: 1.1068, test_f1: 0.3647
 epoch: 64, train_loss: 1.1361, test_loss: 1.1071, test_f1: 0.3639
 epoch: 65, train_loss: 1.1357, test_loss: 1.1103, test_f1: 0.3692
 epoch: 66, train_loss: 1.1319, test_loss: 1.1059, test_f1: 0.3650
 epoch: 67, train_loss: 1.1315, test_loss: 1.1056, test_f1: 0.3638
 epoch: 68, train_loss: 1.1345, test_loss: 1.1054, test_f1: 0.3662
 epoch: 69, train_loss: 1.1289, test_loss: 1.1011, test_f1: 0.3626
 epoch: 70, train_loss: 1.1270, test_loss: 1.0998, test_f1: 0.3698
 epoch: 71, train_loss: 1.1305, test_loss: 1.1006, test_f1: 0.3676
 epoch: 72, train_loss: 1.1265, test_loss: 1.1031, test_f1: 0.3682
 epoch: 73, train_loss: 1.1236, test_loss: 1.0989, test_f1: 0.3702
 epoch: 74, train_loss: 1.1255, test_loss: 1.0977, test_f1: 0.3713
 epoch: 75, train_loss: 1.1251, test_loss: 1.0974, test_f1: 0.3676
 epoch: 76, train_loss: 1.1222, test_loss: 1.0969, test_f1: 0.3676
 epoch: 77, train_loss: 1.1221, test_loss: 1.0967, test_f1: 0.3720
 epoch: 78, train_loss: 1.1210, test_loss: 1.0966, test_f1: 0.3726
 epoch: 79, train_loss: 1.1161, test_loss: 1.0932, test_f1: 0.3697
 epoch: 80, train_loss: 1.1228, test_loss: 1.0928, test_f1: 0.3720
 epoch: 81, train_loss: 1.1187, test_loss: 1.0913, test_f1: 0.3697
 epoch: 82, train_loss: 1.1170, test_loss: 1.0913, test_f1: 0.3720
 epoch: 83, train_loss: 1.1227, test_loss: 1.0924, test_f1: 0.3756
 epoch: 84, train_loss: 1.1159, test_loss: 1.0891, test_f1: 0.3801
 epoch: 85, train_loss: 1.1133, test_loss: 1.0892, test_f1: 0.3737
 epoch: 86, train_loss: 1.1165, test_loss: 1.0878, test_f1: 0.3760
 epoch: 87, train_loss: 1.1147, test_loss: 1.0910, test_f1: 0.3740
 epoch: 88, train_loss: 1.1176, test_loss: 1.0880, test_f1: 0.3791
 epoch: 89, train_loss: 1.1136, test_loss: 1.0858, test_f1: 0.3828
 epoch: 90, train_loss: 1.1187, test_loss: 1.0853, test_f1: 0.3829
 epoch: 91, train_loss: 1.1107, test_loss: 1.0878, test_f1: 0.3756
 epoch: 92, train_loss: 1.1096, test_loss: 1.0852, test_f1: 0.3804
 epoch: 93, train_loss: 1.1076, test_loss: 1.0834, test_f1: 0.3844
 epoch: 94, train_loss: 1.1099, test_loss: 1.0834, test_f1: 0.3859
 epoch: 95, train_loss: 1.1114, test_loss: 1.0818, test_f1: 0.3870
 epoch: 96, train_loss: 1.1100, test_loss: 1.0839, test_f1: 0.3915
 epoch: 97, train_loss: 1.1113, test_loss: 1.0842, test_f1: 0.3870
 epoch: 98, train_loss: 1.1060, test_loss: 1.0824, test_f1: 0.3892
 epoch: 99, train_loss: 1.1072, test_loss: 1.0808, test_f1: 0.3905
##################ITERATION #8 ****************************************
 epoch: 0, train_loss: 1.3158, test_loss: 1.3278, test_f1: 0.2260
 epoch: 1, train_loss: 1.3056, test_loss: 1.3237, test_f1: 0.2260
 epoch: 2, train_loss: 1.3000, test_loss: 1.3183, test_f1: 0.2260
 epoch: 3, train_loss: 1.2934, test_loss: 1.3081, test_f1: 0.2260
 epoch: 4, train_loss: 1.2903, test_loss: 1.3006, test_f1: 0.2260
 epoch: 5, train_loss: 1.2853, test_loss: 1.2932, test_f1: 0.2260
 epoch: 6, train_loss: 1.2812, test_loss: 1.2881, test_f1: 0.2260
 epoch: 7, train_loss: 1.2770, test_loss: 1.2825, test_f1: 0.2260
 epoch: 8, train_loss: 1.2723, test_loss: 1.2761, test_f1: 0.2260
 epoch: 9, train_loss: 1.2682, test_loss: 1.2719, test_f1: 0.2260
 epoch: 10, train_loss: 1.2641, test_loss: 1.2681, test_f1: 0.2260
 epoch: 11, train_loss: 1.2615, test_loss: 1.2627, test_f1: 0.2260
 epoch: 12, train_loss: 1.2546, test_loss: 1.2575, test_f1: 0.2260
 epoch: 13, train_loss: 1.2493, test_loss: 1.2520, test_f1: 0.2260
 epoch: 14, train_loss: 1.2499, test_loss: 1.2475, test_f1: 0.2260
 epoch: 15, train_loss: 1.2477, test_loss: 1.2431, test_f1: 0.2260
 epoch: 16, train_loss: 1.2456, test_loss: 1.2397, test_f1: 0.2260
 epoch: 17, train_loss: 1.2374, test_loss: 1.2348, test_f1: 0.2260
 epoch: 18, train_loss: 1.2349, test_loss: 1.2318, test_f1: 0.2260
 epoch: 19, train_loss: 1.2309, test_loss: 1.2273, test_f1: 0.2260
 epoch: 20, train_loss: 1.2324, test_loss: 1.2226, test_f1: 0.2260
 epoch: 21, train_loss: 1.2259, test_loss: 1.2192, test_f1: 0.2260
 epoch: 22, train_loss: 1.2206, test_loss: 1.2137, test_f1: 0.2260
 epoch: 23, train_loss: 1.2178, test_loss: 1.2117, test_f1: 0.2260
 epoch: 24, train_loss: 1.2145, test_loss: 1.2068, test_f1: 0.2311
 epoch: 25, train_loss: 1.2144, test_loss: 1.2018, test_f1: 0.2335
 epoch: 26, train_loss: 1.2113, test_loss: 1.2008, test_f1: 0.2359
 epoch: 27, train_loss: 1.2048, test_loss: 1.1957, test_f1: 0.2474
 epoch: 28, train_loss: 1.2053, test_loss: 1.1928, test_f1: 0.2680
 epoch: 29, train_loss: 1.2061, test_loss: 1.1900, test_f1: 0.2772
 epoch: 30, train_loss: 1.1945, test_loss: 1.1859, test_f1: 0.2972
 epoch: 31, train_loss: 1.1962, test_loss: 1.1835, test_f1: 0.3091
 epoch: 32, train_loss: 1.1945, test_loss: 1.1781, test_f1: 0.3132
 epoch: 33, train_loss: 1.1918, test_loss: 1.1735, test_f1: 0.3199
 epoch: 34, train_loss: 1.1853, test_loss: 1.1735, test_f1: 0.3311
 epoch: 35, train_loss: 1.1851, test_loss: 1.1687, test_f1: 0.3323
 epoch: 36, train_loss: 1.1822, test_loss: 1.1657, test_f1: 0.3392
 epoch: 37, train_loss: 1.1796, test_loss: 1.1646, test_f1: 0.3437
 epoch: 38, train_loss: 1.1763, test_loss: 1.1595, test_f1: 0.3437
 epoch: 39, train_loss: 1.1780, test_loss: 1.1561, test_f1: 0.3447
 epoch: 40, train_loss: 1.1718, test_loss: 1.1542, test_f1: 0.3447
 epoch: 41, train_loss: 1.1710, test_loss: 1.1535, test_f1: 0.3458
 epoch: 42, train_loss: 1.1700, test_loss: 1.1510, test_f1: 0.3486
 epoch: 43, train_loss: 1.1667, test_loss: 1.1517, test_f1: 0.3512
 epoch: 44, train_loss: 1.1668, test_loss: 1.1482, test_f1: 0.3503
 epoch: 45, train_loss: 1.1606, test_loss: 1.1440, test_f1: 0.3434
 epoch: 46, train_loss: 1.1651, test_loss: 1.1458, test_f1: 0.3460
 epoch: 47, train_loss: 1.1603, test_loss: 1.1428, test_f1: 0.3460
 epoch: 48, train_loss: 1.1520, test_loss: 1.1397, test_f1: 0.3460
 epoch: 49, train_loss: 1.1528, test_loss: 1.1399, test_f1: 0.3410
 epoch: 50, train_loss: 1.1521, test_loss: 1.1370, test_f1: 0.3430
 epoch: 51, train_loss: 1.1463, test_loss: 1.1346, test_f1: 0.3430
 epoch: 52, train_loss: 1.1559, test_loss: 1.1313, test_f1: 0.3460
 epoch: 53, train_loss: 1.1464, test_loss: 1.1317, test_f1: 0.3410
 epoch: 54, train_loss: 1.1484, test_loss: 1.1303, test_f1: 0.3410
 epoch: 55, train_loss: 1.1446, test_loss: 1.1302, test_f1: 0.3467
 epoch: 56, train_loss: 1.1462, test_loss: 1.1285, test_f1: 0.3442
 epoch: 57, train_loss: 1.1497, test_loss: 1.1279, test_f1: 0.3455
 epoch: 58, train_loss: 1.1468, test_loss: 1.1289, test_f1: 0.3402
 epoch: 59, train_loss: 1.1449, test_loss: 1.1284, test_f1: 0.3418
 epoch: 60, train_loss: 1.1415, test_loss: 1.1283, test_f1: 0.3462
 epoch: 61, train_loss: 1.1420, test_loss: 1.1251, test_f1: 0.3432
 epoch: 62, train_loss: 1.1416, test_loss: 1.1261, test_f1: 0.3462
 epoch: 63, train_loss: 1.1388, test_loss: 1.1260, test_f1: 0.3462
 epoch: 64, train_loss: 1.1374, test_loss: 1.1242, test_f1: 0.3437
 epoch: 65, train_loss: 1.1391, test_loss: 1.1239, test_f1: 0.3439
 epoch: 66, train_loss: 1.1394, test_loss: 1.1248, test_f1: 0.3462
 epoch: 67, train_loss: 1.1376, test_loss: 1.1246, test_f1: 0.3488
 epoch: 68, train_loss: 1.1368, test_loss: 1.1213, test_f1: 0.3512
 epoch: 69, train_loss: 1.1343, test_loss: 1.1180, test_f1: 0.3488
 epoch: 70, train_loss: 1.1318, test_loss: 1.1195, test_f1: 0.3512
 epoch: 71, train_loss: 1.1363, test_loss: 1.1211, test_f1: 0.3493
 epoch: 72, train_loss: 1.1295, test_loss: 1.1185, test_f1: 0.3512
 epoch: 73, train_loss: 1.1287, test_loss: 1.1196, test_f1: 0.3484
 epoch: 74, train_loss: 1.1318, test_loss: 1.1168, test_f1: 0.3493
 epoch: 75, train_loss: 1.1337, test_loss: 1.1171, test_f1: 0.3493
 epoch: 76, train_loss: 1.1313, test_loss: 1.1148, test_f1: 0.3503
 epoch: 77, train_loss: 1.1299, test_loss: 1.1148, test_f1: 0.3524
 epoch: 78, train_loss: 1.1233, test_loss: 1.1160, test_f1: 0.3503
 epoch: 79, train_loss: 1.1259, test_loss: 1.1144, test_f1: 0.3493
 epoch: 80, train_loss: 1.1256, test_loss: 1.1139, test_f1: 0.3484
 epoch: 81, train_loss: 1.1234, test_loss: 1.1136, test_f1: 0.3493
 epoch: 82, train_loss: 1.1239, test_loss: 1.1097, test_f1: 0.3503
 epoch: 83, train_loss: 1.1268, test_loss: 1.1112, test_f1: 0.3493
 epoch: 84, train_loss: 1.1235, test_loss: 1.1092, test_f1: 0.3502
 epoch: 85, train_loss: 1.1246, test_loss: 1.1077, test_f1: 0.3512
 epoch: 86, train_loss: 1.1177, test_loss: 1.1071, test_f1: 0.3512
 epoch: 87, train_loss: 1.1196, test_loss: 1.1077, test_f1: 0.3493
 epoch: 88, train_loss: 1.1154, test_loss: 1.1054, test_f1: 0.3502
 epoch: 89, train_loss: 1.1172, test_loss: 1.1051, test_f1: 0.3493
 epoch: 90, train_loss: 1.1211, test_loss: 1.1075, test_f1: 0.3500
 epoch: 91, train_loss: 1.1153, test_loss: 1.1049, test_f1: 0.3502
 epoch: 92, train_loss: 1.1202, test_loss: 1.1008, test_f1: 0.3522
 epoch: 93, train_loss: 1.1235, test_loss: 1.1020, test_f1: 0.3493
 epoch: 94, train_loss: 1.1151, test_loss: 1.1007, test_f1: 0.3512
 epoch: 95, train_loss: 1.1146, test_loss: 1.1017, test_f1: 0.3502
 epoch: 96, train_loss: 1.1163, test_loss: 1.1009, test_f1: 0.3502
 epoch: 97, train_loss: 1.1153, test_loss: 1.1004, test_f1: 0.3502
 epoch: 98, train_loss: 1.1175, test_loss: 1.1007, test_f1: 0.3502
 epoch: 99, train_loss: 1.1094, test_loss: 1.1001, test_f1: 0.3500
##################ITERATION #9 ****************************************
 epoch: 0, train_loss: 1.3354, test_loss: 1.3550, test_f1: 0.2260
 epoch: 1, train_loss: 1.3209, test_loss: 1.3571, test_f1: 0.2260
 epoch: 2, train_loss: 1.3122, test_loss: 1.3624, test_f1: 0.2260
 epoch: 3, train_loss: 1.3030, test_loss: 1.3576, test_f1: 0.2260
 epoch: 4, train_loss: 1.2971, test_loss: 1.3391, test_f1: 0.2260
 epoch: 5, train_loss: 1.2894, test_loss: 1.3070, test_f1: 0.2260
 epoch: 6, train_loss: 1.2801, test_loss: 1.2922, test_f1: 0.2260
 epoch: 7, train_loss: 1.2757, test_loss: 1.2823, test_f1: 0.2260
 epoch: 8, train_loss: 1.2718, test_loss: 1.2754, test_f1: 0.2260
 epoch: 9, train_loss: 1.2641, test_loss: 1.2687, test_f1: 0.2260
 epoch: 10, train_loss: 1.2569, test_loss: 1.2605, test_f1: 0.2260
 epoch: 11, train_loss: 1.2541, test_loss: 1.2543, test_f1: 0.2260
 epoch: 12, train_loss: 1.2490, test_loss: 1.2485, test_f1: 0.2260
 epoch: 13, train_loss: 1.2423, test_loss: 1.2432, test_f1: 0.2260
 epoch: 14, train_loss: 1.2374, test_loss: 1.2369, test_f1: 0.2260
 epoch: 15, train_loss: 1.2351, test_loss: 1.2308, test_f1: 0.2260
 epoch: 16, train_loss: 1.2312, test_loss: 1.2261, test_f1: 0.2260
 epoch: 17, train_loss: 1.2290, test_loss: 1.2218, test_f1: 0.2260
 epoch: 18, train_loss: 1.2228, test_loss: 1.2163, test_f1: 0.2260
 epoch: 19, train_loss: 1.2234, test_loss: 1.2121, test_f1: 0.2260
 epoch: 20, train_loss: 1.2153, test_loss: 1.2074, test_f1: 0.2286
 epoch: 21, train_loss: 1.2145, test_loss: 1.2027, test_f1: 0.2286
 epoch: 22, train_loss: 1.2119, test_loss: 1.1989, test_f1: 0.2429
 epoch: 23, train_loss: 1.2114, test_loss: 1.1951, test_f1: 0.2621
 epoch: 24, train_loss: 1.2047, test_loss: 1.1918, test_f1: 0.2909
 epoch: 25, train_loss: 1.2030, test_loss: 1.1880, test_f1: 0.3105
 epoch: 26, train_loss: 1.1972, test_loss: 1.1838, test_f1: 0.3186
 epoch: 27, train_loss: 1.1949, test_loss: 1.1810, test_f1: 0.3361
 epoch: 28, train_loss: 1.1922, test_loss: 1.1784, test_f1: 0.3395
 epoch: 29, train_loss: 1.1910, test_loss: 1.1739, test_f1: 0.3473
 epoch: 30, train_loss: 1.1891, test_loss: 1.1702, test_f1: 0.3494
 epoch: 31, train_loss: 1.1873, test_loss: 1.1680, test_f1: 0.3505
 epoch: 32, train_loss: 1.1809, test_loss: 1.1642, test_f1: 0.3505
 epoch: 33, train_loss: 1.1781, test_loss: 1.1606, test_f1: 0.3505
 epoch: 34, train_loss: 1.1771, test_loss: 1.1578, test_f1: 0.3505
 epoch: 35, train_loss: 1.1731, test_loss: 1.1549, test_f1: 0.3512
 epoch: 36, train_loss: 1.1705, test_loss: 1.1509, test_f1: 0.3526
 epoch: 37, train_loss: 1.1686, test_loss: 1.1480, test_f1: 0.3546
 epoch: 38, train_loss: 1.1678, test_loss: 1.1469, test_f1: 0.3553
 epoch: 39, train_loss: 1.1654, test_loss: 1.1429, test_f1: 0.3663
 epoch: 40, train_loss: 1.1642, test_loss: 1.1406, test_f1: 0.3673
 epoch: 41, train_loss: 1.1599, test_loss: 1.1372, test_f1: 0.3673
 epoch: 42, train_loss: 1.1530, test_loss: 1.1353, test_f1: 0.3659
 epoch: 43, train_loss: 1.1543, test_loss: 1.1327, test_f1: 0.3635
 epoch: 44, train_loss: 1.1504, test_loss: 1.1304, test_f1: 0.3670
 epoch: 45, train_loss: 1.1499, test_loss: 1.1285, test_f1: 0.3660
 epoch: 46, train_loss: 1.1476, test_loss: 1.1265, test_f1: 0.3667
 epoch: 47, train_loss: 1.1442, test_loss: 1.1245, test_f1: 0.3666
 epoch: 48, train_loss: 1.1405, test_loss: 1.1227, test_f1: 0.3700
 epoch: 49, train_loss: 1.1434, test_loss: 1.1212, test_f1: 0.3685
 epoch: 50, train_loss: 1.1420, test_loss: 1.1185, test_f1: 0.3685
 epoch: 51, train_loss: 1.1363, test_loss: 1.1164, test_f1: 0.3707
 epoch: 52, train_loss: 1.1352, test_loss: 1.1159, test_f1: 0.3737
 epoch: 53, train_loss: 1.1308, test_loss: 1.1153, test_f1: 0.3737
 epoch: 54, train_loss: 1.1310, test_loss: 1.1135, test_f1: 0.3721
 epoch: 55, train_loss: 1.1328, test_loss: 1.1137, test_f1: 0.3721
 epoch: 56, train_loss: 1.1288, test_loss: 1.1104, test_f1: 0.3722
 epoch: 57, train_loss: 1.1284, test_loss: 1.1098, test_f1: 0.3722
 epoch: 58, train_loss: 1.1309, test_loss: 1.1103, test_f1: 0.3709
 epoch: 59, train_loss: 1.1311, test_loss: 1.1080, test_f1: 0.3713
 epoch: 60, train_loss: 1.1274, test_loss: 1.1074, test_f1: 0.3722
 epoch: 61, train_loss: 1.1265, test_loss: 1.1073, test_f1: 0.3704
 epoch: 62, train_loss: 1.1206, test_loss: 1.1069, test_f1: 0.3677
 epoch: 63, train_loss: 1.1259, test_loss: 1.1066, test_f1: 0.3648
 epoch: 64, train_loss: 1.1194, test_loss: 1.1046, test_f1: 0.3730
 epoch: 65, train_loss: 1.1202, test_loss: 1.1039, test_f1: 0.3707
 epoch: 66, train_loss: 1.1197, test_loss: 1.1043, test_f1: 0.3659
 epoch: 67, train_loss: 1.1214, test_loss: 1.1028, test_f1: 0.3652
 epoch: 68, train_loss: 1.1242, test_loss: 1.1018, test_f1: 0.3739
 epoch: 69, train_loss: 1.1155, test_loss: 1.1012, test_f1: 0.3781
 epoch: 70, train_loss: 1.1174, test_loss: 1.1004, test_f1: 0.3830
 epoch: 71, train_loss: 1.1170, test_loss: 1.0998, test_f1: 0.3852
 epoch: 72, train_loss: 1.1192, test_loss: 1.0984, test_f1: 0.3825
 epoch: 73, train_loss: 1.1138, test_loss: 1.0986, test_f1: 0.3847
 epoch: 74, train_loss: 1.1139, test_loss: 1.0988, test_f1: 0.3837
 epoch: 75, train_loss: 1.1113, test_loss: 1.0986, test_f1: 0.3827
 epoch: 76, train_loss: 1.1114, test_loss: 1.0972, test_f1: 0.3836
 epoch: 77, train_loss: 1.1177, test_loss: 1.0956, test_f1: 0.3856
 epoch: 78, train_loss: 1.1084, test_loss: 1.0965, test_f1: 0.3823
 epoch: 79, train_loss: 1.1067, test_loss: 1.0963, test_f1: 0.3828
 epoch: 80, train_loss: 1.1113, test_loss: 1.0962, test_f1: 0.3801
 epoch: 81, train_loss: 1.1089, test_loss: 1.0946, test_f1: 0.3855
 epoch: 82, train_loss: 1.1074, test_loss: 1.0938, test_f1: 0.3865
 epoch: 83, train_loss: 1.1053, test_loss: 1.0942, test_f1: 0.3811
 epoch: 84, train_loss: 1.1025, test_loss: 1.0925, test_f1: 0.3828
 epoch: 85, train_loss: 1.1046, test_loss: 1.0943, test_f1: 0.3760
 epoch: 86, train_loss: 1.1055, test_loss: 1.0917, test_f1: 0.3823
 epoch: 87, train_loss: 1.1061, test_loss: 1.0901, test_f1: 0.3843
 epoch: 88, train_loss: 1.0994, test_loss: 1.0903, test_f1: 0.3820
 epoch: 89, train_loss: 1.0977, test_loss: 1.0898, test_f1: 0.3843
 epoch: 90, train_loss: 1.0953, test_loss: 1.0897, test_f1: 0.3825
 epoch: 91, train_loss: 1.0961, test_loss: 1.0888, test_f1: 0.3825
 epoch: 92, train_loss: 1.1010, test_loss: 1.0884, test_f1: 0.3827
 epoch: 93, train_loss: 1.0980, test_loss: 1.0886, test_f1: 0.3766
 epoch: 94, train_loss: 1.0969, test_loss: 1.0871, test_f1: 0.3857
 epoch: 95, train_loss: 1.0969, test_loss: 1.0858, test_f1: 0.3882
 epoch: 96, train_loss: 1.0847, test_loss: 1.0853, test_f1: 0.3837
 epoch: 97, train_loss: 1.0975, test_loss: 1.0850, test_f1: 0.3840
 epoch: 98, train_loss: 1.0946, test_loss: 1.0830, test_f1: 0.3894
 epoch: 99, train_loss: 1.0953, test_loss: 1.0815, test_f1: 0.3919

Training completed in 447.97 seconds
Best F1: 0.3919 at epoch 99
Mean F1 across iterations: 0.3178  0.0567
========================FINAL RESULTS================================
FEGIN weighted F1: 0.3919  0.0567
python main.py --data ltspice_examples --representation component_pin --model FEGIN --layers 6 --hiddens 16 --batch_size 256 --lr 0.0001 --emb_size 512 --epochs 100 --save_appendix component_pin_L6_H16_BS256_LR0.0001_E512 --no_val
-----



STDERR:
  File "main.py", line 370, in <module>
    main()
  File "main.py", line 254, in main
    dataset = dataset_class(
  File "/home/philip/projects/ltspice_examples_code_repo/Circuit-Completion-Using-GNNs/component_classification_with_link_prediction_head/evaluation/FEGIN/kernel/circuit_datasets.py", line 15, in __init__
    self.data, self.slices = torch.load(self.processed_paths[0])
  File "/home/philip/.local/lib/python3.8/site-packages/torch/serialization.py", line 1040, in load
    warnings.warn(
  File "/usr/lib/python3.8/warnings.py", line 109, in _showwarnmsg
    sw(msg.message, msg.category, msg.filename, msg.lineno,
  File "main.py", line 47, in warn_with_traceback
    traceback.print_stack(file=log)
/home/philip/projects/ltspice_examples_code_repo/Circuit-Completion-Using-GNNs/component_classification_with_link_prediction_head/evaluation/FEGIN/kernel/circuit_datasets.py:15: FutureWarning: You are using `torch.load` with `weights_only=False` (the current default value), which uses the default pickle module implicitly. It is possible to construct malicious pickle data which will execute arbitrary code during unpickling (See https://github.com/pytorch/pytorch/blob/main/SECURITY.md#untrusted-models for more details). In a future release, the default value for `weights_only` will be flipped to `True`. This limits the functions that could be executed during unpickling. Arbitrary objects will no longer be allowed to be loaded via this mode unless they are explicitly allowlisted by the user via `torch.serialization.add_safe_globals`. We recommend you start setting `weights_only=True` for any use case where you don't have full control of the loaded file. Please open an issue on GitHub for any issues related to this experimental feature.
  self.data, self.slices = torch.load(self.processed_paths[0])
