STDOUT:
Results will be saved in /home/philip/projects/ltspice_examples_code_repo/Circuit-Completion-Using-GNNs/component_classification_with_link_prediction_head/evaluation/FEGIN/results/model_FEGIN_dataset_ltspice_examples
Command line input: python main.py --data ltspice_examples --representation component_component --model FEGIN --layers 4 --hiddens 128 --batch_size 128 --lr 0.0001 --emb_size 128 --epochs 100 --save_appendix component_component_L4_H128_BS128_LR0.0001_E128 --no_val
 is saved.
-----
ltspice_examples - FEGIN
Using 4 layers, 128 hidden units, h = 2
Loading component_component representation dataset
ENTERED
Training FEGIN on component_component representation
Train: 3556, Test: 845
##################ITERATION #0 ****************************************
 epoch: 0, train_loss: 1.3581, test_loss: 1.3532, test_f1: 0.2274
 epoch: 1, train_loss: 1.3281, test_loss: 1.3258, test_f1: 0.2274
 epoch: 2, train_loss: 1.3013, test_loss: 1.2931, test_f1: 0.2555
 epoch: 3, train_loss: 1.2744, test_loss: 1.2562, test_f1: 0.3010
 epoch: 4, train_loss: 1.2464, test_loss: 1.2249, test_f1: 0.3085
 epoch: 5, train_loss: 1.2230, test_loss: 1.1979, test_f1: 0.3386
 epoch: 6, train_loss: 1.2002, test_loss: 1.1755, test_f1: 0.3624
 epoch: 7, train_loss: 1.1788, test_loss: 1.1549, test_f1: 0.3664
 epoch: 8, train_loss: 1.1595, test_loss: 1.1313, test_f1: 0.3591
 epoch: 9, train_loss: 1.1424, test_loss: 1.1144, test_f1: 0.4135
 epoch: 10, train_loss: 1.1260, test_loss: 1.0978, test_f1: 0.4224
 epoch: 11, train_loss: 1.1052, test_loss: 1.0891, test_f1: 0.4222
 epoch: 12, train_loss: 1.0847, test_loss: 1.0712, test_f1: 0.4398
 epoch: 13, train_loss: 1.0709, test_loss: 1.0529, test_f1: 0.4487
 epoch: 14, train_loss: 1.0558, test_loss: 1.0417, test_f1: 0.4721
 epoch: 15, train_loss: 1.0357, test_loss: 1.0411, test_f1: 0.4595
 epoch: 16, train_loss: 1.0164, test_loss: 1.0287, test_f1: 0.4544
 epoch: 17, train_loss: 1.0107, test_loss: 1.0357, test_f1: 0.4692
 epoch: 18, train_loss: 0.9949, test_loss: 1.0214, test_f1: 0.4652
 epoch: 19, train_loss: 0.9744, test_loss: 1.0226, test_f1: 0.4651
 epoch: 20, train_loss: 0.9628, test_loss: 1.0135, test_f1: 0.4574
 epoch: 21, train_loss: 0.9443, test_loss: 1.0023, test_f1: 0.4919
 epoch: 22, train_loss: 0.9223, test_loss: 1.0197, test_f1: 0.4682
 epoch: 23, train_loss: 0.9163, test_loss: 1.0441, test_f1: 0.4835
 epoch: 24, train_loss: 0.9039, test_loss: 1.0344, test_f1: 0.4903
 epoch: 25, train_loss: 0.8833, test_loss: 1.0328, test_f1: 0.4988
 epoch: 26, train_loss: 0.8849, test_loss: 1.0180, test_f1: 0.4892
 epoch: 27, train_loss: 0.8643, test_loss: 1.0387, test_f1: 0.4979
 epoch: 28, train_loss: 0.8635, test_loss: 1.0375, test_f1: 0.5075
 epoch: 29, train_loss: 0.8459, test_loss: 1.1026, test_f1: 0.4941
 epoch: 30, train_loss: 0.8330, test_loss: 1.0797, test_f1: 0.4925
 epoch: 31, train_loss: 0.8246, test_loss: 1.0974, test_f1: 0.4770
 epoch: 32, train_loss: 0.8125, test_loss: 1.0612, test_f1: 0.5101
 epoch: 33, train_loss: 0.8015, test_loss: 1.0833, test_f1: 0.4966
 epoch: 34, train_loss: 0.7905, test_loss: 1.0972, test_f1: 0.4978
 epoch: 35, train_loss: 0.7807, test_loss: 1.1093, test_f1: 0.4920
 epoch: 36, train_loss: 0.7731, test_loss: 1.0900, test_f1: 0.5151
 epoch: 37, train_loss: 0.7696, test_loss: 1.0906, test_f1: 0.5198
 epoch: 38, train_loss: 0.7567, test_loss: 1.1272, test_f1: 0.5067
 epoch: 39, train_loss: 0.7368, test_loss: 1.1583, test_f1: 0.4947
 epoch: 40, train_loss: 0.7450, test_loss: 1.1617, test_f1: 0.5007
 epoch: 41, train_loss: 0.7411, test_loss: 1.2060, test_f1: 0.5007
 epoch: 42, train_loss: 0.7303, test_loss: 1.1409, test_f1: 0.5142
 epoch: 43, train_loss: 0.7161, test_loss: 1.1987, test_f1: 0.5084
 epoch: 44, train_loss: 0.7151, test_loss: 1.2069, test_f1: 0.5068
 epoch: 45, train_loss: 0.6947, test_loss: 1.1943, test_f1: 0.5089
 epoch: 46, train_loss: 0.7091, test_loss: 1.2458, test_f1: 0.4949
 epoch: 47, train_loss: 0.6882, test_loss: 1.2342, test_f1: 0.4962
 epoch: 48, train_loss: 0.6810, test_loss: 1.2244, test_f1: 0.5048
 epoch: 49, train_loss: 0.6933, test_loss: 1.2533, test_f1: 0.4985
 epoch: 50, train_loss: 0.6568, test_loss: 1.2788, test_f1: 0.4987
 epoch: 51, train_loss: 0.6561, test_loss: 1.2207, test_f1: 0.5128
 epoch: 52, train_loss: 0.6330, test_loss: 1.2852, test_f1: 0.5041
 epoch: 53, train_loss: 0.6395, test_loss: 1.2592, test_f1: 0.4997
 epoch: 54, train_loss: 0.6364, test_loss: 1.2312, test_f1: 0.5077
 epoch: 55, train_loss: 0.6256, test_loss: 1.3302, test_f1: 0.5001
 epoch: 56, train_loss: 0.6280, test_loss: 1.3081, test_f1: 0.5043
 epoch: 57, train_loss: 0.6290, test_loss: 1.3048, test_f1: 0.5075
 epoch: 58, train_loss: 0.6197, test_loss: 1.3035, test_f1: 0.4984
 epoch: 59, train_loss: 0.6028, test_loss: 1.3291, test_f1: 0.5102
 epoch: 60, train_loss: 0.6255, test_loss: 1.3107, test_f1: 0.5102
 epoch: 61, train_loss: 0.6121, test_loss: 1.3215, test_f1: 0.5038
 epoch: 62, train_loss: 0.6055, test_loss: 1.3031, test_f1: 0.5211
 epoch: 63, train_loss: 0.6098, test_loss: 1.3444, test_f1: 0.5183
 epoch: 64, train_loss: 0.6072, test_loss: 1.3576, test_f1: 0.5030
 epoch: 65, train_loss: 0.6095, test_loss: 1.3204, test_f1: 0.5278
 epoch: 66, train_loss: 0.6061, test_loss: 1.3201, test_f1: 0.5140
 epoch: 67, train_loss: 0.5883, test_loss: 1.3456, test_f1: 0.5178
 epoch: 68, train_loss: 0.5920, test_loss: 1.3069, test_f1: 0.5352
 epoch: 69, train_loss: 0.5772, test_loss: 1.3536, test_f1: 0.5160
 epoch: 70, train_loss: 0.5820, test_loss: 1.3573, test_f1: 0.5305
 epoch: 71, train_loss: 0.5714, test_loss: 1.3494, test_f1: 0.5167
 epoch: 72, train_loss: 0.5810, test_loss: 1.3283, test_f1: 0.5273
 epoch: 73, train_loss: 0.5683, test_loss: 1.3458, test_f1: 0.5231
 epoch: 74, train_loss: 0.5721, test_loss: 1.3904, test_f1: 0.5216
 epoch: 75, train_loss: 0.5625, test_loss: 1.3795, test_f1: 0.5191
 epoch: 76, train_loss: 0.5617, test_loss: 1.4217, test_f1: 0.5203
 epoch: 77, train_loss: 0.5704, test_loss: 1.4165, test_f1: 0.5062
 epoch: 78, train_loss: 0.5760, test_loss: 1.4415, test_f1: 0.5171
 epoch: 79, train_loss: 0.5482, test_loss: 1.4076, test_f1: 0.5067
 epoch: 80, train_loss: 0.5511, test_loss: 1.4723, test_f1: 0.5053
 epoch: 81, train_loss: 0.5459, test_loss: 1.4437, test_f1: 0.5008
 epoch: 82, train_loss: 0.5500, test_loss: 1.4880, test_f1: 0.5202
 epoch: 83, train_loss: 0.5392, test_loss: 1.4518, test_f1: 0.5125
 epoch: 84, train_loss: 0.5546, test_loss: 1.4415, test_f1: 0.5196
 epoch: 85, train_loss: 0.5341, test_loss: 1.4599, test_f1: 0.5116
 epoch: 86, train_loss: 0.5373, test_loss: 1.4658, test_f1: 0.5097
 epoch: 87, train_loss: 0.5513, test_loss: 1.4720, test_f1: 0.5278
 epoch: 88, train_loss: 0.5349, test_loss: 1.4568, test_f1: 0.5014
 epoch: 89, train_loss: 0.5278, test_loss: 1.4466, test_f1: 0.5030
 epoch: 90, train_loss: 0.5157, test_loss: 1.4872, test_f1: 0.5135
 epoch: 91, train_loss: 0.5255, test_loss: 1.4615, test_f1: 0.5204
 epoch: 92, train_loss: 0.5205, test_loss: 1.4665, test_f1: 0.5175
 epoch: 93, train_loss: 0.5166, test_loss: 1.5054, test_f1: 0.5065
 epoch: 94, train_loss: 0.5250, test_loss: 1.4930, test_f1: 0.5236
 epoch: 95, train_loss: 0.5322, test_loss: 1.5361, test_f1: 0.5130
 epoch: 96, train_loss: 0.5211, test_loss: 1.5134, test_f1: 0.5129
 epoch: 97, train_loss: 0.5223, test_loss: 1.5121, test_f1: 0.5145
 epoch: 98, train_loss: 0.5172, test_loss: 1.4889, test_f1: 0.5197
 epoch: 99, train_loss: 0.5038, test_loss: 1.5475, test_f1: 0.5029
##################ITERATION #1 ****************************************
 epoch: 0, train_loss: 1.3101, test_loss: 1.3003, test_f1: 0.2274
 epoch: 1, train_loss: 1.2472, test_loss: 1.2444, test_f1: 0.2555
 epoch: 2, train_loss: 1.2149, test_loss: 1.2018, test_f1: 0.3470
 epoch: 3, train_loss: 1.1912, test_loss: 1.1858, test_f1: 0.3873
 epoch: 4, train_loss: 1.1682, test_loss: 1.2058, test_f1: 0.4102
 epoch: 5, train_loss: 1.1502, test_loss: 1.1714, test_f1: 0.4063
 epoch: 6, train_loss: 1.1234, test_loss: 1.1699, test_f1: 0.4163
 epoch: 7, train_loss: 1.1118, test_loss: 1.1704, test_f1: 0.4256
 epoch: 8, train_loss: 1.0946, test_loss: 1.1404, test_f1: 0.4415
 epoch: 9, train_loss: 1.0743, test_loss: 1.1584, test_f1: 0.4478
 epoch: 10, train_loss: 1.0562, test_loss: 1.1467, test_f1: 0.4518
 epoch: 11, train_loss: 1.0351, test_loss: 1.1676, test_f1: 0.4498
 epoch: 12, train_loss: 1.0135, test_loss: 1.1584, test_f1: 0.4421
 epoch: 13, train_loss: 0.9993, test_loss: 1.1856, test_f1: 0.4383
 epoch: 14, train_loss: 0.9795, test_loss: 1.1550, test_f1: 0.4590
 epoch: 15, train_loss: 0.9582, test_loss: 1.1331, test_f1: 0.4478
 epoch: 16, train_loss: 0.9471, test_loss: 1.0293, test_f1: 0.4716
 epoch: 17, train_loss: 0.9259, test_loss: 1.0321, test_f1: 0.4400
 epoch: 18, train_loss: 0.9142, test_loss: 1.0443, test_f1: 0.4640
 epoch: 19, train_loss: 0.8938, test_loss: 1.0170, test_f1: 0.4673
 epoch: 20, train_loss: 0.8825, test_loss: 1.0286, test_f1: 0.4578
 epoch: 21, train_loss: 0.8622, test_loss: 1.0277, test_f1: 0.4635
 epoch: 22, train_loss: 0.8574, test_loss: 1.0426, test_f1: 0.4673
 epoch: 23, train_loss: 0.8521, test_loss: 1.0359, test_f1: 0.4644
 epoch: 24, train_loss: 0.8449, test_loss: 1.0663, test_f1: 0.4695
 epoch: 25, train_loss: 0.8229, test_loss: 1.0623, test_f1: 0.4681
 epoch: 26, train_loss: 0.8088, test_loss: 1.0355, test_f1: 0.4872
 epoch: 27, train_loss: 0.7934, test_loss: 1.0573, test_f1: 0.4693
 epoch: 28, train_loss: 0.7883, test_loss: 1.0439, test_f1: 0.5035
 epoch: 29, train_loss: 0.7839, test_loss: 1.0670, test_f1: 0.4740
 epoch: 30, train_loss: 0.7848, test_loss: 1.0816, test_f1: 0.4750
 epoch: 31, train_loss: 0.7668, test_loss: 1.0821, test_f1: 0.5066
 epoch: 32, train_loss: 0.7606, test_loss: 1.1006, test_f1: 0.4776
 epoch: 33, train_loss: 0.7484, test_loss: 1.0943, test_f1: 0.5049
 epoch: 34, train_loss: 0.7374, test_loss: 1.0994, test_f1: 0.4799
 epoch: 35, train_loss: 0.7227, test_loss: 1.1261, test_f1: 0.4808
 epoch: 36, train_loss: 0.7098, test_loss: 1.1432, test_f1: 0.4739
 epoch: 37, train_loss: 0.7002, test_loss: 1.1272, test_f1: 0.4950
 epoch: 38, train_loss: 0.7036, test_loss: 1.1212, test_f1: 0.4995
 epoch: 39, train_loss: 0.6791, test_loss: 1.1594, test_f1: 0.4852
 epoch: 40, train_loss: 0.6833, test_loss: 1.1778, test_f1: 0.5128
 epoch: 41, train_loss: 0.6652, test_loss: 1.1947, test_f1: 0.4879
 epoch: 42, train_loss: 0.6735, test_loss: 1.2228, test_f1: 0.4964
 epoch: 43, train_loss: 0.6637, test_loss: 1.2096, test_f1: 0.4943
 epoch: 44, train_loss: 0.6622, test_loss: 1.2531, test_f1: 0.4843
 epoch: 45, train_loss: 0.6544, test_loss: 1.2144, test_f1: 0.4900
 epoch: 46, train_loss: 0.6489, test_loss: 1.2551, test_f1: 0.5083
 epoch: 47, train_loss: 0.6351, test_loss: 1.2809, test_f1: 0.5082
 epoch: 48, train_loss: 0.6205, test_loss: 1.2928, test_f1: 0.5155
 epoch: 49, train_loss: 0.6313, test_loss: 1.2615, test_f1: 0.4997
 epoch: 50, train_loss: 0.6146, test_loss: 1.2836, test_f1: 0.4947
 epoch: 51, train_loss: 0.5884, test_loss: 1.2790, test_f1: 0.5040
 epoch: 52, train_loss: 0.5910, test_loss: 1.2442, test_f1: 0.5089
 epoch: 53, train_loss: 0.5885, test_loss: 1.2895, test_f1: 0.5001
 epoch: 54, train_loss: 0.5773, test_loss: 1.2417, test_f1: 0.5161
 epoch: 55, train_loss: 0.5764, test_loss: 1.3123, test_f1: 0.5083
 epoch: 56, train_loss: 0.5856, test_loss: 1.2765, test_f1: 0.5351
 epoch: 57, train_loss: 0.5615, test_loss: 1.2996, test_f1: 0.5150
 epoch: 58, train_loss: 0.5702, test_loss: 1.3149, test_f1: 0.5124
 epoch: 59, train_loss: 0.5708, test_loss: 1.3465, test_f1: 0.5020
 epoch: 60, train_loss: 0.5627, test_loss: 1.3100, test_f1: 0.5200
 epoch: 61, train_loss: 0.5548, test_loss: 1.3299, test_f1: 0.5083
 epoch: 62, train_loss: 0.5647, test_loss: 1.3922, test_f1: 0.5134
 epoch: 63, train_loss: 0.5607, test_loss: 1.3495, test_f1: 0.5328
 epoch: 64, train_loss: 0.5482, test_loss: 1.3363, test_f1: 0.5349
 epoch: 65, train_loss: 0.5494, test_loss: 1.3890, test_f1: 0.4976
 epoch: 66, train_loss: 0.5341, test_loss: 1.4126, test_f1: 0.5220
 epoch: 67, train_loss: 0.5364, test_loss: 1.3630, test_f1: 0.5221
 epoch: 68, train_loss: 0.5481, test_loss: 1.4114, test_f1: 0.5185
 epoch: 69, train_loss: 0.5268, test_loss: 1.4425, test_f1: 0.5050
 epoch: 70, train_loss: 0.5202, test_loss: 1.4366, test_f1: 0.5013
 epoch: 71, train_loss: 0.5321, test_loss: 1.4118, test_f1: 0.5199
 epoch: 72, train_loss: 0.5280, test_loss: 1.3887, test_f1: 0.5228
 epoch: 73, train_loss: 0.5292, test_loss: 1.4646, test_f1: 0.5115
 epoch: 74, train_loss: 0.5185, test_loss: 1.4338, test_f1: 0.5178
 epoch: 75, train_loss: 0.5125, test_loss: 1.4638, test_f1: 0.5217
 epoch: 76, train_loss: 0.5187, test_loss: 1.4572, test_f1: 0.5236
 epoch: 77, train_loss: 0.5208, test_loss: 1.4894, test_f1: 0.5279
 epoch: 78, train_loss: 0.5033, test_loss: 1.5038, test_f1: 0.5175
 epoch: 79, train_loss: 0.5024, test_loss: 1.5034, test_f1: 0.5242
 epoch: 80, train_loss: 0.5045, test_loss: 1.5308, test_f1: 0.5145
 epoch: 81, train_loss: 0.4971, test_loss: 1.4775, test_f1: 0.5207
 epoch: 82, train_loss: 0.4900, test_loss: 1.4998, test_f1: 0.5243
 epoch: 83, train_loss: 0.5003, test_loss: 1.5690, test_f1: 0.5020
 epoch: 84, train_loss: 0.4929, test_loss: 1.4624, test_f1: 0.5118
 epoch: 85, train_loss: 0.4806, test_loss: 1.5003, test_f1: 0.5148
 epoch: 86, train_loss: 0.4799, test_loss: 1.4836, test_f1: 0.5220
 epoch: 87, train_loss: 0.4806, test_loss: 1.5173, test_f1: 0.5262
 epoch: 88, train_loss: 0.4933, test_loss: 1.5684, test_f1: 0.5056
 epoch: 89, train_loss: 0.4696, test_loss: 1.5762, test_f1: 0.5145
 epoch: 90, train_loss: 0.4785, test_loss: 1.5411, test_f1: 0.5163
 epoch: 91, train_loss: 0.4750, test_loss: 1.5626, test_f1: 0.5146
 epoch: 92, train_loss: 0.4814, test_loss: 1.5961, test_f1: 0.5184
 epoch: 93, train_loss: 0.4785, test_loss: 1.5346, test_f1: 0.5210
 epoch: 94, train_loss: 0.4653, test_loss: 1.5933, test_f1: 0.5269
 epoch: 95, train_loss: 0.4621, test_loss: 1.5868, test_f1: 0.5163
 epoch: 96, train_loss: 0.4723, test_loss: 1.5892, test_f1: 0.5170
 epoch: 97, train_loss: 0.4558, test_loss: 1.5987, test_f1: 0.5198
 epoch: 98, train_loss: 0.4665, test_loss: 1.6894, test_f1: 0.5224
 epoch: 99, train_loss: 0.4641, test_loss: 1.6422, test_f1: 0.5311
##################ITERATION #2 ****************************************
 epoch: 0, train_loss: 1.3080, test_loss: 1.2785, test_f1: 0.2555
 epoch: 1, train_loss: 1.2163, test_loss: 1.2112, test_f1: 0.2955
 epoch: 2, train_loss: 1.1874, test_loss: 1.1538, test_f1: 0.4422
 epoch: 3, train_loss: 1.1655, test_loss: 1.1262, test_f1: 0.4426
 epoch: 4, train_loss: 1.1395, test_loss: 1.1059, test_f1: 0.4726
 epoch: 5, train_loss: 1.1242, test_loss: 1.0986, test_f1: 0.4455
 epoch: 6, train_loss: 1.1036, test_loss: 1.0802, test_f1: 0.4544
 epoch: 7, train_loss: 1.0847, test_loss: 1.0648, test_f1: 0.4641
 epoch: 8, train_loss: 1.0744, test_loss: 1.0627, test_f1: 0.4482
 epoch: 9, train_loss: 1.0639, test_loss: 1.0499, test_f1: 0.4527
 epoch: 10, train_loss: 1.0451, test_loss: 1.0338, test_f1: 0.4519
 epoch: 11, train_loss: 1.0372, test_loss: 1.0180, test_f1: 0.4771
 epoch: 12, train_loss: 1.0188, test_loss: 1.0169, test_f1: 0.4950
 epoch: 13, train_loss: 1.0087, test_loss: 1.0187, test_f1: 0.4799
 epoch: 14, train_loss: 0.9935, test_loss: 1.0062, test_f1: 0.4775
 epoch: 15, train_loss: 0.9772, test_loss: 0.9879, test_f1: 0.4909
 epoch: 16, train_loss: 0.9674, test_loss: 0.9934, test_f1: 0.5111
 epoch: 17, train_loss: 0.9638, test_loss: 0.9878, test_f1: 0.4920
 epoch: 18, train_loss: 0.9472, test_loss: 0.9803, test_f1: 0.4998
 epoch: 19, train_loss: 0.9359, test_loss: 0.9865, test_f1: 0.5117
 epoch: 20, train_loss: 0.9260, test_loss: 0.9805, test_f1: 0.5128
 epoch: 21, train_loss: 0.9099, test_loss: 0.9739, test_f1: 0.5049
 epoch: 22, train_loss: 0.8983, test_loss: 0.9868, test_f1: 0.4935
 epoch: 23, train_loss: 0.8802, test_loss: 0.9734, test_f1: 0.5098
 epoch: 24, train_loss: 0.8807, test_loss: 0.9899, test_f1: 0.5016
 epoch: 25, train_loss: 0.8697, test_loss: 0.9777, test_f1: 0.5229
 epoch: 26, train_loss: 0.8552, test_loss: 0.9955, test_f1: 0.5173
 epoch: 27, train_loss: 0.8448, test_loss: 0.9972, test_f1: 0.5185
 epoch: 28, train_loss: 0.8384, test_loss: 0.9940, test_f1: 0.5134
 epoch: 29, train_loss: 0.8225, test_loss: 0.9973, test_f1: 0.5239
 epoch: 30, train_loss: 0.8213, test_loss: 1.0034, test_f1: 0.5241
 epoch: 31, train_loss: 0.8050, test_loss: 1.0278, test_f1: 0.5380
 epoch: 32, train_loss: 0.8006, test_loss: 1.0090, test_f1: 0.5466
 epoch: 33, train_loss: 0.7928, test_loss: 1.0268, test_f1: 0.5161
 epoch: 34, train_loss: 0.7707, test_loss: 1.0283, test_f1: 0.5216
 epoch: 35, train_loss: 0.7637, test_loss: 1.0456, test_f1: 0.5398
 epoch: 36, train_loss: 0.7570, test_loss: 1.0538, test_f1: 0.5182
 epoch: 37, train_loss: 0.7441, test_loss: 1.0749, test_f1: 0.5367
 epoch: 38, train_loss: 0.7415, test_loss: 1.0761, test_f1: 0.5428
 epoch: 39, train_loss: 0.7315, test_loss: 1.1140, test_f1: 0.5434
 epoch: 40, train_loss: 0.7137, test_loss: 1.0824, test_f1: 0.5256
 epoch: 41, train_loss: 0.7193, test_loss: 1.0794, test_f1: 0.5564
 epoch: 42, train_loss: 0.7272, test_loss: 1.1339, test_f1: 0.5141
 epoch: 43, train_loss: 0.7023, test_loss: 1.1346, test_f1: 0.5424
 epoch: 44, train_loss: 0.7101, test_loss: 1.1749, test_f1: 0.5104
 epoch: 45, train_loss: 0.6873, test_loss: 1.1251, test_f1: 0.5212
 epoch: 46, train_loss: 0.6745, test_loss: 1.1472, test_f1: 0.5302
 epoch: 47, train_loss: 0.6700, test_loss: 1.1754, test_f1: 0.5266
 epoch: 48, train_loss: 0.6760, test_loss: 1.1601, test_f1: 0.5263
 epoch: 49, train_loss: 0.6673, test_loss: 1.0869, test_f1: 0.5483
 epoch: 50, train_loss: 0.6563, test_loss: 1.2252, test_f1: 0.5256
 epoch: 51, train_loss: 0.6419, test_loss: 1.1934, test_f1: 0.5258
 epoch: 52, train_loss: 0.6267, test_loss: 1.1886, test_f1: 0.5291
 epoch: 53, train_loss: 0.6278, test_loss: 1.2199, test_f1: 0.5182
 epoch: 54, train_loss: 0.6167, test_loss: 1.1819, test_f1: 0.5241
 epoch: 55, train_loss: 0.6077, test_loss: 1.2147, test_f1: 0.5221
 epoch: 56, train_loss: 0.6018, test_loss: 1.2163, test_f1: 0.5389
 epoch: 57, train_loss: 0.5958, test_loss: 1.2219, test_f1: 0.5303
 epoch: 58, train_loss: 0.5952, test_loss: 1.2215, test_f1: 0.5228
 epoch: 59, train_loss: 0.6008, test_loss: 1.2359, test_f1: 0.5140
 epoch: 60, train_loss: 0.5855, test_loss: 1.2229, test_f1: 0.5454
 epoch: 61, train_loss: 0.5953, test_loss: 1.2315, test_f1: 0.5306
 epoch: 62, train_loss: 0.5761, test_loss: 1.2574, test_f1: 0.5307
 epoch: 63, train_loss: 0.5785, test_loss: 1.2497, test_f1: 0.5286
 epoch: 64, train_loss: 0.5817, test_loss: 1.2809, test_f1: 0.5352
 epoch: 65, train_loss: 0.5739, test_loss: 1.2490, test_f1: 0.5418
 epoch: 66, train_loss: 0.5609, test_loss: 1.2598, test_f1: 0.5325
 epoch: 67, train_loss: 0.5597, test_loss: 1.2548, test_f1: 0.5398
 epoch: 68, train_loss: 0.5684, test_loss: 1.3331, test_f1: 0.5082
 epoch: 69, train_loss: 0.5461, test_loss: 1.3061, test_f1: 0.5249
 epoch: 70, train_loss: 0.5496, test_loss: 1.3242, test_f1: 0.5360
 epoch: 71, train_loss: 0.5602, test_loss: 1.3012, test_f1: 0.5318
 epoch: 72, train_loss: 0.5693, test_loss: 1.3028, test_f1: 0.5433
 epoch: 73, train_loss: 0.5478, test_loss: 1.3264, test_f1: 0.5326
 epoch: 74, train_loss: 0.5293, test_loss: 1.3010, test_f1: 0.5388
 epoch: 75, train_loss: 0.5484, test_loss: 1.3108, test_f1: 0.5373
 epoch: 76, train_loss: 0.5294, test_loss: 1.3738, test_f1: 0.5313
 epoch: 77, train_loss: 0.5434, test_loss: 1.3719, test_f1: 0.5349
 epoch: 78, train_loss: 0.5221, test_loss: 1.3368, test_f1: 0.5490
 epoch: 79, train_loss: 0.5220, test_loss: 1.3922, test_f1: 0.5333
 epoch: 80, train_loss: 0.5318, test_loss: 1.3748, test_f1: 0.5402
 epoch: 81, train_loss: 0.5289, test_loss: 1.3458, test_f1: 0.5502
 epoch: 82, train_loss: 0.5284, test_loss: 1.3336, test_f1: 0.5574
 epoch: 83, train_loss: 0.5212, test_loss: 1.4469, test_f1: 0.5409
 epoch: 84, train_loss: 0.5421, test_loss: 1.4341, test_f1: 0.5411
 epoch: 85, train_loss: 0.4973, test_loss: 1.4378, test_f1: 0.5439
 epoch: 86, train_loss: 0.5129, test_loss: 1.4175, test_f1: 0.5372
 epoch: 87, train_loss: 0.5129, test_loss: 1.4397, test_f1: 0.5347
 epoch: 88, train_loss: 0.5206, test_loss: 1.3998, test_f1: 0.5531
 epoch: 89, train_loss: 0.5072, test_loss: 1.4345, test_f1: 0.5474
 epoch: 90, train_loss: 0.5061, test_loss: 1.4399, test_f1: 0.5450
 epoch: 91, train_loss: 0.4926, test_loss: 1.4769, test_f1: 0.5320
 epoch: 92, train_loss: 0.4871, test_loss: 1.4436, test_f1: 0.5375
 epoch: 93, train_loss: 0.5039, test_loss: 1.4358, test_f1: 0.5326
 epoch: 94, train_loss: 0.4882, test_loss: 1.4631, test_f1: 0.5409
 epoch: 95, train_loss: 0.4995, test_loss: 1.4945, test_f1: 0.5344
 epoch: 96, train_loss: 0.4756, test_loss: 1.4405, test_f1: 0.5522
 epoch: 97, train_loss: 0.4870, test_loss: 1.5009, test_f1: 0.5444
 epoch: 98, train_loss: 0.4846, test_loss: 1.4570, test_f1: 0.5593
 epoch: 99, train_loss: 0.4781, test_loss: 1.5600, test_f1: 0.5353
##################ITERATION #3 ****************************************
 epoch: 0, train_loss: 1.2812, test_loss: 1.2648, test_f1: 0.2969
 epoch: 1, train_loss: 1.2026, test_loss: 1.1899, test_f1: 0.4328
 epoch: 2, train_loss: 1.1693, test_loss: 1.1398, test_f1: 0.4220
 epoch: 3, train_loss: 1.1550, test_loss: 1.1118, test_f1: 0.4436
 epoch: 4, train_loss: 1.1353, test_loss: 1.0954, test_f1: 0.4543
 epoch: 5, train_loss: 1.1157, test_loss: 1.0848, test_f1: 0.4372
 epoch: 6, train_loss: 1.1037, test_loss: 1.0784, test_f1: 0.4364
 epoch: 7, train_loss: 1.0871, test_loss: 1.0697, test_f1: 0.4272
 epoch: 8, train_loss: 1.0745, test_loss: 1.0583, test_f1: 0.4411
 epoch: 9, train_loss: 1.0498, test_loss: 1.0490, test_f1: 0.4352
 epoch: 10, train_loss: 1.0439, test_loss: 1.0395, test_f1: 0.4849
 epoch: 11, train_loss: 1.0358, test_loss: 1.0349, test_f1: 0.4517
 epoch: 12, train_loss: 1.0133, test_loss: 1.0241, test_f1: 0.4582
 epoch: 13, train_loss: 1.0058, test_loss: 1.0318, test_f1: 0.4529
 epoch: 14, train_loss: 0.9957, test_loss: 1.0260, test_f1: 0.4526
 epoch: 15, train_loss: 0.9882, test_loss: 1.0201, test_f1: 0.4657
 epoch: 16, train_loss: 0.9721, test_loss: 1.0041, test_f1: 0.4753
 epoch: 17, train_loss: 0.9616, test_loss: 1.0016, test_f1: 0.4997
 epoch: 18, train_loss: 0.9429, test_loss: 1.0089, test_f1: 0.4981
 epoch: 19, train_loss: 0.9376, test_loss: 1.0255, test_f1: 0.4830
 epoch: 20, train_loss: 0.9199, test_loss: 1.0246, test_f1: 0.4754
 epoch: 21, train_loss: 0.9099, test_loss: 1.0179, test_f1: 0.5053
 epoch: 22, train_loss: 0.9042, test_loss: 0.9977, test_f1: 0.5165
 epoch: 23, train_loss: 0.8963, test_loss: 1.0140, test_f1: 0.5004
 epoch: 24, train_loss: 0.8780, test_loss: 1.0060, test_f1: 0.5046
 epoch: 25, train_loss: 0.8559, test_loss: 1.0120, test_f1: 0.5020
 epoch: 26, train_loss: 0.8587, test_loss: 1.0207, test_f1: 0.5112
 epoch: 27, train_loss: 0.8471, test_loss: 1.0156, test_f1: 0.5122
 epoch: 28, train_loss: 0.8439, test_loss: 1.0218, test_f1: 0.4985
 epoch: 29, train_loss: 0.8361, test_loss: 1.0132, test_f1: 0.5183
 epoch: 30, train_loss: 0.8200, test_loss: 1.0437, test_f1: 0.5061
 epoch: 31, train_loss: 0.8215, test_loss: 1.0110, test_f1: 0.5176
 epoch: 32, train_loss: 0.8048, test_loss: 1.0574, test_f1: 0.4932
 epoch: 33, train_loss: 0.7893, test_loss: 1.0830, test_f1: 0.5097
 epoch: 34, train_loss: 0.7915, test_loss: 1.0501, test_f1: 0.5077
 epoch: 35, train_loss: 0.7834, test_loss: 1.0927, test_f1: 0.5204
 epoch: 36, train_loss: 0.7901, test_loss: 1.0599, test_f1: 0.5165
 epoch: 37, train_loss: 0.7712, test_loss: 1.0540, test_f1: 0.5416
 epoch: 38, train_loss: 0.7673, test_loss: 1.0687, test_f1: 0.5106
 epoch: 39, train_loss: 0.7393, test_loss: 1.0606, test_f1: 0.5253
 epoch: 40, train_loss: 0.7506, test_loss: 1.0641, test_f1: 0.5209
 epoch: 41, train_loss: 0.7375, test_loss: 1.0590, test_f1: 0.5274
 epoch: 42, train_loss: 0.7137, test_loss: 1.0789, test_f1: 0.5393
 epoch: 43, train_loss: 0.6984, test_loss: 1.1355, test_f1: 0.5273
 epoch: 44, train_loss: 0.7031, test_loss: 1.1008, test_f1: 0.5451
 epoch: 45, train_loss: 0.6938, test_loss: 1.0902, test_f1: 0.5433
 epoch: 46, train_loss: 0.7024, test_loss: 1.1235, test_f1: 0.5283
 epoch: 47, train_loss: 0.6806, test_loss: 1.1497, test_f1: 0.5431
 epoch: 48, train_loss: 0.6707, test_loss: 1.1180, test_f1: 0.5407
 epoch: 49, train_loss: 0.6725, test_loss: 1.1436, test_f1: 0.5263
 epoch: 50, train_loss: 0.6727, test_loss: 1.1716, test_f1: 0.5308
 epoch: 51, train_loss: 0.6635, test_loss: 1.1681, test_f1: 0.5316
 epoch: 52, train_loss: 0.6502, test_loss: 1.1595, test_f1: 0.5209
 epoch: 53, train_loss: 0.6363, test_loss: 1.1542, test_f1: 0.5432
 epoch: 54, train_loss: 0.6316, test_loss: 1.1568, test_f1: 0.5321
 epoch: 55, train_loss: 0.6281, test_loss: 1.1690, test_f1: 0.5452
 epoch: 56, train_loss: 0.6227, test_loss: 1.1625, test_f1: 0.5409
 epoch: 57, train_loss: 0.6286, test_loss: 1.1991, test_f1: 0.5373
 epoch: 58, train_loss: 0.6159, test_loss: 1.2096, test_f1: 0.5354
 epoch: 59, train_loss: 0.6175, test_loss: 1.1883, test_f1: 0.5428
 epoch: 60, train_loss: 0.6082, test_loss: 1.2015, test_f1: 0.5401
 epoch: 61, train_loss: 0.5880, test_loss: 1.1735, test_f1: 0.5404
 epoch: 62, train_loss: 0.5946, test_loss: 1.2074, test_f1: 0.5473
 epoch: 63, train_loss: 0.5918, test_loss: 1.2080, test_f1: 0.5445
 epoch: 64, train_loss: 0.6015, test_loss: 1.2092, test_f1: 0.5518
 epoch: 65, train_loss: 0.5823, test_loss: 1.2154, test_f1: 0.5470
 epoch: 66, train_loss: 0.6048, test_loss: 1.2173, test_f1: 0.5579
 epoch: 67, train_loss: 0.5799, test_loss: 1.2429, test_f1: 0.5497
 epoch: 68, train_loss: 0.5750, test_loss: 1.2256, test_f1: 0.5538
 epoch: 69, train_loss: 0.5637, test_loss: 1.2620, test_f1: 0.5404
 epoch: 70, train_loss: 0.5726, test_loss: 1.2379, test_f1: 0.5566
 epoch: 71, train_loss: 0.5729, test_loss: 1.2410, test_f1: 0.5680
 epoch: 72, train_loss: 0.5801, test_loss: 1.2710, test_f1: 0.5535
 epoch: 73, train_loss: 0.5777, test_loss: 1.2339, test_f1: 0.5607
 epoch: 74, train_loss: 0.5621, test_loss: 1.2622, test_f1: 0.5490
 epoch: 75, train_loss: 0.5567, test_loss: 1.2833, test_f1: 0.5514
 epoch: 76, train_loss: 0.5624, test_loss: 1.2713, test_f1: 0.5485
 epoch: 77, train_loss: 0.5448, test_loss: 1.2692, test_f1: 0.5575
 epoch: 78, train_loss: 0.5557, test_loss: 1.2827, test_f1: 0.5574
 epoch: 79, train_loss: 0.5579, test_loss: 1.2794, test_f1: 0.5501
 epoch: 80, train_loss: 0.5472, test_loss: 1.2994, test_f1: 0.5545
 epoch: 81, train_loss: 0.5424, test_loss: 1.2530, test_f1: 0.5702
 epoch: 82, train_loss: 0.5354, test_loss: 1.3020, test_f1: 0.5602
 epoch: 83, train_loss: 0.5444, test_loss: 1.3130, test_f1: 0.5589
 epoch: 84, train_loss: 0.5211, test_loss: 1.3370, test_f1: 0.5477
 epoch: 85, train_loss: 0.5177, test_loss: 1.3212, test_f1: 0.5699
 epoch: 86, train_loss: 0.5255, test_loss: 1.3445, test_f1: 0.5698
 epoch: 87, train_loss: 0.5252, test_loss: 1.3301, test_f1: 0.5759
 epoch: 88, train_loss: 0.5321, test_loss: 1.3311, test_f1: 0.5609
 epoch: 89, train_loss: 0.5268, test_loss: 1.3602, test_f1: 0.5618
 epoch: 90, train_loss: 0.5109, test_loss: 1.3699, test_f1: 0.5637
 epoch: 91, train_loss: 0.5072, test_loss: 1.3388, test_f1: 0.5815
 epoch: 92, train_loss: 0.5150, test_loss: 1.3331, test_f1: 0.5745
 epoch: 93, train_loss: 0.5148, test_loss: 1.3362, test_f1: 0.5575
 epoch: 94, train_loss: 0.5164, test_loss: 1.3764, test_f1: 0.5598
 epoch: 95, train_loss: 0.5274, test_loss: 1.3299, test_f1: 0.5676
 epoch: 96, train_loss: 0.4995, test_loss: 1.3517, test_f1: 0.5557
 epoch: 97, train_loss: 0.5060, test_loss: 1.3624, test_f1: 0.5610
 epoch: 98, train_loss: 0.4995, test_loss: 1.4069, test_f1: 0.5624
 epoch: 99, train_loss: 0.4979, test_loss: 1.3700, test_f1: 0.5787
##################ITERATION #4 ****************************************
 epoch: 0, train_loss: 1.2876, test_loss: 1.2376, test_f1: 0.2270
 epoch: 1, train_loss: 1.2077, test_loss: 1.1822, test_f1: 0.2901
 epoch: 2, train_loss: 1.1855, test_loss: 1.1459, test_f1: 0.4562
 epoch: 3, train_loss: 1.1587, test_loss: 1.1198, test_f1: 0.4652
 epoch: 4, train_loss: 1.1381, test_loss: 1.1033, test_f1: 0.4603
 epoch: 5, train_loss: 1.1288, test_loss: 1.0799, test_f1: 0.4745
 epoch: 6, train_loss: 1.1077, test_loss: 1.0644, test_f1: 0.4889
 epoch: 7, train_loss: 1.0882, test_loss: 1.0522, test_f1: 0.4797
 epoch: 8, train_loss: 1.0798, test_loss: 1.0380, test_f1: 0.4928
 epoch: 9, train_loss: 1.0624, test_loss: 1.0245, test_f1: 0.4753
 epoch: 10, train_loss: 1.0495, test_loss: 1.0177, test_f1: 0.4689
 epoch: 11, train_loss: 1.0382, test_loss: 1.0066, test_f1: 0.4872
 epoch: 12, train_loss: 1.0278, test_loss: 0.9900, test_f1: 0.4871
 epoch: 13, train_loss: 1.0169, test_loss: 0.9840, test_f1: 0.4848
 epoch: 14, train_loss: 0.9973, test_loss: 0.9852, test_f1: 0.4735
 epoch: 15, train_loss: 0.9992, test_loss: 0.9675, test_f1: 0.4995
 epoch: 16, train_loss: 0.9827, test_loss: 0.9652, test_f1: 0.5171
 epoch: 17, train_loss: 0.9621, test_loss: 0.9594, test_f1: 0.5130
 epoch: 18, train_loss: 0.9576, test_loss: 0.9508, test_f1: 0.5313
 epoch: 19, train_loss: 0.9506, test_loss: 0.9593, test_f1: 0.5163
 epoch: 20, train_loss: 0.9313, test_loss: 0.9482, test_f1: 0.5416
 epoch: 21, train_loss: 0.9262, test_loss: 0.9528, test_f1: 0.5049
 epoch: 22, train_loss: 0.9112, test_loss: 0.9588, test_f1: 0.5203
 epoch: 23, train_loss: 0.9024, test_loss: 0.9535, test_f1: 0.5215
 epoch: 24, train_loss: 0.9006, test_loss: 0.9476, test_f1: 0.5388
 epoch: 25, train_loss: 0.8925, test_loss: 0.9386, test_f1: 0.5404
 epoch: 26, train_loss: 0.8734, test_loss: 0.9742, test_f1: 0.5141
 epoch: 27, train_loss: 0.8599, test_loss: 0.9609, test_f1: 0.5167
 epoch: 28, train_loss: 0.8513, test_loss: 0.9495, test_f1: 0.5377
 epoch: 29, train_loss: 0.8449, test_loss: 0.9498, test_f1: 0.5312
 epoch: 30, train_loss: 0.8318, test_loss: 0.9535, test_f1: 0.5240
 epoch: 31, train_loss: 0.8309, test_loss: 0.9965, test_f1: 0.5112
 epoch: 32, train_loss: 0.8188, test_loss: 0.9587, test_f1: 0.5328
 epoch: 33, train_loss: 0.8174, test_loss: 0.9939, test_f1: 0.4993
 epoch: 34, train_loss: 0.8054, test_loss: 0.9554, test_f1: 0.5383
 epoch: 35, train_loss: 0.8033, test_loss: 1.0090, test_f1: 0.5224
 epoch: 36, train_loss: 0.7841, test_loss: 0.9857, test_f1: 0.5250
 epoch: 37, train_loss: 0.7692, test_loss: 0.9897, test_f1: 0.5281
 epoch: 38, train_loss: 0.7590, test_loss: 1.0074, test_f1: 0.5226
 epoch: 39, train_loss: 0.7538, test_loss: 1.0124, test_f1: 0.5218
 epoch: 40, train_loss: 0.7465, test_loss: 1.0493, test_f1: 0.5269
 epoch: 41, train_loss: 0.7603, test_loss: 0.9902, test_f1: 0.5273
 epoch: 42, train_loss: 0.7320, test_loss: 1.0537, test_f1: 0.5178
 epoch: 43, train_loss: 0.7290, test_loss: 1.0444, test_f1: 0.5173
 epoch: 44, train_loss: 0.7394, test_loss: 1.0666, test_f1: 0.5254
 epoch: 45, train_loss: 0.7191, test_loss: 1.0632, test_f1: 0.5245
 epoch: 46, train_loss: 0.7184, test_loss: 1.0567, test_f1: 0.5247
 epoch: 47, train_loss: 0.7110, test_loss: 1.0890, test_f1: 0.5301
 epoch: 48, train_loss: 0.7090, test_loss: 1.0937, test_f1: 0.5200
 epoch: 49, train_loss: 0.6876, test_loss: 1.0706, test_f1: 0.5128
 epoch: 50, train_loss: 0.6857, test_loss: 1.0622, test_f1: 0.5343
 epoch: 51, train_loss: 0.6758, test_loss: 1.0839, test_f1: 0.5257
 epoch: 52, train_loss: 0.6573, test_loss: 1.0981, test_f1: 0.5216
 epoch: 53, train_loss: 0.6538, test_loss: 1.0961, test_f1: 0.5182
 epoch: 54, train_loss: 0.6459, test_loss: 1.0956, test_f1: 0.5309
 epoch: 55, train_loss: 0.6550, test_loss: 1.1072, test_f1: 0.5371
 epoch: 56, train_loss: 0.6487, test_loss: 1.1352, test_f1: 0.5232
 epoch: 57, train_loss: 0.6494, test_loss: 1.1174, test_f1: 0.5315
 epoch: 58, train_loss: 0.6518, test_loss: 1.1374, test_f1: 0.5223
 epoch: 59, train_loss: 0.6428, test_loss: 1.1230, test_f1: 0.5181
 epoch: 60, train_loss: 0.6416, test_loss: 1.1080, test_f1: 0.5273
 epoch: 61, train_loss: 0.6364, test_loss: 1.1123, test_f1: 0.5301
 epoch: 62, train_loss: 0.6210, test_loss: 1.1416, test_f1: 0.5176
 epoch: 63, train_loss: 0.6245, test_loss: 1.1608, test_f1: 0.5240
 epoch: 64, train_loss: 0.6290, test_loss: 1.1282, test_f1: 0.5305
 epoch: 65, train_loss: 0.6231, test_loss: 1.1678, test_f1: 0.5367
 epoch: 66, train_loss: 0.6190, test_loss: 1.1759, test_f1: 0.5247
 epoch: 67, train_loss: 0.6057, test_loss: 1.2008, test_f1: 0.5267
 epoch: 68, train_loss: 0.6154, test_loss: 1.1677, test_f1: 0.5440
 epoch: 69, train_loss: 0.6175, test_loss: 1.1798, test_f1: 0.5271
 epoch: 70, train_loss: 0.5966, test_loss: 1.1573, test_f1: 0.5320
 epoch: 71, train_loss: 0.6017, test_loss: 1.1640, test_f1: 0.5432
 epoch: 72, train_loss: 0.5925, test_loss: 1.1963, test_f1: 0.5284
 epoch: 73, train_loss: 0.6081, test_loss: 1.1925, test_f1: 0.5250
 epoch: 74, train_loss: 0.5995, test_loss: 1.1990, test_f1: 0.5125
 epoch: 75, train_loss: 0.5983, test_loss: 1.2219, test_f1: 0.5287
 epoch: 76, train_loss: 0.5720, test_loss: 1.2019, test_f1: 0.5322
 epoch: 77, train_loss: 0.5854, test_loss: 1.2436, test_f1: 0.5219
 epoch: 78, train_loss: 0.5813, test_loss: 1.2121, test_f1: 0.5199
 epoch: 79, train_loss: 0.5847, test_loss: 1.2343, test_f1: 0.5328
 epoch: 80, train_loss: 0.5808, test_loss: 1.2267, test_f1: 0.5232
 epoch: 81, train_loss: 0.5717, test_loss: 1.2447, test_f1: 0.5051
 epoch: 82, train_loss: 0.5570, test_loss: 1.2466, test_f1: 0.5161
 epoch: 83, train_loss: 0.5823, test_loss: 1.2860, test_f1: 0.5166
 epoch: 84, train_loss: 0.5786, test_loss: 1.2504, test_f1: 0.5232
 epoch: 85, train_loss: 0.5569, test_loss: 1.2945, test_f1: 0.5196
 epoch: 86, train_loss: 0.5558, test_loss: 1.2767, test_f1: 0.5223
 epoch: 87, train_loss: 0.5614, test_loss: 1.2716, test_f1: 0.5255
 epoch: 88, train_loss: 0.5485, test_loss: 1.3042, test_f1: 0.5230
 epoch: 89, train_loss: 0.5463, test_loss: 1.2929, test_f1: 0.5133
 epoch: 90, train_loss: 0.5509, test_loss: 1.3300, test_f1: 0.5238
 epoch: 91, train_loss: 0.5419, test_loss: 1.3432, test_f1: 0.5069
 epoch: 92, train_loss: 0.5650, test_loss: 1.3150, test_f1: 0.5204
 epoch: 93, train_loss: 0.5512, test_loss: 1.3249, test_f1: 0.5202
 epoch: 94, train_loss: 0.5348, test_loss: 1.3130, test_f1: 0.5266
 epoch: 95, train_loss: 0.5277, test_loss: 1.3641, test_f1: 0.5297
 epoch: 96, train_loss: 0.5353, test_loss: 1.3292, test_f1: 0.5181
 epoch: 97, train_loss: 0.5311, test_loss: 1.3630, test_f1: 0.5242
 epoch: 98, train_loss: 0.5349, test_loss: 1.3485, test_f1: 0.5397
 epoch: 99, train_loss: 0.5267, test_loss: 1.3437, test_f1: 0.5416
##################ITERATION #5 ****************************************
 epoch: 0, train_loss: 1.3397, test_loss: 1.2679, test_f1: 0.2719
 epoch: 1, train_loss: 1.2189, test_loss: 1.1827, test_f1: 0.4289
 epoch: 2, train_loss: 1.1853, test_loss: 1.1463, test_f1: 0.4655
 epoch: 3, train_loss: 1.1589, test_loss: 1.1206, test_f1: 0.4640
 epoch: 4, train_loss: 1.1372, test_loss: 1.1054, test_f1: 0.4616
 epoch: 5, train_loss: 1.1209, test_loss: 1.0972, test_f1: 0.4738
 epoch: 6, train_loss: 1.0991, test_loss: 1.0717, test_f1: 0.4725
 epoch: 7, train_loss: 1.0811, test_loss: 1.0587, test_f1: 0.4800
 epoch: 8, train_loss: 1.0733, test_loss: 1.0387, test_f1: 0.4830
 epoch: 9, train_loss: 1.0649, test_loss: 1.0370, test_f1: 0.4789
 epoch: 10, train_loss: 1.0441, test_loss: 1.0260, test_f1: 0.4817
 epoch: 11, train_loss: 1.0285, test_loss: 1.0298, test_f1: 0.4802
 epoch: 12, train_loss: 1.0177, test_loss: 1.0273, test_f1: 0.4789
 epoch: 13, train_loss: 0.9963, test_loss: 0.9993, test_f1: 0.5262
 epoch: 14, train_loss: 0.9903, test_loss: 0.9972, test_f1: 0.5071
 epoch: 15, train_loss: 0.9676, test_loss: 0.9929, test_f1: 0.4822
 epoch: 16, train_loss: 0.9655, test_loss: 0.9974, test_f1: 0.5107
 epoch: 17, train_loss: 0.9454, test_loss: 0.9877, test_f1: 0.5017
 epoch: 18, train_loss: 0.9367, test_loss: 1.0037, test_f1: 0.4829
 epoch: 19, train_loss: 0.9269, test_loss: 0.9847, test_f1: 0.5168
 epoch: 20, train_loss: 0.9219, test_loss: 0.9761, test_f1: 0.5196
 epoch: 21, train_loss: 0.9042, test_loss: 0.9752, test_f1: 0.5249
 epoch: 22, train_loss: 0.8961, test_loss: 0.9596, test_f1: 0.5068
 epoch: 23, train_loss: 0.8962, test_loss: 0.9675, test_f1: 0.5094
 epoch: 24, train_loss: 0.8714, test_loss: 1.0133, test_f1: 0.4976
 epoch: 25, train_loss: 0.8661, test_loss: 0.9694, test_f1: 0.4890
 epoch: 26, train_loss: 0.8686, test_loss: 0.9550, test_f1: 0.5121
 epoch: 27, train_loss: 0.8491, test_loss: 0.9869, test_f1: 0.4998
 epoch: 28, train_loss: 0.8337, test_loss: 0.9925, test_f1: 0.5007
 epoch: 29, train_loss: 0.8254, test_loss: 1.0117, test_f1: 0.5125
 epoch: 30, train_loss: 0.8230, test_loss: 0.9865, test_f1: 0.5172
 epoch: 31, train_loss: 0.8069, test_loss: 0.9805, test_f1: 0.5209
 epoch: 32, train_loss: 0.7998, test_loss: 1.0049, test_f1: 0.5090
 epoch: 33, train_loss: 0.7851, test_loss: 1.0495, test_f1: 0.5071
 epoch: 34, train_loss: 0.7839, test_loss: 1.0254, test_f1: 0.5236
 epoch: 35, train_loss: 0.7712, test_loss: 1.0301, test_f1: 0.5348
 epoch: 36, train_loss: 0.7654, test_loss: 1.0331, test_f1: 0.5231
 epoch: 37, train_loss: 0.7653, test_loss: 1.0177, test_f1: 0.5411
 epoch: 38, train_loss: 0.7439, test_loss: 1.0417, test_f1: 0.5297
 epoch: 39, train_loss: 0.7364, test_loss: 1.0842, test_f1: 0.5242
 epoch: 40, train_loss: 0.7403, test_loss: 1.0729, test_f1: 0.5293
 epoch: 41, train_loss: 0.7313, test_loss: 1.0885, test_f1: 0.5287
 epoch: 42, train_loss: 0.7098, test_loss: 1.1055, test_f1: 0.5249
 epoch: 43, train_loss: 0.7212, test_loss: 1.0955, test_f1: 0.5398
 epoch: 44, train_loss: 0.7228, test_loss: 1.0950, test_f1: 0.5219
 epoch: 45, train_loss: 0.6991, test_loss: 1.0401, test_f1: 0.5315
 epoch: 46, train_loss: 0.7007, test_loss: 1.0558, test_f1: 0.5504
 epoch: 47, train_loss: 0.6845, test_loss: 1.1030, test_f1: 0.5347
 epoch: 48, train_loss: 0.6794, test_loss: 1.0716, test_f1: 0.5495
 epoch: 49, train_loss: 0.6710, test_loss: 1.0933, test_f1: 0.5368
 epoch: 50, train_loss: 0.6670, test_loss: 1.1025, test_f1: 0.5255
 epoch: 51, train_loss: 0.6457, test_loss: 1.1321, test_f1: 0.5403
 epoch: 52, train_loss: 0.6560, test_loss: 1.1377, test_f1: 0.5384
 epoch: 53, train_loss: 0.6426, test_loss: 1.1262, test_f1: 0.5419
 epoch: 54, train_loss: 0.6327, test_loss: 1.1349, test_f1: 0.5220
 epoch: 55, train_loss: 0.6322, test_loss: 1.1044, test_f1: 0.5240
 epoch: 56, train_loss: 0.6328, test_loss: 1.0979, test_f1: 0.5345
 epoch: 57, train_loss: 0.6257, test_loss: 1.1787, test_f1: 0.5333
 epoch: 58, train_loss: 0.6188, test_loss: 1.2052, test_f1: 0.5207
 epoch: 59, train_loss: 0.6150, test_loss: 1.1814, test_f1: 0.5293
 epoch: 60, train_loss: 0.6177, test_loss: 1.1516, test_f1: 0.5427
 epoch: 61, train_loss: 0.6057, test_loss: 1.1526, test_f1: 0.5479
 epoch: 62, train_loss: 0.6030, test_loss: 1.1645, test_f1: 0.5326
 epoch: 63, train_loss: 0.5962, test_loss: 1.1541, test_f1: 0.5579
 epoch: 64, train_loss: 0.6026, test_loss: 1.2246, test_f1: 0.5183
 epoch: 65, train_loss: 0.6019, test_loss: 1.2084, test_f1: 0.5302
 epoch: 66, train_loss: 0.6074, test_loss: 1.2292, test_f1: 0.5237
 epoch: 67, train_loss: 0.5907, test_loss: 1.1677, test_f1: 0.5301
 epoch: 68, train_loss: 0.5789, test_loss: 1.2422, test_f1: 0.4980
 epoch: 69, train_loss: 0.5763, test_loss: 1.2227, test_f1: 0.5094
 epoch: 70, train_loss: 0.5727, test_loss: 1.1872, test_f1: 0.5325
 epoch: 71, train_loss: 0.5761, test_loss: 1.2032, test_f1: 0.5263
 epoch: 72, train_loss: 0.5775, test_loss: 1.2118, test_f1: 0.5375
 epoch: 73, train_loss: 0.5814, test_loss: 1.2876, test_f1: 0.5157
 epoch: 74, train_loss: 0.5786, test_loss: 1.2852, test_f1: 0.5204
 epoch: 75, train_loss: 0.5697, test_loss: 1.2366, test_f1: 0.5196
 epoch: 76, train_loss: 0.5736, test_loss: 1.2713, test_f1: 0.5200
 epoch: 77, train_loss: 0.5694, test_loss: 1.2930, test_f1: 0.5067
 epoch: 78, train_loss: 0.5561, test_loss: 1.2503, test_f1: 0.5366
 epoch: 79, train_loss: 0.5501, test_loss: 1.2773, test_f1: 0.5183
 epoch: 80, train_loss: 0.5386, test_loss: 1.3453, test_f1: 0.4989
 epoch: 81, train_loss: 0.5652, test_loss: 1.3179, test_f1: 0.5139
 epoch: 82, train_loss: 0.5502, test_loss: 1.3271, test_f1: 0.5121
 epoch: 83, train_loss: 0.5547, test_loss: 1.4314, test_f1: 0.5042
 epoch: 84, train_loss: 0.5496, test_loss: 1.3178, test_f1: 0.5041
 epoch: 85, train_loss: 0.5396, test_loss: 1.3661, test_f1: 0.5018
 epoch: 86, train_loss: 0.5370, test_loss: 1.3127, test_f1: 0.5069
 epoch: 87, train_loss: 0.5297, test_loss: 1.3610, test_f1: 0.5044
 epoch: 88, train_loss: 0.5365, test_loss: 1.3874, test_f1: 0.5023
 epoch: 89, train_loss: 0.5355, test_loss: 1.3662, test_f1: 0.5004
 epoch: 90, train_loss: 0.5289, test_loss: 1.4636, test_f1: 0.5091
 epoch: 91, train_loss: 0.5076, test_loss: 1.4937, test_f1: 0.5058
 epoch: 92, train_loss: 0.5188, test_loss: 1.4748, test_f1: 0.4982
 epoch: 93, train_loss: 0.5313, test_loss: 1.4295, test_f1: 0.5053
 epoch: 94, train_loss: 0.5105, test_loss: 1.4390, test_f1: 0.5061
 epoch: 95, train_loss: 0.5019, test_loss: 1.3673, test_f1: 0.5304
 epoch: 96, train_loss: 0.5181, test_loss: 1.5408, test_f1: 0.5057
 epoch: 97, train_loss: 0.5109, test_loss: 1.5196, test_f1: 0.5021
 epoch: 98, train_loss: 0.4971, test_loss: 1.5204, test_f1: 0.4908
 epoch: 99, train_loss: 0.5009, test_loss: 1.4913, test_f1: 0.4980
##################ITERATION #6 ****************************************
 epoch: 0, train_loss: 1.3318, test_loss: 1.2678, test_f1: 0.2555
 epoch: 1, train_loss: 1.2162, test_loss: 1.1945, test_f1: 0.3806
 epoch: 2, train_loss: 1.1932, test_loss: 1.1562, test_f1: 0.4539
 epoch: 3, train_loss: 1.1630, test_loss: 1.1307, test_f1: 0.4525
 epoch: 4, train_loss: 1.1437, test_loss: 1.1155, test_f1: 0.4492
 epoch: 5, train_loss: 1.1324, test_loss: 1.1090, test_f1: 0.4551
 epoch: 6, train_loss: 1.1082, test_loss: 1.0967, test_f1: 0.4423
 epoch: 7, train_loss: 1.0924, test_loss: 1.0869, test_f1: 0.4483
 epoch: 8, train_loss: 1.0765, test_loss: 1.0780, test_f1: 0.4572
 epoch: 9, train_loss: 1.0566, test_loss: 1.0738, test_f1: 0.4540
 epoch: 10, train_loss: 1.0464, test_loss: 1.0665, test_f1: 0.4627
 epoch: 11, train_loss: 1.0286, test_loss: 1.0542, test_f1: 0.4536
 epoch: 12, train_loss: 1.0256, test_loss: 1.0596, test_f1: 0.4626
 epoch: 13, train_loss: 1.0218, test_loss: 1.0460, test_f1: 0.4637
 epoch: 14, train_loss: 1.0003, test_loss: 1.0484, test_f1: 0.4563
 epoch: 15, train_loss: 0.9826, test_loss: 1.0467, test_f1: 0.4603
 epoch: 16, train_loss: 0.9755, test_loss: 1.0373, test_f1: 0.4635
 epoch: 17, train_loss: 0.9588, test_loss: 1.0346, test_f1: 0.4625
 epoch: 18, train_loss: 0.9539, test_loss: 1.0250, test_f1: 0.4748
 epoch: 19, train_loss: 0.9424, test_loss: 1.0279, test_f1: 0.4825
 epoch: 20, train_loss: 0.9456, test_loss: 1.0193, test_f1: 0.4708
 epoch: 21, train_loss: 0.9286, test_loss: 1.0441, test_f1: 0.4971
 epoch: 22, train_loss: 0.9279, test_loss: 1.0198, test_f1: 0.4657
 epoch: 23, train_loss: 0.9151, test_loss: 1.0446, test_f1: 0.4844
 epoch: 24, train_loss: 0.9020, test_loss: 1.0393, test_f1: 0.4709
 epoch: 25, train_loss: 0.8937, test_loss: 1.0349, test_f1: 0.4895
 epoch: 26, train_loss: 0.8967, test_loss: 1.0271, test_f1: 0.4760
 epoch: 27, train_loss: 0.8744, test_loss: 1.0234, test_f1: 0.4953
 epoch: 28, train_loss: 0.8547, test_loss: 1.0526, test_f1: 0.4697
 epoch: 29, train_loss: 0.8601, test_loss: 1.0236, test_f1: 0.4999
 epoch: 30, train_loss: 0.8497, test_loss: 1.0556, test_f1: 0.4797
 epoch: 31, train_loss: 0.8380, test_loss: 1.0580, test_f1: 0.5001
 epoch: 32, train_loss: 0.8307, test_loss: 1.0559, test_f1: 0.4924
 epoch: 33, train_loss: 0.8047, test_loss: 1.0435, test_f1: 0.5021
 epoch: 34, train_loss: 0.8080, test_loss: 1.0836, test_f1: 0.5007
 epoch: 35, train_loss: 0.8044, test_loss: 1.0509, test_f1: 0.5154
 epoch: 36, train_loss: 0.7939, test_loss: 1.0699, test_f1: 0.5088
 epoch: 37, train_loss: 0.7926, test_loss: 1.0854, test_f1: 0.5005
 epoch: 38, train_loss: 0.7665, test_loss: 1.0722, test_f1: 0.5086
 epoch: 39, train_loss: 0.7812, test_loss: 1.0809, test_f1: 0.5175
 epoch: 40, train_loss: 0.7692, test_loss: 1.0623, test_f1: 0.4987
 epoch: 41, train_loss: 0.7723, test_loss: 1.0682, test_f1: 0.5263
 epoch: 42, train_loss: 0.7465, test_loss: 1.0878, test_f1: 0.5078
 epoch: 43, train_loss: 0.7370, test_loss: 1.0813, test_f1: 0.5040
 epoch: 44, train_loss: 0.7324, test_loss: 1.0740, test_f1: 0.5137
 epoch: 45, train_loss: 0.7342, test_loss: 1.1304, test_f1: 0.5156
 epoch: 46, train_loss: 0.7285, test_loss: 1.0995, test_f1: 0.5149
 epoch: 47, train_loss: 0.7150, test_loss: 1.0891, test_f1: 0.5206
 epoch: 48, train_loss: 0.7246, test_loss: 1.1604, test_f1: 0.5061
 epoch: 49, train_loss: 0.6774, test_loss: 1.1690, test_f1: 0.5093
 epoch: 50, train_loss: 0.7024, test_loss: 1.1852, test_f1: 0.5061
 epoch: 51, train_loss: 0.6828, test_loss: 1.1410, test_f1: 0.5144
 epoch: 52, train_loss: 0.6793, test_loss: 1.1324, test_f1: 0.5317
 epoch: 53, train_loss: 0.6767, test_loss: 1.1678, test_f1: 0.5167
 epoch: 54, train_loss: 0.6738, test_loss: 1.1676, test_f1: 0.5156
 epoch: 55, train_loss: 0.6628, test_loss: 1.1789, test_f1: 0.5053
 epoch: 56, train_loss: 0.6568, test_loss: 1.1889, test_f1: 0.5274
 epoch: 57, train_loss: 0.6518, test_loss: 1.1259, test_f1: 0.5333
 epoch: 58, train_loss: 0.6427, test_loss: 1.1813, test_f1: 0.5276
 epoch: 59, train_loss: 0.6526, test_loss: 1.2023, test_f1: 0.5210
 epoch: 60, train_loss: 0.6415, test_loss: 1.1965, test_f1: 0.5340
 epoch: 61, train_loss: 0.6486, test_loss: 1.1921, test_f1: 0.5318
 epoch: 62, train_loss: 0.6407, test_loss: 1.2129, test_f1: 0.5257
 epoch: 63, train_loss: 0.6427, test_loss: 1.2147, test_f1: 0.5259
 epoch: 64, train_loss: 0.6244, test_loss: 1.2035, test_f1: 0.5352
 epoch: 65, train_loss: 0.6389, test_loss: 1.2256, test_f1: 0.5266
 epoch: 66, train_loss: 0.6308, test_loss: 1.2462, test_f1: 0.5287
 epoch: 67, train_loss: 0.6145, test_loss: 1.1979, test_f1: 0.5332
 epoch: 68, train_loss: 0.6129, test_loss: 1.2249, test_f1: 0.5322
 epoch: 69, train_loss: 0.6316, test_loss: 1.2315, test_f1: 0.5323
 epoch: 70, train_loss: 0.6086, test_loss: 1.2260, test_f1: 0.5365
 epoch: 71, train_loss: 0.6065, test_loss: 1.2202, test_f1: 0.5358
 epoch: 72, train_loss: 0.6164, test_loss: 1.2240, test_f1: 0.5349
 epoch: 73, train_loss: 0.6113, test_loss: 1.2527, test_f1: 0.5259
 epoch: 74, train_loss: 0.5892, test_loss: 1.2281, test_f1: 0.5374
 epoch: 75, train_loss: 0.5967, test_loss: 1.2403, test_f1: 0.5268
 epoch: 76, train_loss: 0.6088, test_loss: 1.2502, test_f1: 0.5376
 epoch: 77, train_loss: 0.5869, test_loss: 1.2615, test_f1: 0.5342
 epoch: 78, train_loss: 0.6052, test_loss: 1.2605, test_f1: 0.5419
 epoch: 79, train_loss: 0.5947, test_loss: 1.2717, test_f1: 0.5312
 epoch: 80, train_loss: 0.5872, test_loss: 1.2819, test_f1: 0.5531
 epoch: 81, train_loss: 0.5858, test_loss: 1.2945, test_f1: 0.5351
 epoch: 82, train_loss: 0.5962, test_loss: 1.3570, test_f1: 0.5171
 epoch: 83, train_loss: 0.5799, test_loss: 1.3026, test_f1: 0.5388
 epoch: 84, train_loss: 0.5799, test_loss: 1.2779, test_f1: 0.5244
 epoch: 85, train_loss: 0.5731, test_loss: 1.2796, test_f1: 0.5427
 epoch: 86, train_loss: 0.5747, test_loss: 1.3313, test_f1: 0.5225
 epoch: 87, train_loss: 0.5723, test_loss: 1.3238, test_f1: 0.5236
 epoch: 88, train_loss: 0.5748, test_loss: 1.3729, test_f1: 0.5193
 epoch: 89, train_loss: 0.5663, test_loss: 1.3174, test_f1: 0.5484
 epoch: 90, train_loss: 0.5670, test_loss: 1.2913, test_f1: 0.5372
 epoch: 91, train_loss: 0.5795, test_loss: 1.3468, test_f1: 0.5231
 epoch: 92, train_loss: 0.5691, test_loss: 1.3518, test_f1: 0.5291
 epoch: 93, train_loss: 0.5454, test_loss: 1.3016, test_f1: 0.5447
 epoch: 94, train_loss: 0.5615, test_loss: 1.2860, test_f1: 0.5393
 epoch: 95, train_loss: 0.5682, test_loss: 1.3940, test_f1: 0.5270
 epoch: 96, train_loss: 0.5402, test_loss: 1.3803, test_f1: 0.5361
 epoch: 97, train_loss: 0.5520, test_loss: 1.3616, test_f1: 0.5316
 epoch: 98, train_loss: 0.5545, test_loss: 1.3458, test_f1: 0.5312
 epoch: 99, train_loss: 0.5619, test_loss: 1.3787, test_f1: 0.5221
##################ITERATION #7 ****************************************
 epoch: 0, train_loss: 1.3371, test_loss: 1.2564, test_f1: 0.2928
 epoch: 1, train_loss: 1.2469, test_loss: 1.1874, test_f1: 0.4415
 epoch: 2, train_loss: 1.2215, test_loss: 1.1737, test_f1: 0.4479
 epoch: 3, train_loss: 1.1881, test_loss: 1.1401, test_f1: 0.4549
 epoch: 4, train_loss: 1.1687, test_loss: 1.1243, test_f1: 0.4469
 epoch: 5, train_loss: 1.1549, test_loss: 1.0993, test_f1: 0.4357
 epoch: 6, train_loss: 1.1315, test_loss: 1.1040, test_f1: 0.4418
 epoch: 7, train_loss: 1.1274, test_loss: 1.0781, test_f1: 0.4582
 epoch: 8, train_loss: 1.1099, test_loss: 1.0775, test_f1: 0.4637
 epoch: 9, train_loss: 1.0935, test_loss: 1.0643, test_f1: 0.4694
 epoch: 10, train_loss: 1.0845, test_loss: 1.0533, test_f1: 0.4793
 epoch: 11, train_loss: 1.0725, test_loss: 1.0398, test_f1: 0.4816
 epoch: 12, train_loss: 1.0600, test_loss: 1.0221, test_f1: 0.4786
 epoch: 13, train_loss: 1.0556, test_loss: 1.0251, test_f1: 0.4687
 epoch: 14, train_loss: 1.0482, test_loss: 1.0159, test_f1: 0.4665
 epoch: 15, train_loss: 1.0211, test_loss: 1.0121, test_f1: 0.4836
 epoch: 16, train_loss: 1.0202, test_loss: 1.0028, test_f1: 0.4755
 epoch: 17, train_loss: 1.0132, test_loss: 0.9988, test_f1: 0.4689
 epoch: 18, train_loss: 1.0008, test_loss: 1.0129, test_f1: 0.4591
 epoch: 19, train_loss: 0.9961, test_loss: 0.9964, test_f1: 0.4760
 epoch: 20, train_loss: 0.9867, test_loss: 0.9851, test_f1: 0.4628
 epoch: 21, train_loss: 0.9702, test_loss: 0.9869, test_f1: 0.4731
 epoch: 22, train_loss: 0.9761, test_loss: 0.9876, test_f1: 0.4589
 epoch: 23, train_loss: 0.9568, test_loss: 0.9859, test_f1: 0.4699
 epoch: 24, train_loss: 0.9424, test_loss: 0.9799, test_f1: 0.4740
 epoch: 25, train_loss: 0.9414, test_loss: 0.9929, test_f1: 0.4591
 epoch: 26, train_loss: 0.9410, test_loss: 0.9946, test_f1: 0.4650
 epoch: 27, train_loss: 0.9214, test_loss: 0.9875, test_f1: 0.4658
 epoch: 28, train_loss: 0.9144, test_loss: 0.9904, test_f1: 0.4637
 epoch: 29, train_loss: 0.9074, test_loss: 0.9890, test_f1: 0.4656
 epoch: 30, train_loss: 0.8947, test_loss: 0.9824, test_f1: 0.4962
 epoch: 31, train_loss: 0.8886, test_loss: 0.9926, test_f1: 0.4979
 epoch: 32, train_loss: 0.8857, test_loss: 0.9895, test_f1: 0.4929
 epoch: 33, train_loss: 0.8796, test_loss: 1.0016, test_f1: 0.5027
 epoch: 34, train_loss: 0.8701, test_loss: 1.0506, test_f1: 0.4711
 epoch: 35, train_loss: 0.8570, test_loss: 1.0112, test_f1: 0.4961
 epoch: 36, train_loss: 0.8515, test_loss: 1.0485, test_f1: 0.4857
 epoch: 37, train_loss: 0.8549, test_loss: 1.0055, test_f1: 0.4866
 epoch: 38, train_loss: 0.8490, test_loss: 0.9962, test_f1: 0.4995
 epoch: 39, train_loss: 0.8330, test_loss: 1.0611, test_f1: 0.4931
 epoch: 40, train_loss: 0.8181, test_loss: 1.0390, test_f1: 0.5068
 epoch: 41, train_loss: 0.8167, test_loss: 1.1017, test_f1: 0.4980
 epoch: 42, train_loss: 0.8179, test_loss: 1.0973, test_f1: 0.4923
 epoch: 43, train_loss: 0.8038, test_loss: 1.0441, test_f1: 0.5224
 epoch: 44, train_loss: 0.7958, test_loss: 1.0282, test_f1: 0.5068
 epoch: 45, train_loss: 0.7760, test_loss: 1.0661, test_f1: 0.4994
 epoch: 46, train_loss: 0.7936, test_loss: 1.0607, test_f1: 0.5184
 epoch: 47, train_loss: 0.7705, test_loss: 1.0650, test_f1: 0.5286
 epoch: 48, train_loss: 0.7665, test_loss: 1.0458, test_f1: 0.5020
 epoch: 49, train_loss: 0.7535, test_loss: 1.0364, test_f1: 0.5287
 epoch: 50, train_loss: 0.7428, test_loss: 1.0882, test_f1: 0.5045
 epoch: 51, train_loss: 0.7432, test_loss: 1.0735, test_f1: 0.5172
 epoch: 52, train_loss: 0.7343, test_loss: 1.1212, test_f1: 0.5215
 epoch: 53, train_loss: 0.7378, test_loss: 1.0785, test_f1: 0.5181
 epoch: 54, train_loss: 0.7273, test_loss: 1.1266, test_f1: 0.5082
 epoch: 55, train_loss: 0.7062, test_loss: 1.0791, test_f1: 0.5363
 epoch: 56, train_loss: 0.7018, test_loss: 1.1048, test_f1: 0.5297
 epoch: 57, train_loss: 0.7122, test_loss: 1.1126, test_f1: 0.5066
 epoch: 58, train_loss: 0.7128, test_loss: 1.0854, test_f1: 0.5220
 epoch: 59, train_loss: 0.6965, test_loss: 1.0849, test_f1: 0.5422
 epoch: 60, train_loss: 0.6931, test_loss: 1.0766, test_f1: 0.5386
 epoch: 61, train_loss: 0.6896, test_loss: 1.1084, test_f1: 0.5318
 epoch: 62, train_loss: 0.6932, test_loss: 1.2239, test_f1: 0.5229
 epoch: 63, train_loss: 0.6871, test_loss: 1.1139, test_f1: 0.5442
 epoch: 64, train_loss: 0.6836, test_loss: 1.1360, test_f1: 0.5326
 epoch: 65, train_loss: 0.6739, test_loss: 1.2129, test_f1: 0.5158
 epoch: 66, train_loss: 0.6813, test_loss: 1.0947, test_f1: 0.5345
 epoch: 67, train_loss: 0.6770, test_loss: 1.1260, test_f1: 0.5431
 epoch: 68, train_loss: 0.6641, test_loss: 1.1249, test_f1: 0.5260
 epoch: 69, train_loss: 0.6617, test_loss: 1.1499, test_f1: 0.5227
 epoch: 70, train_loss: 0.6559, test_loss: 1.1603, test_f1: 0.5370
 epoch: 71, train_loss: 0.6513, test_loss: 1.1474, test_f1: 0.5444
 epoch: 72, train_loss: 0.6468, test_loss: 1.1527, test_f1: 0.5373
 epoch: 73, train_loss: 0.6578, test_loss: 1.1409, test_f1: 0.5378
 epoch: 74, train_loss: 0.6485, test_loss: 1.1484, test_f1: 0.5332
 epoch: 75, train_loss: 0.6478, test_loss: 1.2032, test_f1: 0.5350
 epoch: 76, train_loss: 0.6337, test_loss: 1.1564, test_f1: 0.5361
 epoch: 77, train_loss: 0.6325, test_loss: 1.2073, test_f1: 0.5245
 epoch: 78, train_loss: 0.6340, test_loss: 1.1706, test_f1: 0.5654
 epoch: 79, train_loss: 0.6350, test_loss: 1.1636, test_f1: 0.5380
 epoch: 80, train_loss: 0.6030, test_loss: 1.2131, test_f1: 0.5336
 epoch: 81, train_loss: 0.6426, test_loss: 1.2138, test_f1: 0.5460
 epoch: 82, train_loss: 0.6122, test_loss: 1.1918, test_f1: 0.5427
 epoch: 83, train_loss: 0.6295, test_loss: 1.1612, test_f1: 0.5508
 epoch: 84, train_loss: 0.6009, test_loss: 1.2344, test_f1: 0.5382
 epoch: 85, train_loss: 0.5946, test_loss: 1.1790, test_f1: 0.5467
 epoch: 86, train_loss: 0.6042, test_loss: 1.1824, test_f1: 0.5289
 epoch: 87, train_loss: 0.6121, test_loss: 1.2055, test_f1: 0.5522
 epoch: 88, train_loss: 0.6218, test_loss: 1.2314, test_f1: 0.5358
 epoch: 89, train_loss: 0.5936, test_loss: 1.2075, test_f1: 0.5508
 epoch: 90, train_loss: 0.5872, test_loss: 1.2170, test_f1: 0.5464
 epoch: 91, train_loss: 0.5940, test_loss: 1.2289, test_f1: 0.5487
 epoch: 92, train_loss: 0.5933, test_loss: 1.2525, test_f1: 0.5479
 epoch: 93, train_loss: 0.5944, test_loss: 1.2512, test_f1: 0.5423
 epoch: 94, train_loss: 0.5786, test_loss: 1.2848, test_f1: 0.5508
 epoch: 95, train_loss: 0.5873, test_loss: 1.2358, test_f1: 0.5477
 epoch: 96, train_loss: 0.6009, test_loss: 1.2693, test_f1: 0.5320
 epoch: 97, train_loss: 0.5697, test_loss: 1.2740, test_f1: 0.5411
 epoch: 98, train_loss: 0.5772, test_loss: 1.2131, test_f1: 0.5514
 epoch: 99, train_loss: 0.5655, test_loss: 1.2394, test_f1: 0.5490
##################ITERATION #8 ****************************************
 epoch: 0, train_loss: 1.3462, test_loss: 1.2398, test_f1: 0.3403
 epoch: 1, train_loss: 1.2272, test_loss: 1.1657, test_f1: 0.4647
 epoch: 2, train_loss: 1.1894, test_loss: 1.1237, test_f1: 0.4479
 epoch: 3, train_loss: 1.1530, test_loss: 1.1061, test_f1: 0.4464
 epoch: 4, train_loss: 1.1299, test_loss: 1.0963, test_f1: 0.4569
 epoch: 5, train_loss: 1.1206, test_loss: 1.0747, test_f1: 0.4528
 epoch: 6, train_loss: 1.1175, test_loss: 1.0798, test_f1: 0.4623
 epoch: 7, train_loss: 1.0899, test_loss: 1.0957, test_f1: 0.4340
 epoch: 8, train_loss: 1.0723, test_loss: 1.0723, test_f1: 0.4427
 epoch: 9, train_loss: 1.0560, test_loss: 1.0589, test_f1: 0.4567
 epoch: 10, train_loss: 1.0509, test_loss: 1.0393, test_f1: 0.4823
 epoch: 11, train_loss: 1.0349, test_loss: 1.0591, test_f1: 0.4326
 epoch: 12, train_loss: 1.0181, test_loss: 1.0540, test_f1: 0.4432
 epoch: 13, train_loss: 1.0104, test_loss: 1.0297, test_f1: 0.4522
 epoch: 14, train_loss: 1.0016, test_loss: 1.0300, test_f1: 0.4461
 epoch: 15, train_loss: 0.9858, test_loss: 1.0305, test_f1: 0.4433
 epoch: 16, train_loss: 0.9671, test_loss: 1.0311, test_f1: 0.4443
 epoch: 17, train_loss: 0.9785, test_loss: 1.0230, test_f1: 0.4463
 epoch: 18, train_loss: 0.9637, test_loss: 1.0080, test_f1: 0.4596
 epoch: 19, train_loss: 0.9411, test_loss: 1.0301, test_f1: 0.4478
 epoch: 20, train_loss: 0.9449, test_loss: 1.0094, test_f1: 0.4788
 epoch: 21, train_loss: 0.9268, test_loss: 1.0221, test_f1: 0.4698
 epoch: 22, train_loss: 0.9308, test_loss: 0.9991, test_f1: 0.4854
 epoch: 23, train_loss: 0.9186, test_loss: 1.0047, test_f1: 0.4836
 epoch: 24, train_loss: 0.9095, test_loss: 0.9963, test_f1: 0.4709
 epoch: 25, train_loss: 0.9009, test_loss: 1.0204, test_f1: 0.4848
 epoch: 26, train_loss: 0.9017, test_loss: 0.9965, test_f1: 0.4818
 epoch: 27, train_loss: 0.8829, test_loss: 0.9998, test_f1: 0.4918
 epoch: 28, train_loss: 0.8732, test_loss: 1.0287, test_f1: 0.4739
 epoch: 29, train_loss: 0.8691, test_loss: 1.0308, test_f1: 0.4813
 epoch: 30, train_loss: 0.8467, test_loss: 1.0324, test_f1: 0.4786
 epoch: 31, train_loss: 0.8500, test_loss: 1.0156, test_f1: 0.4841
 epoch: 32, train_loss: 0.8547, test_loss: 0.9825, test_f1: 0.5081
 epoch: 33, train_loss: 0.8385, test_loss: 1.0328, test_f1: 0.5023
 epoch: 34, train_loss: 0.8202, test_loss: 1.0364, test_f1: 0.5133
 epoch: 35, train_loss: 0.8118, test_loss: 1.0371, test_f1: 0.4948
 epoch: 36, train_loss: 0.8129, test_loss: 1.0471, test_f1: 0.4946
 epoch: 37, train_loss: 0.7946, test_loss: 1.0417, test_f1: 0.5154
 epoch: 38, train_loss: 0.7967, test_loss: 1.0635, test_f1: 0.4713
 epoch: 39, train_loss: 0.7923, test_loss: 1.0338, test_f1: 0.5197
 epoch: 40, train_loss: 0.7836, test_loss: 1.0439, test_f1: 0.5117
 epoch: 41, train_loss: 0.7706, test_loss: 1.0878, test_f1: 0.5005
 epoch: 42, train_loss: 0.7750, test_loss: 1.0928, test_f1: 0.5065
 epoch: 43, train_loss: 0.7661, test_loss: 1.0579, test_f1: 0.4729
 epoch: 44, train_loss: 0.7698, test_loss: 1.0863, test_f1: 0.4899
 epoch: 45, train_loss: 0.7475, test_loss: 1.0984, test_f1: 0.4932
 epoch: 46, train_loss: 0.7292, test_loss: 1.1104, test_f1: 0.4856
 epoch: 47, train_loss: 0.7368, test_loss: 1.1403, test_f1: 0.4736
 epoch: 48, train_loss: 0.7439, test_loss: 1.1432, test_f1: 0.4986
 epoch: 49, train_loss: 0.7266, test_loss: 1.1323, test_f1: 0.4802
 epoch: 50, train_loss: 0.7161, test_loss: 1.1205, test_f1: 0.5219
 epoch: 51, train_loss: 0.7152, test_loss: 1.1106, test_f1: 0.5280
 epoch: 52, train_loss: 0.6876, test_loss: 1.1383, test_f1: 0.5036
 epoch: 53, train_loss: 0.6992, test_loss: 1.1384, test_f1: 0.4926
 epoch: 54, train_loss: 0.6798, test_loss: 1.1307, test_f1: 0.5128
 epoch: 55, train_loss: 0.6744, test_loss: 1.1523, test_f1: 0.5068
 epoch: 56, train_loss: 0.6826, test_loss: 1.1489, test_f1: 0.5119
 epoch: 57, train_loss: 0.6735, test_loss: 1.1418, test_f1: 0.5034
 epoch: 58, train_loss: 0.6722, test_loss: 1.1674, test_f1: 0.5096
 epoch: 59, train_loss: 0.6655, test_loss: 1.1687, test_f1: 0.5188
 epoch: 60, train_loss: 0.6627, test_loss: 1.1517, test_f1: 0.5155
 epoch: 61, train_loss: 0.6684, test_loss: 1.1768, test_f1: 0.5158
 epoch: 62, train_loss: 0.6583, test_loss: 1.1609, test_f1: 0.5133
 epoch: 63, train_loss: 0.6511, test_loss: 1.1603, test_f1: 0.5203
 epoch: 64, train_loss: 0.6602, test_loss: 1.1910, test_f1: 0.5127
 epoch: 65, train_loss: 0.6713, test_loss: 1.1722, test_f1: 0.5117
 epoch: 66, train_loss: 0.6594, test_loss: 1.1985, test_f1: 0.5037
 epoch: 67, train_loss: 0.6534, test_loss: 1.2199, test_f1: 0.5108
 epoch: 68, train_loss: 0.6335, test_loss: 1.1962, test_f1: 0.5043
 epoch: 69, train_loss: 0.6389, test_loss: 1.1964, test_f1: 0.5139
 epoch: 70, train_loss: 0.6219, test_loss: 1.2528, test_f1: 0.5080
 epoch: 71, train_loss: 0.6193, test_loss: 1.2323, test_f1: 0.5152
 epoch: 72, train_loss: 0.6371, test_loss: 1.2141, test_f1: 0.5140
 epoch: 73, train_loss: 0.6217, test_loss: 1.2390, test_f1: 0.5051
 epoch: 74, train_loss: 0.6139, test_loss: 1.2492, test_f1: 0.5003
 epoch: 75, train_loss: 0.6349, test_loss: 1.2765, test_f1: 0.5102
 epoch: 76, train_loss: 0.6103, test_loss: 1.2722, test_f1: 0.5151
 epoch: 77, train_loss: 0.5994, test_loss: 1.2424, test_f1: 0.5128
 epoch: 78, train_loss: 0.6245, test_loss: 1.2436, test_f1: 0.5052
 epoch: 79, train_loss: 0.6046, test_loss: 1.2829, test_f1: 0.5040
 epoch: 80, train_loss: 0.6170, test_loss: 1.2594, test_f1: 0.5133
 epoch: 81, train_loss: 0.6080, test_loss: 1.2988, test_f1: 0.5185
 epoch: 82, train_loss: 0.6123, test_loss: 1.2590, test_f1: 0.5102
 epoch: 83, train_loss: 0.6097, test_loss: 1.2646, test_f1: 0.5048
 epoch: 84, train_loss: 0.5922, test_loss: 1.2719, test_f1: 0.4946
 epoch: 85, train_loss: 0.5812, test_loss: 1.2873, test_f1: 0.5026
 epoch: 86, train_loss: 0.5951, test_loss: 1.2744, test_f1: 0.5074
 epoch: 87, train_loss: 0.5841, test_loss: 1.3070, test_f1: 0.5088
 epoch: 88, train_loss: 0.5777, test_loss: 1.3098, test_f1: 0.5081
 epoch: 89, train_loss: 0.5832, test_loss: 1.3190, test_f1: 0.5017
 epoch: 90, train_loss: 0.5918, test_loss: 1.3006, test_f1: 0.5041
 epoch: 91, train_loss: 0.5830, test_loss: 1.2739, test_f1: 0.5290
 epoch: 92, train_loss: 0.5781, test_loss: 1.2913, test_f1: 0.5083
 epoch: 93, train_loss: 0.5695, test_loss: 1.3346, test_f1: 0.5066
 epoch: 94, train_loss: 0.5799, test_loss: 1.3197, test_f1: 0.5113
 epoch: 95, train_loss: 0.5677, test_loss: 1.3359, test_f1: 0.5129
 epoch: 96, train_loss: 0.5699, test_loss: 1.3637, test_f1: 0.4954
 epoch: 97, train_loss: 0.5616, test_loss: 1.3675, test_f1: 0.5152
 epoch: 98, train_loss: 0.5621, test_loss: 1.3389, test_f1: 0.5268
 epoch: 99, train_loss: 0.5710, test_loss: 1.3347, test_f1: 0.5136
##################ITERATION #9 ****************************************
 epoch: 0, train_loss: 1.3476, test_loss: 1.2837, test_f1: 0.3405
 epoch: 1, train_loss: 1.2320, test_loss: 1.2040, test_f1: 0.3821
 epoch: 2, train_loss: 1.2106, test_loss: 1.1414, test_f1: 0.4575
 epoch: 3, train_loss: 1.1789, test_loss: 1.1254, test_f1: 0.4514
 epoch: 4, train_loss: 1.1579, test_loss: 1.0965, test_f1: 0.4604
 epoch: 5, train_loss: 1.1417, test_loss: 1.1002, test_f1: 0.4605
 epoch: 6, train_loss: 1.1049, test_loss: 1.0851, test_f1: 0.4721
 epoch: 7, train_loss: 1.0958, test_loss: 1.0744, test_f1: 0.4676
 epoch: 8, train_loss: 1.0835, test_loss: 1.0618, test_f1: 0.4803
 epoch: 9, train_loss: 1.0703, test_loss: 1.0568, test_f1: 0.4729
 epoch: 10, train_loss: 1.0575, test_loss: 1.0473, test_f1: 0.4899
 epoch: 11, train_loss: 1.0548, test_loss: 1.0367, test_f1: 0.4721
 epoch: 12, train_loss: 1.0424, test_loss: 1.0372, test_f1: 0.4789
 epoch: 13, train_loss: 1.0352, test_loss: 1.0221, test_f1: 0.4873
 epoch: 14, train_loss: 1.0383, test_loss: 1.0097, test_f1: 0.4911
 epoch: 15, train_loss: 1.0098, test_loss: 1.0022, test_f1: 0.5009
 epoch: 16, train_loss: 0.9953, test_loss: 0.9988, test_f1: 0.4832
 epoch: 17, train_loss: 0.9772, test_loss: 1.0065, test_f1: 0.5090
 epoch: 18, train_loss: 0.9635, test_loss: 0.9883, test_f1: 0.4937
 epoch: 19, train_loss: 0.9606, test_loss: 0.9872, test_f1: 0.5069
 epoch: 20, train_loss: 0.9594, test_loss: 0.9838, test_f1: 0.5316
 epoch: 21, train_loss: 0.9509, test_loss: 0.9987, test_f1: 0.4949
 epoch: 22, train_loss: 0.9387, test_loss: 0.9944, test_f1: 0.5008
 epoch: 23, train_loss: 0.9442, test_loss: 0.9875, test_f1: 0.5068
 epoch: 24, train_loss: 0.9281, test_loss: 0.9754, test_f1: 0.4946
 epoch: 25, train_loss: 0.9138, test_loss: 0.9868, test_f1: 0.5218
 epoch: 26, train_loss: 0.9084, test_loss: 0.9952, test_f1: 0.5113
 epoch: 27, train_loss: 0.8943, test_loss: 0.9844, test_f1: 0.5108
 epoch: 28, train_loss: 0.8881, test_loss: 0.9905, test_f1: 0.5188
 epoch: 29, train_loss: 0.8603, test_loss: 0.9659, test_f1: 0.5203
 epoch: 30, train_loss: 0.8838, test_loss: 0.9960, test_f1: 0.5033
 epoch: 31, train_loss: 0.8710, test_loss: 0.9818, test_f1: 0.5173
 epoch: 32, train_loss: 0.8703, test_loss: 1.0021, test_f1: 0.4910
 epoch: 33, train_loss: 0.8505, test_loss: 0.9962, test_f1: 0.5214
 epoch: 34, train_loss: 0.8365, test_loss: 1.0006, test_f1: 0.4904
 epoch: 35, train_loss: 0.8292, test_loss: 0.9931, test_f1: 0.5084
 epoch: 36, train_loss: 0.8289, test_loss: 0.9910, test_f1: 0.4984
 epoch: 37, train_loss: 0.8207, test_loss: 1.0227, test_f1: 0.5158
 epoch: 38, train_loss: 0.8052, test_loss: 1.0192, test_f1: 0.4989
 epoch: 39, train_loss: 0.8108, test_loss: 1.0162, test_f1: 0.5033
 epoch: 40, train_loss: 0.7795, test_loss: 1.0421, test_f1: 0.5042
 epoch: 41, train_loss: 0.7870, test_loss: 1.0401, test_f1: 0.5007
 epoch: 42, train_loss: 0.7773, test_loss: 1.0352, test_f1: 0.5098
 epoch: 43, train_loss: 0.7674, test_loss: 1.0387, test_f1: 0.5110
 epoch: 44, train_loss: 0.7688, test_loss: 1.0324, test_f1: 0.5200
 epoch: 45, train_loss: 0.7532, test_loss: 1.0607, test_f1: 0.5296
 epoch: 46, train_loss: 0.7511, test_loss: 1.0479, test_f1: 0.5275
 epoch: 47, train_loss: 0.7429, test_loss: 1.0591, test_f1: 0.5286
 epoch: 48, train_loss: 0.7332, test_loss: 1.0165, test_f1: 0.5127
 epoch: 49, train_loss: 0.7382, test_loss: 1.0616, test_f1: 0.5213
 epoch: 50, train_loss: 0.7191, test_loss: 1.0850, test_f1: 0.5176
 epoch: 51, train_loss: 0.7075, test_loss: 1.0817, test_f1: 0.5272
 epoch: 52, train_loss: 0.6980, test_loss: 1.0602, test_f1: 0.5324
 epoch: 53, train_loss: 0.6936, test_loss: 1.0553, test_f1: 0.5257
 epoch: 54, train_loss: 0.6829, test_loss: 1.0735, test_f1: 0.5362
 epoch: 55, train_loss: 0.6832, test_loss: 1.0968, test_f1: 0.5366
 epoch: 56, train_loss: 0.6782, test_loss: 1.0791, test_f1: 0.5288
 epoch: 57, train_loss: 0.6780, test_loss: 1.0800, test_f1: 0.5403
 epoch: 58, train_loss: 0.6871, test_loss: 1.0887, test_f1: 0.5257
 epoch: 59, train_loss: 0.6639, test_loss: 1.0903, test_f1: 0.5288
 epoch: 60, train_loss: 0.6646, test_loss: 1.1143, test_f1: 0.5303
 epoch: 61, train_loss: 0.6696, test_loss: 1.0808, test_f1: 0.5235
 epoch: 62, train_loss: 0.6751, test_loss: 1.1017, test_f1: 0.5328
 epoch: 63, train_loss: 0.6611, test_loss: 1.0979, test_f1: 0.5310
 epoch: 64, train_loss: 0.6485, test_loss: 1.1396, test_f1: 0.5334
 epoch: 65, train_loss: 0.6365, test_loss: 1.1536, test_f1: 0.5269
 epoch: 66, train_loss: 0.6444, test_loss: 1.1142, test_f1: 0.5370
 epoch: 67, train_loss: 0.6565, test_loss: 1.1502, test_f1: 0.5448
 epoch: 68, train_loss: 0.6442, test_loss: 1.1355, test_f1: 0.5389
 epoch: 69, train_loss: 0.6316, test_loss: 1.1400, test_f1: 0.5468
 epoch: 70, train_loss: 0.6520, test_loss: 1.1592, test_f1: 0.5237
 epoch: 71, train_loss: 0.6478, test_loss: 1.1535, test_f1: 0.5348
 epoch: 72, train_loss: 0.6387, test_loss: 1.1574, test_f1: 0.5371
 epoch: 73, train_loss: 0.6439, test_loss: 1.1530, test_f1: 0.5331
 epoch: 74, train_loss: 0.6306, test_loss: 1.1527, test_f1: 0.5430
 epoch: 75, train_loss: 0.6145, test_loss: 1.1414, test_f1: 0.5399
 epoch: 76, train_loss: 0.6136, test_loss: 1.1481, test_f1: 0.5336
 epoch: 77, train_loss: 0.6185, test_loss: 1.1541, test_f1: 0.5335
 epoch: 78, train_loss: 0.6097, test_loss: 1.2006, test_f1: 0.5371
 epoch: 79, train_loss: 0.6059, test_loss: 1.1809, test_f1: 0.5241
 epoch: 80, train_loss: 0.6059, test_loss: 1.1499, test_f1: 0.5284
 epoch: 81, train_loss: 0.6054, test_loss: 1.1575, test_f1: 0.5282
 epoch: 82, train_loss: 0.5987, test_loss: 1.2239, test_f1: 0.5348
 epoch: 83, train_loss: 0.5892, test_loss: 1.2045, test_f1: 0.5363
 epoch: 84, train_loss: 0.5825, test_loss: 1.1748, test_f1: 0.5380
 epoch: 85, train_loss: 0.6053, test_loss: 1.2021, test_f1: 0.5347
 epoch: 86, train_loss: 0.5926, test_loss: 1.2382, test_f1: 0.5304
 epoch: 87, train_loss: 0.5990, test_loss: 1.2070, test_f1: 0.5281
 epoch: 88, train_loss: 0.5794, test_loss: 1.2360, test_f1: 0.5369
 epoch: 89, train_loss: 0.5778, test_loss: 1.2292, test_f1: 0.5352
 epoch: 90, train_loss: 0.5852, test_loss: 1.2233, test_f1: 0.5231
 epoch: 91, train_loss: 0.5682, test_loss: 1.2566, test_f1: 0.5387
 epoch: 92, train_loss: 0.5731, test_loss: 1.2199, test_f1: 0.5355
 epoch: 93, train_loss: 0.5675, test_loss: 1.2819, test_f1: 0.5193
 epoch: 94, train_loss: 0.5597, test_loss: 1.2558, test_f1: 0.5272
 epoch: 95, train_loss: 0.5609, test_loss: 1.2593, test_f1: 0.5264
 epoch: 96, train_loss: 0.5440, test_loss: 1.2621, test_f1: 0.5236
 epoch: 97, train_loss: 0.5545, test_loss: 1.2823, test_f1: 0.5302
 epoch: 98, train_loss: 0.5535, test_loss: 1.2915, test_f1: 0.5282
 epoch: 99, train_loss: 0.5545, test_loss: 1.2688, test_f1: 0.5393

Training completed in 488.49 seconds
Best F1: 0.5815 at epoch 91
Mean F1 across iterations: 0.5507  0.0152
========================FINAL RESULTS================================
FEGIN weighted F1: 0.5815  0.0152
python main.py --data ltspice_examples --representation component_component --model FEGIN --layers 4 --hiddens 128 --batch_size 128 --lr 0.0001 --emb_size 128 --epochs 100 --save_appendix component_component_L4_H128_BS128_LR0.0001_E128 --no_val
-----



STDERR:
  File "main.py", line 370, in <module>
    main()
  File "main.py", line 254, in main
    dataset = dataset_class(
  File "/home/philip/projects/ltspice_examples_code_repo/Circuit-Completion-Using-GNNs/component_classification_with_link_prediction_head/evaluation/FEGIN/kernel/circuit_datasets.py", line 15, in __init__
    self.data, self.slices = torch.load(self.processed_paths[0])
  File "/home/philip/.local/lib/python3.8/site-packages/torch/serialization.py", line 1040, in load
    warnings.warn(
  File "/usr/lib/python3.8/warnings.py", line 109, in _showwarnmsg
    sw(msg.message, msg.category, msg.filename, msg.lineno,
  File "main.py", line 47, in warn_with_traceback
    traceback.print_stack(file=log)
/home/philip/projects/ltspice_examples_code_repo/Circuit-Completion-Using-GNNs/component_classification_with_link_prediction_head/evaluation/FEGIN/kernel/circuit_datasets.py:15: FutureWarning: You are using `torch.load` with `weights_only=False` (the current default value), which uses the default pickle module implicitly. It is possible to construct malicious pickle data which will execute arbitrary code during unpickling (See https://github.com/pytorch/pytorch/blob/main/SECURITY.md#untrusted-models for more details). In a future release, the default value for `weights_only` will be flipped to `True`. This limits the functions that could be executed during unpickling. Arbitrary objects will no longer be allowed to be loaded via this mode unless they are explicitly allowlisted by the user via `torch.serialization.add_safe_globals`. We recommend you start setting `weights_only=True` for any use case where you don't have full control of the loaded file. Please open an issue on GitHub for any issues related to this experimental feature.
  self.data, self.slices = torch.load(self.processed_paths[0])
