STDOUT:
Results will be saved in /home/philip/projects/ltspice_examples_code_repo/Circuit-Completion-Using-GNNs/component_classification_with_link_prediction_head/evaluation/FEGIN/results/model_FEGIN_dataset_ltspice_examples
Command line input: python main.py --data ltspice_examples --representation component_net --model FEGIN --layers 2 --hiddens 128 --batch_size 32 --lr 0.0001 --emb_size 128 --epochs 100 --save_appendix component_net_L2_H128_BS32_LR0.0001_E128 --no_val
 is saved.
-----
ltspice_examples - FEGIN
Using 2 layers, 128 hidden units, h = 2
Loading component_net representation dataset
ENTERED
Training FEGIN on component_net representation
Train: 3558, Test: 846
##################ITERATION #0 ****************************************
 epoch: 0, train_loss: 1.3298, test_loss: 1.2615, test_f1: 0.2270
 epoch: 1, train_loss: 1.2373, test_loss: 1.1997, test_f1: 0.2783
 epoch: 2, train_loss: 1.1881, test_loss: 1.1257, test_f1: 0.3578
 epoch: 3, train_loss: 1.1303, test_loss: 1.0623, test_f1: 0.4044
 epoch: 4, train_loss: 1.0653, test_loss: 1.0128, test_f1: 0.4308
 epoch: 5, train_loss: 1.0243, test_loss: 0.9980, test_f1: 0.4560
 epoch: 6, train_loss: 0.9908, test_loss: 0.9713, test_f1: 0.4688
 epoch: 7, train_loss: 0.9719, test_loss: 0.9519, test_f1: 0.4910
 epoch: 8, train_loss: 0.9581, test_loss: 0.9365, test_f1: 0.4932
 epoch: 9, train_loss: 0.9516, test_loss: 0.9455, test_f1: 0.4929
 epoch: 10, train_loss: 0.9332, test_loss: 0.9355, test_f1: 0.4890
 epoch: 11, train_loss: 0.9299, test_loss: 0.9480, test_f1: 0.4730
 epoch: 12, train_loss: 0.9176, test_loss: 0.9000, test_f1: 0.5244
 epoch: 13, train_loss: 0.9048, test_loss: 0.9257, test_f1: 0.5228
 epoch: 14, train_loss: 0.9036, test_loss: 0.9193, test_f1: 0.5108
 epoch: 15, train_loss: 0.8957, test_loss: 0.9316, test_f1: 0.5094
 epoch: 16, train_loss: 0.8807, test_loss: 0.9196, test_f1: 0.5233
 epoch: 17, train_loss: 0.8771, test_loss: 0.9357, test_f1: 0.5212
 epoch: 18, train_loss: 0.8739, test_loss: 0.9311, test_f1: 0.5224
 epoch: 19, train_loss: 0.8711, test_loss: 0.9039, test_f1: 0.5305
 epoch: 20, train_loss: 0.8604, test_loss: 0.8997, test_f1: 0.5328
 epoch: 21, train_loss: 0.8607, test_loss: 0.8878, test_f1: 0.5313
 epoch: 22, train_loss: 0.8412, test_loss: 0.8855, test_f1: 0.5270
 epoch: 23, train_loss: 0.8408, test_loss: 0.9193, test_f1: 0.5264
 epoch: 24, train_loss: 0.8392, test_loss: 0.9100, test_f1: 0.5190
 epoch: 25, train_loss: 0.8392, test_loss: 0.8695, test_f1: 0.5361
 epoch: 26, train_loss: 0.8250, test_loss: 0.9124, test_f1: 0.5428
 epoch: 27, train_loss: 0.8244, test_loss: 0.8948, test_f1: 0.5330
 epoch: 28, train_loss: 0.8109, test_loss: 0.8826, test_f1: 0.5306
 epoch: 29, train_loss: 0.8132, test_loss: 0.9155, test_f1: 0.5188
 epoch: 30, train_loss: 0.8009, test_loss: 0.9236, test_f1: 0.5338
 epoch: 31, train_loss: 0.8024, test_loss: 0.9109, test_f1: 0.5451
 epoch: 32, train_loss: 0.8000, test_loss: 0.9220, test_f1: 0.5484
 epoch: 33, train_loss: 0.7963, test_loss: 0.9083, test_f1: 0.5278
 epoch: 34, train_loss: 0.8013, test_loss: 0.8969, test_f1: 0.5467
 epoch: 35, train_loss: 0.7771, test_loss: 0.9072, test_f1: 0.5478
 epoch: 36, train_loss: 0.7827, test_loss: 0.9125, test_f1: 0.5297
 epoch: 37, train_loss: 0.7777, test_loss: 0.9037, test_f1: 0.5628
 epoch: 38, train_loss: 0.7733, test_loss: 0.8955, test_f1: 0.5432
 epoch: 39, train_loss: 0.7758, test_loss: 0.9144, test_f1: 0.5773
 epoch: 40, train_loss: 0.7623, test_loss: 0.9186, test_f1: 0.5813
 epoch: 41, train_loss: 0.7629, test_loss: 0.9084, test_f1: 0.5505
 epoch: 42, train_loss: 0.7623, test_loss: 0.9325, test_f1: 0.5357
 epoch: 43, train_loss: 0.7576, test_loss: 0.8979, test_f1: 0.5770
 epoch: 44, train_loss: 0.7600, test_loss: 0.9512, test_f1: 0.5304
 epoch: 45, train_loss: 0.7458, test_loss: 0.9400, test_f1: 0.5560
 epoch: 46, train_loss: 0.7383, test_loss: 0.9240, test_f1: 0.5735
 epoch: 47, train_loss: 0.7434, test_loss: 0.9103, test_f1: 0.5967
 epoch: 48, train_loss: 0.7407, test_loss: 0.9247, test_f1: 0.5886
 epoch: 49, train_loss: 0.7326, test_loss: 0.9333, test_f1: 0.5752
 epoch: 50, train_loss: 0.7279, test_loss: 0.9273, test_f1: 0.5805
 epoch: 51, train_loss: 0.7148, test_loss: 0.9239, test_f1: 0.5991
 epoch: 52, train_loss: 0.7186, test_loss: 0.9390, test_f1: 0.5616
 epoch: 53, train_loss: 0.7185, test_loss: 0.9386, test_f1: 0.5942
 epoch: 54, train_loss: 0.6933, test_loss: 0.9231, test_f1: 0.6013
 epoch: 55, train_loss: 0.7112, test_loss: 0.9384, test_f1: 0.5809
 epoch: 56, train_loss: 0.7037, test_loss: 0.9360, test_f1: 0.5856
 epoch: 57, train_loss: 0.6998, test_loss: 0.9259, test_f1: 0.5998
 epoch: 58, train_loss: 0.6999, test_loss: 0.9580, test_f1: 0.5920
 epoch: 59, train_loss: 0.6993, test_loss: 0.9682, test_f1: 0.5863
 epoch: 60, train_loss: 0.7033, test_loss: 0.9407, test_f1: 0.6078
 epoch: 61, train_loss: 0.6913, test_loss: 0.9601, test_f1: 0.6046
 epoch: 62, train_loss: 0.6925, test_loss: 0.9513, test_f1: 0.5911
 epoch: 63, train_loss: 0.6915, test_loss: 0.9530, test_f1: 0.6003
 epoch: 64, train_loss: 0.6960, test_loss: 0.9359, test_f1: 0.6024
 epoch: 65, train_loss: 0.6922, test_loss: 0.9334, test_f1: 0.5986
 epoch: 66, train_loss: 0.6812, test_loss: 0.9576, test_f1: 0.5950
 epoch: 67, train_loss: 0.6813, test_loss: 0.9463, test_f1: 0.5861
 epoch: 68, train_loss: 0.6805, test_loss: 0.9834, test_f1: 0.5801
 epoch: 69, train_loss: 0.6900, test_loss: 0.9689, test_f1: 0.5844
 epoch: 70, train_loss: 0.6761, test_loss: 0.9614, test_f1: 0.6097
 epoch: 71, train_loss: 0.6804, test_loss: 0.9416, test_f1: 0.6200
 epoch: 72, train_loss: 0.6792, test_loss: 0.9383, test_f1: 0.6269
 epoch: 73, train_loss: 0.6772, test_loss: 0.9799, test_f1: 0.6143
 epoch: 74, train_loss: 0.6716, test_loss: 0.9366, test_f1: 0.6159
 epoch: 75, train_loss: 0.6674, test_loss: 0.9830, test_f1: 0.6111
 epoch: 76, train_loss: 0.6680, test_loss: 0.9533, test_f1: 0.6191
 epoch: 77, train_loss: 0.6753, test_loss: 0.9616, test_f1: 0.6073
 epoch: 78, train_loss: 0.6719, test_loss: 0.9782, test_f1: 0.5957
 epoch: 79, train_loss: 0.6679, test_loss: 0.9738, test_f1: 0.5988
 epoch: 80, train_loss: 0.6680, test_loss: 0.9516, test_f1: 0.6263
 epoch: 81, train_loss: 0.6523, test_loss: 0.9628, test_f1: 0.6138
 epoch: 82, train_loss: 0.6682, test_loss: 0.9777, test_f1: 0.6079
 epoch: 83, train_loss: 0.6483, test_loss: 0.9364, test_f1: 0.6149
 epoch: 84, train_loss: 0.6573, test_loss: 0.9520, test_f1: 0.6186
 epoch: 85, train_loss: 0.6567, test_loss: 0.9583, test_f1: 0.6172
 epoch: 86, train_loss: 0.6597, test_loss: 0.9618, test_f1: 0.6068
 epoch: 87, train_loss: 0.6582, test_loss: 0.9792, test_f1: 0.6181
 epoch: 88, train_loss: 0.6479, test_loss: 0.9765, test_f1: 0.6114
 epoch: 89, train_loss: 0.6379, test_loss: 0.9567, test_f1: 0.6253
 epoch: 90, train_loss: 0.6511, test_loss: 0.9753, test_f1: 0.6350
 epoch: 91, train_loss: 0.6424, test_loss: 0.9467, test_f1: 0.6458
 epoch: 92, train_loss: 0.6377, test_loss: 0.9592, test_f1: 0.6356
 epoch: 93, train_loss: 0.6401, test_loss: 1.0003, test_f1: 0.6078
 epoch: 94, train_loss: 0.6343, test_loss: 1.0050, test_f1: 0.6148
 epoch: 95, train_loss: 0.6362, test_loss: 0.9844, test_f1: 0.6234
 epoch: 96, train_loss: 0.6535, test_loss: 0.9899, test_f1: 0.6230
 epoch: 97, train_loss: 0.6367, test_loss: 0.9801, test_f1: 0.6319
 epoch: 98, train_loss: 0.6129, test_loss: 0.9751, test_f1: 0.6246
 epoch: 99, train_loss: 0.6301, test_loss: 0.9992, test_f1: 0.6284
##################ITERATION #1 ****************************************
 epoch: 0, train_loss: 1.2274, test_loss: 1.1110, test_f1: 0.3776
 epoch: 1, train_loss: 1.1084, test_loss: 1.0331, test_f1: 0.4480
 epoch: 2, train_loss: 1.0497, test_loss: 0.9839, test_f1: 0.4660
 epoch: 3, train_loss: 1.0085, test_loss: 0.9561, test_f1: 0.4751
 epoch: 4, train_loss: 0.9840, test_loss: 0.9396, test_f1: 0.5011
 epoch: 5, train_loss: 0.9586, test_loss: 0.9281, test_f1: 0.4956
 epoch: 6, train_loss: 0.9407, test_loss: 0.9211, test_f1: 0.5182
 epoch: 7, train_loss: 0.9234, test_loss: 0.9126, test_f1: 0.5348
 epoch: 8, train_loss: 0.9154, test_loss: 0.9084, test_f1: 0.5317
 epoch: 9, train_loss: 0.9012, test_loss: 0.8904, test_f1: 0.5264
 epoch: 10, train_loss: 0.8871, test_loss: 0.8849, test_f1: 0.5386
 epoch: 11, train_loss: 0.8863, test_loss: 0.8728, test_f1: 0.5524
 epoch: 12, train_loss: 0.8751, test_loss: 0.8588, test_f1: 0.5533
 epoch: 13, train_loss: 0.8571, test_loss: 0.8801, test_f1: 0.5549
 epoch: 14, train_loss: 0.8582, test_loss: 0.8619, test_f1: 0.5445
 epoch: 15, train_loss: 0.8472, test_loss: 0.9042, test_f1: 0.5456
 epoch: 16, train_loss: 0.8418, test_loss: 0.8893, test_f1: 0.5508
 epoch: 17, train_loss: 0.8325, test_loss: 0.8658, test_f1: 0.5729
 epoch: 18, train_loss: 0.8275, test_loss: 0.8827, test_f1: 0.5675
 epoch: 19, train_loss: 0.8108, test_loss: 0.8572, test_f1: 0.5693
 epoch: 20, train_loss: 0.8008, test_loss: 0.8915, test_f1: 0.5624
 epoch: 21, train_loss: 0.8045, test_loss: 0.8553, test_f1: 0.6000
 epoch: 22, train_loss: 0.8088, test_loss: 0.8823, test_f1: 0.5778
 epoch: 23, train_loss: 0.7900, test_loss: 0.8565, test_f1: 0.5674
 epoch: 24, train_loss: 0.7904, test_loss: 0.8732, test_f1: 0.5793
 epoch: 25, train_loss: 0.7805, test_loss: 0.8583, test_f1: 0.5785
 epoch: 26, train_loss: 0.7798, test_loss: 0.8662, test_f1: 0.5996
 epoch: 27, train_loss: 0.7768, test_loss: 0.8789, test_f1: 0.5862
 epoch: 28, train_loss: 0.7723, test_loss: 0.8673, test_f1: 0.5906
 epoch: 29, train_loss: 0.7738, test_loss: 0.8736, test_f1: 0.6013
 epoch: 30, train_loss: 0.7565, test_loss: 0.8785, test_f1: 0.5826
 epoch: 31, train_loss: 0.7475, test_loss: 0.8792, test_f1: 0.5953
 epoch: 32, train_loss: 0.7613, test_loss: 0.8954, test_f1: 0.5920
 epoch: 33, train_loss: 0.7545, test_loss: 0.8741, test_f1: 0.6146
 epoch: 34, train_loss: 0.7397, test_loss: 0.9078, test_f1: 0.6131
 epoch: 35, train_loss: 0.7460, test_loss: 0.9178, test_f1: 0.6194
 epoch: 36, train_loss: 0.7445, test_loss: 0.8791, test_f1: 0.6299
 epoch: 37, train_loss: 0.7282, test_loss: 0.8786, test_f1: 0.6101
 epoch: 38, train_loss: 0.7231, test_loss: 0.8955, test_f1: 0.6121
 epoch: 39, train_loss: 0.7146, test_loss: 0.8890, test_f1: 0.6193
 epoch: 40, train_loss: 0.7099, test_loss: 0.8752, test_f1: 0.6154
 epoch: 41, train_loss: 0.7042, test_loss: 0.9202, test_f1: 0.6225
 epoch: 42, train_loss: 0.7007, test_loss: 0.8832, test_f1: 0.6177
 epoch: 43, train_loss: 0.6983, test_loss: 0.8816, test_f1: 0.6113
 epoch: 44, train_loss: 0.7094, test_loss: 0.8635, test_f1: 0.6332
 epoch: 45, train_loss: 0.6969, test_loss: 0.8772, test_f1: 0.6523
 epoch: 46, train_loss: 0.6837, test_loss: 0.8849, test_f1: 0.6498
 epoch: 47, train_loss: 0.6957, test_loss: 0.8879, test_f1: 0.6314
 epoch: 48, train_loss: 0.6970, test_loss: 0.9082, test_f1: 0.6237
 epoch: 49, train_loss: 0.6875, test_loss: 0.9073, test_f1: 0.6344
 epoch: 50, train_loss: 0.6678, test_loss: 0.9061, test_f1: 0.6211
 epoch: 51, train_loss: 0.6735, test_loss: 0.9126, test_f1: 0.6297
 epoch: 52, train_loss: 0.6570, test_loss: 0.9101, test_f1: 0.6524
 epoch: 53, train_loss: 0.6538, test_loss: 0.9030, test_f1: 0.6348
 epoch: 54, train_loss: 0.6561, test_loss: 0.9453, test_f1: 0.6434
 epoch: 55, train_loss: 0.6609, test_loss: 0.9209, test_f1: 0.6293
 epoch: 56, train_loss: 0.6615, test_loss: 0.9237, test_f1: 0.6384
 epoch: 57, train_loss: 0.6540, test_loss: 0.9250, test_f1: 0.6278
 epoch: 58, train_loss: 0.6554, test_loss: 0.9084, test_f1: 0.6478
 epoch: 59, train_loss: 0.6470, test_loss: 0.9190, test_f1: 0.6552
 epoch: 60, train_loss: 0.6525, test_loss: 0.9043, test_f1: 0.6582
 epoch: 61, train_loss: 0.6461, test_loss: 0.9381, test_f1: 0.6282
 epoch: 62, train_loss: 0.6443, test_loss: 0.9535, test_f1: 0.6171
 epoch: 63, train_loss: 0.6404, test_loss: 0.9067, test_f1: 0.6315
 epoch: 64, train_loss: 0.6443, test_loss: 0.9169, test_f1: 0.6391
 epoch: 65, train_loss: 0.6368, test_loss: 0.9165, test_f1: 0.6365
 epoch: 66, train_loss: 0.6385, test_loss: 0.9246, test_f1: 0.6374
 epoch: 67, train_loss: 0.6450, test_loss: 0.9102, test_f1: 0.6357
 epoch: 68, train_loss: 0.6290, test_loss: 0.9378, test_f1: 0.6317
 epoch: 69, train_loss: 0.6211, test_loss: 0.9104, test_f1: 0.6385
 epoch: 70, train_loss: 0.6306, test_loss: 0.9087, test_f1: 0.6560
 epoch: 71, train_loss: 0.6127, test_loss: 0.9427, test_f1: 0.6587
 epoch: 72, train_loss: 0.6130, test_loss: 0.9230, test_f1: 0.6589
 epoch: 73, train_loss: 0.6135, test_loss: 0.9145, test_f1: 0.6683
 epoch: 74, train_loss: 0.6183, test_loss: 0.9204, test_f1: 0.6673
 epoch: 75, train_loss: 0.6161, test_loss: 0.9453, test_f1: 0.6408
 epoch: 76, train_loss: 0.6116, test_loss: 0.9354, test_f1: 0.6686
 epoch: 77, train_loss: 0.6140, test_loss: 0.9438, test_f1: 0.6688
 epoch: 78, train_loss: 0.6158, test_loss: 0.9592, test_f1: 0.6495
 epoch: 79, train_loss: 0.6111, test_loss: 0.9289, test_f1: 0.6454
 epoch: 80, train_loss: 0.6060, test_loss: 0.9640, test_f1: 0.6448
 epoch: 81, train_loss: 0.6106, test_loss: 0.9622, test_f1: 0.6437
 epoch: 82, train_loss: 0.6170, test_loss: 0.9486, test_f1: 0.6446
 epoch: 83, train_loss: 0.6132, test_loss: 0.9727, test_f1: 0.6407
 epoch: 84, train_loss: 0.5954, test_loss: 0.9278, test_f1: 0.6501
 epoch: 85, train_loss: 0.5969, test_loss: 0.9597, test_f1: 0.6498
 epoch: 86, train_loss: 0.6026, test_loss: 1.0031, test_f1: 0.6390
 epoch: 87, train_loss: 0.6041, test_loss: 0.9679, test_f1: 0.6638
 epoch: 88, train_loss: 0.6088, test_loss: 0.9365, test_f1: 0.6586
 epoch: 89, train_loss: 0.6022, test_loss: 0.9573, test_f1: 0.6376
 epoch: 90, train_loss: 0.5954, test_loss: 0.9837, test_f1: 0.6415
 epoch: 91, train_loss: 0.5934, test_loss: 0.9595, test_f1: 0.6606
 epoch: 92, train_loss: 0.5945, test_loss: 0.9543, test_f1: 0.6430
 epoch: 93, train_loss: 0.5966, test_loss: 0.9800, test_f1: 0.6535
 epoch: 94, train_loss: 0.5874, test_loss: 0.9928, test_f1: 0.6475
 epoch: 95, train_loss: 0.5826, test_loss: 0.9716, test_f1: 0.6559
 epoch: 96, train_loss: 0.5902, test_loss: 0.9629, test_f1: 0.6416
 epoch: 97, train_loss: 0.5864, test_loss: 0.9634, test_f1: 0.6507
 epoch: 98, train_loss: 0.5754, test_loss: 0.9698, test_f1: 0.6660
 epoch: 99, train_loss: 0.5718, test_loss: 0.9568, test_f1: 0.6687
##################ITERATION #2 ****************************************
 epoch: 0, train_loss: 1.2009, test_loss: 1.0470, test_f1: 0.4773
 epoch: 1, train_loss: 1.0701, test_loss: 0.9949, test_f1: 0.4717
 epoch: 2, train_loss: 1.0313, test_loss: 0.9695, test_f1: 0.4734
 epoch: 3, train_loss: 0.9899, test_loss: 0.9599, test_f1: 0.4728
 epoch: 4, train_loss: 0.9733, test_loss: 0.9306, test_f1: 0.5086
 epoch: 5, train_loss: 0.9570, test_loss: 0.9232, test_f1: 0.5218
 epoch: 6, train_loss: 0.9409, test_loss: 0.9114, test_f1: 0.5296
 epoch: 7, train_loss: 0.9365, test_loss: 0.9148, test_f1: 0.5181
 epoch: 8, train_loss: 0.9231, test_loss: 0.9011, test_f1: 0.5270
 epoch: 9, train_loss: 0.9104, test_loss: 0.8984, test_f1: 0.5436
 epoch: 10, train_loss: 0.8977, test_loss: 0.8834, test_f1: 0.5569
 epoch: 11, train_loss: 0.8929, test_loss: 0.8760, test_f1: 0.5764
 epoch: 12, train_loss: 0.8803, test_loss: 0.8811, test_f1: 0.5410
 epoch: 13, train_loss: 0.8705, test_loss: 0.8727, test_f1: 0.5548
 epoch: 14, train_loss: 0.8667, test_loss: 0.8668, test_f1: 0.5753
 epoch: 15, train_loss: 0.8532, test_loss: 0.9045, test_f1: 0.5604
 epoch: 16, train_loss: 0.8432, test_loss: 0.8901, test_f1: 0.5694
 epoch: 17, train_loss: 0.8304, test_loss: 0.8975, test_f1: 0.5678
 epoch: 18, train_loss: 0.8307, test_loss: 0.8600, test_f1: 0.5801
 epoch: 19, train_loss: 0.8249, test_loss: 0.9084, test_f1: 0.5677
 epoch: 20, train_loss: 0.8098, test_loss: 0.8569, test_f1: 0.5612
 epoch: 21, train_loss: 0.8008, test_loss: 0.8698, test_f1: 0.5583
 epoch: 22, train_loss: 0.8047, test_loss: 0.9021, test_f1: 0.5506
 epoch: 23, train_loss: 0.7971, test_loss: 0.8691, test_f1: 0.5630
 epoch: 24, train_loss: 0.7918, test_loss: 0.9030, test_f1: 0.5538
 epoch: 25, train_loss: 0.7810, test_loss: 0.9208, test_f1: 0.5890
 epoch: 26, train_loss: 0.7888, test_loss: 0.8883, test_f1: 0.5759
 epoch: 27, train_loss: 0.7734, test_loss: 0.8736, test_f1: 0.5839
 epoch: 28, train_loss: 0.7714, test_loss: 0.8932, test_f1: 0.5675
 epoch: 29, train_loss: 0.7681, test_loss: 0.8664, test_f1: 0.6007
 epoch: 30, train_loss: 0.7661, test_loss: 0.8941, test_f1: 0.5808
 epoch: 31, train_loss: 0.7587, test_loss: 0.9259, test_f1: 0.5779
 epoch: 32, train_loss: 0.7550, test_loss: 0.8920, test_f1: 0.6048
 epoch: 33, train_loss: 0.7362, test_loss: 0.8957, test_f1: 0.5745
 epoch: 34, train_loss: 0.7407, test_loss: 0.9042, test_f1: 0.5914
 epoch: 35, train_loss: 0.7382, test_loss: 0.9474, test_f1: 0.5951
 epoch: 36, train_loss: 0.7431, test_loss: 0.8969, test_f1: 0.6080
 epoch: 37, train_loss: 0.7296, test_loss: 0.8982, test_f1: 0.6071
 epoch: 38, train_loss: 0.7363, test_loss: 0.9214, test_f1: 0.5995
 epoch: 39, train_loss: 0.7286, test_loss: 0.8955, test_f1: 0.5541
 epoch: 40, train_loss: 0.7227, test_loss: 0.9232, test_f1: 0.5888
 epoch: 41, train_loss: 0.7189, test_loss: 0.8908, test_f1: 0.6085
 epoch: 42, train_loss: 0.7062, test_loss: 0.9208, test_f1: 0.6009
 epoch: 43, train_loss: 0.7042, test_loss: 0.9199, test_f1: 0.6373
 epoch: 44, train_loss: 0.7062, test_loss: 0.9231, test_f1: 0.6051
 epoch: 45, train_loss: 0.7004, test_loss: 0.9607, test_f1: 0.6085
 epoch: 46, train_loss: 0.6944, test_loss: 0.9304, test_f1: 0.6040
 epoch: 47, train_loss: 0.6903, test_loss: 0.9276, test_f1: 0.6170
 epoch: 48, train_loss: 0.6892, test_loss: 0.9347, test_f1: 0.6158
 epoch: 49, train_loss: 0.6801, test_loss: 0.9223, test_f1: 0.6205
 epoch: 50, train_loss: 0.6793, test_loss: 0.9519, test_f1: 0.6100
 epoch: 51, train_loss: 0.6666, test_loss: 0.9204, test_f1: 0.6322
 epoch: 52, train_loss: 0.6583, test_loss: 0.9450, test_f1: 0.5931
 epoch: 53, train_loss: 0.6649, test_loss: 0.9507, test_f1: 0.6271
 epoch: 54, train_loss: 0.6457, test_loss: 0.9182, test_f1: 0.6235
 epoch: 55, train_loss: 0.6424, test_loss: 0.9518, test_f1: 0.6322
 epoch: 56, train_loss: 0.6431, test_loss: 0.9444, test_f1: 0.6471
 epoch: 57, train_loss: 0.6497, test_loss: 0.9398, test_f1: 0.6615
 epoch: 58, train_loss: 0.6454, test_loss: 0.9457, test_f1: 0.6343
 epoch: 59, train_loss: 0.6543, test_loss: 0.9429, test_f1: 0.6379
 epoch: 60, train_loss: 0.6332, test_loss: 0.9613, test_f1: 0.6371
 epoch: 61, train_loss: 0.6433, test_loss: 0.9409, test_f1: 0.6264
 epoch: 62, train_loss: 0.6322, test_loss: 0.9688, test_f1: 0.6448
 epoch: 63, train_loss: 0.6396, test_loss: 0.9837, test_f1: 0.6317
 epoch: 64, train_loss: 0.6405, test_loss: 0.9391, test_f1: 0.6526
 epoch: 65, train_loss: 0.6268, test_loss: 0.9754, test_f1: 0.6411
 epoch: 66, train_loss: 0.6210, test_loss: 0.9867, test_f1: 0.6336
 epoch: 67, train_loss: 0.6312, test_loss: 0.9583, test_f1: 0.6447
 epoch: 68, train_loss: 0.6253, test_loss: 0.9590, test_f1: 0.6489
 epoch: 69, train_loss: 0.6350, test_loss: 0.9650, test_f1: 0.6322
 epoch: 70, train_loss: 0.6175, test_loss: 0.9483, test_f1: 0.6437
 epoch: 71, train_loss: 0.6136, test_loss: 0.9564, test_f1: 0.6325
 epoch: 72, train_loss: 0.6189, test_loss: 0.9623, test_f1: 0.6164
 epoch: 73, train_loss: 0.6168, test_loss: 0.9657, test_f1: 0.6402
 epoch: 74, train_loss: 0.6196, test_loss: 0.9850, test_f1: 0.6725
 epoch: 75, train_loss: 0.6241, test_loss: 0.9615, test_f1: 0.6470
 epoch: 76, train_loss: 0.6098, test_loss: 0.9393, test_f1: 0.6304
 epoch: 77, train_loss: 0.6124, test_loss: 0.9578, test_f1: 0.6320
 epoch: 78, train_loss: 0.6066, test_loss: 0.9511, test_f1: 0.6622
 epoch: 79, train_loss: 0.6129, test_loss: 0.9604, test_f1: 0.6623
 epoch: 80, train_loss: 0.6006, test_loss: 0.9927, test_f1: 0.6395
 epoch: 81, train_loss: 0.6097, test_loss: 0.9807, test_f1: 0.6454
 epoch: 82, train_loss: 0.6056, test_loss: 0.9646, test_f1: 0.6508
 epoch: 83, train_loss: 0.6037, test_loss: 0.9604, test_f1: 0.6477
 epoch: 84, train_loss: 0.5882, test_loss: 0.9451, test_f1: 0.6583
 epoch: 85, train_loss: 0.5988, test_loss: 0.9720, test_f1: 0.6394
 epoch: 86, train_loss: 0.5844, test_loss: 0.9928, test_f1: 0.6558
 epoch: 87, train_loss: 0.5881, test_loss: 0.9673, test_f1: 0.6616
 epoch: 88, train_loss: 0.5906, test_loss: 0.9816, test_f1: 0.6483
 epoch: 89, train_loss: 0.5864, test_loss: 1.0046, test_f1: 0.6361
 epoch: 90, train_loss: 0.5876, test_loss: 0.9707, test_f1: 0.6668
 epoch: 91, train_loss: 0.5847, test_loss: 1.0035, test_f1: 0.6533
 epoch: 92, train_loss: 0.5836, test_loss: 0.9981, test_f1: 0.6331
 epoch: 93, train_loss: 0.5863, test_loss: 0.9951, test_f1: 0.6533
 epoch: 94, train_loss: 0.5795, test_loss: 1.0259, test_f1: 0.6417
 epoch: 95, train_loss: 0.5706, test_loss: 0.9941, test_f1: 0.6595
 epoch: 96, train_loss: 0.5790, test_loss: 1.0210, test_f1: 0.6362
 epoch: 97, train_loss: 0.5874, test_loss: 1.0322, test_f1: 0.6550
 epoch: 98, train_loss: 0.5639, test_loss: 1.0280, test_f1: 0.6568
 epoch: 99, train_loss: 0.5699, test_loss: 1.0074, test_f1: 0.6663
##################ITERATION #3 ****************************************
 epoch: 0, train_loss: 1.1903, test_loss: 1.0316, test_f1: 0.4904
 epoch: 1, train_loss: 1.0667, test_loss: 0.9905, test_f1: 0.4825
 epoch: 2, train_loss: 1.0364, test_loss: 0.9707, test_f1: 0.4883
 epoch: 3, train_loss: 0.9984, test_loss: 0.9546, test_f1: 0.5354
 epoch: 4, train_loss: 0.9794, test_loss: 0.9419, test_f1: 0.5114
 epoch: 5, train_loss: 0.9633, test_loss: 0.9383, test_f1: 0.5088
 epoch: 6, train_loss: 0.9430, test_loss: 0.9307, test_f1: 0.5207
 epoch: 7, train_loss: 0.9262, test_loss: 0.9266, test_f1: 0.5265
 epoch: 8, train_loss: 0.9201, test_loss: 0.9100, test_f1: 0.5327
 epoch: 9, train_loss: 0.9107, test_loss: 0.9036, test_f1: 0.5280
 epoch: 10, train_loss: 0.8884, test_loss: 0.9125, test_f1: 0.5753
 epoch: 11, train_loss: 0.8904, test_loss: 0.9070, test_f1: 0.5387
 epoch: 12, train_loss: 0.8819, test_loss: 0.8855, test_f1: 0.5589
 epoch: 13, train_loss: 0.8647, test_loss: 0.8995, test_f1: 0.5545
 epoch: 14, train_loss: 0.8547, test_loss: 0.8957, test_f1: 0.5455
 epoch: 15, train_loss: 0.8518, test_loss: 0.8848, test_f1: 0.5562
 epoch: 16, train_loss: 0.8513, test_loss: 0.8742, test_f1: 0.5585
 epoch: 17, train_loss: 0.8323, test_loss: 0.8629, test_f1: 0.5424
 epoch: 18, train_loss: 0.8255, test_loss: 0.8926, test_f1: 0.5563
 epoch: 19, train_loss: 0.8300, test_loss: 0.8544, test_f1: 0.5701
 epoch: 20, train_loss: 0.8223, test_loss: 0.8962, test_f1: 0.5576
 epoch: 21, train_loss: 0.8113, test_loss: 0.8768, test_f1: 0.5811
 epoch: 22, train_loss: 0.8089, test_loss: 0.8958, test_f1: 0.5579
 epoch: 23, train_loss: 0.7959, test_loss: 0.8965, test_f1: 0.5729
 epoch: 24, train_loss: 0.7929, test_loss: 0.8781, test_f1: 0.5960
 epoch: 25, train_loss: 0.7913, test_loss: 0.8741, test_f1: 0.6040
 epoch: 26, train_loss: 0.7888, test_loss: 0.9029, test_f1: 0.5784
 epoch: 27, train_loss: 0.7842, test_loss: 0.8996, test_f1: 0.5783
 epoch: 28, train_loss: 0.7772, test_loss: 0.8884, test_f1: 0.5703
 epoch: 29, train_loss: 0.7714, test_loss: 0.8929, test_f1: 0.5994
 epoch: 30, train_loss: 0.7758, test_loss: 0.8988, test_f1: 0.6012
 epoch: 31, train_loss: 0.7579, test_loss: 0.8661, test_f1: 0.5807
 epoch: 32, train_loss: 0.7639, test_loss: 0.9153, test_f1: 0.6031
 epoch: 33, train_loss: 0.7615, test_loss: 0.9090, test_f1: 0.6190
 epoch: 34, train_loss: 0.7491, test_loss: 0.8994, test_f1: 0.5863
 epoch: 35, train_loss: 0.7502, test_loss: 0.8895, test_f1: 0.6041
 epoch: 36, train_loss: 0.7571, test_loss: 0.9005, test_f1: 0.6079
 epoch: 37, train_loss: 0.7450, test_loss: 0.8689, test_f1: 0.6169
 epoch: 38, train_loss: 0.7306, test_loss: 0.9004, test_f1: 0.6116
 epoch: 39, train_loss: 0.7246, test_loss: 0.8717, test_f1: 0.6245
 epoch: 40, train_loss: 0.7291, test_loss: 0.8979, test_f1: 0.6089
 epoch: 41, train_loss: 0.7252, test_loss: 0.9312, test_f1: 0.5881
 epoch: 42, train_loss: 0.7332, test_loss: 0.9042, test_f1: 0.6274
 epoch: 43, train_loss: 0.7286, test_loss: 0.9006, test_f1: 0.6424
 epoch: 44, train_loss: 0.7232, test_loss: 0.8945, test_f1: 0.6078
 epoch: 45, train_loss: 0.7107, test_loss: 0.9122, test_f1: 0.6197
 epoch: 46, train_loss: 0.6970, test_loss: 0.8875, test_f1: 0.6491
 epoch: 47, train_loss: 0.7146, test_loss: 0.9259, test_f1: 0.6131
 epoch: 48, train_loss: 0.7045, test_loss: 0.9141, test_f1: 0.6204
 epoch: 49, train_loss: 0.7056, test_loss: 0.9133, test_f1: 0.6322
 epoch: 50, train_loss: 0.6961, test_loss: 0.8913, test_f1: 0.6242
 epoch: 51, train_loss: 0.6829, test_loss: 0.8977, test_f1: 0.6360
 epoch: 52, train_loss: 0.6859, test_loss: 0.9084, test_f1: 0.6281
 epoch: 53, train_loss: 0.6760, test_loss: 0.9119, test_f1: 0.6334
 epoch: 54, train_loss: 0.6851, test_loss: 0.9406, test_f1: 0.6274
 epoch: 55, train_loss: 0.6703, test_loss: 0.9067, test_f1: 0.6389
 epoch: 56, train_loss: 0.6642, test_loss: 0.9217, test_f1: 0.6315
 epoch: 57, train_loss: 0.6730, test_loss: 0.9269, test_f1: 0.6354
 epoch: 58, train_loss: 0.6560, test_loss: 0.8900, test_f1: 0.6434
 epoch: 59, train_loss: 0.6706, test_loss: 0.9207, test_f1: 0.6524
 epoch: 60, train_loss: 0.6658, test_loss: 0.9143, test_f1: 0.6337
 epoch: 61, train_loss: 0.6628, test_loss: 0.9102, test_f1: 0.6369
 epoch: 62, train_loss: 0.6574, test_loss: 0.8909, test_f1: 0.6502
 epoch: 63, train_loss: 0.6537, test_loss: 0.9107, test_f1: 0.6272
 epoch: 64, train_loss: 0.6478, test_loss: 0.9009, test_f1: 0.6348
 epoch: 65, train_loss: 0.6606, test_loss: 0.9236, test_f1: 0.6262
 epoch: 66, train_loss: 0.6551, test_loss: 0.9213, test_f1: 0.6476
 epoch: 67, train_loss: 0.6471, test_loss: 0.9053, test_f1: 0.6343
 epoch: 68, train_loss: 0.6514, test_loss: 0.9068, test_f1: 0.6496
 epoch: 69, train_loss: 0.6361, test_loss: 0.9142, test_f1: 0.6561
 epoch: 70, train_loss: 0.6421, test_loss: 0.9151, test_f1: 0.6422
 epoch: 71, train_loss: 0.6360, test_loss: 0.9286, test_f1: 0.6316
 epoch: 72, train_loss: 0.6306, test_loss: 0.9264, test_f1: 0.6549
 epoch: 73, train_loss: 0.6407, test_loss: 0.9199, test_f1: 0.6743
 epoch: 74, train_loss: 0.6396, test_loss: 0.9378, test_f1: 0.6675
 epoch: 75, train_loss: 0.6301, test_loss: 0.9460, test_f1: 0.6445
 epoch: 76, train_loss: 0.6396, test_loss: 0.9354, test_f1: 0.6423
 epoch: 77, train_loss: 0.6160, test_loss: 0.9283, test_f1: 0.6453
 epoch: 78, train_loss: 0.6224, test_loss: 0.9144, test_f1: 0.6451
 epoch: 79, train_loss: 0.6400, test_loss: 0.9229, test_f1: 0.6652
 epoch: 80, train_loss: 0.6256, test_loss: 0.9469, test_f1: 0.6636
 epoch: 81, train_loss: 0.6268, test_loss: 0.9494, test_f1: 0.6447
 epoch: 82, train_loss: 0.6160, test_loss: 0.9393, test_f1: 0.6249
 epoch: 83, train_loss: 0.6222, test_loss: 0.9178, test_f1: 0.6712
 epoch: 84, train_loss: 0.6209, test_loss: 0.9469, test_f1: 0.6568
 epoch: 85, train_loss: 0.6167, test_loss: 0.9571, test_f1: 0.6495
 epoch: 86, train_loss: 0.6178, test_loss: 0.9466, test_f1: 0.6486
 epoch: 87, train_loss: 0.6136, test_loss: 0.9323, test_f1: 0.6641
 epoch: 88, train_loss: 0.6079, test_loss: 0.9397, test_f1: 0.6447
 epoch: 89, train_loss: 0.6186, test_loss: 0.9204, test_f1: 0.6598
 epoch: 90, train_loss: 0.6048, test_loss: 0.9420, test_f1: 0.6461
 epoch: 91, train_loss: 0.6141, test_loss: 0.9486, test_f1: 0.6560
 epoch: 92, train_loss: 0.6105, test_loss: 0.9801, test_f1: 0.6380
 epoch: 93, train_loss: 0.6077, test_loss: 0.9141, test_f1: 0.6697
 epoch: 94, train_loss: 0.6045, test_loss: 0.9648, test_f1: 0.6825
 epoch: 95, train_loss: 0.6036, test_loss: 0.9868, test_f1: 0.6388
 epoch: 96, train_loss: 0.6058, test_loss: 0.9923, test_f1: 0.6501
 epoch: 97, train_loss: 0.5998, test_loss: 0.9519, test_f1: 0.6570
 epoch: 98, train_loss: 0.6011, test_loss: 0.9522, test_f1: 0.6684
 epoch: 99, train_loss: 0.5899, test_loss: 0.9548, test_f1: 0.6628
##################ITERATION #4 ****************************************
 epoch: 0, train_loss: 1.2103, test_loss: 1.0262, test_f1: 0.4648
 epoch: 1, train_loss: 1.0630, test_loss: 0.9757, test_f1: 0.5007
 epoch: 2, train_loss: 1.0181, test_loss: 0.9470, test_f1: 0.4953
 epoch: 3, train_loss: 1.0007, test_loss: 0.9418, test_f1: 0.4925
 epoch: 4, train_loss: 0.9701, test_loss: 0.9325, test_f1: 0.5234
 epoch: 5, train_loss: 0.9547, test_loss: 0.9240, test_f1: 0.5005
 epoch: 6, train_loss: 0.9482, test_loss: 0.9147, test_f1: 0.5155
 epoch: 7, train_loss: 0.9314, test_loss: 0.9004, test_f1: 0.5173
 epoch: 8, train_loss: 0.9113, test_loss: 0.9105, test_f1: 0.5300
 epoch: 9, train_loss: 0.9064, test_loss: 0.8710, test_f1: 0.5523
 epoch: 10, train_loss: 0.9026, test_loss: 0.8695, test_f1: 0.5399
 epoch: 11, train_loss: 0.8833, test_loss: 0.8696, test_f1: 0.5384
 epoch: 12, train_loss: 0.8856, test_loss: 0.8610, test_f1: 0.5355
 epoch: 13, train_loss: 0.8663, test_loss: 0.8873, test_f1: 0.5295
 epoch: 14, train_loss: 0.8665, test_loss: 0.8731, test_f1: 0.5289
 epoch: 15, train_loss: 0.8609, test_loss: 0.8830, test_f1: 0.5432
 epoch: 16, train_loss: 0.8604, test_loss: 0.8538, test_f1: 0.5386
 epoch: 17, train_loss: 0.8357, test_loss: 0.8410, test_f1: 0.5413
 epoch: 18, train_loss: 0.8466, test_loss: 0.8351, test_f1: 0.5529
 epoch: 19, train_loss: 0.8286, test_loss: 0.8593, test_f1: 0.5581
 epoch: 20, train_loss: 0.8318, test_loss: 0.8600, test_f1: 0.5672
 epoch: 21, train_loss: 0.8245, test_loss: 0.8840, test_f1: 0.5545
 epoch: 22, train_loss: 0.8126, test_loss: 0.8627, test_f1: 0.5539
 epoch: 23, train_loss: 0.8150, test_loss: 0.8284, test_f1: 0.5715
 epoch: 24, train_loss: 0.7892, test_loss: 0.8191, test_f1: 0.5571
 epoch: 25, train_loss: 0.7932, test_loss: 0.8078, test_f1: 0.5742
 epoch: 26, train_loss: 0.7982, test_loss: 0.7864, test_f1: 0.5917
 epoch: 27, train_loss: 0.7890, test_loss: 0.8217, test_f1: 0.5918
 epoch: 28, train_loss: 0.7743, test_loss: 0.7855, test_f1: 0.5747
 epoch: 29, train_loss: 0.7750, test_loss: 0.8283, test_f1: 0.5765
 epoch: 30, train_loss: 0.7726, test_loss: 0.8434, test_f1: 0.5886
 epoch: 31, train_loss: 0.7755, test_loss: 0.8332, test_f1: 0.6037
 epoch: 32, train_loss: 0.7669, test_loss: 0.8650, test_f1: 0.5789
 epoch: 33, train_loss: 0.7529, test_loss: 0.8435, test_f1: 0.5918
 epoch: 34, train_loss: 0.7544, test_loss: 0.8879, test_f1: 0.6132
 epoch: 35, train_loss: 0.7452, test_loss: 0.8552, test_f1: 0.5799
 epoch: 36, train_loss: 0.7479, test_loss: 0.8275, test_f1: 0.5880
 epoch: 37, train_loss: 0.7420, test_loss: 0.8808, test_f1: 0.5813
 epoch: 38, train_loss: 0.7269, test_loss: 0.8602, test_f1: 0.6390
 epoch: 39, train_loss: 0.7325, test_loss: 0.8775, test_f1: 0.5747
 epoch: 40, train_loss: 0.7343, test_loss: 0.8736, test_f1: 0.6290
 epoch: 41, train_loss: 0.7239, test_loss: 0.8380, test_f1: 0.6449
 epoch: 42, train_loss: 0.7180, test_loss: 0.8585, test_f1: 0.5976
 epoch: 43, train_loss: 0.7071, test_loss: 0.8744, test_f1: 0.6059
 epoch: 44, train_loss: 0.7202, test_loss: 0.8785, test_f1: 0.6022
 epoch: 45, train_loss: 0.7109, test_loss: 0.9338, test_f1: 0.6214
 epoch: 46, train_loss: 0.7062, test_loss: 0.8657, test_f1: 0.6038
 epoch: 47, train_loss: 0.6956, test_loss: 0.8853, test_f1: 0.6035
 epoch: 48, train_loss: 0.7006, test_loss: 0.8027, test_f1: 0.6147
 epoch: 49, train_loss: 0.6983, test_loss: 0.8723, test_f1: 0.6439
 epoch: 50, train_loss: 0.6842, test_loss: 0.8505, test_f1: 0.6230
 epoch: 51, train_loss: 0.6733, test_loss: 0.8491, test_f1: 0.6165
 epoch: 52, train_loss: 0.6744, test_loss: 0.9056, test_f1: 0.6303
 epoch: 53, train_loss: 0.6696, test_loss: 0.8042, test_f1: 0.6298
 epoch: 54, train_loss: 0.6757, test_loss: 0.8422, test_f1: 0.6087
 epoch: 55, train_loss: 0.6654, test_loss: 0.9190, test_f1: 0.6264
 epoch: 56, train_loss: 0.6674, test_loss: 0.8301, test_f1: 0.6345
 epoch: 57, train_loss: 0.6592, test_loss: 0.9195, test_f1: 0.6259
 epoch: 58, train_loss: 0.6658, test_loss: 0.8802, test_f1: 0.6089
 epoch: 59, train_loss: 0.6470, test_loss: 0.9104, test_f1: 0.6246
 epoch: 60, train_loss: 0.6408, test_loss: 0.9153, test_f1: 0.6169
 epoch: 61, train_loss: 0.6656, test_loss: 0.9604, test_f1: 0.6145
 epoch: 62, train_loss: 0.6473, test_loss: 0.8811, test_f1: 0.6452
 epoch: 63, train_loss: 0.6460, test_loss: 0.8698, test_f1: 0.6193
 epoch: 64, train_loss: 0.6408, test_loss: 0.8860, test_f1: 0.6340
 epoch: 65, train_loss: 0.6415, test_loss: 0.8776, test_f1: 0.6324
 epoch: 66, train_loss: 0.6403, test_loss: 0.9295, test_f1: 0.6250
 epoch: 67, train_loss: 0.6380, test_loss: 0.9283, test_f1: 0.6273
 epoch: 68, train_loss: 0.6355, test_loss: 0.9014, test_f1: 0.6273
 epoch: 69, train_loss: 0.6303, test_loss: 0.9513, test_f1: 0.6357
 epoch: 70, train_loss: 0.6338, test_loss: 0.9052, test_f1: 0.6330
 epoch: 71, train_loss: 0.6374, test_loss: 0.9733, test_f1: 0.6330
 epoch: 72, train_loss: 0.6267, test_loss: 0.9081, test_f1: 0.6153
 epoch: 73, train_loss: 0.6240, test_loss: 0.9549, test_f1: 0.6359
 epoch: 74, train_loss: 0.6104, test_loss: 0.9257, test_f1: 0.6441
 epoch: 75, train_loss: 0.6046, test_loss: 0.9803, test_f1: 0.6098
 epoch: 76, train_loss: 0.6225, test_loss: 0.9221, test_f1: 0.6434
 epoch: 77, train_loss: 0.6165, test_loss: 0.9526, test_f1: 0.6432
 epoch: 78, train_loss: 0.6158, test_loss: 0.9367, test_f1: 0.6298
 epoch: 79, train_loss: 0.6148, test_loss: 0.9473, test_f1: 0.6465
 epoch: 80, train_loss: 0.5989, test_loss: 0.8793, test_f1: 0.6472
 epoch: 81, train_loss: 0.6043, test_loss: 0.9090, test_f1: 0.6293
 epoch: 82, train_loss: 0.6023, test_loss: 0.9204, test_f1: 0.6557
 epoch: 83, train_loss: 0.5957, test_loss: 0.8810, test_f1: 0.6264
 epoch: 84, train_loss: 0.6083, test_loss: 0.9675, test_f1: 0.6386
 epoch: 85, train_loss: 0.5964, test_loss: 0.9319, test_f1: 0.6393
 epoch: 86, train_loss: 0.6010, test_loss: 0.9176, test_f1: 0.6442
 epoch: 87, train_loss: 0.5887, test_loss: 0.9449, test_f1: 0.6558
 epoch: 88, train_loss: 0.5861, test_loss: 0.9007, test_f1: 0.6534
 epoch: 89, train_loss: 0.5849, test_loss: 0.8774, test_f1: 0.6405
 epoch: 90, train_loss: 0.5882, test_loss: 0.8939, test_f1: 0.6568
 epoch: 91, train_loss: 0.5842, test_loss: 0.9763, test_f1: 0.6422
 epoch: 92, train_loss: 0.6098, test_loss: 0.9617, test_f1: 0.6303
 epoch: 93, train_loss: 0.6041, test_loss: 1.0088, test_f1: 0.6457
 epoch: 94, train_loss: 0.5981, test_loss: 0.8784, test_f1: 0.6436
 epoch: 95, train_loss: 0.5841, test_loss: 0.8958, test_f1: 0.6509
 epoch: 96, train_loss: 0.5863, test_loss: 1.0108, test_f1: 0.6516
 epoch: 97, train_loss: 0.5953, test_loss: 0.9853, test_f1: 0.6494
 epoch: 98, train_loss: 0.5921, test_loss: 0.9711, test_f1: 0.6418
 epoch: 99, train_loss: 0.5765, test_loss: 0.9817, test_f1: 0.6436
##################ITERATION #5 ****************************************
 epoch: 0, train_loss: 1.2239, test_loss: 1.0064, test_f1: 0.5072
 epoch: 1, train_loss: 1.0748, test_loss: 0.9771, test_f1: 0.4863
 epoch: 2, train_loss: 1.0363, test_loss: 0.9597, test_f1: 0.5062
 epoch: 3, train_loss: 1.0096, test_loss: 0.9529, test_f1: 0.4884
 epoch: 4, train_loss: 0.9799, test_loss: 0.9328, test_f1: 0.4821
 epoch: 5, train_loss: 0.9707, test_loss: 0.9172, test_f1: 0.5053
 epoch: 6, train_loss: 0.9562, test_loss: 0.9090, test_f1: 0.5187
 epoch: 7, train_loss: 0.9480, test_loss: 0.8976, test_f1: 0.5506
 epoch: 8, train_loss: 0.9353, test_loss: 0.9104, test_f1: 0.5379
 epoch: 9, train_loss: 0.9247, test_loss: 0.8863, test_f1: 0.5530
 epoch: 10, train_loss: 0.9126, test_loss: 0.8901, test_f1: 0.5367
 epoch: 11, train_loss: 0.9064, test_loss: 0.8970, test_f1: 0.5528
 epoch: 12, train_loss: 0.9005, test_loss: 0.8926, test_f1: 0.5466
 epoch: 13, train_loss: 0.8934, test_loss: 0.8843, test_f1: 0.5588
 epoch: 14, train_loss: 0.8782, test_loss: 0.8637, test_f1: 0.5399
 epoch: 15, train_loss: 0.8819, test_loss: 0.8725, test_f1: 0.5713
 epoch: 16, train_loss: 0.8663, test_loss: 0.8676, test_f1: 0.5384
 epoch: 17, train_loss: 0.8520, test_loss: 0.8724, test_f1: 0.5660
 epoch: 18, train_loss: 0.8445, test_loss: 0.9135, test_f1: 0.5712
 epoch: 19, train_loss: 0.8426, test_loss: 0.8603, test_f1: 0.5770
 epoch: 20, train_loss: 0.8483, test_loss: 0.8759, test_f1: 0.5540
 epoch: 21, train_loss: 0.8268, test_loss: 0.8843, test_f1: 0.5729
 epoch: 22, train_loss: 0.8286, test_loss: 0.8782, test_f1: 0.5688
 epoch: 23, train_loss: 0.8178, test_loss: 0.8798, test_f1: 0.5821
 epoch: 24, train_loss: 0.8199, test_loss: 0.8710, test_f1: 0.5576
 epoch: 25, train_loss: 0.8112, test_loss: 0.8726, test_f1: 0.5822
 epoch: 26, train_loss: 0.7970, test_loss: 0.8705, test_f1: 0.5876
 epoch: 27, train_loss: 0.7959, test_loss: 0.9414, test_f1: 0.5571
 epoch: 28, train_loss: 0.7941, test_loss: 0.8856, test_f1: 0.5546
 epoch: 29, train_loss: 0.7954, test_loss: 0.8758, test_f1: 0.5665
 epoch: 30, train_loss: 0.7867, test_loss: 0.8894, test_f1: 0.5856
 epoch: 31, train_loss: 0.7834, test_loss: 0.8733, test_f1: 0.6144
 epoch: 32, train_loss: 0.7873, test_loss: 0.8729, test_f1: 0.6037
 epoch: 33, train_loss: 0.7713, test_loss: 0.8736, test_f1: 0.5745
 epoch: 34, train_loss: 0.7711, test_loss: 0.8713, test_f1: 0.6268
 epoch: 35, train_loss: 0.7805, test_loss: 0.8810, test_f1: 0.6018
 epoch: 36, train_loss: 0.7703, test_loss: 0.8993, test_f1: 0.5954
 epoch: 37, train_loss: 0.7548, test_loss: 0.8708, test_f1: 0.6175
 epoch: 38, train_loss: 0.7701, test_loss: 0.8694, test_f1: 0.6149
 epoch: 39, train_loss: 0.7497, test_loss: 0.8602, test_f1: 0.6088
 epoch: 40, train_loss: 0.7460, test_loss: 0.8616, test_f1: 0.6278
 epoch: 41, train_loss: 0.7474, test_loss: 0.8592, test_f1: 0.6172
 epoch: 42, train_loss: 0.7380, test_loss: 0.8824, test_f1: 0.5788
 epoch: 43, train_loss: 0.7338, test_loss: 0.8680, test_f1: 0.6259
 epoch: 44, train_loss: 0.7389, test_loss: 0.8707, test_f1: 0.6124
 epoch: 45, train_loss: 0.7361, test_loss: 0.8739, test_f1: 0.6186
 epoch: 46, train_loss: 0.7246, test_loss: 0.8652, test_f1: 0.6209
 epoch: 47, train_loss: 0.7185, test_loss: 0.8644, test_f1: 0.6223
 epoch: 48, train_loss: 0.7077, test_loss: 0.8727, test_f1: 0.6149
 epoch: 49, train_loss: 0.7273, test_loss: 0.9314, test_f1: 0.6082
 epoch: 50, train_loss: 0.7254, test_loss: 0.8774, test_f1: 0.6225
 epoch: 51, train_loss: 0.7095, test_loss: 0.8641, test_f1: 0.6316
 epoch: 52, train_loss: 0.7139, test_loss: 0.8855, test_f1: 0.6209
 epoch: 53, train_loss: 0.6929, test_loss: 0.8832, test_f1: 0.6227
 epoch: 54, train_loss: 0.6961, test_loss: 0.8897, test_f1: 0.6397
 epoch: 55, train_loss: 0.6894, test_loss: 0.8840, test_f1: 0.6356
 epoch: 56, train_loss: 0.7013, test_loss: 0.8794, test_f1: 0.6401
 epoch: 57, train_loss: 0.6948, test_loss: 0.8798, test_f1: 0.6414
 epoch: 58, train_loss: 0.7002, test_loss: 0.8946, test_f1: 0.6259
 epoch: 59, train_loss: 0.6728, test_loss: 0.8830, test_f1: 0.6436
 epoch: 60, train_loss: 0.6690, test_loss: 0.9103, test_f1: 0.6185
 epoch: 61, train_loss: 0.6774, test_loss: 0.8909, test_f1: 0.6487
 epoch: 62, train_loss: 0.6724, test_loss: 0.8760, test_f1: 0.6242
 epoch: 63, train_loss: 0.6710, test_loss: 0.8855, test_f1: 0.6413
 epoch: 64, train_loss: 0.6694, test_loss: 0.9162, test_f1: 0.6190
 epoch: 65, train_loss: 0.6647, test_loss: 0.9046, test_f1: 0.6412
 epoch: 66, train_loss: 0.6647, test_loss: 0.8883, test_f1: 0.6444
 epoch: 67, train_loss: 0.6631, test_loss: 0.8836, test_f1: 0.6340
 epoch: 68, train_loss: 0.6570, test_loss: 0.9069, test_f1: 0.6530
 epoch: 69, train_loss: 0.6706, test_loss: 0.9388, test_f1: 0.6213
 epoch: 70, train_loss: 0.6538, test_loss: 0.9067, test_f1: 0.6364
 epoch: 71, train_loss: 0.6774, test_loss: 0.9239, test_f1: 0.6484
 epoch: 72, train_loss: 0.6699, test_loss: 0.9236, test_f1: 0.6315
 epoch: 73, train_loss: 0.6619, test_loss: 0.8840, test_f1: 0.6521
 epoch: 74, train_loss: 0.6606, test_loss: 0.9192, test_f1: 0.6521
 epoch: 75, train_loss: 0.6526, test_loss: 0.9333, test_f1: 0.6421
 epoch: 76, train_loss: 0.6473, test_loss: 0.9237, test_f1: 0.6382
 epoch: 77, train_loss: 0.6470, test_loss: 0.9357, test_f1: 0.6493
 epoch: 78, train_loss: 0.6609, test_loss: 0.9345, test_f1: 0.6572
 epoch: 79, train_loss: 0.6411, test_loss: 0.9252, test_f1: 0.6519
 epoch: 80, train_loss: 0.6474, test_loss: 0.9204, test_f1: 0.6368
 epoch: 81, train_loss: 0.6429, test_loss: 0.9273, test_f1: 0.6505
 epoch: 82, train_loss: 0.6529, test_loss: 0.9187, test_f1: 0.6417
 epoch: 83, train_loss: 0.6345, test_loss: 0.9016, test_f1: 0.6613
 epoch: 84, train_loss: 0.6246, test_loss: 0.9161, test_f1: 0.6452
 epoch: 85, train_loss: 0.6412, test_loss: 0.9160, test_f1: 0.6320
 epoch: 86, train_loss: 0.6452, test_loss: 0.9440, test_f1: 0.6187
 epoch: 87, train_loss: 0.6334, test_loss: 0.9493, test_f1: 0.6297
 epoch: 88, train_loss: 0.6311, test_loss: 0.9355, test_f1: 0.6488
 epoch: 89, train_loss: 0.6357, test_loss: 0.9548, test_f1: 0.6405
 epoch: 90, train_loss: 0.6314, test_loss: 0.9435, test_f1: 0.6447
 epoch: 91, train_loss: 0.6300, test_loss: 0.9182, test_f1: 0.6304
 epoch: 92, train_loss: 0.6295, test_loss: 0.9124, test_f1: 0.6515
 epoch: 93, train_loss: 0.6274, test_loss: 0.9546, test_f1: 0.6248
 epoch: 94, train_loss: 0.6275, test_loss: 0.9202, test_f1: 0.6505
 epoch: 95, train_loss: 0.6179, test_loss: 0.9342, test_f1: 0.6510
 epoch: 96, train_loss: 0.6058, test_loss: 0.9437, test_f1: 0.6518
 epoch: 97, train_loss: 0.6148, test_loss: 0.9588, test_f1: 0.6382
 epoch: 98, train_loss: 0.6183, test_loss: 0.9664, test_f1: 0.6342
 epoch: 99, train_loss: 0.6137, test_loss: 0.9166, test_f1: 0.6355
##################ITERATION #6 ****************************************
 epoch: 0, train_loss: 1.2368, test_loss: 1.0092, test_f1: 0.4574
 epoch: 1, train_loss: 1.0717, test_loss: 0.9676, test_f1: 0.4979
 epoch: 2, train_loss: 1.0361, test_loss: 0.9589, test_f1: 0.4943
 epoch: 3, train_loss: 1.0106, test_loss: 0.9598, test_f1: 0.4983
 epoch: 4, train_loss: 0.9882, test_loss: 0.9251, test_f1: 0.5032
 epoch: 5, train_loss: 0.9758, test_loss: 0.9360, test_f1: 0.5007
 epoch: 6, train_loss: 0.9554, test_loss: 0.9154, test_f1: 0.5272
 epoch: 7, train_loss: 0.9387, test_loss: 0.9323, test_f1: 0.5296
 epoch: 8, train_loss: 0.9335, test_loss: 0.9119, test_f1: 0.5180
 epoch: 9, train_loss: 0.9215, test_loss: 0.9020, test_f1: 0.5496
 epoch: 10, train_loss: 0.9120, test_loss: 0.8952, test_f1: 0.5230
 epoch: 11, train_loss: 0.9031, test_loss: 0.9131, test_f1: 0.5213
 epoch: 12, train_loss: 0.8989, test_loss: 0.8833, test_f1: 0.5262
 epoch: 13, train_loss: 0.8876, test_loss: 0.9123, test_f1: 0.5176
 epoch: 14, train_loss: 0.8836, test_loss: 0.9084, test_f1: 0.5239
 epoch: 15, train_loss: 0.8787, test_loss: 0.8969, test_f1: 0.5409
 epoch: 16, train_loss: 0.8653, test_loss: 0.8904, test_f1: 0.5302
 epoch: 17, train_loss: 0.8731, test_loss: 0.9049, test_f1: 0.5154
 epoch: 18, train_loss: 0.8511, test_loss: 0.8713, test_f1: 0.5370
 epoch: 19, train_loss: 0.8536, test_loss: 0.9017, test_f1: 0.5324
 epoch: 20, train_loss: 0.8401, test_loss: 0.8713, test_f1: 0.5451
 epoch: 21, train_loss: 0.8283, test_loss: 0.8918, test_f1: 0.5532
 epoch: 22, train_loss: 0.8297, test_loss: 0.9054, test_f1: 0.5333
 epoch: 23, train_loss: 0.8248, test_loss: 0.9011, test_f1: 0.5477
 epoch: 24, train_loss: 0.8377, test_loss: 0.9079, test_f1: 0.5374
 epoch: 25, train_loss: 0.8304, test_loss: 0.8983, test_f1: 0.5564
 epoch: 26, train_loss: 0.8234, test_loss: 0.8692, test_f1: 0.5575
 epoch: 27, train_loss: 0.8052, test_loss: 0.8824, test_f1: 0.5625
 epoch: 28, train_loss: 0.8057, test_loss: 0.9047, test_f1: 0.5644
 epoch: 29, train_loss: 0.8063, test_loss: 0.9165, test_f1: 0.5512
 epoch: 30, train_loss: 0.8046, test_loss: 0.8854, test_f1: 0.5698
 epoch: 31, train_loss: 0.7914, test_loss: 0.8985, test_f1: 0.5660
 epoch: 32, train_loss: 0.7881, test_loss: 0.9051, test_f1: 0.5643
 epoch: 33, train_loss: 0.7805, test_loss: 0.9109, test_f1: 0.5667
 epoch: 34, train_loss: 0.7788, test_loss: 0.8913, test_f1: 0.5708
 epoch: 35, train_loss: 0.7749, test_loss: 0.8953, test_f1: 0.5610
 epoch: 36, train_loss: 0.7777, test_loss: 0.9017, test_f1: 0.5720
 epoch: 37, train_loss: 0.7707, test_loss: 0.9029, test_f1: 0.5705
 epoch: 38, train_loss: 0.7578, test_loss: 0.8802, test_f1: 0.5703
 epoch: 39, train_loss: 0.7689, test_loss: 0.8774, test_f1: 0.5893
 epoch: 40, train_loss: 0.7530, test_loss: 0.8929, test_f1: 0.5752
 epoch: 41, train_loss: 0.7506, test_loss: 0.8857, test_f1: 0.5938
 epoch: 42, train_loss: 0.7624, test_loss: 0.8965, test_f1: 0.5757
 epoch: 43, train_loss: 0.7554, test_loss: 0.8775, test_f1: 0.5889
 epoch: 44, train_loss: 0.7422, test_loss: 0.8833, test_f1: 0.5892
 epoch: 45, train_loss: 0.7357, test_loss: 0.9229, test_f1: 0.5784
 epoch: 46, train_loss: 0.7392, test_loss: 0.9015, test_f1: 0.5959
 epoch: 47, train_loss: 0.7245, test_loss: 0.8847, test_f1: 0.5957
 epoch: 48, train_loss: 0.7343, test_loss: 0.8864, test_f1: 0.5799
 epoch: 49, train_loss: 0.7318, test_loss: 0.9025, test_f1: 0.5893
 epoch: 50, train_loss: 0.7271, test_loss: 0.8808, test_f1: 0.5732
 epoch: 51, train_loss: 0.7087, test_loss: 0.8887, test_f1: 0.5744
 epoch: 52, train_loss: 0.7093, test_loss: 0.8916, test_f1: 0.5819
 epoch: 53, train_loss: 0.7003, test_loss: 0.9089, test_f1: 0.5916
 epoch: 54, train_loss: 0.7066, test_loss: 0.8986, test_f1: 0.6013
 epoch: 55, train_loss: 0.7006, test_loss: 0.9002, test_f1: 0.5881
 epoch: 56, train_loss: 0.6939, test_loss: 0.8940, test_f1: 0.5910
 epoch: 57, train_loss: 0.6899, test_loss: 0.8966, test_f1: 0.6015
 epoch: 58, train_loss: 0.6875, test_loss: 0.9002, test_f1: 0.5945
 epoch: 59, train_loss: 0.6900, test_loss: 0.9374, test_f1: 0.6208
 epoch: 60, train_loss: 0.6873, test_loss: 0.8985, test_f1: 0.6214
 epoch: 61, train_loss: 0.6976, test_loss: 0.8987, test_f1: 0.6054
 epoch: 62, train_loss: 0.6816, test_loss: 0.8906, test_f1: 0.6029
 epoch: 63, train_loss: 0.6703, test_loss: 0.8834, test_f1: 0.6268
 epoch: 64, train_loss: 0.6810, test_loss: 0.8923, test_f1: 0.6177
 epoch: 65, train_loss: 0.6784, test_loss: 0.8939, test_f1: 0.6446
 epoch: 66, train_loss: 0.6770, test_loss: 0.8996, test_f1: 0.6368
 epoch: 67, train_loss: 0.6874, test_loss: 0.8771, test_f1: 0.6333
 epoch: 68, train_loss: 0.6767, test_loss: 0.8953, test_f1: 0.6264
 epoch: 69, train_loss: 0.6644, test_loss: 0.8961, test_f1: 0.6317
 epoch: 70, train_loss: 0.6615, test_loss: 0.9063, test_f1: 0.6217
 epoch: 71, train_loss: 0.6803, test_loss: 0.9175, test_f1: 0.6461
 epoch: 72, train_loss: 0.6705, test_loss: 0.9084, test_f1: 0.6371
 epoch: 73, train_loss: 0.6687, test_loss: 0.9197, test_f1: 0.5939
 epoch: 74, train_loss: 0.6518, test_loss: 0.9147, test_f1: 0.6073
 epoch: 75, train_loss: 0.6715, test_loss: 0.9079, test_f1: 0.6237
 epoch: 76, train_loss: 0.6497, test_loss: 0.9035, test_f1: 0.6205
 epoch: 77, train_loss: 0.6605, test_loss: 0.9122, test_f1: 0.6073
 epoch: 78, train_loss: 0.6539, test_loss: 0.9092, test_f1: 0.6184
 epoch: 79, train_loss: 0.6444, test_loss: 0.9223, test_f1: 0.6154
 epoch: 80, train_loss: 0.6591, test_loss: 0.9182, test_f1: 0.6100
 epoch: 81, train_loss: 0.6488, test_loss: 0.9365, test_f1: 0.6264
 epoch: 82, train_loss: 0.6507, test_loss: 0.9153, test_f1: 0.6310
 epoch: 83, train_loss: 0.6397, test_loss: 0.9333, test_f1: 0.5914
 epoch: 84, train_loss: 0.6386, test_loss: 0.9287, test_f1: 0.6385
 epoch: 85, train_loss: 0.6314, test_loss: 0.9278, test_f1: 0.6464
 epoch: 86, train_loss: 0.6467, test_loss: 0.9166, test_f1: 0.6337
 epoch: 87, train_loss: 0.6370, test_loss: 0.9126, test_f1: 0.6263
 epoch: 88, train_loss: 0.6532, test_loss: 0.9519, test_f1: 0.6101
 epoch: 89, train_loss: 0.6283, test_loss: 0.9126, test_f1: 0.6346
 epoch: 90, train_loss: 0.6299, test_loss: 0.8983, test_f1: 0.6184
 epoch: 91, train_loss: 0.6347, test_loss: 0.9476, test_f1: 0.6120
 epoch: 92, train_loss: 0.6316, test_loss: 0.9317, test_f1: 0.6183
 epoch: 93, train_loss: 0.6455, test_loss: 0.9211, test_f1: 0.6305
 epoch: 94, train_loss: 0.6490, test_loss: 0.9120, test_f1: 0.6357
 epoch: 95, train_loss: 0.6208, test_loss: 0.9289, test_f1: 0.6222
 epoch: 96, train_loss: 0.6260, test_loss: 0.9224, test_f1: 0.6354
 epoch: 97, train_loss: 0.6077, test_loss: 0.9405, test_f1: 0.6402
 epoch: 98, train_loss: 0.6148, test_loss: 0.9175, test_f1: 0.6320
 epoch: 99, train_loss: 0.6181, test_loss: 0.9435, test_f1: 0.6196
##################ITERATION #7 ****************************************
 epoch: 0, train_loss: 1.2598, test_loss: 1.0081, test_f1: 0.4852
 epoch: 1, train_loss: 1.0927, test_loss: 0.9602, test_f1: 0.4732
 epoch: 2, train_loss: 1.0338, test_loss: 0.9316, test_f1: 0.4698
 epoch: 3, train_loss: 1.0032, test_loss: 0.9241, test_f1: 0.4877
 epoch: 4, train_loss: 0.9763, test_loss: 0.9132, test_f1: 0.4791
 epoch: 5, train_loss: 0.9537, test_loss: 0.9175, test_f1: 0.4691
 epoch: 6, train_loss: 0.9463, test_loss: 0.8943, test_f1: 0.5022
 epoch: 7, train_loss: 0.9239, test_loss: 0.9163, test_f1: 0.5105
 epoch: 8, train_loss: 0.9179, test_loss: 0.9028, test_f1: 0.5106
 epoch: 9, train_loss: 0.9092, test_loss: 0.8783, test_f1: 0.5184
 epoch: 10, train_loss: 0.8971, test_loss: 0.8910, test_f1: 0.5291
 epoch: 11, train_loss: 0.8843, test_loss: 0.8897, test_f1: 0.5219
 epoch: 12, train_loss: 0.8765, test_loss: 0.8934, test_f1: 0.5393
 epoch: 13, train_loss: 0.8763, test_loss: 0.8887, test_f1: 0.5354
 epoch: 14, train_loss: 0.8638, test_loss: 0.8872, test_f1: 0.5595
 epoch: 15, train_loss: 0.8430, test_loss: 0.8796, test_f1: 0.5437
 epoch: 16, train_loss: 0.8397, test_loss: 0.8685, test_f1: 0.5428
 epoch: 17, train_loss: 0.8425, test_loss: 0.8968, test_f1: 0.5482
 epoch: 18, train_loss: 0.8337, test_loss: 0.8824, test_f1: 0.5490
 epoch: 19, train_loss: 0.8301, test_loss: 0.8934, test_f1: 0.5507
 epoch: 20, train_loss: 0.8190, test_loss: 0.8686, test_f1: 0.5620
 epoch: 21, train_loss: 0.8091, test_loss: 0.8738, test_f1: 0.5428
 epoch: 22, train_loss: 0.8080, test_loss: 0.9000, test_f1: 0.5730
 epoch: 23, train_loss: 0.8064, test_loss: 0.8792, test_f1: 0.5930
 epoch: 24, train_loss: 0.7954, test_loss: 0.8618, test_f1: 0.5700
 epoch: 25, train_loss: 0.7998, test_loss: 0.8693, test_f1: 0.5863
 epoch: 26, train_loss: 0.7853, test_loss: 0.8816, test_f1: 0.5722
 epoch: 27, train_loss: 0.7879, test_loss: 0.8825, test_f1: 0.5788
 epoch: 28, train_loss: 0.7703, test_loss: 0.8343, test_f1: 0.5741
 epoch: 29, train_loss: 0.7767, test_loss: 0.8551, test_f1: 0.5943
 epoch: 30, train_loss: 0.7734, test_loss: 0.8840, test_f1: 0.5572
 epoch: 31, train_loss: 0.7584, test_loss: 0.8663, test_f1: 0.5775
 epoch: 32, train_loss: 0.7694, test_loss: 0.8870, test_f1: 0.5988
 epoch: 33, train_loss: 0.7473, test_loss: 0.8318, test_f1: 0.5915
 epoch: 34, train_loss: 0.7419, test_loss: 0.8717, test_f1: 0.5837
 epoch: 35, train_loss: 0.7422, test_loss: 0.8644, test_f1: 0.5907
 epoch: 36, train_loss: 0.7456, test_loss: 0.8814, test_f1: 0.6188
 epoch: 37, train_loss: 0.7287, test_loss: 0.8688, test_f1: 0.6111
 epoch: 38, train_loss: 0.7455, test_loss: 0.8556, test_f1: 0.6128
 epoch: 39, train_loss: 0.7283, test_loss: 0.8802, test_f1: 0.6142
 epoch: 40, train_loss: 0.7228, test_loss: 0.8756, test_f1: 0.6057
 epoch: 41, train_loss: 0.7150, test_loss: 0.8720, test_f1: 0.6108
 epoch: 42, train_loss: 0.7168, test_loss: 0.8895, test_f1: 0.6184
 epoch: 43, train_loss: 0.7124, test_loss: 0.8616, test_f1: 0.6226
 epoch: 44, train_loss: 0.7042, test_loss: 0.8652, test_f1: 0.6090
 epoch: 45, train_loss: 0.7036, test_loss: 0.8844, test_f1: 0.6309
 epoch: 46, train_loss: 0.6874, test_loss: 0.8687, test_f1: 0.6146
 epoch: 47, train_loss: 0.6999, test_loss: 0.8908, test_f1: 0.6060
 epoch: 48, train_loss: 0.6886, test_loss: 0.9064, test_f1: 0.6058
 epoch: 49, train_loss: 0.6753, test_loss: 0.8730, test_f1: 0.6418
 epoch: 50, train_loss: 0.6912, test_loss: 0.8865, test_f1: 0.6077
 epoch: 51, train_loss: 0.6704, test_loss: 0.8582, test_f1: 0.6324
 epoch: 52, train_loss: 0.6517, test_loss: 0.8702, test_f1: 0.6338
 epoch: 53, train_loss: 0.6725, test_loss: 0.8581, test_f1: 0.6244
 epoch: 54, train_loss: 0.6603, test_loss: 0.8786, test_f1: 0.6215
 epoch: 55, train_loss: 0.6454, test_loss: 0.8861, test_f1: 0.6176
 epoch: 56, train_loss: 0.6406, test_loss: 0.8651, test_f1: 0.6311
 epoch: 57, train_loss: 0.6519, test_loss: 0.9045, test_f1: 0.6262
 epoch: 58, train_loss: 0.6510, test_loss: 0.8670, test_f1: 0.6457
 epoch: 59, train_loss: 0.6455, test_loss: 0.8617, test_f1: 0.6478
 epoch: 60, train_loss: 0.6450, test_loss: 0.8791, test_f1: 0.6396
 epoch: 61, train_loss: 0.6489, test_loss: 0.8662, test_f1: 0.6116
 epoch: 62, train_loss: 0.6430, test_loss: 0.8922, test_f1: 0.6414
 epoch: 63, train_loss: 0.6325, test_loss: 0.8767, test_f1: 0.6436
 epoch: 64, train_loss: 0.6326, test_loss: 0.8722, test_f1: 0.6420
 epoch: 65, train_loss: 0.6345, test_loss: 0.8915, test_f1: 0.6372
 epoch: 66, train_loss: 0.6347, test_loss: 0.8835, test_f1: 0.6175
 epoch: 67, train_loss: 0.6424, test_loss: 0.8862, test_f1: 0.6204
 epoch: 68, train_loss: 0.6334, test_loss: 0.8672, test_f1: 0.6524
 epoch: 69, train_loss: 0.6314, test_loss: 0.8772, test_f1: 0.6469
 epoch: 70, train_loss: 0.6308, test_loss: 0.8853, test_f1: 0.6468
 epoch: 71, train_loss: 0.6189, test_loss: 0.8791, test_f1: 0.6416
 epoch: 72, train_loss: 0.6109, test_loss: 0.9085, test_f1: 0.6282
 epoch: 73, train_loss: 0.6243, test_loss: 0.8924, test_f1: 0.6367
 epoch: 74, train_loss: 0.6148, test_loss: 0.8877, test_f1: 0.6434
 epoch: 75, train_loss: 0.6176, test_loss: 0.9154, test_f1: 0.6058
 epoch: 76, train_loss: 0.6112, test_loss: 0.9056, test_f1: 0.6286
 epoch: 77, train_loss: 0.6219, test_loss: 0.9224, test_f1: 0.6304
 epoch: 78, train_loss: 0.6087, test_loss: 0.9123, test_f1: 0.6418
 epoch: 79, train_loss: 0.6178, test_loss: 0.8885, test_f1: 0.6426
 epoch: 80, train_loss: 0.6136, test_loss: 0.8789, test_f1: 0.6395
 epoch: 81, train_loss: 0.6133, test_loss: 0.8989, test_f1: 0.6404
 epoch: 82, train_loss: 0.5959, test_loss: 0.9238, test_f1: 0.6320
 epoch: 83, train_loss: 0.6082, test_loss: 0.8890, test_f1: 0.6322
 epoch: 84, train_loss: 0.6053, test_loss: 0.8934, test_f1: 0.6547
 epoch: 85, train_loss: 0.5979, test_loss: 0.8964, test_f1: 0.6378
 epoch: 86, train_loss: 0.5967, test_loss: 0.9052, test_f1: 0.6627
 epoch: 87, train_loss: 0.5800, test_loss: 0.9009, test_f1: 0.6360
 epoch: 88, train_loss: 0.5959, test_loss: 0.9170, test_f1: 0.6330
 epoch: 89, train_loss: 0.5809, test_loss: 0.9148, test_f1: 0.6622
 epoch: 90, train_loss: 0.5842, test_loss: 0.9082, test_f1: 0.6498
 epoch: 91, train_loss: 0.5760, test_loss: 0.9013, test_f1: 0.6822
 epoch: 92, train_loss: 0.5832, test_loss: 0.9071, test_f1: 0.6422
 epoch: 93, train_loss: 0.5999, test_loss: 0.9080, test_f1: 0.6448
 epoch: 94, train_loss: 0.5853, test_loss: 0.9035, test_f1: 0.6604
 epoch: 95, train_loss: 0.5807, test_loss: 0.9239, test_f1: 0.6709
 epoch: 96, train_loss: 0.5795, test_loss: 0.9260, test_f1: 0.6413
 epoch: 97, train_loss: 0.5781, test_loss: 0.9127, test_f1: 0.6496
 epoch: 98, train_loss: 0.5816, test_loss: 0.9458, test_f1: 0.6377
 epoch: 99, train_loss: 0.5823, test_loss: 0.8999, test_f1: 0.6508
##################ITERATION #8 ****************************************
 epoch: 0, train_loss: 1.2595, test_loss: 1.0396, test_f1: 0.4618
 epoch: 1, train_loss: 1.0899, test_loss: 1.0128, test_f1: 0.4855
 epoch: 2, train_loss: 1.0420, test_loss: 0.9849, test_f1: 0.4746
 epoch: 3, train_loss: 1.0264, test_loss: 0.9612, test_f1: 0.5074
 epoch: 4, train_loss: 0.9966, test_loss: 0.9449, test_f1: 0.5162
 epoch: 5, train_loss: 0.9787, test_loss: 0.9427, test_f1: 0.5150
 epoch: 6, train_loss: 0.9677, test_loss: 0.9376, test_f1: 0.5080
 epoch: 7, train_loss: 0.9497, test_loss: 0.9367, test_f1: 0.5256
 epoch: 8, train_loss: 0.9412, test_loss: 0.9417, test_f1: 0.5153
 epoch: 9, train_loss: 0.9293, test_loss: 0.9284, test_f1: 0.5279
 epoch: 10, train_loss: 0.9178, test_loss: 0.9294, test_f1: 0.5353
 epoch: 11, train_loss: 0.9022, test_loss: 0.9136, test_f1: 0.5525
 epoch: 12, train_loss: 0.9043, test_loss: 0.9348, test_f1: 0.5195
 epoch: 13, train_loss: 0.8840, test_loss: 0.9203, test_f1: 0.5460
 epoch: 14, train_loss: 0.8802, test_loss: 0.9159, test_f1: 0.5253
 epoch: 15, train_loss: 0.8709, test_loss: 0.9076, test_f1: 0.5216
 epoch: 16, train_loss: 0.8603, test_loss: 0.9039, test_f1: 0.5665
 epoch: 17, train_loss: 0.8505, test_loss: 0.9111, test_f1: 0.5207
 epoch: 18, train_loss: 0.8632, test_loss: 0.9266, test_f1: 0.5314
 epoch: 19, train_loss: 0.8413, test_loss: 0.9255, test_f1: 0.5348
 epoch: 20, train_loss: 0.8387, test_loss: 0.9142, test_f1: 0.5591
 epoch: 21, train_loss: 0.8285, test_loss: 0.9310, test_f1: 0.5604
 epoch: 22, train_loss: 0.8284, test_loss: 0.9016, test_f1: 0.5601
 epoch: 23, train_loss: 0.8195, test_loss: 0.8925, test_f1: 0.5846
 epoch: 24, train_loss: 0.8154, test_loss: 0.9244, test_f1: 0.5336
 epoch: 25, train_loss: 0.8217, test_loss: 0.9204, test_f1: 0.5363
 epoch: 26, train_loss: 0.8220, test_loss: 0.9156, test_f1: 0.5499
 epoch: 27, train_loss: 0.8102, test_loss: 0.9070, test_f1: 0.5650
 epoch: 28, train_loss: 0.8150, test_loss: 0.9198, test_f1: 0.5792
 epoch: 29, train_loss: 0.8054, test_loss: 0.9170, test_f1: 0.5510
 epoch: 30, train_loss: 0.7906, test_loss: 0.9204, test_f1: 0.5481
 epoch: 31, train_loss: 0.7850, test_loss: 0.9014, test_f1: 0.5604
 epoch: 32, train_loss: 0.7798, test_loss: 0.9066, test_f1: 0.5667
 epoch: 33, train_loss: 0.7776, test_loss: 0.8998, test_f1: 0.5681
 epoch: 34, train_loss: 0.7732, test_loss: 0.8986, test_f1: 0.5804
 epoch: 35, train_loss: 0.7641, test_loss: 0.9110, test_f1: 0.5915
 epoch: 36, train_loss: 0.7557, test_loss: 0.9061, test_f1: 0.5913
 epoch: 37, train_loss: 0.7642, test_loss: 0.8982, test_f1: 0.5794
 epoch: 38, train_loss: 0.7460, test_loss: 0.9044, test_f1: 0.5780
 epoch: 39, train_loss: 0.7475, test_loss: 0.9021, test_f1: 0.5811
 epoch: 40, train_loss: 0.7441, test_loss: 0.9037, test_f1: 0.6018
 epoch: 41, train_loss: 0.7440, test_loss: 0.8906, test_f1: 0.5959
 epoch: 42, train_loss: 0.7335, test_loss: 0.9055, test_f1: 0.5912
 epoch: 43, train_loss: 0.7409, test_loss: 0.9078, test_f1: 0.6189
 epoch: 44, train_loss: 0.7311, test_loss: 0.9049, test_f1: 0.6022
 epoch: 45, train_loss: 0.7233, test_loss: 0.9077, test_f1: 0.6012
 epoch: 46, train_loss: 0.7172, test_loss: 0.9214, test_f1: 0.6257
 epoch: 47, train_loss: 0.7031, test_loss: 0.9154, test_f1: 0.5994
 epoch: 48, train_loss: 0.7028, test_loss: 0.9081, test_f1: 0.6165
 epoch: 49, train_loss: 0.7121, test_loss: 0.9090, test_f1: 0.5961
 epoch: 50, train_loss: 0.7147, test_loss: 0.9090, test_f1: 0.6020
 epoch: 51, train_loss: 0.7000, test_loss: 0.9158, test_f1: 0.5944
 epoch: 52, train_loss: 0.6834, test_loss: 0.9123, test_f1: 0.6113
 epoch: 53, train_loss: 0.6794, test_loss: 0.9059, test_f1: 0.6277
 epoch: 54, train_loss: 0.6851, test_loss: 0.9137, test_f1: 0.6248
 epoch: 55, train_loss: 0.6856, test_loss: 0.9078, test_f1: 0.6017
 epoch: 56, train_loss: 0.6754, test_loss: 0.9244, test_f1: 0.6194
 epoch: 57, train_loss: 0.6927, test_loss: 0.9103, test_f1: 0.6384
 epoch: 58, train_loss: 0.6699, test_loss: 0.9112, test_f1: 0.6374
 epoch: 59, train_loss: 0.6565, test_loss: 0.9485, test_f1: 0.5973
 epoch: 60, train_loss: 0.6698, test_loss: 0.9417, test_f1: 0.6043
 epoch: 61, train_loss: 0.6711, test_loss: 0.9334, test_f1: 0.5937
 epoch: 62, train_loss: 0.6631, test_loss: 0.9103, test_f1: 0.6236
 epoch: 63, train_loss: 0.6649, test_loss: 0.9286, test_f1: 0.6013
 epoch: 64, train_loss: 0.6554, test_loss: 0.9078, test_f1: 0.6107
 epoch: 65, train_loss: 0.6553, test_loss: 0.9067, test_f1: 0.6488
 epoch: 66, train_loss: 0.6478, test_loss: 0.9199, test_f1: 0.6334
 epoch: 67, train_loss: 0.6567, test_loss: 0.9331, test_f1: 0.6328
 epoch: 68, train_loss: 0.6476, test_loss: 0.9207, test_f1: 0.6338
 epoch: 69, train_loss: 0.6550, test_loss: 0.9220, test_f1: 0.6246
 epoch: 70, train_loss: 0.6461, test_loss: 0.9184, test_f1: 0.6167
 epoch: 71, train_loss: 0.6406, test_loss: 0.9004, test_f1: 0.6593
 epoch: 72, train_loss: 0.6404, test_loss: 0.9114, test_f1: 0.6239
 epoch: 73, train_loss: 0.6379, test_loss: 0.9122, test_f1: 0.6059
 epoch: 74, train_loss: 0.6357, test_loss: 0.9509, test_f1: 0.6313
 epoch: 75, train_loss: 0.6266, test_loss: 0.9392, test_f1: 0.6297
 epoch: 76, train_loss: 0.6443, test_loss: 0.9597, test_f1: 0.6280
 epoch: 77, train_loss: 0.6299, test_loss: 0.9578, test_f1: 0.6160
 epoch: 78, train_loss: 0.6312, test_loss: 0.9509, test_f1: 0.6320
 epoch: 79, train_loss: 0.6230, test_loss: 0.9337, test_f1: 0.6325
 epoch: 80, train_loss: 0.6177, test_loss: 0.9325, test_f1: 0.6111
 epoch: 81, train_loss: 0.6166, test_loss: 0.9409, test_f1: 0.6320
 epoch: 82, train_loss: 0.6110, test_loss: 0.9356, test_f1: 0.6268
 epoch: 83, train_loss: 0.6291, test_loss: 0.9294, test_f1: 0.6447
 epoch: 84, train_loss: 0.6281, test_loss: 0.9424, test_f1: 0.6017
 epoch: 85, train_loss: 0.6161, test_loss: 0.9509, test_f1: 0.6328
 epoch: 86, train_loss: 0.6056, test_loss: 0.9607, test_f1: 0.6407
 epoch: 87, train_loss: 0.6052, test_loss: 0.9508, test_f1: 0.6297
 epoch: 88, train_loss: 0.6090, test_loss: 0.9558, test_f1: 0.6234
 epoch: 89, train_loss: 0.5995, test_loss: 0.9644, test_f1: 0.6417
 epoch: 90, train_loss: 0.5933, test_loss: 0.9825, test_f1: 0.6400
 epoch: 91, train_loss: 0.6008, test_loss: 0.9724, test_f1: 0.6333
 epoch: 92, train_loss: 0.5905, test_loss: 0.9345, test_f1: 0.6370
 epoch: 93, train_loss: 0.5910, test_loss: 0.9585, test_f1: 0.6461
 epoch: 94, train_loss: 0.5867, test_loss: 0.9482, test_f1: 0.6544
 epoch: 95, train_loss: 0.5910, test_loss: 0.9376, test_f1: 0.6569
 epoch: 96, train_loss: 0.6043, test_loss: 0.9476, test_f1: 0.6436
 epoch: 97, train_loss: 0.5967, test_loss: 0.9882, test_f1: 0.6125
 epoch: 98, train_loss: 0.5809, test_loss: 0.9575, test_f1: 0.6594
 epoch: 99, train_loss: 0.5849, test_loss: 0.9740, test_f1: 0.6377
##################ITERATION #9 ****************************************
 epoch: 0, train_loss: 1.3045, test_loss: 1.0314, test_f1: 0.4646
 epoch: 1, train_loss: 1.1134, test_loss: 0.9818, test_f1: 0.4965
 epoch: 2, train_loss: 1.0620, test_loss: 0.9866, test_f1: 0.4719
 epoch: 3, train_loss: 1.0269, test_loss: 0.9434, test_f1: 0.5249
 epoch: 4, train_loss: 1.0091, test_loss: 0.9398, test_f1: 0.5081
 epoch: 5, train_loss: 0.9819, test_loss: 0.9353, test_f1: 0.5288
 epoch: 6, train_loss: 0.9575, test_loss: 0.9207, test_f1: 0.5231
 epoch: 7, train_loss: 0.9415, test_loss: 0.9055, test_f1: 0.5098
 epoch: 8, train_loss: 0.9346, test_loss: 0.9218, test_f1: 0.5524
 epoch: 9, train_loss: 0.9273, test_loss: 0.9124, test_f1: 0.5296
 epoch: 10, train_loss: 0.9218, test_loss: 0.9165, test_f1: 0.5007
 epoch: 11, train_loss: 0.9181, test_loss: 0.9116, test_f1: 0.5339
 epoch: 12, train_loss: 0.9006, test_loss: 0.9053, test_f1: 0.5366
 epoch: 13, train_loss: 0.8929, test_loss: 0.9167, test_f1: 0.5197
 epoch: 14, train_loss: 0.8847, test_loss: 0.9063, test_f1: 0.5245
 epoch: 15, train_loss: 0.8815, test_loss: 0.9003, test_f1: 0.5366
 epoch: 16, train_loss: 0.8631, test_loss: 0.8978, test_f1: 0.5402
 epoch: 17, train_loss: 0.8593, test_loss: 0.8849, test_f1: 0.5452
 epoch: 18, train_loss: 0.8502, test_loss: 0.8757, test_f1: 0.5487
 epoch: 19, train_loss: 0.8474, test_loss: 0.9024, test_f1: 0.5598
 epoch: 20, train_loss: 0.8415, test_loss: 0.9056, test_f1: 0.5754
 epoch: 21, train_loss: 0.8458, test_loss: 0.8850, test_f1: 0.5494
 epoch: 22, train_loss: 0.8413, test_loss: 0.8805, test_f1: 0.5446
 epoch: 23, train_loss: 0.8329, test_loss: 0.8785, test_f1: 0.5580
 epoch: 24, train_loss: 0.8292, test_loss: 0.8762, test_f1: 0.5603
 epoch: 25, train_loss: 0.8155, test_loss: 0.9008, test_f1: 0.5512
 epoch: 26, train_loss: 0.8227, test_loss: 0.8971, test_f1: 0.5510
 epoch: 27, train_loss: 0.8068, test_loss: 0.8818, test_f1: 0.5582
 epoch: 28, train_loss: 0.8091, test_loss: 0.8650, test_f1: 0.5608
 epoch: 29, train_loss: 0.7982, test_loss: 0.8808, test_f1: 0.5622
 epoch: 30, train_loss: 0.8035, test_loss: 0.8768, test_f1: 0.5707
 epoch: 31, train_loss: 0.7852, test_loss: 0.8755, test_f1: 0.5671
 epoch: 32, train_loss: 0.7868, test_loss: 0.8872, test_f1: 0.5769
 epoch: 33, train_loss: 0.7866, test_loss: 0.8714, test_f1: 0.5730
 epoch: 34, train_loss: 0.7845, test_loss: 0.8754, test_f1: 0.5718
 epoch: 35, train_loss: 0.7663, test_loss: 0.8896, test_f1: 0.5819
 epoch: 36, train_loss: 0.7639, test_loss: 0.8885, test_f1: 0.5712
 epoch: 37, train_loss: 0.7626, test_loss: 0.8880, test_f1: 0.5713
 epoch: 38, train_loss: 0.7592, test_loss: 0.8830, test_f1: 0.5745
 epoch: 39, train_loss: 0.7591, test_loss: 0.8895, test_f1: 0.5746
 epoch: 40, train_loss: 0.7588, test_loss: 0.8975, test_f1: 0.5737
 epoch: 41, train_loss: 0.7494, test_loss: 0.8829, test_f1: 0.5991
 epoch: 42, train_loss: 0.7455, test_loss: 0.8748, test_f1: 0.6079
 epoch: 43, train_loss: 0.7414, test_loss: 0.8866, test_f1: 0.5885
 epoch: 44, train_loss: 0.7485, test_loss: 0.8927, test_f1: 0.5775
 epoch: 45, train_loss: 0.7363, test_loss: 0.8849, test_f1: 0.5954
 epoch: 46, train_loss: 0.7368, test_loss: 0.8701, test_f1: 0.5961
 epoch: 47, train_loss: 0.7255, test_loss: 0.8961, test_f1: 0.5884
 epoch: 48, train_loss: 0.7366, test_loss: 0.8735, test_f1: 0.5950
 epoch: 49, train_loss: 0.7204, test_loss: 0.8883, test_f1: 0.5996
 epoch: 50, train_loss: 0.7071, test_loss: 0.8922, test_f1: 0.6040
 epoch: 51, train_loss: 0.7025, test_loss: 0.8934, test_f1: 0.6051
 epoch: 52, train_loss: 0.7144, test_loss: 0.9101, test_f1: 0.5975
 epoch: 53, train_loss: 0.6887, test_loss: 0.8788, test_f1: 0.6139
 epoch: 54, train_loss: 0.6920, test_loss: 0.8853, test_f1: 0.6100
 epoch: 55, train_loss: 0.6988, test_loss: 0.9006, test_f1: 0.6096
 epoch: 56, train_loss: 0.6835, test_loss: 0.8912, test_f1: 0.5980
 epoch: 57, train_loss: 0.6994, test_loss: 0.8902, test_f1: 0.5951
 epoch: 58, train_loss: 0.6950, test_loss: 0.8839, test_f1: 0.6062
 epoch: 59, train_loss: 0.6825, test_loss: 0.8583, test_f1: 0.6191
 epoch: 60, train_loss: 0.6849, test_loss: 0.8648, test_f1: 0.6177
 epoch: 61, train_loss: 0.6974, test_loss: 0.8847, test_f1: 0.6059
 epoch: 62, train_loss: 0.6888, test_loss: 0.8895, test_f1: 0.6069
 epoch: 63, train_loss: 0.6799, test_loss: 0.9028, test_f1: 0.5950
 epoch: 64, train_loss: 0.6713, test_loss: 0.8985, test_f1: 0.5850
 epoch: 65, train_loss: 0.6825, test_loss: 0.8940, test_f1: 0.6066
 epoch: 66, train_loss: 0.6705, test_loss: 0.8937, test_f1: 0.6036
 epoch: 67, train_loss: 0.6702, test_loss: 0.8841, test_f1: 0.6147
 epoch: 68, train_loss: 0.6777, test_loss: 0.9086, test_f1: 0.6334
 epoch: 69, train_loss: 0.6709, test_loss: 0.8911, test_f1: 0.6191
 epoch: 70, train_loss: 0.6581, test_loss: 0.9165, test_f1: 0.6172
 epoch: 71, train_loss: 0.6678, test_loss: 0.9003, test_f1: 0.6028
 epoch: 72, train_loss: 0.6841, test_loss: 0.9202, test_f1: 0.6176
 epoch: 73, train_loss: 0.6523, test_loss: 0.9184, test_f1: 0.6190
 epoch: 74, train_loss: 0.6506, test_loss: 0.8885, test_f1: 0.6297
 epoch: 75, train_loss: 0.6689, test_loss: 0.9094, test_f1: 0.6271
 epoch: 76, train_loss: 0.6675, test_loss: 0.9217, test_f1: 0.6302
 epoch: 77, train_loss: 0.6565, test_loss: 0.9180, test_f1: 0.6164
 epoch: 78, train_loss: 0.6606, test_loss: 0.9255, test_f1: 0.6177
 epoch: 79, train_loss: 0.6533, test_loss: 0.8778, test_f1: 0.6234
 epoch: 80, train_loss: 0.6488, test_loss: 0.9144, test_f1: 0.6217
 epoch: 81, train_loss: 0.6547, test_loss: 0.9187, test_f1: 0.6242
 epoch: 82, train_loss: 0.6429, test_loss: 0.9307, test_f1: 0.6108
 epoch: 83, train_loss: 0.6596, test_loss: 0.9538, test_f1: 0.6178
 epoch: 84, train_loss: 0.6283, test_loss: 0.9234, test_f1: 0.6189
 epoch: 85, train_loss: 0.6559, test_loss: 0.9193, test_f1: 0.6386
 epoch: 86, train_loss: 0.6436, test_loss: 0.9114, test_f1: 0.6269
 epoch: 87, train_loss: 0.6531, test_loss: 0.9166, test_f1: 0.6392
 epoch: 88, train_loss: 0.6433, test_loss: 0.9067, test_f1: 0.6335
 epoch: 89, train_loss: 0.6408, test_loss: 0.9138, test_f1: 0.6217
 epoch: 90, train_loss: 0.6428, test_loss: 0.9369, test_f1: 0.6346
 epoch: 91, train_loss: 0.6245, test_loss: 0.9376, test_f1: 0.6242
 epoch: 92, train_loss: 0.6243, test_loss: 0.9020, test_f1: 0.6358
 epoch: 93, train_loss: 0.6298, test_loss: 0.9194, test_f1: 0.6294
 epoch: 94, train_loss: 0.6290, test_loss: 0.8883, test_f1: 0.6373
 epoch: 95, train_loss: 0.6162, test_loss: 0.9316, test_f1: 0.6396
 epoch: 96, train_loss: 0.6365, test_loss: 0.9220, test_f1: 0.6333
 epoch: 97, train_loss: 0.6103, test_loss: 0.9363, test_f1: 0.6242
 epoch: 98, train_loss: 0.6173, test_loss: 0.9164, test_f1: 0.6418
 epoch: 99, train_loss: 0.6186, test_loss: 0.9189, test_f1: 0.6255

Training completed in 804.11 seconds
Best F1: 0.6825 at epoch 94
Mean F1 across iterations: 0.6618  0.0139
========================FINAL RESULTS================================
FEGIN weighted F1: 0.6825  0.0139
python main.py --data ltspice_examples --representation component_net --model FEGIN --layers 2 --hiddens 128 --batch_size 32 --lr 0.0001 --emb_size 128 --epochs 100 --save_appendix component_net_L2_H128_BS32_LR0.0001_E128 --no_val
-----



STDERR:
  File "main.py", line 370, in <module>
    main()
  File "main.py", line 254, in main
    dataset = dataset_class(
  File "/home/philip/projects/ltspice_examples_code_repo/Circuit-Completion-Using-GNNs/component_classification_with_link_prediction_head/evaluation/FEGIN/kernel/circuit_datasets.py", line 15, in __init__
    self.data, self.slices = torch.load(self.processed_paths[0])
  File "/home/philip/.local/lib/python3.8/site-packages/torch/serialization.py", line 1040, in load
    warnings.warn(
  File "/usr/lib/python3.8/warnings.py", line 109, in _showwarnmsg
    sw(msg.message, msg.category, msg.filename, msg.lineno,
  File "main.py", line 47, in warn_with_traceback
    traceback.print_stack(file=log)
/home/philip/projects/ltspice_examples_code_repo/Circuit-Completion-Using-GNNs/component_classification_with_link_prediction_head/evaluation/FEGIN/kernel/circuit_datasets.py:15: FutureWarning: You are using `torch.load` with `weights_only=False` (the current default value), which uses the default pickle module implicitly. It is possible to construct malicious pickle data which will execute arbitrary code during unpickling (See https://github.com/pytorch/pytorch/blob/main/SECURITY.md#untrusted-models for more details). In a future release, the default value for `weights_only` will be flipped to `True`. This limits the functions that could be executed during unpickling. Arbitrary objects will no longer be allowed to be loaded via this mode unless they are explicitly allowlisted by the user via `torch.serialization.add_safe_globals`. We recommend you start setting `weights_only=True` for any use case where you don't have full control of the loaded file. Please open an issue on GitHub for any issues related to this experimental feature.
  self.data, self.slices = torch.load(self.processed_paths[0])
