STDOUT:
Results will be saved in /home/philip/projects/ltspice_examples_code_repo/Circuit-Completion-Using-GNNs/component_classification_with_link_prediction_head/evaluation/FEGIN/results/model_FEGIN_dataset_ltspice_examples
Command line input: python main.py --data ltspice_examples --representation component_pin --model FEGIN --layers 4 --hiddens 32 --batch_size 256 --lr 0.001 --emb_size 128 --epochs 100 --save_appendix component_pin_L4_H32_BS256_LR0.001_E128 --no_val
 is saved.
-----
ltspice_examples - FEGIN
Using 4 layers, 32 hidden units, h = 2
Loading component_pin representation dataset
ENTERED
Training FEGIN on component_pin representation
Train: 3560, Test: 848
##################ITERATION #0 ****************************************
 epoch: 0, train_loss: 1.3457, test_loss: 1.3400, test_f1: 0.2260
 epoch: 1, train_loss: 1.3089, test_loss: 1.3233, test_f1: 0.2260
 epoch: 2, train_loss: 1.2631, test_loss: 1.2995, test_f1: 0.2260
 epoch: 3, train_loss: 1.2073, test_loss: 1.2755, test_f1: 0.2260
 epoch: 4, train_loss: 1.1498, test_loss: 1.3069, test_f1: 0.2260
 epoch: 5, train_loss: 1.0881, test_loss: 1.1025, test_f1: 0.3404
 epoch: 6, train_loss: 1.0449, test_loss: 1.0294, test_f1: 0.3412
 epoch: 7, train_loss: 1.0161, test_loss: 1.0178, test_f1: 0.3810
 epoch: 8, train_loss: 1.0031, test_loss: 1.0229, test_f1: 0.3444
 epoch: 9, train_loss: 0.9913, test_loss: 1.0141, test_f1: 0.3559
 epoch: 10, train_loss: 0.9757, test_loss: 1.0506, test_f1: 0.3630
 epoch: 11, train_loss: 0.9628, test_loss: 1.0109, test_f1: 0.3912
 epoch: 12, train_loss: 0.9636, test_loss: 1.0143, test_f1: 0.4455
 epoch: 13, train_loss: 0.9462, test_loss: 1.3934, test_f1: 0.2961
 epoch: 14, train_loss: 0.9302, test_loss: 0.9590, test_f1: 0.4640
 epoch: 15, train_loss: 0.9263, test_loss: 0.9540, test_f1: 0.4591
 epoch: 16, train_loss: 0.9085, test_loss: 0.9433, test_f1: 0.4421
 epoch: 17, train_loss: 0.8991, test_loss: 0.9754, test_f1: 0.4755
 epoch: 18, train_loss: 0.8928, test_loss: 0.9937, test_f1: 0.4536
 epoch: 19, train_loss: 0.8813, test_loss: 0.9716, test_f1: 0.4720
 epoch: 20, train_loss: 0.8807, test_loss: 0.9422, test_f1: 0.4849
 epoch: 21, train_loss: 0.8611, test_loss: 0.9836, test_f1: 0.4950
 epoch: 22, train_loss: 0.8454, test_loss: 1.0550, test_f1: 0.4319
 epoch: 23, train_loss: 0.8462, test_loss: 0.9718, test_f1: 0.5163
 epoch: 24, train_loss: 0.8274, test_loss: 0.9638, test_f1: 0.4996
 epoch: 25, train_loss: 0.8353, test_loss: 1.0145, test_f1: 0.4827
 epoch: 26, train_loss: 0.8151, test_loss: 1.0361, test_f1: 0.4987
 epoch: 27, train_loss: 0.8067, test_loss: 0.9610, test_f1: 0.5045
 epoch: 28, train_loss: 0.7980, test_loss: 0.9885, test_f1: 0.4997
 epoch: 29, train_loss: 0.7957, test_loss: 0.9751, test_f1: 0.5149
 epoch: 30, train_loss: 0.7998, test_loss: 1.0124, test_f1: 0.5146
 epoch: 31, train_loss: 0.7841, test_loss: 0.9328, test_f1: 0.4990
 epoch: 32, train_loss: 0.7723, test_loss: 0.9667, test_f1: 0.5099
 epoch: 33, train_loss: 0.7739, test_loss: 0.9328, test_f1: 0.5241
 epoch: 34, train_loss: 0.7677, test_loss: 1.0008, test_f1: 0.5044
 epoch: 35, train_loss: 0.7634, test_loss: 1.0495, test_f1: 0.5107
 epoch: 36, train_loss: 0.7576, test_loss: 0.9677, test_f1: 0.5324
 epoch: 37, train_loss: 0.7416, test_loss: 1.0194, test_f1: 0.5147
 epoch: 38, train_loss: 0.7449, test_loss: 1.0789, test_f1: 0.4812
 epoch: 39, train_loss: 0.7359, test_loss: 1.0146, test_f1: 0.5276
 epoch: 40, train_loss: 0.7307, test_loss: 1.0393, test_f1: 0.5173
 epoch: 41, train_loss: 0.7164, test_loss: 0.9946, test_f1: 0.5262
 epoch: 42, train_loss: 0.6979, test_loss: 1.0766, test_f1: 0.5081
 epoch: 43, train_loss: 0.7043, test_loss: 0.9866, test_f1: 0.5500
 epoch: 44, train_loss: 0.7069, test_loss: 1.0060, test_f1: 0.5429
 epoch: 45, train_loss: 0.7038, test_loss: 1.0710, test_f1: 0.5187
 epoch: 46, train_loss: 0.7063, test_loss: 1.1458, test_f1: 0.5204
 epoch: 47, train_loss: 0.7001, test_loss: 1.0684, test_f1: 0.5019
 epoch: 48, train_loss: 0.6815, test_loss: 1.0650, test_f1: 0.5198
 epoch: 49, train_loss: 0.6697, test_loss: 1.1356, test_f1: 0.5208
 epoch: 50, train_loss: 0.6851, test_loss: 1.1098, test_f1: 0.5023
 epoch: 51, train_loss: 0.6746, test_loss: 1.0578, test_f1: 0.5299
 epoch: 52, train_loss: 0.6479, test_loss: 1.1077, test_f1: 0.5212
 epoch: 53, train_loss: 0.6296, test_loss: 1.0888, test_f1: 0.5230
 epoch: 54, train_loss: 0.6412, test_loss: 1.0653, test_f1: 0.5483
 epoch: 55, train_loss: 0.6362, test_loss: 1.1415, test_f1: 0.5315
 epoch: 56, train_loss: 0.6391, test_loss: 1.1404, test_f1: 0.5250
 epoch: 57, train_loss: 0.6240, test_loss: 1.1193, test_f1: 0.5309
 epoch: 58, train_loss: 0.6282, test_loss: 1.1356, test_f1: 0.5189
 epoch: 59, train_loss: 0.6253, test_loss: 1.1176, test_f1: 0.5423
 epoch: 60, train_loss: 0.6249, test_loss: 1.1285, test_f1: 0.5523
 epoch: 61, train_loss: 0.6268, test_loss: 1.1472, test_f1: 0.5191
 epoch: 62, train_loss: 0.6279, test_loss: 1.1189, test_f1: 0.5481
 epoch: 63, train_loss: 0.6107, test_loss: 1.1162, test_f1: 0.5381
 epoch: 64, train_loss: 0.6133, test_loss: 1.1601, test_f1: 0.5548
 epoch: 65, train_loss: 0.6080, test_loss: 1.1678, test_f1: 0.5435
 epoch: 66, train_loss: 0.6064, test_loss: 1.1734, test_f1: 0.5243
 epoch: 67, train_loss: 0.6091, test_loss: 1.1598, test_f1: 0.5443
 epoch: 68, train_loss: 0.6184, test_loss: 1.1532, test_f1: 0.5272
 epoch: 69, train_loss: 0.6076, test_loss: 1.1658, test_f1: 0.5435
 epoch: 70, train_loss: 0.5886, test_loss: 1.1676, test_f1: 0.5295
 epoch: 71, train_loss: 0.5940, test_loss: 1.1705, test_f1: 0.5467
 epoch: 72, train_loss: 0.5958, test_loss: 1.1744, test_f1: 0.5312
 epoch: 73, train_loss: 0.5782, test_loss: 1.1760, test_f1: 0.5283
 epoch: 74, train_loss: 0.5867, test_loss: 1.2317, test_f1: 0.5421
 epoch: 75, train_loss: 0.5729, test_loss: 1.2230, test_f1: 0.5367
 epoch: 76, train_loss: 0.6018, test_loss: 1.2147, test_f1: 0.5341
 epoch: 77, train_loss: 0.5885, test_loss: 1.1723, test_f1: 0.5425
 epoch: 78, train_loss: 0.5987, test_loss: 1.2318, test_f1: 0.5425
 epoch: 79, train_loss: 0.5851, test_loss: 1.2195, test_f1: 0.5518
 epoch: 80, train_loss: 0.5843, test_loss: 1.2436, test_f1: 0.5263
 epoch: 81, train_loss: 0.5854, test_loss: 1.1942, test_f1: 0.5549
 epoch: 82, train_loss: 0.5633, test_loss: 1.2004, test_f1: 0.5512
 epoch: 83, train_loss: 0.5846, test_loss: 1.2549, test_f1: 0.5337
 epoch: 84, train_loss: 0.5740, test_loss: 1.1908, test_f1: 0.5466
 epoch: 85, train_loss: 0.5675, test_loss: 1.2398, test_f1: 0.5524
 epoch: 86, train_loss: 0.5624, test_loss: 1.2070, test_f1: 0.5613
 epoch: 87, train_loss: 0.5620, test_loss: 1.2168, test_f1: 0.5610
 epoch: 88, train_loss: 0.5630, test_loss: 1.2118, test_f1: 0.5528
 epoch: 89, train_loss: 0.5624, test_loss: 1.1674, test_f1: 0.5504
 epoch: 90, train_loss: 0.5614, test_loss: 1.2006, test_f1: 0.5387
 epoch: 91, train_loss: 0.5526, test_loss: 1.2374, test_f1: 0.5529
 epoch: 92, train_loss: 0.5556, test_loss: 1.2765, test_f1: 0.5493
 epoch: 93, train_loss: 0.5589, test_loss: 1.2554, test_f1: 0.5655
 epoch: 94, train_loss: 0.5505, test_loss: 1.2544, test_f1: 0.5599
 epoch: 95, train_loss: 0.5527, test_loss: 1.2261, test_f1: 0.5714
 epoch: 96, train_loss: 0.5677, test_loss: 1.2189, test_f1: 0.5541
 epoch: 97, train_loss: 0.5408, test_loss: 1.3577, test_f1: 0.5405
 epoch: 98, train_loss: 0.5440, test_loss: 1.2452, test_f1: 0.5528
 epoch: 99, train_loss: 0.5397, test_loss: 1.2868, test_f1: 0.5749
##################ITERATION #1 ****************************************
 epoch: 0, train_loss: 1.2863, test_loss: 1.3008, test_f1: 0.2260
 epoch: 1, train_loss: 1.1746, test_loss: 1.2329, test_f1: 0.2260
 epoch: 2, train_loss: 1.1154, test_loss: 1.1207, test_f1: 0.3342
 epoch: 3, train_loss: 1.0726, test_loss: 1.0676, test_f1: 0.3464
 epoch: 4, train_loss: 1.0452, test_loss: 1.0576, test_f1: 0.3955
 epoch: 5, train_loss: 1.0157, test_loss: 1.0487, test_f1: 0.4450
 epoch: 6, train_loss: 0.9876, test_loss: 1.0334, test_f1: 0.4475
 epoch: 7, train_loss: 0.9651, test_loss: 1.0133, test_f1: 0.4698
 epoch: 8, train_loss: 0.9533, test_loss: 0.9904, test_f1: 0.4864
 epoch: 9, train_loss: 0.9269, test_loss: 1.0076, test_f1: 0.4796
 epoch: 10, train_loss: 0.9064, test_loss: 0.9876, test_f1: 0.4839
 epoch: 11, train_loss: 0.8971, test_loss: 0.9689, test_f1: 0.4966
 epoch: 12, train_loss: 0.8940, test_loss: 0.9543, test_f1: 0.5041
 epoch: 13, train_loss: 0.8673, test_loss: 0.9445, test_f1: 0.5050
 epoch: 14, train_loss: 0.8752, test_loss: 0.9299, test_f1: 0.5315
 epoch: 15, train_loss: 0.8467, test_loss: 0.9250, test_f1: 0.5156
 epoch: 16, train_loss: 0.8339, test_loss: 0.8915, test_f1: 0.5557
 epoch: 17, train_loss: 0.8226, test_loss: 0.9256, test_f1: 0.5416
 epoch: 18, train_loss: 0.8183, test_loss: 0.9460, test_f1: 0.5274
 epoch: 19, train_loss: 0.8065, test_loss: 0.9461, test_f1: 0.5298
 epoch: 20, train_loss: 0.7988, test_loss: 0.9316, test_f1: 0.5290
 epoch: 21, train_loss: 0.7910, test_loss: 0.9332, test_f1: 0.5191
 epoch: 22, train_loss: 0.7920, test_loss: 0.8932, test_f1: 0.5713
 epoch: 23, train_loss: 0.7747, test_loss: 0.8966, test_f1: 0.5290
 epoch: 24, train_loss: 0.7730, test_loss: 0.9393, test_f1: 0.5160
 epoch: 25, train_loss: 0.7688, test_loss: 0.9392, test_f1: 0.5372
 epoch: 26, train_loss: 0.7547, test_loss: 0.9321, test_f1: 0.5285
 epoch: 27, train_loss: 0.7631, test_loss: 0.9428, test_f1: 0.5207
 epoch: 28, train_loss: 0.7576, test_loss: 0.8842, test_f1: 0.5631
 epoch: 29, train_loss: 0.7403, test_loss: 0.9176, test_f1: 0.5420
 epoch: 30, train_loss: 0.7387, test_loss: 0.9343, test_f1: 0.5292
 epoch: 31, train_loss: 0.7322, test_loss: 0.8428, test_f1: 0.5478
 epoch: 32, train_loss: 0.7307, test_loss: 0.8530, test_f1: 0.5558
 epoch: 33, train_loss: 0.7129, test_loss: 0.8184, test_f1: 0.5514
 epoch: 34, train_loss: 0.7132, test_loss: 0.8855, test_f1: 0.5680
 epoch: 35, train_loss: 0.7077, test_loss: 0.8901, test_f1: 0.5449
 epoch: 36, train_loss: 0.6978, test_loss: 0.8827, test_f1: 0.5491
 epoch: 37, train_loss: 0.6896, test_loss: 0.9467, test_f1: 0.5472
 epoch: 38, train_loss: 0.7018, test_loss: 0.8891, test_f1: 0.5395
 epoch: 39, train_loss: 0.7063, test_loss: 0.8350, test_f1: 0.5689
 epoch: 40, train_loss: 0.6899, test_loss: 0.8941, test_f1: 0.5356
 epoch: 41, train_loss: 0.6854, test_loss: 0.9680, test_f1: 0.5314
 epoch: 42, train_loss: 0.6867, test_loss: 0.9138, test_f1: 0.5439
 epoch: 43, train_loss: 0.6754, test_loss: 0.9589, test_f1: 0.5579
 epoch: 44, train_loss: 0.6718, test_loss: 0.9881, test_f1: 0.5069
 epoch: 45, train_loss: 0.6807, test_loss: 1.0595, test_f1: 0.5019
 epoch: 46, train_loss: 0.6826, test_loss: 0.9014, test_f1: 0.5549
 epoch: 47, train_loss: 0.6561, test_loss: 0.9326, test_f1: 0.5392
 epoch: 48, train_loss: 0.6556, test_loss: 0.8753, test_f1: 0.5427
 epoch: 49, train_loss: 0.6583, test_loss: 0.8331, test_f1: 0.5543
 epoch: 50, train_loss: 0.6548, test_loss: 0.8768, test_f1: 0.5562
 epoch: 51, train_loss: 0.6432, test_loss: 0.8799, test_f1: 0.5418
 epoch: 52, train_loss: 0.6372, test_loss: 0.9136, test_f1: 0.5289
 epoch: 53, train_loss: 0.6208, test_loss: 0.8615, test_f1: 0.5501
 epoch: 54, train_loss: 0.6163, test_loss: 0.9401, test_f1: 0.5357
 epoch: 55, train_loss: 0.6211, test_loss: 0.8765, test_f1: 0.5493
 epoch: 56, train_loss: 0.6089, test_loss: 0.9719, test_f1: 0.5237
 epoch: 57, train_loss: 0.6041, test_loss: 0.9363, test_f1: 0.5490
 epoch: 58, train_loss: 0.6035, test_loss: 0.8603, test_f1: 0.5408
 epoch: 59, train_loss: 0.6116, test_loss: 0.9095, test_f1: 0.5480
 epoch: 60, train_loss: 0.6074, test_loss: 0.9167, test_f1: 0.5531
 epoch: 61, train_loss: 0.6061, test_loss: 0.8673, test_f1: 0.5604
 epoch: 62, train_loss: 0.5961, test_loss: 0.9255, test_f1: 0.5426
 epoch: 63, train_loss: 0.6088, test_loss: 0.8666, test_f1: 0.5623
 epoch: 64, train_loss: 0.6014, test_loss: 0.9945, test_f1: 0.5336
 epoch: 65, train_loss: 0.5927, test_loss: 0.9717, test_f1: 0.5494
 epoch: 66, train_loss: 0.5989, test_loss: 0.9456, test_f1: 0.5511
 epoch: 67, train_loss: 0.6094, test_loss: 0.9548, test_f1: 0.5622
 epoch: 68, train_loss: 0.5969, test_loss: 0.9542, test_f1: 0.5568
 epoch: 69, train_loss: 0.6030, test_loss: 0.9894, test_f1: 0.5478
 epoch: 70, train_loss: 0.5930, test_loss: 0.9436, test_f1: 0.5491
 epoch: 71, train_loss: 0.5931, test_loss: 1.0151, test_f1: 0.5664
 epoch: 72, train_loss: 0.5917, test_loss: 0.9629, test_f1: 0.5381
 epoch: 73, train_loss: 0.5805, test_loss: 0.8558, test_f1: 0.5640
 epoch: 74, train_loss: 0.5796, test_loss: 0.9283, test_f1: 0.5444
 epoch: 75, train_loss: 0.5941, test_loss: 0.9237, test_f1: 0.5562
 epoch: 76, train_loss: 0.5752, test_loss: 0.9943, test_f1: 0.5544
 epoch: 77, train_loss: 0.5934, test_loss: 0.9704, test_f1: 0.5508
 epoch: 78, train_loss: 0.5918, test_loss: 0.9114, test_f1: 0.5508
 epoch: 79, train_loss: 0.5845, test_loss: 0.9947, test_f1: 0.5544
 epoch: 80, train_loss: 0.5785, test_loss: 1.0251, test_f1: 0.5442
 epoch: 81, train_loss: 0.5643, test_loss: 0.9587, test_f1: 0.5509
 epoch: 82, train_loss: 0.5683, test_loss: 1.0101, test_f1: 0.5525
 epoch: 83, train_loss: 0.5701, test_loss: 1.0178, test_f1: 0.5604
 epoch: 84, train_loss: 0.5649, test_loss: 0.9940, test_f1: 0.5503
 epoch: 85, train_loss: 0.5614, test_loss: 0.9789, test_f1: 0.5446
 epoch: 86, train_loss: 0.5699, test_loss: 1.0001, test_f1: 0.5464
 epoch: 87, train_loss: 0.5674, test_loss: 1.0157, test_f1: 0.5556
 epoch: 88, train_loss: 0.5734, test_loss: 0.8867, test_f1: 0.5490
 epoch: 89, train_loss: 0.5633, test_loss: 1.0098, test_f1: 0.5541
 epoch: 90, train_loss: 0.5604, test_loss: 0.9787, test_f1: 0.5585
 epoch: 91, train_loss: 0.5609, test_loss: 0.9335, test_f1: 0.5617
 epoch: 92, train_loss: 0.5617, test_loss: 1.0407, test_f1: 0.5566
 epoch: 93, train_loss: 0.5426, test_loss: 1.0738, test_f1: 0.5336
 epoch: 94, train_loss: 0.5566, test_loss: 1.0584, test_f1: 0.5426
 epoch: 95, train_loss: 0.5554, test_loss: 0.9312, test_f1: 0.5630
 epoch: 96, train_loss: 0.5462, test_loss: 0.9163, test_f1: 0.5624
 epoch: 97, train_loss: 0.5610, test_loss: 0.9629, test_f1: 0.5693
 epoch: 98, train_loss: 0.5370, test_loss: 0.9721, test_f1: 0.5457
 epoch: 99, train_loss: 0.5389, test_loss: 1.0125, test_f1: 0.5726
##################ITERATION #2 ****************************************
 epoch: 0, train_loss: 1.2615, test_loss: 1.2910, test_f1: 0.2260
 epoch: 1, train_loss: 1.1468, test_loss: 1.2506, test_f1: 0.2260
 epoch: 2, train_loss: 1.0833, test_loss: 1.1608, test_f1: 0.3202
 epoch: 3, train_loss: 1.0385, test_loss: 1.0823, test_f1: 0.3871
 epoch: 4, train_loss: 1.0082, test_loss: 0.9889, test_f1: 0.4709
 epoch: 5, train_loss: 0.9779, test_loss: 0.9658, test_f1: 0.4842
 epoch: 6, train_loss: 0.9596, test_loss: 0.9437, test_f1: 0.5003
 epoch: 7, train_loss: 0.9452, test_loss: 0.9576, test_f1: 0.4973
 epoch: 8, train_loss: 0.9227, test_loss: 0.9535, test_f1: 0.5066
 epoch: 9, train_loss: 0.9057, test_loss: 0.9703, test_f1: 0.5209
 epoch: 10, train_loss: 0.8823, test_loss: 0.9539, test_f1: 0.5200
 epoch: 11, train_loss: 0.8690, test_loss: 0.9647, test_f1: 0.4990
 epoch: 12, train_loss: 0.8638, test_loss: 1.0050, test_f1: 0.4937
 epoch: 13, train_loss: 0.8475, test_loss: 0.9579, test_f1: 0.5352
 epoch: 14, train_loss: 0.8270, test_loss: 0.9504, test_f1: 0.5386
 epoch: 15, train_loss: 0.8265, test_loss: 0.9304, test_f1: 0.5451
 epoch: 16, train_loss: 0.8085, test_loss: 0.9673, test_f1: 0.5270
 epoch: 17, train_loss: 0.7985, test_loss: 0.9420, test_f1: 0.5410
 epoch: 18, train_loss: 0.7992, test_loss: 0.9809, test_f1: 0.5370
 epoch: 19, train_loss: 0.7817, test_loss: 0.9357, test_f1: 0.5330
 epoch: 20, train_loss: 0.7690, test_loss: 0.9967, test_f1: 0.5347
 epoch: 21, train_loss: 0.7571, test_loss: 0.9383, test_f1: 0.5457
 epoch: 22, train_loss: 0.7522, test_loss: 0.9472, test_f1: 0.5456
 epoch: 23, train_loss: 0.7376, test_loss: 0.9997, test_f1: 0.5446
 epoch: 24, train_loss: 0.7368, test_loss: 0.9229, test_f1: 0.5509
 epoch: 25, train_loss: 0.7249, test_loss: 0.9851, test_f1: 0.5349
 epoch: 26, train_loss: 0.7247, test_loss: 1.0432, test_f1: 0.5373
 epoch: 27, train_loss: 0.7007, test_loss: 1.0411, test_f1: 0.5329
 epoch: 28, train_loss: 0.7048, test_loss: 0.9797, test_f1: 0.5630
 epoch: 29, train_loss: 0.6965, test_loss: 0.9705, test_f1: 0.5614
 epoch: 30, train_loss: 0.6869, test_loss: 1.0736, test_f1: 0.5586
 epoch: 31, train_loss: 0.6914, test_loss: 0.9841, test_f1: 0.5601
 epoch: 32, train_loss: 0.6843, test_loss: 1.0262, test_f1: 0.5513
 epoch: 33, train_loss: 0.6768, test_loss: 0.9622, test_f1: 0.5726
 epoch: 34, train_loss: 0.6514, test_loss: 1.0180, test_f1: 0.5697
 epoch: 35, train_loss: 0.6571, test_loss: 1.1674, test_f1: 0.5225
 epoch: 36, train_loss: 0.6736, test_loss: 1.0474, test_f1: 0.5405
 epoch: 37, train_loss: 0.6786, test_loss: 0.9952, test_f1: 0.5697
 epoch: 38, train_loss: 0.6581, test_loss: 1.0023, test_f1: 0.5730
 epoch: 39, train_loss: 0.6533, test_loss: 0.9721, test_f1: 0.5714
 epoch: 40, train_loss: 0.6432, test_loss: 1.0291, test_f1: 0.5737
 epoch: 41, train_loss: 0.6413, test_loss: 1.0200, test_f1: 0.5952
 epoch: 42, train_loss: 0.6406, test_loss: 0.9472, test_f1: 0.5690
 epoch: 43, train_loss: 0.6240, test_loss: 1.0465, test_f1: 0.5646
 epoch: 44, train_loss: 0.6217, test_loss: 0.9663, test_f1: 0.6200
 epoch: 45, train_loss: 0.6308, test_loss: 1.0095, test_f1: 0.5845
 epoch: 46, train_loss: 0.6104, test_loss: 1.0419, test_f1: 0.5959
 epoch: 47, train_loss: 0.6182, test_loss: 1.0501, test_f1: 0.5805
 epoch: 48, train_loss: 0.6058, test_loss: 1.0217, test_f1: 0.6171
 epoch: 49, train_loss: 0.6052, test_loss: 1.1080, test_f1: 0.5711
 epoch: 50, train_loss: 0.5973, test_loss: 1.1014, test_f1: 0.5842
 epoch: 51, train_loss: 0.5888, test_loss: 1.0074, test_f1: 0.6191
 epoch: 52, train_loss: 0.5868, test_loss: 0.9993, test_f1: 0.6076
 epoch: 53, train_loss: 0.5640, test_loss: 1.0605, test_f1: 0.6022
 epoch: 54, train_loss: 0.5602, test_loss: 1.0301, test_f1: 0.6015
 epoch: 55, train_loss: 0.5692, test_loss: 1.0607, test_f1: 0.6009
 epoch: 56, train_loss: 0.5691, test_loss: 1.0065, test_f1: 0.6148
 epoch: 57, train_loss: 0.5778, test_loss: 1.0707, test_f1: 0.5973
 epoch: 58, train_loss: 0.5480, test_loss: 1.0748, test_f1: 0.5957
 epoch: 59, train_loss: 0.5506, test_loss: 1.0924, test_f1: 0.6002
 epoch: 60, train_loss: 0.5426, test_loss: 1.0636, test_f1: 0.6053
 epoch: 61, train_loss: 0.5596, test_loss: 1.0225, test_f1: 0.6045
 epoch: 62, train_loss: 0.5550, test_loss: 1.0869, test_f1: 0.6059
 epoch: 63, train_loss: 0.5427, test_loss: 1.1017, test_f1: 0.5987
 epoch: 64, train_loss: 0.5322, test_loss: 1.0461, test_f1: 0.6015
 epoch: 65, train_loss: 0.5416, test_loss: 1.1161, test_f1: 0.5969
 epoch: 66, train_loss: 0.5414, test_loss: 1.0379, test_f1: 0.5975
 epoch: 67, train_loss: 0.5434, test_loss: 1.0710, test_f1: 0.6147
 epoch: 68, train_loss: 0.5521, test_loss: 1.0607, test_f1: 0.6131
 epoch: 69, train_loss: 0.5427, test_loss: 1.0949, test_f1: 0.6103
 epoch: 70, train_loss: 0.5213, test_loss: 1.0820, test_f1: 0.6084
 epoch: 71, train_loss: 0.5183, test_loss: 1.1954, test_f1: 0.5818
 epoch: 72, train_loss: 0.5164, test_loss: 1.1197, test_f1: 0.6086
 epoch: 73, train_loss: 0.5245, test_loss: 1.1276, test_f1: 0.6085
 epoch: 74, train_loss: 0.5197, test_loss: 1.0613, test_f1: 0.6221
 epoch: 75, train_loss: 0.5264, test_loss: 1.0776, test_f1: 0.6146
 epoch: 76, train_loss: 0.5216, test_loss: 1.1150, test_f1: 0.6008
 epoch: 77, train_loss: 0.5183, test_loss: 1.1191, test_f1: 0.6002
 epoch: 78, train_loss: 0.5265, test_loss: 1.1241, test_f1: 0.6094
 epoch: 79, train_loss: 0.5089, test_loss: 1.2201, test_f1: 0.5930
 epoch: 80, train_loss: 0.5045, test_loss: 1.1408, test_f1: 0.6002
 epoch: 81, train_loss: 0.4977, test_loss: 1.1411, test_f1: 0.6024
 epoch: 82, train_loss: 0.5103, test_loss: 1.1520, test_f1: 0.6039
 epoch: 83, train_loss: 0.5125, test_loss: 1.1973, test_f1: 0.5865
 epoch: 84, train_loss: 0.4968, test_loss: 1.0606, test_f1: 0.6115
 epoch: 85, train_loss: 0.4995, test_loss: 1.1539, test_f1: 0.6040
 epoch: 86, train_loss: 0.5006, test_loss: 1.2228, test_f1: 0.5901
 epoch: 87, train_loss: 0.4961, test_loss: 1.1452, test_f1: 0.5933
 epoch: 88, train_loss: 0.4843, test_loss: 1.1210, test_f1: 0.6052
 epoch: 89, train_loss: 0.4862, test_loss: 1.1824, test_f1: 0.6352
 epoch: 90, train_loss: 0.5000, test_loss: 1.1945, test_f1: 0.6069
 epoch: 91, train_loss: 0.4927, test_loss: 1.2426, test_f1: 0.5973
 epoch: 92, train_loss: 0.4948, test_loss: 1.2016, test_f1: 0.6012
 epoch: 93, train_loss: 0.4757, test_loss: 1.1386, test_f1: 0.6120
 epoch: 94, train_loss: 0.4774, test_loss: 1.2034, test_f1: 0.6139
 epoch: 95, train_loss: 0.4930, test_loss: 1.2183, test_f1: 0.6247
 epoch: 96, train_loss: 0.4802, test_loss: 1.2602, test_f1: 0.5973
 epoch: 97, train_loss: 0.4869, test_loss: 1.2421, test_f1: 0.6102
 epoch: 98, train_loss: 0.4842, test_loss: 1.3001, test_f1: 0.6006
 epoch: 99, train_loss: 0.4734, test_loss: 1.2173, test_f1: 0.6073
##################ITERATION #3 ****************************************
 epoch: 0, train_loss: 1.2587, test_loss: 1.3091, test_f1: 0.2260
 epoch: 1, train_loss: 1.1199, test_loss: 1.2808, test_f1: 0.2260
 epoch: 2, train_loss: 1.0622, test_loss: 1.1812, test_f1: 0.2902
 epoch: 3, train_loss: 1.0221, test_loss: 1.0579, test_f1: 0.3918
 epoch: 4, train_loss: 0.9872, test_loss: 0.9815, test_f1: 0.4732
 epoch: 5, train_loss: 0.9568, test_loss: 0.9497, test_f1: 0.4847
 epoch: 6, train_loss: 0.9319, test_loss: 0.9522, test_f1: 0.4876
 epoch: 7, train_loss: 0.9167, test_loss: 0.9216, test_f1: 0.5215
 epoch: 8, train_loss: 0.8961, test_loss: 0.9517, test_f1: 0.5081
 epoch: 9, train_loss: 0.8973, test_loss: 0.8981, test_f1: 0.5418
 epoch: 10, train_loss: 0.8770, test_loss: 0.8970, test_f1: 0.5231
 epoch: 11, train_loss: 0.8707, test_loss: 1.0101, test_f1: 0.4981
 epoch: 12, train_loss: 0.8664, test_loss: 0.9246, test_f1: 0.5270
 epoch: 13, train_loss: 0.8411, test_loss: 0.8867, test_f1: 0.5319
 epoch: 14, train_loss: 0.8292, test_loss: 0.8792, test_f1: 0.5465
 epoch: 15, train_loss: 0.8206, test_loss: 0.8853, test_f1: 0.5529
 epoch: 16, train_loss: 0.8157, test_loss: 0.9229, test_f1: 0.5358
 epoch: 17, train_loss: 0.8103, test_loss: 0.9028, test_f1: 0.5265
 epoch: 18, train_loss: 0.7972, test_loss: 0.8848, test_f1: 0.5338
 epoch: 19, train_loss: 0.8011, test_loss: 0.9234, test_f1: 0.5302
 epoch: 20, train_loss: 0.7886, test_loss: 0.8684, test_f1: 0.5221
 epoch: 21, train_loss: 0.7783, test_loss: 0.9276, test_f1: 0.5359
 epoch: 22, train_loss: 0.7686, test_loss: 0.9253, test_f1: 0.5526
 epoch: 23, train_loss: 0.7591, test_loss: 0.9559, test_f1: 0.5372
 epoch: 24, train_loss: 0.7590, test_loss: 0.8697, test_f1: 0.5642
 epoch: 25, train_loss: 0.7521, test_loss: 0.9472, test_f1: 0.5353
 epoch: 26, train_loss: 0.7447, test_loss: 0.9102, test_f1: 0.5649
 epoch: 27, train_loss: 0.7383, test_loss: 0.9247, test_f1: 0.5263
 epoch: 28, train_loss: 0.7311, test_loss: 0.9065, test_f1: 0.5358
 epoch: 29, train_loss: 0.7259, test_loss: 0.9306, test_f1: 0.5395
 epoch: 30, train_loss: 0.7225, test_loss: 0.9166, test_f1: 0.5379
 epoch: 31, train_loss: 0.7128, test_loss: 0.9707, test_f1: 0.5572
 epoch: 32, train_loss: 0.7096, test_loss: 0.8862, test_f1: 0.5735
 epoch: 33, train_loss: 0.6995, test_loss: 0.9791, test_f1: 0.5258
 epoch: 34, train_loss: 0.6911, test_loss: 0.9096, test_f1: 0.5663
 epoch: 35, train_loss: 0.6763, test_loss: 0.8888, test_f1: 0.5667
 epoch: 36, train_loss: 0.6795, test_loss: 0.9375, test_f1: 0.5599
 epoch: 37, train_loss: 0.6684, test_loss: 1.0118, test_f1: 0.5313
 epoch: 38, train_loss: 0.6892, test_loss: 0.9341, test_f1: 0.5815
 epoch: 39, train_loss: 0.6930, test_loss: 0.8999, test_f1: 0.5647
 epoch: 40, train_loss: 0.7005, test_loss: 0.8411, test_f1: 0.6008
 epoch: 41, train_loss: 0.6681, test_loss: 0.9148, test_f1: 0.5732
 epoch: 42, train_loss: 0.6629, test_loss: 0.9081, test_f1: 0.5779
 epoch: 43, train_loss: 0.6526, test_loss: 0.9688, test_f1: 0.5434
 epoch: 44, train_loss: 0.6550, test_loss: 0.8897, test_f1: 0.5889
 epoch: 45, train_loss: 0.6463, test_loss: 0.9723, test_f1: 0.5482
 epoch: 46, train_loss: 0.6480, test_loss: 0.9213, test_f1: 0.5646
 epoch: 47, train_loss: 0.6287, test_loss: 0.9239, test_f1: 0.5714
 epoch: 48, train_loss: 0.6198, test_loss: 0.9278, test_f1: 0.5709
 epoch: 49, train_loss: 0.6364, test_loss: 0.9044, test_f1: 0.5862
 epoch: 50, train_loss: 0.6248, test_loss: 1.0436, test_f1: 0.5711
 epoch: 51, train_loss: 0.6053, test_loss: 0.9436, test_f1: 0.5693
 epoch: 52, train_loss: 0.6111, test_loss: 0.9251, test_f1: 0.5724
 epoch: 53, train_loss: 0.6078, test_loss: 0.9671, test_f1: 0.5548
 epoch: 54, train_loss: 0.5915, test_loss: 0.9348, test_f1: 0.5746
 epoch: 55, train_loss: 0.5775, test_loss: 0.9289, test_f1: 0.5775
 epoch: 56, train_loss: 0.5872, test_loss: 0.9721, test_f1: 0.5778
 epoch: 57, train_loss: 0.5665, test_loss: 0.9674, test_f1: 0.5796
 epoch: 58, train_loss: 0.5707, test_loss: 0.9508, test_f1: 0.5821
 epoch: 59, train_loss: 0.5787, test_loss: 0.9745, test_f1: 0.5728
 epoch: 60, train_loss: 0.5680, test_loss: 0.9850, test_f1: 0.5747
 epoch: 61, train_loss: 0.5734, test_loss: 0.9627, test_f1: 0.5867
 epoch: 62, train_loss: 0.5651, test_loss: 0.9696, test_f1: 0.5740
 epoch: 63, train_loss: 0.5684, test_loss: 1.0049, test_f1: 0.5685
 epoch: 64, train_loss: 0.5788, test_loss: 1.0342, test_f1: 0.5769
 epoch: 65, train_loss: 0.5608, test_loss: 0.9213, test_f1: 0.5981
 epoch: 66, train_loss: 0.5714, test_loss: 0.9494, test_f1: 0.5957
 epoch: 67, train_loss: 0.5571, test_loss: 0.9841, test_f1: 0.6015
 epoch: 68, train_loss: 0.5742, test_loss: 0.9675, test_f1: 0.5890
 epoch: 69, train_loss: 0.5653, test_loss: 0.9453, test_f1: 0.5956
 epoch: 70, train_loss: 0.5551, test_loss: 0.9620, test_f1: 0.6030
 epoch: 71, train_loss: 0.5430, test_loss: 0.9851, test_f1: 0.5921
 epoch: 72, train_loss: 0.5485, test_loss: 0.9973, test_f1: 0.5923
 epoch: 73, train_loss: 0.5537, test_loss: 0.9686, test_f1: 0.6026
 epoch: 74, train_loss: 0.5565, test_loss: 0.9269, test_f1: 0.6115
 epoch: 75, train_loss: 0.5519, test_loss: 1.0485, test_f1: 0.5892
 epoch: 76, train_loss: 0.5454, test_loss: 0.9733, test_f1: 0.6004
 epoch: 77, train_loss: 0.5381, test_loss: 0.9645, test_f1: 0.5954
 epoch: 78, train_loss: 0.5402, test_loss: 1.0060, test_f1: 0.5754
 epoch: 79, train_loss: 0.5405, test_loss: 1.0219, test_f1: 0.5825
 epoch: 80, train_loss: 0.5402, test_loss: 1.0185, test_f1: 0.5770
 epoch: 81, train_loss: 0.5382, test_loss: 0.9710, test_f1: 0.5835
 epoch: 82, train_loss: 0.5372, test_loss: 1.0844, test_f1: 0.5633
 epoch: 83, train_loss: 0.5275, test_loss: 0.9881, test_f1: 0.5861
 epoch: 84, train_loss: 0.5397, test_loss: 1.0261, test_f1: 0.5683
 epoch: 85, train_loss: 0.5268, test_loss: 1.0512, test_f1: 0.5784
 epoch: 86, train_loss: 0.5334, test_loss: 1.0301, test_f1: 0.6149
 epoch: 87, train_loss: 0.5266, test_loss: 1.0205, test_f1: 0.5874
 epoch: 88, train_loss: 0.5247, test_loss: 1.0238, test_f1: 0.5893
 epoch: 89, train_loss: 0.5187, test_loss: 1.0125, test_f1: 0.6006
 epoch: 90, train_loss: 0.5114, test_loss: 1.0744, test_f1: 0.5790
 epoch: 91, train_loss: 0.5150, test_loss: 1.0757, test_f1: 0.5799
 epoch: 92, train_loss: 0.5264, test_loss: 1.0915, test_f1: 0.5734
 epoch: 93, train_loss: 0.5135, test_loss: 1.0352, test_f1: 0.5997
 epoch: 94, train_loss: 0.5311, test_loss: 1.0218, test_f1: 0.5948
 epoch: 95, train_loss: 0.5113, test_loss: 1.0803, test_f1: 0.5681
 epoch: 96, train_loss: 0.5041, test_loss: 1.0931, test_f1: 0.5817
 epoch: 97, train_loss: 0.5071, test_loss: 1.0078, test_f1: 0.5941
 epoch: 98, train_loss: 0.5090, test_loss: 1.0011, test_f1: 0.6070
 epoch: 99, train_loss: 0.5043, test_loss: 1.0979, test_f1: 0.6134
##################ITERATION #4 ****************************************
 epoch: 0, train_loss: 1.2294, test_loss: 1.3219, test_f1: 0.2260
 epoch: 1, train_loss: 1.1079, test_loss: 1.3230, test_f1: 0.2260
 epoch: 2, train_loss: 1.0606, test_loss: 1.1367, test_f1: 0.3238
 epoch: 3, train_loss: 1.0467, test_loss: 1.1193, test_f1: 0.3408
 epoch: 4, train_loss: 1.0195, test_loss: 1.0634, test_f1: 0.4428
 epoch: 5, train_loss: 0.9951, test_loss: 1.0281, test_f1: 0.4936
 epoch: 6, train_loss: 0.9757, test_loss: 0.9960, test_f1: 0.5005
 epoch: 7, train_loss: 0.9508, test_loss: 1.0035, test_f1: 0.4957
 epoch: 8, train_loss: 0.9476, test_loss: 0.9652, test_f1: 0.5257
 epoch: 9, train_loss: 0.9252, test_loss: 0.9619, test_f1: 0.5260
 epoch: 10, train_loss: 0.9149, test_loss: 0.9493, test_f1: 0.5230
 epoch: 11, train_loss: 0.8906, test_loss: 0.9324, test_f1: 0.5319
 epoch: 12, train_loss: 0.8871, test_loss: 0.9236, test_f1: 0.5527
 epoch: 13, train_loss: 0.8655, test_loss: 0.9396, test_f1: 0.5365
 epoch: 14, train_loss: 0.8627, test_loss: 0.9243, test_f1: 0.5215
 epoch: 15, train_loss: 0.8620, test_loss: 0.8928, test_f1: 0.5424
 epoch: 16, train_loss: 0.8381, test_loss: 1.0207, test_f1: 0.5203
 epoch: 17, train_loss: 0.8396, test_loss: 0.9242, test_f1: 0.5427
 epoch: 18, train_loss: 0.8267, test_loss: 0.8652, test_f1: 0.5298
 epoch: 19, train_loss: 0.8118, test_loss: 0.9180, test_f1: 0.5473
 epoch: 20, train_loss: 0.8040, test_loss: 0.8627, test_f1: 0.5566
 epoch: 21, train_loss: 0.7919, test_loss: 0.9083, test_f1: 0.5546
 epoch: 22, train_loss: 0.7939, test_loss: 0.8994, test_f1: 0.5663
 epoch: 23, train_loss: 0.7674, test_loss: 0.9422, test_f1: 0.5469
 epoch: 24, train_loss: 0.7715, test_loss: 0.8965, test_f1: 0.5605
 epoch: 25, train_loss: 0.7773, test_loss: 0.9257, test_f1: 0.5484
 epoch: 26, train_loss: 0.7589, test_loss: 0.9029, test_f1: 0.5477
 epoch: 27, train_loss: 0.7446, test_loss: 0.8794, test_f1: 0.5498
 epoch: 28, train_loss: 0.7581, test_loss: 0.9775, test_f1: 0.5442
 epoch: 29, train_loss: 0.7559, test_loss: 0.8972, test_f1: 0.5588
 epoch: 30, train_loss: 0.7485, test_loss: 0.9202, test_f1: 0.5285
 epoch: 31, train_loss: 0.7259, test_loss: 0.8697, test_f1: 0.5404
 epoch: 32, train_loss: 0.7312, test_loss: 1.0161, test_f1: 0.5357
 epoch: 33, train_loss: 0.7277, test_loss: 0.9524, test_f1: 0.5187
 epoch: 34, train_loss: 0.7313, test_loss: 0.8501, test_f1: 0.5524
 epoch: 35, train_loss: 0.7279, test_loss: 0.9592, test_f1: 0.5346
 epoch: 36, train_loss: 0.7152, test_loss: 0.9262, test_f1: 0.5306
 epoch: 37, train_loss: 0.7042, test_loss: 0.9696, test_f1: 0.5360
 epoch: 38, train_loss: 0.6988, test_loss: 0.9391, test_f1: 0.5539
 epoch: 39, train_loss: 0.6872, test_loss: 0.9169, test_f1: 0.5529
 epoch: 40, train_loss: 0.6860, test_loss: 0.9321, test_f1: 0.5494
 epoch: 41, train_loss: 0.6898, test_loss: 0.9905, test_f1: 0.5499
 epoch: 42, train_loss: 0.7026, test_loss: 0.9327, test_f1: 0.5464
 epoch: 43, train_loss: 0.6854, test_loss: 0.9364, test_f1: 0.5361
 epoch: 44, train_loss: 0.6791, test_loss: 0.9498, test_f1: 0.5619
 epoch: 45, train_loss: 0.6815, test_loss: 0.8782, test_f1: 0.5608
 epoch: 46, train_loss: 0.6725, test_loss: 0.9821, test_f1: 0.5527
 epoch: 47, train_loss: 0.6742, test_loss: 0.9501, test_f1: 0.5402
 epoch: 48, train_loss: 0.6680, test_loss: 0.9501, test_f1: 0.5488
 epoch: 49, train_loss: 0.6592, test_loss: 0.9516, test_f1: 0.5287
 epoch: 50, train_loss: 0.6601, test_loss: 0.8979, test_f1: 0.5550
 epoch: 51, train_loss: 0.6478, test_loss: 0.9191, test_f1: 0.5363
 epoch: 52, train_loss: 0.6405, test_loss: 0.9465, test_f1: 0.5543
 epoch: 53, train_loss: 0.6400, test_loss: 0.9300, test_f1: 0.5495
 epoch: 54, train_loss: 0.6306, test_loss: 0.9906, test_f1: 0.5368
 epoch: 55, train_loss: 0.6227, test_loss: 0.9326, test_f1: 0.5388
 epoch: 56, train_loss: 0.6381, test_loss: 0.9493, test_f1: 0.5336
 epoch: 57, train_loss: 0.6200, test_loss: 0.9747, test_f1: 0.5385
 epoch: 58, train_loss: 0.6293, test_loss: 0.9364, test_f1: 0.5583
 epoch: 59, train_loss: 0.6141, test_loss: 0.9553, test_f1: 0.5548
 epoch: 60, train_loss: 0.6182, test_loss: 0.9424, test_f1: 0.5486
 epoch: 61, train_loss: 0.6119, test_loss: 0.9723, test_f1: 0.5461
 epoch: 62, train_loss: 0.6245, test_loss: 0.9844, test_f1: 0.5556
 epoch: 63, train_loss: 0.6115, test_loss: 0.9788, test_f1: 0.5445
 epoch: 64, train_loss: 0.6161, test_loss: 0.9204, test_f1: 0.5614
 epoch: 65, train_loss: 0.6224, test_loss: 0.9860, test_f1: 0.5543
 epoch: 66, train_loss: 0.6095, test_loss: 0.9269, test_f1: 0.5509
 epoch: 67, train_loss: 0.6091, test_loss: 0.9709, test_f1: 0.5453
 epoch: 68, train_loss: 0.6116, test_loss: 0.9844, test_f1: 0.5469
 epoch: 69, train_loss: 0.6119, test_loss: 0.9440, test_f1: 0.5571
 epoch: 70, train_loss: 0.6203, test_loss: 0.9593, test_f1: 0.5626
 epoch: 71, train_loss: 0.6064, test_loss: 0.9582, test_f1: 0.5555
 epoch: 72, train_loss: 0.6125, test_loss: 0.9538, test_f1: 0.5593
 epoch: 73, train_loss: 0.6023, test_loss: 0.9652, test_f1: 0.5517
 epoch: 74, train_loss: 0.6024, test_loss: 0.9496, test_f1: 0.5647
 epoch: 75, train_loss: 0.5942, test_loss: 0.9651, test_f1: 0.5697
 epoch: 76, train_loss: 0.5795, test_loss: 0.9602, test_f1: 0.5633
 epoch: 77, train_loss: 0.5865, test_loss: 0.9755, test_f1: 0.5563
 epoch: 78, train_loss: 0.5825, test_loss: 0.9643, test_f1: 0.5633
 epoch: 79, train_loss: 0.5858, test_loss: 0.9587, test_f1: 0.5736
 epoch: 80, train_loss: 0.5865, test_loss: 0.9443, test_f1: 0.5635
 epoch: 81, train_loss: 0.5830, test_loss: 1.0015, test_f1: 0.5781
 epoch: 82, train_loss: 0.5763, test_loss: 0.9839, test_f1: 0.5622
 epoch: 83, train_loss: 0.5856, test_loss: 0.9445, test_f1: 0.5630
 epoch: 84, train_loss: 0.5763, test_loss: 0.9638, test_f1: 0.5897
 epoch: 85, train_loss: 0.5713, test_loss: 0.9852, test_f1: 0.5706
 epoch: 86, train_loss: 0.5931, test_loss: 0.9782, test_f1: 0.5685
 epoch: 87, train_loss: 0.5976, test_loss: 0.9663, test_f1: 0.5740
 epoch: 88, train_loss: 0.5985, test_loss: 0.9728, test_f1: 0.5758
 epoch: 89, train_loss: 0.5707, test_loss: 0.9615, test_f1: 0.5911
 epoch: 90, train_loss: 0.5715, test_loss: 0.9772, test_f1: 0.5843
 epoch: 91, train_loss: 0.5669, test_loss: 0.9970, test_f1: 0.5864
 epoch: 92, train_loss: 0.5713, test_loss: 0.9704, test_f1: 0.5999
 epoch: 93, train_loss: 0.5847, test_loss: 0.9628, test_f1: 0.5617
 epoch: 94, train_loss: 0.5787, test_loss: 0.9629, test_f1: 0.5939
 epoch: 95, train_loss: 0.5653, test_loss: 0.9572, test_f1: 0.5845
 epoch: 96, train_loss: 0.5621, test_loss: 0.9790, test_f1: 0.5790
 epoch: 97, train_loss: 0.5556, test_loss: 0.9785, test_f1: 0.5697
 epoch: 98, train_loss: 0.5711, test_loss: 0.9823, test_f1: 0.5726
 epoch: 99, train_loss: 0.5745, test_loss: 1.0078, test_f1: 0.5936
##################ITERATION #5 ****************************************
 epoch: 0, train_loss: 1.2608, test_loss: 1.3167, test_f1: 0.2260
 epoch: 1, train_loss: 1.0967, test_loss: 1.2901, test_f1: 0.2918
 epoch: 2, train_loss: 1.0499, test_loss: 1.4584, test_f1: 0.2651
 epoch: 3, train_loss: 1.0088, test_loss: 1.2452, test_f1: 0.3280
 epoch: 4, train_loss: 0.9848, test_loss: 1.0975, test_f1: 0.3713
 epoch: 5, train_loss: 0.9559, test_loss: 0.9738, test_f1: 0.4407
 epoch: 6, train_loss: 0.9400, test_loss: 0.9672, test_f1: 0.4871
 epoch: 7, train_loss: 0.9158, test_loss: 0.9650, test_f1: 0.5066
 epoch: 8, train_loss: 0.9133, test_loss: 0.9565, test_f1: 0.5018
 epoch: 9, train_loss: 0.9063, test_loss: 0.9601, test_f1: 0.4905
 epoch: 10, train_loss: 0.8757, test_loss: 0.9688, test_f1: 0.5023
 epoch: 11, train_loss: 0.8562, test_loss: 0.9735, test_f1: 0.5135
 epoch: 12, train_loss: 0.8502, test_loss: 0.9721, test_f1: 0.5268
 epoch: 13, train_loss: 0.8476, test_loss: 0.9717, test_f1: 0.5121
 epoch: 14, train_loss: 0.8291, test_loss: 0.9849, test_f1: 0.5224
 epoch: 15, train_loss: 0.8149, test_loss: 0.9756, test_f1: 0.5496
 epoch: 16, train_loss: 0.8202, test_loss: 0.9799, test_f1: 0.5325
 epoch: 17, train_loss: 0.8076, test_loss: 0.9438, test_f1: 0.5439
 epoch: 18, train_loss: 0.7960, test_loss: 0.9906, test_f1: 0.5382
 epoch: 19, train_loss: 0.7998, test_loss: 1.0184, test_f1: 0.5304
 epoch: 20, train_loss: 0.7951, test_loss: 0.9726, test_f1: 0.5385
 epoch: 21, train_loss: 0.7798, test_loss: 1.0083, test_f1: 0.5070
 epoch: 22, train_loss: 0.7690, test_loss: 1.0042, test_f1: 0.5393
 epoch: 23, train_loss: 0.7716, test_loss: 1.1082, test_f1: 0.5532
 epoch: 24, train_loss: 0.7582, test_loss: 1.0503, test_f1: 0.5405
 epoch: 25, train_loss: 0.7453, test_loss: 0.9924, test_f1: 0.5653
 epoch: 26, train_loss: 0.7528, test_loss: 1.0157, test_f1: 0.5650
 epoch: 27, train_loss: 0.7582, test_loss: 1.0278, test_f1: 0.5522
 epoch: 28, train_loss: 0.7341, test_loss: 1.0317, test_f1: 0.5582
 epoch: 29, train_loss: 0.7185, test_loss: 1.0651, test_f1: 0.5829
 epoch: 30, train_loss: 0.7189, test_loss: 1.0607, test_f1: 0.5573
 epoch: 31, train_loss: 0.7093, test_loss: 1.0235, test_f1: 0.5726
 epoch: 32, train_loss: 0.7080, test_loss: 1.1137, test_f1: 0.5457
 epoch: 33, train_loss: 0.6984, test_loss: 1.0948, test_f1: 0.5551
 epoch: 34, train_loss: 0.6977, test_loss: 1.0550, test_f1: 0.5835
 epoch: 35, train_loss: 0.6854, test_loss: 1.0574, test_f1: 0.5726
 epoch: 36, train_loss: 0.6987, test_loss: 1.0687, test_f1: 0.5995
 epoch: 37, train_loss: 0.6763, test_loss: 1.0832, test_f1: 0.5534
 epoch: 38, train_loss: 0.6764, test_loss: 1.0943, test_f1: 0.5709
 epoch: 39, train_loss: 0.6716, test_loss: 1.0660, test_f1: 0.5879
 epoch: 40, train_loss: 0.6799, test_loss: 1.1267, test_f1: 0.5515
 epoch: 41, train_loss: 0.6616, test_loss: 1.0029, test_f1: 0.6100
 epoch: 42, train_loss: 0.6560, test_loss: 1.1904, test_f1: 0.5242
 epoch: 43, train_loss: 0.6559, test_loss: 1.1186, test_f1: 0.5668
 epoch: 44, train_loss: 0.6499, test_loss: 1.1250, test_f1: 0.5720
 epoch: 45, train_loss: 0.6322, test_loss: 1.1500, test_f1: 0.5540
 epoch: 46, train_loss: 0.6369, test_loss: 1.1781, test_f1: 0.5490
 epoch: 47, train_loss: 0.6325, test_loss: 1.0423, test_f1: 0.5857
 epoch: 48, train_loss: 0.6381, test_loss: 1.1184, test_f1: 0.5750
 epoch: 49, train_loss: 0.6579, test_loss: 1.2392, test_f1: 0.5433
 epoch: 50, train_loss: 0.6808, test_loss: 1.1018, test_f1: 0.5672
 epoch: 51, train_loss: 0.6245, test_loss: 1.0758, test_f1: 0.5737
 epoch: 52, train_loss: 0.6247, test_loss: 1.0961, test_f1: 0.5914
 epoch: 53, train_loss: 0.6092, test_loss: 1.1036, test_f1: 0.5849
 epoch: 54, train_loss: 0.5994, test_loss: 1.1244, test_f1: 0.5794
 epoch: 55, train_loss: 0.5980, test_loss: 1.1533, test_f1: 0.5908
 epoch: 56, train_loss: 0.5949, test_loss: 1.0989, test_f1: 0.5893
 epoch: 57, train_loss: 0.5876, test_loss: 1.1063, test_f1: 0.6060
 epoch: 58, train_loss: 0.5859, test_loss: 1.1226, test_f1: 0.5868
 epoch: 59, train_loss: 0.5933, test_loss: 1.1308, test_f1: 0.5697
 epoch: 60, train_loss: 0.5879, test_loss: 1.1365, test_f1: 0.5652
 epoch: 61, train_loss: 0.5794, test_loss: 1.1348, test_f1: 0.5994
 epoch: 62, train_loss: 0.5738, test_loss: 1.1738, test_f1: 0.5837
 epoch: 63, train_loss: 0.5748, test_loss: 1.1407, test_f1: 0.5928
 epoch: 64, train_loss: 0.5769, test_loss: 1.1843, test_f1: 0.5502
 epoch: 65, train_loss: 0.5759, test_loss: 1.1101, test_f1: 0.5911
 epoch: 66, train_loss: 0.5741, test_loss: 1.1854, test_f1: 0.5785
 epoch: 67, train_loss: 0.5727, test_loss: 1.1502, test_f1: 0.5857
 epoch: 68, train_loss: 0.5690, test_loss: 1.2287, test_f1: 0.5614
 epoch: 69, train_loss: 0.5563, test_loss: 1.2193, test_f1: 0.5681
 epoch: 70, train_loss: 0.5664, test_loss: 1.2377, test_f1: 0.5591
 epoch: 71, train_loss: 0.5571, test_loss: 1.1730, test_f1: 0.5907
 epoch: 72, train_loss: 0.5528, test_loss: 1.2106, test_f1: 0.5941
 epoch: 73, train_loss: 0.5433, test_loss: 1.2091, test_f1: 0.5896
 epoch: 74, train_loss: 0.5587, test_loss: 1.2616, test_f1: 0.5791
 epoch: 75, train_loss: 0.5513, test_loss: 1.2737, test_f1: 0.5797
 epoch: 76, train_loss: 0.5577, test_loss: 1.1984, test_f1: 0.5913
 epoch: 77, train_loss: 0.5472, test_loss: 1.1707, test_f1: 0.5720
 epoch: 78, train_loss: 0.5351, test_loss: 1.1630, test_f1: 0.5934
 epoch: 79, train_loss: 0.5375, test_loss: 1.1238, test_f1: 0.5974
 epoch: 80, train_loss: 0.5362, test_loss: 1.2204, test_f1: 0.5912
 epoch: 81, train_loss: 0.5346, test_loss: 1.1799, test_f1: 0.5979
 epoch: 82, train_loss: 0.5264, test_loss: 1.1659, test_f1: 0.6070
 epoch: 83, train_loss: 0.5183, test_loss: 1.2052, test_f1: 0.6068
 epoch: 84, train_loss: 0.5270, test_loss: 1.2099, test_f1: 0.5946
 epoch: 85, train_loss: 0.5110, test_loss: 1.2079, test_f1: 0.5847
 epoch: 86, train_loss: 0.5153, test_loss: 1.2067, test_f1: 0.5711
 epoch: 87, train_loss: 0.5115, test_loss: 1.2890, test_f1: 0.5906
 epoch: 88, train_loss: 0.5193, test_loss: 1.1956, test_f1: 0.6015
 epoch: 89, train_loss: 0.5050, test_loss: 1.2611, test_f1: 0.5972
 epoch: 90, train_loss: 0.5170, test_loss: 1.2595, test_f1: 0.5830
 epoch: 91, train_loss: 0.5026, test_loss: 1.2163, test_f1: 0.5894
 epoch: 92, train_loss: 0.5223, test_loss: 1.2896, test_f1: 0.5726
 epoch: 93, train_loss: 0.5023, test_loss: 1.2615, test_f1: 0.5734
 epoch: 94, train_loss: 0.4980, test_loss: 1.2217, test_f1: 0.5902
 epoch: 95, train_loss: 0.5050, test_loss: 1.2103, test_f1: 0.6172
 epoch: 96, train_loss: 0.5012, test_loss: 1.2373, test_f1: 0.5853
 epoch: 97, train_loss: 0.4900, test_loss: 1.3432, test_f1: 0.5767
 epoch: 98, train_loss: 0.5057, test_loss: 1.2909, test_f1: 0.5910
 epoch: 99, train_loss: 0.4953, test_loss: 1.1885, test_f1: 0.6132
##################ITERATION #6 ****************************************
 epoch: 0, train_loss: 1.4261, test_loss: 1.4084, test_f1: 0.2260
 epoch: 1, train_loss: 1.1623, test_loss: 1.3778, test_f1: 0.2264
 epoch: 2, train_loss: 1.0977, test_loss: 1.3680, test_f1: 0.2737
 epoch: 3, train_loss: 1.0651, test_loss: 1.1512, test_f1: 0.3626
 epoch: 4, train_loss: 1.0398, test_loss: 1.0185, test_f1: 0.4312
 epoch: 5, train_loss: 1.0227, test_loss: 1.0022, test_f1: 0.4956
 epoch: 6, train_loss: 1.0053, test_loss: 1.0025, test_f1: 0.4563
 epoch: 7, train_loss: 0.9909, test_loss: 0.9869, test_f1: 0.4827
 epoch: 8, train_loss: 0.9762, test_loss: 0.9905, test_f1: 0.4991
 epoch: 9, train_loss: 0.9568, test_loss: 0.9832, test_f1: 0.5248
 epoch: 10, train_loss: 0.9397, test_loss: 0.9531, test_f1: 0.5221
 epoch: 11, train_loss: 0.9326, test_loss: 0.9579, test_f1: 0.4859
 epoch: 12, train_loss: 0.9281, test_loss: 0.9332, test_f1: 0.5172
 epoch: 13, train_loss: 0.9007, test_loss: 0.9397, test_f1: 0.5359
 epoch: 14, train_loss: 0.8965, test_loss: 0.9383, test_f1: 0.5161
 epoch: 15, train_loss: 0.8771, test_loss: 0.9268, test_f1: 0.5298
 epoch: 16, train_loss: 0.8708, test_loss: 0.9308, test_f1: 0.5296
 epoch: 17, train_loss: 0.8694, test_loss: 0.9994, test_f1: 0.5111
 epoch: 18, train_loss: 0.8660, test_loss: 0.9598, test_f1: 0.5172
 epoch: 19, train_loss: 0.8523, test_loss: 0.9142, test_f1: 0.5496
 epoch: 20, train_loss: 0.8358, test_loss: 0.8888, test_f1: 0.5707
 epoch: 21, train_loss: 0.8311, test_loss: 0.9159, test_f1: 0.5450
 epoch: 22, train_loss: 0.8313, test_loss: 0.8908, test_f1: 0.5681
 epoch: 23, train_loss: 0.8169, test_loss: 0.9078, test_f1: 0.5650
 epoch: 24, train_loss: 0.8127, test_loss: 0.9242, test_f1: 0.5717
 epoch: 25, train_loss: 0.8027, test_loss: 0.9214, test_f1: 0.5573
 epoch: 26, train_loss: 0.7918, test_loss: 0.9123, test_f1: 0.5585
 epoch: 27, train_loss: 0.7948, test_loss: 0.8748, test_f1: 0.5708
 epoch: 28, train_loss: 0.7973, test_loss: 0.9354, test_f1: 0.5550
 epoch: 29, train_loss: 0.7894, test_loss: 0.8858, test_f1: 0.5787
 epoch: 30, train_loss: 0.7754, test_loss: 0.9013, test_f1: 0.5823
 epoch: 31, train_loss: 0.7739, test_loss: 0.9195, test_f1: 0.5701
 epoch: 32, train_loss: 0.7539, test_loss: 0.8940, test_f1: 0.5629
 epoch: 33, train_loss: 0.7491, test_loss: 0.9278, test_f1: 0.5562
 epoch: 34, train_loss: 0.7457, test_loss: 0.9419, test_f1: 0.5521
 epoch: 35, train_loss: 0.7335, test_loss: 0.9266, test_f1: 0.5685
 epoch: 36, train_loss: 0.7125, test_loss: 0.8742, test_f1: 0.5741
 epoch: 37, train_loss: 0.7242, test_loss: 0.9610, test_f1: 0.5328
 epoch: 38, train_loss: 0.7175, test_loss: 0.9011, test_f1: 0.5801
 epoch: 39, train_loss: 0.7196, test_loss: 0.9859, test_f1: 0.5576
 epoch: 40, train_loss: 0.7105, test_loss: 0.8732, test_f1: 0.5962
 epoch: 41, train_loss: 0.7054, test_loss: 1.0020, test_f1: 0.5211
 epoch: 42, train_loss: 0.7006, test_loss: 0.9107, test_f1: 0.5952
 epoch: 43, train_loss: 0.7137, test_loss: 0.9269, test_f1: 0.5387
 epoch: 44, train_loss: 0.6870, test_loss: 0.9417, test_f1: 0.5648
 epoch: 45, train_loss: 0.6934, test_loss: 0.8963, test_f1: 0.5925
 epoch: 46, train_loss: 0.6779, test_loss: 0.9624, test_f1: 0.5397
 epoch: 47, train_loss: 0.6835, test_loss: 0.8388, test_f1: 0.5875
 epoch: 48, train_loss: 0.6778, test_loss: 0.9170, test_f1: 0.5665
 epoch: 49, train_loss: 0.6662, test_loss: 0.9594, test_f1: 0.5823
 epoch: 50, train_loss: 0.6759, test_loss: 0.8982, test_f1: 0.5919
 epoch: 51, train_loss: 0.6570, test_loss: 0.9060, test_f1: 0.5766
 epoch: 52, train_loss: 0.6386, test_loss: 0.9288, test_f1: 0.5439
 epoch: 53, train_loss: 0.6246, test_loss: 0.9052, test_f1: 0.5891
 epoch: 54, train_loss: 0.6403, test_loss: 0.9353, test_f1: 0.5758
 epoch: 55, train_loss: 0.6295, test_loss: 0.8892, test_f1: 0.5839
 epoch: 56, train_loss: 0.6161, test_loss: 0.8964, test_f1: 0.5900
 epoch: 57, train_loss: 0.6205, test_loss: 0.9116, test_f1: 0.5745
 epoch: 58, train_loss: 0.6142, test_loss: 0.8800, test_f1: 0.5735
 epoch: 59, train_loss: 0.6107, test_loss: 0.9170, test_f1: 0.5710
 epoch: 60, train_loss: 0.6181, test_loss: 0.9377, test_f1: 0.5736
 epoch: 61, train_loss: 0.6029, test_loss: 0.9295, test_f1: 0.5820
 epoch: 62, train_loss: 0.6023, test_loss: 0.9661, test_f1: 0.5789
 epoch: 63, train_loss: 0.6091, test_loss: 0.9131, test_f1: 0.5754
 epoch: 64, train_loss: 0.6047, test_loss: 0.9251, test_f1: 0.5971
 epoch: 65, train_loss: 0.6031, test_loss: 0.9549, test_f1: 0.6129
 epoch: 66, train_loss: 0.5888, test_loss: 0.9223, test_f1: 0.5921
 epoch: 67, train_loss: 0.6024, test_loss: 0.9682, test_f1: 0.5640
 epoch: 68, train_loss: 0.5921, test_loss: 0.9694, test_f1: 0.5820
 epoch: 69, train_loss: 0.5944, test_loss: 0.9716, test_f1: 0.5743
 epoch: 70, train_loss: 0.5937, test_loss: 0.9570, test_f1: 0.6081
 epoch: 71, train_loss: 0.5863, test_loss: 0.9082, test_f1: 0.5779
 epoch: 72, train_loss: 0.5889, test_loss: 0.9582, test_f1: 0.6022
 epoch: 73, train_loss: 0.5845, test_loss: 0.9353, test_f1: 0.6054
 epoch: 74, train_loss: 0.5853, test_loss: 0.9199, test_f1: 0.5777
 epoch: 75, train_loss: 0.5711, test_loss: 0.9378, test_f1: 0.6275
 epoch: 76, train_loss: 0.5603, test_loss: 0.9399, test_f1: 0.5887
 epoch: 77, train_loss: 0.5664, test_loss: 0.9588, test_f1: 0.5851
 epoch: 78, train_loss: 0.5650, test_loss: 0.9936, test_f1: 0.5979
 epoch: 79, train_loss: 0.5582, test_loss: 0.9737, test_f1: 0.6106
 epoch: 80, train_loss: 0.5636, test_loss: 0.9535, test_f1: 0.6010
 epoch: 81, train_loss: 0.5692, test_loss: 0.9635, test_f1: 0.5917
 epoch: 82, train_loss: 0.5595, test_loss: 0.9549, test_f1: 0.6010
 epoch: 83, train_loss: 0.5655, test_loss: 0.9973, test_f1: 0.6067
 epoch: 84, train_loss: 0.5569, test_loss: 0.9989, test_f1: 0.5801
 epoch: 85, train_loss: 0.5410, test_loss: 0.9513, test_f1: 0.6063
 epoch: 86, train_loss: 0.5487, test_loss: 0.9907, test_f1: 0.6287
 epoch: 87, train_loss: 0.5478, test_loss: 0.9557, test_f1: 0.6080
 epoch: 88, train_loss: 0.5404, test_loss: 0.9289, test_f1: 0.6192
 epoch: 89, train_loss: 0.5519, test_loss: 0.9735, test_f1: 0.6126
 epoch: 90, train_loss: 0.5253, test_loss: 0.9884, test_f1: 0.5917
 epoch: 91, train_loss: 0.5418, test_loss: 0.9980, test_f1: 0.5928
 epoch: 92, train_loss: 0.5392, test_loss: 0.9498, test_f1: 0.6285
 epoch: 93, train_loss: 0.5272, test_loss: 0.9951, test_f1: 0.6184
 epoch: 94, train_loss: 0.5303, test_loss: 0.9813, test_f1: 0.5973
 epoch: 95, train_loss: 0.5213, test_loss: 0.9892, test_f1: 0.6008
 epoch: 96, train_loss: 0.5178, test_loss: 0.9899, test_f1: 0.6044
 epoch: 97, train_loss: 0.5187, test_loss: 0.9436, test_f1: 0.6111
 epoch: 98, train_loss: 0.5298, test_loss: 1.0195, test_f1: 0.5991
 epoch: 99, train_loss: 0.5371, test_loss: 0.9870, test_f1: 0.6134
##################ITERATION #7 ****************************************
 epoch: 0, train_loss: 1.3898, test_loss: 1.3630, test_f1: 0.2260
 epoch: 1, train_loss: 1.1941, test_loss: 1.3480, test_f1: 0.2260
 epoch: 2, train_loss: 1.1271, test_loss: 1.2054, test_f1: 0.2479
 epoch: 3, train_loss: 1.0670, test_loss: 1.0982, test_f1: 0.3813
 epoch: 4, train_loss: 1.0398, test_loss: 1.0191, test_f1: 0.4440
 epoch: 5, train_loss: 1.0160, test_loss: 0.9952, test_f1: 0.4526
 epoch: 6, train_loss: 0.9882, test_loss: 0.9694, test_f1: 0.4982
 epoch: 7, train_loss: 0.9623, test_loss: 0.9926, test_f1: 0.4730
 epoch: 8, train_loss: 0.9460, test_loss: 0.9898, test_f1: 0.4631
 epoch: 9, train_loss: 0.9322, test_loss: 0.9703, test_f1: 0.5030
 epoch: 10, train_loss: 0.9236, test_loss: 0.9322, test_f1: 0.5003
 epoch: 11, train_loss: 0.8938, test_loss: 0.9080, test_f1: 0.4977
 epoch: 12, train_loss: 0.8853, test_loss: 0.8930, test_f1: 0.5078
 epoch: 13, train_loss: 0.8708, test_loss: 0.9046, test_f1: 0.4962
 epoch: 14, train_loss: 0.8555, test_loss: 0.9054, test_f1: 0.5263
 epoch: 15, train_loss: 0.8512, test_loss: 0.9010, test_f1: 0.5320
 epoch: 16, train_loss: 0.8300, test_loss: 0.8974, test_f1: 0.5067
 epoch: 17, train_loss: 0.8307, test_loss: 0.9263, test_f1: 0.5156
 epoch: 18, train_loss: 0.8283, test_loss: 0.9481, test_f1: 0.5618
 epoch: 19, train_loss: 0.8255, test_loss: 0.8903, test_f1: 0.5256
 epoch: 20, train_loss: 0.8046, test_loss: 0.9202, test_f1: 0.5207
 epoch: 21, train_loss: 0.7894, test_loss: 1.0428, test_f1: 0.4549
 epoch: 22, train_loss: 0.7916, test_loss: 0.9821, test_f1: 0.5261
 epoch: 23, train_loss: 0.7885, test_loss: 0.8969, test_f1: 0.5319
 epoch: 24, train_loss: 0.7870, test_loss: 0.9153, test_f1: 0.5709
 epoch: 25, train_loss: 0.7754, test_loss: 0.9313, test_f1: 0.5225
 epoch: 26, train_loss: 0.7631, test_loss: 0.8536, test_f1: 0.5565
 epoch: 27, train_loss: 0.7551, test_loss: 0.8876, test_f1: 0.4899
 epoch: 28, train_loss: 0.7628, test_loss: 0.8251, test_f1: 0.5704
 epoch: 29, train_loss: 0.7522, test_loss: 0.8750, test_f1: 0.5691
 epoch: 30, train_loss: 0.7582, test_loss: 0.8886, test_f1: 0.5608
 epoch: 31, train_loss: 0.7595, test_loss: 0.9608, test_f1: 0.5245
 epoch: 32, train_loss: 0.7459, test_loss: 0.8991, test_f1: 0.5268
 epoch: 33, train_loss: 0.7307, test_loss: 0.8479, test_f1: 0.5520
 epoch: 34, train_loss: 0.7118, test_loss: 0.9247, test_f1: 0.5391
 epoch: 35, train_loss: 0.7280, test_loss: 0.8486, test_f1: 0.5519
 epoch: 36, train_loss: 0.7135, test_loss: 0.9182, test_f1: 0.5488
 epoch: 37, train_loss: 0.7092, test_loss: 0.8884, test_f1: 0.5576
 epoch: 38, train_loss: 0.7060, test_loss: 0.8291, test_f1: 0.5794
 epoch: 39, train_loss: 0.7054, test_loss: 0.9102, test_f1: 0.5474
 epoch: 40, train_loss: 0.6879, test_loss: 0.8738, test_f1: 0.5373
 epoch: 41, train_loss: 0.6834, test_loss: 0.9285, test_f1: 0.5816
 epoch: 42, train_loss: 0.6915, test_loss: 0.8910, test_f1: 0.5776
 epoch: 43, train_loss: 0.6880, test_loss: 0.9220, test_f1: 0.5980
 epoch: 44, train_loss: 0.6637, test_loss: 0.8915, test_f1: 0.5792
 epoch: 45, train_loss: 0.6615, test_loss: 0.9085, test_f1: 0.5698
 epoch: 46, train_loss: 0.6698, test_loss: 0.8755, test_f1: 0.5779
 epoch: 47, train_loss: 0.6674, test_loss: 1.1704, test_f1: 0.5445
 epoch: 48, train_loss: 0.6820, test_loss: 1.1304, test_f1: 0.5932
 epoch: 49, train_loss: 0.6833, test_loss: 0.9494, test_f1: 0.5717
 epoch: 50, train_loss: 0.6526, test_loss: 0.8556, test_f1: 0.6142
 epoch: 51, train_loss: 0.6489, test_loss: 0.8802, test_f1: 0.6145
 epoch: 52, train_loss: 0.6417, test_loss: 0.8876, test_f1: 0.5875
 epoch: 53, train_loss: 0.6274, test_loss: 0.9073, test_f1: 0.5929
 epoch: 54, train_loss: 0.6237, test_loss: 0.9148, test_f1: 0.6150
 epoch: 55, train_loss: 0.6203, test_loss: 0.8786, test_f1: 0.6182
 epoch: 56, train_loss: 0.6007, test_loss: 0.9363, test_f1: 0.5936
 epoch: 57, train_loss: 0.6131, test_loss: 0.9009, test_f1: 0.6194
 epoch: 58, train_loss: 0.6085, test_loss: 0.9572, test_f1: 0.5704
 epoch: 59, train_loss: 0.6049, test_loss: 0.9409, test_f1: 0.5937
 epoch: 60, train_loss: 0.6070, test_loss: 0.9267, test_f1: 0.6021
 epoch: 61, train_loss: 0.5973, test_loss: 0.9531, test_f1: 0.6115
 epoch: 62, train_loss: 0.6009, test_loss: 0.9431, test_f1: 0.6038
 epoch: 63, train_loss: 0.6008, test_loss: 0.9064, test_f1: 0.6258
 epoch: 64, train_loss: 0.6092, test_loss: 0.9146, test_f1: 0.6256
 epoch: 65, train_loss: 0.5921, test_loss: 0.9974, test_f1: 0.6039
 epoch: 66, train_loss: 0.6014, test_loss: 0.9853, test_f1: 0.5822
 epoch: 67, train_loss: 0.5902, test_loss: 0.9249, test_f1: 0.5946
 epoch: 68, train_loss: 0.5923, test_loss: 0.9463, test_f1: 0.5920
 epoch: 69, train_loss: 0.5930, test_loss: 0.9380, test_f1: 0.6033
 epoch: 70, train_loss: 0.5833, test_loss: 0.9764, test_f1: 0.5953
 epoch: 71, train_loss: 0.5841, test_loss: 0.9523, test_f1: 0.5978
 epoch: 72, train_loss: 0.5813, test_loss: 0.9530, test_f1: 0.6112
 epoch: 73, train_loss: 0.5805, test_loss: 1.0154, test_f1: 0.5979
 epoch: 74, train_loss: 0.6007, test_loss: 0.9252, test_f1: 0.6195
 epoch: 75, train_loss: 0.5739, test_loss: 0.9207, test_f1: 0.5973
 epoch: 76, train_loss: 0.5770, test_loss: 0.9555, test_f1: 0.6093
 epoch: 77, train_loss: 0.5775, test_loss: 0.9888, test_f1: 0.5892
 epoch: 78, train_loss: 0.5641, test_loss: 0.9741, test_f1: 0.5978
 epoch: 79, train_loss: 0.5615, test_loss: 0.9870, test_f1: 0.5728
 epoch: 80, train_loss: 0.5786, test_loss: 0.9642, test_f1: 0.6181
 epoch: 81, train_loss: 0.5649, test_loss: 1.0230, test_f1: 0.5909
 epoch: 82, train_loss: 0.5681, test_loss: 0.9906, test_f1: 0.5969
 epoch: 83, train_loss: 0.5626, test_loss: 1.0146, test_f1: 0.5921
 epoch: 84, train_loss: 0.5629, test_loss: 0.9352, test_f1: 0.5957
 epoch: 85, train_loss: 0.5563, test_loss: 1.0072, test_f1: 0.5904
 epoch: 86, train_loss: 0.5600, test_loss: 1.0132, test_f1: 0.6031
 epoch: 87, train_loss: 0.5450, test_loss: 0.9941, test_f1: 0.6050
 epoch: 88, train_loss: 0.5584, test_loss: 1.0833, test_f1: 0.5901
 epoch: 89, train_loss: 0.5454, test_loss: 0.9769, test_f1: 0.5927
 epoch: 90, train_loss: 0.5581, test_loss: 1.0015, test_f1: 0.6005
 epoch: 91, train_loss: 0.5508, test_loss: 1.0052, test_f1: 0.5937
 epoch: 92, train_loss: 0.5628, test_loss: 0.9809, test_f1: 0.5829
 epoch: 93, train_loss: 0.5681, test_loss: 1.0474, test_f1: 0.5819
 epoch: 94, train_loss: 0.5466, test_loss: 0.9404, test_f1: 0.6099
 epoch: 95, train_loss: 0.5457, test_loss: 0.9817, test_f1: 0.5940
 epoch: 96, train_loss: 0.5361, test_loss: 1.0166, test_f1: 0.5993
 epoch: 97, train_loss: 0.5305, test_loss: 0.9760, test_f1: 0.5975
 epoch: 98, train_loss: 0.5418, test_loss: 1.0812, test_f1: 0.5966
 epoch: 99, train_loss: 0.5273, test_loss: 1.0085, test_f1: 0.5989
##################ITERATION #8 ****************************************
 epoch: 0, train_loss: 1.2840, test_loss: 1.4366, test_f1: 0.2260
 epoch: 1, train_loss: 1.1132, test_loss: 1.3477, test_f1: 0.2268
 epoch: 2, train_loss: 1.0520, test_loss: 1.2557, test_f1: 0.2442
 epoch: 3, train_loss: 1.0163, test_loss: 1.0269, test_f1: 0.4170
 epoch: 4, train_loss: 1.0006, test_loss: 0.9416, test_f1: 0.4828
 epoch: 5, train_loss: 0.9833, test_loss: 0.9476, test_f1: 0.5170
 epoch: 6, train_loss: 0.9730, test_loss: 0.9375, test_f1: 0.4710
 epoch: 7, train_loss: 0.9535, test_loss: 0.9068, test_f1: 0.5132
 epoch: 8, train_loss: 0.9510, test_loss: 0.8916, test_f1: 0.4909
 epoch: 9, train_loss: 0.9239, test_loss: 0.8623, test_f1: 0.5175
 epoch: 10, train_loss: 0.9107, test_loss: 0.8682, test_f1: 0.5216
 epoch: 11, train_loss: 0.8969, test_loss: 0.8552, test_f1: 0.5504
 epoch: 12, train_loss: 0.8839, test_loss: 0.8720, test_f1: 0.5162
 epoch: 13, train_loss: 0.8725, test_loss: 0.8897, test_f1: 0.5162
 epoch: 14, train_loss: 0.8633, test_loss: 0.8622, test_f1: 0.5536
 epoch: 15, train_loss: 0.8478, test_loss: 0.9028, test_f1: 0.5522
 epoch: 16, train_loss: 0.8422, test_loss: 0.8606, test_f1: 0.5510
 epoch: 17, train_loss: 0.8241, test_loss: 0.8777, test_f1: 0.5244
 epoch: 18, train_loss: 0.8346, test_loss: 0.9142, test_f1: 0.5425
 epoch: 19, train_loss: 0.8152, test_loss: 0.8669, test_f1: 0.5222
 epoch: 20, train_loss: 0.8076, test_loss: 0.8790, test_f1: 0.5662
 epoch: 21, train_loss: 0.8023, test_loss: 0.8500, test_f1: 0.5549
 epoch: 22, train_loss: 0.7715, test_loss: 0.8668, test_f1: 0.5563
 epoch: 23, train_loss: 0.7785, test_loss: 0.8844, test_f1: 0.5622
 epoch: 24, train_loss: 0.7769, test_loss: 0.8805, test_f1: 0.5369
 epoch: 25, train_loss: 0.7664, test_loss: 0.8758, test_f1: 0.5591
 epoch: 26, train_loss: 0.7674, test_loss: 0.8136, test_f1: 0.5440
 epoch: 27, train_loss: 0.7581, test_loss: 0.8556, test_f1: 0.5555
 epoch: 28, train_loss: 0.7570, test_loss: 0.9460, test_f1: 0.5275
 epoch: 29, train_loss: 0.7493, test_loss: 0.8846, test_f1: 0.5551
 epoch: 30, train_loss: 0.7383, test_loss: 0.9070, test_f1: 0.5532
 epoch: 31, train_loss: 0.7306, test_loss: 0.8132, test_f1: 0.5528
 epoch: 32, train_loss: 0.7239, test_loss: 0.8432, test_f1: 0.5770
 epoch: 33, train_loss: 0.7138, test_loss: 0.8241, test_f1: 0.5814
 epoch: 34, train_loss: 0.7123, test_loss: 0.9013, test_f1: 0.5386
 epoch: 35, train_loss: 0.7107, test_loss: 0.9095, test_f1: 0.5583
 epoch: 36, train_loss: 0.7122, test_loss: 0.8683, test_f1: 0.5735
 epoch: 37, train_loss: 0.6955, test_loss: 0.8659, test_f1: 0.5872
 epoch: 38, train_loss: 0.6932, test_loss: 0.9086, test_f1: 0.5650
 epoch: 39, train_loss: 0.6854, test_loss: 0.8588, test_f1: 0.5587
 epoch: 40, train_loss: 0.6826, test_loss: 0.9148, test_f1: 0.5738
 epoch: 41, train_loss: 0.6852, test_loss: 0.8833, test_f1: 0.5716
 epoch: 42, train_loss: 0.6767, test_loss: 0.8602, test_f1: 0.5760
 epoch: 43, train_loss: 0.6731, test_loss: 0.8776, test_f1: 0.5791
 epoch: 44, train_loss: 0.6588, test_loss: 0.8938, test_f1: 0.5731
 epoch: 45, train_loss: 0.6819, test_loss: 0.8970, test_f1: 0.5865
 epoch: 46, train_loss: 0.6670, test_loss: 0.8141, test_f1: 0.5901
 epoch: 47, train_loss: 0.6608, test_loss: 0.8789, test_f1: 0.5808
 epoch: 48, train_loss: 0.6530, test_loss: 0.9294, test_f1: 0.5898
 epoch: 49, train_loss: 0.6544, test_loss: 0.8197, test_f1: 0.6004
 epoch: 50, train_loss: 0.6492, test_loss: 0.8653, test_f1: 0.5847
 epoch: 51, train_loss: 0.6346, test_loss: 0.8910, test_f1: 0.5811
 epoch: 52, train_loss: 0.6379, test_loss: 0.8535, test_f1: 0.6051
 epoch: 53, train_loss: 0.6263, test_loss: 0.8284, test_f1: 0.6105
 epoch: 54, train_loss: 0.6013, test_loss: 0.8213, test_f1: 0.6130
 epoch: 55, train_loss: 0.6225, test_loss: 0.8797, test_f1: 0.5958
 epoch: 56, train_loss: 0.6188, test_loss: 0.8615, test_f1: 0.6136
 epoch: 57, train_loss: 0.6070, test_loss: 0.8410, test_f1: 0.6105
 epoch: 58, train_loss: 0.5993, test_loss: 0.8481, test_f1: 0.6181
 epoch: 59, train_loss: 0.6059, test_loss: 0.8590, test_f1: 0.6237
 epoch: 60, train_loss: 0.6004, test_loss: 0.8598, test_f1: 0.6353
 epoch: 61, train_loss: 0.5884, test_loss: 0.9122, test_f1: 0.6152
 epoch: 62, train_loss: 0.6072, test_loss: 0.9370, test_f1: 0.6159
 epoch: 63, train_loss: 0.6029, test_loss: 0.8373, test_f1: 0.6251
 epoch: 64, train_loss: 0.5922, test_loss: 0.8417, test_f1: 0.6281
 epoch: 65, train_loss: 0.6008, test_loss: 0.8410, test_f1: 0.6307
 epoch: 66, train_loss: 0.5886, test_loss: 0.8608, test_f1: 0.6176
 epoch: 67, train_loss: 0.5826, test_loss: 0.9550, test_f1: 0.6154
 epoch: 68, train_loss: 0.5963, test_loss: 0.9129, test_f1: 0.6159
 epoch: 69, train_loss: 0.5814, test_loss: 0.8703, test_f1: 0.6144
 epoch: 70, train_loss: 0.5897, test_loss: 0.8428, test_f1: 0.6092
 epoch: 71, train_loss: 0.5872, test_loss: 0.8362, test_f1: 0.6236
 epoch: 72, train_loss: 0.5894, test_loss: 0.8304, test_f1: 0.6273
 epoch: 73, train_loss: 0.5772, test_loss: 0.8855, test_f1: 0.6139
 epoch: 74, train_loss: 0.5710, test_loss: 0.8645, test_f1: 0.6027
 epoch: 75, train_loss: 0.5796, test_loss: 0.8377, test_f1: 0.6264
 epoch: 76, train_loss: 0.5782, test_loss: 0.9198, test_f1: 0.6183
 epoch: 77, train_loss: 0.5645, test_loss: 0.8375, test_f1: 0.6231
 epoch: 78, train_loss: 0.5679, test_loss: 0.9219, test_f1: 0.6110
 epoch: 79, train_loss: 0.5693, test_loss: 0.9527, test_f1: 0.6230
 epoch: 80, train_loss: 0.5735, test_loss: 0.8929, test_f1: 0.6132
 epoch: 81, train_loss: 0.5720, test_loss: 0.8779, test_f1: 0.6126
 epoch: 82, train_loss: 0.5555, test_loss: 0.8692, test_f1: 0.6116
 epoch: 83, train_loss: 0.5524, test_loss: 0.8381, test_f1: 0.6249
 epoch: 84, train_loss: 0.5480, test_loss: 0.9197, test_f1: 0.6099
 epoch: 85, train_loss: 0.5621, test_loss: 0.8295, test_f1: 0.6277
 epoch: 86, train_loss: 0.5580, test_loss: 0.9561, test_f1: 0.6119
 epoch: 87, train_loss: 0.5552, test_loss: 0.8913, test_f1: 0.6077
 epoch: 88, train_loss: 0.5549, test_loss: 0.8986, test_f1: 0.6219
 epoch: 89, train_loss: 0.5469, test_loss: 0.9246, test_f1: 0.6190
 epoch: 90, train_loss: 0.5437, test_loss: 0.8471, test_f1: 0.6425
 epoch: 91, train_loss: 0.5586, test_loss: 0.8954, test_f1: 0.6056
 epoch: 92, train_loss: 0.5446, test_loss: 0.9415, test_f1: 0.6132
 epoch: 93, train_loss: 0.5562, test_loss: 0.8350, test_f1: 0.6324
 epoch: 94, train_loss: 0.5301, test_loss: 0.8632, test_f1: 0.6211
 epoch: 95, train_loss: 0.5262, test_loss: 0.9731, test_f1: 0.6148
 epoch: 96, train_loss: 0.5369, test_loss: 0.8813, test_f1: 0.6261
 epoch: 97, train_loss: 0.5222, test_loss: 0.9013, test_f1: 0.6250
 epoch: 98, train_loss: 0.5296, test_loss: 0.9677, test_f1: 0.6097
 epoch: 99, train_loss: 0.5191, test_loss: 0.9235, test_f1: 0.6204
##################ITERATION #9 ****************************************
 epoch: 0, train_loss: 1.4697, test_loss: 1.3758, test_f1: 0.2671
 epoch: 1, train_loss: 1.1596, test_loss: 1.3291, test_f1: 0.3368
 epoch: 2, train_loss: 1.1072, test_loss: 1.2659, test_f1: 0.3943
 epoch: 3, train_loss: 1.0723, test_loss: 1.1864, test_f1: 0.4174
 epoch: 4, train_loss: 1.0428, test_loss: 1.0057, test_f1: 0.4870
 epoch: 5, train_loss: 1.0019, test_loss: 0.9567, test_f1: 0.4984
 epoch: 6, train_loss: 1.0015, test_loss: 0.9542, test_f1: 0.4937
 epoch: 7, train_loss: 0.9800, test_loss: 0.9321, test_f1: 0.4785
 epoch: 8, train_loss: 0.9532, test_loss: 0.9244, test_f1: 0.5380
 epoch: 9, train_loss: 0.9355, test_loss: 0.9100, test_f1: 0.5252
 epoch: 10, train_loss: 0.9341, test_loss: 0.9161, test_f1: 0.4992
 epoch: 11, train_loss: 0.9143, test_loss: 0.8983, test_f1: 0.5411
 epoch: 12, train_loss: 0.8982, test_loss: 0.8884, test_f1: 0.5581
 epoch: 13, train_loss: 0.8841, test_loss: 0.8955, test_f1: 0.5522
 epoch: 14, train_loss: 0.8695, test_loss: 0.9280, test_f1: 0.5429
 epoch: 15, train_loss: 0.8619, test_loss: 0.9270, test_f1: 0.5527
 epoch: 16, train_loss: 0.8472, test_loss: 0.9019, test_f1: 0.5744
 epoch: 17, train_loss: 0.8465, test_loss: 0.9051, test_f1: 0.5524
 epoch: 18, train_loss: 0.8334, test_loss: 0.8499, test_f1: 0.5696
 epoch: 19, train_loss: 0.8339, test_loss: 0.9091, test_f1: 0.5791
 epoch: 20, train_loss: 0.8280, test_loss: 0.8611, test_f1: 0.5788
 epoch: 21, train_loss: 0.8156, test_loss: 0.9069, test_f1: 0.5529
 epoch: 22, train_loss: 0.8198, test_loss: 0.9102, test_f1: 0.5597
 epoch: 23, train_loss: 0.8062, test_loss: 0.8774, test_f1: 0.5683
 epoch: 24, train_loss: 0.7869, test_loss: 0.9185, test_f1: 0.5621
 epoch: 25, train_loss: 0.8083, test_loss: 0.8670, test_f1: 0.5627
 epoch: 26, train_loss: 0.7849, test_loss: 0.9300, test_f1: 0.5851
 epoch: 27, train_loss: 0.7984, test_loss: 0.8888, test_f1: 0.5936
 epoch: 28, train_loss: 0.7975, test_loss: 0.8940, test_f1: 0.5684
 epoch: 29, train_loss: 0.7765, test_loss: 0.8440, test_f1: 0.6064
 epoch: 30, train_loss: 0.7777, test_loss: 0.9039, test_f1: 0.5850
 epoch: 31, train_loss: 0.7679, test_loss: 0.8568, test_f1: 0.6143
 epoch: 32, train_loss: 0.7593, test_loss: 0.9672, test_f1: 0.5755
 epoch: 33, train_loss: 0.7571, test_loss: 0.8720, test_f1: 0.6108
 epoch: 34, train_loss: 0.7454, test_loss: 0.8754, test_f1: 0.6326
 epoch: 35, train_loss: 0.7324, test_loss: 0.8637, test_f1: 0.6011
 epoch: 36, train_loss: 0.7197, test_loss: 0.8797, test_f1: 0.6059
 epoch: 37, train_loss: 0.7378, test_loss: 0.9050, test_f1: 0.6099
 epoch: 38, train_loss: 0.7140, test_loss: 0.8798, test_f1: 0.5983
 epoch: 39, train_loss: 0.7158, test_loss: 0.8919, test_f1: 0.5954
 epoch: 40, train_loss: 0.7253, test_loss: 0.9041, test_f1: 0.6114
 epoch: 41, train_loss: 0.7006, test_loss: 0.8776, test_f1: 0.5959
 epoch: 42, train_loss: 0.6914, test_loss: 0.8967, test_f1: 0.5969
 epoch: 43, train_loss: 0.6791, test_loss: 0.8698, test_f1: 0.6109
 epoch: 44, train_loss: 0.6814, test_loss: 0.9184, test_f1: 0.6103
 epoch: 45, train_loss: 0.6936, test_loss: 0.9136, test_f1: 0.6179
 epoch: 46, train_loss: 0.6990, test_loss: 0.8935, test_f1: 0.6098
 epoch: 47, train_loss: 0.6876, test_loss: 0.8871, test_f1: 0.5784
 epoch: 48, train_loss: 0.6764, test_loss: 0.8727, test_f1: 0.6058
 epoch: 49, train_loss: 0.6592, test_loss: 0.9158, test_f1: 0.5866
 epoch: 50, train_loss: 0.6575, test_loss: 0.9809, test_f1: 0.5832
 epoch: 51, train_loss: 0.6485, test_loss: 0.8759, test_f1: 0.6092
 epoch: 52, train_loss: 0.6375, test_loss: 0.8974, test_f1: 0.6213
 epoch: 53, train_loss: 0.6381, test_loss: 0.8856, test_f1: 0.6176
 epoch: 54, train_loss: 0.6246, test_loss: 0.9090, test_f1: 0.6125
 epoch: 55, train_loss: 0.6259, test_loss: 0.8872, test_f1: 0.6175
 epoch: 56, train_loss: 0.6224, test_loss: 0.9275, test_f1: 0.6351
 epoch: 57, train_loss: 0.6248, test_loss: 0.9407, test_f1: 0.6099
 epoch: 58, train_loss: 0.6115, test_loss: 0.9102, test_f1: 0.6336
 epoch: 59, train_loss: 0.5980, test_loss: 0.9033, test_f1: 0.6219
 epoch: 60, train_loss: 0.6104, test_loss: 0.9414, test_f1: 0.6088
 epoch: 61, train_loss: 0.5930, test_loss: 0.9271, test_f1: 0.6237
 epoch: 62, train_loss: 0.6002, test_loss: 0.9514, test_f1: 0.6370
 epoch: 63, train_loss: 0.6026, test_loss: 0.8943, test_f1: 0.6305
 epoch: 64, train_loss: 0.5951, test_loss: 0.9505, test_f1: 0.5981
 epoch: 65, train_loss: 0.5961, test_loss: 0.9446, test_f1: 0.6125
 epoch: 66, train_loss: 0.5996, test_loss: 0.9585, test_f1: 0.6225
 epoch: 67, train_loss: 0.5950, test_loss: 0.9430, test_f1: 0.6126
 epoch: 68, train_loss: 0.5785, test_loss: 0.9212, test_f1: 0.6152
 epoch: 69, train_loss: 0.5847, test_loss: 0.9243, test_f1: 0.6160
 epoch: 70, train_loss: 0.5832, test_loss: 0.9608, test_f1: 0.6053
 epoch: 71, train_loss: 0.5718, test_loss: 0.9161, test_f1: 0.6282
 epoch: 72, train_loss: 0.5850, test_loss: 0.9400, test_f1: 0.6239
 epoch: 73, train_loss: 0.5972, test_loss: 0.9274, test_f1: 0.6242
 epoch: 74, train_loss: 0.5806, test_loss: 0.9701, test_f1: 0.6066
 epoch: 75, train_loss: 0.5890, test_loss: 0.9926, test_f1: 0.5838
 epoch: 76, train_loss: 0.5673, test_loss: 0.9479, test_f1: 0.6130
 epoch: 77, train_loss: 0.5704, test_loss: 0.9271, test_f1: 0.6145
 epoch: 78, train_loss: 0.5579, test_loss: 0.9670, test_f1: 0.6101
 epoch: 79, train_loss: 0.5725, test_loss: 0.9203, test_f1: 0.6235
 epoch: 80, train_loss: 0.5603, test_loss: 0.9636, test_f1: 0.6154
 epoch: 81, train_loss: 0.5498, test_loss: 0.9592, test_f1: 0.5989
 epoch: 82, train_loss: 0.5592, test_loss: 0.9620, test_f1: 0.6064
 epoch: 83, train_loss: 0.5474, test_loss: 0.9639, test_f1: 0.6174
 epoch: 84, train_loss: 0.5522, test_loss: 0.9266, test_f1: 0.6297
 epoch: 85, train_loss: 0.5646, test_loss: 0.9234, test_f1: 0.6083
 epoch: 86, train_loss: 0.5406, test_loss: 0.9587, test_f1: 0.6303
 epoch: 87, train_loss: 0.5562, test_loss: 0.9811, test_f1: 0.6047
 epoch: 88, train_loss: 0.5532, test_loss: 0.9806, test_f1: 0.6151
 epoch: 89, train_loss: 0.5491, test_loss: 0.9624, test_f1: 0.6134
 epoch: 90, train_loss: 0.5387, test_loss: 0.9677, test_f1: 0.6163
 epoch: 91, train_loss: 0.5275, test_loss: 0.9542, test_f1: 0.6150
 epoch: 92, train_loss: 0.5341, test_loss: 1.0040, test_f1: 0.6045
 epoch: 93, train_loss: 0.5276, test_loss: 0.9426, test_f1: 0.6352
 epoch: 94, train_loss: 0.5429, test_loss: 0.9841, test_f1: 0.5982
 epoch: 95, train_loss: 0.5384, test_loss: 0.9700, test_f1: 0.6256
 epoch: 96, train_loss: 0.5259, test_loss: 0.9620, test_f1: 0.6310
 epoch: 97, train_loss: 0.5138, test_loss: 0.9837, test_f1: 0.6138
 epoch: 98, train_loss: 0.5345, test_loss: 0.9881, test_f1: 0.6146
 epoch: 99, train_loss: 0.5185, test_loss: 0.9943, test_f1: 0.6198

Training completed in 423.36 seconds
Best F1: 0.6425 at epoch 90
Mean F1 across iterations: 0.6149  0.0237
========================FINAL RESULTS================================
FEGIN weighted F1: 0.6425  0.0237
python main.py --data ltspice_examples --representation component_pin --model FEGIN --layers 4 --hiddens 32 --batch_size 256 --lr 0.001 --emb_size 128 --epochs 100 --save_appendix component_pin_L4_H32_BS256_LR0.001_E128 --no_val
-----



STDERR:
  File "main.py", line 370, in <module>
    main()
  File "main.py", line 254, in main
    dataset = dataset_class(
  File "/home/philip/projects/ltspice_examples_code_repo/Circuit-Completion-Using-GNNs/component_classification_with_link_prediction_head/evaluation/FEGIN/kernel/circuit_datasets.py", line 15, in __init__
    self.data, self.slices = torch.load(self.processed_paths[0])
  File "/home/philip/.local/lib/python3.8/site-packages/torch/serialization.py", line 1040, in load
    warnings.warn(
  File "/usr/lib/python3.8/warnings.py", line 109, in _showwarnmsg
    sw(msg.message, msg.category, msg.filename, msg.lineno,
  File "main.py", line 47, in warn_with_traceback
    traceback.print_stack(file=log)
/home/philip/projects/ltspice_examples_code_repo/Circuit-Completion-Using-GNNs/component_classification_with_link_prediction_head/evaluation/FEGIN/kernel/circuit_datasets.py:15: FutureWarning: You are using `torch.load` with `weights_only=False` (the current default value), which uses the default pickle module implicitly. It is possible to construct malicious pickle data which will execute arbitrary code during unpickling (See https://github.com/pytorch/pytorch/blob/main/SECURITY.md#untrusted-models for more details). In a future release, the default value for `weights_only` will be flipped to `True`. This limits the functions that could be executed during unpickling. Arbitrary objects will no longer be allowed to be loaded via this mode unless they are explicitly allowlisted by the user via `torch.serialization.add_safe_globals`. We recommend you start setting `weights_only=True` for any use case where you don't have full control of the loaded file. Please open an issue on GitHub for any issues related to this experimental feature.
  self.data, self.slices = torch.load(self.processed_paths[0])
