STDOUT:
Results will be saved in /home/philip/projects/ltspice_examples_code_repo/Circuit-Completion-Using-GNNs/component_classification_with_link_prediction_head/evaluation/FEGIN/results/model_FEGIN_dataset_ltspice_demos
Command line input: python main.py --data ltspice_demos --representation component_component --model FEGIN --layers 2 --hiddens 128 --batch_size 32 --lr 0.0001 --emb_size 250 --epochs 100 --save_appendix component_component_L2_H128_BS32_LR0.0001_E250 --no_val
 is saved.
-----
ltspice_demos - FEGIN
Using 2 layers, 128 hidden units, h = 2
Loading component_component representation dataset
ENTERED
Training FEGIN on component_component representation
Train: 1565, Test: 383
##################ITERATION #0 ****************************************
 epoch: 0, train_loss: 1.3501, test_loss: 1.3354, test_f1: 0.2281
 epoch: 1, train_loss: 1.2844, test_loss: 1.3006, test_f1: 0.2281
 epoch: 2, train_loss: 1.2347, test_loss: 1.2816, test_f1: 0.2281
 epoch: 3, train_loss: 1.1983, test_loss: 1.2661, test_f1: 0.2584
 epoch: 4, train_loss: 1.1741, test_loss: 1.2471, test_f1: 0.2582
 epoch: 5, train_loss: 1.1540, test_loss: 1.2302, test_f1: 0.2855
 epoch: 6, train_loss: 1.1324, test_loss: 1.2152, test_f1: 0.3387
 epoch: 7, train_loss: 1.1048, test_loss: 1.1990, test_f1: 0.3678
 epoch: 8, train_loss: 1.0921, test_loss: 1.1873, test_f1: 0.3952
 epoch: 9, train_loss: 1.0636, test_loss: 1.1713, test_f1: 0.4011
 epoch: 10, train_loss: 1.0453, test_loss: 1.1772, test_f1: 0.3888
 epoch: 11, train_loss: 1.0271, test_loss: 1.1580, test_f1: 0.3954
 epoch: 12, train_loss: 1.0034, test_loss: 1.1569, test_f1: 0.4085
 epoch: 13, train_loss: 0.9827, test_loss: 1.1602, test_f1: 0.4802
 epoch: 14, train_loss: 0.9714, test_loss: 1.1570, test_f1: 0.4560
 epoch: 15, train_loss: 0.9435, test_loss: 1.1723, test_f1: 0.4875
 epoch: 16, train_loss: 0.9353, test_loss: 1.1490, test_f1: 0.4972
 epoch: 17, train_loss: 0.9141, test_loss: 1.1373, test_f1: 0.5134
 epoch: 18, train_loss: 0.9037, test_loss: 1.1853, test_f1: 0.4973
 epoch: 19, train_loss: 0.8961, test_loss: 1.1440, test_f1: 0.5139
 epoch: 20, train_loss: 0.8776, test_loss: 1.1264, test_f1: 0.4971
 epoch: 21, train_loss: 0.8786, test_loss: 1.1493, test_f1: 0.5014
 epoch: 22, train_loss: 0.8517, test_loss: 1.1630, test_f1: 0.5113
 epoch: 23, train_loss: 0.8618, test_loss: 1.1123, test_f1: 0.5047
 epoch: 24, train_loss: 0.8250, test_loss: 1.1464, test_f1: 0.5407
 epoch: 25, train_loss: 0.8178, test_loss: 1.1632, test_f1: 0.5709
 epoch: 26, train_loss: 0.8243, test_loss: 1.1488, test_f1: 0.5027
 epoch: 27, train_loss: 0.8164, test_loss: 1.1402, test_f1: 0.5958
 epoch: 28, train_loss: 0.8079, test_loss: 1.1656, test_f1: 0.5660
 epoch: 29, train_loss: 0.7798, test_loss: 1.1690, test_f1: 0.5805
 epoch: 30, train_loss: 0.7702, test_loss: 1.1431, test_f1: 0.6078
 epoch: 31, train_loss: 0.7695, test_loss: 1.1758, test_f1: 0.6142
 epoch: 32, train_loss: 0.7485, test_loss: 1.2947, test_f1: 0.5723
 epoch: 33, train_loss: 0.7594, test_loss: 1.1703, test_f1: 0.5875
 epoch: 34, train_loss: 0.7384, test_loss: 1.2315, test_f1: 0.6035
 epoch: 35, train_loss: 0.7285, test_loss: 1.2387, test_f1: 0.5928
 epoch: 36, train_loss: 0.7151, test_loss: 1.2523, test_f1: 0.6176
 epoch: 37, train_loss: 0.7254, test_loss: 1.2621, test_f1: 0.6134
 epoch: 38, train_loss: 0.7043, test_loss: 1.2269, test_f1: 0.6010
 epoch: 39, train_loss: 0.6872, test_loss: 1.3383, test_f1: 0.5707
 epoch: 40, train_loss: 0.6928, test_loss: 1.2305, test_f1: 0.6003
 epoch: 41, train_loss: 0.6802, test_loss: 1.2888, test_f1: 0.5953
 epoch: 42, train_loss: 0.6770, test_loss: 1.2580, test_f1: 0.6000
 epoch: 43, train_loss: 0.6710, test_loss: 1.2528, test_f1: 0.5975
 epoch: 44, train_loss: 0.6582, test_loss: 1.3077, test_f1: 0.5995
 epoch: 45, train_loss: 0.6460, test_loss: 1.3651, test_f1: 0.5776
 epoch: 46, train_loss: 0.6551, test_loss: 1.2538, test_f1: 0.6061
 epoch: 47, train_loss: 0.6310, test_loss: 1.4227, test_f1: 0.5811
 epoch: 48, train_loss: 0.6236, test_loss: 1.3516, test_f1: 0.6065
 epoch: 49, train_loss: 0.6289, test_loss: 1.4043, test_f1: 0.5929
 epoch: 50, train_loss: 0.6164, test_loss: 1.4362, test_f1: 0.5707
 epoch: 51, train_loss: 0.6163, test_loss: 1.4268, test_f1: 0.5944
 epoch: 52, train_loss: 0.5971, test_loss: 1.4633, test_f1: 0.5952
 epoch: 53, train_loss: 0.5779, test_loss: 1.4515, test_f1: 0.5874
 epoch: 54, train_loss: 0.5834, test_loss: 1.4417, test_f1: 0.5851
 epoch: 55, train_loss: 0.5888, test_loss: 1.4868, test_f1: 0.5815
 epoch: 56, train_loss: 0.5660, test_loss: 1.4193, test_f1: 0.5925
 epoch: 57, train_loss: 0.5702, test_loss: 1.4078, test_f1: 0.5877
 epoch: 58, train_loss: 0.5554, test_loss: 1.3957, test_f1: 0.5925
 epoch: 59, train_loss: 0.5624, test_loss: 1.5173, test_f1: 0.6016
 epoch: 60, train_loss: 0.5617, test_loss: 1.5281, test_f1: 0.6004
 epoch: 61, train_loss: 0.5626, test_loss: 1.5068, test_f1: 0.5915
 epoch: 62, train_loss: 0.5515, test_loss: 1.4766, test_f1: 0.6074
 epoch: 63, train_loss: 0.5480, test_loss: 1.4959, test_f1: 0.5894
 epoch: 64, train_loss: 0.5665, test_loss: 1.5478, test_f1: 0.5950
 epoch: 65, train_loss: 0.5549, test_loss: 1.5198, test_f1: 0.5778
 epoch: 66, train_loss: 0.5311, test_loss: 1.6041, test_f1: 0.5662
 epoch: 67, train_loss: 0.5461, test_loss: 1.6199, test_f1: 0.5860
 epoch: 68, train_loss: 0.5360, test_loss: 1.6049, test_f1: 0.5752
 epoch: 69, train_loss: 0.5387, test_loss: 1.5688, test_f1: 0.6002
 epoch: 70, train_loss: 0.5298, test_loss: 1.6375, test_f1: 0.5577
 epoch: 71, train_loss: 0.5228, test_loss: 1.5459, test_f1: 0.5853
 epoch: 72, train_loss: 0.5250, test_loss: 1.6358, test_f1: 0.5765
 epoch: 73, train_loss: 0.5335, test_loss: 1.6935, test_f1: 0.5706
 epoch: 74, train_loss: 0.5331, test_loss: 1.6787, test_f1: 0.5572
 epoch: 75, train_loss: 0.5112, test_loss: 1.5676, test_f1: 0.5956
 epoch: 76, train_loss: 0.5240, test_loss: 1.6840, test_f1: 0.5755
 epoch: 77, train_loss: 0.5007, test_loss: 1.5610, test_f1: 0.5946
 epoch: 78, train_loss: 0.5119, test_loss: 1.6305, test_f1: 0.5726
 epoch: 79, train_loss: 0.5148, test_loss: 1.6029, test_f1: 0.5905
 epoch: 80, train_loss: 0.5196, test_loss: 1.7150, test_f1: 0.5787
 epoch: 81, train_loss: 0.5088, test_loss: 1.7634, test_f1: 0.5697
 epoch: 82, train_loss: 0.5159, test_loss: 1.6635, test_f1: 0.5902
 epoch: 83, train_loss: 0.5005, test_loss: 1.7741, test_f1: 0.5717
 epoch: 84, train_loss: 0.4889, test_loss: 1.6720, test_f1: 0.5853
 epoch: 85, train_loss: 0.4797, test_loss: 1.7450, test_f1: 0.6010
 epoch: 86, train_loss: 0.4761, test_loss: 1.7434, test_f1: 0.5798
 epoch: 87, train_loss: 0.5058, test_loss: 1.6808, test_f1: 0.5753
 epoch: 88, train_loss: 0.4757, test_loss: 1.7143, test_f1: 0.5864
 epoch: 89, train_loss: 0.4826, test_loss: 1.6810, test_f1: 0.5720
 epoch: 90, train_loss: 0.4831, test_loss: 1.7468, test_f1: 0.5813
 epoch: 91, train_loss: 0.4646, test_loss: 1.7194, test_f1: 0.5658
 epoch: 92, train_loss: 0.4853, test_loss: 1.8505, test_f1: 0.5592
 epoch: 93, train_loss: 0.4705, test_loss: 1.8111, test_f1: 0.5718
 epoch: 94, train_loss: 0.4605, test_loss: 1.7402, test_f1: 0.5967
 epoch: 95, train_loss: 0.4643, test_loss: 1.8269, test_f1: 0.5737
 epoch: 96, train_loss: 0.4571, test_loss: 1.8837, test_f1: 0.5821
 epoch: 97, train_loss: 0.4724, test_loss: 1.7969, test_f1: 0.5696
 epoch: 98, train_loss: 0.4677, test_loss: 1.7763, test_f1: 0.5744
 epoch: 99, train_loss: 0.4620, test_loss: 1.7317, test_f1: 0.5814
##################ITERATION #1 ****************************************
 epoch: 0, train_loss: 1.2549, test_loss: 1.2659, test_f1: 0.3498
 epoch: 1, train_loss: 1.1679, test_loss: 1.2655, test_f1: 0.3780
 epoch: 2, train_loss: 1.1260, test_loss: 1.2266, test_f1: 0.3993
 epoch: 3, train_loss: 1.0918, test_loss: 1.2459, test_f1: 0.4346
 epoch: 4, train_loss: 1.0627, test_loss: 1.2611, test_f1: 0.4516
 epoch: 5, train_loss: 1.0406, test_loss: 1.2841, test_f1: 0.4699
 epoch: 6, train_loss: 1.0221, test_loss: 1.2270, test_f1: 0.4904
 epoch: 7, train_loss: 1.0066, test_loss: 1.1563, test_f1: 0.5088
 epoch: 8, train_loss: 0.9861, test_loss: 1.2617, test_f1: 0.5339
 epoch: 9, train_loss: 0.9680, test_loss: 1.1791, test_f1: 0.5487
 epoch: 10, train_loss: 0.9461, test_loss: 1.2455, test_f1: 0.5386
 epoch: 11, train_loss: 0.9400, test_loss: 1.1889, test_f1: 0.5632
 epoch: 12, train_loss: 0.9299, test_loss: 1.1862, test_f1: 0.5411
 epoch: 13, train_loss: 0.9052, test_loss: 1.1565, test_f1: 0.5663
 epoch: 14, train_loss: 0.9053, test_loss: 1.2008, test_f1: 0.5689
 epoch: 15, train_loss: 0.8971, test_loss: 1.1950, test_f1: 0.4986
 epoch: 16, train_loss: 0.8694, test_loss: 1.1845, test_f1: 0.5631
 epoch: 17, train_loss: 0.8715, test_loss: 1.3783, test_f1: 0.5770
 epoch: 18, train_loss: 0.8313, test_loss: 1.1416, test_f1: 0.5946
 epoch: 19, train_loss: 0.8258, test_loss: 1.3276, test_f1: 0.5673
 epoch: 20, train_loss: 0.8316, test_loss: 1.2135, test_f1: 0.5431
 epoch: 21, train_loss: 0.8093, test_loss: 1.1763, test_f1: 0.5617
 epoch: 22, train_loss: 0.8180, test_loss: 1.1776, test_f1: 0.5777
 epoch: 23, train_loss: 0.7942, test_loss: 1.2147, test_f1: 0.5396
 epoch: 24, train_loss: 0.7690, test_loss: 1.3268, test_f1: 0.5613
 epoch: 25, train_loss: 0.7848, test_loss: 1.3280, test_f1: 0.5685
 epoch: 26, train_loss: 0.7598, test_loss: 1.3478, test_f1: 0.5525
 epoch: 27, train_loss: 0.7643, test_loss: 1.2086, test_f1: 0.5796
 epoch: 28, train_loss: 0.7543, test_loss: 1.2726, test_f1: 0.5632
 epoch: 29, train_loss: 0.7450, test_loss: 1.5881, test_f1: 0.5680
 epoch: 30, train_loss: 0.7382, test_loss: 1.2988, test_f1: 0.5633
 epoch: 31, train_loss: 0.7316, test_loss: 1.2646, test_f1: 0.5844
 epoch: 32, train_loss: 0.7224, test_loss: 1.2552, test_f1: 0.5724
 epoch: 33, train_loss: 0.7192, test_loss: 1.3211, test_f1: 0.5815
 epoch: 34, train_loss: 0.7085, test_loss: 1.4114, test_f1: 0.5868
 epoch: 35, train_loss: 0.6957, test_loss: 1.3801, test_f1: 0.5686
 epoch: 36, train_loss: 0.6992, test_loss: 1.4378, test_f1: 0.5665
 epoch: 37, train_loss: 0.6858, test_loss: 1.5009, test_f1: 0.5695
 epoch: 38, train_loss: 0.6777, test_loss: 1.5566, test_f1: 0.5738
 epoch: 39, train_loss: 0.6702, test_loss: 1.3300, test_f1: 0.6012
 epoch: 40, train_loss: 0.6782, test_loss: 1.3536, test_f1: 0.5723
 epoch: 41, train_loss: 0.6717, test_loss: 1.3228, test_f1: 0.5949
 epoch: 42, train_loss: 0.6414, test_loss: 1.3295, test_f1: 0.5863
 epoch: 43, train_loss: 0.6378, test_loss: 1.4049, test_f1: 0.5805
 epoch: 44, train_loss: 0.6546, test_loss: 1.7374, test_f1: 0.5335
 epoch: 45, train_loss: 0.6432, test_loss: 1.9994, test_f1: 0.5847
 epoch: 46, train_loss: 0.6297, test_loss: 1.5704, test_f1: 0.5822
 epoch: 47, train_loss: 0.6151, test_loss: 1.4540, test_f1: 0.6097
 epoch: 48, train_loss: 0.6242, test_loss: 1.6173, test_f1: 0.5759
 epoch: 49, train_loss: 0.6099, test_loss: 1.5148, test_f1: 0.5877
 epoch: 50, train_loss: 0.5981, test_loss: 1.4891, test_f1: 0.5921
 epoch: 51, train_loss: 0.5893, test_loss: 1.4876, test_f1: 0.5998
 epoch: 52, train_loss: 0.5749, test_loss: 1.5100, test_f1: 0.5927
 epoch: 53, train_loss: 0.5861, test_loss: 1.6159, test_f1: 0.5926
 epoch: 54, train_loss: 0.5620, test_loss: 1.5717, test_f1: 0.5927
 epoch: 55, train_loss: 0.5506, test_loss: 1.7196, test_f1: 0.5865
 epoch: 56, train_loss: 0.5643, test_loss: 1.8915, test_f1: 0.5721
 epoch: 57, train_loss: 0.5714, test_loss: 1.9725, test_f1: 0.5807
 epoch: 58, train_loss: 0.5675, test_loss: 1.7196, test_f1: 0.5734
 epoch: 59, train_loss: 0.5556, test_loss: 1.6903, test_f1: 0.5969
 epoch: 60, train_loss: 0.5674, test_loss: 1.7665, test_f1: 0.5792
 epoch: 61, train_loss: 0.5558, test_loss: 1.5458, test_f1: 0.5737
 epoch: 62, train_loss: 0.5403, test_loss: 1.5326, test_f1: 0.5796
 epoch: 63, train_loss: 0.5505, test_loss: 1.6604, test_f1: 0.5873
 epoch: 64, train_loss: 0.5323, test_loss: 1.7119, test_f1: 0.5589
 epoch: 65, train_loss: 0.5394, test_loss: 1.7397, test_f1: 0.5868
 epoch: 66, train_loss: 0.5446, test_loss: 1.7721, test_f1: 0.5781
 epoch: 67, train_loss: 0.5377, test_loss: 1.6403, test_f1: 0.5909
 epoch: 68, train_loss: 0.5282, test_loss: 1.6842, test_f1: 0.5755
 epoch: 69, train_loss: 0.5278, test_loss: 1.7084, test_f1: 0.5999
 epoch: 70, train_loss: 0.5237, test_loss: 1.6906, test_f1: 0.5688
 epoch: 71, train_loss: 0.5202, test_loss: 1.7384, test_f1: 0.5899
 epoch: 72, train_loss: 0.5170, test_loss: 1.7549, test_f1: 0.5806
 epoch: 73, train_loss: 0.5095, test_loss: 2.0190, test_f1: 0.5827
 epoch: 74, train_loss: 0.5051, test_loss: 2.1168, test_f1: 0.5828
 epoch: 75, train_loss: 0.5084, test_loss: 1.7700, test_f1: 0.5864
 epoch: 76, train_loss: 0.4994, test_loss: 2.0237, test_f1: 0.5855
 epoch: 77, train_loss: 0.5090, test_loss: 1.9784, test_f1: 0.5832
 epoch: 78, train_loss: 0.5061, test_loss: 2.1653, test_f1: 0.5788
 epoch: 79, train_loss: 0.4849, test_loss: 1.9689, test_f1: 0.5806
 epoch: 80, train_loss: 0.4964, test_loss: 2.0851, test_f1: 0.5781
 epoch: 81, train_loss: 0.5016, test_loss: 1.8943, test_f1: 0.5839
 epoch: 82, train_loss: 0.5067, test_loss: 1.8020, test_f1: 0.6014
 epoch: 83, train_loss: 0.4910, test_loss: 1.9320, test_f1: 0.5737
 epoch: 84, train_loss: 0.4804, test_loss: 2.2415, test_f1: 0.5608
 epoch: 85, train_loss: 0.4821, test_loss: 2.0174, test_f1: 0.5678
 epoch: 86, train_loss: 0.4742, test_loss: 2.1684, test_f1: 0.5658
 epoch: 87, train_loss: 0.4920, test_loss: 2.3126, test_f1: 0.5818
 epoch: 88, train_loss: 0.4593, test_loss: 2.5097, test_f1: 0.5799
 epoch: 89, train_loss: 0.4714, test_loss: 2.0958, test_f1: 0.5763
 epoch: 90, train_loss: 0.4643, test_loss: 2.8649, test_f1: 0.5835
 epoch: 91, train_loss: 0.4455, test_loss: 2.1263, test_f1: 0.5775
 epoch: 92, train_loss: 0.4628, test_loss: 2.5152, test_f1: 0.5835
 epoch: 93, train_loss: 0.4639, test_loss: 2.5225, test_f1: 0.5701
 epoch: 94, train_loss: 0.4730, test_loss: 1.9862, test_f1: 0.5917
 epoch: 95, train_loss: 0.4674, test_loss: 2.3892, test_f1: 0.5740
 epoch: 96, train_loss: 0.4549, test_loss: 2.4372, test_f1: 0.5836
 epoch: 97, train_loss: 0.4569, test_loss: 2.1674, test_f1: 0.5740
 epoch: 98, train_loss: 0.4520, test_loss: 2.4574, test_f1: 0.5750
 epoch: 99, train_loss: 0.4430, test_loss: 2.2745, test_f1: 0.5882
##################ITERATION #2 ****************************************
 epoch: 0, train_loss: 1.2431, test_loss: 1.3216, test_f1: 0.3307
 epoch: 1, train_loss: 1.1643, test_loss: 1.2797, test_f1: 0.3708
 epoch: 2, train_loss: 1.1212, test_loss: 1.2007, test_f1: 0.3824
 epoch: 3, train_loss: 1.0770, test_loss: 1.1971, test_f1: 0.4378
 epoch: 4, train_loss: 1.0530, test_loss: 1.1659, test_f1: 0.4689
 epoch: 5, train_loss: 1.0309, test_loss: 1.1485, test_f1: 0.5635
 epoch: 6, train_loss: 1.0074, test_loss: 1.1429, test_f1: 0.5355
 epoch: 7, train_loss: 0.9922, test_loss: 1.1192, test_f1: 0.5288
 epoch: 8, train_loss: 0.9655, test_loss: 1.1427, test_f1: 0.5320
 epoch: 9, train_loss: 0.9495, test_loss: 1.1040, test_f1: 0.5587
 epoch: 10, train_loss: 0.9285, test_loss: 1.1088, test_f1: 0.5460
 epoch: 11, train_loss: 0.9142, test_loss: 1.1176, test_f1: 0.5561
 epoch: 12, train_loss: 0.8953, test_loss: 1.1092, test_f1: 0.5239
 epoch: 13, train_loss: 0.8903, test_loss: 1.1253, test_f1: 0.5512
 epoch: 14, train_loss: 0.8634, test_loss: 1.1123, test_f1: 0.5593
 epoch: 15, train_loss: 0.8762, test_loss: 1.1028, test_f1: 0.5632
 epoch: 16, train_loss: 0.8570, test_loss: 1.0920, test_f1: 0.5611
 epoch: 17, train_loss: 0.8430, test_loss: 1.0952, test_f1: 0.5777
 epoch: 18, train_loss: 0.8388, test_loss: 1.0955, test_f1: 0.5770
 epoch: 19, train_loss: 0.8359, test_loss: 1.1001, test_f1: 0.5761
 epoch: 20, train_loss: 0.8345, test_loss: 1.0843, test_f1: 0.5876
 epoch: 21, train_loss: 0.7987, test_loss: 1.1368, test_f1: 0.5235
 epoch: 22, train_loss: 0.7930, test_loss: 1.1020, test_f1: 0.5929
 epoch: 23, train_loss: 0.7732, test_loss: 1.1261, test_f1: 0.5697
 epoch: 24, train_loss: 0.7758, test_loss: 1.1331, test_f1: 0.5681
 epoch: 25, train_loss: 0.7739, test_loss: 1.1108, test_f1: 0.5650
 epoch: 26, train_loss: 0.7515, test_loss: 1.1283, test_f1: 0.5967
 epoch: 27, train_loss: 0.7619, test_loss: 1.1627, test_f1: 0.5369
 epoch: 28, train_loss: 0.7470, test_loss: 1.1510, test_f1: 0.6029
 epoch: 29, train_loss: 0.7509, test_loss: 1.1887, test_f1: 0.5743
 epoch: 30, train_loss: 0.7353, test_loss: 1.1556, test_f1: 0.6062
 epoch: 31, train_loss: 0.7263, test_loss: 1.1435, test_f1: 0.6162
 epoch: 32, train_loss: 0.7270, test_loss: 1.2093, test_f1: 0.5834
 epoch: 33, train_loss: 0.7163, test_loss: 1.1782, test_f1: 0.5555
 epoch: 34, train_loss: 0.7218, test_loss: 1.1831, test_f1: 0.5920
 epoch: 35, train_loss: 0.6949, test_loss: 1.1478, test_f1: 0.6236
 epoch: 36, train_loss: 0.6752, test_loss: 1.2018, test_f1: 0.6423
 epoch: 37, train_loss: 0.6767, test_loss: 1.2302, test_f1: 0.5996
 epoch: 38, train_loss: 0.7040, test_loss: 1.2376, test_f1: 0.5850
 epoch: 39, train_loss: 0.6762, test_loss: 1.2185, test_f1: 0.6207
 epoch: 40, train_loss: 0.6565, test_loss: 1.2615, test_f1: 0.6131
 epoch: 41, train_loss: 0.6679, test_loss: 1.1921, test_f1: 0.5867
 epoch: 42, train_loss: 0.6506, test_loss: 1.3003, test_f1: 0.5979
 epoch: 43, train_loss: 0.6470, test_loss: 1.2473, test_f1: 0.6085
 epoch: 44, train_loss: 0.6253, test_loss: 1.2253, test_f1: 0.6230
 epoch: 45, train_loss: 0.6271, test_loss: 1.2904, test_f1: 0.6081
 epoch: 46, train_loss: 0.6156, test_loss: 1.3187, test_f1: 0.6167
 epoch: 47, train_loss: 0.5972, test_loss: 1.3660, test_f1: 0.6030
 epoch: 48, train_loss: 0.5976, test_loss: 1.3798, test_f1: 0.6148
 epoch: 49, train_loss: 0.5769, test_loss: 1.3390, test_f1: 0.6139
 epoch: 50, train_loss: 0.6011, test_loss: 1.3486, test_f1: 0.5891
 epoch: 51, train_loss: 0.5839, test_loss: 1.3412, test_f1: 0.6005
 epoch: 52, train_loss: 0.5750, test_loss: 1.3391, test_f1: 0.6000
 epoch: 53, train_loss: 0.5766, test_loss: 1.3548, test_f1: 0.5970
 epoch: 54, train_loss: 0.5753, test_loss: 1.3632, test_f1: 0.6178
 epoch: 55, train_loss: 0.5636, test_loss: 1.3745, test_f1: 0.5943
 epoch: 56, train_loss: 0.5610, test_loss: 1.3536, test_f1: 0.6139
 epoch: 57, train_loss: 0.5541, test_loss: 1.3710, test_f1: 0.5914
 epoch: 58, train_loss: 0.5504, test_loss: 1.3547, test_f1: 0.5944
 epoch: 59, train_loss: 0.5376, test_loss: 1.3726, test_f1: 0.5950
 epoch: 60, train_loss: 0.5488, test_loss: 1.3605, test_f1: 0.5911
 epoch: 61, train_loss: 0.5423, test_loss: 1.4241, test_f1: 0.6076
 epoch: 62, train_loss: 0.5401, test_loss: 1.4518, test_f1: 0.5951
 epoch: 63, train_loss: 0.5295, test_loss: 1.4194, test_f1: 0.5834
 epoch: 64, train_loss: 0.5203, test_loss: 1.4190, test_f1: 0.5912
 epoch: 65, train_loss: 0.5395, test_loss: 1.5386, test_f1: 0.5438
 epoch: 66, train_loss: 0.5345, test_loss: 1.4201, test_f1: 0.6034
 epoch: 67, train_loss: 0.5391, test_loss: 1.3994, test_f1: 0.5858
 epoch: 68, train_loss: 0.5245, test_loss: 1.4849, test_f1: 0.6025
 epoch: 69, train_loss: 0.5156, test_loss: 1.4226, test_f1: 0.5880
 epoch: 70, train_loss: 0.5018, test_loss: 1.4377, test_f1: 0.5923
 epoch: 71, train_loss: 0.5071, test_loss: 1.4386, test_f1: 0.5809
 epoch: 72, train_loss: 0.5204, test_loss: 1.5155, test_f1: 0.5809
 epoch: 73, train_loss: 0.4952, test_loss: 1.5377, test_f1: 0.5829
 epoch: 74, train_loss: 0.4998, test_loss: 1.5407, test_f1: 0.5993
 epoch: 75, train_loss: 0.5086, test_loss: 1.5786, test_f1: 0.5924
 epoch: 76, train_loss: 0.5072, test_loss: 1.5070, test_f1: 0.5990
 epoch: 77, train_loss: 0.4922, test_loss: 1.5670, test_f1: 0.5779
 epoch: 78, train_loss: 0.4803, test_loss: 1.5963, test_f1: 0.5773
 epoch: 79, train_loss: 0.4836, test_loss: 1.5392, test_f1: 0.5877
 epoch: 80, train_loss: 0.4735, test_loss: 1.5402, test_f1: 0.5836
 epoch: 81, train_loss: 0.4864, test_loss: 1.5386, test_f1: 0.5797
 epoch: 82, train_loss: 0.4626, test_loss: 1.5796, test_f1: 0.5874
 epoch: 83, train_loss: 0.4599, test_loss: 1.6125, test_f1: 0.5943
 epoch: 84, train_loss: 0.4837, test_loss: 1.5776, test_f1: 0.6161
 epoch: 85, train_loss: 0.4722, test_loss: 1.5642, test_f1: 0.6204
 epoch: 86, train_loss: 0.4836, test_loss: 1.5719, test_f1: 0.5964
 epoch: 87, train_loss: 0.4737, test_loss: 1.6032, test_f1: 0.5667
 epoch: 88, train_loss: 0.4778, test_loss: 1.5601, test_f1: 0.5965
 epoch: 89, train_loss: 0.4825, test_loss: 1.6086, test_f1: 0.6065
 epoch: 90, train_loss: 0.4500, test_loss: 1.6269, test_f1: 0.5786
 epoch: 91, train_loss: 0.4719, test_loss: 1.6001, test_f1: 0.5742
 epoch: 92, train_loss: 0.4654, test_loss: 1.5695, test_f1: 0.5926
 epoch: 93, train_loss: 0.4487, test_loss: 1.6272, test_f1: 0.5835
 epoch: 94, train_loss: 0.4632, test_loss: 1.7034, test_f1: 0.5961
 epoch: 95, train_loss: 0.4416, test_loss: 1.5820, test_f1: 0.5912
 epoch: 96, train_loss: 0.4361, test_loss: 1.6805, test_f1: 0.5804
 epoch: 97, train_loss: 0.4309, test_loss: 1.6366, test_f1: 0.5947
 epoch: 98, train_loss: 0.4674, test_loss: 1.6595, test_f1: 0.5648
 epoch: 99, train_loss: 0.4417, test_loss: 1.6039, test_f1: 0.5980
##################ITERATION #3 ****************************************
 epoch: 0, train_loss: 1.2608, test_loss: 1.2781, test_f1: 0.3925
 epoch: 1, train_loss: 1.1622, test_loss: 1.2476, test_f1: 0.4724
 epoch: 2, train_loss: 1.1168, test_loss: 1.1867, test_f1: 0.4958
 epoch: 3, train_loss: 1.0776, test_loss: 1.1442, test_f1: 0.5043
 epoch: 4, train_loss: 1.0482, test_loss: 1.1208, test_f1: 0.5344
 epoch: 5, train_loss: 1.0140, test_loss: 1.1016, test_f1: 0.5395
 epoch: 6, train_loss: 1.0045, test_loss: 1.0909, test_f1: 0.5396
 epoch: 7, train_loss: 0.9664, test_loss: 1.1005, test_f1: 0.5675
 epoch: 8, train_loss: 0.9584, test_loss: 1.0689, test_f1: 0.5936
 epoch: 9, train_loss: 0.9354, test_loss: 1.0661, test_f1: 0.6236
 epoch: 10, train_loss: 0.9247, test_loss: 1.0442, test_f1: 0.6228
 epoch: 11, train_loss: 0.9102, test_loss: 1.0841, test_f1: 0.5689
 epoch: 12, train_loss: 0.8965, test_loss: 1.0587, test_f1: 0.6088
 epoch: 13, train_loss: 0.8795, test_loss: 1.0369, test_f1: 0.6372
 epoch: 14, train_loss: 0.8671, test_loss: 1.0477, test_f1: 0.6225
 epoch: 15, train_loss: 0.8544, test_loss: 1.0923, test_f1: 0.5680
 epoch: 16, train_loss: 0.8475, test_loss: 1.0283, test_f1: 0.6315
 epoch: 17, train_loss: 0.8372, test_loss: 1.1161, test_f1: 0.5923
 epoch: 18, train_loss: 0.8193, test_loss: 1.0439, test_f1: 0.6560
 epoch: 19, train_loss: 0.8342, test_loss: 1.0620, test_f1: 0.6139
 epoch: 20, train_loss: 0.8097, test_loss: 1.0268, test_f1: 0.6414
 epoch: 21, train_loss: 0.7943, test_loss: 1.0072, test_f1: 0.6454
 epoch: 22, train_loss: 0.7690, test_loss: 1.0177, test_f1: 0.6252
 epoch: 23, train_loss: 0.7678, test_loss: 1.0460, test_f1: 0.6340
 epoch: 24, train_loss: 0.7733, test_loss: 1.0084, test_f1: 0.6512
 epoch: 25, train_loss: 0.7724, test_loss: 1.0577, test_f1: 0.6134
 epoch: 26, train_loss: 0.7559, test_loss: 1.0815, test_f1: 0.5838
 epoch: 27, train_loss: 0.7417, test_loss: 0.9885, test_f1: 0.6672
 epoch: 28, train_loss: 0.7235, test_loss: 1.0100, test_f1: 0.6448
 epoch: 29, train_loss: 0.7278, test_loss: 1.0321, test_f1: 0.6514
 epoch: 30, train_loss: 0.7426, test_loss: 1.0349, test_f1: 0.6518
 epoch: 31, train_loss: 0.7090, test_loss: 1.0341, test_f1: 0.6549
 epoch: 32, train_loss: 0.7287, test_loss: 1.0837, test_f1: 0.5801
 epoch: 33, train_loss: 0.7005, test_loss: 1.0486, test_f1: 0.6308
 epoch: 34, train_loss: 0.6983, test_loss: 1.1337, test_f1: 0.6173
 epoch: 35, train_loss: 0.6815, test_loss: 1.1295, test_f1: 0.6279
 epoch: 36, train_loss: 0.6834, test_loss: 1.1246, test_f1: 0.6095
 epoch: 37, train_loss: 0.6908, test_loss: 1.1619, test_f1: 0.6292
 epoch: 38, train_loss: 0.6805, test_loss: 1.1748, test_f1: 0.6065
 epoch: 39, train_loss: 0.6532, test_loss: 1.2017, test_f1: 0.6352
 epoch: 40, train_loss: 0.6714, test_loss: 1.2609, test_f1: 0.5913
 epoch: 41, train_loss: 0.6503, test_loss: 1.3226, test_f1: 0.5716
 epoch: 42, train_loss: 0.6373, test_loss: 1.2303, test_f1: 0.6037
 epoch: 43, train_loss: 0.6342, test_loss: 1.2468, test_f1: 0.5979
 epoch: 44, train_loss: 0.6580, test_loss: 1.2393, test_f1: 0.5918
 epoch: 45, train_loss: 0.6198, test_loss: 1.3285, test_f1: 0.6066
 epoch: 46, train_loss: 0.6361, test_loss: 1.3412, test_f1: 0.5844
 epoch: 47, train_loss: 0.6106, test_loss: 1.3663, test_f1: 0.5919
 epoch: 48, train_loss: 0.6145, test_loss: 1.3385, test_f1: 0.5783
 epoch: 49, train_loss: 0.6042, test_loss: 1.3658, test_f1: 0.6058
 epoch: 50, train_loss: 0.5991, test_loss: 1.3641, test_f1: 0.6090
 epoch: 51, train_loss: 0.6052, test_loss: 1.4071, test_f1: 0.5917
 epoch: 52, train_loss: 0.5822, test_loss: 1.3954, test_f1: 0.5891
 epoch: 53, train_loss: 0.5721, test_loss: 1.4134, test_f1: 0.5810
 epoch: 54, train_loss: 0.5847, test_loss: 1.4588, test_f1: 0.5941
 epoch: 55, train_loss: 0.5525, test_loss: 1.3507, test_f1: 0.5855
 epoch: 56, train_loss: 0.5591, test_loss: 1.4339, test_f1: 0.5930
 epoch: 57, train_loss: 0.5594, test_loss: 1.4103, test_f1: 0.6089
 epoch: 58, train_loss: 0.5562, test_loss: 1.3570, test_f1: 0.5976
 epoch: 59, train_loss: 0.5617, test_loss: 1.3730, test_f1: 0.5946
 epoch: 60, train_loss: 0.5558, test_loss: 1.4238, test_f1: 0.5805
 epoch: 61, train_loss: 0.5573, test_loss: 1.4498, test_f1: 0.6100
 epoch: 62, train_loss: 0.5388, test_loss: 1.3889, test_f1: 0.5961
 epoch: 63, train_loss: 0.5448, test_loss: 1.4529, test_f1: 0.5850
 epoch: 64, train_loss: 0.5654, test_loss: 1.4990, test_f1: 0.6044
 epoch: 65, train_loss: 0.5431, test_loss: 1.4862, test_f1: 0.5966
 epoch: 66, train_loss: 0.5486, test_loss: 1.4650, test_f1: 0.5934
 epoch: 67, train_loss: 0.5312, test_loss: 1.6428, test_f1: 0.5869
 epoch: 68, train_loss: 0.5270, test_loss: 1.4946, test_f1: 0.6019
 epoch: 69, train_loss: 0.5304, test_loss: 1.4922, test_f1: 0.5921
 epoch: 70, train_loss: 0.5324, test_loss: 1.4417, test_f1: 0.6114
 epoch: 71, train_loss: 0.5302, test_loss: 1.4742, test_f1: 0.5925
 epoch: 72, train_loss: 0.5075, test_loss: 1.5070, test_f1: 0.5942
 epoch: 73, train_loss: 0.5160, test_loss: 1.5239, test_f1: 0.6079
 epoch: 74, train_loss: 0.5226, test_loss: 1.5643, test_f1: 0.5852
 epoch: 75, train_loss: 0.4912, test_loss: 1.5214, test_f1: 0.5998
 epoch: 76, train_loss: 0.5315, test_loss: 1.5533, test_f1: 0.5836
 epoch: 77, train_loss: 0.5077, test_loss: 1.6589, test_f1: 0.5932
 epoch: 78, train_loss: 0.4923, test_loss: 1.5696, test_f1: 0.5832
 epoch: 79, train_loss: 0.5155, test_loss: 1.5958, test_f1: 0.6024
 epoch: 80, train_loss: 0.5045, test_loss: 1.6967, test_f1: 0.5712
 epoch: 81, train_loss: 0.4990, test_loss: 1.6207, test_f1: 0.5765
 epoch: 82, train_loss: 0.4927, test_loss: 1.7347, test_f1: 0.5875
 epoch: 83, train_loss: 0.5033, test_loss: 1.6777, test_f1: 0.5803
 epoch: 84, train_loss: 0.5060, test_loss: 1.5889, test_f1: 0.5943
 epoch: 85, train_loss: 0.5013, test_loss: 1.6238, test_f1: 0.5926
 epoch: 86, train_loss: 0.5106, test_loss: 1.6915, test_f1: 0.6069
 epoch: 87, train_loss: 0.4751, test_loss: 1.6527, test_f1: 0.5939
 epoch: 88, train_loss: 0.5009, test_loss: 1.8902, test_f1: 0.5728
 epoch: 89, train_loss: 0.4821, test_loss: 1.7677, test_f1: 0.5975
 epoch: 90, train_loss: 0.4757, test_loss: 1.7329, test_f1: 0.6005
 epoch: 91, train_loss: 0.4754, test_loss: 1.7741, test_f1: 0.5740
 epoch: 92, train_loss: 0.4800, test_loss: 1.7555, test_f1: 0.6002
 epoch: 93, train_loss: 0.4654, test_loss: 1.8817, test_f1: 0.5872
 epoch: 94, train_loss: 0.4593, test_loss: 1.7332, test_f1: 0.6062
 epoch: 95, train_loss: 0.4656, test_loss: 1.8583, test_f1: 0.5634
 epoch: 96, train_loss: 0.4483, test_loss: 1.7367, test_f1: 0.6025
 epoch: 97, train_loss: 0.4403, test_loss: 1.7239, test_f1: 0.5936
 epoch: 98, train_loss: 0.4655, test_loss: 1.7735, test_f1: 0.6174
 epoch: 99, train_loss: 0.4508, test_loss: 1.8414, test_f1: 0.5857
##################ITERATION #4 ****************************************
 epoch: 0, train_loss: 1.2713, test_loss: 1.2536, test_f1: 0.3748
 epoch: 1, train_loss: 1.1447, test_loss: 1.2572, test_f1: 0.4567
 epoch: 2, train_loss: 1.1096, test_loss: 1.2148, test_f1: 0.4620
 epoch: 3, train_loss: 1.0639, test_loss: 1.2047, test_f1: 0.4664
 epoch: 4, train_loss: 1.0553, test_loss: 1.2306, test_f1: 0.4818
 epoch: 5, train_loss: 1.0292, test_loss: 1.2098, test_f1: 0.4811
 epoch: 6, train_loss: 1.0125, test_loss: 1.2123, test_f1: 0.5257
 epoch: 7, train_loss: 0.9734, test_loss: 1.2537, test_f1: 0.4763
 epoch: 8, train_loss: 0.9579, test_loss: 1.1737, test_f1: 0.5166
 epoch: 9, train_loss: 0.9556, test_loss: 1.1365, test_f1: 0.5667
 epoch: 10, train_loss: 0.9467, test_loss: 1.1494, test_f1: 0.5374
 epoch: 11, train_loss: 0.9248, test_loss: 1.2695, test_f1: 0.5205
 epoch: 12, train_loss: 0.8997, test_loss: 1.1884, test_f1: 0.5306
 epoch: 13, train_loss: 0.8905, test_loss: 1.1447, test_f1: 0.5405
 epoch: 14, train_loss: 0.8959, test_loss: 1.1930, test_f1: 0.5433
 epoch: 15, train_loss: 0.8708, test_loss: 1.2153, test_f1: 0.5612
 epoch: 16, train_loss: 0.8599, test_loss: 1.1520, test_f1: 0.5475
 epoch: 17, train_loss: 0.8372, test_loss: 1.1406, test_f1: 0.5689
 epoch: 18, train_loss: 0.8303, test_loss: 1.2767, test_f1: 0.5232
 epoch: 19, train_loss: 0.8237, test_loss: 1.3174, test_f1: 0.5350
 epoch: 20, train_loss: 0.8097, test_loss: 1.3277, test_f1: 0.5198
 epoch: 21, train_loss: 0.8125, test_loss: 1.2607, test_f1: 0.5621
 epoch: 22, train_loss: 0.7997, test_loss: 1.3445, test_f1: 0.5559
 epoch: 23, train_loss: 0.7994, test_loss: 1.2505, test_f1: 0.5724
 epoch: 24, train_loss: 0.7811, test_loss: 1.3022, test_f1: 0.5587
 epoch: 25, train_loss: 0.7655, test_loss: 1.3025, test_f1: 0.5368
 epoch: 26, train_loss: 0.7626, test_loss: 1.2138, test_f1: 0.5570
 epoch: 27, train_loss: 0.7499, test_loss: 1.3780, test_f1: 0.5654
 epoch: 28, train_loss: 0.7377, test_loss: 1.4264, test_f1: 0.5388
 epoch: 29, train_loss: 0.7381, test_loss: 1.4027, test_f1: 0.5656
 epoch: 30, train_loss: 0.7412, test_loss: 1.3264, test_f1: 0.5691
 epoch: 31, train_loss: 0.7170, test_loss: 1.4033, test_f1: 0.5816
 epoch: 32, train_loss: 0.7268, test_loss: 1.5716, test_f1: 0.5741
 epoch: 33, train_loss: 0.7152, test_loss: 1.4874, test_f1: 0.5580
 epoch: 34, train_loss: 0.6855, test_loss: 1.4048, test_f1: 0.5766
 epoch: 35, train_loss: 0.7083, test_loss: 1.4168, test_f1: 0.5460
 epoch: 36, train_loss: 0.6776, test_loss: 1.6748, test_f1: 0.5618
 epoch: 37, train_loss: 0.6796, test_loss: 1.4237, test_f1: 0.5667
 epoch: 38, train_loss: 0.6713, test_loss: 1.5392, test_f1: 0.5759
 epoch: 39, train_loss: 0.6648, test_loss: 1.4140, test_f1: 0.5649
 epoch: 40, train_loss: 0.6403, test_loss: 1.4511, test_f1: 0.5670
 epoch: 41, train_loss: 0.6599, test_loss: 1.5615, test_f1: 0.5725
 epoch: 42, train_loss: 0.6343, test_loss: 1.6240, test_f1: 0.5444
 epoch: 43, train_loss: 0.6266, test_loss: 1.5743, test_f1: 0.5538
 epoch: 44, train_loss: 0.6419, test_loss: 1.5892, test_f1: 0.5495
 epoch: 45, train_loss: 0.6163, test_loss: 1.5970, test_f1: 0.5905
 epoch: 46, train_loss: 0.6111, test_loss: 1.5679, test_f1: 0.5836
 epoch: 47, train_loss: 0.6070, test_loss: 1.6705, test_f1: 0.5631
 epoch: 48, train_loss: 0.6229, test_loss: 1.4305, test_f1: 0.5590
 epoch: 49, train_loss: 0.5987, test_loss: 1.6000, test_f1: 0.5905
 epoch: 50, train_loss: 0.5785, test_loss: 1.6237, test_f1: 0.5729
 epoch: 51, train_loss: 0.5727, test_loss: 1.8694, test_f1: 0.5635
 epoch: 52, train_loss: 0.5731, test_loss: 1.7991, test_f1: 0.5695
 epoch: 53, train_loss: 0.5589, test_loss: 1.5700, test_f1: 0.5702
 epoch: 54, train_loss: 0.5599, test_loss: 1.6574, test_f1: 0.5620
 epoch: 55, train_loss: 0.5379, test_loss: 1.5767, test_f1: 0.5462
 epoch: 56, train_loss: 0.5574, test_loss: 1.6163, test_f1: 0.6002
 epoch: 57, train_loss: 0.5448, test_loss: 1.8986, test_f1: 0.5545
 epoch: 58, train_loss: 0.5347, test_loss: 1.6797, test_f1: 0.5659
 epoch: 59, train_loss: 0.5518, test_loss: 1.6870, test_f1: 0.5598
 epoch: 60, train_loss: 0.5520, test_loss: 1.7121, test_f1: 0.5898
 epoch: 61, train_loss: 0.5387, test_loss: 1.6892, test_f1: 0.5623
 epoch: 62, train_loss: 0.5408, test_loss: 1.7765, test_f1: 0.5781
 epoch: 63, train_loss: 0.5144, test_loss: 1.6861, test_f1: 0.5730
 epoch: 64, train_loss: 0.5300, test_loss: 1.8097, test_f1: 0.5684
 epoch: 65, train_loss: 0.5279, test_loss: 1.8604, test_f1: 0.5753
 epoch: 66, train_loss: 0.5243, test_loss: 1.9385, test_f1: 0.5610
 epoch: 67, train_loss: 0.5093, test_loss: 1.9398, test_f1: 0.5594
 epoch: 68, train_loss: 0.5224, test_loss: 1.9166, test_f1: 0.5705
 epoch: 69, train_loss: 0.5136, test_loss: 1.8651, test_f1: 0.5651
 epoch: 70, train_loss: 0.4898, test_loss: 1.8488, test_f1: 0.5853
 epoch: 71, train_loss: 0.4942, test_loss: 1.8827, test_f1: 0.5791
 epoch: 72, train_loss: 0.5055, test_loss: 1.8456, test_f1: 0.5758
 epoch: 73, train_loss: 0.4937, test_loss: 2.0400, test_f1: 0.5664
 epoch: 74, train_loss: 0.5035, test_loss: 1.8350, test_f1: 0.5822
 epoch: 75, train_loss: 0.4987, test_loss: 1.8754, test_f1: 0.5558
 epoch: 76, train_loss: 0.4980, test_loss: 1.9624, test_f1: 0.5785
 epoch: 77, train_loss: 0.4672, test_loss: 1.9161, test_f1: 0.5713
 epoch: 78, train_loss: 0.4821, test_loss: 2.1774, test_f1: 0.5711
 epoch: 79, train_loss: 0.5095, test_loss: 1.9381, test_f1: 0.5688
 epoch: 80, train_loss: 0.4859, test_loss: 2.0923, test_f1: 0.5538
 epoch: 81, train_loss: 0.4562, test_loss: 2.0357, test_f1: 0.5699
 epoch: 82, train_loss: 0.4613, test_loss: 2.2666, test_f1: 0.5773
 epoch: 83, train_loss: 0.4685, test_loss: 1.8866, test_f1: 0.5651
 epoch: 84, train_loss: 0.4576, test_loss: 1.9240, test_f1: 0.5898
 epoch: 85, train_loss: 0.4756, test_loss: 2.1178, test_f1: 0.5875
 epoch: 86, train_loss: 0.4678, test_loss: 2.1020, test_f1: 0.5780
 epoch: 87, train_loss: 0.4920, test_loss: 2.2826, test_f1: 0.5915
 epoch: 88, train_loss: 0.4648, test_loss: 2.3070, test_f1: 0.5834
 epoch: 89, train_loss: 0.4445, test_loss: 2.3359, test_f1: 0.5862
 epoch: 90, train_loss: 0.4642, test_loss: 2.0141, test_f1: 0.5577
 epoch: 91, train_loss: 0.4669, test_loss: 2.4529, test_f1: 0.5676
 epoch: 92, train_loss: 0.4599, test_loss: 2.4331, test_f1: 0.5641
 epoch: 93, train_loss: 0.4531, test_loss: 2.1873, test_f1: 0.5633
 epoch: 94, train_loss: 0.4442, test_loss: 2.2965, test_f1: 0.5719
 epoch: 95, train_loss: 0.4565, test_loss: 2.4091, test_f1: 0.5767
 epoch: 96, train_loss: 0.4518, test_loss: 2.4489, test_f1: 0.5719
 epoch: 97, train_loss: 0.4473, test_loss: 2.2121, test_f1: 0.5681
 epoch: 98, train_loss: 0.4385, test_loss: 2.3906, test_f1: 0.5975
 epoch: 99, train_loss: 0.4424, test_loss: 2.3458, test_f1: 0.5614
##################ITERATION #5 ****************************************
 epoch: 0, train_loss: 1.2758, test_loss: 1.2786, test_f1: 0.3734
 epoch: 1, train_loss: 1.1826, test_loss: 1.2407, test_f1: 0.4810
 epoch: 2, train_loss: 1.1109, test_loss: 1.1882, test_f1: 0.4721
 epoch: 3, train_loss: 1.0911, test_loss: 1.1767, test_f1: 0.4601
 epoch: 4, train_loss: 1.0577, test_loss: 1.1809, test_f1: 0.4696
 epoch: 5, train_loss: 1.0402, test_loss: 1.1650, test_f1: 0.5160
 epoch: 6, train_loss: 1.0357, test_loss: 1.1691, test_f1: 0.5319
 epoch: 7, train_loss: 0.9800, test_loss: 1.1766, test_f1: 0.5623
 epoch: 8, train_loss: 0.9780, test_loss: 1.1385, test_f1: 0.5302
 epoch: 9, train_loss: 0.9602, test_loss: 1.1127, test_f1: 0.5660
 epoch: 10, train_loss: 0.9446, test_loss: 1.1722, test_f1: 0.5382
 epoch: 11, train_loss: 0.9355, test_loss: 1.1579, test_f1: 0.5515
 epoch: 12, train_loss: 0.9239, test_loss: 1.1181, test_f1: 0.5426
 epoch: 13, train_loss: 0.9010, test_loss: 1.1695, test_f1: 0.5323
 epoch: 14, train_loss: 0.8802, test_loss: 1.1619, test_f1: 0.4973
 epoch: 15, train_loss: 0.8670, test_loss: 1.1988, test_f1: 0.5611
 epoch: 16, train_loss: 0.8744, test_loss: 1.1615, test_f1: 0.5606
 epoch: 17, train_loss: 0.8727, test_loss: 1.1284, test_f1: 0.5504
 epoch: 18, train_loss: 0.8678, test_loss: 1.1602, test_f1: 0.5609
 epoch: 19, train_loss: 0.8252, test_loss: 1.1485, test_f1: 0.5799
 epoch: 20, train_loss: 0.8379, test_loss: 1.1508, test_f1: 0.5731
 epoch: 21, train_loss: 0.8086, test_loss: 1.2157, test_f1: 0.5474
 epoch: 22, train_loss: 0.8025, test_loss: 1.1671, test_f1: 0.6049
 epoch: 23, train_loss: 0.7966, test_loss: 1.2068, test_f1: 0.5484
 epoch: 24, train_loss: 0.7910, test_loss: 1.2098, test_f1: 0.5261
 epoch: 25, train_loss: 0.7951, test_loss: 1.2366, test_f1: 0.5667
 epoch: 26, train_loss: 0.7767, test_loss: 1.1843, test_f1: 0.5906
 epoch: 27, train_loss: 0.7936, test_loss: 1.1611, test_f1: 0.5714
 epoch: 28, train_loss: 0.7751, test_loss: 1.2057, test_f1: 0.5798
 epoch: 29, train_loss: 0.7632, test_loss: 1.2032, test_f1: 0.5678
 epoch: 30, train_loss: 0.7558, test_loss: 1.2210, test_f1: 0.5764
 epoch: 31, train_loss: 0.7579, test_loss: 1.2510, test_f1: 0.5651
 epoch: 32, train_loss: 0.7413, test_loss: 1.2840, test_f1: 0.5571
 epoch: 33, train_loss: 0.7426, test_loss: 1.4186, test_f1: 0.5445
 epoch: 34, train_loss: 0.7176, test_loss: 1.3446, test_f1: 0.5464
 epoch: 35, train_loss: 0.7249, test_loss: 1.3280, test_f1: 0.5742
 epoch: 36, train_loss: 0.7196, test_loss: 1.4459, test_f1: 0.5552
 epoch: 37, train_loss: 0.6905, test_loss: 1.3874, test_f1: 0.5647
 epoch: 38, train_loss: 0.6926, test_loss: 1.3374, test_f1: 0.5791
 epoch: 39, train_loss: 0.6955, test_loss: 1.3277, test_f1: 0.5656
 epoch: 40, train_loss: 0.6915, test_loss: 1.3550, test_f1: 0.5882
 epoch: 41, train_loss: 0.6808, test_loss: 1.3700, test_f1: 0.5713
 epoch: 42, train_loss: 0.6837, test_loss: 1.2969, test_f1: 0.5723
 epoch: 43, train_loss: 0.6845, test_loss: 1.3751, test_f1: 0.5646
 epoch: 44, train_loss: 0.6571, test_loss: 1.4458, test_f1: 0.5650
 epoch: 45, train_loss: 0.6517, test_loss: 1.5420, test_f1: 0.5517
 epoch: 46, train_loss: 0.6813, test_loss: 1.5910, test_f1: 0.5506
 epoch: 47, train_loss: 0.6454, test_loss: 1.4063, test_f1: 0.5626
 epoch: 48, train_loss: 0.6291, test_loss: 1.5161, test_f1: 0.5584
 epoch: 49, train_loss: 0.6454, test_loss: 1.4941, test_f1: 0.6033
 epoch: 50, train_loss: 0.6339, test_loss: 1.5902, test_f1: 0.5482
 epoch: 51, train_loss: 0.6058, test_loss: 1.5339, test_f1: 0.5460
 epoch: 52, train_loss: 0.6049, test_loss: 1.5078, test_f1: 0.5431
 epoch: 53, train_loss: 0.6135, test_loss: 1.6153, test_f1: 0.5436
 epoch: 54, train_loss: 0.6156, test_loss: 1.5084, test_f1: 0.5733
 epoch: 55, train_loss: 0.5866, test_loss: 1.6290, test_f1: 0.5481
 epoch: 56, train_loss: 0.5921, test_loss: 1.7182, test_f1: 0.5361
 epoch: 57, train_loss: 0.5953, test_loss: 1.6545, test_f1: 0.5446
 epoch: 58, train_loss: 0.6006, test_loss: 1.5798, test_f1: 0.5559
 epoch: 59, train_loss: 0.5986, test_loss: 1.7252, test_f1: 0.5324
 epoch: 60, train_loss: 0.6104, test_loss: 1.6054, test_f1: 0.5621
 epoch: 61, train_loss: 0.5913, test_loss: 1.6423, test_f1: 0.5507
 epoch: 62, train_loss: 0.5879, test_loss: 1.6147, test_f1: 0.5331
 epoch: 63, train_loss: 0.5739, test_loss: 1.7037, test_f1: 0.5384
 epoch: 64, train_loss: 0.5809, test_loss: 1.6823, test_f1: 0.5574
 epoch: 65, train_loss: 0.5756, test_loss: 1.6489, test_f1: 0.5502
 epoch: 66, train_loss: 0.5783, test_loss: 1.6890, test_f1: 0.5600
 epoch: 67, train_loss: 0.5520, test_loss: 1.7029, test_f1: 0.5503
 epoch: 68, train_loss: 0.5506, test_loss: 1.6765, test_f1: 0.5483
 epoch: 69, train_loss: 0.5766, test_loss: 1.7732, test_f1: 0.5414
 epoch: 70, train_loss: 0.5489, test_loss: 1.7079, test_f1: 0.5573
 epoch: 71, train_loss: 0.5485, test_loss: 1.7202, test_f1: 0.5433
 epoch: 72, train_loss: 0.5425, test_loss: 1.9252, test_f1: 0.5371
 epoch: 73, train_loss: 0.5513, test_loss: 1.7423, test_f1: 0.5457
 epoch: 74, train_loss: 0.5633, test_loss: 1.7756, test_f1: 0.5451
 epoch: 75, train_loss: 0.5388, test_loss: 1.7809, test_f1: 0.5536
 epoch: 76, train_loss: 0.5481, test_loss: 1.7677, test_f1: 0.5498
 epoch: 77, train_loss: 0.5321, test_loss: 1.7365, test_f1: 0.5371
 epoch: 78, train_loss: 0.5377, test_loss: 1.8302, test_f1: 0.5703
 epoch: 79, train_loss: 0.5419, test_loss: 1.8841, test_f1: 0.5583
 epoch: 80, train_loss: 0.5150, test_loss: 1.9083, test_f1: 0.5630
 epoch: 81, train_loss: 0.5297, test_loss: 1.8302, test_f1: 0.5445
 epoch: 82, train_loss: 0.5369, test_loss: 1.7896, test_f1: 0.5639
 epoch: 83, train_loss: 0.5313, test_loss: 1.8042, test_f1: 0.5581
 epoch: 84, train_loss: 0.5172, test_loss: 1.8617, test_f1: 0.5372
 epoch: 85, train_loss: 0.5526, test_loss: 1.8215, test_f1: 0.5564
 epoch: 86, train_loss: 0.5171, test_loss: 1.8438, test_f1: 0.5624
 epoch: 87, train_loss: 0.5031, test_loss: 1.7604, test_f1: 0.5602
 epoch: 88, train_loss: 0.5052, test_loss: 1.7010, test_f1: 0.5762
 epoch: 89, train_loss: 0.5050, test_loss: 1.8464, test_f1: 0.5676
 epoch: 90, train_loss: 0.5117, test_loss: 2.0016, test_f1: 0.5567
 epoch: 91, train_loss: 0.5214, test_loss: 1.8223, test_f1: 0.5670
 epoch: 92, train_loss: 0.4943, test_loss: 1.8964, test_f1: 0.5527
 epoch: 93, train_loss: 0.4822, test_loss: 1.8687, test_f1: 0.5587
 epoch: 94, train_loss: 0.5020, test_loss: 1.9233, test_f1: 0.5572
 epoch: 95, train_loss: 0.5007, test_loss: 1.8613, test_f1: 0.5667
 epoch: 96, train_loss: 0.5125, test_loss: 2.0521, test_f1: 0.5551
 epoch: 97, train_loss: 0.4975, test_loss: 1.9122, test_f1: 0.5678
 epoch: 98, train_loss: 0.4974, test_loss: 1.9559, test_f1: 0.5660
 epoch: 99, train_loss: 0.5018, test_loss: 2.1220, test_f1: 0.5683
##################ITERATION #6 ****************************************
 epoch: 0, train_loss: 1.3004, test_loss: 1.2965, test_f1: 0.3645
 epoch: 1, train_loss: 1.1338, test_loss: 1.2026, test_f1: 0.4805
 epoch: 2, train_loss: 1.1259, test_loss: 1.1837, test_f1: 0.4931
 epoch: 3, train_loss: 1.0777, test_loss: 1.1689, test_f1: 0.4990
 epoch: 4, train_loss: 1.0485, test_loss: 1.1754, test_f1: 0.4939
 epoch: 5, train_loss: 1.0179, test_loss: 1.1548, test_f1: 0.4982
 epoch: 6, train_loss: 1.0077, test_loss: 1.1265, test_f1: 0.5205
 epoch: 7, train_loss: 1.0069, test_loss: 1.1395, test_f1: 0.5185
 epoch: 8, train_loss: 0.9946, test_loss: 1.1201, test_f1: 0.5055
 epoch: 9, train_loss: 0.9555, test_loss: 1.1186, test_f1: 0.5170
 epoch: 10, train_loss: 0.9612, test_loss: 1.1649, test_f1: 0.5009
 epoch: 11, train_loss: 0.9401, test_loss: 1.1590, test_f1: 0.5143
 epoch: 12, train_loss: 0.9232, test_loss: 1.1662, test_f1: 0.5275
 epoch: 13, train_loss: 0.9029, test_loss: 1.1221, test_f1: 0.5574
 epoch: 14, train_loss: 0.9152, test_loss: 1.1606, test_f1: 0.5622
 epoch: 15, train_loss: 0.9075, test_loss: 1.1416, test_f1: 0.5707
 epoch: 16, train_loss: 0.8799, test_loss: 1.1111, test_f1: 0.5131
 epoch: 17, train_loss: 0.8673, test_loss: 1.1636, test_f1: 0.5342
 epoch: 18, train_loss: 0.8573, test_loss: 1.1078, test_f1: 0.5477
 epoch: 19, train_loss: 0.8450, test_loss: 1.1572, test_f1: 0.5228
 epoch: 20, train_loss: 0.8465, test_loss: 1.1461, test_f1: 0.5453
 epoch: 21, train_loss: 0.8212, test_loss: 1.1446, test_f1: 0.6018
 epoch: 22, train_loss: 0.8541, test_loss: 1.1598, test_f1: 0.5576
 epoch: 23, train_loss: 0.8392, test_loss: 1.1348, test_f1: 0.5723
 epoch: 24, train_loss: 0.8198, test_loss: 1.1028, test_f1: 0.5556
 epoch: 25, train_loss: 0.8044, test_loss: 1.1422, test_f1: 0.5974
 epoch: 26, train_loss: 0.8011, test_loss: 1.1197, test_f1: 0.5804
 epoch: 27, train_loss: 0.7797, test_loss: 1.1371, test_f1: 0.6105
 epoch: 28, train_loss: 0.7808, test_loss: 1.1632, test_f1: 0.6161
 epoch: 29, train_loss: 0.7985, test_loss: 1.1231, test_f1: 0.5784
 epoch: 30, train_loss: 0.7573, test_loss: 1.1355, test_f1: 0.5870
 epoch: 31, train_loss: 0.7559, test_loss: 1.2208, test_f1: 0.5262
 epoch: 32, train_loss: 0.7522, test_loss: 1.1651, test_f1: 0.6008
 epoch: 33, train_loss: 0.7321, test_loss: 1.1549, test_f1: 0.5831
 epoch: 34, train_loss: 0.7318, test_loss: 1.2335, test_f1: 0.5582
 epoch: 35, train_loss: 0.7307, test_loss: 1.2061, test_f1: 0.6222
 epoch: 36, train_loss: 0.7211, test_loss: 1.2210, test_f1: 0.5912
 epoch: 37, train_loss: 0.7086, test_loss: 1.2114, test_f1: 0.6167
 epoch: 38, train_loss: 0.7197, test_loss: 1.1991, test_f1: 0.5863
 epoch: 39, train_loss: 0.7180, test_loss: 1.3404, test_f1: 0.5513
 epoch: 40, train_loss: 0.6881, test_loss: 1.1893, test_f1: 0.6046
 epoch: 41, train_loss: 0.7076, test_loss: 1.1830, test_f1: 0.5979
 epoch: 42, train_loss: 0.6823, test_loss: 1.3878, test_f1: 0.5376
 epoch: 43, train_loss: 0.6876, test_loss: 1.2677, test_f1: 0.5695
 epoch: 44, train_loss: 0.6792, test_loss: 1.3614, test_f1: 0.5801
 epoch: 45, train_loss: 0.6517, test_loss: 1.3272, test_f1: 0.5706
 epoch: 46, train_loss: 0.6532, test_loss: 1.3237, test_f1: 0.5754
 epoch: 47, train_loss: 0.6655, test_loss: 1.2169, test_f1: 0.5857
 epoch: 48, train_loss: 0.6452, test_loss: 1.3455, test_f1: 0.5714
 epoch: 49, train_loss: 0.6475, test_loss: 1.3082, test_f1: 0.5770
 epoch: 50, train_loss: 0.6268, test_loss: 1.2859, test_f1: 0.5822
 epoch: 51, train_loss: 0.6187, test_loss: 1.3466, test_f1: 0.5827
 epoch: 52, train_loss: 0.6083, test_loss: 1.4167, test_f1: 0.5796
 epoch: 53, train_loss: 0.6120, test_loss: 1.4182, test_f1: 0.5820
 epoch: 54, train_loss: 0.6114, test_loss: 1.3815, test_f1: 0.5483
 epoch: 55, train_loss: 0.5919, test_loss: 1.4034, test_f1: 0.5701
 epoch: 56, train_loss: 0.5940, test_loss: 1.3831, test_f1: 0.5751
 epoch: 57, train_loss: 0.6012, test_loss: 1.4896, test_f1: 0.5654
 epoch: 58, train_loss: 0.5889, test_loss: 1.4206, test_f1: 0.5841
 epoch: 59, train_loss: 0.6049, test_loss: 1.4248, test_f1: 0.5633
 epoch: 60, train_loss: 0.5704, test_loss: 1.4764, test_f1: 0.5619
 epoch: 61, train_loss: 0.5875, test_loss: 1.4339, test_f1: 0.5802
 epoch: 62, train_loss: 0.5758, test_loss: 1.4126, test_f1: 0.5739
 epoch: 63, train_loss: 0.5757, test_loss: 1.5036, test_f1: 0.5762
 epoch: 64, train_loss: 0.5835, test_loss: 1.5032, test_f1: 0.5787
 epoch: 65, train_loss: 0.5583, test_loss: 1.4812, test_f1: 0.5929
 epoch: 66, train_loss: 0.5505, test_loss: 1.4763, test_f1: 0.5871
 epoch: 67, train_loss: 0.5470, test_loss: 1.4957, test_f1: 0.5798
 epoch: 68, train_loss: 0.5673, test_loss: 1.5522, test_f1: 0.5683
 epoch: 69, train_loss: 0.5734, test_loss: 1.5643, test_f1: 0.5904
 epoch: 70, train_loss: 0.5686, test_loss: 1.5667, test_f1: 0.5739
 epoch: 71, train_loss: 0.5446, test_loss: 1.5137, test_f1: 0.5648
 epoch: 72, train_loss: 0.5543, test_loss: 1.5411, test_f1: 0.5760
 epoch: 73, train_loss: 0.5594, test_loss: 1.5262, test_f1: 0.5826
 epoch: 74, train_loss: 0.5394, test_loss: 1.6272, test_f1: 0.5661
 epoch: 75, train_loss: 0.5618, test_loss: 1.5447, test_f1: 0.5671
 epoch: 76, train_loss: 0.5597, test_loss: 1.5455, test_f1: 0.5698
 epoch: 77, train_loss: 0.5326, test_loss: 1.6260, test_f1: 0.5715
 epoch: 78, train_loss: 0.5348, test_loss: 1.6199, test_f1: 0.5723
 epoch: 79, train_loss: 0.5341, test_loss: 1.7347, test_f1: 0.5629
 epoch: 80, train_loss: 0.5238, test_loss: 1.6733, test_f1: 0.5670
 epoch: 81, train_loss: 0.5288, test_loss: 1.5778, test_f1: 0.5677
 epoch: 82, train_loss: 0.5457, test_loss: 1.6743, test_f1: 0.5824
 epoch: 83, train_loss: 0.5158, test_loss: 1.7170, test_f1: 0.5757
 epoch: 84, train_loss: 0.5119, test_loss: 1.6819, test_f1: 0.5696
 epoch: 85, train_loss: 0.5152, test_loss: 1.7465, test_f1: 0.5705
 epoch: 86, train_loss: 0.5129, test_loss: 1.7176, test_f1: 0.5791
 epoch: 87, train_loss: 0.5103, test_loss: 1.7804, test_f1: 0.5787
 epoch: 88, train_loss: 0.5145, test_loss: 1.8597, test_f1: 0.5664
 epoch: 89, train_loss: 0.4971, test_loss: 1.8530, test_f1: 0.5652
 epoch: 90, train_loss: 0.5115, test_loss: 1.8500, test_f1: 0.5752
 epoch: 91, train_loss: 0.5057, test_loss: 1.8644, test_f1: 0.5884
 epoch: 92, train_loss: 0.5307, test_loss: 1.8680, test_f1: 0.5714
 epoch: 93, train_loss: 0.4743, test_loss: 1.7948, test_f1: 0.5596
 epoch: 94, train_loss: 0.4847, test_loss: 1.8323, test_f1: 0.5725
 epoch: 95, train_loss: 0.4862, test_loss: 1.8430, test_f1: 0.5749
 epoch: 96, train_loss: 0.4945, test_loss: 1.7670, test_f1: 0.5716
 epoch: 97, train_loss: 0.5005, test_loss: 1.8295, test_f1: 0.5761
 epoch: 98, train_loss: 0.5112, test_loss: 1.8953, test_f1: 0.5782
 epoch: 99, train_loss: 0.4732, test_loss: 1.7946, test_f1: 0.5945
##################ITERATION #7 ****************************************
 epoch: 0, train_loss: 1.3015, test_loss: 1.1799, test_f1: 0.4840
 epoch: 1, train_loss: 1.1263, test_loss: 1.1792, test_f1: 0.4984
 epoch: 2, train_loss: 1.1116, test_loss: 1.1635, test_f1: 0.5090
 epoch: 3, train_loss: 1.0668, test_loss: 1.1449, test_f1: 0.5287
 epoch: 4, train_loss: 1.0415, test_loss: 1.1396, test_f1: 0.5244
 epoch: 5, train_loss: 0.9893, test_loss: 1.1295, test_f1: 0.5383
 epoch: 6, train_loss: 0.9762, test_loss: 1.1368, test_f1: 0.5531
 epoch: 7, train_loss: 0.9643, test_loss: 1.1562, test_f1: 0.5495
 epoch: 8, train_loss: 0.9725, test_loss: 1.1738, test_f1: 0.5572
 epoch: 9, train_loss: 0.9346, test_loss: 1.1702, test_f1: 0.5452
 epoch: 10, train_loss: 0.9164, test_loss: 1.1540, test_f1: 0.5857
 epoch: 11, train_loss: 0.9267, test_loss: 1.1490, test_f1: 0.5530
 epoch: 12, train_loss: 0.9040, test_loss: 1.1323, test_f1: 0.5884
 epoch: 13, train_loss: 0.8926, test_loss: 1.1482, test_f1: 0.6003
 epoch: 14, train_loss: 0.8801, test_loss: 1.1643, test_f1: 0.6013
 epoch: 15, train_loss: 0.8655, test_loss: 1.1577, test_f1: 0.5720
 epoch: 16, train_loss: 0.8751, test_loss: 1.1595, test_f1: 0.5769
 epoch: 17, train_loss: 0.8609, test_loss: 1.1668, test_f1: 0.5747
 epoch: 18, train_loss: 0.8532, test_loss: 1.1774, test_f1: 0.5767
 epoch: 19, train_loss: 0.8361, test_loss: 1.1886, test_f1: 0.5746
 epoch: 20, train_loss: 0.8246, test_loss: 1.2258, test_f1: 0.5529
 epoch: 21, train_loss: 0.8231, test_loss: 1.1955, test_f1: 0.5847
 epoch: 22, train_loss: 0.8103, test_loss: 1.2248, test_f1: 0.5577
 epoch: 23, train_loss: 0.7929, test_loss: 1.2217, test_f1: 0.5714
 epoch: 24, train_loss: 0.7957, test_loss: 1.2594, test_f1: 0.5307
 epoch: 25, train_loss: 0.7928, test_loss: 1.2530, test_f1: 0.5819
 epoch: 26, train_loss: 0.7610, test_loss: 1.2107, test_f1: 0.5868
 epoch: 27, train_loss: 0.7741, test_loss: 1.2041, test_f1: 0.5739
 epoch: 28, train_loss: 0.7603, test_loss: 1.2531, test_f1: 0.5571
 epoch: 29, train_loss: 0.7694, test_loss: 1.2292, test_f1: 0.5640
 epoch: 30, train_loss: 0.7589, test_loss: 1.3010, test_f1: 0.5744
 epoch: 31, train_loss: 0.7372, test_loss: 1.2755, test_f1: 0.5746
 epoch: 32, train_loss: 0.7259, test_loss: 1.2767, test_f1: 0.5661
 epoch: 33, train_loss: 0.7282, test_loss: 1.3331, test_f1: 0.5680
 epoch: 34, train_loss: 0.7298, test_loss: 1.3226, test_f1: 0.5715
 epoch: 35, train_loss: 0.7208, test_loss: 1.3668, test_f1: 0.5922
 epoch: 36, train_loss: 0.7186, test_loss: 1.4029, test_f1: 0.5694
 epoch: 37, train_loss: 0.7134, test_loss: 1.4101, test_f1: 0.5718
 epoch: 38, train_loss: 0.6930, test_loss: 1.4490, test_f1: 0.5561
 epoch: 39, train_loss: 0.6723, test_loss: 1.4220, test_f1: 0.5657
 epoch: 40, train_loss: 0.6715, test_loss: 1.4630, test_f1: 0.5607
 epoch: 41, train_loss: 0.6798, test_loss: 1.4519, test_f1: 0.5510
 epoch: 42, train_loss: 0.6789, test_loss: 1.4808, test_f1: 0.5543
 epoch: 43, train_loss: 0.6542, test_loss: 1.4077, test_f1: 0.5668
 epoch: 44, train_loss: 0.6484, test_loss: 1.4954, test_f1: 0.5412
 epoch: 45, train_loss: 0.6390, test_loss: 1.5025, test_f1: 0.5645
 epoch: 46, train_loss: 0.6410, test_loss: 1.4830, test_f1: 0.5688
 epoch: 47, train_loss: 0.6424, test_loss: 1.4787, test_f1: 0.5586
 epoch: 48, train_loss: 0.6232, test_loss: 1.5704, test_f1: 0.5228
 epoch: 49, train_loss: 0.6205, test_loss: 1.5953, test_f1: 0.5344
 epoch: 50, train_loss: 0.6142, test_loss: 1.6827, test_f1: 0.5623
 epoch: 51, train_loss: 0.5956, test_loss: 1.6098, test_f1: 0.5616
 epoch: 52, train_loss: 0.5979, test_loss: 1.6319, test_f1: 0.5514
 epoch: 53, train_loss: 0.5812, test_loss: 1.5985, test_f1: 0.5524
 epoch: 54, train_loss: 0.6054, test_loss: 1.6576, test_f1: 0.5429
 epoch: 55, train_loss: 0.5845, test_loss: 1.7659, test_f1: 0.5297
 epoch: 56, train_loss: 0.5945, test_loss: 1.7543, test_f1: 0.5304
 epoch: 57, train_loss: 0.5684, test_loss: 1.7585, test_f1: 0.5509
 epoch: 58, train_loss: 0.5713, test_loss: 1.9421, test_f1: 0.5277
 epoch: 59, train_loss: 0.5789, test_loss: 1.9597, test_f1: 0.5410
 epoch: 60, train_loss: 0.5679, test_loss: 1.7562, test_f1: 0.5482
 epoch: 61, train_loss: 0.5639, test_loss: 1.6920, test_f1: 0.5404
 epoch: 62, train_loss: 0.5634, test_loss: 1.7613, test_f1: 0.5532
 epoch: 63, train_loss: 0.5718, test_loss: 1.8520, test_f1: 0.5450
 epoch: 64, train_loss: 0.5701, test_loss: 1.7593, test_f1: 0.5594
 epoch: 65, train_loss: 0.5404, test_loss: 1.8632, test_f1: 0.5559
 epoch: 66, train_loss: 0.5555, test_loss: 1.9937, test_f1: 0.5506
 epoch: 67, train_loss: 0.5325, test_loss: 1.8698, test_f1: 0.5277
 epoch: 68, train_loss: 0.5382, test_loss: 1.8377, test_f1: 0.5423
 epoch: 69, train_loss: 0.5387, test_loss: 1.8473, test_f1: 0.5434
 epoch: 70, train_loss: 0.5538, test_loss: 1.8795, test_f1: 0.5196
 epoch: 71, train_loss: 0.5328, test_loss: 1.7967, test_f1: 0.5379
 epoch: 72, train_loss: 0.5399, test_loss: 1.8423, test_f1: 0.5453
 epoch: 73, train_loss: 0.5253, test_loss: 1.8888, test_f1: 0.5249
 epoch: 74, train_loss: 0.5292, test_loss: 1.8610, test_f1: 0.5405
 epoch: 75, train_loss: 0.5332, test_loss: 1.9214, test_f1: 0.5410
 epoch: 76, train_loss: 0.5358, test_loss: 1.8615, test_f1: 0.5592
 epoch: 77, train_loss: 0.5177, test_loss: 1.9560, test_f1: 0.5400
 epoch: 78, train_loss: 0.5408, test_loss: 2.0002, test_f1: 0.5413
 epoch: 79, train_loss: 0.5284, test_loss: 2.0312, test_f1: 0.5413
 epoch: 80, train_loss: 0.5294, test_loss: 1.9680, test_f1: 0.5417
 epoch: 81, train_loss: 0.5181, test_loss: 2.1606, test_f1: 0.5521
 epoch: 82, train_loss: 0.5224, test_loss: 1.9178, test_f1: 0.5354
 epoch: 83, train_loss: 0.5085, test_loss: 2.0772, test_f1: 0.5577
 epoch: 84, train_loss: 0.5318, test_loss: 2.1436, test_f1: 0.5437
 epoch: 85, train_loss: 0.4892, test_loss: 2.0777, test_f1: 0.5622
 epoch: 86, train_loss: 0.4891, test_loss: 2.1786, test_f1: 0.5302
 epoch: 87, train_loss: 0.5081, test_loss: 2.1324, test_f1: 0.5645
 epoch: 88, train_loss: 0.4917, test_loss: 2.0646, test_f1: 0.5468
 epoch: 89, train_loss: 0.5034, test_loss: 2.0221, test_f1: 0.5404
 epoch: 90, train_loss: 0.4911, test_loss: 2.0603, test_f1: 0.5544
 epoch: 91, train_loss: 0.5110, test_loss: 2.3948, test_f1: 0.5335
 epoch: 92, train_loss: 0.4958, test_loss: 2.1020, test_f1: 0.5308
 epoch: 93, train_loss: 0.4847, test_loss: 2.0492, test_f1: 0.5324
 epoch: 94, train_loss: 0.4714, test_loss: 2.1857, test_f1: 0.5466
 epoch: 95, train_loss: 0.4871, test_loss: 2.2111, test_f1: 0.5409
 epoch: 96, train_loss: 0.4759, test_loss: 2.2848, test_f1: 0.5279
 epoch: 97, train_loss: 0.4626, test_loss: 2.1113, test_f1: 0.5339
 epoch: 98, train_loss: 0.4918, test_loss: 2.1801, test_f1: 0.5399
 epoch: 99, train_loss: 0.4872, test_loss: 2.0761, test_f1: 0.5404
##################ITERATION #8 ****************************************
 epoch: 0, train_loss: 1.3421, test_loss: 1.1763, test_f1: 0.4823
 epoch: 1, train_loss: 1.1711, test_loss: 1.1921, test_f1: 0.4853
 epoch: 2, train_loss: 1.1366, test_loss: 1.2163, test_f1: 0.4959
 epoch: 3, train_loss: 1.1024, test_loss: 1.1258, test_f1: 0.4931
 epoch: 4, train_loss: 1.0518, test_loss: 1.1029, test_f1: 0.5066
 epoch: 5, train_loss: 1.0520, test_loss: 1.0944, test_f1: 0.5443
 epoch: 6, train_loss: 1.0270, test_loss: 1.0710, test_f1: 0.5526
 epoch: 7, train_loss: 1.0052, test_loss: 1.0872, test_f1: 0.5728
 epoch: 8, train_loss: 0.9861, test_loss: 1.1174, test_f1: 0.5571
 epoch: 9, train_loss: 0.9797, test_loss: 1.0824, test_f1: 0.5763
 epoch: 10, train_loss: 0.9586, test_loss: 1.0618, test_f1: 0.5639
 epoch: 11, train_loss: 0.9371, test_loss: 1.0802, test_f1: 0.5648
 epoch: 12, train_loss: 0.9310, test_loss: 1.0543, test_f1: 0.5933
 epoch: 13, train_loss: 0.9172, test_loss: 1.0677, test_f1: 0.5778
 epoch: 14, train_loss: 0.8920, test_loss: 1.0238, test_f1: 0.5956
 epoch: 15, train_loss: 0.8896, test_loss: 1.0580, test_f1: 0.5575
 epoch: 16, train_loss: 0.8772, test_loss: 1.0433, test_f1: 0.5896
 epoch: 17, train_loss: 0.8495, test_loss: 1.0807, test_f1: 0.5943
 epoch: 18, train_loss: 0.8639, test_loss: 1.1929, test_f1: 0.5682
 epoch: 19, train_loss: 0.8407, test_loss: 1.1636, test_f1: 0.5693
 epoch: 20, train_loss: 0.8385, test_loss: 1.1873, test_f1: 0.6022
 epoch: 21, train_loss: 0.8462, test_loss: 1.0892, test_f1: 0.6071
 epoch: 22, train_loss: 0.8126, test_loss: 1.0863, test_f1: 0.5869
 epoch: 23, train_loss: 0.8217, test_loss: 1.0849, test_f1: 0.5573
 epoch: 24, train_loss: 0.8065, test_loss: 1.0589, test_f1: 0.6198
 epoch: 25, train_loss: 0.7943, test_loss: 1.0915, test_f1: 0.5925
 epoch: 26, train_loss: 0.7893, test_loss: 1.1083, test_f1: 0.5383
 epoch: 27, train_loss: 0.7941, test_loss: 1.1185, test_f1: 0.5743
 epoch: 28, train_loss: 0.7896, test_loss: 1.0389, test_f1: 0.6418
 epoch: 29, train_loss: 0.7679, test_loss: 1.0520, test_f1: 0.6190
 epoch: 30, train_loss: 0.7492, test_loss: 1.0945, test_f1: 0.6323
 epoch: 31, train_loss: 0.7489, test_loss: 1.2011, test_f1: 0.5451
 epoch: 32, train_loss: 0.7433, test_loss: 1.1799, test_f1: 0.5159
 epoch: 33, train_loss: 0.7429, test_loss: 1.1526, test_f1: 0.6035
 epoch: 34, train_loss: 0.7354, test_loss: 1.1945, test_f1: 0.5866
 epoch: 35, train_loss: 0.7330, test_loss: 1.3431, test_f1: 0.5920
 epoch: 36, train_loss: 0.7039, test_loss: 1.2240, test_f1: 0.5735
 epoch: 37, train_loss: 0.6965, test_loss: 1.2007, test_f1: 0.5755
 epoch: 38, train_loss: 0.7072, test_loss: 1.2737, test_f1: 0.5460
 epoch: 39, train_loss: 0.7043, test_loss: 1.1551, test_f1: 0.5512
 epoch: 40, train_loss: 0.7011, test_loss: 1.2236, test_f1: 0.5604
 epoch: 41, train_loss: 0.6833, test_loss: 1.3124, test_f1: 0.5700
 epoch: 42, train_loss: 0.6728, test_loss: 1.3223, test_f1: 0.5579
 epoch: 43, train_loss: 0.6791, test_loss: 1.2569, test_f1: 0.5715
 epoch: 44, train_loss: 0.6788, test_loss: 1.2688, test_f1: 0.5476
 epoch: 45, train_loss: 0.6774, test_loss: 1.3751, test_f1: 0.5340
 epoch: 46, train_loss: 0.6740, test_loss: 1.2880, test_f1: 0.5559
 epoch: 47, train_loss: 0.6646, test_loss: 1.3021, test_f1: 0.5680
 epoch: 48, train_loss: 0.6543, test_loss: 1.3357, test_f1: 0.5492
 epoch: 49, train_loss: 0.6399, test_loss: 1.2645, test_f1: 0.5696
 epoch: 50, train_loss: 0.6499, test_loss: 1.3289, test_f1: 0.5507
 epoch: 51, train_loss: 0.6456, test_loss: 1.3322, test_f1: 0.5418
 epoch: 52, train_loss: 0.6042, test_loss: 1.3995, test_f1: 0.5513
 epoch: 53, train_loss: 0.6162, test_loss: 1.3968, test_f1: 0.5542
 epoch: 54, train_loss: 0.6148, test_loss: 1.3650, test_f1: 0.5466
 epoch: 55, train_loss: 0.6190, test_loss: 1.4325, test_f1: 0.5588
 epoch: 56, train_loss: 0.5999, test_loss: 1.3852, test_f1: 0.5568
 epoch: 57, train_loss: 0.5873, test_loss: 1.3282, test_f1: 0.5585
 epoch: 58, train_loss: 0.5902, test_loss: 1.3690, test_f1: 0.5585
 epoch: 59, train_loss: 0.5927, test_loss: 1.4046, test_f1: 0.5578
 epoch: 60, train_loss: 0.5975, test_loss: 1.3990, test_f1: 0.5574
 epoch: 61, train_loss: 0.6024, test_loss: 1.3941, test_f1: 0.5565
 epoch: 62, train_loss: 0.5824, test_loss: 1.4131, test_f1: 0.5456
 epoch: 63, train_loss: 0.5998, test_loss: 1.4426, test_f1: 0.5606
 epoch: 64, train_loss: 0.5832, test_loss: 1.4005, test_f1: 0.5583
 epoch: 65, train_loss: 0.5753, test_loss: 1.4593, test_f1: 0.5583
 epoch: 66, train_loss: 0.5803, test_loss: 1.5038, test_f1: 0.5362
 epoch: 67, train_loss: 0.6073, test_loss: 1.4840, test_f1: 0.5593
 epoch: 68, train_loss: 0.5822, test_loss: 1.4425, test_f1: 0.5430
 epoch: 69, train_loss: 0.5736, test_loss: 1.4181, test_f1: 0.5844
 epoch: 70, train_loss: 0.5695, test_loss: 1.4945, test_f1: 0.5456
 epoch: 71, train_loss: 0.5475, test_loss: 1.5302, test_f1: 0.5399
 epoch: 72, train_loss: 0.5449, test_loss: 1.5882, test_f1: 0.5382
 epoch: 73, train_loss: 0.5376, test_loss: 1.6309, test_f1: 0.5365
 epoch: 74, train_loss: 0.5452, test_loss: 1.5112, test_f1: 0.5753
 epoch: 75, train_loss: 0.5627, test_loss: 1.5832, test_f1: 0.5302
 epoch: 76, train_loss: 0.5512, test_loss: 1.5493, test_f1: 0.5513
 epoch: 77, train_loss: 0.5144, test_loss: 1.5953, test_f1: 0.5514
 epoch: 78, train_loss: 0.5419, test_loss: 1.5204, test_f1: 0.5691
 epoch: 79, train_loss: 0.5532, test_loss: 1.5534, test_f1: 0.5488
 epoch: 80, train_loss: 0.5245, test_loss: 1.5657, test_f1: 0.5491
 epoch: 81, train_loss: 0.5422, test_loss: 1.5302, test_f1: 0.5541
 epoch: 82, train_loss: 0.5516, test_loss: 1.5659, test_f1: 0.5411
 epoch: 83, train_loss: 0.5418, test_loss: 1.5510, test_f1: 0.5512
 epoch: 84, train_loss: 0.5308, test_loss: 1.5018, test_f1: 0.5609
 epoch: 85, train_loss: 0.5371, test_loss: 1.5234, test_f1: 0.5552
 epoch: 86, train_loss: 0.5375, test_loss: 1.5412, test_f1: 0.5525
 epoch: 87, train_loss: 0.5208, test_loss: 1.5054, test_f1: 0.5446
 epoch: 88, train_loss: 0.5142, test_loss: 1.7306, test_f1: 0.5501
 epoch: 89, train_loss: 0.5299, test_loss: 1.5512, test_f1: 0.5482
 epoch: 90, train_loss: 0.5284, test_loss: 1.5656, test_f1: 0.5525
 epoch: 91, train_loss: 0.5092, test_loss: 1.5069, test_f1: 0.5666
 epoch: 92, train_loss: 0.5334, test_loss: 1.5627, test_f1: 0.5539
 epoch: 93, train_loss: 0.5153, test_loss: 1.5200, test_f1: 0.5766
 epoch: 94, train_loss: 0.4914, test_loss: 1.5316, test_f1: 0.5611
 epoch: 95, train_loss: 0.5151, test_loss: 1.6076, test_f1: 0.5565
 epoch: 96, train_loss: 0.5008, test_loss: 1.4943, test_f1: 0.5873
 epoch: 97, train_loss: 0.4877, test_loss: 1.6866, test_f1: 0.5365
 epoch: 98, train_loss: 0.5105, test_loss: 1.5875, test_f1: 0.5610
 epoch: 99, train_loss: 0.5020, test_loss: 1.5875, test_f1: 0.5745
##################ITERATION #9 ****************************************
 epoch: 0, train_loss: 1.3834, test_loss: 1.3079, test_f1: 0.4764
 epoch: 1, train_loss: 1.2232, test_loss: 1.2992, test_f1: 0.4866
 epoch: 2, train_loss: 1.1612, test_loss: 1.3013, test_f1: 0.5040
 epoch: 3, train_loss: 1.1033, test_loss: 1.2711, test_f1: 0.5293
 epoch: 4, train_loss: 1.0818, test_loss: 1.2550, test_f1: 0.5195
 epoch: 5, train_loss: 1.0393, test_loss: 1.2514, test_f1: 0.5003
 epoch: 6, train_loss: 1.0421, test_loss: 1.2074, test_f1: 0.5599
 epoch: 7, train_loss: 1.0340, test_loss: 1.2306, test_f1: 0.5341
 epoch: 8, train_loss: 1.0052, test_loss: 1.2273, test_f1: 0.5482
 epoch: 9, train_loss: 0.9735, test_loss: 1.2753, test_f1: 0.5195
 epoch: 10, train_loss: 0.9627, test_loss: 1.2401, test_f1: 0.5458
 epoch: 11, train_loss: 0.9431, test_loss: 1.2636, test_f1: 0.5298
 epoch: 12, train_loss: 0.9489, test_loss: 1.1876, test_f1: 0.5433
 epoch: 13, train_loss: 0.9217, test_loss: 1.2109, test_f1: 0.5387
 epoch: 14, train_loss: 0.9261, test_loss: 1.2410, test_f1: 0.5250
 epoch: 15, train_loss: 0.9202, test_loss: 1.2954, test_f1: 0.4963
 epoch: 16, train_loss: 0.8963, test_loss: 1.2398, test_f1: 0.5445
 epoch: 17, train_loss: 0.8998, test_loss: 1.2322, test_f1: 0.5498
 epoch: 18, train_loss: 0.8679, test_loss: 1.2226, test_f1: 0.5549
 epoch: 19, train_loss: 0.8586, test_loss: 1.2312, test_f1: 0.5460
 epoch: 20, train_loss: 0.8384, test_loss: 1.2317, test_f1: 0.5577
 epoch: 21, train_loss: 0.8323, test_loss: 1.2420, test_f1: 0.5524
 epoch: 22, train_loss: 0.8389, test_loss: 1.2167, test_f1: 0.5636
 epoch: 23, train_loss: 0.8203, test_loss: 1.2233, test_f1: 0.5488
 epoch: 24, train_loss: 0.7981, test_loss: 1.2302, test_f1: 0.5791
 epoch: 25, train_loss: 0.8206, test_loss: 1.2342, test_f1: 0.5984
 epoch: 26, train_loss: 0.8083, test_loss: 1.2259, test_f1: 0.6052
 epoch: 27, train_loss: 0.8037, test_loss: 1.2349, test_f1: 0.5892
 epoch: 28, train_loss: 0.7895, test_loss: 1.2117, test_f1: 0.5742
 epoch: 29, train_loss: 0.8009, test_loss: 1.2379, test_f1: 0.5795
 epoch: 30, train_loss: 0.7648, test_loss: 1.1998, test_f1: 0.6050
 epoch: 31, train_loss: 0.7762, test_loss: 1.2115, test_f1: 0.6073
 epoch: 32, train_loss: 0.7684, test_loss: 1.2577, test_f1: 0.5867
 epoch: 33, train_loss: 0.7446, test_loss: 1.2449, test_f1: 0.6028
 epoch: 34, train_loss: 0.7474, test_loss: 1.2714, test_f1: 0.5958
 epoch: 35, train_loss: 0.7450, test_loss: 1.3264, test_f1: 0.5841
 epoch: 36, train_loss: 0.7352, test_loss: 1.2831, test_f1: 0.6459
 epoch: 37, train_loss: 0.7176, test_loss: 1.3335, test_f1: 0.6142
 epoch: 38, train_loss: 0.7257, test_loss: 1.3610, test_f1: 0.6385
 epoch: 39, train_loss: 0.7108, test_loss: 1.3735, test_f1: 0.5805
 epoch: 40, train_loss: 0.6949, test_loss: 1.4013, test_f1: 0.5805
 epoch: 41, train_loss: 0.6865, test_loss: 1.3218, test_f1: 0.5936
 epoch: 42, train_loss: 0.6978, test_loss: 1.3485, test_f1: 0.6324
 epoch: 43, train_loss: 0.6590, test_loss: 1.3365, test_f1: 0.6287
 epoch: 44, train_loss: 0.6761, test_loss: 1.4071, test_f1: 0.6090
 epoch: 45, train_loss: 0.6661, test_loss: 1.3991, test_f1: 0.6573
 epoch: 46, train_loss: 0.6793, test_loss: 1.4639, test_f1: 0.6095
 epoch: 47, train_loss: 0.6576, test_loss: 1.3670, test_f1: 0.6064
 epoch: 48, train_loss: 0.6512, test_loss: 1.4016, test_f1: 0.6029
 epoch: 49, train_loss: 0.6487, test_loss: 1.3443, test_f1: 0.5912
 epoch: 50, train_loss: 0.6350, test_loss: 1.3914, test_f1: 0.6266
 epoch: 51, train_loss: 0.6224, test_loss: 1.4165, test_f1: 0.6157
 epoch: 52, train_loss: 0.6417, test_loss: 1.4463, test_f1: 0.5856
 epoch: 53, train_loss: 0.5994, test_loss: 1.3730, test_f1: 0.6150
 epoch: 54, train_loss: 0.6036, test_loss: 1.4444, test_f1: 0.6134
 epoch: 55, train_loss: 0.6152, test_loss: 1.3956, test_f1: 0.6182
 epoch: 56, train_loss: 0.6117, test_loss: 1.4687, test_f1: 0.6354
 epoch: 57, train_loss: 0.6040, test_loss: 1.4680, test_f1: 0.6131
 epoch: 58, train_loss: 0.5966, test_loss: 1.4672, test_f1: 0.5991
 epoch: 59, train_loss: 0.5765, test_loss: 1.4771, test_f1: 0.6124
 epoch: 60, train_loss: 0.5811, test_loss: 1.4912, test_f1: 0.6145
 epoch: 61, train_loss: 0.5808, test_loss: 1.5109, test_f1: 0.6081
 epoch: 62, train_loss: 0.5879, test_loss: 1.5601, test_f1: 0.6354
 epoch: 63, train_loss: 0.5837, test_loss: 1.4641, test_f1: 0.6104
 epoch: 64, train_loss: 0.5883, test_loss: 1.5444, test_f1: 0.6001
 epoch: 65, train_loss: 0.6039, test_loss: 1.5366, test_f1: 0.5950
 epoch: 66, train_loss: 0.5704, test_loss: 1.5121, test_f1: 0.6066
 epoch: 67, train_loss: 0.5620, test_loss: 1.4483, test_f1: 0.6233
 epoch: 68, train_loss: 0.5704, test_loss: 1.5704, test_f1: 0.5973
 epoch: 69, train_loss: 0.5710, test_loss: 1.5514, test_f1: 0.6026
 epoch: 70, train_loss: 0.5671, test_loss: 1.5477, test_f1: 0.6082
 epoch: 71, train_loss: 0.5646, test_loss: 1.6321, test_f1: 0.6145
 epoch: 72, train_loss: 0.5520, test_loss: 1.5547, test_f1: 0.5949
 epoch: 73, train_loss: 0.5423, test_loss: 1.5946, test_f1: 0.5902
 epoch: 74, train_loss: 0.5616, test_loss: 1.5981, test_f1: 0.6161
 epoch: 75, train_loss: 0.5473, test_loss: 1.6213, test_f1: 0.6021
 epoch: 76, train_loss: 0.5538, test_loss: 1.5554, test_f1: 0.6113
 epoch: 77, train_loss: 0.5474, test_loss: 1.6233, test_f1: 0.6081
 epoch: 78, train_loss: 0.5335, test_loss: 1.6033, test_f1: 0.6045
 epoch: 79, train_loss: 0.5357, test_loss: 1.6032, test_f1: 0.6204
 epoch: 80, train_loss: 0.5425, test_loss: 1.5443, test_f1: 0.5975
 epoch: 81, train_loss: 0.5392, test_loss: 1.6300, test_f1: 0.6026
 epoch: 82, train_loss: 0.5358, test_loss: 1.6394, test_f1: 0.5980
 epoch: 83, train_loss: 0.5642, test_loss: 1.5988, test_f1: 0.6158
 epoch: 84, train_loss: 0.5416, test_loss: 1.5864, test_f1: 0.5894
 epoch: 85, train_loss: 0.5240, test_loss: 1.6201, test_f1: 0.5860
 epoch: 86, train_loss: 0.5268, test_loss: 1.6012, test_f1: 0.5878
 epoch: 87, train_loss: 0.5145, test_loss: 1.6276, test_f1: 0.5975
 epoch: 88, train_loss: 0.5314, test_loss: 1.5349, test_f1: 0.5914
 epoch: 89, train_loss: 0.5181, test_loss: 1.5713, test_f1: 0.6059
 epoch: 90, train_loss: 0.5055, test_loss: 1.6481, test_f1: 0.5916
 epoch: 91, train_loss: 0.5234, test_loss: 1.6099, test_f1: 0.6056
 epoch: 92, train_loss: 0.5013, test_loss: 1.7063, test_f1: 0.5817
 epoch: 93, train_loss: 0.4932, test_loss: 1.7073, test_f1: 0.6135
 epoch: 94, train_loss: 0.4960, test_loss: 1.6835, test_f1: 0.5891
 epoch: 95, train_loss: 0.4846, test_loss: 1.6319, test_f1: 0.5923
 epoch: 96, train_loss: 0.5010, test_loss: 1.6607, test_f1: 0.5887
 epoch: 97, train_loss: 0.5088, test_loss: 1.6212, test_f1: 0.6105
 epoch: 98, train_loss: 0.5025, test_loss: 1.5741, test_f1: 0.6030
 epoch: 99, train_loss: 0.4776, test_loss: 1.6723, test_f1: 0.6028

Training completed in 769.59 seconds
Best F1: 0.6672 at epoch 27
Mean F1 across iterations: 0.6264  0.0230
========================FINAL RESULTS================================
FEGIN weighted F1: 0.6672  0.0230
python main.py --data ltspice_demos --representation component_component --model FEGIN --layers 2 --hiddens 128 --batch_size 32 --lr 0.0001 --emb_size 250 --epochs 100 --save_appendix component_component_L2_H128_BS32_LR0.0001_E250 --no_val
-----



STDERR:
  File "main.py", line 370, in <module>
    main()
  File "main.py", line 254, in main
    dataset = dataset_class(
  File "/home/philip/projects/ltspice_examples_code_repo/Circuit-Completion-Using-GNNs/component_classification_with_link_prediction_head/evaluation/FEGIN/kernel/circuit_datasets.py", line 15, in __init__
    self.data, self.slices = torch.load(self.processed_paths[0])
  File "/home/philip/.local/lib/python3.8/site-packages/torch/serialization.py", line 1040, in load
    warnings.warn(
  File "/usr/lib/python3.8/warnings.py", line 109, in _showwarnmsg
    sw(msg.message, msg.category, msg.filename, msg.lineno,
  File "main.py", line 47, in warn_with_traceback
    traceback.print_stack(file=log)
/home/philip/projects/ltspice_examples_code_repo/Circuit-Completion-Using-GNNs/component_classification_with_link_prediction_head/evaluation/FEGIN/kernel/circuit_datasets.py:15: FutureWarning: You are using `torch.load` with `weights_only=False` (the current default value), which uses the default pickle module implicitly. It is possible to construct malicious pickle data which will execute arbitrary code during unpickling (See https://github.com/pytorch/pytorch/blob/main/SECURITY.md#untrusted-models for more details). In a future release, the default value for `weights_only` will be flipped to `True`. This limits the functions that could be executed during unpickling. Arbitrary objects will no longer be allowed to be loaded via this mode unless they are explicitly allowlisted by the user via `torch.serialization.add_safe_globals`. We recommend you start setting `weights_only=True` for any use case where you don't have full control of the loaded file. Please open an issue on GitHub for any issues related to this experimental feature.
  self.data, self.slices = torch.load(self.processed_paths[0])
