STDOUT:
Results will be saved in /home/philip/projects/ltspice_examples_code_repo/Circuit-Completion-Using-GNNs/component_classification_with_link_prediction_head/evaluation/FEGIN/results/model_FEGIN_dataset_ltspice_demos
Command line input: python main.py --data ltspice_demos --representation component_net --model FEGIN --layers 6 --hiddens 128 --batch_size 256 --lr 0.0001 --emb_size 512 --epochs 100 --save_appendix component_net_L6_H128_BS256_LR0.0001_E512 --no_val
 is saved.
-----
ltspice_demos - FEGIN
Using 6 layers, 128 hidden units, h = 2
Loading component_net representation dataset
ENTERED
Training FEGIN on component_net representation
Train: 1565, Test: 383
##################ITERATION #0 ****************************************
 epoch: 0, train_loss: 1.3740, test_loss: 1.3732, test_f1: 0.2281
 epoch: 1, train_loss: 1.3582, test_loss: 1.3721, test_f1: 0.2281
 epoch: 2, train_loss: 1.3494, test_loss: 1.3701, test_f1: 0.2281
 epoch: 3, train_loss: 1.3390, test_loss: 1.3668, test_f1: 0.2281
 epoch: 4, train_loss: 1.3285, test_loss: 1.3619, test_f1: 0.2281
 epoch: 5, train_loss: 1.3138, test_loss: 1.3555, test_f1: 0.2281
 epoch: 6, train_loss: 1.2994, test_loss: 1.3486, test_f1: 0.2281
 epoch: 7, train_loss: 1.2840, test_loss: 1.3379, test_f1: 0.2281
 epoch: 8, train_loss: 1.2643, test_loss: 1.3232, test_f1: 0.2281
 epoch: 9, train_loss: 1.2459, test_loss: 1.3047, test_f1: 0.2500
 epoch: 10, train_loss: 1.2236, test_loss: 1.2821, test_f1: 0.2748
 epoch: 11, train_loss: 1.2032, test_loss: 1.2525, test_f1: 0.2807
 epoch: 12, train_loss: 1.1840, test_loss: 1.2288, test_f1: 0.2793
 epoch: 13, train_loss: 1.1675, test_loss: 1.2142, test_f1: 0.2793
 epoch: 14, train_loss: 1.1519, test_loss: 1.1994, test_f1: 0.2778
 epoch: 15, train_loss: 1.1384, test_loss: 1.1885, test_f1: 0.2793
 epoch: 16, train_loss: 1.1323, test_loss: 1.1781, test_f1: 0.2793
 epoch: 17, train_loss: 1.1165, test_loss: 1.1692, test_f1: 0.3404
 epoch: 18, train_loss: 1.1119, test_loss: 1.1663, test_f1: 0.3371
 epoch: 19, train_loss: 1.1018, test_loss: 1.1585, test_f1: 0.3279
 epoch: 20, train_loss: 1.0914, test_loss: 1.1520, test_f1: 0.3390
 epoch: 21, train_loss: 1.0866, test_loss: 1.1422, test_f1: 0.3401
 epoch: 22, train_loss: 1.0803, test_loss: 1.1428, test_f1: 0.3503
 epoch: 23, train_loss: 1.0745, test_loss: 1.1363, test_f1: 0.3650
 epoch: 24, train_loss: 1.0676, test_loss: 1.1228, test_f1: 0.3903
 epoch: 25, train_loss: 1.0606, test_loss: 1.1227, test_f1: 0.4094
 epoch: 26, train_loss: 1.0586, test_loss: 1.1138, test_f1: 0.4360
 epoch: 27, train_loss: 1.0514, test_loss: 1.1040, test_f1: 0.4610
 epoch: 28, train_loss: 1.0414, test_loss: 1.1071, test_f1: 0.4874
 epoch: 29, train_loss: 1.0346, test_loss: 1.1056, test_f1: 0.5041
 epoch: 30, train_loss: 1.0254, test_loss: 1.1015, test_f1: 0.5279
 epoch: 31, train_loss: 1.0237, test_loss: 1.1014, test_f1: 0.5219
 epoch: 32, train_loss: 1.0152, test_loss: 1.0857, test_f1: 0.5494
 epoch: 33, train_loss: 1.0037, test_loss: 1.1000, test_f1: 0.5154
 epoch: 34, train_loss: 0.9972, test_loss: 1.0713, test_f1: 0.5426
 epoch: 35, train_loss: 0.9890, test_loss: 1.0792, test_f1: 0.5319
 epoch: 36, train_loss: 0.9869, test_loss: 1.0673, test_f1: 0.5172
 epoch: 37, train_loss: 0.9677, test_loss: 1.0544, test_f1: 0.5365
 epoch: 38, train_loss: 0.9579, test_loss: 1.0400, test_f1: 0.5401
 epoch: 39, train_loss: 0.9542, test_loss: 1.0356, test_f1: 0.5447
 epoch: 40, train_loss: 0.9355, test_loss: 1.0353, test_f1: 0.5404
 epoch: 41, train_loss: 0.9323, test_loss: 1.0483, test_f1: 0.5418
 epoch: 42, train_loss: 0.9192, test_loss: 1.0303, test_f1: 0.5464
 epoch: 43, train_loss: 0.9087, test_loss: 1.0057, test_f1: 0.5496
 epoch: 44, train_loss: 0.9075, test_loss: 1.0061, test_f1: 0.5686
 epoch: 45, train_loss: 0.8965, test_loss: 1.0214, test_f1: 0.5464
 epoch: 46, train_loss: 0.8859, test_loss: 1.0092, test_f1: 0.5503
 epoch: 47, train_loss: 0.8712, test_loss: 1.0223, test_f1: 0.5459
 epoch: 48, train_loss: 0.8700, test_loss: 1.0313, test_f1: 0.5548
 epoch: 49, train_loss: 0.8665, test_loss: 1.0487, test_f1: 0.5592
 epoch: 50, train_loss: 0.8672, test_loss: 1.0614, test_f1: 0.5426
 epoch: 51, train_loss: 0.8576, test_loss: 1.0190, test_f1: 0.5532
 epoch: 52, train_loss: 0.8502, test_loss: 1.0252, test_f1: 0.5508
 epoch: 53, train_loss: 0.8442, test_loss: 1.0053, test_f1: 0.5621
 epoch: 54, train_loss: 0.8359, test_loss: 0.9851, test_f1: 0.5716
 epoch: 55, train_loss: 0.8284, test_loss: 0.9874, test_f1: 0.5743
 epoch: 56, train_loss: 0.8246, test_loss: 1.0203, test_f1: 0.5604
 epoch: 57, train_loss: 0.8234, test_loss: 1.0022, test_f1: 0.5608
 epoch: 58, train_loss: 0.8121, test_loss: 1.0100, test_f1: 0.5708
 epoch: 59, train_loss: 0.8163, test_loss: 1.0199, test_f1: 0.5608
 epoch: 60, train_loss: 0.8120, test_loss: 1.0133, test_f1: 0.5625
 epoch: 61, train_loss: 0.8108, test_loss: 1.0088, test_f1: 0.5808
 epoch: 62, train_loss: 0.8020, test_loss: 1.0263, test_f1: 0.5714
 epoch: 63, train_loss: 0.8012, test_loss: 1.0011, test_f1: 0.5701
 epoch: 64, train_loss: 0.7934, test_loss: 1.0021, test_f1: 0.5796
 epoch: 65, train_loss: 0.7921, test_loss: 1.0124, test_f1: 0.5770
 epoch: 66, train_loss: 0.7996, test_loss: 1.0134, test_f1: 0.5707
 epoch: 67, train_loss: 0.7948, test_loss: 1.0060, test_f1: 0.5706
 epoch: 68, train_loss: 0.7796, test_loss: 1.0189, test_f1: 0.5645
 epoch: 69, train_loss: 0.7803, test_loss: 1.0047, test_f1: 0.5980
 epoch: 70, train_loss: 0.7761, test_loss: 0.9880, test_f1: 0.5967
 epoch: 71, train_loss: 0.7801, test_loss: 1.0252, test_f1: 0.5851
 epoch: 72, train_loss: 0.7839, test_loss: 1.0226, test_f1: 0.5859
 epoch: 73, train_loss: 0.7711, test_loss: 1.0150, test_f1: 0.5877
 epoch: 74, train_loss: 0.7624, test_loss: 1.0397, test_f1: 0.5854
 epoch: 75, train_loss: 0.7568, test_loss: 1.0146, test_f1: 0.5784
 epoch: 76, train_loss: 0.7567, test_loss: 0.9991, test_f1: 0.6049
 epoch: 77, train_loss: 0.7542, test_loss: 1.0342, test_f1: 0.5813
 epoch: 78, train_loss: 0.7532, test_loss: 1.0490, test_f1: 0.5781
 epoch: 79, train_loss: 0.7515, test_loss: 1.0455, test_f1: 0.5832
 epoch: 80, train_loss: 0.7470, test_loss: 1.0260, test_f1: 0.5704
 epoch: 81, train_loss: 0.7533, test_loss: 1.0161, test_f1: 0.5825
 epoch: 82, train_loss: 0.7628, test_loss: 1.0275, test_f1: 0.5836
 epoch: 83, train_loss: 0.7543, test_loss: 1.0430, test_f1: 0.6029
 epoch: 84, train_loss: 0.7399, test_loss: 1.0087, test_f1: 0.5952
 epoch: 85, train_loss: 0.7412, test_loss: 1.0426, test_f1: 0.6106
 epoch: 86, train_loss: 0.7374, test_loss: 1.0392, test_f1: 0.6001
 epoch: 87, train_loss: 0.7310, test_loss: 1.0406, test_f1: 0.5986
 epoch: 88, train_loss: 0.7372, test_loss: 1.0559, test_f1: 0.5823
 epoch: 89, train_loss: 0.7341, test_loss: 1.0262, test_f1: 0.5898
 epoch: 90, train_loss: 0.7289, test_loss: 1.0193, test_f1: 0.5812
 epoch: 91, train_loss: 0.7280, test_loss: 1.0480, test_f1: 0.5935
 epoch: 92, train_loss: 0.7201, test_loss: 1.0609, test_f1: 0.5920
 epoch: 93, train_loss: 0.7258, test_loss: 1.0287, test_f1: 0.6067
 epoch: 94, train_loss: 0.7087, test_loss: 1.0374, test_f1: 0.6073
 epoch: 95, train_loss: 0.7152, test_loss: 1.0594, test_f1: 0.5952
 epoch: 96, train_loss: 0.7109, test_loss: 1.0589, test_f1: 0.5974
 epoch: 97, train_loss: 0.7095, test_loss: 1.0484, test_f1: 0.6004
 epoch: 98, train_loss: 0.7158, test_loss: 1.0755, test_f1: 0.5829
 epoch: 99, train_loss: 0.7177, test_loss: 1.0654, test_f1: 0.6054
##################ITERATION #1 ****************************************
 epoch: 0, train_loss: 1.3259, test_loss: 1.3645, test_f1: 0.2281
 epoch: 1, train_loss: 1.2805, test_loss: 1.3601, test_f1: 0.2281
 epoch: 2, train_loss: 1.2576, test_loss: 1.3535, test_f1: 0.2281
 epoch: 3, train_loss: 1.2345, test_loss: 1.3431, test_f1: 0.2281
 epoch: 4, train_loss: 1.2104, test_loss: 1.3314, test_f1: 0.2281
 epoch: 5, train_loss: 1.1947, test_loss: 1.3183, test_f1: 0.2281
 epoch: 6, train_loss: 1.1740, test_loss: 1.3005, test_f1: 0.2384
 epoch: 7, train_loss: 1.1572, test_loss: 1.2828, test_f1: 0.2390
 epoch: 8, train_loss: 1.1425, test_loss: 1.2628, test_f1: 0.2534
 epoch: 9, train_loss: 1.1316, test_loss: 1.2466, test_f1: 0.2478
 epoch: 10, train_loss: 1.1195, test_loss: 1.2279, test_f1: 0.2708
 epoch: 11, train_loss: 1.1082, test_loss: 1.1998, test_f1: 0.3199
 epoch: 12, train_loss: 1.0962, test_loss: 1.1774, test_f1: 0.3955
 epoch: 13, train_loss: 1.0841, test_loss: 1.1617, test_f1: 0.4705
 epoch: 14, train_loss: 1.0800, test_loss: 1.1486, test_f1: 0.4857
 epoch: 15, train_loss: 1.0710, test_loss: 1.1366, test_f1: 0.4955
 epoch: 16, train_loss: 1.0577, test_loss: 1.1276, test_f1: 0.4797
 epoch: 17, train_loss: 1.0493, test_loss: 1.1228, test_f1: 0.4832
 epoch: 18, train_loss: 1.0424, test_loss: 1.1073, test_f1: 0.5021
 epoch: 19, train_loss: 1.0297, test_loss: 1.1031, test_f1: 0.5119
 epoch: 20, train_loss: 1.0215, test_loss: 1.0989, test_f1: 0.5044
 epoch: 21, train_loss: 1.0170, test_loss: 1.0947, test_f1: 0.4990
 epoch: 22, train_loss: 1.0113, test_loss: 1.0860, test_f1: 0.5148
 epoch: 23, train_loss: 0.9975, test_loss: 1.0716, test_f1: 0.5081
 epoch: 24, train_loss: 0.9924, test_loss: 1.0708, test_f1: 0.5012
 epoch: 25, train_loss: 0.9858, test_loss: 1.0582, test_f1: 0.5086
 epoch: 26, train_loss: 0.9708, test_loss: 1.0636, test_f1: 0.5258
 epoch: 27, train_loss: 0.9562, test_loss: 1.0541, test_f1: 0.5354
 epoch: 28, train_loss: 0.9518, test_loss: 1.0422, test_f1: 0.5399
 epoch: 29, train_loss: 0.9510, test_loss: 1.0414, test_f1: 0.5275
 epoch: 30, train_loss: 0.9444, test_loss: 1.0379, test_f1: 0.5435
 epoch: 31, train_loss: 0.9359, test_loss: 1.0420, test_f1: 0.5390
 epoch: 32, train_loss: 0.9291, test_loss: 1.0334, test_f1: 0.5443
 epoch: 33, train_loss: 0.9216, test_loss: 1.0322, test_f1: 0.5497
 epoch: 34, train_loss: 0.9192, test_loss: 1.0119, test_f1: 0.5572
 epoch: 35, train_loss: 0.9116, test_loss: 1.0236, test_f1: 0.5579
 epoch: 36, train_loss: 0.9049, test_loss: 1.0277, test_f1: 0.5640
 epoch: 37, train_loss: 0.9013, test_loss: 1.0310, test_f1: 0.5633
 epoch: 38, train_loss: 0.8917, test_loss: 1.0045, test_f1: 0.5627
 epoch: 39, train_loss: 0.8828, test_loss: 1.0110, test_f1: 0.5115
 epoch: 40, train_loss: 0.8717, test_loss: 1.0092, test_f1: 0.5803
 epoch: 41, train_loss: 0.8606, test_loss: 1.0216, test_f1: 0.5739
 epoch: 42, train_loss: 0.8622, test_loss: 1.0439, test_f1: 0.5619
 epoch: 43, train_loss: 0.8566, test_loss: 1.0758, test_f1: 0.5608
 epoch: 44, train_loss: 0.8574, test_loss: 1.0264, test_f1: 0.5742
 epoch: 45, train_loss: 0.8433, test_loss: 1.0395, test_f1: 0.5722
 epoch: 46, train_loss: 0.8262, test_loss: 1.0309, test_f1: 0.5653
 epoch: 47, train_loss: 0.8262, test_loss: 1.0216, test_f1: 0.5683
 epoch: 48, train_loss: 0.8183, test_loss: 1.0308, test_f1: 0.5918
 epoch: 49, train_loss: 0.8121, test_loss: 1.0442, test_f1: 0.5686
 epoch: 50, train_loss: 0.8139, test_loss: 1.0245, test_f1: 0.5685
 epoch: 51, train_loss: 0.8068, test_loss: 1.0277, test_f1: 0.5605
 epoch: 52, train_loss: 0.8022, test_loss: 1.0528, test_f1: 0.5696
 epoch: 53, train_loss: 0.8031, test_loss: 1.0834, test_f1: 0.5745
 epoch: 54, train_loss: 0.8005, test_loss: 1.0684, test_f1: 0.5643
 epoch: 55, train_loss: 0.7941, test_loss: 1.0481, test_f1: 0.5601
 epoch: 56, train_loss: 0.7894, test_loss: 1.0221, test_f1: 0.5583
 epoch: 57, train_loss: 0.7827, test_loss: 1.0291, test_f1: 0.5629
 epoch: 58, train_loss: 0.7890, test_loss: 1.0346, test_f1: 0.5649
 epoch: 59, train_loss: 0.7717, test_loss: 1.0469, test_f1: 0.5721
 epoch: 60, train_loss: 0.7855, test_loss: 1.0702, test_f1: 0.5748
 epoch: 61, train_loss: 0.7745, test_loss: 1.0407, test_f1: 0.5744
 epoch: 62, train_loss: 0.7697, test_loss: 1.0263, test_f1: 0.5724
 epoch: 63, train_loss: 0.7649, test_loss: 1.0502, test_f1: 0.5634
 epoch: 64, train_loss: 0.7654, test_loss: 1.0569, test_f1: 0.5712
 epoch: 65, train_loss: 0.7581, test_loss: 1.0542, test_f1: 0.5728
 epoch: 66, train_loss: 0.7575, test_loss: 1.0529, test_f1: 0.5786
 epoch: 67, train_loss: 0.7679, test_loss: 1.0440, test_f1: 0.5877
 epoch: 68, train_loss: 0.7505, test_loss: 1.0733, test_f1: 0.5887
 epoch: 69, train_loss: 0.7553, test_loss: 1.0952, test_f1: 0.5831
 epoch: 70, train_loss: 0.7429, test_loss: 1.0679, test_f1: 0.5774
 epoch: 71, train_loss: 0.7490, test_loss: 1.0330, test_f1: 0.5754
 epoch: 72, train_loss: 0.7416, test_loss: 1.0373, test_f1: 0.5819
 epoch: 73, train_loss: 0.7444, test_loss: 1.0582, test_f1: 0.5827
 epoch: 74, train_loss: 0.7386, test_loss: 1.0653, test_f1: 0.5821
 epoch: 75, train_loss: 0.7345, test_loss: 1.0710, test_f1: 0.5836
 epoch: 76, train_loss: 0.7361, test_loss: 1.0868, test_f1: 0.5706
 epoch: 77, train_loss: 0.7416, test_loss: 1.0833, test_f1: 0.5706
 epoch: 78, train_loss: 0.7368, test_loss: 1.0916, test_f1: 0.5735
 epoch: 79, train_loss: 0.7288, test_loss: 1.0971, test_f1: 0.5738
 epoch: 80, train_loss: 0.7278, test_loss: 1.0860, test_f1: 0.5710
 epoch: 81, train_loss: 0.7368, test_loss: 1.1175, test_f1: 0.5803
 epoch: 82, train_loss: 0.7174, test_loss: 1.1358, test_f1: 0.5674
 epoch: 83, train_loss: 0.7177, test_loss: 1.1202, test_f1: 0.5835
 epoch: 84, train_loss: 0.7147, test_loss: 1.1121, test_f1: 0.5706
 epoch: 85, train_loss: 0.7210, test_loss: 1.1149, test_f1: 0.5744
 epoch: 86, train_loss: 0.7162, test_loss: 1.0776, test_f1: 0.5969
 epoch: 87, train_loss: 0.7196, test_loss: 1.0875, test_f1: 0.5605
 epoch: 88, train_loss: 0.7174, test_loss: 1.1291, test_f1: 0.5666
 epoch: 89, train_loss: 0.7057, test_loss: 1.1296, test_f1: 0.5617
 epoch: 90, train_loss: 0.7130, test_loss: 1.1220, test_f1: 0.5653
 epoch: 91, train_loss: 0.7042, test_loss: 1.0857, test_f1: 0.5745
 epoch: 92, train_loss: 0.7074, test_loss: 1.0887, test_f1: 0.5830
 epoch: 93, train_loss: 0.7103, test_loss: 1.1114, test_f1: 0.5752
 epoch: 94, train_loss: 0.7001, test_loss: 1.1581, test_f1: 0.5574
 epoch: 95, train_loss: 0.7067, test_loss: 1.1192, test_f1: 0.5656
 epoch: 96, train_loss: 0.7033, test_loss: 1.0716, test_f1: 0.5879
 epoch: 97, train_loss: 0.7038, test_loss: 1.0766, test_f1: 0.5751
 epoch: 98, train_loss: 0.7047, test_loss: 1.1144, test_f1: 0.5978
 epoch: 99, train_loss: 0.6854, test_loss: 1.1291, test_f1: 0.5864
##################ITERATION #2 ****************************************
 epoch: 0, train_loss: 1.2763, test_loss: 1.3487, test_f1: 0.2281
 epoch: 1, train_loss: 1.2178, test_loss: 1.3448, test_f1: 0.2281
 epoch: 2, train_loss: 1.1897, test_loss: 1.3398, test_f1: 0.2281
 epoch: 3, train_loss: 1.1715, test_loss: 1.3285, test_f1: 0.2281
 epoch: 4, train_loss: 1.1490, test_loss: 1.3095, test_f1: 0.2281
 epoch: 5, train_loss: 1.1337, test_loss: 1.2914, test_f1: 0.2281
 epoch: 6, train_loss: 1.1156, test_loss: 1.2819, test_f1: 0.2443
 epoch: 7, train_loss: 1.1053, test_loss: 1.2689, test_f1: 0.2844
 epoch: 8, train_loss: 1.0872, test_loss: 1.2488, test_f1: 0.3466
 epoch: 9, train_loss: 1.0765, test_loss: 1.2305, test_f1: 0.3878
 epoch: 10, train_loss: 1.0600, test_loss: 1.1861, test_f1: 0.4111
 epoch: 11, train_loss: 1.0557, test_loss: 1.1439, test_f1: 0.4463
 epoch: 12, train_loss: 1.0432, test_loss: 1.1222, test_f1: 0.4695
 epoch: 13, train_loss: 1.0319, test_loss: 1.1167, test_f1: 0.4775
 epoch: 14, train_loss: 1.0259, test_loss: 1.1087, test_f1: 0.4651
 epoch: 15, train_loss: 1.0071, test_loss: 1.1065, test_f1: 0.4624
 epoch: 16, train_loss: 0.9982, test_loss: 1.0894, test_f1: 0.4709
 epoch: 17, train_loss: 0.9890, test_loss: 1.0757, test_f1: 0.4601
 epoch: 18, train_loss: 0.9824, test_loss: 1.0759, test_f1: 0.4855
 epoch: 19, train_loss: 0.9743, test_loss: 1.0677, test_f1: 0.5080
 epoch: 20, train_loss: 0.9637, test_loss: 1.0701, test_f1: 0.5198
 epoch: 21, train_loss: 0.9582, test_loss: 1.0675, test_f1: 0.5176
 epoch: 22, train_loss: 0.9540, test_loss: 1.0591, test_f1: 0.5211
 epoch: 23, train_loss: 0.9371, test_loss: 1.0646, test_f1: 0.5255
 epoch: 24, train_loss: 0.9383, test_loss: 1.0484, test_f1: 0.5303
 epoch: 25, train_loss: 0.9218, test_loss: 1.0316, test_f1: 0.5365
 epoch: 26, train_loss: 0.9082, test_loss: 1.0435, test_f1: 0.5340
 epoch: 27, train_loss: 0.9162, test_loss: 1.0386, test_f1: 0.5332
 epoch: 28, train_loss: 0.9062, test_loss: 1.0203, test_f1: 0.5433
 epoch: 29, train_loss: 0.8939, test_loss: 1.0258, test_f1: 0.5485
 epoch: 30, train_loss: 0.8957, test_loss: 1.0349, test_f1: 0.5454
 epoch: 31, train_loss: 0.8858, test_loss: 1.0431, test_f1: 0.5382
 epoch: 32, train_loss: 0.8774, test_loss: 1.0527, test_f1: 0.5540
 epoch: 33, train_loss: 0.8779, test_loss: 1.0420, test_f1: 0.5502
 epoch: 34, train_loss: 0.8703, test_loss: 1.0659, test_f1: 0.5551
 epoch: 35, train_loss: 0.8618, test_loss: 1.0429, test_f1: 0.5801
 epoch: 36, train_loss: 0.8636, test_loss: 1.0404, test_f1: 0.5626
 epoch: 37, train_loss: 0.8565, test_loss: 1.0578, test_f1: 0.5672
 epoch: 38, train_loss: 0.8503, test_loss: 1.0638, test_f1: 0.5653
 epoch: 39, train_loss: 0.8433, test_loss: 1.0796, test_f1: 0.5758
 epoch: 40, train_loss: 0.8371, test_loss: 1.0489, test_f1: 0.5824
 epoch: 41, train_loss: 0.8296, test_loss: 1.0393, test_f1: 0.5802
 epoch: 42, train_loss: 0.8228, test_loss: 1.0673, test_f1: 0.5798
 epoch: 43, train_loss: 0.8236, test_loss: 1.0907, test_f1: 0.5706
 epoch: 44, train_loss: 0.8224, test_loss: 1.0791, test_f1: 0.5760
 epoch: 45, train_loss: 0.8132, test_loss: 1.0717, test_f1: 0.5845
 epoch: 46, train_loss: 0.8085, test_loss: 1.0688, test_f1: 0.5888
 epoch: 47, train_loss: 0.8035, test_loss: 1.0900, test_f1: 0.5882
 epoch: 48, train_loss: 0.8044, test_loss: 1.0774, test_f1: 0.5829
 epoch: 49, train_loss: 0.7975, test_loss: 1.0794, test_f1: 0.5856
 epoch: 50, train_loss: 0.8092, test_loss: 1.1071, test_f1: 0.5840
 epoch: 51, train_loss: 0.7952, test_loss: 1.0949, test_f1: 0.5879
 epoch: 52, train_loss: 0.7906, test_loss: 1.0983, test_f1: 0.5907
 epoch: 53, train_loss: 0.7916, test_loss: 1.1030, test_f1: 0.5904
 epoch: 54, train_loss: 0.7803, test_loss: 1.1128, test_f1: 0.5857
 epoch: 55, train_loss: 0.7854, test_loss: 1.1142, test_f1: 0.5937
 epoch: 56, train_loss: 0.7736, test_loss: 1.0982, test_f1: 0.6054
 epoch: 57, train_loss: 0.7831, test_loss: 1.1132, test_f1: 0.5792
 epoch: 58, train_loss: 0.7822, test_loss: 1.1308, test_f1: 0.5736
 epoch: 59, train_loss: 0.7752, test_loss: 1.1185, test_f1: 0.5832
 epoch: 60, train_loss: 0.7658, test_loss: 1.1085, test_f1: 0.5898
 epoch: 61, train_loss: 0.7687, test_loss: 1.0753, test_f1: 0.5954
 epoch: 62, train_loss: 0.7624, test_loss: 1.0882, test_f1: 0.5933
 epoch: 63, train_loss: 0.7593, test_loss: 1.1064, test_f1: 0.5870
 epoch: 64, train_loss: 0.7594, test_loss: 1.1061, test_f1: 0.5876
 epoch: 65, train_loss: 0.7511, test_loss: 1.1038, test_f1: 0.5959
 epoch: 66, train_loss: 0.7511, test_loss: 1.1210, test_f1: 0.5877
 epoch: 67, train_loss: 0.7422, test_loss: 1.1221, test_f1: 0.5943
 epoch: 68, train_loss: 0.7474, test_loss: 1.1515, test_f1: 0.5781
 epoch: 69, train_loss: 0.7409, test_loss: 1.1306, test_f1: 0.5848
 epoch: 70, train_loss: 0.7340, test_loss: 1.1296, test_f1: 0.5883
 epoch: 71, train_loss: 0.7489, test_loss: 1.1263, test_f1: 0.5793
 epoch: 72, train_loss: 0.7332, test_loss: 1.1392, test_f1: 0.5797
 epoch: 73, train_loss: 0.7320, test_loss: 1.1571, test_f1: 0.5972
 epoch: 74, train_loss: 0.7331, test_loss: 1.1562, test_f1: 0.5899
 epoch: 75, train_loss: 0.7357, test_loss: 1.1497, test_f1: 0.6000
 epoch: 76, train_loss: 0.7385, test_loss: 1.1665, test_f1: 0.5925
 epoch: 77, train_loss: 0.7280, test_loss: 1.1955, test_f1: 0.5899
 epoch: 78, train_loss: 0.7181, test_loss: 1.1792, test_f1: 0.6013
 epoch: 79, train_loss: 0.7268, test_loss: 1.1612, test_f1: 0.5868
 epoch: 80, train_loss: 0.7246, test_loss: 1.1625, test_f1: 0.5959
 epoch: 81, train_loss: 0.7102, test_loss: 1.1870, test_f1: 0.5860
 epoch: 82, train_loss: 0.7160, test_loss: 1.2185, test_f1: 0.5895
 epoch: 83, train_loss: 0.7172, test_loss: 1.2384, test_f1: 0.5831
 epoch: 84, train_loss: 0.7166, test_loss: 1.1967, test_f1: 0.5866
 epoch: 85, train_loss: 0.7141, test_loss: 1.2291, test_f1: 0.5791
 epoch: 86, train_loss: 0.7081, test_loss: 1.2059, test_f1: 0.5872
 epoch: 87, train_loss: 0.7026, test_loss: 1.1970, test_f1: 0.5845
 epoch: 88, train_loss: 0.7103, test_loss: 1.2037, test_f1: 0.5793
 epoch: 89, train_loss: 0.7034, test_loss: 1.2295, test_f1: 0.5653
 epoch: 90, train_loss: 0.7143, test_loss: 1.2446, test_f1: 0.5647
 epoch: 91, train_loss: 0.6971, test_loss: 1.2149, test_f1: 0.5694
 epoch: 92, train_loss: 0.7061, test_loss: 1.2026, test_f1: 0.5866
 epoch: 93, train_loss: 0.7007, test_loss: 1.2128, test_f1: 0.5877
 epoch: 94, train_loss: 0.6955, test_loss: 1.2176, test_f1: 0.5658
 epoch: 95, train_loss: 0.6990, test_loss: 1.2568, test_f1: 0.5658
 epoch: 96, train_loss: 0.6965, test_loss: 1.2462, test_f1: 0.5793
 epoch: 97, train_loss: 0.6939, test_loss: 1.2157, test_f1: 0.5834
 epoch: 98, train_loss: 0.6939, test_loss: 1.2241, test_f1: 0.5622
 epoch: 99, train_loss: 0.6750, test_loss: 1.2554, test_f1: 0.5719
##################ITERATION #3 ****************************************
 epoch: 0, train_loss: 1.2712, test_loss: 1.3473, test_f1: 0.2281
 epoch: 1, train_loss: 1.1905, test_loss: 1.3408, test_f1: 0.2281
 epoch: 2, train_loss: 1.1653, test_loss: 1.3356, test_f1: 0.2281
 epoch: 3, train_loss: 1.1318, test_loss: 1.3246, test_f1: 0.2281
 epoch: 4, train_loss: 1.1136, test_loss: 1.3000, test_f1: 0.2336
 epoch: 5, train_loss: 1.0998, test_loss: 1.2712, test_f1: 0.2569
 epoch: 6, train_loss: 1.0835, test_loss: 1.2417, test_f1: 0.2979
 epoch: 7, train_loss: 1.0671, test_loss: 1.2077, test_f1: 0.3418
 epoch: 8, train_loss: 1.0562, test_loss: 1.1820, test_f1: 0.3870
 epoch: 9, train_loss: 1.0439, test_loss: 1.1653, test_f1: 0.4005
 epoch: 10, train_loss: 1.0252, test_loss: 1.1541, test_f1: 0.4129
 epoch: 11, train_loss: 1.0154, test_loss: 1.1376, test_f1: 0.4721
 epoch: 12, train_loss: 1.0124, test_loss: 1.1209, test_f1: 0.4774
 epoch: 13, train_loss: 0.9933, test_loss: 1.1116, test_f1: 0.4943
 epoch: 14, train_loss: 0.9835, test_loss: 1.1039, test_f1: 0.4985
 epoch: 15, train_loss: 0.9820, test_loss: 1.1021, test_f1: 0.5217
 epoch: 16, train_loss: 0.9649, test_loss: 1.0911, test_f1: 0.5191
 epoch: 17, train_loss: 0.9524, test_loss: 1.0918, test_f1: 0.5239
 epoch: 18, train_loss: 0.9492, test_loss: 1.0951, test_f1: 0.5437
 epoch: 19, train_loss: 0.9482, test_loss: 1.0908, test_f1: 0.5338
 epoch: 20, train_loss: 0.9299, test_loss: 1.0876, test_f1: 0.5277
 epoch: 21, train_loss: 0.9262, test_loss: 1.0892, test_f1: 0.5326
 epoch: 22, train_loss: 0.9166, test_loss: 1.0683, test_f1: 0.5369
 epoch: 23, train_loss: 0.9075, test_loss: 1.0648, test_f1: 0.5490
 epoch: 24, train_loss: 0.9109, test_loss: 1.0634, test_f1: 0.5475
 epoch: 25, train_loss: 0.8983, test_loss: 1.0708, test_f1: 0.5256
 epoch: 26, train_loss: 0.8918, test_loss: 1.0874, test_f1: 0.5618
 epoch: 27, train_loss: 0.8744, test_loss: 1.0726, test_f1: 0.5605
 epoch: 28, train_loss: 0.8792, test_loss: 1.0393, test_f1: 0.5422
 epoch: 29, train_loss: 0.8650, test_loss: 1.0477, test_f1: 0.5359
 epoch: 30, train_loss: 0.8582, test_loss: 1.0424, test_f1: 0.5361
 epoch: 31, train_loss: 0.8482, test_loss: 1.0521, test_f1: 0.5535
 epoch: 32, train_loss: 0.8519, test_loss: 1.0432, test_f1: 0.5673
 epoch: 33, train_loss: 0.8397, test_loss: 1.0619, test_f1: 0.5559
 epoch: 34, train_loss: 0.8313, test_loss: 1.0561, test_f1: 0.5543
 epoch: 35, train_loss: 0.8366, test_loss: 1.0560, test_f1: 0.5639
 epoch: 36, train_loss: 0.8223, test_loss: 1.0512, test_f1: 0.5723
 epoch: 37, train_loss: 0.8204, test_loss: 1.1087, test_f1: 0.5619
 epoch: 38, train_loss: 0.8208, test_loss: 1.0684, test_f1: 0.5781
 epoch: 39, train_loss: 0.8045, test_loss: 1.0626, test_f1: 0.5752
 epoch: 40, train_loss: 0.8025, test_loss: 1.0883, test_f1: 0.5809
 epoch: 41, train_loss: 0.8058, test_loss: 1.1221, test_f1: 0.5726
 epoch: 42, train_loss: 0.8022, test_loss: 1.0985, test_f1: 0.5743
 epoch: 43, train_loss: 0.7992, test_loss: 1.0730, test_f1: 0.5572
 epoch: 44, train_loss: 0.7930, test_loss: 1.0693, test_f1: 0.5670
 epoch: 45, train_loss: 0.7904, test_loss: 1.0843, test_f1: 0.5854
 epoch: 46, train_loss: 0.7783, test_loss: 1.1105, test_f1: 0.5724
 epoch: 47, train_loss: 0.7723, test_loss: 1.1026, test_f1: 0.5835
 epoch: 48, train_loss: 0.7695, test_loss: 1.0797, test_f1: 0.5692
 epoch: 49, train_loss: 0.7830, test_loss: 1.1042, test_f1: 0.5601
 epoch: 50, train_loss: 0.7708, test_loss: 1.1237, test_f1: 0.5819
 epoch: 51, train_loss: 0.7577, test_loss: 1.1112, test_f1: 0.5933
 epoch: 52, train_loss: 0.7518, test_loss: 1.1121, test_f1: 0.5644
 epoch: 53, train_loss: 0.7468, test_loss: 1.1191, test_f1: 0.5646
 epoch: 54, train_loss: 0.7467, test_loss: 1.1371, test_f1: 0.5700
 epoch: 55, train_loss: 0.7346, test_loss: 1.1548, test_f1: 0.5665
 epoch: 56, train_loss: 0.7398, test_loss: 1.1372, test_f1: 0.5913
 epoch: 57, train_loss: 0.7504, test_loss: 1.1319, test_f1: 0.5781
 epoch: 58, train_loss: 0.7388, test_loss: 1.1501, test_f1: 0.5717
 epoch: 59, train_loss: 0.7304, test_loss: 1.1508, test_f1: 0.5591
 epoch: 60, train_loss: 0.7242, test_loss: 1.1575, test_f1: 0.5817
 epoch: 61, train_loss: 0.7263, test_loss: 1.1274, test_f1: 0.5658
 epoch: 62, train_loss: 0.7196, test_loss: 1.1570, test_f1: 0.5696
 epoch: 63, train_loss: 0.7200, test_loss: 1.1682, test_f1: 0.5708
 epoch: 64, train_loss: 0.7192, test_loss: 1.1789, test_f1: 0.5722
 epoch: 65, train_loss: 0.7188, test_loss: 1.1701, test_f1: 0.5840
 epoch: 66, train_loss: 0.7133, test_loss: 1.1822, test_f1: 0.5726
 epoch: 67, train_loss: 0.7065, test_loss: 1.1775, test_f1: 0.5698
 epoch: 68, train_loss: 0.7118, test_loss: 1.1867, test_f1: 0.5773
 epoch: 69, train_loss: 0.7083, test_loss: 1.2011, test_f1: 0.5826
 epoch: 70, train_loss: 0.7090, test_loss: 1.2216, test_f1: 0.5666
 epoch: 71, train_loss: 0.7014, test_loss: 1.2223, test_f1: 0.5675
 epoch: 72, train_loss: 0.7060, test_loss: 1.2210, test_f1: 0.5618
 epoch: 73, train_loss: 0.6895, test_loss: 1.2440, test_f1: 0.5662
 epoch: 74, train_loss: 0.6956, test_loss: 1.2126, test_f1: 0.5769
 epoch: 75, train_loss: 0.6909, test_loss: 1.2409, test_f1: 0.5719
 epoch: 76, train_loss: 0.6913, test_loss: 1.2248, test_f1: 0.5743
 epoch: 77, train_loss: 0.6778, test_loss: 1.2354, test_f1: 0.5786
 epoch: 78, train_loss: 0.6832, test_loss: 1.2578, test_f1: 0.5893
 epoch: 79, train_loss: 0.6926, test_loss: 1.2656, test_f1: 0.5666
 epoch: 80, train_loss: 0.6879, test_loss: 1.2650, test_f1: 0.5620
 epoch: 81, train_loss: 0.6707, test_loss: 1.2715, test_f1: 0.5820
 epoch: 82, train_loss: 0.6766, test_loss: 1.3081, test_f1: 0.5783
 epoch: 83, train_loss: 0.6751, test_loss: 1.3071, test_f1: 0.5847
 epoch: 84, train_loss: 0.6690, test_loss: 1.3052, test_f1: 0.5917
 epoch: 85, train_loss: 0.6673, test_loss: 1.2970, test_f1: 0.5757
 epoch: 86, train_loss: 0.6813, test_loss: 1.2982, test_f1: 0.5786
 epoch: 87, train_loss: 0.6639, test_loss: 1.3237, test_f1: 0.5784
 epoch: 88, train_loss: 0.6653, test_loss: 1.3153, test_f1: 0.5664
 epoch: 89, train_loss: 0.6553, test_loss: 1.3506, test_f1: 0.5719
 epoch: 90, train_loss: 0.6646, test_loss: 1.3443, test_f1: 0.5719
 epoch: 91, train_loss: 0.6670, test_loss: 1.3041, test_f1: 0.5652
 epoch: 92, train_loss: 0.6668, test_loss: 1.3061, test_f1: 0.5729
 epoch: 93, train_loss: 0.6770, test_loss: 1.3301, test_f1: 0.5711
 epoch: 94, train_loss: 0.6827, test_loss: 1.3715, test_f1: 0.5784
 epoch: 95, train_loss: 0.6552, test_loss: 1.3195, test_f1: 0.5779
 epoch: 96, train_loss: 0.6562, test_loss: 1.3233, test_f1: 0.5759
 epoch: 97, train_loss: 0.6542, test_loss: 1.2927, test_f1: 0.5810
 epoch: 98, train_loss: 0.6527, test_loss: 1.3238, test_f1: 0.5749
 epoch: 99, train_loss: 0.6387, test_loss: 1.3651, test_f1: 0.5785
##################ITERATION #4 ****************************************
 epoch: 0, train_loss: 1.2576, test_loss: 1.3281, test_f1: 0.2281
 epoch: 1, train_loss: 1.1898, test_loss: 1.3191, test_f1: 0.2281
 epoch: 2, train_loss: 1.1616, test_loss: 1.3147, test_f1: 0.2281
 epoch: 3, train_loss: 1.1364, test_loss: 1.3071, test_f1: 0.2281
 epoch: 4, train_loss: 1.1174, test_loss: 1.2960, test_f1: 0.2281
 epoch: 5, train_loss: 1.1064, test_loss: 1.2807, test_f1: 0.2281
 epoch: 6, train_loss: 1.0876, test_loss: 1.2642, test_f1: 0.2452
 epoch: 7, train_loss: 1.0872, test_loss: 1.2533, test_f1: 0.2921
 epoch: 8, train_loss: 1.0654, test_loss: 1.2443, test_f1: 0.4003
 epoch: 9, train_loss: 1.0558, test_loss: 1.2233, test_f1: 0.4090
 epoch: 10, train_loss: 1.0515, test_loss: 1.1920, test_f1: 0.4476
 epoch: 11, train_loss: 1.0425, test_loss: 1.1791, test_f1: 0.4329
 epoch: 12, train_loss: 1.0258, test_loss: 1.1695, test_f1: 0.4571
 epoch: 13, train_loss: 1.0184, test_loss: 1.1252, test_f1: 0.4875
 epoch: 14, train_loss: 1.0083, test_loss: 1.1097, test_f1: 0.5123
 epoch: 15, train_loss: 0.9992, test_loss: 1.1068, test_f1: 0.5091
 epoch: 16, train_loss: 0.9862, test_loss: 1.1069, test_f1: 0.5018
 epoch: 17, train_loss: 0.9835, test_loss: 1.0940, test_f1: 0.5211
 epoch: 18, train_loss: 0.9764, test_loss: 1.0937, test_f1: 0.5050
 epoch: 19, train_loss: 0.9608, test_loss: 1.0970, test_f1: 0.5138
 epoch: 20, train_loss: 0.9511, test_loss: 1.0754, test_f1: 0.5283
 epoch: 21, train_loss: 0.9484, test_loss: 1.0733, test_f1: 0.5107
 epoch: 22, train_loss: 0.9413, test_loss: 1.0673, test_f1: 0.5233
 epoch: 23, train_loss: 0.9358, test_loss: 1.0634, test_f1: 0.5194
 epoch: 24, train_loss: 0.9299, test_loss: 1.0509, test_f1: 0.5121
 epoch: 25, train_loss: 0.9202, test_loss: 1.0530, test_f1: 0.5314
 epoch: 26, train_loss: 0.9241, test_loss: 1.0440, test_f1: 0.5362
 epoch: 27, train_loss: 0.9100, test_loss: 1.0427, test_f1: 0.5433
 epoch: 28, train_loss: 0.9004, test_loss: 1.0480, test_f1: 0.5302
 epoch: 29, train_loss: 0.8942, test_loss: 1.0778, test_f1: 0.5225
 epoch: 30, train_loss: 0.8872, test_loss: 1.0624, test_f1: 0.5152
 epoch: 31, train_loss: 0.8874, test_loss: 1.0793, test_f1: 0.5268
 epoch: 32, train_loss: 0.8711, test_loss: 1.0656, test_f1: 0.5256
 epoch: 33, train_loss: 0.8610, test_loss: 1.0608, test_f1: 0.5381
 epoch: 34, train_loss: 0.8673, test_loss: 1.0474, test_f1: 0.5526
 epoch: 35, train_loss: 0.8573, test_loss: 1.0315, test_f1: 0.5368
 epoch: 36, train_loss: 0.8542, test_loss: 1.0492, test_f1: 0.5547
 epoch: 37, train_loss: 0.8547, test_loss: 1.0346, test_f1: 0.5555
 epoch: 38, train_loss: 0.8502, test_loss: 1.0530, test_f1: 0.5389
 epoch: 39, train_loss: 0.8402, test_loss: 1.0764, test_f1: 0.5229
 epoch: 40, train_loss: 0.8518, test_loss: 1.0893, test_f1: 0.5406
 epoch: 41, train_loss: 0.8305, test_loss: 1.0334, test_f1: 0.5495
 epoch: 42, train_loss: 0.8279, test_loss: 1.0761, test_f1: 0.5361
 epoch: 43, train_loss: 0.8268, test_loss: 1.1147, test_f1: 0.5312
 epoch: 44, train_loss: 0.8202, test_loss: 1.0827, test_f1: 0.5294
 epoch: 45, train_loss: 0.8203, test_loss: 1.0859, test_f1: 0.5508
 epoch: 46, train_loss: 0.8237, test_loss: 1.0777, test_f1: 0.5286
 epoch: 47, train_loss: 0.8198, test_loss: 1.0752, test_f1: 0.5407
 epoch: 48, train_loss: 0.8075, test_loss: 1.0931, test_f1: 0.5398
 epoch: 49, train_loss: 0.7924, test_loss: 1.0922, test_f1: 0.5434
 epoch: 50, train_loss: 0.8120, test_loss: 1.1105, test_f1: 0.5570
 epoch: 51, train_loss: 0.7951, test_loss: 1.1296, test_f1: 0.5625
 epoch: 52, train_loss: 0.7878, test_loss: 1.1547, test_f1: 0.5558
 epoch: 53, train_loss: 0.7776, test_loss: 1.1479, test_f1: 0.5479
 epoch: 54, train_loss: 0.7686, test_loss: 1.1559, test_f1: 0.5529
 epoch: 55, train_loss: 0.7738, test_loss: 1.1489, test_f1: 0.5428
 epoch: 56, train_loss: 0.7658, test_loss: 1.1481, test_f1: 0.5399
 epoch: 57, train_loss: 0.7753, test_loss: 1.1407, test_f1: 0.5527
 epoch: 58, train_loss: 0.7764, test_loss: 1.1425, test_f1: 0.5530
 epoch: 59, train_loss: 0.7636, test_loss: 1.1348, test_f1: 0.5440
 epoch: 60, train_loss: 0.7590, test_loss: 1.1191, test_f1: 0.5466
 epoch: 61, train_loss: 0.7575, test_loss: 1.1063, test_f1: 0.5471
 epoch: 62, train_loss: 0.7573, test_loss: 1.0972, test_f1: 0.5451
 epoch: 63, train_loss: 0.7568, test_loss: 1.1009, test_f1: 0.5453
 epoch: 64, train_loss: 0.7581, test_loss: 1.1418, test_f1: 0.5476
 epoch: 65, train_loss: 0.7479, test_loss: 1.1536, test_f1: 0.5459
 epoch: 66, train_loss: 0.7339, test_loss: 1.1561, test_f1: 0.5404
 epoch: 67, train_loss: 0.7306, test_loss: 1.1673, test_f1: 0.5437
 epoch: 68, train_loss: 0.7485, test_loss: 1.1518, test_f1: 0.5432
 epoch: 69, train_loss: 0.7435, test_loss: 1.1790, test_f1: 0.5479
 epoch: 70, train_loss: 0.7415, test_loss: 1.1665, test_f1: 0.5460
 epoch: 71, train_loss: 0.7397, test_loss: 1.1614, test_f1: 0.5475
 epoch: 72, train_loss: 0.7421, test_loss: 1.1542, test_f1: 0.5505
 epoch: 73, train_loss: 0.7486, test_loss: 1.1975, test_f1: 0.5444
 epoch: 74, train_loss: 0.7244, test_loss: 1.1454, test_f1: 0.5410
 epoch: 75, train_loss: 0.7220, test_loss: 1.1289, test_f1: 0.5536
 epoch: 76, train_loss: 0.7308, test_loss: 1.1400, test_f1: 0.5538
 epoch: 77, train_loss: 0.7264, test_loss: 1.1456, test_f1: 0.5457
 epoch: 78, train_loss: 0.7305, test_loss: 1.1845, test_f1: 0.5379
 epoch: 79, train_loss: 0.7166, test_loss: 1.1594, test_f1: 0.5448
 epoch: 80, train_loss: 0.7260, test_loss: 1.1384, test_f1: 0.5565
 epoch: 81, train_loss: 0.7279, test_loss: 1.1027, test_f1: 0.5507
 epoch: 82, train_loss: 0.7213, test_loss: 1.1266, test_f1: 0.5566
 epoch: 83, train_loss: 0.7095, test_loss: 1.1161, test_f1: 0.5556
 epoch: 84, train_loss: 0.7153, test_loss: 1.1322, test_f1: 0.5438
 epoch: 85, train_loss: 0.7142, test_loss: 1.1520, test_f1: 0.5515
 epoch: 86, train_loss: 0.7013, test_loss: 1.1481, test_f1: 0.5398
 epoch: 87, train_loss: 0.7174, test_loss: 1.1707, test_f1: 0.5266
 epoch: 88, train_loss: 0.7104, test_loss: 1.2067, test_f1: 0.5424
 epoch: 89, train_loss: 0.6986, test_loss: 1.1911, test_f1: 0.5519
 epoch: 90, train_loss: 0.6982, test_loss: 1.2271, test_f1: 0.5520
 epoch: 91, train_loss: 0.7083, test_loss: 1.2154, test_f1: 0.5455
 epoch: 92, train_loss: 0.7037, test_loss: 1.1817, test_f1: 0.5478
 epoch: 93, train_loss: 0.6945, test_loss: 1.2063, test_f1: 0.5431
 epoch: 94, train_loss: 0.6915, test_loss: 1.1811, test_f1: 0.5532
 epoch: 95, train_loss: 0.6939, test_loss: 1.1645, test_f1: 0.5604
 epoch: 96, train_loss: 0.6965, test_loss: 1.1768, test_f1: 0.5534
 epoch: 97, train_loss: 0.6977, test_loss: 1.1426, test_f1: 0.5545
 epoch: 98, train_loss: 0.6930, test_loss: 1.2114, test_f1: 0.5597
 epoch: 99, train_loss: 0.6961, test_loss: 1.2051, test_f1: 0.5559
##################ITERATION #5 ****************************************
 epoch: 0, train_loss: 1.2246, test_loss: 1.3724, test_f1: 0.2281
 epoch: 1, train_loss: 1.1434, test_loss: 1.3725, test_f1: 0.2281
 epoch: 2, train_loss: 1.1202, test_loss: 1.3689, test_f1: 0.3104
 epoch: 3, train_loss: 1.0895, test_loss: 1.3653, test_f1: 0.2402
 epoch: 4, train_loss: 1.0777, test_loss: 1.3475, test_f1: 0.2941
 epoch: 5, train_loss: 1.0603, test_loss: 1.3216, test_f1: 0.3276
 epoch: 6, train_loss: 1.0495, test_loss: 1.2893, test_f1: 0.3888
 epoch: 7, train_loss: 1.0367, test_loss: 1.2578, test_f1: 0.4331
 epoch: 8, train_loss: 1.0245, test_loss: 1.2170, test_f1: 0.4451
 epoch: 9, train_loss: 1.0140, test_loss: 1.1744, test_f1: 0.4447
 epoch: 10, train_loss: 0.9977, test_loss: 1.1316, test_f1: 0.4859
 epoch: 11, train_loss: 0.9863, test_loss: 1.1066, test_f1: 0.4910
 epoch: 12, train_loss: 0.9801, test_loss: 1.0909, test_f1: 0.4872
 epoch: 13, train_loss: 0.9742, test_loss: 1.0711, test_f1: 0.4880
 epoch: 14, train_loss: 0.9654, test_loss: 1.0645, test_f1: 0.5082
 epoch: 15, train_loss: 0.9491, test_loss: 1.0541, test_f1: 0.5138
 epoch: 16, train_loss: 0.9507, test_loss: 1.0601, test_f1: 0.4971
 epoch: 17, train_loss: 0.9322, test_loss: 1.0619, test_f1: 0.5244
 epoch: 18, train_loss: 0.9255, test_loss: 1.0603, test_f1: 0.5091
 epoch: 19, train_loss: 0.9165, test_loss: 1.0435, test_f1: 0.5221
 epoch: 20, train_loss: 0.9040, test_loss: 1.0306, test_f1: 0.5217
 epoch: 21, train_loss: 0.9061, test_loss: 1.0357, test_f1: 0.5397
 epoch: 22, train_loss: 0.9131, test_loss: 1.0516, test_f1: 0.5320
 epoch: 23, train_loss: 0.9055, test_loss: 1.0515, test_f1: 0.5371
 epoch: 24, train_loss: 0.8878, test_loss: 1.0456, test_f1: 0.5430
 epoch: 25, train_loss: 0.8878, test_loss: 1.0180, test_f1: 0.5360
 epoch: 26, train_loss: 0.8686, test_loss: 1.0150, test_f1: 0.5360
 epoch: 27, train_loss: 0.8705, test_loss: 1.0260, test_f1: 0.5431
 epoch: 28, train_loss: 0.8639, test_loss: 1.0432, test_f1: 0.5359
 epoch: 29, train_loss: 0.8509, test_loss: 1.0460, test_f1: 0.5492
 epoch: 30, train_loss: 0.8481, test_loss: 1.0591, test_f1: 0.5404
 epoch: 31, train_loss: 0.8440, test_loss: 1.0446, test_f1: 0.5374
 epoch: 32, train_loss: 0.8482, test_loss: 1.0451, test_f1: 0.5591
 epoch: 33, train_loss: 0.8381, test_loss: 1.0481, test_f1: 0.5408
 epoch: 34, train_loss: 0.8492, test_loss: 1.0418, test_f1: 0.5335
 epoch: 35, train_loss: 0.8232, test_loss: 1.0461, test_f1: 0.5244
 epoch: 36, train_loss: 0.8386, test_loss: 1.0659, test_f1: 0.5363
 epoch: 37, train_loss: 0.8306, test_loss: 1.0836, test_f1: 0.5454
 epoch: 38, train_loss: 0.8175, test_loss: 1.0822, test_f1: 0.5406
 epoch: 39, train_loss: 0.8203, test_loss: 1.1100, test_f1: 0.5578
 epoch: 40, train_loss: 0.8189, test_loss: 1.0774, test_f1: 0.5527
 epoch: 41, train_loss: 0.8060, test_loss: 1.0588, test_f1: 0.5623
 epoch: 42, train_loss: 0.8231, test_loss: 1.0595, test_f1: 0.5512
 epoch: 43, train_loss: 0.8113, test_loss: 1.0646, test_f1: 0.5715
 epoch: 44, train_loss: 0.7985, test_loss: 1.0689, test_f1: 0.5460
 epoch: 45, train_loss: 0.7925, test_loss: 1.0648, test_f1: 0.5486
 epoch: 46, train_loss: 0.7958, test_loss: 1.0455, test_f1: 0.5654
 epoch: 47, train_loss: 0.7934, test_loss: 1.0590, test_f1: 0.5700
 epoch: 48, train_loss: 0.7816, test_loss: 1.0404, test_f1: 0.5723
 epoch: 49, train_loss: 0.7746, test_loss: 1.0928, test_f1: 0.5620
 epoch: 50, train_loss: 0.7710, test_loss: 1.1117, test_f1: 0.5473
 epoch: 51, train_loss: 0.7629, test_loss: 1.0969, test_f1: 0.5646
 epoch: 52, train_loss: 0.7589, test_loss: 1.0676, test_f1: 0.5783
 epoch: 53, train_loss: 0.7561, test_loss: 1.0482, test_f1: 0.5807
 epoch: 54, train_loss: 0.7591, test_loss: 1.0620, test_f1: 0.5850
 epoch: 55, train_loss: 0.7588, test_loss: 1.0708, test_f1: 0.5790
 epoch: 56, train_loss: 0.7592, test_loss: 1.0875, test_f1: 0.5654
 epoch: 57, train_loss: 0.7492, test_loss: 1.0805, test_f1: 0.5575
 epoch: 58, train_loss: 0.7527, test_loss: 1.1038, test_f1: 0.5780
 epoch: 59, train_loss: 0.7438, test_loss: 1.1234, test_f1: 0.5933
 epoch: 60, train_loss: 0.7455, test_loss: 1.1095, test_f1: 0.5674
 epoch: 61, train_loss: 0.7527, test_loss: 1.1056, test_f1: 0.5788
 epoch: 62, train_loss: 0.7276, test_loss: 1.0778, test_f1: 0.5894
 epoch: 63, train_loss: 0.7495, test_loss: 1.0703, test_f1: 0.5798
 epoch: 64, train_loss: 0.7381, test_loss: 1.0988, test_f1: 0.5768
 epoch: 65, train_loss: 0.7315, test_loss: 1.1335, test_f1: 0.5729
 epoch: 66, train_loss: 0.7334, test_loss: 1.1261, test_f1: 0.5610
 epoch: 67, train_loss: 0.7314, test_loss: 1.1284, test_f1: 0.5809
 epoch: 68, train_loss: 0.7241, test_loss: 1.1327, test_f1: 0.5743
 epoch: 69, train_loss: 0.7230, test_loss: 1.1117, test_f1: 0.5737
 epoch: 70, train_loss: 0.7226, test_loss: 1.0939, test_f1: 0.6110
 epoch: 71, train_loss: 0.7161, test_loss: 1.0978, test_f1: 0.5859
 epoch: 72, train_loss: 0.7113, test_loss: 1.1116, test_f1: 0.5744
 epoch: 73, train_loss: 0.7198, test_loss: 1.0951, test_f1: 0.5723
 epoch: 74, train_loss: 0.7173, test_loss: 1.1114, test_f1: 0.5800
 epoch: 75, train_loss: 0.7167, test_loss: 1.1106, test_f1: 0.5829
 epoch: 76, train_loss: 0.7283, test_loss: 1.1191, test_f1: 0.5913
 epoch: 77, train_loss: 0.7121, test_loss: 1.1377, test_f1: 0.5893
 epoch: 78, train_loss: 0.7235, test_loss: 1.1410, test_f1: 0.5851
 epoch: 79, train_loss: 0.7137, test_loss: 1.1450, test_f1: 0.5796
 epoch: 80, train_loss: 0.7066, test_loss: 1.1299, test_f1: 0.5831
 epoch: 81, train_loss: 0.6992, test_loss: 1.1074, test_f1: 0.5851
 epoch: 82, train_loss: 0.7062, test_loss: 1.0994, test_f1: 0.6048
 epoch: 83, train_loss: 0.7035, test_loss: 1.0836, test_f1: 0.5838
 epoch: 84, train_loss: 0.7171, test_loss: 1.0855, test_f1: 0.5832
 epoch: 85, train_loss: 0.7096, test_loss: 1.1190, test_f1: 0.5771
 epoch: 86, train_loss: 0.6979, test_loss: 1.1471, test_f1: 0.5690
 epoch: 87, train_loss: 0.7020, test_loss: 1.1293, test_f1: 0.5698
 epoch: 88, train_loss: 0.6975, test_loss: 1.1370, test_f1: 0.5590
 epoch: 89, train_loss: 0.6931, test_loss: 1.1312, test_f1: 0.5647
 epoch: 90, train_loss: 0.6831, test_loss: 1.1316, test_f1: 0.5842
 epoch: 91, train_loss: 0.6846, test_loss: 1.1310, test_f1: 0.5847
 epoch: 92, train_loss: 0.6868, test_loss: 1.1271, test_f1: 0.6021
 epoch: 93, train_loss: 0.6868, test_loss: 1.1247, test_f1: 0.5999
 epoch: 94, train_loss: 0.6795, test_loss: 1.1281, test_f1: 0.5924
 epoch: 95, train_loss: 0.6735, test_loss: 1.1399, test_f1: 0.5836
 epoch: 96, train_loss: 0.6853, test_loss: 1.1333, test_f1: 0.5786
 epoch: 97, train_loss: 0.6839, test_loss: 1.1519, test_f1: 0.5848
 epoch: 98, train_loss: 0.6731, test_loss: 1.1903, test_f1: 0.5898
 epoch: 99, train_loss: 0.6719, test_loss: 1.1977, test_f1: 0.5768
##################ITERATION #6 ****************************************
 epoch: 0, train_loss: 1.2280, test_loss: 1.3564, test_f1: 0.2281
 epoch: 1, train_loss: 1.1423, test_loss: 1.3508, test_f1: 0.2281
 epoch: 2, train_loss: 1.1096, test_loss: 1.3662, test_f1: 0.2949
 epoch: 3, train_loss: 1.0891, test_loss: 1.3705, test_f1: 0.2199
 epoch: 4, train_loss: 1.0631, test_loss: 1.3452, test_f1: 0.2663
 epoch: 5, train_loss: 1.0481, test_loss: 1.2987, test_f1: 0.3497
 epoch: 6, train_loss: 1.0324, test_loss: 1.2839, test_f1: 0.3280
 epoch: 7, train_loss: 1.0343, test_loss: 1.2391, test_f1: 0.3868
 epoch: 8, train_loss: 1.0017, test_loss: 1.1710, test_f1: 0.4504
 epoch: 9, train_loss: 0.9969, test_loss: 1.1517, test_f1: 0.4482
 epoch: 10, train_loss: 0.9859, test_loss: 1.1267, test_f1: 0.4769
 epoch: 11, train_loss: 0.9685, test_loss: 1.1057, test_f1: 0.5149
 epoch: 12, train_loss: 0.9691, test_loss: 1.0863, test_f1: 0.5112
 epoch: 13, train_loss: 0.9529, test_loss: 1.0725, test_f1: 0.5173
 epoch: 14, train_loss: 0.9528, test_loss: 1.0551, test_f1: 0.5302
 epoch: 15, train_loss: 0.9465, test_loss: 1.0484, test_f1: 0.5288
 epoch: 16, train_loss: 0.9294, test_loss: 1.0552, test_f1: 0.5379
 epoch: 17, train_loss: 0.9278, test_loss: 1.0517, test_f1: 0.5473
 epoch: 18, train_loss: 0.9232, test_loss: 1.0569, test_f1: 0.5344
 epoch: 19, train_loss: 0.9067, test_loss: 1.0567, test_f1: 0.5227
 epoch: 20, train_loss: 0.8975, test_loss: 1.0473, test_f1: 0.5396
 epoch: 21, train_loss: 0.8873, test_loss: 1.0342, test_f1: 0.5487
 epoch: 22, train_loss: 0.8831, test_loss: 1.0231, test_f1: 0.5555
 epoch: 23, train_loss: 0.8860, test_loss: 1.0273, test_f1: 0.5633
 epoch: 24, train_loss: 0.8817, test_loss: 1.0472, test_f1: 0.5552
 epoch: 25, train_loss: 0.8717, test_loss: 1.0618, test_f1: 0.5481
 epoch: 26, train_loss: 0.8552, test_loss: 1.0689, test_f1: 0.5429
 epoch: 27, train_loss: 0.8638, test_loss: 1.0762, test_f1: 0.5487
 epoch: 28, train_loss: 0.8523, test_loss: 1.0758, test_f1: 0.5508
 epoch: 29, train_loss: 0.8492, test_loss: 1.0795, test_f1: 0.5551
 epoch: 30, train_loss: 0.8405, test_loss: 1.1144, test_f1: 0.5424
 epoch: 31, train_loss: 0.8348, test_loss: 1.1129, test_f1: 0.5391
 epoch: 32, train_loss: 0.8276, test_loss: 1.0831, test_f1: 0.5529
 epoch: 33, train_loss: 0.8327, test_loss: 1.0854, test_f1: 0.5519
 epoch: 34, train_loss: 0.8225, test_loss: 1.1154, test_f1: 0.5389
 epoch: 35, train_loss: 0.8139, test_loss: 1.0978, test_f1: 0.5535
 epoch: 36, train_loss: 0.8168, test_loss: 1.0932, test_f1: 0.5548
 epoch: 37, train_loss: 0.8061, test_loss: 1.0944, test_f1: 0.5671
 epoch: 38, train_loss: 0.8124, test_loss: 1.0976, test_f1: 0.5406
 epoch: 39, train_loss: 0.8032, test_loss: 1.1095, test_f1: 0.5569
 epoch: 40, train_loss: 0.7914, test_loss: 1.1191, test_f1: 0.5385
 epoch: 41, train_loss: 0.7929, test_loss: 1.1023, test_f1: 0.5268
 epoch: 42, train_loss: 0.8000, test_loss: 1.1064, test_f1: 0.5371
 epoch: 43, train_loss: 0.7734, test_loss: 1.1008, test_f1: 0.5695
 epoch: 44, train_loss: 0.7879, test_loss: 1.1063, test_f1: 0.5545
 epoch: 45, train_loss: 0.7794, test_loss: 1.0816, test_f1: 0.5531
 epoch: 46, train_loss: 0.7757, test_loss: 1.1304, test_f1: 0.5528
 epoch: 47, train_loss: 0.7690, test_loss: 1.1712, test_f1: 0.5446
 epoch: 48, train_loss: 0.7635, test_loss: 1.1543, test_f1: 0.5609
 epoch: 49, train_loss: 0.7431, test_loss: 1.1522, test_f1: 0.5722
 epoch: 50, train_loss: 0.7675, test_loss: 1.1848, test_f1: 0.5803
 epoch: 51, train_loss: 0.7597, test_loss: 1.1551, test_f1: 0.5745
 epoch: 52, train_loss: 0.7534, test_loss: 1.1109, test_f1: 0.5625
 epoch: 53, train_loss: 0.7542, test_loss: 1.1200, test_f1: 0.5671
 epoch: 54, train_loss: 0.7404, test_loss: 1.1630, test_f1: 0.5434
 epoch: 55, train_loss: 0.7491, test_loss: 1.1760, test_f1: 0.5794
 epoch: 56, train_loss: 0.7298, test_loss: 1.1703, test_f1: 0.5793
 epoch: 57, train_loss: 0.7324, test_loss: 1.1547, test_f1: 0.5743
 epoch: 58, train_loss: 0.7211, test_loss: 1.1850, test_f1: 0.5621
 epoch: 59, train_loss: 0.7136, test_loss: 1.1420, test_f1: 0.5677
 epoch: 60, train_loss: 0.7164, test_loss: 1.1613, test_f1: 0.5515
 epoch: 61, train_loss: 0.7174, test_loss: 1.1787, test_f1: 0.5512
 epoch: 62, train_loss: 0.7207, test_loss: 1.1925, test_f1: 0.5473
 epoch: 63, train_loss: 0.7098, test_loss: 1.1937, test_f1: 0.5398
 epoch: 64, train_loss: 0.7122, test_loss: 1.1547, test_f1: 0.5469
 epoch: 65, train_loss: 0.7072, test_loss: 1.1586, test_f1: 0.5573
 epoch: 66, train_loss: 0.7172, test_loss: 1.1558, test_f1: 0.5583
 epoch: 67, train_loss: 0.7206, test_loss: 1.1513, test_f1: 0.5696
 epoch: 68, train_loss: 0.7040, test_loss: 1.1860, test_f1: 0.5674
 epoch: 69, train_loss: 0.6971, test_loss: 1.2034, test_f1: 0.5657
 epoch: 70, train_loss: 0.7056, test_loss: 1.2408, test_f1: 0.5575
 epoch: 71, train_loss: 0.7020, test_loss: 1.2630, test_f1: 0.5525
 epoch: 72, train_loss: 0.6920, test_loss: 1.2186, test_f1: 0.5643
 epoch: 73, train_loss: 0.7033, test_loss: 1.2390, test_f1: 0.5548
 epoch: 74, train_loss: 0.6885, test_loss: 1.2596, test_f1: 0.5539
 epoch: 75, train_loss: 0.6981, test_loss: 1.2259, test_f1: 0.5649
 epoch: 76, train_loss: 0.6929, test_loss: 1.2174, test_f1: 0.5491
 epoch: 77, train_loss: 0.6897, test_loss: 1.2351, test_f1: 0.5491
 epoch: 78, train_loss: 0.7001, test_loss: 1.2695, test_f1: 0.5593
 epoch: 79, train_loss: 0.6844, test_loss: 1.2353, test_f1: 0.5707
 epoch: 80, train_loss: 0.6865, test_loss: 1.2144, test_f1: 0.5683
 epoch: 81, train_loss: 0.6836, test_loss: 1.2014, test_f1: 0.5503
 epoch: 82, train_loss: 0.6758, test_loss: 1.2435, test_f1: 0.5746
 epoch: 83, train_loss: 0.6835, test_loss: 1.2230, test_f1: 0.5731
 epoch: 84, train_loss: 0.6791, test_loss: 1.2200, test_f1: 0.5732
 epoch: 85, train_loss: 0.6883, test_loss: 1.2263, test_f1: 0.5730
 epoch: 86, train_loss: 0.6735, test_loss: 1.2751, test_f1: 0.5585
 epoch: 87, train_loss: 0.6709, test_loss: 1.2634, test_f1: 0.5720
 epoch: 88, train_loss: 0.6720, test_loss: 1.2943, test_f1: 0.5623
 epoch: 89, train_loss: 0.6634, test_loss: 1.3013, test_f1: 0.5621
 epoch: 90, train_loss: 0.6612, test_loss: 1.3098, test_f1: 0.5862
 epoch: 91, train_loss: 0.6598, test_loss: 1.3128, test_f1: 0.5635
 epoch: 92, train_loss: 0.6705, test_loss: 1.2972, test_f1: 0.5724
 epoch: 93, train_loss: 0.6705, test_loss: 1.2760, test_f1: 0.5728
 epoch: 94, train_loss: 0.6624, test_loss: 1.2712, test_f1: 0.5538
 epoch: 95, train_loss: 0.6630, test_loss: 1.2913, test_f1: 0.5454
 epoch: 96, train_loss: 0.6669, test_loss: 1.3265, test_f1: 0.5561
 epoch: 97, train_loss: 0.6630, test_loss: 1.3461, test_f1: 0.5707
 epoch: 98, train_loss: 0.6565, test_loss: 1.3391, test_f1: 0.5663
 epoch: 99, train_loss: 0.6580, test_loss: 1.2755, test_f1: 0.5918
##################ITERATION #7 ****************************************
 epoch: 0, train_loss: 1.2190, test_loss: 1.3827, test_f1: 0.2281
 epoch: 1, train_loss: 1.1339, test_loss: 1.4191, test_f1: 0.0950
 epoch: 2, train_loss: 1.1044, test_loss: 1.4566, test_f1: 0.0831
 epoch: 3, train_loss: 1.0886, test_loss: 1.4458, test_f1: 0.0936
 epoch: 4, train_loss: 1.0675, test_loss: 1.3811, test_f1: 0.1990
 epoch: 5, train_loss: 1.0534, test_loss: 1.3193, test_f1: 0.3012
 epoch: 6, train_loss: 1.0365, test_loss: 1.2867, test_f1: 0.3102
 epoch: 7, train_loss: 1.0320, test_loss: 1.2433, test_f1: 0.3667
 epoch: 8, train_loss: 1.0147, test_loss: 1.2111, test_f1: 0.3947
 epoch: 9, train_loss: 0.9888, test_loss: 1.1595, test_f1: 0.4264
 epoch: 10, train_loss: 0.9851, test_loss: 1.1294, test_f1: 0.4743
 epoch: 11, train_loss: 0.9795, test_loss: 1.1070, test_f1: 0.5004
 epoch: 12, train_loss: 0.9635, test_loss: 1.0932, test_f1: 0.4934
 epoch: 13, train_loss: 0.9515, test_loss: 1.0775, test_f1: 0.5039
 epoch: 14, train_loss: 0.9522, test_loss: 1.0834, test_f1: 0.5323
 epoch: 15, train_loss: 0.9494, test_loss: 1.0695, test_f1: 0.5515
 epoch: 16, train_loss: 0.9371, test_loss: 1.0594, test_f1: 0.5529
 epoch: 17, train_loss: 0.9271, test_loss: 1.0712, test_f1: 0.5096
 epoch: 18, train_loss: 0.9274, test_loss: 1.0842, test_f1: 0.5463
 epoch: 19, train_loss: 0.9206, test_loss: 1.0724, test_f1: 0.5532
 epoch: 20, train_loss: 0.9030, test_loss: 1.0473, test_f1: 0.5340
 epoch: 21, train_loss: 0.8957, test_loss: 1.0359, test_f1: 0.5410
 epoch: 22, train_loss: 0.8953, test_loss: 1.0578, test_f1: 0.5479
 epoch: 23, train_loss: 0.8854, test_loss: 1.0573, test_f1: 0.5646
 epoch: 24, train_loss: 0.8712, test_loss: 1.0610, test_f1: 0.5586
 epoch: 25, train_loss: 0.8821, test_loss: 1.0427, test_f1: 0.5551
 epoch: 26, train_loss: 0.8726, test_loss: 1.0337, test_f1: 0.5594
 epoch: 27, train_loss: 0.8583, test_loss: 1.0480, test_f1: 0.5466
 epoch: 28, train_loss: 0.8629, test_loss: 1.0634, test_f1: 0.5564
 epoch: 29, train_loss: 0.8604, test_loss: 1.0527, test_f1: 0.5574
 epoch: 30, train_loss: 0.8413, test_loss: 1.0558, test_f1: 0.5607
 epoch: 31, train_loss: 0.8397, test_loss: 1.0472, test_f1: 0.5615
 epoch: 32, train_loss: 0.8343, test_loss: 1.0517, test_f1: 0.5776
 epoch: 33, train_loss: 0.8260, test_loss: 1.0577, test_f1: 0.5752
 epoch: 34, train_loss: 0.8245, test_loss: 1.0635, test_f1: 0.5519
 epoch: 35, train_loss: 0.8248, test_loss: 1.0669, test_f1: 0.5687
 epoch: 36, train_loss: 0.8106, test_loss: 1.0646, test_f1: 0.5738
 epoch: 37, train_loss: 0.8067, test_loss: 1.0641, test_f1: 0.5836
 epoch: 38, train_loss: 0.7942, test_loss: 1.0982, test_f1: 0.5677
 epoch: 39, train_loss: 0.7959, test_loss: 1.0778, test_f1: 0.5706
 epoch: 40, train_loss: 0.7924, test_loss: 1.0924, test_f1: 0.5435
 epoch: 41, train_loss: 0.7966, test_loss: 1.1113, test_f1: 0.5566
 epoch: 42, train_loss: 0.7937, test_loss: 1.0760, test_f1: 0.5896
 epoch: 43, train_loss: 0.7816, test_loss: 1.0755, test_f1: 0.5833
 epoch: 44, train_loss: 0.7943, test_loss: 1.0835, test_f1: 0.5800
 epoch: 45, train_loss: 0.7687, test_loss: 1.0816, test_f1: 0.5731
 epoch: 46, train_loss: 0.7685, test_loss: 1.0685, test_f1: 0.5654
 epoch: 47, train_loss: 0.7860, test_loss: 1.0710, test_f1: 0.5736
 epoch: 48, train_loss: 0.7719, test_loss: 1.1414, test_f1: 0.5663
 epoch: 49, train_loss: 0.7783, test_loss: 1.1687, test_f1: 0.5511
 epoch: 50, train_loss: 0.7602, test_loss: 1.1380, test_f1: 0.5671
 epoch: 51, train_loss: 0.7593, test_loss: 1.1046, test_f1: 0.5726
 epoch: 52, train_loss: 0.7580, test_loss: 1.1088, test_f1: 0.5498
 epoch: 53, train_loss: 0.7346, test_loss: 1.1110, test_f1: 0.5423
 epoch: 54, train_loss: 0.7499, test_loss: 1.0759, test_f1: 0.5630
 epoch: 55, train_loss: 0.7435, test_loss: 1.0559, test_f1: 0.5650
 epoch: 56, train_loss: 0.7515, test_loss: 1.0679, test_f1: 0.5644
 epoch: 57, train_loss: 0.7429, test_loss: 1.0838, test_f1: 0.5732
 epoch: 58, train_loss: 0.7372, test_loss: 1.0943, test_f1: 0.5727
 epoch: 59, train_loss: 0.7237, test_loss: 1.0861, test_f1: 0.5718
 epoch: 60, train_loss: 0.7292, test_loss: 1.0741, test_f1: 0.5739
 epoch: 61, train_loss: 0.7208, test_loss: 1.0870, test_f1: 0.5640
 epoch: 62, train_loss: 0.7222, test_loss: 1.0724, test_f1: 0.5699
 epoch: 63, train_loss: 0.7220, test_loss: 1.0873, test_f1: 0.5557
 epoch: 64, train_loss: 0.7150, test_loss: 1.0865, test_f1: 0.5644
 epoch: 65, train_loss: 0.7017, test_loss: 1.0830, test_f1: 0.5698
 epoch: 66, train_loss: 0.7100, test_loss: 1.1021, test_f1: 0.5649
 epoch: 67, train_loss: 0.7134, test_loss: 1.1324, test_f1: 0.5621
 epoch: 68, train_loss: 0.7035, test_loss: 1.1468, test_f1: 0.5515
 epoch: 69, train_loss: 0.7046, test_loss: 1.1149, test_f1: 0.5700
 epoch: 70, train_loss: 0.7127, test_loss: 1.1141, test_f1: 0.5574
 epoch: 71, train_loss: 0.7041, test_loss: 1.1224, test_f1: 0.5707
 epoch: 72, train_loss: 0.6925, test_loss: 1.1394, test_f1: 0.5653
 epoch: 73, train_loss: 0.7071, test_loss: 1.1719, test_f1: 0.5882
 epoch: 74, train_loss: 0.6927, test_loss: 1.1725, test_f1: 0.5570
 epoch: 75, train_loss: 0.6926, test_loss: 1.1429, test_f1: 0.5598
 epoch: 76, train_loss: 0.6979, test_loss: 1.2000, test_f1: 0.5443
 epoch: 77, train_loss: 0.6939, test_loss: 1.1876, test_f1: 0.5493
 epoch: 78, train_loss: 0.7059, test_loss: 1.1779, test_f1: 0.5726
 epoch: 79, train_loss: 0.7000, test_loss: 1.1665, test_f1: 0.5691
 epoch: 80, train_loss: 0.6887, test_loss: 1.1550, test_f1: 0.5753
 epoch: 81, train_loss: 0.6779, test_loss: 1.1475, test_f1: 0.5779
 epoch: 82, train_loss: 0.6884, test_loss: 1.1572, test_f1: 0.5572
 epoch: 83, train_loss: 0.6954, test_loss: 1.1647, test_f1: 0.5538
 epoch: 84, train_loss: 0.6869, test_loss: 1.1883, test_f1: 0.5505
 epoch: 85, train_loss: 0.6878, test_loss: 1.1960, test_f1: 0.5676
 epoch: 86, train_loss: 0.6717, test_loss: 1.2006, test_f1: 0.5860
 epoch: 87, train_loss: 0.6804, test_loss: 1.2086, test_f1: 0.5924
 epoch: 88, train_loss: 0.6689, test_loss: 1.2104, test_f1: 0.5802
 epoch: 89, train_loss: 0.6751, test_loss: 1.1817, test_f1: 0.5935
 epoch: 90, train_loss: 0.6776, test_loss: 1.2053, test_f1: 0.5615
 epoch: 91, train_loss: 0.6788, test_loss: 1.2185, test_f1: 0.5630
 epoch: 92, train_loss: 0.6679, test_loss: 1.2186, test_f1: 0.5614
 epoch: 93, train_loss: 0.6768, test_loss: 1.2320, test_f1: 0.5724
 epoch: 94, train_loss: 0.6620, test_loss: 1.2182, test_f1: 0.5644
 epoch: 95, train_loss: 0.6702, test_loss: 1.2102, test_f1: 0.5568
 epoch: 96, train_loss: 0.6523, test_loss: 1.1996, test_f1: 0.5646
 epoch: 97, train_loss: 0.6702, test_loss: 1.1933, test_f1: 0.5614
 epoch: 98, train_loss: 0.6637, test_loss: 1.2070, test_f1: 0.5617
 epoch: 99, train_loss: 0.6669, test_loss: 1.2266, test_f1: 0.5696
##################ITERATION #8 ****************************************
 epoch: 0, train_loss: 1.2229, test_loss: 1.3433, test_f1: 0.2281
 epoch: 1, train_loss: 1.1410, test_loss: 1.3688, test_f1: 0.2281
 epoch: 2, train_loss: 1.1068, test_loss: 1.4032, test_f1: 0.1371
 epoch: 3, train_loss: 1.0901, test_loss: 1.4194, test_f1: 0.1044
 epoch: 4, train_loss: 1.0604, test_loss: 1.3571, test_f1: 0.2039
 epoch: 5, train_loss: 1.0457, test_loss: 1.2731, test_f1: 0.3530
 epoch: 6, train_loss: 1.0389, test_loss: 1.2162, test_f1: 0.3697
 epoch: 7, train_loss: 1.0216, test_loss: 1.2038, test_f1: 0.4078
 epoch: 8, train_loss: 1.0087, test_loss: 1.2015, test_f1: 0.4591
 epoch: 9, train_loss: 1.0042, test_loss: 1.1894, test_f1: 0.4208
 epoch: 10, train_loss: 0.9780, test_loss: 1.1686, test_f1: 0.4273
 epoch: 11, train_loss: 0.9747, test_loss: 1.1341, test_f1: 0.4633
 epoch: 12, train_loss: 0.9607, test_loss: 1.1039, test_f1: 0.4991
 epoch: 13, train_loss: 0.9698, test_loss: 1.0761, test_f1: 0.4931
 epoch: 14, train_loss: 0.9572, test_loss: 1.0556, test_f1: 0.5012
 epoch: 15, train_loss: 0.9416, test_loss: 1.0462, test_f1: 0.5176
 epoch: 16, train_loss: 0.9343, test_loss: 1.0493, test_f1: 0.5395
 epoch: 17, train_loss: 0.9321, test_loss: 1.0512, test_f1: 0.5351
 epoch: 18, train_loss: 0.9191, test_loss: 1.0472, test_f1: 0.5366
 epoch: 19, train_loss: 0.9142, test_loss: 1.0374, test_f1: 0.5426
 epoch: 20, train_loss: 0.9075, test_loss: 1.0428, test_f1: 0.5524
 epoch: 21, train_loss: 0.8952, test_loss: 1.0293, test_f1: 0.5394
 epoch: 22, train_loss: 0.8878, test_loss: 1.0190, test_f1: 0.5558
 epoch: 23, train_loss: 0.8859, test_loss: 1.0176, test_f1: 0.5515
 epoch: 24, train_loss: 0.8908, test_loss: 1.0233, test_f1: 0.5491
 epoch: 25, train_loss: 0.8622, test_loss: 1.0526, test_f1: 0.5468
 epoch: 26, train_loss: 0.8817, test_loss: 1.0537, test_f1: 0.5561
 epoch: 27, train_loss: 0.8591, test_loss: 1.0838, test_f1: 0.5684
 epoch: 28, train_loss: 0.8483, test_loss: 1.0497, test_f1: 0.5720
 epoch: 29, train_loss: 0.8581, test_loss: 1.0255, test_f1: 0.5785
 epoch: 30, train_loss: 0.8423, test_loss: 1.0204, test_f1: 0.5723
 epoch: 31, train_loss: 0.8368, test_loss: 1.0479, test_f1: 0.5704
 epoch: 32, train_loss: 0.8422, test_loss: 1.0570, test_f1: 0.5627
 epoch: 33, train_loss: 0.8357, test_loss: 1.0349, test_f1: 0.5595
 epoch: 34, train_loss: 0.8428, test_loss: 1.0307, test_f1: 0.5735
 epoch: 35, train_loss: 0.8341, test_loss: 1.0701, test_f1: 0.5666
 epoch: 36, train_loss: 0.8154, test_loss: 1.0763, test_f1: 0.5749
 epoch: 37, train_loss: 0.8136, test_loss: 1.0767, test_f1: 0.5645
 epoch: 38, train_loss: 0.8150, test_loss: 1.0827, test_f1: 0.5549
 epoch: 39, train_loss: 0.7954, test_loss: 1.0656, test_f1: 0.5628
 epoch: 40, train_loss: 0.7984, test_loss: 1.0746, test_f1: 0.5770
 epoch: 41, train_loss: 0.8111, test_loss: 1.0752, test_f1: 0.5784
 epoch: 42, train_loss: 0.7944, test_loss: 1.0829, test_f1: 0.5772
 epoch: 43, train_loss: 0.8061, test_loss: 1.1198, test_f1: 0.5712
 epoch: 44, train_loss: 0.7969, test_loss: 1.1102, test_f1: 0.5653
 epoch: 45, train_loss: 0.7910, test_loss: 1.0973, test_f1: 0.5670
 epoch: 46, train_loss: 0.7868, test_loss: 1.1020, test_f1: 0.5755
 epoch: 47, train_loss: 0.7743, test_loss: 1.1046, test_f1: 0.5747
 epoch: 48, train_loss: 0.7746, test_loss: 1.1157, test_f1: 0.5800
 epoch: 49, train_loss: 0.7897, test_loss: 1.1044, test_f1: 0.5782
 epoch: 50, train_loss: 0.7666, test_loss: 1.0989, test_f1: 0.5862
 epoch: 51, train_loss: 0.7527, test_loss: 1.1064, test_f1: 0.5737
 epoch: 52, train_loss: 0.7596, test_loss: 1.1161, test_f1: 0.5835
 epoch: 53, train_loss: 0.7421, test_loss: 1.1065, test_f1: 0.5889
 epoch: 54, train_loss: 0.7569, test_loss: 1.1074, test_f1: 0.5962
 epoch: 55, train_loss: 0.7499, test_loss: 1.1041, test_f1: 0.5988
 epoch: 56, train_loss: 0.7386, test_loss: 1.1050, test_f1: 0.5954
 epoch: 57, train_loss: 0.7383, test_loss: 1.1159, test_f1: 0.6007
 epoch: 58, train_loss: 0.7391, test_loss: 1.1192, test_f1: 0.5900
 epoch: 59, train_loss: 0.7245, test_loss: 1.1139, test_f1: 0.5950
 epoch: 60, train_loss: 0.7280, test_loss: 1.1153, test_f1: 0.5912
 epoch: 61, train_loss: 0.7282, test_loss: 1.1244, test_f1: 0.5780
 epoch: 62, train_loss: 0.7263, test_loss: 1.1218, test_f1: 0.5765
 epoch: 63, train_loss: 0.7317, test_loss: 1.1143, test_f1: 0.5806
 epoch: 64, train_loss: 0.7360, test_loss: 1.1432, test_f1: 0.5753
 epoch: 65, train_loss: 0.7183, test_loss: 1.1680, test_f1: 0.5625
 epoch: 66, train_loss: 0.7173, test_loss: 1.1834, test_f1: 0.5770
 epoch: 67, train_loss: 0.7107, test_loss: 1.1573, test_f1: 0.5818
 epoch: 68, train_loss: 0.7161, test_loss: 1.1643, test_f1: 0.5848
 epoch: 69, train_loss: 0.7119, test_loss: 1.1906, test_f1: 0.5812
 epoch: 70, train_loss: 0.7032, test_loss: 1.1925, test_f1: 0.5847
 epoch: 71, train_loss: 0.7123, test_loss: 1.1678, test_f1: 0.5945
 epoch: 72, train_loss: 0.7140, test_loss: 1.1709, test_f1: 0.5958
 epoch: 73, train_loss: 0.7123, test_loss: 1.1999, test_f1: 0.5997
 epoch: 74, train_loss: 0.7055, test_loss: 1.2239, test_f1: 0.6107
 epoch: 75, train_loss: 0.6960, test_loss: 1.2197, test_f1: 0.5995
 epoch: 76, train_loss: 0.7018, test_loss: 1.2211, test_f1: 0.5817
 epoch: 77, train_loss: 0.7033, test_loss: 1.2269, test_f1: 0.6024
 epoch: 78, train_loss: 0.6995, test_loss: 1.2277, test_f1: 0.5956
 epoch: 79, train_loss: 0.6948, test_loss: 1.2281, test_f1: 0.5984
 epoch: 80, train_loss: 0.6863, test_loss: 1.2408, test_f1: 0.6036
 epoch: 81, train_loss: 0.6867, test_loss: 1.2377, test_f1: 0.6047
 epoch: 82, train_loss: 0.6942, test_loss: 1.2408, test_f1: 0.5953
 epoch: 83, train_loss: 0.7014, test_loss: 1.2686, test_f1: 0.5828
 epoch: 84, train_loss: 0.6862, test_loss: 1.2622, test_f1: 0.5925
 epoch: 85, train_loss: 0.6933, test_loss: 1.2552, test_f1: 0.5839
 epoch: 86, train_loss: 0.6779, test_loss: 1.2805, test_f1: 0.5900
 epoch: 87, train_loss: 0.6756, test_loss: 1.2906, test_f1: 0.5784
 epoch: 88, train_loss: 0.6640, test_loss: 1.2797, test_f1: 0.5858
 epoch: 89, train_loss: 0.6787, test_loss: 1.2628, test_f1: 0.5725
 epoch: 90, train_loss: 0.6828, test_loss: 1.2565, test_f1: 0.5856
 epoch: 91, train_loss: 0.6760, test_loss: 1.2598, test_f1: 0.5832
 epoch: 92, train_loss: 0.6672, test_loss: 1.2349, test_f1: 0.6018
 epoch: 93, train_loss: 0.6625, test_loss: 1.2350, test_f1: 0.5739
 epoch: 94, train_loss: 0.6738, test_loss: 1.2609, test_f1: 0.6015
 epoch: 95, train_loss: 0.6531, test_loss: 1.2734, test_f1: 0.6062
 epoch: 96, train_loss: 0.6725, test_loss: 1.2764, test_f1: 0.5789
 epoch: 97, train_loss: 0.6748, test_loss: 1.2916, test_f1: 0.5759
 epoch: 98, train_loss: 0.6615, test_loss: 1.2860, test_f1: 0.6234
 epoch: 99, train_loss: 0.6687, test_loss: 1.2706, test_f1: 0.6058
##################ITERATION #9 ****************************************
 epoch: 0, train_loss: 1.2339, test_loss: 1.3259, test_f1: 0.2281
 epoch: 1, train_loss: 1.1356, test_loss: 1.3391, test_f1: 0.2281
 epoch: 2, train_loss: 1.1121, test_loss: 1.3351, test_f1: 0.2281
 epoch: 3, train_loss: 1.0934, test_loss: 1.3035, test_f1: 0.2281
 epoch: 4, train_loss: 1.0625, test_loss: 1.2756, test_f1: 0.3014
 epoch: 5, train_loss: 1.0477, test_loss: 1.2594, test_f1: 0.3531
 epoch: 6, train_loss: 1.0338, test_loss: 1.2146, test_f1: 0.4280
 epoch: 7, train_loss: 1.0279, test_loss: 1.1678, test_f1: 0.4721
 epoch: 8, train_loss: 1.0046, test_loss: 1.1408, test_f1: 0.4570
 epoch: 9, train_loss: 1.0058, test_loss: 1.1110, test_f1: 0.4859
 epoch: 10, train_loss: 0.9845, test_loss: 1.0790, test_f1: 0.5251
 epoch: 11, train_loss: 0.9898, test_loss: 1.0558, test_f1: 0.5266
 epoch: 12, train_loss: 0.9728, test_loss: 1.0581, test_f1: 0.5124
 epoch: 13, train_loss: 0.9694, test_loss: 1.0485, test_f1: 0.5278
 epoch: 14, train_loss: 0.9470, test_loss: 1.0319, test_f1: 0.5168
 epoch: 15, train_loss: 0.9527, test_loss: 1.0259, test_f1: 0.5329
 epoch: 16, train_loss: 0.9365, test_loss: 1.0322, test_f1: 0.5395
 epoch: 17, train_loss: 0.9258, test_loss: 1.0358, test_f1: 0.5327
 epoch: 18, train_loss: 0.9419, test_loss: 1.0380, test_f1: 0.5274
 epoch: 19, train_loss: 0.9152, test_loss: 1.0371, test_f1: 0.5348
 epoch: 20, train_loss: 0.9123, test_loss: 1.0243, test_f1: 0.5521
 epoch: 21, train_loss: 0.8932, test_loss: 1.0323, test_f1: 0.5479
 epoch: 22, train_loss: 0.8999, test_loss: 1.0146, test_f1: 0.5554
 epoch: 23, train_loss: 0.9101, test_loss: 1.0158, test_f1: 0.5529
 epoch: 24, train_loss: 0.8986, test_loss: 1.0103, test_f1: 0.5443
 epoch: 25, train_loss: 0.8856, test_loss: 1.0045, test_f1: 0.5483
 epoch: 26, train_loss: 0.8886, test_loss: 0.9975, test_f1: 0.5421
 epoch: 27, train_loss: 0.8865, test_loss: 1.0138, test_f1: 0.5358
 epoch: 28, train_loss: 0.8852, test_loss: 1.0317, test_f1: 0.5500
 epoch: 29, train_loss: 0.8678, test_loss: 1.0275, test_f1: 0.5601
 epoch: 30, train_loss: 0.8655, test_loss: 1.0075, test_f1: 0.5618
 epoch: 31, train_loss: 0.8685, test_loss: 0.9902, test_f1: 0.5614
 epoch: 32, train_loss: 0.8685, test_loss: 1.0252, test_f1: 0.5537
 epoch: 33, train_loss: 0.8467, test_loss: 1.0112, test_f1: 0.5575
 epoch: 34, train_loss: 0.8403, test_loss: 0.9638, test_f1: 0.5708
 epoch: 35, train_loss: 0.8458, test_loss: 0.9801, test_f1: 0.5721
 epoch: 36, train_loss: 0.8425, test_loss: 1.0022, test_f1: 0.5654
 epoch: 37, train_loss: 0.8486, test_loss: 0.9950, test_f1: 0.5702
 epoch: 38, train_loss: 0.8346, test_loss: 1.0116, test_f1: 0.5765
 epoch: 39, train_loss: 0.8364, test_loss: 1.0205, test_f1: 0.5740
 epoch: 40, train_loss: 0.8224, test_loss: 1.0245, test_f1: 0.5626
 epoch: 41, train_loss: 0.8063, test_loss: 0.9994, test_f1: 0.5758
 epoch: 42, train_loss: 0.8150, test_loss: 0.9824, test_f1: 0.5630
 epoch: 43, train_loss: 0.8116, test_loss: 1.0018, test_f1: 0.5628
 epoch: 44, train_loss: 0.8057, test_loss: 0.9710, test_f1: 0.5810
 epoch: 45, train_loss: 0.7969, test_loss: 0.9935, test_f1: 0.5814
 epoch: 46, train_loss: 0.8075, test_loss: 1.0071, test_f1: 0.5949
 epoch: 47, train_loss: 0.8033, test_loss: 1.0308, test_f1: 0.5849
 epoch: 48, train_loss: 0.7927, test_loss: 1.0060, test_f1: 0.5685
 epoch: 49, train_loss: 0.7890, test_loss: 1.0042, test_f1: 0.5496
 epoch: 50, train_loss: 0.7793, test_loss: 1.0252, test_f1: 0.5546
 epoch: 51, train_loss: 0.7751, test_loss: 1.0078, test_f1: 0.5674
 epoch: 52, train_loss: 0.7799, test_loss: 0.9940, test_f1: 0.5854
 epoch: 53, train_loss: 0.7777, test_loss: 0.9810, test_f1: 0.5802
 epoch: 54, train_loss: 0.7740, test_loss: 0.9846, test_f1: 0.5733
 epoch: 55, train_loss: 0.7583, test_loss: 1.0049, test_f1: 0.5794
 epoch: 56, train_loss: 0.7613, test_loss: 1.0080, test_f1: 0.5829
 epoch: 57, train_loss: 0.7506, test_loss: 1.0034, test_f1: 0.5754
 epoch: 58, train_loss: 0.7604, test_loss: 1.0103, test_f1: 0.5766
 epoch: 59, train_loss: 0.7494, test_loss: 1.0207, test_f1: 0.5748
 epoch: 60, train_loss: 0.7487, test_loss: 1.0304, test_f1: 0.5721
 epoch: 61, train_loss: 0.7563, test_loss: 1.0209, test_f1: 0.5751
 epoch: 62, train_loss: 0.7504, test_loss: 0.9914, test_f1: 0.5733
 epoch: 63, train_loss: 0.7489, test_loss: 0.9743, test_f1: 0.5980
 epoch: 64, train_loss: 0.7458, test_loss: 0.9591, test_f1: 0.5847
 epoch: 65, train_loss: 0.7474, test_loss: 1.0071, test_f1: 0.5854
 epoch: 66, train_loss: 0.7396, test_loss: 1.0254, test_f1: 0.5756
 epoch: 67, train_loss: 0.7355, test_loss: 1.0154, test_f1: 0.5804
 epoch: 68, train_loss: 0.7409, test_loss: 1.0087, test_f1: 0.5855
 epoch: 69, train_loss: 0.7324, test_loss: 1.0134, test_f1: 0.5829
 epoch: 70, train_loss: 0.7345, test_loss: 1.0472, test_f1: 0.5805
 epoch: 71, train_loss: 0.7507, test_loss: 1.0469, test_f1: 0.5756
 epoch: 72, train_loss: 0.7234, test_loss: 1.0471, test_f1: 0.5743
 epoch: 73, train_loss: 0.7377, test_loss: 1.0262, test_f1: 0.5731
 epoch: 74, train_loss: 0.7361, test_loss: 1.0132, test_f1: 0.5664
 epoch: 75, train_loss: 0.7289, test_loss: 1.0149, test_f1: 0.5578
 epoch: 76, train_loss: 0.7366, test_loss: 1.0296, test_f1: 0.5554
 epoch: 77, train_loss: 0.7299, test_loss: 1.0036, test_f1: 0.5778
 epoch: 78, train_loss: 0.7219, test_loss: 1.0012, test_f1: 0.5705
 epoch: 79, train_loss: 0.7215, test_loss: 1.0062, test_f1: 0.5785
 epoch: 80, train_loss: 0.7247, test_loss: 1.0343, test_f1: 0.5626
 epoch: 81, train_loss: 0.7216, test_loss: 1.0284, test_f1: 0.5732
 epoch: 82, train_loss: 0.7163, test_loss: 0.9930, test_f1: 0.5787
 epoch: 83, train_loss: 0.7172, test_loss: 0.9860, test_f1: 0.5817
 epoch: 84, train_loss: 0.7224, test_loss: 1.0167, test_f1: 0.5711
 epoch: 85, train_loss: 0.7042, test_loss: 1.0275, test_f1: 0.5701
 epoch: 86, train_loss: 0.7128, test_loss: 1.0293, test_f1: 0.5800
 epoch: 87, train_loss: 0.7056, test_loss: 1.0363, test_f1: 0.5833
 epoch: 88, train_loss: 0.7087, test_loss: 1.0441, test_f1: 0.5807
 epoch: 89, train_loss: 0.7075, test_loss: 1.0516, test_f1: 0.5815
 epoch: 90, train_loss: 0.7059, test_loss: 1.0223, test_f1: 0.5818
 epoch: 91, train_loss: 0.6894, test_loss: 1.0215, test_f1: 0.5755
 epoch: 92, train_loss: 0.7064, test_loss: 1.0354, test_f1: 0.5811
 epoch: 93, train_loss: 0.7004, test_loss: 1.0346, test_f1: 0.5779
 epoch: 94, train_loss: 0.6872, test_loss: 1.0733, test_f1: 0.5782
 epoch: 95, train_loss: 0.6953, test_loss: 1.0619, test_f1: 0.5863
 epoch: 96, train_loss: 0.6808, test_loss: 1.0225, test_f1: 0.6002
 epoch: 97, train_loss: 0.6902, test_loss: 1.0058, test_f1: 0.6022
 epoch: 98, train_loss: 0.6850, test_loss: 1.0337, test_f1: 0.5970
 epoch: 99, train_loss: 0.6790, test_loss: 1.0585, test_f1: 0.5913

Training completed in 402.15 seconds
Best F1: 0.6234 at epoch 98
Mean F1 across iterations: 0.5992  0.0154
========================FINAL RESULTS================================
FEGIN weighted F1: 0.6234  0.0154
python main.py --data ltspice_demos --representation component_net --model FEGIN --layers 6 --hiddens 128 --batch_size 256 --lr 0.0001 --emb_size 512 --epochs 100 --save_appendix component_net_L6_H128_BS256_LR0.0001_E512 --no_val
-----



STDERR:
  File "main.py", line 370, in <module>
    main()
  File "main.py", line 254, in main
    dataset = dataset_class(
  File "/home/philip/projects/ltspice_examples_code_repo/Circuit-Completion-Using-GNNs/component_classification_with_link_prediction_head/evaluation/FEGIN/kernel/circuit_datasets.py", line 15, in __init__
    self.data, self.slices = torch.load(self.processed_paths[0])
  File "/home/philip/.local/lib/python3.8/site-packages/torch/serialization.py", line 1040, in load
    warnings.warn(
  File "/usr/lib/python3.8/warnings.py", line 109, in _showwarnmsg
    sw(msg.message, msg.category, msg.filename, msg.lineno,
  File "main.py", line 47, in warn_with_traceback
    traceback.print_stack(file=log)
/home/philip/projects/ltspice_examples_code_repo/Circuit-Completion-Using-GNNs/component_classification_with_link_prediction_head/evaluation/FEGIN/kernel/circuit_datasets.py:15: FutureWarning: You are using `torch.load` with `weights_only=False` (the current default value), which uses the default pickle module implicitly. It is possible to construct malicious pickle data which will execute arbitrary code during unpickling (See https://github.com/pytorch/pytorch/blob/main/SECURITY.md#untrusted-models for more details). In a future release, the default value for `weights_only` will be flipped to `True`. This limits the functions that could be executed during unpickling. Arbitrary objects will no longer be allowed to be loaded via this mode unless they are explicitly allowlisted by the user via `torch.serialization.add_safe_globals`. We recommend you start setting `weights_only=True` for any use case where you don't have full control of the loaded file. Please open an issue on GitHub for any issues related to this experimental feature.
  self.data, self.slices = torch.load(self.processed_paths[0])
