STDOUT:
Results will be saved in /home/philip/projects/ltspice_examples_code_repo/Circuit-Completion-Using-GNNs/component_classification_with_link_prediction_head/evaluation/FEGIN/results/model_FEGIN_dataset_ltspice_demos
Command line input: python main.py --data ltspice_demos --representation component_component --model FEGIN --layers 2 --hiddens 128 --batch_size 32 --lr 0.0001 --emb_size 250 --epochs 100 --save_appendix component_component_L2_H128_BS32_LR0.0001_E250 --no_val
 is saved.
-----
ltspice_demos - FEGIN
Using 2 layers, 128 hidden units, h = 2
Loading component_component representation dataset
ENTERED
Training FEGIN on component_component representation
Train: 1565, Test: 383
##################ITERATION #0 ****************************************
 epoch: 0, train_loss: 1.3501, test_loss: 1.3354, test_f1: 0.2281
 epoch: 1, train_loss: 1.2844, test_loss: 1.3004, test_f1: 0.2281
 epoch: 2, train_loss: 1.2347, test_loss: 1.2819, test_f1: 0.2281
 epoch: 3, train_loss: 1.1984, test_loss: 1.2673, test_f1: 0.2584
 epoch: 4, train_loss: 1.1743, test_loss: 1.2486, test_f1: 0.2594
 epoch: 5, train_loss: 1.1541, test_loss: 1.2326, test_f1: 0.2855
 epoch: 6, train_loss: 1.1322, test_loss: 1.2158, test_f1: 0.3324
 epoch: 7, train_loss: 1.1040, test_loss: 1.2001, test_f1: 0.3660
 epoch: 8, train_loss: 1.0922, test_loss: 1.1862, test_f1: 0.3823
 epoch: 9, train_loss: 1.0631, test_loss: 1.1722, test_f1: 0.3852
 epoch: 10, train_loss: 1.0445, test_loss: 1.1776, test_f1: 0.3951
 epoch: 11, train_loss: 1.0264, test_loss: 1.1618, test_f1: 0.4115
 epoch: 12, train_loss: 1.0037, test_loss: 1.1553, test_f1: 0.4191
 epoch: 13, train_loss: 0.9827, test_loss: 1.1770, test_f1: 0.4600
 epoch: 14, train_loss: 0.9701, test_loss: 1.1548, test_f1: 0.4560
 epoch: 15, train_loss: 0.9433, test_loss: 1.1621, test_f1: 0.5053
 epoch: 16, train_loss: 0.9352, test_loss: 1.1440, test_f1: 0.5051
 epoch: 17, train_loss: 0.9161, test_loss: 1.1429, test_f1: 0.5027
 epoch: 18, train_loss: 0.9046, test_loss: 1.1727, test_f1: 0.5034
 epoch: 19, train_loss: 0.8982, test_loss: 1.1462, test_f1: 0.5115
 epoch: 20, train_loss: 0.8771, test_loss: 1.1270, test_f1: 0.5115
 epoch: 21, train_loss: 0.8756, test_loss: 1.1386, test_f1: 0.4817
 epoch: 22, train_loss: 0.8538, test_loss: 1.1348, test_f1: 0.5095
 epoch: 23, train_loss: 0.8610, test_loss: 1.0964, test_f1: 0.5163
 epoch: 24, train_loss: 0.8243, test_loss: 1.1239, test_f1: 0.5392
 epoch: 25, train_loss: 0.8189, test_loss: 1.1027, test_f1: 0.5886
 epoch: 26, train_loss: 0.8246, test_loss: 1.1169, test_f1: 0.5215
 epoch: 27, train_loss: 0.8143, test_loss: 1.0975, test_f1: 0.6089
 epoch: 28, train_loss: 0.8046, test_loss: 1.1266, test_f1: 0.5685
 epoch: 29, train_loss: 0.7769, test_loss: 1.1519, test_f1: 0.6025
 epoch: 30, train_loss: 0.7689, test_loss: 1.1127, test_f1: 0.6097
 epoch: 31, train_loss: 0.7658, test_loss: 1.1079, test_f1: 0.6168
 epoch: 32, train_loss: 0.7463, test_loss: 1.2104, test_f1: 0.5547
 epoch: 33, train_loss: 0.7621, test_loss: 1.1747, test_f1: 0.6070
 epoch: 34, train_loss: 0.7366, test_loss: 1.1402, test_f1: 0.6245
 epoch: 35, train_loss: 0.7274, test_loss: 1.2106, test_f1: 0.5725
 epoch: 36, train_loss: 0.7172, test_loss: 1.1939, test_f1: 0.6116
 epoch: 37, train_loss: 0.7287, test_loss: 1.2132, test_f1: 0.6153
 epoch: 38, train_loss: 0.7070, test_loss: 1.1513, test_f1: 0.6151
 epoch: 39, train_loss: 0.6934, test_loss: 1.2810, test_f1: 0.5865
 epoch: 40, train_loss: 0.6964, test_loss: 1.1725, test_f1: 0.6116
 epoch: 41, train_loss: 0.6784, test_loss: 1.1896, test_f1: 0.6083
 epoch: 42, train_loss: 0.6782, test_loss: 1.2289, test_f1: 0.6186
 epoch: 43, train_loss: 0.6704, test_loss: 1.2270, test_f1: 0.6021
 epoch: 44, train_loss: 0.6551, test_loss: 1.2260, test_f1: 0.6119
 epoch: 45, train_loss: 0.6461, test_loss: 1.3440, test_f1: 0.5635
 epoch: 46, train_loss: 0.6492, test_loss: 1.2280, test_f1: 0.5872
 epoch: 47, train_loss: 0.6341, test_loss: 1.3186, test_f1: 0.5840
 epoch: 48, train_loss: 0.6250, test_loss: 1.2961, test_f1: 0.6023
 epoch: 49, train_loss: 0.6276, test_loss: 1.3271, test_f1: 0.6005
 epoch: 50, train_loss: 0.6232, test_loss: 1.3686, test_f1: 0.5830
 epoch: 51, train_loss: 0.6187, test_loss: 1.2888, test_f1: 0.5891
 epoch: 52, train_loss: 0.5977, test_loss: 1.3134, test_f1: 0.5956
 epoch: 53, train_loss: 0.5826, test_loss: 1.3242, test_f1: 0.5951
 epoch: 54, train_loss: 0.5877, test_loss: 1.3263, test_f1: 0.5866
 epoch: 55, train_loss: 0.5892, test_loss: 1.3681, test_f1: 0.5658
 epoch: 56, train_loss: 0.5704, test_loss: 1.3269, test_f1: 0.5853
 epoch: 57, train_loss: 0.5689, test_loss: 1.3035, test_f1: 0.5911
 epoch: 58, train_loss: 0.5539, test_loss: 1.3144, test_f1: 0.5767
 epoch: 59, train_loss: 0.5674, test_loss: 1.3808, test_f1: 0.5841
 epoch: 60, train_loss: 0.5635, test_loss: 1.3713, test_f1: 0.5936
 epoch: 61, train_loss: 0.5718, test_loss: 1.3698, test_f1: 0.5923
 epoch: 62, train_loss: 0.5557, test_loss: 1.3324, test_f1: 0.5895
 epoch: 63, train_loss: 0.5542, test_loss: 1.4008, test_f1: 0.5794
 epoch: 64, train_loss: 0.5693, test_loss: 1.3910, test_f1: 0.5854
 epoch: 65, train_loss: 0.5587, test_loss: 1.4240, test_f1: 0.5911
 epoch: 66, train_loss: 0.5356, test_loss: 1.4575, test_f1: 0.5501
 epoch: 67, train_loss: 0.5506, test_loss: 1.5007, test_f1: 0.5543
 epoch: 68, train_loss: 0.5385, test_loss: 1.4684, test_f1: 0.5785
 epoch: 69, train_loss: 0.5333, test_loss: 1.5057, test_f1: 0.5660
 epoch: 70, train_loss: 0.5318, test_loss: 1.5308, test_f1: 0.5347
 epoch: 71, train_loss: 0.5262, test_loss: 1.4148, test_f1: 0.5650
 epoch: 72, train_loss: 0.5267, test_loss: 1.4543, test_f1: 0.5856
 epoch: 73, train_loss: 0.5416, test_loss: 1.5715, test_f1: 0.5566
 epoch: 74, train_loss: 0.5383, test_loss: 1.5183, test_f1: 0.5574
 epoch: 75, train_loss: 0.5134, test_loss: 1.4530, test_f1: 0.5809
 epoch: 76, train_loss: 0.5284, test_loss: 1.6034, test_f1: 0.5562
 epoch: 77, train_loss: 0.5058, test_loss: 1.4660, test_f1: 0.5890
 epoch: 78, train_loss: 0.5106, test_loss: 1.5214, test_f1: 0.5626
 epoch: 79, train_loss: 0.5176, test_loss: 1.5030, test_f1: 0.5813
 epoch: 80, train_loss: 0.5190, test_loss: 1.6099, test_f1: 0.5489
 epoch: 81, train_loss: 0.5087, test_loss: 1.6217, test_f1: 0.5612
 epoch: 82, train_loss: 0.5095, test_loss: 1.5454, test_f1: 0.5600
 epoch: 83, train_loss: 0.5088, test_loss: 1.6714, test_f1: 0.5626
 epoch: 84, train_loss: 0.4934, test_loss: 1.6205, test_f1: 0.5588
 epoch: 85, train_loss: 0.4806, test_loss: 1.6267, test_f1: 0.5715
 epoch: 86, train_loss: 0.4811, test_loss: 1.6669, test_f1: 0.5535
 epoch: 87, train_loss: 0.5033, test_loss: 1.5673, test_f1: 0.5684
 epoch: 88, train_loss: 0.4805, test_loss: 1.6090, test_f1: 0.5763
 epoch: 89, train_loss: 0.4805, test_loss: 1.5970, test_f1: 0.5706
 epoch: 90, train_loss: 0.4862, test_loss: 1.6317, test_f1: 0.5526
 epoch: 91, train_loss: 0.4662, test_loss: 1.6152, test_f1: 0.5584
 epoch: 92, train_loss: 0.4961, test_loss: 1.6634, test_f1: 0.5711
 epoch: 93, train_loss: 0.4688, test_loss: 1.6393, test_f1: 0.5791
 epoch: 94, train_loss: 0.4576, test_loss: 1.6206, test_f1: 0.5881
 epoch: 95, train_loss: 0.4665, test_loss: 1.7064, test_f1: 0.5772
 epoch: 96, train_loss: 0.4495, test_loss: 1.8182, test_f1: 0.5637
 epoch: 97, train_loss: 0.4764, test_loss: 1.7349, test_f1: 0.5267
 epoch: 98, train_loss: 0.4677, test_loss: 1.6243, test_f1: 0.5936
 epoch: 99, train_loss: 0.4761, test_loss: 1.5862, test_f1: 0.6006
##################ITERATION #1 ****************************************
 epoch: 0, train_loss: 1.2558, test_loss: 1.2680, test_f1: 0.3364
 epoch: 1, train_loss: 1.1687, test_loss: 1.2526, test_f1: 0.3831
 epoch: 2, train_loss: 1.1265, test_loss: 1.1953, test_f1: 0.3927
 epoch: 3, train_loss: 1.0926, test_loss: 1.2303, test_f1: 0.4283
 epoch: 4, train_loss: 1.0624, test_loss: 1.2385, test_f1: 0.4466
 epoch: 5, train_loss: 1.0410, test_loss: 1.2164, test_f1: 0.4751
 epoch: 6, train_loss: 1.0223, test_loss: 1.1837, test_f1: 0.4843
 epoch: 7, train_loss: 1.0057, test_loss: 1.1754, test_f1: 0.5127
 epoch: 8, train_loss: 0.9850, test_loss: 1.1735, test_f1: 0.5268
 epoch: 9, train_loss: 0.9666, test_loss: 1.2031, test_f1: 0.5376
 epoch: 10, train_loss: 0.9452, test_loss: 1.1680, test_f1: 0.5563
 epoch: 11, train_loss: 0.9389, test_loss: 1.1672, test_f1: 0.5623
 epoch: 12, train_loss: 0.9255, test_loss: 1.2150, test_f1: 0.5352
 epoch: 13, train_loss: 0.9065, test_loss: 1.3920, test_f1: 0.5631
 epoch: 14, train_loss: 0.9041, test_loss: 1.1550, test_f1: 0.5686
 epoch: 15, train_loss: 0.8980, test_loss: 1.1749, test_f1: 0.5314
 epoch: 16, train_loss: 0.8671, test_loss: 1.2254, test_f1: 0.5592
 epoch: 17, train_loss: 0.8705, test_loss: 1.1447, test_f1: 0.5691
 epoch: 18, train_loss: 0.8297, test_loss: 1.1112, test_f1: 0.5859
 epoch: 19, train_loss: 0.8258, test_loss: 1.2048, test_f1: 0.5326
 epoch: 20, train_loss: 0.8323, test_loss: 1.1777, test_f1: 0.5764
 epoch: 21, train_loss: 0.8091, test_loss: 1.1824, test_f1: 0.5693
 epoch: 22, train_loss: 0.8164, test_loss: 1.2015, test_f1: 0.5909
 epoch: 23, train_loss: 0.7903, test_loss: 1.1892, test_f1: 0.5653
 epoch: 24, train_loss: 0.7665, test_loss: 1.1982, test_f1: 0.5694
 epoch: 25, train_loss: 0.7842, test_loss: 1.2238, test_f1: 0.5828
 epoch: 26, train_loss: 0.7604, test_loss: 1.5276, test_f1: 0.5595
 epoch: 27, train_loss: 0.7618, test_loss: 1.7492, test_f1: 0.5892
 epoch: 28, train_loss: 0.7566, test_loss: 1.2832, test_f1: 0.5847
 epoch: 29, train_loss: 0.7377, test_loss: 1.3182, test_f1: 0.6067
 epoch: 30, train_loss: 0.7365, test_loss: 1.3046, test_f1: 0.5876
 epoch: 31, train_loss: 0.7297, test_loss: 1.2624, test_f1: 0.6167
 epoch: 32, train_loss: 0.7241, test_loss: 1.2461, test_f1: 0.6010
 epoch: 33, train_loss: 0.7143, test_loss: 1.3972, test_f1: 0.5906
 epoch: 34, train_loss: 0.7123, test_loss: 1.2580, test_f1: 0.6306
 epoch: 35, train_loss: 0.6929, test_loss: 1.3275, test_f1: 0.5988
 epoch: 36, train_loss: 0.6970, test_loss: 1.3838, test_f1: 0.5903
 epoch: 37, train_loss: 0.6770, test_loss: 1.3825, test_f1: 0.5933
 epoch: 38, train_loss: 0.6654, test_loss: 1.4586, test_f1: 0.5954
 epoch: 39, train_loss: 0.6686, test_loss: 1.3485, test_f1: 0.5988
 epoch: 40, train_loss: 0.6780, test_loss: 1.3967, test_f1: 0.5890
 epoch: 41, train_loss: 0.6629, test_loss: 1.7198, test_f1: 0.6004
 epoch: 42, train_loss: 0.6336, test_loss: 1.9671, test_f1: 0.5961
 epoch: 43, train_loss: 0.6364, test_loss: 1.8987, test_f1: 0.5861
 epoch: 44, train_loss: 0.6510, test_loss: 2.5937, test_f1: 0.5408
 epoch: 45, train_loss: 0.6377, test_loss: 2.0797, test_f1: 0.5927
 epoch: 46, train_loss: 0.6246, test_loss: 1.6016, test_f1: 0.6022
 epoch: 47, train_loss: 0.6184, test_loss: 1.4723, test_f1: 0.6074
 epoch: 48, train_loss: 0.6164, test_loss: 1.7025, test_f1: 0.5641
 epoch: 49, train_loss: 0.5992, test_loss: 1.6122, test_f1: 0.5667
 epoch: 50, train_loss: 0.6000, test_loss: 1.6062, test_f1: 0.5722
 epoch: 51, train_loss: 0.5867, test_loss: 1.5569, test_f1: 0.5960
 epoch: 52, train_loss: 0.5744, test_loss: 1.5983, test_f1: 0.5775
 epoch: 53, train_loss: 0.5775, test_loss: 1.7054, test_f1: 0.5634
 epoch: 54, train_loss: 0.5630, test_loss: 1.7041, test_f1: 0.5818
 epoch: 55, train_loss: 0.5501, test_loss: 1.8443, test_f1: 0.5743
 epoch: 56, train_loss: 0.5644, test_loss: 2.1537, test_f1: 0.5671
 epoch: 57, train_loss: 0.5676, test_loss: 2.1543, test_f1: 0.5775
 epoch: 58, train_loss: 0.5645, test_loss: 1.9135, test_f1: 0.5876
 epoch: 59, train_loss: 0.5554, test_loss: 1.8200, test_f1: 0.5779
 epoch: 60, train_loss: 0.5588, test_loss: 1.8719, test_f1: 0.5584
 epoch: 61, train_loss: 0.5479, test_loss: 1.6678, test_f1: 0.5722
 epoch: 62, train_loss: 0.5318, test_loss: 1.6373, test_f1: 0.5945
 epoch: 63, train_loss: 0.5449, test_loss: 1.8363, test_f1: 0.5518
 epoch: 64, train_loss: 0.5265, test_loss: 1.8430, test_f1: 0.5757
 epoch: 65, train_loss: 0.5307, test_loss: 1.8412, test_f1: 0.5692
 epoch: 66, train_loss: 0.5326, test_loss: 1.8844, test_f1: 0.5616
 epoch: 67, train_loss: 0.5324, test_loss: 1.8110, test_f1: 0.5642
 epoch: 68, train_loss: 0.5209, test_loss: 1.8800, test_f1: 0.5616
 epoch: 69, train_loss: 0.5158, test_loss: 1.9657, test_f1: 0.5724
 epoch: 70, train_loss: 0.5154, test_loss: 1.8620, test_f1: 0.5738
 epoch: 71, train_loss: 0.5193, test_loss: 1.8986, test_f1: 0.5654
 epoch: 72, train_loss: 0.5139, test_loss: 1.9015, test_f1: 0.5832
 epoch: 73, train_loss: 0.5114, test_loss: 2.1841, test_f1: 0.5913
 epoch: 74, train_loss: 0.4998, test_loss: 2.2721, test_f1: 0.5895
 epoch: 75, train_loss: 0.5022, test_loss: 1.7955, test_f1: 0.5801
 epoch: 76, train_loss: 0.4966, test_loss: 2.0058, test_f1: 0.5932
 epoch: 77, train_loss: 0.4984, test_loss: 2.1732, test_f1: 0.5696
 epoch: 78, train_loss: 0.4965, test_loss: 2.5385, test_f1: 0.5683
 epoch: 79, train_loss: 0.4804, test_loss: 2.2747, test_f1: 0.5912
 epoch: 80, train_loss: 0.4881, test_loss: 2.4122, test_f1: 0.5831
 epoch: 81, train_loss: 0.4938, test_loss: 2.0893, test_f1: 0.5953
 epoch: 82, train_loss: 0.5017, test_loss: 1.9784, test_f1: 0.5848
 epoch: 83, train_loss: 0.4776, test_loss: 2.1060, test_f1: 0.5605
 epoch: 84, train_loss: 0.4736, test_loss: 2.1528, test_f1: 0.5459
 epoch: 85, train_loss: 0.4700, test_loss: 2.1109, test_f1: 0.5863
 epoch: 86, train_loss: 0.4602, test_loss: 2.1872, test_f1: 0.5725
 epoch: 87, train_loss: 0.4736, test_loss: 2.1823, test_f1: 0.5747
 epoch: 88, train_loss: 0.4533, test_loss: 2.3732, test_f1: 0.5810
 epoch: 89, train_loss: 0.4732, test_loss: 2.1199, test_f1: 0.5692
 epoch: 90, train_loss: 0.4550, test_loss: 2.5211, test_f1: 0.5618
 epoch: 91, train_loss: 0.4452, test_loss: 2.3813, test_f1: 0.5666
 epoch: 92, train_loss: 0.4585, test_loss: 2.3688, test_f1: 0.5698
 epoch: 93, train_loss: 0.4572, test_loss: 2.9576, test_f1: 0.5665
 epoch: 94, train_loss: 0.4695, test_loss: 2.2121, test_f1: 0.5705
 epoch: 95, train_loss: 0.4576, test_loss: 2.4489, test_f1: 0.5788
 epoch: 96, train_loss: 0.4553, test_loss: 2.4404, test_f1: 0.5608
 epoch: 97, train_loss: 0.4652, test_loss: 2.3873, test_f1: 0.5929
 epoch: 98, train_loss: 0.4481, test_loss: 2.3644, test_f1: 0.5699
 epoch: 99, train_loss: 0.4386, test_loss: 2.3531, test_f1: 0.5822
##################ITERATION #2 ****************************************
 epoch: 0, train_loss: 1.2432, test_loss: 1.3183, test_f1: 0.3222
 epoch: 1, train_loss: 1.1637, test_loss: 1.2833, test_f1: 0.3725
 epoch: 2, train_loss: 1.1215, test_loss: 1.2033, test_f1: 0.3909
 epoch: 3, train_loss: 1.0832, test_loss: 1.2033, test_f1: 0.4473
 epoch: 4, train_loss: 1.0577, test_loss: 1.1704, test_f1: 0.4839
 epoch: 5, train_loss: 1.0338, test_loss: 1.1398, test_f1: 0.5311
 epoch: 6, train_loss: 1.0113, test_loss: 1.1431, test_f1: 0.5348
 epoch: 7, train_loss: 0.9967, test_loss: 1.1162, test_f1: 0.5417
 epoch: 8, train_loss: 0.9677, test_loss: 1.1334, test_f1: 0.5523
 epoch: 9, train_loss: 0.9546, test_loss: 1.1118, test_f1: 0.5658
 epoch: 10, train_loss: 0.9293, test_loss: 1.1260, test_f1: 0.5584
 epoch: 11, train_loss: 0.9178, test_loss: 1.1231, test_f1: 0.5582
 epoch: 12, train_loss: 0.8992, test_loss: 1.1027, test_f1: 0.5584
 epoch: 13, train_loss: 0.8947, test_loss: 1.1601, test_f1: 0.5697
 epoch: 14, train_loss: 0.8656, test_loss: 1.1315, test_f1: 0.5834
 epoch: 15, train_loss: 0.8809, test_loss: 1.1392, test_f1: 0.5948
 epoch: 16, train_loss: 0.8617, test_loss: 1.1416, test_f1: 0.5927
 epoch: 17, train_loss: 0.8433, test_loss: 1.1513, test_f1: 0.5846
 epoch: 18, train_loss: 0.8444, test_loss: 1.1544, test_f1: 0.5795
 epoch: 19, train_loss: 0.8350, test_loss: 1.1373, test_f1: 0.6006
 epoch: 20, train_loss: 0.8337, test_loss: 1.1313, test_f1: 0.6006
 epoch: 21, train_loss: 0.8019, test_loss: 1.1716, test_f1: 0.5619
 epoch: 22, train_loss: 0.7906, test_loss: 1.1753, test_f1: 0.5983
 epoch: 23, train_loss: 0.7664, test_loss: 1.2060, test_f1: 0.5696
 epoch: 24, train_loss: 0.7737, test_loss: 1.1928, test_f1: 0.5822
 epoch: 25, train_loss: 0.7759, test_loss: 1.1965, test_f1: 0.5565
 epoch: 26, train_loss: 0.7576, test_loss: 1.1709, test_f1: 0.6238
 epoch: 27, train_loss: 0.7578, test_loss: 1.2314, test_f1: 0.5620
 epoch: 28, train_loss: 0.7496, test_loss: 1.2080, test_f1: 0.5900
 epoch: 29, train_loss: 0.7469, test_loss: 1.2300, test_f1: 0.5657
 epoch: 30, train_loss: 0.7357, test_loss: 1.2269, test_f1: 0.5961
 epoch: 31, train_loss: 0.7281, test_loss: 1.1961, test_f1: 0.6298
 epoch: 32, train_loss: 0.7244, test_loss: 1.3008, test_f1: 0.5851
 epoch: 33, train_loss: 0.7146, test_loss: 1.2684, test_f1: 0.5779
 epoch: 34, train_loss: 0.7168, test_loss: 1.2570, test_f1: 0.5811
 epoch: 35, train_loss: 0.6886, test_loss: 1.2389, test_f1: 0.6137
 epoch: 36, train_loss: 0.6684, test_loss: 1.3150, test_f1: 0.5858
 epoch: 37, train_loss: 0.6773, test_loss: 1.3199, test_f1: 0.5868
 epoch: 38, train_loss: 0.6945, test_loss: 1.2649, test_f1: 0.6242
 epoch: 39, train_loss: 0.6714, test_loss: 1.2914, test_f1: 0.5996
 epoch: 40, train_loss: 0.6497, test_loss: 1.2850, test_f1: 0.6034
 epoch: 41, train_loss: 0.6586, test_loss: 1.2576, test_f1: 0.5949
 epoch: 42, train_loss: 0.6430, test_loss: 1.3838, test_f1: 0.5670
 epoch: 43, train_loss: 0.6414, test_loss: 1.3388, test_f1: 0.5810
 epoch: 44, train_loss: 0.6194, test_loss: 1.3015, test_f1: 0.5941
 epoch: 45, train_loss: 0.6108, test_loss: 1.3747, test_f1: 0.5810
 epoch: 46, train_loss: 0.6077, test_loss: 1.4291, test_f1: 0.5787
 epoch: 47, train_loss: 0.5960, test_loss: 1.3594, test_f1: 0.5915
 epoch: 48, train_loss: 0.5964, test_loss: 1.3454, test_f1: 0.6076
 epoch: 49, train_loss: 0.5779, test_loss: 1.4407, test_f1: 0.6005
 epoch: 50, train_loss: 0.6018, test_loss: 1.3693, test_f1: 0.5873
 epoch: 51, train_loss: 0.5724, test_loss: 1.3789, test_f1: 0.5906
 epoch: 52, train_loss: 0.5663, test_loss: 1.3581, test_f1: 0.6013
 epoch: 53, train_loss: 0.5690, test_loss: 1.4025, test_f1: 0.5852
 epoch: 54, train_loss: 0.5621, test_loss: 1.4144, test_f1: 0.5996
 epoch: 55, train_loss: 0.5521, test_loss: 1.4468, test_f1: 0.5790
 epoch: 56, train_loss: 0.5522, test_loss: 1.4598, test_f1: 0.6091
 epoch: 57, train_loss: 0.5474, test_loss: 1.4449, test_f1: 0.5750
 epoch: 58, train_loss: 0.5415, test_loss: 1.4485, test_f1: 0.6057
 epoch: 59, train_loss: 0.5307, test_loss: 1.4887, test_f1: 0.6024
 epoch: 60, train_loss: 0.5483, test_loss: 1.4738, test_f1: 0.5914
 epoch: 61, train_loss: 0.5288, test_loss: 1.7273, test_f1: 0.5513
 epoch: 62, train_loss: 0.5365, test_loss: 1.7167, test_f1: 0.5798
 epoch: 63, train_loss: 0.5326, test_loss: 1.5319, test_f1: 0.5870
 epoch: 64, train_loss: 0.5162, test_loss: 1.5454, test_f1: 0.6036
 epoch: 65, train_loss: 0.5408, test_loss: 1.6293, test_f1: 0.5565
 epoch: 66, train_loss: 0.5265, test_loss: 1.4625, test_f1: 0.6201
 epoch: 67, train_loss: 0.5355, test_loss: 1.5253, test_f1: 0.5900
 epoch: 68, train_loss: 0.5240, test_loss: 1.6907, test_f1: 0.5634
 epoch: 69, train_loss: 0.5154, test_loss: 1.5876, test_f1: 0.5682
 epoch: 70, train_loss: 0.4988, test_loss: 1.6360, test_f1: 0.5848
 epoch: 71, train_loss: 0.4988, test_loss: 1.5565, test_f1: 0.5757
 epoch: 72, train_loss: 0.5230, test_loss: 1.7017, test_f1: 0.5697
 epoch: 73, train_loss: 0.5011, test_loss: 1.6212, test_f1: 0.5821
 epoch: 74, train_loss: 0.4932, test_loss: 1.7760, test_f1: 0.5655
 epoch: 75, train_loss: 0.5025, test_loss: 1.6757, test_f1: 0.5882
 epoch: 76, train_loss: 0.5029, test_loss: 1.7921, test_f1: 0.5622
 epoch: 77, train_loss: 0.4916, test_loss: 1.7425, test_f1: 0.5701
 epoch: 78, train_loss: 0.4724, test_loss: 1.8289, test_f1: 0.5568
 epoch: 79, train_loss: 0.4800, test_loss: 1.6892, test_f1: 0.5851
 epoch: 80, train_loss: 0.4706, test_loss: 1.7425, test_f1: 0.5534
 epoch: 81, train_loss: 0.4858, test_loss: 1.6612, test_f1: 0.5801
 epoch: 82, train_loss: 0.4575, test_loss: 2.0162, test_f1: 0.5778
 epoch: 83, train_loss: 0.4593, test_loss: 1.9378, test_f1: 0.5757
 epoch: 84, train_loss: 0.4750, test_loss: 2.1230, test_f1: 0.5810
 epoch: 85, train_loss: 0.4679, test_loss: 1.8806, test_f1: 0.5813
 epoch: 86, train_loss: 0.4684, test_loss: 1.9201, test_f1: 0.5934
 epoch: 87, train_loss: 0.4692, test_loss: 1.9979, test_f1: 0.5325
 epoch: 88, train_loss: 0.4688, test_loss: 1.7320, test_f1: 0.5772
 epoch: 89, train_loss: 0.4784, test_loss: 2.0551, test_f1: 0.5834
 epoch: 90, train_loss: 0.4371, test_loss: 1.9369, test_f1: 0.5407
 epoch: 91, train_loss: 0.4699, test_loss: 2.1035, test_f1: 0.5780
 epoch: 92, train_loss: 0.4641, test_loss: 1.9459, test_f1: 0.5620
 epoch: 93, train_loss: 0.4454, test_loss: 2.0645, test_f1: 0.5918
 epoch: 94, train_loss: 0.4668, test_loss: 2.0377, test_f1: 0.5798
 epoch: 95, train_loss: 0.4443, test_loss: 1.8949, test_f1: 0.5701
 epoch: 96, train_loss: 0.4342, test_loss: 2.0447, test_f1: 0.5574
 epoch: 97, train_loss: 0.4353, test_loss: 1.8332, test_f1: 0.5742
 epoch: 98, train_loss: 0.4699, test_loss: 2.0219, test_f1: 0.5739
 epoch: 99, train_loss: 0.4408, test_loss: 2.0834, test_f1: 0.5397
##################ITERATION #3 ****************************************
 epoch: 0, train_loss: 1.2599, test_loss: 1.2821, test_f1: 0.3850
 epoch: 1, train_loss: 1.1641, test_loss: 1.2501, test_f1: 0.4639
 epoch: 2, train_loss: 1.1194, test_loss: 1.1933, test_f1: 0.4970
 epoch: 3, train_loss: 1.0794, test_loss: 1.1426, test_f1: 0.5258
 epoch: 4, train_loss: 1.0515, test_loss: 1.1246, test_f1: 0.5376
 epoch: 5, train_loss: 1.0134, test_loss: 1.0978, test_f1: 0.5354
 epoch: 6, train_loss: 1.0072, test_loss: 1.0877, test_f1: 0.5627
 epoch: 7, train_loss: 0.9669, test_loss: 1.0909, test_f1: 0.5614
 epoch: 8, train_loss: 0.9502, test_loss: 1.0654, test_f1: 0.5969
 epoch: 9, train_loss: 0.9337, test_loss: 1.0587, test_f1: 0.6057
 epoch: 10, train_loss: 0.9228, test_loss: 1.0343, test_f1: 0.6209
 epoch: 11, train_loss: 0.9066, test_loss: 1.0746, test_f1: 0.5727
 epoch: 12, train_loss: 0.8902, test_loss: 1.0433, test_f1: 0.6062
 epoch: 13, train_loss: 0.8729, test_loss: 1.0209, test_f1: 0.6124
 epoch: 14, train_loss: 0.8597, test_loss: 1.0252, test_f1: 0.6094
 epoch: 15, train_loss: 0.8451, test_loss: 1.1012, test_f1: 0.5666
 epoch: 16, train_loss: 0.8343, test_loss: 1.0195, test_f1: 0.6313
 epoch: 17, train_loss: 0.8318, test_loss: 1.0793, test_f1: 0.5924
 epoch: 18, train_loss: 0.8137, test_loss: 1.0138, test_f1: 0.6480
 epoch: 19, train_loss: 0.8307, test_loss: 1.0507, test_f1: 0.6199
 epoch: 20, train_loss: 0.8016, test_loss: 1.0094, test_f1: 0.6396
 epoch: 21, train_loss: 0.7880, test_loss: 1.0199, test_f1: 0.6272
 epoch: 22, train_loss: 0.7602, test_loss: 1.0021, test_f1: 0.6107
 epoch: 23, train_loss: 0.7573, test_loss: 1.0173, test_f1: 0.6258
 epoch: 24, train_loss: 0.7660, test_loss: 1.0003, test_f1: 0.6206
 epoch: 25, train_loss: 0.7682, test_loss: 1.0017, test_f1: 0.6291
 epoch: 26, train_loss: 0.7410, test_loss: 1.0601, test_f1: 0.6129
 epoch: 27, train_loss: 0.7256, test_loss: 1.0097, test_f1: 0.6494
 epoch: 28, train_loss: 0.7109, test_loss: 1.0180, test_f1: 0.6640
 epoch: 29, train_loss: 0.7143, test_loss: 1.0177, test_f1: 0.6278
 epoch: 30, train_loss: 0.7335, test_loss: 1.0008, test_f1: 0.6558
 epoch: 31, train_loss: 0.6970, test_loss: 1.0142, test_f1: 0.6488
 epoch: 32, train_loss: 0.7119, test_loss: 1.0332, test_f1: 0.6168
 epoch: 33, train_loss: 0.6916, test_loss: 1.0173, test_f1: 0.6191
 epoch: 34, train_loss: 0.6943, test_loss: 1.0758, test_f1: 0.6343
 epoch: 35, train_loss: 0.6804, test_loss: 1.0773, test_f1: 0.6447
 epoch: 36, train_loss: 0.6776, test_loss: 1.0774, test_f1: 0.6328
 epoch: 37, train_loss: 0.6862, test_loss: 1.1544, test_f1: 0.6010
 epoch: 38, train_loss: 0.6785, test_loss: 1.1400, test_f1: 0.6400
 epoch: 39, train_loss: 0.6451, test_loss: 1.1895, test_f1: 0.6113
 epoch: 40, train_loss: 0.6585, test_loss: 1.1396, test_f1: 0.6046
 epoch: 41, train_loss: 0.6452, test_loss: 1.1219, test_f1: 0.5758
 epoch: 42, train_loss: 0.6297, test_loss: 1.1965, test_f1: 0.6145
 epoch: 43, train_loss: 0.6255, test_loss: 1.2169, test_f1: 0.5731
 epoch: 44, train_loss: 0.6482, test_loss: 1.1763, test_f1: 0.6207
 epoch: 45, train_loss: 0.6124, test_loss: 1.1886, test_f1: 0.6221
 epoch: 46, train_loss: 0.6288, test_loss: 1.2524, test_f1: 0.5666
 epoch: 47, train_loss: 0.6055, test_loss: 1.2248, test_f1: 0.5845
 epoch: 48, train_loss: 0.5983, test_loss: 1.1985, test_f1: 0.6347
 epoch: 49, train_loss: 0.5966, test_loss: 1.2586, test_f1: 0.5670
 epoch: 50, train_loss: 0.5832, test_loss: 1.2100, test_f1: 0.6056
 epoch: 51, train_loss: 0.5868, test_loss: 1.2175, test_f1: 0.6076
 epoch: 52, train_loss: 0.5677, test_loss: 1.2918, test_f1: 0.5775
 epoch: 53, train_loss: 0.5604, test_loss: 1.2890, test_f1: 0.6069
 epoch: 54, train_loss: 0.5699, test_loss: 1.3187, test_f1: 0.6242
 epoch: 55, train_loss: 0.5501, test_loss: 1.2558, test_f1: 0.5978
 epoch: 56, train_loss: 0.5436, test_loss: 1.3617, test_f1: 0.5947
 epoch: 57, train_loss: 0.5527, test_loss: 1.3578, test_f1: 0.6060
 epoch: 58, train_loss: 0.5451, test_loss: 1.3295, test_f1: 0.6045
 epoch: 59, train_loss: 0.5398, test_loss: 1.2773, test_f1: 0.6170
 epoch: 60, train_loss: 0.5463, test_loss: 1.3508, test_f1: 0.6009
 epoch: 61, train_loss: 0.5540, test_loss: 1.3784, test_f1: 0.5798
 epoch: 62, train_loss: 0.5351, test_loss: 1.4149, test_f1: 0.5852
 epoch: 63, train_loss: 0.5372, test_loss: 1.3924, test_f1: 0.5997
 epoch: 64, train_loss: 0.5456, test_loss: 1.3614, test_f1: 0.5964
 epoch: 65, train_loss: 0.5232, test_loss: 1.3721, test_f1: 0.5908
 epoch: 66, train_loss: 0.5396, test_loss: 1.3230, test_f1: 0.6007
 epoch: 67, train_loss: 0.5181, test_loss: 1.4281, test_f1: 0.5875
 epoch: 68, train_loss: 0.5166, test_loss: 1.4385, test_f1: 0.5785
 epoch: 69, train_loss: 0.5192, test_loss: 1.4042, test_f1: 0.5991
 epoch: 70, train_loss: 0.5333, test_loss: 1.3845, test_f1: 0.6066
 epoch: 71, train_loss: 0.5162, test_loss: 1.4140, test_f1: 0.6230
 epoch: 72, train_loss: 0.4866, test_loss: 1.4798, test_f1: 0.5915
 epoch: 73, train_loss: 0.5077, test_loss: 1.4559, test_f1: 0.6043
 epoch: 74, train_loss: 0.5144, test_loss: 1.4852, test_f1: 0.5867
 epoch: 75, train_loss: 0.4897, test_loss: 1.4743, test_f1: 0.6039
 epoch: 76, train_loss: 0.5223, test_loss: 1.5037, test_f1: 0.5944
 epoch: 77, train_loss: 0.5024, test_loss: 1.5228, test_f1: 0.5787
 epoch: 78, train_loss: 0.4930, test_loss: 1.5008, test_f1: 0.5820
 epoch: 79, train_loss: 0.5051, test_loss: 1.5490, test_f1: 0.5800
 epoch: 80, train_loss: 0.5000, test_loss: 1.5521, test_f1: 0.5668
 epoch: 81, train_loss: 0.4831, test_loss: 1.5017, test_f1: 0.5933
 epoch: 82, train_loss: 0.4873, test_loss: 1.5956, test_f1: 0.5747
 epoch: 83, train_loss: 0.4911, test_loss: 1.6551, test_f1: 0.5820
 epoch: 84, train_loss: 0.4874, test_loss: 1.6138, test_f1: 0.5846
 epoch: 85, train_loss: 0.5024, test_loss: 1.6556, test_f1: 0.5850
 epoch: 86, train_loss: 0.4948, test_loss: 1.6183, test_f1: 0.6039
 epoch: 87, train_loss: 0.4751, test_loss: 1.6276, test_f1: 0.6028
 epoch: 88, train_loss: 0.4900, test_loss: 1.7613, test_f1: 0.5747
 epoch: 89, train_loss: 0.4658, test_loss: 1.6420, test_f1: 0.6025
 epoch: 90, train_loss: 0.4728, test_loss: 1.6172, test_f1: 0.5973
 epoch: 91, train_loss: 0.4699, test_loss: 1.6773, test_f1: 0.5777
 epoch: 92, train_loss: 0.4628, test_loss: 1.7073, test_f1: 0.5904
 epoch: 93, train_loss: 0.4511, test_loss: 1.7083, test_f1: 0.5928
 epoch: 94, train_loss: 0.4557, test_loss: 1.7492, test_f1: 0.5712
 epoch: 95, train_loss: 0.4549, test_loss: 1.6861, test_f1: 0.5805
 epoch: 96, train_loss: 0.4410, test_loss: 1.5808, test_f1: 0.5997
 epoch: 97, train_loss: 0.4446, test_loss: 1.6437, test_f1: 0.5916
 epoch: 98, train_loss: 0.4475, test_loss: 1.6599, test_f1: 0.6057
 epoch: 99, train_loss: 0.4448, test_loss: 1.6752, test_f1: 0.5949
##################ITERATION #4 ****************************************
 epoch: 0, train_loss: 1.2717, test_loss: 1.2551, test_f1: 0.3986
 epoch: 1, train_loss: 1.1440, test_loss: 1.2710, test_f1: 0.4588
 epoch: 2, train_loss: 1.1128, test_loss: 1.2797, test_f1: 0.4676
 epoch: 3, train_loss: 1.0681, test_loss: 1.1816, test_f1: 0.4701
 epoch: 4, train_loss: 1.0545, test_loss: 1.2328, test_f1: 0.5226
 epoch: 5, train_loss: 1.0307, test_loss: 1.2085, test_f1: 0.5152
 epoch: 6, train_loss: 1.0156, test_loss: 1.2053, test_f1: 0.5458
 epoch: 7, train_loss: 0.9797, test_loss: 1.2677, test_f1: 0.5018
 epoch: 8, train_loss: 0.9601, test_loss: 1.1770, test_f1: 0.5374
 epoch: 9, train_loss: 0.9538, test_loss: 1.1887, test_f1: 0.5763
 epoch: 10, train_loss: 0.9495, test_loss: 1.2676, test_f1: 0.5374
 epoch: 11, train_loss: 0.9292, test_loss: 1.2464, test_f1: 0.5578
 epoch: 12, train_loss: 0.9059, test_loss: 1.3537, test_f1: 0.5465
 epoch: 13, train_loss: 0.8808, test_loss: 1.2388, test_f1: 0.5582
 epoch: 14, train_loss: 0.8907, test_loss: 1.3120, test_f1: 0.5607
 epoch: 15, train_loss: 0.8702, test_loss: 1.3443, test_f1: 0.5772
 epoch: 16, train_loss: 0.8599, test_loss: 1.2552, test_f1: 0.5798
 epoch: 17, train_loss: 0.8322, test_loss: 1.2379, test_f1: 0.5743
 epoch: 18, train_loss: 0.8302, test_loss: 1.3843, test_f1: 0.5365
 epoch: 19, train_loss: 0.8215, test_loss: 1.3374, test_f1: 0.5800
 epoch: 20, train_loss: 0.8159, test_loss: 1.4311, test_f1: 0.5459
 epoch: 21, train_loss: 0.8015, test_loss: 1.2869, test_f1: 0.5581
 epoch: 22, train_loss: 0.7912, test_loss: 1.3947, test_f1: 0.5795
 epoch: 23, train_loss: 0.8018, test_loss: 1.4022, test_f1: 0.5733
 epoch: 24, train_loss: 0.7677, test_loss: 1.4782, test_f1: 0.5724
 epoch: 25, train_loss: 0.7577, test_loss: 1.4457, test_f1: 0.5507
 epoch: 26, train_loss: 0.7597, test_loss: 1.3434, test_f1: 0.5631
 epoch: 27, train_loss: 0.7484, test_loss: 1.5497, test_f1: 0.5567
 epoch: 28, train_loss: 0.7426, test_loss: 1.5886, test_f1: 0.5563
 epoch: 29, train_loss: 0.7377, test_loss: 1.7822, test_f1: 0.5883
 epoch: 30, train_loss: 0.7429, test_loss: 1.5842, test_f1: 0.5618
 epoch: 31, train_loss: 0.7106, test_loss: 1.6277, test_f1: 0.5772
 epoch: 32, train_loss: 0.7260, test_loss: 1.6782, test_f1: 0.5677
 epoch: 33, train_loss: 0.7190, test_loss: 1.6168, test_f1: 0.5649
 epoch: 34, train_loss: 0.6930, test_loss: 1.8099, test_f1: 0.5590
 epoch: 35, train_loss: 0.7042, test_loss: 1.8760, test_f1: 0.5336
 epoch: 36, train_loss: 0.6870, test_loss: 1.9071, test_f1: 0.5499
 epoch: 37, train_loss: 0.6762, test_loss: 1.7765, test_f1: 0.5516
 epoch: 38, train_loss: 0.6699, test_loss: 1.9919, test_f1: 0.5822
 epoch: 39, train_loss: 0.6603, test_loss: 1.9635, test_f1: 0.5619
 epoch: 40, train_loss: 0.6464, test_loss: 1.5613, test_f1: 0.5747
 epoch: 41, train_loss: 0.6606, test_loss: 2.2085, test_f1: 0.5686
 epoch: 42, train_loss: 0.6365, test_loss: 2.1955, test_f1: 0.5485
 epoch: 43, train_loss: 0.6386, test_loss: 2.0014, test_f1: 0.5614
 epoch: 44, train_loss: 0.6438, test_loss: 2.0677, test_f1: 0.5538
 epoch: 45, train_loss: 0.6279, test_loss: 2.1077, test_f1: 0.5618
 epoch: 46, train_loss: 0.6115, test_loss: 2.0172, test_f1: 0.5649
 epoch: 47, train_loss: 0.6189, test_loss: 2.2729, test_f1: 0.5566
 epoch: 48, train_loss: 0.6204, test_loss: 2.2157, test_f1: 0.5589
 epoch: 49, train_loss: 0.5848, test_loss: 2.3238, test_f1: 0.5585
 epoch: 50, train_loss: 0.5910, test_loss: 2.1243, test_f1: 0.5700
 epoch: 51, train_loss: 0.5761, test_loss: 2.3870, test_f1: 0.5748
 epoch: 52, train_loss: 0.5793, test_loss: 2.2688, test_f1: 0.5717
 epoch: 53, train_loss: 0.5629, test_loss: 2.1857, test_f1: 0.5556
 epoch: 54, train_loss: 0.5613, test_loss: 2.2420, test_f1: 0.5484
 epoch: 55, train_loss: 0.5467, test_loss: 2.0891, test_f1: 0.5533
 epoch: 56, train_loss: 0.5642, test_loss: 2.0316, test_f1: 0.5534
 epoch: 57, train_loss: 0.5446, test_loss: 2.1973, test_f1: 0.5533
 epoch: 58, train_loss: 0.5543, test_loss: 2.1228, test_f1: 0.5724
 epoch: 59, train_loss: 0.5517, test_loss: 2.0630, test_f1: 0.5716
 epoch: 60, train_loss: 0.5615, test_loss: 2.3713, test_f1: 0.5597
 epoch: 61, train_loss: 0.5502, test_loss: 2.1053, test_f1: 0.5586
 epoch: 62, train_loss: 0.5585, test_loss: 2.1543, test_f1: 0.5708
 epoch: 63, train_loss: 0.5194, test_loss: 2.2640, test_f1: 0.5676
 epoch: 64, train_loss: 0.5323, test_loss: 2.1260, test_f1: 0.5555
 epoch: 65, train_loss: 0.5291, test_loss: 2.2947, test_f1: 0.5659
 epoch: 66, train_loss: 0.5249, test_loss: 2.4099, test_f1: 0.5470
 epoch: 67, train_loss: 0.5134, test_loss: 2.3090, test_f1: 0.5562
 epoch: 68, train_loss: 0.5336, test_loss: 2.3508, test_f1: 0.5775
 epoch: 69, train_loss: 0.5168, test_loss: 2.3417, test_f1: 0.5508
 epoch: 70, train_loss: 0.4943, test_loss: 2.1837, test_f1: 0.5710
 epoch: 71, train_loss: 0.5044, test_loss: 2.3456, test_f1: 0.5788
 epoch: 72, train_loss: 0.5087, test_loss: 2.2114, test_f1: 0.5556
 epoch: 73, train_loss: 0.4937, test_loss: 2.3218, test_f1: 0.5716
 epoch: 74, train_loss: 0.5125, test_loss: 2.1711, test_f1: 0.5437
 epoch: 75, train_loss: 0.4940, test_loss: 2.2997, test_f1: 0.5432
 epoch: 76, train_loss: 0.5006, test_loss: 2.5775, test_f1: 0.5500
 epoch: 77, train_loss: 0.4776, test_loss: 2.3402, test_f1: 0.5835
 epoch: 78, train_loss: 0.4848, test_loss: 2.3977, test_f1: 0.5680
 epoch: 79, train_loss: 0.5096, test_loss: 2.3392, test_f1: 0.5760
 epoch: 80, train_loss: 0.4999, test_loss: 2.5640, test_f1: 0.5326
 epoch: 81, train_loss: 0.4624, test_loss: 2.4738, test_f1: 0.5526
 epoch: 82, train_loss: 0.4778, test_loss: 2.8328, test_f1: 0.5778
 epoch: 83, train_loss: 0.4803, test_loss: 2.3046, test_f1: 0.5773
 epoch: 84, train_loss: 0.4677, test_loss: 2.3376, test_f1: 0.5791
 epoch: 85, train_loss: 0.4727, test_loss: 2.6735, test_f1: 0.5838
 epoch: 86, train_loss: 0.4730, test_loss: 2.7789, test_f1: 0.5566
 epoch: 87, train_loss: 0.4923, test_loss: 2.6396, test_f1: 0.5573
 epoch: 88, train_loss: 0.4818, test_loss: 3.0000, test_f1: 0.5471
 epoch: 89, train_loss: 0.4413, test_loss: 2.8189, test_f1: 0.5780
 epoch: 90, train_loss: 0.4682, test_loss: 2.7600, test_f1: 0.5553
 epoch: 91, train_loss: 0.4845, test_loss: 2.8458, test_f1: 0.5747
 epoch: 92, train_loss: 0.4577, test_loss: 2.9869, test_f1: 0.5644
 epoch: 93, train_loss: 0.4433, test_loss: 2.9313, test_f1: 0.5480
 epoch: 94, train_loss: 0.4412, test_loss: 3.1736, test_f1: 0.5547
 epoch: 95, train_loss: 0.4598, test_loss: 2.8544, test_f1: 0.5812
 epoch: 96, train_loss: 0.4550, test_loss: 2.8077, test_f1: 0.5640
 epoch: 97, train_loss: 0.4524, test_loss: 2.7653, test_f1: 0.5470
 epoch: 98, train_loss: 0.4576, test_loss: 2.9949, test_f1: 0.5714
 epoch: 99, train_loss: 0.4463, test_loss: 3.2188, test_f1: 0.5580
##################ITERATION #5 ****************************************
 epoch: 0, train_loss: 1.2734, test_loss: 1.2894, test_f1: 0.3953
 epoch: 1, train_loss: 1.1815, test_loss: 1.2383, test_f1: 0.4555
 epoch: 2, train_loss: 1.1141, test_loss: 1.2083, test_f1: 0.4782
 epoch: 3, train_loss: 1.0929, test_loss: 1.1812, test_f1: 0.4516
 epoch: 4, train_loss: 1.0614, test_loss: 1.1897, test_f1: 0.5084
 epoch: 5, train_loss: 1.0384, test_loss: 1.1684, test_f1: 0.5325
 epoch: 6, train_loss: 1.0347, test_loss: 1.1688, test_f1: 0.5403
 epoch: 7, train_loss: 0.9829, test_loss: 1.1991, test_f1: 0.5271
 epoch: 8, train_loss: 0.9809, test_loss: 1.2226, test_f1: 0.5088
 epoch: 9, train_loss: 0.9615, test_loss: 1.1774, test_f1: 0.5359
 epoch: 10, train_loss: 0.9474, test_loss: 1.2423, test_f1: 0.5436
 epoch: 11, train_loss: 0.9298, test_loss: 1.2043, test_f1: 0.5096
 epoch: 12, train_loss: 0.9215, test_loss: 1.2184, test_f1: 0.5226
 epoch: 13, train_loss: 0.9023, test_loss: 1.2562, test_f1: 0.5143
 epoch: 14, train_loss: 0.8850, test_loss: 1.2473, test_f1: 0.5013
 epoch: 15, train_loss: 0.8726, test_loss: 1.2072, test_f1: 0.5752
 epoch: 16, train_loss: 0.8750, test_loss: 1.2671, test_f1: 0.5344
 epoch: 17, train_loss: 0.8833, test_loss: 1.2114, test_f1: 0.5556
 epoch: 18, train_loss: 0.8661, test_loss: 1.2185, test_f1: 0.5774
 epoch: 19, train_loss: 0.8300, test_loss: 1.2503, test_f1: 0.5470
 epoch: 20, train_loss: 0.8379, test_loss: 1.1960, test_f1: 0.5918
 epoch: 21, train_loss: 0.8121, test_loss: 1.2905, test_f1: 0.5624
 epoch: 22, train_loss: 0.8142, test_loss: 1.2265, test_f1: 0.5909
 epoch: 23, train_loss: 0.8039, test_loss: 1.2754, test_f1: 0.5784
 epoch: 24, train_loss: 0.7946, test_loss: 1.2548, test_f1: 0.5782
 epoch: 25, train_loss: 0.8024, test_loss: 1.2695, test_f1: 0.5792
 epoch: 26, train_loss: 0.7871, test_loss: 1.1539, test_f1: 0.6163
 epoch: 27, train_loss: 0.7965, test_loss: 1.2753, test_f1: 0.5768
 epoch: 28, train_loss: 0.7708, test_loss: 1.3398, test_f1: 0.5506
 epoch: 29, train_loss: 0.7666, test_loss: 1.2619, test_f1: 0.5754
 epoch: 30, train_loss: 0.7580, test_loss: 1.2908, test_f1: 0.5831
 epoch: 31, train_loss: 0.7647, test_loss: 1.2645, test_f1: 0.6026
 epoch: 32, train_loss: 0.7490, test_loss: 1.3483, test_f1: 0.5839
 epoch: 33, train_loss: 0.7464, test_loss: 1.3842, test_f1: 0.5765
 epoch: 34, train_loss: 0.7310, test_loss: 1.3854, test_f1: 0.5655
 epoch: 35, train_loss: 0.7196, test_loss: 1.3038, test_f1: 0.5631
 epoch: 36, train_loss: 0.7218, test_loss: 1.4674, test_f1: 0.5455
 epoch: 37, train_loss: 0.6878, test_loss: 1.4347, test_f1: 0.5758
 epoch: 38, train_loss: 0.7071, test_loss: 1.3753, test_f1: 0.5718
 epoch: 39, train_loss: 0.7134, test_loss: 1.3829, test_f1: 0.5574
 epoch: 40, train_loss: 0.6937, test_loss: 1.3523, test_f1: 0.5841
 epoch: 41, train_loss: 0.6893, test_loss: 1.3622, test_f1: 0.5546
 epoch: 42, train_loss: 0.6785, test_loss: 1.3926, test_f1: 0.6026
 epoch: 43, train_loss: 0.6826, test_loss: 1.4223, test_f1: 0.5788
 epoch: 44, train_loss: 0.6585, test_loss: 1.3603, test_f1: 0.5682
 epoch: 45, train_loss: 0.6608, test_loss: 1.5568, test_f1: 0.5459
 epoch: 46, train_loss: 0.6755, test_loss: 1.3838, test_f1: 0.5728
 epoch: 47, train_loss: 0.6556, test_loss: 1.3926, test_f1: 0.5860
 epoch: 48, train_loss: 0.6370, test_loss: 1.5047, test_f1: 0.5629
 epoch: 49, train_loss: 0.6419, test_loss: 1.5049, test_f1: 0.5606
 epoch: 50, train_loss: 0.6369, test_loss: 1.5130, test_f1: 0.5560
 epoch: 51, train_loss: 0.6161, test_loss: 1.5319, test_f1: 0.5474
 epoch: 52, train_loss: 0.6071, test_loss: 1.5318, test_f1: 0.5599
 epoch: 53, train_loss: 0.6137, test_loss: 1.5255, test_f1: 0.5649
 epoch: 54, train_loss: 0.6056, test_loss: 1.4670, test_f1: 0.5867
 epoch: 55, train_loss: 0.5874, test_loss: 1.5602, test_f1: 0.5722
 epoch: 56, train_loss: 0.5910, test_loss: 1.5734, test_f1: 0.5573
 epoch: 57, train_loss: 0.5909, test_loss: 1.6054, test_f1: 0.5786
 epoch: 58, train_loss: 0.5983, test_loss: 1.5005, test_f1: 0.5765
 epoch: 59, train_loss: 0.6013, test_loss: 1.5885, test_f1: 0.5724
 epoch: 60, train_loss: 0.6011, test_loss: 1.5835, test_f1: 0.5765
 epoch: 61, train_loss: 0.5865, test_loss: 1.6574, test_f1: 0.5594
 epoch: 62, train_loss: 0.5772, test_loss: 1.6290, test_f1: 0.5595
 epoch: 63, train_loss: 0.5846, test_loss: 1.5363, test_f1: 0.5861
 epoch: 64, train_loss: 0.5833, test_loss: 1.6681, test_f1: 0.5520
 epoch: 65, train_loss: 0.5727, test_loss: 1.5752, test_f1: 0.5806
 epoch: 66, train_loss: 0.5819, test_loss: 1.6360, test_f1: 0.5860
 epoch: 67, train_loss: 0.5483, test_loss: 1.7157, test_f1: 0.5728
 epoch: 68, train_loss: 0.5560, test_loss: 1.6243, test_f1: 0.5720
 epoch: 69, train_loss: 0.5794, test_loss: 1.6539, test_f1: 0.5882
 epoch: 70, train_loss: 0.5553, test_loss: 1.5576, test_f1: 0.5881
 epoch: 71, train_loss: 0.5531, test_loss: 1.6546, test_f1: 0.5792
 epoch: 72, train_loss: 0.5448, test_loss: 1.8264, test_f1: 0.5756
 epoch: 73, train_loss: 0.5534, test_loss: 1.6393, test_f1: 0.5760
 epoch: 74, train_loss: 0.5757, test_loss: 1.6264, test_f1: 0.5749
 epoch: 75, train_loss: 0.5364, test_loss: 1.6998, test_f1: 0.5713
 epoch: 76, train_loss: 0.5373, test_loss: 1.6956, test_f1: 0.5969
 epoch: 77, train_loss: 0.5322, test_loss: 1.6264, test_f1: 0.5859
 epoch: 78, train_loss: 0.5428, test_loss: 1.6797, test_f1: 0.5770
 epoch: 79, train_loss: 0.5329, test_loss: 1.7660, test_f1: 0.5950
 epoch: 80, train_loss: 0.5176, test_loss: 1.7978, test_f1: 0.5703
 epoch: 81, train_loss: 0.5164, test_loss: 1.7076, test_f1: 0.5683
 epoch: 82, train_loss: 0.5320, test_loss: 1.7197, test_f1: 0.5833
 epoch: 83, train_loss: 0.5287, test_loss: 1.8693, test_f1: 0.5851
 epoch: 84, train_loss: 0.5154, test_loss: 1.7864, test_f1: 0.5606
 epoch: 85, train_loss: 0.5424, test_loss: 1.7513, test_f1: 0.5760
 epoch: 86, train_loss: 0.5248, test_loss: 1.7196, test_f1: 0.5955
 epoch: 87, train_loss: 0.5081, test_loss: 1.7371, test_f1: 0.5817
 epoch: 88, train_loss: 0.5026, test_loss: 1.6790, test_f1: 0.6038
 epoch: 89, train_loss: 0.4947, test_loss: 1.8073, test_f1: 0.5839
 epoch: 90, train_loss: 0.5162, test_loss: 1.9648, test_f1: 0.5649
 epoch: 91, train_loss: 0.5122, test_loss: 1.9813, test_f1: 0.5753
 epoch: 92, train_loss: 0.4913, test_loss: 2.0291, test_f1: 0.5696
 epoch: 93, train_loss: 0.4751, test_loss: 1.9468, test_f1: 0.5724
 epoch: 94, train_loss: 0.4926, test_loss: 1.9152, test_f1: 0.5630
 epoch: 95, train_loss: 0.5011, test_loss: 1.8611, test_f1: 0.5801
 epoch: 96, train_loss: 0.5049, test_loss: 1.9337, test_f1: 0.5635
 epoch: 97, train_loss: 0.4926, test_loss: 1.8498, test_f1: 0.5629
 epoch: 98, train_loss: 0.4909, test_loss: 2.0265, test_f1: 0.5684
 epoch: 99, train_loss: 0.4966, test_loss: 2.0004, test_f1: 0.5760
##################ITERATION #6 ****************************************
 epoch: 0, train_loss: 1.2987, test_loss: 1.3063, test_f1: 0.3681
 epoch: 1, train_loss: 1.1352, test_loss: 1.2026, test_f1: 0.4948
 epoch: 2, train_loss: 1.1204, test_loss: 1.1810, test_f1: 0.4971
 epoch: 3, train_loss: 1.0737, test_loss: 1.1522, test_f1: 0.5088
 epoch: 4, train_loss: 1.0564, test_loss: 1.1477, test_f1: 0.5174
 epoch: 5, train_loss: 1.0186, test_loss: 1.1349, test_f1: 0.5462
 epoch: 6, train_loss: 1.0044, test_loss: 1.1227, test_f1: 0.5069
 epoch: 7, train_loss: 1.0034, test_loss: 1.1216, test_f1: 0.5162
 epoch: 8, train_loss: 0.9895, test_loss: 1.1436, test_f1: 0.5021
 epoch: 9, train_loss: 0.9529, test_loss: 1.1101, test_f1: 0.5545
 epoch: 10, train_loss: 0.9615, test_loss: 1.1286, test_f1: 0.5316
 epoch: 11, train_loss: 0.9428, test_loss: 1.1384, test_f1: 0.5844
 epoch: 12, train_loss: 0.9247, test_loss: 1.1109, test_f1: 0.6078
 epoch: 13, train_loss: 0.9010, test_loss: 1.0884, test_f1: 0.5896
 epoch: 14, train_loss: 0.9133, test_loss: 1.0929, test_f1: 0.5900
 epoch: 15, train_loss: 0.9021, test_loss: 1.0850, test_f1: 0.5875
 epoch: 16, train_loss: 0.8817, test_loss: 1.1019, test_f1: 0.5548
 epoch: 17, train_loss: 0.8593, test_loss: 1.1698, test_f1: 0.5384
 epoch: 18, train_loss: 0.8514, test_loss: 1.1229, test_f1: 0.5477
 epoch: 19, train_loss: 0.8386, test_loss: 1.1605, test_f1: 0.5262
 epoch: 20, train_loss: 0.8498, test_loss: 1.1128, test_f1: 0.5459
 epoch: 21, train_loss: 0.8179, test_loss: 1.1891, test_f1: 0.5505
 epoch: 22, train_loss: 0.8526, test_loss: 1.1342, test_f1: 0.5628
 epoch: 23, train_loss: 0.8393, test_loss: 1.1580, test_f1: 0.5392
 epoch: 24, train_loss: 0.8165, test_loss: 1.1328, test_f1: 0.5693
 epoch: 25, train_loss: 0.8043, test_loss: 1.1244, test_f1: 0.5690
 epoch: 26, train_loss: 0.7937, test_loss: 1.1366, test_f1: 0.5818
 epoch: 27, train_loss: 0.7869, test_loss: 1.1289, test_f1: 0.5971
 epoch: 28, train_loss: 0.7787, test_loss: 1.1400, test_f1: 0.5832
 epoch: 29, train_loss: 0.8028, test_loss: 1.1191, test_f1: 0.5815
 epoch: 30, train_loss: 0.7538, test_loss: 1.1310, test_f1: 0.5802
 epoch: 31, train_loss: 0.7447, test_loss: 1.1618, test_f1: 0.5509
 epoch: 32, train_loss: 0.7604, test_loss: 1.1488, test_f1: 0.5713
 epoch: 33, train_loss: 0.7350, test_loss: 1.1456, test_f1: 0.6008
 epoch: 34, train_loss: 0.7368, test_loss: 1.2331, test_f1: 0.5667
 epoch: 35, train_loss: 0.7428, test_loss: 1.2280, test_f1: 0.5537
 epoch: 36, train_loss: 0.7152, test_loss: 1.1876, test_f1: 0.5739
 epoch: 37, train_loss: 0.7025, test_loss: 1.1937, test_f1: 0.5967
 epoch: 38, train_loss: 0.7173, test_loss: 1.1729, test_f1: 0.5799
 epoch: 39, train_loss: 0.7175, test_loss: 1.3315, test_f1: 0.5476
 epoch: 40, train_loss: 0.6867, test_loss: 1.1897, test_f1: 0.5969
 epoch: 41, train_loss: 0.7034, test_loss: 1.2720, test_f1: 0.5810
 epoch: 42, train_loss: 0.6809, test_loss: 1.3785, test_f1: 0.5834
 epoch: 43, train_loss: 0.6850, test_loss: 1.2327, test_f1: 0.5870
 epoch: 44, train_loss: 0.6789, test_loss: 1.4693, test_f1: 0.5803
 epoch: 45, train_loss: 0.6702, test_loss: 1.4186, test_f1: 0.5373
 epoch: 46, train_loss: 0.6658, test_loss: 1.3174, test_f1: 0.5367
 epoch: 47, train_loss: 0.6720, test_loss: 1.2244, test_f1: 0.5826
 epoch: 48, train_loss: 0.6443, test_loss: 1.2689, test_f1: 0.5678
 epoch: 49, train_loss: 0.6353, test_loss: 1.3607, test_f1: 0.5597
 epoch: 50, train_loss: 0.6323, test_loss: 1.4495, test_f1: 0.5725
 epoch: 51, train_loss: 0.6215, test_loss: 1.3381, test_f1: 0.5739
 epoch: 52, train_loss: 0.6030, test_loss: 1.4463, test_f1: 0.5799
 epoch: 53, train_loss: 0.6113, test_loss: 1.3903, test_f1: 0.5661
 epoch: 54, train_loss: 0.5955, test_loss: 1.3749, test_f1: 0.5574
 epoch: 55, train_loss: 0.5968, test_loss: 1.4613, test_f1: 0.5560
 epoch: 56, train_loss: 0.5929, test_loss: 1.5030, test_f1: 0.5660
 epoch: 57, train_loss: 0.5958, test_loss: 1.3856, test_f1: 0.5584
 epoch: 58, train_loss: 0.5894, test_loss: 1.4769, test_f1: 0.5668
 epoch: 59, train_loss: 0.5932, test_loss: 1.4567, test_f1: 0.5441
 epoch: 60, train_loss: 0.5665, test_loss: 1.5082, test_f1: 0.5801
 epoch: 61, train_loss: 0.5831, test_loss: 1.3860, test_f1: 0.5638
 epoch: 62, train_loss: 0.5848, test_loss: 1.4716, test_f1: 0.5624
 epoch: 63, train_loss: 0.5741, test_loss: 1.5297, test_f1: 0.5785
 epoch: 64, train_loss: 0.5930, test_loss: 1.4550, test_f1: 0.5699
 epoch: 65, train_loss: 0.5620, test_loss: 1.5306, test_f1: 0.5545
 epoch: 66, train_loss: 0.5530, test_loss: 1.5517, test_f1: 0.5683
 epoch: 67, train_loss: 0.5483, test_loss: 1.4836, test_f1: 0.5540
 epoch: 68, train_loss: 0.5724, test_loss: 1.5134, test_f1: 0.5476
 epoch: 69, train_loss: 0.5695, test_loss: 1.5315, test_f1: 0.5608
 epoch: 70, train_loss: 0.5621, test_loss: 1.5534, test_f1: 0.5381
 epoch: 71, train_loss: 0.5575, test_loss: 1.5354, test_f1: 0.5550
 epoch: 72, train_loss: 0.5726, test_loss: 1.5187, test_f1: 0.5592
 epoch: 73, train_loss: 0.5550, test_loss: 1.5560, test_f1: 0.5550
 epoch: 74, train_loss: 0.5433, test_loss: 1.6841, test_f1: 0.5445
 epoch: 75, train_loss: 0.5650, test_loss: 1.5366, test_f1: 0.5538
 epoch: 76, train_loss: 0.5567, test_loss: 1.5304, test_f1: 0.5670
 epoch: 77, train_loss: 0.5415, test_loss: 1.7286, test_f1: 0.5549
 epoch: 78, train_loss: 0.5394, test_loss: 1.5997, test_f1: 0.5489
 epoch: 79, train_loss: 0.5325, test_loss: 1.6904, test_f1: 0.5424
 epoch: 80, train_loss: 0.5409, test_loss: 1.5999, test_f1: 0.5563
 epoch: 81, train_loss: 0.5231, test_loss: 1.5452, test_f1: 0.5611
 epoch: 82, train_loss: 0.5377, test_loss: 1.6233, test_f1: 0.5642
 epoch: 83, train_loss: 0.5003, test_loss: 1.7993, test_f1: 0.5659
 epoch: 84, train_loss: 0.5192, test_loss: 1.5971, test_f1: 0.5580
 epoch: 85, train_loss: 0.5174, test_loss: 1.7187, test_f1: 0.5716
 epoch: 86, train_loss: 0.5080, test_loss: 1.6661, test_f1: 0.5706
 epoch: 87, train_loss: 0.5036, test_loss: 1.6730, test_f1: 0.5719
 epoch: 88, train_loss: 0.5048, test_loss: 1.7213, test_f1: 0.5498
 epoch: 89, train_loss: 0.5004, test_loss: 1.7979, test_f1: 0.5522
 epoch: 90, train_loss: 0.5093, test_loss: 2.0327, test_f1: 0.5614
 epoch: 91, train_loss: 0.5086, test_loss: 1.7894, test_f1: 0.5377
 epoch: 92, train_loss: 0.5389, test_loss: 1.9731, test_f1: 0.5653
 epoch: 93, train_loss: 0.4794, test_loss: 1.8923, test_f1: 0.5480
 epoch: 94, train_loss: 0.4904, test_loss: 1.8691, test_f1: 0.5521
 epoch: 95, train_loss: 0.4768, test_loss: 1.8817, test_f1: 0.5635
 epoch: 96, train_loss: 0.4939, test_loss: 1.7836, test_f1: 0.5428
 epoch: 97, train_loss: 0.4855, test_loss: 1.7829, test_f1: 0.5578
 epoch: 98, train_loss: 0.5057, test_loss: 1.8570, test_f1: 0.5685
 epoch: 99, train_loss: 0.4981, test_loss: 2.0055, test_f1: 0.5515
##################ITERATION #7 ****************************************
 epoch: 0, train_loss: 1.3003, test_loss: 1.1807, test_f1: 0.4686
 epoch: 1, train_loss: 1.1250, test_loss: 1.1729, test_f1: 0.5164
 epoch: 2, train_loss: 1.1104, test_loss: 1.1819, test_f1: 0.4973
 epoch: 3, train_loss: 1.0653, test_loss: 1.1579, test_f1: 0.5181
 epoch: 4, train_loss: 1.0434, test_loss: 1.1536, test_f1: 0.5539
 epoch: 5, train_loss: 0.9858, test_loss: 1.1288, test_f1: 0.5572
 epoch: 6, train_loss: 0.9735, test_loss: 1.1285, test_f1: 0.5542
 epoch: 7, train_loss: 0.9643, test_loss: 1.1394, test_f1: 0.5525
 epoch: 8, train_loss: 0.9790, test_loss: 1.1376, test_f1: 0.5606
 epoch: 9, train_loss: 0.9311, test_loss: 1.1381, test_f1: 0.5453
 epoch: 10, train_loss: 0.9137, test_loss: 1.1487, test_f1: 0.5425
 epoch: 11, train_loss: 0.9252, test_loss: 1.1226, test_f1: 0.5479
 epoch: 12, train_loss: 0.9087, test_loss: 1.1134, test_f1: 0.5681
 epoch: 13, train_loss: 0.8907, test_loss: 1.1266, test_f1: 0.5663
 epoch: 14, train_loss: 0.8873, test_loss: 1.1366, test_f1: 0.5745
 epoch: 15, train_loss: 0.8687, test_loss: 1.1313, test_f1: 0.5556
 epoch: 16, train_loss: 0.8749, test_loss: 1.1453, test_f1: 0.5744
 epoch: 17, train_loss: 0.8544, test_loss: 1.1368, test_f1: 0.5742
 epoch: 18, train_loss: 0.8483, test_loss: 1.1459, test_f1: 0.5655
 epoch: 19, train_loss: 0.8401, test_loss: 1.1596, test_f1: 0.5585
 epoch: 20, train_loss: 0.8186, test_loss: 1.1916, test_f1: 0.5667
 epoch: 21, train_loss: 0.8209, test_loss: 1.1940, test_f1: 0.5581
 epoch: 22, train_loss: 0.8104, test_loss: 1.2199, test_f1: 0.5481
 epoch: 23, train_loss: 0.7915, test_loss: 1.1812, test_f1: 0.5736
 epoch: 24, train_loss: 0.8005, test_loss: 1.2362, test_f1: 0.5397
 epoch: 25, train_loss: 0.7988, test_loss: 1.2220, test_f1: 0.5683
 epoch: 26, train_loss: 0.7642, test_loss: 1.1674, test_f1: 0.5817
 epoch: 27, train_loss: 0.7731, test_loss: 1.1844, test_f1: 0.5740
 epoch: 28, train_loss: 0.7616, test_loss: 1.1832, test_f1: 0.5772
 epoch: 29, train_loss: 0.7641, test_loss: 1.2103, test_f1: 0.5504
 epoch: 30, train_loss: 0.7559, test_loss: 1.2581, test_f1: 0.5725
 epoch: 31, train_loss: 0.7257, test_loss: 1.2620, test_f1: 0.5666
 epoch: 32, train_loss: 0.7242, test_loss: 1.2408, test_f1: 0.5695
 epoch: 33, train_loss: 0.7253, test_loss: 1.2835, test_f1: 0.5634
 epoch: 34, train_loss: 0.7243, test_loss: 1.2591, test_f1: 0.5684
 epoch: 35, train_loss: 0.7195, test_loss: 1.2988, test_f1: 0.5900
 epoch: 36, train_loss: 0.7178, test_loss: 1.3350, test_f1: 0.5620
 epoch: 37, train_loss: 0.7010, test_loss: 1.2725, test_f1: 0.5421
 epoch: 38, train_loss: 0.6879, test_loss: 1.4243, test_f1: 0.5397
 epoch: 39, train_loss: 0.6715, test_loss: 1.3164, test_f1: 0.5588
 epoch: 40, train_loss: 0.6767, test_loss: 1.3760, test_f1: 0.5522
 epoch: 41, train_loss: 0.6798, test_loss: 1.3616, test_f1: 0.5637
 epoch: 42, train_loss: 0.6827, test_loss: 1.3889, test_f1: 0.5495
 epoch: 43, train_loss: 0.6507, test_loss: 1.3924, test_f1: 0.5783
 epoch: 44, train_loss: 0.6553, test_loss: 1.5050, test_f1: 0.5713
 epoch: 45, train_loss: 0.6361, test_loss: 1.4161, test_f1: 0.5472
 epoch: 46, train_loss: 0.6320, test_loss: 1.4001, test_f1: 0.5649
 epoch: 47, train_loss: 0.6470, test_loss: 1.4404, test_f1: 0.5349
 epoch: 48, train_loss: 0.6249, test_loss: 1.4889, test_f1: 0.5505
 epoch: 49, train_loss: 0.6304, test_loss: 1.4544, test_f1: 0.5452
 epoch: 50, train_loss: 0.6064, test_loss: 1.5737, test_f1: 0.5381
 epoch: 51, train_loss: 0.6053, test_loss: 1.5419, test_f1: 0.5436
 epoch: 52, train_loss: 0.5974, test_loss: 1.5634, test_f1: 0.5350
 epoch: 53, train_loss: 0.5784, test_loss: 1.5376, test_f1: 0.5714
 epoch: 54, train_loss: 0.6091, test_loss: 1.5738, test_f1: 0.5636
 epoch: 55, train_loss: 0.5732, test_loss: 1.6226, test_f1: 0.5477
 epoch: 56, train_loss: 0.5864, test_loss: 1.6011, test_f1: 0.5387
 epoch: 57, train_loss: 0.5745, test_loss: 1.5948, test_f1: 0.5497
 epoch: 58, train_loss: 0.5869, test_loss: 1.7128, test_f1: 0.5419
 epoch: 59, train_loss: 0.5795, test_loss: 1.7074, test_f1: 0.5602
 epoch: 60, train_loss: 0.5717, test_loss: 1.6174, test_f1: 0.5590
 epoch: 61, train_loss: 0.5743, test_loss: 1.5885, test_f1: 0.5534
 epoch: 62, train_loss: 0.5713, test_loss: 1.6310, test_f1: 0.5528
 epoch: 63, train_loss: 0.5820, test_loss: 1.6860, test_f1: 0.5606
 epoch: 64, train_loss: 0.5704, test_loss: 1.6886, test_f1: 0.5525
 epoch: 65, train_loss: 0.5590, test_loss: 1.6848, test_f1: 0.5523
 epoch: 66, train_loss: 0.5676, test_loss: 1.7504, test_f1: 0.5556
 epoch: 67, train_loss: 0.5355, test_loss: 1.6939, test_f1: 0.5595
 epoch: 68, train_loss: 0.5557, test_loss: 1.6760, test_f1: 0.5605
 epoch: 69, train_loss: 0.5467, test_loss: 1.7300, test_f1: 0.5606
 epoch: 70, train_loss: 0.5637, test_loss: 1.6539, test_f1: 0.5586
 epoch: 71, train_loss: 0.5385, test_loss: 1.7568, test_f1: 0.5597
 epoch: 72, train_loss: 0.5461, test_loss: 1.7102, test_f1: 0.5623
 epoch: 73, train_loss: 0.5283, test_loss: 1.7290, test_f1: 0.5632
 epoch: 74, train_loss: 0.5373, test_loss: 1.7610, test_f1: 0.5818
 epoch: 75, train_loss: 0.5287, test_loss: 1.7647, test_f1: 0.5628
 epoch: 76, train_loss: 0.5551, test_loss: 1.7372, test_f1: 0.5569
 epoch: 77, train_loss: 0.5201, test_loss: 1.8712, test_f1: 0.5609
 epoch: 78, train_loss: 0.5449, test_loss: 1.8741, test_f1: 0.5663
 epoch: 79, train_loss: 0.5288, test_loss: 1.8318, test_f1: 0.5627
 epoch: 80, train_loss: 0.5408, test_loss: 1.8352, test_f1: 0.5686
 epoch: 81, train_loss: 0.5124, test_loss: 1.8964, test_f1: 0.5730
 epoch: 82, train_loss: 0.5317, test_loss: 1.7602, test_f1: 0.5648
 epoch: 83, train_loss: 0.5085, test_loss: 1.9572, test_f1: 0.5729
 epoch: 84, train_loss: 0.5277, test_loss: 1.8437, test_f1: 0.5741
 epoch: 85, train_loss: 0.4949, test_loss: 1.8920, test_f1: 0.5718
 epoch: 86, train_loss: 0.4936, test_loss: 1.8366, test_f1: 0.5606
 epoch: 87, train_loss: 0.5108, test_loss: 1.8726, test_f1: 0.5800
 epoch: 88, train_loss: 0.5107, test_loss: 1.8522, test_f1: 0.5823
 epoch: 89, train_loss: 0.5083, test_loss: 1.9959, test_f1: 0.5714
 epoch: 90, train_loss: 0.4984, test_loss: 1.7783, test_f1: 0.5739
 epoch: 91, train_loss: 0.5152, test_loss: 1.9786, test_f1: 0.5792
 epoch: 92, train_loss: 0.5096, test_loss: 1.8323, test_f1: 0.5620
 epoch: 93, train_loss: 0.4961, test_loss: 1.7972, test_f1: 0.5742
 epoch: 94, train_loss: 0.4740, test_loss: 1.8854, test_f1: 0.5580
 epoch: 95, train_loss: 0.4960, test_loss: 1.8848, test_f1: 0.5652
 epoch: 96, train_loss: 0.4884, test_loss: 1.9833, test_f1: 0.5664
 epoch: 97, train_loss: 0.4813, test_loss: 1.8968, test_f1: 0.5658
 epoch: 98, train_loss: 0.4951, test_loss: 1.9641, test_f1: 0.5620
 epoch: 99, train_loss: 0.4914, test_loss: 1.9033, test_f1: 0.5563
##################ITERATION #8 ****************************************
 epoch: 0, train_loss: 1.3410, test_loss: 1.1860, test_f1: 0.4603
 epoch: 1, train_loss: 1.1773, test_loss: 1.2210, test_f1: 0.5142
 epoch: 2, train_loss: 1.1350, test_loss: 1.1632, test_f1: 0.5295
 epoch: 3, train_loss: 1.0998, test_loss: 1.1679, test_f1: 0.5003
 epoch: 4, train_loss: 1.0537, test_loss: 1.1247, test_f1: 0.5097
 epoch: 5, train_loss: 1.0552, test_loss: 1.0939, test_f1: 0.5723
 epoch: 6, train_loss: 1.0379, test_loss: 1.0977, test_f1: 0.5534
 epoch: 7, train_loss: 1.0100, test_loss: 1.1323, test_f1: 0.5630
 epoch: 8, train_loss: 0.9897, test_loss: 1.1093, test_f1: 0.5707
 epoch: 9, train_loss: 0.9872, test_loss: 1.1081, test_f1: 0.5631
 epoch: 10, train_loss: 0.9711, test_loss: 1.0789, test_f1: 0.5769
 epoch: 11, train_loss: 0.9314, test_loss: 1.0937, test_f1: 0.5665
 epoch: 12, train_loss: 0.9354, test_loss: 1.0613, test_f1: 0.5788
 epoch: 13, train_loss: 0.9254, test_loss: 1.0760, test_f1: 0.5741
 epoch: 14, train_loss: 0.8975, test_loss: 1.0589, test_f1: 0.5579
 epoch: 15, train_loss: 0.8980, test_loss: 1.0824, test_f1: 0.5356
 epoch: 16, train_loss: 0.8953, test_loss: 1.0650, test_f1: 0.5618
 epoch: 17, train_loss: 0.8566, test_loss: 1.0841, test_f1: 0.5747
 epoch: 18, train_loss: 0.8759, test_loss: 1.0723, test_f1: 0.5740
 epoch: 19, train_loss: 0.8412, test_loss: 1.0602, test_f1: 0.5662
 epoch: 20, train_loss: 0.8468, test_loss: 1.0740, test_f1: 0.5715
 epoch: 21, train_loss: 0.8447, test_loss: 1.1112, test_f1: 0.5628
 epoch: 22, train_loss: 0.8180, test_loss: 1.0929, test_f1: 0.5632
 epoch: 23, train_loss: 0.8265, test_loss: 1.0804, test_f1: 0.5712
 epoch: 24, train_loss: 0.8197, test_loss: 1.1007, test_f1: 0.5795
 epoch: 25, train_loss: 0.8012, test_loss: 1.1328, test_f1: 0.5580
 epoch: 26, train_loss: 0.7940, test_loss: 1.1149, test_f1: 0.5611
 epoch: 27, train_loss: 0.7937, test_loss: 1.1414, test_f1: 0.5873
 epoch: 28, train_loss: 0.7928, test_loss: 1.1122, test_f1: 0.6265
 epoch: 29, train_loss: 0.7840, test_loss: 1.1555, test_f1: 0.6051
 epoch: 30, train_loss: 0.7544, test_loss: 1.1198, test_f1: 0.6024
 epoch: 31, train_loss: 0.7562, test_loss: 1.1712, test_f1: 0.5431
 epoch: 32, train_loss: 0.7416, test_loss: 1.2358, test_f1: 0.5272
 epoch: 33, train_loss: 0.7466, test_loss: 1.2384, test_f1: 0.5828
 epoch: 34, train_loss: 0.7431, test_loss: 1.2157, test_f1: 0.5885
 epoch: 35, train_loss: 0.7408, test_loss: 1.2108, test_f1: 0.6234
 epoch: 36, train_loss: 0.7172, test_loss: 1.2558, test_f1: 0.5768
 epoch: 37, train_loss: 0.7048, test_loss: 1.2556, test_f1: 0.5814
 epoch: 38, train_loss: 0.7116, test_loss: 1.2684, test_f1: 0.5657
 epoch: 39, train_loss: 0.7127, test_loss: 1.1954, test_f1: 0.5993
 epoch: 40, train_loss: 0.7037, test_loss: 1.2657, test_f1: 0.6090
 epoch: 41, train_loss: 0.6952, test_loss: 1.2505, test_f1: 0.5711
 epoch: 42, train_loss: 0.6997, test_loss: 1.2701, test_f1: 0.5939
 epoch: 43, train_loss: 0.6876, test_loss: 1.3051, test_f1: 0.5612
 epoch: 44, train_loss: 0.6847, test_loss: 1.2848, test_f1: 0.5774
 epoch: 45, train_loss: 0.6764, test_loss: 1.3138, test_f1: 0.5670
 epoch: 46, train_loss: 0.6793, test_loss: 1.3090, test_f1: 0.5726
 epoch: 47, train_loss: 0.6730, test_loss: 1.2667, test_f1: 0.5850
 epoch: 48, train_loss: 0.6617, test_loss: 1.2365, test_f1: 0.6057
 epoch: 49, train_loss: 0.6484, test_loss: 1.2397, test_f1: 0.5550
 epoch: 50, train_loss: 0.6452, test_loss: 1.3469, test_f1: 0.5762
 epoch: 51, train_loss: 0.6451, test_loss: 1.2745, test_f1: 0.5677
 epoch: 52, train_loss: 0.6174, test_loss: 1.3341, test_f1: 0.5720
 epoch: 53, train_loss: 0.6204, test_loss: 1.2765, test_f1: 0.5768
 epoch: 54, train_loss: 0.6222, test_loss: 1.2986, test_f1: 0.5855
 epoch: 55, train_loss: 0.6307, test_loss: 1.3955, test_f1: 0.5648
 epoch: 56, train_loss: 0.6182, test_loss: 1.3474, test_f1: 0.5717
 epoch: 57, train_loss: 0.6021, test_loss: 1.2721, test_f1: 0.5764
 epoch: 58, train_loss: 0.5939, test_loss: 1.3408, test_f1: 0.5582
 epoch: 59, train_loss: 0.5961, test_loss: 1.3760, test_f1: 0.5892
 epoch: 60, train_loss: 0.6083, test_loss: 1.3200, test_f1: 0.5939
 epoch: 61, train_loss: 0.6117, test_loss: 1.4314, test_f1: 0.5679
 epoch: 62, train_loss: 0.5865, test_loss: 1.4022, test_f1: 0.5797
 epoch: 63, train_loss: 0.6160, test_loss: 1.4765, test_f1: 0.5653
 epoch: 64, train_loss: 0.5799, test_loss: 1.4904, test_f1: 0.5671
 epoch: 65, train_loss: 0.5980, test_loss: 1.4188, test_f1: 0.5556
 epoch: 66, train_loss: 0.5897, test_loss: 1.4247, test_f1: 0.5556
 epoch: 67, train_loss: 0.6009, test_loss: 1.4908, test_f1: 0.5659
 epoch: 68, train_loss: 0.5907, test_loss: 1.4291, test_f1: 0.5538
 epoch: 69, train_loss: 0.5792, test_loss: 1.4001, test_f1: 0.5883
 epoch: 70, train_loss: 0.5758, test_loss: 1.4487, test_f1: 0.5701
 epoch: 71, train_loss: 0.5654, test_loss: 1.5406, test_f1: 0.5610
 epoch: 72, train_loss: 0.5574, test_loss: 1.5287, test_f1: 0.5583
 epoch: 73, train_loss: 0.5485, test_loss: 1.5665, test_f1: 0.5489
 epoch: 74, train_loss: 0.5447, test_loss: 1.4916, test_f1: 0.5834
 epoch: 75, train_loss: 0.5705, test_loss: 1.5148, test_f1: 0.5450
 epoch: 76, train_loss: 0.5490, test_loss: 1.6409, test_f1: 0.5722
 epoch: 77, train_loss: 0.5323, test_loss: 1.5592, test_f1: 0.5704
 epoch: 78, train_loss: 0.5595, test_loss: 1.5309, test_f1: 0.5792
 epoch: 79, train_loss: 0.5556, test_loss: 1.5310, test_f1: 0.5565
 epoch: 80, train_loss: 0.5264, test_loss: 1.6208, test_f1: 0.5632
 epoch: 81, train_loss: 0.5352, test_loss: 1.5908, test_f1: 0.5762
 epoch: 82, train_loss: 0.5540, test_loss: 1.5555, test_f1: 0.5671
 epoch: 83, train_loss: 0.5489, test_loss: 1.6121, test_f1: 0.5481
 epoch: 84, train_loss: 0.5406, test_loss: 1.5965, test_f1: 0.5850
 epoch: 85, train_loss: 0.5381, test_loss: 1.5974, test_f1: 0.5689
 epoch: 86, train_loss: 0.5411, test_loss: 1.5843, test_f1: 0.5793
 epoch: 87, train_loss: 0.5335, test_loss: 1.6071, test_f1: 0.5880
 epoch: 88, train_loss: 0.5342, test_loss: 1.7270, test_f1: 0.5537
 epoch: 89, train_loss: 0.5337, test_loss: 1.6203, test_f1: 0.5670
 epoch: 90, train_loss: 0.5325, test_loss: 1.6997, test_f1: 0.5616
 epoch: 91, train_loss: 0.5201, test_loss: 1.6325, test_f1: 0.5630
 epoch: 92, train_loss: 0.5369, test_loss: 1.6640, test_f1: 0.5437
 epoch: 93, train_loss: 0.5260, test_loss: 1.6252, test_f1: 0.5927
 epoch: 94, train_loss: 0.5084, test_loss: 1.5591, test_f1: 0.5943
 epoch: 95, train_loss: 0.5260, test_loss: 1.6572, test_f1: 0.5652
 epoch: 96, train_loss: 0.5115, test_loss: 1.6781, test_f1: 0.5812
 epoch: 97, train_loss: 0.4863, test_loss: 1.7065, test_f1: 0.5466
 epoch: 98, train_loss: 0.5125, test_loss: 1.7250, test_f1: 0.5552
 epoch: 99, train_loss: 0.5131, test_loss: 1.6937, test_f1: 0.5609
##################ITERATION #9 ****************************************
 epoch: 0, train_loss: 1.3813, test_loss: 1.2937, test_f1: 0.5134
 epoch: 1, train_loss: 1.2246, test_loss: 1.2925, test_f1: 0.4757
 epoch: 2, train_loss: 1.1604, test_loss: 1.2856, test_f1: 0.5260
 epoch: 3, train_loss: 1.1111, test_loss: 1.2799, test_f1: 0.5273
 epoch: 4, train_loss: 1.0806, test_loss: 1.2555, test_f1: 0.5427
 epoch: 5, train_loss: 1.0334, test_loss: 1.2248, test_f1: 0.5162
 epoch: 6, train_loss: 1.0378, test_loss: 1.2265, test_f1: 0.5457
 epoch: 7, train_loss: 1.0386, test_loss: 1.2342, test_f1: 0.5230
 epoch: 8, train_loss: 1.0100, test_loss: 1.1677, test_f1: 0.5727
 epoch: 9, train_loss: 0.9777, test_loss: 1.1725, test_f1: 0.5401
 epoch: 10, train_loss: 0.9657, test_loss: 1.1705, test_f1: 0.5571
 epoch: 11, train_loss: 0.9421, test_loss: 1.1996, test_f1: 0.5560
 epoch: 12, train_loss: 0.9415, test_loss: 1.1464, test_f1: 0.5549
 epoch: 13, train_loss: 0.9228, test_loss: 1.1652, test_f1: 0.5646
 epoch: 14, train_loss: 0.9236, test_loss: 1.2152, test_f1: 0.5431
 epoch: 15, train_loss: 0.9223, test_loss: 1.2768, test_f1: 0.5393
 epoch: 16, train_loss: 0.8901, test_loss: 1.2219, test_f1: 0.5299
 epoch: 17, train_loss: 0.8935, test_loss: 1.1903, test_f1: 0.5549
 epoch: 18, train_loss: 0.8692, test_loss: 1.2484, test_f1: 0.5511
 epoch: 19, train_loss: 0.8576, test_loss: 1.1909, test_f1: 0.5669
 epoch: 20, train_loss: 0.8427, test_loss: 1.2058, test_f1: 0.5775
 epoch: 21, train_loss: 0.8244, test_loss: 1.2679, test_f1: 0.5664
 epoch: 22, train_loss: 0.8275, test_loss: 1.2353, test_f1: 0.5977
 epoch: 23, train_loss: 0.8139, test_loss: 1.2420, test_f1: 0.5750
 epoch: 24, train_loss: 0.8017, test_loss: 1.1631, test_f1: 0.5972
 epoch: 25, train_loss: 0.8129, test_loss: 1.1909, test_f1: 0.5790
 epoch: 26, train_loss: 0.8018, test_loss: 1.1972, test_f1: 0.6088
 epoch: 27, train_loss: 0.8046, test_loss: 1.1895, test_f1: 0.5926
 epoch: 28, train_loss: 0.7878, test_loss: 1.2565, test_f1: 0.5855
 epoch: 29, train_loss: 0.8043, test_loss: 1.2415, test_f1: 0.5699
 epoch: 30, train_loss: 0.7564, test_loss: 1.1878, test_f1: 0.6070
 epoch: 31, train_loss: 0.7667, test_loss: 1.2488, test_f1: 0.6067
 epoch: 32, train_loss: 0.7510, test_loss: 1.2134, test_f1: 0.5875
 epoch: 33, train_loss: 0.7407, test_loss: 1.2450, test_f1: 0.5747
 epoch: 34, train_loss: 0.7413, test_loss: 1.2178, test_f1: 0.5905
 epoch: 35, train_loss: 0.7473, test_loss: 1.2893, test_f1: 0.5399
 epoch: 36, train_loss: 0.7285, test_loss: 1.2403, test_f1: 0.6030
 epoch: 37, train_loss: 0.7135, test_loss: 1.2384, test_f1: 0.5691
 epoch: 38, train_loss: 0.7002, test_loss: 1.2289, test_f1: 0.5847
 epoch: 39, train_loss: 0.7109, test_loss: 1.2484, test_f1: 0.6025
 epoch: 40, train_loss: 0.7018, test_loss: 1.2926, test_f1: 0.5830
 epoch: 41, train_loss: 0.6835, test_loss: 1.3619, test_f1: 0.5641
 epoch: 42, train_loss: 0.6986, test_loss: 1.4650, test_f1: 0.5668
 epoch: 43, train_loss: 0.6630, test_loss: 1.3580, test_f1: 0.5952
 epoch: 44, train_loss: 0.6725, test_loss: 1.3382, test_f1: 0.5865
 epoch: 45, train_loss: 0.6590, test_loss: 1.2906, test_f1: 0.5588
 epoch: 46, train_loss: 0.6829, test_loss: 1.4574, test_f1: 0.5743
 epoch: 47, train_loss: 0.6497, test_loss: 1.3918, test_f1: 0.5931
 epoch: 48, train_loss: 0.6597, test_loss: 1.3145, test_f1: 0.5985
 epoch: 49, train_loss: 0.6358, test_loss: 1.3840, test_f1: 0.5906
 epoch: 50, train_loss: 0.6190, test_loss: 1.3666, test_f1: 0.5865
 epoch: 51, train_loss: 0.6171, test_loss: 1.4282, test_f1: 0.5882
 epoch: 52, train_loss: 0.6335, test_loss: 1.3925, test_f1: 0.5964
 epoch: 53, train_loss: 0.5976, test_loss: 1.3360, test_f1: 0.6050
 epoch: 54, train_loss: 0.5872, test_loss: 1.4586, test_f1: 0.5876
 epoch: 55, train_loss: 0.6048, test_loss: 1.4194, test_f1: 0.5963
 epoch: 56, train_loss: 0.6029, test_loss: 1.4480, test_f1: 0.5879
 epoch: 57, train_loss: 0.6051, test_loss: 1.5525, test_f1: 0.5933
 epoch: 58, train_loss: 0.5955, test_loss: 1.5249, test_f1: 0.6067
 epoch: 59, train_loss: 0.5694, test_loss: 1.5705, test_f1: 0.5908
 epoch: 60, train_loss: 0.5797, test_loss: 1.6123, test_f1: 0.5595
 epoch: 61, train_loss: 0.5781, test_loss: 1.5053, test_f1: 0.5896
 epoch: 62, train_loss: 0.5830, test_loss: 1.5566, test_f1: 0.5706
 epoch: 63, train_loss: 0.5804, test_loss: 1.4650, test_f1: 0.5968
 epoch: 64, train_loss: 0.5804, test_loss: 1.5214, test_f1: 0.5644
 epoch: 65, train_loss: 0.5930, test_loss: 1.5223, test_f1: 0.5859
 epoch: 66, train_loss: 0.5631, test_loss: 1.6015, test_f1: 0.5769
 epoch: 67, train_loss: 0.5673, test_loss: 1.4618, test_f1: 0.5952
 epoch: 68, train_loss: 0.5531, test_loss: 1.6200, test_f1: 0.5861
 epoch: 69, train_loss: 0.5616, test_loss: 1.5191, test_f1: 0.5659
 epoch: 70, train_loss: 0.5602, test_loss: 1.5434, test_f1: 0.5768
 epoch: 71, train_loss: 0.5645, test_loss: 1.5648, test_f1: 0.5747
 epoch: 72, train_loss: 0.5558, test_loss: 1.5720, test_f1: 0.5780
 epoch: 73, train_loss: 0.5414, test_loss: 1.5880, test_f1: 0.5722
 epoch: 74, train_loss: 0.5620, test_loss: 1.6532, test_f1: 0.5806
 epoch: 75, train_loss: 0.5487, test_loss: 1.5498, test_f1: 0.5809
 epoch: 76, train_loss: 0.5530, test_loss: 1.5822, test_f1: 0.5767
 epoch: 77, train_loss: 0.5458, test_loss: 1.6367, test_f1: 0.5800
 epoch: 78, train_loss: 0.5218, test_loss: 1.5644, test_f1: 0.5797
 epoch: 79, train_loss: 0.5288, test_loss: 1.6816, test_f1: 0.5827
 epoch: 80, train_loss: 0.5408, test_loss: 1.5621, test_f1: 0.5797
 epoch: 81, train_loss: 0.5331, test_loss: 1.6502, test_f1: 0.5870
 epoch: 82, train_loss: 0.5322, test_loss: 1.6992, test_f1: 0.5767
 epoch: 83, train_loss: 0.5525, test_loss: 1.6044, test_f1: 0.5916
 epoch: 84, train_loss: 0.5432, test_loss: 1.6369, test_f1: 0.5836
 epoch: 85, train_loss: 0.5091, test_loss: 1.5938, test_f1: 0.5698
 epoch: 86, train_loss: 0.5279, test_loss: 1.6139, test_f1: 0.5753
 epoch: 87, train_loss: 0.5153, test_loss: 1.6274, test_f1: 0.5683
 epoch: 88, train_loss: 0.5198, test_loss: 1.6277, test_f1: 0.5788
 epoch: 89, train_loss: 0.5231, test_loss: 1.6301, test_f1: 0.5828
 epoch: 90, train_loss: 0.5160, test_loss: 1.6700, test_f1: 0.5663
 epoch: 91, train_loss: 0.5199, test_loss: 1.6140, test_f1: 0.5751
 epoch: 92, train_loss: 0.4964, test_loss: 1.7059, test_f1: 0.5861
 epoch: 93, train_loss: 0.4906, test_loss: 1.8244, test_f1: 0.6039
 epoch: 94, train_loss: 0.5047, test_loss: 1.7551, test_f1: 0.5784
 epoch: 95, train_loss: 0.4866, test_loss: 1.7242, test_f1: 0.5732
 epoch: 96, train_loss: 0.4896, test_loss: 1.6865, test_f1: 0.5902
 epoch: 97, train_loss: 0.5100, test_loss: 1.6545, test_f1: 0.5764
 epoch: 98, train_loss: 0.4891, test_loss: 1.5996, test_f1: 0.6017
 epoch: 99, train_loss: 0.4895, test_loss: 1.6764, test_f1: 0.5842

Training completed in 502.24 seconds
Best F1: 0.6640 at epoch 28
Mean F1 across iterations: 0.6187  0.0209
========================FINAL RESULTS================================
FEGIN weighted F1: 0.6640  0.0209
python main.py --data ltspice_demos --representation component_component --model FEGIN --layers 2 --hiddens 128 --batch_size 32 --lr 0.0001 --emb_size 250 --epochs 100 --save_appendix component_component_L2_H128_BS32_LR0.0001_E250 --no_val
-----



STDERR:
  File "main.py", line 370, in <module>
    main()
  File "main.py", line 254, in main
    dataset = dataset_class(
  File "/home/philip/projects/ltspice_examples_code_repo/Circuit-Completion-Using-GNNs/component_classification_with_link_prediction_head/evaluation/FEGIN/kernel/circuit_datasets.py", line 15, in __init__
    self.data, self.slices = torch.load(self.processed_paths[0])
  File "/home/philip/.local/lib/python3.8/site-packages/torch/serialization.py", line 1040, in load
    warnings.warn(
  File "/usr/lib/python3.8/warnings.py", line 109, in _showwarnmsg
    sw(msg.message, msg.category, msg.filename, msg.lineno,
  File "main.py", line 47, in warn_with_traceback
    traceback.print_stack(file=log)
/home/philip/projects/ltspice_examples_code_repo/Circuit-Completion-Using-GNNs/component_classification_with_link_prediction_head/evaluation/FEGIN/kernel/circuit_datasets.py:15: FutureWarning: You are using `torch.load` with `weights_only=False` (the current default value), which uses the default pickle module implicitly. It is possible to construct malicious pickle data which will execute arbitrary code during unpickling (See https://github.com/pytorch/pytorch/blob/main/SECURITY.md#untrusted-models for more details). In a future release, the default value for `weights_only` will be flipped to `True`. This limits the functions that could be executed during unpickling. Arbitrary objects will no longer be allowed to be loaded via this mode unless they are explicitly allowlisted by the user via `torch.serialization.add_safe_globals`. We recommend you start setting `weights_only=True` for any use case where you don't have full control of the loaded file. Please open an issue on GitHub for any issues related to this experimental feature.
  self.data, self.slices = torch.load(self.processed_paths[0])
