STDOUT:
Results will be saved in /home/philip/projects/llm_inference_code_repo/Circuit-Completion-Using-GNNs/component_classification_with_link_prediction_head/evaluation/FEGIN/results/model_FEGIN_dataset_ltspice_examples
Command line input: python main.py --data ltspice_examples --representation component_net --model FEGIN --layers 3 --hiddens 32 --batch_size 64 --lr 0.001 --emb_size 128 --epochs 100 --save_appendix component_net_L3_H32_BS64_LR0.001_E128 --no_val
 is saved.
-----
ltspice_examples - FEGIN
Using 3 layers, 32 hidden units, h = 2
Loading component_net representation dataset
ENTERED
Training FEGIN on component_net representation
Train: 3558, Test: 846
##################ITERATION #0 ****************************************
 epoch: 0, train_loss: 1.3113, test_loss: 1.2582, test_f1: 0.2270
 epoch: 1, train_loss: 1.2208, test_loss: 1.1994, test_f1: 0.2673
 epoch: 2, train_loss: 1.1913, test_loss: 1.1468, test_f1: 0.3503
 epoch: 3, train_loss: 1.1417, test_loss: 1.0573, test_f1: 0.4887
 epoch: 4, train_loss: 1.0720, test_loss: 0.9950, test_f1: 0.4964
 epoch: 5, train_loss: 1.0016, test_loss: 0.9560, test_f1: 0.4848
 epoch: 6, train_loss: 0.9883, test_loss: 0.9805, test_f1: 0.4860
 epoch: 7, train_loss: 0.9695, test_loss: 1.0084, test_f1: 0.4715
 epoch: 8, train_loss: 0.9553, test_loss: 0.9166, test_f1: 0.4988
 epoch: 9, train_loss: 0.9426, test_loss: 0.9345, test_f1: 0.5041
 epoch: 10, train_loss: 0.9400, test_loss: 0.9277, test_f1: 0.5404
 epoch: 11, train_loss: 0.9278, test_loss: 0.9058, test_f1: 0.5448
 epoch: 12, train_loss: 0.9050, test_loss: 0.9136, test_f1: 0.5372
 epoch: 13, train_loss: 0.9097, test_loss: 0.9031, test_f1: 0.5370
 epoch: 14, train_loss: 0.9000, test_loss: 0.9053, test_f1: 0.5131
 epoch: 15, train_loss: 0.8943, test_loss: 0.9397, test_f1: 0.5396
 epoch: 16, train_loss: 0.8848, test_loss: 0.9208, test_f1: 0.5499
 epoch: 17, train_loss: 0.8667, test_loss: 0.9574, test_f1: 0.5179
 epoch: 18, train_loss: 0.8622, test_loss: 0.9602, test_f1: 0.5140
 epoch: 19, train_loss: 0.8629, test_loss: 0.9631, test_f1: 0.5496
 epoch: 20, train_loss: 0.8511, test_loss: 0.9655, test_f1: 0.5641
 epoch: 21, train_loss: 0.8516, test_loss: 0.9177, test_f1: 0.5480
 epoch: 22, train_loss: 0.8471, test_loss: 0.8717, test_f1: 0.5815
 epoch: 23, train_loss: 0.8378, test_loss: 0.8903, test_f1: 0.5728
 epoch: 24, train_loss: 0.8501, test_loss: 0.9234, test_f1: 0.5497
 epoch: 25, train_loss: 0.8233, test_loss: 0.8900, test_f1: 0.5596
 epoch: 26, train_loss: 0.8183, test_loss: 0.8869, test_f1: 0.5595
 epoch: 27, train_loss: 0.8271, test_loss: 0.9495, test_f1: 0.5638
 epoch: 28, train_loss: 0.8109, test_loss: 0.9025, test_f1: 0.5963
 epoch: 29, train_loss: 0.8044, test_loss: 0.9440, test_f1: 0.5688
 epoch: 30, train_loss: 0.8026, test_loss: 0.8827, test_f1: 0.5886
 epoch: 31, train_loss: 0.8022, test_loss: 0.9295, test_f1: 0.6122
 epoch: 32, train_loss: 0.7978, test_loss: 0.9616, test_f1: 0.5626
 epoch: 33, train_loss: 0.7773, test_loss: 0.9166, test_f1: 0.6101
 epoch: 34, train_loss: 0.7755, test_loss: 0.8744, test_f1: 0.5735
 epoch: 35, train_loss: 0.7692, test_loss: 0.9228, test_f1: 0.6062
 epoch: 36, train_loss: 0.7703, test_loss: 0.9009, test_f1: 0.5793
 epoch: 37, train_loss: 0.7694, test_loss: 0.9038, test_f1: 0.6154
 epoch: 38, train_loss: 0.7625, test_loss: 0.9062, test_f1: 0.5971
 epoch: 39, train_loss: 0.7525, test_loss: 0.9126, test_f1: 0.5877
 epoch: 40, train_loss: 0.7643, test_loss: 0.8840, test_f1: 0.6163
 epoch: 41, train_loss: 0.7510, test_loss: 0.9156, test_f1: 0.6075
 epoch: 42, train_loss: 0.7460, test_loss: 0.9430, test_f1: 0.5957
 epoch: 43, train_loss: 0.7450, test_loss: 0.9071, test_f1: 0.6241
 epoch: 44, train_loss: 0.7375, test_loss: 0.8995, test_f1: 0.6080
 epoch: 45, train_loss: 0.7342, test_loss: 0.8802, test_f1: 0.6171
 epoch: 46, train_loss: 0.7223, test_loss: 0.9334, test_f1: 0.6076
 epoch: 47, train_loss: 0.7431, test_loss: 0.9071, test_f1: 0.5873
 epoch: 48, train_loss: 0.7234, test_loss: 0.8979, test_f1: 0.6544
 epoch: 49, train_loss: 0.7199, test_loss: 0.9589, test_f1: 0.6145
 epoch: 50, train_loss: 0.7189, test_loss: 0.9125, test_f1: 0.6208
 epoch: 51, train_loss: 0.6984, test_loss: 0.8725, test_f1: 0.6668
 epoch: 52, train_loss: 0.6901, test_loss: 0.8726, test_f1: 0.6686
 epoch: 53, train_loss: 0.6903, test_loss: 0.8674, test_f1: 0.6478
 epoch: 54, train_loss: 0.6846, test_loss: 0.8910, test_f1: 0.6411
 epoch: 55, train_loss: 0.6713, test_loss: 0.8959, test_f1: 0.6418
 epoch: 56, train_loss: 0.6786, test_loss: 0.8777, test_f1: 0.6310
 epoch: 57, train_loss: 0.6699, test_loss: 0.8677, test_f1: 0.6608
 epoch: 58, train_loss: 0.6690, test_loss: 0.8960, test_f1: 0.6268
 epoch: 59, train_loss: 0.6697, test_loss: 0.8740, test_f1: 0.6536
 epoch: 60, train_loss: 0.6669, test_loss: 0.8928, test_f1: 0.6420
 epoch: 61, train_loss: 0.6757, test_loss: 0.8754, test_f1: 0.6456
 epoch: 62, train_loss: 0.6599, test_loss: 0.8777, test_f1: 0.6543
 epoch: 63, train_loss: 0.6533, test_loss: 0.9130, test_f1: 0.6274
 epoch: 64, train_loss: 0.6656, test_loss: 0.8957, test_f1: 0.6377
 epoch: 65, train_loss: 0.6666, test_loss: 0.9025, test_f1: 0.6521
 epoch: 66, train_loss: 0.6447, test_loss: 0.9144, test_f1: 0.6467
 epoch: 67, train_loss: 0.6375, test_loss: 0.8830, test_f1: 0.6815
 epoch: 68, train_loss: 0.6651, test_loss: 0.9141, test_f1: 0.6515
 epoch: 69, train_loss: 0.6299, test_loss: 0.9117, test_f1: 0.6395
 epoch: 70, train_loss: 0.6407, test_loss: 0.9026, test_f1: 0.6800
 epoch: 71, train_loss: 0.6414, test_loss: 0.8914, test_f1: 0.6500
 epoch: 72, train_loss: 0.6288, test_loss: 0.9099, test_f1: 0.6516
 epoch: 73, train_loss: 0.6368, test_loss: 0.8933, test_f1: 0.6802
 epoch: 74, train_loss: 0.6335, test_loss: 0.8826, test_f1: 0.6611
 epoch: 75, train_loss: 0.6183, test_loss: 0.8992, test_f1: 0.6488
 epoch: 76, train_loss: 0.6339, test_loss: 0.9199, test_f1: 0.6350
 epoch: 77, train_loss: 0.6244, test_loss: 0.8969, test_f1: 0.6400
 epoch: 78, train_loss: 0.6196, test_loss: 0.9013, test_f1: 0.6736
 epoch: 79, train_loss: 0.6116, test_loss: 0.9109, test_f1: 0.6563
 epoch: 80, train_loss: 0.5987, test_loss: 0.9031, test_f1: 0.6428
 epoch: 81, train_loss: 0.6227, test_loss: 0.9194, test_f1: 0.6403
 epoch: 82, train_loss: 0.6202, test_loss: 0.9008, test_f1: 0.6442
 epoch: 83, train_loss: 0.6217, test_loss: 0.9056, test_f1: 0.6605
 epoch: 84, train_loss: 0.6052, test_loss: 0.8884, test_f1: 0.6395
 epoch: 85, train_loss: 0.6126, test_loss: 0.9223, test_f1: 0.6594
 epoch: 86, train_loss: 0.6077, test_loss: 0.9066, test_f1: 0.6692
 epoch: 87, train_loss: 0.5980, test_loss: 0.9208, test_f1: 0.6578
 epoch: 88, train_loss: 0.5953, test_loss: 0.8983, test_f1: 0.6680
 epoch: 89, train_loss: 0.5933, test_loss: 0.9225, test_f1: 0.6643
 epoch: 90, train_loss: 0.5938, test_loss: 0.8988, test_f1: 0.6932
 epoch: 91, train_loss: 0.6019, test_loss: 0.9056, test_f1: 0.6691
 epoch: 92, train_loss: 0.5936, test_loss: 0.9198, test_f1: 0.6472
 epoch: 93, train_loss: 0.5896, test_loss: 0.9139, test_f1: 0.6412
 epoch: 94, train_loss: 0.5978, test_loss: 0.9466, test_f1: 0.6496
 epoch: 95, train_loss: 0.5827, test_loss: 0.9315, test_f1: 0.6435
 epoch: 96, train_loss: 0.5997, test_loss: 0.9197, test_f1: 0.6742
 epoch: 97, train_loss: 0.5919, test_loss: 0.9543, test_f1: 0.6562
 epoch: 98, train_loss: 0.5868, test_loss: 0.9414, test_f1: 0.6454
 epoch: 99, train_loss: 0.5792, test_loss: 0.9323, test_f1: 0.6338
##################ITERATION #1 ****************************************
 epoch: 0, train_loss: 1.2111, test_loss: 1.1267, test_f1: 0.4047
 epoch: 1, train_loss: 1.0769, test_loss: 0.9941, test_f1: 0.4612
 epoch: 2, train_loss: 1.0171, test_loss: 1.0049, test_f1: 0.4666
 epoch: 3, train_loss: 0.9855, test_loss: 0.9403, test_f1: 0.5035
 epoch: 4, train_loss: 0.9626, test_loss: 0.9394, test_f1: 0.4845
 epoch: 5, train_loss: 0.9409, test_loss: 0.9342, test_f1: 0.4966
 epoch: 6, train_loss: 0.9269, test_loss: 0.9384, test_f1: 0.4888
 epoch: 7, train_loss: 0.9107, test_loss: 0.9094, test_f1: 0.5117
 epoch: 8, train_loss: 0.9011, test_loss: 0.9449, test_f1: 0.5214
 epoch: 9, train_loss: 0.8936, test_loss: 0.9376, test_f1: 0.5175
 epoch: 10, train_loss: 0.8858, test_loss: 0.9214, test_f1: 0.5187
 epoch: 11, train_loss: 0.8727, test_loss: 0.9493, test_f1: 0.5074
 epoch: 12, train_loss: 0.8666, test_loss: 0.9537, test_f1: 0.5258
 epoch: 13, train_loss: 0.8647, test_loss: 0.9058, test_f1: 0.5498
 epoch: 14, train_loss: 0.8523, test_loss: 0.9084, test_f1: 0.5200
 epoch: 15, train_loss: 0.8419, test_loss: 0.9472, test_f1: 0.5387
 epoch: 16, train_loss: 0.8415, test_loss: 0.9295, test_f1: 0.5330
 epoch: 17, train_loss: 0.8184, test_loss: 0.9552, test_f1: 0.5375
 epoch: 18, train_loss: 0.8315, test_loss: 0.8969, test_f1: 0.5207
 epoch: 19, train_loss: 0.8123, test_loss: 0.9669, test_f1: 0.5294
 epoch: 20, train_loss: 0.8148, test_loss: 1.0225, test_f1: 0.5585
 epoch: 21, train_loss: 0.8119, test_loss: 0.9214, test_f1: 0.5040
 epoch: 22, train_loss: 0.8103, test_loss: 0.9654, test_f1: 0.5515
 epoch: 23, train_loss: 0.8093, test_loss: 0.9985, test_f1: 0.4960
 epoch: 24, train_loss: 0.7910, test_loss: 0.9853, test_f1: 0.5440
 epoch: 25, train_loss: 0.7834, test_loss: 1.0015, test_f1: 0.5119
 epoch: 26, train_loss: 0.7846, test_loss: 0.9571, test_f1: 0.5725
 epoch: 27, train_loss: 0.7652, test_loss: 0.9824, test_f1: 0.5727
 epoch: 28, train_loss: 0.7684, test_loss: 0.9417, test_f1: 0.5595
 epoch: 29, train_loss: 0.7731, test_loss: 1.0159, test_f1: 0.5049
 epoch: 30, train_loss: 0.7732, test_loss: 0.9510, test_f1: 0.5423
 epoch: 31, train_loss: 0.7520, test_loss: 1.0130, test_f1: 0.5834
 epoch: 32, train_loss: 0.7492, test_loss: 0.9201, test_f1: 0.5972
 epoch: 33, train_loss: 0.7470, test_loss: 0.9412, test_f1: 0.5817
 epoch: 34, train_loss: 0.7544, test_loss: 0.9740, test_f1: 0.5783
 epoch: 35, train_loss: 0.7502, test_loss: 0.9834, test_f1: 0.5630
 epoch: 36, train_loss: 0.7402, test_loss: 0.8726, test_f1: 0.5784
 epoch: 37, train_loss: 0.7300, test_loss: 0.9808, test_f1: 0.5839
 epoch: 38, train_loss: 0.7339, test_loss: 0.9713, test_f1: 0.6038
 epoch: 39, train_loss: 0.7278, test_loss: 0.9746, test_f1: 0.5696
 epoch: 40, train_loss: 0.7095, test_loss: 0.9497, test_f1: 0.5957
 epoch: 41, train_loss: 0.7171, test_loss: 0.9755, test_f1: 0.5741
 epoch: 42, train_loss: 0.7056, test_loss: 1.0149, test_f1: 0.5968
 epoch: 43, train_loss: 0.7069, test_loss: 1.0303, test_f1: 0.5803
 epoch: 44, train_loss: 0.7231, test_loss: 0.9947, test_f1: 0.5960
 epoch: 45, train_loss: 0.7101, test_loss: 0.9739, test_f1: 0.5906
 epoch: 46, train_loss: 0.6995, test_loss: 0.9767, test_f1: 0.5994
 epoch: 47, train_loss: 0.7009, test_loss: 0.9605, test_f1: 0.6227
 epoch: 48, train_loss: 0.6893, test_loss: 1.0570, test_f1: 0.5905
 epoch: 49, train_loss: 0.6872, test_loss: 0.9885, test_f1: 0.6131
 epoch: 50, train_loss: 0.6883, test_loss: 0.9262, test_f1: 0.6158
 epoch: 51, train_loss: 0.6590, test_loss: 0.9894, test_f1: 0.6119
 epoch: 52, train_loss: 0.6556, test_loss: 0.9676, test_f1: 0.6342
 epoch: 53, train_loss: 0.6489, test_loss: 0.9609, test_f1: 0.6431
 epoch: 54, train_loss: 0.6535, test_loss: 0.9703, test_f1: 0.6146
 epoch: 55, train_loss: 0.6410, test_loss: 0.9886, test_f1: 0.6131
 epoch: 56, train_loss: 0.6451, test_loss: 0.9708, test_f1: 0.6178
 epoch: 57, train_loss: 0.6281, test_loss: 0.9735, test_f1: 0.6227
 epoch: 58, train_loss: 0.6398, test_loss: 0.9657, test_f1: 0.6280
 epoch: 59, train_loss: 0.6299, test_loss: 0.9963, test_f1: 0.6199
 epoch: 60, train_loss: 0.6352, test_loss: 0.9583, test_f1: 0.5993
 epoch: 61, train_loss: 0.6268, test_loss: 0.9362, test_f1: 0.6363
 epoch: 62, train_loss: 0.6231, test_loss: 0.9693, test_f1: 0.6042
 epoch: 63, train_loss: 0.6134, test_loss: 0.9580, test_f1: 0.6194
 epoch: 64, train_loss: 0.6143, test_loss: 1.0233, test_f1: 0.6171
 epoch: 65, train_loss: 0.6113, test_loss: 1.0079, test_f1: 0.6187
 epoch: 66, train_loss: 0.6113, test_loss: 0.9806, test_f1: 0.6174
 epoch: 67, train_loss: 0.6110, test_loss: 1.0036, test_f1: 0.6341
 epoch: 68, train_loss: 0.5945, test_loss: 0.9748, test_f1: 0.6207
 epoch: 69, train_loss: 0.6061, test_loss: 0.9876, test_f1: 0.6188
 epoch: 70, train_loss: 0.5972, test_loss: 0.9918, test_f1: 0.6386
 epoch: 71, train_loss: 0.6080, test_loss: 0.9667, test_f1: 0.6346
 epoch: 72, train_loss: 0.5920, test_loss: 0.9968, test_f1: 0.6314
 epoch: 73, train_loss: 0.5904, test_loss: 1.0347, test_f1: 0.6261
 epoch: 74, train_loss: 0.5841, test_loss: 0.9672, test_f1: 0.6424
 epoch: 75, train_loss: 0.5980, test_loss: 0.9991, test_f1: 0.6057
 epoch: 76, train_loss: 0.5884, test_loss: 1.0095, test_f1: 0.6214
 epoch: 77, train_loss: 0.5984, test_loss: 1.0379, test_f1: 0.6339
 epoch: 78, train_loss: 0.5824, test_loss: 0.9860, test_f1: 0.6595
 epoch: 79, train_loss: 0.5820, test_loss: 0.9814, test_f1: 0.6390
 epoch: 80, train_loss: 0.5855, test_loss: 1.0001, test_f1: 0.6462
 epoch: 81, train_loss: 0.5773, test_loss: 1.0442, test_f1: 0.6291
 epoch: 82, train_loss: 0.5731, test_loss: 0.9864, test_f1: 0.6340
 epoch: 83, train_loss: 0.5777, test_loss: 1.0175, test_f1: 0.6611
 epoch: 84, train_loss: 0.5583, test_loss: 1.0168, test_f1: 0.6374
 epoch: 85, train_loss: 0.5869, test_loss: 0.9681, test_f1: 0.6741
 epoch: 86, train_loss: 0.5764, test_loss: 1.0004, test_f1: 0.6423
 epoch: 87, train_loss: 0.5721, test_loss: 1.0988, test_f1: 0.6366
 epoch: 88, train_loss: 0.5730, test_loss: 1.0030, test_f1: 0.6703
 epoch: 89, train_loss: 0.5644, test_loss: 1.0682, test_f1: 0.6266
 epoch: 90, train_loss: 0.5702, test_loss: 1.0092, test_f1: 0.6353
 epoch: 91, train_loss: 0.5545, test_loss: 1.0689, test_f1: 0.6485
 epoch: 92, train_loss: 0.5617, test_loss: 1.0111, test_f1: 0.6418
 epoch: 93, train_loss: 0.5520, test_loss: 0.9791, test_f1: 0.6533
 epoch: 94, train_loss: 0.5650, test_loss: 1.0246, test_f1: 0.6364
 epoch: 95, train_loss: 0.5561, test_loss: 1.0208, test_f1: 0.6428
 epoch: 96, train_loss: 0.5439, test_loss: 1.0074, test_f1: 0.6372
 epoch: 97, train_loss: 0.5456, test_loss: 1.0120, test_f1: 0.6499
 epoch: 98, train_loss: 0.5748, test_loss: 1.0065, test_f1: 0.6592
 epoch: 99, train_loss: 0.5611, test_loss: 1.0376, test_f1: 0.6203
##################ITERATION #2 ****************************************
 epoch: 0, train_loss: 1.2251, test_loss: 1.1602, test_f1: 0.3548
 epoch: 1, train_loss: 1.1227, test_loss: 1.0540, test_f1: 0.4415
 epoch: 2, train_loss: 1.0773, test_loss: 0.9965, test_f1: 0.4717
 epoch: 3, train_loss: 1.0322, test_loss: 0.9699, test_f1: 0.4591
 epoch: 4, train_loss: 0.9984, test_loss: 0.9515, test_f1: 0.4657
 epoch: 5, train_loss: 0.9872, test_loss: 0.9445, test_f1: 0.4538
 epoch: 6, train_loss: 0.9669, test_loss: 0.9296, test_f1: 0.4879
 epoch: 7, train_loss: 0.9605, test_loss: 0.9381, test_f1: 0.4772
 epoch: 8, train_loss: 0.9378, test_loss: 0.9014, test_f1: 0.5090
 epoch: 9, train_loss: 0.9216, test_loss: 0.9260, test_f1: 0.5026
 epoch: 10, train_loss: 0.9139, test_loss: 0.9081, test_f1: 0.4809
 epoch: 11, train_loss: 0.9172, test_loss: 0.9145, test_f1: 0.4981
 epoch: 12, train_loss: 0.9024, test_loss: 0.9347, test_f1: 0.5125
 epoch: 13, train_loss: 0.9043, test_loss: 0.9378, test_f1: 0.4903
 epoch: 14, train_loss: 0.8922, test_loss: 0.9664, test_f1: 0.5000
 epoch: 15, train_loss: 0.8918, test_loss: 0.9139, test_f1: 0.5192
 epoch: 16, train_loss: 0.8840, test_loss: 0.9606, test_f1: 0.4910
 epoch: 17, train_loss: 0.8623, test_loss: 0.9858, test_f1: 0.4988
 epoch: 18, train_loss: 0.8689, test_loss: 0.9525, test_f1: 0.5285
 epoch: 19, train_loss: 0.8629, test_loss: 0.9165, test_f1: 0.5102
 epoch: 20, train_loss: 0.8444, test_loss: 0.9162, test_f1: 0.5253
 epoch: 21, train_loss: 0.8529, test_loss: 0.9815, test_f1: 0.5126
 epoch: 22, train_loss: 0.8385, test_loss: 0.8882, test_f1: 0.5129
 epoch: 23, train_loss: 0.8469, test_loss: 0.9509, test_f1: 0.5410
 epoch: 24, train_loss: 0.8320, test_loss: 0.9836, test_f1: 0.5622
 epoch: 25, train_loss: 0.8276, test_loss: 0.9313, test_f1: 0.5235
 epoch: 26, train_loss: 0.8316, test_loss: 0.9499, test_f1: 0.5333
 epoch: 27, train_loss: 0.8217, test_loss: 0.9286, test_f1: 0.5583
 epoch: 28, train_loss: 0.8092, test_loss: 0.9330, test_f1: 0.5600
 epoch: 29, train_loss: 0.8265, test_loss: 0.8573, test_f1: 0.5276
 epoch: 30, train_loss: 0.8068, test_loss: 1.0266, test_f1: 0.4983
 epoch: 31, train_loss: 0.8118, test_loss: 0.9263, test_f1: 0.5587
 epoch: 32, train_loss: 0.7981, test_loss: 0.9246, test_f1: 0.5731
 epoch: 33, train_loss: 0.7918, test_loss: 1.0585, test_f1: 0.5133
 epoch: 34, train_loss: 0.7953, test_loss: 0.9522, test_f1: 0.5902
 epoch: 35, train_loss: 0.7884, test_loss: 0.9394, test_f1: 0.5273
 epoch: 36, train_loss: 0.7889, test_loss: 0.9309, test_f1: 0.5536
 epoch: 37, train_loss: 0.7761, test_loss: 0.8946, test_f1: 0.6021
 epoch: 38, train_loss: 0.7757, test_loss: 0.9487, test_f1: 0.5639
 epoch: 39, train_loss: 0.7845, test_loss: 0.9636, test_f1: 0.5610
 epoch: 40, train_loss: 0.7649, test_loss: 0.9716, test_f1: 0.5901
 epoch: 41, train_loss: 0.7584, test_loss: 1.0174, test_f1: 0.5101
 epoch: 42, train_loss: 0.7565, test_loss: 0.9782, test_f1: 0.5848
 epoch: 43, train_loss: 0.7653, test_loss: 0.9228, test_f1: 0.5934
 epoch: 44, train_loss: 0.7382, test_loss: 0.9214, test_f1: 0.5791
 epoch: 45, train_loss: 0.7399, test_loss: 0.9219, test_f1: 0.5893
 epoch: 46, train_loss: 0.7380, test_loss: 0.9206, test_f1: 0.6021
 epoch: 47, train_loss: 0.7294, test_loss: 0.9243, test_f1: 0.5800
 epoch: 48, train_loss: 0.7446, test_loss: 0.9553, test_f1: 0.5868
 epoch: 49, train_loss: 0.7415, test_loss: 0.9338, test_f1: 0.5945
 epoch: 50, train_loss: 0.7348, test_loss: 0.8572, test_f1: 0.6162
 epoch: 51, train_loss: 0.7126, test_loss: 0.8806, test_f1: 0.6150
 epoch: 52, train_loss: 0.7010, test_loss: 0.9118, test_f1: 0.6391
 epoch: 53, train_loss: 0.7009, test_loss: 0.9438, test_f1: 0.6289
 epoch: 54, train_loss: 0.6977, test_loss: 0.9105, test_f1: 0.6049
 epoch: 55, train_loss: 0.6917, test_loss: 0.9577, test_f1: 0.5985
 epoch: 56, train_loss: 0.6840, test_loss: 0.9507, test_f1: 0.6300
 epoch: 57, train_loss: 0.6852, test_loss: 0.9197, test_f1: 0.6084
 epoch: 58, train_loss: 0.6765, test_loss: 0.9128, test_f1: 0.6176
 epoch: 59, train_loss: 0.6824, test_loss: 0.9456, test_f1: 0.6319
 epoch: 60, train_loss: 0.6748, test_loss: 0.9707, test_f1: 0.6151
 epoch: 61, train_loss: 0.6672, test_loss: 0.9692, test_f1: 0.6158
 epoch: 62, train_loss: 0.6736, test_loss: 0.9308, test_f1: 0.6347
 epoch: 63, train_loss: 0.6822, test_loss: 0.9394, test_f1: 0.6162
 epoch: 64, train_loss: 0.6830, test_loss: 0.9182, test_f1: 0.6253
 epoch: 65, train_loss: 0.6733, test_loss: 0.9715, test_f1: 0.6028
 epoch: 66, train_loss: 0.6657, test_loss: 0.9184, test_f1: 0.6120
 epoch: 67, train_loss: 0.6682, test_loss: 0.9165, test_f1: 0.6317
 epoch: 68, train_loss: 0.6542, test_loss: 0.9725, test_f1: 0.6016
 epoch: 69, train_loss: 0.6601, test_loss: 0.9340, test_f1: 0.6240
 epoch: 70, train_loss: 0.6675, test_loss: 0.9378, test_f1: 0.6181
 epoch: 71, train_loss: 0.6549, test_loss: 0.9432, test_f1: 0.6284
 epoch: 72, train_loss: 0.6473, test_loss: 0.9204, test_f1: 0.6126
 epoch: 73, train_loss: 0.6516, test_loss: 0.9261, test_f1: 0.6100
 epoch: 74, train_loss: 0.6471, test_loss: 0.9686, test_f1: 0.6170
 epoch: 75, train_loss: 0.6446, test_loss: 0.9325, test_f1: 0.6286
 epoch: 76, train_loss: 0.6441, test_loss: 0.9580, test_f1: 0.6375
 epoch: 77, train_loss: 0.6418, test_loss: 0.9398, test_f1: 0.6092
 epoch: 78, train_loss: 0.6291, test_loss: 0.9498, test_f1: 0.6090
 epoch: 79, train_loss: 0.6411, test_loss: 0.9548, test_f1: 0.6511
 epoch: 80, train_loss: 0.6281, test_loss: 0.9356, test_f1: 0.6370
 epoch: 81, train_loss: 0.6311, test_loss: 0.9153, test_f1: 0.6537
 epoch: 82, train_loss: 0.6213, test_loss: 0.9694, test_f1: 0.6327
 epoch: 83, train_loss: 0.6259, test_loss: 0.9498, test_f1: 0.6296
 epoch: 84, train_loss: 0.6238, test_loss: 0.9294, test_f1: 0.6434
 epoch: 85, train_loss: 0.6346, test_loss: 0.9308, test_f1: 0.6615
 epoch: 86, train_loss: 0.6265, test_loss: 0.9172, test_f1: 0.6467
 epoch: 87, train_loss: 0.6280, test_loss: 0.9373, test_f1: 0.6512
 epoch: 88, train_loss: 0.6167, test_loss: 0.9624, test_f1: 0.6299
 epoch: 89, train_loss: 0.6242, test_loss: 0.9464, test_f1: 0.6491
 epoch: 90, train_loss: 0.6198, test_loss: 0.9192, test_f1: 0.6530
 epoch: 91, train_loss: 0.6176, test_loss: 0.9411, test_f1: 0.6533
 epoch: 92, train_loss: 0.6242, test_loss: 0.9241, test_f1: 0.6545
 epoch: 93, train_loss: 0.6138, test_loss: 0.9537, test_f1: 0.6340
 epoch: 94, train_loss: 0.6065, test_loss: 0.9216, test_f1: 0.6502
 epoch: 95, train_loss: 0.6114, test_loss: 0.9591, test_f1: 0.6336
 epoch: 96, train_loss: 0.5915, test_loss: 0.9458, test_f1: 0.6486
 epoch: 97, train_loss: 0.5977, test_loss: 1.0146, test_f1: 0.6167
 epoch: 98, train_loss: 0.6198, test_loss: 0.9914, test_f1: 0.6067
 epoch: 99, train_loss: 0.6129, test_loss: 0.9832, test_f1: 0.6385
##################ITERATION #3 ****************************************
 epoch: 0, train_loss: 1.2082, test_loss: 1.1252, test_f1: 0.3578
 epoch: 1, train_loss: 1.0520, test_loss: 0.9650, test_f1: 0.4812
 epoch: 2, train_loss: 1.0043, test_loss: 0.9721, test_f1: 0.4706
 epoch: 3, train_loss: 0.9713, test_loss: 0.9617, test_f1: 0.5030
 epoch: 4, train_loss: 0.9477, test_loss: 0.9227, test_f1: 0.5056
 epoch: 5, train_loss: 0.9380, test_loss: 0.9421, test_f1: 0.4943
 epoch: 6, train_loss: 0.9336, test_loss: 0.9120, test_f1: 0.5464
 epoch: 7, train_loss: 0.9113, test_loss: 0.9278, test_f1: 0.5372
 epoch: 8, train_loss: 0.9056, test_loss: 0.9279, test_f1: 0.5179
 epoch: 9, train_loss: 0.9006, test_loss: 0.9098, test_f1: 0.5341
 epoch: 10, train_loss: 0.8799, test_loss: 0.9287, test_f1: 0.5596
 epoch: 11, train_loss: 0.8784, test_loss: 0.9342, test_f1: 0.5336
 epoch: 12, train_loss: 0.8898, test_loss: 0.9359, test_f1: 0.5293
 epoch: 13, train_loss: 0.8639, test_loss: 0.9033, test_f1: 0.5490
 epoch: 14, train_loss: 0.8557, test_loss: 0.9187, test_f1: 0.5401
 epoch: 15, train_loss: 0.8497, test_loss: 0.9768, test_f1: 0.5048
 epoch: 16, train_loss: 0.8492, test_loss: 0.9133, test_f1: 0.5555
 epoch: 17, train_loss: 0.8498, test_loss: 0.9314, test_f1: 0.5368
 epoch: 18, train_loss: 0.8348, test_loss: 0.8878, test_f1: 0.5727
 epoch: 19, train_loss: 0.8362, test_loss: 0.8954, test_f1: 0.5724
 epoch: 20, train_loss: 0.8376, test_loss: 0.9132, test_f1: 0.5878
 epoch: 21, train_loss: 0.8217, test_loss: 0.8956, test_f1: 0.5886
 epoch: 22, train_loss: 0.8350, test_loss: 0.9315, test_f1: 0.5435
 epoch: 23, train_loss: 0.7970, test_loss: 0.8758, test_f1: 0.5855
 epoch: 24, train_loss: 0.8107, test_loss: 0.9001, test_f1: 0.5708
 epoch: 25, train_loss: 0.7974, test_loss: 0.9362, test_f1: 0.5638
 epoch: 26, train_loss: 0.8055, test_loss: 0.8922, test_f1: 0.5894
 epoch: 27, train_loss: 0.8068, test_loss: 0.9460, test_f1: 0.5605
 epoch: 28, train_loss: 0.7851, test_loss: 0.9232, test_f1: 0.5875
 epoch: 29, train_loss: 0.7871, test_loss: 0.9244, test_f1: 0.5891
 epoch: 30, train_loss: 0.7761, test_loss: 0.9332, test_f1: 0.5909
 epoch: 31, train_loss: 0.7815, test_loss: 0.9003, test_f1: 0.5948
 epoch: 32, train_loss: 0.7731, test_loss: 0.9217, test_f1: 0.5944
 epoch: 33, train_loss: 0.7680, test_loss: 0.9086, test_f1: 0.6070
 epoch: 34, train_loss: 0.7654, test_loss: 0.9451, test_f1: 0.5921
 epoch: 35, train_loss: 0.7459, test_loss: 0.9540, test_f1: 0.6075
 epoch: 36, train_loss: 0.7536, test_loss: 0.9134, test_f1: 0.5871
 epoch: 37, train_loss: 0.7591, test_loss: 0.8755, test_f1: 0.6055
 epoch: 38, train_loss: 0.7528, test_loss: 0.9012, test_f1: 0.5921
 epoch: 39, train_loss: 0.7514, test_loss: 0.9186, test_f1: 0.6060
 epoch: 40, train_loss: 0.7507, test_loss: 0.8760, test_f1: 0.6296
 epoch: 41, train_loss: 0.7434, test_loss: 0.9135, test_f1: 0.6160
 epoch: 42, train_loss: 0.7484, test_loss: 0.8803, test_f1: 0.6036
 epoch: 43, train_loss: 0.7394, test_loss: 0.9327, test_f1: 0.5864
 epoch: 44, train_loss: 0.7457, test_loss: 0.9046, test_f1: 0.6038
 epoch: 45, train_loss: 0.7278, test_loss: 0.9316, test_f1: 0.6023
 epoch: 46, train_loss: 0.7123, test_loss: 0.9104, test_f1: 0.6019
 epoch: 47, train_loss: 0.7275, test_loss: 0.9121, test_f1: 0.6226
 epoch: 48, train_loss: 0.7048, test_loss: 0.9125, test_f1: 0.6086
 epoch: 49, train_loss: 0.7336, test_loss: 0.9042, test_f1: 0.6132
 epoch: 50, train_loss: 0.7127, test_loss: 0.9032, test_f1: 0.6212
 epoch: 51, train_loss: 0.7116, test_loss: 0.8878, test_f1: 0.6292
 epoch: 52, train_loss: 0.6885, test_loss: 0.8922, test_f1: 0.6148
 epoch: 53, train_loss: 0.6767, test_loss: 0.8832, test_f1: 0.6421
 epoch: 54, train_loss: 0.6863, test_loss: 0.9301, test_f1: 0.6121
 epoch: 55, train_loss: 0.6926, test_loss: 0.8907, test_f1: 0.6307
 epoch: 56, train_loss: 0.6762, test_loss: 0.9080, test_f1: 0.6347
 epoch: 57, train_loss: 0.6672, test_loss: 0.9380, test_f1: 0.6231
 epoch: 58, train_loss: 0.6743, test_loss: 0.9064, test_f1: 0.6318
 epoch: 59, train_loss: 0.6740, test_loss: 0.9385, test_f1: 0.6101
 epoch: 60, train_loss: 0.6658, test_loss: 0.9276, test_f1: 0.6135
 epoch: 61, train_loss: 0.6575, test_loss: 0.8931, test_f1: 0.6276
 epoch: 62, train_loss: 0.6459, test_loss: 0.8584, test_f1: 0.6639
 epoch: 63, train_loss: 0.6594, test_loss: 0.9127, test_f1: 0.6360
 epoch: 64, train_loss: 0.6445, test_loss: 0.9329, test_f1: 0.6227
 epoch: 65, train_loss: 0.6516, test_loss: 0.9306, test_f1: 0.6251
 epoch: 66, train_loss: 0.6470, test_loss: 0.9122, test_f1: 0.6364
 epoch: 67, train_loss: 0.6418, test_loss: 0.9314, test_f1: 0.6455
 epoch: 68, train_loss: 0.6485, test_loss: 0.8833, test_f1: 0.6386
 epoch: 69, train_loss: 0.6244, test_loss: 0.9670, test_f1: 0.6236
 epoch: 70, train_loss: 0.6507, test_loss: 0.9367, test_f1: 0.6454
 epoch: 71, train_loss: 0.6374, test_loss: 0.9391, test_f1: 0.6452
 epoch: 72, train_loss: 0.6412, test_loss: 0.9027, test_f1: 0.6515
 epoch: 73, train_loss: 0.6415, test_loss: 0.9221, test_f1: 0.6263
 epoch: 74, train_loss: 0.6211, test_loss: 0.9886, test_f1: 0.6296
 epoch: 75, train_loss: 0.6317, test_loss: 0.9038, test_f1: 0.6446
 epoch: 76, train_loss: 0.6446, test_loss: 0.9587, test_f1: 0.6434
 epoch: 77, train_loss: 0.6222, test_loss: 0.9538, test_f1: 0.6421
 epoch: 78, train_loss: 0.6356, test_loss: 0.8978, test_f1: 0.6554
 epoch: 79, train_loss: 0.6201, test_loss: 0.8957, test_f1: 0.6415
 epoch: 80, train_loss: 0.6155, test_loss: 0.9089, test_f1: 0.6293
 epoch: 81, train_loss: 0.6151, test_loss: 0.9681, test_f1: 0.6508
 epoch: 82, train_loss: 0.6282, test_loss: 0.9042, test_f1: 0.6578
 epoch: 83, train_loss: 0.6290, test_loss: 0.9317, test_f1: 0.6303
 epoch: 84, train_loss: 0.6198, test_loss: 0.9146, test_f1: 0.6288
 epoch: 85, train_loss: 0.6134, test_loss: 0.9102, test_f1: 0.6577
 epoch: 86, train_loss: 0.6135, test_loss: 0.9510, test_f1: 0.6298
 epoch: 87, train_loss: 0.6193, test_loss: 1.0207, test_f1: 0.6449
 epoch: 88, train_loss: 0.6162, test_loss: 0.9369, test_f1: 0.6497
 epoch: 89, train_loss: 0.6002, test_loss: 0.9262, test_f1: 0.6849
 epoch: 90, train_loss: 0.6042, test_loss: 0.9689, test_f1: 0.6440
 epoch: 91, train_loss: 0.6023, test_loss: 0.9487, test_f1: 0.6757
 epoch: 92, train_loss: 0.6021, test_loss: 0.9785, test_f1: 0.6618
 epoch: 93, train_loss: 0.5925, test_loss: 0.9891, test_f1: 0.6756
 epoch: 94, train_loss: 0.5901, test_loss: 0.9482, test_f1: 0.6601
 epoch: 95, train_loss: 0.5982, test_loss: 0.9145, test_f1: 0.6674
 epoch: 96, train_loss: 0.6096, test_loss: 0.9335, test_f1: 0.6559
 epoch: 97, train_loss: 0.5976, test_loss: 0.9787, test_f1: 0.6594
 epoch: 98, train_loss: 0.5819, test_loss: 0.9096, test_f1: 0.6467
 epoch: 99, train_loss: 0.5929, test_loss: 0.9147, test_f1: 0.6754
##################ITERATION #4 ****************************************
 epoch: 0, train_loss: 1.2802, test_loss: 1.1724, test_f1: 0.3399
 epoch: 1, train_loss: 1.0907, test_loss: 0.9998, test_f1: 0.4871
 epoch: 2, train_loss: 1.0297, test_loss: 0.9664, test_f1: 0.4705
 epoch: 3, train_loss: 0.9986, test_loss: 0.9502, test_f1: 0.5256
 epoch: 4, train_loss: 0.9578, test_loss: 0.9747, test_f1: 0.4745
 epoch: 5, train_loss: 0.9611, test_loss: 0.9643, test_f1: 0.5205
 epoch: 6, train_loss: 0.9394, test_loss: 0.9526, test_f1: 0.4973
 epoch: 7, train_loss: 0.9357, test_loss: 0.8964, test_f1: 0.5215
 epoch: 8, train_loss: 0.9238, test_loss: 0.9262, test_f1: 0.5385
 epoch: 9, train_loss: 0.9114, test_loss: 0.9311, test_f1: 0.5371
 epoch: 10, train_loss: 0.8896, test_loss: 0.9557, test_f1: 0.5230
 epoch: 11, train_loss: 0.8922, test_loss: 0.9499, test_f1: 0.5418
 epoch: 12, train_loss: 0.8909, test_loss: 0.9700, test_f1: 0.5456
 epoch: 13, train_loss: 0.8777, test_loss: 0.9158, test_f1: 0.5638
 epoch: 14, train_loss: 0.8800, test_loss: 0.9488, test_f1: 0.5647
 epoch: 15, train_loss: 0.8769, test_loss: 0.9348, test_f1: 0.5494
 epoch: 16, train_loss: 0.8549, test_loss: 0.9154, test_f1: 0.5723
 epoch: 17, train_loss: 0.8577, test_loss: 0.9435, test_f1: 0.5506
 epoch: 18, train_loss: 0.8465, test_loss: 0.9369, test_f1: 0.5617
 epoch: 19, train_loss: 0.8494, test_loss: 0.9218, test_f1: 0.5586
 epoch: 20, train_loss: 0.8317, test_loss: 0.9573, test_f1: 0.5646
 epoch: 21, train_loss: 0.8301, test_loss: 0.9418, test_f1: 0.5713
 epoch: 22, train_loss: 0.8397, test_loss: 0.9170, test_f1: 0.5945
 epoch: 23, train_loss: 0.8296, test_loss: 0.9704, test_f1: 0.5749
 epoch: 24, train_loss: 0.8231, test_loss: 0.9552, test_f1: 0.5675
 epoch: 25, train_loss: 0.8127, test_loss: 0.9394, test_f1: 0.5622
 epoch: 26, train_loss: 0.8195, test_loss: 0.9467, test_f1: 0.5762
 epoch: 27, train_loss: 0.8195, test_loss: 0.9445, test_f1: 0.5495
 epoch: 28, train_loss: 0.8171, test_loss: 0.9356, test_f1: 0.5750
 epoch: 29, train_loss: 0.8048, test_loss: 0.9528, test_f1: 0.5594
 epoch: 30, train_loss: 0.8027, test_loss: 0.9620, test_f1: 0.5653
 epoch: 31, train_loss: 0.7874, test_loss: 0.9652, test_f1: 0.5867
 epoch: 32, train_loss: 0.7973, test_loss: 0.9477, test_f1: 0.5663
 epoch: 33, train_loss: 0.7978, test_loss: 0.9423, test_f1: 0.5664
 epoch: 34, train_loss: 0.7899, test_loss: 0.9591, test_f1: 0.5762
 epoch: 35, train_loss: 0.7760, test_loss: 0.9434, test_f1: 0.5982
 epoch: 36, train_loss: 0.7778, test_loss: 0.9592, test_f1: 0.5747
 epoch: 37, train_loss: 0.7845, test_loss: 0.9190, test_f1: 0.5853
 epoch: 38, train_loss: 0.7708, test_loss: 0.9941, test_f1: 0.5812
 epoch: 39, train_loss: 0.7770, test_loss: 0.9286, test_f1: 0.5875
 epoch: 40, train_loss: 0.7638, test_loss: 0.9261, test_f1: 0.5871
 epoch: 41, train_loss: 0.7557, test_loss: 0.9110, test_f1: 0.5842
 epoch: 42, train_loss: 0.7570, test_loss: 0.9159, test_f1: 0.5894
 epoch: 43, train_loss: 0.7652, test_loss: 0.9492, test_f1: 0.5579
 epoch: 44, train_loss: 0.7527, test_loss: 0.9687, test_f1: 0.5947
 epoch: 45, train_loss: 0.7529, test_loss: 1.0507, test_f1: 0.5482
 epoch: 46, train_loss: 0.7664, test_loss: 0.9671, test_f1: 0.5570
 epoch: 47, train_loss: 0.7484, test_loss: 0.9257, test_f1: 0.5898
 epoch: 48, train_loss: 0.7438, test_loss: 0.9375, test_f1: 0.5652
 epoch: 49, train_loss: 0.7600, test_loss: 0.9738, test_f1: 0.5577
 epoch: 50, train_loss: 0.7299, test_loss: 0.9361, test_f1: 0.5555
 epoch: 51, train_loss: 0.7139, test_loss: 0.9170, test_f1: 0.5928
 epoch: 52, train_loss: 0.7127, test_loss: 0.9082, test_f1: 0.6002
 epoch: 53, train_loss: 0.7087, test_loss: 0.9164, test_f1: 0.6049
 epoch: 54, train_loss: 0.7145, test_loss: 0.9367, test_f1: 0.5816
 epoch: 55, train_loss: 0.6994, test_loss: 0.9470, test_f1: 0.5991
 epoch: 56, train_loss: 0.7086, test_loss: 0.9236, test_f1: 0.6137
 epoch: 57, train_loss: 0.6912, test_loss: 0.9276, test_f1: 0.5897
 epoch: 58, train_loss: 0.7011, test_loss: 0.9162, test_f1: 0.5971
 epoch: 59, train_loss: 0.7018, test_loss: 0.9376, test_f1: 0.5909
 epoch: 60, train_loss: 0.6996, test_loss: 0.9230, test_f1: 0.5976
 epoch: 61, train_loss: 0.6969, test_loss: 0.9074, test_f1: 0.5984
 epoch: 62, train_loss: 0.7001, test_loss: 0.9279, test_f1: 0.5910
 epoch: 63, train_loss: 0.6969, test_loss: 0.9236, test_f1: 0.5971
 epoch: 64, train_loss: 0.7028, test_loss: 0.9568, test_f1: 0.5914
 epoch: 65, train_loss: 0.6865, test_loss: 0.9358, test_f1: 0.5969
 epoch: 66, train_loss: 0.6806, test_loss: 0.9519, test_f1: 0.5829
 epoch: 67, train_loss: 0.6775, test_loss: 0.9365, test_f1: 0.6036
 epoch: 68, train_loss: 0.6806, test_loss: 0.9202, test_f1: 0.6000
 epoch: 69, train_loss: 0.6817, test_loss: 0.9320, test_f1: 0.5895
 epoch: 70, train_loss: 0.6748, test_loss: 0.9352, test_f1: 0.5904
 epoch: 71, train_loss: 0.6720, test_loss: 0.9670, test_f1: 0.5989
 epoch: 72, train_loss: 0.6692, test_loss: 0.9607, test_f1: 0.5805
 epoch: 73, train_loss: 0.6785, test_loss: 0.9597, test_f1: 0.5787
 epoch: 74, train_loss: 0.6750, test_loss: 0.9433, test_f1: 0.6143
 epoch: 75, train_loss: 0.6698, test_loss: 0.9761, test_f1: 0.5813
 epoch: 76, train_loss: 0.6576, test_loss: 0.9462, test_f1: 0.6055
 epoch: 77, train_loss: 0.6583, test_loss: 0.9440, test_f1: 0.5839
 epoch: 78, train_loss: 0.6532, test_loss: 0.9710, test_f1: 0.6040
 epoch: 79, train_loss: 0.6580, test_loss: 0.9608, test_f1: 0.5992
 epoch: 80, train_loss: 0.6635, test_loss: 0.9432, test_f1: 0.6106
 epoch: 81, train_loss: 0.6619, test_loss: 0.9210, test_f1: 0.6019
 epoch: 82, train_loss: 0.6619, test_loss: 0.9346, test_f1: 0.6079
 epoch: 83, train_loss: 0.6599, test_loss: 0.9499, test_f1: 0.6013
 epoch: 84, train_loss: 0.6417, test_loss: 0.9513, test_f1: 0.6094
 epoch: 85, train_loss: 0.6442, test_loss: 0.9323, test_f1: 0.5986
 epoch: 86, train_loss: 0.6584, test_loss: 0.9414, test_f1: 0.6108
 epoch: 87, train_loss: 0.6453, test_loss: 0.9254, test_f1: 0.6080
 epoch: 88, train_loss: 0.6569, test_loss: 0.9359, test_f1: 0.6136
 epoch: 89, train_loss: 0.6438, test_loss: 0.9869, test_f1: 0.6168
 epoch: 90, train_loss: 0.6384, test_loss: 0.9520, test_f1: 0.6169
 epoch: 91, train_loss: 0.6463, test_loss: 0.9457, test_f1: 0.6050
 epoch: 92, train_loss: 0.6256, test_loss: 0.9636, test_f1: 0.6057
 epoch: 93, train_loss: 0.6331, test_loss: 0.9700, test_f1: 0.6136
 epoch: 94, train_loss: 0.6415, test_loss: 0.9554, test_f1: 0.6235
 epoch: 95, train_loss: 0.6325, test_loss: 0.9670, test_f1: 0.6052
 epoch: 96, train_loss: 0.6302, test_loss: 0.9678, test_f1: 0.5979
 epoch: 97, train_loss: 0.6342, test_loss: 1.0050, test_f1: 0.6131
 epoch: 98, train_loss: 0.6271, test_loss: 0.9824, test_f1: 0.6111
 epoch: 99, train_loss: 0.6238, test_loss: 0.9956, test_f1: 0.5861
##################ITERATION #5 ****************************************
 epoch: 0, train_loss: 1.2568, test_loss: 1.0752, test_f1: 0.4158
 epoch: 1, train_loss: 1.0893, test_loss: 0.9907, test_f1: 0.4311
 epoch: 2, train_loss: 1.0405, test_loss: 1.0022, test_f1: 0.4731
 epoch: 3, train_loss: 1.0260, test_loss: 0.9932, test_f1: 0.4987
 epoch: 4, train_loss: 0.9841, test_loss: 0.9766, test_f1: 0.4769
 epoch: 5, train_loss: 0.9649, test_loss: 0.9702, test_f1: 0.4814
 epoch: 6, train_loss: 0.9501, test_loss: 0.9652, test_f1: 0.4939
 epoch: 7, train_loss: 0.9563, test_loss: 0.9511, test_f1: 0.4880
 epoch: 8, train_loss: 0.9406, test_loss: 0.9787, test_f1: 0.4867
 epoch: 9, train_loss: 0.9217, test_loss: 0.9527, test_f1: 0.4903
 epoch: 10, train_loss: 0.9108, test_loss: 0.9612, test_f1: 0.4871
 epoch: 11, train_loss: 0.9160, test_loss: 1.0158, test_f1: 0.4695
 epoch: 12, train_loss: 0.9074, test_loss: 0.9307, test_f1: 0.5228
 epoch: 13, train_loss: 0.8942, test_loss: 0.9381, test_f1: 0.5184
 epoch: 14, train_loss: 0.8884, test_loss: 0.9660, test_f1: 0.4926
 epoch: 15, train_loss: 0.9009, test_loss: 0.9324, test_f1: 0.5140
 epoch: 16, train_loss: 0.8623, test_loss: 0.9806, test_f1: 0.4886
 epoch: 17, train_loss: 0.8713, test_loss: 0.8983, test_f1: 0.5134
 epoch: 18, train_loss: 0.8618, test_loss: 0.9363, test_f1: 0.5079
 epoch: 19, train_loss: 0.8585, test_loss: 0.9179, test_f1: 0.5286
 epoch: 20, train_loss: 0.8544, test_loss: 0.9118, test_f1: 0.5215
 epoch: 21, train_loss: 0.8427, test_loss: 0.9240, test_f1: 0.5269
 epoch: 22, train_loss: 0.8449, test_loss: 0.9610, test_f1: 0.5269
 epoch: 23, train_loss: 0.8447, test_loss: 0.9191, test_f1: 0.5452
 epoch: 24, train_loss: 0.8328, test_loss: 0.9268, test_f1: 0.5717
 epoch: 25, train_loss: 0.8283, test_loss: 0.9348, test_f1: 0.5378
 epoch: 26, train_loss: 0.8304, test_loss: 0.9301, test_f1: 0.5369
 epoch: 27, train_loss: 0.8318, test_loss: 0.9485, test_f1: 0.5602
 epoch: 28, train_loss: 0.8327, test_loss: 0.9341, test_f1: 0.5616
 epoch: 29, train_loss: 0.8154, test_loss: 0.9589, test_f1: 0.5056
 epoch: 30, train_loss: 0.8188, test_loss: 0.9080, test_f1: 0.5769
 epoch: 31, train_loss: 0.8092, test_loss: 0.9376, test_f1: 0.5300
 epoch: 32, train_loss: 0.7982, test_loss: 0.9357, test_f1: 0.5345
 epoch: 33, train_loss: 0.7964, test_loss: 1.0663, test_f1: 0.5255
 epoch: 34, train_loss: 0.8165, test_loss: 0.9761, test_f1: 0.5412
 epoch: 35, train_loss: 0.8025, test_loss: 0.9638, test_f1: 0.5318
 epoch: 36, train_loss: 0.7994, test_loss: 0.9457, test_f1: 0.5702
 epoch: 37, train_loss: 0.7972, test_loss: 0.9070, test_f1: 0.5851
 epoch: 38, train_loss: 0.7852, test_loss: 0.9401, test_f1: 0.5383
 epoch: 39, train_loss: 0.7639, test_loss: 0.9180, test_f1: 0.5742
 epoch: 40, train_loss: 0.7706, test_loss: 0.8887, test_f1: 0.5471
 epoch: 41, train_loss: 0.7775, test_loss: 0.9027, test_f1: 0.5998
 epoch: 42, train_loss: 0.7729, test_loss: 0.9555, test_f1: 0.5475
 epoch: 43, train_loss: 0.7590, test_loss: 0.9041, test_f1: 0.5810
 epoch: 44, train_loss: 0.7640, test_loss: 0.9107, test_f1: 0.5850
 epoch: 45, train_loss: 0.7598, test_loss: 0.9046, test_f1: 0.5467
 epoch: 46, train_loss: 0.7429, test_loss: 0.9152, test_f1: 0.5998
 epoch: 47, train_loss: 0.7490, test_loss: 0.9271, test_f1: 0.5769
 epoch: 48, train_loss: 0.7449, test_loss: 0.9351, test_f1: 0.6075
 epoch: 49, train_loss: 0.7477, test_loss: 0.9307, test_f1: 0.5939
 epoch: 50, train_loss: 0.7401, test_loss: 0.9288, test_f1: 0.5798
 epoch: 51, train_loss: 0.7253, test_loss: 0.9250, test_f1: 0.6176
 epoch: 52, train_loss: 0.7155, test_loss: 0.9260, test_f1: 0.5934
 epoch: 53, train_loss: 0.7144, test_loss: 0.9297, test_f1: 0.6311
 epoch: 54, train_loss: 0.7234, test_loss: 0.9090, test_f1: 0.6204
 epoch: 55, train_loss: 0.7105, test_loss: 0.9133, test_f1: 0.6002
 epoch: 56, train_loss: 0.7001, test_loss: 0.9250, test_f1: 0.5994
 epoch: 57, train_loss: 0.6970, test_loss: 0.9064, test_f1: 0.6243
 epoch: 58, train_loss: 0.7034, test_loss: 0.9277, test_f1: 0.5896
 epoch: 59, train_loss: 0.7046, test_loss: 0.9003, test_f1: 0.6378
 epoch: 60, train_loss: 0.7062, test_loss: 0.8943, test_f1: 0.6477
 epoch: 61, train_loss: 0.6821, test_loss: 0.9068, test_f1: 0.6245
 epoch: 62, train_loss: 0.6815, test_loss: 0.9218, test_f1: 0.6258
 epoch: 63, train_loss: 0.6782, test_loss: 0.9378, test_f1: 0.5870
 epoch: 64, train_loss: 0.6837, test_loss: 0.9162, test_f1: 0.6084
 epoch: 65, train_loss: 0.6814, test_loss: 0.9206, test_f1: 0.6204
 epoch: 66, train_loss: 0.6886, test_loss: 0.9268, test_f1: 0.6209
 epoch: 67, train_loss: 0.6743, test_loss: 0.9280, test_f1: 0.6196
 epoch: 68, train_loss: 0.6803, test_loss: 0.9308, test_f1: 0.6211
 epoch: 69, train_loss: 0.6721, test_loss: 0.9246, test_f1: 0.6068
 epoch: 70, train_loss: 0.6902, test_loss: 0.9330, test_f1: 0.6122
 epoch: 71, train_loss: 0.6683, test_loss: 0.9124, test_f1: 0.6332
 epoch: 72, train_loss: 0.6829, test_loss: 0.9107, test_f1: 0.6314
 epoch: 73, train_loss: 0.6727, test_loss: 0.9301, test_f1: 0.6458
 epoch: 74, train_loss: 0.6615, test_loss: 0.9129, test_f1: 0.6206
 epoch: 75, train_loss: 0.6636, test_loss: 0.9331, test_f1: 0.6040
 epoch: 76, train_loss: 0.6677, test_loss: 0.9221, test_f1: 0.6560
 epoch: 77, train_loss: 0.6548, test_loss: 0.9238, test_f1: 0.6336
 epoch: 78, train_loss: 0.6504, test_loss: 0.9109, test_f1: 0.6261
 epoch: 79, train_loss: 0.6633, test_loss: 0.9471, test_f1: 0.6139
 epoch: 80, train_loss: 0.6494, test_loss: 0.9314, test_f1: 0.6107
 epoch: 81, train_loss: 0.6566, test_loss: 0.9259, test_f1: 0.6348
 epoch: 82, train_loss: 0.6538, test_loss: 0.9269, test_f1: 0.6216
 epoch: 83, train_loss: 0.6504, test_loss: 0.9403, test_f1: 0.6158
 epoch: 84, train_loss: 0.6459, test_loss: 0.9645, test_f1: 0.6189
 epoch: 85, train_loss: 0.6470, test_loss: 0.9598, test_f1: 0.6120
 epoch: 86, train_loss: 0.6443, test_loss: 0.9294, test_f1: 0.6561
 epoch: 87, train_loss: 0.6413, test_loss: 0.9756, test_f1: 0.6209
 epoch: 88, train_loss: 0.6470, test_loss: 0.9387, test_f1: 0.6067
 epoch: 89, train_loss: 0.6525, test_loss: 0.9601, test_f1: 0.6303
 epoch: 90, train_loss: 0.6394, test_loss: 0.9480, test_f1: 0.5995
 epoch: 91, train_loss: 0.6244, test_loss: 0.9715, test_f1: 0.6365
 epoch: 92, train_loss: 0.6385, test_loss: 0.9541, test_f1: 0.6502
 epoch: 93, train_loss: 0.6386, test_loss: 0.9420, test_f1: 0.6095
 epoch: 94, train_loss: 0.6352, test_loss: 0.9622, test_f1: 0.6451
 epoch: 95, train_loss: 0.6359, test_loss: 1.0300, test_f1: 0.5983
 epoch: 96, train_loss: 0.6605, test_loss: 0.9260, test_f1: 0.6178
 epoch: 97, train_loss: 0.6314, test_loss: 0.9388, test_f1: 0.6268
 epoch: 98, train_loss: 0.6238, test_loss: 0.9349, test_f1: 0.6207
 epoch: 99, train_loss: 0.6251, test_loss: 0.9495, test_f1: 0.6281
##################ITERATION #6 ****************************************
 epoch: 0, train_loss: 1.2909, test_loss: 1.0876, test_f1: 0.3930
 epoch: 1, train_loss: 1.1024, test_loss: 0.9954, test_f1: 0.4709
 epoch: 2, train_loss: 1.0481, test_loss: 1.0009, test_f1: 0.4611
 epoch: 3, train_loss: 1.0219, test_loss: 0.9935, test_f1: 0.4555
 epoch: 4, train_loss: 0.9992, test_loss: 1.0142, test_f1: 0.4818
 epoch: 5, train_loss: 0.9881, test_loss: 0.9793, test_f1: 0.4817
 epoch: 6, train_loss: 0.9749, test_loss: 0.9446, test_f1: 0.4722
 epoch: 7, train_loss: 0.9625, test_loss: 0.9377, test_f1: 0.4998
 epoch: 8, train_loss: 0.9486, test_loss: 0.9692, test_f1: 0.4813
 epoch: 9, train_loss: 0.9414, test_loss: 0.9884, test_f1: 0.5123
 epoch: 10, train_loss: 0.9334, test_loss: 0.9806, test_f1: 0.4944
 epoch: 11, train_loss: 0.9177, test_loss: 0.9854, test_f1: 0.5111
 epoch: 12, train_loss: 0.9136, test_loss: 0.9777, test_f1: 0.4964
 epoch: 13, train_loss: 0.9098, test_loss: 0.9837, test_f1: 0.4917
 epoch: 14, train_loss: 0.8909, test_loss: 0.9804, test_f1: 0.4988
 epoch: 15, train_loss: 0.8896, test_loss: 0.9932, test_f1: 0.4975
 epoch: 16, train_loss: 0.8871, test_loss: 0.9835, test_f1: 0.5154
 epoch: 17, train_loss: 0.8862, test_loss: 0.9580, test_f1: 0.5119
 epoch: 18, train_loss: 0.8732, test_loss: 0.9865, test_f1: 0.5054
 epoch: 19, train_loss: 0.8668, test_loss: 0.9644, test_f1: 0.5231
 epoch: 20, train_loss: 0.8557, test_loss: 0.9353, test_f1: 0.5725
 epoch: 21, train_loss: 0.8543, test_loss: 0.9629, test_f1: 0.4995
 epoch: 22, train_loss: 0.8460, test_loss: 0.9608, test_f1: 0.5365
 epoch: 23, train_loss: 0.8407, test_loss: 0.9735, test_f1: 0.5493
 epoch: 24, train_loss: 0.8338, test_loss: 0.9445, test_f1: 0.5340
 epoch: 25, train_loss: 0.8347, test_loss: 0.9447, test_f1: 0.5440
 epoch: 26, train_loss: 0.8224, test_loss: 1.0010, test_f1: 0.5292
 epoch: 27, train_loss: 0.8239, test_loss: 0.9959, test_f1: 0.5417
 epoch: 28, train_loss: 0.8215, test_loss: 1.0000, test_f1: 0.5436
 epoch: 29, train_loss: 0.8267, test_loss: 0.9680, test_f1: 0.5561
 epoch: 30, train_loss: 0.8111, test_loss: 0.9234, test_f1: 0.5807
 epoch: 31, train_loss: 0.7906, test_loss: 0.9407, test_f1: 0.5595
 epoch: 32, train_loss: 0.8013, test_loss: 0.9729, test_f1: 0.5748
 epoch: 33, train_loss: 0.7899, test_loss: 0.9445, test_f1: 0.6001
 epoch: 34, train_loss: 0.7856, test_loss: 0.9481, test_f1: 0.6100
 epoch: 35, train_loss: 0.7884, test_loss: 0.9542, test_f1: 0.5963
 epoch: 36, train_loss: 0.7862, test_loss: 0.9520, test_f1: 0.5792
 epoch: 37, train_loss: 0.7810, test_loss: 0.9574, test_f1: 0.5881
 epoch: 38, train_loss: 0.7804, test_loss: 1.0040, test_f1: 0.5579
 epoch: 39, train_loss: 0.7653, test_loss: 1.0126, test_f1: 0.5650
 epoch: 40, train_loss: 0.7593, test_loss: 0.9646, test_f1: 0.5561
 epoch: 41, train_loss: 0.7498, test_loss: 0.9688, test_f1: 0.6066
 epoch: 42, train_loss: 0.7535, test_loss: 0.9803, test_f1: 0.6011
 epoch: 43, train_loss: 0.7452, test_loss: 1.0084, test_f1: 0.5909
 epoch: 44, train_loss: 0.7375, test_loss: 0.9928, test_f1: 0.5763
 epoch: 45, train_loss: 0.7302, test_loss: 0.9787, test_f1: 0.6077
 epoch: 46, train_loss: 0.7262, test_loss: 0.9893, test_f1: 0.5864
 epoch: 47, train_loss: 0.7188, test_loss: 0.9709, test_f1: 0.6075
 epoch: 48, train_loss: 0.7212, test_loss: 0.9977, test_f1: 0.6038
 epoch: 49, train_loss: 0.7205, test_loss: 1.0114, test_f1: 0.5663
 epoch: 50, train_loss: 0.7126, test_loss: 1.0213, test_f1: 0.6042
 epoch: 51, train_loss: 0.6906, test_loss: 1.0085, test_f1: 0.6287
 epoch: 52, train_loss: 0.6809, test_loss: 0.9923, test_f1: 0.5940
 epoch: 53, train_loss: 0.6830, test_loss: 1.0019, test_f1: 0.5854
 epoch: 54, train_loss: 0.6657, test_loss: 1.0285, test_f1: 0.6030
 epoch: 55, train_loss: 0.6619, test_loss: 1.0060, test_f1: 0.6128
 epoch: 56, train_loss: 0.6808, test_loss: 1.0047, test_f1: 0.6312
 epoch: 57, train_loss: 0.6692, test_loss: 1.0260, test_f1: 0.6382
 epoch: 58, train_loss: 0.6555, test_loss: 1.0384, test_f1: 0.6176
 epoch: 59, train_loss: 0.6573, test_loss: 1.0560, test_f1: 0.6183
 epoch: 60, train_loss: 0.6630, test_loss: 1.0471, test_f1: 0.6083
 epoch: 61, train_loss: 0.6518, test_loss: 1.0343, test_f1: 0.6382
 epoch: 62, train_loss: 0.6504, test_loss: 1.0275, test_f1: 0.6368
 epoch: 63, train_loss: 0.6461, test_loss: 1.0247, test_f1: 0.6387
 epoch: 64, train_loss: 0.6461, test_loss: 1.0328, test_f1: 0.6404
 epoch: 65, train_loss: 0.6428, test_loss: 1.0118, test_f1: 0.6467
 epoch: 66, train_loss: 0.6339, test_loss: 1.0648, test_f1: 0.6267
 epoch: 67, train_loss: 0.6514, test_loss: 1.0507, test_f1: 0.6486
 epoch: 68, train_loss: 0.6427, test_loss: 1.0581, test_f1: 0.6428
 epoch: 69, train_loss: 0.6320, test_loss: 1.0845, test_f1: 0.6581
 epoch: 70, train_loss: 0.6296, test_loss: 1.0903, test_f1: 0.6431
 epoch: 71, train_loss: 0.6349, test_loss: 1.1204, test_f1: 0.6138
 epoch: 72, train_loss: 0.6293, test_loss: 1.0719, test_f1: 0.6371
 epoch: 73, train_loss: 0.6247, test_loss: 1.0643, test_f1: 0.6593
 epoch: 74, train_loss: 0.6289, test_loss: 1.0818, test_f1: 0.6327
 epoch: 75, train_loss: 0.6395, test_loss: 1.0772, test_f1: 0.6322
 epoch: 76, train_loss: 0.6323, test_loss: 1.0579, test_f1: 0.6355
 epoch: 77, train_loss: 0.6245, test_loss: 1.0808, test_f1: 0.6402
 epoch: 78, train_loss: 0.6249, test_loss: 1.0672, test_f1: 0.6337
 epoch: 79, train_loss: 0.6247, test_loss: 1.0648, test_f1: 0.6453
 epoch: 80, train_loss: 0.6196, test_loss: 1.0662, test_f1: 0.6534
 epoch: 81, train_loss: 0.6251, test_loss: 1.0915, test_f1: 0.6404
 epoch: 82, train_loss: 0.6288, test_loss: 1.0905, test_f1: 0.6441
 epoch: 83, train_loss: 0.6141, test_loss: 1.0492, test_f1: 0.6707
 epoch: 84, train_loss: 0.6063, test_loss: 1.0523, test_f1: 0.6578
 epoch: 85, train_loss: 0.6045, test_loss: 1.0806, test_f1: 0.6735
 epoch: 86, train_loss: 0.6028, test_loss: 1.0888, test_f1: 0.6212
 epoch: 87, train_loss: 0.6035, test_loss: 1.1356, test_f1: 0.6306
 epoch: 88, train_loss: 0.6063, test_loss: 1.0751, test_f1: 0.6354
 epoch: 89, train_loss: 0.5954, test_loss: 1.1119, test_f1: 0.6632
 epoch: 90, train_loss: 0.5966, test_loss: 1.1008, test_f1: 0.6483
 epoch: 91, train_loss: 0.5955, test_loss: 1.0995, test_f1: 0.6439
 epoch: 92, train_loss: 0.5873, test_loss: 1.1246, test_f1: 0.6484
 epoch: 93, train_loss: 0.5909, test_loss: 1.1284, test_f1: 0.6365
 epoch: 94, train_loss: 0.5949, test_loss: 1.1360, test_f1: 0.6233
 epoch: 95, train_loss: 0.5775, test_loss: 1.0917, test_f1: 0.6530
 epoch: 96, train_loss: 0.6058, test_loss: 1.1870, test_f1: 0.6391
 epoch: 97, train_loss: 0.6040, test_loss: 1.0923, test_f1: 0.6544
 epoch: 98, train_loss: 0.5709, test_loss: 1.0935, test_f1: 0.6516
 epoch: 99, train_loss: 0.5788, test_loss: 1.1623, test_f1: 0.6309
##################ITERATION #7 ****************************************
 epoch: 0, train_loss: 1.3805, test_loss: 1.1312, test_f1: 0.4120
 epoch: 1, train_loss: 1.1457, test_loss: 0.9809, test_f1: 0.4645
 epoch: 2, train_loss: 1.0781, test_loss: 0.9729, test_f1: 0.4989
 epoch: 3, train_loss: 1.0462, test_loss: 1.0028, test_f1: 0.4789
 epoch: 4, train_loss: 1.0011, test_loss: 0.9414, test_f1: 0.5096
 epoch: 5, train_loss: 0.9796, test_loss: 0.9553, test_f1: 0.4964
 epoch: 6, train_loss: 0.9736, test_loss: 0.9470, test_f1: 0.5046
 epoch: 7, train_loss: 0.9605, test_loss: 0.9260, test_f1: 0.5243
 epoch: 8, train_loss: 0.9408, test_loss: 0.9220, test_f1: 0.5096
 epoch: 9, train_loss: 0.9383, test_loss: 0.9069, test_f1: 0.5387
 epoch: 10, train_loss: 0.9348, test_loss: 0.9071, test_f1: 0.5236
 epoch: 11, train_loss: 0.9140, test_loss: 0.9362, test_f1: 0.5284
 epoch: 12, train_loss: 0.9099, test_loss: 0.8975, test_f1: 0.5202
 epoch: 13, train_loss: 0.8944, test_loss: 0.9318, test_f1: 0.5109
 epoch: 14, train_loss: 0.8984, test_loss: 0.8973, test_f1: 0.5417
 epoch: 15, train_loss: 0.8870, test_loss: 0.9189, test_f1: 0.5141
 epoch: 16, train_loss: 0.8801, test_loss: 0.9139, test_f1: 0.5329
 epoch: 17, train_loss: 0.8759, test_loss: 0.9269, test_f1: 0.5333
 epoch: 18, train_loss: 0.8602, test_loss: 0.9506, test_f1: 0.5369
 epoch: 19, train_loss: 0.8589, test_loss: 0.9124, test_f1: 0.5452
 epoch: 20, train_loss: 0.8518, test_loss: 0.8898, test_f1: 0.5406
 epoch: 21, train_loss: 0.8372, test_loss: 0.9032, test_f1: 0.5591
 epoch: 22, train_loss: 0.8350, test_loss: 0.8851, test_f1: 0.5541
 epoch: 23, train_loss: 0.8463, test_loss: 0.9188, test_f1: 0.5724
 epoch: 24, train_loss: 0.8424, test_loss: 0.9194, test_f1: 0.5385
 epoch: 25, train_loss: 0.8289, test_loss: 0.8869, test_f1: 0.5719
 epoch: 26, train_loss: 0.8298, test_loss: 0.8988, test_f1: 0.5451
 epoch: 27, train_loss: 0.8189, test_loss: 0.8953, test_f1: 0.5486
 epoch: 28, train_loss: 0.8058, test_loss: 0.8971, test_f1: 0.5610
 epoch: 29, train_loss: 0.8074, test_loss: 0.9212, test_f1: 0.5364
 epoch: 30, train_loss: 0.8061, test_loss: 0.8901, test_f1: 0.5803
 epoch: 31, train_loss: 0.8005, test_loss: 0.8870, test_f1: 0.5757
 epoch: 32, train_loss: 0.7942, test_loss: 0.9309, test_f1: 0.5461
 epoch: 33, train_loss: 0.7954, test_loss: 0.9344, test_f1: 0.5646
 epoch: 34, train_loss: 0.7927, test_loss: 0.8850, test_f1: 0.5540
 epoch: 35, train_loss: 0.7984, test_loss: 0.8548, test_f1: 0.5707
 epoch: 36, train_loss: 0.7941, test_loss: 0.9162, test_f1: 0.5348
 epoch: 37, train_loss: 0.7852, test_loss: 0.8581, test_f1: 0.5760
 epoch: 38, train_loss: 0.7656, test_loss: 0.8671, test_f1: 0.5638
 epoch: 39, train_loss: 0.7757, test_loss: 0.8941, test_f1: 0.5735
 epoch: 40, train_loss: 0.7692, test_loss: 0.8964, test_f1: 0.5829
 epoch: 41, train_loss: 0.7609, test_loss: 0.8793, test_f1: 0.5858
 epoch: 42, train_loss: 0.7643, test_loss: 0.8924, test_f1: 0.5720
 epoch: 43, train_loss: 0.7504, test_loss: 0.8957, test_f1: 0.5885
 epoch: 44, train_loss: 0.7623, test_loss: 0.9177, test_f1: 0.5806
 epoch: 45, train_loss: 0.7441, test_loss: 0.8357, test_f1: 0.6165
 epoch: 46, train_loss: 0.7486, test_loss: 0.8698, test_f1: 0.5837
 epoch: 47, train_loss: 0.7354, test_loss: 0.9459, test_f1: 0.5481
 epoch: 48, train_loss: 0.7463, test_loss: 0.8647, test_f1: 0.6070
 epoch: 49, train_loss: 0.7422, test_loss: 0.8783, test_f1: 0.5962
 epoch: 50, train_loss: 0.7420, test_loss: 0.8669, test_f1: 0.5887
 epoch: 51, train_loss: 0.7195, test_loss: 0.8497, test_f1: 0.5941
 epoch: 52, train_loss: 0.7062, test_loss: 0.8625, test_f1: 0.6002
 epoch: 53, train_loss: 0.7060, test_loss: 0.8390, test_f1: 0.6284
 epoch: 54, train_loss: 0.7070, test_loss: 0.8762, test_f1: 0.5996
 epoch: 55, train_loss: 0.7029, test_loss: 0.8677, test_f1: 0.6311
 epoch: 56, train_loss: 0.6953, test_loss: 0.8467, test_f1: 0.6221
 epoch: 57, train_loss: 0.7038, test_loss: 0.8564, test_f1: 0.6177
 epoch: 58, train_loss: 0.6881, test_loss: 0.8784, test_f1: 0.6050
 epoch: 59, train_loss: 0.6981, test_loss: 0.8782, test_f1: 0.5987
 epoch: 60, train_loss: 0.6948, test_loss: 0.8798, test_f1: 0.5932
 epoch: 61, train_loss: 0.6920, test_loss: 0.8435, test_f1: 0.6287
 epoch: 62, train_loss: 0.6737, test_loss: 0.8468, test_f1: 0.6265
 epoch: 63, train_loss: 0.6769, test_loss: 0.8525, test_f1: 0.6295
 epoch: 64, train_loss: 0.6816, test_loss: 0.8363, test_f1: 0.6216
 epoch: 65, train_loss: 0.6822, test_loss: 0.9032, test_f1: 0.5910
 epoch: 66, train_loss: 0.6727, test_loss: 0.8651, test_f1: 0.6015
 epoch: 67, train_loss: 0.6822, test_loss: 0.8813, test_f1: 0.6254
 epoch: 68, train_loss: 0.6745, test_loss: 0.8560, test_f1: 0.6513
 epoch: 69, train_loss: 0.6864, test_loss: 0.8787, test_f1: 0.6158
 epoch: 70, train_loss: 0.6773, test_loss: 0.8602, test_f1: 0.6149
 epoch: 71, train_loss: 0.6584, test_loss: 0.9194, test_f1: 0.6119
 epoch: 72, train_loss: 0.6816, test_loss: 0.8578, test_f1: 0.6356
 epoch: 73, train_loss: 0.6703, test_loss: 0.8872, test_f1: 0.6023
 epoch: 74, train_loss: 0.6600, test_loss: 0.8733, test_f1: 0.6276
 epoch: 75, train_loss: 0.6643, test_loss: 0.8867, test_f1: 0.6268
 epoch: 76, train_loss: 0.6628, test_loss: 0.8861, test_f1: 0.6090
 epoch: 77, train_loss: 0.6551, test_loss: 0.8755, test_f1: 0.6252
 epoch: 78, train_loss: 0.6596, test_loss: 0.9185, test_f1: 0.6120
 epoch: 79, train_loss: 0.6556, test_loss: 0.8703, test_f1: 0.6222
 epoch: 80, train_loss: 0.6585, test_loss: 0.9040, test_f1: 0.6200
 epoch: 81, train_loss: 0.6489, test_loss: 0.8757, test_f1: 0.6269
 epoch: 82, train_loss: 0.6529, test_loss: 0.8665, test_f1: 0.6597
 epoch: 83, train_loss: 0.6507, test_loss: 0.8744, test_f1: 0.6567
 epoch: 84, train_loss: 0.6559, test_loss: 0.9305, test_f1: 0.6126
 epoch: 85, train_loss: 0.6526, test_loss: 0.8666, test_f1: 0.6595
 epoch: 86, train_loss: 0.6539, test_loss: 0.9156, test_f1: 0.6066
 epoch: 87, train_loss: 0.6404, test_loss: 0.9187, test_f1: 0.6112
 epoch: 88, train_loss: 0.6359, test_loss: 0.8972, test_f1: 0.6353
 epoch: 89, train_loss: 0.6376, test_loss: 0.8908, test_f1: 0.6347
 epoch: 90, train_loss: 0.6490, test_loss: 0.8894, test_f1: 0.6491
 epoch: 91, train_loss: 0.6264, test_loss: 0.9040, test_f1: 0.6570
 epoch: 92, train_loss: 0.6449, test_loss: 0.8949, test_f1: 0.6515
 epoch: 93, train_loss: 0.6304, test_loss: 0.8929, test_f1: 0.6324
 epoch: 94, train_loss: 0.6435, test_loss: 0.8642, test_f1: 0.6517
 epoch: 95, train_loss: 0.6224, test_loss: 0.9010, test_f1: 0.6407
 epoch: 96, train_loss: 0.6356, test_loss: 0.8687, test_f1: 0.6384
 epoch: 97, train_loss: 0.6157, test_loss: 0.9274, test_f1: 0.6202
 epoch: 98, train_loss: 0.6317, test_loss: 0.8865, test_f1: 0.6476
 epoch: 99, train_loss: 0.6255, test_loss: 0.9925, test_f1: 0.5774
##################ITERATION #8 ****************************************
 epoch: 0, train_loss: 1.3892, test_loss: 1.1199, test_f1: 0.3933
 epoch: 1, train_loss: 1.1275, test_loss: 1.0173, test_f1: 0.4289
 epoch: 2, train_loss: 1.0665, test_loss: 0.9880, test_f1: 0.4276
 epoch: 3, train_loss: 1.0266, test_loss: 0.9446, test_f1: 0.4537
 epoch: 4, train_loss: 0.9892, test_loss: 0.9431, test_f1: 0.4577
 epoch: 5, train_loss: 0.9593, test_loss: 0.9548, test_f1: 0.4692
 epoch: 6, train_loss: 0.9603, test_loss: 0.9319, test_f1: 0.4996
 epoch: 7, train_loss: 0.9529, test_loss: 0.9085, test_f1: 0.4983
 epoch: 8, train_loss: 0.9329, test_loss: 0.9172, test_f1: 0.4878
 epoch: 9, train_loss: 0.9208, test_loss: 0.9421, test_f1: 0.4806
 epoch: 10, train_loss: 0.9067, test_loss: 0.8879, test_f1: 0.5251
 epoch: 11, train_loss: 0.8986, test_loss: 0.8815, test_f1: 0.5138
 epoch: 12, train_loss: 0.8912, test_loss: 0.9208, test_f1: 0.5134
 epoch: 13, train_loss: 0.8906, test_loss: 0.9082, test_f1: 0.5200
 epoch: 14, train_loss: 0.8895, test_loss: 0.8841, test_f1: 0.5220
 epoch: 15, train_loss: 0.8868, test_loss: 0.9178, test_f1: 0.5227
 epoch: 16, train_loss: 0.8759, test_loss: 0.9313, test_f1: 0.5308
 epoch: 17, train_loss: 0.8739, test_loss: 0.8958, test_f1: 0.5177
 epoch: 18, train_loss: 0.8482, test_loss: 0.9338, test_f1: 0.5301
 epoch: 19, train_loss: 0.8589, test_loss: 0.9311, test_f1: 0.5183
 epoch: 20, train_loss: 0.8442, test_loss: 0.9024, test_f1: 0.5610
 epoch: 21, train_loss: 0.8264, test_loss: 0.9263, test_f1: 0.4910
 epoch: 22, train_loss: 0.8466, test_loss: 0.9184, test_f1: 0.5548
 epoch: 23, train_loss: 0.8412, test_loss: 0.9337, test_f1: 0.5366
 epoch: 24, train_loss: 0.8247, test_loss: 0.9483, test_f1: 0.5280
 epoch: 25, train_loss: 0.8207, test_loss: 0.9078, test_f1: 0.5572
 epoch: 26, train_loss: 0.8166, test_loss: 0.9325, test_f1: 0.5379
 epoch: 27, train_loss: 0.8333, test_loss: 0.9074, test_f1: 0.5551
 epoch: 28, train_loss: 0.8239, test_loss: 0.9161, test_f1: 0.5438
 epoch: 29, train_loss: 0.8260, test_loss: 0.9005, test_f1: 0.5588
 epoch: 30, train_loss: 0.8070, test_loss: 0.9248, test_f1: 0.5395
 epoch: 31, train_loss: 0.8012, test_loss: 0.9231, test_f1: 0.5411
 epoch: 32, train_loss: 0.7975, test_loss: 0.9207, test_f1: 0.5755
 epoch: 33, train_loss: 0.7948, test_loss: 0.9053, test_f1: 0.5629
 epoch: 34, train_loss: 0.7828, test_loss: 0.9161, test_f1: 0.5541
 epoch: 35, train_loss: 0.7878, test_loss: 0.8934, test_f1: 0.5644
 epoch: 36, train_loss: 0.7938, test_loss: 0.9259, test_f1: 0.5485
 epoch: 37, train_loss: 0.7791, test_loss: 0.9240, test_f1: 0.5610
 epoch: 38, train_loss: 0.7797, test_loss: 0.9138, test_f1: 0.5610
 epoch: 39, train_loss: 0.7686, test_loss: 0.8964, test_f1: 0.5580
 epoch: 40, train_loss: 0.7716, test_loss: 0.9269, test_f1: 0.5779
 epoch: 41, train_loss: 0.7698, test_loss: 0.9390, test_f1: 0.5922
 epoch: 42, train_loss: 0.7629, test_loss: 0.9216, test_f1: 0.5584
 epoch: 43, train_loss: 0.7604, test_loss: 0.9030, test_f1: 0.5778
 epoch: 44, train_loss: 0.7602, test_loss: 0.9085, test_f1: 0.5973
 epoch: 45, train_loss: 0.7745, test_loss: 0.8950, test_f1: 0.5553
 epoch: 46, train_loss: 0.7443, test_loss: 0.9165, test_f1: 0.5886
 epoch: 47, train_loss: 0.7381, test_loss: 0.9640, test_f1: 0.5809
 epoch: 48, train_loss: 0.7449, test_loss: 0.9319, test_f1: 0.5672
 epoch: 49, train_loss: 0.7437, test_loss: 0.9378, test_f1: 0.5923
 epoch: 50, train_loss: 0.7440, test_loss: 0.9310, test_f1: 0.5934
 epoch: 51, train_loss: 0.7267, test_loss: 0.9067, test_f1: 0.5809
 epoch: 52, train_loss: 0.7194, test_loss: 0.9002, test_f1: 0.5790
 epoch: 53, train_loss: 0.7121, test_loss: 0.9221, test_f1: 0.5924
 epoch: 54, train_loss: 0.7140, test_loss: 0.9007, test_f1: 0.5979
 epoch: 55, train_loss: 0.7097, test_loss: 0.9484, test_f1: 0.5903
 epoch: 56, train_loss: 0.6899, test_loss: 0.9281, test_f1: 0.5825
 epoch: 57, train_loss: 0.7047, test_loss: 0.9034, test_f1: 0.5921
 epoch: 58, train_loss: 0.7025, test_loss: 0.8853, test_f1: 0.5977
 epoch: 59, train_loss: 0.6936, test_loss: 0.9318, test_f1: 0.5904
 epoch: 60, train_loss: 0.6952, test_loss: 0.9367, test_f1: 0.6106
 epoch: 61, train_loss: 0.6987, test_loss: 0.9017, test_f1: 0.5976
 epoch: 62, train_loss: 0.7075, test_loss: 0.9181, test_f1: 0.5753
 epoch: 63, train_loss: 0.6844, test_loss: 0.9104, test_f1: 0.6063
 epoch: 64, train_loss: 0.6896, test_loss: 0.9210, test_f1: 0.6004
 epoch: 65, train_loss: 0.6865, test_loss: 0.9092, test_f1: 0.6261
 epoch: 66, train_loss: 0.6818, test_loss: 0.9102, test_f1: 0.6116
 epoch: 67, train_loss: 0.6802, test_loss: 0.9288, test_f1: 0.5927
 epoch: 68, train_loss: 0.6818, test_loss: 0.9250, test_f1: 0.6144
 epoch: 69, train_loss: 0.6881, test_loss: 0.9149, test_f1: 0.5969
 epoch: 70, train_loss: 0.6865, test_loss: 0.9170, test_f1: 0.6105
 epoch: 71, train_loss: 0.6605, test_loss: 0.9265, test_f1: 0.6021
 epoch: 72, train_loss: 0.6702, test_loss: 0.9601, test_f1: 0.5859
 epoch: 73, train_loss: 0.6802, test_loss: 0.9461, test_f1: 0.5991
 epoch: 74, train_loss: 0.6763, test_loss: 0.9555, test_f1: 0.5781
 epoch: 75, train_loss: 0.6687, test_loss: 0.9576, test_f1: 0.5973
 epoch: 76, train_loss: 0.6706, test_loss: 0.9414, test_f1: 0.6062
 epoch: 77, train_loss: 0.6796, test_loss: 0.9243, test_f1: 0.5889
 epoch: 78, train_loss: 0.6681, test_loss: 0.9803, test_f1: 0.5837
 epoch: 79, train_loss: 0.6574, test_loss: 0.9272, test_f1: 0.6202
 epoch: 80, train_loss: 0.6667, test_loss: 0.9580, test_f1: 0.6084
 epoch: 81, train_loss: 0.6503, test_loss: 0.9423, test_f1: 0.6111
 epoch: 82, train_loss: 0.6611, test_loss: 0.9523, test_f1: 0.6206
 epoch: 83, train_loss: 0.6509, test_loss: 0.9659, test_f1: 0.5906
 epoch: 84, train_loss: 0.6615, test_loss: 0.9800, test_f1: 0.6072
 epoch: 85, train_loss: 0.6473, test_loss: 0.9552, test_f1: 0.5996
 epoch: 86, train_loss: 0.6558, test_loss: 0.9628, test_f1: 0.6127
 epoch: 87, train_loss: 0.6565, test_loss: 1.0073, test_f1: 0.6001
 epoch: 88, train_loss: 0.6453, test_loss: 0.9326, test_f1: 0.6083
 epoch: 89, train_loss: 0.6421, test_loss: 0.9737, test_f1: 0.6182
 epoch: 90, train_loss: 0.6409, test_loss: 0.9802, test_f1: 0.6137
 epoch: 91, train_loss: 0.6395, test_loss: 0.9718, test_f1: 0.6030
 epoch: 92, train_loss: 0.6401, test_loss: 0.9267, test_f1: 0.6085
 epoch: 93, train_loss: 0.6569, test_loss: 0.9561, test_f1: 0.5870
 epoch: 94, train_loss: 0.6278, test_loss: 0.9715, test_f1: 0.6047
 epoch: 95, train_loss: 0.6340, test_loss: 0.9549, test_f1: 0.5987
 epoch: 96, train_loss: 0.6190, test_loss: 0.9501, test_f1: 0.6155
 epoch: 97, train_loss: 0.6421, test_loss: 0.9749, test_f1: 0.6062
 epoch: 98, train_loss: 0.6360, test_loss: 0.9522, test_f1: 0.6354
 epoch: 99, train_loss: 0.6212, test_loss: 0.9577, test_f1: 0.5824
##################ITERATION #9 ****************************************
 epoch: 0, train_loss: 1.3771, test_loss: 1.0891, test_f1: 0.3953
 epoch: 1, train_loss: 1.0803, test_loss: 0.9887, test_f1: 0.4515
 epoch: 2, train_loss: 1.0277, test_loss: 0.9831, test_f1: 0.4493
 epoch: 3, train_loss: 1.0059, test_loss: 0.9717, test_f1: 0.4547
 epoch: 4, train_loss: 0.9864, test_loss: 0.9263, test_f1: 0.4857
 epoch: 5, train_loss: 0.9647, test_loss: 0.9475, test_f1: 0.4653
 epoch: 6, train_loss: 0.9530, test_loss: 0.9681, test_f1: 0.4511
 epoch: 7, train_loss: 0.9405, test_loss: 0.9010, test_f1: 0.5129
 epoch: 8, train_loss: 0.9385, test_loss: 0.9768, test_f1: 0.4767
 epoch: 9, train_loss: 0.9172, test_loss: 0.9438, test_f1: 0.4960
 epoch: 10, train_loss: 0.9063, test_loss: 0.9068, test_f1: 0.4966
 epoch: 11, train_loss: 0.9002, test_loss: 0.9518, test_f1: 0.4986
 epoch: 12, train_loss: 0.8961, test_loss: 0.8818, test_f1: 0.5026
 epoch: 13, train_loss: 0.8908, test_loss: 0.9333, test_f1: 0.5062
 epoch: 14, train_loss: 0.8763, test_loss: 0.9039, test_f1: 0.5255
 epoch: 15, train_loss: 0.8729, test_loss: 0.9557, test_f1: 0.5127
 epoch: 16, train_loss: 0.8764, test_loss: 0.9756, test_f1: 0.5366
 epoch: 17, train_loss: 0.8569, test_loss: 0.8974, test_f1: 0.5345
 epoch: 18, train_loss: 0.8526, test_loss: 0.9139, test_f1: 0.5403
 epoch: 19, train_loss: 0.8383, test_loss: 0.8858, test_f1: 0.5406
 epoch: 20, train_loss: 0.8329, test_loss: 0.8967, test_f1: 0.5692
 epoch: 21, train_loss: 0.8410, test_loss: 0.9112, test_f1: 0.5714
 epoch: 22, train_loss: 0.8385, test_loss: 0.9003, test_f1: 0.5597
 epoch: 23, train_loss: 0.8162, test_loss: 0.9567, test_f1: 0.5515
 epoch: 24, train_loss: 0.8211, test_loss: 0.9142, test_f1: 0.5527
 epoch: 25, train_loss: 0.8290, test_loss: 0.8898, test_f1: 0.5895
 epoch: 26, train_loss: 0.8179, test_loss: 0.9192, test_f1: 0.5413
 epoch: 27, train_loss: 0.8043, test_loss: 0.8779, test_f1: 0.5849
 epoch: 28, train_loss: 0.8027, test_loss: 0.9011, test_f1: 0.6321
 epoch: 29, train_loss: 0.8001, test_loss: 0.8976, test_f1: 0.6061
 epoch: 30, train_loss: 0.7846, test_loss: 0.8756, test_f1: 0.5849
 epoch: 31, train_loss: 0.7936, test_loss: 0.9228, test_f1: 0.5841
 epoch: 32, train_loss: 0.7858, test_loss: 0.8803, test_f1: 0.6064
 epoch: 33, train_loss: 0.7733, test_loss: 0.8819, test_f1: 0.5984
 epoch: 34, train_loss: 0.7651, test_loss: 0.9229, test_f1: 0.5927
 epoch: 35, train_loss: 0.7875, test_loss: 0.9193, test_f1: 0.5592
 epoch: 36, train_loss: 0.7724, test_loss: 0.8623, test_f1: 0.6191
 epoch: 37, train_loss: 0.7655, test_loss: 0.8922, test_f1: 0.5765
 epoch: 38, train_loss: 0.7501, test_loss: 0.8911, test_f1: 0.5977
 epoch: 39, train_loss: 0.7579, test_loss: 0.8863, test_f1: 0.6223
 epoch: 40, train_loss: 0.7565, test_loss: 0.9119, test_f1: 0.5878
 epoch: 41, train_loss: 0.7400, test_loss: 0.9035, test_f1: 0.6278
 epoch: 42, train_loss: 0.7473, test_loss: 0.8966, test_f1: 0.5967
 epoch: 43, train_loss: 0.7420, test_loss: 0.9769, test_f1: 0.5615
 epoch: 44, train_loss: 0.7503, test_loss: 0.8793, test_f1: 0.6260
 epoch: 45, train_loss: 0.7385, test_loss: 0.8735, test_f1: 0.6285
 epoch: 46, train_loss: 0.7377, test_loss: 0.8772, test_f1: 0.6142
 epoch: 47, train_loss: 0.7317, test_loss: 0.8978, test_f1: 0.5677
 epoch: 48, train_loss: 0.7278, test_loss: 0.9069, test_f1: 0.6184
 epoch: 49, train_loss: 0.7407, test_loss: 0.9627, test_f1: 0.5726
 epoch: 50, train_loss: 0.7221, test_loss: 0.8996, test_f1: 0.6223
 epoch: 51, train_loss: 0.7009, test_loss: 0.8670, test_f1: 0.6163
 epoch: 52, train_loss: 0.6829, test_loss: 0.8565, test_f1: 0.6267
 epoch: 53, train_loss: 0.6836, test_loss: 0.8904, test_f1: 0.5954
 epoch: 54, train_loss: 0.6828, test_loss: 0.8427, test_f1: 0.6593
 epoch: 55, train_loss: 0.6802, test_loss: 0.8670, test_f1: 0.6247
 epoch: 56, train_loss: 0.6740, test_loss: 0.8632, test_f1: 0.6374
 epoch: 57, train_loss: 0.6686, test_loss: 0.9131, test_f1: 0.6277
 epoch: 58, train_loss: 0.6769, test_loss: 0.8406, test_f1: 0.6576
 epoch: 59, train_loss: 0.6593, test_loss: 0.8453, test_f1: 0.6599
 epoch: 60, train_loss: 0.6658, test_loss: 0.8654, test_f1: 0.6547
 epoch: 61, train_loss: 0.6550, test_loss: 0.8760, test_f1: 0.6642
 epoch: 62, train_loss: 0.6555, test_loss: 0.9017, test_f1: 0.6428
 epoch: 63, train_loss: 0.6712, test_loss: 0.9033, test_f1: 0.6424
 epoch: 64, train_loss: 0.6572, test_loss: 0.8833, test_f1: 0.6566
 epoch: 65, train_loss: 0.6541, test_loss: 0.8778, test_f1: 0.6657
 epoch: 66, train_loss: 0.6466, test_loss: 0.8764, test_f1: 0.6482
 epoch: 67, train_loss: 0.6501, test_loss: 0.8756, test_f1: 0.6373
 epoch: 68, train_loss: 0.6503, test_loss: 0.8825, test_f1: 0.6438
 epoch: 69, train_loss: 0.6377, test_loss: 0.9076, test_f1: 0.6397
 epoch: 70, train_loss: 0.6579, test_loss: 0.8504, test_f1: 0.6591
 epoch: 71, train_loss: 0.6316, test_loss: 0.8693, test_f1: 0.6625
 epoch: 72, train_loss: 0.6345, test_loss: 0.8868, test_f1: 0.6587
 epoch: 73, train_loss: 0.6387, test_loss: 0.8935, test_f1: 0.6441
 epoch: 74, train_loss: 0.6263, test_loss: 0.8876, test_f1: 0.6293
 epoch: 75, train_loss: 0.6365, test_loss: 0.9143, test_f1: 0.6406
 epoch: 76, train_loss: 0.6221, test_loss: 0.8726, test_f1: 0.6578
 epoch: 77, train_loss: 0.6282, test_loss: 0.8607, test_f1: 0.6777
 epoch: 78, train_loss: 0.6346, test_loss: 0.8925, test_f1: 0.6549
 epoch: 79, train_loss: 0.6208, test_loss: 0.9037, test_f1: 0.6489
 epoch: 80, train_loss: 0.6270, test_loss: 0.8876, test_f1: 0.6611
 epoch: 81, train_loss: 0.6274, test_loss: 0.9074, test_f1: 0.6242
 epoch: 82, train_loss: 0.6179, test_loss: 0.8895, test_f1: 0.6619
 epoch: 83, train_loss: 0.6292, test_loss: 0.8697, test_f1: 0.6400
 epoch: 84, train_loss: 0.6145, test_loss: 0.8740, test_f1: 0.6536
 epoch: 85, train_loss: 0.6072, test_loss: 0.9286, test_f1: 0.6376
 epoch: 86, train_loss: 0.6020, test_loss: 0.9413, test_f1: 0.6608
 epoch: 87, train_loss: 0.6085, test_loss: 0.9128, test_f1: 0.6604
 epoch: 88, train_loss: 0.6120, test_loss: 0.8864, test_f1: 0.6626
 epoch: 89, train_loss: 0.6114, test_loss: 0.8988, test_f1: 0.6716
 epoch: 90, train_loss: 0.6061, test_loss: 0.9068, test_f1: 0.6639
 epoch: 91, train_loss: 0.5919, test_loss: 0.9551, test_f1: 0.6451
 epoch: 92, train_loss: 0.6039, test_loss: 0.8853, test_f1: 0.6669
 epoch: 93, train_loss: 0.5923, test_loss: 0.8857, test_f1: 0.6458
 epoch: 94, train_loss: 0.6042, test_loss: 0.8800, test_f1: 0.6763
 epoch: 95, train_loss: 0.6012, test_loss: 0.8950, test_f1: 0.6592
 epoch: 96, train_loss: 0.5768, test_loss: 0.9088, test_f1: 0.6514
 epoch: 97, train_loss: 0.5846, test_loss: 0.8990, test_f1: 0.6473
 epoch: 98, train_loss: 0.5827, test_loss: 0.8726, test_f1: 0.6570
 epoch: 99, train_loss: 0.5859, test_loss: 0.8968, test_f1: 0.6710

Training completed in 743.22 seconds
Best F1: 0.6932 at epoch 90
Mean F1 across iterations: 0.6640  0.0205
========================FINAL RESULTS================================
FEGIN weighted F1: 0.6932  0.0205
python main.py --data ltspice_examples --representation component_net --model FEGIN --layers 3 --hiddens 32 --batch_size 64 --lr 0.001 --emb_size 128 --epochs 100 --save_appendix component_net_L3_H32_BS64_LR0.001_E128 --no_val
-----



STDERR:
  File "main.py", line 370, in <module>
    main()
  File "main.py", line 254, in main
    dataset = dataset_class(
  File "/home/philip/projects/llm_inference_code_repo/Circuit-Completion-Using-GNNs/component_classification_with_link_prediction_head/evaluation/FEGIN/kernel/circuit_datasets.py", line 15, in __init__
    self.data, self.slices = torch.load(self.processed_paths[0])
  File "/home/philip/.local/lib/python3.8/site-packages/torch/serialization.py", line 1040, in load
    warnings.warn(
  File "/usr/lib/python3.8/warnings.py", line 109, in _showwarnmsg
    sw(msg.message, msg.category, msg.filename, msg.lineno,
  File "main.py", line 47, in warn_with_traceback
    traceback.print_stack(file=log)
/home/philip/projects/llm_inference_code_repo/Circuit-Completion-Using-GNNs/component_classification_with_link_prediction_head/evaluation/FEGIN/kernel/circuit_datasets.py:15: FutureWarning: You are using `torch.load` with `weights_only=False` (the current default value), which uses the default pickle module implicitly. It is possible to construct malicious pickle data which will execute arbitrary code during unpickling (See https://github.com/pytorch/pytorch/blob/main/SECURITY.md#untrusted-models for more details). In a future release, the default value for `weights_only` will be flipped to `True`. This limits the functions that could be executed during unpickling. Arbitrary objects will no longer be allowed to be loaded via this mode unless they are explicitly allowlisted by the user via `torch.serialization.add_safe_globals`. We recommend you start setting `weights_only=True` for any use case where you don't have full control of the loaded file. Please open an issue on GitHub for any issues related to this experimental feature.
  self.data, self.slices = torch.load(self.processed_paths[0])
