STDOUT:
Results will be saved in /home/philip/projects/llm_inference_code_repo/Circuit-Completion-Using-GNNs/component_classification_with_link_prediction_head/evaluation/FEGIN/results/model_FEGIN_dataset_ltspice_examples
Command line input: python main.py --data ltspice_examples --representation component_component --model FEGIN --layers 4 --hiddens 16 --batch_size 32 --lr 0.01 --emb_size 512 --epochs 100 --save_appendix component_component_L4_H16_BS32_LR0.01_E512 --no_val
 is saved.
-----
ltspice_examples - FEGIN
Using 4 layers, 16 hidden units, h = 2
Loading component_component representation dataset
ENTERED
Training FEGIN on component_component representation
Train: 3556, Test: 845
##################ITERATION #0 ****************************************
 epoch: 0, train_loss: 1.2793, test_loss: 1.2351, test_f1: 0.2614
 epoch: 1, train_loss: 1.1990, test_loss: 1.1004, test_f1: 0.4275
 epoch: 2, train_loss: 1.1232, test_loss: 1.0659, test_f1: 0.4366
 epoch: 3, train_loss: 1.0823, test_loss: 0.9818, test_f1: 0.4555
 epoch: 4, train_loss: 1.0518, test_loss: 0.9605, test_f1: 0.4481
 epoch: 5, train_loss: 1.0308, test_loss: 1.0133, test_f1: 0.4499
 epoch: 6, train_loss: 1.0281, test_loss: 0.9580, test_f1: 0.5028
 epoch: 7, train_loss: 1.0121, test_loss: 1.0349, test_f1: 0.4929
 epoch: 8, train_loss: 1.0045, test_loss: 1.1051, test_f1: 0.4510
 epoch: 9, train_loss: 1.0025, test_loss: 1.0176, test_f1: 0.4572
 epoch: 10, train_loss: 0.9890, test_loss: 1.0093, test_f1: 0.4722
 epoch: 11, train_loss: 0.9980, test_loss: 1.0672, test_f1: 0.4951
 epoch: 12, train_loss: 0.9795, test_loss: 1.3535, test_f1: 0.4060
 epoch: 13, train_loss: 0.9773, test_loss: 1.1071, test_f1: 0.4996
 epoch: 14, train_loss: 0.9669, test_loss: 1.0386, test_f1: 0.5029
 epoch: 15, train_loss: 0.9577, test_loss: 1.0185, test_f1: 0.5011
 epoch: 16, train_loss: 0.9563, test_loss: 1.0258, test_f1: 0.4708
 epoch: 17, train_loss: 0.9541, test_loss: 1.0309, test_f1: 0.4933
 epoch: 18, train_loss: 0.9527, test_loss: 1.0355, test_f1: 0.4633
 epoch: 19, train_loss: 0.9546, test_loss: 1.0200, test_f1: 0.5136
 epoch: 20, train_loss: 0.9398, test_loss: 1.0001, test_f1: 0.4703
 epoch: 21, train_loss: 0.9472, test_loss: 0.9712, test_f1: 0.5049
 epoch: 22, train_loss: 0.9470, test_loss: 0.9663, test_f1: 0.4905
 epoch: 23, train_loss: 0.9422, test_loss: 0.9811, test_f1: 0.5027
 epoch: 24, train_loss: 0.9301, test_loss: 0.9875, test_f1: 0.4676
 epoch: 25, train_loss: 0.9466, test_loss: 1.0519, test_f1: 0.4882
 epoch: 26, train_loss: 0.9352, test_loss: 0.9309, test_f1: 0.5112
 epoch: 27, train_loss: 0.9227, test_loss: 0.9966, test_f1: 0.5112
 epoch: 28, train_loss: 0.9311, test_loss: 0.9881, test_f1: 0.4862
 epoch: 29, train_loss: 0.9209, test_loss: 0.9794, test_f1: 0.5092
 epoch: 30, train_loss: 0.9043, test_loss: 0.9845, test_f1: 0.4934
 epoch: 31, train_loss: 0.9227, test_loss: 1.0189, test_f1: 0.4497
 epoch: 32, train_loss: 0.9590, test_loss: 1.0176, test_f1: 0.4723
 epoch: 33, train_loss: 0.9147, test_loss: 0.9997, test_f1: 0.5172
 epoch: 34, train_loss: 0.9159, test_loss: 1.0751, test_f1: 0.4683
 epoch: 35, train_loss: 0.9452, test_loss: 1.0499, test_f1: 0.4926
 epoch: 36, train_loss: 0.9150, test_loss: 0.9924, test_f1: 0.5199
 epoch: 37, train_loss: 0.9137, test_loss: 0.9501, test_f1: 0.5079
 epoch: 38, train_loss: 0.9093, test_loss: 1.0036, test_f1: 0.5032
 epoch: 39, train_loss: 0.9067, test_loss: 1.0391, test_f1: 0.5236
 epoch: 40, train_loss: 0.8991, test_loss: 0.9951, test_f1: 0.5369
 epoch: 41, train_loss: 0.9030, test_loss: 0.9929, test_f1: 0.5031
 epoch: 42, train_loss: 0.9137, test_loss: 1.2174, test_f1: 0.4828
 epoch: 43, train_loss: 0.9243, test_loss: 1.0173, test_f1: 0.5165
 epoch: 44, train_loss: 0.9011, test_loss: 0.9947, test_f1: 0.5022
 epoch: 45, train_loss: 0.8940, test_loss: 0.9452, test_f1: 0.5103
 epoch: 46, train_loss: 0.9167, test_loss: 0.9750, test_f1: 0.5158
 epoch: 47, train_loss: 0.9220, test_loss: 1.0643, test_f1: 0.5098
 epoch: 48, train_loss: 0.9056, test_loss: 0.9959, test_f1: 0.5168
 epoch: 49, train_loss: 0.9103, test_loss: 0.9417, test_f1: 0.5306
 epoch: 50, train_loss: 0.8943, test_loss: 0.9520, test_f1: 0.5335
 epoch: 51, train_loss: 0.8659, test_loss: 0.9802, test_f1: 0.5351
 epoch: 52, train_loss: 0.8759, test_loss: 0.9768, test_f1: 0.5495
 epoch: 53, train_loss: 0.8737, test_loss: 0.9343, test_f1: 0.5305
 epoch: 54, train_loss: 0.8741, test_loss: 0.9914, test_f1: 0.5390
 epoch: 55, train_loss: 0.8659, test_loss: 0.9933, test_f1: 0.5383
 epoch: 56, train_loss: 0.8798, test_loss: 0.9647, test_f1: 0.5261
 epoch: 57, train_loss: 0.8567, test_loss: 1.0192, test_f1: 0.5304
 epoch: 58, train_loss: 0.8738, test_loss: 0.9424, test_f1: 0.5356
 epoch: 59, train_loss: 0.8727, test_loss: 0.9849, test_f1: 0.5205
 epoch: 60, train_loss: 0.8479, test_loss: 0.9933, test_f1: 0.5351
 epoch: 61, train_loss: 0.8625, test_loss: 0.9585, test_f1: 0.5457
 epoch: 62, train_loss: 0.8890, test_loss: 0.9707, test_f1: 0.5195
 epoch: 63, train_loss: 0.8559, test_loss: 0.9998, test_f1: 0.5033
 epoch: 64, train_loss: 0.8663, test_loss: 0.9909, test_f1: 0.5191
 epoch: 65, train_loss: 0.8591, test_loss: 0.9778, test_f1: 0.5176
 epoch: 66, train_loss: 0.8518, test_loss: 1.0295, test_f1: 0.5086
 epoch: 67, train_loss: 0.8531, test_loss: 1.0633, test_f1: 0.4937
 epoch: 68, train_loss: 0.8628, test_loss: 0.9361, test_f1: 0.5195
 epoch: 69, train_loss: 0.8522, test_loss: 1.0039, test_f1: 0.5175
 epoch: 70, train_loss: 0.8510, test_loss: 0.9139, test_f1: 0.5179
 epoch: 71, train_loss: 0.8516, test_loss: 0.9882, test_f1: 0.4945
 epoch: 72, train_loss: 0.8481, test_loss: 0.9603, test_f1: 0.5373
 epoch: 73, train_loss: 0.8543, test_loss: 0.9753, test_f1: 0.5230
 epoch: 74, train_loss: 0.8580, test_loss: 0.9347, test_f1: 0.5120
 epoch: 75, train_loss: 0.8567, test_loss: 0.9926, test_f1: 0.5012
 epoch: 76, train_loss: 0.8602, test_loss: 0.9283, test_f1: 0.5093
 epoch: 77, train_loss: 0.8517, test_loss: 0.9408, test_f1: 0.5400
 epoch: 78, train_loss: 0.8505, test_loss: 0.9596, test_f1: 0.5168
 epoch: 79, train_loss: 0.8437, test_loss: 0.9554, test_f1: 0.5049
 epoch: 80, train_loss: 0.8440, test_loss: 0.9502, test_f1: 0.5339
 epoch: 81, train_loss: 0.8417, test_loss: 0.9239, test_f1: 0.5228
 epoch: 82, train_loss: 0.8440, test_loss: 0.9579, test_f1: 0.5247
 epoch: 83, train_loss: 0.8588, test_loss: 0.9303, test_f1: 0.5164
 epoch: 84, train_loss: 0.8443, test_loss: 0.9593, test_f1: 0.5147
 epoch: 85, train_loss: 0.8466, test_loss: 0.9723, test_f1: 0.4986
 epoch: 86, train_loss: 0.8425, test_loss: 0.9313, test_f1: 0.5528
 epoch: 87, train_loss: 0.8343, test_loss: 0.9475, test_f1: 0.5169
 epoch: 88, train_loss: 0.8314, test_loss: 0.9913, test_f1: 0.5252
 epoch: 89, train_loss: 0.8349, test_loss: 0.9299, test_f1: 0.5215
 epoch: 90, train_loss: 0.8290, test_loss: 1.0068, test_f1: 0.5109
 epoch: 91, train_loss: 0.8225, test_loss: 0.9549, test_f1: 0.5510
 epoch: 92, train_loss: 0.8392, test_loss: 0.9386, test_f1: 0.5727
 epoch: 93, train_loss: 0.8282, test_loss: 0.9450, test_f1: 0.5652
 epoch: 94, train_loss: 0.8316, test_loss: 0.9878, test_f1: 0.5697
 epoch: 95, train_loss: 0.8379, test_loss: 1.0501, test_f1: 0.4784
 epoch: 96, train_loss: 0.8418, test_loss: 1.0059, test_f1: 0.5132
 epoch: 97, train_loss: 0.8380, test_loss: 0.9362, test_f1: 0.5280
 epoch: 98, train_loss: 0.8372, test_loss: 0.9380, test_f1: 0.5203
 epoch: 99, train_loss: 0.8308, test_loss: 1.0105, test_f1: 0.5077
##################ITERATION #1 ****************************************
 epoch: 0, train_loss: 1.2741, test_loss: 1.1357, test_f1: 0.4002
 epoch: 1, train_loss: 1.1546, test_loss: 1.1221, test_f1: 0.4370
 epoch: 2, train_loss: 1.1147, test_loss: 1.0122, test_f1: 0.4447
 epoch: 3, train_loss: 1.0566, test_loss: 0.9916, test_f1: 0.4721
 epoch: 4, train_loss: 1.0229, test_loss: 1.0195, test_f1: 0.4595
 epoch: 5, train_loss: 1.0155, test_loss: 1.0089, test_f1: 0.4598
 epoch: 6, train_loss: 1.0136, test_loss: 1.0241, test_f1: 0.4573
 epoch: 7, train_loss: 1.0009, test_loss: 0.9919, test_f1: 0.4766
 epoch: 8, train_loss: 0.9969, test_loss: 1.0191, test_f1: 0.4890
 epoch: 9, train_loss: 0.9775, test_loss: 1.0238, test_f1: 0.4683
 epoch: 10, train_loss: 0.9843, test_loss: 1.0521, test_f1: 0.4444
 epoch: 11, train_loss: 1.0265, test_loss: 0.9727, test_f1: 0.4836
 epoch: 12, train_loss: 0.9802, test_loss: 1.0273, test_f1: 0.4421
 epoch: 13, train_loss: 0.9897, test_loss: 0.9734, test_f1: 0.4734
 epoch: 14, train_loss: 0.9800, test_loss: 0.9790, test_f1: 0.4760
 epoch: 15, train_loss: 0.9630, test_loss: 1.0921, test_f1: 0.4536
 epoch: 16, train_loss: 0.9842, test_loss: 1.0449, test_f1: 0.4357
 epoch: 17, train_loss: 0.9541, test_loss: 1.1676, test_f1: 0.4559
 epoch: 18, train_loss: 0.9581, test_loss: 1.1123, test_f1: 0.4483
 epoch: 19, train_loss: 0.9619, test_loss: 1.0363, test_f1: 0.4693
 epoch: 20, train_loss: 0.9619, test_loss: 0.9915, test_f1: 0.5082
 epoch: 21, train_loss: 0.9595, test_loss: 1.0074, test_f1: 0.4787
 epoch: 22, train_loss: 0.9336, test_loss: 0.9962, test_f1: 0.5160
 epoch: 23, train_loss: 0.9583, test_loss: 0.9823, test_f1: 0.5074
 epoch: 24, train_loss: 0.9415, test_loss: 0.9861, test_f1: 0.4811
 epoch: 25, train_loss: 0.9398, test_loss: 1.0255, test_f1: 0.4686
 epoch: 26, train_loss: 0.9514, test_loss: 0.9968, test_f1: 0.4932
 epoch: 27, train_loss: 0.9393, test_loss: 0.9943, test_f1: 0.4619
 epoch: 28, train_loss: 0.9443, test_loss: 1.0491, test_f1: 0.4702
 epoch: 29, train_loss: 0.9588, test_loss: 0.9643, test_f1: 0.4914
 epoch: 30, train_loss: 0.9422, test_loss: 0.9914, test_f1: 0.4969
 epoch: 31, train_loss: 0.9720, test_loss: 1.0156, test_f1: 0.4662
 epoch: 32, train_loss: 0.9829, test_loss: 1.0036, test_f1: 0.4574
 epoch: 33, train_loss: 0.9349, test_loss: 1.0145, test_f1: 0.4925
 epoch: 34, train_loss: 0.9327, test_loss: 1.0270, test_f1: 0.5057
 epoch: 35, train_loss: 0.9317, test_loss: 1.0861, test_f1: 0.4968
 epoch: 36, train_loss: 0.9251, test_loss: 1.0810, test_f1: 0.4768
 epoch: 37, train_loss: 0.9228, test_loss: 0.9725, test_f1: 0.5089
 epoch: 38, train_loss: 0.9176, test_loss: 1.0918, test_f1: 0.4786
 epoch: 39, train_loss: 0.9260, test_loss: 0.9517, test_f1: 0.5146
 epoch: 40, train_loss: 0.9260, test_loss: 0.9913, test_f1: 0.5019
 epoch: 41, train_loss: 0.9206, test_loss: 1.0225, test_f1: 0.4948
 epoch: 42, train_loss: 0.9277, test_loss: 0.9810, test_f1: 0.4802
 epoch: 43, train_loss: 0.9157, test_loss: 1.1132, test_f1: 0.4915
 epoch: 44, train_loss: 0.9179, test_loss: 1.0089, test_f1: 0.4811
 epoch: 45, train_loss: 0.9115, test_loss: 0.9470, test_f1: 0.5023
 epoch: 46, train_loss: 0.9089, test_loss: 1.0704, test_f1: 0.5007
 epoch: 47, train_loss: 0.9190, test_loss: 0.9959, test_f1: 0.4971
 epoch: 48, train_loss: 0.9195, test_loss: 1.0846, test_f1: 0.4869
 epoch: 49, train_loss: 0.9071, test_loss: 1.0486, test_f1: 0.4978
 epoch: 50, train_loss: 0.9173, test_loss: 0.9800, test_f1: 0.5269
 epoch: 51, train_loss: 0.8963, test_loss: 0.9514, test_f1: 0.5207
 epoch: 52, train_loss: 0.8950, test_loss: 0.9622, test_f1: 0.5173
 epoch: 53, train_loss: 0.8877, test_loss: 0.9274, test_f1: 0.5189
 epoch: 54, train_loss: 0.8802, test_loss: 0.9404, test_f1: 0.5143
 epoch: 55, train_loss: 0.8832, test_loss: 0.9548, test_f1: 0.5199
 epoch: 56, train_loss: 0.8908, test_loss: 1.0117, test_f1: 0.5051
 epoch: 57, train_loss: 0.8746, test_loss: 0.9353, test_f1: 0.5253
 epoch: 58, train_loss: 0.8762, test_loss: 0.9929, test_f1: 0.5188
 epoch: 59, train_loss: 0.8847, test_loss: 0.9590, test_f1: 0.5149
 epoch: 60, train_loss: 0.8821, test_loss: 0.9571, test_f1: 0.5190
 epoch: 61, train_loss: 0.8704, test_loss: 0.9340, test_f1: 0.5309
 epoch: 62, train_loss: 0.8780, test_loss: 0.9578, test_f1: 0.5228
 epoch: 63, train_loss: 0.8835, test_loss: 0.9538, test_f1: 0.5369
 epoch: 64, train_loss: 0.8729, test_loss: 0.9601, test_f1: 0.5100
 epoch: 65, train_loss: 0.8765, test_loss: 0.9978, test_f1: 0.5262
 epoch: 66, train_loss: 0.8763, test_loss: 0.9776, test_f1: 0.5132
 epoch: 67, train_loss: 0.8833, test_loss: 1.0251, test_f1: 0.4917
 epoch: 68, train_loss: 0.8700, test_loss: 0.9666, test_f1: 0.5212
 epoch: 69, train_loss: 0.8667, test_loss: 1.0994, test_f1: 0.4796
 epoch: 70, train_loss: 0.8657, test_loss: 0.9456, test_f1: 0.5151
 epoch: 71, train_loss: 0.8654, test_loss: 0.9471, test_f1: 0.5229
 epoch: 72, train_loss: 0.8624, test_loss: 0.9648, test_f1: 0.5218
 epoch: 73, train_loss: 0.8720, test_loss: 0.9541, test_f1: 0.5056
 epoch: 74, train_loss: 0.8716, test_loss: 0.9291, test_f1: 0.5247
 epoch: 75, train_loss: 0.8595, test_loss: 0.9508, test_f1: 0.5179
 epoch: 76, train_loss: 0.8559, test_loss: 0.9391, test_f1: 0.5352
 epoch: 77, train_loss: 0.8612, test_loss: 0.9417, test_f1: 0.5211
 epoch: 78, train_loss: 0.9050, test_loss: 0.9472, test_f1: 0.5293
 epoch: 79, train_loss: 0.8780, test_loss: 0.9680, test_f1: 0.5124
 epoch: 80, train_loss: 0.8632, test_loss: 0.9815, test_f1: 0.5179
 epoch: 81, train_loss: 0.8633, test_loss: 0.9797, test_f1: 0.5318
 epoch: 82, train_loss: 0.8511, test_loss: 0.9270, test_f1: 0.5256
 epoch: 83, train_loss: 0.8537, test_loss: 0.9483, test_f1: 0.5171
 epoch: 84, train_loss: 0.8706, test_loss: 0.9381, test_f1: 0.5068
 epoch: 85, train_loss: 0.8765, test_loss: 0.9286, test_f1: 0.5336
 epoch: 86, train_loss: 0.8535, test_loss: 0.9648, test_f1: 0.5305
 epoch: 87, train_loss: 0.8562, test_loss: 0.9676, test_f1: 0.5246
 epoch: 88, train_loss: 0.8497, test_loss: 0.9260, test_f1: 0.5641
 epoch: 89, train_loss: 0.8467, test_loss: 0.9548, test_f1: 0.5060
 epoch: 90, train_loss: 0.8464, test_loss: 1.0117, test_f1: 0.5087
 epoch: 91, train_loss: 0.8498, test_loss: 0.9557, test_f1: 0.5315
 epoch: 92, train_loss: 0.8451, test_loss: 0.9594, test_f1: 0.5181
 epoch: 93, train_loss: 0.8430, test_loss: 0.9634, test_f1: 0.5327
 epoch: 94, train_loss: 0.8531, test_loss: 0.9712, test_f1: 0.5154
 epoch: 95, train_loss: 0.8409, test_loss: 0.9788, test_f1: 0.5330
 epoch: 96, train_loss: 0.8575, test_loss: 0.9289, test_f1: 0.5194
 epoch: 97, train_loss: 0.8448, test_loss: 0.9797, test_f1: 0.4893
 epoch: 98, train_loss: 0.8328, test_loss: 0.9872, test_f1: 0.5510
 epoch: 99, train_loss: 0.8424, test_loss: 0.9774, test_f1: 0.5231
##################ITERATION #2 ****************************************
 epoch: 0, train_loss: 1.2571, test_loss: 1.1672, test_f1: 0.4154
 epoch: 1, train_loss: 1.1628, test_loss: 1.0593, test_f1: 0.4464
 epoch: 2, train_loss: 1.1134, test_loss: 1.0602, test_f1: 0.4434
 epoch: 3, train_loss: 1.0887, test_loss: 1.0104, test_f1: 0.4658
 epoch: 4, train_loss: 1.0891, test_loss: 0.9784, test_f1: 0.4665
 epoch: 5, train_loss: 1.0637, test_loss: 1.0020, test_f1: 0.4608
 epoch: 6, train_loss: 1.0759, test_loss: 1.0679, test_f1: 0.4447
 epoch: 7, train_loss: 1.0446, test_loss: 0.9803, test_f1: 0.4491
 epoch: 8, train_loss: 1.0399, test_loss: 1.0495, test_f1: 0.4512
 epoch: 9, train_loss: 1.0407, test_loss: 0.9582, test_f1: 0.4575
 epoch: 10, train_loss: 1.0315, test_loss: 1.0078, test_f1: 0.4576
 epoch: 11, train_loss: 1.0105, test_loss: 0.9674, test_f1: 0.4765
 epoch: 12, train_loss: 0.9986, test_loss: 0.9800, test_f1: 0.4563
 epoch: 13, train_loss: 0.9951, test_loss: 1.0327, test_f1: 0.4450
 epoch: 14, train_loss: 0.9860, test_loss: 0.9619, test_f1: 0.4637
 epoch: 15, train_loss: 0.9762, test_loss: 1.0444, test_f1: 0.4613
 epoch: 16, train_loss: 0.9695, test_loss: 0.9890, test_f1: 0.4639
 epoch: 17, train_loss: 0.9796, test_loss: 0.9779, test_f1: 0.4700
 epoch: 18, train_loss: 0.9693, test_loss: 1.0022, test_f1: 0.4637
 epoch: 19, train_loss: 0.9785, test_loss: 1.0448, test_f1: 0.4531
 epoch: 20, train_loss: 0.9714, test_loss: 0.9349, test_f1: 0.4878
 epoch: 21, train_loss: 0.9765, test_loss: 1.0346, test_f1: 0.4673
 epoch: 22, train_loss: 0.9527, test_loss: 0.9015, test_f1: 0.4540
 epoch: 23, train_loss: 0.9548, test_loss: 0.9778, test_f1: 0.4645
 epoch: 24, train_loss: 0.9550, test_loss: 0.9938, test_f1: 0.4953
 epoch: 25, train_loss: 0.9829, test_loss: 0.9896, test_f1: 0.4775
 epoch: 26, train_loss: 0.9787, test_loss: 1.0260, test_f1: 0.4817
 epoch: 27, train_loss: 0.9457, test_loss: 1.1086, test_f1: 0.4753
 epoch: 28, train_loss: 0.9514, test_loss: 0.9712, test_f1: 0.4967
 epoch: 29, train_loss: 0.9462, test_loss: 0.9884, test_f1: 0.4662
 epoch: 30, train_loss: 0.9449, test_loss: 0.9679, test_f1: 0.4649
 epoch: 31, train_loss: 0.9447, test_loss: 1.0158, test_f1: 0.4635
 epoch: 32, train_loss: 0.9390, test_loss: 1.0845, test_f1: 0.4708
 epoch: 33, train_loss: 0.9412, test_loss: 0.9980, test_f1: 0.4898
 epoch: 34, train_loss: 0.9762, test_loss: 0.9816, test_f1: 0.4830
 epoch: 35, train_loss: 0.9424, test_loss: 1.0181, test_f1: 0.4911
 epoch: 36, train_loss: 0.9463, test_loss: 1.0243, test_f1: 0.4573
 epoch: 37, train_loss: 0.9247, test_loss: 0.9944, test_f1: 0.4726
 epoch: 38, train_loss: 0.9262, test_loss: 1.0417, test_f1: 0.4863
 epoch: 39, train_loss: 0.9351, test_loss: 1.0214, test_f1: 0.4670
 epoch: 40, train_loss: 0.9296, test_loss: 1.0169, test_f1: 0.4646
 epoch: 41, train_loss: 0.9295, test_loss: 0.9864, test_f1: 0.5133
 epoch: 42, train_loss: 0.9292, test_loss: 0.9428, test_f1: 0.4793
 epoch: 43, train_loss: 0.9293, test_loss: 0.9827, test_f1: 0.5021
 epoch: 44, train_loss: 0.9242, test_loss: 1.0246, test_f1: 0.4929
 epoch: 45, train_loss: 0.9394, test_loss: 1.0076, test_f1: 0.4772
 epoch: 46, train_loss: 0.9346, test_loss: 1.5969, test_f1: 0.4577
 epoch: 47, train_loss: 0.9405, test_loss: 1.0109, test_f1: 0.4888
 epoch: 48, train_loss: 0.9300, test_loss: 1.0499, test_f1: 0.4983
 epoch: 49, train_loss: 0.9322, test_loss: 0.9519, test_f1: 0.4949
 epoch: 50, train_loss: 0.9096, test_loss: 1.0943, test_f1: 0.4496
 epoch: 51, train_loss: 0.9111, test_loss: 0.9869, test_f1: 0.5127
 epoch: 52, train_loss: 0.8969, test_loss: 1.0240, test_f1: 0.4877
 epoch: 53, train_loss: 0.8974, test_loss: 1.0201, test_f1: 0.5193
 epoch: 54, train_loss: 0.8833, test_loss: 1.0346, test_f1: 0.5218
 epoch: 55, train_loss: 0.8872, test_loss: 1.0295, test_f1: 0.5173
 epoch: 56, train_loss: 0.8952, test_loss: 0.9727, test_f1: 0.5046
 epoch: 57, train_loss: 0.8943, test_loss: 1.0040, test_f1: 0.5361
 epoch: 58, train_loss: 0.8865, test_loss: 0.9957, test_f1: 0.5415
 epoch: 59, train_loss: 0.8948, test_loss: 0.9755, test_f1: 0.5347
 epoch: 60, train_loss: 0.8845, test_loss: 0.9842, test_f1: 0.5043
 epoch: 61, train_loss: 0.8915, test_loss: 1.0449, test_f1: 0.5018
 epoch: 62, train_loss: 0.8772, test_loss: 1.1685, test_f1: 0.5478
 epoch: 63, train_loss: 0.8871, test_loss: 1.0461, test_f1: 0.5398
 epoch: 64, train_loss: 0.8769, test_loss: 0.9859, test_f1: 0.5263
 epoch: 65, train_loss: 0.8898, test_loss: 1.0197, test_f1: 0.5332
 epoch: 66, train_loss: 0.8834, test_loss: 1.0188, test_f1: 0.5059
 epoch: 67, train_loss: 0.8857, test_loss: 1.0166, test_f1: 0.4838
 epoch: 68, train_loss: 0.8845, test_loss: 1.0926, test_f1: 0.5483
 epoch: 69, train_loss: 0.8745, test_loss: 1.0220, test_f1: 0.5275
 epoch: 70, train_loss: 0.8823, test_loss: 1.0523, test_f1: 0.5231
 epoch: 71, train_loss: 0.8691, test_loss: 1.0466, test_f1: 0.5646
 epoch: 72, train_loss: 0.8599, test_loss: 1.0155, test_f1: 0.5318
 epoch: 73, train_loss: 0.8871, test_loss: 0.9984, test_f1: 0.5232
 epoch: 74, train_loss: 0.8757, test_loss: 0.9908, test_f1: 0.5311
 epoch: 75, train_loss: 0.8709, test_loss: 1.0013, test_f1: 0.5633
 epoch: 76, train_loss: 0.8802, test_loss: 0.9243, test_f1: 0.5655
 epoch: 77, train_loss: 0.8754, test_loss: 1.0303, test_f1: 0.5583
 epoch: 78, train_loss: 0.8616, test_loss: 1.0332, test_f1: 0.5402
 epoch: 79, train_loss: 0.8613, test_loss: 1.0393, test_f1: 0.5565
 epoch: 80, train_loss: 0.8640, test_loss: 1.0585, test_f1: 0.5242
 epoch: 81, train_loss: 0.8687, test_loss: 1.0220, test_f1: 0.5412
 epoch: 82, train_loss: 0.8697, test_loss: 1.0956, test_f1: 0.5268
 epoch: 83, train_loss: 0.8596, test_loss: 1.0193, test_f1: 0.5471
 epoch: 84, train_loss: 0.8732, test_loss: 1.0100, test_f1: 0.5257
 epoch: 85, train_loss: 0.8669, test_loss: 0.9139, test_f1: 0.5397
 epoch: 86, train_loss: 0.8630, test_loss: 1.0103, test_f1: 0.5389
 epoch: 87, train_loss: 0.8686, test_loss: 1.0550, test_f1: 0.5474
 epoch: 88, train_loss: 0.8597, test_loss: 1.1010, test_f1: 0.5467
 epoch: 89, train_loss: 0.8599, test_loss: 1.0517, test_f1: 0.5492
 epoch: 90, train_loss: 0.8567, test_loss: 1.0117, test_f1: 0.5352
 epoch: 91, train_loss: 0.8588, test_loss: 1.0433, test_f1: 0.5351
 epoch: 92, train_loss: 0.8524, test_loss: 1.0562, test_f1: 0.5654
 epoch: 93, train_loss: 0.8630, test_loss: 0.9908, test_f1: 0.5635
 epoch: 94, train_loss: 0.8654, test_loss: 1.0065, test_f1: 0.5385
 epoch: 95, train_loss: 0.8540, test_loss: 1.0844, test_f1: 0.5545
 epoch: 96, train_loss: 0.8633, test_loss: 0.9959, test_f1: 0.5651
 epoch: 97, train_loss: 0.8570, test_loss: 0.9883, test_f1: 0.5725
 epoch: 98, train_loss: 0.8553, test_loss: 1.0544, test_f1: 0.5660
 epoch: 99, train_loss: 0.8580, test_loss: 0.9744, test_f1: 0.5609
##################ITERATION #3 ****************************************
 epoch: 0, train_loss: 1.2549, test_loss: 1.1562, test_f1: 0.3308
 epoch: 1, train_loss: 1.1792, test_loss: 1.0632, test_f1: 0.4095
 epoch: 2, train_loss: 1.1401, test_loss: 1.0661, test_f1: 0.4495
 epoch: 3, train_loss: 1.1174, test_loss: 1.0414, test_f1: 0.4174
 epoch: 4, train_loss: 1.0990, test_loss: 0.9962, test_f1: 0.4733
 epoch: 5, train_loss: 1.0711, test_loss: 1.0542, test_f1: 0.4626
 epoch: 6, train_loss: 1.0548, test_loss: 1.0430, test_f1: 0.4461
 epoch: 7, train_loss: 1.0695, test_loss: 1.0597, test_f1: 0.4396
 epoch: 8, train_loss: 1.0567, test_loss: 0.9676, test_f1: 0.4523
 epoch: 9, train_loss: 1.0181, test_loss: 1.0173, test_f1: 0.4630
 epoch: 10, train_loss: 1.0177, test_loss: 1.0248, test_f1: 0.4586
 epoch: 11, train_loss: 1.0034, test_loss: 1.0250, test_f1: 0.4628
 epoch: 12, train_loss: 0.9954, test_loss: 0.9958, test_f1: 0.4963
 epoch: 13, train_loss: 0.9955, test_loss: 0.9627, test_f1: 0.4549
 epoch: 14, train_loss: 0.9807, test_loss: 0.9872, test_f1: 0.4467
 epoch: 15, train_loss: 0.9762, test_loss: 1.0016, test_f1: 0.4737
 epoch: 16, train_loss: 0.9703, test_loss: 0.9774, test_f1: 0.4712
 epoch: 17, train_loss: 0.9695, test_loss: 0.9980, test_f1: 0.4720
 epoch: 18, train_loss: 0.9759, test_loss: 0.9851, test_f1: 0.4701
 epoch: 19, train_loss: 0.9599, test_loss: 1.0064, test_f1: 0.4697
 epoch: 20, train_loss: 0.9608, test_loss: 0.9840, test_f1: 0.4720
 epoch: 21, train_loss: 0.9594, test_loss: 0.9775, test_f1: 0.4626
 epoch: 22, train_loss: 0.9610, test_loss: 0.9835, test_f1: 0.5314
 epoch: 23, train_loss: 0.9598, test_loss: 0.9760, test_f1: 0.4705
 epoch: 24, train_loss: 0.9566, test_loss: 1.0050, test_f1: 0.4653
 epoch: 25, train_loss: 0.9578, test_loss: 0.9698, test_f1: 0.4822
 epoch: 26, train_loss: 0.9510, test_loss: 0.9834, test_f1: 0.4857
 epoch: 27, train_loss: 0.9420, test_loss: 0.9838, test_f1: 0.4935
 epoch: 28, train_loss: 0.9522, test_loss: 1.0108, test_f1: 0.4656
 epoch: 29, train_loss: 0.9469, test_loss: 0.9825, test_f1: 0.4632
 epoch: 30, train_loss: 0.9386, test_loss: 0.9808, test_f1: 0.4538
 epoch: 31, train_loss: 0.9482, test_loss: 0.9730, test_f1: 0.4714
 epoch: 32, train_loss: 0.9501, test_loss: 1.0390, test_f1: 0.4281
 epoch: 33, train_loss: 0.9384, test_loss: 0.9663, test_f1: 0.5000
 epoch: 34, train_loss: 0.9354, test_loss: 0.9831, test_f1: 0.4976
 epoch: 35, train_loss: 0.9342, test_loss: 0.9739, test_f1: 0.5020
 epoch: 36, train_loss: 0.9408, test_loss: 1.0714, test_f1: 0.4503
 epoch: 37, train_loss: 0.9457, test_loss: 1.0012, test_f1: 0.4735
 epoch: 38, train_loss: 0.9433, test_loss: 0.9891, test_f1: 0.5004
 epoch: 39, train_loss: 0.9240, test_loss: 1.0127, test_f1: 0.4927
 epoch: 40, train_loss: 0.9412, test_loss: 0.9715, test_f1: 0.4689
 epoch: 41, train_loss: 0.9271, test_loss: 0.9567, test_f1: 0.4993
 epoch: 42, train_loss: 0.9314, test_loss: 0.9518, test_f1: 0.4888
 epoch: 43, train_loss: 0.9210, test_loss: 0.9900, test_f1: 0.4854
 epoch: 44, train_loss: 0.9371, test_loss: 0.9906, test_f1: 0.4487
 epoch: 45, train_loss: 0.9249, test_loss: 0.9750, test_f1: 0.4887
 epoch: 46, train_loss: 0.9330, test_loss: 1.0172, test_f1: 0.4872
 epoch: 47, train_loss: 0.9314, test_loss: 1.0365, test_f1: 0.4824
 epoch: 48, train_loss: 0.9636, test_loss: 1.0115, test_f1: 0.4567
 epoch: 49, train_loss: 0.9367, test_loss: 1.0202, test_f1: 0.4920
 epoch: 50, train_loss: 0.9266, test_loss: 1.0432, test_f1: 0.4895
 epoch: 51, train_loss: 0.9148, test_loss: 0.9936, test_f1: 0.4997
 epoch: 52, train_loss: 0.9110, test_loss: 1.0162, test_f1: 0.4958
 epoch: 53, train_loss: 0.9061, test_loss: 1.0256, test_f1: 0.4887
 epoch: 54, train_loss: 0.9060, test_loss: 0.9910, test_f1: 0.5020
 epoch: 55, train_loss: 0.8991, test_loss: 1.0155, test_f1: 0.4970
 epoch: 56, train_loss: 0.9066, test_loss: 1.0310, test_f1: 0.4839
 epoch: 57, train_loss: 0.9038, test_loss: 1.0043, test_f1: 0.4974
 epoch: 58, train_loss: 0.8885, test_loss: 1.0321, test_f1: 0.4890
 epoch: 59, train_loss: 0.8952, test_loss: 1.0321, test_f1: 0.4972
 epoch: 60, train_loss: 0.9014, test_loss: 0.9640, test_f1: 0.5108
 epoch: 61, train_loss: 0.8910, test_loss: 0.9744, test_f1: 0.4925
 epoch: 62, train_loss: 0.9004, test_loss: 0.9858, test_f1: 0.4971
 epoch: 63, train_loss: 0.8932, test_loss: 1.0261, test_f1: 0.4656
 epoch: 64, train_loss: 0.9027, test_loss: 0.9818, test_f1: 0.4996
 epoch: 65, train_loss: 0.8873, test_loss: 0.9928, test_f1: 0.4911
 epoch: 66, train_loss: 0.8988, test_loss: 1.0320, test_f1: 0.4943
 epoch: 67, train_loss: 0.9014, test_loss: 1.0403, test_f1: 0.4629
 epoch: 68, train_loss: 0.8987, test_loss: 1.0241, test_f1: 0.4834
 epoch: 69, train_loss: 0.8910, test_loss: 1.0138, test_f1: 0.5057
 epoch: 70, train_loss: 0.8990, test_loss: 0.9952, test_f1: 0.5056
 epoch: 71, train_loss: 0.8890, test_loss: 0.9976, test_f1: 0.5000
 epoch: 72, train_loss: 0.8953, test_loss: 0.9653, test_f1: 0.4932
 epoch: 73, train_loss: 0.8833, test_loss: 0.9789, test_f1: 0.4938
 epoch: 74, train_loss: 0.8887, test_loss: 0.9959, test_f1: 0.5068
 epoch: 75, train_loss: 0.8914, test_loss: 0.9516, test_f1: 0.5034
 epoch: 76, train_loss: 0.8843, test_loss: 0.9822, test_f1: 0.5030
 epoch: 77, train_loss: 0.8957, test_loss: 0.9902, test_f1: 0.4987
 epoch: 78, train_loss: 0.8883, test_loss: 1.0091, test_f1: 0.4823
 epoch: 79, train_loss: 0.8906, test_loss: 0.9862, test_f1: 0.4970
 epoch: 80, train_loss: 0.8757, test_loss: 1.0154, test_f1: 0.4829
 epoch: 81, train_loss: 0.8738, test_loss: 1.0349, test_f1: 0.4900
 epoch: 82, train_loss: 0.8716, test_loss: 1.0332, test_f1: 0.4858
 epoch: 83, train_loss: 0.8893, test_loss: 1.0613, test_f1: 0.4881
 epoch: 84, train_loss: 0.8856, test_loss: 1.0136, test_f1: 0.5023
 epoch: 85, train_loss: 0.8891, test_loss: 1.0234, test_f1: 0.5050
 epoch: 86, train_loss: 0.8810, test_loss: 1.0543, test_f1: 0.4959
 epoch: 87, train_loss: 0.8753, test_loss: 1.0210, test_f1: 0.5046
 epoch: 88, train_loss: 0.8928, test_loss: 0.9872, test_f1: 0.4943
 epoch: 89, train_loss: 0.8664, test_loss: 0.9727, test_f1: 0.4982
 epoch: 90, train_loss: 0.8709, test_loss: 1.0112, test_f1: 0.4810
 epoch: 91, train_loss: 0.8797, test_loss: 1.0242, test_f1: 0.4993
 epoch: 92, train_loss: 0.8838, test_loss: 1.0560, test_f1: 0.4919
 epoch: 93, train_loss: 0.8790, test_loss: 1.0350, test_f1: 0.5010
 epoch: 94, train_loss: 0.8792, test_loss: 1.0379, test_f1: 0.5007
 epoch: 95, train_loss: 0.8785, test_loss: 1.0023, test_f1: 0.5001
 epoch: 96, train_loss: 0.8888, test_loss: 1.0188, test_f1: 0.5050
 epoch: 97, train_loss: 0.8647, test_loss: 0.9619, test_f1: 0.5021
 epoch: 98, train_loss: 0.8726, test_loss: 1.0303, test_f1: 0.4844
 epoch: 99, train_loss: 0.8679, test_loss: 1.0017, test_f1: 0.5001
##################ITERATION #4 ****************************************
 epoch: 0, train_loss: 1.2694, test_loss: 1.2118, test_f1: 0.3140
 epoch: 1, train_loss: 1.2046, test_loss: 1.1271, test_f1: 0.3265
 epoch: 2, train_loss: 1.1551, test_loss: 1.0564, test_f1: 0.3903
 epoch: 3, train_loss: 1.1199, test_loss: 1.0883, test_f1: 0.4226
 epoch: 4, train_loss: 1.0883, test_loss: 0.9892, test_f1: 0.4970
 epoch: 5, train_loss: 1.0665, test_loss: 1.0349, test_f1: 0.4222
 epoch: 6, train_loss: 1.0408, test_loss: 1.0593, test_f1: 0.4426
 epoch: 7, train_loss: 1.0139, test_loss: 1.0643, test_f1: 0.4185
 epoch: 8, train_loss: 1.0048, test_loss: 1.0474, test_f1: 0.4586
 epoch: 9, train_loss: 0.9952, test_loss: 1.0149, test_f1: 0.4793
 epoch: 10, train_loss: 0.9906, test_loss: 1.1459, test_f1: 0.4224
 epoch: 11, train_loss: 0.9918, test_loss: 1.0425, test_f1: 0.4574
 epoch: 12, train_loss: 0.9823, test_loss: 1.0278, test_f1: 0.4588
 epoch: 13, train_loss: 0.9781, test_loss: 1.0110, test_f1: 0.4779
 epoch: 14, train_loss: 0.9787, test_loss: 1.0129, test_f1: 0.4545
 epoch: 15, train_loss: 0.9735, test_loss: 1.0742, test_f1: 0.4621
 epoch: 16, train_loss: 0.9588, test_loss: 1.0251, test_f1: 0.4515
 epoch: 17, train_loss: 0.9970, test_loss: 0.9953, test_f1: 0.4456
 epoch: 18, train_loss: 0.9609, test_loss: 1.0039, test_f1: 0.4573
 epoch: 19, train_loss: 0.9404, test_loss: 1.0012, test_f1: 0.4771
 epoch: 20, train_loss: 0.9481, test_loss: 1.0541, test_f1: 0.4713
 epoch: 21, train_loss: 0.9399, test_loss: 1.0047, test_f1: 0.4833
 epoch: 22, train_loss: 0.9433, test_loss: 1.1316, test_f1: 0.4230
 epoch: 23, train_loss: 0.9642, test_loss: 0.9792, test_f1: 0.4715
 epoch: 24, train_loss: 0.9525, test_loss: 0.9926, test_f1: 0.4576
 epoch: 25, train_loss: 0.9315, test_loss: 1.0012, test_f1: 0.4701
 epoch: 26, train_loss: 0.9372, test_loss: 1.0238, test_f1: 0.4631
 epoch: 27, train_loss: 0.9386, test_loss: 0.9645, test_f1: 0.5114
 epoch: 28, train_loss: 0.9208, test_loss: 1.0184, test_f1: 0.4753
 epoch: 29, train_loss: 0.9203, test_loss: 1.0067, test_f1: 0.5006
 epoch: 30, train_loss: 0.9094, test_loss: 0.9530, test_f1: 0.5425
 epoch: 31, train_loss: 0.9320, test_loss: 1.0204, test_f1: 0.4521
 epoch: 32, train_loss: 0.9170, test_loss: 1.0293, test_f1: 0.4690
 epoch: 33, train_loss: 0.9095, test_loss: 0.9580, test_f1: 0.5059
 epoch: 34, train_loss: 0.9096, test_loss: 0.9711, test_f1: 0.4765
 epoch: 35, train_loss: 0.9252, test_loss: 0.9913, test_f1: 0.4628
 epoch: 36, train_loss: 0.9114, test_loss: 0.9598, test_f1: 0.4844
 epoch: 37, train_loss: 0.9040, test_loss: 1.0374, test_f1: 0.4774
 epoch: 38, train_loss: 0.9126, test_loss: 0.9752, test_f1: 0.4736
 epoch: 39, train_loss: 0.9003, test_loss: 1.0127, test_f1: 0.5425
 epoch: 40, train_loss: 0.9149, test_loss: 1.0652, test_f1: 0.4497
 epoch: 41, train_loss: 0.9225, test_loss: 0.9429, test_f1: 0.4827
 epoch: 42, train_loss: 0.8995, test_loss: 1.0208, test_f1: 0.4833
 epoch: 43, train_loss: 0.9056, test_loss: 1.1466, test_f1: 0.4611
 epoch: 44, train_loss: 0.9229, test_loss: 1.0400, test_f1: 0.4863
 epoch: 45, train_loss: 0.9188, test_loss: 1.0012, test_f1: 0.4484
 epoch: 46, train_loss: 0.9021, test_loss: 0.9748, test_f1: 0.5027
 epoch: 47, train_loss: 0.9155, test_loss: 0.9875, test_f1: 0.4882
 epoch: 48, train_loss: 0.8907, test_loss: 0.9891, test_f1: 0.4981
 epoch: 49, train_loss: 0.8897, test_loss: 0.9499, test_f1: 0.4783
 epoch: 50, train_loss: 0.8969, test_loss: 0.9494, test_f1: 0.4672
 epoch: 51, train_loss: 0.8892, test_loss: 0.9909, test_f1: 0.4630
 epoch: 52, train_loss: 0.8762, test_loss: 0.9387, test_f1: 0.4956
 epoch: 53, train_loss: 0.8814, test_loss: 0.9690, test_f1: 0.4956
 epoch: 54, train_loss: 0.8756, test_loss: 0.9590, test_f1: 0.4813
 epoch: 55, train_loss: 0.8741, test_loss: 0.9391, test_f1: 0.4894
 epoch: 56, train_loss: 0.8826, test_loss: 0.9348, test_f1: 0.5006
 epoch: 57, train_loss: 0.8892, test_loss: 0.9608, test_f1: 0.4966
 epoch: 58, train_loss: 0.8756, test_loss: 0.9644, test_f1: 0.5048
 epoch: 59, train_loss: 0.8721, test_loss: 0.9653, test_f1: 0.5103
 epoch: 60, train_loss: 0.8774, test_loss: 0.9976, test_f1: 0.4950
 epoch: 61, train_loss: 0.8738, test_loss: 0.9403, test_f1: 0.4810
 epoch: 62, train_loss: 0.8565, test_loss: 0.9886, test_f1: 0.4775
 epoch: 63, train_loss: 0.8626, test_loss: 0.9889, test_f1: 0.5010
 epoch: 64, train_loss: 0.9122, test_loss: 0.9623, test_f1: 0.5126
 epoch: 65, train_loss: 0.8813, test_loss: 0.9612, test_f1: 0.4780
 epoch: 66, train_loss: 0.8573, test_loss: 0.9706, test_f1: 0.4969
 epoch: 67, train_loss: 0.8547, test_loss: 0.9355, test_f1: 0.5472
 epoch: 68, train_loss: 0.8571, test_loss: 0.9624, test_f1: 0.4843
 epoch: 69, train_loss: 0.8549, test_loss: 0.9810, test_f1: 0.5564
 epoch: 70, train_loss: 0.8511, test_loss: 0.9363, test_f1: 0.5048
 epoch: 71, train_loss: 0.8569, test_loss: 0.9918, test_f1: 0.5115
 epoch: 72, train_loss: 0.8515, test_loss: 0.9844, test_f1: 0.4828
 epoch: 73, train_loss: 0.8596, test_loss: 0.9474, test_f1: 0.5489
 epoch: 74, train_loss: 0.8509, test_loss: 0.9777, test_f1: 0.4975
 epoch: 75, train_loss: 0.8552, test_loss: 1.0006, test_f1: 0.5213
 epoch: 76, train_loss: 0.8581, test_loss: 0.9566, test_f1: 0.5021
 epoch: 77, train_loss: 0.8520, test_loss: 0.9938, test_f1: 0.5381
 epoch: 78, train_loss: 0.8454, test_loss: 0.9530, test_f1: 0.5067
 epoch: 79, train_loss: 0.8442, test_loss: 0.9664, test_f1: 0.5256
 epoch: 80, train_loss: 0.8411, test_loss: 0.9709, test_f1: 0.5167
 epoch: 81, train_loss: 0.8627, test_loss: 0.9645, test_f1: 0.5059
 epoch: 82, train_loss: 0.8507, test_loss: 0.9794, test_f1: 0.5014
 epoch: 83, train_loss: 0.8615, test_loss: 0.9646, test_f1: 0.5184
 epoch: 84, train_loss: 0.8562, test_loss: 0.9777, test_f1: 0.5378
 epoch: 85, train_loss: 0.8471, test_loss: 1.0085, test_f1: 0.5072
 epoch: 86, train_loss: 0.8528, test_loss: 0.9542, test_f1: 0.4902
 epoch: 87, train_loss: 0.8477, test_loss: 0.9876, test_f1: 0.5140
 epoch: 88, train_loss: 0.8531, test_loss: 0.9551, test_f1: 0.5333
 epoch: 89, train_loss: 0.8479, test_loss: 0.9748, test_f1: 0.5183
 epoch: 90, train_loss: 0.8441, test_loss: 0.9833, test_f1: 0.5357
 epoch: 91, train_loss: 0.8532, test_loss: 1.0049, test_f1: 0.4961
 epoch: 92, train_loss: 0.8330, test_loss: 0.9805, test_f1: 0.5358
 epoch: 93, train_loss: 0.8391, test_loss: 0.9741, test_f1: 0.5042
 epoch: 94, train_loss: 0.8451, test_loss: 1.0113, test_f1: 0.5157
 epoch: 95, train_loss: 0.8382, test_loss: 0.9516, test_f1: 0.4884
 epoch: 96, train_loss: 0.8378, test_loss: 0.9994, test_f1: 0.5199
 epoch: 97, train_loss: 0.8382, test_loss: 0.9907, test_f1: 0.5160
 epoch: 98, train_loss: 0.8346, test_loss: 0.9562, test_f1: 0.5209
 epoch: 99, train_loss: 0.8431, test_loss: 1.0244, test_f1: 0.5263
##################ITERATION #5 ****************************************
 epoch: 0, train_loss: 1.2667, test_loss: 1.1966, test_f1: 0.3253
 epoch: 1, train_loss: 1.2046, test_loss: 1.1069, test_f1: 0.3634
 epoch: 2, train_loss: 1.1655, test_loss: 1.0760, test_f1: 0.3459
 epoch: 3, train_loss: 1.1471, test_loss: 1.0741, test_f1: 0.3589
 epoch: 4, train_loss: 1.1154, test_loss: 1.0703, test_f1: 0.3903
 epoch: 5, train_loss: 1.0982, test_loss: 0.9958, test_f1: 0.4252
 epoch: 6, train_loss: 1.0813, test_loss: 0.9654, test_f1: 0.4765
 epoch: 7, train_loss: 1.0825, test_loss: 0.9965, test_f1: 0.4504
 epoch: 8, train_loss: 1.0294, test_loss: 0.9977, test_f1: 0.4414
 epoch: 9, train_loss: 1.0094, test_loss: 0.9840, test_f1: 0.4750
 epoch: 10, train_loss: 1.0010, test_loss: 0.9738, test_f1: 0.4708
 epoch: 11, train_loss: 0.9870, test_loss: 0.9397, test_f1: 0.4570
 epoch: 12, train_loss: 0.9802, test_loss: 0.9925, test_f1: 0.4561
 epoch: 13, train_loss: 0.9750, test_loss: 1.0012, test_f1: 0.4539
 epoch: 14, train_loss: 0.9681, test_loss: 0.9965, test_f1: 0.4931
 epoch: 15, train_loss: 0.9724, test_loss: 1.0372, test_f1: 0.4827
 epoch: 16, train_loss: 0.9768, test_loss: 1.1218, test_f1: 0.4850
 epoch: 17, train_loss: 0.9816, test_loss: 0.9387, test_f1: 0.4703
 epoch: 18, train_loss: 0.9410, test_loss: 0.9766, test_f1: 0.4727
 epoch: 19, train_loss: 0.9555, test_loss: 0.9805, test_f1: 0.4858
 epoch: 20, train_loss: 0.9535, test_loss: 1.1680, test_f1: 0.4606
 epoch: 21, train_loss: 0.9552, test_loss: 0.9426, test_f1: 0.4726
 epoch: 22, train_loss: 0.9631, test_loss: 0.8924, test_f1: 0.4701
 epoch: 23, train_loss: 0.9474, test_loss: 1.0647, test_f1: 0.4421
 epoch: 24, train_loss: 0.9474, test_loss: 1.0324, test_f1: 0.4543
 epoch: 25, train_loss: 0.9405, test_loss: 0.9461, test_f1: 0.5345
 epoch: 26, train_loss: 0.9299, test_loss: 1.0221, test_f1: 0.5084
 epoch: 27, train_loss: 0.9396, test_loss: 0.9526, test_f1: 0.5291
 epoch: 28, train_loss: 0.9434, test_loss: 0.9760, test_f1: 0.5094
 epoch: 29, train_loss: 0.9428, test_loss: 0.9648, test_f1: 0.4923
 epoch: 30, train_loss: 0.9272, test_loss: 0.9582, test_f1: 0.4884
 epoch: 31, train_loss: 0.9357, test_loss: 0.9476, test_f1: 0.5048
 epoch: 32, train_loss: 0.9371, test_loss: 0.9377, test_f1: 0.5196
 epoch: 33, train_loss: 0.9357, test_loss: 0.9842, test_f1: 0.4734
 epoch: 34, train_loss: 0.9195, test_loss: 0.9890, test_f1: 0.4938
 epoch: 35, train_loss: 0.9195, test_loss: 1.0204, test_f1: 0.5136
 epoch: 36, train_loss: 0.9601, test_loss: 0.9236, test_f1: 0.5045
 epoch: 37, train_loss: 0.9321, test_loss: 0.9898, test_f1: 0.5017
 epoch: 38, train_loss: 0.9233, test_loss: 1.0147, test_f1: 0.5228
 epoch: 39, train_loss: 0.9266, test_loss: 0.9550, test_f1: 0.5213
 epoch: 40, train_loss: 0.9100, test_loss: 0.9869, test_f1: 0.5163
 epoch: 41, train_loss: 0.9283, test_loss: 0.9543, test_f1: 0.5257
 epoch: 42, train_loss: 0.9216, test_loss: 0.9578, test_f1: 0.5118
 epoch: 43, train_loss: 0.9219, test_loss: 0.9629, test_f1: 0.5282
 epoch: 44, train_loss: 0.9281, test_loss: 0.9683, test_f1: 0.5209
 epoch: 45, train_loss: 0.9149, test_loss: 0.9717, test_f1: 0.5111
 epoch: 46, train_loss: 0.9209, test_loss: 0.9833, test_f1: 0.5305
 epoch: 47, train_loss: 0.9106, test_loss: 1.0532, test_f1: 0.5423
 epoch: 48, train_loss: 0.9088, test_loss: 1.0289, test_f1: 0.4955
 epoch: 49, train_loss: 0.9125, test_loss: 1.0091, test_f1: 0.5308
 epoch: 50, train_loss: 0.9027, test_loss: 0.9744, test_f1: 0.5236
 epoch: 51, train_loss: 0.8900, test_loss: 0.9735, test_f1: 0.5382
 epoch: 52, train_loss: 0.8896, test_loss: 0.9726, test_f1: 0.5320
 epoch: 53, train_loss: 0.8854, test_loss: 0.9294, test_f1: 0.5230
 epoch: 54, train_loss: 0.8830, test_loss: 0.9493, test_f1: 0.5198
 epoch: 55, train_loss: 0.8800, test_loss: 0.9886, test_f1: 0.5320
 epoch: 56, train_loss: 0.8811, test_loss: 0.9767, test_f1: 0.5154
 epoch: 57, train_loss: 0.8717, test_loss: 1.0264, test_f1: 0.5236
 epoch: 58, train_loss: 0.8950, test_loss: 0.9548, test_f1: 0.5545
 epoch: 59, train_loss: 0.8842, test_loss: 1.0083, test_f1: 0.4872
 epoch: 60, train_loss: 0.8773, test_loss: 0.9295, test_f1: 0.5310
 epoch: 61, train_loss: 0.8884, test_loss: 0.9509, test_f1: 0.5456
 epoch: 62, train_loss: 0.8754, test_loss: 0.9522, test_f1: 0.5321
 epoch: 63, train_loss: 0.8767, test_loss: 0.9858, test_f1: 0.5213
 epoch: 64, train_loss: 0.8741, test_loss: 0.9685, test_f1: 0.5317
 epoch: 65, train_loss: 0.8667, test_loss: 0.9887, test_f1: 0.5337
 epoch: 66, train_loss: 0.8728, test_loss: 1.0809, test_f1: 0.5185
 epoch: 67, train_loss: 0.8746, test_loss: 1.0823, test_f1: 0.5284
 epoch: 68, train_loss: 0.8694, test_loss: 1.0510, test_f1: 0.4998
 epoch: 69, train_loss: 0.8602, test_loss: 1.0115, test_f1: 0.5506
 epoch: 70, train_loss: 0.8562, test_loss: 0.9997, test_f1: 0.5304
 epoch: 71, train_loss: 0.8709, test_loss: 0.9786, test_f1: 0.5315
 epoch: 72, train_loss: 0.8657, test_loss: 0.9695, test_f1: 0.5409
 epoch: 73, train_loss: 0.8542, test_loss: 0.9954, test_f1: 0.5249
 epoch: 74, train_loss: 0.8639, test_loss: 0.9515, test_f1: 0.5370
 epoch: 75, train_loss: 0.8681, test_loss: 0.9406, test_f1: 0.5633
 epoch: 76, train_loss: 0.8591, test_loss: 0.9586, test_f1: 0.5498
 epoch: 77, train_loss: 0.8502, test_loss: 0.9830, test_f1: 0.5390
 epoch: 78, train_loss: 0.8646, test_loss: 0.9588, test_f1: 0.5115
 epoch: 79, train_loss: 0.8565, test_loss: 0.9565, test_f1: 0.5234
 epoch: 80, train_loss: 0.8492, test_loss: 0.9523, test_f1: 0.5318
 epoch: 81, train_loss: 0.8508, test_loss: 0.9385, test_f1: 0.5313
 epoch: 82, train_loss: 0.8578, test_loss: 1.0812, test_f1: 0.5107
 epoch: 83, train_loss: 0.8933, test_loss: 0.9424, test_f1: 0.5178
 epoch: 84, train_loss: 0.8628, test_loss: 0.9458, test_f1: 0.5288
 epoch: 85, train_loss: 0.8473, test_loss: 0.9435, test_f1: 0.5366
 epoch: 86, train_loss: 0.8450, test_loss: 0.9865, test_f1: 0.5321
 epoch: 87, train_loss: 0.8487, test_loss: 0.9644, test_f1: 0.5426
 epoch: 88, train_loss: 0.8525, test_loss: 1.0437, test_f1: 0.4965
 epoch: 89, train_loss: 0.8452, test_loss: 0.9648, test_f1: 0.5555
 epoch: 90, train_loss: 0.8497, test_loss: 0.9650, test_f1: 0.5407
 epoch: 91, train_loss: 0.8511, test_loss: 0.9828, test_f1: 0.5179
 epoch: 92, train_loss: 0.8420, test_loss: 1.0156, test_f1: 0.5178
 epoch: 93, train_loss: 0.8527, test_loss: 0.9929, test_f1: 0.5562
 epoch: 94, train_loss: 0.8474, test_loss: 1.0163, test_f1: 0.5312
 epoch: 95, train_loss: 0.8427, test_loss: 0.9499, test_f1: 0.5362
 epoch: 96, train_loss: 0.8350, test_loss: 0.9356, test_f1: 0.5453
 epoch: 97, train_loss: 0.8361, test_loss: 0.9727, test_f1: 0.5180
 epoch: 98, train_loss: 0.8384, test_loss: 0.9668, test_f1: 0.5428
 epoch: 99, train_loss: 0.8375, test_loss: 0.9860, test_f1: 0.5283
##################ITERATION #6 ****************************************
 epoch: 0, train_loss: 1.2673, test_loss: 1.1977, test_f1: 0.3581
 epoch: 1, train_loss: 1.2130, test_loss: 1.1470, test_f1: 0.3905
 epoch: 2, train_loss: 1.1769, test_loss: 1.1331, test_f1: 0.4062
 epoch: 3, train_loss: 1.1219, test_loss: 1.0330, test_f1: 0.4534
 epoch: 4, train_loss: 1.0605, test_loss: 1.0800, test_f1: 0.4331
 epoch: 5, train_loss: 1.0479, test_loss: 1.0364, test_f1: 0.4987
 epoch: 6, train_loss: 1.0189, test_loss: 1.4864, test_f1: 0.4125
 epoch: 7, train_loss: 1.0495, test_loss: 0.9598, test_f1: 0.4653
 epoch: 8, train_loss: 1.0178, test_loss: 0.9493, test_f1: 0.4427
 epoch: 9, train_loss: 1.0147, test_loss: 0.9516, test_f1: 0.4914
 epoch: 10, train_loss: 1.0136, test_loss: 0.9359, test_f1: 0.4767
 epoch: 11, train_loss: 0.9846, test_loss: 0.9778, test_f1: 0.4787
 epoch: 12, train_loss: 0.9871, test_loss: 0.9541, test_f1: 0.4717
 epoch: 13, train_loss: 0.9817, test_loss: 0.9792, test_f1: 0.4621
 epoch: 14, train_loss: 0.9744, test_loss: 0.9359, test_f1: 0.5169
 epoch: 15, train_loss: 0.9948, test_loss: 0.9669, test_f1: 0.4623
 epoch: 16, train_loss: 0.9704, test_loss: 0.9619, test_f1: 0.4957
 epoch: 17, train_loss: 0.9600, test_loss: 0.9989, test_f1: 0.4570
 epoch: 18, train_loss: 0.9676, test_loss: 0.9740, test_f1: 0.4773
 epoch: 19, train_loss: 0.9532, test_loss: 0.9758, test_f1: 0.4955
 epoch: 20, train_loss: 0.9595, test_loss: 0.9579, test_f1: 0.4913
 epoch: 21, train_loss: 0.9574, test_loss: 0.9835, test_f1: 0.4990
 epoch: 22, train_loss: 0.9697, test_loss: 0.9622, test_f1: 0.4711
 epoch: 23, train_loss: 0.9646, test_loss: 1.1254, test_f1: 0.4748
 epoch: 24, train_loss: 0.9609, test_loss: 1.0000, test_f1: 0.4692
 epoch: 25, train_loss: 0.9531, test_loss: 0.9812, test_f1: 0.4958
 epoch: 26, train_loss: 0.9637, test_loss: 0.9922, test_f1: 0.5025
 epoch: 27, train_loss: 0.9399, test_loss: 0.9646, test_f1: 0.4692
 epoch: 28, train_loss: 0.9490, test_loss: 0.9948, test_f1: 0.4822
 epoch: 29, train_loss: 0.9440, test_loss: 0.9882, test_f1: 0.4955
 epoch: 30, train_loss: 0.9502, test_loss: 0.9768, test_f1: 0.4935
 epoch: 31, train_loss: 0.9291, test_loss: 1.0033, test_f1: 0.4921
 epoch: 32, train_loss: 0.9515, test_loss: 0.9461, test_f1: 0.4925
 epoch: 33, train_loss: 0.9429, test_loss: 0.9853, test_f1: 0.4713
 epoch: 34, train_loss: 0.9392, test_loss: 0.9459, test_f1: 0.4934
 epoch: 35, train_loss: 0.9352, test_loss: 0.9208, test_f1: 0.5043
 epoch: 36, train_loss: 0.9382, test_loss: 1.0023, test_f1: 0.4780
 epoch: 37, train_loss: 0.9313, test_loss: 1.0065, test_f1: 0.5028
 epoch: 38, train_loss: 0.9399, test_loss: 1.0093, test_f1: 0.4941
 epoch: 39, train_loss: 0.9207, test_loss: 0.9523, test_f1: 0.5060
 epoch: 40, train_loss: 0.9213, test_loss: 0.9791, test_f1: 0.5026
 epoch: 41, train_loss: 0.9222, test_loss: 1.0897, test_f1: 0.4620
 epoch: 42, train_loss: 0.9226, test_loss: 0.9795, test_f1: 0.4814
 epoch: 43, train_loss: 0.9223, test_loss: 0.9549, test_f1: 0.5044
 epoch: 44, train_loss: 0.9103, test_loss: 0.9566, test_f1: 0.5138
 epoch: 45, train_loss: 0.9055, test_loss: 0.9959, test_f1: 0.5100
 epoch: 46, train_loss: 0.9251, test_loss: 0.9968, test_f1: 0.4923
 epoch: 47, train_loss: 0.9153, test_loss: 0.9944, test_f1: 0.5083
 epoch: 48, train_loss: 0.9135, test_loss: 1.1149, test_f1: 0.4458
 epoch: 49, train_loss: 0.9137, test_loss: 0.9939, test_f1: 0.5118
 epoch: 50, train_loss: 0.9083, test_loss: 1.0010, test_f1: 0.4969
 epoch: 51, train_loss: 0.9006, test_loss: 0.9775, test_f1: 0.5035
 epoch: 52, train_loss: 0.8900, test_loss: 0.9904, test_f1: 0.4911
 epoch: 53, train_loss: 0.8850, test_loss: 0.9793, test_f1: 0.5141
 epoch: 54, train_loss: 0.8982, test_loss: 0.9663, test_f1: 0.5235
 epoch: 55, train_loss: 0.8858, test_loss: 0.9855, test_f1: 0.4999
 epoch: 56, train_loss: 0.8838, test_loss: 0.9497, test_f1: 0.5184
 epoch: 57, train_loss: 0.8796, test_loss: 0.9833, test_f1: 0.5025
 epoch: 58, train_loss: 0.8726, test_loss: 1.0212, test_f1: 0.5111
 epoch: 59, train_loss: 0.8752, test_loss: 1.0233, test_f1: 0.5016
 epoch: 60, train_loss: 0.8715, test_loss: 1.0576, test_f1: 0.5141
 epoch: 61, train_loss: 0.8758, test_loss: 1.1666, test_f1: 0.4710
 epoch: 62, train_loss: 0.8714, test_loss: 1.0630, test_f1: 0.4769
 epoch: 63, train_loss: 0.8753, test_loss: 0.9684, test_f1: 0.5190
 epoch: 64, train_loss: 0.8928, test_loss: 0.9695, test_f1: 0.5077
 epoch: 65, train_loss: 0.8702, test_loss: 0.9675, test_f1: 0.4883
 epoch: 66, train_loss: 0.8764, test_loss: 0.9773, test_f1: 0.5186
 epoch: 67, train_loss: 0.8603, test_loss: 1.0781, test_f1: 0.4895
 epoch: 68, train_loss: 0.8622, test_loss: 0.9946, test_f1: 0.4718
 epoch: 69, train_loss: 0.8551, test_loss: 0.9405, test_f1: 0.5225
 epoch: 70, train_loss: 0.8726, test_loss: 1.0114, test_f1: 0.5017
 epoch: 71, train_loss: 0.8619, test_loss: 0.9645, test_f1: 0.5063
 epoch: 72, train_loss: 0.8706, test_loss: 0.9345, test_f1: 0.5070
 epoch: 73, train_loss: 0.8647, test_loss: 0.9815, test_f1: 0.4891
 epoch: 74, train_loss: 0.8550, test_loss: 0.9880, test_f1: 0.5083
 epoch: 75, train_loss: 0.8603, test_loss: 0.9660, test_f1: 0.5160
 epoch: 76, train_loss: 0.8494, test_loss: 0.9536, test_f1: 0.5028
 epoch: 77, train_loss: 0.8601, test_loss: 0.9927, test_f1: 0.5166
 epoch: 78, train_loss: 0.8506, test_loss: 0.9974, test_f1: 0.5274
 epoch: 79, train_loss: 0.8555, test_loss: 0.9966, test_f1: 0.4984
 epoch: 80, train_loss: 0.8390, test_loss: 1.0011, test_f1: 0.4966
 epoch: 81, train_loss: 0.8405, test_loss: 0.9821, test_f1: 0.5242
 epoch: 82, train_loss: 0.8563, test_loss: 0.9696, test_f1: 0.5058
 epoch: 83, train_loss: 0.8651, test_loss: 0.9894, test_f1: 0.5048
 epoch: 84, train_loss: 0.8589, test_loss: 0.9639, test_f1: 0.5209
 epoch: 85, train_loss: 0.8573, test_loss: 0.9822, test_f1: 0.5150
 epoch: 86, train_loss: 0.8419, test_loss: 1.0596, test_f1: 0.4895
 epoch: 87, train_loss: 0.8505, test_loss: 0.9696, test_f1: 0.4986
 epoch: 88, train_loss: 0.8590, test_loss: 0.9338, test_f1: 0.5154
 epoch: 89, train_loss: 0.8715, test_loss: 0.9658, test_f1: 0.5178
 epoch: 90, train_loss: 0.8440, test_loss: 0.9766, test_f1: 0.5148
 epoch: 91, train_loss: 0.8525, test_loss: 0.9423, test_f1: 0.5246
 epoch: 92, train_loss: 0.8319, test_loss: 0.9552, test_f1: 0.5069
 epoch: 93, train_loss: 0.8561, test_loss: 0.9528, test_f1: 0.5197
 epoch: 94, train_loss: 0.8342, test_loss: 1.0725, test_f1: 0.5013
 epoch: 95, train_loss: 0.8497, test_loss: 0.9840, test_f1: 0.5099
 epoch: 96, train_loss: 0.8438, test_loss: 0.9380, test_f1: 0.5249
 epoch: 97, train_loss: 0.8538, test_loss: 0.9896, test_f1: 0.5111
 epoch: 98, train_loss: 0.8480, test_loss: 0.9620, test_f1: 0.5202
 epoch: 99, train_loss: 0.8406, test_loss: 0.9670, test_f1: 0.5268
##################ITERATION #7 ****************************************
 epoch: 0, train_loss: 1.2761, test_loss: 1.2353, test_f1: 0.3135
 epoch: 1, train_loss: 1.2420, test_loss: 1.1778, test_f1: 0.3872
 epoch: 2, train_loss: 1.2090, test_loss: 1.1398, test_f1: 0.4121
 epoch: 3, train_loss: 1.1832, test_loss: 1.0892, test_f1: 0.4440
 epoch: 4, train_loss: 1.1480, test_loss: 1.0719, test_f1: 0.4223
 epoch: 5, train_loss: 1.1206, test_loss: 1.1353, test_f1: 0.4487
 epoch: 6, train_loss: 1.0968, test_loss: 0.9877, test_f1: 0.4825
 epoch: 7, train_loss: 1.0797, test_loss: 0.9847, test_f1: 0.4775
 epoch: 8, train_loss: 1.0631, test_loss: 1.0425, test_f1: 0.4294
 epoch: 9, train_loss: 1.0562, test_loss: 0.9954, test_f1: 0.4530
 epoch: 10, train_loss: 1.0330, test_loss: 0.9463, test_f1: 0.4716
 epoch: 11, train_loss: 1.0203, test_loss: 0.9452, test_f1: 0.4552
 epoch: 12, train_loss: 1.0001, test_loss: 0.9406, test_f1: 0.4691
 epoch: 13, train_loss: 1.0656, test_loss: 1.0374, test_f1: 0.4703
 epoch: 14, train_loss: 1.0804, test_loss: 0.9881, test_f1: 0.4717
 epoch: 15, train_loss: 1.0608, test_loss: 0.9687, test_f1: 0.4535
 epoch: 16, train_loss: 1.0404, test_loss: 0.9382, test_f1: 0.4799
 epoch: 17, train_loss: 1.0253, test_loss: 0.9109, test_f1: 0.4858
 epoch: 18, train_loss: 1.0224, test_loss: 0.9371, test_f1: 0.4650
 epoch: 19, train_loss: 1.0137, test_loss: 0.9378, test_f1: 0.4886
 epoch: 20, train_loss: 1.0120, test_loss: 0.9224, test_f1: 0.4682
 epoch: 21, train_loss: 1.0097, test_loss: 0.9761, test_f1: 0.4685
 epoch: 22, train_loss: 0.9971, test_loss: 0.9877, test_f1: 0.4714
 epoch: 23, train_loss: 0.9929, test_loss: 1.0205, test_f1: 0.4862
 epoch: 24, train_loss: 1.0270, test_loss: 0.9487, test_f1: 0.4921
 epoch: 25, train_loss: 0.9782, test_loss: 1.0068, test_f1: 0.5066
 epoch: 26, train_loss: 0.9842, test_loss: 0.9694, test_f1: 0.4749
 epoch: 27, train_loss: 0.9752, test_loss: 0.9738, test_f1: 0.4944
 epoch: 28, train_loss: 0.9825, test_loss: 0.9535, test_f1: 0.4890
 epoch: 29, train_loss: 0.9621, test_loss: 0.9412, test_f1: 0.4924
 epoch: 30, train_loss: 0.9737, test_loss: 1.0471, test_f1: 0.4929
 epoch: 31, train_loss: 0.9621, test_loss: 0.9819, test_f1: 0.4810
 epoch: 32, train_loss: 0.9595, test_loss: 0.9912, test_f1: 0.4895
 epoch: 33, train_loss: 0.9564, test_loss: 1.0536, test_f1: 0.4854
 epoch: 34, train_loss: 0.9709, test_loss: 1.0617, test_f1: 0.4692
 epoch: 35, train_loss: 0.9608, test_loss: 1.0248, test_f1: 0.4836
 epoch: 36, train_loss: 0.9430, test_loss: 1.0418, test_f1: 0.4892
 epoch: 37, train_loss: 0.9536, test_loss: 0.9945, test_f1: 0.4929
 epoch: 38, train_loss: 0.9421, test_loss: 0.9915, test_f1: 0.4654
 epoch: 39, train_loss: 0.9384, test_loss: 1.0691, test_f1: 0.4920
 epoch: 40, train_loss: 0.9420, test_loss: 1.0586, test_f1: 0.4765
 epoch: 41, train_loss: 0.9401, test_loss: 1.0024, test_f1: 0.4800
 epoch: 42, train_loss: 0.9389, test_loss: 1.1115, test_f1: 0.5201
 epoch: 43, train_loss: 0.9337, test_loss: 1.0178, test_f1: 0.4805
 epoch: 44, train_loss: 0.9453, test_loss: 1.0756, test_f1: 0.4836
 epoch: 45, train_loss: 0.9555, test_loss: 1.0558, test_f1: 0.4824
 epoch: 46, train_loss: 0.9358, test_loss: 1.0758, test_f1: 0.4862
 epoch: 47, train_loss: 0.9284, test_loss: 1.0857, test_f1: 0.4901
 epoch: 48, train_loss: 0.9494, test_loss: 1.0497, test_f1: 0.4792
 epoch: 49, train_loss: 0.9496, test_loss: 0.9975, test_f1: 0.4728
 epoch: 50, train_loss: 0.9310, test_loss: 1.0479, test_f1: 0.5065
 epoch: 51, train_loss: 0.9231, test_loss: 1.0550, test_f1: 0.4994
 epoch: 52, train_loss: 0.9000, test_loss: 1.0834, test_f1: 0.4914
 epoch: 53, train_loss: 0.9020, test_loss: 1.0888, test_f1: 0.4861
 epoch: 54, train_loss: 0.8968, test_loss: 1.1364, test_f1: 0.4688
 epoch: 55, train_loss: 0.8937, test_loss: 1.1280, test_f1: 0.4702
 epoch: 56, train_loss: 0.9051, test_loss: 1.0645, test_f1: 0.4954
 epoch: 57, train_loss: 0.9078, test_loss: 1.0121, test_f1: 0.5164
 epoch: 58, train_loss: 0.9015, test_loss: 1.0609, test_f1: 0.4900
 epoch: 59, train_loss: 0.9015, test_loss: 1.0508, test_f1: 0.4808
 epoch: 60, train_loss: 0.8948, test_loss: 1.0818, test_f1: 0.4894
 epoch: 61, train_loss: 0.8987, test_loss: 1.1271, test_f1: 0.4519
 epoch: 62, train_loss: 0.8982, test_loss: 1.0622, test_f1: 0.5038
 epoch: 63, train_loss: 0.8865, test_loss: 1.0643, test_f1: 0.5048
 epoch: 64, train_loss: 0.8834, test_loss: 1.1215, test_f1: 0.4909
 epoch: 65, train_loss: 0.9134, test_loss: 1.0773, test_f1: 0.4724
 epoch: 66, train_loss: 0.8960, test_loss: 1.1139, test_f1: 0.4836
 epoch: 67, train_loss: 0.8999, test_loss: 1.0941, test_f1: 0.4953
 epoch: 68, train_loss: 0.8879, test_loss: 1.0328, test_f1: 0.4759
 epoch: 69, train_loss: 0.8891, test_loss: 1.1149, test_f1: 0.4681
 epoch: 70, train_loss: 0.8881, test_loss: 1.0827, test_f1: 0.4642
 epoch: 71, train_loss: 0.8916, test_loss: 1.0376, test_f1: 0.4730
 epoch: 72, train_loss: 0.8871, test_loss: 0.9877, test_f1: 0.4878
 epoch: 73, train_loss: 0.8812, test_loss: 1.0359, test_f1: 0.4931
 epoch: 74, train_loss: 0.8766, test_loss: 1.1513, test_f1: 0.4716
 epoch: 75, train_loss: 0.8843, test_loss: 1.0792, test_f1: 0.4711
 epoch: 76, train_loss: 0.8721, test_loss: 1.0900, test_f1: 0.4764
 epoch: 77, train_loss: 0.8817, test_loss: 1.0664, test_f1: 0.4757
 epoch: 78, train_loss: 0.8755, test_loss: 1.0953, test_f1: 0.4722
 epoch: 79, train_loss: 0.8795, test_loss: 1.1054, test_f1: 0.4699
 epoch: 80, train_loss: 0.8793, test_loss: 1.1361, test_f1: 0.4730
 epoch: 81, train_loss: 0.8767, test_loss: 1.2434, test_f1: 0.4753
 epoch: 82, train_loss: 0.8737, test_loss: 1.1916, test_f1: 0.4972
 epoch: 83, train_loss: 0.8782, test_loss: 1.2356, test_f1: 0.4722
 epoch: 84, train_loss: 0.8739, test_loss: 1.1107, test_f1: 0.4933
 epoch: 85, train_loss: 0.8773, test_loss: 1.0737, test_f1: 0.4829
 epoch: 86, train_loss: 0.8720, test_loss: 1.0768, test_f1: 0.5217
 epoch: 87, train_loss: 0.8862, test_loss: 1.0166, test_f1: 0.5242
 epoch: 88, train_loss: 0.8637, test_loss: 1.1200, test_f1: 0.5111
 epoch: 89, train_loss: 0.8599, test_loss: 1.1286, test_f1: 0.4978
 epoch: 90, train_loss: 0.8629, test_loss: 1.1051, test_f1: 0.4893
 epoch: 91, train_loss: 0.8791, test_loss: 1.1775, test_f1: 0.5071
 epoch: 92, train_loss: 0.8566, test_loss: 1.0881, test_f1: 0.5098
 epoch: 93, train_loss: 0.8852, test_loss: 1.1127, test_f1: 0.5122
 epoch: 94, train_loss: 0.8695, test_loss: 1.1242, test_f1: 0.4919
 epoch: 95, train_loss: 0.8618, test_loss: 1.0421, test_f1: 0.5163
 epoch: 96, train_loss: 0.8753, test_loss: 0.9986, test_f1: 0.5199
 epoch: 97, train_loss: 0.8503, test_loss: 1.0481, test_f1: 0.5114
 epoch: 98, train_loss: 0.8659, test_loss: 1.1290, test_f1: 0.4770
 epoch: 99, train_loss: 0.8556, test_loss: 1.0518, test_f1: 0.5122
##################ITERATION #8 ****************************************
 epoch: 0, train_loss: 1.2750, test_loss: 1.1877, test_f1: 0.4171
 epoch: 1, train_loss: 1.1851, test_loss: 1.1277, test_f1: 0.4000
 epoch: 2, train_loss: 1.1424, test_loss: 1.0241, test_f1: 0.4610
 epoch: 3, train_loss: 1.1291, test_loss: 1.0490, test_f1: 0.4532
 epoch: 4, train_loss: 1.0994, test_loss: 1.0371, test_f1: 0.4320
 epoch: 5, train_loss: 1.0863, test_loss: 0.9808, test_f1: 0.4725
 epoch: 6, train_loss: 1.0909, test_loss: 1.0003, test_f1: 0.4594
 epoch: 7, train_loss: 1.0646, test_loss: 0.9853, test_f1: 0.4475
 epoch: 8, train_loss: 1.0731, test_loss: 1.0480, test_f1: 0.4333
 epoch: 9, train_loss: 1.0567, test_loss: 1.0108, test_f1: 0.4579
 epoch: 10, train_loss: 1.0398, test_loss: 0.9968, test_f1: 0.4692
 epoch: 11, train_loss: 1.0490, test_loss: 1.0307, test_f1: 0.4562
 epoch: 12, train_loss: 1.0302, test_loss: 1.0121, test_f1: 0.4686
 epoch: 13, train_loss: 1.0295, test_loss: 0.9922, test_f1: 0.4613
 epoch: 14, train_loss: 1.0116, test_loss: 1.0155, test_f1: 0.4868
 epoch: 15, train_loss: 1.0208, test_loss: 1.0006, test_f1: 0.4652
 epoch: 16, train_loss: 0.9998, test_loss: 1.0616, test_f1: 0.4431
 epoch: 17, train_loss: 1.0075, test_loss: 1.0472, test_f1: 0.4504
 epoch: 18, train_loss: 1.0073, test_loss: 0.9942, test_f1: 0.4472
 epoch: 19, train_loss: 0.9877, test_loss: 1.0227, test_f1: 0.4680
 epoch: 20, train_loss: 0.9812, test_loss: 1.0674, test_f1: 0.4478
 epoch: 21, train_loss: 1.0049, test_loss: 1.0384, test_f1: 0.4644
 epoch: 22, train_loss: 0.9715, test_loss: 1.0232, test_f1: 0.4518
 epoch: 23, train_loss: 0.9648, test_loss: 1.0069, test_f1: 0.4646
 epoch: 24, train_loss: 0.9691, test_loss: 1.0401, test_f1: 0.4597
 epoch: 25, train_loss: 0.9697, test_loss: 1.0354, test_f1: 0.5024
 epoch: 26, train_loss: 0.9669, test_loss: 1.0469, test_f1: 0.4606
 epoch: 27, train_loss: 0.9629, test_loss: 1.0139, test_f1: 0.4867
 epoch: 28, train_loss: 0.9509, test_loss: 1.0769, test_f1: 0.5177
 epoch: 29, train_loss: 0.9523, test_loss: 1.0692, test_f1: 0.4777
 epoch: 30, train_loss: 0.9492, test_loss: 1.0400, test_f1: 0.4164
 epoch: 31, train_loss: 0.9817, test_loss: 1.0015, test_f1: 0.4851
 epoch: 32, train_loss: 0.9562, test_loss: 1.0474, test_f1: 0.4583
 epoch: 33, train_loss: 0.9659, test_loss: 1.0105, test_f1: 0.4475
 epoch: 34, train_loss: 0.9473, test_loss: 0.9534, test_f1: 0.5171
 epoch: 35, train_loss: 0.9493, test_loss: 1.0390, test_f1: 0.4780
 epoch: 36, train_loss: 0.9311, test_loss: 1.0527, test_f1: 0.4754
 epoch: 37, train_loss: 0.9464, test_loss: 1.0006, test_f1: 0.5072
 epoch: 38, train_loss: 0.9383, test_loss: 1.0137, test_f1: 0.4773
 epoch: 39, train_loss: 0.9603, test_loss: 1.0412, test_f1: 0.4455
 epoch: 40, train_loss: 0.9400, test_loss: 1.0102, test_f1: 0.4944
 epoch: 41, train_loss: 0.9346, test_loss: 1.0168, test_f1: 0.4630
 epoch: 42, train_loss: 0.9430, test_loss: 1.0739, test_f1: 0.4801
 epoch: 43, train_loss: 0.9420, test_loss: 1.0113, test_f1: 0.4769
 epoch: 44, train_loss: 0.9283, test_loss: 1.0965, test_f1: 0.4566
 epoch: 45, train_loss: 0.9205, test_loss: 1.0806, test_f1: 0.4644
 epoch: 46, train_loss: 0.9158, test_loss: 1.1561, test_f1: 0.4795
 epoch: 47, train_loss: 0.9277, test_loss: 1.0311, test_f1: 0.4702
 epoch: 48, train_loss: 0.9206, test_loss: 1.0945, test_f1: 0.4681
 epoch: 49, train_loss: 0.9247, test_loss: 1.0203, test_f1: 0.5147
 epoch: 50, train_loss: 0.9245, test_loss: 1.0344, test_f1: 0.4671
 epoch: 51, train_loss: 0.9075, test_loss: 1.0069, test_f1: 0.5125
 epoch: 52, train_loss: 0.9001, test_loss: 0.9989, test_f1: 0.5067
 epoch: 53, train_loss: 0.8944, test_loss: 1.0314, test_f1: 0.4809
 epoch: 54, train_loss: 0.8919, test_loss: 1.0176, test_f1: 0.5367
 epoch: 55, train_loss: 0.8817, test_loss: 1.1446, test_f1: 0.4761
 epoch: 56, train_loss: 0.8793, test_loss: 1.0877, test_f1: 0.4860
 epoch: 57, train_loss: 0.8841, test_loss: 0.9918, test_f1: 0.5150
 epoch: 58, train_loss: 0.8812, test_loss: 1.0912, test_f1: 0.4796
 epoch: 59, train_loss: 0.8785, test_loss: 1.0358, test_f1: 0.5163
 epoch: 60, train_loss: 0.8678, test_loss: 1.0058, test_f1: 0.5132
 epoch: 61, train_loss: 0.8835, test_loss: 0.9850, test_f1: 0.4964
 epoch: 62, train_loss: 0.8787, test_loss: 1.0725, test_f1: 0.4828
 epoch: 63, train_loss: 0.8718, test_loss: 1.0856, test_f1: 0.4941
 epoch: 64, train_loss: 0.8665, test_loss: 1.0216, test_f1: 0.4855
 epoch: 65, train_loss: 0.8725, test_loss: 1.1323, test_f1: 0.4755
 epoch: 66, train_loss: 0.8673, test_loss: 1.0010, test_f1: 0.5278
 epoch: 67, train_loss: 0.8745, test_loss: 1.0276, test_f1: 0.5115
 epoch: 68, train_loss: 0.8819, test_loss: 0.9864, test_f1: 0.5207
 epoch: 69, train_loss: 0.8724, test_loss: 1.0213, test_f1: 0.5005
 epoch: 70, train_loss: 0.8555, test_loss: 1.0318, test_f1: 0.4967
 epoch: 71, train_loss: 0.8662, test_loss: 0.9970, test_f1: 0.5191
 epoch: 72, train_loss: 0.8727, test_loss: 1.1407, test_f1: 0.5103
 epoch: 73, train_loss: 0.8739, test_loss: 1.0047, test_f1: 0.5025
 epoch: 74, train_loss: 0.8637, test_loss: 1.0717, test_f1: 0.4727
 epoch: 75, train_loss: 0.8665, test_loss: 1.0280, test_f1: 0.4912
 epoch: 76, train_loss: 0.8524, test_loss: 1.0009, test_f1: 0.4915
 epoch: 77, train_loss: 0.8647, test_loss: 1.0106, test_f1: 0.5112
 epoch: 78, train_loss: 0.8421, test_loss: 1.0061, test_f1: 0.5285
 epoch: 79, train_loss: 0.8465, test_loss: 1.1242, test_f1: 0.5027
 epoch: 80, train_loss: 0.8508, test_loss: 1.0725, test_f1: 0.4963
 epoch: 81, train_loss: 0.8614, test_loss: 1.0502, test_f1: 0.5088
 epoch: 82, train_loss: 0.8534, test_loss: 1.0353, test_f1: 0.4776
 epoch: 83, train_loss: 0.8451, test_loss: 1.1226, test_f1: 0.4815
 epoch: 84, train_loss: 0.8600, test_loss: 1.0796, test_f1: 0.4841
 epoch: 85, train_loss: 0.8339, test_loss: 1.0430, test_f1: 0.4974
 epoch: 86, train_loss: 0.8524, test_loss: 1.0907, test_f1: 0.4766
 epoch: 87, train_loss: 0.8402, test_loss: 1.0554, test_f1: 0.4929
 epoch: 88, train_loss: 0.8484, test_loss: 0.9994, test_f1: 0.5000
 epoch: 89, train_loss: 0.8401, test_loss: 1.0266, test_f1: 0.5001
 epoch: 90, train_loss: 0.8390, test_loss: 0.9686, test_f1: 0.5156
 epoch: 91, train_loss: 0.8377, test_loss: 1.0446, test_f1: 0.4919
 epoch: 92, train_loss: 0.8383, test_loss: 1.1217, test_f1: 0.4756
 epoch: 93, train_loss: 0.8538, test_loss: 1.0548, test_f1: 0.4899
 epoch: 94, train_loss: 0.8587, test_loss: 1.0758, test_f1: 0.4926
 epoch: 95, train_loss: 0.8832, test_loss: 1.0419, test_f1: 0.4757
 epoch: 96, train_loss: 0.8522, test_loss: 0.9842, test_f1: 0.5125
 epoch: 97, train_loss: 0.8400, test_loss: 0.9889, test_f1: 0.5171
 epoch: 98, train_loss: 0.8522, test_loss: 0.9491, test_f1: 0.5247
 epoch: 99, train_loss: 0.8513, test_loss: 0.9576, test_f1: 0.5222
##################ITERATION #9 ****************************************
 epoch: 0, train_loss: 1.2740, test_loss: 1.1921, test_f1: 0.3331
 epoch: 1, train_loss: 1.2105, test_loss: 1.1106, test_f1: 0.4228
 epoch: 2, train_loss: 1.1627, test_loss: 1.0744, test_f1: 0.4406
 epoch: 3, train_loss: 1.1230, test_loss: 1.0445, test_f1: 0.4610
 epoch: 4, train_loss: 1.1011, test_loss: 0.9967, test_f1: 0.5053
 epoch: 5, train_loss: 1.0648, test_loss: 1.0903, test_f1: 0.4568
 epoch: 6, train_loss: 1.0605, test_loss: 0.9894, test_f1: 0.5003
 epoch: 7, train_loss: 1.0255, test_loss: 1.0122, test_f1: 0.4922
 epoch: 8, train_loss: 1.0194, test_loss: 1.0217, test_f1: 0.4747
 epoch: 9, train_loss: 0.9936, test_loss: 1.0138, test_f1: 0.4779
 epoch: 10, train_loss: 0.9969, test_loss: 1.0404, test_f1: 0.4714
 epoch: 11, train_loss: 0.9839, test_loss: 1.0355, test_f1: 0.4629
 epoch: 12, train_loss: 0.9905, test_loss: 1.0142, test_f1: 0.4779
 epoch: 13, train_loss: 0.9799, test_loss: 1.0377, test_f1: 0.4977
 epoch: 14, train_loss: 0.9738, test_loss: 1.0670, test_f1: 0.4726
 epoch: 15, train_loss: 0.9734, test_loss: 1.0264, test_f1: 0.4852
 epoch: 16, train_loss: 0.9736, test_loss: 1.0082, test_f1: 0.4837
 epoch: 17, train_loss: 0.9563, test_loss: 1.0573, test_f1: 0.4643
 epoch: 18, train_loss: 0.9674, test_loss: 0.9990, test_f1: 0.4779
 epoch: 19, train_loss: 0.9582, test_loss: 1.0282, test_f1: 0.4797
 epoch: 20, train_loss: 0.9423, test_loss: 1.0125, test_f1: 0.4788
 epoch: 21, train_loss: 0.9530, test_loss: 0.9863, test_f1: 0.5045
 epoch: 22, train_loss: 0.9710, test_loss: 0.9784, test_f1: 0.5036
 epoch: 23, train_loss: 0.9499, test_loss: 0.9831, test_f1: 0.4737
 epoch: 24, train_loss: 0.9678, test_loss: 0.9865, test_f1: 0.4999
 epoch: 25, train_loss: 0.9560, test_loss: 1.0313, test_f1: 0.4793
 epoch: 26, train_loss: 0.9752, test_loss: 1.1412, test_f1: 0.4646
 epoch: 27, train_loss: 0.9444, test_loss: 0.9357, test_f1: 0.4769
 epoch: 28, train_loss: 0.9395, test_loss: 0.9738, test_f1: 0.5083
 epoch: 29, train_loss: 0.9296, test_loss: 0.9981, test_f1: 0.4696
 epoch: 30, train_loss: 0.9297, test_loss: 0.9979, test_f1: 0.4881
 epoch: 31, train_loss: 0.9533, test_loss: 1.0341, test_f1: 0.4846
 epoch: 32, train_loss: 0.9269, test_loss: 1.0706, test_f1: 0.4766
 epoch: 33, train_loss: 0.9370, test_loss: 1.0827, test_f1: 0.4724
 epoch: 34, train_loss: 0.9246, test_loss: 0.9538, test_f1: 0.5171
 epoch: 35, train_loss: 0.9320, test_loss: 1.1537, test_f1: 0.4835
 epoch: 36, train_loss: 0.9263, test_loss: 1.0304, test_f1: 0.4622
 epoch: 37, train_loss: 0.9187, test_loss: 1.0228, test_f1: 0.5151
 epoch: 38, train_loss: 0.9121, test_loss: 1.0019, test_f1: 0.5068
 epoch: 39, train_loss: 0.9268, test_loss: 0.9840, test_f1: 0.4945
 epoch: 40, train_loss: 0.9233, test_loss: 1.0878, test_f1: 0.4882
 epoch: 41, train_loss: 0.9568, test_loss: 0.9762, test_f1: 0.4958
 epoch: 42, train_loss: 0.9420, test_loss: 1.0410, test_f1: 0.4839
 epoch: 43, train_loss: 0.9422, test_loss: 0.9501, test_f1: 0.5247
 epoch: 44, train_loss: 0.9314, test_loss: 1.0369, test_f1: 0.4970
 epoch: 45, train_loss: 0.9454, test_loss: 0.9758, test_f1: 0.5175
 epoch: 46, train_loss: 0.9300, test_loss: 0.9674, test_f1: 0.5053
 epoch: 47, train_loss: 0.9266, test_loss: 0.9897, test_f1: 0.5274
 epoch: 48, train_loss: 0.9399, test_loss: 0.9542, test_f1: 0.5178
 epoch: 49, train_loss: 0.9299, test_loss: 1.0611, test_f1: 0.4952
 epoch: 50, train_loss: 0.9184, test_loss: 1.1245, test_f1: 0.4897
 epoch: 51, train_loss: 0.8982, test_loss: 0.9748, test_f1: 0.5097
 epoch: 52, train_loss: 0.8980, test_loss: 1.0405, test_f1: 0.4853
 epoch: 53, train_loss: 0.8926, test_loss: 0.9744, test_f1: 0.5090
 epoch: 54, train_loss: 0.8820, test_loss: 1.0161, test_f1: 0.5083
 epoch: 55, train_loss: 0.8887, test_loss: 0.9730, test_f1: 0.5194
 epoch: 56, train_loss: 0.8875, test_loss: 1.1020, test_f1: 0.4979
 epoch: 57, train_loss: 0.8840, test_loss: 1.0195, test_f1: 0.5029
 epoch: 58, train_loss: 0.8842, test_loss: 1.1295, test_f1: 0.4931
 epoch: 59, train_loss: 0.8865, test_loss: 1.0491, test_f1: 0.5002
 epoch: 60, train_loss: 0.8799, test_loss: 0.9848, test_f1: 0.5201
 epoch: 61, train_loss: 0.8858, test_loss: 1.0993, test_f1: 0.5011
 epoch: 62, train_loss: 0.8807, test_loss: 0.9687, test_f1: 0.5087
 epoch: 63, train_loss: 0.8825, test_loss: 1.0604, test_f1: 0.4958
 epoch: 64, train_loss: 0.8899, test_loss: 1.0407, test_f1: 0.4965
 epoch: 65, train_loss: 0.8735, test_loss: 1.0608, test_f1: 0.4813
 epoch: 66, train_loss: 0.8623, test_loss: 1.0903, test_f1: 0.4919
 epoch: 67, train_loss: 0.8613, test_loss: 1.0683, test_f1: 0.4823
 epoch: 68, train_loss: 0.8842, test_loss: 0.9667, test_f1: 0.5025
 epoch: 69, train_loss: 0.8778, test_loss: 1.0111, test_f1: 0.4870
 epoch: 70, train_loss: 0.8636, test_loss: 1.0593, test_f1: 0.4957
 epoch: 71, train_loss: 0.8528, test_loss: 1.0777, test_f1: 0.4933
 epoch: 72, train_loss: 0.8622, test_loss: 0.9837, test_f1: 0.5085
 epoch: 73, train_loss: 0.8715, test_loss: 0.9795, test_f1: 0.5119
 epoch: 74, train_loss: 0.8722, test_loss: 1.0802, test_f1: 0.4912
 epoch: 75, train_loss: 0.8566, test_loss: 0.9668, test_f1: 0.5014
 epoch: 76, train_loss: 0.8595, test_loss: 1.0247, test_f1: 0.4975
 epoch: 77, train_loss: 0.8634, test_loss: 1.0262, test_f1: 0.5011
 epoch: 78, train_loss: 0.8580, test_loss: 1.0677, test_f1: 0.4912
 epoch: 79, train_loss: 0.8562, test_loss: 0.9628, test_f1: 0.5116
 epoch: 80, train_loss: 0.8571, test_loss: 0.9811, test_f1: 0.5232
 epoch: 81, train_loss: 0.8526, test_loss: 0.9739, test_f1: 0.5191
 epoch: 82, train_loss: 0.8516, test_loss: 1.0034, test_f1: 0.5053
 epoch: 83, train_loss: 0.8415, test_loss: 0.9607, test_f1: 0.5137
 epoch: 84, train_loss: 0.8482, test_loss: 1.0237, test_f1: 0.5014
 epoch: 85, train_loss: 0.8476, test_loss: 0.9700, test_f1: 0.4985
 epoch: 86, train_loss: 0.8483, test_loss: 1.0680, test_f1: 0.4903
 epoch: 87, train_loss: 0.8603, test_loss: 0.9609, test_f1: 0.5269
 epoch: 88, train_loss: 0.8428, test_loss: 1.0022, test_f1: 0.5167
 epoch: 89, train_loss: 0.8430, test_loss: 1.0189, test_f1: 0.4962
 epoch: 90, train_loss: 0.8490, test_loss: 0.9512, test_f1: 0.5083
 epoch: 91, train_loss: 0.8459, test_loss: 1.0075, test_f1: 0.5144
 epoch: 92, train_loss: 0.8363, test_loss: 0.9369, test_f1: 0.5213
 epoch: 93, train_loss: 0.8472, test_loss: 1.0379, test_f1: 0.4963
 epoch: 94, train_loss: 0.8446, test_loss: 0.9756, test_f1: 0.5162
 epoch: 95, train_loss: 0.8439, test_loss: 1.0968, test_f1: 0.4952
 epoch: 96, train_loss: 0.8380, test_loss: 1.0260, test_f1: 0.4885
 epoch: 97, train_loss: 0.8542, test_loss: 1.0201, test_f1: 0.5002
 epoch: 98, train_loss: 0.8337, test_loss: 1.0289, test_f1: 0.4862
 epoch: 99, train_loss: 0.8331, test_loss: 0.9819, test_f1: 0.5082

Training completed in 989.76 seconds
Best F1: 0.5727 at epoch 92
Mean F1 across iterations: 0.5476  0.0190
========================FINAL RESULTS================================
FEGIN weighted F1: 0.5727  0.0190
python main.py --data ltspice_examples --representation component_component --model FEGIN --layers 4 --hiddens 16 --batch_size 32 --lr 0.01 --emb_size 512 --epochs 100 --save_appendix component_component_L4_H16_BS32_LR0.01_E512 --no_val
-----



STDERR:
  File "main.py", line 370, in <module>
    main()
  File "main.py", line 254, in main
    dataset = dataset_class(
  File "/home/philip/projects/llm_inference_code_repo/Circuit-Completion-Using-GNNs/component_classification_with_link_prediction_head/evaluation/FEGIN/kernel/circuit_datasets.py", line 15, in __init__
    self.data, self.slices = torch.load(self.processed_paths[0])
  File "/home/philip/.local/lib/python3.8/site-packages/torch/serialization.py", line 1040, in load
    warnings.warn(
  File "/usr/lib/python3.8/warnings.py", line 109, in _showwarnmsg
    sw(msg.message, msg.category, msg.filename, msg.lineno,
  File "main.py", line 47, in warn_with_traceback
    traceback.print_stack(file=log)
/home/philip/projects/llm_inference_code_repo/Circuit-Completion-Using-GNNs/component_classification_with_link_prediction_head/evaluation/FEGIN/kernel/circuit_datasets.py:15: FutureWarning: You are using `torch.load` with `weights_only=False` (the current default value), which uses the default pickle module implicitly. It is possible to construct malicious pickle data which will execute arbitrary code during unpickling (See https://github.com/pytorch/pytorch/blob/main/SECURITY.md#untrusted-models for more details). In a future release, the default value for `weights_only` will be flipped to `True`. This limits the functions that could be executed during unpickling. Arbitrary objects will no longer be allowed to be loaded via this mode unless they are explicitly allowlisted by the user via `torch.serialization.add_safe_globals`. We recommend you start setting `weights_only=True` for any use case where you don't have full control of the loaded file. Please open an issue on GitHub for any issues related to this experimental feature.
  self.data, self.slices = torch.load(self.processed_paths[0])
