STDOUT:
Results will be saved in /home/philip/projects/ltspice_examples_code_repo/Circuit-Completion-Using-GNNs/component_classification_with_link_prediction_head/evaluation/FEGIN/results/model_FEGIN_dataset_ltspice_examples
Command line input: python main.py --data ltspice_examples --representation component_pin --model FEGIN --layers 2 --hiddens 128 --batch_size 32 --lr 0.0001 --emb_size 128 --epochs 100 --save_appendix component_pin_L2_H128_BS32_LR0.0001_E128 --no_val
 is saved.
-----
ltspice_examples - FEGIN
Using 2 layers, 128 hidden units, h = 2
Loading component_pin representation dataset
ENTERED
Training FEGIN on component_pin representation
Train: 3560, Test: 848
##################ITERATION #0 ****************************************
 epoch: 0, train_loss: 1.3326, test_loss: 1.2088, test_f1: 0.3361
 epoch: 1, train_loss: 1.1557, test_loss: 1.0857, test_f1: 0.3445
 epoch: 2, train_loss: 1.0703, test_loss: 1.0530, test_f1: 0.3432
 epoch: 3, train_loss: 1.0374, test_loss: 1.0377, test_f1: 0.3692
 epoch: 4, train_loss: 1.0164, test_loss: 1.0118, test_f1: 0.4259
 epoch: 5, train_loss: 0.9924, test_loss: 1.0053, test_f1: 0.4352
 epoch: 6, train_loss: 0.9768, test_loss: 0.9996, test_f1: 0.4815
 epoch: 7, train_loss: 0.9616, test_loss: 0.9912, test_f1: 0.4913
 epoch: 8, train_loss: 0.9556, test_loss: 0.9867, test_f1: 0.4729
 epoch: 9, train_loss: 0.9316, test_loss: 0.9738, test_f1: 0.4890
 epoch: 10, train_loss: 0.9207, test_loss: 0.9722, test_f1: 0.5070
 epoch: 11, train_loss: 0.8986, test_loss: 0.9896, test_f1: 0.5149
 epoch: 12, train_loss: 0.8885, test_loss: 0.9296, test_f1: 0.5238
 epoch: 13, train_loss: 0.8742, test_loss: 0.9246, test_f1: 0.5280
 epoch: 14, train_loss: 0.8569, test_loss: 0.9047, test_f1: 0.5299
 epoch: 15, train_loss: 0.8418, test_loss: 0.9170, test_f1: 0.5171
 epoch: 16, train_loss: 0.8351, test_loss: 0.8976, test_f1: 0.5302
 epoch: 17, train_loss: 0.8205, test_loss: 0.8815, test_f1: 0.5447
 epoch: 18, train_loss: 0.8143, test_loss: 0.8778, test_f1: 0.5349
 epoch: 19, train_loss: 0.7921, test_loss: 0.8929, test_f1: 0.5212
 epoch: 20, train_loss: 0.7849, test_loss: 0.8838, test_f1: 0.5431
 epoch: 21, train_loss: 0.7812, test_loss: 0.9029, test_f1: 0.5331
 epoch: 22, train_loss: 0.7775, test_loss: 0.8926, test_f1: 0.5435
 epoch: 23, train_loss: 0.7593, test_loss: 0.8786, test_f1: 0.5484
 epoch: 24, train_loss: 0.7475, test_loss: 0.8918, test_f1: 0.5529
 epoch: 25, train_loss: 0.7503, test_loss: 0.8996, test_f1: 0.5243
 epoch: 26, train_loss: 0.7363, test_loss: 0.9089, test_f1: 0.5568
 epoch: 27, train_loss: 0.7266, test_loss: 0.9121, test_f1: 0.5376
 epoch: 28, train_loss: 0.7224, test_loss: 0.9177, test_f1: 0.5688
 epoch: 29, train_loss: 0.7119, test_loss: 0.9014, test_f1: 0.5745
 epoch: 30, train_loss: 0.7127, test_loss: 0.9118, test_f1: 0.5648
 epoch: 31, train_loss: 0.7063, test_loss: 0.9240, test_f1: 0.5577
 epoch: 32, train_loss: 0.7012, test_loss: 0.9210, test_f1: 0.5823
 epoch: 33, train_loss: 0.6855, test_loss: 0.9076, test_f1: 0.5861
 epoch: 34, train_loss: 0.6820, test_loss: 0.9624, test_f1: 0.5664
 epoch: 35, train_loss: 0.6834, test_loss: 0.9115, test_f1: 0.5890
 epoch: 36, train_loss: 0.6703, test_loss: 0.9440, test_f1: 0.5800
 epoch: 37, train_loss: 0.6731, test_loss: 0.9491, test_f1: 0.5855
 epoch: 38, train_loss: 0.6508, test_loss: 0.9484, test_f1: 0.5971
 epoch: 39, train_loss: 0.6596, test_loss: 0.9531, test_f1: 0.5896
 epoch: 40, train_loss: 0.6412, test_loss: 0.9317, test_f1: 0.5843
 epoch: 41, train_loss: 0.6351, test_loss: 0.9389, test_f1: 0.5729
 epoch: 42, train_loss: 0.6363, test_loss: 0.9469, test_f1: 0.5998
 epoch: 43, train_loss: 0.6498, test_loss: 1.0077, test_f1: 0.5884
 epoch: 44, train_loss: 0.6311, test_loss: 0.9825, test_f1: 0.5916
 epoch: 45, train_loss: 0.6162, test_loss: 0.9686, test_f1: 0.6181
 epoch: 46, train_loss: 0.6313, test_loss: 0.9824, test_f1: 0.5894
 epoch: 47, train_loss: 0.6142, test_loss: 1.0146, test_f1: 0.6019
 epoch: 48, train_loss: 0.6102, test_loss: 0.9866, test_f1: 0.5985
 epoch: 49, train_loss: 0.6100, test_loss: 0.9721, test_f1: 0.5820
 epoch: 50, train_loss: 0.6074, test_loss: 0.9909, test_f1: 0.5922
 epoch: 51, train_loss: 0.5985, test_loss: 0.9906, test_f1: 0.6083
 epoch: 52, train_loss: 0.5921, test_loss: 1.0049, test_f1: 0.5968
 epoch: 53, train_loss: 0.5845, test_loss: 1.0142, test_f1: 0.5987
 epoch: 54, train_loss: 0.5800, test_loss: 1.0267, test_f1: 0.6037
 epoch: 55, train_loss: 0.5866, test_loss: 0.9919, test_f1: 0.6030
 epoch: 56, train_loss: 0.5706, test_loss: 1.0332, test_f1: 0.6013
 epoch: 57, train_loss: 0.5610, test_loss: 1.0222, test_f1: 0.6081
 epoch: 58, train_loss: 0.5755, test_loss: 0.9762, test_f1: 0.6055
 epoch: 59, train_loss: 0.5822, test_loss: 1.0651, test_f1: 0.6027
 epoch: 60, train_loss: 0.5679, test_loss: 0.9896, test_f1: 0.6029
 epoch: 61, train_loss: 0.5672, test_loss: 1.0166, test_f1: 0.6170
 epoch: 62, train_loss: 0.5675, test_loss: 0.9914, test_f1: 0.6140
 epoch: 63, train_loss: 0.5615, test_loss: 1.0038, test_f1: 0.6049
 epoch: 64, train_loss: 0.5647, test_loss: 1.0042, test_f1: 0.6199
 epoch: 65, train_loss: 0.5529, test_loss: 1.0552, test_f1: 0.6022
 epoch: 66, train_loss: 0.5438, test_loss: 1.0706, test_f1: 0.6142
 epoch: 67, train_loss: 0.5524, test_loss: 0.9981, test_f1: 0.6299
 epoch: 68, train_loss: 0.5443, test_loss: 1.0913, test_f1: 0.5962
 epoch: 69, train_loss: 0.5334, test_loss: 1.0799, test_f1: 0.5934
 epoch: 70, train_loss: 0.5491, test_loss: 1.0655, test_f1: 0.6044
 epoch: 71, train_loss: 0.5289, test_loss: 1.0557, test_f1: 0.6068
 epoch: 72, train_loss: 0.5393, test_loss: 1.0433, test_f1: 0.6124
 epoch: 73, train_loss: 0.5408, test_loss: 1.0491, test_f1: 0.6335
 epoch: 74, train_loss: 0.5303, test_loss: 1.0723, test_f1: 0.6120
 epoch: 75, train_loss: 0.5330, test_loss: 1.0398, test_f1: 0.6144
 epoch: 76, train_loss: 0.5347, test_loss: 1.0811, test_f1: 0.6188
 epoch: 77, train_loss: 0.5275, test_loss: 1.0961, test_f1: 0.6010
 epoch: 78, train_loss: 0.5292, test_loss: 1.0393, test_f1: 0.6276
 epoch: 79, train_loss: 0.5175, test_loss: 1.0852, test_f1: 0.6391
 epoch: 80, train_loss: 0.5145, test_loss: 1.0863, test_f1: 0.6470
 epoch: 81, train_loss: 0.5073, test_loss: 1.1220, test_f1: 0.6145
 epoch: 82, train_loss: 0.5142, test_loss: 1.0994, test_f1: 0.6019
 epoch: 83, train_loss: 0.5186, test_loss: 1.1170, test_f1: 0.6204
 epoch: 84, train_loss: 0.5125, test_loss: 1.1428, test_f1: 0.6227
 epoch: 85, train_loss: 0.5137, test_loss: 1.1784, test_f1: 0.6310
 epoch: 86, train_loss: 0.5109, test_loss: 1.1111, test_f1: 0.6408
 epoch: 87, train_loss: 0.5138, test_loss: 1.1594, test_f1: 0.6353
 epoch: 88, train_loss: 0.5054, test_loss: 1.1250, test_f1: 0.6194
 epoch: 89, train_loss: 0.5055, test_loss: 1.1451, test_f1: 0.6005
 epoch: 90, train_loss: 0.5110, test_loss: 1.1644, test_f1: 0.6303
 epoch: 91, train_loss: 0.4982, test_loss: 1.1413, test_f1: 0.6234
 epoch: 92, train_loss: 0.4980, test_loss: 1.1607, test_f1: 0.6077
 epoch: 93, train_loss: 0.5043, test_loss: 1.1448, test_f1: 0.6167
 epoch: 94, train_loss: 0.4896, test_loss: 1.1819, test_f1: 0.6086
 epoch: 95, train_loss: 0.5030, test_loss: 1.1524, test_f1: 0.5973
 epoch: 96, train_loss: 0.4961, test_loss: 1.1832, test_f1: 0.6109
 epoch: 97, train_loss: 0.5035, test_loss: 1.1314, test_f1: 0.6093
 epoch: 98, train_loss: 0.4762, test_loss: 1.1821, test_f1: 0.6114
 epoch: 99, train_loss: 0.4960, test_loss: 1.1848, test_f1: 0.6118
##################ITERATION #1 ****************************************
 epoch: 0, train_loss: 1.2213, test_loss: 1.0684, test_f1: 0.4137
 epoch: 1, train_loss: 1.0545, test_loss: 1.0022, test_f1: 0.4798
 epoch: 2, train_loss: 1.0031, test_loss: 0.9777, test_f1: 0.5216
 epoch: 3, train_loss: 0.9672, test_loss: 0.9487, test_f1: 0.5093
 epoch: 4, train_loss: 0.9435, test_loss: 0.9207, test_f1: 0.5095
 epoch: 5, train_loss: 0.9101, test_loss: 0.8947, test_f1: 0.5478
 epoch: 6, train_loss: 0.8950, test_loss: 0.9116, test_f1: 0.5347
 epoch: 7, train_loss: 0.8721, test_loss: 0.8713, test_f1: 0.5366
 epoch: 8, train_loss: 0.8577, test_loss: 0.8572, test_f1: 0.5549
 epoch: 9, train_loss: 0.8426, test_loss: 0.8576, test_f1: 0.5399
 epoch: 10, train_loss: 0.8353, test_loss: 0.8796, test_f1: 0.5635
 epoch: 11, train_loss: 0.8149, test_loss: 0.8442, test_f1: 0.5757
 epoch: 12, train_loss: 0.7898, test_loss: 0.8706, test_f1: 0.5663
 epoch: 13, train_loss: 0.7902, test_loss: 0.8356, test_f1: 0.5658
 epoch: 14, train_loss: 0.7782, test_loss: 0.8305, test_f1: 0.5658
 epoch: 15, train_loss: 0.7627, test_loss: 0.8773, test_f1: 0.5700
 epoch: 16, train_loss: 0.7694, test_loss: 0.8522, test_f1: 0.5720
 epoch: 17, train_loss: 0.7593, test_loss: 0.8453, test_f1: 0.5635
 epoch: 18, train_loss: 0.7490, test_loss: 0.8831, test_f1: 0.5709
 epoch: 19, train_loss: 0.7304, test_loss: 0.8700, test_f1: 0.5666
 epoch: 20, train_loss: 0.7266, test_loss: 0.8941, test_f1: 0.5918
 epoch: 21, train_loss: 0.7225, test_loss: 0.8668, test_f1: 0.5808
 epoch: 22, train_loss: 0.7152, test_loss: 0.8515, test_f1: 0.5783
 epoch: 23, train_loss: 0.7160, test_loss: 0.8472, test_f1: 0.5654
 epoch: 24, train_loss: 0.7009, test_loss: 0.8680, test_f1: 0.6156
 epoch: 25, train_loss: 0.6918, test_loss: 0.8411, test_f1: 0.5992
 epoch: 26, train_loss: 0.6906, test_loss: 0.9147, test_f1: 0.5682
 epoch: 27, train_loss: 0.6800, test_loss: 0.8501, test_f1: 0.5963
 epoch: 28, train_loss: 0.6845, test_loss: 0.8655, test_f1: 0.5905
 epoch: 29, train_loss: 0.6797, test_loss: 0.8910, test_f1: 0.5917
 epoch: 30, train_loss: 0.6744, test_loss: 0.8560, test_f1: 0.6024
 epoch: 31, train_loss: 0.6601, test_loss: 0.8895, test_f1: 0.5985
 epoch: 32, train_loss: 0.6404, test_loss: 0.9424, test_f1: 0.5878
 epoch: 33, train_loss: 0.6549, test_loss: 0.9532, test_f1: 0.6172
 epoch: 34, train_loss: 0.6478, test_loss: 0.9271, test_f1: 0.5864
 epoch: 35, train_loss: 0.6423, test_loss: 0.8854, test_f1: 0.6178
 epoch: 36, train_loss: 0.6297, test_loss: 0.8977, test_f1: 0.6165
 epoch: 37, train_loss: 0.6275, test_loss: 0.8610, test_f1: 0.6212
 epoch: 38, train_loss: 0.6245, test_loss: 0.8767, test_f1: 0.6283
 epoch: 39, train_loss: 0.6162, test_loss: 0.8474, test_f1: 0.6421
 epoch: 40, train_loss: 0.6275, test_loss: 0.9223, test_f1: 0.6204
 epoch: 41, train_loss: 0.6010, test_loss: 0.8468, test_f1: 0.6390
 epoch: 42, train_loss: 0.6006, test_loss: 0.8126, test_f1: 0.6345
 epoch: 43, train_loss: 0.5973, test_loss: 0.8218, test_f1: 0.6380
 epoch: 44, train_loss: 0.5980, test_loss: 0.8419, test_f1: 0.6172
 epoch: 45, train_loss: 0.6043, test_loss: 0.8232, test_f1: 0.6099
 epoch: 46, train_loss: 0.6031, test_loss: 0.9061, test_f1: 0.6218
 epoch: 47, train_loss: 0.5856, test_loss: 0.8423, test_f1: 0.6329
 epoch: 48, train_loss: 0.5828, test_loss: 0.9004, test_f1: 0.6257
 epoch: 49, train_loss: 0.5879, test_loss: 0.8065, test_f1: 0.6615
 epoch: 50, train_loss: 0.5747, test_loss: 0.8524, test_f1: 0.6309
 epoch: 51, train_loss: 0.5667, test_loss: 0.8771, test_f1: 0.6279
 epoch: 52, train_loss: 0.5527, test_loss: 0.7959, test_f1: 0.6388
 epoch: 53, train_loss: 0.5489, test_loss: 0.8961, test_f1: 0.6429
 epoch: 54, train_loss: 0.5471, test_loss: 0.9039, test_f1: 0.6229
 epoch: 55, train_loss: 0.5423, test_loss: 0.8311, test_f1: 0.6382
 epoch: 56, train_loss: 0.5415, test_loss: 0.8467, test_f1: 0.6348
 epoch: 57, train_loss: 0.5385, test_loss: 0.8470, test_f1: 0.6488
 epoch: 58, train_loss: 0.5366, test_loss: 0.9040, test_f1: 0.6483
 epoch: 59, train_loss: 0.5244, test_loss: 0.9042, test_f1: 0.6482
 epoch: 60, train_loss: 0.5427, test_loss: 0.9111, test_f1: 0.6505
 epoch: 61, train_loss: 0.5348, test_loss: 0.8512, test_f1: 0.6467
 epoch: 62, train_loss: 0.5340, test_loss: 0.9152, test_f1: 0.6412
 epoch: 63, train_loss: 0.5214, test_loss: 0.8467, test_f1: 0.6354
 epoch: 64, train_loss: 0.5195, test_loss: 0.9337, test_f1: 0.6433
 epoch: 65, train_loss: 0.5158, test_loss: 0.9411, test_f1: 0.6608
 epoch: 66, train_loss: 0.5149, test_loss: 0.9303, test_f1: 0.6375
 epoch: 67, train_loss: 0.5191, test_loss: 0.9799, test_f1: 0.6425
 epoch: 68, train_loss: 0.5204, test_loss: 0.8713, test_f1: 0.6637
 epoch: 69, train_loss: 0.5193, test_loss: 0.8907, test_f1: 0.6351
 epoch: 70, train_loss: 0.5163, test_loss: 0.9659, test_f1: 0.6351
 epoch: 71, train_loss: 0.5133, test_loss: 0.9612, test_f1: 0.6381
 epoch: 72, train_loss: 0.5051, test_loss: 0.9558, test_f1: 0.6430
 epoch: 73, train_loss: 0.5139, test_loss: 0.9115, test_f1: 0.6390
 epoch: 74, train_loss: 0.5010, test_loss: 0.9484, test_f1: 0.6191
 epoch: 75, train_loss: 0.5052, test_loss: 0.8450, test_f1: 0.6426
 epoch: 76, train_loss: 0.4918, test_loss: 0.9435, test_f1: 0.6376
 epoch: 77, train_loss: 0.4990, test_loss: 0.9574, test_f1: 0.6337
 epoch: 78, train_loss: 0.4889, test_loss: 0.9766, test_f1: 0.6466
 epoch: 79, train_loss: 0.4951, test_loss: 0.8661, test_f1: 0.6453
 epoch: 80, train_loss: 0.4958, test_loss: 0.9111, test_f1: 0.6635
 epoch: 81, train_loss: 0.4807, test_loss: 0.9149, test_f1: 0.6455
 epoch: 82, train_loss: 0.4881, test_loss: 1.0020, test_f1: 0.6412
 epoch: 83, train_loss: 0.4777, test_loss: 0.9449, test_f1: 0.6388
 epoch: 84, train_loss: 0.4906, test_loss: 0.9400, test_f1: 0.6548
 epoch: 85, train_loss: 0.4788, test_loss: 1.0333, test_f1: 0.6458
 epoch: 86, train_loss: 0.4858, test_loss: 0.9678, test_f1: 0.6479
 epoch: 87, train_loss: 0.4779, test_loss: 0.8930, test_f1: 0.6462
 epoch: 88, train_loss: 0.4759, test_loss: 0.9592, test_f1: 0.6508
 epoch: 89, train_loss: 0.4766, test_loss: 0.9391, test_f1: 0.6762
 epoch: 90, train_loss: 0.4714, test_loss: 1.0205, test_f1: 0.6381
 epoch: 91, train_loss: 0.4643, test_loss: 0.9931, test_f1: 0.6291
 epoch: 92, train_loss: 0.4577, test_loss: 0.9738, test_f1: 0.6455
 epoch: 93, train_loss: 0.4667, test_loss: 0.9825, test_f1: 0.6570
 epoch: 94, train_loss: 0.4583, test_loss: 0.9919, test_f1: 0.6435
 epoch: 95, train_loss: 0.4554, test_loss: 0.9991, test_f1: 0.6261
 epoch: 96, train_loss: 0.4812, test_loss: 0.9654, test_f1: 0.6339
 epoch: 97, train_loss: 0.4609, test_loss: 0.9437, test_f1: 0.6436
 epoch: 98, train_loss: 0.4585, test_loss: 0.9679, test_f1: 0.6179
 epoch: 99, train_loss: 0.4658, test_loss: 1.0100, test_f1: 0.6597
##################ITERATION #2 ****************************************
 epoch: 0, train_loss: 1.1688, test_loss: 1.0232, test_f1: 0.4127
 epoch: 1, train_loss: 1.0285, test_loss: 0.9747, test_f1: 0.4880
 epoch: 2, train_loss: 0.9935, test_loss: 0.9794, test_f1: 0.4861
 epoch: 3, train_loss: 0.9605, test_loss: 0.9566, test_f1: 0.5430
 epoch: 4, train_loss: 0.9347, test_loss: 0.9299, test_f1: 0.5084
 epoch: 5, train_loss: 0.9185, test_loss: 0.9189, test_f1: 0.5340
 epoch: 6, train_loss: 0.9044, test_loss: 0.9264, test_f1: 0.5522
 epoch: 7, train_loss: 0.8824, test_loss: 0.9206, test_f1: 0.5435
 epoch: 8, train_loss: 0.8741, test_loss: 0.9109, test_f1: 0.5470
 epoch: 9, train_loss: 0.8541, test_loss: 0.8750, test_f1: 0.5683
 epoch: 10, train_loss: 0.8387, test_loss: 0.8554, test_f1: 0.5613
 epoch: 11, train_loss: 0.8279, test_loss: 0.8502, test_f1: 0.5890
 epoch: 12, train_loss: 0.8122, test_loss: 0.8379, test_f1: 0.5778
 epoch: 13, train_loss: 0.8022, test_loss: 0.8584, test_f1: 0.5535
 epoch: 14, train_loss: 0.7989, test_loss: 0.8353, test_f1: 0.5749
 epoch: 15, train_loss: 0.7714, test_loss: 0.8622, test_f1: 0.5642
 epoch: 16, train_loss: 0.7776, test_loss: 0.8076, test_f1: 0.5813
 epoch: 17, train_loss: 0.7740, test_loss: 0.8500, test_f1: 0.5659
 epoch: 18, train_loss: 0.7616, test_loss: 0.8391, test_f1: 0.5918
 epoch: 19, train_loss: 0.7445, test_loss: 0.8102, test_f1: 0.5928
 epoch: 20, train_loss: 0.7328, test_loss: 0.8296, test_f1: 0.5994
 epoch: 21, train_loss: 0.7386, test_loss: 0.8343, test_f1: 0.5841
 epoch: 22, train_loss: 0.7226, test_loss: 0.8068, test_f1: 0.5880
 epoch: 23, train_loss: 0.7168, test_loss: 0.8363, test_f1: 0.5802
 epoch: 24, train_loss: 0.7138, test_loss: 0.8189, test_f1: 0.6059
 epoch: 25, train_loss: 0.7098, test_loss: 0.8378, test_f1: 0.5914
 epoch: 26, train_loss: 0.7043, test_loss: 0.8350, test_f1: 0.5947
 epoch: 27, train_loss: 0.6927, test_loss: 0.8091, test_f1: 0.6254
 epoch: 28, train_loss: 0.6909, test_loss: 0.8159, test_f1: 0.6015
 epoch: 29, train_loss: 0.6764, test_loss: 0.7758, test_f1: 0.5913
 epoch: 30, train_loss: 0.6687, test_loss: 0.8026, test_f1: 0.5949
 epoch: 31, train_loss: 0.6684, test_loss: 0.7920, test_f1: 0.6202
 epoch: 32, train_loss: 0.6665, test_loss: 0.7721, test_f1: 0.6137
 epoch: 33, train_loss: 0.6607, test_loss: 0.8297, test_f1: 0.6221
 epoch: 34, train_loss: 0.6439, test_loss: 0.7841, test_f1: 0.6364
 epoch: 35, train_loss: 0.6431, test_loss: 0.7965, test_f1: 0.6159
 epoch: 36, train_loss: 0.6465, test_loss: 0.7898, test_f1: 0.6515
 epoch: 37, train_loss: 0.6303, test_loss: 0.7928, test_f1: 0.6161
 epoch: 38, train_loss: 0.6280, test_loss: 0.7850, test_f1: 0.6390
 epoch: 39, train_loss: 0.6233, test_loss: 0.8390, test_f1: 0.6356
 epoch: 40, train_loss: 0.6182, test_loss: 0.8590, test_f1: 0.6096
 epoch: 41, train_loss: 0.6191, test_loss: 0.7836, test_f1: 0.6317
 epoch: 42, train_loss: 0.6153, test_loss: 0.8581, test_f1: 0.6094
 epoch: 43, train_loss: 0.6080, test_loss: 0.8370, test_f1: 0.6366
 epoch: 44, train_loss: 0.6079, test_loss: 0.8158, test_f1: 0.6516
 epoch: 45, train_loss: 0.6043, test_loss: 0.8615, test_f1: 0.6338
 epoch: 46, train_loss: 0.5964, test_loss: 0.8631, test_f1: 0.6486
 epoch: 47, train_loss: 0.5760, test_loss: 0.8535, test_f1: 0.6437
 epoch: 48, train_loss: 0.5870, test_loss: 0.8593, test_f1: 0.6176
 epoch: 49, train_loss: 0.5757, test_loss: 0.8884, test_f1: 0.6212
 epoch: 50, train_loss: 0.5836, test_loss: 0.8852, test_f1: 0.6259
 epoch: 51, train_loss: 0.5540, test_loss: 0.8787, test_f1: 0.6377
 epoch: 52, train_loss: 0.5505, test_loss: 0.8674, test_f1: 0.6394
 epoch: 53, train_loss: 0.5478, test_loss: 0.8797, test_f1: 0.6389
 epoch: 54, train_loss: 0.5463, test_loss: 0.8561, test_f1: 0.6545
 epoch: 55, train_loss: 0.5415, test_loss: 0.8385, test_f1: 0.6482
 epoch: 56, train_loss: 0.5359, test_loss: 0.8596, test_f1: 0.6692
 epoch: 57, train_loss: 0.5368, test_loss: 0.8615, test_f1: 0.6633
 epoch: 58, train_loss: 0.5250, test_loss: 0.8549, test_f1: 0.6236
 epoch: 59, train_loss: 0.5374, test_loss: 0.8724, test_f1: 0.6335
 epoch: 60, train_loss: 0.5278, test_loss: 0.9002, test_f1: 0.6237
 epoch: 61, train_loss: 0.5347, test_loss: 0.9017, test_f1: 0.6399
 epoch: 62, train_loss: 0.5252, test_loss: 0.9451, test_f1: 0.6422
 epoch: 63, train_loss: 0.5310, test_loss: 0.8797, test_f1: 0.6373
 epoch: 64, train_loss: 0.5227, test_loss: 0.9137, test_f1: 0.6350
 epoch: 65, train_loss: 0.5179, test_loss: 0.8991, test_f1: 0.6517
 epoch: 66, train_loss: 0.5269, test_loss: 0.9109, test_f1: 0.6625
 epoch: 67, train_loss: 0.5093, test_loss: 0.9350, test_f1: 0.6486
 epoch: 68, train_loss: 0.5189, test_loss: 0.8655, test_f1: 0.6613
 epoch: 69, train_loss: 0.5053, test_loss: 0.9260, test_f1: 0.6326
 epoch: 70, train_loss: 0.5058, test_loss: 0.8887, test_f1: 0.6398
 epoch: 71, train_loss: 0.5104, test_loss: 0.8838, test_f1: 0.6471
 epoch: 72, train_loss: 0.5148, test_loss: 0.9190, test_f1: 0.6533
 epoch: 73, train_loss: 0.4991, test_loss: 0.9062, test_f1: 0.6653
 epoch: 74, train_loss: 0.4982, test_loss: 0.9081, test_f1: 0.6553
 epoch: 75, train_loss: 0.4988, test_loss: 0.9256, test_f1: 0.6533
 epoch: 76, train_loss: 0.4895, test_loss: 0.8824, test_f1: 0.6748
 epoch: 77, train_loss: 0.4846, test_loss: 0.9102, test_f1: 0.6436
 epoch: 78, train_loss: 0.5016, test_loss: 0.8729, test_f1: 0.6514
 epoch: 79, train_loss: 0.4862, test_loss: 0.9493, test_f1: 0.6353
 epoch: 80, train_loss: 0.4940, test_loss: 0.9769, test_f1: 0.6308
 epoch: 81, train_loss: 0.4811, test_loss: 0.9361, test_f1: 0.6502
 epoch: 82, train_loss: 0.4807, test_loss: 0.9376, test_f1: 0.6267
 epoch: 83, train_loss: 0.4704, test_loss: 0.9415, test_f1: 0.6414
 epoch: 84, train_loss: 0.4800, test_loss: 0.9828, test_f1: 0.6444
 epoch: 85, train_loss: 0.4715, test_loss: 0.9319, test_f1: 0.6330
 epoch: 86, train_loss: 0.4729, test_loss: 1.0312, test_f1: 0.6205
 epoch: 87, train_loss: 0.4783, test_loss: 0.9602, test_f1: 0.6401
 epoch: 88, train_loss: 0.4722, test_loss: 1.0114, test_f1: 0.6241
 epoch: 89, train_loss: 0.4591, test_loss: 0.9975, test_f1: 0.6403
 epoch: 90, train_loss: 0.4636, test_loss: 0.9608, test_f1: 0.6582
 epoch: 91, train_loss: 0.4578, test_loss: 1.1084, test_f1: 0.6322
 epoch: 92, train_loss: 0.4604, test_loss: 1.0204, test_f1: 0.6301
 epoch: 93, train_loss: 0.4519, test_loss: 0.9934, test_f1: 0.6401
 epoch: 94, train_loss: 0.4532, test_loss: 1.0120, test_f1: 0.6367
 epoch: 95, train_loss: 0.4686, test_loss: 0.9660, test_f1: 0.6431
 epoch: 96, train_loss: 0.4641, test_loss: 1.0197, test_f1: 0.6530
 epoch: 97, train_loss: 0.4624, test_loss: 0.9906, test_f1: 0.6350
 epoch: 98, train_loss: 0.4514, test_loss: 1.0443, test_f1: 0.6425
 epoch: 99, train_loss: 0.4577, test_loss: 1.0703, test_f1: 0.6295
##################ITERATION #3 ****************************************
 epoch: 0, train_loss: 1.1416, test_loss: 0.9860, test_f1: 0.5043
 epoch: 1, train_loss: 1.0256, test_loss: 0.9509, test_f1: 0.5390
 epoch: 2, train_loss: 0.9901, test_loss: 0.9372, test_f1: 0.5231
 epoch: 3, train_loss: 0.9607, test_loss: 0.9174, test_f1: 0.5554
 epoch: 4, train_loss: 0.9351, test_loss: 0.9003, test_f1: 0.5424
 epoch: 5, train_loss: 0.9276, test_loss: 0.9105, test_f1: 0.5399
 epoch: 6, train_loss: 0.9055, test_loss: 0.8917, test_f1: 0.5731
 epoch: 7, train_loss: 0.8905, test_loss: 0.9008, test_f1: 0.5728
 epoch: 8, train_loss: 0.8872, test_loss: 0.8628, test_f1: 0.5536
 epoch: 9, train_loss: 0.8756, test_loss: 0.8726, test_f1: 0.5666
 epoch: 10, train_loss: 0.8607, test_loss: 0.8555, test_f1: 0.5824
 epoch: 11, train_loss: 0.8435, test_loss: 0.8575, test_f1: 0.5928
 epoch: 12, train_loss: 0.8350, test_loss: 0.8553, test_f1: 0.5738
 epoch: 13, train_loss: 0.8150, test_loss: 0.8431, test_f1: 0.5977
 epoch: 14, train_loss: 0.8156, test_loss: 0.8634, test_f1: 0.6170
 epoch: 15, train_loss: 0.8037, test_loss: 0.8388, test_f1: 0.6124
 epoch: 16, train_loss: 0.7910, test_loss: 0.8311, test_f1: 0.6127
 epoch: 17, train_loss: 0.7785, test_loss: 0.8204, test_f1: 0.5981
 epoch: 18, train_loss: 0.7712, test_loss: 0.8148, test_f1: 0.5918
 epoch: 19, train_loss: 0.7618, test_loss: 0.9365, test_f1: 0.5686
 epoch: 20, train_loss: 0.7601, test_loss: 0.8332, test_f1: 0.6079
 epoch: 21, train_loss: 0.7439, test_loss: 0.8178, test_f1: 0.6104
 epoch: 22, train_loss: 0.7372, test_loss: 0.8457, test_f1: 0.6029
 epoch: 23, train_loss: 0.7417, test_loss: 0.8406, test_f1: 0.6071
 epoch: 24, train_loss: 0.7230, test_loss: 0.8444, test_f1: 0.6036
 epoch: 25, train_loss: 0.7234, test_loss: 0.8460, test_f1: 0.5977
 epoch: 26, train_loss: 0.6997, test_loss: 0.8274, test_f1: 0.6253
 epoch: 27, train_loss: 0.6926, test_loss: 0.8203, test_f1: 0.6221
 epoch: 28, train_loss: 0.6965, test_loss: 0.8341, test_f1: 0.6416
 epoch: 29, train_loss: 0.6983, test_loss: 0.8210, test_f1: 0.6136
 epoch: 30, train_loss: 0.6891, test_loss: 0.8272, test_f1: 0.6312
 epoch: 31, train_loss: 0.6847, test_loss: 0.8589, test_f1: 0.6117
 epoch: 32, train_loss: 0.6702, test_loss: 0.8503, test_f1: 0.6131
 epoch: 33, train_loss: 0.6638, test_loss: 0.7972, test_f1: 0.6133
 epoch: 34, train_loss: 0.6644, test_loss: 0.8304, test_f1: 0.6152
 epoch: 35, train_loss: 0.6695, test_loss: 0.8019, test_f1: 0.6185
 epoch: 36, train_loss: 0.6588, test_loss: 0.8195, test_f1: 0.6405
 epoch: 37, train_loss: 0.6561, test_loss: 0.8462, test_f1: 0.6330
 epoch: 38, train_loss: 0.6360, test_loss: 0.8636, test_f1: 0.6348
 epoch: 39, train_loss: 0.6352, test_loss: 0.8484, test_f1: 0.6218
 epoch: 40, train_loss: 0.6387, test_loss: 0.7731, test_f1: 0.6440
 epoch: 41, train_loss: 0.6257, test_loss: 0.8242, test_f1: 0.6246
 epoch: 42, train_loss: 0.6181, test_loss: 0.7831, test_f1: 0.6413
 epoch: 43, train_loss: 0.6185, test_loss: 0.9281, test_f1: 0.6239
 epoch: 44, train_loss: 0.6080, test_loss: 0.8844, test_f1: 0.6334
 epoch: 45, train_loss: 0.6116, test_loss: 0.9315, test_f1: 0.6201
 epoch: 46, train_loss: 0.5943, test_loss: 0.8786, test_f1: 0.6282
 epoch: 47, train_loss: 0.6062, test_loss: 0.8382, test_f1: 0.6239
 epoch: 48, train_loss: 0.6086, test_loss: 0.8675, test_f1: 0.6345
 epoch: 49, train_loss: 0.5875, test_loss: 0.8745, test_f1: 0.6377
 epoch: 50, train_loss: 0.5993, test_loss: 0.8450, test_f1: 0.6193
 epoch: 51, train_loss: 0.5730, test_loss: 0.8938, test_f1: 0.6329
 epoch: 52, train_loss: 0.5668, test_loss: 0.8894, test_f1: 0.6216
 epoch: 53, train_loss: 0.5553, test_loss: 0.7994, test_f1: 0.6255
 epoch: 54, train_loss: 0.5582, test_loss: 0.8428, test_f1: 0.6465
 epoch: 55, train_loss: 0.5599, test_loss: 0.9063, test_f1: 0.6164
 epoch: 56, train_loss: 0.5519, test_loss: 0.9324, test_f1: 0.6244
 epoch: 57, train_loss: 0.5512, test_loss: 0.8552, test_f1: 0.6395
 epoch: 58, train_loss: 0.5620, test_loss: 0.8628, test_f1: 0.6481
 epoch: 59, train_loss: 0.5450, test_loss: 0.9204, test_f1: 0.6283
 epoch: 60, train_loss: 0.5429, test_loss: 0.9095, test_f1: 0.6359
 epoch: 61, train_loss: 0.5550, test_loss: 0.9392, test_f1: 0.6339
 epoch: 62, train_loss: 0.5381, test_loss: 0.8961, test_f1: 0.6362
 epoch: 63, train_loss: 0.5348, test_loss: 0.9191, test_f1: 0.6397
 epoch: 64, train_loss: 0.5291, test_loss: 0.8187, test_f1: 0.6384
 epoch: 65, train_loss: 0.5414, test_loss: 0.9329, test_f1: 0.6308
 epoch: 66, train_loss: 0.5280, test_loss: 0.9268, test_f1: 0.6304
 epoch: 67, train_loss: 0.5372, test_loss: 0.8620, test_f1: 0.6298
 epoch: 68, train_loss: 0.5272, test_loss: 0.9281, test_f1: 0.6278
 epoch: 69, train_loss: 0.5259, test_loss: 0.9269, test_f1: 0.6315
 epoch: 70, train_loss: 0.5224, test_loss: 0.9004, test_f1: 0.6360
 epoch: 71, train_loss: 0.5227, test_loss: 0.8476, test_f1: 0.6366
 epoch: 72, train_loss: 0.5176, test_loss: 0.9657, test_f1: 0.6247
 epoch: 73, train_loss: 0.5102, test_loss: 0.9343, test_f1: 0.6401
 epoch: 74, train_loss: 0.5160, test_loss: 0.8977, test_f1: 0.6321
 epoch: 75, train_loss: 0.5141, test_loss: 0.9405, test_f1: 0.6343
 epoch: 76, train_loss: 0.5147, test_loss: 0.9930, test_f1: 0.6343
 epoch: 77, train_loss: 0.5119, test_loss: 0.9408, test_f1: 0.6398
 epoch: 78, train_loss: 0.5003, test_loss: 0.9119, test_f1: 0.6309
 epoch: 79, train_loss: 0.4950, test_loss: 1.0415, test_f1: 0.6205
 epoch: 80, train_loss: 0.4940, test_loss: 1.0060, test_f1: 0.6355
 epoch: 81, train_loss: 0.4969, test_loss: 0.9953, test_f1: 0.6378
 epoch: 82, train_loss: 0.4971, test_loss: 1.0430, test_f1: 0.6370
 epoch: 83, train_loss: 0.4890, test_loss: 0.9951, test_f1: 0.6309
 epoch: 84, train_loss: 0.4913, test_loss: 1.0535, test_f1: 0.6398
 epoch: 85, train_loss: 0.4915, test_loss: 1.0097, test_f1: 0.6562
 epoch: 86, train_loss: 0.4817, test_loss: 0.9710, test_f1: 0.6380
 epoch: 87, train_loss: 0.4861, test_loss: 0.9334, test_f1: 0.6395
 epoch: 88, train_loss: 0.4838, test_loss: 1.0167, test_f1: 0.6315
 epoch: 89, train_loss: 0.4874, test_loss: 0.9730, test_f1: 0.6516
 epoch: 90, train_loss: 0.4844, test_loss: 1.0098, test_f1: 0.6417
 epoch: 91, train_loss: 0.4797, test_loss: 0.9973, test_f1: 0.6417
 epoch: 92, train_loss: 0.4643, test_loss: 1.0480, test_f1: 0.6450
 epoch: 93, train_loss: 0.4765, test_loss: 0.9899, test_f1: 0.6441
 epoch: 94, train_loss: 0.4834, test_loss: 0.9839, test_f1: 0.6475
 epoch: 95, train_loss: 0.4755, test_loss: 0.9985, test_f1: 0.6358
 epoch: 96, train_loss: 0.4704, test_loss: 1.0114, test_f1: 0.6621
 epoch: 97, train_loss: 0.4621, test_loss: 0.9821, test_f1: 0.6429
 epoch: 98, train_loss: 0.4667, test_loss: 0.9976, test_f1: 0.6446
 epoch: 99, train_loss: 0.4607, test_loss: 1.0538, test_f1: 0.6501
##################ITERATION #4 ****************************************
 epoch: 0, train_loss: 1.1755, test_loss: 0.9948, test_f1: 0.5249
 epoch: 1, train_loss: 1.0383, test_loss: 0.9704, test_f1: 0.5297
 epoch: 2, train_loss: 0.9936, test_loss: 0.9526, test_f1: 0.5318
 epoch: 3, train_loss: 0.9700, test_loss: 0.9384, test_f1: 0.5644
 epoch: 4, train_loss: 0.9371, test_loss: 0.9166, test_f1: 0.5494
 epoch: 5, train_loss: 0.9310, test_loss: 0.9204, test_f1: 0.5556
 epoch: 6, train_loss: 0.8959, test_loss: 0.9271, test_f1: 0.5491
 epoch: 7, train_loss: 0.8803, test_loss: 0.8949, test_f1: 0.5590
 epoch: 8, train_loss: 0.8739, test_loss: 0.8919, test_f1: 0.5524
 epoch: 9, train_loss: 0.8619, test_loss: 0.8767, test_f1: 0.5876
 epoch: 10, train_loss: 0.8366, test_loss: 0.8751, test_f1: 0.5718
 epoch: 11, train_loss: 0.8424, test_loss: 0.8739, test_f1: 0.5480
 epoch: 12, train_loss: 0.8034, test_loss: 0.8814, test_f1: 0.6078
 epoch: 13, train_loss: 0.7995, test_loss: 0.9056, test_f1: 0.5916
 epoch: 14, train_loss: 0.7962, test_loss: 0.8245, test_f1: 0.6041
 epoch: 15, train_loss: 0.7826, test_loss: 0.8497, test_f1: 0.6173
 epoch: 16, train_loss: 0.7702, test_loss: 0.8531, test_f1: 0.6128
 epoch: 17, train_loss: 0.7669, test_loss: 0.8359, test_f1: 0.5748
 epoch: 18, train_loss: 0.7584, test_loss: 0.8496, test_f1: 0.6178
 epoch: 19, train_loss: 0.7523, test_loss: 0.8343, test_f1: 0.6222
 epoch: 20, train_loss: 0.7433, test_loss: 0.8155, test_f1: 0.6384
 epoch: 21, train_loss: 0.7346, test_loss: 0.8132, test_f1: 0.6367
 epoch: 22, train_loss: 0.7340, test_loss: 0.7868, test_f1: 0.6304
 epoch: 23, train_loss: 0.7152, test_loss: 0.8055, test_f1: 0.6364
 epoch: 24, train_loss: 0.7084, test_loss: 0.8158, test_f1: 0.6119
 epoch: 25, train_loss: 0.7004, test_loss: 0.8281, test_f1: 0.6398
 epoch: 26, train_loss: 0.6930, test_loss: 0.8188, test_f1: 0.6525
 epoch: 27, train_loss: 0.6907, test_loss: 0.8347, test_f1: 0.6241
 epoch: 28, train_loss: 0.6794, test_loss: 0.8232, test_f1: 0.6443
 epoch: 29, train_loss: 0.6694, test_loss: 0.8168, test_f1: 0.6282
 epoch: 30, train_loss: 0.6748, test_loss: 0.8317, test_f1: 0.6298
 epoch: 31, train_loss: 0.6601, test_loss: 0.8412, test_f1: 0.6448
 epoch: 32, train_loss: 0.6801, test_loss: 0.8026, test_f1: 0.6518
 epoch: 33, train_loss: 0.6552, test_loss: 0.8064, test_f1: 0.6394
 epoch: 34, train_loss: 0.6471, test_loss: 0.8128, test_f1: 0.6505
 epoch: 35, train_loss: 0.6493, test_loss: 0.8306, test_f1: 0.6517
 epoch: 36, train_loss: 0.6401, test_loss: 0.8502, test_f1: 0.6290
 epoch: 37, train_loss: 0.6344, test_loss: 0.8166, test_f1: 0.6545
 epoch: 38, train_loss: 0.6400, test_loss: 0.8117, test_f1: 0.6515
 epoch: 39, train_loss: 0.6233, test_loss: 0.8362, test_f1: 0.6533
 epoch: 40, train_loss: 0.6077, test_loss: 0.7978, test_f1: 0.6792
 epoch: 41, train_loss: 0.6168, test_loss: 0.8334, test_f1: 0.6381
 epoch: 42, train_loss: 0.6067, test_loss: 0.8196, test_f1: 0.6582
 epoch: 43, train_loss: 0.6087, test_loss: 0.8676, test_f1: 0.6587
 epoch: 44, train_loss: 0.6009, test_loss: 0.8370, test_f1: 0.6575
 epoch: 45, train_loss: 0.5857, test_loss: 0.8173, test_f1: 0.6737
 epoch: 46, train_loss: 0.5845, test_loss: 0.8635, test_f1: 0.6711
 epoch: 47, train_loss: 0.5782, test_loss: 0.8315, test_f1: 0.6603
 epoch: 48, train_loss: 0.5920, test_loss: 0.8731, test_f1: 0.6408
 epoch: 49, train_loss: 0.5830, test_loss: 0.8634, test_f1: 0.6539
 epoch: 50, train_loss: 0.5726, test_loss: 0.8702, test_f1: 0.6460
 epoch: 51, train_loss: 0.5604, test_loss: 0.8253, test_f1: 0.6558
 epoch: 52, train_loss: 0.5625, test_loss: 0.8318, test_f1: 0.6758
 epoch: 53, train_loss: 0.5431, test_loss: 0.8252, test_f1: 0.6741
 epoch: 54, train_loss: 0.5441, test_loss: 0.8516, test_f1: 0.6730
 epoch: 55, train_loss: 0.5519, test_loss: 0.8370, test_f1: 0.6790
 epoch: 56, train_loss: 0.5430, test_loss: 0.8396, test_f1: 0.6714
 epoch: 57, train_loss: 0.5316, test_loss: 0.8558, test_f1: 0.6583
 epoch: 58, train_loss: 0.5321, test_loss: 0.8537, test_f1: 0.6810
 epoch: 59, train_loss: 0.5378, test_loss: 0.8505, test_f1: 0.6763
 epoch: 60, train_loss: 0.5257, test_loss: 0.8806, test_f1: 0.6619
 epoch: 61, train_loss: 0.5437, test_loss: 0.8509, test_f1: 0.6409
 epoch: 62, train_loss: 0.5340, test_loss: 0.8495, test_f1: 0.6648
 epoch: 63, train_loss: 0.5392, test_loss: 0.8640, test_f1: 0.6496
 epoch: 64, train_loss: 0.5251, test_loss: 0.8762, test_f1: 0.6540
 epoch: 65, train_loss: 0.5291, test_loss: 0.8419, test_f1: 0.6780
 epoch: 66, train_loss: 0.5230, test_loss: 0.8432, test_f1: 0.6795
 epoch: 67, train_loss: 0.5193, test_loss: 0.8752, test_f1: 0.6583
 epoch: 68, train_loss: 0.5119, test_loss: 0.8634, test_f1: 0.6543
 epoch: 69, train_loss: 0.4978, test_loss: 0.9027, test_f1: 0.6586
 epoch: 70, train_loss: 0.5239, test_loss: 0.8334, test_f1: 0.6570
 epoch: 71, train_loss: 0.5073, test_loss: 0.8673, test_f1: 0.6672
 epoch: 72, train_loss: 0.5061, test_loss: 0.8652, test_f1: 0.6789
 epoch: 73, train_loss: 0.5158, test_loss: 0.8955, test_f1: 0.6834
 epoch: 74, train_loss: 0.5166, test_loss: 0.8900, test_f1: 0.6622
 epoch: 75, train_loss: 0.4936, test_loss: 0.9200, test_f1: 0.6573
 epoch: 76, train_loss: 0.4873, test_loss: 0.9184, test_f1: 0.6535
 epoch: 77, train_loss: 0.4925, test_loss: 0.9175, test_f1: 0.6558
 epoch: 78, train_loss: 0.4869, test_loss: 0.9292, test_f1: 0.6542
 epoch: 79, train_loss: 0.4879, test_loss: 0.9583, test_f1: 0.6452
 epoch: 80, train_loss: 0.4976, test_loss: 0.9144, test_f1: 0.6830
 epoch: 81, train_loss: 0.4899, test_loss: 0.9428, test_f1: 0.6805
 epoch: 82, train_loss: 0.4850, test_loss: 0.9647, test_f1: 0.6672
 epoch: 83, train_loss: 0.4796, test_loss: 0.9342, test_f1: 0.6644
 epoch: 84, train_loss: 0.4738, test_loss: 0.9545, test_f1: 0.6636
 epoch: 85, train_loss: 0.4646, test_loss: 0.9575, test_f1: 0.6623
 epoch: 86, train_loss: 0.4850, test_loss: 0.9332, test_f1: 0.6586
 epoch: 87, train_loss: 0.4714, test_loss: 0.8935, test_f1: 0.6649
 epoch: 88, train_loss: 0.4755, test_loss: 0.9310, test_f1: 0.6799
 epoch: 89, train_loss: 0.4576, test_loss: 0.9295, test_f1: 0.6773
 epoch: 90, train_loss: 0.4684, test_loss: 0.9466, test_f1: 0.6616
 epoch: 91, train_loss: 0.4586, test_loss: 0.9713, test_f1: 0.6441
 epoch: 92, train_loss: 0.4769, test_loss: 0.9421, test_f1: 0.6540
 epoch: 93, train_loss: 0.4587, test_loss: 0.9168, test_f1: 0.6689
 epoch: 94, train_loss: 0.4673, test_loss: 0.9745, test_f1: 0.6512
 epoch: 95, train_loss: 0.4641, test_loss: 0.9245, test_f1: 0.6723
 epoch: 96, train_loss: 0.4433, test_loss: 0.9284, test_f1: 0.6836
 epoch: 97, train_loss: 0.4693, test_loss: 0.9490, test_f1: 0.6824
 epoch: 98, train_loss: 0.4591, test_loss: 0.9597, test_f1: 0.6528
 epoch: 99, train_loss: 0.4547, test_loss: 0.9802, test_f1: 0.6600
##################ITERATION #5 ****************************************
 epoch: 0, train_loss: 1.1640, test_loss: 0.9669, test_f1: 0.4946
 epoch: 1, train_loss: 1.0266, test_loss: 0.9509, test_f1: 0.4804
 epoch: 2, train_loss: 0.9910, test_loss: 0.9311, test_f1: 0.5362
 epoch: 3, train_loss: 0.9669, test_loss: 0.9370, test_f1: 0.5108
 epoch: 4, train_loss: 0.9346, test_loss: 0.9157, test_f1: 0.5428
 epoch: 5, train_loss: 0.9293, test_loss: 0.8934, test_f1: 0.5611
 epoch: 6, train_loss: 0.8991, test_loss: 0.8717, test_f1: 0.5589
 epoch: 7, train_loss: 0.8838, test_loss: 0.8778, test_f1: 0.5736
 epoch: 8, train_loss: 0.8709, test_loss: 0.9021, test_f1: 0.5312
 epoch: 9, train_loss: 0.8530, test_loss: 0.8874, test_f1: 0.5593
 epoch: 10, train_loss: 0.8382, test_loss: 0.8662, test_f1: 0.5695
 epoch: 11, train_loss: 0.8414, test_loss: 0.8605, test_f1: 0.5986
 epoch: 12, train_loss: 0.8118, test_loss: 0.8744, test_f1: 0.5964
 epoch: 13, train_loss: 0.8074, test_loss: 0.8459, test_f1: 0.5950
 epoch: 14, train_loss: 0.7944, test_loss: 0.8427, test_f1: 0.6108
 epoch: 15, train_loss: 0.7946, test_loss: 0.8270, test_f1: 0.6159
 epoch: 16, train_loss: 0.7805, test_loss: 0.8359, test_f1: 0.6162
 epoch: 17, train_loss: 0.7685, test_loss: 0.8200, test_f1: 0.6120
 epoch: 18, train_loss: 0.7651, test_loss: 0.8587, test_f1: 0.6170
 epoch: 19, train_loss: 0.7568, test_loss: 0.8472, test_f1: 0.6184
 epoch: 20, train_loss: 0.7321, test_loss: 0.8339, test_f1: 0.6222
 epoch: 21, train_loss: 0.7371, test_loss: 0.8452, test_f1: 0.6112
 epoch: 22, train_loss: 0.7315, test_loss: 0.8307, test_f1: 0.6132
 epoch: 23, train_loss: 0.7162, test_loss: 0.8349, test_f1: 0.6190
 epoch: 24, train_loss: 0.7104, test_loss: 0.8562, test_f1: 0.6183
 epoch: 25, train_loss: 0.7099, test_loss: 0.8333, test_f1: 0.6490
 epoch: 26, train_loss: 0.7051, test_loss: 0.8221, test_f1: 0.6427
 epoch: 27, train_loss: 0.6975, test_loss: 0.8110, test_f1: 0.6262
 epoch: 28, train_loss: 0.6778, test_loss: 0.8324, test_f1: 0.6289
 epoch: 29, train_loss: 0.6819, test_loss: 0.8023, test_f1: 0.6517
 epoch: 30, train_loss: 0.6723, test_loss: 0.8291, test_f1: 0.6303
 epoch: 31, train_loss: 0.6617, test_loss: 0.8519, test_f1: 0.6099
 epoch: 32, train_loss: 0.6544, test_loss: 0.8210, test_f1: 0.6495
 epoch: 33, train_loss: 0.6685, test_loss: 0.8305, test_f1: 0.6237
 epoch: 34, train_loss: 0.6611, test_loss: 0.7945, test_f1: 0.6382
 epoch: 35, train_loss: 0.6552, test_loss: 0.8302, test_f1: 0.6511
 epoch: 36, train_loss: 0.6469, test_loss: 0.8020, test_f1: 0.6376
 epoch: 37, train_loss: 0.6564, test_loss: 0.7978, test_f1: 0.6491
 epoch: 38, train_loss: 0.6397, test_loss: 0.8304, test_f1: 0.6279
 epoch: 39, train_loss: 0.6465, test_loss: 0.8354, test_f1: 0.6300
 epoch: 40, train_loss: 0.6304, test_loss: 0.7772, test_f1: 0.6490
 epoch: 41, train_loss: 0.6223, test_loss: 0.8074, test_f1: 0.6669
 epoch: 42, train_loss: 0.6142, test_loss: 0.7646, test_f1: 0.6570
 epoch: 43, train_loss: 0.6119, test_loss: 0.8353, test_f1: 0.6489
 epoch: 44, train_loss: 0.6097, test_loss: 0.8305, test_f1: 0.6363
 epoch: 45, train_loss: 0.6029, test_loss: 0.8009, test_f1: 0.6549
 epoch: 46, train_loss: 0.5956, test_loss: 0.8113, test_f1: 0.6492
 epoch: 47, train_loss: 0.5894, test_loss: 0.7987, test_f1: 0.6373
 epoch: 48, train_loss: 0.6031, test_loss: 0.8025, test_f1: 0.6529
 epoch: 49, train_loss: 0.5977, test_loss: 0.8097, test_f1: 0.6292
 epoch: 50, train_loss: 0.5787, test_loss: 0.7856, test_f1: 0.6531
 epoch: 51, train_loss: 0.5764, test_loss: 0.8273, test_f1: 0.6375
 epoch: 52, train_loss: 0.5676, test_loss: 0.7980, test_f1: 0.6449
 epoch: 53, train_loss: 0.5569, test_loss: 0.7989, test_f1: 0.6462
 epoch: 54, train_loss: 0.5789, test_loss: 0.7774, test_f1: 0.6575
 epoch: 55, train_loss: 0.5563, test_loss: 0.8065, test_f1: 0.6519
 epoch: 56, train_loss: 0.5581, test_loss: 0.8396, test_f1: 0.6501
 epoch: 57, train_loss: 0.5348, test_loss: 0.8420, test_f1: 0.6531
 epoch: 58, train_loss: 0.5447, test_loss: 0.8391, test_f1: 0.6529
 epoch: 59, train_loss: 0.5489, test_loss: 0.8415, test_f1: 0.6633
 epoch: 60, train_loss: 0.5384, test_loss: 0.8065, test_f1: 0.6571
 epoch: 61, train_loss: 0.5387, test_loss: 0.8327, test_f1: 0.6472
 epoch: 62, train_loss: 0.5319, test_loss: 0.8346, test_f1: 0.6577
 epoch: 63, train_loss: 0.5353, test_loss: 0.7848, test_f1: 0.6539
 epoch: 64, train_loss: 0.5373, test_loss: 0.8396, test_f1: 0.6403
 epoch: 65, train_loss: 0.5294, test_loss: 0.8112, test_f1: 0.6655
 epoch: 66, train_loss: 0.5269, test_loss: 0.8482, test_f1: 0.6520
 epoch: 67, train_loss: 0.5402, test_loss: 0.8430, test_f1: 0.6444
 epoch: 68, train_loss: 0.5167, test_loss: 0.8238, test_f1: 0.6486
 epoch: 69, train_loss: 0.5190, test_loss: 0.8066, test_f1: 0.6675
 epoch: 70, train_loss: 0.5197, test_loss: 0.8497, test_f1: 0.6522
 epoch: 71, train_loss: 0.5136, test_loss: 0.8542, test_f1: 0.6653
 epoch: 72, train_loss: 0.5121, test_loss: 0.8599, test_f1: 0.6538
 epoch: 73, train_loss: 0.5218, test_loss: 0.8414, test_f1: 0.6621
 epoch: 74, train_loss: 0.5079, test_loss: 0.8733, test_f1: 0.6515
 epoch: 75, train_loss: 0.5198, test_loss: 0.8848, test_f1: 0.6542
 epoch: 76, train_loss: 0.5075, test_loss: 0.8083, test_f1: 0.6691
 epoch: 77, train_loss: 0.5116, test_loss: 0.8389, test_f1: 0.6449
 epoch: 78, train_loss: 0.5059, test_loss: 0.8070, test_f1: 0.6763
 epoch: 79, train_loss: 0.4911, test_loss: 0.8559, test_f1: 0.6689
 epoch: 80, train_loss: 0.5048, test_loss: 0.8348, test_f1: 0.6501
 epoch: 81, train_loss: 0.4984, test_loss: 0.8523, test_f1: 0.6601
 epoch: 82, train_loss: 0.4981, test_loss: 0.8009, test_f1: 0.6520
 epoch: 83, train_loss: 0.4919, test_loss: 0.8161, test_f1: 0.6644
 epoch: 84, train_loss: 0.4942, test_loss: 0.8324, test_f1: 0.6525
 epoch: 85, train_loss: 0.4807, test_loss: 0.8235, test_f1: 0.6715
 epoch: 86, train_loss: 0.4845, test_loss: 0.8518, test_f1: 0.6402
 epoch: 87, train_loss: 0.4869, test_loss: 0.8738, test_f1: 0.6513
 epoch: 88, train_loss: 0.4775, test_loss: 0.8720, test_f1: 0.6571
 epoch: 89, train_loss: 0.4745, test_loss: 0.8554, test_f1: 0.6518
 epoch: 90, train_loss: 0.4847, test_loss: 0.8470, test_f1: 0.6469
 epoch: 91, train_loss: 0.4933, test_loss: 0.9238, test_f1: 0.6540
 epoch: 92, train_loss: 0.4782, test_loss: 0.8470, test_f1: 0.6659
 epoch: 93, train_loss: 0.4783, test_loss: 0.8831, test_f1: 0.6453
 epoch: 94, train_loss: 0.4679, test_loss: 0.8766, test_f1: 0.6499
 epoch: 95, train_loss: 0.4723, test_loss: 0.8781, test_f1: 0.6451
 epoch: 96, train_loss: 0.4674, test_loss: 0.8645, test_f1: 0.6489
 epoch: 97, train_loss: 0.4763, test_loss: 0.8471, test_f1: 0.6483
 epoch: 98, train_loss: 0.4574, test_loss: 0.8332, test_f1: 0.6766
 epoch: 99, train_loss: 0.4589, test_loss: 0.8894, test_f1: 0.6492
##################ITERATION #6 ****************************************
 epoch: 0, train_loss: 1.2048, test_loss: 1.0136, test_f1: 0.5069
 epoch: 1, train_loss: 1.0702, test_loss: 0.9894, test_f1: 0.5134
 epoch: 2, train_loss: 1.0257, test_loss: 0.9621, test_f1: 0.5356
 epoch: 3, train_loss: 0.9818, test_loss: 0.9558, test_f1: 0.5187
 epoch: 4, train_loss: 0.9602, test_loss: 0.9336, test_f1: 0.5552
 epoch: 5, train_loss: 0.9406, test_loss: 0.9020, test_f1: 0.5547
 epoch: 6, train_loss: 0.9205, test_loss: 0.9081, test_f1: 0.5446
 epoch: 7, train_loss: 0.8993, test_loss: 0.9155, test_f1: 0.5364
 epoch: 8, train_loss: 0.8845, test_loss: 0.8914, test_f1: 0.5478
 epoch: 9, train_loss: 0.8782, test_loss: 0.8776, test_f1: 0.5582
 epoch: 10, train_loss: 0.8610, test_loss: 0.8664, test_f1: 0.5998
 epoch: 11, train_loss: 0.8412, test_loss: 0.8490, test_f1: 0.5816
 epoch: 12, train_loss: 0.8295, test_loss: 0.8462, test_f1: 0.6046
 epoch: 13, train_loss: 0.8180, test_loss: 0.8541, test_f1: 0.5891
 epoch: 14, train_loss: 0.8077, test_loss: 0.8304, test_f1: 0.6206
 epoch: 15, train_loss: 0.8037, test_loss: 0.8490, test_f1: 0.6117
 epoch: 16, train_loss: 0.7751, test_loss: 0.8091, test_f1: 0.6143
 epoch: 17, train_loss: 0.7770, test_loss: 0.8283, test_f1: 0.6214
 epoch: 18, train_loss: 0.7671, test_loss: 0.8171, test_f1: 0.6300
 epoch: 19, train_loss: 0.7568, test_loss: 0.8135, test_f1: 0.6330
 epoch: 20, train_loss: 0.7503, test_loss: 0.7675, test_f1: 0.6414
 epoch: 21, train_loss: 0.7426, test_loss: 0.8376, test_f1: 0.6188
 epoch: 22, train_loss: 0.7225, test_loss: 0.8422, test_f1: 0.5885
 epoch: 23, train_loss: 0.7210, test_loss: 0.8194, test_f1: 0.6102
 epoch: 24, train_loss: 0.7182, test_loss: 0.7864, test_f1: 0.6534
 epoch: 25, train_loss: 0.7083, test_loss: 0.7746, test_f1: 0.6422
 epoch: 26, train_loss: 0.7110, test_loss: 0.7690, test_f1: 0.6343
 epoch: 27, train_loss: 0.6776, test_loss: 0.8261, test_f1: 0.6166
 epoch: 28, train_loss: 0.6905, test_loss: 0.8271, test_f1: 0.6331
 epoch: 29, train_loss: 0.6676, test_loss: 0.7887, test_f1: 0.6394
 epoch: 30, train_loss: 0.6905, test_loss: 0.7793, test_f1: 0.6383
 epoch: 31, train_loss: 0.6730, test_loss: 0.7897, test_f1: 0.6361
 epoch: 32, train_loss: 0.6647, test_loss: 0.7892, test_f1: 0.6364
 epoch: 33, train_loss: 0.6516, test_loss: 0.7749, test_f1: 0.6292
 epoch: 34, train_loss: 0.6534, test_loss: 0.7942, test_f1: 0.6362
 epoch: 35, train_loss: 0.6499, test_loss: 0.8206, test_f1: 0.6356
 epoch: 36, train_loss: 0.6524, test_loss: 0.8148, test_f1: 0.6467
 epoch: 37, train_loss: 0.6336, test_loss: 0.7878, test_f1: 0.6112
 epoch: 38, train_loss: 0.6228, test_loss: 0.8345, test_f1: 0.6209
 epoch: 39, train_loss: 0.6182, test_loss: 0.8275, test_f1: 0.6419
 epoch: 40, train_loss: 0.6138, test_loss: 0.7990, test_f1: 0.6446
 epoch: 41, train_loss: 0.6225, test_loss: 0.7602, test_f1: 0.6358
 epoch: 42, train_loss: 0.6038, test_loss: 0.8053, test_f1: 0.6482
 epoch: 43, train_loss: 0.5986, test_loss: 0.7780, test_f1: 0.6694
 epoch: 44, train_loss: 0.6032, test_loss: 0.8306, test_f1: 0.6329
 epoch: 45, train_loss: 0.5982, test_loss: 0.8096, test_f1: 0.6253
 epoch: 46, train_loss: 0.5871, test_loss: 0.7895, test_f1: 0.6480
 epoch: 47, train_loss: 0.5852, test_loss: 0.7971, test_f1: 0.6477
 epoch: 48, train_loss: 0.5837, test_loss: 0.7859, test_f1: 0.6494
 epoch: 49, train_loss: 0.5818, test_loss: 0.7929, test_f1: 0.6445
 epoch: 50, train_loss: 0.5704, test_loss: 0.8675, test_f1: 0.6032
 epoch: 51, train_loss: 0.5586, test_loss: 0.8205, test_f1: 0.6448
 epoch: 52, train_loss: 0.5514, test_loss: 0.8216, test_f1: 0.6476
 epoch: 53, train_loss: 0.5609, test_loss: 0.8037, test_f1: 0.6235
 epoch: 54, train_loss: 0.5457, test_loss: 0.8388, test_f1: 0.6304
 epoch: 55, train_loss: 0.5353, test_loss: 0.8528, test_f1: 0.6395
 epoch: 56, train_loss: 0.5407, test_loss: 0.7954, test_f1: 0.6365
 epoch: 57, train_loss: 0.5483, test_loss: 0.7758, test_f1: 0.6600
 epoch: 58, train_loss: 0.5413, test_loss: 0.7741, test_f1: 0.6603
 epoch: 59, train_loss: 0.5299, test_loss: 0.8197, test_f1: 0.6392
 epoch: 60, train_loss: 0.5249, test_loss: 0.8589, test_f1: 0.6367
 epoch: 61, train_loss: 0.5163, test_loss: 0.8320, test_f1: 0.6270
 epoch: 62, train_loss: 0.5180, test_loss: 0.8456, test_f1: 0.6438
 epoch: 63, train_loss: 0.5284, test_loss: 0.8741, test_f1: 0.6317
 epoch: 64, train_loss: 0.5228, test_loss: 0.8394, test_f1: 0.6477
 epoch: 65, train_loss: 0.5111, test_loss: 0.8230, test_f1: 0.6556
 epoch: 66, train_loss: 0.5060, test_loss: 0.8209, test_f1: 0.6285
 epoch: 67, train_loss: 0.5247, test_loss: 0.8876, test_f1: 0.6350
 epoch: 68, train_loss: 0.5095, test_loss: 0.8890, test_f1: 0.6365
 epoch: 69, train_loss: 0.5005, test_loss: 0.8729, test_f1: 0.6403
 epoch: 70, train_loss: 0.5097, test_loss: 0.8221, test_f1: 0.6462
 epoch: 71, train_loss: 0.5165, test_loss: 0.8729, test_f1: 0.6362
 epoch: 72, train_loss: 0.4978, test_loss: 0.8447, test_f1: 0.6649
 epoch: 73, train_loss: 0.4949, test_loss: 0.8808, test_f1: 0.6459
 epoch: 74, train_loss: 0.4953, test_loss: 0.8281, test_f1: 0.6308
 epoch: 75, train_loss: 0.5052, test_loss: 0.9558, test_f1: 0.6362
 epoch: 76, train_loss: 0.4958, test_loss: 0.8363, test_f1: 0.6465
 epoch: 77, train_loss: 0.4853, test_loss: 0.8882, test_f1: 0.6470
 epoch: 78, train_loss: 0.4989, test_loss: 0.8938, test_f1: 0.6389
 epoch: 79, train_loss: 0.4976, test_loss: 0.8709, test_f1: 0.6334
 epoch: 80, train_loss: 0.4804, test_loss: 0.8887, test_f1: 0.6425
 epoch: 81, train_loss: 0.4730, test_loss: 0.9585, test_f1: 0.6419
 epoch: 82, train_loss: 0.4690, test_loss: 0.8687, test_f1: 0.6330
 epoch: 83, train_loss: 0.4746, test_loss: 0.8910, test_f1: 0.6212
 epoch: 84, train_loss: 0.4799, test_loss: 0.8493, test_f1: 0.6326
 epoch: 85, train_loss: 0.4760, test_loss: 0.8197, test_f1: 0.6338
 epoch: 86, train_loss: 0.4704, test_loss: 0.8869, test_f1: 0.6368
 epoch: 87, train_loss: 0.4666, test_loss: 0.8628, test_f1: 0.6548
 epoch: 88, train_loss: 0.4728, test_loss: 0.9354, test_f1: 0.6464
 epoch: 89, train_loss: 0.4642, test_loss: 0.8515, test_f1: 0.6526
 epoch: 90, train_loss: 0.4658, test_loss: 0.9443, test_f1: 0.6301
 epoch: 91, train_loss: 0.4679, test_loss: 0.9748, test_f1: 0.6057
 epoch: 92, train_loss: 0.4550, test_loss: 0.9634, test_f1: 0.6319
 epoch: 93, train_loss: 0.4631, test_loss: 0.9908, test_f1: 0.6296
 epoch: 94, train_loss: 0.4539, test_loss: 0.9730, test_f1: 0.6437
 epoch: 95, train_loss: 0.4446, test_loss: 0.9696, test_f1: 0.6175
 epoch: 96, train_loss: 0.4446, test_loss: 0.9456, test_f1: 0.6319
 epoch: 97, train_loss: 0.4450, test_loss: 0.9663, test_f1: 0.6444
 epoch: 98, train_loss: 0.4383, test_loss: 0.8981, test_f1: 0.6254
 epoch: 99, train_loss: 0.4546, test_loss: 0.9686, test_f1: 0.6321
##################ITERATION #7 ****************************************
 epoch: 0, train_loss: 1.1574, test_loss: 0.9768, test_f1: 0.4649
 epoch: 1, train_loss: 1.0379, test_loss: 0.9536, test_f1: 0.5148
 epoch: 2, train_loss: 0.9786, test_loss: 0.9635, test_f1: 0.4803
 epoch: 3, train_loss: 0.9619, test_loss: 0.9199, test_f1: 0.5398
 epoch: 4, train_loss: 0.9326, test_loss: 0.9102, test_f1: 0.5343
 epoch: 5, train_loss: 0.9100, test_loss: 0.9358, test_f1: 0.5331
 epoch: 6, train_loss: 0.9013, test_loss: 0.9081, test_f1: 0.5757
 epoch: 7, train_loss: 0.8696, test_loss: 0.9004, test_f1: 0.5516
 epoch: 8, train_loss: 0.8677, test_loss: 0.9038, test_f1: 0.5616
 epoch: 9, train_loss: 0.8521, test_loss: 0.8660, test_f1: 0.5464
 epoch: 10, train_loss: 0.8328, test_loss: 0.8839, test_f1: 0.5934
 epoch: 11, train_loss: 0.8198, test_loss: 0.8627, test_f1: 0.5653
 epoch: 12, train_loss: 0.8254, test_loss: 0.8548, test_f1: 0.6000
 epoch: 13, train_loss: 0.8054, test_loss: 0.8283, test_f1: 0.5644
 epoch: 14, train_loss: 0.7938, test_loss: 0.8505, test_f1: 0.5778
 epoch: 15, train_loss: 0.7936, test_loss: 0.8469, test_f1: 0.5898
 epoch: 16, train_loss: 0.7810, test_loss: 0.8805, test_f1: 0.6047
 epoch: 17, train_loss: 0.7693, test_loss: 0.8507, test_f1: 0.6083
 epoch: 18, train_loss: 0.7613, test_loss: 0.8468, test_f1: 0.5994
 epoch: 19, train_loss: 0.7513, test_loss: 0.8372, test_f1: 0.5774
 epoch: 20, train_loss: 0.7432, test_loss: 0.8516, test_f1: 0.6018
 epoch: 21, train_loss: 0.7348, test_loss: 0.8184, test_f1: 0.5851
 epoch: 22, train_loss: 0.7272, test_loss: 0.8715, test_f1: 0.5869
 epoch: 23, train_loss: 0.7320, test_loss: 0.8190, test_f1: 0.6048
 epoch: 24, train_loss: 0.7164, test_loss: 0.8798, test_f1: 0.5872
 epoch: 25, train_loss: 0.7116, test_loss: 0.7943, test_f1: 0.6334
 epoch: 26, train_loss: 0.7044, test_loss: 0.8720, test_f1: 0.5752
 epoch: 27, train_loss: 0.7033, test_loss: 0.8193, test_f1: 0.6104
 epoch: 28, train_loss: 0.6878, test_loss: 0.8224, test_f1: 0.6214
 epoch: 29, train_loss: 0.6879, test_loss: 0.8197, test_f1: 0.5904
 epoch: 30, train_loss: 0.6914, test_loss: 0.8561, test_f1: 0.6147
 epoch: 31, train_loss: 0.6846, test_loss: 0.8233, test_f1: 0.6131
 epoch: 32, train_loss: 0.6755, test_loss: 0.8434, test_f1: 0.6061
 epoch: 33, train_loss: 0.6558, test_loss: 0.8382, test_f1: 0.6231
 epoch: 34, train_loss: 0.6656, test_loss: 0.7916, test_f1: 0.6203
 epoch: 35, train_loss: 0.6477, test_loss: 0.8240, test_f1: 0.6248
 epoch: 36, train_loss: 0.6311, test_loss: 0.8178, test_f1: 0.6268
 epoch: 37, train_loss: 0.6327, test_loss: 0.8057, test_f1: 0.6220
 epoch: 38, train_loss: 0.6474, test_loss: 0.7938, test_f1: 0.6398
 epoch: 39, train_loss: 0.6242, test_loss: 0.7930, test_f1: 0.6266
 epoch: 40, train_loss: 0.6256, test_loss: 0.8384, test_f1: 0.6242
 epoch: 41, train_loss: 0.6246, test_loss: 0.7937, test_f1: 0.6300
 epoch: 42, train_loss: 0.6251, test_loss: 0.7960, test_f1: 0.6418
 epoch: 43, train_loss: 0.6168, test_loss: 0.7735, test_f1: 0.6516
 epoch: 44, train_loss: 0.6008, test_loss: 0.8049, test_f1: 0.6304
 epoch: 45, train_loss: 0.6121, test_loss: 0.8123, test_f1: 0.6438
 epoch: 46, train_loss: 0.5885, test_loss: 0.7723, test_f1: 0.6444
 epoch: 47, train_loss: 0.5964, test_loss: 0.8991, test_f1: 0.6153
 epoch: 48, train_loss: 0.5853, test_loss: 0.7875, test_f1: 0.6434
 epoch: 49, train_loss: 0.5868, test_loss: 0.7853, test_f1: 0.6381
 epoch: 50, train_loss: 0.5818, test_loss: 0.8040, test_f1: 0.6163
 epoch: 51, train_loss: 0.5631, test_loss: 0.7871, test_f1: 0.6489
 epoch: 52, train_loss: 0.5607, test_loss: 0.7336, test_f1: 0.6548
 epoch: 53, train_loss: 0.5562, test_loss: 0.7833, test_f1: 0.6288
 epoch: 54, train_loss: 0.5572, test_loss: 0.7892, test_f1: 0.6354
 epoch: 55, train_loss: 0.5392, test_loss: 0.7949, test_f1: 0.6496
 epoch: 56, train_loss: 0.5540, test_loss: 0.8260, test_f1: 0.6415
 epoch: 57, train_loss: 0.5558, test_loss: 0.8003, test_f1: 0.6450
 epoch: 58, train_loss: 0.5510, test_loss: 0.8134, test_f1: 0.6364
 epoch: 59, train_loss: 0.5511, test_loss: 0.7718, test_f1: 0.6493
 epoch: 60, train_loss: 0.5399, test_loss: 0.7964, test_f1: 0.6239
 epoch: 61, train_loss: 0.5404, test_loss: 0.8005, test_f1: 0.6291
 epoch: 62, train_loss: 0.5300, test_loss: 0.8274, test_f1: 0.6146
 epoch: 63, train_loss: 0.5338, test_loss: 0.8663, test_f1: 0.6184
 epoch: 64, train_loss: 0.5337, test_loss: 0.8066, test_f1: 0.6678
 epoch: 65, train_loss: 0.5276, test_loss: 0.8379, test_f1: 0.6493
 epoch: 66, train_loss: 0.5199, test_loss: 0.8038, test_f1: 0.6381
 epoch: 67, train_loss: 0.5288, test_loss: 0.8000, test_f1: 0.6442
 epoch: 68, train_loss: 0.5298, test_loss: 0.8268, test_f1: 0.6299
 epoch: 69, train_loss: 0.5111, test_loss: 0.7891, test_f1: 0.6726
 epoch: 70, train_loss: 0.5259, test_loss: 0.8163, test_f1: 0.6374
 epoch: 71, train_loss: 0.5110, test_loss: 0.8154, test_f1: 0.6355
 epoch: 72, train_loss: 0.5013, test_loss: 0.8251, test_f1: 0.6506
 epoch: 73, train_loss: 0.5060, test_loss: 0.7898, test_f1: 0.6379
 epoch: 74, train_loss: 0.5117, test_loss: 0.8231, test_f1: 0.6437
 epoch: 75, train_loss: 0.5178, test_loss: 0.8090, test_f1: 0.6421
 epoch: 76, train_loss: 0.5115, test_loss: 0.8194, test_f1: 0.6467
 epoch: 77, train_loss: 0.4998, test_loss: 0.8511, test_f1: 0.6353
 epoch: 78, train_loss: 0.4903, test_loss: 0.8669, test_f1: 0.6391
 epoch: 79, train_loss: 0.5088, test_loss: 0.8411, test_f1: 0.6425
 epoch: 80, train_loss: 0.4924, test_loss: 0.8849, test_f1: 0.6227
 epoch: 81, train_loss: 0.5085, test_loss: 0.8841, test_f1: 0.6294
 epoch: 82, train_loss: 0.4924, test_loss: 0.8423, test_f1: 0.6364
 epoch: 83, train_loss: 0.4999, test_loss: 0.8877, test_f1: 0.6277
 epoch: 84, train_loss: 0.4846, test_loss: 0.8043, test_f1: 0.6649
 epoch: 85, train_loss: 0.4923, test_loss: 0.8269, test_f1: 0.6363
 epoch: 86, train_loss: 0.4803, test_loss: 0.8953, test_f1: 0.6259
 epoch: 87, train_loss: 0.4800, test_loss: 0.9125, test_f1: 0.6344
 epoch: 88, train_loss: 0.4750, test_loss: 0.8853, test_f1: 0.6433
 epoch: 89, train_loss: 0.4729, test_loss: 0.9021, test_f1: 0.6361
 epoch: 90, train_loss: 0.4795, test_loss: 0.9292, test_f1: 0.6254
 epoch: 91, train_loss: 0.4737, test_loss: 0.8715, test_f1: 0.6246
 epoch: 92, train_loss: 0.4734, test_loss: 0.9367, test_f1: 0.6295
 epoch: 93, train_loss: 0.4636, test_loss: 0.8455, test_f1: 0.6397
 epoch: 94, train_loss: 0.4669, test_loss: 0.8457, test_f1: 0.6362
 epoch: 95, train_loss: 0.4722, test_loss: 0.9257, test_f1: 0.6303
 epoch: 96, train_loss: 0.4567, test_loss: 0.8796, test_f1: 0.6338
 epoch: 97, train_loss: 0.4746, test_loss: 0.9184, test_f1: 0.6290
 epoch: 98, train_loss: 0.4619, test_loss: 0.8684, test_f1: 0.6495
 epoch: 99, train_loss: 0.4513, test_loss: 0.9037, test_f1: 0.6414
##################ITERATION #8 ****************************************
 epoch: 0, train_loss: 1.1974, test_loss: 1.0201, test_f1: 0.4209
 epoch: 1, train_loss: 1.0617, test_loss: 0.9809, test_f1: 0.4596
 epoch: 2, train_loss: 1.0164, test_loss: 0.9634, test_f1: 0.4773
 epoch: 3, train_loss: 0.9925, test_loss: 0.9042, test_f1: 0.5269
 epoch: 4, train_loss: 0.9489, test_loss: 0.9269, test_f1: 0.4854
 epoch: 5, train_loss: 0.9461, test_loss: 0.9013, test_f1: 0.5111
 epoch: 6, train_loss: 0.9217, test_loss: 0.9076, test_f1: 0.5317
 epoch: 7, train_loss: 0.9021, test_loss: 0.8811, test_f1: 0.5486
 epoch: 8, train_loss: 0.8950, test_loss: 0.8771, test_f1: 0.5440
 epoch: 9, train_loss: 0.8752, test_loss: 0.8894, test_f1: 0.5622
 epoch: 10, train_loss: 0.8606, test_loss: 0.9102, test_f1: 0.5688
 epoch: 11, train_loss: 0.8467, test_loss: 0.8965, test_f1: 0.5457
 epoch: 12, train_loss: 0.8442, test_loss: 0.9040, test_f1: 0.5427
 epoch: 13, train_loss: 0.8271, test_loss: 0.8391, test_f1: 0.5919
 epoch: 14, train_loss: 0.8088, test_loss: 0.8443, test_f1: 0.5821
 epoch: 15, train_loss: 0.8065, test_loss: 0.8884, test_f1: 0.5859
 epoch: 16, train_loss: 0.7981, test_loss: 0.9244, test_f1: 0.5837
 epoch: 17, train_loss: 0.7857, test_loss: 0.8654, test_f1: 0.5602
 epoch: 18, train_loss: 0.7809, test_loss: 0.8520, test_f1: 0.5904
 epoch: 19, train_loss: 0.7709, test_loss: 0.8685, test_f1: 0.5891
 epoch: 20, train_loss: 0.7721, test_loss: 0.8361, test_f1: 0.5939
 epoch: 21, train_loss: 0.7622, test_loss: 0.9008, test_f1: 0.5919
 epoch: 22, train_loss: 0.7585, test_loss: 0.8174, test_f1: 0.6101
 epoch: 23, train_loss: 0.7496, test_loss: 0.8454, test_f1: 0.6055
 epoch: 24, train_loss: 0.7516, test_loss: 0.8314, test_f1: 0.5903
 epoch: 25, train_loss: 0.7343, test_loss: 0.8605, test_f1: 0.6022
 epoch: 26, train_loss: 0.7333, test_loss: 0.8326, test_f1: 0.6059
 epoch: 27, train_loss: 0.7254, test_loss: 0.8707, test_f1: 0.5922
 epoch: 28, train_loss: 0.7064, test_loss: 0.8290, test_f1: 0.6297
 epoch: 29, train_loss: 0.7038, test_loss: 0.8760, test_f1: 0.5878
 epoch: 30, train_loss: 0.7103, test_loss: 0.8406, test_f1: 0.5998
 epoch: 31, train_loss: 0.6978, test_loss: 0.8436, test_f1: 0.5902
 epoch: 32, train_loss: 0.6956, test_loss: 0.8124, test_f1: 0.6093
 epoch: 33, train_loss: 0.6776, test_loss: 0.8424, test_f1: 0.6127
 epoch: 34, train_loss: 0.6895, test_loss: 0.8483, test_f1: 0.6080
 epoch: 35, train_loss: 0.6659, test_loss: 0.8400, test_f1: 0.6135
 epoch: 36, train_loss: 0.6700, test_loss: 0.7838, test_f1: 0.6076
 epoch: 37, train_loss: 0.6629, test_loss: 0.8320, test_f1: 0.6116
 epoch: 38, train_loss: 0.6749, test_loss: 0.8375, test_f1: 0.5882
 epoch: 39, train_loss: 0.6635, test_loss: 0.8552, test_f1: 0.6153
 epoch: 40, train_loss: 0.6397, test_loss: 0.8065, test_f1: 0.6337
 epoch: 41, train_loss: 0.6390, test_loss: 0.8672, test_f1: 0.5997
 epoch: 42, train_loss: 0.6399, test_loss: 0.8326, test_f1: 0.6241
 epoch: 43, train_loss: 0.6274, test_loss: 0.8827, test_f1: 0.6014
 epoch: 44, train_loss: 0.6358, test_loss: 0.8360, test_f1: 0.6190
 epoch: 45, train_loss: 0.6103, test_loss: 0.8018, test_f1: 0.6212
 epoch: 46, train_loss: 0.6083, test_loss: 0.8579, test_f1: 0.6202
 epoch: 47, train_loss: 0.6201, test_loss: 0.9264, test_f1: 0.6085
 epoch: 48, train_loss: 0.6209, test_loss: 0.8100, test_f1: 0.6241
 epoch: 49, train_loss: 0.6072, test_loss: 0.7879, test_f1: 0.6329
 epoch: 50, train_loss: 0.6124, test_loss: 0.9308, test_f1: 0.6076
 epoch: 51, train_loss: 0.5866, test_loss: 0.7727, test_f1: 0.6462
 epoch: 52, train_loss: 0.5780, test_loss: 0.8203, test_f1: 0.6376
 epoch: 53, train_loss: 0.5904, test_loss: 0.8122, test_f1: 0.6261
 epoch: 54, train_loss: 0.5825, test_loss: 0.8604, test_f1: 0.6341
 epoch: 55, train_loss: 0.5845, test_loss: 0.8336, test_f1: 0.6169
 epoch: 56, train_loss: 0.5740, test_loss: 0.8138, test_f1: 0.6293
 epoch: 57, train_loss: 0.5672, test_loss: 0.8759, test_f1: 0.6104
 epoch: 58, train_loss: 0.5739, test_loss: 0.8660, test_f1: 0.6077
 epoch: 59, train_loss: 0.5738, test_loss: 0.8067, test_f1: 0.6332
 epoch: 60, train_loss: 0.5683, test_loss: 0.8309, test_f1: 0.6243
 epoch: 61, train_loss: 0.5637, test_loss: 0.8389, test_f1: 0.6285
 epoch: 62, train_loss: 0.5501, test_loss: 0.8095, test_f1: 0.6428
 epoch: 63, train_loss: 0.5392, test_loss: 0.8160, test_f1: 0.6209
 epoch: 64, train_loss: 0.5528, test_loss: 0.8185, test_f1: 0.6412
 epoch: 65, train_loss: 0.5549, test_loss: 0.8168, test_f1: 0.6472
 epoch: 66, train_loss: 0.5576, test_loss: 0.8482, test_f1: 0.6266
 epoch: 67, train_loss: 0.5285, test_loss: 0.8538, test_f1: 0.6206
 epoch: 68, train_loss: 0.5516, test_loss: 0.8382, test_f1: 0.6232
 epoch: 69, train_loss: 0.5395, test_loss: 0.8102, test_f1: 0.6338
 epoch: 70, train_loss: 0.5314, test_loss: 0.7758, test_f1: 0.6651
 epoch: 71, train_loss: 0.5334, test_loss: 0.8259, test_f1: 0.6269
 epoch: 72, train_loss: 0.5368, test_loss: 0.7843, test_f1: 0.6416
 epoch: 73, train_loss: 0.5317, test_loss: 0.8023, test_f1: 0.6343
 epoch: 74, train_loss: 0.5265, test_loss: 0.8091, test_f1: 0.6522
 epoch: 75, train_loss: 0.5283, test_loss: 0.8666, test_f1: 0.6128
 epoch: 76, train_loss: 0.5265, test_loss: 0.7807, test_f1: 0.6460
 epoch: 77, train_loss: 0.5256, test_loss: 0.7967, test_f1: 0.6441
 epoch: 78, train_loss: 0.5160, test_loss: 0.8010, test_f1: 0.6454
 epoch: 79, train_loss: 0.5208, test_loss: 0.8240, test_f1: 0.6415
 epoch: 80, train_loss: 0.4955, test_loss: 0.8123, test_f1: 0.6633
 epoch: 81, train_loss: 0.5203, test_loss: 0.8040, test_f1: 0.6384
 epoch: 82, train_loss: 0.5096, test_loss: 0.9123, test_f1: 0.6292
 epoch: 83, train_loss: 0.5163, test_loss: 0.8850, test_f1: 0.6187
 epoch: 84, train_loss: 0.5160, test_loss: 0.8164, test_f1: 0.6435
 epoch: 85, train_loss: 0.5048, test_loss: 0.7788, test_f1: 0.6738
 epoch: 86, train_loss: 0.5081, test_loss: 0.7803, test_f1: 0.6665
 epoch: 87, train_loss: 0.5114, test_loss: 0.7812, test_f1: 0.6580
 epoch: 88, train_loss: 0.5036, test_loss: 0.8464, test_f1: 0.6461
 epoch: 89, train_loss: 0.5088, test_loss: 0.8240, test_f1: 0.6577
 epoch: 90, train_loss: 0.5024, test_loss: 0.8416, test_f1: 0.6546
 epoch: 91, train_loss: 0.5064, test_loss: 0.8780, test_f1: 0.6627
 epoch: 92, train_loss: 0.5034, test_loss: 0.8332, test_f1: 0.6615
 epoch: 93, train_loss: 0.4997, test_loss: 0.8681, test_f1: 0.6385
 epoch: 94, train_loss: 0.4949, test_loss: 0.8447, test_f1: 0.6416
 epoch: 95, train_loss: 0.4887, test_loss: 0.8353, test_f1: 0.6661
 epoch: 96, train_loss: 0.4775, test_loss: 0.8391, test_f1: 0.6559
 epoch: 97, train_loss: 0.4930, test_loss: 0.8376, test_f1: 0.6832
 epoch: 98, train_loss: 0.4822, test_loss: 0.7697, test_f1: 0.6827
 epoch: 99, train_loss: 0.4798, test_loss: 0.8459, test_f1: 0.6520
##################ITERATION #9 ****************************************
 epoch: 0, train_loss: 1.2557, test_loss: 0.9968, test_f1: 0.5192
 epoch: 1, train_loss: 1.0773, test_loss: 0.9888, test_f1: 0.4997
 epoch: 2, train_loss: 1.0072, test_loss: 0.9382, test_f1: 0.5255
 epoch: 3, train_loss: 0.9717, test_loss: 0.9225, test_f1: 0.5451
 epoch: 4, train_loss: 0.9541, test_loss: 0.9277, test_f1: 0.5514
 epoch: 5, train_loss: 0.9467, test_loss: 0.8896, test_f1: 0.5270
 epoch: 6, train_loss: 0.9233, test_loss: 0.8987, test_f1: 0.5495
 epoch: 7, train_loss: 0.9080, test_loss: 0.8998, test_f1: 0.5724
 epoch: 8, train_loss: 0.8811, test_loss: 0.9121, test_f1: 0.5411
 epoch: 9, train_loss: 0.8752, test_loss: 0.8663, test_f1: 0.5531
 epoch: 10, train_loss: 0.8577, test_loss: 0.8544, test_f1: 0.5521
 epoch: 11, train_loss: 0.8446, test_loss: 0.8656, test_f1: 0.5614
 epoch: 12, train_loss: 0.8292, test_loss: 0.8537, test_f1: 0.6070
 epoch: 13, train_loss: 0.8119, test_loss: 0.8497, test_f1: 0.6325
 epoch: 14, train_loss: 0.8145, test_loss: 0.8603, test_f1: 0.5958
 epoch: 15, train_loss: 0.7931, test_loss: 0.8295, test_f1: 0.5960
 epoch: 16, train_loss: 0.7903, test_loss: 0.8426, test_f1: 0.5975
 epoch: 17, train_loss: 0.7939, test_loss: 0.8516, test_f1: 0.5852
 epoch: 18, train_loss: 0.7749, test_loss: 0.8116, test_f1: 0.5959
 epoch: 19, train_loss: 0.7645, test_loss: 0.7890, test_f1: 0.6036
 epoch: 20, train_loss: 0.7641, test_loss: 0.8373, test_f1: 0.6172
 epoch: 21, train_loss: 0.7522, test_loss: 0.8178, test_f1: 0.6349
 epoch: 22, train_loss: 0.7421, test_loss: 0.8667, test_f1: 0.5912
 epoch: 23, train_loss: 0.7388, test_loss: 0.8290, test_f1: 0.6464
 epoch: 24, train_loss: 0.7283, test_loss: 0.8266, test_f1: 0.6251
 epoch: 25, train_loss: 0.7304, test_loss: 0.8330, test_f1: 0.6242
 epoch: 26, train_loss: 0.7244, test_loss: 0.8369, test_f1: 0.6068
 epoch: 27, train_loss: 0.7201, test_loss: 0.8067, test_f1: 0.6398
 epoch: 28, train_loss: 0.7125, test_loss: 0.8069, test_f1: 0.6319
 epoch: 29, train_loss: 0.7122, test_loss: 0.8597, test_f1: 0.6033
 epoch: 30, train_loss: 0.6950, test_loss: 0.8114, test_f1: 0.6403
 epoch: 31, train_loss: 0.6846, test_loss: 0.8270, test_f1: 0.6353
 epoch: 32, train_loss: 0.6866, test_loss: 0.8126, test_f1: 0.6345
 epoch: 33, train_loss: 0.6861, test_loss: 0.8144, test_f1: 0.6428
 epoch: 34, train_loss: 0.6774, test_loss: 0.8140, test_f1: 0.6410
 epoch: 35, train_loss: 0.6585, test_loss: 0.8143, test_f1: 0.6262
 epoch: 36, train_loss: 0.6696, test_loss: 0.8138, test_f1: 0.6246
 epoch: 37, train_loss: 0.6590, test_loss: 0.8372, test_f1: 0.6274
 epoch: 38, train_loss: 0.6623, test_loss: 0.7958, test_f1: 0.6264
 epoch: 39, train_loss: 0.6490, test_loss: 0.8205, test_f1: 0.6451
 epoch: 40, train_loss: 0.6381, test_loss: 0.8195, test_f1: 0.6380
 epoch: 41, train_loss: 0.6403, test_loss: 0.8118, test_f1: 0.6409
 epoch: 42, train_loss: 0.6347, test_loss: 0.8088, test_f1: 0.6495
 epoch: 43, train_loss: 0.6267, test_loss: 0.8360, test_f1: 0.6437
 epoch: 44, train_loss: 0.6262, test_loss: 0.8212, test_f1: 0.6380
 epoch: 45, train_loss: 0.6165, test_loss: 0.8093, test_f1: 0.6632
 epoch: 46, train_loss: 0.6155, test_loss: 0.7946, test_f1: 0.6556
 epoch: 47, train_loss: 0.6106, test_loss: 0.8129, test_f1: 0.6485
 epoch: 48, train_loss: 0.6221, test_loss: 0.8079, test_f1: 0.6541
 epoch: 49, train_loss: 0.6071, test_loss: 0.8355, test_f1: 0.6428
 epoch: 50, train_loss: 0.6101, test_loss: 0.7880, test_f1: 0.6576
 epoch: 51, train_loss: 0.5845, test_loss: 0.7991, test_f1: 0.6700
 epoch: 52, train_loss: 0.5872, test_loss: 0.7771, test_f1: 0.6607
 epoch: 53, train_loss: 0.5634, test_loss: 0.8076, test_f1: 0.6516
 epoch: 54, train_loss: 0.5718, test_loss: 0.8292, test_f1: 0.6501
 epoch: 55, train_loss: 0.5747, test_loss: 0.8224, test_f1: 0.6576
 epoch: 56, train_loss: 0.5596, test_loss: 0.8136, test_f1: 0.6553
 epoch: 57, train_loss: 0.5637, test_loss: 0.8210, test_f1: 0.6390
 epoch: 58, train_loss: 0.5721, test_loss: 0.8094, test_f1: 0.6544
 epoch: 59, train_loss: 0.5684, test_loss: 0.8023, test_f1: 0.6595
 epoch: 60, train_loss: 0.5694, test_loss: 0.8207, test_f1: 0.6405
 epoch: 61, train_loss: 0.5532, test_loss: 0.8341, test_f1: 0.6608
 epoch: 62, train_loss: 0.5605, test_loss: 0.8232, test_f1: 0.6453
 epoch: 63, train_loss: 0.5511, test_loss: 0.8080, test_f1: 0.6581
 epoch: 64, train_loss: 0.5554, test_loss: 0.7842, test_f1: 0.6611
 epoch: 65, train_loss: 0.5526, test_loss: 0.8028, test_f1: 0.6500
 epoch: 66, train_loss: 0.5490, test_loss: 0.8149, test_f1: 0.6498
 epoch: 67, train_loss: 0.5534, test_loss: 0.7969, test_f1: 0.6558
 epoch: 68, train_loss: 0.5493, test_loss: 0.8299, test_f1: 0.6586
 epoch: 69, train_loss: 0.5451, test_loss: 0.7966, test_f1: 0.6644
 epoch: 70, train_loss: 0.5380, test_loss: 0.7837, test_f1: 0.6694
 epoch: 71, train_loss: 0.5413, test_loss: 0.7916, test_f1: 0.6585
 epoch: 72, train_loss: 0.5256, test_loss: 0.8053, test_f1: 0.6770
 epoch: 73, train_loss: 0.5382, test_loss: 0.8300, test_f1: 0.6571
 epoch: 74, train_loss: 0.5331, test_loss: 0.8283, test_f1: 0.6598
 epoch: 75, train_loss: 0.5285, test_loss: 0.8225, test_f1: 0.6660
 epoch: 76, train_loss: 0.5357, test_loss: 0.8739, test_f1: 0.6530
 epoch: 77, train_loss: 0.5170, test_loss: 0.8604, test_f1: 0.6502
 epoch: 78, train_loss: 0.5326, test_loss: 0.8293, test_f1: 0.6694
 epoch: 79, train_loss: 0.5245, test_loss: 0.8247, test_f1: 0.6648
 epoch: 80, train_loss: 0.5206, test_loss: 0.8086, test_f1: 0.6501
 epoch: 81, train_loss: 0.5155, test_loss: 0.8264, test_f1: 0.6646
 epoch: 82, train_loss: 0.5085, test_loss: 0.7849, test_f1: 0.6653
 epoch: 83, train_loss: 0.5045, test_loss: 0.8242, test_f1: 0.6520
 epoch: 84, train_loss: 0.5144, test_loss: 0.8693, test_f1: 0.6544
 epoch: 85, train_loss: 0.4966, test_loss: 0.8796, test_f1: 0.6592
 epoch: 86, train_loss: 0.5176, test_loss: 0.8498, test_f1: 0.6712
 epoch: 87, train_loss: 0.5094, test_loss: 0.8523, test_f1: 0.6574
 epoch: 88, train_loss: 0.4983, test_loss: 0.8886, test_f1: 0.6490
 epoch: 89, train_loss: 0.5053, test_loss: 0.8540, test_f1: 0.6492
 epoch: 90, train_loss: 0.4864, test_loss: 0.8493, test_f1: 0.6670
 epoch: 91, train_loss: 0.4983, test_loss: 0.8425, test_f1: 0.6792
 epoch: 92, train_loss: 0.4976, test_loss: 0.8209, test_f1: 0.6637
 epoch: 93, train_loss: 0.4926, test_loss: 0.8915, test_f1: 0.6389
 epoch: 94, train_loss: 0.4980, test_loss: 0.8641, test_f1: 0.6504
 epoch: 95, train_loss: 0.4926, test_loss: 0.8804, test_f1: 0.6627
 epoch: 96, train_loss: 0.4724, test_loss: 0.8266, test_f1: 0.6411
 epoch: 97, train_loss: 0.4813, test_loss: 0.8410, test_f1: 0.6658
 epoch: 98, train_loss: 0.4939, test_loss: 0.8419, test_f1: 0.6624
 epoch: 99, train_loss: 0.4800, test_loss: 0.8677, test_f1: 0.6549

Training completed in 831.01 seconds
Best F1: 0.6836 at epoch 96
Mean F1 across iterations: 0.6725  0.0104
========================FINAL RESULTS================================
FEGIN weighted F1: 0.6836  0.0104
python main.py --data ltspice_examples --representation component_pin --model FEGIN --layers 2 --hiddens 128 --batch_size 32 --lr 0.0001 --emb_size 128 --epochs 100 --save_appendix component_pin_L2_H128_BS32_LR0.0001_E128 --no_val
-----



STDERR:
  File "main.py", line 370, in <module>
    main()
  File "main.py", line 254, in main
    dataset = dataset_class(
  File "/home/philip/projects/ltspice_examples_code_repo/Circuit-Completion-Using-GNNs/component_classification_with_link_prediction_head/evaluation/FEGIN/kernel/circuit_datasets.py", line 15, in __init__
    self.data, self.slices = torch.load(self.processed_paths[0])
  File "/home/philip/.local/lib/python3.8/site-packages/torch/serialization.py", line 1040, in load
    warnings.warn(
  File "/usr/lib/python3.8/warnings.py", line 109, in _showwarnmsg
    sw(msg.message, msg.category, msg.filename, msg.lineno,
  File "main.py", line 47, in warn_with_traceback
    traceback.print_stack(file=log)
/home/philip/projects/ltspice_examples_code_repo/Circuit-Completion-Using-GNNs/component_classification_with_link_prediction_head/evaluation/FEGIN/kernel/circuit_datasets.py:15: FutureWarning: You are using `torch.load` with `weights_only=False` (the current default value), which uses the default pickle module implicitly. It is possible to construct malicious pickle data which will execute arbitrary code during unpickling (See https://github.com/pytorch/pytorch/blob/main/SECURITY.md#untrusted-models for more details). In a future release, the default value for `weights_only` will be flipped to `True`. This limits the functions that could be executed during unpickling. Arbitrary objects will no longer be allowed to be loaded via this mode unless they are explicitly allowlisted by the user via `torch.serialization.add_safe_globals`. We recommend you start setting `weights_only=True` for any use case where you don't have full control of the loaded file. Please open an issue on GitHub for any issues related to this experimental feature.
  self.data, self.slices = torch.load(self.processed_paths[0])
