STDOUT:
Results will be saved in /home/philip/projects/ltspice_examples_code_repo/Circuit-Completion-Using-GNNs/component_classification_with_link_prediction_head/evaluation/FEGIN/results/model_FEGIN_dataset_ltspice_examples
Command line input: python main.py --data ltspice_examples --representation component_pin_net --model FEGIN --layers 4 --hiddens 16 --batch_size 32 --lr 0.01 --emb_size 250 --epochs 100 --save_appendix component_pin_net_L4_H16_BS32_LR0.01_E250 --no_val
 is saved.
-----
ltspice_examples - FEGIN
Using 4 layers, 16 hidden units, h = 2
Loading component_pin_net representation dataset
ENTERED
Training FEGIN on component_pin_net representation
Train: 3558, Test: 846
##################ITERATION #0 ****************************************
 epoch: 0, train_loss: 1.1685, test_loss: 1.1262, test_f1: 0.4038
 epoch: 1, train_loss: 1.0466, test_loss: 1.0544, test_f1: 0.4538
 epoch: 2, train_loss: 1.0071, test_loss: 1.0901, test_f1: 0.4484
 epoch: 3, train_loss: 1.0024, test_loss: 1.0264, test_f1: 0.4534
 epoch: 4, train_loss: 1.0012, test_loss: 1.0123, test_f1: 0.4646
 epoch: 5, train_loss: 1.0079, test_loss: 1.0435, test_f1: 0.4559
 epoch: 6, train_loss: 0.9880, test_loss: 0.9984, test_f1: 0.4707
 epoch: 7, train_loss: 0.9795, test_loss: 1.0725, test_f1: 0.4279
 epoch: 8, train_loss: 1.0027, test_loss: 0.9986, test_f1: 0.4566
 epoch: 9, train_loss: 0.9868, test_loss: 1.0371, test_f1: 0.4571
 epoch: 10, train_loss: 0.9644, test_loss: 1.0165, test_f1: 0.4615
 epoch: 11, train_loss: 0.9752, test_loss: 0.9882, test_f1: 0.5029
 epoch: 12, train_loss: 0.9714, test_loss: 1.0125, test_f1: 0.4886
 epoch: 13, train_loss: 0.9521, test_loss: 0.9807, test_f1: 0.4771
 epoch: 14, train_loss: 0.9485, test_loss: 0.9598, test_f1: 0.5414
 epoch: 15, train_loss: 0.9495, test_loss: 1.0180, test_f1: 0.5038
 epoch: 16, train_loss: 0.9445, test_loss: 0.9391, test_f1: 0.4833
 epoch: 17, train_loss: 0.9317, test_loss: 0.9686, test_f1: 0.5002
 epoch: 18, train_loss: 0.9367, test_loss: 1.0193, test_f1: 0.4976
 epoch: 19, train_loss: 0.9362, test_loss: 1.0047, test_f1: 0.4475
 epoch: 20, train_loss: 0.9515, test_loss: 0.9561, test_f1: 0.4903
 epoch: 21, train_loss: 0.9380, test_loss: 0.9605, test_f1: 0.4892
 epoch: 22, train_loss: 0.9370, test_loss: 0.9430, test_f1: 0.4776
 epoch: 23, train_loss: 0.9260, test_loss: 0.9293, test_f1: 0.4835
 epoch: 24, train_loss: 0.9217, test_loss: 0.9753, test_f1: 0.5373
 epoch: 25, train_loss: 0.9186, test_loss: 0.9308, test_f1: 0.5115
 epoch: 26, train_loss: 0.9203, test_loss: 0.9999, test_f1: 0.4985
 epoch: 27, train_loss: 0.9171, test_loss: 0.9763, test_f1: 0.5117
 epoch: 28, train_loss: 0.9092, test_loss: 0.9401, test_f1: 0.5127
 epoch: 29, train_loss: 0.9109, test_loss: 0.9336, test_f1: 0.5593
 epoch: 30, train_loss: 0.9139, test_loss: 0.9138, test_f1: 0.5131
 epoch: 31, train_loss: 0.8995, test_loss: 0.9422, test_f1: 0.5193
 epoch: 32, train_loss: 0.9024, test_loss: 0.8888, test_f1: 0.5159
 epoch: 33, train_loss: 0.8910, test_loss: 0.9491, test_f1: 0.4686
 epoch: 34, train_loss: 0.9064, test_loss: 0.9420, test_f1: 0.5256
 epoch: 35, train_loss: 0.8921, test_loss: 0.9014, test_f1: 0.5200
 epoch: 36, train_loss: 0.8928, test_loss: 0.9004, test_f1: 0.5200
 epoch: 37, train_loss: 0.8816, test_loss: 0.9080, test_f1: 0.5128
 epoch: 38, train_loss: 0.8818, test_loss: 0.9250, test_f1: 0.5448
 epoch: 39, train_loss: 0.8818, test_loss: 0.9324, test_f1: 0.5157
 epoch: 40, train_loss: 0.8799, test_loss: 0.8853, test_f1: 0.5281
 epoch: 41, train_loss: 0.8787, test_loss: 0.9716, test_f1: 0.4968
 epoch: 42, train_loss: 0.8891, test_loss: 0.8619, test_f1: 0.5495
 epoch: 43, train_loss: 0.8871, test_loss: 0.8826, test_f1: 0.5152
 epoch: 44, train_loss: 0.8766, test_loss: 0.8876, test_f1: 0.5931
 epoch: 45, train_loss: 0.8715, test_loss: 0.8788, test_f1: 0.5252
 epoch: 46, train_loss: 0.8624, test_loss: 0.8880, test_f1: 0.5283
 epoch: 47, train_loss: 0.8721, test_loss: 0.8671, test_f1: 0.5468
 epoch: 48, train_loss: 0.8665, test_loss: 0.8831, test_f1: 0.5379
 epoch: 49, train_loss: 0.8631, test_loss: 0.9044, test_f1: 0.5018
 epoch: 50, train_loss: 0.8584, test_loss: 0.9633, test_f1: 0.4849
 epoch: 51, train_loss: 0.8535, test_loss: 0.8820, test_f1: 0.5555
 epoch: 52, train_loss: 0.8393, test_loss: 0.8988, test_f1: 0.5475
 epoch: 53, train_loss: 0.8373, test_loss: 0.8814, test_f1: 0.5360
 epoch: 54, train_loss: 0.8325, test_loss: 0.8466, test_f1: 0.5462
 epoch: 55, train_loss: 0.8361, test_loss: 0.9154, test_f1: 0.5065
 epoch: 56, train_loss: 0.8202, test_loss: 0.8318, test_f1: 0.5706
 epoch: 57, train_loss: 0.8248, test_loss: 0.8657, test_f1: 0.5446
 epoch: 58, train_loss: 0.8212, test_loss: 0.9036, test_f1: 0.5104
 epoch: 59, train_loss: 0.8196, test_loss: 0.8408, test_f1: 0.5659
 epoch: 60, train_loss: 0.8244, test_loss: 0.8245, test_f1: 0.5450
 epoch: 61, train_loss: 0.8350, test_loss: 0.8576, test_f1: 0.5816
 epoch: 62, train_loss: 0.8240, test_loss: 0.8491, test_f1: 0.5959
 epoch: 63, train_loss: 0.8217, test_loss: 0.8716, test_f1: 0.5880
 epoch: 64, train_loss: 0.8058, test_loss: 0.8904, test_f1: 0.5664
 epoch: 65, train_loss: 0.8159, test_loss: 0.8668, test_f1: 0.5766
 epoch: 66, train_loss: 0.8138, test_loss: 0.8645, test_f1: 0.5781
 epoch: 67, train_loss: 0.8243, test_loss: 0.8275, test_f1: 0.5919
 epoch: 68, train_loss: 0.8193, test_loss: 0.8708, test_f1: 0.5580
 epoch: 69, train_loss: 0.8264, test_loss: 0.8391, test_f1: 0.5897
 epoch: 70, train_loss: 0.8228, test_loss: 0.8720, test_f1: 0.6155
 epoch: 71, train_loss: 0.8208, test_loss: 0.8541, test_f1: 0.5806
 epoch: 72, train_loss: 0.8125, test_loss: 0.8355, test_f1: 0.6078
 epoch: 73, train_loss: 0.8094, test_loss: 0.8272, test_f1: 0.5905
 epoch: 74, train_loss: 0.8156, test_loss: 0.8601, test_f1: 0.5728
 epoch: 75, train_loss: 0.8192, test_loss: 0.8757, test_f1: 0.5773
 epoch: 76, train_loss: 0.8031, test_loss: 0.8519, test_f1: 0.5847
 epoch: 77, train_loss: 0.8134, test_loss: 0.8304, test_f1: 0.5880
 epoch: 78, train_loss: 0.8108, test_loss: 0.8155, test_f1: 0.5822
 epoch: 79, train_loss: 0.8151, test_loss: 0.8824, test_f1: 0.5606
 epoch: 80, train_loss: 0.8156, test_loss: 0.8583, test_f1: 0.5886
 epoch: 81, train_loss: 0.8018, test_loss: 0.8066, test_f1: 0.6129
 epoch: 82, train_loss: 0.8125, test_loss: 0.8337, test_f1: 0.5827
 epoch: 83, train_loss: 0.8018, test_loss: 0.8207, test_f1: 0.5782
 epoch: 84, train_loss: 0.8025, test_loss: 0.8042, test_f1: 0.6022
 epoch: 85, train_loss: 0.8077, test_loss: 0.8168, test_f1: 0.6022
 epoch: 86, train_loss: 0.8089, test_loss: 0.7892, test_f1: 0.5908
 epoch: 87, train_loss: 0.8037, test_loss: 0.8444, test_f1: 0.6085
 epoch: 88, train_loss: 0.7949, test_loss: 0.8386, test_f1: 0.5617
 epoch: 89, train_loss: 0.7960, test_loss: 0.8326, test_f1: 0.5714
 epoch: 90, train_loss: 0.7962, test_loss: 0.8678, test_f1: 0.5776
 epoch: 91, train_loss: 0.7927, test_loss: 0.8488, test_f1: 0.5984
 epoch: 92, train_loss: 0.7954, test_loss: 0.8065, test_f1: 0.5934
 epoch: 93, train_loss: 0.7789, test_loss: 0.8212, test_f1: 0.6140
 epoch: 94, train_loss: 0.7941, test_loss: 0.8140, test_f1: 0.5923
 epoch: 95, train_loss: 0.7925, test_loss: 0.8296, test_f1: 0.5609
 epoch: 96, train_loss: 0.7794, test_loss: 0.8086, test_f1: 0.6242
 epoch: 97, train_loss: 0.7855, test_loss: 0.8161, test_f1: 0.6273
 epoch: 98, train_loss: 0.7826, test_loss: 0.8355, test_f1: 0.5989
 epoch: 99, train_loss: 0.7839, test_loss: 0.8315, test_f1: 0.5971
##################ITERATION #1 ****************************************
 epoch: 0, train_loss: 1.1198, test_loss: 1.0357, test_f1: 0.4431
 epoch: 1, train_loss: 1.0299, test_loss: 1.1100, test_f1: 0.4518
 epoch: 2, train_loss: 1.0028, test_loss: 1.0355, test_f1: 0.4524
 epoch: 3, train_loss: 0.9861, test_loss: 0.9880, test_f1: 0.4928
 epoch: 4, train_loss: 0.9720, test_loss: 0.9861, test_f1: 0.4883
 epoch: 5, train_loss: 0.9619, test_loss: 0.9531, test_f1: 0.5283
 epoch: 6, train_loss: 0.9589, test_loss: 1.1226, test_f1: 0.3877
 epoch: 7, train_loss: 0.9663, test_loss: 0.9780, test_f1: 0.4855
 epoch: 8, train_loss: 0.9471, test_loss: 0.9703, test_f1: 0.5087
 epoch: 9, train_loss: 0.9410, test_loss: 0.9197, test_f1: 0.5303
 epoch: 10, train_loss: 0.9062, test_loss: 0.9624, test_f1: 0.4883
 epoch: 11, train_loss: 0.9335, test_loss: 0.9123, test_f1: 0.5265
 epoch: 12, train_loss: 0.9254, test_loss: 0.9053, test_f1: 0.4895
 epoch: 13, train_loss: 0.9183, test_loss: 0.9100, test_f1: 0.5523
 epoch: 14, train_loss: 0.9063, test_loss: 0.9013, test_f1: 0.5321
 epoch: 15, train_loss: 0.9069, test_loss: 1.0764, test_f1: 0.4279
 epoch: 16, train_loss: 0.9279, test_loss: 0.9280, test_f1: 0.5182
 epoch: 17, train_loss: 0.8984, test_loss: 0.9539, test_f1: 0.4924
 epoch: 18, train_loss: 0.8872, test_loss: 0.8995, test_f1: 0.5133
 epoch: 19, train_loss: 0.9053, test_loss: 0.9246, test_f1: 0.5150
 epoch: 20, train_loss: 0.9074, test_loss: 0.8567, test_f1: 0.5312
 epoch: 21, train_loss: 0.8912, test_loss: 0.9038, test_f1: 0.5498
 epoch: 22, train_loss: 0.8958, test_loss: 0.9414, test_f1: 0.5263
 epoch: 23, train_loss: 0.8979, test_loss: 0.8692, test_f1: 0.5436
 epoch: 24, train_loss: 0.8869, test_loss: 0.8747, test_f1: 0.5557
 epoch: 25, train_loss: 0.8956, test_loss: 0.9464, test_f1: 0.4941
 epoch: 26, train_loss: 0.8783, test_loss: 0.8614, test_f1: 0.5369
 epoch: 27, train_loss: 0.8723, test_loss: 0.8970, test_f1: 0.5604
 epoch: 28, train_loss: 0.8760, test_loss: 0.8307, test_f1: 0.5682
 epoch: 29, train_loss: 0.8644, test_loss: 1.0049, test_f1: 0.5014
 epoch: 30, train_loss: 0.8602, test_loss: 0.8482, test_f1: 0.5798
 epoch: 31, train_loss: 0.8488, test_loss: 0.8467, test_f1: 0.5412
 epoch: 32, train_loss: 0.8434, test_loss: 1.0718, test_f1: 0.4755
 epoch: 33, train_loss: 0.8646, test_loss: 0.9006, test_f1: 0.5509
 epoch: 34, train_loss: 0.8475, test_loss: 0.8106, test_f1: 0.5786
 epoch: 35, train_loss: 0.8499, test_loss: 0.8060, test_f1: 0.6174
 epoch: 36, train_loss: 0.8335, test_loss: 0.8328, test_f1: 0.5524
 epoch: 37, train_loss: 0.8498, test_loss: 0.8968, test_f1: 0.5790
 epoch: 38, train_loss: 0.8323, test_loss: 0.8331, test_f1: 0.5862
 epoch: 39, train_loss: 0.8398, test_loss: 0.8390, test_f1: 0.5599
 epoch: 40, train_loss: 0.8495, test_loss: 0.8917, test_f1: 0.5991
 epoch: 41, train_loss: 0.8522, test_loss: 0.8239, test_f1: 0.5408
 epoch: 42, train_loss: 0.8453, test_loss: 0.8888, test_f1: 0.5516
 epoch: 43, train_loss: 0.8197, test_loss: 0.8577, test_f1: 0.5607
 epoch: 44, train_loss: 0.8404, test_loss: 0.8288, test_f1: 0.6088
 epoch: 45, train_loss: 0.8300, test_loss: 0.8438, test_f1: 0.5965
 epoch: 46, train_loss: 0.8144, test_loss: 0.8532, test_f1: 0.5246
 epoch: 47, train_loss: 0.8152, test_loss: 0.7874, test_f1: 0.6189
 epoch: 48, train_loss: 0.8177, test_loss: 0.8396, test_f1: 0.5675
 epoch: 49, train_loss: 0.8143, test_loss: 0.8042, test_f1: 0.5698
 epoch: 50, train_loss: 0.8211, test_loss: 0.8438, test_f1: 0.5535
 epoch: 51, train_loss: 0.8024, test_loss: 0.8462, test_f1: 0.6090
 epoch: 52, train_loss: 0.7911, test_loss: 0.8217, test_f1: 0.6036
 epoch: 53, train_loss: 0.7720, test_loss: 0.8752, test_f1: 0.5807
 epoch: 54, train_loss: 0.7743, test_loss: 0.8209, test_f1: 0.6178
 epoch: 55, train_loss: 0.7670, test_loss: 0.8087, test_f1: 0.6050
 epoch: 56, train_loss: 0.7716, test_loss: 0.8360, test_f1: 0.6187
 epoch: 57, train_loss: 0.7740, test_loss: 0.8155, test_f1: 0.6207
 epoch: 58, train_loss: 0.7880, test_loss: 0.7808, test_f1: 0.5867
 epoch: 59, train_loss: 0.7806, test_loss: 0.7984, test_f1: 0.5759
 epoch: 60, train_loss: 0.7781, test_loss: 0.8310, test_f1: 0.6243
 epoch: 61, train_loss: 0.7659, test_loss: 0.8235, test_f1: 0.6209
 epoch: 62, train_loss: 0.7665, test_loss: 0.8261, test_f1: 0.5966
 epoch: 63, train_loss: 0.7649, test_loss: 0.8123, test_f1: 0.6022
 epoch: 64, train_loss: 0.7718, test_loss: 0.8252, test_f1: 0.6048
 epoch: 65, train_loss: 0.7619, test_loss: 0.8257, test_f1: 0.5948
 epoch: 66, train_loss: 0.7707, test_loss: 0.8157, test_f1: 0.6112
 epoch: 67, train_loss: 0.7823, test_loss: 0.8102, test_f1: 0.5944
 epoch: 68, train_loss: 0.7517, test_loss: 0.7770, test_f1: 0.6062
 epoch: 69, train_loss: 0.7550, test_loss: 0.8089, test_f1: 0.6037
 epoch: 70, train_loss: 0.7542, test_loss: 0.8063, test_f1: 0.5920
 epoch: 71, train_loss: 0.7542, test_loss: 0.8862, test_f1: 0.5814
 epoch: 72, train_loss: 0.7682, test_loss: 0.8694, test_f1: 0.5399
 epoch: 73, train_loss: 0.7463, test_loss: 0.8281, test_f1: 0.5579
 epoch: 74, train_loss: 0.7570, test_loss: 0.8301, test_f1: 0.5396
 epoch: 75, train_loss: 0.7636, test_loss: 0.8281, test_f1: 0.6141
 epoch: 76, train_loss: 0.7567, test_loss: 0.7627, test_f1: 0.5931
 epoch: 77, train_loss: 0.7516, test_loss: 0.8174, test_f1: 0.5990
 epoch: 78, train_loss: 0.7628, test_loss: 0.8247, test_f1: 0.6112
 epoch: 79, train_loss: 0.7703, test_loss: 0.8077, test_f1: 0.5817
 epoch: 80, train_loss: 0.7632, test_loss: 0.8346, test_f1: 0.5774
 epoch: 81, train_loss: 0.7492, test_loss: 0.8276, test_f1: 0.5983
 epoch: 82, train_loss: 0.7586, test_loss: 0.8551, test_f1: 0.5725
 epoch: 83, train_loss: 0.7465, test_loss: 0.7883, test_f1: 0.6321
 epoch: 84, train_loss: 0.7361, test_loss: 0.8482, test_f1: 0.5920
 epoch: 85, train_loss: 0.7653, test_loss: 0.8100, test_f1: 0.5772
 epoch: 86, train_loss: 0.7487, test_loss: 0.8785, test_f1: 0.5902
 epoch: 87, train_loss: 0.7502, test_loss: 0.7816, test_f1: 0.5973
 epoch: 88, train_loss: 0.7519, test_loss: 0.8365, test_f1: 0.5763
 epoch: 89, train_loss: 0.7483, test_loss: 0.8263, test_f1: 0.5771
 epoch: 90, train_loss: 0.7398, test_loss: 0.8014, test_f1: 0.5988
 epoch: 91, train_loss: 0.7467, test_loss: 0.8171, test_f1: 0.5587
 epoch: 92, train_loss: 0.7331, test_loss: 0.8378, test_f1: 0.5801
 epoch: 93, train_loss: 0.7408, test_loss: 0.8875, test_f1: 0.5550
 epoch: 94, train_loss: 0.7378, test_loss: 0.8363, test_f1: 0.5919
 epoch: 95, train_loss: 0.7376, test_loss: 0.8301, test_f1: 0.5928
 epoch: 96, train_loss: 0.7277, test_loss: 0.8615, test_f1: 0.6582
 epoch: 97, train_loss: 0.7448, test_loss: 0.8532, test_f1: 0.5743
 epoch: 98, train_loss: 0.7349, test_loss: 0.8445, test_f1: 0.5781
 epoch: 99, train_loss: 0.7291, test_loss: 0.8532, test_f1: 0.6097
##################ITERATION #2 ****************************************
 epoch: 0, train_loss: 1.1262, test_loss: 1.1064, test_f1: 0.3718
 epoch: 1, train_loss: 1.0212, test_loss: 1.1237, test_f1: 0.4498
 epoch: 2, train_loss: 1.0108, test_loss: 1.0067, test_f1: 0.4961
 epoch: 3, train_loss: 0.9834, test_loss: 1.0404, test_f1: 0.5099
 epoch: 4, train_loss: 0.9759, test_loss: 0.9762, test_f1: 0.5384
 epoch: 5, train_loss: 0.9620, test_loss: 0.9914, test_f1: 0.4940
 epoch: 6, train_loss: 0.9561, test_loss: 1.0116, test_f1: 0.4736
 epoch: 7, train_loss: 0.9404, test_loss: 0.9682, test_f1: 0.5155
 epoch: 8, train_loss: 0.9485, test_loss: 1.0410, test_f1: 0.5107
 epoch: 9, train_loss: 0.9400, test_loss: 0.9502, test_f1: 0.5290
 epoch: 10, train_loss: 0.9227, test_loss: 0.9039, test_f1: 0.4942
 epoch: 11, train_loss: 0.9186, test_loss: 0.9690, test_f1: 0.5148
 epoch: 12, train_loss: 0.9126, test_loss: 0.9252, test_f1: 0.4869
 epoch: 13, train_loss: 0.9227, test_loss: 0.9317, test_f1: 0.5076
 epoch: 14, train_loss: 0.9021, test_loss: 0.9554, test_f1: 0.5029
 epoch: 15, train_loss: 0.9262, test_loss: 0.9284, test_f1: 0.5318
 epoch: 16, train_loss: 0.8933, test_loss: 0.9688, test_f1: 0.5178
 epoch: 17, train_loss: 0.8933, test_loss: 0.9031, test_f1: 0.5152
 epoch: 18, train_loss: 0.8733, test_loss: 0.8781, test_f1: 0.5922
 epoch: 19, train_loss: 0.8730, test_loss: 0.8207, test_f1: 0.5742
 epoch: 20, train_loss: 0.8715, test_loss: 1.0100, test_f1: 0.5047
 epoch: 21, train_loss: 0.8808, test_loss: 0.8780, test_f1: 0.5261
 epoch: 22, train_loss: 0.8646, test_loss: 0.8822, test_f1: 0.6151
 epoch: 23, train_loss: 0.8571, test_loss: 0.9122, test_f1: 0.5354
 epoch: 24, train_loss: 0.8663, test_loss: 1.0507, test_f1: 0.4558
 epoch: 25, train_loss: 0.8562, test_loss: 0.8372, test_f1: 0.5782
 epoch: 26, train_loss: 0.8699, test_loss: 0.8747, test_f1: 0.5362
 epoch: 27, train_loss: 0.8590, test_loss: 0.8654, test_f1: 0.5787
 epoch: 28, train_loss: 0.8659, test_loss: 0.8426, test_f1: 0.5283
 epoch: 29, train_loss: 0.9483, test_loss: 0.9438, test_f1: 0.5218
 epoch: 30, train_loss: 0.8837, test_loss: 1.0072, test_f1: 0.5017
 epoch: 31, train_loss: 0.8615, test_loss: 0.9106, test_f1: 0.5394
 epoch: 32, train_loss: 0.8687, test_loss: 0.8414, test_f1: 0.5603
 epoch: 33, train_loss: 0.8486, test_loss: 0.8667, test_f1: 0.5553
 epoch: 34, train_loss: 0.8436, test_loss: 0.9004, test_f1: 0.5416
 epoch: 35, train_loss: 0.8346, test_loss: 0.8936, test_f1: 0.5387
 epoch: 36, train_loss: 0.8475, test_loss: 0.8193, test_f1: 0.5808
 epoch: 37, train_loss: 0.8485, test_loss: 0.8200, test_f1: 0.5841
 epoch: 38, train_loss: 0.8246, test_loss: 0.9197, test_f1: 0.5105
 epoch: 39, train_loss: 0.8326, test_loss: 0.8587, test_f1: 0.5648
 epoch: 40, train_loss: 0.8325, test_loss: 0.8569, test_f1: 0.5389
 epoch: 41, train_loss: 0.8271, test_loss: 0.8726, test_f1: 0.5548
 epoch: 42, train_loss: 0.8355, test_loss: 0.8038, test_f1: 0.5745
 epoch: 43, train_loss: 0.8198, test_loss: 0.8376, test_f1: 0.6158
 epoch: 44, train_loss: 0.8234, test_loss: 0.8501, test_f1: 0.5733
 epoch: 45, train_loss: 0.8235, test_loss: 0.8775, test_f1: 0.5477
 epoch: 46, train_loss: 0.8128, test_loss: 0.8289, test_f1: 0.5585
 epoch: 47, train_loss: 0.8209, test_loss: 0.8142, test_f1: 0.5996
 epoch: 48, train_loss: 0.8119, test_loss: 0.8743, test_f1: 0.5644
 epoch: 49, train_loss: 0.8270, test_loss: 0.8650, test_f1: 0.5603
 epoch: 50, train_loss: 0.8209, test_loss: 0.8500, test_f1: 0.5662
 epoch: 51, train_loss: 0.7869, test_loss: 0.7994, test_f1: 0.5885
 epoch: 52, train_loss: 0.7705, test_loss: 0.8221, test_f1: 0.6123
 epoch: 53, train_loss: 0.7793, test_loss: 0.7891, test_f1: 0.5991
 epoch: 54, train_loss: 0.7728, test_loss: 0.8096, test_f1: 0.5951
 epoch: 55, train_loss: 0.7744, test_loss: 0.8059, test_f1: 0.5865
 epoch: 56, train_loss: 0.7677, test_loss: 0.8262, test_f1: 0.5812
 epoch: 57, train_loss: 0.7763, test_loss: 0.8077, test_f1: 0.6130
 epoch: 58, train_loss: 0.7737, test_loss: 0.7852, test_f1: 0.6058
 epoch: 59, train_loss: 0.7572, test_loss: 0.8574, test_f1: 0.5420
 epoch: 60, train_loss: 0.7620, test_loss: 0.8119, test_f1: 0.6248
 epoch: 61, train_loss: 0.7675, test_loss: 0.8275, test_f1: 0.6149
 epoch: 62, train_loss: 0.7630, test_loss: 0.8138, test_f1: 0.5955
 epoch: 63, train_loss: 0.7565, test_loss: 0.7849, test_f1: 0.6162
 epoch: 64, train_loss: 0.7577, test_loss: 0.8128, test_f1: 0.6178
 epoch: 65, train_loss: 0.7633, test_loss: 0.8178, test_f1: 0.6161
 epoch: 66, train_loss: 0.7507, test_loss: 0.7943, test_f1: 0.6183
 epoch: 67, train_loss: 0.7555, test_loss: 0.8322, test_f1: 0.5592
 epoch: 68, train_loss: 0.7585, test_loss: 0.7884, test_f1: 0.6037
 epoch: 69, train_loss: 0.7594, test_loss: 0.8185, test_f1: 0.6122
 epoch: 70, train_loss: 0.7445, test_loss: 0.8247, test_f1: 0.5698
 epoch: 71, train_loss: 0.7594, test_loss: 0.8343, test_f1: 0.6112
 epoch: 72, train_loss: 0.7645, test_loss: 0.7799, test_f1: 0.6213
 epoch: 73, train_loss: 0.7555, test_loss: 0.8584, test_f1: 0.5982
 epoch: 74, train_loss: 0.7553, test_loss: 0.8006, test_f1: 0.6184
 epoch: 75, train_loss: 0.7663, test_loss: 0.8193, test_f1: 0.5875
 epoch: 76, train_loss: 0.7390, test_loss: 0.8125, test_f1: 0.6125
 epoch: 77, train_loss: 0.7492, test_loss: 0.8580, test_f1: 0.6061
 epoch: 78, train_loss: 0.7479, test_loss: 0.8044, test_f1: 0.5890
 epoch: 79, train_loss: 0.7408, test_loss: 0.8292, test_f1: 0.5998
 epoch: 80, train_loss: 0.7387, test_loss: 0.8029, test_f1: 0.6146
 epoch: 81, train_loss: 0.7459, test_loss: 0.8113, test_f1: 0.6001
 epoch: 82, train_loss: 0.7486, test_loss: 0.8223, test_f1: 0.6106
 epoch: 83, train_loss: 0.7256, test_loss: 0.8555, test_f1: 0.6084
 epoch: 84, train_loss: 0.7429, test_loss: 0.8096, test_f1: 0.6132
 epoch: 85, train_loss: 0.7651, test_loss: 0.8273, test_f1: 0.6118
 epoch: 86, train_loss: 0.7532, test_loss: 0.8077, test_f1: 0.5976
 epoch: 87, train_loss: 0.7399, test_loss: 0.8093, test_f1: 0.6452
 epoch: 88, train_loss: 0.7349, test_loss: 0.7789, test_f1: 0.6255
 epoch: 89, train_loss: 0.7494, test_loss: 0.7637, test_f1: 0.6246
 epoch: 90, train_loss: 0.7414, test_loss: 0.8007, test_f1: 0.5977
 epoch: 91, train_loss: 0.7306, test_loss: 0.7901, test_f1: 0.5964
 epoch: 92, train_loss: 0.7359, test_loss: 0.8035, test_f1: 0.5869
 epoch: 93, train_loss: 0.7392, test_loss: 0.8395, test_f1: 0.5801
 epoch: 94, train_loss: 0.7362, test_loss: 0.7845, test_f1: 0.6076
 epoch: 95, train_loss: 0.7270, test_loss: 0.7923, test_f1: 0.6109
 epoch: 96, train_loss: 0.7203, test_loss: 0.7916, test_f1: 0.6121
 epoch: 97, train_loss: 0.7470, test_loss: 0.7992, test_f1: 0.6044
 epoch: 98, train_loss: 0.7306, test_loss: 0.8167, test_f1: 0.5981
 epoch: 99, train_loss: 0.7457, test_loss: 0.7921, test_f1: 0.6090
##################ITERATION #3 ****************************************
 epoch: 0, train_loss: 1.1253, test_loss: 1.1684, test_f1: 0.4105
 epoch: 1, train_loss: 1.0580, test_loss: 1.1397, test_f1: 0.3907
 epoch: 2, train_loss: 1.0379, test_loss: 1.0435, test_f1: 0.4671
 epoch: 3, train_loss: 1.0173, test_loss: 1.0077, test_f1: 0.4735
 epoch: 4, train_loss: 1.0055, test_loss: 1.1134, test_f1: 0.4599
 epoch: 5, train_loss: 1.0142, test_loss: 0.9979, test_f1: 0.4725
 epoch: 6, train_loss: 0.9961, test_loss: 1.0343, test_f1: 0.4550
 epoch: 7, train_loss: 0.9842, test_loss: 1.0188, test_f1: 0.4451
 epoch: 8, train_loss: 0.9798, test_loss: 1.0324, test_f1: 0.4774
 epoch: 9, train_loss: 0.9708, test_loss: 0.9801, test_f1: 0.4986
 epoch: 10, train_loss: 0.9618, test_loss: 0.9978, test_f1: 0.4777
 epoch: 11, train_loss: 0.9587, test_loss: 1.0066, test_f1: 0.4939
 epoch: 12, train_loss: 0.9566, test_loss: 0.9462, test_f1: 0.5499
 epoch: 13, train_loss: 0.9411, test_loss: 0.9704, test_f1: 0.5152
 epoch: 14, train_loss: 0.9485, test_loss: 0.9772, test_f1: 0.5022
 epoch: 15, train_loss: 0.9400, test_loss: 0.9657, test_f1: 0.4917
 epoch: 16, train_loss: 0.9414, test_loss: 0.9981, test_f1: 0.4819
 epoch: 17, train_loss: 0.9350, test_loss: 0.9336, test_f1: 0.5083
 epoch: 18, train_loss: 0.9350, test_loss: 0.9570, test_f1: 0.5059
 epoch: 19, train_loss: 0.9285, test_loss: 1.0611, test_f1: 0.4862
 epoch: 20, train_loss: 0.9124, test_loss: 0.9134, test_f1: 0.5033
 epoch: 21, train_loss: 0.9212, test_loss: 1.0046, test_f1: 0.5085
 epoch: 22, train_loss: 0.9116, test_loss: 0.9700, test_f1: 0.5074
 epoch: 23, train_loss: 0.9105, test_loss: 0.9304, test_f1: 0.4999
 epoch: 24, train_loss: 0.9081, test_loss: 0.9426, test_f1: 0.5031
 epoch: 25, train_loss: 0.9155, test_loss: 0.9509, test_f1: 0.5059
 epoch: 26, train_loss: 0.8982, test_loss: 0.9218, test_f1: 0.5429
 epoch: 27, train_loss: 0.8996, test_loss: 0.9432, test_f1: 0.5151
 epoch: 28, train_loss: 0.8902, test_loss: 0.9274, test_f1: 0.4839
 epoch: 29, train_loss: 0.8917, test_loss: 0.9007, test_f1: 0.5352
 epoch: 30, train_loss: 0.8830, test_loss: 0.9127, test_f1: 0.5726
 epoch: 31, train_loss: 0.8746, test_loss: 0.8779, test_f1: 0.5272
 epoch: 32, train_loss: 0.8795, test_loss: 0.9384, test_f1: 0.5048
 epoch: 33, train_loss: 0.8669, test_loss: 0.9436, test_f1: 0.5484
 epoch: 34, train_loss: 0.8809, test_loss: 0.9106, test_f1: 0.5612
 epoch: 35, train_loss: 0.8725, test_loss: 0.9646, test_f1: 0.5026
 epoch: 36, train_loss: 0.8559, test_loss: 0.8651, test_f1: 0.5352
 epoch: 37, train_loss: 0.8646, test_loss: 0.9291, test_f1: 0.5670
 epoch: 38, train_loss: 0.8622, test_loss: 0.9261, test_f1: 0.5709
 epoch: 39, train_loss: 0.8640, test_loss: 0.9203, test_f1: 0.5676
 epoch: 40, train_loss: 0.8504, test_loss: 0.8406, test_f1: 0.5548
 epoch: 41, train_loss: 0.8544, test_loss: 0.8955, test_f1: 0.5369
 epoch: 42, train_loss: 0.8583, test_loss: 0.8417, test_f1: 0.5859
 epoch: 43, train_loss: 0.8507, test_loss: 0.8885, test_f1: 0.6150
 epoch: 44, train_loss: 0.8566, test_loss: 0.8893, test_f1: 0.5759
 epoch: 45, train_loss: 0.8439, test_loss: 0.8870, test_f1: 0.6189
 epoch: 46, train_loss: 0.8407, test_loss: 0.8895, test_f1: 0.5981
 epoch: 47, train_loss: 0.8530, test_loss: 0.9279, test_f1: 0.4959
 epoch: 48, train_loss: 0.8246, test_loss: 0.8868, test_f1: 0.5710
 epoch: 49, train_loss: 0.8346, test_loss: 0.9041, test_f1: 0.5633
 epoch: 50, train_loss: 0.8402, test_loss: 0.8383, test_f1: 0.5965
 epoch: 51, train_loss: 0.8069, test_loss: 0.8485, test_f1: 0.5851
 epoch: 52, train_loss: 0.8054, test_loss: 0.8122, test_f1: 0.6242
 epoch: 53, train_loss: 0.8023, test_loss: 0.8579, test_f1: 0.5622
 epoch: 54, train_loss: 0.8008, test_loss: 0.8380, test_f1: 0.5802
 epoch: 55, train_loss: 0.8073, test_loss: 0.8531, test_f1: 0.5473
 epoch: 56, train_loss: 0.7968, test_loss: 0.8703, test_f1: 0.5732
 epoch: 57, train_loss: 0.7996, test_loss: 0.8410, test_f1: 0.5970
 epoch: 58, train_loss: 0.8058, test_loss: 0.8300, test_f1: 0.6196
 epoch: 59, train_loss: 0.7937, test_loss: 0.8592, test_f1: 0.6108
 epoch: 60, train_loss: 0.7894, test_loss: 0.8713, test_f1: 0.5711
 epoch: 61, train_loss: 0.7773, test_loss: 0.8413, test_f1: 0.5931
 epoch: 62, train_loss: 0.7907, test_loss: 0.8805, test_f1: 0.5948
 epoch: 63, train_loss: 0.7821, test_loss: 0.8369, test_f1: 0.5903
 epoch: 64, train_loss: 0.7720, test_loss: 0.8532, test_f1: 0.5971
 epoch: 65, train_loss: 0.7816, test_loss: 0.8445, test_f1: 0.5977
 epoch: 66, train_loss: 0.7841, test_loss: 0.8685, test_f1: 0.5845
 epoch: 67, train_loss: 0.7702, test_loss: 0.8738, test_f1: 0.5625
 epoch: 68, train_loss: 0.7782, test_loss: 0.8726, test_f1: 0.6030
 epoch: 69, train_loss: 0.7734, test_loss: 0.8444, test_f1: 0.6116
 epoch: 70, train_loss: 0.7637, test_loss: 0.8322, test_f1: 0.6043
 epoch: 71, train_loss: 0.7742, test_loss: 0.8357, test_f1: 0.6298
 epoch: 72, train_loss: 0.7655, test_loss: 0.8341, test_f1: 0.5723
 epoch: 73, train_loss: 0.7753, test_loss: 0.8454, test_f1: 0.5840
 epoch: 74, train_loss: 0.7668, test_loss: 0.8446, test_f1: 0.6190
 epoch: 75, train_loss: 0.7697, test_loss: 0.8546, test_f1: 0.5981
 epoch: 76, train_loss: 0.7716, test_loss: 0.8276, test_f1: 0.5984
 epoch: 77, train_loss: 0.7746, test_loss: 0.8279, test_f1: 0.5823
 epoch: 78, train_loss: 0.7631, test_loss: 0.8210, test_f1: 0.5908
 epoch: 79, train_loss: 0.7712, test_loss: 0.8308, test_f1: 0.6031
 epoch: 80, train_loss: 0.7597, test_loss: 0.8439, test_f1: 0.5835
 epoch: 81, train_loss: 0.7678, test_loss: 0.8446, test_f1: 0.5888
 epoch: 82, train_loss: 0.7455, test_loss: 0.8400, test_f1: 0.6010
 epoch: 83, train_loss: 0.7578, test_loss: 0.8199, test_f1: 0.5965
 epoch: 84, train_loss: 0.7642, test_loss: 0.8368, test_f1: 0.5907
 epoch: 85, train_loss: 0.7653, test_loss: 0.8268, test_f1: 0.5998
 epoch: 86, train_loss: 0.7734, test_loss: 0.8297, test_f1: 0.5967
 epoch: 87, train_loss: 0.7515, test_loss: 0.7982, test_f1: 0.5980
 epoch: 88, train_loss: 0.7638, test_loss: 0.8124, test_f1: 0.6030
 epoch: 89, train_loss: 0.7514, test_loss: 0.8370, test_f1: 0.5688
 epoch: 90, train_loss: 0.7571, test_loss: 0.8377, test_f1: 0.6092
 epoch: 91, train_loss: 0.7495, test_loss: 0.8239, test_f1: 0.6238
 epoch: 92, train_loss: 0.7542, test_loss: 0.7958, test_f1: 0.5987
 epoch: 93, train_loss: 0.7484, test_loss: 0.8212, test_f1: 0.6235
 epoch: 94, train_loss: 0.7506, test_loss: 0.8133, test_f1: 0.5859
 epoch: 95, train_loss: 0.7670, test_loss: 0.8484, test_f1: 0.5670
 epoch: 96, train_loss: 0.7563, test_loss: 0.8350, test_f1: 0.5763
 epoch: 97, train_loss: 0.7492, test_loss: 0.8164, test_f1: 0.6155
 epoch: 98, train_loss: 0.7364, test_loss: 0.8418, test_f1: 0.6177
 epoch: 99, train_loss: 0.7337, test_loss: 0.8364, test_f1: 0.6092
##################ITERATION #4 ****************************************
 epoch: 0, train_loss: 1.1357, test_loss: 1.0662, test_f1: 0.4131
 epoch: 1, train_loss: 1.0275, test_loss: 1.1471, test_f1: 0.4400
 epoch: 2, train_loss: 1.0164, test_loss: 1.0193, test_f1: 0.4628
 epoch: 3, train_loss: 1.0113, test_loss: 1.0294, test_f1: 0.4724
 epoch: 4, train_loss: 0.9857, test_loss: 1.0845, test_f1: 0.4667
 epoch: 5, train_loss: 0.9789, test_loss: 1.0357, test_f1: 0.4720
 epoch: 6, train_loss: 0.9635, test_loss: 1.0631, test_f1: 0.4829
 epoch: 7, train_loss: 0.9592, test_loss: 1.0672, test_f1: 0.4862
 epoch: 8, train_loss: 0.9586, test_loss: 1.0081, test_f1: 0.4947
 epoch: 9, train_loss: 0.9629, test_loss: 1.0637, test_f1: 0.4565
 epoch: 10, train_loss: 0.9531, test_loss: 0.9968, test_f1: 0.5070
 epoch: 11, train_loss: 0.9486, test_loss: 1.0183, test_f1: 0.5071
 epoch: 12, train_loss: 0.9455, test_loss: 1.0017, test_f1: 0.5029
 epoch: 13, train_loss: 0.9590, test_loss: 1.0092, test_f1: 0.5042
 epoch: 14, train_loss: 0.9308, test_loss: 1.1113, test_f1: 0.4273
 epoch: 15, train_loss: 0.9365, test_loss: 1.0811, test_f1: 0.4602
 epoch: 16, train_loss: 0.9307, test_loss: 0.9615, test_f1: 0.5370
 epoch: 17, train_loss: 0.9180, test_loss: 0.9583, test_f1: 0.5001
 epoch: 18, train_loss: 0.9349, test_loss: 0.9370, test_f1: 0.5140
 epoch: 19, train_loss: 0.9230, test_loss: 0.9613, test_f1: 0.5633
 epoch: 20, train_loss: 0.9140, test_loss: 0.9815, test_f1: 0.5232
 epoch: 21, train_loss: 0.9369, test_loss: 1.0184, test_f1: 0.5059
 epoch: 22, train_loss: 0.9184, test_loss: 0.9787, test_f1: 0.5068
 epoch: 23, train_loss: 0.9114, test_loss: 1.0100, test_f1: 0.4849
 epoch: 24, train_loss: 0.8856, test_loss: 0.9351, test_f1: 0.5770
 epoch: 25, train_loss: 0.8897, test_loss: 0.9167, test_f1: 0.5430
 epoch: 26, train_loss: 0.8940, test_loss: 0.9670, test_f1: 0.5318
 epoch: 27, train_loss: 0.9092, test_loss: 0.9643, test_f1: 0.5562
 epoch: 28, train_loss: 0.8808, test_loss: 0.9088, test_f1: 0.5304
 epoch: 29, train_loss: 0.8839, test_loss: 0.9034, test_f1: 0.5370
 epoch: 30, train_loss: 0.8819, test_loss: 0.8731, test_f1: 0.5461
 epoch: 31, train_loss: 0.8886, test_loss: 0.9500, test_f1: 0.5683
 epoch: 32, train_loss: 0.8888, test_loss: 0.9324, test_f1: 0.4997
 epoch: 33, train_loss: 0.8850, test_loss: 0.9397, test_f1: 0.5304
 epoch: 34, train_loss: 0.8910, test_loss: 0.9271, test_f1: 0.5174
 epoch: 35, train_loss: 0.8746, test_loss: 0.8488, test_f1: 0.5297
 epoch: 36, train_loss: 0.8739, test_loss: 1.0220, test_f1: 0.5817
 epoch: 37, train_loss: 0.8733, test_loss: 0.8923, test_f1: 0.5492
 epoch: 38, train_loss: 0.8857, test_loss: 0.9480, test_f1: 0.5337
 epoch: 39, train_loss: 0.8640, test_loss: 0.8684, test_f1: 0.5765
 epoch: 40, train_loss: 0.8619, test_loss: 0.9088, test_f1: 0.5334
 epoch: 41, train_loss: 0.8771, test_loss: 0.8825, test_f1: 0.5805
 epoch: 42, train_loss: 0.8611, test_loss: 0.9158, test_f1: 0.5404
 epoch: 43, train_loss: 0.9051, test_loss: 0.8714, test_f1: 0.5604
 epoch: 44, train_loss: 0.8708, test_loss: 0.8300, test_f1: 0.5397
 epoch: 45, train_loss: 0.8540, test_loss: 0.8622, test_f1: 0.5568
 epoch: 46, train_loss: 0.8676, test_loss: 0.8894, test_f1: 0.5608
 epoch: 47, train_loss: 0.8598, test_loss: 0.9286, test_f1: 0.5463
 epoch: 48, train_loss: 0.8439, test_loss: 0.8912, test_f1: 0.5994
 epoch: 49, train_loss: 0.8472, test_loss: 0.8429, test_f1: 0.6022
 epoch: 50, train_loss: 0.8439, test_loss: 0.8400, test_f1: 0.5414
 epoch: 51, train_loss: 0.8329, test_loss: 0.8225, test_f1: 0.5850
 epoch: 52, train_loss: 0.8245, test_loss: 0.8605, test_f1: 0.5970
 epoch: 53, train_loss: 0.8086, test_loss: 0.8571, test_f1: 0.5715
 epoch: 54, train_loss: 0.8162, test_loss: 0.8468, test_f1: 0.6205
 epoch: 55, train_loss: 0.7972, test_loss: 0.8370, test_f1: 0.5846
 epoch: 56, train_loss: 0.8036, test_loss: 0.8086, test_f1: 0.5647
 epoch: 57, train_loss: 0.7994, test_loss: 0.8506, test_f1: 0.6183
 epoch: 58, train_loss: 0.7991, test_loss: 0.8542, test_f1: 0.6103
 epoch: 59, train_loss: 0.7876, test_loss: 0.8435, test_f1: 0.5982
 epoch: 60, train_loss: 0.8016, test_loss: 0.8118, test_f1: 0.5730
 epoch: 61, train_loss: 0.7815, test_loss: 0.8964, test_f1: 0.5580
 epoch: 62, train_loss: 0.7885, test_loss: 0.8560, test_f1: 0.5737
 epoch: 63, train_loss: 0.7817, test_loss: 0.9007, test_f1: 0.5703
 epoch: 64, train_loss: 0.7962, test_loss: 0.8209, test_f1: 0.5871
 epoch: 65, train_loss: 0.7900, test_loss: 0.8534, test_f1: 0.6222
 epoch: 66, train_loss: 0.7808, test_loss: 0.8421, test_f1: 0.5715
 epoch: 67, train_loss: 0.8035, test_loss: 0.8274, test_f1: 0.5918
 epoch: 68, train_loss: 0.7965, test_loss: 0.8032, test_f1: 0.5687
 epoch: 69, train_loss: 0.7798, test_loss: 0.8976, test_f1: 0.6215
 epoch: 70, train_loss: 0.7959, test_loss: 0.8657, test_f1: 0.5856
 epoch: 71, train_loss: 0.7802, test_loss: 0.8701, test_f1: 0.5999
 epoch: 72, train_loss: 0.7706, test_loss: 0.8833, test_f1: 0.5988
 epoch: 73, train_loss: 0.7769, test_loss: 0.8616, test_f1: 0.5847
 epoch: 74, train_loss: 0.7778, test_loss: 0.8073, test_f1: 0.5876
 epoch: 75, train_loss: 0.7597, test_loss: 0.8272, test_f1: 0.6101
 epoch: 76, train_loss: 0.7720, test_loss: 0.8361, test_f1: 0.6006
 epoch: 77, train_loss: 0.7571, test_loss: 0.8978, test_f1: 0.6099
 epoch: 78, train_loss: 0.7725, test_loss: 0.8255, test_f1: 0.5992
 epoch: 79, train_loss: 0.7581, test_loss: 0.8284, test_f1: 0.5941
 epoch: 80, train_loss: 0.7596, test_loss: 0.9037, test_f1: 0.5853
 epoch: 81, train_loss: 0.7832, test_loss: 0.8857, test_f1: 0.6108
 epoch: 82, train_loss: 0.7722, test_loss: 0.9123, test_f1: 0.5781
 epoch: 83, train_loss: 0.7590, test_loss: 0.8866, test_f1: 0.5769
 epoch: 84, train_loss: 0.7646, test_loss: 0.9136, test_f1: 0.5724
 epoch: 85, train_loss: 0.7482, test_loss: 0.9095, test_f1: 0.5917
 epoch: 86, train_loss: 0.7679, test_loss: 0.8256, test_f1: 0.5842
 epoch: 87, train_loss: 0.7547, test_loss: 0.8438, test_f1: 0.5889
 epoch: 88, train_loss: 0.7501, test_loss: 0.8419, test_f1: 0.6349
 epoch: 89, train_loss: 0.7577, test_loss: 0.8193, test_f1: 0.5941
 epoch: 90, train_loss: 0.7458, test_loss: 0.7708, test_f1: 0.5955
 epoch: 91, train_loss: 0.7449, test_loss: 0.8538, test_f1: 0.5944
 epoch: 92, train_loss: 0.7476, test_loss: 0.7507, test_f1: 0.6223
 epoch: 93, train_loss: 0.7343, test_loss: 0.8206, test_f1: 0.6124
 epoch: 94, train_loss: 0.7702, test_loss: 0.8180, test_f1: 0.6200
 epoch: 95, train_loss: 0.7461, test_loss: 0.7939, test_f1: 0.6070
 epoch: 96, train_loss: 0.7357, test_loss: 0.8515, test_f1: 0.6096
 epoch: 97, train_loss: 0.7334, test_loss: 0.8423, test_f1: 0.6320
 epoch: 98, train_loss: 0.7350, test_loss: 0.8546, test_f1: 0.6161
 epoch: 99, train_loss: 0.7382, test_loss: 0.8370, test_f1: 0.6111
##################ITERATION #5 ****************************************
 epoch: 0, train_loss: 1.1200, test_loss: 1.0326, test_f1: 0.4270
 epoch: 1, train_loss: 1.0195, test_loss: 1.0761, test_f1: 0.4123
 epoch: 2, train_loss: 0.9971, test_loss: 1.0359, test_f1: 0.4925
 epoch: 3, train_loss: 0.9959, test_loss: 1.0723, test_f1: 0.4341
 epoch: 4, train_loss: 1.0238, test_loss: 1.0284, test_f1: 0.4387
 epoch: 5, train_loss: 0.9996, test_loss: 0.9946, test_f1: 0.4733
 epoch: 6, train_loss: 0.9762, test_loss: 1.0198, test_f1: 0.4702
 epoch: 7, train_loss: 0.9726, test_loss: 1.0958, test_f1: 0.4444
 epoch: 8, train_loss: 0.9700, test_loss: 1.0218, test_f1: 0.5079
 epoch: 9, train_loss: 0.9767, test_loss: 0.9705, test_f1: 0.4898
 epoch: 10, train_loss: 0.9525, test_loss: 0.9498, test_f1: 0.5181
 epoch: 11, train_loss: 0.9606, test_loss: 0.9489, test_f1: 0.5016
 epoch: 12, train_loss: 0.9552, test_loss: 0.9030, test_f1: 0.5149
 epoch: 13, train_loss: 0.9398, test_loss: 0.9149, test_f1: 0.5149
 epoch: 14, train_loss: 0.9276, test_loss: 0.9565, test_f1: 0.4813
 epoch: 15, train_loss: 0.9368, test_loss: 0.9341, test_f1: 0.4877
 epoch: 16, train_loss: 0.9354, test_loss: 0.9436, test_f1: 0.4786
 epoch: 17, train_loss: 0.9247, test_loss: 0.8589, test_f1: 0.5980
 epoch: 18, train_loss: 0.9107, test_loss: 0.8712, test_f1: 0.5397
 epoch: 19, train_loss: 0.9104, test_loss: 0.8948, test_f1: 0.5222
 epoch: 20, train_loss: 0.9228, test_loss: 0.8443, test_f1: 0.5330
 epoch: 21, train_loss: 0.8928, test_loss: 0.8749, test_f1: 0.5509
 epoch: 22, train_loss: 0.8874, test_loss: 0.9011, test_f1: 0.4919
 epoch: 23, train_loss: 0.9152, test_loss: 0.8773, test_f1: 0.5089
 epoch: 24, train_loss: 0.8875, test_loss: 0.9378, test_f1: 0.4963
 epoch: 25, train_loss: 0.8812, test_loss: 0.8773, test_f1: 0.5185
 epoch: 26, train_loss: 0.8818, test_loss: 0.8669, test_f1: 0.5454
 epoch: 27, train_loss: 0.8600, test_loss: 0.8944, test_f1: 0.5087
 epoch: 28, train_loss: 0.8568, test_loss: 0.8910, test_f1: 0.5206
 epoch: 29, train_loss: 0.8450, test_loss: 0.9058, test_f1: 0.5595
 epoch: 30, train_loss: 0.8541, test_loss: 0.8778, test_f1: 0.5310
 epoch: 31, train_loss: 0.8519, test_loss: 0.8620, test_f1: 0.5449
 epoch: 32, train_loss: 0.8547, test_loss: 0.9231, test_f1: 0.5629
 epoch: 33, train_loss: 0.8555, test_loss: 0.8575, test_f1: 0.5535
 epoch: 34, train_loss: 0.8412, test_loss: 0.8149, test_f1: 0.5627
 epoch: 35, train_loss: 0.8367, test_loss: 0.9099, test_f1: 0.5175
 epoch: 36, train_loss: 0.8381, test_loss: 1.0272, test_f1: 0.4571
 epoch: 37, train_loss: 0.8487, test_loss: 0.8390, test_f1: 0.5515
 epoch: 38, train_loss: 0.8541, test_loss: 0.8326, test_f1: 0.5396
 epoch: 39, train_loss: 0.8332, test_loss: 1.0268, test_f1: 0.5669
 epoch: 40, train_loss: 0.8338, test_loss: 1.0974, test_f1: 0.5072
 epoch: 41, train_loss: 0.8259, test_loss: 0.8393, test_f1: 0.5496
 epoch: 42, train_loss: 0.8323, test_loss: 0.8346, test_f1: 0.5541
 epoch: 43, train_loss: 0.8206, test_loss: 0.8528, test_f1: 0.5221
 epoch: 44, train_loss: 0.8376, test_loss: 0.8642, test_f1: 0.5351
 epoch: 45, train_loss: 0.8347, test_loss: 0.9157, test_f1: 0.5026
 epoch: 46, train_loss: 0.8248, test_loss: 0.8389, test_f1: 0.5364
 epoch: 47, train_loss: 0.8222, test_loss: 0.8747, test_f1: 0.5877
 epoch: 48, train_loss: 0.8209, test_loss: 0.8392, test_f1: 0.5751
 epoch: 49, train_loss: 0.8228, test_loss: 0.8528, test_f1: 0.5219
 epoch: 50, train_loss: 0.8273, test_loss: 0.8802, test_f1: 0.6049
 epoch: 51, train_loss: 0.8004, test_loss: 0.8340, test_f1: 0.5889
 epoch: 52, train_loss: 0.8075, test_loss: 0.8186, test_f1: 0.5791
 epoch: 53, train_loss: 0.7929, test_loss: 0.8232, test_f1: 0.5842
 epoch: 54, train_loss: 0.7972, test_loss: 0.8184, test_f1: 0.6074
 epoch: 55, train_loss: 0.7946, test_loss: 0.8464, test_f1: 0.5767
 epoch: 56, train_loss: 0.7907, test_loss: 0.8288, test_f1: 0.6291
 epoch: 57, train_loss: 0.7888, test_loss: 0.8358, test_f1: 0.5677
 epoch: 58, train_loss: 0.7888, test_loss: 0.8250, test_f1: 0.5805
 epoch: 59, train_loss: 0.7875, test_loss: 0.8198, test_f1: 0.5842
 epoch: 60, train_loss: 0.7771, test_loss: 0.8559, test_f1: 0.6009
 epoch: 61, train_loss: 0.7797, test_loss: 0.8233, test_f1: 0.5726
 epoch: 62, train_loss: 0.7815, test_loss: 0.8084, test_f1: 0.6503
 epoch: 63, train_loss: 0.7879, test_loss: 0.8511, test_f1: 0.5826
 epoch: 64, train_loss: 0.7670, test_loss: 0.8499, test_f1: 0.5937
 epoch: 65, train_loss: 0.7696, test_loss: 0.8410, test_f1: 0.6234
 epoch: 66, train_loss: 0.7632, test_loss: 0.8326, test_f1: 0.5595
 epoch: 67, train_loss: 0.7691, test_loss: 0.8575, test_f1: 0.5537
 epoch: 68, train_loss: 0.7698, test_loss: 0.8236, test_f1: 0.5441
 epoch: 69, train_loss: 0.7750, test_loss: 0.8633, test_f1: 0.6001
 epoch: 70, train_loss: 0.7712, test_loss: 0.8226, test_f1: 0.6518
 epoch: 71, train_loss: 0.7657, test_loss: 0.8409, test_f1: 0.6033
 epoch: 72, train_loss: 0.7588, test_loss: 0.8491, test_f1: 0.5543
 epoch: 73, train_loss: 0.7754, test_loss: 0.8010, test_f1: 0.5992
 epoch: 74, train_loss: 0.7653, test_loss: 0.7976, test_f1: 0.6069
 epoch: 75, train_loss: 0.7675, test_loss: 0.8064, test_f1: 0.6188
 epoch: 76, train_loss: 0.7779, test_loss: 0.8189, test_f1: 0.5601
 epoch: 77, train_loss: 0.7519, test_loss: 0.8193, test_f1: 0.6365
 epoch: 78, train_loss: 0.7743, test_loss: 0.7932, test_f1: 0.6012
 epoch: 79, train_loss: 0.7634, test_loss: 0.8067, test_f1: 0.6329
 epoch: 80, train_loss: 0.7656, test_loss: 0.8252, test_f1: 0.5894
 epoch: 81, train_loss: 0.7581, test_loss: 0.8246, test_f1: 0.6129
 epoch: 82, train_loss: 0.7508, test_loss: 0.8267, test_f1: 0.6499
 epoch: 83, train_loss: 0.7536, test_loss: 0.8122, test_f1: 0.5849
 epoch: 84, train_loss: 0.7595, test_loss: 0.8046, test_f1: 0.5974
 epoch: 85, train_loss: 0.7609, test_loss: 0.8560, test_f1: 0.5608
 epoch: 86, train_loss: 0.7581, test_loss: 0.8083, test_f1: 0.6448
 epoch: 87, train_loss: 0.7478, test_loss: 0.8262, test_f1: 0.5835
 epoch: 88, train_loss: 0.7523, test_loss: 0.8510, test_f1: 0.5600
 epoch: 89, train_loss: 0.7451, test_loss: 0.7978, test_f1: 0.6044
 epoch: 90, train_loss: 0.7450, test_loss: 0.8874, test_f1: 0.6110
 epoch: 91, train_loss: 0.7493, test_loss: 0.8256, test_f1: 0.6005
 epoch: 92, train_loss: 0.7587, test_loss: 0.8033, test_f1: 0.6304
 epoch: 93, train_loss: 0.7474, test_loss: 0.8293, test_f1: 0.6328
 epoch: 94, train_loss: 0.7408, test_loss: 0.7821, test_f1: 0.6380
 epoch: 95, train_loss: 0.7537, test_loss: 0.7761, test_f1: 0.6361
 epoch: 96, train_loss: 0.7437, test_loss: 0.7842, test_f1: 0.6509
 epoch: 97, train_loss: 0.7578, test_loss: 0.8111, test_f1: 0.6273
 epoch: 98, train_loss: 0.7446, test_loss: 0.7807, test_f1: 0.6256
 epoch: 99, train_loss: 0.7475, test_loss: 0.8016, test_f1: 0.6197
##################ITERATION #6 ****************************************
 epoch: 0, train_loss: 1.1287, test_loss: 1.1165, test_f1: 0.3450
 epoch: 1, train_loss: 1.0313, test_loss: 1.0517, test_f1: 0.4729
 epoch: 2, train_loss: 1.0067, test_loss: 1.0112, test_f1: 0.4760
 epoch: 3, train_loss: 0.9838, test_loss: 1.0468, test_f1: 0.4850
 epoch: 4, train_loss: 0.9758, test_loss: 1.0103, test_f1: 0.4895
 epoch: 5, train_loss: 0.9519, test_loss: 0.9854, test_f1: 0.4929
 epoch: 6, train_loss: 0.9553, test_loss: 0.9711, test_f1: 0.5091
 epoch: 7, train_loss: 0.9629, test_loss: 0.9538, test_f1: 0.4883
 epoch: 8, train_loss: 0.9290, test_loss: 0.9619, test_f1: 0.4873
 epoch: 9, train_loss: 0.9535, test_loss: 0.9884, test_f1: 0.4559
 epoch: 10, train_loss: 0.9445, test_loss: 0.9431, test_f1: 0.5104
 epoch: 11, train_loss: 0.9290, test_loss: 0.9164, test_f1: 0.5070
 epoch: 12, train_loss: 0.9065, test_loss: 0.9144, test_f1: 0.5270
 epoch: 13, train_loss: 0.9054, test_loss: 0.9440, test_f1: 0.5379
 epoch: 14, train_loss: 0.9173, test_loss: 0.9095, test_f1: 0.5713
 epoch: 15, train_loss: 0.9133, test_loss: 0.8624, test_f1: 0.5177
 epoch: 16, train_loss: 0.9150, test_loss: 0.9593, test_f1: 0.5012
 epoch: 17, train_loss: 0.8967, test_loss: 0.9602, test_f1: 0.5589
 epoch: 18, train_loss: 0.9153, test_loss: 0.8104, test_f1: 0.5493
 epoch: 19, train_loss: 0.9022, test_loss: 0.8254, test_f1: 0.5360
 epoch: 20, train_loss: 0.8783, test_loss: 0.9822, test_f1: 0.4722
 epoch: 21, train_loss: 0.8895, test_loss: 0.8852, test_f1: 0.5498
 epoch: 22, train_loss: 0.8915, test_loss: 0.9567, test_f1: 0.5447
 epoch: 23, train_loss: 0.8858, test_loss: 0.8718, test_f1: 0.5299
 epoch: 24, train_loss: 0.8778, test_loss: 0.8749, test_f1: 0.5242
 epoch: 25, train_loss: 0.8717, test_loss: 0.8908, test_f1: 0.5189
 epoch: 26, train_loss: 0.8580, test_loss: 0.8751, test_f1: 0.5321
 epoch: 27, train_loss: 0.8640, test_loss: 0.8704, test_f1: 0.5610
 epoch: 28, train_loss: 0.8681, test_loss: 0.8731, test_f1: 0.5467
 epoch: 29, train_loss: 0.8586, test_loss: 0.8188, test_f1: 0.5450
 epoch: 30, train_loss: 0.8708, test_loss: 0.8538, test_f1: 0.5865
 epoch: 31, train_loss: 0.8664, test_loss: 0.8897, test_f1: 0.5393
 epoch: 32, train_loss: 0.8596, test_loss: 0.8647, test_f1: 0.5562
 epoch: 33, train_loss: 0.8647, test_loss: 0.8484, test_f1: 0.5434
 epoch: 34, train_loss: 0.8505, test_loss: 0.8673, test_f1: 0.5917
 epoch: 35, train_loss: 0.8561, test_loss: 0.8893, test_f1: 0.5486
 epoch: 36, train_loss: 0.8598, test_loss: 0.9170, test_f1: 0.5154
 epoch: 37, train_loss: 0.8511, test_loss: 0.8562, test_f1: 0.5491
 epoch: 38, train_loss: 0.8584, test_loss: 0.8412, test_f1: 0.5397
 epoch: 39, train_loss: 0.8517, test_loss: 0.8598, test_f1: 0.5338
 epoch: 40, train_loss: 0.8560, test_loss: 0.8641, test_f1: 0.5369
 epoch: 41, train_loss: 0.8378, test_loss: 0.8836, test_f1: 0.5343
 epoch: 42, train_loss: 0.8477, test_loss: 0.9502, test_f1: 0.5172
 epoch: 43, train_loss: 0.8455, test_loss: 0.8590, test_f1: 0.5410
 epoch: 44, train_loss: 0.8426, test_loss: 0.8323, test_f1: 0.5626
 epoch: 45, train_loss: 0.8383, test_loss: 0.8265, test_f1: 0.5684
 epoch: 46, train_loss: 0.8319, test_loss: 0.8546, test_f1: 0.5737
 epoch: 47, train_loss: 0.8431, test_loss: 0.8703, test_f1: 0.5554
 epoch: 48, train_loss: 0.8320, test_loss: 0.8510, test_f1: 0.5550
 epoch: 49, train_loss: 0.8491, test_loss: 0.8392, test_f1: 0.5496
 epoch: 50, train_loss: 0.8378, test_loss: 0.8274, test_f1: 0.5690
 epoch: 51, train_loss: 0.8089, test_loss: 0.8416, test_f1: 0.6014
 epoch: 52, train_loss: 0.8096, test_loss: 0.8264, test_f1: 0.5921
 epoch: 53, train_loss: 0.8094, test_loss: 0.8195, test_f1: 0.5839
 epoch: 54, train_loss: 0.8032, test_loss: 0.8187, test_f1: 0.5701
 epoch: 55, train_loss: 0.8135, test_loss: 0.8432, test_f1: 0.5760
 epoch: 56, train_loss: 0.7845, test_loss: 0.8336, test_f1: 0.5899
 epoch: 57, train_loss: 0.7917, test_loss: 0.8298, test_f1: 0.6122
 epoch: 58, train_loss: 0.7955, test_loss: 0.8339, test_f1: 0.5815
 epoch: 59, train_loss: 0.7935, test_loss: 0.8324, test_f1: 0.5951
 epoch: 60, train_loss: 0.8000, test_loss: 0.8430, test_f1: 0.5990
 epoch: 61, train_loss: 0.7943, test_loss: 0.8329, test_f1: 0.6102
 epoch: 62, train_loss: 0.8032, test_loss: 0.8430, test_f1: 0.6020
 epoch: 63, train_loss: 0.7883, test_loss: 0.8561, test_f1: 0.6162
 epoch: 64, train_loss: 0.7996, test_loss: 0.8364, test_f1: 0.5997
 epoch: 65, train_loss: 0.8024, test_loss: 0.8347, test_f1: 0.5832
 epoch: 66, train_loss: 0.7968, test_loss: 0.7930, test_f1: 0.5854
 epoch: 67, train_loss: 0.8005, test_loss: 0.8296, test_f1: 0.5859
 epoch: 68, train_loss: 0.7803, test_loss: 0.8103, test_f1: 0.5813
 epoch: 69, train_loss: 0.7835, test_loss: 0.8103, test_f1: 0.5761
 epoch: 70, train_loss: 0.7690, test_loss: 0.8032, test_f1: 0.5934
 epoch: 71, train_loss: 0.7826, test_loss: 0.7907, test_f1: 0.5966
 epoch: 72, train_loss: 0.7741, test_loss: 0.8230, test_f1: 0.6088
 epoch: 73, train_loss: 0.7816, test_loss: 0.8086, test_f1: 0.6204
 epoch: 74, train_loss: 0.7801, test_loss: 0.8089, test_f1: 0.5979
 epoch: 75, train_loss: 0.7759, test_loss: 0.8110, test_f1: 0.6223
 epoch: 76, train_loss: 0.7677, test_loss: 0.8091, test_f1: 0.5904
 epoch: 77, train_loss: 0.7700, test_loss: 0.8148, test_f1: 0.5791
 epoch: 78, train_loss: 0.7685, test_loss: 0.8131, test_f1: 0.5830
 epoch: 79, train_loss: 0.7716, test_loss: 0.8259, test_f1: 0.6192
 epoch: 80, train_loss: 0.7717, test_loss: 0.8205, test_f1: 0.6018
 epoch: 81, train_loss: 0.7715, test_loss: 0.8099, test_f1: 0.5912
 epoch: 82, train_loss: 0.7745, test_loss: 0.8136, test_f1: 0.6039
 epoch: 83, train_loss: 0.7606, test_loss: 0.8267, test_f1: 0.5977
 epoch: 84, train_loss: 0.7727, test_loss: 0.8604, test_f1: 0.5662
 epoch: 85, train_loss: 0.7615, test_loss: 0.8192, test_f1: 0.5806
 epoch: 86, train_loss: 0.7529, test_loss: 0.8075, test_f1: 0.6020
 epoch: 87, train_loss: 0.7541, test_loss: 0.8137, test_f1: 0.6093
 epoch: 88, train_loss: 0.7722, test_loss: 0.7989, test_f1: 0.5844
 epoch: 89, train_loss: 0.7762, test_loss: 0.7966, test_f1: 0.5960
 epoch: 90, train_loss: 0.7723, test_loss: 0.8068, test_f1: 0.6013
 epoch: 91, train_loss: 0.7692, test_loss: 0.8324, test_f1: 0.6138
 epoch: 92, train_loss: 0.7474, test_loss: 0.8073, test_f1: 0.6338
 epoch: 93, train_loss: 0.7581, test_loss: 0.7898, test_f1: 0.6166
 epoch: 94, train_loss: 0.7523, test_loss: 0.7715, test_f1: 0.6032
 epoch: 95, train_loss: 0.7537, test_loss: 0.8231, test_f1: 0.6029
 epoch: 96, train_loss: 0.7453, test_loss: 0.7823, test_f1: 0.5965
 epoch: 97, train_loss: 0.7534, test_loss: 0.7592, test_f1: 0.6356
 epoch: 98, train_loss: 0.7538, test_loss: 0.7849, test_f1: 0.6187
 epoch: 99, train_loss: 0.7485, test_loss: 0.7748, test_f1: 0.6382
##################ITERATION #7 ****************************************
 epoch: 0, train_loss: 1.1417, test_loss: 1.0934, test_f1: 0.3422
 epoch: 1, train_loss: 1.0612, test_loss: 1.0559, test_f1: 0.4603
 epoch: 2, train_loss: 1.0457, test_loss: 1.1147, test_f1: 0.4172
 epoch: 3, train_loss: 1.0145, test_loss: 1.2022, test_f1: 0.3795
 epoch: 4, train_loss: 1.0101, test_loss: 1.0289, test_f1: 0.4664
 epoch: 5, train_loss: 0.9969, test_loss: 1.0392, test_f1: 0.4827
 epoch: 6, train_loss: 0.9813, test_loss: 1.0105, test_f1: 0.4665
 epoch: 7, train_loss: 0.9759, test_loss: 0.9714, test_f1: 0.4924
 epoch: 8, train_loss: 0.9616, test_loss: 1.1762, test_f1: 0.4065
 epoch: 9, train_loss: 0.9668, test_loss: 0.9880, test_f1: 0.4975
 epoch: 10, train_loss: 0.9628, test_loss: 0.9619, test_f1: 0.4941
 epoch: 11, train_loss: 0.9485, test_loss: 0.9927, test_f1: 0.4420
 epoch: 12, train_loss: 0.9495, test_loss: 0.9936, test_f1: 0.5031
 epoch: 13, train_loss: 0.9410, test_loss: 0.9739, test_f1: 0.4825
 epoch: 14, train_loss: 0.9407, test_loss: 0.9617, test_f1: 0.5135
 epoch: 15, train_loss: 0.9262, test_loss: 0.9727, test_f1: 0.5321
 epoch: 16, train_loss: 0.9199, test_loss: 0.9576, test_f1: 0.5414
 epoch: 17, train_loss: 0.8998, test_loss: 0.9635, test_f1: 0.5649
 epoch: 18, train_loss: 0.9274, test_loss: 0.9425, test_f1: 0.4949
 epoch: 19, train_loss: 0.9184, test_loss: 0.9309, test_f1: 0.5089
 epoch: 20, train_loss: 0.9086, test_loss: 0.9671, test_f1: 0.5098
 epoch: 21, train_loss: 0.9004, test_loss: 0.9288, test_f1: 0.5181
 epoch: 22, train_loss: 0.9008, test_loss: 0.9847, test_f1: 0.4973
 epoch: 23, train_loss: 0.9037, test_loss: 0.9351, test_f1: 0.5112
 epoch: 24, train_loss: 0.9009, test_loss: 0.9244, test_f1: 0.5288
 epoch: 25, train_loss: 0.8762, test_loss: 0.9291, test_f1: 0.5016
 epoch: 26, train_loss: 0.8793, test_loss: 0.8710, test_f1: 0.5591
 epoch: 27, train_loss: 0.8949, test_loss: 0.8751, test_f1: 0.5286
 epoch: 28, train_loss: 0.8851, test_loss: 0.8978, test_f1: 0.5110
 epoch: 29, train_loss: 0.8749, test_loss: 0.8809, test_f1: 0.5546
 epoch: 30, train_loss: 0.8761, test_loss: 0.9824, test_f1: 0.5004
 epoch: 31, train_loss: 0.8769, test_loss: 0.8980, test_f1: 0.5191
 epoch: 32, train_loss: 0.8651, test_loss: 0.8780, test_f1: 0.5510
 epoch: 33, train_loss: 0.8854, test_loss: 0.8602, test_f1: 0.5542
 epoch: 34, train_loss: 0.8804, test_loss: 0.9256, test_f1: 0.5221
 epoch: 35, train_loss: 0.8958, test_loss: 0.9075, test_f1: 0.5376
 epoch: 36, train_loss: 0.8697, test_loss: 0.8522, test_f1: 0.5528
 epoch: 37, train_loss: 0.8734, test_loss: 0.9069, test_f1: 0.5585
 epoch: 38, train_loss: 0.8728, test_loss: 0.8957, test_f1: 0.5833
 epoch: 39, train_loss: 0.9037, test_loss: 1.0405, test_f1: 0.4347
 epoch: 40, train_loss: 0.9727, test_loss: 1.0039, test_f1: 0.4729
 epoch: 41, train_loss: 0.9356, test_loss: 0.9131, test_f1: 0.5354
 epoch: 42, train_loss: 0.9272, test_loss: 0.9433, test_f1: 0.5249
 epoch: 43, train_loss: 0.9084, test_loss: 0.9256, test_f1: 0.5331
 epoch: 44, train_loss: 0.8831, test_loss: 0.8909, test_f1: 0.5365
 epoch: 45, train_loss: 0.8753, test_loss: 0.9436, test_f1: 0.5123
 epoch: 46, train_loss: 0.8755, test_loss: 0.8576, test_f1: 0.5655
 epoch: 47, train_loss: 0.8601, test_loss: 0.8982, test_f1: 0.5359
 epoch: 48, train_loss: 0.8556, test_loss: 0.8799, test_f1: 0.5456
 epoch: 49, train_loss: 0.8637, test_loss: 0.8572, test_f1: 0.5723
 epoch: 50, train_loss: 0.8724, test_loss: 0.9169, test_f1: 0.5194
 epoch: 51, train_loss: 0.8746, test_loss: 0.8320, test_f1: 0.5853
 epoch: 52, train_loss: 0.8426, test_loss: 0.8731, test_f1: 0.5696
 epoch: 53, train_loss: 0.8414, test_loss: 0.8530, test_f1: 0.5582
 epoch: 54, train_loss: 0.8303, test_loss: 0.8388, test_f1: 0.5728
 epoch: 55, train_loss: 0.8275, test_loss: 0.8332, test_f1: 0.5779
 epoch: 56, train_loss: 0.8234, test_loss: 0.8165, test_f1: 0.5891
 epoch: 57, train_loss: 0.8189, test_loss: 0.8234, test_f1: 0.5689
 epoch: 58, train_loss: 0.8298, test_loss: 0.8706, test_f1: 0.5891
 epoch: 59, train_loss: 0.8138, test_loss: 0.8195, test_f1: 0.5797
 epoch: 60, train_loss: 0.8264, test_loss: 0.8148, test_f1: 0.5748
 epoch: 61, train_loss: 0.8117, test_loss: 0.8202, test_f1: 0.5586
 epoch: 62, train_loss: 0.8201, test_loss: 0.8221, test_f1: 0.5693
 epoch: 63, train_loss: 0.8043, test_loss: 0.8360, test_f1: 0.5625
 epoch: 64, train_loss: 0.8051, test_loss: 0.8295, test_f1: 0.5803
 epoch: 65, train_loss: 0.8105, test_loss: 0.8197, test_f1: 0.6076
 epoch: 66, train_loss: 0.8012, test_loss: 0.8216, test_f1: 0.6222
 epoch: 67, train_loss: 0.8171, test_loss: 0.8345, test_f1: 0.5864
 epoch: 68, train_loss: 0.7973, test_loss: 0.8028, test_f1: 0.5727
 epoch: 69, train_loss: 0.7839, test_loss: 0.8831, test_f1: 0.5660
 epoch: 70, train_loss: 0.8122, test_loss: 0.8445, test_f1: 0.5708
 epoch: 71, train_loss: 0.7947, test_loss: 0.8441, test_f1: 0.5716
 epoch: 72, train_loss: 0.7908, test_loss: 0.8516, test_f1: 0.5868
 epoch: 73, train_loss: 0.7963, test_loss: 0.8172, test_f1: 0.6251
 epoch: 74, train_loss: 0.7880, test_loss: 0.8295, test_f1: 0.5820
 epoch: 75, train_loss: 0.7854, test_loss: 0.8149, test_f1: 0.6085
 epoch: 76, train_loss: 0.7927, test_loss: 0.8616, test_f1: 0.5474
 epoch: 77, train_loss: 0.7955, test_loss: 0.8371, test_f1: 0.6021
 epoch: 78, train_loss: 0.8056, test_loss: 0.8372, test_f1: 0.5781
 epoch: 79, train_loss: 0.7932, test_loss: 0.8161, test_f1: 0.5917
 epoch: 80, train_loss: 0.7856, test_loss: 0.8326, test_f1: 0.5772
 epoch: 81, train_loss: 0.7773, test_loss: 0.8165, test_f1: 0.5869
 epoch: 82, train_loss: 0.7892, test_loss: 0.7903, test_f1: 0.5901
 epoch: 83, train_loss: 0.7953, test_loss: 0.7991, test_f1: 0.5943
 epoch: 84, train_loss: 0.7932, test_loss: 0.8176, test_f1: 0.5662
 epoch: 85, train_loss: 0.7897, test_loss: 0.8384, test_f1: 0.6177
 epoch: 86, train_loss: 0.7829, test_loss: 0.8237, test_f1: 0.5854
 epoch: 87, train_loss: 0.7788, test_loss: 0.7978, test_f1: 0.6249
 epoch: 88, train_loss: 0.7824, test_loss: 0.8390, test_f1: 0.6000
 epoch: 89, train_loss: 0.7830, test_loss: 0.8149, test_f1: 0.5636
 epoch: 90, train_loss: 0.7856, test_loss: 0.8076, test_f1: 0.6021
 epoch: 91, train_loss: 0.7803, test_loss: 0.8147, test_f1: 0.5788
 epoch: 92, train_loss: 0.7780, test_loss: 0.8312, test_f1: 0.6171
 epoch: 93, train_loss: 0.7799, test_loss: 0.8011, test_f1: 0.5985
 epoch: 94, train_loss: 0.7739, test_loss: 0.8157, test_f1: 0.5970
 epoch: 95, train_loss: 0.7787, test_loss: 0.8064, test_f1: 0.6116
 epoch: 96, train_loss: 0.7854, test_loss: 0.7835, test_f1: 0.6286
 epoch: 97, train_loss: 0.7723, test_loss: 0.8230, test_f1: 0.5710
 epoch: 98, train_loss: 0.7754, test_loss: 0.8021, test_f1: 0.5643
 epoch: 99, train_loss: 0.7667, test_loss: 0.8128, test_f1: 0.5648
##################ITERATION #8 ****************************************
 epoch: 0, train_loss: 1.1369, test_loss: 1.0748, test_f1: 0.3875
 epoch: 1, train_loss: 1.0204, test_loss: 0.9700, test_f1: 0.4427
 epoch: 2, train_loss: 1.0053, test_loss: 1.0438, test_f1: 0.4897
 epoch: 3, train_loss: 0.9836, test_loss: 1.0331, test_f1: 0.4691
 epoch: 4, train_loss: 0.9791, test_loss: 1.0747, test_f1: 0.4536
 epoch: 5, train_loss: 0.9670, test_loss: 1.0132, test_f1: 0.4852
 epoch: 6, train_loss: 0.9510, test_loss: 1.0027, test_f1: 0.4759
 epoch: 7, train_loss: 0.9634, test_loss: 0.9989, test_f1: 0.4517
 epoch: 8, train_loss: 0.9452, test_loss: 0.9851, test_f1: 0.4744
 epoch: 9, train_loss: 0.9383, test_loss: 0.9897, test_f1: 0.5048
 epoch: 10, train_loss: 0.9516, test_loss: 0.9615, test_f1: 0.5056
 epoch: 11, train_loss: 0.9234, test_loss: 0.9669, test_f1: 0.5286
 epoch: 12, train_loss: 0.9270, test_loss: 1.0040, test_f1: 0.5023
 epoch: 13, train_loss: 0.9268, test_loss: 0.9313, test_f1: 0.5031
 epoch: 14, train_loss: 0.9134, test_loss: 1.0362, test_f1: 0.4644
 epoch: 15, train_loss: 0.9031, test_loss: 0.9288, test_f1: 0.5100
 epoch: 16, train_loss: 0.9055, test_loss: 0.9873, test_f1: 0.5136
 epoch: 17, train_loss: 0.9078, test_loss: 0.9465, test_f1: 0.5332
 epoch: 18, train_loss: 0.9062, test_loss: 0.8914, test_f1: 0.5529
 epoch: 19, train_loss: 0.8968, test_loss: 0.9447, test_f1: 0.5071
 epoch: 20, train_loss: 0.8832, test_loss: 0.9198, test_f1: 0.5179
 epoch: 21, train_loss: 0.8713, test_loss: 0.9340, test_f1: 0.5231
 epoch: 22, train_loss: 0.8864, test_loss: 0.9150, test_f1: 0.5148
 epoch: 23, train_loss: 0.8891, test_loss: 0.8995, test_f1: 0.5263
 epoch: 24, train_loss: 0.8972, test_loss: 0.8752, test_f1: 0.5160
 epoch: 25, train_loss: 0.8763, test_loss: 0.9371, test_f1: 0.5290
 epoch: 26, train_loss: 0.8825, test_loss: 0.8742, test_f1: 0.5384
 epoch: 27, train_loss: 0.8661, test_loss: 0.8749, test_f1: 0.5306
 epoch: 28, train_loss: 0.8777, test_loss: 0.9286, test_f1: 0.5270
 epoch: 29, train_loss: 0.8650, test_loss: 0.8820, test_f1: 0.5307
 epoch: 30, train_loss: 0.8596, test_loss: 0.8675, test_f1: 0.5485
 epoch: 31, train_loss: 0.8640, test_loss: 0.8679, test_f1: 0.5510
 epoch: 32, train_loss: 0.8567, test_loss: 0.8735, test_f1: 0.5349
 epoch: 33, train_loss: 0.8668, test_loss: 0.8431, test_f1: 0.5433
 epoch: 34, train_loss: 0.8504, test_loss: 0.7871, test_f1: 0.5622
 epoch: 35, train_loss: 0.8384, test_loss: 0.8461, test_f1: 0.5468
 epoch: 36, train_loss: 0.8644, test_loss: 0.9052, test_f1: 0.5349
 epoch: 37, train_loss: 0.8298, test_loss: 0.8709, test_f1: 0.5427
 epoch: 38, train_loss: 0.8598, test_loss: 0.8731, test_f1: 0.5503
 epoch: 39, train_loss: 0.8655, test_loss: 0.8657, test_f1: 0.5231
 epoch: 40, train_loss: 0.8419, test_loss: 0.9058, test_f1: 0.5350
 epoch: 41, train_loss: 0.8574, test_loss: 0.8530, test_f1: 0.5467
 epoch: 42, train_loss: 0.8404, test_loss: 0.8947, test_f1: 0.5532
 epoch: 43, train_loss: 0.8417, test_loss: 0.8351, test_f1: 0.5689
 epoch: 44, train_loss: 0.8558, test_loss: 0.8574, test_f1: 0.5623
 epoch: 45, train_loss: 0.8504, test_loss: 0.8591, test_f1: 0.6037
 epoch: 46, train_loss: 0.8642, test_loss: 0.8421, test_f1: 0.5521
 epoch: 47, train_loss: 0.8434, test_loss: 0.8574, test_f1: 0.5597
 epoch: 48, train_loss: 0.8316, test_loss: 0.9141, test_f1: 0.5349
 epoch: 49, train_loss: 0.8436, test_loss: 0.8672, test_f1: 0.5389
 epoch: 50, train_loss: 0.8360, test_loss: 0.8664, test_f1: 0.5871
 epoch: 51, train_loss: 0.8039, test_loss: 0.8584, test_f1: 0.5699
 epoch: 52, train_loss: 0.8066, test_loss: 0.8340, test_f1: 0.5724
 epoch: 53, train_loss: 0.8065, test_loss: 0.8458, test_f1: 0.5843
 epoch: 54, train_loss: 0.8075, test_loss: 0.8196, test_f1: 0.5852
 epoch: 55, train_loss: 0.7990, test_loss: 0.8294, test_f1: 0.5905
 epoch: 56, train_loss: 0.7900, test_loss: 0.8252, test_f1: 0.5943
 epoch: 57, train_loss: 0.7984, test_loss: 0.8186, test_f1: 0.5951
 epoch: 58, train_loss: 0.7978, test_loss: 0.8356, test_f1: 0.5815
 epoch: 59, train_loss: 0.7939, test_loss: 0.8494, test_f1: 0.5913
 epoch: 60, train_loss: 0.7890, test_loss: 0.8379, test_f1: 0.5974
 epoch: 61, train_loss: 0.7875, test_loss: 0.8572, test_f1: 0.5903
 epoch: 62, train_loss: 0.7958, test_loss: 0.8124, test_f1: 0.5991
 epoch: 63, train_loss: 0.7910, test_loss: 0.8408, test_f1: 0.5683
 epoch: 64, train_loss: 0.7843, test_loss: 0.8118, test_f1: 0.6082
 epoch: 65, train_loss: 0.7954, test_loss: 0.8253, test_f1: 0.5979
 epoch: 66, train_loss: 0.7708, test_loss: 0.8576, test_f1: 0.6029
 epoch: 67, train_loss: 0.7882, test_loss: 0.8411, test_f1: 0.5861
 epoch: 68, train_loss: 0.7781, test_loss: 0.8275, test_f1: 0.5904
 epoch: 69, train_loss: 0.7999, test_loss: 0.8386, test_f1: 0.5983
 epoch: 70, train_loss: 0.7790, test_loss: 0.8343, test_f1: 0.5878
 epoch: 71, train_loss: 0.7709, test_loss: 0.8286, test_f1: 0.6060
 epoch: 72, train_loss: 0.7748, test_loss: 0.8312, test_f1: 0.6347
 epoch: 73, train_loss: 0.7659, test_loss: 0.8507, test_f1: 0.5910
 epoch: 74, train_loss: 0.7656, test_loss: 0.8587, test_f1: 0.5825
 epoch: 75, train_loss: 0.7731, test_loss: 0.8281, test_f1: 0.6019
 epoch: 76, train_loss: 0.7716, test_loss: 0.8772, test_f1: 0.6021
 epoch: 77, train_loss: 0.7862, test_loss: 0.8199, test_f1: 0.6229
 epoch: 78, train_loss: 0.7728, test_loss: 0.8269, test_f1: 0.6020
 epoch: 79, train_loss: 0.7716, test_loss: 0.8882, test_f1: 0.5945
 epoch: 80, train_loss: 0.7774, test_loss: 0.8222, test_f1: 0.6145
 epoch: 81, train_loss: 0.7556, test_loss: 0.8273, test_f1: 0.6481
 epoch: 82, train_loss: 0.7594, test_loss: 0.8351, test_f1: 0.6090
 epoch: 83, train_loss: 0.7593, test_loss: 0.8488, test_f1: 0.6177
 epoch: 84, train_loss: 0.7540, test_loss: 0.8428, test_f1: 0.6201
 epoch: 85, train_loss: 0.7527, test_loss: 0.8494, test_f1: 0.6310
 epoch: 86, train_loss: 0.7692, test_loss: 0.8102, test_f1: 0.6298
 epoch: 87, train_loss: 0.7564, test_loss: 0.8211, test_f1: 0.6237
 epoch: 88, train_loss: 0.7528, test_loss: 0.8311, test_f1: 0.6153
 epoch: 89, train_loss: 0.7472, test_loss: 0.8264, test_f1: 0.6163
 epoch: 90, train_loss: 0.7502, test_loss: 0.8227, test_f1: 0.6166
 epoch: 91, train_loss: 0.7479, test_loss: 0.8247, test_f1: 0.6242
 epoch: 92, train_loss: 0.7269, test_loss: 0.8408, test_f1: 0.6193
 epoch: 93, train_loss: 0.7503, test_loss: 0.8335, test_f1: 0.6236
 epoch: 94, train_loss: 0.7638, test_loss: 0.8054, test_f1: 0.6466
 epoch: 95, train_loss: 0.7516, test_loss: 0.8324, test_f1: 0.6184
 epoch: 96, train_loss: 0.7504, test_loss: 0.8306, test_f1: 0.6086
 epoch: 97, train_loss: 0.7814, test_loss: 0.8390, test_f1: 0.6042
 epoch: 98, train_loss: 0.7742, test_loss: 0.8383, test_f1: 0.6243
 epoch: 99, train_loss: 0.7674, test_loss: 0.8406, test_f1: 0.6073
##################ITERATION #9 ****************************************
 epoch: 0, train_loss: 1.1388, test_loss: 1.0756, test_f1: 0.3691
 epoch: 1, train_loss: 1.0379, test_loss: 1.0524, test_f1: 0.4251
 epoch: 2, train_loss: 1.0098, test_loss: 1.0185, test_f1: 0.5093
 epoch: 3, train_loss: 1.0062, test_loss: 1.0619, test_f1: 0.4246
 epoch: 4, train_loss: 0.9992, test_loss: 1.0001, test_f1: 0.4893
 epoch: 5, train_loss: 0.9784, test_loss: 0.9978, test_f1: 0.4554
 epoch: 6, train_loss: 0.9766, test_loss: 1.0344, test_f1: 0.4628
 epoch: 7, train_loss: 0.9831, test_loss: 0.9857, test_f1: 0.5034
 epoch: 8, train_loss: 0.9662, test_loss: 1.0038, test_f1: 0.4667
 epoch: 9, train_loss: 0.9893, test_loss: 0.9957, test_f1: 0.4626
 epoch: 10, train_loss: 0.9688, test_loss: 0.9716, test_f1: 0.4976
 epoch: 11, train_loss: 0.9646, test_loss: 1.0018, test_f1: 0.4448
 epoch: 12, train_loss: 0.9478, test_loss: 0.9778, test_f1: 0.4728
 epoch: 13, train_loss: 0.9343, test_loss: 0.9365, test_f1: 0.4897
 epoch: 14, train_loss: 0.9338, test_loss: 0.9901, test_f1: 0.4811
 epoch: 15, train_loss: 0.9360, test_loss: 0.9358, test_f1: 0.4978
 epoch: 16, train_loss: 0.9301, test_loss: 0.9932, test_f1: 0.4493
 epoch: 17, train_loss: 0.9145, test_loss: 0.9820, test_f1: 0.4804
 epoch: 18, train_loss: 0.9182, test_loss: 0.9498, test_f1: 0.5147
 epoch: 19, train_loss: 0.9168, test_loss: 0.9173, test_f1: 0.5484
 epoch: 20, train_loss: 0.9104, test_loss: 0.9262, test_f1: 0.5330
 epoch: 21, train_loss: 0.9141, test_loss: 0.8950, test_f1: 0.5581
 epoch: 22, train_loss: 0.8944, test_loss: 0.9142, test_f1: 0.5167
 epoch: 23, train_loss: 0.8920, test_loss: 0.8624, test_f1: 0.5728
 epoch: 24, train_loss: 0.8857, test_loss: 0.9119, test_f1: 0.5573
 epoch: 25, train_loss: 0.9111, test_loss: 0.8716, test_f1: 0.5216
 epoch: 26, train_loss: 0.9191, test_loss: 0.8663, test_f1: 0.5342
 epoch: 27, train_loss: 0.8960, test_loss: 0.8977, test_f1: 0.4981
 epoch: 28, train_loss: 0.8827, test_loss: 0.7851, test_f1: 0.5482
 epoch: 29, train_loss: 0.8860, test_loss: 0.8120, test_f1: 0.5607
 epoch: 30, train_loss: 0.8721, test_loss: 0.9347, test_f1: 0.4994
 epoch: 31, train_loss: 0.9055, test_loss: 0.8760, test_f1: 0.5061
 epoch: 32, train_loss: 0.8898, test_loss: 0.8486, test_f1: 0.4975
 epoch: 33, train_loss: 0.8881, test_loss: 0.8637, test_f1: 0.5051
 epoch: 34, train_loss: 0.8689, test_loss: 0.8330, test_f1: 0.5198
 epoch: 35, train_loss: 0.8741, test_loss: 0.8092, test_f1: 0.5744
 epoch: 36, train_loss: 0.8672, test_loss: 0.8079, test_f1: 0.5796
 epoch: 37, train_loss: 0.8658, test_loss: 0.8353, test_f1: 0.5195
 epoch: 38, train_loss: 0.8531, test_loss: 0.8505, test_f1: 0.5083
 epoch: 39, train_loss: 0.8557, test_loss: 0.8028, test_f1: 0.5166
 epoch: 40, train_loss: 0.8525, test_loss: 0.8925, test_f1: 0.5023
 epoch: 41, train_loss: 0.8610, test_loss: 0.8343, test_f1: 0.5063
 epoch: 42, train_loss: 0.8608, test_loss: 0.8008, test_f1: 0.5465
 epoch: 43, train_loss: 0.8385, test_loss: 0.8167, test_f1: 0.5518
 epoch: 44, train_loss: 0.8508, test_loss: 0.7837, test_f1: 0.5920
 epoch: 45, train_loss: 0.8588, test_loss: 0.8043, test_f1: 0.5453
 epoch: 46, train_loss: 0.8568, test_loss: 0.8502, test_f1: 0.5535
 epoch: 47, train_loss: 0.8291, test_loss: 0.8403, test_f1: 0.5442
 epoch: 48, train_loss: 0.8390, test_loss: 0.8421, test_f1: 0.5591
 epoch: 49, train_loss: 0.8510, test_loss: 0.7945, test_f1: 0.5682
 epoch: 50, train_loss: 0.8297, test_loss: 0.8025, test_f1: 0.5690
 epoch: 51, train_loss: 0.8194, test_loss: 0.8403, test_f1: 0.5319
 epoch: 52, train_loss: 0.8169, test_loss: 0.8285, test_f1: 0.5314
 epoch: 53, train_loss: 0.8013, test_loss: 0.8041, test_f1: 0.5718
 epoch: 54, train_loss: 0.8058, test_loss: 0.8379, test_f1: 0.5928
 epoch: 55, train_loss: 0.8048, test_loss: 0.8041, test_f1: 0.5780
 epoch: 56, train_loss: 0.8050, test_loss: 0.8161, test_f1: 0.5544
 epoch: 57, train_loss: 0.8088, test_loss: 0.8161, test_f1: 0.5500
 epoch: 58, train_loss: 0.7946, test_loss: 0.7617, test_f1: 0.5505
 epoch: 59, train_loss: 0.7977, test_loss: 0.7908, test_f1: 0.6222
 epoch: 60, train_loss: 0.7900, test_loss: 0.7841, test_f1: 0.5747
 epoch: 61, train_loss: 0.7940, test_loss: 0.8041, test_f1: 0.6335
 epoch: 62, train_loss: 0.7931, test_loss: 0.7715, test_f1: 0.5730
 epoch: 63, train_loss: 0.8004, test_loss: 0.7798, test_f1: 0.5675
 epoch: 64, train_loss: 0.7959, test_loss: 0.7798, test_f1: 0.6102
 epoch: 65, train_loss: 0.7836, test_loss: 0.8065, test_f1: 0.5844
 epoch: 66, train_loss: 0.7909, test_loss: 0.8116, test_f1: 0.5831
 epoch: 67, train_loss: 0.7752, test_loss: 0.7794, test_f1: 0.5732
 epoch: 68, train_loss: 0.7898, test_loss: 0.7473, test_f1: 0.5880
 epoch: 69, train_loss: 0.7762, test_loss: 0.7395, test_f1: 0.5760
 epoch: 70, train_loss: 0.7812, test_loss: 0.8271, test_f1: 0.5587
 epoch: 71, train_loss: 0.7821, test_loss: 0.8141, test_f1: 0.5900
 epoch: 72, train_loss: 0.7891, test_loss: 0.8096, test_f1: 0.5792
 epoch: 73, train_loss: 0.7945, test_loss: 0.7477, test_f1: 0.5824
 epoch: 74, train_loss: 0.7815, test_loss: 0.8018, test_f1: 0.6165
 epoch: 75, train_loss: 0.7794, test_loss: 0.7688, test_f1: 0.5802
 epoch: 76, train_loss: 0.7806, test_loss: 0.7460, test_f1: 0.6359
 epoch: 77, train_loss: 0.7919, test_loss: 0.7639, test_f1: 0.6427
 epoch: 78, train_loss: 0.7968, test_loss: 0.7821, test_f1: 0.6007
 epoch: 79, train_loss: 0.7762, test_loss: 0.7906, test_f1: 0.6197
 epoch: 80, train_loss: 0.7730, test_loss: 0.8434, test_f1: 0.5626
 epoch: 81, train_loss: 0.7718, test_loss: 0.7790, test_f1: 0.5717
 epoch: 82, train_loss: 0.7888, test_loss: 0.7394, test_f1: 0.6113
 epoch: 83, train_loss: 0.7833, test_loss: 0.8242, test_f1: 0.6018
 epoch: 84, train_loss: 0.7612, test_loss: 0.7926, test_f1: 0.6367
 epoch: 85, train_loss: 0.7698, test_loss: 0.8146, test_f1: 0.5999
 epoch: 86, train_loss: 0.7702, test_loss: 0.7592, test_f1: 0.6055
 epoch: 87, train_loss: 0.7685, test_loss: 0.7770, test_f1: 0.6257
 epoch: 88, train_loss: 0.7727, test_loss: 0.7922, test_f1: 0.6097
 epoch: 89, train_loss: 0.7596, test_loss: 0.7931, test_f1: 0.6249
 epoch: 90, train_loss: 0.7683, test_loss: 0.8181, test_f1: 0.5789
 epoch: 91, train_loss: 0.7575, test_loss: 0.7667, test_f1: 0.5965
 epoch: 92, train_loss: 0.7661, test_loss: 0.7826, test_f1: 0.6097
 epoch: 93, train_loss: 0.7628, test_loss: 0.8069, test_f1: 0.5969
 epoch: 94, train_loss: 0.7664, test_loss: 0.7980, test_f1: 0.5591
 epoch: 95, train_loss: 0.7516, test_loss: 0.7977, test_f1: 0.6010
 epoch: 96, train_loss: 0.7472, test_loss: 0.8461, test_f1: 0.6403
 epoch: 97, train_loss: 0.7490, test_loss: 0.8295, test_f1: 0.5817
 epoch: 98, train_loss: 0.7610, test_loss: 0.7980, test_f1: 0.6111
 epoch: 99, train_loss: 0.7531, test_loss: 0.7942, test_f1: 0.5856

Training completed in 1112.82 seconds
Best F1: 0.6582 at epoch 96
Mean F1 across iterations: 0.6405  0.0100
========================FINAL RESULTS================================
FEGIN weighted F1: 0.6582  0.0100
python main.py --data ltspice_examples --representation component_pin_net --model FEGIN --layers 4 --hiddens 16 --batch_size 32 --lr 0.01 --emb_size 250 --epochs 100 --save_appendix component_pin_net_L4_H16_BS32_LR0.01_E250 --no_val
-----



STDERR:
  File "main.py", line 370, in <module>
    main()
  File "main.py", line 254, in main
    dataset = dataset_class(
  File "/home/philip/projects/ltspice_examples_code_repo/Circuit-Completion-Using-GNNs/component_classification_with_link_prediction_head/evaluation/FEGIN/kernel/circuit_datasets.py", line 15, in __init__
    self.data, self.slices = torch.load(self.processed_paths[0])
  File "/home/philip/.local/lib/python3.8/site-packages/torch/serialization.py", line 1040, in load
    warnings.warn(
  File "/usr/lib/python3.8/warnings.py", line 109, in _showwarnmsg
    sw(msg.message, msg.category, msg.filename, msg.lineno,
  File "main.py", line 47, in warn_with_traceback
    traceback.print_stack(file=log)
/home/philip/projects/ltspice_examples_code_repo/Circuit-Completion-Using-GNNs/component_classification_with_link_prediction_head/evaluation/FEGIN/kernel/circuit_datasets.py:15: FutureWarning: You are using `torch.load` with `weights_only=False` (the current default value), which uses the default pickle module implicitly. It is possible to construct malicious pickle data which will execute arbitrary code during unpickling (See https://github.com/pytorch/pytorch/blob/main/SECURITY.md#untrusted-models for more details). In a future release, the default value for `weights_only` will be flipped to `True`. This limits the functions that could be executed during unpickling. Arbitrary objects will no longer be allowed to be loaded via this mode unless they are explicitly allowlisted by the user via `torch.serialization.add_safe_globals`. We recommend you start setting `weights_only=True` for any use case where you don't have full control of the loaded file. Please open an issue on GitHub for any issues related to this experimental feature.
  self.data, self.slices = torch.load(self.processed_paths[0])
