STDOUT:
Results will be saved in /home/philip/projects/ltspice_examples_code_repo/Circuit-Completion-Using-GNNs/component_classification_with_link_prediction_head/evaluation/FEGIN/results/model_FEGIN_dataset_ltspice_examples
Command line input: python main.py --data ltspice_examples --representation component_component --model FEGIN --layers 3 --hiddens 128 --batch_size 32 --lr 0.001 --emb_size 512 --epochs 100 --save_appendix component_component_L3_H128_BS32_LR0.001_E512 --no_val
 is saved.
-----
ltspice_examples - FEGIN
Using 3 layers, 128 hidden units, h = 2
Loading component_component representation dataset
ENTERED
Training FEGIN on component_component representation
Train: 3556, Test: 845
##################ITERATION #0 ****************************************
 epoch: 0, train_loss: 1.2315, test_loss: 1.1337, test_f1: 0.4415
 epoch: 1, train_loss: 1.1249, test_loss: 1.0596, test_f1: 0.4561
 epoch: 2, train_loss: 1.0565, test_loss: 0.9792, test_f1: 0.4734
 epoch: 3, train_loss: 1.0228, test_loss: 0.9510, test_f1: 0.5102
 epoch: 4, train_loss: 1.0024, test_loss: 0.9541, test_f1: 0.5148
 epoch: 5, train_loss: 0.9787, test_loss: 0.9382, test_f1: 0.4906
 epoch: 6, train_loss: 0.9500, test_loss: 0.9740, test_f1: 0.5486
 epoch: 7, train_loss: 0.9260, test_loss: 0.9560, test_f1: 0.5384
 epoch: 8, train_loss: 0.9259, test_loss: 0.9593, test_f1: 0.5052
 epoch: 9, train_loss: 0.9041, test_loss: 0.9646, test_f1: 0.5476
 epoch: 10, train_loss: 0.8954, test_loss: 0.9929, test_f1: 0.5344
 epoch: 11, train_loss: 0.8729, test_loss: 1.0095, test_f1: 0.4824
 epoch: 12, train_loss: 0.8817, test_loss: 0.9825, test_f1: 0.5371
 epoch: 13, train_loss: 0.8682, test_loss: 0.9502, test_f1: 0.5296
 epoch: 14, train_loss: 0.8509, test_loss: 0.9096, test_f1: 0.5743
 epoch: 15, train_loss: 0.8469, test_loss: 1.0244, test_f1: 0.5161
 epoch: 16, train_loss: 0.8357, test_loss: 0.9656, test_f1: 0.5449
 epoch: 17, train_loss: 0.8675, test_loss: 0.9983, test_f1: 0.5297
 epoch: 18, train_loss: 0.8248, test_loss: 0.9841, test_f1: 0.5504
 epoch: 19, train_loss: 0.8159, test_loss: 1.0110, test_f1: 0.5413
 epoch: 20, train_loss: 0.7998, test_loss: 1.0174, test_f1: 0.5566
 epoch: 21, train_loss: 0.8125, test_loss: 0.9713, test_f1: 0.5303
 epoch: 22, train_loss: 0.8321, test_loss: 0.9647, test_f1: 0.5635
 epoch: 23, train_loss: 0.7999, test_loss: 1.0160, test_f1: 0.5521
 epoch: 24, train_loss: 0.7844, test_loss: 0.9968, test_f1: 0.5696
 epoch: 25, train_loss: 0.7578, test_loss: 1.0135, test_f1: 0.5738
 epoch: 26, train_loss: 0.7596, test_loss: 1.0555, test_f1: 0.5387
 epoch: 27, train_loss: 0.7595, test_loss: 1.0643, test_f1: 0.5589
 epoch: 28, train_loss: 0.7375, test_loss: 1.1210, test_f1: 0.5409
 epoch: 29, train_loss: 0.7475, test_loss: 1.0158, test_f1: 0.5626
 epoch: 30, train_loss: 0.7310, test_loss: 0.9811, test_f1: 0.5379
 epoch: 31, train_loss: 0.7089, test_loss: 1.2037, test_f1: 0.5305
 epoch: 32, train_loss: 0.7379, test_loss: 1.0063, test_f1: 0.5534
 epoch: 33, train_loss: 0.7033, test_loss: 1.0710, test_f1: 0.5421
 epoch: 34, train_loss: 0.6986, test_loss: 1.1268, test_f1: 0.5474
 epoch: 35, train_loss: 0.7138, test_loss: 1.1324, test_f1: 0.5313
 epoch: 36, train_loss: 0.6986, test_loss: 1.0387, test_f1: 0.5603
 epoch: 37, train_loss: 0.6790, test_loss: 1.1145, test_f1: 0.5491
 epoch: 38, train_loss: 0.7392, test_loss: 1.0470, test_f1: 0.5728
 epoch: 39, train_loss: 0.6888, test_loss: 1.1366, test_f1: 0.5287
 epoch: 40, train_loss: 0.7399, test_loss: 1.1173, test_f1: 0.5308
 epoch: 41, train_loss: 0.7160, test_loss: 1.1757, test_f1: 0.5522
 epoch: 42, train_loss: 0.6847, test_loss: 1.0374, test_f1: 0.5803
 epoch: 43, train_loss: 0.6565, test_loss: 1.1360, test_f1: 0.5268
 epoch: 44, train_loss: 0.6450, test_loss: 1.1832, test_f1: 0.5314
 epoch: 45, train_loss: 0.6498, test_loss: 1.1691, test_f1: 0.5667
 epoch: 46, train_loss: 0.6788, test_loss: 1.1347, test_f1: 0.5243
 epoch: 47, train_loss: 0.6423, test_loss: 1.1893, test_f1: 0.5629
 epoch: 48, train_loss: 0.6208, test_loss: 1.1873, test_f1: 0.5616
 epoch: 49, train_loss: 0.6180, test_loss: 1.2731, test_f1: 0.5416
 epoch: 50, train_loss: 0.6551, test_loss: 1.2302, test_f1: 0.5658
 epoch: 51, train_loss: 0.5803, test_loss: 1.2052, test_f1: 0.5643
 epoch: 52, train_loss: 0.5755, test_loss: 1.1765, test_f1: 0.5826
 epoch: 53, train_loss: 0.5754, test_loss: 1.1507, test_f1: 0.5564
 epoch: 54, train_loss: 0.5525, test_loss: 1.1793, test_f1: 0.5846
 epoch: 55, train_loss: 0.5418, test_loss: 1.1812, test_f1: 0.5944
 epoch: 56, train_loss: 0.5549, test_loss: 1.2185, test_f1: 0.5716
 epoch: 57, train_loss: 0.5249, test_loss: 1.2937, test_f1: 0.5746
 epoch: 58, train_loss: 0.5172, test_loss: 1.2860, test_f1: 0.5737
 epoch: 59, train_loss: 0.5120, test_loss: 1.2980, test_f1: 0.5600
 epoch: 60, train_loss: 0.5183, test_loss: 1.3497, test_f1: 0.5477
 epoch: 61, train_loss: 0.5302, test_loss: 1.2735, test_f1: 0.5683
 epoch: 62, train_loss: 0.4982, test_loss: 1.3059, test_f1: 0.5498
 epoch: 63, train_loss: 0.4970, test_loss: 1.3953, test_f1: 0.5539
 epoch: 64, train_loss: 0.4849, test_loss: 1.3556, test_f1: 0.5569
 epoch: 65, train_loss: 0.5039, test_loss: 1.2464, test_f1: 0.5837
 epoch: 66, train_loss: 0.4858, test_loss: 1.4061, test_f1: 0.5588
 epoch: 67, train_loss: 0.4866, test_loss: 1.4259, test_f1: 0.5575
 epoch: 68, train_loss: 0.4926, test_loss: 1.3357, test_f1: 0.5549
 epoch: 69, train_loss: 0.4983, test_loss: 1.3108, test_f1: 0.5777
 epoch: 70, train_loss: 0.4699, test_loss: 1.4358, test_f1: 0.5394
 epoch: 71, train_loss: 0.4949, test_loss: 1.2661, test_f1: 0.5632
 epoch: 72, train_loss: 0.4561, test_loss: 1.3711, test_f1: 0.5523
 epoch: 73, train_loss: 0.4584, test_loss: 1.3151, test_f1: 0.5552
 epoch: 74, train_loss: 0.4474, test_loss: 1.5013, test_f1: 0.5428
 epoch: 75, train_loss: 0.4468, test_loss: 1.3856, test_f1: 0.5424
 epoch: 76, train_loss: 0.4270, test_loss: 1.3947, test_f1: 0.5466
 epoch: 77, train_loss: 0.4656, test_loss: 1.4496, test_f1: 0.5424
 epoch: 78, train_loss: 0.4431, test_loss: 1.4190, test_f1: 0.5340
 epoch: 79, train_loss: 0.4509, test_loss: 1.5187, test_f1: 0.5511
 epoch: 80, train_loss: 0.4200, test_loss: 1.5507, test_f1: 0.5525
 epoch: 81, train_loss: 0.4337, test_loss: 1.3869, test_f1: 0.5633
 epoch: 82, train_loss: 0.4243, test_loss: 1.4726, test_f1: 0.5694
 epoch: 83, train_loss: 0.4366, test_loss: 1.3714, test_f1: 0.5524
 epoch: 84, train_loss: 0.4329, test_loss: 1.3588, test_f1: 0.5575
 epoch: 85, train_loss: 0.4308, test_loss: 1.4318, test_f1: 0.5677
 epoch: 86, train_loss: 0.4069, test_loss: 1.4736, test_f1: 0.5566
 epoch: 87, train_loss: 0.4854, test_loss: 1.3024, test_f1: 0.5410
 epoch: 88, train_loss: 0.4257, test_loss: 1.3220, test_f1: 0.5493
 epoch: 89, train_loss: 0.4228, test_loss: 1.3960, test_f1: 0.5724
 epoch: 90, train_loss: 0.4051, test_loss: 1.5370, test_f1: 0.5669
 epoch: 91, train_loss: 0.3966, test_loss: 1.4172, test_f1: 0.5540
 epoch: 92, train_loss: 0.3864, test_loss: 1.5162, test_f1: 0.5653
 epoch: 93, train_loss: 0.4052, test_loss: 1.4400, test_f1: 0.5649
 epoch: 94, train_loss: 0.3940, test_loss: 1.5772, test_f1: 0.5661
 epoch: 95, train_loss: 0.3687, test_loss: 1.4555, test_f1: 0.6009
 epoch: 96, train_loss: 0.3911, test_loss: 1.5463, test_f1: 0.5633
 epoch: 97, train_loss: 0.3901, test_loss: 1.5836, test_f1: 0.5584
 epoch: 98, train_loss: 0.3929, test_loss: 1.5810, test_f1: 0.5424
 epoch: 99, train_loss: 0.3725, test_loss: 1.5410, test_f1: 0.6035
##################ITERATION #1 ****************************************
 epoch: 0, train_loss: 1.1933, test_loss: 1.0617, test_f1: 0.4871
 epoch: 1, train_loss: 1.0937, test_loss: 1.0065, test_f1: 0.4606
 epoch: 2, train_loss: 1.0315, test_loss: 0.9789, test_f1: 0.4602
 epoch: 3, train_loss: 1.0167, test_loss: 0.9345, test_f1: 0.4827
 epoch: 4, train_loss: 1.0042, test_loss: 1.1256, test_f1: 0.4485
 epoch: 5, train_loss: 0.9834, test_loss: 0.9741, test_f1: 0.4865
 epoch: 6, train_loss: 0.9465, test_loss: 1.0224, test_f1: 0.4783
 epoch: 7, train_loss: 0.9414, test_loss: 1.0124, test_f1: 0.5425
 epoch: 8, train_loss: 0.9237, test_loss: 0.9909, test_f1: 0.5038
 epoch: 9, train_loss: 0.9250, test_loss: 0.9799, test_f1: 0.5046
 epoch: 10, train_loss: 0.8945, test_loss: 0.9691, test_f1: 0.5264
 epoch: 11, train_loss: 0.8892, test_loss: 1.0300, test_f1: 0.5193
 epoch: 12, train_loss: 0.8865, test_loss: 1.0471, test_f1: 0.5395
 epoch: 13, train_loss: 0.8643, test_loss: 1.0742, test_f1: 0.4967
 epoch: 14, train_loss: 0.8543, test_loss: 1.0711, test_f1: 0.5126
 epoch: 15, train_loss: 0.8497, test_loss: 1.0782, test_f1: 0.5277
 epoch: 16, train_loss: 0.8374, test_loss: 1.0385, test_f1: 0.5122
 epoch: 17, train_loss: 0.8306, test_loss: 1.1141, test_f1: 0.5147
 epoch: 18, train_loss: 0.8228, test_loss: 1.0191, test_f1: 0.5501
 epoch: 19, train_loss: 0.8351, test_loss: 1.0812, test_f1: 0.5502
 epoch: 20, train_loss: 0.8011, test_loss: 1.0115, test_f1: 0.5417
 epoch: 21, train_loss: 0.7883, test_loss: 1.0253, test_f1: 0.5694
 epoch: 22, train_loss: 0.7905, test_loss: 1.3495, test_f1: 0.4718
 epoch: 23, train_loss: 0.7971, test_loss: 1.0441, test_f1: 0.5243
 epoch: 24, train_loss: 0.7650, test_loss: 1.1238, test_f1: 0.5218
 epoch: 25, train_loss: 0.7653, test_loss: 1.1007, test_f1: 0.5583
 epoch: 26, train_loss: 0.7523, test_loss: 1.0531, test_f1: 0.5366
 epoch: 27, train_loss: 0.7608, test_loss: 1.0494, test_f1: 0.5566
 epoch: 28, train_loss: 0.7599, test_loss: 1.1364, test_f1: 0.5278
 epoch: 29, train_loss: 0.7323, test_loss: 1.1068, test_f1: 0.5484
 epoch: 30, train_loss: 0.7659, test_loss: 1.0637, test_f1: 0.5380
 epoch: 31, train_loss: 0.7532, test_loss: 1.1330, test_f1: 0.5404
 epoch: 32, train_loss: 0.7273, test_loss: 1.0767, test_f1: 0.5575
 epoch: 33, train_loss: 0.7214, test_loss: 1.1279, test_f1: 0.5501
 epoch: 34, train_loss: 0.7538, test_loss: 1.1407, test_f1: 0.5587
 epoch: 35, train_loss: 0.7062, test_loss: 1.2108, test_f1: 0.5194
 epoch: 36, train_loss: 0.6978, test_loss: 1.0943, test_f1: 0.5501
 epoch: 37, train_loss: 0.7158, test_loss: 1.1199, test_f1: 0.5346
 epoch: 38, train_loss: 0.7046, test_loss: 1.0738, test_f1: 0.5542
 epoch: 39, train_loss: 0.7185, test_loss: 1.0306, test_f1: 0.5134
 epoch: 40, train_loss: 0.7168, test_loss: 1.0788, test_f1: 0.5640
 epoch: 41, train_loss: 0.6930, test_loss: 1.1025, test_f1: 0.5459
 epoch: 42, train_loss: 0.6785, test_loss: 1.0821, test_f1: 0.5470
 epoch: 43, train_loss: 0.6693, test_loss: 1.0808, test_f1: 0.5592
 epoch: 44, train_loss: 0.6857, test_loss: 1.1850, test_f1: 0.5545
 epoch: 45, train_loss: 0.7271, test_loss: 1.2527, test_f1: 0.5178
 epoch: 46, train_loss: 0.6921, test_loss: 1.2039, test_f1: 0.5536
 epoch: 47, train_loss: 0.6721, test_loss: 1.0839, test_f1: 0.5591
 epoch: 48, train_loss: 0.6781, test_loss: 1.1337, test_f1: 0.5165
 epoch: 49, train_loss: 0.6758, test_loss: 1.2022, test_f1: 0.5321
 epoch: 50, train_loss: 0.6515, test_loss: 1.1811, test_f1: 0.5483
 epoch: 51, train_loss: 0.6117, test_loss: 1.1917, test_f1: 0.5322
 epoch: 52, train_loss: 0.6000, test_loss: 1.1217, test_f1: 0.5574
 epoch: 53, train_loss: 0.5776, test_loss: 1.2051, test_f1: 0.5445
 epoch: 54, train_loss: 0.5865, test_loss: 1.2504, test_f1: 0.5301
 epoch: 55, train_loss: 0.5677, test_loss: 1.1494, test_f1: 0.5670
 epoch: 56, train_loss: 0.5580, test_loss: 1.1789, test_f1: 0.5774
 epoch: 57, train_loss: 0.6282, test_loss: 1.1794, test_f1: 0.5355
 epoch: 58, train_loss: 0.5549, test_loss: 1.1868, test_f1: 0.5366
 epoch: 59, train_loss: 0.5697, test_loss: 1.2412, test_f1: 0.5314
 epoch: 60, train_loss: 0.5632, test_loss: 1.2069, test_f1: 0.5383
 epoch: 61, train_loss: 0.5416, test_loss: 1.1967, test_f1: 0.5840
 epoch: 62, train_loss: 0.5442, test_loss: 1.2605, test_f1: 0.5525
 epoch: 63, train_loss: 0.5404, test_loss: 1.3409, test_f1: 0.5302
 epoch: 64, train_loss: 0.5447, test_loss: 1.2464, test_f1: 0.5514
 epoch: 65, train_loss: 0.5434, test_loss: 1.3578, test_f1: 0.5433
 epoch: 66, train_loss: 0.5155, test_loss: 1.2925, test_f1: 0.5708
 epoch: 67, train_loss: 0.5222, test_loss: 1.2440, test_f1: 0.5599
 epoch: 68, train_loss: 0.4989, test_loss: 1.3722, test_f1: 0.5492
 epoch: 69, train_loss: 0.5288, test_loss: 1.2544, test_f1: 0.5307
 epoch: 70, train_loss: 0.5087, test_loss: 1.2889, test_f1: 0.5507
 epoch: 71, train_loss: 0.5086, test_loss: 1.3153, test_f1: 0.5378
 epoch: 72, train_loss: 0.4855, test_loss: 1.3627, test_f1: 0.5636
 epoch: 73, train_loss: 0.4772, test_loss: 1.2968, test_f1: 0.5648
 epoch: 74, train_loss: 0.5166, test_loss: 1.2808, test_f1: 0.5720
 epoch: 75, train_loss: 0.4816, test_loss: 1.3163, test_f1: 0.5523
 epoch: 76, train_loss: 0.4980, test_loss: 1.3877, test_f1: 0.5286
 epoch: 77, train_loss: 0.4761, test_loss: 1.3654, test_f1: 0.5385
 epoch: 78, train_loss: 0.4915, test_loss: 1.3744, test_f1: 0.5711
 epoch: 79, train_loss: 0.4792, test_loss: 1.4638, test_f1: 0.5441
 epoch: 80, train_loss: 0.4745, test_loss: 1.3601, test_f1: 0.5702
 epoch: 81, train_loss: 0.4936, test_loss: 1.2896, test_f1: 0.5565
 epoch: 82, train_loss: 0.4740, test_loss: 1.4707, test_f1: 0.5295
 epoch: 83, train_loss: 0.4451, test_loss: 1.3529, test_f1: 0.5712
 epoch: 84, train_loss: 0.4815, test_loss: 1.4345, test_f1: 0.5565
 epoch: 85, train_loss: 0.4550, test_loss: 1.4539, test_f1: 0.5423
 epoch: 86, train_loss: 0.4801, test_loss: 1.4525, test_f1: 0.5287
 epoch: 87, train_loss: 0.4363, test_loss: 1.4416, test_f1: 0.5519
 epoch: 88, train_loss: 0.4462, test_loss: 1.4201, test_f1: 0.5817
 epoch: 89, train_loss: 0.4231, test_loss: 1.5100, test_f1: 0.5507
 epoch: 90, train_loss: 0.4442, test_loss: 1.4014, test_f1: 0.5540
 epoch: 91, train_loss: 0.4260, test_loss: 1.4038, test_f1: 0.5697
 epoch: 92, train_loss: 0.4442, test_loss: 1.4576, test_f1: 0.5557
 epoch: 93, train_loss: 0.4256, test_loss: 1.3956, test_f1: 0.5630
 epoch: 94, train_loss: 0.4568, test_loss: 1.4975, test_f1: 0.5514
 epoch: 95, train_loss: 0.4641, test_loss: 1.4888, test_f1: 0.5646
 epoch: 96, train_loss: 0.4356, test_loss: 1.3847, test_f1: 0.5424
 epoch: 97, train_loss: 0.4521, test_loss: 1.2954, test_f1: 0.5856
 epoch: 98, train_loss: 0.4213, test_loss: 1.4015, test_f1: 0.5477
 epoch: 99, train_loss: 0.4081, test_loss: 1.3640, test_f1: 0.5833
##################ITERATION #2 ****************************************
 epoch: 0, train_loss: 1.2371, test_loss: 1.1590, test_f1: 0.4198
 epoch: 1, train_loss: 1.1058, test_loss: 0.9810, test_f1: 0.4841
 epoch: 2, train_loss: 1.0476, test_loss: 1.0407, test_f1: 0.4649
 epoch: 3, train_loss: 1.0376, test_loss: 0.9428, test_f1: 0.4855
 epoch: 4, train_loss: 1.0149, test_loss: 0.9539, test_f1: 0.4919
 epoch: 5, train_loss: 0.9777, test_loss: 1.0011, test_f1: 0.4902
 epoch: 6, train_loss: 0.9739, test_loss: 0.9884, test_f1: 0.4625
 epoch: 7, train_loss: 0.9547, test_loss: 0.9115, test_f1: 0.4923
 epoch: 8, train_loss: 0.9406, test_loss: 0.9715, test_f1: 0.5063
 epoch: 9, train_loss: 0.9218, test_loss: 0.9722, test_f1: 0.5109
 epoch: 10, train_loss: 0.9207, test_loss: 0.9909, test_f1: 0.5474
 epoch: 11, train_loss: 0.9120, test_loss: 0.9834, test_f1: 0.5072
 epoch: 12, train_loss: 0.9044, test_loss: 0.9349, test_f1: 0.5458
 epoch: 13, train_loss: 0.8844, test_loss: 0.9734, test_f1: 0.5530
 epoch: 14, train_loss: 0.8631, test_loss: 0.9882, test_f1: 0.5608
 epoch: 15, train_loss: 0.8508, test_loss: 0.9994, test_f1: 0.5304
 epoch: 16, train_loss: 0.8414, test_loss: 1.0990, test_f1: 0.5010
 epoch: 17, train_loss: 0.8323, test_loss: 1.0452, test_f1: 0.5410
 epoch: 18, train_loss: 0.8310, test_loss: 0.9852, test_f1: 0.5300
 epoch: 19, train_loss: 0.8172, test_loss: 1.0367, test_f1: 0.5367
 epoch: 20, train_loss: 0.8530, test_loss: 1.0639, test_f1: 0.4988
 epoch: 21, train_loss: 0.8312, test_loss: 1.0222, test_f1: 0.5367
 epoch: 22, train_loss: 0.7919, test_loss: 1.0125, test_f1: 0.5380
 epoch: 23, train_loss: 0.7899, test_loss: 1.1178, test_f1: 0.5651
 epoch: 24, train_loss: 0.7825, test_loss: 1.0847, test_f1: 0.5035
 epoch: 25, train_loss: 0.7654, test_loss: 1.0076, test_f1: 0.5436
 epoch: 26, train_loss: 0.7681, test_loss: 1.0142, test_f1: 0.5376
 epoch: 27, train_loss: 0.7547, test_loss: 1.0619, test_f1: 0.5586
 epoch: 28, train_loss: 0.7318, test_loss: 1.1274, test_f1: 0.5544
 epoch: 29, train_loss: 0.7361, test_loss: 1.0753, test_f1: 0.5607
 epoch: 30, train_loss: 0.7096, test_loss: 1.0781, test_f1: 0.5638
 epoch: 31, train_loss: 0.7178, test_loss: 1.1201, test_f1: 0.5494
 epoch: 32, train_loss: 0.7482, test_loss: 1.0903, test_f1: 0.5373
 epoch: 33, train_loss: 0.7271, test_loss: 1.0906, test_f1: 0.5420
 epoch: 34, train_loss: 0.6964, test_loss: 1.1115, test_f1: 0.5120
 epoch: 35, train_loss: 0.7137, test_loss: 1.0399, test_f1: 0.5652
 epoch: 36, train_loss: 0.6957, test_loss: 1.0248, test_f1: 0.5663
 epoch: 37, train_loss: 0.6845, test_loss: 1.0398, test_f1: 0.5643
 epoch: 38, train_loss: 0.6758, test_loss: 1.0894, test_f1: 0.5450
 epoch: 39, train_loss: 0.6537, test_loss: 1.0703, test_f1: 0.5657
 epoch: 40, train_loss: 0.6645, test_loss: 1.0921, test_f1: 0.5384
 epoch: 41, train_loss: 0.6733, test_loss: 1.0847, test_f1: 0.5682
 epoch: 42, train_loss: 0.6638, test_loss: 1.0720, test_f1: 0.5703
 epoch: 43, train_loss: 0.6655, test_loss: 0.9742, test_f1: 0.5718
 epoch: 44, train_loss: 0.6410, test_loss: 1.0783, test_f1: 0.5660
 epoch: 45, train_loss: 0.6393, test_loss: 1.0932, test_f1: 0.5445
 epoch: 46, train_loss: 0.6864, test_loss: 1.0299, test_f1: 0.5796
 epoch: 47, train_loss: 0.6247, test_loss: 1.1391, test_f1: 0.5591
 epoch: 48, train_loss: 0.6331, test_loss: 1.0821, test_f1: 0.5456
 epoch: 49, train_loss: 0.6384, test_loss: 1.0884, test_f1: 0.5622
 epoch: 50, train_loss: 0.6088, test_loss: 1.1052, test_f1: 0.5796
 epoch: 51, train_loss: 0.5600, test_loss: 1.0749, test_f1: 0.5757
 epoch: 52, train_loss: 0.5912, test_loss: 1.0758, test_f1: 0.5590
 epoch: 53, train_loss: 0.5448, test_loss: 1.1789, test_f1: 0.5842
 epoch: 54, train_loss: 0.5429, test_loss: 1.0731, test_f1: 0.5577
 epoch: 55, train_loss: 0.5552, test_loss: 1.1292, test_f1: 0.5766
 epoch: 56, train_loss: 0.5056, test_loss: 1.1666, test_f1: 0.5627
 epoch: 57, train_loss: 0.5097, test_loss: 1.1252, test_f1: 0.5894
 epoch: 58, train_loss: 0.5285, test_loss: 1.1118, test_f1: 0.5877
 epoch: 59, train_loss: 0.4968, test_loss: 1.2347, test_f1: 0.5491
 epoch: 60, train_loss: 0.4800, test_loss: 1.1784, test_f1: 0.5820
 epoch: 61, train_loss: 0.4917, test_loss: 1.1869, test_f1: 0.5881
 epoch: 62, train_loss: 0.4819, test_loss: 1.1787, test_f1: 0.5858
 epoch: 63, train_loss: 0.4803, test_loss: 1.2489, test_f1: 0.5565
 epoch: 64, train_loss: 0.5004, test_loss: 1.2136, test_f1: 0.5605
 epoch: 65, train_loss: 0.4840, test_loss: 1.2380, test_f1: 0.5340
 epoch: 66, train_loss: 0.4543, test_loss: 1.2357, test_f1: 0.5639
 epoch: 67, train_loss: 0.4558, test_loss: 1.2698, test_f1: 0.5730
 epoch: 68, train_loss: 0.4673, test_loss: 1.2959, test_f1: 0.5492
 epoch: 69, train_loss: 0.4662, test_loss: 1.3063, test_f1: 0.5887
 epoch: 70, train_loss: 0.4632, test_loss: 1.2172, test_f1: 0.5960
 epoch: 71, train_loss: 0.4497, test_loss: 1.1911, test_f1: 0.5975
 epoch: 72, train_loss: 0.4585, test_loss: 1.2292, test_f1: 0.5613
 epoch: 73, train_loss: 0.4396, test_loss: 1.2918, test_f1: 0.5945
 epoch: 74, train_loss: 0.4159, test_loss: 1.3251, test_f1: 0.5814
 epoch: 75, train_loss: 0.4228, test_loss: 1.2818, test_f1: 0.5843
 epoch: 76, train_loss: 0.4338, test_loss: 1.3076, test_f1: 0.5690
 epoch: 77, train_loss: 0.4341, test_loss: 1.2997, test_f1: 0.5871
 epoch: 78, train_loss: 0.4286, test_loss: 1.3491, test_f1: 0.5683
 epoch: 79, train_loss: 0.4120, test_loss: 1.5848, test_f1: 0.5606
 epoch: 80, train_loss: 0.4092, test_loss: 1.4432, test_f1: 0.5704
 epoch: 81, train_loss: 0.4205, test_loss: 1.5369, test_f1: 0.5558
 epoch: 82, train_loss: 0.3893, test_loss: 1.3925, test_f1: 0.5822
 epoch: 83, train_loss: 0.4316, test_loss: 1.4545, test_f1: 0.5454
 epoch: 84, train_loss: 0.4077, test_loss: 1.4995, test_f1: 0.5643
 epoch: 85, train_loss: 0.3988, test_loss: 1.5260, test_f1: 0.5402
 epoch: 86, train_loss: 0.4491, test_loss: 1.3989, test_f1: 0.5732
 epoch: 87, train_loss: 0.3906, test_loss: 1.4721, test_f1: 0.5436
 epoch: 88, train_loss: 0.4103, test_loss: 1.3826, test_f1: 0.5726
 epoch: 89, train_loss: 0.3732, test_loss: 1.4323, test_f1: 0.5894
 epoch: 90, train_loss: 0.3763, test_loss: 1.6607, test_f1: 0.5527
 epoch: 91, train_loss: 0.3644, test_loss: 1.5573, test_f1: 0.5485
 epoch: 92, train_loss: 0.3749, test_loss: 1.4884, test_f1: 0.5741
 epoch: 93, train_loss: 0.3795, test_loss: 1.4421, test_f1: 0.5591
 epoch: 94, train_loss: 0.3628, test_loss: 1.5140, test_f1: 0.5612
 epoch: 95, train_loss: 0.3648, test_loss: 1.5583, test_f1: 0.5679
 epoch: 96, train_loss: 0.3811, test_loss: 1.5019, test_f1: 0.5743
 epoch: 97, train_loss: 0.3924, test_loss: 1.5822, test_f1: 0.5750
 epoch: 98, train_loss: 0.3560, test_loss: 1.3879, test_f1: 0.5851
 epoch: 99, train_loss: 0.3694, test_loss: 1.4502, test_f1: 0.5624
##################ITERATION #3 ****************************************
 epoch: 0, train_loss: 1.3101, test_loss: 1.1224, test_f1: 0.4233
 epoch: 1, train_loss: 1.1212, test_loss: 1.0646, test_f1: 0.4306
 epoch: 2, train_loss: 1.0613, test_loss: 1.0320, test_f1: 0.4251
 epoch: 3, train_loss: 1.0356, test_loss: 0.9649, test_f1: 0.5021
 epoch: 4, train_loss: 1.0302, test_loss: 0.9764, test_f1: 0.4519
 epoch: 5, train_loss: 1.0047, test_loss: 0.9151, test_f1: 0.5009
 epoch: 6, train_loss: 0.9742, test_loss: 1.0156, test_f1: 0.4881
 epoch: 7, train_loss: 0.9520, test_loss: 1.0453, test_f1: 0.4853
 epoch: 8, train_loss: 0.9373, test_loss: 1.0216, test_f1: 0.4646
 epoch: 9, train_loss: 0.9385, test_loss: 1.0309, test_f1: 0.4950
 epoch: 10, train_loss: 0.9110, test_loss: 0.9977, test_f1: 0.5121
 epoch: 11, train_loss: 0.8977, test_loss: 1.0306, test_f1: 0.5163
 epoch: 12, train_loss: 0.8664, test_loss: 0.9955, test_f1: 0.5104
 epoch: 13, train_loss: 0.8623, test_loss: 1.0174, test_f1: 0.5256
 epoch: 14, train_loss: 0.8476, test_loss: 1.0115, test_f1: 0.5310
 epoch: 15, train_loss: 0.8336, test_loss: 1.0578, test_f1: 0.5261
 epoch: 16, train_loss: 0.8501, test_loss: 1.1392, test_f1: 0.5183
 epoch: 17, train_loss: 0.8204, test_loss: 1.0742, test_f1: 0.5423
 epoch: 18, train_loss: 0.8192, test_loss: 1.0541, test_f1: 0.5412
 epoch: 19, train_loss: 0.8226, test_loss: 1.0632, test_f1: 0.5283
 epoch: 20, train_loss: 0.7899, test_loss: 1.0623, test_f1: 0.5180
 epoch: 21, train_loss: 0.7733, test_loss: 1.0682, test_f1: 0.5507
 epoch: 22, train_loss: 0.7910, test_loss: 1.0960, test_f1: 0.5622
 epoch: 23, train_loss: 0.7783, test_loss: 1.1660, test_f1: 0.5122
 epoch: 24, train_loss: 0.7468, test_loss: 1.1202, test_f1: 0.5329
 epoch: 25, train_loss: 0.7676, test_loss: 1.0931, test_f1: 0.5445
 epoch: 26, train_loss: 0.7581, test_loss: 1.0566, test_f1: 0.5504
 epoch: 27, train_loss: 0.7210, test_loss: 1.1431, test_f1: 0.5393
 epoch: 28, train_loss: 0.7152, test_loss: 1.2093, test_f1: 0.5187
 epoch: 29, train_loss: 0.7186, test_loss: 1.3679, test_f1: 0.5010
 epoch: 30, train_loss: 0.7173, test_loss: 1.1076, test_f1: 0.5619
 epoch: 31, train_loss: 0.7006, test_loss: 1.0678, test_f1: 0.5436
 epoch: 32, train_loss: 0.7231, test_loss: 1.0437, test_f1: 0.5519
 epoch: 33, train_loss: 0.7846, test_loss: 0.9475, test_f1: 0.5432
 epoch: 34, train_loss: 0.7205, test_loss: 1.0978, test_f1: 0.5321
 epoch: 35, train_loss: 0.7104, test_loss: 1.0055, test_f1: 0.5464
 epoch: 36, train_loss: 0.6884, test_loss: 0.9944, test_f1: 0.5844
 epoch: 37, train_loss: 0.7042, test_loss: 1.0811, test_f1: 0.5529
 epoch: 38, train_loss: 0.6795, test_loss: 1.1575, test_f1: 0.5314
 epoch: 39, train_loss: 0.6744, test_loss: 1.0474, test_f1: 0.5442
 epoch: 40, train_loss: 0.6718, test_loss: 1.0875, test_f1: 0.5446
 epoch: 41, train_loss: 0.6568, test_loss: 1.1541, test_f1: 0.5228
 epoch: 42, train_loss: 0.6948, test_loss: 1.1863, test_f1: 0.5103
 epoch: 43, train_loss: 0.6529, test_loss: 1.0850, test_f1: 0.5591
 epoch: 44, train_loss: 0.6542, test_loss: 1.1615, test_f1: 0.5631
 epoch: 45, train_loss: 0.6299, test_loss: 1.2073, test_f1: 0.5020
 epoch: 46, train_loss: 0.6612, test_loss: 1.3226, test_f1: 0.5285
 epoch: 47, train_loss: 0.6411, test_loss: 1.1130, test_f1: 0.5478
 epoch: 48, train_loss: 0.6326, test_loss: 1.3114, test_f1: 0.5266
 epoch: 49, train_loss: 0.6184, test_loss: 1.1291, test_f1: 0.5529
 epoch: 50, train_loss: 0.6122, test_loss: 1.1665, test_f1: 0.5287
 epoch: 51, train_loss: 0.5565, test_loss: 1.1755, test_f1: 0.5748
 epoch: 52, train_loss: 0.5486, test_loss: 1.2150, test_f1: 0.5760
 epoch: 53, train_loss: 0.5352, test_loss: 1.2506, test_f1: 0.5485
 epoch: 54, train_loss: 0.5289, test_loss: 1.2656, test_f1: 0.5468
 epoch: 55, train_loss: 0.5288, test_loss: 1.2765, test_f1: 0.5631
 epoch: 56, train_loss: 0.5470, test_loss: 1.2325, test_f1: 0.5583
 epoch: 57, train_loss: 0.5225, test_loss: 1.3423, test_f1: 0.5529
 epoch: 58, train_loss: 0.5237, test_loss: 1.3371, test_f1: 0.5277
 epoch: 59, train_loss: 0.5241, test_loss: 1.3811, test_f1: 0.5452
 epoch: 60, train_loss: 0.5099, test_loss: 1.2736, test_f1: 0.5474
 epoch: 61, train_loss: 0.4926, test_loss: 1.2980, test_f1: 0.5701
 epoch: 62, train_loss: 0.4825, test_loss: 1.2014, test_f1: 0.5675
 epoch: 63, train_loss: 0.4785, test_loss: 1.5080, test_f1: 0.5189
 epoch: 64, train_loss: 0.5045, test_loss: 1.4325, test_f1: 0.5358
 epoch: 65, train_loss: 0.4787, test_loss: 1.3442, test_f1: 0.5389
 epoch: 66, train_loss: 0.4795, test_loss: 1.3204, test_f1: 0.5263
 epoch: 67, train_loss: 0.4505, test_loss: 1.3990, test_f1: 0.5396
 epoch: 68, train_loss: 0.4533, test_loss: 1.3854, test_f1: 0.5394
 epoch: 69, train_loss: 0.4620, test_loss: 1.4378, test_f1: 0.5216
 epoch: 70, train_loss: 0.4436, test_loss: 1.4294, test_f1: 0.5413
 epoch: 71, train_loss: 0.4360, test_loss: 1.3803, test_f1: 0.5383
 epoch: 72, train_loss: 0.4345, test_loss: 1.4191, test_f1: 0.5608
 epoch: 73, train_loss: 0.4355, test_loss: 1.4007, test_f1: 0.5681
 epoch: 74, train_loss: 0.4340, test_loss: 1.5894, test_f1: 0.5598
 epoch: 75, train_loss: 0.4232, test_loss: 1.6226, test_f1: 0.5473
 epoch: 76, train_loss: 0.4311, test_loss: 1.5809, test_f1: 0.5307
 epoch: 77, train_loss: 0.4435, test_loss: 1.4729, test_f1: 0.5317
 epoch: 78, train_loss: 0.4503, test_loss: 1.3746, test_f1: 0.5400
 epoch: 79, train_loss: 0.4587, test_loss: 1.4424, test_f1: 0.5517
 epoch: 80, train_loss: 0.4199, test_loss: 1.3599, test_f1: 0.5665
 epoch: 81, train_loss: 0.4113, test_loss: 1.3764, test_f1: 0.5589
 epoch: 82, train_loss: 0.3995, test_loss: 1.5656, test_f1: 0.5035
 epoch: 83, train_loss: 0.4122, test_loss: 1.3954, test_f1: 0.5637
 epoch: 84, train_loss: 0.4153, test_loss: 1.6105, test_f1: 0.5205
 epoch: 85, train_loss: 0.4431, test_loss: 1.5484, test_f1: 0.5440
 epoch: 86, train_loss: 0.4086, test_loss: 1.5148, test_f1: 0.5698
 epoch: 87, train_loss: 0.3998, test_loss: 1.4858, test_f1: 0.5542
 epoch: 88, train_loss: 0.4373, test_loss: 1.3898, test_f1: 0.5529
 epoch: 89, train_loss: 0.4211, test_loss: 1.4308, test_f1: 0.5562
 epoch: 90, train_loss: 0.3786, test_loss: 1.4839, test_f1: 0.5757
 epoch: 91, train_loss: 0.3931, test_loss: 1.4951, test_f1: 0.5511
 epoch: 92, train_loss: 0.3940, test_loss: 1.5508, test_f1: 0.5347
 epoch: 93, train_loss: 0.4071, test_loss: 1.5573, test_f1: 0.5104
 epoch: 94, train_loss: 0.3881, test_loss: 1.5591, test_f1: 0.5251
 epoch: 95, train_loss: 0.3674, test_loss: 1.6177, test_f1: 0.5719
 epoch: 96, train_loss: 0.3745, test_loss: 1.6131, test_f1: 0.5541
 epoch: 97, train_loss: 0.3590, test_loss: 1.6739, test_f1: 0.5340
 epoch: 98, train_loss: 0.3499, test_loss: 1.6866, test_f1: 0.5506
 epoch: 99, train_loss: 0.3494, test_loss: 1.7411, test_f1: 0.5371
##################ITERATION #4 ****************************************
 epoch: 0, train_loss: 1.3058, test_loss: 1.1178, test_f1: 0.3977
 epoch: 1, train_loss: 1.1271, test_loss: 1.0631, test_f1: 0.4268
 epoch: 2, train_loss: 1.0925, test_loss: 0.9706, test_f1: 0.4796
 epoch: 3, train_loss: 1.0427, test_loss: 0.9776, test_f1: 0.4983
 epoch: 4, train_loss: 1.0253, test_loss: 0.9677, test_f1: 0.4676
 epoch: 5, train_loss: 1.0014, test_loss: 1.0231, test_f1: 0.4805
 epoch: 6, train_loss: 0.9829, test_loss: 0.9470, test_f1: 0.4457
 epoch: 7, train_loss: 0.9620, test_loss: 0.9799, test_f1: 0.5258
 epoch: 8, train_loss: 0.9495, test_loss: 0.9766, test_f1: 0.5077
 epoch: 9, train_loss: 0.9660, test_loss: 1.0439, test_f1: 0.4756
 epoch: 10, train_loss: 0.9471, test_loss: 1.0054, test_f1: 0.5057
 epoch: 11, train_loss: 0.9140, test_loss: 0.9851, test_f1: 0.4965
 epoch: 12, train_loss: 0.9142, test_loss: 0.9436, test_f1: 0.5041
 epoch: 13, train_loss: 0.8976, test_loss: 0.9417, test_f1: 0.5183
 epoch: 14, train_loss: 0.8897, test_loss: 0.9937, test_f1: 0.5162
 epoch: 15, train_loss: 0.9118, test_loss: 0.9984, test_f1: 0.5090
 epoch: 16, train_loss: 0.8823, test_loss: 0.9763, test_f1: 0.5252
 epoch: 17, train_loss: 0.8484, test_loss: 0.9990, test_f1: 0.5230
 epoch: 18, train_loss: 0.8329, test_loss: 1.0458, test_f1: 0.4929
 epoch: 19, train_loss: 0.8660, test_loss: 0.9901, test_f1: 0.5245
 epoch: 20, train_loss: 0.8206, test_loss: 1.1040, test_f1: 0.5407
 epoch: 21, train_loss: 0.8176, test_loss: 1.0811, test_f1: 0.5313
 epoch: 22, train_loss: 0.8168, test_loss: 0.9898, test_f1: 0.5229
 epoch: 23, train_loss: 0.8031, test_loss: 1.0709, test_f1: 0.5592
 epoch: 24, train_loss: 0.7876, test_loss: 1.1461, test_f1: 0.5279
 epoch: 25, train_loss: 0.7933, test_loss: 1.0942, test_f1: 0.5417
 epoch: 26, train_loss: 0.7764, test_loss: 1.0420, test_f1: 0.5764
 epoch: 27, train_loss: 0.7613, test_loss: 1.1166, test_f1: 0.5790
 epoch: 28, train_loss: 0.7853, test_loss: 1.1060, test_f1: 0.5535
 epoch: 29, train_loss: 0.8104, test_loss: 1.0607, test_f1: 0.5204
 epoch: 30, train_loss: 0.7779, test_loss: 1.1011, test_f1: 0.5646
 epoch: 31, train_loss: 0.7551, test_loss: 1.1314, test_f1: 0.5647
 epoch: 32, train_loss: 0.7346, test_loss: 1.1208, test_f1: 0.5712
 epoch: 33, train_loss: 0.7197, test_loss: 1.1396, test_f1: 0.5655
 epoch: 34, train_loss: 0.7434, test_loss: 1.1686, test_f1: 0.5692
 epoch: 35, train_loss: 0.7323, test_loss: 1.0697, test_f1: 0.5392
 epoch: 36, train_loss: 0.7087, test_loss: 1.1855, test_f1: 0.5784
 epoch: 37, train_loss: 0.6877, test_loss: 1.1889, test_f1: 0.5078
 epoch: 38, train_loss: 0.7347, test_loss: 1.1512, test_f1: 0.5381
 epoch: 39, train_loss: 0.6863, test_loss: 1.1556, test_f1: 0.5297
 epoch: 40, train_loss: 0.8332, test_loss: 1.0718, test_f1: 0.5573
 epoch: 41, train_loss: 0.7190, test_loss: 1.1746, test_f1: 0.5515
 epoch: 42, train_loss: 0.6985, test_loss: 1.1232, test_f1: 0.5447
 epoch: 43, train_loss: 0.6807, test_loss: 1.1009, test_f1: 0.5615
 epoch: 44, train_loss: 0.7076, test_loss: 1.1444, test_f1: 0.5631
 epoch: 45, train_loss: 0.6909, test_loss: 1.1073, test_f1: 0.5226
 epoch: 46, train_loss: 0.6715, test_loss: 1.1834, test_f1: 0.5449
 epoch: 47, train_loss: 0.6601, test_loss: 1.1310, test_f1: 0.5508
 epoch: 48, train_loss: 0.6439, test_loss: 1.2332, test_f1: 0.5589
 epoch: 49, train_loss: 0.6436, test_loss: 1.2102, test_f1: 0.5437
 epoch: 50, train_loss: 0.6513, test_loss: 1.1783, test_f1: 0.5599
 epoch: 51, train_loss: 0.5957, test_loss: 1.2231, test_f1: 0.5281
 epoch: 52, train_loss: 0.5958, test_loss: 1.1590, test_f1: 0.5722
 epoch: 53, train_loss: 0.5803, test_loss: 1.1784, test_f1: 0.5885
 epoch: 54, train_loss: 0.5691, test_loss: 1.2281, test_f1: 0.5621
 epoch: 55, train_loss: 0.5443, test_loss: 1.2724, test_f1: 0.5903
 epoch: 56, train_loss: 0.5748, test_loss: 1.2354, test_f1: 0.5605
 epoch: 57, train_loss: 0.5616, test_loss: 1.2991, test_f1: 0.5657
 epoch: 58, train_loss: 0.5513, test_loss: 1.2652, test_f1: 0.5743
 epoch: 59, train_loss: 0.5556, test_loss: 1.1698, test_f1: 0.5813
 epoch: 60, train_loss: 0.5275, test_loss: 1.3505, test_f1: 0.5414
 epoch: 61, train_loss: 0.5140, test_loss: 1.2723, test_f1: 0.5636
 epoch: 62, train_loss: 0.5120, test_loss: 1.3039, test_f1: 0.5571
 epoch: 63, train_loss: 0.5172, test_loss: 1.2997, test_f1: 0.5541
 epoch: 64, train_loss: 0.5176, test_loss: 1.3331, test_f1: 0.5533
 epoch: 65, train_loss: 0.5300, test_loss: 1.3278, test_f1: 0.5665
 epoch: 66, train_loss: 0.5244, test_loss: 1.2712, test_f1: 0.5729
 epoch: 67, train_loss: 0.5032, test_loss: 1.3380, test_f1: 0.5711
 epoch: 68, train_loss: 0.4975, test_loss: 1.2838, test_f1: 0.5700
 epoch: 69, train_loss: 0.4942, test_loss: 1.3684, test_f1: 0.5471
 epoch: 70, train_loss: 0.4956, test_loss: 1.3174, test_f1: 0.5893
 epoch: 71, train_loss: 0.4696, test_loss: 1.2954, test_f1: 0.5964
 epoch: 72, train_loss: 0.5271, test_loss: 1.4498, test_f1: 0.5602
 epoch: 73, train_loss: 0.5083, test_loss: 1.3321, test_f1: 0.5816
 epoch: 74, train_loss: 0.4815, test_loss: 1.3501, test_f1: 0.5817
 epoch: 75, train_loss: 0.4833, test_loss: 1.3236, test_f1: 0.5792
 epoch: 76, train_loss: 0.4687, test_loss: 1.4113, test_f1: 0.5638
 epoch: 77, train_loss: 0.4637, test_loss: 1.3958, test_f1: 0.5577
 epoch: 78, train_loss: 0.4400, test_loss: 1.4731, test_f1: 0.5464
 epoch: 79, train_loss: 0.4734, test_loss: 1.3839, test_f1: 0.5663
 epoch: 80, train_loss: 0.4448, test_loss: 1.4238, test_f1: 0.5994
 epoch: 81, train_loss: 0.4435, test_loss: 1.4910, test_f1: 0.5806
 epoch: 82, train_loss: 0.4345, test_loss: 1.4140, test_f1: 0.5871
 epoch: 83, train_loss: 0.4396, test_loss: 1.4132, test_f1: 0.5851
 epoch: 84, train_loss: 0.4342, test_loss: 1.5757, test_f1: 0.5533
 epoch: 85, train_loss: 0.4352, test_loss: 1.4141, test_f1: 0.5751
 epoch: 86, train_loss: 0.4386, test_loss: 1.4076, test_f1: 0.5633
 epoch: 87, train_loss: 0.4187, test_loss: 1.5515, test_f1: 0.5433
 epoch: 88, train_loss: 0.4327, test_loss: 1.4225, test_f1: 0.5880
 epoch: 89, train_loss: 0.4856, test_loss: 1.4380, test_f1: 0.5569
 epoch: 90, train_loss: 0.4314, test_loss: 1.4892, test_f1: 0.5722
 epoch: 91, train_loss: 0.4136, test_loss: 1.4673, test_f1: 0.5734
 epoch: 92, train_loss: 0.4306, test_loss: 1.5051, test_f1: 0.5580
 epoch: 93, train_loss: 0.4054, test_loss: 1.5619, test_f1: 0.5524
 epoch: 94, train_loss: 0.4362, test_loss: 1.5143, test_f1: 0.5806
 epoch: 95, train_loss: 0.3981, test_loss: 1.5664, test_f1: 0.5636
 epoch: 96, train_loss: 0.3999, test_loss: 1.5836, test_f1: 0.5879
 epoch: 97, train_loss: 0.4054, test_loss: 1.7255, test_f1: 0.5556
 epoch: 98, train_loss: 0.3924, test_loss: 1.5276, test_f1: 0.5876
 epoch: 99, train_loss: 0.3982, test_loss: 1.5433, test_f1: 0.5736
##################ITERATION #5 ****************************************
 epoch: 0, train_loss: 1.2728, test_loss: 1.0822, test_f1: 0.4026
 epoch: 1, train_loss: 1.0985, test_loss: 1.0250, test_f1: 0.4490
 epoch: 2, train_loss: 1.0639, test_loss: 0.9869, test_f1: 0.4505
 epoch: 3, train_loss: 1.0353, test_loss: 0.9891, test_f1: 0.4680
 epoch: 4, train_loss: 1.0091, test_loss: 0.9898, test_f1: 0.4498
 epoch: 5, train_loss: 1.0007, test_loss: 0.9813, test_f1: 0.4522
 epoch: 6, train_loss: 0.9689, test_loss: 0.9743, test_f1: 0.4865
 epoch: 7, train_loss: 0.9472, test_loss: 0.9644, test_f1: 0.4869
 epoch: 8, train_loss: 0.9550, test_loss: 0.9873, test_f1: 0.5069
 epoch: 9, train_loss: 0.9312, test_loss: 0.9388, test_f1: 0.5850
 epoch: 10, train_loss: 0.9046, test_loss: 0.9796, test_f1: 0.5257
 epoch: 11, train_loss: 0.9050, test_loss: 1.0371, test_f1: 0.4964
 epoch: 12, train_loss: 0.8935, test_loss: 0.9581, test_f1: 0.4893
 epoch: 13, train_loss: 0.8858, test_loss: 1.0480, test_f1: 0.4680
 epoch: 14, train_loss: 0.8726, test_loss: 0.9906, test_f1: 0.5110
 epoch: 15, train_loss: 0.8830, test_loss: 0.9639, test_f1: 0.5302
 epoch: 16, train_loss: 0.8567, test_loss: 0.9969, test_f1: 0.5252
 epoch: 17, train_loss: 0.8477, test_loss: 1.0885, test_f1: 0.4867
 epoch: 18, train_loss: 0.8459, test_loss: 1.0225, test_f1: 0.5351
 epoch: 19, train_loss: 0.8295, test_loss: 1.0264, test_f1: 0.5337
 epoch: 20, train_loss: 0.8259, test_loss: 0.9752, test_f1: 0.5550
 epoch: 21, train_loss: 0.7979, test_loss: 0.9953, test_f1: 0.5423
 epoch: 22, train_loss: 0.8099, test_loss: 1.0242, test_f1: 0.5255
 epoch: 23, train_loss: 0.8001, test_loss: 0.9320, test_f1: 0.5481
 epoch: 24, train_loss: 0.8028, test_loss: 1.0306, test_f1: 0.5445
 epoch: 25, train_loss: 0.7737, test_loss: 1.0564, test_f1: 0.5542
 epoch: 26, train_loss: 0.7583, test_loss: 1.0734, test_f1: 0.5565
 epoch: 27, train_loss: 0.7908, test_loss: 1.0040, test_f1: 0.5555
 epoch: 28, train_loss: 0.7486, test_loss: 0.9499, test_f1: 0.5546
 epoch: 29, train_loss: 0.7438, test_loss: 0.9727, test_f1: 0.5700
 epoch: 30, train_loss: 0.7369, test_loss: 1.0603, test_f1: 0.5311
 epoch: 31, train_loss: 0.7418, test_loss: 1.0467, test_f1: 0.5486
 epoch: 32, train_loss: 0.7388, test_loss: 0.9733, test_f1: 0.5705
 epoch: 33, train_loss: 0.7166, test_loss: 1.1457, test_f1: 0.5302
 epoch: 34, train_loss: 0.7109, test_loss: 1.0585, test_f1: 0.5710
 epoch: 35, train_loss: 0.6808, test_loss: 0.9872, test_f1: 0.5730
 epoch: 36, train_loss: 0.7229, test_loss: 1.0688, test_f1: 0.5799
 epoch: 37, train_loss: 0.6812, test_loss: 1.1553, test_f1: 0.5605
 epoch: 38, train_loss: 0.7014, test_loss: 1.1800, test_f1: 0.5553
 epoch: 39, train_loss: 0.6965, test_loss: 1.0771, test_f1: 0.5942
 epoch: 40, train_loss: 0.6865, test_loss: 1.0939, test_f1: 0.5751
 epoch: 41, train_loss: 0.6651, test_loss: 0.9924, test_f1: 0.5651
 epoch: 42, train_loss: 0.7011, test_loss: 1.0552, test_f1: 0.5745
 epoch: 43, train_loss: 0.6972, test_loss: 0.9425, test_f1: 0.6007
 epoch: 44, train_loss: 0.6585, test_loss: 1.1058, test_f1: 0.5657
 epoch: 45, train_loss: 0.6789, test_loss: 0.9596, test_f1: 0.5885
 epoch: 46, train_loss: 0.6571, test_loss: 0.9404, test_f1: 0.5639
 epoch: 47, train_loss: 0.6614, test_loss: 0.9734, test_f1: 0.5831
 epoch: 48, train_loss: 0.6238, test_loss: 1.0175, test_f1: 0.5800
 epoch: 49, train_loss: 0.6251, test_loss: 2.5350, test_f1: 0.5527
 epoch: 50, train_loss: 0.6374, test_loss: 1.0400, test_f1: 0.6138
 epoch: 51, train_loss: 0.6010, test_loss: 1.0190, test_f1: 0.5915
 epoch: 52, train_loss: 0.5627, test_loss: 0.9853, test_f1: 0.5980
 epoch: 53, train_loss: 0.5408, test_loss: 1.0632, test_f1: 0.6000
 epoch: 54, train_loss: 0.5274, test_loss: 1.0370, test_f1: 0.6080
 epoch: 55, train_loss: 0.5390, test_loss: 1.1164, test_f1: 0.6089
 epoch: 56, train_loss: 0.5336, test_loss: 1.1655, test_f1: 0.5840
 epoch: 57, train_loss: 0.5359, test_loss: 1.1123, test_f1: 0.5967
 epoch: 58, train_loss: 0.5227, test_loss: 1.1086, test_f1: 0.5914
 epoch: 59, train_loss: 0.5214, test_loss: 1.1852, test_f1: 0.5975
 epoch: 60, train_loss: 0.5148, test_loss: 1.1751, test_f1: 0.5740
 epoch: 61, train_loss: 0.5034, test_loss: 1.1274, test_f1: 0.6037
 epoch: 62, train_loss: 0.5102, test_loss: 1.1022, test_f1: 0.6137
 epoch: 63, train_loss: 0.5041, test_loss: 1.1115, test_f1: 0.5872
 epoch: 64, train_loss: 0.4890, test_loss: 1.1099, test_f1: 0.5813
 epoch: 65, train_loss: 0.4908, test_loss: 1.1226, test_f1: 0.5834
 epoch: 66, train_loss: 0.4852, test_loss: 1.2080, test_f1: 0.5568
 epoch: 67, train_loss: 0.5134, test_loss: 1.0546, test_f1: 0.5725
 epoch: 68, train_loss: 0.4857, test_loss: 1.1078, test_f1: 0.5800
 epoch: 69, train_loss: 0.4649, test_loss: 1.1193, test_f1: 0.5875
 epoch: 70, train_loss: 0.4820, test_loss: 1.1596, test_f1: 0.5951
 epoch: 71, train_loss: 0.4790, test_loss: 1.1692, test_f1: 0.5853
 epoch: 72, train_loss: 0.4607, test_loss: 1.2816, test_f1: 0.5796
 epoch: 73, train_loss: 0.4641, test_loss: 1.1382, test_f1: 0.5801
 epoch: 74, train_loss: 0.4495, test_loss: 1.1826, test_f1: 0.5875
 epoch: 75, train_loss: 0.4628, test_loss: 1.1118, test_f1: 0.6077
 epoch: 76, train_loss: 0.4341, test_loss: 1.1413, test_f1: 0.6067
 epoch: 77, train_loss: 0.4365, test_loss: 1.1461, test_f1: 0.6015
 epoch: 78, train_loss: 0.4303, test_loss: 1.1580, test_f1: 0.5914
 epoch: 79, train_loss: 0.4171, test_loss: 1.1708, test_f1: 0.5928
 epoch: 80, train_loss: 0.4285, test_loss: 1.1723, test_f1: 0.6065
 epoch: 81, train_loss: 0.4469, test_loss: 1.1733, test_f1: 0.5893
 epoch: 82, train_loss: 0.4277, test_loss: 1.2761, test_f1: 0.6009
 epoch: 83, train_loss: 0.4608, test_loss: 1.2106, test_f1: 0.5728
 epoch: 84, train_loss: 0.4280, test_loss: 1.2211, test_f1: 0.5893
 epoch: 85, train_loss: 0.4182, test_loss: 1.2405, test_f1: 0.5800
 epoch: 86, train_loss: 0.4438, test_loss: 1.2314, test_f1: 0.6094
 epoch: 87, train_loss: 0.4396, test_loss: 1.2425, test_f1: 0.5857
 epoch: 88, train_loss: 0.4014, test_loss: 1.2451, test_f1: 0.5983
 epoch: 89, train_loss: 0.4060, test_loss: 1.2217, test_f1: 0.5593
 epoch: 90, train_loss: 0.4692, test_loss: 1.2613, test_f1: 0.5744
 epoch: 91, train_loss: 0.4294, test_loss: 1.2281, test_f1: 0.6026
 epoch: 92, train_loss: 0.4112, test_loss: 1.1683, test_f1: 0.6105
 epoch: 93, train_loss: 0.4161, test_loss: 1.3680, test_f1: 0.5638
 epoch: 94, train_loss: 0.4052, test_loss: 1.1693, test_f1: 0.5903
 epoch: 95, train_loss: 0.3897, test_loss: 1.1387, test_f1: 0.6034
 epoch: 96, train_loss: 0.3974, test_loss: 1.2403, test_f1: 0.5889
 epoch: 97, train_loss: 0.3788, test_loss: 1.3285, test_f1: 0.5807
 epoch: 98, train_loss: 0.3812, test_loss: 1.1652, test_f1: 0.5846
 epoch: 99, train_loss: 0.5118, test_loss: 1.1534, test_f1: 0.5886
##################ITERATION #6 ****************************************
 epoch: 0, train_loss: 1.2678, test_loss: 1.0961, test_f1: 0.4534
 epoch: 1, train_loss: 1.1153, test_loss: 1.0477, test_f1: 0.4226
 epoch: 2, train_loss: 1.0606, test_loss: 1.0466, test_f1: 0.4755
 epoch: 3, train_loss: 1.0332, test_loss: 0.9827, test_f1: 0.4879
 epoch: 4, train_loss: 1.0038, test_loss: 1.0741, test_f1: 0.4614
 epoch: 5, train_loss: 1.0126, test_loss: 0.9816, test_f1: 0.4946
 epoch: 6, train_loss: 0.9784, test_loss: 0.9266, test_f1: 0.5166
 epoch: 7, train_loss: 0.9475, test_loss: 0.9306, test_f1: 0.5339
 epoch: 8, train_loss: 0.9403, test_loss: 0.9738, test_f1: 0.5165
 epoch: 9, train_loss: 0.9211, test_loss: 0.8997, test_f1: 0.5337
 epoch: 10, train_loss: 0.9223, test_loss: 1.0108, test_f1: 0.5176
 epoch: 11, train_loss: 0.8897, test_loss: 1.0226, test_f1: 0.5225
 epoch: 12, train_loss: 0.8756, test_loss: 0.9269, test_f1: 0.5606
 epoch: 13, train_loss: 0.8536, test_loss: 0.9899, test_f1: 0.5453
 epoch: 14, train_loss: 0.8489, test_loss: 1.0110, test_f1: 0.5484
 epoch: 15, train_loss: 0.8389, test_loss: 0.9802, test_f1: 0.5506
 epoch: 16, train_loss: 0.8423, test_loss: 1.0387, test_f1: 0.5547
 epoch: 17, train_loss: 0.8209, test_loss: 1.1326, test_f1: 0.4944
 epoch: 18, train_loss: 0.8193, test_loss: 0.9157, test_f1: 0.5692
 epoch: 19, train_loss: 0.8202, test_loss: 0.9625, test_f1: 0.5248
 epoch: 20, train_loss: 0.7910, test_loss: 0.9649, test_f1: 0.5603
 epoch: 21, train_loss: 0.7859, test_loss: 1.0015, test_f1: 0.5584
 epoch: 22, train_loss: 0.7819, test_loss: 0.9813, test_f1: 0.5601
 epoch: 23, train_loss: 0.7793, test_loss: 1.0734, test_f1: 0.5258
 epoch: 24, train_loss: 0.7887, test_loss: 1.0108, test_f1: 0.5433
 epoch: 25, train_loss: 0.7753, test_loss: 1.0090, test_f1: 0.5404
 epoch: 26, train_loss: 0.7468, test_loss: 1.0322, test_f1: 0.5309
 epoch: 27, train_loss: 0.7468, test_loss: 0.9575, test_f1: 0.5529
 epoch: 28, train_loss: 0.7469, test_loss: 0.9831, test_f1: 0.5588
 epoch: 29, train_loss: 0.7272, test_loss: 0.9769, test_f1: 0.5710
 epoch: 30, train_loss: 0.7239, test_loss: 1.0536, test_f1: 0.5328
 epoch: 31, train_loss: 0.7250, test_loss: 1.0823, test_f1: 0.5482
 epoch: 32, train_loss: 0.7059, test_loss: 1.0913, test_f1: 0.5345
 epoch: 33, train_loss: 0.6894, test_loss: 0.9883, test_f1: 0.5557
 epoch: 34, train_loss: 0.7190, test_loss: 0.9924, test_f1: 0.5706
 epoch: 35, train_loss: 0.7203, test_loss: 0.9542, test_f1: 0.5835
 epoch: 36, train_loss: 0.7127, test_loss: 1.0641, test_f1: 0.5590
 epoch: 37, train_loss: 0.6924, test_loss: 0.9905, test_f1: 0.5836
 epoch: 38, train_loss: 0.7082, test_loss: 1.0325, test_f1: 0.5565
 epoch: 39, train_loss: 0.7014, test_loss: 1.0932, test_f1: 0.5278
 epoch: 40, train_loss: 0.6820, test_loss: 0.9966, test_f1: 0.5407
 epoch: 41, train_loss: 0.6782, test_loss: 1.0118, test_f1: 0.5435
 epoch: 42, train_loss: 0.6806, test_loss: 1.0976, test_f1: 0.5690
 epoch: 43, train_loss: 0.6491, test_loss: 1.0831, test_f1: 0.5505
 epoch: 44, train_loss: 0.6552, test_loss: 1.2347, test_f1: 0.5281
 epoch: 45, train_loss: 0.6552, test_loss: 1.2007, test_f1: 0.5597
 epoch: 46, train_loss: 0.6460, test_loss: 1.1206, test_f1: 0.5554
 epoch: 47, train_loss: 0.6314, test_loss: 1.1452, test_f1: 0.5414
 epoch: 48, train_loss: 0.6149, test_loss: 1.0733, test_f1: 0.5479
 epoch: 49, train_loss: 0.6701, test_loss: 1.1614, test_f1: 0.5337
 epoch: 50, train_loss: 0.6480, test_loss: 1.1334, test_f1: 0.5365
 epoch: 51, train_loss: 0.5948, test_loss: 1.1013, test_f1: 0.5497
 epoch: 52, train_loss: 0.5938, test_loss: 1.1343, test_f1: 0.5702
 epoch: 53, train_loss: 0.5702, test_loss: 1.1585, test_f1: 0.5473
 epoch: 54, train_loss: 0.5636, test_loss: 1.1998, test_f1: 0.5503
 epoch: 55, train_loss: 0.5446, test_loss: 1.1762, test_f1: 0.5374
 epoch: 56, train_loss: 0.5812, test_loss: 1.1438, test_f1: 0.5579
 epoch: 57, train_loss: 0.5434, test_loss: 1.1964, test_f1: 0.5187
 epoch: 58, train_loss: 0.5264, test_loss: 1.1988, test_f1: 0.5601
 epoch: 59, train_loss: 0.5240, test_loss: 1.2365, test_f1: 0.5404
 epoch: 60, train_loss: 0.5071, test_loss: 1.1998, test_f1: 0.5489
 epoch: 61, train_loss: 0.4937, test_loss: 1.2149, test_f1: 0.5522
 epoch: 62, train_loss: 0.5057, test_loss: 1.2374, test_f1: 0.5365
 epoch: 63, train_loss: 0.5016, test_loss: 1.1929, test_f1: 0.5702
 epoch: 64, train_loss: 0.4945, test_loss: 1.2502, test_f1: 0.5338
 epoch: 65, train_loss: 0.4998, test_loss: 1.1474, test_f1: 0.5803
 epoch: 66, train_loss: 0.4874, test_loss: 1.2186, test_f1: 0.5510
 epoch: 67, train_loss: 0.4726, test_loss: 1.2164, test_f1: 0.5750
 epoch: 68, train_loss: 0.4988, test_loss: 1.2538, test_f1: 0.5518
 epoch: 69, train_loss: 0.4621, test_loss: 1.2850, test_f1: 0.5430
 epoch: 70, train_loss: 0.4755, test_loss: 1.2442, test_f1: 0.5343
 epoch: 71, train_loss: 0.4727, test_loss: 1.2713, test_f1: 0.5439
 epoch: 72, train_loss: 0.4711, test_loss: 1.2345, test_f1: 0.5532
 epoch: 73, train_loss: 0.4538, test_loss: 1.2415, test_f1: 0.5645
 epoch: 74, train_loss: 0.4393, test_loss: 1.3269, test_f1: 0.5533
 epoch: 75, train_loss: 0.4318, test_loss: 1.4452, test_f1: 0.5478
 epoch: 76, train_loss: 0.4424, test_loss: 1.2606, test_f1: 0.5603
 epoch: 77, train_loss: 0.4644, test_loss: 1.3013, test_f1: 0.5665
 epoch: 78, train_loss: 0.4277, test_loss: 1.4874, test_f1: 0.5288
 epoch: 79, train_loss: 0.4490, test_loss: 1.2466, test_f1: 0.5565
 epoch: 80, train_loss: 0.4344, test_loss: 1.2468, test_f1: 0.5768
 epoch: 81, train_loss: 0.4225, test_loss: 1.3096, test_f1: 0.5525
 epoch: 82, train_loss: 0.4401, test_loss: 1.3045, test_f1: 0.5357
 epoch: 83, train_loss: 0.4157, test_loss: 1.4230, test_f1: 0.5575
 epoch: 84, train_loss: 0.4225, test_loss: 1.2821, test_f1: 0.5602
 epoch: 85, train_loss: 0.4151, test_loss: 1.3196, test_f1: 0.5420
 epoch: 86, train_loss: 0.4074, test_loss: 1.3479, test_f1: 0.5732
 epoch: 87, train_loss: 0.4390, test_loss: 1.4139, test_f1: 0.5459
 epoch: 88, train_loss: 0.4163, test_loss: 1.4634, test_f1: 0.5168
 epoch: 89, train_loss: 0.4134, test_loss: 1.3174, test_f1: 0.5821
 epoch: 90, train_loss: 0.3933, test_loss: 1.3177, test_f1: 0.5546
 epoch: 91, train_loss: 0.3782, test_loss: 1.3864, test_f1: 0.5420
 epoch: 92, train_loss: 0.3873, test_loss: 1.3964, test_f1: 0.5651
 epoch: 93, train_loss: 0.3831, test_loss: 1.4517, test_f1: 0.5422
 epoch: 94, train_loss: 0.3807, test_loss: 1.4376, test_f1: 0.5673
 epoch: 95, train_loss: 0.3729, test_loss: 1.6513, test_f1: 0.5398
 epoch: 96, train_loss: 0.3950, test_loss: 1.4377, test_f1: 0.5409
 epoch: 97, train_loss: 0.4123, test_loss: 1.5049, test_f1: 0.5375
 epoch: 98, train_loss: 0.4103, test_loss: 1.3835, test_f1: 0.5508
 epoch: 99, train_loss: 0.3808, test_loss: 1.6090, test_f1: 0.5171
##################ITERATION #7 ****************************************
 epoch: 0, train_loss: 1.3026, test_loss: 1.2141, test_f1: 0.3629
 epoch: 1, train_loss: 1.1475, test_loss: 1.1087, test_f1: 0.4442
 epoch: 2, train_loss: 1.1074, test_loss: 1.0633, test_f1: 0.4211
 epoch: 3, train_loss: 1.0773, test_loss: 1.0331, test_f1: 0.4417
 epoch: 4, train_loss: 1.0477, test_loss: 1.0011, test_f1: 0.4549
 epoch: 5, train_loss: 1.0249, test_loss: 1.0184, test_f1: 0.4689
 epoch: 6, train_loss: 0.9944, test_loss: 1.0176, test_f1: 0.5039
 epoch: 7, train_loss: 0.9816, test_loss: 0.9706, test_f1: 0.4932
 epoch: 8, train_loss: 0.9667, test_loss: 0.9501, test_f1: 0.5267
 epoch: 9, train_loss: 0.9458, test_loss: 1.0087, test_f1: 0.4838
 epoch: 10, train_loss: 0.9305, test_loss: 0.9923, test_f1: 0.4968
 epoch: 11, train_loss: 0.9265, test_loss: 0.9226, test_f1: 0.5220
 epoch: 12, train_loss: 0.8892, test_loss: 0.9733, test_f1: 0.5043
 epoch: 13, train_loss: 0.8708, test_loss: 1.1340, test_f1: 0.4793
 epoch: 14, train_loss: 0.8800, test_loss: 1.0108, test_f1: 0.5533
 epoch: 15, train_loss: 0.8656, test_loss: 1.0062, test_f1: 0.5559
 epoch: 16, train_loss: 0.8530, test_loss: 0.9974, test_f1: 0.5113
 epoch: 17, train_loss: 0.9076, test_loss: 0.9765, test_f1: 0.5406
 epoch: 18, train_loss: 0.8717, test_loss: 0.9554, test_f1: 0.5082
 epoch: 19, train_loss: 0.8444, test_loss: 0.9310, test_f1: 0.5440
 epoch: 20, train_loss: 0.8196, test_loss: 1.0316, test_f1: 0.5741
 epoch: 21, train_loss: 0.8250, test_loss: 1.0626, test_f1: 0.5883
 epoch: 22, train_loss: 0.7917, test_loss: 1.0510, test_f1: 0.5693
 epoch: 23, train_loss: 0.8058, test_loss: 1.0601, test_f1: 0.5655
 epoch: 24, train_loss: 0.8326, test_loss: 1.0203, test_f1: 0.5423
 epoch: 25, train_loss: 0.8415, test_loss: 1.0434, test_f1: 0.5566
 epoch: 26, train_loss: 0.8087, test_loss: 1.1543, test_f1: 0.5615
 epoch: 27, train_loss: 0.7895, test_loss: 1.0896, test_f1: 0.5575
 epoch: 28, train_loss: 0.8104, test_loss: 1.0049, test_f1: 0.5498
 epoch: 29, train_loss: 0.7648, test_loss: 1.0513, test_f1: 0.5687
 epoch: 30, train_loss: 0.7505, test_loss: 1.1035, test_f1: 0.5480
 epoch: 31, train_loss: 0.7463, test_loss: 1.0366, test_f1: 0.5712
 epoch: 32, train_loss: 0.7362, test_loss: 1.0746, test_f1: 0.5470
 epoch: 33, train_loss: 0.7478, test_loss: 1.0468, test_f1: 0.5633
 epoch: 34, train_loss: 0.7235, test_loss: 1.0075, test_f1: 0.5671
 epoch: 35, train_loss: 0.7481, test_loss: 1.0144, test_f1: 0.5689
 epoch: 36, train_loss: 0.7084, test_loss: 1.0522, test_f1: 0.5803
 epoch: 37, train_loss: 0.7022, test_loss: 0.9806, test_f1: 0.5577
 epoch: 38, train_loss: 0.7138, test_loss: 0.9726, test_f1: 0.5445
 epoch: 39, train_loss: 0.6866, test_loss: 1.0262, test_f1: 0.5887
 epoch: 40, train_loss: 0.7019, test_loss: 0.9666, test_f1: 0.5596
 epoch: 41, train_loss: 0.6937, test_loss: 1.1245, test_f1: 0.5727
 epoch: 42, train_loss: 0.6736, test_loss: 1.1103, test_f1: 0.5892
 epoch: 43, train_loss: 0.6580, test_loss: 1.1511, test_f1: 0.5483
 epoch: 44, train_loss: 0.6768, test_loss: 1.1254, test_f1: 0.5558
 epoch: 45, train_loss: 0.6438, test_loss: 1.1245, test_f1: 0.5480
 epoch: 46, train_loss: 0.6433, test_loss: 1.0971, test_f1: 0.5899
 epoch: 47, train_loss: 0.6869, test_loss: 1.0567, test_f1: 0.5643
 epoch: 48, train_loss: 0.6594, test_loss: 1.0509, test_f1: 0.5506
 epoch: 49, train_loss: 0.6467, test_loss: 0.9818, test_f1: 0.5705
 epoch: 50, train_loss: 0.6219, test_loss: 1.1655, test_f1: 0.5362
 epoch: 51, train_loss: 0.5979, test_loss: 1.1036, test_f1: 0.5676
 epoch: 52, train_loss: 0.5553, test_loss: 1.1651, test_f1: 0.5542
 epoch: 53, train_loss: 0.5630, test_loss: 1.1184, test_f1: 0.5664
 epoch: 54, train_loss: 0.5480, test_loss: 1.2043, test_f1: 0.5487
 epoch: 55, train_loss: 0.5608, test_loss: 1.1658, test_f1: 0.5525
 epoch: 56, train_loss: 0.5410, test_loss: 1.1459, test_f1: 0.5595
 epoch: 57, train_loss: 0.5415, test_loss: 1.0947, test_f1: 0.5660
 epoch: 58, train_loss: 0.5399, test_loss: 1.2166, test_f1: 0.5379
 epoch: 59, train_loss: 0.5135, test_loss: 1.2358, test_f1: 0.5598
 epoch: 60, train_loss: 0.5112, test_loss: 1.3632, test_f1: 0.5462
 epoch: 61, train_loss: 0.5278, test_loss: 1.1931, test_f1: 0.5551
 epoch: 62, train_loss: 0.5090, test_loss: 1.2104, test_f1: 0.5505
 epoch: 63, train_loss: 0.5130, test_loss: 1.2580, test_f1: 0.5631
 epoch: 64, train_loss: 0.5207, test_loss: 1.2635, test_f1: 0.5579
 epoch: 65, train_loss: 0.5351, test_loss: 1.2198, test_f1: 0.5455
 epoch: 66, train_loss: 0.4960, test_loss: 1.3224, test_f1: 0.5516
 epoch: 67, train_loss: 0.4755, test_loss: 1.2834, test_f1: 0.5481
 epoch: 68, train_loss: 0.4646, test_loss: 1.2995, test_f1: 0.5793
 epoch: 69, train_loss: 0.4863, test_loss: 1.3802, test_f1: 0.5366
 epoch: 70, train_loss: 0.4789, test_loss: 1.3720, test_f1: 0.5714
 epoch: 71, train_loss: 0.4800, test_loss: 1.3593, test_f1: 0.5532
 epoch: 72, train_loss: 0.4713, test_loss: 1.3944, test_f1: 0.5371
 epoch: 73, train_loss: 0.4426, test_loss: 1.4535, test_f1: 0.5442
 epoch: 74, train_loss: 0.4584, test_loss: 1.4055, test_f1: 0.5521
 epoch: 75, train_loss: 0.4797, test_loss: 1.3206, test_f1: 0.5441
 epoch: 76, train_loss: 0.4838, test_loss: 1.3446, test_f1: 0.5780
 epoch: 77, train_loss: 0.5038, test_loss: 1.3580, test_f1: 0.5581
 epoch: 78, train_loss: 0.4550, test_loss: 1.3833, test_f1: 0.5834
 epoch: 79, train_loss: 0.4478, test_loss: 1.3507, test_f1: 0.5582
 epoch: 80, train_loss: 0.4352, test_loss: 1.4239, test_f1: 0.5778
 epoch: 81, train_loss: 0.4278, test_loss: 1.3891, test_f1: 0.5598
 epoch: 82, train_loss: 0.4200, test_loss: 1.4520, test_f1: 0.5464
 epoch: 83, train_loss: 0.4224, test_loss: 1.3849, test_f1: 0.5605
 epoch: 84, train_loss: 0.4095, test_loss: 1.3901, test_f1: 0.5626
 epoch: 85, train_loss: 0.4063, test_loss: 1.3943, test_f1: 0.5605
 epoch: 86, train_loss: 0.4090, test_loss: 1.3778, test_f1: 0.5442
 epoch: 87, train_loss: 0.4142, test_loss: 1.4503, test_f1: 0.5471
 epoch: 88, train_loss: 0.4021, test_loss: 1.3939, test_f1: 0.5736
 epoch: 89, train_loss: 0.3982, test_loss: 1.4536, test_f1: 0.5525
 epoch: 90, train_loss: 0.4137, test_loss: 1.3698, test_f1: 0.5748
 epoch: 91, train_loss: 0.4099, test_loss: 1.3913, test_f1: 0.5775
 epoch: 92, train_loss: 0.4221, test_loss: 1.4860, test_f1: 0.5410
 epoch: 93, train_loss: 0.4019, test_loss: 1.5139, test_f1: 0.5664
 epoch: 94, train_loss: 0.3821, test_loss: 1.4465, test_f1: 0.5537
 epoch: 95, train_loss: 0.3920, test_loss: 1.4639, test_f1: 0.5389
 epoch: 96, train_loss: 0.3758, test_loss: 1.5170, test_f1: 0.5639
 epoch: 97, train_loss: 0.3839, test_loss: 1.5483, test_f1: 0.5448
 epoch: 98, train_loss: 0.4019, test_loss: 1.4911, test_f1: 0.5530
 epoch: 99, train_loss: 0.3775, test_loss: 1.4983, test_f1: 0.5502
##################ITERATION #8 ****************************************
 epoch: 0, train_loss: 1.2815, test_loss: 1.1301, test_f1: 0.3883
 epoch: 1, train_loss: 1.1227, test_loss: 1.0365, test_f1: 0.4332
 epoch: 2, train_loss: 1.0759, test_loss: 1.0100, test_f1: 0.4695
 epoch: 3, train_loss: 1.0409, test_loss: 1.0192, test_f1: 0.4747
 epoch: 4, train_loss: 1.0296, test_loss: 0.9941, test_f1: 0.4894
 epoch: 5, train_loss: 0.9993, test_loss: 0.9735, test_f1: 0.4705
 epoch: 6, train_loss: 0.9892, test_loss: 1.0293, test_f1: 0.4887
 epoch: 7, train_loss: 0.9819, test_loss: 1.0744, test_f1: 0.4706
 epoch: 8, train_loss: 0.9661, test_loss: 1.0020, test_f1: 0.4831
 epoch: 9, train_loss: 0.9490, test_loss: 1.0807, test_f1: 0.4913
 epoch: 10, train_loss: 0.9402, test_loss: 1.0410, test_f1: 0.5063
 epoch: 11, train_loss: 0.9361, test_loss: 0.9790, test_f1: 0.5080
 epoch: 12, train_loss: 0.9396, test_loss: 0.9471, test_f1: 0.5115
 epoch: 13, train_loss: 0.9276, test_loss: 0.9511, test_f1: 0.5302
 epoch: 14, train_loss: 0.9101, test_loss: 1.0814, test_f1: 0.4788
 epoch: 15, train_loss: 0.8811, test_loss: 0.9943, test_f1: 0.5479
 epoch: 16, train_loss: 0.8590, test_loss: 1.0565, test_f1: 0.5279
 epoch: 17, train_loss: 0.8607, test_loss: 1.0181, test_f1: 0.5596
 epoch: 18, train_loss: 0.8381, test_loss: 0.9881, test_f1: 0.5509
 epoch: 19, train_loss: 0.8617, test_loss: 0.9911, test_f1: 0.5411
 epoch: 20, train_loss: 0.8647, test_loss: 1.0192, test_f1: 0.5583
 epoch: 21, train_loss: 0.8300, test_loss: 1.0192, test_f1: 0.5352
 epoch: 22, train_loss: 0.8173, test_loss: 1.0909, test_f1: 0.5342
 epoch: 23, train_loss: 0.8147, test_loss: 1.0775, test_f1: 0.5421
 epoch: 24, train_loss: 0.7971, test_loss: 1.1174, test_f1: 0.5336
 epoch: 25, train_loss: 0.8010, test_loss: 1.0621, test_f1: 0.5402
 epoch: 26, train_loss: 0.7851, test_loss: 1.1173, test_f1: 0.5616
 epoch: 27, train_loss: 0.7651, test_loss: 1.0882, test_f1: 0.5416
 epoch: 28, train_loss: 0.8019, test_loss: 0.9898, test_f1: 0.5489
 epoch: 29, train_loss: 0.7628, test_loss: 1.0957, test_f1: 0.5616
 epoch: 30, train_loss: 0.7553, test_loss: 1.0406, test_f1: 0.5412
 epoch: 31, train_loss: 0.7477, test_loss: 1.0440, test_f1: 0.5606
 epoch: 32, train_loss: 0.7396, test_loss: 1.0718, test_f1: 0.5581
 epoch: 33, train_loss: 0.7569, test_loss: 1.0917, test_f1: 0.5490
 epoch: 34, train_loss: 0.7153, test_loss: 1.0369, test_f1: 0.5684
 epoch: 35, train_loss: 0.7124, test_loss: 1.0513, test_f1: 0.5770
 epoch: 36, train_loss: 0.7070, test_loss: 1.0789, test_f1: 0.5706
 epoch: 37, train_loss: 0.7004, test_loss: 1.1035, test_f1: 0.5697
 epoch: 38, train_loss: 0.7062, test_loss: 1.1428, test_f1: 0.5625
 epoch: 39, train_loss: 0.7353, test_loss: 1.0672, test_f1: 0.5694
 epoch: 40, train_loss: 0.7109, test_loss: 1.1543, test_f1: 0.5373
 epoch: 41, train_loss: 0.6885, test_loss: 1.0580, test_f1: 0.5581
 epoch: 42, train_loss: 0.6693, test_loss: 1.0116, test_f1: 0.5678
 epoch: 43, train_loss: 0.6763, test_loss: 1.0642, test_f1: 0.5732
 epoch: 44, train_loss: 0.6547, test_loss: 1.0696, test_f1: 0.5291
 epoch: 45, train_loss: 0.6618, test_loss: 0.9972, test_f1: 0.5414
 epoch: 46, train_loss: 0.6323, test_loss: 1.0925, test_f1: 0.5604
 epoch: 47, train_loss: 0.6515, test_loss: 1.0727, test_f1: 0.5558
 epoch: 48, train_loss: 0.6863, test_loss: 1.0476, test_f1: 0.5758
 epoch: 49, train_loss: 0.6396, test_loss: 1.0305, test_f1: 0.5531
 epoch: 50, train_loss: 0.6350, test_loss: 1.0901, test_f1: 0.5849
 epoch: 51, train_loss: 0.6029, test_loss: 1.0596, test_f1: 0.5607
 epoch: 52, train_loss: 0.5687, test_loss: 1.1958, test_f1: 0.5564
 epoch: 53, train_loss: 0.5669, test_loss: 1.1151, test_f1: 0.5909
 epoch: 54, train_loss: 0.5520, test_loss: 1.1296, test_f1: 0.5857
 epoch: 55, train_loss: 0.5496, test_loss: 1.1715, test_f1: 0.5658
 epoch: 56, train_loss: 0.5616, test_loss: 1.1358, test_f1: 0.5624
 epoch: 57, train_loss: 0.5217, test_loss: 1.1575, test_f1: 0.5628
 epoch: 58, train_loss: 0.5375, test_loss: 1.2389, test_f1: 0.5398
 epoch: 59, train_loss: 0.5258, test_loss: 1.1322, test_f1: 0.5619
 epoch: 60, train_loss: 0.5229, test_loss: 1.2095, test_f1: 0.5958
 epoch: 61, train_loss: 0.5137, test_loss: 1.2735, test_f1: 0.5499
 epoch: 62, train_loss: 0.5243, test_loss: 1.2005, test_f1: 0.5778
 epoch: 63, train_loss: 0.5056, test_loss: 1.2278, test_f1: 0.5604
 epoch: 64, train_loss: 0.5120, test_loss: 1.1877, test_f1: 0.5838
 epoch: 65, train_loss: 0.5021, test_loss: 1.2676, test_f1: 0.5676
 epoch: 66, train_loss: 0.5212, test_loss: 1.2215, test_f1: 0.5625
 epoch: 67, train_loss: 0.4858, test_loss: 1.2237, test_f1: 0.5624
 epoch: 68, train_loss: 0.4916, test_loss: 1.2903, test_f1: 0.5777
 epoch: 69, train_loss: 0.4717, test_loss: 1.2604, test_f1: 0.5789
 epoch: 70, train_loss: 0.5039, test_loss: 1.2826, test_f1: 0.5735
 epoch: 71, train_loss: 0.4856, test_loss: 1.3243, test_f1: 0.5601
 epoch: 72, train_loss: 0.4722, test_loss: 1.2941, test_f1: 0.5482
 epoch: 73, train_loss: 0.4665, test_loss: 1.2452, test_f1: 0.5706
 epoch: 74, train_loss: 0.4781, test_loss: 1.2467, test_f1: 0.5603
 epoch: 75, train_loss: 0.4678, test_loss: 1.2374, test_f1: 0.5711
 epoch: 76, train_loss: 0.4693, test_loss: 1.2583, test_f1: 0.5831
 epoch: 77, train_loss: 0.5023, test_loss: 1.2132, test_f1: 0.5671
 epoch: 78, train_loss: 0.5052, test_loss: 1.1583, test_f1: 0.5612
 epoch: 79, train_loss: 0.4598, test_loss: 1.1950, test_f1: 0.5914
 epoch: 80, train_loss: 0.4529, test_loss: 1.3137, test_f1: 0.5718
 epoch: 81, train_loss: 0.4550, test_loss: 1.2559, test_f1: 0.5653
 epoch: 82, train_loss: 0.4527, test_loss: 1.2484, test_f1: 0.5713
 epoch: 83, train_loss: 0.4379, test_loss: 1.2495, test_f1: 0.5796
 epoch: 84, train_loss: 0.4366, test_loss: 1.3613, test_f1: 0.5704
 epoch: 85, train_loss: 0.4532, test_loss: 1.3377, test_f1: 0.5783
 epoch: 86, train_loss: 0.4268, test_loss: 1.4028, test_f1: 0.5348
 epoch: 87, train_loss: 0.4240, test_loss: 1.1669, test_f1: 0.5912
 epoch: 88, train_loss: 0.4308, test_loss: 1.1955, test_f1: 0.5712
 epoch: 89, train_loss: 0.4288, test_loss: 1.2481, test_f1: 0.5759
 epoch: 90, train_loss: 0.4160, test_loss: 1.3136, test_f1: 0.5437
 epoch: 91, train_loss: 0.4551, test_loss: 1.3298, test_f1: 0.5829
 epoch: 92, train_loss: 0.4213, test_loss: 1.3846, test_f1: 0.5634
 epoch: 93, train_loss: 0.4316, test_loss: 1.2820, test_f1: 0.5482
 epoch: 94, train_loss: 0.3891, test_loss: 1.3564, test_f1: 0.5715
 epoch: 95, train_loss: 0.4247, test_loss: 1.3141, test_f1: 0.5510
 epoch: 96, train_loss: 0.3941, test_loss: 1.3191, test_f1: 0.5445
 epoch: 97, train_loss: 0.3911, test_loss: 1.4728, test_f1: 0.5407
 epoch: 98, train_loss: 0.4056, test_loss: 1.3549, test_f1: 0.5654
 epoch: 99, train_loss: 0.4083, test_loss: 1.3877, test_f1: 0.5555
##################ITERATION #9 ****************************************
 epoch: 0, train_loss: 1.2996, test_loss: 1.1397, test_f1: 0.4194
 epoch: 1, train_loss: 1.1133, test_loss: 0.9868, test_f1: 0.4700
 epoch: 2, train_loss: 1.0529, test_loss: 1.0437, test_f1: 0.4355
 epoch: 3, train_loss: 1.0195, test_loss: 0.9701, test_f1: 0.5289
 epoch: 4, train_loss: 1.0103, test_loss: 1.0226, test_f1: 0.4379
 epoch: 5, train_loss: 0.9749, test_loss: 0.9818, test_f1: 0.4932
 epoch: 6, train_loss: 0.9534, test_loss: 0.9938, test_f1: 0.4917
 epoch: 7, train_loss: 0.9440, test_loss: 0.9540, test_f1: 0.4979
 epoch: 8, train_loss: 0.9291, test_loss: 0.9856, test_f1: 0.4828
 epoch: 9, train_loss: 0.9087, test_loss: 0.9888, test_f1: 0.5236
 epoch: 10, train_loss: 0.9138, test_loss: 1.0386, test_f1: 0.4629
 epoch: 11, train_loss: 0.8908, test_loss: 1.0063, test_f1: 0.4683
 epoch: 12, train_loss: 0.9039, test_loss: 1.1425, test_f1: 0.4736
 epoch: 13, train_loss: 0.8842, test_loss: 0.9865, test_f1: 0.5149
 epoch: 14, train_loss: 0.8603, test_loss: 1.0627, test_f1: 0.5296
 epoch: 15, train_loss: 0.8516, test_loss: 1.0304, test_f1: 0.5195
 epoch: 16, train_loss: 0.8422, test_loss: 1.0558, test_f1: 0.5035
 epoch: 17, train_loss: 0.8207, test_loss: 1.1452, test_f1: 0.5204
 epoch: 18, train_loss: 0.8296, test_loss: 1.1346, test_f1: 0.5003
 epoch: 19, train_loss: 0.8224, test_loss: 1.0575, test_f1: 0.5791
 epoch: 20, train_loss: 0.8011, test_loss: 1.0227, test_f1: 0.5273
 epoch: 21, train_loss: 0.8130, test_loss: 1.0761, test_f1: 0.5416
 epoch: 22, train_loss: 0.7850, test_loss: 1.0697, test_f1: 0.5572
 epoch: 23, train_loss: 0.7785, test_loss: 1.1593, test_f1: 0.5448
 epoch: 24, train_loss: 0.7711, test_loss: 1.0950, test_f1: 0.5339
 epoch: 25, train_loss: 0.7573, test_loss: 1.0242, test_f1: 0.5645
 epoch: 26, train_loss: 0.7550, test_loss: 1.2166, test_f1: 0.5238
 epoch: 27, train_loss: 0.7592, test_loss: 1.1239, test_f1: 0.5677
 epoch: 28, train_loss: 0.7623, test_loss: 1.0349, test_f1: 0.5331
 epoch: 29, train_loss: 0.7295, test_loss: 1.0208, test_f1: 0.5328
 epoch: 30, train_loss: 0.7093, test_loss: 1.1334, test_f1: 0.5456
 epoch: 31, train_loss: 0.7270, test_loss: 1.0992, test_f1: 0.5776
 epoch: 32, train_loss: 0.7062, test_loss: 1.2118, test_f1: 0.5615
 epoch: 33, train_loss: 0.6943, test_loss: 1.1234, test_f1: 0.5546
 epoch: 34, train_loss: 0.6918, test_loss: 1.2075, test_f1: 0.5610
 epoch: 35, train_loss: 0.7071, test_loss: 1.0936, test_f1: 0.5741
 epoch: 36, train_loss: 0.6658, test_loss: 1.1246, test_f1: 0.5453
 epoch: 37, train_loss: 0.6577, test_loss: 1.1156, test_f1: 0.5431
 epoch: 38, train_loss: 0.6685, test_loss: 1.1417, test_f1: 0.5813
 epoch: 39, train_loss: 0.6613, test_loss: 1.1455, test_f1: 0.5498
 epoch: 40, train_loss: 0.6702, test_loss: 1.1335, test_f1: 0.5621
 epoch: 41, train_loss: 0.6789, test_loss: 1.0661, test_f1: 0.5619
 epoch: 42, train_loss: 0.6534, test_loss: 1.1797, test_f1: 0.5332
 epoch: 43, train_loss: 0.6705, test_loss: 1.0766, test_f1: 0.5651
 epoch: 44, train_loss: 0.6695, test_loss: 1.1489, test_f1: 0.5356
 epoch: 45, train_loss: 0.6448, test_loss: 1.1148, test_f1: 0.5849
 epoch: 46, train_loss: 0.6105, test_loss: 1.2002, test_f1: 0.5655
 epoch: 47, train_loss: 0.6359, test_loss: 1.1542, test_f1: 0.5732
 epoch: 48, train_loss: 0.6307, test_loss: 1.1161, test_f1: 0.5864
 epoch: 49, train_loss: 0.6359, test_loss: 1.1334, test_f1: 0.5468
 epoch: 50, train_loss: 0.6042, test_loss: 1.1916, test_f1: 0.5467
 epoch: 51, train_loss: 0.5830, test_loss: 1.2003, test_f1: 0.5678
 epoch: 52, train_loss: 0.5808, test_loss: 1.1717, test_f1: 0.6077
 epoch: 53, train_loss: 0.5411, test_loss: 1.2217, test_f1: 0.5675
 epoch: 54, train_loss: 0.5549, test_loss: 1.2543, test_f1: 0.5789
 epoch: 55, train_loss: 0.5475, test_loss: 1.1879, test_f1: 0.5867
 epoch: 56, train_loss: 0.5203, test_loss: 1.2535, test_f1: 0.5670
 epoch: 57, train_loss: 0.5252, test_loss: 1.2394, test_f1: 0.5664
 epoch: 58, train_loss: 0.5338, test_loss: 1.2381, test_f1: 0.5868
 epoch: 59, train_loss: 0.5226, test_loss: 1.2380, test_f1: 0.5693
 epoch: 60, train_loss: 0.5204, test_loss: 1.2939, test_f1: 0.6044
 epoch: 61, train_loss: 0.4744, test_loss: 1.3053, test_f1: 0.5997
 epoch: 62, train_loss: 0.4775, test_loss: 1.3065, test_f1: 0.6006
 epoch: 63, train_loss: 0.4815, test_loss: 1.3063, test_f1: 0.5728
 epoch: 64, train_loss: 0.4960, test_loss: 1.3590, test_f1: 0.5678
 epoch: 65, train_loss: 0.4758, test_loss: 1.3651, test_f1: 0.5915
 epoch: 66, train_loss: 0.4834, test_loss: 1.3754, test_f1: 0.5858
 epoch: 67, train_loss: 0.4789, test_loss: 1.3321, test_f1: 0.5779
 epoch: 68, train_loss: 0.4593, test_loss: 1.3474, test_f1: 0.5953
 epoch: 69, train_loss: 0.4727, test_loss: 1.3533, test_f1: 0.5986
 epoch: 70, train_loss: 0.4494, test_loss: 1.3130, test_f1: 0.5929
 epoch: 71, train_loss: 0.4380, test_loss: 1.4146, test_f1: 0.5793
 epoch: 72, train_loss: 0.4447, test_loss: 1.4135, test_f1: 0.5898
 epoch: 73, train_loss: 0.4419, test_loss: 1.3514, test_f1: 0.5955
 epoch: 74, train_loss: 0.4426, test_loss: 1.4059, test_f1: 0.5716
 epoch: 75, train_loss: 0.4404, test_loss: 1.4209, test_f1: 0.5708
 epoch: 76, train_loss: 0.4397, test_loss: 1.3790, test_f1: 0.5820
 epoch: 77, train_loss: 0.4402, test_loss: 1.4219, test_f1: 0.5439
 epoch: 78, train_loss: 0.4326, test_loss: 1.3762, test_f1: 0.5636
 epoch: 79, train_loss: 0.4345, test_loss: 1.3814, test_f1: 0.5660
 epoch: 80, train_loss: 0.4342, test_loss: 1.4102, test_f1: 0.5849
 epoch: 81, train_loss: 0.4242, test_loss: 1.5113, test_f1: 0.5658
 epoch: 82, train_loss: 0.4246, test_loss: 1.5339, test_f1: 0.5691
 epoch: 83, train_loss: 0.4223, test_loss: 1.3848, test_f1: 0.5542
 epoch: 84, train_loss: 0.4201, test_loss: 1.4003, test_f1: 0.5858
 epoch: 85, train_loss: 0.4084, test_loss: 1.4337, test_f1: 0.5711
 epoch: 86, train_loss: 0.4329, test_loss: 1.4938, test_f1: 0.5231
 epoch: 87, train_loss: 0.4209, test_loss: 1.4825, test_f1: 0.5430
 epoch: 88, train_loss: 0.4179, test_loss: 1.3875, test_f1: 0.5818
 epoch: 89, train_loss: 0.3974, test_loss: 1.3887, test_f1: 0.5921
 epoch: 90, train_loss: 0.3914, test_loss: 1.4483, test_f1: 0.5814
 epoch: 91, train_loss: 0.3920, test_loss: 1.5477, test_f1: 0.5594
 epoch: 92, train_loss: 0.3867, test_loss: 1.5617, test_f1: 0.5628
 epoch: 93, train_loss: 0.3992, test_loss: 1.4523, test_f1: 0.5828
 epoch: 94, train_loss: 0.3611, test_loss: 1.5503, test_f1: 0.5741
 epoch: 95, train_loss: 0.3861, test_loss: 1.5689, test_f1: 0.5672
 epoch: 96, train_loss: 0.3917, test_loss: 1.5243, test_f1: 0.5755
 epoch: 97, train_loss: 0.3718, test_loss: 1.4978, test_f1: 0.5908
 epoch: 98, train_loss: 0.4013, test_loss: 1.4879, test_f1: 0.5862
 epoch: 99, train_loss: 0.3492, test_loss: 1.5165, test_f1: 0.5849

Training completed in 939.66 seconds
Best F1: 0.6138 at epoch 50
Mean F1 across iterations: 0.5961  0.0098
========================FINAL RESULTS================================
FEGIN weighted F1: 0.6138  0.0098
python main.py --data ltspice_examples --representation component_component --model FEGIN --layers 3 --hiddens 128 --batch_size 32 --lr 0.001 --emb_size 512 --epochs 100 --save_appendix component_component_L3_H128_BS32_LR0.001_E512 --no_val
-----



STDERR:
  File "main.py", line 370, in <module>
    main()
  File "main.py", line 254, in main
    dataset = dataset_class(
  File "/home/philip/projects/ltspice_examples_code_repo/Circuit-Completion-Using-GNNs/component_classification_with_link_prediction_head/evaluation/FEGIN/kernel/circuit_datasets.py", line 15, in __init__
    self.data, self.slices = torch.load(self.processed_paths[0])
  File "/home/philip/.local/lib/python3.8/site-packages/torch/serialization.py", line 1040, in load
    warnings.warn(
  File "/usr/lib/python3.8/warnings.py", line 109, in _showwarnmsg
    sw(msg.message, msg.category, msg.filename, msg.lineno,
  File "main.py", line 47, in warn_with_traceback
    traceback.print_stack(file=log)
/home/philip/projects/ltspice_examples_code_repo/Circuit-Completion-Using-GNNs/component_classification_with_link_prediction_head/evaluation/FEGIN/kernel/circuit_datasets.py:15: FutureWarning: You are using `torch.load` with `weights_only=False` (the current default value), which uses the default pickle module implicitly. It is possible to construct malicious pickle data which will execute arbitrary code during unpickling (See https://github.com/pytorch/pytorch/blob/main/SECURITY.md#untrusted-models for more details). In a future release, the default value for `weights_only` will be flipped to `True`. This limits the functions that could be executed during unpickling. Arbitrary objects will no longer be allowed to be loaded via this mode unless they are explicitly allowlisted by the user via `torch.serialization.add_safe_globals`. We recommend you start setting `weights_only=True` for any use case where you don't have full control of the loaded file. Please open an issue on GitHub for any issues related to this experimental feature.
  self.data, self.slices = torch.load(self.processed_paths[0])
