STDOUT:
Results will be saved in /home/philip/projects/ltspice_examples_code_repo/Circuit-Completion-Using-GNNs/component_classification_with_link_prediction_head/evaluation/FEGIN/results/model_FEGIN_dataset_ltspice_examples
Command line input: python main.py --data ltspice_examples --representation component_component --model FEGIN --layers 6 --hiddens 64 --batch_size 64 --lr 0.001 --emb_size 512 --epochs 100 --save_appendix component_component_L6_H64_BS64_LR0.001_E512 --no_val
 is saved.
-----
ltspice_examples - FEGIN
Using 6 layers, 64 hidden units, h = 2
Loading component_component representation dataset
ENTERED
Training FEGIN on component_component representation
Train: 3556, Test: 845
##################ITERATION #0 ****************************************
 epoch: 0, train_loss: 1.2808, test_loss: 1.2101, test_f1: 0.2895
 epoch: 1, train_loss: 1.1963, test_loss: 1.1416, test_f1: 0.3685
 epoch: 2, train_loss: 1.1337, test_loss: 1.0897, test_f1: 0.4280
 epoch: 3, train_loss: 1.1075, test_loss: 1.0503, test_f1: 0.4428
 epoch: 4, train_loss: 1.0732, test_loss: 1.0108, test_f1: 0.4563
 epoch: 5, train_loss: 1.0501, test_loss: 0.9770, test_f1: 0.4874
 epoch: 6, train_loss: 1.0272, test_loss: 0.9802, test_f1: 0.4588
 epoch: 7, train_loss: 1.0003, test_loss: 1.0134, test_f1: 0.4847
 epoch: 8, train_loss: 0.9914, test_loss: 0.9979, test_f1: 0.4993
 epoch: 9, train_loss: 0.9681, test_loss: 1.0923, test_f1: 0.4760
 epoch: 10, train_loss: 0.9503, test_loss: 0.9890, test_f1: 0.4833
 epoch: 11, train_loss: 0.9425, test_loss: 0.9793, test_f1: 0.5076
 epoch: 12, train_loss: 0.9237, test_loss: 1.0102, test_f1: 0.5093
 epoch: 13, train_loss: 0.9035, test_loss: 0.9386, test_f1: 0.5328
 epoch: 14, train_loss: 0.8875, test_loss: 1.0009, test_f1: 0.5024
 epoch: 15, train_loss: 0.8818, test_loss: 1.0684, test_f1: 0.4984
 epoch: 16, train_loss: 0.8600, test_loss: 1.0485, test_f1: 0.4914
 epoch: 17, train_loss: 0.8720, test_loss: 0.9493, test_f1: 0.5240
 epoch: 18, train_loss: 0.8451, test_loss: 1.0173, test_f1: 0.5387
 epoch: 19, train_loss: 0.8372, test_loss: 0.9632, test_f1: 0.5095
 epoch: 20, train_loss: 0.8193, test_loss: 1.0768, test_f1: 0.5162
 epoch: 21, train_loss: 0.8082, test_loss: 1.0315, test_f1: 0.4981
 epoch: 22, train_loss: 0.7963, test_loss: 1.0407, test_f1: 0.5307
 epoch: 23, train_loss: 0.7889, test_loss: 1.0743, test_f1: 0.4970
 epoch: 24, train_loss: 0.8033, test_loss: 1.0153, test_f1: 0.5620
 epoch: 25, train_loss: 0.7793, test_loss: 1.0871, test_f1: 0.5498
 epoch: 26, train_loss: 0.7719, test_loss: 1.1156, test_f1: 0.5123
 epoch: 27, train_loss: 0.7436, test_loss: 1.1623, test_f1: 0.5269
 epoch: 28, train_loss: 0.7745, test_loss: 1.2267, test_f1: 0.5296
 epoch: 29, train_loss: 0.7425, test_loss: 1.1911, test_f1: 0.5374
 epoch: 30, train_loss: 0.7339, test_loss: 1.0946, test_f1: 0.5402
 epoch: 31, train_loss: 0.7325, test_loss: 1.2144, test_f1: 0.5384
 epoch: 32, train_loss: 0.7183, test_loss: 1.1230, test_f1: 0.5477
 epoch: 33, train_loss: 0.7176, test_loss: 1.1746, test_f1: 0.5446
 epoch: 34, train_loss: 0.7041, test_loss: 1.2765, test_f1: 0.5257
 epoch: 35, train_loss: 0.6966, test_loss: 1.3171, test_f1: 0.5238
 epoch: 36, train_loss: 0.6980, test_loss: 1.1931, test_f1: 0.5378
 epoch: 37, train_loss: 0.6886, test_loss: 1.2169, test_f1: 0.5474
 epoch: 38, train_loss: 0.6756, test_loss: 1.3280, test_f1: 0.5170
 epoch: 39, train_loss: 0.6820, test_loss: 1.3089, test_f1: 0.5199
 epoch: 40, train_loss: 0.6500, test_loss: 1.3134, test_f1: 0.5211
 epoch: 41, train_loss: 0.6438, test_loss: 1.2789, test_f1: 0.5559
 epoch: 42, train_loss: 0.6430, test_loss: 1.3993, test_f1: 0.5179
 epoch: 43, train_loss: 0.6317, test_loss: 1.3472, test_f1: 0.5531
 epoch: 44, train_loss: 0.6458, test_loss: 1.3876, test_f1: 0.5330
 epoch: 45, train_loss: 0.6339, test_loss: 1.3715, test_f1: 0.5393
 epoch: 46, train_loss: 0.6335, test_loss: 1.3144, test_f1: 0.5656
 epoch: 47, train_loss: 0.6253, test_loss: 1.3117, test_f1: 0.5668
 epoch: 48, train_loss: 0.5899, test_loss: 1.3092, test_f1: 0.5826
 epoch: 49, train_loss: 0.6102, test_loss: 1.3055, test_f1: 0.5434
 epoch: 50, train_loss: 0.6267, test_loss: 1.3564, test_f1: 0.5823
 epoch: 51, train_loss: 0.5716, test_loss: 1.4876, test_f1: 0.5287
 epoch: 52, train_loss: 0.5466, test_loss: 1.4023, test_f1: 0.5701
 epoch: 53, train_loss: 0.5347, test_loss: 1.6442, test_f1: 0.5518
 epoch: 54, train_loss: 0.5296, test_loss: 1.6342, test_f1: 0.5540
 epoch: 55, train_loss: 0.5255, test_loss: 1.6650, test_f1: 0.5469
 epoch: 56, train_loss: 0.5224, test_loss: 1.5973, test_f1: 0.5470
 epoch: 57, train_loss: 0.5245, test_loss: 1.6015, test_f1: 0.5400
 epoch: 58, train_loss: 0.5215, test_loss: 1.5089, test_f1: 0.5761
 epoch: 59, train_loss: 0.5077, test_loss: 1.5976, test_f1: 0.5698
 epoch: 60, train_loss: 0.5053, test_loss: 1.6136, test_f1: 0.5447
 epoch: 61, train_loss: 0.4973, test_loss: 1.7070, test_f1: 0.5450
 epoch: 62, train_loss: 0.5012, test_loss: 1.6170, test_f1: 0.5596
 epoch: 63, train_loss: 0.4837, test_loss: 1.7530, test_f1: 0.5580
 epoch: 64, train_loss: 0.4927, test_loss: 1.6728, test_f1: 0.5441
 epoch: 65, train_loss: 0.4835, test_loss: 1.7043, test_f1: 0.5431
 epoch: 66, train_loss: 0.4922, test_loss: 1.7488, test_f1: 0.5768
 epoch: 67, train_loss: 0.4782, test_loss: 1.6588, test_f1: 0.5636
 epoch: 68, train_loss: 0.4676, test_loss: 1.7700, test_f1: 0.5595
 epoch: 69, train_loss: 0.4558, test_loss: 1.7700, test_f1: 0.5521
 epoch: 70, train_loss: 0.4472, test_loss: 1.8955, test_f1: 0.5497
 epoch: 71, train_loss: 0.4777, test_loss: 1.7962, test_f1: 0.5590
 epoch: 72, train_loss: 0.4604, test_loss: 1.7188, test_f1: 0.5747
 epoch: 73, train_loss: 0.4641, test_loss: 1.8410, test_f1: 0.5592
 epoch: 74, train_loss: 0.4515, test_loss: 1.9173, test_f1: 0.5229
 epoch: 75, train_loss: 0.4479, test_loss: 1.7148, test_f1: 0.5637
 epoch: 76, train_loss: 0.4494, test_loss: 1.7873, test_f1: 0.5457
 epoch: 77, train_loss: 0.4275, test_loss: 1.8591, test_f1: 0.5595
 epoch: 78, train_loss: 0.4465, test_loss: 1.7325, test_f1: 0.5901
 epoch: 79, train_loss: 0.4271, test_loss: 1.8261, test_f1: 0.5634
 epoch: 80, train_loss: 0.4302, test_loss: 1.8888, test_f1: 0.5674
 epoch: 81, train_loss: 0.4245, test_loss: 1.8634, test_f1: 0.5709
 epoch: 82, train_loss: 0.4223, test_loss: 1.8234, test_f1: 0.5601
 epoch: 83, train_loss: 0.4112, test_loss: 1.8747, test_f1: 0.5550
 epoch: 84, train_loss: 0.4393, test_loss: 1.7218, test_f1: 0.5392
 epoch: 85, train_loss: 0.4089, test_loss: 1.8858, test_f1: 0.5604
 epoch: 86, train_loss: 0.4195, test_loss: 2.0297, test_f1: 0.5526
 epoch: 87, train_loss: 0.4109, test_loss: 2.0584, test_f1: 0.5228
 epoch: 88, train_loss: 0.4047, test_loss: 1.9158, test_f1: 0.5735
 epoch: 89, train_loss: 0.3868, test_loss: 1.9700, test_f1: 0.5572
 epoch: 90, train_loss: 0.3921, test_loss: 2.0890, test_f1: 0.5634
 epoch: 91, train_loss: 0.4256, test_loss: 1.9511, test_f1: 0.5535
 epoch: 92, train_loss: 0.4195, test_loss: 2.1652, test_f1: 0.5408
 epoch: 93, train_loss: 0.4120, test_loss: 1.9668, test_f1: 0.5613
 epoch: 94, train_loss: 0.4145, test_loss: 1.7801, test_f1: 0.5572
 epoch: 95, train_loss: 0.4178, test_loss: 2.1013, test_f1: 0.5299
 epoch: 96, train_loss: 0.3681, test_loss: 2.0414, test_f1: 0.5582
 epoch: 97, train_loss: 0.3789, test_loss: 1.9422, test_f1: 0.5533
 epoch: 98, train_loss: 0.3986, test_loss: 1.9359, test_f1: 0.5510
 epoch: 99, train_loss: 0.3838, test_loss: 1.9664, test_f1: 0.5759
##################ITERATION #1 ****************************************
 epoch: 0, train_loss: 1.2446, test_loss: 1.1684, test_f1: 0.4195
 epoch: 1, train_loss: 1.1632, test_loss: 1.0930, test_f1: 0.4536
 epoch: 2, train_loss: 1.1096, test_loss: 1.0392, test_f1: 0.4479
 epoch: 3, train_loss: 1.0689, test_loss: 0.9938, test_f1: 0.4974
 epoch: 4, train_loss: 1.0531, test_loss: 0.9801, test_f1: 0.4775
 epoch: 5, train_loss: 1.0243, test_loss: 0.9784, test_f1: 0.4830
 epoch: 6, train_loss: 0.9991, test_loss: 0.9734, test_f1: 0.4951
 epoch: 7, train_loss: 0.9832, test_loss: 0.9996, test_f1: 0.4534
 epoch: 8, train_loss: 0.9795, test_loss: 0.9515, test_f1: 0.5208
 epoch: 9, train_loss: 0.9603, test_loss: 0.9456, test_f1: 0.5008
 epoch: 10, train_loss: 0.9421, test_loss: 0.9809, test_f1: 0.4842
 epoch: 11, train_loss: 0.9281, test_loss: 1.0459, test_f1: 0.4649
 epoch: 12, train_loss: 0.9225, test_loss: 0.9207, test_f1: 0.5157
 epoch: 13, train_loss: 0.9244, test_loss: 1.0031, test_f1: 0.4738
 epoch: 14, train_loss: 0.9015, test_loss: 0.9840, test_f1: 0.4907
 epoch: 15, train_loss: 0.8849, test_loss: 1.0053, test_f1: 0.5103
 epoch: 16, train_loss: 0.8747, test_loss: 0.9543, test_f1: 0.5105
 epoch: 17, train_loss: 0.8747, test_loss: 1.0017, test_f1: 0.5237
 epoch: 18, train_loss: 0.8554, test_loss: 1.1652, test_f1: 0.5104
 epoch: 19, train_loss: 0.8567, test_loss: 0.9872, test_f1: 0.5436
 epoch: 20, train_loss: 0.8321, test_loss: 0.9933, test_f1: 0.5347
 epoch: 21, train_loss: 0.8234, test_loss: 0.9733, test_f1: 0.5503
 epoch: 22, train_loss: 0.8074, test_loss: 0.9856, test_f1: 0.5309
 epoch: 23, train_loss: 0.8043, test_loss: 1.0750, test_f1: 0.4732
 epoch: 24, train_loss: 0.8145, test_loss: 1.0717, test_f1: 0.5046
 epoch: 25, train_loss: 0.8067, test_loss: 1.0333, test_f1: 0.5247
 epoch: 26, train_loss: 0.7840, test_loss: 1.0660, test_f1: 0.5456
 epoch: 27, train_loss: 0.7849, test_loss: 1.0152, test_f1: 0.5404
 epoch: 28, train_loss: 0.7660, test_loss: 1.0501, test_f1: 0.5117
 epoch: 29, train_loss: 0.7803, test_loss: 1.0393, test_f1: 0.5944
 epoch: 30, train_loss: 0.7783, test_loss: 1.1064, test_f1: 0.5299
 epoch: 31, train_loss: 0.7607, test_loss: 1.2435, test_f1: 0.5625
 epoch: 32, train_loss: 0.7490, test_loss: 1.1122, test_f1: 0.5590
 epoch: 33, train_loss: 0.7471, test_loss: 1.1160, test_f1: 0.5395
 epoch: 34, train_loss: 0.7393, test_loss: 1.3192, test_f1: 0.5289
 epoch: 35, train_loss: 0.7319, test_loss: 1.0711, test_f1: 0.5485
 epoch: 36, train_loss: 0.7466, test_loss: 1.1336, test_f1: 0.5550
 epoch: 37, train_loss: 0.7329, test_loss: 1.2044, test_f1: 0.5540
 epoch: 38, train_loss: 0.7060, test_loss: 1.0702, test_f1: 0.5585
 epoch: 39, train_loss: 0.7047, test_loss: 1.1783, test_f1: 0.5173
 epoch: 40, train_loss: 0.7031, test_loss: 1.2292, test_f1: 0.5282
 epoch: 41, train_loss: 0.6932, test_loss: 1.2452, test_f1: 0.5574
 epoch: 42, train_loss: 0.7267, test_loss: 1.1949, test_f1: 0.5436
 epoch: 43, train_loss: 0.7224, test_loss: 1.1713, test_f1: 0.5703
 epoch: 44, train_loss: 0.6983, test_loss: 1.2660, test_f1: 0.5507
 epoch: 45, train_loss: 0.6721, test_loss: 1.1597, test_f1: 0.5696
 epoch: 46, train_loss: 0.6578, test_loss: 1.3039, test_f1: 0.5121
 epoch: 47, train_loss: 0.6825, test_loss: 1.2066, test_f1: 0.5438
 epoch: 48, train_loss: 0.6524, test_loss: 1.2498, test_f1: 0.5485
 epoch: 49, train_loss: 0.6628, test_loss: 1.2547, test_f1: 0.5855
 epoch: 50, train_loss: 0.6406, test_loss: 1.3790, test_f1: 0.5274
 epoch: 51, train_loss: 0.6143, test_loss: 1.3161, test_f1: 0.5404
 epoch: 52, train_loss: 0.5830, test_loss: 1.3571, test_f1: 0.5576
 epoch: 53, train_loss: 0.5773, test_loss: 1.3272, test_f1: 0.5623
 epoch: 54, train_loss: 0.5723, test_loss: 1.5266, test_f1: 0.5280
 epoch: 55, train_loss: 0.5834, test_loss: 1.3756, test_f1: 0.5605
 epoch: 56, train_loss: 0.5697, test_loss: 1.3814, test_f1: 0.5661
 epoch: 57, train_loss: 0.5746, test_loss: 1.3822, test_f1: 0.5436
 epoch: 58, train_loss: 0.5737, test_loss: 1.3455, test_f1: 0.5693
 epoch: 59, train_loss: 0.5646, test_loss: 1.3567, test_f1: 0.5707
 epoch: 60, train_loss: 0.5491, test_loss: 1.6209, test_f1: 0.5246
 epoch: 61, train_loss: 0.5464, test_loss: 1.4220, test_f1: 0.5657
 epoch: 62, train_loss: 0.5362, test_loss: 1.4824, test_f1: 0.5765
 epoch: 63, train_loss: 0.5206, test_loss: 1.4648, test_f1: 0.5616
 epoch: 64, train_loss: 0.5323, test_loss: 1.5788, test_f1: 0.5317
 epoch: 65, train_loss: 0.5213, test_loss: 1.5589, test_f1: 0.5594
 epoch: 66, train_loss: 0.5129, test_loss: 1.4746, test_f1: 0.5704
 epoch: 67, train_loss: 0.5091, test_loss: 1.6845, test_f1: 0.5379
 epoch: 68, train_loss: 0.4921, test_loss: 1.5066, test_f1: 0.5662
 epoch: 69, train_loss: 0.5135, test_loss: 1.5599, test_f1: 0.5552
 epoch: 70, train_loss: 0.5013, test_loss: 1.6696, test_f1: 0.5431
 epoch: 71, train_loss: 0.4916, test_loss: 1.6065, test_f1: 0.5378
 epoch: 72, train_loss: 0.4902, test_loss: 1.6479, test_f1: 0.5323
 epoch: 73, train_loss: 0.4885, test_loss: 1.6613, test_f1: 0.5463
 epoch: 74, train_loss: 0.4913, test_loss: 1.5928, test_f1: 0.5520
 epoch: 75, train_loss: 0.4939, test_loss: 1.4847, test_f1: 0.5674
 epoch: 76, train_loss: 0.4937, test_loss: 1.7501, test_f1: 0.5345
 epoch: 77, train_loss: 0.4775, test_loss: 1.5770, test_f1: 0.5732
 epoch: 78, train_loss: 0.4749, test_loss: 1.7162, test_f1: 0.5595
 epoch: 79, train_loss: 0.4670, test_loss: 1.6561, test_f1: 0.5677
 epoch: 80, train_loss: 0.4864, test_loss: 1.6426, test_f1: 0.5504
 epoch: 81, train_loss: 0.4773, test_loss: 1.7112, test_f1: 0.5555
 epoch: 82, train_loss: 0.4565, test_loss: 1.7401, test_f1: 0.5665
 epoch: 83, train_loss: 0.4516, test_loss: 1.7379, test_f1: 0.5767
 epoch: 84, train_loss: 0.4533, test_loss: 1.7568, test_f1: 0.5521
 epoch: 85, train_loss: 0.4676, test_loss: 1.6918, test_f1: 0.5621
 epoch: 86, train_loss: 0.4510, test_loss: 1.5908, test_f1: 0.5722
 epoch: 87, train_loss: 0.4651, test_loss: 1.6901, test_f1: 0.5526
 epoch: 88, train_loss: 0.4492, test_loss: 1.6565, test_f1: 0.5911
 epoch: 89, train_loss: 0.4330, test_loss: 1.6929, test_f1: 0.5602
 epoch: 90, train_loss: 0.4349, test_loss: 1.7814, test_f1: 0.5658
 epoch: 91, train_loss: 0.4352, test_loss: 1.8091, test_f1: 0.5690
 epoch: 92, train_loss: 0.4312, test_loss: 1.7904, test_f1: 0.5298
 epoch: 93, train_loss: 0.4289, test_loss: 1.8209, test_f1: 0.5801
 epoch: 94, train_loss: 0.4242, test_loss: 1.9687, test_f1: 0.5435
 epoch: 95, train_loss: 0.4346, test_loss: 1.8381, test_f1: 0.5395
 epoch: 96, train_loss: 0.4138, test_loss: 1.8837, test_f1: 0.5298
 epoch: 97, train_loss: 0.4196, test_loss: 1.8072, test_f1: 0.5493
 epoch: 98, train_loss: 0.4183, test_loss: 2.0387, test_f1: 0.5317
 epoch: 99, train_loss: 0.4052, test_loss: 1.8409, test_f1: 0.5657
##################ITERATION #2 ****************************************
 epoch: 0, train_loss: 1.2810, test_loss: 1.2885, test_f1: 0.3797
 epoch: 1, train_loss: 1.1936, test_loss: 1.1358, test_f1: 0.4163
 epoch: 2, train_loss: 1.1466, test_loss: 1.0966, test_f1: 0.4410
 epoch: 3, train_loss: 1.1001, test_loss: 1.0329, test_f1: 0.4625
 epoch: 4, train_loss: 1.0677, test_loss: 1.0440, test_f1: 0.4790
 epoch: 5, train_loss: 1.0521, test_loss: 1.0340, test_f1: 0.4555
 epoch: 6, train_loss: 1.0213, test_loss: 1.0301, test_f1: 0.4723
 epoch: 7, train_loss: 1.0219, test_loss: 1.0248, test_f1: 0.4523
 epoch: 8, train_loss: 0.9855, test_loss: 0.9398, test_f1: 0.4956
 epoch: 9, train_loss: 0.9655, test_loss: 0.9473, test_f1: 0.4680
 epoch: 10, train_loss: 0.9550, test_loss: 0.9582, test_f1: 0.4984
 epoch: 11, train_loss: 0.9418, test_loss: 0.9595, test_f1: 0.5124
 epoch: 12, train_loss: 0.9256, test_loss: 0.9377, test_f1: 0.4933
 epoch: 13, train_loss: 0.9106, test_loss: 0.9613, test_f1: 0.4829
 epoch: 14, train_loss: 0.9177, test_loss: 0.9179, test_f1: 0.5277
 epoch: 15, train_loss: 0.8935, test_loss: 0.9764, test_f1: 0.4911
 epoch: 16, train_loss: 0.8807, test_loss: 0.9850, test_f1: 0.5119
 epoch: 17, train_loss: 0.8734, test_loss: 1.0476, test_f1: 0.4821
 epoch: 18, train_loss: 0.8754, test_loss: 1.0172, test_f1: 0.4998
 epoch: 19, train_loss: 0.8560, test_loss: 1.0368, test_f1: 0.5045
 epoch: 20, train_loss: 0.8393, test_loss: 1.0399, test_f1: 0.5260
 epoch: 21, train_loss: 0.8399, test_loss: 1.1380, test_f1: 0.4882
 epoch: 22, train_loss: 0.8362, test_loss: 1.0694, test_f1: 0.4898
 epoch: 23, train_loss: 0.8226, test_loss: 1.0733, test_f1: 0.5307
 epoch: 24, train_loss: 0.8222, test_loss: 1.0355, test_f1: 0.5303
 epoch: 25, train_loss: 0.7939, test_loss: 1.0171, test_f1: 0.5352
 epoch: 26, train_loss: 0.7908, test_loss: 1.0161, test_f1: 0.5234
 epoch: 27, train_loss: 0.7927, test_loss: 1.1023, test_f1: 0.5470
 epoch: 28, train_loss: 0.7868, test_loss: 1.1132, test_f1: 0.5360
 epoch: 29, train_loss: 0.7766, test_loss: 1.0846, test_f1: 0.5269
 epoch: 30, train_loss: 0.7690, test_loss: 1.1494, test_f1: 0.5082
 epoch: 31, train_loss: 0.7727, test_loss: 1.1026, test_f1: 0.5339
 epoch: 32, train_loss: 0.7536, test_loss: 1.1951, test_f1: 0.5269
 epoch: 33, train_loss: 0.7562, test_loss: 1.0514, test_f1: 0.5394
 epoch: 34, train_loss: 0.7461, test_loss: 1.1675, test_f1: 0.5081
 epoch: 35, train_loss: 0.7428, test_loss: 1.1050, test_f1: 0.5447
 epoch: 36, train_loss: 0.7363, test_loss: 1.1281, test_f1: 0.5190
 epoch: 37, train_loss: 0.7241, test_loss: 1.1643, test_f1: 0.5320
 epoch: 38, train_loss: 0.7314, test_loss: 1.1378, test_f1: 0.5114
 epoch: 39, train_loss: 0.6904, test_loss: 1.2295, test_f1: 0.4965
 epoch: 40, train_loss: 0.7142, test_loss: 1.2100, test_f1: 0.5234
 epoch: 41, train_loss: 0.7201, test_loss: 1.1967, test_f1: 0.5031
 epoch: 42, train_loss: 0.7085, test_loss: 1.1192, test_f1: 0.5218
 epoch: 43, train_loss: 0.6953, test_loss: 1.2524, test_f1: 0.4927
 epoch: 44, train_loss: 0.6883, test_loss: 1.1752, test_f1: 0.5525
 epoch: 45, train_loss: 0.6849, test_loss: 1.2324, test_f1: 0.5197
 epoch: 46, train_loss: 0.6849, test_loss: 1.2155, test_f1: 0.5066
 epoch: 47, train_loss: 0.6581, test_loss: 1.2446, test_f1: 0.5187
 epoch: 48, train_loss: 0.6469, test_loss: 1.2272, test_f1: 0.5278
 epoch: 49, train_loss: 0.6535, test_loss: 1.2124, test_f1: 0.5068
 epoch: 50, train_loss: 0.6488, test_loss: 1.2665, test_f1: 0.5388
 epoch: 51, train_loss: 0.6148, test_loss: 1.3005, test_f1: 0.5275
 epoch: 52, train_loss: 0.5981, test_loss: 1.2968, test_f1: 0.5418
 epoch: 53, train_loss: 0.5760, test_loss: 1.3467, test_f1: 0.5263
 epoch: 54, train_loss: 0.5700, test_loss: 1.3962, test_f1: 0.5186
 epoch: 55, train_loss: 0.5766, test_loss: 1.4162, test_f1: 0.5559
 epoch: 56, train_loss: 0.5727, test_loss: 1.3778, test_f1: 0.5500
 epoch: 57, train_loss: 0.5609, test_loss: 1.4741, test_f1: 0.5339
 epoch: 58, train_loss: 0.5782, test_loss: 1.4204, test_f1: 0.5234
 epoch: 59, train_loss: 0.5629, test_loss: 1.4092, test_f1: 0.5359
 epoch: 60, train_loss: 0.5435, test_loss: 1.3220, test_f1: 0.5325
 epoch: 61, train_loss: 0.5583, test_loss: 1.3710, test_f1: 0.5180
 epoch: 62, train_loss: 0.5692, test_loss: 1.4327, test_f1: 0.5299
 epoch: 63, train_loss: 0.5468, test_loss: 1.4283, test_f1: 0.5471
 epoch: 64, train_loss: 0.5466, test_loss: 1.4549, test_f1: 0.5477
 epoch: 65, train_loss: 0.5515, test_loss: 1.5135, test_f1: 0.5224
 epoch: 66, train_loss: 0.5270, test_loss: 1.4422, test_f1: 0.5184
 epoch: 67, train_loss: 0.5093, test_loss: 1.5389, test_f1: 0.5268
 epoch: 68, train_loss: 0.5237, test_loss: 1.5925, test_f1: 0.5215
 epoch: 69, train_loss: 0.5204, test_loss: 1.4602, test_f1: 0.5196
 epoch: 70, train_loss: 0.5085, test_loss: 1.4640, test_f1: 0.5359
 epoch: 71, train_loss: 0.5022, test_loss: 1.4633, test_f1: 0.5319
 epoch: 72, train_loss: 0.5075, test_loss: 1.5636, test_f1: 0.5466
 epoch: 73, train_loss: 0.5001, test_loss: 1.7104, test_f1: 0.5494
 epoch: 74, train_loss: 0.4991, test_loss: 1.6990, test_f1: 0.5324
 epoch: 75, train_loss: 0.5149, test_loss: 1.7007, test_f1: 0.5075
 epoch: 76, train_loss: 0.5020, test_loss: 1.6067, test_f1: 0.5258
 epoch: 77, train_loss: 0.4880, test_loss: 1.5996, test_f1: 0.5430
 epoch: 78, train_loss: 0.4903, test_loss: 1.6113, test_f1: 0.5454
 epoch: 79, train_loss: 0.4772, test_loss: 1.7745, test_f1: 0.5291
 epoch: 80, train_loss: 0.4739, test_loss: 1.7740, test_f1: 0.5269
 epoch: 81, train_loss: 0.4889, test_loss: 1.5680, test_f1: 0.5347
 epoch: 82, train_loss: 0.4833, test_loss: 1.6669, test_f1: 0.5389
 epoch: 83, train_loss: 0.4639, test_loss: 1.6341, test_f1: 0.5498
 epoch: 84, train_loss: 0.4687, test_loss: 1.7948, test_f1: 0.5404
 epoch: 85, train_loss: 0.4736, test_loss: 1.6083, test_f1: 0.5514
 epoch: 86, train_loss: 0.4549, test_loss: 1.7596, test_f1: 0.5555
 epoch: 87, train_loss: 0.4663, test_loss: 1.8237, test_f1: 0.5389
 epoch: 88, train_loss: 0.4644, test_loss: 1.6449, test_f1: 0.5670
 epoch: 89, train_loss: 0.4362, test_loss: 1.6771, test_f1: 0.5521
 epoch: 90, train_loss: 0.4485, test_loss: 1.7840, test_f1: 0.5549
 epoch: 91, train_loss: 0.4472, test_loss: 1.6336, test_f1: 0.5352
 epoch: 92, train_loss: 0.4408, test_loss: 1.6822, test_f1: 0.5543
 epoch: 93, train_loss: 0.4385, test_loss: 1.6905, test_f1: 0.5540
 epoch: 94, train_loss: 0.4406, test_loss: 1.5883, test_f1: 0.5570
 epoch: 95, train_loss: 0.4360, test_loss: 1.6957, test_f1: 0.5436
 epoch: 96, train_loss: 0.4459, test_loss: 1.6497, test_f1: 0.5571
 epoch: 97, train_loss: 0.4170, test_loss: 1.8041, test_f1: 0.5368
 epoch: 98, train_loss: 0.4210, test_loss: 1.7650, test_f1: 0.5637
 epoch: 99, train_loss: 0.4334, test_loss: 1.8425, test_f1: 0.5549
##################ITERATION #3 ****************************************
 epoch: 0, train_loss: 1.2774, test_loss: 1.1701, test_f1: 0.3407
 epoch: 1, train_loss: 1.1721, test_loss: 1.1462, test_f1: 0.4132
 epoch: 2, train_loss: 1.1168, test_loss: 1.0627, test_f1: 0.4719
 epoch: 3, train_loss: 1.0872, test_loss: 1.0438, test_f1: 0.4410
 epoch: 4, train_loss: 1.0530, test_loss: 1.0300, test_f1: 0.4322
 epoch: 5, train_loss: 1.0349, test_loss: 1.0244, test_f1: 0.4554
 epoch: 6, train_loss: 1.0076, test_loss: 0.9437, test_f1: 0.5058
 epoch: 7, train_loss: 0.9872, test_loss: 1.0359, test_f1: 0.4634
 epoch: 8, train_loss: 0.9716, test_loss: 0.9354, test_f1: 0.5100
 epoch: 9, train_loss: 0.9519, test_loss: 1.0012, test_f1: 0.4749
 epoch: 10, train_loss: 0.9337, test_loss: 0.9925, test_f1: 0.4624
 epoch: 11, train_loss: 0.9279, test_loss: 0.9550, test_f1: 0.5137
 epoch: 12, train_loss: 0.9094, test_loss: 0.9867, test_f1: 0.5240
 epoch: 13, train_loss: 0.9039, test_loss: 1.0191, test_f1: 0.5155
 epoch: 14, train_loss: 0.8966, test_loss: 0.9560, test_f1: 0.5046
 epoch: 15, train_loss: 0.8703, test_loss: 0.9896, test_f1: 0.5135
 epoch: 16, train_loss: 0.8810, test_loss: 0.9916, test_f1: 0.5085
 epoch: 17, train_loss: 0.8679, test_loss: 0.9690, test_f1: 0.5240
 epoch: 18, train_loss: 0.8706, test_loss: 1.0029, test_f1: 0.5199
 epoch: 19, train_loss: 0.8427, test_loss: 1.0352, test_f1: 0.5088
 epoch: 20, train_loss: 0.8306, test_loss: 1.0019, test_f1: 0.5354
 epoch: 21, train_loss: 0.8184, test_loss: 1.0186, test_f1: 0.5348
 epoch: 22, train_loss: 0.8286, test_loss: 1.0409, test_f1: 0.5390
 epoch: 23, train_loss: 0.8217, test_loss: 0.9634, test_f1: 0.5604
 epoch: 24, train_loss: 0.8169, test_loss: 1.0035, test_f1: 0.5241
 epoch: 25, train_loss: 0.8104, test_loss: 1.0095, test_f1: 0.5384
 epoch: 26, train_loss: 0.8120, test_loss: 1.0935, test_f1: 0.5372
 epoch: 27, train_loss: 0.7896, test_loss: 1.1250, test_f1: 0.5078
 epoch: 28, train_loss: 0.7865, test_loss: 1.0915, test_f1: 0.5221
 epoch: 29, train_loss: 0.7737, test_loss: 1.1248, test_f1: 0.5225
 epoch: 30, train_loss: 0.7850, test_loss: 1.1240, test_f1: 0.5379
 epoch: 31, train_loss: 0.7648, test_loss: 1.1204, test_f1: 0.5436
 epoch: 32, train_loss: 0.7567, test_loss: 1.3379, test_f1: 0.5024
 epoch: 33, train_loss: 0.7497, test_loss: 1.1003, test_f1: 0.5482
 epoch: 34, train_loss: 0.7268, test_loss: 1.1183, test_f1: 0.5587
 epoch: 35, train_loss: 0.7399, test_loss: 1.1590, test_f1: 0.5182
 epoch: 36, train_loss: 0.7368, test_loss: 1.1743, test_f1: 0.5126
 epoch: 37, train_loss: 0.7273, test_loss: 1.2474, test_f1: 0.5116
 epoch: 38, train_loss: 0.7190, test_loss: 1.1796, test_f1: 0.5380
 epoch: 39, train_loss: 0.6980, test_loss: 1.1911, test_f1: 0.5136
 epoch: 40, train_loss: 0.7321, test_loss: 1.1801, test_f1: 0.5141
 epoch: 41, train_loss: 0.6960, test_loss: 1.3061, test_f1: 0.5126
 epoch: 42, train_loss: 0.6931, test_loss: 1.2554, test_f1: 0.5079
 epoch: 43, train_loss: 0.6857, test_loss: 1.2613, test_f1: 0.5142
 epoch: 44, train_loss: 0.7016, test_loss: 1.2199, test_f1: 0.5097
 epoch: 45, train_loss: 0.6795, test_loss: 1.2047, test_f1: 0.5326
 epoch: 46, train_loss: 0.6699, test_loss: 1.2054, test_f1: 0.5545
 epoch: 47, train_loss: 0.6640, test_loss: 1.2295, test_f1: 0.5324
 epoch: 48, train_loss: 0.6560, test_loss: 1.1603, test_f1: 0.5302
 epoch: 49, train_loss: 0.6413, test_loss: 1.1880, test_f1: 0.5270
 epoch: 50, train_loss: 0.6571, test_loss: 1.1876, test_f1: 0.5346
 epoch: 51, train_loss: 0.6079, test_loss: 1.2257, test_f1: 0.5501
 epoch: 52, train_loss: 0.5893, test_loss: 1.2760, test_f1: 0.5386
 epoch: 53, train_loss: 0.5890, test_loss: 1.2911, test_f1: 0.5281
 epoch: 54, train_loss: 0.5723, test_loss: 1.3078, test_f1: 0.5377
 epoch: 55, train_loss: 0.5623, test_loss: 1.3671, test_f1: 0.5450
 epoch: 56, train_loss: 0.5470, test_loss: 1.3408, test_f1: 0.5427
 epoch: 57, train_loss: 0.5475, test_loss: 1.4188, test_f1: 0.5379
 epoch: 58, train_loss: 0.5477, test_loss: 1.2903, test_f1: 0.5415
 epoch: 59, train_loss: 0.5497, test_loss: 1.4059, test_f1: 0.5289
 epoch: 60, train_loss: 0.5333, test_loss: 1.3943, test_f1: 0.5487
 epoch: 61, train_loss: 0.5425, test_loss: 1.3683, test_f1: 0.5442
 epoch: 62, train_loss: 0.5250, test_loss: 1.4195, test_f1: 0.5537
 epoch: 63, train_loss: 0.5304, test_loss: 1.4053, test_f1: 0.5354
 epoch: 64, train_loss: 0.5215, test_loss: 1.3903, test_f1: 0.5378
 epoch: 65, train_loss: 0.5176, test_loss: 1.3822, test_f1: 0.5668
 epoch: 66, train_loss: 0.5261, test_loss: 1.4711, test_f1: 0.5409
 epoch: 67, train_loss: 0.5108, test_loss: 1.4680, test_f1: 0.5384
 epoch: 68, train_loss: 0.5143, test_loss: 1.4852, test_f1: 0.5550
 epoch: 69, train_loss: 0.5052, test_loss: 1.4673, test_f1: 0.5520
 epoch: 70, train_loss: 0.4950, test_loss: 1.4664, test_f1: 0.5627
 epoch: 71, train_loss: 0.4912, test_loss: 1.4563, test_f1: 0.5540
 epoch: 72, train_loss: 0.4991, test_loss: 1.4690, test_f1: 0.5364
 epoch: 73, train_loss: 0.4913, test_loss: 1.4666, test_f1: 0.5436
 epoch: 74, train_loss: 0.4709, test_loss: 1.5659, test_f1: 0.5433
 epoch: 75, train_loss: 0.4933, test_loss: 1.4741, test_f1: 0.5578
 epoch: 76, train_loss: 0.4532, test_loss: 1.5490, test_f1: 0.5375
 epoch: 77, train_loss: 0.4738, test_loss: 1.6508, test_f1: 0.5497
 epoch: 78, train_loss: 0.4665, test_loss: 1.5784, test_f1: 0.5308
 epoch: 79, train_loss: 0.4904, test_loss: 1.4978, test_f1: 0.5420
 epoch: 80, train_loss: 0.4595, test_loss: 1.6406, test_f1: 0.5354
 epoch: 81, train_loss: 0.4611, test_loss: 1.5809, test_f1: 0.5528
 epoch: 82, train_loss: 0.4429, test_loss: 1.6008, test_f1: 0.5380
 epoch: 83, train_loss: 0.4580, test_loss: 1.5432, test_f1: 0.5650
 epoch: 84, train_loss: 0.4461, test_loss: 1.5962, test_f1: 0.5645
 epoch: 85, train_loss: 0.4463, test_loss: 1.5216, test_f1: 0.5516
 epoch: 86, train_loss: 0.4387, test_loss: 1.6209, test_f1: 0.5588
 epoch: 87, train_loss: 0.4427, test_loss: 1.6526, test_f1: 0.5545
 epoch: 88, train_loss: 0.4469, test_loss: 1.5885, test_f1: 0.5417
 epoch: 89, train_loss: 0.4393, test_loss: 1.5346, test_f1: 0.5576
 epoch: 90, train_loss: 0.4543, test_loss: 1.7093, test_f1: 0.5514
 epoch: 91, train_loss: 0.4334, test_loss: 1.6491, test_f1: 0.5281
 epoch: 92, train_loss: 0.4247, test_loss: 1.6871, test_f1: 0.5441
 epoch: 93, train_loss: 0.4132, test_loss: 1.6609, test_f1: 0.5485
 epoch: 94, train_loss: 0.4181, test_loss: 1.7131, test_f1: 0.5237
 epoch: 95, train_loss: 0.4414, test_loss: 1.5857, test_f1: 0.5506
 epoch: 96, train_loss: 0.4292, test_loss: 1.7198, test_f1: 0.5580
 epoch: 97, train_loss: 0.4172, test_loss: 1.5939, test_f1: 0.5516
 epoch: 98, train_loss: 0.3986, test_loss: 1.7768, test_f1: 0.5602
 epoch: 99, train_loss: 0.4003, test_loss: 1.6044, test_f1: 0.5475
##################ITERATION #4 ****************************************
 epoch: 0, train_loss: 1.3285, test_loss: 1.2136, test_f1: 0.3742
 epoch: 1, train_loss: 1.2138, test_loss: 1.1427, test_f1: 0.4033
 epoch: 2, train_loss: 1.1624, test_loss: 1.1362, test_f1: 0.4027
 epoch: 3, train_loss: 1.1404, test_loss: 1.1040, test_f1: 0.4327
 epoch: 4, train_loss: 1.1321, test_loss: 1.0854, test_f1: 0.4410
 epoch: 5, train_loss: 1.1067, test_loss: 1.0263, test_f1: 0.4337
 epoch: 6, train_loss: 1.0673, test_loss: 1.0368, test_f1: 0.4280
 epoch: 7, train_loss: 1.0524, test_loss: 0.9981, test_f1: 0.4929
 epoch: 8, train_loss: 1.0507, test_loss: 0.9855, test_f1: 0.4712
 epoch: 9, train_loss: 1.0237, test_loss: 0.9561, test_f1: 0.4872
 epoch: 10, train_loss: 1.0033, test_loss: 1.0225, test_f1: 0.4474
 epoch: 11, train_loss: 0.9766, test_loss: 0.9569, test_f1: 0.5137
 epoch: 12, train_loss: 0.9634, test_loss: 1.0287, test_f1: 0.4450
 epoch: 13, train_loss: 0.9983, test_loss: 1.0103, test_f1: 0.4386
 epoch: 14, train_loss: 0.9607, test_loss: 1.0380, test_f1: 0.4607
 epoch: 15, train_loss: 0.9490, test_loss: 1.0218, test_f1: 0.4801
 epoch: 16, train_loss: 0.9430, test_loss: 0.9877, test_f1: 0.4756
 epoch: 17, train_loss: 0.9251, test_loss: 1.0018, test_f1: 0.4490
 epoch: 18, train_loss: 0.9330, test_loss: 0.9478, test_f1: 0.4945
 epoch: 19, train_loss: 0.9061, test_loss: 1.0585, test_f1: 0.4750
 epoch: 20, train_loss: 0.8970, test_loss: 1.1651, test_f1: 0.4556
 epoch: 21, train_loss: 0.8954, test_loss: 0.9763, test_f1: 0.4827
 epoch: 22, train_loss: 0.8784, test_loss: 0.9709, test_f1: 0.5105
 epoch: 23, train_loss: 0.8806, test_loss: 1.1840, test_f1: 0.5088
 epoch: 24, train_loss: 0.8821, test_loss: 1.0950, test_f1: 0.4722
 epoch: 25, train_loss: 0.8643, test_loss: 1.1361, test_f1: 0.4798
 epoch: 26, train_loss: 0.8562, test_loss: 1.0966, test_f1: 0.4890
 epoch: 27, train_loss: 0.8551, test_loss: 0.9945, test_f1: 0.4860
 epoch: 28, train_loss: 0.8324, test_loss: 1.0252, test_f1: 0.4950
 epoch: 29, train_loss: 0.8317, test_loss: 1.1323, test_f1: 0.4849
 epoch: 30, train_loss: 0.8401, test_loss: 1.0384, test_f1: 0.5057
 epoch: 31, train_loss: 0.8322, test_loss: 1.0758, test_f1: 0.5368
 epoch: 32, train_loss: 0.8478, test_loss: 1.0973, test_f1: 0.4948
 epoch: 33, train_loss: 0.8296, test_loss: 1.1139, test_f1: 0.4772
 epoch: 34, train_loss: 0.8143, test_loss: 1.1302, test_f1: 0.4920
 epoch: 35, train_loss: 0.8103, test_loss: 1.1002, test_f1: 0.5042
 epoch: 36, train_loss: 0.7906, test_loss: 1.1818, test_f1: 0.4869
 epoch: 37, train_loss: 0.8079, test_loss: 1.1819, test_f1: 0.5016
 epoch: 38, train_loss: 0.7834, test_loss: 1.0693, test_f1: 0.4894
 epoch: 39, train_loss: 0.7868, test_loss: 1.1428, test_f1: 0.5176
 epoch: 40, train_loss: 0.7863, test_loss: 1.2330, test_f1: 0.4986
 epoch: 41, train_loss: 0.7859, test_loss: 1.1192, test_f1: 0.5068
 epoch: 42, train_loss: 0.7814, test_loss: 1.0941, test_f1: 0.5303
 epoch: 43, train_loss: 0.7741, test_loss: 1.1250, test_f1: 0.5096
 epoch: 44, train_loss: 0.7528, test_loss: 1.2012, test_f1: 0.5341
 epoch: 45, train_loss: 0.7562, test_loss: 1.1776, test_f1: 0.5268
 epoch: 46, train_loss: 0.7381, test_loss: 1.2000, test_f1: 0.5012
 epoch: 47, train_loss: 0.7334, test_loss: 1.1860, test_f1: 0.5010
 epoch: 48, train_loss: 0.7282, test_loss: 1.2728, test_f1: 0.5359
 epoch: 49, train_loss: 0.7467, test_loss: 1.2520, test_f1: 0.4905
 epoch: 50, train_loss: 0.7429, test_loss: 1.1645, test_f1: 0.5306
 epoch: 51, train_loss: 0.6951, test_loss: 1.1712, test_f1: 0.5183
 epoch: 52, train_loss: 0.6861, test_loss: 1.2655, test_f1: 0.5285
 epoch: 53, train_loss: 0.6633, test_loss: 1.2370, test_f1: 0.5398
 epoch: 54, train_loss: 0.6683, test_loss: 1.1746, test_f1: 0.5282
 epoch: 55, train_loss: 0.6688, test_loss: 1.2777, test_f1: 0.5312
 epoch: 56, train_loss: 0.6408, test_loss: 1.3159, test_f1: 0.5198
 epoch: 57, train_loss: 0.6476, test_loss: 1.3398, test_f1: 0.5269
 epoch: 58, train_loss: 0.6472, test_loss: 1.3414, test_f1: 0.5234
 epoch: 59, train_loss: 0.6533, test_loss: 1.2233, test_f1: 0.5327
 epoch: 60, train_loss: 0.6499, test_loss: 1.2629, test_f1: 0.5261
 epoch: 61, train_loss: 0.6395, test_loss: 1.2526, test_f1: 0.5534
 epoch: 62, train_loss: 0.6384, test_loss: 1.2746, test_f1: 0.5480
 epoch: 63, train_loss: 0.6353, test_loss: 1.3786, test_f1: 0.5402
 epoch: 64, train_loss: 0.6256, test_loss: 1.3435, test_f1: 0.5447
 epoch: 65, train_loss: 0.6234, test_loss: 1.3063, test_f1: 0.5206
 epoch: 66, train_loss: 0.6217, test_loss: 1.3041, test_f1: 0.5499
 epoch: 67, train_loss: 0.6037, test_loss: 1.3816, test_f1: 0.5502
 epoch: 68, train_loss: 0.6132, test_loss: 1.3338, test_f1: 0.5466
 epoch: 69, train_loss: 0.6064, test_loss: 1.4096, test_f1: 0.5298
 epoch: 70, train_loss: 0.6014, test_loss: 1.4269, test_f1: 0.5372
 epoch: 71, train_loss: 0.5987, test_loss: 1.3750, test_f1: 0.5355
 epoch: 72, train_loss: 0.6145, test_loss: 1.3581, test_f1: 0.5483
 epoch: 73, train_loss: 0.5938, test_loss: 1.3633, test_f1: 0.5333
 epoch: 74, train_loss: 0.5945, test_loss: 1.3268, test_f1: 0.5534
 epoch: 75, train_loss: 0.6039, test_loss: 1.4023, test_f1: 0.5434
 epoch: 76, train_loss: 0.5810, test_loss: 1.4144, test_f1: 0.5481
 epoch: 77, train_loss: 0.5818, test_loss: 1.4232, test_f1: 0.5180
 epoch: 78, train_loss: 0.5755, test_loss: 1.3050, test_f1: 0.5537
 epoch: 79, train_loss: 0.5852, test_loss: 1.4908, test_f1: 0.5404
 epoch: 80, train_loss: 0.5679, test_loss: 1.4448, test_f1: 0.5456
 epoch: 81, train_loss: 0.5783, test_loss: 1.4542, test_f1: 0.5498
 epoch: 82, train_loss: 0.5908, test_loss: 1.4102, test_f1: 0.5426
 epoch: 83, train_loss: 0.5801, test_loss: 1.3836, test_f1: 0.5674
 epoch: 84, train_loss: 0.5673, test_loss: 1.4322, test_f1: 0.5419
 epoch: 85, train_loss: 0.5661, test_loss: 1.3397, test_f1: 0.5555
 epoch: 86, train_loss: 0.5592, test_loss: 1.3158, test_f1: 0.5418
 epoch: 87, train_loss: 0.5457, test_loss: 1.3698, test_f1: 0.5459
 epoch: 88, train_loss: 0.5474, test_loss: 1.3836, test_f1: 0.5537
 epoch: 89, train_loss: 0.5457, test_loss: 1.3942, test_f1: 0.5489
 epoch: 90, train_loss: 0.5329, test_loss: 1.4570, test_f1: 0.5442
 epoch: 91, train_loss: 0.5407, test_loss: 1.3954, test_f1: 0.5542
 epoch: 92, train_loss: 0.5460, test_loss: 1.3955, test_f1: 0.5276
 epoch: 93, train_loss: 0.5088, test_loss: 1.5217, test_f1: 0.5403
 epoch: 94, train_loss: 0.5480, test_loss: 1.4065, test_f1: 0.5659
 epoch: 95, train_loss: 0.5435, test_loss: 1.3928, test_f1: 0.5406
 epoch: 96, train_loss: 0.5161, test_loss: 1.4083, test_f1: 0.5585
 epoch: 97, train_loss: 0.5131, test_loss: 1.4455, test_f1: 0.5472
 epoch: 98, train_loss: 0.4975, test_loss: 1.4575, test_f1: 0.5550
 epoch: 99, train_loss: 0.5133, test_loss: 1.5245, test_f1: 0.5441
##################ITERATION #5 ****************************************
 epoch: 0, train_loss: 1.3241, test_loss: 1.1418, test_f1: 0.4228
 epoch: 1, train_loss: 1.1846, test_loss: 1.1144, test_f1: 0.3871
 epoch: 2, train_loss: 1.1492, test_loss: 1.0810, test_f1: 0.4077
 epoch: 3, train_loss: 1.1226, test_loss: 1.0605, test_f1: 0.4363
 epoch: 4, train_loss: 1.0951, test_loss: 1.0226, test_f1: 0.4495
 epoch: 5, train_loss: 1.0749, test_loss: 1.0105, test_f1: 0.4514
 epoch: 6, train_loss: 1.0497, test_loss: 0.9780, test_f1: 0.4673
 epoch: 7, train_loss: 1.0285, test_loss: 1.0638, test_f1: 0.4399
 epoch: 8, train_loss: 1.0261, test_loss: 0.9911, test_f1: 0.4463
 epoch: 9, train_loss: 1.0074, test_loss: 1.0497, test_f1: 0.4341
 epoch: 10, train_loss: 0.9917, test_loss: 1.0198, test_f1: 0.4636
 epoch: 11, train_loss: 0.9847, test_loss: 1.0022, test_f1: 0.4576
 epoch: 12, train_loss: 0.9758, test_loss: 1.0174, test_f1: 0.4575
 epoch: 13, train_loss: 0.9473, test_loss: 1.0545, test_f1: 0.4453
 epoch: 14, train_loss: 0.9456, test_loss: 1.0048, test_f1: 0.4607
 epoch: 15, train_loss: 0.9259, test_loss: 0.9506, test_f1: 0.4654
 epoch: 16, train_loss: 0.9395, test_loss: 0.9915, test_f1: 0.4790
 epoch: 17, train_loss: 0.9208, test_loss: 1.0431, test_f1: 0.4360
 epoch: 18, train_loss: 0.9265, test_loss: 0.9988, test_f1: 0.4710
 epoch: 19, train_loss: 0.9081, test_loss: 1.0472, test_f1: 0.4816
 epoch: 20, train_loss: 0.8939, test_loss: 0.9624, test_f1: 0.4969
 epoch: 21, train_loss: 0.8889, test_loss: 1.0105, test_f1: 0.4843
 epoch: 22, train_loss: 0.8983, test_loss: 1.0666, test_f1: 0.4871
 epoch: 23, train_loss: 0.8822, test_loss: 1.0375, test_f1: 0.4804
 epoch: 24, train_loss: 0.8807, test_loss: 1.0648, test_f1: 0.4702
 epoch: 25, train_loss: 0.8730, test_loss: 1.0295, test_f1: 0.4917
 epoch: 26, train_loss: 0.8467, test_loss: 1.0481, test_f1: 0.5009
 epoch: 27, train_loss: 0.8323, test_loss: 1.1331, test_f1: 0.4619
 epoch: 28, train_loss: 0.8646, test_loss: 0.9904, test_f1: 0.4765
 epoch: 29, train_loss: 0.8292, test_loss: 1.0803, test_f1: 0.4917
 epoch: 30, train_loss: 0.8107, test_loss: 1.0836, test_f1: 0.4911
 epoch: 31, train_loss: 0.8152, test_loss: 1.0024, test_f1: 0.5132
 epoch: 32, train_loss: 0.8204, test_loss: 1.0181, test_f1: 0.5201
 epoch: 33, train_loss: 0.8124, test_loss: 1.1749, test_f1: 0.4975
 epoch: 34, train_loss: 0.7981, test_loss: 1.0450, test_f1: 0.4967
 epoch: 35, train_loss: 0.7898, test_loss: 1.1271, test_f1: 0.4899
 epoch: 36, train_loss: 0.7617, test_loss: 1.1729, test_f1: 0.5091
 epoch: 37, train_loss: 0.7809, test_loss: 1.0857, test_f1: 0.5015
 epoch: 38, train_loss: 0.7700, test_loss: 1.1066, test_f1: 0.5033
 epoch: 39, train_loss: 0.7796, test_loss: 1.0890, test_f1: 0.4951
 epoch: 40, train_loss: 0.7529, test_loss: 1.0898, test_f1: 0.5314
 epoch: 41, train_loss: 0.7637, test_loss: 1.1802, test_f1: 0.5201
 epoch: 42, train_loss: 0.7434, test_loss: 1.1265, test_f1: 0.5172
 epoch: 43, train_loss: 0.7296, test_loss: 1.2033, test_f1: 0.5142
 epoch: 44, train_loss: 0.7336, test_loss: 1.1356, test_f1: 0.5062
 epoch: 45, train_loss: 0.7336, test_loss: 1.1205, test_f1: 0.5027
 epoch: 46, train_loss: 0.7189, test_loss: 1.0917, test_f1: 0.5270
 epoch: 47, train_loss: 0.7159, test_loss: 1.0769, test_f1: 0.5489
 epoch: 48, train_loss: 0.7121, test_loss: 1.1489, test_f1: 0.5369
 epoch: 49, train_loss: 0.7161, test_loss: 1.1495, test_f1: 0.5342
 epoch: 50, train_loss: 0.7154, test_loss: 1.1871, test_f1: 0.5377
 epoch: 51, train_loss: 0.6839, test_loss: 1.1570, test_f1: 0.5397
 epoch: 52, train_loss: 0.6565, test_loss: 1.1592, test_f1: 0.5364
 epoch: 53, train_loss: 0.6371, test_loss: 1.1979, test_f1: 0.5348
 epoch: 54, train_loss: 0.6302, test_loss: 1.1804, test_f1: 0.5388
 epoch: 55, train_loss: 0.6267, test_loss: 1.1795, test_f1: 0.5206
 epoch: 56, train_loss: 0.6376, test_loss: 1.2295, test_f1: 0.5385
 epoch: 57, train_loss: 0.6278, test_loss: 1.1888, test_f1: 0.5340
 epoch: 58, train_loss: 0.6086, test_loss: 1.2501, test_f1: 0.5695
 epoch: 59, train_loss: 0.6087, test_loss: 1.2326, test_f1: 0.5481
 epoch: 60, train_loss: 0.6061, test_loss: 1.2115, test_f1: 0.5113
 epoch: 61, train_loss: 0.5877, test_loss: 1.2413, test_f1: 0.5369
 epoch: 62, train_loss: 0.5946, test_loss: 1.2404, test_f1: 0.5380
 epoch: 63, train_loss: 0.5953, test_loss: 1.2900, test_f1: 0.5197
 epoch: 64, train_loss: 0.5892, test_loss: 1.3113, test_f1: 0.5469
 epoch: 65, train_loss: 0.5753, test_loss: 1.2767, test_f1: 0.5444
 epoch: 66, train_loss: 0.6036, test_loss: 1.2719, test_f1: 0.5326
 epoch: 67, train_loss: 0.5613, test_loss: 1.3470, test_f1: 0.5445
 epoch: 68, train_loss: 0.6017, test_loss: 1.2459, test_f1: 0.5643
 epoch: 69, train_loss: 0.5554, test_loss: 1.2821, test_f1: 0.5720
 epoch: 70, train_loss: 0.5664, test_loss: 1.2763, test_f1: 0.5563
 epoch: 71, train_loss: 0.5419, test_loss: 1.3584, test_f1: 0.5351
 epoch: 72, train_loss: 0.5500, test_loss: 1.3359, test_f1: 0.5396
 epoch: 73, train_loss: 0.5460, test_loss: 1.2936, test_f1: 0.5496
 epoch: 74, train_loss: 0.5517, test_loss: 1.3438, test_f1: 0.5602
 epoch: 75, train_loss: 0.5445, test_loss: 1.3511, test_f1: 0.5439
 epoch: 76, train_loss: 0.5378, test_loss: 1.3106, test_f1: 0.5545
 epoch: 77, train_loss: 0.5399, test_loss: 1.3744, test_f1: 0.5599
 epoch: 78, train_loss: 0.5462, test_loss: 1.4278, test_f1: 0.5418
 epoch: 79, train_loss: 0.5390, test_loss: 1.3288, test_f1: 0.5534
 epoch: 80, train_loss: 0.5414, test_loss: 1.2624, test_f1: 0.5490
 epoch: 81, train_loss: 0.5081, test_loss: 1.3970, test_f1: 0.5698
 epoch: 82, train_loss: 0.5108, test_loss: 1.3432, test_f1: 0.5455
 epoch: 83, train_loss: 0.5334, test_loss: 1.3922, test_f1: 0.5478
 epoch: 84, train_loss: 0.5339, test_loss: 1.3505, test_f1: 0.5587
 epoch: 85, train_loss: 0.5296, test_loss: 1.4037, test_f1: 0.5557
 epoch: 86, train_loss: 0.5049, test_loss: 1.3870, test_f1: 0.5542
 epoch: 87, train_loss: 0.5016, test_loss: 1.4879, test_f1: 0.5693
 epoch: 88, train_loss: 0.5073, test_loss: 1.4397, test_f1: 0.5381
 epoch: 89, train_loss: 0.4920, test_loss: 1.4577, test_f1: 0.5427
 epoch: 90, train_loss: 0.5007, test_loss: 1.4006, test_f1: 0.5553
 epoch: 91, train_loss: 0.4729, test_loss: 1.4743, test_f1: 0.5621
 epoch: 92, train_loss: 0.5119, test_loss: 1.5049, test_f1: 0.5761
 epoch: 93, train_loss: 0.4866, test_loss: 1.4196, test_f1: 0.5429
 epoch: 94, train_loss: 0.4859, test_loss: 1.4074, test_f1: 0.5781
 epoch: 95, train_loss: 0.4648, test_loss: 1.3700, test_f1: 0.5609
 epoch: 96, train_loss: 0.4825, test_loss: 1.4504, test_f1: 0.5631
 epoch: 97, train_loss: 0.4483, test_loss: 1.5382, test_f1: 0.5394
 epoch: 98, train_loss: 0.4795, test_loss: 1.4279, test_f1: 0.5600
 epoch: 99, train_loss: 0.4691, test_loss: 1.4844, test_f1: 0.5542
##################ITERATION #6 ****************************************
 epoch: 0, train_loss: 1.3642, test_loss: 1.1767, test_f1: 0.3519
 epoch: 1, train_loss: 1.1947, test_loss: 1.1205, test_f1: 0.4133
 epoch: 2, train_loss: 1.1448, test_loss: 1.0937, test_f1: 0.4164
 epoch: 3, train_loss: 1.1068, test_loss: 1.0410, test_f1: 0.4582
 epoch: 4, train_loss: 1.0897, test_loss: 1.0754, test_f1: 0.4273
 epoch: 5, train_loss: 1.0547, test_loss: 1.0522, test_f1: 0.4339
 epoch: 6, train_loss: 1.0407, test_loss: 1.0630, test_f1: 0.4419
 epoch: 7, train_loss: 1.0291, test_loss: 1.0411, test_f1: 0.4483
 epoch: 8, train_loss: 1.0139, test_loss: 1.0416, test_f1: 0.4537
 epoch: 9, train_loss: 0.9955, test_loss: 1.0162, test_f1: 0.4325
 epoch: 10, train_loss: 0.9713, test_loss: 1.0264, test_f1: 0.4586
 epoch: 11, train_loss: 0.9588, test_loss: 0.9982, test_f1: 0.4585
 epoch: 12, train_loss: 0.9484, test_loss: 1.0573, test_f1: 0.4969
 epoch: 13, train_loss: 0.9380, test_loss: 1.1123, test_f1: 0.4432
 epoch: 14, train_loss: 0.9384, test_loss: 1.0076, test_f1: 0.4704
 epoch: 15, train_loss: 0.8990, test_loss: 0.9867, test_f1: 0.5156
 epoch: 16, train_loss: 0.9159, test_loss: 1.0203, test_f1: 0.4789
 epoch: 17, train_loss: 0.8920, test_loss: 1.0513, test_f1: 0.5150
 epoch: 18, train_loss: 0.8758, test_loss: 1.0180, test_f1: 0.5074
 epoch: 19, train_loss: 0.8676, test_loss: 1.0450, test_f1: 0.4651
 epoch: 20, train_loss: 0.8616, test_loss: 1.0891, test_f1: 0.5109
 epoch: 21, train_loss: 0.8382, test_loss: 1.2285, test_f1: 0.4996
 epoch: 22, train_loss: 0.8437, test_loss: 1.0571, test_f1: 0.5215
 epoch: 23, train_loss: 0.8462, test_loss: 1.1383, test_f1: 0.5173
 epoch: 24, train_loss: 0.8354, test_loss: 1.0479, test_f1: 0.5344
 epoch: 25, train_loss: 0.8253, test_loss: 1.0776, test_f1: 0.5253
 epoch: 26, train_loss: 0.8106, test_loss: 1.0991, test_f1: 0.5415
 epoch: 27, train_loss: 0.8074, test_loss: 1.0734, test_f1: 0.5409
 epoch: 28, train_loss: 0.7971, test_loss: 1.0692, test_f1: 0.5176
 epoch: 29, train_loss: 0.7822, test_loss: 1.0583, test_f1: 0.5623
 epoch: 30, train_loss: 0.7918, test_loss: 1.2194, test_f1: 0.5401
 epoch: 31, train_loss: 0.7874, test_loss: 1.1246, test_f1: 0.5212
 epoch: 32, train_loss: 0.7622, test_loss: 1.1317, test_f1: 0.5211
 epoch: 33, train_loss: 0.7624, test_loss: 1.2625, test_f1: 0.4926
 epoch: 34, train_loss: 0.7824, test_loss: 1.0693, test_f1: 0.5201
 epoch: 35, train_loss: 0.7811, test_loss: 1.0775, test_f1: 0.5560
 epoch: 36, train_loss: 0.7646, test_loss: 1.0722, test_f1: 0.5311
 epoch: 37, train_loss: 0.7361, test_loss: 1.1025, test_f1: 0.5316
 epoch: 38, train_loss: 0.7267, test_loss: 1.0929, test_f1: 0.5487
 epoch: 39, train_loss: 0.7383, test_loss: 1.1954, test_f1: 0.5538
 epoch: 40, train_loss: 0.7362, test_loss: 1.0479, test_f1: 0.5466
 epoch: 41, train_loss: 0.7331, test_loss: 1.1832, test_f1: 0.5221
 epoch: 42, train_loss: 0.7231, test_loss: 1.1775, test_f1: 0.5486
 epoch: 43, train_loss: 0.7241, test_loss: 1.0826, test_f1: 0.5554
 epoch: 44, train_loss: 0.7172, test_loss: 1.1394, test_f1: 0.5157
 epoch: 45, train_loss: 0.6993, test_loss: 1.1633, test_f1: 0.5532
 epoch: 46, train_loss: 0.7067, test_loss: 1.1825, test_f1: 0.5500
 epoch: 47, train_loss: 0.6976, test_loss: 1.2084, test_f1: 0.5222
 epoch: 48, train_loss: 0.6885, test_loss: 1.3094, test_f1: 0.5239
 epoch: 49, train_loss: 0.6908, test_loss: 1.2297, test_f1: 0.5449
 epoch: 50, train_loss: 0.6891, test_loss: 1.2449, test_f1: 0.5293
 epoch: 51, train_loss: 0.6428, test_loss: 1.3080, test_f1: 0.5479
 epoch: 52, train_loss: 0.6354, test_loss: 1.3701, test_f1: 0.5243
 epoch: 53, train_loss: 0.6272, test_loss: 1.2645, test_f1: 0.5433
 epoch: 54, train_loss: 0.6129, test_loss: 1.3559, test_f1: 0.5340
 epoch: 55, train_loss: 0.6062, test_loss: 1.3712, test_f1: 0.5474
 epoch: 56, train_loss: 0.5882, test_loss: 1.4001, test_f1: 0.5452
 epoch: 57, train_loss: 0.6051, test_loss: 1.3924, test_f1: 0.5272
 epoch: 58, train_loss: 0.5909, test_loss: 1.4088, test_f1: 0.5583
 epoch: 59, train_loss: 0.5852, test_loss: 1.3507, test_f1: 0.5725
 epoch: 60, train_loss: 0.5676, test_loss: 1.4007, test_f1: 0.5391
 epoch: 61, train_loss: 0.5637, test_loss: 1.3802, test_f1: 0.5395
 epoch: 62, train_loss: 0.5656, test_loss: 1.4189, test_f1: 0.5569
 epoch: 63, train_loss: 0.5580, test_loss: 1.4263, test_f1: 0.5434
 epoch: 64, train_loss: 0.5610, test_loss: 1.4518, test_f1: 0.5420
 epoch: 65, train_loss: 0.5567, test_loss: 1.3759, test_f1: 0.5320
 epoch: 66, train_loss: 0.5558, test_loss: 1.3610, test_f1: 0.5429
 epoch: 67, train_loss: 0.5585, test_loss: 1.4353, test_f1: 0.5396
 epoch: 68, train_loss: 0.5533, test_loss: 1.4217, test_f1: 0.5446
 epoch: 69, train_loss: 0.5580, test_loss: 1.4654, test_f1: 0.5307
 epoch: 70, train_loss: 0.5326, test_loss: 1.4992, test_f1: 0.5477
 epoch: 71, train_loss: 0.5399, test_loss: 1.3991, test_f1: 0.5541
 epoch: 72, train_loss: 0.5418, test_loss: 1.4603, test_f1: 0.5566
 epoch: 73, train_loss: 0.5303, test_loss: 1.4953, test_f1: 0.5306
 epoch: 74, train_loss: 0.5200, test_loss: 1.4870, test_f1: 0.5499
 epoch: 75, train_loss: 0.5281, test_loss: 1.4318, test_f1: 0.5393
 epoch: 76, train_loss: 0.5442, test_loss: 1.4561, test_f1: 0.5533
 epoch: 77, train_loss: 0.5303, test_loss: 1.5512, test_f1: 0.5490
 epoch: 78, train_loss: 0.5220, test_loss: 1.5225, test_f1: 0.5652
 epoch: 79, train_loss: 0.5227, test_loss: 1.4551, test_f1: 0.5627
 epoch: 80, train_loss: 0.4951, test_loss: 1.5253, test_f1: 0.5836
 epoch: 81, train_loss: 0.5027, test_loss: 1.4496, test_f1: 0.5772
 epoch: 82, train_loss: 0.5005, test_loss: 1.4870, test_f1: 0.5502
 epoch: 83, train_loss: 0.4925, test_loss: 1.5105, test_f1: 0.5723
 epoch: 84, train_loss: 0.5003, test_loss: 1.5106, test_f1: 0.5548
 epoch: 85, train_loss: 0.4822, test_loss: 1.5700, test_f1: 0.5590
 epoch: 86, train_loss: 0.4984, test_loss: 1.5050, test_f1: 0.5886
 epoch: 87, train_loss: 0.4955, test_loss: 1.4504, test_f1: 0.5599
 epoch: 88, train_loss: 0.4723, test_loss: 1.5625, test_f1: 0.5672
 epoch: 89, train_loss: 0.4694, test_loss: 1.5839, test_f1: 0.5761
 epoch: 90, train_loss: 0.4792, test_loss: 1.5069, test_f1: 0.5740
 epoch: 91, train_loss: 0.4869, test_loss: 1.6032, test_f1: 0.5429
 epoch: 92, train_loss: 0.4679, test_loss: 1.5687, test_f1: 0.5710
 epoch: 93, train_loss: 0.4703, test_loss: 1.5767, test_f1: 0.5619
 epoch: 94, train_loss: 0.4721, test_loss: 1.5481, test_f1: 0.5569
 epoch: 95, train_loss: 0.4533, test_loss: 1.6438, test_f1: 0.5606
 epoch: 96, train_loss: 0.4682, test_loss: 1.6484, test_f1: 0.5518
 epoch: 97, train_loss: 0.4439, test_loss: 1.5941, test_f1: 0.5468
 epoch: 98, train_loss: 0.4630, test_loss: 1.6370, test_f1: 0.5434
 epoch: 99, train_loss: 0.4682, test_loss: 1.6848, test_f1: 0.5433
##################ITERATION #7 ****************************************
 epoch: 0, train_loss: 1.3472, test_loss: 1.1741, test_f1: 0.3542
 epoch: 1, train_loss: 1.2045, test_loss: 1.1313, test_f1: 0.4124
 epoch: 2, train_loss: 1.1649, test_loss: 1.1215, test_f1: 0.3990
 epoch: 3, train_loss: 1.1498, test_loss: 1.0816, test_f1: 0.4217
 epoch: 4, train_loss: 1.1105, test_loss: 1.0590, test_f1: 0.4404
 epoch: 5, train_loss: 1.0982, test_loss: 1.0679, test_f1: 0.4338
 epoch: 6, train_loss: 1.0830, test_loss: 1.0549, test_f1: 0.4176
 epoch: 7, train_loss: 1.0691, test_loss: 1.0753, test_f1: 0.4127
 epoch: 8, train_loss: 1.0494, test_loss: 1.0337, test_f1: 0.4436
 epoch: 9, train_loss: 1.0482, test_loss: 1.0336, test_f1: 0.4410
 epoch: 10, train_loss: 1.0420, test_loss: 0.9780, test_f1: 0.4890
 epoch: 11, train_loss: 1.0024, test_loss: 1.0426, test_f1: 0.4418
 epoch: 12, train_loss: 0.9946, test_loss: 1.0081, test_f1: 0.4778
 epoch: 13, train_loss: 0.9725, test_loss: 1.0392, test_f1: 0.4578
 epoch: 14, train_loss: 0.9648, test_loss: 1.0483, test_f1: 0.4509
 epoch: 15, train_loss: 0.9518, test_loss: 1.0773, test_f1: 0.4629
 epoch: 16, train_loss: 0.9673, test_loss: 0.9764, test_f1: 0.4990
 epoch: 17, train_loss: 0.9446, test_loss: 1.0076, test_f1: 0.4631
 epoch: 18, train_loss: 0.9321, test_loss: 1.0659, test_f1: 0.4607
 epoch: 19, train_loss: 0.9224, test_loss: 1.0397, test_f1: 0.4645
 epoch: 20, train_loss: 0.9075, test_loss: 1.0815, test_f1: 0.4608
 epoch: 21, train_loss: 0.9057, test_loss: 1.0713, test_f1: 0.4554
 epoch: 22, train_loss: 0.8977, test_loss: 1.0764, test_f1: 0.4913
 epoch: 23, train_loss: 0.8673, test_loss: 1.1366, test_f1: 0.4582
 epoch: 24, train_loss: 0.8706, test_loss: 1.0616, test_f1: 0.4862
 epoch: 25, train_loss: 0.8662, test_loss: 1.0582, test_f1: 0.4975
 epoch: 26, train_loss: 0.8631, test_loss: 1.1024, test_f1: 0.4818
 epoch: 27, train_loss: 0.8456, test_loss: 1.2358, test_f1: 0.4595
 epoch: 28, train_loss: 0.8423, test_loss: 1.1585, test_f1: 0.4725
 epoch: 29, train_loss: 0.8208, test_loss: 1.1610, test_f1: 0.5208
 epoch: 30, train_loss: 0.8397, test_loss: 1.0899, test_f1: 0.4962
 epoch: 31, train_loss: 0.8256, test_loss: 1.1177, test_f1: 0.4952
 epoch: 32, train_loss: 0.8173, test_loss: 1.0382, test_f1: 0.5198
 epoch: 33, train_loss: 0.8127, test_loss: 1.1659, test_f1: 0.4905
 epoch: 34, train_loss: 0.7826, test_loss: 1.1949, test_f1: 0.4940
 epoch: 35, train_loss: 0.8023, test_loss: 1.0153, test_f1: 0.4911
 epoch: 36, train_loss: 0.7888, test_loss: 1.2060, test_f1: 0.4866
 epoch: 37, train_loss: 0.7994, test_loss: 1.1719, test_f1: 0.5245
 epoch: 38, train_loss: 0.7761, test_loss: 1.2142, test_f1: 0.4845
 epoch: 39, train_loss: 0.7755, test_loss: 1.2626, test_f1: 0.4978
 epoch: 40, train_loss: 0.7690, test_loss: 1.1751, test_f1: 0.5327
 epoch: 41, train_loss: 0.7639, test_loss: 1.1970, test_f1: 0.5210
 epoch: 42, train_loss: 0.7729, test_loss: 1.1581, test_f1: 0.5031
 epoch: 43, train_loss: 0.7682, test_loss: 1.2849, test_f1: 0.4756
 epoch: 44, train_loss: 0.7650, test_loss: 1.0348, test_f1: 0.5305
 epoch: 45, train_loss: 0.7446, test_loss: 1.1413, test_f1: 0.5163
 epoch: 46, train_loss: 0.7474, test_loss: 1.1812, test_f1: 0.5179
 epoch: 47, train_loss: 0.7390, test_loss: 1.2086, test_f1: 0.5185
 epoch: 48, train_loss: 0.7200, test_loss: 1.2444, test_f1: 0.5175
 epoch: 49, train_loss: 0.7267, test_loss: 1.1902, test_f1: 0.4864
 epoch: 50, train_loss: 0.7361, test_loss: 1.0782, test_f1: 0.5551
 epoch: 51, train_loss: 0.6870, test_loss: 1.1929, test_f1: 0.5359
 epoch: 52, train_loss: 0.6745, test_loss: 1.1980, test_f1: 0.5483
 epoch: 53, train_loss: 0.6674, test_loss: 1.2024, test_f1: 0.5434
 epoch: 54, train_loss: 0.6543, test_loss: 1.2724, test_f1: 0.5415
 epoch: 55, train_loss: 0.6599, test_loss: 1.2186, test_f1: 0.5475
 epoch: 56, train_loss: 0.6519, test_loss: 1.2178, test_f1: 0.5333
 epoch: 57, train_loss: 0.6343, test_loss: 1.2838, test_f1: 0.5297
 epoch: 58, train_loss: 0.6395, test_loss: 1.2645, test_f1: 0.5374
 epoch: 59, train_loss: 0.6510, test_loss: 1.2570, test_f1: 0.5337
 epoch: 60, train_loss: 0.6242, test_loss: 1.2793, test_f1: 0.5228
 epoch: 61, train_loss: 0.6128, test_loss: 1.2399, test_f1: 0.5456
 epoch: 62, train_loss: 0.6266, test_loss: 1.3234, test_f1: 0.5198
 epoch: 63, train_loss: 0.6150, test_loss: 1.2810, test_f1: 0.5475
 epoch: 64, train_loss: 0.6308, test_loss: 1.2810, test_f1: 0.5165
 epoch: 65, train_loss: 0.6079, test_loss: 1.2399, test_f1: 0.5528
 epoch: 66, train_loss: 0.6298, test_loss: 1.2913, test_f1: 0.5305
 epoch: 67, train_loss: 0.6099, test_loss: 1.2921, test_f1: 0.5465
 epoch: 68, train_loss: 0.6132, test_loss: 1.2761, test_f1: 0.5561
 epoch: 69, train_loss: 0.6047, test_loss: 1.3405, test_f1: 0.5367
 epoch: 70, train_loss: 0.6151, test_loss: 1.2636, test_f1: 0.5473
 epoch: 71, train_loss: 0.5871, test_loss: 1.3147, test_f1: 0.5286
 epoch: 72, train_loss: 0.5850, test_loss: 1.2944, test_f1: 0.5627
 epoch: 73, train_loss: 0.5722, test_loss: 1.3527, test_f1: 0.5474
 epoch: 74, train_loss: 0.5734, test_loss: 1.3011, test_f1: 0.5631
 epoch: 75, train_loss: 0.5706, test_loss: 1.3804, test_f1: 0.5550
 epoch: 76, train_loss: 0.5710, test_loss: 1.3550, test_f1: 0.5528
 epoch: 77, train_loss: 0.5587, test_loss: 1.3919, test_f1: 0.5520
 epoch: 78, train_loss: 0.5618, test_loss: 1.3706, test_f1: 0.5622
 epoch: 79, train_loss: 0.5522, test_loss: 1.3786, test_f1: 0.5433
 epoch: 80, train_loss: 0.5613, test_loss: 1.3795, test_f1: 0.5423
 epoch: 81, train_loss: 0.5501, test_loss: 1.3244, test_f1: 0.5345
 epoch: 82, train_loss: 0.5442, test_loss: 1.3202, test_f1: 0.5920
 epoch: 83, train_loss: 0.5531, test_loss: 1.4289, test_f1: 0.5310
 epoch: 84, train_loss: 0.5180, test_loss: 1.4307, test_f1: 0.5596
 epoch: 85, train_loss: 0.5453, test_loss: 1.3015, test_f1: 0.5628
 epoch: 86, train_loss: 0.5355, test_loss: 1.4310, test_f1: 0.5374
 epoch: 87, train_loss: 0.5297, test_loss: 1.3561, test_f1: 0.5517
 epoch: 88, train_loss: 0.5391, test_loss: 1.3167, test_f1: 0.5683
 epoch: 89, train_loss: 0.5327, test_loss: 1.3975, test_f1: 0.5749
 epoch: 90, train_loss: 0.5280, test_loss: 1.3288, test_f1: 0.5674
 epoch: 91, train_loss: 0.5254, test_loss: 1.2207, test_f1: 0.5519
 epoch: 92, train_loss: 0.5270, test_loss: 1.4561, test_f1: 0.5376
 epoch: 93, train_loss: 0.5223, test_loss: 1.3290, test_f1: 0.5692
 epoch: 94, train_loss: 0.5091, test_loss: 1.4186, test_f1: 0.5499
 epoch: 95, train_loss: 0.5290, test_loss: 1.3607, test_f1: 0.5699
 epoch: 96, train_loss: 0.5311, test_loss: 1.3732, test_f1: 0.5621
 epoch: 97, train_loss: 0.5157, test_loss: 1.3825, test_f1: 0.5747
 epoch: 98, train_loss: 0.4855, test_loss: 1.3406, test_f1: 0.5731
 epoch: 99, train_loss: 0.5168, test_loss: 1.3979, test_f1: 0.5589
##################ITERATION #8 ****************************************
 epoch: 0, train_loss: 1.4657, test_loss: 1.2163, test_f1: 0.3210
 epoch: 1, train_loss: 1.2224, test_loss: 1.1367, test_f1: 0.4503
 epoch: 2, train_loss: 1.1675, test_loss: 1.1194, test_f1: 0.4118
 epoch: 3, train_loss: 1.1497, test_loss: 1.1262, test_f1: 0.3683
 epoch: 4, train_loss: 1.1173, test_loss: 1.2002, test_f1: 0.4005
 epoch: 5, train_loss: 1.1000, test_loss: 1.0883, test_f1: 0.4042
 epoch: 6, train_loss: 1.0919, test_loss: 1.0661, test_f1: 0.4244
 epoch: 7, train_loss: 1.0641, test_loss: 1.0586, test_f1: 0.4380
 epoch: 8, train_loss: 1.0595, test_loss: 1.0450, test_f1: 0.4398
 epoch: 9, train_loss: 1.0330, test_loss: 1.0075, test_f1: 0.4538
 epoch: 10, train_loss: 1.0137, test_loss: 0.9911, test_f1: 0.4868
 epoch: 11, train_loss: 1.0142, test_loss: 0.9565, test_f1: 0.4905
 epoch: 12, train_loss: 0.9866, test_loss: 0.9778, test_f1: 0.4691
 epoch: 13, train_loss: 0.9602, test_loss: 0.9557, test_f1: 0.5137
 epoch: 14, train_loss: 0.9547, test_loss: 0.9678, test_f1: 0.4962
 epoch: 15, train_loss: 0.9385, test_loss: 0.9839, test_f1: 0.5230
 epoch: 16, train_loss: 0.9324, test_loss: 0.9452, test_f1: 0.5217
 epoch: 17, train_loss: 0.9212, test_loss: 0.9541, test_f1: 0.5229
 epoch: 18, train_loss: 0.9035, test_loss: 0.9937, test_f1: 0.5036
 epoch: 19, train_loss: 0.8935, test_loss: 0.9532, test_f1: 0.5295
 epoch: 20, train_loss: 0.8804, test_loss: 0.9578, test_f1: 0.5379
 epoch: 21, train_loss: 0.8826, test_loss: 0.9890, test_f1: 0.5243
 epoch: 22, train_loss: 0.8761, test_loss: 0.9889, test_f1: 0.4986
 epoch: 23, train_loss: 0.8688, test_loss: 1.0526, test_f1: 0.4981
 epoch: 24, train_loss: 0.8472, test_loss: 0.9782, test_f1: 0.5186
 epoch: 25, train_loss: 0.8375, test_loss: 0.9616, test_f1: 0.5175
 epoch: 26, train_loss: 0.8396, test_loss: 0.9709, test_f1: 0.5000
 epoch: 27, train_loss: 0.8363, test_loss: 0.9502, test_f1: 0.5610
 epoch: 28, train_loss: 0.8214, test_loss: 0.9814, test_f1: 0.5234
 epoch: 29, train_loss: 0.8079, test_loss: 1.0457, test_f1: 0.4900
 epoch: 30, train_loss: 0.7961, test_loss: 0.9671, test_f1: 0.5207
 epoch: 31, train_loss: 0.7903, test_loss: 1.0365, test_f1: 0.5085
 epoch: 32, train_loss: 0.8007, test_loss: 1.0620, test_f1: 0.5083
 epoch: 33, train_loss: 0.7896, test_loss: 0.9455, test_f1: 0.5612
 epoch: 34, train_loss: 0.7935, test_loss: 0.9888, test_f1: 0.5434
 epoch: 35, train_loss: 0.7744, test_loss: 1.0333, test_f1: 0.5234
 epoch: 36, train_loss: 0.7543, test_loss: 0.9866, test_f1: 0.5368
 epoch: 37, train_loss: 0.7445, test_loss: 1.1243, test_f1: 0.5079
 epoch: 38, train_loss: 0.7714, test_loss: 0.9705, test_f1: 0.5534
 epoch: 39, train_loss: 0.7542, test_loss: 1.1144, test_f1: 0.5274
 epoch: 40, train_loss: 0.7458, test_loss: 1.0454, test_f1: 0.5228
 epoch: 41, train_loss: 0.7324, test_loss: 1.0265, test_f1: 0.5632
 epoch: 42, train_loss: 0.7269, test_loss: 1.0637, test_f1: 0.5288
 epoch: 43, train_loss: 0.7276, test_loss: 1.0184, test_f1: 0.5340
 epoch: 44, train_loss: 0.7332, test_loss: 1.0667, test_f1: 0.5457
 epoch: 45, train_loss: 0.7057, test_loss: 1.0916, test_f1: 0.5354
 epoch: 46, train_loss: 0.7070, test_loss: 1.1079, test_f1: 0.5408
 epoch: 47, train_loss: 0.7083, test_loss: 1.0686, test_f1: 0.5533
 epoch: 48, train_loss: 0.6990, test_loss: 1.0747, test_f1: 0.5395
 epoch: 49, train_loss: 0.6842, test_loss: 1.1060, test_f1: 0.5341
 epoch: 50, train_loss: 0.6781, test_loss: 1.1602, test_f1: 0.5224
 epoch: 51, train_loss: 0.6460, test_loss: 1.0205, test_f1: 0.5738
 epoch: 52, train_loss: 0.6267, test_loss: 1.1014, test_f1: 0.5509
 epoch: 53, train_loss: 0.6126, test_loss: 1.0995, test_f1: 0.5639
 epoch: 54, train_loss: 0.6116, test_loss: 1.1758, test_f1: 0.5371
 epoch: 55, train_loss: 0.6029, test_loss: 1.1510, test_f1: 0.5602
 epoch: 56, train_loss: 0.5956, test_loss: 1.0911, test_f1: 0.5836
 epoch: 57, train_loss: 0.5943, test_loss: 1.2136, test_f1: 0.5696
 epoch: 58, train_loss: 0.5882, test_loss: 1.1696, test_f1: 0.5721
 epoch: 59, train_loss: 0.5860, test_loss: 1.1872, test_f1: 0.5819
 epoch: 60, train_loss: 0.5922, test_loss: 1.1676, test_f1: 0.5495
 epoch: 61, train_loss: 0.5942, test_loss: 1.1068, test_f1: 0.5712
 epoch: 62, train_loss: 0.5726, test_loss: 1.2211, test_f1: 0.5667
 epoch: 63, train_loss: 0.5581, test_loss: 1.2066, test_f1: 0.5549
 epoch: 64, train_loss: 0.5639, test_loss: 1.2071, test_f1: 0.5460
 epoch: 65, train_loss: 0.5638, test_loss: 1.2777, test_f1: 0.5638
 epoch: 66, train_loss: 0.5555, test_loss: 1.1823, test_f1: 0.5459
 epoch: 67, train_loss: 0.5456, test_loss: 1.2075, test_f1: 0.5569
 epoch: 68, train_loss: 0.5445, test_loss: 1.1458, test_f1: 0.5876
 epoch: 69, train_loss: 0.5468, test_loss: 1.2019, test_f1: 0.5719
 epoch: 70, train_loss: 0.5445, test_loss: 1.1987, test_f1: 0.5644
 epoch: 71, train_loss: 0.5406, test_loss: 1.1610, test_f1: 0.5587
 epoch: 72, train_loss: 0.5259, test_loss: 1.2219, test_f1: 0.5482
 epoch: 73, train_loss: 0.5234, test_loss: 1.3195, test_f1: 0.5426
 epoch: 74, train_loss: 0.5054, test_loss: 1.3292, test_f1: 0.5747
 epoch: 75, train_loss: 0.5207, test_loss: 1.2878, test_f1: 0.5591
 epoch: 76, train_loss: 0.5214, test_loss: 1.3185, test_f1: 0.5715
 epoch: 77, train_loss: 0.5224, test_loss: 1.2230, test_f1: 0.5641
 epoch: 78, train_loss: 0.5156, test_loss: 1.3027, test_f1: 0.5739
 epoch: 79, train_loss: 0.5015, test_loss: 1.2867, test_f1: 0.5924
 epoch: 80, train_loss: 0.5045, test_loss: 1.2479, test_f1: 0.5823
 epoch: 81, train_loss: 0.5120, test_loss: 1.3335, test_f1: 0.5700
 epoch: 82, train_loss: 0.5012, test_loss: 1.2738, test_f1: 0.5777
 epoch: 83, train_loss: 0.4873, test_loss: 1.3108, test_f1: 0.5890
 epoch: 84, train_loss: 0.4833, test_loss: 1.4138, test_f1: 0.5664
 epoch: 85, train_loss: 0.4912, test_loss: 1.4370, test_f1: 0.5681
 epoch: 86, train_loss: 0.4855, test_loss: 1.2740, test_f1: 0.5797
 epoch: 87, train_loss: 0.4696, test_loss: 1.4792, test_f1: 0.5590
 epoch: 88, train_loss: 0.4835, test_loss: 1.3718, test_f1: 0.5841
 epoch: 89, train_loss: 0.6556, test_loss: 1.2647, test_f1: 0.5809
 epoch: 90, train_loss: 0.5366, test_loss: 1.3274, test_f1: 0.5469
 epoch: 91, train_loss: 0.4742, test_loss: 1.2872, test_f1: 0.5504
 epoch: 92, train_loss: 0.4706, test_loss: 1.4019, test_f1: 0.5664
 epoch: 93, train_loss: 0.4833, test_loss: 1.3670, test_f1: 0.5520
 epoch: 94, train_loss: 0.4739, test_loss: 1.3349, test_f1: 0.5814
 epoch: 95, train_loss: 0.4735, test_loss: 1.3722, test_f1: 0.5643
 epoch: 96, train_loss: 0.4569, test_loss: 1.3972, test_f1: 0.5849
 epoch: 97, train_loss: 0.4563, test_loss: 1.4229, test_f1: 0.5537
 epoch: 98, train_loss: 0.4556, test_loss: 1.3970, test_f1: 0.5759
 epoch: 99, train_loss: 0.4385, test_loss: 1.4953, test_f1: 0.5706
##################ITERATION #9 ****************************************
 epoch: 0, train_loss: 1.3737, test_loss: 1.1686, test_f1: 0.4025
 epoch: 1, train_loss: 1.1803, test_loss: 1.1084, test_f1: 0.4189
 epoch: 2, train_loss: 1.1434, test_loss: 1.0715, test_f1: 0.4319
 epoch: 3, train_loss: 1.0978, test_loss: 1.0368, test_f1: 0.4379
 epoch: 4, train_loss: 1.0770, test_loss: 1.0246, test_f1: 0.4657
 epoch: 5, train_loss: 1.0532, test_loss: 0.9853, test_f1: 0.4649
 epoch: 6, train_loss: 1.0340, test_loss: 0.9971, test_f1: 0.4684
 epoch: 7, train_loss: 1.0289, test_loss: 0.9753, test_f1: 0.4785
 epoch: 8, train_loss: 1.0098, test_loss: 0.9486, test_f1: 0.4521
 epoch: 9, train_loss: 0.9848, test_loss: 0.9691, test_f1: 0.4619
 epoch: 10, train_loss: 0.9641, test_loss: 0.9680, test_f1: 0.4761
 epoch: 11, train_loss: 0.9532, test_loss: 0.9295, test_f1: 0.4844
 epoch: 12, train_loss: 0.9533, test_loss: 1.0218, test_f1: 0.4451
 epoch: 13, train_loss: 0.9272, test_loss: 0.9816, test_f1: 0.4765
 epoch: 14, train_loss: 0.9257, test_loss: 1.0027, test_f1: 0.4570
 epoch: 15, train_loss: 0.9186, test_loss: 0.9384, test_f1: 0.4865
 epoch: 16, train_loss: 0.9066, test_loss: 0.9531, test_f1: 0.4947
 epoch: 17, train_loss: 0.8859, test_loss: 0.9327, test_f1: 0.4767
 epoch: 18, train_loss: 0.8779, test_loss: 0.9532, test_f1: 0.4889
 epoch: 19, train_loss: 0.8584, test_loss: 0.9492, test_f1: 0.5253
 epoch: 20, train_loss: 0.8762, test_loss: 0.9569, test_f1: 0.4864
 epoch: 21, train_loss: 0.8514, test_loss: 0.9457, test_f1: 0.5136
 epoch: 22, train_loss: 0.8499, test_loss: 0.9622, test_f1: 0.5179
 epoch: 23, train_loss: 0.8494, test_loss: 0.9459, test_f1: 0.5277
 epoch: 24, train_loss: 0.8160, test_loss: 1.1932, test_f1: 0.4558
 epoch: 25, train_loss: 0.8134, test_loss: 1.0248, test_f1: 0.5337
 epoch: 26, train_loss: 0.8017, test_loss: 1.0208, test_f1: 0.5349
 epoch: 27, train_loss: 0.8261, test_loss: 1.0277, test_f1: 0.4823
 epoch: 28, train_loss: 0.8080, test_loss: 1.0236, test_f1: 0.5080
 epoch: 29, train_loss: 0.8027, test_loss: 1.0797, test_f1: 0.5065
 epoch: 30, train_loss: 0.7929, test_loss: 1.0983, test_f1: 0.5212
 epoch: 31, train_loss: 0.8028, test_loss: 1.0152, test_f1: 0.5246
 epoch: 32, train_loss: 0.7767, test_loss: 1.0983, test_f1: 0.5237
 epoch: 33, train_loss: 0.7848, test_loss: 1.0550, test_f1: 0.5374
 epoch: 34, train_loss: 0.7857, test_loss: 1.0533, test_f1: 0.5175
 epoch: 35, train_loss: 0.7708, test_loss: 1.0808, test_f1: 0.5352
 epoch: 36, train_loss: 0.7517, test_loss: 1.0250, test_f1: 0.5313
 epoch: 37, train_loss: 0.7543, test_loss: 1.1113, test_f1: 0.5111
 epoch: 38, train_loss: 0.7535, test_loss: 1.1364, test_f1: 0.5276
 epoch: 39, train_loss: 0.7528, test_loss: 1.1340, test_f1: 0.5074
 epoch: 40, train_loss: 0.7372, test_loss: 1.1165, test_f1: 0.5355
 epoch: 41, train_loss: 0.7124, test_loss: 1.2569, test_f1: 0.5247
 epoch: 42, train_loss: 0.7685, test_loss: 1.1277, test_f1: 0.5266
 epoch: 43, train_loss: 0.7266, test_loss: 1.1785, test_f1: 0.5178
 epoch: 44, train_loss: 0.7034, test_loss: 1.3182, test_f1: 0.5117
 epoch: 45, train_loss: 0.7070, test_loss: 1.3369, test_f1: 0.5203
 epoch: 46, train_loss: 0.7042, test_loss: 1.1160, test_f1: 0.5272
 epoch: 47, train_loss: 0.7016, test_loss: 1.1644, test_f1: 0.5590
 epoch: 48, train_loss: 0.7076, test_loss: 1.1083, test_f1: 0.5523
 epoch: 49, train_loss: 0.6965, test_loss: 1.1734, test_f1: 0.5268
 epoch: 50, train_loss: 0.6886, test_loss: 1.1331, test_f1: 0.5412
 epoch: 51, train_loss: 0.6640, test_loss: 1.1754, test_f1: 0.5448
 epoch: 52, train_loss: 0.6302, test_loss: 1.2033, test_f1: 0.5331
 epoch: 53, train_loss: 0.6189, test_loss: 1.3594, test_f1: 0.5078
 epoch: 54, train_loss: 0.6041, test_loss: 1.3765, test_f1: 0.5286
 epoch: 55, train_loss: 0.6148, test_loss: 1.2272, test_f1: 0.5400
 epoch: 56, train_loss: 0.6067, test_loss: 1.2330, test_f1: 0.5426
 epoch: 57, train_loss: 0.6249, test_loss: 1.3286, test_f1: 0.5210
 epoch: 58, train_loss: 0.5874, test_loss: 1.2704, test_f1: 0.5447
 epoch: 59, train_loss: 0.5975, test_loss: 1.2926, test_f1: 0.5327
 epoch: 60, train_loss: 0.5792, test_loss: 1.3029, test_f1: 0.5493
 epoch: 61, train_loss: 0.5927, test_loss: 1.2955, test_f1: 0.5302
 epoch: 62, train_loss: 0.5799, test_loss: 1.3448, test_f1: 0.5224
 epoch: 63, train_loss: 0.5919, test_loss: 1.3868, test_f1: 0.5273
 epoch: 64, train_loss: 0.5905, test_loss: 1.4251, test_f1: 0.5157
 epoch: 65, train_loss: 0.5716, test_loss: 1.3916, test_f1: 0.5237
 epoch: 66, train_loss: 0.5858, test_loss: 1.3103, test_f1: 0.5475
 epoch: 67, train_loss: 0.5600, test_loss: 1.3537, test_f1: 0.5416
 epoch: 68, train_loss: 0.5599, test_loss: 1.3720, test_f1: 0.5366
 epoch: 69, train_loss: 0.5583, test_loss: 1.4324, test_f1: 0.5410
 epoch: 70, train_loss: 0.5556, test_loss: 1.3909, test_f1: 0.5369
 epoch: 71, train_loss: 0.5491, test_loss: 1.4815, test_f1: 0.5288
 epoch: 72, train_loss: 0.5520, test_loss: 1.3570, test_f1: 0.5480
 epoch: 73, train_loss: 0.5423, test_loss: 1.4932, test_f1: 0.5252
 epoch: 74, train_loss: 0.5322, test_loss: 1.4589, test_f1: 0.5328
 epoch: 75, train_loss: 0.5240, test_loss: 1.4769, test_f1: 0.5377
 epoch: 76, train_loss: 0.5207, test_loss: 1.4782, test_f1: 0.5355
 epoch: 77, train_loss: 0.5383, test_loss: 1.4356, test_f1: 0.5283
 epoch: 78, train_loss: 0.5441, test_loss: 1.4007, test_f1: 0.5477
 epoch: 79, train_loss: 0.5286, test_loss: 1.4486, test_f1: 0.5560
 epoch: 80, train_loss: 0.5222, test_loss: 1.4871, test_f1: 0.5561
 epoch: 81, train_loss: 0.5171, test_loss: 1.5395, test_f1: 0.5282
 epoch: 82, train_loss: 0.5207, test_loss: 1.5516, test_f1: 0.5306
 epoch: 83, train_loss: 0.5091, test_loss: 1.5334, test_f1: 0.5427
 epoch: 84, train_loss: 0.5129, test_loss: 1.5999, test_f1: 0.5173
 epoch: 85, train_loss: 0.5094, test_loss: 1.5894, test_f1: 0.5391
 epoch: 86, train_loss: 0.5168, test_loss: 1.4998, test_f1: 0.5254
 epoch: 87, train_loss: 0.4904, test_loss: 1.4454, test_f1: 0.5355
 epoch: 88, train_loss: 0.4721, test_loss: 1.4915, test_f1: 0.5383
 epoch: 89, train_loss: 0.4938, test_loss: 1.5349, test_f1: 0.5393
 epoch: 90, train_loss: 0.4935, test_loss: 1.5801, test_f1: 0.5382
 epoch: 91, train_loss: 0.4924, test_loss: 1.5813, test_f1: 0.5314
 epoch: 92, train_loss: 0.4960, test_loss: 1.5775, test_f1: 0.5199
 epoch: 93, train_loss: 0.4936, test_loss: 1.4736, test_f1: 0.5528
 epoch: 94, train_loss: 0.4822, test_loss: 1.5111, test_f1: 0.5688
 epoch: 95, train_loss: 0.4733, test_loss: 1.5609, test_f1: 0.5458
 epoch: 96, train_loss: 0.4636, test_loss: 1.5479, test_f1: 0.5262
 epoch: 97, train_loss: 0.4596, test_loss: 1.5808, test_f1: 0.5540
 epoch: 98, train_loss: 0.4664, test_loss: 1.6260, test_f1: 0.5446
 epoch: 99, train_loss: 0.4539, test_loss: 1.6806, test_f1: 0.5525

Training completed in 883.39 seconds
Best F1: 0.5944 at epoch 29
Mean F1 across iterations: 0.5806  0.0114
========================FINAL RESULTS================================
FEGIN weighted F1: 0.5944  0.0114
python main.py --data ltspice_examples --representation component_component --model FEGIN --layers 6 --hiddens 64 --batch_size 64 --lr 0.001 --emb_size 512 --epochs 100 --save_appendix component_component_L6_H64_BS64_LR0.001_E512 --no_val
-----



STDERR:
  File "main.py", line 370, in <module>
    main()
  File "main.py", line 254, in main
    dataset = dataset_class(
  File "/home/philip/projects/ltspice_examples_code_repo/Circuit-Completion-Using-GNNs/component_classification_with_link_prediction_head/evaluation/FEGIN/kernel/circuit_datasets.py", line 15, in __init__
    self.data, self.slices = torch.load(self.processed_paths[0])
  File "/home/philip/.local/lib/python3.8/site-packages/torch/serialization.py", line 1040, in load
    warnings.warn(
  File "/usr/lib/python3.8/warnings.py", line 109, in _showwarnmsg
    sw(msg.message, msg.category, msg.filename, msg.lineno,
  File "main.py", line 47, in warn_with_traceback
    traceback.print_stack(file=log)
/home/philip/projects/ltspice_examples_code_repo/Circuit-Completion-Using-GNNs/component_classification_with_link_prediction_head/evaluation/FEGIN/kernel/circuit_datasets.py:15: FutureWarning: You are using `torch.load` with `weights_only=False` (the current default value), which uses the default pickle module implicitly. It is possible to construct malicious pickle data which will execute arbitrary code during unpickling (See https://github.com/pytorch/pytorch/blob/main/SECURITY.md#untrusted-models for more details). In a future release, the default value for `weights_only` will be flipped to `True`. This limits the functions that could be executed during unpickling. Arbitrary objects will no longer be allowed to be loaded via this mode unless they are explicitly allowlisted by the user via `torch.serialization.add_safe_globals`. We recommend you start setting `weights_only=True` for any use case where you don't have full control of the loaded file. Please open an issue on GitHub for any issues related to this experimental feature.
  self.data, self.slices = torch.load(self.processed_paths[0])
