STDOUT:
Results will be saved in /home/philip/projects/ltspice_examples_code_repo/Circuit-Completion-Using-GNNs/component_classification_with_link_prediction_head/evaluation/FEGIN/results/model_FEGIN_dataset_ltspice_examples
Command line input: python main.py --data ltspice_examples --representation component_net --model FEGIN --layers 5 --hiddens 128 --batch_size 64 --lr 0.001 --emb_size 250 --epochs 100 --save_appendix component_net_L5_H128_BS64_LR0.001_E250 --no_val
 is saved.
-----
ltspice_examples - FEGIN
Using 5 layers, 128 hidden units, h = 2
Loading component_net representation dataset
ENTERED
Training FEGIN on component_net representation
Train: 3558, Test: 846
##################ITERATION #0 ****************************************
 epoch: 0, train_loss: 1.1975, test_loss: 1.0828, test_f1: 0.4219
 epoch: 1, train_loss: 0.9925, test_loss: 1.0170, test_f1: 0.4918
 epoch: 2, train_loss: 0.9543, test_loss: 0.9471, test_f1: 0.5348
 epoch: 3, train_loss: 0.9168, test_loss: 0.9148, test_f1: 0.5362
 epoch: 4, train_loss: 0.8901, test_loss: 0.8654, test_f1: 0.5818
 epoch: 5, train_loss: 0.8670, test_loss: 0.9690, test_f1: 0.5198
 epoch: 6, train_loss: 0.8565, test_loss: 0.8753, test_f1: 0.5854
 epoch: 7, train_loss: 0.8431, test_loss: 0.9285, test_f1: 0.5759
 epoch: 8, train_loss: 0.8195, test_loss: 0.8437, test_f1: 0.5820
 epoch: 9, train_loss: 0.8223, test_loss: 0.9900, test_f1: 0.5525
 epoch: 10, train_loss: 0.8129, test_loss: 0.9439, test_f1: 0.6052
 epoch: 11, train_loss: 0.8015, test_loss: 1.0111, test_f1: 0.5225
 epoch: 12, train_loss: 0.7844, test_loss: 0.9453, test_f1: 0.5883
 epoch: 13, train_loss: 0.7573, test_loss: 0.9543, test_f1: 0.6039
 epoch: 14, train_loss: 0.7726, test_loss: 0.9795, test_f1: 0.5802
 epoch: 15, train_loss: 0.7628, test_loss: 0.8759, test_f1: 0.5715
 epoch: 16, train_loss: 0.7349, test_loss: 0.9611, test_f1: 0.5853
 epoch: 17, train_loss: 0.7240, test_loss: 0.9956, test_f1: 0.5832
 epoch: 18, train_loss: 0.7076, test_loss: 0.9680, test_f1: 0.6540
 epoch: 19, train_loss: 0.7037, test_loss: 0.9554, test_f1: 0.6191
 epoch: 20, train_loss: 0.6973, test_loss: 0.9768, test_f1: 0.6243
 epoch: 21, train_loss: 0.6854, test_loss: 1.0590, test_f1: 0.6115
 epoch: 22, train_loss: 0.6826, test_loss: 0.9649, test_f1: 0.6159
 epoch: 23, train_loss: 0.6776, test_loss: 0.9177, test_f1: 0.6348
 epoch: 24, train_loss: 0.6579, test_loss: 1.0466, test_f1: 0.6006
 epoch: 25, train_loss: 0.6587, test_loss: 1.0957, test_f1: 0.6145
 epoch: 26, train_loss: 0.6336, test_loss: 0.9753, test_f1: 0.6180
 epoch: 27, train_loss: 0.6157, test_loss: 0.9616, test_f1: 0.6357
 epoch: 28, train_loss: 0.5948, test_loss: 1.0112, test_f1: 0.6140
 epoch: 29, train_loss: 0.5901, test_loss: 0.9505, test_f1: 0.6210
 epoch: 30, train_loss: 0.6210, test_loss: 0.9590, test_f1: 0.6376
 epoch: 31, train_loss: 0.5880, test_loss: 1.0085, test_f1: 0.6618
 epoch: 32, train_loss: 0.5445, test_loss: 1.1393, test_f1: 0.6289
 epoch: 33, train_loss: 0.5565, test_loss: 1.1417, test_f1: 0.6194
 epoch: 34, train_loss: 0.5323, test_loss: 1.0699, test_f1: 0.6353
 epoch: 35, train_loss: 0.5568, test_loss: 1.1157, test_f1: 0.6321
 epoch: 36, train_loss: 0.5199, test_loss: 0.9917, test_f1: 0.6461
 epoch: 37, train_loss: 0.5252, test_loss: 1.0099, test_f1: 0.6701
 epoch: 38, train_loss: 0.4883, test_loss: 1.2072, test_f1: 0.6383
 epoch: 39, train_loss: 0.5107, test_loss: 1.2093, test_f1: 0.6684
 epoch: 40, train_loss: 0.5085, test_loss: 1.1358, test_f1: 0.6181
 epoch: 41, train_loss: 0.4839, test_loss: 1.1731, test_f1: 0.6342
 epoch: 42, train_loss: 0.4810, test_loss: 1.1982, test_f1: 0.6305
 epoch: 43, train_loss: 0.4482, test_loss: 1.2605, test_f1: 0.6178
 epoch: 44, train_loss: 0.4611, test_loss: 1.1980, test_f1: 0.6306
 epoch: 45, train_loss: 0.4890, test_loss: 1.1184, test_f1: 0.6605
 epoch: 46, train_loss: 0.4454, test_loss: 1.2151, test_f1: 0.6848
 epoch: 47, train_loss: 0.4238, test_loss: 1.2348, test_f1: 0.6457
 epoch: 48, train_loss: 0.4107, test_loss: 1.4817, test_f1: 0.6148
 epoch: 49, train_loss: 0.4088, test_loss: 1.2441, test_f1: 0.6820
 epoch: 50, train_loss: 0.4201, test_loss: 1.4148, test_f1: 0.6456
 epoch: 51, train_loss: 0.3401, test_loss: 1.4418, test_f1: 0.6412
 epoch: 52, train_loss: 0.3261, test_loss: 1.5443, test_f1: 0.6470
 epoch: 53, train_loss: 0.3080, test_loss: 1.5374, test_f1: 0.6552
 epoch: 54, train_loss: 0.3116, test_loss: 1.6647, test_f1: 0.6503
 epoch: 55, train_loss: 0.3205, test_loss: 1.6322, test_f1: 0.6375
 epoch: 56, train_loss: 0.2944, test_loss: 1.7058, test_f1: 0.6294
 epoch: 57, train_loss: 0.3016, test_loss: 1.6579, test_f1: 0.6560
 epoch: 58, train_loss: 0.2953, test_loss: 1.5848, test_f1: 0.6500
 epoch: 59, train_loss: 0.2803, test_loss: 1.7325, test_f1: 0.6414
 epoch: 60, train_loss: 0.2571, test_loss: 1.7555, test_f1: 0.6594
 epoch: 61, train_loss: 0.2648, test_loss: 1.6803, test_f1: 0.6461
 epoch: 62, train_loss: 0.2894, test_loss: 1.7932, test_f1: 0.6515
 epoch: 63, train_loss: 0.2613, test_loss: 1.8764, test_f1: 0.6403
 epoch: 64, train_loss: 0.2569, test_loss: 1.8392, test_f1: 0.6556
 epoch: 65, train_loss: 0.2534, test_loss: 2.0127, test_f1: 0.6418
 epoch: 66, train_loss: 0.2581, test_loss: 1.8529, test_f1: 0.6521
 epoch: 67, train_loss: 0.2341, test_loss: 2.0473, test_f1: 0.6544
 epoch: 68, train_loss: 0.2569, test_loss: 1.9356, test_f1: 0.6626
 epoch: 69, train_loss: 0.2460, test_loss: 1.9570, test_f1: 0.6368
 epoch: 70, train_loss: 0.2349, test_loss: 2.1065, test_f1: 0.6614
 epoch: 71, train_loss: 0.2300, test_loss: 1.9669, test_f1: 0.6483
 epoch: 72, train_loss: 0.2169, test_loss: 2.0735, test_f1: 0.6466
 epoch: 73, train_loss: 0.2083, test_loss: 2.1247, test_f1: 0.6566
 epoch: 74, train_loss: 0.2391, test_loss: 2.0027, test_f1: 0.6560
 epoch: 75, train_loss: 0.2203, test_loss: 2.0990, test_f1: 0.6612
 epoch: 76, train_loss: 0.2017, test_loss: 2.1125, test_f1: 0.6563
 epoch: 77, train_loss: 0.1973, test_loss: 2.1748, test_f1: 0.6359
 epoch: 78, train_loss: 0.2004, test_loss: 2.2311, test_f1: 0.6558
 epoch: 79, train_loss: 0.1973, test_loss: 2.3270, test_f1: 0.6694
 epoch: 80, train_loss: 0.2026, test_loss: 2.4733, test_f1: 0.6575
 epoch: 81, train_loss: 0.2006, test_loss: 2.2750, test_f1: 0.6658
 epoch: 82, train_loss: 0.2049, test_loss: 2.3498, test_f1: 0.6342
 epoch: 83, train_loss: 0.1984, test_loss: 2.6103, test_f1: 0.6349
 epoch: 84, train_loss: 0.2064, test_loss: 2.2874, test_f1: 0.6434
 epoch: 85, train_loss: 0.2047, test_loss: 2.3502, test_f1: 0.6571
 epoch: 86, train_loss: 0.1977, test_loss: 2.5129, test_f1: 0.6317
 epoch: 87, train_loss: 0.2033, test_loss: 2.3639, test_f1: 0.6627
 epoch: 88, train_loss: 0.1807, test_loss: 2.5854, test_f1: 0.6430
 epoch: 89, train_loss: 0.1942, test_loss: 2.6629, test_f1: 0.6385
 epoch: 90, train_loss: 0.1996, test_loss: 2.4192, test_f1: 0.6503
 epoch: 91, train_loss: 0.1972, test_loss: 2.4508, test_f1: 0.6391
 epoch: 92, train_loss: 0.1925, test_loss: 2.5059, test_f1: 0.6649
 epoch: 93, train_loss: 0.1955, test_loss: 2.3403, test_f1: 0.6701
 epoch: 94, train_loss: 0.1791, test_loss: 2.2457, test_f1: 0.6560
 epoch: 95, train_loss: 0.1592, test_loss: 2.4254, test_f1: 0.6443
 epoch: 96, train_loss: 0.1832, test_loss: 2.4728, test_f1: 0.6387
 epoch: 97, train_loss: 0.1743, test_loss: 2.5093, test_f1: 0.6537
 epoch: 98, train_loss: 0.1564, test_loss: 2.8621, test_f1: 0.6506
 epoch: 99, train_loss: 0.1903, test_loss: 2.6206, test_f1: 0.6338
##################ITERATION #1 ****************************************
 epoch: 0, train_loss: 1.1266, test_loss: 1.0318, test_f1: 0.4329
 epoch: 1, train_loss: 0.9818, test_loss: 0.9661, test_f1: 0.5182
 epoch: 2, train_loss: 0.9408, test_loss: 0.9410, test_f1: 0.5074
 epoch: 3, train_loss: 0.9049, test_loss: 0.9327, test_f1: 0.5240
 epoch: 4, train_loss: 0.8856, test_loss: 0.9479, test_f1: 0.5740
 epoch: 5, train_loss: 0.8764, test_loss: 0.9589, test_f1: 0.5005
 epoch: 6, train_loss: 0.8531, test_loss: 0.9701, test_f1: 0.5657
 epoch: 7, train_loss: 0.8329, test_loss: 0.9149, test_f1: 0.6051
 epoch: 8, train_loss: 0.8169, test_loss: 0.9399, test_f1: 0.6094
 epoch: 9, train_loss: 0.8217, test_loss: 0.9484, test_f1: 0.6144
 epoch: 10, train_loss: 0.7989, test_loss: 0.9634, test_f1: 0.5438
 epoch: 11, train_loss: 0.7736, test_loss: 0.9782, test_f1: 0.6008
 epoch: 12, train_loss: 0.7741, test_loss: 1.0081, test_f1: 0.5715
 epoch: 13, train_loss: 0.7681, test_loss: 0.9273, test_f1: 0.6066
 epoch: 14, train_loss: 0.7488, test_loss: 0.9767, test_f1: 0.5680
 epoch: 15, train_loss: 0.7455, test_loss: 0.9536, test_f1: 0.5767
 epoch: 16, train_loss: 0.7325, test_loss: 0.9376, test_f1: 0.6105
 epoch: 17, train_loss: 0.7348, test_loss: 1.0243, test_f1: 0.6234
 epoch: 18, train_loss: 0.7135, test_loss: 0.9837, test_f1: 0.6313
 epoch: 19, train_loss: 0.6983, test_loss: 1.0437, test_f1: 0.6307
 epoch: 20, train_loss: 0.6963, test_loss: 0.9866, test_f1: 0.6232
 epoch: 21, train_loss: 0.6848, test_loss: 1.1414, test_f1: 0.5580
 epoch: 22, train_loss: 0.6791, test_loss: 1.0684, test_f1: 0.6059
 epoch: 23, train_loss: 0.6608, test_loss: 1.0363, test_f1: 0.6160
 epoch: 24, train_loss: 0.6531, test_loss: 0.9875, test_f1: 0.5833
 epoch: 25, train_loss: 0.6468, test_loss: 0.9860, test_f1: 0.6439
 epoch: 26, train_loss: 0.6386, test_loss: 0.9488, test_f1: 0.6392
 epoch: 27, train_loss: 0.6257, test_loss: 1.0578, test_f1: 0.5914
 epoch: 28, train_loss: 0.6175, test_loss: 1.0180, test_f1: 0.6489
 epoch: 29, train_loss: 0.6102, test_loss: 1.0121, test_f1: 0.6195
 epoch: 30, train_loss: 0.6104, test_loss: 1.0788, test_f1: 0.6385
 epoch: 31, train_loss: 0.6077, test_loss: 1.0793, test_f1: 0.6337
 epoch: 32, train_loss: 0.5797, test_loss: 1.0507, test_f1: 0.6573
 epoch: 33, train_loss: 0.5813, test_loss: 1.1073, test_f1: 0.6349
 epoch: 34, train_loss: 0.5721, test_loss: 1.3405, test_f1: 0.5690
 epoch: 35, train_loss: 0.5471, test_loss: 1.0993, test_f1: 0.6515
 epoch: 36, train_loss: 0.5488, test_loss: 1.1394, test_f1: 0.6438
 epoch: 37, train_loss: 0.5220, test_loss: 1.0760, test_f1: 0.6168
 epoch: 38, train_loss: 0.5285, test_loss: 1.0312, test_f1: 0.6678
 epoch: 39, train_loss: 0.5010, test_loss: 1.1568, test_f1: 0.6434
 epoch: 40, train_loss: 0.5195, test_loss: 1.0575, test_f1: 0.6672
 epoch: 41, train_loss: 0.4909, test_loss: 1.1469, test_f1: 0.6290
 epoch: 42, train_loss: 0.4995, test_loss: 1.1083, test_f1: 0.6594
 epoch: 43, train_loss: 0.4660, test_loss: 1.2125, test_f1: 0.6499
 epoch: 44, train_loss: 0.4778, test_loss: 1.1357, test_f1: 0.6694
 epoch: 45, train_loss: 0.4439, test_loss: 1.2080, test_f1: 0.6516
 epoch: 46, train_loss: 0.4438, test_loss: 1.2107, test_f1: 0.6434
 epoch: 47, train_loss: 0.4595, test_loss: 1.2629, test_f1: 0.6437
 epoch: 48, train_loss: 0.4299, test_loss: 1.3931, test_f1: 0.6197
 epoch: 49, train_loss: 0.4315, test_loss: 1.3663, test_f1: 0.6621
 epoch: 50, train_loss: 0.4430, test_loss: 1.4060, test_f1: 0.6313
 epoch: 51, train_loss: 0.3928, test_loss: 1.2960, test_f1: 0.6632
 epoch: 52, train_loss: 0.3642, test_loss: 1.4338, test_f1: 0.6266
 epoch: 53, train_loss: 0.3454, test_loss: 1.4886, test_f1: 0.6212
 epoch: 54, train_loss: 0.3491, test_loss: 1.4687, test_f1: 0.6380
 epoch: 55, train_loss: 0.3205, test_loss: 1.4563, test_f1: 0.6566
 epoch: 56, train_loss: 0.3051, test_loss: 1.5591, test_f1: 0.6182
 epoch: 57, train_loss: 0.3176, test_loss: 1.5565, test_f1: 0.6328
 epoch: 58, train_loss: 0.3177, test_loss: 1.4859, test_f1: 0.6432
 epoch: 59, train_loss: 0.3011, test_loss: 1.5569, test_f1: 0.6386
 epoch: 60, train_loss: 0.3055, test_loss: 1.6094, test_f1: 0.6192
 epoch: 61, train_loss: 0.2968, test_loss: 1.6664, test_f1: 0.6496
 epoch: 62, train_loss: 0.3043, test_loss: 1.7790, test_f1: 0.6175
 epoch: 63, train_loss: 0.2791, test_loss: 1.7497, test_f1: 0.6217
 epoch: 64, train_loss: 0.2804, test_loss: 1.7275, test_f1: 0.6426
 epoch: 65, train_loss: 0.2724, test_loss: 1.6803, test_f1: 0.6417
 epoch: 66, train_loss: 0.2913, test_loss: 1.7255, test_f1: 0.6174
 epoch: 67, train_loss: 0.2631, test_loss: 1.6843, test_f1: 0.6704
 epoch: 68, train_loss: 0.2836, test_loss: 1.7652, test_f1: 0.6372
 epoch: 69, train_loss: 0.2470, test_loss: 1.7401, test_f1: 0.6368
 epoch: 70, train_loss: 0.2449, test_loss: 1.7023, test_f1: 0.6251
 epoch: 71, train_loss: 0.2635, test_loss: 1.8086, test_f1: 0.6303
 epoch: 72, train_loss: 0.2358, test_loss: 1.8907, test_f1: 0.6165
 epoch: 73, train_loss: 0.2360, test_loss: 1.8976, test_f1: 0.6410
 epoch: 74, train_loss: 0.2322, test_loss: 1.9069, test_f1: 0.6278
 epoch: 75, train_loss: 0.2435, test_loss: 1.9674, test_f1: 0.6320
 epoch: 76, train_loss: 0.2513, test_loss: 1.9471, test_f1: 0.6097
 epoch: 77, train_loss: 0.2241, test_loss: 1.9794, test_f1: 0.6137
 epoch: 78, train_loss: 0.2211, test_loss: 2.0299, test_f1: 0.6083
 epoch: 79, train_loss: 0.2331, test_loss: 2.0020, test_f1: 0.6161
 epoch: 80, train_loss: 0.2345, test_loss: 2.0092, test_f1: 0.6495
 epoch: 81, train_loss: 0.2205, test_loss: 1.9944, test_f1: 0.6155
 epoch: 82, train_loss: 0.2050, test_loss: 2.0637, test_f1: 0.6232
 epoch: 83, train_loss: 0.2131, test_loss: 2.0241, test_f1: 0.6116
 epoch: 84, train_loss: 0.2034, test_loss: 2.1073, test_f1: 0.6155
 epoch: 85, train_loss: 0.2162, test_loss: 2.2038, test_f1: 0.6316
 epoch: 86, train_loss: 0.2049, test_loss: 2.1987, test_f1: 0.6226
 epoch: 87, train_loss: 0.2131, test_loss: 2.1310, test_f1: 0.6114
 epoch: 88, train_loss: 0.2051, test_loss: 2.2671, test_f1: 0.6033
 epoch: 89, train_loss: 0.2007, test_loss: 2.1749, test_f1: 0.6143
 epoch: 90, train_loss: 0.2050, test_loss: 2.2823, test_f1: 0.6023
 epoch: 91, train_loss: 0.2176, test_loss: 2.1449, test_f1: 0.6305
 epoch: 92, train_loss: 0.2222, test_loss: 2.1265, test_f1: 0.6283
 epoch: 93, train_loss: 0.1896, test_loss: 2.2809, test_f1: 0.6239
 epoch: 94, train_loss: 0.1900, test_loss: 2.2010, test_f1: 0.6372
 epoch: 95, train_loss: 0.2007, test_loss: 2.3240, test_f1: 0.6005
 epoch: 96, train_loss: 0.2258, test_loss: 2.2232, test_f1: 0.6235
 epoch: 97, train_loss: 0.1866, test_loss: 2.2648, test_f1: 0.5954
 epoch: 98, train_loss: 0.1858, test_loss: 2.3087, test_f1: 0.6314
 epoch: 99, train_loss: 0.1811, test_loss: 2.3056, test_f1: 0.6216
##################ITERATION #2 ****************************************
 epoch: 0, train_loss: 1.1756, test_loss: 1.0096, test_f1: 0.4448
 epoch: 1, train_loss: 0.9787, test_loss: 0.9800, test_f1: 0.5239
 epoch: 2, train_loss: 0.9484, test_loss: 0.9719, test_f1: 0.5090
 epoch: 3, train_loss: 0.9230, test_loss: 0.9218, test_f1: 0.5063
 epoch: 4, train_loss: 0.8966, test_loss: 0.9592, test_f1: 0.5074
 epoch: 5, train_loss: 0.8923, test_loss: 0.9372, test_f1: 0.5231
 epoch: 6, train_loss: 0.8634, test_loss: 0.9694, test_f1: 0.5356
 epoch: 7, train_loss: 0.8557, test_loss: 0.9346, test_f1: 0.5541
 epoch: 8, train_loss: 0.8381, test_loss: 0.9738, test_f1: 0.5521
 epoch: 9, train_loss: 0.8342, test_loss: 0.9581, test_f1: 0.5701
 epoch: 10, train_loss: 0.8121, test_loss: 0.9700, test_f1: 0.5832
 epoch: 11, train_loss: 0.8058, test_loss: 0.9859, test_f1: 0.5737
 epoch: 12, train_loss: 0.7988, test_loss: 0.9590, test_f1: 0.5368
 epoch: 13, train_loss: 0.7654, test_loss: 0.9407, test_f1: 0.5929
 epoch: 14, train_loss: 0.7745, test_loss: 0.9600, test_f1: 0.5419
 epoch: 15, train_loss: 0.7668, test_loss: 0.9709, test_f1: 0.5945
 epoch: 16, train_loss: 0.7523, test_loss: 0.9717, test_f1: 0.5782
 epoch: 17, train_loss: 0.7518, test_loss: 0.9776, test_f1: 0.5476
 epoch: 18, train_loss: 0.7360, test_loss: 0.9578, test_f1: 0.5842
 epoch: 19, train_loss: 0.7184, test_loss: 0.9780, test_f1: 0.6077
 epoch: 20, train_loss: 0.7426, test_loss: 0.9960, test_f1: 0.5995
 epoch: 21, train_loss: 0.7060, test_loss: 1.0657, test_f1: 0.5773
 epoch: 22, train_loss: 0.7003, test_loss: 0.9468, test_f1: 0.5835
 epoch: 23, train_loss: 0.7045, test_loss: 1.0717, test_f1: 0.5910
 epoch: 24, train_loss: 0.7039, test_loss: 0.9801, test_f1: 0.5620
 epoch: 25, train_loss: 0.6742, test_loss: 0.9769, test_f1: 0.6177
 epoch: 26, train_loss: 0.6765, test_loss: 0.9564, test_f1: 0.5684
 epoch: 27, train_loss: 0.6657, test_loss: 0.9752, test_f1: 0.6190
 epoch: 28, train_loss: 0.6557, test_loss: 0.9802, test_f1: 0.6396
 epoch: 29, train_loss: 0.6278, test_loss: 0.9658, test_f1: 0.6352
 epoch: 30, train_loss: 0.6363, test_loss: 1.0500, test_f1: 0.6157
 epoch: 31, train_loss: 0.6116, test_loss: 1.0207, test_f1: 0.6281
 epoch: 32, train_loss: 0.5996, test_loss: 1.0252, test_f1: 0.6243
 epoch: 33, train_loss: 0.5844, test_loss: 1.1232, test_f1: 0.6372
 epoch: 34, train_loss: 0.5917, test_loss: 1.0037, test_f1: 0.6363
 epoch: 35, train_loss: 0.5691, test_loss: 1.0269, test_f1: 0.6119
 epoch: 36, train_loss: 0.5639, test_loss: 1.0085, test_f1: 0.6506
 epoch: 37, train_loss: 0.5810, test_loss: 1.0538, test_f1: 0.6291
 epoch: 38, train_loss: 0.5467, test_loss: 1.1312, test_f1: 0.5866
 epoch: 39, train_loss: 0.5531, test_loss: 1.2022, test_f1: 0.6306
 epoch: 40, train_loss: 0.5457, test_loss: 1.0681, test_f1: 0.6323
 epoch: 41, train_loss: 0.5302, test_loss: 1.1345, test_f1: 0.6157
 epoch: 42, train_loss: 0.5119, test_loss: 1.0610, test_f1: 0.6437
 epoch: 43, train_loss: 0.4915, test_loss: 1.2098, test_f1: 0.6318
 epoch: 44, train_loss: 0.5189, test_loss: 1.2454, test_f1: 0.6096
 epoch: 45, train_loss: 0.4927, test_loss: 1.1712, test_f1: 0.6421
 epoch: 46, train_loss: 0.4827, test_loss: 1.1272, test_f1: 0.6587
 epoch: 47, train_loss: 0.4640, test_loss: 1.2324, test_f1: 0.6292
 epoch: 48, train_loss: 0.4652, test_loss: 1.2544, test_f1: 0.6239
 epoch: 49, train_loss: 0.4639, test_loss: 1.1906, test_f1: 0.6532
 epoch: 50, train_loss: 0.4656, test_loss: 1.1782, test_f1: 0.6591
 epoch: 51, train_loss: 0.4144, test_loss: 1.1525, test_f1: 0.6425
 epoch: 52, train_loss: 0.3894, test_loss: 1.1679, test_f1: 0.6596
 epoch: 53, train_loss: 0.3710, test_loss: 1.3141, test_f1: 0.6496
 epoch: 54, train_loss: 0.3566, test_loss: 1.3319, test_f1: 0.6352
 epoch: 55, train_loss: 0.3453, test_loss: 1.3088, test_f1: 0.6697
 epoch: 56, train_loss: 0.3468, test_loss: 1.3729, test_f1: 0.6757
 epoch: 57, train_loss: 0.3301, test_loss: 1.4692, test_f1: 0.6540
 epoch: 58, train_loss: 0.3435, test_loss: 1.3713, test_f1: 0.6706
 epoch: 59, train_loss: 0.3477, test_loss: 1.4368, test_f1: 0.6472
 epoch: 60, train_loss: 0.3446, test_loss: 1.3096, test_f1: 0.6892
 epoch: 61, train_loss: 0.3210, test_loss: 1.3419, test_f1: 0.6583
 epoch: 62, train_loss: 0.2913, test_loss: 1.4873, test_f1: 0.6435
 epoch: 63, train_loss: 0.2948, test_loss: 1.4927, test_f1: 0.6539
 epoch: 64, train_loss: 0.2954, test_loss: 1.5101, test_f1: 0.6580
 epoch: 65, train_loss: 0.3056, test_loss: 1.5082, test_f1: 0.6512
 epoch: 66, train_loss: 0.2867, test_loss: 1.4518, test_f1: 0.6729
 epoch: 67, train_loss: 0.3097, test_loss: 1.5035, test_f1: 0.6624
 epoch: 68, train_loss: 0.2864, test_loss: 1.4675, test_f1: 0.6668
 epoch: 69, train_loss: 0.2794, test_loss: 1.4727, test_f1: 0.6514
 epoch: 70, train_loss: 0.2705, test_loss: 1.4874, test_f1: 0.6687
 epoch: 71, train_loss: 0.2850, test_loss: 1.5484, test_f1: 0.6481
 epoch: 72, train_loss: 0.2747, test_loss: 1.5566, test_f1: 0.6700
 epoch: 73, train_loss: 0.2960, test_loss: 1.5756, test_f1: 0.6553
 epoch: 74, train_loss: 0.2704, test_loss: 1.6136, test_f1: 0.6539
 epoch: 75, train_loss: 0.2598, test_loss: 1.5934, test_f1: 0.6391
 epoch: 76, train_loss: 0.2472, test_loss: 1.5616, test_f1: 0.6624
 epoch: 77, train_loss: 0.2770, test_loss: 1.6392, test_f1: 0.6545
 epoch: 78, train_loss: 0.2475, test_loss: 1.7458, test_f1: 0.6396
 epoch: 79, train_loss: 0.2399, test_loss: 1.6029, test_f1: 0.6509
 epoch: 80, train_loss: 0.2323, test_loss: 1.6442, test_f1: 0.6611
 epoch: 81, train_loss: 0.2486, test_loss: 1.7013, test_f1: 0.6497
 epoch: 82, train_loss: 0.2318, test_loss: 1.7179, test_f1: 0.6508
 epoch: 83, train_loss: 0.2429, test_loss: 1.7727, test_f1: 0.6487
 epoch: 84, train_loss: 0.2177, test_loss: 1.7467, test_f1: 0.6378
 epoch: 85, train_loss: 0.2430, test_loss: 1.7028, test_f1: 0.6374
 epoch: 86, train_loss: 0.2241, test_loss: 1.5955, test_f1: 0.6675
 epoch: 87, train_loss: 0.2305, test_loss: 1.7706, test_f1: 0.6480
 epoch: 88, train_loss: 0.2320, test_loss: 1.7834, test_f1: 0.6568
 epoch: 89, train_loss: 0.2426, test_loss: 1.7771, test_f1: 0.6285
 epoch: 90, train_loss: 0.2182, test_loss: 1.6885, test_f1: 0.6589
 epoch: 91, train_loss: 0.2107, test_loss: 1.7912, test_f1: 0.6516
 epoch: 92, train_loss: 0.2014, test_loss: 1.8594, test_f1: 0.6397
 epoch: 93, train_loss: 0.2127, test_loss: 1.9419, test_f1: 0.6467
 epoch: 94, train_loss: 0.2113, test_loss: 1.7951, test_f1: 0.6661
 epoch: 95, train_loss: 0.2085, test_loss: 1.8987, test_f1: 0.6493
 epoch: 96, train_loss: 0.2101, test_loss: 1.8282, test_f1: 0.6310
 epoch: 97, train_loss: 0.2090, test_loss: 1.8374, test_f1: 0.6258
 epoch: 98, train_loss: 0.1985, test_loss: 1.8615, test_f1: 0.6328
 epoch: 99, train_loss: 0.2109, test_loss: 1.9472, test_f1: 0.6452
##################ITERATION #3 ****************************************
 epoch: 0, train_loss: 1.2597, test_loss: 0.9960, test_f1: 0.4580
 epoch: 1, train_loss: 1.0162, test_loss: 0.9425, test_f1: 0.4868
 epoch: 2, train_loss: 0.9474, test_loss: 0.9418, test_f1: 0.5358
 epoch: 3, train_loss: 0.9338, test_loss: 0.9575, test_f1: 0.5264
 epoch: 4, train_loss: 0.9174, test_loss: 0.9325, test_f1: 0.5260
 epoch: 5, train_loss: 0.8926, test_loss: 0.9698, test_f1: 0.5531
 epoch: 6, train_loss: 0.8644, test_loss: 0.8890, test_f1: 0.5457
 epoch: 7, train_loss: 0.8570, test_loss: 0.9450, test_f1: 0.5361
 epoch: 8, train_loss: 0.8579, test_loss: 0.9558, test_f1: 0.5342
 epoch: 9, train_loss: 0.8270, test_loss: 0.9493, test_f1: 0.5222
 epoch: 10, train_loss: 0.8103, test_loss: 0.9250, test_f1: 0.5935
 epoch: 11, train_loss: 0.7902, test_loss: 0.9294, test_f1: 0.5609
 epoch: 12, train_loss: 0.7942, test_loss: 0.9102, test_f1: 0.5905
 epoch: 13, train_loss: 0.7887, test_loss: 0.9846, test_f1: 0.5743
 epoch: 14, train_loss: 0.7797, test_loss: 0.9509, test_f1: 0.5760
 epoch: 15, train_loss: 0.7576, test_loss: 0.9846, test_f1: 0.5858
 epoch: 16, train_loss: 0.7579, test_loss: 0.9518, test_f1: 0.6001
 epoch: 17, train_loss: 0.7453, test_loss: 0.9304, test_f1: 0.5904
 epoch: 18, train_loss: 0.7363, test_loss: 0.9433, test_f1: 0.5686
 epoch: 19, train_loss: 0.7452, test_loss: 0.9277, test_f1: 0.5959
 epoch: 20, train_loss: 0.7177, test_loss: 0.9572, test_f1: 0.5935
 epoch: 21, train_loss: 0.7198, test_loss: 0.9844, test_f1: 0.6174
 epoch: 22, train_loss: 0.7093, test_loss: 0.9647, test_f1: 0.5957
 epoch: 23, train_loss: 0.7017, test_loss: 0.9978, test_f1: 0.5869
 epoch: 24, train_loss: 0.7056, test_loss: 0.9706, test_f1: 0.6086
 epoch: 25, train_loss: 0.6821, test_loss: 1.0244, test_f1: 0.6220
 epoch: 26, train_loss: 0.6425, test_loss: 1.0378, test_f1: 0.6088
 epoch: 27, train_loss: 0.6470, test_loss: 0.9916, test_f1: 0.6510
 epoch: 28, train_loss: 0.6440, test_loss: 1.0226, test_f1: 0.6131
 epoch: 29, train_loss: 0.6449, test_loss: 1.1137, test_f1: 0.6065
 epoch: 30, train_loss: 0.6386, test_loss: 1.0441, test_f1: 0.6241
 epoch: 31, train_loss: 0.6231, test_loss: 1.0882, test_f1: 0.5986
 epoch: 32, train_loss: 0.6151, test_loss: 0.9722, test_f1: 0.6283
 epoch: 33, train_loss: 0.5995, test_loss: 1.0479, test_f1: 0.6523
 epoch: 34, train_loss: 0.5832, test_loss: 1.1036, test_f1: 0.6250
 epoch: 35, train_loss: 0.5829, test_loss: 1.0215, test_f1: 0.6406
 epoch: 36, train_loss: 0.5798, test_loss: 1.0666, test_f1: 0.6295
 epoch: 37, train_loss: 0.5631, test_loss: 1.0537, test_f1: 0.6331
 epoch: 38, train_loss: 0.5547, test_loss: 1.1087, test_f1: 0.6214
 epoch: 39, train_loss: 0.5605, test_loss: 1.1585, test_f1: 0.6066
 epoch: 40, train_loss: 0.5690, test_loss: 1.1129, test_f1: 0.6300
 epoch: 41, train_loss: 0.5529, test_loss: 1.0513, test_f1: 0.6503
 epoch: 42, train_loss: 0.5198, test_loss: 1.0796, test_f1: 0.6935
 epoch: 43, train_loss: 0.5000, test_loss: 1.1281, test_f1: 0.6320
 epoch: 44, train_loss: 0.5269, test_loss: 1.1058, test_f1: 0.6368
 epoch: 45, train_loss: 0.5084, test_loss: 1.1237, test_f1: 0.6328
 epoch: 46, train_loss: 0.5052, test_loss: 1.0842, test_f1: 0.6429
 epoch: 47, train_loss: 0.4824, test_loss: 1.0915, test_f1: 0.6467
 epoch: 48, train_loss: 0.5046, test_loss: 1.1483, test_f1: 0.6394
 epoch: 49, train_loss: 0.4710, test_loss: 1.1870, test_f1: 0.6315
 epoch: 50, train_loss: 0.4631, test_loss: 1.1571, test_f1: 0.6556
 epoch: 51, train_loss: 0.4120, test_loss: 1.2540, test_f1: 0.6730
 epoch: 52, train_loss: 0.4094, test_loss: 1.2396, test_f1: 0.6343
 epoch: 53, train_loss: 0.3655, test_loss: 1.2311, test_f1: 0.6521
 epoch: 54, train_loss: 0.3658, test_loss: 1.3584, test_f1: 0.6353
 epoch: 55, train_loss: 0.3790, test_loss: 1.3889, test_f1: 0.6697
 epoch: 56, train_loss: 0.3534, test_loss: 1.2851, test_f1: 0.6555
 epoch: 57, train_loss: 0.3529, test_loss: 1.2953, test_f1: 0.6597
 epoch: 58, train_loss: 0.3366, test_loss: 1.3135, test_f1: 0.6508
 epoch: 59, train_loss: 0.3251, test_loss: 1.4040, test_f1: 0.6407
 epoch: 60, train_loss: 0.3290, test_loss: 1.4334, test_f1: 0.6414
 epoch: 61, train_loss: 0.3318, test_loss: 1.2940, test_f1: 0.6470
 epoch: 62, train_loss: 0.3174, test_loss: 1.3288, test_f1: 0.6601
 epoch: 63, train_loss: 0.3368, test_loss: 1.4291, test_f1: 0.6362
 epoch: 64, train_loss: 0.3153, test_loss: 1.3709, test_f1: 0.6648
 epoch: 65, train_loss: 0.3093, test_loss: 1.4359, test_f1: 0.6329
 epoch: 66, train_loss: 0.3070, test_loss: 1.4540, test_f1: 0.6413
 epoch: 67, train_loss: 0.2943, test_loss: 1.5080, test_f1: 0.6396
 epoch: 68, train_loss: 0.2752, test_loss: 1.5645, test_f1: 0.6320
 epoch: 69, train_loss: 0.2965, test_loss: 1.5089, test_f1: 0.6488
 epoch: 70, train_loss: 0.2857, test_loss: 1.6398, test_f1: 0.6330
 epoch: 71, train_loss: 0.2853, test_loss: 1.4845, test_f1: 0.6472
 epoch: 72, train_loss: 0.2717, test_loss: 1.5679, test_f1: 0.6407
 epoch: 73, train_loss: 0.3075, test_loss: 1.5124, test_f1: 0.6367
 epoch: 74, train_loss: 0.2686, test_loss: 1.5048, test_f1: 0.6321
 epoch: 75, train_loss: 0.2720, test_loss: 1.6001, test_f1: 0.6497
 epoch: 76, train_loss: 0.2714, test_loss: 1.5682, test_f1: 0.6449
 epoch: 77, train_loss: 0.2770, test_loss: 1.6055, test_f1: 0.6502
 epoch: 78, train_loss: 0.2638, test_loss: 1.5695, test_f1: 0.6551
 epoch: 79, train_loss: 0.2635, test_loss: 1.6339, test_f1: 0.6500
 epoch: 80, train_loss: 0.2527, test_loss: 1.7223, test_f1: 0.6549
 epoch: 81, train_loss: 0.2669, test_loss: 1.6513, test_f1: 0.6466
 epoch: 82, train_loss: 0.2557, test_loss: 1.6900, test_f1: 0.6376
 epoch: 83, train_loss: 0.2479, test_loss: 1.6143, test_f1: 0.6341
 epoch: 84, train_loss: 0.2445, test_loss: 1.7530, test_f1: 0.6289
 epoch: 85, train_loss: 0.2412, test_loss: 1.7500, test_f1: 0.6473
 epoch: 86, train_loss: 0.2557, test_loss: 1.6842, test_f1: 0.6517
 epoch: 87, train_loss: 0.2327, test_loss: 1.9217, test_f1: 0.6312
 epoch: 88, train_loss: 0.2451, test_loss: 1.7063, test_f1: 0.6428
 epoch: 89, train_loss: 0.2368, test_loss: 1.6137, test_f1: 0.6431
 epoch: 90, train_loss: 0.2285, test_loss: 1.7297, test_f1: 0.6656
 epoch: 91, train_loss: 0.2266, test_loss: 1.7279, test_f1: 0.6406
 epoch: 92, train_loss: 0.2415, test_loss: 1.7992, test_f1: 0.6413
 epoch: 93, train_loss: 0.2126, test_loss: 1.7943, test_f1: 0.6513
 epoch: 94, train_loss: 0.2153, test_loss: 1.7867, test_f1: 0.6509
 epoch: 95, train_loss: 0.2280, test_loss: 1.8908, test_f1: 0.6469
 epoch: 96, train_loss: 0.2350, test_loss: 1.8244, test_f1: 0.6285
 epoch: 97, train_loss: 0.2243, test_loss: 1.7959, test_f1: 0.6315
 epoch: 98, train_loss: 0.2156, test_loss: 1.7717, test_f1: 0.6389
 epoch: 99, train_loss: 0.2171, test_loss: 1.9404, test_f1: 0.6265
##################ITERATION #4 ****************************************
 epoch: 0, train_loss: 1.2691, test_loss: 1.0260, test_f1: 0.4680
 epoch: 1, train_loss: 1.0117, test_loss: 0.9556, test_f1: 0.5370
 epoch: 2, train_loss: 0.9559, test_loss: 0.9428, test_f1: 0.5312
 epoch: 3, train_loss: 0.9234, test_loss: 0.9510, test_f1: 0.5040
 epoch: 4, train_loss: 0.9126, test_loss: 0.9401, test_f1: 0.5409
 epoch: 5, train_loss: 0.8847, test_loss: 0.9513, test_f1: 0.5257
 epoch: 6, train_loss: 0.8622, test_loss: 0.8989, test_f1: 0.5665
 epoch: 7, train_loss: 0.8521, test_loss: 0.9643, test_f1: 0.5407
 epoch: 8, train_loss: 0.8547, test_loss: 0.9074, test_f1: 0.5586
 epoch: 9, train_loss: 0.8402, test_loss: 0.9602, test_f1: 0.5497
 epoch: 10, train_loss: 0.8158, test_loss: 1.0020, test_f1: 0.5787
 epoch: 11, train_loss: 0.8102, test_loss: 1.0421, test_f1: 0.5353
 epoch: 12, train_loss: 0.8129, test_loss: 0.9277, test_f1: 0.5567
 epoch: 13, train_loss: 0.7905, test_loss: 0.9904, test_f1: 0.5537
 epoch: 14, train_loss: 0.7844, test_loss: 0.9794, test_f1: 0.5657
 epoch: 15, train_loss: 0.7822, test_loss: 0.9709, test_f1: 0.5942
 epoch: 16, train_loss: 0.7703, test_loss: 0.9887, test_f1: 0.5866
 epoch: 17, train_loss: 0.7406, test_loss: 1.0153, test_f1: 0.5948
 epoch: 18, train_loss: 0.7398, test_loss: 1.0055, test_f1: 0.5982
 epoch: 19, train_loss: 0.7362, test_loss: 1.0406, test_f1: 0.6119
 epoch: 20, train_loss: 0.7384, test_loss: 0.9994, test_f1: 0.5875
 epoch: 21, train_loss: 0.7182, test_loss: 1.0094, test_f1: 0.5892
 epoch: 22, train_loss: 0.7200, test_loss: 1.0748, test_f1: 0.5802
 epoch: 23, train_loss: 0.7215, test_loss: 0.9617, test_f1: 0.6238
 epoch: 24, train_loss: 0.7028, test_loss: 1.0130, test_f1: 0.6281
 epoch: 25, train_loss: 0.6777, test_loss: 1.0184, test_f1: 0.6359
 epoch: 26, train_loss: 0.6848, test_loss: 0.8937, test_f1: 0.6213
 epoch: 27, train_loss: 0.6635, test_loss: 1.0190, test_f1: 0.6297
 epoch: 28, train_loss: 0.6662, test_loss: 1.0333, test_f1: 0.6380
 epoch: 29, train_loss: 0.6392, test_loss: 0.9776, test_f1: 0.6312
 epoch: 30, train_loss: 0.6508, test_loss: 1.0081, test_f1: 0.6348
 epoch: 31, train_loss: 0.6250, test_loss: 1.0799, test_f1: 0.6258
 epoch: 32, train_loss: 0.6431, test_loss: 1.0211, test_f1: 0.6256
 epoch: 33, train_loss: 0.6243, test_loss: 1.0077, test_f1: 0.6086
 epoch: 34, train_loss: 0.6165, test_loss: 1.1084, test_f1: 0.6043
 epoch: 35, train_loss: 0.6060, test_loss: 1.0907, test_f1: 0.6176
 epoch: 36, train_loss: 0.6157, test_loss: 1.0504, test_f1: 0.6273
 epoch: 37, train_loss: 0.5875, test_loss: 1.0601, test_f1: 0.6248
 epoch: 38, train_loss: 0.5871, test_loss: 0.9916, test_f1: 0.6417
 epoch: 39, train_loss: 0.5627, test_loss: 1.0424, test_f1: 0.6226
 epoch: 40, train_loss: 0.5619, test_loss: 1.1363, test_f1: 0.6132
 epoch: 41, train_loss: 0.5459, test_loss: 1.0003, test_f1: 0.6568
 epoch: 42, train_loss: 0.5551, test_loss: 1.1029, test_f1: 0.6425
 epoch: 43, train_loss: 0.5413, test_loss: 1.1216, test_f1: 0.6329
 epoch: 44, train_loss: 0.5332, test_loss: 1.1488, test_f1: 0.6372
 epoch: 45, train_loss: 0.5213, test_loss: 1.4372, test_f1: 0.5853
 epoch: 46, train_loss: 0.5261, test_loss: 1.0903, test_f1: 0.6366
 epoch: 47, train_loss: 0.5037, test_loss: 1.1114, test_f1: 0.6348
 epoch: 48, train_loss: 0.5072, test_loss: 1.0392, test_f1: 0.6323
 epoch: 49, train_loss: 0.5065, test_loss: 1.0906, test_f1: 0.6526
 epoch: 50, train_loss: 0.4961, test_loss: 1.1644, test_f1: 0.6583
 epoch: 51, train_loss: 0.4177, test_loss: 1.2030, test_f1: 0.6703
 epoch: 52, train_loss: 0.4101, test_loss: 1.2005, test_f1: 0.6367
 epoch: 53, train_loss: 0.3982, test_loss: 1.2645, test_f1: 0.6516
 epoch: 54, train_loss: 0.3751, test_loss: 1.2732, test_f1: 0.6598
 epoch: 55, train_loss: 0.3760, test_loss: 1.2087, test_f1: 0.6612
 epoch: 56, train_loss: 0.3729, test_loss: 1.2814, test_f1: 0.6556
 epoch: 57, train_loss: 0.3653, test_loss: 1.2884, test_f1: 0.6578
 epoch: 58, train_loss: 0.3721, test_loss: 1.2750, test_f1: 0.6586
 epoch: 59, train_loss: 0.3408, test_loss: 1.4130, test_f1: 0.6697
 epoch: 60, train_loss: 0.3471, test_loss: 1.3954, test_f1: 0.6538
 epoch: 61, train_loss: 0.3335, test_loss: 1.3225, test_f1: 0.6693
 epoch: 62, train_loss: 0.3598, test_loss: 1.4053, test_f1: 0.6682
 epoch: 63, train_loss: 0.3386, test_loss: 1.4163, test_f1: 0.6617
 epoch: 64, train_loss: 0.3265, test_loss: 1.4340, test_f1: 0.6596
 epoch: 65, train_loss: 0.3152, test_loss: 1.4709, test_f1: 0.6430
 epoch: 66, train_loss: 0.3186, test_loss: 1.3908, test_f1: 0.6513
 epoch: 67, train_loss: 0.3178, test_loss: 1.3816, test_f1: 0.6549
 epoch: 68, train_loss: 0.3125, test_loss: 1.4590, test_f1: 0.6302
 epoch: 69, train_loss: 0.3237, test_loss: 1.4985, test_f1: 0.6487
 epoch: 70, train_loss: 0.3002, test_loss: 1.6113, test_f1: 0.6595
 epoch: 71, train_loss: 0.2979, test_loss: 1.4019, test_f1: 0.6654
 epoch: 72, train_loss: 0.3032, test_loss: 1.4636, test_f1: 0.6619
 epoch: 73, train_loss: 0.2905, test_loss: 1.4484, test_f1: 0.6558
 epoch: 74, train_loss: 0.2944, test_loss: 1.5013, test_f1: 0.6605
 epoch: 75, train_loss: 0.2923, test_loss: 1.4070, test_f1: 0.6499
 epoch: 76, train_loss: 0.2739, test_loss: 1.4354, test_f1: 0.6681
 epoch: 77, train_loss: 0.2807, test_loss: 1.5997, test_f1: 0.6513
 epoch: 78, train_loss: 0.2735, test_loss: 1.6043, test_f1: 0.6514
 epoch: 79, train_loss: 0.2715, test_loss: 1.5959, test_f1: 0.6243
 epoch: 80, train_loss: 0.2613, test_loss: 1.6581, test_f1: 0.6365
 epoch: 81, train_loss: 0.2460, test_loss: 1.6886, test_f1: 0.6593
 epoch: 82, train_loss: 0.2467, test_loss: 1.8116, test_f1: 0.6277
 epoch: 83, train_loss: 0.2606, test_loss: 1.8103, test_f1: 0.6477
 epoch: 84, train_loss: 0.2680, test_loss: 1.5603, test_f1: 0.6414
 epoch: 85, train_loss: 0.2623, test_loss: 1.6619, test_f1: 0.6468
 epoch: 86, train_loss: 0.2543, test_loss: 1.7700, test_f1: 0.6288
 epoch: 87, train_loss: 0.2564, test_loss: 1.6505, test_f1: 0.6523
 epoch: 88, train_loss: 0.2566, test_loss: 1.6566, test_f1: 0.6403
 epoch: 89, train_loss: 0.2491, test_loss: 1.6040, test_f1: 0.6524
 epoch: 90, train_loss: 0.2509, test_loss: 1.5603, test_f1: 0.6479
 epoch: 91, train_loss: 0.2356, test_loss: 1.7495, test_f1: 0.6320
 epoch: 92, train_loss: 0.2303, test_loss: 1.8156, test_f1: 0.6203
 epoch: 93, train_loss: 0.2340, test_loss: 1.7919, test_f1: 0.6167
 epoch: 94, train_loss: 0.2374, test_loss: 1.6318, test_f1: 0.6294
 epoch: 95, train_loss: 0.2240, test_loss: 1.6243, test_f1: 0.6492
 epoch: 96, train_loss: 0.2321, test_loss: 1.8043, test_f1: 0.6373
 epoch: 97, train_loss: 0.2291, test_loss: 1.7429, test_f1: 0.6256
 epoch: 98, train_loss: 0.2389, test_loss: 1.6460, test_f1: 0.6620
 epoch: 99, train_loss: 0.2218, test_loss: 1.7725, test_f1: 0.6356
##################ITERATION #5 ****************************************
 epoch: 0, train_loss: 1.2802, test_loss: 1.0476, test_f1: 0.4233
 epoch: 1, train_loss: 0.9980, test_loss: 0.9700, test_f1: 0.4958
 epoch: 2, train_loss: 0.9404, test_loss: 0.9688, test_f1: 0.4670
 epoch: 3, train_loss: 0.9313, test_loss: 0.9339, test_f1: 0.5039
 epoch: 4, train_loss: 0.9113, test_loss: 0.9650, test_f1: 0.5460
 epoch: 5, train_loss: 0.8985, test_loss: 0.9292, test_f1: 0.5299
 epoch: 6, train_loss: 0.8625, test_loss: 1.0041, test_f1: 0.5336
 epoch: 7, train_loss: 0.8479, test_loss: 0.9396, test_f1: 0.5426
 epoch: 8, train_loss: 0.8458, test_loss: 0.9236, test_f1: 0.5684
 epoch: 9, train_loss: 0.8200, test_loss: 0.9590, test_f1: 0.5723
 epoch: 10, train_loss: 0.8250, test_loss: 0.8890, test_f1: 0.5349
 epoch: 11, train_loss: 0.7962, test_loss: 0.9519, test_f1: 0.5706
 epoch: 12, train_loss: 0.7844, test_loss: 0.9111, test_f1: 0.5730
 epoch: 13, train_loss: 0.7828, test_loss: 0.9561, test_f1: 0.5828
 epoch: 14, train_loss: 0.7668, test_loss: 0.9567, test_f1: 0.5789
 epoch: 15, train_loss: 0.7514, test_loss: 1.0038, test_f1: 0.5644
 epoch: 16, train_loss: 0.7652, test_loss: 1.0207, test_f1: 0.5601
 epoch: 17, train_loss: 0.7399, test_loss: 0.9971, test_f1: 0.5576
 epoch: 18, train_loss: 0.7250, test_loss: 1.0230, test_f1: 0.6168
 epoch: 19, train_loss: 0.7116, test_loss: 0.9767, test_f1: 0.6147
 epoch: 20, train_loss: 0.7056, test_loss: 0.9393, test_f1: 0.5829
 epoch: 21, train_loss: 0.6903, test_loss: 0.9761, test_f1: 0.6178
 epoch: 22, train_loss: 0.6762, test_loss: 0.9753, test_f1: 0.6349
 epoch: 23, train_loss: 0.6786, test_loss: 1.1016, test_f1: 0.5948
 epoch: 24, train_loss: 0.6687, test_loss: 1.0827, test_f1: 0.5896
 epoch: 25, train_loss: 0.6653, test_loss: 1.0795, test_f1: 0.6183
 epoch: 26, train_loss: 0.6609, test_loss: 1.0577, test_f1: 0.5991
 epoch: 27, train_loss: 0.6571, test_loss: 1.0690, test_f1: 0.6124
 epoch: 28, train_loss: 0.6337, test_loss: 0.9943, test_f1: 0.5893
 epoch: 29, train_loss: 0.6200, test_loss: 1.0490, test_f1: 0.6023
 epoch: 30, train_loss: 0.6014, test_loss: 1.0796, test_f1: 0.5937
 epoch: 31, train_loss: 0.5929, test_loss: 1.1792, test_f1: 0.6109
 epoch: 32, train_loss: 0.6020, test_loss: 1.0869, test_f1: 0.5960
 epoch: 33, train_loss: 0.5884, test_loss: 1.0370, test_f1: 0.6027
 epoch: 34, train_loss: 0.5698, test_loss: 1.1278, test_f1: 0.6514
 epoch: 35, train_loss: 0.5706, test_loss: 1.0488, test_f1: 0.6236
 epoch: 36, train_loss: 0.5548, test_loss: 1.1350, test_f1: 0.6358
 epoch: 37, train_loss: 0.5676, test_loss: 1.1747, test_f1: 0.6447
 epoch: 38, train_loss: 0.5622, test_loss: 1.0748, test_f1: 0.6367
 epoch: 39, train_loss: 0.5582, test_loss: 1.1862, test_f1: 0.6059
 epoch: 40, train_loss: 0.5358, test_loss: 1.2527, test_f1: 0.6209
 epoch: 41, train_loss: 0.5462, test_loss: 1.1206, test_f1: 0.6317
 epoch: 42, train_loss: 0.5190, test_loss: 1.0806, test_f1: 0.6238
 epoch: 43, train_loss: 0.5133, test_loss: 1.1033, test_f1: 0.6318
 epoch: 44, train_loss: 0.5102, test_loss: 1.1169, test_f1: 0.6129
 epoch: 45, train_loss: 0.4837, test_loss: 1.2177, test_f1: 0.6382
 epoch: 46, train_loss: 0.5026, test_loss: 1.1028, test_f1: 0.6243
 epoch: 47, train_loss: 0.4998, test_loss: 1.1149, test_f1: 0.6258
 epoch: 48, train_loss: 0.4897, test_loss: 1.2317, test_f1: 0.6210
 epoch: 49, train_loss: 0.4666, test_loss: 1.2419, test_f1: 0.6245
 epoch: 50, train_loss: 0.4677, test_loss: 1.2889, test_f1: 0.6587
 epoch: 51, train_loss: 0.4124, test_loss: 1.3022, test_f1: 0.6301
 epoch: 52, train_loss: 0.3883, test_loss: 1.3667, test_f1: 0.6487
 epoch: 53, train_loss: 0.3781, test_loss: 1.3829, test_f1: 0.6557
 epoch: 54, train_loss: 0.3840, test_loss: 1.3860, test_f1: 0.6323
 epoch: 55, train_loss: 0.3637, test_loss: 1.3304, test_f1: 0.6623
 epoch: 56, train_loss: 0.3607, test_loss: 1.4893, test_f1: 0.6534
 epoch: 57, train_loss: 0.3502, test_loss: 1.5092, test_f1: 0.6600
 epoch: 58, train_loss: 0.3508, test_loss: 1.3974, test_f1: 0.6618
 epoch: 59, train_loss: 0.3351, test_loss: 1.3790, test_f1: 0.6648
 epoch: 60, train_loss: 0.3236, test_loss: 1.5117, test_f1: 0.6450
 epoch: 61, train_loss: 0.3219, test_loss: 1.4484, test_f1: 0.6563
 epoch: 62, train_loss: 0.3150, test_loss: 1.5080, test_f1: 0.6569
 epoch: 63, train_loss: 0.3160, test_loss: 1.5705, test_f1: 0.6557
 epoch: 64, train_loss: 0.2986, test_loss: 1.4865, test_f1: 0.6779
 epoch: 65, train_loss: 0.2982, test_loss: 1.6595, test_f1: 0.6495
 epoch: 66, train_loss: 0.2966, test_loss: 1.5852, test_f1: 0.6607
 epoch: 67, train_loss: 0.3003, test_loss: 1.6587, test_f1: 0.6230
 epoch: 68, train_loss: 0.3031, test_loss: 1.5344, test_f1: 0.6745
 epoch: 69, train_loss: 0.2928, test_loss: 1.5094, test_f1: 0.6487
 epoch: 70, train_loss: 0.2920, test_loss: 1.5174, test_f1: 0.6749
 epoch: 71, train_loss: 0.2867, test_loss: 1.5973, test_f1: 0.6722
 epoch: 72, train_loss: 0.2799, test_loss: 1.6671, test_f1: 0.6301
 epoch: 73, train_loss: 0.2935, test_loss: 1.6516, test_f1: 0.6477
 epoch: 74, train_loss: 0.2785, test_loss: 1.6468, test_f1: 0.6477
 epoch: 75, train_loss: 0.2907, test_loss: 1.5721, test_f1: 0.6375
 epoch: 76, train_loss: 0.2593, test_loss: 1.6439, test_f1: 0.6415
 epoch: 77, train_loss: 0.2724, test_loss: 1.6709, test_f1: 0.6604
 epoch: 78, train_loss: 0.2672, test_loss: 1.7966, test_f1: 0.6564
 epoch: 79, train_loss: 0.2544, test_loss: 1.7098, test_f1: 0.6517
 epoch: 80, train_loss: 0.2658, test_loss: 1.7621, test_f1: 0.6502
 epoch: 81, train_loss: 0.2597, test_loss: 1.8315, test_f1: 0.6500
 epoch: 82, train_loss: 0.2539, test_loss: 1.6849, test_f1: 0.6756
 epoch: 83, train_loss: 0.2527, test_loss: 1.7162, test_f1: 0.6389
 epoch: 84, train_loss: 0.2602, test_loss: 1.7129, test_f1: 0.6662
 epoch: 85, train_loss: 0.2440, test_loss: 1.7268, test_f1: 0.6540
 epoch: 86, train_loss: 0.2395, test_loss: 1.7504, test_f1: 0.6490
 epoch: 87, train_loss: 0.2410, test_loss: 1.7116, test_f1: 0.6460
 epoch: 88, train_loss: 0.2458, test_loss: 1.6769, test_f1: 0.6440
 epoch: 89, train_loss: 0.2393, test_loss: 1.7902, test_f1: 0.6535
 epoch: 90, train_loss: 0.2488, test_loss: 1.9279, test_f1: 0.6184
 epoch: 91, train_loss: 0.2275, test_loss: 1.7802, test_f1: 0.6444
 epoch: 92, train_loss: 0.2147, test_loss: 1.8212, test_f1: 0.6411
 epoch: 93, train_loss: 0.2129, test_loss: 1.8367, test_f1: 0.6476
 epoch: 94, train_loss: 0.2253, test_loss: 1.8004, test_f1: 0.6358
 epoch: 95, train_loss: 0.2141, test_loss: 1.9143, test_f1: 0.6273
 epoch: 96, train_loss: 0.2297, test_loss: 1.7731, test_f1: 0.6351
 epoch: 97, train_loss: 0.2224, test_loss: 1.8747, test_f1: 0.6236
 epoch: 98, train_loss: 0.2383, test_loss: 1.8271, test_f1: 0.6213
 epoch: 99, train_loss: 0.2213, test_loss: 1.7171, test_f1: 0.6486
##################ITERATION #6 ****************************************
 epoch: 0, train_loss: 1.3438, test_loss: 1.0339, test_f1: 0.4819
 epoch: 1, train_loss: 1.0067, test_loss: 0.9399, test_f1: 0.4914
 epoch: 2, train_loss: 0.9476, test_loss: 0.9557, test_f1: 0.5089
 epoch: 3, train_loss: 0.9402, test_loss: 0.9701, test_f1: 0.5042
 epoch: 4, train_loss: 0.9243, test_loss: 0.9712, test_f1: 0.5056
 epoch: 5, train_loss: 0.8848, test_loss: 0.9799, test_f1: 0.5027
 epoch: 6, train_loss: 0.8903, test_loss: 0.9210, test_f1: 0.5414
 epoch: 7, train_loss: 0.8632, test_loss: 0.9179, test_f1: 0.5305
 epoch: 8, train_loss: 0.8354, test_loss: 0.9460, test_f1: 0.5789
 epoch: 9, train_loss: 0.8375, test_loss: 0.9369, test_f1: 0.5826
 epoch: 10, train_loss: 0.8131, test_loss: 0.9516, test_f1: 0.5385
 epoch: 11, train_loss: 0.8243, test_loss: 0.9399, test_f1: 0.5594
 epoch: 12, train_loss: 0.8028, test_loss: 0.9387, test_f1: 0.5658
 epoch: 13, train_loss: 0.7804, test_loss: 0.9405, test_f1: 0.5788
 epoch: 14, train_loss: 0.7728, test_loss: 0.9214, test_f1: 0.5695
 epoch: 15, train_loss: 0.7491, test_loss: 0.9310, test_f1: 0.5989
 epoch: 16, train_loss: 0.7645, test_loss: 0.9627, test_f1: 0.5941
 epoch: 17, train_loss: 0.7609, test_loss: 0.9079, test_f1: 0.5847
 epoch: 18, train_loss: 0.7263, test_loss: 0.9538, test_f1: 0.6141
 epoch: 19, train_loss: 0.7312, test_loss: 0.9559, test_f1: 0.5775
 epoch: 20, train_loss: 0.7161, test_loss: 1.0301, test_f1: 0.5872
 epoch: 21, train_loss: 0.7226, test_loss: 1.0240, test_f1: 0.6004
 epoch: 22, train_loss: 0.7143, test_loss: 0.9531, test_f1: 0.5757
 epoch: 23, train_loss: 0.7059, test_loss: 0.9937, test_f1: 0.6131
 epoch: 24, train_loss: 0.6842, test_loss: 0.9885, test_f1: 0.6370
 epoch: 25, train_loss: 0.6766, test_loss: 1.0417, test_f1: 0.5924
 epoch: 26, train_loss: 0.6653, test_loss: 0.9959, test_f1: 0.6241
 epoch: 27, train_loss: 0.6652, test_loss: 1.0665, test_f1: 0.6298
 epoch: 28, train_loss: 0.6602, test_loss: 1.0149, test_f1: 0.6085
 epoch: 29, train_loss: 0.6303, test_loss: 1.0602, test_f1: 0.6275
 epoch: 30, train_loss: 0.6442, test_loss: 0.9444, test_f1: 0.6513
 epoch: 31, train_loss: 0.6201, test_loss: 1.0179, test_f1: 0.6546
 epoch: 32, train_loss: 0.5999, test_loss: 1.1173, test_f1: 0.5977
 epoch: 33, train_loss: 0.6089, test_loss: 0.9931, test_f1: 0.6566
 epoch: 34, train_loss: 0.5969, test_loss: 1.0105, test_f1: 0.6100
 epoch: 35, train_loss: 0.5856, test_loss: 1.0079, test_f1: 0.6224
 epoch: 36, train_loss: 0.5890, test_loss: 1.0444, test_f1: 0.6204
 epoch: 37, train_loss: 0.5573, test_loss: 1.0668, test_f1: 0.6426
 epoch: 38, train_loss: 0.5614, test_loss: 1.0737, test_f1: 0.6402
 epoch: 39, train_loss: 0.5879, test_loss: 1.0992, test_f1: 0.6334
 epoch: 40, train_loss: 0.5381, test_loss: 1.1615, test_f1: 0.6636
 epoch: 41, train_loss: 0.5412, test_loss: 1.1259, test_f1: 0.6419
 epoch: 42, train_loss: 0.5337, test_loss: 1.0994, test_f1: 0.6739
 epoch: 43, train_loss: 0.5122, test_loss: 1.1270, test_f1: 0.6448
 epoch: 44, train_loss: 0.4954, test_loss: 1.1255, test_f1: 0.6601
 epoch: 45, train_loss: 0.5124, test_loss: 1.1172, test_f1: 0.6375
 epoch: 46, train_loss: 0.4692, test_loss: 1.3459, test_f1: 0.6219
 epoch: 47, train_loss: 0.4920, test_loss: 1.1681, test_f1: 0.6639
 epoch: 48, train_loss: 0.4973, test_loss: 1.1470, test_f1: 0.6382
 epoch: 49, train_loss: 0.4583, test_loss: 1.1855, test_f1: 0.6653
 epoch: 50, train_loss: 0.4666, test_loss: 1.0942, test_f1: 0.6299
 epoch: 51, train_loss: 0.4242, test_loss: 1.1790, test_f1: 0.6565
 epoch: 52, train_loss: 0.3876, test_loss: 1.2450, test_f1: 0.6834
 epoch: 53, train_loss: 0.3668, test_loss: 1.2426, test_f1: 0.6660
 epoch: 54, train_loss: 0.3685, test_loss: 1.2897, test_f1: 0.6550
 epoch: 55, train_loss: 0.3435, test_loss: 1.3367, test_f1: 0.6680
 epoch: 56, train_loss: 0.3390, test_loss: 1.3904, test_f1: 0.6702
 epoch: 57, train_loss: 0.3401, test_loss: 1.3348, test_f1: 0.6850
 epoch: 58, train_loss: 0.3268, test_loss: 1.3900, test_f1: 0.6745
 epoch: 59, train_loss: 0.3253, test_loss: 1.3227, test_f1: 0.6720
 epoch: 60, train_loss: 0.3241, test_loss: 1.3050, test_f1: 0.6847
 epoch: 61, train_loss: 0.3066, test_loss: 1.4422, test_f1: 0.6673
 epoch: 62, train_loss: 0.3111, test_loss: 1.6139, test_f1: 0.6532
 epoch: 63, train_loss: 0.3022, test_loss: 1.5002, test_f1: 0.6482
 epoch: 64, train_loss: 0.3090, test_loss: 1.3801, test_f1: 0.6841
 epoch: 65, train_loss: 0.2943, test_loss: 1.4238, test_f1: 0.6797
 epoch: 66, train_loss: 0.2860, test_loss: 1.5183, test_f1: 0.6721
 epoch: 67, train_loss: 0.2938, test_loss: 1.5312, test_f1: 0.6441
 epoch: 68, train_loss: 0.2881, test_loss: 1.5109, test_f1: 0.6697
 epoch: 69, train_loss: 0.2922, test_loss: 1.5525, test_f1: 0.6558
 epoch: 70, train_loss: 0.2854, test_loss: 1.4777, test_f1: 0.6790
 epoch: 71, train_loss: 0.2853, test_loss: 1.4059, test_f1: 0.6615
 epoch: 72, train_loss: 0.2773, test_loss: 1.5195, test_f1: 0.6666
 epoch: 73, train_loss: 0.2850, test_loss: 1.4907, test_f1: 0.6759
 epoch: 74, train_loss: 0.2678, test_loss: 1.5782, test_f1: 0.6493
 epoch: 75, train_loss: 0.2784, test_loss: 1.5381, test_f1: 0.6730
 epoch: 76, train_loss: 0.2707, test_loss: 1.5983, test_f1: 0.6620
 epoch: 77, train_loss: 0.2711, test_loss: 1.5615, test_f1: 0.6982
 epoch: 78, train_loss: 0.2631, test_loss: 1.5872, test_f1: 0.6540
 epoch: 79, train_loss: 0.2549, test_loss: 1.6319, test_f1: 0.6689
 epoch: 80, train_loss: 0.2513, test_loss: 1.5722, test_f1: 0.6614
 epoch: 81, train_loss: 0.2406, test_loss: 1.5842, test_f1: 0.6764
 epoch: 82, train_loss: 0.2459, test_loss: 1.7562, test_f1: 0.6594
 epoch: 83, train_loss: 0.2448, test_loss: 1.6855, test_f1: 0.6501
 epoch: 84, train_loss: 0.2394, test_loss: 1.6905, test_f1: 0.6423
 epoch: 85, train_loss: 0.2479, test_loss: 1.6843, test_f1: 0.6622
 epoch: 86, train_loss: 0.2353, test_loss: 1.6516, test_f1: 0.6661
 epoch: 87, train_loss: 0.2483, test_loss: 1.7182, test_f1: 0.6745
 epoch: 88, train_loss: 0.2163, test_loss: 1.8339, test_f1: 0.6495
 epoch: 89, train_loss: 0.2183, test_loss: 1.8240, test_f1: 0.6780
 epoch: 90, train_loss: 0.2313, test_loss: 1.6774, test_f1: 0.6686
 epoch: 91, train_loss: 0.2389, test_loss: 1.8238, test_f1: 0.6680
 epoch: 92, train_loss: 0.2116, test_loss: 1.7711, test_f1: 0.6694
 epoch: 93, train_loss: 0.2351, test_loss: 1.8492, test_f1: 0.6853
 epoch: 94, train_loss: 0.2213, test_loss: 1.8677, test_f1: 0.6592
 epoch: 95, train_loss: 0.2204, test_loss: 1.8753, test_f1: 0.6633
 epoch: 96, train_loss: 0.2199, test_loss: 1.8811, test_f1: 0.6577
 epoch: 97, train_loss: 0.2119, test_loss: 1.9148, test_f1: 0.6581
 epoch: 98, train_loss: 0.2045, test_loss: 1.8760, test_f1: 0.6579
 epoch: 99, train_loss: 0.2150, test_loss: 1.9650, test_f1: 0.6614
##################ITERATION #7 ****************************************
 epoch: 0, train_loss: 1.2603, test_loss: 1.0637, test_f1: 0.4269
 epoch: 1, train_loss: 0.9869, test_loss: 0.9373, test_f1: 0.4888
 epoch: 2, train_loss: 0.9326, test_loss: 0.9393, test_f1: 0.5162
 epoch: 3, train_loss: 0.9219, test_loss: 0.9708, test_f1: 0.4940
 epoch: 4, train_loss: 0.8996, test_loss: 0.9096, test_f1: 0.5403
 epoch: 5, train_loss: 0.8752, test_loss: 0.9402, test_f1: 0.5433
 epoch: 6, train_loss: 0.8528, test_loss: 1.0134, test_f1: 0.5165
 epoch: 7, train_loss: 0.8503, test_loss: 0.9993, test_f1: 0.5181
 epoch: 8, train_loss: 0.8164, test_loss: 0.9344, test_f1: 0.5459
 epoch: 9, train_loss: 0.8173, test_loss: 0.9699, test_f1: 0.5586
 epoch: 10, train_loss: 0.8027, test_loss: 0.9693, test_f1: 0.5757
 epoch: 11, train_loss: 0.8055, test_loss: 0.8972, test_f1: 0.5656
 epoch: 12, train_loss: 0.7828, test_loss: 1.0363, test_f1: 0.5452
 epoch: 13, train_loss: 0.7684, test_loss: 0.9493, test_f1: 0.6072
 epoch: 14, train_loss: 0.7527, test_loss: 0.9722, test_f1: 0.6000
 epoch: 15, train_loss: 0.7336, test_loss: 0.9131, test_f1: 0.5871
 epoch: 16, train_loss: 0.7500, test_loss: 0.9638, test_f1: 0.5618
 epoch: 17, train_loss: 0.7353, test_loss: 0.9490, test_f1: 0.5869
 epoch: 18, train_loss: 0.7203, test_loss: 0.9514, test_f1: 0.6227
 epoch: 19, train_loss: 0.6949, test_loss: 0.9605, test_f1: 0.6355
 epoch: 20, train_loss: 0.6856, test_loss: 0.9198, test_f1: 0.6105
 epoch: 21, train_loss: 0.7031, test_loss: 0.9435, test_f1: 0.6300
 epoch: 22, train_loss: 0.6777, test_loss: 0.8985, test_f1: 0.6195
 epoch: 23, train_loss: 0.6589, test_loss: 0.9933, test_f1: 0.6266
 epoch: 24, train_loss: 0.6551, test_loss: 1.0054, test_f1: 0.5888
 epoch: 25, train_loss: 0.6428, test_loss: 1.0205, test_f1: 0.6074
 epoch: 26, train_loss: 0.6254, test_loss: 0.9570, test_f1: 0.6329
 epoch: 27, train_loss: 0.6185, test_loss: 1.0358, test_f1: 0.6203
 epoch: 28, train_loss: 0.6115, test_loss: 0.9435, test_f1: 0.6376
 epoch: 29, train_loss: 0.5992, test_loss: 1.0477, test_f1: 0.6088
 epoch: 30, train_loss: 0.5828, test_loss: 1.0059, test_f1: 0.6261
 epoch: 31, train_loss: 0.5789, test_loss: 1.0288, test_f1: 0.6032
 epoch: 32, train_loss: 0.5708, test_loss: 0.9425, test_f1: 0.6424
 epoch: 33, train_loss: 0.5657, test_loss: 1.0442, test_f1: 0.6178
 epoch: 34, train_loss: 0.5652, test_loss: 1.0674, test_f1: 0.6411
 epoch: 35, train_loss: 0.5546, test_loss: 1.0381, test_f1: 0.6125
 epoch: 36, train_loss: 0.5560, test_loss: 0.9859, test_f1: 0.6354
 epoch: 37, train_loss: 0.5389, test_loss: 1.0070, test_f1: 0.6528
 epoch: 38, train_loss: 0.5309, test_loss: 1.1064, test_f1: 0.6165
 epoch: 39, train_loss: 0.4984, test_loss: 1.0362, test_f1: 0.6470
 epoch: 40, train_loss: 0.4925, test_loss: 1.1267, test_f1: 0.6656
 epoch: 41, train_loss: 0.4739, test_loss: 1.0968, test_f1: 0.6626
 epoch: 42, train_loss: 0.4867, test_loss: 1.2001, test_f1: 0.6343
 epoch: 43, train_loss: 0.4758, test_loss: 1.1574, test_f1: 0.6443
 epoch: 44, train_loss: 0.4739, test_loss: 1.1625, test_f1: 0.6401
 epoch: 45, train_loss: 0.4521, test_loss: 1.1423, test_f1: 0.6689
 epoch: 46, train_loss: 0.4522, test_loss: 1.2341, test_f1: 0.6400
 epoch: 47, train_loss: 0.4719, test_loss: 1.1581, test_f1: 0.6420
 epoch: 48, train_loss: 0.4541, test_loss: 1.1540, test_f1: 0.6491
 epoch: 49, train_loss: 0.4352, test_loss: 1.1633, test_f1: 0.6630
 epoch: 50, train_loss: 0.4400, test_loss: 1.2139, test_f1: 0.6773
 epoch: 51, train_loss: 0.3962, test_loss: 1.2231, test_f1: 0.6573
 epoch: 52, train_loss: 0.3464, test_loss: 1.2395, test_f1: 0.6769
 epoch: 53, train_loss: 0.3497, test_loss: 1.2278, test_f1: 0.6666
 epoch: 54, train_loss: 0.3569, test_loss: 1.3141, test_f1: 0.6680
 epoch: 55, train_loss: 0.3205, test_loss: 1.2854, test_f1: 0.6742
 epoch: 56, train_loss: 0.3100, test_loss: 1.3726, test_f1: 0.6440
 epoch: 57, train_loss: 0.2997, test_loss: 1.3668, test_f1: 0.6644
 epoch: 58, train_loss: 0.2968, test_loss: 1.3669, test_f1: 0.6510
 epoch: 59, train_loss: 0.2909, test_loss: 1.3960, test_f1: 0.6634
 epoch: 60, train_loss: 0.3017, test_loss: 1.3922, test_f1: 0.6586
 epoch: 61, train_loss: 0.2923, test_loss: 1.4204, test_f1: 0.6434
 epoch: 62, train_loss: 0.2716, test_loss: 1.4103, test_f1: 0.6518
 epoch: 63, train_loss: 0.2706, test_loss: 1.5479, test_f1: 0.6484
 epoch: 64, train_loss: 0.2901, test_loss: 1.4836, test_f1: 0.6390
 epoch: 65, train_loss: 0.2792, test_loss: 1.4856, test_f1: 0.6349
 epoch: 66, train_loss: 0.2681, test_loss: 1.5202, test_f1: 0.6470
 epoch: 67, train_loss: 0.2502, test_loss: 1.5034, test_f1: 0.6489
 epoch: 68, train_loss: 0.2907, test_loss: 1.4961, test_f1: 0.6417
 epoch: 69, train_loss: 0.2552, test_loss: 1.6525, test_f1: 0.6336
 epoch: 70, train_loss: 0.2583, test_loss: 1.4866, test_f1: 0.6691
 epoch: 71, train_loss: 0.2435, test_loss: 1.5617, test_f1: 0.6440
 epoch: 72, train_loss: 0.2391, test_loss: 1.5429, test_f1: 0.6456
 epoch: 73, train_loss: 0.2508, test_loss: 1.5532, test_f1: 0.6473
 epoch: 74, train_loss: 0.2296, test_loss: 1.6211, test_f1: 0.6478
 epoch: 75, train_loss: 0.2171, test_loss: 1.6114, test_f1: 0.6431
 epoch: 76, train_loss: 0.2207, test_loss: 1.6769, test_f1: 0.6335
 epoch: 77, train_loss: 0.2295, test_loss: 1.6754, test_f1: 0.6691
 epoch: 78, train_loss: 0.2125, test_loss: 1.5967, test_f1: 0.6571
 epoch: 79, train_loss: 0.2061, test_loss: 1.6895, test_f1: 0.6490
 epoch: 80, train_loss: 0.2091, test_loss: 1.7767, test_f1: 0.6256
 epoch: 81, train_loss: 0.2348, test_loss: 1.6632, test_f1: 0.6398
 epoch: 82, train_loss: 0.2253, test_loss: 1.6730, test_f1: 0.6242
 epoch: 83, train_loss: 0.2007, test_loss: 1.8071, test_f1: 0.6450
 epoch: 84, train_loss: 0.2090, test_loss: 1.7816, test_f1: 0.6268
 epoch: 85, train_loss: 0.2057, test_loss: 1.7437, test_f1: 0.6465
 epoch: 86, train_loss: 0.2176, test_loss: 1.7176, test_f1: 0.6638
 epoch: 87, train_loss: 0.2141, test_loss: 1.7294, test_f1: 0.6492
 epoch: 88, train_loss: 0.2115, test_loss: 1.6606, test_f1: 0.6414
 epoch: 89, train_loss: 0.2016, test_loss: 1.7580, test_f1: 0.6297
 epoch: 90, train_loss: 0.1975, test_loss: 1.7287, test_f1: 0.6641
 epoch: 91, train_loss: 0.1732, test_loss: 1.8354, test_f1: 0.6342
 epoch: 92, train_loss: 0.1908, test_loss: 1.8594, test_f1: 0.6223
 epoch: 93, train_loss: 0.1948, test_loss: 1.7720, test_f1: 0.6371
 epoch: 94, train_loss: 0.2020, test_loss: 1.8103, test_f1: 0.6432
 epoch: 95, train_loss: 0.1946, test_loss: 1.7655, test_f1: 0.6299
 epoch: 96, train_loss: 0.1818, test_loss: 1.8946, test_f1: 0.6233
 epoch: 97, train_loss: 0.1901, test_loss: 1.8603, test_f1: 0.6334
 epoch: 98, train_loss: 0.2027, test_loss: 1.9782, test_f1: 0.6430
 epoch: 99, train_loss: 0.1958, test_loss: 1.9368, test_f1: 0.6318
##################ITERATION #8 ****************************************
 epoch: 0, train_loss: 1.3384, test_loss: 1.0231, test_f1: 0.5136
 epoch: 1, train_loss: 1.0145, test_loss: 0.9079, test_f1: 0.4869
 epoch: 2, train_loss: 0.9693, test_loss: 0.9156, test_f1: 0.5439
 epoch: 3, train_loss: 0.9380, test_loss: 0.9154, test_f1: 0.5063
 epoch: 4, train_loss: 0.9112, test_loss: 0.9514, test_f1: 0.5438
 epoch: 5, train_loss: 0.9078, test_loss: 1.0142, test_f1: 0.5264
 epoch: 6, train_loss: 0.8879, test_loss: 0.9493, test_f1: 0.5381
 epoch: 7, train_loss: 0.8568, test_loss: 0.9590, test_f1: 0.5660
 epoch: 8, train_loss: 0.8588, test_loss: 0.9736, test_f1: 0.5806
 epoch: 9, train_loss: 0.8339, test_loss: 0.9766, test_f1: 0.5307
 epoch: 10, train_loss: 0.8295, test_loss: 0.9728, test_f1: 0.5434
 epoch: 11, train_loss: 0.8158, test_loss: 0.9634, test_f1: 0.5341
 epoch: 12, train_loss: 0.8023, test_loss: 0.9483, test_f1: 0.5766
 epoch: 13, train_loss: 0.7929, test_loss: 1.0022, test_f1: 0.5799
 epoch: 14, train_loss: 0.7855, test_loss: 1.0438, test_f1: 0.5535
 epoch: 15, train_loss: 0.7798, test_loss: 0.9175, test_f1: 0.5785
 epoch: 16, train_loss: 0.7698, test_loss: 0.9681, test_f1: 0.5896
 epoch: 17, train_loss: 0.7530, test_loss: 0.9385, test_f1: 0.5767
 epoch: 18, train_loss: 0.7459, test_loss: 0.8783, test_f1: 0.6103
 epoch: 19, train_loss: 0.7288, test_loss: 1.0038, test_f1: 0.5785
 epoch: 20, train_loss: 0.7500, test_loss: 0.9761, test_f1: 0.6415
 epoch: 21, train_loss: 0.7238, test_loss: 0.9356, test_f1: 0.6177
 epoch: 22, train_loss: 0.6982, test_loss: 0.9649, test_f1: 0.6141
 epoch: 23, train_loss: 0.7041, test_loss: 1.0279, test_f1: 0.5875
 epoch: 24, train_loss: 0.7068, test_loss: 1.0785, test_f1: 0.5997
 epoch: 25, train_loss: 0.6869, test_loss: 1.0410, test_f1: 0.6187
 epoch: 26, train_loss: 0.6874, test_loss: 0.9330, test_f1: 0.6111
 epoch: 27, train_loss: 0.6630, test_loss: 0.9905, test_f1: 0.5607
 epoch: 28, train_loss: 0.6927, test_loss: 1.0023, test_f1: 0.6349
 epoch: 29, train_loss: 0.6465, test_loss: 1.1195, test_f1: 0.6213
 epoch: 30, train_loss: 0.6470, test_loss: 1.0135, test_f1: 0.6292
 epoch: 31, train_loss: 0.6311, test_loss: 1.0586, test_f1: 0.6256
 epoch: 32, train_loss: 0.6336, test_loss: 1.1089, test_f1: 0.6548
 epoch: 33, train_loss: 0.6361, test_loss: 1.1259, test_f1: 0.5646
 epoch: 34, train_loss: 0.6039, test_loss: 1.0309, test_f1: 0.6397
 epoch: 35, train_loss: 0.6169, test_loss: 1.0432, test_f1: 0.6405
 epoch: 36, train_loss: 0.6108, test_loss: 1.0686, test_f1: 0.6001
 epoch: 37, train_loss: 0.6117, test_loss: 1.0973, test_f1: 0.6313
 epoch: 38, train_loss: 0.5988, test_loss: 1.0878, test_f1: 0.6478
 epoch: 39, train_loss: 0.6061, test_loss: 1.1496, test_f1: 0.5958
 epoch: 40, train_loss: 0.5767, test_loss: 1.0691, test_f1: 0.6398
 epoch: 41, train_loss: 0.5617, test_loss: 1.0999, test_f1: 0.6133
 epoch: 42, train_loss: 0.5605, test_loss: 1.1147, test_f1: 0.6608
 epoch: 43, train_loss: 0.5564, test_loss: 1.2046, test_f1: 0.6410
 epoch: 44, train_loss: 0.5348, test_loss: 1.1733, test_f1: 0.6421
 epoch: 45, train_loss: 0.5614, test_loss: 1.1976, test_f1: 0.6280
 epoch: 46, train_loss: 0.5420, test_loss: 1.1284, test_f1: 0.6259
 epoch: 47, train_loss: 0.5185, test_loss: 1.1484, test_f1: 0.6234
 epoch: 48, train_loss: 0.5172, test_loss: 1.1099, test_f1: 0.6089
 epoch: 49, train_loss: 0.5106, test_loss: 1.1220, test_f1: 0.6597
 epoch: 50, train_loss: 0.5149, test_loss: 1.1263, test_f1: 0.6617
 epoch: 51, train_loss: 0.4748, test_loss: 1.1851, test_f1: 0.6507
 epoch: 52, train_loss: 0.4424, test_loss: 1.1333, test_f1: 0.6589
 epoch: 53, train_loss: 0.4204, test_loss: 1.2208, test_f1: 0.6484
 epoch: 54, train_loss: 0.4054, test_loss: 1.2218, test_f1: 0.6571
 epoch: 55, train_loss: 0.3897, test_loss: 1.2680, test_f1: 0.6436
 epoch: 56, train_loss: 0.3695, test_loss: 1.2907, test_f1: 0.6464
 epoch: 57, train_loss: 0.3920, test_loss: 1.2797, test_f1: 0.6333
 epoch: 58, train_loss: 0.3809, test_loss: 1.4159, test_f1: 0.6339
 epoch: 59, train_loss: 0.3677, test_loss: 1.4064, test_f1: 0.6169
 epoch: 60, train_loss: 0.3713, test_loss: 1.4490, test_f1: 0.6162
 epoch: 61, train_loss: 0.3642, test_loss: 1.4260, test_f1: 0.6533
 epoch: 62, train_loss: 0.3790, test_loss: 1.4538, test_f1: 0.6340
 epoch: 63, train_loss: 0.3804, test_loss: 1.3792, test_f1: 0.6263
 epoch: 64, train_loss: 0.3553, test_loss: 1.3905, test_f1: 0.6353
 epoch: 65, train_loss: 0.3435, test_loss: 1.3800, test_f1: 0.6379
 epoch: 66, train_loss: 0.3709, test_loss: 1.4408, test_f1: 0.6136
 epoch: 67, train_loss: 0.3430, test_loss: 1.4715, test_f1: 0.6605
 epoch: 68, train_loss: 0.3407, test_loss: 1.5667, test_f1: 0.6303
 epoch: 69, train_loss: 0.3391, test_loss: 1.4828, test_f1: 0.6262
 epoch: 70, train_loss: 0.3267, test_loss: 1.5025, test_f1: 0.6050
 epoch: 71, train_loss: 0.3399, test_loss: 1.4419, test_f1: 0.6372
 epoch: 72, train_loss: 0.3212, test_loss: 1.4298, test_f1: 0.6428
 epoch: 73, train_loss: 0.3166, test_loss: 1.5228, test_f1: 0.6488
 epoch: 74, train_loss: 0.3032, test_loss: 1.4778, test_f1: 0.6230
 epoch: 75, train_loss: 0.3014, test_loss: 1.4316, test_f1: 0.6304
 epoch: 76, train_loss: 0.2935, test_loss: 1.4262, test_f1: 0.6464
 epoch: 77, train_loss: 0.3266, test_loss: 1.5634, test_f1: 0.6354
 epoch: 78, train_loss: 0.3037, test_loss: 1.4746, test_f1: 0.6231
 epoch: 79, train_loss: 0.3017, test_loss: 1.5496, test_f1: 0.6080
 epoch: 80, train_loss: 0.2860, test_loss: 1.5742, test_f1: 0.6291
 epoch: 81, train_loss: 0.2941, test_loss: 1.5776, test_f1: 0.6261
 epoch: 82, train_loss: 0.2643, test_loss: 1.6776, test_f1: 0.6093
 epoch: 83, train_loss: 0.2783, test_loss: 1.5749, test_f1: 0.6403
 epoch: 84, train_loss: 0.2742, test_loss: 1.6899, test_f1: 0.6116
 epoch: 85, train_loss: 0.2664, test_loss: 1.6282, test_f1: 0.6447
 epoch: 86, train_loss: 0.2755, test_loss: 1.6579, test_f1: 0.6434
 epoch: 87, train_loss: 0.2747, test_loss: 1.7172, test_f1: 0.6132
 epoch: 88, train_loss: 0.2796, test_loss: 1.6919, test_f1: 0.5886
 epoch: 89, train_loss: 0.2567, test_loss: 1.7356, test_f1: 0.6259
 epoch: 90, train_loss: 0.2537, test_loss: 1.7245, test_f1: 0.6175
 epoch: 91, train_loss: 0.2610, test_loss: 1.7662, test_f1: 0.6250
 epoch: 92, train_loss: 0.2526, test_loss: 1.8454, test_f1: 0.6057
 epoch: 93, train_loss: 0.2490, test_loss: 1.8777, test_f1: 0.6197
 epoch: 94, train_loss: 0.2437, test_loss: 1.8766, test_f1: 0.6271
 epoch: 95, train_loss: 0.2491, test_loss: 1.6302, test_f1: 0.6532
 epoch: 96, train_loss: 0.2505, test_loss: 1.8225, test_f1: 0.6306
 epoch: 97, train_loss: 0.2574, test_loss: 1.7663, test_f1: 0.6363
 epoch: 98, train_loss: 0.2334, test_loss: 1.6573, test_f1: 0.6187
 epoch: 99, train_loss: 0.2614, test_loss: 1.7651, test_f1: 0.6052
##################ITERATION #9 ****************************************
 epoch: 0, train_loss: 1.2844, test_loss: 1.0246, test_f1: 0.4603
 epoch: 1, train_loss: 0.9885, test_loss: 0.9677, test_f1: 0.4545
 epoch: 2, train_loss: 0.9577, test_loss: 0.9359, test_f1: 0.4474
 epoch: 3, train_loss: 0.9286, test_loss: 0.9528, test_f1: 0.4891
 epoch: 4, train_loss: 0.9246, test_loss: 0.9457, test_f1: 0.5080
 epoch: 5, train_loss: 0.8890, test_loss: 0.9433, test_f1: 0.5212
 epoch: 6, train_loss: 0.8734, test_loss: 0.9329, test_f1: 0.5163
 epoch: 7, train_loss: 0.8568, test_loss: 0.9966, test_f1: 0.4930
 epoch: 8, train_loss: 0.8545, test_loss: 0.9828, test_f1: 0.4991
 epoch: 9, train_loss: 0.8502, test_loss: 0.9381, test_f1: 0.5393
 epoch: 10, train_loss: 0.8417, test_loss: 0.9548, test_f1: 0.5582
 epoch: 11, train_loss: 0.8085, test_loss: 0.9350, test_f1: 0.5404
 epoch: 12, train_loss: 0.8044, test_loss: 0.9564, test_f1: 0.5590
 epoch: 13, train_loss: 0.7936, test_loss: 1.0534, test_f1: 0.5379
 epoch: 14, train_loss: 0.7836, test_loss: 0.9667, test_f1: 0.5332
 epoch: 15, train_loss: 0.7759, test_loss: 0.9058, test_f1: 0.5707
 epoch: 16, train_loss: 0.7566, test_loss: 0.9528, test_f1: 0.5931
 epoch: 17, train_loss: 0.7595, test_loss: 0.9771, test_f1: 0.5818
 epoch: 18, train_loss: 0.7384, test_loss: 1.0012, test_f1: 0.6048
 epoch: 19, train_loss: 0.7437, test_loss: 0.9331, test_f1: 0.5988
 epoch: 20, train_loss: 0.7222, test_loss: 0.9707, test_f1: 0.5996
 epoch: 21, train_loss: 0.7120, test_loss: 1.0327, test_f1: 0.5676
 epoch: 22, train_loss: 0.7065, test_loss: 0.9899, test_f1: 0.6015
 epoch: 23, train_loss: 0.7032, test_loss: 1.0235, test_f1: 0.6064
 epoch: 24, train_loss: 0.6982, test_loss: 1.0253, test_f1: 0.5996
 epoch: 25, train_loss: 0.6776, test_loss: 1.0313, test_f1: 0.5997
 epoch: 26, train_loss: 0.6636, test_loss: 1.0325, test_f1: 0.5973
 epoch: 27, train_loss: 0.6707, test_loss: 0.9088, test_f1: 0.6232
 epoch: 28, train_loss: 0.6542, test_loss: 0.9413, test_f1: 0.6221
 epoch: 29, train_loss: 0.6393, test_loss: 1.0065, test_f1: 0.6345
 epoch: 30, train_loss: 0.6391, test_loss: 1.0238, test_f1: 0.5649
 epoch: 31, train_loss: 0.6388, test_loss: 0.9484, test_f1: 0.6135
 epoch: 32, train_loss: 0.6128, test_loss: 0.9030, test_f1: 0.6438
 epoch: 33, train_loss: 0.6377, test_loss: 0.9758, test_f1: 0.6053
 epoch: 34, train_loss: 0.5943, test_loss: 0.9534, test_f1: 0.6416
 epoch: 35, train_loss: 0.6066, test_loss: 0.9502, test_f1: 0.6031
 epoch: 36, train_loss: 0.5875, test_loss: 0.9850, test_f1: 0.6156
 epoch: 37, train_loss: 0.5827, test_loss: 0.9563, test_f1: 0.6402
 epoch: 38, train_loss: 0.6075, test_loss: 0.9405, test_f1: 0.6103
 epoch: 39, train_loss: 0.5659, test_loss: 1.1249, test_f1: 0.6414
 epoch: 40, train_loss: 0.5595, test_loss: 1.0010, test_f1: 0.6473
 epoch: 41, train_loss: 0.5479, test_loss: 1.0084, test_f1: 0.6415
 epoch: 42, train_loss: 0.5356, test_loss: 0.9607, test_f1: 0.6600
 epoch: 43, train_loss: 0.5436, test_loss: 1.0753, test_f1: 0.6184
 epoch: 44, train_loss: 0.5264, test_loss: 1.0236, test_f1: 0.6488
 epoch: 45, train_loss: 0.5155, test_loss: 1.1130, test_f1: 0.6229
 epoch: 46, train_loss: 0.5213, test_loss: 1.0610, test_f1: 0.6363
 epoch: 47, train_loss: 0.4972, test_loss: 1.0528, test_f1: 0.6447
 epoch: 48, train_loss: 0.4960, test_loss: 0.9800, test_f1: 0.6564
 epoch: 49, train_loss: 0.4716, test_loss: 1.0953, test_f1: 0.6155
 epoch: 50, train_loss: 0.5033, test_loss: 1.0787, test_f1: 0.6262
 epoch: 51, train_loss: 0.4515, test_loss: 1.1176, test_f1: 0.6189
 epoch: 52, train_loss: 0.4220, test_loss: 1.1416, test_f1: 0.6346
 epoch: 53, train_loss: 0.4197, test_loss: 1.1194, test_f1: 0.6288
 epoch: 54, train_loss: 0.4057, test_loss: 1.1514, test_f1: 0.6715
 epoch: 55, train_loss: 0.3727, test_loss: 1.2076, test_f1: 0.6412
 epoch: 56, train_loss: 0.3900, test_loss: 1.2384, test_f1: 0.6503
 epoch: 57, train_loss: 0.3813, test_loss: 1.1305, test_f1: 0.6585
 epoch: 58, train_loss: 0.3709, test_loss: 1.1899, test_f1: 0.6400
 epoch: 59, train_loss: 0.3498, test_loss: 1.3320, test_f1: 0.6384
 epoch: 60, train_loss: 0.3403, test_loss: 1.3163, test_f1: 0.6592
 epoch: 61, train_loss: 0.3392, test_loss: 1.3157, test_f1: 0.6134
 epoch: 62, train_loss: 0.3433, test_loss: 1.2628, test_f1: 0.6524
 epoch: 63, train_loss: 0.3316, test_loss: 1.3527, test_f1: 0.6629
 epoch: 64, train_loss: 0.3248, test_loss: 1.3871, test_f1: 0.6504
 epoch: 65, train_loss: 0.3341, test_loss: 1.2236, test_f1: 0.6452
 epoch: 66, train_loss: 0.3213, test_loss: 1.3202, test_f1: 0.6310
 epoch: 67, train_loss: 0.3214, test_loss: 1.2933, test_f1: 0.6483
 epoch: 68, train_loss: 0.3142, test_loss: 1.3173, test_f1: 0.6336
 epoch: 69, train_loss: 0.3159, test_loss: 1.4317, test_f1: 0.6540
 epoch: 70, train_loss: 0.2998, test_loss: 1.2665, test_f1: 0.6410
 epoch: 71, train_loss: 0.3204, test_loss: 1.2804, test_f1: 0.6484
 epoch: 72, train_loss: 0.3011, test_loss: 1.3069, test_f1: 0.6471
 epoch: 73, train_loss: 0.2920, test_loss: 1.4120, test_f1: 0.6375
 epoch: 74, train_loss: 0.2740, test_loss: 1.3858, test_f1: 0.6435
 epoch: 75, train_loss: 0.2857, test_loss: 1.4227, test_f1: 0.6280
 epoch: 76, train_loss: 0.2749, test_loss: 1.4031, test_f1: 0.6643
 epoch: 77, train_loss: 0.2897, test_loss: 1.4950, test_f1: 0.6315
 epoch: 78, train_loss: 0.2675, test_loss: 1.3956, test_f1: 0.6644
 epoch: 79, train_loss: 0.2866, test_loss: 1.3366, test_f1: 0.6588
 epoch: 80, train_loss: 0.2540, test_loss: 1.4179, test_f1: 0.6667
 epoch: 81, train_loss: 0.2747, test_loss: 1.4169, test_f1: 0.6482
 epoch: 82, train_loss: 0.2692, test_loss: 1.4740, test_f1: 0.6433
 epoch: 83, train_loss: 0.2789, test_loss: 1.3928, test_f1: 0.6504
 epoch: 84, train_loss: 0.2636, test_loss: 1.6070, test_f1: 0.6579
 epoch: 85, train_loss: 0.2786, test_loss: 1.4449, test_f1: 0.6373
 epoch: 86, train_loss: 0.2709, test_loss: 1.5206, test_f1: 0.6338
 epoch: 87, train_loss: 0.2547, test_loss: 1.5555, test_f1: 0.6403
 epoch: 88, train_loss: 0.2366, test_loss: 1.5298, test_f1: 0.6423
 epoch: 89, train_loss: 0.2476, test_loss: 1.6542, test_f1: 0.6232
 epoch: 90, train_loss: 0.2713, test_loss: 1.6564, test_f1: 0.6704
 epoch: 91, train_loss: 0.2580, test_loss: 1.5491, test_f1: 0.6356
 epoch: 92, train_loss: 0.2259, test_loss: 1.5951, test_f1: 0.6483
 epoch: 93, train_loss: 0.2328, test_loss: 1.5896, test_f1: 0.6224
 epoch: 94, train_loss: 0.2143, test_loss: 1.5728, test_f1: 0.6251
 epoch: 95, train_loss: 0.2141, test_loss: 1.5749, test_f1: 0.6549
 epoch: 96, train_loss: 0.2276, test_loss: 1.6989, test_f1: 0.6469
 epoch: 97, train_loss: 0.2267, test_loss: 1.6689, test_f1: 0.6398
 epoch: 98, train_loss: 0.2230, test_loss: 1.6498, test_f1: 0.6329
 epoch: 99, train_loss: 0.2359, test_loss: 1.5684, test_f1: 0.6286

Training completed in 791.38 seconds
Best F1: 0.6982 at epoch 77
Mean F1 across iterations: 0.6795  0.0111
========================FINAL RESULTS================================
FEGIN weighted F1: 0.6982  0.0111
python main.py --data ltspice_examples --representation component_net --model FEGIN --layers 5 --hiddens 128 --batch_size 64 --lr 0.001 --emb_size 250 --epochs 100 --save_appendix component_net_L5_H128_BS64_LR0.001_E250 --no_val
-----



STDERR:
  File "main.py", line 370, in <module>
    main()
  File "main.py", line 254, in main
    dataset = dataset_class(
  File "/home/philip/projects/ltspice_examples_code_repo/Circuit-Completion-Using-GNNs/component_classification_with_link_prediction_head/evaluation/FEGIN/kernel/circuit_datasets.py", line 15, in __init__
    self.data, self.slices = torch.load(self.processed_paths[0])
  File "/home/philip/.local/lib/python3.8/site-packages/torch/serialization.py", line 1040, in load
    warnings.warn(
  File "/usr/lib/python3.8/warnings.py", line 109, in _showwarnmsg
    sw(msg.message, msg.category, msg.filename, msg.lineno,
  File "main.py", line 47, in warn_with_traceback
    traceback.print_stack(file=log)
/home/philip/projects/ltspice_examples_code_repo/Circuit-Completion-Using-GNNs/component_classification_with_link_prediction_head/evaluation/FEGIN/kernel/circuit_datasets.py:15: FutureWarning: You are using `torch.load` with `weights_only=False` (the current default value), which uses the default pickle module implicitly. It is possible to construct malicious pickle data which will execute arbitrary code during unpickling (See https://github.com/pytorch/pytorch/blob/main/SECURITY.md#untrusted-models for more details). In a future release, the default value for `weights_only` will be flipped to `True`. This limits the functions that could be executed during unpickling. Arbitrary objects will no longer be allowed to be loaded via this mode unless they are explicitly allowlisted by the user via `torch.serialization.add_safe_globals`. We recommend you start setting `weights_only=True` for any use case where you don't have full control of the loaded file. Please open an issue on GitHub for any issues related to this experimental feature.
  self.data, self.slices = torch.load(self.processed_paths[0])
