STDOUT:
Results will be saved in /home/philip/projects/llm_inference_code_repo/Circuit-Completion-Using-GNNs/component_classification_with_link_prediction_head/evaluation/FEGIN/results/model_FEGIN_dataset_ltspice_examples
Command line input: python main.py --data ltspice_examples --representation component_pin_net --model FEGIN --layers 5 --hiddens 128 --batch_size 256 --lr 0.01 --emb_size 512 --epochs 100 --save_appendix component_pin_net_L5_H128_BS256_LR0.01_E512 --no_val
 is saved.
-----
ltspice_examples - FEGIN
Using 5 layers, 128 hidden units, h = 2
Loading component_pin_net representation dataset
Loading component_pin_net representation data...
Loaded 4404 examples (component_pin_net)
saving path: data/processed/ltspice_examples_component_pin_net_processed.pt
ENTERED
Training FEGIN on component_pin_net representation
Train: 3558, Test: 846
##################ITERATION #0 ****************************************
 epoch: 0, train_loss: 1.2614, test_loss: 1.1584, test_f1: 0.3967
 epoch: 1, train_loss: 1.0534, test_loss: 1.0139, test_f1: 0.4326
 epoch: 2, train_loss: 0.9985, test_loss: 1.2516, test_f1: 0.3986
 epoch: 3, train_loss: 0.9620, test_loss: 0.9780, test_f1: 0.4523
 epoch: 4, train_loss: 0.9268, test_loss: 1.2077, test_f1: 0.4310
 epoch: 5, train_loss: 0.9204, test_loss: 1.0186, test_f1: 0.4439
 epoch: 6, train_loss: 0.8843, test_loss: 1.0291, test_f1: 0.4741
 epoch: 7, train_loss: 0.8778, test_loss: 1.2349, test_f1: 0.4825
 epoch: 8, train_loss: 0.8555, test_loss: 0.9314, test_f1: 0.5300
 epoch: 9, train_loss: 0.8370, test_loss: 1.0040, test_f1: 0.4970
 epoch: 10, train_loss: 0.8243, test_loss: 0.8912, test_f1: 0.5165
 epoch: 11, train_loss: 0.8015, test_loss: 0.9033, test_f1: 0.5020
 epoch: 12, train_loss: 0.7926, test_loss: 0.8774, test_f1: 0.5521
 epoch: 13, train_loss: 0.7497, test_loss: 0.8971, test_f1: 0.5747
 epoch: 14, train_loss: 0.7564, test_loss: 0.8463, test_f1: 0.6125
 epoch: 15, train_loss: 0.7313, test_loss: 0.7692, test_f1: 0.5842
 epoch: 16, train_loss: 0.7343, test_loss: 0.9018, test_f1: 0.5733
 epoch: 17, train_loss: 0.7086, test_loss: 0.7282, test_f1: 0.6629
 epoch: 18, train_loss: 0.6931, test_loss: 0.8518, test_f1: 0.5878
 epoch: 19, train_loss: 0.6840, test_loss: 1.5310, test_f1: 0.4157
 epoch: 20, train_loss: 0.6840, test_loss: 0.7384, test_f1: 0.5836
 epoch: 21, train_loss: 0.6762, test_loss: 0.8760, test_f1: 0.6205
 epoch: 22, train_loss: 0.6575, test_loss: 0.9717, test_f1: 0.6155
 epoch: 23, train_loss: 0.6557, test_loss: 1.0647, test_f1: 0.5382
 epoch: 24, train_loss: 0.6388, test_loss: 1.1543, test_f1: 0.5842
 epoch: 25, train_loss: 0.6410, test_loss: 0.8121, test_f1: 0.5972
 epoch: 26, train_loss: 0.6279, test_loss: 0.9346, test_f1: 0.6387
 epoch: 27, train_loss: 0.6102, test_loss: 0.9976, test_f1: 0.6255
 epoch: 28, train_loss: 0.5786, test_loss: 1.4481, test_f1: 0.5414
 epoch: 29, train_loss: 0.5837, test_loss: 0.7875, test_f1: 0.6522
 epoch: 30, train_loss: 0.5827, test_loss: 1.1055, test_f1: 0.6063
 epoch: 31, train_loss: 0.5750, test_loss: 0.9072, test_f1: 0.6518
 epoch: 32, train_loss: 0.5459, test_loss: 0.9724, test_f1: 0.6238
 epoch: 33, train_loss: 0.5304, test_loss: 0.9573, test_f1: 0.6588
 epoch: 34, train_loss: 0.5472, test_loss: 1.1706, test_f1: 0.6594
 epoch: 35, train_loss: 0.5500, test_loss: 1.1946, test_f1: 0.6089
 epoch: 36, train_loss: 0.5266, test_loss: 0.8301, test_f1: 0.6722
 epoch: 37, train_loss: 0.5166, test_loss: 0.7331, test_f1: 0.6829
 epoch: 38, train_loss: 0.5098, test_loss: 0.9962, test_f1: 0.6821
 epoch: 39, train_loss: 0.5261, test_loss: 0.7840, test_f1: 0.6497
 epoch: 40, train_loss: 0.5196, test_loss: 1.5148, test_f1: 0.6540
 epoch: 41, train_loss: 0.4680, test_loss: 1.3623, test_f1: 0.6288
 epoch: 42, train_loss: 0.4833, test_loss: 0.8427, test_f1: 0.6263
 epoch: 43, train_loss: 0.4824, test_loss: 1.2666, test_f1: 0.6302
 epoch: 44, train_loss: 0.4516, test_loss: 1.0215, test_f1: 0.6983
 epoch: 45, train_loss: 0.4566, test_loss: 1.3328, test_f1: 0.5621
 epoch: 46, train_loss: 0.4882, test_loss: 1.2928, test_f1: 0.5671
 epoch: 47, train_loss: 0.4484, test_loss: 1.1199, test_f1: 0.6414
 epoch: 48, train_loss: 0.4332, test_loss: 1.0703, test_f1: 0.6661
 epoch: 49, train_loss: 0.4652, test_loss: 1.1941, test_f1: 0.6110
 epoch: 50, train_loss: 0.4389, test_loss: 1.1576, test_f1: 0.6760
 epoch: 51, train_loss: 0.3874, test_loss: 1.1550, test_f1: 0.6894
 epoch: 52, train_loss: 0.3714, test_loss: 1.0938, test_f1: 0.7040
 epoch: 53, train_loss: 0.3261, test_loss: 0.9369, test_f1: 0.7063
 epoch: 54, train_loss: 0.3219, test_loss: 0.9680, test_f1: 0.6886
 epoch: 55, train_loss: 0.3289, test_loss: 1.1542, test_f1: 0.6808
 epoch: 56, train_loss: 0.2937, test_loss: 1.2389, test_f1: 0.7051
 epoch: 57, train_loss: 0.2915, test_loss: 0.9781, test_f1: 0.7091
 epoch: 58, train_loss: 0.3005, test_loss: 1.1464, test_f1: 0.6694
 epoch: 59, train_loss: 0.3142, test_loss: 0.9150, test_f1: 0.7153
 epoch: 60, train_loss: 0.2740, test_loss: 0.9608, test_f1: 0.7014
 epoch: 61, train_loss: 0.2910, test_loss: 1.3737, test_f1: 0.6767
 epoch: 62, train_loss: 0.2796, test_loss: 1.2375, test_f1: 0.6865
 epoch: 63, train_loss: 0.2955, test_loss: 1.3259, test_f1: 0.6804
 epoch: 64, train_loss: 0.2732, test_loss: 1.0478, test_f1: 0.7085
 epoch: 65, train_loss: 0.2711, test_loss: 1.1403, test_f1: 0.6722
 epoch: 66, train_loss: 0.2660, test_loss: 1.1890, test_f1: 0.6879
 epoch: 67, train_loss: 0.2623, test_loss: 1.1563, test_f1: 0.7047
 epoch: 68, train_loss: 0.2355, test_loss: 1.2986, test_f1: 0.6963
 epoch: 69, train_loss: 0.2421, test_loss: 1.3120, test_f1: 0.7010
 epoch: 70, train_loss: 0.2480, test_loss: 1.5114, test_f1: 0.6835
 epoch: 71, train_loss: 0.2388, test_loss: 1.4452, test_f1: 0.6729
 epoch: 72, train_loss: 0.2509, test_loss: 1.3681, test_f1: 0.6828
 epoch: 73, train_loss: 0.2308, test_loss: 1.5374, test_f1: 0.7080
 epoch: 74, train_loss: 0.2350, test_loss: 1.3828, test_f1: 0.6875
 epoch: 75, train_loss: 0.2154, test_loss: 1.4204, test_f1: 0.7017
 epoch: 76, train_loss: 0.2385, test_loss: 1.4305, test_f1: 0.6866
 epoch: 77, train_loss: 0.2306, test_loss: 1.3331, test_f1: 0.6916
 epoch: 78, train_loss: 0.2076, test_loss: 1.2173, test_f1: 0.7243
 epoch: 79, train_loss: 0.1916, test_loss: 1.3028, test_f1: 0.7196
 epoch: 80, train_loss: 0.2353, test_loss: 1.4588, test_f1: 0.6594
 epoch: 81, train_loss: 0.2181, test_loss: 1.2913, test_f1: 0.6827
 epoch: 82, train_loss: 0.2148, test_loss: 1.4678, test_f1: 0.7161
 epoch: 83, train_loss: 0.2164, test_loss: 1.5165, test_f1: 0.6757
 epoch: 84, train_loss: 0.1930, test_loss: 1.4354, test_f1: 0.6779
 epoch: 85, train_loss: 0.1793, test_loss: 1.6233, test_f1: 0.6806
 epoch: 86, train_loss: 0.1822, test_loss: 1.5096, test_f1: 0.7009
 epoch: 87, train_loss: 0.2202, test_loss: 1.4418, test_f1: 0.6751
 epoch: 88, train_loss: 0.2289, test_loss: 1.3221, test_f1: 0.6850
 epoch: 89, train_loss: 0.1924, test_loss: 1.3691, test_f1: 0.6909
 epoch: 90, train_loss: 0.1784, test_loss: 1.4904, test_f1: 0.6768
 epoch: 91, train_loss: 0.1884, test_loss: 1.4091, test_f1: 0.6966
 epoch: 92, train_loss: 0.1969, test_loss: 1.4955, test_f1: 0.6930
 epoch: 93, train_loss: 0.1629, test_loss: 1.4784, test_f1: 0.6909
 epoch: 94, train_loss: 0.1500, test_loss: 1.6458, test_f1: 0.6756
 epoch: 95, train_loss: 0.1514, test_loss: 1.6924, test_f1: 0.6956
 epoch: 96, train_loss: 0.1797, test_loss: 1.6111, test_f1: 0.7020
 epoch: 97, train_loss: 0.1950, test_loss: 1.4158, test_f1: 0.6861
 epoch: 98, train_loss: 0.1788, test_loss: 1.3934, test_f1: 0.6868
 epoch: 99, train_loss: 0.1622, test_loss: 1.5732, test_f1: 0.6697
##################ITERATION #1 ****************************************
 epoch: 0, train_loss: 1.5517, test_loss: 1.4456, test_f1: 0.2516
 epoch: 1, train_loss: 1.0342, test_loss: 1.1204, test_f1: 0.4692
 epoch: 2, train_loss: 0.9920, test_loss: 0.9678, test_f1: 0.4393
 epoch: 3, train_loss: 0.9608, test_loss: 0.9766, test_f1: 0.5117
 epoch: 4, train_loss: 0.9566, test_loss: 0.9866, test_f1: 0.4519
 epoch: 5, train_loss: 0.9277, test_loss: 1.0199, test_f1: 0.4842
 epoch: 6, train_loss: 0.8971, test_loss: 0.9038, test_f1: 0.5347
 epoch: 7, train_loss: 0.8771, test_loss: 0.8815, test_f1: 0.5520
 epoch: 8, train_loss: 0.8571, test_loss: 0.9578, test_f1: 0.5383
 epoch: 9, train_loss: 0.8438, test_loss: 0.9619, test_f1: 0.5401
 epoch: 10, train_loss: 0.8242, test_loss: 0.9842, test_f1: 0.5363
 epoch: 11, train_loss: 0.8204, test_loss: 1.3227, test_f1: 0.5177
 epoch: 12, train_loss: 0.8047, test_loss: 1.1507, test_f1: 0.5276
 epoch: 13, train_loss: 0.7896, test_loss: 0.8263, test_f1: 0.5914
 epoch: 14, train_loss: 0.7657, test_loss: 0.9120, test_f1: 0.5051
 epoch: 15, train_loss: 0.7381, test_loss: 0.9528, test_f1: 0.5981
 epoch: 16, train_loss: 0.7265, test_loss: 0.8988, test_f1: 0.6224
 epoch: 17, train_loss: 0.7230, test_loss: 1.0106, test_f1: 0.5522
 epoch: 18, train_loss: 0.7384, test_loss: 1.0688, test_f1: 0.5987
 epoch: 19, train_loss: 0.7074, test_loss: 0.8602, test_f1: 0.6099
 epoch: 20, train_loss: 0.6899, test_loss: 0.8438, test_f1: 0.6211
 epoch: 21, train_loss: 0.6915, test_loss: 1.0871, test_f1: 0.5895
 epoch: 22, train_loss: 0.6730, test_loss: 1.0122, test_f1: 0.5949
 epoch: 23, train_loss: 0.6550, test_loss: 0.9205, test_f1: 0.6191
 epoch: 24, train_loss: 0.6556, test_loss: 0.9790, test_f1: 0.5740
 epoch: 25, train_loss: 0.6520, test_loss: 0.8514, test_f1: 0.6085
 epoch: 26, train_loss: 0.6261, test_loss: 0.8328, test_f1: 0.6411
 epoch: 27, train_loss: 0.6375, test_loss: 1.0042, test_f1: 0.5785
 epoch: 28, train_loss: 0.6211, test_loss: 0.9291, test_f1: 0.6103
 epoch: 29, train_loss: 0.6231, test_loss: 0.9632, test_f1: 0.6314
 epoch: 30, train_loss: 0.6531, test_loss: 0.8785, test_f1: 0.6081
 epoch: 31, train_loss: 0.6074, test_loss: 1.0435, test_f1: 0.4690
 epoch: 32, train_loss: 0.5873, test_loss: 0.8529, test_f1: 0.6171
 epoch: 33, train_loss: 0.5776, test_loss: 0.7636, test_f1: 0.6519
 epoch: 34, train_loss: 0.5717, test_loss: 1.0236, test_f1: 0.6161
 epoch: 35, train_loss: 0.5579, test_loss: 1.0141, test_f1: 0.5965
 epoch: 36, train_loss: 0.5388, test_loss: 0.8292, test_f1: 0.6391
 epoch: 37, train_loss: 0.5346, test_loss: 1.2673, test_f1: 0.6435
 epoch: 38, train_loss: 0.5263, test_loss: 0.9897, test_f1: 0.6302
 epoch: 39, train_loss: 0.5214, test_loss: 1.1388, test_f1: 0.6073
 epoch: 40, train_loss: 0.4938, test_loss: 1.0486, test_f1: 0.5931
 epoch: 41, train_loss: 0.5348, test_loss: 1.0691, test_f1: 0.6286
 epoch: 42, train_loss: 0.4886, test_loss: 1.1532, test_f1: 0.6251
 epoch: 43, train_loss: 0.4855, test_loss: 0.9601, test_f1: 0.6552
 epoch: 44, train_loss: 0.4765, test_loss: 1.1924, test_f1: 0.6528
 epoch: 45, train_loss: 0.4795, test_loss: 1.0512, test_f1: 0.6515
 epoch: 46, train_loss: 0.4875, test_loss: 1.0207, test_f1: 0.6445
 epoch: 47, train_loss: 0.4853, test_loss: 1.1895, test_f1: 0.6725
 epoch: 48, train_loss: 0.4611, test_loss: 1.2031, test_f1: 0.6414
 epoch: 49, train_loss: 0.4554, test_loss: 1.1241, test_f1: 0.6638
 epoch: 50, train_loss: 0.4375, test_loss: 1.0866, test_f1: 0.6492
 epoch: 51, train_loss: 0.4252, test_loss: 1.1041, test_f1: 0.6756
 epoch: 52, train_loss: 0.3902, test_loss: 1.0503, test_f1: 0.6817
 epoch: 53, train_loss: 0.3599, test_loss: 1.0648, test_f1: 0.6858
 epoch: 54, train_loss: 0.3429, test_loss: 1.0241, test_f1: 0.6816
 epoch: 55, train_loss: 0.3390, test_loss: 1.2933, test_f1: 0.6631
 epoch: 56, train_loss: 0.3348, test_loss: 1.2820, test_f1: 0.6762
 epoch: 57, train_loss: 0.3079, test_loss: 1.2971, test_f1: 0.6899
 epoch: 58, train_loss: 0.3126, test_loss: 1.4272, test_f1: 0.6216
 epoch: 59, train_loss: 0.3143, test_loss: 1.1578, test_f1: 0.6788
 epoch: 60, train_loss: 0.3222, test_loss: 1.2562, test_f1: 0.6682
 epoch: 61, train_loss: 0.3005, test_loss: 1.1930, test_f1: 0.6644
 epoch: 62, train_loss: 0.2766, test_loss: 1.4954, test_f1: 0.6542
 epoch: 63, train_loss: 0.2919, test_loss: 1.5925, test_f1: 0.6578
 epoch: 64, train_loss: 0.3002, test_loss: 1.5565, test_f1: 0.6435
 epoch: 65, train_loss: 0.2662, test_loss: 1.4946, test_f1: 0.6836
 epoch: 66, train_loss: 0.2786, test_loss: 1.4727, test_f1: 0.6730
 epoch: 67, train_loss: 0.2676, test_loss: 1.2277, test_f1: 0.6842
 epoch: 68, train_loss: 0.2675, test_loss: 1.3429, test_f1: 0.6654
 epoch: 69, train_loss: 0.2650, test_loss: 1.5516, test_f1: 0.6638
 epoch: 70, train_loss: 0.2819, test_loss: 1.5737, test_f1: 0.6775
 epoch: 71, train_loss: 0.2929, test_loss: 1.7258, test_f1: 0.6192
 epoch: 72, train_loss: 0.2934, test_loss: 1.2988, test_f1: 0.6604
 epoch: 73, train_loss: 0.2763, test_loss: 1.3532, test_f1: 0.6581
 epoch: 74, train_loss: 0.2630, test_loss: 1.3915, test_f1: 0.6705
 epoch: 75, train_loss: 0.2466, test_loss: 1.5007, test_f1: 0.6682
 epoch: 76, train_loss: 0.2566, test_loss: 1.3974, test_f1: 0.6395
 epoch: 77, train_loss: 0.2558, test_loss: 1.7734, test_f1: 0.6416
 epoch: 78, train_loss: 0.2747, test_loss: 1.6889, test_f1: 0.6383
 epoch: 79, train_loss: 0.2474, test_loss: 1.4132, test_f1: 0.6840
 epoch: 80, train_loss: 0.2399, test_loss: 1.6443, test_f1: 0.6082
 epoch: 81, train_loss: 0.2482, test_loss: 1.4143, test_f1: 0.6561
 epoch: 82, train_loss: 0.2415, test_loss: 1.6288, test_f1: 0.6371
 epoch: 83, train_loss: 0.3028, test_loss: 1.2870, test_f1: 0.6779
 epoch: 84, train_loss: 0.3010, test_loss: 1.3224, test_f1: 0.6519
 epoch: 85, train_loss: 0.2721, test_loss: 1.3678, test_f1: 0.6711
 epoch: 86, train_loss: 0.2287, test_loss: 1.3939, test_f1: 0.6725
 epoch: 87, train_loss: 0.2159, test_loss: 1.7086, test_f1: 0.6448
 epoch: 88, train_loss: 0.1978, test_loss: 1.6823, test_f1: 0.6733
 epoch: 89, train_loss: 0.2126, test_loss: 1.6718, test_f1: 0.6829
 epoch: 90, train_loss: 0.2357, test_loss: 1.6434, test_f1: 0.6373
 epoch: 91, train_loss: 0.2305, test_loss: 1.6001, test_f1: 0.6771
 epoch: 92, train_loss: 0.2209, test_loss: 1.5995, test_f1: 0.6655
 epoch: 93, train_loss: 0.2289, test_loss: 1.6570, test_f1: 0.6550
 epoch: 94, train_loss: 0.2004, test_loss: 1.3770, test_f1: 0.6703
 epoch: 95, train_loss: 0.1939, test_loss: 1.6355, test_f1: 0.6691
 epoch: 96, train_loss: 0.1876, test_loss: 1.6375, test_f1: 0.6433
 epoch: 97, train_loss: 0.1974, test_loss: 1.6307, test_f1: 0.6389
 epoch: 98, train_loss: 0.2012, test_loss: 1.6287, test_f1: 0.6668
 epoch: 99, train_loss: 0.1866, test_loss: 1.6701, test_f1: 0.6736
##################ITERATION #2 ****************************************
 epoch: 0, train_loss: 1.4966, test_loss: 1.6343, test_f1: 0.0776
 epoch: 1, train_loss: 1.0431, test_loss: 1.2161, test_f1: 0.4332
 epoch: 2, train_loss: 0.9971, test_loss: 1.0291, test_f1: 0.4475
 epoch: 3, train_loss: 0.9478, test_loss: 0.9435, test_f1: 0.4806
 epoch: 4, train_loss: 0.9351, test_loss: 1.0420, test_f1: 0.4949
 epoch: 5, train_loss: 0.9142, test_loss: 0.9952, test_f1: 0.5055
 epoch: 6, train_loss: 0.9046, test_loss: 0.9376, test_f1: 0.4763
 epoch: 7, train_loss: 0.8746, test_loss: 0.9288, test_f1: 0.4906
 epoch: 8, train_loss: 0.8535, test_loss: 0.9170, test_f1: 0.5812
 epoch: 9, train_loss: 0.8478, test_loss: 0.9513, test_f1: 0.5198
 epoch: 10, train_loss: 0.8280, test_loss: 0.8560, test_f1: 0.5902
 epoch: 11, train_loss: 0.8137, test_loss: 1.0716, test_f1: 0.5596
 epoch: 12, train_loss: 0.7918, test_loss: 0.9319, test_f1: 0.5641
 epoch: 13, train_loss: 0.7883, test_loss: 0.9542, test_f1: 0.5356
 epoch: 14, train_loss: 0.7901, test_loss: 0.8612, test_f1: 0.5335
 epoch: 15, train_loss: 0.7795, test_loss: 0.8823, test_f1: 0.5872
 epoch: 16, train_loss: 0.7382, test_loss: 0.7907, test_f1: 0.6253
 epoch: 17, train_loss: 0.7306, test_loss: 1.0420, test_f1: 0.5213
 epoch: 18, train_loss: 0.7190, test_loss: 1.1701, test_f1: 0.5260
 epoch: 19, train_loss: 0.7168, test_loss: 0.8366, test_f1: 0.5649
 epoch: 20, train_loss: 0.7081, test_loss: 0.8464, test_f1: 0.6262
 epoch: 21, train_loss: 0.7134, test_loss: 0.9579, test_f1: 0.5805
 epoch: 22, train_loss: 0.7077, test_loss: 0.8991, test_f1: 0.6015
 epoch: 23, train_loss: 0.7031, test_loss: 0.8102, test_f1: 0.5977
 epoch: 24, train_loss: 0.6789, test_loss: 1.0531, test_f1: 0.5692
 epoch: 25, train_loss: 0.6808, test_loss: 0.9367, test_f1: 0.6431
 epoch: 26, train_loss: 0.6651, test_loss: 0.7926, test_f1: 0.6115
 epoch: 27, train_loss: 0.6560, test_loss: 0.8921, test_f1: 0.6253
 epoch: 28, train_loss: 0.6208, test_loss: 0.8934, test_f1: 0.6353
 epoch: 29, train_loss: 0.5996, test_loss: 0.9229, test_f1: 0.6387
 epoch: 30, train_loss: 0.6199, test_loss: 0.9740, test_f1: 0.6025
 epoch: 31, train_loss: 0.6307, test_loss: 1.1064, test_f1: 0.5973
 epoch: 32, train_loss: 0.6077, test_loss: 0.9986, test_f1: 0.5954
 epoch: 33, train_loss: 0.5852, test_loss: 0.8259, test_f1: 0.6125
 epoch: 34, train_loss: 0.5687, test_loss: 0.9004, test_f1: 0.6116
 epoch: 35, train_loss: 0.5759, test_loss: 0.9745, test_f1: 0.5892
 epoch: 36, train_loss: 0.5711, test_loss: 0.9713, test_f1: 0.6524
 epoch: 37, train_loss: 0.5680, test_loss: 0.8899, test_f1: 0.6175
 epoch: 38, train_loss: 0.5694, test_loss: 0.7770, test_f1: 0.6530
 epoch: 39, train_loss: 0.5539, test_loss: 1.0028, test_f1: 0.6186
 epoch: 40, train_loss: 0.5544, test_loss: 0.8221, test_f1: 0.6531
 epoch: 41, train_loss: 0.5308, test_loss: 0.8999, test_f1: 0.6376
 epoch: 42, train_loss: 0.5454, test_loss: 1.1273, test_f1: 0.5966
 epoch: 43, train_loss: 0.5467, test_loss: 0.8685, test_f1: 0.6348
 epoch: 44, train_loss: 0.5315, test_loss: 0.8717, test_f1: 0.6259
 epoch: 45, train_loss: 0.5162, test_loss: 1.0542, test_f1: 0.6302
 epoch: 46, train_loss: 0.5094, test_loss: 1.1014, test_f1: 0.5939
 epoch: 47, train_loss: 0.5533, test_loss: 0.8876, test_f1: 0.6437
 epoch: 48, train_loss: 0.5213, test_loss: 0.9758, test_f1: 0.6689
 epoch: 49, train_loss: 0.4912, test_loss: 1.1545, test_f1: 0.6355
 epoch: 50, train_loss: 0.4750, test_loss: 0.9546, test_f1: 0.6189
 epoch: 51, train_loss: 0.4491, test_loss: 0.8895, test_f1: 0.6757
 epoch: 52, train_loss: 0.4647, test_loss: 0.8992, test_f1: 0.6773
 epoch: 53, train_loss: 0.4069, test_loss: 0.9076, test_f1: 0.6597
 epoch: 54, train_loss: 0.3932, test_loss: 0.8989, test_f1: 0.6811
 epoch: 55, train_loss: 0.3910, test_loss: 0.9882, test_f1: 0.6510
 epoch: 56, train_loss: 0.3913, test_loss: 0.9669, test_f1: 0.6495
 epoch: 57, train_loss: 0.3819, test_loss: 1.1569, test_f1: 0.6412
 epoch: 58, train_loss: 0.3602, test_loss: 1.1583, test_f1: 0.6472
 epoch: 59, train_loss: 0.3622, test_loss: 0.9769, test_f1: 0.6503
 epoch: 60, train_loss: 0.3548, test_loss: 0.9537, test_f1: 0.6653
 epoch: 61, train_loss: 0.3588, test_loss: 1.0136, test_f1: 0.6805
 epoch: 62, train_loss: 0.3666, test_loss: 1.2628, test_f1: 0.6510
 epoch: 63, train_loss: 0.3483, test_loss: 1.1718, test_f1: 0.6624
 epoch: 64, train_loss: 0.3563, test_loss: 1.0860, test_f1: 0.6571
 epoch: 65, train_loss: 0.3469, test_loss: 1.0694, test_f1: 0.6442
 epoch: 66, train_loss: 0.3417, test_loss: 1.1671, test_f1: 0.6604
 epoch: 67, train_loss: 0.3392, test_loss: 1.0850, test_f1: 0.6685
 epoch: 68, train_loss: 0.3328, test_loss: 0.9312, test_f1: 0.6527
 epoch: 69, train_loss: 0.3392, test_loss: 1.0589, test_f1: 0.6424
 epoch: 70, train_loss: 0.3349, test_loss: 0.9641, test_f1: 0.6619
 epoch: 71, train_loss: 0.3269, test_loss: 0.9650, test_f1: 0.7061
 epoch: 72, train_loss: 0.3009, test_loss: 1.2239, test_f1: 0.6671
 epoch: 73, train_loss: 0.3104, test_loss: 1.3000, test_f1: 0.6602
 epoch: 74, train_loss: 0.2997, test_loss: 1.2586, test_f1: 0.6567
 epoch: 75, train_loss: 0.3131, test_loss: 1.3638, test_f1: 0.6642
 epoch: 76, train_loss: 0.3009, test_loss: 1.1832, test_f1: 0.6411
 epoch: 77, train_loss: 0.3356, test_loss: 1.1203, test_f1: 0.6501
 epoch: 78, train_loss: 0.2888, test_loss: 1.1087, test_f1: 0.6631
 epoch: 79, train_loss: 0.3152, test_loss: 1.0180, test_f1: 0.6691
 epoch: 80, train_loss: 0.3120, test_loss: 1.1146, test_f1: 0.6484
 epoch: 81, train_loss: 0.3334, test_loss: 1.1212, test_f1: 0.6328
 epoch: 82, train_loss: 0.2979, test_loss: 1.2302, test_f1: 0.6585
 epoch: 83, train_loss: 0.2799, test_loss: 1.2042, test_f1: 0.6704
 epoch: 84, train_loss: 0.2772, test_loss: 1.3385, test_f1: 0.6457
 epoch: 85, train_loss: 0.2971, test_loss: 1.3497, test_f1: 0.6462
 epoch: 86, train_loss: 0.2786, test_loss: 1.3523, test_f1: 0.6660
 epoch: 87, train_loss: 0.2681, test_loss: 1.2008, test_f1: 0.6719
 epoch: 88, train_loss: 0.2617, test_loss: 1.2222, test_f1: 0.6436
 epoch: 89, train_loss: 0.2486, test_loss: 1.3529, test_f1: 0.6512
 epoch: 90, train_loss: 0.2568, test_loss: 1.2764, test_f1: 0.6514
 epoch: 91, train_loss: 0.2518, test_loss: 1.4046, test_f1: 0.6716
 epoch: 92, train_loss: 0.2530, test_loss: 1.2739, test_f1: 0.6517
 epoch: 93, train_loss: 0.2582, test_loss: 1.2800, test_f1: 0.6603
 epoch: 94, train_loss: 0.2758, test_loss: 1.2128, test_f1: 0.6708
 epoch: 95, train_loss: 0.2538, test_loss: 1.4388, test_f1: 0.6577
 epoch: 96, train_loss: 0.2464, test_loss: 1.3503, test_f1: 0.6554
 epoch: 97, train_loss: 0.2358, test_loss: 1.3522, test_f1: 0.6544
 epoch: 98, train_loss: 0.2332, test_loss: 1.2777, test_f1: 0.6746
 epoch: 99, train_loss: 0.2406, test_loss: 1.2740, test_f1: 0.6910
##################ITERATION #3 ****************************************
 epoch: 0, train_loss: 1.5609, test_loss: 2.0517, test_f1: 0.1386
 epoch: 1, train_loss: 1.0392, test_loss: 1.2383, test_f1: 0.3744
 epoch: 2, train_loss: 0.9952, test_loss: 1.0337, test_f1: 0.4671
 epoch: 3, train_loss: 0.9643, test_loss: 0.9194, test_f1: 0.5012
 epoch: 4, train_loss: 0.9359, test_loss: 1.0289, test_f1: 0.4937
 epoch: 5, train_loss: 0.9272, test_loss: 0.9164, test_f1: 0.5189
 epoch: 6, train_loss: 0.9061, test_loss: 0.9500, test_f1: 0.5244
 epoch: 7, train_loss: 0.8943, test_loss: 0.9612, test_f1: 0.5206
 epoch: 8, train_loss: 0.8763, test_loss: 0.9602, test_f1: 0.5058
 epoch: 9, train_loss: 0.8624, test_loss: 0.8992, test_f1: 0.5300
 epoch: 10, train_loss: 0.8345, test_loss: 0.9582, test_f1: 0.5671
 epoch: 11, train_loss: 0.8343, test_loss: 0.9826, test_f1: 0.4964
 epoch: 12, train_loss: 0.8260, test_loss: 0.8812, test_f1: 0.5387
 epoch: 13, train_loss: 0.8135, test_loss: 0.9890, test_f1: 0.5579
 epoch: 14, train_loss: 0.7864, test_loss: 0.9871, test_f1: 0.5521
 epoch: 15, train_loss: 0.7839, test_loss: 0.9085, test_f1: 0.5730
 epoch: 16, train_loss: 0.7907, test_loss: 0.8941, test_f1: 0.5653
 epoch: 17, train_loss: 0.7537, test_loss: 1.0041, test_f1: 0.5704
 epoch: 18, train_loss: 0.7548, test_loss: 0.9582, test_f1: 0.5575
 epoch: 19, train_loss: 0.7356, test_loss: 0.9199, test_f1: 0.5556
 epoch: 20, train_loss: 0.7323, test_loss: 0.8886, test_f1: 0.6342
 epoch: 21, train_loss: 0.7110, test_loss: 0.9955, test_f1: 0.5276
 epoch: 22, train_loss: 0.7086, test_loss: 0.9078, test_f1: 0.6021
 epoch: 23, train_loss: 0.7051, test_loss: 0.9311, test_f1: 0.5921
 epoch: 24, train_loss: 0.7026, test_loss: 1.1452, test_f1: 0.4768
 epoch: 25, train_loss: 0.7123, test_loss: 1.0019, test_f1: 0.5924
 epoch: 26, train_loss: 0.6843, test_loss: 0.9155, test_f1: 0.6182
 epoch: 27, train_loss: 0.6618, test_loss: 1.0068, test_f1: 0.5924
 epoch: 28, train_loss: 0.6443, test_loss: 0.9643, test_f1: 0.5790
 epoch: 29, train_loss: 0.6406, test_loss: 1.2140, test_f1: 0.5380
 epoch: 30, train_loss: 0.6242, test_loss: 0.8448, test_f1: 0.6323
 epoch: 31, train_loss: 0.6150, test_loss: 0.9018, test_f1: 0.6036
 epoch: 32, train_loss: 0.5907, test_loss: 0.9749, test_f1: 0.6102
 epoch: 33, train_loss: 0.6038, test_loss: 0.9780, test_f1: 0.6318
 epoch: 34, train_loss: 0.6022, test_loss: 0.9697, test_f1: 0.6021
 epoch: 35, train_loss: 0.6065, test_loss: 0.9915, test_f1: 0.6465
 epoch: 36, train_loss: 0.5874, test_loss: 1.0606, test_f1: 0.5750
 epoch: 37, train_loss: 0.6087, test_loss: 1.2734, test_f1: 0.5817
 epoch: 38, train_loss: 0.6083, test_loss: 0.9284, test_f1: 0.6353
 epoch: 39, train_loss: 0.5825, test_loss: 0.9681, test_f1: 0.6191
 epoch: 40, train_loss: 0.5521, test_loss: 0.9738, test_f1: 0.6087
 epoch: 41, train_loss: 0.5323, test_loss: 1.1844, test_f1: 0.5930
 epoch: 42, train_loss: 0.5416, test_loss: 1.0407, test_f1: 0.6547
 epoch: 43, train_loss: 0.5512, test_loss: 1.0326, test_f1: 0.6453
 epoch: 44, train_loss: 0.5210, test_loss: 1.0460, test_f1: 0.6088
 epoch: 45, train_loss: 0.5218, test_loss: 0.9791, test_f1: 0.6469
 epoch: 46, train_loss: 0.5257, test_loss: 1.2581, test_f1: 0.6220
 epoch: 47, train_loss: 0.5250, test_loss: 1.1601, test_f1: 0.6251
 epoch: 48, train_loss: 0.5050, test_loss: 1.2138, test_f1: 0.6241
 epoch: 49, train_loss: 0.4979, test_loss: 1.0384, test_f1: 0.6359
 epoch: 50, train_loss: 0.5095, test_loss: 1.2602, test_f1: 0.5913
 epoch: 51, train_loss: 0.4876, test_loss: 1.0229, test_f1: 0.6677
 epoch: 52, train_loss: 0.4255, test_loss: 1.1798, test_f1: 0.6531
 epoch: 53, train_loss: 0.4278, test_loss: 1.0902, test_f1: 0.6542
 epoch: 54, train_loss: 0.3873, test_loss: 1.1025, test_f1: 0.6585
 epoch: 55, train_loss: 0.3751, test_loss: 1.1249, test_f1: 0.6592
 epoch: 56, train_loss: 0.3979, test_loss: 1.1734, test_f1: 0.6491
 epoch: 57, train_loss: 0.3765, test_loss: 1.2079, test_f1: 0.6423
 epoch: 58, train_loss: 0.3823, test_loss: 1.1107, test_f1: 0.6431
 epoch: 59, train_loss: 0.3609, test_loss: 1.2301, test_f1: 0.6467
 epoch: 60, train_loss: 0.3479, test_loss: 1.2542, test_f1: 0.6549
 epoch: 61, train_loss: 0.3666, test_loss: 1.2634, test_f1: 0.6187
 epoch: 62, train_loss: 0.3717, test_loss: 1.3950, test_f1: 0.6470
 epoch: 63, train_loss: 0.3597, test_loss: 1.2184, test_f1: 0.6518
 epoch: 64, train_loss: 0.3429, test_loss: 1.2836, test_f1: 0.6264
 epoch: 65, train_loss: 0.3247, test_loss: 1.3062, test_f1: 0.6573
 epoch: 66, train_loss: 0.3390, test_loss: 1.2635, test_f1: 0.6808
 epoch: 67, train_loss: 0.3629, test_loss: 1.2798, test_f1: 0.6346
 epoch: 68, train_loss: 0.3614, test_loss: 1.1976, test_f1: 0.6517
 epoch: 69, train_loss: 0.3430, test_loss: 1.2896, test_f1: 0.6441
 epoch: 70, train_loss: 0.3335, test_loss: 1.3069, test_f1: 0.6355
 epoch: 71, train_loss: 0.3209, test_loss: 1.3683, test_f1: 0.6469
 epoch: 72, train_loss: 0.3183, test_loss: 1.3980, test_f1: 0.6554
 epoch: 73, train_loss: 0.3270, test_loss: 1.3874, test_f1: 0.6561
 epoch: 74, train_loss: 0.3151, test_loss: 1.5601, test_f1: 0.6156
 epoch: 75, train_loss: 0.3207, test_loss: 1.4094, test_f1: 0.6371
 epoch: 76, train_loss: 0.3108, test_loss: 1.4650, test_f1: 0.6189
 epoch: 77, train_loss: 0.3271, test_loss: 1.4226, test_f1: 0.6503
 epoch: 78, train_loss: 0.3380, test_loss: 1.4827, test_f1: 0.6265
 epoch: 79, train_loss: 0.3085, test_loss: 1.4831, test_f1: 0.6538
 epoch: 80, train_loss: 0.2919, test_loss: 1.4650, test_f1: 0.6614
 epoch: 81, train_loss: 0.3133, test_loss: 1.5700, test_f1: 0.6316
 epoch: 82, train_loss: 0.2981, test_loss: 1.5369, test_f1: 0.6114
 epoch: 83, train_loss: 0.3045, test_loss: 1.4728, test_f1: 0.6355
 epoch: 84, train_loss: 0.3156, test_loss: 1.3056, test_f1: 0.6744
 epoch: 85, train_loss: 0.3138, test_loss: 1.3598, test_f1: 0.6227
 epoch: 86, train_loss: 0.3144, test_loss: 1.6196, test_f1: 0.6180
 epoch: 87, train_loss: 0.2923, test_loss: 1.5283, test_f1: 0.6391
 epoch: 88, train_loss: 0.2743, test_loss: 1.5583, test_f1: 0.6488
 epoch: 89, train_loss: 0.2699, test_loss: 1.3992, test_f1: 0.6623
 epoch: 90, train_loss: 0.2718, test_loss: 1.6238, test_f1: 0.6311
 epoch: 91, train_loss: 0.2645, test_loss: 1.5721, test_f1: 0.6320
 epoch: 92, train_loss: 0.2948, test_loss: 1.4893, test_f1: 0.6323
 epoch: 93, train_loss: 0.2887, test_loss: 1.5397, test_f1: 0.6368
 epoch: 94, train_loss: 0.2788, test_loss: 1.5866, test_f1: 0.6664
 epoch: 95, train_loss: 0.2753, test_loss: 1.6508, test_f1: 0.6504
 epoch: 96, train_loss: 0.2649, test_loss: 1.7002, test_f1: 0.6296
 epoch: 97, train_loss: 0.2473, test_loss: 1.7673, test_f1: 0.6258
 epoch: 98, train_loss: 0.2465, test_loss: 1.7119, test_f1: 0.6208
 epoch: 99, train_loss: 0.2465, test_loss: 1.6455, test_f1: 0.6392
##################ITERATION #4 ****************************************
 epoch: 0, train_loss: 1.8119, test_loss: 4.5504, test_f1: 0.1318
 epoch: 1, train_loss: 1.0612, test_loss: 1.1268, test_f1: 0.3934
 epoch: 2, train_loss: 0.9830, test_loss: 0.9852, test_f1: 0.4520
 epoch: 3, train_loss: 0.9375, test_loss: 0.9432, test_f1: 0.4867
 epoch: 4, train_loss: 0.9311, test_loss: 0.9604, test_f1: 0.5389
 epoch: 5, train_loss: 0.9015, test_loss: 1.0281, test_f1: 0.4960
 epoch: 6, train_loss: 0.8865, test_loss: 0.9363, test_f1: 0.5040
 epoch: 7, train_loss: 0.8775, test_loss: 1.0795, test_f1: 0.5158
 epoch: 8, train_loss: 0.8648, test_loss: 0.9907, test_f1: 0.5510
 epoch: 9, train_loss: 0.8411, test_loss: 0.9893, test_f1: 0.4509
 epoch: 10, train_loss: 0.8180, test_loss: 0.8255, test_f1: 0.5995
 epoch: 11, train_loss: 0.8075, test_loss: 0.8365, test_f1: 0.5690
 epoch: 12, train_loss: 0.7862, test_loss: 0.8388, test_f1: 0.5991
 epoch: 13, train_loss: 0.7713, test_loss: 0.9161, test_f1: 0.5865
 epoch: 14, train_loss: 0.7646, test_loss: 0.8867, test_f1: 0.5802
 epoch: 15, train_loss: 0.7592, test_loss: 0.9577, test_f1: 0.5773
 epoch: 16, train_loss: 0.7160, test_loss: 0.9148, test_f1: 0.5558
 epoch: 17, train_loss: 0.7541, test_loss: 0.8523, test_f1: 0.5948
 epoch: 18, train_loss: 0.7260, test_loss: 0.8115, test_f1: 0.6325
 epoch: 19, train_loss: 0.7020, test_loss: 0.7860, test_f1: 0.6133
 epoch: 20, train_loss: 0.6906, test_loss: 0.9090, test_f1: 0.6016
 epoch: 21, train_loss: 0.6911, test_loss: 0.8102, test_f1: 0.5983
 epoch: 22, train_loss: 0.6574, test_loss: 0.8159, test_f1: 0.6239
 epoch: 23, train_loss: 0.6671, test_loss: 0.8376, test_f1: 0.5682
 epoch: 24, train_loss: 0.6486, test_loss: 0.7760, test_f1: 0.6541
 epoch: 25, train_loss: 0.6547, test_loss: 0.8025, test_f1: 0.6432
 epoch: 26, train_loss: 0.6383, test_loss: 0.8195, test_f1: 0.6143
 epoch: 27, train_loss: 0.6067, test_loss: 0.8823, test_f1: 0.5992
 epoch: 28, train_loss: 0.6070, test_loss: 0.7496, test_f1: 0.6847
 epoch: 29, train_loss: 0.5889, test_loss: 0.8972, test_f1: 0.5839
 epoch: 30, train_loss: 0.6024, test_loss: 0.7763, test_f1: 0.6145
 epoch: 31, train_loss: 0.5764, test_loss: 1.2091, test_f1: 0.5522
 epoch: 32, train_loss: 0.6025, test_loss: 0.9463, test_f1: 0.5792
 epoch: 33, train_loss: 0.5861, test_loss: 0.8649, test_f1: 0.5912
 epoch: 34, train_loss: 0.5799, test_loss: 0.9989, test_f1: 0.5759
 epoch: 35, train_loss: 0.5730, test_loss: 1.1015, test_f1: 0.5984
 epoch: 36, train_loss: 0.5951, test_loss: 0.9567, test_f1: 0.5853
 epoch: 37, train_loss: 0.5856, test_loss: 0.8943, test_f1: 0.6650
 epoch: 38, train_loss: 0.5464, test_loss: 0.8256, test_f1: 0.6412
 epoch: 39, train_loss: 0.5302, test_loss: 0.9811, test_f1: 0.6312
 epoch: 40, train_loss: 0.5076, test_loss: 0.8803, test_f1: 0.6292
 epoch: 41, train_loss: 0.5279, test_loss: 1.1418, test_f1: 0.5913
 epoch: 42, train_loss: 0.5179, test_loss: 0.9122, test_f1: 0.6138
 epoch: 43, train_loss: 0.5035, test_loss: 3.2668, test_f1: 0.3477
 epoch: 44, train_loss: 0.4808, test_loss: 0.9361, test_f1: 0.6338
 epoch: 45, train_loss: 0.4823, test_loss: 0.9107, test_f1: 0.6532
 epoch: 46, train_loss: 0.5345, test_loss: 0.9546, test_f1: 0.6128
 epoch: 47, train_loss: 0.5342, test_loss: 0.8842, test_f1: 0.6396
 epoch: 48, train_loss: 0.5177, test_loss: 1.0779, test_f1: 0.5468
 epoch: 49, train_loss: 0.4830, test_loss: 0.8631, test_f1: 0.6354
 epoch: 50, train_loss: 0.4768, test_loss: 0.9084, test_f1: 0.6462
 epoch: 51, train_loss: 0.4183, test_loss: 0.9015, test_f1: 0.6552
 epoch: 52, train_loss: 0.3863, test_loss: 0.9537, test_f1: 0.6683
 epoch: 53, train_loss: 0.3731, test_loss: 1.0145, test_f1: 0.6525
 epoch: 54, train_loss: 0.3686, test_loss: 0.9473, test_f1: 0.6791
 epoch: 55, train_loss: 0.3824, test_loss: 0.9816, test_f1: 0.6496
 epoch: 56, train_loss: 0.3510, test_loss: 0.9472, test_f1: 0.6469
 epoch: 57, train_loss: 0.3501, test_loss: 1.1015, test_f1: 0.6416
 epoch: 58, train_loss: 0.3606, test_loss: 1.0883, test_f1: 0.6502
 epoch: 59, train_loss: 0.3418, test_loss: 1.0055, test_f1: 0.6440
 epoch: 60, train_loss: 0.3339, test_loss: 1.0423, test_f1: 0.6542
 epoch: 61, train_loss: 0.3231, test_loss: 1.1508, test_f1: 0.6383
 epoch: 62, train_loss: 0.3345, test_loss: 1.1040, test_f1: 0.6290
 epoch: 63, train_loss: 0.3470, test_loss: 1.0581, test_f1: 0.6459
 epoch: 64, train_loss: 0.3572, test_loss: 1.1778, test_f1: 0.6250
 epoch: 65, train_loss: 0.3427, test_loss: 1.0613, test_f1: 0.6635
 epoch: 66, train_loss: 0.3260, test_loss: 1.1164, test_f1: 0.6330
 epoch: 67, train_loss: 0.3133, test_loss: 1.0551, test_f1: 0.6855
 epoch: 68, train_loss: 0.3276, test_loss: 1.1227, test_f1: 0.6616
 epoch: 69, train_loss: 0.3095, test_loss: 1.0326, test_f1: 0.6432
 epoch: 70, train_loss: 0.3003, test_loss: 1.0390, test_f1: 0.6629
 epoch: 71, train_loss: 0.2832, test_loss: 1.1720, test_f1: 0.6591
 epoch: 72, train_loss: 0.2858, test_loss: 1.2576, test_f1: 0.6661
 epoch: 73, train_loss: 0.2751, test_loss: 1.2425, test_f1: 0.6563
 epoch: 74, train_loss: 0.2908, test_loss: 1.3745, test_f1: 0.6420
 epoch: 75, train_loss: 0.2834, test_loss: 1.1817, test_f1: 0.6285
 epoch: 76, train_loss: 0.2885, test_loss: 1.2011, test_f1: 0.6763
 epoch: 77, train_loss: 0.3065, test_loss: 1.2604, test_f1: 0.6449
 epoch: 78, train_loss: 0.2969, test_loss: 1.2160, test_f1: 0.6539
 epoch: 79, train_loss: 0.2713, test_loss: 1.3764, test_f1: 0.6581
 epoch: 80, train_loss: 0.2708, test_loss: 1.2890, test_f1: 0.6625
 epoch: 81, train_loss: 0.2757, test_loss: 1.0977, test_f1: 0.6615
 epoch: 82, train_loss: 0.2826, test_loss: 1.2763, test_f1: 0.6893
 epoch: 83, train_loss: 0.2669, test_loss: 1.4710, test_f1: 0.6538
 epoch: 84, train_loss: 0.2728, test_loss: 1.3982, test_f1: 0.6467
 epoch: 85, train_loss: 0.2597, test_loss: 1.2894, test_f1: 0.6418
 epoch: 86, train_loss: 0.2688, test_loss: 1.2782, test_f1: 0.6575
 epoch: 87, train_loss: 0.2322, test_loss: 1.4621, test_f1: 0.6191
 epoch: 88, train_loss: 0.2535, test_loss: 1.3526, test_f1: 0.6573
 epoch: 89, train_loss: 0.2509, test_loss: 1.2973, test_f1: 0.6733
 epoch: 90, train_loss: 0.2677, test_loss: 1.4149, test_f1: 0.6253
 epoch: 91, train_loss: 0.2600, test_loss: 1.2870, test_f1: 0.6455
 epoch: 92, train_loss: 0.2565, test_loss: 1.2714, test_f1: 0.6882
 epoch: 93, train_loss: 0.2521, test_loss: 1.2429, test_f1: 0.6551
 epoch: 94, train_loss: 0.2550, test_loss: 1.2988, test_f1: 0.6560
 epoch: 95, train_loss: 0.2576, test_loss: 1.4179, test_f1: 0.6313
 epoch: 96, train_loss: 0.2314, test_loss: 1.2648, test_f1: 0.6758
 epoch: 97, train_loss: 0.2393, test_loss: 1.3111, test_f1: 0.6463
 epoch: 98, train_loss: 0.2573, test_loss: 1.3714, test_f1: 0.6584
 epoch: 99, train_loss: 0.2273, test_loss: 1.4583, test_f1: 0.6635
##################ITERATION #5 ****************************************
 epoch: 0, train_loss: 1.6336, test_loss: 1.4353, test_f1: 0.2883
 epoch: 1, train_loss: 1.0643, test_loss: 1.0889, test_f1: 0.3926
 epoch: 2, train_loss: 1.0142, test_loss: 1.1138, test_f1: 0.4439
 epoch: 3, train_loss: 0.9985, test_loss: 1.0679, test_f1: 0.4894
 epoch: 4, train_loss: 0.9628, test_loss: 1.0653, test_f1: 0.4859
 epoch: 5, train_loss: 0.9387, test_loss: 1.0867, test_f1: 0.4816
 epoch: 6, train_loss: 0.9169, test_loss: 1.0222, test_f1: 0.4917
 epoch: 7, train_loss: 0.9202, test_loss: 1.0902, test_f1: 0.5109
 epoch: 8, train_loss: 0.8959, test_loss: 1.0792, test_f1: 0.5018
 epoch: 9, train_loss: 0.8851, test_loss: 1.0642, test_f1: 0.5069
 epoch: 10, train_loss: 0.8655, test_loss: 1.1890, test_f1: 0.4545
 epoch: 11, train_loss: 0.8480, test_loss: 0.8788, test_f1: 0.5595
 epoch: 12, train_loss: 0.8364, test_loss: 0.9280, test_f1: 0.5429
 epoch: 13, train_loss: 0.8122, test_loss: 1.0321, test_f1: 0.5410
 epoch: 14, train_loss: 0.7859, test_loss: 1.0126, test_f1: 0.5692
 epoch: 15, train_loss: 0.8160, test_loss: 0.9757, test_f1: 0.5410
 epoch: 16, train_loss: 0.7965, test_loss: 1.0370, test_f1: 0.5655
 epoch: 17, train_loss: 0.7871, test_loss: 1.0295, test_f1: 0.5457
 epoch: 18, train_loss: 0.7393, test_loss: 1.1705, test_f1: 0.5543
 epoch: 19, train_loss: 0.7317, test_loss: 1.0195, test_f1: 0.6153
 epoch: 20, train_loss: 0.7160, test_loss: 1.0899, test_f1: 0.5782
 epoch: 21, train_loss: 0.7118, test_loss: 1.2753, test_f1: 0.4862
 epoch: 22, train_loss: 0.7143, test_loss: 1.0089, test_f1: 0.6074
 epoch: 23, train_loss: 0.7042, test_loss: 1.2751, test_f1: 0.5460
 epoch: 24, train_loss: 0.6862, test_loss: 0.9428, test_f1: 0.6087
 epoch: 25, train_loss: 0.6662, test_loss: 0.9897, test_f1: 0.5403
 epoch: 26, train_loss: 0.6775, test_loss: 1.0463, test_f1: 0.6165
 epoch: 27, train_loss: 0.6531, test_loss: 1.0123, test_f1: 0.6420
 epoch: 28, train_loss: 0.6365, test_loss: 1.0963, test_f1: 0.5891
 epoch: 29, train_loss: 0.6358, test_loss: 1.1173, test_f1: 0.6362
 epoch: 30, train_loss: 0.6196, test_loss: 1.1018, test_f1: 0.6353
 epoch: 31, train_loss: 0.6260, test_loss: 1.1743, test_f1: 0.5947
 epoch: 32, train_loss: 0.5978, test_loss: 1.0787, test_f1: 0.6252
 epoch: 33, train_loss: 0.6134, test_loss: 1.0000, test_f1: 0.6132
 epoch: 34, train_loss: 0.6090, test_loss: 1.1940, test_f1: 0.6260
 epoch: 35, train_loss: 0.5994, test_loss: 1.5198, test_f1: 0.5683
 epoch: 36, train_loss: 0.5851, test_loss: 1.2138, test_f1: 0.5911
 epoch: 37, train_loss: 0.5710, test_loss: 1.2859, test_f1: 0.6096
 epoch: 38, train_loss: 0.5672, test_loss: 1.1441, test_f1: 0.6088
 epoch: 39, train_loss: 0.5685, test_loss: 1.1933, test_f1: 0.6080
 epoch: 40, train_loss: 0.5308, test_loss: 1.3059, test_f1: 0.6415
 epoch: 41, train_loss: 0.5227, test_loss: 1.1909, test_f1: 0.5976
 epoch: 42, train_loss: 0.5209, test_loss: 1.2983, test_f1: 0.5763
 epoch: 43, train_loss: 0.5317, test_loss: 1.0366, test_f1: 0.6302
 epoch: 44, train_loss: 0.5420, test_loss: 1.2920, test_f1: 0.6025
 epoch: 45, train_loss: 0.5241, test_loss: 1.1407, test_f1: 0.6592
 epoch: 46, train_loss: 0.4900, test_loss: 1.0445, test_f1: 0.6382
 epoch: 47, train_loss: 0.5155, test_loss: 1.3065, test_f1: 0.6290
 epoch: 48, train_loss: 0.4866, test_loss: 1.4866, test_f1: 0.6005
 epoch: 49, train_loss: 0.4997, test_loss: 1.4762, test_f1: 0.5484
 epoch: 50, train_loss: 0.4955, test_loss: 1.2611, test_f1: 0.6100
 epoch: 51, train_loss: 0.4349, test_loss: 1.1010, test_f1: 0.6295
 epoch: 52, train_loss: 0.4160, test_loss: 1.2456, test_f1: 0.6261
 epoch: 53, train_loss: 0.3773, test_loss: 1.1703, test_f1: 0.6494
 epoch: 54, train_loss: 0.3764, test_loss: 1.2892, test_f1: 0.6256
 epoch: 55, train_loss: 0.3583, test_loss: 1.1217, test_f1: 0.6460
 epoch: 56, train_loss: 0.3647, test_loss: 1.3460, test_f1: 0.6443
 epoch: 57, train_loss: 0.3451, test_loss: 1.1920, test_f1: 0.6509
 epoch: 58, train_loss: 0.3379, test_loss: 1.1640, test_f1: 0.6559
 epoch: 59, train_loss: 0.3427, test_loss: 1.3241, test_f1: 0.6366
 epoch: 60, train_loss: 0.3467, test_loss: 1.2082, test_f1: 0.6582
 epoch: 61, train_loss: 0.3384, test_loss: 1.3485, test_f1: 0.6255
 epoch: 62, train_loss: 0.3326, test_loss: 1.4005, test_f1: 0.6367
 epoch: 63, train_loss: 0.3319, test_loss: 1.4586, test_f1: 0.6513
 epoch: 64, train_loss: 0.3385, test_loss: 1.5040, test_f1: 0.6234
 epoch: 65, train_loss: 0.3636, test_loss: 1.3700, test_f1: 0.6429
 epoch: 66, train_loss: 0.3336, test_loss: 1.2227, test_f1: 0.6875
 epoch: 67, train_loss: 0.3002, test_loss: 1.4002, test_f1: 0.6653
 epoch: 68, train_loss: 0.3101, test_loss: 1.3342, test_f1: 0.6531
 epoch: 69, train_loss: 0.3033, test_loss: 1.4054, test_f1: 0.6278
 epoch: 70, train_loss: 0.3025, test_loss: 1.3800, test_f1: 0.6472
 epoch: 71, train_loss: 0.3009, test_loss: 1.2508, test_f1: 0.6360
 epoch: 72, train_loss: 0.3014, test_loss: 1.6760, test_f1: 0.6709
 epoch: 73, train_loss: 0.3015, test_loss: 1.7339, test_f1: 0.6586
 epoch: 74, train_loss: 0.2987, test_loss: 1.7313, test_f1: 0.6481
 epoch: 75, train_loss: 0.2900, test_loss: 1.3155, test_f1: 0.6504
 epoch: 76, train_loss: 0.2889, test_loss: 1.5766, test_f1: 0.6115
 epoch: 77, train_loss: 0.2952, test_loss: 1.4861, test_f1: 0.6652
 epoch: 78, train_loss: 0.3054, test_loss: 1.4039, test_f1: 0.6275
 epoch: 79, train_loss: 0.2854, test_loss: 1.7133, test_f1: 0.6179
 epoch: 80, train_loss: 0.2822, test_loss: 1.7694, test_f1: 0.6505
 epoch: 81, train_loss: 0.2731, test_loss: 1.5149, test_f1: 0.6645
 epoch: 82, train_loss: 0.2670, test_loss: 1.6974, test_f1: 0.6412
 epoch: 83, train_loss: 0.2787, test_loss: 1.9737, test_f1: 0.6158
 epoch: 84, train_loss: 0.2690, test_loss: 2.1843, test_f1: 0.6424
 epoch: 85, train_loss: 0.2559, test_loss: 1.6352, test_f1: 0.6554
 epoch: 86, train_loss: 0.2621, test_loss: 1.5694, test_f1: 0.6476
 epoch: 87, train_loss: 0.2625, test_loss: 1.7355, test_f1: 0.6271
 epoch: 88, train_loss: 0.2752, test_loss: 1.6900, test_f1: 0.6459
 epoch: 89, train_loss: 0.2558, test_loss: 1.4994, test_f1: 0.6622
 epoch: 90, train_loss: 0.2354, test_loss: 1.7228, test_f1: 0.6375
 epoch: 91, train_loss: 0.2365, test_loss: 1.6391, test_f1: 0.6379
 epoch: 92, train_loss: 0.2368, test_loss: 1.8855, test_f1: 0.6503
 epoch: 93, train_loss: 0.2136, test_loss: 1.8627, test_f1: 0.6470
 epoch: 94, train_loss: 0.2413, test_loss: 1.8825, test_f1: 0.6202
 epoch: 95, train_loss: 0.2654, test_loss: 1.9947, test_f1: 0.5934
 epoch: 96, train_loss: 0.2627, test_loss: 1.8444, test_f1: 0.6124
 epoch: 97, train_loss: 0.2612, test_loss: 1.6490, test_f1: 0.6111
 epoch: 98, train_loss: 0.2672, test_loss: 1.4745, test_f1: 0.6304
 epoch: 99, train_loss: 0.2624, test_loss: 1.5924, test_f1: 0.6347
##################ITERATION #6 ****************************************
 epoch: 0, train_loss: 1.6577, test_loss: 2.9710, test_f1: 0.2270
 epoch: 1, train_loss: 1.1560, test_loss: 2.2309, test_f1: 0.2295
 epoch: 2, train_loss: 1.1030, test_loss: 1.1322, test_f1: 0.2988
 epoch: 3, train_loss: 1.0371, test_loss: 0.9957, test_f1: 0.5311
 epoch: 4, train_loss: 0.9555, test_loss: 0.9585, test_f1: 0.4988
 epoch: 5, train_loss: 0.9231, test_loss: 0.9561, test_f1: 0.4908
 epoch: 6, train_loss: 0.9147, test_loss: 0.9312, test_f1: 0.4932
 epoch: 7, train_loss: 0.9071, test_loss: 0.9280, test_f1: 0.5473
 epoch: 8, train_loss: 0.8859, test_loss: 0.9162, test_f1: 0.5273
 epoch: 9, train_loss: 0.8647, test_loss: 0.9271, test_f1: 0.5891
 epoch: 10, train_loss: 0.8435, test_loss: 0.9378, test_f1: 0.5277
 epoch: 11, train_loss: 0.8479, test_loss: 1.0470, test_f1: 0.5134
 epoch: 12, train_loss: 0.8100, test_loss: 0.9630, test_f1: 0.5355
 epoch: 13, train_loss: 0.7922, test_loss: 0.8461, test_f1: 0.6081
 epoch: 14, train_loss: 0.7699, test_loss: 0.8512, test_f1: 0.5988
 epoch: 15, train_loss: 0.7558, test_loss: 1.0188, test_f1: 0.5720
 epoch: 16, train_loss: 0.7391, test_loss: 0.9069, test_f1: 0.6173
 epoch: 17, train_loss: 0.7278, test_loss: 0.9518, test_f1: 0.5816
 epoch: 18, train_loss: 0.7565, test_loss: 0.9930, test_f1: 0.5590
 epoch: 19, train_loss: 0.7593, test_loss: 1.0240, test_f1: 0.5627
 epoch: 20, train_loss: 0.7200, test_loss: 0.9485, test_f1: 0.5992
 epoch: 21, train_loss: 0.7014, test_loss: 0.9858, test_f1: 0.5935
 epoch: 22, train_loss: 0.6908, test_loss: 0.8522, test_f1: 0.5880
 epoch: 23, train_loss: 0.6876, test_loss: 1.7328, test_f1: 0.3979
 epoch: 24, train_loss: 0.6903, test_loss: 1.0298, test_f1: 0.6360
 epoch: 25, train_loss: 0.6573, test_loss: 0.9446, test_f1: 0.6233
 epoch: 26, train_loss: 0.6491, test_loss: 0.9239, test_f1: 0.6083
 epoch: 27, train_loss: 0.6301, test_loss: 0.9011, test_f1: 0.6179
 epoch: 28, train_loss: 0.6068, test_loss: 0.8763, test_f1: 0.6377
 epoch: 29, train_loss: 0.6100, test_loss: 1.0048, test_f1: 0.6374
 epoch: 30, train_loss: 0.6046, test_loss: 0.8608, test_f1: 0.6562
 epoch: 31, train_loss: 0.5801, test_loss: 1.0631, test_f1: 0.6383
 epoch: 32, train_loss: 0.6001, test_loss: 0.9551, test_f1: 0.6159
 epoch: 33, train_loss: 0.5969, test_loss: 1.1344, test_f1: 0.5782
 epoch: 34, train_loss: 0.5754, test_loss: 0.8683, test_f1: 0.5976
 epoch: 35, train_loss: 0.5487, test_loss: 0.9477, test_f1: 0.6629
 epoch: 36, train_loss: 0.5348, test_loss: 1.2684, test_f1: 0.5896
 epoch: 37, train_loss: 0.5733, test_loss: 1.1076, test_f1: 0.6512
 epoch: 38, train_loss: 0.5550, test_loss: 0.9243, test_f1: 0.6178
 epoch: 39, train_loss: 0.5469, test_loss: 0.9628, test_f1: 0.6211
 epoch: 40, train_loss: 0.5213, test_loss: 1.0307, test_f1: 0.6368
 epoch: 41, train_loss: 0.5204, test_loss: 1.0229, test_f1: 0.6253
 epoch: 42, train_loss: 0.5342, test_loss: 1.0332, test_f1: 0.6198
 epoch: 43, train_loss: 0.5241, test_loss: 0.9762, test_f1: 0.6540
 epoch: 44, train_loss: 0.5220, test_loss: 1.3990, test_f1: 0.5957
 epoch: 45, train_loss: 0.5195, test_loss: 0.9716, test_f1: 0.6457
 epoch: 46, train_loss: 0.5018, test_loss: 0.8960, test_f1: 0.6596
 epoch: 47, train_loss: 0.4644, test_loss: 0.9851, test_f1: 0.6391
 epoch: 48, train_loss: 0.4896, test_loss: 1.1173, test_f1: 0.6385
 epoch: 49, train_loss: 0.4821, test_loss: 1.0584, test_f1: 0.6371
 epoch: 50, train_loss: 0.4486, test_loss: 0.9790, test_f1: 0.6578
 epoch: 51, train_loss: 0.4276, test_loss: 1.0259, test_f1: 0.6490
 epoch: 52, train_loss: 0.3947, test_loss: 0.9885, test_f1: 0.6745
 epoch: 53, train_loss: 0.3664, test_loss: 1.0358, test_f1: 0.6725
 epoch: 54, train_loss: 0.3744, test_loss: 1.1326, test_f1: 0.6875
 epoch: 55, train_loss: 0.3657, test_loss: 1.0364, test_f1: 0.6714
 epoch: 56, train_loss: 0.3791, test_loss: 1.0126, test_f1: 0.6680
 epoch: 57, train_loss: 0.3636, test_loss: 1.0343, test_f1: 0.6682
 epoch: 58, train_loss: 0.3358, test_loss: 1.0833, test_f1: 0.6899
 epoch: 59, train_loss: 0.3363, test_loss: 1.1833, test_f1: 0.6830
 epoch: 60, train_loss: 0.3572, test_loss: 1.1863, test_f1: 0.6593
 epoch: 61, train_loss: 0.3470, test_loss: 1.1909, test_f1: 0.6506
 epoch: 62, train_loss: 0.3064, test_loss: 1.0296, test_f1: 0.6746
 epoch: 63, train_loss: 0.3024, test_loss: 1.3170, test_f1: 0.6907
 epoch: 64, train_loss: 0.3236, test_loss: 1.2604, test_f1: 0.6760
 epoch: 65, train_loss: 0.3093, test_loss: 1.3035, test_f1: 0.6566
 epoch: 66, train_loss: 0.3038, test_loss: 1.3395, test_f1: 0.6907
 epoch: 67, train_loss: 0.3189, test_loss: 1.3273, test_f1: 0.6727
 epoch: 68, train_loss: 0.3171, test_loss: 1.4008, test_f1: 0.6523
 epoch: 69, train_loss: 0.2928, test_loss: 1.3149, test_f1: 0.6271
 epoch: 70, train_loss: 0.3031, test_loss: 1.2322, test_f1: 0.6878
 epoch: 71, train_loss: 0.3143, test_loss: 1.4071, test_f1: 0.6519
 epoch: 72, train_loss: 0.2999, test_loss: 1.4019, test_f1: 0.6302
 epoch: 73, train_loss: 0.2993, test_loss: 1.2271, test_f1: 0.6757
 epoch: 74, train_loss: 0.2864, test_loss: 1.3828, test_f1: 0.6544
 epoch: 75, train_loss: 0.2627, test_loss: 1.3197, test_f1: 0.6584
 epoch: 76, train_loss: 0.2875, test_loss: 1.4950, test_f1: 0.6569
 epoch: 77, train_loss: 0.2978, test_loss: 1.2528, test_f1: 0.6758
 epoch: 78, train_loss: 0.3029, test_loss: 1.3222, test_f1: 0.6675
 epoch: 79, train_loss: 0.2903, test_loss: 1.3876, test_f1: 0.6570
 epoch: 80, train_loss: 0.2796, test_loss: 1.3473, test_f1: 0.6701
 epoch: 81, train_loss: 0.2947, test_loss: 1.1813, test_f1: 0.6887
 epoch: 82, train_loss: 0.2897, test_loss: 1.3900, test_f1: 0.6253
 epoch: 83, train_loss: 0.2910, test_loss: 1.1461, test_f1: 0.6905
 epoch: 84, train_loss: 0.2575, test_loss: 1.3769, test_f1: 0.6669
 epoch: 85, train_loss: 0.2363, test_loss: 1.5076, test_f1: 0.6710
 epoch: 86, train_loss: 0.2704, test_loss: 1.5577, test_f1: 0.6494
 epoch: 87, train_loss: 0.2658, test_loss: 1.4764, test_f1: 0.6665
 epoch: 88, train_loss: 0.2649, test_loss: 1.3763, test_f1: 0.6500
 epoch: 89, train_loss: 0.2480, test_loss: 1.3337, test_f1: 0.6704
 epoch: 90, train_loss: 0.2515, test_loss: 1.3430, test_f1: 0.6907
 epoch: 91, train_loss: 0.2444, test_loss: 1.5261, test_f1: 0.6712
 epoch: 92, train_loss: 0.2334, test_loss: 1.6595, test_f1: 0.6201
 epoch: 93, train_loss: 0.2525, test_loss: 1.8119, test_f1: 0.6183
 epoch: 94, train_loss: 0.2594, test_loss: 1.5355, test_f1: 0.6643
 epoch: 95, train_loss: 0.2617, test_loss: 1.4089, test_f1: 0.6802
 epoch: 96, train_loss: 0.2623, test_loss: 1.3334, test_f1: 0.6567
 epoch: 97, train_loss: 0.2532, test_loss: 1.3454, test_f1: 0.6878
 epoch: 98, train_loss: 0.2262, test_loss: 1.6567, test_f1: 0.6438
 epoch: 99, train_loss: 0.2060, test_loss: 1.5210, test_f1: 0.6923
##################ITERATION #7 ****************************************
 epoch: 0, train_loss: 1.9784, test_loss: 3.7148, test_f1: 0.2005
 epoch: 1, train_loss: 1.0302, test_loss: 1.5848, test_f1: 0.2846
 epoch: 2, train_loss: 0.9868, test_loss: 1.0440, test_f1: 0.4915
 epoch: 3, train_loss: 0.9609, test_loss: 1.0156, test_f1: 0.5118
 epoch: 4, train_loss: 0.9360, test_loss: 1.0472, test_f1: 0.5034
 epoch: 5, train_loss: 0.9143, test_loss: 1.0348, test_f1: 0.4813
 epoch: 6, train_loss: 0.8897, test_loss: 0.9949, test_f1: 0.5140
 epoch: 7, train_loss: 0.8720, test_loss: 1.0312, test_f1: 0.4905
 epoch: 8, train_loss: 0.8625, test_loss: 1.0303, test_f1: 0.5132
 epoch: 9, train_loss: 0.8680, test_loss: 0.9487, test_f1: 0.5057
 epoch: 10, train_loss: 0.8433, test_loss: 0.9799, test_f1: 0.5459
 epoch: 11, train_loss: 0.8203, test_loss: 0.9412, test_f1: 0.5778
 epoch: 12, train_loss: 0.8073, test_loss: 0.9582, test_f1: 0.5561
 epoch: 13, train_loss: 0.7889, test_loss: 1.0018, test_f1: 0.5476
 epoch: 14, train_loss: 0.7811, test_loss: 0.8679, test_f1: 0.5905
 epoch: 15, train_loss: 0.7562, test_loss: 0.9861, test_f1: 0.5588
 epoch: 16, train_loss: 0.7255, test_loss: 0.9182, test_f1: 0.5836
 epoch: 17, train_loss: 0.7500, test_loss: 1.0328, test_f1: 0.5586
 epoch: 18, train_loss: 0.7075, test_loss: 1.0010, test_f1: 0.5827
 epoch: 19, train_loss: 0.7102, test_loss: 0.9065, test_f1: 0.6170
 epoch: 20, train_loss: 0.6722, test_loss: 0.9468, test_f1: 0.6052
 epoch: 21, train_loss: 0.6577, test_loss: 0.9098, test_f1: 0.6194
 epoch: 22, train_loss: 0.6749, test_loss: 1.1055, test_f1: 0.5670
 epoch: 23, train_loss: 0.6499, test_loss: 0.9639, test_f1: 0.5884
 epoch: 24, train_loss: 0.6416, test_loss: 0.8714, test_f1: 0.6413
 epoch: 25, train_loss: 0.6271, test_loss: 1.0948, test_f1: 0.5643
 epoch: 26, train_loss: 0.6287, test_loss: 1.0865, test_f1: 0.5857
 epoch: 27, train_loss: 0.6193, test_loss: 1.0266, test_f1: 0.6409
 epoch: 28, train_loss: 0.6155, test_loss: 1.0390, test_f1: 0.5989
 epoch: 29, train_loss: 0.6233, test_loss: 0.9374, test_f1: 0.5873
 epoch: 30, train_loss: 0.5955, test_loss: 0.9723, test_f1: 0.6400
 epoch: 31, train_loss: 0.5721, test_loss: 1.1027, test_f1: 0.6138
 epoch: 32, train_loss: 0.5777, test_loss: 1.0914, test_f1: 0.5784
 epoch: 33, train_loss: 0.5514, test_loss: 0.9672, test_f1: 0.6391
 epoch: 34, train_loss: 0.5654, test_loss: 0.9372, test_f1: 0.6194
 epoch: 35, train_loss: 0.5606, test_loss: 1.0973, test_f1: 0.6454
 epoch: 36, train_loss: 0.5634, test_loss: 0.9870, test_f1: 0.6209
 epoch: 37, train_loss: 0.5354, test_loss: 1.0379, test_f1: 0.6547
 epoch: 38, train_loss: 0.5228, test_loss: 1.1048, test_f1: 0.6399
 epoch: 39, train_loss: 0.5425, test_loss: 1.2161, test_f1: 0.6240
 epoch: 40, train_loss: 0.5111, test_loss: 0.9864, test_f1: 0.6498
 epoch: 41, train_loss: 0.5061, test_loss: 0.9427, test_f1: 0.6692
 epoch: 42, train_loss: 0.4903, test_loss: 1.1061, test_f1: 0.6424
 epoch: 43, train_loss: 0.5067, test_loss: 0.9627, test_f1: 0.5814
 epoch: 44, train_loss: 0.4972, test_loss: 1.0869, test_f1: 0.6411
 epoch: 45, train_loss: 0.4859, test_loss: 1.0617, test_f1: 0.6394
 epoch: 46, train_loss: 0.4837, test_loss: 0.8920, test_f1: 0.6666
 epoch: 47, train_loss: 0.5081, test_loss: 0.9973, test_f1: 0.6197
 epoch: 48, train_loss: 0.4807, test_loss: 1.1931, test_f1: 0.6278
 epoch: 49, train_loss: 0.4855, test_loss: 1.1181, test_f1: 0.6428
 epoch: 50, train_loss: 0.4690, test_loss: 1.0880, test_f1: 0.6488
 epoch: 51, train_loss: 0.4181, test_loss: 1.1046, test_f1: 0.6496
 epoch: 52, train_loss: 0.3741, test_loss: 1.0018, test_f1: 0.6696
 epoch: 53, train_loss: 0.3567, test_loss: 1.1438, test_f1: 0.6415
 epoch: 54, train_loss: 0.3385, test_loss: 1.1403, test_f1: 0.6492
 epoch: 55, train_loss: 0.3614, test_loss: 1.1495, test_f1: 0.6771
 epoch: 56, train_loss: 0.3254, test_loss: 1.3276, test_f1: 0.6409
 epoch: 57, train_loss: 0.3157, test_loss: 1.2276, test_f1: 0.6615
 epoch: 58, train_loss: 0.3338, test_loss: 1.1855, test_f1: 0.6796
 epoch: 59, train_loss: 0.3075, test_loss: 1.2606, test_f1: 0.6740
 epoch: 60, train_loss: 0.3145, test_loss: 1.2842, test_f1: 0.6657
 epoch: 61, train_loss: 0.3093, test_loss: 1.2794, test_f1: 0.6603
 epoch: 62, train_loss: 0.3137, test_loss: 1.3353, test_f1: 0.6233
 epoch: 63, train_loss: 0.2897, test_loss: 1.3411, test_f1: 0.6508
 epoch: 64, train_loss: 0.3037, test_loss: 1.2429, test_f1: 0.6499
 epoch: 65, train_loss: 0.2932, test_loss: 1.4302, test_f1: 0.6810
 epoch: 66, train_loss: 0.3144, test_loss: 1.3837, test_f1: 0.6482
 epoch: 67, train_loss: 0.3090, test_loss: 1.2585, test_f1: 0.6594
 epoch: 68, train_loss: 0.2683, test_loss: 1.3980, test_f1: 0.6644
 epoch: 69, train_loss: 0.2768, test_loss: 1.2546, test_f1: 0.6566
 epoch: 70, train_loss: 0.2555, test_loss: 1.4065, test_f1: 0.6611
 epoch: 71, train_loss: 0.2566, test_loss: 1.3453, test_f1: 0.6657
 epoch: 72, train_loss: 0.2832, test_loss: 1.3777, test_f1: 0.6445
 epoch: 73, train_loss: 0.2980, test_loss: 1.4046, test_f1: 0.6481
 epoch: 74, train_loss: 0.2857, test_loss: 1.5495, test_f1: 0.6383
 epoch: 75, train_loss: 0.2702, test_loss: 1.5546, test_f1: 0.6472
 epoch: 76, train_loss: 0.2740, test_loss: 1.6602, test_f1: 0.6230
 epoch: 77, train_loss: 0.2918, test_loss: 1.5514, test_f1: 0.6543
 epoch: 78, train_loss: 0.2753, test_loss: 1.2930, test_f1: 0.6984
 epoch: 79, train_loss: 0.2871, test_loss: 1.3890, test_f1: 0.6900
 epoch: 80, train_loss: 0.2787, test_loss: 1.5648, test_f1: 0.6017
 epoch: 81, train_loss: 0.2715, test_loss: 1.4631, test_f1: 0.6440
 epoch: 82, train_loss: 0.2620, test_loss: 1.4629, test_f1: 0.6327
 epoch: 83, train_loss: 0.2575, test_loss: 1.4905, test_f1: 0.6729
 epoch: 84, train_loss: 0.2732, test_loss: 1.7357, test_f1: 0.6539
 epoch: 85, train_loss: 0.2403, test_loss: 1.4251, test_f1: 0.6461
 epoch: 86, train_loss: 0.2287, test_loss: 1.6053, test_f1: 0.6423
 epoch: 87, train_loss: 0.2240, test_loss: 1.5296, test_f1: 0.6481
 epoch: 88, train_loss: 0.2099, test_loss: 1.6418, test_f1: 0.6425
 epoch: 89, train_loss: 0.2328, test_loss: 1.5773, test_f1: 0.6464
 epoch: 90, train_loss: 0.2613, test_loss: 1.5796, test_f1: 0.6448
 epoch: 91, train_loss: 0.2215, test_loss: 1.5649, test_f1: 0.6728
 epoch: 92, train_loss: 0.2403, test_loss: 1.7047, test_f1: 0.6537
 epoch: 93, train_loss: 0.2243, test_loss: 1.7400, test_f1: 0.6331
 epoch: 94, train_loss: 0.2230, test_loss: 1.6652, test_f1: 0.6453
 epoch: 95, train_loss: 0.2019, test_loss: 1.6880, test_f1: 0.6390
 epoch: 96, train_loss: 0.2311, test_loss: 1.7701, test_f1: 0.6833
 epoch: 97, train_loss: 0.2199, test_loss: 1.6508, test_f1: 0.6371
 epoch: 98, train_loss: 0.2112, test_loss: 1.7078, test_f1: 0.6358
 epoch: 99, train_loss: 0.2270, test_loss: 1.9152, test_f1: 0.6526
##################ITERATION #8 ****************************************
 epoch: 0, train_loss: 1.8990, test_loss: 1.4632, test_f1: 0.2503
 epoch: 1, train_loss: 1.1006, test_loss: 1.1576, test_f1: 0.4508
 epoch: 2, train_loss: 1.0022, test_loss: 1.1160, test_f1: 0.4983
 epoch: 3, train_loss: 0.9739, test_loss: 1.0567, test_f1: 0.5066
 epoch: 4, train_loss: 0.9477, test_loss: 1.0062, test_f1: 0.5212
 epoch: 5, train_loss: 0.9314, test_loss: 0.9664, test_f1: 0.5211
 epoch: 6, train_loss: 0.9028, test_loss: 0.9896, test_f1: 0.5235
 epoch: 7, train_loss: 0.8972, test_loss: 0.9279, test_f1: 0.5338
 epoch: 8, train_loss: 0.8645, test_loss: 1.0728, test_f1: 0.5076
 epoch: 9, train_loss: 0.8702, test_loss: 1.0367, test_f1: 0.5412
 epoch: 10, train_loss: 0.8709, test_loss: 1.0985, test_f1: 0.5297
 epoch: 11, train_loss: 0.8236, test_loss: 0.9054, test_f1: 0.5582
 epoch: 12, train_loss: 0.8102, test_loss: 0.9671, test_f1: 0.5784
 epoch: 13, train_loss: 0.7998, test_loss: 0.9026, test_f1: 0.5571
 epoch: 14, train_loss: 0.7986, test_loss: 0.8374, test_f1: 0.5829
 epoch: 15, train_loss: 0.7920, test_loss: 0.9667, test_f1: 0.5384
 epoch: 16, train_loss: 0.7989, test_loss: 0.8139, test_f1: 0.5964
 epoch: 17, train_loss: 0.7557, test_loss: 0.8948, test_f1: 0.5498
 epoch: 18, train_loss: 0.7205, test_loss: 0.9048, test_f1: 0.5840
 epoch: 19, train_loss: 0.7297, test_loss: 0.9462, test_f1: 0.6130
 epoch: 20, train_loss: 0.7062, test_loss: 0.8754, test_f1: 0.6195
 epoch: 21, train_loss: 0.7194, test_loss: 0.7852, test_f1: 0.6423
 epoch: 22, train_loss: 0.7169, test_loss: 0.9208, test_f1: 0.5870
 epoch: 23, train_loss: 0.7235, test_loss: 0.8632, test_f1: 0.6002
 epoch: 24, train_loss: 0.6927, test_loss: 0.8120, test_f1: 0.6189
 epoch: 25, train_loss: 0.6792, test_loss: 0.9990, test_f1: 0.5990
 epoch: 26, train_loss: 0.6543, test_loss: 0.7965, test_f1: 0.6171
 epoch: 27, train_loss: 0.6595, test_loss: 0.8751, test_f1: 0.5642
 epoch: 28, train_loss: 0.6733, test_loss: 0.8127, test_f1: 0.6231
 epoch: 29, train_loss: 0.6430, test_loss: 0.8853, test_f1: 0.6038
 epoch: 30, train_loss: 0.6461, test_loss: 0.9432, test_f1: 0.5927
 epoch: 31, train_loss: 0.6329, test_loss: 0.7876, test_f1: 0.6527
 epoch: 32, train_loss: 0.6290, test_loss: 1.1285, test_f1: 0.5407
 epoch: 33, train_loss: 0.6263, test_loss: 0.9675, test_f1: 0.5898
 epoch: 34, train_loss: 0.6194, test_loss: 0.9068, test_f1: 0.6381
 epoch: 35, train_loss: 0.5844, test_loss: 1.2097, test_f1: 0.5510
 epoch: 36, train_loss: 0.5927, test_loss: 0.9240, test_f1: 0.6209
 epoch: 37, train_loss: 0.5837, test_loss: 1.0373, test_f1: 0.5825
 epoch: 38, train_loss: 0.5769, test_loss: 0.8761, test_f1: 0.6244
 epoch: 39, train_loss: 0.5648, test_loss: 0.8472, test_f1: 0.6031
 epoch: 40, train_loss: 0.5882, test_loss: 0.8903, test_f1: 0.6355
 epoch: 41, train_loss: 0.5621, test_loss: 0.8880, test_f1: 0.6174
 epoch: 42, train_loss: 0.5349, test_loss: 0.9033, test_f1: 0.6232
 epoch: 43, train_loss: 0.5476, test_loss: 1.0162, test_f1: 0.5843
 epoch: 44, train_loss: 0.5389, test_loss: 0.9532, test_f1: 0.5935
 epoch: 45, train_loss: 0.5487, test_loss: 0.9671, test_f1: 0.6001
 epoch: 46, train_loss: 0.5362, test_loss: 0.9018, test_f1: 0.6135
 epoch: 47, train_loss: 0.5213, test_loss: 1.1515, test_f1: 0.4856
 epoch: 48, train_loss: 0.5329, test_loss: 0.8521, test_f1: 0.6471
 epoch: 49, train_loss: 0.5263, test_loss: 0.9481, test_f1: 0.6225
 epoch: 50, train_loss: 0.5117, test_loss: 0.8092, test_f1: 0.6287
 epoch: 51, train_loss: 0.4660, test_loss: 0.7458, test_f1: 0.6709
 epoch: 52, train_loss: 0.4385, test_loss: 0.8708, test_f1: 0.6470
 epoch: 53, train_loss: 0.4274, test_loss: 0.7823, test_f1: 0.6511
 epoch: 54, train_loss: 0.4097, test_loss: 0.7958, test_f1: 0.6778
 epoch: 55, train_loss: 0.3851, test_loss: 0.8389, test_f1: 0.6885
 epoch: 56, train_loss: 0.3832, test_loss: 0.9240, test_f1: 0.6502
 epoch: 57, train_loss: 0.4050, test_loss: 0.7832, test_f1: 0.6777
 epoch: 58, train_loss: 0.4050, test_loss: 0.8582, test_f1: 0.6413
 epoch: 59, train_loss: 0.3829, test_loss: 0.9060, test_f1: 0.6620
 epoch: 60, train_loss: 0.3814, test_loss: 0.9153, test_f1: 0.6757
 epoch: 61, train_loss: 0.3621, test_loss: 0.8802, test_f1: 0.6760
 epoch: 62, train_loss: 0.3426, test_loss: 0.8502, test_f1: 0.6728
 epoch: 63, train_loss: 0.3619, test_loss: 0.9542, test_f1: 0.6487
 epoch: 64, train_loss: 0.3696, test_loss: 0.9382, test_f1: 0.6538
 epoch: 65, train_loss: 0.3684, test_loss: 0.9767, test_f1: 0.6493
 epoch: 66, train_loss: 0.3283, test_loss: 1.0556, test_f1: 0.6530
 epoch: 67, train_loss: 0.3368, test_loss: 0.9904, test_f1: 0.6316
 epoch: 68, train_loss: 0.3507, test_loss: 1.0598, test_f1: 0.6314
 epoch: 69, train_loss: 0.3563, test_loss: 0.9704, test_f1: 0.6647
 epoch: 70, train_loss: 0.3382, test_loss: 0.9544, test_f1: 0.6501
 epoch: 71, train_loss: 0.3563, test_loss: 0.8994, test_f1: 0.6787
 epoch: 72, train_loss: 0.3281, test_loss: 1.0045, test_f1: 0.6379
 epoch: 73, train_loss: 0.3308, test_loss: 0.9894, test_f1: 0.6368
 epoch: 74, train_loss: 0.3390, test_loss: 1.2176, test_f1: 0.6088
 epoch: 75, train_loss: 0.3398, test_loss: 1.0572, test_f1: 0.6593
 epoch: 76, train_loss: 0.3583, test_loss: 1.0801, test_f1: 0.6308
 epoch: 77, train_loss: 0.3399, test_loss: 0.9832, test_f1: 0.6521
 epoch: 78, train_loss: 0.3302, test_loss: 1.0388, test_f1: 0.6258
 epoch: 79, train_loss: 0.3139, test_loss: 1.1010, test_f1: 0.6275
 epoch: 80, train_loss: 0.3221, test_loss: 1.0123, test_f1: 0.6656
 epoch: 81, train_loss: 0.2991, test_loss: 0.9730, test_f1: 0.6655
 epoch: 82, train_loss: 0.2951, test_loss: 0.9984, test_f1: 0.6527
 epoch: 83, train_loss: 0.2936, test_loss: 1.0401, test_f1: 0.6595
 epoch: 84, train_loss: 0.3330, test_loss: 0.9785, test_f1: 0.6872
 epoch: 85, train_loss: 0.3329, test_loss: 0.9712, test_f1: 0.6149
 epoch: 86, train_loss: 0.3179, test_loss: 1.1165, test_f1: 0.6295
 epoch: 87, train_loss: 0.2777, test_loss: 1.0865, test_f1: 0.6361
 epoch: 88, train_loss: 0.2782, test_loss: 1.1034, test_f1: 0.6718
 epoch: 89, train_loss: 0.2767, test_loss: 0.9798, test_f1: 0.6904
 epoch: 90, train_loss: 0.2921, test_loss: 0.9850, test_f1: 0.6821
 epoch: 91, train_loss: 0.2743, test_loss: 1.0929, test_f1: 0.6615
 epoch: 92, train_loss: 0.2712, test_loss: 1.0959, test_f1: 0.6644
 epoch: 93, train_loss: 0.2924, test_loss: 1.0496, test_f1: 0.6670
 epoch: 94, train_loss: 0.2643, test_loss: 1.0990, test_f1: 0.6492
 epoch: 95, train_loss: 0.2722, test_loss: 1.1331, test_f1: 0.6425
 epoch: 96, train_loss: 0.2940, test_loss: 1.0771, test_f1: 0.6505
 epoch: 97, train_loss: 0.2917, test_loss: 1.0434, test_f1: 0.6508
 epoch: 98, train_loss: 0.2739, test_loss: 1.0650, test_f1: 0.6695
 epoch: 99, train_loss: 0.2889, test_loss: 1.1032, test_f1: 0.6542
##################ITERATION #9 ****************************************
 epoch: 0, train_loss: 1.9171, test_loss: 2.6469, test_f1: 0.2873
 epoch: 1, train_loss: 1.0154, test_loss: 1.1104, test_f1: 0.3711
 epoch: 2, train_loss: 0.9548, test_loss: 1.1221, test_f1: 0.3916
 epoch: 3, train_loss: 0.9204, test_loss: 1.0600, test_f1: 0.4402
 epoch: 4, train_loss: 0.8919, test_loss: 0.9868, test_f1: 0.4940
 epoch: 5, train_loss: 0.9035, test_loss: 0.9417, test_f1: 0.5607
 epoch: 6, train_loss: 0.8562, test_loss: 0.8510, test_f1: 0.6006
 epoch: 7, train_loss: 0.8238, test_loss: 0.8427, test_f1: 0.5364
 epoch: 8, train_loss: 0.8216, test_loss: 0.8710, test_f1: 0.5875
 epoch: 9, train_loss: 0.7970, test_loss: 0.9038, test_f1: 0.6068
 epoch: 10, train_loss: 0.7821, test_loss: 1.0288, test_f1: 0.5237
 epoch: 11, train_loss: 0.7578, test_loss: 1.0153, test_f1: 0.5389
 epoch: 12, train_loss: 0.7560, test_loss: 0.8865, test_f1: 0.5974
 epoch: 13, train_loss: 0.7330, test_loss: 0.9385, test_f1: 0.5700
 epoch: 14, train_loss: 0.7087, test_loss: 0.8533, test_f1: 0.6254
 epoch: 15, train_loss: 0.7160, test_loss: 0.8478, test_f1: 0.5949
 epoch: 16, train_loss: 0.6955, test_loss: 0.8292, test_f1: 0.6265
 epoch: 17, train_loss: 0.6856, test_loss: 0.8937, test_f1: 0.5769
 epoch: 18, train_loss: 0.6628, test_loss: 0.8655, test_f1: 0.5951
 epoch: 19, train_loss: 0.6690, test_loss: 0.8739, test_f1: 0.6242
 epoch: 20, train_loss: 0.6855, test_loss: 0.9412, test_f1: 0.5880
 epoch: 21, train_loss: 0.6611, test_loss: 0.8160, test_f1: 0.6085
 epoch: 22, train_loss: 0.6216, test_loss: 0.7403, test_f1: 0.6369
 epoch: 23, train_loss: 0.6104, test_loss: 0.8493, test_f1: 0.6275
 epoch: 24, train_loss: 0.6124, test_loss: 0.8676, test_f1: 0.6295
 epoch: 25, train_loss: 0.5736, test_loss: 0.9393, test_f1: 0.5956
 epoch: 26, train_loss: 0.5849, test_loss: 0.8320, test_f1: 0.6516
 epoch: 27, train_loss: 0.5679, test_loss: 0.8981, test_f1: 0.6267
 epoch: 28, train_loss: 0.5860, test_loss: 0.7948, test_f1: 0.6440
 epoch: 29, train_loss: 0.5743, test_loss: 1.0031, test_f1: 0.6167
 epoch: 30, train_loss: 0.5374, test_loss: 1.0039, test_f1: 0.6186
 epoch: 31, train_loss: 0.5517, test_loss: 0.9766, test_f1: 0.5932
 epoch: 32, train_loss: 0.5665, test_loss: 0.8901, test_f1: 0.6437
 epoch: 33, train_loss: 0.5347, test_loss: 0.8645, test_f1: 0.6387
 epoch: 34, train_loss: 0.5527, test_loss: 0.9011, test_f1: 0.6440
 epoch: 35, train_loss: 0.5140, test_loss: 0.8924, test_f1: 0.5943
 epoch: 36, train_loss: 0.5296, test_loss: 0.9087, test_f1: 0.6474
 epoch: 37, train_loss: 0.5106, test_loss: 0.9876, test_f1: 0.6266
 epoch: 38, train_loss: 0.5176, test_loss: 0.9826, test_f1: 0.6248
 epoch: 39, train_loss: 0.5009, test_loss: 0.8017, test_f1: 0.6785
 epoch: 40, train_loss: 0.5056, test_loss: 0.9435, test_f1: 0.6227
 epoch: 41, train_loss: 0.4793, test_loss: 0.9725, test_f1: 0.6546
 epoch: 42, train_loss: 0.4769, test_loss: 0.9678, test_f1: 0.6309
 epoch: 43, train_loss: 0.5186, test_loss: 0.8246, test_f1: 0.6665
 epoch: 44, train_loss: 0.4988, test_loss: 0.9712, test_f1: 0.6172
 epoch: 45, train_loss: 0.4899, test_loss: 0.8027, test_f1: 0.6743
 epoch: 46, train_loss: 0.4686, test_loss: 0.8808, test_f1: 0.6624
 epoch: 47, train_loss: 0.4539, test_loss: 1.0199, test_f1: 0.6105
 epoch: 48, train_loss: 0.4591, test_loss: 1.0089, test_f1: 0.6288
 epoch: 49, train_loss: 0.4460, test_loss: 0.9344, test_f1: 0.6660
 epoch: 50, train_loss: 0.4468, test_loss: 0.8622, test_f1: 0.6618
 epoch: 51, train_loss: 0.4099, test_loss: 0.9409, test_f1: 0.6534
 epoch: 52, train_loss: 0.3793, test_loss: 0.9105, test_f1: 0.6659
 epoch: 53, train_loss: 0.3510, test_loss: 0.9902, test_f1: 0.6589
 epoch: 54, train_loss: 0.3304, test_loss: 1.0357, test_f1: 0.6452
 epoch: 55, train_loss: 0.3261, test_loss: 0.9281, test_f1: 0.6656
 epoch: 56, train_loss: 0.3340, test_loss: 1.1170, test_f1: 0.6851
 epoch: 57, train_loss: 0.3045, test_loss: 1.0776, test_f1: 0.6371
 epoch: 58, train_loss: 0.3131, test_loss: 1.0462, test_f1: 0.6628
 epoch: 59, train_loss: 0.3016, test_loss: 1.1493, test_f1: 0.6633
 epoch: 60, train_loss: 0.3197, test_loss: 1.0461, test_f1: 0.6610
 epoch: 61, train_loss: 0.3156, test_loss: 1.0456, test_f1: 0.6786
 epoch: 62, train_loss: 0.3027, test_loss: 1.1271, test_f1: 0.6429
 epoch: 63, train_loss: 0.3061, test_loss: 1.0992, test_f1: 0.6767
 epoch: 64, train_loss: 0.3044, test_loss: 1.0415, test_f1: 0.6668
 epoch: 65, train_loss: 0.2970, test_loss: 1.2862, test_f1: 0.5964
 epoch: 66, train_loss: 0.3010, test_loss: 1.2116, test_f1: 0.6489
 epoch: 67, train_loss: 0.2954, test_loss: 1.2756, test_f1: 0.6408
 epoch: 68, train_loss: 0.2854, test_loss: 1.2973, test_f1: 0.6571
 epoch: 69, train_loss: 0.3168, test_loss: 1.2317, test_f1: 0.6436
 epoch: 70, train_loss: 0.3144, test_loss: 1.1133, test_f1: 0.6497
 epoch: 71, train_loss: 0.3242, test_loss: 1.2869, test_f1: 0.6146
 epoch: 72, train_loss: 0.2834, test_loss: 1.1703, test_f1: 0.6564
 epoch: 73, train_loss: 0.2798, test_loss: 1.2464, test_f1: 0.6214
 epoch: 74, train_loss: 0.2697, test_loss: 1.1978, test_f1: 0.6520
 epoch: 75, train_loss: 0.2579, test_loss: 1.1869, test_f1: 0.6302
 epoch: 76, train_loss: 0.2764, test_loss: 1.0635, test_f1: 0.6682
 epoch: 77, train_loss: 0.2597, test_loss: 1.1831, test_f1: 0.6298
 epoch: 78, train_loss: 0.2965, test_loss: 1.2202, test_f1: 0.6411
 epoch: 79, train_loss: 0.2730, test_loss: 1.3028, test_f1: 0.6482
 epoch: 80, train_loss: 0.2646, test_loss: 1.4047, test_f1: 0.6194
 epoch: 81, train_loss: 0.2643, test_loss: 1.2206, test_f1: 0.6428
 epoch: 82, train_loss: 0.2711, test_loss: 1.1457, test_f1: 0.6541
 epoch: 83, train_loss: 0.2493, test_loss: 1.1441, test_f1: 0.6650
 epoch: 84, train_loss: 0.2543, test_loss: 1.4153, test_f1: 0.6302
 epoch: 85, train_loss: 0.2525, test_loss: 1.2824, test_f1: 0.6318
 epoch: 86, train_loss: 0.2512, test_loss: 1.1721, test_f1: 0.6718
 epoch: 87, train_loss: 0.2733, test_loss: 1.1765, test_f1: 0.6727
 epoch: 88, train_loss: 0.2546, test_loss: 1.1970, test_f1: 0.6623
 epoch: 89, train_loss: 0.2681, test_loss: 1.1411, test_f1: 0.6621
 epoch: 90, train_loss: 0.2521, test_loss: 1.2804, test_f1: 0.6375
 epoch: 91, train_loss: 0.2510, test_loss: 1.3560, test_f1: 0.6668
 epoch: 92, train_loss: 0.2459, test_loss: 1.4597, test_f1: 0.6531
 epoch: 93, train_loss: 0.2377, test_loss: 1.2885, test_f1: 0.6367
 epoch: 94, train_loss: 0.2254, test_loss: 1.3458, test_f1: 0.6221
 epoch: 95, train_loss: 0.2363, test_loss: 1.3787, test_f1: 0.6268
 epoch: 96, train_loss: 0.2164, test_loss: 1.1814, test_f1: 0.6786
 epoch: 97, train_loss: 0.2333, test_loss: 1.4863, test_f1: 0.6479
 epoch: 98, train_loss: 0.2072, test_loss: 1.2351, test_f1: 0.6920
 epoch: 99, train_loss: 0.2312, test_loss: 1.4396, test_f1: 0.6320

Training completed in 2064.59 seconds
Best F1: 0.7243 at epoch 78
Mean F1 across iterations: 0.6951  0.0116
========================FINAL RESULTS================================
FEGIN weighted F1: 0.7243  0.0116
python main.py --data ltspice_examples --representation component_pin_net --model FEGIN --layers 5 --hiddens 128 --batch_size 256 --lr 0.01 --emb_size 512 --epochs 100 --save_appendix component_pin_net_L5_H128_BS256_LR0.01_E512 --no_val
-----



STDERR:
Processing...
Done!
  File "main.py", line 370, in <module>
    main()
  File "main.py", line 254, in main
    dataset = dataset_class(
  File "/home/philip/projects/llm_inference_code_repo/Circuit-Completion-Using-GNNs/component_classification_with_link_prediction_head/evaluation/FEGIN/kernel/circuit_datasets.py", line 15, in __init__
    self.data, self.slices = torch.load(self.processed_paths[0])
  File "/home/philip/.local/lib/python3.8/site-packages/torch/serialization.py", line 1040, in load
    warnings.warn(
  File "/usr/lib/python3.8/warnings.py", line 109, in _showwarnmsg
    sw(msg.message, msg.category, msg.filename, msg.lineno,
  File "main.py", line 47, in warn_with_traceback
    traceback.print_stack(file=log)
/home/philip/projects/llm_inference_code_repo/Circuit-Completion-Using-GNNs/component_classification_with_link_prediction_head/evaluation/FEGIN/kernel/circuit_datasets.py:15: FutureWarning: You are using `torch.load` with `weights_only=False` (the current default value), which uses the default pickle module implicitly. It is possible to construct malicious pickle data which will execute arbitrary code during unpickling (See https://github.com/pytorch/pytorch/blob/main/SECURITY.md#untrusted-models for more details). In a future release, the default value for `weights_only` will be flipped to `True`. This limits the functions that could be executed during unpickling. Arbitrary objects will no longer be allowed to be loaded via this mode unless they are explicitly allowlisted by the user via `torch.serialization.add_safe_globals`. We recommend you start setting `weights_only=True` for any use case where you don't have full control of the loaded file. Please open an issue on GitHub for any issues related to this experimental feature.
  self.data, self.slices = torch.load(self.processed_paths[0])
