STDOUT:
Results will be saved in /home/philip/projects/llm_inference_code_repo/Circuit-Completion-Using-GNNs/component_classification_with_link_prediction_head/evaluation/FEGIN/results/model_FEGIN_dataset_ltspice_examples
Command line input: python main.py --data ltspice_examples --representation component_pin --model FEGIN --layers 2 --hiddens 128 --batch_size 128 --lr 0.001 --emb_size 250 --epochs 100 --save_appendix component_pin_L2_H128_BS128_LR0.001_E250 --no_val
 is saved.
-----
ltspice_examples - FEGIN
Using 2 layers, 128 hidden units, h = 2
Loading component_pin representation dataset
ENTERED
Training FEGIN on component_pin representation
Train: 3560, Test: 848
##################ITERATION #0 ****************************************
 epoch: 0, train_loss: 1.2445, test_loss: 1.2225, test_f1: 0.2383
 epoch: 1, train_loss: 1.0381, test_loss: 1.0354, test_f1: 0.3525
 epoch: 2, train_loss: 0.9597, test_loss: 0.9766, test_f1: 0.4802
 epoch: 3, train_loss: 0.9193, test_loss: 0.9588, test_f1: 0.5197
 epoch: 4, train_loss: 0.8879, test_loss: 0.9916, test_f1: 0.4691
 epoch: 5, train_loss: 0.8550, test_loss: 0.9375, test_f1: 0.5562
 epoch: 6, train_loss: 0.8252, test_loss: 0.9123, test_f1: 0.5335
 epoch: 7, train_loss: 0.8015, test_loss: 0.9838, test_f1: 0.5353
 epoch: 8, train_loss: 0.7760, test_loss: 0.8898, test_f1: 0.5567
 epoch: 9, train_loss: 0.7541, test_loss: 0.9006, test_f1: 0.5960
 epoch: 10, train_loss: 0.7363, test_loss: 0.8798, test_f1: 0.5648
 epoch: 11, train_loss: 0.7250, test_loss: 0.9230, test_f1: 0.5945
 epoch: 12, train_loss: 0.7064, test_loss: 1.0699, test_f1: 0.5332
 epoch: 13, train_loss: 0.6924, test_loss: 0.9907, test_f1: 0.5832
 epoch: 14, train_loss: 0.6717, test_loss: 0.8777, test_f1: 0.6154
 epoch: 15, train_loss: 0.6578, test_loss: 0.8975, test_f1: 0.6206
 epoch: 16, train_loss: 0.6277, test_loss: 0.9223, test_f1: 0.5700
 epoch: 17, train_loss: 0.6468, test_loss: 0.9429, test_f1: 0.5877
 epoch: 18, train_loss: 0.6270, test_loss: 0.8684, test_f1: 0.5860
 epoch: 19, train_loss: 0.6001, test_loss: 1.0558, test_f1: 0.5942
 epoch: 20, train_loss: 0.5963, test_loss: 1.0705, test_f1: 0.5929
 epoch: 21, train_loss: 0.5916, test_loss: 0.9179, test_f1: 0.6199
 epoch: 22, train_loss: 0.5788, test_loss: 0.9278, test_f1: 0.6273
 epoch: 23, train_loss: 0.5845, test_loss: 1.2678, test_f1: 0.5799
 epoch: 24, train_loss: 0.5607, test_loss: 0.9352, test_f1: 0.6264
 epoch: 25, train_loss: 0.5320, test_loss: 1.1375, test_f1: 0.5921
 epoch: 26, train_loss: 0.5318, test_loss: 0.9099, test_f1: 0.6257
 epoch: 27, train_loss: 0.5071, test_loss: 0.9699, test_f1: 0.6406
 epoch: 28, train_loss: 0.4998, test_loss: 1.0809, test_f1: 0.6328
 epoch: 29, train_loss: 0.5094, test_loss: 0.9012, test_f1: 0.6813
 epoch: 30, train_loss: 0.4811, test_loss: 1.1003, test_f1: 0.6333
 epoch: 31, train_loss: 0.4814, test_loss: 0.9910, test_f1: 0.6520
 epoch: 32, train_loss: 0.4667, test_loss: 1.0767, test_f1: 0.6356
 epoch: 33, train_loss: 0.4529, test_loss: 1.0656, test_f1: 0.6560
 epoch: 34, train_loss: 0.4497, test_loss: 1.0164, test_f1: 0.6319
 epoch: 35, train_loss: 0.4255, test_loss: 1.2796, test_f1: 0.6265
 epoch: 36, train_loss: 0.4432, test_loss: 1.1486, test_f1: 0.6675
 epoch: 37, train_loss: 0.4167, test_loss: 1.2177, test_f1: 0.6515
 epoch: 38, train_loss: 0.4047, test_loss: 1.4637, test_f1: 0.6168
 epoch: 39, train_loss: 0.3925, test_loss: 1.1579, test_f1: 0.6529
 epoch: 40, train_loss: 0.4070, test_loss: 1.2034, test_f1: 0.6244
 epoch: 41, train_loss: 0.3876, test_loss: 1.0714, test_f1: 0.6998
 epoch: 42, train_loss: 0.3649, test_loss: 1.1598, test_f1: 0.6704
 epoch: 43, train_loss: 0.3642, test_loss: 1.3269, test_f1: 0.6394
 epoch: 44, train_loss: 0.3570, test_loss: 1.2397, test_f1: 0.6453
 epoch: 45, train_loss: 0.3535, test_loss: 1.3322, test_f1: 0.6443
 epoch: 46, train_loss: 0.3488, test_loss: 1.4056, test_f1: 0.6502
 epoch: 47, train_loss: 0.3274, test_loss: 1.3513, test_f1: 0.6361
 epoch: 48, train_loss: 0.3145, test_loss: 1.4760, test_f1: 0.6875
 epoch: 49, train_loss: 0.3218, test_loss: 1.9392, test_f1: 0.5690
 epoch: 50, train_loss: 0.3256, test_loss: 1.5606, test_f1: 0.6482
 epoch: 51, train_loss: 0.2823, test_loss: 1.5115, test_f1: 0.6765
 epoch: 52, train_loss: 0.2692, test_loss: 1.4390, test_f1: 0.6686
 epoch: 53, train_loss: 0.2385, test_loss: 1.4663, test_f1: 0.6899
 epoch: 54, train_loss: 0.2459, test_loss: 1.3538, test_f1: 0.6835
 epoch: 55, train_loss: 0.2190, test_loss: 1.5807, test_f1: 0.6706
 epoch: 56, train_loss: 0.2114, test_loss: 1.5720, test_f1: 0.6693
 epoch: 57, train_loss: 0.2189, test_loss: 1.5045, test_f1: 0.6698
 epoch: 58, train_loss: 0.2149, test_loss: 1.5571, test_f1: 0.6723
 epoch: 59, train_loss: 0.2130, test_loss: 1.7484, test_f1: 0.6737
 epoch: 60, train_loss: 0.2057, test_loss: 1.7931, test_f1: 0.6559
 epoch: 61, train_loss: 0.2011, test_loss: 1.7171, test_f1: 0.6652
 epoch: 62, train_loss: 0.2060, test_loss: 1.5822, test_f1: 0.6788
 epoch: 63, train_loss: 0.1939, test_loss: 1.6610, test_f1: 0.6849
 epoch: 64, train_loss: 0.2027, test_loss: 1.5955, test_f1: 0.6630
 epoch: 65, train_loss: 0.2029, test_loss: 2.0513, test_f1: 0.6416
 epoch: 66, train_loss: 0.1868, test_loss: 1.6107, test_f1: 0.6787
 epoch: 67, train_loss: 0.1844, test_loss: 1.5755, test_f1: 0.7164
 epoch: 68, train_loss: 0.1927, test_loss: 1.5999, test_f1: 0.6707
 epoch: 69, train_loss: 0.1759, test_loss: 1.9512, test_f1: 0.6441
 epoch: 70, train_loss: 0.1653, test_loss: 1.6981, test_f1: 0.6784
 epoch: 71, train_loss: 0.1811, test_loss: 1.7424, test_f1: 0.6865
 epoch: 72, train_loss: 0.1764, test_loss: 1.8940, test_f1: 0.6448
 epoch: 73, train_loss: 0.1741, test_loss: 1.8325, test_f1: 0.7006
 epoch: 74, train_loss: 0.1748, test_loss: 1.7068, test_f1: 0.6798
 epoch: 75, train_loss: 0.1652, test_loss: 1.8017, test_f1: 0.6628
 epoch: 76, train_loss: 0.1783, test_loss: 1.8886, test_f1: 0.6869
 epoch: 77, train_loss: 0.1678, test_loss: 1.9228, test_f1: 0.6896
 epoch: 78, train_loss: 0.1407, test_loss: 1.9624, test_f1: 0.6652
 epoch: 79, train_loss: 0.1492, test_loss: 1.7794, test_f1: 0.6641
 epoch: 80, train_loss: 0.1518, test_loss: 2.0247, test_f1: 0.6679
 epoch: 81, train_loss: 0.1568, test_loss: 2.2569, test_f1: 0.6600
 epoch: 82, train_loss: 0.1490, test_loss: 1.8554, test_f1: 0.6861
 epoch: 83, train_loss: 0.1487, test_loss: 2.0646, test_f1: 0.6737
 epoch: 84, train_loss: 0.1527, test_loss: 2.1000, test_f1: 0.6672
 epoch: 85, train_loss: 0.1327, test_loss: 1.9283, test_f1: 0.6806
 epoch: 86, train_loss: 0.1367, test_loss: 2.2834, test_f1: 0.6672
 epoch: 87, train_loss: 0.1393, test_loss: 1.9958, test_f1: 0.6742
 epoch: 88, train_loss: 0.1421, test_loss: 2.0764, test_f1: 0.6499
 epoch: 89, train_loss: 0.1460, test_loss: 1.9848, test_f1: 0.6610
 epoch: 90, train_loss: 0.1468, test_loss: 1.9846, test_f1: 0.6732
 epoch: 91, train_loss: 0.1434, test_loss: 2.1640, test_f1: 0.6647
 epoch: 92, train_loss: 0.1376, test_loss: 2.0480, test_f1: 0.6798
 epoch: 93, train_loss: 0.1183, test_loss: 1.9749, test_f1: 0.6795
 epoch: 94, train_loss: 0.1364, test_loss: 2.1906, test_f1: 0.6593
 epoch: 95, train_loss: 0.1423, test_loss: 2.1012, test_f1: 0.6673
 epoch: 96, train_loss: 0.1442, test_loss: 2.2057, test_f1: 0.6481
 epoch: 97, train_loss: 0.1240, test_loss: 2.1247, test_f1: 0.6800
 epoch: 98, train_loss: 0.1145, test_loss: 2.1395, test_f1: 0.6889
 epoch: 99, train_loss: 0.1236, test_loss: 2.0785, test_f1: 0.6771
##################ITERATION #1 ****************************************
 epoch: 0, train_loss: 1.1309, test_loss: 1.1807, test_f1: 0.3493
 epoch: 1, train_loss: 0.9624, test_loss: 1.0014, test_f1: 0.4403
 epoch: 2, train_loss: 0.9173, test_loss: 0.9518, test_f1: 0.5368
 epoch: 3, train_loss: 0.8646, test_loss: 0.9465, test_f1: 0.4853
 epoch: 4, train_loss: 0.8305, test_loss: 0.8825, test_f1: 0.5438
 epoch: 5, train_loss: 0.8054, test_loss: 1.0475, test_f1: 0.5213
 epoch: 6, train_loss: 0.7799, test_loss: 0.8957, test_f1: 0.5306
 epoch: 7, train_loss: 0.7573, test_loss: 0.9371, test_f1: 0.5852
 epoch: 8, train_loss: 0.7529, test_loss: 0.8358, test_f1: 0.5731
 epoch: 9, train_loss: 0.7286, test_loss: 0.8506, test_f1: 0.5898
 epoch: 10, train_loss: 0.7002, test_loss: 0.8365, test_f1: 0.6173
 epoch: 11, train_loss: 0.6839, test_loss: 0.8912, test_f1: 0.6048
 epoch: 12, train_loss: 0.6695, test_loss: 0.9042, test_f1: 0.6105
 epoch: 13, train_loss: 0.6491, test_loss: 0.9199, test_f1: 0.5739
 epoch: 14, train_loss: 0.6289, test_loss: 0.9288, test_f1: 0.6101
 epoch: 15, train_loss: 0.6275, test_loss: 0.9243, test_f1: 0.6080
 epoch: 16, train_loss: 0.6172, test_loss: 1.0401, test_f1: 0.5997
 epoch: 17, train_loss: 0.5990, test_loss: 0.8282, test_f1: 0.6545
 epoch: 18, train_loss: 0.5812, test_loss: 0.8427, test_f1: 0.6580
 epoch: 19, train_loss: 0.5789, test_loss: 0.9418, test_f1: 0.6142
 epoch: 20, train_loss: 0.5659, test_loss: 0.8830, test_f1: 0.6484
 epoch: 21, train_loss: 0.5453, test_loss: 0.8877, test_f1: 0.6444
 epoch: 22, train_loss: 0.5466, test_loss: 1.0279, test_f1: 0.6187
 epoch: 23, train_loss: 0.5228, test_loss: 0.9216, test_f1: 0.6602
 epoch: 24, train_loss: 0.5103, test_loss: 0.8972, test_f1: 0.6733
 epoch: 25, train_loss: 0.5094, test_loss: 0.9253, test_f1: 0.6415
 epoch: 26, train_loss: 0.5033, test_loss: 0.9434, test_f1: 0.6293
 epoch: 27, train_loss: 0.4633, test_loss: 0.9522, test_f1: 0.6704
 epoch: 28, train_loss: 0.4689, test_loss: 0.8935, test_f1: 0.6473
 epoch: 29, train_loss: 0.4586, test_loss: 1.0090, test_f1: 0.6408
 epoch: 30, train_loss: 0.4535, test_loss: 0.8905, test_f1: 0.6325
 epoch: 31, train_loss: 0.4465, test_loss: 1.0700, test_f1: 0.6175
 epoch: 32, train_loss: 0.4209, test_loss: 1.1580, test_f1: 0.6366
 epoch: 33, train_loss: 0.4526, test_loss: 0.9582, test_f1: 0.6493
 epoch: 34, train_loss: 0.4302, test_loss: 1.0648, test_f1: 0.6303
 epoch: 35, train_loss: 0.4198, test_loss: 1.0162, test_f1: 0.6810
 epoch: 36, train_loss: 0.3814, test_loss: 1.2594, test_f1: 0.5585
 epoch: 37, train_loss: 0.3938, test_loss: 1.0116, test_f1: 0.6638
 epoch: 38, train_loss: 0.3888, test_loss: 1.0985, test_f1: 0.6173
 epoch: 39, train_loss: 0.3615, test_loss: 1.0591, test_f1: 0.6746
 epoch: 40, train_loss: 0.3642, test_loss: 1.0181, test_f1: 0.6598
 epoch: 41, train_loss: 0.3607, test_loss: 1.1279, test_f1: 0.6647
 epoch: 42, train_loss: 0.3475, test_loss: 1.1193, test_f1: 0.6851
 epoch: 43, train_loss: 0.3635, test_loss: 1.0087, test_f1: 0.6806
 epoch: 44, train_loss: 0.3498, test_loss: 1.1136, test_f1: 0.6797
 epoch: 45, train_loss: 0.3393, test_loss: 1.2670, test_f1: 0.6504
 epoch: 46, train_loss: 0.3320, test_loss: 1.0618, test_f1: 0.6953
 epoch: 47, train_loss: 0.3217, test_loss: 1.1250, test_f1: 0.6413
 epoch: 48, train_loss: 0.3142, test_loss: 1.1578, test_f1: 0.6350
 epoch: 49, train_loss: 0.3040, test_loss: 1.2707, test_f1: 0.6562
 epoch: 50, train_loss: 0.3247, test_loss: 1.1758, test_f1: 0.6636
 epoch: 51, train_loss: 0.2614, test_loss: 1.0197, test_f1: 0.7079
 epoch: 52, train_loss: 0.2471, test_loss: 1.2373, test_f1: 0.6415
 epoch: 53, train_loss: 0.2258, test_loss: 1.1992, test_f1: 0.6797
 epoch: 54, train_loss: 0.2213, test_loss: 1.3192, test_f1: 0.6456
 epoch: 55, train_loss: 0.2228, test_loss: 1.3312, test_f1: 0.6605
 epoch: 56, train_loss: 0.2231, test_loss: 1.3593, test_f1: 0.6855
 epoch: 57, train_loss: 0.2100, test_loss: 1.3514, test_f1: 0.6686
 epoch: 58, train_loss: 0.1985, test_loss: 1.4619, test_f1: 0.6724
 epoch: 59, train_loss: 0.1949, test_loss: 1.3573, test_f1: 0.6733
 epoch: 60, train_loss: 0.1837, test_loss: 1.6034, test_f1: 0.6623
 epoch: 61, train_loss: 0.1854, test_loss: 1.4075, test_f1: 0.6665
 epoch: 62, train_loss: 0.1818, test_loss: 1.4826, test_f1: 0.6780
 epoch: 63, train_loss: 0.1858, test_loss: 1.6320, test_f1: 0.6413
 epoch: 64, train_loss: 0.1837, test_loss: 1.5998, test_f1: 0.6358
 epoch: 65, train_loss: 0.1766, test_loss: 1.5205, test_f1: 0.6634
 epoch: 66, train_loss: 0.1631, test_loss: 1.6499, test_f1: 0.6645
 epoch: 67, train_loss: 0.1673, test_loss: 1.5672, test_f1: 0.6664
 epoch: 68, train_loss: 0.1681, test_loss: 1.7334, test_f1: 0.6581
 epoch: 69, train_loss: 0.1757, test_loss: 1.4891, test_f1: 0.6735
 epoch: 70, train_loss: 0.1667, test_loss: 1.8268, test_f1: 0.6263
 epoch: 71, train_loss: 0.1719, test_loss: 1.5995, test_f1: 0.6828
 epoch: 72, train_loss: 0.1497, test_loss: 1.5295, test_f1: 0.6474
 epoch: 73, train_loss: 0.1648, test_loss: 1.6729, test_f1: 0.6512
 epoch: 74, train_loss: 0.1641, test_loss: 1.9924, test_f1: 0.6104
 epoch: 75, train_loss: 0.1564, test_loss: 1.6090, test_f1: 0.6777
 epoch: 76, train_loss: 0.1535, test_loss: 2.0667, test_f1: 0.6220
 epoch: 77, train_loss: 0.1615, test_loss: 1.7167, test_f1: 0.6701
 epoch: 78, train_loss: 0.1667, test_loss: 1.7242, test_f1: 0.6778
 epoch: 79, train_loss: 0.1593, test_loss: 1.7096, test_f1: 0.6567
 epoch: 80, train_loss: 0.1409, test_loss: 1.8775, test_f1: 0.6544
 epoch: 81, train_loss: 0.1488, test_loss: 1.9534, test_f1: 0.6293
 epoch: 82, train_loss: 0.1368, test_loss: 1.8544, test_f1: 0.6600
 epoch: 83, train_loss: 0.1294, test_loss: 2.0355, test_f1: 0.6434
 epoch: 84, train_loss: 0.1388, test_loss: 1.7897, test_f1: 0.6607
 epoch: 85, train_loss: 0.1236, test_loss: 1.6886, test_f1: 0.6781
 epoch: 86, train_loss: 0.1299, test_loss: 2.0024, test_f1: 0.6403
 epoch: 87, train_loss: 0.1240, test_loss: 1.8548, test_f1: 0.6630
 epoch: 88, train_loss: 0.1448, test_loss: 1.7513, test_f1: 0.6675
 epoch: 89, train_loss: 0.1502, test_loss: 2.0308, test_f1: 0.6405
 epoch: 90, train_loss: 0.1274, test_loss: 1.7458, test_f1: 0.6707
 epoch: 91, train_loss: 0.1427, test_loss: 1.8195, test_f1: 0.6471
 epoch: 92, train_loss: 0.1359, test_loss: 1.9067, test_f1: 0.6530
 epoch: 93, train_loss: 0.1178, test_loss: 2.0227, test_f1: 0.6566
 epoch: 94, train_loss: 0.1277, test_loss: 2.0340, test_f1: 0.6496
 epoch: 95, train_loss: 0.1020, test_loss: 2.0939, test_f1: 0.6426
 epoch: 96, train_loss: 0.1146, test_loss: 2.2623, test_f1: 0.6395
 epoch: 97, train_loss: 0.1180, test_loss: 2.1221, test_f1: 0.6393
 epoch: 98, train_loss: 0.1082, test_loss: 2.3049, test_f1: 0.6241
 epoch: 99, train_loss: 0.1245, test_loss: 2.1689, test_f1: 0.6327
##################ITERATION #2 ****************************************
 epoch: 0, train_loss: 1.1110, test_loss: 1.3331, test_f1: 0.2286
 epoch: 1, train_loss: 0.9694, test_loss: 0.9867, test_f1: 0.3999
 epoch: 2, train_loss: 0.8998, test_loss: 0.9872, test_f1: 0.4816
 epoch: 3, train_loss: 0.8553, test_loss: 0.9108, test_f1: 0.5832
 epoch: 4, train_loss: 0.8393, test_loss: 0.8904, test_f1: 0.5281
 epoch: 5, train_loss: 0.7972, test_loss: 0.8475, test_f1: 0.5631
 epoch: 6, train_loss: 0.7689, test_loss: 0.8555, test_f1: 0.6102
 epoch: 7, train_loss: 0.7567, test_loss: 0.8052, test_f1: 0.5818
 epoch: 8, train_loss: 0.7532, test_loss: 0.8171, test_f1: 0.5892
 epoch: 9, train_loss: 0.7325, test_loss: 0.9045, test_f1: 0.5714
 epoch: 10, train_loss: 0.7112, test_loss: 0.9891, test_f1: 0.5634
 epoch: 11, train_loss: 0.6981, test_loss: 0.8026, test_f1: 0.6233
 epoch: 12, train_loss: 0.6791, test_loss: 0.8554, test_f1: 0.5947
 epoch: 13, train_loss: 0.6669, test_loss: 0.7835, test_f1: 0.6248
 epoch: 14, train_loss: 0.6605, test_loss: 0.8869, test_f1: 0.5940
 epoch: 15, train_loss: 0.6258, test_loss: 0.8350, test_f1: 0.6271
 epoch: 16, train_loss: 0.6068, test_loss: 0.8687, test_f1: 0.6114
 epoch: 17, train_loss: 0.6163, test_loss: 0.8510, test_f1: 0.6076
 epoch: 18, train_loss: 0.5867, test_loss: 0.8385, test_f1: 0.6281
 epoch: 19, train_loss: 0.5865, test_loss: 0.8311, test_f1: 0.5941
 epoch: 20, train_loss: 0.5781, test_loss: 0.8653, test_f1: 0.6208
 epoch: 21, train_loss: 0.5588, test_loss: 0.9136, test_f1: 0.6079
 epoch: 22, train_loss: 0.5349, test_loss: 0.8805, test_f1: 0.6174
 epoch: 23, train_loss: 0.5183, test_loss: 0.8450, test_f1: 0.6551
 epoch: 24, train_loss: 0.5354, test_loss: 0.8760, test_f1: 0.6514
 epoch: 25, train_loss: 0.5173, test_loss: 0.9455, test_f1: 0.6201
 epoch: 26, train_loss: 0.4992, test_loss: 0.8467, test_f1: 0.6597
 epoch: 27, train_loss: 0.5125, test_loss: 0.9376, test_f1: 0.6177
 epoch: 28, train_loss: 0.4910, test_loss: 0.9687, test_f1: 0.6558
 epoch: 29, train_loss: 0.4683, test_loss: 1.0317, test_f1: 0.6234
 epoch: 30, train_loss: 0.4556, test_loss: 1.0131, test_f1: 0.6278
 epoch: 31, train_loss: 0.4647, test_loss: 0.9810, test_f1: 0.6709
 epoch: 32, train_loss: 0.4409, test_loss: 0.9911, test_f1: 0.6423
 epoch: 33, train_loss: 0.4292, test_loss: 0.9116, test_f1: 0.6547
 epoch: 34, train_loss: 0.4368, test_loss: 1.0925, test_f1: 0.5990
 epoch: 35, train_loss: 0.4212, test_loss: 1.2016, test_f1: 0.6257
 epoch: 36, train_loss: 0.4341, test_loss: 1.1448, test_f1: 0.6259
 epoch: 37, train_loss: 0.4130, test_loss: 0.9803, test_f1: 0.6486
 epoch: 38, train_loss: 0.3890, test_loss: 1.0674, test_f1: 0.6387
 epoch: 39, train_loss: 0.3973, test_loss: 0.9175, test_f1: 0.6536
 epoch: 40, train_loss: 0.3665, test_loss: 1.0479, test_f1: 0.6598
 epoch: 41, train_loss: 0.3663, test_loss: 1.0921, test_f1: 0.6566
 epoch: 42, train_loss: 0.3939, test_loss: 0.9781, test_f1: 0.6533
 epoch: 43, train_loss: 0.3405, test_loss: 1.2443, test_f1: 0.6268
 epoch: 44, train_loss: 0.3439, test_loss: 1.1417, test_f1: 0.6667
 epoch: 45, train_loss: 0.3510, test_loss: 1.0511, test_f1: 0.6310
 epoch: 46, train_loss: 0.3471, test_loss: 1.2351, test_f1: 0.6170
 epoch: 47, train_loss: 0.3417, test_loss: 1.1754, test_f1: 0.6332
 epoch: 48, train_loss: 0.3360, test_loss: 1.0904, test_f1: 0.6729
 epoch: 49, train_loss: 0.3248, test_loss: 1.1230, test_f1: 0.6481
 epoch: 50, train_loss: 0.2903, test_loss: 1.0181, test_f1: 0.6701
 epoch: 51, train_loss: 0.2748, test_loss: 1.1981, test_f1: 0.6633
 epoch: 52, train_loss: 0.2569, test_loss: 1.2009, test_f1: 0.6651
 epoch: 53, train_loss: 0.2500, test_loss: 1.2686, test_f1: 0.6363
 epoch: 54, train_loss: 0.2360, test_loss: 1.2667, test_f1: 0.6749
 epoch: 55, train_loss: 0.2391, test_loss: 1.2904, test_f1: 0.6608
 epoch: 56, train_loss: 0.2404, test_loss: 1.3805, test_f1: 0.6507
 epoch: 57, train_loss: 0.2294, test_loss: 1.2851, test_f1: 0.6609
 epoch: 58, train_loss: 0.2137, test_loss: 1.4344, test_f1: 0.6513
 epoch: 59, train_loss: 0.2262, test_loss: 1.3387, test_f1: 0.6655
 epoch: 60, train_loss: 0.2403, test_loss: 1.3182, test_f1: 0.6774
 epoch: 61, train_loss: 0.2263, test_loss: 1.2777, test_f1: 0.6796
 epoch: 62, train_loss: 0.2333, test_loss: 1.3995, test_f1: 0.6575
 epoch: 63, train_loss: 0.2124, test_loss: 1.3818, test_f1: 0.6739
 epoch: 64, train_loss: 0.1947, test_loss: 1.4200, test_f1: 0.6603
 epoch: 65, train_loss: 0.2086, test_loss: 1.4989, test_f1: 0.6664
 epoch: 66, train_loss: 0.1924, test_loss: 1.4878, test_f1: 0.6470
 epoch: 67, train_loss: 0.1911, test_loss: 1.4708, test_f1: 0.6544
 epoch: 68, train_loss: 0.1878, test_loss: 1.3270, test_f1: 0.6786
 epoch: 69, train_loss: 0.2032, test_loss: 1.3681, test_f1: 0.6761
 epoch: 70, train_loss: 0.1920, test_loss: 1.3792, test_f1: 0.6678
 epoch: 71, train_loss: 0.1809, test_loss: 1.6260, test_f1: 0.6621
 epoch: 72, train_loss: 0.1854, test_loss: 1.4876, test_f1: 0.6272
 epoch: 73, train_loss: 0.1826, test_loss: 1.5952, test_f1: 0.6309
 epoch: 74, train_loss: 0.1679, test_loss: 1.5774, test_f1: 0.6768
 epoch: 75, train_loss: 0.1694, test_loss: 1.6670, test_f1: 0.6387
 epoch: 76, train_loss: 0.1865, test_loss: 1.5956, test_f1: 0.6445
 epoch: 77, train_loss: 0.1778, test_loss: 1.6708, test_f1: 0.6180
 epoch: 78, train_loss: 0.1858, test_loss: 1.5650, test_f1: 0.6670
 epoch: 79, train_loss: 0.1804, test_loss: 1.6445, test_f1: 0.6558
 epoch: 80, train_loss: 0.1581, test_loss: 1.6684, test_f1: 0.6556
 epoch: 81, train_loss: 0.1667, test_loss: 1.5387, test_f1: 0.6637
 epoch: 82, train_loss: 0.1752, test_loss: 1.4750, test_f1: 0.6731
 epoch: 83, train_loss: 0.1663, test_loss: 1.7846, test_f1: 0.6255
 epoch: 84, train_loss: 0.1548, test_loss: 1.5470, test_f1: 0.6656
 epoch: 85, train_loss: 0.1459, test_loss: 1.7555, test_f1: 0.6550
 epoch: 86, train_loss: 0.1451, test_loss: 1.8668, test_f1: 0.6357
 epoch: 87, train_loss: 0.1538, test_loss: 1.6529, test_f1: 0.6431
 epoch: 88, train_loss: 0.1572, test_loss: 1.9253, test_f1: 0.6544
 epoch: 89, train_loss: 0.1350, test_loss: 1.6941, test_f1: 0.6401
 epoch: 90, train_loss: 0.1522, test_loss: 2.0026, test_f1: 0.6334
 epoch: 91, train_loss: 0.1661, test_loss: 1.7319, test_f1: 0.6709
 epoch: 92, train_loss: 0.1416, test_loss: 1.7728, test_f1: 0.6478
 epoch: 93, train_loss: 0.1412, test_loss: 1.8366, test_f1: 0.6568
 epoch: 94, train_loss: 0.1563, test_loss: 1.7568, test_f1: 0.6532
 epoch: 95, train_loss: 0.1346, test_loss: 1.9863, test_f1: 0.6480
 epoch: 96, train_loss: 0.1323, test_loss: 1.7989, test_f1: 0.6751
 epoch: 97, train_loss: 0.1623, test_loss: 1.9763, test_f1: 0.6538
 epoch: 98, train_loss: 0.1417, test_loss: 1.9169, test_f1: 0.6435
 epoch: 99, train_loss: 0.1468, test_loss: 1.8500, test_f1: 0.6660
##################ITERATION #3 ****************************************
 epoch: 0, train_loss: 1.1992, test_loss: 1.4184, test_f1: 0.2260
 epoch: 1, train_loss: 0.9834, test_loss: 1.0973, test_f1: 0.3776
 epoch: 2, train_loss: 0.9267, test_loss: 0.9545, test_f1: 0.5341
 epoch: 3, train_loss: 0.8817, test_loss: 0.9547, test_f1: 0.4842
 epoch: 4, train_loss: 0.8432, test_loss: 0.9135, test_f1: 0.5414
 epoch: 5, train_loss: 0.8383, test_loss: 0.9851, test_f1: 0.5709
 epoch: 6, train_loss: 0.8122, test_loss: 1.0366, test_f1: 0.5188
 epoch: 7, train_loss: 0.7959, test_loss: 0.8652, test_f1: 0.5616
 epoch: 8, train_loss: 0.7598, test_loss: 0.8844, test_f1: 0.5582
 epoch: 9, train_loss: 0.7320, test_loss: 0.8777, test_f1: 0.6232
 epoch: 10, train_loss: 0.7350, test_loss: 0.8237, test_f1: 0.6353
 epoch: 11, train_loss: 0.7095, test_loss: 0.9740, test_f1: 0.5848
 epoch: 12, train_loss: 0.7080, test_loss: 0.9692, test_f1: 0.5894
 epoch: 13, train_loss: 0.6812, test_loss: 0.8216, test_f1: 0.6204
 epoch: 14, train_loss: 0.6648, test_loss: 0.9054, test_f1: 0.6245
 epoch: 15, train_loss: 0.6690, test_loss: 0.8201, test_f1: 0.6595
 epoch: 16, train_loss: 0.6392, test_loss: 0.8965, test_f1: 0.6217
 epoch: 17, train_loss: 0.6260, test_loss: 1.0201, test_f1: 0.5702
 epoch: 18, train_loss: 0.6289, test_loss: 1.0288, test_f1: 0.5998
 epoch: 19, train_loss: 0.6049, test_loss: 0.8812, test_f1: 0.6552
 epoch: 20, train_loss: 0.5926, test_loss: 0.9503, test_f1: 0.6104
 epoch: 21, train_loss: 0.5588, test_loss: 0.9109, test_f1: 0.6291
 epoch: 22, train_loss: 0.5826, test_loss: 0.9843, test_f1: 0.6217
 epoch: 23, train_loss: 0.5444, test_loss: 0.9455, test_f1: 0.6005
 epoch: 24, train_loss: 0.5376, test_loss: 0.8897, test_f1: 0.6449
 epoch: 25, train_loss: 0.5392, test_loss: 0.8953, test_f1: 0.6606
 epoch: 26, train_loss: 0.5374, test_loss: 0.8703, test_f1: 0.6354
 epoch: 27, train_loss: 0.5052, test_loss: 0.9612, test_f1: 0.6114
 epoch: 28, train_loss: 0.5015, test_loss: 0.8658, test_f1: 0.6714
 epoch: 29, train_loss: 0.4917, test_loss: 0.9421, test_f1: 0.6577
 epoch: 30, train_loss: 0.4737, test_loss: 0.9150, test_f1: 0.6643
 epoch: 31, train_loss: 0.4765, test_loss: 1.0555, test_f1: 0.6473
 epoch: 32, train_loss: 0.4655, test_loss: 0.9661, test_f1: 0.6417
 epoch: 33, train_loss: 0.4468, test_loss: 0.9874, test_f1: 0.6887
 epoch: 34, train_loss: 0.4332, test_loss: 1.0530, test_f1: 0.6500
 epoch: 35, train_loss: 0.4164, test_loss: 1.0608, test_f1: 0.6478
 epoch: 36, train_loss: 0.4051, test_loss: 1.2775, test_f1: 0.5972
 epoch: 37, train_loss: 0.4143, test_loss: 1.0809, test_f1: 0.6577
 epoch: 38, train_loss: 0.4147, test_loss: 0.9619, test_f1: 0.6787
 epoch: 39, train_loss: 0.3910, test_loss: 0.9353, test_f1: 0.6623
 epoch: 40, train_loss: 0.4037, test_loss: 1.0644, test_f1: 0.6362
 epoch: 41, train_loss: 0.3848, test_loss: 1.1029, test_f1: 0.6460
 epoch: 42, train_loss: 0.3882, test_loss: 1.1521, test_f1: 0.6507
 epoch: 43, train_loss: 0.3734, test_loss: 1.0574, test_f1: 0.6820
 epoch: 44, train_loss: 0.3563, test_loss: 1.0063, test_f1: 0.6705
 epoch: 45, train_loss: 0.3448, test_loss: 1.2004, test_f1: 0.6577
 epoch: 46, train_loss: 0.3496, test_loss: 1.0797, test_f1: 0.6796
 epoch: 47, train_loss: 0.3460, test_loss: 1.1169, test_f1: 0.6652
 epoch: 48, train_loss: 0.3530, test_loss: 0.9729, test_f1: 0.6752
 epoch: 49, train_loss: 0.3351, test_loss: 1.1807, test_f1: 0.6572
 epoch: 50, train_loss: 0.3256, test_loss: 1.1018, test_f1: 0.6444
 epoch: 51, train_loss: 0.2979, test_loss: 1.1554, test_f1: 0.6561
 epoch: 52, train_loss: 0.2651, test_loss: 1.1779, test_f1: 0.6746
 epoch: 53, train_loss: 0.2590, test_loss: 1.1989, test_f1: 0.6693
 epoch: 54, train_loss: 0.2445, test_loss: 1.1310, test_f1: 0.6838
 epoch: 55, train_loss: 0.2546, test_loss: 1.2974, test_f1: 0.6618
 epoch: 56, train_loss: 0.2451, test_loss: 1.3493, test_f1: 0.6738
 epoch: 57, train_loss: 0.2387, test_loss: 1.2279, test_f1: 0.6703
 epoch: 58, train_loss: 0.2328, test_loss: 1.2746, test_f1: 0.6693
 epoch: 59, train_loss: 0.2366, test_loss: 1.2687, test_f1: 0.6742
 epoch: 60, train_loss: 0.2323, test_loss: 1.2645, test_f1: 0.6646
 epoch: 61, train_loss: 0.2374, test_loss: 1.4625, test_f1: 0.6621
 epoch: 62, train_loss: 0.2450, test_loss: 1.2778, test_f1: 0.6754
 epoch: 63, train_loss: 0.2203, test_loss: 1.3128, test_f1: 0.6837
 epoch: 64, train_loss: 0.2293, test_loss: 1.3750, test_f1: 0.6710
 epoch: 65, train_loss: 0.2193, test_loss: 1.5042, test_f1: 0.6637
 epoch: 66, train_loss: 0.2158, test_loss: 1.2391, test_f1: 0.6571
 epoch: 67, train_loss: 0.2074, test_loss: 1.3986, test_f1: 0.6912
 epoch: 68, train_loss: 0.1978, test_loss: 1.3709, test_f1: 0.6538
 epoch: 69, train_loss: 0.2081, test_loss: 1.4880, test_f1: 0.6820
 epoch: 70, train_loss: 0.1927, test_loss: 1.3696, test_f1: 0.6669
 epoch: 71, train_loss: 0.2168, test_loss: 1.2982, test_f1: 0.6834
 epoch: 72, train_loss: 0.1946, test_loss: 1.6819, test_f1: 0.6599
 epoch: 73, train_loss: 0.1864, test_loss: 1.4617, test_f1: 0.6810
 epoch: 74, train_loss: 0.1973, test_loss: 1.4633, test_f1: 0.6806
 epoch: 75, train_loss: 0.2035, test_loss: 1.5215, test_f1: 0.6738
 epoch: 76, train_loss: 0.1844, test_loss: 1.5884, test_f1: 0.6712
 epoch: 77, train_loss: 0.1960, test_loss: 1.5624, test_f1: 0.6860
 epoch: 78, train_loss: 0.1735, test_loss: 1.5331, test_f1: 0.6632
 epoch: 79, train_loss: 0.1943, test_loss: 1.6370, test_f1: 0.6891
 epoch: 80, train_loss: 0.1772, test_loss: 1.5521, test_f1: 0.6752
 epoch: 81, train_loss: 0.1635, test_loss: 1.5727, test_f1: 0.6780
 epoch: 82, train_loss: 0.1795, test_loss: 1.5270, test_f1: 0.6728
 epoch: 83, train_loss: 0.1758, test_loss: 1.6331, test_f1: 0.6637
 epoch: 84, train_loss: 0.1725, test_loss: 1.4571, test_f1: 0.6776
 epoch: 85, train_loss: 0.1443, test_loss: 1.6561, test_f1: 0.6766
 epoch: 86, train_loss: 0.1692, test_loss: 1.6751, test_f1: 0.6739
 epoch: 87, train_loss: 0.1575, test_loss: 1.6517, test_f1: 0.6491
 epoch: 88, train_loss: 0.1560, test_loss: 1.6702, test_f1: 0.6789
 epoch: 89, train_loss: 0.1543, test_loss: 1.6304, test_f1: 0.6857
 epoch: 90, train_loss: 0.1516, test_loss: 1.7683, test_f1: 0.6668
 epoch: 91, train_loss: 0.1540, test_loss: 1.6633, test_f1: 0.6806
 epoch: 92, train_loss: 0.1524, test_loss: 1.6533, test_f1: 0.6679
 epoch: 93, train_loss: 0.1490, test_loss: 1.8867, test_f1: 0.6798
 epoch: 94, train_loss: 0.1533, test_loss: 1.6981, test_f1: 0.6688
 epoch: 95, train_loss: 0.1689, test_loss: 1.8465, test_f1: 0.6743
 epoch: 96, train_loss: 0.1631, test_loss: 1.7886, test_f1: 0.6472
 epoch: 97, train_loss: 0.1608, test_loss: 1.7078, test_f1: 0.6834
 epoch: 98, train_loss: 0.1453, test_loss: 1.7760, test_f1: 0.6884
 epoch: 99, train_loss: 0.1559, test_loss: 1.8684, test_f1: 0.6650
##################ITERATION #4 ****************************************
 epoch: 0, train_loss: 1.3231, test_loss: 1.2618, test_f1: 0.2630
 epoch: 1, train_loss: 1.0182, test_loss: 0.9943, test_f1: 0.4845
 epoch: 2, train_loss: 0.9423, test_loss: 0.9617, test_f1: 0.5339
 epoch: 3, train_loss: 0.9224, test_loss: 0.9184, test_f1: 0.5747
 epoch: 4, train_loss: 0.8768, test_loss: 0.9478, test_f1: 0.5819
 epoch: 5, train_loss: 0.8496, test_loss: 0.9872, test_f1: 0.5373
 epoch: 6, train_loss: 0.8145, test_loss: 0.9306, test_f1: 0.5480
 epoch: 7, train_loss: 0.7962, test_loss: 0.9187, test_f1: 0.5890
 epoch: 8, train_loss: 0.7791, test_loss: 0.8987, test_f1: 0.6067
 epoch: 9, train_loss: 0.7566, test_loss: 0.8747, test_f1: 0.6083
 epoch: 10, train_loss: 0.7487, test_loss: 0.8581, test_f1: 0.6184
 epoch: 11, train_loss: 0.7374, test_loss: 0.8416, test_f1: 0.6329
 epoch: 12, train_loss: 0.7072, test_loss: 0.8185, test_f1: 0.6322
 epoch: 13, train_loss: 0.6875, test_loss: 0.9273, test_f1: 0.5873
 epoch: 14, train_loss: 0.6892, test_loss: 0.8266, test_f1: 0.6684
 epoch: 15, train_loss: 0.6791, test_loss: 1.1582, test_f1: 0.5680
 epoch: 16, train_loss: 0.6460, test_loss: 1.0182, test_f1: 0.6069
 epoch: 17, train_loss: 0.6557, test_loss: 0.9298, test_f1: 0.6355
 epoch: 18, train_loss: 0.6239, test_loss: 0.9383, test_f1: 0.5743
 epoch: 19, train_loss: 0.6294, test_loss: 0.9484, test_f1: 0.6390
 epoch: 20, train_loss: 0.6137, test_loss: 0.8361, test_f1: 0.6409
 epoch: 21, train_loss: 0.6001, test_loss: 0.9141, test_f1: 0.6416
 epoch: 22, train_loss: 0.5696, test_loss: 0.8542, test_f1: 0.6651
 epoch: 23, train_loss: 0.5685, test_loss: 0.8250, test_f1: 0.6480
 epoch: 24, train_loss: 0.5513, test_loss: 0.9044, test_f1: 0.6691
 epoch: 25, train_loss: 0.5424, test_loss: 0.8981, test_f1: 0.6249
 epoch: 26, train_loss: 0.5466, test_loss: 0.8703, test_f1: 0.6575
 epoch: 27, train_loss: 0.5119, test_loss: 0.9542, test_f1: 0.6456
 epoch: 28, train_loss: 0.5165, test_loss: 0.9017, test_f1: 0.6519
 epoch: 29, train_loss: 0.4943, test_loss: 0.9370, test_f1: 0.6624
 epoch: 30, train_loss: 0.4854, test_loss: 1.0406, test_f1: 0.6237
 epoch: 31, train_loss: 0.4777, test_loss: 0.9190, test_f1: 0.6598
 epoch: 32, train_loss: 0.4848, test_loss: 0.9956, test_f1: 0.6282
 epoch: 33, train_loss: 0.4758, test_loss: 0.9931, test_f1: 0.6562
 epoch: 34, train_loss: 0.4574, test_loss: 0.9325, test_f1: 0.6626
 epoch: 35, train_loss: 0.4647, test_loss: 0.9534, test_f1: 0.6842
 epoch: 36, train_loss: 0.4464, test_loss: 0.9100, test_f1: 0.6699
 epoch: 37, train_loss: 0.4276, test_loss: 1.0579, test_f1: 0.6900
 epoch: 38, train_loss: 0.4162, test_loss: 0.9437, test_f1: 0.6501
 epoch: 39, train_loss: 0.4004, test_loss: 0.9759, test_f1: 0.6817
 epoch: 40, train_loss: 0.4060, test_loss: 1.1233, test_f1: 0.6356
 epoch: 41, train_loss: 0.4272, test_loss: 1.0173, test_f1: 0.6532
 epoch: 42, train_loss: 0.4245, test_loss: 1.0339, test_f1: 0.6380
 epoch: 43, train_loss: 0.3826, test_loss: 1.1116, test_f1: 0.6304
 epoch: 44, train_loss: 0.3692, test_loss: 0.9981, test_f1: 0.6680
 epoch: 45, train_loss: 0.3615, test_loss: 1.0957, test_f1: 0.6366
 epoch: 46, train_loss: 0.3738, test_loss: 1.3089, test_f1: 0.6359
 epoch: 47, train_loss: 0.3813, test_loss: 0.9855, test_f1: 0.6776
 epoch: 48, train_loss: 0.3631, test_loss: 1.1474, test_f1: 0.6687
 epoch: 49, train_loss: 0.3519, test_loss: 1.0724, test_f1: 0.6346
 epoch: 50, train_loss: 0.3350, test_loss: 1.2691, test_f1: 0.6427
 epoch: 51, train_loss: 0.2907, test_loss: 1.0985, test_f1: 0.6953
 epoch: 52, train_loss: 0.2787, test_loss: 1.1351, test_f1: 0.6727
 epoch: 53, train_loss: 0.2635, test_loss: 1.1699, test_f1: 0.6748
 epoch: 54, train_loss: 0.2662, test_loss: 1.1900, test_f1: 0.6851
 epoch: 55, train_loss: 0.2636, test_loss: 1.2344, test_f1: 0.6797
 epoch: 56, train_loss: 0.2632, test_loss: 1.1692, test_f1: 0.6857
 epoch: 57, train_loss: 0.2622, test_loss: 1.2811, test_f1: 0.6630
 epoch: 58, train_loss: 0.2426, test_loss: 1.1907, test_f1: 0.6751
 epoch: 59, train_loss: 0.2521, test_loss: 1.1917, test_f1: 0.6747
 epoch: 60, train_loss: 0.2334, test_loss: 1.3419, test_f1: 0.6668
 epoch: 61, train_loss: 0.2294, test_loss: 1.1769, test_f1: 0.7005
 epoch: 62, train_loss: 0.2364, test_loss: 1.4959, test_f1: 0.6179
 epoch: 63, train_loss: 0.2346, test_loss: 1.2639, test_f1: 0.6851
 epoch: 64, train_loss: 0.2231, test_loss: 1.3404, test_f1: 0.6734
 epoch: 65, train_loss: 0.2288, test_loss: 1.3232, test_f1: 0.6850
 epoch: 66, train_loss: 0.2240, test_loss: 1.3533, test_f1: 0.6492
 epoch: 67, train_loss: 0.2250, test_loss: 1.2854, test_f1: 0.6852
 epoch: 68, train_loss: 0.2120, test_loss: 1.3982, test_f1: 0.6758
 epoch: 69, train_loss: 0.2233, test_loss: 1.2759, test_f1: 0.6679
 epoch: 70, train_loss: 0.2156, test_loss: 1.3832, test_f1: 0.7009
 epoch: 71, train_loss: 0.1995, test_loss: 1.4282, test_f1: 0.6242
 epoch: 72, train_loss: 0.2104, test_loss: 1.3750, test_f1: 0.6735
 epoch: 73, train_loss: 0.2054, test_loss: 1.4296, test_f1: 0.6426
 epoch: 74, train_loss: 0.2048, test_loss: 1.5271, test_f1: 0.6596
 epoch: 75, train_loss: 0.2089, test_loss: 1.3463, test_f1: 0.6921
 epoch: 76, train_loss: 0.1945, test_loss: 1.3945, test_f1: 0.6838
 epoch: 77, train_loss: 0.1876, test_loss: 1.5457, test_f1: 0.6645
 epoch: 78, train_loss: 0.1885, test_loss: 1.5486, test_f1: 0.6378
 epoch: 79, train_loss: 0.2030, test_loss: 1.3294, test_f1: 0.6846
 epoch: 80, train_loss: 0.1767, test_loss: 1.4425, test_f1: 0.6790
 epoch: 81, train_loss: 0.1953, test_loss: 1.4639, test_f1: 0.6270
 epoch: 82, train_loss: 0.1924, test_loss: 1.4383, test_f1: 0.6928
 epoch: 83, train_loss: 0.2114, test_loss: 1.4119, test_f1: 0.6494
 epoch: 84, train_loss: 0.1909, test_loss: 1.5019, test_f1: 0.6658
 epoch: 85, train_loss: 0.1897, test_loss: 1.5364, test_f1: 0.6177
 epoch: 86, train_loss: 0.1643, test_loss: 1.6142, test_f1: 0.6573
 epoch: 87, train_loss: 0.1810, test_loss: 1.4404, test_f1: 0.6565
 epoch: 88, train_loss: 0.1778, test_loss: 1.7622, test_f1: 0.6469
 epoch: 89, train_loss: 0.1851, test_loss: 1.5744, test_f1: 0.6647
 epoch: 90, train_loss: 0.1730, test_loss: 1.4439, test_f1: 0.6905
 epoch: 91, train_loss: 0.1657, test_loss: 1.6837, test_f1: 0.6302
 epoch: 92, train_loss: 0.1666, test_loss: 1.4283, test_f1: 0.6848
 epoch: 93, train_loss: 0.1465, test_loss: 1.6500, test_f1: 0.6592
 epoch: 94, train_loss: 0.1611, test_loss: 1.6186, test_f1: 0.6489
 epoch: 95, train_loss: 0.1700, test_loss: 1.6099, test_f1: 0.6676
 epoch: 96, train_loss: 0.1527, test_loss: 1.6478, test_f1: 0.6792
 epoch: 97, train_loss: 0.1572, test_loss: 1.5295, test_f1: 0.6613
 epoch: 98, train_loss: 0.1536, test_loss: 1.7988, test_f1: 0.6158
 epoch: 99, train_loss: 0.1665, test_loss: 1.7077, test_f1: 0.6623
##################ITERATION #5 ****************************************
 epoch: 0, train_loss: 1.3479, test_loss: 1.2415, test_f1: 0.2943
 epoch: 1, train_loss: 0.9790, test_loss: 0.9778, test_f1: 0.5108
 epoch: 2, train_loss: 0.9328, test_loss: 0.9740, test_f1: 0.5585
 epoch: 3, train_loss: 0.8978, test_loss: 0.9588, test_f1: 0.5384
 epoch: 4, train_loss: 0.8702, test_loss: 0.9676, test_f1: 0.5873
 epoch: 5, train_loss: 0.8362, test_loss: 0.9591, test_f1: 0.5650
 epoch: 6, train_loss: 0.8182, test_loss: 0.8945, test_f1: 0.5818
 epoch: 7, train_loss: 0.8044, test_loss: 0.8823, test_f1: 0.5933
 epoch: 8, train_loss: 0.7895, test_loss: 0.9187, test_f1: 0.6202
 epoch: 9, train_loss: 0.7483, test_loss: 0.8645, test_f1: 0.6128
 epoch: 10, train_loss: 0.7406, test_loss: 0.9069, test_f1: 0.6013
 epoch: 11, train_loss: 0.7388, test_loss: 0.8840, test_f1: 0.6241
 epoch: 12, train_loss: 0.7155, test_loss: 1.0741, test_f1: 0.5685
 epoch: 13, train_loss: 0.7100, test_loss: 0.8667, test_f1: 0.6118
 epoch: 14, train_loss: 0.6929, test_loss: 0.9856, test_f1: 0.5981
 epoch: 15, train_loss: 0.6868, test_loss: 0.8594, test_f1: 0.6484
 epoch: 16, train_loss: 0.6611, test_loss: 0.8724, test_f1: 0.6348
 epoch: 17, train_loss: 0.6555, test_loss: 0.9553, test_f1: 0.6061
 epoch: 18, train_loss: 0.6545, test_loss: 0.9706, test_f1: 0.5987
 epoch: 19, train_loss: 0.6357, test_loss: 0.9721, test_f1: 0.6241
 epoch: 20, train_loss: 0.6437, test_loss: 0.8825, test_f1: 0.6189
 epoch: 21, train_loss: 0.5991, test_loss: 0.9732, test_f1: 0.5832
 epoch: 22, train_loss: 0.5995, test_loss: 0.8743, test_f1: 0.6187
 epoch: 23, train_loss: 0.5977, test_loss: 0.9039, test_f1: 0.6155
 epoch: 24, train_loss: 0.5647, test_loss: 0.9117, test_f1: 0.5977
 epoch: 25, train_loss: 0.5796, test_loss: 0.8590, test_f1: 0.6438
 epoch: 26, train_loss: 0.5621, test_loss: 0.8604, test_f1: 0.6378
 epoch: 27, train_loss: 0.5456, test_loss: 0.9303, test_f1: 0.6270
 epoch: 28, train_loss: 0.5649, test_loss: 0.8869, test_f1: 0.6147
 epoch: 29, train_loss: 0.5354, test_loss: 0.9428, test_f1: 0.6286
 epoch: 30, train_loss: 0.5388, test_loss: 0.8926, test_f1: 0.6370
 epoch: 31, train_loss: 0.5331, test_loss: 1.0191, test_f1: 0.5802
 epoch: 32, train_loss: 0.5212, test_loss: 0.8787, test_f1: 0.6463
 epoch: 33, train_loss: 0.5032, test_loss: 0.9626, test_f1: 0.6012
 epoch: 34, train_loss: 0.4898, test_loss: 0.8913, test_f1: 0.6404
 epoch: 35, train_loss: 0.4764, test_loss: 0.8727, test_f1: 0.6351
 epoch: 36, train_loss: 0.4672, test_loss: 1.0141, test_f1: 0.6129
 epoch: 37, train_loss: 0.4633, test_loss: 0.9336, test_f1: 0.6319
 epoch: 38, train_loss: 0.4665, test_loss: 0.9076, test_f1: 0.6258
 epoch: 39, train_loss: 0.4663, test_loss: 1.0418, test_f1: 0.6268
 epoch: 40, train_loss: 0.4655, test_loss: 1.0020, test_f1: 0.6415
 epoch: 41, train_loss: 0.4444, test_loss: 0.9545, test_f1: 0.6376
 epoch: 42, train_loss: 0.4553, test_loss: 1.0260, test_f1: 0.6004
 epoch: 43, train_loss: 0.4376, test_loss: 1.0337, test_f1: 0.5800
 epoch: 44, train_loss: 0.4084, test_loss: 1.0512, test_f1: 0.6397
 epoch: 45, train_loss: 0.4165, test_loss: 0.8914, test_f1: 0.6506
 epoch: 46, train_loss: 0.3910, test_loss: 1.0346, test_f1: 0.6303
 epoch: 47, train_loss: 0.3925, test_loss: 0.8950, test_f1: 0.6849
 epoch: 48, train_loss: 0.4070, test_loss: 0.9152, test_f1: 0.6808
 epoch: 49, train_loss: 0.3850, test_loss: 1.0241, test_f1: 0.6241
 epoch: 50, train_loss: 0.3906, test_loss: 0.9530, test_f1: 0.6605
 epoch: 51, train_loss: 0.3554, test_loss: 1.0053, test_f1: 0.6431
 epoch: 52, train_loss: 0.3219, test_loss: 0.9233, test_f1: 0.6912
 epoch: 53, train_loss: 0.3140, test_loss: 1.0348, test_f1: 0.6487
 epoch: 54, train_loss: 0.3193, test_loss: 1.0255, test_f1: 0.6925
 epoch: 55, train_loss: 0.2975, test_loss: 1.0586, test_f1: 0.6730
 epoch: 56, train_loss: 0.2969, test_loss: 1.1733, test_f1: 0.6152
 epoch: 57, train_loss: 0.2918, test_loss: 0.9813, test_f1: 0.6525
 epoch: 58, train_loss: 0.2993, test_loss: 1.0579, test_f1: 0.6847
 epoch: 59, train_loss: 0.2950, test_loss: 1.0870, test_f1: 0.6500
 epoch: 60, train_loss: 0.2935, test_loss: 0.9936, test_f1: 0.6832
 epoch: 61, train_loss: 0.2703, test_loss: 1.0880, test_f1: 0.6431
 epoch: 62, train_loss: 0.2698, test_loss: 1.0901, test_f1: 0.6538
 epoch: 63, train_loss: 0.2717, test_loss: 1.1018, test_f1: 0.6740
 epoch: 64, train_loss: 0.2648, test_loss: 1.0328, test_f1: 0.6659
 epoch: 65, train_loss: 0.2661, test_loss: 1.1392, test_f1: 0.6671
 epoch: 66, train_loss: 0.2558, test_loss: 1.0651, test_f1: 0.7063
 epoch: 67, train_loss: 0.2569, test_loss: 1.2408, test_f1: 0.6321
 epoch: 68, train_loss: 0.2532, test_loss: 1.1332, test_f1: 0.6635
 epoch: 69, train_loss: 0.2481, test_loss: 1.2902, test_f1: 0.6148
 epoch: 70, train_loss: 0.2532, test_loss: 1.1586, test_f1: 0.6792
 epoch: 71, train_loss: 0.2678, test_loss: 1.1932, test_f1: 0.6622
 epoch: 72, train_loss: 0.2547, test_loss: 1.1784, test_f1: 0.6516
 epoch: 73, train_loss: 0.2405, test_loss: 1.2168, test_f1: 0.6699
 epoch: 74, train_loss: 0.2399, test_loss: 1.4545, test_f1: 0.5900
 epoch: 75, train_loss: 0.2256, test_loss: 1.2247, test_f1: 0.6697
 epoch: 76, train_loss: 0.2256, test_loss: 1.2101, test_f1: 0.6708
 epoch: 77, train_loss: 0.2190, test_loss: 1.3167, test_f1: 0.6466
 epoch: 78, train_loss: 0.2197, test_loss: 1.2458, test_f1: 0.6493
 epoch: 79, train_loss: 0.2220, test_loss: 1.3047, test_f1: 0.6570
 epoch: 80, train_loss: 0.2063, test_loss: 1.2682, test_f1: 0.6407
 epoch: 81, train_loss: 0.2100, test_loss: 1.4629, test_f1: 0.6264
 epoch: 82, train_loss: 0.2147, test_loss: 1.2517, test_f1: 0.6679
 epoch: 83, train_loss: 0.2150, test_loss: 1.3642, test_f1: 0.6473
 epoch: 84, train_loss: 0.2047, test_loss: 1.4106, test_f1: 0.6698
 epoch: 85, train_loss: 0.1995, test_loss: 1.3519, test_f1: 0.6712
 epoch: 86, train_loss: 0.2235, test_loss: 1.2708, test_f1: 0.6917
 epoch: 87, train_loss: 0.2075, test_loss: 1.3599, test_f1: 0.6680
 epoch: 88, train_loss: 0.2117, test_loss: 1.5191, test_f1: 0.6638
 epoch: 89, train_loss: 0.2027, test_loss: 1.4249, test_f1: 0.6440
 epoch: 90, train_loss: 0.2121, test_loss: 1.4764, test_f1: 0.6440
 epoch: 91, train_loss: 0.1912, test_loss: 1.4470, test_f1: 0.6550
 epoch: 92, train_loss: 0.2003, test_loss: 1.3467, test_f1: 0.6537
 epoch: 93, train_loss: 0.1957, test_loss: 1.5003, test_f1: 0.6278
 epoch: 94, train_loss: 0.2078, test_loss: 1.4136, test_f1: 0.6601
 epoch: 95, train_loss: 0.2012, test_loss: 1.4525, test_f1: 0.6656
 epoch: 96, train_loss: 0.2021, test_loss: 1.4259, test_f1: 0.6469
 epoch: 97, train_loss: 0.1684, test_loss: 1.6106, test_f1: 0.6242
 epoch: 98, train_loss: 0.1904, test_loss: 1.5780, test_f1: 0.6228
 epoch: 99, train_loss: 0.1757, test_loss: 1.4550, test_f1: 0.6599
##################ITERATION #6 ****************************************
 epoch: 0, train_loss: 1.4753, test_loss: 1.2513, test_f1: 0.2825
 epoch: 1, train_loss: 1.0147, test_loss: 1.0155, test_f1: 0.4456
 epoch: 2, train_loss: 0.9276, test_loss: 0.9076, test_f1: 0.5357
 epoch: 3, train_loss: 0.8983, test_loss: 0.8947, test_f1: 0.5752
 epoch: 4, train_loss: 0.8522, test_loss: 0.8893, test_f1: 0.5625
 epoch: 5, train_loss: 0.8283, test_loss: 0.8487, test_f1: 0.6061
 epoch: 6, train_loss: 0.8170, test_loss: 0.9302, test_f1: 0.6164
 epoch: 7, train_loss: 0.8050, test_loss: 0.8932, test_f1: 0.6059
 epoch: 8, train_loss: 0.7862, test_loss: 0.9177, test_f1: 0.6072
 epoch: 9, train_loss: 0.7528, test_loss: 0.8898, test_f1: 0.5534
 epoch: 10, train_loss: 0.7431, test_loss: 0.9283, test_f1: 0.6040
 epoch: 11, train_loss: 0.7372, test_loss: 0.8683, test_f1: 0.6127
 epoch: 12, train_loss: 0.6998, test_loss: 0.9264, test_f1: 0.5956
 epoch: 13, train_loss: 0.6849, test_loss: 0.8528, test_f1: 0.6237
 epoch: 14, train_loss: 0.6979, test_loss: 0.8006, test_f1: 0.6350
 epoch: 15, train_loss: 0.6712, test_loss: 0.8950, test_f1: 0.6299
 epoch: 16, train_loss: 0.6566, test_loss: 0.8582, test_f1: 0.6417
 epoch: 17, train_loss: 0.6422, test_loss: 0.8959, test_f1: 0.6305
 epoch: 18, train_loss: 0.6167, test_loss: 0.8991, test_f1: 0.6248
 epoch: 19, train_loss: 0.6070, test_loss: 1.0999, test_f1: 0.5855
 epoch: 20, train_loss: 0.5950, test_loss: 0.8978, test_f1: 0.6410
 epoch: 21, train_loss: 0.6080, test_loss: 0.9763, test_f1: 0.5811
 epoch: 22, train_loss: 0.5888, test_loss: 0.8855, test_f1: 0.6201
 epoch: 23, train_loss: 0.5687, test_loss: 0.9736, test_f1: 0.6099
 epoch: 24, train_loss: 0.5586, test_loss: 0.8676, test_f1: 0.6433
 epoch: 25, train_loss: 0.5391, test_loss: 0.8763, test_f1: 0.6601
 epoch: 26, train_loss: 0.5453, test_loss: 0.8944, test_f1: 0.6349
 epoch: 27, train_loss: 0.5393, test_loss: 0.8366, test_f1: 0.6692
 epoch: 28, train_loss: 0.5160, test_loss: 0.8945, test_f1: 0.6312
 epoch: 29, train_loss: 0.5072, test_loss: 0.9387, test_f1: 0.6107
 epoch: 30, train_loss: 0.4791, test_loss: 0.9215, test_f1: 0.6623
 epoch: 31, train_loss: 0.4974, test_loss: 1.2116, test_f1: 0.5936
 epoch: 32, train_loss: 0.4669, test_loss: 0.8609, test_f1: 0.6425
 epoch: 33, train_loss: 0.4637, test_loss: 0.8832, test_f1: 0.6534
 epoch: 34, train_loss: 0.4660, test_loss: 1.0684, test_f1: 0.6057
 epoch: 35, train_loss: 0.4637, test_loss: 0.8979, test_f1: 0.6573
 epoch: 36, train_loss: 0.4604, test_loss: 0.9140, test_f1: 0.6450
 epoch: 37, train_loss: 0.4511, test_loss: 1.0869, test_f1: 0.6326
 epoch: 38, train_loss: 0.4488, test_loss: 0.9126, test_f1: 0.6590
 epoch: 39, train_loss: 0.4172, test_loss: 0.9933, test_f1: 0.6395
 epoch: 40, train_loss: 0.4037, test_loss: 1.0845, test_f1: 0.6173
 epoch: 41, train_loss: 0.4066, test_loss: 1.0767, test_f1: 0.6239
 epoch: 42, train_loss: 0.3822, test_loss: 1.0054, test_f1: 0.6422
 epoch: 43, train_loss: 0.3940, test_loss: 1.1040, test_f1: 0.6213
 epoch: 44, train_loss: 0.3725, test_loss: 0.9662, test_f1: 0.6495
 epoch: 45, train_loss: 0.3832, test_loss: 1.0322, test_f1: 0.6363
 epoch: 46, train_loss: 0.3659, test_loss: 0.9976, test_f1: 0.6889
 epoch: 47, train_loss: 0.3685, test_loss: 1.0736, test_f1: 0.6190
 epoch: 48, train_loss: 0.3509, test_loss: 1.0868, test_f1: 0.6468
 epoch: 49, train_loss: 0.3431, test_loss: 1.0534, test_f1: 0.6466
 epoch: 50, train_loss: 0.3473, test_loss: 1.1383, test_f1: 0.6567
 epoch: 51, train_loss: 0.3207, test_loss: 1.0326, test_f1: 0.6823
 epoch: 52, train_loss: 0.2806, test_loss: 1.1064, test_f1: 0.6671
 epoch: 53, train_loss: 0.2914, test_loss: 1.1382, test_f1: 0.6470
 epoch: 54, train_loss: 0.2685, test_loss: 1.0837, test_f1: 0.6800
 epoch: 55, train_loss: 0.2764, test_loss: 1.1484, test_f1: 0.6432
 epoch: 56, train_loss: 0.2556, test_loss: 1.0956, test_f1: 0.6638
 epoch: 57, train_loss: 0.2544, test_loss: 1.0963, test_f1: 0.6786
 epoch: 58, train_loss: 0.2411, test_loss: 1.1734, test_f1: 0.6566
 epoch: 59, train_loss: 0.2667, test_loss: 1.1879, test_f1: 0.6762
 epoch: 60, train_loss: 0.2526, test_loss: 1.1716, test_f1: 0.6558
 epoch: 61, train_loss: 0.2569, test_loss: 1.1323, test_f1: 0.6850
 epoch: 62, train_loss: 0.2499, test_loss: 1.2508, test_f1: 0.6717
 epoch: 63, train_loss: 0.2410, test_loss: 1.1844, test_f1: 0.6776
 epoch: 64, train_loss: 0.2428, test_loss: 1.2272, test_f1: 0.6635
 epoch: 65, train_loss: 0.2410, test_loss: 1.1663, test_f1: 0.6835
 epoch: 66, train_loss: 0.2176, test_loss: 1.2759, test_f1: 0.6488
 epoch: 67, train_loss: 0.2189, test_loss: 1.3124, test_f1: 0.6350
 epoch: 68, train_loss: 0.2188, test_loss: 1.3481, test_f1: 0.6780
 epoch: 69, train_loss: 0.2340, test_loss: 1.3830, test_f1: 0.6489
 epoch: 70, train_loss: 0.2441, test_loss: 1.4424, test_f1: 0.6561
 epoch: 71, train_loss: 0.2256, test_loss: 1.2489, test_f1: 0.6548
 epoch: 72, train_loss: 0.2283, test_loss: 1.2476, test_f1: 0.6556
 epoch: 73, train_loss: 0.2166, test_loss: 1.2141, test_f1: 0.6582
 epoch: 74, train_loss: 0.2371, test_loss: 1.2657, test_f1: 0.6728
 epoch: 75, train_loss: 0.2165, test_loss: 1.3611, test_f1: 0.6504
 epoch: 76, train_loss: 0.2072, test_loss: 1.2616, test_f1: 0.6842
 epoch: 77, train_loss: 0.2083, test_loss: 1.3786, test_f1: 0.6714
 epoch: 78, train_loss: 0.2102, test_loss: 1.3518, test_f1: 0.6689
 epoch: 79, train_loss: 0.1995, test_loss: 1.3258, test_f1: 0.6571
 epoch: 80, train_loss: 0.1846, test_loss: 1.3415, test_f1: 0.6696
 epoch: 81, train_loss: 0.2080, test_loss: 1.4568, test_f1: 0.6496
 epoch: 82, train_loss: 0.2009, test_loss: 1.2749, test_f1: 0.6697
 epoch: 83, train_loss: 0.2011, test_loss: 1.3415, test_f1: 0.6714
 epoch: 84, train_loss: 0.1937, test_loss: 1.4242, test_f1: 0.6528
 epoch: 85, train_loss: 0.1826, test_loss: 1.4490, test_f1: 0.6637
 epoch: 86, train_loss: 0.1772, test_loss: 1.4640, test_f1: 0.6308
 epoch: 87, train_loss: 0.1948, test_loss: 1.4112, test_f1: 0.6798
 epoch: 88, train_loss: 0.1642, test_loss: 1.4593, test_f1: 0.6614
 epoch: 89, train_loss: 0.2016, test_loss: 1.3978, test_f1: 0.6607
 epoch: 90, train_loss: 0.1935, test_loss: 1.4518, test_f1: 0.6618
 epoch: 91, train_loss: 0.1986, test_loss: 1.3265, test_f1: 0.6692
 epoch: 92, train_loss: 0.1895, test_loss: 1.3599, test_f1: 0.6791
 epoch: 93, train_loss: 0.1697, test_loss: 1.3554, test_f1: 0.6748
 epoch: 94, train_loss: 0.1747, test_loss: 1.5502, test_f1: 0.6573
 epoch: 95, train_loss: 0.1651, test_loss: 1.4860, test_f1: 0.6700
 epoch: 96, train_loss: 0.1620, test_loss: 1.4891, test_f1: 0.6646
 epoch: 97, train_loss: 0.1537, test_loss: 1.4507, test_f1: 0.6728
 epoch: 98, train_loss: 0.1575, test_loss: 1.7798, test_f1: 0.6292
 epoch: 99, train_loss: 0.1549, test_loss: 1.6330, test_f1: 0.6343
##################ITERATION #7 ****************************************
 epoch: 0, train_loss: 1.5537, test_loss: 1.2077, test_f1: 0.2714
 epoch: 1, train_loss: 1.0112, test_loss: 0.9837, test_f1: 0.4471
 epoch: 2, train_loss: 0.9582, test_loss: 0.9918, test_f1: 0.5022
 epoch: 3, train_loss: 0.9314, test_loss: 0.9717, test_f1: 0.5347
 epoch: 4, train_loss: 0.8987, test_loss: 0.9179, test_f1: 0.5484
 epoch: 5, train_loss: 0.8639, test_loss: 0.9387, test_f1: 0.5332
 epoch: 6, train_loss: 0.8520, test_loss: 0.8710, test_f1: 0.5793
 epoch: 7, train_loss: 0.8213, test_loss: 0.8422, test_f1: 0.5863
 epoch: 8, train_loss: 0.7917, test_loss: 0.8857, test_f1: 0.5804
 epoch: 9, train_loss: 0.7644, test_loss: 0.9065, test_f1: 0.5735
 epoch: 10, train_loss: 0.7445, test_loss: 0.8434, test_f1: 0.6026
 epoch: 11, train_loss: 0.7320, test_loss: 0.8990, test_f1: 0.6196
 epoch: 12, train_loss: 0.7312, test_loss: 0.8782, test_f1: 0.6045
 epoch: 13, train_loss: 0.6904, test_loss: 0.8469, test_f1: 0.6263
 epoch: 14, train_loss: 0.6896, test_loss: 0.8402, test_f1: 0.6252
 epoch: 15, train_loss: 0.6670, test_loss: 1.0564, test_f1: 0.5802
 epoch: 16, train_loss: 0.6560, test_loss: 0.8289, test_f1: 0.6287
 epoch: 17, train_loss: 0.6173, test_loss: 0.8522, test_f1: 0.6154
 epoch: 18, train_loss: 0.6387, test_loss: 0.8759, test_f1: 0.6031
 epoch: 19, train_loss: 0.6297, test_loss: 0.9805, test_f1: 0.5896
 epoch: 20, train_loss: 0.5953, test_loss: 0.9309, test_f1: 0.5979
 epoch: 21, train_loss: 0.5817, test_loss: 0.8775, test_f1: 0.6321
 epoch: 22, train_loss: 0.5763, test_loss: 0.9431, test_f1: 0.5956
 epoch: 23, train_loss: 0.5655, test_loss: 0.9237, test_f1: 0.6375
 epoch: 24, train_loss: 0.5568, test_loss: 0.9211, test_f1: 0.6382
 epoch: 25, train_loss: 0.5337, test_loss: 0.9986, test_f1: 0.6016
 epoch: 26, train_loss: 0.5311, test_loss: 0.9171, test_f1: 0.6420
 epoch: 27, train_loss: 0.5236, test_loss: 0.9423, test_f1: 0.6322
 epoch: 28, train_loss: 0.5177, test_loss: 1.4080, test_f1: 0.5600
 epoch: 29, train_loss: 0.5234, test_loss: 0.8749, test_f1: 0.6297
 epoch: 30, train_loss: 0.5143, test_loss: 0.9446, test_f1: 0.6115
 epoch: 31, train_loss: 0.4923, test_loss: 0.9506, test_f1: 0.6382
 epoch: 32, train_loss: 0.4821, test_loss: 0.9679, test_f1: 0.6384
 epoch: 33, train_loss: 0.4678, test_loss: 0.9939, test_f1: 0.6618
 epoch: 34, train_loss: 0.4482, test_loss: 0.9710, test_f1: 0.6523
 epoch: 35, train_loss: 0.4498, test_loss: 0.9442, test_f1: 0.6376
 epoch: 36, train_loss: 0.4483, test_loss: 1.0344, test_f1: 0.6627
 epoch: 37, train_loss: 0.4222, test_loss: 1.0607, test_f1: 0.6576
 epoch: 38, train_loss: 0.4008, test_loss: 1.0565, test_f1: 0.6467
 epoch: 39, train_loss: 0.4269, test_loss: 1.1235, test_f1: 0.6169
 epoch: 40, train_loss: 0.4073, test_loss: 1.0925, test_f1: 0.6397
 epoch: 41, train_loss: 0.4032, test_loss: 1.0279, test_f1: 0.6505
 epoch: 42, train_loss: 0.4025, test_loss: 1.1481, test_f1: 0.6517
 epoch: 43, train_loss: 0.4028, test_loss: 1.1222, test_f1: 0.6420
 epoch: 44, train_loss: 0.4025, test_loss: 1.1595, test_f1: 0.6499
 epoch: 45, train_loss: 0.3811, test_loss: 1.2779, test_f1: 0.6272
 epoch: 46, train_loss: 0.3702, test_loss: 1.1324, test_f1: 0.6439
 epoch: 47, train_loss: 0.3770, test_loss: 1.1596, test_f1: 0.5971
 epoch: 48, train_loss: 0.3632, test_loss: 1.1976, test_f1: 0.6599
 epoch: 49, train_loss: 0.3496, test_loss: 1.2980, test_f1: 0.6400
 epoch: 50, train_loss: 0.3439, test_loss: 1.2808, test_f1: 0.6409
 epoch: 51, train_loss: 0.2954, test_loss: 1.3503, test_f1: 0.6335
 epoch: 52, train_loss: 0.2972, test_loss: 1.3250, test_f1: 0.6536
 epoch: 53, train_loss: 0.2774, test_loss: 1.3228, test_f1: 0.6494
 epoch: 54, train_loss: 0.2607, test_loss: 1.3937, test_f1: 0.6507
 epoch: 55, train_loss: 0.2674, test_loss: 1.4290, test_f1: 0.6398
 epoch: 56, train_loss: 0.2642, test_loss: 1.3440, test_f1: 0.6491
 epoch: 57, train_loss: 0.2375, test_loss: 1.4118, test_f1: 0.6435
 epoch: 58, train_loss: 0.2512, test_loss: 1.4813, test_f1: 0.6392
 epoch: 59, train_loss: 0.2504, test_loss: 1.4881, test_f1: 0.6281
 epoch: 60, train_loss: 0.2780, test_loss: 1.3910, test_f1: 0.6500
 epoch: 61, train_loss: 0.2597, test_loss: 1.3482, test_f1: 0.6606
 epoch: 62, train_loss: 0.2358, test_loss: 1.4018, test_f1: 0.6645
 epoch: 63, train_loss: 0.2552, test_loss: 1.5480, test_f1: 0.6474
 epoch: 64, train_loss: 0.2473, test_loss: 1.5618, test_f1: 0.6377
 epoch: 65, train_loss: 0.2520, test_loss: 1.4996, test_f1: 0.6378
 epoch: 66, train_loss: 0.2326, test_loss: 1.4261, test_f1: 0.6576
 epoch: 67, train_loss: 0.2295, test_loss: 1.4754, test_f1: 0.6454
 epoch: 68, train_loss: 0.2133, test_loss: 1.6493, test_f1: 0.6334
 epoch: 69, train_loss: 0.2425, test_loss: 1.5752, test_f1: 0.6367
 epoch: 70, train_loss: 0.2215, test_loss: 1.6004, test_f1: 0.6355
 epoch: 71, train_loss: 0.2207, test_loss: 1.4890, test_f1: 0.6526
 epoch: 72, train_loss: 0.2209, test_loss: 1.5236, test_f1: 0.6455
 epoch: 73, train_loss: 0.2137, test_loss: 1.5756, test_f1: 0.6386
 epoch: 74, train_loss: 0.2113, test_loss: 1.6860, test_f1: 0.6358
 epoch: 75, train_loss: 0.2096, test_loss: 1.4714, test_f1: 0.6808
 epoch: 76, train_loss: 0.2150, test_loss: 1.6244, test_f1: 0.6458
 epoch: 77, train_loss: 0.1995, test_loss: 1.6177, test_f1: 0.6456
 epoch: 78, train_loss: 0.2064, test_loss: 1.5296, test_f1: 0.6589
 epoch: 79, train_loss: 0.2006, test_loss: 1.5987, test_f1: 0.6493
 epoch: 80, train_loss: 0.2156, test_loss: 1.6429, test_f1: 0.6507
 epoch: 81, train_loss: 0.2054, test_loss: 1.5278, test_f1: 0.6303
 epoch: 82, train_loss: 0.2109, test_loss: 1.6817, test_f1: 0.6579
 epoch: 83, train_loss: 0.2018, test_loss: 1.6875, test_f1: 0.6341
 epoch: 84, train_loss: 0.1980, test_loss: 1.6462, test_f1: 0.6412
 epoch: 85, train_loss: 0.1896, test_loss: 1.7744, test_f1: 0.6531
 epoch: 86, train_loss: 0.1974, test_loss: 1.8634, test_f1: 0.5910
 epoch: 87, train_loss: 0.1954, test_loss: 1.8175, test_f1: 0.6251
 epoch: 88, train_loss: 0.1954, test_loss: 1.8910, test_f1: 0.5966
 epoch: 89, train_loss: 0.1842, test_loss: 1.6862, test_f1: 0.6388
 epoch: 90, train_loss: 0.1795, test_loss: 1.8624, test_f1: 0.6044
 epoch: 91, train_loss: 0.1806, test_loss: 1.8063, test_f1: 0.6255
 epoch: 92, train_loss: 0.1704, test_loss: 1.8499, test_f1: 0.6045
 epoch: 93, train_loss: 0.1668, test_loss: 1.9140, test_f1: 0.6392
 epoch: 94, train_loss: 0.1650, test_loss: 1.9411, test_f1: 0.6473
 epoch: 95, train_loss: 0.1570, test_loss: 1.9174, test_f1: 0.6350
 epoch: 96, train_loss: 0.1611, test_loss: 1.8626, test_f1: 0.6322
 epoch: 97, train_loss: 0.1684, test_loss: 1.8795, test_f1: 0.6413
 epoch: 98, train_loss: 0.1503, test_loss: 2.0603, test_f1: 0.6399
 epoch: 99, train_loss: 0.1697, test_loss: 1.9491, test_f1: 0.6288
##################ITERATION #8 ****************************************
 epoch: 0, train_loss: 1.4334, test_loss: 1.3219, test_f1: 0.2501
 epoch: 1, train_loss: 1.0029, test_loss: 1.0416, test_f1: 0.4354
 epoch: 2, train_loss: 0.9585, test_loss: 1.0032, test_f1: 0.4857
 epoch: 3, train_loss: 0.9143, test_loss: 0.9835, test_f1: 0.5266
 epoch: 4, train_loss: 0.8938, test_loss: 0.9324, test_f1: 0.5878
 epoch: 5, train_loss: 0.8506, test_loss: 0.9827, test_f1: 0.5450
 epoch: 6, train_loss: 0.8262, test_loss: 0.9088, test_f1: 0.5681
 epoch: 7, train_loss: 0.8031, test_loss: 0.8786, test_f1: 0.5919
 epoch: 8, train_loss: 0.7992, test_loss: 0.8898, test_f1: 0.5783
 epoch: 9, train_loss: 0.7776, test_loss: 0.9024, test_f1: 0.5885
 epoch: 10, train_loss: 0.7540, test_loss: 0.8762, test_f1: 0.6245
 epoch: 11, train_loss: 0.7236, test_loss: 0.8788, test_f1: 0.5817
 epoch: 12, train_loss: 0.7168, test_loss: 0.8718, test_f1: 0.6128
 epoch: 13, train_loss: 0.6960, test_loss: 0.9090, test_f1: 0.6217
 epoch: 14, train_loss: 0.6793, test_loss: 0.8843, test_f1: 0.6032
 epoch: 15, train_loss: 0.6547, test_loss: 0.8564, test_f1: 0.6384
 epoch: 16, train_loss: 0.6600, test_loss: 0.9998, test_f1: 0.6073
 epoch: 17, train_loss: 0.6409, test_loss: 0.8746, test_f1: 0.5984
 epoch: 18, train_loss: 0.6304, test_loss: 0.8633, test_f1: 0.6303
 epoch: 19, train_loss: 0.6115, test_loss: 0.9298, test_f1: 0.6121
 epoch: 20, train_loss: 0.6202, test_loss: 0.8622, test_f1: 0.6094
 epoch: 21, train_loss: 0.6023, test_loss: 0.8733, test_f1: 0.6075
 epoch: 22, train_loss: 0.5699, test_loss: 0.9496, test_f1: 0.6076
 epoch: 23, train_loss: 0.5727, test_loss: 0.8788, test_f1: 0.6286
 epoch: 24, train_loss: 0.5666, test_loss: 0.9267, test_f1: 0.6062
 epoch: 25, train_loss: 0.5644, test_loss: 0.9369, test_f1: 0.5944
 epoch: 26, train_loss: 0.5514, test_loss: 1.0184, test_f1: 0.5767
 epoch: 27, train_loss: 0.5134, test_loss: 0.8064, test_f1: 0.6383
 epoch: 28, train_loss: 0.5127, test_loss: 0.9398, test_f1: 0.6146
 epoch: 29, train_loss: 0.5191, test_loss: 0.9693, test_f1: 0.6334
 epoch: 30, train_loss: 0.5303, test_loss: 0.8470, test_f1: 0.6529
 epoch: 31, train_loss: 0.4840, test_loss: 0.8499, test_f1: 0.6863
 epoch: 32, train_loss: 0.4764, test_loss: 0.8400, test_f1: 0.6813
 epoch: 33, train_loss: 0.4964, test_loss: 0.8933, test_f1: 0.6631
 epoch: 34, train_loss: 0.4814, test_loss: 0.9558, test_f1: 0.6344
 epoch: 35, train_loss: 0.4636, test_loss: 0.9057, test_f1: 0.6483
 epoch: 36, train_loss: 0.4691, test_loss: 0.9659, test_f1: 0.6514
 epoch: 37, train_loss: 0.4695, test_loss: 0.9246, test_f1: 0.6572
 epoch: 38, train_loss: 0.4499, test_loss: 0.8947, test_f1: 0.6482
 epoch: 39, train_loss: 0.4455, test_loss: 0.9674, test_f1: 0.6371
 epoch: 40, train_loss: 0.4193, test_loss: 0.9370, test_f1: 0.6613
 epoch: 41, train_loss: 0.4232, test_loss: 0.8878, test_f1: 0.6475
 epoch: 42, train_loss: 0.4257, test_loss: 0.8270, test_f1: 0.6631
 epoch: 43, train_loss: 0.4009, test_loss: 0.9973, test_f1: 0.6305
 epoch: 44, train_loss: 0.4192, test_loss: 0.8556, test_f1: 0.6291
 epoch: 45, train_loss: 0.4188, test_loss: 1.1386, test_f1: 0.6024
 epoch: 46, train_loss: 0.4075, test_loss: 0.8995, test_f1: 0.6830
 epoch: 47, train_loss: 0.3668, test_loss: 0.9466, test_f1: 0.6731
 epoch: 48, train_loss: 0.3570, test_loss: 1.1664, test_f1: 0.6489
 epoch: 49, train_loss: 0.3772, test_loss: 0.9906, test_f1: 0.6605
 epoch: 50, train_loss: 0.3722, test_loss: 1.0874, test_f1: 0.6443
 epoch: 51, train_loss: 0.3355, test_loss: 0.9529, test_f1: 0.6779
 epoch: 52, train_loss: 0.3037, test_loss: 1.0851, test_f1: 0.6708
 epoch: 53, train_loss: 0.2932, test_loss: 1.0181, test_f1: 0.6798
 epoch: 54, train_loss: 0.3125, test_loss: 1.0645, test_f1: 0.6525
 epoch: 55, train_loss: 0.2955, test_loss: 1.0411, test_f1: 0.6801
 epoch: 56, train_loss: 0.2874, test_loss: 1.0570, test_f1: 0.6843
 epoch: 57, train_loss: 0.2965, test_loss: 1.0423, test_f1: 0.6611
 epoch: 58, train_loss: 0.2833, test_loss: 1.1614, test_f1: 0.6609
 epoch: 59, train_loss: 0.2723, test_loss: 0.9903, test_f1: 0.6861
 epoch: 60, train_loss: 0.2505, test_loss: 1.0716, test_f1: 0.6753
 epoch: 61, train_loss: 0.2712, test_loss: 1.1073, test_f1: 0.6542
 epoch: 62, train_loss: 0.2630, test_loss: 1.0875, test_f1: 0.6796
 epoch: 63, train_loss: 0.2590, test_loss: 1.2386, test_f1: 0.6686
 epoch: 64, train_loss: 0.2531, test_loss: 1.2032, test_f1: 0.6613
 epoch: 65, train_loss: 0.2786, test_loss: 1.0627, test_f1: 0.6386
 epoch: 66, train_loss: 0.2510, test_loss: 1.1619, test_f1: 0.6630
 epoch: 67, train_loss: 0.2427, test_loss: 1.1012, test_f1: 0.6729
 epoch: 68, train_loss: 0.2288, test_loss: 1.2839, test_f1: 0.6555
 epoch: 69, train_loss: 0.2389, test_loss: 1.2041, test_f1: 0.6563
 epoch: 70, train_loss: 0.2322, test_loss: 1.1340, test_f1: 0.6856
 epoch: 71, train_loss: 0.2562, test_loss: 1.2201, test_f1: 0.6498
 epoch: 72, train_loss: 0.2248, test_loss: 1.0293, test_f1: 0.6819
 epoch: 73, train_loss: 0.2391, test_loss: 1.3269, test_f1: 0.6865
 epoch: 74, train_loss: 0.2177, test_loss: 1.2165, test_f1: 0.6712
 epoch: 75, train_loss: 0.2321, test_loss: 1.2094, test_f1: 0.6568
 epoch: 76, train_loss: 0.2467, test_loss: 1.2155, test_f1: 0.6653
 epoch: 77, train_loss: 0.2174, test_loss: 1.1190, test_f1: 0.6681
 epoch: 78, train_loss: 0.2194, test_loss: 1.2653, test_f1: 0.6531
 epoch: 79, train_loss: 0.2183, test_loss: 1.1828, test_f1: 0.6918
 epoch: 80, train_loss: 0.2065, test_loss: 1.2419, test_f1: 0.6786
 epoch: 81, train_loss: 0.2075, test_loss: 1.2666, test_f1: 0.6576
 epoch: 82, train_loss: 0.2331, test_loss: 1.6001, test_f1: 0.6612
 epoch: 83, train_loss: 0.2003, test_loss: 1.2731, test_f1: 0.6616
 epoch: 84, train_loss: 0.1888, test_loss: 1.4537, test_f1: 0.6570
 epoch: 85, train_loss: 0.1954, test_loss: 1.5517, test_f1: 0.6150
 epoch: 86, train_loss: 0.1977, test_loss: 1.3987, test_f1: 0.6866
 epoch: 87, train_loss: 0.2157, test_loss: 1.3639, test_f1: 0.6378
 epoch: 88, train_loss: 0.1957, test_loss: 1.3839, test_f1: 0.6262
 epoch: 89, train_loss: 0.2121, test_loss: 1.3340, test_f1: 0.6381
 epoch: 90, train_loss: 0.1997, test_loss: 1.5684, test_f1: 0.6383
 epoch: 91, train_loss: 0.1965, test_loss: 1.2440, test_f1: 0.6813
 epoch: 92, train_loss: 0.1954, test_loss: 1.4806, test_f1: 0.6442
 epoch: 93, train_loss: 0.1939, test_loss: 1.3970, test_f1: 0.6090
 epoch: 94, train_loss: 0.1927, test_loss: 1.4743, test_f1: 0.6438
 epoch: 95, train_loss: 0.2097, test_loss: 1.4905, test_f1: 0.6327
 epoch: 96, train_loss: 0.1898, test_loss: 1.4045, test_f1: 0.6572
 epoch: 97, train_loss: 0.1915, test_loss: 1.4779, test_f1: 0.6633
 epoch: 98, train_loss: 0.1764, test_loss: 1.5350, test_f1: 0.6485
 epoch: 99, train_loss: 0.1722, test_loss: 1.5561, test_f1: 0.6667
##################ITERATION #9 ****************************************
 epoch: 0, train_loss: 1.5801, test_loss: 1.3054, test_f1: 0.2441
 epoch: 1, train_loss: 1.0126, test_loss: 1.0317, test_f1: 0.3439
 epoch: 2, train_loss: 0.9553, test_loss: 0.9732, test_f1: 0.4928
 epoch: 3, train_loss: 0.9159, test_loss: 0.9198, test_f1: 0.5287
 epoch: 4, train_loss: 0.8697, test_loss: 0.8998, test_f1: 0.5435
 epoch: 5, train_loss: 0.8381, test_loss: 0.9398, test_f1: 0.5365
 epoch: 6, train_loss: 0.8094, test_loss: 0.8556, test_f1: 0.6022
 epoch: 7, train_loss: 0.8011, test_loss: 0.8956, test_f1: 0.5506
 epoch: 8, train_loss: 0.7733, test_loss: 0.8852, test_f1: 0.5442
 epoch: 9, train_loss: 0.7507, test_loss: 0.8646, test_f1: 0.5315
 epoch: 10, train_loss: 0.7280, test_loss: 0.8349, test_f1: 0.6265
 epoch: 11, train_loss: 0.7130, test_loss: 0.8959, test_f1: 0.5928
 epoch: 12, train_loss: 0.7274, test_loss: 1.2990, test_f1: 0.5011
 epoch: 13, train_loss: 0.6665, test_loss: 0.8189, test_f1: 0.6442
 epoch: 14, train_loss: 0.6441, test_loss: 0.8535, test_f1: 0.6095
 epoch: 15, train_loss: 0.6545, test_loss: 0.8952, test_f1: 0.5809
 epoch: 16, train_loss: 0.6383, test_loss: 0.8711, test_f1: 0.6051
 epoch: 17, train_loss: 0.6110, test_loss: 0.8755, test_f1: 0.6051
 epoch: 18, train_loss: 0.6225, test_loss: 0.7660, test_f1: 0.6590
 epoch: 19, train_loss: 0.6070, test_loss: 0.8643, test_f1: 0.5950
 epoch: 20, train_loss: 0.5879, test_loss: 0.8279, test_f1: 0.6238
 epoch: 21, train_loss: 0.5806, test_loss: 0.7719, test_f1: 0.6373
 epoch: 22, train_loss: 0.5696, test_loss: 0.9172, test_f1: 0.6285
 epoch: 23, train_loss: 0.5652, test_loss: 0.9056, test_f1: 0.6185
 epoch: 24, train_loss: 0.5564, test_loss: 0.8982, test_f1: 0.6077
 epoch: 25, train_loss: 0.5542, test_loss: 0.8917, test_f1: 0.6413
 epoch: 26, train_loss: 0.5266, test_loss: 0.9279, test_f1: 0.6393
 epoch: 27, train_loss: 0.5369, test_loss: 0.8295, test_f1: 0.6591
 epoch: 28, train_loss: 0.5169, test_loss: 1.0243, test_f1: 0.5861
 epoch: 29, train_loss: 0.5051, test_loss: 0.9185, test_f1: 0.6296
 epoch: 30, train_loss: 0.4964, test_loss: 0.7944, test_f1: 0.6753
 epoch: 31, train_loss: 0.4773, test_loss: 0.8188, test_f1: 0.6682
 epoch: 32, train_loss: 0.4795, test_loss: 0.9320, test_f1: 0.6505
 epoch: 33, train_loss: 0.4752, test_loss: 0.9522, test_f1: 0.6632
 epoch: 34, train_loss: 0.4697, test_loss: 0.8469, test_f1: 0.6449
 epoch: 35, train_loss: 0.4671, test_loss: 0.8376, test_f1: 0.6320
 epoch: 36, train_loss: 0.4436, test_loss: 0.8071, test_f1: 0.6932
 epoch: 37, train_loss: 0.4596, test_loss: 0.8653, test_f1: 0.6362
 epoch: 38, train_loss: 0.4446, test_loss: 0.7761, test_f1: 0.6845
 epoch: 39, train_loss: 0.4579, test_loss: 1.0286, test_f1: 0.6239
 epoch: 40, train_loss: 0.4468, test_loss: 0.9440, test_f1: 0.6428
 epoch: 41, train_loss: 0.4439, test_loss: 0.9603, test_f1: 0.6282
 epoch: 42, train_loss: 0.4165, test_loss: 0.8171, test_f1: 0.6813
 epoch: 43, train_loss: 0.4392, test_loss: 0.8279, test_f1: 0.6731
 epoch: 44, train_loss: 0.4156, test_loss: 0.9368, test_f1: 0.6677
 epoch: 45, train_loss: 0.4086, test_loss: 0.8759, test_f1: 0.6900
 epoch: 46, train_loss: 0.3912, test_loss: 0.9357, test_f1: 0.6701
 epoch: 47, train_loss: 0.3925, test_loss: 0.8961, test_f1: 0.6955
 epoch: 48, train_loss: 0.3950, test_loss: 0.9523, test_f1: 0.6513
 epoch: 49, train_loss: 0.3687, test_loss: 1.0130, test_f1: 0.6348
 epoch: 50, train_loss: 0.3570, test_loss: 0.9494, test_f1: 0.7001
 epoch: 51, train_loss: 0.3335, test_loss: 0.9231, test_f1: 0.6976
 epoch: 52, train_loss: 0.2893, test_loss: 0.9140, test_f1: 0.6974
 epoch: 53, train_loss: 0.2901, test_loss: 0.9266, test_f1: 0.6825
 epoch: 54, train_loss: 0.2939, test_loss: 1.0336, test_f1: 0.6676
 epoch: 55, train_loss: 0.2951, test_loss: 0.9300, test_f1: 0.7035
 epoch: 56, train_loss: 0.3019, test_loss: 1.0021, test_f1: 0.6971
 epoch: 57, train_loss: 0.2719, test_loss: 0.9715, test_f1: 0.6840
 epoch: 58, train_loss: 0.2844, test_loss: 0.9538, test_f1: 0.7060
 epoch: 59, train_loss: 0.3069, test_loss: 0.9702, test_f1: 0.7103
 epoch: 60, train_loss: 0.2843, test_loss: 1.0622, test_f1: 0.6801
 epoch: 61, train_loss: 0.2653, test_loss: 0.9647, test_f1: 0.6859
 epoch: 62, train_loss: 0.2509, test_loss: 1.0490, test_f1: 0.6845
 epoch: 63, train_loss: 0.2567, test_loss: 0.9850, test_f1: 0.6904
 epoch: 64, train_loss: 0.2505, test_loss: 1.0632, test_f1: 0.7019
 epoch: 65, train_loss: 0.2518, test_loss: 1.0338, test_f1: 0.7321
 epoch: 66, train_loss: 0.2572, test_loss: 0.9503, test_f1: 0.6928
 epoch: 67, train_loss: 0.2384, test_loss: 1.0819, test_f1: 0.6930
 epoch: 68, train_loss: 0.2350, test_loss: 1.0230, test_f1: 0.6955
 epoch: 69, train_loss: 0.2317, test_loss: 1.1208, test_f1: 0.6657
 epoch: 70, train_loss: 0.2344, test_loss: 1.0640, test_f1: 0.6813
 epoch: 71, train_loss: 0.2378, test_loss: 1.0754, test_f1: 0.6805
 epoch: 72, train_loss: 0.2662, test_loss: 1.0778, test_f1: 0.6851
 epoch: 73, train_loss: 0.2242, test_loss: 1.0061, test_f1: 0.7299
 epoch: 74, train_loss: 0.2335, test_loss: 1.1873, test_f1: 0.6614
 epoch: 75, train_loss: 0.2276, test_loss: 1.0908, test_f1: 0.6854
 epoch: 76, train_loss: 0.2193, test_loss: 1.1927, test_f1: 0.6732
 epoch: 77, train_loss: 0.2364, test_loss: 1.1586, test_f1: 0.6829
 epoch: 78, train_loss: 0.2176, test_loss: 1.0934, test_f1: 0.7103
 epoch: 79, train_loss: 0.2185, test_loss: 1.0690, test_f1: 0.7020
 epoch: 80, train_loss: 0.2020, test_loss: 1.1088, test_f1: 0.6977
 epoch: 81, train_loss: 0.2097, test_loss: 1.1754, test_f1: 0.6719
 epoch: 82, train_loss: 0.2031, test_loss: 1.1282, test_f1: 0.6749
 epoch: 83, train_loss: 0.1987, test_loss: 1.2041, test_f1: 0.6865
 epoch: 84, train_loss: 0.1988, test_loss: 1.1728, test_f1: 0.6830
 epoch: 85, train_loss: 0.2010, test_loss: 1.2009, test_f1: 0.6817
 epoch: 86, train_loss: 0.1906, test_loss: 1.1817, test_f1: 0.7015
 epoch: 87, train_loss: 0.1922, test_loss: 1.2072, test_f1: 0.6913
 epoch: 88, train_loss: 0.2080, test_loss: 1.3413, test_f1: 0.6805
 epoch: 89, train_loss: 0.1949, test_loss: 1.3220, test_f1: 0.6787
 epoch: 90, train_loss: 0.1746, test_loss: 1.2628, test_f1: 0.6813
 epoch: 91, train_loss: 0.1858, test_loss: 1.3456, test_f1: 0.6883
 epoch: 92, train_loss: 0.2144, test_loss: 1.0815, test_f1: 0.7040
 epoch: 93, train_loss: 0.1985, test_loss: 1.2355, test_f1: 0.7022
 epoch: 94, train_loss: 0.1873, test_loss: 1.2531, test_f1: 0.6942
 epoch: 95, train_loss: 0.1753, test_loss: 1.2405, test_f1: 0.6815
 epoch: 96, train_loss: 0.1725, test_loss: 1.2063, test_f1: 0.6909
 epoch: 97, train_loss: 0.1682, test_loss: 1.3979, test_f1: 0.6530
 epoch: 98, train_loss: 0.1756, test_loss: 1.4038, test_f1: 0.6838
 epoch: 99, train_loss: 0.1714, test_loss: 1.3337, test_f1: 0.6714

Training completed in 930.32 seconds
Best F1: 0.7321 at epoch 65
Mean F1 across iterations: 0.6996  0.0157
========================FINAL RESULTS================================
FEGIN weighted F1: 0.7321  0.0157
python main.py --data ltspice_examples --representation component_pin --model FEGIN --layers 2 --hiddens 128 --batch_size 128 --lr 0.001 --emb_size 250 --epochs 100 --save_appendix component_pin_L2_H128_BS128_LR0.001_E250 --no_val
-----



STDERR:
  File "main.py", line 370, in <module>
    main()
  File "main.py", line 254, in main
    dataset = dataset_class(
  File "/home/philip/projects/llm_inference_code_repo/Circuit-Completion-Using-GNNs/component_classification_with_link_prediction_head/evaluation/FEGIN/kernel/circuit_datasets.py", line 15, in __init__
    self.data, self.slices = torch.load(self.processed_paths[0])
  File "/home/philip/.local/lib/python3.8/site-packages/torch/serialization.py", line 1040, in load
    warnings.warn(
  File "/usr/lib/python3.8/warnings.py", line 109, in _showwarnmsg
    sw(msg.message, msg.category, msg.filename, msg.lineno,
  File "main.py", line 47, in warn_with_traceback
    traceback.print_stack(file=log)
/home/philip/projects/llm_inference_code_repo/Circuit-Completion-Using-GNNs/component_classification_with_link_prediction_head/evaluation/FEGIN/kernel/circuit_datasets.py:15: FutureWarning: You are using `torch.load` with `weights_only=False` (the current default value), which uses the default pickle module implicitly. It is possible to construct malicious pickle data which will execute arbitrary code during unpickling (See https://github.com/pytorch/pytorch/blob/main/SECURITY.md#untrusted-models for more details). In a future release, the default value for `weights_only` will be flipped to `True`. This limits the functions that could be executed during unpickling. Arbitrary objects will no longer be allowed to be loaded via this mode unless they are explicitly allowlisted by the user via `torch.serialization.add_safe_globals`. We recommend you start setting `weights_only=True` for any use case where you don't have full control of the loaded file. Please open an issue on GitHub for any issues related to this experimental feature.
  self.data, self.slices = torch.load(self.processed_paths[0])
