STDOUT:
Results will be saved in /home/philip/projects/ltspice_examples_code_repo/Circuit-Completion-Using-GNNs/component_classification_with_link_prediction_head/evaluation/FEGIN/results/model_FEGIN_dataset_ltspice_demos
Command line input: python main.py --data ltspice_demos --representation component_net --model FEGIN --layers 6 --hiddens 128 --batch_size 256 --lr 0.0001 --emb_size 512 --epochs 100 --save_appendix component_net_L6_H128_BS256_LR0.0001_E512 --no_val
 is saved.
-----
ltspice_demos - FEGIN
Using 6 layers, 128 hidden units, h = 2
Loading component_net representation dataset
ENTERED
Training FEGIN on component_net representation
Train: 1565, Test: 383
##################ITERATION #0 ****************************************
 epoch: 0, train_loss: 1.3740, test_loss: 1.3732, test_f1: 0.2281
 epoch: 1, train_loss: 1.3584, test_loss: 1.3722, test_f1: 0.2281
 epoch: 2, train_loss: 1.3494, test_loss: 1.3702, test_f1: 0.2281
 epoch: 3, train_loss: 1.3388, test_loss: 1.3670, test_f1: 0.2281
 epoch: 4, train_loss: 1.3286, test_loss: 1.3619, test_f1: 0.2281
 epoch: 5, train_loss: 1.3141, test_loss: 1.3552, test_f1: 0.2281
 epoch: 6, train_loss: 1.2998, test_loss: 1.3478, test_f1: 0.2281
 epoch: 7, train_loss: 1.2844, test_loss: 1.3361, test_f1: 0.2281
 epoch: 8, train_loss: 1.2650, test_loss: 1.3202, test_f1: 0.2281
 epoch: 9, train_loss: 1.2463, test_loss: 1.2982, test_f1: 0.2281
 epoch: 10, train_loss: 1.2239, test_loss: 1.2776, test_f1: 0.2527
 epoch: 11, train_loss: 1.2040, test_loss: 1.2536, test_f1: 0.2687
 epoch: 12, train_loss: 1.1840, test_loss: 1.2307, test_f1: 0.2574
 epoch: 13, train_loss: 1.1678, test_loss: 1.2146, test_f1: 0.2793
 epoch: 14, train_loss: 1.1516, test_loss: 1.1988, test_f1: 0.2793
 epoch: 15, train_loss: 1.1387, test_loss: 1.1901, test_f1: 0.2793
 epoch: 16, train_loss: 1.1330, test_loss: 1.1797, test_f1: 0.2793
 epoch: 17, train_loss: 1.1177, test_loss: 1.1733, test_f1: 0.3404
 epoch: 18, train_loss: 1.1124, test_loss: 1.1679, test_f1: 0.3354
 epoch: 19, train_loss: 1.1013, test_loss: 1.1623, test_f1: 0.3387
 epoch: 20, train_loss: 1.0941, test_loss: 1.1523, test_f1: 0.3354
 epoch: 21, train_loss: 1.0869, test_loss: 1.1431, test_f1: 0.3551
 epoch: 22, train_loss: 1.0813, test_loss: 1.1474, test_f1: 0.3525
 epoch: 23, train_loss: 1.0753, test_loss: 1.1392, test_f1: 0.3545
 epoch: 24, train_loss: 1.0676, test_loss: 1.1246, test_f1: 0.3563
 epoch: 25, train_loss: 1.0603, test_loss: 1.1331, test_f1: 0.4018
 epoch: 26, train_loss: 1.0583, test_loss: 1.1212, test_f1: 0.4384
 epoch: 27, train_loss: 1.0510, test_loss: 1.1114, test_f1: 0.4709
 epoch: 28, train_loss: 1.0424, test_loss: 1.1121, test_f1: 0.4867
 epoch: 29, train_loss: 1.0342, test_loss: 1.1121, test_f1: 0.5000
 epoch: 30, train_loss: 1.0254, test_loss: 1.1109, test_f1: 0.5276
 epoch: 31, train_loss: 1.0225, test_loss: 1.1051, test_f1: 0.5080
 epoch: 32, train_loss: 1.0131, test_loss: 1.0875, test_f1: 0.5224
 epoch: 33, train_loss: 0.9994, test_loss: 1.0786, test_f1: 0.5255
 epoch: 34, train_loss: 0.9968, test_loss: 1.0610, test_f1: 0.5406
 epoch: 35, train_loss: 0.9862, test_loss: 1.0805, test_f1: 0.5349
 epoch: 36, train_loss: 0.9840, test_loss: 1.0681, test_f1: 0.5220
 epoch: 37, train_loss: 0.9642, test_loss: 1.0563, test_f1: 0.5360
 epoch: 38, train_loss: 0.9543, test_loss: 1.0502, test_f1: 0.5362
 epoch: 39, train_loss: 0.9547, test_loss: 1.0390, test_f1: 0.5454
 epoch: 40, train_loss: 0.9382, test_loss: 1.0165, test_f1: 0.5386
 epoch: 41, train_loss: 0.9300, test_loss: 1.0601, test_f1: 0.5429
 epoch: 42, train_loss: 0.9190, test_loss: 1.0181, test_f1: 0.5402
 epoch: 43, train_loss: 0.9056, test_loss: 1.0139, test_f1: 0.5600
 epoch: 44, train_loss: 0.8985, test_loss: 1.0081, test_f1: 0.5463
 epoch: 45, train_loss: 0.8873, test_loss: 0.9916, test_f1: 0.5523
 epoch: 46, train_loss: 0.8763, test_loss: 0.9969, test_f1: 0.5593
 epoch: 47, train_loss: 0.8623, test_loss: 0.9779, test_f1: 0.5618
 epoch: 48, train_loss: 0.8658, test_loss: 0.9843, test_f1: 0.5727
 epoch: 49, train_loss: 0.8616, test_loss: 1.0034, test_f1: 0.5799
 epoch: 50, train_loss: 0.8536, test_loss: 0.9909, test_f1: 0.5711
 epoch: 51, train_loss: 0.8504, test_loss: 0.9842, test_f1: 0.5678
 epoch: 52, train_loss: 0.8379, test_loss: 1.0204, test_f1: 0.5535
 epoch: 53, train_loss: 0.8357, test_loss: 1.0206, test_f1: 0.5555
 epoch: 54, train_loss: 0.8272, test_loss: 1.0096, test_f1: 0.5580
 epoch: 55, train_loss: 0.8197, test_loss: 1.0047, test_f1: 0.5561
 epoch: 56, train_loss: 0.8164, test_loss: 1.0323, test_f1: 0.5634
 epoch: 57, train_loss: 0.8133, test_loss: 1.0099, test_f1: 0.5651
 epoch: 58, train_loss: 0.7998, test_loss: 1.0216, test_f1: 0.5613
 epoch: 59, train_loss: 0.8051, test_loss: 1.0168, test_f1: 0.5624
 epoch: 60, train_loss: 0.8016, test_loss: 1.0490, test_f1: 0.5479
 epoch: 61, train_loss: 0.8013, test_loss: 1.0027, test_f1: 0.5515
 epoch: 62, train_loss: 0.7924, test_loss: 1.0204, test_f1: 0.5608
 epoch: 63, train_loss: 0.7892, test_loss: 0.9960, test_f1: 0.5796
 epoch: 64, train_loss: 0.7777, test_loss: 1.0188, test_f1: 0.5638
 epoch: 65, train_loss: 0.7765, test_loss: 1.0594, test_f1: 0.5517
 epoch: 66, train_loss: 0.7908, test_loss: 1.0462, test_f1: 0.5566
 epoch: 67, train_loss: 0.7775, test_loss: 1.0409, test_f1: 0.5604
 epoch: 68, train_loss: 0.7653, test_loss: 1.0124, test_f1: 0.5716
 epoch: 69, train_loss: 0.7664, test_loss: 1.0143, test_f1: 0.5564
 epoch: 70, train_loss: 0.7645, test_loss: 1.0136, test_f1: 0.5522
 epoch: 71, train_loss: 0.7697, test_loss: 1.0415, test_f1: 0.5744
 epoch: 72, train_loss: 0.7751, test_loss: 1.0287, test_f1: 0.5771
 epoch: 73, train_loss: 0.7658, test_loss: 1.0220, test_f1: 0.5778
 epoch: 74, train_loss: 0.7542, test_loss: 1.0496, test_f1: 0.5575
 epoch: 75, train_loss: 0.7485, test_loss: 1.0273, test_f1: 0.5682
 epoch: 76, train_loss: 0.7484, test_loss: 0.9979, test_f1: 0.5820
 epoch: 77, train_loss: 0.7445, test_loss: 1.0281, test_f1: 0.5632
 epoch: 78, train_loss: 0.7425, test_loss: 1.0616, test_f1: 0.5629
 epoch: 79, train_loss: 0.7365, test_loss: 1.0539, test_f1: 0.5696
 epoch: 80, train_loss: 0.7355, test_loss: 1.0283, test_f1: 0.5925
 epoch: 81, train_loss: 0.7340, test_loss: 1.0430, test_f1: 0.5880
 epoch: 82, train_loss: 0.7426, test_loss: 1.0920, test_f1: 0.5487
 epoch: 83, train_loss: 0.7430, test_loss: 1.0952, test_f1: 0.5705
 epoch: 84, train_loss: 0.7323, test_loss: 1.0251, test_f1: 0.5841
 epoch: 85, train_loss: 0.7354, test_loss: 1.0611, test_f1: 0.5767
 epoch: 86, train_loss: 0.7330, test_loss: 1.0870, test_f1: 0.5584
 epoch: 87, train_loss: 0.7284, test_loss: 1.0701, test_f1: 0.5709
 epoch: 88, train_loss: 0.7277, test_loss: 1.0666, test_f1: 0.5575
 epoch: 89, train_loss: 0.7297, test_loss: 1.0407, test_f1: 0.5734
 epoch: 90, train_loss: 0.7216, test_loss: 1.0549, test_f1: 0.5674
 epoch: 91, train_loss: 0.7306, test_loss: 1.0682, test_f1: 0.5737
 epoch: 92, train_loss: 0.7138, test_loss: 1.0818, test_f1: 0.5695
 epoch: 93, train_loss: 0.7122, test_loss: 1.0677, test_f1: 0.5660
 epoch: 94, train_loss: 0.6972, test_loss: 1.0651, test_f1: 0.5729
 epoch: 95, train_loss: 0.7069, test_loss: 1.0682, test_f1: 0.5591
 epoch: 96, train_loss: 0.7006, test_loss: 1.0920, test_f1: 0.5826
 epoch: 97, train_loss: 0.7074, test_loss: 1.0914, test_f1: 0.5702
 epoch: 98, train_loss: 0.7011, test_loss: 1.0907, test_f1: 0.5637
 epoch: 99, train_loss: 0.7040, test_loss: 1.0939, test_f1: 0.5562
##################ITERATION #1 ****************************************
 epoch: 0, train_loss: 1.3263, test_loss: 1.3644, test_f1: 0.2281
 epoch: 1, train_loss: 1.2792, test_loss: 1.3596, test_f1: 0.2281
 epoch: 2, train_loss: 1.2565, test_loss: 1.3527, test_f1: 0.2281
 epoch: 3, train_loss: 1.2335, test_loss: 1.3428, test_f1: 0.2281
 epoch: 4, train_loss: 1.2095, test_loss: 1.3316, test_f1: 0.2281
 epoch: 5, train_loss: 1.1941, test_loss: 1.3197, test_f1: 0.2651
 epoch: 6, train_loss: 1.1734, test_loss: 1.3020, test_f1: 0.2583
 epoch: 7, train_loss: 1.1569, test_loss: 1.2830, test_f1: 0.2478
 epoch: 8, train_loss: 1.1409, test_loss: 1.2613, test_f1: 0.2686
 epoch: 9, train_loss: 1.1287, test_loss: 1.2444, test_f1: 0.2680
 epoch: 10, train_loss: 1.1172, test_loss: 1.2239, test_f1: 0.2958
 epoch: 11, train_loss: 1.1068, test_loss: 1.1987, test_f1: 0.3972
 epoch: 12, train_loss: 1.0921, test_loss: 1.1783, test_f1: 0.4338
 epoch: 13, train_loss: 1.0801, test_loss: 1.1608, test_f1: 0.4782
 epoch: 14, train_loss: 1.0784, test_loss: 1.1460, test_f1: 0.4932
 epoch: 15, train_loss: 1.0690, test_loss: 1.1359, test_f1: 0.4928
 epoch: 16, train_loss: 1.0556, test_loss: 1.1256, test_f1: 0.4959
 epoch: 17, train_loss: 1.0443, test_loss: 1.1182, test_f1: 0.4900
 epoch: 18, train_loss: 1.0354, test_loss: 1.1063, test_f1: 0.5112
 epoch: 19, train_loss: 1.0278, test_loss: 1.0937, test_f1: 0.5044
 epoch: 20, train_loss: 1.0154, test_loss: 1.0908, test_f1: 0.5039
 epoch: 21, train_loss: 1.0106, test_loss: 1.0866, test_f1: 0.5051
 epoch: 22, train_loss: 1.0078, test_loss: 1.0816, test_f1: 0.5224
 epoch: 23, train_loss: 0.9911, test_loss: 1.0668, test_f1: 0.5261
 epoch: 24, train_loss: 0.9850, test_loss: 1.0603, test_f1: 0.5324
 epoch: 25, train_loss: 0.9792, test_loss: 1.0515, test_f1: 0.5374
 epoch: 26, train_loss: 0.9645, test_loss: 1.0510, test_f1: 0.5510
 epoch: 27, train_loss: 0.9488, test_loss: 1.0501, test_f1: 0.5485
 epoch: 28, train_loss: 0.9452, test_loss: 1.0477, test_f1: 0.5560
 epoch: 29, train_loss: 0.9416, test_loss: 1.0457, test_f1: 0.5309
 epoch: 30, train_loss: 0.9369, test_loss: 1.0326, test_f1: 0.5522
 epoch: 31, train_loss: 0.9279, test_loss: 1.0356, test_f1: 0.5567
 epoch: 32, train_loss: 0.9192, test_loss: 1.0344, test_f1: 0.5658
 epoch: 33, train_loss: 0.9135, test_loss: 1.0370, test_f1: 0.5676
 epoch: 34, train_loss: 0.9081, test_loss: 1.0124, test_f1: 0.5629
 epoch: 35, train_loss: 0.8960, test_loss: 1.0123, test_f1: 0.5615
 epoch: 36, train_loss: 0.8899, test_loss: 1.0150, test_f1: 0.5567
 epoch: 37, train_loss: 0.8861, test_loss: 1.0311, test_f1: 0.5586
 epoch: 38, train_loss: 0.8746, test_loss: 1.0306, test_f1: 0.5509
 epoch: 39, train_loss: 0.8691, test_loss: 1.0287, test_f1: 0.5635
 epoch: 40, train_loss: 0.8571, test_loss: 1.0202, test_f1: 0.5765
 epoch: 41, train_loss: 0.8472, test_loss: 1.0219, test_f1: 0.5618
 epoch: 42, train_loss: 0.8498, test_loss: 1.0301, test_f1: 0.5644
 epoch: 43, train_loss: 0.8429, test_loss: 1.0460, test_f1: 0.5576
 epoch: 44, train_loss: 0.8407, test_loss: 1.0215, test_f1: 0.5740
 epoch: 45, train_loss: 0.8359, test_loss: 1.0340, test_f1: 0.5668
 epoch: 46, train_loss: 0.8188, test_loss: 1.0453, test_f1: 0.5619
 epoch: 47, train_loss: 0.8198, test_loss: 1.0379, test_f1: 0.5573
 epoch: 48, train_loss: 0.8062, test_loss: 1.0482, test_f1: 0.5727
 epoch: 49, train_loss: 0.8029, test_loss: 1.0666, test_f1: 0.5751
 epoch: 50, train_loss: 0.8131, test_loss: 1.0356, test_f1: 0.5943
 epoch: 51, train_loss: 0.8087, test_loss: 1.0558, test_f1: 0.5949
 epoch: 52, train_loss: 0.7989, test_loss: 1.0945, test_f1: 0.5798
 epoch: 53, train_loss: 0.8027, test_loss: 1.0777, test_f1: 0.5734
 epoch: 54, train_loss: 0.7899, test_loss: 1.0665, test_f1: 0.5855
 epoch: 55, train_loss: 0.7919, test_loss: 1.0630, test_f1: 0.5921
 epoch: 56, train_loss: 0.7868, test_loss: 1.0574, test_f1: 0.5981
 epoch: 57, train_loss: 0.7797, test_loss: 1.1070, test_f1: 0.5723
 epoch: 58, train_loss: 0.7895, test_loss: 1.1021, test_f1: 0.5694
 epoch: 59, train_loss: 0.7742, test_loss: 1.1005, test_f1: 0.5609
 epoch: 60, train_loss: 0.7862, test_loss: 1.1266, test_f1: 0.5521
 epoch: 61, train_loss: 0.7805, test_loss: 1.1019, test_f1: 0.5705
 epoch: 62, train_loss: 0.7696, test_loss: 1.1024, test_f1: 0.5825
 epoch: 63, train_loss: 0.7639, test_loss: 1.1292, test_f1: 0.5741
 epoch: 64, train_loss: 0.7691, test_loss: 1.1235, test_f1: 0.5748
 epoch: 65, train_loss: 0.7537, test_loss: 1.1167, test_f1: 0.5852
 epoch: 66, train_loss: 0.7589, test_loss: 1.1287, test_f1: 0.5718
 epoch: 67, train_loss: 0.7631, test_loss: 1.1074, test_f1: 0.5859
 epoch: 68, train_loss: 0.7502, test_loss: 1.1002, test_f1: 0.5852
 epoch: 69, train_loss: 0.7547, test_loss: 1.1422, test_f1: 0.5722
 epoch: 70, train_loss: 0.7483, test_loss: 1.1776, test_f1: 0.5612
 epoch: 71, train_loss: 0.7557, test_loss: 1.1468, test_f1: 0.5720
 epoch: 72, train_loss: 0.7438, test_loss: 1.1182, test_f1: 0.5822
 epoch: 73, train_loss: 0.7449, test_loss: 1.1255, test_f1: 0.5858
 epoch: 74, train_loss: 0.7407, test_loss: 1.1110, test_f1: 0.5824
 epoch: 75, train_loss: 0.7360, test_loss: 1.1501, test_f1: 0.5750
 epoch: 76, train_loss: 0.7367, test_loss: 1.2141, test_f1: 0.5679
 epoch: 77, train_loss: 0.7394, test_loss: 1.1764, test_f1: 0.5724
 epoch: 78, train_loss: 0.7393, test_loss: 1.1910, test_f1: 0.5645
 epoch: 79, train_loss: 0.7357, test_loss: 1.1842, test_f1: 0.5681
 epoch: 80, train_loss: 0.7299, test_loss: 1.1511, test_f1: 0.5734
 epoch: 81, train_loss: 0.7354, test_loss: 1.1644, test_f1: 0.5679
 epoch: 82, train_loss: 0.7241, test_loss: 1.1613, test_f1: 0.5679
 epoch: 83, train_loss: 0.7239, test_loss: 1.1572, test_f1: 0.5702
 epoch: 84, train_loss: 0.7167, test_loss: 1.1717, test_f1: 0.5723
 epoch: 85, train_loss: 0.7255, test_loss: 1.1983, test_f1: 0.5869
 epoch: 86, train_loss: 0.7267, test_loss: 1.1586, test_f1: 0.5895
 epoch: 87, train_loss: 0.7275, test_loss: 1.1787, test_f1: 0.5849
 epoch: 88, train_loss: 0.7229, test_loss: 1.1909, test_f1: 0.5797
 epoch: 89, train_loss: 0.7160, test_loss: 1.1866, test_f1: 0.5749
 epoch: 90, train_loss: 0.7224, test_loss: 1.1846, test_f1: 0.5775
 epoch: 91, train_loss: 0.7087, test_loss: 1.1762, test_f1: 0.5801
 epoch: 92, train_loss: 0.7006, test_loss: 1.1934, test_f1: 0.5587
 epoch: 93, train_loss: 0.7099, test_loss: 1.1916, test_f1: 0.5659
 epoch: 94, train_loss: 0.7055, test_loss: 1.2030, test_f1: 0.5727
 epoch: 95, train_loss: 0.7103, test_loss: 1.1488, test_f1: 0.5781
 epoch: 96, train_loss: 0.7028, test_loss: 1.1308, test_f1: 0.5926
 epoch: 97, train_loss: 0.7060, test_loss: 1.1364, test_f1: 0.5821
 epoch: 98, train_loss: 0.7055, test_loss: 1.1885, test_f1: 0.5672
 epoch: 99, train_loss: 0.6858, test_loss: 1.1889, test_f1: 0.5716
##################ITERATION #2 ****************************************
 epoch: 0, train_loss: 1.2762, test_loss: 1.3482, test_f1: 0.2281
 epoch: 1, train_loss: 1.2210, test_loss: 1.3444, test_f1: 0.2281
 epoch: 2, train_loss: 1.1926, test_loss: 1.3396, test_f1: 0.2281
 epoch: 3, train_loss: 1.1748, test_loss: 1.3288, test_f1: 0.2281
 epoch: 4, train_loss: 1.1526, test_loss: 1.3090, test_f1: 0.2281
 epoch: 5, train_loss: 1.1370, test_loss: 1.2916, test_f1: 0.2281
 epoch: 6, train_loss: 1.1200, test_loss: 1.2789, test_f1: 0.2390
 epoch: 7, train_loss: 1.1099, test_loss: 1.2659, test_f1: 0.2750
 epoch: 8, train_loss: 1.0898, test_loss: 1.2537, test_f1: 0.3322
 epoch: 9, train_loss: 1.0819, test_loss: 1.2328, test_f1: 0.3821
 epoch: 10, train_loss: 1.0637, test_loss: 1.1773, test_f1: 0.3944
 epoch: 11, train_loss: 1.0607, test_loss: 1.1500, test_f1: 0.4134
 epoch: 12, train_loss: 1.0480, test_loss: 1.1309, test_f1: 0.4316
 epoch: 13, train_loss: 1.0350, test_loss: 1.1163, test_f1: 0.4726
 epoch: 14, train_loss: 1.0298, test_loss: 1.1067, test_f1: 0.4766
 epoch: 15, train_loss: 1.0112, test_loss: 1.1063, test_f1: 0.4630
 epoch: 16, train_loss: 1.0007, test_loss: 1.0935, test_f1: 0.4654
 epoch: 17, train_loss: 0.9936, test_loss: 1.0803, test_f1: 0.4760
 epoch: 18, train_loss: 0.9897, test_loss: 1.0806, test_f1: 0.4971
 epoch: 19, train_loss: 0.9757, test_loss: 1.0687, test_f1: 0.5032
 epoch: 20, train_loss: 0.9679, test_loss: 1.0672, test_f1: 0.4943
 epoch: 21, train_loss: 0.9582, test_loss: 1.0732, test_f1: 0.5241
 epoch: 22, train_loss: 0.9548, test_loss: 1.0710, test_f1: 0.5315
 epoch: 23, train_loss: 0.9330, test_loss: 1.0817, test_f1: 0.5248
 epoch: 24, train_loss: 0.9388, test_loss: 1.0723, test_f1: 0.5307
 epoch: 25, train_loss: 0.9256, test_loss: 1.0398, test_f1: 0.5399
 epoch: 26, train_loss: 0.9120, test_loss: 1.0528, test_f1: 0.5346
 epoch: 27, train_loss: 0.9176, test_loss: 1.0471, test_f1: 0.5367
 epoch: 28, train_loss: 0.9088, test_loss: 1.0290, test_f1: 0.5701
 epoch: 29, train_loss: 0.8963, test_loss: 1.0317, test_f1: 0.5553
 epoch: 30, train_loss: 0.8960, test_loss: 1.0433, test_f1: 0.5459
 epoch: 31, train_loss: 0.8919, test_loss: 1.0452, test_f1: 0.5167
 epoch: 32, train_loss: 0.8797, test_loss: 1.0339, test_f1: 0.5700
 epoch: 33, train_loss: 0.8770, test_loss: 1.0439, test_f1: 0.5661
 epoch: 34, train_loss: 0.8715, test_loss: 1.0657, test_f1: 0.5554
 epoch: 35, train_loss: 0.8691, test_loss: 1.0350, test_f1: 0.5620
 epoch: 36, train_loss: 0.8622, test_loss: 1.0352, test_f1: 0.5685
 epoch: 37, train_loss: 0.8616, test_loss: 1.0542, test_f1: 0.5644
 epoch: 38, train_loss: 0.8478, test_loss: 1.0490, test_f1: 0.5719
 epoch: 39, train_loss: 0.8487, test_loss: 1.0876, test_f1: 0.5561
 epoch: 40, train_loss: 0.8438, test_loss: 1.0380, test_f1: 0.5843
 epoch: 41, train_loss: 0.8348, test_loss: 1.0488, test_f1: 0.5803
 epoch: 42, train_loss: 0.8238, test_loss: 1.0900, test_f1: 0.5730
 epoch: 43, train_loss: 0.8316, test_loss: 1.0940, test_f1: 0.5681
 epoch: 44, train_loss: 0.8258, test_loss: 1.0832, test_f1: 0.5608
 epoch: 45, train_loss: 0.8178, test_loss: 1.0727, test_f1: 0.5882
 epoch: 46, train_loss: 0.8126, test_loss: 1.0641, test_f1: 0.5767
 epoch: 47, train_loss: 0.8123, test_loss: 1.0749, test_f1: 0.5839
 epoch: 48, train_loss: 0.8076, test_loss: 1.0546, test_f1: 0.5865
 epoch: 49, train_loss: 0.7973, test_loss: 1.0809, test_f1: 0.5694
 epoch: 50, train_loss: 0.8099, test_loss: 1.1032, test_f1: 0.5925
 epoch: 51, train_loss: 0.7992, test_loss: 1.1473, test_f1: 0.5870
 epoch: 52, train_loss: 0.7863, test_loss: 1.1215, test_f1: 0.5701
 epoch: 53, train_loss: 0.7947, test_loss: 1.1088, test_f1: 0.5762
 epoch: 54, train_loss: 0.7793, test_loss: 1.0962, test_f1: 0.5590
 epoch: 55, train_loss: 0.7816, test_loss: 1.1131, test_f1: 0.5773
 epoch: 56, train_loss: 0.7747, test_loss: 1.0871, test_f1: 0.5795
 epoch: 57, train_loss: 0.7780, test_loss: 1.0973, test_f1: 0.5725
 epoch: 58, train_loss: 0.7763, test_loss: 1.1258, test_f1: 0.5673
 epoch: 59, train_loss: 0.7678, test_loss: 1.1203, test_f1: 0.5733
 epoch: 60, train_loss: 0.7692, test_loss: 1.1197, test_f1: 0.5795
 epoch: 61, train_loss: 0.7627, test_loss: 1.1021, test_f1: 0.5983
 epoch: 62, train_loss: 0.7692, test_loss: 1.1176, test_f1: 0.6054
 epoch: 63, train_loss: 0.7642, test_loss: 1.1277, test_f1: 0.6022
 epoch: 64, train_loss: 0.7562, test_loss: 1.1575, test_f1: 0.5798
 epoch: 65, train_loss: 0.7496, test_loss: 1.1810, test_f1: 0.5903
 epoch: 66, train_loss: 0.7525, test_loss: 1.1617, test_f1: 0.5816
 epoch: 67, train_loss: 0.7422, test_loss: 1.1368, test_f1: 0.5967
 epoch: 68, train_loss: 0.7491, test_loss: 1.1493, test_f1: 0.6109
 epoch: 69, train_loss: 0.7402, test_loss: 1.1446, test_f1: 0.5885
 epoch: 70, train_loss: 0.7326, test_loss: 1.1656, test_f1: 0.6054
 epoch: 71, train_loss: 0.7461, test_loss: 1.1746, test_f1: 0.5990
 epoch: 72, train_loss: 0.7354, test_loss: 1.1933, test_f1: 0.5926
 epoch: 73, train_loss: 0.7316, test_loss: 1.1725, test_f1: 0.5845
 epoch: 74, train_loss: 0.7340, test_loss: 1.1398, test_f1: 0.5965
 epoch: 75, train_loss: 0.7356, test_loss: 1.1684, test_f1: 0.6052
 epoch: 76, train_loss: 0.7369, test_loss: 1.1756, test_f1: 0.5990
 epoch: 77, train_loss: 0.7218, test_loss: 1.1778, test_f1: 0.6045
 epoch: 78, train_loss: 0.7153, test_loss: 1.1973, test_f1: 0.5959
 epoch: 79, train_loss: 0.7270, test_loss: 1.1810, test_f1: 0.5919
 epoch: 80, train_loss: 0.7226, test_loss: 1.1825, test_f1: 0.6081
 epoch: 81, train_loss: 0.7122, test_loss: 1.1834, test_f1: 0.6120
 epoch: 82, train_loss: 0.7111, test_loss: 1.2028, test_f1: 0.6041
 epoch: 83, train_loss: 0.7123, test_loss: 1.2024, test_f1: 0.6057
 epoch: 84, train_loss: 0.7199, test_loss: 1.1686, test_f1: 0.5919
 epoch: 85, train_loss: 0.7069, test_loss: 1.1805, test_f1: 0.5875
 epoch: 86, train_loss: 0.7076, test_loss: 1.1700, test_f1: 0.5993
 epoch: 87, train_loss: 0.7015, test_loss: 1.1672, test_f1: 0.5925
 epoch: 88, train_loss: 0.7025, test_loss: 1.2227, test_f1: 0.5803
 epoch: 89, train_loss: 0.7029, test_loss: 1.2573, test_f1: 0.5903
 epoch: 90, train_loss: 0.7059, test_loss: 1.2550, test_f1: 0.5858
 epoch: 91, train_loss: 0.6968, test_loss: 1.1748, test_f1: 0.5996
 epoch: 92, train_loss: 0.6941, test_loss: 1.1769, test_f1: 0.5849
 epoch: 93, train_loss: 0.6912, test_loss: 1.2111, test_f1: 0.5794
 epoch: 94, train_loss: 0.6885, test_loss: 1.2145, test_f1: 0.5954
 epoch: 95, train_loss: 0.7029, test_loss: 1.2348, test_f1: 0.6164
 epoch: 96, train_loss: 0.6881, test_loss: 1.1911, test_f1: 0.6063
 epoch: 97, train_loss: 0.6811, test_loss: 1.1798, test_f1: 0.5840
 epoch: 98, train_loss: 0.6815, test_loss: 1.1870, test_f1: 0.5763
 epoch: 99, train_loss: 0.6679, test_loss: 1.2275, test_f1: 0.5868
##################ITERATION #3 ****************************************
 epoch: 0, train_loss: 1.2701, test_loss: 1.3461, test_f1: 0.2281
 epoch: 1, train_loss: 1.1915, test_loss: 1.3397, test_f1: 0.2281
 epoch: 2, train_loss: 1.1665, test_loss: 1.3345, test_f1: 0.2281
 epoch: 3, train_loss: 1.1345, test_loss: 1.3264, test_f1: 0.2281
 epoch: 4, train_loss: 1.1159, test_loss: 1.3029, test_f1: 0.2336
 epoch: 5, train_loss: 1.1015, test_loss: 1.2726, test_f1: 0.2889
 epoch: 6, train_loss: 1.0848, test_loss: 1.2394, test_f1: 0.3144
 epoch: 7, train_loss: 1.0682, test_loss: 1.2088, test_f1: 0.3346
 epoch: 8, train_loss: 1.0582, test_loss: 1.1787, test_f1: 0.3838
 epoch: 9, train_loss: 1.0449, test_loss: 1.1596, test_f1: 0.4423
 epoch: 10, train_loss: 1.0253, test_loss: 1.1505, test_f1: 0.4619
 epoch: 11, train_loss: 1.0173, test_loss: 1.1383, test_f1: 0.4820
 epoch: 12, train_loss: 1.0158, test_loss: 1.1218, test_f1: 0.4855
 epoch: 13, train_loss: 0.9942, test_loss: 1.1217, test_f1: 0.4983
 epoch: 14, train_loss: 0.9837, test_loss: 1.1220, test_f1: 0.5013
 epoch: 15, train_loss: 0.9841, test_loss: 1.1114, test_f1: 0.5305
 epoch: 16, train_loss: 0.9648, test_loss: 1.0991, test_f1: 0.5305
 epoch: 17, train_loss: 0.9549, test_loss: 1.0914, test_f1: 0.5265
 epoch: 18, train_loss: 0.9505, test_loss: 1.0876, test_f1: 0.5181
 epoch: 19, train_loss: 0.9482, test_loss: 1.0930, test_f1: 0.5331
 epoch: 20, train_loss: 0.9335, test_loss: 1.0785, test_f1: 0.5291
 epoch: 21, train_loss: 0.9283, test_loss: 1.0806, test_f1: 0.5345
 epoch: 22, train_loss: 0.9196, test_loss: 1.0718, test_f1: 0.5303
 epoch: 23, train_loss: 0.9126, test_loss: 1.0722, test_f1: 0.5240
 epoch: 24, train_loss: 0.9175, test_loss: 1.0781, test_f1: 0.5073
 epoch: 25, train_loss: 0.9011, test_loss: 1.0892, test_f1: 0.5216
 epoch: 26, train_loss: 0.8998, test_loss: 1.0790, test_f1: 0.5492
 epoch: 27, train_loss: 0.8829, test_loss: 1.0688, test_f1: 0.5414
 epoch: 28, train_loss: 0.8884, test_loss: 1.0526, test_f1: 0.5437
 epoch: 29, train_loss: 0.8700, test_loss: 1.0492, test_f1: 0.5309
 epoch: 30, train_loss: 0.8675, test_loss: 1.0562, test_f1: 0.5562
 epoch: 31, train_loss: 0.8564, test_loss: 1.0500, test_f1: 0.5665
 epoch: 32, train_loss: 0.8643, test_loss: 1.0397, test_f1: 0.5539
 epoch: 33, train_loss: 0.8479, test_loss: 1.0712, test_f1: 0.5537
 epoch: 34, train_loss: 0.8423, test_loss: 1.0620, test_f1: 0.5601
 epoch: 35, train_loss: 0.8464, test_loss: 1.0476, test_f1: 0.5498
 epoch: 36, train_loss: 0.8314, test_loss: 1.0560, test_f1: 0.5613
 epoch: 37, train_loss: 0.8328, test_loss: 1.1018, test_f1: 0.5571
 epoch: 38, train_loss: 0.8316, test_loss: 1.0996, test_f1: 0.5540
 epoch: 39, train_loss: 0.8215, test_loss: 1.0921, test_f1: 0.5610
 epoch: 40, train_loss: 0.8093, test_loss: 1.0725, test_f1: 0.5552
 epoch: 41, train_loss: 0.8056, test_loss: 1.0838, test_f1: 0.5683
 epoch: 42, train_loss: 0.7952, test_loss: 1.0910, test_f1: 0.5680
 epoch: 43, train_loss: 0.8032, test_loss: 1.0952, test_f1: 0.5777
 epoch: 44, train_loss: 0.7972, test_loss: 1.0884, test_f1: 0.5561
 epoch: 45, train_loss: 0.7944, test_loss: 1.0601, test_f1: 0.5458
 epoch: 46, train_loss: 0.7844, test_loss: 1.0924, test_f1: 0.5647
 epoch: 47, train_loss: 0.7764, test_loss: 1.1115, test_f1: 0.5575
 epoch: 48, train_loss: 0.7742, test_loss: 1.1142, test_f1: 0.5670
 epoch: 49, train_loss: 0.7814, test_loss: 1.1237, test_f1: 0.5478
 epoch: 50, train_loss: 0.7746, test_loss: 1.1130, test_f1: 0.5665
 epoch: 51, train_loss: 0.7603, test_loss: 1.1178, test_f1: 0.5651
 epoch: 52, train_loss: 0.7568, test_loss: 1.1325, test_f1: 0.5584
 epoch: 53, train_loss: 0.7533, test_loss: 1.1415, test_f1: 0.5633
 epoch: 54, train_loss: 0.7534, test_loss: 1.1481, test_f1: 0.5624
 epoch: 55, train_loss: 0.7473, test_loss: 1.1552, test_f1: 0.5615
 epoch: 56, train_loss: 0.7510, test_loss: 1.1465, test_f1: 0.5649
 epoch: 57, train_loss: 0.7574, test_loss: 1.1435, test_f1: 0.5543
 epoch: 58, train_loss: 0.7463, test_loss: 1.1781, test_f1: 0.5520
 epoch: 59, train_loss: 0.7380, test_loss: 1.1811, test_f1: 0.5611
 epoch: 60, train_loss: 0.7267, test_loss: 1.1604, test_f1: 0.5638
 epoch: 61, train_loss: 0.7308, test_loss: 1.1458, test_f1: 0.5562
 epoch: 62, train_loss: 0.7226, test_loss: 1.1756, test_f1: 0.5527
 epoch: 63, train_loss: 0.7197, test_loss: 1.1830, test_f1: 0.5644
 epoch: 64, train_loss: 0.7265, test_loss: 1.2078, test_f1: 0.5755
 epoch: 65, train_loss: 0.7202, test_loss: 1.1769, test_f1: 0.5758
 epoch: 66, train_loss: 0.7195, test_loss: 1.1861, test_f1: 0.5580
 epoch: 67, train_loss: 0.7165, test_loss: 1.1897, test_f1: 0.5671
 epoch: 68, train_loss: 0.7187, test_loss: 1.1741, test_f1: 0.5765
 epoch: 69, train_loss: 0.7175, test_loss: 1.1794, test_f1: 0.5756
 epoch: 70, train_loss: 0.7180, test_loss: 1.2073, test_f1: 0.5590
 epoch: 71, train_loss: 0.7073, test_loss: 1.1916, test_f1: 0.5656
 epoch: 72, train_loss: 0.7084, test_loss: 1.2019, test_f1: 0.5735
 epoch: 73, train_loss: 0.6911, test_loss: 1.2188, test_f1: 0.5676
 epoch: 74, train_loss: 0.7067, test_loss: 1.1796, test_f1: 0.5493
 epoch: 75, train_loss: 0.6996, test_loss: 1.1740, test_f1: 0.5579
 epoch: 76, train_loss: 0.6972, test_loss: 1.1818, test_f1: 0.5758
 epoch: 77, train_loss: 0.6862, test_loss: 1.1921, test_f1: 0.5794
 epoch: 78, train_loss: 0.6967, test_loss: 1.1941, test_f1: 0.5639
 epoch: 79, train_loss: 0.7031, test_loss: 1.2198, test_f1: 0.5682
 epoch: 80, train_loss: 0.6945, test_loss: 1.2151, test_f1: 0.5693
 epoch: 81, train_loss: 0.6845, test_loss: 1.2388, test_f1: 0.5476
 epoch: 82, train_loss: 0.6919, test_loss: 1.2970, test_f1: 0.5657
 epoch: 83, train_loss: 0.6860, test_loss: 1.2981, test_f1: 0.5733
 epoch: 84, train_loss: 0.6791, test_loss: 1.2971, test_f1: 0.5559
 epoch: 85, train_loss: 0.6833, test_loss: 1.2819, test_f1: 0.5498
 epoch: 86, train_loss: 0.6963, test_loss: 1.2727, test_f1: 0.5716
 epoch: 87, train_loss: 0.6709, test_loss: 1.2881, test_f1: 0.5694
 epoch: 88, train_loss: 0.6675, test_loss: 1.2846, test_f1: 0.5696
 epoch: 89, train_loss: 0.6652, test_loss: 1.3133, test_f1: 0.5514
 epoch: 90, train_loss: 0.6776, test_loss: 1.3472, test_f1: 0.5564
 epoch: 91, train_loss: 0.6800, test_loss: 1.3385, test_f1: 0.5602
 epoch: 92, train_loss: 0.6663, test_loss: 1.3104, test_f1: 0.5679
 epoch: 93, train_loss: 0.6783, test_loss: 1.3210, test_f1: 0.5686
 epoch: 94, train_loss: 0.6782, test_loss: 1.3526, test_f1: 0.5751
 epoch: 95, train_loss: 0.6613, test_loss: 1.2760, test_f1: 0.5660
 epoch: 96, train_loss: 0.6675, test_loss: 1.2671, test_f1: 0.5713
 epoch: 97, train_loss: 0.6628, test_loss: 1.2362, test_f1: 0.5645
 epoch: 98, train_loss: 0.6618, test_loss: 1.2820, test_f1: 0.5678
 epoch: 99, train_loss: 0.6526, test_loss: 1.3190, test_f1: 0.5680
##################ITERATION #4 ****************************************
 epoch: 0, train_loss: 1.2560, test_loss: 1.3271, test_f1: 0.2281
 epoch: 1, train_loss: 1.1878, test_loss: 1.3198, test_f1: 0.2281
 epoch: 2, train_loss: 1.1599, test_loss: 1.3176, test_f1: 0.2281
 epoch: 3, train_loss: 1.1321, test_loss: 1.3107, test_f1: 0.2281
 epoch: 4, train_loss: 1.1158, test_loss: 1.3009, test_f1: 0.2281
 epoch: 5, train_loss: 1.1064, test_loss: 1.2873, test_f1: 0.2281
 epoch: 6, train_loss: 1.0872, test_loss: 1.2705, test_f1: 0.2593
 epoch: 7, train_loss: 1.0844, test_loss: 1.2567, test_f1: 0.3167
 epoch: 8, train_loss: 1.0651, test_loss: 1.2453, test_f1: 0.3834
 epoch: 9, train_loss: 1.0543, test_loss: 1.2196, test_f1: 0.4130
 epoch: 10, train_loss: 1.0476, test_loss: 1.1938, test_f1: 0.4067
 epoch: 11, train_loss: 1.0377, test_loss: 1.1674, test_f1: 0.4460
 epoch: 12, train_loss: 1.0254, test_loss: 1.1559, test_f1: 0.4438
 epoch: 13, train_loss: 1.0170, test_loss: 1.1310, test_f1: 0.4791
 epoch: 14, train_loss: 1.0087, test_loss: 1.1200, test_f1: 0.5035
 epoch: 15, train_loss: 0.9976, test_loss: 1.1103, test_f1: 0.5027
 epoch: 16, train_loss: 0.9877, test_loss: 1.1115, test_f1: 0.5204
 epoch: 17, train_loss: 0.9818, test_loss: 1.0982, test_f1: 0.5118
 epoch: 18, train_loss: 0.9755, test_loss: 1.0957, test_f1: 0.5094
 epoch: 19, train_loss: 0.9604, test_loss: 1.0971, test_f1: 0.5133
 epoch: 20, train_loss: 0.9510, test_loss: 1.0708, test_f1: 0.5160
 epoch: 21, train_loss: 0.9471, test_loss: 1.0663, test_f1: 0.5156
 epoch: 22, train_loss: 0.9404, test_loss: 1.0648, test_f1: 0.5167
 epoch: 23, train_loss: 0.9320, test_loss: 1.0645, test_f1: 0.5126
 epoch: 24, train_loss: 0.9325, test_loss: 1.0643, test_f1: 0.5328
 epoch: 25, train_loss: 0.9224, test_loss: 1.0475, test_f1: 0.5150
 epoch: 26, train_loss: 0.9269, test_loss: 1.0397, test_f1: 0.5445
 epoch: 27, train_loss: 0.9200, test_loss: 1.0405, test_f1: 0.5484
 epoch: 28, train_loss: 0.9032, test_loss: 1.0366, test_f1: 0.5443
 epoch: 29, train_loss: 0.8928, test_loss: 1.0322, test_f1: 0.5325
 epoch: 30, train_loss: 0.8921, test_loss: 1.0294, test_f1: 0.5283
 epoch: 31, train_loss: 0.8922, test_loss: 1.0464, test_f1: 0.5278
 epoch: 32, train_loss: 0.8758, test_loss: 1.0211, test_f1: 0.5521
 epoch: 33, train_loss: 0.8653, test_loss: 1.0534, test_f1: 0.5283
 epoch: 34, train_loss: 0.8675, test_loss: 1.0497, test_f1: 0.5392
 epoch: 35, train_loss: 0.8591, test_loss: 1.0603, test_f1: 0.5363
 epoch: 36, train_loss: 0.8541, test_loss: 1.0540, test_f1: 0.5475
 epoch: 37, train_loss: 0.8571, test_loss: 1.0283, test_f1: 0.5595
 epoch: 38, train_loss: 0.8526, test_loss: 0.9965, test_f1: 0.5509
 epoch: 39, train_loss: 0.8421, test_loss: 1.0398, test_f1: 0.5402
 epoch: 40, train_loss: 0.8602, test_loss: 1.0351, test_f1: 0.5642
 epoch: 41, train_loss: 0.8352, test_loss: 1.0232, test_f1: 0.5466
 epoch: 42, train_loss: 0.8326, test_loss: 1.0211, test_f1: 0.5541
 epoch: 43, train_loss: 0.8295, test_loss: 1.0208, test_f1: 0.5602
 epoch: 44, train_loss: 0.8256, test_loss: 0.9964, test_f1: 0.5741
 epoch: 45, train_loss: 0.8264, test_loss: 1.0003, test_f1: 0.5634
 epoch: 46, train_loss: 0.8241, test_loss: 1.0316, test_f1: 0.5613
 epoch: 47, train_loss: 0.8196, test_loss: 1.0362, test_f1: 0.5478
 epoch: 48, train_loss: 0.8112, test_loss: 1.0328, test_f1: 0.5581
 epoch: 49, train_loss: 0.7852, test_loss: 1.0163, test_f1: 0.5748
 epoch: 50, train_loss: 0.8038, test_loss: 1.0853, test_f1: 0.5418
 epoch: 51, train_loss: 0.7988, test_loss: 1.0867, test_f1: 0.5416
 epoch: 52, train_loss: 0.7921, test_loss: 1.0502, test_f1: 0.5659
 epoch: 53, train_loss: 0.7788, test_loss: 1.0301, test_f1: 0.5800
 epoch: 54, train_loss: 0.7686, test_loss: 1.0382, test_f1: 0.5769
 epoch: 55, train_loss: 0.7774, test_loss: 1.0736, test_f1: 0.5662
 epoch: 56, train_loss: 0.7754, test_loss: 1.0359, test_f1: 0.5745
 epoch: 57, train_loss: 0.7786, test_loss: 1.0616, test_f1: 0.5658
 epoch: 58, train_loss: 0.7764, test_loss: 1.1118, test_f1: 0.5502
 epoch: 59, train_loss: 0.7684, test_loss: 1.0944, test_f1: 0.5441
 epoch: 60, train_loss: 0.7641, test_loss: 1.1111, test_f1: 0.5529
 epoch: 61, train_loss: 0.7651, test_loss: 1.1056, test_f1: 0.5732
 epoch: 62, train_loss: 0.7552, test_loss: 1.1463, test_f1: 0.5557
 epoch: 63, train_loss: 0.7598, test_loss: 1.0967, test_f1: 0.5541
 epoch: 64, train_loss: 0.7571, test_loss: 1.0637, test_f1: 0.5502
 epoch: 65, train_loss: 0.7525, test_loss: 1.0772, test_f1: 0.5549
 epoch: 66, train_loss: 0.7377, test_loss: 1.0722, test_f1: 0.5419
 epoch: 67, train_loss: 0.7385, test_loss: 1.0755, test_f1: 0.5681
 epoch: 68, train_loss: 0.7497, test_loss: 1.0810, test_f1: 0.5611
 epoch: 69, train_loss: 0.7392, test_loss: 1.0892, test_f1: 0.5392
 epoch: 70, train_loss: 0.7417, test_loss: 1.0728, test_f1: 0.5509
 epoch: 71, train_loss: 0.7383, test_loss: 1.0811, test_f1: 0.5666
 epoch: 72, train_loss: 0.7440, test_loss: 1.0860, test_f1: 0.5665
 epoch: 73, train_loss: 0.7435, test_loss: 1.0835, test_f1: 0.5647
 epoch: 74, train_loss: 0.7179, test_loss: 1.0833, test_f1: 0.5543
 epoch: 75, train_loss: 0.7196, test_loss: 1.1026, test_f1: 0.5591
 epoch: 76, train_loss: 0.7408, test_loss: 1.1064, test_f1: 0.5644
 epoch: 77, train_loss: 0.7271, test_loss: 1.0726, test_f1: 0.5806
 epoch: 78, train_loss: 0.7243, test_loss: 1.0621, test_f1: 0.5774
 epoch: 79, train_loss: 0.7200, test_loss: 1.0657, test_f1: 0.5746
 epoch: 80, train_loss: 0.7258, test_loss: 1.1093, test_f1: 0.5661
 epoch: 81, train_loss: 0.7337, test_loss: 1.0948, test_f1: 0.5691
 epoch: 82, train_loss: 0.7216, test_loss: 1.0801, test_f1: 0.5620
 epoch: 83, train_loss: 0.7124, test_loss: 1.0858, test_f1: 0.5781
 epoch: 84, train_loss: 0.7118, test_loss: 1.1178, test_f1: 0.5748
 epoch: 85, train_loss: 0.7109, test_loss: 1.1170, test_f1: 0.5569
 epoch: 86, train_loss: 0.7019, test_loss: 1.1017, test_f1: 0.5747
 epoch: 87, train_loss: 0.7156, test_loss: 1.0795, test_f1: 0.5861
 epoch: 88, train_loss: 0.7102, test_loss: 1.1056, test_f1: 0.5739
 epoch: 89, train_loss: 0.7062, test_loss: 1.1078, test_f1: 0.5594
 epoch: 90, train_loss: 0.7039, test_loss: 1.1154, test_f1: 0.5874
 epoch: 91, train_loss: 0.7027, test_loss: 1.1050, test_f1: 0.5774
 epoch: 92, train_loss: 0.6956, test_loss: 1.1165, test_f1: 0.5805
 epoch: 93, train_loss: 0.7017, test_loss: 1.1416, test_f1: 0.5722
 epoch: 94, train_loss: 0.6938, test_loss: 1.1558, test_f1: 0.5725
 epoch: 95, train_loss: 0.6955, test_loss: 1.1285, test_f1: 0.5752
 epoch: 96, train_loss: 0.6936, test_loss: 1.1192, test_f1: 0.5799
 epoch: 97, train_loss: 0.6922, test_loss: 1.1281, test_f1: 0.5847
 epoch: 98, train_loss: 0.6855, test_loss: 1.1215, test_f1: 0.5561
 epoch: 99, train_loss: 0.6930, test_loss: 1.1295, test_f1: 0.5650
##################ITERATION #5 ****************************************
 epoch: 0, train_loss: 1.2261, test_loss: 1.3715, test_f1: 0.2281
 epoch: 1, train_loss: 1.1448, test_loss: 1.3719, test_f1: 0.2281
 epoch: 2, train_loss: 1.1200, test_loss: 1.3672, test_f1: 0.2988
 epoch: 3, train_loss: 1.0925, test_loss: 1.3626, test_f1: 0.2543
 epoch: 4, train_loss: 1.0768, test_loss: 1.3444, test_f1: 0.3185
 epoch: 5, train_loss: 1.0629, test_loss: 1.3156, test_f1: 0.3408
 epoch: 6, train_loss: 1.0489, test_loss: 1.2865, test_f1: 0.3572
 epoch: 7, train_loss: 1.0400, test_loss: 1.2447, test_f1: 0.4320
 epoch: 8, train_loss: 1.0219, test_loss: 1.1872, test_f1: 0.4546
 epoch: 9, train_loss: 1.0091, test_loss: 1.1576, test_f1: 0.4798
 epoch: 10, train_loss: 0.9996, test_loss: 1.1293, test_f1: 0.4962
 epoch: 11, train_loss: 0.9849, test_loss: 1.0960, test_f1: 0.5094
 epoch: 12, train_loss: 0.9793, test_loss: 1.0769, test_f1: 0.5004
 epoch: 13, train_loss: 0.9742, test_loss: 1.0526, test_f1: 0.5050
 epoch: 14, train_loss: 0.9661, test_loss: 1.0474, test_f1: 0.5236
 epoch: 15, train_loss: 0.9471, test_loss: 1.0428, test_f1: 0.5173
 epoch: 16, train_loss: 0.9473, test_loss: 1.0490, test_f1: 0.5081
 epoch: 17, train_loss: 0.9308, test_loss: 1.0530, test_f1: 0.5028
 epoch: 18, train_loss: 0.9256, test_loss: 1.0313, test_f1: 0.4967
 epoch: 19, train_loss: 0.9139, test_loss: 1.0306, test_f1: 0.5040
 epoch: 20, train_loss: 0.9056, test_loss: 1.0134, test_f1: 0.5130
 epoch: 21, train_loss: 0.9044, test_loss: 1.0148, test_f1: 0.5272
 epoch: 22, train_loss: 0.9058, test_loss: 1.0342, test_f1: 0.5171
 epoch: 23, train_loss: 0.9015, test_loss: 1.0455, test_f1: 0.5262
 epoch: 24, train_loss: 0.8889, test_loss: 1.0268, test_f1: 0.5476
 epoch: 25, train_loss: 0.8831, test_loss: 1.0002, test_f1: 0.5384
 epoch: 26, train_loss: 0.8625, test_loss: 1.0144, test_f1: 0.5302
 epoch: 27, train_loss: 0.8638, test_loss: 1.0235, test_f1: 0.5430
 epoch: 28, train_loss: 0.8705, test_loss: 1.0312, test_f1: 0.5475
 epoch: 29, train_loss: 0.8521, test_loss: 1.0469, test_f1: 0.5341
 epoch: 30, train_loss: 0.8455, test_loss: 1.0744, test_f1: 0.5419
 epoch: 31, train_loss: 0.8415, test_loss: 1.0696, test_f1: 0.5411
 epoch: 32, train_loss: 0.8475, test_loss: 1.0794, test_f1: 0.5521
 epoch: 33, train_loss: 0.8374, test_loss: 1.0733, test_f1: 0.5467
 epoch: 34, train_loss: 0.8446, test_loss: 1.0731, test_f1: 0.5407
 epoch: 35, train_loss: 0.8286, test_loss: 1.0481, test_f1: 0.5757
 epoch: 36, train_loss: 0.8399, test_loss: 1.0738, test_f1: 0.5596
 epoch: 37, train_loss: 0.8363, test_loss: 1.0670, test_f1: 0.5444
 epoch: 38, train_loss: 0.8187, test_loss: 1.0652, test_f1: 0.5441
 epoch: 39, train_loss: 0.8149, test_loss: 1.0851, test_f1: 0.5451
 epoch: 40, train_loss: 0.8150, test_loss: 1.0837, test_f1: 0.5629
 epoch: 41, train_loss: 0.7981, test_loss: 1.0503, test_f1: 0.5716
 epoch: 42, train_loss: 0.8115, test_loss: 1.0535, test_f1: 0.5517
 epoch: 43, train_loss: 0.8015, test_loss: 1.0460, test_f1: 0.5419
 epoch: 44, train_loss: 0.7924, test_loss: 1.0434, test_f1: 0.5690
 epoch: 45, train_loss: 0.7827, test_loss: 1.0469, test_f1: 0.5602
 epoch: 46, train_loss: 0.7991, test_loss: 1.0593, test_f1: 0.5649
 epoch: 47, train_loss: 0.8006, test_loss: 1.0657, test_f1: 0.5479
 epoch: 48, train_loss: 0.7827, test_loss: 1.0950, test_f1: 0.5710
 epoch: 49, train_loss: 0.7726, test_loss: 1.1558, test_f1: 0.5466
 epoch: 50, train_loss: 0.7693, test_loss: 1.1190, test_f1: 0.5581
 epoch: 51, train_loss: 0.7584, test_loss: 1.1046, test_f1: 0.5678
 epoch: 52, train_loss: 0.7569, test_loss: 1.0942, test_f1: 0.5707
 epoch: 53, train_loss: 0.7492, test_loss: 1.0923, test_f1: 0.5660
 epoch: 54, train_loss: 0.7594, test_loss: 1.1183, test_f1: 0.5659
 epoch: 55, train_loss: 0.7526, test_loss: 1.1065, test_f1: 0.5810
 epoch: 56, train_loss: 0.7522, test_loss: 1.1195, test_f1: 0.5816
 epoch: 57, train_loss: 0.7402, test_loss: 1.0985, test_f1: 0.5820
 epoch: 58, train_loss: 0.7565, test_loss: 1.1063, test_f1: 0.5679
 epoch: 59, train_loss: 0.7333, test_loss: 1.1117, test_f1: 0.5654
 epoch: 60, train_loss: 0.7358, test_loss: 1.0840, test_f1: 0.5876
 epoch: 61, train_loss: 0.7443, test_loss: 1.1168, test_f1: 0.5799
 epoch: 62, train_loss: 0.7271, test_loss: 1.0917, test_f1: 0.5758
 epoch: 63, train_loss: 0.7432, test_loss: 1.0701, test_f1: 0.5862
 epoch: 64, train_loss: 0.7315, test_loss: 1.0539, test_f1: 0.5729
 epoch: 65, train_loss: 0.7282, test_loss: 1.0783, test_f1: 0.5645
 epoch: 66, train_loss: 0.7336, test_loss: 1.1079, test_f1: 0.5737
 epoch: 67, train_loss: 0.7274, test_loss: 1.0911, test_f1: 0.5927
 epoch: 68, train_loss: 0.7202, test_loss: 1.1014, test_f1: 0.5692
 epoch: 69, train_loss: 0.7205, test_loss: 1.0665, test_f1: 0.5740
 epoch: 70, train_loss: 0.7240, test_loss: 1.0613, test_f1: 0.5717
 epoch: 71, train_loss: 0.7184, test_loss: 1.0684, test_f1: 0.5811
 epoch: 72, train_loss: 0.7187, test_loss: 1.0543, test_f1: 0.5824
 epoch: 73, train_loss: 0.7131, test_loss: 1.0615, test_f1: 0.5798
 epoch: 74, train_loss: 0.7136, test_loss: 1.0739, test_f1: 0.5875
 epoch: 75, train_loss: 0.7084, test_loss: 1.1109, test_f1: 0.5918
 epoch: 76, train_loss: 0.7227, test_loss: 1.1086, test_f1: 0.5819
 epoch: 77, train_loss: 0.7142, test_loss: 1.1108, test_f1: 0.5802
 epoch: 78, train_loss: 0.7140, test_loss: 1.1034, test_f1: 0.5678
 epoch: 79, train_loss: 0.7105, test_loss: 1.0921, test_f1: 0.5678
 epoch: 80, train_loss: 0.7008, test_loss: 1.0675, test_f1: 0.5906
 epoch: 81, train_loss: 0.6987, test_loss: 1.0735, test_f1: 0.5935
 epoch: 82, train_loss: 0.6977, test_loss: 1.0924, test_f1: 0.5884
 epoch: 83, train_loss: 0.6923, test_loss: 1.1023, test_f1: 0.5707
 epoch: 84, train_loss: 0.6988, test_loss: 1.0813, test_f1: 0.5674
 epoch: 85, train_loss: 0.6932, test_loss: 1.1072, test_f1: 0.5592
 epoch: 86, train_loss: 0.6827, test_loss: 1.1399, test_f1: 0.5732
 epoch: 87, train_loss: 0.6917, test_loss: 1.1353, test_f1: 0.5786
 epoch: 88, train_loss: 0.6834, test_loss: 1.1298, test_f1: 0.5708
 epoch: 89, train_loss: 0.6819, test_loss: 1.1275, test_f1: 0.5687
 epoch: 90, train_loss: 0.6751, test_loss: 1.1410, test_f1: 0.5729
 epoch: 91, train_loss: 0.6719, test_loss: 1.1454, test_f1: 0.5720
 epoch: 92, train_loss: 0.6810, test_loss: 1.1553, test_f1: 0.5817
 epoch: 93, train_loss: 0.6707, test_loss: 1.1554, test_f1: 0.5634
 epoch: 94, train_loss: 0.6741, test_loss: 1.1407, test_f1: 0.5681
 epoch: 95, train_loss: 0.6664, test_loss: 1.1606, test_f1: 0.5657
 epoch: 96, train_loss: 0.6782, test_loss: 1.1582, test_f1: 0.5838
 epoch: 97, train_loss: 0.6696, test_loss: 1.1515, test_f1: 0.5971
 epoch: 98, train_loss: 0.6670, test_loss: 1.1812, test_f1: 0.5845
 epoch: 99, train_loss: 0.6651, test_loss: 1.2167, test_f1: 0.5656
##################ITERATION #6 ****************************************
 epoch: 0, train_loss: 1.2286, test_loss: 1.3544, test_f1: 0.2281
 epoch: 1, train_loss: 1.1429, test_loss: 1.3490, test_f1: 0.2281
 epoch: 2, train_loss: 1.1104, test_loss: 1.3633, test_f1: 0.2441
 epoch: 3, train_loss: 1.0889, test_loss: 1.3662, test_f1: 0.2381
 epoch: 4, train_loss: 1.0646, test_loss: 1.3405, test_f1: 0.2799
 epoch: 5, train_loss: 1.0533, test_loss: 1.2993, test_f1: 0.3016
 epoch: 6, train_loss: 1.0330, test_loss: 1.2750, test_f1: 0.3486
 epoch: 7, train_loss: 1.0323, test_loss: 1.2248, test_f1: 0.4410
 epoch: 8, train_loss: 1.0031, test_loss: 1.1631, test_f1: 0.4502
 epoch: 9, train_loss: 0.9994, test_loss: 1.1504, test_f1: 0.4824
 epoch: 10, train_loss: 0.9884, test_loss: 1.1275, test_f1: 0.4841
 epoch: 11, train_loss: 0.9651, test_loss: 1.1130, test_f1: 0.4796
 epoch: 12, train_loss: 0.9673, test_loss: 1.0965, test_f1: 0.5149
 epoch: 13, train_loss: 0.9490, test_loss: 1.0632, test_f1: 0.5179
 epoch: 14, train_loss: 0.9470, test_loss: 1.0411, test_f1: 0.5332
 epoch: 15, train_loss: 0.9439, test_loss: 1.0364, test_f1: 0.5447
 epoch: 16, train_loss: 0.9288, test_loss: 1.0466, test_f1: 0.5315
 epoch: 17, train_loss: 0.9259, test_loss: 1.0470, test_f1: 0.5279
 epoch: 18, train_loss: 0.9075, test_loss: 1.0387, test_f1: 0.5476
 epoch: 19, train_loss: 0.8989, test_loss: 1.0305, test_f1: 0.5584
 epoch: 20, train_loss: 0.8980, test_loss: 1.0441, test_f1: 0.5452
 epoch: 21, train_loss: 0.8877, test_loss: 1.0357, test_f1: 0.5366
 epoch: 22, train_loss: 0.8859, test_loss: 1.0035, test_f1: 0.5453
 epoch: 23, train_loss: 0.8758, test_loss: 0.9939, test_f1: 0.5404
 epoch: 24, train_loss: 0.8789, test_loss: 1.0053, test_f1: 0.5479
 epoch: 25, train_loss: 0.8587, test_loss: 1.0195, test_f1: 0.5504
 epoch: 26, train_loss: 0.8544, test_loss: 1.0177, test_f1: 0.5508
 epoch: 27, train_loss: 0.8574, test_loss: 1.0331, test_f1: 0.5287
 epoch: 28, train_loss: 0.8488, test_loss: 1.0290, test_f1: 0.5414
 epoch: 29, train_loss: 0.8461, test_loss: 1.0305, test_f1: 0.5481
 epoch: 30, train_loss: 0.8460, test_loss: 1.0759, test_f1: 0.5637
 epoch: 31, train_loss: 0.8303, test_loss: 1.0392, test_f1: 0.5663
 epoch: 32, train_loss: 0.8197, test_loss: 1.0219, test_f1: 0.5459
 epoch: 33, train_loss: 0.8332, test_loss: 1.0226, test_f1: 0.5435
 epoch: 34, train_loss: 0.8241, test_loss: 1.0202, test_f1: 0.5282
 epoch: 35, train_loss: 0.8158, test_loss: 1.0439, test_f1: 0.5483
 epoch: 36, train_loss: 0.8107, test_loss: 1.0850, test_f1: 0.5699
 epoch: 37, train_loss: 0.8100, test_loss: 1.0396, test_f1: 0.5500
 epoch: 38, train_loss: 0.8080, test_loss: 1.0197, test_f1: 0.5619
 epoch: 39, train_loss: 0.7967, test_loss: 1.0269, test_f1: 0.5656
 epoch: 40, train_loss: 0.7937, test_loss: 1.0406, test_f1: 0.5571
 epoch: 41, train_loss: 0.8003, test_loss: 1.0169, test_f1: 0.5540
 epoch: 42, train_loss: 0.8028, test_loss: 1.0093, test_f1: 0.5435
 epoch: 43, train_loss: 0.7787, test_loss: 1.0133, test_f1: 0.5630
 epoch: 44, train_loss: 0.7914, test_loss: 1.0273, test_f1: 0.5432
 epoch: 45, train_loss: 0.7838, test_loss: 1.0440, test_f1: 0.5430
 epoch: 46, train_loss: 0.7811, test_loss: 1.1041, test_f1: 0.5492
 epoch: 47, train_loss: 0.7684, test_loss: 1.0708, test_f1: 0.5639
 epoch: 48, train_loss: 0.7656, test_loss: 1.0893, test_f1: 0.5683
 epoch: 49, train_loss: 0.7448, test_loss: 1.1273, test_f1: 0.5780
 epoch: 50, train_loss: 0.7679, test_loss: 1.1355, test_f1: 0.5782
 epoch: 51, train_loss: 0.7491, test_loss: 1.1071, test_f1: 0.5783
 epoch: 52, train_loss: 0.7455, test_loss: 1.0474, test_f1: 0.5815
 epoch: 53, train_loss: 0.7454, test_loss: 1.0586, test_f1: 0.5675
 epoch: 54, train_loss: 0.7345, test_loss: 1.0828, test_f1: 0.5650
 epoch: 55, train_loss: 0.7417, test_loss: 1.0847, test_f1: 0.5671
 epoch: 56, train_loss: 0.7250, test_loss: 1.0892, test_f1: 0.5764
 epoch: 57, train_loss: 0.7265, test_loss: 1.1217, test_f1: 0.5669
 epoch: 58, train_loss: 0.7236, test_loss: 1.1339, test_f1: 0.5700
 epoch: 59, train_loss: 0.7098, test_loss: 1.1003, test_f1: 0.5746
 epoch: 60, train_loss: 0.7213, test_loss: 1.0973, test_f1: 0.5713
 epoch: 61, train_loss: 0.7165, test_loss: 1.1137, test_f1: 0.5686
 epoch: 62, train_loss: 0.7124, test_loss: 1.1097, test_f1: 0.5639
 epoch: 63, train_loss: 0.7053, test_loss: 1.0961, test_f1: 0.5781
 epoch: 64, train_loss: 0.7171, test_loss: 1.0920, test_f1: 0.5805
 epoch: 65, train_loss: 0.6991, test_loss: 1.0952, test_f1: 0.5952
 epoch: 66, train_loss: 0.7044, test_loss: 1.0754, test_f1: 0.5817
 epoch: 67, train_loss: 0.7116, test_loss: 1.0748, test_f1: 0.5763
 epoch: 68, train_loss: 0.6980, test_loss: 1.0835, test_f1: 0.5840
 epoch: 69, train_loss: 0.6929, test_loss: 1.1170, test_f1: 0.5869
 epoch: 70, train_loss: 0.7070, test_loss: 1.1226, test_f1: 0.5631
 epoch: 71, train_loss: 0.7046, test_loss: 1.1898, test_f1: 0.5429
 epoch: 72, train_loss: 0.6962, test_loss: 1.1277, test_f1: 0.5865
 epoch: 73, train_loss: 0.7091, test_loss: 1.1373, test_f1: 0.5611
 epoch: 74, train_loss: 0.6913, test_loss: 1.1509, test_f1: 0.5611
 epoch: 75, train_loss: 0.7075, test_loss: 1.1603, test_f1: 0.5494
 epoch: 76, train_loss: 0.6986, test_loss: 1.1564, test_f1: 0.5821
 epoch: 77, train_loss: 0.6850, test_loss: 1.1626, test_f1: 0.5819
 epoch: 78, train_loss: 0.6893, test_loss: 1.1642, test_f1: 0.5681
 epoch: 79, train_loss: 0.6771, test_loss: 1.1582, test_f1: 0.5721
 epoch: 80, train_loss: 0.6859, test_loss: 1.1929, test_f1: 0.5721
 epoch: 81, train_loss: 0.6772, test_loss: 1.1630, test_f1: 0.5618
 epoch: 82, train_loss: 0.6757, test_loss: 1.1832, test_f1: 0.5665
 epoch: 83, train_loss: 0.6872, test_loss: 1.1828, test_f1: 0.5756
 epoch: 84, train_loss: 0.6714, test_loss: 1.1724, test_f1: 0.5731
 epoch: 85, train_loss: 0.6747, test_loss: 1.1992, test_f1: 0.5736
 epoch: 86, train_loss: 0.6666, test_loss: 1.2114, test_f1: 0.5764
 epoch: 87, train_loss: 0.6589, test_loss: 1.2146, test_f1: 0.5720
 epoch: 88, train_loss: 0.6670, test_loss: 1.2000, test_f1: 0.5555
 epoch: 89, train_loss: 0.6572, test_loss: 1.1760, test_f1: 0.5606
 epoch: 90, train_loss: 0.6625, test_loss: 1.1980, test_f1: 0.5746
 epoch: 91, train_loss: 0.6611, test_loss: 1.2144, test_f1: 0.5877
 epoch: 92, train_loss: 0.6718, test_loss: 1.1940, test_f1: 0.5643
 epoch: 93, train_loss: 0.6680, test_loss: 1.1829, test_f1: 0.5713
 epoch: 94, train_loss: 0.6568, test_loss: 1.1604, test_f1: 0.5523
 epoch: 95, train_loss: 0.6674, test_loss: 1.1705, test_f1: 0.5524
 epoch: 96, train_loss: 0.6596, test_loss: 1.1954, test_f1: 0.5657
 epoch: 97, train_loss: 0.6588, test_loss: 1.2389, test_f1: 0.5602
 epoch: 98, train_loss: 0.6524, test_loss: 1.2079, test_f1: 0.5680
 epoch: 99, train_loss: 0.6596, test_loss: 1.1910, test_f1: 0.5811
##################ITERATION #7 ****************************************
 epoch: 0, train_loss: 1.2182, test_loss: 1.3777, test_f1: 0.2281
 epoch: 1, train_loss: 1.1272, test_loss: 1.4115, test_f1: 0.0950
 epoch: 2, train_loss: 1.1062, test_loss: 1.4394, test_f1: 0.0831
 epoch: 3, train_loss: 1.0796, test_loss: 1.4309, test_f1: 0.1029
 epoch: 4, train_loss: 1.0617, test_loss: 1.3770, test_f1: 0.2045
 epoch: 5, train_loss: 1.0456, test_loss: 1.3201, test_f1: 0.2721
 epoch: 6, train_loss: 1.0348, test_loss: 1.2940, test_f1: 0.3156
 epoch: 7, train_loss: 1.0282, test_loss: 1.2531, test_f1: 0.3710
 epoch: 8, train_loss: 1.0160, test_loss: 1.2260, test_f1: 0.3782
 epoch: 9, train_loss: 0.9857, test_loss: 1.1758, test_f1: 0.4360
 epoch: 10, train_loss: 0.9826, test_loss: 1.1353, test_f1: 0.4648
 epoch: 11, train_loss: 0.9805, test_loss: 1.1038, test_f1: 0.5052
 epoch: 12, train_loss: 0.9686, test_loss: 1.0863, test_f1: 0.5202
 epoch: 13, train_loss: 0.9580, test_loss: 1.0775, test_f1: 0.5031
 epoch: 14, train_loss: 0.9534, test_loss: 1.0738, test_f1: 0.5222
 epoch: 15, train_loss: 0.9424, test_loss: 1.0720, test_f1: 0.5379
 epoch: 16, train_loss: 0.9421, test_loss: 1.0656, test_f1: 0.5401
 epoch: 17, train_loss: 0.9257, test_loss: 1.0677, test_f1: 0.5204
 epoch: 18, train_loss: 0.9248, test_loss: 1.0689, test_f1: 0.5429
 epoch: 19, train_loss: 0.9268, test_loss: 1.0629, test_f1: 0.5391
 epoch: 20, train_loss: 0.9020, test_loss: 1.0338, test_f1: 0.5447
 epoch: 21, train_loss: 0.9007, test_loss: 1.0277, test_f1: 0.5349
 epoch: 22, train_loss: 0.9024, test_loss: 1.0328, test_f1: 0.5455
 epoch: 23, train_loss: 0.8907, test_loss: 1.0503, test_f1: 0.5337
 epoch: 24, train_loss: 0.8755, test_loss: 1.0533, test_f1: 0.5371
 epoch: 25, train_loss: 0.8862, test_loss: 1.0517, test_f1: 0.5437
 epoch: 26, train_loss: 0.8739, test_loss: 1.0417, test_f1: 0.5329
 epoch: 27, train_loss: 0.8653, test_loss: 1.0531, test_f1: 0.5340
 epoch: 28, train_loss: 0.8637, test_loss: 1.0531, test_f1: 0.5380
 epoch: 29, train_loss: 0.8653, test_loss: 1.0487, test_f1: 0.5282
 epoch: 30, train_loss: 0.8525, test_loss: 1.0636, test_f1: 0.5592
 epoch: 31, train_loss: 0.8502, test_loss: 1.0479, test_f1: 0.5596
 epoch: 32, train_loss: 0.8436, test_loss: 1.0640, test_f1: 0.5620
 epoch: 33, train_loss: 0.8414, test_loss: 1.0633, test_f1: 0.5382
 epoch: 34, train_loss: 0.8361, test_loss: 1.0597, test_f1: 0.5576
 epoch: 35, train_loss: 0.8288, test_loss: 1.0590, test_f1: 0.5640
 epoch: 36, train_loss: 0.8199, test_loss: 1.0684, test_f1: 0.5570
 epoch: 37, train_loss: 0.8181, test_loss: 1.0651, test_f1: 0.5541
 epoch: 38, train_loss: 0.8028, test_loss: 1.0525, test_f1: 0.5449
 epoch: 39, train_loss: 0.8021, test_loss: 1.0367, test_f1: 0.5829
 epoch: 40, train_loss: 0.7979, test_loss: 1.0447, test_f1: 0.5653
 epoch: 41, train_loss: 0.7961, test_loss: 1.0377, test_f1: 0.5761
 epoch: 42, train_loss: 0.8010, test_loss: 1.0599, test_f1: 0.5672
 epoch: 43, train_loss: 0.7856, test_loss: 1.0786, test_f1: 0.5693
 epoch: 44, train_loss: 0.7891, test_loss: 1.0774, test_f1: 0.5861
 epoch: 45, train_loss: 0.7823, test_loss: 1.0753, test_f1: 0.5883
 epoch: 46, train_loss: 0.7755, test_loss: 1.0591, test_f1: 0.5742
 epoch: 47, train_loss: 0.7777, test_loss: 1.0661, test_f1: 0.5624
 epoch: 48, train_loss: 0.7712, test_loss: 1.1059, test_f1: 0.5309
 epoch: 49, train_loss: 0.7771, test_loss: 1.0748, test_f1: 0.5571
 epoch: 50, train_loss: 0.7521, test_loss: 1.0964, test_f1: 0.5765
 epoch: 51, train_loss: 0.7536, test_loss: 1.0796, test_f1: 0.5526
 epoch: 52, train_loss: 0.7613, test_loss: 1.0710, test_f1: 0.5707
 epoch: 53, train_loss: 0.7412, test_loss: 1.0705, test_f1: 0.5844
 epoch: 54, train_loss: 0.7473, test_loss: 1.0736, test_f1: 0.5774
 epoch: 55, train_loss: 0.7469, test_loss: 1.0750, test_f1: 0.5754
 epoch: 56, train_loss: 0.7474, test_loss: 1.0781, test_f1: 0.5901
 epoch: 57, train_loss: 0.7429, test_loss: 1.0885, test_f1: 0.5817
 epoch: 58, train_loss: 0.7333, test_loss: 1.0777, test_f1: 0.5759
 epoch: 59, train_loss: 0.7308, test_loss: 1.0804, test_f1: 0.5938
 epoch: 60, train_loss: 0.7317, test_loss: 1.0766, test_f1: 0.5701
 epoch: 61, train_loss: 0.7253, test_loss: 1.0831, test_f1: 0.5779
 epoch: 62, train_loss: 0.7245, test_loss: 1.0817, test_f1: 0.5761
 epoch: 63, train_loss: 0.7255, test_loss: 1.0815, test_f1: 0.5814
 epoch: 64, train_loss: 0.7173, test_loss: 1.0914, test_f1: 0.5811
 epoch: 65, train_loss: 0.7130, test_loss: 1.0956, test_f1: 0.5623
 epoch: 66, train_loss: 0.7175, test_loss: 1.0971, test_f1: 0.5736
 epoch: 67, train_loss: 0.7160, test_loss: 1.1118, test_f1: 0.5746
 epoch: 68, train_loss: 0.7091, test_loss: 1.1283, test_f1: 0.5735
 epoch: 69, train_loss: 0.7199, test_loss: 1.1386, test_f1: 0.5764
 epoch: 70, train_loss: 0.7207, test_loss: 1.1428, test_f1: 0.5871
 epoch: 71, train_loss: 0.7141, test_loss: 1.1273, test_f1: 0.5746
 epoch: 72, train_loss: 0.7118, test_loss: 1.1213, test_f1: 0.5531
 epoch: 73, train_loss: 0.7156, test_loss: 1.1045, test_f1: 0.5737
 epoch: 74, train_loss: 0.7033, test_loss: 1.1291, test_f1: 0.5766
 epoch: 75, train_loss: 0.6992, test_loss: 1.1251, test_f1: 0.5734
 epoch: 76, train_loss: 0.7068, test_loss: 1.1502, test_f1: 0.5864
 epoch: 77, train_loss: 0.7010, test_loss: 1.1286, test_f1: 0.5959
 epoch: 78, train_loss: 0.6971, test_loss: 1.1203, test_f1: 0.5868
 epoch: 79, train_loss: 0.6913, test_loss: 1.1391, test_f1: 0.5849
 epoch: 80, train_loss: 0.6862, test_loss: 1.1408, test_f1: 0.5713
 epoch: 81, train_loss: 0.6846, test_loss: 1.1048, test_f1: 0.5801
 epoch: 82, train_loss: 0.6883, test_loss: 1.0991, test_f1: 0.5758
 epoch: 83, train_loss: 0.6927, test_loss: 1.1236, test_f1: 0.5686
 epoch: 84, train_loss: 0.6871, test_loss: 1.1375, test_f1: 0.5656
 epoch: 85, train_loss: 0.6912, test_loss: 1.1243, test_f1: 0.5760
 epoch: 86, train_loss: 0.6729, test_loss: 1.1369, test_f1: 0.5868
 epoch: 87, train_loss: 0.6825, test_loss: 1.1339, test_f1: 0.5878
 epoch: 88, train_loss: 0.6709, test_loss: 1.1645, test_f1: 0.5732
 epoch: 89, train_loss: 0.6778, test_loss: 1.1341, test_f1: 0.5895
 epoch: 90, train_loss: 0.6772, test_loss: 1.1290, test_f1: 0.5949
 epoch: 91, train_loss: 0.6842, test_loss: 1.1603, test_f1: 0.5989
 epoch: 92, train_loss: 0.6739, test_loss: 1.1807, test_f1: 0.5822
 epoch: 93, train_loss: 0.6757, test_loss: 1.2052, test_f1: 0.5634
 epoch: 94, train_loss: 0.6742, test_loss: 1.1747, test_f1: 0.5635
 epoch: 95, train_loss: 0.6682, test_loss: 1.1612, test_f1: 0.5719
 epoch: 96, train_loss: 0.6654, test_loss: 1.1734, test_f1: 0.5742
 epoch: 97, train_loss: 0.6678, test_loss: 1.1658, test_f1: 0.5749
 epoch: 98, train_loss: 0.6603, test_loss: 1.1866, test_f1: 0.5671
 epoch: 99, train_loss: 0.6762, test_loss: 1.2223, test_f1: 0.5605
##################ITERATION #8 ****************************************
 epoch: 0, train_loss: 1.2253, test_loss: 1.3398, test_f1: 0.2281
 epoch: 1, train_loss: 1.1425, test_loss: 1.3621, test_f1: 0.2281
 epoch: 2, train_loss: 1.1072, test_loss: 1.3909, test_f1: 0.2257
 epoch: 3, train_loss: 1.0827, test_loss: 1.4018, test_f1: 0.1383
 epoch: 4, train_loss: 1.0572, test_loss: 1.3450, test_f1: 0.2053
 epoch: 5, train_loss: 1.0513, test_loss: 1.2638, test_f1: 0.3407
 epoch: 6, train_loss: 1.0378, test_loss: 1.2112, test_f1: 0.3493
 epoch: 7, train_loss: 1.0205, test_loss: 1.1929, test_f1: 0.4301
 epoch: 8, train_loss: 1.0063, test_loss: 1.1773, test_f1: 0.4437
 epoch: 9, train_loss: 0.9993, test_loss: 1.1638, test_f1: 0.4427
 epoch: 10, train_loss: 0.9764, test_loss: 1.1560, test_f1: 0.4394
 epoch: 11, train_loss: 0.9689, test_loss: 1.1258, test_f1: 0.4451
 epoch: 12, train_loss: 0.9624, test_loss: 1.1043, test_f1: 0.4795
 epoch: 13, train_loss: 0.9621, test_loss: 1.0739, test_f1: 0.5210
 epoch: 14, train_loss: 0.9559, test_loss: 1.0688, test_f1: 0.5363
 epoch: 15, train_loss: 0.9433, test_loss: 1.0570, test_f1: 0.5450
 epoch: 16, train_loss: 0.9340, test_loss: 1.0649, test_f1: 0.5213
 epoch: 17, train_loss: 0.9338, test_loss: 1.0562, test_f1: 0.5232
 epoch: 18, train_loss: 0.9208, test_loss: 1.0425, test_f1: 0.5376
 epoch: 19, train_loss: 0.9195, test_loss: 1.0428, test_f1: 0.5401
 epoch: 20, train_loss: 0.9034, test_loss: 1.0594, test_f1: 0.5314
 epoch: 21, train_loss: 0.8974, test_loss: 1.0524, test_f1: 0.5388
 epoch: 22, train_loss: 0.8859, test_loss: 1.0370, test_f1: 0.5398
 epoch: 23, train_loss: 0.8818, test_loss: 1.0252, test_f1: 0.5592
 epoch: 24, train_loss: 0.8867, test_loss: 1.0256, test_f1: 0.5493
 epoch: 25, train_loss: 0.8705, test_loss: 1.0467, test_f1: 0.5447
 epoch: 26, train_loss: 0.8817, test_loss: 1.0547, test_f1: 0.5525
 epoch: 27, train_loss: 0.8598, test_loss: 1.0638, test_f1: 0.5441
 epoch: 28, train_loss: 0.8457, test_loss: 1.0398, test_f1: 0.5594
 epoch: 29, train_loss: 0.8521, test_loss: 1.0262, test_f1: 0.5534
 epoch: 30, train_loss: 0.8406, test_loss: 1.0195, test_f1: 0.5633
 epoch: 31, train_loss: 0.8354, test_loss: 1.0417, test_f1: 0.5664
 epoch: 32, train_loss: 0.8384, test_loss: 1.0667, test_f1: 0.5586
 epoch: 33, train_loss: 0.8344, test_loss: 1.0574, test_f1: 0.5736
 epoch: 34, train_loss: 0.8370, test_loss: 1.0566, test_f1: 0.5517
 epoch: 35, train_loss: 0.8417, test_loss: 1.0745, test_f1: 0.5581
 epoch: 36, train_loss: 0.8194, test_loss: 1.0726, test_f1: 0.5550
 epoch: 37, train_loss: 0.8136, test_loss: 1.0780, test_f1: 0.5522
 epoch: 38, train_loss: 0.8167, test_loss: 1.0555, test_f1: 0.5732
 epoch: 39, train_loss: 0.7967, test_loss: 1.0551, test_f1: 0.5812
 epoch: 40, train_loss: 0.8109, test_loss: 1.0976, test_f1: 0.5736
 epoch: 41, train_loss: 0.8113, test_loss: 1.1133, test_f1: 0.5603
 epoch: 42, train_loss: 0.8049, test_loss: 1.1357, test_f1: 0.5643
 epoch: 43, train_loss: 0.8001, test_loss: 1.1471, test_f1: 0.5617
 epoch: 44, train_loss: 0.7852, test_loss: 1.1223, test_f1: 0.5809
 epoch: 45, train_loss: 0.7787, test_loss: 1.1194, test_f1: 0.5682
 epoch: 46, train_loss: 0.7873, test_loss: 1.1185, test_f1: 0.5681
 epoch: 47, train_loss: 0.7693, test_loss: 1.1389, test_f1: 0.5700
 epoch: 48, train_loss: 0.7846, test_loss: 1.1344, test_f1: 0.5811
 epoch: 49, train_loss: 0.7863, test_loss: 1.1191, test_f1: 0.5726
 epoch: 50, train_loss: 0.7726, test_loss: 1.1240, test_f1: 0.5699
 epoch: 51, train_loss: 0.7521, test_loss: 1.1192, test_f1: 0.5831
 epoch: 52, train_loss: 0.7604, test_loss: 1.1396, test_f1: 0.5796
 epoch: 53, train_loss: 0.7446, test_loss: 1.1351, test_f1: 0.5775
 epoch: 54, train_loss: 0.7569, test_loss: 1.1233, test_f1: 0.5718
 epoch: 55, train_loss: 0.7505, test_loss: 1.1043, test_f1: 0.5882
 epoch: 56, train_loss: 0.7382, test_loss: 1.0938, test_f1: 0.5944
 epoch: 57, train_loss: 0.7446, test_loss: 1.1054, test_f1: 0.5850
 epoch: 58, train_loss: 0.7430, test_loss: 1.1125, test_f1: 0.5803
 epoch: 59, train_loss: 0.7252, test_loss: 1.1302, test_f1: 0.5921
 epoch: 60, train_loss: 0.7448, test_loss: 1.1516, test_f1: 0.5841
 epoch: 61, train_loss: 0.7348, test_loss: 1.1540, test_f1: 0.5792
 epoch: 62, train_loss: 0.7282, test_loss: 1.1406, test_f1: 0.5900
 epoch: 63, train_loss: 0.7338, test_loss: 1.1310, test_f1: 0.5725
 epoch: 64, train_loss: 0.7419, test_loss: 1.1327, test_f1: 0.5885
 epoch: 65, train_loss: 0.7141, test_loss: 1.1552, test_f1: 0.5681
 epoch: 66, train_loss: 0.7252, test_loss: 1.1606, test_f1: 0.5776
 epoch: 67, train_loss: 0.7165, test_loss: 1.1581, test_f1: 0.5950
 epoch: 68, train_loss: 0.7205, test_loss: 1.1888, test_f1: 0.5798
 epoch: 69, train_loss: 0.7230, test_loss: 1.2215, test_f1: 0.5679
 epoch: 70, train_loss: 0.7157, test_loss: 1.2135, test_f1: 0.5698
 epoch: 71, train_loss: 0.7172, test_loss: 1.1922, test_f1: 0.5824
 epoch: 72, train_loss: 0.7074, test_loss: 1.1847, test_f1: 0.5829
 epoch: 73, train_loss: 0.7089, test_loss: 1.2003, test_f1: 0.5824
 epoch: 74, train_loss: 0.7079, test_loss: 1.2261, test_f1: 0.5767
 epoch: 75, train_loss: 0.6927, test_loss: 1.2408, test_f1: 0.5688
 epoch: 76, train_loss: 0.6958, test_loss: 1.2623, test_f1: 0.5697
 epoch: 77, train_loss: 0.7030, test_loss: 1.2476, test_f1: 0.5773
 epoch: 78, train_loss: 0.6928, test_loss: 1.2229, test_f1: 0.5801
 epoch: 79, train_loss: 0.6984, test_loss: 1.2202, test_f1: 0.5699
 epoch: 80, train_loss: 0.6924, test_loss: 1.2318, test_f1: 0.5724
 epoch: 81, train_loss: 0.6965, test_loss: 1.2118, test_f1: 0.5854
 epoch: 82, train_loss: 0.6935, test_loss: 1.2057, test_f1: 0.5765
 epoch: 83, train_loss: 0.6858, test_loss: 1.2343, test_f1: 0.5775
 epoch: 84, train_loss: 0.6876, test_loss: 1.2516, test_f1: 0.5576
 epoch: 85, train_loss: 0.6956, test_loss: 1.2266, test_f1: 0.5626
 epoch: 86, train_loss: 0.6917, test_loss: 1.2408, test_f1: 0.5592
 epoch: 87, train_loss: 0.6834, test_loss: 1.2455, test_f1: 0.5678
 epoch: 88, train_loss: 0.6711, test_loss: 1.2408, test_f1: 0.5695
 epoch: 89, train_loss: 0.6845, test_loss: 1.2561, test_f1: 0.5795
 epoch: 90, train_loss: 0.6858, test_loss: 1.2667, test_f1: 0.5702
 epoch: 91, train_loss: 0.6807, test_loss: 1.2668, test_f1: 0.5759
 epoch: 92, train_loss: 0.6790, test_loss: 1.2780, test_f1: 0.5730
 epoch: 93, train_loss: 0.6647, test_loss: 1.2710, test_f1: 0.5805
 epoch: 94, train_loss: 0.6687, test_loss: 1.2822, test_f1: 0.5804
 epoch: 95, train_loss: 0.6613, test_loss: 1.2595, test_f1: 0.5829
 epoch: 96, train_loss: 0.6758, test_loss: 1.2540, test_f1: 0.5710
 epoch: 97, train_loss: 0.6736, test_loss: 1.3053, test_f1: 0.5735
 epoch: 98, train_loss: 0.6736, test_loss: 1.2994, test_f1: 0.5677
 epoch: 99, train_loss: 0.6676, test_loss: 1.2786, test_f1: 0.5801
##################ITERATION #9 ****************************************
 epoch: 0, train_loss: 1.2318, test_loss: 1.3240, test_f1: 0.2281
 epoch: 1, train_loss: 1.1363, test_loss: 1.3350, test_f1: 0.2281
 epoch: 2, train_loss: 1.1101, test_loss: 1.3287, test_f1: 0.2281
 epoch: 3, train_loss: 1.0839, test_loss: 1.3008, test_f1: 0.2281
 epoch: 4, train_loss: 1.0658, test_loss: 1.2778, test_f1: 0.3149
 epoch: 5, train_loss: 1.0492, test_loss: 1.2640, test_f1: 0.3419
 epoch: 6, train_loss: 1.0393, test_loss: 1.2347, test_f1: 0.3961
 epoch: 7, train_loss: 1.0261, test_loss: 1.1946, test_f1: 0.4309
 epoch: 8, train_loss: 1.0100, test_loss: 1.1641, test_f1: 0.4376
 epoch: 9, train_loss: 1.0097, test_loss: 1.1347, test_f1: 0.4478
 epoch: 10, train_loss: 0.9878, test_loss: 1.1023, test_f1: 0.4627
 epoch: 11, train_loss: 0.9846, test_loss: 1.0806, test_f1: 0.5128
 epoch: 12, train_loss: 0.9731, test_loss: 1.0775, test_f1: 0.5080
 epoch: 13, train_loss: 0.9660, test_loss: 1.0590, test_f1: 0.5093
 epoch: 14, train_loss: 0.9458, test_loss: 1.0303, test_f1: 0.5315
 epoch: 15, train_loss: 0.9526, test_loss: 1.0260, test_f1: 0.5336
 epoch: 16, train_loss: 0.9400, test_loss: 1.0321, test_f1: 0.5370
 epoch: 17, train_loss: 0.9243, test_loss: 1.0289, test_f1: 0.5393
 epoch: 18, train_loss: 0.9362, test_loss: 1.0174, test_f1: 0.5423
 epoch: 19, train_loss: 0.9080, test_loss: 1.0205, test_f1: 0.5293
 epoch: 20, train_loss: 0.9057, test_loss: 1.0254, test_f1: 0.5424
 epoch: 21, train_loss: 0.8922, test_loss: 1.0273, test_f1: 0.5542
 epoch: 22, train_loss: 0.8945, test_loss: 1.0210, test_f1: 0.5606
 epoch: 23, train_loss: 0.9064, test_loss: 1.0330, test_f1: 0.5565
 epoch: 24, train_loss: 0.8954, test_loss: 1.0712, test_f1: 0.5334
 epoch: 25, train_loss: 0.8917, test_loss: 1.0425, test_f1: 0.5456
 epoch: 26, train_loss: 0.8915, test_loss: 1.0178, test_f1: 0.5511
 epoch: 27, train_loss: 0.8769, test_loss: 1.0141, test_f1: 0.5630
 epoch: 28, train_loss: 0.8738, test_loss: 1.0271, test_f1: 0.5692
 epoch: 29, train_loss: 0.8635, test_loss: 1.0369, test_f1: 0.5709
 epoch: 30, train_loss: 0.8631, test_loss: 0.9900, test_f1: 0.5556
 epoch: 31, train_loss: 0.8583, test_loss: 0.9924, test_f1: 0.5556
 epoch: 32, train_loss: 0.8532, test_loss: 1.0115, test_f1: 0.5596
 epoch: 33, train_loss: 0.8434, test_loss: 1.0171, test_f1: 0.5763
 epoch: 34, train_loss: 0.8495, test_loss: 0.9785, test_f1: 0.5874
 epoch: 35, train_loss: 0.8437, test_loss: 0.9880, test_f1: 0.5697
 epoch: 36, train_loss: 0.8312, test_loss: 0.9982, test_f1: 0.5699
 epoch: 37, train_loss: 0.8378, test_loss: 0.9932, test_f1: 0.5696
 epoch: 38, train_loss: 0.8340, test_loss: 1.0266, test_f1: 0.5564
 epoch: 39, train_loss: 0.8252, test_loss: 1.0283, test_f1: 0.5708
 epoch: 40, train_loss: 0.8182, test_loss: 1.0103, test_f1: 0.6011
 epoch: 41, train_loss: 0.7988, test_loss: 0.9930, test_f1: 0.5838
 epoch: 42, train_loss: 0.8091, test_loss: 0.9814, test_f1: 0.5817
 epoch: 43, train_loss: 0.8074, test_loss: 0.9865, test_f1: 0.5640
 epoch: 44, train_loss: 0.7922, test_loss: 0.9750, test_f1: 0.5764
 epoch: 45, train_loss: 0.7998, test_loss: 1.0071, test_f1: 0.5885
 epoch: 46, train_loss: 0.7992, test_loss: 1.0132, test_f1: 0.5832
 epoch: 47, train_loss: 0.7884, test_loss: 1.0286, test_f1: 0.5840
 epoch: 48, train_loss: 0.7814, test_loss: 1.0335, test_f1: 0.5697
 epoch: 49, train_loss: 0.7775, test_loss: 1.0241, test_f1: 0.5867
 epoch: 50, train_loss: 0.7810, test_loss: 1.0743, test_f1: 0.5742
 epoch: 51, train_loss: 0.7713, test_loss: 1.0404, test_f1: 0.5880
 epoch: 52, train_loss: 0.7773, test_loss: 1.0104, test_f1: 0.5708
 epoch: 53, train_loss: 0.7764, test_loss: 1.0100, test_f1: 0.5716
 epoch: 54, train_loss: 0.7685, test_loss: 1.0174, test_f1: 0.5743
 epoch: 55, train_loss: 0.7542, test_loss: 1.0646, test_f1: 0.5791
 epoch: 56, train_loss: 0.7656, test_loss: 1.0531, test_f1: 0.5880
 epoch: 57, train_loss: 0.7464, test_loss: 1.0344, test_f1: 0.5948
 epoch: 58, train_loss: 0.7590, test_loss: 1.0262, test_f1: 0.5621
 epoch: 59, train_loss: 0.7448, test_loss: 1.0412, test_f1: 0.5695
 epoch: 60, train_loss: 0.7457, test_loss: 1.0681, test_f1: 0.5717
 epoch: 61, train_loss: 0.7602, test_loss: 1.0545, test_f1: 0.5783
 epoch: 62, train_loss: 0.7453, test_loss: 1.0023, test_f1: 0.5845
 epoch: 63, train_loss: 0.7497, test_loss: 0.9989, test_f1: 0.6015
 epoch: 64, train_loss: 0.7417, test_loss: 1.0168, test_f1: 0.5846
 epoch: 65, train_loss: 0.7379, test_loss: 1.0364, test_f1: 0.5822
 epoch: 66, train_loss: 0.7303, test_loss: 1.0474, test_f1: 0.5742
 epoch: 67, train_loss: 0.7387, test_loss: 1.0451, test_f1: 0.5878
 epoch: 68, train_loss: 0.7354, test_loss: 1.0326, test_f1: 0.5752
 epoch: 69, train_loss: 0.7321, test_loss: 1.0242, test_f1: 0.5753
 epoch: 70, train_loss: 0.7325, test_loss: 1.0382, test_f1: 0.5927
 epoch: 71, train_loss: 0.7381, test_loss: 1.0564, test_f1: 0.5819
 epoch: 72, train_loss: 0.7136, test_loss: 1.0746, test_f1: 0.5690
 epoch: 73, train_loss: 0.7292, test_loss: 1.0679, test_f1: 0.5638
 epoch: 74, train_loss: 0.7253, test_loss: 1.0811, test_f1: 0.5758
 epoch: 75, train_loss: 0.7203, test_loss: 1.1208, test_f1: 0.5762
 epoch: 76, train_loss: 0.7293, test_loss: 1.1058, test_f1: 0.5685
 epoch: 77, train_loss: 0.7227, test_loss: 1.0954, test_f1: 0.5767
 epoch: 78, train_loss: 0.7108, test_loss: 1.0863, test_f1: 0.5691
 epoch: 79, train_loss: 0.7153, test_loss: 1.0976, test_f1: 0.5798
 epoch: 80, train_loss: 0.7207, test_loss: 1.1114, test_f1: 0.5818
 epoch: 81, train_loss: 0.7191, test_loss: 1.0861, test_f1: 0.5578
 epoch: 82, train_loss: 0.7126, test_loss: 1.0365, test_f1: 0.5881
 epoch: 83, train_loss: 0.7159, test_loss: 1.0602, test_f1: 0.5732
 epoch: 84, train_loss: 0.7200, test_loss: 1.1001, test_f1: 0.5727
 epoch: 85, train_loss: 0.7094, test_loss: 1.0931, test_f1: 0.5855
 epoch: 86, train_loss: 0.7138, test_loss: 1.0793, test_f1: 0.5793
 epoch: 87, train_loss: 0.7091, test_loss: 1.0929, test_f1: 0.5845
 epoch: 88, train_loss: 0.6992, test_loss: 1.0879, test_f1: 0.5849
 epoch: 89, train_loss: 0.7156, test_loss: 1.0741, test_f1: 0.5788
 epoch: 90, train_loss: 0.7045, test_loss: 1.0312, test_f1: 0.5873
 epoch: 91, train_loss: 0.6852, test_loss: 1.0340, test_f1: 0.5824
 epoch: 92, train_loss: 0.7038, test_loss: 1.0593, test_f1: 0.5803
 epoch: 93, train_loss: 0.7052, test_loss: 1.0779, test_f1: 0.5888
 epoch: 94, train_loss: 0.6931, test_loss: 1.0885, test_f1: 0.5861
 epoch: 95, train_loss: 0.6930, test_loss: 1.0646, test_f1: 0.6036
 epoch: 96, train_loss: 0.6841, test_loss: 1.0412, test_f1: 0.6039
 epoch: 97, train_loss: 0.6964, test_loss: 1.0335, test_f1: 0.6064
 epoch: 98, train_loss: 0.6915, test_loss: 1.0553, test_f1: 0.6011
 epoch: 99, train_loss: 0.6814, test_loss: 1.0684, test_f1: 0.5982

Training completed in 326.93 seconds
Best F1: 0.6164 at epoch 95
Mean F1 across iterations: 0.5966  0.0095
========================FINAL RESULTS================================
FEGIN weighted F1: 0.6164  0.0095
python main.py --data ltspice_demos --representation component_net --model FEGIN --layers 6 --hiddens 128 --batch_size 256 --lr 0.0001 --emb_size 512 --epochs 100 --save_appendix component_net_L6_H128_BS256_LR0.0001_E512 --no_val
-----



STDERR:
  File "main.py", line 370, in <module>
    main()
  File "main.py", line 254, in main
    dataset = dataset_class(
  File "/home/philip/projects/ltspice_examples_code_repo/Circuit-Completion-Using-GNNs/component_classification_with_link_prediction_head/evaluation/FEGIN/kernel/circuit_datasets.py", line 15, in __init__
    self.data, self.slices = torch.load(self.processed_paths[0])
  File "/home/philip/.local/lib/python3.8/site-packages/torch/serialization.py", line 1040, in load
    warnings.warn(
  File "/usr/lib/python3.8/warnings.py", line 109, in _showwarnmsg
    sw(msg.message, msg.category, msg.filename, msg.lineno,
  File "main.py", line 47, in warn_with_traceback
    traceback.print_stack(file=log)
/home/philip/projects/ltspice_examples_code_repo/Circuit-Completion-Using-GNNs/component_classification_with_link_prediction_head/evaluation/FEGIN/kernel/circuit_datasets.py:15: FutureWarning: You are using `torch.load` with `weights_only=False` (the current default value), which uses the default pickle module implicitly. It is possible to construct malicious pickle data which will execute arbitrary code during unpickling (See https://github.com/pytorch/pytorch/blob/main/SECURITY.md#untrusted-models for more details). In a future release, the default value for `weights_only` will be flipped to `True`. This limits the functions that could be executed during unpickling. Arbitrary objects will no longer be allowed to be loaded via this mode unless they are explicitly allowlisted by the user via `torch.serialization.add_safe_globals`. We recommend you start setting `weights_only=True` for any use case where you don't have full control of the loaded file. Please open an issue on GitHub for any issues related to this experimental feature.
  self.data, self.slices = torch.load(self.processed_paths[0])
