STDOUT:
Results will be saved in /home/philip/projects/ltspice_examples_code_repo/Circuit-Completion-Using-GNNs/component_classification_with_link_prediction_head/evaluation/FEGIN/results/model_FEGIN_dataset_ltspice_demos
Command line input: python main.py --data ltspice_demos --representation component_net --model FEGIN --layers 6 --hiddens 128 --batch_size 256 --lr 0.0001 --emb_size 512 --epochs 100 --save_appendix component_net_L6_H128_BS256_LR0.0001_E512 --no_val
 is saved.
-----
ltspice_demos - FEGIN
Using 6 layers, 128 hidden units, h = 2
Loading component_net representation dataset
ENTERED
Training FEGIN on component_net representation
Train: 1565, Test: 383
##################ITERATION #0 ****************************************
 epoch: 0, train_loss: 1.3740, test_loss: 1.3732, test_f1: 0.2281
 epoch: 1, train_loss: 1.3583, test_loss: 1.3721, test_f1: 0.2281
 epoch: 2, train_loss: 1.3494, test_loss: 1.3702, test_f1: 0.2281
 epoch: 3, train_loss: 1.3392, test_loss: 1.3669, test_f1: 0.2281
 epoch: 4, train_loss: 1.3285, test_loss: 1.3621, test_f1: 0.2281
 epoch: 5, train_loss: 1.3139, test_loss: 1.3554, test_f1: 0.2281
 epoch: 6, train_loss: 1.2994, test_loss: 1.3476, test_f1: 0.2281
 epoch: 7, train_loss: 1.2839, test_loss: 1.3357, test_f1: 0.2281
 epoch: 8, train_loss: 1.2640, test_loss: 1.3208, test_f1: 0.2281
 epoch: 9, train_loss: 1.2454, test_loss: 1.3002, test_f1: 0.2281
 epoch: 10, train_loss: 1.2229, test_loss: 1.2818, test_f1: 0.2412
 epoch: 11, train_loss: 1.2027, test_loss: 1.2533, test_f1: 0.2946
 epoch: 12, train_loss: 1.1828, test_loss: 1.2289, test_f1: 0.2778
 epoch: 13, train_loss: 1.1668, test_loss: 1.2130, test_f1: 0.2793
 epoch: 14, train_loss: 1.1506, test_loss: 1.1988, test_f1: 0.2778
 epoch: 15, train_loss: 1.1374, test_loss: 1.1888, test_f1: 0.2793
 epoch: 16, train_loss: 1.1318, test_loss: 1.1789, test_f1: 0.3078
 epoch: 17, train_loss: 1.1168, test_loss: 1.1713, test_f1: 0.3020
 epoch: 18, train_loss: 1.1108, test_loss: 1.1691, test_f1: 0.3027
 epoch: 19, train_loss: 1.1011, test_loss: 1.1679, test_f1: 0.3003
 epoch: 20, train_loss: 1.0917, test_loss: 1.1559, test_f1: 0.2978
 epoch: 21, train_loss: 1.0875, test_loss: 1.1432, test_f1: 0.3460
 epoch: 22, train_loss: 1.0822, test_loss: 1.1454, test_f1: 0.3498
 epoch: 23, train_loss: 1.0759, test_loss: 1.1449, test_f1: 0.3517
 epoch: 24, train_loss: 1.0695, test_loss: 1.1275, test_f1: 0.4007
 epoch: 25, train_loss: 1.0578, test_loss: 1.1247, test_f1: 0.4107
 epoch: 26, train_loss: 1.0571, test_loss: 1.1193, test_f1: 0.4192
 epoch: 27, train_loss: 1.0488, test_loss: 1.1087, test_f1: 0.4522
 epoch: 28, train_loss: 1.0380, test_loss: 1.1176, test_f1: 0.4868
 epoch: 29, train_loss: 1.0333, test_loss: 1.1040, test_f1: 0.4867
 epoch: 30, train_loss: 1.0242, test_loss: 1.1006, test_f1: 0.5175
 epoch: 31, train_loss: 1.0211, test_loss: 1.0872, test_f1: 0.5272
 epoch: 32, train_loss: 1.0092, test_loss: 1.0919, test_f1: 0.5386
 epoch: 33, train_loss: 0.9979, test_loss: 1.1168, test_f1: 0.5064
 epoch: 34, train_loss: 0.9940, test_loss: 1.1016, test_f1: 0.5410
 epoch: 35, train_loss: 0.9812, test_loss: 1.1061, test_f1: 0.5265
 epoch: 36, train_loss: 0.9796, test_loss: 1.0962, test_f1: 0.5300
 epoch: 37, train_loss: 0.9644, test_loss: 1.0609, test_f1: 0.5621
 epoch: 38, train_loss: 0.9499, test_loss: 1.0381, test_f1: 0.5660
 epoch: 39, train_loss: 0.9470, test_loss: 1.0600, test_f1: 0.5498
 epoch: 40, train_loss: 0.9302, test_loss: 1.0197, test_f1: 0.5606
 epoch: 41, train_loss: 0.9227, test_loss: 1.0749, test_f1: 0.5553
 epoch: 42, train_loss: 0.9134, test_loss: 1.0382, test_f1: 0.5631
 epoch: 43, train_loss: 0.8992, test_loss: 1.0235, test_f1: 0.5506
 epoch: 44, train_loss: 0.8946, test_loss: 0.9912, test_f1: 0.5410
 epoch: 45, train_loss: 0.8849, test_loss: 1.0154, test_f1: 0.5628
 epoch: 46, train_loss: 0.8769, test_loss: 1.0014, test_f1: 0.5544
 epoch: 47, train_loss: 0.8606, test_loss: 1.0113, test_f1: 0.5399
 epoch: 48, train_loss: 0.8608, test_loss: 1.0213, test_f1: 0.5506
 epoch: 49, train_loss: 0.8568, test_loss: 1.0390, test_f1: 0.5616
 epoch: 50, train_loss: 0.8497, test_loss: 1.0424, test_f1: 0.5356
 epoch: 51, train_loss: 0.8393, test_loss: 0.9894, test_f1: 0.5604
 epoch: 52, train_loss: 0.8344, test_loss: 0.9918, test_f1: 0.5439
 epoch: 53, train_loss: 0.8332, test_loss: 1.0259, test_f1: 0.5462
 epoch: 54, train_loss: 0.8224, test_loss: 0.9950, test_f1: 0.5494
 epoch: 55, train_loss: 0.8154, test_loss: 0.9888, test_f1: 0.5524
 epoch: 56, train_loss: 0.8103, test_loss: 1.0417, test_f1: 0.5451
 epoch: 57, train_loss: 0.8074, test_loss: 0.9962, test_f1: 0.5568
 epoch: 58, train_loss: 0.7956, test_loss: 1.0149, test_f1: 0.5569
 epoch: 59, train_loss: 0.7968, test_loss: 1.0107, test_f1: 0.5536
 epoch: 60, train_loss: 0.7958, test_loss: 1.0309, test_f1: 0.5626
 epoch: 61, train_loss: 0.7961, test_loss: 1.0270, test_f1: 0.5520
 epoch: 62, train_loss: 0.7854, test_loss: 1.0522, test_f1: 0.5409
 epoch: 63, train_loss: 0.7866, test_loss: 1.0471, test_f1: 0.5411
 epoch: 64, train_loss: 0.7783, test_loss: 1.0412, test_f1: 0.5532
 epoch: 65, train_loss: 0.7758, test_loss: 1.0261, test_f1: 0.5527
 epoch: 66, train_loss: 0.7834, test_loss: 1.0358, test_f1: 0.5611
 epoch: 67, train_loss: 0.7834, test_loss: 1.0543, test_f1: 0.5542
 epoch: 68, train_loss: 0.7648, test_loss: 1.0390, test_f1: 0.5597
 epoch: 69, train_loss: 0.7664, test_loss: 1.0326, test_f1: 0.5488
 epoch: 70, train_loss: 0.7662, test_loss: 1.0370, test_f1: 0.5420
 epoch: 71, train_loss: 0.7734, test_loss: 1.0759, test_f1: 0.5567
 epoch: 72, train_loss: 0.7663, test_loss: 1.0745, test_f1: 0.5618
 epoch: 73, train_loss: 0.7674, test_loss: 1.0431, test_f1: 0.5575
 epoch: 74, train_loss: 0.7492, test_loss: 1.1102, test_f1: 0.5402
 epoch: 75, train_loss: 0.7447, test_loss: 1.0838, test_f1: 0.5507
 epoch: 76, train_loss: 0.7449, test_loss: 1.0354, test_f1: 0.5841
 epoch: 77, train_loss: 0.7423, test_loss: 1.0422, test_f1: 0.5623
 epoch: 78, train_loss: 0.7403, test_loss: 1.0815, test_f1: 0.5544
 epoch: 79, train_loss: 0.7385, test_loss: 1.0931, test_f1: 0.5718
 epoch: 80, train_loss: 0.7329, test_loss: 1.0270, test_f1: 0.5723
 epoch: 81, train_loss: 0.7368, test_loss: 1.0487, test_f1: 0.5721
 epoch: 82, train_loss: 0.7414, test_loss: 1.0859, test_f1: 0.5575
 epoch: 83, train_loss: 0.7382, test_loss: 1.0681, test_f1: 0.5635
 epoch: 84, train_loss: 0.7253, test_loss: 1.0315, test_f1: 0.5799
 epoch: 85, train_loss: 0.7278, test_loss: 1.0671, test_f1: 0.5870
 epoch: 86, train_loss: 0.7234, test_loss: 1.1125, test_f1: 0.5753
 epoch: 87, train_loss: 0.7228, test_loss: 1.1235, test_f1: 0.5572
 epoch: 88, train_loss: 0.7138, test_loss: 1.1293, test_f1: 0.5438
 epoch: 89, train_loss: 0.7237, test_loss: 1.0667, test_f1: 0.5812
 epoch: 90, train_loss: 0.7233, test_loss: 1.1232, test_f1: 0.5658
 epoch: 91, train_loss: 0.7196, test_loss: 1.1385, test_f1: 0.5691
 epoch: 92, train_loss: 0.7099, test_loss: 1.1162, test_f1: 0.5684
 epoch: 93, train_loss: 0.7117, test_loss: 1.0972, test_f1: 0.5665
 epoch: 94, train_loss: 0.7032, test_loss: 1.1117, test_f1: 0.5707
 epoch: 95, train_loss: 0.7155, test_loss: 1.1383, test_f1: 0.5614
 epoch: 96, train_loss: 0.7047, test_loss: 1.1576, test_f1: 0.5733
 epoch: 97, train_loss: 0.7050, test_loss: 1.1429, test_f1: 0.5785
 epoch: 98, train_loss: 0.7000, test_loss: 1.1202, test_f1: 0.5631
 epoch: 99, train_loss: 0.7024, test_loss: 1.1009, test_f1: 0.5861
##################ITERATION #1 ****************************************
 epoch: 0, train_loss: 1.3251, test_loss: 1.3644, test_f1: 0.2281
 epoch: 1, train_loss: 1.2788, test_loss: 1.3599, test_f1: 0.2281
 epoch: 2, train_loss: 1.2552, test_loss: 1.3532, test_f1: 0.2281
 epoch: 3, train_loss: 1.2321, test_loss: 1.3430, test_f1: 0.2281
 epoch: 4, train_loss: 1.2087, test_loss: 1.3321, test_f1: 0.2281
 epoch: 5, train_loss: 1.1927, test_loss: 1.3202, test_f1: 0.2281
 epoch: 6, train_loss: 1.1733, test_loss: 1.3046, test_f1: 0.2651
 epoch: 7, train_loss: 1.1566, test_loss: 1.2877, test_f1: 0.2336
 epoch: 8, train_loss: 1.1421, test_loss: 1.2648, test_f1: 0.2942
 epoch: 9, train_loss: 1.1302, test_loss: 1.2471, test_f1: 0.2732
 epoch: 10, train_loss: 1.1194, test_loss: 1.2289, test_f1: 0.2643
 epoch: 11, train_loss: 1.1083, test_loss: 1.2053, test_f1: 0.3483
 epoch: 12, train_loss: 1.0959, test_loss: 1.1808, test_f1: 0.4072
 epoch: 13, train_loss: 1.0827, test_loss: 1.1616, test_f1: 0.4571
 epoch: 14, train_loss: 1.0801, test_loss: 1.1482, test_f1: 0.4700
 epoch: 15, train_loss: 1.0712, test_loss: 1.1377, test_f1: 0.4891
 epoch: 16, train_loss: 1.0558, test_loss: 1.1285, test_f1: 0.4853
 epoch: 17, train_loss: 1.0477, test_loss: 1.1193, test_f1: 0.4929
 epoch: 18, train_loss: 1.0400, test_loss: 1.1063, test_f1: 0.5246
 epoch: 19, train_loss: 1.0307, test_loss: 1.0977, test_f1: 0.5196
 epoch: 20, train_loss: 1.0188, test_loss: 1.0980, test_f1: 0.5126
 epoch: 21, train_loss: 1.0166, test_loss: 1.0921, test_f1: 0.5167
 epoch: 22, train_loss: 1.0104, test_loss: 1.0856, test_f1: 0.5251
 epoch: 23, train_loss: 0.9965, test_loss: 1.0718, test_f1: 0.5272
 epoch: 24, train_loss: 0.9901, test_loss: 1.0739, test_f1: 0.5344
 epoch: 25, train_loss: 0.9805, test_loss: 1.0701, test_f1: 0.5406
 epoch: 26, train_loss: 0.9666, test_loss: 1.0704, test_f1: 0.5383
 epoch: 27, train_loss: 0.9518, test_loss: 1.0504, test_f1: 0.5423
 epoch: 28, train_loss: 0.9486, test_loss: 1.0530, test_f1: 0.5421
 epoch: 29, train_loss: 0.9444, test_loss: 1.0454, test_f1: 0.5620
 epoch: 30, train_loss: 0.9381, test_loss: 1.0415, test_f1: 0.5446
 epoch: 31, train_loss: 0.9294, test_loss: 1.0562, test_f1: 0.5385
 epoch: 32, train_loss: 0.9207, test_loss: 1.0443, test_f1: 0.5601
 epoch: 33, train_loss: 0.9082, test_loss: 1.0440, test_f1: 0.5517
 epoch: 34, train_loss: 0.9042, test_loss: 1.0173, test_f1: 0.5664
 epoch: 35, train_loss: 0.8969, test_loss: 1.0474, test_f1: 0.5805
 epoch: 36, train_loss: 0.8873, test_loss: 1.0456, test_f1: 0.5808
 epoch: 37, train_loss: 0.8800, test_loss: 1.0478, test_f1: 0.5900
 epoch: 38, train_loss: 0.8685, test_loss: 1.0530, test_f1: 0.5740
 epoch: 39, train_loss: 0.8633, test_loss: 1.0397, test_f1: 0.5786
 epoch: 40, train_loss: 0.8568, test_loss: 1.0420, test_f1: 0.5793
 epoch: 41, train_loss: 0.8472, test_loss: 1.0788, test_f1: 0.5706
 epoch: 42, train_loss: 0.8494, test_loss: 1.0899, test_f1: 0.5747
 epoch: 43, train_loss: 0.8438, test_loss: 1.0875, test_f1: 0.5591
 epoch: 44, train_loss: 0.8389, test_loss: 1.0669, test_f1: 0.5861
 epoch: 45, train_loss: 0.8333, test_loss: 1.0539, test_f1: 0.5679
 epoch: 46, train_loss: 0.8133, test_loss: 1.0706, test_f1: 0.5777
 epoch: 47, train_loss: 0.8154, test_loss: 1.0813, test_f1: 0.5721
 epoch: 48, train_loss: 0.8072, test_loss: 1.1059, test_f1: 0.5620
 epoch: 49, train_loss: 0.7994, test_loss: 1.0855, test_f1: 0.5485
 epoch: 50, train_loss: 0.8027, test_loss: 1.0447, test_f1: 0.5727
 epoch: 51, train_loss: 0.7967, test_loss: 1.0653, test_f1: 0.5657
 epoch: 52, train_loss: 0.7912, test_loss: 1.1189, test_f1: 0.5489
 epoch: 53, train_loss: 0.7939, test_loss: 1.1308, test_f1: 0.5428
 epoch: 54, train_loss: 0.7869, test_loss: 1.1108, test_f1: 0.5621
 epoch: 55, train_loss: 0.7823, test_loss: 1.1119, test_f1: 0.5665
 epoch: 56, train_loss: 0.7767, test_loss: 1.1181, test_f1: 0.5763
 epoch: 57, train_loss: 0.7694, test_loss: 1.1322, test_f1: 0.5604
 epoch: 58, train_loss: 0.7788, test_loss: 1.1333, test_f1: 0.5453
 epoch: 59, train_loss: 0.7615, test_loss: 1.1580, test_f1: 0.5397
 epoch: 60, train_loss: 0.7742, test_loss: 1.1686, test_f1: 0.5420
 epoch: 61, train_loss: 0.7688, test_loss: 1.1420, test_f1: 0.5480
 epoch: 62, train_loss: 0.7585, test_loss: 1.1347, test_f1: 0.5581
 epoch: 63, train_loss: 0.7599, test_loss: 1.1415, test_f1: 0.5722
 epoch: 64, train_loss: 0.7606, test_loss: 1.1295, test_f1: 0.5586
 epoch: 65, train_loss: 0.7471, test_loss: 1.1634, test_f1: 0.5552
 epoch: 66, train_loss: 0.7575, test_loss: 1.1666, test_f1: 0.5459
 epoch: 67, train_loss: 0.7575, test_loss: 1.1505, test_f1: 0.5572
 epoch: 68, train_loss: 0.7416, test_loss: 1.1626, test_f1: 0.5441
 epoch: 69, train_loss: 0.7432, test_loss: 1.1744, test_f1: 0.5382
 epoch: 70, train_loss: 0.7368, test_loss: 1.1968, test_f1: 0.5475
 epoch: 71, train_loss: 0.7415, test_loss: 1.2020, test_f1: 0.5414
 epoch: 72, train_loss: 0.7391, test_loss: 1.1788, test_f1: 0.5500
 epoch: 73, train_loss: 0.7376, test_loss: 1.1582, test_f1: 0.5635
 epoch: 74, train_loss: 0.7344, test_loss: 1.1279, test_f1: 0.5551
 epoch: 75, train_loss: 0.7291, test_loss: 1.1369, test_f1: 0.5635
 epoch: 76, train_loss: 0.7329, test_loss: 1.1906, test_f1: 0.5589
 epoch: 77, train_loss: 0.7336, test_loss: 1.1833, test_f1: 0.5588
 epoch: 78, train_loss: 0.7314, test_loss: 1.2093, test_f1: 0.5512
 epoch: 79, train_loss: 0.7271, test_loss: 1.1723, test_f1: 0.5669
 epoch: 80, train_loss: 0.7262, test_loss: 1.1775, test_f1: 0.5794
 epoch: 81, train_loss: 0.7335, test_loss: 1.2012, test_f1: 0.5836
 epoch: 82, train_loss: 0.7172, test_loss: 1.1842, test_f1: 0.5698
 epoch: 83, train_loss: 0.7183, test_loss: 1.2047, test_f1: 0.5652
 epoch: 84, train_loss: 0.7143, test_loss: 1.1975, test_f1: 0.5463
 epoch: 85, train_loss: 0.7194, test_loss: 1.2066, test_f1: 0.5633
 epoch: 86, train_loss: 0.7227, test_loss: 1.1783, test_f1: 0.5628
 epoch: 87, train_loss: 0.7235, test_loss: 1.1967, test_f1: 0.5614
 epoch: 88, train_loss: 0.7188, test_loss: 1.2050, test_f1: 0.5454
 epoch: 89, train_loss: 0.7088, test_loss: 1.2104, test_f1: 0.5473
 epoch: 90, train_loss: 0.7155, test_loss: 1.2146, test_f1: 0.5494
 epoch: 91, train_loss: 0.7132, test_loss: 1.1909, test_f1: 0.5623
 epoch: 92, train_loss: 0.7067, test_loss: 1.1688, test_f1: 0.5572
 epoch: 93, train_loss: 0.7082, test_loss: 1.1828, test_f1: 0.5670
 epoch: 94, train_loss: 0.7028, test_loss: 1.1985, test_f1: 0.5573
 epoch: 95, train_loss: 0.7024, test_loss: 1.2043, test_f1: 0.5727
 epoch: 96, train_loss: 0.7017, test_loss: 1.2132, test_f1: 0.5809
 epoch: 97, train_loss: 0.7042, test_loss: 1.2021, test_f1: 0.5762
 epoch: 98, train_loss: 0.7013, test_loss: 1.2483, test_f1: 0.5715
 epoch: 99, train_loss: 0.6832, test_loss: 1.2523, test_f1: 0.5685
##################ITERATION #2 ****************************************
 epoch: 0, train_loss: 1.2767, test_loss: 1.3486, test_f1: 0.2281
 epoch: 1, train_loss: 1.2173, test_loss: 1.3446, test_f1: 0.2281
 epoch: 2, train_loss: 1.1907, test_loss: 1.3399, test_f1: 0.2281
 epoch: 3, train_loss: 1.1720, test_loss: 1.3280, test_f1: 0.2281
 epoch: 4, train_loss: 1.1496, test_loss: 1.3070, test_f1: 0.2281
 epoch: 5, train_loss: 1.1334, test_loss: 1.2895, test_f1: 0.2281
 epoch: 6, train_loss: 1.1169, test_loss: 1.2817, test_f1: 0.2390
 epoch: 7, train_loss: 1.1062, test_loss: 1.2698, test_f1: 0.2792
 epoch: 8, train_loss: 1.0875, test_loss: 1.2542, test_f1: 0.3449
 epoch: 9, train_loss: 1.0757, test_loss: 1.2301, test_f1: 0.3739
 epoch: 10, train_loss: 1.0604, test_loss: 1.1771, test_f1: 0.4171
 epoch: 11, train_loss: 1.0555, test_loss: 1.1440, test_f1: 0.4359
 epoch: 12, train_loss: 1.0435, test_loss: 1.1250, test_f1: 0.4414
 epoch: 13, train_loss: 1.0314, test_loss: 1.1118, test_f1: 0.4553
 epoch: 14, train_loss: 1.0240, test_loss: 1.1051, test_f1: 0.4742
 epoch: 15, train_loss: 1.0048, test_loss: 1.1009, test_f1: 0.4650
 epoch: 16, train_loss: 0.9949, test_loss: 1.0860, test_f1: 0.4747
 epoch: 17, train_loss: 0.9875, test_loss: 1.0674, test_f1: 0.4845
 epoch: 18, train_loss: 0.9794, test_loss: 1.0648, test_f1: 0.4909
 epoch: 19, train_loss: 0.9707, test_loss: 1.0631, test_f1: 0.5075
 epoch: 20, train_loss: 0.9596, test_loss: 1.0539, test_f1: 0.5130
 epoch: 21, train_loss: 0.9555, test_loss: 1.0594, test_f1: 0.5334
 epoch: 22, train_loss: 0.9508, test_loss: 1.0629, test_f1: 0.5377
 epoch: 23, train_loss: 0.9328, test_loss: 1.0653, test_f1: 0.5370
 epoch: 24, train_loss: 0.9302, test_loss: 1.0479, test_f1: 0.5373
 epoch: 25, train_loss: 0.9174, test_loss: 1.0311, test_f1: 0.5458
 epoch: 26, train_loss: 0.9032, test_loss: 1.0464, test_f1: 0.5467
 epoch: 27, train_loss: 0.9109, test_loss: 1.0373, test_f1: 0.5476
 epoch: 28, train_loss: 0.8974, test_loss: 1.0240, test_f1: 0.5581
 epoch: 29, train_loss: 0.8888, test_loss: 1.0393, test_f1: 0.5570
 epoch: 30, train_loss: 0.8864, test_loss: 1.0585, test_f1: 0.5438
 epoch: 31, train_loss: 0.8813, test_loss: 1.0438, test_f1: 0.5499
 epoch: 32, train_loss: 0.8669, test_loss: 1.0351, test_f1: 0.5527
 epoch: 33, train_loss: 0.8644, test_loss: 1.0258, test_f1: 0.5627
 epoch: 34, train_loss: 0.8637, test_loss: 1.0715, test_f1: 0.5481
 epoch: 35, train_loss: 0.8599, test_loss: 1.0361, test_f1: 0.5534
 epoch: 36, train_loss: 0.8530, test_loss: 1.0220, test_f1: 0.5514
 epoch: 37, train_loss: 0.8498, test_loss: 1.0399, test_f1: 0.5616
 epoch: 38, train_loss: 0.8444, test_loss: 1.0225, test_f1: 0.5595
 epoch: 39, train_loss: 0.8382, test_loss: 1.0377, test_f1: 0.5488
 epoch: 40, train_loss: 0.8351, test_loss: 1.0199, test_f1: 0.5383
 epoch: 41, train_loss: 0.8226, test_loss: 1.0387, test_f1: 0.5354
 epoch: 42, train_loss: 0.8149, test_loss: 1.0502, test_f1: 0.5604
 epoch: 43, train_loss: 0.8088, test_loss: 1.0644, test_f1: 0.5597
 epoch: 44, train_loss: 0.8130, test_loss: 1.0767, test_f1: 0.5674
 epoch: 45, train_loss: 0.8055, test_loss: 1.0830, test_f1: 0.5606
 epoch: 46, train_loss: 0.7994, test_loss: 1.0856, test_f1: 0.5642
 epoch: 47, train_loss: 0.7954, test_loss: 1.0800, test_f1: 0.5633
 epoch: 48, train_loss: 0.7892, test_loss: 1.0703, test_f1: 0.5536
 epoch: 49, train_loss: 0.7810, test_loss: 1.0678, test_f1: 0.5535
 epoch: 50, train_loss: 0.7915, test_loss: 1.0820, test_f1: 0.5652
 epoch: 51, train_loss: 0.7795, test_loss: 1.0780, test_f1: 0.5591
 epoch: 52, train_loss: 0.7721, test_loss: 1.0929, test_f1: 0.5659
 epoch: 53, train_loss: 0.7724, test_loss: 1.0874, test_f1: 0.5636
 epoch: 54, train_loss: 0.7619, test_loss: 1.0861, test_f1: 0.5760
 epoch: 55, train_loss: 0.7679, test_loss: 1.1065, test_f1: 0.5662
 epoch: 56, train_loss: 0.7624, test_loss: 1.1028, test_f1: 0.5650
 epoch: 57, train_loss: 0.7678, test_loss: 1.1093, test_f1: 0.5622
 epoch: 58, train_loss: 0.7677, test_loss: 1.1334, test_f1: 0.5528
 epoch: 59, train_loss: 0.7559, test_loss: 1.1247, test_f1: 0.5746
 epoch: 60, train_loss: 0.7497, test_loss: 1.1126, test_f1: 0.5745
 epoch: 61, train_loss: 0.7442, test_loss: 1.0959, test_f1: 0.5717
 epoch: 62, train_loss: 0.7531, test_loss: 1.1099, test_f1: 0.5468
 epoch: 63, train_loss: 0.7464, test_loss: 1.1204, test_f1: 0.5568
 epoch: 64, train_loss: 0.7413, test_loss: 1.1175, test_f1: 0.5586
 epoch: 65, train_loss: 0.7310, test_loss: 1.1195, test_f1: 0.5670
 epoch: 66, train_loss: 0.7326, test_loss: 1.1363, test_f1: 0.5639
 epoch: 67, train_loss: 0.7287, test_loss: 1.1454, test_f1: 0.5631
 epoch: 68, train_loss: 0.7295, test_loss: 1.1522, test_f1: 0.5637
 epoch: 69, train_loss: 0.7283, test_loss: 1.1453, test_f1: 0.5584
 epoch: 70, train_loss: 0.7220, test_loss: 1.1678, test_f1: 0.5519
 epoch: 71, train_loss: 0.7318, test_loss: 1.1744, test_f1: 0.5593
 epoch: 72, train_loss: 0.7208, test_loss: 1.1735, test_f1: 0.5642
 epoch: 73, train_loss: 0.7133, test_loss: 1.1538, test_f1: 0.5678
 epoch: 74, train_loss: 0.7224, test_loss: 1.1680, test_f1: 0.5623
 epoch: 75, train_loss: 0.7221, test_loss: 1.2134, test_f1: 0.5707
 epoch: 76, train_loss: 0.7231, test_loss: 1.2439, test_f1: 0.5553
 epoch: 77, train_loss: 0.7125, test_loss: 1.2438, test_f1: 0.5555
 epoch: 78, train_loss: 0.7082, test_loss: 1.2488, test_f1: 0.5720
 epoch: 79, train_loss: 0.7113, test_loss: 1.2524, test_f1: 0.5562
 epoch: 80, train_loss: 0.7087, test_loss: 1.2614, test_f1: 0.5554
 epoch: 81, train_loss: 0.6998, test_loss: 1.2250, test_f1: 0.5640
 epoch: 82, train_loss: 0.7007, test_loss: 1.2040, test_f1: 0.5777
 epoch: 83, train_loss: 0.6970, test_loss: 1.2216, test_f1: 0.5550
 epoch: 84, train_loss: 0.7055, test_loss: 1.2089, test_f1: 0.5676
 epoch: 85, train_loss: 0.6994, test_loss: 1.2258, test_f1: 0.5544
 epoch: 86, train_loss: 0.6965, test_loss: 1.2234, test_f1: 0.5657
 epoch: 87, train_loss: 0.7001, test_loss: 1.2276, test_f1: 0.5702
 epoch: 88, train_loss: 0.6942, test_loss: 1.2491, test_f1: 0.5590
 epoch: 89, train_loss: 0.6916, test_loss: 1.2738, test_f1: 0.5594
 epoch: 90, train_loss: 0.6899, test_loss: 1.2734, test_f1: 0.5646
 epoch: 91, train_loss: 0.6855, test_loss: 1.2582, test_f1: 0.5616
 epoch: 92, train_loss: 0.6985, test_loss: 1.2270, test_f1: 0.5578
 epoch: 93, train_loss: 0.6904, test_loss: 1.2492, test_f1: 0.5540
 epoch: 94, train_loss: 0.6869, test_loss: 1.2632, test_f1: 0.5542
 epoch: 95, train_loss: 0.6919, test_loss: 1.2918, test_f1: 0.5530
 epoch: 96, train_loss: 0.6824, test_loss: 1.2743, test_f1: 0.5579
 epoch: 97, train_loss: 0.6775, test_loss: 1.2709, test_f1: 0.5619
 epoch: 98, train_loss: 0.6880, test_loss: 1.2523, test_f1: 0.5716
 epoch: 99, train_loss: 0.6689, test_loss: 1.2851, test_f1: 0.5688
##################ITERATION #3 ****************************************
 epoch: 0, train_loss: 1.2730, test_loss: 1.3475, test_f1: 0.2281
 epoch: 1, train_loss: 1.1917, test_loss: 1.3408, test_f1: 0.2281
 epoch: 2, train_loss: 1.1655, test_loss: 1.3362, test_f1: 0.2281
 epoch: 3, train_loss: 1.1342, test_loss: 1.3259, test_f1: 0.2281
 epoch: 4, train_loss: 1.1161, test_loss: 1.3026, test_f1: 0.2336
 epoch: 5, train_loss: 1.1019, test_loss: 1.2732, test_f1: 0.2901
 epoch: 6, train_loss: 1.0850, test_loss: 1.2408, test_f1: 0.3072
 epoch: 7, train_loss: 1.0663, test_loss: 1.2085, test_f1: 0.3632
 epoch: 8, train_loss: 1.0544, test_loss: 1.1813, test_f1: 0.3893
 epoch: 9, train_loss: 1.0429, test_loss: 1.1678, test_f1: 0.4200
 epoch: 10, train_loss: 1.0251, test_loss: 1.1547, test_f1: 0.4531
 epoch: 11, train_loss: 1.0141, test_loss: 1.1428, test_f1: 0.4774
 epoch: 12, train_loss: 1.0126, test_loss: 1.1231, test_f1: 0.4771
 epoch: 13, train_loss: 0.9927, test_loss: 1.1130, test_f1: 0.4887
 epoch: 14, train_loss: 0.9821, test_loss: 1.1017, test_f1: 0.5047
 epoch: 15, train_loss: 0.9802, test_loss: 1.0990, test_f1: 0.5118
 epoch: 16, train_loss: 0.9643, test_loss: 1.1024, test_f1: 0.5226
 epoch: 17, train_loss: 0.9559, test_loss: 1.1148, test_f1: 0.5189
 epoch: 18, train_loss: 0.9505, test_loss: 1.1387, test_f1: 0.5257
 epoch: 19, train_loss: 0.9475, test_loss: 1.1412, test_f1: 0.5277
 epoch: 20, train_loss: 0.9340, test_loss: 1.1092, test_f1: 0.5384
 epoch: 21, train_loss: 0.9269, test_loss: 1.0814, test_f1: 0.5509
 epoch: 22, train_loss: 0.9205, test_loss: 1.0857, test_f1: 0.5466
 epoch: 23, train_loss: 0.9096, test_loss: 1.0813, test_f1: 0.5364
 epoch: 24, train_loss: 0.9192, test_loss: 1.0759, test_f1: 0.5325
 epoch: 25, train_loss: 0.9047, test_loss: 1.0868, test_f1: 0.5328
 epoch: 26, train_loss: 0.8924, test_loss: 1.0878, test_f1: 0.5544
 epoch: 27, train_loss: 0.8828, test_loss: 1.0865, test_f1: 0.5622
 epoch: 28, train_loss: 0.8849, test_loss: 1.0603, test_f1: 0.5592
 epoch: 29, train_loss: 0.8666, test_loss: 1.0711, test_f1: 0.5592
 epoch: 30, train_loss: 0.8673, test_loss: 1.0689, test_f1: 0.5632
 epoch: 31, train_loss: 0.8526, test_loss: 1.0849, test_f1: 0.5658
 epoch: 32, train_loss: 0.8629, test_loss: 1.0747, test_f1: 0.5672
 epoch: 33, train_loss: 0.8416, test_loss: 1.0937, test_f1: 0.5564
 epoch: 34, train_loss: 0.8372, test_loss: 1.0797, test_f1: 0.5680
 epoch: 35, train_loss: 0.8457, test_loss: 1.0798, test_f1: 0.5604
 epoch: 36, train_loss: 0.8278, test_loss: 1.0672, test_f1: 0.5663
 epoch: 37, train_loss: 0.8279, test_loss: 1.0802, test_f1: 0.5719
 epoch: 38, train_loss: 0.8173, test_loss: 1.0600, test_f1: 0.5727
 epoch: 39, train_loss: 0.8119, test_loss: 1.0591, test_f1: 0.5715
 epoch: 40, train_loss: 0.8109, test_loss: 1.0628, test_f1: 0.5774
 epoch: 41, train_loss: 0.8026, test_loss: 1.0840, test_f1: 0.5655
 epoch: 42, train_loss: 0.7934, test_loss: 1.0982, test_f1: 0.5695
 epoch: 43, train_loss: 0.7964, test_loss: 1.0890, test_f1: 0.5668
 epoch: 44, train_loss: 0.7896, test_loss: 1.0902, test_f1: 0.5749
 epoch: 45, train_loss: 0.7918, test_loss: 1.0621, test_f1: 0.5826
 epoch: 46, train_loss: 0.7801, test_loss: 1.0692, test_f1: 0.5642
 epoch: 47, train_loss: 0.7725, test_loss: 1.0906, test_f1: 0.5717
 epoch: 48, train_loss: 0.7744, test_loss: 1.0871, test_f1: 0.5701
 epoch: 49, train_loss: 0.7685, test_loss: 1.0967, test_f1: 0.5688
 epoch: 50, train_loss: 0.7706, test_loss: 1.0947, test_f1: 0.5769
 epoch: 51, train_loss: 0.7570, test_loss: 1.0968, test_f1: 0.5850
 epoch: 52, train_loss: 0.7514, test_loss: 1.1077, test_f1: 0.5714
 epoch: 53, train_loss: 0.7451, test_loss: 1.0992, test_f1: 0.5746
 epoch: 54, train_loss: 0.7529, test_loss: 1.0932, test_f1: 0.5772
 epoch: 55, train_loss: 0.7366, test_loss: 1.0934, test_f1: 0.5755
 epoch: 56, train_loss: 0.7398, test_loss: 1.0780, test_f1: 0.5768
 epoch: 57, train_loss: 0.7431, test_loss: 1.0874, test_f1: 0.5829
 epoch: 58, train_loss: 0.7399, test_loss: 1.1067, test_f1: 0.5946
 epoch: 59, train_loss: 0.7256, test_loss: 1.1259, test_f1: 0.5661
 epoch: 60, train_loss: 0.7177, test_loss: 1.1233, test_f1: 0.5799
 epoch: 61, train_loss: 0.7217, test_loss: 1.1078, test_f1: 0.5705
 epoch: 62, train_loss: 0.7196, test_loss: 1.1233, test_f1: 0.5619
 epoch: 63, train_loss: 0.7184, test_loss: 1.1238, test_f1: 0.5567
 epoch: 64, train_loss: 0.7238, test_loss: 1.1440, test_f1: 0.5584
 epoch: 65, train_loss: 0.7226, test_loss: 1.1278, test_f1: 0.5642
 epoch: 66, train_loss: 0.7106, test_loss: 1.1391, test_f1: 0.5600
 epoch: 67, train_loss: 0.7092, test_loss: 1.1385, test_f1: 0.5520
 epoch: 68, train_loss: 0.7166, test_loss: 1.1284, test_f1: 0.5635
 epoch: 69, train_loss: 0.7056, test_loss: 1.1450, test_f1: 0.5529
 epoch: 70, train_loss: 0.7124, test_loss: 1.1447, test_f1: 0.5710
 epoch: 71, train_loss: 0.6996, test_loss: 1.1337, test_f1: 0.5697
 epoch: 72, train_loss: 0.7085, test_loss: 1.1483, test_f1: 0.5608
 epoch: 73, train_loss: 0.6869, test_loss: 1.1640, test_f1: 0.5618
 epoch: 74, train_loss: 0.6992, test_loss: 1.1439, test_f1: 0.5536
 epoch: 75, train_loss: 0.6971, test_loss: 1.1519, test_f1: 0.5584
 epoch: 76, train_loss: 0.7012, test_loss: 1.1362, test_f1: 0.5638
 epoch: 77, train_loss: 0.6824, test_loss: 1.1608, test_f1: 0.5715
 epoch: 78, train_loss: 0.6909, test_loss: 1.1700, test_f1: 0.5779
 epoch: 79, train_loss: 0.6939, test_loss: 1.1660, test_f1: 0.5656
 epoch: 80, train_loss: 0.6872, test_loss: 1.1589, test_f1: 0.5685
 epoch: 81, train_loss: 0.6759, test_loss: 1.1370, test_f1: 0.5814
 epoch: 82, train_loss: 0.6892, test_loss: 1.1656, test_f1: 0.5773
 epoch: 83, train_loss: 0.6815, test_loss: 1.1768, test_f1: 0.5822
 epoch: 84, train_loss: 0.6768, test_loss: 1.1523, test_f1: 0.5891
 epoch: 85, train_loss: 0.6755, test_loss: 1.1511, test_f1: 0.5814
 epoch: 86, train_loss: 0.6855, test_loss: 1.1430, test_f1: 0.5854
 epoch: 87, train_loss: 0.6696, test_loss: 1.1555, test_f1: 0.5778
 epoch: 88, train_loss: 0.6688, test_loss: 1.1295, test_f1: 0.5731
 epoch: 89, train_loss: 0.6622, test_loss: 1.1739, test_f1: 0.5770
 epoch: 90, train_loss: 0.6762, test_loss: 1.2084, test_f1: 0.5762
 epoch: 91, train_loss: 0.6640, test_loss: 1.1878, test_f1: 0.5787
 epoch: 92, train_loss: 0.6712, test_loss: 1.1838, test_f1: 0.5661
 epoch: 93, train_loss: 0.6655, test_loss: 1.1923, test_f1: 0.5628
 epoch: 94, train_loss: 0.6665, test_loss: 1.2366, test_f1: 0.5765
 epoch: 95, train_loss: 0.6518, test_loss: 1.1726, test_f1: 0.5717
 epoch: 96, train_loss: 0.6534, test_loss: 1.1762, test_f1: 0.5708
 epoch: 97, train_loss: 0.6580, test_loss: 1.1677, test_f1: 0.5735
 epoch: 98, train_loss: 0.6567, test_loss: 1.1886, test_f1: 0.5872
 epoch: 99, train_loss: 0.6451, test_loss: 1.2204, test_f1: 0.5785
##################ITERATION #4 ****************************************
 epoch: 0, train_loss: 1.2566, test_loss: 1.3281, test_f1: 0.2281
 epoch: 1, train_loss: 1.1889, test_loss: 1.3206, test_f1: 0.2281
 epoch: 2, train_loss: 1.1614, test_loss: 1.3178, test_f1: 0.2281
 epoch: 3, train_loss: 1.1343, test_loss: 1.3098, test_f1: 0.2281
 epoch: 4, train_loss: 1.1176, test_loss: 1.2983, test_f1: 0.2281
 epoch: 5, train_loss: 1.1065, test_loss: 1.2797, test_f1: 0.2281
 epoch: 6, train_loss: 1.0861, test_loss: 1.2634, test_f1: 0.2544
 epoch: 7, train_loss: 1.0848, test_loss: 1.2621, test_f1: 0.3381
 epoch: 8, train_loss: 1.0618, test_loss: 1.2466, test_f1: 0.4064
 epoch: 9, train_loss: 1.0527, test_loss: 1.2222, test_f1: 0.4280
 epoch: 10, train_loss: 1.0463, test_loss: 1.1862, test_f1: 0.4144
 epoch: 11, train_loss: 1.0395, test_loss: 1.1743, test_f1: 0.4328
 epoch: 12, train_loss: 1.0216, test_loss: 1.1551, test_f1: 0.4459
 epoch: 13, train_loss: 1.0121, test_loss: 1.1185, test_f1: 0.4673
 epoch: 14, train_loss: 1.0064, test_loss: 1.1195, test_f1: 0.4960
 epoch: 15, train_loss: 0.9983, test_loss: 1.1030, test_f1: 0.5271
 epoch: 16, train_loss: 0.9883, test_loss: 1.0867, test_f1: 0.5232
 epoch: 17, train_loss: 0.9836, test_loss: 1.0863, test_f1: 0.5222
 epoch: 18, train_loss: 0.9746, test_loss: 1.0845, test_f1: 0.5280
 epoch: 19, train_loss: 0.9691, test_loss: 1.0891, test_f1: 0.5058
 epoch: 20, train_loss: 0.9547, test_loss: 1.0846, test_f1: 0.5145
 epoch: 21, train_loss: 0.9527, test_loss: 1.0896, test_f1: 0.4953
 epoch: 22, train_loss: 0.9423, test_loss: 1.0699, test_f1: 0.5287
 epoch: 23, train_loss: 0.9388, test_loss: 1.0696, test_f1: 0.5265
 epoch: 24, train_loss: 0.9327, test_loss: 1.0391, test_f1: 0.5239
 epoch: 25, train_loss: 0.9206, test_loss: 1.0370, test_f1: 0.5461
 epoch: 26, train_loss: 0.9236, test_loss: 1.0367, test_f1: 0.5342
 epoch: 27, train_loss: 0.9110, test_loss: 1.0328, test_f1: 0.5199
 epoch: 28, train_loss: 0.9082, test_loss: 1.0456, test_f1: 0.5417
 epoch: 29, train_loss: 0.8953, test_loss: 1.0138, test_f1: 0.5379
 epoch: 30, train_loss: 0.8875, test_loss: 0.9985, test_f1: 0.5467
 epoch: 31, train_loss: 0.8842, test_loss: 1.0210, test_f1: 0.5400
 epoch: 32, train_loss: 0.8735, test_loss: 1.0218, test_f1: 0.5426
 epoch: 33, train_loss: 0.8581, test_loss: 1.0244, test_f1: 0.5280
 epoch: 34, train_loss: 0.8574, test_loss: 1.0264, test_f1: 0.5624
 epoch: 35, train_loss: 0.8475, test_loss: 1.0517, test_f1: 0.5449
 epoch: 36, train_loss: 0.8420, test_loss: 1.0607, test_f1: 0.5109
 epoch: 37, train_loss: 0.8389, test_loss: 1.0153, test_f1: 0.5620
 epoch: 38, train_loss: 0.8448, test_loss: 1.0124, test_f1: 0.5375
 epoch: 39, train_loss: 0.8428, test_loss: 1.0621, test_f1: 0.5159
 epoch: 40, train_loss: 0.8539, test_loss: 1.0152, test_f1: 0.5426
 epoch: 41, train_loss: 0.8389, test_loss: 1.0146, test_f1: 0.5558
 epoch: 42, train_loss: 0.8354, test_loss: 1.0790, test_f1: 0.5507
 epoch: 43, train_loss: 0.8312, test_loss: 1.1119, test_f1: 0.5066
 epoch: 44, train_loss: 0.8263, test_loss: 1.0044, test_f1: 0.5504
 epoch: 45, train_loss: 0.8253, test_loss: 1.0413, test_f1: 0.5598
 epoch: 46, train_loss: 0.8293, test_loss: 1.0783, test_f1: 0.5578
 epoch: 47, train_loss: 0.8220, test_loss: 1.0620, test_f1: 0.5780
 epoch: 48, train_loss: 0.8054, test_loss: 1.0521, test_f1: 0.5740
 epoch: 49, train_loss: 0.7888, test_loss: 1.0503, test_f1: 0.5825
 epoch: 50, train_loss: 0.8075, test_loss: 1.0796, test_f1: 0.5658
 epoch: 51, train_loss: 0.7942, test_loss: 1.1026, test_f1: 0.5720
 epoch: 52, train_loss: 0.7824, test_loss: 1.1010, test_f1: 0.5606
 epoch: 53, train_loss: 0.7753, test_loss: 1.0869, test_f1: 0.5740
 epoch: 54, train_loss: 0.7642, test_loss: 1.0942, test_f1: 0.5827
 epoch: 55, train_loss: 0.7763, test_loss: 1.0903, test_f1: 0.5795
 epoch: 56, train_loss: 0.7707, test_loss: 1.0574, test_f1: 0.6001
 epoch: 57, train_loss: 0.7755, test_loss: 1.0678, test_f1: 0.5995
 epoch: 58, train_loss: 0.7747, test_loss: 1.0525, test_f1: 0.5852
 epoch: 59, train_loss: 0.7604, test_loss: 1.0488, test_f1: 0.5865
 epoch: 60, train_loss: 0.7499, test_loss: 1.0380, test_f1: 0.5906
 epoch: 61, train_loss: 0.7574, test_loss: 1.0510, test_f1: 0.5647
 epoch: 62, train_loss: 0.7525, test_loss: 1.1009, test_f1: 0.5537
 epoch: 63, train_loss: 0.7483, test_loss: 1.1021, test_f1: 0.5603
 epoch: 64, train_loss: 0.7470, test_loss: 1.0598, test_f1: 0.5770
 epoch: 65, train_loss: 0.7438, test_loss: 1.0410, test_f1: 0.5811
 epoch: 66, train_loss: 0.7296, test_loss: 1.0486, test_f1: 0.5763
 epoch: 67, train_loss: 0.7339, test_loss: 1.0580, test_f1: 0.5851
 epoch: 68, train_loss: 0.7452, test_loss: 1.0681, test_f1: 0.5745
 epoch: 69, train_loss: 0.7385, test_loss: 1.0909, test_f1: 0.5669
 epoch: 70, train_loss: 0.7373, test_loss: 1.1117, test_f1: 0.5616
 epoch: 71, train_loss: 0.7354, test_loss: 1.1102, test_f1: 0.5641
 epoch: 72, train_loss: 0.7383, test_loss: 1.0787, test_f1: 0.5875
 epoch: 73, train_loss: 0.7414, test_loss: 1.0867, test_f1: 0.5829
 epoch: 74, train_loss: 0.7251, test_loss: 1.0990, test_f1: 0.5674
 epoch: 75, train_loss: 0.7165, test_loss: 1.1500, test_f1: 0.5509
 epoch: 76, train_loss: 0.7401, test_loss: 1.1252, test_f1: 0.5560
 epoch: 77, train_loss: 0.7238, test_loss: 1.1141, test_f1: 0.5878
 epoch: 78, train_loss: 0.7239, test_loss: 1.1244, test_f1: 0.5643
 epoch: 79, train_loss: 0.7123, test_loss: 1.1529, test_f1: 0.5719
 epoch: 80, train_loss: 0.7178, test_loss: 1.1593, test_f1: 0.5725
 epoch: 81, train_loss: 0.7200, test_loss: 1.1468, test_f1: 0.5828
 epoch: 82, train_loss: 0.7123, test_loss: 1.1265, test_f1: 0.5862
 epoch: 83, train_loss: 0.7088, test_loss: 1.1179, test_f1: 0.5915
 epoch: 84, train_loss: 0.7080, test_loss: 1.0921, test_f1: 0.5752
 epoch: 85, train_loss: 0.7123, test_loss: 1.1224, test_f1: 0.5641
 epoch: 86, train_loss: 0.7019, test_loss: 1.1326, test_f1: 0.5643
 epoch: 87, train_loss: 0.7039, test_loss: 1.1398, test_f1: 0.5905
 epoch: 88, train_loss: 0.7095, test_loss: 1.1459, test_f1: 0.5830
 epoch: 89, train_loss: 0.6961, test_loss: 1.2706, test_f1: 0.5332
 epoch: 90, train_loss: 0.7129, test_loss: 1.1582, test_f1: 0.5581
 epoch: 91, train_loss: 0.7161, test_loss: 1.1391, test_f1: 0.5492
 epoch: 92, train_loss: 0.7075, test_loss: 1.1386, test_f1: 0.5678
 epoch: 93, train_loss: 0.7053, test_loss: 1.1616, test_f1: 0.5721
 epoch: 94, train_loss: 0.6961, test_loss: 1.1734, test_f1: 0.5721
 epoch: 95, train_loss: 0.6935, test_loss: 1.1872, test_f1: 0.5903
 epoch: 96, train_loss: 0.6908, test_loss: 1.1739, test_f1: 0.5777
 epoch: 97, train_loss: 0.6946, test_loss: 1.1796, test_f1: 0.5739
 epoch: 98, train_loss: 0.6875, test_loss: 1.1624, test_f1: 0.5858
 epoch: 99, train_loss: 0.6919, test_loss: 1.1568, test_f1: 0.5772
##################ITERATION #5 ****************************************
 epoch: 0, train_loss: 1.2270, test_loss: 1.3727, test_f1: 0.2281
 epoch: 1, train_loss: 1.1424, test_loss: 1.3714, test_f1: 0.2281
 epoch: 2, train_loss: 1.1186, test_loss: 1.3677, test_f1: 0.3115
 epoch: 3, train_loss: 1.0880, test_loss: 1.3668, test_f1: 0.2350
 epoch: 4, train_loss: 1.0777, test_loss: 1.3511, test_f1: 0.2957
 epoch: 5, train_loss: 1.0598, test_loss: 1.3280, test_f1: 0.3218
 epoch: 6, train_loss: 1.0465, test_loss: 1.2886, test_f1: 0.3689
 epoch: 7, train_loss: 1.0382, test_loss: 1.2456, test_f1: 0.4275
 epoch: 8, train_loss: 1.0220, test_loss: 1.2048, test_f1: 0.4250
 epoch: 9, train_loss: 1.0089, test_loss: 1.1718, test_f1: 0.4624
 epoch: 10, train_loss: 0.9971, test_loss: 1.1470, test_f1: 0.4982
 epoch: 11, train_loss: 0.9870, test_loss: 1.1157, test_f1: 0.4856
 epoch: 12, train_loss: 0.9799, test_loss: 1.0921, test_f1: 0.4938
 epoch: 13, train_loss: 0.9736, test_loss: 1.0683, test_f1: 0.4887
 epoch: 14, train_loss: 0.9646, test_loss: 1.0554, test_f1: 0.5063
 epoch: 15, train_loss: 0.9472, test_loss: 1.0515, test_f1: 0.5015
 epoch: 16, train_loss: 0.9489, test_loss: 1.0547, test_f1: 0.5073
 epoch: 17, train_loss: 0.9301, test_loss: 1.0620, test_f1: 0.5136
 epoch: 18, train_loss: 0.9260, test_loss: 1.0562, test_f1: 0.5157
 epoch: 19, train_loss: 0.9160, test_loss: 1.0403, test_f1: 0.5086
 epoch: 20, train_loss: 0.9083, test_loss: 1.0206, test_f1: 0.5212
 epoch: 21, train_loss: 0.9045, test_loss: 1.0342, test_f1: 0.5311
 epoch: 22, train_loss: 0.9099, test_loss: 1.0591, test_f1: 0.5501
 epoch: 23, train_loss: 0.9091, test_loss: 1.0700, test_f1: 0.5347
 epoch: 24, train_loss: 0.8948, test_loss: 1.0336, test_f1: 0.5398
 epoch: 25, train_loss: 0.8865, test_loss: 1.0128, test_f1: 0.5316
 epoch: 26, train_loss: 0.8670, test_loss: 1.0232, test_f1: 0.5320
 epoch: 27, train_loss: 0.8672, test_loss: 1.0250, test_f1: 0.5378
 epoch: 28, train_loss: 0.8615, test_loss: 1.0288, test_f1: 0.5341
 epoch: 29, train_loss: 0.8521, test_loss: 1.0358, test_f1: 0.5471
 epoch: 30, train_loss: 0.8487, test_loss: 1.0444, test_f1: 0.5444
 epoch: 31, train_loss: 0.8439, test_loss: 1.0159, test_f1: 0.5467
 epoch: 32, train_loss: 0.8469, test_loss: 1.0416, test_f1: 0.5433
 epoch: 33, train_loss: 0.8344, test_loss: 1.0350, test_f1: 0.5546
 epoch: 34, train_loss: 0.8385, test_loss: 1.0159, test_f1: 0.5672
 epoch: 35, train_loss: 0.8211, test_loss: 1.0077, test_f1: 0.5669
 epoch: 36, train_loss: 0.8337, test_loss: 1.0502, test_f1: 0.5410
 epoch: 37, train_loss: 0.8269, test_loss: 1.0265, test_f1: 0.5522
 epoch: 38, train_loss: 0.8191, test_loss: 0.9948, test_f1: 0.5602
 epoch: 39, train_loss: 0.8173, test_loss: 1.0572, test_f1: 0.5605
 epoch: 40, train_loss: 0.8175, test_loss: 1.0127, test_f1: 0.5703
 epoch: 41, train_loss: 0.7984, test_loss: 1.0144, test_f1: 0.5760
 epoch: 42, train_loss: 0.8094, test_loss: 1.0227, test_f1: 0.5734
 epoch: 43, train_loss: 0.8061, test_loss: 1.0356, test_f1: 0.5683
 epoch: 44, train_loss: 0.7940, test_loss: 1.0564, test_f1: 0.5636
 epoch: 45, train_loss: 0.7917, test_loss: 1.0538, test_f1: 0.5734
 epoch: 46, train_loss: 0.7953, test_loss: 1.0395, test_f1: 0.5755
 epoch: 47, train_loss: 0.7874, test_loss: 1.0067, test_f1: 0.5799
 epoch: 48, train_loss: 0.7781, test_loss: 1.0370, test_f1: 0.5670
 epoch: 49, train_loss: 0.7798, test_loss: 1.0509, test_f1: 0.5677
 epoch: 50, train_loss: 0.7632, test_loss: 1.0248, test_f1: 0.5844
 epoch: 51, train_loss: 0.7582, test_loss: 1.0209, test_f1: 0.5717
 epoch: 52, train_loss: 0.7540, test_loss: 1.0260, test_f1: 0.5590
 epoch: 53, train_loss: 0.7536, test_loss: 1.0243, test_f1: 0.5699
 epoch: 54, train_loss: 0.7646, test_loss: 1.0253, test_f1: 0.5785
 epoch: 55, train_loss: 0.7530, test_loss: 1.0548, test_f1: 0.5743
 epoch: 56, train_loss: 0.7509, test_loss: 1.0545, test_f1: 0.5805
 epoch: 57, train_loss: 0.7426, test_loss: 1.0120, test_f1: 0.5885
 epoch: 58, train_loss: 0.7553, test_loss: 1.0226, test_f1: 0.5871
 epoch: 59, train_loss: 0.7346, test_loss: 1.0598, test_f1: 0.5772
 epoch: 60, train_loss: 0.7370, test_loss: 1.0766, test_f1: 0.5826
 epoch: 61, train_loss: 0.7473, test_loss: 1.0700, test_f1: 0.5816
 epoch: 62, train_loss: 0.7280, test_loss: 1.0452, test_f1: 0.5822
 epoch: 63, train_loss: 0.7422, test_loss: 1.0451, test_f1: 0.5800
 epoch: 64, train_loss: 0.7338, test_loss: 1.0392, test_f1: 0.5851
 epoch: 65, train_loss: 0.7356, test_loss: 1.0739, test_f1: 0.5759
 epoch: 66, train_loss: 0.7284, test_loss: 1.1322, test_f1: 0.5660
 epoch: 67, train_loss: 0.7297, test_loss: 1.1081, test_f1: 0.5687
 epoch: 68, train_loss: 0.7219, test_loss: 1.0818, test_f1: 0.5763
 epoch: 69, train_loss: 0.7226, test_loss: 1.1072, test_f1: 0.5645
 epoch: 70, train_loss: 0.7225, test_loss: 1.0983, test_f1: 0.5726
 epoch: 71, train_loss: 0.7152, test_loss: 1.0783, test_f1: 0.5874
 epoch: 72, train_loss: 0.7135, test_loss: 1.0667, test_f1: 0.5846
 epoch: 73, train_loss: 0.7141, test_loss: 1.0728, test_f1: 0.5904
 epoch: 74, train_loss: 0.7171, test_loss: 1.1031, test_f1: 0.5822
 epoch: 75, train_loss: 0.7180, test_loss: 1.0948, test_f1: 0.5833
 epoch: 76, train_loss: 0.7225, test_loss: 1.0756, test_f1: 0.5933
 epoch: 77, train_loss: 0.7098, test_loss: 1.1195, test_f1: 0.5696
 epoch: 78, train_loss: 0.7167, test_loss: 1.0906, test_f1: 0.5850
 epoch: 79, train_loss: 0.7086, test_loss: 1.0967, test_f1: 0.5796
 epoch: 80, train_loss: 0.7043, test_loss: 1.1074, test_f1: 0.5754
 epoch: 81, train_loss: 0.6879, test_loss: 1.0803, test_f1: 0.5877
 epoch: 82, train_loss: 0.6970, test_loss: 1.0969, test_f1: 0.5821
 epoch: 83, train_loss: 0.6987, test_loss: 1.1044, test_f1: 0.5774
 epoch: 84, train_loss: 0.7032, test_loss: 1.0795, test_f1: 0.5812
 epoch: 85, train_loss: 0.6959, test_loss: 1.1138, test_f1: 0.5810
 epoch: 86, train_loss: 0.6888, test_loss: 1.1650, test_f1: 0.5661
 epoch: 87, train_loss: 0.6948, test_loss: 1.1651, test_f1: 0.5723
 epoch: 88, train_loss: 0.6890, test_loss: 1.1508, test_f1: 0.5672
 epoch: 89, train_loss: 0.6822, test_loss: 1.1446, test_f1: 0.5759
 epoch: 90, train_loss: 0.6780, test_loss: 1.1363, test_f1: 0.5770
 epoch: 91, train_loss: 0.6747, test_loss: 1.1560, test_f1: 0.5783
 epoch: 92, train_loss: 0.6778, test_loss: 1.1405, test_f1: 0.5772
 epoch: 93, train_loss: 0.6788, test_loss: 1.1166, test_f1: 0.5837
 epoch: 94, train_loss: 0.6748, test_loss: 1.1116, test_f1: 0.5780
 epoch: 95, train_loss: 0.6678, test_loss: 1.1369, test_f1: 0.5726
 epoch: 96, train_loss: 0.6771, test_loss: 1.1243, test_f1: 0.5823
 epoch: 97, train_loss: 0.6748, test_loss: 1.1260, test_f1: 0.5944
 epoch: 98, train_loss: 0.6675, test_loss: 1.1701, test_f1: 0.5753
 epoch: 99, train_loss: 0.6663, test_loss: 1.2286, test_f1: 0.5772
##################ITERATION #6 ****************************************
 epoch: 0, train_loss: 1.2277, test_loss: 1.3554, test_f1: 0.2281
 epoch: 1, train_loss: 1.1403, test_loss: 1.3508, test_f1: 0.2281
 epoch: 2, train_loss: 1.1067, test_loss: 1.3689, test_f1: 0.3111
 epoch: 3, train_loss: 1.0850, test_loss: 1.3765, test_f1: 0.2020
 epoch: 4, train_loss: 1.0608, test_loss: 1.3467, test_f1: 0.2760
 epoch: 5, train_loss: 1.0493, test_loss: 1.2928, test_f1: 0.3043
 epoch: 6, train_loss: 1.0319, test_loss: 1.2654, test_f1: 0.3591
 epoch: 7, train_loss: 1.0316, test_loss: 1.2262, test_f1: 0.4042
 epoch: 8, train_loss: 1.0005, test_loss: 1.1751, test_f1: 0.4711
 epoch: 9, train_loss: 0.9958, test_loss: 1.1523, test_f1: 0.4831
 epoch: 10, train_loss: 0.9836, test_loss: 1.1360, test_f1: 0.5026
 epoch: 11, train_loss: 0.9645, test_loss: 1.1289, test_f1: 0.4759
 epoch: 12, train_loss: 0.9654, test_loss: 1.1222, test_f1: 0.5099
 epoch: 13, train_loss: 0.9490, test_loss: 1.1066, test_f1: 0.5161
 epoch: 14, train_loss: 0.9494, test_loss: 1.0906, test_f1: 0.5383
 epoch: 15, train_loss: 0.9389, test_loss: 1.0668, test_f1: 0.5499
 epoch: 16, train_loss: 0.9283, test_loss: 1.0669, test_f1: 0.5335
 epoch: 17, train_loss: 0.9254, test_loss: 1.0657, test_f1: 0.5403
 epoch: 18, train_loss: 0.9151, test_loss: 1.0829, test_f1: 0.5276
 epoch: 19, train_loss: 0.9042, test_loss: 1.0751, test_f1: 0.5417
 epoch: 20, train_loss: 0.8977, test_loss: 1.0744, test_f1: 0.5606
 epoch: 21, train_loss: 0.8829, test_loss: 1.0669, test_f1: 0.5698
 epoch: 22, train_loss: 0.8839, test_loss: 1.0576, test_f1: 0.5497
 epoch: 23, train_loss: 0.8775, test_loss: 1.0546, test_f1: 0.5380
 epoch: 24, train_loss: 0.8770, test_loss: 1.0426, test_f1: 0.5404
 epoch: 25, train_loss: 0.8662, test_loss: 1.0550, test_f1: 0.5598
 epoch: 26, train_loss: 0.8535, test_loss: 1.0591, test_f1: 0.5701
 epoch: 27, train_loss: 0.8601, test_loss: 1.0562, test_f1: 0.5556
 epoch: 28, train_loss: 0.8497, test_loss: 1.0537, test_f1: 0.5646
 epoch: 29, train_loss: 0.8446, test_loss: 1.0341, test_f1: 0.5718
 epoch: 30, train_loss: 0.8388, test_loss: 1.0540, test_f1: 0.5700
 epoch: 31, train_loss: 0.8309, test_loss: 1.0603, test_f1: 0.5576
 epoch: 32, train_loss: 0.8311, test_loss: 1.0555, test_f1: 0.5643
 epoch: 33, train_loss: 0.8347, test_loss: 1.0683, test_f1: 0.5593
 epoch: 34, train_loss: 0.8223, test_loss: 1.0934, test_f1: 0.5564
 epoch: 35, train_loss: 0.8155, test_loss: 1.1002, test_f1: 0.5668
 epoch: 36, train_loss: 0.8182, test_loss: 1.1212, test_f1: 0.5750
 epoch: 37, train_loss: 0.8080, test_loss: 1.1731, test_f1: 0.5416
 epoch: 38, train_loss: 0.8070, test_loss: 1.1193, test_f1: 0.5482
 epoch: 39, train_loss: 0.7977, test_loss: 1.0968, test_f1: 0.5635
 epoch: 40, train_loss: 0.7944, test_loss: 1.0897, test_f1: 0.5539
 epoch: 41, train_loss: 0.7975, test_loss: 1.0774, test_f1: 0.5780
 epoch: 42, train_loss: 0.8054, test_loss: 1.0682, test_f1: 0.5620
 epoch: 43, train_loss: 0.7826, test_loss: 1.1000, test_f1: 0.5782
 epoch: 44, train_loss: 0.7917, test_loss: 1.1171, test_f1: 0.5565
 epoch: 45, train_loss: 0.7738, test_loss: 1.0775, test_f1: 0.5681
 epoch: 46, train_loss: 0.7683, test_loss: 1.1064, test_f1: 0.5584
 epoch: 47, train_loss: 0.7708, test_loss: 1.1302, test_f1: 0.5504
 epoch: 48, train_loss: 0.7631, test_loss: 1.0960, test_f1: 0.5816
 epoch: 49, train_loss: 0.7468, test_loss: 1.0978, test_f1: 0.5704
 epoch: 50, train_loss: 0.7633, test_loss: 1.1175, test_f1: 0.5674
 epoch: 51, train_loss: 0.7592, test_loss: 1.1218, test_f1: 0.5619
 epoch: 52, train_loss: 0.7501, test_loss: 1.0703, test_f1: 0.5804
 epoch: 53, train_loss: 0.7456, test_loss: 1.0924, test_f1: 0.5742
 epoch: 54, train_loss: 0.7334, test_loss: 1.1220, test_f1: 0.5778
 epoch: 55, train_loss: 0.7444, test_loss: 1.1397, test_f1: 0.5535
 epoch: 56, train_loss: 0.7343, test_loss: 1.1170, test_f1: 0.5750
 epoch: 57, train_loss: 0.7379, test_loss: 1.1011, test_f1: 0.5592
 epoch: 58, train_loss: 0.7262, test_loss: 1.1158, test_f1: 0.5541
 epoch: 59, train_loss: 0.7233, test_loss: 1.0899, test_f1: 0.5580
 epoch: 60, train_loss: 0.7277, test_loss: 1.0996, test_f1: 0.5638
 epoch: 61, train_loss: 0.7205, test_loss: 1.1160, test_f1: 0.5558
 epoch: 62, train_loss: 0.7188, test_loss: 1.1295, test_f1: 0.5767
 epoch: 63, train_loss: 0.7166, test_loss: 1.1273, test_f1: 0.5864
 epoch: 64, train_loss: 0.7182, test_loss: 1.1158, test_f1: 0.5683
 epoch: 65, train_loss: 0.7114, test_loss: 1.1292, test_f1: 0.5674
 epoch: 66, train_loss: 0.7171, test_loss: 1.1360, test_f1: 0.5596
 epoch: 67, train_loss: 0.7148, test_loss: 1.1198, test_f1: 0.5497
 epoch: 68, train_loss: 0.7047, test_loss: 1.1192, test_f1: 0.5773
 epoch: 69, train_loss: 0.7017, test_loss: 1.1325, test_f1: 0.5810
 epoch: 70, train_loss: 0.7143, test_loss: 1.1258, test_f1: 0.5848
 epoch: 71, train_loss: 0.7109, test_loss: 1.1454, test_f1: 0.5744
 epoch: 72, train_loss: 0.7009, test_loss: 1.1488, test_f1: 0.5707
 epoch: 73, train_loss: 0.7072, test_loss: 1.1593, test_f1: 0.5721
 epoch: 74, train_loss: 0.7024, test_loss: 1.2363, test_f1: 0.5449
 epoch: 75, train_loss: 0.7112, test_loss: 1.1975, test_f1: 0.5362
 epoch: 76, train_loss: 0.7080, test_loss: 1.1552, test_f1: 0.5629
 epoch: 77, train_loss: 0.6943, test_loss: 1.1298, test_f1: 0.5691
 epoch: 78, train_loss: 0.7047, test_loss: 1.1325, test_f1: 0.5736
 epoch: 79, train_loss: 0.7018, test_loss: 1.1378, test_f1: 0.5742
 epoch: 80, train_loss: 0.7038, test_loss: 1.1484, test_f1: 0.5741
 epoch: 81, train_loss: 0.6896, test_loss: 1.1183, test_f1: 0.5703
 epoch: 82, train_loss: 0.6852, test_loss: 1.1370, test_f1: 0.5544
 epoch: 83, train_loss: 0.6924, test_loss: 1.1455, test_f1: 0.5666
 epoch: 84, train_loss: 0.6893, test_loss: 1.1636, test_f1: 0.5778
 epoch: 85, train_loss: 0.6858, test_loss: 1.1512, test_f1: 0.5887
 epoch: 86, train_loss: 0.6781, test_loss: 1.1731, test_f1: 0.5834
 epoch: 87, train_loss: 0.6791, test_loss: 1.2005, test_f1: 0.5794
 epoch: 88, train_loss: 0.6739, test_loss: 1.2044, test_f1: 0.5721
 epoch: 89, train_loss: 0.6694, test_loss: 1.1775, test_f1: 0.5721
 epoch: 90, train_loss: 0.6745, test_loss: 1.2021, test_f1: 0.5640
 epoch: 91, train_loss: 0.6833, test_loss: 1.2212, test_f1: 0.5806
 epoch: 92, train_loss: 0.6865, test_loss: 1.1828, test_f1: 0.5877
 epoch: 93, train_loss: 0.6812, test_loss: 1.1908, test_f1: 0.5768
 epoch: 94, train_loss: 0.6717, test_loss: 1.2039, test_f1: 0.5535
 epoch: 95, train_loss: 0.6760, test_loss: 1.2310, test_f1: 0.5461
 epoch: 96, train_loss: 0.6719, test_loss: 1.2197, test_f1: 0.5702
 epoch: 97, train_loss: 0.6838, test_loss: 1.2197, test_f1: 0.5611
 epoch: 98, train_loss: 0.6733, test_loss: 1.1921, test_f1: 0.5453
 epoch: 99, train_loss: 0.6722, test_loss: 1.1718, test_f1: 0.5686
##################ITERATION #7 ****************************************
 epoch: 0, train_loss: 1.2178, test_loss: 1.3791, test_f1: 0.2281
 epoch: 1, train_loss: 1.1339, test_loss: 1.4139, test_f1: 0.0950
 epoch: 2, train_loss: 1.1058, test_loss: 1.4477, test_f1: 0.0831
 epoch: 3, train_loss: 1.0872, test_loss: 1.4448, test_f1: 0.0936
 epoch: 4, train_loss: 1.0649, test_loss: 1.3890, test_f1: 0.1967
 epoch: 5, train_loss: 1.0451, test_loss: 1.3401, test_f1: 0.2713
 epoch: 6, train_loss: 1.0337, test_loss: 1.3066, test_f1: 0.2943
 epoch: 7, train_loss: 1.0256, test_loss: 1.2649, test_f1: 0.3578
 epoch: 8, train_loss: 1.0160, test_loss: 1.2291, test_f1: 0.3831
 epoch: 9, train_loss: 0.9906, test_loss: 1.1834, test_f1: 0.4223
 epoch: 10, train_loss: 0.9867, test_loss: 1.1334, test_f1: 0.4294
 epoch: 11, train_loss: 0.9741, test_loss: 1.1216, test_f1: 0.4909
 epoch: 12, train_loss: 0.9632, test_loss: 1.1209, test_f1: 0.4794
 epoch: 13, train_loss: 0.9569, test_loss: 1.0972, test_f1: 0.4866
 epoch: 14, train_loss: 0.9492, test_loss: 1.0806, test_f1: 0.4950
 epoch: 15, train_loss: 0.9402, test_loss: 1.0671, test_f1: 0.5248
 epoch: 16, train_loss: 0.9441, test_loss: 1.0537, test_f1: 0.5229
 epoch: 17, train_loss: 0.9218, test_loss: 1.0673, test_f1: 0.5001
 epoch: 18, train_loss: 0.9230, test_loss: 1.0773, test_f1: 0.4987
 epoch: 19, train_loss: 0.9222, test_loss: 1.0834, test_f1: 0.4913
 epoch: 20, train_loss: 0.9072, test_loss: 1.0697, test_f1: 0.5130
 epoch: 21, train_loss: 0.9039, test_loss: 1.0494, test_f1: 0.5072
 epoch: 22, train_loss: 0.9027, test_loss: 1.0369, test_f1: 0.5259
 epoch: 23, train_loss: 0.8953, test_loss: 1.0649, test_f1: 0.5299
 epoch: 24, train_loss: 0.8777, test_loss: 1.0696, test_f1: 0.5212
 epoch: 25, train_loss: 0.8887, test_loss: 1.0637, test_f1: 0.5354
 epoch: 26, train_loss: 0.8808, test_loss: 1.0538, test_f1: 0.5056
 epoch: 27, train_loss: 0.8608, test_loss: 1.0587, test_f1: 0.5112
 epoch: 28, train_loss: 0.8616, test_loss: 1.0619, test_f1: 0.5284
 epoch: 29, train_loss: 0.8507, test_loss: 1.0539, test_f1: 0.5426
 epoch: 30, train_loss: 0.8395, test_loss: 1.0512, test_f1: 0.5524
 epoch: 31, train_loss: 0.8382, test_loss: 1.0423, test_f1: 0.5448
 epoch: 32, train_loss: 0.8317, test_loss: 1.0480, test_f1: 0.5710
 epoch: 33, train_loss: 0.8264, test_loss: 1.0520, test_f1: 0.5602
 epoch: 34, train_loss: 0.8335, test_loss: 1.0411, test_f1: 0.5633
 epoch: 35, train_loss: 0.8265, test_loss: 1.0558, test_f1: 0.5660
 epoch: 36, train_loss: 0.8101, test_loss: 1.0554, test_f1: 0.5536
 epoch: 37, train_loss: 0.8070, test_loss: 1.0489, test_f1: 0.5711
 epoch: 38, train_loss: 0.7985, test_loss: 1.0523, test_f1: 0.5687
 epoch: 39, train_loss: 0.7967, test_loss: 1.0507, test_f1: 0.5678
 epoch: 40, train_loss: 0.7881, test_loss: 1.0585, test_f1: 0.5886
 epoch: 41, train_loss: 0.7902, test_loss: 1.0594, test_f1: 0.5891
 epoch: 42, train_loss: 0.7859, test_loss: 1.0607, test_f1: 0.5702
 epoch: 43, train_loss: 0.7680, test_loss: 1.0465, test_f1: 0.5832
 epoch: 44, train_loss: 0.7825, test_loss: 1.0567, test_f1: 0.5648
 epoch: 45, train_loss: 0.7612, test_loss: 1.0616, test_f1: 0.5919
 epoch: 46, train_loss: 0.7637, test_loss: 1.0595, test_f1: 0.5893
 epoch: 47, train_loss: 0.7804, test_loss: 1.0482, test_f1: 0.5794
 epoch: 48, train_loss: 0.7626, test_loss: 1.0714, test_f1: 0.5719
 epoch: 49, train_loss: 0.7614, test_loss: 1.0914, test_f1: 0.5801
 epoch: 50, train_loss: 0.7457, test_loss: 1.0818, test_f1: 0.5664
 epoch: 51, train_loss: 0.7428, test_loss: 1.0647, test_f1: 0.5725
 epoch: 52, train_loss: 0.7467, test_loss: 1.0694, test_f1: 0.5778
 epoch: 53, train_loss: 0.7273, test_loss: 1.0634, test_f1: 0.5864
 epoch: 54, train_loss: 0.7348, test_loss: 1.0558, test_f1: 0.5915
 epoch: 55, train_loss: 0.7305, test_loss: 1.0501, test_f1: 0.5915
 epoch: 56, train_loss: 0.7409, test_loss: 1.0592, test_f1: 0.5908
 epoch: 57, train_loss: 0.7308, test_loss: 1.0671, test_f1: 0.5956
 epoch: 58, train_loss: 0.7293, test_loss: 1.0609, test_f1: 0.6031
 epoch: 59, train_loss: 0.7180, test_loss: 1.0619, test_f1: 0.5736
 epoch: 60, train_loss: 0.7182, test_loss: 1.0612, test_f1: 0.5825
 epoch: 61, train_loss: 0.7137, test_loss: 1.0471, test_f1: 0.5925
 epoch: 62, train_loss: 0.7221, test_loss: 1.0519, test_f1: 0.5827
 epoch: 63, train_loss: 0.7115, test_loss: 1.0497, test_f1: 0.5786
 epoch: 64, train_loss: 0.7110, test_loss: 1.0572, test_f1: 0.5783
 epoch: 65, train_loss: 0.6988, test_loss: 1.0537, test_f1: 0.5795
 epoch: 66, train_loss: 0.7042, test_loss: 1.0647, test_f1: 0.5859
 epoch: 67, train_loss: 0.7075, test_loss: 1.0896, test_f1: 0.5916
 epoch: 68, train_loss: 0.6998, test_loss: 1.0975, test_f1: 0.5858
 epoch: 69, train_loss: 0.7089, test_loss: 1.0900, test_f1: 0.5856
 epoch: 70, train_loss: 0.7069, test_loss: 1.0833, test_f1: 0.5984
 epoch: 71, train_loss: 0.7018, test_loss: 1.0832, test_f1: 0.5915
 epoch: 72, train_loss: 0.6930, test_loss: 1.0900, test_f1: 0.6024
 epoch: 73, train_loss: 0.7048, test_loss: 1.0859, test_f1: 0.5955
 epoch: 74, train_loss: 0.6859, test_loss: 1.0987, test_f1: 0.5933
 epoch: 75, train_loss: 0.6802, test_loss: 1.0973, test_f1: 0.5839
 epoch: 76, train_loss: 0.6962, test_loss: 1.1034, test_f1: 0.5864
 epoch: 77, train_loss: 0.6822, test_loss: 1.0945, test_f1: 0.5970
 epoch: 78, train_loss: 0.6905, test_loss: 1.1033, test_f1: 0.5839
 epoch: 79, train_loss: 0.6793, test_loss: 1.1146, test_f1: 0.5962
 epoch: 80, train_loss: 0.6751, test_loss: 1.1079, test_f1: 0.5900
 epoch: 81, train_loss: 0.6735, test_loss: 1.0879, test_f1: 0.5989
 epoch: 82, train_loss: 0.6729, test_loss: 1.1052, test_f1: 0.5756
 epoch: 83, train_loss: 0.6804, test_loss: 1.1222, test_f1: 0.5811
 epoch: 84, train_loss: 0.6757, test_loss: 1.1452, test_f1: 0.6021
 epoch: 85, train_loss: 0.6813, test_loss: 1.1512, test_f1: 0.6009
 epoch: 86, train_loss: 0.6597, test_loss: 1.1299, test_f1: 0.5890
 epoch: 87, train_loss: 0.6740, test_loss: 1.1425, test_f1: 0.6028
 epoch: 88, train_loss: 0.6600, test_loss: 1.1831, test_f1: 0.5869
 epoch: 89, train_loss: 0.6725, test_loss: 1.1609, test_f1: 0.5787
 epoch: 90, train_loss: 0.6700, test_loss: 1.1259, test_f1: 0.5838
 epoch: 91, train_loss: 0.6695, test_loss: 1.1034, test_f1: 0.5942
 epoch: 92, train_loss: 0.6588, test_loss: 1.1224, test_f1: 0.5941
 epoch: 93, train_loss: 0.6616, test_loss: 1.1624, test_f1: 0.5859
 epoch: 94, train_loss: 0.6539, test_loss: 1.1680, test_f1: 0.5882
 epoch: 95, train_loss: 0.6541, test_loss: 1.1404, test_f1: 0.5945
 epoch: 96, train_loss: 0.6373, test_loss: 1.1477, test_f1: 0.5710
 epoch: 97, train_loss: 0.6511, test_loss: 1.1265, test_f1: 0.5817
 epoch: 98, train_loss: 0.6472, test_loss: 1.1307, test_f1: 0.6234
 epoch: 99, train_loss: 0.6509, test_loss: 1.1336, test_f1: 0.6149
##################ITERATION #8 ****************************************
 epoch: 0, train_loss: 1.2262, test_loss: 1.3410, test_f1: 0.2281
 epoch: 1, train_loss: 1.1398, test_loss: 1.3665, test_f1: 0.2281
 epoch: 2, train_loss: 1.1006, test_loss: 1.4072, test_f1: 0.1270
 epoch: 3, train_loss: 1.0861, test_loss: 1.4342, test_f1: 0.0848
 epoch: 4, train_loss: 1.0586, test_loss: 1.3785, test_f1: 0.1724
 epoch: 5, train_loss: 1.0461, test_loss: 1.2799, test_f1: 0.3415
 epoch: 6, train_loss: 1.0285, test_loss: 1.2303, test_f1: 0.3951
 epoch: 7, train_loss: 1.0141, test_loss: 1.2083, test_f1: 0.4226
 epoch: 8, train_loss: 1.0067, test_loss: 1.2043, test_f1: 0.4377
 epoch: 9, train_loss: 1.0000, test_loss: 1.1855, test_f1: 0.4309
 epoch: 10, train_loss: 0.9717, test_loss: 1.1576, test_f1: 0.4365
 epoch: 11, train_loss: 0.9637, test_loss: 1.1105, test_f1: 0.4715
 epoch: 12, train_loss: 0.9607, test_loss: 1.0887, test_f1: 0.4795
 epoch: 13, train_loss: 0.9627, test_loss: 1.0592, test_f1: 0.5163
 epoch: 14, train_loss: 0.9533, test_loss: 1.0481, test_f1: 0.5289
 epoch: 15, train_loss: 0.9386, test_loss: 1.0395, test_f1: 0.5212
 epoch: 16, train_loss: 0.9239, test_loss: 1.0373, test_f1: 0.5261
 epoch: 17, train_loss: 0.9276, test_loss: 1.0332, test_f1: 0.5364
 epoch: 18, train_loss: 0.9184, test_loss: 1.0275, test_f1: 0.5384
 epoch: 19, train_loss: 0.9128, test_loss: 1.0280, test_f1: 0.5555
 epoch: 20, train_loss: 0.9038, test_loss: 1.0516, test_f1: 0.5535
 epoch: 21, train_loss: 0.8878, test_loss: 1.0480, test_f1: 0.5501
 epoch: 22, train_loss: 0.8853, test_loss: 1.0245, test_f1: 0.5571
 epoch: 23, train_loss: 0.8807, test_loss: 1.0105, test_f1: 0.5594
 epoch: 24, train_loss: 0.8918, test_loss: 1.0126, test_f1: 0.5633
 epoch: 25, train_loss: 0.8632, test_loss: 1.0487, test_f1: 0.5520
 epoch: 26, train_loss: 0.8835, test_loss: 1.0477, test_f1: 0.5492
 epoch: 27, train_loss: 0.8560, test_loss: 1.0549, test_f1: 0.5598
 epoch: 28, train_loss: 0.8453, test_loss: 1.0403, test_f1: 0.5556
 epoch: 29, train_loss: 0.8530, test_loss: 1.0533, test_f1: 0.5713
 epoch: 30, train_loss: 0.8434, test_loss: 1.0505, test_f1: 0.5775
 epoch: 31, train_loss: 0.8371, test_loss: 1.0300, test_f1: 0.5771
 epoch: 32, train_loss: 0.8460, test_loss: 1.0332, test_f1: 0.5789
 epoch: 33, train_loss: 0.8431, test_loss: 1.0089, test_f1: 0.5686
 epoch: 34, train_loss: 0.8419, test_loss: 0.9834, test_f1: 0.5888
 epoch: 35, train_loss: 0.8320, test_loss: 1.0287, test_f1: 0.5831
 epoch: 36, train_loss: 0.8188, test_loss: 1.0643, test_f1: 0.5742
 epoch: 37, train_loss: 0.8141, test_loss: 1.0200, test_f1: 0.5812
 epoch: 38, train_loss: 0.8054, test_loss: 1.0370, test_f1: 0.5626
 epoch: 39, train_loss: 0.7963, test_loss: 1.0526, test_f1: 0.5708
 epoch: 40, train_loss: 0.8016, test_loss: 1.0417, test_f1: 0.5902
 epoch: 41, train_loss: 0.8104, test_loss: 1.0452, test_f1: 0.5845
 epoch: 42, train_loss: 0.7917, test_loss: 1.0415, test_f1: 0.5954
 epoch: 43, train_loss: 0.7893, test_loss: 1.0675, test_f1: 0.5837
 epoch: 44, train_loss: 0.7799, test_loss: 1.0595, test_f1: 0.5776
 epoch: 45, train_loss: 0.7790, test_loss: 1.0653, test_f1: 0.6019
 epoch: 46, train_loss: 0.7781, test_loss: 1.0555, test_f1: 0.5880
 epoch: 47, train_loss: 0.7714, test_loss: 1.0675, test_f1: 0.5818
 epoch: 48, train_loss: 0.7718, test_loss: 1.0654, test_f1: 0.5953
 epoch: 49, train_loss: 0.7838, test_loss: 1.0605, test_f1: 0.5982
 epoch: 50, train_loss: 0.7658, test_loss: 1.0501, test_f1: 0.5907
 epoch: 51, train_loss: 0.7516, test_loss: 1.0654, test_f1: 0.5867
 epoch: 52, train_loss: 0.7588, test_loss: 1.0820, test_f1: 0.5894
 epoch: 53, train_loss: 0.7447, test_loss: 1.0729, test_f1: 0.6051
 epoch: 54, train_loss: 0.7612, test_loss: 1.0577, test_f1: 0.5904
 epoch: 55, train_loss: 0.7533, test_loss: 1.0377, test_f1: 0.5971
 epoch: 56, train_loss: 0.7385, test_loss: 1.0707, test_f1: 0.5822
 epoch: 57, train_loss: 0.7423, test_loss: 1.0937, test_f1: 0.5885
 epoch: 58, train_loss: 0.7404, test_loss: 1.0918, test_f1: 0.5894
 epoch: 59, train_loss: 0.7257, test_loss: 1.0859, test_f1: 0.5987
 epoch: 60, train_loss: 0.7368, test_loss: 1.0774, test_f1: 0.5930
 epoch: 61, train_loss: 0.7215, test_loss: 1.0821, test_f1: 0.5917
 epoch: 62, train_loss: 0.7296, test_loss: 1.0707, test_f1: 0.5820
 epoch: 63, train_loss: 0.7334, test_loss: 1.0650, test_f1: 0.5914
 epoch: 64, train_loss: 0.7407, test_loss: 1.0958, test_f1: 0.5977
 epoch: 65, train_loss: 0.7226, test_loss: 1.1196, test_f1: 0.5911
 epoch: 66, train_loss: 0.7216, test_loss: 1.1138, test_f1: 0.5885
 epoch: 67, train_loss: 0.7106, test_loss: 1.0938, test_f1: 0.5818
 epoch: 68, train_loss: 0.7227, test_loss: 1.0934, test_f1: 0.5859
 epoch: 69, train_loss: 0.7158, test_loss: 1.1044, test_f1: 0.5731
 epoch: 70, train_loss: 0.7145, test_loss: 1.1119, test_f1: 0.5746
 epoch: 71, train_loss: 0.7127, test_loss: 1.0856, test_f1: 0.5857
 epoch: 72, train_loss: 0.7046, test_loss: 1.0791, test_f1: 0.6048
 epoch: 73, train_loss: 0.7121, test_loss: 1.0896, test_f1: 0.5857
 epoch: 74, train_loss: 0.7052, test_loss: 1.1186, test_f1: 0.5856
 epoch: 75, train_loss: 0.6917, test_loss: 1.0855, test_f1: 0.5993
 epoch: 76, train_loss: 0.6947, test_loss: 1.1243, test_f1: 0.5791
 epoch: 77, train_loss: 0.6998, test_loss: 1.1318, test_f1: 0.5837
 epoch: 78, train_loss: 0.6932, test_loss: 1.1414, test_f1: 0.5841
 epoch: 79, train_loss: 0.7002, test_loss: 1.1429, test_f1: 0.5875
 epoch: 80, train_loss: 0.6891, test_loss: 1.1589, test_f1: 0.5827
 epoch: 81, train_loss: 0.6873, test_loss: 1.1444, test_f1: 0.5899
 epoch: 82, train_loss: 0.6891, test_loss: 1.1458, test_f1: 0.5858
 epoch: 83, train_loss: 0.6895, test_loss: 1.1530, test_f1: 0.5883
 epoch: 84, train_loss: 0.6847, test_loss: 1.1531, test_f1: 0.5800
 epoch: 85, train_loss: 0.6849, test_loss: 1.1739, test_f1: 0.5979
 epoch: 86, train_loss: 0.6863, test_loss: 1.1800, test_f1: 0.5907
 epoch: 87, train_loss: 0.6813, test_loss: 1.1517, test_f1: 0.6018
 epoch: 88, train_loss: 0.6728, test_loss: 1.1492, test_f1: 0.5945
 epoch: 89, train_loss: 0.6814, test_loss: 1.1415, test_f1: 0.5972
 epoch: 90, train_loss: 0.6813, test_loss: 1.1666, test_f1: 0.5848
 epoch: 91, train_loss: 0.6749, test_loss: 1.1595, test_f1: 0.6009
 epoch: 92, train_loss: 0.6754, test_loss: 1.1515, test_f1: 0.6108
 epoch: 93, train_loss: 0.6659, test_loss: 1.1471, test_f1: 0.6016
 epoch: 94, train_loss: 0.6745, test_loss: 1.1728, test_f1: 0.5951
 epoch: 95, train_loss: 0.6752, test_loss: 1.1972, test_f1: 0.5802
 epoch: 96, train_loss: 0.6788, test_loss: 1.1976, test_f1: 0.5783
 epoch: 97, train_loss: 0.6765, test_loss: 1.2271, test_f1: 0.5753
 epoch: 98, train_loss: 0.6657, test_loss: 1.1881, test_f1: 0.6013
 epoch: 99, train_loss: 0.6605, test_loss: 1.1486, test_f1: 0.6037
##################ITERATION #9 ****************************************
 epoch: 0, train_loss: 1.2349, test_loss: 1.3261, test_f1: 0.2281
 epoch: 1, train_loss: 1.1351, test_loss: 1.3389, test_f1: 0.2281
 epoch: 2, train_loss: 1.1035, test_loss: 1.3366, test_f1: 0.2281
 epoch: 3, train_loss: 1.0819, test_loss: 1.3052, test_f1: 0.2281
 epoch: 4, train_loss: 1.0604, test_loss: 1.2736, test_f1: 0.3206
 epoch: 5, train_loss: 1.0451, test_loss: 1.2534, test_f1: 0.3514
 epoch: 6, train_loss: 1.0412, test_loss: 1.2179, test_f1: 0.4292
 epoch: 7, train_loss: 1.0216, test_loss: 1.1716, test_f1: 0.4639
 epoch: 8, train_loss: 1.0047, test_loss: 1.1467, test_f1: 0.4627
 epoch: 9, train_loss: 1.0043, test_loss: 1.1203, test_f1: 0.4824
 epoch: 10, train_loss: 0.9861, test_loss: 1.0912, test_f1: 0.5038
 epoch: 11, train_loss: 0.9858, test_loss: 1.0736, test_f1: 0.5157
 epoch: 12, train_loss: 0.9643, test_loss: 1.0791, test_f1: 0.5161
 epoch: 13, train_loss: 0.9641, test_loss: 1.0643, test_f1: 0.5210
 epoch: 14, train_loss: 0.9448, test_loss: 1.0407, test_f1: 0.5222
 epoch: 15, train_loss: 0.9484, test_loss: 1.0271, test_f1: 0.5393
 epoch: 16, train_loss: 0.9397, test_loss: 1.0315, test_f1: 0.5317
 epoch: 17, train_loss: 0.9217, test_loss: 1.0444, test_f1: 0.5342
 epoch: 18, train_loss: 0.9420, test_loss: 1.0290, test_f1: 0.5353
 epoch: 19, train_loss: 0.9164, test_loss: 1.0240, test_f1: 0.5256
 epoch: 20, train_loss: 0.9114, test_loss: 1.0090, test_f1: 0.5356
 epoch: 21, train_loss: 0.8962, test_loss: 1.0249, test_f1: 0.5312
 epoch: 22, train_loss: 0.8949, test_loss: 1.0071, test_f1: 0.5328
 epoch: 23, train_loss: 0.9134, test_loss: 1.0193, test_f1: 0.5328
 epoch: 24, train_loss: 0.9010, test_loss: 1.0407, test_f1: 0.5510
 epoch: 25, train_loss: 0.8872, test_loss: 1.0508, test_f1: 0.5401
 epoch: 26, train_loss: 0.8870, test_loss: 1.0285, test_f1: 0.5385
 epoch: 27, train_loss: 0.8817, test_loss: 1.0097, test_f1: 0.5522
 epoch: 28, train_loss: 0.8766, test_loss: 1.0018, test_f1: 0.5628
 epoch: 29, train_loss: 0.8679, test_loss: 1.0378, test_f1: 0.5337
 epoch: 30, train_loss: 0.8615, test_loss: 1.0210, test_f1: 0.5539
 epoch: 31, train_loss: 0.8608, test_loss: 0.9964, test_f1: 0.5721
 epoch: 32, train_loss: 0.8572, test_loss: 1.0255, test_f1: 0.5541
 epoch: 33, train_loss: 0.8417, test_loss: 1.0301, test_f1: 0.5600
 epoch: 34, train_loss: 0.8353, test_loss: 1.0146, test_f1: 0.5611
 epoch: 35, train_loss: 0.8402, test_loss: 1.0114, test_f1: 0.5700
 epoch: 36, train_loss: 0.8279, test_loss: 1.0197, test_f1: 0.5552
 epoch: 37, train_loss: 0.8355, test_loss: 0.9898, test_f1: 0.5579
 epoch: 38, train_loss: 0.8281, test_loss: 1.0005, test_f1: 0.5699
 epoch: 39, train_loss: 0.8260, test_loss: 1.0482, test_f1: 0.5860
 epoch: 40, train_loss: 0.8183, test_loss: 1.0463, test_f1: 0.5618
 epoch: 41, train_loss: 0.8016, test_loss: 0.9966, test_f1: 0.5560
 epoch: 42, train_loss: 0.8097, test_loss: 1.0046, test_f1: 0.5678
 epoch: 43, train_loss: 0.8077, test_loss: 1.0109, test_f1: 0.5816
 epoch: 44, train_loss: 0.7970, test_loss: 0.9736, test_f1: 0.5747
 epoch: 45, train_loss: 0.8053, test_loss: 0.9998, test_f1: 0.5444
 epoch: 46, train_loss: 0.8064, test_loss: 1.0234, test_f1: 0.5532
 epoch: 47, train_loss: 0.8094, test_loss: 1.0460, test_f1: 0.5433
 epoch: 48, train_loss: 0.7838, test_loss: 1.0795, test_f1: 0.5552
 epoch: 49, train_loss: 0.7840, test_loss: 1.0492, test_f1: 0.5809
 epoch: 50, train_loss: 0.7746, test_loss: 1.0446, test_f1: 0.5894
 epoch: 51, train_loss: 0.7720, test_loss: 1.0255, test_f1: 0.5781
 epoch: 52, train_loss: 0.7743, test_loss: 1.0075, test_f1: 0.5862
 epoch: 53, train_loss: 0.7703, test_loss: 1.0069, test_f1: 0.5818
 epoch: 54, train_loss: 0.7673, test_loss: 1.0131, test_f1: 0.5726
 epoch: 55, train_loss: 0.7511, test_loss: 1.0208, test_f1: 0.5796
 epoch: 56, train_loss: 0.7603, test_loss: 1.0088, test_f1: 0.5795
 epoch: 57, train_loss: 0.7531, test_loss: 1.0136, test_f1: 0.5838
 epoch: 58, train_loss: 0.7594, test_loss: 1.0180, test_f1: 0.5781
 epoch: 59, train_loss: 0.7506, test_loss: 1.0337, test_f1: 0.5714
 epoch: 60, train_loss: 0.7431, test_loss: 1.0511, test_f1: 0.5585
 epoch: 61, train_loss: 0.7460, test_loss: 1.0258, test_f1: 0.5716
 epoch: 62, train_loss: 0.7372, test_loss: 1.0163, test_f1: 0.5825
 epoch: 63, train_loss: 0.7489, test_loss: 1.0133, test_f1: 0.5695
 epoch: 64, train_loss: 0.7429, test_loss: 1.0306, test_f1: 0.5860
 epoch: 65, train_loss: 0.7400, test_loss: 1.0288, test_f1: 0.5696
 epoch: 66, train_loss: 0.7277, test_loss: 1.0220, test_f1: 0.5885
 epoch: 67, train_loss: 0.7327, test_loss: 1.0402, test_f1: 0.5718
 epoch: 68, train_loss: 0.7372, test_loss: 1.0487, test_f1: 0.5810
 epoch: 69, train_loss: 0.7299, test_loss: 1.0508, test_f1: 0.5651
 epoch: 70, train_loss: 0.7287, test_loss: 1.0628, test_f1: 0.5789
 epoch: 71, train_loss: 0.7334, test_loss: 1.0695, test_f1: 0.5873
 epoch: 72, train_loss: 0.7119, test_loss: 1.0745, test_f1: 0.5792
 epoch: 73, train_loss: 0.7266, test_loss: 1.0400, test_f1: 0.5754
 epoch: 74, train_loss: 0.7206, test_loss: 1.0202, test_f1: 0.5784
 epoch: 75, train_loss: 0.7247, test_loss: 1.0425, test_f1: 0.5767
 epoch: 76, train_loss: 0.7277, test_loss: 1.0463, test_f1: 0.5813
 epoch: 77, train_loss: 0.7224, test_loss: 1.0393, test_f1: 0.5835
 epoch: 78, train_loss: 0.7162, test_loss: 1.0441, test_f1: 0.5632
 epoch: 79, train_loss: 0.7137, test_loss: 1.0365, test_f1: 0.5666
 epoch: 80, train_loss: 0.7211, test_loss: 1.0412, test_f1: 0.5722
 epoch: 81, train_loss: 0.7066, test_loss: 1.0403, test_f1: 0.5750
 epoch: 82, train_loss: 0.7105, test_loss: 1.0116, test_f1: 0.5830
 epoch: 83, train_loss: 0.7139, test_loss: 1.0337, test_f1: 0.5568
 epoch: 84, train_loss: 0.7148, test_loss: 1.0489, test_f1: 0.5818
 epoch: 85, train_loss: 0.7013, test_loss: 1.0532, test_f1: 0.5857
 epoch: 86, train_loss: 0.7111, test_loss: 1.0284, test_f1: 0.5792
 epoch: 87, train_loss: 0.7042, test_loss: 1.0396, test_f1: 0.5708
 epoch: 88, train_loss: 0.7041, test_loss: 1.0639, test_f1: 0.5891
 epoch: 89, train_loss: 0.7104, test_loss: 1.0579, test_f1: 0.5895
 epoch: 90, train_loss: 0.7043, test_loss: 1.0622, test_f1: 0.5989
 epoch: 91, train_loss: 0.6871, test_loss: 1.0619, test_f1: 0.5984
 epoch: 92, train_loss: 0.6968, test_loss: 1.0623, test_f1: 0.5894
 epoch: 93, train_loss: 0.6971, test_loss: 1.0504, test_f1: 0.6016
 epoch: 94, train_loss: 0.6848, test_loss: 1.0880, test_f1: 0.5955
 epoch: 95, train_loss: 0.6843, test_loss: 1.1012, test_f1: 0.5931
 epoch: 96, train_loss: 0.6805, test_loss: 1.0889, test_f1: 0.5871
 epoch: 97, train_loss: 0.6810, test_loss: 1.0715, test_f1: 0.5823
 epoch: 98, train_loss: 0.6821, test_loss: 1.0718, test_f1: 0.5941
 epoch: 99, train_loss: 0.6775, test_loss: 1.0863, test_f1: 0.5842

Training completed in 326.80 seconds
Best F1: 0.6234 at epoch 98
Mean F1 across iterations: 0.5968  0.0123
========================FINAL RESULTS================================
FEGIN weighted F1: 0.6234  0.0123
python main.py --data ltspice_demos --representation component_net --model FEGIN --layers 6 --hiddens 128 --batch_size 256 --lr 0.0001 --emb_size 512 --epochs 100 --save_appendix component_net_L6_H128_BS256_LR0.0001_E512 --no_val
-----



STDERR:
  File "main.py", line 370, in <module>
    main()
  File "main.py", line 254, in main
    dataset = dataset_class(
  File "/home/philip/projects/ltspice_examples_code_repo/Circuit-Completion-Using-GNNs/component_classification_with_link_prediction_head/evaluation/FEGIN/kernel/circuit_datasets.py", line 15, in __init__
    self.data, self.slices = torch.load(self.processed_paths[0])
  File "/home/philip/.local/lib/python3.8/site-packages/torch/serialization.py", line 1040, in load
    warnings.warn(
  File "/usr/lib/python3.8/warnings.py", line 109, in _showwarnmsg
    sw(msg.message, msg.category, msg.filename, msg.lineno,
  File "main.py", line 47, in warn_with_traceback
    traceback.print_stack(file=log)
/home/philip/projects/ltspice_examples_code_repo/Circuit-Completion-Using-GNNs/component_classification_with_link_prediction_head/evaluation/FEGIN/kernel/circuit_datasets.py:15: FutureWarning: You are using `torch.load` with `weights_only=False` (the current default value), which uses the default pickle module implicitly. It is possible to construct malicious pickle data which will execute arbitrary code during unpickling (See https://github.com/pytorch/pytorch/blob/main/SECURITY.md#untrusted-models for more details). In a future release, the default value for `weights_only` will be flipped to `True`. This limits the functions that could be executed during unpickling. Arbitrary objects will no longer be allowed to be loaded via this mode unless they are explicitly allowlisted by the user via `torch.serialization.add_safe_globals`. We recommend you start setting `weights_only=True` for any use case where you don't have full control of the loaded file. Please open an issue on GitHub for any issues related to this experimental feature.
  self.data, self.slices = torch.load(self.processed_paths[0])
