STDOUT:
Results will be saved in /home/philip/projects/ltspice_examples_code_repo/Circuit-Completion-Using-GNNs/component_classification_with_link_prediction_head/evaluation/FEGIN/results/model_FEGIN_dataset_ltspice_examples
Command line input: python main.py --data ltspice_examples --representation component_net --model FEGIN --layers 2 --hiddens 128 --batch_size 64 --lr 0.0001 --emb_size 128 --epochs 100 --save_appendix component_net_L2_H128_BS64_LR0.0001_E128 --no_val
 is saved.
-----
ltspice_examples - FEGIN
Using 2 layers, 128 hidden units, h = 2
Loading component_net representation dataset
ENTERED
Training FEGIN on component_net representation
Train: 3558, Test: 846
##################ITERATION #0 ****************************************
 epoch: 0, train_loss: 1.3556, test_loss: 1.3344, test_f1: 0.2270
 epoch: 1, train_loss: 1.2907, test_loss: 1.2709, test_f1: 0.2270
 epoch: 2, train_loss: 1.2499, test_loss: 1.2251, test_f1: 0.2611
 epoch: 3, train_loss: 1.2118, test_loss: 1.1773, test_f1: 0.2996
 epoch: 4, train_loss: 1.1707, test_loss: 1.1230, test_f1: 0.3751
 epoch: 5, train_loss: 1.1242, test_loss: 1.0684, test_f1: 0.4265
 epoch: 6, train_loss: 1.0707, test_loss: 1.0301, test_f1: 0.4559
 epoch: 7, train_loss: 1.0275, test_loss: 0.9966, test_f1: 0.4598
 epoch: 8, train_loss: 0.9984, test_loss: 0.9725, test_f1: 0.4674
 epoch: 9, train_loss: 0.9770, test_loss: 0.9613, test_f1: 0.4792
 epoch: 10, train_loss: 0.9615, test_loss: 0.9483, test_f1: 0.4886
 epoch: 11, train_loss: 0.9499, test_loss: 0.9395, test_f1: 0.4947
 epoch: 12, train_loss: 0.9354, test_loss: 0.9336, test_f1: 0.4792
 epoch: 13, train_loss: 0.9258, test_loss: 0.9249, test_f1: 0.5182
 epoch: 14, train_loss: 0.9174, test_loss: 0.9367, test_f1: 0.4963
 epoch: 15, train_loss: 0.9164, test_loss: 0.9414, test_f1: 0.5103
 epoch: 16, train_loss: 0.9005, test_loss: 0.9387, test_f1: 0.4933
 epoch: 17, train_loss: 0.8994, test_loss: 0.9560, test_f1: 0.5099
 epoch: 18, train_loss: 0.8897, test_loss: 0.9275, test_f1: 0.5261
 epoch: 19, train_loss: 0.8911, test_loss: 0.9250, test_f1: 0.5175
 epoch: 20, train_loss: 0.8748, test_loss: 0.9183, test_f1: 0.5213
 epoch: 21, train_loss: 0.8741, test_loss: 0.9106, test_f1: 0.5329
 epoch: 22, train_loss: 0.8580, test_loss: 0.9122, test_f1: 0.5210
 epoch: 23, train_loss: 0.8552, test_loss: 0.8883, test_f1: 0.5325
 epoch: 24, train_loss: 0.8561, test_loss: 0.9433, test_f1: 0.5252
 epoch: 25, train_loss: 0.8428, test_loss: 0.9057, test_f1: 0.5364
 epoch: 26, train_loss: 0.8336, test_loss: 0.9103, test_f1: 0.5266
 epoch: 27, train_loss: 0.8337, test_loss: 0.9188, test_f1: 0.5240
 epoch: 28, train_loss: 0.8350, test_loss: 0.9274, test_f1: 0.5338
 epoch: 29, train_loss: 0.8198, test_loss: 0.9573, test_f1: 0.5259
 epoch: 30, train_loss: 0.8177, test_loss: 0.9402, test_f1: 0.5286
 epoch: 31, train_loss: 0.8126, test_loss: 0.9241, test_f1: 0.5340
 epoch: 32, train_loss: 0.8049, test_loss: 0.9267, test_f1: 0.5360
 epoch: 33, train_loss: 0.7999, test_loss: 0.9107, test_f1: 0.5435
 epoch: 34, train_loss: 0.7988, test_loss: 0.9046, test_f1: 0.5377
 epoch: 35, train_loss: 0.7994, test_loss: 0.9233, test_f1: 0.5276
 epoch: 36, train_loss: 0.7900, test_loss: 0.9470, test_f1: 0.5464
 epoch: 37, train_loss: 0.7911, test_loss: 0.9317, test_f1: 0.5308
 epoch: 38, train_loss: 0.7787, test_loss: 0.9635, test_f1: 0.5175
 epoch: 39, train_loss: 0.7794, test_loss: 0.9412, test_f1: 0.5469
 epoch: 40, train_loss: 0.7698, test_loss: 0.9349, test_f1: 0.5621
 epoch: 41, train_loss: 0.7742, test_loss: 0.9323, test_f1: 0.5435
 epoch: 42, train_loss: 0.7663, test_loss: 0.9301, test_f1: 0.5619
 epoch: 43, train_loss: 0.7658, test_loss: 0.9242, test_f1: 0.5387
 epoch: 44, train_loss: 0.7583, test_loss: 0.9514, test_f1: 0.5184
 epoch: 45, train_loss: 0.7596, test_loss: 0.9160, test_f1: 0.5582
 epoch: 46, train_loss: 0.7460, test_loss: 0.9562, test_f1: 0.5427
 epoch: 47, train_loss: 0.7492, test_loss: 0.9223, test_f1: 0.5678
 epoch: 48, train_loss: 0.7497, test_loss: 0.9109, test_f1: 0.5689
 epoch: 49, train_loss: 0.7453, test_loss: 0.9262, test_f1: 0.5431
 epoch: 50, train_loss: 0.7350, test_loss: 0.9150, test_f1: 0.5764
 epoch: 51, train_loss: 0.7286, test_loss: 0.9166, test_f1: 0.5681
 epoch: 52, train_loss: 0.7249, test_loss: 0.9195, test_f1: 0.5672
 epoch: 53, train_loss: 0.7177, test_loss: 0.9153, test_f1: 0.5727
 epoch: 54, train_loss: 0.7132, test_loss: 0.9343, test_f1: 0.5781
 epoch: 55, train_loss: 0.7226, test_loss: 0.9268, test_f1: 0.5727
 epoch: 56, train_loss: 0.7099, test_loss: 0.9258, test_f1: 0.5776
 epoch: 57, train_loss: 0.7129, test_loss: 0.9278, test_f1: 0.5694
 epoch: 58, train_loss: 0.7078, test_loss: 0.9183, test_f1: 0.5750
 epoch: 59, train_loss: 0.7094, test_loss: 0.9301, test_f1: 0.5757
 epoch: 60, train_loss: 0.7166, test_loss: 0.9400, test_f1: 0.5829
 epoch: 61, train_loss: 0.7097, test_loss: 0.9391, test_f1: 0.5737
 epoch: 62, train_loss: 0.6926, test_loss: 0.9376, test_f1: 0.6161
 epoch: 63, train_loss: 0.7079, test_loss: 0.9482, test_f1: 0.5736
 epoch: 64, train_loss: 0.7001, test_loss: 0.9446, test_f1: 0.5569
 epoch: 65, train_loss: 0.6973, test_loss: 0.9281, test_f1: 0.5829
 epoch: 66, train_loss: 0.6899, test_loss: 0.9477, test_f1: 0.5940
 epoch: 67, train_loss: 0.6895, test_loss: 0.9260, test_f1: 0.5912
 epoch: 68, train_loss: 0.6908, test_loss: 0.9522, test_f1: 0.5843
 epoch: 69, train_loss: 0.6918, test_loss: 0.9373, test_f1: 0.6069
 epoch: 70, train_loss: 0.6708, test_loss: 0.9629, test_f1: 0.5921
 epoch: 71, train_loss: 0.6858, test_loss: 0.9421, test_f1: 0.6017
 epoch: 72, train_loss: 0.6825, test_loss: 0.9487, test_f1: 0.6161
 epoch: 73, train_loss: 0.6912, test_loss: 0.9464, test_f1: 0.6040
 epoch: 74, train_loss: 0.6750, test_loss: 0.9296, test_f1: 0.6066
 epoch: 75, train_loss: 0.6780, test_loss: 0.9474, test_f1: 0.6114
 epoch: 76, train_loss: 0.6774, test_loss: 0.9420, test_f1: 0.5905
 epoch: 77, train_loss: 0.6840, test_loss: 0.9538, test_f1: 0.6047
 epoch: 78, train_loss: 0.6718, test_loss: 0.9606, test_f1: 0.6095
 epoch: 79, train_loss: 0.6657, test_loss: 0.9348, test_f1: 0.6016
 epoch: 80, train_loss: 0.6829, test_loss: 0.9590, test_f1: 0.5812
 epoch: 81, train_loss: 0.6654, test_loss: 0.9350, test_f1: 0.5964
 epoch: 82, train_loss: 0.6647, test_loss: 0.9583, test_f1: 0.6076
 epoch: 83, train_loss: 0.6732, test_loss: 0.9265, test_f1: 0.6042
 epoch: 84, train_loss: 0.6671, test_loss: 0.9391, test_f1: 0.5657
 epoch: 85, train_loss: 0.6592, test_loss: 0.9333, test_f1: 0.5983
 epoch: 86, train_loss: 0.6624, test_loss: 0.9438, test_f1: 0.5975
 epoch: 87, train_loss: 0.6651, test_loss: 0.9369, test_f1: 0.5970
 epoch: 88, train_loss: 0.6600, test_loss: 0.9552, test_f1: 0.5968
 epoch: 89, train_loss: 0.6557, test_loss: 0.9421, test_f1: 0.5979
 epoch: 90, train_loss: 0.6592, test_loss: 0.9364, test_f1: 0.6221
 epoch: 91, train_loss: 0.6498, test_loss: 0.9471, test_f1: 0.5805
 epoch: 92, train_loss: 0.6590, test_loss: 0.9697, test_f1: 0.6304
 epoch: 93, train_loss: 0.6602, test_loss: 0.9615, test_f1: 0.5838
 epoch: 94, train_loss: 0.6477, test_loss: 0.9445, test_f1: 0.6009
 epoch: 95, train_loss: 0.6530, test_loss: 0.9395, test_f1: 0.6125
 epoch: 96, train_loss: 0.6577, test_loss: 0.9449, test_f1: 0.6037
 epoch: 97, train_loss: 0.6495, test_loss: 0.9616, test_f1: 0.6107
 epoch: 98, train_loss: 0.6445, test_loss: 0.9816, test_f1: 0.5735
 epoch: 99, train_loss: 0.6331, test_loss: 0.9512, test_f1: 0.6059
##################ITERATION #1 ****************************************
 epoch: 0, train_loss: 1.2721, test_loss: 1.2290, test_f1: 0.2651
 epoch: 1, train_loss: 1.1721, test_loss: 1.1226, test_f1: 0.4038
 epoch: 2, train_loss: 1.1204, test_loss: 1.0656, test_f1: 0.4409
 epoch: 3, train_loss: 1.0724, test_loss: 1.0176, test_f1: 0.4646
 epoch: 4, train_loss: 1.0294, test_loss: 0.9813, test_f1: 0.4866
 epoch: 5, train_loss: 1.0029, test_loss: 0.9505, test_f1: 0.4932
 epoch: 6, train_loss: 0.9643, test_loss: 0.9603, test_f1: 0.4862
 epoch: 7, train_loss: 0.9554, test_loss: 0.9345, test_f1: 0.4994
 epoch: 8, train_loss: 0.9403, test_loss: 0.9241, test_f1: 0.5091
 epoch: 9, train_loss: 0.9325, test_loss: 0.9242, test_f1: 0.5092
 epoch: 10, train_loss: 0.9128, test_loss: 0.9009, test_f1: 0.5223
 epoch: 11, train_loss: 0.9023, test_loss: 0.8741, test_f1: 0.5240
 epoch: 12, train_loss: 0.8969, test_loss: 0.8753, test_f1: 0.5384
 epoch: 13, train_loss: 0.8836, test_loss: 0.8981, test_f1: 0.5328
 epoch: 14, train_loss: 0.8794, test_loss: 0.8973, test_f1: 0.5333
 epoch: 15, train_loss: 0.8709, test_loss: 0.9182, test_f1: 0.5268
 epoch: 16, train_loss: 0.8702, test_loss: 0.9048, test_f1: 0.5355
 epoch: 17, train_loss: 0.8575, test_loss: 0.8673, test_f1: 0.5429
 epoch: 18, train_loss: 0.8472, test_loss: 0.9043, test_f1: 0.5405
 epoch: 19, train_loss: 0.8445, test_loss: 0.8715, test_f1: 0.5516
 epoch: 20, train_loss: 0.8374, test_loss: 0.8886, test_f1: 0.5410
 epoch: 21, train_loss: 0.8386, test_loss: 0.8769, test_f1: 0.5564
 epoch: 22, train_loss: 0.8280, test_loss: 0.9026, test_f1: 0.5474
 epoch: 23, train_loss: 0.8284, test_loss: 0.8719, test_f1: 0.5415
 epoch: 24, train_loss: 0.8146, test_loss: 0.8869, test_f1: 0.5452
 epoch: 25, train_loss: 0.8145, test_loss: 0.8735, test_f1: 0.5397
 epoch: 26, train_loss: 0.8069, test_loss: 0.9044, test_f1: 0.5418
 epoch: 27, train_loss: 0.8066, test_loss: 0.9151, test_f1: 0.5383
 epoch: 28, train_loss: 0.8067, test_loss: 0.8841, test_f1: 0.5490
 epoch: 29, train_loss: 0.7952, test_loss: 0.9226, test_f1: 0.5473
 epoch: 30, train_loss: 0.7904, test_loss: 0.8924, test_f1: 0.5565
 epoch: 31, train_loss: 0.7894, test_loss: 0.8972, test_f1: 0.5449
 epoch: 32, train_loss: 0.7829, test_loss: 0.8885, test_f1: 0.5478
 epoch: 33, train_loss: 0.7773, test_loss: 0.9196, test_f1: 0.5463
 epoch: 34, train_loss: 0.7632, test_loss: 0.9391, test_f1: 0.5439
 epoch: 35, train_loss: 0.7625, test_loss: 0.9023, test_f1: 0.5547
 epoch: 36, train_loss: 0.7633, test_loss: 0.8890, test_f1: 0.5684
 epoch: 37, train_loss: 0.7491, test_loss: 0.8809, test_f1: 0.5763
 epoch: 38, train_loss: 0.7583, test_loss: 0.9057, test_f1: 0.5542
 epoch: 39, train_loss: 0.7474, test_loss: 0.8924, test_f1: 0.5686
 epoch: 40, train_loss: 0.7400, test_loss: 0.8935, test_f1: 0.5919
 epoch: 41, train_loss: 0.7353, test_loss: 0.9172, test_f1: 0.5488
 epoch: 42, train_loss: 0.7440, test_loss: 0.8922, test_f1: 0.5511
 epoch: 43, train_loss: 0.7305, test_loss: 0.9140, test_f1: 0.5563
 epoch: 44, train_loss: 0.7152, test_loss: 0.9115, test_f1: 0.5530
 epoch: 45, train_loss: 0.7267, test_loss: 0.9083, test_f1: 0.5826
 epoch: 46, train_loss: 0.7212, test_loss: 0.9042, test_f1: 0.5879
 epoch: 47, train_loss: 0.7219, test_loss: 0.8968, test_f1: 0.5777
 epoch: 48, train_loss: 0.7223, test_loss: 0.9001, test_f1: 0.6077
 epoch: 49, train_loss: 0.7120, test_loss: 0.9151, test_f1: 0.6005
 epoch: 50, train_loss: 0.7020, test_loss: 0.9023, test_f1: 0.5771
 epoch: 51, train_loss: 0.6939, test_loss: 0.9064, test_f1: 0.5995
 epoch: 52, train_loss: 0.6897, test_loss: 0.9135, test_f1: 0.5761
 epoch: 53, train_loss: 0.6933, test_loss: 0.8869, test_f1: 0.6077
 epoch: 54, train_loss: 0.6815, test_loss: 0.9354, test_f1: 0.5878
 epoch: 55, train_loss: 0.6884, test_loss: 0.9052, test_f1: 0.6079
 epoch: 56, train_loss: 0.6790, test_loss: 0.9075, test_f1: 0.6229
 epoch: 57, train_loss: 0.6724, test_loss: 0.9403, test_f1: 0.5956
 epoch: 58, train_loss: 0.6683, test_loss: 0.8934, test_f1: 0.6131
 epoch: 59, train_loss: 0.6764, test_loss: 0.9417, test_f1: 0.5934
 epoch: 60, train_loss: 0.6669, test_loss: 0.9140, test_f1: 0.6073
 epoch: 61, train_loss: 0.6706, test_loss: 0.9406, test_f1: 0.6055
 epoch: 62, train_loss: 0.6651, test_loss: 0.9228, test_f1: 0.5866
 epoch: 63, train_loss: 0.6605, test_loss: 0.9028, test_f1: 0.6195
 epoch: 64, train_loss: 0.6656, test_loss: 0.9072, test_f1: 0.6313
 epoch: 65, train_loss: 0.6606, test_loss: 0.9197, test_f1: 0.5982
 epoch: 66, train_loss: 0.6556, test_loss: 0.9296, test_f1: 0.5985
 epoch: 67, train_loss: 0.6628, test_loss: 0.9163, test_f1: 0.5990
 epoch: 68, train_loss: 0.6510, test_loss: 0.9253, test_f1: 0.6041
 epoch: 69, train_loss: 0.6485, test_loss: 0.9267, test_f1: 0.5997
 epoch: 70, train_loss: 0.6413, test_loss: 0.9374, test_f1: 0.6067
 epoch: 71, train_loss: 0.6486, test_loss: 0.9453, test_f1: 0.6145
 epoch: 72, train_loss: 0.6372, test_loss: 0.9338, test_f1: 0.6172
 epoch: 73, train_loss: 0.6371, test_loss: 0.9332, test_f1: 0.6211
 epoch: 74, train_loss: 0.6459, test_loss: 0.9400, test_f1: 0.6172
 epoch: 75, train_loss: 0.6380, test_loss: 0.9375, test_f1: 0.6205
 epoch: 76, train_loss: 0.6436, test_loss: 0.9633, test_f1: 0.6380
 epoch: 77, train_loss: 0.6280, test_loss: 0.9412, test_f1: 0.6243
 epoch: 78, train_loss: 0.6326, test_loss: 0.9478, test_f1: 0.6196
 epoch: 79, train_loss: 0.6302, test_loss: 0.9400, test_f1: 0.6099
 epoch: 80, train_loss: 0.6289, test_loss: 0.9449, test_f1: 0.6223
 epoch: 81, train_loss: 0.6313, test_loss: 0.9364, test_f1: 0.6302
 epoch: 82, train_loss: 0.6410, test_loss: 0.9341, test_f1: 0.6282
 epoch: 83, train_loss: 0.6218, test_loss: 0.9330, test_f1: 0.6369
 epoch: 84, train_loss: 0.6294, test_loss: 0.9403, test_f1: 0.5986
 epoch: 85, train_loss: 0.6273, test_loss: 0.9344, test_f1: 0.6448
 epoch: 86, train_loss: 0.6291, test_loss: 0.9473, test_f1: 0.6303
 epoch: 87, train_loss: 0.6204, test_loss: 0.9264, test_f1: 0.6428
 epoch: 88, train_loss: 0.6210, test_loss: 0.9510, test_f1: 0.6145
 epoch: 89, train_loss: 0.6144, test_loss: 0.9504, test_f1: 0.6452
 epoch: 90, train_loss: 0.6130, test_loss: 0.9479, test_f1: 0.6315
 epoch: 91, train_loss: 0.6194, test_loss: 0.9379, test_f1: 0.6554
 epoch: 92, train_loss: 0.5973, test_loss: 0.9383, test_f1: 0.6374
 epoch: 93, train_loss: 0.6086, test_loss: 0.9356, test_f1: 0.6496
 epoch: 94, train_loss: 0.6135, test_loss: 0.9621, test_f1: 0.6210
 epoch: 95, train_loss: 0.6040, test_loss: 0.9776, test_f1: 0.6081
 epoch: 96, train_loss: 0.6095, test_loss: 0.9475, test_f1: 0.6146
 epoch: 97, train_loss: 0.6001, test_loss: 0.9528, test_f1: 0.6176
 epoch: 98, train_loss: 0.5926, test_loss: 0.9847, test_f1: 0.6128
 epoch: 99, train_loss: 0.5979, test_loss: 0.9496, test_f1: 0.6206
##################ITERATION #2 ****************************************
 epoch: 0, train_loss: 1.2306, test_loss: 1.1698, test_f1: 0.3474
 epoch: 1, train_loss: 1.1209, test_loss: 1.0672, test_f1: 0.4497
 epoch: 2, train_loss: 1.0676, test_loss: 1.0206, test_f1: 0.4578
 epoch: 3, train_loss: 1.0241, test_loss: 0.9857, test_f1: 0.4815
 epoch: 4, train_loss: 0.9968, test_loss: 0.9552, test_f1: 0.4807
 epoch: 5, train_loss: 0.9728, test_loss: 0.9459, test_f1: 0.5338
 epoch: 6, train_loss: 0.9480, test_loss: 0.9278, test_f1: 0.5174
 epoch: 7, train_loss: 0.9396, test_loss: 0.9191, test_f1: 0.5466
 epoch: 8, train_loss: 0.9220, test_loss: 0.9225, test_f1: 0.5275
 epoch: 9, train_loss: 0.9094, test_loss: 0.9110, test_f1: 0.5425
 epoch: 10, train_loss: 0.9033, test_loss: 0.9016, test_f1: 0.5625
 epoch: 11, train_loss: 0.8958, test_loss: 0.8981, test_f1: 0.5624
 epoch: 12, train_loss: 0.8824, test_loss: 0.9034, test_f1: 0.5401
 epoch: 13, train_loss: 0.8765, test_loss: 0.9037, test_f1: 0.5472
 epoch: 14, train_loss: 0.8623, test_loss: 0.8877, test_f1: 0.5598
 epoch: 15, train_loss: 0.8538, test_loss: 0.9265, test_f1: 0.5503
 epoch: 16, train_loss: 0.8461, test_loss: 0.9129, test_f1: 0.5426
 epoch: 17, train_loss: 0.8429, test_loss: 0.8884, test_f1: 0.5663
 epoch: 18, train_loss: 0.8395, test_loss: 0.8976, test_f1: 0.5560
 epoch: 19, train_loss: 0.8247, test_loss: 0.9089, test_f1: 0.5535
 epoch: 20, train_loss: 0.8237, test_loss: 0.8936, test_f1: 0.5592
 epoch: 21, train_loss: 0.8100, test_loss: 0.8929, test_f1: 0.5629
 epoch: 22, train_loss: 0.8105, test_loss: 0.9064, test_f1: 0.5499
 epoch: 23, train_loss: 0.7974, test_loss: 0.8996, test_f1: 0.5479
 epoch: 24, train_loss: 0.7964, test_loss: 0.9034, test_f1: 0.5405
 epoch: 25, train_loss: 0.7962, test_loss: 0.9141, test_f1: 0.5543
 epoch: 26, train_loss: 0.7849, test_loss: 0.8970, test_f1: 0.5682
 epoch: 27, train_loss: 0.7792, test_loss: 0.9362, test_f1: 0.5550
 epoch: 28, train_loss: 0.7793, test_loss: 0.9281, test_f1: 0.5644
 epoch: 29, train_loss: 0.7625, test_loss: 0.9188, test_f1: 0.5784
 epoch: 30, train_loss: 0.7634, test_loss: 0.9346, test_f1: 0.5545
 epoch: 31, train_loss: 0.7573, test_loss: 0.9162, test_f1: 0.5774
 epoch: 32, train_loss: 0.7541, test_loss: 0.8830, test_f1: 0.5626
 epoch: 33, train_loss: 0.7412, test_loss: 0.8814, test_f1: 0.5637
 epoch: 34, train_loss: 0.7443, test_loss: 0.9054, test_f1: 0.5935
 epoch: 35, train_loss: 0.7422, test_loss: 0.9117, test_f1: 0.5834
 epoch: 36, train_loss: 0.7326, test_loss: 0.9185, test_f1: 0.5703
 epoch: 37, train_loss: 0.7302, test_loss: 0.9333, test_f1: 0.5897
 epoch: 38, train_loss: 0.7238, test_loss: 0.9248, test_f1: 0.5927
 epoch: 39, train_loss: 0.7162, test_loss: 0.8903, test_f1: 0.5937
 epoch: 40, train_loss: 0.7180, test_loss: 0.9062, test_f1: 0.6079
 epoch: 41, train_loss: 0.7126, test_loss: 0.8907, test_f1: 0.5934
 epoch: 42, train_loss: 0.6972, test_loss: 0.9347, test_f1: 0.5709
 epoch: 43, train_loss: 0.7012, test_loss: 0.9055, test_f1: 0.6103
 epoch: 44, train_loss: 0.7026, test_loss: 0.9006, test_f1: 0.6349
 epoch: 45, train_loss: 0.7034, test_loss: 0.9490, test_f1: 0.6035
 epoch: 46, train_loss: 0.6933, test_loss: 0.9294, test_f1: 0.5965
 epoch: 47, train_loss: 0.6862, test_loss: 0.9215, test_f1: 0.6030
 epoch: 48, train_loss: 0.6896, test_loss: 0.9394, test_f1: 0.5902
 epoch: 49, train_loss: 0.6790, test_loss: 0.9608, test_f1: 0.6154
 epoch: 50, train_loss: 0.6869, test_loss: 0.9385, test_f1: 0.6014
 epoch: 51, train_loss: 0.6558, test_loss: 0.9244, test_f1: 0.6342
 epoch: 52, train_loss: 0.6633, test_loss: 0.9232, test_f1: 0.6172
 epoch: 53, train_loss: 0.6537, test_loss: 0.9420, test_f1: 0.6215
 epoch: 54, train_loss: 0.6505, test_loss: 0.9123, test_f1: 0.6331
 epoch: 55, train_loss: 0.6474, test_loss: 0.9430, test_f1: 0.6109
 epoch: 56, train_loss: 0.6490, test_loss: 0.9255, test_f1: 0.6200
 epoch: 57, train_loss: 0.6452, test_loss: 0.9169, test_f1: 0.6278
 epoch: 58, train_loss: 0.6423, test_loss: 0.9214, test_f1: 0.6276
 epoch: 59, train_loss: 0.6443, test_loss: 0.9359, test_f1: 0.6246
 epoch: 60, train_loss: 0.6435, test_loss: 0.9468, test_f1: 0.6235
 epoch: 61, train_loss: 0.6372, test_loss: 0.9336, test_f1: 0.6320
 epoch: 62, train_loss: 0.6285, test_loss: 0.9653, test_f1: 0.6119
 epoch: 63, train_loss: 0.6318, test_loss: 0.9874, test_f1: 0.6223
 epoch: 64, train_loss: 0.6358, test_loss: 0.9279, test_f1: 0.6348
 epoch: 65, train_loss: 0.6288, test_loss: 0.9508, test_f1: 0.6337
 epoch: 66, train_loss: 0.6229, test_loss: 0.9646, test_f1: 0.6235
 epoch: 67, train_loss: 0.6221, test_loss: 0.9347, test_f1: 0.6356
 epoch: 68, train_loss: 0.6228, test_loss: 0.9568, test_f1: 0.6303
 epoch: 69, train_loss: 0.6318, test_loss: 0.9502, test_f1: 0.6312
 epoch: 70, train_loss: 0.6177, test_loss: 0.9454, test_f1: 0.6168
 epoch: 71, train_loss: 0.6073, test_loss: 0.9783, test_f1: 0.6361
 epoch: 72, train_loss: 0.6059, test_loss: 0.9560, test_f1: 0.6428
 epoch: 73, train_loss: 0.6197, test_loss: 0.9761, test_f1: 0.6047
 epoch: 74, train_loss: 0.6093, test_loss: 1.0019, test_f1: 0.6262
 epoch: 75, train_loss: 0.6185, test_loss: 0.9439, test_f1: 0.6483
 epoch: 76, train_loss: 0.6000, test_loss: 0.9480, test_f1: 0.6357
 epoch: 77, train_loss: 0.6035, test_loss: 0.9846, test_f1: 0.6366
 epoch: 78, train_loss: 0.5992, test_loss: 0.9889, test_f1: 0.6495
 epoch: 79, train_loss: 0.5901, test_loss: 0.9659, test_f1: 0.6450
 epoch: 80, train_loss: 0.5938, test_loss: 0.9573, test_f1: 0.6449
 epoch: 81, train_loss: 0.5968, test_loss: 0.9962, test_f1: 0.6674
 epoch: 82, train_loss: 0.5927, test_loss: 0.9713, test_f1: 0.6370
 epoch: 83, train_loss: 0.5923, test_loss: 0.9766, test_f1: 0.6438
 epoch: 84, train_loss: 0.5920, test_loss: 0.9802, test_f1: 0.6359
 epoch: 85, train_loss: 0.5930, test_loss: 0.9964, test_f1: 0.6302
 epoch: 86, train_loss: 0.5715, test_loss: 0.9882, test_f1: 0.6357
 epoch: 87, train_loss: 0.5810, test_loss: 0.9931, test_f1: 0.6465
 epoch: 88, train_loss: 0.5913, test_loss: 1.0129, test_f1: 0.6322
 epoch: 89, train_loss: 0.5875, test_loss: 0.9772, test_f1: 0.6636
 epoch: 90, train_loss: 0.5860, test_loss: 0.9839, test_f1: 0.6627
 epoch: 91, train_loss: 0.5761, test_loss: 0.9744, test_f1: 0.6680
 epoch: 92, train_loss: 0.5763, test_loss: 1.0055, test_f1: 0.6345
 epoch: 93, train_loss: 0.5733, test_loss: 1.0253, test_f1: 0.6464
 epoch: 94, train_loss: 0.5852, test_loss: 1.0137, test_f1: 0.6565
 epoch: 95, train_loss: 0.5615, test_loss: 1.0044, test_f1: 0.6407
 epoch: 96, train_loss: 0.5820, test_loss: 1.0176, test_f1: 0.6550
 epoch: 97, train_loss: 0.5731, test_loss: 1.0161, test_f1: 0.6552
 epoch: 98, train_loss: 0.5654, test_loss: 1.0227, test_f1: 0.6463
 epoch: 99, train_loss: 0.5584, test_loss: 1.0162, test_f1: 0.6579
##################ITERATION #3 ****************************************
 epoch: 0, train_loss: 1.2078, test_loss: 1.1311, test_f1: 0.3655
 epoch: 1, train_loss: 1.0867, test_loss: 1.0151, test_f1: 0.4955
 epoch: 2, train_loss: 1.0433, test_loss: 0.9888, test_f1: 0.5001
 epoch: 3, train_loss: 0.9978, test_loss: 0.9606, test_f1: 0.5107
 epoch: 4, train_loss: 0.9734, test_loss: 0.9395, test_f1: 0.5042
 epoch: 5, train_loss: 0.9623, test_loss: 0.9375, test_f1: 0.5312
 epoch: 6, train_loss: 0.9407, test_loss: 0.9271, test_f1: 0.5334
 epoch: 7, train_loss: 0.9323, test_loss: 0.9097, test_f1: 0.5494
 epoch: 8, train_loss: 0.9124, test_loss: 0.9058, test_f1: 0.5508
 epoch: 9, train_loss: 0.9013, test_loss: 0.8965, test_f1: 0.5356
 epoch: 10, train_loss: 0.8969, test_loss: 0.8897, test_f1: 0.5601
 epoch: 11, train_loss: 0.8768, test_loss: 0.8968, test_f1: 0.5468
 epoch: 12, train_loss: 0.8749, test_loss: 0.8948, test_f1: 0.5536
 epoch: 13, train_loss: 0.8671, test_loss: 0.8994, test_f1: 0.5413
 epoch: 14, train_loss: 0.8642, test_loss: 0.8913, test_f1: 0.5524
 epoch: 15, train_loss: 0.8536, test_loss: 0.9074, test_f1: 0.5547
 epoch: 16, train_loss: 0.8426, test_loss: 0.9034, test_f1: 0.5410
 epoch: 17, train_loss: 0.8458, test_loss: 0.8995, test_f1: 0.5507
 epoch: 18, train_loss: 0.8329, test_loss: 0.9093, test_f1: 0.5473
 epoch: 19, train_loss: 0.8276, test_loss: 0.8901, test_f1: 0.5464
 epoch: 20, train_loss: 0.8209, test_loss: 0.8843, test_f1: 0.5391
 epoch: 21, train_loss: 0.8061, test_loss: 0.9048, test_f1: 0.5411
 epoch: 22, train_loss: 0.8124, test_loss: 0.9069, test_f1: 0.5384
 epoch: 23, train_loss: 0.8095, test_loss: 0.8942, test_f1: 0.5520
 epoch: 24, train_loss: 0.7958, test_loss: 0.9284, test_f1: 0.5438
 epoch: 25, train_loss: 0.7937, test_loss: 0.9140, test_f1: 0.5458
 epoch: 26, train_loss: 0.7905, test_loss: 0.9102, test_f1: 0.5585
 epoch: 27, train_loss: 0.7825, test_loss: 0.9202, test_f1: 0.5559
 epoch: 28, train_loss: 0.7794, test_loss: 0.9562, test_f1: 0.5701
 epoch: 29, train_loss: 0.7710, test_loss: 0.9127, test_f1: 0.5748
 epoch: 30, train_loss: 0.7533, test_loss: 0.9020, test_f1: 0.5771
 epoch: 31, train_loss: 0.7567, test_loss: 0.9445, test_f1: 0.5469
 epoch: 32, train_loss: 0.7667, test_loss: 0.9173, test_f1: 0.5714
 epoch: 33, train_loss: 0.7452, test_loss: 0.9110, test_f1: 0.5899
 epoch: 34, train_loss: 0.7405, test_loss: 0.9030, test_f1: 0.5716
 epoch: 35, train_loss: 0.7439, test_loss: 0.9373, test_f1: 0.5665
 epoch: 36, train_loss: 0.7434, test_loss: 0.9353, test_f1: 0.5701
 epoch: 37, train_loss: 0.7354, test_loss: 0.9276, test_f1: 0.5841
 epoch: 38, train_loss: 0.7361, test_loss: 0.9659, test_f1: 0.5719
 epoch: 39, train_loss: 0.7222, test_loss: 0.9461, test_f1: 0.5686
 epoch: 40, train_loss: 0.7266, test_loss: 0.9341, test_f1: 0.5773
 epoch: 41, train_loss: 0.7255, test_loss: 0.9280, test_f1: 0.5886
 epoch: 42, train_loss: 0.7118, test_loss: 0.9450, test_f1: 0.6014
 epoch: 43, train_loss: 0.7140, test_loss: 0.9530, test_f1: 0.6065
 epoch: 44, train_loss: 0.6983, test_loss: 0.9671, test_f1: 0.6088
 epoch: 45, train_loss: 0.7097, test_loss: 0.9677, test_f1: 0.5986
 epoch: 46, train_loss: 0.6847, test_loss: 0.9480, test_f1: 0.5910
 epoch: 47, train_loss: 0.6856, test_loss: 0.9761, test_f1: 0.5858
 epoch: 48, train_loss: 0.6870, test_loss: 0.9673, test_f1: 0.6028
 epoch: 49, train_loss: 0.6816, test_loss: 0.9625, test_f1: 0.6171
 epoch: 50, train_loss: 0.6833, test_loss: 0.9560, test_f1: 0.6018
 epoch: 51, train_loss: 0.6736, test_loss: 0.9649, test_f1: 0.6104
 epoch: 52, train_loss: 0.6729, test_loss: 0.9773, test_f1: 0.6067
 epoch: 53, train_loss: 0.6591, test_loss: 0.9665, test_f1: 0.6122
 epoch: 54, train_loss: 0.6599, test_loss: 0.9848, test_f1: 0.6153
 epoch: 55, train_loss: 0.6604, test_loss: 0.9601, test_f1: 0.6206
 epoch: 56, train_loss: 0.6584, test_loss: 0.9882, test_f1: 0.6156
 epoch: 57, train_loss: 0.6454, test_loss: 0.9877, test_f1: 0.6063
 epoch: 58, train_loss: 0.6489, test_loss: 0.9884, test_f1: 0.6089
 epoch: 59, train_loss: 0.6541, test_loss: 1.0056, test_f1: 0.6135
 epoch: 60, train_loss: 0.6480, test_loss: 0.9793, test_f1: 0.6046
 epoch: 61, train_loss: 0.6565, test_loss: 0.9899, test_f1: 0.6020
 epoch: 62, train_loss: 0.6469, test_loss: 0.9756, test_f1: 0.6030
 epoch: 63, train_loss: 0.6493, test_loss: 1.0054, test_f1: 0.6044
 epoch: 64, train_loss: 0.6393, test_loss: 0.9916, test_f1: 0.6157
 epoch: 65, train_loss: 0.6380, test_loss: 0.9848, test_f1: 0.6099
 epoch: 66, train_loss: 0.6376, test_loss: 0.9858, test_f1: 0.6300
 epoch: 67, train_loss: 0.6421, test_loss: 1.0094, test_f1: 0.6120
 epoch: 68, train_loss: 0.6380, test_loss: 1.0088, test_f1: 0.6132
 epoch: 69, train_loss: 0.6314, test_loss: 1.0330, test_f1: 0.6209
 epoch: 70, train_loss: 0.6291, test_loss: 1.0245, test_f1: 0.6015
 epoch: 71, train_loss: 0.6254, test_loss: 1.0113, test_f1: 0.6161
 epoch: 72, train_loss: 0.6369, test_loss: 1.0178, test_f1: 0.6188
 epoch: 73, train_loss: 0.6365, test_loss: 1.0423, test_f1: 0.6185
 epoch: 74, train_loss: 0.6272, test_loss: 1.0188, test_f1: 0.6236
 epoch: 75, train_loss: 0.6256, test_loss: 1.0247, test_f1: 0.6165
 epoch: 76, train_loss: 0.6313, test_loss: 1.0297, test_f1: 0.6286
 epoch: 77, train_loss: 0.6148, test_loss: 1.0269, test_f1: 0.6162
 epoch: 78, train_loss: 0.6087, test_loss: 1.0258, test_f1: 0.6166
 epoch: 79, train_loss: 0.6138, test_loss: 1.0198, test_f1: 0.6160
 epoch: 80, train_loss: 0.6172, test_loss: 1.0353, test_f1: 0.6172
 epoch: 81, train_loss: 0.6108, test_loss: 1.0185, test_f1: 0.6125
 epoch: 82, train_loss: 0.6041, test_loss: 1.0185, test_f1: 0.6134
 epoch: 83, train_loss: 0.6102, test_loss: 1.0346, test_f1: 0.6099
 epoch: 84, train_loss: 0.6056, test_loss: 1.0309, test_f1: 0.6154
 epoch: 85, train_loss: 0.6180, test_loss: 1.0447, test_f1: 0.6151
 epoch: 86, train_loss: 0.6009, test_loss: 1.0296, test_f1: 0.6167
 epoch: 87, train_loss: 0.5867, test_loss: 1.0489, test_f1: 0.6534
 epoch: 88, train_loss: 0.5891, test_loss: 1.0524, test_f1: 0.6088
 epoch: 89, train_loss: 0.6014, test_loss: 1.0576, test_f1: 0.6259
 epoch: 90, train_loss: 0.6021, test_loss: 1.0376, test_f1: 0.6265
 epoch: 91, train_loss: 0.5940, test_loss: 1.0351, test_f1: 0.6148
 epoch: 92, train_loss: 0.5939, test_loss: 1.0665, test_f1: 0.6105
 epoch: 93, train_loss: 0.5952, test_loss: 1.0467, test_f1: 0.6171
 epoch: 94, train_loss: 0.5914, test_loss: 1.0311, test_f1: 0.6293
 epoch: 95, train_loss: 0.5911, test_loss: 1.0592, test_f1: 0.6370
 epoch: 96, train_loss: 0.5989, test_loss: 1.0554, test_f1: 0.6257
 epoch: 97, train_loss: 0.5860, test_loss: 1.0733, test_f1: 0.6152
 epoch: 98, train_loss: 0.5819, test_loss: 1.0847, test_f1: 0.6003
 epoch: 99, train_loss: 0.5760, test_loss: 1.0508, test_f1: 0.6276
##################ITERATION #4 ****************************************
 epoch: 0, train_loss: 1.2252, test_loss: 1.1191, test_f1: 0.4260
 epoch: 1, train_loss: 1.0985, test_loss: 1.0101, test_f1: 0.4739
 epoch: 2, train_loss: 1.0640, test_loss: 0.9771, test_f1: 0.4888
 epoch: 3, train_loss: 1.0392, test_loss: 0.9557, test_f1: 0.4735
 epoch: 4, train_loss: 1.0083, test_loss: 0.9438, test_f1: 0.4956
 epoch: 5, train_loss: 0.9866, test_loss: 0.9396, test_f1: 0.5161
 epoch: 6, train_loss: 0.9913, test_loss: 0.9303, test_f1: 0.5151
 epoch: 7, train_loss: 0.9565, test_loss: 0.9154, test_f1: 0.5153
 epoch: 8, train_loss: 0.9434, test_loss: 0.9155, test_f1: 0.5228
 epoch: 9, train_loss: 0.9224, test_loss: 0.9058, test_f1: 0.5319
 epoch: 10, train_loss: 0.9189, test_loss: 0.9018, test_f1: 0.5229
 epoch: 11, train_loss: 0.9114, test_loss: 0.9088, test_f1: 0.5410
 epoch: 12, train_loss: 0.9032, test_loss: 0.8922, test_f1: 0.5367
 epoch: 13, train_loss: 0.8934, test_loss: 0.8866, test_f1: 0.5497
 epoch: 14, train_loss: 0.8928, test_loss: 0.9043, test_f1: 0.5382
 epoch: 15, train_loss: 0.8764, test_loss: 0.8900, test_f1: 0.5531
 epoch: 16, train_loss: 0.8708, test_loss: 0.8668, test_f1: 0.5340
 epoch: 17, train_loss: 0.8537, test_loss: 0.8627, test_f1: 0.5364
 epoch: 18, train_loss: 0.8604, test_loss: 0.8745, test_f1: 0.5245
 epoch: 19, train_loss: 0.8535, test_loss: 0.8794, test_f1: 0.5372
 epoch: 20, train_loss: 0.8392, test_loss: 0.8745, test_f1: 0.5682
 epoch: 21, train_loss: 0.8335, test_loss: 0.8595, test_f1: 0.5304
 epoch: 22, train_loss: 0.8253, test_loss: 0.8714, test_f1: 0.5593
 epoch: 23, train_loss: 0.8188, test_loss: 0.8807, test_f1: 0.5580
 epoch: 24, train_loss: 0.8122, test_loss: 0.8701, test_f1: 0.5657
 epoch: 25, train_loss: 0.8164, test_loss: 0.8706, test_f1: 0.5493
 epoch: 26, train_loss: 0.8216, test_loss: 0.8722, test_f1: 0.5676
 epoch: 27, train_loss: 0.7937, test_loss: 0.8618, test_f1: 0.5526
 epoch: 28, train_loss: 0.7937, test_loss: 0.9052, test_f1: 0.5467
 epoch: 29, train_loss: 0.7986, test_loss: 0.8771, test_f1: 0.5590
 epoch: 30, train_loss: 0.7899, test_loss: 0.8540, test_f1: 0.5698
 epoch: 31, train_loss: 0.7796, test_loss: 0.8675, test_f1: 0.5768
 epoch: 32, train_loss: 0.7810, test_loss: 0.8787, test_f1: 0.5817
 epoch: 33, train_loss: 0.7731, test_loss: 0.8668, test_f1: 0.5684
 epoch: 34, train_loss: 0.7758, test_loss: 0.8976, test_f1: 0.5800
 epoch: 35, train_loss: 0.7530, test_loss: 0.8803, test_f1: 0.5944
 epoch: 36, train_loss: 0.7528, test_loss: 0.8654, test_f1: 0.5833
 epoch: 37, train_loss: 0.7565, test_loss: 0.8691, test_f1: 0.5905
 epoch: 38, train_loss: 0.7569, test_loss: 0.8757, test_f1: 0.5922
 epoch: 39, train_loss: 0.7402, test_loss: 0.8523, test_f1: 0.6134
 epoch: 40, train_loss: 0.7444, test_loss: 0.8753, test_f1: 0.5842
 epoch: 41, train_loss: 0.7317, test_loss: 0.8624, test_f1: 0.5850
 epoch: 42, train_loss: 0.7464, test_loss: 0.9020, test_f1: 0.5860
 epoch: 43, train_loss: 0.7429, test_loss: 0.9041, test_f1: 0.5928
 epoch: 44, train_loss: 0.7317, test_loss: 0.8771, test_f1: 0.6339
 epoch: 45, train_loss: 0.7220, test_loss: 0.9242, test_f1: 0.5857
 epoch: 46, train_loss: 0.7092, test_loss: 0.8858, test_f1: 0.6120
 epoch: 47, train_loss: 0.7021, test_loss: 0.9045, test_f1: 0.6012
 epoch: 48, train_loss: 0.7035, test_loss: 0.9099, test_f1: 0.6191
 epoch: 49, train_loss: 0.7092, test_loss: 0.8807, test_f1: 0.6041
 epoch: 50, train_loss: 0.6994, test_loss: 0.8924, test_f1: 0.6186
 epoch: 51, train_loss: 0.6983, test_loss: 0.8960, test_f1: 0.6115
 epoch: 52, train_loss: 0.6917, test_loss: 0.8922, test_f1: 0.6180
 epoch: 53, train_loss: 0.6800, test_loss: 0.8856, test_f1: 0.6164
 epoch: 54, train_loss: 0.6699, test_loss: 0.9034, test_f1: 0.6131
 epoch: 55, train_loss: 0.6843, test_loss: 0.9040, test_f1: 0.6360
 epoch: 56, train_loss: 0.6864, test_loss: 0.8867, test_f1: 0.6081
 epoch: 57, train_loss: 0.6741, test_loss: 0.8965, test_f1: 0.6168
 epoch: 58, train_loss: 0.6669, test_loss: 0.8730, test_f1: 0.6223
 epoch: 59, train_loss: 0.6597, test_loss: 0.8846, test_f1: 0.6160
 epoch: 60, train_loss: 0.6695, test_loss: 0.8994, test_f1: 0.6152
 epoch: 61, train_loss: 0.6704, test_loss: 0.9150, test_f1: 0.6038
 epoch: 62, train_loss: 0.6618, test_loss: 0.8856, test_f1: 0.6228
 epoch: 63, train_loss: 0.6598, test_loss: 0.9023, test_f1: 0.6285
 epoch: 64, train_loss: 0.6656, test_loss: 0.9063, test_f1: 0.6182
 epoch: 65, train_loss: 0.6552, test_loss: 0.8960, test_f1: 0.6117
 epoch: 66, train_loss: 0.6648, test_loss: 0.9194, test_f1: 0.6339
 epoch: 67, train_loss: 0.6531, test_loss: 0.9202, test_f1: 0.6307
 epoch: 68, train_loss: 0.6485, test_loss: 0.9185, test_f1: 0.6216
 epoch: 69, train_loss: 0.6421, test_loss: 0.9120, test_f1: 0.6277
 epoch: 70, train_loss: 0.6500, test_loss: 0.9158, test_f1: 0.6329
 epoch: 71, train_loss: 0.6491, test_loss: 0.9382, test_f1: 0.6184
 epoch: 72, train_loss: 0.6476, test_loss: 0.9283, test_f1: 0.6155
 epoch: 73, train_loss: 0.6353, test_loss: 0.9162, test_f1: 0.6297
 epoch: 74, train_loss: 0.6485, test_loss: 0.9196, test_f1: 0.6365
 epoch: 75, train_loss: 0.6431, test_loss: 0.9242, test_f1: 0.6195
 epoch: 76, train_loss: 0.6412, test_loss: 0.9249, test_f1: 0.6380
 epoch: 77, train_loss: 0.6376, test_loss: 0.9327, test_f1: 0.6295
 epoch: 78, train_loss: 0.6356, test_loss: 0.9400, test_f1: 0.6140
 epoch: 79, train_loss: 0.6281, test_loss: 0.9290, test_f1: 0.6264
 epoch: 80, train_loss: 0.6187, test_loss: 0.9263, test_f1: 0.6295
 epoch: 81, train_loss: 0.6205, test_loss: 0.9346, test_f1: 0.6364
 epoch: 82, train_loss: 0.6272, test_loss: 0.9175, test_f1: 0.6206
 epoch: 83, train_loss: 0.6197, test_loss: 0.9279, test_f1: 0.6372
 epoch: 84, train_loss: 0.6185, test_loss: 0.9297, test_f1: 0.6520
 epoch: 85, train_loss: 0.6087, test_loss: 0.9500, test_f1: 0.6340
 epoch: 86, train_loss: 0.6171, test_loss: 0.9391, test_f1: 0.6167
 epoch: 87, train_loss: 0.6260, test_loss: 0.9214, test_f1: 0.6445
 epoch: 88, train_loss: 0.6075, test_loss: 0.9580, test_f1: 0.6301
 epoch: 89, train_loss: 0.6136, test_loss: 0.9563, test_f1: 0.6303
 epoch: 90, train_loss: 0.6065, test_loss: 0.9361, test_f1: 0.6451
 epoch: 91, train_loss: 0.6191, test_loss: 0.9402, test_f1: 0.6415
 epoch: 92, train_loss: 0.6048, test_loss: 0.9609, test_f1: 0.6333
 epoch: 93, train_loss: 0.6122, test_loss: 0.9386, test_f1: 0.6424
 epoch: 94, train_loss: 0.6017, test_loss: 0.9450, test_f1: 0.6320
 epoch: 95, train_loss: 0.5895, test_loss: 0.9527, test_f1: 0.6260
 epoch: 96, train_loss: 0.5990, test_loss: 0.9485, test_f1: 0.6631
 epoch: 97, train_loss: 0.5899, test_loss: 0.9634, test_f1: 0.6351
 epoch: 98, train_loss: 0.5902, test_loss: 0.9701, test_f1: 0.6441
 epoch: 99, train_loss: 0.5925, test_loss: 0.9938, test_f1: 0.6277
##################ITERATION #5 ****************************************
 epoch: 0, train_loss: 1.2373, test_loss: 1.0745, test_f1: 0.4522
 epoch: 1, train_loss: 1.0952, test_loss: 1.0029, test_f1: 0.4754
 epoch: 2, train_loss: 1.0582, test_loss: 0.9760, test_f1: 0.4857
 epoch: 3, train_loss: 1.0103, test_loss: 0.9572, test_f1: 0.4957
 epoch: 4, train_loss: 0.9886, test_loss: 0.9424, test_f1: 0.4987
 epoch: 5, train_loss: 0.9816, test_loss: 0.9245, test_f1: 0.5038
 epoch: 6, train_loss: 0.9587, test_loss: 0.9364, test_f1: 0.5011
 epoch: 7, train_loss: 0.9411, test_loss: 0.9200, test_f1: 0.5199
 epoch: 8, train_loss: 0.9307, test_loss: 0.9247, test_f1: 0.5138
 epoch: 9, train_loss: 0.9248, test_loss: 0.9091, test_f1: 0.5312
 epoch: 10, train_loss: 0.9070, test_loss: 0.9137, test_f1: 0.5187
 epoch: 11, train_loss: 0.9136, test_loss: 0.9098, test_f1: 0.5333
 epoch: 12, train_loss: 0.8920, test_loss: 0.9060, test_f1: 0.5163
 epoch: 13, train_loss: 0.8841, test_loss: 0.9068, test_f1: 0.5295
 epoch: 14, train_loss: 0.8754, test_loss: 0.9131, test_f1: 0.5278
 epoch: 15, train_loss: 0.8630, test_loss: 0.9105, test_f1: 0.5433
 epoch: 16, train_loss: 0.8584, test_loss: 0.9361, test_f1: 0.5286
 epoch: 17, train_loss: 0.8462, test_loss: 0.9013, test_f1: 0.5399
 epoch: 18, train_loss: 0.8390, test_loss: 0.9100, test_f1: 0.5371
 epoch: 19, train_loss: 0.8369, test_loss: 0.9170, test_f1: 0.5459
 epoch: 20, train_loss: 0.8337, test_loss: 0.9230, test_f1: 0.5398
 epoch: 21, train_loss: 0.8231, test_loss: 0.9079, test_f1: 0.5554
 epoch: 22, train_loss: 0.8248, test_loss: 0.9262, test_f1: 0.5593
 epoch: 23, train_loss: 0.8226, test_loss: 0.9147, test_f1: 0.5569
 epoch: 24, train_loss: 0.8022, test_loss: 0.9077, test_f1: 0.5465
 epoch: 25, train_loss: 0.7971, test_loss: 0.9041, test_f1: 0.5621
 epoch: 26, train_loss: 0.7967, test_loss: 0.9247, test_f1: 0.5461
 epoch: 27, train_loss: 0.8026, test_loss: 0.9300, test_f1: 0.5534
 epoch: 28, train_loss: 0.7875, test_loss: 0.9205, test_f1: 0.5521
 epoch: 29, train_loss: 0.7815, test_loss: 0.9148, test_f1: 0.5641
 epoch: 30, train_loss: 0.7700, test_loss: 0.9458, test_f1: 0.5530
 epoch: 31, train_loss: 0.7731, test_loss: 0.8926, test_f1: 0.5759
 epoch: 32, train_loss: 0.7663, test_loss: 0.9267, test_f1: 0.5516
 epoch: 33, train_loss: 0.7619, test_loss: 0.9216, test_f1: 0.5556
 epoch: 34, train_loss: 0.7535, test_loss: 0.9228, test_f1: 0.5816
 epoch: 35, train_loss: 0.7619, test_loss: 0.9003, test_f1: 0.5949
 epoch: 36, train_loss: 0.7530, test_loss: 0.9142, test_f1: 0.5876
 epoch: 37, train_loss: 0.7549, test_loss: 0.9263, test_f1: 0.5958
 epoch: 38, train_loss: 0.7333, test_loss: 0.9156, test_f1: 0.5893
 epoch: 39, train_loss: 0.7403, test_loss: 0.9290, test_f1: 0.5839
 epoch: 40, train_loss: 0.7276, test_loss: 0.9330, test_f1: 0.5742
 epoch: 41, train_loss: 0.7296, test_loss: 0.9221, test_f1: 0.5694
 epoch: 42, train_loss: 0.7225, test_loss: 1.0075, test_f1: 0.5506
 epoch: 43, train_loss: 0.7136, test_loss: 0.9159, test_f1: 0.6107
 epoch: 44, train_loss: 0.7130, test_loss: 0.9562, test_f1: 0.5928
 epoch: 45, train_loss: 0.7109, test_loss: 0.9216, test_f1: 0.5843
 epoch: 46, train_loss: 0.7068, test_loss: 0.9288, test_f1: 0.6178
 epoch: 47, train_loss: 0.6980, test_loss: 0.9416, test_f1: 0.6029
 epoch: 48, train_loss: 0.6907, test_loss: 0.9542, test_f1: 0.5858
 epoch: 49, train_loss: 0.6953, test_loss: 0.9559, test_f1: 0.5950
 epoch: 50, train_loss: 0.6874, test_loss: 0.9331, test_f1: 0.5915
 epoch: 51, train_loss: 0.6758, test_loss: 0.9375, test_f1: 0.6122
 epoch: 52, train_loss: 0.6801, test_loss: 0.9546, test_f1: 0.5929
 epoch: 53, train_loss: 0.6707, test_loss: 0.9427, test_f1: 0.6037
 epoch: 54, train_loss: 0.6641, test_loss: 0.9464, test_f1: 0.5909
 epoch: 55, train_loss: 0.6698, test_loss: 0.9321, test_f1: 0.6248
 epoch: 56, train_loss: 0.6718, test_loss: 0.9557, test_f1: 0.6131
 epoch: 57, train_loss: 0.6677, test_loss: 0.9385, test_f1: 0.6355
 epoch: 58, train_loss: 0.6526, test_loss: 0.9485, test_f1: 0.6037
 epoch: 59, train_loss: 0.6633, test_loss: 0.9475, test_f1: 0.6042
 epoch: 60, train_loss: 0.6490, test_loss: 0.9361, test_f1: 0.6193
 epoch: 61, train_loss: 0.6551, test_loss: 0.9402, test_f1: 0.6192
 epoch: 62, train_loss: 0.6478, test_loss: 0.9621, test_f1: 0.6150
 epoch: 63, train_loss: 0.6620, test_loss: 0.9445, test_f1: 0.6206
 epoch: 64, train_loss: 0.6419, test_loss: 0.9568, test_f1: 0.6208
 epoch: 65, train_loss: 0.6393, test_loss: 0.9405, test_f1: 0.6302
 epoch: 66, train_loss: 0.6392, test_loss: 0.9412, test_f1: 0.6372
 epoch: 67, train_loss: 0.6367, test_loss: 0.9561, test_f1: 0.6246
 epoch: 68, train_loss: 0.6435, test_loss: 0.9647, test_f1: 0.6072
 epoch: 69, train_loss: 0.6373, test_loss: 0.9716, test_f1: 0.6261
 epoch: 70, train_loss: 0.6284, test_loss: 0.9644, test_f1: 0.6363
 epoch: 71, train_loss: 0.6400, test_loss: 0.9720, test_f1: 0.6331
 epoch: 72, train_loss: 0.6245, test_loss: 0.9862, test_f1: 0.6145
 epoch: 73, train_loss: 0.6430, test_loss: 0.9747, test_f1: 0.6351
 epoch: 74, train_loss: 0.6430, test_loss: 0.9642, test_f1: 0.6522
 epoch: 75, train_loss: 0.6215, test_loss: 0.9895, test_f1: 0.6322
 epoch: 76, train_loss: 0.6213, test_loss: 1.0002, test_f1: 0.6188
 epoch: 77, train_loss: 0.6290, test_loss: 1.0003, test_f1: 0.6361
 epoch: 78, train_loss: 0.6235, test_loss: 0.9959, test_f1: 0.6349
 epoch: 79, train_loss: 0.6439, test_loss: 1.0049, test_f1: 0.6292
 epoch: 80, train_loss: 0.6189, test_loss: 0.9656, test_f1: 0.6583
 epoch: 81, train_loss: 0.6194, test_loss: 0.9832, test_f1: 0.6409
 epoch: 82, train_loss: 0.6131, test_loss: 0.9977, test_f1: 0.6369
 epoch: 83, train_loss: 0.6135, test_loss: 0.9626, test_f1: 0.6355
 epoch: 84, train_loss: 0.6172, test_loss: 1.0313, test_f1: 0.6278
 epoch: 85, train_loss: 0.6069, test_loss: 1.0088, test_f1: 0.6305
 epoch: 86, train_loss: 0.6155, test_loss: 1.0305, test_f1: 0.6272
 epoch: 87, train_loss: 0.6182, test_loss: 1.0287, test_f1: 0.6352
 epoch: 88, train_loss: 0.6083, test_loss: 1.0053, test_f1: 0.6494
 epoch: 89, train_loss: 0.6036, test_loss: 1.0117, test_f1: 0.6358
 epoch: 90, train_loss: 0.5977, test_loss: 0.9925, test_f1: 0.6425
 epoch: 91, train_loss: 0.5896, test_loss: 1.0228, test_f1: 0.6235
 epoch: 92, train_loss: 0.6062, test_loss: 1.0167, test_f1: 0.6432
 epoch: 93, train_loss: 0.5986, test_loss: 1.0068, test_f1: 0.6467
 epoch: 94, train_loss: 0.5931, test_loss: 1.0385, test_f1: 0.6400
 epoch: 95, train_loss: 0.5991, test_loss: 1.0469, test_f1: 0.6343
 epoch: 96, train_loss: 0.6044, test_loss: 0.9998, test_f1: 0.6368
 epoch: 97, train_loss: 0.5833, test_loss: 1.0826, test_f1: 0.6408
 epoch: 98, train_loss: 0.5941, test_loss: 1.0395, test_f1: 0.6345
 epoch: 99, train_loss: 0.5953, test_loss: 1.0325, test_f1: 0.6322
##################ITERATION #6 ****************************************
 epoch: 0, train_loss: 1.2360, test_loss: 1.0738, test_f1: 0.4265
 epoch: 1, train_loss: 1.0831, test_loss: 0.9861, test_f1: 0.4858
 epoch: 2, train_loss: 1.0569, test_loss: 0.9624, test_f1: 0.5002
 epoch: 3, train_loss: 1.0264, test_loss: 0.9536, test_f1: 0.5047
 epoch: 4, train_loss: 0.9918, test_loss: 0.9378, test_f1: 0.5098
 epoch: 5, train_loss: 0.9725, test_loss: 0.9460, test_f1: 0.5295
 epoch: 6, train_loss: 0.9574, test_loss: 0.9306, test_f1: 0.5173
 epoch: 7, train_loss: 0.9366, test_loss: 0.9206, test_f1: 0.5534
 epoch: 8, train_loss: 0.9457, test_loss: 0.9067, test_f1: 0.5254
 epoch: 9, train_loss: 0.9165, test_loss: 0.9169, test_f1: 0.5537
 epoch: 10, train_loss: 0.9188, test_loss: 0.9038, test_f1: 0.5158
 epoch: 11, train_loss: 0.9106, test_loss: 0.9193, test_f1: 0.5229
 epoch: 12, train_loss: 0.8927, test_loss: 0.9029, test_f1: 0.5355
 epoch: 13, train_loss: 0.8958, test_loss: 0.9148, test_f1: 0.5323
 epoch: 14, train_loss: 0.8852, test_loss: 0.9008, test_f1: 0.5326
 epoch: 15, train_loss: 0.8676, test_loss: 0.8909, test_f1: 0.5358
 epoch: 16, train_loss: 0.8586, test_loss: 0.8954, test_f1: 0.5538
 epoch: 17, train_loss: 0.8593, test_loss: 0.8927, test_f1: 0.5418
 epoch: 18, train_loss: 0.8503, test_loss: 0.8910, test_f1: 0.5342
 epoch: 19, train_loss: 0.8508, test_loss: 0.8806, test_f1: 0.5409
 epoch: 20, train_loss: 0.8478, test_loss: 0.8663, test_f1: 0.5387
 epoch: 21, train_loss: 0.8396, test_loss: 0.8730, test_f1: 0.5485
 epoch: 22, train_loss: 0.8263, test_loss: 0.8657, test_f1: 0.5634
 epoch: 23, train_loss: 0.8192, test_loss: 0.8779, test_f1: 0.5584
 epoch: 24, train_loss: 0.8266, test_loss: 0.9012, test_f1: 0.5626
 epoch: 25, train_loss: 0.8256, test_loss: 0.8830, test_f1: 0.5501
 epoch: 26, train_loss: 0.8110, test_loss: 0.8777, test_f1: 0.5560
 epoch: 27, train_loss: 0.7923, test_loss: 0.8590, test_f1: 0.5697
 epoch: 28, train_loss: 0.7919, test_loss: 0.8857, test_f1: 0.5518
 epoch: 29, train_loss: 0.7976, test_loss: 0.9121, test_f1: 0.5783
 epoch: 30, train_loss: 0.7887, test_loss: 0.8703, test_f1: 0.5500
 epoch: 31, train_loss: 0.7751, test_loss: 0.8842, test_f1: 0.5699
 epoch: 32, train_loss: 0.7895, test_loss: 0.8843, test_f1: 0.5577
 epoch: 33, train_loss: 0.7719, test_loss: 0.8808, test_f1: 0.5603
 epoch: 34, train_loss: 0.7664, test_loss: 0.8933, test_f1: 0.5708
 epoch: 35, train_loss: 0.7581, test_loss: 0.8910, test_f1: 0.5845
 epoch: 36, train_loss: 0.7603, test_loss: 0.9075, test_f1: 0.5853
 epoch: 37, train_loss: 0.7586, test_loss: 0.8789, test_f1: 0.5792
 epoch: 38, train_loss: 0.7556, test_loss: 0.9071, test_f1: 0.5897
 epoch: 39, train_loss: 0.7450, test_loss: 0.8957, test_f1: 0.6183
 epoch: 40, train_loss: 0.7417, test_loss: 0.8794, test_f1: 0.5895
 epoch: 41, train_loss: 0.7338, test_loss: 0.8917, test_f1: 0.5920
 epoch: 42, train_loss: 0.7350, test_loss: 0.9242, test_f1: 0.5808
 epoch: 43, train_loss: 0.7221, test_loss: 0.9015, test_f1: 0.5759
 epoch: 44, train_loss: 0.7315, test_loss: 0.9058, test_f1: 0.5998
 epoch: 45, train_loss: 0.7229, test_loss: 0.9082, test_f1: 0.5823
 epoch: 46, train_loss: 0.7206, test_loss: 0.9209, test_f1: 0.5745
 epoch: 47, train_loss: 0.7172, test_loss: 0.9024, test_f1: 0.5875
 epoch: 48, train_loss: 0.7057, test_loss: 0.9104, test_f1: 0.5774
 epoch: 49, train_loss: 0.7043, test_loss: 0.8972, test_f1: 0.6060
 epoch: 50, train_loss: 0.6997, test_loss: 0.8956, test_f1: 0.6025
 epoch: 51, train_loss: 0.6946, test_loss: 0.8945, test_f1: 0.6107
 epoch: 52, train_loss: 0.6910, test_loss: 0.8993, test_f1: 0.6096
 epoch: 53, train_loss: 0.6796, test_loss: 0.9172, test_f1: 0.6246
 epoch: 54, train_loss: 0.6792, test_loss: 0.9110, test_f1: 0.6267
 epoch: 55, train_loss: 0.6729, test_loss: 0.9048, test_f1: 0.6073
 epoch: 56, train_loss: 0.6788, test_loss: 0.9255, test_f1: 0.6079
 epoch: 57, train_loss: 0.6688, test_loss: 0.9082, test_f1: 0.6052
 epoch: 58, train_loss: 0.6791, test_loss: 0.9036, test_f1: 0.6093
 epoch: 59, train_loss: 0.6663, test_loss: 0.9149, test_f1: 0.6184
 epoch: 60, train_loss: 0.6744, test_loss: 0.9302, test_f1: 0.5927
 epoch: 61, train_loss: 0.6692, test_loss: 0.9118, test_f1: 0.6091
 epoch: 62, train_loss: 0.6605, test_loss: 0.8843, test_f1: 0.6123
 epoch: 63, train_loss: 0.6464, test_loss: 0.9138, test_f1: 0.6078
 epoch: 64, train_loss: 0.6574, test_loss: 0.9245, test_f1: 0.6156
 epoch: 65, train_loss: 0.6571, test_loss: 0.9129, test_f1: 0.6214
 epoch: 66, train_loss: 0.6530, test_loss: 0.9174, test_f1: 0.6016
 epoch: 67, train_loss: 0.6520, test_loss: 0.9088, test_f1: 0.6295
 epoch: 68, train_loss: 0.6501, test_loss: 0.9174, test_f1: 0.6132
 epoch: 69, train_loss: 0.6465, test_loss: 0.9150, test_f1: 0.6368
 epoch: 70, train_loss: 0.6548, test_loss: 0.9233, test_f1: 0.6151
 epoch: 71, train_loss: 0.6490, test_loss: 0.9275, test_f1: 0.6026
 epoch: 72, train_loss: 0.6377, test_loss: 0.9341, test_f1: 0.6115
 epoch: 73, train_loss: 0.6443, test_loss: 0.9381, test_f1: 0.6138
 epoch: 74, train_loss: 0.6399, test_loss: 0.9252, test_f1: 0.6069
 epoch: 75, train_loss: 0.6407, test_loss: 0.9368, test_f1: 0.6285
 epoch: 76, train_loss: 0.6172, test_loss: 0.9280, test_f1: 0.6122
 epoch: 77, train_loss: 0.6268, test_loss: 0.9362, test_f1: 0.6331
 epoch: 78, train_loss: 0.6238, test_loss: 0.9516, test_f1: 0.6227
 epoch: 79, train_loss: 0.6269, test_loss: 0.9314, test_f1: 0.6188
 epoch: 80, train_loss: 0.6394, test_loss: 0.9168, test_f1: 0.6069
 epoch: 81, train_loss: 0.6130, test_loss: 0.9552, test_f1: 0.6231
 epoch: 82, train_loss: 0.6263, test_loss: 0.9244, test_f1: 0.6328
 epoch: 83, train_loss: 0.6131, test_loss: 0.9262, test_f1: 0.6090
 epoch: 84, train_loss: 0.6119, test_loss: 0.9490, test_f1: 0.6223
 epoch: 85, train_loss: 0.6224, test_loss: 0.9406, test_f1: 0.6126
 epoch: 86, train_loss: 0.6159, test_loss: 0.9541, test_f1: 0.6170
 epoch: 87, train_loss: 0.6202, test_loss: 0.9139, test_f1: 0.6398
 epoch: 88, train_loss: 0.6216, test_loss: 0.9296, test_f1: 0.6401
 epoch: 89, train_loss: 0.6040, test_loss: 0.9370, test_f1: 0.6149
 epoch: 90, train_loss: 0.6027, test_loss: 0.9435, test_f1: 0.6121
 epoch: 91, train_loss: 0.6115, test_loss: 0.9628, test_f1: 0.6338
 epoch: 92, train_loss: 0.6007, test_loss: 0.9514, test_f1: 0.6280
 epoch: 93, train_loss: 0.5934, test_loss: 0.9324, test_f1: 0.6378
 epoch: 94, train_loss: 0.5956, test_loss: 0.9412, test_f1: 0.6160
 epoch: 95, train_loss: 0.6047, test_loss: 0.9344, test_f1: 0.6269
 epoch: 96, train_loss: 0.5931, test_loss: 0.9581, test_f1: 0.6257
 epoch: 97, train_loss: 0.5847, test_loss: 0.9493, test_f1: 0.6374
 epoch: 98, train_loss: 0.5939, test_loss: 0.9633, test_f1: 0.6309
 epoch: 99, train_loss: 0.5872, test_loss: 0.9521, test_f1: 0.6237
##################ITERATION #7 ****************************************
 epoch: 0, train_loss: 1.3111, test_loss: 1.1116, test_f1: 0.4161
 epoch: 1, train_loss: 1.1346, test_loss: 0.9883, test_f1: 0.5202
 epoch: 2, train_loss: 1.0684, test_loss: 0.9547, test_f1: 0.5203
 epoch: 3, train_loss: 1.0399, test_loss: 0.9347, test_f1: 0.5243
 epoch: 4, train_loss: 1.0099, test_loss: 0.9258, test_f1: 0.5327
 epoch: 5, train_loss: 0.9837, test_loss: 0.9068, test_f1: 0.5275
 epoch: 6, train_loss: 0.9732, test_loss: 0.8973, test_f1: 0.5376
 epoch: 7, train_loss: 0.9614, test_loss: 0.9083, test_f1: 0.5352
 epoch: 8, train_loss: 0.9491, test_loss: 0.9088, test_f1: 0.5247
 epoch: 9, train_loss: 0.9358, test_loss: 0.8808, test_f1: 0.5379
 epoch: 10, train_loss: 0.9248, test_loss: 0.9053, test_f1: 0.5358
 epoch: 11, train_loss: 0.9137, test_loss: 0.8906, test_f1: 0.5372
 epoch: 12, train_loss: 0.9073, test_loss: 0.8953, test_f1: 0.5493
 epoch: 13, train_loss: 0.9031, test_loss: 0.8927, test_f1: 0.5403
 epoch: 14, train_loss: 0.8905, test_loss: 0.9053, test_f1: 0.5609
 epoch: 15, train_loss: 0.8745, test_loss: 0.8881, test_f1: 0.5736
 epoch: 16, train_loss: 0.8637, test_loss: 0.8994, test_f1: 0.5558
 epoch: 17, train_loss: 0.8685, test_loss: 0.9145, test_f1: 0.5328
 epoch: 18, train_loss: 0.8634, test_loss: 0.9084, test_f1: 0.5647
 epoch: 19, train_loss: 0.8575, test_loss: 0.9157, test_f1: 0.5389
 epoch: 20, train_loss: 0.8485, test_loss: 0.8927, test_f1: 0.5579
 epoch: 21, train_loss: 0.8442, test_loss: 0.9032, test_f1: 0.5707
 epoch: 22, train_loss: 0.8371, test_loss: 0.8995, test_f1: 0.5754
 epoch: 23, train_loss: 0.8354, test_loss: 0.8693, test_f1: 0.5808
 epoch: 24, train_loss: 0.8245, test_loss: 0.9011, test_f1: 0.5840
 epoch: 25, train_loss: 0.8317, test_loss: 0.9019, test_f1: 0.5799
 epoch: 26, train_loss: 0.8196, test_loss: 0.9056, test_f1: 0.5441
 epoch: 27, train_loss: 0.8043, test_loss: 0.9004, test_f1: 0.6060
 epoch: 28, train_loss: 0.8102, test_loss: 0.9017, test_f1: 0.5792
 epoch: 29, train_loss: 0.8066, test_loss: 0.8971, test_f1: 0.5720
 epoch: 30, train_loss: 0.7953, test_loss: 0.8786, test_f1: 0.5942
 epoch: 31, train_loss: 0.7961, test_loss: 0.9009, test_f1: 0.5863
 epoch: 32, train_loss: 0.7864, test_loss: 0.8794, test_f1: 0.6129
 epoch: 33, train_loss: 0.7905, test_loss: 0.8688, test_f1: 0.6059
 epoch: 34, train_loss: 0.7827, test_loss: 0.8862, test_f1: 0.5928
 epoch: 35, train_loss: 0.7722, test_loss: 0.8789, test_f1: 0.6055
 epoch: 36, train_loss: 0.7739, test_loss: 0.9273, test_f1: 0.5862
 epoch: 37, train_loss: 0.7619, test_loss: 0.9613, test_f1: 0.5888
 epoch: 38, train_loss: 0.7636, test_loss: 0.9051, test_f1: 0.5978
 epoch: 39, train_loss: 0.7694, test_loss: 0.9115, test_f1: 0.5902
 epoch: 40, train_loss: 0.7538, test_loss: 0.8692, test_f1: 0.6147
 epoch: 41, train_loss: 0.7415, test_loss: 0.9174, test_f1: 0.5847
 epoch: 42, train_loss: 0.7422, test_loss: 0.9173, test_f1: 0.6142
 epoch: 43, train_loss: 0.7455, test_loss: 0.9286, test_f1: 0.5658
 epoch: 44, train_loss: 0.7509, test_loss: 0.9229, test_f1: 0.5991
 epoch: 45, train_loss: 0.7396, test_loss: 0.9270, test_f1: 0.5916
 epoch: 46, train_loss: 0.7359, test_loss: 0.9402, test_f1: 0.5785
 epoch: 47, train_loss: 0.7307, test_loss: 0.9356, test_f1: 0.6094
 epoch: 48, train_loss: 0.7278, test_loss: 0.9671, test_f1: 0.5889
 epoch: 49, train_loss: 0.7133, test_loss: 0.9390, test_f1: 0.5948
 epoch: 50, train_loss: 0.7097, test_loss: 0.9282, test_f1: 0.5823
 epoch: 51, train_loss: 0.7084, test_loss: 0.9270, test_f1: 0.5938
 epoch: 52, train_loss: 0.7034, test_loss: 0.9319, test_f1: 0.5981
 epoch: 53, train_loss: 0.7070, test_loss: 0.9155, test_f1: 0.6006
 epoch: 54, train_loss: 0.7146, test_loss: 0.9628, test_f1: 0.5886
 epoch: 55, train_loss: 0.7027, test_loss: 0.9506, test_f1: 0.5948
 epoch: 56, train_loss: 0.6988, test_loss: 0.9564, test_f1: 0.5962
 epoch: 57, train_loss: 0.6905, test_loss: 0.9575, test_f1: 0.5914
 epoch: 58, train_loss: 0.6849, test_loss: 0.9462, test_f1: 0.6050
 epoch: 59, train_loss: 0.6863, test_loss: 0.9373, test_f1: 0.6157
 epoch: 60, train_loss: 0.6866, test_loss: 0.9654, test_f1: 0.6001
 epoch: 61, train_loss: 0.6810, test_loss: 0.9560, test_f1: 0.6038
 epoch: 62, train_loss: 0.6754, test_loss: 0.9672, test_f1: 0.5951
 epoch: 63, train_loss: 0.6760, test_loss: 0.9545, test_f1: 0.5877
 epoch: 64, train_loss: 0.6814, test_loss: 0.9660, test_f1: 0.5963
 epoch: 65, train_loss: 0.6771, test_loss: 0.9504, test_f1: 0.5965
 epoch: 66, train_loss: 0.6794, test_loss: 0.9354, test_f1: 0.6137
 epoch: 67, train_loss: 0.6702, test_loss: 0.9360, test_f1: 0.6061
 epoch: 68, train_loss: 0.6785, test_loss: 0.9465, test_f1: 0.6157
 epoch: 69, train_loss: 0.6602, test_loss: 0.9317, test_f1: 0.6043
 epoch: 70, train_loss: 0.6656, test_loss: 0.9523, test_f1: 0.6115
 epoch: 71, train_loss: 0.6643, test_loss: 0.9654, test_f1: 0.6104
 epoch: 72, train_loss: 0.6558, test_loss: 0.9660, test_f1: 0.6177
 epoch: 73, train_loss: 0.6580, test_loss: 0.9679, test_f1: 0.6153
 epoch: 74, train_loss: 0.6570, test_loss: 0.9598, test_f1: 0.6127
 epoch: 75, train_loss: 0.6495, test_loss: 0.9693, test_f1: 0.5992
 epoch: 76, train_loss: 0.6454, test_loss: 0.9675, test_f1: 0.6004
 epoch: 77, train_loss: 0.6511, test_loss: 0.9661, test_f1: 0.5977
 epoch: 78, train_loss: 0.6497, test_loss: 0.9805, test_f1: 0.6016
 epoch: 79, train_loss: 0.6501, test_loss: 0.9684, test_f1: 0.6170
 epoch: 80, train_loss: 0.6484, test_loss: 0.9839, test_f1: 0.6025
 epoch: 81, train_loss: 0.6433, test_loss: 0.9599, test_f1: 0.6063
 epoch: 82, train_loss: 0.6506, test_loss: 0.9798, test_f1: 0.6110
 epoch: 83, train_loss: 0.6318, test_loss: 0.9696, test_f1: 0.6244
 epoch: 84, train_loss: 0.6304, test_loss: 0.9868, test_f1: 0.6267
 epoch: 85, train_loss: 0.6416, test_loss: 0.9910, test_f1: 0.6423
 epoch: 86, train_loss: 0.6421, test_loss: 0.9803, test_f1: 0.6218
 epoch: 87, train_loss: 0.6349, test_loss: 0.9729, test_f1: 0.6175
 epoch: 88, train_loss: 0.6347, test_loss: 1.0102, test_f1: 0.6172
 epoch: 89, train_loss: 0.6409, test_loss: 1.0092, test_f1: 0.6416
 epoch: 90, train_loss: 0.6330, test_loss: 0.9793, test_f1: 0.6319
 epoch: 91, train_loss: 0.6238, test_loss: 0.9694, test_f1: 0.6502
 epoch: 92, train_loss: 0.6239, test_loss: 0.9897, test_f1: 0.6336
 epoch: 93, train_loss: 0.6118, test_loss: 0.9823, test_f1: 0.6219
 epoch: 94, train_loss: 0.6202, test_loss: 0.9822, test_f1: 0.6428
 epoch: 95, train_loss: 0.6174, test_loss: 1.0056, test_f1: 0.6431
 epoch: 96, train_loss: 0.6180, test_loss: 0.9887, test_f1: 0.6302
 epoch: 97, train_loss: 0.6174, test_loss: 1.0059, test_f1: 0.6395
 epoch: 98, train_loss: 0.6216, test_loss: 1.0077, test_f1: 0.6312
 epoch: 99, train_loss: 0.6157, test_loss: 1.0000, test_f1: 0.6341
##################ITERATION #8 ****************************************
 epoch: 0, train_loss: 1.2636, test_loss: 1.0496, test_f1: 0.4596
 epoch: 1, train_loss: 1.1225, test_loss: 1.0184, test_f1: 0.4693
 epoch: 2, train_loss: 1.0744, test_loss: 0.9904, test_f1: 0.4813
 epoch: 3, train_loss: 1.0491, test_loss: 0.9811, test_f1: 0.4928
 epoch: 4, train_loss: 1.0165, test_loss: 0.9853, test_f1: 0.5176
 epoch: 5, train_loss: 1.0039, test_loss: 0.9763, test_f1: 0.5096
 epoch: 6, train_loss: 0.9757, test_loss: 0.9619, test_f1: 0.4995
 epoch: 7, train_loss: 0.9776, test_loss: 0.9544, test_f1: 0.5173
 epoch: 8, train_loss: 0.9472, test_loss: 0.9546, test_f1: 0.5199
 epoch: 9, train_loss: 0.9329, test_loss: 0.9385, test_f1: 0.5107
 epoch: 10, train_loss: 0.9261, test_loss: 0.9275, test_f1: 0.5313
 epoch: 11, train_loss: 0.9202, test_loss: 0.9206, test_f1: 0.5377
 epoch: 12, train_loss: 0.9089, test_loss: 0.9275, test_f1: 0.5363
 epoch: 13, train_loss: 0.8914, test_loss: 0.9123, test_f1: 0.5457
 epoch: 14, train_loss: 0.8924, test_loss: 0.9160, test_f1: 0.5522
 epoch: 15, train_loss: 0.8748, test_loss: 0.9308, test_f1: 0.5491
 epoch: 16, train_loss: 0.8771, test_loss: 0.8714, test_f1: 0.5797
 epoch: 17, train_loss: 0.8603, test_loss: 0.9133, test_f1: 0.5656
 epoch: 18, train_loss: 0.8630, test_loss: 0.8997, test_f1: 0.5709
 epoch: 19, train_loss: 0.8519, test_loss: 0.8977, test_f1: 0.5862
 epoch: 20, train_loss: 0.8385, test_loss: 0.8965, test_f1: 0.5942
 epoch: 21, train_loss: 0.8395, test_loss: 0.8945, test_f1: 0.5775
 epoch: 22, train_loss: 0.8245, test_loss: 0.8865, test_f1: 0.5977
 epoch: 23, train_loss: 0.8265, test_loss: 0.9153, test_f1: 0.5700
 epoch: 24, train_loss: 0.8299, test_loss: 0.8928, test_f1: 0.5739
 epoch: 25, train_loss: 0.8178, test_loss: 0.8750, test_f1: 0.5793
 epoch: 26, train_loss: 0.8051, test_loss: 0.8836, test_f1: 0.5817
 epoch: 27, train_loss: 0.8058, test_loss: 0.8833, test_f1: 0.5964
 epoch: 28, train_loss: 0.8043, test_loss: 0.8592, test_f1: 0.5920
 epoch: 29, train_loss: 0.7911, test_loss: 0.9088, test_f1: 0.5826
 epoch: 30, train_loss: 0.7947, test_loss: 0.8775, test_f1: 0.5999
 epoch: 31, train_loss: 0.7776, test_loss: 0.8604, test_f1: 0.6096
 epoch: 32, train_loss: 0.7881, test_loss: 0.8941, test_f1: 0.5976
 epoch: 33, train_loss: 0.7694, test_loss: 0.9089, test_f1: 0.5892
 epoch: 34, train_loss: 0.7658, test_loss: 0.9059, test_f1: 0.6194
 epoch: 35, train_loss: 0.7717, test_loss: 0.8836, test_f1: 0.5960
 epoch: 36, train_loss: 0.7588, test_loss: 0.9154, test_f1: 0.5921
 epoch: 37, train_loss: 0.7590, test_loss: 0.8990, test_f1: 0.5799
 epoch: 38, train_loss: 0.7563, test_loss: 0.9254, test_f1: 0.5947
 epoch: 39, train_loss: 0.7419, test_loss: 0.9210, test_f1: 0.6189
 epoch: 40, train_loss: 0.7447, test_loss: 0.8985, test_f1: 0.6163
 epoch: 41, train_loss: 0.7602, test_loss: 0.9061, test_f1: 0.5928
 epoch: 42, train_loss: 0.7424, test_loss: 0.9056, test_f1: 0.6003
 epoch: 43, train_loss: 0.7235, test_loss: 0.9203, test_f1: 0.6187
 epoch: 44, train_loss: 0.7230, test_loss: 0.8918, test_f1: 0.6000
 epoch: 45, train_loss: 0.7288, test_loss: 0.9088, test_f1: 0.5847
 epoch: 46, train_loss: 0.7228, test_loss: 0.9132, test_f1: 0.6205
 epoch: 47, train_loss: 0.7117, test_loss: 0.9294, test_f1: 0.5862
 epoch: 48, train_loss: 0.7054, test_loss: 0.9309, test_f1: 0.6460
 epoch: 49, train_loss: 0.7182, test_loss: 0.9394, test_f1: 0.6068
 epoch: 50, train_loss: 0.7092, test_loss: 0.9241, test_f1: 0.6017
 epoch: 51, train_loss: 0.6962, test_loss: 0.9335, test_f1: 0.6111
 epoch: 52, train_loss: 0.6902, test_loss: 0.9324, test_f1: 0.6028
 epoch: 53, train_loss: 0.6936, test_loss: 0.9272, test_f1: 0.6011
 epoch: 54, train_loss: 0.6826, test_loss: 0.9360, test_f1: 0.6061
 epoch: 55, train_loss: 0.6846, test_loss: 0.9147, test_f1: 0.6313
 epoch: 56, train_loss: 0.6825, test_loss: 0.9379, test_f1: 0.6135
 epoch: 57, train_loss: 0.6801, test_loss: 0.9356, test_f1: 0.6153
 epoch: 58, train_loss: 0.6671, test_loss: 0.9236, test_f1: 0.6140
 epoch: 59, train_loss: 0.6684, test_loss: 0.9343, test_f1: 0.6126
 epoch: 60, train_loss: 0.6662, test_loss: 0.9326, test_f1: 0.5952
 epoch: 61, train_loss: 0.6712, test_loss: 0.9305, test_f1: 0.6155
 epoch: 62, train_loss: 0.6631, test_loss: 0.9353, test_f1: 0.5984
 epoch: 63, train_loss: 0.6628, test_loss: 0.9390, test_f1: 0.5931
 epoch: 64, train_loss: 0.6631, test_loss: 0.9302, test_f1: 0.6116
 epoch: 65, train_loss: 0.6559, test_loss: 0.9326, test_f1: 0.6156
 epoch: 66, train_loss: 0.6645, test_loss: 0.9226, test_f1: 0.6481
 epoch: 67, train_loss: 0.6586, test_loss: 0.9299, test_f1: 0.6405
 epoch: 68, train_loss: 0.6592, test_loss: 0.9342, test_f1: 0.6312
 epoch: 69, train_loss: 0.6607, test_loss: 0.9355, test_f1: 0.6294
 epoch: 70, train_loss: 0.6439, test_loss: 0.9481, test_f1: 0.6057
 epoch: 71, train_loss: 0.6457, test_loss: 0.9346, test_f1: 0.6262
 epoch: 72, train_loss: 0.6486, test_loss: 0.9496, test_f1: 0.6360
 epoch: 73, train_loss: 0.6420, test_loss: 0.9605, test_f1: 0.6188
 epoch: 74, train_loss: 0.6342, test_loss: 0.9387, test_f1: 0.6433
 epoch: 75, train_loss: 0.6564, test_loss: 0.9681, test_f1: 0.5989
 epoch: 76, train_loss: 0.6411, test_loss: 0.9494, test_f1: 0.6427
 epoch: 77, train_loss: 0.6399, test_loss: 0.9401, test_f1: 0.6131
 epoch: 78, train_loss: 0.6360, test_loss: 0.9533, test_f1: 0.6337
 epoch: 79, train_loss: 0.6288, test_loss: 0.9620, test_f1: 0.6221
 epoch: 80, train_loss: 0.6297, test_loss: 0.9515, test_f1: 0.6107
 epoch: 81, train_loss: 0.6372, test_loss: 0.9608, test_f1: 0.6165
 epoch: 82, train_loss: 0.6230, test_loss: 0.9412, test_f1: 0.6245
 epoch: 83, train_loss: 0.6377, test_loss: 0.9421, test_f1: 0.6385
 epoch: 84, train_loss: 0.6285, test_loss: 0.9596, test_f1: 0.6004
 epoch: 85, train_loss: 0.6306, test_loss: 0.9509, test_f1: 0.6347
 epoch: 86, train_loss: 0.6145, test_loss: 0.9767, test_f1: 0.6272
 epoch: 87, train_loss: 0.6209, test_loss: 0.9750, test_f1: 0.6233
 epoch: 88, train_loss: 0.6243, test_loss: 0.9738, test_f1: 0.6583
 epoch: 89, train_loss: 0.6089, test_loss: 0.9674, test_f1: 0.6340
 epoch: 90, train_loss: 0.6011, test_loss: 0.9794, test_f1: 0.6209
 epoch: 91, train_loss: 0.6008, test_loss: 0.9565, test_f1: 0.6567
 epoch: 92, train_loss: 0.6209, test_loss: 0.9627, test_f1: 0.6512
 epoch: 93, train_loss: 0.6095, test_loss: 0.9637, test_f1: 0.6379
 epoch: 94, train_loss: 0.6199, test_loss: 0.9567, test_f1: 0.6476
 epoch: 95, train_loss: 0.6108, test_loss: 0.9533, test_f1: 0.6429
 epoch: 96, train_loss: 0.6023, test_loss: 0.9809, test_f1: 0.6478
 epoch: 97, train_loss: 0.6036, test_loss: 0.9892, test_f1: 0.6192
 epoch: 98, train_loss: 0.5935, test_loss: 0.9936, test_f1: 0.6270
 epoch: 99, train_loss: 0.5968, test_loss: 0.9804, test_f1: 0.6519
##################ITERATION #9 ****************************************
 epoch: 0, train_loss: 1.3176, test_loss: 1.0838, test_f1: 0.4178
 epoch: 1, train_loss: 1.1189, test_loss: 1.0003, test_f1: 0.4765
 epoch: 2, train_loss: 1.0863, test_loss: 0.9893, test_f1: 0.4710
 epoch: 3, train_loss: 1.0410, test_loss: 0.9667, test_f1: 0.4800
 epoch: 4, train_loss: 1.0153, test_loss: 0.9504, test_f1: 0.4914
 epoch: 5, train_loss: 0.9940, test_loss: 0.9505, test_f1: 0.5100
 epoch: 6, train_loss: 0.9836, test_loss: 0.9413, test_f1: 0.5123
 epoch: 7, train_loss: 0.9704, test_loss: 0.9307, test_f1: 0.5084
 epoch: 8, train_loss: 0.9505, test_loss: 0.9329, test_f1: 0.5119
 epoch: 9, train_loss: 0.9414, test_loss: 0.9344, test_f1: 0.5225
 epoch: 10, train_loss: 0.9263, test_loss: 0.9268, test_f1: 0.5120
 epoch: 11, train_loss: 0.9267, test_loss: 0.9190, test_f1: 0.5265
 epoch: 12, train_loss: 0.9183, test_loss: 0.9048, test_f1: 0.5452
 epoch: 13, train_loss: 0.9167, test_loss: 0.9132, test_f1: 0.5148
 epoch: 14, train_loss: 0.8928, test_loss: 0.9219, test_f1: 0.5327
 epoch: 15, train_loss: 0.8898, test_loss: 0.9033, test_f1: 0.5368
 epoch: 16, train_loss: 0.8873, test_loss: 0.9060, test_f1: 0.5324
 epoch: 17, train_loss: 0.8743, test_loss: 0.9147, test_f1: 0.5543
 epoch: 18, train_loss: 0.8713, test_loss: 0.9011, test_f1: 0.5358
 epoch: 19, train_loss: 0.8576, test_loss: 0.8890, test_f1: 0.5663
 epoch: 20, train_loss: 0.8426, test_loss: 0.8959, test_f1: 0.5534
 epoch: 21, train_loss: 0.8409, test_loss: 0.9018, test_f1: 0.5664
 epoch: 22, train_loss: 0.8397, test_loss: 0.9060, test_f1: 0.5886
 epoch: 23, train_loss: 0.8319, test_loss: 0.9088, test_f1: 0.5504
 epoch: 24, train_loss: 0.8326, test_loss: 0.8738, test_f1: 0.5645
 epoch: 25, train_loss: 0.8235, test_loss: 0.9259, test_f1: 0.5615
 epoch: 26, train_loss: 0.8258, test_loss: 0.8900, test_f1: 0.5686
 epoch: 27, train_loss: 0.8049, test_loss: 0.8933, test_f1: 0.5464
 epoch: 28, train_loss: 0.8089, test_loss: 0.8852, test_f1: 0.5773
 epoch: 29, train_loss: 0.7983, test_loss: 0.8834, test_f1: 0.5747
 epoch: 30, train_loss: 0.7912, test_loss: 0.8897, test_f1: 0.5654
 epoch: 31, train_loss: 0.7845, test_loss: 0.8825, test_f1: 0.5931
 epoch: 32, train_loss: 0.7913, test_loss: 0.8987, test_f1: 0.5834
 epoch: 33, train_loss: 0.7802, test_loss: 0.8941, test_f1: 0.5800
 epoch: 34, train_loss: 0.7729, test_loss: 0.8764, test_f1: 0.5750
 epoch: 35, train_loss: 0.7721, test_loss: 0.9022, test_f1: 0.5935
 epoch: 36, train_loss: 0.7648, test_loss: 0.9072, test_f1: 0.5730
 epoch: 37, train_loss: 0.7704, test_loss: 0.8818, test_f1: 0.5812
 epoch: 38, train_loss: 0.7537, test_loss: 0.8941, test_f1: 0.5833
 epoch: 39, train_loss: 0.7514, test_loss: 0.8727, test_f1: 0.5891
 epoch: 40, train_loss: 0.7468, test_loss: 0.8928, test_f1: 0.5896
 epoch: 41, train_loss: 0.7436, test_loss: 0.8836, test_f1: 0.5943
 epoch: 42, train_loss: 0.7489, test_loss: 0.9213, test_f1: 0.5768
 epoch: 43, train_loss: 0.7345, test_loss: 0.9155, test_f1: 0.5858
 epoch: 44, train_loss: 0.7271, test_loss: 0.9175, test_f1: 0.5857
 epoch: 45, train_loss: 0.7297, test_loss: 0.9076, test_f1: 0.6051
 epoch: 46, train_loss: 0.7274, test_loss: 0.8782, test_f1: 0.6012
 epoch: 47, train_loss: 0.7208, test_loss: 0.9234, test_f1: 0.5911
 epoch: 48, train_loss: 0.7253, test_loss: 0.9132, test_f1: 0.6040
 epoch: 49, train_loss: 0.7081, test_loss: 0.9264, test_f1: 0.5878
 epoch: 50, train_loss: 0.7162, test_loss: 0.9207, test_f1: 0.6203
 epoch: 51, train_loss: 0.7124, test_loss: 0.9098, test_f1: 0.6043
 epoch: 52, train_loss: 0.6981, test_loss: 0.9154, test_f1: 0.5943
 epoch: 53, train_loss: 0.6904, test_loss: 0.8946, test_f1: 0.6052
 epoch: 54, train_loss: 0.6886, test_loss: 0.9105, test_f1: 0.6112
 epoch: 55, train_loss: 0.6831, test_loss: 0.9084, test_f1: 0.6052
 epoch: 56, train_loss: 0.6914, test_loss: 0.9209, test_f1: 0.5973
 epoch: 57, train_loss: 0.6912, test_loss: 0.9101, test_f1: 0.5963
 epoch: 58, train_loss: 0.6839, test_loss: 0.9035, test_f1: 0.6047
 epoch: 59, train_loss: 0.6804, test_loss: 0.9099, test_f1: 0.5987
 epoch: 60, train_loss: 0.6816, test_loss: 0.9137, test_f1: 0.6028
 epoch: 61, train_loss: 0.6802, test_loss: 0.9197, test_f1: 0.6078
 epoch: 62, train_loss: 0.6659, test_loss: 0.9168, test_f1: 0.6148
 epoch: 63, train_loss: 0.6861, test_loss: 0.9188, test_f1: 0.6056
 epoch: 64, train_loss: 0.6700, test_loss: 0.9194, test_f1: 0.6145
 epoch: 65, train_loss: 0.6807, test_loss: 0.9169, test_f1: 0.6128
 epoch: 66, train_loss: 0.6650, test_loss: 0.9147, test_f1: 0.6165
 epoch: 67, train_loss: 0.6623, test_loss: 0.9006, test_f1: 0.6128
 epoch: 68, train_loss: 0.6661, test_loss: 0.9204, test_f1: 0.6288
 epoch: 69, train_loss: 0.6657, test_loss: 0.9263, test_f1: 0.6126
 epoch: 70, train_loss: 0.6531, test_loss: 0.9163, test_f1: 0.6073
 epoch: 71, train_loss: 0.6575, test_loss: 0.9043, test_f1: 0.6347
 epoch: 72, train_loss: 0.6549, test_loss: 0.9294, test_f1: 0.6122
 epoch: 73, train_loss: 0.6525, test_loss: 0.9322, test_f1: 0.6237
 epoch: 74, train_loss: 0.6547, test_loss: 0.9192, test_f1: 0.6195
 epoch: 75, train_loss: 0.6539, test_loss: 0.9313, test_f1: 0.6263
 epoch: 76, train_loss: 0.6443, test_loss: 0.9534, test_f1: 0.6070
 epoch: 77, train_loss: 0.6447, test_loss: 0.9429, test_f1: 0.6182
 epoch: 78, train_loss: 0.6378, test_loss: 0.9377, test_f1: 0.6105
 epoch: 79, train_loss: 0.6410, test_loss: 0.9232, test_f1: 0.6202
 epoch: 80, train_loss: 0.6368, test_loss: 0.9214, test_f1: 0.6132
 epoch: 81, train_loss: 0.6337, test_loss: 0.9298, test_f1: 0.6235
 epoch: 82, train_loss: 0.6433, test_loss: 0.9364, test_f1: 0.6363
 epoch: 83, train_loss: 0.6366, test_loss: 0.9442, test_f1: 0.6185
 epoch: 84, train_loss: 0.6316, test_loss: 0.9234, test_f1: 0.6490
 epoch: 85, train_loss: 0.6279, test_loss: 0.9357, test_f1: 0.6157
 epoch: 86, train_loss: 0.6295, test_loss: 0.9189, test_f1: 0.6396
 epoch: 87, train_loss: 0.6369, test_loss: 0.9224, test_f1: 0.6443
 epoch: 88, train_loss: 0.6272, test_loss: 0.9327, test_f1: 0.6263
 epoch: 89, train_loss: 0.6272, test_loss: 0.9302, test_f1: 0.6294
 epoch: 90, train_loss: 0.6170, test_loss: 0.9504, test_f1: 0.6293
 epoch: 91, train_loss: 0.6195, test_loss: 0.9567, test_f1: 0.6210
 epoch: 92, train_loss: 0.6228, test_loss: 0.9526, test_f1: 0.6077
 epoch: 93, train_loss: 0.6243, test_loss: 0.9522, test_f1: 0.6286
 epoch: 94, train_loss: 0.6126, test_loss: 0.9468, test_f1: 0.6388
 epoch: 95, train_loss: 0.6234, test_loss: 0.9589, test_f1: 0.6264
 epoch: 96, train_loss: 0.6158, test_loss: 0.9425, test_f1: 0.6352
 epoch: 97, train_loss: 0.6035, test_loss: 0.9515, test_f1: 0.6244
 epoch: 98, train_loss: 0.6004, test_loss: 0.9460, test_f1: 0.6539
 epoch: 99, train_loss: 0.6097, test_loss: 0.9535, test_f1: 0.6318

Training completed in 561.76 seconds
Best F1: 0.6680 at epoch 91
Mean F1 across iterations: 0.6531  0.0104
========================FINAL RESULTS================================
FEGIN weighted F1: 0.6680  0.0104
python main.py --data ltspice_examples --representation component_net --model FEGIN --layers 2 --hiddens 128 --batch_size 64 --lr 0.0001 --emb_size 128 --epochs 100 --save_appendix component_net_L2_H128_BS64_LR0.0001_E128 --no_val
-----



STDERR:
  File "main.py", line 370, in <module>
    main()
  File "main.py", line 254, in main
    dataset = dataset_class(
  File "/home/philip/projects/ltspice_examples_code_repo/Circuit-Completion-Using-GNNs/component_classification_with_link_prediction_head/evaluation/FEGIN/kernel/circuit_datasets.py", line 15, in __init__
    self.data, self.slices = torch.load(self.processed_paths[0])
  File "/home/philip/.local/lib/python3.8/site-packages/torch/serialization.py", line 1040, in load
    warnings.warn(
  File "/usr/lib/python3.8/warnings.py", line 109, in _showwarnmsg
    sw(msg.message, msg.category, msg.filename, msg.lineno,
  File "main.py", line 47, in warn_with_traceback
    traceback.print_stack(file=log)
/home/philip/projects/ltspice_examples_code_repo/Circuit-Completion-Using-GNNs/component_classification_with_link_prediction_head/evaluation/FEGIN/kernel/circuit_datasets.py:15: FutureWarning: You are using `torch.load` with `weights_only=False` (the current default value), which uses the default pickle module implicitly. It is possible to construct malicious pickle data which will execute arbitrary code during unpickling (See https://github.com/pytorch/pytorch/blob/main/SECURITY.md#untrusted-models for more details). In a future release, the default value for `weights_only` will be flipped to `True`. This limits the functions that could be executed during unpickling. Arbitrary objects will no longer be allowed to be loaded via this mode unless they are explicitly allowlisted by the user via `torch.serialization.add_safe_globals`. We recommend you start setting `weights_only=True` for any use case where you don't have full control of the loaded file. Please open an issue on GitHub for any issues related to this experimental feature.
  self.data, self.slices = torch.load(self.processed_paths[0])
