STDOUT:
Results will be saved in /home/philip/projects/ltspice_examples_code_repo/Circuit-Completion-Using-GNNs/component_classification_with_link_prediction_head/evaluation/FEGIN/results/model_FEGIN_dataset_ltspice_demos
Command line input: python main.py --data ltspice_demos --representation component_component --model FEGIN --layers 6 --hiddens 64 --batch_size 64 --lr 0.001 --emb_size 512 --epochs 100 --save_appendix component_component_L6_H64_BS64_LR0.001_E512 --no_val
 is saved.
-----
ltspice_demos - FEGIN
Using 6 layers, 64 hidden units, h = 2
Loading component_component representation dataset
ENTERED
Training FEGIN on component_component representation
Train: 1565, Test: 383
##################ITERATION #0 ****************************************
 epoch: 0, train_loss: 1.2751, test_loss: 1.3020, test_f1: 0.2281
 epoch: 1, train_loss: 1.1921, test_loss: 1.2515, test_f1: 0.3391
 epoch: 2, train_loss: 1.1519, test_loss: 1.2264, test_f1: 0.3478
 epoch: 3, train_loss: 1.1033, test_loss: 1.2084, test_f1: 0.3469
 epoch: 4, train_loss: 1.0745, test_loss: 1.2284, test_f1: 0.4391
 epoch: 5, train_loss: 1.0271, test_loss: 1.1935, test_f1: 0.4190
 epoch: 6, train_loss: 0.9959, test_loss: 1.1983, test_f1: 0.3727
 epoch: 7, train_loss: 0.9751, test_loss: 1.1935, test_f1: 0.4693
 epoch: 8, train_loss: 0.9382, test_loss: 1.2980, test_f1: 0.4513
 epoch: 9, train_loss: 0.8983, test_loss: 1.1642, test_f1: 0.5376
 epoch: 10, train_loss: 0.9010, test_loss: 1.1980, test_f1: 0.5173
 epoch: 11, train_loss: 0.8653, test_loss: 1.3465, test_f1: 0.5485
 epoch: 12, train_loss: 0.8274, test_loss: 1.3503, test_f1: 0.4558
 epoch: 13, train_loss: 0.8431, test_loss: 1.4698, test_f1: 0.5507
 epoch: 14, train_loss: 0.8068, test_loss: 1.1805, test_f1: 0.5874
 epoch: 15, train_loss: 0.8093, test_loss: 1.2428, test_f1: 0.5382
 epoch: 16, train_loss: 0.7808, test_loss: 1.3602, test_f1: 0.5313
 epoch: 17, train_loss: 0.7600, test_loss: 1.3753, test_f1: 0.4889
 epoch: 18, train_loss: 0.7606, test_loss: 1.3675, test_f1: 0.5521
 epoch: 19, train_loss: 0.7563, test_loss: 1.4468, test_f1: 0.5015
 epoch: 20, train_loss: 0.7367, test_loss: 1.4115, test_f1: 0.5269
 epoch: 21, train_loss: 0.7102, test_loss: 1.5146, test_f1: 0.5400
 epoch: 22, train_loss: 0.6991, test_loss: 1.5042, test_f1: 0.5693
 epoch: 23, train_loss: 0.7025, test_loss: 1.4600, test_f1: 0.5863
 epoch: 24, train_loss: 0.6828, test_loss: 1.5255, test_f1: 0.5658
 epoch: 25, train_loss: 0.6861, test_loss: 2.0068, test_f1: 0.4729
 epoch: 26, train_loss: 0.6949, test_loss: 1.5082, test_f1: 0.5647
 epoch: 27, train_loss: 0.6466, test_loss: 1.6691, test_f1: 0.5587
 epoch: 28, train_loss: 0.6563, test_loss: 1.8401, test_f1: 0.5646
 epoch: 29, train_loss: 0.6504, test_loss: 1.6174, test_f1: 0.5305
 epoch: 30, train_loss: 0.6445, test_loss: 1.4946, test_f1: 0.5449
 epoch: 31, train_loss: 0.6016, test_loss: 1.6249, test_f1: 0.5647
 epoch: 32, train_loss: 0.6476, test_loss: 1.6546, test_f1: 0.5458
 epoch: 33, train_loss: 0.5918, test_loss: 1.6859, test_f1: 0.5700
 epoch: 34, train_loss: 0.5946, test_loss: 1.6484, test_f1: 0.5617
 epoch: 35, train_loss: 0.5918, test_loss: 2.0872, test_f1: 0.5295
 epoch: 36, train_loss: 0.5773, test_loss: 1.8576, test_f1: 0.5702
 epoch: 37, train_loss: 0.5650, test_loss: 1.6383, test_f1: 0.5258
 epoch: 38, train_loss: 0.5712, test_loss: 1.8198, test_f1: 0.4879
 epoch: 39, train_loss: 0.5346, test_loss: 1.8443, test_f1: 0.5361
 epoch: 40, train_loss: 0.5476, test_loss: 1.6926, test_f1: 0.5381
 epoch: 41, train_loss: 0.5588, test_loss: 2.1438, test_f1: 0.5948
 epoch: 42, train_loss: 0.5596, test_loss: 1.8336, test_f1: 0.5081
 epoch: 43, train_loss: 0.5848, test_loss: 1.6607, test_f1: 0.4913
 epoch: 44, train_loss: 0.5203, test_loss: 1.7943, test_f1: 0.5066
 epoch: 45, train_loss: 0.4806, test_loss: 1.9222, test_f1: 0.4964
 epoch: 46, train_loss: 0.4849, test_loss: 1.8537, test_f1: 0.5120
 epoch: 47, train_loss: 0.5010, test_loss: 2.1124, test_f1: 0.5065
 epoch: 48, train_loss: 0.4793, test_loss: 2.0158, test_f1: 0.5327
 epoch: 49, train_loss: 0.4677, test_loss: 2.0534, test_f1: 0.5128
 epoch: 50, train_loss: 0.4641, test_loss: 1.7959, test_f1: 0.4948
 epoch: 51, train_loss: 0.4263, test_loss: 1.9006, test_f1: 0.5269
 epoch: 52, train_loss: 0.4191, test_loss: 1.9760, test_f1: 0.5197
 epoch: 53, train_loss: 0.4005, test_loss: 2.0769, test_f1: 0.5244
 epoch: 54, train_loss: 0.4022, test_loss: 2.1550, test_f1: 0.5429
 epoch: 55, train_loss: 0.3914, test_loss: 2.1247, test_f1: 0.5014
 epoch: 56, train_loss: 0.3754, test_loss: 2.2178, test_f1: 0.5068
 epoch: 57, train_loss: 0.3656, test_loss: 2.1131, test_f1: 0.5098
 epoch: 58, train_loss: 0.3936, test_loss: 2.1746, test_f1: 0.4865
 epoch: 59, train_loss: 0.3819, test_loss: 2.1800, test_f1: 0.5129
 epoch: 60, train_loss: 0.3479, test_loss: 2.2299, test_f1: 0.5099
 epoch: 61, train_loss: 0.3786, test_loss: 2.1347, test_f1: 0.5115
 epoch: 62, train_loss: 0.3664, test_loss: 2.2817, test_f1: 0.5000
 epoch: 63, train_loss: 0.3721, test_loss: 2.3252, test_f1: 0.5133
 epoch: 64, train_loss: 0.3487, test_loss: 2.4121, test_f1: 0.5271
 epoch: 65, train_loss: 0.3147, test_loss: 2.5950, test_f1: 0.4872
 epoch: 66, train_loss: 0.3240, test_loss: 2.4202, test_f1: 0.5033
 epoch: 67, train_loss: 0.3531, test_loss: 2.6275, test_f1: 0.5118
 epoch: 68, train_loss: 0.3693, test_loss: 2.3083, test_f1: 0.5124
 epoch: 69, train_loss: 0.3615, test_loss: 2.5298, test_f1: 0.5255
 epoch: 70, train_loss: 0.3255, test_loss: 2.5610, test_f1: 0.5221
 epoch: 71, train_loss: 0.3096, test_loss: 2.4465, test_f1: 0.5352
 epoch: 72, train_loss: 0.2907, test_loss: 2.5787, test_f1: 0.5096
 epoch: 73, train_loss: 0.2928, test_loss: 2.4230, test_f1: 0.5272
 epoch: 74, train_loss: 0.3052, test_loss: 2.5616, test_f1: 0.5376
 epoch: 75, train_loss: 0.3169, test_loss: 2.5179, test_f1: 0.4952
 epoch: 76, train_loss: 0.2978, test_loss: 2.7167, test_f1: 0.4791
 epoch: 77, train_loss: 0.3118, test_loss: 2.7258, test_f1: 0.4903
 epoch: 78, train_loss: 0.2827, test_loss: 2.8769, test_f1: 0.5014
 epoch: 79, train_loss: 0.3069, test_loss: 2.8381, test_f1: 0.5127
 epoch: 80, train_loss: 0.2969, test_loss: 3.0546, test_f1: 0.5293
 epoch: 81, train_loss: 0.2737, test_loss: 3.1280, test_f1: 0.5085
 epoch: 82, train_loss: 0.2723, test_loss: 2.6237, test_f1: 0.5056
 epoch: 83, train_loss: 0.2654, test_loss: 2.7173, test_f1: 0.4938
 epoch: 84, train_loss: 0.2856, test_loss: 3.1190, test_f1: 0.5186
 epoch: 85, train_loss: 0.2736, test_loss: 3.0054, test_f1: 0.5161
 epoch: 86, train_loss: 0.3022, test_loss: 2.9027, test_f1: 0.5155
 epoch: 87, train_loss: 0.2993, test_loss: 3.0116, test_f1: 0.4886
 epoch: 88, train_loss: 0.2705, test_loss: 3.4136, test_f1: 0.4794
 epoch: 89, train_loss: 0.2743, test_loss: 3.2003, test_f1: 0.4768
 epoch: 90, train_loss: 0.2515, test_loss: 3.0537, test_f1: 0.5229
 epoch: 91, train_loss: 0.2858, test_loss: 3.0680, test_f1: 0.4924
 epoch: 92, train_loss: 0.2709, test_loss: 3.2497, test_f1: 0.4936
 epoch: 93, train_loss: 0.2645, test_loss: 3.2567, test_f1: 0.4746
 epoch: 94, train_loss: 0.2653, test_loss: 3.3044, test_f1: 0.4837
 epoch: 95, train_loss: 0.2496, test_loss: 3.4092, test_f1: 0.5093
 epoch: 96, train_loss: 0.2773, test_loss: 3.1872, test_f1: 0.5113
 epoch: 97, train_loss: 0.2767, test_loss: 3.6269, test_f1: 0.4945
 epoch: 98, train_loss: 0.2666, test_loss: 3.8170, test_f1: 0.4925
 epoch: 99, train_loss: 0.2558, test_loss: 3.9927, test_f1: 0.4929
##################ITERATION #1 ****************************************
 epoch: 0, train_loss: 1.2225, test_loss: 1.2921, test_f1: 0.2717
 epoch: 1, train_loss: 1.1239, test_loss: 1.1821, test_f1: 0.4904
 epoch: 2, train_loss: 1.0627, test_loss: 1.1710, test_f1: 0.5056
 epoch: 3, train_loss: 1.0121, test_loss: 1.1488, test_f1: 0.5137
 epoch: 4, train_loss: 0.9867, test_loss: 1.1672, test_f1: 0.4177
 epoch: 5, train_loss: 0.9302, test_loss: 1.1595, test_f1: 0.5256
 epoch: 6, train_loss: 0.9241, test_loss: 1.1193, test_f1: 0.5223
 epoch: 7, train_loss: 0.9052, test_loss: 1.2069, test_f1: 0.5210
 epoch: 8, train_loss: 0.8555, test_loss: 1.2473, test_f1: 0.5178
 epoch: 9, train_loss: 0.8373, test_loss: 1.1739, test_f1: 0.5347
 epoch: 10, train_loss: 0.8209, test_loss: 1.2223, test_f1: 0.5603
 epoch: 11, train_loss: 0.8277, test_loss: 1.2616, test_f1: 0.5392
 epoch: 12, train_loss: 0.7859, test_loss: 1.2394, test_f1: 0.4936
 epoch: 13, train_loss: 0.7647, test_loss: 1.4474, test_f1: 0.4895
 epoch: 14, train_loss: 0.7479, test_loss: 1.3091, test_f1: 0.5104
 epoch: 15, train_loss: 0.7673, test_loss: 1.4218, test_f1: 0.5712
 epoch: 16, train_loss: 0.7159, test_loss: 1.6962, test_f1: 0.5622
 epoch: 17, train_loss: 0.7377, test_loss: 1.8980, test_f1: 0.5262
 epoch: 18, train_loss: 0.7297, test_loss: 1.4078, test_f1: 0.5762
 epoch: 19, train_loss: 0.7335, test_loss: 1.8849, test_f1: 0.5209
 epoch: 20, train_loss: 0.6953, test_loss: 1.5346, test_f1: 0.5680
 epoch: 21, train_loss: 0.7003, test_loss: 1.9023, test_f1: 0.5135
 epoch: 22, train_loss: 0.6989, test_loss: 1.6653, test_f1: 0.5567
 epoch: 23, train_loss: 0.6516, test_loss: 2.2482, test_f1: 0.5325
 epoch: 24, train_loss: 0.6358, test_loss: 2.0487, test_f1: 0.5618
 epoch: 25, train_loss: 0.6678, test_loss: 2.4079, test_f1: 0.5020
 epoch: 26, train_loss: 0.6576, test_loss: 2.0738, test_f1: 0.5355
 epoch: 27, train_loss: 0.6377, test_loss: 1.8034, test_f1: 0.5209
 epoch: 28, train_loss: 0.6311, test_loss: 2.4015, test_f1: 0.5941
 epoch: 29, train_loss: 0.6285, test_loss: 2.1468, test_f1: 0.5325
 epoch: 30, train_loss: 0.6102, test_loss: 2.1846, test_f1: 0.5387
 epoch: 31, train_loss: 0.6313, test_loss: 1.8985, test_f1: 0.5939
 epoch: 32, train_loss: 0.5706, test_loss: 1.9314, test_f1: 0.5752
 epoch: 33, train_loss: 0.5787, test_loss: 2.0480, test_f1: 0.5706
 epoch: 34, train_loss: 0.5545, test_loss: 2.0227, test_f1: 0.5460
 epoch: 35, train_loss: 0.5942, test_loss: 2.0121, test_f1: 0.5927
 epoch: 36, train_loss: 0.5876, test_loss: 1.9083, test_f1: 0.6033
 epoch: 37, train_loss: 0.5718, test_loss: 2.4958, test_f1: 0.5640
 epoch: 38, train_loss: 0.5463, test_loss: 2.3658, test_f1: 0.5404
 epoch: 39, train_loss: 0.5543, test_loss: 2.4128, test_f1: 0.5376
 epoch: 40, train_loss: 0.5383, test_loss: 2.5494, test_f1: 0.5672
 epoch: 41, train_loss: 0.5503, test_loss: 2.1411, test_f1: 0.5319
 epoch: 42, train_loss: 0.5340, test_loss: 2.5280, test_f1: 0.5677
 epoch: 43, train_loss: 0.5219, test_loss: 2.1795, test_f1: 0.5471
 epoch: 44, train_loss: 0.5040, test_loss: 1.8820, test_f1: 0.5597
 epoch: 45, train_loss: 0.5066, test_loss: 2.3161, test_f1: 0.5276
 epoch: 46, train_loss: 0.4959, test_loss: 2.1047, test_f1: 0.5673
 epoch: 47, train_loss: 0.5138, test_loss: 2.5811, test_f1: 0.5667
 epoch: 48, train_loss: 0.5015, test_loss: 2.8327, test_f1: 0.5705
 epoch: 49, train_loss: 0.5014, test_loss: 2.7161, test_f1: 0.5595
 epoch: 50, train_loss: 0.4786, test_loss: 2.7554, test_f1: 0.5144
 epoch: 51, train_loss: 0.4568, test_loss: 2.8397, test_f1: 0.5641
 epoch: 52, train_loss: 0.4181, test_loss: 3.1317, test_f1: 0.5783
 epoch: 53, train_loss: 0.3990, test_loss: 2.6434, test_f1: 0.5842
 epoch: 54, train_loss: 0.3929, test_loss: 3.1980, test_f1: 0.5632
 epoch: 55, train_loss: 0.3684, test_loss: 2.9967, test_f1: 0.5684
 epoch: 56, train_loss: 0.3753, test_loss: 3.4731, test_f1: 0.5435
 epoch: 57, train_loss: 0.3777, test_loss: 2.9184, test_f1: 0.5520
 epoch: 58, train_loss: 0.3927, test_loss: 2.8625, test_f1: 0.5683
 epoch: 59, train_loss: 0.3673, test_loss: 2.8752, test_f1: 0.5424
 epoch: 60, train_loss: 0.3876, test_loss: 2.8107, test_f1: 0.5654
 epoch: 61, train_loss: 0.3768, test_loss: 2.7711, test_f1: 0.5571
 epoch: 62, train_loss: 0.3669, test_loss: 2.8777, test_f1: 0.5510
 epoch: 63, train_loss: 0.3497, test_loss: 2.8583, test_f1: 0.5351
 epoch: 64, train_loss: 0.3560, test_loss: 3.1894, test_f1: 0.5464
 epoch: 65, train_loss: 0.3588, test_loss: 3.2851, test_f1: 0.5483
 epoch: 66, train_loss: 0.3495, test_loss: 3.0082, test_f1: 0.5474
 epoch: 67, train_loss: 0.3460, test_loss: 3.6733, test_f1: 0.5538
 epoch: 68, train_loss: 0.3504, test_loss: 3.5581, test_f1: 0.5647
 epoch: 69, train_loss: 0.3599, test_loss: 3.8050, test_f1: 0.5386
 epoch: 70, train_loss: 0.3831, test_loss: 3.6374, test_f1: 0.5163
 epoch: 71, train_loss: 0.3389, test_loss: 3.5286, test_f1: 0.5379
 epoch: 72, train_loss: 0.3342, test_loss: 3.4713, test_f1: 0.5451
 epoch: 73, train_loss: 0.3241, test_loss: 3.1574, test_f1: 0.5444
 epoch: 74, train_loss: 0.3190, test_loss: 3.0603, test_f1: 0.5720
 epoch: 75, train_loss: 0.3216, test_loss: 3.8839, test_f1: 0.5395
 epoch: 76, train_loss: 0.3322, test_loss: 3.3046, test_f1: 0.5372
 epoch: 77, train_loss: 0.3377, test_loss: 3.3211, test_f1: 0.5491
 epoch: 78, train_loss: 0.3332, test_loss: 3.0926, test_f1: 0.5510
 epoch: 79, train_loss: 0.3028, test_loss: 4.1145, test_f1: 0.5406
 epoch: 80, train_loss: 0.3302, test_loss: 3.1874, test_f1: 0.5671
 epoch: 81, train_loss: 0.3026, test_loss: 3.5081, test_f1: 0.5649
 epoch: 82, train_loss: 0.2917, test_loss: 3.8876, test_f1: 0.5479
 epoch: 83, train_loss: 0.3202, test_loss: 2.9177, test_f1: 0.5604
 epoch: 84, train_loss: 0.2760, test_loss: 3.0598, test_f1: 0.5832
 epoch: 85, train_loss: 0.2801, test_loss: 3.0541, test_f1: 0.5464
 epoch: 86, train_loss: 0.2943, test_loss: 3.4349, test_f1: 0.5661
 epoch: 87, train_loss: 0.2661, test_loss: 3.4963, test_f1: 0.5646
 epoch: 88, train_loss: 0.2550, test_loss: 3.1552, test_f1: 0.5575
 epoch: 89, train_loss: 0.3038, test_loss: 3.4472, test_f1: 0.5453
 epoch: 90, train_loss: 0.2763, test_loss: 3.5196, test_f1: 0.5422
 epoch: 91, train_loss: 0.2699, test_loss: 2.9902, test_f1: 0.5303
 epoch: 92, train_loss: 0.2772, test_loss: 4.3447, test_f1: 0.5420
 epoch: 93, train_loss: 0.2688, test_loss: 3.8656, test_f1: 0.5746
 epoch: 94, train_loss: 0.2533, test_loss: 3.9070, test_f1: 0.5186
 epoch: 95, train_loss: 0.2492, test_loss: 3.2243, test_f1: 0.5445
 epoch: 96, train_loss: 0.2663, test_loss: 3.6450, test_f1: 0.5401
 epoch: 97, train_loss: 0.2720, test_loss: 3.2813, test_f1: 0.5455
 epoch: 98, train_loss: 0.2778, test_loss: 3.0697, test_f1: 0.5763
 epoch: 99, train_loss: 0.2801, test_loss: 3.1740, test_f1: 0.5788
##################ITERATION #2 ****************************************
 epoch: 0, train_loss: 1.2303, test_loss: 1.3533, test_f1: 0.3273
 epoch: 1, train_loss: 1.1404, test_loss: 1.2662, test_f1: 0.3825
 epoch: 2, train_loss: 1.0933, test_loss: 1.3009, test_f1: 0.4475
 epoch: 3, train_loss: 1.0652, test_loss: 1.2314, test_f1: 0.5344
 epoch: 4, train_loss: 1.0190, test_loss: 1.2365, test_f1: 0.5235
 epoch: 5, train_loss: 0.9721, test_loss: 1.2872, test_f1: 0.5566
 epoch: 6, train_loss: 0.9608, test_loss: 1.6016, test_f1: 0.4903
 epoch: 7, train_loss: 0.9366, test_loss: 1.2574, test_f1: 0.5205
 epoch: 8, train_loss: 0.9093, test_loss: 1.1638, test_f1: 0.5829
 epoch: 9, train_loss: 0.8655, test_loss: 1.1310, test_f1: 0.5809
 epoch: 10, train_loss: 0.8799, test_loss: 1.1824, test_f1: 0.5667
 epoch: 11, train_loss: 0.8656, test_loss: 1.1296, test_f1: 0.5453
 epoch: 12, train_loss: 0.8431, test_loss: 1.1085, test_f1: 0.5545
 epoch: 13, train_loss: 0.8231, test_loss: 1.1759, test_f1: 0.5783
 epoch: 14, train_loss: 0.7960, test_loss: 1.0924, test_f1: 0.5740
 epoch: 15, train_loss: 0.8058, test_loss: 1.0888, test_f1: 0.5458
 epoch: 16, train_loss: 0.8056, test_loss: 1.0988, test_f1: 0.5704
 epoch: 17, train_loss: 0.7473, test_loss: 1.1351, test_f1: 0.5791
 epoch: 18, train_loss: 0.7661, test_loss: 1.1211, test_f1: 0.6160
 epoch: 19, train_loss: 0.7430, test_loss: 1.2077, test_f1: 0.5519
 epoch: 20, train_loss: 0.7326, test_loss: 1.2447, test_f1: 0.5932
 epoch: 21, train_loss: 0.7302, test_loss: 1.1611, test_f1: 0.6202
 epoch: 22, train_loss: 0.7177, test_loss: 1.1802, test_f1: 0.5985
 epoch: 23, train_loss: 0.6800, test_loss: 1.1937, test_f1: 0.6127
 epoch: 24, train_loss: 0.6880, test_loss: 1.2091, test_f1: 0.6018
 epoch: 25, train_loss: 0.6848, test_loss: 1.5075, test_f1: 0.5913
 epoch: 26, train_loss: 0.6797, test_loss: 1.3324, test_f1: 0.6064
 epoch: 27, train_loss: 0.6575, test_loss: 1.2933, test_f1: 0.5784
 epoch: 28, train_loss: 0.6328, test_loss: 1.4078, test_f1: 0.5328
 epoch: 29, train_loss: 0.6436, test_loss: 1.3909, test_f1: 0.5736
 epoch: 30, train_loss: 0.6221, test_loss: 1.5668, test_f1: 0.5961
 epoch: 31, train_loss: 0.6388, test_loss: 1.4512, test_f1: 0.5872
 epoch: 32, train_loss: 0.6242, test_loss: 1.5345, test_f1: 0.5802
 epoch: 33, train_loss: 0.6267, test_loss: 1.6073, test_f1: 0.5728
 epoch: 34, train_loss: 0.6255, test_loss: 1.5139, test_f1: 0.6086
 epoch: 35, train_loss: 0.6043, test_loss: 1.4459, test_f1: 0.6003
 epoch: 36, train_loss: 0.5922, test_loss: 1.7448, test_f1: 0.5647
 epoch: 37, train_loss: 0.5849, test_loss: 1.6999, test_f1: 0.5782
 epoch: 38, train_loss: 0.5642, test_loss: 1.7910, test_f1: 0.5854
 epoch: 39, train_loss: 0.5616, test_loss: 1.9040, test_f1: 0.5882
 epoch: 40, train_loss: 0.5387, test_loss: 2.1824, test_f1: 0.5678
 epoch: 41, train_loss: 0.5418, test_loss: 1.7628, test_f1: 0.5775
 epoch: 42, train_loss: 0.5367, test_loss: 1.9592, test_f1: 0.5946
 epoch: 43, train_loss: 0.5131, test_loss: 1.5765, test_f1: 0.6166
 epoch: 44, train_loss: 0.5238, test_loss: 1.8581, test_f1: 0.5666
 epoch: 45, train_loss: 0.5825, test_loss: 1.7095, test_f1: 0.5930
 epoch: 46, train_loss: 0.6230, test_loss: 1.5274, test_f1: 0.5544
 epoch: 47, train_loss: 0.5551, test_loss: 1.7214, test_f1: 0.6034
 epoch: 48, train_loss: 0.5239, test_loss: 1.7413, test_f1: 0.6020
 epoch: 49, train_loss: 0.5366, test_loss: 1.6674, test_f1: 0.5996
 epoch: 50, train_loss: 0.5370, test_loss: 1.9235, test_f1: 0.5507
 epoch: 51, train_loss: 0.4545, test_loss: 1.7901, test_f1: 0.5820
 epoch: 52, train_loss: 0.4292, test_loss: 2.0029, test_f1: 0.5783
 epoch: 53, train_loss: 0.4332, test_loss: 2.1343, test_f1: 0.5749
 epoch: 54, train_loss: 0.4152, test_loss: 2.2774, test_f1: 0.5694
 epoch: 55, train_loss: 0.4158, test_loss: 2.1251, test_f1: 0.5797
 epoch: 56, train_loss: 0.3938, test_loss: 2.1564, test_f1: 0.5754
 epoch: 57, train_loss: 0.4067, test_loss: 2.3272, test_f1: 0.5903
 epoch: 58, train_loss: 0.3791, test_loss: 2.1902, test_f1: 0.5805
 epoch: 59, train_loss: 0.3734, test_loss: 2.4190, test_f1: 0.5542
 epoch: 60, train_loss: 0.3678, test_loss: 2.2630, test_f1: 0.5912
 epoch: 61, train_loss: 0.3605, test_loss: 2.6094, test_f1: 0.5894
 epoch: 62, train_loss: 0.3967, test_loss: 2.4563, test_f1: 0.6003
 epoch: 63, train_loss: 0.3829, test_loss: 2.4711, test_f1: 0.5986
 epoch: 64, train_loss: 0.3603, test_loss: 2.5680, test_f1: 0.5886
 epoch: 65, train_loss: 0.3792, test_loss: 2.4343, test_f1: 0.6086
 epoch: 66, train_loss: 0.3456, test_loss: 2.6454, test_f1: 0.5816
 epoch: 67, train_loss: 0.3625, test_loss: 2.7815, test_f1: 0.5938
 epoch: 68, train_loss: 0.3417, test_loss: 2.3553, test_f1: 0.6115
 epoch: 69, train_loss: 0.3883, test_loss: 2.6105, test_f1: 0.5985
 epoch: 70, train_loss: 0.3396, test_loss: 2.4566, test_f1: 0.6077
 epoch: 71, train_loss: 0.3618, test_loss: 2.4834, test_f1: 0.5915
 epoch: 72, train_loss: 0.3410, test_loss: 2.7081, test_f1: 0.5813
 epoch: 73, train_loss: 0.3295, test_loss: 2.8642, test_f1: 0.5956
 epoch: 74, train_loss: 0.3458, test_loss: 2.9022, test_f1: 0.5602
 epoch: 75, train_loss: 0.3282, test_loss: 2.8270, test_f1: 0.5842
 epoch: 76, train_loss: 0.3442, test_loss: 2.5904, test_f1: 0.5741
 epoch: 77, train_loss: 0.3309, test_loss: 3.1038, test_f1: 0.5766
 epoch: 78, train_loss: 0.3307, test_loss: 2.9120, test_f1: 0.5702
 epoch: 79, train_loss: 0.3398, test_loss: 2.9448, test_f1: 0.5956
 epoch: 80, train_loss: 0.3326, test_loss: 2.8504, test_f1: 0.6180
 epoch: 81, train_loss: 0.3138, test_loss: 3.1248, test_f1: 0.5862
 epoch: 82, train_loss: 0.3210, test_loss: 2.8502, test_f1: 0.5952
 epoch: 83, train_loss: 0.3162, test_loss: 2.9090, test_f1: 0.5828
 epoch: 84, train_loss: 0.3142, test_loss: 3.2657, test_f1: 0.5796
 epoch: 85, train_loss: 0.3109, test_loss: 3.1544, test_f1: 0.6054
 epoch: 86, train_loss: 0.3070, test_loss: 3.0170, test_f1: 0.5833
 epoch: 87, train_loss: 0.3309, test_loss: 2.6564, test_f1: 0.5897
 epoch: 88, train_loss: 0.3099, test_loss: 2.7280, test_f1: 0.5790
 epoch: 89, train_loss: 0.3051, test_loss: 2.8040, test_f1: 0.5737
 epoch: 90, train_loss: 0.3244, test_loss: 3.0800, test_f1: 0.5596
 epoch: 91, train_loss: 0.3048, test_loss: 2.9736, test_f1: 0.5894
 epoch: 92, train_loss: 0.2968, test_loss: 2.9707, test_f1: 0.5982
 epoch: 93, train_loss: 0.3192, test_loss: 3.1931, test_f1: 0.5812
 epoch: 94, train_loss: 0.2841, test_loss: 2.9903, test_f1: 0.5910
 epoch: 95, train_loss: 0.3437, test_loss: 2.8691, test_f1: 0.5773
 epoch: 96, train_loss: 0.2875, test_loss: 3.1720, test_f1: 0.5702
 epoch: 97, train_loss: 0.2775, test_loss: 3.2573, test_f1: 0.5551
 epoch: 98, train_loss: 0.3267, test_loss: 3.3188, test_f1: 0.5908
 epoch: 99, train_loss: 0.2947, test_loss: 3.3047, test_f1: 0.5765
##################ITERATION #3 ****************************************
 epoch: 0, train_loss: 1.2656, test_loss: 1.3176, test_f1: 0.3656
 epoch: 1, train_loss: 1.1817, test_loss: 1.2453, test_f1: 0.4059
 epoch: 2, train_loss: 1.1249, test_loss: 1.2247, test_f1: 0.4931
 epoch: 3, train_loss: 1.0832, test_loss: 1.1998, test_f1: 0.4813
 epoch: 4, train_loss: 1.0504, test_loss: 1.2096, test_f1: 0.4878
 epoch: 5, train_loss: 1.0177, test_loss: 1.2081, test_f1: 0.5596
 epoch: 6, train_loss: 0.9732, test_loss: 1.2425, test_f1: 0.5485
 epoch: 7, train_loss: 0.9469, test_loss: 1.2390, test_f1: 0.5847
 epoch: 8, train_loss: 0.9293, test_loss: 1.3464, test_f1: 0.5348
 epoch: 9, train_loss: 0.9204, test_loss: 1.2493, test_f1: 0.5219
 epoch: 10, train_loss: 0.8910, test_loss: 1.2422, test_f1: 0.5538
 epoch: 11, train_loss: 0.8776, test_loss: 1.2720, test_f1: 0.5769
 epoch: 12, train_loss: 0.8565, test_loss: 1.4938, test_f1: 0.5237
 epoch: 13, train_loss: 0.8523, test_loss: 1.3145, test_f1: 0.5273
 epoch: 14, train_loss: 0.8528, test_loss: 1.4605, test_f1: 0.5550
 epoch: 15, train_loss: 0.8412, test_loss: 1.3370, test_f1: 0.5486
 epoch: 16, train_loss: 0.8338, test_loss: 1.2997, test_f1: 0.6009
 epoch: 17, train_loss: 0.8142, test_loss: 1.3788, test_f1: 0.5903
 epoch: 18, train_loss: 0.8196, test_loss: 1.5280, test_f1: 0.5974
 epoch: 19, train_loss: 0.7565, test_loss: 1.3565, test_f1: 0.6000
 epoch: 20, train_loss: 0.7576, test_loss: 1.3641, test_f1: 0.6071
 epoch: 21, train_loss: 0.7454, test_loss: 1.4942, test_f1: 0.5897
 epoch: 22, train_loss: 0.7665, test_loss: 1.5326, test_f1: 0.5786
 epoch: 23, train_loss: 0.7645, test_loss: 1.5003, test_f1: 0.5869
 epoch: 24, train_loss: 0.7467, test_loss: 1.6635, test_f1: 0.5970
 epoch: 25, train_loss: 0.7382, test_loss: 1.3566, test_f1: 0.5738
 epoch: 26, train_loss: 0.7075, test_loss: 1.4249, test_f1: 0.5896
 epoch: 27, train_loss: 0.6926, test_loss: 1.6585, test_f1: 0.5290
 epoch: 28, train_loss: 0.7247, test_loss: 1.5794, test_f1: 0.5710
 epoch: 29, train_loss: 0.6885, test_loss: 1.5774, test_f1: 0.5727
 epoch: 30, train_loss: 0.6970, test_loss: 1.3952, test_f1: 0.5707
 epoch: 31, train_loss: 0.6979, test_loss: 1.4378, test_f1: 0.6214
 epoch: 32, train_loss: 0.6924, test_loss: 1.4794, test_f1: 0.5886
 epoch: 33, train_loss: 0.6524, test_loss: 1.3724, test_f1: 0.6160
 epoch: 34, train_loss: 0.6655, test_loss: 1.6273, test_f1: 0.5711
 epoch: 35, train_loss: 0.6204, test_loss: 1.6663, test_f1: 0.5472
 epoch: 36, train_loss: 0.6103, test_loss: 2.0661, test_f1: 0.5181
 epoch: 37, train_loss: 0.6217, test_loss: 1.5123, test_f1: 0.5963
 epoch: 38, train_loss: 0.6333, test_loss: 2.1009, test_f1: 0.5626
 epoch: 39, train_loss: 0.6255, test_loss: 1.9591, test_f1: 0.5589
 epoch: 40, train_loss: 0.6039, test_loss: 1.8722, test_f1: 0.5852
 epoch: 41, train_loss: 0.5876, test_loss: 1.7446, test_f1: 0.6128
 epoch: 42, train_loss: 0.5996, test_loss: 2.3722, test_f1: 0.5559
 epoch: 43, train_loss: 0.5963, test_loss: 2.0697, test_f1: 0.5818
 epoch: 44, train_loss: 0.5699, test_loss: 1.9671, test_f1: 0.6081
 epoch: 45, train_loss: 0.5818, test_loss: 1.9000, test_f1: 0.6266
 epoch: 46, train_loss: 0.5723, test_loss: 3.0578, test_f1: 0.5092
 epoch: 47, train_loss: 0.5443, test_loss: 1.7939, test_f1: 0.6105
 epoch: 48, train_loss: 0.5592, test_loss: 2.0735, test_f1: 0.6076
 epoch: 49, train_loss: 0.6238, test_loss: 2.5722, test_f1: 0.6087
 epoch: 50, train_loss: 0.5643, test_loss: 2.1131, test_f1: 0.5947
 epoch: 51, train_loss: 0.5384, test_loss: 1.9790, test_f1: 0.6149
 epoch: 52, train_loss: 0.4893, test_loss: 2.0094, test_f1: 0.6030
 epoch: 53, train_loss: 0.4939, test_loss: 2.1914, test_f1: 0.6231
 epoch: 54, train_loss: 0.4699, test_loss: 2.2602, test_f1: 0.6207
 epoch: 55, train_loss: 0.4512, test_loss: 2.2556, test_f1: 0.6103
 epoch: 56, train_loss: 0.4394, test_loss: 2.4587, test_f1: 0.5959
 epoch: 57, train_loss: 0.4413, test_loss: 2.2534, test_f1: 0.6057
 epoch: 58, train_loss: 0.4389, test_loss: 2.1951, test_f1: 0.5992
 epoch: 59, train_loss: 0.4294, test_loss: 2.3469, test_f1: 0.5968
 epoch: 60, train_loss: 0.4189, test_loss: 2.2775, test_f1: 0.5993
 epoch: 61, train_loss: 0.4346, test_loss: 2.6925, test_f1: 0.5831
 epoch: 62, train_loss: 0.4357, test_loss: 2.3598, test_f1: 0.6340
 epoch: 63, train_loss: 0.4299, test_loss: 2.4366, test_f1: 0.5756
 epoch: 64, train_loss: 0.4062, test_loss: 2.3059, test_f1: 0.6179
 epoch: 65, train_loss: 0.4289, test_loss: 2.2345, test_f1: 0.6077
 epoch: 66, train_loss: 0.4389, test_loss: 2.3340, test_f1: 0.5764
 epoch: 67, train_loss: 0.3901, test_loss: 2.5535, test_f1: 0.5934
 epoch: 68, train_loss: 0.4293, test_loss: 2.0846, test_f1: 0.6127
 epoch: 69, train_loss: 0.3881, test_loss: 3.0015, test_f1: 0.5756
 epoch: 70, train_loss: 0.4139, test_loss: 2.6689, test_f1: 0.5992
 epoch: 71, train_loss: 0.4071, test_loss: 2.7140, test_f1: 0.5626
 epoch: 72, train_loss: 0.3872, test_loss: 2.5455, test_f1: 0.5959
 epoch: 73, train_loss: 0.4012, test_loss: 2.9363, test_f1: 0.6142
 epoch: 74, train_loss: 0.3891, test_loss: 3.1427, test_f1: 0.5809
 epoch: 75, train_loss: 0.3744, test_loss: 2.4352, test_f1: 0.6179
 epoch: 76, train_loss: 0.3833, test_loss: 2.4344, test_f1: 0.5909
 epoch: 77, train_loss: 0.3669, test_loss: 3.0087, test_f1: 0.6315
 epoch: 78, train_loss: 0.3783, test_loss: 3.0020, test_f1: 0.5490
 epoch: 79, train_loss: 0.3637, test_loss: 2.9376, test_f1: 0.6324
 epoch: 80, train_loss: 0.3865, test_loss: 2.6441, test_f1: 0.6140
 epoch: 81, train_loss: 0.3798, test_loss: 3.6764, test_f1: 0.6417
 epoch: 82, train_loss: 0.3625, test_loss: 2.4730, test_f1: 0.5802
 epoch: 83, train_loss: 0.3819, test_loss: 2.9681, test_f1: 0.6092
 epoch: 84, train_loss: 0.3517, test_loss: 2.8589, test_f1: 0.6270
 epoch: 85, train_loss: 0.3576, test_loss: 3.0126, test_f1: 0.6213
 epoch: 86, train_loss: 0.3332, test_loss: 3.1349, test_f1: 0.5939
 epoch: 87, train_loss: 0.3497, test_loss: 3.3444, test_f1: 0.5882
 epoch: 88, train_loss: 0.3235, test_loss: 2.7767, test_f1: 0.6561
 epoch: 89, train_loss: 0.3468, test_loss: 2.7828, test_f1: 0.6252
 epoch: 90, train_loss: 0.3214, test_loss: 2.9880, test_f1: 0.6131
 epoch: 91, train_loss: 0.3420, test_loss: 2.7749, test_f1: 0.6080
 epoch: 92, train_loss: 0.3301, test_loss: 3.3835, test_f1: 0.6209
 epoch: 93, train_loss: 0.3557, test_loss: 3.3346, test_f1: 0.6059
 epoch: 94, train_loss: 0.3357, test_loss: 3.0142, test_f1: 0.6221
 epoch: 95, train_loss: 0.3208, test_loss: 3.5420, test_f1: 0.5597
 epoch: 96, train_loss: 0.3309, test_loss: 3.0592, test_f1: 0.6102
 epoch: 97, train_loss: 0.3402, test_loss: 2.7099, test_f1: 0.6246
 epoch: 98, train_loss: 0.3135, test_loss: 3.4690, test_f1: 0.5856
 epoch: 99, train_loss: 0.3233, test_loss: 3.3259, test_f1: 0.6136
##################ITERATION #4 ****************************************
 epoch: 0, train_loss: 1.2504, test_loss: 1.2848, test_f1: 0.2263
 epoch: 1, train_loss: 1.1379, test_loss: 1.3195, test_f1: 0.4836
 epoch: 2, train_loss: 1.0801, test_loss: 1.1747, test_f1: 0.4892
 epoch: 3, train_loss: 1.0498, test_loss: 1.1650, test_f1: 0.4612
 epoch: 4, train_loss: 0.9853, test_loss: 1.2218, test_f1: 0.4837
 epoch: 5, train_loss: 0.9697, test_loss: 1.2919, test_f1: 0.4553
 epoch: 6, train_loss: 0.9377, test_loss: 1.2458, test_f1: 0.5092
 epoch: 7, train_loss: 0.9142, test_loss: 1.1318, test_f1: 0.5457
 epoch: 8, train_loss: 0.8990, test_loss: 1.1327, test_f1: 0.5693
 epoch: 9, train_loss: 0.8764, test_loss: 1.1522, test_f1: 0.5555
 epoch: 10, train_loss: 0.8548, test_loss: 1.2577, test_f1: 0.4810
 epoch: 11, train_loss: 0.8176, test_loss: 1.2123, test_f1: 0.5485
 epoch: 12, train_loss: 0.8288, test_loss: 1.1805, test_f1: 0.5302
 epoch: 13, train_loss: 0.8191, test_loss: 1.1397, test_f1: 0.5813
 epoch: 14, train_loss: 0.8173, test_loss: 1.1922, test_f1: 0.5842
 epoch: 15, train_loss: 0.7944, test_loss: 1.2213, test_f1: 0.5150
 epoch: 16, train_loss: 0.7662, test_loss: 1.5379, test_f1: 0.5048
 epoch: 17, train_loss: 0.7398, test_loss: 1.2812, test_f1: 0.5072
 epoch: 18, train_loss: 0.7451, test_loss: 1.2847, test_f1: 0.5522
 epoch: 19, train_loss: 0.7251, test_loss: 1.4402, test_f1: 0.4934
 epoch: 20, train_loss: 0.7326, test_loss: 1.3370, test_f1: 0.5447
 epoch: 21, train_loss: 0.7389, test_loss: 1.1971, test_f1: 0.5720
 epoch: 22, train_loss: 0.7199, test_loss: 1.2748, test_f1: 0.5597
 epoch: 23, train_loss: 0.6742, test_loss: 1.4280, test_f1: 0.5213
 epoch: 24, train_loss: 0.6582, test_loss: 1.4563, test_f1: 0.5313
 epoch: 25, train_loss: 0.6638, test_loss: 1.4030, test_f1: 0.5506
 epoch: 26, train_loss: 0.6475, test_loss: 1.5556, test_f1: 0.4992
 epoch: 27, train_loss: 0.6742, test_loss: 1.6421, test_f1: 0.5072
 epoch: 28, train_loss: 0.6464, test_loss: 1.5484, test_f1: 0.5190
 epoch: 29, train_loss: 0.6327, test_loss: 1.5112, test_f1: 0.5397
 epoch: 30, train_loss: 0.6280, test_loss: 1.4179, test_f1: 0.5744
 epoch: 31, train_loss: 0.6668, test_loss: 1.4887, test_f1: 0.5532
 epoch: 32, train_loss: 0.6399, test_loss: 1.6280, test_f1: 0.5162
 epoch: 33, train_loss: 0.6611, test_loss: 1.3707, test_f1: 0.5755
 epoch: 34, train_loss: 0.6057, test_loss: 1.5199, test_f1: 0.5212
 epoch: 35, train_loss: 0.6127, test_loss: 1.5661, test_f1: 0.5954
 epoch: 36, train_loss: 0.5549, test_loss: 1.6230, test_f1: 0.5385
 epoch: 37, train_loss: 0.5780, test_loss: 1.6272, test_f1: 0.6001
 epoch: 38, train_loss: 0.5610, test_loss: 1.7019, test_f1: 0.5423
 epoch: 39, train_loss: 0.5993, test_loss: 1.6175, test_f1: 0.5676
 epoch: 40, train_loss: 0.5604, test_loss: 1.7693, test_f1: 0.5600
 epoch: 41, train_loss: 0.5650, test_loss: 1.6475, test_f1: 0.5913
 epoch: 42, train_loss: 0.5564, test_loss: 1.8599, test_f1: 0.4964
 epoch: 43, train_loss: 0.5428, test_loss: 1.7213, test_f1: 0.5792
 epoch: 44, train_loss: 0.5522, test_loss: 1.8835, test_f1: 0.5472
 epoch: 45, train_loss: 0.5364, test_loss: 1.7117, test_f1: 0.5561
 epoch: 46, train_loss: 0.5001, test_loss: 1.7417, test_f1: 0.5694
 epoch: 47, train_loss: 0.5033, test_loss: 2.0072, test_f1: 0.5343
 epoch: 48, train_loss: 0.4613, test_loss: 2.2100, test_f1: 0.5132
 epoch: 49, train_loss: 0.4910, test_loss: 2.3548, test_f1: 0.5282
 epoch: 50, train_loss: 0.5048, test_loss: 1.9373, test_f1: 0.5712
 epoch: 51, train_loss: 0.4611, test_loss: 2.1449, test_f1: 0.5192
 epoch: 52, train_loss: 0.4402, test_loss: 1.9974, test_f1: 0.5956
 epoch: 53, train_loss: 0.4185, test_loss: 2.1014, test_f1: 0.5901
 epoch: 54, train_loss: 0.4023, test_loss: 2.1956, test_f1: 0.5544
 epoch: 55, train_loss: 0.4089, test_loss: 2.3562, test_f1: 0.5327
 epoch: 56, train_loss: 0.3925, test_loss: 2.1970, test_f1: 0.5750
 epoch: 57, train_loss: 0.3861, test_loss: 2.4044, test_f1: 0.5308
 epoch: 58, train_loss: 0.4660, test_loss: 2.4850, test_f1: 0.4980
 epoch: 59, train_loss: 0.4303, test_loss: 2.4735, test_f1: 0.5731
 epoch: 60, train_loss: 0.4221, test_loss: 2.3964, test_f1: 0.5579
 epoch: 61, train_loss: 0.3993, test_loss: 2.5729, test_f1: 0.5343
 epoch: 62, train_loss: 0.3812, test_loss: 2.3080, test_f1: 0.5685
 epoch: 63, train_loss: 0.3654, test_loss: 2.4172, test_f1: 0.5603
 epoch: 64, train_loss: 0.3831, test_loss: 2.2796, test_f1: 0.5582
 epoch: 65, train_loss: 0.3723, test_loss: 2.3670, test_f1: 0.5607
 epoch: 66, train_loss: 0.3555, test_loss: 2.5514, test_f1: 0.5510
 epoch: 67, train_loss: 0.3890, test_loss: 2.4364, test_f1: 0.5897
 epoch: 68, train_loss: 0.3683, test_loss: 2.2835, test_f1: 0.5484
 epoch: 69, train_loss: 0.3288, test_loss: 2.3168, test_f1: 0.5523
 epoch: 70, train_loss: 0.3310, test_loss: 2.4559, test_f1: 0.5417
 epoch: 71, train_loss: 0.3437, test_loss: 2.4984, test_f1: 0.5460
 epoch: 72, train_loss: 0.3377, test_loss: 2.3939, test_f1: 0.5639
 epoch: 73, train_loss: 0.3417, test_loss: 2.4012, test_f1: 0.6015
 epoch: 74, train_loss: 0.3672, test_loss: 2.8471, test_f1: 0.5251
 epoch: 75, train_loss: 0.3386, test_loss: 2.7988, test_f1: 0.5214
 epoch: 76, train_loss: 0.3201, test_loss: 2.8308, test_f1: 0.5507
 epoch: 77, train_loss: 0.3420, test_loss: 2.4845, test_f1: 0.5666
 epoch: 78, train_loss: 0.3193, test_loss: 2.7560, test_f1: 0.5505
 epoch: 79, train_loss: 0.3046, test_loss: 2.7889, test_f1: 0.5485
 epoch: 80, train_loss: 0.2997, test_loss: 2.6784, test_f1: 0.5731
 epoch: 81, train_loss: 0.3201, test_loss: 3.3471, test_f1: 0.5655
 epoch: 82, train_loss: 0.3156, test_loss: 2.6029, test_f1: 0.5424
 epoch: 83, train_loss: 0.2949, test_loss: 3.0259, test_f1: 0.5749
 epoch: 84, train_loss: 0.2928, test_loss: 2.6632, test_f1: 0.5938
 epoch: 85, train_loss: 0.3063, test_loss: 2.7595, test_f1: 0.6042
 epoch: 86, train_loss: 0.2897, test_loss: 2.7715, test_f1: 0.5736
 epoch: 87, train_loss: 0.2846, test_loss: 3.2999, test_f1: 0.5649
 epoch: 88, train_loss: 0.2637, test_loss: 3.2218, test_f1: 0.5943
 epoch: 89, train_loss: 0.2849, test_loss: 3.2403, test_f1: 0.5593
 epoch: 90, train_loss: 0.2789, test_loss: 3.3083, test_f1: 0.5760
 epoch: 91, train_loss: 0.2806, test_loss: 3.0844, test_f1: 0.5622
 epoch: 92, train_loss: 0.3024, test_loss: 3.3986, test_f1: 0.5555
 epoch: 93, train_loss: 0.2974, test_loss: 3.4745, test_f1: 0.5674
 epoch: 94, train_loss: 0.3033, test_loss: 3.0928, test_f1: 0.5433
 epoch: 95, train_loss: 0.2847, test_loss: 3.0981, test_f1: 0.5429
 epoch: 96, train_loss: 0.2916, test_loss: 2.9333, test_f1: 0.5622
 epoch: 97, train_loss: 0.3122, test_loss: 2.8290, test_f1: 0.5692
 epoch: 98, train_loss: 0.2524, test_loss: 3.1266, test_f1: 0.5804
 epoch: 99, train_loss: 0.2678, test_loss: 3.1680, test_f1: 0.5789
##################ITERATION #5 ****************************************
 epoch: 0, train_loss: 1.2680, test_loss: 1.3175, test_f1: 0.2892
 epoch: 1, train_loss: 1.1633, test_loss: 1.2432, test_f1: 0.4286
 epoch: 2, train_loss: 1.1132, test_loss: 1.1546, test_f1: 0.5444
 epoch: 3, train_loss: 1.0547, test_loss: 1.1356, test_f1: 0.4944
 epoch: 4, train_loss: 1.0285, test_loss: 1.1382, test_f1: 0.4635
 epoch: 5, train_loss: 0.9816, test_loss: 1.1093, test_f1: 0.5503
 epoch: 6, train_loss: 0.9811, test_loss: 1.1248, test_f1: 0.5569
 epoch: 7, train_loss: 0.9491, test_loss: 1.1254, test_f1: 0.5277
 epoch: 8, train_loss: 0.9208, test_loss: 1.0953, test_f1: 0.5662
 epoch: 9, train_loss: 0.8991, test_loss: 1.1190, test_f1: 0.5640
 epoch: 10, train_loss: 0.8754, test_loss: 1.0584, test_f1: 0.5453
 epoch: 11, train_loss: 0.8700, test_loss: 1.1063, test_f1: 0.5821
 epoch: 12, train_loss: 0.8600, test_loss: 1.1570, test_f1: 0.4954
 epoch: 13, train_loss: 0.8640, test_loss: 1.1783, test_f1: 0.5390
 epoch: 14, train_loss: 0.8290, test_loss: 1.1884, test_f1: 0.5709
 epoch: 15, train_loss: 0.8023, test_loss: 1.0832, test_f1: 0.5719
 epoch: 16, train_loss: 0.8090, test_loss: 1.1076, test_f1: 0.5875
 epoch: 17, train_loss: 0.7876, test_loss: 1.3144, test_f1: 0.5392
 epoch: 18, train_loss: 0.7784, test_loss: 1.3368, test_f1: 0.5827
 epoch: 19, train_loss: 0.7921, test_loss: 1.2431, test_f1: 0.5832
 epoch: 20, train_loss: 0.7712, test_loss: 1.2895, test_f1: 0.5589
 epoch: 21, train_loss: 0.7473, test_loss: 1.3090, test_f1: 0.5911
 epoch: 22, train_loss: 0.7282, test_loss: 1.3124, test_f1: 0.5379
 epoch: 23, train_loss: 0.7285, test_loss: 1.2894, test_f1: 0.5946
 epoch: 24, train_loss: 0.7173, test_loss: 1.3669, test_f1: 0.5604
 epoch: 25, train_loss: 0.7326, test_loss: 1.3026, test_f1: 0.5491
 epoch: 26, train_loss: 0.7030, test_loss: 1.3689, test_f1: 0.5855
 epoch: 27, train_loss: 0.6844, test_loss: 1.3385, test_f1: 0.5335
 epoch: 28, train_loss: 0.6768, test_loss: 1.2566, test_f1: 0.5612
 epoch: 29, train_loss: 0.6982, test_loss: 1.2644, test_f1: 0.5533
 epoch: 30, train_loss: 0.6859, test_loss: 1.3837, test_f1: 0.5600
 epoch: 31, train_loss: 0.6676, test_loss: 1.7177, test_f1: 0.4790
 epoch: 32, train_loss: 0.6683, test_loss: 1.5553, test_f1: 0.5063
 epoch: 33, train_loss: 0.6449, test_loss: 1.6145, test_f1: 0.6002
 epoch: 34, train_loss: 0.6555, test_loss: 1.6757, test_f1: 0.5415
 epoch: 35, train_loss: 0.6494, test_loss: 1.4491, test_f1: 0.5493
 epoch: 36, train_loss: 0.6277, test_loss: 1.5348, test_f1: 0.5853
 epoch: 37, train_loss: 0.6502, test_loss: 1.3901, test_f1: 0.5800
 epoch: 38, train_loss: 0.6228, test_loss: 1.4142, test_f1: 0.5606
 epoch: 39, train_loss: 0.6531, test_loss: 1.2941, test_f1: 0.5714
 epoch: 40, train_loss: 0.6383, test_loss: 1.3511, test_f1: 0.5546
 epoch: 41, train_loss: 0.6012, test_loss: 1.3296, test_f1: 0.5725
 epoch: 42, train_loss: 0.5848, test_loss: 1.5771, test_f1: 0.5402
 epoch: 43, train_loss: 0.5757, test_loss: 1.5921, test_f1: 0.5502
 epoch: 44, train_loss: 0.5769, test_loss: 1.4372, test_f1: 0.5631
 epoch: 45, train_loss: 0.5874, test_loss: 1.6006, test_f1: 0.5857
 epoch: 46, train_loss: 0.5848, test_loss: 1.6511, test_f1: 0.5809
 epoch: 47, train_loss: 0.5947, test_loss: 1.5759, test_f1: 0.5836
 epoch: 48, train_loss: 0.5618, test_loss: 1.5437, test_f1: 0.5597
 epoch: 49, train_loss: 0.5626, test_loss: 1.7740, test_f1: 0.5477
 epoch: 50, train_loss: 0.5483, test_loss: 1.8008, test_f1: 0.5947
 epoch: 51, train_loss: 0.5575, test_loss: 1.9161, test_f1: 0.6204
 epoch: 52, train_loss: 0.4948, test_loss: 1.7899, test_f1: 0.5859
 epoch: 53, train_loss: 0.4757, test_loss: 1.7294, test_f1: 0.5753
 epoch: 54, train_loss: 0.4927, test_loss: 1.7861, test_f1: 0.5729
 epoch: 55, train_loss: 0.4638, test_loss: 1.8832, test_f1: 0.5945
 epoch: 56, train_loss: 0.4588, test_loss: 1.7091, test_f1: 0.5486
 epoch: 57, train_loss: 0.4883, test_loss: 1.5757, test_f1: 0.5832
 epoch: 58, train_loss: 0.4624, test_loss: 1.5886, test_f1: 0.5837
 epoch: 59, train_loss: 0.4488, test_loss: 1.7797, test_f1: 0.5817
 epoch: 60, train_loss: 0.4508, test_loss: 1.8033, test_f1: 0.5827
 epoch: 61, train_loss: 0.4257, test_loss: 1.7182, test_f1: 0.5998
 epoch: 62, train_loss: 0.4308, test_loss: 1.8738, test_f1: 0.5920
 epoch: 63, train_loss: 0.4180, test_loss: 1.7866, test_f1: 0.5435
 epoch: 64, train_loss: 0.4276, test_loss: 1.7837, test_f1: 0.5798
 epoch: 65, train_loss: 0.4033, test_loss: 1.9198, test_f1: 0.5656
 epoch: 66, train_loss: 0.4291, test_loss: 1.9436, test_f1: 0.5792
 epoch: 67, train_loss: 0.4235, test_loss: 1.6451, test_f1: 0.5717
 epoch: 68, train_loss: 0.4203, test_loss: 1.6823, test_f1: 0.5916
 epoch: 69, train_loss: 0.4146, test_loss: 2.0045, test_f1: 0.5390
 epoch: 70, train_loss: 0.3999, test_loss: 2.1252, test_f1: 0.5365
 epoch: 71, train_loss: 0.3803, test_loss: 1.9419, test_f1: 0.5363
 epoch: 72, train_loss: 0.3973, test_loss: 1.8460, test_f1: 0.5828
 epoch: 73, train_loss: 0.4031, test_loss: 1.9633, test_f1: 0.5837
 epoch: 74, train_loss: 0.3889, test_loss: 1.9961, test_f1: 0.5645
 epoch: 75, train_loss: 0.4156, test_loss: 2.0601, test_f1: 0.5978
 epoch: 76, train_loss: 0.4086, test_loss: 2.0402, test_f1: 0.5179
 epoch: 77, train_loss: 0.3797, test_loss: 1.7908, test_f1: 0.5550
 epoch: 78, train_loss: 0.3911, test_loss: 1.8944, test_f1: 0.5968
 epoch: 79, train_loss: 0.3675, test_loss: 1.8719, test_f1: 0.5838
 epoch: 80, train_loss: 0.3635, test_loss: 1.9225, test_f1: 0.5568
 epoch: 81, train_loss: 0.3749, test_loss: 2.2118, test_f1: 0.5919
 epoch: 82, train_loss: 0.3831, test_loss: 2.0920, test_f1: 0.5583
 epoch: 83, train_loss: 0.3476, test_loss: 1.9469, test_f1: 0.5878
 epoch: 84, train_loss: 0.3506, test_loss: 2.1025, test_f1: 0.5450
 epoch: 85, train_loss: 0.3762, test_loss: 2.0887, test_f1: 0.5673
 epoch: 86, train_loss: 0.3668, test_loss: 1.7918, test_f1: 0.5694
 epoch: 87, train_loss: 0.3629, test_loss: 1.8990, test_f1: 0.5883
 epoch: 88, train_loss: 0.3607, test_loss: 1.9875, test_f1: 0.5824
 epoch: 89, train_loss: 0.3731, test_loss: 1.9639, test_f1: 0.5875
 epoch: 90, train_loss: 0.3581, test_loss: 1.8899, test_f1: 0.6139
 epoch: 91, train_loss: 0.3459, test_loss: 1.9233, test_f1: 0.5978
 epoch: 92, train_loss: 0.3092, test_loss: 2.1093, test_f1: 0.6124
 epoch: 93, train_loss: 0.3534, test_loss: 2.2389, test_f1: 0.5739
 epoch: 94, train_loss: 0.3317, test_loss: 2.1505, test_f1: 0.5825
 epoch: 95, train_loss: 0.3374, test_loss: 2.3930, test_f1: 0.5751
 epoch: 96, train_loss: 0.3277, test_loss: 2.3485, test_f1: 0.5567
 epoch: 97, train_loss: 0.3141, test_loss: 3.6670, test_f1: 0.5872
 epoch: 98, train_loss: 0.3640, test_loss: 2.2515, test_f1: 0.5593
 epoch: 99, train_loss: 0.3171, test_loss: 2.3484, test_f1: 0.5698
##################ITERATION #6 ****************************************
 epoch: 0, train_loss: 1.2842, test_loss: 1.2882, test_f1: 0.2281
 epoch: 1, train_loss: 1.1676, test_loss: 1.2455, test_f1: 0.4061
 epoch: 2, train_loss: 1.1045, test_loss: 1.2437, test_f1: 0.4733
 epoch: 3, train_loss: 1.0791, test_loss: 1.2237, test_f1: 0.5080
 epoch: 4, train_loss: 1.0383, test_loss: 1.1717, test_f1: 0.5222
 epoch: 5, train_loss: 0.9904, test_loss: 1.2268, test_f1: 0.5448
 epoch: 6, train_loss: 0.9644, test_loss: 1.2159, test_f1: 0.5468
 epoch: 7, train_loss: 0.9637, test_loss: 1.1362, test_f1: 0.5741
 epoch: 8, train_loss: 0.9025, test_loss: 1.2624, test_f1: 0.5589
 epoch: 9, train_loss: 0.9046, test_loss: 1.1361, test_f1: 0.5696
 epoch: 10, train_loss: 0.8682, test_loss: 1.1952, test_f1: 0.5563
 epoch: 11, train_loss: 0.8598, test_loss: 1.0681, test_f1: 0.5538
 epoch: 12, train_loss: 0.8369, test_loss: 1.1282, test_f1: 0.5805
 epoch: 13, train_loss: 0.8355, test_loss: 1.2371, test_f1: 0.5380
 epoch: 14, train_loss: 0.8132, test_loss: 1.3081, test_f1: 0.5476
 epoch: 15, train_loss: 0.8066, test_loss: 1.2833, test_f1: 0.6015
 epoch: 16, train_loss: 0.8060, test_loss: 1.3230, test_f1: 0.6073
 epoch: 17, train_loss: 0.7902, test_loss: 1.2764, test_f1: 0.5884
 epoch: 18, train_loss: 0.7903, test_loss: 1.3261, test_f1: 0.6029
 epoch: 19, train_loss: 0.7580, test_loss: 1.2083, test_f1: 0.5868
 epoch: 20, train_loss: 0.7671, test_loss: 1.2072, test_f1: 0.5809
 epoch: 21, train_loss: 0.7389, test_loss: 1.3593, test_f1: 0.5806
 epoch: 22, train_loss: 0.7033, test_loss: 1.2291, test_f1: 0.6053
 epoch: 23, train_loss: 0.7191, test_loss: 1.2972, test_f1: 0.5654
 epoch: 24, train_loss: 0.6819, test_loss: 1.3122, test_f1: 0.6128
 epoch: 25, train_loss: 0.7193, test_loss: 1.2305, test_f1: 0.5820
 epoch: 26, train_loss: 0.6843, test_loss: 1.3747, test_f1: 0.5882
 epoch: 27, train_loss: 0.6534, test_loss: 1.1868, test_f1: 0.6296
 epoch: 28, train_loss: 0.6677, test_loss: 1.5266, test_f1: 0.5519
 epoch: 29, train_loss: 0.6422, test_loss: 1.6678, test_f1: 0.5541
 epoch: 30, train_loss: 0.6502, test_loss: 1.4038, test_f1: 0.5470
 epoch: 31, train_loss: 0.6429, test_loss: 1.4766, test_f1: 0.5500
 epoch: 32, train_loss: 0.6432, test_loss: 1.6955, test_f1: 0.5238
 epoch: 33, train_loss: 0.6048, test_loss: 1.5522, test_f1: 0.5636
 epoch: 34, train_loss: 0.6245, test_loss: 1.6235, test_f1: 0.5594
 epoch: 35, train_loss: 0.6355, test_loss: 2.1329, test_f1: 0.5402
 epoch: 36, train_loss: 0.6050, test_loss: 1.8877, test_f1: 0.5889
 epoch: 37, train_loss: 0.5773, test_loss: 1.6897, test_f1: 0.5685
 epoch: 38, train_loss: 0.6073, test_loss: 1.9583, test_f1: 0.5284
 epoch: 39, train_loss: 0.6084, test_loss: 1.5478, test_f1: 0.5995
 epoch: 40, train_loss: 0.5698, test_loss: 1.8394, test_f1: 0.5079
 epoch: 41, train_loss: 0.5685, test_loss: 2.1212, test_f1: 0.5627
 epoch: 42, train_loss: 0.5676, test_loss: 2.5093, test_f1: 0.5316
 epoch: 43, train_loss: 0.5931, test_loss: 2.0850, test_f1: 0.5898
 epoch: 44, train_loss: 0.5542, test_loss: 2.0604, test_f1: 0.5633
 epoch: 45, train_loss: 0.5323, test_loss: 1.7179, test_f1: 0.5448
 epoch: 46, train_loss: 0.5785, test_loss: 1.8572, test_f1: 0.6149
 epoch: 47, train_loss: 0.5607, test_loss: 1.7101, test_f1: 0.5664
 epoch: 48, train_loss: 0.5303, test_loss: 1.8443, test_f1: 0.5291
 epoch: 49, train_loss: 0.5257, test_loss: 2.0152, test_f1: 0.5420
 epoch: 50, train_loss: 0.5220, test_loss: 2.0248, test_f1: 0.5513
 epoch: 51, train_loss: 0.4929, test_loss: 2.0547, test_f1: 0.5829
 epoch: 52, train_loss: 0.4375, test_loss: 2.0297, test_f1: 0.5821
 epoch: 53, train_loss: 0.4702, test_loss: 2.0113, test_f1: 0.5515
 epoch: 54, train_loss: 0.4109, test_loss: 2.2593, test_f1: 0.5589
 epoch: 55, train_loss: 0.4108, test_loss: 2.1293, test_f1: 0.5637
 epoch: 56, train_loss: 0.4139, test_loss: 2.1194, test_f1: 0.5743
 epoch: 57, train_loss: 0.4120, test_loss: 2.2049, test_f1: 0.5640
 epoch: 58, train_loss: 0.4372, test_loss: 2.1863, test_f1: 0.5773
 epoch: 59, train_loss: 0.3982, test_loss: 2.1928, test_f1: 0.5882
 epoch: 60, train_loss: 0.4057, test_loss: 2.5617, test_f1: 0.5186
 epoch: 61, train_loss: 0.3869, test_loss: 2.4570, test_f1: 0.5903
 epoch: 62, train_loss: 0.3770, test_loss: 2.3315, test_f1: 0.5527
 epoch: 63, train_loss: 0.3988, test_loss: 2.8677, test_f1: 0.5427
 epoch: 64, train_loss: 0.4222, test_loss: 2.9433, test_f1: 0.5624
 epoch: 65, train_loss: 0.4325, test_loss: 2.7366, test_f1: 0.5742
 epoch: 66, train_loss: 0.3787, test_loss: 2.6734, test_f1: 0.5801
 epoch: 67, train_loss: 0.3752, test_loss: 3.4280, test_f1: 0.5596
 epoch: 68, train_loss: 0.3816, test_loss: 2.6119, test_f1: 0.5703
 epoch: 69, train_loss: 0.3660, test_loss: 2.8423, test_f1: 0.5660
 epoch: 70, train_loss: 0.3698, test_loss: 2.6797, test_f1: 0.5736
 epoch: 71, train_loss: 0.3664, test_loss: 2.2208, test_f1: 0.5733
 epoch: 72, train_loss: 0.3610, test_loss: 2.8890, test_f1: 0.5802
 epoch: 73, train_loss: 0.3960, test_loss: 2.4498, test_f1: 0.5931
 epoch: 74, train_loss: 0.3785, test_loss: 2.5888, test_f1: 0.5669
 epoch: 75, train_loss: 0.3601, test_loss: 2.7081, test_f1: 0.5617
 epoch: 76, train_loss: 0.3476, test_loss: 2.5712, test_f1: 0.5671
 epoch: 77, train_loss: 0.3459, test_loss: 2.6343, test_f1: 0.5632
 epoch: 78, train_loss: 0.3554, test_loss: 3.3506, test_f1: 0.5007
 epoch: 79, train_loss: 0.3469, test_loss: 2.7921, test_f1: 0.5592
 epoch: 80, train_loss: 0.3663, test_loss: 2.7075, test_f1: 0.5589
 epoch: 81, train_loss: 0.3525, test_loss: 3.6522, test_f1: 0.5532
 epoch: 82, train_loss: 0.3464, test_loss: 3.0467, test_f1: 0.5375
 epoch: 83, train_loss: 0.3347, test_loss: 3.0492, test_f1: 0.5608
 epoch: 84, train_loss: 0.3565, test_loss: 2.9963, test_f1: 0.5517
 epoch: 85, train_loss: 0.3467, test_loss: 2.8489, test_f1: 0.5659
 epoch: 86, train_loss: 0.3283, test_loss: 2.9011, test_f1: 0.5949
 epoch: 87, train_loss: 0.3488, test_loss: 3.1634, test_f1: 0.5263
 epoch: 88, train_loss: 0.3297, test_loss: 3.5985, test_f1: 0.5842
 epoch: 89, train_loss: 0.3061, test_loss: 3.6279, test_f1: 0.5795
 epoch: 90, train_loss: 0.3174, test_loss: 3.7289, test_f1: 0.5492
 epoch: 91, train_loss: 0.3481, test_loss: 3.1154, test_f1: 0.5476
 epoch: 92, train_loss: 0.3305, test_loss: 2.7945, test_f1: 0.5902
 epoch: 93, train_loss: 0.3359, test_loss: 3.2891, test_f1: 0.5398
 epoch: 94, train_loss: 0.3207, test_loss: 2.9892, test_f1: 0.5369
 epoch: 95, train_loss: 0.3335, test_loss: 3.4630, test_f1: 0.5413
 epoch: 96, train_loss: 0.3154, test_loss: 3.6811, test_f1: 0.5554
 epoch: 97, train_loss: 0.3125, test_loss: 3.3646, test_f1: 0.5724
 epoch: 98, train_loss: 0.2981, test_loss: 3.5033, test_f1: 0.5498
 epoch: 99, train_loss: 0.3167, test_loss: 3.7474, test_f1: 0.5931
##################ITERATION #7 ****************************************
 epoch: 0, train_loss: 1.3538, test_loss: 1.3604, test_f1: 0.2494
 epoch: 1, train_loss: 1.2189, test_loss: 1.3098, test_f1: 0.3145
 epoch: 2, train_loss: 1.1432, test_loss: 1.2153, test_f1: 0.5006
 epoch: 3, train_loss: 1.0866, test_loss: 1.1951, test_f1: 0.4672
 epoch: 4, train_loss: 1.0643, test_loss: 1.1571, test_f1: 0.4951
 epoch: 5, train_loss: 0.9986, test_loss: 1.2017, test_f1: 0.5383
 epoch: 6, train_loss: 0.9875, test_loss: 1.2330, test_f1: 0.5293
 epoch: 7, train_loss: 0.9482, test_loss: 1.2977, test_f1: 0.5136
 epoch: 8, train_loss: 0.9174, test_loss: 1.2591, test_f1: 0.5706
 epoch: 9, train_loss: 0.9212, test_loss: 1.2016, test_f1: 0.5744
 epoch: 10, train_loss: 0.9034, test_loss: 1.4192, test_f1: 0.5278
 epoch: 11, train_loss: 0.8880, test_loss: 1.1748, test_f1: 0.5824
 epoch: 12, train_loss: 0.8689, test_loss: 1.4544, test_f1: 0.5152
 epoch: 13, train_loss: 0.8610, test_loss: 1.2807, test_f1: 0.5826
 epoch: 14, train_loss: 0.8303, test_loss: 1.2811, test_f1: 0.5945
 epoch: 15, train_loss: 0.8229, test_loss: 1.2394, test_f1: 0.5751
 epoch: 16, train_loss: 0.8005, test_loss: 1.4655, test_f1: 0.5829
 epoch: 17, train_loss: 0.7928, test_loss: 1.3762, test_f1: 0.5942
 epoch: 18, train_loss: 0.7812, test_loss: 1.3917, test_f1: 0.5713
 epoch: 19, train_loss: 0.7906, test_loss: 1.4956, test_f1: 0.5665
 epoch: 20, train_loss: 0.7901, test_loss: 1.3726, test_f1: 0.5794
 epoch: 21, train_loss: 0.7577, test_loss: 1.2674, test_f1: 0.6376
 epoch: 22, train_loss: 0.7780, test_loss: 1.3939, test_f1: 0.5557
 epoch: 23, train_loss: 0.7463, test_loss: 1.3071, test_f1: 0.5751
 epoch: 24, train_loss: 0.7337, test_loss: 1.3647, test_f1: 0.5798
 epoch: 25, train_loss: 0.7131, test_loss: 1.3526, test_f1: 0.5984
 epoch: 26, train_loss: 0.7220, test_loss: 1.5821, test_f1: 0.5450
 epoch: 27, train_loss: 0.7045, test_loss: 1.4066, test_f1: 0.5729
 epoch: 28, train_loss: 0.6922, test_loss: 1.4622, test_f1: 0.5982
 epoch: 29, train_loss: 0.6814, test_loss: 1.4617, test_f1: 0.5730
 epoch: 30, train_loss: 0.6696, test_loss: 1.3325, test_f1: 0.6265
 epoch: 31, train_loss: 0.6748, test_loss: 1.4770, test_f1: 0.5941
 epoch: 32, train_loss: 0.6625, test_loss: 1.7667, test_f1: 0.5208
 epoch: 33, train_loss: 0.6378, test_loss: 1.6396, test_f1: 0.5720
 epoch: 34, train_loss: 0.6238, test_loss: 1.6783, test_f1: 0.6044
 epoch: 35, train_loss: 0.6403, test_loss: 1.9825, test_f1: 0.5669
 epoch: 36, train_loss: 0.6308, test_loss: 1.4537, test_f1: 0.6151
 epoch: 37, train_loss: 0.6193, test_loss: 1.7434, test_f1: 0.5845
 epoch: 38, train_loss: 0.6027, test_loss: 1.8604, test_f1: 0.5354
 epoch: 39, train_loss: 0.6049, test_loss: 1.7062, test_f1: 0.5650
 epoch: 40, train_loss: 0.5946, test_loss: 2.0518, test_f1: 0.5992
 epoch: 41, train_loss: 0.6031, test_loss: 1.9487, test_f1: 0.5676
 epoch: 42, train_loss: 0.6007, test_loss: 1.8969, test_f1: 0.5686
 epoch: 43, train_loss: 0.6262, test_loss: 1.8291, test_f1: 0.5393
 epoch: 44, train_loss: 0.5797, test_loss: 1.9995, test_f1: 0.4931
 epoch: 45, train_loss: 0.5765, test_loss: 1.8238, test_f1: 0.5444
 epoch: 46, train_loss: 0.5667, test_loss: 2.0491, test_f1: 0.5168
 epoch: 47, train_loss: 0.5873, test_loss: 1.9660, test_f1: 0.5115
 epoch: 48, train_loss: 0.5701, test_loss: 1.8732, test_f1: 0.5168
 epoch: 49, train_loss: 0.5309, test_loss: 2.1185, test_f1: 0.5735
 epoch: 50, train_loss: 0.5418, test_loss: 1.7341, test_f1: 0.5966
 epoch: 51, train_loss: 0.4974, test_loss: 1.9664, test_f1: 0.5741
 epoch: 52, train_loss: 0.4994, test_loss: 1.9909, test_f1: 0.5233
 epoch: 53, train_loss: 0.4916, test_loss: 1.9337, test_f1: 0.5573
 epoch: 54, train_loss: 0.4850, test_loss: 2.1046, test_f1: 0.5362
 epoch: 55, train_loss: 0.4497, test_loss: 1.8859, test_f1: 0.5788
 epoch: 56, train_loss: 0.4820, test_loss: 2.1052, test_f1: 0.5460
 epoch: 57, train_loss: 0.4365, test_loss: 2.1865, test_f1: 0.5613
 epoch: 58, train_loss: 0.4488, test_loss: 2.2710, test_f1: 0.5264
 epoch: 59, train_loss: 0.4251, test_loss: 2.0778, test_f1: 0.5508
 epoch: 60, train_loss: 0.4213, test_loss: 2.0664, test_f1: 0.5659
 epoch: 61, train_loss: 0.4709, test_loss: 2.4944, test_f1: 0.5497
 epoch: 62, train_loss: 0.4428, test_loss: 2.2859, test_f1: 0.5335
 epoch: 63, train_loss: 0.4337, test_loss: 2.4349, test_f1: 0.5598
 epoch: 64, train_loss: 0.4757, test_loss: 2.5578, test_f1: 0.5252
 epoch: 65, train_loss: 0.4524, test_loss: 2.5289, test_f1: 0.5258
 epoch: 66, train_loss: 0.4318, test_loss: 2.0953, test_f1: 0.5704
 epoch: 67, train_loss: 0.4212, test_loss: 2.2894, test_f1: 0.5488
 epoch: 68, train_loss: 0.4140, test_loss: 2.3488, test_f1: 0.5985
 epoch: 69, train_loss: 0.4448, test_loss: 2.8195, test_f1: 0.5337
 epoch: 70, train_loss: 0.4385, test_loss: 2.2447, test_f1: 0.5832
 epoch: 71, train_loss: 0.4097, test_loss: 2.3945, test_f1: 0.5453
 epoch: 72, train_loss: 0.4184, test_loss: 2.3709, test_f1: 0.5855
 epoch: 73, train_loss: 0.3849, test_loss: 2.5549, test_f1: 0.5280
 epoch: 74, train_loss: 0.3966, test_loss: 2.9560, test_f1: 0.5657
 epoch: 75, train_loss: 0.4012, test_loss: 2.8609, test_f1: 0.5461
 epoch: 76, train_loss: 0.3606, test_loss: 2.8344, test_f1: 0.5468
 epoch: 77, train_loss: 0.3867, test_loss: 3.0898, test_f1: 0.5482
 epoch: 78, train_loss: 0.3800, test_loss: 2.9237, test_f1: 0.5347
 epoch: 79, train_loss: 0.4082, test_loss: 2.8553, test_f1: 0.5790
 epoch: 80, train_loss: 0.3653, test_loss: 2.8800, test_f1: 0.5559
 epoch: 81, train_loss: 0.3526, test_loss: 2.9801, test_f1: 0.5523
 epoch: 82, train_loss: 0.3553, test_loss: 3.1156, test_f1: 0.5213
 epoch: 83, train_loss: 0.3335, test_loss: 2.9395, test_f1: 0.5548
 epoch: 84, train_loss: 0.3505, test_loss: 3.3389, test_f1: 0.5203
 epoch: 85, train_loss: 0.3905, test_loss: 2.7184, test_f1: 0.5789
 epoch: 86, train_loss: 0.3796, test_loss: 3.1462, test_f1: 0.5671
 epoch: 87, train_loss: 0.3874, test_loss: 2.9463, test_f1: 0.5402
 epoch: 88, train_loss: 0.3874, test_loss: 3.1580, test_f1: 0.5126
 epoch: 89, train_loss: 0.3347, test_loss: 3.3256, test_f1: 0.5518
 epoch: 90, train_loss: 0.3559, test_loss: 3.1952, test_f1: 0.5569
 epoch: 91, train_loss: 0.3690, test_loss: 3.0342, test_f1: 0.6032
 epoch: 92, train_loss: 0.3445, test_loss: 3.8823, test_f1: 0.5592
 epoch: 93, train_loss: 0.3532, test_loss: 3.7290, test_f1: 0.5041
 epoch: 94, train_loss: 0.3491, test_loss: 3.7556, test_f1: 0.5690
 epoch: 95, train_loss: 0.3488, test_loss: 3.5519, test_f1: 0.5471
 epoch: 96, train_loss: 0.3437, test_loss: 3.2567, test_f1: 0.5699
 epoch: 97, train_loss: 0.3276, test_loss: 2.9856, test_f1: 0.5743
 epoch: 98, train_loss: 0.2916, test_loss: 3.1294, test_f1: 0.6007
 epoch: 99, train_loss: 0.3033, test_loss: 3.2968, test_f1: 0.5655
##################ITERATION #8 ****************************************
 epoch: 0, train_loss: 1.3272, test_loss: 1.3777, test_f1: 0.2912
 epoch: 1, train_loss: 1.1677, test_loss: 1.2061, test_f1: 0.4562
 epoch: 2, train_loss: 1.0918, test_loss: 1.2545, test_f1: 0.4968
 epoch: 3, train_loss: 1.0555, test_loss: 1.1401, test_f1: 0.5598
 epoch: 4, train_loss: 1.0324, test_loss: 1.1678, test_f1: 0.5132
 epoch: 5, train_loss: 1.0088, test_loss: 1.0987, test_f1: 0.5450
 epoch: 6, train_loss: 0.9956, test_loss: 1.2122, test_f1: 0.5013
 epoch: 7, train_loss: 0.9513, test_loss: 1.0990, test_f1: 0.5925
 epoch: 8, train_loss: 0.9446, test_loss: 1.3062, test_f1: 0.4789
 epoch: 9, train_loss: 0.9251, test_loss: 1.1410, test_f1: 0.5709
 epoch: 10, train_loss: 0.9025, test_loss: 1.1070, test_f1: 0.5340
 epoch: 11, train_loss: 0.8929, test_loss: 1.2700, test_f1: 0.4742
 epoch: 12, train_loss: 0.9007, test_loss: 1.1112, test_f1: 0.5523
 epoch: 13, train_loss: 0.8524, test_loss: 1.1591, test_f1: 0.5488
 epoch: 14, train_loss: 0.8622, test_loss: 1.0657, test_f1: 0.5814
 epoch: 15, train_loss: 0.8254, test_loss: 1.1767, test_f1: 0.5333
 epoch: 16, train_loss: 0.8364, test_loss: 1.2337, test_f1: 0.5594
 epoch: 17, train_loss: 0.8173, test_loss: 1.0401, test_f1: 0.5953
 epoch: 18, train_loss: 0.8102, test_loss: 1.1365, test_f1: 0.5552
 epoch: 19, train_loss: 0.8008, test_loss: 1.1690, test_f1: 0.5230
 epoch: 20, train_loss: 0.7970, test_loss: 1.1609, test_f1: 0.5430
 epoch: 21, train_loss: 0.7920, test_loss: 1.1721, test_f1: 0.5712
 epoch: 22, train_loss: 0.7661, test_loss: 1.1148, test_f1: 0.5815
 epoch: 23, train_loss: 0.7628, test_loss: 1.2433, test_f1: 0.5400
 epoch: 24, train_loss: 0.7573, test_loss: 1.1610, test_f1: 0.5704
 epoch: 25, train_loss: 0.7409, test_loss: 1.3881, test_f1: 0.5247
 epoch: 26, train_loss: 0.7463, test_loss: 1.2457, test_f1: 0.5963
 epoch: 27, train_loss: 0.7264, test_loss: 1.3927, test_f1: 0.5760
 epoch: 28, train_loss: 0.7369, test_loss: 1.2829, test_f1: 0.5731
 epoch: 29, train_loss: 0.7251, test_loss: 1.3339, test_f1: 0.5628
 epoch: 30, train_loss: 0.7120, test_loss: 1.1780, test_f1: 0.5959
 epoch: 31, train_loss: 0.6913, test_loss: 1.4497, test_f1: 0.5386
 epoch: 32, train_loss: 0.7240, test_loss: 1.2728, test_f1: 0.5546
 epoch: 33, train_loss: 0.7027, test_loss: 1.4193, test_f1: 0.5992
 epoch: 34, train_loss: 0.7101, test_loss: 1.3202, test_f1: 0.5965
 epoch: 35, train_loss: 0.6908, test_loss: 1.3061, test_f1: 0.5572
 epoch: 36, train_loss: 0.6765, test_loss: 1.3461, test_f1: 0.5653
 epoch: 37, train_loss: 0.6679, test_loss: 1.3790, test_f1: 0.6101
 epoch: 38, train_loss: 0.6699, test_loss: 1.3445, test_f1: 0.5517
 epoch: 39, train_loss: 0.6575, test_loss: 1.4478, test_f1: 0.5772
 epoch: 40, train_loss: 0.6696, test_loss: 1.4912, test_f1: 0.5944
 epoch: 41, train_loss: 0.6602, test_loss: 1.3165, test_f1: 0.6254
 epoch: 42, train_loss: 0.6285, test_loss: 1.5394, test_f1: 0.5584
 epoch: 43, train_loss: 0.6235, test_loss: 1.5368, test_f1: 0.5854
 epoch: 44, train_loss: 0.6285, test_loss: 1.4270, test_f1: 0.5736
 epoch: 45, train_loss: 0.6155, test_loss: 1.6053, test_f1: 0.5306
 epoch: 46, train_loss: 0.6028, test_loss: 1.5252, test_f1: 0.5715
 epoch: 47, train_loss: 0.6172, test_loss: 1.6058, test_f1: 0.5986
 epoch: 48, train_loss: 0.5695, test_loss: 1.6064, test_f1: 0.5476
 epoch: 49, train_loss: 0.6118, test_loss: 1.3007, test_f1: 0.5944
 epoch: 50, train_loss: 0.6090, test_loss: 1.5520, test_f1: 0.5894
 epoch: 51, train_loss: 0.5814, test_loss: 1.4253, test_f1: 0.6048
 epoch: 52, train_loss: 0.5392, test_loss: 1.5846, test_f1: 0.6069
 epoch: 53, train_loss: 0.5085, test_loss: 1.5868, test_f1: 0.5932
 epoch: 54, train_loss: 0.5150, test_loss: 1.6864, test_f1: 0.5607
 epoch: 55, train_loss: 0.4977, test_loss: 1.6262, test_f1: 0.5708
 epoch: 56, train_loss: 0.4947, test_loss: 1.6543, test_f1: 0.5698
 epoch: 57, train_loss: 0.5056, test_loss: 1.5698, test_f1: 0.5779
 epoch: 58, train_loss: 0.4898, test_loss: 1.6045, test_f1: 0.6217
 epoch: 59, train_loss: 0.4956, test_loss: 1.6464, test_f1: 0.6122
 epoch: 60, train_loss: 0.4702, test_loss: 1.7981, test_f1: 0.5511
 epoch: 61, train_loss: 0.4788, test_loss: 1.6153, test_f1: 0.6125
 epoch: 62, train_loss: 0.4703, test_loss: 1.5565, test_f1: 0.6067
 epoch: 63, train_loss: 0.4754, test_loss: 1.6867, test_f1: 0.6029
 epoch: 64, train_loss: 0.4599, test_loss: 1.7266, test_f1: 0.5886
 epoch: 65, train_loss: 0.4902, test_loss: 1.7487, test_f1: 0.5941
 epoch: 66, train_loss: 0.4578, test_loss: 1.7634, test_f1: 0.5877
 epoch: 67, train_loss: 0.4596, test_loss: 1.7172, test_f1: 0.5810
 epoch: 68, train_loss: 0.4418, test_loss: 1.9122, test_f1: 0.6210
 epoch: 69, train_loss: 0.4369, test_loss: 2.0221, test_f1: 0.5900
 epoch: 70, train_loss: 0.4468, test_loss: 2.0684, test_f1: 0.5740
 epoch: 71, train_loss: 0.4225, test_loss: 1.9608, test_f1: 0.5722
 epoch: 72, train_loss: 0.4510, test_loss: 2.2139, test_f1: 0.5918
 epoch: 73, train_loss: 0.4535, test_loss: 2.0887, test_f1: 0.5391
 epoch: 74, train_loss: 0.4370, test_loss: 1.9613, test_f1: 0.5896
 epoch: 75, train_loss: 0.4513, test_loss: 1.8490, test_f1: 0.5658
 epoch: 76, train_loss: 0.4340, test_loss: 1.9681, test_f1: 0.5861
 epoch: 77, train_loss: 0.4202, test_loss: 1.6972, test_f1: 0.6242
 epoch: 78, train_loss: 0.4031, test_loss: 1.8265, test_f1: 0.5918
 epoch: 79, train_loss: 0.4188, test_loss: 1.8188, test_f1: 0.5770
 epoch: 80, train_loss: 0.4192, test_loss: 1.9241, test_f1: 0.5750
 epoch: 81, train_loss: 0.4244, test_loss: 2.0748, test_f1: 0.5679
 epoch: 82, train_loss: 0.4057, test_loss: 2.1640, test_f1: 0.5860
 epoch: 83, train_loss: 0.3785, test_loss: 2.0378, test_f1: 0.5980
 epoch: 84, train_loss: 0.3831, test_loss: 2.2018, test_f1: 0.5739
 epoch: 85, train_loss: 0.3673, test_loss: 1.8079, test_f1: 0.6028
 epoch: 86, train_loss: 0.3812, test_loss: 2.0451, test_f1: 0.5488
 epoch: 87, train_loss: 0.4074, test_loss: 2.0190, test_f1: 0.5813
 epoch: 88, train_loss: 0.3778, test_loss: 2.0950, test_f1: 0.5774
 epoch: 89, train_loss: 0.3753, test_loss: 2.0541, test_f1: 0.5458
 epoch: 90, train_loss: 0.3565, test_loss: 2.1937, test_f1: 0.5932
 epoch: 91, train_loss: 0.3857, test_loss: 2.1857, test_f1: 0.5938
 epoch: 92, train_loss: 0.3778, test_loss: 2.5455, test_f1: 0.5744
 epoch: 93, train_loss: 0.3867, test_loss: 2.4941, test_f1: 0.5600
 epoch: 94, train_loss: 0.3753, test_loss: 2.3440, test_f1: 0.6039
 epoch: 95, train_loss: 0.3468, test_loss: 2.3608, test_f1: 0.5521
 epoch: 96, train_loss: 0.3601, test_loss: 2.4514, test_f1: 0.5835
 epoch: 97, train_loss: 0.3436, test_loss: 2.7725, test_f1: 0.5908
 epoch: 98, train_loss: 0.3497, test_loss: 2.6523, test_f1: 0.5664
 epoch: 99, train_loss: 0.3487, test_loss: 2.5368, test_f1: 0.5364
##################ITERATION #9 ****************************************
 epoch: 0, train_loss: 1.3028, test_loss: 1.2833, test_f1: 0.3964
 epoch: 1, train_loss: 1.1376, test_loss: 1.2434, test_f1: 0.4321
 epoch: 2, train_loss: 1.0652, test_loss: 1.1813, test_f1: 0.5389
 epoch: 3, train_loss: 1.0379, test_loss: 1.1606, test_f1: 0.5128
 epoch: 4, train_loss: 1.0176, test_loss: 1.1730, test_f1: 0.5826
 epoch: 5, train_loss: 0.9723, test_loss: 1.1163, test_f1: 0.5725
 epoch: 6, train_loss: 0.9400, test_loss: 1.1118, test_f1: 0.5783
 epoch: 7, train_loss: 0.9366, test_loss: 1.1234, test_f1: 0.6140
 epoch: 8, train_loss: 0.9093, test_loss: 1.0931, test_f1: 0.5662
 epoch: 9, train_loss: 0.8820, test_loss: 1.1422, test_f1: 0.5571
 epoch: 10, train_loss: 0.8559, test_loss: 1.1523, test_f1: 0.5355
 epoch: 11, train_loss: 0.8745, test_loss: 1.1292, test_f1: 0.5674
 epoch: 12, train_loss: 0.8389, test_loss: 1.1225, test_f1: 0.6205
 epoch: 13, train_loss: 0.7905, test_loss: 1.1500, test_f1: 0.5870
 epoch: 14, train_loss: 0.7884, test_loss: 1.1403, test_f1: 0.5491
 epoch: 15, train_loss: 0.7776, test_loss: 1.2218, test_f1: 0.5409
 epoch: 16, train_loss: 0.7728, test_loss: 1.3226, test_f1: 0.5212
 epoch: 17, train_loss: 0.7680, test_loss: 1.3218, test_f1: 0.5711
 epoch: 18, train_loss: 0.7316, test_loss: 1.2457, test_f1: 0.5695
 epoch: 19, train_loss: 0.6931, test_loss: 1.2357, test_f1: 0.5734
 epoch: 20, train_loss: 0.7115, test_loss: 1.2895, test_f1: 0.5650
 epoch: 21, train_loss: 0.7033, test_loss: 1.2388, test_f1: 0.5964
 epoch: 22, train_loss: 0.6991, test_loss: 1.3908, test_f1: 0.5294
 epoch: 23, train_loss: 0.6770, test_loss: 1.1335, test_f1: 0.6003
 epoch: 24, train_loss: 0.6676, test_loss: 1.1858, test_f1: 0.5847
 epoch: 25, train_loss: 0.6610, test_loss: 1.2950, test_f1: 0.5979
 epoch: 26, train_loss: 0.6521, test_loss: 1.2935, test_f1: 0.5785
 epoch: 27, train_loss: 0.6389, test_loss: 1.5647, test_f1: 0.5589
 epoch: 28, train_loss: 0.6313, test_loss: 1.2686, test_f1: 0.6005
 epoch: 29, train_loss: 0.6414, test_loss: 1.3491, test_f1: 0.5632
 epoch: 30, train_loss: 0.6464, test_loss: 1.2720, test_f1: 0.5757
 epoch: 31, train_loss: 0.6060, test_loss: 1.3214, test_f1: 0.5798
 epoch: 32, train_loss: 0.6056, test_loss: 1.3428, test_f1: 0.5801
 epoch: 33, train_loss: 0.5786, test_loss: 1.4017, test_f1: 0.5491
 epoch: 34, train_loss: 0.5858, test_loss: 1.4770, test_f1: 0.6130
 epoch: 35, train_loss: 0.5926, test_loss: 1.4393, test_f1: 0.5631
 epoch: 36, train_loss: 0.5682, test_loss: 1.4751, test_f1: 0.5728
 epoch: 37, train_loss: 0.5774, test_loss: 1.4846, test_f1: 0.5599
 epoch: 38, train_loss: 0.5979, test_loss: 1.5566, test_f1: 0.5695
 epoch: 39, train_loss: 0.5805, test_loss: 1.5619, test_f1: 0.5640
 epoch: 40, train_loss: 0.5404, test_loss: 1.5524, test_f1: 0.5854
 epoch: 41, train_loss: 0.5635, test_loss: 1.5016, test_f1: 0.5611
 epoch: 42, train_loss: 0.5391, test_loss: 1.5757, test_f1: 0.5550
 epoch: 43, train_loss: 0.5430, test_loss: 1.3594, test_f1: 0.6220
 epoch: 44, train_loss: 0.5258, test_loss: 1.7200, test_f1: 0.5969
 epoch: 45, train_loss: 0.5371, test_loss: 1.7465, test_f1: 0.5490
 epoch: 46, train_loss: 0.5224, test_loss: 1.6409, test_f1: 0.6195
 epoch: 47, train_loss: 0.5108, test_loss: 1.6515, test_f1: 0.5798
 epoch: 48, train_loss: 0.5111, test_loss: 1.6211, test_f1: 0.5857
 epoch: 49, train_loss: 0.4944, test_loss: 2.4808, test_f1: 0.5763
 epoch: 50, train_loss: 0.5074, test_loss: 1.6270, test_f1: 0.5831
 epoch: 51, train_loss: 0.4620, test_loss: 1.8319, test_f1: 0.6026
 epoch: 52, train_loss: 0.4024, test_loss: 2.1155, test_f1: 0.5866
 epoch: 53, train_loss: 0.4012, test_loss: 2.0886, test_f1: 0.5756
 epoch: 54, train_loss: 0.4124, test_loss: 2.3767, test_f1: 0.5925
 epoch: 55, train_loss: 0.3868, test_loss: 2.2918, test_f1: 0.6116
 epoch: 56, train_loss: 0.4017, test_loss: 2.1175, test_f1: 0.5899
 epoch: 57, train_loss: 0.4008, test_loss: 2.0497, test_f1: 0.5894
 epoch: 58, train_loss: 0.3762, test_loss: 2.2207, test_f1: 0.5851
 epoch: 59, train_loss: 0.3572, test_loss: 2.3075, test_f1: 0.5885
 epoch: 60, train_loss: 0.3622, test_loss: 2.4651, test_f1: 0.5756
 epoch: 61, train_loss: 0.3647, test_loss: 2.3677, test_f1: 0.6111
 epoch: 62, train_loss: 0.3646, test_loss: 2.6939, test_f1: 0.5887
 epoch: 63, train_loss: 0.3847, test_loss: 3.0221, test_f1: 0.5891
 epoch: 64, train_loss: 0.3701, test_loss: 2.6518, test_f1: 0.5818
 epoch: 65, train_loss: 0.3540, test_loss: 3.1137, test_f1: 0.5788
 epoch: 66, train_loss: 0.3416, test_loss: 3.2043, test_f1: 0.5641
 epoch: 67, train_loss: 0.3622, test_loss: 3.2091, test_f1: 0.5809
 epoch: 68, train_loss: 0.3285, test_loss: 2.7636, test_f1: 0.5936
 epoch: 69, train_loss: 0.3258, test_loss: 2.8890, test_f1: 0.5767
 epoch: 70, train_loss: 0.3364, test_loss: 3.9365, test_f1: 0.5819
 epoch: 71, train_loss: 0.3319, test_loss: 4.1442, test_f1: 0.5821
 epoch: 72, train_loss: 0.3188, test_loss: 2.9944, test_f1: 0.5866
 epoch: 73, train_loss: 0.3146, test_loss: 2.7050, test_f1: 0.5553
 epoch: 74, train_loss: 0.2918, test_loss: 3.1728, test_f1: 0.5735
 epoch: 75, train_loss: 0.3076, test_loss: 3.2623, test_f1: 0.5679
 epoch: 76, train_loss: 0.2952, test_loss: 3.0367, test_f1: 0.5885
 epoch: 77, train_loss: 0.3018, test_loss: 3.5054, test_f1: 0.5588
 epoch: 78, train_loss: 0.3124, test_loss: 2.9461, test_f1: 0.6086
 epoch: 79, train_loss: 0.3360, test_loss: 3.1771, test_f1: 0.5888
 epoch: 80, train_loss: 0.2852, test_loss: 2.8589, test_f1: 0.5921
 epoch: 81, train_loss: 0.3410, test_loss: 3.3928, test_f1: 0.6248
 epoch: 82, train_loss: 0.3215, test_loss: 3.4879, test_f1: 0.6085
 epoch: 83, train_loss: 0.3242, test_loss: 3.2048, test_f1: 0.6124
 epoch: 84, train_loss: 0.2832, test_loss: 3.0459, test_f1: 0.5949
 epoch: 85, train_loss: 0.3180, test_loss: 3.3182, test_f1: 0.5977
 epoch: 86, train_loss: 0.2793, test_loss: 3.6569, test_f1: 0.5949
 epoch: 87, train_loss: 0.2753, test_loss: 3.1277, test_f1: 0.6060
 epoch: 88, train_loss: 0.3027, test_loss: 3.7925, test_f1: 0.5851
 epoch: 89, train_loss: 0.2770, test_loss: 4.5107, test_f1: 0.6132
 epoch: 90, train_loss: 0.2863, test_loss: 4.0106, test_f1: 0.5736
 epoch: 91, train_loss: 0.2841, test_loss: 3.4892, test_f1: 0.5920
 epoch: 92, train_loss: 0.2693, test_loss: 3.9387, test_f1: 0.5954
 epoch: 93, train_loss: 0.3036, test_loss: 3.8093, test_f1: 0.5824
 epoch: 94, train_loss: 0.2743, test_loss: 4.2691, test_f1: 0.5866
 epoch: 95, train_loss: 0.2623, test_loss: 3.3549, test_f1: 0.6006
 epoch: 96, train_loss: 0.2542, test_loss: 3.6151, test_f1: 0.5969
 epoch: 97, train_loss: 0.2713, test_loss: 3.0000, test_f1: 0.5825
 epoch: 98, train_loss: 0.2801, test_loss: 3.1924, test_f1: 0.5758
 epoch: 99, train_loss: 0.2433, test_loss: 3.9004, test_f1: 0.6385

Training completed in 545.07 seconds
Best F1: 0.6561 at epoch 88
Mean F1 across iterations: 0.6230  0.0178
========================FINAL RESULTS================================
FEGIN weighted F1: 0.6561  0.0178
python main.py --data ltspice_demos --representation component_component --model FEGIN --layers 6 --hiddens 64 --batch_size 64 --lr 0.001 --emb_size 512 --epochs 100 --save_appendix component_component_L6_H64_BS64_LR0.001_E512 --no_val
-----



STDERR:
  File "main.py", line 370, in <module>
    main()
  File "main.py", line 254, in main
    dataset = dataset_class(
  File "/home/philip/projects/ltspice_examples_code_repo/Circuit-Completion-Using-GNNs/component_classification_with_link_prediction_head/evaluation/FEGIN/kernel/circuit_datasets.py", line 15, in __init__
    self.data, self.slices = torch.load(self.processed_paths[0])
  File "/home/philip/.local/lib/python3.8/site-packages/torch/serialization.py", line 1040, in load
    warnings.warn(
  File "/usr/lib/python3.8/warnings.py", line 109, in _showwarnmsg
    sw(msg.message, msg.category, msg.filename, msg.lineno,
  File "main.py", line 47, in warn_with_traceback
    traceback.print_stack(file=log)
/home/philip/projects/ltspice_examples_code_repo/Circuit-Completion-Using-GNNs/component_classification_with_link_prediction_head/evaluation/FEGIN/kernel/circuit_datasets.py:15: FutureWarning: You are using `torch.load` with `weights_only=False` (the current default value), which uses the default pickle module implicitly. It is possible to construct malicious pickle data which will execute arbitrary code during unpickling (See https://github.com/pytorch/pytorch/blob/main/SECURITY.md#untrusted-models for more details). In a future release, the default value for `weights_only` will be flipped to `True`. This limits the functions that could be executed during unpickling. Arbitrary objects will no longer be allowed to be loaded via this mode unless they are explicitly allowlisted by the user via `torch.serialization.add_safe_globals`. We recommend you start setting `weights_only=True` for any use case where you don't have full control of the loaded file. Please open an issue on GitHub for any issues related to this experimental feature.
  self.data, self.slices = torch.load(self.processed_paths[0])
