STDOUT:
Results will be saved in /home/philip/projects/ltspice_examples_code_repo/Circuit-Completion-Using-GNNs/component_classification_with_link_prediction_head/evaluation/FEGIN/results/model_FEGIN_dataset_ltspice_demos
Command line input: python main.py --data ltspice_demos --representation component_pin_net --model FEGIN --layers 2 --hiddens 128 --batch_size 32 --lr 0.01 --emb_size 128 --epochs 100 --save_appendix component_pin_net_L2_H128_BS32_LR0.01_E128 --no_val
 is saved.
-----
ltspice_demos - FEGIN
Using 2 layers, 128 hidden units, h = 2
Loading component_pin_net representation dataset
ENTERED
Training FEGIN on component_pin_net representation
Train: 1565, Test: 383
##################ITERATION #0 ****************************************
 epoch: 0, train_loss: 1.1233, test_loss: 1.3649, test_f1: 0.3942
 epoch: 1, train_loss: 0.9957, test_loss: 1.1151, test_f1: 0.4193
 epoch: 2, train_loss: 0.9463, test_loss: 1.0542, test_f1: 0.5259
 epoch: 3, train_loss: 0.9226, test_loss: 0.9698, test_f1: 0.5826
 epoch: 4, train_loss: 0.9100, test_loss: 1.0441, test_f1: 0.4628
 epoch: 5, train_loss: 0.9011, test_loss: 0.9640, test_f1: 0.5741
 epoch: 6, train_loss: 0.9013, test_loss: 0.9939, test_f1: 0.5843
 epoch: 7, train_loss: 0.8584, test_loss: 1.0198, test_f1: 0.5514
 epoch: 8, train_loss: 0.8490, test_loss: 1.0082, test_f1: 0.5724
 epoch: 9, train_loss: 0.8703, test_loss: 1.1138, test_f1: 0.4538
 epoch: 10, train_loss: 0.8449, test_loss: 1.0303, test_f1: 0.5758
 epoch: 11, train_loss: 0.8093, test_loss: 1.7513, test_f1: 0.3860
 epoch: 12, train_loss: 0.7933, test_loss: 1.0106, test_f1: 0.5789
 epoch: 13, train_loss: 0.8199, test_loss: 1.0143, test_f1: 0.4793
 epoch: 14, train_loss: 0.7949, test_loss: 1.2133, test_f1: 0.5533
 epoch: 15, train_loss: 0.8056, test_loss: 1.1300, test_f1: 0.4569
 epoch: 16, train_loss: 0.8110, test_loss: 1.3515, test_f1: 0.5183
 epoch: 17, train_loss: 0.7629, test_loss: 1.3668, test_f1: 0.4112
 epoch: 18, train_loss: 0.7689, test_loss: 0.9854, test_f1: 0.5837
 epoch: 19, train_loss: 0.7579, test_loss: 0.9655, test_f1: 0.6182
 epoch: 20, train_loss: 0.7467, test_loss: 1.1592, test_f1: 0.4802
 epoch: 21, train_loss: 0.7358, test_loss: 1.0102, test_f1: 0.6289
 epoch: 22, train_loss: 0.7093, test_loss: 1.3783, test_f1: 0.4489
 epoch: 23, train_loss: 0.7042, test_loss: 1.0676, test_f1: 0.6479
 epoch: 24, train_loss: 0.6971, test_loss: 1.1613, test_f1: 0.5652
 epoch: 25, train_loss: 0.6725, test_loss: 1.3170, test_f1: 0.5363
 epoch: 26, train_loss: 0.6871, test_loss: 1.4043, test_f1: 0.6078
 epoch: 27, train_loss: 0.6537, test_loss: 1.1974, test_f1: 0.5752
 epoch: 28, train_loss: 0.7038, test_loss: 1.0394, test_f1: 0.5920
 epoch: 29, train_loss: 0.6606, test_loss: 1.1397, test_f1: 0.6442
 epoch: 30, train_loss: 0.6404, test_loss: 1.2106, test_f1: 0.5593
 epoch: 31, train_loss: 0.6615, test_loss: 1.0203, test_f1: 0.5768
 epoch: 32, train_loss: 0.6427, test_loss: 1.1692, test_f1: 0.5775
 epoch: 33, train_loss: 0.6149, test_loss: 1.2857, test_f1: 0.5798
 epoch: 34, train_loss: 0.6254, test_loss: 1.1066, test_f1: 0.5887
 epoch: 35, train_loss: 0.6439, test_loss: 1.4067, test_f1: 0.5125
 epoch: 36, train_loss: 0.6282, test_loss: 1.1146, test_f1: 0.5946
 epoch: 37, train_loss: 0.6060, test_loss: 1.1844, test_f1: 0.6448
 epoch: 38, train_loss: 0.6227, test_loss: 1.1116, test_f1: 0.5878
 epoch: 39, train_loss: 0.5913, test_loss: 1.2555, test_f1: 0.6327
 epoch: 40, train_loss: 0.5900, test_loss: 1.3605, test_f1: 0.5754
 epoch: 41, train_loss: 0.6094, test_loss: 1.2491, test_f1: 0.5286
 epoch: 42, train_loss: 0.6011, test_loss: 1.1444, test_f1: 0.5802
 epoch: 43, train_loss: 0.5675, test_loss: 1.3342, test_f1: 0.5996
 epoch: 44, train_loss: 0.5644, test_loss: 1.2604, test_f1: 0.5831
 epoch: 45, train_loss: 0.5735, test_loss: 1.2068, test_f1: 0.5650
 epoch: 46, train_loss: 0.5682, test_loss: 2.4970, test_f1: 0.4693
 epoch: 47, train_loss: 0.5742, test_loss: 1.2355, test_f1: 0.6068
 epoch: 48, train_loss: 0.5618, test_loss: 1.3755, test_f1: 0.5873
 epoch: 49, train_loss: 0.5537, test_loss: 1.2691, test_f1: 0.6000
 epoch: 50, train_loss: 0.5355, test_loss: 1.5560, test_f1: 0.5920
 epoch: 51, train_loss: 0.4963, test_loss: 1.7045, test_f1: 0.5680
 epoch: 52, train_loss: 0.4872, test_loss: 1.4048, test_f1: 0.6047
 epoch: 53, train_loss: 0.4755, test_loss: 1.3831, test_f1: 0.6183
 epoch: 54, train_loss: 0.4552, test_loss: 1.3494, test_f1: 0.6639
 epoch: 55, train_loss: 0.4398, test_loss: 1.5841, test_f1: 0.6141
 epoch: 56, train_loss: 0.4205, test_loss: 1.6849, test_f1: 0.6214
 epoch: 57, train_loss: 0.4352, test_loss: 1.5209, test_f1: 0.6287
 epoch: 58, train_loss: 0.4384, test_loss: 1.4251, test_f1: 0.6243
 epoch: 59, train_loss: 0.4122, test_loss: 1.4974, test_f1: 0.6326
 epoch: 60, train_loss: 0.4194, test_loss: 1.5237, test_f1: 0.6707
 epoch: 61, train_loss: 0.4024, test_loss: 1.6812, test_f1: 0.6461
 epoch: 62, train_loss: 0.4112, test_loss: 1.6445, test_f1: 0.6428
 epoch: 63, train_loss: 0.3984, test_loss: 1.5874, test_f1: 0.6127
 epoch: 64, train_loss: 0.3933, test_loss: 1.8096, test_f1: 0.6363
 epoch: 65, train_loss: 0.4307, test_loss: 1.3613, test_f1: 0.6400
 epoch: 66, train_loss: 0.3828, test_loss: 1.9092, test_f1: 0.5725
 epoch: 67, train_loss: 0.4318, test_loss: 1.5710, test_f1: 0.6156
 epoch: 68, train_loss: 0.3830, test_loss: 1.7580, test_f1: 0.6418
 epoch: 69, train_loss: 0.4006, test_loss: 1.5106, test_f1: 0.6659
 epoch: 70, train_loss: 0.3813, test_loss: 1.6641, test_f1: 0.6145
 epoch: 71, train_loss: 0.3735, test_loss: 1.4690, test_f1: 0.6446
 epoch: 72, train_loss: 0.3718, test_loss: 1.6227, test_f1: 0.6131
 epoch: 73, train_loss: 0.3514, test_loss: 1.7890, test_f1: 0.6542
 epoch: 74, train_loss: 0.3828, test_loss: 1.6383, test_f1: 0.6282
 epoch: 75, train_loss: 0.3705, test_loss: 1.7949, test_f1: 0.6298
 epoch: 76, train_loss: 0.3409, test_loss: 1.5560, test_f1: 0.6477
 epoch: 77, train_loss: 0.4095, test_loss: 1.4872, test_f1: 0.6591
 epoch: 78, train_loss: 0.3462, test_loss: 1.5278, test_f1: 0.6461
 epoch: 79, train_loss: 0.3644, test_loss: 1.4528, test_f1: 0.6364
 epoch: 80, train_loss: 0.3819, test_loss: 1.6447, test_f1: 0.6319
 epoch: 81, train_loss: 0.3626, test_loss: 1.6260, test_f1: 0.6652
 epoch: 82, train_loss: 0.3155, test_loss: 1.6418, test_f1: 0.6465
 epoch: 83, train_loss: 0.3736, test_loss: 1.5629, test_f1: 0.6324
 epoch: 84, train_loss: 0.3447, test_loss: 1.7531, test_f1: 0.6834
 epoch: 85, train_loss: 0.3642, test_loss: 1.6160, test_f1: 0.6621
 epoch: 86, train_loss: 0.3620, test_loss: 1.6337, test_f1: 0.6393
 epoch: 87, train_loss: 0.3172, test_loss: 1.7423, test_f1: 0.6593
 epoch: 88, train_loss: 0.3617, test_loss: 1.8458, test_f1: 0.6193
 epoch: 89, train_loss: 0.3502, test_loss: 1.5408, test_f1: 0.6388
 epoch: 90, train_loss: 0.3380, test_loss: 1.7151, test_f1: 0.6043
 epoch: 91, train_loss: 0.3031, test_loss: 1.6753, test_f1: 0.6453
 epoch: 92, train_loss: 0.3243, test_loss: 1.4869, test_f1: 0.6736
 epoch: 93, train_loss: 0.3273, test_loss: 2.1389, test_f1: 0.6122
 epoch: 94, train_loss: 0.2909, test_loss: 1.7762, test_f1: 0.6422
 epoch: 95, train_loss: 0.3113, test_loss: 1.9024, test_f1: 0.6336
 epoch: 96, train_loss: 0.3161, test_loss: 1.7304, test_f1: 0.6324
 epoch: 97, train_loss: 0.2860, test_loss: 1.8758, test_f1: 0.6341
 epoch: 98, train_loss: 0.3249, test_loss: 1.7784, test_f1: 0.6069
 epoch: 99, train_loss: 0.3251, test_loss: 1.9284, test_f1: 0.5810
##################ITERATION #1 ****************************************
 epoch: 0, train_loss: 1.1637, test_loss: 1.1604, test_f1: 0.3290
 epoch: 1, train_loss: 1.0561, test_loss: 1.1172, test_f1: 0.3683
 epoch: 2, train_loss: 1.0236, test_loss: 1.1219, test_f1: 0.3811
 epoch: 3, train_loss: 0.9913, test_loss: 1.0949, test_f1: 0.3875
 epoch: 4, train_loss: 0.9771, test_loss: 1.0763, test_f1: 0.3994
 epoch: 5, train_loss: 0.9554, test_loss: 1.0681, test_f1: 0.4667
 epoch: 6, train_loss: 0.9392, test_loss: 1.0211, test_f1: 0.5369
 epoch: 7, train_loss: 0.8988, test_loss: 0.9522, test_f1: 0.5395
 epoch: 8, train_loss: 0.8828, test_loss: 1.0200, test_f1: 0.5327
 epoch: 9, train_loss: 0.8631, test_loss: 0.9917, test_f1: 0.5442
 epoch: 10, train_loss: 0.8648, test_loss: 0.9399, test_f1: 0.4979
 epoch: 11, train_loss: 0.8515, test_loss: 0.9336, test_f1: 0.5531
 epoch: 12, train_loss: 0.8609, test_loss: 1.0121, test_f1: 0.5214
 epoch: 13, train_loss: 0.8406, test_loss: 1.0354, test_f1: 0.5113
 epoch: 14, train_loss: 0.8338, test_loss: 1.2178, test_f1: 0.4092
 epoch: 15, train_loss: 0.8574, test_loss: 0.9358, test_f1: 0.5735
 epoch: 16, train_loss: 0.8037, test_loss: 1.1743, test_f1: 0.4954
 epoch: 17, train_loss: 0.8135, test_loss: 0.9540, test_f1: 0.5673
 epoch: 18, train_loss: 0.7991, test_loss: 0.9537, test_f1: 0.5501
 epoch: 19, train_loss: 0.7815, test_loss: 1.0142, test_f1: 0.5025
 epoch: 20, train_loss: 0.7722, test_loss: 0.9727, test_f1: 0.5649
 epoch: 21, train_loss: 0.7929, test_loss: 1.1709, test_f1: 0.4904
 epoch: 22, train_loss: 0.7662, test_loss: 1.1460, test_f1: 0.5286
 epoch: 23, train_loss: 0.7744, test_loss: 1.0683, test_f1: 0.5083
 epoch: 24, train_loss: 0.7618, test_loss: 1.1393, test_f1: 0.4955
 epoch: 25, train_loss: 0.7383, test_loss: 1.0947, test_f1: 0.4895
 epoch: 26, train_loss: 0.7252, test_loss: 1.7056, test_f1: 0.4532
 epoch: 27, train_loss: 0.7336, test_loss: 1.3761, test_f1: 0.5423
 epoch: 28, train_loss: 0.7329, test_loss: 1.1310, test_f1: 0.5793
 epoch: 29, train_loss: 0.7148, test_loss: 1.0595, test_f1: 0.6072
 epoch: 30, train_loss: 0.7068, test_loss: 1.2684, test_f1: 0.5407
 epoch: 31, train_loss: 0.6680, test_loss: 1.0948, test_f1: 0.5727
 epoch: 32, train_loss: 0.6735, test_loss: 1.4970, test_f1: 0.4428
 epoch: 33, train_loss: 0.6942, test_loss: 1.2521, test_f1: 0.5379
 epoch: 34, train_loss: 0.6882, test_loss: 1.5021, test_f1: 0.5742
 epoch: 35, train_loss: 0.6642, test_loss: 0.9781, test_f1: 0.6572
 epoch: 36, train_loss: 0.6508, test_loss: 1.6652, test_f1: 0.5342
 epoch: 37, train_loss: 0.6888, test_loss: 1.3484, test_f1: 0.5592
 epoch: 38, train_loss: 0.6570, test_loss: 1.2421, test_f1: 0.5585
 epoch: 39, train_loss: 0.6539, test_loss: 1.2733, test_f1: 0.5897
 epoch: 40, train_loss: 0.6500, test_loss: 1.6320, test_f1: 0.5714
 epoch: 41, train_loss: 0.6705, test_loss: 1.3524, test_f1: 0.5872
 epoch: 42, train_loss: 0.6340, test_loss: 1.3596, test_f1: 0.5677
 epoch: 43, train_loss: 0.6407, test_loss: 1.0157, test_f1: 0.6195
 epoch: 44, train_loss: 0.6353, test_loss: 1.1349, test_f1: 0.5960
 epoch: 45, train_loss: 0.6868, test_loss: 1.7553, test_f1: 0.5505
 epoch: 46, train_loss: 0.6515, test_loss: 1.2357, test_f1: 0.5938
 epoch: 47, train_loss: 0.6340, test_loss: 1.3233, test_f1: 0.6044
 epoch: 48, train_loss: 0.6869, test_loss: 1.0059, test_f1: 0.6606
 epoch: 49, train_loss: 0.5962, test_loss: 1.2818, test_f1: 0.6313
 epoch: 50, train_loss: 0.5932, test_loss: 1.1905, test_f1: 0.6125
 epoch: 51, train_loss: 0.5481, test_loss: 1.0631, test_f1: 0.6432
 epoch: 52, train_loss: 0.5399, test_loss: 0.9728, test_f1: 0.6369
 epoch: 53, train_loss: 0.5055, test_loss: 1.4578, test_f1: 0.6092
 epoch: 54, train_loss: 0.5375, test_loss: 1.5633, test_f1: 0.6295
 epoch: 55, train_loss: 0.5087, test_loss: 1.3522, test_f1: 0.6136
 epoch: 56, train_loss: 0.5210, test_loss: 1.4014, test_f1: 0.6365
 epoch: 57, train_loss: 0.4859, test_loss: 1.4515, test_f1: 0.6371
 epoch: 58, train_loss: 0.5022, test_loss: 1.3415, test_f1: 0.6003
 epoch: 59, train_loss: 0.4929, test_loss: 1.7111, test_f1: 0.5551
 epoch: 60, train_loss: 0.4598, test_loss: 1.3224, test_f1: 0.6218
 epoch: 61, train_loss: 0.4887, test_loss: 1.6014, test_f1: 0.6104
 epoch: 62, train_loss: 0.4847, test_loss: 1.2919, test_f1: 0.6251
 epoch: 63, train_loss: 0.4760, test_loss: 1.1546, test_f1: 0.6438
 epoch: 64, train_loss: 0.4608, test_loss: 1.5012, test_f1: 0.6234
 epoch: 65, train_loss: 0.4681, test_loss: 1.3855, test_f1: 0.6097
 epoch: 66, train_loss: 0.4835, test_loss: 1.3432, test_f1: 0.6159
 epoch: 67, train_loss: 0.4421, test_loss: 1.4427, test_f1: 0.6090
 epoch: 68, train_loss: 0.4478, test_loss: 1.5935, test_f1: 0.6424
 epoch: 69, train_loss: 0.4403, test_loss: 1.6635, test_f1: 0.6140
 epoch: 70, train_loss: 0.4332, test_loss: 1.5085, test_f1: 0.5930
 epoch: 71, train_loss: 0.4326, test_loss: 1.7869, test_f1: 0.6124
 epoch: 72, train_loss: 0.4418, test_loss: 1.8417, test_f1: 0.6418
 epoch: 73, train_loss: 0.4541, test_loss: 1.7037, test_f1: 0.6311
 epoch: 74, train_loss: 0.3938, test_loss: 1.8380, test_f1: 0.6000
 epoch: 75, train_loss: 0.4303, test_loss: 2.0098, test_f1: 0.5908
 epoch: 76, train_loss: 0.4100, test_loss: 1.7630, test_f1: 0.6378
 epoch: 77, train_loss: 0.4058, test_loss: 1.8601, test_f1: 0.6465
 epoch: 78, train_loss: 0.4211, test_loss: 2.2555, test_f1: 0.5942
 epoch: 79, train_loss: 0.4222, test_loss: 1.5795, test_f1: 0.6216
 epoch: 80, train_loss: 0.4178, test_loss: 2.0224, test_f1: 0.6400
 epoch: 81, train_loss: 0.4298, test_loss: 1.5391, test_f1: 0.5851
 epoch: 82, train_loss: 0.4056, test_loss: 1.7841, test_f1: 0.6234
 epoch: 83, train_loss: 0.3955, test_loss: 1.7095, test_f1: 0.5961
 epoch: 84, train_loss: 0.4018, test_loss: 1.7576, test_f1: 0.5930
 epoch: 85, train_loss: 0.4027, test_loss: 1.7863, test_f1: 0.5905
 epoch: 86, train_loss: 0.3737, test_loss: 1.8126, test_f1: 0.6191
 epoch: 87, train_loss: 0.3730, test_loss: 1.6516, test_f1: 0.5980
 epoch: 88, train_loss: 0.3686, test_loss: 1.8230, test_f1: 0.5706
 epoch: 89, train_loss: 0.3922, test_loss: 1.6164, test_f1: 0.6022
 epoch: 90, train_loss: 0.3495, test_loss: 2.1019, test_f1: 0.5945
 epoch: 91, train_loss: 0.3665, test_loss: 1.7762, test_f1: 0.6020
 epoch: 92, train_loss: 0.3559, test_loss: 1.6614, test_f1: 0.5939
 epoch: 93, train_loss: 0.3842, test_loss: 1.7309, test_f1: 0.5676
 epoch: 94, train_loss: 0.3313, test_loss: 1.7971, test_f1: 0.6460
 epoch: 95, train_loss: 0.3522, test_loss: 2.1523, test_f1: 0.6278
 epoch: 96, train_loss: 0.3855, test_loss: 1.7028, test_f1: 0.5878
 epoch: 97, train_loss: 0.3505, test_loss: 1.9321, test_f1: 0.6393
 epoch: 98, train_loss: 0.3602, test_loss: 1.9447, test_f1: 0.5824
 epoch: 99, train_loss: 0.3339, test_loss: 1.9067, test_f1: 0.6327
##################ITERATION #2 ****************************************
 epoch: 0, train_loss: 1.1063, test_loss: 1.4480, test_f1: 0.3992
 epoch: 1, train_loss: 0.9389, test_loss: 1.0764, test_f1: 0.5103
 epoch: 2, train_loss: 0.9260, test_loss: 1.0455, test_f1: 0.5266
 epoch: 3, train_loss: 0.9003, test_loss: 1.0477, test_f1: 0.4074
 epoch: 4, train_loss: 0.8973, test_loss: 0.9759, test_f1: 0.4667
 epoch: 5, train_loss: 0.8682, test_loss: 1.0330, test_f1: 0.5076
 epoch: 6, train_loss: 0.8870, test_loss: 1.0791, test_f1: 0.5444
 epoch: 7, train_loss: 0.8448, test_loss: 1.0366, test_f1: 0.4544
 epoch: 8, train_loss: 0.8422, test_loss: 0.9858, test_f1: 0.4892
 epoch: 9, train_loss: 0.9001, test_loss: 0.9831, test_f1: 0.5707
 epoch: 10, train_loss: 0.8443, test_loss: 0.9879, test_f1: 0.5375
 epoch: 11, train_loss: 0.8373, test_loss: 0.9844, test_f1: 0.5411
 epoch: 12, train_loss: 0.8360, test_loss: 0.9754, test_f1: 0.5771
 epoch: 13, train_loss: 0.8266, test_loss: 1.2394, test_f1: 0.5007
 epoch: 14, train_loss: 0.8481, test_loss: 0.9455, test_f1: 0.5450
 epoch: 15, train_loss: 0.8169, test_loss: 0.9867, test_f1: 0.5983
 epoch: 16, train_loss: 0.7955, test_loss: 1.0197, test_f1: 0.5452
 epoch: 17, train_loss: 0.7877, test_loss: 1.2324, test_f1: 0.5378
 epoch: 18, train_loss: 0.7840, test_loss: 0.9445, test_f1: 0.5267
 epoch: 19, train_loss: 0.7898, test_loss: 0.9833, test_f1: 0.4875
 epoch: 20, train_loss: 0.8229, test_loss: 1.1516, test_f1: 0.5059
 epoch: 21, train_loss: 0.8149, test_loss: 1.0100, test_f1: 0.5593
 epoch: 22, train_loss: 0.7879, test_loss: 1.0264, test_f1: 0.5778
 epoch: 23, train_loss: 0.7571, test_loss: 1.3977, test_f1: 0.4828
 epoch: 24, train_loss: 0.7678, test_loss: 1.2691, test_f1: 0.5335
 epoch: 25, train_loss: 0.7565, test_loss: 1.1232, test_f1: 0.5149
 epoch: 26, train_loss: 0.7516, test_loss: 1.9045, test_f1: 0.4406
 epoch: 27, train_loss: 0.7572, test_loss: 1.9602, test_f1: 0.3941
 epoch: 28, train_loss: 0.7444, test_loss: 1.0544, test_f1: 0.5019
 epoch: 29, train_loss: 0.7229, test_loss: 1.1410, test_f1: 0.4984
 epoch: 30, train_loss: 0.7417, test_loss: 0.9322, test_f1: 0.5640
 epoch: 31, train_loss: 0.7001, test_loss: 0.9563, test_f1: 0.5703
 epoch: 32, train_loss: 0.7282, test_loss: 1.1543, test_f1: 0.5942
 epoch: 33, train_loss: 0.6909, test_loss: 0.9858, test_f1: 0.5522
 epoch: 34, train_loss: 0.6707, test_loss: 1.2963, test_f1: 0.5467
 epoch: 35, train_loss: 0.6952, test_loss: 0.9974, test_f1: 0.5356
 epoch: 36, train_loss: 0.6744, test_loss: 1.7929, test_f1: 0.4336
 epoch: 37, train_loss: 0.6741, test_loss: 1.1430, test_f1: 0.5675
 epoch: 38, train_loss: 0.6559, test_loss: 1.1770, test_f1: 0.5433
 epoch: 39, train_loss: 0.6914, test_loss: 0.9993, test_f1: 0.5672
 epoch: 40, train_loss: 0.6698, test_loss: 1.2116, test_f1: 0.5140
 epoch: 41, train_loss: 0.6544, test_loss: 1.1561, test_f1: 0.5899
 epoch: 42, train_loss: 0.6351, test_loss: 1.0508, test_f1: 0.6295
 epoch: 43, train_loss: 0.6536, test_loss: 1.1892, test_f1: 0.5638
 epoch: 44, train_loss: 0.6497, test_loss: 1.2218, test_f1: 0.4698
 epoch: 45, train_loss: 0.6226, test_loss: 1.1300, test_f1: 0.5257
 epoch: 46, train_loss: 0.6286, test_loss: 0.9739, test_f1: 0.6159
 epoch: 47, train_loss: 0.6477, test_loss: 1.2066, test_f1: 0.5732
 epoch: 48, train_loss: 0.6474, test_loss: 1.1605, test_f1: 0.5581
 epoch: 49, train_loss: 0.6156, test_loss: 1.4138, test_f1: 0.5724
 epoch: 50, train_loss: 0.6406, test_loss: 1.5912, test_f1: 0.6086
 epoch: 51, train_loss: 0.6081, test_loss: 1.1167, test_f1: 0.6372
 epoch: 52, train_loss: 0.5465, test_loss: 1.2120, test_f1: 0.6195
 epoch: 53, train_loss: 0.5413, test_loss: 1.3928, test_f1: 0.6177
 epoch: 54, train_loss: 0.5356, test_loss: 1.4912, test_f1: 0.6050
 epoch: 55, train_loss: 0.5400, test_loss: 1.5182, test_f1: 0.6036
 epoch: 56, train_loss: 0.5310, test_loss: 1.2613, test_f1: 0.6093
 epoch: 57, train_loss: 0.5215, test_loss: 1.4099, test_f1: 0.6519
 epoch: 58, train_loss: 0.5130, test_loss: 1.5457, test_f1: 0.5810
 epoch: 59, train_loss: 0.5201, test_loss: 1.7322, test_f1: 0.5823
 epoch: 60, train_loss: 0.5181, test_loss: 1.9197, test_f1: 0.6133
 epoch: 61, train_loss: 0.4984, test_loss: 1.5190, test_f1: 0.5923
 epoch: 62, train_loss: 0.5089, test_loss: 1.4509, test_f1: 0.5892
 epoch: 63, train_loss: 0.4934, test_loss: 1.2972, test_f1: 0.6601
 epoch: 64, train_loss: 0.4818, test_loss: 1.2790, test_f1: 0.6168
 epoch: 65, train_loss: 0.4905, test_loss: 1.6017, test_f1: 0.6217
 epoch: 66, train_loss: 0.4867, test_loss: 1.3663, test_f1: 0.5747
 epoch: 67, train_loss: 0.4831, test_loss: 1.6697, test_f1: 0.6262
 epoch: 68, train_loss: 0.4951, test_loss: 1.1286, test_f1: 0.6552
 epoch: 69, train_loss: 0.4611, test_loss: 1.4185, test_f1: 0.6338
 epoch: 70, train_loss: 0.4587, test_loss: 1.6776, test_f1: 0.5822
 epoch: 71, train_loss: 0.4454, test_loss: 1.5108, test_f1: 0.5977
 epoch: 72, train_loss: 0.4604, test_loss: 1.5519, test_f1: 0.6353
 epoch: 73, train_loss: 0.4880, test_loss: 1.3288, test_f1: 0.5950
 epoch: 74, train_loss: 0.4580, test_loss: 1.9710, test_f1: 0.6247
 epoch: 75, train_loss: 0.4285, test_loss: 1.5611, test_f1: 0.6180
 epoch: 76, train_loss: 0.4546, test_loss: 1.9167, test_f1: 0.6009
 epoch: 77, train_loss: 0.4343, test_loss: 1.6794, test_f1: 0.6225
 epoch: 78, train_loss: 0.4491, test_loss: 1.8254, test_f1: 0.6151
 epoch: 79, train_loss: 0.4387, test_loss: 2.1886, test_f1: 0.6134
 epoch: 80, train_loss: 0.4632, test_loss: 1.8876, test_f1: 0.6325
 epoch: 81, train_loss: 0.4426, test_loss: 1.7344, test_f1: 0.6149
 epoch: 82, train_loss: 0.4384, test_loss: 1.6060, test_f1: 0.6388
 epoch: 83, train_loss: 0.4268, test_loss: 1.5451, test_f1: 0.6048
 epoch: 84, train_loss: 0.4232, test_loss: 1.6481, test_f1: 0.6066
 epoch: 85, train_loss: 0.4308, test_loss: 2.0945, test_f1: 0.5825
 epoch: 86, train_loss: 0.4070, test_loss: 1.8424, test_f1: 0.5745
 epoch: 87, train_loss: 0.4520, test_loss: 2.2085, test_f1: 0.5996
 epoch: 88, train_loss: 0.4233, test_loss: 1.9252, test_f1: 0.6115
 epoch: 89, train_loss: 0.4242, test_loss: 1.6313, test_f1: 0.6025
 epoch: 90, train_loss: 0.4189, test_loss: 1.6948, test_f1: 0.6109
 epoch: 91, train_loss: 0.4105, test_loss: 1.7403, test_f1: 0.6125
 epoch: 92, train_loss: 0.3828, test_loss: 1.9506, test_f1: 0.6243
 epoch: 93, train_loss: 0.4113, test_loss: 1.8624, test_f1: 0.5863
 epoch: 94, train_loss: 0.3861, test_loss: 1.7139, test_f1: 0.6298
 epoch: 95, train_loss: 0.4107, test_loss: 1.9761, test_f1: 0.5898
 epoch: 96, train_loss: 0.3636, test_loss: 1.8175, test_f1: 0.6241
 epoch: 97, train_loss: 0.3816, test_loss: 2.1846, test_f1: 0.6029
 epoch: 98, train_loss: 0.3789, test_loss: 2.1257, test_f1: 0.6060
 epoch: 99, train_loss: 0.3970, test_loss: 2.3778, test_f1: 0.6192
##################ITERATION #3 ****************************************
 epoch: 0, train_loss: 1.1232, test_loss: 1.1487, test_f1: 0.3748
 epoch: 1, train_loss: 0.9384, test_loss: 1.0236, test_f1: 0.4849
 epoch: 2, train_loss: 0.9246, test_loss: 1.1751, test_f1: 0.4656
 epoch: 3, train_loss: 0.8910, test_loss: 1.0085, test_f1: 0.4310
 epoch: 4, train_loss: 0.8898, test_loss: 0.9830, test_f1: 0.5831
 epoch: 5, train_loss: 0.8707, test_loss: 0.9608, test_f1: 0.5700
 epoch: 6, train_loss: 0.8588, test_loss: 1.0980, test_f1: 0.5706
 epoch: 7, train_loss: 0.8541, test_loss: 0.9966, test_f1: 0.4747
 epoch: 8, train_loss: 0.8820, test_loss: 0.9562, test_f1: 0.5649
 epoch: 9, train_loss: 0.8450, test_loss: 1.0123, test_f1: 0.5544
 epoch: 10, train_loss: 0.8794, test_loss: 0.9883, test_f1: 0.5874
 epoch: 11, train_loss: 0.8150, test_loss: 0.9603, test_f1: 0.5084
 epoch: 12, train_loss: 0.8264, test_loss: 0.9995, test_f1: 0.5561
 epoch: 13, train_loss: 0.8106, test_loss: 1.4367, test_f1: 0.4769
 epoch: 14, train_loss: 0.8095, test_loss: 0.9260, test_f1: 0.5842
 epoch: 15, train_loss: 0.8087, test_loss: 0.9725, test_f1: 0.5428
 epoch: 16, train_loss: 0.7810, test_loss: 0.9837, test_f1: 0.5317
 epoch: 17, train_loss: 0.8027, test_loss: 1.0557, test_f1: 0.4173
 epoch: 18, train_loss: 0.7964, test_loss: 1.4407, test_f1: 0.4017
 epoch: 19, train_loss: 0.7608, test_loss: 1.0628, test_f1: 0.5288
 epoch: 20, train_loss: 0.8005, test_loss: 1.5474, test_f1: 0.3673
 epoch: 21, train_loss: 0.9130, test_loss: 0.9567, test_f1: 0.5280
 epoch: 22, train_loss: 0.7952, test_loss: 1.3099, test_f1: 0.4614
 epoch: 23, train_loss: 0.7805, test_loss: 1.0167, test_f1: 0.5619
 epoch: 24, train_loss: 0.7686, test_loss: 1.2015, test_f1: 0.4962
 epoch: 25, train_loss: 0.7728, test_loss: 1.1622, test_f1: 0.5001
 epoch: 26, train_loss: 0.7768, test_loss: 0.9751, test_f1: 0.5421
 epoch: 27, train_loss: 0.7244, test_loss: 0.9786, test_f1: 0.5857
 epoch: 28, train_loss: 0.6929, test_loss: 1.0582, test_f1: 0.5205
 epoch: 29, train_loss: 0.7161, test_loss: 1.2327, test_f1: 0.5110
 epoch: 30, train_loss: 0.6832, test_loss: 1.1759, test_f1: 0.4768
 epoch: 31, train_loss: 0.7173, test_loss: 1.1542, test_f1: 0.5622
 epoch: 32, train_loss: 0.6836, test_loss: 1.2783, test_f1: 0.4905
 epoch: 33, train_loss: 0.6928, test_loss: 1.0493, test_f1: 0.5816
 epoch: 34, train_loss: 0.6907, test_loss: 1.2998, test_f1: 0.5716
 epoch: 35, train_loss: 0.6759, test_loss: 1.0846, test_f1: 0.5607
 epoch: 36, train_loss: 0.6806, test_loss: 1.0731, test_f1: 0.4983
 epoch: 37, train_loss: 0.6789, test_loss: 1.3333, test_f1: 0.5350
 epoch: 38, train_loss: 0.6783, test_loss: 0.9692, test_f1: 0.6619
 epoch: 39, train_loss: 0.6504, test_loss: 1.4488, test_f1: 0.4955
 epoch: 40, train_loss: 0.6526, test_loss: 1.3679, test_f1: 0.5390
 epoch: 41, train_loss: 0.6831, test_loss: 1.1377, test_f1: 0.5647
 epoch: 42, train_loss: 0.6352, test_loss: 1.1230, test_f1: 0.5944
 epoch: 43, train_loss: 0.6687, test_loss: 1.1187, test_f1: 0.5623
 epoch: 44, train_loss: 0.6257, test_loss: 1.1649, test_f1: 0.5632
 epoch: 45, train_loss: 0.6174, test_loss: 1.1966, test_f1: 0.4617
 epoch: 46, train_loss: 0.6493, test_loss: 1.0066, test_f1: 0.5755
 epoch: 47, train_loss: 0.6353, test_loss: 1.0933, test_f1: 0.5362
 epoch: 48, train_loss: 0.6143, test_loss: 1.1857, test_f1: 0.5842
 epoch: 49, train_loss: 0.6121, test_loss: 1.1228, test_f1: 0.5939
 epoch: 50, train_loss: 0.6669, test_loss: 1.0838, test_f1: 0.5136
 epoch: 51, train_loss: 0.5971, test_loss: 0.9700, test_f1: 0.6338
 epoch: 52, train_loss: 0.5746, test_loss: 1.0029, test_f1: 0.6075
 epoch: 53, train_loss: 0.5613, test_loss: 1.2177, test_f1: 0.5770
 epoch: 54, train_loss: 0.5173, test_loss: 1.0942, test_f1: 0.6089
 epoch: 55, train_loss: 0.5314, test_loss: 1.1626, test_f1: 0.5589
 epoch: 56, train_loss: 0.4980, test_loss: 1.1808, test_f1: 0.6303
 epoch: 57, train_loss: 0.4966, test_loss: 1.0992, test_f1: 0.6505
 epoch: 58, train_loss: 0.5188, test_loss: 1.0349, test_f1: 0.6317
 epoch: 59, train_loss: 0.5142, test_loss: 1.2914, test_f1: 0.5640
 epoch: 60, train_loss: 0.4963, test_loss: 1.2315, test_f1: 0.5221
 epoch: 61, train_loss: 0.5074, test_loss: 1.5565, test_f1: 0.5901
 epoch: 62, train_loss: 0.4954, test_loss: 1.1767, test_f1: 0.6374
 epoch: 63, train_loss: 0.4655, test_loss: 1.1213, test_f1: 0.6404
 epoch: 64, train_loss: 0.4486, test_loss: 1.2465, test_f1: 0.6247
 epoch: 65, train_loss: 0.5124, test_loss: 1.1109, test_f1: 0.6448
 epoch: 66, train_loss: 0.4885, test_loss: 1.1654, test_f1: 0.5524
 epoch: 67, train_loss: 0.4627, test_loss: 1.3218, test_f1: 0.6184
 epoch: 68, train_loss: 0.4370, test_loss: 1.2068, test_f1: 0.6871
 epoch: 69, train_loss: 0.4364, test_loss: 1.2114, test_f1: 0.6157
 epoch: 70, train_loss: 0.4297, test_loss: 1.4595, test_f1: 0.5820
 epoch: 71, train_loss: 0.4138, test_loss: 1.4006, test_f1: 0.6391
 epoch: 72, train_loss: 0.4215, test_loss: 1.4025, test_f1: 0.6010
 epoch: 73, train_loss: 0.4504, test_loss: 1.3276, test_f1: 0.6176
 epoch: 74, train_loss: 0.4035, test_loss: 1.5585, test_f1: 0.6007
 epoch: 75, train_loss: 0.4060, test_loss: 1.5162, test_f1: 0.5838
 epoch: 76, train_loss: 0.4185, test_loss: 1.3171, test_f1: 0.6091
 epoch: 77, train_loss: 0.4067, test_loss: 1.6848, test_f1: 0.5960
 epoch: 78, train_loss: 0.4035, test_loss: 1.2150, test_f1: 0.6217
 epoch: 79, train_loss: 0.4148, test_loss: 1.4973, test_f1: 0.6216
 epoch: 80, train_loss: 0.4539, test_loss: 1.2590, test_f1: 0.5692
 epoch: 81, train_loss: 0.3898, test_loss: 1.2906, test_f1: 0.6235
 epoch: 82, train_loss: 0.3565, test_loss: 1.3253, test_f1: 0.5830
 epoch: 83, train_loss: 0.3871, test_loss: 1.4888, test_f1: 0.5538
 epoch: 84, train_loss: 0.3728, test_loss: 1.3026, test_f1: 0.6449
 epoch: 85, train_loss: 0.3779, test_loss: 1.7599, test_f1: 0.5604
 epoch: 86, train_loss: 0.3663, test_loss: 1.3397, test_f1: 0.6206
 epoch: 87, train_loss: 0.3541, test_loss: 1.3059, test_f1: 0.6137
 epoch: 88, train_loss: 0.3860, test_loss: 1.4678, test_f1: 0.6072
 epoch: 89, train_loss: 0.3782, test_loss: 1.5344, test_f1: 0.6014
 epoch: 90, train_loss: 0.4034, test_loss: 1.3720, test_f1: 0.6347
 epoch: 91, train_loss: 0.3293, test_loss: 1.8141, test_f1: 0.6165
 epoch: 92, train_loss: 0.3749, test_loss: 1.5636, test_f1: 0.6074
 epoch: 93, train_loss: 0.3360, test_loss: 1.5560, test_f1: 0.5890
 epoch: 94, train_loss: 0.3511, test_loss: 1.6826, test_f1: 0.5731
 epoch: 95, train_loss: 0.3354, test_loss: 1.5437, test_f1: 0.6494
 epoch: 96, train_loss: 0.3546, test_loss: 1.6120, test_f1: 0.5925
 epoch: 97, train_loss: 0.3486, test_loss: 1.5699, test_f1: 0.6206
 epoch: 98, train_loss: 0.3403, test_loss: 1.3122, test_f1: 0.6635
 epoch: 99, train_loss: 0.3414, test_loss: 1.3955, test_f1: 0.5840
##################ITERATION #4 ****************************************
 epoch: 0, train_loss: 1.1659, test_loss: 1.1337, test_f1: 0.3724
 epoch: 1, train_loss: 1.0329, test_loss: 1.0988, test_f1: 0.3890
 epoch: 2, train_loss: 1.0117, test_loss: 1.1272, test_f1: 0.4161
 epoch: 3, train_loss: 1.0019, test_loss: 1.1333, test_f1: 0.4171
 epoch: 4, train_loss: 0.9619, test_loss: 1.0294, test_f1: 0.4240
 epoch: 5, train_loss: 0.9540, test_loss: 1.0139, test_f1: 0.5686
 epoch: 6, train_loss: 0.9068, test_loss: 1.0322, test_f1: 0.5052
 epoch: 7, train_loss: 0.8874, test_loss: 0.9980, test_f1: 0.4535
 epoch: 8, train_loss: 0.8774, test_loss: 1.0237, test_f1: 0.5098
 epoch: 9, train_loss: 0.8807, test_loss: 1.0516, test_f1: 0.4126
 epoch: 10, train_loss: 0.8594, test_loss: 1.0382, test_f1: 0.5227
 epoch: 11, train_loss: 0.8561, test_loss: 0.9856, test_f1: 0.5395
 epoch: 12, train_loss: 0.8298, test_loss: 0.9925, test_f1: 0.5576
 epoch: 13, train_loss: 0.8350, test_loss: 1.0417, test_f1: 0.5154
 epoch: 14, train_loss: 0.8122, test_loss: 1.0512, test_f1: 0.5299
 epoch: 15, train_loss: 0.8056, test_loss: 1.2285, test_f1: 0.5188
 epoch: 16, train_loss: 0.8395, test_loss: 0.9835, test_f1: 0.5365
 epoch: 17, train_loss: 0.8235, test_loss: 1.1529, test_f1: 0.5061
 epoch: 18, train_loss: 0.8251, test_loss: 1.0263, test_f1: 0.5451
 epoch: 19, train_loss: 0.8268, test_loss: 1.0487, test_f1: 0.4651
 epoch: 20, train_loss: 0.7978, test_loss: 1.1303, test_f1: 0.5112
 epoch: 21, train_loss: 0.8047, test_loss: 1.1540, test_f1: 0.5124
 epoch: 22, train_loss: 0.7955, test_loss: 1.3096, test_f1: 0.5018
 epoch: 23, train_loss: 0.7795, test_loss: 1.1808, test_f1: 0.4619
 epoch: 24, train_loss: 0.7851, test_loss: 1.4902, test_f1: 0.5100
 epoch: 25, train_loss: 0.7506, test_loss: 1.3153, test_f1: 0.5036
 epoch: 26, train_loss: 0.7726, test_loss: 1.0243, test_f1: 0.5208
 epoch: 27, train_loss: 0.7811, test_loss: 1.2026, test_f1: 0.4993
 epoch: 28, train_loss: 0.7815, test_loss: 1.2163, test_f1: 0.5016
 epoch: 29, train_loss: 0.7639, test_loss: 1.4506, test_f1: 0.4497
 epoch: 30, train_loss: 0.7536, test_loss: 1.5276, test_f1: 0.5259
 epoch: 31, train_loss: 0.7267, test_loss: 1.2904, test_f1: 0.5181
 epoch: 32, train_loss: 0.7274, test_loss: 1.3376, test_f1: 0.5000
 epoch: 33, train_loss: 0.7302, test_loss: 1.6306, test_f1: 0.5124
 epoch: 34, train_loss: 0.7673, test_loss: 1.1530, test_f1: 0.5030
 epoch: 35, train_loss: 0.7810, test_loss: 1.1235, test_f1: 0.5162
 epoch: 36, train_loss: 0.7341, test_loss: 1.1217, test_f1: 0.5010
 epoch: 37, train_loss: 0.7148, test_loss: 1.3359, test_f1: 0.5105
 epoch: 38, train_loss: 0.7227, test_loss: 1.0842, test_f1: 0.5202
 epoch: 39, train_loss: 0.7188, test_loss: 1.6269, test_f1: 0.5390
 epoch: 40, train_loss: 0.7244, test_loss: 1.3450, test_f1: 0.5351
 epoch: 41, train_loss: 0.7289, test_loss: 1.0998, test_f1: 0.5502
 epoch: 42, train_loss: 0.7325, test_loss: 1.1965, test_f1: 0.5221
 epoch: 43, train_loss: 0.6802, test_loss: 1.3867, test_f1: 0.4577
 epoch: 44, train_loss: 0.6941, test_loss: 1.2967, test_f1: 0.5183
 epoch: 45, train_loss: 0.6865, test_loss: 1.2718, test_f1: 0.5337
 epoch: 46, train_loss: 0.6883, test_loss: 1.0958, test_f1: 0.5390
 epoch: 47, train_loss: 0.6913, test_loss: 1.3565, test_f1: 0.5212
 epoch: 48, train_loss: 0.6830, test_loss: 1.0637, test_f1: 0.5477
 epoch: 49, train_loss: 0.6524, test_loss: 1.2283, test_f1: 0.5361
 epoch: 50, train_loss: 0.6826, test_loss: 1.0917, test_f1: 0.4877
 epoch: 51, train_loss: 0.6682, test_loss: 1.1954, test_f1: 0.5075
 epoch: 52, train_loss: 0.6193, test_loss: 1.2803, test_f1: 0.5138
 epoch: 53, train_loss: 0.5931, test_loss: 1.3284, test_f1: 0.5154
 epoch: 54, train_loss: 0.5834, test_loss: 1.3293, test_f1: 0.5244
 epoch: 55, train_loss: 0.6005, test_loss: 1.3361, test_f1: 0.5178
 epoch: 56, train_loss: 0.5552, test_loss: 2.3572, test_f1: 0.4931
 epoch: 57, train_loss: 0.5624, test_loss: 1.2866, test_f1: 0.5553
 epoch: 58, train_loss: 0.5878, test_loss: 2.7046, test_f1: 0.5162
 epoch: 59, train_loss: 0.5841, test_loss: 1.8141, test_f1: 0.5255
 epoch: 60, train_loss: 0.5435, test_loss: 1.3438, test_f1: 0.5664
 epoch: 61, train_loss: 0.5349, test_loss: 1.2143, test_f1: 0.5366
 epoch: 62, train_loss: 0.6117, test_loss: 2.1381, test_f1: 0.5014
 epoch: 63, train_loss: 0.5971, test_loss: 1.2828, test_f1: 0.5400
 epoch: 64, train_loss: 0.5701, test_loss: 1.6027, test_f1: 0.5621
 epoch: 65, train_loss: 0.5564, test_loss: 1.6160, test_f1: 0.5421
 epoch: 66, train_loss: 0.5399, test_loss: 1.3582, test_f1: 0.5238
 epoch: 67, train_loss: 0.5359, test_loss: 1.6376, test_f1: 0.5364
 epoch: 68, train_loss: 0.5325, test_loss: 1.3119, test_f1: 0.5690
 epoch: 69, train_loss: 0.5367, test_loss: 1.5186, test_f1: 0.5479
 epoch: 70, train_loss: 0.5268, test_loss: 1.7188, test_f1: 0.5189
 epoch: 71, train_loss: 0.5262, test_loss: 1.5128, test_f1: 0.5376
 epoch: 72, train_loss: 0.5694, test_loss: 1.9278, test_f1: 0.5158
 epoch: 73, train_loss: 0.5120, test_loss: 1.8032, test_f1: 0.5319
 epoch: 74, train_loss: 0.4840, test_loss: 1.7697, test_f1: 0.5695
 epoch: 75, train_loss: 0.4957, test_loss: 1.3807, test_f1: 0.5423
 epoch: 76, train_loss: 0.5000, test_loss: 1.9137, test_f1: 0.4949
 epoch: 77, train_loss: 0.4878, test_loss: 1.5207, test_f1: 0.5671
 epoch: 78, train_loss: 0.4936, test_loss: 1.6535, test_f1: 0.5497
 epoch: 79, train_loss: 0.4880, test_loss: 1.9019, test_f1: 0.5344
 epoch: 80, train_loss: 0.5080, test_loss: 2.1430, test_f1: 0.5056
 epoch: 81, train_loss: 0.5096, test_loss: 1.5137, test_f1: 0.5479
 epoch: 82, train_loss: 0.4778, test_loss: 1.8102, test_f1: 0.5223
 epoch: 83, train_loss: 0.4485, test_loss: 1.8598, test_f1: 0.5212
 epoch: 84, train_loss: 0.4297, test_loss: 2.3403, test_f1: 0.5281
 epoch: 85, train_loss: 0.4496, test_loss: 1.7165, test_f1: 0.5525
 epoch: 86, train_loss: 0.4426, test_loss: 1.8295, test_f1: 0.5221
 epoch: 87, train_loss: 0.4441, test_loss: 2.0188, test_f1: 0.5202
 epoch: 88, train_loss: 0.4533, test_loss: 1.9635, test_f1: 0.5161
 epoch: 89, train_loss: 0.4285, test_loss: 2.2665, test_f1: 0.5245
 epoch: 90, train_loss: 0.4560, test_loss: 2.4428, test_f1: 0.5330
 epoch: 91, train_loss: 0.4265, test_loss: 2.0062, test_f1: 0.4972
 epoch: 92, train_loss: 0.4497, test_loss: 1.5758, test_f1: 0.5582
 epoch: 93, train_loss: 0.4605, test_loss: 2.2620, test_f1: 0.5613
 epoch: 94, train_loss: 0.4366, test_loss: 2.4194, test_f1: 0.5207
 epoch: 95, train_loss: 0.4251, test_loss: 1.8933, test_f1: 0.5342
 epoch: 96, train_loss: 0.4290, test_loss: 2.7893, test_f1: 0.5335
 epoch: 97, train_loss: 0.4054, test_loss: 2.4042, test_f1: 0.5273
 epoch: 98, train_loss: 0.4240, test_loss: 2.0633, test_f1: 0.5100
 epoch: 99, train_loss: 0.4245, test_loss: 1.9470, test_f1: 0.5667
##################ITERATION #5 ****************************************
 epoch: 0, train_loss: 1.1863, test_loss: 1.2268, test_f1: 0.4240
 epoch: 1, train_loss: 1.0021, test_loss: 1.0839, test_f1: 0.4594
 epoch: 2, train_loss: 0.9616, test_loss: 1.1028, test_f1: 0.4263
 epoch: 3, train_loss: 0.8895, test_loss: 1.0110, test_f1: 0.5405
 epoch: 4, train_loss: 0.8861, test_loss: 0.9902, test_f1: 0.5144
 epoch: 5, train_loss: 0.9061, test_loss: 0.9825, test_f1: 0.5225
 epoch: 6, train_loss: 0.8736, test_loss: 0.9678, test_f1: 0.4350
 epoch: 7, train_loss: 0.8711, test_loss: 1.0070, test_f1: 0.4930
 epoch: 8, train_loss: 0.8837, test_loss: 1.0175, test_f1: 0.5622
 epoch: 9, train_loss: 0.8853, test_loss: 1.0099, test_f1: 0.5666
 epoch: 10, train_loss: 0.8893, test_loss: 1.0098, test_f1: 0.4999
 epoch: 11, train_loss: 0.8662, test_loss: 1.0071, test_f1: 0.5464
 epoch: 12, train_loss: 0.8650, test_loss: 1.1040, test_f1: 0.4806
 epoch: 13, train_loss: 0.8626, test_loss: 1.0190, test_f1: 0.4322
 epoch: 14, train_loss: 0.8566, test_loss: 1.1140, test_f1: 0.5590
 epoch: 15, train_loss: 0.8505, test_loss: 1.0329, test_f1: 0.5156
 epoch: 16, train_loss: 0.8545, test_loss: 1.0163, test_f1: 0.4273
 epoch: 17, train_loss: 0.8638, test_loss: 1.2168, test_f1: 0.3702
 epoch: 18, train_loss: 0.8376, test_loss: 1.1665, test_f1: 0.5192
 epoch: 19, train_loss: 0.8202, test_loss: 1.0721, test_f1: 0.5478
 epoch: 20, train_loss: 0.8110, test_loss: 1.1536, test_f1: 0.4879
 epoch: 21, train_loss: 0.8309, test_loss: 1.1455, test_f1: 0.4864
 epoch: 22, train_loss: 0.8173, test_loss: 1.0996, test_f1: 0.4168
 epoch: 23, train_loss: 0.8210, test_loss: 1.0425, test_f1: 0.5338
 epoch: 24, train_loss: 0.8133, test_loss: 1.3977, test_f1: 0.4342
 epoch: 25, train_loss: 0.7972, test_loss: 1.3850, test_f1: 0.5192
 epoch: 26, train_loss: 0.8129, test_loss: 1.1391, test_f1: 0.5204
 epoch: 27, train_loss: 0.8084, test_loss: 1.8910, test_f1: 0.4548
 epoch: 28, train_loss: 0.8030, test_loss: 1.0575, test_f1: 0.5598
 epoch: 29, train_loss: 0.7695, test_loss: 2.5399, test_f1: 0.3130
 epoch: 30, train_loss: 0.8178, test_loss: 1.5401, test_f1: 0.3886
 epoch: 31, train_loss: 0.8130, test_loss: 1.0437, test_f1: 0.5876
 epoch: 32, train_loss: 0.7776, test_loss: 1.0889, test_f1: 0.5500
 epoch: 33, train_loss: 0.7711, test_loss: 1.0916, test_f1: 0.5175
 epoch: 34, train_loss: 0.7559, test_loss: 1.1507, test_f1: 0.5509
 epoch: 35, train_loss: 0.7647, test_loss: 1.1785, test_f1: 0.4830
 epoch: 36, train_loss: 0.7517, test_loss: 1.1006, test_f1: 0.5437
 epoch: 37, train_loss: 0.7433, test_loss: 1.0650, test_f1: 0.6124
 epoch: 38, train_loss: 0.7810, test_loss: 1.1794, test_f1: 0.5189
 epoch: 39, train_loss: 0.7374, test_loss: 1.1770, test_f1: 0.4581
 epoch: 40, train_loss: 0.7422, test_loss: 1.1824, test_f1: 0.4663
 epoch: 41, train_loss: 0.7391, test_loss: 1.1209, test_f1: 0.5688
 epoch: 42, train_loss: 0.7086, test_loss: 1.1471, test_f1: 0.5690
 epoch: 43, train_loss: 0.7396, test_loss: 1.3399, test_f1: 0.5739
 epoch: 44, train_loss: 0.7071, test_loss: 1.4569, test_f1: 0.5441
 epoch: 45, train_loss: 0.7220, test_loss: 1.5399, test_f1: 0.5537
 epoch: 46, train_loss: 0.7200, test_loss: 1.0068, test_f1: 0.5753
 epoch: 47, train_loss: 0.6631, test_loss: 1.6324, test_f1: 0.5907
 epoch: 48, train_loss: 0.6792, test_loss: 1.3165, test_f1: 0.6099
 epoch: 49, train_loss: 0.6431, test_loss: 1.4748, test_f1: 0.5625
 epoch: 50, train_loss: 0.6799, test_loss: 1.8365, test_f1: 0.5549
 epoch: 51, train_loss: 0.6540, test_loss: 1.1709, test_f1: 0.5883
 epoch: 52, train_loss: 0.6065, test_loss: 1.3863, test_f1: 0.6500
 epoch: 53, train_loss: 0.5956, test_loss: 1.3804, test_f1: 0.5930
 epoch: 54, train_loss: 0.5863, test_loss: 1.1604, test_f1: 0.6216
 epoch: 55, train_loss: 0.6151, test_loss: 1.3065, test_f1: 0.5313
 epoch: 56, train_loss: 0.6010, test_loss: 1.2547, test_f1: 0.6001
 epoch: 57, train_loss: 0.5750, test_loss: 1.6131, test_f1: 0.6067
 epoch: 58, train_loss: 0.5599, test_loss: 1.2367, test_f1: 0.5938
 epoch: 59, train_loss: 0.5622, test_loss: 1.2899, test_f1: 0.5609
 epoch: 60, train_loss: 0.5379, test_loss: 1.5038, test_f1: 0.6071
 epoch: 61, train_loss: 0.5633, test_loss: 1.2340, test_f1: 0.6089
 epoch: 62, train_loss: 0.5499, test_loss: 1.8274, test_f1: 0.5968
 epoch: 63, train_loss: 0.5452, test_loss: 1.6443, test_f1: 0.6010
 epoch: 64, train_loss: 0.5325, test_loss: 1.2621, test_f1: 0.6275
 epoch: 65, train_loss: 0.5161, test_loss: 1.4844, test_f1: 0.6063
 epoch: 66, train_loss: 0.5401, test_loss: 1.3946, test_f1: 0.5843
 epoch: 67, train_loss: 0.5036, test_loss: 1.6242, test_f1: 0.5250
 epoch: 68, train_loss: 0.5109, test_loss: 1.8876, test_f1: 0.5848
 epoch: 69, train_loss: 0.5342, test_loss: 1.1951, test_f1: 0.6296
 epoch: 70, train_loss: 0.5149, test_loss: 1.1839, test_f1: 0.6364
 epoch: 71, train_loss: 0.4796, test_loss: 1.4500, test_f1: 0.6164
 epoch: 72, train_loss: 0.5081, test_loss: 1.3889, test_f1: 0.6008
 epoch: 73, train_loss: 0.5195, test_loss: 1.4985, test_f1: 0.5858
 epoch: 74, train_loss: 0.5189, test_loss: 1.5665, test_f1: 0.5756
 epoch: 75, train_loss: 0.4842, test_loss: 1.6560, test_f1: 0.6015
 epoch: 76, train_loss: 0.4578, test_loss: 1.7298, test_f1: 0.6586
 epoch: 77, train_loss: 0.4873, test_loss: 1.9799, test_f1: 0.6256
 epoch: 78, train_loss: 0.4901, test_loss: 2.3936, test_f1: 0.5874
 epoch: 79, train_loss: 0.4718, test_loss: 1.5572, test_f1: 0.6241
 epoch: 80, train_loss: 0.4461, test_loss: 1.2995, test_f1: 0.6467
 epoch: 81, train_loss: 0.4575, test_loss: 1.3150, test_f1: 0.6429
 epoch: 82, train_loss: 0.4687, test_loss: 1.2240, test_f1: 0.6657
 epoch: 83, train_loss: 0.4113, test_loss: 1.6294, test_f1: 0.6153
 epoch: 84, train_loss: 0.4463, test_loss: 1.4600, test_f1: 0.6140
 epoch: 85, train_loss: 0.4181, test_loss: 1.6162, test_f1: 0.5859
 epoch: 86, train_loss: 0.4280, test_loss: 1.7223, test_f1: 0.5708
 epoch: 87, train_loss: 0.4257, test_loss: 1.6004, test_f1: 0.5888
 epoch: 88, train_loss: 0.4357, test_loss: 1.7269, test_f1: 0.5743
 epoch: 89, train_loss: 0.4369, test_loss: 1.7029, test_f1: 0.5786
 epoch: 90, train_loss: 0.4369, test_loss: 1.5110, test_f1: 0.5995
 epoch: 91, train_loss: 0.4089, test_loss: 1.3607, test_f1: 0.6424
 epoch: 92, train_loss: 0.4239, test_loss: 1.7286, test_f1: 0.6208
 epoch: 93, train_loss: 0.4370, test_loss: 1.2313, test_f1: 0.5971
 epoch: 94, train_loss: 0.4350, test_loss: 1.4184, test_f1: 0.6214
 epoch: 95, train_loss: 0.3730, test_loss: 1.6491, test_f1: 0.6087
 epoch: 96, train_loss: 0.3908, test_loss: 1.2312, test_f1: 0.6393
 epoch: 97, train_loss: 0.3829, test_loss: 2.1948, test_f1: 0.5992
 epoch: 98, train_loss: 0.3774, test_loss: 1.4943, test_f1: 0.6456
 epoch: 99, train_loss: 0.3731, test_loss: 1.7421, test_f1: 0.6194
##################ITERATION #6 ****************************************
 epoch: 0, train_loss: 1.1505, test_loss: 1.4825, test_f1: 0.4607
 epoch: 1, train_loss: 0.9599, test_loss: 1.0325, test_f1: 0.4322
 epoch: 2, train_loss: 0.9268, test_loss: 1.0665, test_f1: 0.4383
 epoch: 3, train_loss: 0.9029, test_loss: 1.2463, test_f1: 0.4020
 epoch: 4, train_loss: 0.8943, test_loss: 0.9513, test_f1: 0.4783
 epoch: 5, train_loss: 0.8385, test_loss: 1.0451, test_f1: 0.5837
 epoch: 6, train_loss: 0.8610, test_loss: 1.1103, test_f1: 0.4223
 epoch: 7, train_loss: 0.8434, test_loss: 1.1534, test_f1: 0.4575
 epoch: 8, train_loss: 0.8193, test_loss: 1.4614, test_f1: 0.4738
 epoch: 9, train_loss: 0.8239, test_loss: 1.0774, test_f1: 0.4913
 epoch: 10, train_loss: 0.7904, test_loss: 1.0208, test_f1: 0.5604
 epoch: 11, train_loss: 0.7847, test_loss: 1.3363, test_f1: 0.5284
 epoch: 12, train_loss: 0.7793, test_loss: 1.3238, test_f1: 0.5140
 epoch: 13, train_loss: 0.7742, test_loss: 1.0571, test_f1: 0.5723
 epoch: 14, train_loss: 0.7750, test_loss: 1.0640, test_f1: 0.4527
 epoch: 15, train_loss: 0.7367, test_loss: 1.1163, test_f1: 0.5885
 epoch: 16, train_loss: 0.7161, test_loss: 1.2229, test_f1: 0.4948
 epoch: 17, train_loss: 0.7244, test_loss: 1.3646, test_f1: 0.4383
 epoch: 18, train_loss: 0.7306, test_loss: 1.2804, test_f1: 0.5261
 epoch: 19, train_loss: 0.7239, test_loss: 0.9711, test_f1: 0.6276
 epoch: 20, train_loss: 0.7439, test_loss: 1.5161, test_f1: 0.5073
 epoch: 21, train_loss: 0.7016, test_loss: 0.9497, test_f1: 0.5966
 epoch: 22, train_loss: 0.7098, test_loss: 3.3629, test_f1: 0.2721
 epoch: 23, train_loss: 0.7135, test_loss: 0.9149, test_f1: 0.6415
 epoch: 24, train_loss: 0.6826, test_loss: 1.4083, test_f1: 0.5870
 epoch: 25, train_loss: 0.7827, test_loss: 1.0236, test_f1: 0.5690
 epoch: 26, train_loss: 0.7278, test_loss: 0.9977, test_f1: 0.6349
 epoch: 27, train_loss: 0.7319, test_loss: 1.0420, test_f1: 0.6250
 epoch: 28, train_loss: 0.7005, test_loss: 1.0721, test_f1: 0.5740
 epoch: 29, train_loss: 0.7154, test_loss: 1.2214, test_f1: 0.5954
 epoch: 30, train_loss: 0.7002, test_loss: 1.0085, test_f1: 0.5560
 epoch: 31, train_loss: 0.7146, test_loss: 0.9991, test_f1: 0.6124
 epoch: 32, train_loss: 0.6856, test_loss: 1.0371, test_f1: 0.5703
 epoch: 33, train_loss: 0.6713, test_loss: 1.0651, test_f1: 0.6095
 epoch: 34, train_loss: 0.6563, test_loss: 1.1157, test_f1: 0.5836
 epoch: 35, train_loss: 0.6742, test_loss: 1.1272, test_f1: 0.5655
 epoch: 36, train_loss: 0.6645, test_loss: 1.3563, test_f1: 0.6026
 epoch: 37, train_loss: 0.6659, test_loss: 1.0953, test_f1: 0.5396
 epoch: 38, train_loss: 0.6476, test_loss: 1.0281, test_f1: 0.6121
 epoch: 39, train_loss: 0.6490, test_loss: 1.2990, test_f1: 0.5857
 epoch: 40, train_loss: 0.6310, test_loss: 1.3237, test_f1: 0.5653
 epoch: 41, train_loss: 0.5935, test_loss: 1.1474, test_f1: 0.6069
 epoch: 42, train_loss: 0.6536, test_loss: 0.9623, test_f1: 0.6529
 epoch: 43, train_loss: 0.6080, test_loss: 1.1577, test_f1: 0.5975
 epoch: 44, train_loss: 0.6008, test_loss: 1.0297, test_f1: 0.6280
 epoch: 45, train_loss: 0.5791, test_loss: 1.0912, test_f1: 0.6118
 epoch: 46, train_loss: 0.5465, test_loss: 1.2158, test_f1: 0.6185
 epoch: 47, train_loss: 0.6130, test_loss: 1.3868, test_f1: 0.6287
 epoch: 48, train_loss: 0.6061, test_loss: 1.1018, test_f1: 0.6181
 epoch: 49, train_loss: 0.5824, test_loss: 1.1439, test_f1: 0.5117
 epoch: 50, train_loss: 0.5605, test_loss: 1.4658, test_f1: 0.5896
 epoch: 51, train_loss: 0.5106, test_loss: 1.0401, test_f1: 0.6583
 epoch: 52, train_loss: 0.4968, test_loss: 1.1216, test_f1: 0.6567
 epoch: 53, train_loss: 0.4896, test_loss: 1.1382, test_f1: 0.6362
 epoch: 54, train_loss: 0.5046, test_loss: 1.1755, test_f1: 0.6323
 epoch: 55, train_loss: 0.4825, test_loss: 1.0714, test_f1: 0.6838
 epoch: 56, train_loss: 0.4735, test_loss: 1.2434, test_f1: 0.6481
 epoch: 57, train_loss: 0.4737, test_loss: 1.1829, test_f1: 0.6891
 epoch: 58, train_loss: 0.4822, test_loss: 1.4875, test_f1: 0.6579
 epoch: 59, train_loss: 0.4773, test_loss: 1.1807, test_f1: 0.6444
 epoch: 60, train_loss: 0.4777, test_loss: 1.3240, test_f1: 0.6080
 epoch: 61, train_loss: 0.4265, test_loss: 1.1743, test_f1: 0.6589
 epoch: 62, train_loss: 0.4279, test_loss: 1.3084, test_f1: 0.6376
 epoch: 63, train_loss: 0.4592, test_loss: 1.2811, test_f1: 0.6150
 epoch: 64, train_loss: 0.4400, test_loss: 1.3505, test_f1: 0.6351
 epoch: 65, train_loss: 0.4667, test_loss: 1.1808, test_f1: 0.6462
 epoch: 66, train_loss: 0.4375, test_loss: 1.1205, test_f1: 0.6457
 epoch: 67, train_loss: 0.4030, test_loss: 1.4274, test_f1: 0.6320
 epoch: 68, train_loss: 0.4541, test_loss: 1.2666, test_f1: 0.6179
 epoch: 69, train_loss: 0.4333, test_loss: 1.2740, test_f1: 0.6722
 epoch: 70, train_loss: 0.4568, test_loss: 1.3270, test_f1: 0.6518
 epoch: 71, train_loss: 0.4420, test_loss: 1.1159, test_f1: 0.6420
 epoch: 72, train_loss: 0.4595, test_loss: 1.1903, test_f1: 0.6659
 epoch: 73, train_loss: 0.4442, test_loss: 1.2446, test_f1: 0.6360
 epoch: 74, train_loss: 0.4205, test_loss: 1.1322, test_f1: 0.6595
 epoch: 75, train_loss: 0.4138, test_loss: 1.2383, test_f1: 0.6743
 epoch: 76, train_loss: 0.4128, test_loss: 1.1856, test_f1: 0.6732
 epoch: 77, train_loss: 0.4218, test_loss: 1.2396, test_f1: 0.6650
 epoch: 78, train_loss: 0.4180, test_loss: 1.5414, test_f1: 0.6126
 epoch: 79, train_loss: 0.3993, test_loss: 1.3222, test_f1: 0.6430
 epoch: 80, train_loss: 0.3962, test_loss: 1.4354, test_f1: 0.6578
 epoch: 81, train_loss: 0.4214, test_loss: 1.2935, test_f1: 0.6262
 epoch: 82, train_loss: 0.3870, test_loss: 1.3560, test_f1: 0.6779
 epoch: 83, train_loss: 0.3861, test_loss: 1.4125, test_f1: 0.6736
 epoch: 84, train_loss: 0.4141, test_loss: 1.3416, test_f1: 0.6981
 epoch: 85, train_loss: 0.3944, test_loss: 1.2485, test_f1: 0.6102
 epoch: 86, train_loss: 0.3757, test_loss: 1.2740, test_f1: 0.6609
 epoch: 87, train_loss: 0.3807, test_loss: 1.3910, test_f1: 0.6541
 epoch: 88, train_loss: 0.3479, test_loss: 1.5368, test_f1: 0.6455
 epoch: 89, train_loss: 0.4161, test_loss: 1.4059, test_f1: 0.6557
 epoch: 90, train_loss: 0.3944, test_loss: 1.3282, test_f1: 0.6539
 epoch: 91, train_loss: 0.3672, test_loss: 1.4864, test_f1: 0.6519
 epoch: 92, train_loss: 0.3844, test_loss: 1.3479, test_f1: 0.6425
 epoch: 93, train_loss: 0.3566, test_loss: 1.4631, test_f1: 0.6306
 epoch: 94, train_loss: 0.3545, test_loss: 1.3174, test_f1: 0.6362
 epoch: 95, train_loss: 0.3699, test_loss: 1.6869, test_f1: 0.5979
 epoch: 96, train_loss: 0.3850, test_loss: 1.6640, test_f1: 0.6347
 epoch: 97, train_loss: 0.4080, test_loss: 1.2778, test_f1: 0.6779
 epoch: 98, train_loss: 0.3741, test_loss: 1.2363, test_f1: 0.6409
 epoch: 99, train_loss: 0.3514, test_loss: 1.6853, test_f1: 0.6510
##################ITERATION #7 ****************************************
 epoch: 0, train_loss: 1.1329, test_loss: 1.2011, test_f1: 0.2592
 epoch: 1, train_loss: 0.9317, test_loss: 0.9881, test_f1: 0.5258
 epoch: 2, train_loss: 0.8955, test_loss: 0.9980, test_f1: 0.5258
 epoch: 3, train_loss: 0.8826, test_loss: 1.0150, test_f1: 0.5504
 epoch: 4, train_loss: 0.8748, test_loss: 0.9704, test_f1: 0.5817
 epoch: 5, train_loss: 0.8670, test_loss: 1.0157, test_f1: 0.4654
 epoch: 6, train_loss: 0.8314, test_loss: 1.0088, test_f1: 0.5450
 epoch: 7, train_loss: 0.8525, test_loss: 0.9698, test_f1: 0.5906
 epoch: 8, train_loss: 0.8179, test_loss: 1.0453, test_f1: 0.5162
 epoch: 9, train_loss: 0.8196, test_loss: 1.3641, test_f1: 0.4554
 epoch: 10, train_loss: 0.8053, test_loss: 1.0228, test_f1: 0.5210
 epoch: 11, train_loss: 0.7810, test_loss: 1.1285, test_f1: 0.5550
 epoch: 12, train_loss: 0.8014, test_loss: 1.1762, test_f1: 0.4757
 epoch: 13, train_loss: 0.8088, test_loss: 1.0151, test_f1: 0.4759
 epoch: 14, train_loss: 0.7771, test_loss: 1.2042, test_f1: 0.5516
 epoch: 15, train_loss: 0.7756, test_loss: 0.9779, test_f1: 0.5684
 epoch: 16, train_loss: 0.7553, test_loss: 1.1977, test_f1: 0.5354
 epoch: 17, train_loss: 0.7294, test_loss: 1.2588, test_f1: 0.5049
 epoch: 18, train_loss: 0.7412, test_loss: 0.9987, test_f1: 0.5797
 epoch: 19, train_loss: 0.7348, test_loss: 1.0910, test_f1: 0.5704
 epoch: 20, train_loss: 0.7606, test_loss: 1.1162, test_f1: 0.4709
 epoch: 21, train_loss: 0.7691, test_loss: 1.3281, test_f1: 0.4983
 epoch: 22, train_loss: 0.7319, test_loss: 1.3488, test_f1: 0.4671
 epoch: 23, train_loss: 0.7234, test_loss: 1.0792, test_f1: 0.5193
 epoch: 24, train_loss: 0.7051, test_loss: 0.9325, test_f1: 0.6265
 epoch: 25, train_loss: 0.7100, test_loss: 0.9188, test_f1: 0.6235
 epoch: 26, train_loss: 0.6852, test_loss: 1.1029, test_f1: 0.5613
 epoch: 27, train_loss: 0.6763, test_loss: 1.2465, test_f1: 0.5457
 epoch: 28, train_loss: 0.6930, test_loss: 0.9808, test_f1: 0.5741
 epoch: 29, train_loss: 0.6881, test_loss: 1.3141, test_f1: 0.4795
 epoch: 30, train_loss: 0.6863, test_loss: 1.3920, test_f1: 0.4179
 epoch: 31, train_loss: 0.6865, test_loss: 1.2939, test_f1: 0.5368
 epoch: 32, train_loss: 0.6510, test_loss: 1.1472, test_f1: 0.5082
 epoch: 33, train_loss: 0.7021, test_loss: 0.9900, test_f1: 0.5723
 epoch: 34, train_loss: 0.6632, test_loss: 1.0600, test_f1: 0.5438
 epoch: 35, train_loss: 0.6445, test_loss: 1.3585, test_f1: 0.5485
 epoch: 36, train_loss: 0.6429, test_loss: 1.1140, test_f1: 0.5327
 epoch: 37, train_loss: 0.6558, test_loss: 1.2064, test_f1: 0.5464
 epoch: 38, train_loss: 0.6284, test_loss: 1.1195, test_f1: 0.5739
 epoch: 39, train_loss: 0.6342, test_loss: 1.0335, test_f1: 0.6218
 epoch: 40, train_loss: 0.6075, test_loss: 1.1288, test_f1: 0.6094
 epoch: 41, train_loss: 0.5814, test_loss: 1.2652, test_f1: 0.5783
 epoch: 42, train_loss: 0.5905, test_loss: 1.3785, test_f1: 0.5385
 epoch: 43, train_loss: 0.5739, test_loss: 1.3507, test_f1: 0.6021
 epoch: 44, train_loss: 0.5581, test_loss: 1.8224, test_f1: 0.5440
 epoch: 45, train_loss: 0.5774, test_loss: 1.3577, test_f1: 0.5721
 epoch: 46, train_loss: 0.5789, test_loss: 1.2042, test_f1: 0.5821
 epoch: 47, train_loss: 0.5650, test_loss: 1.1863, test_f1: 0.5518
 epoch: 48, train_loss: 0.5877, test_loss: 1.3284, test_f1: 0.5506
 epoch: 49, train_loss: 0.5551, test_loss: 1.1960, test_f1: 0.5714
 epoch: 50, train_loss: 0.5638, test_loss: 1.3066, test_f1: 0.6129
 epoch: 51, train_loss: 0.5763, test_loss: 1.1024, test_f1: 0.6283
 epoch: 52, train_loss: 0.4739, test_loss: 1.2092, test_f1: 0.6208
 epoch: 53, train_loss: 0.4831, test_loss: 1.1896, test_f1: 0.6152
 epoch: 54, train_loss: 0.4457, test_loss: 1.3629, test_f1: 0.6281
 epoch: 55, train_loss: 0.4545, test_loss: 1.2300, test_f1: 0.6180
 epoch: 56, train_loss: 0.4847, test_loss: 1.1826, test_f1: 0.6395
 epoch: 57, train_loss: 0.4426, test_loss: 1.2458, test_f1: 0.5667
 epoch: 58, train_loss: 0.4607, test_loss: 1.2190, test_f1: 0.6477
 epoch: 59, train_loss: 0.4469, test_loss: 1.2701, test_f1: 0.6278
 epoch: 60, train_loss: 0.4657, test_loss: 1.3347, test_f1: 0.5825
 epoch: 61, train_loss: 0.4653, test_loss: 1.4535, test_f1: 0.6311
 epoch: 62, train_loss: 0.4409, test_loss: 1.4056, test_f1: 0.5816
 epoch: 63, train_loss: 0.4604, test_loss: 1.3254, test_f1: 0.6376
 epoch: 64, train_loss: 0.4185, test_loss: 1.3612, test_f1: 0.5746
 epoch: 65, train_loss: 0.4188, test_loss: 1.3122, test_f1: 0.6080
 epoch: 66, train_loss: 0.4022, test_loss: 1.4666, test_f1: 0.6188
 epoch: 67, train_loss: 0.4092, test_loss: 1.5346, test_f1: 0.6324
 epoch: 68, train_loss: 0.4126, test_loss: 1.4408, test_f1: 0.6192
 epoch: 69, train_loss: 0.4228, test_loss: 1.7101, test_f1: 0.6242
 epoch: 70, train_loss: 0.4130, test_loss: 1.5677, test_f1: 0.6123
 epoch: 71, train_loss: 0.3863, test_loss: 1.5868, test_f1: 0.5894
 epoch: 72, train_loss: 0.4029, test_loss: 1.4011, test_f1: 0.6129
 epoch: 73, train_loss: 0.3909, test_loss: 1.3892, test_f1: 0.6456
 epoch: 74, train_loss: 0.3699, test_loss: 1.4088, test_f1: 0.6165
 epoch: 75, train_loss: 0.3720, test_loss: 1.6398, test_f1: 0.5995
 epoch: 76, train_loss: 0.3809, test_loss: 1.4297, test_f1: 0.6239
 epoch: 77, train_loss: 0.3963, test_loss: 1.2579, test_f1: 0.6609
 epoch: 78, train_loss: 0.3454, test_loss: 1.5466, test_f1: 0.5859
 epoch: 79, train_loss: 0.4011, test_loss: 1.6692, test_f1: 0.5896
 epoch: 80, train_loss: 0.3666, test_loss: 1.5253, test_f1: 0.5910
 epoch: 81, train_loss: 0.3192, test_loss: 1.5757, test_f1: 0.6348
 epoch: 82, train_loss: 0.3528, test_loss: 1.7068, test_f1: 0.5930
 epoch: 83, train_loss: 0.3713, test_loss: 1.5159, test_f1: 0.5820
 epoch: 84, train_loss: 0.3307, test_loss: 1.3478, test_f1: 0.6235
 epoch: 85, train_loss: 0.3434, test_loss: 1.6910, test_f1: 0.5631
 epoch: 86, train_loss: 0.3591, test_loss: 1.4285, test_f1: 0.6537
 epoch: 87, train_loss: 0.3238, test_loss: 1.5066, test_f1: 0.5937
 epoch: 88, train_loss: 0.3528, test_loss: 1.3385, test_f1: 0.6168
 epoch: 89, train_loss: 0.3532, test_loss: 1.6044, test_f1: 0.5358
 epoch: 90, train_loss: 0.3439, test_loss: 1.3413, test_f1: 0.6709
 epoch: 91, train_loss: 0.3422, test_loss: 1.8104, test_f1: 0.6015
 epoch: 92, train_loss: 0.3321, test_loss: 1.6378, test_f1: 0.6167
 epoch: 93, train_loss: 0.3264, test_loss: 1.5580, test_f1: 0.6289
 epoch: 94, train_loss: 0.3475, test_loss: 1.5853, test_f1: 0.6011
 epoch: 95, train_loss: 0.2950, test_loss: 1.4952, test_f1: 0.5977
 epoch: 96, train_loss: 0.3361, test_loss: 1.6810, test_f1: 0.6138
 epoch: 97, train_loss: 0.3619, test_loss: 1.3446, test_f1: 0.6195
 epoch: 98, train_loss: 0.3090, test_loss: 1.6651, test_f1: 0.6070
 epoch: 99, train_loss: 0.3198, test_loss: 1.6315, test_f1: 0.6008
##################ITERATION #8 ****************************************
 epoch: 0, train_loss: 1.1564, test_loss: 1.1825, test_f1: 0.4383
 epoch: 1, train_loss: 0.9308, test_loss: 1.0562, test_f1: 0.4432
 epoch: 2, train_loss: 0.8696, test_loss: 1.0161, test_f1: 0.5699
 epoch: 3, train_loss: 0.8439, test_loss: 1.2802, test_f1: 0.3798
 epoch: 4, train_loss: 0.8373, test_loss: 1.2403, test_f1: 0.4282
 epoch: 5, train_loss: 0.8623, test_loss: 1.0479, test_f1: 0.4560
 epoch: 6, train_loss: 0.8255, test_loss: 1.2187, test_f1: 0.4577
 epoch: 7, train_loss: 0.8360, test_loss: 2.3236, test_f1: 0.3043
 epoch: 8, train_loss: 0.8118, test_loss: 1.0440, test_f1: 0.4436
 epoch: 9, train_loss: 0.7880, test_loss: 1.0335, test_f1: 0.5480
 epoch: 10, train_loss: 0.7827, test_loss: 1.0911, test_f1: 0.5097
 epoch: 11, train_loss: 0.7755, test_loss: 1.1095, test_f1: 0.5307
 epoch: 12, train_loss: 0.7708, test_loss: 1.2555, test_f1: 0.5860
 epoch: 13, train_loss: 0.7894, test_loss: 1.1520, test_f1: 0.4786
 epoch: 14, train_loss: 0.7487, test_loss: 1.4656, test_f1: 0.5484
 epoch: 15, train_loss: 0.7387, test_loss: 1.2809, test_f1: 0.5014
 epoch: 16, train_loss: 0.7361, test_loss: 1.0674, test_f1: 0.5427
 epoch: 17, train_loss: 0.7375, test_loss: 1.1201, test_f1: 0.5774
 epoch: 18, train_loss: 0.7237, test_loss: 1.8013, test_f1: 0.5040
 epoch: 19, train_loss: 0.7234, test_loss: 1.3709, test_f1: 0.5187
 epoch: 20, train_loss: 0.7151, test_loss: 1.4904, test_f1: 0.5487
 epoch: 21, train_loss: 0.7411, test_loss: 1.0616, test_f1: 0.5442
 epoch: 22, train_loss: 0.6970, test_loss: 0.9692, test_f1: 0.6467
 epoch: 23, train_loss: 0.6953, test_loss: 1.0898, test_f1: 0.5707
 epoch: 24, train_loss: 0.6864, test_loss: 1.1420, test_f1: 0.5813
 epoch: 25, train_loss: 0.6741, test_loss: 1.2003, test_f1: 0.5900
 epoch: 26, train_loss: 0.6741, test_loss: 1.3592, test_f1: 0.4233
 epoch: 27, train_loss: 0.6652, test_loss: 1.1229, test_f1: 0.5899
 epoch: 28, train_loss: 0.6647, test_loss: 1.2019, test_f1: 0.6320
 epoch: 29, train_loss: 0.6346, test_loss: 1.1871, test_f1: 0.6051
 epoch: 30, train_loss: 0.6348, test_loss: 1.3502, test_f1: 0.5933
 epoch: 31, train_loss: 0.6320, test_loss: 1.6313, test_f1: 0.5457
 epoch: 32, train_loss: 0.6336, test_loss: 1.6272, test_f1: 0.4582
 epoch: 33, train_loss: 0.6313, test_loss: 1.8232, test_f1: 0.5417
 epoch: 34, train_loss: 0.6049, test_loss: 1.0508, test_f1: 0.6442
 epoch: 35, train_loss: 0.6212, test_loss: 1.1270, test_f1: 0.5959
 epoch: 36, train_loss: 0.6610, test_loss: 1.0824, test_f1: 0.5777
 epoch: 37, train_loss: 0.6324, test_loss: 1.8075, test_f1: 0.5562
 epoch: 38, train_loss: 0.6241, test_loss: 1.5678, test_f1: 0.6103
 epoch: 39, train_loss: 0.6286, test_loss: 1.0759, test_f1: 0.5959
 epoch: 40, train_loss: 0.5946, test_loss: 1.1814, test_f1: 0.6374
 epoch: 41, train_loss: 0.5992, test_loss: 1.5317, test_f1: 0.5726
 epoch: 42, train_loss: 0.5938, test_loss: 1.0527, test_f1: 0.6296
 epoch: 43, train_loss: 0.5857, test_loss: 3.4357, test_f1: 0.4309
 epoch: 44, train_loss: 0.5613, test_loss: 1.4073, test_f1: 0.6446
 epoch: 45, train_loss: 0.5972, test_loss: 1.4134, test_f1: 0.5059
 epoch: 46, train_loss: 0.5754, test_loss: 1.4625, test_f1: 0.6057
 epoch: 47, train_loss: 0.6376, test_loss: 1.3668, test_f1: 0.5847
 epoch: 48, train_loss: 0.5833, test_loss: 1.3886, test_f1: 0.5957
 epoch: 49, train_loss: 0.5999, test_loss: 1.1552, test_f1: 0.5849
 epoch: 50, train_loss: 0.5773, test_loss: 1.3831, test_f1: 0.6481
 epoch: 51, train_loss: 0.5364, test_loss: 1.3771, test_f1: 0.6253
 epoch: 52, train_loss: 0.4775, test_loss: 1.7395, test_f1: 0.5801
 epoch: 53, train_loss: 0.5007, test_loss: 1.3897, test_f1: 0.6409
 epoch: 54, train_loss: 0.4935, test_loss: 1.6375, test_f1: 0.6322
 epoch: 55, train_loss: 0.4669, test_loss: 1.5328, test_f1: 0.6141
 epoch: 56, train_loss: 0.4745, test_loss: 1.7395, test_f1: 0.6406
 epoch: 57, train_loss: 0.4304, test_loss: 1.7430, test_f1: 0.6039
 epoch: 58, train_loss: 0.4469, test_loss: 1.3047, test_f1: 0.6584
 epoch: 59, train_loss: 0.4362, test_loss: 1.6838, test_f1: 0.6310
 epoch: 60, train_loss: 0.4376, test_loss: 1.6697, test_f1: 0.6250
 epoch: 61, train_loss: 0.4199, test_loss: 1.6561, test_f1: 0.6560
 epoch: 62, train_loss: 0.4791, test_loss: 1.7261, test_f1: 0.6404
 epoch: 63, train_loss: 0.4333, test_loss: 1.6238, test_f1: 0.6383
 epoch: 64, train_loss: 0.4288, test_loss: 1.6510, test_f1: 0.6075
 epoch: 65, train_loss: 0.4354, test_loss: 1.7034, test_f1: 0.5682
 epoch: 66, train_loss: 0.4208, test_loss: 1.5699, test_f1: 0.6745
 epoch: 67, train_loss: 0.4141, test_loss: 1.6420, test_f1: 0.6429
 epoch: 68, train_loss: 0.4261, test_loss: 1.3188, test_f1: 0.6168
 epoch: 69, train_loss: 0.3904, test_loss: 1.2842, test_f1: 0.5925
 epoch: 70, train_loss: 0.3959, test_loss: 1.2454, test_f1: 0.6904
 epoch: 71, train_loss: 0.3881, test_loss: 1.6044, test_f1: 0.6308
 epoch: 72, train_loss: 0.4030, test_loss: 1.5835, test_f1: 0.5905
 epoch: 73, train_loss: 0.4214, test_loss: 1.4501, test_f1: 0.6777
 epoch: 74, train_loss: 0.3678, test_loss: 1.5072, test_f1: 0.6190
 epoch: 75, train_loss: 0.3997, test_loss: 1.5030, test_f1: 0.6171
 epoch: 76, train_loss: 0.3641, test_loss: 1.9702, test_f1: 0.6421
 epoch: 77, train_loss: 0.3532, test_loss: 1.8942, test_f1: 0.6170
 epoch: 78, train_loss: 0.3685, test_loss: 1.7761, test_f1: 0.6463
 epoch: 79, train_loss: 0.3655, test_loss: 1.7238, test_f1: 0.6461
 epoch: 80, train_loss: 0.4167, test_loss: 1.9719, test_f1: 0.6236
 epoch: 81, train_loss: 0.3943, test_loss: 1.6801, test_f1: 0.5641
 epoch: 82, train_loss: 0.3662, test_loss: 2.2114, test_f1: 0.6325
 epoch: 83, train_loss: 0.3768, test_loss: 1.9259, test_f1: 0.5787
 epoch: 84, train_loss: 0.3787, test_loss: 2.0045, test_f1: 0.6104
 epoch: 85, train_loss: 0.3293, test_loss: 1.9182, test_f1: 0.6227
 epoch: 86, train_loss: 0.3611, test_loss: 2.0654, test_f1: 0.5971
 epoch: 87, train_loss: 0.3739, test_loss: 2.1068, test_f1: 0.5710
 epoch: 88, train_loss: 0.3679, test_loss: 2.2651, test_f1: 0.5982
 epoch: 89, train_loss: 0.3592, test_loss: 2.0527, test_f1: 0.6179
 epoch: 90, train_loss: 0.3470, test_loss: 2.1393, test_f1: 0.6238
 epoch: 91, train_loss: 0.3551, test_loss: 1.8683, test_f1: 0.6029
 epoch: 92, train_loss: 0.3433, test_loss: 1.8859, test_f1: 0.5654
 epoch: 93, train_loss: 0.2967, test_loss: 1.7634, test_f1: 0.6453
 epoch: 94, train_loss: 0.3844, test_loss: 2.0217, test_f1: 0.6205
 epoch: 95, train_loss: 0.3439, test_loss: 1.9375, test_f1: 0.6001
 epoch: 96, train_loss: 0.2878, test_loss: 2.1418, test_f1: 0.6433
 epoch: 97, train_loss: 0.3090, test_loss: 1.7492, test_f1: 0.5641
 epoch: 98, train_loss: 0.3393, test_loss: 2.0908, test_f1: 0.6552
 epoch: 99, train_loss: 0.3254, test_loss: 1.9672, test_f1: 0.6281
##################ITERATION #9 ****************************************
 epoch: 0, train_loss: 1.1233, test_loss: 1.0923, test_f1: 0.4619
 epoch: 1, train_loss: 0.9366, test_loss: 1.0325, test_f1: 0.5024
 epoch: 2, train_loss: 0.8760, test_loss: 1.0863, test_f1: 0.4341
 epoch: 3, train_loss: 0.8880, test_loss: 1.1046, test_f1: 0.4197
 epoch: 4, train_loss: 0.8822, test_loss: 1.1406, test_f1: 0.4239
 epoch: 5, train_loss: 0.8196, test_loss: 1.0796, test_f1: 0.5316
 epoch: 6, train_loss: 0.8379, test_loss: 1.1182, test_f1: 0.4947
 epoch: 7, train_loss: 0.8163, test_loss: 1.0260, test_f1: 0.5369
 epoch: 8, train_loss: 0.7945, test_loss: 1.1689, test_f1: 0.5025
 epoch: 9, train_loss: 0.8209, test_loss: 1.0467, test_f1: 0.5168
 epoch: 10, train_loss: 0.7891, test_loss: 1.5306, test_f1: 0.5287
 epoch: 11, train_loss: 0.8022, test_loss: 1.1271, test_f1: 0.4944
 epoch: 12, train_loss: 0.7493, test_loss: 1.3534, test_f1: 0.4763
 epoch: 13, train_loss: 0.7619, test_loss: 1.2768, test_f1: 0.5204
 epoch: 14, train_loss: 0.7575, test_loss: 1.2676, test_f1: 0.4987
 epoch: 15, train_loss: 0.7449, test_loss: 1.0311, test_f1: 0.5462
 epoch: 16, train_loss: 0.7465, test_loss: 1.0821, test_f1: 0.5423
 epoch: 17, train_loss: 0.7749, test_loss: 1.1656, test_f1: 0.5435
 epoch: 18, train_loss: 0.7425, test_loss: 1.4162, test_f1: 0.5308
 epoch: 19, train_loss: 0.7452, test_loss: 1.3187, test_f1: 0.5353
 epoch: 20, train_loss: 0.7036, test_loss: 1.8480, test_f1: 0.5249
 epoch: 21, train_loss: 0.6921, test_loss: 1.1443, test_f1: 0.4843
 epoch: 22, train_loss: 0.6916, test_loss: 1.1658, test_f1: 0.5160
 epoch: 23, train_loss: 0.7060, test_loss: 1.0416, test_f1: 0.5490
 epoch: 24, train_loss: 0.6758, test_loss: 1.4797, test_f1: 0.5754
 epoch: 25, train_loss: 0.6705, test_loss: 1.0924, test_f1: 0.5738
 epoch: 26, train_loss: 0.6613, test_loss: 1.3013, test_f1: 0.5372
 epoch: 27, train_loss: 0.6470, test_loss: 1.6858, test_f1: 0.5593
 epoch: 28, train_loss: 0.6771, test_loss: 1.4304, test_f1: 0.5938
 epoch: 29, train_loss: 0.6365, test_loss: 1.4516, test_f1: 0.5550
 epoch: 30, train_loss: 0.6412, test_loss: 1.1217, test_f1: 0.5319
 epoch: 31, train_loss: 0.6441, test_loss: 1.5756, test_f1: 0.5913
 epoch: 32, train_loss: 0.6242, test_loss: 1.3007, test_f1: 0.5627
 epoch: 33, train_loss: 0.6476, test_loss: 1.2443, test_f1: 0.5954
 epoch: 34, train_loss: 0.6334, test_loss: 1.0311, test_f1: 0.5951
 epoch: 35, train_loss: 0.6714, test_loss: 1.3763, test_f1: 0.5501
 epoch: 36, train_loss: 0.6191, test_loss: 1.3180, test_f1: 0.5446
 epoch: 37, train_loss: 0.6123, test_loss: 1.2400, test_f1: 0.5668
 epoch: 38, train_loss: 0.6057, test_loss: 1.1259, test_f1: 0.5628
 epoch: 39, train_loss: 0.6118, test_loss: 1.2718, test_f1: 0.5919
 epoch: 40, train_loss: 0.6116, test_loss: 1.1558, test_f1: 0.6054
 epoch: 41, train_loss: 0.6158, test_loss: 1.1920, test_f1: 0.5739
 epoch: 42, train_loss: 0.5639, test_loss: 1.1029, test_f1: 0.6061
 epoch: 43, train_loss: 0.5994, test_loss: 1.2897, test_f1: 0.5779
 epoch: 44, train_loss: 0.6124, test_loss: 1.3954, test_f1: 0.5180
 epoch: 45, train_loss: 0.5766, test_loss: 1.1323, test_f1: 0.6150
 epoch: 46, train_loss: 0.5608, test_loss: 1.7955, test_f1: 0.6042
 epoch: 47, train_loss: 0.5657, test_loss: 1.2034, test_f1: 0.5758
 epoch: 48, train_loss: 0.5319, test_loss: 1.2827, test_f1: 0.5464
 epoch: 49, train_loss: 0.5863, test_loss: 1.3262, test_f1: 0.6069
 epoch: 50, train_loss: 0.5487, test_loss: 1.3924, test_f1: 0.5359
 epoch: 51, train_loss: 0.5105, test_loss: 1.4349, test_f1: 0.5668
 epoch: 52, train_loss: 0.5176, test_loss: 1.5887, test_f1: 0.5782
 epoch: 53, train_loss: 0.4844, test_loss: 1.6529, test_f1: 0.5859
 epoch: 54, train_loss: 0.5319, test_loss: 1.4987, test_f1: 0.5669
 epoch: 55, train_loss: 0.4773, test_loss: 1.4544, test_f1: 0.5976
 epoch: 56, train_loss: 0.4754, test_loss: 1.1441, test_f1: 0.6307
 epoch: 57, train_loss: 0.4607, test_loss: 1.2932, test_f1: 0.6109
 epoch: 58, train_loss: 0.3990, test_loss: 1.9153, test_f1: 0.5837
 epoch: 59, train_loss: 0.4609, test_loss: 1.5838, test_f1: 0.5861
 epoch: 60, train_loss: 0.4069, test_loss: 1.4045, test_f1: 0.5830
 epoch: 61, train_loss: 0.3952, test_loss: 1.8534, test_f1: 0.5581
 epoch: 62, train_loss: 0.3879, test_loss: 1.9447, test_f1: 0.5826
 epoch: 63, train_loss: 0.3916, test_loss: 2.2457, test_f1: 0.5815
 epoch: 64, train_loss: 0.4202, test_loss: 1.9216, test_f1: 0.5627
 epoch: 65, train_loss: 0.4041, test_loss: 2.0136, test_f1: 0.5816
 epoch: 66, train_loss: 0.4056, test_loss: 1.7928, test_f1: 0.6016
 epoch: 67, train_loss: 0.3761, test_loss: 1.8932, test_f1: 0.5640
 epoch: 68, train_loss: 0.4592, test_loss: 1.7434, test_f1: 0.5526
 epoch: 69, train_loss: 0.3874, test_loss: 1.9022, test_f1: 0.5745
 epoch: 70, train_loss: 0.4103, test_loss: 1.5816, test_f1: 0.6098
 epoch: 71, train_loss: 0.3810, test_loss: 2.0489, test_f1: 0.5814
 epoch: 72, train_loss: 0.4077, test_loss: 2.5660, test_f1: 0.5460
 epoch: 73, train_loss: 0.3814, test_loss: 1.8587, test_f1: 0.5693
 epoch: 74, train_loss: 0.3567, test_loss: 1.8838, test_f1: 0.6094
 epoch: 75, train_loss: 0.3955, test_loss: 1.5816, test_f1: 0.6343
 epoch: 76, train_loss: 0.3532, test_loss: 2.3946, test_f1: 0.5403
 epoch: 77, train_loss: 0.3858, test_loss: 2.0230, test_f1: 0.5777
 epoch: 78, train_loss: 0.3493, test_loss: 1.8197, test_f1: 0.5743
 epoch: 79, train_loss: 0.3533, test_loss: 1.7721, test_f1: 0.5828
 epoch: 80, train_loss: 0.3260, test_loss: 2.1987, test_f1: 0.5874
 epoch: 81, train_loss: 0.3300, test_loss: 2.2048, test_f1: 0.5395
 epoch: 82, train_loss: 0.3676, test_loss: 1.5587, test_f1: 0.6317
 epoch: 83, train_loss: 0.3123, test_loss: 1.8133, test_f1: 0.6160
 epoch: 84, train_loss: 0.3412, test_loss: 1.5802, test_f1: 0.6143
 epoch: 85, train_loss: 0.3357, test_loss: 2.4440, test_f1: 0.5540
 epoch: 86, train_loss: 0.3296, test_loss: 1.7398, test_f1: 0.6195
 epoch: 87, train_loss: 0.3064, test_loss: 1.9100, test_f1: 0.5958
 epoch: 88, train_loss: 0.2775, test_loss: 2.0860, test_f1: 0.5849
 epoch: 89, train_loss: 0.3392, test_loss: 1.8407, test_f1: 0.5703
 epoch: 90, train_loss: 0.3354, test_loss: 1.8430, test_f1: 0.6105
 epoch: 91, train_loss: 0.3547, test_loss: 2.5555, test_f1: 0.5593
 epoch: 92, train_loss: 0.2879, test_loss: 2.6303, test_f1: 0.5741
 epoch: 93, train_loss: 0.3136, test_loss: 2.0240, test_f1: 0.5784
 epoch: 94, train_loss: 0.2915, test_loss: 1.7444, test_f1: 0.6036
 epoch: 95, train_loss: 0.3022, test_loss: 2.3174, test_f1: 0.6138
 epoch: 96, train_loss: 0.2920, test_loss: 2.3133, test_f1: 0.5898
 epoch: 97, train_loss: 0.2876, test_loss: 2.3412, test_f1: 0.6039
 epoch: 98, train_loss: 0.2826, test_loss: 2.7376, test_f1: 0.5651
 epoch: 99, train_loss: 0.2801, test_loss: 2.4710, test_f1: 0.5608

Training completed in 512.10 seconds
Best F1: 0.6981 at epoch 84
Mean F1 across iterations: 0.6620  0.0355
========================FINAL RESULTS================================
FEGIN weighted F1: 0.6981  0.0355
python main.py --data ltspice_demos --representation component_pin_net --model FEGIN --layers 2 --hiddens 128 --batch_size 32 --lr 0.01 --emb_size 128 --epochs 100 --save_appendix component_pin_net_L2_H128_BS32_LR0.01_E128 --no_val
-----



STDERR:
  File "main.py", line 370, in <module>
    main()
  File "main.py", line 254, in main
    dataset = dataset_class(
  File "/home/philip/projects/ltspice_examples_code_repo/Circuit-Completion-Using-GNNs/component_classification_with_link_prediction_head/evaluation/FEGIN/kernel/circuit_datasets.py", line 15, in __init__
    self.data, self.slices = torch.load(self.processed_paths[0])
  File "/home/philip/.local/lib/python3.8/site-packages/torch/serialization.py", line 1040, in load
    warnings.warn(
  File "/usr/lib/python3.8/warnings.py", line 109, in _showwarnmsg
    sw(msg.message, msg.category, msg.filename, msg.lineno,
  File "main.py", line 47, in warn_with_traceback
    traceback.print_stack(file=log)
/home/philip/projects/ltspice_examples_code_repo/Circuit-Completion-Using-GNNs/component_classification_with_link_prediction_head/evaluation/FEGIN/kernel/circuit_datasets.py:15: FutureWarning: You are using `torch.load` with `weights_only=False` (the current default value), which uses the default pickle module implicitly. It is possible to construct malicious pickle data which will execute arbitrary code during unpickling (See https://github.com/pytorch/pytorch/blob/main/SECURITY.md#untrusted-models for more details). In a future release, the default value for `weights_only` will be flipped to `True`. This limits the functions that could be executed during unpickling. Arbitrary objects will no longer be allowed to be loaded via this mode unless they are explicitly allowlisted by the user via `torch.serialization.add_safe_globals`. We recommend you start setting `weights_only=True` for any use case where you don't have full control of the loaded file. Please open an issue on GitHub for any issues related to this experimental feature.
  self.data, self.slices = torch.load(self.processed_paths[0])
