STDOUT:
Results will be saved in /home/philip/projects/ltspice_examples_code_repo/Circuit-Completion-Using-GNNs/component_classification_with_link_prediction_head/evaluation/FEGIN/results/model_FEGIN_dataset_ltspice_examples
Command line input: python main.py --data ltspice_examples --representation component_component --model FEGIN --layers 4 --hiddens 128 --batch_size 128 --lr 0.0001 --emb_size 128 --epochs 100 --save_appendix component_component_L4_H128_BS128_LR0.0001_E128 --no_val
 is saved.
-----
ltspice_examples - FEGIN
Using 4 layers, 128 hidden units, h = 2
Loading component_component representation dataset
ENTERED
Training FEGIN on component_component representation
Train: 3556, Test: 845
##################ITERATION #0 ****************************************
 epoch: 0, train_loss: 1.3581, test_loss: 1.3532, test_f1: 0.2274
 epoch: 1, train_loss: 1.3281, test_loss: 1.3258, test_f1: 0.2274
 epoch: 2, train_loss: 1.3014, test_loss: 1.2935, test_f1: 0.2555
 epoch: 3, train_loss: 1.2746, test_loss: 1.2564, test_f1: 0.2994
 epoch: 4, train_loss: 1.2466, test_loss: 1.2256, test_f1: 0.3143
 epoch: 5, train_loss: 1.2232, test_loss: 1.1969, test_f1: 0.3393
 epoch: 6, train_loss: 1.2004, test_loss: 1.1761, test_f1: 0.3606
 epoch: 7, train_loss: 1.1792, test_loss: 1.1545, test_f1: 0.3748
 epoch: 8, train_loss: 1.1598, test_loss: 1.1319, test_f1: 0.3641
 epoch: 9, train_loss: 1.1422, test_loss: 1.1118, test_f1: 0.4082
 epoch: 10, train_loss: 1.1265, test_loss: 1.1003, test_f1: 0.4276
 epoch: 11, train_loss: 1.1050, test_loss: 1.0867, test_f1: 0.4257
 epoch: 12, train_loss: 1.0846, test_loss: 1.0701, test_f1: 0.4334
 epoch: 13, train_loss: 1.0714, test_loss: 1.0563, test_f1: 0.4386
 epoch: 14, train_loss: 1.0567, test_loss: 1.0413, test_f1: 0.4514
 epoch: 15, train_loss: 1.0363, test_loss: 1.0373, test_f1: 0.4479
 epoch: 16, train_loss: 1.0148, test_loss: 1.0279, test_f1: 0.4481
 epoch: 17, train_loss: 1.0099, test_loss: 1.0151, test_f1: 0.4729
 epoch: 18, train_loss: 0.9952, test_loss: 1.0165, test_f1: 0.4702
 epoch: 19, train_loss: 0.9773, test_loss: 1.0078, test_f1: 0.4762
 epoch: 20, train_loss: 0.9662, test_loss: 0.9986, test_f1: 0.4772
 epoch: 21, train_loss: 0.9494, test_loss: 0.9923, test_f1: 0.4970
 epoch: 22, train_loss: 0.9238, test_loss: 1.0001, test_f1: 0.5009
 epoch: 23, train_loss: 0.9143, test_loss: 1.0200, test_f1: 0.4955
 epoch: 24, train_loss: 0.9034, test_loss: 1.0072, test_f1: 0.5043
 epoch: 25, train_loss: 0.8851, test_loss: 1.0007, test_f1: 0.5054
 epoch: 26, train_loss: 0.8851, test_loss: 1.0022, test_f1: 0.5011
 epoch: 27, train_loss: 0.8636, test_loss: 1.0375, test_f1: 0.4900
 epoch: 28, train_loss: 0.8624, test_loss: 1.0243, test_f1: 0.5046
 epoch: 29, train_loss: 0.8520, test_loss: 1.0814, test_f1: 0.5000
 epoch: 30, train_loss: 0.8266, test_loss: 1.0592, test_f1: 0.4910
 epoch: 31, train_loss: 0.8229, test_loss: 1.0733, test_f1: 0.4912
 epoch: 32, train_loss: 0.8049, test_loss: 1.0746, test_f1: 0.4860
 epoch: 33, train_loss: 0.7994, test_loss: 1.0651, test_f1: 0.5190
 epoch: 34, train_loss: 0.7903, test_loss: 1.0711, test_f1: 0.5279
 epoch: 35, train_loss: 0.7819, test_loss: 1.0679, test_f1: 0.4965
 epoch: 36, train_loss: 0.7751, test_loss: 1.0664, test_f1: 0.5021
 epoch: 37, train_loss: 0.7702, test_loss: 1.1057, test_f1: 0.5161
 epoch: 38, train_loss: 0.7510, test_loss: 1.1049, test_f1: 0.5143
 epoch: 39, train_loss: 0.7393, test_loss: 1.1299, test_f1: 0.5283
 epoch: 40, train_loss: 0.7360, test_loss: 1.1380, test_f1: 0.5075
 epoch: 41, train_loss: 0.7365, test_loss: 1.2100, test_f1: 0.5038
 epoch: 42, train_loss: 0.7248, test_loss: 1.0795, test_f1: 0.5381
 epoch: 43, train_loss: 0.7126, test_loss: 1.1638, test_f1: 0.5049
 epoch: 44, train_loss: 0.7012, test_loss: 1.1896, test_f1: 0.5167
 epoch: 45, train_loss: 0.6953, test_loss: 1.1787, test_f1: 0.5024
 epoch: 46, train_loss: 0.6972, test_loss: 1.2123, test_f1: 0.5228
 epoch: 47, train_loss: 0.6856, test_loss: 1.2142, test_f1: 0.5029
 epoch: 48, train_loss: 0.6661, test_loss: 1.1972, test_f1: 0.5137
 epoch: 49, train_loss: 0.6861, test_loss: 1.2357, test_f1: 0.5266
 epoch: 50, train_loss: 0.6534, test_loss: 1.2901, test_f1: 0.5016
 epoch: 51, train_loss: 0.6517, test_loss: 1.1792, test_f1: 0.5335
 epoch: 52, train_loss: 0.6340, test_loss: 1.2434, test_f1: 0.5135
 epoch: 53, train_loss: 0.6351, test_loss: 1.2441, test_f1: 0.5358
 epoch: 54, train_loss: 0.6389, test_loss: 1.1894, test_f1: 0.5270
 epoch: 55, train_loss: 0.6214, test_loss: 1.2952, test_f1: 0.5159
 epoch: 56, train_loss: 0.6248, test_loss: 1.2840, test_f1: 0.5275
 epoch: 57, train_loss: 0.6194, test_loss: 1.2740, test_f1: 0.5194
 epoch: 58, train_loss: 0.6140, test_loss: 1.3201, test_f1: 0.5343
 epoch: 59, train_loss: 0.6031, test_loss: 1.3374, test_f1: 0.5183
 epoch: 60, train_loss: 0.6204, test_loss: 1.2876, test_f1: 0.5177
 epoch: 61, train_loss: 0.6099, test_loss: 1.3491, test_f1: 0.5227
 epoch: 62, train_loss: 0.5956, test_loss: 1.3074, test_f1: 0.5189
 epoch: 63, train_loss: 0.6088, test_loss: 1.3051, test_f1: 0.5200
 epoch: 64, train_loss: 0.6027, test_loss: 1.3581, test_f1: 0.5311
 epoch: 65, train_loss: 0.6046, test_loss: 1.3599, test_f1: 0.5358
 epoch: 66, train_loss: 0.5956, test_loss: 1.3742, test_f1: 0.5276
 epoch: 67, train_loss: 0.5905, test_loss: 1.3531, test_f1: 0.5289
 epoch: 68, train_loss: 0.5894, test_loss: 1.3433, test_f1: 0.5412
 epoch: 69, train_loss: 0.5748, test_loss: 1.3671, test_f1: 0.5323
 epoch: 70, train_loss: 0.5723, test_loss: 1.3606, test_f1: 0.5298
 epoch: 71, train_loss: 0.5724, test_loss: 1.4041, test_f1: 0.5465
 epoch: 72, train_loss: 0.5861, test_loss: 1.3184, test_f1: 0.5357
 epoch: 73, train_loss: 0.5676, test_loss: 1.3928, test_f1: 0.5247
 epoch: 74, train_loss: 0.5694, test_loss: 1.3988, test_f1: 0.5380
 epoch: 75, train_loss: 0.5660, test_loss: 1.4239, test_f1: 0.5275
 epoch: 76, train_loss: 0.5508, test_loss: 1.4339, test_f1: 0.5368
 epoch: 77, train_loss: 0.5614, test_loss: 1.4179, test_f1: 0.5319
 epoch: 78, train_loss: 0.5746, test_loss: 1.4066, test_f1: 0.5347
 epoch: 79, train_loss: 0.5441, test_loss: 1.3985, test_f1: 0.5418
 epoch: 80, train_loss: 0.5510, test_loss: 1.3888, test_f1: 0.5432
 epoch: 81, train_loss: 0.5461, test_loss: 1.4115, test_f1: 0.5326
 epoch: 82, train_loss: 0.5383, test_loss: 1.4278, test_f1: 0.5498
 epoch: 83, train_loss: 0.5330, test_loss: 1.4295, test_f1: 0.5424
 epoch: 84, train_loss: 0.5479, test_loss: 1.4440, test_f1: 0.5421
 epoch: 85, train_loss: 0.5325, test_loss: 1.4316, test_f1: 0.5406
 epoch: 86, train_loss: 0.5327, test_loss: 1.4494, test_f1: 0.5337
 epoch: 87, train_loss: 0.5393, test_loss: 1.4190, test_f1: 0.5392
 epoch: 88, train_loss: 0.5444, test_loss: 1.4232, test_f1: 0.5303
 epoch: 89, train_loss: 0.5268, test_loss: 1.3913, test_f1: 0.5412
 epoch: 90, train_loss: 0.5119, test_loss: 1.4662, test_f1: 0.5199
 epoch: 91, train_loss: 0.5293, test_loss: 1.4391, test_f1: 0.5387
 epoch: 92, train_loss: 0.5146, test_loss: 1.4583, test_f1: 0.5281
 epoch: 93, train_loss: 0.5164, test_loss: 1.5324, test_f1: 0.5253
 epoch: 94, train_loss: 0.5285, test_loss: 1.5317, test_f1: 0.5362
 epoch: 95, train_loss: 0.5218, test_loss: 1.4841, test_f1: 0.5418
 epoch: 96, train_loss: 0.5123, test_loss: 1.5753, test_f1: 0.5366
 epoch: 97, train_loss: 0.5260, test_loss: 1.4722, test_f1: 0.5305
 epoch: 98, train_loss: 0.5154, test_loss: 1.5117, test_f1: 0.5373
 epoch: 99, train_loss: 0.4949, test_loss: 1.4757, test_f1: 0.5338
##################ITERATION #1 ****************************************
 epoch: 0, train_loss: 1.3099, test_loss: 1.3011, test_f1: 0.2274
 epoch: 1, train_loss: 1.2469, test_loss: 1.2461, test_f1: 0.2555
 epoch: 2, train_loss: 1.2159, test_loss: 1.2036, test_f1: 0.3418
 epoch: 3, train_loss: 1.1926, test_loss: 1.1922, test_f1: 0.3955
 epoch: 4, train_loss: 1.1689, test_loss: 1.2042, test_f1: 0.4112
 epoch: 5, train_loss: 1.1544, test_loss: 1.1803, test_f1: 0.4132
 epoch: 6, train_loss: 1.1295, test_loss: 1.1713, test_f1: 0.4344
 epoch: 7, train_loss: 1.1183, test_loss: 1.1801, test_f1: 0.4427
 epoch: 8, train_loss: 1.1002, test_loss: 1.1507, test_f1: 0.4464
 epoch: 9, train_loss: 1.0794, test_loss: 1.1583, test_f1: 0.4328
 epoch: 10, train_loss: 1.0597, test_loss: 1.1691, test_f1: 0.4553
 epoch: 11, train_loss: 1.0389, test_loss: 1.1783, test_f1: 0.4546
 epoch: 12, train_loss: 1.0156, test_loss: 1.1768, test_f1: 0.4545
 epoch: 13, train_loss: 1.0018, test_loss: 1.1885, test_f1: 0.4671
 epoch: 14, train_loss: 0.9826, test_loss: 1.1814, test_f1: 0.4560
 epoch: 15, train_loss: 0.9638, test_loss: 1.1213, test_f1: 0.4595
 epoch: 16, train_loss: 0.9509, test_loss: 1.1317, test_f1: 0.4633
 epoch: 17, train_loss: 0.9347, test_loss: 1.1988, test_f1: 0.4458
 epoch: 18, train_loss: 0.9233, test_loss: 1.1846, test_f1: 0.4472
 epoch: 19, train_loss: 0.9015, test_loss: 1.1910, test_f1: 0.4550
 epoch: 20, train_loss: 0.8899, test_loss: 1.1961, test_f1: 0.4451
 epoch: 21, train_loss: 0.8710, test_loss: 1.2521, test_f1: 0.4477
 epoch: 22, train_loss: 0.8623, test_loss: 1.1394, test_f1: 0.4729
 epoch: 23, train_loss: 0.8587, test_loss: 1.1666, test_f1: 0.4533
 epoch: 24, train_loss: 0.8555, test_loss: 1.2593, test_f1: 0.4612
 epoch: 25, train_loss: 0.8326, test_loss: 1.3591, test_f1: 0.4688
 epoch: 26, train_loss: 0.8143, test_loss: 1.1592, test_f1: 0.4822
 epoch: 27, train_loss: 0.8144, test_loss: 1.1710, test_f1: 0.4831
 epoch: 28, train_loss: 0.7955, test_loss: 1.1948, test_f1: 0.4965
 epoch: 29, train_loss: 0.7900, test_loss: 1.1991, test_f1: 0.4776
 epoch: 30, train_loss: 0.7902, test_loss: 1.0959, test_f1: 0.4672
 epoch: 31, train_loss: 0.7711, test_loss: 1.0853, test_f1: 0.4684
 epoch: 32, train_loss: 0.7674, test_loss: 1.1211, test_f1: 0.4785
 epoch: 33, train_loss: 0.7461, test_loss: 1.1011, test_f1: 0.4705
 epoch: 34, train_loss: 0.7429, test_loss: 1.0719, test_f1: 0.4981
 epoch: 35, train_loss: 0.7312, test_loss: 1.0831, test_f1: 0.4838
 epoch: 36, train_loss: 0.7229, test_loss: 1.1186, test_f1: 0.4761
 epoch: 37, train_loss: 0.7169, test_loss: 1.1218, test_f1: 0.4701
 epoch: 38, train_loss: 0.7164, test_loss: 1.1147, test_f1: 0.4892
 epoch: 39, train_loss: 0.6984, test_loss: 1.1218, test_f1: 0.4858
 epoch: 40, train_loss: 0.6858, test_loss: 1.1398, test_f1: 0.4950
 epoch: 41, train_loss: 0.6721, test_loss: 1.1686, test_f1: 0.4897
 epoch: 42, train_loss: 0.6787, test_loss: 1.1687, test_f1: 0.5036
 epoch: 43, train_loss: 0.6697, test_loss: 1.1997, test_f1: 0.4725
 epoch: 44, train_loss: 0.6676, test_loss: 1.2290, test_f1: 0.4933
 epoch: 45, train_loss: 0.6627, test_loss: 1.1847, test_f1: 0.4993
 epoch: 46, train_loss: 0.6563, test_loss: 1.2066, test_f1: 0.4935
 epoch: 47, train_loss: 0.6482, test_loss: 1.3205, test_f1: 0.4805
 epoch: 48, train_loss: 0.6495, test_loss: 1.2936, test_f1: 0.4900
 epoch: 49, train_loss: 0.6543, test_loss: 1.2800, test_f1: 0.4631
 epoch: 50, train_loss: 0.6301, test_loss: 1.2075, test_f1: 0.5014
 epoch: 51, train_loss: 0.6086, test_loss: 1.3300, test_f1: 0.5026
 epoch: 52, train_loss: 0.5904, test_loss: 1.2649, test_f1: 0.5091
 epoch: 53, train_loss: 0.5956, test_loss: 1.3315, test_f1: 0.4863
 epoch: 54, train_loss: 0.5817, test_loss: 1.2700, test_f1: 0.4970
 epoch: 55, train_loss: 0.5759, test_loss: 1.3235, test_f1: 0.4985
 epoch: 56, train_loss: 0.6000, test_loss: 1.3161, test_f1: 0.4998
 epoch: 57, train_loss: 0.5767, test_loss: 1.3489, test_f1: 0.4878
 epoch: 58, train_loss: 0.5704, test_loss: 1.3274, test_f1: 0.5014
 epoch: 59, train_loss: 0.5826, test_loss: 1.3590, test_f1: 0.4886
 epoch: 60, train_loss: 0.5865, test_loss: 1.3800, test_f1: 0.4996
 epoch: 61, train_loss: 0.5674, test_loss: 1.3826, test_f1: 0.5042
 epoch: 62, train_loss: 0.5815, test_loss: 1.4001, test_f1: 0.4894
 epoch: 63, train_loss: 0.5634, test_loss: 1.4160, test_f1: 0.4929
 epoch: 64, train_loss: 0.5468, test_loss: 1.4270, test_f1: 0.5029
 epoch: 65, train_loss: 0.5627, test_loss: 1.4173, test_f1: 0.4981
 epoch: 66, train_loss: 0.5418, test_loss: 1.4226, test_f1: 0.5085
 epoch: 67, train_loss: 0.5528, test_loss: 1.4003, test_f1: 0.5034
 epoch: 68, train_loss: 0.5604, test_loss: 1.4319, test_f1: 0.4958
 epoch: 69, train_loss: 0.5528, test_loss: 1.4823, test_f1: 0.4945
 epoch: 70, train_loss: 0.5316, test_loss: 1.4454, test_f1: 0.4921
 epoch: 71, train_loss: 0.5378, test_loss: 1.4605, test_f1: 0.5078
 epoch: 72, train_loss: 0.5429, test_loss: 1.4552, test_f1: 0.5059
 epoch: 73, train_loss: 0.5405, test_loss: 1.4405, test_f1: 0.5023
 epoch: 74, train_loss: 0.5374, test_loss: 1.4158, test_f1: 0.5000
 epoch: 75, train_loss: 0.5343, test_loss: 1.4721, test_f1: 0.5095
 epoch: 76, train_loss: 0.5188, test_loss: 1.5290, test_f1: 0.5049
 epoch: 77, train_loss: 0.5296, test_loss: 1.5204, test_f1: 0.4955
 epoch: 78, train_loss: 0.5229, test_loss: 1.5139, test_f1: 0.4847
 epoch: 79, train_loss: 0.5102, test_loss: 1.5307, test_f1: 0.5007
 epoch: 80, train_loss: 0.5200, test_loss: 1.5200, test_f1: 0.4969
 epoch: 81, train_loss: 0.5111, test_loss: 1.5093, test_f1: 0.5004
 epoch: 82, train_loss: 0.5120, test_loss: 1.5507, test_f1: 0.5006
 epoch: 83, train_loss: 0.5078, test_loss: 1.5421, test_f1: 0.4996
 epoch: 84, train_loss: 0.5059, test_loss: 1.5152, test_f1: 0.5049
 epoch: 85, train_loss: 0.4879, test_loss: 1.5849, test_f1: 0.4918
 epoch: 86, train_loss: 0.4972, test_loss: 1.6069, test_f1: 0.5088
 epoch: 87, train_loss: 0.4965, test_loss: 1.5894, test_f1: 0.4905
 epoch: 88, train_loss: 0.5056, test_loss: 1.6414, test_f1: 0.4940
 epoch: 89, train_loss: 0.4975, test_loss: 1.5952, test_f1: 0.5081
 epoch: 90, train_loss: 0.4958, test_loss: 1.5528, test_f1: 0.5149
 epoch: 91, train_loss: 0.4972, test_loss: 1.6273, test_f1: 0.5157
 epoch: 92, train_loss: 0.4786, test_loss: 1.5715, test_f1: 0.5110
 epoch: 93, train_loss: 0.4896, test_loss: 1.5904, test_f1: 0.5040
 epoch: 94, train_loss: 0.4739, test_loss: 1.6106, test_f1: 0.5054
 epoch: 95, train_loss: 0.4666, test_loss: 1.6210, test_f1: 0.5038
 epoch: 96, train_loss: 0.4905, test_loss: 1.6387, test_f1: 0.5145
 epoch: 97, train_loss: 0.4602, test_loss: 1.6167, test_f1: 0.5132
 epoch: 98, train_loss: 0.4853, test_loss: 1.6738, test_f1: 0.4994
 epoch: 99, train_loss: 0.4816, test_loss: 1.5949, test_f1: 0.5126
##################ITERATION #2 ****************************************
 epoch: 0, train_loss: 1.3084, test_loss: 1.2786, test_f1: 0.2555
 epoch: 1, train_loss: 1.2152, test_loss: 1.2091, test_f1: 0.2814
 epoch: 2, train_loss: 1.1857, test_loss: 1.1520, test_f1: 0.4634
 epoch: 3, train_loss: 1.1654, test_loss: 1.1260, test_f1: 0.4649
 epoch: 4, train_loss: 1.1364, test_loss: 1.1049, test_f1: 0.4723
 epoch: 5, train_loss: 1.1229, test_loss: 1.0961, test_f1: 0.4571
 epoch: 6, train_loss: 1.1022, test_loss: 1.0784, test_f1: 0.4761
 epoch: 7, train_loss: 1.0824, test_loss: 1.0680, test_f1: 0.4810
 epoch: 8, train_loss: 1.0725, test_loss: 1.0614, test_f1: 0.4726
 epoch: 9, train_loss: 1.0618, test_loss: 1.0496, test_f1: 0.4834
 epoch: 10, train_loss: 1.0445, test_loss: 1.0369, test_f1: 0.4489
 epoch: 11, train_loss: 1.0376, test_loss: 1.0266, test_f1: 0.4700
 epoch: 12, train_loss: 1.0152, test_loss: 1.0271, test_f1: 0.4571
 epoch: 13, train_loss: 1.0056, test_loss: 1.0175, test_f1: 0.4711
 epoch: 14, train_loss: 0.9870, test_loss: 1.0207, test_f1: 0.4523
 epoch: 15, train_loss: 0.9764, test_loss: 0.9979, test_f1: 0.4695
 epoch: 16, train_loss: 0.9637, test_loss: 1.0052, test_f1: 0.4830
 epoch: 17, train_loss: 0.9583, test_loss: 0.9986, test_f1: 0.4830
 epoch: 18, train_loss: 0.9402, test_loss: 1.0027, test_f1: 0.4618
 epoch: 19, train_loss: 0.9294, test_loss: 1.0088, test_f1: 0.4955
 epoch: 20, train_loss: 0.9218, test_loss: 1.0056, test_f1: 0.4811
 epoch: 21, train_loss: 0.8974, test_loss: 0.9764, test_f1: 0.5161
 epoch: 22, train_loss: 0.8850, test_loss: 1.0143, test_f1: 0.5042
 epoch: 23, train_loss: 0.8715, test_loss: 0.9961, test_f1: 0.5005
 epoch: 24, train_loss: 0.8773, test_loss: 1.0189, test_f1: 0.4942
 epoch: 25, train_loss: 0.8666, test_loss: 0.9833, test_f1: 0.5172
 epoch: 26, train_loss: 0.8478, test_loss: 1.0305, test_f1: 0.5069
 epoch: 27, train_loss: 0.8349, test_loss: 1.0182, test_f1: 0.5108
 epoch: 28, train_loss: 0.8257, test_loss: 1.0036, test_f1: 0.5074
 epoch: 29, train_loss: 0.8172, test_loss: 1.0197, test_f1: 0.4976
 epoch: 30, train_loss: 0.8041, test_loss: 1.0078, test_f1: 0.5332
 epoch: 31, train_loss: 0.7882, test_loss: 1.0438, test_f1: 0.5047
 epoch: 32, train_loss: 0.7893, test_loss: 1.0465, test_f1: 0.5320
 epoch: 33, train_loss: 0.7825, test_loss: 1.0492, test_f1: 0.5172
 epoch: 34, train_loss: 0.7564, test_loss: 1.0924, test_f1: 0.5151
 epoch: 35, train_loss: 0.7581, test_loss: 1.0669, test_f1: 0.5092
 epoch: 36, train_loss: 0.7441, test_loss: 1.0860, test_f1: 0.5084
 epoch: 37, train_loss: 0.7340, test_loss: 1.0638, test_f1: 0.5438
 epoch: 38, train_loss: 0.7299, test_loss: 1.1141, test_f1: 0.5228
 epoch: 39, train_loss: 0.7147, test_loss: 1.1060, test_f1: 0.5217
 epoch: 40, train_loss: 0.7034, test_loss: 1.1066, test_f1: 0.5310
 epoch: 41, train_loss: 0.7114, test_loss: 1.1072, test_f1: 0.5285
 epoch: 42, train_loss: 0.7061, test_loss: 1.1409, test_f1: 0.5136
 epoch: 43, train_loss: 0.6857, test_loss: 1.1630, test_f1: 0.5207
 epoch: 44, train_loss: 0.6987, test_loss: 1.1437, test_f1: 0.5431
 epoch: 45, train_loss: 0.6844, test_loss: 1.1633, test_f1: 0.5330
 epoch: 46, train_loss: 0.6624, test_loss: 1.1824, test_f1: 0.5354
 epoch: 47, train_loss: 0.6630, test_loss: 1.1813, test_f1: 0.5278
 epoch: 48, train_loss: 0.6623, test_loss: 1.2050, test_f1: 0.5296
 epoch: 49, train_loss: 0.6538, test_loss: 1.1365, test_f1: 0.5428
 epoch: 50, train_loss: 0.6428, test_loss: 1.2589, test_f1: 0.5214
 epoch: 51, train_loss: 0.6272, test_loss: 1.2250, test_f1: 0.5326
 epoch: 52, train_loss: 0.6171, test_loss: 1.2336, test_f1: 0.5143
 epoch: 53, train_loss: 0.6157, test_loss: 1.2457, test_f1: 0.5236
 epoch: 54, train_loss: 0.6135, test_loss: 1.2519, test_f1: 0.5361
 epoch: 55, train_loss: 0.5978, test_loss: 1.2607, test_f1: 0.5259
 epoch: 56, train_loss: 0.5810, test_loss: 1.2195, test_f1: 0.5308
 epoch: 57, train_loss: 0.5883, test_loss: 1.2769, test_f1: 0.5263
 epoch: 58, train_loss: 0.5783, test_loss: 1.2636, test_f1: 0.5183
 epoch: 59, train_loss: 0.5889, test_loss: 1.2421, test_f1: 0.5221
 epoch: 60, train_loss: 0.5808, test_loss: 1.2576, test_f1: 0.5476
 epoch: 61, train_loss: 0.5887, test_loss: 1.2983, test_f1: 0.5287
 epoch: 62, train_loss: 0.5684, test_loss: 1.2850, test_f1: 0.5278
 epoch: 63, train_loss: 0.5632, test_loss: 1.3053, test_f1: 0.5255
 epoch: 64, train_loss: 0.5656, test_loss: 1.3128, test_f1: 0.5319
 epoch: 65, train_loss: 0.5698, test_loss: 1.2963, test_f1: 0.5283
 epoch: 66, train_loss: 0.5469, test_loss: 1.3134, test_f1: 0.5286
 epoch: 67, train_loss: 0.5592, test_loss: 1.2995, test_f1: 0.5378
 epoch: 68, train_loss: 0.5608, test_loss: 1.3419, test_f1: 0.5404
 epoch: 69, train_loss: 0.5470, test_loss: 1.3320, test_f1: 0.5240
 epoch: 70, train_loss: 0.5596, test_loss: 1.3986, test_f1: 0.5249
 epoch: 71, train_loss: 0.5524, test_loss: 1.3697, test_f1: 0.5366
 epoch: 72, train_loss: 0.5632, test_loss: 1.3626, test_f1: 0.5239
 epoch: 73, train_loss: 0.5323, test_loss: 1.4009, test_f1: 0.5305
 epoch: 74, train_loss: 0.5175, test_loss: 1.3490, test_f1: 0.5242
 epoch: 75, train_loss: 0.5400, test_loss: 1.3714, test_f1: 0.5389
 epoch: 76, train_loss: 0.5242, test_loss: 1.4401, test_f1: 0.5196
 epoch: 77, train_loss: 0.5365, test_loss: 1.4146, test_f1: 0.5364
 epoch: 78, train_loss: 0.5144, test_loss: 1.4393, test_f1: 0.5291
 epoch: 79, train_loss: 0.5154, test_loss: 1.4175, test_f1: 0.5218
 epoch: 80, train_loss: 0.5169, test_loss: 1.3992, test_f1: 0.5134
 epoch: 81, train_loss: 0.5124, test_loss: 1.3941, test_f1: 0.5325
 epoch: 82, train_loss: 0.5213, test_loss: 1.4848, test_f1: 0.5180
 epoch: 83, train_loss: 0.5057, test_loss: 1.4456, test_f1: 0.5364
 epoch: 84, train_loss: 0.5230, test_loss: 1.4346, test_f1: 0.5321
 epoch: 85, train_loss: 0.4949, test_loss: 1.4952, test_f1: 0.5280
 epoch: 86, train_loss: 0.4997, test_loss: 1.4645, test_f1: 0.5370
 epoch: 87, train_loss: 0.4998, test_loss: 1.4909, test_f1: 0.5244
 epoch: 88, train_loss: 0.5080, test_loss: 1.4499, test_f1: 0.5315
 epoch: 89, train_loss: 0.5083, test_loss: 1.4808, test_f1: 0.5405
 epoch: 90, train_loss: 0.4974, test_loss: 1.5172, test_f1: 0.5318
 epoch: 91, train_loss: 0.4756, test_loss: 1.5515, test_f1: 0.5218
 epoch: 92, train_loss: 0.4758, test_loss: 1.5325, test_f1: 0.5280
 epoch: 93, train_loss: 0.4823, test_loss: 1.4906, test_f1: 0.5380
 epoch: 94, train_loss: 0.4864, test_loss: 1.5496, test_f1: 0.5291
 epoch: 95, train_loss: 0.4885, test_loss: 1.5203, test_f1: 0.5336
 epoch: 96, train_loss: 0.4636, test_loss: 1.5717, test_f1: 0.5386
 epoch: 97, train_loss: 0.4671, test_loss: 1.5557, test_f1: 0.5143
 epoch: 98, train_loss: 0.4658, test_loss: 1.5819, test_f1: 0.5261
 epoch: 99, train_loss: 0.4673, test_loss: 1.5718, test_f1: 0.5341
##################ITERATION #3 ****************************************
 epoch: 0, train_loss: 1.2786, test_loss: 1.2674, test_f1: 0.3103
 epoch: 1, train_loss: 1.2008, test_loss: 1.1856, test_f1: 0.4216
 epoch: 2, train_loss: 1.1659, test_loss: 1.1369, test_f1: 0.4283
 epoch: 3, train_loss: 1.1519, test_loss: 1.1092, test_f1: 0.4425
 epoch: 4, train_loss: 1.1284, test_loss: 1.0944, test_f1: 0.4449
 epoch: 5, train_loss: 1.1075, test_loss: 1.0787, test_f1: 0.4320
 epoch: 6, train_loss: 1.0965, test_loss: 1.0716, test_f1: 0.4339
 epoch: 7, train_loss: 1.0779, test_loss: 1.0624, test_f1: 0.4377
 epoch: 8, train_loss: 1.0674, test_loss: 1.0531, test_f1: 0.4435
 epoch: 9, train_loss: 1.0426, test_loss: 1.0468, test_f1: 0.4501
 epoch: 10, train_loss: 1.0351, test_loss: 1.0338, test_f1: 0.4655
 epoch: 11, train_loss: 1.0226, test_loss: 1.0317, test_f1: 0.4619
 epoch: 12, train_loss: 1.0036, test_loss: 1.0202, test_f1: 0.4485
 epoch: 13, train_loss: 0.9981, test_loss: 1.0242, test_f1: 0.4556
 epoch: 14, train_loss: 0.9876, test_loss: 1.0129, test_f1: 0.4622
 epoch: 15, train_loss: 0.9792, test_loss: 1.0097, test_f1: 0.4688
 epoch: 16, train_loss: 0.9660, test_loss: 1.0138, test_f1: 0.4806
 epoch: 17, train_loss: 0.9458, test_loss: 0.9999, test_f1: 0.4770
 epoch: 18, train_loss: 0.9320, test_loss: 1.0069, test_f1: 0.5000
 epoch: 19, train_loss: 0.9284, test_loss: 1.0008, test_f1: 0.4839
 epoch: 20, train_loss: 0.9147, test_loss: 1.0001, test_f1: 0.4856
 epoch: 21, train_loss: 0.9058, test_loss: 1.0102, test_f1: 0.4954
 epoch: 22, train_loss: 0.8996, test_loss: 0.9913, test_f1: 0.4971
 epoch: 23, train_loss: 0.8823, test_loss: 1.0027, test_f1: 0.4984
 epoch: 24, train_loss: 0.8718, test_loss: 0.9901, test_f1: 0.5123
 epoch: 25, train_loss: 0.8582, test_loss: 1.0094, test_f1: 0.4982
 epoch: 26, train_loss: 0.8536, test_loss: 1.0057, test_f1: 0.5134
 epoch: 27, train_loss: 0.8397, test_loss: 1.0013, test_f1: 0.5060
 epoch: 28, train_loss: 0.8363, test_loss: 1.0429, test_f1: 0.4917
 epoch: 29, train_loss: 0.8196, test_loss: 1.0415, test_f1: 0.5037
 epoch: 30, train_loss: 0.8129, test_loss: 1.0246, test_f1: 0.4971
 epoch: 31, train_loss: 0.8086, test_loss: 1.0148, test_f1: 0.5078
 epoch: 32, train_loss: 0.7921, test_loss: 1.0422, test_f1: 0.4809
 epoch: 33, train_loss: 0.7835, test_loss: 1.0750, test_f1: 0.5070
 epoch: 34, train_loss: 0.7937, test_loss: 1.0624, test_f1: 0.5022
 epoch: 35, train_loss: 0.7809, test_loss: 1.0907, test_f1: 0.4978
 epoch: 36, train_loss: 0.7891, test_loss: 1.0613, test_f1: 0.5206
 epoch: 37, train_loss: 0.7681, test_loss: 1.0546, test_f1: 0.4854
 epoch: 38, train_loss: 0.7580, test_loss: 1.0823, test_f1: 0.4996
 epoch: 39, train_loss: 0.7391, test_loss: 1.1128, test_f1: 0.4976
 epoch: 40, train_loss: 0.7380, test_loss: 1.0944, test_f1: 0.4995
 epoch: 41, train_loss: 0.7379, test_loss: 1.0754, test_f1: 0.5143
 epoch: 42, train_loss: 0.7098, test_loss: 1.1152, test_f1: 0.5091
 epoch: 43, train_loss: 0.7003, test_loss: 1.1351, test_f1: 0.5073
 epoch: 44, train_loss: 0.6966, test_loss: 1.1640, test_f1: 0.5016
 epoch: 45, train_loss: 0.6943, test_loss: 1.1529, test_f1: 0.5139
 epoch: 46, train_loss: 0.6886, test_loss: 1.1682, test_f1: 0.5095
 epoch: 47, train_loss: 0.6762, test_loss: 1.2029, test_f1: 0.5034
 epoch: 48, train_loss: 0.6698, test_loss: 1.1950, test_f1: 0.5187
 epoch: 49, train_loss: 0.6652, test_loss: 1.2153, test_f1: 0.5133
 epoch: 50, train_loss: 0.6697, test_loss: 1.1938, test_f1: 0.5064
 epoch: 51, train_loss: 0.6547, test_loss: 1.2064, test_f1: 0.5244
 epoch: 52, train_loss: 0.6457, test_loss: 1.2217, test_f1: 0.5224
 epoch: 53, train_loss: 0.6231, test_loss: 1.2371, test_f1: 0.5128
 epoch: 54, train_loss: 0.6358, test_loss: 1.2192, test_f1: 0.5085
 epoch: 55, train_loss: 0.6167, test_loss: 1.2132, test_f1: 0.5260
 epoch: 56, train_loss: 0.6211, test_loss: 1.2138, test_f1: 0.5306
 epoch: 57, train_loss: 0.6279, test_loss: 1.2457, test_f1: 0.5139
 epoch: 58, train_loss: 0.6181, test_loss: 1.2628, test_f1: 0.5165
 epoch: 59, train_loss: 0.6130, test_loss: 1.2445, test_f1: 0.5229
 epoch: 60, train_loss: 0.6039, test_loss: 1.2796, test_f1: 0.5162
 epoch: 61, train_loss: 0.5939, test_loss: 1.2657, test_f1: 0.5171
 epoch: 62, train_loss: 0.5930, test_loss: 1.2566, test_f1: 0.5149
 epoch: 63, train_loss: 0.5939, test_loss: 1.2825, test_f1: 0.5189
 epoch: 64, train_loss: 0.6007, test_loss: 1.2594, test_f1: 0.5123
 epoch: 65, train_loss: 0.5900, test_loss: 1.3143, test_f1: 0.5105
 epoch: 66, train_loss: 0.6034, test_loss: 1.2770, test_f1: 0.5200
 epoch: 67, train_loss: 0.5834, test_loss: 1.2965, test_f1: 0.5315
 epoch: 68, train_loss: 0.5912, test_loss: 1.3230, test_f1: 0.5292
 epoch: 69, train_loss: 0.5666, test_loss: 1.2993, test_f1: 0.5153
 epoch: 70, train_loss: 0.5695, test_loss: 1.3151, test_f1: 0.5205
 epoch: 71, train_loss: 0.5710, test_loss: 1.3000, test_f1: 0.5308
 epoch: 72, train_loss: 0.5836, test_loss: 1.2912, test_f1: 0.5287
 epoch: 73, train_loss: 0.5739, test_loss: 1.3181, test_f1: 0.5181
 epoch: 74, train_loss: 0.5676, test_loss: 1.3272, test_f1: 0.5160
 epoch: 75, train_loss: 0.5479, test_loss: 1.3145, test_f1: 0.5309
 epoch: 76, train_loss: 0.5613, test_loss: 1.3455, test_f1: 0.5213
 epoch: 77, train_loss: 0.5578, test_loss: 1.3319, test_f1: 0.5268
 epoch: 78, train_loss: 0.5707, test_loss: 1.3233, test_f1: 0.5467
 epoch: 79, train_loss: 0.5457, test_loss: 1.3157, test_f1: 0.5192
 epoch: 80, train_loss: 0.5529, test_loss: 1.3508, test_f1: 0.5239
 epoch: 81, train_loss: 0.5495, test_loss: 1.3898, test_f1: 0.5242
 epoch: 82, train_loss: 0.5401, test_loss: 1.3782, test_f1: 0.5212
 epoch: 83, train_loss: 0.5462, test_loss: 1.3837, test_f1: 0.5238
 epoch: 84, train_loss: 0.5284, test_loss: 1.4099, test_f1: 0.5242
 epoch: 85, train_loss: 0.5161, test_loss: 1.3659, test_f1: 0.5340
 epoch: 86, train_loss: 0.5380, test_loss: 1.4264, test_f1: 0.5162
 epoch: 87, train_loss: 0.5335, test_loss: 1.4159, test_f1: 0.5313
 epoch: 88, train_loss: 0.5395, test_loss: 1.3997, test_f1: 0.5236
 epoch: 89, train_loss: 0.5331, test_loss: 1.4177, test_f1: 0.5166
 epoch: 90, train_loss: 0.5271, test_loss: 1.3982, test_f1: 0.5413
 epoch: 91, train_loss: 0.5128, test_loss: 1.4480, test_f1: 0.5383
 epoch: 92, train_loss: 0.5229, test_loss: 1.4550, test_f1: 0.5131
 epoch: 93, train_loss: 0.5158, test_loss: 1.4459, test_f1: 0.5375
 epoch: 94, train_loss: 0.5153, test_loss: 1.4752, test_f1: 0.5215
 epoch: 95, train_loss: 0.5281, test_loss: 1.4399, test_f1: 0.5206
 epoch: 96, train_loss: 0.5120, test_loss: 1.4454, test_f1: 0.5343
 epoch: 97, train_loss: 0.5058, test_loss: 1.4294, test_f1: 0.5409
 epoch: 98, train_loss: 0.4956, test_loss: 1.4711, test_f1: 0.5331
 epoch: 99, train_loss: 0.4960, test_loss: 1.4871, test_f1: 0.5241
##################ITERATION #4 ****************************************
 epoch: 0, train_loss: 1.2909, test_loss: 1.2374, test_f1: 0.2654
 epoch: 1, train_loss: 1.2110, test_loss: 1.1830, test_f1: 0.3253
 epoch: 2, train_loss: 1.1867, test_loss: 1.1448, test_f1: 0.4681
 epoch: 3, train_loss: 1.1610, test_loss: 1.1187, test_f1: 0.4622
 epoch: 4, train_loss: 1.1400, test_loss: 1.1024, test_f1: 0.4670
 epoch: 5, train_loss: 1.1285, test_loss: 1.0775, test_f1: 0.4694
 epoch: 6, train_loss: 1.1096, test_loss: 1.0601, test_f1: 0.4832
 epoch: 7, train_loss: 1.0887, test_loss: 1.0431, test_f1: 0.5004
 epoch: 8, train_loss: 1.0806, test_loss: 1.0285, test_f1: 0.4829
 epoch: 9, train_loss: 1.0629, test_loss: 1.0193, test_f1: 0.5046
 epoch: 10, train_loss: 1.0480, test_loss: 1.0129, test_f1: 0.4892
 epoch: 11, train_loss: 1.0371, test_loss: 0.9963, test_f1: 0.5025
 epoch: 12, train_loss: 1.0237, test_loss: 0.9839, test_f1: 0.5011
 epoch: 13, train_loss: 1.0166, test_loss: 0.9797, test_f1: 0.5151
 epoch: 14, train_loss: 1.0026, test_loss: 0.9768, test_f1: 0.5032
 epoch: 15, train_loss: 0.9995, test_loss: 0.9621, test_f1: 0.5096
 epoch: 16, train_loss: 0.9796, test_loss: 0.9650, test_f1: 0.5041
 epoch: 17, train_loss: 0.9580, test_loss: 0.9517, test_f1: 0.5326
 epoch: 18, train_loss: 0.9534, test_loss: 0.9524, test_f1: 0.5163
 epoch: 19, train_loss: 0.9401, test_loss: 0.9513, test_f1: 0.5043
 epoch: 20, train_loss: 0.9264, test_loss: 0.9510, test_f1: 0.5225
 epoch: 21, train_loss: 0.9212, test_loss: 0.9378, test_f1: 0.5264
 epoch: 22, train_loss: 0.9068, test_loss: 0.9486, test_f1: 0.5102
 epoch: 23, train_loss: 0.9029, test_loss: 0.9582, test_f1: 0.5013
 epoch: 24, train_loss: 0.8976, test_loss: 0.9553, test_f1: 0.5197
 epoch: 25, train_loss: 0.8771, test_loss: 0.9370, test_f1: 0.5294
 epoch: 26, train_loss: 0.8642, test_loss: 0.9440, test_f1: 0.5109
 epoch: 27, train_loss: 0.8571, test_loss: 0.9451, test_f1: 0.5358
 epoch: 28, train_loss: 0.8453, test_loss: 0.9548, test_f1: 0.5286
 epoch: 29, train_loss: 0.8298, test_loss: 0.9684, test_f1: 0.4999
 epoch: 30, train_loss: 0.8170, test_loss: 0.9465, test_f1: 0.5217
 epoch: 31, train_loss: 0.8227, test_loss: 0.9794, test_f1: 0.5288
 epoch: 32, train_loss: 0.8052, test_loss: 0.9481, test_f1: 0.5498
 epoch: 33, train_loss: 0.8016, test_loss: 0.9757, test_f1: 0.5252
 epoch: 34, train_loss: 0.7906, test_loss: 0.9664, test_f1: 0.5202
 epoch: 35, train_loss: 0.7872, test_loss: 0.9669, test_f1: 0.5386
 epoch: 36, train_loss: 0.7682, test_loss: 0.9482, test_f1: 0.5369
 epoch: 37, train_loss: 0.7532, test_loss: 0.9965, test_f1: 0.5145
 epoch: 38, train_loss: 0.7598, test_loss: 1.0003, test_f1: 0.5434
 epoch: 39, train_loss: 0.7454, test_loss: 0.9858, test_f1: 0.5322
 epoch: 40, train_loss: 0.7290, test_loss: 1.0066, test_f1: 0.5400
 epoch: 41, train_loss: 0.7350, test_loss: 0.9984, test_f1: 0.5458
 epoch: 42, train_loss: 0.7170, test_loss: 1.0287, test_f1: 0.5284
 epoch: 43, train_loss: 0.7095, test_loss: 1.0177, test_f1: 0.5395
 epoch: 44, train_loss: 0.7059, test_loss: 1.0138, test_f1: 0.5332
 epoch: 45, train_loss: 0.7070, test_loss: 1.0711, test_f1: 0.5346
 epoch: 46, train_loss: 0.6961, test_loss: 1.0552, test_f1: 0.5403
 epoch: 47, train_loss: 0.6920, test_loss: 1.0870, test_f1: 0.5309
 epoch: 48, train_loss: 0.6915, test_loss: 1.1009, test_f1: 0.5432
 epoch: 49, train_loss: 0.6742, test_loss: 1.1146, test_f1: 0.5338
 epoch: 50, train_loss: 0.6676, test_loss: 1.0692, test_f1: 0.5394
 epoch: 51, train_loss: 0.6583, test_loss: 1.1137, test_f1: 0.5328
 epoch: 52, train_loss: 0.6521, test_loss: 1.1196, test_f1: 0.5489
 epoch: 53, train_loss: 0.6339, test_loss: 1.1226, test_f1: 0.5257
 epoch: 54, train_loss: 0.6283, test_loss: 1.1200, test_f1: 0.5341
 epoch: 55, train_loss: 0.6326, test_loss: 1.1519, test_f1: 0.5317
 epoch: 56, train_loss: 0.6244, test_loss: 1.1748, test_f1: 0.5415
 epoch: 57, train_loss: 0.6335, test_loss: 1.1534, test_f1: 0.5449
 epoch: 58, train_loss: 0.6298, test_loss: 1.1612, test_f1: 0.5381
 epoch: 59, train_loss: 0.6241, test_loss: 1.1411, test_f1: 0.5349
 epoch: 60, train_loss: 0.6206, test_loss: 1.1698, test_f1: 0.5299
 epoch: 61, train_loss: 0.6218, test_loss: 1.1478, test_f1: 0.5563
 epoch: 62, train_loss: 0.6076, test_loss: 1.1903, test_f1: 0.5444
 epoch: 63, train_loss: 0.6031, test_loss: 1.2036, test_f1: 0.5345
 epoch: 64, train_loss: 0.6098, test_loss: 1.1835, test_f1: 0.5467
 epoch: 65, train_loss: 0.6044, test_loss: 1.1910, test_f1: 0.5326
 epoch: 66, train_loss: 0.6169, test_loss: 1.1892, test_f1: 0.5377
 epoch: 67, train_loss: 0.5849, test_loss: 1.2107, test_f1: 0.5496
 epoch: 68, train_loss: 0.5879, test_loss: 1.2067, test_f1: 0.5496
 epoch: 69, train_loss: 0.5946, test_loss: 1.2146, test_f1: 0.5315
 epoch: 70, train_loss: 0.5867, test_loss: 1.2267, test_f1: 0.5435
 epoch: 71, train_loss: 0.5889, test_loss: 1.2226, test_f1: 0.5381
 epoch: 72, train_loss: 0.5689, test_loss: 1.2159, test_f1: 0.5328
 epoch: 73, train_loss: 0.5903, test_loss: 1.2390, test_f1: 0.5404
 epoch: 74, train_loss: 0.5795, test_loss: 1.2512, test_f1: 0.5322
 epoch: 75, train_loss: 0.5767, test_loss: 1.2170, test_f1: 0.5398
 epoch: 76, train_loss: 0.5532, test_loss: 1.2391, test_f1: 0.5391
 epoch: 77, train_loss: 0.5768, test_loss: 1.2514, test_f1: 0.5492
 epoch: 78, train_loss: 0.5654, test_loss: 1.2259, test_f1: 0.5358
 epoch: 79, train_loss: 0.5638, test_loss: 1.2524, test_f1: 0.5420
 epoch: 80, train_loss: 0.5492, test_loss: 1.2494, test_f1: 0.5369
 epoch: 81, train_loss: 0.5611, test_loss: 1.2785, test_f1: 0.5372
 epoch: 82, train_loss: 0.5412, test_loss: 1.2925, test_f1: 0.5302
 epoch: 83, train_loss: 0.5626, test_loss: 1.3017, test_f1: 0.5144
 epoch: 84, train_loss: 0.5542, test_loss: 1.2628, test_f1: 0.5389
 epoch: 85, train_loss: 0.5353, test_loss: 1.2936, test_f1: 0.5265
 epoch: 86, train_loss: 0.5413, test_loss: 1.3320, test_f1: 0.5332
 epoch: 87, train_loss: 0.5440, test_loss: 1.3042, test_f1: 0.5306
 epoch: 88, train_loss: 0.5401, test_loss: 1.3410, test_f1: 0.5261
 epoch: 89, train_loss: 0.5451, test_loss: 1.3278, test_f1: 0.5295
 epoch: 90, train_loss: 0.5315, test_loss: 1.3314, test_f1: 0.5315
 epoch: 91, train_loss: 0.5239, test_loss: 1.3145, test_f1: 0.5349
 epoch: 92, train_loss: 0.5324, test_loss: 1.3183, test_f1: 0.5252
 epoch: 93, train_loss: 0.5249, test_loss: 1.3472, test_f1: 0.5096
 epoch: 94, train_loss: 0.5152, test_loss: 1.3481, test_f1: 0.5321
 epoch: 95, train_loss: 0.5181, test_loss: 1.3739, test_f1: 0.5351
 epoch: 96, train_loss: 0.5107, test_loss: 1.3657, test_f1: 0.5156
 epoch: 97, train_loss: 0.5117, test_loss: 1.3686, test_f1: 0.5282
 epoch: 98, train_loss: 0.5202, test_loss: 1.3777, test_f1: 0.5433
 epoch: 99, train_loss: 0.5211, test_loss: 1.3696, test_f1: 0.5182
##################ITERATION #5 ****************************************
 epoch: 0, train_loss: 1.3433, test_loss: 1.2645, test_f1: 0.2743
 epoch: 1, train_loss: 1.2198, test_loss: 1.1839, test_f1: 0.4295
 epoch: 2, train_loss: 1.1824, test_loss: 1.1459, test_f1: 0.4421
 epoch: 3, train_loss: 1.1598, test_loss: 1.1204, test_f1: 0.4500
 epoch: 4, train_loss: 1.1376, test_loss: 1.0964, test_f1: 0.4634
 epoch: 5, train_loss: 1.1157, test_loss: 1.0936, test_f1: 0.4457
 epoch: 6, train_loss: 1.0966, test_loss: 1.0729, test_f1: 0.4579
 epoch: 7, train_loss: 1.0833, test_loss: 1.0597, test_f1: 0.4658
 epoch: 8, train_loss: 1.0632, test_loss: 1.0426, test_f1: 0.4823
 epoch: 9, train_loss: 1.0586, test_loss: 1.0437, test_f1: 0.4742
 epoch: 10, train_loss: 1.0400, test_loss: 1.0304, test_f1: 0.4851
 epoch: 11, train_loss: 1.0293, test_loss: 1.0241, test_f1: 0.4955
 epoch: 12, train_loss: 1.0097, test_loss: 1.0222, test_f1: 0.4850
 epoch: 13, train_loss: 0.9882, test_loss: 1.0062, test_f1: 0.5008
 epoch: 14, train_loss: 0.9786, test_loss: 1.0071, test_f1: 0.5006
 epoch: 15, train_loss: 0.9672, test_loss: 1.0123, test_f1: 0.4930
 epoch: 16, train_loss: 0.9604, test_loss: 0.9982, test_f1: 0.4985
 epoch: 17, train_loss: 0.9418, test_loss: 0.9901, test_f1: 0.5181
 epoch: 18, train_loss: 0.9376, test_loss: 1.0088, test_f1: 0.4919
 epoch: 19, train_loss: 0.9216, test_loss: 0.9998, test_f1: 0.4911
 epoch: 20, train_loss: 0.9168, test_loss: 0.9890, test_f1: 0.5023
 epoch: 21, train_loss: 0.8961, test_loss: 0.9768, test_f1: 0.5032
 epoch: 22, train_loss: 0.8952, test_loss: 0.9842, test_f1: 0.4897
 epoch: 23, train_loss: 0.8963, test_loss: 0.9996, test_f1: 0.4875
 epoch: 24, train_loss: 0.8685, test_loss: 1.0028, test_f1: 0.5133
 epoch: 25, train_loss: 0.8639, test_loss: 0.9931, test_f1: 0.5177
 epoch: 26, train_loss: 0.8578, test_loss: 0.9739, test_f1: 0.5221
 epoch: 27, train_loss: 0.8379, test_loss: 0.9977, test_f1: 0.4899
 epoch: 28, train_loss: 0.8343, test_loss: 1.0135, test_f1: 0.4831
 epoch: 29, train_loss: 0.8133, test_loss: 1.0186, test_f1: 0.4908
 epoch: 30, train_loss: 0.8242, test_loss: 1.0264, test_f1: 0.5025
 epoch: 31, train_loss: 0.8012, test_loss: 1.0141, test_f1: 0.5152
 epoch: 32, train_loss: 0.7890, test_loss: 1.0521, test_f1: 0.5033
 epoch: 33, train_loss: 0.7811, test_loss: 1.0872, test_f1: 0.4933
 epoch: 34, train_loss: 0.7729, test_loss: 1.0699, test_f1: 0.5024
 epoch: 35, train_loss: 0.7557, test_loss: 1.0746, test_f1: 0.5222
 epoch: 36, train_loss: 0.7687, test_loss: 1.0835, test_f1: 0.5023
 epoch: 37, train_loss: 0.7577, test_loss: 1.1023, test_f1: 0.5138
 epoch: 38, train_loss: 0.7377, test_loss: 1.1085, test_f1: 0.5081
 epoch: 39, train_loss: 0.7276, test_loss: 1.1231, test_f1: 0.5074
 epoch: 40, train_loss: 0.7452, test_loss: 1.0925, test_f1: 0.5286
 epoch: 41, train_loss: 0.7194, test_loss: 1.1655, test_f1: 0.5135
 epoch: 42, train_loss: 0.7059, test_loss: 1.1359, test_f1: 0.5110
 epoch: 43, train_loss: 0.7003, test_loss: 1.1461, test_f1: 0.5104
 epoch: 44, train_loss: 0.7052, test_loss: 1.1391, test_f1: 0.5281
 epoch: 45, train_loss: 0.6897, test_loss: 1.1823, test_f1: 0.5262
 epoch: 46, train_loss: 0.6825, test_loss: 1.1341, test_f1: 0.5263
 epoch: 47, train_loss: 0.6726, test_loss: 1.1943, test_f1: 0.5220
 epoch: 48, train_loss: 0.6591, test_loss: 1.1145, test_f1: 0.5173
 epoch: 49, train_loss: 0.6629, test_loss: 1.1689, test_f1: 0.5226
 epoch: 50, train_loss: 0.6508, test_loss: 1.1732, test_f1: 0.5187
 epoch: 51, train_loss: 0.6368, test_loss: 1.1840, test_f1: 0.5275
 epoch: 52, train_loss: 0.6323, test_loss: 1.1818, test_f1: 0.5318
 epoch: 53, train_loss: 0.6256, test_loss: 1.1819, test_f1: 0.5200
 epoch: 54, train_loss: 0.6174, test_loss: 1.2316, test_f1: 0.5273
 epoch: 55, train_loss: 0.6151, test_loss: 1.2274, test_f1: 0.5295
 epoch: 56, train_loss: 0.6292, test_loss: 1.2067, test_f1: 0.5252
 epoch: 57, train_loss: 0.6180, test_loss: 1.2683, test_f1: 0.5054
 epoch: 58, train_loss: 0.6057, test_loss: 1.2656, test_f1: 0.5271
 epoch: 59, train_loss: 0.6072, test_loss: 1.2621, test_f1: 0.5184
 epoch: 60, train_loss: 0.6008, test_loss: 1.2511, test_f1: 0.5241
 epoch: 61, train_loss: 0.5875, test_loss: 1.2606, test_f1: 0.5301
 epoch: 62, train_loss: 0.5872, test_loss: 1.2365, test_f1: 0.5296
 epoch: 63, train_loss: 0.5838, test_loss: 1.2678, test_f1: 0.5244
 epoch: 64, train_loss: 0.5916, test_loss: 1.3257, test_f1: 0.5289
 epoch: 65, train_loss: 0.5876, test_loss: 1.2810, test_f1: 0.5238
 epoch: 66, train_loss: 0.6025, test_loss: 1.2969, test_f1: 0.5229
 epoch: 67, train_loss: 0.5788, test_loss: 1.2964, test_f1: 0.5207
 epoch: 68, train_loss: 0.5622, test_loss: 1.2930, test_f1: 0.5287
 epoch: 69, train_loss: 0.5722, test_loss: 1.3447, test_f1: 0.5220
 epoch: 70, train_loss: 0.5752, test_loss: 1.2995, test_f1: 0.5312
 epoch: 71, train_loss: 0.5689, test_loss: 1.3556, test_f1: 0.5337
 epoch: 72, train_loss: 0.5580, test_loss: 1.3226, test_f1: 0.5300
 epoch: 73, train_loss: 0.5663, test_loss: 1.3775, test_f1: 0.5316
 epoch: 74, train_loss: 0.5622, test_loss: 1.3509, test_f1: 0.5361
 epoch: 75, train_loss: 0.5475, test_loss: 1.3300, test_f1: 0.5416
 epoch: 76, train_loss: 0.5524, test_loss: 1.3453, test_f1: 0.5341
 epoch: 77, train_loss: 0.5532, test_loss: 1.3464, test_f1: 0.5286
 epoch: 78, train_loss: 0.5321, test_loss: 1.3587, test_f1: 0.5311
 epoch: 79, train_loss: 0.5261, test_loss: 1.4044, test_f1: 0.5338
 epoch: 80, train_loss: 0.5358, test_loss: 1.3944, test_f1: 0.5266
 epoch: 81, train_loss: 0.5450, test_loss: 1.3544, test_f1: 0.5311
 epoch: 82, train_loss: 0.5265, test_loss: 1.3935, test_f1: 0.5264
 epoch: 83, train_loss: 0.5433, test_loss: 1.4243, test_f1: 0.5104
 epoch: 84, train_loss: 0.5268, test_loss: 1.3968, test_f1: 0.5250
 epoch: 85, train_loss: 0.5267, test_loss: 1.4302, test_f1: 0.5285
 epoch: 86, train_loss: 0.5096, test_loss: 1.4289, test_f1: 0.5286
 epoch: 87, train_loss: 0.5137, test_loss: 1.4180, test_f1: 0.5275
 epoch: 88, train_loss: 0.5144, test_loss: 1.4121, test_f1: 0.5373
 epoch: 89, train_loss: 0.5167, test_loss: 1.4280, test_f1: 0.5316
 epoch: 90, train_loss: 0.5176, test_loss: 1.4748, test_f1: 0.5217
 epoch: 91, train_loss: 0.4988, test_loss: 1.4150, test_f1: 0.5396
 epoch: 92, train_loss: 0.4995, test_loss: 1.4603, test_f1: 0.5354
 epoch: 93, train_loss: 0.5216, test_loss: 1.4755, test_f1: 0.5311
 epoch: 94, train_loss: 0.4939, test_loss: 1.4804, test_f1: 0.5264
 epoch: 95, train_loss: 0.4875, test_loss: 1.5008, test_f1: 0.5228
 epoch: 96, train_loss: 0.5185, test_loss: 1.4818, test_f1: 0.5325
 epoch: 97, train_loss: 0.4822, test_loss: 1.5294, test_f1: 0.5266
 epoch: 98, train_loss: 0.4805, test_loss: 1.5075, test_f1: 0.5301
 epoch: 99, train_loss: 0.4905, test_loss: 1.5323, test_f1: 0.5253
##################ITERATION #6 ****************************************
 epoch: 0, train_loss: 1.3312, test_loss: 1.2694, test_f1: 0.2753
 epoch: 1, train_loss: 1.2142, test_loss: 1.1858, test_f1: 0.3828
 epoch: 2, train_loss: 1.1923, test_loss: 1.1602, test_f1: 0.4332
 epoch: 3, train_loss: 1.1558, test_loss: 1.1451, test_f1: 0.4346
 epoch: 4, train_loss: 1.1444, test_loss: 1.1185, test_f1: 0.4418
 epoch: 5, train_loss: 1.1307, test_loss: 1.1161, test_f1: 0.4358
 epoch: 6, train_loss: 1.1072, test_loss: 1.0979, test_f1: 0.4486
 epoch: 7, train_loss: 1.0925, test_loss: 1.0918, test_f1: 0.4547
 epoch: 8, train_loss: 1.0763, test_loss: 1.0896, test_f1: 0.4514
 epoch: 9, train_loss: 1.0511, test_loss: 1.0807, test_f1: 0.4609
 epoch: 10, train_loss: 1.0540, test_loss: 1.0721, test_f1: 0.4655
 epoch: 11, train_loss: 1.0322, test_loss: 1.0628, test_f1: 0.4635
 epoch: 12, train_loss: 1.0278, test_loss: 1.0644, test_f1: 0.4485
 epoch: 13, train_loss: 1.0259, test_loss: 1.0451, test_f1: 0.4610
 epoch: 14, train_loss: 1.0103, test_loss: 1.0569, test_f1: 0.4618
 epoch: 15, train_loss: 0.9894, test_loss: 1.0472, test_f1: 0.4810
 epoch: 16, train_loss: 0.9849, test_loss: 1.0376, test_f1: 0.4700
 epoch: 17, train_loss: 0.9696, test_loss: 1.0485, test_f1: 0.4687
 epoch: 18, train_loss: 0.9622, test_loss: 1.0307, test_f1: 0.4839
 epoch: 19, train_loss: 0.9448, test_loss: 1.0214, test_f1: 0.4849
 epoch: 20, train_loss: 0.9512, test_loss: 1.0242, test_f1: 0.4848
 epoch: 21, train_loss: 0.9455, test_loss: 1.0386, test_f1: 0.4915
 epoch: 22, train_loss: 0.9329, test_loss: 1.0217, test_f1: 0.4906
 epoch: 23, train_loss: 0.9267, test_loss: 1.0466, test_f1: 0.4750
 epoch: 24, train_loss: 0.9152, test_loss: 1.0221, test_f1: 0.4871
 epoch: 25, train_loss: 0.8966, test_loss: 1.0177, test_f1: 0.4961
 epoch: 26, train_loss: 0.9037, test_loss: 1.0116, test_f1: 0.4912
 epoch: 27, train_loss: 0.8872, test_loss: 1.0140, test_f1: 0.5121
 epoch: 28, train_loss: 0.8737, test_loss: 1.0438, test_f1: 0.4781
 epoch: 29, train_loss: 0.8717, test_loss: 1.0106, test_f1: 0.4919
 epoch: 30, train_loss: 0.8638, test_loss: 1.0339, test_f1: 0.5187
 epoch: 31, train_loss: 0.8562, test_loss: 1.0297, test_f1: 0.5049
 epoch: 32, train_loss: 0.8475, test_loss: 1.0297, test_f1: 0.5018
 epoch: 33, train_loss: 0.8335, test_loss: 1.0389, test_f1: 0.4909
 epoch: 34, train_loss: 0.8291, test_loss: 1.0423, test_f1: 0.4871
 epoch: 35, train_loss: 0.8168, test_loss: 1.0388, test_f1: 0.5051
 epoch: 36, train_loss: 0.8123, test_loss: 1.0470, test_f1: 0.4895
 epoch: 37, train_loss: 0.8086, test_loss: 1.0868, test_f1: 0.4839
 epoch: 38, train_loss: 0.7908, test_loss: 1.0475, test_f1: 0.5135
 epoch: 39, train_loss: 0.7952, test_loss: 1.0678, test_f1: 0.5209
 epoch: 40, train_loss: 0.7929, test_loss: 1.0583, test_f1: 0.5195
 epoch: 41, train_loss: 0.7820, test_loss: 1.0677, test_f1: 0.4878
 epoch: 42, train_loss: 0.7654, test_loss: 1.0417, test_f1: 0.5002
 epoch: 43, train_loss: 0.7549, test_loss: 1.0677, test_f1: 0.5023
 epoch: 44, train_loss: 0.7416, test_loss: 1.0730, test_f1: 0.5103
 epoch: 45, train_loss: 0.7487, test_loss: 1.0641, test_f1: 0.5331
 epoch: 46, train_loss: 0.7487, test_loss: 1.0773, test_f1: 0.5365
 epoch: 47, train_loss: 0.7365, test_loss: 1.1061, test_f1: 0.5099
 epoch: 48, train_loss: 0.7409, test_loss: 1.0736, test_f1: 0.5515
 epoch: 49, train_loss: 0.7043, test_loss: 1.1121, test_f1: 0.5069
 epoch: 50, train_loss: 0.7256, test_loss: 1.1410, test_f1: 0.4956
 epoch: 51, train_loss: 0.7003, test_loss: 1.0950, test_f1: 0.5287
 epoch: 52, train_loss: 0.6944, test_loss: 1.1058, test_f1: 0.5360
 epoch: 53, train_loss: 0.6962, test_loss: 1.1101, test_f1: 0.5267
 epoch: 54, train_loss: 0.6873, test_loss: 1.1097, test_f1: 0.5209
 epoch: 55, train_loss: 0.6845, test_loss: 1.1022, test_f1: 0.5200
 epoch: 56, train_loss: 0.6738, test_loss: 1.1486, test_f1: 0.5230
 epoch: 57, train_loss: 0.6681, test_loss: 1.1065, test_f1: 0.5131
 epoch: 58, train_loss: 0.6624, test_loss: 1.1569, test_f1: 0.5224
 epoch: 59, train_loss: 0.6689, test_loss: 1.1311, test_f1: 0.5301
 epoch: 60, train_loss: 0.6585, test_loss: 1.1586, test_f1: 0.5399
 epoch: 61, train_loss: 0.6619, test_loss: 1.1633, test_f1: 0.5232
 epoch: 62, train_loss: 0.6529, test_loss: 1.1508, test_f1: 0.5196
 epoch: 63, train_loss: 0.6622, test_loss: 1.1577, test_f1: 0.5324
 epoch: 64, train_loss: 0.6453, test_loss: 1.1724, test_f1: 0.5199
 epoch: 65, train_loss: 0.6513, test_loss: 1.1918, test_f1: 0.5237
 epoch: 66, train_loss: 0.6526, test_loss: 1.2101, test_f1: 0.5274
 epoch: 67, train_loss: 0.6255, test_loss: 1.1768, test_f1: 0.5326
 epoch: 68, train_loss: 0.6275, test_loss: 1.1794, test_f1: 0.5265
 epoch: 69, train_loss: 0.6508, test_loss: 1.2079, test_f1: 0.5375
 epoch: 70, train_loss: 0.6276, test_loss: 1.1964, test_f1: 0.5252
 epoch: 71, train_loss: 0.6276, test_loss: 1.2017, test_f1: 0.5255
 epoch: 72, train_loss: 0.6367, test_loss: 1.1900, test_f1: 0.5447
 epoch: 73, train_loss: 0.6296, test_loss: 1.2038, test_f1: 0.5355
 epoch: 74, train_loss: 0.6002, test_loss: 1.2039, test_f1: 0.5359
 epoch: 75, train_loss: 0.6182, test_loss: 1.2094, test_f1: 0.5413
 epoch: 76, train_loss: 0.6231, test_loss: 1.2319, test_f1: 0.5258
 epoch: 77, train_loss: 0.6087, test_loss: 1.2334, test_f1: 0.5327
 epoch: 78, train_loss: 0.6147, test_loss: 1.2193, test_f1: 0.5366
 epoch: 79, train_loss: 0.6100, test_loss: 1.2156, test_f1: 0.5223
 epoch: 80, train_loss: 0.6034, test_loss: 1.2253, test_f1: 0.5437
 epoch: 81, train_loss: 0.5970, test_loss: 1.2164, test_f1: 0.5260
 epoch: 82, train_loss: 0.5993, test_loss: 1.2903, test_f1: 0.5342
 epoch: 83, train_loss: 0.6002, test_loss: 1.2503, test_f1: 0.5427
 epoch: 84, train_loss: 0.5899, test_loss: 1.2436, test_f1: 0.5260
 epoch: 85, train_loss: 0.5880, test_loss: 1.2381, test_f1: 0.5382
 epoch: 86, train_loss: 0.6008, test_loss: 1.2457, test_f1: 0.5458
 epoch: 87, train_loss: 0.5896, test_loss: 1.2634, test_f1: 0.5385
 epoch: 88, train_loss: 0.5968, test_loss: 1.2231, test_f1: 0.5567
 epoch: 89, train_loss: 0.5793, test_loss: 1.2642, test_f1: 0.5423
 epoch: 90, train_loss: 0.5921, test_loss: 1.2835, test_f1: 0.5393
 epoch: 91, train_loss: 0.5840, test_loss: 1.2601, test_f1: 0.5367
 epoch: 92, train_loss: 0.5816, test_loss: 1.2906, test_f1: 0.5342
 epoch: 93, train_loss: 0.5625, test_loss: 1.2987, test_f1: 0.5325
 epoch: 94, train_loss: 0.5679, test_loss: 1.2939, test_f1: 0.5364
 epoch: 95, train_loss: 0.5828, test_loss: 1.3074, test_f1: 0.5522
 epoch: 96, train_loss: 0.5617, test_loss: 1.2891, test_f1: 0.5375
 epoch: 97, train_loss: 0.5635, test_loss: 1.3374, test_f1: 0.5360
 epoch: 98, train_loss: 0.5604, test_loss: 1.2756, test_f1: 0.5379
 epoch: 99, train_loss: 0.5606, test_loss: 1.3305, test_f1: 0.5298
##################ITERATION #7 ****************************************
 epoch: 0, train_loss: 1.3335, test_loss: 1.2656, test_f1: 0.3019
 epoch: 1, train_loss: 1.2376, test_loss: 1.2030, test_f1: 0.4197
 epoch: 2, train_loss: 1.2189, test_loss: 1.1818, test_f1: 0.4382
 epoch: 3, train_loss: 1.1896, test_loss: 1.1330, test_f1: 0.4544
 epoch: 4, train_loss: 1.1697, test_loss: 1.1237, test_f1: 0.4599
 epoch: 5, train_loss: 1.1550, test_loss: 1.1256, test_f1: 0.4758
 epoch: 6, train_loss: 1.1339, test_loss: 1.0882, test_f1: 0.4609
 epoch: 7, train_loss: 1.1254, test_loss: 1.0915, test_f1: 0.4449
 epoch: 8, train_loss: 1.1020, test_loss: 1.0753, test_f1: 0.4618
 epoch: 9, train_loss: 1.0974, test_loss: 1.0632, test_f1: 0.4593
 epoch: 10, train_loss: 1.0898, test_loss: 1.0627, test_f1: 0.4400
 epoch: 11, train_loss: 1.0690, test_loss: 1.0724, test_f1: 0.4698
 epoch: 12, train_loss: 1.0655, test_loss: 1.0430, test_f1: 0.4613
 epoch: 13, train_loss: 1.0537, test_loss: 1.0519, test_f1: 0.4652
 epoch: 14, train_loss: 1.0394, test_loss: 1.0550, test_f1: 0.4561
 epoch: 15, train_loss: 1.0233, test_loss: 1.0701, test_f1: 0.4306
 epoch: 16, train_loss: 1.0152, test_loss: 1.0228, test_f1: 0.4641
 epoch: 17, train_loss: 1.0085, test_loss: 1.0197, test_f1: 0.4678
 epoch: 18, train_loss: 0.9925, test_loss: 1.0192, test_f1: 0.4694
 epoch: 19, train_loss: 1.0018, test_loss: 1.0350, test_f1: 0.4716
 epoch: 20, train_loss: 0.9749, test_loss: 1.0297, test_f1: 0.4731
 epoch: 21, train_loss: 0.9702, test_loss: 1.0140, test_f1: 0.4753
 epoch: 22, train_loss: 0.9687, test_loss: 0.9995, test_f1: 0.4755
 epoch: 23, train_loss: 0.9539, test_loss: 1.0622, test_f1: 0.4541
 epoch: 24, train_loss: 0.9470, test_loss: 0.9952, test_f1: 0.4763
 epoch: 25, train_loss: 0.9392, test_loss: 1.0260, test_f1: 0.4499
 epoch: 26, train_loss: 0.9331, test_loss: 1.0430, test_f1: 0.4513
 epoch: 27, train_loss: 0.9265, test_loss: 1.1259, test_f1: 0.4648
 epoch: 28, train_loss: 0.9162, test_loss: 1.1245, test_f1: 0.4669
 epoch: 29, train_loss: 0.9030, test_loss: 1.1813, test_f1: 0.4607
 epoch: 30, train_loss: 0.8949, test_loss: 1.0515, test_f1: 0.4707
 epoch: 31, train_loss: 0.8788, test_loss: 1.1234, test_f1: 0.4592
 epoch: 32, train_loss: 0.8757, test_loss: 1.1923, test_f1: 0.4586
 epoch: 33, train_loss: 0.8841, test_loss: 1.1463, test_f1: 0.4736
 epoch: 34, train_loss: 0.8729, test_loss: 1.1842, test_f1: 0.4697
 epoch: 35, train_loss: 0.8506, test_loss: 1.1563, test_f1: 0.4754
 epoch: 36, train_loss: 0.8459, test_loss: 1.1763, test_f1: 0.4566
 epoch: 37, train_loss: 0.8515, test_loss: 1.3160, test_f1: 0.4564
 epoch: 38, train_loss: 0.8488, test_loss: 1.2530, test_f1: 0.4731
 epoch: 39, train_loss: 0.8374, test_loss: 1.0701, test_f1: 0.4679
 epoch: 40, train_loss: 0.8219, test_loss: 1.1407, test_f1: 0.4899
 epoch: 41, train_loss: 0.8165, test_loss: 1.1876, test_f1: 0.4748
 epoch: 42, train_loss: 0.8182, test_loss: 1.2116, test_f1: 0.4583
 epoch: 43, train_loss: 0.8012, test_loss: 1.3827, test_f1: 0.4745
 epoch: 44, train_loss: 0.7922, test_loss: 1.2886, test_f1: 0.4802
 epoch: 45, train_loss: 0.7798, test_loss: 1.3556, test_f1: 0.4732
 epoch: 46, train_loss: 0.7951, test_loss: 1.2240, test_f1: 0.4836
 epoch: 47, train_loss: 0.7719, test_loss: 1.2934, test_f1: 0.4734
 epoch: 48, train_loss: 0.7689, test_loss: 1.3292, test_f1: 0.4771
 epoch: 49, train_loss: 0.7722, test_loss: 1.5242, test_f1: 0.4714
 epoch: 50, train_loss: 0.7627, test_loss: 1.4406, test_f1: 0.4753
 epoch: 51, train_loss: 0.7647, test_loss: 1.6357, test_f1: 0.4801
 epoch: 52, train_loss: 0.7450, test_loss: 1.5204, test_f1: 0.4793
 epoch: 53, train_loss: 0.7385, test_loss: 1.4946, test_f1: 0.4884
 epoch: 54, train_loss: 0.7364, test_loss: 1.5445, test_f1: 0.4769
 epoch: 55, train_loss: 0.7163, test_loss: 1.5393, test_f1: 0.4901
 epoch: 56, train_loss: 0.7334, test_loss: 1.5966, test_f1: 0.4802
 epoch: 57, train_loss: 0.7304, test_loss: 1.6961, test_f1: 0.4787
 epoch: 58, train_loss: 0.7232, test_loss: 1.5651, test_f1: 0.4991
 epoch: 59, train_loss: 0.7104, test_loss: 1.6656, test_f1: 0.4813
 epoch: 60, train_loss: 0.7115, test_loss: 1.5678, test_f1: 0.4792
 epoch: 61, train_loss: 0.7112, test_loss: 1.6571, test_f1: 0.4836
 epoch: 62, train_loss: 0.7027, test_loss: 1.6487, test_f1: 0.4957
 epoch: 63, train_loss: 0.6958, test_loss: 1.6981, test_f1: 0.4910
 epoch: 64, train_loss: 0.7056, test_loss: 1.6337, test_f1: 0.4966
 epoch: 65, train_loss: 0.6798, test_loss: 1.7353, test_f1: 0.4896
 epoch: 66, train_loss: 0.6865, test_loss: 1.8036, test_f1: 0.4858
 epoch: 67, train_loss: 0.6881, test_loss: 1.8341, test_f1: 0.4856
 epoch: 68, train_loss: 0.6715, test_loss: 1.7155, test_f1: 0.4785
 epoch: 69, train_loss: 0.6836, test_loss: 1.6705, test_f1: 0.4807
 epoch: 70, train_loss: 0.6627, test_loss: 1.8071, test_f1: 0.4916
 epoch: 71, train_loss: 0.6599, test_loss: 1.9141, test_f1: 0.4830
 epoch: 72, train_loss: 0.6667, test_loss: 1.8980, test_f1: 0.4827
 epoch: 73, train_loss: 0.6663, test_loss: 1.7418, test_f1: 0.4813
 epoch: 74, train_loss: 0.6681, test_loss: 1.6898, test_f1: 0.4875
 epoch: 75, train_loss: 0.6569, test_loss: 2.0085, test_f1: 0.4893
 epoch: 76, train_loss: 0.6440, test_loss: 1.9273, test_f1: 0.4974
 epoch: 77, train_loss: 0.6504, test_loss: 1.7300, test_f1: 0.4948
 epoch: 78, train_loss: 0.6505, test_loss: 1.6769, test_f1: 0.4882
 epoch: 79, train_loss: 0.6544, test_loss: 1.7726, test_f1: 0.4933
 epoch: 80, train_loss: 0.6299, test_loss: 1.7338, test_f1: 0.5165
 epoch: 81, train_loss: 0.6380, test_loss: 1.8615, test_f1: 0.4976
 epoch: 82, train_loss: 0.6278, test_loss: 1.8916, test_f1: 0.4916
 epoch: 83, train_loss: 0.6476, test_loss: 1.9024, test_f1: 0.5012
 epoch: 84, train_loss: 0.6375, test_loss: 1.6547, test_f1: 0.5052
 epoch: 85, train_loss: 0.6107, test_loss: 1.6483, test_f1: 0.5112
 epoch: 86, train_loss: 0.6270, test_loss: 1.6681, test_f1: 0.4891
 epoch: 87, train_loss: 0.6238, test_loss: 1.6903, test_f1: 0.4925
 epoch: 88, train_loss: 0.6325, test_loss: 1.8794, test_f1: 0.4917
 epoch: 89, train_loss: 0.6271, test_loss: 2.1920, test_f1: 0.5066
 epoch: 90, train_loss: 0.6141, test_loss: 2.0274, test_f1: 0.4899
 epoch: 91, train_loss: 0.6085, test_loss: 1.9438, test_f1: 0.5111
 epoch: 92, train_loss: 0.6076, test_loss: 2.0603, test_f1: 0.5111
 epoch: 93, train_loss: 0.6081, test_loss: 2.2008, test_f1: 0.5105
 epoch: 94, train_loss: 0.5917, test_loss: 2.1378, test_f1: 0.5125
 epoch: 95, train_loss: 0.6108, test_loss: 2.2181, test_f1: 0.5049
 epoch: 96, train_loss: 0.5997, test_loss: 2.0754, test_f1: 0.4979
 epoch: 97, train_loss: 0.5890, test_loss: 2.1626, test_f1: 0.4890
 epoch: 98, train_loss: 0.5870, test_loss: 2.2878, test_f1: 0.4970
 epoch: 99, train_loss: 0.5840, test_loss: 2.1316, test_f1: 0.5080
##################ITERATION #8 ****************************************
 epoch: 0, train_loss: 1.3449, test_loss: 1.2416, test_f1: 0.3580
 epoch: 1, train_loss: 1.2236, test_loss: 1.1722, test_f1: 0.4335
 epoch: 2, train_loss: 1.1892, test_loss: 1.1187, test_f1: 0.4251
 epoch: 3, train_loss: 1.1537, test_loss: 1.0923, test_f1: 0.4402
 epoch: 4, train_loss: 1.1369, test_loss: 1.0839, test_f1: 0.4538
 epoch: 5, train_loss: 1.1253, test_loss: 1.0726, test_f1: 0.4329
 epoch: 6, train_loss: 1.1310, test_loss: 1.0788, test_f1: 0.4530
 epoch: 7, train_loss: 1.0846, test_loss: 1.0878, test_f1: 0.4065
 epoch: 8, train_loss: 1.0750, test_loss: 1.0737, test_f1: 0.4255
 epoch: 9, train_loss: 1.0649, test_loss: 1.0687, test_f1: 0.4275
 epoch: 10, train_loss: 1.0533, test_loss: 1.0332, test_f1: 0.4478
 epoch: 11, train_loss: 1.0436, test_loss: 1.0525, test_f1: 0.4398
 epoch: 12, train_loss: 1.0201, test_loss: 1.0470, test_f1: 0.4294
 epoch: 13, train_loss: 1.0137, test_loss: 1.0268, test_f1: 0.4499
 epoch: 14, train_loss: 1.0117, test_loss: 1.0300, test_f1: 0.4433
 epoch: 15, train_loss: 0.9985, test_loss: 1.0308, test_f1: 0.4346
 epoch: 16, train_loss: 0.9733, test_loss: 1.0241, test_f1: 0.4644
 epoch: 17, train_loss: 0.9893, test_loss: 1.0232, test_f1: 0.4575
 epoch: 18, train_loss: 0.9745, test_loss: 1.0077, test_f1: 0.4570
 epoch: 19, train_loss: 0.9587, test_loss: 1.0102, test_f1: 0.4720
 epoch: 20, train_loss: 0.9583, test_loss: 1.0031, test_f1: 0.4628
 epoch: 21, train_loss: 0.9380, test_loss: 0.9969, test_f1: 0.4647
 epoch: 22, train_loss: 0.9379, test_loss: 0.9951, test_f1: 0.4641
 epoch: 23, train_loss: 0.9281, test_loss: 1.0178, test_f1: 0.4794
 epoch: 24, train_loss: 0.9177, test_loss: 0.9995, test_f1: 0.4704
 epoch: 25, train_loss: 0.9119, test_loss: 1.0023, test_f1: 0.4805
 epoch: 26, train_loss: 0.9107, test_loss: 1.0141, test_f1: 0.4802
 epoch: 27, train_loss: 0.8910, test_loss: 0.9948, test_f1: 0.4864
 epoch: 28, train_loss: 0.8904, test_loss: 1.0095, test_f1: 0.4935
 epoch: 29, train_loss: 0.8844, test_loss: 1.0101, test_f1: 0.4733
 epoch: 30, train_loss: 0.8672, test_loss: 1.0130, test_f1: 0.4665
 epoch: 31, train_loss: 0.8581, test_loss: 1.0120, test_f1: 0.4579
 epoch: 32, train_loss: 0.8653, test_loss: 1.0013, test_f1: 0.4743
 epoch: 33, train_loss: 0.8445, test_loss: 0.9935, test_f1: 0.4928
 epoch: 34, train_loss: 0.8288, test_loss: 1.0041, test_f1: 0.4888
 epoch: 35, train_loss: 0.8325, test_loss: 1.0007, test_f1: 0.4778
 epoch: 36, train_loss: 0.8313, test_loss: 1.0187, test_f1: 0.4817
 epoch: 37, train_loss: 0.8128, test_loss: 1.0123, test_f1: 0.4873
 epoch: 38, train_loss: 0.8039, test_loss: 1.0249, test_f1: 0.4615
 epoch: 39, train_loss: 0.7989, test_loss: 1.0352, test_f1: 0.4762
 epoch: 40, train_loss: 0.7973, test_loss: 1.0252, test_f1: 0.4822
 epoch: 41, train_loss: 0.7911, test_loss: 1.0351, test_f1: 0.5031
 epoch: 42, train_loss: 0.7877, test_loss: 1.0500, test_f1: 0.4832
 epoch: 43, train_loss: 0.7737, test_loss: 1.0264, test_f1: 0.4940
 epoch: 44, train_loss: 0.7772, test_loss: 1.0486, test_f1: 0.5216
 epoch: 45, train_loss: 0.7548, test_loss: 1.0393, test_f1: 0.5333
 epoch: 46, train_loss: 0.7408, test_loss: 1.0989, test_f1: 0.4782
 epoch: 47, train_loss: 0.7487, test_loss: 1.0757, test_f1: 0.5179
 epoch: 48, train_loss: 0.7548, test_loss: 1.1070, test_f1: 0.4925
 epoch: 49, train_loss: 0.7340, test_loss: 1.0881, test_f1: 0.4861
 epoch: 50, train_loss: 0.7184, test_loss: 1.0812, test_f1: 0.4976
 epoch: 51, train_loss: 0.7217, test_loss: 1.1094, test_f1: 0.4803
 epoch: 52, train_loss: 0.6959, test_loss: 1.1215, test_f1: 0.4822
 epoch: 53, train_loss: 0.7044, test_loss: 1.1111, test_f1: 0.4796
 epoch: 54, train_loss: 0.6954, test_loss: 1.1138, test_f1: 0.4795
 epoch: 55, train_loss: 0.6829, test_loss: 1.1361, test_f1: 0.5054
 epoch: 56, train_loss: 0.6956, test_loss: 1.1496, test_f1: 0.4904
 epoch: 57, train_loss: 0.6928, test_loss: 1.1246, test_f1: 0.5052
 epoch: 58, train_loss: 0.6873, test_loss: 1.1261, test_f1: 0.5073
 epoch: 59, train_loss: 0.6862, test_loss: 1.1312, test_f1: 0.5023
 epoch: 60, train_loss: 0.6702, test_loss: 1.1436, test_f1: 0.5058
 epoch: 61, train_loss: 0.6786, test_loss: 1.1349, test_f1: 0.5029
 epoch: 62, train_loss: 0.6652, test_loss: 1.1387, test_f1: 0.4888
 epoch: 63, train_loss: 0.6671, test_loss: 1.1542, test_f1: 0.4923
 epoch: 64, train_loss: 0.6705, test_loss: 1.1494, test_f1: 0.4918
 epoch: 65, train_loss: 0.6720, test_loss: 1.1340, test_f1: 0.5025
 epoch: 66, train_loss: 0.6720, test_loss: 1.1633, test_f1: 0.4890
 epoch: 67, train_loss: 0.6608, test_loss: 1.1757, test_f1: 0.5003
 epoch: 68, train_loss: 0.6449, test_loss: 1.1790, test_f1: 0.4950
 epoch: 69, train_loss: 0.6477, test_loss: 1.1874, test_f1: 0.4887
 epoch: 70, train_loss: 0.6436, test_loss: 1.2188, test_f1: 0.4782
 epoch: 71, train_loss: 0.6306, test_loss: 1.1910, test_f1: 0.4783
 epoch: 72, train_loss: 0.6478, test_loss: 1.2064, test_f1: 0.4679
 epoch: 73, train_loss: 0.6284, test_loss: 1.2086, test_f1: 0.4933
 epoch: 74, train_loss: 0.6262, test_loss: 1.2023, test_f1: 0.4875
 epoch: 75, train_loss: 0.6384, test_loss: 1.1965, test_f1: 0.4954
 epoch: 76, train_loss: 0.6301, test_loss: 1.2206, test_f1: 0.5026
 epoch: 77, train_loss: 0.6102, test_loss: 1.2247, test_f1: 0.4959
 epoch: 78, train_loss: 0.6338, test_loss: 1.1988, test_f1: 0.4803
 epoch: 79, train_loss: 0.6239, test_loss: 1.2400, test_f1: 0.5005
 epoch: 80, train_loss: 0.6244, test_loss: 1.2199, test_f1: 0.4867
 epoch: 81, train_loss: 0.6209, test_loss: 1.2286, test_f1: 0.4896
 epoch: 82, train_loss: 0.6266, test_loss: 1.1992, test_f1: 0.5110
 epoch: 83, train_loss: 0.6143, test_loss: 1.2305, test_f1: 0.4860
 epoch: 84, train_loss: 0.6100, test_loss: 1.2240, test_f1: 0.4849
 epoch: 85, train_loss: 0.6038, test_loss: 1.2678, test_f1: 0.4859
 epoch: 86, train_loss: 0.6188, test_loss: 1.2251, test_f1: 0.5030
 epoch: 87, train_loss: 0.6008, test_loss: 1.2132, test_f1: 0.4894
 epoch: 88, train_loss: 0.5945, test_loss: 1.2433, test_f1: 0.4998
 epoch: 89, train_loss: 0.6051, test_loss: 1.2331, test_f1: 0.4988
 epoch: 90, train_loss: 0.5961, test_loss: 1.2358, test_f1: 0.4922
 epoch: 91, train_loss: 0.5951, test_loss: 1.2409, test_f1: 0.5084
 epoch: 92, train_loss: 0.5990, test_loss: 1.2765, test_f1: 0.4884
 epoch: 93, train_loss: 0.5798, test_loss: 1.2771, test_f1: 0.4823
 epoch: 94, train_loss: 0.5909, test_loss: 1.2712, test_f1: 0.5019
 epoch: 95, train_loss: 0.5812, test_loss: 1.2691, test_f1: 0.5005
 epoch: 96, train_loss: 0.5886, test_loss: 1.3227, test_f1: 0.4785
 epoch: 97, train_loss: 0.5710, test_loss: 1.2904, test_f1: 0.4853
 epoch: 98, train_loss: 0.5699, test_loss: 1.2776, test_f1: 0.4925
 epoch: 99, train_loss: 0.6011, test_loss: 1.2840, test_f1: 0.4913
##################ITERATION #9 ****************************************
 epoch: 0, train_loss: 1.3510, test_loss: 1.2860, test_f1: 0.3338
 epoch: 1, train_loss: 1.2416, test_loss: 1.1972, test_f1: 0.4140
 epoch: 2, train_loss: 1.2097, test_loss: 1.1533, test_f1: 0.4527
 epoch: 3, train_loss: 1.1735, test_loss: 1.1232, test_f1: 0.4457
 epoch: 4, train_loss: 1.1535, test_loss: 1.1017, test_f1: 0.4615
 epoch: 5, train_loss: 1.1360, test_loss: 1.0988, test_f1: 0.4510
 epoch: 6, train_loss: 1.1061, test_loss: 1.0771, test_f1: 0.4542
 epoch: 7, train_loss: 1.0931, test_loss: 1.0691, test_f1: 0.4758
 epoch: 8, train_loss: 1.0821, test_loss: 1.0674, test_f1: 0.4773
 epoch: 9, train_loss: 1.0848, test_loss: 1.0622, test_f1: 0.4694
 epoch: 10, train_loss: 1.0509, test_loss: 1.0311, test_f1: 0.4788
 epoch: 11, train_loss: 1.0487, test_loss: 1.0325, test_f1: 0.4921
 epoch: 12, train_loss: 1.0352, test_loss: 1.0243, test_f1: 0.4932
 epoch: 13, train_loss: 1.0316, test_loss: 1.0151, test_f1: 0.5018
 epoch: 14, train_loss: 1.0342, test_loss: 1.0038, test_f1: 0.5062
 epoch: 15, train_loss: 1.0062, test_loss: 1.0221, test_f1: 0.5131
 epoch: 16, train_loss: 0.9873, test_loss: 0.9972, test_f1: 0.5066
 epoch: 17, train_loss: 0.9668, test_loss: 0.9840, test_f1: 0.5199
 epoch: 18, train_loss: 0.9615, test_loss: 0.9944, test_f1: 0.5138
 epoch: 19, train_loss: 0.9592, test_loss: 0.9977, test_f1: 0.5125
 epoch: 20, train_loss: 0.9525, test_loss: 0.9949, test_f1: 0.5125
 epoch: 21, train_loss: 0.9446, test_loss: 0.9871, test_f1: 0.5188
 epoch: 22, train_loss: 0.9325, test_loss: 0.9945, test_f1: 0.5282
 epoch: 23, train_loss: 0.9381, test_loss: 0.9807, test_f1: 0.5169
 epoch: 24, train_loss: 0.9137, test_loss: 0.9772, test_f1: 0.5060
 epoch: 25, train_loss: 0.9025, test_loss: 0.9803, test_f1: 0.5128
 epoch: 26, train_loss: 0.9008, test_loss: 0.9720, test_f1: 0.5293
 epoch: 27, train_loss: 0.8855, test_loss: 0.9921, test_f1: 0.5003
 epoch: 28, train_loss: 0.8727, test_loss: 0.9716, test_f1: 0.5293
 epoch: 29, train_loss: 0.8526, test_loss: 0.9753, test_f1: 0.5353
 epoch: 30, train_loss: 0.8684, test_loss: 0.9876, test_f1: 0.5246
 epoch: 31, train_loss: 0.8598, test_loss: 0.9852, test_f1: 0.5241
 epoch: 32, train_loss: 0.8525, test_loss: 0.9881, test_f1: 0.5192
 epoch: 33, train_loss: 0.8510, test_loss: 1.0049, test_f1: 0.5174
 epoch: 34, train_loss: 0.8280, test_loss: 0.9684, test_f1: 0.5245
 epoch: 35, train_loss: 0.8148, test_loss: 0.9852, test_f1: 0.5267
 epoch: 36, train_loss: 0.8165, test_loss: 0.9938, test_f1: 0.5217
 epoch: 37, train_loss: 0.8140, test_loss: 1.0031, test_f1: 0.5337
 epoch: 38, train_loss: 0.8044, test_loss: 0.9911, test_f1: 0.5219
 epoch: 39, train_loss: 0.7948, test_loss: 1.0349, test_f1: 0.5178
 epoch: 40, train_loss: 0.7732, test_loss: 0.9957, test_f1: 0.5114
 epoch: 41, train_loss: 0.7851, test_loss: 1.0459, test_f1: 0.5146
 epoch: 42, train_loss: 0.7621, test_loss: 1.0004, test_f1: 0.5409
 epoch: 43, train_loss: 0.7580, test_loss: 1.0024, test_f1: 0.5389
 epoch: 44, train_loss: 0.7716, test_loss: 1.0682, test_f1: 0.5160
 epoch: 45, train_loss: 0.7506, test_loss: 1.0247, test_f1: 0.5280
 epoch: 46, train_loss: 0.7547, test_loss: 1.0528, test_f1: 0.5045
 epoch: 47, train_loss: 0.7453, test_loss: 1.0305, test_f1: 0.5191
 epoch: 48, train_loss: 0.7316, test_loss: 1.0205, test_f1: 0.5344
 epoch: 49, train_loss: 0.7302, test_loss: 1.0125, test_f1: 0.5486
 epoch: 50, train_loss: 0.6996, test_loss: 1.0617, test_f1: 0.5301
 epoch: 51, train_loss: 0.7152, test_loss: 1.0288, test_f1: 0.5356
 epoch: 52, train_loss: 0.6928, test_loss: 1.0381, test_f1: 0.5449
 epoch: 53, train_loss: 0.6880, test_loss: 1.0319, test_f1: 0.5362
 epoch: 54, train_loss: 0.6880, test_loss: 1.0543, test_f1: 0.5373
 epoch: 55, train_loss: 0.6807, test_loss: 1.0572, test_f1: 0.5423
 epoch: 56, train_loss: 0.6822, test_loss: 1.0469, test_f1: 0.5442
 epoch: 57, train_loss: 0.6762, test_loss: 1.0695, test_f1: 0.5325
 epoch: 58, train_loss: 0.6881, test_loss: 1.0562, test_f1: 0.5357
 epoch: 59, train_loss: 0.6645, test_loss: 1.0626, test_f1: 0.5302
 epoch: 60, train_loss: 0.6667, test_loss: 1.0651, test_f1: 0.5450
 epoch: 61, train_loss: 0.6790, test_loss: 1.0563, test_f1: 0.5472
 epoch: 62, train_loss: 0.6595, test_loss: 1.0878, test_f1: 0.5387
 epoch: 63, train_loss: 0.6634, test_loss: 1.0602, test_f1: 0.5414
 epoch: 64, train_loss: 0.6599, test_loss: 1.0613, test_f1: 0.5480
 epoch: 65, train_loss: 0.6409, test_loss: 1.1013, test_f1: 0.5435
 epoch: 66, train_loss: 0.6418, test_loss: 1.1007, test_f1: 0.5449
 epoch: 67, train_loss: 0.6505, test_loss: 1.1248, test_f1: 0.5424
 epoch: 68, train_loss: 0.6521, test_loss: 1.0998, test_f1: 0.5311
 epoch: 69, train_loss: 0.6374, test_loss: 1.1214, test_f1: 0.5262
 epoch: 70, train_loss: 0.6384, test_loss: 1.0999, test_f1: 0.5317
 epoch: 71, train_loss: 0.6438, test_loss: 1.0895, test_f1: 0.5469
 epoch: 72, train_loss: 0.6467, test_loss: 1.0789, test_f1: 0.5450
 epoch: 73, train_loss: 0.6478, test_loss: 1.1140, test_f1: 0.5358
 epoch: 74, train_loss: 0.6390, test_loss: 1.0935, test_f1: 0.5469
 epoch: 75, train_loss: 0.6294, test_loss: 1.0942, test_f1: 0.5435
 epoch: 76, train_loss: 0.6193, test_loss: 1.0815, test_f1: 0.5522
 epoch: 77, train_loss: 0.6190, test_loss: 1.0957, test_f1: 0.5325
 epoch: 78, train_loss: 0.6170, test_loss: 1.1128, test_f1: 0.5357
 epoch: 79, train_loss: 0.6162, test_loss: 1.0930, test_f1: 0.5497
 epoch: 80, train_loss: 0.6217, test_loss: 1.0934, test_f1: 0.5525
 epoch: 81, train_loss: 0.6109, test_loss: 1.1022, test_f1: 0.5443
 epoch: 82, train_loss: 0.6103, test_loss: 1.1002, test_f1: 0.5390
 epoch: 83, train_loss: 0.5962, test_loss: 1.1221, test_f1: 0.5493
 epoch: 84, train_loss: 0.5817, test_loss: 1.1453, test_f1: 0.5508
 epoch: 85, train_loss: 0.5994, test_loss: 1.1276, test_f1: 0.5346
 epoch: 86, train_loss: 0.5929, test_loss: 1.1203, test_f1: 0.5379
 epoch: 87, train_loss: 0.6047, test_loss: 1.1787, test_f1: 0.5252
 epoch: 88, train_loss: 0.5897, test_loss: 1.1419, test_f1: 0.5350
 epoch: 89, train_loss: 0.5830, test_loss: 1.1438, test_f1: 0.5395
 epoch: 90, train_loss: 0.5811, test_loss: 1.1432, test_f1: 0.5516
 epoch: 91, train_loss: 0.5758, test_loss: 1.1401, test_f1: 0.5418
 epoch: 92, train_loss: 0.5761, test_loss: 1.1606, test_f1: 0.5397
 epoch: 93, train_loss: 0.5668, test_loss: 1.1402, test_f1: 0.5472
 epoch: 94, train_loss: 0.5684, test_loss: 1.1671, test_f1: 0.5372
 epoch: 95, train_loss: 0.5597, test_loss: 1.1793, test_f1: 0.5514
 epoch: 96, train_loss: 0.5659, test_loss: 1.1765, test_f1: 0.5493
 epoch: 97, train_loss: 0.5727, test_loss: 1.1756, test_f1: 0.5480
 epoch: 98, train_loss: 0.5637, test_loss: 1.2094, test_f1: 0.5468
 epoch: 99, train_loss: 0.5656, test_loss: 1.1796, test_f1: 0.5505

Training completed in 490.90 seconds
Best F1: 0.5567 at epoch 88
Mean F1 across iterations: 0.5417  0.0144
========================FINAL RESULTS================================
FEGIN weighted F1: 0.5567  0.0144
python main.py --data ltspice_examples --representation component_component --model FEGIN --layers 4 --hiddens 128 --batch_size 128 --lr 0.0001 --emb_size 128 --epochs 100 --save_appendix component_component_L4_H128_BS128_LR0.0001_E128 --no_val
-----



STDERR:
  File "main.py", line 370, in <module>
    main()
  File "main.py", line 254, in main
    dataset = dataset_class(
  File "/home/philip/projects/ltspice_examples_code_repo/Circuit-Completion-Using-GNNs/component_classification_with_link_prediction_head/evaluation/FEGIN/kernel/circuit_datasets.py", line 15, in __init__
    self.data, self.slices = torch.load(self.processed_paths[0])
  File "/home/philip/.local/lib/python3.8/site-packages/torch/serialization.py", line 1040, in load
    warnings.warn(
  File "/usr/lib/python3.8/warnings.py", line 109, in _showwarnmsg
    sw(msg.message, msg.category, msg.filename, msg.lineno,
  File "main.py", line 47, in warn_with_traceback
    traceback.print_stack(file=log)
/home/philip/projects/ltspice_examples_code_repo/Circuit-Completion-Using-GNNs/component_classification_with_link_prediction_head/evaluation/FEGIN/kernel/circuit_datasets.py:15: FutureWarning: You are using `torch.load` with `weights_only=False` (the current default value), which uses the default pickle module implicitly. It is possible to construct malicious pickle data which will execute arbitrary code during unpickling (See https://github.com/pytorch/pytorch/blob/main/SECURITY.md#untrusted-models for more details). In a future release, the default value for `weights_only` will be flipped to `True`. This limits the functions that could be executed during unpickling. Arbitrary objects will no longer be allowed to be loaded via this mode unless they are explicitly allowlisted by the user via `torch.serialization.add_safe_globals`. We recommend you start setting `weights_only=True` for any use case where you don't have full control of the loaded file. Please open an issue on GitHub for any issues related to this experimental feature.
  self.data, self.slices = torch.load(self.processed_paths[0])
