STDOUT:
Results will be saved in /home/philip/projects/ltspice_examples_code_repo/Circuit-Completion-Using-GNNs/component_classification_with_link_prediction_head/evaluation/FEGIN/results/model_FEGIN_dataset_ltspice_examples
Command line input: python main.py --data ltspice_examples --representation component_component --model FEGIN --layers 2 --hiddens 64 --batch_size 128 --lr 0.001 --emb_size 250 --epochs 100 --save_appendix component_component_L2_H64_BS128_LR0.001_E250 --no_val
 is saved.
-----
ltspice_examples - FEGIN
Using 2 layers, 64 hidden units, h = 2
Loading component_component representation dataset
ENTERED
Training FEGIN on component_component representation
Train: 3556, Test: 845
##################ITERATION #0 ****************************************
 epoch: 0, train_loss: 1.3136, test_loss: 1.2546, test_f1: 0.2274
 epoch: 1, train_loss: 1.1969, test_loss: 1.1573, test_f1: 0.3360
 epoch: 2, train_loss: 1.1535, test_loss: 1.1042, test_f1: 0.3609
 epoch: 3, train_loss: 1.1154, test_loss: 1.0597, test_f1: 0.4654
 epoch: 4, train_loss: 1.0837, test_loss: 1.0210, test_f1: 0.4473
 epoch: 5, train_loss: 1.0557, test_loss: 0.9782, test_f1: 0.5133
 epoch: 6, train_loss: 1.0262, test_loss: 1.0265, test_f1: 0.4472
 epoch: 7, train_loss: 0.9951, test_loss: 0.9456, test_f1: 0.4909
 epoch: 8, train_loss: 0.9759, test_loss: 0.9485, test_f1: 0.5034
 epoch: 9, train_loss: 0.9629, test_loss: 0.9926, test_f1: 0.4827
 epoch: 10, train_loss: 0.9384, test_loss: 0.9154, test_f1: 0.5240
 epoch: 11, train_loss: 0.9164, test_loss: 0.9232, test_f1: 0.4990
 epoch: 12, train_loss: 0.9111, test_loss: 0.9161, test_f1: 0.5258
 epoch: 13, train_loss: 0.8869, test_loss: 0.9741, test_f1: 0.4624
 epoch: 14, train_loss: 0.8960, test_loss: 0.9165, test_f1: 0.5178
 epoch: 15, train_loss: 0.8758, test_loss: 1.0297, test_f1: 0.5009
 epoch: 16, train_loss: 0.8699, test_loss: 0.9290, test_f1: 0.5375
 epoch: 17, train_loss: 0.8617, test_loss: 0.9605, test_f1: 0.5297
 epoch: 18, train_loss: 0.8526, test_loss: 1.0007, test_f1: 0.4997
 epoch: 19, train_loss: 0.8370, test_loss: 0.9265, test_f1: 0.5341
 epoch: 20, train_loss: 0.8306, test_loss: 0.9555, test_f1: 0.5395
 epoch: 21, train_loss: 0.8091, test_loss: 0.9569, test_f1: 0.5258
 epoch: 22, train_loss: 0.8183, test_loss: 0.9403, test_f1: 0.5427
 epoch: 23, train_loss: 0.8034, test_loss: 0.9321, test_f1: 0.5282
 epoch: 24, train_loss: 0.7875, test_loss: 1.0211, test_f1: 0.5125
 epoch: 25, train_loss: 0.7828, test_loss: 0.9642, test_f1: 0.5407
 epoch: 26, train_loss: 0.7681, test_loss: 1.0072, test_f1: 0.5148
 epoch: 27, train_loss: 0.7683, test_loss: 1.0082, test_f1: 0.5102
 epoch: 28, train_loss: 0.7595, test_loss: 1.0170, test_f1: 0.5137
 epoch: 29, train_loss: 0.7652, test_loss: 0.9913, test_f1: 0.5535
 epoch: 30, train_loss: 0.7422, test_loss: 1.1208, test_f1: 0.4841
 epoch: 31, train_loss: 0.7417, test_loss: 1.0710, test_f1: 0.5153
 epoch: 32, train_loss: 0.7226, test_loss: 1.0937, test_f1: 0.5200
 epoch: 33, train_loss: 0.7179, test_loss: 1.0453, test_f1: 0.5432
 epoch: 34, train_loss: 0.7208, test_loss: 1.0850, test_f1: 0.5071
 epoch: 35, train_loss: 0.7111, test_loss: 1.1323, test_f1: 0.5451
 epoch: 36, train_loss: 0.7028, test_loss: 1.0977, test_f1: 0.5392
 epoch: 37, train_loss: 0.7005, test_loss: 1.1022, test_f1: 0.5515
 epoch: 38, train_loss: 0.6882, test_loss: 1.1239, test_f1: 0.5019
 epoch: 39, train_loss: 0.6783, test_loss: 1.1322, test_f1: 0.5122
 epoch: 40, train_loss: 0.6673, test_loss: 1.2032, test_f1: 0.5264
 epoch: 41, train_loss: 0.6495, test_loss: 1.0899, test_f1: 0.5327
 epoch: 42, train_loss: 0.6647, test_loss: 1.1686, test_f1: 0.5431
 epoch: 43, train_loss: 0.6504, test_loss: 1.1824, test_f1: 0.5503
 epoch: 44, train_loss: 0.6388, test_loss: 1.1525, test_f1: 0.5327
 epoch: 45, train_loss: 0.6418, test_loss: 1.2140, test_f1: 0.5366
 epoch: 46, train_loss: 0.6417, test_loss: 1.2117, test_f1: 0.5239
 epoch: 47, train_loss: 0.6385, test_loss: 1.1112, test_f1: 0.5566
 epoch: 48, train_loss: 0.6095, test_loss: 1.2445, test_f1: 0.5319
 epoch: 49, train_loss: 0.6252, test_loss: 1.2522, test_f1: 0.5243
 epoch: 50, train_loss: 0.6110, test_loss: 1.2432, test_f1: 0.5180
 epoch: 51, train_loss: 0.5795, test_loss: 1.2241, test_f1: 0.5368
 epoch: 52, train_loss: 0.5662, test_loss: 1.2862, test_f1: 0.5278
 epoch: 53, train_loss: 0.5576, test_loss: 1.1683, test_f1: 0.5739
 epoch: 54, train_loss: 0.5477, test_loss: 1.2663, test_f1: 0.5212
 epoch: 55, train_loss: 0.5499, test_loss: 1.2828, test_f1: 0.5198
 epoch: 56, train_loss: 0.5570, test_loss: 1.2416, test_f1: 0.5474
 epoch: 57, train_loss: 0.5552, test_loss: 1.2630, test_f1: 0.5414
 epoch: 58, train_loss: 0.5444, test_loss: 1.3717, test_f1: 0.5326
 epoch: 59, train_loss: 0.5179, test_loss: 1.3496, test_f1: 0.5224
 epoch: 60, train_loss: 0.5310, test_loss: 1.3294, test_f1: 0.5273
 epoch: 61, train_loss: 0.5158, test_loss: 1.3743, test_f1: 0.5185
 epoch: 62, train_loss: 0.5391, test_loss: 1.3306, test_f1: 0.5256
 epoch: 63, train_loss: 0.5101, test_loss: 1.4033, test_f1: 0.5042
 epoch: 64, train_loss: 0.5158, test_loss: 1.2853, test_f1: 0.5626
 epoch: 65, train_loss: 0.5225, test_loss: 1.3039, test_f1: 0.5246
 epoch: 66, train_loss: 0.5188, test_loss: 1.3918, test_f1: 0.5210
 epoch: 67, train_loss: 0.5127, test_loss: 1.4053, test_f1: 0.5284
 epoch: 68, train_loss: 0.5050, test_loss: 1.3844, test_f1: 0.5095
 epoch: 69, train_loss: 0.5040, test_loss: 1.3961, test_f1: 0.5415
 epoch: 70, train_loss: 0.5030, test_loss: 1.4408, test_f1: 0.5253
 epoch: 71, train_loss: 0.4828, test_loss: 1.3791, test_f1: 0.5316
 epoch: 72, train_loss: 0.4881, test_loss: 1.4910, test_f1: 0.5299
 epoch: 73, train_loss: 0.4903, test_loss: 1.4306, test_f1: 0.5424
 epoch: 74, train_loss: 0.4753, test_loss: 1.4650, test_f1: 0.5336
 epoch: 75, train_loss: 0.4709, test_loss: 1.4792, test_f1: 0.5594
 epoch: 76, train_loss: 0.4747, test_loss: 1.4777, test_f1: 0.5375
 epoch: 77, train_loss: 0.4830, test_loss: 1.4598, test_f1: 0.5409
 epoch: 78, train_loss: 0.4888, test_loss: 1.4822, test_f1: 0.5322
 epoch: 79, train_loss: 0.4769, test_loss: 1.6169, test_f1: 0.5480
 epoch: 80, train_loss: 0.4719, test_loss: 1.4545, test_f1: 0.5438
 epoch: 81, train_loss: 0.4590, test_loss: 1.6022, test_f1: 0.5154
 epoch: 82, train_loss: 0.4459, test_loss: 1.5692, test_f1: 0.5134
 epoch: 83, train_loss: 0.4662, test_loss: 1.5508, test_f1: 0.5431
 epoch: 84, train_loss: 0.4675, test_loss: 1.4325, test_f1: 0.5437
 epoch: 85, train_loss: 0.4690, test_loss: 1.5263, test_f1: 0.5490
 epoch: 86, train_loss: 0.4512, test_loss: 1.6055, test_f1: 0.5549
 epoch: 87, train_loss: 0.4491, test_loss: 1.5601, test_f1: 0.5315
 epoch: 88, train_loss: 0.4346, test_loss: 1.6794, test_f1: 0.5297
 epoch: 89, train_loss: 0.4457, test_loss: 1.5323, test_f1: 0.5325
 epoch: 90, train_loss: 0.4386, test_loss: 1.5784, test_f1: 0.5346
 epoch: 91, train_loss: 0.4413, test_loss: 1.5331, test_f1: 0.5459
 epoch: 92, train_loss: 0.4427, test_loss: 1.5241, test_f1: 0.5671
 epoch: 93, train_loss: 0.4387, test_loss: 1.5293, test_f1: 0.5572
 epoch: 94, train_loss: 0.4382, test_loss: 1.5238, test_f1: 0.5241
 epoch: 95, train_loss: 0.4358, test_loss: 1.5447, test_f1: 0.5446
 epoch: 96, train_loss: 0.4308, test_loss: 1.5840, test_f1: 0.5444
 epoch: 97, train_loss: 0.4199, test_loss: 1.6629, test_f1: 0.5188
 epoch: 98, train_loss: 0.4279, test_loss: 1.7211, test_f1: 0.5197
 epoch: 99, train_loss: 0.4116, test_loss: 1.8151, test_f1: 0.5212
##################ITERATION #1 ****************************************
 epoch: 0, train_loss: 1.2544, test_loss: 1.2612, test_f1: 0.3323
 epoch: 1, train_loss: 1.1351, test_loss: 1.0966, test_f1: 0.4173
 epoch: 2, train_loss: 1.0880, test_loss: 1.0128, test_f1: 0.4587
 epoch: 3, train_loss: 1.0433, test_loss: 0.9848, test_f1: 0.5018
 epoch: 4, train_loss: 1.0090, test_loss: 0.9392, test_f1: 0.4896
 epoch: 5, train_loss: 0.9878, test_loss: 0.9265, test_f1: 0.4739
 epoch: 6, train_loss: 0.9614, test_loss: 0.9912, test_f1: 0.4984
 epoch: 7, train_loss: 0.9554, test_loss: 0.9186, test_f1: 0.4690
 epoch: 8, train_loss: 0.9281, test_loss: 1.0057, test_f1: 0.4743
 epoch: 9, train_loss: 0.9130, test_loss: 0.9406, test_f1: 0.4925
 epoch: 10, train_loss: 0.8863, test_loss: 0.9344, test_f1: 0.4988
 epoch: 11, train_loss: 0.8818, test_loss: 0.9530, test_f1: 0.5233
 epoch: 12, train_loss: 0.8797, test_loss: 0.9446, test_f1: 0.4986
 epoch: 13, train_loss: 0.8631, test_loss: 0.9250, test_f1: 0.5313
 epoch: 14, train_loss: 0.8500, test_loss: 0.9378, test_f1: 0.5202
 epoch: 15, train_loss: 0.8386, test_loss: 0.9431, test_f1: 0.5411
 epoch: 16, train_loss: 0.8177, test_loss: 0.9063, test_f1: 0.5339
 epoch: 17, train_loss: 0.8105, test_loss: 1.0542, test_f1: 0.5089
 epoch: 18, train_loss: 0.8044, test_loss: 1.0029, test_f1: 0.5143
 epoch: 19, train_loss: 0.7873, test_loss: 0.9782, test_f1: 0.5272
 epoch: 20, train_loss: 0.7734, test_loss: 0.9926, test_f1: 0.5440
 epoch: 21, train_loss: 0.7743, test_loss: 1.0381, test_f1: 0.5363
 epoch: 22, train_loss: 0.7567, test_loss: 1.0079, test_f1: 0.5167
 epoch: 23, train_loss: 0.7507, test_loss: 0.9738, test_f1: 0.5454
 epoch: 24, train_loss: 0.7508, test_loss: 0.9957, test_f1: 0.5625
 epoch: 25, train_loss: 0.7321, test_loss: 1.0386, test_f1: 0.5562
 epoch: 26, train_loss: 0.7284, test_loss: 1.0894, test_f1: 0.5193
 epoch: 27, train_loss: 0.7280, test_loss: 1.0540, test_f1: 0.5460
 epoch: 28, train_loss: 0.7086, test_loss: 1.0535, test_f1: 0.5410
 epoch: 29, train_loss: 0.7096, test_loss: 1.1796, test_f1: 0.5301
 epoch: 30, train_loss: 0.7005, test_loss: 1.1266, test_f1: 0.5416
 epoch: 31, train_loss: 0.6908, test_loss: 1.0830, test_f1: 0.5441
 epoch: 32, train_loss: 0.6818, test_loss: 1.0592, test_f1: 0.5586
 epoch: 33, train_loss: 0.6590, test_loss: 1.0441, test_f1: 0.5924
 epoch: 34, train_loss: 0.6628, test_loss: 1.1223, test_f1: 0.5411
 epoch: 35, train_loss: 0.6543, test_loss: 1.0629, test_f1: 0.5715
 epoch: 36, train_loss: 0.6509, test_loss: 1.0373, test_f1: 0.5847
 epoch: 37, train_loss: 0.6432, test_loss: 1.0907, test_f1: 0.5933
 epoch: 38, train_loss: 0.6199, test_loss: 1.1151, test_f1: 0.5658
 epoch: 39, train_loss: 0.5996, test_loss: 1.1571, test_f1: 0.5634
 epoch: 40, train_loss: 0.6216, test_loss: 1.1216, test_f1: 0.5718
 epoch: 41, train_loss: 0.5978, test_loss: 1.1185, test_f1: 0.5680
 epoch: 42, train_loss: 0.5957, test_loss: 1.0810, test_f1: 0.5820
 epoch: 43, train_loss: 0.5715, test_loss: 1.1700, test_f1: 0.5782
 epoch: 44, train_loss: 0.5822, test_loss: 1.2736, test_f1: 0.5447
 epoch: 45, train_loss: 0.5470, test_loss: 1.1596, test_f1: 0.5686
 epoch: 46, train_loss: 0.5536, test_loss: 1.1629, test_f1: 0.5540
 epoch: 47, train_loss: 0.5533, test_loss: 1.1993, test_f1: 0.5684
 epoch: 48, train_loss: 0.5289, test_loss: 1.2418, test_f1: 0.5383
 epoch: 49, train_loss: 0.5400, test_loss: 1.3383, test_f1: 0.5450
 epoch: 50, train_loss: 0.5373, test_loss: 1.2574, test_f1: 0.5379
 epoch: 51, train_loss: 0.5036, test_loss: 1.2534, test_f1: 0.5540
 epoch: 52, train_loss: 0.4677, test_loss: 1.2470, test_f1: 0.5845
 epoch: 53, train_loss: 0.4748, test_loss: 1.2869, test_f1: 0.5717
 epoch: 54, train_loss: 0.4613, test_loss: 1.2701, test_f1: 0.5672
 epoch: 55, train_loss: 0.4576, test_loss: 1.3228, test_f1: 0.5624
 epoch: 56, train_loss: 0.4507, test_loss: 1.3057, test_f1: 0.5367
 epoch: 57, train_loss: 0.4421, test_loss: 1.3467, test_f1: 0.5540
 epoch: 58, train_loss: 0.4370, test_loss: 1.3998, test_f1: 0.5469
 epoch: 59, train_loss: 0.4377, test_loss: 1.4128, test_f1: 0.5360
 epoch: 60, train_loss: 0.4153, test_loss: 1.4455, test_f1: 0.5379
 epoch: 61, train_loss: 0.4215, test_loss: 1.3680, test_f1: 0.5651
 epoch: 62, train_loss: 0.4215, test_loss: 1.4290, test_f1: 0.5466
 epoch: 63, train_loss: 0.4182, test_loss: 1.4141, test_f1: 0.5608
 epoch: 64, train_loss: 0.4287, test_loss: 1.4336, test_f1: 0.5330
 epoch: 65, train_loss: 0.4174, test_loss: 1.4335, test_f1: 0.5530
 epoch: 66, train_loss: 0.4105, test_loss: 1.4109, test_f1: 0.5575
 epoch: 67, train_loss: 0.4014, test_loss: 1.4596, test_f1: 0.5396
 epoch: 68, train_loss: 0.4149, test_loss: 1.4333, test_f1: 0.5625
 epoch: 69, train_loss: 0.4113, test_loss: 1.5143, test_f1: 0.5569
 epoch: 70, train_loss: 0.3925, test_loss: 1.5202, test_f1: 0.5264
 epoch: 71, train_loss: 0.3997, test_loss: 1.5157, test_f1: 0.5727
 epoch: 72, train_loss: 0.3775, test_loss: 1.4788, test_f1: 0.5559
 epoch: 73, train_loss: 0.3856, test_loss: 1.5696, test_f1: 0.5412
 epoch: 74, train_loss: 0.3736, test_loss: 1.6790, test_f1: 0.5646
 epoch: 75, train_loss: 0.3779, test_loss: 1.5041, test_f1: 0.5663
 epoch: 76, train_loss: 0.3708, test_loss: 1.6231, test_f1: 0.5470
 epoch: 77, train_loss: 0.3711, test_loss: 1.4988, test_f1: 0.5497
 epoch: 78, train_loss: 0.3773, test_loss: 1.5135, test_f1: 0.5534
 epoch: 79, train_loss: 0.3735, test_loss: 1.5274, test_f1: 0.5818
 epoch: 80, train_loss: 0.3632, test_loss: 1.5923, test_f1: 0.5479
 epoch: 81, train_loss: 0.3643, test_loss: 1.5908, test_f1: 0.5526
 epoch: 82, train_loss: 0.3770, test_loss: 1.5801, test_f1: 0.5682
 epoch: 83, train_loss: 0.3485, test_loss: 1.6316, test_f1: 0.5424
 epoch: 84, train_loss: 0.3601, test_loss: 1.8105, test_f1: 0.5394
 epoch: 85, train_loss: 0.3613, test_loss: 1.5840, test_f1: 0.5349
 epoch: 86, train_loss: 0.3522, test_loss: 1.6382, test_f1: 0.5449
 epoch: 87, train_loss: 0.3373, test_loss: 1.5863, test_f1: 0.5624
 epoch: 88, train_loss: 0.3258, test_loss: 1.7370, test_f1: 0.5361
 epoch: 89, train_loss: 0.3532, test_loss: 1.6258, test_f1: 0.5600
 epoch: 90, train_loss: 0.3223, test_loss: 1.7352, test_f1: 0.5498
 epoch: 91, train_loss: 0.3398, test_loss: 1.8168, test_f1: 0.5382
 epoch: 92, train_loss: 0.3311, test_loss: 1.8944, test_f1: 0.5435
 epoch: 93, train_loss: 0.3156, test_loss: 1.8847, test_f1: 0.5616
 epoch: 94, train_loss: 0.3257, test_loss: 1.7894, test_f1: 0.5514
 epoch: 95, train_loss: 0.3238, test_loss: 1.6965, test_f1: 0.5646
 epoch: 96, train_loss: 0.3238, test_loss: 1.8049, test_f1: 0.5417
 epoch: 97, train_loss: 0.3269, test_loss: 1.6911, test_f1: 0.5551
 epoch: 98, train_loss: 0.3149, test_loss: 2.0344, test_f1: 0.5264
 epoch: 99, train_loss: 0.3256, test_loss: 1.8584, test_f1: 0.5469
##################ITERATION #2 ****************************************
 epoch: 0, train_loss: 1.3394, test_loss: 1.2356, test_f1: 0.3265
 epoch: 1, train_loss: 1.1759, test_loss: 1.1359, test_f1: 0.4562
 epoch: 2, train_loss: 1.1378, test_loss: 1.0684, test_f1: 0.4485
 epoch: 3, train_loss: 1.1094, test_loss: 1.0318, test_f1: 0.4849
 epoch: 4, train_loss: 1.0780, test_loss: 1.0121, test_f1: 0.4491
 epoch: 5, train_loss: 1.0452, test_loss: 1.0073, test_f1: 0.4965
 epoch: 6, train_loss: 1.0257, test_loss: 0.9811, test_f1: 0.4819
 epoch: 7, train_loss: 0.9976, test_loss: 0.9547, test_f1: 0.4922
 epoch: 8, train_loss: 0.9748, test_loss: 0.9462, test_f1: 0.5017
 epoch: 9, train_loss: 0.9643, test_loss: 0.9479, test_f1: 0.4689
 epoch: 10, train_loss: 0.9387, test_loss: 0.9715, test_f1: 0.4784
 epoch: 11, train_loss: 0.9356, test_loss: 0.9572, test_f1: 0.4774
 epoch: 12, train_loss: 0.9330, test_loss: 0.9926, test_f1: 0.4914
 epoch: 13, train_loss: 0.9139, test_loss: 0.9691, test_f1: 0.4921
 epoch: 14, train_loss: 0.9064, test_loss: 1.0104, test_f1: 0.4807
 epoch: 15, train_loss: 0.8824, test_loss: 0.9857, test_f1: 0.4994
 epoch: 16, train_loss: 0.8864, test_loss: 0.9741, test_f1: 0.5288
 epoch: 17, train_loss: 0.8734, test_loss: 0.9840, test_f1: 0.5116
 epoch: 18, train_loss: 0.8695, test_loss: 0.9951, test_f1: 0.5011
 epoch: 19, train_loss: 0.8606, test_loss: 1.0237, test_f1: 0.5005
 epoch: 20, train_loss: 0.8453, test_loss: 0.9897, test_f1: 0.5242
 epoch: 21, train_loss: 0.8467, test_loss: 0.9818, test_f1: 0.5201
 epoch: 22, train_loss: 0.8337, test_loss: 0.9758, test_f1: 0.5205
 epoch: 23, train_loss: 0.8231, test_loss: 1.0073, test_f1: 0.5206
 epoch: 24, train_loss: 0.8205, test_loss: 1.0161, test_f1: 0.5114
 epoch: 25, train_loss: 0.8038, test_loss: 0.9958, test_f1: 0.5417
 epoch: 26, train_loss: 0.7995, test_loss: 1.0522, test_f1: 0.5331
 epoch: 27, train_loss: 0.8042, test_loss: 0.9917, test_f1: 0.5436
 epoch: 28, train_loss: 0.8032, test_loss: 1.0577, test_f1: 0.5168
 epoch: 29, train_loss: 0.7802, test_loss: 1.0307, test_f1: 0.5144
 epoch: 30, train_loss: 0.7668, test_loss: 1.0575, test_f1: 0.5012
 epoch: 31, train_loss: 0.7811, test_loss: 1.0503, test_f1: 0.5409
 epoch: 32, train_loss: 0.7429, test_loss: 1.0571, test_f1: 0.5384
 epoch: 33, train_loss: 0.7617, test_loss: 1.0919, test_f1: 0.5335
 epoch: 34, train_loss: 0.7549, test_loss: 1.0935, test_f1: 0.5447
 epoch: 35, train_loss: 0.7408, test_loss: 1.0818, test_f1: 0.5152
 epoch: 36, train_loss: 0.7312, test_loss: 1.0876, test_f1: 0.5080
 epoch: 37, train_loss: 0.7220, test_loss: 1.0678, test_f1: 0.5096
 epoch: 38, train_loss: 0.7159, test_loss: 1.0907, test_f1: 0.5301
 epoch: 39, train_loss: 0.7059, test_loss: 1.1302, test_f1: 0.5000
 epoch: 40, train_loss: 0.6994, test_loss: 1.1028, test_f1: 0.5182
 epoch: 41, train_loss: 0.7045, test_loss: 1.1432, test_f1: 0.5162
 epoch: 42, train_loss: 0.6838, test_loss: 1.1338, test_f1: 0.5468
 epoch: 43, train_loss: 0.6879, test_loss: 1.1320, test_f1: 0.5465
 epoch: 44, train_loss: 0.6859, test_loss: 1.1716, test_f1: 0.5165
 epoch: 45, train_loss: 0.6850, test_loss: 1.0874, test_f1: 0.5368
 epoch: 46, train_loss: 0.6543, test_loss: 1.1590, test_f1: 0.5470
 epoch: 47, train_loss: 0.6775, test_loss: 1.1932, test_f1: 0.5216
 epoch: 48, train_loss: 0.6658, test_loss: 1.1740, test_f1: 0.5678
 epoch: 49, train_loss: 0.6606, test_loss: 1.1817, test_f1: 0.5581
 epoch: 50, train_loss: 0.6500, test_loss: 1.1426, test_f1: 0.5390
 epoch: 51, train_loss: 0.6345, test_loss: 1.1461, test_f1: 0.5415
 epoch: 52, train_loss: 0.6181, test_loss: 1.1725, test_f1: 0.5526
 epoch: 53, train_loss: 0.5868, test_loss: 1.1728, test_f1: 0.5455
 epoch: 54, train_loss: 0.5968, test_loss: 1.1952, test_f1: 0.5521
 epoch: 55, train_loss: 0.5940, test_loss: 1.2024, test_f1: 0.5658
 epoch: 56, train_loss: 0.5841, test_loss: 1.2024, test_f1: 0.5543
 epoch: 57, train_loss: 0.5805, test_loss: 1.2421, test_f1: 0.5429
 epoch: 58, train_loss: 0.5864, test_loss: 1.2430, test_f1: 0.5600
 epoch: 59, train_loss: 0.5858, test_loss: 1.2275, test_f1: 0.5630
 epoch: 60, train_loss: 0.5619, test_loss: 1.2628, test_f1: 0.5615
 epoch: 61, train_loss: 0.5810, test_loss: 1.2015, test_f1: 0.5733
 epoch: 62, train_loss: 0.5917, test_loss: 1.2561, test_f1: 0.5415
 epoch: 63, train_loss: 0.5694, test_loss: 1.2828, test_f1: 0.5448
 epoch: 64, train_loss: 0.5527, test_loss: 1.2979, test_f1: 0.5507
 epoch: 65, train_loss: 0.5477, test_loss: 1.2352, test_f1: 0.5711
 epoch: 66, train_loss: 0.5326, test_loss: 1.2907, test_f1: 0.5277
 epoch: 67, train_loss: 0.5414, test_loss: 1.3073, test_f1: 0.5286
 epoch: 68, train_loss: 0.5434, test_loss: 1.3025, test_f1: 0.5514
 epoch: 69, train_loss: 0.5343, test_loss: 1.3124, test_f1: 0.5466
 epoch: 70, train_loss: 0.5288, test_loss: 1.3751, test_f1: 0.5343
 epoch: 71, train_loss: 0.5382, test_loss: 1.2879, test_f1: 0.5469
 epoch: 72, train_loss: 0.5342, test_loss: 1.2714, test_f1: 0.5519
 epoch: 73, train_loss: 0.5311, test_loss: 1.3461, test_f1: 0.5316
 epoch: 74, train_loss: 0.5247, test_loss: 1.3048, test_f1: 0.5271
 epoch: 75, train_loss: 0.5330, test_loss: 1.3093, test_f1: 0.5511
 epoch: 76, train_loss: 0.5203, test_loss: 1.2961, test_f1: 0.5602
 epoch: 77, train_loss: 0.5037, test_loss: 1.3476, test_f1: 0.5558
 epoch: 78, train_loss: 0.5242, test_loss: 1.3202, test_f1: 0.5251
 epoch: 79, train_loss: 0.5215, test_loss: 1.3030, test_f1: 0.5553
 epoch: 80, train_loss: 0.5047, test_loss: 1.3672, test_f1: 0.5335
 epoch: 81, train_loss: 0.4910, test_loss: 1.3255, test_f1: 0.5556
 epoch: 82, train_loss: 0.4825, test_loss: 1.3409, test_f1: 0.5542
 epoch: 83, train_loss: 0.4928, test_loss: 1.4398, test_f1: 0.5513
 epoch: 84, train_loss: 0.4974, test_loss: 1.3634, test_f1: 0.5600
 epoch: 85, train_loss: 0.4963, test_loss: 1.4060, test_f1: 0.5289
 epoch: 86, train_loss: 0.4979, test_loss: 1.3647, test_f1: 0.5577
 epoch: 87, train_loss: 0.4998, test_loss: 1.3478, test_f1: 0.5579
 epoch: 88, train_loss: 0.4973, test_loss: 1.3887, test_f1: 0.5525
 epoch: 89, train_loss: 0.4816, test_loss: 1.3387, test_f1: 0.5785
 epoch: 90, train_loss: 0.4588, test_loss: 1.4742, test_f1: 0.5496
 epoch: 91, train_loss: 0.4811, test_loss: 1.3807, test_f1: 0.5673
 epoch: 92, train_loss: 0.4761, test_loss: 1.3358, test_f1: 0.5549
 epoch: 93, train_loss: 0.4718, test_loss: 1.3677, test_f1: 0.5630
 epoch: 94, train_loss: 0.4676, test_loss: 1.4587, test_f1: 0.5462
 epoch: 95, train_loss: 0.4686, test_loss: 1.4047, test_f1: 0.5767
 epoch: 96, train_loss: 0.4699, test_loss: 1.4793, test_f1: 0.5288
 epoch: 97, train_loss: 0.4612, test_loss: 1.5062, test_f1: 0.5490
 epoch: 98, train_loss: 0.4461, test_loss: 1.4425, test_f1: 0.5292
 epoch: 99, train_loss: 0.4565, test_loss: 1.5118, test_f1: 0.5468
##################ITERATION #3 ****************************************
 epoch: 0, train_loss: 1.3795, test_loss: 1.2551, test_f1: 0.2947
 epoch: 1, train_loss: 1.1947, test_loss: 1.1372, test_f1: 0.4042
 epoch: 2, train_loss: 1.1345, test_loss: 1.0565, test_f1: 0.4803
 epoch: 3, train_loss: 1.0903, test_loss: 1.0064, test_f1: 0.4567
 epoch: 4, train_loss: 1.0609, test_loss: 0.9959, test_f1: 0.5120
 epoch: 5, train_loss: 1.0344, test_loss: 0.9811, test_f1: 0.4867
 epoch: 6, train_loss: 1.0058, test_loss: 0.9601, test_f1: 0.4907
 epoch: 7, train_loss: 0.9950, test_loss: 0.9739, test_f1: 0.4729
 epoch: 8, train_loss: 0.9687, test_loss: 0.9786, test_f1: 0.4520
 epoch: 9, train_loss: 0.9687, test_loss: 0.9781, test_f1: 0.4839
 epoch: 10, train_loss: 0.9458, test_loss: 1.0026, test_f1: 0.4431
 epoch: 11, train_loss: 0.9408, test_loss: 0.9704, test_f1: 0.4996
 epoch: 12, train_loss: 0.9228, test_loss: 0.9746, test_f1: 0.4815
 epoch: 13, train_loss: 0.9104, test_loss: 0.9640, test_f1: 0.4791
 epoch: 14, train_loss: 0.8941, test_loss: 0.9472, test_f1: 0.5057
 epoch: 15, train_loss: 0.8851, test_loss: 1.0312, test_f1: 0.4861
 epoch: 16, train_loss: 0.8815, test_loss: 0.9275, test_f1: 0.5030
 epoch: 17, train_loss: 0.8979, test_loss: 0.9651, test_f1: 0.4990
 epoch: 18, train_loss: 0.8696, test_loss: 0.9834, test_f1: 0.5038
 epoch: 19, train_loss: 0.8551, test_loss: 1.0004, test_f1: 0.5047
 epoch: 20, train_loss: 0.8541, test_loss: 1.0899, test_f1: 0.4890
 epoch: 21, train_loss: 0.8295, test_loss: 1.0034, test_f1: 0.5180
 epoch: 22, train_loss: 0.8205, test_loss: 0.9944, test_f1: 0.5227
 epoch: 23, train_loss: 0.8205, test_loss: 0.9958, test_f1: 0.5286
 epoch: 24, train_loss: 0.8246, test_loss: 0.9649, test_f1: 0.5404
 epoch: 25, train_loss: 0.8136, test_loss: 0.9786, test_f1: 0.5075
 epoch: 26, train_loss: 0.7946, test_loss: 0.9549, test_f1: 0.5261
 epoch: 27, train_loss: 0.7851, test_loss: 1.0314, test_f1: 0.5037
 epoch: 28, train_loss: 0.7847, test_loss: 1.1513, test_f1: 0.5162
 epoch: 29, train_loss: 0.7855, test_loss: 0.9911, test_f1: 0.5364
 epoch: 30, train_loss: 0.7803, test_loss: 0.9453, test_f1: 0.5365
 epoch: 31, train_loss: 0.7690, test_loss: 0.9878, test_f1: 0.5692
 epoch: 32, train_loss: 0.7670, test_loss: 0.9867, test_f1: 0.5424
 epoch: 33, train_loss: 0.7616, test_loss: 0.9660, test_f1: 0.5430
 epoch: 34, train_loss: 0.7475, test_loss: 1.1257, test_f1: 0.5068
 epoch: 35, train_loss: 0.7346, test_loss: 1.0555, test_f1: 0.5322
 epoch: 36, train_loss: 0.7389, test_loss: 0.9469, test_f1: 0.5560
 epoch: 37, train_loss: 0.7396, test_loss: 1.1349, test_f1: 0.5020
 epoch: 38, train_loss: 0.7280, test_loss: 0.9861, test_f1: 0.5467
 epoch: 39, train_loss: 0.7179, test_loss: 1.0030, test_f1: 0.5123
 epoch: 40, train_loss: 0.6985, test_loss: 1.0847, test_f1: 0.5144
 epoch: 41, train_loss: 0.6944, test_loss: 1.0890, test_f1: 0.5121
 epoch: 42, train_loss: 0.6947, test_loss: 1.0305, test_f1: 0.5647
 epoch: 43, train_loss: 0.7057, test_loss: 1.0039, test_f1: 0.5541
 epoch: 44, train_loss: 0.6904, test_loss: 1.0537, test_f1: 0.5676
 epoch: 45, train_loss: 0.6793, test_loss: 1.0637, test_f1: 0.5032
 epoch: 46, train_loss: 0.6674, test_loss: 1.0407, test_f1: 0.5282
 epoch: 47, train_loss: 0.6725, test_loss: 1.1146, test_f1: 0.5380
 epoch: 48, train_loss: 0.6534, test_loss: 1.0386, test_f1: 0.5089
 epoch: 49, train_loss: 0.6778, test_loss: 1.1100, test_f1: 0.5050
 epoch: 50, train_loss: 0.6763, test_loss: 1.0881, test_f1: 0.5623
 epoch: 51, train_loss: 0.6434, test_loss: 1.0005, test_f1: 0.5458
 epoch: 52, train_loss: 0.6095, test_loss: 1.0273, test_f1: 0.5424
 epoch: 53, train_loss: 0.6229, test_loss: 1.0306, test_f1: 0.5608
 epoch: 54, train_loss: 0.6167, test_loss: 0.9996, test_f1: 0.5636
 epoch: 55, train_loss: 0.5962, test_loss: 1.0859, test_f1: 0.5495
 epoch: 56, train_loss: 0.5904, test_loss: 1.0940, test_f1: 0.5502
 epoch: 57, train_loss: 0.5936, test_loss: 1.1189, test_f1: 0.5540
 epoch: 58, train_loss: 0.5915, test_loss: 1.0825, test_f1: 0.5687
 epoch: 59, train_loss: 0.5924, test_loss: 1.1271, test_f1: 0.5566
 epoch: 60, train_loss: 0.5854, test_loss: 1.1176, test_f1: 0.5505
 epoch: 61, train_loss: 0.5879, test_loss: 1.0272, test_f1: 0.5619
 epoch: 62, train_loss: 0.5883, test_loss: 1.1075, test_f1: 0.5333
 epoch: 63, train_loss: 0.5670, test_loss: 1.0979, test_f1: 0.5390
 epoch: 64, train_loss: 0.5651, test_loss: 1.1894, test_f1: 0.5610
 epoch: 65, train_loss: 0.5678, test_loss: 1.0906, test_f1: 0.5597
 epoch: 66, train_loss: 0.5577, test_loss: 1.1061, test_f1: 0.5453
 epoch: 67, train_loss: 0.5483, test_loss: 1.2026, test_f1: 0.5560
 epoch: 68, train_loss: 0.5574, test_loss: 1.1243, test_f1: 0.5505
 epoch: 69, train_loss: 0.5497, test_loss: 1.1117, test_f1: 0.5473
 epoch: 70, train_loss: 0.5606, test_loss: 1.1567, test_f1: 0.5678
 epoch: 71, train_loss: 0.5464, test_loss: 1.1488, test_f1: 0.5663
 epoch: 72, train_loss: 0.5353, test_loss: 1.2390, test_f1: 0.5587
 epoch: 73, train_loss: 0.5547, test_loss: 1.1567, test_f1: 0.5568
 epoch: 74, train_loss: 0.5329, test_loss: 1.2158, test_f1: 0.5283
 epoch: 75, train_loss: 0.5394, test_loss: 1.2172, test_f1: 0.5428
 epoch: 76, train_loss: 0.5459, test_loss: 1.2625, test_f1: 0.5266
 epoch: 77, train_loss: 0.5296, test_loss: 1.1648, test_f1: 0.5690
 epoch: 78, train_loss: 0.5340, test_loss: 1.3205, test_f1: 0.5523
 epoch: 79, train_loss: 0.5224, test_loss: 1.1699, test_f1: 0.5723
 epoch: 80, train_loss: 0.5120, test_loss: 1.2728, test_f1: 0.5428
 epoch: 81, train_loss: 0.5107, test_loss: 1.2090, test_f1: 0.5571
 epoch: 82, train_loss: 0.5348, test_loss: 1.1952, test_f1: 0.5400
 epoch: 83, train_loss: 0.5261, test_loss: 1.2193, test_f1: 0.5135
 epoch: 84, train_loss: 0.5044, test_loss: 1.2375, test_f1: 0.5548
 epoch: 85, train_loss: 0.5139, test_loss: 1.2498, test_f1: 0.5358
 epoch: 86, train_loss: 0.4970, test_loss: 1.3012, test_f1: 0.5610
 epoch: 87, train_loss: 0.5088, test_loss: 1.3395, test_f1: 0.5417
 epoch: 88, train_loss: 0.4961, test_loss: 1.2616, test_f1: 0.5530
 epoch: 89, train_loss: 0.4885, test_loss: 1.1795, test_f1: 0.5644
 epoch: 90, train_loss: 0.4972, test_loss: 1.2090, test_f1: 0.5591
 epoch: 91, train_loss: 0.4749, test_loss: 1.3208, test_f1: 0.5334
 epoch: 92, train_loss: 0.5014, test_loss: 1.2597, test_f1: 0.5306
 epoch: 93, train_loss: 0.4751, test_loss: 1.3316, test_f1: 0.5500
 epoch: 94, train_loss: 0.4765, test_loss: 1.3440, test_f1: 0.5273
 epoch: 95, train_loss: 0.4791, test_loss: 1.4223, test_f1: 0.5412
 epoch: 96, train_loss: 0.4871, test_loss: 1.4207, test_f1: 0.5421
 epoch: 97, train_loss: 0.4996, test_loss: 1.2449, test_f1: 0.5717
 epoch: 98, train_loss: 0.4692, test_loss: 1.2694, test_f1: 0.5752
 epoch: 99, train_loss: 0.4584, test_loss: 1.2437, test_f1: 0.5428
##################ITERATION #4 ****************************************
 epoch: 0, train_loss: 1.4306, test_loss: 1.2396, test_f1: 0.3247
 epoch: 1, train_loss: 1.1931, test_loss: 1.1437, test_f1: 0.4126
 epoch: 2, train_loss: 1.1166, test_loss: 1.0840, test_f1: 0.4201
 epoch: 3, train_loss: 1.0750, test_loss: 1.0176, test_f1: 0.4576
 epoch: 4, train_loss: 1.0416, test_loss: 1.0168, test_f1: 0.4777
 epoch: 5, train_loss: 1.0157, test_loss: 0.9942, test_f1: 0.4381
 epoch: 6, train_loss: 0.9954, test_loss: 1.0090, test_f1: 0.4533
 epoch: 7, train_loss: 0.9948, test_loss: 0.9826, test_f1: 0.5057
 epoch: 8, train_loss: 0.9710, test_loss: 0.9998, test_f1: 0.4613
 epoch: 9, train_loss: 0.9359, test_loss: 0.9965, test_f1: 0.5125
 epoch: 10, train_loss: 0.9475, test_loss: 1.0039, test_f1: 0.5056
 epoch: 11, train_loss: 0.9224, test_loss: 0.9937, test_f1: 0.5288
 epoch: 12, train_loss: 0.9179, test_loss: 1.0247, test_f1: 0.5226
 epoch: 13, train_loss: 0.9118, test_loss: 1.0284, test_f1: 0.5040
 epoch: 14, train_loss: 0.9080, test_loss: 0.9987, test_f1: 0.4925
 epoch: 15, train_loss: 0.8904, test_loss: 1.0850, test_f1: 0.5253
 epoch: 16, train_loss: 0.8814, test_loss: 1.0480, test_f1: 0.5128
 epoch: 17, train_loss: 0.8839, test_loss: 1.0414, test_f1: 0.4763
 epoch: 18, train_loss: 0.8587, test_loss: 1.0220, test_f1: 0.5483
 epoch: 19, train_loss: 0.8562, test_loss: 1.1113, test_f1: 0.4683
 epoch: 20, train_loss: 0.8562, test_loss: 1.0529, test_f1: 0.5109
 epoch: 21, train_loss: 0.8316, test_loss: 1.0458, test_f1: 0.5376
 epoch: 22, train_loss: 0.8286, test_loss: 1.0425, test_f1: 0.5353
 epoch: 23, train_loss: 0.8141, test_loss: 1.1278, test_f1: 0.4979
 epoch: 24, train_loss: 0.8025, test_loss: 1.0457, test_f1: 0.5415
 epoch: 25, train_loss: 0.8177, test_loss: 1.0464, test_f1: 0.5215
 epoch: 26, train_loss: 0.8006, test_loss: 1.0106, test_f1: 0.5239
 epoch: 27, train_loss: 0.8053, test_loss: 1.0332, test_f1: 0.5467
 epoch: 28, train_loss: 0.7838, test_loss: 1.0684, test_f1: 0.5388
 epoch: 29, train_loss: 0.7738, test_loss: 1.0679, test_f1: 0.5756
 epoch: 30, train_loss: 0.7677, test_loss: 1.1286, test_f1: 0.5309
 epoch: 31, train_loss: 0.7679, test_loss: 1.0536, test_f1: 0.5704
 epoch: 32, train_loss: 0.7565, test_loss: 1.0954, test_f1: 0.5792
 epoch: 33, train_loss: 0.7485, test_loss: 1.0575, test_f1: 0.5725
 epoch: 34, train_loss: 0.7212, test_loss: 1.1143, test_f1: 0.5755
 epoch: 35, train_loss: 0.7414, test_loss: 1.1188, test_f1: 0.5481
 epoch: 36, train_loss: 0.7255, test_loss: 1.1444, test_f1: 0.5573
 epoch: 37, train_loss: 0.7170, test_loss: 1.0951, test_f1: 0.5813
 epoch: 38, train_loss: 0.7169, test_loss: 1.1157, test_f1: 0.5522
 epoch: 39, train_loss: 0.7063, test_loss: 1.0787, test_f1: 0.5672
 epoch: 40, train_loss: 0.7141, test_loss: 1.1695, test_f1: 0.5775
 epoch: 41, train_loss: 0.7180, test_loss: 1.1696, test_f1: 0.5683
 epoch: 42, train_loss: 0.7040, test_loss: 1.1505, test_f1: 0.5511
 epoch: 43, train_loss: 0.6946, test_loss: 1.1522, test_f1: 0.5511
 epoch: 44, train_loss: 0.7019, test_loss: 1.0914, test_f1: 0.5851
 epoch: 45, train_loss: 0.6714, test_loss: 1.2027, test_f1: 0.5656
 epoch: 46, train_loss: 0.6777, test_loss: 1.1814, test_f1: 0.5340
 epoch: 47, train_loss: 0.6863, test_loss: 1.1229, test_f1: 0.5751
 epoch: 48, train_loss: 0.6552, test_loss: 1.1672, test_f1: 0.5685
 epoch: 49, train_loss: 0.6509, test_loss: 1.1312, test_f1: 0.5841
 epoch: 50, train_loss: 0.6441, test_loss: 1.1180, test_f1: 0.5926
 epoch: 51, train_loss: 0.6279, test_loss: 1.1919, test_f1: 0.5787
 epoch: 52, train_loss: 0.6137, test_loss: 1.1400, test_f1: 0.5890
 epoch: 53, train_loss: 0.5993, test_loss: 1.1601, test_f1: 0.5869
 epoch: 54, train_loss: 0.6017, test_loss: 1.2300, test_f1: 0.5800
 epoch: 55, train_loss: 0.5991, test_loss: 1.1883, test_f1: 0.5707
 epoch: 56, train_loss: 0.5944, test_loss: 1.2748, test_f1: 0.5685
 epoch: 57, train_loss: 0.5922, test_loss: 1.2166, test_f1: 0.5752
 epoch: 58, train_loss: 0.5879, test_loss: 1.2442, test_f1: 0.5799
 epoch: 59, train_loss: 0.5698, test_loss: 1.2509, test_f1: 0.5825
 epoch: 60, train_loss: 0.5731, test_loss: 1.2812, test_f1: 0.5837
 epoch: 61, train_loss: 0.5576, test_loss: 1.2976, test_f1: 0.5889
 epoch: 62, train_loss: 0.5681, test_loss: 1.3250, test_f1: 0.5432
 epoch: 63, train_loss: 0.5631, test_loss: 1.3233, test_f1: 0.6011
 epoch: 64, train_loss: 0.5782, test_loss: 1.2809, test_f1: 0.5771
 epoch: 65, train_loss: 0.5660, test_loss: 1.2869, test_f1: 0.5862
 epoch: 66, train_loss: 0.5522, test_loss: 1.3035, test_f1: 0.5756
 epoch: 67, train_loss: 0.5580, test_loss: 1.3089, test_f1: 0.5964
 epoch: 68, train_loss: 0.5533, test_loss: 1.3926, test_f1: 0.5915
 epoch: 69, train_loss: 0.5287, test_loss: 1.3096, test_f1: 0.5948
 epoch: 70, train_loss: 0.5347, test_loss: 1.3368, test_f1: 0.6063
 epoch: 71, train_loss: 0.5618, test_loss: 1.3354, test_f1: 0.5917
 epoch: 72, train_loss: 0.5453, test_loss: 1.2918, test_f1: 0.5813
 epoch: 73, train_loss: 0.5290, test_loss: 1.3656, test_f1: 0.5783
 epoch: 74, train_loss: 0.5293, test_loss: 1.3251, test_f1: 0.5723
 epoch: 75, train_loss: 0.5334, test_loss: 1.3087, test_f1: 0.5971
 epoch: 76, train_loss: 0.5192, test_loss: 1.3944, test_f1: 0.5653
 epoch: 77, train_loss: 0.5363, test_loss: 1.5062, test_f1: 0.5700
 epoch: 78, train_loss: 0.5267, test_loss: 1.3902, test_f1: 0.5833
 epoch: 79, train_loss: 0.5150, test_loss: 1.3861, test_f1: 0.5926
 epoch: 80, train_loss: 0.5132, test_loss: 1.4313, test_f1: 0.5670
 epoch: 81, train_loss: 0.5124, test_loss: 1.3594, test_f1: 0.5728
 epoch: 82, train_loss: 0.5134, test_loss: 1.3463, test_f1: 0.5859
 epoch: 83, train_loss: 0.5022, test_loss: 1.4268, test_f1: 0.5678
 epoch: 84, train_loss: 0.5227, test_loss: 1.3774, test_f1: 0.6033
 epoch: 85, train_loss: 0.5001, test_loss: 1.4205, test_f1: 0.5356
 epoch: 86, train_loss: 0.4993, test_loss: 1.4964, test_f1: 0.5591
 epoch: 87, train_loss: 0.4766, test_loss: 1.3981, test_f1: 0.5593
 epoch: 88, train_loss: 0.4759, test_loss: 1.3704, test_f1: 0.5815
 epoch: 89, train_loss: 0.4974, test_loss: 1.4372, test_f1: 0.5643
 epoch: 90, train_loss: 0.4845, test_loss: 1.4953, test_f1: 0.5597
 epoch: 91, train_loss: 0.4823, test_loss: 1.4013, test_f1: 0.5738
 epoch: 92, train_loss: 0.4826, test_loss: 1.3365, test_f1: 0.5758
 epoch: 93, train_loss: 0.4810, test_loss: 1.4659, test_f1: 0.5785
 epoch: 94, train_loss: 0.5022, test_loss: 1.3802, test_f1: 0.5709
 epoch: 95, train_loss: 0.4765, test_loss: 1.3623, test_f1: 0.5815
 epoch: 96, train_loss: 0.4580, test_loss: 1.4410, test_f1: 0.5725
 epoch: 97, train_loss: 0.4641, test_loss: 1.4299, test_f1: 0.5729
 epoch: 98, train_loss: 0.4633, test_loss: 1.4407, test_f1: 0.6011
 epoch: 99, train_loss: 0.4745, test_loss: 1.5558, test_f1: 0.5449
##################ITERATION #5 ****************************************
 epoch: 0, train_loss: 1.4506, test_loss: 1.1959, test_f1: 0.4150
 epoch: 1, train_loss: 1.2078, test_loss: 1.1026, test_f1: 0.4388
 epoch: 2, train_loss: 1.1556, test_loss: 1.0546, test_f1: 0.4687
 epoch: 3, train_loss: 1.0969, test_loss: 1.0271, test_f1: 0.4487
 epoch: 4, train_loss: 1.0693, test_loss: 1.0088, test_f1: 0.4472
 epoch: 5, train_loss: 1.0441, test_loss: 0.9896, test_f1: 0.4781
 epoch: 6, train_loss: 1.0143, test_loss: 1.0218, test_f1: 0.4417
 epoch: 7, train_loss: 0.9872, test_loss: 0.9699, test_f1: 0.5086
 epoch: 8, train_loss: 0.9743, test_loss: 0.9436, test_f1: 0.4645
 epoch: 9, train_loss: 0.9608, test_loss: 0.9470, test_f1: 0.5009
 epoch: 10, train_loss: 0.9490, test_loss: 1.0720, test_f1: 0.5098
 epoch: 11, train_loss: 0.9415, test_loss: 0.9690, test_f1: 0.5112
 epoch: 12, train_loss: 0.9184, test_loss: 0.9589, test_f1: 0.5045
 epoch: 13, train_loss: 0.9135, test_loss: 0.9163, test_f1: 0.5341
 epoch: 14, train_loss: 0.8854, test_loss: 0.9906, test_f1: 0.4640
 epoch: 15, train_loss: 0.8779, test_loss: 0.9917, test_f1: 0.5170
 epoch: 16, train_loss: 0.8734, test_loss: 0.9906, test_f1: 0.5287
 epoch: 17, train_loss: 0.8633, test_loss: 1.0525, test_f1: 0.5556
 epoch: 18, train_loss: 0.8469, test_loss: 1.1259, test_f1: 0.4878
 epoch: 19, train_loss: 0.8435, test_loss: 1.0333, test_f1: 0.5144
 epoch: 20, train_loss: 0.8220, test_loss: 0.9935, test_f1: 0.5272
 epoch: 21, train_loss: 0.8102, test_loss: 0.9679, test_f1: 0.5578
 epoch: 22, train_loss: 0.8011, test_loss: 0.9600, test_f1: 0.5226
 epoch: 23, train_loss: 0.7983, test_loss: 0.9941, test_f1: 0.5258
 epoch: 24, train_loss: 0.8092, test_loss: 1.1523, test_f1: 0.4859
 epoch: 25, train_loss: 0.8021, test_loss: 1.1090, test_f1: 0.5177
 epoch: 26, train_loss: 0.7954, test_loss: 1.0383, test_f1: 0.5142
 epoch: 27, train_loss: 0.7818, test_loss: 1.0069, test_f1: 0.5580
 epoch: 28, train_loss: 0.7872, test_loss: 1.0541, test_f1: 0.5373
 epoch: 29, train_loss: 0.7736, test_loss: 1.0918, test_f1: 0.5195
 epoch: 30, train_loss: 0.7730, test_loss: 1.0367, test_f1: 0.5226
 epoch: 31, train_loss: 0.7406, test_loss: 1.1537, test_f1: 0.5385
 epoch: 32, train_loss: 0.7266, test_loss: 1.0600, test_f1: 0.5477
 epoch: 33, train_loss: 0.7301, test_loss: 0.9962, test_f1: 0.5498
 epoch: 34, train_loss: 0.7343, test_loss: 1.0857, test_f1: 0.5309
 epoch: 35, train_loss: 0.7206, test_loss: 1.0762, test_f1: 0.5500
 epoch: 36, train_loss: 0.7259, test_loss: 1.1694, test_f1: 0.5437
 epoch: 37, train_loss: 0.7165, test_loss: 1.2295, test_f1: 0.5237
 epoch: 38, train_loss: 0.7080, test_loss: 1.0407, test_f1: 0.5368
 epoch: 39, train_loss: 0.6998, test_loss: 1.1244, test_f1: 0.5454
 epoch: 40, train_loss: 0.7037, test_loss: 1.1240, test_f1: 0.5489
 epoch: 41, train_loss: 0.6808, test_loss: 1.1171, test_f1: 0.5502
 epoch: 42, train_loss: 0.6729, test_loss: 1.0763, test_f1: 0.5631
 epoch: 43, train_loss: 0.6791, test_loss: 1.1368, test_f1: 0.5363
 epoch: 44, train_loss: 0.6513, test_loss: 1.1759, test_f1: 0.5616
 epoch: 45, train_loss: 0.6848, test_loss: 1.1764, test_f1: 0.5747
 epoch: 46, train_loss: 0.6784, test_loss: 1.1238, test_f1: 0.5388
 epoch: 47, train_loss: 0.6600, test_loss: 1.1185, test_f1: 0.5498
 epoch: 48, train_loss: 0.6510, test_loss: 1.1561, test_f1: 0.5369
 epoch: 49, train_loss: 0.6568, test_loss: 1.1525, test_f1: 0.5611
 epoch: 50, train_loss: 0.6353, test_loss: 1.1723, test_f1: 0.5619
 epoch: 51, train_loss: 0.6221, test_loss: 1.2088, test_f1: 0.5493
 epoch: 52, train_loss: 0.5873, test_loss: 1.2085, test_f1: 0.5528
 epoch: 53, train_loss: 0.5852, test_loss: 1.1763, test_f1: 0.5641
 epoch: 54, train_loss: 0.5843, test_loss: 1.2057, test_f1: 0.5561
 epoch: 55, train_loss: 0.5984, test_loss: 1.2131, test_f1: 0.5513
 epoch: 56, train_loss: 0.5865, test_loss: 1.1982, test_f1: 0.5616
 epoch: 57, train_loss: 0.5817, test_loss: 1.2157, test_f1: 0.5589
 epoch: 58, train_loss: 0.5992, test_loss: 1.2250, test_f1: 0.5386
 epoch: 59, train_loss: 0.5681, test_loss: 1.2520, test_f1: 0.5297
 epoch: 60, train_loss: 0.5669, test_loss: 1.2603, test_f1: 0.5274
 epoch: 61, train_loss: 0.5628, test_loss: 1.2336, test_f1: 0.5586
 epoch: 62, train_loss: 0.5578, test_loss: 1.2055, test_f1: 0.5668
 epoch: 63, train_loss: 0.5756, test_loss: 1.3060, test_f1: 0.5167
 epoch: 64, train_loss: 0.5543, test_loss: 1.2361, test_f1: 0.5364
 epoch: 65, train_loss: 0.5574, test_loss: 1.2599, test_f1: 0.5296
 epoch: 66, train_loss: 0.5484, test_loss: 1.2405, test_f1: 0.5516
 epoch: 67, train_loss: 0.5530, test_loss: 1.2694, test_f1: 0.5477
 epoch: 68, train_loss: 0.5625, test_loss: 1.2792, test_f1: 0.5335
 epoch: 69, train_loss: 0.5450, test_loss: 1.2587, test_f1: 0.5624
 epoch: 70, train_loss: 0.5409, test_loss: 1.3198, test_f1: 0.5377
 epoch: 71, train_loss: 0.5431, test_loss: 1.2918, test_f1: 0.5378
 epoch: 72, train_loss: 0.5493, test_loss: 1.3727, test_f1: 0.5397
 epoch: 73, train_loss: 0.5280, test_loss: 1.3228, test_f1: 0.5346
 epoch: 74, train_loss: 0.5112, test_loss: 1.2935, test_f1: 0.5640
 epoch: 75, train_loss: 0.5261, test_loss: 1.4012, test_f1: 0.5178
 epoch: 76, train_loss: 0.5142, test_loss: 1.3667, test_f1: 0.5449
 epoch: 77, train_loss: 0.5306, test_loss: 1.3698, test_f1: 0.5239
 epoch: 78, train_loss: 0.5140, test_loss: 1.3932, test_f1: 0.5244
 epoch: 79, train_loss: 0.5231, test_loss: 1.3649, test_f1: 0.5268
 epoch: 80, train_loss: 0.5109, test_loss: 1.3173, test_f1: 0.5486
 epoch: 81, train_loss: 0.5018, test_loss: 1.3905, test_f1: 0.5340
 epoch: 82, train_loss: 0.5021, test_loss: 1.4240, test_f1: 0.5233
 epoch: 83, train_loss: 0.5200, test_loss: 1.3736, test_f1: 0.5443
 epoch: 84, train_loss: 0.5092, test_loss: 1.3986, test_f1: 0.5343
 epoch: 85, train_loss: 0.4905, test_loss: 1.4023, test_f1: 0.5445
 epoch: 86, train_loss: 0.5003, test_loss: 1.3218, test_f1: 0.5473
 epoch: 87, train_loss: 0.5052, test_loss: 1.4188, test_f1: 0.4965
 epoch: 88, train_loss: 0.4965, test_loss: 1.2763, test_f1: 0.5481
 epoch: 89, train_loss: 0.4856, test_loss: 1.4120, test_f1: 0.5341
 epoch: 90, train_loss: 0.4796, test_loss: 1.3969, test_f1: 0.5295
 epoch: 91, train_loss: 0.4858, test_loss: 1.3625, test_f1: 0.5086
 epoch: 92, train_loss: 0.4871, test_loss: 1.3815, test_f1: 0.5479
 epoch: 93, train_loss: 0.4836, test_loss: 1.4227, test_f1: 0.5437
 epoch: 94, train_loss: 0.4745, test_loss: 1.4310, test_f1: 0.5465
 epoch: 95, train_loss: 0.4770, test_loss: 1.5259, test_f1: 0.5423
 epoch: 96, train_loss: 0.4750, test_loss: 1.3769, test_f1: 0.5492
 epoch: 97, train_loss: 0.4818, test_loss: 1.4144, test_f1: 0.5451
 epoch: 98, train_loss: 0.4642, test_loss: 1.4468, test_f1: 0.5385
 epoch: 99, train_loss: 0.4574, test_loss: 1.5699, test_f1: 0.5281
##################ITERATION #6 ****************************************
 epoch: 0, train_loss: 1.5099, test_loss: 1.2096, test_f1: 0.3527
 epoch: 1, train_loss: 1.2035, test_loss: 1.1209, test_f1: 0.4171
 epoch: 2, train_loss: 1.1459, test_loss: 1.0826, test_f1: 0.4233
 epoch: 3, train_loss: 1.1377, test_loss: 1.0586, test_f1: 0.4432
 epoch: 4, train_loss: 1.0933, test_loss: 1.0268, test_f1: 0.4448
 epoch: 5, train_loss: 1.0716, test_loss: 1.0205, test_f1: 0.4533
 epoch: 6, train_loss: 1.0419, test_loss: 1.0108, test_f1: 0.4811
 epoch: 7, train_loss: 1.0184, test_loss: 1.0404, test_f1: 0.4586
 epoch: 8, train_loss: 0.9973, test_loss: 1.0094, test_f1: 0.4598
 epoch: 9, train_loss: 0.9977, test_loss: 1.0173, test_f1: 0.4660
 epoch: 10, train_loss: 0.9772, test_loss: 1.0063, test_f1: 0.4734
 epoch: 11, train_loss: 0.9817, test_loss: 0.9646, test_f1: 0.5009
 epoch: 12, train_loss: 0.9458, test_loss: 1.0174, test_f1: 0.4878
 epoch: 13, train_loss: 0.9371, test_loss: 1.1027, test_f1: 0.4633
 epoch: 14, train_loss: 0.9172, test_loss: 1.0027, test_f1: 0.5013
 epoch: 15, train_loss: 0.9031, test_loss: 1.0167, test_f1: 0.4897
 epoch: 16, train_loss: 0.9039, test_loss: 0.9793, test_f1: 0.5024
 epoch: 17, train_loss: 0.8825, test_loss: 0.9787, test_f1: 0.5041
 epoch: 18, train_loss: 0.8875, test_loss: 1.0079, test_f1: 0.4932
 epoch: 19, train_loss: 0.8837, test_loss: 0.9822, test_f1: 0.5247
 epoch: 20, train_loss: 0.8583, test_loss: 1.0251, test_f1: 0.5190
 epoch: 21, train_loss: 0.8528, test_loss: 0.9948, test_f1: 0.5272
 epoch: 22, train_loss: 0.8442, test_loss: 1.1315, test_f1: 0.4737
 epoch: 23, train_loss: 0.8421, test_loss: 1.0344, test_f1: 0.5442
 epoch: 24, train_loss: 0.8344, test_loss: 0.9998, test_f1: 0.5316
 epoch: 25, train_loss: 0.8384, test_loss: 0.9880, test_f1: 0.5261
 epoch: 26, train_loss: 0.8213, test_loss: 0.9959, test_f1: 0.5361
 epoch: 27, train_loss: 0.8100, test_loss: 1.0033, test_f1: 0.5070
 epoch: 28, train_loss: 0.8000, test_loss: 1.0189, test_f1: 0.5547
 epoch: 29, train_loss: 0.7810, test_loss: 1.0118, test_f1: 0.5327
 epoch: 30, train_loss: 0.7848, test_loss: 1.0245, test_f1: 0.5201
 epoch: 31, train_loss: 0.7585, test_loss: 1.0197, test_f1: 0.5413
 epoch: 32, train_loss: 0.7713, test_loss: 1.0252, test_f1: 0.5290
 epoch: 33, train_loss: 0.7556, test_loss: 1.0706, test_f1: 0.5365
 epoch: 34, train_loss: 0.7432, test_loss: 1.1062, test_f1: 0.5101
 epoch: 35, train_loss: 0.7368, test_loss: 1.0687, test_f1: 0.5280
 epoch: 36, train_loss: 0.7467, test_loss: 1.0865, test_f1: 0.5451
 epoch: 37, train_loss: 0.7453, test_loss: 1.0788, test_f1: 0.5322
 epoch: 38, train_loss: 0.7347, test_loss: 1.1141, test_f1: 0.5236
 epoch: 39, train_loss: 0.7247, test_loss: 1.0690, test_f1: 0.5316
 epoch: 40, train_loss: 0.7320, test_loss: 1.0770, test_f1: 0.5090
 epoch: 41, train_loss: 0.7191, test_loss: 1.0806, test_f1: 0.5216
 epoch: 42, train_loss: 0.7089, test_loss: 1.1269, test_f1: 0.5512
 epoch: 43, train_loss: 0.7007, test_loss: 1.2111, test_f1: 0.5256
 epoch: 44, train_loss: 0.6927, test_loss: 1.1542, test_f1: 0.5486
 epoch: 45, train_loss: 0.6997, test_loss: 1.0964, test_f1: 0.5269
 epoch: 46, train_loss: 0.6914, test_loss: 1.1771, test_f1: 0.4927
 epoch: 47, train_loss: 0.6771, test_loss: 1.1236, test_f1: 0.4973
 epoch: 48, train_loss: 0.6857, test_loss: 1.1254, test_f1: 0.5280
 epoch: 49, train_loss: 0.6856, test_loss: 1.1489, test_f1: 0.5457
 epoch: 50, train_loss: 0.6687, test_loss: 1.1837, test_f1: 0.5188
 epoch: 51, train_loss: 0.6347, test_loss: 1.2075, test_f1: 0.5326
 epoch: 52, train_loss: 0.6139, test_loss: 1.1720, test_f1: 0.5295
 epoch: 53, train_loss: 0.6200, test_loss: 1.1514, test_f1: 0.5465
 epoch: 54, train_loss: 0.6185, test_loss: 1.2120, test_f1: 0.5127
 epoch: 55, train_loss: 0.6024, test_loss: 1.2133, test_f1: 0.5294
 epoch: 56, train_loss: 0.5922, test_loss: 1.1907, test_f1: 0.5238
 epoch: 57, train_loss: 0.6033, test_loss: 1.2286, test_f1: 0.5333
 epoch: 58, train_loss: 0.5967, test_loss: 1.2071, test_f1: 0.5358
 epoch: 59, train_loss: 0.5906, test_loss: 1.2193, test_f1: 0.5371
 epoch: 60, train_loss: 0.5685, test_loss: 1.2129, test_f1: 0.5531
 epoch: 61, train_loss: 0.5901, test_loss: 1.2188, test_f1: 0.5317
 epoch: 62, train_loss: 0.5691, test_loss: 1.2897, test_f1: 0.5332
 epoch: 63, train_loss: 0.5743, test_loss: 1.2178, test_f1: 0.5453
 epoch: 64, train_loss: 0.5857, test_loss: 1.2683, test_f1: 0.5137
 epoch: 65, train_loss: 0.5773, test_loss: 1.3001, test_f1: 0.5444
 epoch: 66, train_loss: 0.5521, test_loss: 1.2087, test_f1: 0.5314
 epoch: 67, train_loss: 0.5646, test_loss: 1.2898, test_f1: 0.5459
 epoch: 68, train_loss: 0.5828, test_loss: 1.3052, test_f1: 0.5348
 epoch: 69, train_loss: 0.5652, test_loss: 1.2870, test_f1: 0.5336
 epoch: 70, train_loss: 0.5522, test_loss: 1.2597, test_f1: 0.5512
 epoch: 71, train_loss: 0.5582, test_loss: 1.3029, test_f1: 0.5424
 epoch: 72, train_loss: 0.5537, test_loss: 1.2817, test_f1: 0.5373
 epoch: 73, train_loss: 0.5479, test_loss: 1.2497, test_f1: 0.5676
 epoch: 74, train_loss: 0.5324, test_loss: 1.2824, test_f1: 0.5535
 epoch: 75, train_loss: 0.5421, test_loss: 1.3066, test_f1: 0.5361
 epoch: 76, train_loss: 0.5331, test_loss: 1.3040, test_f1: 0.5536
 epoch: 77, train_loss: 0.5257, test_loss: 1.2616, test_f1: 0.5396
 epoch: 78, train_loss: 0.5219, test_loss: 1.3585, test_f1: 0.5404
 epoch: 79, train_loss: 0.5354, test_loss: 1.4162, test_f1: 0.5186
 epoch: 80, train_loss: 0.5258, test_loss: 1.3954, test_f1: 0.5558
 epoch: 81, train_loss: 0.5220, test_loss: 1.3047, test_f1: 0.5646
 epoch: 82, train_loss: 0.5124, test_loss: 1.3286, test_f1: 0.5497
 epoch: 83, train_loss: 0.5178, test_loss: 1.3188, test_f1: 0.5364
 epoch: 84, train_loss: 0.5261, test_loss: 1.3317, test_f1: 0.5454
 epoch: 85, train_loss: 0.5215, test_loss: 1.4137, test_f1: 0.5449
 epoch: 86, train_loss: 0.4940, test_loss: 1.3465, test_f1: 0.5541
 epoch: 87, train_loss: 0.4902, test_loss: 1.3732, test_f1: 0.5519
 epoch: 88, train_loss: 0.4972, test_loss: 1.3790, test_f1: 0.5391
 epoch: 89, train_loss: 0.5032, test_loss: 1.3677, test_f1: 0.5396
 epoch: 90, train_loss: 0.5180, test_loss: 1.3477, test_f1: 0.5470
 epoch: 91, train_loss: 0.4893, test_loss: 1.3550, test_f1: 0.5358
 epoch: 92, train_loss: 0.4780, test_loss: 1.4003, test_f1: 0.5508
 epoch: 93, train_loss: 0.5049, test_loss: 1.4457, test_f1: 0.5284
 epoch: 94, train_loss: 0.4893, test_loss: 1.3208, test_f1: 0.5460
 epoch: 95, train_loss: 0.4810, test_loss: 1.4093, test_f1: 0.5623
 epoch: 96, train_loss: 0.4778, test_loss: 1.3692, test_f1: 0.5530
 epoch: 97, train_loss: 0.4836, test_loss: 1.4384, test_f1: 0.5434
 epoch: 98, train_loss: 0.4757, test_loss: 1.3949, test_f1: 0.5497
 epoch: 99, train_loss: 0.4864, test_loss: 1.4003, test_f1: 0.5607
##################ITERATION #7 ****************************************
 epoch: 0, train_loss: 1.5504, test_loss: 1.2429, test_f1: 0.3548
 epoch: 1, train_loss: 1.2429, test_loss: 1.1580, test_f1: 0.4430
 epoch: 2, train_loss: 1.1742, test_loss: 1.1087, test_f1: 0.4618
 epoch: 3, train_loss: 1.1411, test_loss: 1.0692, test_f1: 0.4685
 epoch: 4, train_loss: 1.1185, test_loss: 1.0481, test_f1: 0.4490
 epoch: 5, train_loss: 1.0845, test_loss: 1.0315, test_f1: 0.4565
 epoch: 6, train_loss: 1.0497, test_loss: 1.0047, test_f1: 0.4637
 epoch: 7, train_loss: 1.0372, test_loss: 1.0086, test_f1: 0.4851
 epoch: 8, train_loss: 1.0254, test_loss: 0.9803, test_f1: 0.4902
 epoch: 9, train_loss: 0.9974, test_loss: 1.0049, test_f1: 0.4719
 epoch: 10, train_loss: 0.9905, test_loss: 0.9841, test_f1: 0.4681
 epoch: 11, train_loss: 0.9842, test_loss: 0.9851, test_f1: 0.5050
 epoch: 12, train_loss: 0.9503, test_loss: 1.0271, test_f1: 0.4988
 epoch: 13, train_loss: 0.9461, test_loss: 0.9606, test_f1: 0.4961
 epoch: 14, train_loss: 0.9272, test_loss: 0.9545, test_f1: 0.5314
 epoch: 15, train_loss: 0.9245, test_loss: 1.0118, test_f1: 0.5035
 epoch: 16, train_loss: 0.8982, test_loss: 0.9756, test_f1: 0.5314
 epoch: 17, train_loss: 0.8973, test_loss: 0.9832, test_f1: 0.5117
 epoch: 18, train_loss: 0.8747, test_loss: 1.0773, test_f1: 0.5509
 epoch: 19, train_loss: 0.8595, test_loss: 1.0015, test_f1: 0.5516
 epoch: 20, train_loss: 0.8646, test_loss: 1.0219, test_f1: 0.5108
 epoch: 21, train_loss: 0.8613, test_loss: 0.9963, test_f1: 0.5395
 epoch: 22, train_loss: 0.8504, test_loss: 1.0951, test_f1: 0.5037
 epoch: 23, train_loss: 0.8352, test_loss: 0.9863, test_f1: 0.5346
 epoch: 24, train_loss: 0.8311, test_loss: 1.0516, test_f1: 0.5234
 epoch: 25, train_loss: 0.8352, test_loss: 1.0663, test_f1: 0.5267
 epoch: 26, train_loss: 0.8277, test_loss: 0.9913, test_f1: 0.5283
 epoch: 27, train_loss: 0.8155, test_loss: 1.0302, test_f1: 0.5578
 epoch: 28, train_loss: 0.8157, test_loss: 1.0953, test_f1: 0.5420
 epoch: 29, train_loss: 0.8181, test_loss: 1.0511, test_f1: 0.5572
 epoch: 30, train_loss: 0.8046, test_loss: 1.0264, test_f1: 0.5445
 epoch: 31, train_loss: 0.7955, test_loss: 1.0010, test_f1: 0.5419
 epoch: 32, train_loss: 0.7796, test_loss: 1.0266, test_f1: 0.5302
 epoch: 33, train_loss: 0.7742, test_loss: 1.0459, test_f1: 0.5642
 epoch: 34, train_loss: 0.7771, test_loss: 1.0801, test_f1: 0.5307
 epoch: 35, train_loss: 0.7795, test_loss: 1.0960, test_f1: 0.5520
 epoch: 36, train_loss: 0.7675, test_loss: 1.1101, test_f1: 0.4985
 epoch: 37, train_loss: 0.7379, test_loss: 1.1614, test_f1: 0.5321
 epoch: 38, train_loss: 0.7448, test_loss: 1.0828, test_f1: 0.5354
 epoch: 39, train_loss: 0.7494, test_loss: 1.0775, test_f1: 0.5322
 epoch: 40, train_loss: 0.7408, test_loss: 1.0718, test_f1: 0.5641
 epoch: 41, train_loss: 0.7325, test_loss: 1.1711, test_f1: 0.5190
 epoch: 42, train_loss: 0.7325, test_loss: 1.1780, test_f1: 0.5513
 epoch: 43, train_loss: 0.7225, test_loss: 1.1834, test_f1: 0.5363
 epoch: 44, train_loss: 0.7416, test_loss: 1.1040, test_f1: 0.5270
 epoch: 45, train_loss: 0.7090, test_loss: 1.1996, test_f1: 0.5376
 epoch: 46, train_loss: 0.7061, test_loss: 1.1476, test_f1: 0.5562
 epoch: 47, train_loss: 0.7032, test_loss: 1.1228, test_f1: 0.5465
 epoch: 48, train_loss: 0.6917, test_loss: 1.1664, test_f1: 0.5367
 epoch: 49, train_loss: 0.7038, test_loss: 1.2032, test_f1: 0.5398
 epoch: 50, train_loss: 0.7129, test_loss: 1.0984, test_f1: 0.5645
 epoch: 51, train_loss: 0.6738, test_loss: 1.1705, test_f1: 0.5486
 epoch: 52, train_loss: 0.6574, test_loss: 1.1406, test_f1: 0.5572
 epoch: 53, train_loss: 0.6550, test_loss: 1.1940, test_f1: 0.5500
 epoch: 54, train_loss: 0.6514, test_loss: 1.2008, test_f1: 0.5619
 epoch: 55, train_loss: 0.6340, test_loss: 1.2425, test_f1: 0.5456
 epoch: 56, train_loss: 0.6291, test_loss: 1.1754, test_f1: 0.5554
 epoch: 57, train_loss: 0.6374, test_loss: 1.1942, test_f1: 0.5587
 epoch: 58, train_loss: 0.6224, test_loss: 1.2127, test_f1: 0.5593
 epoch: 59, train_loss: 0.6250, test_loss: 1.1567, test_f1: 0.5618
 epoch: 60, train_loss: 0.6318, test_loss: 1.2313, test_f1: 0.5455
 epoch: 61, train_loss: 0.6188, test_loss: 1.2238, test_f1: 0.5366
 epoch: 62, train_loss: 0.6206, test_loss: 1.2253, test_f1: 0.5541
 epoch: 63, train_loss: 0.6151, test_loss: 1.1911, test_f1: 0.5484
 epoch: 64, train_loss: 0.6088, test_loss: 1.2574, test_f1: 0.5351
 epoch: 65, train_loss: 0.6073, test_loss: 1.2228, test_f1: 0.5550
 epoch: 66, train_loss: 0.5921, test_loss: 1.2938, test_f1: 0.5370
 epoch: 67, train_loss: 0.6033, test_loss: 1.2888, test_f1: 0.5430
 epoch: 68, train_loss: 0.5940, test_loss: 1.3331, test_f1: 0.5485
 epoch: 69, train_loss: 0.5958, test_loss: 1.2679, test_f1: 0.5405
 epoch: 70, train_loss: 0.5877, test_loss: 1.3701, test_f1: 0.5477
 epoch: 71, train_loss: 0.6127, test_loss: 1.2697, test_f1: 0.5420
 epoch: 72, train_loss: 0.5915, test_loss: 1.3330, test_f1: 0.5489
 epoch: 73, train_loss: 0.5872, test_loss: 1.2460, test_f1: 0.5487
 epoch: 74, train_loss: 0.5833, test_loss: 1.3392, test_f1: 0.5355
 epoch: 75, train_loss: 0.5882, test_loss: 1.3221, test_f1: 0.5269
 epoch: 76, train_loss: 0.5696, test_loss: 1.3218, test_f1: 0.5546
 epoch: 77, train_loss: 0.5944, test_loss: 1.3042, test_f1: 0.5811
 epoch: 78, train_loss: 0.5854, test_loss: 1.3307, test_f1: 0.5307
 epoch: 79, train_loss: 0.5687, test_loss: 1.3161, test_f1: 0.5415
 epoch: 80, train_loss: 0.5645, test_loss: 1.2984, test_f1: 0.5470
 epoch: 81, train_loss: 0.5508, test_loss: 1.3093, test_f1: 0.5253
 epoch: 82, train_loss: 0.5613, test_loss: 1.3495, test_f1: 0.5553
 epoch: 83, train_loss: 0.5600, test_loss: 1.3181, test_f1: 0.5459
 epoch: 84, train_loss: 0.5445, test_loss: 1.3602, test_f1: 0.5505
 epoch: 85, train_loss: 0.5520, test_loss: 1.3425, test_f1: 0.5457
 epoch: 86, train_loss: 0.5425, test_loss: 1.3735, test_f1: 0.5342
 epoch: 87, train_loss: 0.5607, test_loss: 1.3109, test_f1: 0.5507
 epoch: 88, train_loss: 0.5690, test_loss: 1.4676, test_f1: 0.5258
 epoch: 89, train_loss: 0.5447, test_loss: 1.3759, test_f1: 0.5439
 epoch: 90, train_loss: 0.5528, test_loss: 1.4200, test_f1: 0.5305
 epoch: 91, train_loss: 0.5338, test_loss: 1.3385, test_f1: 0.5557
 epoch: 92, train_loss: 0.5415, test_loss: 1.4621, test_f1: 0.5115
 epoch: 93, train_loss: 0.5437, test_loss: 1.3958, test_f1: 0.5275
 epoch: 94, train_loss: 0.5193, test_loss: 1.4707, test_f1: 0.5295
 epoch: 95, train_loss: 0.5365, test_loss: 1.3765, test_f1: 0.5370
 epoch: 96, train_loss: 0.5277, test_loss: 1.3682, test_f1: 0.5493
 epoch: 97, train_loss: 0.5187, test_loss: 1.4534, test_f1: 0.5407
 epoch: 98, train_loss: 0.5331, test_loss: 1.4457, test_f1: 0.5259
 epoch: 99, train_loss: 0.5209, test_loss: 1.3957, test_f1: 0.5422
##################ITERATION #8 ****************************************
 epoch: 0, train_loss: 1.5309, test_loss: 1.3498, test_f1: 0.3601
 epoch: 1, train_loss: 1.2181, test_loss: 1.1158, test_f1: 0.4392
 epoch: 2, train_loss: 1.1423, test_loss: 1.0543, test_f1: 0.4200
 epoch: 3, train_loss: 1.1210, test_loss: 1.0344, test_f1: 0.4328
 epoch: 4, train_loss: 1.1042, test_loss: 0.9993, test_f1: 0.4524
 epoch: 5, train_loss: 1.0695, test_loss: 0.9762, test_f1: 0.4992
 epoch: 6, train_loss: 1.0476, test_loss: 0.9740, test_f1: 0.5017
 epoch: 7, train_loss: 1.0271, test_loss: 0.9597, test_f1: 0.4912
 epoch: 8, train_loss: 1.0235, test_loss: 1.0112, test_f1: 0.4492
 epoch: 9, train_loss: 0.9963, test_loss: 0.9670, test_f1: 0.4856
 epoch: 10, train_loss: 0.9739, test_loss: 0.9468, test_f1: 0.4850
 epoch: 11, train_loss: 0.9613, test_loss: 0.9612, test_f1: 0.4835
 epoch: 12, train_loss: 0.9486, test_loss: 0.9428, test_f1: 0.4689
 epoch: 13, train_loss: 0.9415, test_loss: 1.0018, test_f1: 0.5169
 epoch: 14, train_loss: 0.9341, test_loss: 0.9862, test_f1: 0.5022
 epoch: 15, train_loss: 0.9082, test_loss: 0.9382, test_f1: 0.5148
 epoch: 16, train_loss: 0.9037, test_loss: 0.9608, test_f1: 0.5098
 epoch: 17, train_loss: 0.8978, test_loss: 0.9718, test_f1: 0.5087
 epoch: 18, train_loss: 0.8897, test_loss: 0.9698, test_f1: 0.4911
 epoch: 19, train_loss: 0.8920, test_loss: 0.9593, test_f1: 0.5268
 epoch: 20, train_loss: 0.8834, test_loss: 0.9767, test_f1: 0.5256
 epoch: 21, train_loss: 0.8775, test_loss: 1.0435, test_f1: 0.4899
 epoch: 22, train_loss: 0.8588, test_loss: 1.0171, test_f1: 0.5266
 epoch: 23, train_loss: 0.8685, test_loss: 0.9309, test_f1: 0.5312
 epoch: 24, train_loss: 0.8578, test_loss: 1.0208, test_f1: 0.5041
 epoch: 25, train_loss: 0.8339, test_loss: 1.0137, test_f1: 0.5209
 epoch: 26, train_loss: 0.8456, test_loss: 0.9760, test_f1: 0.5075
 epoch: 27, train_loss: 0.8255, test_loss: 0.9936, test_f1: 0.5361
 epoch: 28, train_loss: 0.8227, test_loss: 1.0664, test_f1: 0.5116
 epoch: 29, train_loss: 0.8053, test_loss: 1.0572, test_f1: 0.5262
 epoch: 30, train_loss: 0.8088, test_loss: 1.0651, test_f1: 0.5378
 epoch: 31, train_loss: 0.8139, test_loss: 1.0799, test_f1: 0.5019
 epoch: 32, train_loss: 0.7995, test_loss: 1.0510, test_f1: 0.5138
 epoch: 33, train_loss: 0.7993, test_loss: 1.1066, test_f1: 0.4993
 epoch: 34, train_loss: 0.7936, test_loss: 1.0441, test_f1: 0.5163
 epoch: 35, train_loss: 0.7822, test_loss: 1.0264, test_f1: 0.5368
 epoch: 36, train_loss: 0.7877, test_loss: 1.0858, test_f1: 0.5046
 epoch: 37, train_loss: 0.7826, test_loss: 1.0519, test_f1: 0.5277
 epoch: 38, train_loss: 0.7701, test_loss: 1.1013, test_f1: 0.5046
 epoch: 39, train_loss: 0.7513, test_loss: 1.1911, test_f1: 0.4929
 epoch: 40, train_loss: 0.7539, test_loss: 1.0221, test_f1: 0.5490
 epoch: 41, train_loss: 0.7428, test_loss: 1.0685, test_f1: 0.5452
 epoch: 42, train_loss: 0.7571, test_loss: 1.1572, test_f1: 0.5262
 epoch: 43, train_loss: 0.7452, test_loss: 1.0962, test_f1: 0.5494
 epoch: 44, train_loss: 0.7283, test_loss: 1.1182, test_f1: 0.5403
 epoch: 45, train_loss: 0.7294, test_loss: 1.1253, test_f1: 0.5547
 epoch: 46, train_loss: 0.7130, test_loss: 1.1530, test_f1: 0.5409
 epoch: 47, train_loss: 0.7095, test_loss: 1.0822, test_f1: 0.5696
 epoch: 48, train_loss: 0.7082, test_loss: 1.1650, test_f1: 0.5238
 epoch: 49, train_loss: 0.7063, test_loss: 1.1297, test_f1: 0.5541
 epoch: 50, train_loss: 0.7058, test_loss: 1.1756, test_f1: 0.5318
 epoch: 51, train_loss: 0.6780, test_loss: 1.1830, test_f1: 0.4959
 epoch: 52, train_loss: 0.6530, test_loss: 1.1933, test_f1: 0.5372
 epoch: 53, train_loss: 0.6501, test_loss: 1.2242, test_f1: 0.5074
 epoch: 54, train_loss: 0.6470, test_loss: 1.2377, test_f1: 0.5170
 epoch: 55, train_loss: 0.6397, test_loss: 1.2356, test_f1: 0.5147
 epoch: 56, train_loss: 0.6396, test_loss: 1.2497, test_f1: 0.5273
 epoch: 57, train_loss: 0.6268, test_loss: 1.2210, test_f1: 0.5373
 epoch: 58, train_loss: 0.6411, test_loss: 1.2331, test_f1: 0.5196
 epoch: 59, train_loss: 0.6276, test_loss: 1.2321, test_f1: 0.5247
 epoch: 60, train_loss: 0.6241, test_loss: 1.2805, test_f1: 0.5090
 epoch: 61, train_loss: 0.6282, test_loss: 1.2323, test_f1: 0.5324
 epoch: 62, train_loss: 0.6221, test_loss: 1.3048, test_f1: 0.5077
 epoch: 63, train_loss: 0.6154, test_loss: 1.2713, test_f1: 0.5064
 epoch: 64, train_loss: 0.6125, test_loss: 1.2750, test_f1: 0.5362
 epoch: 65, train_loss: 0.6190, test_loss: 1.3453, test_f1: 0.5049
 epoch: 66, train_loss: 0.6183, test_loss: 1.2206, test_f1: 0.5298
 epoch: 67, train_loss: 0.6092, test_loss: 1.2672, test_f1: 0.5429
 epoch: 68, train_loss: 0.5918, test_loss: 1.3410, test_f1: 0.5315
 epoch: 69, train_loss: 0.5844, test_loss: 1.3299, test_f1: 0.5582
 epoch: 70, train_loss: 0.5869, test_loss: 1.3883, test_f1: 0.5270
 epoch: 71, train_loss: 0.5877, test_loss: 1.3243, test_f1: 0.5383
 epoch: 72, train_loss: 0.5708, test_loss: 1.2756, test_f1: 0.5439
 epoch: 73, train_loss: 0.5824, test_loss: 1.4139, test_f1: 0.5485
 epoch: 74, train_loss: 0.5860, test_loss: 1.3883, test_f1: 0.5256
 epoch: 75, train_loss: 0.5666, test_loss: 1.4063, test_f1: 0.5369
 epoch: 76, train_loss: 0.5599, test_loss: 1.3905, test_f1: 0.5155
 epoch: 77, train_loss: 0.5665, test_loss: 1.4002, test_f1: 0.5338
 epoch: 78, train_loss: 0.5522, test_loss: 1.5284, test_f1: 0.5324
 epoch: 79, train_loss: 0.5527, test_loss: 1.4518, test_f1: 0.5106
 epoch: 80, train_loss: 0.5638, test_loss: 1.5087, test_f1: 0.5225
 epoch: 81, train_loss: 0.5644, test_loss: 1.5486, test_f1: 0.5114
 epoch: 82, train_loss: 0.5500, test_loss: 1.4975, test_f1: 0.5228
 epoch: 83, train_loss: 0.5545, test_loss: 1.5719, test_f1: 0.5266
 epoch: 84, train_loss: 0.5342, test_loss: 1.3699, test_f1: 0.5204
 epoch: 85, train_loss: 0.5574, test_loss: 1.4183, test_f1: 0.5472
 epoch: 86, train_loss: 0.5344, test_loss: 1.3723, test_f1: 0.5321
 epoch: 87, train_loss: 0.5412, test_loss: 1.5008, test_f1: 0.5381
 epoch: 88, train_loss: 0.5374, test_loss: 1.4549, test_f1: 0.5411
 epoch: 89, train_loss: 0.5325, test_loss: 1.6647, test_f1: 0.5444
 epoch: 90, train_loss: 0.5177, test_loss: 1.4725, test_f1: 0.5506
 epoch: 91, train_loss: 0.5234, test_loss: 1.6219, test_f1: 0.5419
 epoch: 92, train_loss: 0.5261, test_loss: 1.5405, test_f1: 0.5361
 epoch: 93, train_loss: 0.5394, test_loss: 1.5144, test_f1: 0.5070
 epoch: 94, train_loss: 0.5287, test_loss: 1.5050, test_f1: 0.5270
 epoch: 95, train_loss: 0.5073, test_loss: 1.5850, test_f1: 0.5455
 epoch: 96, train_loss: 0.5108, test_loss: 1.7510, test_f1: 0.5531
 epoch: 97, train_loss: 0.5040, test_loss: 1.7189, test_f1: 0.5315
 epoch: 98, train_loss: 0.4968, test_loss: 1.6767, test_f1: 0.5466
 epoch: 99, train_loss: 0.5143, test_loss: 1.6711, test_f1: 0.5492
##################ITERATION #9 ****************************************
 epoch: 0, train_loss: 1.6658, test_loss: 1.2325, test_f1: 0.3221
 epoch: 1, train_loss: 1.2155, test_loss: 1.1383, test_f1: 0.4430
 epoch: 2, train_loss: 1.1667, test_loss: 1.0842, test_f1: 0.4503
 epoch: 3, train_loss: 1.1182, test_loss: 1.0700, test_f1: 0.4230
 epoch: 4, train_loss: 1.1031, test_loss: 1.0449, test_f1: 0.4610
 epoch: 5, train_loss: 1.0611, test_loss: 0.9947, test_f1: 0.4789
 epoch: 6, train_loss: 1.0378, test_loss: 0.9916, test_f1: 0.4822
 epoch: 7, train_loss: 1.0219, test_loss: 0.9607, test_f1: 0.4944
 epoch: 8, train_loss: 0.9955, test_loss: 0.9312, test_f1: 0.5042
 epoch: 9, train_loss: 0.9730, test_loss: 0.9718, test_f1: 0.5155
 epoch: 10, train_loss: 0.9574, test_loss: 0.9502, test_f1: 0.5106
 epoch: 11, train_loss: 0.9493, test_loss: 0.9571, test_f1: 0.4919
 epoch: 12, train_loss: 0.9394, test_loss: 1.0378, test_f1: 0.4812
 epoch: 13, train_loss: 0.9256, test_loss: 0.8964, test_f1: 0.5380
 epoch: 14, train_loss: 0.9102, test_loss: 0.9117, test_f1: 0.5162
 epoch: 15, train_loss: 0.9029, test_loss: 0.9721, test_f1: 0.5287
 epoch: 16, train_loss: 0.8873, test_loss: 0.9007, test_f1: 0.5073
 epoch: 17, train_loss: 0.8770, test_loss: 0.9456, test_f1: 0.5182
 epoch: 18, train_loss: 0.8519, test_loss: 0.9955, test_f1: 0.5330
 epoch: 19, train_loss: 0.8536, test_loss: 1.0706, test_f1: 0.4733
 epoch: 20, train_loss: 0.8519, test_loss: 0.9715, test_f1: 0.5067
 epoch: 21, train_loss: 0.8376, test_loss: 0.9925, test_f1: 0.5300
 epoch: 22, train_loss: 0.8313, test_loss: 0.9946, test_f1: 0.5189
 epoch: 23, train_loss: 0.8253, test_loss: 1.0621, test_f1: 0.5256
 epoch: 24, train_loss: 0.8101, test_loss: 1.0390, test_f1: 0.5358
 epoch: 25, train_loss: 0.8043, test_loss: 1.0303, test_f1: 0.5355
 epoch: 26, train_loss: 0.7975, test_loss: 1.0205, test_f1: 0.5032
 epoch: 27, train_loss: 0.7856, test_loss: 0.9874, test_f1: 0.5432
 epoch: 28, train_loss: 0.7866, test_loss: 1.0832, test_f1: 0.5195
 epoch: 29, train_loss: 0.7736, test_loss: 1.0754, test_f1: 0.5068
 epoch: 30, train_loss: 0.7569, test_loss: 1.1343, test_f1: 0.4997
 epoch: 31, train_loss: 0.7562, test_loss: 1.0803, test_f1: 0.5375
 epoch: 32, train_loss: 0.7507, test_loss: 1.0530, test_f1: 0.5392
 epoch: 33, train_loss: 0.7424, test_loss: 1.1018, test_f1: 0.5302
 epoch: 34, train_loss: 0.7597, test_loss: 1.1630, test_f1: 0.5034
 epoch: 35, train_loss: 0.7422, test_loss: 1.0957, test_f1: 0.5566
 epoch: 36, train_loss: 0.7421, test_loss: 1.0973, test_f1: 0.5087
 epoch: 37, train_loss: 0.7128, test_loss: 1.1018, test_f1: 0.5153
 epoch: 38, train_loss: 0.7258, test_loss: 1.0462, test_f1: 0.5383
 epoch: 39, train_loss: 0.7142, test_loss: 1.0845, test_f1: 0.5426
 epoch: 40, train_loss: 0.7170, test_loss: 1.0949, test_f1: 0.5631
 epoch: 41, train_loss: 0.7058, test_loss: 1.1908, test_f1: 0.5180
 epoch: 42, train_loss: 0.7226, test_loss: 1.1179, test_f1: 0.5331
 epoch: 43, train_loss: 0.7046, test_loss: 1.1634, test_f1: 0.5441
 epoch: 44, train_loss: 0.7019, test_loss: 1.2505, test_f1: 0.5248
 epoch: 45, train_loss: 0.6966, test_loss: 1.1974, test_f1: 0.5390
 epoch: 46, train_loss: 0.6725, test_loss: 1.2139, test_f1: 0.5135
 epoch: 47, train_loss: 0.6730, test_loss: 1.2427, test_f1: 0.5003
 epoch: 48, train_loss: 0.6741, test_loss: 1.1469, test_f1: 0.5489
 epoch: 49, train_loss: 0.6738, test_loss: 1.3290, test_f1: 0.5089
 epoch: 50, train_loss: 0.6809, test_loss: 1.2090, test_f1: 0.5255
 epoch: 51, train_loss: 0.6349, test_loss: 1.1857, test_f1: 0.5542
 epoch: 52, train_loss: 0.6102, test_loss: 1.2544, test_f1: 0.5291
 epoch: 53, train_loss: 0.6069, test_loss: 1.2646, test_f1: 0.5480
 epoch: 54, train_loss: 0.6179, test_loss: 1.2826, test_f1: 0.5458
 epoch: 55, train_loss: 0.6030, test_loss: 1.3165, test_f1: 0.5397
 epoch: 56, train_loss: 0.5990, test_loss: 1.2694, test_f1: 0.5171
 epoch: 57, train_loss: 0.5939, test_loss: 1.2796, test_f1: 0.5350
 epoch: 58, train_loss: 0.5843, test_loss: 1.3166, test_f1: 0.5175
 epoch: 59, train_loss: 0.6010, test_loss: 1.3328, test_f1: 0.5214
 epoch: 60, train_loss: 0.5865, test_loss: 1.3618, test_f1: 0.5057
 epoch: 61, train_loss: 0.5760, test_loss: 1.2977, test_f1: 0.5363
 epoch: 62, train_loss: 0.6088, test_loss: 1.3601, test_f1: 0.5287
 epoch: 63, train_loss: 0.5732, test_loss: 1.3593, test_f1: 0.5333
 epoch: 64, train_loss: 0.5741, test_loss: 1.2906, test_f1: 0.5500
 epoch: 65, train_loss: 0.5669, test_loss: 1.3521, test_f1: 0.5393
 epoch: 66, train_loss: 0.5803, test_loss: 1.2641, test_f1: 0.5476
 epoch: 67, train_loss: 0.5566, test_loss: 1.3955, test_f1: 0.5286
 epoch: 68, train_loss: 0.5681, test_loss: 1.2920, test_f1: 0.5423
 epoch: 69, train_loss: 0.5631, test_loss: 1.3464, test_f1: 0.5213
 epoch: 70, train_loss: 0.5492, test_loss: 1.2537, test_f1: 0.5336
 epoch: 71, train_loss: 0.5557, test_loss: 1.3249, test_f1: 0.5291
 epoch: 72, train_loss: 0.5422, test_loss: 1.3146, test_f1: 0.5511
 epoch: 73, train_loss: 0.5480, test_loss: 1.3834, test_f1: 0.5407
 epoch: 74, train_loss: 0.5523, test_loss: 1.2998, test_f1: 0.5378
 epoch: 75, train_loss: 0.5526, test_loss: 1.3419, test_f1: 0.5344
 epoch: 76, train_loss: 0.5465, test_loss: 1.3971, test_f1: 0.5173
 epoch: 77, train_loss: 0.5545, test_loss: 1.3555, test_f1: 0.5233
 epoch: 78, train_loss: 0.5183, test_loss: 1.3384, test_f1: 0.5491
 epoch: 79, train_loss: 0.5343, test_loss: 1.3715, test_f1: 0.5406
 epoch: 80, train_loss: 0.5287, test_loss: 1.3805, test_f1: 0.5378
 epoch: 81, train_loss: 0.5253, test_loss: 1.4105, test_f1: 0.5444
 epoch: 82, train_loss: 0.5446, test_loss: 1.4305, test_f1: 0.5310
 epoch: 83, train_loss: 0.5247, test_loss: 1.3901, test_f1: 0.5411
 epoch: 84, train_loss: 0.5361, test_loss: 1.3351, test_f1: 0.5534
 epoch: 85, train_loss: 0.5204, test_loss: 1.4601, test_f1: 0.5125
 epoch: 86, train_loss: 0.5098, test_loss: 1.4383, test_f1: 0.5352
 epoch: 87, train_loss: 0.5081, test_loss: 1.4010, test_f1: 0.5329
 epoch: 88, train_loss: 0.4955, test_loss: 1.3617, test_f1: 0.5436
 epoch: 89, train_loss: 0.4963, test_loss: 1.4182, test_f1: 0.5439
 epoch: 90, train_loss: 0.5011, test_loss: 1.4644, test_f1: 0.5366
 epoch: 91, train_loss: 0.4816, test_loss: 1.4348, test_f1: 0.5486
 epoch: 92, train_loss: 0.4845, test_loss: 1.3980, test_f1: 0.5373
 epoch: 93, train_loss: 0.4920, test_loss: 1.4274, test_f1: 0.5468
 epoch: 94, train_loss: 0.4821, test_loss: 1.5154, test_f1: 0.5452
 epoch: 95, train_loss: 0.4846, test_loss: 1.5160, test_f1: 0.5358
 epoch: 96, train_loss: 0.4801, test_loss: 1.4802, test_f1: 0.5336
 epoch: 97, train_loss: 0.4677, test_loss: 1.4707, test_f1: 0.5395
 epoch: 98, train_loss: 0.4759, test_loss: 1.4432, test_f1: 0.5562
 epoch: 99, train_loss: 0.4699, test_loss: 1.4768, test_f1: 0.5385

Training completed in 424.62 seconds
Best F1: 0.6063 at epoch 70
Mean F1 across iterations: 0.5783  0.0122
========================FINAL RESULTS================================
FEGIN weighted F1: 0.6063  0.0122
python main.py --data ltspice_examples --representation component_component --model FEGIN --layers 2 --hiddens 64 --batch_size 128 --lr 0.001 --emb_size 250 --epochs 100 --save_appendix component_component_L2_H64_BS128_LR0.001_E250 --no_val
-----



STDERR:
  File "main.py", line 370, in <module>
    main()
  File "main.py", line 254, in main
    dataset = dataset_class(
  File "/home/philip/projects/ltspice_examples_code_repo/Circuit-Completion-Using-GNNs/component_classification_with_link_prediction_head/evaluation/FEGIN/kernel/circuit_datasets.py", line 15, in __init__
    self.data, self.slices = torch.load(self.processed_paths[0])
  File "/home/philip/.local/lib/python3.8/site-packages/torch/serialization.py", line 1040, in load
    warnings.warn(
  File "/usr/lib/python3.8/warnings.py", line 109, in _showwarnmsg
    sw(msg.message, msg.category, msg.filename, msg.lineno,
  File "main.py", line 47, in warn_with_traceback
    traceback.print_stack(file=log)
/home/philip/projects/ltspice_examples_code_repo/Circuit-Completion-Using-GNNs/component_classification_with_link_prediction_head/evaluation/FEGIN/kernel/circuit_datasets.py:15: FutureWarning: You are using `torch.load` with `weights_only=False` (the current default value), which uses the default pickle module implicitly. It is possible to construct malicious pickle data which will execute arbitrary code during unpickling (See https://github.com/pytorch/pytorch/blob/main/SECURITY.md#untrusted-models for more details). In a future release, the default value for `weights_only` will be flipped to `True`. This limits the functions that could be executed during unpickling. Arbitrary objects will no longer be allowed to be loaded via this mode unless they are explicitly allowlisted by the user via `torch.serialization.add_safe_globals`. We recommend you start setting `weights_only=True` for any use case where you don't have full control of the loaded file. Please open an issue on GitHub for any issues related to this experimental feature.
  self.data, self.slices = torch.load(self.processed_paths[0])
