STDOUT:
Results will be saved in /home/philip/projects/ltspice_examples_code_repo/Circuit-Completion-Using-GNNs/component_classification_with_link_prediction_head/evaluation/FEGIN/results/model_FEGIN_dataset_ltspice_examples
Command line input: python main.py --data ltspice_examples --representation component_pin_net --model FEGIN --layers 2 --hiddens 32 --batch_size 256 --lr 0.0001 --emb_size 128 --epochs 100 --save_appendix component_pin_net_L2_H32_BS256_LR0.0001_E128 --no_val
 is saved.
-----
ltspice_examples - FEGIN
Using 2 layers, 32 hidden units, h = 2
Loading component_pin_net representation dataset
ENTERED
Training FEGIN on component_pin_net representation
Train: 3558, Test: 846
##################ITERATION #0 ****************************************
 epoch: 0, train_loss: 1.3863, test_loss: 1.3806, test_f1: 0.0793
 epoch: 1, train_loss: 1.3834, test_loss: 1.3800, test_f1: 0.0793
 epoch: 2, train_loss: 1.3819, test_loss: 1.3787, test_f1: 0.0793
 epoch: 3, train_loss: 1.3804, test_loss: 1.3767, test_f1: 0.0793
 epoch: 4, train_loss: 1.3792, test_loss: 1.3748, test_f1: 0.0793
 epoch: 5, train_loss: 1.3773, test_loss: 1.3732, test_f1: 0.0793
 epoch: 6, train_loss: 1.3758, test_loss: 1.3716, test_f1: 0.0793
 epoch: 7, train_loss: 1.3742, test_loss: 1.3701, test_f1: 0.0793
 epoch: 8, train_loss: 1.3727, test_loss: 1.3685, test_f1: 0.0793
 epoch: 9, train_loss: 1.3712, test_loss: 1.3668, test_f1: 0.0793
 epoch: 10, train_loss: 1.3696, test_loss: 1.3651, test_f1: 0.0793
 epoch: 11, train_loss: 1.3675, test_loss: 1.3631, test_f1: 0.0793
 epoch: 12, train_loss: 1.3656, test_loss: 1.3611, test_f1: 0.0840
 epoch: 13, train_loss: 1.3638, test_loss: 1.3589, test_f1: 0.1038
 epoch: 14, train_loss: 1.3618, test_loss: 1.3567, test_f1: 0.1136
 epoch: 15, train_loss: 1.3597, test_loss: 1.3541, test_f1: 0.1209
 epoch: 16, train_loss: 1.3569, test_loss: 1.3513, test_f1: 0.1289
 epoch: 17, train_loss: 1.3539, test_loss: 1.3481, test_f1: 0.2634
 epoch: 18, train_loss: 1.3510, test_loss: 1.3444, test_f1: 0.2954
 epoch: 19, train_loss: 1.3473, test_loss: 1.3403, test_f1: 0.3326
 epoch: 20, train_loss: 1.3432, test_loss: 1.3356, test_f1: 0.3539
 epoch: 21, train_loss: 1.3398, test_loss: 1.3300, test_f1: 0.3798
 epoch: 22, train_loss: 1.3333, test_loss: 1.3242, test_f1: 0.3772
 epoch: 23, train_loss: 1.3291, test_loss: 1.3177, test_f1: 0.3775
 epoch: 24, train_loss: 1.3218, test_loss: 1.3103, test_f1: 0.3809
 epoch: 25, train_loss: 1.3160, test_loss: 1.3026, test_f1: 0.3711
 epoch: 26, train_loss: 1.3081, test_loss: 1.2943, test_f1: 0.3696
 epoch: 27, train_loss: 1.3003, test_loss: 1.2858, test_f1: 0.3720
 epoch: 28, train_loss: 1.2920, test_loss: 1.2765, test_f1: 0.3745
 epoch: 29, train_loss: 1.2837, test_loss: 1.2664, test_f1: 0.3510
 epoch: 30, train_loss: 1.2742, test_loss: 1.2553, test_f1: 0.3660
 epoch: 31, train_loss: 1.2665, test_loss: 1.2446, test_f1: 0.3730
 epoch: 32, train_loss: 1.2524, test_loss: 1.2334, test_f1: 0.3707
 epoch: 33, train_loss: 1.2431, test_loss: 1.2212, test_f1: 0.3698
 epoch: 34, train_loss: 1.2326, test_loss: 1.2103, test_f1: 0.3704
 epoch: 35, train_loss: 1.2226, test_loss: 1.1986, test_f1: 0.3683
 epoch: 36, train_loss: 1.2132, test_loss: 1.1868, test_f1: 0.3682
 epoch: 37, train_loss: 1.2013, test_loss: 1.1757, test_f1: 0.3625
 epoch: 38, train_loss: 1.1908, test_loss: 1.1652, test_f1: 0.3640
 epoch: 39, train_loss: 1.1800, test_loss: 1.1557, test_f1: 0.3517
 epoch: 40, train_loss: 1.1676, test_loss: 1.1470, test_f1: 0.3459
 epoch: 41, train_loss: 1.1619, test_loss: 1.1381, test_f1: 0.3459
 epoch: 42, train_loss: 1.1535, test_loss: 1.1300, test_f1: 0.3449
 epoch: 43, train_loss: 1.1471, test_loss: 1.1226, test_f1: 0.3433
 epoch: 44, train_loss: 1.1388, test_loss: 1.1168, test_f1: 0.3423
 epoch: 45, train_loss: 1.1291, test_loss: 1.1102, test_f1: 0.3423
 epoch: 46, train_loss: 1.1257, test_loss: 1.1055, test_f1: 0.3423
 epoch: 47, train_loss: 1.1154, test_loss: 1.1005, test_f1: 0.3423
 epoch: 48, train_loss: 1.1127, test_loss: 1.0956, test_f1: 0.3423
 epoch: 49, train_loss: 1.1055, test_loss: 1.0916, test_f1: 0.3423
 epoch: 50, train_loss: 1.1073, test_loss: 1.0887, test_f1: 0.3433
 epoch: 51, train_loss: 1.0988, test_loss: 1.0864, test_f1: 0.3449
 epoch: 52, train_loss: 1.0963, test_loss: 1.0845, test_f1: 0.3449
 epoch: 53, train_loss: 1.0926, test_loss: 1.0820, test_f1: 0.3474
 epoch: 54, train_loss: 1.0916, test_loss: 1.0804, test_f1: 0.3524
 epoch: 55, train_loss: 1.0871, test_loss: 1.0786, test_f1: 0.3623
 epoch: 56, train_loss: 1.0873, test_loss: 1.0777, test_f1: 0.3623
 epoch: 57, train_loss: 1.0812, test_loss: 1.0759, test_f1: 0.3664
 epoch: 58, train_loss: 1.0785, test_loss: 1.0739, test_f1: 0.3728
 epoch: 59, train_loss: 1.0825, test_loss: 1.0721, test_f1: 0.3796
 epoch: 60, train_loss: 1.0801, test_loss: 1.0707, test_f1: 0.3796
 epoch: 61, train_loss: 1.0722, test_loss: 1.0690, test_f1: 0.3812
 epoch: 62, train_loss: 1.0749, test_loss: 1.0679, test_f1: 0.3835
 epoch: 63, train_loss: 1.0715, test_loss: 1.0663, test_f1: 0.3835
 epoch: 64, train_loss: 1.0722, test_loss: 1.0652, test_f1: 0.3828
 epoch: 65, train_loss: 1.0685, test_loss: 1.0644, test_f1: 0.3836
 epoch: 66, train_loss: 1.0669, test_loss: 1.0626, test_f1: 0.3851
 epoch: 67, train_loss: 1.0623, test_loss: 1.0608, test_f1: 0.3872
 epoch: 68, train_loss: 1.0636, test_loss: 1.0589, test_f1: 0.3886
 epoch: 69, train_loss: 1.0652, test_loss: 1.0582, test_f1: 0.3909
 epoch: 70, train_loss: 1.0628, test_loss: 1.0568, test_f1: 0.3920
 epoch: 71, train_loss: 1.0611, test_loss: 1.0556, test_f1: 0.3920
 epoch: 72, train_loss: 1.0563, test_loss: 1.0546, test_f1: 0.3941
 epoch: 73, train_loss: 1.0577, test_loss: 1.0534, test_f1: 0.3933
 epoch: 74, train_loss: 1.0592, test_loss: 1.0520, test_f1: 0.3944
 epoch: 75, train_loss: 1.0479, test_loss: 1.0513, test_f1: 0.3956
 epoch: 76, train_loss: 1.0523, test_loss: 1.0499, test_f1: 0.3956
 epoch: 77, train_loss: 1.0462, test_loss: 1.0487, test_f1: 0.4047
 epoch: 78, train_loss: 1.0455, test_loss: 1.0477, test_f1: 0.4047
 epoch: 79, train_loss: 1.0459, test_loss: 1.0466, test_f1: 0.4051
 epoch: 80, train_loss: 1.0403, test_loss: 1.0448, test_f1: 0.4108
 epoch: 81, train_loss: 1.0449, test_loss: 1.0437, test_f1: 0.4108
 epoch: 82, train_loss: 1.0399, test_loss: 1.0427, test_f1: 0.4147
 epoch: 83, train_loss: 1.0392, test_loss: 1.0412, test_f1: 0.4165
 epoch: 84, train_loss: 1.0413, test_loss: 1.0401, test_f1: 0.4165
 epoch: 85, train_loss: 1.0445, test_loss: 1.0397, test_f1: 0.4165
 epoch: 86, train_loss: 1.0386, test_loss: 1.0384, test_f1: 0.4165
 epoch: 87, train_loss: 1.0362, test_loss: 1.0374, test_f1: 0.4157
 epoch: 88, train_loss: 1.0355, test_loss: 1.0364, test_f1: 0.4212
 epoch: 89, train_loss: 1.0357, test_loss: 1.0351, test_f1: 0.4240
 epoch: 90, train_loss: 1.0350, test_loss: 1.0343, test_f1: 0.4246
 epoch: 91, train_loss: 1.0321, test_loss: 1.0327, test_f1: 0.4332
 epoch: 92, train_loss: 1.0319, test_loss: 1.0318, test_f1: 0.4256
 epoch: 93, train_loss: 1.0310, test_loss: 1.0309, test_f1: 0.4355
 epoch: 94, train_loss: 1.0269, test_loss: 1.0299, test_f1: 0.4388
 epoch: 95, train_loss: 1.0298, test_loss: 1.0287, test_f1: 0.4398
 epoch: 96, train_loss: 1.0262, test_loss: 1.0285, test_f1: 0.4388
 epoch: 97, train_loss: 1.0264, test_loss: 1.0279, test_f1: 0.4379
 epoch: 98, train_loss: 1.0245, test_loss: 1.0270, test_f1: 0.4405
 epoch: 99, train_loss: 1.0218, test_loss: 1.0249, test_f1: 0.4420
##################ITERATION #1 ****************************************
 epoch: 0, train_loss: 1.3468, test_loss: 1.3482, test_f1: 0.2270
 epoch: 1, train_loss: 1.3403, test_loss: 1.3448, test_f1: 0.2270
 epoch: 2, train_loss: 1.3372, test_loss: 1.3401, test_f1: 0.2270
 epoch: 3, train_loss: 1.3315, test_loss: 1.3347, test_f1: 0.2270
 epoch: 4, train_loss: 1.3283, test_loss: 1.3289, test_f1: 0.2270
 epoch: 5, train_loss: 1.3242, test_loss: 1.3229, test_f1: 0.2270
 epoch: 6, train_loss: 1.3191, test_loss: 1.3166, test_f1: 0.2270
 epoch: 7, train_loss: 1.3131, test_loss: 1.3103, test_f1: 0.2270
 epoch: 8, train_loss: 1.3096, test_loss: 1.3040, test_f1: 0.2270
 epoch: 9, train_loss: 1.3029, test_loss: 1.2970, test_f1: 0.2344
 epoch: 10, train_loss: 1.2974, test_loss: 1.2897, test_f1: 0.2392
 epoch: 11, train_loss: 1.2908, test_loss: 1.2816, test_f1: 0.2506
 epoch: 12, train_loss: 1.2823, test_loss: 1.2725, test_f1: 0.2783
 epoch: 13, train_loss: 1.2774, test_loss: 1.2627, test_f1: 0.2920
 epoch: 14, train_loss: 1.2681, test_loss: 1.2518, test_f1: 0.3088
 epoch: 15, train_loss: 1.2580, test_loss: 1.2406, test_f1: 0.3195
 epoch: 16, train_loss: 1.2467, test_loss: 1.2297, test_f1: 0.3332
 epoch: 17, train_loss: 1.2390, test_loss: 1.2179, test_f1: 0.3280
 epoch: 18, train_loss: 1.2270, test_loss: 1.2061, test_f1: 0.3334
 epoch: 19, train_loss: 1.2171, test_loss: 1.1944, test_f1: 0.3344
 epoch: 20, train_loss: 1.2073, test_loss: 1.1827, test_f1: 0.3393
 epoch: 21, train_loss: 1.1959, test_loss: 1.1720, test_f1: 0.3403
 epoch: 22, train_loss: 1.1816, test_loss: 1.1610, test_f1: 0.3403
 epoch: 23, train_loss: 1.1760, test_loss: 1.1511, test_f1: 0.3413
 epoch: 24, train_loss: 1.1683, test_loss: 1.1417, test_f1: 0.3413
 epoch: 25, train_loss: 1.1610, test_loss: 1.1332, test_f1: 0.3413
 epoch: 26, train_loss: 1.1482, test_loss: 1.1254, test_f1: 0.3413
 epoch: 27, train_loss: 1.1397, test_loss: 1.1184, test_f1: 0.3413
 epoch: 28, train_loss: 1.1306, test_loss: 1.1117, test_f1: 0.3450
 epoch: 29, train_loss: 1.1248, test_loss: 1.1057, test_f1: 0.3460
 epoch: 30, train_loss: 1.1187, test_loss: 1.1003, test_f1: 0.3460
 epoch: 31, train_loss: 1.1140, test_loss: 1.0954, test_f1: 0.3460
 epoch: 32, train_loss: 1.1035, test_loss: 1.0906, test_f1: 0.3460
 epoch: 33, train_loss: 1.1016, test_loss: 1.0884, test_f1: 0.3460
 epoch: 34, train_loss: 1.0982, test_loss: 1.0835, test_f1: 0.3460
 epoch: 35, train_loss: 1.0940, test_loss: 1.0785, test_f1: 0.3460
 epoch: 36, train_loss: 1.0883, test_loss: 1.0757, test_f1: 0.3460
 epoch: 37, train_loss: 1.0831, test_loss: 1.0733, test_f1: 0.3450
 epoch: 38, train_loss: 1.0814, test_loss: 1.0690, test_f1: 0.3450
 epoch: 39, train_loss: 1.0767, test_loss: 1.0655, test_f1: 0.3460
 epoch: 40, train_loss: 1.0708, test_loss: 1.0642, test_f1: 0.3450
 epoch: 41, train_loss: 1.0697, test_loss: 1.0627, test_f1: 0.3450
 epoch: 42, train_loss: 1.0663, test_loss: 1.0591, test_f1: 0.3459
 epoch: 43, train_loss: 1.0608, test_loss: 1.0567, test_f1: 0.3460
 epoch: 44, train_loss: 1.0552, test_loss: 1.0545, test_f1: 0.3469
 epoch: 45, train_loss: 1.0542, test_loss: 1.0527, test_f1: 0.3459
 epoch: 46, train_loss: 1.0568, test_loss: 1.0483, test_f1: 0.3476
 epoch: 47, train_loss: 1.0464, test_loss: 1.0487, test_f1: 0.3485
 epoch: 48, train_loss: 1.0514, test_loss: 1.0471, test_f1: 0.3495
 epoch: 49, train_loss: 1.0493, test_loss: 1.0428, test_f1: 0.3489
 epoch: 50, train_loss: 1.0447, test_loss: 1.0411, test_f1: 0.3540
 epoch: 51, train_loss: 1.0470, test_loss: 1.0398, test_f1: 0.3609
 epoch: 52, train_loss: 1.0445, test_loss: 1.0383, test_f1: 0.3657
 epoch: 53, train_loss: 1.0415, test_loss: 1.0401, test_f1: 0.3681
 epoch: 54, train_loss: 1.0387, test_loss: 1.0382, test_f1: 0.3689
 epoch: 55, train_loss: 1.0380, test_loss: 1.0364, test_f1: 0.3699
 epoch: 56, train_loss: 1.0382, test_loss: 1.0367, test_f1: 0.3714
 epoch: 57, train_loss: 1.0373, test_loss: 1.0346, test_f1: 0.3717
 epoch: 58, train_loss: 1.0400, test_loss: 1.0338, test_f1: 0.3773
 epoch: 59, train_loss: 1.0388, test_loss: 1.0342, test_f1: 0.3833
 epoch: 60, train_loss: 1.0362, test_loss: 1.0343, test_f1: 0.3819
 epoch: 61, train_loss: 1.0367, test_loss: 1.0316, test_f1: 0.3819
 epoch: 62, train_loss: 1.0317, test_loss: 1.0305, test_f1: 0.3806
 epoch: 63, train_loss: 1.0363, test_loss: 1.0291, test_f1: 0.3828
 epoch: 64, train_loss: 1.0295, test_loss: 1.0274, test_f1: 0.3849
 epoch: 65, train_loss: 1.0312, test_loss: 1.0275, test_f1: 0.3870
 epoch: 66, train_loss: 1.0316, test_loss: 1.0264, test_f1: 0.3870
 epoch: 67, train_loss: 1.0258, test_loss: 1.0259, test_f1: 0.3870
 epoch: 68, train_loss: 1.0300, test_loss: 1.0247, test_f1: 0.3871
 epoch: 69, train_loss: 1.0310, test_loss: 1.0245, test_f1: 0.3878
 epoch: 70, train_loss: 1.0270, test_loss: 1.0243, test_f1: 0.3878
 epoch: 71, train_loss: 1.0235, test_loss: 1.0242, test_f1: 0.3932
 epoch: 72, train_loss: 1.0230, test_loss: 1.0226, test_f1: 0.3958
 epoch: 73, train_loss: 1.0235, test_loss: 1.0219, test_f1: 0.3972
 epoch: 74, train_loss: 1.0246, test_loss: 1.0202, test_f1: 0.4002
 epoch: 75, train_loss: 1.0238, test_loss: 1.0190, test_f1: 0.4006
 epoch: 76, train_loss: 1.0243, test_loss: 1.0190, test_f1: 0.4017
 epoch: 77, train_loss: 1.0213, test_loss: 1.0193, test_f1: 0.4036
 epoch: 78, train_loss: 1.0157, test_loss: 1.0182, test_f1: 0.4021
 epoch: 79, train_loss: 1.0218, test_loss: 1.0169, test_f1: 0.4007
 epoch: 80, train_loss: 1.0190, test_loss: 1.0165, test_f1: 0.4029
 epoch: 81, train_loss: 1.0211, test_loss: 1.0150, test_f1: 0.4031
 epoch: 82, train_loss: 1.0155, test_loss: 1.0143, test_f1: 0.4042
 epoch: 83, train_loss: 1.0148, test_loss: 1.0149, test_f1: 0.4027
 epoch: 84, train_loss: 1.0169, test_loss: 1.0145, test_f1: 0.4032
 epoch: 85, train_loss: 1.0141, test_loss: 1.0128, test_f1: 0.4117
 epoch: 86, train_loss: 1.0145, test_loss: 1.0117, test_f1: 0.4089
 epoch: 87, train_loss: 1.0182, test_loss: 1.0118, test_f1: 0.4071
 epoch: 88, train_loss: 1.0094, test_loss: 1.0109, test_f1: 0.4019
 epoch: 89, train_loss: 1.0129, test_loss: 1.0115, test_f1: 0.4081
 epoch: 90, train_loss: 1.0147, test_loss: 1.0097, test_f1: 0.4091
 epoch: 91, train_loss: 1.0120, test_loss: 1.0075, test_f1: 0.4072
 epoch: 92, train_loss: 1.0110, test_loss: 1.0068, test_f1: 0.4073
 epoch: 93, train_loss: 1.0111, test_loss: 1.0058, test_f1: 0.4108
 epoch: 94, train_loss: 1.0069, test_loss: 1.0064, test_f1: 0.4107
 epoch: 95, train_loss: 1.0053, test_loss: 1.0052, test_f1: 0.4108
 epoch: 96, train_loss: 1.0068, test_loss: 1.0045, test_f1: 0.4108
 epoch: 97, train_loss: 1.0050, test_loss: 1.0031, test_f1: 0.4075
 epoch: 98, train_loss: 1.0038, test_loss: 1.0021, test_f1: 0.4191
 epoch: 99, train_loss: 0.9988, test_loss: 1.0019, test_f1: 0.4133
##################ITERATION #2 ****************************************
 epoch: 0, train_loss: 1.3093, test_loss: 1.3244, test_f1: 0.2270
 epoch: 1, train_loss: 1.2982, test_loss: 1.3185, test_f1: 0.2270
 epoch: 2, train_loss: 1.2874, test_loss: 1.3102, test_f1: 0.2270
 epoch: 3, train_loss: 1.2813, test_loss: 1.2959, test_f1: 0.2270
 epoch: 4, train_loss: 1.2705, test_loss: 1.2763, test_f1: 0.2416
 epoch: 5, train_loss: 1.2633, test_loss: 1.2584, test_f1: 0.2819
 epoch: 6, train_loss: 1.2546, test_loss: 1.2451, test_f1: 0.3059
 epoch: 7, train_loss: 1.2456, test_loss: 1.2344, test_f1: 0.3284
 epoch: 8, train_loss: 1.2341, test_loss: 1.2232, test_f1: 0.3401
 epoch: 9, train_loss: 1.2272, test_loss: 1.2117, test_f1: 0.3324
 epoch: 10, train_loss: 1.2159, test_loss: 1.2007, test_f1: 0.3364
 epoch: 11, train_loss: 1.2061, test_loss: 1.1900, test_f1: 0.3384
 epoch: 12, train_loss: 1.1980, test_loss: 1.1798, test_f1: 0.3431
 epoch: 13, train_loss: 1.1883, test_loss: 1.1695, test_f1: 0.3431
 epoch: 14, train_loss: 1.1813, test_loss: 1.1602, test_f1: 0.3431
 epoch: 15, train_loss: 1.1690, test_loss: 1.1514, test_f1: 0.3421
 epoch: 16, train_loss: 1.1635, test_loss: 1.1434, test_f1: 0.3411
 epoch: 17, train_loss: 1.1569, test_loss: 1.1366, test_f1: 0.3404
 epoch: 18, train_loss: 1.1506, test_loss: 1.1291, test_f1: 0.3416
 epoch: 19, train_loss: 1.1435, test_loss: 1.1217, test_f1: 0.3406
 epoch: 20, train_loss: 1.1324, test_loss: 1.1166, test_f1: 0.3397
 epoch: 21, train_loss: 1.1267, test_loss: 1.1126, test_f1: 0.3395
 epoch: 22, train_loss: 1.1213, test_loss: 1.1027, test_f1: 0.3419
 epoch: 23, train_loss: 1.1166, test_loss: 1.1009, test_f1: 0.3399
 epoch: 24, train_loss: 1.1093, test_loss: 1.0960, test_f1: 0.3408
 epoch: 25, train_loss: 1.1110, test_loss: 1.0933, test_f1: 0.3408
 epoch: 26, train_loss: 1.1006, test_loss: 1.0885, test_f1: 0.3418
 epoch: 27, train_loss: 1.0982, test_loss: 1.0871, test_f1: 0.3404
 epoch: 28, train_loss: 1.0905, test_loss: 1.0809, test_f1: 0.3418
 epoch: 29, train_loss: 1.0890, test_loss: 1.0818, test_f1: 0.3404
 epoch: 30, train_loss: 1.0868, test_loss: 1.0753, test_f1: 0.3418
 epoch: 31, train_loss: 1.0822, test_loss: 1.0759, test_f1: 0.3404
 epoch: 32, train_loss: 1.0810, test_loss: 1.0709, test_f1: 0.3406
 epoch: 33, train_loss: 1.0777, test_loss: 1.0693, test_f1: 0.3404
 epoch: 34, train_loss: 1.0716, test_loss: 1.0651, test_f1: 0.3418
 epoch: 35, train_loss: 1.0714, test_loss: 1.0672, test_f1: 0.3404
 epoch: 36, train_loss: 1.0656, test_loss: 1.0593, test_f1: 0.3404
 epoch: 37, train_loss: 1.0648, test_loss: 1.0604, test_f1: 0.3404
 epoch: 38, train_loss: 1.0659, test_loss: 1.0563, test_f1: 0.3408
 epoch: 39, train_loss: 1.0649, test_loss: 1.0565, test_f1: 0.3404
 epoch: 40, train_loss: 1.0570, test_loss: 1.0551, test_f1: 0.3408
 epoch: 41, train_loss: 1.0576, test_loss: 1.0510, test_f1: 0.3420
 epoch: 42, train_loss: 1.0579, test_loss: 1.0501, test_f1: 0.3411
 epoch: 43, train_loss: 1.0556, test_loss: 1.0466, test_f1: 0.3406
 epoch: 44, train_loss: 1.0521, test_loss: 1.0452, test_f1: 0.3411
 epoch: 45, train_loss: 1.0506, test_loss: 1.0397, test_f1: 0.3420
 epoch: 46, train_loss: 1.0465, test_loss: 1.0440, test_f1: 0.3406
 epoch: 47, train_loss: 1.0456, test_loss: 1.0345, test_f1: 0.3440
 epoch: 48, train_loss: 1.0409, test_loss: 1.0394, test_f1: 0.3403
 epoch: 49, train_loss: 1.0402, test_loss: 1.0385, test_f1: 0.3429
 epoch: 50, train_loss: 1.0416, test_loss: 1.0305, test_f1: 0.3516
 epoch: 51, train_loss: 1.0421, test_loss: 1.0365, test_f1: 0.3522
 epoch: 52, train_loss: 1.0412, test_loss: 1.0286, test_f1: 0.3558
 epoch: 53, train_loss: 1.0388, test_loss: 1.0297, test_f1: 0.3572
 epoch: 54, train_loss: 1.0355, test_loss: 1.0369, test_f1: 0.3555
 epoch: 55, train_loss: 1.0352, test_loss: 1.0325, test_f1: 0.3604
 epoch: 56, train_loss: 1.0340, test_loss: 1.0290, test_f1: 0.3625
 epoch: 57, train_loss: 1.0286, test_loss: 1.0259, test_f1: 0.3658
 epoch: 58, train_loss: 1.0333, test_loss: 1.0311, test_f1: 0.3647
 epoch: 59, train_loss: 1.0303, test_loss: 1.0266, test_f1: 0.3651
 epoch: 60, train_loss: 1.0335, test_loss: 1.0270, test_f1: 0.3647
 epoch: 61, train_loss: 1.0283, test_loss: 1.0252, test_f1: 0.3693
 epoch: 62, train_loss: 1.0322, test_loss: 1.0234, test_f1: 0.3693
 epoch: 63, train_loss: 1.0257, test_loss: 1.0235, test_f1: 0.3740
 epoch: 64, train_loss: 1.0296, test_loss: 1.0195, test_f1: 0.3740
 epoch: 65, train_loss: 1.0271, test_loss: 1.0197, test_f1: 0.3776
 epoch: 66, train_loss: 1.0275, test_loss: 1.0242, test_f1: 0.3774
 epoch: 67, train_loss: 1.0215, test_loss: 1.0198, test_f1: 0.3806
 epoch: 68, train_loss: 1.0263, test_loss: 1.0179, test_f1: 0.3808
 epoch: 69, train_loss: 1.0263, test_loss: 1.0163, test_f1: 0.3844
 epoch: 70, train_loss: 1.0269, test_loss: 1.0179, test_f1: 0.3835
 epoch: 71, train_loss: 1.0222, test_loss: 1.0194, test_f1: 0.3826
 epoch: 72, train_loss: 1.0246, test_loss: 1.0136, test_f1: 0.3849
 epoch: 73, train_loss: 1.0186, test_loss: 1.0137, test_f1: 0.3868
 epoch: 74, train_loss: 1.0217, test_loss: 1.0147, test_f1: 0.3866
 epoch: 75, train_loss: 1.0211, test_loss: 1.0140, test_f1: 0.3866
 epoch: 76, train_loss: 1.0208, test_loss: 1.0111, test_f1: 0.3870
 epoch: 77, train_loss: 1.0204, test_loss: 1.0129, test_f1: 0.3861
 epoch: 78, train_loss: 1.0168, test_loss: 1.0107, test_f1: 0.3863
 epoch: 79, train_loss: 1.0143, test_loss: 1.0071, test_f1: 0.3864
 epoch: 80, train_loss: 1.0141, test_loss: 1.0072, test_f1: 0.3906
 epoch: 81, train_loss: 1.0219, test_loss: 1.0061, test_f1: 0.3904
 epoch: 82, train_loss: 1.0139, test_loss: 1.0027, test_f1: 0.3946
 epoch: 83, train_loss: 1.0148, test_loss: 1.0054, test_f1: 0.3914
 epoch: 84, train_loss: 1.0161, test_loss: 1.0020, test_f1: 0.3926
 epoch: 85, train_loss: 1.0153, test_loss: 1.0056, test_f1: 0.3917
 epoch: 86, train_loss: 1.0128, test_loss: 1.0037, test_f1: 0.3909
 epoch: 87, train_loss: 1.0104, test_loss: 0.9979, test_f1: 0.3950
 epoch: 88, train_loss: 1.0122, test_loss: 0.9977, test_f1: 0.3952
 epoch: 89, train_loss: 1.0179, test_loss: 0.9975, test_f1: 0.3985
 epoch: 90, train_loss: 1.0078, test_loss: 0.9980, test_f1: 0.4032
 epoch: 91, train_loss: 1.0069, test_loss: 1.0000, test_f1: 0.3942
 epoch: 92, train_loss: 1.0108, test_loss: 0.9943, test_f1: 0.4054
 epoch: 93, train_loss: 1.0174, test_loss: 0.9961, test_f1: 0.4052
 epoch: 94, train_loss: 1.0165, test_loss: 0.9961, test_f1: 0.4060
 epoch: 95, train_loss: 1.0094, test_loss: 0.9946, test_f1: 0.4070
 epoch: 96, train_loss: 1.0134, test_loss: 0.9902, test_f1: 0.4140
 epoch: 97, train_loss: 1.0079, test_loss: 0.9921, test_f1: 0.4094
 epoch: 98, train_loss: 1.0070, test_loss: 0.9935, test_f1: 0.4088
 epoch: 99, train_loss: 1.0002, test_loss: 0.9894, test_f1: 0.4167
##################ITERATION #3 ****************************************
 epoch: 0, train_loss: 1.3016, test_loss: 1.3169, test_f1: 0.2270
 epoch: 1, train_loss: 1.2885, test_loss: 1.3133, test_f1: 0.2270
 epoch: 2, train_loss: 1.2761, test_loss: 1.3074, test_f1: 0.2270
 epoch: 3, train_loss: 1.2735, test_loss: 1.2951, test_f1: 0.2270
 epoch: 4, train_loss: 1.2579, test_loss: 1.2736, test_f1: 0.2270
 epoch: 5, train_loss: 1.2501, test_loss: 1.2480, test_f1: 0.2783
 epoch: 6, train_loss: 1.2384, test_loss: 1.2269, test_f1: 0.3102
 epoch: 7, train_loss: 1.2258, test_loss: 1.2115, test_f1: 0.3185
 epoch: 8, train_loss: 1.2184, test_loss: 1.1989, test_f1: 0.3239
 epoch: 9, train_loss: 1.2061, test_loss: 1.1883, test_f1: 0.3291
 epoch: 10, train_loss: 1.1976, test_loss: 1.1791, test_f1: 0.3295
 epoch: 11, train_loss: 1.1917, test_loss: 1.1703, test_f1: 0.3328
 epoch: 12, train_loss: 1.1838, test_loss: 1.1622, test_f1: 0.3373
 epoch: 13, train_loss: 1.1767, test_loss: 1.1548, test_f1: 0.3443
 epoch: 14, train_loss: 1.1669, test_loss: 1.1468, test_f1: 0.3431
 epoch: 15, train_loss: 1.1608, test_loss: 1.1398, test_f1: 0.3461
 epoch: 16, train_loss: 1.1519, test_loss: 1.1319, test_f1: 0.3337
 epoch: 17, train_loss: 1.1451, test_loss: 1.1258, test_f1: 0.3362
 epoch: 18, train_loss: 1.1365, test_loss: 1.1187, test_f1: 0.3394
 epoch: 19, train_loss: 1.1311, test_loss: 1.1136, test_f1: 0.3399
 epoch: 20, train_loss: 1.1238, test_loss: 1.1082, test_f1: 0.3419
 epoch: 21, train_loss: 1.1208, test_loss: 1.1034, test_f1: 0.3412
 epoch: 22, train_loss: 1.1085, test_loss: 1.0981, test_f1: 0.3416
 epoch: 23, train_loss: 1.1047, test_loss: 1.0935, test_f1: 0.3419
 epoch: 24, train_loss: 1.1020, test_loss: 1.0897, test_f1: 0.3426
 epoch: 25, train_loss: 1.0971, test_loss: 1.0847, test_f1: 0.3428
 epoch: 26, train_loss: 1.0950, test_loss: 1.0822, test_f1: 0.3416
 epoch: 27, train_loss: 1.0897, test_loss: 1.0793, test_f1: 0.3426
 epoch: 28, train_loss: 1.0878, test_loss: 1.0755, test_f1: 0.3428
 epoch: 29, train_loss: 1.0796, test_loss: 1.0720, test_f1: 0.3428
 epoch: 30, train_loss: 1.0768, test_loss: 1.0678, test_f1: 0.3428
 epoch: 31, train_loss: 1.0784, test_loss: 1.0645, test_f1: 0.3454
 epoch: 32, train_loss: 1.0664, test_loss: 1.0633, test_f1: 0.3451
 epoch: 33, train_loss: 1.0672, test_loss: 1.0596, test_f1: 0.3454
 epoch: 34, train_loss: 1.0602, test_loss: 1.0550, test_f1: 0.3463
 epoch: 35, train_loss: 1.0610, test_loss: 1.0557, test_f1: 0.3462
 epoch: 36, train_loss: 1.0551, test_loss: 1.0528, test_f1: 0.3470
 epoch: 37, train_loss: 1.0531, test_loss: 1.0499, test_f1: 0.3520
 epoch: 38, train_loss: 1.0552, test_loss: 1.0454, test_f1: 0.3549
 epoch: 39, train_loss: 1.0476, test_loss: 1.0423, test_f1: 0.3615
 epoch: 40, train_loss: 1.0437, test_loss: 1.0430, test_f1: 0.3686
 epoch: 41, train_loss: 1.0430, test_loss: 1.0397, test_f1: 0.3736
 epoch: 42, train_loss: 1.0409, test_loss: 1.0381, test_f1: 0.3758
 epoch: 43, train_loss: 1.0375, test_loss: 1.0356, test_f1: 0.3792
 epoch: 44, train_loss: 1.0365, test_loss: 1.0327, test_f1: 0.3845
 epoch: 45, train_loss: 1.0345, test_loss: 1.0306, test_f1: 0.3944
 epoch: 46, train_loss: 1.0311, test_loss: 1.0279, test_f1: 0.3944
 epoch: 47, train_loss: 1.0286, test_loss: 1.0258, test_f1: 0.3935
 epoch: 48, train_loss: 1.0275, test_loss: 1.0250, test_f1: 0.3943
 epoch: 49, train_loss: 1.0232, test_loss: 1.0229, test_f1: 0.3896
 epoch: 50, train_loss: 1.0308, test_loss: 1.0201, test_f1: 0.3896
 epoch: 51, train_loss: 1.0181, test_loss: 1.0173, test_f1: 0.3896
 epoch: 52, train_loss: 1.0208, test_loss: 1.0170, test_f1: 0.3916
 epoch: 53, train_loss: 1.0226, test_loss: 1.0144, test_f1: 0.3926
 epoch: 54, train_loss: 1.0213, test_loss: 1.0155, test_f1: 0.3919
 epoch: 55, train_loss: 1.0181, test_loss: 1.0142, test_f1: 0.3923
 epoch: 56, train_loss: 1.0183, test_loss: 1.0154, test_f1: 0.3954
 epoch: 57, train_loss: 1.0148, test_loss: 1.0122, test_f1: 0.3954
 epoch: 58, train_loss: 1.0143, test_loss: 1.0085, test_f1: 0.3968
 epoch: 59, train_loss: 1.0139, test_loss: 1.0100, test_f1: 0.3961
 epoch: 60, train_loss: 1.0163, test_loss: 1.0100, test_f1: 0.3941
 epoch: 61, train_loss: 1.0121, test_loss: 1.0072, test_f1: 0.3958
 epoch: 62, train_loss: 1.0080, test_loss: 1.0068, test_f1: 0.3944
 epoch: 63, train_loss: 1.0122, test_loss: 1.0035, test_f1: 0.3972
 epoch: 64, train_loss: 1.0153, test_loss: 1.0031, test_f1: 0.3983
 epoch: 65, train_loss: 1.0081, test_loss: 1.0026, test_f1: 0.3965
 epoch: 66, train_loss: 1.0067, test_loss: 1.0025, test_f1: 0.3983
 epoch: 67, train_loss: 1.0102, test_loss: 1.0026, test_f1: 0.4009
 epoch: 68, train_loss: 1.0082, test_loss: 0.9998, test_f1: 0.4038
 epoch: 69, train_loss: 1.0105, test_loss: 0.9977, test_f1: 0.4030
 epoch: 70, train_loss: 1.0074, test_loss: 0.9987, test_f1: 0.4019
 epoch: 71, train_loss: 1.0016, test_loss: 0.9965, test_f1: 0.4038
 epoch: 72, train_loss: 1.0034, test_loss: 0.9935, test_f1: 0.4040
 epoch: 73, train_loss: 1.0055, test_loss: 0.9928, test_f1: 0.4130
 epoch: 74, train_loss: 1.0048, test_loss: 0.9931, test_f1: 0.4120
 epoch: 75, train_loss: 0.9976, test_loss: 0.9916, test_f1: 0.4127
 epoch: 76, train_loss: 0.9997, test_loss: 0.9890, test_f1: 0.4130
 epoch: 77, train_loss: 0.9967, test_loss: 0.9888, test_f1: 0.4120
 epoch: 78, train_loss: 0.9995, test_loss: 0.9883, test_f1: 0.4154
 epoch: 79, train_loss: 0.9969, test_loss: 0.9856, test_f1: 0.4147
 epoch: 80, train_loss: 0.9985, test_loss: 0.9874, test_f1: 0.4161
 epoch: 81, train_loss: 0.9965, test_loss: 0.9826, test_f1: 0.4137
 epoch: 82, train_loss: 0.9992, test_loss: 0.9819, test_f1: 0.4198
 epoch: 83, train_loss: 0.9974, test_loss: 0.9789, test_f1: 0.4338
 epoch: 84, train_loss: 0.9934, test_loss: 0.9794, test_f1: 0.4330
 epoch: 85, train_loss: 0.9988, test_loss: 0.9783, test_f1: 0.4387
 epoch: 86, train_loss: 0.9898, test_loss: 0.9782, test_f1: 0.4434
 epoch: 87, train_loss: 0.9904, test_loss: 0.9766, test_f1: 0.4357
 epoch: 88, train_loss: 0.9904, test_loss: 0.9764, test_f1: 0.4412
 epoch: 89, train_loss: 0.9928, test_loss: 0.9751, test_f1: 0.4355
 epoch: 90, train_loss: 0.9913, test_loss: 0.9726, test_f1: 0.4444
 epoch: 91, train_loss: 0.9975, test_loss: 0.9708, test_f1: 0.4519
 epoch: 92, train_loss: 0.9840, test_loss: 0.9708, test_f1: 0.4517
 epoch: 93, train_loss: 0.9914, test_loss: 0.9739, test_f1: 0.4495
 epoch: 94, train_loss: 0.9896, test_loss: 0.9702, test_f1: 0.4496
 epoch: 95, train_loss: 0.9918, test_loss: 0.9699, test_f1: 0.4591
 epoch: 96, train_loss: 0.9870, test_loss: 0.9685, test_f1: 0.4592
 epoch: 97, train_loss: 0.9808, test_loss: 0.9665, test_f1: 0.4608
 epoch: 98, train_loss: 0.9804, test_loss: 0.9643, test_f1: 0.4613
 epoch: 99, train_loss: 0.9854, test_loss: 0.9608, test_f1: 0.4533
##################ITERATION #4 ****************************************
 epoch: 0, train_loss: 1.3088, test_loss: 1.3224, test_f1: 0.2270
 epoch: 1, train_loss: 1.2954, test_loss: 1.3225, test_f1: 0.2270
 epoch: 2, train_loss: 1.2841, test_loss: 1.3180, test_f1: 0.2270
 epoch: 3, train_loss: 1.2722, test_loss: 1.3067, test_f1: 0.2270
 epoch: 4, train_loss: 1.2634, test_loss: 1.2851, test_f1: 0.2270
 epoch: 5, train_loss: 1.2483, test_loss: 1.2558, test_f1: 0.2295
 epoch: 6, train_loss: 1.2325, test_loss: 1.2260, test_f1: 0.2611
 epoch: 7, train_loss: 1.2244, test_loss: 1.2030, test_f1: 0.2983
 epoch: 8, train_loss: 1.2063, test_loss: 1.1849, test_f1: 0.3308
 epoch: 9, train_loss: 1.1920, test_loss: 1.1692, test_f1: 0.3384
 epoch: 10, train_loss: 1.1795, test_loss: 1.1554, test_f1: 0.3403
 epoch: 11, train_loss: 1.1660, test_loss: 1.1428, test_f1: 0.3422
 epoch: 12, train_loss: 1.1552, test_loss: 1.1330, test_f1: 0.3422
 epoch: 13, train_loss: 1.1438, test_loss: 1.1241, test_f1: 0.3460
 epoch: 14, train_loss: 1.1337, test_loss: 1.1164, test_f1: 0.3450
 epoch: 15, train_loss: 1.1234, test_loss: 1.1106, test_f1: 0.3450
 epoch: 16, train_loss: 1.1163, test_loss: 1.1054, test_f1: 0.3450
 epoch: 17, train_loss: 1.1077, test_loss: 1.0996, test_f1: 0.3441
 epoch: 18, train_loss: 1.1028, test_loss: 1.0944, test_f1: 0.3441
 epoch: 19, train_loss: 1.0969, test_loss: 1.0921, test_f1: 0.3441
 epoch: 20, train_loss: 1.0933, test_loss: 1.0876, test_f1: 0.3441
 epoch: 21, train_loss: 1.0867, test_loss: 1.0853, test_f1: 0.3466
 epoch: 22, train_loss: 1.0817, test_loss: 1.0818, test_f1: 0.3456
 epoch: 23, train_loss: 1.0791, test_loss: 1.0790, test_f1: 0.3466
 epoch: 24, train_loss: 1.0765, test_loss: 1.0769, test_f1: 0.3466
 epoch: 25, train_loss: 1.0679, test_loss: 1.0720, test_f1: 0.3466
 epoch: 26, train_loss: 1.0669, test_loss: 1.0686, test_f1: 0.3491
 epoch: 27, train_loss: 1.0627, test_loss: 1.0678, test_f1: 0.3507
 epoch: 28, train_loss: 1.0597, test_loss: 1.0650, test_f1: 0.3542
 epoch: 29, train_loss: 1.0488, test_loss: 1.0657, test_f1: 0.3543
 epoch: 30, train_loss: 1.0527, test_loss: 1.0614, test_f1: 0.3586
 epoch: 31, train_loss: 1.0468, test_loss: 1.0582, test_f1: 0.3605
 epoch: 32, train_loss: 1.0460, test_loss: 1.0577, test_f1: 0.3590
 epoch: 33, train_loss: 1.0445, test_loss: 1.0556, test_f1: 0.3637
 epoch: 34, train_loss: 1.0414, test_loss: 1.0518, test_f1: 0.3695
 epoch: 35, train_loss: 1.0365, test_loss: 1.0492, test_f1: 0.3670
 epoch: 36, train_loss: 1.0382, test_loss: 1.0447, test_f1: 0.3757
 epoch: 37, train_loss: 1.0361, test_loss: 1.0438, test_f1: 0.3831
 epoch: 38, train_loss: 1.0288, test_loss: 1.0434, test_f1: 0.3936
 epoch: 39, train_loss: 1.0259, test_loss: 1.0413, test_f1: 0.3939
 epoch: 40, train_loss: 1.0266, test_loss: 1.0382, test_f1: 0.3987
 epoch: 41, train_loss: 1.0276, test_loss: 1.0379, test_f1: 0.4021
 epoch: 42, train_loss: 1.0225, test_loss: 1.0329, test_f1: 0.4045
 epoch: 43, train_loss: 1.0183, test_loss: 1.0310, test_f1: 0.4023
 epoch: 44, train_loss: 1.0173, test_loss: 1.0317, test_f1: 0.4052
 epoch: 45, train_loss: 1.0158, test_loss: 1.0281, test_f1: 0.4102
 epoch: 46, train_loss: 1.0152, test_loss: 1.0251, test_f1: 0.4101
 epoch: 47, train_loss: 1.0178, test_loss: 1.0279, test_f1: 0.4100
 epoch: 48, train_loss: 1.0082, test_loss: 1.0241, test_f1: 0.4140
 epoch: 49, train_loss: 1.0089, test_loss: 1.0226, test_f1: 0.4128
 epoch: 50, train_loss: 1.0048, test_loss: 1.0202, test_f1: 0.4208
 epoch: 51, train_loss: 0.9996, test_loss: 1.0197, test_f1: 0.4215
 epoch: 52, train_loss: 1.0045, test_loss: 1.0171, test_f1: 0.4255
 epoch: 53, train_loss: 1.0027, test_loss: 1.0179, test_f1: 0.4271
 epoch: 54, train_loss: 0.9996, test_loss: 1.0184, test_f1: 0.4240
 epoch: 55, train_loss: 1.0055, test_loss: 1.0185, test_f1: 0.4233
 epoch: 56, train_loss: 1.0015, test_loss: 1.0146, test_f1: 0.4286
 epoch: 57, train_loss: 1.0047, test_loss: 1.0140, test_f1: 0.4270
 epoch: 58, train_loss: 0.9970, test_loss: 1.0143, test_f1: 0.4286
 epoch: 59, train_loss: 1.0015, test_loss: 1.0127, test_f1: 0.4311
 epoch: 60, train_loss: 0.9981, test_loss: 1.0122, test_f1: 0.4335
 epoch: 61, train_loss: 0.9971, test_loss: 1.0146, test_f1: 0.4319
 epoch: 62, train_loss: 0.9936, test_loss: 1.0132, test_f1: 0.4309
 epoch: 63, train_loss: 0.9898, test_loss: 1.0121, test_f1: 0.4323
 epoch: 64, train_loss: 0.9948, test_loss: 1.0103, test_f1: 0.4425
 epoch: 65, train_loss: 0.9918, test_loss: 1.0105, test_f1: 0.4410
 epoch: 66, train_loss: 0.9897, test_loss: 1.0091, test_f1: 0.4394
 epoch: 67, train_loss: 0.9956, test_loss: 1.0078, test_f1: 0.4469
 epoch: 68, train_loss: 0.9914, test_loss: 1.0083, test_f1: 0.4428
 epoch: 69, train_loss: 0.9879, test_loss: 1.0074, test_f1: 0.4428
 epoch: 70, train_loss: 0.9896, test_loss: 1.0051, test_f1: 0.4439
 epoch: 71, train_loss: 0.9910, test_loss: 1.0045, test_f1: 0.4425
 epoch: 72, train_loss: 0.9812, test_loss: 1.0055, test_f1: 0.4479
 epoch: 73, train_loss: 0.9959, test_loss: 1.0047, test_f1: 0.4436
 epoch: 74, train_loss: 0.9801, test_loss: 1.0021, test_f1: 0.4448
 epoch: 75, train_loss: 0.9825, test_loss: 1.0044, test_f1: 0.4471
 epoch: 76, train_loss: 0.9885, test_loss: 1.0007, test_f1: 0.4463
 epoch: 77, train_loss: 0.9824, test_loss: 1.0033, test_f1: 0.4476
 epoch: 78, train_loss: 0.9837, test_loss: 1.0038, test_f1: 0.4483
 epoch: 79, train_loss: 0.9857, test_loss: 1.0017, test_f1: 0.4452
 epoch: 80, train_loss: 0.9826, test_loss: 0.9988, test_f1: 0.4452
 epoch: 81, train_loss: 0.9791, test_loss: 0.9954, test_f1: 0.4522
 epoch: 82, train_loss: 0.9767, test_loss: 0.9963, test_f1: 0.4497
 epoch: 83, train_loss: 0.9844, test_loss: 0.9960, test_f1: 0.4529
 epoch: 84, train_loss: 0.9784, test_loss: 0.9957, test_f1: 0.4515
 epoch: 85, train_loss: 0.9829, test_loss: 0.9967, test_f1: 0.4545
 epoch: 86, train_loss: 0.9818, test_loss: 1.0005, test_f1: 0.4592
 epoch: 87, train_loss: 0.9780, test_loss: 0.9986, test_f1: 0.4573
 epoch: 88, train_loss: 0.9814, test_loss: 0.9965, test_f1: 0.4562
 epoch: 89, train_loss: 0.9768, test_loss: 0.9925, test_f1: 0.4578
 epoch: 90, train_loss: 0.9738, test_loss: 0.9924, test_f1: 0.4558
 epoch: 91, train_loss: 0.9829, test_loss: 0.9920, test_f1: 0.4565
 epoch: 92, train_loss: 0.9708, test_loss: 0.9935, test_f1: 0.4593
 epoch: 93, train_loss: 0.9677, test_loss: 0.9927, test_f1: 0.4554
 epoch: 94, train_loss: 0.9710, test_loss: 0.9903, test_f1: 0.4583
 epoch: 95, train_loss: 0.9736, test_loss: 0.9920, test_f1: 0.4575
 epoch: 96, train_loss: 0.9727, test_loss: 0.9906, test_f1: 0.4620
 epoch: 97, train_loss: 0.9703, test_loss: 0.9893, test_f1: 0.4610
 epoch: 98, train_loss: 0.9740, test_loss: 0.9928, test_f1: 0.4600
 epoch: 99, train_loss: 0.9726, test_loss: 0.9869, test_f1: 0.4578
##################ITERATION #5 ****************************************
 epoch: 0, train_loss: 1.3099, test_loss: 1.3130, test_f1: 0.2270
 epoch: 1, train_loss: 1.2873, test_loss: 1.3109, test_f1: 0.2270
 epoch: 2, train_loss: 1.2707, test_loss: 1.3015, test_f1: 0.2270
 epoch: 3, train_loss: 1.2567, test_loss: 1.2746, test_f1: 0.2270
 epoch: 4, train_loss: 1.2432, test_loss: 1.2348, test_f1: 0.2270
 epoch: 5, train_loss: 1.2328, test_loss: 1.2086, test_f1: 0.2270
 epoch: 6, train_loss: 1.2159, test_loss: 1.1905, test_f1: 0.2320
 epoch: 7, train_loss: 1.1990, test_loss: 1.1735, test_f1: 0.2981
 epoch: 8, train_loss: 1.1871, test_loss: 1.1586, test_f1: 0.3150
 epoch: 9, train_loss: 1.1711, test_loss: 1.1446, test_f1: 0.3324
 epoch: 10, train_loss: 1.1668, test_loss: 1.1309, test_f1: 0.3470
 epoch: 11, train_loss: 1.1494, test_loss: 1.1201, test_f1: 0.3499
 epoch: 12, train_loss: 1.1435, test_loss: 1.1102, test_f1: 0.3537
 epoch: 13, train_loss: 1.1374, test_loss: 1.1024, test_f1: 0.3537
 epoch: 14, train_loss: 1.1257, test_loss: 1.0958, test_f1: 0.3539
 epoch: 15, train_loss: 1.1174, test_loss: 1.0901, test_f1: 0.3539
 epoch: 16, train_loss: 1.1123, test_loss: 1.0838, test_f1: 0.3539
 epoch: 17, train_loss: 1.1023, test_loss: 1.0798, test_f1: 0.3589
 epoch: 18, train_loss: 1.1013, test_loss: 1.0750, test_f1: 0.3638
 epoch: 19, train_loss: 1.0918, test_loss: 1.0728, test_f1: 0.3628
 epoch: 20, train_loss: 1.0912, test_loss: 1.0697, test_f1: 0.3652
 epoch: 21, train_loss: 1.0792, test_loss: 1.0672, test_f1: 0.3652
 epoch: 22, train_loss: 1.0816, test_loss: 1.0663, test_f1: 0.3741
 epoch: 23, train_loss: 1.0787, test_loss: 1.0624, test_f1: 0.3745
 epoch: 24, train_loss: 1.0750, test_loss: 1.0603, test_f1: 0.3728
 epoch: 25, train_loss: 1.0739, test_loss: 1.0576, test_f1: 0.3738
 epoch: 26, train_loss: 1.0706, test_loss: 1.0562, test_f1: 0.3718
 epoch: 27, train_loss: 1.0703, test_loss: 1.0553, test_f1: 0.3705
 epoch: 28, train_loss: 1.0666, test_loss: 1.0534, test_f1: 0.3718
 epoch: 29, train_loss: 1.0604, test_loss: 1.0522, test_f1: 0.3702
 epoch: 30, train_loss: 1.0596, test_loss: 1.0511, test_f1: 0.3719
 epoch: 31, train_loss: 1.0581, test_loss: 1.0485, test_f1: 0.3696
 epoch: 32, train_loss: 1.0527, test_loss: 1.0464, test_f1: 0.3719
 epoch: 33, train_loss: 1.0493, test_loss: 1.0439, test_f1: 0.3728
 epoch: 34, train_loss: 1.0518, test_loss: 1.0436, test_f1: 0.3722
 epoch: 35, train_loss: 1.0490, test_loss: 1.0417, test_f1: 0.3722
 epoch: 36, train_loss: 1.0468, test_loss: 1.0422, test_f1: 0.3716
 epoch: 37, train_loss: 1.0466, test_loss: 1.0410, test_f1: 0.3738
 epoch: 38, train_loss: 1.0440, test_loss: 1.0382, test_f1: 0.3733
 epoch: 39, train_loss: 1.0388, test_loss: 1.0355, test_f1: 0.3742
 epoch: 40, train_loss: 1.0425, test_loss: 1.0321, test_f1: 0.3755
 epoch: 41, train_loss: 1.0430, test_loss: 1.0335, test_f1: 0.3755
 epoch: 42, train_loss: 1.0393, test_loss: 1.0321, test_f1: 0.3732
 epoch: 43, train_loss: 1.0345, test_loss: 1.0306, test_f1: 0.3752
 epoch: 44, train_loss: 1.0352, test_loss: 1.0305, test_f1: 0.3806
 epoch: 45, train_loss: 1.0291, test_loss: 1.0298, test_f1: 0.3828
 epoch: 46, train_loss: 1.0289, test_loss: 1.0285, test_f1: 0.3901
 epoch: 47, train_loss: 1.0325, test_loss: 1.0306, test_f1: 0.3901
 epoch: 48, train_loss: 1.0323, test_loss: 1.0283, test_f1: 0.3972
 epoch: 49, train_loss: 1.0241, test_loss: 1.0260, test_f1: 0.3955
 epoch: 50, train_loss: 1.0240, test_loss: 1.0245, test_f1: 0.4041
 epoch: 51, train_loss: 1.0276, test_loss: 1.0259, test_f1: 0.4061
 epoch: 52, train_loss: 1.0213, test_loss: 1.0267, test_f1: 0.4073
 epoch: 53, train_loss: 1.0251, test_loss: 1.0276, test_f1: 0.4061
 epoch: 54, train_loss: 1.0241, test_loss: 1.0247, test_f1: 0.4066
 epoch: 55, train_loss: 1.0226, test_loss: 1.0258, test_f1: 0.4050
 epoch: 56, train_loss: 1.0243, test_loss: 1.0210, test_f1: 0.4068
 epoch: 57, train_loss: 1.0228, test_loss: 1.0213, test_f1: 0.4068
 epoch: 58, train_loss: 1.0176, test_loss: 1.0222, test_f1: 0.4058
 epoch: 59, train_loss: 1.0211, test_loss: 1.0221, test_f1: 0.4051
 epoch: 60, train_loss: 1.0205, test_loss: 1.0181, test_f1: 0.4056
 epoch: 61, train_loss: 1.0206, test_loss: 1.0176, test_f1: 0.4071
 epoch: 62, train_loss: 1.0172, test_loss: 1.0203, test_f1: 0.4038
 epoch: 63, train_loss: 1.0214, test_loss: 1.0181, test_f1: 0.4056
 epoch: 64, train_loss: 1.0184, test_loss: 1.0177, test_f1: 0.4088
 epoch: 65, train_loss: 1.0183, test_loss: 1.0182, test_f1: 0.4126
 epoch: 66, train_loss: 1.0122, test_loss: 1.0178, test_f1: 0.4136
 epoch: 67, train_loss: 1.0127, test_loss: 1.0160, test_f1: 0.4165
 epoch: 68, train_loss: 1.0136, test_loss: 1.0152, test_f1: 0.4118
 epoch: 69, train_loss: 1.0195, test_loss: 1.0147, test_f1: 0.4166
 epoch: 70, train_loss: 1.0113, test_loss: 1.0137, test_f1: 0.4232
 epoch: 71, train_loss: 1.0200, test_loss: 1.0127, test_f1: 0.4157
 epoch: 72, train_loss: 1.0129, test_loss: 1.0130, test_f1: 0.4078
 epoch: 73, train_loss: 1.0096, test_loss: 1.0135, test_f1: 0.4137
 epoch: 74, train_loss: 1.0043, test_loss: 1.0115, test_f1: 0.4252
 epoch: 75, train_loss: 1.0116, test_loss: 1.0099, test_f1: 0.4242
 epoch: 76, train_loss: 1.0134, test_loss: 1.0114, test_f1: 0.4137
 epoch: 77, train_loss: 1.0159, test_loss: 1.0108, test_f1: 0.4157
 epoch: 78, train_loss: 1.0092, test_loss: 1.0109, test_f1: 0.4222
 epoch: 79, train_loss: 1.0084, test_loss: 1.0095, test_f1: 0.4224
 epoch: 80, train_loss: 1.0065, test_loss: 1.0092, test_f1: 0.4250
 epoch: 81, train_loss: 1.0066, test_loss: 1.0107, test_f1: 0.4194
 epoch: 82, train_loss: 1.0054, test_loss: 1.0103, test_f1: 0.4258
 epoch: 83, train_loss: 1.0047, test_loss: 1.0087, test_f1: 0.4330
 epoch: 84, train_loss: 1.0024, test_loss: 1.0066, test_f1: 0.4323
 epoch: 85, train_loss: 1.0057, test_loss: 1.0070, test_f1: 0.4341
 epoch: 86, train_loss: 1.0053, test_loss: 1.0047, test_f1: 0.4340
 epoch: 87, train_loss: 1.0044, test_loss: 1.0071, test_f1: 0.4320
 epoch: 88, train_loss: 1.0112, test_loss: 1.0055, test_f1: 0.4338
 epoch: 89, train_loss: 1.0015, test_loss: 1.0054, test_f1: 0.4358
 epoch: 90, train_loss: 1.0009, test_loss: 1.0053, test_f1: 0.4337
 epoch: 91, train_loss: 1.0047, test_loss: 1.0034, test_f1: 0.4391
 epoch: 92, train_loss: 0.9983, test_loss: 1.0034, test_f1: 0.4391
 epoch: 93, train_loss: 1.0062, test_loss: 1.0043, test_f1: 0.4371
 epoch: 94, train_loss: 1.0043, test_loss: 1.0023, test_f1: 0.4391
 epoch: 95, train_loss: 1.0007, test_loss: 1.0008, test_f1: 0.4391
 epoch: 96, train_loss: 0.9972, test_loss: 1.0021, test_f1: 0.4354
 epoch: 97, train_loss: 0.9946, test_loss: 1.0016, test_f1: 0.4432
 epoch: 98, train_loss: 1.0014, test_loss: 1.0012, test_f1: 0.4366
 epoch: 99, train_loss: 0.9965, test_loss: 0.9984, test_f1: 0.4398
##################ITERATION #6 ****************************************
 epoch: 0, train_loss: 1.3456, test_loss: 1.3421, test_f1: 0.2270
 epoch: 1, train_loss: 1.3195, test_loss: 1.3403, test_f1: 0.2270
 epoch: 2, train_loss: 1.3085, test_loss: 1.3363, test_f1: 0.2270
 epoch: 3, train_loss: 1.2942, test_loss: 1.3216, test_f1: 0.2270
 epoch: 4, train_loss: 1.2746, test_loss: 1.2851, test_f1: 0.2270
 epoch: 5, train_loss: 1.2584, test_loss: 1.2534, test_f1: 0.2270
 epoch: 6, train_loss: 1.2511, test_loss: 1.2291, test_f1: 0.2270
 epoch: 7, train_loss: 1.2260, test_loss: 1.2064, test_f1: 0.2416
 epoch: 8, train_loss: 1.2114, test_loss: 1.1885, test_f1: 0.2819
 epoch: 9, train_loss: 1.2006, test_loss: 1.1707, test_f1: 0.2999
 epoch: 10, train_loss: 1.1892, test_loss: 1.1550, test_f1: 0.3144
 epoch: 11, train_loss: 1.1763, test_loss: 1.1397, test_f1: 0.3237
 epoch: 12, train_loss: 1.1639, test_loss: 1.1269, test_f1: 0.3367
 epoch: 13, train_loss: 1.1528, test_loss: 1.1144, test_f1: 0.3467
 epoch: 14, train_loss: 1.1461, test_loss: 1.1041, test_f1: 0.3453
 epoch: 15, train_loss: 1.1403, test_loss: 1.0952, test_f1: 0.3393
 epoch: 16, train_loss: 1.1324, test_loss: 1.0874, test_f1: 0.3403
 epoch: 17, train_loss: 1.1263, test_loss: 1.0807, test_f1: 0.3422
 epoch: 18, train_loss: 1.1103, test_loss: 1.0747, test_f1: 0.3422
 epoch: 19, train_loss: 1.1080, test_loss: 1.0689, test_f1: 0.3441
 epoch: 20, train_loss: 1.1000, test_loss: 1.0630, test_f1: 0.3466
 epoch: 21, train_loss: 1.0985, test_loss: 1.0575, test_f1: 0.3492
 epoch: 22, train_loss: 1.0880, test_loss: 1.0553, test_f1: 0.3517
 epoch: 23, train_loss: 1.0896, test_loss: 1.0524, test_f1: 0.3592
 epoch: 24, train_loss: 1.0807, test_loss: 1.0491, test_f1: 0.3592
 epoch: 25, train_loss: 1.0746, test_loss: 1.0445, test_f1: 0.3617
 epoch: 26, train_loss: 1.0737, test_loss: 1.0423, test_f1: 0.3636
 epoch: 27, train_loss: 1.0684, test_loss: 1.0397, test_f1: 0.3631
 epoch: 28, train_loss: 1.0657, test_loss: 1.0356, test_f1: 0.3631
 epoch: 29, train_loss: 1.0567, test_loss: 1.0334, test_f1: 0.3678
 epoch: 30, train_loss: 1.0557, test_loss: 1.0311, test_f1: 0.3727
 epoch: 31, train_loss: 1.0518, test_loss: 1.0285, test_f1: 0.3781
 epoch: 32, train_loss: 1.0471, test_loss: 1.0281, test_f1: 0.3867
 epoch: 33, train_loss: 1.0462, test_loss: 1.0229, test_f1: 0.3893
 epoch: 34, train_loss: 1.0450, test_loss: 1.0230, test_f1: 0.3943
 epoch: 35, train_loss: 1.0368, test_loss: 1.0210, test_f1: 0.3996
 epoch: 36, train_loss: 1.0378, test_loss: 1.0175, test_f1: 0.4059
 epoch: 37, train_loss: 1.0349, test_loss: 1.0148, test_f1: 0.4071
 epoch: 38, train_loss: 1.0333, test_loss: 1.0170, test_f1: 0.4119
 epoch: 39, train_loss: 1.0286, test_loss: 1.0220, test_f1: 0.4102
 epoch: 40, train_loss: 1.0221, test_loss: 1.0177, test_f1: 0.4173
 epoch: 41, train_loss: 1.0232, test_loss: 1.0121, test_f1: 0.4229
 epoch: 42, train_loss: 1.0250, test_loss: 1.0101, test_f1: 0.4296
 epoch: 43, train_loss: 1.0234, test_loss: 1.0110, test_f1: 0.4219
 epoch: 44, train_loss: 1.0234, test_loss: 1.0048, test_f1: 0.4304
 epoch: 45, train_loss: 1.0145, test_loss: 1.0034, test_f1: 0.4309
 epoch: 46, train_loss: 1.0161, test_loss: 1.0023, test_f1: 0.4309
 epoch: 47, train_loss: 1.0101, test_loss: 1.0009, test_f1: 0.4335
 epoch: 48, train_loss: 1.0157, test_loss: 0.9988, test_f1: 0.4377
 epoch: 49, train_loss: 1.0071, test_loss: 0.9991, test_f1: 0.4350
 epoch: 50, train_loss: 1.0068, test_loss: 0.9945, test_f1: 0.4431
 epoch: 51, train_loss: 1.0024, test_loss: 0.9939, test_f1: 0.4405
 epoch: 52, train_loss: 0.9995, test_loss: 0.9948, test_f1: 0.4349
 epoch: 53, train_loss: 1.0026, test_loss: 0.9925, test_f1: 0.4431
 epoch: 54, train_loss: 1.0040, test_loss: 0.9929, test_f1: 0.4422
 epoch: 55, train_loss: 0.9958, test_loss: 0.9927, test_f1: 0.4452
 epoch: 56, train_loss: 0.9937, test_loss: 0.9876, test_f1: 0.4597
 epoch: 57, train_loss: 1.0016, test_loss: 0.9894, test_f1: 0.4569
 epoch: 58, train_loss: 0.9959, test_loss: 0.9913, test_f1: 0.4543
 epoch: 59, train_loss: 0.9861, test_loss: 0.9901, test_f1: 0.4642
 epoch: 60, train_loss: 0.9911, test_loss: 0.9861, test_f1: 0.4666
 epoch: 61, train_loss: 0.9942, test_loss: 0.9881, test_f1: 0.4633
 epoch: 62, train_loss: 0.9935, test_loss: 0.9864, test_f1: 0.4675
 epoch: 63, train_loss: 0.9902, test_loss: 0.9869, test_f1: 0.4665
 epoch: 64, train_loss: 0.9931, test_loss: 0.9839, test_f1: 0.4722
 epoch: 65, train_loss: 0.9840, test_loss: 0.9856, test_f1: 0.4723
 epoch: 66, train_loss: 0.9876, test_loss: 0.9844, test_f1: 0.4652
 epoch: 67, train_loss: 0.9824, test_loss: 0.9822, test_f1: 0.4655
 epoch: 68, train_loss: 0.9795, test_loss: 0.9833, test_f1: 0.4736
 epoch: 69, train_loss: 0.9837, test_loss: 0.9816, test_f1: 0.4655
 epoch: 70, train_loss: 0.9785, test_loss: 0.9790, test_f1: 0.4742
 epoch: 71, train_loss: 0.9778, test_loss: 0.9801, test_f1: 0.4743
 epoch: 72, train_loss: 0.9844, test_loss: 0.9770, test_f1: 0.4785
 epoch: 73, train_loss: 0.9772, test_loss: 0.9767, test_f1: 0.4779
 epoch: 74, train_loss: 0.9748, test_loss: 0.9729, test_f1: 0.4781
 epoch: 75, train_loss: 0.9750, test_loss: 0.9713, test_f1: 0.4754
 epoch: 76, train_loss: 0.9733, test_loss: 0.9723, test_f1: 0.4752
 epoch: 77, train_loss: 0.9758, test_loss: 0.9720, test_f1: 0.4779
 epoch: 78, train_loss: 0.9738, test_loss: 0.9703, test_f1: 0.4767
 epoch: 79, train_loss: 0.9667, test_loss: 0.9693, test_f1: 0.4800
 epoch: 80, train_loss: 0.9649, test_loss: 0.9675, test_f1: 0.4802
 epoch: 81, train_loss: 0.9699, test_loss: 0.9668, test_f1: 0.4778
 epoch: 82, train_loss: 0.9741, test_loss: 0.9636, test_f1: 0.4815
 epoch: 83, train_loss: 0.9672, test_loss: 0.9647, test_f1: 0.4828
 epoch: 84, train_loss: 0.9668, test_loss: 0.9634, test_f1: 0.4862
 epoch: 85, train_loss: 0.9622, test_loss: 0.9627, test_f1: 0.4833
 epoch: 86, train_loss: 0.9663, test_loss: 0.9649, test_f1: 0.4804
 epoch: 87, train_loss: 0.9624, test_loss: 0.9614, test_f1: 0.4818
 epoch: 88, train_loss: 0.9645, test_loss: 0.9596, test_f1: 0.4818
 epoch: 89, train_loss: 0.9613, test_loss: 0.9571, test_f1: 0.4828
 epoch: 90, train_loss: 0.9624, test_loss: 0.9591, test_f1: 0.4795
 epoch: 91, train_loss: 0.9626, test_loss: 0.9586, test_f1: 0.4830
 epoch: 92, train_loss: 0.9662, test_loss: 0.9562, test_f1: 0.4838
 epoch: 93, train_loss: 0.9560, test_loss: 0.9587, test_f1: 0.4789
 epoch: 94, train_loss: 0.9563, test_loss: 0.9549, test_f1: 0.4826
 epoch: 95, train_loss: 0.9612, test_loss: 0.9559, test_f1: 0.4787
 epoch: 96, train_loss: 0.9620, test_loss: 0.9551, test_f1: 0.4795
 epoch: 97, train_loss: 0.9564, test_loss: 0.9554, test_f1: 0.4855
 epoch: 98, train_loss: 0.9529, test_loss: 0.9590, test_f1: 0.4832
 epoch: 99, train_loss: 0.9568, test_loss: 0.9489, test_f1: 0.4884
##################ITERATION #7 ****************************************
 epoch: 0, train_loss: 1.2801, test_loss: 1.3277, test_f1: 0.2270
 epoch: 1, train_loss: 1.2518, test_loss: 1.3268, test_f1: 0.2270
 epoch: 2, train_loss: 1.2317, test_loss: 1.3066, test_f1: 0.2270
 epoch: 3, train_loss: 1.2191, test_loss: 1.2513, test_f1: 0.2320
 epoch: 4, train_loss: 1.2061, test_loss: 1.2067, test_f1: 0.2708
 epoch: 5, train_loss: 1.1849, test_loss: 1.1776, test_f1: 0.3067
 epoch: 6, train_loss: 1.1785, test_loss: 1.1578, test_f1: 0.3293
 epoch: 7, train_loss: 1.1647, test_loss: 1.1443, test_f1: 0.3354
 epoch: 8, train_loss: 1.1588, test_loss: 1.1332, test_f1: 0.3403
 epoch: 9, train_loss: 1.1417, test_loss: 1.1238, test_f1: 0.3432
 epoch: 10, train_loss: 1.1349, test_loss: 1.1151, test_f1: 0.3441
 epoch: 11, train_loss: 1.1294, test_loss: 1.1077, test_f1: 0.3451
 epoch: 12, train_loss: 1.1109, test_loss: 1.1011, test_f1: 0.3460
 epoch: 13, train_loss: 1.1018, test_loss: 1.0960, test_f1: 0.3445
 epoch: 14, train_loss: 1.1013, test_loss: 1.0906, test_f1: 0.3459
 epoch: 15, train_loss: 1.0937, test_loss: 1.0860, test_f1: 0.3480
 epoch: 16, train_loss: 1.0888, test_loss: 1.0840, test_f1: 0.3472
 epoch: 17, train_loss: 1.0862, test_loss: 1.0810, test_f1: 0.3472
 epoch: 18, train_loss: 1.0740, test_loss: 1.0781, test_f1: 0.3506
 epoch: 19, train_loss: 1.0706, test_loss: 1.0765, test_f1: 0.3723
 epoch: 20, train_loss: 1.0733, test_loss: 1.0748, test_f1: 0.3718
 epoch: 21, train_loss: 1.0666, test_loss: 1.0747, test_f1: 0.3699
 epoch: 22, train_loss: 1.0646, test_loss: 1.0716, test_f1: 0.3702
 epoch: 23, train_loss: 1.0602, test_loss: 1.0702, test_f1: 0.3760
 epoch: 24, train_loss: 1.0534, test_loss: 1.0681, test_f1: 0.3760
 epoch: 25, train_loss: 1.0541, test_loss: 1.0677, test_f1: 0.3804
 epoch: 26, train_loss: 1.0519, test_loss: 1.0680, test_f1: 0.3857
 epoch: 27, train_loss: 1.0460, test_loss: 1.0672, test_f1: 0.3876
 epoch: 28, train_loss: 1.0441, test_loss: 1.0637, test_f1: 0.3960
 epoch: 29, train_loss: 1.0415, test_loss: 1.0646, test_f1: 0.4038
 epoch: 30, train_loss: 1.0402, test_loss: 1.0632, test_f1: 0.4130
 epoch: 31, train_loss: 1.0389, test_loss: 1.0622, test_f1: 0.4152
 epoch: 32, train_loss: 1.0351, test_loss: 1.0598, test_f1: 0.4181
 epoch: 33, train_loss: 1.0283, test_loss: 1.0571, test_f1: 0.4191
 epoch: 34, train_loss: 1.0241, test_loss: 1.0551, test_f1: 0.4193
 epoch: 35, train_loss: 1.0301, test_loss: 1.0504, test_f1: 0.4193
 epoch: 36, train_loss: 1.0237, test_loss: 1.0521, test_f1: 0.4215
 epoch: 37, train_loss: 1.0260, test_loss: 1.0520, test_f1: 0.4184
 epoch: 38, train_loss: 1.0201, test_loss: 1.0472, test_f1: 0.4280
 epoch: 39, train_loss: 1.0187, test_loss: 1.0466, test_f1: 0.4288
 epoch: 40, train_loss: 1.0150, test_loss: 1.0434, test_f1: 0.4280
 epoch: 41, train_loss: 1.0135, test_loss: 1.0418, test_f1: 0.4418
 epoch: 42, train_loss: 1.0058, test_loss: 1.0402, test_f1: 0.4408
 epoch: 43, train_loss: 1.0141, test_loss: 1.0360, test_f1: 0.4420
 epoch: 44, train_loss: 1.0082, test_loss: 1.0321, test_f1: 0.4456
 epoch: 45, train_loss: 1.0081, test_loss: 1.0301, test_f1: 0.4457
 epoch: 46, train_loss: 1.0015, test_loss: 1.0287, test_f1: 0.4476
 epoch: 47, train_loss: 1.0013, test_loss: 1.0240, test_f1: 0.4493
 epoch: 48, train_loss: 1.0008, test_loss: 1.0264, test_f1: 0.4528
 epoch: 49, train_loss: 1.0062, test_loss: 1.0220, test_f1: 0.4565
 epoch: 50, train_loss: 0.9933, test_loss: 1.0257, test_f1: 0.4511
 epoch: 51, train_loss: 0.9966, test_loss: 1.0229, test_f1: 0.4529
 epoch: 52, train_loss: 0.9945, test_loss: 1.0201, test_f1: 0.4543
 epoch: 53, train_loss: 0.9930, test_loss: 1.0183, test_f1: 0.4529
 epoch: 54, train_loss: 0.9913, test_loss: 1.0153, test_f1: 0.4550
 epoch: 55, train_loss: 0.9883, test_loss: 1.0171, test_f1: 0.4528
 epoch: 56, train_loss: 0.9838, test_loss: 1.0146, test_f1: 0.4543
 epoch: 57, train_loss: 0.9880, test_loss: 1.0125, test_f1: 0.4548
 epoch: 58, train_loss: 0.9898, test_loss: 1.0125, test_f1: 0.4540
 epoch: 59, train_loss: 0.9857, test_loss: 1.0094, test_f1: 0.4564
 epoch: 60, train_loss: 0.9877, test_loss: 1.0084, test_f1: 0.4545
 epoch: 61, train_loss: 0.9815, test_loss: 1.0077, test_f1: 0.4550
 epoch: 62, train_loss: 0.9822, test_loss: 1.0056, test_f1: 0.4563
 epoch: 63, train_loss: 0.9810, test_loss: 1.0070, test_f1: 0.4586
 epoch: 64, train_loss: 0.9802, test_loss: 1.0056, test_f1: 0.4587
 epoch: 65, train_loss: 0.9816, test_loss: 1.0035, test_f1: 0.4573
 epoch: 66, train_loss: 0.9838, test_loss: 1.0010, test_f1: 0.4583
 epoch: 67, train_loss: 0.9749, test_loss: 1.0008, test_f1: 0.4578
 epoch: 68, train_loss: 0.9781, test_loss: 1.0039, test_f1: 0.4581
 epoch: 69, train_loss: 0.9777, test_loss: 1.0011, test_f1: 0.4599
 epoch: 70, train_loss: 0.9735, test_loss: 0.9984, test_f1: 0.4583
 epoch: 71, train_loss: 0.9729, test_loss: 1.0009, test_f1: 0.4610
 epoch: 72, train_loss: 0.9778, test_loss: 1.0013, test_f1: 0.4650
 epoch: 73, train_loss: 0.9738, test_loss: 0.9978, test_f1: 0.4619
 epoch: 74, train_loss: 0.9745, test_loss: 0.9966, test_f1: 0.4638
 epoch: 75, train_loss: 0.9720, test_loss: 0.9964, test_f1: 0.4643
 epoch: 76, train_loss: 0.9713, test_loss: 0.9959, test_f1: 0.4666
 epoch: 77, train_loss: 0.9735, test_loss: 0.9968, test_f1: 0.4631
 epoch: 78, train_loss: 0.9741, test_loss: 0.9912, test_f1: 0.4643
 epoch: 79, train_loss: 0.9739, test_loss: 0.9967, test_f1: 0.4646
 epoch: 80, train_loss: 0.9720, test_loss: 0.9927, test_f1: 0.4661
 epoch: 81, train_loss: 0.9660, test_loss: 0.9888, test_f1: 0.4716
 epoch: 82, train_loss: 0.9689, test_loss: 0.9928, test_f1: 0.4699
 epoch: 83, train_loss: 0.9654, test_loss: 0.9891, test_f1: 0.4676
 epoch: 84, train_loss: 0.9707, test_loss: 0.9923, test_f1: 0.4720
 epoch: 85, train_loss: 0.9645, test_loss: 0.9898, test_f1: 0.4726
 epoch: 86, train_loss: 0.9653, test_loss: 0.9901, test_f1: 0.4710
 epoch: 87, train_loss: 0.9650, test_loss: 0.9887, test_f1: 0.4707
 epoch: 88, train_loss: 0.9686, test_loss: 0.9904, test_f1: 0.4725
 epoch: 89, train_loss: 0.9616, test_loss: 0.9867, test_f1: 0.4694
 epoch: 90, train_loss: 0.9595, test_loss: 0.9889, test_f1: 0.4664
 epoch: 91, train_loss: 0.9624, test_loss: 0.9873, test_f1: 0.4684
 epoch: 92, train_loss: 0.9582, test_loss: 0.9831, test_f1: 0.4720
 epoch: 93, train_loss: 0.9568, test_loss: 0.9841, test_f1: 0.4739
 epoch: 94, train_loss: 0.9645, test_loss: 0.9831, test_f1: 0.4771
 epoch: 95, train_loss: 0.9666, test_loss: 0.9853, test_f1: 0.4739
 epoch: 96, train_loss: 0.9582, test_loss: 0.9848, test_f1: 0.4739
 epoch: 97, train_loss: 0.9623, test_loss: 0.9839, test_f1: 0.4790
 epoch: 98, train_loss: 0.9507, test_loss: 0.9866, test_f1: 0.4792
 epoch: 99, train_loss: 0.9557, test_loss: 0.9827, test_f1: 0.4816
##################ITERATION #8 ****************************************
 epoch: 0, train_loss: 1.3194, test_loss: 1.3352, test_f1: 0.2270
 epoch: 1, train_loss: 1.2882, test_loss: 1.3205, test_f1: 0.2270
 epoch: 2, train_loss: 1.2729, test_loss: 1.3031, test_f1: 0.2270
 epoch: 3, train_loss: 1.2578, test_loss: 1.2745, test_f1: 0.2270
 epoch: 4, train_loss: 1.2415, test_loss: 1.2389, test_f1: 0.2270
 epoch: 5, train_loss: 1.2284, test_loss: 1.2109, test_f1: 0.2295
 epoch: 6, train_loss: 1.2154, test_loss: 1.1882, test_f1: 0.2747
 epoch: 7, train_loss: 1.1986, test_loss: 1.1697, test_f1: 0.3031
 epoch: 8, train_loss: 1.1780, test_loss: 1.1546, test_f1: 0.3195
 epoch: 9, train_loss: 1.1671, test_loss: 1.1418, test_f1: 0.3374
 epoch: 10, train_loss: 1.1584, test_loss: 1.1300, test_f1: 0.3422
 epoch: 11, train_loss: 1.1574, test_loss: 1.1204, test_f1: 0.3422
 epoch: 12, train_loss: 1.1349, test_loss: 1.1106, test_f1: 0.3422
 epoch: 13, train_loss: 1.1282, test_loss: 1.1027, test_f1: 0.3422
 epoch: 14, train_loss: 1.1203, test_loss: 1.0951, test_f1: 0.3460
 epoch: 15, train_loss: 1.1159, test_loss: 1.0893, test_f1: 0.3460
 epoch: 16, train_loss: 1.1035, test_loss: 1.0838, test_f1: 0.3460
 epoch: 17, train_loss: 1.0945, test_loss: 1.0786, test_f1: 0.3460
 epoch: 18, train_loss: 1.0922, test_loss: 1.0739, test_f1: 0.3460
 epoch: 19, train_loss: 1.0883, test_loss: 1.0696, test_f1: 0.3450
 epoch: 20, train_loss: 1.0794, test_loss: 1.0652, test_f1: 0.3450
 epoch: 21, train_loss: 1.0749, test_loss: 1.0620, test_f1: 0.3448
 epoch: 22, train_loss: 1.0706, test_loss: 1.0584, test_f1: 0.3448
 epoch: 23, train_loss: 1.0669, test_loss: 1.0558, test_f1: 0.3450
 epoch: 24, train_loss: 1.0661, test_loss: 1.0532, test_f1: 0.3448
 epoch: 25, train_loss: 1.0568, test_loss: 1.0508, test_f1: 0.3426
 epoch: 26, train_loss: 1.0536, test_loss: 1.0476, test_f1: 0.3445
 epoch: 27, train_loss: 1.0500, test_loss: 1.0465, test_f1: 0.3431
 epoch: 28, train_loss: 1.0508, test_loss: 1.0428, test_f1: 0.3538
 epoch: 29, train_loss: 1.0430, test_loss: 1.0415, test_f1: 0.3543
 epoch: 30, train_loss: 1.0447, test_loss: 1.0402, test_f1: 0.3568
 epoch: 31, train_loss: 1.0437, test_loss: 1.0391, test_f1: 0.3653
 epoch: 32, train_loss: 1.0394, test_loss: 1.0359, test_f1: 0.3779
 epoch: 33, train_loss: 1.0343, test_loss: 1.0328, test_f1: 0.3824
 epoch: 34, train_loss: 1.0372, test_loss: 1.0314, test_f1: 0.3844
 epoch: 35, train_loss: 1.0323, test_loss: 1.0289, test_f1: 0.3960
 epoch: 36, train_loss: 1.0269, test_loss: 1.0270, test_f1: 0.4164
 epoch: 37, train_loss: 1.0251, test_loss: 1.0272, test_f1: 0.4052
 epoch: 38, train_loss: 1.0244, test_loss: 1.0237, test_f1: 0.4204
 epoch: 39, train_loss: 1.0206, test_loss: 1.0206, test_f1: 0.4215
 epoch: 40, train_loss: 1.0205, test_loss: 1.0181, test_f1: 0.4308
 epoch: 41, train_loss: 1.0140, test_loss: 1.0149, test_f1: 0.4447
 epoch: 42, train_loss: 1.0202, test_loss: 1.0131, test_f1: 0.4391
 epoch: 43, train_loss: 1.0116, test_loss: 1.0113, test_f1: 0.4379
 epoch: 44, train_loss: 1.0083, test_loss: 1.0099, test_f1: 0.4587
 epoch: 45, train_loss: 1.0098, test_loss: 1.0091, test_f1: 0.4579
 epoch: 46, train_loss: 1.0137, test_loss: 1.0047, test_f1: 0.4623
 epoch: 47, train_loss: 1.0047, test_loss: 1.0047, test_f1: 0.4609
 epoch: 48, train_loss: 1.0059, test_loss: 0.9998, test_f1: 0.4587
 epoch: 49, train_loss: 1.0033, test_loss: 0.9984, test_f1: 0.4603
 epoch: 50, train_loss: 1.0077, test_loss: 0.9987, test_f1: 0.4633
 epoch: 51, train_loss: 0.9907, test_loss: 0.9978, test_f1: 0.4624
 epoch: 52, train_loss: 0.9979, test_loss: 0.9972, test_f1: 0.4670
 epoch: 53, train_loss: 0.9966, test_loss: 0.9970, test_f1: 0.4675
 epoch: 54, train_loss: 0.9942, test_loss: 0.9963, test_f1: 0.4685
 epoch: 55, train_loss: 0.9962, test_loss: 0.9942, test_f1: 0.4670
 epoch: 56, train_loss: 0.9983, test_loss: 0.9924, test_f1: 0.4649
 epoch: 57, train_loss: 0.9937, test_loss: 0.9930, test_f1: 0.4685
 epoch: 58, train_loss: 0.9953, test_loss: 0.9900, test_f1: 0.4665
 epoch: 59, train_loss: 0.9902, test_loss: 0.9902, test_f1: 0.4681
 epoch: 60, train_loss: 0.9930, test_loss: 0.9889, test_f1: 0.4681
 epoch: 61, train_loss: 0.9941, test_loss: 0.9880, test_f1: 0.4665
 epoch: 62, train_loss: 0.9864, test_loss: 0.9881, test_f1: 0.4695
 epoch: 63, train_loss: 0.9891, test_loss: 0.9890, test_f1: 0.4695
 epoch: 64, train_loss: 0.9888, test_loss: 0.9859, test_f1: 0.4680
 epoch: 65, train_loss: 0.9869, test_loss: 0.9838, test_f1: 0.4696
 epoch: 66, train_loss: 0.9906, test_loss: 0.9840, test_f1: 0.4701
 epoch: 67, train_loss: 0.9893, test_loss: 0.9830, test_f1: 0.4711
 epoch: 68, train_loss: 0.9785, test_loss: 0.9818, test_f1: 0.4710
 epoch: 69, train_loss: 0.9883, test_loss: 0.9822, test_f1: 0.4710
 epoch: 70, train_loss: 0.9880, test_loss: 0.9809, test_f1: 0.4701
 epoch: 71, train_loss: 0.9845, test_loss: 0.9805, test_f1: 0.4706
 epoch: 72, train_loss: 0.9809, test_loss: 0.9776, test_f1: 0.4701
 epoch: 73, train_loss: 0.9832, test_loss: 0.9765, test_f1: 0.4726
 epoch: 74, train_loss: 0.9886, test_loss: 0.9772, test_f1: 0.4740
 epoch: 75, train_loss: 0.9811, test_loss: 0.9759, test_f1: 0.4691
 epoch: 76, train_loss: 0.9782, test_loss: 0.9762, test_f1: 0.4691
 epoch: 77, train_loss: 0.9783, test_loss: 0.9760, test_f1: 0.4759
 epoch: 78, train_loss: 0.9836, test_loss: 0.9762, test_f1: 0.4708
 epoch: 79, train_loss: 0.9752, test_loss: 0.9751, test_f1: 0.4750
 epoch: 80, train_loss: 0.9829, test_loss: 0.9739, test_f1: 0.4710
 epoch: 81, train_loss: 0.9810, test_loss: 0.9726, test_f1: 0.4710
 epoch: 82, train_loss: 0.9814, test_loss: 0.9719, test_f1: 0.4701
 epoch: 83, train_loss: 0.9705, test_loss: 0.9711, test_f1: 0.4774
 epoch: 84, train_loss: 0.9753, test_loss: 0.9710, test_f1: 0.4763
 epoch: 85, train_loss: 0.9723, test_loss: 0.9721, test_f1: 0.4851
 epoch: 86, train_loss: 0.9739, test_loss: 0.9719, test_f1: 0.4811
 epoch: 87, train_loss: 0.9663, test_loss: 0.9711, test_f1: 0.4859
 epoch: 88, train_loss: 0.9783, test_loss: 0.9698, test_f1: 0.4814
 epoch: 89, train_loss: 0.9768, test_loss: 0.9705, test_f1: 0.4781
 epoch: 90, train_loss: 0.9709, test_loss: 0.9697, test_f1: 0.4875
 epoch: 91, train_loss: 0.9759, test_loss: 0.9678, test_f1: 0.4795
 epoch: 92, train_loss: 0.9694, test_loss: 0.9669, test_f1: 0.4795
 epoch: 93, train_loss: 0.9707, test_loss: 0.9657, test_f1: 0.4814
 epoch: 94, train_loss: 0.9746, test_loss: 0.9660, test_f1: 0.4838
 epoch: 95, train_loss: 0.9696, test_loss: 0.9659, test_f1: 0.4819
 epoch: 96, train_loss: 0.9638, test_loss: 0.9652, test_f1: 0.4895
 epoch: 97, train_loss: 0.9679, test_loss: 0.9656, test_f1: 0.4866
 epoch: 98, train_loss: 0.9652, test_loss: 0.9647, test_f1: 0.4875
 epoch: 99, train_loss: 0.9637, test_loss: 0.9635, test_f1: 0.4875
##################ITERATION #9 ****************************************
 epoch: 0, train_loss: 1.3984, test_loss: 1.4185, test_f1: 0.2270
 epoch: 1, train_loss: 1.3377, test_loss: 1.4139, test_f1: 0.2270
 epoch: 2, train_loss: 1.3182, test_loss: 1.3843, test_f1: 0.2270
 epoch: 3, train_loss: 1.2917, test_loss: 1.3328, test_f1: 0.2270
 epoch: 4, train_loss: 1.2720, test_loss: 1.2843, test_f1: 0.2270
 epoch: 5, train_loss: 1.2544, test_loss: 1.2435, test_f1: 0.2392
 epoch: 6, train_loss: 1.2331, test_loss: 1.2058, test_f1: 0.2709
 epoch: 7, train_loss: 1.2170, test_loss: 1.1784, test_f1: 0.2853
 epoch: 8, train_loss: 1.2018, test_loss: 1.1583, test_f1: 0.3009
 epoch: 9, train_loss: 1.1887, test_loss: 1.1409, test_f1: 0.3130
 epoch: 10, train_loss: 1.1742, test_loss: 1.1250, test_f1: 0.3200
 epoch: 11, train_loss: 1.1566, test_loss: 1.1099, test_f1: 0.3388
 epoch: 12, train_loss: 1.1448, test_loss: 1.0953, test_f1: 0.3680
 epoch: 13, train_loss: 1.1304, test_loss: 1.0829, test_f1: 0.3921
 epoch: 14, train_loss: 1.1186, test_loss: 1.0722, test_f1: 0.4042
 epoch: 15, train_loss: 1.1099, test_loss: 1.0639, test_f1: 0.4092
 epoch: 16, train_loss: 1.1021, test_loss: 1.0573, test_f1: 0.4106
 epoch: 17, train_loss: 1.0967, test_loss: 1.0511, test_f1: 0.4127
 epoch: 18, train_loss: 1.0895, test_loss: 1.0463, test_f1: 0.4143
 epoch: 19, train_loss: 1.0850, test_loss: 1.0410, test_f1: 0.4147
 epoch: 20, train_loss: 1.0731, test_loss: 1.0355, test_f1: 0.4175
 epoch: 21, train_loss: 1.0684, test_loss: 1.0322, test_f1: 0.4184
 epoch: 22, train_loss: 1.0622, test_loss: 1.0292, test_f1: 0.4202
 epoch: 23, train_loss: 1.0592, test_loss: 1.0274, test_f1: 0.4268
 epoch: 24, train_loss: 1.0511, test_loss: 1.0228, test_f1: 0.4291
 epoch: 25, train_loss: 1.0459, test_loss: 1.0209, test_f1: 0.4261
 epoch: 26, train_loss: 1.0518, test_loss: 1.0195, test_f1: 0.4242
 epoch: 27, train_loss: 1.0395, test_loss: 1.0151, test_f1: 0.4315
 epoch: 28, train_loss: 1.0375, test_loss: 1.0151, test_f1: 0.4382
 epoch: 29, train_loss: 1.0382, test_loss: 1.0112, test_f1: 0.4324
 epoch: 30, train_loss: 1.0333, test_loss: 1.0075, test_f1: 0.4299
 epoch: 31, train_loss: 1.0303, test_loss: 1.0056, test_f1: 0.4368
 epoch: 32, train_loss: 1.0298, test_loss: 1.0050, test_f1: 0.4359
 epoch: 33, train_loss: 1.0197, test_loss: 1.0011, test_f1: 0.4340
 epoch: 34, train_loss: 1.0159, test_loss: 0.9993, test_f1: 0.4360
 epoch: 35, train_loss: 1.0224, test_loss: 0.9991, test_f1: 0.4375
 epoch: 36, train_loss: 1.0147, test_loss: 0.9999, test_f1: 0.4396
 epoch: 37, train_loss: 1.0057, test_loss: 0.9964, test_f1: 0.4396
 epoch: 38, train_loss: 1.0076, test_loss: 0.9975, test_f1: 0.4406
 epoch: 39, train_loss: 1.0119, test_loss: 0.9960, test_f1: 0.4496
 epoch: 40, train_loss: 1.0078, test_loss: 0.9937, test_f1: 0.4496
 epoch: 41, train_loss: 1.0051, test_loss: 0.9946, test_f1: 0.4458
 epoch: 42, train_loss: 1.0026, test_loss: 0.9949, test_f1: 0.4460
 epoch: 43, train_loss: 1.0005, test_loss: 0.9924, test_f1: 0.4434
 epoch: 44, train_loss: 1.0008, test_loss: 0.9912, test_f1: 0.4460
 epoch: 45, train_loss: 0.9961, test_loss: 0.9892, test_f1: 0.4522
 epoch: 46, train_loss: 0.9916, test_loss: 0.9910, test_f1: 0.4556
 epoch: 47, train_loss: 0.9894, test_loss: 0.9906, test_f1: 0.4513
 epoch: 48, train_loss: 0.9921, test_loss: 0.9910, test_f1: 0.4549
 epoch: 49, train_loss: 0.9845, test_loss: 0.9896, test_f1: 0.4556
 epoch: 50, train_loss: 0.9840, test_loss: 0.9889, test_f1: 0.4575
 epoch: 51, train_loss: 0.9824, test_loss: 0.9868, test_f1: 0.4565
 epoch: 52, train_loss: 0.9897, test_loss: 0.9873, test_f1: 0.4556
 epoch: 53, train_loss: 0.9851, test_loss: 0.9879, test_f1: 0.4578
 epoch: 54, train_loss: 0.9861, test_loss: 0.9875, test_f1: 0.4587
 epoch: 55, train_loss: 0.9834, test_loss: 0.9868, test_f1: 0.4587
 epoch: 56, train_loss: 0.9804, test_loss: 0.9854, test_f1: 0.4568
 epoch: 57, train_loss: 0.9850, test_loss: 0.9853, test_f1: 0.4563
 epoch: 58, train_loss: 0.9761, test_loss: 0.9865, test_f1: 0.4600
 epoch: 59, train_loss: 0.9781, test_loss: 0.9891, test_f1: 0.4589
 epoch: 60, train_loss: 0.9772, test_loss: 0.9875, test_f1: 0.4579
 epoch: 61, train_loss: 0.9721, test_loss: 0.9868, test_f1: 0.4600
 epoch: 62, train_loss: 0.9731, test_loss: 0.9855, test_f1: 0.4630
 epoch: 63, train_loss: 0.9768, test_loss: 0.9847, test_f1: 0.4610
 epoch: 64, train_loss: 0.9723, test_loss: 0.9813, test_f1: 0.4621
 epoch: 65, train_loss: 0.9739, test_loss: 0.9810, test_f1: 0.4623
 epoch: 66, train_loss: 0.9773, test_loss: 0.9818, test_f1: 0.4657
 epoch: 67, train_loss: 0.9778, test_loss: 0.9802, test_f1: 0.4626
 epoch: 68, train_loss: 0.9721, test_loss: 0.9839, test_f1: 0.4605
 epoch: 69, train_loss: 0.9689, test_loss: 0.9821, test_f1: 0.4611
 epoch: 70, train_loss: 0.9635, test_loss: 0.9816, test_f1: 0.4628
 epoch: 71, train_loss: 0.9716, test_loss: 0.9805, test_f1: 0.4650
 epoch: 72, train_loss: 0.9652, test_loss: 0.9789, test_f1: 0.4661
 epoch: 73, train_loss: 0.9705, test_loss: 0.9819, test_f1: 0.4648
 epoch: 74, train_loss: 0.9697, test_loss: 0.9831, test_f1: 0.4676
 epoch: 75, train_loss: 0.9636, test_loss: 0.9805, test_f1: 0.4657
 epoch: 76, train_loss: 0.9658, test_loss: 0.9772, test_f1: 0.4676
 epoch: 77, train_loss: 0.9635, test_loss: 0.9777, test_f1: 0.4666
 epoch: 78, train_loss: 0.9614, test_loss: 0.9779, test_f1: 0.4674
 epoch: 79, train_loss: 0.9630, test_loss: 0.9755, test_f1: 0.4668
 epoch: 80, train_loss: 0.9755, test_loss: 0.9775, test_f1: 0.4694
 epoch: 81, train_loss: 0.9657, test_loss: 0.9773, test_f1: 0.4667
 epoch: 82, train_loss: 0.9599, test_loss: 0.9774, test_f1: 0.4681
 epoch: 83, train_loss: 0.9640, test_loss: 0.9752, test_f1: 0.4724
 epoch: 84, train_loss: 0.9657, test_loss: 0.9737, test_f1: 0.4689
 epoch: 85, train_loss: 0.9624, test_loss: 0.9736, test_f1: 0.4693
 epoch: 86, train_loss: 0.9563, test_loss: 0.9749, test_f1: 0.4698
 epoch: 87, train_loss: 0.9613, test_loss: 0.9734, test_f1: 0.4702
 epoch: 88, train_loss: 0.9591, test_loss: 0.9714, test_f1: 0.4761
 epoch: 89, train_loss: 0.9568, test_loss: 0.9717, test_f1: 0.4747
 epoch: 90, train_loss: 0.9576, test_loss: 0.9734, test_f1: 0.4741
 epoch: 91, train_loss: 0.9526, test_loss: 0.9714, test_f1: 0.4751
 epoch: 92, train_loss: 0.9541, test_loss: 0.9692, test_f1: 0.4706
 epoch: 93, train_loss: 0.9558, test_loss: 0.9677, test_f1: 0.4730
 epoch: 94, train_loss: 0.9488, test_loss: 0.9708, test_f1: 0.4702
 epoch: 95, train_loss: 0.9534, test_loss: 0.9685, test_f1: 0.4695
 epoch: 96, train_loss: 0.9542, test_loss: 0.9715, test_f1: 0.4706
 epoch: 97, train_loss: 0.9531, test_loss: 0.9682, test_f1: 0.4751
 epoch: 98, train_loss: 0.9479, test_loss: 0.9654, test_f1: 0.4751
 epoch: 99, train_loss: 0.9490, test_loss: 0.9657, test_f1: 0.4706

Training completed in 396.07 seconds
Best F1: 0.4895 at epoch 96
Mean F1 across iterations: 0.4580  0.0255
========================FINAL RESULTS================================
FEGIN weighted F1: 0.4895  0.0255
python main.py --data ltspice_examples --representation component_pin_net --model FEGIN --layers 2 --hiddens 32 --batch_size 256 --lr 0.0001 --emb_size 128 --epochs 100 --save_appendix component_pin_net_L2_H32_BS256_LR0.0001_E128 --no_val
-----



STDERR:
  File "main.py", line 370, in <module>
    main()
  File "main.py", line 254, in main
    dataset = dataset_class(
  File "/home/philip/projects/ltspice_examples_code_repo/Circuit-Completion-Using-GNNs/component_classification_with_link_prediction_head/evaluation/FEGIN/kernel/circuit_datasets.py", line 15, in __init__
    self.data, self.slices = torch.load(self.processed_paths[0])
  File "/home/philip/.local/lib/python3.8/site-packages/torch/serialization.py", line 1040, in load
    warnings.warn(
  File "/usr/lib/python3.8/warnings.py", line 109, in _showwarnmsg
    sw(msg.message, msg.category, msg.filename, msg.lineno,
  File "main.py", line 47, in warn_with_traceback
    traceback.print_stack(file=log)
/home/philip/projects/ltspice_examples_code_repo/Circuit-Completion-Using-GNNs/component_classification_with_link_prediction_head/evaluation/FEGIN/kernel/circuit_datasets.py:15: FutureWarning: You are using `torch.load` with `weights_only=False` (the current default value), which uses the default pickle module implicitly. It is possible to construct malicious pickle data which will execute arbitrary code during unpickling (See https://github.com/pytorch/pytorch/blob/main/SECURITY.md#untrusted-models for more details). In a future release, the default value for `weights_only` will be flipped to `True`. This limits the functions that could be executed during unpickling. Arbitrary objects will no longer be allowed to be loaded via this mode unless they are explicitly allowlisted by the user via `torch.serialization.add_safe_globals`. We recommend you start setting `weights_only=True` for any use case where you don't have full control of the loaded file. Please open an issue on GitHub for any issues related to this experimental feature.
  self.data, self.slices = torch.load(self.processed_paths[0])
