STDOUT:
Results will be saved in /home/philip/projects/ltspice_examples_code_repo/Circuit-Completion-Using-GNNs/component_classification_with_link_prediction_head/evaluation/FEGIN/results/model_FEGIN_dataset_ltspice_demos
Command line input: python main.py --data ltspice_demos --representation component_pin --model FEGIN --layers 4 --hiddens 16 --batch_size 64 --lr 0.001 --emb_size 250 --epochs 100 --save_appendix component_pin_L4_H16_BS64_LR0.001_E250 --no_val
 is saved.
-----
ltspice_demos - FEGIN
Using 4 layers, 16 hidden units, h = 2
Loading component_pin representation dataset
ENTERED
Training FEGIN on component_pin representation
Train: 1565, Test: 383
##################ITERATION #0 ****************************************
 epoch: 0, train_loss: 1.4364, test_loss: 1.4040, test_f1: 0.0497
 epoch: 1, train_loss: 1.3602, test_loss: 1.3614, test_f1: 0.1365
 epoch: 2, train_loss: 1.2935, test_loss: 1.3161, test_f1: 0.1365
 epoch: 3, train_loss: 1.2400, test_loss: 1.2777, test_f1: 0.1420
 epoch: 4, train_loss: 1.2023, test_loss: 1.2409, test_f1: 0.2133
 epoch: 5, train_loss: 1.1767, test_loss: 1.2335, test_f1: 0.3534
 epoch: 6, train_loss: 1.1562, test_loss: 1.2123, test_f1: 0.2982
 epoch: 7, train_loss: 1.1310, test_loss: 1.1994, test_f1: 0.2770
 epoch: 8, train_loss: 1.1153, test_loss: 1.2341, test_f1: 0.3250
 epoch: 9, train_loss: 1.1009, test_loss: 1.2353, test_f1: 0.4054
 epoch: 10, train_loss: 1.0907, test_loss: 1.3332, test_f1: 0.3783
 epoch: 11, train_loss: 1.0669, test_loss: 1.5191, test_f1: 0.3324
 epoch: 12, train_loss: 1.0574, test_loss: 1.2309, test_f1: 0.4202
 epoch: 13, train_loss: 1.0451, test_loss: 1.1727, test_f1: 0.3568
 epoch: 14, train_loss: 1.0053, test_loss: 1.1340, test_f1: 0.4134
 epoch: 15, train_loss: 0.9968, test_loss: 1.1445, test_f1: 0.4624
 epoch: 16, train_loss: 0.9755, test_loss: 1.0371, test_f1: 0.4810
 epoch: 17, train_loss: 0.9577, test_loss: 1.0593, test_f1: 0.4685
 epoch: 18, train_loss: 0.9520, test_loss: 1.0455, test_f1: 0.4844
 epoch: 19, train_loss: 0.9370, test_loss: 1.2633, test_f1: 0.4188
 epoch: 20, train_loss: 0.9164, test_loss: 1.0366, test_f1: 0.5490
 epoch: 21, train_loss: 0.9261, test_loss: 1.0195, test_f1: 0.5425
 epoch: 22, train_loss: 0.9003, test_loss: 1.0374, test_f1: 0.5358
 epoch: 23, train_loss: 0.9049, test_loss: 0.9903, test_f1: 0.5894
 epoch: 24, train_loss: 0.9172, test_loss: 1.3555, test_f1: 0.4584
 epoch: 25, train_loss: 0.8867, test_loss: 1.2694, test_f1: 0.4641
 epoch: 26, train_loss: 0.8839, test_loss: 1.0311, test_f1: 0.5808
 epoch: 27, train_loss: 0.8747, test_loss: 0.9951, test_f1: 0.5800
 epoch: 28, train_loss: 0.8746, test_loss: 0.9644, test_f1: 0.5909
 epoch: 29, train_loss: 0.8537, test_loss: 1.0036, test_f1: 0.5954
 epoch: 30, train_loss: 0.8474, test_loss: 1.8400, test_f1: 0.2206
 epoch: 31, train_loss: 0.8658, test_loss: 1.1983, test_f1: 0.4782
 epoch: 32, train_loss: 0.8397, test_loss: 0.9906, test_f1: 0.5820
 epoch: 33, train_loss: 0.8325, test_loss: 1.0360, test_f1: 0.5535
 epoch: 34, train_loss: 0.8377, test_loss: 0.9757, test_f1: 0.5602
 epoch: 35, train_loss: 0.8132, test_loss: 1.0255, test_f1: 0.5580
 epoch: 36, train_loss: 0.8126, test_loss: 0.9924, test_f1: 0.5819
 epoch: 37, train_loss: 0.8016, test_loss: 0.9777, test_f1: 0.6199
 epoch: 38, train_loss: 0.8155, test_loss: 1.0347, test_f1: 0.5649
 epoch: 39, train_loss: 0.8055, test_loss: 1.0174, test_f1: 0.5826
 epoch: 40, train_loss: 0.7967, test_loss: 1.2807, test_f1: 0.4946
 epoch: 41, train_loss: 0.7920, test_loss: 1.2630, test_f1: 0.4345
 epoch: 42, train_loss: 0.7944, test_loss: 1.0455, test_f1: 0.5525
 epoch: 43, train_loss: 0.8283, test_loss: 1.0768, test_f1: 0.5476
 epoch: 44, train_loss: 0.7962, test_loss: 1.0348, test_f1: 0.5734
 epoch: 45, train_loss: 0.7831, test_loss: 0.9476, test_f1: 0.5911
 epoch: 46, train_loss: 0.7811, test_loss: 1.0712, test_f1: 0.5714
 epoch: 47, train_loss: 0.7669, test_loss: 0.9903, test_f1: 0.5836
 epoch: 48, train_loss: 0.7685, test_loss: 0.9890, test_f1: 0.6128
 epoch: 49, train_loss: 0.7557, test_loss: 1.0171, test_f1: 0.5843
 epoch: 50, train_loss: 0.7689, test_loss: 1.0009, test_f1: 0.5630
 epoch: 51, train_loss: 0.7544, test_loss: 1.0280, test_f1: 0.5920
 epoch: 52, train_loss: 0.7603, test_loss: 1.0240, test_f1: 0.6062
 epoch: 53, train_loss: 0.7291, test_loss: 1.0440, test_f1: 0.6004
 epoch: 54, train_loss: 0.7299, test_loss: 0.9640, test_f1: 0.5949
 epoch: 55, train_loss: 0.7381, test_loss: 1.0072, test_f1: 0.5826
 epoch: 56, train_loss: 0.7252, test_loss: 1.0911, test_f1: 0.5782
 epoch: 57, train_loss: 0.7453, test_loss: 1.0762, test_f1: 0.5852
 epoch: 58, train_loss: 0.7202, test_loss: 1.0101, test_f1: 0.5816
 epoch: 59, train_loss: 0.7349, test_loss: 1.0320, test_f1: 0.5929
 epoch: 60, train_loss: 0.7540, test_loss: 1.0533, test_f1: 0.5669
 epoch: 61, train_loss: 0.7232, test_loss: 0.9917, test_f1: 0.5881
 epoch: 62, train_loss: 0.7214, test_loss: 1.0224, test_f1: 0.5725
 epoch: 63, train_loss: 0.7082, test_loss: 1.0118, test_f1: 0.5652
 epoch: 64, train_loss: 0.7204, test_loss: 1.0052, test_f1: 0.5632
 epoch: 65, train_loss: 0.6919, test_loss: 1.0408, test_f1: 0.5672
 epoch: 66, train_loss: 0.7186, test_loss: 1.0968, test_f1: 0.5344
 epoch: 67, train_loss: 0.7204, test_loss: 1.0873, test_f1: 0.5895
 epoch: 68, train_loss: 0.7042, test_loss: 1.0252, test_f1: 0.5809
 epoch: 69, train_loss: 0.7137, test_loss: 0.9978, test_f1: 0.6063
 epoch: 70, train_loss: 0.7175, test_loss: 1.0140, test_f1: 0.6172
 epoch: 71, train_loss: 0.7101, test_loss: 1.0417, test_f1: 0.5765
 epoch: 72, train_loss: 0.7057, test_loss: 1.0632, test_f1: 0.5945
 epoch: 73, train_loss: 0.7107, test_loss: 1.1287, test_f1: 0.5513
 epoch: 74, train_loss: 0.7027, test_loss: 1.0492, test_f1: 0.5711
 epoch: 75, train_loss: 0.7085, test_loss: 1.0928, test_f1: 0.5594
 epoch: 76, train_loss: 0.6964, test_loss: 1.1095, test_f1: 0.5797
 epoch: 77, train_loss: 0.6953, test_loss: 1.0857, test_f1: 0.5580
 epoch: 78, train_loss: 0.6967, test_loss: 1.0736, test_f1: 0.6023
 epoch: 79, train_loss: 0.6876, test_loss: 1.0481, test_f1: 0.5624
 epoch: 80, train_loss: 0.6906, test_loss: 1.0877, test_f1: 0.5875
 epoch: 81, train_loss: 0.7173, test_loss: 1.0872, test_f1: 0.5738
 epoch: 82, train_loss: 0.6781, test_loss: 1.0800, test_f1: 0.6001
 epoch: 83, train_loss: 0.6789, test_loss: 1.0565, test_f1: 0.6219
 epoch: 84, train_loss: 0.6687, test_loss: 1.1660, test_f1: 0.5600
 epoch: 85, train_loss: 0.6740, test_loss: 1.0996, test_f1: 0.5822
 epoch: 86, train_loss: 0.6982, test_loss: 1.0917, test_f1: 0.6133
 epoch: 87, train_loss: 0.6918, test_loss: 1.1114, test_f1: 0.5735
 epoch: 88, train_loss: 0.6791, test_loss: 1.1195, test_f1: 0.5901
 epoch: 89, train_loss: 0.6737, test_loss: 1.1087, test_f1: 0.5876
 epoch: 90, train_loss: 0.6635, test_loss: 1.1256, test_f1: 0.5666
 epoch: 91, train_loss: 0.6554, test_loss: 1.0936, test_f1: 0.6078
 epoch: 92, train_loss: 0.6811, test_loss: 1.1370, test_f1: 0.5824
 epoch: 93, train_loss: 0.6678, test_loss: 1.1281, test_f1: 0.5745
 epoch: 94, train_loss: 0.6670, test_loss: 1.0955, test_f1: 0.6013
 epoch: 95, train_loss: 0.6678, test_loss: 1.1670, test_f1: 0.5852
 epoch: 96, train_loss: 0.6766, test_loss: 1.2385, test_f1: 0.5267
 epoch: 97, train_loss: 0.6848, test_loss: 1.1298, test_f1: 0.5967
 epoch: 98, train_loss: 0.6811, test_loss: 1.0817, test_f1: 0.5764
 epoch: 99, train_loss: 0.6905, test_loss: 1.1068, test_f1: 0.6086
##################ITERATION #1 ****************************************
 epoch: 0, train_loss: 1.3911, test_loss: 1.3078, test_f1: 0.2281
 epoch: 1, train_loss: 1.2258, test_loss: 1.2715, test_f1: 0.2281
 epoch: 2, train_loss: 1.1963, test_loss: 1.2427, test_f1: 0.2281
 epoch: 3, train_loss: 1.1787, test_loss: 1.2254, test_f1: 0.3018
 epoch: 4, train_loss: 1.1388, test_loss: 1.2144, test_f1: 0.3511
 epoch: 5, train_loss: 1.1195, test_loss: 1.1918, test_f1: 0.3610
 epoch: 6, train_loss: 1.1056, test_loss: 1.1615, test_f1: 0.3694
 epoch: 7, train_loss: 1.0783, test_loss: 1.1436, test_f1: 0.4201
 epoch: 8, train_loss: 1.0639, test_loss: 1.1285, test_f1: 0.4343
 epoch: 9, train_loss: 1.0354, test_loss: 1.1109, test_f1: 0.4364
 epoch: 10, train_loss: 1.0336, test_loss: 1.1043, test_f1: 0.4452
 epoch: 11, train_loss: 1.0104, test_loss: 1.1076, test_f1: 0.4465
 epoch: 12, train_loss: 0.9855, test_loss: 1.0986, test_f1: 0.5052
 epoch: 13, train_loss: 0.9773, test_loss: 1.0727, test_f1: 0.4951
 epoch: 14, train_loss: 0.9679, test_loss: 1.0655, test_f1: 0.4724
 epoch: 15, train_loss: 0.9582, test_loss: 1.0587, test_f1: 0.4817
 epoch: 16, train_loss: 0.9437, test_loss: 1.0565, test_f1: 0.4992
 epoch: 17, train_loss: 0.9425, test_loss: 1.0462, test_f1: 0.4777
 epoch: 18, train_loss: 0.9320, test_loss: 1.0616, test_f1: 0.5344
 epoch: 19, train_loss: 0.9113, test_loss: 1.0585, test_f1: 0.5416
 epoch: 20, train_loss: 0.8981, test_loss: 1.0336, test_f1: 0.5656
 epoch: 21, train_loss: 0.8918, test_loss: 1.0242, test_f1: 0.4825
 epoch: 22, train_loss: 0.8631, test_loss: 1.0470, test_f1: 0.5660
 epoch: 23, train_loss: 0.8558, test_loss: 1.0093, test_f1: 0.5313
 epoch: 24, train_loss: 0.8787, test_loss: 1.1154, test_f1: 0.4999
 epoch: 25, train_loss: 0.8530, test_loss: 1.0157, test_f1: 0.5759
 epoch: 26, train_loss: 0.8529, test_loss: 1.0081, test_f1: 0.5853
 epoch: 27, train_loss: 0.8560, test_loss: 0.9901, test_f1: 0.5879
 epoch: 28, train_loss: 0.8346, test_loss: 1.0305, test_f1: 0.5708
 epoch: 29, train_loss: 0.8217, test_loss: 1.0066, test_f1: 0.5573
 epoch: 30, train_loss: 0.8296, test_loss: 1.0635, test_f1: 0.5199
 epoch: 31, train_loss: 0.8096, test_loss: 1.0303, test_f1: 0.5641
 epoch: 32, train_loss: 0.8348, test_loss: 1.0316, test_f1: 0.5670
 epoch: 33, train_loss: 0.7959, test_loss: 1.0215, test_f1: 0.5567
 epoch: 34, train_loss: 0.7929, test_loss: 1.0479, test_f1: 0.5722
 epoch: 35, train_loss: 0.7826, test_loss: 1.0055, test_f1: 0.5641
 epoch: 36, train_loss: 0.7824, test_loss: 1.0809, test_f1: 0.5135
 epoch: 37, train_loss: 0.7848, test_loss: 1.0239, test_f1: 0.5586
 epoch: 38, train_loss: 0.7827, test_loss: 1.0257, test_f1: 0.5792
 epoch: 39, train_loss: 0.7931, test_loss: 1.1064, test_f1: 0.5689
 epoch: 40, train_loss: 0.7699, test_loss: 1.0039, test_f1: 0.5637
 epoch: 41, train_loss: 0.7787, test_loss: 1.0490, test_f1: 0.5721
 epoch: 42, train_loss: 0.7551, test_loss: 1.0388, test_f1: 0.5467
 epoch: 43, train_loss: 0.7576, test_loss: 1.0642, test_f1: 0.5448
 epoch: 44, train_loss: 0.7752, test_loss: 1.0822, test_f1: 0.5477
 epoch: 45, train_loss: 0.7603, test_loss: 1.1143, test_f1: 0.5518
 epoch: 46, train_loss: 0.7500, test_loss: 1.0724, test_f1: 0.5562
 epoch: 47, train_loss: 0.7553, test_loss: 1.0725, test_f1: 0.5591
 epoch: 48, train_loss: 0.7513, test_loss: 1.1079, test_f1: 0.5275
 epoch: 49, train_loss: 0.7413, test_loss: 1.1027, test_f1: 0.5553
 epoch: 50, train_loss: 0.7375, test_loss: 1.1282, test_f1: 0.5499
 epoch: 51, train_loss: 0.7212, test_loss: 1.0419, test_f1: 0.5525
 epoch: 52, train_loss: 0.7332, test_loss: 1.1280, test_f1: 0.5510
 epoch: 53, train_loss: 0.7250, test_loss: 1.1056, test_f1: 0.5481
 epoch: 54, train_loss: 0.7166, test_loss: 1.0783, test_f1: 0.5386
 epoch: 55, train_loss: 0.7208, test_loss: 1.1369, test_f1: 0.5481
 epoch: 56, train_loss: 0.7222, test_loss: 1.0886, test_f1: 0.5553
 epoch: 57, train_loss: 0.7177, test_loss: 1.1324, test_f1: 0.5452
 epoch: 58, train_loss: 0.7325, test_loss: 1.0958, test_f1: 0.5577
 epoch: 59, train_loss: 0.7237, test_loss: 1.0780, test_f1: 0.5461
 epoch: 60, train_loss: 0.7074, test_loss: 1.0957, test_f1: 0.5398
 epoch: 61, train_loss: 0.7210, test_loss: 1.0694, test_f1: 0.5548
 epoch: 62, train_loss: 0.7102, test_loss: 1.0765, test_f1: 0.5476
 epoch: 63, train_loss: 0.7107, test_loss: 1.0792, test_f1: 0.5362
 epoch: 64, train_loss: 0.7105, test_loss: 1.1358, test_f1: 0.5582
 epoch: 65, train_loss: 0.6887, test_loss: 1.1155, test_f1: 0.5459
 epoch: 66, train_loss: 0.7013, test_loss: 1.1409, test_f1: 0.5451
 epoch: 67, train_loss: 0.7075, test_loss: 1.1079, test_f1: 0.5499
 epoch: 68, train_loss: 0.7173, test_loss: 1.0870, test_f1: 0.5804
 epoch: 69, train_loss: 0.7037, test_loss: 1.1362, test_f1: 0.5505
 epoch: 70, train_loss: 0.7022, test_loss: 1.1004, test_f1: 0.5641
 epoch: 71, train_loss: 0.6936, test_loss: 1.2028, test_f1: 0.5287
 epoch: 72, train_loss: 0.7057, test_loss: 1.1097, test_f1: 0.5585
 epoch: 73, train_loss: 0.6912, test_loss: 1.1321, test_f1: 0.5465
 epoch: 74, train_loss: 0.7099, test_loss: 1.1215, test_f1: 0.5484
 epoch: 75, train_loss: 0.6818, test_loss: 1.1978, test_f1: 0.5512
 epoch: 76, train_loss: 0.6934, test_loss: 1.1140, test_f1: 0.5786
 epoch: 77, train_loss: 0.6848, test_loss: 1.2354, test_f1: 0.5232
 epoch: 78, train_loss: 0.6980, test_loss: 1.2306, test_f1: 0.5226
 epoch: 79, train_loss: 0.6981, test_loss: 1.1273, test_f1: 0.5597
 epoch: 80, train_loss: 0.6954, test_loss: 1.1893, test_f1: 0.5378
 epoch: 81, train_loss: 0.7047, test_loss: 1.2201, test_f1: 0.5317
 epoch: 82, train_loss: 0.6977, test_loss: 1.1407, test_f1: 0.5376
 epoch: 83, train_loss: 0.6985, test_loss: 1.1798, test_f1: 0.5601
 epoch: 84, train_loss: 0.6849, test_loss: 1.2308, test_f1: 0.5295
 epoch: 85, train_loss: 0.6807, test_loss: 1.2253, test_f1: 0.5389
 epoch: 86, train_loss: 0.6740, test_loss: 1.2652, test_f1: 0.5383
 epoch: 87, train_loss: 0.6931, test_loss: 1.2142, test_f1: 0.5372
 epoch: 88, train_loss: 0.6866, test_loss: 1.1984, test_f1: 0.5274
 epoch: 89, train_loss: 0.6883, test_loss: 1.2051, test_f1: 0.5532
 epoch: 90, train_loss: 0.6867, test_loss: 1.1870, test_f1: 0.5505
 epoch: 91, train_loss: 0.6811, test_loss: 1.3009, test_f1: 0.5103
 epoch: 92, train_loss: 0.6741, test_loss: 1.1316, test_f1: 0.5540
 epoch: 93, train_loss: 0.6836, test_loss: 1.1944, test_f1: 0.5565
 epoch: 94, train_loss: 0.6994, test_loss: 1.2465, test_f1: 0.5322
 epoch: 95, train_loss: 0.6906, test_loss: 1.2150, test_f1: 0.5500
 epoch: 96, train_loss: 0.7581, test_loss: 1.3808, test_f1: 0.5444
 epoch: 97, train_loss: 0.7214, test_loss: 1.1675, test_f1: 0.5659
 epoch: 98, train_loss: 0.6979, test_loss: 1.1903, test_f1: 0.5594
 epoch: 99, train_loss: 0.6902, test_loss: 1.1936, test_f1: 0.5587
##################ITERATION #2 ****************************************
 epoch: 0, train_loss: 1.3911, test_loss: 1.3428, test_f1: 0.2281
 epoch: 1, train_loss: 1.2358, test_loss: 1.3014, test_f1: 0.2281
 epoch: 2, train_loss: 1.1842, test_loss: 1.2765, test_f1: 0.2756
 epoch: 3, train_loss: 1.1357, test_loss: 1.2382, test_f1: 0.3280
 epoch: 4, train_loss: 1.0922, test_loss: 1.1974, test_f1: 0.3703
 epoch: 5, train_loss: 1.0810, test_loss: 1.1865, test_f1: 0.3740
 epoch: 6, train_loss: 1.0507, test_loss: 1.1443, test_f1: 0.3843
 epoch: 7, train_loss: 1.0386, test_loss: 1.1478, test_f1: 0.3925
 epoch: 8, train_loss: 1.0276, test_loss: 1.1359, test_f1: 0.3922
 epoch: 9, train_loss: 1.0032, test_loss: 1.1045, test_f1: 0.4573
 epoch: 10, train_loss: 0.9885, test_loss: 1.0743, test_f1: 0.4508
 epoch: 11, train_loss: 0.9733, test_loss: 1.0591, test_f1: 0.4619
 epoch: 12, train_loss: 0.9527, test_loss: 1.0305, test_f1: 0.4676
 epoch: 13, train_loss: 0.9420, test_loss: 1.0390, test_f1: 0.4824
 epoch: 14, train_loss: 0.9216, test_loss: 1.0206, test_f1: 0.5146
 epoch: 15, train_loss: 0.9134, test_loss: 1.0119, test_f1: 0.4749
 epoch: 16, train_loss: 0.9145, test_loss: 1.0570, test_f1: 0.4880
 epoch: 17, train_loss: 0.8883, test_loss: 1.0316, test_f1: 0.4836
 epoch: 18, train_loss: 0.8810, test_loss: 1.0308, test_f1: 0.5140
 epoch: 19, train_loss: 0.8809, test_loss: 1.0150, test_f1: 0.5074
 epoch: 20, train_loss: 0.8805, test_loss: 1.0274, test_f1: 0.4901
 epoch: 21, train_loss: 0.8575, test_loss: 1.0231, test_f1: 0.5078
 epoch: 22, train_loss: 0.8595, test_loss: 0.9886, test_f1: 0.5468
 epoch: 23, train_loss: 0.8583, test_loss: 1.0730, test_f1: 0.5243
 epoch: 24, train_loss: 0.8491, test_loss: 1.0365, test_f1: 0.5394
 epoch: 25, train_loss: 0.8408, test_loss: 1.0560, test_f1: 0.5231
 epoch: 26, train_loss: 0.8417, test_loss: 1.0184, test_f1: 0.4982
 epoch: 27, train_loss: 0.8256, test_loss: 1.0252, test_f1: 0.5089
 epoch: 28, train_loss: 0.8177, test_loss: 0.9919, test_f1: 0.5289
 epoch: 29, train_loss: 0.8088, test_loss: 0.9943, test_f1: 0.5318
 epoch: 30, train_loss: 0.8096, test_loss: 1.0155, test_f1: 0.5568
 epoch: 31, train_loss: 0.8297, test_loss: 0.9889, test_f1: 0.5156
 epoch: 32, train_loss: 0.8116, test_loss: 0.9813, test_f1: 0.5310
 epoch: 33, train_loss: 0.7986, test_loss: 0.9602, test_f1: 0.5451
 epoch: 34, train_loss: 0.7865, test_loss: 1.0673, test_f1: 0.4951
 epoch: 35, train_loss: 0.7877, test_loss: 1.0170, test_f1: 0.5251
 epoch: 36, train_loss: 0.8011, test_loss: 1.0149, test_f1: 0.5094
 epoch: 37, train_loss: 0.7861, test_loss: 1.0413, test_f1: 0.5049
 epoch: 38, train_loss: 0.7921, test_loss: 1.1587, test_f1: 0.4562
 epoch: 39, train_loss: 0.7697, test_loss: 0.9789, test_f1: 0.5227
 epoch: 40, train_loss: 0.7733, test_loss: 0.9931, test_f1: 0.5443
 epoch: 41, train_loss: 0.7617, test_loss: 1.0013, test_f1: 0.5125
 epoch: 42, train_loss: 0.7759, test_loss: 0.9856, test_f1: 0.5465
 epoch: 43, train_loss: 0.7669, test_loss: 0.9589, test_f1: 0.5459
 epoch: 44, train_loss: 0.7679, test_loss: 1.1297, test_f1: 0.4964
 epoch: 45, train_loss: 0.7647, test_loss: 1.0224, test_f1: 0.5548
 epoch: 46, train_loss: 0.7424, test_loss: 0.9419, test_f1: 0.5402
 epoch: 47, train_loss: 0.7487, test_loss: 1.0386, test_f1: 0.5379
 epoch: 48, train_loss: 0.7554, test_loss: 1.0441, test_f1: 0.5071
 epoch: 49, train_loss: 0.7371, test_loss: 1.0223, test_f1: 0.5202
 epoch: 50, train_loss: 0.7676, test_loss: 0.9816, test_f1: 0.5573
 epoch: 51, train_loss: 0.7335, test_loss: 0.9672, test_f1: 0.5427
 epoch: 52, train_loss: 0.7401, test_loss: 0.9789, test_f1: 0.5434
 epoch: 53, train_loss: 0.7274, test_loss: 0.9798, test_f1: 0.5386
 epoch: 54, train_loss: 0.7103, test_loss: 1.0025, test_f1: 0.5515
 epoch: 55, train_loss: 0.7261, test_loss: 1.0088, test_f1: 0.5226
 epoch: 56, train_loss: 0.7097, test_loss: 0.9827, test_f1: 0.5490
 epoch: 57, train_loss: 0.7098, test_loss: 1.0484, test_f1: 0.5286
 epoch: 58, train_loss: 0.7275, test_loss: 1.0163, test_f1: 0.5460
 epoch: 59, train_loss: 0.7192, test_loss: 1.0562, test_f1: 0.5393
 epoch: 60, train_loss: 0.7087, test_loss: 1.0157, test_f1: 0.5233
 epoch: 61, train_loss: 0.7125, test_loss: 1.0063, test_f1: 0.5468
 epoch: 62, train_loss: 0.7059, test_loss: 1.0095, test_f1: 0.5412
 epoch: 63, train_loss: 0.7043, test_loss: 1.0179, test_f1: 0.5206
 epoch: 64, train_loss: 0.7071, test_loss: 1.0171, test_f1: 0.5402
 epoch: 65, train_loss: 0.7032, test_loss: 1.0590, test_f1: 0.5144
 epoch: 66, train_loss: 0.7061, test_loss: 1.0634, test_f1: 0.5828
 epoch: 67, train_loss: 0.6931, test_loss: 1.0454, test_f1: 0.5476
 epoch: 68, train_loss: 0.7351, test_loss: 1.0410, test_f1: 0.5507
 epoch: 69, train_loss: 0.7046, test_loss: 1.0844, test_f1: 0.5294
 epoch: 70, train_loss: 0.6976, test_loss: 1.0452, test_f1: 0.5667
 epoch: 71, train_loss: 0.6923, test_loss: 1.0396, test_f1: 0.5648
 epoch: 72, train_loss: 0.6971, test_loss: 1.0492, test_f1: 0.5354
 epoch: 73, train_loss: 0.6952, test_loss: 1.1561, test_f1: 0.5096
 epoch: 74, train_loss: 0.6947, test_loss: 1.0542, test_f1: 0.5529
 epoch: 75, train_loss: 0.6916, test_loss: 1.0877, test_f1: 0.5460
 epoch: 76, train_loss: 0.6889, test_loss: 1.1077, test_f1: 0.5180
 epoch: 77, train_loss: 0.6816, test_loss: 1.0394, test_f1: 0.5532
 epoch: 78, train_loss: 0.6835, test_loss: 1.0514, test_f1: 0.5407
 epoch: 79, train_loss: 0.6899, test_loss: 1.0587, test_f1: 0.5430
 epoch: 80, train_loss: 0.6791, test_loss: 1.0918, test_f1: 0.5246
 epoch: 81, train_loss: 0.6930, test_loss: 1.1309, test_f1: 0.5071
 epoch: 82, train_loss: 0.6764, test_loss: 1.0811, test_f1: 0.5283
 epoch: 83, train_loss: 0.6946, test_loss: 1.0580, test_f1: 0.5271
 epoch: 84, train_loss: 0.6845, test_loss: 1.0894, test_f1: 0.5472
 epoch: 85, train_loss: 0.6780, test_loss: 1.1508, test_f1: 0.5238
 epoch: 86, train_loss: 0.6771, test_loss: 1.1048, test_f1: 0.5505
 epoch: 87, train_loss: 0.6699, test_loss: 1.1558, test_f1: 0.5470
 epoch: 88, train_loss: 0.6934, test_loss: 1.1102, test_f1: 0.5881
 epoch: 89, train_loss: 0.6691, test_loss: 1.1001, test_f1: 0.5367
 epoch: 90, train_loss: 0.6838, test_loss: 1.1116, test_f1: 0.5716
 epoch: 91, train_loss: 0.6720, test_loss: 1.0760, test_f1: 0.5613
 epoch: 92, train_loss: 0.6506, test_loss: 1.1014, test_f1: 0.5651
 epoch: 93, train_loss: 0.6635, test_loss: 1.1224, test_f1: 0.5535
 epoch: 94, train_loss: 0.6614, test_loss: 1.1486, test_f1: 0.5501
 epoch: 95, train_loss: 0.6708, test_loss: 1.1974, test_f1: 0.5578
 epoch: 96, train_loss: 0.6584, test_loss: 1.1368, test_f1: 0.5374
 epoch: 97, train_loss: 0.6612, test_loss: 1.1486, test_f1: 0.5579
 epoch: 98, train_loss: 0.6682, test_loss: 1.2162, test_f1: 0.5306
 epoch: 99, train_loss: 0.6666, test_loss: 1.1740, test_f1: 0.5347
##################ITERATION #3 ****************************************
 epoch: 0, train_loss: 1.3551, test_loss: 1.3079, test_f1: 0.2281
 epoch: 1, train_loss: 1.1988, test_loss: 1.2957, test_f1: 0.2285
 epoch: 2, train_loss: 1.1652, test_loss: 1.2314, test_f1: 0.3154
 epoch: 3, train_loss: 1.1289, test_loss: 1.2033, test_f1: 0.3893
 epoch: 4, train_loss: 1.1011, test_loss: 1.1889, test_f1: 0.4078
 epoch: 5, train_loss: 1.0884, test_loss: 1.1686, test_f1: 0.4206
 epoch: 6, train_loss: 1.0781, test_loss: 1.1510, test_f1: 0.4513
 epoch: 7, train_loss: 1.0470, test_loss: 1.1532, test_f1: 0.4445
 epoch: 8, train_loss: 1.0458, test_loss: 1.1447, test_f1: 0.4531
 epoch: 9, train_loss: 1.0410, test_loss: 1.1381, test_f1: 0.4648
 epoch: 10, train_loss: 1.0172, test_loss: 1.1072, test_f1: 0.4856
 epoch: 11, train_loss: 0.9989, test_loss: 1.0879, test_f1: 0.4991
 epoch: 12, train_loss: 0.9985, test_loss: 1.1023, test_f1: 0.4973
 epoch: 13, train_loss: 0.9666, test_loss: 1.1098, test_f1: 0.4785
 epoch: 14, train_loss: 0.9694, test_loss: 1.0642, test_f1: 0.4863
 epoch: 15, train_loss: 0.9550, test_loss: 1.0530, test_f1: 0.5138
 epoch: 16, train_loss: 0.9407, test_loss: 1.0535, test_f1: 0.5322
 epoch: 17, train_loss: 0.9404, test_loss: 1.0684, test_f1: 0.5140
 epoch: 18, train_loss: 0.9309, test_loss: 1.0748, test_f1: 0.5117
 epoch: 19, train_loss: 0.9136, test_loss: 1.1176, test_f1: 0.5075
 epoch: 20, train_loss: 0.9182, test_loss: 1.0465, test_f1: 0.5250
 epoch: 21, train_loss: 0.9105, test_loss: 1.0449, test_f1: 0.5044
 epoch: 22, train_loss: 0.8990, test_loss: 1.0407, test_f1: 0.5231
 epoch: 23, train_loss: 0.9128, test_loss: 1.0355, test_f1: 0.5220
 epoch: 24, train_loss: 0.8909, test_loss: 1.0246, test_f1: 0.5274
 epoch: 25, train_loss: 0.9005, test_loss: 1.0619, test_f1: 0.5162
 epoch: 26, train_loss: 0.8977, test_loss: 1.0711, test_f1: 0.5410
 epoch: 27, train_loss: 0.8821, test_loss: 1.0995, test_f1: 0.5130
 epoch: 28, train_loss: 0.8772, test_loss: 1.0654, test_f1: 0.5405
 epoch: 29, train_loss: 0.8522, test_loss: 1.0587, test_f1: 0.5427
 epoch: 30, train_loss: 0.8813, test_loss: 1.0732, test_f1: 0.5211
 epoch: 31, train_loss: 0.8897, test_loss: 1.0229, test_f1: 0.5475
 epoch: 32, train_loss: 0.8527, test_loss: 1.0727, test_f1: 0.5425
 epoch: 33, train_loss: 0.8351, test_loss: 1.0572, test_f1: 0.5582
 epoch: 34, train_loss: 0.8452, test_loss: 1.0766, test_f1: 0.5497
 epoch: 35, train_loss: 0.8254, test_loss: 1.0979, test_f1: 0.5632
 epoch: 36, train_loss: 0.8474, test_loss: 1.0545, test_f1: 0.5434
 epoch: 37, train_loss: 0.8309, test_loss: 1.1002, test_f1: 0.5278
 epoch: 38, train_loss: 0.8249, test_loss: 1.1159, test_f1: 0.5445
 epoch: 39, train_loss: 0.8221, test_loss: 1.0644, test_f1: 0.5655
 epoch: 40, train_loss: 0.8316, test_loss: 1.0114, test_f1: 0.5755
 epoch: 41, train_loss: 0.8177, test_loss: 1.0986, test_f1: 0.5461
 epoch: 42, train_loss: 0.8416, test_loss: 1.0930, test_f1: 0.5650
 epoch: 43, train_loss: 0.8088, test_loss: 1.0758, test_f1: 0.5723
 epoch: 44, train_loss: 0.8036, test_loss: 1.0734, test_f1: 0.5579
 epoch: 45, train_loss: 0.7879, test_loss: 1.1481, test_f1: 0.5510
 epoch: 46, train_loss: 0.7960, test_loss: 1.0336, test_f1: 0.5718
 epoch: 47, train_loss: 0.8087, test_loss: 1.0998, test_f1: 0.5650
 epoch: 48, train_loss: 0.8051, test_loss: 1.0913, test_f1: 0.5854
 epoch: 49, train_loss: 0.8146, test_loss: 1.0825, test_f1: 0.5595
 epoch: 50, train_loss: 0.7960, test_loss: 1.0977, test_f1: 0.5976
 epoch: 51, train_loss: 0.7889, test_loss: 1.0441, test_f1: 0.5610
 epoch: 52, train_loss: 0.7793, test_loss: 1.0847, test_f1: 0.5632
 epoch: 53, train_loss: 0.7709, test_loss: 1.1349, test_f1: 0.5703
 epoch: 54, train_loss: 0.7786, test_loss: 1.1401, test_f1: 0.5781
 epoch: 55, train_loss: 0.7739, test_loss: 1.1262, test_f1: 0.5655
 epoch: 56, train_loss: 0.7657, test_loss: 1.1344, test_f1: 0.5578
 epoch: 57, train_loss: 0.7636, test_loss: 1.1199, test_f1: 0.5654
 epoch: 58, train_loss: 0.7593, test_loss: 1.1310, test_f1: 0.5628
 epoch: 59, train_loss: 0.7540, test_loss: 1.0962, test_f1: 0.5652
 epoch: 60, train_loss: 0.7542, test_loss: 1.1452, test_f1: 0.5720
 epoch: 61, train_loss: 0.7679, test_loss: 1.1093, test_f1: 0.5834
 epoch: 62, train_loss: 0.7622, test_loss: 1.0986, test_f1: 0.5666
 epoch: 63, train_loss: 0.7512, test_loss: 1.1169, test_f1: 0.5743
 epoch: 64, train_loss: 0.7604, test_loss: 1.1072, test_f1: 0.5799
 epoch: 65, train_loss: 0.7490, test_loss: 1.1287, test_f1: 0.5757
 epoch: 66, train_loss: 0.7575, test_loss: 1.1343, test_f1: 0.5724
 epoch: 67, train_loss: 0.7570, test_loss: 1.1055, test_f1: 0.5676
 epoch: 68, train_loss: 0.7800, test_loss: 1.1729, test_f1: 0.5759
 epoch: 69, train_loss: 0.7429, test_loss: 1.1413, test_f1: 0.5868
 epoch: 70, train_loss: 0.7380, test_loss: 1.1668, test_f1: 0.5568
 epoch: 71, train_loss: 0.7465, test_loss: 1.1649, test_f1: 0.5725
 epoch: 72, train_loss: 0.7484, test_loss: 1.1636, test_f1: 0.5783
 epoch: 73, train_loss: 0.7331, test_loss: 1.2013, test_f1: 0.5646
 epoch: 74, train_loss: 0.7371, test_loss: 1.1589, test_f1: 0.5576
 epoch: 75, train_loss: 0.7251, test_loss: 1.1451, test_f1: 0.5860
 epoch: 76, train_loss: 0.7411, test_loss: 1.1652, test_f1: 0.5669
 epoch: 77, train_loss: 0.7324, test_loss: 1.2002, test_f1: 0.5755
 epoch: 78, train_loss: 0.7292, test_loss: 1.1967, test_f1: 0.5681
 epoch: 79, train_loss: 0.7379, test_loss: 1.1942, test_f1: 0.5634
 epoch: 80, train_loss: 0.7343, test_loss: 1.1516, test_f1: 0.5670
 epoch: 81, train_loss: 0.7276, test_loss: 1.1666, test_f1: 0.5738
 epoch: 82, train_loss: 0.7360, test_loss: 1.1854, test_f1: 0.5669
 epoch: 83, train_loss: 0.7396, test_loss: 1.1654, test_f1: 0.5610
 epoch: 84, train_loss: 0.7383, test_loss: 1.1548, test_f1: 0.5571
 epoch: 85, train_loss: 0.7346, test_loss: 1.1957, test_f1: 0.5540
 epoch: 86, train_loss: 0.7405, test_loss: 1.2978, test_f1: 0.5638
 epoch: 87, train_loss: 0.7308, test_loss: 1.1742, test_f1: 0.5671
 epoch: 88, train_loss: 0.7203, test_loss: 1.1676, test_f1: 0.5666
 epoch: 89, train_loss: 0.7376, test_loss: 1.1925, test_f1: 0.5529
 epoch: 90, train_loss: 0.7251, test_loss: 1.2468, test_f1: 0.5654
 epoch: 91, train_loss: 0.7256, test_loss: 1.1562, test_f1: 0.5657
 epoch: 92, train_loss: 0.7150, test_loss: 1.1550, test_f1: 0.5614
 epoch: 93, train_loss: 0.7190, test_loss: 1.1454, test_f1: 0.5615
 epoch: 94, train_loss: 0.7274, test_loss: 1.1942, test_f1: 0.5661
 epoch: 95, train_loss: 0.7158, test_loss: 1.1745, test_f1: 0.5771
 epoch: 96, train_loss: 0.7090, test_loss: 1.2257, test_f1: 0.5651
 epoch: 97, train_loss: 0.7207, test_loss: 1.2239, test_f1: 0.5559
 epoch: 98, train_loss: 0.7104, test_loss: 1.2129, test_f1: 0.5820
 epoch: 99, train_loss: 0.7013, test_loss: 1.2666, test_f1: 0.5524
##################ITERATION #4 ****************************************
 epoch: 0, train_loss: 1.3531, test_loss: 1.3045, test_f1: 0.2281
 epoch: 1, train_loss: 1.2170, test_loss: 1.2549, test_f1: 0.2281
 epoch: 2, train_loss: 1.1539, test_loss: 1.2309, test_f1: 0.2921
 epoch: 3, train_loss: 1.1355, test_loss: 1.1923, test_f1: 0.3923
 epoch: 4, train_loss: 1.1110, test_loss: 1.1685, test_f1: 0.4502
 epoch: 5, train_loss: 1.0835, test_loss: 1.1358, test_f1: 0.4770
 epoch: 6, train_loss: 1.0628, test_loss: 1.1122, test_f1: 0.4799
 epoch: 7, train_loss: 1.0360, test_loss: 1.1146, test_f1: 0.4763
 epoch: 8, train_loss: 1.0134, test_loss: 1.0651, test_f1: 0.4991
 epoch: 9, train_loss: 1.0071, test_loss: 1.0842, test_f1: 0.4945
 epoch: 10, train_loss: 0.9777, test_loss: 1.0734, test_f1: 0.5087
 epoch: 11, train_loss: 0.9771, test_loss: 1.0598, test_f1: 0.5330
 epoch: 12, train_loss: 0.9477, test_loss: 1.0596, test_f1: 0.4855
 epoch: 13, train_loss: 0.9508, test_loss: 1.0637, test_f1: 0.5112
 epoch: 14, train_loss: 0.9307, test_loss: 1.0396, test_f1: 0.5217
 epoch: 15, train_loss: 0.9349, test_loss: 1.0903, test_f1: 0.4957
 epoch: 16, train_loss: 0.9238, test_loss: 1.0229, test_f1: 0.5342
 epoch: 17, train_loss: 0.9171, test_loss: 1.0567, test_f1: 0.5434
 epoch: 18, train_loss: 0.9074, test_loss: 1.0532, test_f1: 0.5376
 epoch: 19, train_loss: 0.9002, test_loss: 1.0486, test_f1: 0.5386
 epoch: 20, train_loss: 0.8669, test_loss: 1.0408, test_f1: 0.5378
 epoch: 21, train_loss: 0.8700, test_loss: 1.0778, test_f1: 0.5186
 epoch: 22, train_loss: 0.8624, test_loss: 1.1074, test_f1: 0.4804
 epoch: 23, train_loss: 0.8733, test_loss: 1.1041, test_f1: 0.5369
 epoch: 24, train_loss: 0.8439, test_loss: 1.0787, test_f1: 0.5161
 epoch: 25, train_loss: 0.8300, test_loss: 1.0483, test_f1: 0.5565
 epoch: 26, train_loss: 0.8256, test_loss: 1.1002, test_f1: 0.5106
 epoch: 27, train_loss: 0.8161, test_loss: 1.0855, test_f1: 0.5264
 epoch: 28, train_loss: 0.8198, test_loss: 1.0888, test_f1: 0.5081
 epoch: 29, train_loss: 0.8238, test_loss: 1.1832, test_f1: 0.4885
 epoch: 30, train_loss: 0.8303, test_loss: 1.1133, test_f1: 0.5182
 epoch: 31, train_loss: 0.8058, test_loss: 1.0810, test_f1: 0.5394
 epoch: 32, train_loss: 0.8076, test_loss: 1.1333, test_f1: 0.5277
 epoch: 33, train_loss: 0.8071, test_loss: 1.1131, test_f1: 0.5032
 epoch: 34, train_loss: 0.7932, test_loss: 1.1154, test_f1: 0.5153
 epoch: 35, train_loss: 0.7857, test_loss: 1.1136, test_f1: 0.5133
 epoch: 36, train_loss: 0.7676, test_loss: 1.2902, test_f1: 0.4894
 epoch: 37, train_loss: 0.7610, test_loss: 1.2411, test_f1: 0.4670
 epoch: 38, train_loss: 0.7864, test_loss: 1.1470, test_f1: 0.4873
 epoch: 39, train_loss: 0.7875, test_loss: 1.1241, test_f1: 0.5331
 epoch: 40, train_loss: 0.7699, test_loss: 1.2013, test_f1: 0.4801
 epoch: 41, train_loss: 0.7854, test_loss: 1.3849, test_f1: 0.4429
 epoch: 42, train_loss: 0.7681, test_loss: 1.1998, test_f1: 0.4830
 epoch: 43, train_loss: 0.7635, test_loss: 1.1151, test_f1: 0.5231
 epoch: 44, train_loss: 0.7658, test_loss: 1.0403, test_f1: 0.5404
 epoch: 45, train_loss: 0.7575, test_loss: 1.1492, test_f1: 0.5016
 epoch: 46, train_loss: 0.7639, test_loss: 1.1342, test_f1: 0.5342
 epoch: 47, train_loss: 0.7401, test_loss: 1.1175, test_f1: 0.4973
 epoch: 48, train_loss: 0.7463, test_loss: 1.2394, test_f1: 0.4619
 epoch: 49, train_loss: 0.7510, test_loss: 1.1128, test_f1: 0.5154
 epoch: 50, train_loss: 0.7363, test_loss: 1.3086, test_f1: 0.4475
 epoch: 51, train_loss: 0.7261, test_loss: 1.1291, test_f1: 0.5015
 epoch: 52, train_loss: 0.7180, test_loss: 1.1572, test_f1: 0.5095
 epoch: 53, train_loss: 0.7124, test_loss: 1.1922, test_f1: 0.5159
 epoch: 54, train_loss: 0.7069, test_loss: 1.2985, test_f1: 0.4742
 epoch: 55, train_loss: 0.7069, test_loss: 1.1858, test_f1: 0.5007
 epoch: 56, train_loss: 0.7127, test_loss: 1.2216, test_f1: 0.4796
 epoch: 57, train_loss: 0.7071, test_loss: 1.1320, test_f1: 0.5023
 epoch: 58, train_loss: 0.7206, test_loss: 1.1284, test_f1: 0.5385
 epoch: 59, train_loss: 0.7079, test_loss: 1.1872, test_f1: 0.4863
 epoch: 60, train_loss: 0.6997, test_loss: 1.1636, test_f1: 0.4933
 epoch: 61, train_loss: 0.6956, test_loss: 1.1486, test_f1: 0.5381
 epoch: 62, train_loss: 0.7054, test_loss: 1.1417, test_f1: 0.5295
 epoch: 63, train_loss: 0.7121, test_loss: 1.1978, test_f1: 0.5218
 epoch: 64, train_loss: 0.7071, test_loss: 1.1450, test_f1: 0.5302
 epoch: 65, train_loss: 0.6917, test_loss: 1.1732, test_f1: 0.5042
 epoch: 66, train_loss: 0.6899, test_loss: 1.2354, test_f1: 0.4981
 epoch: 67, train_loss: 0.7091, test_loss: 1.1785, test_f1: 0.5172
 epoch: 68, train_loss: 0.6961, test_loss: 1.1615, test_f1: 0.5500
 epoch: 69, train_loss: 0.6977, test_loss: 1.1723, test_f1: 0.5088
 epoch: 70, train_loss: 0.6920, test_loss: 1.1847, test_f1: 0.5165
 epoch: 71, train_loss: 0.6966, test_loss: 1.1517, test_f1: 0.5215
 epoch: 72, train_loss: 0.6968, test_loss: 1.2290, test_f1: 0.5034
 epoch: 73, train_loss: 0.7043, test_loss: 1.2333, test_f1: 0.5179
 epoch: 74, train_loss: 0.6919, test_loss: 1.1768, test_f1: 0.5338
 epoch: 75, train_loss: 0.6799, test_loss: 1.2342, test_f1: 0.5120
 epoch: 76, train_loss: 0.6879, test_loss: 1.1990, test_f1: 0.5277
 epoch: 77, train_loss: 0.6752, test_loss: 1.1988, test_f1: 0.5495
 epoch: 78, train_loss: 0.6908, test_loss: 1.1986, test_f1: 0.5088
 epoch: 79, train_loss: 0.6780, test_loss: 1.2262, test_f1: 0.5264
 epoch: 80, train_loss: 0.6929, test_loss: 1.2012, test_f1: 0.5229
 epoch: 81, train_loss: 0.6837, test_loss: 1.2290, test_f1: 0.5109
 epoch: 82, train_loss: 0.6850, test_loss: 1.2155, test_f1: 0.5060
 epoch: 83, train_loss: 0.6805, test_loss: 1.2707, test_f1: 0.5013
 epoch: 84, train_loss: 0.6694, test_loss: 1.2912, test_f1: 0.4969
 epoch: 85, train_loss: 0.7100, test_loss: 1.2030, test_f1: 0.5232
 epoch: 86, train_loss: 0.6811, test_loss: 1.3646, test_f1: 0.4908
 epoch: 87, train_loss: 0.6856, test_loss: 1.2359, test_f1: 0.4971
 epoch: 88, train_loss: 0.6838, test_loss: 1.2553, test_f1: 0.5456
 epoch: 89, train_loss: 0.6783, test_loss: 1.2456, test_f1: 0.5242
 epoch: 90, train_loss: 0.7054, test_loss: 1.1711, test_f1: 0.5233
 epoch: 91, train_loss: 0.6767, test_loss: 1.2315, test_f1: 0.5071
 epoch: 92, train_loss: 0.6642, test_loss: 1.2505, test_f1: 0.5048
 epoch: 93, train_loss: 0.6636, test_loss: 1.3517, test_f1: 0.5068
 epoch: 94, train_loss: 0.6660, test_loss: 1.1974, test_f1: 0.5183
 epoch: 95, train_loss: 0.6645, test_loss: 1.2672, test_f1: 0.5196
 epoch: 96, train_loss: 0.6580, test_loss: 1.2430, test_f1: 0.5219
 epoch: 97, train_loss: 0.6586, test_loss: 1.2533, test_f1: 0.5306
 epoch: 98, train_loss: 0.6708, test_loss: 1.2957, test_f1: 0.5388
 epoch: 99, train_loss: 0.6871, test_loss: 1.1877, test_f1: 0.5349
##################ITERATION #5 ****************************************
 epoch: 0, train_loss: 1.3829, test_loss: 1.3179, test_f1: 0.2281
 epoch: 1, train_loss: 1.1872, test_loss: 1.3119, test_f1: 0.2316
 epoch: 2, train_loss: 1.1293, test_loss: 1.2161, test_f1: 0.3394
 epoch: 3, train_loss: 1.0904, test_loss: 1.1203, test_f1: 0.3656
 epoch: 4, train_loss: 1.0476, test_loss: 1.0966, test_f1: 0.3825
 epoch: 5, train_loss: 1.0459, test_loss: 1.0848, test_f1: 0.4284
 epoch: 6, train_loss: 1.0177, test_loss: 1.0496, test_f1: 0.4689
 epoch: 7, train_loss: 1.0147, test_loss: 1.0663, test_f1: 0.4833
 epoch: 8, train_loss: 0.9665, test_loss: 1.0635, test_f1: 0.4757
 epoch: 9, train_loss: 0.9446, test_loss: 1.0428, test_f1: 0.4790
 epoch: 10, train_loss: 0.9442, test_loss: 0.9910, test_f1: 0.5178
 epoch: 11, train_loss: 0.9278, test_loss: 1.0330, test_f1: 0.5184
 epoch: 12, train_loss: 0.9106, test_loss: 1.0434, test_f1: 0.5377
 epoch: 13, train_loss: 0.8999, test_loss: 1.0074, test_f1: 0.5497
 epoch: 14, train_loss: 0.9070, test_loss: 1.0130, test_f1: 0.5406
 epoch: 15, train_loss: 0.9074, test_loss: 1.0797, test_f1: 0.4890
 epoch: 16, train_loss: 0.8834, test_loss: 1.2576, test_f1: 0.4207
 epoch: 17, train_loss: 0.8669, test_loss: 1.0293, test_f1: 0.5519
 epoch: 18, train_loss: 0.8571, test_loss: 1.0248, test_f1: 0.5538
 epoch: 19, train_loss: 0.8498, test_loss: 1.0049, test_f1: 0.5318
 epoch: 20, train_loss: 0.8491, test_loss: 1.0301, test_f1: 0.5613
 epoch: 21, train_loss: 0.8276, test_loss: 0.9983, test_f1: 0.5633
 epoch: 22, train_loss: 0.8214, test_loss: 1.0407, test_f1: 0.5421
 epoch: 23, train_loss: 0.8306, test_loss: 1.0642, test_f1: 0.5050
 epoch: 24, train_loss: 0.8163, test_loss: 1.0519, test_f1: 0.5387
 epoch: 25, train_loss: 0.8037, test_loss: 1.0391, test_f1: 0.5356
 epoch: 26, train_loss: 0.8332, test_loss: 1.0003, test_f1: 0.5482
 epoch: 27, train_loss: 0.8077, test_loss: 1.0563, test_f1: 0.5368
 epoch: 28, train_loss: 0.7974, test_loss: 1.0966, test_f1: 0.5452
 epoch: 29, train_loss: 0.8049, test_loss: 1.0043, test_f1: 0.5981
 epoch: 30, train_loss: 0.8058, test_loss: 1.1162, test_f1: 0.5446
 epoch: 31, train_loss: 0.7944, test_loss: 1.2207, test_f1: 0.5177
 epoch: 32, train_loss: 0.7872, test_loss: 1.0501, test_f1: 0.5517
 epoch: 33, train_loss: 0.7825, test_loss: 1.1733, test_f1: 0.5786
 epoch: 34, train_loss: 0.8125, test_loss: 1.1403, test_f1: 0.5598
 epoch: 35, train_loss: 0.7979, test_loss: 1.0334, test_f1: 0.5662
 epoch: 36, train_loss: 0.7644, test_loss: 1.0285, test_f1: 0.5816
 epoch: 37, train_loss: 0.7734, test_loss: 1.0252, test_f1: 0.5968
 epoch: 38, train_loss: 0.7569, test_loss: 1.0744, test_f1: 0.5552
 epoch: 39, train_loss: 0.7624, test_loss: 1.0718, test_f1: 0.5542
 epoch: 40, train_loss: 0.7473, test_loss: 1.0681, test_f1: 0.5871
 epoch: 41, train_loss: 0.7552, test_loss: 1.0398, test_f1: 0.6099
 epoch: 42, train_loss: 0.7399, test_loss: 1.0774, test_f1: 0.5986
 epoch: 43, train_loss: 0.7472, test_loss: 1.1878, test_f1: 0.5167
 epoch: 44, train_loss: 0.7392, test_loss: 1.1360, test_f1: 0.5821
 epoch: 45, train_loss: 0.7328, test_loss: 1.0400, test_f1: 0.5896
 epoch: 46, train_loss: 0.7341, test_loss: 1.0644, test_f1: 0.6172
 epoch: 47, train_loss: 0.7358, test_loss: 1.0622, test_f1: 0.6012
 epoch: 48, train_loss: 0.7318, test_loss: 1.1766, test_f1: 0.5393
 epoch: 49, train_loss: 0.7222, test_loss: 1.5060, test_f1: 0.5303
 epoch: 50, train_loss: 0.7186, test_loss: 1.1128, test_f1: 0.5630
 epoch: 51, train_loss: 0.7062, test_loss: 1.1267, test_f1: 0.5790
 epoch: 52, train_loss: 0.7047, test_loss: 1.1513, test_f1: 0.5812
 epoch: 53, train_loss: 0.7015, test_loss: 1.1022, test_f1: 0.5833
 epoch: 54, train_loss: 0.6966, test_loss: 1.2484, test_f1: 0.5698
 epoch: 55, train_loss: 0.7073, test_loss: 1.1618, test_f1: 0.5766
 epoch: 56, train_loss: 0.7007, test_loss: 1.1212, test_f1: 0.6012
 epoch: 57, train_loss: 0.6981, test_loss: 1.1602, test_f1: 0.5729
 epoch: 58, train_loss: 0.6736, test_loss: 1.1164, test_f1: 0.5860
 epoch: 59, train_loss: 0.6995, test_loss: 1.1915, test_f1: 0.5723
 epoch: 60, train_loss: 0.6925, test_loss: 1.0737, test_f1: 0.6150
 epoch: 61, train_loss: 0.6842, test_loss: 1.0987, test_f1: 0.5666
 epoch: 62, train_loss: 0.7043, test_loss: 1.1023, test_f1: 0.6141
 epoch: 63, train_loss: 0.6864, test_loss: 1.1605, test_f1: 0.5645
 epoch: 64, train_loss: 0.7020, test_loss: 1.2505, test_f1: 0.5736
 epoch: 65, train_loss: 0.6904, test_loss: 1.2683, test_f1: 0.5857
 epoch: 66, train_loss: 0.6795, test_loss: 1.3494, test_f1: 0.5931
 epoch: 67, train_loss: 0.6703, test_loss: 1.4105, test_f1: 0.5712
 epoch: 68, train_loss: 0.6741, test_loss: 1.2613, test_f1: 0.5954
 epoch: 69, train_loss: 0.6781, test_loss: 1.3481, test_f1: 0.5905
 epoch: 70, train_loss: 0.6837, test_loss: 1.2306, test_f1: 0.5828
 epoch: 71, train_loss: 0.6793, test_loss: 1.3788, test_f1: 0.5698
 epoch: 72, train_loss: 0.6757, test_loss: 1.2243, test_f1: 0.6044
 epoch: 73, train_loss: 0.6739, test_loss: 1.2917, test_f1: 0.5907
 epoch: 74, train_loss: 0.6666, test_loss: 1.2669, test_f1: 0.5764
 epoch: 75, train_loss: 0.6668, test_loss: 1.2754, test_f1: 0.5846
 epoch: 76, train_loss: 0.6709, test_loss: 1.2448, test_f1: 0.5915
 epoch: 77, train_loss: 0.6783, test_loss: 1.1786, test_f1: 0.5863
 epoch: 78, train_loss: 0.6698, test_loss: 1.2378, test_f1: 0.5854
 epoch: 79, train_loss: 0.6625, test_loss: 1.3033, test_f1: 0.5751
 epoch: 80, train_loss: 0.6571, test_loss: 1.4298, test_f1: 0.5757
 epoch: 81, train_loss: 0.6750, test_loss: 1.2760, test_f1: 0.5934
 epoch: 82, train_loss: 0.6508, test_loss: 1.2293, test_f1: 0.5682
 epoch: 83, train_loss: 0.6526, test_loss: 1.3036, test_f1: 0.5838
 epoch: 84, train_loss: 0.6518, test_loss: 1.3513, test_f1: 0.5802
 epoch: 85, train_loss: 0.6349, test_loss: 1.2700, test_f1: 0.6248
 epoch: 86, train_loss: 0.6654, test_loss: 1.6451, test_f1: 0.5270
 epoch: 87, train_loss: 0.6594, test_loss: 1.2380, test_f1: 0.6349
 epoch: 88, train_loss: 0.6528, test_loss: 1.4353, test_f1: 0.5796
 epoch: 89, train_loss: 0.6634, test_loss: 1.3258, test_f1: 0.5826
 epoch: 90, train_loss: 0.6591, test_loss: 1.3566, test_f1: 0.5557
 epoch: 91, train_loss: 0.6651, test_loss: 1.4238, test_f1: 0.5655
 epoch: 92, train_loss: 0.6721, test_loss: 1.2335, test_f1: 0.5973
 epoch: 93, train_loss: 0.6679, test_loss: 1.1935, test_f1: 0.5970
 epoch: 94, train_loss: 0.6639, test_loss: 1.2613, test_f1: 0.5723
 epoch: 95, train_loss: 0.6526, test_loss: 1.2453, test_f1: 0.6136
 epoch: 96, train_loss: 0.6600, test_loss: 1.2668, test_f1: 0.5893
 epoch: 97, train_loss: 0.6455, test_loss: 1.3786, test_f1: 0.5905
 epoch: 98, train_loss: 0.6305, test_loss: 1.2506, test_f1: 0.6161
 epoch: 99, train_loss: 0.6477, test_loss: 1.2557, test_f1: 0.6199
##################ITERATION #6 ****************************************
 epoch: 0, train_loss: 1.3189, test_loss: 1.2973, test_f1: 0.2281
 epoch: 1, train_loss: 1.1996, test_loss: 1.2812, test_f1: 0.2281
 epoch: 2, train_loss: 1.1873, test_loss: 1.2420, test_f1: 0.2728
 epoch: 3, train_loss: 1.1654, test_loss: 1.2247, test_f1: 0.3676
 epoch: 4, train_loss: 1.1321, test_loss: 1.2072, test_f1: 0.3835
 epoch: 5, train_loss: 1.1034, test_loss: 1.1759, test_f1: 0.3796
 epoch: 6, train_loss: 1.0760, test_loss: 1.1514, test_f1: 0.3620
 epoch: 7, train_loss: 1.0483, test_loss: 1.1224, test_f1: 0.3812
 epoch: 8, train_loss: 1.0190, test_loss: 1.1349, test_f1: 0.3962
 epoch: 9, train_loss: 1.0201, test_loss: 1.1272, test_f1: 0.4763
 epoch: 10, train_loss: 1.0073, test_loss: 1.0937, test_f1: 0.4258
 epoch: 11, train_loss: 0.9807, test_loss: 1.0783, test_f1: 0.5184
 epoch: 12, train_loss: 0.9665, test_loss: 1.0850, test_f1: 0.5260
 epoch: 13, train_loss: 0.9763, test_loss: 1.0646, test_f1: 0.5318
 epoch: 14, train_loss: 0.9508, test_loss: 1.0575, test_f1: 0.5299
 epoch: 15, train_loss: 0.9399, test_loss: 1.0800, test_f1: 0.5176
 epoch: 16, train_loss: 0.9272, test_loss: 1.0301, test_f1: 0.5600
 epoch: 17, train_loss: 0.9055, test_loss: 1.0809, test_f1: 0.4714
 epoch: 18, train_loss: 0.9073, test_loss: 1.0891, test_f1: 0.4680
 epoch: 19, train_loss: 0.8928, test_loss: 1.0578, test_f1: 0.4734
 epoch: 20, train_loss: 0.8778, test_loss: 1.0687, test_f1: 0.5521
 epoch: 21, train_loss: 0.8671, test_loss: 1.1674, test_f1: 0.4169
 epoch: 22, train_loss: 0.8634, test_loss: 1.0957, test_f1: 0.5314
 epoch: 23, train_loss: 0.8607, test_loss: 1.0606, test_f1: 0.4834
 epoch: 24, train_loss: 0.8512, test_loss: 1.0531, test_f1: 0.5186
 epoch: 25, train_loss: 0.8433, test_loss: 1.0270, test_f1: 0.5393
 epoch: 26, train_loss: 0.8252, test_loss: 1.0263, test_f1: 0.5843
 epoch: 27, train_loss: 0.8340, test_loss: 1.0886, test_f1: 0.4889
 epoch: 28, train_loss: 0.8197, test_loss: 1.0195, test_f1: 0.5553
 epoch: 29, train_loss: 0.8026, test_loss: 1.0317, test_f1: 0.5389
 epoch: 30, train_loss: 0.8026, test_loss: 1.0223, test_f1: 0.5702
 epoch: 31, train_loss: 0.7942, test_loss: 0.9793, test_f1: 0.5534
 epoch: 32, train_loss: 0.7752, test_loss: 1.0406, test_f1: 0.5439
 epoch: 33, train_loss: 0.7661, test_loss: 1.0636, test_f1: 0.5447
 epoch: 34, train_loss: 0.7651, test_loss: 1.0327, test_f1: 0.5666
 epoch: 35, train_loss: 0.7773, test_loss: 0.9984, test_f1: 0.5375
 epoch: 36, train_loss: 0.7598, test_loss: 1.0441, test_f1: 0.5245
 epoch: 37, train_loss: 0.7730, test_loss: 1.1131, test_f1: 0.5689
 epoch: 38, train_loss: 0.7588, test_loss: 1.1662, test_f1: 0.5244
 epoch: 39, train_loss: 0.7678, test_loss: 1.1532, test_f1: 0.5171
 epoch: 40, train_loss: 0.7531, test_loss: 1.1930, test_f1: 0.5469
 epoch: 41, train_loss: 0.7479, test_loss: 1.2945, test_f1: 0.5248
 epoch: 42, train_loss: 0.7721, test_loss: 1.1224, test_f1: 0.5656
 epoch: 43, train_loss: 0.7454, test_loss: 1.1655, test_f1: 0.5828
 epoch: 44, train_loss: 0.7470, test_loss: 1.3299, test_f1: 0.5314
 epoch: 45, train_loss: 0.7337, test_loss: 1.2315, test_f1: 0.5666
 epoch: 46, train_loss: 0.7348, test_loss: 1.2269, test_f1: 0.5587
 epoch: 47, train_loss: 0.7360, test_loss: 1.2383, test_f1: 0.5481
 epoch: 48, train_loss: 0.7240, test_loss: 1.1586, test_f1: 0.5746
 epoch: 49, train_loss: 0.7340, test_loss: 1.2398, test_f1: 0.5505
 epoch: 50, train_loss: 0.7388, test_loss: 1.3540, test_f1: 0.5289
 epoch: 51, train_loss: 0.7077, test_loss: 1.2419, test_f1: 0.5483
 epoch: 52, train_loss: 0.7080, test_loss: 1.2040, test_f1: 0.5610
 epoch: 53, train_loss: 0.6972, test_loss: 1.2728, test_f1: 0.5466
 epoch: 54, train_loss: 0.6973, test_loss: 1.2403, test_f1: 0.5593
 epoch: 55, train_loss: 0.6956, test_loss: 1.3100, test_f1: 0.5491
 epoch: 56, train_loss: 0.6837, test_loss: 1.2823, test_f1: 0.5723
 epoch: 57, train_loss: 0.6780, test_loss: 1.3546, test_f1: 0.5183
 epoch: 58, train_loss: 0.7115, test_loss: 1.2435, test_f1: 0.5534
 epoch: 59, train_loss: 0.6774, test_loss: 1.2790, test_f1: 0.5558
 epoch: 60, train_loss: 0.6915, test_loss: 1.2174, test_f1: 0.5747
 epoch: 61, train_loss: 0.6898, test_loss: 1.2889, test_f1: 0.5573
 epoch: 62, train_loss: 0.6803, test_loss: 1.2951, test_f1: 0.5581
 epoch: 63, train_loss: 0.6749, test_loss: 1.2995, test_f1: 0.5774
 epoch: 64, train_loss: 0.6724, test_loss: 1.3318, test_f1: 0.5642
 epoch: 65, train_loss: 0.6816, test_loss: 1.3115, test_f1: 0.5749
 epoch: 66, train_loss: 0.6731, test_loss: 1.3480, test_f1: 0.5580
 epoch: 67, train_loss: 0.6877, test_loss: 1.3299, test_f1: 0.5675
 epoch: 68, train_loss: 0.6840, test_loss: 1.3074, test_f1: 0.5731
 epoch: 69, train_loss: 0.6711, test_loss: 1.2839, test_f1: 0.5670
 epoch: 70, train_loss: 0.6660, test_loss: 1.4364, test_f1: 0.5545
 epoch: 71, train_loss: 0.6612, test_loss: 1.2767, test_f1: 0.5897
 epoch: 72, train_loss: 0.6678, test_loss: 1.3190, test_f1: 0.5673
 epoch: 73, train_loss: 0.6671, test_loss: 1.3180, test_f1: 0.5879
 epoch: 74, train_loss: 0.6661, test_loss: 1.3299, test_f1: 0.5788
 epoch: 75, train_loss: 0.6649, test_loss: 1.3422, test_f1: 0.5710
 epoch: 76, train_loss: 0.6607, test_loss: 1.3282, test_f1: 0.5670
 epoch: 77, train_loss: 0.6694, test_loss: 1.4020, test_f1: 0.5392
 epoch: 78, train_loss: 0.6760, test_loss: 1.4002, test_f1: 0.5582
 epoch: 79, train_loss: 0.6504, test_loss: 1.3344, test_f1: 0.5678
 epoch: 80, train_loss: 0.6595, test_loss: 1.3235, test_f1: 0.5614
 epoch: 81, train_loss: 0.6686, test_loss: 1.3934, test_f1: 0.5913
 epoch: 82, train_loss: 0.6503, test_loss: 1.3046, test_f1: 0.5976
 epoch: 83, train_loss: 0.6640, test_loss: 1.4357, test_f1: 0.5525
 epoch: 84, train_loss: 0.6578, test_loss: 1.4151, test_f1: 0.5656
 epoch: 85, train_loss: 0.6532, test_loss: 1.2880, test_f1: 0.5986
 epoch: 86, train_loss: 0.6514, test_loss: 1.4437, test_f1: 0.5547
 epoch: 87, train_loss: 0.6559, test_loss: 1.4347, test_f1: 0.5549
 epoch: 88, train_loss: 0.6422, test_loss: 1.4281, test_f1: 0.5719
 epoch: 89, train_loss: 0.6509, test_loss: 1.4530, test_f1: 0.5707
 epoch: 90, train_loss: 0.6410, test_loss: 1.4559, test_f1: 0.5451
 epoch: 91, train_loss: 0.6421, test_loss: 1.4513, test_f1: 0.5594
 epoch: 92, train_loss: 0.6525, test_loss: 1.4752, test_f1: 0.5710
 epoch: 93, train_loss: 0.6410, test_loss: 1.4647, test_f1: 0.5710
 epoch: 94, train_loss: 0.6537, test_loss: 1.4316, test_f1: 0.5556
 epoch: 95, train_loss: 0.6428, test_loss: 1.4283, test_f1: 0.5681
 epoch: 96, train_loss: 0.6331, test_loss: 1.4630, test_f1: 0.5437
 epoch: 97, train_loss: 0.6438, test_loss: 1.4027, test_f1: 0.5839
 epoch: 98, train_loss: 0.6451, test_loss: 1.4321, test_f1: 0.5601
 epoch: 99, train_loss: 0.6448, test_loss: 1.3834, test_f1: 0.5605
##################ITERATION #7 ****************************************
 epoch: 0, train_loss: 1.4816, test_loss: 1.3864, test_f1: 0.2281
 epoch: 1, train_loss: 1.1998, test_loss: 1.3312, test_f1: 0.2685
 epoch: 2, train_loss: 1.1257, test_loss: 1.1515, test_f1: 0.4151
 epoch: 3, train_loss: 1.0743, test_loss: 1.1188, test_f1: 0.4360
 epoch: 4, train_loss: 1.0513, test_loss: 1.1031, test_f1: 0.5003
 epoch: 5, train_loss: 1.0217, test_loss: 1.0870, test_f1: 0.5155
 epoch: 6, train_loss: 1.0159, test_loss: 1.0758, test_f1: 0.4920
 epoch: 7, train_loss: 0.9911, test_loss: 1.0752, test_f1: 0.4933
 epoch: 8, train_loss: 0.9805, test_loss: 1.0606, test_f1: 0.5189
 epoch: 9, train_loss: 0.9813, test_loss: 1.1042, test_f1: 0.4820
 epoch: 10, train_loss: 0.9764, test_loss: 1.0404, test_f1: 0.5121
 epoch: 11, train_loss: 0.9667, test_loss: 1.0530, test_f1: 0.5083
 epoch: 12, train_loss: 0.9453, test_loss: 1.0274, test_f1: 0.5381
 epoch: 13, train_loss: 0.9447, test_loss: 1.0104, test_f1: 0.5090
 epoch: 14, train_loss: 0.9225, test_loss: 1.0177, test_f1: 0.5142
 epoch: 15, train_loss: 0.9262, test_loss: 1.0461, test_f1: 0.4948
 epoch: 16, train_loss: 0.8942, test_loss: 1.0394, test_f1: 0.5259
 epoch: 17, train_loss: 0.8983, test_loss: 1.0691, test_f1: 0.4990
 epoch: 18, train_loss: 0.8814, test_loss: 1.0007, test_f1: 0.5460
 epoch: 19, train_loss: 0.8982, test_loss: 1.0177, test_f1: 0.5473
 epoch: 20, train_loss: 0.8940, test_loss: 1.0323, test_f1: 0.5242
 epoch: 21, train_loss: 0.8703, test_loss: 1.0942, test_f1: 0.4886
 epoch: 22, train_loss: 0.8576, test_loss: 1.0576, test_f1: 0.5276
 epoch: 23, train_loss: 0.8686, test_loss: 1.0017, test_f1: 0.5494
 epoch: 24, train_loss: 0.8439, test_loss: 1.0806, test_f1: 0.5364
 epoch: 25, train_loss: 0.8554, test_loss: 1.0229, test_f1: 0.5423
 epoch: 26, train_loss: 0.8514, test_loss: 1.0593, test_f1: 0.5457
 epoch: 27, train_loss: 0.8432, test_loss: 1.0303, test_f1: 0.5637
 epoch: 28, train_loss: 0.8265, test_loss: 1.0379, test_f1: 0.5522
 epoch: 29, train_loss: 0.8410, test_loss: 1.0370, test_f1: 0.5845
 epoch: 30, train_loss: 0.8128, test_loss: 1.0996, test_f1: 0.5632
 epoch: 31, train_loss: 0.8054, test_loss: 1.0132, test_f1: 0.5588
 epoch: 32, train_loss: 0.8222, test_loss: 1.0460, test_f1: 0.5748
 epoch: 33, train_loss: 0.8087, test_loss: 1.0356, test_f1: 0.5756
 epoch: 34, train_loss: 0.7955, test_loss: 1.0685, test_f1: 0.5675
 epoch: 35, train_loss: 0.7867, test_loss: 1.0524, test_f1: 0.5743
 epoch: 36, train_loss: 0.7835, test_loss: 1.0527, test_f1: 0.5717
 epoch: 37, train_loss: 0.7850, test_loss: 1.0623, test_f1: 0.5692
 epoch: 38, train_loss: 0.7819, test_loss: 1.0484, test_f1: 0.5816
 epoch: 39, train_loss: 0.7639, test_loss: 1.0757, test_f1: 0.5679
 epoch: 40, train_loss: 0.7819, test_loss: 1.1012, test_f1: 0.5755
 epoch: 41, train_loss: 0.7646, test_loss: 1.0460, test_f1: 0.5726
 epoch: 42, train_loss: 0.7589, test_loss: 1.2183, test_f1: 0.5317
 epoch: 43, train_loss: 0.7666, test_loss: 1.0764, test_f1: 0.5730
 epoch: 44, train_loss: 0.7539, test_loss: 1.1247, test_f1: 0.5943
 epoch: 45, train_loss: 0.7525, test_loss: 1.0463, test_f1: 0.6037
 epoch: 46, train_loss: 0.7504, test_loss: 1.0743, test_f1: 0.5942
 epoch: 47, train_loss: 0.7579, test_loss: 1.2498, test_f1: 0.4854
 epoch: 48, train_loss: 0.7541, test_loss: 1.0992, test_f1: 0.5959
 epoch: 49, train_loss: 0.7508, test_loss: 1.1182, test_f1: 0.5717
 epoch: 50, train_loss: 0.7409, test_loss: 1.1104, test_f1: 0.6203
 epoch: 51, train_loss: 0.7303, test_loss: 1.1169, test_f1: 0.6199
 epoch: 52, train_loss: 0.7233, test_loss: 1.0657, test_f1: 0.5955
 epoch: 53, train_loss: 0.7162, test_loss: 1.1696, test_f1: 0.5943
 epoch: 54, train_loss: 0.7328, test_loss: 1.1137, test_f1: 0.6051
 epoch: 55, train_loss: 0.7150, test_loss: 1.0735, test_f1: 0.6142
 epoch: 56, train_loss: 0.7073, test_loss: 1.1250, test_f1: 0.6177
 epoch: 57, train_loss: 0.7163, test_loss: 1.1656, test_f1: 0.6005
 epoch: 58, train_loss: 0.7086, test_loss: 1.0893, test_f1: 0.6190
 epoch: 59, train_loss: 0.7059, test_loss: 1.1134, test_f1: 0.6226
 epoch: 60, train_loss: 0.7058, test_loss: 1.2302, test_f1: 0.5961
 epoch: 61, train_loss: 0.6997, test_loss: 1.1327, test_f1: 0.6147
 epoch: 62, train_loss: 0.7042, test_loss: 1.1911, test_f1: 0.5819
 epoch: 63, train_loss: 0.6986, test_loss: 1.1603, test_f1: 0.6119
 epoch: 64, train_loss: 0.6891, test_loss: 1.1569, test_f1: 0.5944
 epoch: 65, train_loss: 0.7025, test_loss: 1.1282, test_f1: 0.6296
 epoch: 66, train_loss: 0.6849, test_loss: 1.2757, test_f1: 0.6024
 epoch: 67, train_loss: 0.6825, test_loss: 1.1742, test_f1: 0.6005
 epoch: 68, train_loss: 0.6833, test_loss: 1.1844, test_f1: 0.5868
 epoch: 69, train_loss: 0.6952, test_loss: 1.1818, test_f1: 0.6242
 epoch: 70, train_loss: 0.6987, test_loss: 1.2489, test_f1: 0.5894
 epoch: 71, train_loss: 0.6851, test_loss: 1.2238, test_f1: 0.5917
 epoch: 72, train_loss: 0.6964, test_loss: 1.1786, test_f1: 0.6256
 epoch: 73, train_loss: 0.6870, test_loss: 1.2536, test_f1: 0.5961
 epoch: 74, train_loss: 0.6890, test_loss: 1.2478, test_f1: 0.6147
 epoch: 75, train_loss: 0.6742, test_loss: 1.3154, test_f1: 0.5769
 epoch: 76, train_loss: 0.6685, test_loss: 1.2179, test_f1: 0.5936
 epoch: 77, train_loss: 0.6995, test_loss: 1.3388, test_f1: 0.5849
 epoch: 78, train_loss: 0.6954, test_loss: 1.2326, test_f1: 0.6108
 epoch: 79, train_loss: 0.6796, test_loss: 1.2786, test_f1: 0.6017
 epoch: 80, train_loss: 0.6613, test_loss: 1.2330, test_f1: 0.6146
 epoch: 81, train_loss: 0.6578, test_loss: 1.3472, test_f1: 0.5915
 epoch: 82, train_loss: 0.6731, test_loss: 1.3413, test_f1: 0.6063
 epoch: 83, train_loss: 0.6862, test_loss: 1.2155, test_f1: 0.6101
 epoch: 84, train_loss: 0.6723, test_loss: 1.3681, test_f1: 0.5572
 epoch: 85, train_loss: 0.6694, test_loss: 1.2482, test_f1: 0.6066
 epoch: 86, train_loss: 0.6440, test_loss: 1.3370, test_f1: 0.5941
 epoch: 87, train_loss: 0.6467, test_loss: 1.3011, test_f1: 0.6068
 epoch: 88, train_loss: 0.6729, test_loss: 1.3933, test_f1: 0.5959
 epoch: 89, train_loss: 0.6798, test_loss: 1.3081, test_f1: 0.5856
 epoch: 90, train_loss: 0.6725, test_loss: 1.3015, test_f1: 0.5886
 epoch: 91, train_loss: 0.6536, test_loss: 1.3301, test_f1: 0.6029
 epoch: 92, train_loss: 0.6410, test_loss: 1.3287, test_f1: 0.5914
 epoch: 93, train_loss: 0.6635, test_loss: 1.2734, test_f1: 0.5872
 epoch: 94, train_loss: 0.6478, test_loss: 1.4179, test_f1: 0.6193
 epoch: 95, train_loss: 0.6712, test_loss: 1.4061, test_f1: 0.5702
 epoch: 96, train_loss: 0.6570, test_loss: 1.4194, test_f1: 0.5731
 epoch: 97, train_loss: 0.6474, test_loss: 1.3469, test_f1: 0.5774
 epoch: 98, train_loss: 0.6550, test_loss: 1.3600, test_f1: 0.5950
 epoch: 99, train_loss: 0.6406, test_loss: 1.4042, test_f1: 0.6022
##################ITERATION #8 ****************************************
 epoch: 0, train_loss: 1.4707, test_loss: 1.4123, test_f1: 0.2281
 epoch: 1, train_loss: 1.2389, test_loss: 1.3494, test_f1: 0.2545
 epoch: 2, train_loss: 1.1791, test_loss: 1.2878, test_f1: 0.2909
 epoch: 3, train_loss: 1.1439, test_loss: 1.2048, test_f1: 0.3906
 epoch: 4, train_loss: 1.1113, test_loss: 1.2092, test_f1: 0.4361
 epoch: 5, train_loss: 1.0836, test_loss: 1.1830, test_f1: 0.4532
 epoch: 6, train_loss: 1.0770, test_loss: 1.1466, test_f1: 0.4860
 epoch: 7, train_loss: 1.0566, test_loss: 1.1464, test_f1: 0.4826
 epoch: 8, train_loss: 1.0410, test_loss: 1.1111, test_f1: 0.4728
 epoch: 9, train_loss: 1.0251, test_loss: 1.0862, test_f1: 0.4687
 epoch: 10, train_loss: 1.0226, test_loss: 1.0945, test_f1: 0.5123
 epoch: 11, train_loss: 0.9900, test_loss: 1.1040, test_f1: 0.4739
 epoch: 12, train_loss: 0.9948, test_loss: 1.0705, test_f1: 0.5484
 epoch: 13, train_loss: 0.9832, test_loss: 1.0877, test_f1: 0.4607
 epoch: 14, train_loss: 0.9784, test_loss: 1.0629, test_f1: 0.5307
 epoch: 15, train_loss: 0.9494, test_loss: 1.0433, test_f1: 0.5687
 epoch: 16, train_loss: 0.9585, test_loss: 1.0365, test_f1: 0.5799
 epoch: 17, train_loss: 0.9261, test_loss: 1.0315, test_f1: 0.5563
 epoch: 18, train_loss: 0.9257, test_loss: 1.0506, test_f1: 0.5195
 epoch: 19, train_loss: 0.9066, test_loss: 1.0443, test_f1: 0.5521
 epoch: 20, train_loss: 0.8997, test_loss: 1.0285, test_f1: 0.5548
 epoch: 21, train_loss: 0.9174, test_loss: 1.0495, test_f1: 0.5349
 epoch: 22, train_loss: 0.8983, test_loss: 1.0322, test_f1: 0.5593
 epoch: 23, train_loss: 0.8915, test_loss: 1.0403, test_f1: 0.5497
 epoch: 24, train_loss: 0.8746, test_loss: 1.0502, test_f1: 0.5410
 epoch: 25, train_loss: 0.8602, test_loss: 1.0186, test_f1: 0.5025
 epoch: 26, train_loss: 0.8579, test_loss: 1.0438, test_f1: 0.5717
 epoch: 27, train_loss: 0.8424, test_loss: 0.9836, test_f1: 0.5952
 epoch: 28, train_loss: 0.8440, test_loss: 1.0175, test_f1: 0.5789
 epoch: 29, train_loss: 0.8708, test_loss: 1.0270, test_f1: 0.5448
 epoch: 30, train_loss: 0.8518, test_loss: 1.1187, test_f1: 0.5016
 epoch: 31, train_loss: 0.8300, test_loss: 1.0418, test_f1: 0.5452
 epoch: 32, train_loss: 0.8294, test_loss: 1.0440, test_f1: 0.5598
 epoch: 33, train_loss: 0.8271, test_loss: 1.1253, test_f1: 0.4910
 epoch: 34, train_loss: 0.8251, test_loss: 1.0326, test_f1: 0.5667
 epoch: 35, train_loss: 0.7977, test_loss: 1.0249, test_f1: 0.5695
 epoch: 36, train_loss: 0.7834, test_loss: 1.0228, test_f1: 0.5810
 epoch: 37, train_loss: 0.7877, test_loss: 1.0498, test_f1: 0.5633
 epoch: 38, train_loss: 0.8005, test_loss: 1.1458, test_f1: 0.4925
 epoch: 39, train_loss: 0.8048, test_loss: 1.0335, test_f1: 0.5581
 epoch: 40, train_loss: 0.8078, test_loss: 1.1021, test_f1: 0.5553
 epoch: 41, train_loss: 0.7790, test_loss: 1.0711, test_f1: 0.5502
 epoch: 42, train_loss: 0.7653, test_loss: 1.1083, test_f1: 0.5235
 epoch: 43, train_loss: 0.7739, test_loss: 1.1086, test_f1: 0.5175
 epoch: 44, train_loss: 0.7894, test_loss: 1.0573, test_f1: 0.5265
 epoch: 45, train_loss: 0.7720, test_loss: 1.0388, test_f1: 0.5381
 epoch: 46, train_loss: 0.7777, test_loss: 1.0475, test_f1: 0.5345
 epoch: 47, train_loss: 0.7736, test_loss: 1.0334, test_f1: 0.5279
 epoch: 48, train_loss: 0.7650, test_loss: 1.0566, test_f1: 0.5414
 epoch: 49, train_loss: 0.7664, test_loss: 1.0494, test_f1: 0.5506
 epoch: 50, train_loss: 0.7438, test_loss: 1.0594, test_f1: 0.5579
 epoch: 51, train_loss: 0.7327, test_loss: 1.0797, test_f1: 0.5545
 epoch: 52, train_loss: 0.7226, test_loss: 1.0906, test_f1: 0.5575
 epoch: 53, train_loss: 0.7475, test_loss: 1.0524, test_f1: 0.5478
 epoch: 54, train_loss: 0.7363, test_loss: 1.1236, test_f1: 0.5402
 epoch: 55, train_loss: 0.7362, test_loss: 1.1161, test_f1: 0.5267
 epoch: 56, train_loss: 0.7239, test_loss: 1.0947, test_f1: 0.5427
 epoch: 57, train_loss: 0.7242, test_loss: 1.0979, test_f1: 0.5397
 epoch: 58, train_loss: 0.7163, test_loss: 1.1638, test_f1: 0.5402
 epoch: 59, train_loss: 0.7332, test_loss: 1.0956, test_f1: 0.5431
 epoch: 60, train_loss: 0.7225, test_loss: 1.0679, test_f1: 0.5318
 epoch: 61, train_loss: 0.7080, test_loss: 1.0717, test_f1: 0.5469
 epoch: 62, train_loss: 0.7146, test_loss: 1.1449, test_f1: 0.5380
 epoch: 63, train_loss: 0.7177, test_loss: 1.1528, test_f1: 0.5375
 epoch: 64, train_loss: 0.7250, test_loss: 1.1774, test_f1: 0.5203
 epoch: 65, train_loss: 0.7000, test_loss: 1.1310, test_f1: 0.5130
 epoch: 66, train_loss: 0.6970, test_loss: 1.1722, test_f1: 0.5337
 epoch: 67, train_loss: 0.7079, test_loss: 1.1398, test_f1: 0.5217
 epoch: 68, train_loss: 0.7019, test_loss: 1.2156, test_f1: 0.5388
 epoch: 69, train_loss: 0.7036, test_loss: 1.1239, test_f1: 0.5368
 epoch: 70, train_loss: 0.6991, test_loss: 1.1807, test_f1: 0.5371
 epoch: 71, train_loss: 0.7055, test_loss: 1.1981, test_f1: 0.5353
 epoch: 72, train_loss: 0.7041, test_loss: 1.1601, test_f1: 0.5310
 epoch: 73, train_loss: 0.7109, test_loss: 1.1310, test_f1: 0.5457
 epoch: 74, train_loss: 0.7005, test_loss: 1.1878, test_f1: 0.5277
 epoch: 75, train_loss: 0.7071, test_loss: 1.1422, test_f1: 0.5205
 epoch: 76, train_loss: 0.6884, test_loss: 1.1934, test_f1: 0.5117
 epoch: 77, train_loss: 0.6930, test_loss: 1.2033, test_f1: 0.5217
 epoch: 78, train_loss: 0.6962, test_loss: 1.1548, test_f1: 0.5656
 epoch: 79, train_loss: 0.6861, test_loss: 1.1477, test_f1: 0.5621
 epoch: 80, train_loss: 0.7036, test_loss: 1.2587, test_f1: 0.5294
 epoch: 81, train_loss: 0.6835, test_loss: 1.1650, test_f1: 0.5323
 epoch: 82, train_loss: 0.6734, test_loss: 1.2001, test_f1: 0.5539
 epoch: 83, train_loss: 0.6788, test_loss: 1.1522, test_f1: 0.5429
 epoch: 84, train_loss: 0.6851, test_loss: 1.2643, test_f1: 0.5269
 epoch: 85, train_loss: 0.6854, test_loss: 1.1909, test_f1: 0.5394
 epoch: 86, train_loss: 0.6860, test_loss: 1.1946, test_f1: 0.5611
 epoch: 87, train_loss: 0.6806, test_loss: 1.1778, test_f1: 0.5292
 epoch: 88, train_loss: 0.6838, test_loss: 1.1385, test_f1: 0.5504
 epoch: 89, train_loss: 0.6961, test_loss: 1.1222, test_f1: 0.5727
 epoch: 90, train_loss: 0.6727, test_loss: 1.1907, test_f1: 0.5405
 epoch: 91, train_loss: 0.6854, test_loss: 1.2126, test_f1: 0.5630
 epoch: 92, train_loss: 0.6857, test_loss: 1.2028, test_f1: 0.5714
 epoch: 93, train_loss: 0.6829, test_loss: 1.2410, test_f1: 0.5546
 epoch: 94, train_loss: 0.6704, test_loss: 1.2653, test_f1: 0.5424
 epoch: 95, train_loss: 0.6701, test_loss: 1.1616, test_f1: 0.5566
 epoch: 96, train_loss: 0.6655, test_loss: 1.1958, test_f1: 0.5369
 epoch: 97, train_loss: 0.6826, test_loss: 1.2658, test_f1: 0.5405
 epoch: 98, train_loss: 0.6680, test_loss: 1.2073, test_f1: 0.5311
 epoch: 99, train_loss: 0.6749, test_loss: 1.2657, test_f1: 0.5586
##################ITERATION #9 ****************************************
 epoch: 0, train_loss: 1.6323, test_loss: 1.3590, test_f1: 0.2270
 epoch: 1, train_loss: 1.3074, test_loss: 1.3052, test_f1: 0.2768
 epoch: 2, train_loss: 1.2331, test_loss: 1.2485, test_f1: 0.2832
 epoch: 3, train_loss: 1.1994, test_loss: 1.2034, test_f1: 0.3282
 epoch: 4, train_loss: 1.1699, test_loss: 1.1850, test_f1: 0.3980
 epoch: 5, train_loss: 1.1278, test_loss: 1.1536, test_f1: 0.4974
 epoch: 6, train_loss: 1.1040, test_loss: 1.1029, test_f1: 0.4957
 epoch: 7, train_loss: 1.0987, test_loss: 1.0810, test_f1: 0.5319
 epoch: 8, train_loss: 1.0712, test_loss: 1.0782, test_f1: 0.5093
 epoch: 9, train_loss: 1.0269, test_loss: 1.0654, test_f1: 0.5368
 epoch: 10, train_loss: 0.9964, test_loss: 1.0228, test_f1: 0.5560
 epoch: 11, train_loss: 0.9745, test_loss: 1.0055, test_f1: 0.5754
 epoch: 12, train_loss: 0.9564, test_loss: 1.0166, test_f1: 0.5491
 epoch: 13, train_loss: 0.9476, test_loss: 0.9912, test_f1: 0.5486
 epoch: 14, train_loss: 0.9295, test_loss: 1.0121, test_f1: 0.5663
 epoch: 15, train_loss: 0.9077, test_loss: 0.9805, test_f1: 0.5746
 epoch: 16, train_loss: 0.9006, test_loss: 0.9579, test_f1: 0.5929
 epoch: 17, train_loss: 0.8955, test_loss: 0.9842, test_f1: 0.5505
 epoch: 18, train_loss: 0.8739, test_loss: 0.9622, test_f1: 0.5953
 epoch: 19, train_loss: 0.8697, test_loss: 1.0057, test_f1: 0.5780
 epoch: 20, train_loss: 0.8419, test_loss: 0.9894, test_f1: 0.5705
 epoch: 21, train_loss: 0.8574, test_loss: 1.0588, test_f1: 0.5272
 epoch: 22, train_loss: 0.8548, test_loss: 0.9833, test_f1: 0.5778
 epoch: 23, train_loss: 0.8310, test_loss: 0.9695, test_f1: 0.5677
 epoch: 24, train_loss: 0.8373, test_loss: 0.9400, test_f1: 0.5784
 epoch: 25, train_loss: 0.8133, test_loss: 0.9562, test_f1: 0.5694
 epoch: 26, train_loss: 0.8040, test_loss: 0.9494, test_f1: 0.5721
 epoch: 27, train_loss: 0.8056, test_loss: 0.9731, test_f1: 0.5589
 epoch: 28, train_loss: 0.8043, test_loss: 1.0081, test_f1: 0.5527
 epoch: 29, train_loss: 0.7971, test_loss: 0.9904, test_f1: 0.5879
 epoch: 30, train_loss: 0.7832, test_loss: 1.0570, test_f1: 0.5280
 epoch: 31, train_loss: 0.8012, test_loss: 0.9951, test_f1: 0.5604
 epoch: 32, train_loss: 0.7754, test_loss: 0.9682, test_f1: 0.5624
 epoch: 33, train_loss: 0.7762, test_loss: 0.9785, test_f1: 0.5541
 epoch: 34, train_loss: 0.7683, test_loss: 1.0772, test_f1: 0.5229
 epoch: 35, train_loss: 0.7694, test_loss: 0.9582, test_f1: 0.5708
 epoch: 36, train_loss: 0.7599, test_loss: 0.9995, test_f1: 0.5438
 epoch: 37, train_loss: 0.7811, test_loss: 1.0081, test_f1: 0.5691
 epoch: 38, train_loss: 0.7619, test_loss: 0.9809, test_f1: 0.5399
 epoch: 39, train_loss: 0.7413, test_loss: 0.9432, test_f1: 0.5694
 epoch: 40, train_loss: 0.7428, test_loss: 1.0048, test_f1: 0.5374
 epoch: 41, train_loss: 0.7406, test_loss: 0.9779, test_f1: 0.5777
 epoch: 42, train_loss: 0.7489, test_loss: 1.0041, test_f1: 0.5828
 epoch: 43, train_loss: 0.7472, test_loss: 0.9845, test_f1: 0.5728
 epoch: 44, train_loss: 0.7391, test_loss: 0.9660, test_f1: 0.5701
 epoch: 45, train_loss: 0.7250, test_loss: 0.9950, test_f1: 0.5534
 epoch: 46, train_loss: 0.7289, test_loss: 1.0007, test_f1: 0.5546
 epoch: 47, train_loss: 0.7079, test_loss: 1.0126, test_f1: 0.5641
 epoch: 48, train_loss: 0.7130, test_loss: 0.9593, test_f1: 0.5663
 epoch: 49, train_loss: 0.7221, test_loss: 1.0291, test_f1: 0.5712
 epoch: 50, train_loss: 0.7125, test_loss: 1.0323, test_f1: 0.5550
 epoch: 51, train_loss: 0.6875, test_loss: 0.9911, test_f1: 0.5837
 epoch: 52, train_loss: 0.6850, test_loss: 1.0319, test_f1: 0.5872
 epoch: 53, train_loss: 0.6735, test_loss: 1.0246, test_f1: 0.5653
 epoch: 54, train_loss: 0.6824, test_loss: 1.0227, test_f1: 0.5777
 epoch: 55, train_loss: 0.7013, test_loss: 1.0548, test_f1: 0.5620
 epoch: 56, train_loss: 0.6926, test_loss: 1.0187, test_f1: 0.5828
 epoch: 57, train_loss: 0.6730, test_loss: 1.0045, test_f1: 0.5624
 epoch: 58, train_loss: 0.6802, test_loss: 1.0487, test_f1: 0.5862
 epoch: 59, train_loss: 0.6736, test_loss: 1.0266, test_f1: 0.5803
 epoch: 60, train_loss: 0.6639, test_loss: 1.0467, test_f1: 0.5771
 epoch: 61, train_loss: 0.6719, test_loss: 1.0077, test_f1: 0.5848
 epoch: 62, train_loss: 0.6758, test_loss: 1.0627, test_f1: 0.5476
 epoch: 63, train_loss: 0.6642, test_loss: 1.0391, test_f1: 0.5678
 epoch: 64, train_loss: 0.6652, test_loss: 1.0646, test_f1: 0.5429
 epoch: 65, train_loss: 0.6489, test_loss: 1.0916, test_f1: 0.5453
 epoch: 66, train_loss: 0.6781, test_loss: 1.0093, test_f1: 0.5920
 epoch: 67, train_loss: 0.6534, test_loss: 1.0600, test_f1: 0.5654
 epoch: 68, train_loss: 0.6578, test_loss: 1.0726, test_f1: 0.5722
 epoch: 69, train_loss: 0.6666, test_loss: 1.1346, test_f1: 0.5303
 epoch: 70, train_loss: 0.6537, test_loss: 1.0916, test_f1: 0.5632
 epoch: 71, train_loss: 0.6696, test_loss: 1.0935, test_f1: 0.5487
 epoch: 72, train_loss: 0.6535, test_loss: 1.1762, test_f1: 0.5469
 epoch: 73, train_loss: 0.6628, test_loss: 1.0730, test_f1: 0.5793
 epoch: 74, train_loss: 0.6440, test_loss: 1.0717, test_f1: 0.5389
 epoch: 75, train_loss: 0.6328, test_loss: 1.0656, test_f1: 0.5796
 epoch: 76, train_loss: 0.6536, test_loss: 1.0375, test_f1: 0.5609
 epoch: 77, train_loss: 0.6422, test_loss: 1.1212, test_f1: 0.5750
 epoch: 78, train_loss: 0.6323, test_loss: 1.0731, test_f1: 0.5548
 epoch: 79, train_loss: 0.6507, test_loss: 1.1467, test_f1: 0.5574
 epoch: 80, train_loss: 0.6440, test_loss: 1.1036, test_f1: 0.5577
 epoch: 81, train_loss: 0.6322, test_loss: 1.1199, test_f1: 0.5302
 epoch: 82, train_loss: 0.6238, test_loss: 1.0789, test_f1: 0.5662
 epoch: 83, train_loss: 0.6286, test_loss: 1.0516, test_f1: 0.5531
 epoch: 84, train_loss: 0.6340, test_loss: 1.1493, test_f1: 0.5682
 epoch: 85, train_loss: 0.6393, test_loss: 1.0739, test_f1: 0.5635
 epoch: 86, train_loss: 0.6419, test_loss: 1.1145, test_f1: 0.5334
 epoch: 87, train_loss: 0.6284, test_loss: 1.1143, test_f1: 0.5492
 epoch: 88, train_loss: 0.6193, test_loss: 1.1906, test_f1: 0.5521
 epoch: 89, train_loss: 0.6301, test_loss: 1.1691, test_f1: 0.5625
 epoch: 90, train_loss: 0.6367, test_loss: 1.0841, test_f1: 0.5749
 epoch: 91, train_loss: 0.6224, test_loss: 1.1122, test_f1: 0.5623
 epoch: 92, train_loss: 0.6227, test_loss: 1.1708, test_f1: 0.5776
 epoch: 93, train_loss: 0.6353, test_loss: 1.1350, test_f1: 0.5306
 epoch: 94, train_loss: 0.6218, test_loss: 1.1291, test_f1: 0.5610
 epoch: 95, train_loss: 0.6306, test_loss: 1.1248, test_f1: 0.5344
 epoch: 96, train_loss: 0.6077, test_loss: 1.1167, test_f1: 0.5614
 epoch: 97, train_loss: 0.6121, test_loss: 1.1438, test_f1: 0.5671
 epoch: 98, train_loss: 0.6094, test_loss: 1.1251, test_f1: 0.5608
 epoch: 99, train_loss: 0.6137, test_loss: 1.1255, test_f1: 0.5403

Training completed in 443.35 seconds
Best F1: 0.6349 at epoch 87
Mean F1 across iterations: 0.6006  0.0219
========================FINAL RESULTS================================
FEGIN weighted F1: 0.6349  0.0219
python main.py --data ltspice_demos --representation component_pin --model FEGIN --layers 4 --hiddens 16 --batch_size 64 --lr 0.001 --emb_size 250 --epochs 100 --save_appendix component_pin_L4_H16_BS64_LR0.001_E250 --no_val
-----



STDERR:
  File "main.py", line 370, in <module>
    main()
  File "main.py", line 254, in main
    dataset = dataset_class(
  File "/home/philip/projects/ltspice_examples_code_repo/Circuit-Completion-Using-GNNs/component_classification_with_link_prediction_head/evaluation/FEGIN/kernel/circuit_datasets.py", line 15, in __init__
    self.data, self.slices = torch.load(self.processed_paths[0])
  File "/home/philip/.local/lib/python3.8/site-packages/torch/serialization.py", line 1040, in load
    warnings.warn(
  File "/usr/lib/python3.8/warnings.py", line 109, in _showwarnmsg
    sw(msg.message, msg.category, msg.filename, msg.lineno,
  File "main.py", line 47, in warn_with_traceback
    traceback.print_stack(file=log)
/home/philip/projects/ltspice_examples_code_repo/Circuit-Completion-Using-GNNs/component_classification_with_link_prediction_head/evaluation/FEGIN/kernel/circuit_datasets.py:15: FutureWarning: You are using `torch.load` with `weights_only=False` (the current default value), which uses the default pickle module implicitly. It is possible to construct malicious pickle data which will execute arbitrary code during unpickling (See https://github.com/pytorch/pytorch/blob/main/SECURITY.md#untrusted-models for more details). In a future release, the default value for `weights_only` will be flipped to `True`. This limits the functions that could be executed during unpickling. Arbitrary objects will no longer be allowed to be loaded via this mode unless they are explicitly allowlisted by the user via `torch.serialization.add_safe_globals`. We recommend you start setting `weights_only=True` for any use case where you don't have full control of the loaded file. Please open an issue on GitHub for any issues related to this experimental feature.
  self.data, self.slices = torch.load(self.processed_paths[0])
