STDOUT:
Results will be saved in /home/philip/projects/ltspice_examples_code_repo/Circuit-Completion-Using-GNNs/component_classification_with_link_prediction_head/evaluation/FEGIN/results/model_FEGIN_dataset_ltspice_demos
Command line input: python main.py --data ltspice_demos --representation component_pin --model FEGIN --layers 4 --hiddens 16 --batch_size 64 --lr 0.001 --emb_size 250 --epochs 100 --save_appendix component_pin_L4_H16_BS64_LR0.001_E250 --no_val
 is saved.
-----
ltspice_demos - FEGIN
Using 4 layers, 16 hidden units, h = 2
Loading component_pin representation dataset
ENTERED
Training FEGIN on component_pin representation
Train: 1565, Test: 383
##################ITERATION #0 ****************************************
 epoch: 0, train_loss: 1.4364, test_loss: 1.4040, test_f1: 0.0497
 epoch: 1, train_loss: 1.3601, test_loss: 1.3607, test_f1: 0.1365
 epoch: 2, train_loss: 1.2936, test_loss: 1.3167, test_f1: 0.1365
 epoch: 3, train_loss: 1.2400, test_loss: 1.2747, test_f1: 0.1405
 epoch: 4, train_loss: 1.2016, test_loss: 1.2411, test_f1: 0.1634
 epoch: 5, train_loss: 1.1750, test_loss: 1.2485, test_f1: 0.3449
 epoch: 6, train_loss: 1.1504, test_loss: 1.2051, test_f1: 0.2625
 epoch: 7, train_loss: 1.1226, test_loss: 1.2060, test_f1: 0.2636
 epoch: 8, train_loss: 1.1084, test_loss: 1.1785, test_f1: 0.4344
 epoch: 9, train_loss: 1.0970, test_loss: 1.2561, test_f1: 0.3746
 epoch: 10, train_loss: 1.0845, test_loss: 1.1823, test_f1: 0.4282
 epoch: 11, train_loss: 1.0710, test_loss: 1.1689, test_f1: 0.4337
 epoch: 12, train_loss: 1.0634, test_loss: 1.2566, test_f1: 0.4261
 epoch: 13, train_loss: 1.0562, test_loss: 1.4345, test_f1: 0.1336
 epoch: 14, train_loss: 1.0380, test_loss: 1.1061, test_f1: 0.4620
 epoch: 15, train_loss: 1.0196, test_loss: 1.2904, test_f1: 0.4455
 epoch: 16, train_loss: 0.9990, test_loss: 1.1481, test_f1: 0.4584
 epoch: 17, train_loss: 0.9757, test_loss: 1.1282, test_f1: 0.4636
 epoch: 18, train_loss: 0.9687, test_loss: 1.1162, test_f1: 0.4145
 epoch: 19, train_loss: 0.9533, test_loss: 1.4763, test_f1: 0.4018
 epoch: 20, train_loss: 0.9279, test_loss: 1.0334, test_f1: 0.4864
 epoch: 21, train_loss: 0.9224, test_loss: 1.0768, test_f1: 0.4684
 epoch: 22, train_loss: 0.9214, test_loss: 0.9986, test_f1: 0.5395
 epoch: 23, train_loss: 0.9075, test_loss: 1.1563, test_f1: 0.4795
 epoch: 24, train_loss: 0.9240, test_loss: 1.0695, test_f1: 0.4869
 epoch: 25, train_loss: 0.8906, test_loss: 1.0060, test_f1: 0.5559
 epoch: 26, train_loss: 0.9013, test_loss: 1.1026, test_f1: 0.4846
 epoch: 27, train_loss: 0.8688, test_loss: 1.0739, test_f1: 0.5436
 epoch: 28, train_loss: 0.8776, test_loss: 1.0672, test_f1: 0.5640
 epoch: 29, train_loss: 0.8425, test_loss: 1.0700, test_f1: 0.5774
 epoch: 30, train_loss: 0.8570, test_loss: 0.9924, test_f1: 0.5349
 epoch: 31, train_loss: 0.8643, test_loss: 1.5591, test_f1: 0.4032
 epoch: 32, train_loss: 0.8634, test_loss: 1.0385, test_f1: 0.5382
 epoch: 33, train_loss: 0.8273, test_loss: 1.1065, test_f1: 0.5553
 epoch: 34, train_loss: 0.8283, test_loss: 1.0847, test_f1: 0.5752
 epoch: 35, train_loss: 0.8200, test_loss: 1.0443, test_f1: 0.5382
 epoch: 36, train_loss: 0.8157, test_loss: 1.1802, test_f1: 0.5365
 epoch: 37, train_loss: 0.8259, test_loss: 1.0247, test_f1: 0.5157
 epoch: 38, train_loss: 0.8309, test_loss: 1.1224, test_f1: 0.5657
 epoch: 39, train_loss: 0.8010, test_loss: 1.0417, test_f1: 0.5845
 epoch: 40, train_loss: 0.7900, test_loss: 1.2270, test_f1: 0.5581
 epoch: 41, train_loss: 0.7956, test_loss: 1.0764, test_f1: 0.5503
 epoch: 42, train_loss: 0.7924, test_loss: 1.2848, test_f1: 0.5230
 epoch: 43, train_loss: 0.7779, test_loss: 1.0686, test_f1: 0.5676
 epoch: 44, train_loss: 0.7960, test_loss: 1.1500, test_f1: 0.5855
 epoch: 45, train_loss: 0.7881, test_loss: 1.0537, test_f1: 0.5556
 epoch: 46, train_loss: 0.7880, test_loss: 1.1785, test_f1: 0.5668
 epoch: 47, train_loss: 0.7671, test_loss: 1.0899, test_f1: 0.5423
 epoch: 48, train_loss: 0.7738, test_loss: 1.2161, test_f1: 0.5667
 epoch: 49, train_loss: 0.7527, test_loss: 1.1357, test_f1: 0.5374
 epoch: 50, train_loss: 0.7517, test_loss: 1.5741, test_f1: 0.4977
 epoch: 51, train_loss: 0.7566, test_loss: 1.1794, test_f1: 0.5869
 epoch: 52, train_loss: 0.7478, test_loss: 1.1669, test_f1: 0.5755
 epoch: 53, train_loss: 0.7358, test_loss: 1.3436, test_f1: 0.5672
 epoch: 54, train_loss: 0.7478, test_loss: 1.1559, test_f1: 0.5618
 epoch: 55, train_loss: 0.7391, test_loss: 1.2176, test_f1: 0.5825
 epoch: 56, train_loss: 0.7291, test_loss: 1.2525, test_f1: 0.5753
 epoch: 57, train_loss: 0.7273, test_loss: 1.3474, test_f1: 0.5635
 epoch: 58, train_loss: 0.7214, test_loss: 1.1991, test_f1: 0.5712
 epoch: 59, train_loss: 0.7268, test_loss: 1.2928, test_f1: 0.5587
 epoch: 60, train_loss: 0.7346, test_loss: 1.1962, test_f1: 0.5868
 epoch: 61, train_loss: 0.7124, test_loss: 1.3319, test_f1: 0.5651
 epoch: 62, train_loss: 0.7228, test_loss: 1.2486, test_f1: 0.5918
 epoch: 63, train_loss: 0.7088, test_loss: 1.2932, test_f1: 0.5645
 epoch: 64, train_loss: 0.7264, test_loss: 1.1832, test_f1: 0.5663
 epoch: 65, train_loss: 0.6881, test_loss: 1.3160, test_f1: 0.5790
 epoch: 66, train_loss: 0.7220, test_loss: 1.3581, test_f1: 0.5771
 epoch: 67, train_loss: 0.7161, test_loss: 1.2993, test_f1: 0.5679
 epoch: 68, train_loss: 0.6903, test_loss: 1.2306, test_f1: 0.5732
 epoch: 69, train_loss: 0.7053, test_loss: 1.2854, test_f1: 0.5646
 epoch: 70, train_loss: 0.7183, test_loss: 1.2160, test_f1: 0.5832
 epoch: 71, train_loss: 0.7196, test_loss: 1.3044, test_f1: 0.5697
 epoch: 72, train_loss: 0.7040, test_loss: 1.3572, test_f1: 0.5811
 epoch: 73, train_loss: 0.7032, test_loss: 1.3262, test_f1: 0.5897
 epoch: 74, train_loss: 0.7038, test_loss: 1.3916, test_f1: 0.5787
 epoch: 75, train_loss: 0.7052, test_loss: 1.2782, test_f1: 0.5829
 epoch: 76, train_loss: 0.6937, test_loss: 1.5681, test_f1: 0.5549
 epoch: 77, train_loss: 0.6957, test_loss: 1.2342, test_f1: 0.5544
 epoch: 78, train_loss: 0.6861, test_loss: 1.3915, test_f1: 0.5933
 epoch: 79, train_loss: 0.6922, test_loss: 1.3172, test_f1: 0.5711
 epoch: 80, train_loss: 0.7081, test_loss: 1.3368, test_f1: 0.5763
 epoch: 81, train_loss: 0.6936, test_loss: 1.3022, test_f1: 0.6013
 epoch: 82, train_loss: 0.6956, test_loss: 1.3831, test_f1: 0.6056
 epoch: 83, train_loss: 0.6865, test_loss: 1.2832, test_f1: 0.5882
 epoch: 84, train_loss: 0.6711, test_loss: 1.4951, test_f1: 0.5571
 epoch: 85, train_loss: 0.6752, test_loss: 1.4469, test_f1: 0.5796
 epoch: 86, train_loss: 0.6878, test_loss: 1.3416, test_f1: 0.5661
 epoch: 87, train_loss: 0.6802, test_loss: 1.3616, test_f1: 0.5694
 epoch: 88, train_loss: 0.6924, test_loss: 1.5047, test_f1: 0.5757
 epoch: 89, train_loss: 0.6860, test_loss: 1.2482, test_f1: 0.5966
 epoch: 90, train_loss: 0.6716, test_loss: 1.6149, test_f1: 0.5887
 epoch: 91, train_loss: 0.6589, test_loss: 1.4926, test_f1: 0.5754
 epoch: 92, train_loss: 0.6761, test_loss: 1.6365, test_f1: 0.5788
 epoch: 93, train_loss: 0.6714, test_loss: 1.3147, test_f1: 0.6106
 epoch: 94, train_loss: 0.6798, test_loss: 1.4606, test_f1: 0.5949
 epoch: 95, train_loss: 0.6794, test_loss: 1.2933, test_f1: 0.5575
 epoch: 96, train_loss: 0.6793, test_loss: 1.3483, test_f1: 0.5958
 epoch: 97, train_loss: 0.6862, test_loss: 1.4433, test_f1: 0.5875
 epoch: 98, train_loss: 0.6871, test_loss: 1.5065, test_f1: 0.5884
 epoch: 99, train_loss: 0.6808, test_loss: 1.5382, test_f1: 0.5817
##################ITERATION #1 ****************************************
 epoch: 0, train_loss: 1.4006, test_loss: 1.3072, test_f1: 0.2281
 epoch: 1, train_loss: 1.2415, test_loss: 1.2661, test_f1: 0.2281
 epoch: 2, train_loss: 1.2083, test_loss: 1.2522, test_f1: 0.2281
 epoch: 3, train_loss: 1.1912, test_loss: 1.2396, test_f1: 0.2441
 epoch: 4, train_loss: 1.1564, test_loss: 1.2326, test_f1: 0.3061
 epoch: 5, train_loss: 1.1482, test_loss: 1.2087, test_f1: 0.3862
 epoch: 6, train_loss: 1.1220, test_loss: 1.1892, test_f1: 0.3788
 epoch: 7, train_loss: 1.0965, test_loss: 1.1575, test_f1: 0.4288
 epoch: 8, train_loss: 1.0857, test_loss: 1.1632, test_f1: 0.4385
 epoch: 9, train_loss: 1.0511, test_loss: 1.1356, test_f1: 0.4014
 epoch: 10, train_loss: 1.0373, test_loss: 1.1158, test_f1: 0.4066
 epoch: 11, train_loss: 1.0128, test_loss: 1.1057, test_f1: 0.4423
 epoch: 12, train_loss: 0.9874, test_loss: 1.0857, test_f1: 0.4500
 epoch: 13, train_loss: 0.9819, test_loss: 1.0924, test_f1: 0.4598
 epoch: 14, train_loss: 0.9618, test_loss: 1.0494, test_f1: 0.5093
 epoch: 15, train_loss: 0.9561, test_loss: 1.0484, test_f1: 0.5197
 epoch: 16, train_loss: 0.9384, test_loss: 1.0976, test_f1: 0.4427
 epoch: 17, train_loss: 0.9375, test_loss: 1.1140, test_f1: 0.4837
 epoch: 18, train_loss: 0.9311, test_loss: 1.1543, test_f1: 0.4864
 epoch: 19, train_loss: 0.9202, test_loss: 1.0578, test_f1: 0.5609
 epoch: 20, train_loss: 0.8983, test_loss: 1.0437, test_f1: 0.5124
 epoch: 21, train_loss: 0.9123, test_loss: 1.0362, test_f1: 0.4878
 epoch: 22, train_loss: 0.8732, test_loss: 1.0545, test_f1: 0.5221
 epoch: 23, train_loss: 0.8566, test_loss: 1.0318, test_f1: 0.5317
 epoch: 24, train_loss: 0.8857, test_loss: 1.0380, test_f1: 0.4887
 epoch: 25, train_loss: 0.8535, test_loss: 1.0679, test_f1: 0.5562
 epoch: 26, train_loss: 0.8549, test_loss: 1.0558, test_f1: 0.5588
 epoch: 27, train_loss: 0.8572, test_loss: 1.1080, test_f1: 0.4890
 epoch: 28, train_loss: 0.8465, test_loss: 1.0657, test_f1: 0.5422
 epoch: 29, train_loss: 0.8338, test_loss: 1.0546, test_f1: 0.5197
 epoch: 30, train_loss: 0.8291, test_loss: 1.0216, test_f1: 0.5686
 epoch: 31, train_loss: 0.8241, test_loss: 1.0391, test_f1: 0.5504
 epoch: 32, train_loss: 0.8271, test_loss: 1.0183, test_f1: 0.5747
 epoch: 33, train_loss: 0.8080, test_loss: 1.0361, test_f1: 0.5564
 epoch: 34, train_loss: 0.8110, test_loss: 1.0309, test_f1: 0.5648
 epoch: 35, train_loss: 0.8022, test_loss: 1.0778, test_f1: 0.5171
 epoch: 36, train_loss: 0.8010, test_loss: 1.0383, test_f1: 0.5727
 epoch: 37, train_loss: 0.7933, test_loss: 1.0512, test_f1: 0.5452
 epoch: 38, train_loss: 0.7976, test_loss: 1.0549, test_f1: 0.5682
 epoch: 39, train_loss: 0.7870, test_loss: 1.0732, test_f1: 0.5391
 epoch: 40, train_loss: 0.7755, test_loss: 1.2216, test_f1: 0.5330
 epoch: 41, train_loss: 0.7937, test_loss: 1.2423, test_f1: 0.5300
 epoch: 42, train_loss: 0.7687, test_loss: 1.1022, test_f1: 0.5416
 epoch: 43, train_loss: 0.7706, test_loss: 1.0430, test_f1: 0.5539
 epoch: 44, train_loss: 0.7675, test_loss: 1.1183, test_f1: 0.5226
 epoch: 45, train_loss: 0.7675, test_loss: 1.0504, test_f1: 0.5830
 epoch: 46, train_loss: 0.7587, test_loss: 1.0176, test_f1: 0.5919
 epoch: 47, train_loss: 0.7624, test_loss: 1.0662, test_f1: 0.5639
 epoch: 48, train_loss: 0.7412, test_loss: 0.9805, test_f1: 0.6032
 epoch: 49, train_loss: 0.7431, test_loss: 1.0513, test_f1: 0.5835
 epoch: 50, train_loss: 0.7416, test_loss: 1.0049, test_f1: 0.5910
 epoch: 51, train_loss: 0.7286, test_loss: 1.0468, test_f1: 0.5806
 epoch: 52, train_loss: 0.7310, test_loss: 1.0768, test_f1: 0.5771
 epoch: 53, train_loss: 0.7326, test_loss: 1.0371, test_f1: 0.5703
 epoch: 54, train_loss: 0.7168, test_loss: 1.0174, test_f1: 0.5776
 epoch: 55, train_loss: 0.7317, test_loss: 1.0192, test_f1: 0.5779
 epoch: 56, train_loss: 0.7144, test_loss: 1.0281, test_f1: 0.5774
 epoch: 57, train_loss: 0.7275, test_loss: 1.1008, test_f1: 0.5653
 epoch: 58, train_loss: 0.7378, test_loss: 1.0381, test_f1: 0.5825
 epoch: 59, train_loss: 0.7143, test_loss: 0.9867, test_f1: 0.6194
 epoch: 60, train_loss: 0.7284, test_loss: 1.0847, test_f1: 0.5760
 epoch: 61, train_loss: 0.7110, test_loss: 1.0447, test_f1: 0.5693
 epoch: 62, train_loss: 0.7115, test_loss: 1.0184, test_f1: 0.5895
 epoch: 63, train_loss: 0.6900, test_loss: 1.0448, test_f1: 0.5751
 epoch: 64, train_loss: 0.7088, test_loss: 1.0919, test_f1: 0.5703
 epoch: 65, train_loss: 0.6774, test_loss: 1.0554, test_f1: 0.5639
 epoch: 66, train_loss: 0.6976, test_loss: 1.0408, test_f1: 0.5792
 epoch: 67, train_loss: 0.7019, test_loss: 1.0534, test_f1: 0.5674
 epoch: 68, train_loss: 0.7159, test_loss: 1.0226, test_f1: 0.5830
 epoch: 69, train_loss: 0.6981, test_loss: 1.0797, test_f1: 0.5646
 epoch: 70, train_loss: 0.6983, test_loss: 1.0626, test_f1: 0.5787
 epoch: 71, train_loss: 0.6959, test_loss: 1.1044, test_f1: 0.5691
 epoch: 72, train_loss: 0.6888, test_loss: 1.0263, test_f1: 0.5932
 epoch: 73, train_loss: 0.7000, test_loss: 1.1362, test_f1: 0.5635
 epoch: 74, train_loss: 0.6929, test_loss: 1.0717, test_f1: 0.5845
 epoch: 75, train_loss: 0.6600, test_loss: 1.0804, test_f1: 0.5669
 epoch: 76, train_loss: 0.6823, test_loss: 1.1029, test_f1: 0.5688
 epoch: 77, train_loss: 0.6824, test_loss: 1.1232, test_f1: 0.5629
 epoch: 78, train_loss: 0.6950, test_loss: 1.1531, test_f1: 0.5653
 epoch: 79, train_loss: 0.6808, test_loss: 1.1580, test_f1: 0.5451
 epoch: 80, train_loss: 0.6711, test_loss: 1.1089, test_f1: 0.5605
 epoch: 81, train_loss: 0.6901, test_loss: 1.0762, test_f1: 0.5830
 epoch: 82, train_loss: 0.6851, test_loss: 1.0721, test_f1: 0.5689
 epoch: 83, train_loss: 0.6808, test_loss: 1.0568, test_f1: 0.5817
 epoch: 84, train_loss: 0.6737, test_loss: 1.0570, test_f1: 0.6057
 epoch: 85, train_loss: 0.6721, test_loss: 1.0740, test_f1: 0.5825
 epoch: 86, train_loss: 0.6656, test_loss: 1.0725, test_f1: 0.5810
 epoch: 87, train_loss: 0.6887, test_loss: 1.1561, test_f1: 0.5558
 epoch: 88, train_loss: 0.6707, test_loss: 1.1210, test_f1: 0.5743
 epoch: 89, train_loss: 0.6781, test_loss: 1.1216, test_f1: 0.5829
 epoch: 90, train_loss: 0.6826, test_loss: 1.1340, test_f1: 0.5608
 epoch: 91, train_loss: 0.6688, test_loss: 1.1139, test_f1: 0.5790
 epoch: 92, train_loss: 0.6619, test_loss: 1.0638, test_f1: 0.5915
 epoch: 93, train_loss: 0.6746, test_loss: 1.1641, test_f1: 0.5604
 epoch: 94, train_loss: 0.6759, test_loss: 1.1484, test_f1: 0.5495
 epoch: 95, train_loss: 0.6720, test_loss: 1.1265, test_f1: 0.5491
 epoch: 96, train_loss: 0.6816, test_loss: 1.1747, test_f1: 0.5627
 epoch: 97, train_loss: 0.6625, test_loss: 1.0864, test_f1: 0.5872
 epoch: 98, train_loss: 0.6541, test_loss: 1.1706, test_f1: 0.5865
 epoch: 99, train_loss: 0.6566, test_loss: 1.1262, test_f1: 0.5705
##################ITERATION #2 ****************************************
 epoch: 0, train_loss: 1.4100, test_loss: 1.3510, test_f1: 0.2238
 epoch: 1, train_loss: 1.2374, test_loss: 1.3144, test_f1: 0.2281
 epoch: 2, train_loss: 1.1751, test_loss: 1.2452, test_f1: 0.2507
 epoch: 3, train_loss: 1.1211, test_loss: 1.2028, test_f1: 0.3382
 epoch: 4, train_loss: 1.0864, test_loss: 1.1747, test_f1: 0.3463
 epoch: 5, train_loss: 1.0663, test_loss: 1.1583, test_f1: 0.3824
 epoch: 6, train_loss: 1.0436, test_loss: 1.1696, test_f1: 0.3704
 epoch: 7, train_loss: 1.0246, test_loss: 1.1107, test_f1: 0.4000
 epoch: 8, train_loss: 1.0114, test_loss: 1.0933, test_f1: 0.3964
 epoch: 9, train_loss: 0.9990, test_loss: 1.0785, test_f1: 0.4643
 epoch: 10, train_loss: 0.9824, test_loss: 1.0917, test_f1: 0.4209
 epoch: 11, train_loss: 0.9708, test_loss: 1.0800, test_f1: 0.4375
 epoch: 12, train_loss: 0.9468, test_loss: 1.0846, test_f1: 0.4635
 epoch: 13, train_loss: 0.9411, test_loss: 1.0625, test_f1: 0.4558
 epoch: 14, train_loss: 0.9243, test_loss: 1.0493, test_f1: 0.5002
 epoch: 15, train_loss: 0.9130, test_loss: 1.0166, test_f1: 0.5377
 epoch: 16, train_loss: 0.9162, test_loss: 1.0743, test_f1: 0.4500
 epoch: 17, train_loss: 0.8825, test_loss: 1.0772, test_f1: 0.5083
 epoch: 18, train_loss: 0.8784, test_loss: 1.1157, test_f1: 0.5021
 epoch: 19, train_loss: 0.8564, test_loss: 1.0500, test_f1: 0.4872
 epoch: 20, train_loss: 0.8522, test_loss: 1.0393, test_f1: 0.5006
 epoch: 21, train_loss: 0.8359, test_loss: 1.0592, test_f1: 0.5205
 epoch: 22, train_loss: 0.8342, test_loss: 1.0340, test_f1: 0.5466
 epoch: 23, train_loss: 0.8323, test_loss: 1.0462, test_f1: 0.5247
 epoch: 24, train_loss: 0.7968, test_loss: 1.0952, test_f1: 0.5719
 epoch: 25, train_loss: 0.8152, test_loss: 1.1157, test_f1: 0.5384
 epoch: 26, train_loss: 0.8104, test_loss: 1.0848, test_f1: 0.5188
 epoch: 27, train_loss: 0.7913, test_loss: 1.1128, test_f1: 0.4893
 epoch: 28, train_loss: 0.7847, test_loss: 1.1047, test_f1: 0.4852
 epoch: 29, train_loss: 0.7798, test_loss: 1.1011, test_f1: 0.5470
 epoch: 30, train_loss: 0.7955, test_loss: 1.0721, test_f1: 0.5493
 epoch: 31, train_loss: 0.7886, test_loss: 1.0621, test_f1: 0.5242
 epoch: 32, train_loss: 0.7669, test_loss: 1.1065, test_f1: 0.5223
 epoch: 33, train_loss: 0.7588, test_loss: 1.0660, test_f1: 0.5630
 epoch: 34, train_loss: 0.7413, test_loss: 1.1034, test_f1: 0.5235
 epoch: 35, train_loss: 0.7528, test_loss: 0.9992, test_f1: 0.5636
 epoch: 36, train_loss: 0.7544, test_loss: 1.1270, test_f1: 0.5134
 epoch: 37, train_loss: 0.7316, test_loss: 1.1301, test_f1: 0.5086
 epoch: 38, train_loss: 0.7391, test_loss: 1.1198, test_f1: 0.5368
 epoch: 39, train_loss: 0.7497, test_loss: 1.0676, test_f1: 0.5498
 epoch: 40, train_loss: 0.7385, test_loss: 1.0259, test_f1: 0.5571
 epoch: 41, train_loss: 0.7222, test_loss: 1.1520, test_f1: 0.5215
 epoch: 42, train_loss: 0.7305, test_loss: 1.0761, test_f1: 0.5540
 epoch: 43, train_loss: 0.7289, test_loss: 1.0488, test_f1: 0.5949
 epoch: 44, train_loss: 0.7301, test_loss: 1.1287, test_f1: 0.5246
 epoch: 45, train_loss: 0.7063, test_loss: 1.1340, test_f1: 0.5557
 epoch: 46, train_loss: 0.7034, test_loss: 1.1412, test_f1: 0.5183
 epoch: 47, train_loss: 0.7016, test_loss: 1.1628, test_f1: 0.5610
 epoch: 48, train_loss: 0.7076, test_loss: 1.3034, test_f1: 0.5003
 epoch: 49, train_loss: 0.6834, test_loss: 1.2279, test_f1: 0.5321
 epoch: 50, train_loss: 0.7287, test_loss: 1.2344, test_f1: 0.5481
 epoch: 51, train_loss: 0.6813, test_loss: 1.2226, test_f1: 0.5422
 epoch: 52, train_loss: 0.6935, test_loss: 1.2265, test_f1: 0.5337
 epoch: 53, train_loss: 0.6836, test_loss: 1.2754, test_f1: 0.5404
 epoch: 54, train_loss: 0.6464, test_loss: 1.2485, test_f1: 0.5270
 epoch: 55, train_loss: 0.6726, test_loss: 1.2191, test_f1: 0.5593
 epoch: 56, train_loss: 0.6642, test_loss: 1.1460, test_f1: 0.5599
 epoch: 57, train_loss: 0.6779, test_loss: 1.3011, test_f1: 0.5381
 epoch: 58, train_loss: 0.6867, test_loss: 1.1491, test_f1: 0.5409
 epoch: 59, train_loss: 0.6803, test_loss: 1.1962, test_f1: 0.5737
 epoch: 60, train_loss: 0.6531, test_loss: 1.2735, test_f1: 0.5132
 epoch: 61, train_loss: 0.6810, test_loss: 1.2192, test_f1: 0.5495
 epoch: 62, train_loss: 0.6663, test_loss: 1.2622, test_f1: 0.5485
 epoch: 63, train_loss: 0.6610, test_loss: 1.2954, test_f1: 0.5232
 epoch: 64, train_loss: 0.6706, test_loss: 1.2589, test_f1: 0.5584
 epoch: 65, train_loss: 0.6716, test_loss: 1.3056, test_f1: 0.5300
 epoch: 66, train_loss: 0.6625, test_loss: 1.2792, test_f1: 0.5482
 epoch: 67, train_loss: 0.6522, test_loss: 1.2758, test_f1: 0.5484
 epoch: 68, train_loss: 0.6731, test_loss: 1.2730, test_f1: 0.5342
 epoch: 69, train_loss: 0.6568, test_loss: 1.2685, test_f1: 0.5559
 epoch: 70, train_loss: 0.6664, test_loss: 1.2914, test_f1: 0.5591
 epoch: 71, train_loss: 0.6535, test_loss: 1.3603, test_f1: 0.5368
 epoch: 72, train_loss: 0.6543, test_loss: 1.2273, test_f1: 0.5524
 epoch: 73, train_loss: 0.6514, test_loss: 1.3314, test_f1: 0.5463
 epoch: 74, train_loss: 0.6532, test_loss: 1.1864, test_f1: 0.5703
 epoch: 75, train_loss: 0.6438, test_loss: 1.2114, test_f1: 0.5559
 epoch: 76, train_loss: 0.6488, test_loss: 1.2757, test_f1: 0.5313
 epoch: 77, train_loss: 0.6337, test_loss: 1.2004, test_f1: 0.5689
 epoch: 78, train_loss: 0.6588, test_loss: 1.2751, test_f1: 0.5696
 epoch: 79, train_loss: 0.6457, test_loss: 1.3610, test_f1: 0.5299
 epoch: 80, train_loss: 0.6403, test_loss: 1.3583, test_f1: 0.5229
 epoch: 81, train_loss: 0.6562, test_loss: 1.2757, test_f1: 0.5341
 epoch: 82, train_loss: 0.6545, test_loss: 1.3324, test_f1: 0.5592
 epoch: 83, train_loss: 0.6522, test_loss: 1.2443, test_f1: 0.5458
 epoch: 84, train_loss: 0.6469, test_loss: 1.4588, test_f1: 0.5209
 epoch: 85, train_loss: 0.6408, test_loss: 1.3579, test_f1: 0.5129
 epoch: 86, train_loss: 0.6286, test_loss: 1.3571, test_f1: 0.5477
 epoch: 87, train_loss: 0.6235, test_loss: 1.4448, test_f1: 0.5193
 epoch: 88, train_loss: 0.6429, test_loss: 1.3687, test_f1: 0.5394
 epoch: 89, train_loss: 0.6263, test_loss: 1.3301, test_f1: 0.5512
 epoch: 90, train_loss: 0.6332, test_loss: 1.3218, test_f1: 0.5564
 epoch: 91, train_loss: 0.6280, test_loss: 1.3168, test_f1: 0.5413
 epoch: 92, train_loss: 0.6271, test_loss: 1.3267, test_f1: 0.5406
 epoch: 93, train_loss: 0.6164, test_loss: 1.3528, test_f1: 0.5610
 epoch: 94, train_loss: 0.6105, test_loss: 1.4178, test_f1: 0.5287
 epoch: 95, train_loss: 0.6383, test_loss: 1.3248, test_f1: 0.5397
 epoch: 96, train_loss: 0.6334, test_loss: 1.3640, test_f1: 0.5473
 epoch: 97, train_loss: 0.6271, test_loss: 1.2902, test_f1: 0.5444
 epoch: 98, train_loss: 0.6394, test_loss: 1.3446, test_f1: 0.5326
 epoch: 99, train_loss: 0.6229, test_loss: 1.3441, test_f1: 0.5314
##################ITERATION #3 ****************************************
 epoch: 0, train_loss: 1.3678, test_loss: 1.3135, test_f1: 0.2281
 epoch: 1, train_loss: 1.1988, test_loss: 1.2785, test_f1: 0.2281
 epoch: 2, train_loss: 1.1669, test_loss: 1.2353, test_f1: 0.2909
 epoch: 3, train_loss: 1.1290, test_loss: 1.1991, test_f1: 0.3762
 epoch: 4, train_loss: 1.0965, test_loss: 1.1876, test_f1: 0.4007
 epoch: 5, train_loss: 1.0893, test_loss: 1.1645, test_f1: 0.4221
 epoch: 6, train_loss: 1.0740, test_loss: 1.1567, test_f1: 0.4255
 epoch: 7, train_loss: 1.0321, test_loss: 1.1196, test_f1: 0.3988
 epoch: 8, train_loss: 1.0371, test_loss: 1.1196, test_f1: 0.4493
 epoch: 9, train_loss: 1.0207, test_loss: 1.0871, test_f1: 0.4685
 epoch: 10, train_loss: 1.0096, test_loss: 1.0889, test_f1: 0.4914
 epoch: 11, train_loss: 0.9962, test_loss: 1.0704, test_f1: 0.5115
 epoch: 12, train_loss: 0.9810, test_loss: 1.0573, test_f1: 0.5074
 epoch: 13, train_loss: 0.9514, test_loss: 1.0587, test_f1: 0.5115
 epoch: 14, train_loss: 0.9612, test_loss: 1.0243, test_f1: 0.5284
 epoch: 15, train_loss: 0.9381, test_loss: 1.0235, test_f1: 0.5311
 epoch: 16, train_loss: 0.9298, test_loss: 1.0087, test_f1: 0.5208
 epoch: 17, train_loss: 0.9229, test_loss: 1.0028, test_f1: 0.5393
 epoch: 18, train_loss: 0.9232, test_loss: 1.0246, test_f1: 0.4942
 epoch: 19, train_loss: 0.8996, test_loss: 1.0398, test_f1: 0.4861
 epoch: 20, train_loss: 0.8981, test_loss: 0.9784, test_f1: 0.5276
 epoch: 21, train_loss: 0.8930, test_loss: 0.9887, test_f1: 0.5327
 epoch: 22, train_loss: 0.8931, test_loss: 0.9776, test_f1: 0.5262
 epoch: 23, train_loss: 0.8920, test_loss: 0.9898, test_f1: 0.5112
 epoch: 24, train_loss: 0.8952, test_loss: 1.0006, test_f1: 0.5411
 epoch: 25, train_loss: 0.8959, test_loss: 0.9802, test_f1: 0.5351
 epoch: 26, train_loss: 0.8797, test_loss: 0.9984, test_f1: 0.5211
 epoch: 27, train_loss: 0.8687, test_loss: 1.0030, test_f1: 0.5428
 epoch: 28, train_loss: 0.8690, test_loss: 0.9936, test_f1: 0.5586
 epoch: 29, train_loss: 0.8578, test_loss: 1.0273, test_f1: 0.5147
 epoch: 30, train_loss: 0.8592, test_loss: 1.0766, test_f1: 0.5012
 epoch: 31, train_loss: 0.8564, test_loss: 0.9895, test_f1: 0.5206
 epoch: 32, train_loss: 0.8467, test_loss: 1.0355, test_f1: 0.4735
 epoch: 33, train_loss: 0.8377, test_loss: 1.0083, test_f1: 0.5423
 epoch: 34, train_loss: 0.8404, test_loss: 1.0004, test_f1: 0.5374
 epoch: 35, train_loss: 0.8279, test_loss: 1.0325, test_f1: 0.5230
 epoch: 36, train_loss: 0.8278, test_loss: 1.0109, test_f1: 0.5431
 epoch: 37, train_loss: 0.8055, test_loss: 1.0198, test_f1: 0.5450
 epoch: 38, train_loss: 0.8205, test_loss: 1.0196, test_f1: 0.5176
 epoch: 39, train_loss: 0.8088, test_loss: 1.0141, test_f1: 0.5736
 epoch: 40, train_loss: 0.8087, test_loss: 0.9581, test_f1: 0.5319
 epoch: 41, train_loss: 0.7984, test_loss: 1.0960, test_f1: 0.5522
 epoch: 42, train_loss: 0.8214, test_loss: 0.9887, test_f1: 0.5614
 epoch: 43, train_loss: 0.8033, test_loss: 1.0284, test_f1: 0.5311
 epoch: 44, train_loss: 0.7950, test_loss: 0.9934, test_f1: 0.5504
 epoch: 45, train_loss: 0.7857, test_loss: 0.9925, test_f1: 0.5945
 epoch: 46, train_loss: 0.7810, test_loss: 0.9750, test_f1: 0.5329
 epoch: 47, train_loss: 0.7920, test_loss: 0.9837, test_f1: 0.5549
 epoch: 48, train_loss: 0.7792, test_loss: 1.0177, test_f1: 0.5405
 epoch: 49, train_loss: 0.7871, test_loss: 0.9996, test_f1: 0.5649
 epoch: 50, train_loss: 0.7585, test_loss: 1.0850, test_f1: 0.5620
 epoch: 51, train_loss: 0.7678, test_loss: 0.9817, test_f1: 0.5790
 epoch: 52, train_loss: 0.7629, test_loss: 1.0313, test_f1: 0.5538
 epoch: 53, train_loss: 0.7608, test_loss: 1.0639, test_f1: 0.5441
 epoch: 54, train_loss: 0.7485, test_loss: 1.0665, test_f1: 0.5450
 epoch: 55, train_loss: 0.7569, test_loss: 0.9935, test_f1: 0.5835
 epoch: 56, train_loss: 0.7556, test_loss: 1.0474, test_f1: 0.5487
 epoch: 57, train_loss: 0.7361, test_loss: 1.0018, test_f1: 0.5748
 epoch: 58, train_loss: 0.7436, test_loss: 1.0318, test_f1: 0.5620
 epoch: 59, train_loss: 0.7469, test_loss: 0.9846, test_f1: 0.5757
 epoch: 60, train_loss: 0.7294, test_loss: 1.0041, test_f1: 0.5576
 epoch: 61, train_loss: 0.7301, test_loss: 1.0436, test_f1: 0.5628
 epoch: 62, train_loss: 0.7341, test_loss: 1.0160, test_f1: 0.5882
 epoch: 63, train_loss: 0.7339, test_loss: 1.0216, test_f1: 0.5481
 epoch: 64, train_loss: 0.7369, test_loss: 1.0438, test_f1: 0.5755
 epoch: 65, train_loss: 0.7288, test_loss: 1.0281, test_f1: 0.5684
 epoch: 66, train_loss: 0.7300, test_loss: 1.0437, test_f1: 0.5705
 epoch: 67, train_loss: 0.7165, test_loss: 1.0331, test_f1: 0.5764
 epoch: 68, train_loss: 0.7224, test_loss: 1.0757, test_f1: 0.5624
 epoch: 69, train_loss: 0.7193, test_loss: 0.9982, test_f1: 0.5664
 epoch: 70, train_loss: 0.7194, test_loss: 1.0301, test_f1: 0.5917
 epoch: 71, train_loss: 0.7200, test_loss: 1.0446, test_f1: 0.5669
 epoch: 72, train_loss: 0.7134, test_loss: 1.0317, test_f1: 0.5594
 epoch: 73, train_loss: 0.7178, test_loss: 1.0550, test_f1: 0.5559
 epoch: 74, train_loss: 0.7086, test_loss: 1.0559, test_f1: 0.5898
 epoch: 75, train_loss: 0.6980, test_loss: 1.0433, test_f1: 0.6101
 epoch: 76, train_loss: 0.7251, test_loss: 1.0153, test_f1: 0.5944
 epoch: 77, train_loss: 0.7124, test_loss: 1.0722, test_f1: 0.5742
 epoch: 78, train_loss: 0.7115, test_loss: 1.0539, test_f1: 0.5700
 epoch: 79, train_loss: 0.7098, test_loss: 1.0915, test_f1: 0.5626
 epoch: 80, train_loss: 0.7118, test_loss: 1.0492, test_f1: 0.5753
 epoch: 81, train_loss: 0.7029, test_loss: 1.0733, test_f1: 0.6094
 epoch: 82, train_loss: 0.7095, test_loss: 1.0867, test_f1: 0.5739
 epoch: 83, train_loss: 0.7114, test_loss: 1.1662, test_f1: 0.5166
 epoch: 84, train_loss: 0.7251, test_loss: 1.1646, test_f1: 0.5438
 epoch: 85, train_loss: 0.7081, test_loss: 1.1223, test_f1: 0.5918
 epoch: 86, train_loss: 0.7077, test_loss: 1.0976, test_f1: 0.5751
 epoch: 87, train_loss: 0.6995, test_loss: 1.1321, test_f1: 0.5867
 epoch: 88, train_loss: 0.6922, test_loss: 1.1095, test_f1: 0.5767
 epoch: 89, train_loss: 0.7058, test_loss: 1.1166, test_f1: 0.5569
 epoch: 90, train_loss: 0.6998, test_loss: 1.1347, test_f1: 0.5611
 epoch: 91, train_loss: 0.6876, test_loss: 1.0538, test_f1: 0.5900
 epoch: 92, train_loss: 0.6935, test_loss: 1.0654, test_f1: 0.5671
 epoch: 93, train_loss: 0.6903, test_loss: 1.1221, test_f1: 0.5870
 epoch: 94, train_loss: 0.6870, test_loss: 1.0888, test_f1: 0.5738
 epoch: 95, train_loss: 0.6921, test_loss: 1.1794, test_f1: 0.5603
 epoch: 96, train_loss: 0.6975, test_loss: 1.1570, test_f1: 0.5552
 epoch: 97, train_loss: 0.7029, test_loss: 1.1353, test_f1: 0.5528
 epoch: 98, train_loss: 0.6928, test_loss: 1.1599, test_f1: 0.5691
 epoch: 99, train_loss: 0.6870, test_loss: 1.1092, test_f1: 0.5778
##################ITERATION #4 ****************************************
 epoch: 0, train_loss: 1.3567, test_loss: 1.3112, test_f1: 0.2281
 epoch: 1, train_loss: 1.2177, test_loss: 1.2326, test_f1: 0.2281
 epoch: 2, train_loss: 1.1527, test_loss: 1.2071, test_f1: 0.3081
 epoch: 3, train_loss: 1.1309, test_loss: 1.1545, test_f1: 0.4019
 epoch: 4, train_loss: 1.0986, test_loss: 1.1303, test_f1: 0.4368
 epoch: 5, train_loss: 1.0619, test_loss: 1.1187, test_f1: 0.4761
 epoch: 6, train_loss: 1.0432, test_loss: 1.0938, test_f1: 0.4818
 epoch: 7, train_loss: 1.0172, test_loss: 1.0783, test_f1: 0.4470
 epoch: 8, train_loss: 0.9975, test_loss: 1.0460, test_f1: 0.4812
 epoch: 9, train_loss: 0.9933, test_loss: 1.0414, test_f1: 0.4880
 epoch: 10, train_loss: 0.9616, test_loss: 1.0365, test_f1: 0.5055
 epoch: 11, train_loss: 0.9547, test_loss: 1.0548, test_f1: 0.5144
 epoch: 12, train_loss: 0.9411, test_loss: 1.0565, test_f1: 0.4951
 epoch: 13, train_loss: 0.9389, test_loss: 1.0423, test_f1: 0.4986
 epoch: 14, train_loss: 0.9247, test_loss: 1.0350, test_f1: 0.4930
 epoch: 15, train_loss: 0.9341, test_loss: 1.0203, test_f1: 0.5341
 epoch: 16, train_loss: 0.9106, test_loss: 1.0681, test_f1: 0.5284
 epoch: 17, train_loss: 0.9046, test_loss: 1.0201, test_f1: 0.5392
 epoch: 18, train_loss: 0.8944, test_loss: 1.0228, test_f1: 0.5196
 epoch: 19, train_loss: 0.8852, test_loss: 1.0152, test_f1: 0.5364
 epoch: 20, train_loss: 0.8645, test_loss: 1.0078, test_f1: 0.5203
 epoch: 21, train_loss: 0.8699, test_loss: 1.0532, test_f1: 0.5284
 epoch: 22, train_loss: 0.8592, test_loss: 1.0733, test_f1: 0.5304
 epoch: 23, train_loss: 0.8759, test_loss: 1.0602, test_f1: 0.5178
 epoch: 24, train_loss: 0.8360, test_loss: 1.0426, test_f1: 0.5257
 epoch: 25, train_loss: 0.8486, test_loss: 1.0434, test_f1: 0.5236
 epoch: 26, train_loss: 0.8423, test_loss: 1.0294, test_f1: 0.5066
 epoch: 27, train_loss: 0.8318, test_loss: 1.0408, test_f1: 0.5137
 epoch: 28, train_loss: 0.8491, test_loss: 1.0474, test_f1: 0.5211
 epoch: 29, train_loss: 0.8515, test_loss: 1.0475, test_f1: 0.5192
 epoch: 30, train_loss: 0.8444, test_loss: 1.0034, test_f1: 0.5291
 epoch: 31, train_loss: 0.8242, test_loss: 1.0636, test_f1: 0.5224
 epoch: 32, train_loss: 0.8160, test_loss: 1.0677, test_f1: 0.5239
 epoch: 33, train_loss: 0.8273, test_loss: 1.0446, test_f1: 0.5222
 epoch: 34, train_loss: 0.7951, test_loss: 1.0490, test_f1: 0.5371
 epoch: 35, train_loss: 0.7995, test_loss: 1.0469, test_f1: 0.5288
 epoch: 36, train_loss: 0.7993, test_loss: 1.0763, test_f1: 0.5349
 epoch: 37, train_loss: 0.7812, test_loss: 1.0203, test_f1: 0.5503
 epoch: 38, train_loss: 0.8018, test_loss: 1.1352, test_f1: 0.5043
 epoch: 39, train_loss: 0.7977, test_loss: 1.0583, test_f1: 0.5297
 epoch: 40, train_loss: 0.7898, test_loss: 1.0260, test_f1: 0.5408
 epoch: 41, train_loss: 0.8017, test_loss: 1.0228, test_f1: 0.5383
 epoch: 42, train_loss: 0.7763, test_loss: 1.0567, test_f1: 0.5237
 epoch: 43, train_loss: 0.7917, test_loss: 1.0510, test_f1: 0.5556
 epoch: 44, train_loss: 0.7892, test_loss: 0.9810, test_f1: 0.5447
 epoch: 45, train_loss: 0.7746, test_loss: 0.9984, test_f1: 0.5489
 epoch: 46, train_loss: 0.7854, test_loss: 0.9730, test_f1: 0.5739
 epoch: 47, train_loss: 0.7652, test_loss: 1.0068, test_f1: 0.5535
 epoch: 48, train_loss: 0.7729, test_loss: 1.0467, test_f1: 0.5347
 epoch: 49, train_loss: 0.7627, test_loss: 1.0359, test_f1: 0.5397
 epoch: 50, train_loss: 0.7634, test_loss: 0.9865, test_f1: 0.5271
 epoch: 51, train_loss: 0.7469, test_loss: 0.9785, test_f1: 0.5459
 epoch: 52, train_loss: 0.7420, test_loss: 0.9901, test_f1: 0.5687
 epoch: 53, train_loss: 0.7405, test_loss: 0.9678, test_f1: 0.5644
 epoch: 54, train_loss: 0.7457, test_loss: 0.9982, test_f1: 0.5651
 epoch: 55, train_loss: 0.7391, test_loss: 1.0034, test_f1: 0.5733
 epoch: 56, train_loss: 0.7399, test_loss: 1.1584, test_f1: 0.4978
 epoch: 57, train_loss: 0.7414, test_loss: 0.9682, test_f1: 0.6012
 epoch: 58, train_loss: 0.7412, test_loss: 1.0367, test_f1: 0.5484
 epoch: 59, train_loss: 0.7321, test_loss: 0.9670, test_f1: 0.5815
 epoch: 60, train_loss: 0.7297, test_loss: 0.9789, test_f1: 0.5782
 epoch: 61, train_loss: 0.7337, test_loss: 1.0133, test_f1: 0.5654
 epoch: 62, train_loss: 0.7274, test_loss: 0.9834, test_f1: 0.5756
 epoch: 63, train_loss: 0.7258, test_loss: 1.0557, test_f1: 0.5647
 epoch: 64, train_loss: 0.7248, test_loss: 1.0149, test_f1: 0.5727
 epoch: 65, train_loss: 0.7278, test_loss: 0.9978, test_f1: 0.5821
 epoch: 66, train_loss: 0.7214, test_loss: 1.0922, test_f1: 0.5772
 epoch: 67, train_loss: 0.7271, test_loss: 1.1579, test_f1: 0.5276
 epoch: 68, train_loss: 0.7251, test_loss: 1.0252, test_f1: 0.5729
 epoch: 69, train_loss: 0.7268, test_loss: 1.0150, test_f1: 0.6004
 epoch: 70, train_loss: 0.7150, test_loss: 1.0131, test_f1: 0.5792
 epoch: 71, train_loss: 0.7199, test_loss: 0.9605, test_f1: 0.5930
 epoch: 72, train_loss: 0.7381, test_loss: 0.9985, test_f1: 0.5843
 epoch: 73, train_loss: 0.7165, test_loss: 1.0677, test_f1: 0.5405
 epoch: 74, train_loss: 0.7091, test_loss: 0.9925, test_f1: 0.5756
 epoch: 75, train_loss: 0.7002, test_loss: 1.0200, test_f1: 0.5719
 epoch: 76, train_loss: 0.7051, test_loss: 1.1006, test_f1: 0.5643
 epoch: 77, train_loss: 0.7189, test_loss: 1.0612, test_f1: 0.5489
 epoch: 78, train_loss: 0.7248, test_loss: 1.0306, test_f1: 0.5861
 epoch: 79, train_loss: 0.7043, test_loss: 1.0964, test_f1: 0.5451
 epoch: 80, train_loss: 0.7087, test_loss: 1.0212, test_f1: 0.5874
 epoch: 81, train_loss: 0.7157, test_loss: 1.0236, test_f1: 0.5916
 epoch: 82, train_loss: 0.7076, test_loss: 0.9533, test_f1: 0.6218
 epoch: 83, train_loss: 0.6979, test_loss: 0.9846, test_f1: 0.5928
 epoch: 84, train_loss: 0.6964, test_loss: 1.0071, test_f1: 0.5931
 epoch: 85, train_loss: 0.7327, test_loss: 1.0688, test_f1: 0.5616
 epoch: 86, train_loss: 0.7103, test_loss: 1.0502, test_f1: 0.5910
 epoch: 87, train_loss: 0.7051, test_loss: 1.0474, test_f1: 0.5671
 epoch: 88, train_loss: 0.6880, test_loss: 1.0137, test_f1: 0.5820
 epoch: 89, train_loss: 0.6940, test_loss: 0.9957, test_f1: 0.5969
 epoch: 90, train_loss: 0.7086, test_loss: 0.9868, test_f1: 0.5950
 epoch: 91, train_loss: 0.6867, test_loss: 0.9594, test_f1: 0.6090
 epoch: 92, train_loss: 0.6911, test_loss: 1.0848, test_f1: 0.5846
 epoch: 93, train_loss: 0.6919, test_loss: 1.0311, test_f1: 0.6007
 epoch: 94, train_loss: 0.6847, test_loss: 1.0371, test_f1: 0.5862
 epoch: 95, train_loss: 0.7075, test_loss: 1.0926, test_f1: 0.5632
 epoch: 96, train_loss: 0.6852, test_loss: 1.0770, test_f1: 0.5757
 epoch: 97, train_loss: 0.6937, test_loss: 1.0217, test_f1: 0.5950
 epoch: 98, train_loss: 0.6838, test_loss: 1.0565, test_f1: 0.6116
 epoch: 99, train_loss: 0.6907, test_loss: 1.0628, test_f1: 0.5715
##################ITERATION #5 ****************************************
 epoch: 0, train_loss: 1.4567, test_loss: 1.3365, test_f1: 0.2281
 epoch: 1, train_loss: 1.1856, test_loss: 1.3257, test_f1: 0.2485
 epoch: 2, train_loss: 1.1291, test_loss: 1.2120, test_f1: 0.3326
 epoch: 3, train_loss: 1.0756, test_loss: 1.1074, test_f1: 0.4210
 epoch: 4, train_loss: 1.0444, test_loss: 1.0967, test_f1: 0.3838
 epoch: 5, train_loss: 1.0257, test_loss: 1.0657, test_f1: 0.4803
 epoch: 6, train_loss: 1.0158, test_loss: 1.0607, test_f1: 0.5105
 epoch: 7, train_loss: 1.0150, test_loss: 1.1275, test_f1: 0.4903
 epoch: 8, train_loss: 0.9668, test_loss: 1.0249, test_f1: 0.5426
 epoch: 9, train_loss: 0.9454, test_loss: 1.1184, test_f1: 0.5128
 epoch: 10, train_loss: 0.9549, test_loss: 1.0166, test_f1: 0.5685
 epoch: 11, train_loss: 0.9465, test_loss: 1.0706, test_f1: 0.5238
 epoch: 12, train_loss: 0.9212, test_loss: 1.0502, test_f1: 0.5176
 epoch: 13, train_loss: 0.9230, test_loss: 1.0387, test_f1: 0.5454
 epoch: 14, train_loss: 0.9091, test_loss: 1.1263, test_f1: 0.5077
 epoch: 15, train_loss: 0.9055, test_loss: 1.1443, test_f1: 0.5125
 epoch: 16, train_loss: 0.8973, test_loss: 1.2512, test_f1: 0.4790
 epoch: 17, train_loss: 0.8743, test_loss: 1.2359, test_f1: 0.5368
 epoch: 18, train_loss: 0.8662, test_loss: 1.2955, test_f1: 0.4993
 epoch: 19, train_loss: 0.8574, test_loss: 1.0618, test_f1: 0.5217
 epoch: 20, train_loss: 0.8523, test_loss: 1.3779, test_f1: 0.5073
 epoch: 21, train_loss: 0.8305, test_loss: 1.0460, test_f1: 0.5232
 epoch: 22, train_loss: 0.8323, test_loss: 1.6531, test_f1: 0.5235
 epoch: 23, train_loss: 0.8163, test_loss: 1.7711, test_f1: 0.5158
 epoch: 24, train_loss: 0.8210, test_loss: 1.8247, test_f1: 0.5138
 epoch: 25, train_loss: 0.8166, test_loss: 1.4413, test_f1: 0.5241
 epoch: 26, train_loss: 0.8225, test_loss: 1.5445, test_f1: 0.5448
 epoch: 27, train_loss: 0.7956, test_loss: 1.7670, test_f1: 0.5265
 epoch: 28, train_loss: 0.7884, test_loss: 1.4783, test_f1: 0.5319
 epoch: 29, train_loss: 0.7863, test_loss: 1.6078, test_f1: 0.5393
 epoch: 30, train_loss: 0.7980, test_loss: 1.4641, test_f1: 0.5507
 epoch: 31, train_loss: 0.7857, test_loss: 1.9749, test_f1: 0.5285
 epoch: 32, train_loss: 0.7765, test_loss: 1.5500, test_f1: 0.5338
 epoch: 33, train_loss: 0.7633, test_loss: 1.6973, test_f1: 0.4512
 epoch: 34, train_loss: 0.7938, test_loss: 1.5038, test_f1: 0.5471
 epoch: 35, train_loss: 0.7819, test_loss: 1.4660, test_f1: 0.5403
 epoch: 36, train_loss: 0.7479, test_loss: 2.2602, test_f1: 0.5487
 epoch: 37, train_loss: 0.7431, test_loss: 1.5215, test_f1: 0.5151
 epoch: 38, train_loss: 0.7519, test_loss: 1.3979, test_f1: 0.5433
 epoch: 39, train_loss: 0.7561, test_loss: 1.4997, test_f1: 0.5489
 epoch: 40, train_loss: 0.7347, test_loss: 1.6570, test_f1: 0.5370
 epoch: 41, train_loss: 0.7547, test_loss: 1.8815, test_f1: 0.5488
 epoch: 42, train_loss: 0.7374, test_loss: 2.0233, test_f1: 0.4831
 epoch: 43, train_loss: 0.7319, test_loss: 1.4725, test_f1: 0.4993
 epoch: 44, train_loss: 0.7261, test_loss: 1.8430, test_f1: 0.5435
 epoch: 45, train_loss: 0.7251, test_loss: 1.4172, test_f1: 0.5457
 epoch: 46, train_loss: 0.7133, test_loss: 1.7439, test_f1: 0.5527
 epoch: 47, train_loss: 0.7243, test_loss: 1.9133, test_f1: 0.5730
 epoch: 48, train_loss: 0.7040, test_loss: 1.4119, test_f1: 0.5568
 epoch: 49, train_loss: 0.7261, test_loss: 2.0924, test_f1: 0.5515
 epoch: 50, train_loss: 0.7058, test_loss: 1.9246, test_f1: 0.5627
 epoch: 51, train_loss: 0.6878, test_loss: 1.8093, test_f1: 0.5665
 epoch: 52, train_loss: 0.7026, test_loss: 1.6929, test_f1: 0.5565
 epoch: 53, train_loss: 0.6904, test_loss: 1.6960, test_f1: 0.5360
 epoch: 54, train_loss: 0.6949, test_loss: 1.6475, test_f1: 0.5676
 epoch: 55, train_loss: 0.6775, test_loss: 1.7290, test_f1: 0.5502
 epoch: 56, train_loss: 0.6832, test_loss: 1.6182, test_f1: 0.5806
 epoch: 57, train_loss: 0.6785, test_loss: 2.0501, test_f1: 0.5447
 epoch: 58, train_loss: 0.6744, test_loss: 1.5489, test_f1: 0.5499
 epoch: 59, train_loss: 0.6713, test_loss: 1.5475, test_f1: 0.5384
 epoch: 60, train_loss: 0.6763, test_loss: 1.3195, test_f1: 0.5459
 epoch: 61, train_loss: 0.6857, test_loss: 1.8555, test_f1: 0.5361
 epoch: 62, train_loss: 0.7033, test_loss: 1.8000, test_f1: 0.5511
 epoch: 63, train_loss: 0.6659, test_loss: 1.4558, test_f1: 0.5385
 epoch: 64, train_loss: 0.6795, test_loss: 1.5136, test_f1: 0.5543
 epoch: 65, train_loss: 0.6725, test_loss: 1.6061, test_f1: 0.5605
 epoch: 66, train_loss: 0.6451, test_loss: 1.5905, test_f1: 0.5143
 epoch: 67, train_loss: 0.6462, test_loss: 1.6080, test_f1: 0.5235
 epoch: 68, train_loss: 0.6559, test_loss: 1.5839, test_f1: 0.5426
 epoch: 69, train_loss: 0.6660, test_loss: 1.6144, test_f1: 0.5546
 epoch: 70, train_loss: 0.6429, test_loss: 1.5727, test_f1: 0.5488
 epoch: 71, train_loss: 0.6371, test_loss: 1.4940, test_f1: 0.5467
 epoch: 72, train_loss: 0.6371, test_loss: 1.3759, test_f1: 0.5530
 epoch: 73, train_loss: 0.6626, test_loss: 1.7347, test_f1: 0.5046
 epoch: 74, train_loss: 0.6719, test_loss: 1.7801, test_f1: 0.5545
 epoch: 75, train_loss: 0.6425, test_loss: 1.4124, test_f1: 0.5342
 epoch: 76, train_loss: 0.6485, test_loss: 1.8087, test_f1: 0.5744
 epoch: 77, train_loss: 0.6598, test_loss: 1.6927, test_f1: 0.5337
 epoch: 78, train_loss: 0.6432, test_loss: 1.3336, test_f1: 0.5579
 epoch: 79, train_loss: 0.6642, test_loss: 1.4196, test_f1: 0.5570
 epoch: 80, train_loss: 0.6390, test_loss: 1.6465, test_f1: 0.5470
 epoch: 81, train_loss: 0.6443, test_loss: 1.7108, test_f1: 0.5449
 epoch: 82, train_loss: 0.6311, test_loss: 1.6407, test_f1: 0.5707
 epoch: 83, train_loss: 0.6378, test_loss: 1.6347, test_f1: 0.5656
 epoch: 84, train_loss: 0.6457, test_loss: 1.4927, test_f1: 0.5452
 epoch: 85, train_loss: 0.6147, test_loss: 1.4777, test_f1: 0.5300
 epoch: 86, train_loss: 0.6336, test_loss: 1.7635, test_f1: 0.5407
 epoch: 87, train_loss: 0.6293, test_loss: 1.6388, test_f1: 0.5237
 epoch: 88, train_loss: 0.6570, test_loss: 1.7414, test_f1: 0.5837
 epoch: 89, train_loss: 0.6478, test_loss: 2.0779, test_f1: 0.5317
 epoch: 90, train_loss: 0.6469, test_loss: 1.7762, test_f1: 0.5612
 epoch: 91, train_loss: 0.6303, test_loss: 1.5259, test_f1: 0.5514
 epoch: 92, train_loss: 0.6296, test_loss: 1.8227, test_f1: 0.5550
 epoch: 93, train_loss: 0.6356, test_loss: 1.7525, test_f1: 0.5600
 epoch: 94, train_loss: 0.6460, test_loss: 1.7639, test_f1: 0.5319
 epoch: 95, train_loss: 0.6189, test_loss: 1.9818, test_f1: 0.5512
 epoch: 96, train_loss: 0.6251, test_loss: 1.6791, test_f1: 0.5346
 epoch: 97, train_loss: 0.6154, test_loss: 2.1157, test_f1: 0.5604
 epoch: 98, train_loss: 0.6186, test_loss: 2.1696, test_f1: 0.5477
 epoch: 99, train_loss: 0.6230, test_loss: 1.6190, test_f1: 0.5453
##################ITERATION #6 ****************************************
 epoch: 0, train_loss: 1.3111, test_loss: 1.2936, test_f1: 0.2281
 epoch: 1, train_loss: 1.1987, test_loss: 1.2558, test_f1: 0.2582
 epoch: 2, train_loss: 1.1821, test_loss: 1.2112, test_f1: 0.2919
 epoch: 3, train_loss: 1.1551, test_loss: 1.1942, test_f1: 0.3784
 epoch: 4, train_loss: 1.1288, test_loss: 1.1481, test_f1: 0.3992
 epoch: 5, train_loss: 1.0903, test_loss: 1.1234, test_f1: 0.4684
 epoch: 6, train_loss: 1.0576, test_loss: 1.0990, test_f1: 0.4303
 epoch: 7, train_loss: 1.0218, test_loss: 1.0778, test_f1: 0.4744
 epoch: 8, train_loss: 1.0079, test_loss: 1.1210, test_f1: 0.3994
 epoch: 9, train_loss: 1.0041, test_loss: 1.0743, test_f1: 0.4693
 epoch: 10, train_loss: 0.9868, test_loss: 1.0601, test_f1: 0.5080
 epoch: 11, train_loss: 0.9685, test_loss: 1.0501, test_f1: 0.5121
 epoch: 12, train_loss: 0.9573, test_loss: 1.0777, test_f1: 0.4868
 epoch: 13, train_loss: 0.9613, test_loss: 1.0604, test_f1: 0.4854
 epoch: 14, train_loss: 0.9359, test_loss: 1.1286, test_f1: 0.5095
 epoch: 15, train_loss: 0.9178, test_loss: 1.1615, test_f1: 0.4639
 epoch: 16, train_loss: 0.9118, test_loss: 1.0715, test_f1: 0.4646
 epoch: 17, train_loss: 0.8879, test_loss: 1.0859, test_f1: 0.4808
 epoch: 18, train_loss: 0.8993, test_loss: 1.0857, test_f1: 0.4936
 epoch: 19, train_loss: 0.8792, test_loss: 1.1440, test_f1: 0.4626
 epoch: 20, train_loss: 0.8627, test_loss: 1.1514, test_f1: 0.5186
 epoch: 21, train_loss: 0.8525, test_loss: 1.1182, test_f1: 0.4863
 epoch: 22, train_loss: 0.8347, test_loss: 1.1244, test_f1: 0.5211
 epoch: 23, train_loss: 0.8401, test_loss: 1.0986, test_f1: 0.4887
 epoch: 24, train_loss: 0.8474, test_loss: 1.0980, test_f1: 0.4741
 epoch: 25, train_loss: 0.8147, test_loss: 1.0681, test_f1: 0.5362
 epoch: 26, train_loss: 0.8100, test_loss: 1.1251, test_f1: 0.5328
 epoch: 27, train_loss: 0.8145, test_loss: 1.1828, test_f1: 0.5246
 epoch: 28, train_loss: 0.8127, test_loss: 1.0639, test_f1: 0.5142
 epoch: 29, train_loss: 0.7944, test_loss: 1.0836, test_f1: 0.5263
 epoch: 30, train_loss: 0.8043, test_loss: 1.0846, test_f1: 0.5821
 epoch: 31, train_loss: 0.7862, test_loss: 1.0765, test_f1: 0.5465
 epoch: 32, train_loss: 0.7683, test_loss: 1.0059, test_f1: 0.5655
 epoch: 33, train_loss: 0.7794, test_loss: 1.1767, test_f1: 0.5708
 epoch: 34, train_loss: 0.7523, test_loss: 1.1247, test_f1: 0.5505
 epoch: 35, train_loss: 0.7669, test_loss: 1.1342, test_f1: 0.5743
 epoch: 36, train_loss: 0.7543, test_loss: 1.1245, test_f1: 0.5568
 epoch: 37, train_loss: 0.7587, test_loss: 1.1535, test_f1: 0.5869
 epoch: 38, train_loss: 0.7502, test_loss: 1.1225, test_f1: 0.5625
 epoch: 39, train_loss: 0.7625, test_loss: 1.1627, test_f1: 0.5985
 epoch: 40, train_loss: 0.7513, test_loss: 1.1104, test_f1: 0.5906
 epoch: 41, train_loss: 0.7509, test_loss: 1.1457, test_f1: 0.5783
 epoch: 42, train_loss: 0.7500, test_loss: 1.1518, test_f1: 0.5728
 epoch: 43, train_loss: 0.7303, test_loss: 1.1298, test_f1: 0.5588
 epoch: 44, train_loss: 0.7415, test_loss: 1.1847, test_f1: 0.5561
 epoch: 45, train_loss: 0.7393, test_loss: 1.1272, test_f1: 0.5612
 epoch: 46, train_loss: 0.7307, test_loss: 1.2694, test_f1: 0.5711
 epoch: 47, train_loss: 0.7345, test_loss: 1.2420, test_f1: 0.5655
 epoch: 48, train_loss: 0.7209, test_loss: 1.1675, test_f1: 0.5891
 epoch: 49, train_loss: 0.7197, test_loss: 1.3684, test_f1: 0.5618
 epoch: 50, train_loss: 0.7297, test_loss: 1.3195, test_f1: 0.5600
 epoch: 51, train_loss: 0.6999, test_loss: 1.2492, test_f1: 0.5571
 epoch: 52, train_loss: 0.7067, test_loss: 1.2499, test_f1: 0.5766
 epoch: 53, train_loss: 0.6992, test_loss: 1.2559, test_f1: 0.5741
 epoch: 54, train_loss: 0.6953, test_loss: 1.2339, test_f1: 0.5801
 epoch: 55, train_loss: 0.6930, test_loss: 1.4136, test_f1: 0.5651
 epoch: 56, train_loss: 0.6870, test_loss: 1.3215, test_f1: 0.5771
 epoch: 57, train_loss: 0.6770, test_loss: 1.3580, test_f1: 0.5533
 epoch: 58, train_loss: 0.7159, test_loss: 1.3164, test_f1: 0.5737
 epoch: 59, train_loss: 0.6720, test_loss: 1.3600, test_f1: 0.5735
 epoch: 60, train_loss: 0.6845, test_loss: 1.2904, test_f1: 0.5635
 epoch: 61, train_loss: 0.6906, test_loss: 1.2939, test_f1: 0.5657
 epoch: 62, train_loss: 0.6838, test_loss: 1.3756, test_f1: 0.5562
 epoch: 63, train_loss: 0.6773, test_loss: 1.3496, test_f1: 0.5764
 epoch: 64, train_loss: 0.6652, test_loss: 1.4315, test_f1: 0.5557
 epoch: 65, train_loss: 0.6835, test_loss: 1.3545, test_f1: 0.5426
 epoch: 66, train_loss: 0.6681, test_loss: 1.4340, test_f1: 0.5441
 epoch: 67, train_loss: 0.6631, test_loss: 1.4899, test_f1: 0.5577
 epoch: 68, train_loss: 0.6733, test_loss: 1.4776, test_f1: 0.5525
 epoch: 69, train_loss: 0.6727, test_loss: 1.3935, test_f1: 0.5543
 epoch: 70, train_loss: 0.6664, test_loss: 1.4173, test_f1: 0.5685
 epoch: 71, train_loss: 0.6628, test_loss: 1.3311, test_f1: 0.5721
 epoch: 72, train_loss: 0.6695, test_loss: 1.3470, test_f1: 0.5458
 epoch: 73, train_loss: 0.6745, test_loss: 1.4875, test_f1: 0.5708
 epoch: 74, train_loss: 0.6541, test_loss: 1.4309, test_f1: 0.5538
 epoch: 75, train_loss: 0.6657, test_loss: 1.4070, test_f1: 0.5569
 epoch: 76, train_loss: 0.6690, test_loss: 1.4661, test_f1: 0.5680
 epoch: 77, train_loss: 0.6661, test_loss: 1.5735, test_f1: 0.5837
 epoch: 78, train_loss: 0.6730, test_loss: 1.5929, test_f1: 0.5689
 epoch: 79, train_loss: 0.6617, test_loss: 1.5218, test_f1: 0.5582
 epoch: 80, train_loss: 0.6491, test_loss: 1.5002, test_f1: 0.5771
 epoch: 81, train_loss: 0.6717, test_loss: 1.6648, test_f1: 0.5283
 epoch: 82, train_loss: 0.6515, test_loss: 1.5442, test_f1: 0.5813
 epoch: 83, train_loss: 0.6625, test_loss: 1.4863, test_f1: 0.5815
 epoch: 84, train_loss: 0.6501, test_loss: 1.4598, test_f1: 0.5693
 epoch: 85, train_loss: 0.6470, test_loss: 1.5334, test_f1: 0.5766
 epoch: 86, train_loss: 0.6574, test_loss: 1.5341, test_f1: 0.5648
 epoch: 87, train_loss: 0.6486, test_loss: 1.5693, test_f1: 0.5599
 epoch: 88, train_loss: 0.6348, test_loss: 1.5704, test_f1: 0.5699
 epoch: 89, train_loss: 0.6478, test_loss: 1.6205, test_f1: 0.5449
 epoch: 90, train_loss: 0.6407, test_loss: 1.6231, test_f1: 0.5454
 epoch: 91, train_loss: 0.6526, test_loss: 1.5741, test_f1: 0.5633
 epoch: 92, train_loss: 0.6506, test_loss: 1.6491, test_f1: 0.5457
 epoch: 93, train_loss: 0.6461, test_loss: 1.5953, test_f1: 0.5657
 epoch: 94, train_loss: 0.6440, test_loss: 1.5543, test_f1: 0.5503
 epoch: 95, train_loss: 0.6371, test_loss: 1.6010, test_f1: 0.5681
 epoch: 96, train_loss: 0.6418, test_loss: 1.7194, test_f1: 0.5533
 epoch: 97, train_loss: 0.6587, test_loss: 1.6110, test_f1: 0.5454
 epoch: 98, train_loss: 0.6404, test_loss: 1.6573, test_f1: 0.5488
 epoch: 99, train_loss: 0.6423, test_loss: 1.5857, test_f1: 0.5484
##################ITERATION #7 ****************************************
 epoch: 0, train_loss: 1.4987, test_loss: 1.3933, test_f1: 0.2281
 epoch: 1, train_loss: 1.2171, test_loss: 1.3507, test_f1: 0.2740
 epoch: 2, train_loss: 1.1457, test_loss: 1.1606, test_f1: 0.3953
 epoch: 3, train_loss: 1.0871, test_loss: 1.1225, test_f1: 0.4397
 epoch: 4, train_loss: 1.0570, test_loss: 1.1192, test_f1: 0.4791
 epoch: 5, train_loss: 1.0392, test_loss: 1.0994, test_f1: 0.4969
 epoch: 6, train_loss: 1.0323, test_loss: 1.1231, test_f1: 0.4852
 epoch: 7, train_loss: 1.0093, test_loss: 1.1092, test_f1: 0.5007
 epoch: 8, train_loss: 0.9979, test_loss: 1.0760, test_f1: 0.5159
 epoch: 9, train_loss: 0.9929, test_loss: 1.0583, test_f1: 0.5165
 epoch: 10, train_loss: 0.9850, test_loss: 1.0587, test_f1: 0.5334
 epoch: 11, train_loss: 0.9737, test_loss: 1.0457, test_f1: 0.5229
 epoch: 12, train_loss: 0.9544, test_loss: 1.0809, test_f1: 0.5044
 epoch: 13, train_loss: 0.9474, test_loss: 1.1757, test_f1: 0.4872
 epoch: 14, train_loss: 0.9417, test_loss: 1.0277, test_f1: 0.5406
 epoch: 15, train_loss: 0.9315, test_loss: 1.0290, test_f1: 0.5072
 epoch: 16, train_loss: 0.9002, test_loss: 1.0139, test_f1: 0.5504
 epoch: 17, train_loss: 0.9160, test_loss: 1.0114, test_f1: 0.5623
 epoch: 18, train_loss: 0.9033, test_loss: 1.0067, test_f1: 0.5282
 epoch: 19, train_loss: 0.9084, test_loss: 1.0208, test_f1: 0.5378
 epoch: 20, train_loss: 0.8846, test_loss: 1.0360, test_f1: 0.5187
 epoch: 21, train_loss: 0.8863, test_loss: 1.0523, test_f1: 0.5166
 epoch: 22, train_loss: 0.8645, test_loss: 1.1937, test_f1: 0.4548
 epoch: 23, train_loss: 0.8629, test_loss: 1.0392, test_f1: 0.5340
 epoch: 24, train_loss: 0.8563, test_loss: 1.1135, test_f1: 0.5045
 epoch: 25, train_loss: 0.8513, test_loss: 1.0958, test_f1: 0.5347
 epoch: 26, train_loss: 0.8407, test_loss: 1.0980, test_f1: 0.5402
 epoch: 27, train_loss: 0.8362, test_loss: 1.0753, test_f1: 0.5312
 epoch: 28, train_loss: 0.8116, test_loss: 1.0553, test_f1: 0.5384
 epoch: 29, train_loss: 0.8237, test_loss: 1.0770, test_f1: 0.5682
 epoch: 30, train_loss: 0.7901, test_loss: 1.0862, test_f1: 0.5544
 epoch: 31, train_loss: 0.8088, test_loss: 1.0329, test_f1: 0.5584
 epoch: 32, train_loss: 0.8093, test_loss: 1.0663, test_f1: 0.5492
 epoch: 33, train_loss: 0.7947, test_loss: 1.0775, test_f1: 0.5632
 epoch: 34, train_loss: 0.7917, test_loss: 1.1202, test_f1: 0.5734
 epoch: 35, train_loss: 0.7769, test_loss: 1.1015, test_f1: 0.5761
 epoch: 36, train_loss: 0.7628, test_loss: 1.1069, test_f1: 0.5535
 epoch: 37, train_loss: 0.7638, test_loss: 1.0746, test_f1: 0.5804
 epoch: 38, train_loss: 0.7671, test_loss: 1.1006, test_f1: 0.5687
 epoch: 39, train_loss: 0.7477, test_loss: 1.1627, test_f1: 0.5803
 epoch: 40, train_loss: 0.7698, test_loss: 1.0630, test_f1: 0.5915
 epoch: 41, train_loss: 0.7557, test_loss: 1.1310, test_f1: 0.5672
 epoch: 42, train_loss: 0.7561, test_loss: 1.1848, test_f1: 0.5952
 epoch: 43, train_loss: 0.7629, test_loss: 1.1031, test_f1: 0.5632
 epoch: 44, train_loss: 0.7514, test_loss: 1.1564, test_f1: 0.5440
 epoch: 45, train_loss: 0.7469, test_loss: 1.1438, test_f1: 0.5647
 epoch: 46, train_loss: 0.7413, test_loss: 1.1444, test_f1: 0.6158
 epoch: 47, train_loss: 0.7372, test_loss: 1.2979, test_f1: 0.5794
 epoch: 48, train_loss: 0.7434, test_loss: 1.0745, test_f1: 0.6066
 epoch: 49, train_loss: 0.7380, test_loss: 1.2199, test_f1: 0.5713
 epoch: 50, train_loss: 0.7331, test_loss: 1.1622, test_f1: 0.5762
 epoch: 51, train_loss: 0.7134, test_loss: 1.1668, test_f1: 0.6167
 epoch: 52, train_loss: 0.7099, test_loss: 1.1516, test_f1: 0.5826
 epoch: 53, train_loss: 0.7009, test_loss: 1.1196, test_f1: 0.6101
 epoch: 54, train_loss: 0.7069, test_loss: 1.1313, test_f1: 0.6058
 epoch: 55, train_loss: 0.7011, test_loss: 1.1967, test_f1: 0.5865
 epoch: 56, train_loss: 0.6987, test_loss: 1.1870, test_f1: 0.6146
 epoch: 57, train_loss: 0.6959, test_loss: 1.1553, test_f1: 0.6163
 epoch: 58, train_loss: 0.7118, test_loss: 1.1400, test_f1: 0.5823
 epoch: 59, train_loss: 0.7021, test_loss: 1.2485, test_f1: 0.5878
 epoch: 60, train_loss: 0.7041, test_loss: 1.2074, test_f1: 0.6096
 epoch: 61, train_loss: 0.6873, test_loss: 1.1497, test_f1: 0.5947
 epoch: 62, train_loss: 0.6963, test_loss: 1.2736, test_f1: 0.5999
 epoch: 63, train_loss: 0.6839, test_loss: 1.2236, test_f1: 0.6018
 epoch: 64, train_loss: 0.6864, test_loss: 1.2688, test_f1: 0.5928
 epoch: 65, train_loss: 0.6906, test_loss: 1.2706, test_f1: 0.5854
 epoch: 66, train_loss: 0.6868, test_loss: 1.3498, test_f1: 0.5730
 epoch: 67, train_loss: 0.6834, test_loss: 1.2342, test_f1: 0.6127
 epoch: 68, train_loss: 0.6830, test_loss: 1.3158, test_f1: 0.5884
 epoch: 69, train_loss: 0.6960, test_loss: 1.3021, test_f1: 0.5751
 epoch: 70, train_loss: 0.6925, test_loss: 1.3352, test_f1: 0.5745
 epoch: 71, train_loss: 0.6757, test_loss: 1.2882, test_f1: 0.5735
 epoch: 72, train_loss: 0.6886, test_loss: 1.2956, test_f1: 0.6080
 epoch: 73, train_loss: 0.6726, test_loss: 1.3097, test_f1: 0.5958
 epoch: 74, train_loss: 0.6711, test_loss: 1.4036, test_f1: 0.5789
 epoch: 75, train_loss: 0.6748, test_loss: 1.3632, test_f1: 0.5953
 epoch: 76, train_loss: 0.6687, test_loss: 1.3536, test_f1: 0.5800
 epoch: 77, train_loss: 0.6756, test_loss: 1.2960, test_f1: 0.5996
 epoch: 78, train_loss: 0.6784, test_loss: 1.4438, test_f1: 0.5811
 epoch: 79, train_loss: 0.6674, test_loss: 1.3666, test_f1: 0.5901
 epoch: 80, train_loss: 0.6658, test_loss: 1.3400, test_f1: 0.5864
 epoch: 81, train_loss: 0.6706, test_loss: 1.4067, test_f1: 0.5686
 epoch: 82, train_loss: 0.6714, test_loss: 1.4494, test_f1: 0.6156
 epoch: 83, train_loss: 0.6778, test_loss: 1.4117, test_f1: 0.5848
 epoch: 84, train_loss: 0.6881, test_loss: 1.4662, test_f1: 0.5873
 epoch: 85, train_loss: 0.6708, test_loss: 1.4794, test_f1: 0.5864
 epoch: 86, train_loss: 0.6591, test_loss: 1.4058, test_f1: 0.5790
 epoch: 87, train_loss: 0.6674, test_loss: 1.4207, test_f1: 0.5827
 epoch: 88, train_loss: 0.6627, test_loss: 1.3623, test_f1: 0.5917
 epoch: 89, train_loss: 0.6687, test_loss: 1.2344, test_f1: 0.5872
 epoch: 90, train_loss: 0.6719, test_loss: 1.5108, test_f1: 0.5761
 epoch: 91, train_loss: 0.6660, test_loss: 1.4518, test_f1: 0.5912
 epoch: 92, train_loss: 0.6599, test_loss: 1.3504, test_f1: 0.5909
 epoch: 93, train_loss: 0.6499, test_loss: 1.4349, test_f1: 0.5971
 epoch: 94, train_loss: 0.6481, test_loss: 1.4804, test_f1: 0.5999
 epoch: 95, train_loss: 0.6624, test_loss: 1.4719, test_f1: 0.5821
 epoch: 96, train_loss: 0.6539, test_loss: 1.3958, test_f1: 0.6031
 epoch: 97, train_loss: 0.6416, test_loss: 1.4645, test_f1: 0.5801
 epoch: 98, train_loss: 0.6404, test_loss: 1.5845, test_f1: 0.5895
 epoch: 99, train_loss: 0.6536, test_loss: 1.4263, test_f1: 0.5687
##################ITERATION #8 ****************************************
 epoch: 0, train_loss: 1.4370, test_loss: 1.3474, test_f1: 0.2281
 epoch: 1, train_loss: 1.2405, test_loss: 1.2949, test_f1: 0.2706
 epoch: 2, train_loss: 1.1760, test_loss: 1.2559, test_f1: 0.3402
 epoch: 3, train_loss: 1.1549, test_loss: 1.2181, test_f1: 0.4074
 epoch: 4, train_loss: 1.1016, test_loss: 1.1652, test_f1: 0.4635
 epoch: 5, train_loss: 1.0917, test_loss: 1.1737, test_f1: 0.5038
 epoch: 6, train_loss: 1.0742, test_loss: 1.1084, test_f1: 0.4819
 epoch: 7, train_loss: 1.0534, test_loss: 1.0743, test_f1: 0.5490
 epoch: 8, train_loss: 1.0208, test_loss: 1.0573, test_f1: 0.5385
 epoch: 9, train_loss: 1.0037, test_loss: 1.0206, test_f1: 0.5564
 epoch: 10, train_loss: 0.9873, test_loss: 1.0224, test_f1: 0.5699
 epoch: 11, train_loss: 0.9646, test_loss: 1.0203, test_f1: 0.5429
 epoch: 12, train_loss: 0.9671, test_loss: 1.0146, test_f1: 0.5713
 epoch: 13, train_loss: 0.9429, test_loss: 1.0005, test_f1: 0.5741
 epoch: 14, train_loss: 0.9489, test_loss: 1.0059, test_f1: 0.5789
 epoch: 15, train_loss: 0.9216, test_loss: 0.9983, test_f1: 0.5692
 epoch: 16, train_loss: 0.9265, test_loss: 1.0034, test_f1: 0.5810
 epoch: 17, train_loss: 0.8846, test_loss: 0.9853, test_f1: 0.6135
 epoch: 18, train_loss: 0.8926, test_loss: 0.9872, test_f1: 0.5842
 epoch: 19, train_loss: 0.8873, test_loss: 1.0043, test_f1: 0.5793
 epoch: 20, train_loss: 0.8625, test_loss: 0.9689, test_f1: 0.5970
 epoch: 21, train_loss: 0.8715, test_loss: 0.9962, test_f1: 0.5644
 epoch: 22, train_loss: 0.8692, test_loss: 1.0172, test_f1: 0.5514
 epoch: 23, train_loss: 0.8641, test_loss: 0.9745, test_f1: 0.5966
 epoch: 24, train_loss: 0.8554, test_loss: 0.9732, test_f1: 0.5710
 epoch: 25, train_loss: 0.8444, test_loss: 0.9764, test_f1: 0.5652
 epoch: 26, train_loss: 0.8428, test_loss: 0.9977, test_f1: 0.5899
 epoch: 27, train_loss: 0.8195, test_loss: 0.9841, test_f1: 0.5917
 epoch: 28, train_loss: 0.8181, test_loss: 0.9961, test_f1: 0.5989
 epoch: 29, train_loss: 0.8382, test_loss: 0.9733, test_f1: 0.6027
 epoch: 30, train_loss: 0.8258, test_loss: 1.0187, test_f1: 0.5698
 epoch: 31, train_loss: 0.8137, test_loss: 0.9982, test_f1: 0.6129
 epoch: 32, train_loss: 0.8139, test_loss: 0.9550, test_f1: 0.6015
 epoch: 33, train_loss: 0.7988, test_loss: 1.0286, test_f1: 0.5830
 epoch: 34, train_loss: 0.7946, test_loss: 1.0173, test_f1: 0.5731
 epoch: 35, train_loss: 0.8073, test_loss: 0.9609, test_f1: 0.6041
 epoch: 36, train_loss: 0.7853, test_loss: 0.9845, test_f1: 0.5755
 epoch: 37, train_loss: 0.7811, test_loss: 0.9765, test_f1: 0.5933
 epoch: 38, train_loss: 0.8013, test_loss: 0.9839, test_f1: 0.5837
 epoch: 39, train_loss: 0.7901, test_loss: 0.9533, test_f1: 0.5840
 epoch: 40, train_loss: 0.7956, test_loss: 0.9638, test_f1: 0.5787
 epoch: 41, train_loss: 0.7717, test_loss: 0.9678, test_f1: 0.5761
 epoch: 42, train_loss: 0.7928, test_loss: 0.9660, test_f1: 0.5970
 epoch: 43, train_loss: 0.7908, test_loss: 1.0163, test_f1: 0.5553
 epoch: 44, train_loss: 0.7629, test_loss: 0.9479, test_f1: 0.5765
 epoch: 45, train_loss: 0.7658, test_loss: 0.9716, test_f1: 0.5740
 epoch: 46, train_loss: 0.7594, test_loss: 1.0079, test_f1: 0.5362
 epoch: 47, train_loss: 0.7735, test_loss: 1.0111, test_f1: 0.5996
 epoch: 48, train_loss: 0.7754, test_loss: 0.9965, test_f1: 0.5719
 epoch: 49, train_loss: 0.7548, test_loss: 0.9856, test_f1: 0.6209
 epoch: 50, train_loss: 0.7655, test_loss: 1.0145, test_f1: 0.5919
 epoch: 51, train_loss: 0.7391, test_loss: 0.9856, test_f1: 0.5989
 epoch: 52, train_loss: 0.7313, test_loss: 1.0128, test_f1: 0.6018
 epoch: 53, train_loss: 0.7516, test_loss: 1.0732, test_f1: 0.5751
 epoch: 54, train_loss: 0.7286, test_loss: 1.0173, test_f1: 0.5676
 epoch: 55, train_loss: 0.7438, test_loss: 1.0562, test_f1: 0.5878
 epoch: 56, train_loss: 0.7444, test_loss: 1.0987, test_f1: 0.5990
 epoch: 57, train_loss: 0.7213, test_loss: 1.0624, test_f1: 0.5595
 epoch: 58, train_loss: 0.7127, test_loss: 1.0878, test_f1: 0.6147
 epoch: 59, train_loss: 0.7200, test_loss: 1.0569, test_f1: 0.6059
 epoch: 60, train_loss: 0.7354, test_loss: 1.0331, test_f1: 0.5818
 epoch: 61, train_loss: 0.7251, test_loss: 1.0784, test_f1: 0.5757
 epoch: 62, train_loss: 0.7176, test_loss: 1.0406, test_f1: 0.5860
 epoch: 63, train_loss: 0.7317, test_loss: 1.0165, test_f1: 0.6095
 epoch: 64, train_loss: 0.7181, test_loss: 1.0214, test_f1: 0.6065
 epoch: 65, train_loss: 0.6948, test_loss: 1.0587, test_f1: 0.6090
 epoch: 66, train_loss: 0.7114, test_loss: 1.1005, test_f1: 0.5647
 epoch: 67, train_loss: 0.7319, test_loss: 1.0277, test_f1: 0.5938
 epoch: 68, train_loss: 0.7156, test_loss: 1.0876, test_f1: 0.5914
 epoch: 69, train_loss: 0.7214, test_loss: 1.0820, test_f1: 0.6198
 epoch: 70, train_loss: 0.7087, test_loss: 1.0950, test_f1: 0.5723
 epoch: 71, train_loss: 0.7018, test_loss: 1.0941, test_f1: 0.6063
 epoch: 72, train_loss: 0.6989, test_loss: 1.0100, test_f1: 0.6035
 epoch: 73, train_loss: 0.7072, test_loss: 1.1215, test_f1: 0.6208
 epoch: 74, train_loss: 0.7229, test_loss: 1.0287, test_f1: 0.6095
 epoch: 75, train_loss: 0.7209, test_loss: 1.0215, test_f1: 0.6058
 epoch: 76, train_loss: 0.7218, test_loss: 1.0958, test_f1: 0.6176
 epoch: 77, train_loss: 0.7173, test_loss: 1.0432, test_f1: 0.5939
 epoch: 78, train_loss: 0.7077, test_loss: 1.0603, test_f1: 0.6164
 epoch: 79, train_loss: 0.7123, test_loss: 1.0674, test_f1: 0.5956
 epoch: 80, train_loss: 0.7134, test_loss: 1.0708, test_f1: 0.6172
 epoch: 81, train_loss: 0.6988, test_loss: 1.0756, test_f1: 0.6041
 epoch: 82, train_loss: 0.6785, test_loss: 1.1088, test_f1: 0.5793
 epoch: 83, train_loss: 0.6908, test_loss: 1.0845, test_f1: 0.5926
 epoch: 84, train_loss: 0.6952, test_loss: 1.0865, test_f1: 0.6215
 epoch: 85, train_loss: 0.6924, test_loss: 1.0802, test_f1: 0.6097
 epoch: 86, train_loss: 0.6912, test_loss: 1.0592, test_f1: 0.5974
 epoch: 87, train_loss: 0.7123, test_loss: 1.0117, test_f1: 0.6315
 epoch: 88, train_loss: 0.6996, test_loss: 1.0453, test_f1: 0.6173
 epoch: 89, train_loss: 0.7079, test_loss: 1.1846, test_f1: 0.6232
 epoch: 90, train_loss: 0.6867, test_loss: 1.1344, test_f1: 0.6084
 epoch: 91, train_loss: 0.6853, test_loss: 1.1479, test_f1: 0.6154
 epoch: 92, train_loss: 0.6811, test_loss: 1.1197, test_f1: 0.6208
 epoch: 93, train_loss: 0.6895, test_loss: 1.0878, test_f1: 0.6097
 epoch: 94, train_loss: 0.6971, test_loss: 1.0329, test_f1: 0.6079
 epoch: 95, train_loss: 0.6876, test_loss: 1.1035, test_f1: 0.6214
 epoch: 96, train_loss: 0.6974, test_loss: 1.0453, test_f1: 0.6157
 epoch: 97, train_loss: 0.6896, test_loss: 1.1565, test_f1: 0.6070
 epoch: 98, train_loss: 0.6822, test_loss: 1.0850, test_f1: 0.6139
 epoch: 99, train_loss: 0.6842, test_loss: 1.0847, test_f1: 0.6001
##################ITERATION #9 ****************************************
 epoch: 0, train_loss: 1.6346, test_loss: 1.3771, test_f1: 0.2385
 epoch: 1, train_loss: 1.3115, test_loss: 1.3223, test_f1: 0.3142
 epoch: 2, train_loss: 1.2300, test_loss: 1.2667, test_f1: 0.3617
 epoch: 3, train_loss: 1.1944, test_loss: 1.2229, test_f1: 0.3787
 epoch: 4, train_loss: 1.1630, test_loss: 1.1736, test_f1: 0.4234
 epoch: 5, train_loss: 1.1239, test_loss: 1.1311, test_f1: 0.4432
 epoch: 6, train_loss: 1.0854, test_loss: 1.1098, test_f1: 0.4766
 epoch: 7, train_loss: 1.0746, test_loss: 1.0890, test_f1: 0.4837
 epoch: 8, train_loss: 1.0439, test_loss: 1.0442, test_f1: 0.5303
 epoch: 9, train_loss: 1.0120, test_loss: 1.0471, test_f1: 0.5025
 epoch: 10, train_loss: 0.9780, test_loss: 1.0062, test_f1: 0.5437
 epoch: 11, train_loss: 0.9796, test_loss: 0.9882, test_f1: 0.5495
 epoch: 12, train_loss: 0.9517, test_loss: 0.9864, test_f1: 0.5560
 epoch: 13, train_loss: 0.9322, test_loss: 0.9716, test_f1: 0.5537
 epoch: 14, train_loss: 0.9224, test_loss: 0.9468, test_f1: 0.5624
 epoch: 15, train_loss: 0.9033, test_loss: 0.9726, test_f1: 0.5666
 epoch: 16, train_loss: 0.8866, test_loss: 0.9577, test_f1: 0.5686
 epoch: 17, train_loss: 0.8887, test_loss: 0.9553, test_f1: 0.5419
 epoch: 18, train_loss: 0.8650, test_loss: 0.9673, test_f1: 0.5807
 epoch: 19, train_loss: 0.8422, test_loss: 0.9556, test_f1: 0.5723
 epoch: 20, train_loss: 0.8316, test_loss: 0.9925, test_f1: 0.5600
 epoch: 21, train_loss: 0.8415, test_loss: 0.9872, test_f1: 0.5665
 epoch: 22, train_loss: 0.8427, test_loss: 0.9924, test_f1: 0.5854
 epoch: 23, train_loss: 0.8346, test_loss: 0.9474, test_f1: 0.5846
 epoch: 24, train_loss: 0.8138, test_loss: 0.9493, test_f1: 0.5948
 epoch: 25, train_loss: 0.8069, test_loss: 0.9755, test_f1: 0.5880
 epoch: 26, train_loss: 0.7939, test_loss: 0.9322, test_f1: 0.5930
 epoch: 27, train_loss: 0.7844, test_loss: 0.9874, test_f1: 0.5909
 epoch: 28, train_loss: 0.7882, test_loss: 0.9823, test_f1: 0.6026
 epoch: 29, train_loss: 0.7868, test_loss: 1.0247, test_f1: 0.5619
 epoch: 30, train_loss: 0.7637, test_loss: 0.9986, test_f1: 0.5662
 epoch: 31, train_loss: 0.7848, test_loss: 1.0279, test_f1: 0.5355
 epoch: 32, train_loss: 0.7764, test_loss: 0.9612, test_f1: 0.6033
 epoch: 33, train_loss: 0.7700, test_loss: 0.9882, test_f1: 0.5828
 epoch: 34, train_loss: 0.7540, test_loss: 1.0254, test_f1: 0.5681
 epoch: 35, train_loss: 0.7529, test_loss: 0.9915, test_f1: 0.5825
 epoch: 36, train_loss: 0.7405, test_loss: 0.9787, test_f1: 0.5878
 epoch: 37, train_loss: 0.7515, test_loss: 0.9452, test_f1: 0.5976
 epoch: 38, train_loss: 0.7349, test_loss: 0.9863, test_f1: 0.5743
 epoch: 39, train_loss: 0.7307, test_loss: 0.9536, test_f1: 0.6020
 epoch: 40, train_loss: 0.7357, test_loss: 0.9509, test_f1: 0.5863
 epoch: 41, train_loss: 0.7167, test_loss: 0.9737, test_f1: 0.5827
 epoch: 42, train_loss: 0.7233, test_loss: 0.9889, test_f1: 0.6002
 epoch: 43, train_loss: 0.7305, test_loss: 1.0059, test_f1: 0.5754
 epoch: 44, train_loss: 0.7115, test_loss: 0.9651, test_f1: 0.5844
 epoch: 45, train_loss: 0.7026, test_loss: 0.9727, test_f1: 0.6052
 epoch: 46, train_loss: 0.7053, test_loss: 0.9197, test_f1: 0.5977
 epoch: 47, train_loss: 0.6925, test_loss: 0.9692, test_f1: 0.5723
 epoch: 48, train_loss: 0.7015, test_loss: 0.9877, test_f1: 0.5721
 epoch: 49, train_loss: 0.7054, test_loss: 1.0308, test_f1: 0.5850
 epoch: 50, train_loss: 0.7086, test_loss: 1.0067, test_f1: 0.5588
 epoch: 51, train_loss: 0.6866, test_loss: 0.9887, test_f1: 0.5915
 epoch: 52, train_loss: 0.6898, test_loss: 0.9669, test_f1: 0.5834
 epoch: 53, train_loss: 0.6843, test_loss: 0.9656, test_f1: 0.6058
 epoch: 54, train_loss: 0.6745, test_loss: 0.9655, test_f1: 0.5956
 epoch: 55, train_loss: 0.6955, test_loss: 0.9756, test_f1: 0.5825
 epoch: 56, train_loss: 0.6736, test_loss: 0.9619, test_f1: 0.5902
 epoch: 57, train_loss: 0.6790, test_loss: 0.9518, test_f1: 0.6045
 epoch: 58, train_loss: 0.6726, test_loss: 0.9879, test_f1: 0.5712
 epoch: 59, train_loss: 0.6653, test_loss: 0.9586, test_f1: 0.5997
 epoch: 60, train_loss: 0.6549, test_loss: 0.9603, test_f1: 0.6032
 epoch: 61, train_loss: 0.6562, test_loss: 1.0250, test_f1: 0.5803
 epoch: 62, train_loss: 0.6822, test_loss: 0.9761, test_f1: 0.6125
 epoch: 63, train_loss: 0.6648, test_loss: 0.9659, test_f1: 0.5928
 epoch: 64, train_loss: 0.6756, test_loss: 0.9688, test_f1: 0.5864
 epoch: 65, train_loss: 0.6607, test_loss: 1.0162, test_f1: 0.5800
 epoch: 66, train_loss: 0.6513, test_loss: 1.0415, test_f1: 0.5718
 epoch: 67, train_loss: 0.6545, test_loss: 0.9859, test_f1: 0.5918
 epoch: 68, train_loss: 0.6553, test_loss: 1.0075, test_f1: 0.5762
 epoch: 69, train_loss: 0.6824, test_loss: 0.9959, test_f1: 0.5878
 epoch: 70, train_loss: 0.6639, test_loss: 0.9950, test_f1: 0.5840
 epoch: 71, train_loss: 0.6568, test_loss: 1.0430, test_f1: 0.5662
 epoch: 72, train_loss: 0.6567, test_loss: 0.9485, test_f1: 0.5806
 epoch: 73, train_loss: 0.6654, test_loss: 0.9729, test_f1: 0.5798
 epoch: 74, train_loss: 0.6402, test_loss: 0.9683, test_f1: 0.5926
 epoch: 75, train_loss: 0.6441, test_loss: 0.9684, test_f1: 0.5875
 epoch: 76, train_loss: 0.6449, test_loss: 0.9881, test_f1: 0.5891
 epoch: 77, train_loss: 0.6543, test_loss: 0.9997, test_f1: 0.5774
 epoch: 78, train_loss: 0.6177, test_loss: 0.9964, test_f1: 0.5741
 epoch: 79, train_loss: 0.6481, test_loss: 0.9599, test_f1: 0.6087
 epoch: 80, train_loss: 0.6389, test_loss: 0.9928, test_f1: 0.5660
 epoch: 81, train_loss: 0.6419, test_loss: 1.0210, test_f1: 0.5791
 epoch: 82, train_loss: 0.6339, test_loss: 1.0354, test_f1: 0.5786
 epoch: 83, train_loss: 0.6357, test_loss: 0.9624, test_f1: 0.5967
 epoch: 84, train_loss: 0.6284, test_loss: 1.0042, test_f1: 0.6040
 epoch: 85, train_loss: 0.6295, test_loss: 1.0366, test_f1: 0.5745
 epoch: 86, train_loss: 0.6380, test_loss: 1.0534, test_f1: 0.5818
 epoch: 87, train_loss: 0.6305, test_loss: 1.0066, test_f1: 0.5859
 epoch: 88, train_loss: 0.6303, test_loss: 1.0637, test_f1: 0.5680
 epoch: 89, train_loss: 0.6253, test_loss: 1.0371, test_f1: 0.5847
 epoch: 90, train_loss: 0.6438, test_loss: 1.0307, test_f1: 0.5741
 epoch: 91, train_loss: 0.6282, test_loss: 1.0469, test_f1: 0.5736
 epoch: 92, train_loss: 0.6321, test_loss: 1.0476, test_f1: 0.5784
 epoch: 93, train_loss: 0.6504, test_loss: 0.9949, test_f1: 0.5938
 epoch: 94, train_loss: 0.6285, test_loss: 1.0702, test_f1: 0.5795
 epoch: 95, train_loss: 0.6296, test_loss: 0.9813, test_f1: 0.5866
 epoch: 96, train_loss: 0.6236, test_loss: 0.9812, test_f1: 0.5834
 epoch: 97, train_loss: 0.6174, test_loss: 1.0331, test_f1: 0.5753
 epoch: 98, train_loss: 0.6104, test_loss: 1.0110, test_f1: 0.6056
 epoch: 99, train_loss: 0.6323, test_loss: 1.0134, test_f1: 0.5976

Training completed in 443.40 seconds
Best F1: 0.6315 at epoch 87
Mean F1 across iterations: 0.6100  0.0134
========================FINAL RESULTS================================
FEGIN weighted F1: 0.6315  0.0134
python main.py --data ltspice_demos --representation component_pin --model FEGIN --layers 4 --hiddens 16 --batch_size 64 --lr 0.001 --emb_size 250 --epochs 100 --save_appendix component_pin_L4_H16_BS64_LR0.001_E250 --no_val
-----



STDERR:
  File "main.py", line 370, in <module>
    main()
  File "main.py", line 254, in main
    dataset = dataset_class(
  File "/home/philip/projects/ltspice_examples_code_repo/Circuit-Completion-Using-GNNs/component_classification_with_link_prediction_head/evaluation/FEGIN/kernel/circuit_datasets.py", line 15, in __init__
    self.data, self.slices = torch.load(self.processed_paths[0])
  File "/home/philip/.local/lib/python3.8/site-packages/torch/serialization.py", line 1040, in load
    warnings.warn(
  File "/usr/lib/python3.8/warnings.py", line 109, in _showwarnmsg
    sw(msg.message, msg.category, msg.filename, msg.lineno,
  File "main.py", line 47, in warn_with_traceback
    traceback.print_stack(file=log)
/home/philip/projects/ltspice_examples_code_repo/Circuit-Completion-Using-GNNs/component_classification_with_link_prediction_head/evaluation/FEGIN/kernel/circuit_datasets.py:15: FutureWarning: You are using `torch.load` with `weights_only=False` (the current default value), which uses the default pickle module implicitly. It is possible to construct malicious pickle data which will execute arbitrary code during unpickling (See https://github.com/pytorch/pytorch/blob/main/SECURITY.md#untrusted-models for more details). In a future release, the default value for `weights_only` will be flipped to `True`. This limits the functions that could be executed during unpickling. Arbitrary objects will no longer be allowed to be loaded via this mode unless they are explicitly allowlisted by the user via `torch.serialization.add_safe_globals`. We recommend you start setting `weights_only=True` for any use case where you don't have full control of the loaded file. Please open an issue on GitHub for any issues related to this experimental feature.
  self.data, self.slices = torch.load(self.processed_paths[0])
