STDOUT:
Results will be saved in /home/philip/projects/ltspice_examples_code_repo/Circuit-Completion-Using-GNNs/component_classification_with_link_prediction_head/evaluation/FEGIN/results/model_FEGIN_dataset_ltspice_examples
Command line input: python main.py --data ltspice_examples --representation component_net --model FEGIN --layers 6 --hiddens 128 --batch_size 128 --lr 0.001 --emb_size 128 --epochs 100 --save_appendix component_net_L6_H128_BS128_LR0.001_E128 --no_val
 is saved.
-----
ltspice_examples - FEGIN
Using 6 layers, 128 hidden units, h = 2
Loading component_net representation dataset
ENTERED
Training FEGIN on component_net representation
Train: 3558, Test: 846
##################ITERATION #0 ****************************************
 epoch: 0, train_loss: 1.2187, test_loss: 1.2785, test_f1: 0.3479
 epoch: 1, train_loss: 1.0241, test_loss: 1.0356, test_f1: 0.4404
 epoch: 2, train_loss: 0.9629, test_loss: 0.9358, test_f1: 0.5343
 epoch: 3, train_loss: 0.9179, test_loss: 0.9764, test_f1: 0.5124
 epoch: 4, train_loss: 0.8940, test_loss: 0.8969, test_f1: 0.5128
 epoch: 5, train_loss: 0.8803, test_loss: 0.9498, test_f1: 0.5414
 epoch: 6, train_loss: 0.8617, test_loss: 0.9770, test_f1: 0.5399
 epoch: 7, train_loss: 0.8580, test_loss: 1.0430, test_f1: 0.5325
 epoch: 8, train_loss: 0.8350, test_loss: 0.9233, test_f1: 0.5561
 epoch: 9, train_loss: 0.8161, test_loss: 0.9189, test_f1: 0.5636
 epoch: 10, train_loss: 0.7967, test_loss: 1.1025, test_f1: 0.5359
 epoch: 11, train_loss: 0.7957, test_loss: 1.0752, test_f1: 0.5675
 epoch: 12, train_loss: 0.7848, test_loss: 0.8769, test_f1: 0.6147
 epoch: 13, train_loss: 0.7626, test_loss: 0.8916, test_f1: 0.5896
 epoch: 14, train_loss: 0.7515, test_loss: 1.0859, test_f1: 0.5469
 epoch: 15, train_loss: 0.7546, test_loss: 0.8897, test_f1: 0.6282
 epoch: 16, train_loss: 0.7276, test_loss: 0.9079, test_f1: 0.6178
 epoch: 17, train_loss: 0.7160, test_loss: 1.0715, test_f1: 0.5910
 epoch: 18, train_loss: 0.7326, test_loss: 0.9559, test_f1: 0.6014
 epoch: 19, train_loss: 0.7184, test_loss: 0.9559, test_f1: 0.6184
 epoch: 20, train_loss: 0.6900, test_loss: 1.0927, test_f1: 0.5549
 epoch: 21, train_loss: 0.6798, test_loss: 0.9352, test_f1: 0.6411
 epoch: 22, train_loss: 0.6645, test_loss: 1.0313, test_f1: 0.6129
 epoch: 23, train_loss: 0.6640, test_loss: 0.9556, test_f1: 0.6236
 epoch: 24, train_loss: 0.6552, test_loss: 0.9345, test_f1: 0.6164
 epoch: 25, train_loss: 0.6492, test_loss: 1.0929, test_f1: 0.5572
 epoch: 26, train_loss: 0.6474, test_loss: 1.0415, test_f1: 0.6016
 epoch: 27, train_loss: 0.6328, test_loss: 1.0195, test_f1: 0.6052
 epoch: 28, train_loss: 0.6237, test_loss: 1.0220, test_f1: 0.6060
 epoch: 29, train_loss: 0.6015, test_loss: 0.9649, test_f1: 0.5876
 epoch: 30, train_loss: 0.5935, test_loss: 1.0163, test_f1: 0.5951
 epoch: 31, train_loss: 0.5789, test_loss: 1.0432, test_f1: 0.6441
 epoch: 32, train_loss: 0.5948, test_loss: 1.1448, test_f1: 0.5827
 epoch: 33, train_loss: 0.5713, test_loss: 1.0309, test_f1: 0.6296
 epoch: 34, train_loss: 0.5456, test_loss: 1.0630, test_f1: 0.6074
 epoch: 35, train_loss: 0.5237, test_loss: 1.1525, test_f1: 0.6290
 epoch: 36, train_loss: 0.5456, test_loss: 1.0425, test_f1: 0.6375
 epoch: 37, train_loss: 0.5228, test_loss: 1.2535, test_f1: 0.6106
 epoch: 38, train_loss: 0.5041, test_loss: 1.0828, test_f1: 0.6344
 epoch: 39, train_loss: 0.5183, test_loss: 1.0365, test_f1: 0.6677
 epoch: 40, train_loss: 0.5052, test_loss: 1.1361, test_f1: 0.6320
 epoch: 41, train_loss: 0.4813, test_loss: 1.2648, test_f1: 0.6054
 epoch: 42, train_loss: 0.4948, test_loss: 1.1706, test_f1: 0.6351
 epoch: 43, train_loss: 0.4689, test_loss: 1.2780, test_f1: 0.6228
 epoch: 44, train_loss: 0.4537, test_loss: 1.2891, test_f1: 0.6240
 epoch: 45, train_loss: 0.4269, test_loss: 1.2934, test_f1: 0.6170
 epoch: 46, train_loss: 0.4367, test_loss: 1.3052, test_f1: 0.6442
 epoch: 47, train_loss: 0.4335, test_loss: 1.3773, test_f1: 0.6296
 epoch: 48, train_loss: 0.4277, test_loss: 1.1864, test_f1: 0.6402
 epoch: 49, train_loss: 0.3952, test_loss: 1.3650, test_f1: 0.6360
 epoch: 50, train_loss: 0.4135, test_loss: 1.3325, test_f1: 0.6348
 epoch: 51, train_loss: 0.3722, test_loss: 1.2943, test_f1: 0.6555
 epoch: 52, train_loss: 0.3153, test_loss: 1.4322, test_f1: 0.6239
 epoch: 53, train_loss: 0.3149, test_loss: 1.4598, test_f1: 0.6388
 epoch: 54, train_loss: 0.3012, test_loss: 1.4879, test_f1: 0.6483
 epoch: 55, train_loss: 0.2821, test_loss: 1.5248, test_f1: 0.6319
 epoch: 56, train_loss: 0.2715, test_loss: 1.5849, test_f1: 0.6274
 epoch: 57, train_loss: 0.2702, test_loss: 1.5601, test_f1: 0.6294
 epoch: 58, train_loss: 0.2655, test_loss: 1.7047, test_f1: 0.6407
 epoch: 59, train_loss: 0.2737, test_loss: 1.5908, test_f1: 0.6352
 epoch: 60, train_loss: 0.2700, test_loss: 1.5612, test_f1: 0.6438
 epoch: 61, train_loss: 0.2797, test_loss: 1.5753, test_f1: 0.6481
 epoch: 62, train_loss: 0.2580, test_loss: 1.6679, test_f1: 0.6431
 epoch: 63, train_loss: 0.2613, test_loss: 1.8387, test_f1: 0.5756
 epoch: 64, train_loss: 0.2392, test_loss: 1.7873, test_f1: 0.6172
 epoch: 65, train_loss: 0.2310, test_loss: 1.8241, test_f1: 0.6389
 epoch: 66, train_loss: 0.2479, test_loss: 1.8864, test_f1: 0.6071
 epoch: 67, train_loss: 0.2421, test_loss: 1.8266, test_f1: 0.6258
 epoch: 68, train_loss: 0.2283, test_loss: 1.8206, test_f1: 0.6568
 epoch: 69, train_loss: 0.2133, test_loss: 1.9917, test_f1: 0.6349
 epoch: 70, train_loss: 0.2120, test_loss: 1.9225, test_f1: 0.6432
 epoch: 71, train_loss: 0.2315, test_loss: 2.0133, test_f1: 0.6370
 epoch: 72, train_loss: 0.2186, test_loss: 1.9941, test_f1: 0.6469
 epoch: 73, train_loss: 0.2390, test_loss: 2.0057, test_f1: 0.6560
 epoch: 74, train_loss: 0.2082, test_loss: 2.0075, test_f1: 0.6502
 epoch: 75, train_loss: 0.1895, test_loss: 2.1294, test_f1: 0.6358
 epoch: 76, train_loss: 0.2062, test_loss: 1.8262, test_f1: 0.6787
 epoch: 77, train_loss: 0.1946, test_loss: 2.1248, test_f1: 0.6270
 epoch: 78, train_loss: 0.2039, test_loss: 2.2755, test_f1: 0.6315
 epoch: 79, train_loss: 0.2043, test_loss: 2.0657, test_f1: 0.6507
 epoch: 80, train_loss: 0.1967, test_loss: 2.3493, test_f1: 0.6352
 epoch: 81, train_loss: 0.1879, test_loss: 2.1283, test_f1: 0.6183
 epoch: 82, train_loss: 0.1847, test_loss: 2.3013, test_f1: 0.6479
 epoch: 83, train_loss: 0.1863, test_loss: 2.2956, test_f1: 0.6423
 epoch: 84, train_loss: 0.1935, test_loss: 2.4771, test_f1: 0.6367
 epoch: 85, train_loss: 0.1956, test_loss: 2.1919, test_f1: 0.6364
 epoch: 86, train_loss: 0.2034, test_loss: 2.1586, test_f1: 0.6474
 epoch: 87, train_loss: 0.1836, test_loss: 2.2322, test_f1: 0.6364
 epoch: 88, train_loss: 0.1805, test_loss: 2.1791, test_f1: 0.6246
 epoch: 89, train_loss: 0.1700, test_loss: 2.2918, test_f1: 0.6262
 epoch: 90, train_loss: 0.1720, test_loss: 2.3249, test_f1: 0.6272
 epoch: 91, train_loss: 0.1654, test_loss: 2.1632, test_f1: 0.6380
 epoch: 92, train_loss: 0.1728, test_loss: 2.2486, test_f1: 0.6441
 epoch: 93, train_loss: 0.1736, test_loss: 2.5060, test_f1: 0.6144
 epoch: 94, train_loss: 0.2069, test_loss: 2.4529, test_f1: 0.6170
 epoch: 95, train_loss: 0.1695, test_loss: 2.4160, test_f1: 0.6318
 epoch: 96, train_loss: 0.1677, test_loss: 2.3284, test_f1: 0.6092
 epoch: 97, train_loss: 0.1648, test_loss: 2.6106, test_f1: 0.6365
 epoch: 98, train_loss: 0.1579, test_loss: 2.6401, test_f1: 0.6446
 epoch: 99, train_loss: 0.1666, test_loss: 2.6369, test_f1: 0.6328
##################ITERATION #1 ****************************************
 epoch: 0, train_loss: 1.1550, test_loss: 1.2020, test_f1: 0.3176
 epoch: 1, train_loss: 1.0037, test_loss: 0.9743, test_f1: 0.4770
 epoch: 2, train_loss: 0.9343, test_loss: 0.9582, test_f1: 0.5098
 epoch: 3, train_loss: 0.9130, test_loss: 0.9623, test_f1: 0.5113
 epoch: 4, train_loss: 0.8771, test_loss: 0.8708, test_f1: 0.5312
 epoch: 5, train_loss: 0.8615, test_loss: 0.9407, test_f1: 0.5280
 epoch: 6, train_loss: 0.8473, test_loss: 0.9448, test_f1: 0.5270
 epoch: 7, train_loss: 0.8145, test_loss: 0.9845, test_f1: 0.5359
 epoch: 8, train_loss: 0.8020, test_loss: 0.9939, test_f1: 0.5204
 epoch: 9, train_loss: 0.8005, test_loss: 0.9682, test_f1: 0.5738
 epoch: 10, train_loss: 0.7946, test_loss: 1.0608, test_f1: 0.5545
 epoch: 11, train_loss: 0.7654, test_loss: 0.9351, test_f1: 0.5832
 epoch: 12, train_loss: 0.7496, test_loss: 0.9786, test_f1: 0.5864
 epoch: 13, train_loss: 0.7432, test_loss: 0.9652, test_f1: 0.5331
 epoch: 14, train_loss: 0.7354, test_loss: 0.9689, test_f1: 0.5793
 epoch: 15, train_loss: 0.7246, test_loss: 0.9646, test_f1: 0.5943
 epoch: 16, train_loss: 0.6985, test_loss: 0.9927, test_f1: 0.5938
 epoch: 17, train_loss: 0.6929, test_loss: 1.0695, test_f1: 0.5797
 epoch: 18, train_loss: 0.6863, test_loss: 1.0283, test_f1: 0.5801
 epoch: 19, train_loss: 0.6834, test_loss: 1.2024, test_f1: 0.5752
 epoch: 20, train_loss: 0.6673, test_loss: 0.9720, test_f1: 0.6023
 epoch: 21, train_loss: 0.6563, test_loss: 0.9847, test_f1: 0.6110
 epoch: 22, train_loss: 0.6658, test_loss: 1.0333, test_f1: 0.5774
 epoch: 23, train_loss: 0.6510, test_loss: 1.0452, test_f1: 0.5881
 epoch: 24, train_loss: 0.6241, test_loss: 0.9866, test_f1: 0.5979
 epoch: 25, train_loss: 0.6030, test_loss: 1.0546, test_f1: 0.6228
 epoch: 26, train_loss: 0.6001, test_loss: 0.9409, test_f1: 0.6493
 epoch: 27, train_loss: 0.5797, test_loss: 1.0424, test_f1: 0.6366
 epoch: 28, train_loss: 0.5950, test_loss: 1.1455, test_f1: 0.6223
 epoch: 29, train_loss: 0.5785, test_loss: 1.0873, test_f1: 0.6172
 epoch: 30, train_loss: 0.5495, test_loss: 1.1150, test_f1: 0.5967
 epoch: 31, train_loss: 0.5755, test_loss: 1.2757, test_f1: 0.5594
 epoch: 32, train_loss: 0.5860, test_loss: 1.2665, test_f1: 0.5674
 epoch: 33, train_loss: 0.5269, test_loss: 1.1187, test_f1: 0.6342
 epoch: 34, train_loss: 0.5268, test_loss: 1.1261, test_f1: 0.6487
 epoch: 35, train_loss: 0.5163, test_loss: 1.3571, test_f1: 0.5900
 epoch: 36, train_loss: 0.5275, test_loss: 1.1858, test_f1: 0.6410
 epoch: 37, train_loss: 0.5022, test_loss: 1.1824, test_f1: 0.6357
 epoch: 38, train_loss: 0.4955, test_loss: 1.3069, test_f1: 0.6295
 epoch: 39, train_loss: 0.5022, test_loss: 1.2686, test_f1: 0.6250
 epoch: 40, train_loss: 0.4687, test_loss: 1.0645, test_f1: 0.6368
 epoch: 41, train_loss: 0.4866, test_loss: 1.2329, test_f1: 0.6435
 epoch: 42, train_loss: 0.4602, test_loss: 1.3960, test_f1: 0.5920
 epoch: 43, train_loss: 0.4507, test_loss: 1.1535, test_f1: 0.6454
 epoch: 44, train_loss: 0.4546, test_loss: 1.2754, test_f1: 0.6339
 epoch: 45, train_loss: 0.4175, test_loss: 1.5431, test_f1: 0.6146
 epoch: 46, train_loss: 0.4490, test_loss: 1.3511, test_f1: 0.6208
 epoch: 47, train_loss: 0.4701, test_loss: 1.4227, test_f1: 0.6095
 epoch: 48, train_loss: 0.4047, test_loss: 1.4850, test_f1: 0.6433
 epoch: 49, train_loss: 0.4153, test_loss: 1.2944, test_f1: 0.6324
 epoch: 50, train_loss: 0.4034, test_loss: 1.3823, test_f1: 0.6158
 epoch: 51, train_loss: 0.3567, test_loss: 1.3843, test_f1: 0.6418
 epoch: 52, train_loss: 0.3037, test_loss: 1.4869, test_f1: 0.6459
 epoch: 53, train_loss: 0.3012, test_loss: 1.5833, test_f1: 0.6523
 epoch: 54, train_loss: 0.2833, test_loss: 1.6407, test_f1: 0.6601
 epoch: 55, train_loss: 0.2969, test_loss: 1.6202, test_f1: 0.6412
 epoch: 56, train_loss: 0.2960, test_loss: 1.7458, test_f1: 0.6293
 epoch: 57, train_loss: 0.2837, test_loss: 1.6936, test_f1: 0.6405
 epoch: 58, train_loss: 0.2836, test_loss: 1.6347, test_f1: 0.6246
 epoch: 59, train_loss: 0.2577, test_loss: 1.7584, test_f1: 0.6439
 epoch: 60, train_loss: 0.2684, test_loss: 1.7154, test_f1: 0.6449
 epoch: 61, train_loss: 0.2549, test_loss: 1.8050, test_f1: 0.6349
 epoch: 62, train_loss: 0.2478, test_loss: 1.7284, test_f1: 0.6349
 epoch: 63, train_loss: 0.2464, test_loss: 1.8079, test_f1: 0.6505
 epoch: 64, train_loss: 0.2388, test_loss: 1.8342, test_f1: 0.6366
 epoch: 65, train_loss: 0.2436, test_loss: 1.8469, test_f1: 0.6333
 epoch: 66, train_loss: 0.2383, test_loss: 1.9724, test_f1: 0.6386
 epoch: 67, train_loss: 0.2199, test_loss: 1.8037, test_f1: 0.6432
 epoch: 68, train_loss: 0.2266, test_loss: 1.8611, test_f1: 0.6663
 epoch: 69, train_loss: 0.2291, test_loss: 2.1629, test_f1: 0.6390
 epoch: 70, train_loss: 0.2309, test_loss: 1.9440, test_f1: 0.6257
 epoch: 71, train_loss: 0.2217, test_loss: 1.9910, test_f1: 0.6217
 epoch: 72, train_loss: 0.2220, test_loss: 2.0961, test_f1: 0.6186
 epoch: 73, train_loss: 0.2442, test_loss: 2.0431, test_f1: 0.6191
 epoch: 74, train_loss: 0.2313, test_loss: 1.9159, test_f1: 0.6379
 epoch: 75, train_loss: 0.2051, test_loss: 2.0955, test_f1: 0.6298
 epoch: 76, train_loss: 0.2223, test_loss: 1.9751, test_f1: 0.6406
 epoch: 77, train_loss: 0.2088, test_loss: 2.1335, test_f1: 0.6167
 epoch: 78, train_loss: 0.2044, test_loss: 2.0878, test_f1: 0.6198
 epoch: 79, train_loss: 0.1941, test_loss: 2.2526, test_f1: 0.6161
 epoch: 80, train_loss: 0.1984, test_loss: 2.2428, test_f1: 0.6347
 epoch: 81, train_loss: 0.1926, test_loss: 2.2837, test_f1: 0.6316
 epoch: 82, train_loss: 0.2000, test_loss: 2.2676, test_f1: 0.6205
 epoch: 83, train_loss: 0.1761, test_loss: 2.3194, test_f1: 0.6158
 epoch: 84, train_loss: 0.1829, test_loss: 2.3031, test_f1: 0.6170
 epoch: 85, train_loss: 0.1825, test_loss: 2.4883, test_f1: 0.6005
 epoch: 86, train_loss: 0.1840, test_loss: 2.2576, test_f1: 0.6283
 epoch: 87, train_loss: 0.1946, test_loss: 2.2728, test_f1: 0.6280
 epoch: 88, train_loss: 0.2116, test_loss: 2.1760, test_f1: 0.6298
 epoch: 89, train_loss: 0.2046, test_loss: 2.1180, test_f1: 0.6091
 epoch: 90, train_loss: 0.1843, test_loss: 2.0891, test_f1: 0.6337
 epoch: 91, train_loss: 0.1743, test_loss: 2.2146, test_f1: 0.6318
 epoch: 92, train_loss: 0.1595, test_loss: 2.3660, test_f1: 0.6204
 epoch: 93, train_loss: 0.1644, test_loss: 2.2529, test_f1: 0.6245
 epoch: 94, train_loss: 0.1619, test_loss: 2.3669, test_f1: 0.6201
 epoch: 95, train_loss: 0.1843, test_loss: 2.5012, test_f1: 0.6195
 epoch: 96, train_loss: 0.1632, test_loss: 2.3491, test_f1: 0.6240
 epoch: 97, train_loss: 0.1699, test_loss: 2.2738, test_f1: 0.6516
 epoch: 98, train_loss: 0.1773, test_loss: 2.5456, test_f1: 0.6245
 epoch: 99, train_loss: 0.1521, test_loss: 2.5102, test_f1: 0.6051
##################ITERATION #2 ****************************************
 epoch: 0, train_loss: 1.1773, test_loss: 1.3996, test_f1: 0.1911
 epoch: 1, train_loss: 1.0265, test_loss: 0.9561, test_f1: 0.4891
 epoch: 2, train_loss: 0.9820, test_loss: 0.9117, test_f1: 0.5364
 epoch: 3, train_loss: 0.9273, test_loss: 0.9451, test_f1: 0.4957
 epoch: 4, train_loss: 0.9017, test_loss: 0.8962, test_f1: 0.5704
 epoch: 5, train_loss: 0.8875, test_loss: 0.9067, test_f1: 0.4701
 epoch: 6, train_loss: 0.8715, test_loss: 0.9872, test_f1: 0.5292
 epoch: 7, train_loss: 0.8513, test_loss: 0.9457, test_f1: 0.5260
 epoch: 8, train_loss: 0.8217, test_loss: 0.9185, test_f1: 0.5348
 epoch: 9, train_loss: 0.8076, test_loss: 0.9432, test_f1: 0.5917
 epoch: 10, train_loss: 0.7942, test_loss: 0.9929, test_f1: 0.5346
 epoch: 11, train_loss: 0.7809, test_loss: 0.9070, test_f1: 0.5420
 epoch: 12, train_loss: 0.7723, test_loss: 0.9304, test_f1: 0.5958
 epoch: 13, train_loss: 0.7637, test_loss: 0.9757, test_f1: 0.5539
 epoch: 14, train_loss: 0.7346, test_loss: 1.0259, test_f1: 0.5657
 epoch: 15, train_loss: 0.7312, test_loss: 0.8643, test_f1: 0.6074
 epoch: 16, train_loss: 0.7333, test_loss: 0.9356, test_f1: 0.5735
 epoch: 17, train_loss: 0.7181, test_loss: 0.9344, test_f1: 0.6195
 epoch: 18, train_loss: 0.6956, test_loss: 0.9434, test_f1: 0.5843
 epoch: 19, train_loss: 0.6958, test_loss: 0.9401, test_f1: 0.5937
 epoch: 20, train_loss: 0.7071, test_loss: 0.9246, test_f1: 0.5921
 epoch: 21, train_loss: 0.6809, test_loss: 0.9481, test_f1: 0.5962
 epoch: 22, train_loss: 0.6650, test_loss: 0.9687, test_f1: 0.6063
 epoch: 23, train_loss: 0.6665, test_loss: 1.0844, test_f1: 0.5994
 epoch: 24, train_loss: 0.6641, test_loss: 1.0059, test_f1: 0.5846
 epoch: 25, train_loss: 0.6480, test_loss: 1.0087, test_f1: 0.6117
 epoch: 26, train_loss: 0.6459, test_loss: 0.9562, test_f1: 0.6013
 epoch: 27, train_loss: 0.6212, test_loss: 1.0986, test_f1: 0.5829
 epoch: 28, train_loss: 0.5988, test_loss: 1.0666, test_f1: 0.5960
 epoch: 29, train_loss: 0.5843, test_loss: 0.9687, test_f1: 0.5979
 epoch: 30, train_loss: 0.5860, test_loss: 1.0121, test_f1: 0.5956
 epoch: 31, train_loss: 0.5839, test_loss: 1.0216, test_f1: 0.6095
 epoch: 32, train_loss: 0.5646, test_loss: 1.0328, test_f1: 0.6176
 epoch: 33, train_loss: 0.5554, test_loss: 1.0721, test_f1: 0.6430
 epoch: 34, train_loss: 0.5516, test_loss: 1.0832, test_f1: 0.6363
 epoch: 35, train_loss: 0.5571, test_loss: 1.1077, test_f1: 0.5513
 epoch: 36, train_loss: 0.5440, test_loss: 1.0354, test_f1: 0.6385
 epoch: 37, train_loss: 0.5031, test_loss: 1.0712, test_f1: 0.6186
 epoch: 38, train_loss: 0.4951, test_loss: 1.1322, test_f1: 0.6529
 epoch: 39, train_loss: 0.5082, test_loss: 1.1210, test_f1: 0.6269
 epoch: 40, train_loss: 0.5010, test_loss: 1.1900, test_f1: 0.6113
 epoch: 41, train_loss: 0.4967, test_loss: 1.0687, test_f1: 0.6151
 epoch: 42, train_loss: 0.5049, test_loss: 1.2341, test_f1: 0.6370
 epoch: 43, train_loss: 0.4688, test_loss: 1.1255, test_f1: 0.6100
 epoch: 44, train_loss: 0.4746, test_loss: 1.0873, test_f1: 0.6586
 epoch: 45, train_loss: 0.4456, test_loss: 1.1593, test_f1: 0.6538
 epoch: 46, train_loss: 0.4659, test_loss: 1.0824, test_f1: 0.6745
 epoch: 47, train_loss: 0.4387, test_loss: 1.2076, test_f1: 0.6409
 epoch: 48, train_loss: 0.4115, test_loss: 1.2885, test_f1: 0.6798
 epoch: 49, train_loss: 0.4277, test_loss: 1.2153, test_f1: 0.6248
 epoch: 50, train_loss: 0.4409, test_loss: 1.2678, test_f1: 0.6283
 epoch: 51, train_loss: 0.4006, test_loss: 1.3059, test_f1: 0.6509
 epoch: 52, train_loss: 0.3483, test_loss: 1.2265, test_f1: 0.6834
 epoch: 53, train_loss: 0.3357, test_loss: 1.3220, test_f1: 0.6625
 epoch: 54, train_loss: 0.3179, test_loss: 1.4060, test_f1: 0.6569
 epoch: 55, train_loss: 0.3125, test_loss: 1.3640, test_f1: 0.6514
 epoch: 56, train_loss: 0.3078, test_loss: 1.4268, test_f1: 0.6365
 epoch: 57, train_loss: 0.3133, test_loss: 1.3809, test_f1: 0.6618
 epoch: 58, train_loss: 0.3238, test_loss: 1.4188, test_f1: 0.6493
 epoch: 59, train_loss: 0.3003, test_loss: 1.4241, test_f1: 0.7016
 epoch: 60, train_loss: 0.3038, test_loss: 1.4826, test_f1: 0.6546
 epoch: 61, train_loss: 0.2924, test_loss: 1.5501, test_f1: 0.6650
 epoch: 62, train_loss: 0.2939, test_loss: 1.5103, test_f1: 0.6951
 epoch: 63, train_loss: 0.2810, test_loss: 1.5385, test_f1: 0.6410
 epoch: 64, train_loss: 0.2782, test_loss: 1.7361, test_f1: 0.6275
 epoch: 65, train_loss: 0.2708, test_loss: 1.5067, test_f1: 0.6652
 epoch: 66, train_loss: 0.2788, test_loss: 1.4887, test_f1: 0.6616
 epoch: 67, train_loss: 0.2912, test_loss: 1.5166, test_f1: 0.6836
 epoch: 68, train_loss: 0.2892, test_loss: 1.6061, test_f1: 0.6558
 epoch: 69, train_loss: 0.2584, test_loss: 1.7011, test_f1: 0.6569
 epoch: 70, train_loss: 0.2732, test_loss: 1.6276, test_f1: 0.6654
 epoch: 71, train_loss: 0.2374, test_loss: 1.7246, test_f1: 0.6509
 epoch: 72, train_loss: 0.2446, test_loss: 1.7331, test_f1: 0.6416
 epoch: 73, train_loss: 0.2454, test_loss: 1.7701, test_f1: 0.6517
 epoch: 74, train_loss: 0.2490, test_loss: 1.7636, test_f1: 0.6451
 epoch: 75, train_loss: 0.2253, test_loss: 1.7223, test_f1: 0.6701
 epoch: 76, train_loss: 0.2296, test_loss: 2.0089, test_f1: 0.6288
 epoch: 77, train_loss: 0.2310, test_loss: 1.7762, test_f1: 0.6557
 epoch: 78, train_loss: 0.2379, test_loss: 1.8237, test_f1: 0.6600
 epoch: 79, train_loss: 0.2465, test_loss: 1.7218, test_f1: 0.6674
 epoch: 80, train_loss: 0.2385, test_loss: 1.8218, test_f1: 0.6379
 epoch: 81, train_loss: 0.2303, test_loss: 1.8156, test_f1: 0.6675
 epoch: 82, train_loss: 0.2283, test_loss: 1.7070, test_f1: 0.6616
 epoch: 83, train_loss: 0.2184, test_loss: 1.8313, test_f1: 0.6543
 epoch: 84, train_loss: 0.2188, test_loss: 1.8326, test_f1: 0.6467
 epoch: 85, train_loss: 0.2081, test_loss: 1.9964, test_f1: 0.6442
 epoch: 86, train_loss: 0.1988, test_loss: 1.9254, test_f1: 0.6421
 epoch: 87, train_loss: 0.2124, test_loss: 1.9891, test_f1: 0.6570
 epoch: 88, train_loss: 0.2215, test_loss: 1.8550, test_f1: 0.6644
 epoch: 89, train_loss: 0.2089, test_loss: 1.8859, test_f1: 0.6864
 epoch: 90, train_loss: 0.2033, test_loss: 2.1928, test_f1: 0.6449
 epoch: 91, train_loss: 0.2141, test_loss: 1.7666, test_f1: 0.6641
 epoch: 92, train_loss: 0.2135, test_loss: 1.9451, test_f1: 0.6538
 epoch: 93, train_loss: 0.2074, test_loss: 1.9246, test_f1: 0.6556
 epoch: 94, train_loss: 0.1876, test_loss: 1.8516, test_f1: 0.6657
 epoch: 95, train_loss: 0.1912, test_loss: 2.0533, test_f1: 0.6618
 epoch: 96, train_loss: 0.1957, test_loss: 1.9456, test_f1: 0.6557
 epoch: 97, train_loss: 0.1963, test_loss: 1.9409, test_f1: 0.6666
 epoch: 98, train_loss: 0.2035, test_loss: 1.9143, test_f1: 0.6459
 epoch: 99, train_loss: 0.1922, test_loss: 2.2973, test_f1: 0.6110
##################ITERATION #3 ****************************************
 epoch: 0, train_loss: 1.2071, test_loss: 1.2384, test_f1: 0.2324
 epoch: 1, train_loss: 0.9928, test_loss: 0.9733, test_f1: 0.4579
 epoch: 2, train_loss: 0.9370, test_loss: 0.9025, test_f1: 0.5357
 epoch: 3, train_loss: 0.9163, test_loss: 0.9559, test_f1: 0.4965
 epoch: 4, train_loss: 0.8947, test_loss: 1.0895, test_f1: 0.4800
 epoch: 5, train_loss: 0.8831, test_loss: 0.9693, test_f1: 0.5199
 epoch: 6, train_loss: 0.8593, test_loss: 0.9742, test_f1: 0.5184
 epoch: 7, train_loss: 0.8278, test_loss: 1.0072, test_f1: 0.5440
 epoch: 8, train_loss: 0.8245, test_loss: 1.1070, test_f1: 0.5236
 epoch: 9, train_loss: 0.8139, test_loss: 1.0172, test_f1: 0.4946
 epoch: 10, train_loss: 0.8078, test_loss: 0.9855, test_f1: 0.5392
 epoch: 11, train_loss: 0.8059, test_loss: 1.0015, test_f1: 0.5633
 epoch: 12, train_loss: 0.7782, test_loss: 1.0278, test_f1: 0.5570
 epoch: 13, train_loss: 0.7714, test_loss: 1.0232, test_f1: 0.6085
 epoch: 14, train_loss: 0.7514, test_loss: 0.9750, test_f1: 0.5649
 epoch: 15, train_loss: 0.7451, test_loss: 1.0976, test_f1: 0.5340
 epoch: 16, train_loss: 0.7271, test_loss: 1.0518, test_f1: 0.5495
 epoch: 17, train_loss: 0.7112, test_loss: 0.9806, test_f1: 0.5571
 epoch: 18, train_loss: 0.7068, test_loss: 1.0257, test_f1: 0.6064
 epoch: 19, train_loss: 0.7072, test_loss: 1.0522, test_f1: 0.6038
 epoch: 20, train_loss: 0.6894, test_loss: 1.0144, test_f1: 0.6046
 epoch: 21, train_loss: 0.6716, test_loss: 1.1325, test_f1: 0.5744
 epoch: 22, train_loss: 0.6811, test_loss: 0.9937, test_f1: 0.5926
 epoch: 23, train_loss: 0.6626, test_loss: 1.0361, test_f1: 0.6089
 epoch: 24, train_loss: 0.6558, test_loss: 1.0942, test_f1: 0.5990
 epoch: 25, train_loss: 0.6431, test_loss: 1.0969, test_f1: 0.5938
 epoch: 26, train_loss: 0.6167, test_loss: 1.1292, test_f1: 0.6079
 epoch: 27, train_loss: 0.6155, test_loss: 1.1232, test_f1: 0.5880
 epoch: 28, train_loss: 0.6242, test_loss: 1.0610, test_f1: 0.5666
 epoch: 29, train_loss: 0.6000, test_loss: 1.0925, test_f1: 0.6209
 epoch: 30, train_loss: 0.6057, test_loss: 1.1114, test_f1: 0.6140
 epoch: 31, train_loss: 0.5835, test_loss: 1.1063, test_f1: 0.6578
 epoch: 32, train_loss: 0.5496, test_loss: 1.1615, test_f1: 0.6187
 epoch: 33, train_loss: 0.5950, test_loss: 1.0844, test_f1: 0.6514
 epoch: 34, train_loss: 0.5575, test_loss: 1.1174, test_f1: 0.6183
 epoch: 35, train_loss: 0.5441, test_loss: 1.1251, test_f1: 0.6278
 epoch: 36, train_loss: 0.5315, test_loss: 1.2986, test_f1: 0.6089
 epoch: 37, train_loss: 0.5384, test_loss: 1.2837, test_f1: 0.5946
 epoch: 38, train_loss: 0.5127, test_loss: 1.2347, test_f1: 0.6277
 epoch: 39, train_loss: 0.4827, test_loss: 1.2599, test_f1: 0.6326
 epoch: 40, train_loss: 0.5229, test_loss: 1.2515, test_f1: 0.6114
 epoch: 41, train_loss: 0.5154, test_loss: 1.2449, test_f1: 0.6479
 epoch: 42, train_loss: 0.4804, test_loss: 1.3090, test_f1: 0.6548
 epoch: 43, train_loss: 0.4791, test_loss: 1.3729, test_f1: 0.5995
 epoch: 44, train_loss: 0.4627, test_loss: 1.2450, test_f1: 0.6201
 epoch: 45, train_loss: 0.4529, test_loss: 1.3052, test_f1: 0.6188
 epoch: 46, train_loss: 0.4426, test_loss: 1.2869, test_f1: 0.6169
 epoch: 47, train_loss: 0.4587, test_loss: 1.3498, test_f1: 0.5968
 epoch: 48, train_loss: 0.4614, test_loss: 1.3179, test_f1: 0.6299
 epoch: 49, train_loss: 0.4317, test_loss: 1.3482, test_f1: 0.6500
 epoch: 50, train_loss: 0.4674, test_loss: 1.3983, test_f1: 0.6274
 epoch: 51, train_loss: 0.3667, test_loss: 1.3419, test_f1: 0.6297
 epoch: 52, train_loss: 0.3628, test_loss: 1.3584, test_f1: 0.6254
 epoch: 53, train_loss: 0.3421, test_loss: 1.4863, test_f1: 0.6457
 epoch: 54, train_loss: 0.3353, test_loss: 1.4943, test_f1: 0.6203
 epoch: 55, train_loss: 0.3139, test_loss: 1.5217, test_f1: 0.6548
 epoch: 56, train_loss: 0.3055, test_loss: 1.5523, test_f1: 0.6518
 epoch: 57, train_loss: 0.3040, test_loss: 1.5402, test_f1: 0.6477
 epoch: 58, train_loss: 0.2972, test_loss: 1.5741, test_f1: 0.6263
 epoch: 59, train_loss: 0.2941, test_loss: 1.5976, test_f1: 0.6158
 epoch: 60, train_loss: 0.3071, test_loss: 1.6088, test_f1: 0.6262
 epoch: 61, train_loss: 0.3015, test_loss: 1.5899, test_f1: 0.6349
 epoch: 62, train_loss: 0.2848, test_loss: 1.6406, test_f1: 0.6288
 epoch: 63, train_loss: 0.3013, test_loss: 1.7773, test_f1: 0.6483
 epoch: 64, train_loss: 0.2764, test_loss: 1.7078, test_f1: 0.6343
 epoch: 65, train_loss: 0.2712, test_loss: 1.6895, test_f1: 0.6598
 epoch: 66, train_loss: 0.2817, test_loss: 1.6184, test_f1: 0.6653
 epoch: 67, train_loss: 0.2897, test_loss: 1.7079, test_f1: 0.6184
 epoch: 68, train_loss: 0.2646, test_loss: 1.7353, test_f1: 0.6331
 epoch: 69, train_loss: 0.2649, test_loss: 1.7660, test_f1: 0.6441
 epoch: 70, train_loss: 0.2633, test_loss: 1.7363, test_f1: 0.6588
 epoch: 71, train_loss: 0.2674, test_loss: 1.8561, test_f1: 0.6090
 epoch: 72, train_loss: 0.2530, test_loss: 1.8668, test_f1: 0.6453
 epoch: 73, train_loss: 0.2300, test_loss: 1.8854, test_f1: 0.6409
 epoch: 74, train_loss: 0.2491, test_loss: 1.8448, test_f1: 0.6529
 epoch: 75, train_loss: 0.2460, test_loss: 1.7967, test_f1: 0.6368
 epoch: 76, train_loss: 0.2326, test_loss: 1.9429, test_f1: 0.6562
 epoch: 77, train_loss: 0.2510, test_loss: 1.8044, test_f1: 0.6456
 epoch: 78, train_loss: 0.2520, test_loss: 1.8959, test_f1: 0.6550
 epoch: 79, train_loss: 0.2368, test_loss: 1.9555, test_f1: 0.6366
 epoch: 80, train_loss: 0.2366, test_loss: 1.9091, test_f1: 0.6327
 epoch: 81, train_loss: 0.2523, test_loss: 1.7518, test_f1: 0.6334
 epoch: 82, train_loss: 0.2401, test_loss: 1.8536, test_f1: 0.6316
 epoch: 83, train_loss: 0.2526, test_loss: 1.8600, test_f1: 0.6336
 epoch: 84, train_loss: 0.2467, test_loss: 1.9878, test_f1: 0.6252
 epoch: 85, train_loss: 0.2298, test_loss: 1.8927, test_f1: 0.6431
 epoch: 86, train_loss: 0.2320, test_loss: 1.9757, test_f1: 0.6553
 epoch: 87, train_loss: 0.2218, test_loss: 1.8634, test_f1: 0.6345
 epoch: 88, train_loss: 0.1970, test_loss: 1.9864, test_f1: 0.6308
 epoch: 89, train_loss: 0.2384, test_loss: 2.0034, test_f1: 0.6204
 epoch: 90, train_loss: 0.2252, test_loss: 1.7830, test_f1: 0.6176
 epoch: 91, train_loss: 0.2087, test_loss: 1.9470, test_f1: 0.6477
 epoch: 92, train_loss: 0.1969, test_loss: 2.0302, test_f1: 0.6366
 epoch: 93, train_loss: 0.1773, test_loss: 2.0470, test_f1: 0.6418
 epoch: 94, train_loss: 0.1910, test_loss: 2.2304, test_f1: 0.6109
 epoch: 95, train_loss: 0.1834, test_loss: 2.1045, test_f1: 0.6394
 epoch: 96, train_loss: 0.1931, test_loss: 2.1806, test_f1: 0.6542
 epoch: 97, train_loss: 0.1864, test_loss: 2.0788, test_f1: 0.6278
 epoch: 98, train_loss: 0.1959, test_loss: 2.0662, test_f1: 0.6335
 epoch: 99, train_loss: 0.1883, test_loss: 2.0644, test_f1: 0.6296
##################ITERATION #4 ****************************************
 epoch: 0, train_loss: 1.2604, test_loss: 1.1820, test_f1: 0.4266
 epoch: 1, train_loss: 1.0214, test_loss: 0.9494, test_f1: 0.5011
 epoch: 2, train_loss: 0.9642, test_loss: 0.9626, test_f1: 0.5120
 epoch: 3, train_loss: 0.9298, test_loss: 0.9418, test_f1: 0.5160
 epoch: 4, train_loss: 0.9022, test_loss: 0.9583, test_f1: 0.4978
 epoch: 5, train_loss: 0.8752, test_loss: 0.9788, test_f1: 0.4818
 epoch: 6, train_loss: 0.8716, test_loss: 0.9712, test_f1: 0.5250
 epoch: 7, train_loss: 0.8570, test_loss: 0.9980, test_f1: 0.5230
 epoch: 8, train_loss: 0.8377, test_loss: 0.8813, test_f1: 0.5561
 epoch: 9, train_loss: 0.8096, test_loss: 1.0086, test_f1: 0.5313
 epoch: 10, train_loss: 0.8180, test_loss: 0.8957, test_f1: 0.5523
 epoch: 11, train_loss: 0.7994, test_loss: 0.9838, test_f1: 0.5301
 epoch: 12, train_loss: 0.7709, test_loss: 0.9915, test_f1: 0.6081
 epoch: 13, train_loss: 0.7762, test_loss: 1.0228, test_f1: 0.5869
 epoch: 14, train_loss: 0.7684, test_loss: 0.9570, test_f1: 0.5656
 epoch: 15, train_loss: 0.7647, test_loss: 0.9648, test_f1: 0.5631
 epoch: 16, train_loss: 0.7451, test_loss: 0.9856, test_f1: 0.5533
 epoch: 17, train_loss: 0.7270, test_loss: 1.0006, test_f1: 0.5751
 epoch: 18, train_loss: 0.7117, test_loss: 1.0247, test_f1: 0.5775
 epoch: 19, train_loss: 0.7039, test_loss: 0.9758, test_f1: 0.6135
 epoch: 20, train_loss: 0.6889, test_loss: 0.9939, test_f1: 0.5820
 epoch: 21, train_loss: 0.7072, test_loss: 0.9978, test_f1: 0.5808
 epoch: 22, train_loss: 0.6849, test_loss: 1.0949, test_f1: 0.5886
 epoch: 23, train_loss: 0.6978, test_loss: 1.0462, test_f1: 0.5944
 epoch: 24, train_loss: 0.6850, test_loss: 1.0402, test_f1: 0.6072
 epoch: 25, train_loss: 0.6642, test_loss: 1.0791, test_f1: 0.6139
 epoch: 26, train_loss: 0.6299, test_loss: 1.0205, test_f1: 0.5627
 epoch: 27, train_loss: 0.6404, test_loss: 1.0512, test_f1: 0.6062
 epoch: 28, train_loss: 0.6168, test_loss: 1.0110, test_f1: 0.6211
 epoch: 29, train_loss: 0.6162, test_loss: 1.0146, test_f1: 0.5976
 epoch: 30, train_loss: 0.6304, test_loss: 0.9962, test_f1: 0.6267
 epoch: 31, train_loss: 0.6092, test_loss: 1.0166, test_f1: 0.6151
 epoch: 32, train_loss: 0.5916, test_loss: 1.0139, test_f1: 0.6217
 epoch: 33, train_loss: 0.5909, test_loss: 1.0449, test_f1: 0.6237
 epoch: 34, train_loss: 0.5745, test_loss: 1.0389, test_f1: 0.6165
 epoch: 35, train_loss: 0.5567, test_loss: 1.0867, test_f1: 0.6393
 epoch: 36, train_loss: 0.5362, test_loss: 1.1300, test_f1: 0.6380
 epoch: 37, train_loss: 0.5545, test_loss: 1.1102, test_f1: 0.6167
 epoch: 38, train_loss: 0.5307, test_loss: 1.0929, test_f1: 0.6138
 epoch: 39, train_loss: 0.5210, test_loss: 1.0350, test_f1: 0.6231
 epoch: 40, train_loss: 0.5116, test_loss: 1.0942, test_f1: 0.6234
 epoch: 41, train_loss: 0.5090, test_loss: 1.1809, test_f1: 0.6305
 epoch: 42, train_loss: 0.4844, test_loss: 1.0500, test_f1: 0.6173
 epoch: 43, train_loss: 0.4744, test_loss: 1.0872, test_f1: 0.6367
 epoch: 44, train_loss: 0.4779, test_loss: 1.1289, test_f1: 0.6811
 epoch: 45, train_loss: 0.4726, test_loss: 1.1042, test_f1: 0.6500
 epoch: 46, train_loss: 0.4568, test_loss: 1.1799, test_f1: 0.6086
 epoch: 47, train_loss: 0.4615, test_loss: 1.1146, test_f1: 0.6324
 epoch: 48, train_loss: 0.4473, test_loss: 1.2362, test_f1: 0.6167
 epoch: 49, train_loss: 0.4363, test_loss: 1.2366, test_f1: 0.6301
 epoch: 50, train_loss: 0.4696, test_loss: 1.2956, test_f1: 0.6306
 epoch: 51, train_loss: 0.4014, test_loss: 1.2307, test_f1: 0.6572
 epoch: 52, train_loss: 0.3602, test_loss: 1.2457, test_f1: 0.6596
 epoch: 53, train_loss: 0.3569, test_loss: 1.3348, test_f1: 0.6364
 epoch: 54, train_loss: 0.3447, test_loss: 1.3147, test_f1: 0.6707
 epoch: 55, train_loss: 0.3383, test_loss: 1.2936, test_f1: 0.6503
 epoch: 56, train_loss: 0.3210, test_loss: 1.2871, test_f1: 0.6637
 epoch: 57, train_loss: 0.3009, test_loss: 1.3241, test_f1: 0.6514
 epoch: 58, train_loss: 0.3182, test_loss: 1.4184, test_f1: 0.6496
 epoch: 59, train_loss: 0.3168, test_loss: 1.3925, test_f1: 0.6607
 epoch: 60, train_loss: 0.2954, test_loss: 1.4289, test_f1: 0.6323
 epoch: 61, train_loss: 0.2957, test_loss: 1.5179, test_f1: 0.6512
 epoch: 62, train_loss: 0.2902, test_loss: 1.4981, test_f1: 0.6403
 epoch: 63, train_loss: 0.2872, test_loss: 1.5479, test_f1: 0.6543
 epoch: 64, train_loss: 0.2838, test_loss: 1.4868, test_f1: 0.6446
 epoch: 65, train_loss: 0.2887, test_loss: 1.5576, test_f1: 0.6474
 epoch: 66, train_loss: 0.2714, test_loss: 1.6275, test_f1: 0.6635
 epoch: 67, train_loss: 0.2590, test_loss: 1.5736, test_f1: 0.6603
 epoch: 68, train_loss: 0.2728, test_loss: 1.4948, test_f1: 0.6423
 epoch: 69, train_loss: 0.2818, test_loss: 1.5710, test_f1: 0.6335
 epoch: 70, train_loss: 0.2754, test_loss: 1.6276, test_f1: 0.6458
 epoch: 71, train_loss: 0.2665, test_loss: 1.5372, test_f1: 0.6792
 epoch: 72, train_loss: 0.2601, test_loss: 1.6221, test_f1: 0.6465
 epoch: 73, train_loss: 0.2474, test_loss: 1.6118, test_f1: 0.6252
 epoch: 74, train_loss: 0.2668, test_loss: 1.7685, test_f1: 0.6385
 epoch: 75, train_loss: 0.2478, test_loss: 1.6353, test_f1: 0.6758
 epoch: 76, train_loss: 0.2375, test_loss: 1.7158, test_f1: 0.6277
 epoch: 77, train_loss: 0.2457, test_loss: 1.6015, test_f1: 0.6596
 epoch: 78, train_loss: 0.2408, test_loss: 1.8423, test_f1: 0.6522
 epoch: 79, train_loss: 0.2397, test_loss: 1.6605, test_f1: 0.6511
 epoch: 80, train_loss: 0.2286, test_loss: 1.6438, test_f1: 0.6887
 epoch: 81, train_loss: 0.2221, test_loss: 1.6854, test_f1: 0.6541
 epoch: 82, train_loss: 0.2453, test_loss: 1.7757, test_f1: 0.6529
 epoch: 83, train_loss: 0.2237, test_loss: 1.6715, test_f1: 0.6808
 epoch: 84, train_loss: 0.2457, test_loss: 1.7863, test_f1: 0.6320
 epoch: 85, train_loss: 0.2314, test_loss: 1.7546, test_f1: 0.6648
 epoch: 86, train_loss: 0.2103, test_loss: 1.8771, test_f1: 0.6371
 epoch: 87, train_loss: 0.2213, test_loss: 1.8576, test_f1: 0.6449
 epoch: 88, train_loss: 0.2204, test_loss: 1.8305, test_f1: 0.6376
 epoch: 89, train_loss: 0.2035, test_loss: 1.7104, test_f1: 0.6562
 epoch: 90, train_loss: 0.2001, test_loss: 1.9532, test_f1: 0.6304
 epoch: 91, train_loss: 0.2059, test_loss: 1.9025, test_f1: 0.6645
 epoch: 92, train_loss: 0.2117, test_loss: 1.7276, test_f1: 0.6783
 epoch: 93, train_loss: 0.1906, test_loss: 1.8182, test_f1: 0.6547
 epoch: 94, train_loss: 0.1860, test_loss: 2.0396, test_f1: 0.6646
 epoch: 95, train_loss: 0.2025, test_loss: 1.7945, test_f1: 0.6473
 epoch: 96, train_loss: 0.1968, test_loss: 2.0249, test_f1: 0.6541
 epoch: 97, train_loss: 0.1827, test_loss: 2.0514, test_f1: 0.6407
 epoch: 98, train_loss: 0.1951, test_loss: 1.9042, test_f1: 0.6752
 epoch: 99, train_loss: 0.2022, test_loss: 1.8569, test_f1: 0.6645
##################ITERATION #5 ****************************************
 epoch: 0, train_loss: 1.3140, test_loss: 1.1126, test_f1: 0.3693
 epoch: 1, train_loss: 1.0166, test_loss: 0.9825, test_f1: 0.4662
 epoch: 2, train_loss: 0.9535, test_loss: 0.9586, test_f1: 0.4848
 epoch: 3, train_loss: 0.9178, test_loss: 0.9751, test_f1: 0.5004
 epoch: 4, train_loss: 0.9084, test_loss: 0.9976, test_f1: 0.4889
 epoch: 5, train_loss: 0.8912, test_loss: 0.9916, test_f1: 0.5013
 epoch: 6, train_loss: 0.8707, test_loss: 0.9474, test_f1: 0.5083
 epoch: 7, train_loss: 0.8548, test_loss: 0.9813, test_f1: 0.5329
 epoch: 8, train_loss: 0.8421, test_loss: 0.9780, test_f1: 0.5463
 epoch: 9, train_loss: 0.8374, test_loss: 1.0361, test_f1: 0.4991
 epoch: 10, train_loss: 0.8105, test_loss: 0.9763, test_f1: 0.5359
 epoch: 11, train_loss: 0.7935, test_loss: 0.9752, test_f1: 0.5561
 epoch: 12, train_loss: 0.7926, test_loss: 0.9618, test_f1: 0.5455
 epoch: 13, train_loss: 0.7786, test_loss: 0.9671, test_f1: 0.5849
 epoch: 14, train_loss: 0.7758, test_loss: 1.0137, test_f1: 0.5537
 epoch: 15, train_loss: 0.7571, test_loss: 1.0589, test_f1: 0.5234
 epoch: 16, train_loss: 0.7565, test_loss: 1.0528, test_f1: 0.5370
 epoch: 17, train_loss: 0.7468, test_loss: 1.0179, test_f1: 0.5711
 epoch: 18, train_loss: 0.7464, test_loss: 1.0609, test_f1: 0.5894
 epoch: 19, train_loss: 0.7133, test_loss: 0.9995, test_f1: 0.5502
 epoch: 20, train_loss: 0.6946, test_loss: 1.0744, test_f1: 0.6181
 epoch: 21, train_loss: 0.7004, test_loss: 1.0828, test_f1: 0.5813
 epoch: 22, train_loss: 0.6900, test_loss: 1.0626, test_f1: 0.5725
 epoch: 23, train_loss: 0.6830, test_loss: 0.9750, test_f1: 0.6058
 epoch: 24, train_loss: 0.7000, test_loss: 1.0163, test_f1: 0.5990
 epoch: 25, train_loss: 0.6737, test_loss: 1.1029, test_f1: 0.6083
 epoch: 26, train_loss: 0.6638, test_loss: 1.0263, test_f1: 0.5967
 epoch: 27, train_loss: 0.6483, test_loss: 1.0325, test_f1: 0.5846
 epoch: 28, train_loss: 0.6463, test_loss: 1.0347, test_f1: 0.6153
 epoch: 29, train_loss: 0.6452, test_loss: 1.0571, test_f1: 0.6454
 epoch: 30, train_loss: 0.6438, test_loss: 0.9813, test_f1: 0.6292
 epoch: 31, train_loss: 0.6233, test_loss: 1.1032, test_f1: 0.5687
 epoch: 32, train_loss: 0.6125, test_loss: 1.1191, test_f1: 0.5858
 epoch: 33, train_loss: 0.6172, test_loss: 1.0180, test_f1: 0.6354
 epoch: 34, train_loss: 0.6191, test_loss: 1.0165, test_f1: 0.5971
 epoch: 35, train_loss: 0.5913, test_loss: 1.1706, test_f1: 0.6107
 epoch: 36, train_loss: 0.5929, test_loss: 1.0933, test_f1: 0.5784
 epoch: 37, train_loss: 0.5814, test_loss: 1.0448, test_f1: 0.6186
 epoch: 38, train_loss: 0.5867, test_loss: 1.0491, test_f1: 0.6426
 epoch: 39, train_loss: 0.5857, test_loss: 0.9743, test_f1: 0.6190
 epoch: 40, train_loss: 0.5617, test_loss: 1.1035, test_f1: 0.5749
 epoch: 41, train_loss: 0.5432, test_loss: 1.1451, test_f1: 0.6170
 epoch: 42, train_loss: 0.5373, test_loss: 1.0323, test_f1: 0.6174
 epoch: 43, train_loss: 0.5443, test_loss: 1.1403, test_f1: 0.6433
 epoch: 44, train_loss: 0.5127, test_loss: 1.0986, test_f1: 0.6409
 epoch: 45, train_loss: 0.5069, test_loss: 1.2666, test_f1: 0.6016
 epoch: 46, train_loss: 0.5015, test_loss: 1.3034, test_f1: 0.6312
 epoch: 47, train_loss: 0.4966, test_loss: 1.2667, test_f1: 0.6222
 epoch: 48, train_loss: 0.5042, test_loss: 1.2177, test_f1: 0.5958
 epoch: 49, train_loss: 0.4936, test_loss: 1.3255, test_f1: 0.6089
 epoch: 50, train_loss: 0.5072, test_loss: 1.2100, test_f1: 0.6260
 epoch: 51, train_loss: 0.4387, test_loss: 1.2403, test_f1: 0.6479
 epoch: 52, train_loss: 0.4181, test_loss: 1.1974, test_f1: 0.6433
 epoch: 53, train_loss: 0.3949, test_loss: 1.2865, test_f1: 0.6476
 epoch: 54, train_loss: 0.3579, test_loss: 1.2782, test_f1: 0.6456
 epoch: 55, train_loss: 0.3713, test_loss: 1.4005, test_f1: 0.6301
 epoch: 56, train_loss: 0.3673, test_loss: 1.3332, test_f1: 0.6458
 epoch: 57, train_loss: 0.3528, test_loss: 1.4396, test_f1: 0.6481
 epoch: 58, train_loss: 0.3532, test_loss: 1.3499, test_f1: 0.6756
 epoch: 59, train_loss: 0.3499, test_loss: 1.5438, test_f1: 0.6183
 epoch: 60, train_loss: 0.3433, test_loss: 1.5327, test_f1: 0.6192
 epoch: 61, train_loss: 0.3364, test_loss: 1.3506, test_f1: 0.6351
 epoch: 62, train_loss: 0.3362, test_loss: 1.4222, test_f1: 0.6336
 epoch: 63, train_loss: 0.3565, test_loss: 1.4410, test_f1: 0.6434
 epoch: 64, train_loss: 0.3248, test_loss: 1.5372, test_f1: 0.6293
 epoch: 65, train_loss: 0.3362, test_loss: 1.4866, test_f1: 0.6249
 epoch: 66, train_loss: 0.3193, test_loss: 1.4378, test_f1: 0.6538
 epoch: 67, train_loss: 0.3069, test_loss: 1.4415, test_f1: 0.6223
 epoch: 68, train_loss: 0.3106, test_loss: 1.4447, test_f1: 0.6476
 epoch: 69, train_loss: 0.2952, test_loss: 1.5160, test_f1: 0.6388
 epoch: 70, train_loss: 0.2986, test_loss: 1.3609, test_f1: 0.6280
 epoch: 71, train_loss: 0.2920, test_loss: 1.5896, test_f1: 0.6544
 epoch: 72, train_loss: 0.3062, test_loss: 1.4864, test_f1: 0.6275
 epoch: 73, train_loss: 0.2931, test_loss: 1.4952, test_f1: 0.6510
 epoch: 74, train_loss: 0.2925, test_loss: 1.3554, test_f1: 0.6333
 epoch: 75, train_loss: 0.2769, test_loss: 1.5971, test_f1: 0.6323
 epoch: 76, train_loss: 0.2652, test_loss: 1.6057, test_f1: 0.6299
 epoch: 77, train_loss: 0.2721, test_loss: 1.7716, test_f1: 0.6498
 epoch: 78, train_loss: 0.2703, test_loss: 1.6375, test_f1: 0.6540
 epoch: 79, train_loss: 0.2559, test_loss: 1.6089, test_f1: 0.6515
 epoch: 80, train_loss: 0.2615, test_loss: 1.6328, test_f1: 0.6371
 epoch: 81, train_loss: 0.2300, test_loss: 1.6597, test_f1: 0.6379
 epoch: 82, train_loss: 0.2754, test_loss: 1.6702, test_f1: 0.6182
 epoch: 83, train_loss: 0.2615, test_loss: 1.6011, test_f1: 0.6386
 epoch: 84, train_loss: 0.2569, test_loss: 1.7330, test_f1: 0.6347
 epoch: 85, train_loss: 0.2493, test_loss: 1.7616, test_f1: 0.6318
 epoch: 86, train_loss: 0.2353, test_loss: 1.7622, test_f1: 0.6503
 epoch: 87, train_loss: 0.2226, test_loss: 1.6432, test_f1: 0.6647
 epoch: 88, train_loss: 0.2542, test_loss: 1.6302, test_f1: 0.6495
 epoch: 89, train_loss: 0.2378, test_loss: 1.7747, test_f1: 0.6301
 epoch: 90, train_loss: 0.2294, test_loss: 1.7520, test_f1: 0.6552
 epoch: 91, train_loss: 0.2144, test_loss: 1.6039, test_f1: 0.6383
 epoch: 92, train_loss: 0.2240, test_loss: 1.7981, test_f1: 0.6444
 epoch: 93, train_loss: 0.2132, test_loss: 1.7455, test_f1: 0.6486
 epoch: 94, train_loss: 0.2259, test_loss: 1.9287, test_f1: 0.6238
 epoch: 95, train_loss: 0.2117, test_loss: 1.5744, test_f1: 0.6634
 epoch: 96, train_loss: 0.2112, test_loss: 1.8763, test_f1: 0.6388
 epoch: 97, train_loss: 0.2113, test_loss: 1.7436, test_f1: 0.6498
 epoch: 98, train_loss: 0.2136, test_loss: 1.8417, test_f1: 0.6169
 epoch: 99, train_loss: 0.2142, test_loss: 1.8687, test_f1: 0.6288
##################ITERATION #6 ****************************************
 epoch: 0, train_loss: 1.3601, test_loss: 1.1269, test_f1: 0.3425
 epoch: 1, train_loss: 1.0476, test_loss: 1.0207, test_f1: 0.4556
 epoch: 2, train_loss: 0.9756, test_loss: 0.9745, test_f1: 0.4814
 epoch: 3, train_loss: 0.9308, test_loss: 0.9816, test_f1: 0.4780
 epoch: 4, train_loss: 0.9169, test_loss: 1.0294, test_f1: 0.4829
 epoch: 5, train_loss: 0.8947, test_loss: 0.9515, test_f1: 0.5128
 epoch: 6, train_loss: 0.8751, test_loss: 1.0070, test_f1: 0.4841
 epoch: 7, train_loss: 0.8652, test_loss: 0.9779, test_f1: 0.5179
 epoch: 8, train_loss: 0.8485, test_loss: 0.9537, test_f1: 0.5277
 epoch: 9, train_loss: 0.8114, test_loss: 0.9327, test_f1: 0.5478
 epoch: 10, train_loss: 0.8293, test_loss: 0.9830, test_f1: 0.5348
 epoch: 11, train_loss: 0.8138, test_loss: 0.9685, test_f1: 0.5449
 epoch: 12, train_loss: 0.7975, test_loss: 0.9507, test_f1: 0.5649
 epoch: 13, train_loss: 0.7908, test_loss: 0.9600, test_f1: 0.5304
 epoch: 14, train_loss: 0.7879, test_loss: 0.9545, test_f1: 0.5786
 epoch: 15, train_loss: 0.7702, test_loss: 0.9652, test_f1: 0.5521
 epoch: 16, train_loss: 0.7544, test_loss: 0.9416, test_f1: 0.5699
 epoch: 17, train_loss: 0.7601, test_loss: 0.9443, test_f1: 0.5795
 epoch: 18, train_loss: 0.7623, test_loss: 1.0150, test_f1: 0.5714
 epoch: 19, train_loss: 0.7445, test_loss: 1.0097, test_f1: 0.5499
 epoch: 20, train_loss: 0.7274, test_loss: 1.0156, test_f1: 0.5481
 epoch: 21, train_loss: 0.7010, test_loss: 1.0027, test_f1: 0.6173
 epoch: 22, train_loss: 0.6993, test_loss: 0.9968, test_f1: 0.5709
 epoch: 23, train_loss: 0.7111, test_loss: 1.0257, test_f1: 0.6140
 epoch: 24, train_loss: 0.6914, test_loss: 1.0210, test_f1: 0.6378
 epoch: 25, train_loss: 0.6896, test_loss: 1.0427, test_f1: 0.5881
 epoch: 26, train_loss: 0.6964, test_loss: 0.9352, test_f1: 0.6381
 epoch: 27, train_loss: 0.6626, test_loss: 1.0483, test_f1: 0.5830
 epoch: 28, train_loss: 0.6617, test_loss: 1.0089, test_f1: 0.5792
 epoch: 29, train_loss: 0.6485, test_loss: 1.0165, test_f1: 0.6630
 epoch: 30, train_loss: 0.6298, test_loss: 1.0625, test_f1: 0.6169
 epoch: 31, train_loss: 0.6458, test_loss: 1.0478, test_f1: 0.5747
 epoch: 32, train_loss: 0.6175, test_loss: 1.0061, test_f1: 0.6126
 epoch: 33, train_loss: 0.6235, test_loss: 1.0694, test_f1: 0.6047
 epoch: 34, train_loss: 0.6262, test_loss: 1.0084, test_f1: 0.6479
 epoch: 35, train_loss: 0.6097, test_loss: 1.0210, test_f1: 0.6004
 epoch: 36, train_loss: 0.5868, test_loss: 0.9429, test_f1: 0.5991
 epoch: 37, train_loss: 0.5832, test_loss: 0.9959, test_f1: 0.6292
 epoch: 38, train_loss: 0.5810, test_loss: 1.0758, test_f1: 0.6268
 epoch: 39, train_loss: 0.5865, test_loss: 1.1469, test_f1: 0.5835
 epoch: 40, train_loss: 0.5806, test_loss: 1.0066, test_f1: 0.6519
 epoch: 41, train_loss: 0.5701, test_loss: 1.0558, test_f1: 0.5762
 epoch: 42, train_loss: 0.5427, test_loss: 1.0718, test_f1: 0.6302
 epoch: 43, train_loss: 0.5486, test_loss: 1.0924, test_f1: 0.6201
 epoch: 44, train_loss: 0.5392, test_loss: 1.0424, test_f1: 0.6366
 epoch: 45, train_loss: 0.5152, test_loss: 1.0940, test_f1: 0.6324
 epoch: 46, train_loss: 0.5294, test_loss: 1.1678, test_f1: 0.6102
 epoch: 47, train_loss: 0.5391, test_loss: 1.0250, test_f1: 0.6573
 epoch: 48, train_loss: 0.5094, test_loss: 1.0206, test_f1: 0.6103
 epoch: 49, train_loss: 0.4931, test_loss: 1.2311, test_f1: 0.6347
 epoch: 50, train_loss: 0.4805, test_loss: 1.1504, test_f1: 0.6216
 epoch: 51, train_loss: 0.4636, test_loss: 1.1068, test_f1: 0.6786
 epoch: 52, train_loss: 0.4176, test_loss: 1.2466, test_f1: 0.6435
 epoch: 53, train_loss: 0.3930, test_loss: 1.1825, test_f1: 0.6814
 epoch: 54, train_loss: 0.3692, test_loss: 1.2806, test_f1: 0.6382
 epoch: 55, train_loss: 0.3857, test_loss: 1.2335, test_f1: 0.6430
 epoch: 56, train_loss: 0.3828, test_loss: 1.3233, test_f1: 0.6412
 epoch: 57, train_loss: 0.3632, test_loss: 1.4263, test_f1: 0.6256
 epoch: 58, train_loss: 0.3682, test_loss: 1.2653, test_f1: 0.6271
 epoch: 59, train_loss: 0.3582, test_loss: 1.4001, test_f1: 0.6147
 epoch: 60, train_loss: 0.3709, test_loss: 1.2305, test_f1: 0.6374
 epoch: 61, train_loss: 0.3435, test_loss: 1.2821, test_f1: 0.6191
 epoch: 62, train_loss: 0.3535, test_loss: 1.3806, test_f1: 0.6386
 epoch: 63, train_loss: 0.3324, test_loss: 1.5502, test_f1: 0.6213
 epoch: 64, train_loss: 0.3089, test_loss: 1.2811, test_f1: 0.6588
 epoch: 65, train_loss: 0.3199, test_loss: 1.2992, test_f1: 0.6505
 epoch: 66, train_loss: 0.3214, test_loss: 1.4789, test_f1: 0.6286
 epoch: 67, train_loss: 0.3417, test_loss: 1.3517, test_f1: 0.6609
 epoch: 68, train_loss: 0.3094, test_loss: 1.5952, test_f1: 0.5997
 epoch: 69, train_loss: 0.3054, test_loss: 1.4300, test_f1: 0.6361
 epoch: 70, train_loss: 0.2851, test_loss: 1.4943, test_f1: 0.6481
 epoch: 71, train_loss: 0.2882, test_loss: 1.5283, test_f1: 0.6279
 epoch: 72, train_loss: 0.2918, test_loss: 1.3685, test_f1: 0.6617
 epoch: 73, train_loss: 0.2842, test_loss: 1.4702, test_f1: 0.6077
 epoch: 74, train_loss: 0.2866, test_loss: 1.5206, test_f1: 0.6353
 epoch: 75, train_loss: 0.3128, test_loss: 1.4471, test_f1: 0.6516
 epoch: 76, train_loss: 0.2995, test_loss: 1.4912, test_f1: 0.6338
 epoch: 77, train_loss: 0.2920, test_loss: 1.5647, test_f1: 0.6203
 epoch: 78, train_loss: 0.2779, test_loss: 1.3897, test_f1: 0.6522
 epoch: 79, train_loss: 0.2847, test_loss: 1.5780, test_f1: 0.6328
 epoch: 80, train_loss: 0.3017, test_loss: 1.5765, test_f1: 0.6176
 epoch: 81, train_loss: 0.2781, test_loss: 1.5128, test_f1: 0.6224
 epoch: 82, train_loss: 0.2611, test_loss: 1.6504, test_f1: 0.5943
 epoch: 83, train_loss: 0.2373, test_loss: 1.5672, test_f1: 0.6412
 epoch: 84, train_loss: 0.2554, test_loss: 1.5761, test_f1: 0.6465
 epoch: 85, train_loss: 0.2556, test_loss: 1.6295, test_f1: 0.6515
 epoch: 86, train_loss: 0.2407, test_loss: 1.6828, test_f1: 0.6476
 epoch: 87, train_loss: 0.2456, test_loss: 1.6993, test_f1: 0.6613
 epoch: 88, train_loss: 0.2632, test_loss: 1.5308, test_f1: 0.6540
 epoch: 89, train_loss: 0.2686, test_loss: 1.7274, test_f1: 0.6327
 epoch: 90, train_loss: 0.2270, test_loss: 1.7619, test_f1: 0.6309
 epoch: 91, train_loss: 0.2206, test_loss: 1.7588, test_f1: 0.6356
 epoch: 92, train_loss: 0.2431, test_loss: 1.8415, test_f1: 0.6436
 epoch: 93, train_loss: 0.2401, test_loss: 1.8140, test_f1: 0.6374
 epoch: 94, train_loss: 0.2255, test_loss: 1.8016, test_f1: 0.6270
 epoch: 95, train_loss: 0.2129, test_loss: 1.7286, test_f1: 0.6361
 epoch: 96, train_loss: 0.2312, test_loss: 1.7624, test_f1: 0.6399
 epoch: 97, train_loss: 0.2260, test_loss: 1.7820, test_f1: 0.6448
 epoch: 98, train_loss: 0.2345, test_loss: 1.8248, test_f1: 0.6395
 epoch: 99, train_loss: 0.2075, test_loss: 1.7426, test_f1: 0.6587
##################ITERATION #7 ****************************************
 epoch: 0, train_loss: 1.3658, test_loss: 1.2486, test_f1: 0.3988
 epoch: 1, train_loss: 1.0515, test_loss: 1.0329, test_f1: 0.4611
 epoch: 2, train_loss: 0.9747, test_loss: 0.9416, test_f1: 0.4840
 epoch: 3, train_loss: 0.9416, test_loss: 0.9266, test_f1: 0.4853
 epoch: 4, train_loss: 0.9092, test_loss: 0.9150, test_f1: 0.5248
 epoch: 5, train_loss: 0.8960, test_loss: 0.9491, test_f1: 0.5117
 epoch: 6, train_loss: 0.8858, test_loss: 0.9666, test_f1: 0.5549
 epoch: 7, train_loss: 0.8521, test_loss: 1.0086, test_f1: 0.5349
 epoch: 8, train_loss: 0.8456, test_loss: 0.9986, test_f1: 0.5416
 epoch: 9, train_loss: 0.8592, test_loss: 1.0150, test_f1: 0.5120
 epoch: 10, train_loss: 0.8107, test_loss: 1.0131, test_f1: 0.5370
 epoch: 11, train_loss: 0.8152, test_loss: 1.0079, test_f1: 0.5129
 epoch: 12, train_loss: 0.8082, test_loss: 0.9934, test_f1: 0.5596
 epoch: 13, train_loss: 0.7873, test_loss: 0.9765, test_f1: 0.5381
 epoch: 14, train_loss: 0.7907, test_loss: 0.9837, test_f1: 0.5220
 epoch: 15, train_loss: 0.7889, test_loss: 1.0383, test_f1: 0.5544
 epoch: 16, train_loss: 0.7571, test_loss: 1.0014, test_f1: 0.5548
 epoch: 17, train_loss: 0.7541, test_loss: 1.0166, test_f1: 0.5998
 epoch: 18, train_loss: 0.7496, test_loss: 1.0471, test_f1: 0.5584
 epoch: 19, train_loss: 0.7186, test_loss: 1.0393, test_f1: 0.5534
 epoch: 20, train_loss: 0.7196, test_loss: 1.0408, test_f1: 0.5530
 epoch: 21, train_loss: 0.7214, test_loss: 1.0393, test_f1: 0.5906
 epoch: 22, train_loss: 0.7042, test_loss: 1.0636, test_f1: 0.5917
 epoch: 23, train_loss: 0.7007, test_loss: 1.0610, test_f1: 0.5705
 epoch: 24, train_loss: 0.6720, test_loss: 1.0728, test_f1: 0.6062
 epoch: 25, train_loss: 0.6657, test_loss: 1.0745, test_f1: 0.6062
 epoch: 26, train_loss: 0.6746, test_loss: 1.1048, test_f1: 0.6010
 epoch: 27, train_loss: 0.6897, test_loss: 1.0799, test_f1: 0.6048
 epoch: 28, train_loss: 0.6488, test_loss: 1.0709, test_f1: 0.5804
 epoch: 29, train_loss: 0.6645, test_loss: 1.1018, test_f1: 0.5937
 epoch: 30, train_loss: 0.6365, test_loss: 1.0418, test_f1: 0.6355
 epoch: 31, train_loss: 0.6208, test_loss: 1.0752, test_f1: 0.6148
 epoch: 32, train_loss: 0.6154, test_loss: 1.0854, test_f1: 0.5811
 epoch: 33, train_loss: 0.6163, test_loss: 1.1637, test_f1: 0.6471
 epoch: 34, train_loss: 0.6001, test_loss: 1.1726, test_f1: 0.6244
 epoch: 35, train_loss: 0.5920, test_loss: 1.0982, test_f1: 0.6328
 epoch: 36, train_loss: 0.6000, test_loss: 1.0558, test_f1: 0.6130
 epoch: 37, train_loss: 0.6110, test_loss: 1.2120, test_f1: 0.6115
 epoch: 38, train_loss: 0.5730, test_loss: 1.1372, test_f1: 0.6278
 epoch: 39, train_loss: 0.5670, test_loss: 1.1247, test_f1: 0.5996
 epoch: 40, train_loss: 0.5622, test_loss: 1.1086, test_f1: 0.6339
 epoch: 41, train_loss: 0.5611, test_loss: 1.1776, test_f1: 0.6238
 epoch: 42, train_loss: 0.5762, test_loss: 1.1290, test_f1: 0.6553
 epoch: 43, train_loss: 0.5482, test_loss: 1.2141, test_f1: 0.6050
 epoch: 44, train_loss: 0.5370, test_loss: 1.1396, test_f1: 0.6158
 epoch: 45, train_loss: 0.5276, test_loss: 1.1505, test_f1: 0.6105
 epoch: 46, train_loss: 0.5237, test_loss: 1.2538, test_f1: 0.6127
 epoch: 47, train_loss: 0.5158, test_loss: 1.1761, test_f1: 0.6179
 epoch: 48, train_loss: 0.5328, test_loss: 1.2282, test_f1: 0.6357
 epoch: 49, train_loss: 0.5158, test_loss: 1.2041, test_f1: 0.6385
 epoch: 50, train_loss: 0.4968, test_loss: 1.2527, test_f1: 0.6200
 epoch: 51, train_loss: 0.4358, test_loss: 1.2451, test_f1: 0.6600
 epoch: 52, train_loss: 0.4184, test_loss: 1.3922, test_f1: 0.6360
 epoch: 53, train_loss: 0.4132, test_loss: 1.2482, test_f1: 0.6434
 epoch: 54, train_loss: 0.3952, test_loss: 1.3647, test_f1: 0.6584
 epoch: 55, train_loss: 0.3782, test_loss: 1.3289, test_f1: 0.6765
 epoch: 56, train_loss: 0.3819, test_loss: 1.4057, test_f1: 0.6583
 epoch: 57, train_loss: 0.3693, test_loss: 1.3658, test_f1: 0.6446
 epoch: 58, train_loss: 0.3694, test_loss: 1.3407, test_f1: 0.6541
 epoch: 59, train_loss: 0.3552, test_loss: 1.5044, test_f1: 0.6151
 epoch: 60, train_loss: 0.3474, test_loss: 1.4988, test_f1: 0.6359
 epoch: 61, train_loss: 0.3453, test_loss: 1.4657, test_f1: 0.6308
 epoch: 62, train_loss: 0.3289, test_loss: 1.4890, test_f1: 0.6442
 epoch: 63, train_loss: 0.3295, test_loss: 1.5097, test_f1: 0.6334
 epoch: 64, train_loss: 0.3339, test_loss: 1.4604, test_f1: 0.6313
 epoch: 65, train_loss: 0.3229, test_loss: 1.5797, test_f1: 0.6297
 epoch: 66, train_loss: 0.3160, test_loss: 1.6061, test_f1: 0.6367
 epoch: 67, train_loss: 0.3329, test_loss: 1.6313, test_f1: 0.6383
 epoch: 68, train_loss: 0.3366, test_loss: 1.6237, test_f1: 0.6186
 epoch: 69, train_loss: 0.3161, test_loss: 1.5434, test_f1: 0.6432
 epoch: 70, train_loss: 0.3054, test_loss: 1.5946, test_f1: 0.6161
 epoch: 71, train_loss: 0.2952, test_loss: 1.5805, test_f1: 0.6227
 epoch: 72, train_loss: 0.3034, test_loss: 1.5611, test_f1: 0.6513
 epoch: 73, train_loss: 0.3206, test_loss: 1.5974, test_f1: 0.6294
 epoch: 74, train_loss: 0.2763, test_loss: 1.6062, test_f1: 0.6536
 epoch: 75, train_loss: 0.2745, test_loss: 1.6263, test_f1: 0.6278
 epoch: 76, train_loss: 0.2739, test_loss: 1.7461, test_f1: 0.5963
 epoch: 77, train_loss: 0.2752, test_loss: 1.6357, test_f1: 0.6537
 epoch: 78, train_loss: 0.2739, test_loss: 1.6787, test_f1: 0.6608
 epoch: 79, train_loss: 0.2707, test_loss: 1.6937, test_f1: 0.6328
 epoch: 80, train_loss: 0.2630, test_loss: 1.7218, test_f1: 0.6273
 epoch: 81, train_loss: 0.2656, test_loss: 1.8191, test_f1: 0.6395
 epoch: 82, train_loss: 0.2644, test_loss: 1.7326, test_f1: 0.6194
 epoch: 83, train_loss: 0.2651, test_loss: 1.8608, test_f1: 0.6031
 epoch: 84, train_loss: 0.2715, test_loss: 1.8263, test_f1: 0.6053
 epoch: 85, train_loss: 0.2501, test_loss: 1.7254, test_f1: 0.6474
 epoch: 86, train_loss: 0.2329, test_loss: 2.0102, test_f1: 0.6384
 epoch: 87, train_loss: 0.2318, test_loss: 1.9466, test_f1: 0.6228
 epoch: 88, train_loss: 0.2812, test_loss: 1.8572, test_f1: 0.6119
 epoch: 89, train_loss: 0.2397, test_loss: 1.9305, test_f1: 0.6155
 epoch: 90, train_loss: 0.2540, test_loss: 1.8468, test_f1: 0.6065
 epoch: 91, train_loss: 0.2506, test_loss: 1.7715, test_f1: 0.6477
 epoch: 92, train_loss: 0.2315, test_loss: 1.9693, test_f1: 0.6256
 epoch: 93, train_loss: 0.2459, test_loss: 1.8373, test_f1: 0.6382
 epoch: 94, train_loss: 0.2258, test_loss: 1.9064, test_f1: 0.6347
 epoch: 95, train_loss: 0.2118, test_loss: 1.8269, test_f1: 0.6352
 epoch: 96, train_loss: 0.2316, test_loss: 1.8300, test_f1: 0.6295
 epoch: 97, train_loss: 0.2289, test_loss: 2.0512, test_f1: 0.6417
 epoch: 98, train_loss: 0.2156, test_loss: 2.0855, test_f1: 0.6179
 epoch: 99, train_loss: 0.2365, test_loss: 1.9364, test_f1: 0.6289
##################ITERATION #8 ****************************************
 epoch: 0, train_loss: 1.4223, test_loss: 1.2190, test_f1: 0.3255
 epoch: 1, train_loss: 1.0263, test_loss: 0.9900, test_f1: 0.4355
 epoch: 2, train_loss: 0.9608, test_loss: 0.9704, test_f1: 0.4663
 epoch: 3, train_loss: 0.9268, test_loss: 0.9406, test_f1: 0.4785
 epoch: 4, train_loss: 0.8939, test_loss: 0.9449, test_f1: 0.4934
 epoch: 5, train_loss: 0.8792, test_loss: 0.9175, test_f1: 0.4991
 epoch: 6, train_loss: 0.8748, test_loss: 0.9890, test_f1: 0.4986
 epoch: 7, train_loss: 0.8649, test_loss: 0.9880, test_f1: 0.5004
 epoch: 8, train_loss: 0.8506, test_loss: 0.9791, test_f1: 0.5123
 epoch: 9, train_loss: 0.8304, test_loss: 1.0048, test_f1: 0.4944
 epoch: 10, train_loss: 0.8289, test_loss: 1.0661, test_f1: 0.5078
 epoch: 11, train_loss: 0.8249, test_loss: 0.9849, test_f1: 0.5319
 epoch: 12, train_loss: 0.7933, test_loss: 0.9726, test_f1: 0.5588
 epoch: 13, train_loss: 0.7973, test_loss: 0.9882, test_f1: 0.5696
 epoch: 14, train_loss: 0.7707, test_loss: 0.9667, test_f1: 0.5649
 epoch: 15, train_loss: 0.7701, test_loss: 1.0168, test_f1: 0.5511
 epoch: 16, train_loss: 0.7579, test_loss: 1.0013, test_f1: 0.5992
 epoch: 17, train_loss: 0.7425, test_loss: 0.9931, test_f1: 0.5747
 epoch: 18, train_loss: 0.7398, test_loss: 0.9741, test_f1: 0.6074
 epoch: 19, train_loss: 0.7293, test_loss: 1.0164, test_f1: 0.5857
 epoch: 20, train_loss: 0.7344, test_loss: 1.0151, test_f1: 0.5636
 epoch: 21, train_loss: 0.7126, test_loss: 1.0347, test_f1: 0.5881
 epoch: 22, train_loss: 0.7241, test_loss: 0.9289, test_f1: 0.5864
 epoch: 23, train_loss: 0.6929, test_loss: 1.0416, test_f1: 0.6028
 epoch: 24, train_loss: 0.6738, test_loss: 1.1022, test_f1: 0.5953
 epoch: 25, train_loss: 0.6888, test_loss: 1.0927, test_f1: 0.5840
 epoch: 26, train_loss: 0.6840, test_loss: 1.0382, test_f1: 0.6230
 epoch: 27, train_loss: 0.6668, test_loss: 1.0266, test_f1: 0.5930
 epoch: 28, train_loss: 0.6596, test_loss: 1.0581, test_f1: 0.5922
 epoch: 29, train_loss: 0.6544, test_loss: 1.0542, test_f1: 0.6118
 epoch: 30, train_loss: 0.6377, test_loss: 1.0494, test_f1: 0.5937
 epoch: 31, train_loss: 0.6575, test_loss: 1.1146, test_f1: 0.5899
 epoch: 32, train_loss: 0.6348, test_loss: 1.0828, test_f1: 0.6113
 epoch: 33, train_loss: 0.6218, test_loss: 1.0704, test_f1: 0.6174
 epoch: 34, train_loss: 0.5923, test_loss: 1.0124, test_f1: 0.6409
 epoch: 35, train_loss: 0.5930, test_loss: 1.1048, test_f1: 0.6296
 epoch: 36, train_loss: 0.5831, test_loss: 1.1013, test_f1: 0.5907
 epoch: 37, train_loss: 0.5774, test_loss: 1.1661, test_f1: 0.5975
 epoch: 38, train_loss: 0.5896, test_loss: 1.1265, test_f1: 0.6463
 epoch: 39, train_loss: 0.5831, test_loss: 1.1120, test_f1: 0.6017
 epoch: 40, train_loss: 0.5849, test_loss: 1.1960, test_f1: 0.5926
 epoch: 41, train_loss: 0.5523, test_loss: 1.1844, test_f1: 0.5985
 epoch: 42, train_loss: 0.5554, test_loss: 1.1387, test_f1: 0.5987
 epoch: 43, train_loss: 0.5411, test_loss: 1.1981, test_f1: 0.6182
 epoch: 44, train_loss: 0.5450, test_loss: 1.2220, test_f1: 0.6087
 epoch: 45, train_loss: 0.5159, test_loss: 1.1511, test_f1: 0.6525
 epoch: 46, train_loss: 0.5075, test_loss: 1.2990, test_f1: 0.6159
 epoch: 47, train_loss: 0.5034, test_loss: 1.1197, test_f1: 0.6556
 epoch: 48, train_loss: 0.5106, test_loss: 1.1681, test_f1: 0.6471
 epoch: 49, train_loss: 0.4774, test_loss: 1.2247, test_f1: 0.6398
 epoch: 50, train_loss: 0.5218, test_loss: 1.1300, test_f1: 0.6366
 epoch: 51, train_loss: 0.4514, test_loss: 1.1849, test_f1: 0.6752
 epoch: 52, train_loss: 0.4221, test_loss: 1.2499, test_f1: 0.6648
 epoch: 53, train_loss: 0.4007, test_loss: 1.3067, test_f1: 0.6364
 epoch: 54, train_loss: 0.3751, test_loss: 1.2467, test_f1: 0.6663
 epoch: 55, train_loss: 0.3975, test_loss: 1.3386, test_f1: 0.6385
 epoch: 56, train_loss: 0.3627, test_loss: 1.3401, test_f1: 0.6523
 epoch: 57, train_loss: 0.3819, test_loss: 1.2995, test_f1: 0.6429
 epoch: 58, train_loss: 0.3691, test_loss: 1.2080, test_f1: 0.6656
 epoch: 59, train_loss: 0.3484, test_loss: 1.3062, test_f1: 0.6757
 epoch: 60, train_loss: 0.3216, test_loss: 1.4222, test_f1: 0.6428
 epoch: 61, train_loss: 0.3292, test_loss: 1.2952, test_f1: 0.6711
 epoch: 62, train_loss: 0.3303, test_loss: 1.3954, test_f1: 0.6399
 epoch: 63, train_loss: 0.3283, test_loss: 1.5275, test_f1: 0.6475
 epoch: 64, train_loss: 0.3247, test_loss: 1.4836, test_f1: 0.6498
 epoch: 65, train_loss: 0.3238, test_loss: 1.4225, test_f1: 0.6514
 epoch: 66, train_loss: 0.3181, test_loss: 1.4453, test_f1: 0.6438
 epoch: 67, train_loss: 0.3245, test_loss: 1.4476, test_f1: 0.6743
 epoch: 68, train_loss: 0.3221, test_loss: 1.5859, test_f1: 0.6403
 epoch: 69, train_loss: 0.3097, test_loss: 1.4947, test_f1: 0.6572
 epoch: 70, train_loss: 0.2929, test_loss: 1.4933, test_f1: 0.6581
 epoch: 71, train_loss: 0.2835, test_loss: 1.5016, test_f1: 0.6664
 epoch: 72, train_loss: 0.2928, test_loss: 1.5668, test_f1: 0.6527
 epoch: 73, train_loss: 0.3092, test_loss: 1.6219, test_f1: 0.6447
 epoch: 74, train_loss: 0.2714, test_loss: 1.5383, test_f1: 0.6618
 epoch: 75, train_loss: 0.2785, test_loss: 1.5831, test_f1: 0.6499
 epoch: 76, train_loss: 0.2949, test_loss: 1.7404, test_f1: 0.6640
 epoch: 77, train_loss: 0.2877, test_loss: 1.6526, test_f1: 0.6406
 epoch: 78, train_loss: 0.2733, test_loss: 1.5117, test_f1: 0.6745
 epoch: 79, train_loss: 0.2661, test_loss: 1.7167, test_f1: 0.6627
 epoch: 80, train_loss: 0.2648, test_loss: 1.7815, test_f1: 0.6191
 epoch: 81, train_loss: 0.2616, test_loss: 1.6649, test_f1: 0.6560
 epoch: 82, train_loss: 0.2512, test_loss: 1.7116, test_f1: 0.6744
 epoch: 83, train_loss: 0.2398, test_loss: 1.7868, test_f1: 0.6514
 epoch: 84, train_loss: 0.2688, test_loss: 1.6985, test_f1: 0.6540
 epoch: 85, train_loss: 0.2543, test_loss: 1.8450, test_f1: 0.6494
 epoch: 86, train_loss: 0.2602, test_loss: 1.7052, test_f1: 0.6564
 epoch: 87, train_loss: 0.2391, test_loss: 1.7694, test_f1: 0.6592
 epoch: 88, train_loss: 0.2476, test_loss: 1.7762, test_f1: 0.6568
 epoch: 89, train_loss: 0.2559, test_loss: 1.7871, test_f1: 0.6369
 epoch: 90, train_loss: 0.2243, test_loss: 1.9753, test_f1: 0.6452
 epoch: 91, train_loss: 0.2309, test_loss: 1.8887, test_f1: 0.6440
 epoch: 92, train_loss: 0.2248, test_loss: 1.7711, test_f1: 0.6542
 epoch: 93, train_loss: 0.2311, test_loss: 1.9070, test_f1: 0.6457
 epoch: 94, train_loss: 0.2307, test_loss: 1.8238, test_f1: 0.6512
 epoch: 95, train_loss: 0.2180, test_loss: 1.7815, test_f1: 0.6545
 epoch: 96, train_loss: 0.2426, test_loss: 1.9500, test_f1: 0.6400
 epoch: 97, train_loss: 0.2303, test_loss: 1.9070, test_f1: 0.6412
 epoch: 98, train_loss: 0.2262, test_loss: 1.9949, test_f1: 0.6483
 epoch: 99, train_loss: 0.2214, test_loss: 1.9480, test_f1: 0.6322
##################ITERATION #9 ****************************************
 epoch: 0, train_loss: 1.3825, test_loss: 1.2541, test_f1: 0.2270
 epoch: 1, train_loss: 1.0274, test_loss: 1.0081, test_f1: 0.4347
 epoch: 2, train_loss: 0.9440, test_loss: 0.9427, test_f1: 0.5090
 epoch: 3, train_loss: 0.9229, test_loss: 0.9105, test_f1: 0.5034
 epoch: 4, train_loss: 0.9132, test_loss: 0.9312, test_f1: 0.4864
 epoch: 5, train_loss: 0.8894, test_loss: 0.9407, test_f1: 0.5356
 epoch: 6, train_loss: 0.8618, test_loss: 1.0213, test_f1: 0.5373
 epoch: 7, train_loss: 0.8437, test_loss: 1.0081, test_f1: 0.5392
 epoch: 8, train_loss: 0.8301, test_loss: 0.9700, test_f1: 0.5331
 epoch: 9, train_loss: 0.8159, test_loss: 0.9602, test_f1: 0.5622
 epoch: 10, train_loss: 0.7857, test_loss: 0.9890, test_f1: 0.5732
 epoch: 11, train_loss: 0.7860, test_loss: 0.9129, test_f1: 0.5735
 epoch: 12, train_loss: 0.8028, test_loss: 0.9532, test_f1: 0.5461
 epoch: 13, train_loss: 0.7832, test_loss: 0.9820, test_f1: 0.5858
 epoch: 14, train_loss: 0.7691, test_loss: 0.9553, test_f1: 0.6127
 epoch: 15, train_loss: 0.7513, test_loss: 0.9824, test_f1: 0.5758
 epoch: 16, train_loss: 0.7368, test_loss: 0.9985, test_f1: 0.5667
 epoch: 17, train_loss: 0.7248, test_loss: 0.9756, test_f1: 0.5692
 epoch: 18, train_loss: 0.7174, test_loss: 1.0584, test_f1: 0.5656
 epoch: 19, train_loss: 0.7202, test_loss: 0.9976, test_f1: 0.5776
 epoch: 20, train_loss: 0.7036, test_loss: 0.9769, test_f1: 0.6157
 epoch: 21, train_loss: 0.6960, test_loss: 0.9833, test_f1: 0.6168
 epoch: 22, train_loss: 0.6871, test_loss: 1.0943, test_f1: 0.6116
 epoch: 23, train_loss: 0.6728, test_loss: 0.9863, test_f1: 0.5894
 epoch: 24, train_loss: 0.6627, test_loss: 0.9563, test_f1: 0.6125
 epoch: 25, train_loss: 0.6417, test_loss: 0.9897, test_f1: 0.6199
 epoch: 26, train_loss: 0.6557, test_loss: 0.9568, test_f1: 0.6202
 epoch: 27, train_loss: 0.6218, test_loss: 1.0549, test_f1: 0.6471
 epoch: 28, train_loss: 0.6121, test_loss: 1.0051, test_f1: 0.6279
 epoch: 29, train_loss: 0.6094, test_loss: 1.0313, test_f1: 0.5879
 epoch: 30, train_loss: 0.6024, test_loss: 0.9477, test_f1: 0.6588
 epoch: 31, train_loss: 0.6450, test_loss: 1.1188, test_f1: 0.5833
 epoch: 32, train_loss: 0.6188, test_loss: 1.0240, test_f1: 0.6081
 epoch: 33, train_loss: 0.6022, test_loss: 1.1317, test_f1: 0.6058
 epoch: 34, train_loss: 0.5907, test_loss: 1.0410, test_f1: 0.6207
 epoch: 35, train_loss: 0.5614, test_loss: 0.9887, test_f1: 0.6318
 epoch: 36, train_loss: 0.5570, test_loss: 1.0516, test_f1: 0.6266
 epoch: 37, train_loss: 0.5572, test_loss: 1.1353, test_f1: 0.6207
 epoch: 38, train_loss: 0.5439, test_loss: 1.0711, test_f1: 0.5860
 epoch: 39, train_loss: 0.5520, test_loss: 1.1177, test_f1: 0.6047
 epoch: 40, train_loss: 0.5340, test_loss: 1.1342, test_f1: 0.6213
 epoch: 41, train_loss: 0.5276, test_loss: 0.9520, test_f1: 0.6454
 epoch: 42, train_loss: 0.5235, test_loss: 1.1239, test_f1: 0.6383
 epoch: 43, train_loss: 0.5171, test_loss: 1.0248, test_f1: 0.6365
 epoch: 44, train_loss: 0.5361, test_loss: 1.2242, test_f1: 0.6157
 epoch: 45, train_loss: 0.5101, test_loss: 1.0420, test_f1: 0.6398
 epoch: 46, train_loss: 0.5197, test_loss: 1.2161, test_f1: 0.6222
 epoch: 47, train_loss: 0.5098, test_loss: 1.0947, test_f1: 0.6587
 epoch: 48, train_loss: 0.4825, test_loss: 1.2784, test_f1: 0.6169
 epoch: 49, train_loss: 0.5052, test_loss: 1.1043, test_f1: 0.6353
 epoch: 50, train_loss: 0.5057, test_loss: 1.3399, test_f1: 0.5932
 epoch: 51, train_loss: 0.4522, test_loss: 1.1299, test_f1: 0.6527
 epoch: 52, train_loss: 0.4140, test_loss: 1.1675, test_f1: 0.6546
 epoch: 53, train_loss: 0.3783, test_loss: 1.2243, test_f1: 0.6445
 epoch: 54, train_loss: 0.3844, test_loss: 1.2772, test_f1: 0.6496
 epoch: 55, train_loss: 0.3768, test_loss: 1.3202, test_f1: 0.6318
 epoch: 56, train_loss: 0.3726, test_loss: 1.1989, test_f1: 0.6571
 epoch: 57, train_loss: 0.3586, test_loss: 1.3641, test_f1: 0.6191
 epoch: 58, train_loss: 0.3705, test_loss: 1.3147, test_f1: 0.6508
 epoch: 59, train_loss: 0.3471, test_loss: 1.2730, test_f1: 0.6397
 epoch: 60, train_loss: 0.3384, test_loss: 1.2924, test_f1: 0.6520
 epoch: 61, train_loss: 0.3283, test_loss: 1.2747, test_f1: 0.6637
 epoch: 62, train_loss: 0.3421, test_loss: 1.5133, test_f1: 0.6118
 epoch: 63, train_loss: 0.3166, test_loss: 1.2879, test_f1: 0.6395
 epoch: 64, train_loss: 0.3277, test_loss: 1.3200, test_f1: 0.6455
 epoch: 65, train_loss: 0.3268, test_loss: 1.5344, test_f1: 0.6290
 epoch: 66, train_loss: 0.3211, test_loss: 1.4147, test_f1: 0.6538
 epoch: 67, train_loss: 0.3001, test_loss: 1.4177, test_f1: 0.6472
 epoch: 68, train_loss: 0.2908, test_loss: 1.5396, test_f1: 0.6507
 epoch: 69, train_loss: 0.3153, test_loss: 1.5281, test_f1: 0.6321
 epoch: 70, train_loss: 0.3307, test_loss: 1.5516, test_f1: 0.6120
 epoch: 71, train_loss: 0.3064, test_loss: 1.3764, test_f1: 0.6491
 epoch: 72, train_loss: 0.3102, test_loss: 1.4452, test_f1: 0.6508
 epoch: 73, train_loss: 0.2814, test_loss: 1.6301, test_f1: 0.6325
 epoch: 74, train_loss: 0.2691, test_loss: 1.5147, test_f1: 0.6386
 epoch: 75, train_loss: 0.2924, test_loss: 1.3871, test_f1: 0.6782
 epoch: 76, train_loss: 0.3037, test_loss: 1.5556, test_f1: 0.6438
 epoch: 77, train_loss: 0.3032, test_loss: 1.6631, test_f1: 0.6192
 epoch: 78, train_loss: 0.2780, test_loss: 1.7101, test_f1: 0.6293
 epoch: 79, train_loss: 0.2727, test_loss: 1.5706, test_f1: 0.6545
 epoch: 80, train_loss: 0.2657, test_loss: 1.6576, test_f1: 0.6408
 epoch: 81, train_loss: 0.2731, test_loss: 1.6906, test_f1: 0.6514
 epoch: 82, train_loss: 0.2606, test_loss: 1.6084, test_f1: 0.6470
 epoch: 83, train_loss: 0.2620, test_loss: 1.5933, test_f1: 0.6495
 epoch: 84, train_loss: 0.2644, test_loss: 1.6718, test_f1: 0.6367
 epoch: 85, train_loss: 0.2430, test_loss: 1.7092, test_f1: 0.6197
 epoch: 86, train_loss: 0.2635, test_loss: 1.6937, test_f1: 0.6426
 epoch: 87, train_loss: 0.2546, test_loss: 1.6915, test_f1: 0.6480
 epoch: 88, train_loss: 0.2481, test_loss: 1.9117, test_f1: 0.6248
 epoch: 89, train_loss: 0.2347, test_loss: 2.0235, test_f1: 0.6274
 epoch: 90, train_loss: 0.2607, test_loss: 1.7925, test_f1: 0.6414
 epoch: 91, train_loss: 0.2479, test_loss: 1.8647, test_f1: 0.6625
 epoch: 92, train_loss: 0.2458, test_loss: 1.8687, test_f1: 0.6103
 epoch: 93, train_loss: 0.2515, test_loss: 1.7731, test_f1: 0.6482
 epoch: 94, train_loss: 0.2431, test_loss: 1.7900, test_f1: 0.6289
 epoch: 95, train_loss: 0.2473, test_loss: 1.9903, test_f1: 0.6137
 epoch: 96, train_loss: 0.2280, test_loss: 1.6191, test_f1: 0.6631
 epoch: 97, train_loss: 0.2028, test_loss: 2.0478, test_f1: 0.6438
 epoch: 98, train_loss: 0.2234, test_loss: 2.0148, test_f1: 0.6361
 epoch: 99, train_loss: 0.2347, test_loss: 1.9445, test_f1: 0.6233

Training completed in 569.65 seconds
Best F1: 0.7016 at epoch 59
Mean F1 across iterations: 0.6788  0.0099
========================FINAL RESULTS================================
FEGIN weighted F1: 0.7016  0.0099
python main.py --data ltspice_examples --representation component_net --model FEGIN --layers 6 --hiddens 128 --batch_size 128 --lr 0.001 --emb_size 128 --epochs 100 --save_appendix component_net_L6_H128_BS128_LR0.001_E128 --no_val
-----



STDERR:
  File "main.py", line 370, in <module>
    main()
  File "main.py", line 254, in main
    dataset = dataset_class(
  File "/home/philip/projects/ltspice_examples_code_repo/Circuit-Completion-Using-GNNs/component_classification_with_link_prediction_head/evaluation/FEGIN/kernel/circuit_datasets.py", line 15, in __init__
    self.data, self.slices = torch.load(self.processed_paths[0])
  File "/home/philip/.local/lib/python3.8/site-packages/torch/serialization.py", line 1040, in load
    warnings.warn(
  File "/usr/lib/python3.8/warnings.py", line 109, in _showwarnmsg
    sw(msg.message, msg.category, msg.filename, msg.lineno,
  File "main.py", line 47, in warn_with_traceback
    traceback.print_stack(file=log)
/home/philip/projects/ltspice_examples_code_repo/Circuit-Completion-Using-GNNs/component_classification_with_link_prediction_head/evaluation/FEGIN/kernel/circuit_datasets.py:15: FutureWarning: You are using `torch.load` with `weights_only=False` (the current default value), which uses the default pickle module implicitly. It is possible to construct malicious pickle data which will execute arbitrary code during unpickling (See https://github.com/pytorch/pytorch/blob/main/SECURITY.md#untrusted-models for more details). In a future release, the default value for `weights_only` will be flipped to `True`. This limits the functions that could be executed during unpickling. Arbitrary objects will no longer be allowed to be loaded via this mode unless they are explicitly allowlisted by the user via `torch.serialization.add_safe_globals`. We recommend you start setting `weights_only=True` for any use case where you don't have full control of the loaded file. Please open an issue on GitHub for any issues related to this experimental feature.
  self.data, self.slices = torch.load(self.processed_paths[0])
