STDOUT:
Results will be saved in /home/philip/projects/ltspice_examples_code_repo/Circuit-Completion-Using-GNNs/component_classification_with_link_prediction_head/evaluation/FEGIN/results/model_FEGIN_dataset_ltspice_examples
Command line input: python main.py --data ltspice_examples --representation component_component --model FEGIN --layers 4 --hiddens 16 --batch_size 32 --lr 0.01 --emb_size 512 --epochs 100 --save_appendix component_component_L4_H16_BS32_LR0.01_E512 --no_val
 is saved.
-----
ltspice_examples - FEGIN
Using 4 layers, 16 hidden units, h = 2
Loading component_component representation dataset
ENTERED
Training FEGIN on component_component representation
Train: 3556, Test: 845
##################ITERATION #0 ****************************************
 epoch: 0, train_loss: 1.2858, test_loss: 1.2850, test_f1: 0.2325
 epoch: 1, train_loss: 1.2512, test_loss: 1.2271, test_f1: 0.2325
 epoch: 2, train_loss: 1.2105, test_loss: 1.1780, test_f1: 0.3506
 epoch: 3, train_loss: 1.1391, test_loss: 1.0182, test_f1: 0.4541
 epoch: 4, train_loss: 1.0895, test_loss: 1.1150, test_f1: 0.4488
 epoch: 5, train_loss: 1.0536, test_loss: 1.0278, test_f1: 0.4662
 epoch: 6, train_loss: 1.0384, test_loss: 1.0003, test_f1: 0.4564
 epoch: 7, train_loss: 1.0429, test_loss: 0.9794, test_f1: 0.4595
 epoch: 8, train_loss: 1.0241, test_loss: 1.0693, test_f1: 0.4506
 epoch: 9, train_loss: 1.0277, test_loss: 1.0246, test_f1: 0.4465
 epoch: 10, train_loss: 1.0231, test_loss: 1.0149, test_f1: 0.4426
 epoch: 11, train_loss: 0.9998, test_loss: 1.0117, test_f1: 0.4731
 epoch: 12, train_loss: 0.9886, test_loss: 1.0418, test_f1: 0.4712
 epoch: 13, train_loss: 0.9964, test_loss: 1.0172, test_f1: 0.4518
 epoch: 14, train_loss: 1.0083, test_loss: 1.0086, test_f1: 0.4836
 epoch: 15, train_loss: 0.9940, test_loss: 1.0206, test_f1: 0.4691
 epoch: 16, train_loss: 0.9748, test_loss: 0.9949, test_f1: 0.4634
 epoch: 17, train_loss: 0.9775, test_loss: 1.0476, test_f1: 0.4584
 epoch: 18, train_loss: 0.9779, test_loss: 1.0165, test_f1: 0.4735
 epoch: 19, train_loss: 0.9777, test_loss: 1.0073, test_f1: 0.4471
 epoch: 20, train_loss: 0.9790, test_loss: 1.0301, test_f1: 0.4552
 epoch: 21, train_loss: 0.9790, test_loss: 1.0275, test_f1: 0.4622
 epoch: 22, train_loss: 0.9716, test_loss: 1.0125, test_f1: 0.4626
 epoch: 23, train_loss: 0.9670, test_loss: 0.9937, test_f1: 0.4929
 epoch: 24, train_loss: 0.9570, test_loss: 1.0308, test_f1: 0.4768
 epoch: 25, train_loss: 0.9597, test_loss: 1.0905, test_f1: 0.4421
 epoch: 26, train_loss: 0.9744, test_loss: 1.0431, test_f1: 0.4527
 epoch: 27, train_loss: 0.9532, test_loss: 1.0380, test_f1: 0.4634
 epoch: 28, train_loss: 0.9534, test_loss: 1.0651, test_f1: 0.4667
 epoch: 29, train_loss: 0.9399, test_loss: 1.0163, test_f1: 0.5109
 epoch: 30, train_loss: 0.9541, test_loss: 0.9819, test_f1: 0.4755
 epoch: 31, train_loss: 0.9539, test_loss: 1.0005, test_f1: 0.4803
 epoch: 32, train_loss: 0.9510, test_loss: 1.0444, test_f1: 0.5006
 epoch: 33, train_loss: 0.9485, test_loss: 1.0585, test_f1: 0.4458
 epoch: 34, train_loss: 0.9593, test_loss: 1.0182, test_f1: 0.4676
 epoch: 35, train_loss: 0.9564, test_loss: 0.9973, test_f1: 0.4960
 epoch: 36, train_loss: 0.9424, test_loss: 1.0023, test_f1: 0.5154
 epoch: 37, train_loss: 0.9510, test_loss: 1.0079, test_f1: 0.4591
 epoch: 38, train_loss: 0.9310, test_loss: 0.9831, test_f1: 0.4605
 epoch: 39, train_loss: 0.9728, test_loss: 1.0799, test_f1: 0.4757
 epoch: 40, train_loss: 0.9423, test_loss: 1.1150, test_f1: 0.4557
 epoch: 41, train_loss: 0.9467, test_loss: 1.0601, test_f1: 0.4731
 epoch: 42, train_loss: 0.9454, test_loss: 1.0526, test_f1: 0.4887
 epoch: 43, train_loss: 0.9411, test_loss: 1.1199, test_f1: 0.4906
 epoch: 44, train_loss: 0.9312, test_loss: 1.1355, test_f1: 0.4555
 epoch: 45, train_loss: 0.9307, test_loss: 1.0418, test_f1: 0.4734
 epoch: 46, train_loss: 0.9421, test_loss: 1.0945, test_f1: 0.4669
 epoch: 47, train_loss: 0.9394, test_loss: 1.0751, test_f1: 0.4665
 epoch: 48, train_loss: 0.9495, test_loss: 1.0570, test_f1: 0.4803
 epoch: 49, train_loss: 0.9400, test_loss: 1.0414, test_f1: 0.4893
 epoch: 50, train_loss: 0.9311, test_loss: 1.0636, test_f1: 0.5127
 epoch: 51, train_loss: 0.9319, test_loss: 1.0709, test_f1: 0.4931
 epoch: 52, train_loss: 0.9172, test_loss: 1.0992, test_f1: 0.4620
 epoch: 53, train_loss: 0.9165, test_loss: 1.0704, test_f1: 0.4859
 epoch: 54, train_loss: 0.9233, test_loss: 1.0276, test_f1: 0.4727
 epoch: 55, train_loss: 0.9080, test_loss: 1.0796, test_f1: 0.5067
 epoch: 56, train_loss: 0.9137, test_loss: 1.0763, test_f1: 0.5075
 epoch: 57, train_loss: 0.8982, test_loss: 1.0658, test_f1: 0.4966
 epoch: 58, train_loss: 0.9061, test_loss: 1.1056, test_f1: 0.5017
 epoch: 59, train_loss: 0.8928, test_loss: 1.0726, test_f1: 0.4962
 epoch: 60, train_loss: 0.9020, test_loss: 1.0581, test_f1: 0.5069
 epoch: 61, train_loss: 0.9031, test_loss: 0.9962, test_f1: 0.5050
 epoch: 62, train_loss: 0.8915, test_loss: 1.0285, test_f1: 0.5097
 epoch: 63, train_loss: 0.9076, test_loss: 1.0866, test_f1: 0.5183
 epoch: 64, train_loss: 0.8926, test_loss: 1.0724, test_f1: 0.4969
 epoch: 65, train_loss: 0.9119, test_loss: 1.0148, test_f1: 0.4986
 epoch: 66, train_loss: 0.9036, test_loss: 1.0253, test_f1: 0.5315
 epoch: 67, train_loss: 0.9052, test_loss: 1.0677, test_f1: 0.5289
 epoch: 68, train_loss: 0.8940, test_loss: 1.0582, test_f1: 0.5056
 epoch: 69, train_loss: 0.8918, test_loss: 1.0834, test_f1: 0.5102
 epoch: 70, train_loss: 0.8984, test_loss: 1.1025, test_f1: 0.5518
 epoch: 71, train_loss: 0.8915, test_loss: 1.1180, test_f1: 0.4895
 epoch: 72, train_loss: 0.8780, test_loss: 1.0935, test_f1: 0.5163
 epoch: 73, train_loss: 0.8983, test_loss: 1.0615, test_f1: 0.5108
 epoch: 74, train_loss: 0.8971, test_loss: 1.0632, test_f1: 0.5366
 epoch: 75, train_loss: 0.9007, test_loss: 1.0445, test_f1: 0.5299
 epoch: 76, train_loss: 0.8831, test_loss: 1.0034, test_f1: 0.5620
 epoch: 77, train_loss: 0.8788, test_loss: 1.0459, test_f1: 0.5191
 epoch: 78, train_loss: 0.8894, test_loss: 1.0717, test_f1: 0.5344
 epoch: 79, train_loss: 0.8896, test_loss: 1.0123, test_f1: 0.5503
 epoch: 80, train_loss: 0.8796, test_loss: 1.0602, test_f1: 0.5417
 epoch: 81, train_loss: 0.8868, test_loss: 1.0440, test_f1: 0.5644
 epoch: 82, train_loss: 0.8827, test_loss: 1.0587, test_f1: 0.5433
 epoch: 83, train_loss: 0.8802, test_loss: 1.0921, test_f1: 0.4920
 epoch: 84, train_loss: 0.8824, test_loss: 1.1148, test_f1: 0.5445
 epoch: 85, train_loss: 0.8762, test_loss: 1.0361, test_f1: 0.5257
 epoch: 86, train_loss: 0.8761, test_loss: 1.0805, test_f1: 0.5480
 epoch: 87, train_loss: 0.8745, test_loss: 1.0833, test_f1: 0.5247
 epoch: 88, train_loss: 0.8878, test_loss: 1.0637, test_f1: 0.5355
 epoch: 89, train_loss: 0.8839, test_loss: 1.0298, test_f1: 0.5506
 epoch: 90, train_loss: 0.8839, test_loss: 1.0962, test_f1: 0.5499
 epoch: 91, train_loss: 0.8733, test_loss: 1.1302, test_f1: 0.5374
 epoch: 92, train_loss: 0.8801, test_loss: 1.0438, test_f1: 0.5288
 epoch: 93, train_loss: 0.8759, test_loss: 1.0121, test_f1: 0.5765
 epoch: 94, train_loss: 0.8791, test_loss: 1.0417, test_f1: 0.5455
 epoch: 95, train_loss: 0.8740, test_loss: 1.0293, test_f1: 0.5455
 epoch: 96, train_loss: 0.8679, test_loss: 1.0967, test_f1: 0.5639
 epoch: 97, train_loss: 0.8727, test_loss: 1.0518, test_f1: 0.5802
 epoch: 98, train_loss: 0.8607, test_loss: 1.0544, test_f1: 0.5692
 epoch: 99, train_loss: 0.8741, test_loss: 1.0605, test_f1: 0.5485
##################ITERATION #1 ****************************************
 epoch: 0, train_loss: 1.2642, test_loss: 1.2329, test_f1: 0.3507
 epoch: 1, train_loss: 1.1999, test_loss: 1.0884, test_f1: 0.4445
 epoch: 2, train_loss: 1.1411, test_loss: 1.0709, test_f1: 0.4634
 epoch: 3, train_loss: 1.1040, test_loss: 1.0222, test_f1: 0.4618
 epoch: 4, train_loss: 1.0909, test_loss: 1.0220, test_f1: 0.4628
 epoch: 5, train_loss: 1.0542, test_loss: 0.9705, test_f1: 0.5042
 epoch: 6, train_loss: 1.0398, test_loss: 1.0179, test_f1: 0.4794
 epoch: 7, train_loss: 1.0154, test_loss: 1.0428, test_f1: 0.4359
 epoch: 8, train_loss: 1.0194, test_loss: 1.0748, test_f1: 0.4590
 epoch: 9, train_loss: 1.0188, test_loss: 0.9903, test_f1: 0.4787
 epoch: 10, train_loss: 1.0036, test_loss: 0.9990, test_f1: 0.5010
 epoch: 11, train_loss: 0.9940, test_loss: 0.9791, test_f1: 0.5005
 epoch: 12, train_loss: 0.9896, test_loss: 1.0693, test_f1: 0.4693
 epoch: 13, train_loss: 1.0023, test_loss: 0.9590, test_f1: 0.4872
 epoch: 14, train_loss: 0.9787, test_loss: 1.1521, test_f1: 0.4598
 epoch: 15, train_loss: 1.0978, test_loss: 0.9381, test_f1: 0.4950
 epoch: 16, train_loss: 1.0226, test_loss: 0.9550, test_f1: 0.4790
 epoch: 17, train_loss: 1.0020, test_loss: 1.0046, test_f1: 0.4724
 epoch: 18, train_loss: 0.9802, test_loss: 1.0269, test_f1: 0.4781
 epoch: 19, train_loss: 0.9695, test_loss: 1.0375, test_f1: 0.4598
 epoch: 20, train_loss: 0.9932, test_loss: 1.0441, test_f1: 0.4580
 epoch: 21, train_loss: 0.9704, test_loss: 1.0191, test_f1: 0.5045
 epoch: 22, train_loss: 0.9705, test_loss: 1.0334, test_f1: 0.4689
 epoch: 23, train_loss: 0.9558, test_loss: 1.0315, test_f1: 0.5046
 epoch: 24, train_loss: 0.9540, test_loss: 1.0311, test_f1: 0.4658
 epoch: 25, train_loss: 0.9585, test_loss: 1.0141, test_f1: 0.4920
 epoch: 26, train_loss: 0.9366, test_loss: 1.0824, test_f1: 0.4673
 epoch: 27, train_loss: 0.9769, test_loss: 1.0304, test_f1: 0.4785
 epoch: 28, train_loss: 0.9404, test_loss: 1.0164, test_f1: 0.4941
 epoch: 29, train_loss: 0.9488, test_loss: 1.0154, test_f1: 0.4760
 epoch: 30, train_loss: 0.9449, test_loss: 0.9993, test_f1: 0.5003
 epoch: 31, train_loss: 0.9558, test_loss: 1.0342, test_f1: 0.4829
 epoch: 32, train_loss: 0.9643, test_loss: 1.0186, test_f1: 0.4867
 epoch: 33, train_loss: 0.9684, test_loss: 1.0255, test_f1: 0.4879
 epoch: 34, train_loss: 0.9404, test_loss: 0.9966, test_f1: 0.5142
 epoch: 35, train_loss: 0.9544, test_loss: 1.0187, test_f1: 0.4731
 epoch: 36, train_loss: 0.9334, test_loss: 1.0681, test_f1: 0.4944
 epoch: 37, train_loss: 0.9279, test_loss: 1.0520, test_f1: 0.4816
 epoch: 38, train_loss: 0.9480, test_loss: 0.9976, test_f1: 0.5107
 epoch: 39, train_loss: 0.9354, test_loss: 1.0072, test_f1: 0.5187
 epoch: 40, train_loss: 0.9359, test_loss: 1.0206, test_f1: 0.5036
 epoch: 41, train_loss: 0.9174, test_loss: 1.0115, test_f1: 0.5076
 epoch: 42, train_loss: 0.9402, test_loss: 0.9473, test_f1: 0.5152
 epoch: 43, train_loss: 0.9326, test_loss: 1.0155, test_f1: 0.5014
 epoch: 44, train_loss: 0.9261, test_loss: 1.0347, test_f1: 0.5229
 epoch: 45, train_loss: 0.9264, test_loss: 1.0602, test_f1: 0.4971
 epoch: 46, train_loss: 0.9277, test_loss: 1.1856, test_f1: 0.4645
 epoch: 47, train_loss: 0.9209, test_loss: 1.0814, test_f1: 0.4956
 epoch: 48, train_loss: 0.9175, test_loss: 1.0624, test_f1: 0.5129
 epoch: 49, train_loss: 0.9117, test_loss: 1.0250, test_f1: 0.5028
 epoch: 50, train_loss: 0.9170, test_loss: 1.0352, test_f1: 0.5050
 epoch: 51, train_loss: 0.9047, test_loss: 1.0162, test_f1: 0.5119
 epoch: 52, train_loss: 0.9007, test_loss: 1.0142, test_f1: 0.5211
 epoch: 53, train_loss: 0.8919, test_loss: 1.0288, test_f1: 0.5201
 epoch: 54, train_loss: 0.9041, test_loss: 1.0118, test_f1: 0.5309
 epoch: 55, train_loss: 0.8878, test_loss: 1.0263, test_f1: 0.5131
 epoch: 56, train_loss: 0.8949, test_loss: 1.0515, test_f1: 0.5077
 epoch: 57, train_loss: 0.8801, test_loss: 1.0533, test_f1: 0.4923
 epoch: 58, train_loss: 0.8895, test_loss: 1.0107, test_f1: 0.5140
 epoch: 59, train_loss: 0.8925, test_loss: 1.0154, test_f1: 0.4960
 epoch: 60, train_loss: 0.8865, test_loss: 1.0373, test_f1: 0.5154
 epoch: 61, train_loss: 0.8939, test_loss: 1.0251, test_f1: 0.5027
 epoch: 62, train_loss: 0.8916, test_loss: 0.9877, test_f1: 0.5251
 epoch: 63, train_loss: 0.8878, test_loss: 1.0365, test_f1: 0.5090
 epoch: 64, train_loss: 0.8816, test_loss: 1.0188, test_f1: 0.4921
 epoch: 65, train_loss: 0.8900, test_loss: 0.9717, test_f1: 0.5216
 epoch: 66, train_loss: 0.8722, test_loss: 1.0057, test_f1: 0.5260
 epoch: 67, train_loss: 0.8856, test_loss: 1.0721, test_f1: 0.4769
 epoch: 68, train_loss: 0.8890, test_loss: 1.0122, test_f1: 0.5013
 epoch: 69, train_loss: 0.8835, test_loss: 1.0299, test_f1: 0.4916
 epoch: 70, train_loss: 0.8923, test_loss: 1.1109, test_f1: 0.4841
 epoch: 71, train_loss: 0.8725, test_loss: 0.9880, test_f1: 0.4979
 epoch: 72, train_loss: 0.8873, test_loss: 1.0165, test_f1: 0.5024
 epoch: 73, train_loss: 0.8837, test_loss: 1.0864, test_f1: 0.4891
 epoch: 74, train_loss: 0.8798, test_loss: 1.1860, test_f1: 0.4821
 epoch: 75, train_loss: 0.8848, test_loss: 1.0476, test_f1: 0.4942
 epoch: 76, train_loss: 0.8960, test_loss: 1.0332, test_f1: 0.4999
 epoch: 77, train_loss: 0.8723, test_loss: 1.0931, test_f1: 0.4748
 epoch: 78, train_loss: 0.8682, test_loss: 1.0163, test_f1: 0.4769
 epoch: 79, train_loss: 0.8817, test_loss: 1.0071, test_f1: 0.5228
 epoch: 80, train_loss: 0.8600, test_loss: 1.1038, test_f1: 0.5206
 epoch: 81, train_loss: 0.8663, test_loss: 1.0500, test_f1: 0.4877
 epoch: 82, train_loss: 0.8628, test_loss: 1.0269, test_f1: 0.5068
 epoch: 83, train_loss: 0.8698, test_loss: 1.1292, test_f1: 0.4867
 epoch: 84, train_loss: 0.8733, test_loss: 1.0074, test_f1: 0.5102
 epoch: 85, train_loss: 0.8642, test_loss: 1.1148, test_f1: 0.4828
 epoch: 86, train_loss: 0.8661, test_loss: 1.1060, test_f1: 0.4887
 epoch: 87, train_loss: 0.8763, test_loss: 1.0363, test_f1: 0.4863
 epoch: 88, train_loss: 0.8699, test_loss: 1.0388, test_f1: 0.4967
 epoch: 89, train_loss: 0.8798, test_loss: 1.0647, test_f1: 0.4966
 epoch: 90, train_loss: 0.8709, test_loss: 0.9905, test_f1: 0.5247
 epoch: 91, train_loss: 0.8709, test_loss: 1.0163, test_f1: 0.5556
 epoch: 92, train_loss: 0.8775, test_loss: 1.0064, test_f1: 0.4973
 epoch: 93, train_loss: 0.8700, test_loss: 1.0073, test_f1: 0.5177
 epoch: 94, train_loss: 0.8594, test_loss: 1.0032, test_f1: 0.5054
 epoch: 95, train_loss: 0.8536, test_loss: 1.0097, test_f1: 0.5166
 epoch: 96, train_loss: 0.8593, test_loss: 1.0391, test_f1: 0.4927
 epoch: 97, train_loss: 0.8631, test_loss: 1.0532, test_f1: 0.4974
 epoch: 98, train_loss: 0.8649, test_loss: 0.9999, test_f1: 0.5251
 epoch: 99, train_loss: 0.8654, test_loss: 1.0148, test_f1: 0.5152
##################ITERATION #2 ****************************************
 epoch: 0, train_loss: 1.2525, test_loss: 1.1423, test_f1: 0.4249
 epoch: 1, train_loss: 1.1621, test_loss: 1.0616, test_f1: 0.4738
 epoch: 2, train_loss: 1.0930, test_loss: 1.0857, test_f1: 0.4427
 epoch: 3, train_loss: 1.0679, test_loss: 1.3441, test_f1: 0.3753
 epoch: 4, train_loss: 1.0726, test_loss: 0.9877, test_f1: 0.4488
 epoch: 5, train_loss: 1.0343, test_loss: 1.0743, test_f1: 0.4435
 epoch: 6, train_loss: 1.0323, test_loss: 0.9477, test_f1: 0.4756
 epoch: 7, train_loss: 1.0143, test_loss: 0.9849, test_f1: 0.4863
 epoch: 8, train_loss: 0.9907, test_loss: 0.9245, test_f1: 0.4627
 epoch: 9, train_loss: 0.9983, test_loss: 1.0146, test_f1: 0.4669
 epoch: 10, train_loss: 0.9994, test_loss: 1.0028, test_f1: 0.4870
 epoch: 11, train_loss: 0.9743, test_loss: 1.0156, test_f1: 0.4568
 epoch: 12, train_loss: 0.9764, test_loss: 0.9462, test_f1: 0.4983
 epoch: 13, train_loss: 0.9629, test_loss: 0.9949, test_f1: 0.4943
 epoch: 14, train_loss: 0.9588, test_loss: 1.0816, test_f1: 0.4573
 epoch: 15, train_loss: 0.9639, test_loss: 0.9896, test_f1: 0.4663
 epoch: 16, train_loss: 0.9648, test_loss: 1.0354, test_f1: 0.4851
 epoch: 17, train_loss: 0.9759, test_loss: 1.0347, test_f1: 0.4680
 epoch: 18, train_loss: 0.9515, test_loss: 1.0139, test_f1: 0.4843
 epoch: 19, train_loss: 0.9616, test_loss: 0.9934, test_f1: 0.4873
 epoch: 20, train_loss: 0.9485, test_loss: 1.0297, test_f1: 0.4702
 epoch: 21, train_loss: 0.9993, test_loss: 1.0287, test_f1: 0.4695
 epoch: 22, train_loss: 0.9740, test_loss: 1.0709, test_f1: 0.4781
 epoch: 23, train_loss: 0.9636, test_loss: 0.9876, test_f1: 0.4824
 epoch: 24, train_loss: 0.9465, test_loss: 1.0497, test_f1: 0.4851
 epoch: 25, train_loss: 0.9624, test_loss: 1.0071, test_f1: 0.4825
 epoch: 26, train_loss: 0.9423, test_loss: 1.0583, test_f1: 0.4570
 epoch: 27, train_loss: 0.9577, test_loss: 1.0115, test_f1: 0.4862
 epoch: 28, train_loss: 0.9437, test_loss: 1.0785, test_f1: 0.4933
 epoch: 29, train_loss: 0.9525, test_loss: 0.9669, test_f1: 0.5198
 epoch: 30, train_loss: 0.9352, test_loss: 1.0808, test_f1: 0.4939
 epoch: 31, train_loss: 0.9495, test_loss: 0.9912, test_f1: 0.4810
 epoch: 32, train_loss: 0.9314, test_loss: 1.1680, test_f1: 0.4812
 epoch: 33, train_loss: 0.9242, test_loss: 1.0934, test_f1: 0.5065
 epoch: 34, train_loss: 0.9310, test_loss: 1.0006, test_f1: 0.5107
 epoch: 35, train_loss: 0.9336, test_loss: 1.0180, test_f1: 0.4904
 epoch: 36, train_loss: 0.9421, test_loss: 1.0113, test_f1: 0.5020
 epoch: 37, train_loss: 0.9225, test_loss: 1.0586, test_f1: 0.4860
 epoch: 38, train_loss: 0.9164, test_loss: 1.1703, test_f1: 0.4734
 epoch: 39, train_loss: 0.9173, test_loss: 1.0684, test_f1: 0.4757
 epoch: 40, train_loss: 0.9149, test_loss: 1.0048, test_f1: 0.5018
 epoch: 41, train_loss: 0.9226, test_loss: 0.9576, test_f1: 0.5063
 epoch: 42, train_loss: 0.9177, test_loss: 0.9648, test_f1: 0.5110
 epoch: 43, train_loss: 0.9094, test_loss: 1.0766, test_f1: 0.4820
 epoch: 44, train_loss: 0.9082, test_loss: 1.1148, test_f1: 0.4879
 epoch: 45, train_loss: 0.9086, test_loss: 1.1160, test_f1: 0.5002
 epoch: 46, train_loss: 0.9140, test_loss: 1.0117, test_f1: 0.5127
 epoch: 47, train_loss: 0.9084, test_loss: 0.9508, test_f1: 0.5261
 epoch: 48, train_loss: 0.9193, test_loss: 0.9936, test_f1: 0.4886
 epoch: 49, train_loss: 0.8997, test_loss: 1.1030, test_f1: 0.4929
 epoch: 50, train_loss: 0.9007, test_loss: 1.0015, test_f1: 0.5038
 epoch: 51, train_loss: 0.8904, test_loss: 0.9764, test_f1: 0.5084
 epoch: 52, train_loss: 0.8879, test_loss: 0.9641, test_f1: 0.5082
 epoch: 53, train_loss: 0.8798, test_loss: 0.9686, test_f1: 0.5084
 epoch: 54, train_loss: 0.8800, test_loss: 0.9703, test_f1: 0.5137
 epoch: 55, train_loss: 0.8735, test_loss: 0.9636, test_f1: 0.5056
 epoch: 56, train_loss: 0.8727, test_loss: 0.9634, test_f1: 0.5174
 epoch: 57, train_loss: 0.8721, test_loss: 0.9533, test_f1: 0.5185
 epoch: 58, train_loss: 0.8582, test_loss: 0.9799, test_f1: 0.5017
 epoch: 59, train_loss: 0.8749, test_loss: 0.9432, test_f1: 0.5160
 epoch: 60, train_loss: 0.8763, test_loss: 0.9772, test_f1: 0.5002
 epoch: 61, train_loss: 0.8816, test_loss: 0.9718, test_f1: 0.5177
 epoch: 62, train_loss: 0.8656, test_loss: 0.9549, test_f1: 0.5038
 epoch: 63, train_loss: 0.8720, test_loss: 0.9338, test_f1: 0.5083
 epoch: 64, train_loss: 0.8601, test_loss: 0.9358, test_f1: 0.5070
 epoch: 65, train_loss: 0.8578, test_loss: 0.9822, test_f1: 0.5060
 epoch: 66, train_loss: 0.8665, test_loss: 0.9403, test_f1: 0.5143
 epoch: 67, train_loss: 0.8651, test_loss: 0.9739, test_f1: 0.5102
 epoch: 68, train_loss: 0.8628, test_loss: 0.9224, test_f1: 0.5212
 epoch: 69, train_loss: 0.8569, test_loss: 0.9950, test_f1: 0.4844
 epoch: 70, train_loss: 0.8603, test_loss: 0.9617, test_f1: 0.5276
 epoch: 71, train_loss: 0.8554, test_loss: 0.9739, test_f1: 0.5015
 epoch: 72, train_loss: 0.8799, test_loss: 1.0437, test_f1: 0.4862
 epoch: 73, train_loss: 0.8599, test_loss: 0.9978, test_f1: 0.5147
 epoch: 74, train_loss: 0.8546, test_loss: 0.9979, test_f1: 0.5093
 epoch: 75, train_loss: 0.8482, test_loss: 1.0408, test_f1: 0.4941
 epoch: 76, train_loss: 0.8541, test_loss: 1.0278, test_f1: 0.5131
 epoch: 77, train_loss: 0.8614, test_loss: 0.9599, test_f1: 0.5241
 epoch: 78, train_loss: 0.8515, test_loss: 0.9937, test_f1: 0.4898
 epoch: 79, train_loss: 0.8622, test_loss: 0.9662, test_f1: 0.5093
 epoch: 80, train_loss: 0.8478, test_loss: 1.0242, test_f1: 0.4988
 epoch: 81, train_loss: 0.8511, test_loss: 1.1503, test_f1: 0.4935
 epoch: 82, train_loss: 0.8525, test_loss: 1.1204, test_f1: 0.5047
 epoch: 83, train_loss: 0.8505, test_loss: 1.0131, test_f1: 0.5049
 epoch: 84, train_loss: 0.8543, test_loss: 0.9919, test_f1: 0.5037
 epoch: 85, train_loss: 0.8438, test_loss: 0.9888, test_f1: 0.4929
 epoch: 86, train_loss: 0.8454, test_loss: 0.9760, test_f1: 0.5239
 epoch: 87, train_loss: 0.8377, test_loss: 1.0103, test_f1: 0.5060
 epoch: 88, train_loss: 0.8413, test_loss: 0.9853, test_f1: 0.5194
 epoch: 89, train_loss: 0.8464, test_loss: 0.9528, test_f1: 0.5186
 epoch: 90, train_loss: 0.8312, test_loss: 0.9765, test_f1: 0.5079
 epoch: 91, train_loss: 0.8410, test_loss: 0.9904, test_f1: 0.5168
 epoch: 92, train_loss: 0.8400, test_loss: 1.0013, test_f1: 0.5197
 epoch: 93, train_loss: 0.8449, test_loss: 0.9940, test_f1: 0.5078
 epoch: 94, train_loss: 0.8347, test_loss: 0.9970, test_f1: 0.5084
 epoch: 95, train_loss: 0.8383, test_loss: 0.9949, test_f1: 0.5254
 epoch: 96, train_loss: 0.8457, test_loss: 0.9693, test_f1: 0.4969
 epoch: 97, train_loss: 0.8345, test_loss: 1.0321, test_f1: 0.4959
 epoch: 98, train_loss: 0.8294, test_loss: 0.9967, test_f1: 0.5163
 epoch: 99, train_loss: 0.8643, test_loss: 0.9655, test_f1: 0.5153
##################ITERATION #3 ****************************************
 epoch: 0, train_loss: 1.2518, test_loss: 1.1726, test_f1: 0.3259
 epoch: 1, train_loss: 1.1775, test_loss: 1.1215, test_f1: 0.4094
 epoch: 2, train_loss: 1.1103, test_loss: 1.0360, test_f1: 0.4340
 epoch: 3, train_loss: 1.0881, test_loss: 0.9841, test_f1: 0.4731
 epoch: 4, train_loss: 1.0797, test_loss: 0.9948, test_f1: 0.4324
 epoch: 5, train_loss: 1.0677, test_loss: 0.9746, test_f1: 0.4648
 epoch: 6, train_loss: 1.0642, test_loss: 0.9817, test_f1: 0.4681
 epoch: 7, train_loss: 1.0366, test_loss: 1.4336, test_f1: 0.3771
 epoch: 8, train_loss: 1.0421, test_loss: 0.9623, test_f1: 0.4620
 epoch: 9, train_loss: 1.0112, test_loss: 0.9625, test_f1: 0.4819
 epoch: 10, train_loss: 0.9883, test_loss: 0.9869, test_f1: 0.4662
 epoch: 11, train_loss: 1.0042, test_loss: 0.9870, test_f1: 0.4840
 epoch: 12, train_loss: 0.9961, test_loss: 0.9872, test_f1: 0.4666
 epoch: 13, train_loss: 0.9860, test_loss: 0.9657, test_f1: 0.4827
 epoch: 14, train_loss: 0.9832, test_loss: 0.9603, test_f1: 0.4911
 epoch: 15, train_loss: 0.9689, test_loss: 0.9816, test_f1: 0.5022
 epoch: 16, train_loss: 0.9757, test_loss: 1.0032, test_f1: 0.4768
 epoch: 17, train_loss: 0.9623, test_loss: 1.0229, test_f1: 0.4513
 epoch: 18, train_loss: 0.9632, test_loss: 0.9770, test_f1: 0.4772
 epoch: 19, train_loss: 0.9533, test_loss: 0.9662, test_f1: 0.4929
 epoch: 20, train_loss: 0.9418, test_loss: 0.9435, test_f1: 0.4826
 epoch: 21, train_loss: 0.9526, test_loss: 0.9807, test_f1: 0.5062
 epoch: 22, train_loss: 0.9682, test_loss: 0.9684, test_f1: 0.5107
 epoch: 23, train_loss: 0.9472, test_loss: 0.9593, test_f1: 0.4976
 epoch: 24, train_loss: 0.9453, test_loss: 1.0033, test_f1: 0.4890
 epoch: 25, train_loss: 0.9435, test_loss: 0.9527, test_f1: 0.5150
 epoch: 26, train_loss: 0.9457, test_loss: 0.9522, test_f1: 0.4977
 epoch: 27, train_loss: 0.9468, test_loss: 0.9467, test_f1: 0.5060
 epoch: 28, train_loss: 0.9390, test_loss: 0.9526, test_f1: 0.4998
 epoch: 29, train_loss: 0.9512, test_loss: 0.9562, test_f1: 0.5030
 epoch: 30, train_loss: 0.9345, test_loss: 0.9593, test_f1: 0.4990
 epoch: 31, train_loss: 0.9375, test_loss: 0.9483, test_f1: 0.4957
 epoch: 32, train_loss: 0.9423, test_loss: 0.9580, test_f1: 0.4986
 epoch: 33, train_loss: 0.9392, test_loss: 1.2056, test_f1: 0.5001
 epoch: 34, train_loss: 0.9299, test_loss: 0.9703, test_f1: 0.4994
 epoch: 35, train_loss: 0.9363, test_loss: 1.1078, test_f1: 0.4782
 epoch: 36, train_loss: 0.9388, test_loss: 0.9405, test_f1: 0.4962
 epoch: 37, train_loss: 0.9283, test_loss: 0.9424, test_f1: 0.5140
 epoch: 38, train_loss: 0.9151, test_loss: 0.9516, test_f1: 0.5137
 epoch: 39, train_loss: 0.9359, test_loss: 0.9327, test_f1: 0.5242
 epoch: 40, train_loss: 0.9184, test_loss: 1.0118, test_f1: 0.5128
 epoch: 41, train_loss: 0.9339, test_loss: 0.9789, test_f1: 0.5084
 epoch: 42, train_loss: 0.9247, test_loss: 0.9985, test_f1: 0.5005
 epoch: 43, train_loss: 0.9170, test_loss: 0.9672, test_f1: 0.5008
 epoch: 44, train_loss: 0.9239, test_loss: 0.9971, test_f1: 0.4958
 epoch: 45, train_loss: 0.9191, test_loss: 0.9983, test_f1: 0.4869
 epoch: 46, train_loss: 0.9169, test_loss: 1.0045, test_f1: 0.5190
 epoch: 47, train_loss: 0.9085, test_loss: 0.9518, test_f1: 0.4964
 epoch: 48, train_loss: 0.9258, test_loss: 0.9641, test_f1: 0.4858
 epoch: 49, train_loss: 0.9450, test_loss: 0.9464, test_f1: 0.4935
 epoch: 50, train_loss: 0.9170, test_loss: 0.9449, test_f1: 0.5072
 epoch: 51, train_loss: 0.9026, test_loss: 0.9540, test_f1: 0.5096
 epoch: 52, train_loss: 0.8862, test_loss: 0.9470, test_f1: 0.5214
 epoch: 53, train_loss: 0.8877, test_loss: 0.9411, test_f1: 0.5264
 epoch: 54, train_loss: 0.8959, test_loss: 0.9405, test_f1: 0.5124
 epoch: 55, train_loss: 0.8999, test_loss: 0.9360, test_f1: 0.5161
 epoch: 56, train_loss: 0.8953, test_loss: 0.9133, test_f1: 0.5115
 epoch: 57, train_loss: 0.8955, test_loss: 0.9312, test_f1: 0.5122
 epoch: 58, train_loss: 0.8822, test_loss: 0.9128, test_f1: 0.5118
 epoch: 59, train_loss: 0.8746, test_loss: 0.9614, test_f1: 0.5246
 epoch: 60, train_loss: 0.8897, test_loss: 0.9501, test_f1: 0.5196
 epoch: 61, train_loss: 0.8660, test_loss: 0.9498, test_f1: 0.5095
 epoch: 62, train_loss: 0.8895, test_loss: 0.9381, test_f1: 0.5138
 epoch: 63, train_loss: 0.8764, test_loss: 0.9425, test_f1: 0.5174
 epoch: 64, train_loss: 0.8701, test_loss: 0.9389, test_f1: 0.5048
 epoch: 65, train_loss: 0.8937, test_loss: 0.9559, test_f1: 0.5015
 epoch: 66, train_loss: 0.8692, test_loss: 0.9962, test_f1: 0.4969
 epoch: 67, train_loss: 0.8738, test_loss: 0.9459, test_f1: 0.5089
 epoch: 68, train_loss: 0.8604, test_loss: 0.9422, test_f1: 0.5196
 epoch: 69, train_loss: 0.8708, test_loss: 0.9175, test_f1: 0.5222
 epoch: 70, train_loss: 0.8641, test_loss: 0.9443, test_f1: 0.5027
 epoch: 71, train_loss: 0.8741, test_loss: 0.9089, test_f1: 0.5189
 epoch: 72, train_loss: 0.8673, test_loss: 0.9263, test_f1: 0.5109
 epoch: 73, train_loss: 0.8818, test_loss: 0.9426, test_f1: 0.5104
 epoch: 74, train_loss: 0.8583, test_loss: 0.9125, test_f1: 0.5208
 epoch: 75, train_loss: 0.8655, test_loss: 0.9395, test_f1: 0.5145
 epoch: 76, train_loss: 0.8565, test_loss: 0.9484, test_f1: 0.5207
 epoch: 77, train_loss: 0.8718, test_loss: 0.9304, test_f1: 0.5252
 epoch: 78, train_loss: 0.8546, test_loss: 0.9369, test_f1: 0.5123
 epoch: 79, train_loss: 0.8574, test_loss: 0.9712, test_f1: 0.5085
 epoch: 80, train_loss: 0.8552, test_loss: 0.9452, test_f1: 0.5202
 epoch: 81, train_loss: 0.8704, test_loss: 0.9764, test_f1: 0.5051
 epoch: 82, train_loss: 0.8507, test_loss: 0.9642, test_f1: 0.5048
 epoch: 83, train_loss: 0.8511, test_loss: 0.9459, test_f1: 0.5057
 epoch: 84, train_loss: 0.8416, test_loss: 0.9704, test_f1: 0.5086
 epoch: 85, train_loss: 0.8831, test_loss: 0.9587, test_f1: 0.5010
 epoch: 86, train_loss: 0.8539, test_loss: 0.9271, test_f1: 0.5268
 epoch: 87, train_loss: 0.8675, test_loss: 0.9368, test_f1: 0.5246
 epoch: 88, train_loss: 0.8541, test_loss: 0.9821, test_f1: 0.4787
 epoch: 89, train_loss: 0.8571, test_loss: 0.9641, test_f1: 0.5249
 epoch: 90, train_loss: 0.8588, test_loss: 0.9217, test_f1: 0.5158
 epoch: 91, train_loss: 0.8489, test_loss: 0.9671, test_f1: 0.5096
 epoch: 92, train_loss: 0.8523, test_loss: 0.9395, test_f1: 0.5181
 epoch: 93, train_loss: 0.8500, test_loss: 1.0020, test_f1: 0.4837
 epoch: 94, train_loss: 0.8435, test_loss: 0.9448, test_f1: 0.5285
 epoch: 95, train_loss: 0.8375, test_loss: 0.9433, test_f1: 0.4940
 epoch: 96, train_loss: 0.8704, test_loss: 0.9539, test_f1: 0.5089
 epoch: 97, train_loss: 0.8517, test_loss: 0.9373, test_f1: 0.5190
 epoch: 98, train_loss: 0.8434, test_loss: 0.9518, test_f1: 0.5222
 epoch: 99, train_loss: 0.8458, test_loss: 0.9417, test_f1: 0.5422
##################ITERATION #4 ****************************************
 epoch: 0, train_loss: 1.2810, test_loss: 1.2145, test_f1: 0.3279
 epoch: 1, train_loss: 1.2003, test_loss: 1.1027, test_f1: 0.3676
 epoch: 2, train_loss: 1.1489, test_loss: 1.1369, test_f1: 0.3422
 epoch: 3, train_loss: 1.1187, test_loss: 1.0348, test_f1: 0.4537
 epoch: 4, train_loss: 1.1034, test_loss: 0.9766, test_f1: 0.4542
 epoch: 5, train_loss: 1.0756, test_loss: 0.9512, test_f1: 0.4724
 epoch: 6, train_loss: 1.0507, test_loss: 0.9799, test_f1: 0.4580
 epoch: 7, train_loss: 1.0397, test_loss: 0.9379, test_f1: 0.4808
 epoch: 8, train_loss: 1.0246, test_loss: 0.9541, test_f1: 0.4579
 epoch: 9, train_loss: 1.0323, test_loss: 0.9422, test_f1: 0.4628
 epoch: 10, train_loss: 1.0144, test_loss: 1.0252, test_f1: 0.4490
 epoch: 11, train_loss: 1.0082, test_loss: 0.9969, test_f1: 0.4855
 epoch: 12, train_loss: 1.0158, test_loss: 1.0190, test_f1: 0.4344
 epoch: 13, train_loss: 0.9912, test_loss: 1.0306, test_f1: 0.4928
 epoch: 14, train_loss: 0.9885, test_loss: 1.0475, test_f1: 0.4190
 epoch: 15, train_loss: 1.0015, test_loss: 1.0560, test_f1: 0.4536
 epoch: 16, train_loss: 0.9903, test_loss: 0.9363, test_f1: 0.4561
 epoch: 17, train_loss: 0.9830, test_loss: 1.0821, test_f1: 0.4476
 epoch: 18, train_loss: 0.9826, test_loss: 0.9834, test_f1: 0.4894
 epoch: 19, train_loss: 0.9821, test_loss: 0.9615, test_f1: 0.4834
 epoch: 20, train_loss: 0.9694, test_loss: 0.9847, test_f1: 0.4944
 epoch: 21, train_loss: 0.9550, test_loss: 0.9668, test_f1: 0.4867
 epoch: 22, train_loss: 0.9933, test_loss: 0.9502, test_f1: 0.5116
 epoch: 23, train_loss: 0.9620, test_loss: 0.9788, test_f1: 0.5066
 epoch: 24, train_loss: 0.9655, test_loss: 1.0272, test_f1: 0.5047
 epoch: 25, train_loss: 0.9646, test_loss: 1.0521, test_f1: 0.4946
 epoch: 26, train_loss: 0.9537, test_loss: 1.0101, test_f1: 0.4901
 epoch: 27, train_loss: 0.9553, test_loss: 0.9848, test_f1: 0.5111
 epoch: 28, train_loss: 0.9548, test_loss: 1.0603, test_f1: 0.4907
 epoch: 29, train_loss: 0.9614, test_loss: 0.9990, test_f1: 0.5197
 epoch: 30, train_loss: 0.9551, test_loss: 0.9687, test_f1: 0.5320
 epoch: 31, train_loss: 0.9524, test_loss: 1.0291, test_f1: 0.4839
 epoch: 32, train_loss: 0.9479, test_loss: 1.0671, test_f1: 0.4927
 epoch: 33, train_loss: 0.9502, test_loss: 0.9829, test_f1: 0.4893
 epoch: 34, train_loss: 0.9353, test_loss: 0.9610, test_f1: 0.5304
 epoch: 35, train_loss: 0.9564, test_loss: 1.0253, test_f1: 0.5014
 epoch: 36, train_loss: 0.9416, test_loss: 1.0022, test_f1: 0.5186
 epoch: 37, train_loss: 0.9474, test_loss: 0.9649, test_f1: 0.5147
 epoch: 38, train_loss: 0.9343, test_loss: 0.9965, test_f1: 0.5155
 epoch: 39, train_loss: 0.9243, test_loss: 0.9759, test_f1: 0.4921
 epoch: 40, train_loss: 0.9387, test_loss: 1.0946, test_f1: 0.4625
 epoch: 41, train_loss: 0.9375, test_loss: 1.0683, test_f1: 0.4823
 epoch: 42, train_loss: 0.9173, test_loss: 0.9895, test_f1: 0.5101
 epoch: 43, train_loss: 0.9674, test_loss: 0.9856, test_f1: 0.5075
 epoch: 44, train_loss: 0.9302, test_loss: 0.9733, test_f1: 0.4970
 epoch: 45, train_loss: 0.9262, test_loss: 0.9663, test_f1: 0.5197
 epoch: 46, train_loss: 0.9303, test_loss: 0.9579, test_f1: 0.5249
 epoch: 47, train_loss: 0.9234, test_loss: 0.9322, test_f1: 0.5201
 epoch: 48, train_loss: 0.9300, test_loss: 1.0705, test_f1: 0.4987
 epoch: 49, train_loss: 0.9153, test_loss: 0.9765, test_f1: 0.4936
 epoch: 50, train_loss: 0.9290, test_loss: 0.9468, test_f1: 0.5238
 epoch: 51, train_loss: 0.8964, test_loss: 1.0218, test_f1: 0.5002
 epoch: 52, train_loss: 0.8990, test_loss: 0.9677, test_f1: 0.5068
 epoch: 53, train_loss: 0.8969, test_loss: 0.9366, test_f1: 0.5171
 epoch: 54, train_loss: 0.8999, test_loss: 1.0640, test_f1: 0.4892
 epoch: 55, train_loss: 0.8896, test_loss: 0.9838, test_f1: 0.4880
 epoch: 56, train_loss: 0.8916, test_loss: 0.9497, test_f1: 0.5206
 epoch: 57, train_loss: 0.8855, test_loss: 0.9663, test_f1: 0.5517
 epoch: 58, train_loss: 0.8873, test_loss: 0.9418, test_f1: 0.5108
 epoch: 59, train_loss: 0.8922, test_loss: 0.9926, test_f1: 0.4929
 epoch: 60, train_loss: 0.8857, test_loss: 0.9958, test_f1: 0.4776
 epoch: 61, train_loss: 0.8808, test_loss: 0.9656, test_f1: 0.5083
 epoch: 62, train_loss: 0.8815, test_loss: 1.0120, test_f1: 0.4943
 epoch: 63, train_loss: 0.8732, test_loss: 1.0920, test_f1: 0.4923
 epoch: 64, train_loss: 0.8755, test_loss: 0.9945, test_f1: 0.4908
 epoch: 65, train_loss: 0.8905, test_loss: 1.0341, test_f1: 0.4726
 epoch: 66, train_loss: 0.8933, test_loss: 0.9349, test_f1: 0.5365
 epoch: 67, train_loss: 0.8799, test_loss: 0.9741, test_f1: 0.5089
 epoch: 68, train_loss: 0.8660, test_loss: 0.9940, test_f1: 0.4730
 epoch: 69, train_loss: 0.8834, test_loss: 0.9687, test_f1: 0.4974
 epoch: 70, train_loss: 0.8732, test_loss: 0.9674, test_f1: 0.5077
 epoch: 71, train_loss: 0.8751, test_loss: 1.0772, test_f1: 0.5127
 epoch: 72, train_loss: 0.8714, test_loss: 1.0086, test_f1: 0.5066
 epoch: 73, train_loss: 0.8633, test_loss: 0.9773, test_f1: 0.5263
 epoch: 74, train_loss: 0.8859, test_loss: 0.9951, test_f1: 0.5102
 epoch: 75, train_loss: 0.8714, test_loss: 1.0607, test_f1: 0.5005
 epoch: 76, train_loss: 0.8625, test_loss: 0.9930, test_f1: 0.4852
 epoch: 77, train_loss: 0.8600, test_loss: 1.0299, test_f1: 0.5349
 epoch: 78, train_loss: 0.8633, test_loss: 1.0436, test_f1: 0.5308
 epoch: 79, train_loss: 0.8635, test_loss: 0.9587, test_f1: 0.5312
 epoch: 80, train_loss: 0.8696, test_loss: 0.9517, test_f1: 0.5323
 epoch: 81, train_loss: 0.8648, test_loss: 1.0790, test_f1: 0.5040
 epoch: 82, train_loss: 0.8602, test_loss: 0.9574, test_f1: 0.5315
 epoch: 83, train_loss: 0.8394, test_loss: 0.9893, test_f1: 0.5400
 epoch: 84, train_loss: 0.8586, test_loss: 1.0116, test_f1: 0.5022
 epoch: 85, train_loss: 0.8674, test_loss: 1.0015, test_f1: 0.4976
 epoch: 86, train_loss: 0.8513, test_loss: 1.0939, test_f1: 0.5167
 epoch: 87, train_loss: 0.8353, test_loss: 0.9909, test_f1: 0.5276
 epoch: 88, train_loss: 0.8571, test_loss: 1.0331, test_f1: 0.5172
 epoch: 89, train_loss: 0.8550, test_loss: 0.9736, test_f1: 0.5489
 epoch: 90, train_loss: 0.8461, test_loss: 0.9609, test_f1: 0.5362
 epoch: 91, train_loss: 0.8429, test_loss: 0.9628, test_f1: 0.5801
 epoch: 92, train_loss: 0.8520, test_loss: 0.9667, test_f1: 0.5478
 epoch: 93, train_loss: 0.8514, test_loss: 1.0096, test_f1: 0.5260
 epoch: 94, train_loss: 0.8437, test_loss: 1.0451, test_f1: 0.5263
 epoch: 95, train_loss: 0.8417, test_loss: 0.9657, test_f1: 0.5495
 epoch: 96, train_loss: 0.8452, test_loss: 1.2256, test_f1: 0.4804
 epoch: 97, train_loss: 0.8506, test_loss: 0.9739, test_f1: 0.5742
 epoch: 98, train_loss: 0.8340, test_loss: 0.9945, test_f1: 0.5505
 epoch: 99, train_loss: 0.8613, test_loss: 0.9716, test_f1: 0.5489
##################ITERATION #5 ****************************************
 epoch: 0, train_loss: 1.2568, test_loss: 1.2270, test_f1: 0.2787
 epoch: 1, train_loss: 1.1873, test_loss: 1.0916, test_f1: 0.3435
 epoch: 2, train_loss: 1.1300, test_loss: 1.0792, test_f1: 0.3912
 epoch: 3, train_loss: 1.0889, test_loss: 1.0004, test_f1: 0.4339
 epoch: 4, train_loss: 1.0564, test_loss: 1.0165, test_f1: 0.4443
 epoch: 5, train_loss: 1.0475, test_loss: 0.9647, test_f1: 0.4590
 epoch: 6, train_loss: 1.0154, test_loss: 1.0027, test_f1: 0.4736
 epoch: 7, train_loss: 0.9982, test_loss: 0.9631, test_f1: 0.4715
 epoch: 8, train_loss: 0.9834, test_loss: 0.9958, test_f1: 0.4743
 epoch: 9, train_loss: 0.9967, test_loss: 0.9687, test_f1: 0.4578
 epoch: 10, train_loss: 0.9761, test_loss: 0.9623, test_f1: 0.5212
 epoch: 11, train_loss: 0.9647, test_loss: 0.9772, test_f1: 0.4703
 epoch: 12, train_loss: 0.9695, test_loss: 1.0411, test_f1: 0.4526
 epoch: 13, train_loss: 0.9589, test_loss: 0.9490, test_f1: 0.4937
 epoch: 14, train_loss: 0.9569, test_loss: 0.9434, test_f1: 0.4957
 epoch: 15, train_loss: 0.9335, test_loss: 0.9712, test_f1: 0.5016
 epoch: 16, train_loss: 0.9598, test_loss: 0.9674, test_f1: 0.4896
 epoch: 17, train_loss: 0.9403, test_loss: 1.0280, test_f1: 0.4973
 epoch: 18, train_loss: 0.9470, test_loss: 0.9683, test_f1: 0.4903
 epoch: 19, train_loss: 0.9468, test_loss: 0.9664, test_f1: 0.5153
 epoch: 20, train_loss: 0.9563, test_loss: 1.0243, test_f1: 0.4848
 epoch: 21, train_loss: 0.9354, test_loss: 0.9976, test_f1: 0.4949
 epoch: 22, train_loss: 0.9451, test_loss: 0.9684, test_f1: 0.4903
 epoch: 23, train_loss: 0.9389, test_loss: 1.0065, test_f1: 0.4925
 epoch: 24, train_loss: 0.9356, test_loss: 0.9845, test_f1: 0.4988
 epoch: 25, train_loss: 0.9269, test_loss: 0.9908, test_f1: 0.4881
 epoch: 26, train_loss: 0.9118, test_loss: 0.9430, test_f1: 0.5061
 epoch: 27, train_loss: 0.9269, test_loss: 0.9141, test_f1: 0.4928
 epoch: 28, train_loss: 1.0628, test_loss: 0.9543, test_f1: 0.5086
 epoch: 29, train_loss: 0.9677, test_loss: 1.2008, test_f1: 0.4774
 epoch: 30, train_loss: 0.9792, test_loss: 1.0293, test_f1: 0.4888
 epoch: 31, train_loss: 0.9584, test_loss: 0.9754, test_f1: 0.5033
 epoch: 32, train_loss: 0.9425, test_loss: 1.0195, test_f1: 0.4949
 epoch: 33, train_loss: 0.9280, test_loss: 0.9599, test_f1: 0.5255
 epoch: 34, train_loss: 0.9258, test_loss: 1.0014, test_f1: 0.5400
 epoch: 35, train_loss: 0.9311, test_loss: 0.9823, test_f1: 0.5446
 epoch: 36, train_loss: 0.9159, test_loss: 1.1092, test_f1: 0.4741
 epoch: 37, train_loss: 0.9215, test_loss: 0.9793, test_f1: 0.5199
 epoch: 38, train_loss: 0.9437, test_loss: 1.0060, test_f1: 0.5125
 epoch: 39, train_loss: 0.9196, test_loss: 1.0142, test_f1: 0.5299
 epoch: 40, train_loss: 0.9154, test_loss: 0.8951, test_f1: 0.5637
 epoch: 41, train_loss: 0.9073, test_loss: 1.0190, test_f1: 0.5401
 epoch: 42, train_loss: 0.9136, test_loss: 0.9163, test_f1: 0.5818
 epoch: 43, train_loss: 0.8976, test_loss: 0.9383, test_f1: 0.5019
 epoch: 44, train_loss: 0.9104, test_loss: 0.9712, test_f1: 0.5065
 epoch: 45, train_loss: 0.8978, test_loss: 0.9384, test_f1: 0.5088
 epoch: 46, train_loss: 0.9067, test_loss: 0.9379, test_f1: 0.5008
 epoch: 47, train_loss: 0.9160, test_loss: 0.9635, test_f1: 0.4997
 epoch: 48, train_loss: 0.9101, test_loss: 0.9597, test_f1: 0.5069
 epoch: 49, train_loss: 0.9047, test_loss: 0.9486, test_f1: 0.5289
 epoch: 50, train_loss: 0.9069, test_loss: 0.9680, test_f1: 0.5120
 epoch: 51, train_loss: 0.8940, test_loss: 0.9680, test_f1: 0.5253
 epoch: 52, train_loss: 0.8728, test_loss: 0.9592, test_f1: 0.5221
 epoch: 53, train_loss: 0.8860, test_loss: 1.0277, test_f1: 0.5206
 epoch: 54, train_loss: 0.8728, test_loss: 0.9994, test_f1: 0.5095
 epoch: 55, train_loss: 0.8704, test_loss: 0.9853, test_f1: 0.5270
 epoch: 56, train_loss: 0.8712, test_loss: 0.9802, test_f1: 0.5183
 epoch: 57, train_loss: 0.8696, test_loss: 1.1375, test_f1: 0.5066
 epoch: 58, train_loss: 0.8954, test_loss: 1.0730, test_f1: 0.5229
 epoch: 59, train_loss: 0.8592, test_loss: 0.9515, test_f1: 0.5714
 epoch: 60, train_loss: 0.8621, test_loss: 0.9581, test_f1: 0.5468
 epoch: 61, train_loss: 0.8618, test_loss: 0.9775, test_f1: 0.5574
 epoch: 62, train_loss: 0.8659, test_loss: 0.9775, test_f1: 0.5449
 epoch: 63, train_loss: 0.8718, test_loss: 0.9737, test_f1: 0.5577
 epoch: 64, train_loss: 0.8593, test_loss: 0.9546, test_f1: 0.5545
 epoch: 65, train_loss: 0.8633, test_loss: 0.9804, test_f1: 0.5494
 epoch: 66, train_loss: 0.8464, test_loss: 0.9891, test_f1: 0.5708
 epoch: 67, train_loss: 0.8582, test_loss: 1.0235, test_f1: 0.5274
 epoch: 68, train_loss: 0.8625, test_loss: 0.9804, test_f1: 0.5331
 epoch: 69, train_loss: 0.8612, test_loss: 0.9582, test_f1: 0.5664
 epoch: 70, train_loss: 0.8573, test_loss: 0.9294, test_f1: 0.5578
 epoch: 71, train_loss: 0.8625, test_loss: 0.9890, test_f1: 0.5370
 epoch: 72, train_loss: 0.8617, test_loss: 0.9831, test_f1: 0.5160
 epoch: 73, train_loss: 0.8592, test_loss: 1.0222, test_f1: 0.5604
 epoch: 74, train_loss: 0.8543, test_loss: 0.9717, test_f1: 0.5672
 epoch: 75, train_loss: 0.8557, test_loss: 0.9969, test_f1: 0.5384
 epoch: 76, train_loss: 0.8451, test_loss: 1.0349, test_f1: 0.5478
 epoch: 77, train_loss: 0.8490, test_loss: 1.0559, test_f1: 0.5342
 epoch: 78, train_loss: 0.8437, test_loss: 1.0089, test_f1: 0.5636
 epoch: 79, train_loss: 0.8351, test_loss: 0.9989, test_f1: 0.5328
 epoch: 80, train_loss: 0.8707, test_loss: 0.9781, test_f1: 0.5459
 epoch: 81, train_loss: 0.8513, test_loss: 0.9680, test_f1: 0.5639
 epoch: 82, train_loss: 0.8479, test_loss: 0.9564, test_f1: 0.5594
 epoch: 83, train_loss: 0.8274, test_loss: 0.9582, test_f1: 0.5594
 epoch: 84, train_loss: 0.8470, test_loss: 0.9505, test_f1: 0.5564
 epoch: 85, train_loss: 0.8486, test_loss: 1.0033, test_f1: 0.5733
 epoch: 86, train_loss: 0.8415, test_loss: 0.9932, test_f1: 0.5382
 epoch: 87, train_loss: 0.8470, test_loss: 0.9909, test_f1: 0.5361
 epoch: 88, train_loss: 0.8466, test_loss: 0.9998, test_f1: 0.5379
 epoch: 89, train_loss: 0.8403, test_loss: 0.9835, test_f1: 0.5509
 epoch: 90, train_loss: 0.8405, test_loss: 0.9791, test_f1: 0.5486
 epoch: 91, train_loss: 0.8370, test_loss: 1.0142, test_f1: 0.5751
 epoch: 92, train_loss: 0.8500, test_loss: 0.9431, test_f1: 0.5682
 epoch: 93, train_loss: 0.8348, test_loss: 0.9453, test_f1: 0.5796
 epoch: 94, train_loss: 0.8559, test_loss: 0.9624, test_f1: 0.5369
 epoch: 95, train_loss: 0.8432, test_loss: 1.0166, test_f1: 0.5495
 epoch: 96, train_loss: 0.8466, test_loss: 0.9929, test_f1: 0.5431
 epoch: 97, train_loss: 0.8439, test_loss: 0.9748, test_f1: 0.5636
 epoch: 98, train_loss: 0.8319, test_loss: 0.9945, test_f1: 0.5758
 epoch: 99, train_loss: 0.8354, test_loss: 0.9628, test_f1: 0.5644
##################ITERATION #6 ****************************************
 epoch: 0, train_loss: 1.2582, test_loss: 1.2484, test_f1: 0.3116
 epoch: 1, train_loss: 1.1638, test_loss: 1.0597, test_f1: 0.4563
 epoch: 2, train_loss: 1.1232, test_loss: 1.0577, test_f1: 0.4744
 epoch: 3, train_loss: 1.0950, test_loss: 1.1130, test_f1: 0.4210
 epoch: 4, train_loss: 1.0983, test_loss: 0.9683, test_f1: 0.4958
 epoch: 5, train_loss: 1.0674, test_loss: 0.9790, test_f1: 0.4777
 epoch: 6, train_loss: 1.0563, test_loss: 0.9518, test_f1: 0.4789
 epoch: 7, train_loss: 1.0431, test_loss: 0.9568, test_f1: 0.4548
 epoch: 8, train_loss: 1.0380, test_loss: 0.9847, test_f1: 0.4607
 epoch: 9, train_loss: 1.0233, test_loss: 0.9615, test_f1: 0.4851
 epoch: 10, train_loss: 1.0158, test_loss: 0.9346, test_f1: 0.4797
 epoch: 11, train_loss: 1.0572, test_loss: 0.9647, test_f1: 0.4486
 epoch: 12, train_loss: 1.0310, test_loss: 0.9499, test_f1: 0.4480
 epoch: 13, train_loss: 0.9995, test_loss: 0.9582, test_f1: 0.4693
 epoch: 14, train_loss: 1.0051, test_loss: 1.0004, test_f1: 0.4502
 epoch: 15, train_loss: 0.9889, test_loss: 0.9693, test_f1: 0.4431
 epoch: 16, train_loss: 0.9689, test_loss: 0.9569, test_f1: 0.4555
 epoch: 17, train_loss: 0.9774, test_loss: 0.9523, test_f1: 0.4884
 epoch: 18, train_loss: 0.9733, test_loss: 0.9802, test_f1: 0.4927
 epoch: 19, train_loss: 0.9631, test_loss: 0.9963, test_f1: 0.4872
 epoch: 20, train_loss: 0.9827, test_loss: 1.0456, test_f1: 0.4542
 epoch: 21, train_loss: 0.9767, test_loss: 0.9893, test_f1: 0.4982
 epoch: 22, train_loss: 0.9824, test_loss: 0.9556, test_f1: 0.4845
 epoch: 23, train_loss: 0.9704, test_loss: 1.0053, test_f1: 0.4845
 epoch: 24, train_loss: 0.9623, test_loss: 0.9854, test_f1: 0.4859
 epoch: 25, train_loss: 0.9455, test_loss: 0.9951, test_f1: 0.5243
 epoch: 26, train_loss: 0.9555, test_loss: 0.9288, test_f1: 0.4900
 epoch: 27, train_loss: 0.9562, test_loss: 0.9990, test_f1: 0.5146
 epoch: 28, train_loss: 0.9619, test_loss: 1.0026, test_f1: 0.4991
 epoch: 29, train_loss: 0.9481, test_loss: 0.9946, test_f1: 0.4955
 epoch: 30, train_loss: 0.9447, test_loss: 1.0023, test_f1: 0.4874
 epoch: 31, train_loss: 0.9430, test_loss: 1.0435, test_f1: 0.4747
 epoch: 32, train_loss: 0.9448, test_loss: 1.0102, test_f1: 0.4472
 epoch: 33, train_loss: 0.9472, test_loss: 0.9981, test_f1: 0.5356
 epoch: 34, train_loss: 0.9333, test_loss: 1.0554, test_f1: 0.4979
 epoch: 35, train_loss: 0.9383, test_loss: 1.0160, test_f1: 0.4856
 epoch: 36, train_loss: 0.9364, test_loss: 1.1390, test_f1: 0.4683
 epoch: 37, train_loss: 0.9320, test_loss: 1.0093, test_f1: 0.4830
 epoch: 38, train_loss: 0.9344, test_loss: 1.0397, test_f1: 0.4775
 epoch: 39, train_loss: 0.9280, test_loss: 1.8253, test_f1: 0.4008
 epoch: 40, train_loss: 1.0236, test_loss: 0.9992, test_f1: 0.4492
 epoch: 41, train_loss: 0.9543, test_loss: 0.9805, test_f1: 0.4892
 epoch: 42, train_loss: 0.9542, test_loss: 1.0175, test_f1: 0.5010
 epoch: 43, train_loss: 0.9383, test_loss: 1.0072, test_f1: 0.4701
 epoch: 44, train_loss: 0.9370, test_loss: 1.0157, test_f1: 0.4830
 epoch: 45, train_loss: 0.9383, test_loss: 1.0143, test_f1: 0.4962
 epoch: 46, train_loss: 0.9349, test_loss: 1.0001, test_f1: 0.4736
 epoch: 47, train_loss: 0.9118, test_loss: 1.0122, test_f1: 0.5214
 epoch: 48, train_loss: 0.9456, test_loss: 0.9957, test_f1: 0.4883
 epoch: 49, train_loss: 0.9285, test_loss: 0.9650, test_f1: 0.4781
 epoch: 50, train_loss: 0.9281, test_loss: 0.9914, test_f1: 0.4917
 epoch: 51, train_loss: 0.9130, test_loss: 0.9916, test_f1: 0.4839
 epoch: 52, train_loss: 0.8988, test_loss: 0.9671, test_f1: 0.4885
 epoch: 53, train_loss: 0.8920, test_loss: 1.0092, test_f1: 0.4908
 epoch: 54, train_loss: 0.9014, test_loss: 0.9708, test_f1: 0.5454
 epoch: 55, train_loss: 0.8859, test_loss: 1.0143, test_f1: 0.5190
 epoch: 56, train_loss: 0.8852, test_loss: 1.0660, test_f1: 0.4706
 epoch: 57, train_loss: 0.8880, test_loss: 0.9977, test_f1: 0.4939
 epoch: 58, train_loss: 0.8994, test_loss: 1.1707, test_f1: 0.4915
 epoch: 59, train_loss: 0.8942, test_loss: 0.9651, test_f1: 0.5162
 epoch: 60, train_loss: 0.8952, test_loss: 0.9872, test_f1: 0.4942
 epoch: 61, train_loss: 0.8855, test_loss: 1.0505, test_f1: 0.4914
 epoch: 62, train_loss: 0.8872, test_loss: 0.9992, test_f1: 0.5135
 epoch: 63, train_loss: 0.8921, test_loss: 1.0044, test_f1: 0.5101
 epoch: 64, train_loss: 0.8972, test_loss: 1.0098, test_f1: 0.5181
 epoch: 65, train_loss: 0.8931, test_loss: 0.9943, test_f1: 0.5091
 epoch: 66, train_loss: 0.8863, test_loss: 1.0435, test_f1: 0.4886
 epoch: 67, train_loss: 0.8934, test_loss: 1.0320, test_f1: 0.4964
 epoch: 68, train_loss: 0.8773, test_loss: 1.0465, test_f1: 0.4958
 epoch: 69, train_loss: 0.8821, test_loss: 1.1463, test_f1: 0.4942
 epoch: 70, train_loss: 0.8708, test_loss: 1.0307, test_f1: 0.4806
 epoch: 71, train_loss: 0.8790, test_loss: 1.0787, test_f1: 0.4742
 epoch: 72, train_loss: 0.8747, test_loss: 1.0100, test_f1: 0.5045
 epoch: 73, train_loss: 0.8772, test_loss: 0.9861, test_f1: 0.5102
 epoch: 74, train_loss: 0.8769, test_loss: 1.0805, test_f1: 0.4929
 epoch: 75, train_loss: 0.8768, test_loss: 1.1128, test_f1: 0.4815
 epoch: 76, train_loss: 0.8783, test_loss: 0.9791, test_f1: 0.5326
 epoch: 77, train_loss: 0.8763, test_loss: 0.9767, test_f1: 0.4986
 epoch: 78, train_loss: 0.8752, test_loss: 0.9827, test_f1: 0.5125
 epoch: 79, train_loss: 0.8637, test_loss: 1.0998, test_f1: 0.4657
 epoch: 80, train_loss: 0.8684, test_loss: 0.9719, test_f1: 0.5294
 epoch: 81, train_loss: 0.8697, test_loss: 1.0046, test_f1: 0.5194
 epoch: 82, train_loss: 0.8841, test_loss: 1.0001, test_f1: 0.4451
 epoch: 83, train_loss: 0.8757, test_loss: 1.0961, test_f1: 0.4781
 epoch: 84, train_loss: 0.8630, test_loss: 1.1027, test_f1: 0.4931
 epoch: 85, train_loss: 0.8556, test_loss: 1.0037, test_f1: 0.5137
 epoch: 86, train_loss: 0.8718, test_loss: 1.0014, test_f1: 0.5169
 epoch: 87, train_loss: 0.8785, test_loss: 0.9821, test_f1: 0.5357
 epoch: 88, train_loss: 0.8739, test_loss: 1.0192, test_f1: 0.4757
 epoch: 89, train_loss: 0.8792, test_loss: 0.9527, test_f1: 0.5066
 epoch: 90, train_loss: 0.8707, test_loss: 1.0334, test_f1: 0.4903
 epoch: 91, train_loss: 0.8663, test_loss: 0.9957, test_f1: 0.5224
 epoch: 92, train_loss: 0.8593, test_loss: 0.9497, test_f1: 0.5307
 epoch: 93, train_loss: 0.8683, test_loss: 1.0075, test_f1: 0.5185
 epoch: 94, train_loss: 0.8591, test_loss: 1.0321, test_f1: 0.4939
 epoch: 95, train_loss: 0.8583, test_loss: 1.0237, test_f1: 0.4829
 epoch: 96, train_loss: 0.8747, test_loss: 1.0253, test_f1: 0.5140
 epoch: 97, train_loss: 0.8574, test_loss: 1.0677, test_f1: 0.5058
 epoch: 98, train_loss: 0.8640, test_loss: 0.9833, test_f1: 0.4956
 epoch: 99, train_loss: 0.8584, test_loss: 1.0237, test_f1: 0.5194
##################ITERATION #7 ****************************************
 epoch: 0, train_loss: 1.2885, test_loss: 1.2423, test_f1: 0.3399
 epoch: 1, train_loss: 1.2385, test_loss: 1.1859, test_f1: 0.3971
 epoch: 2, train_loss: 1.2045, test_loss: 1.1460, test_f1: 0.3963
 epoch: 3, train_loss: 1.2038, test_loss: 1.1268, test_f1: 0.3646
 epoch: 4, train_loss: 1.1666, test_loss: 1.0698, test_f1: 0.4671
 epoch: 5, train_loss: 1.1362, test_loss: 1.1064, test_f1: 0.4077
 epoch: 6, train_loss: 1.1090, test_loss: 1.0276, test_f1: 0.4693
 epoch: 7, train_loss: 1.1251, test_loss: 1.0664, test_f1: 0.4511
 epoch: 8, train_loss: 1.0605, test_loss: 1.0324, test_f1: 0.4655
 epoch: 9, train_loss: 1.0536, test_loss: 1.0673, test_f1: 0.4795
 epoch: 10, train_loss: 1.0566, test_loss: 0.9728, test_f1: 0.4802
 epoch: 11, train_loss: 1.0390, test_loss: 0.9871, test_f1: 0.4512
 epoch: 12, train_loss: 1.0389, test_loss: 1.0654, test_f1: 0.4708
 epoch: 13, train_loss: 1.0255, test_loss: 1.0115, test_f1: 0.4841
 epoch: 14, train_loss: 1.0204, test_loss: 0.9491, test_f1: 0.4821
 epoch: 15, train_loss: 1.0150, test_loss: 0.9476, test_f1: 0.4627
 epoch: 16, train_loss: 1.0079, test_loss: 0.9813, test_f1: 0.4780
 epoch: 17, train_loss: 1.0130, test_loss: 1.0114, test_f1: 0.4806
 epoch: 18, train_loss: 1.0130, test_loss: 0.9931, test_f1: 0.4463
 epoch: 19, train_loss: 1.0012, test_loss: 1.0013, test_f1: 0.5080
 epoch: 20, train_loss: 1.0076, test_loss: 1.0018, test_f1: 0.4701
 epoch: 21, train_loss: 1.0176, test_loss: 0.9507, test_f1: 0.4700
 epoch: 22, train_loss: 1.0025, test_loss: 1.0240, test_f1: 0.4417
 epoch: 23, train_loss: 0.9920, test_loss: 1.0276, test_f1: 0.4721
 epoch: 24, train_loss: 0.9872, test_loss: 0.9927, test_f1: 0.5000
 epoch: 25, train_loss: 0.9772, test_loss: 1.0308, test_f1: 0.4868
 epoch: 26, train_loss: 0.9769, test_loss: 0.9919, test_f1: 0.5353
 epoch: 27, train_loss: 0.9812, test_loss: 1.0352, test_f1: 0.4591
 epoch: 28, train_loss: 0.9610, test_loss: 0.9695, test_f1: 0.5086
 epoch: 29, train_loss: 0.9743, test_loss: 1.0025, test_f1: 0.4805
 epoch: 30, train_loss: 0.9708, test_loss: 1.0058, test_f1: 0.4944
 epoch: 31, train_loss: 0.9660, test_loss: 1.0867, test_f1: 0.4725
 epoch: 32, train_loss: 0.9446, test_loss: 1.0036, test_f1: 0.4699
 epoch: 33, train_loss: 0.9631, test_loss: 0.9833, test_f1: 0.5077
 epoch: 34, train_loss: 0.9606, test_loss: 1.0518, test_f1: 0.4592
 epoch: 35, train_loss: 0.9534, test_loss: 1.0082, test_f1: 0.4975
 epoch: 36, train_loss: 0.9373, test_loss: 0.9910, test_f1: 0.5124
 epoch: 37, train_loss: 0.9406, test_loss: 1.0069, test_f1: 0.4810
 epoch: 38, train_loss: 0.9454, test_loss: 0.9765, test_f1: 0.5045
 epoch: 39, train_loss: 0.9504, test_loss: 0.9730, test_f1: 0.5008
 epoch: 40, train_loss: 0.9315, test_loss: 0.9511, test_f1: 0.5153
 epoch: 41, train_loss: 0.9669, test_loss: 1.0445, test_f1: 0.5108
 epoch: 42, train_loss: 0.9565, test_loss: 1.0050, test_f1: 0.4927
 epoch: 43, train_loss: 0.9483, test_loss: 0.9971, test_f1: 0.4976
 epoch: 44, train_loss: 0.9348, test_loss: 1.0007, test_f1: 0.5079
 epoch: 45, train_loss: 0.9286, test_loss: 1.0125, test_f1: 0.4963
 epoch: 46, train_loss: 0.9388, test_loss: 0.9745, test_f1: 0.4947
 epoch: 47, train_loss: 0.9237, test_loss: 1.0297, test_f1: 0.4786
 epoch: 48, train_loss: 0.9326, test_loss: 1.0251, test_f1: 0.5076
 epoch: 49, train_loss: 0.9234, test_loss: 1.0128, test_f1: 0.4972
 epoch: 50, train_loss: 0.9320, test_loss: 0.9858, test_f1: 0.4957
 epoch: 51, train_loss: 0.9152, test_loss: 0.9858, test_f1: 0.4844
 epoch: 52, train_loss: 0.8918, test_loss: 0.9726, test_f1: 0.5229
 epoch: 53, train_loss: 0.9014, test_loss: 0.9794, test_f1: 0.5128
 epoch: 54, train_loss: 0.8938, test_loss: 0.9395, test_f1: 0.5016
 epoch: 55, train_loss: 0.8985, test_loss: 0.9472, test_f1: 0.5231
 epoch: 56, train_loss: 0.8899, test_loss: 0.9386, test_f1: 0.5097
 epoch: 57, train_loss: 0.8911, test_loss: 0.9524, test_f1: 0.5098
 epoch: 58, train_loss: 0.8799, test_loss: 0.9597, test_f1: 0.5241
 epoch: 59, train_loss: 0.9024, test_loss: 0.9889, test_f1: 0.5224
 epoch: 60, train_loss: 0.8885, test_loss: 0.9637, test_f1: 0.4879
 epoch: 61, train_loss: 0.8825, test_loss: 0.9524, test_f1: 0.5075
 epoch: 62, train_loss: 0.8923, test_loss: 0.9484, test_f1: 0.4988
 epoch: 63, train_loss: 0.8908, test_loss: 0.9473, test_f1: 0.5204
 epoch: 64, train_loss: 0.8875, test_loss: 0.9466, test_f1: 0.5149
 epoch: 65, train_loss: 0.8877, test_loss: 0.9296, test_f1: 0.5231
 epoch: 66, train_loss: 0.8872, test_loss: 0.9785, test_f1: 0.5329
 epoch: 67, train_loss: 0.8832, test_loss: 0.9659, test_f1: 0.5420
 epoch: 68, train_loss: 0.8837, test_loss: 0.9484, test_f1: 0.5381
 epoch: 69, train_loss: 0.8869, test_loss: 0.9581, test_f1: 0.5138
 epoch: 70, train_loss: 0.8737, test_loss: 0.9708, test_f1: 0.5174
 epoch: 71, train_loss: 0.8718, test_loss: 0.9815, test_f1: 0.5061
 epoch: 72, train_loss: 0.8729, test_loss: 0.9709, test_f1: 0.5030
 epoch: 73, train_loss: 0.8719, test_loss: 0.9348, test_f1: 0.5086
 epoch: 74, train_loss: 0.8814, test_loss: 0.9618, test_f1: 0.5189
 epoch: 75, train_loss: 0.8777, test_loss: 0.9721, test_f1: 0.4894
 epoch: 76, train_loss: 0.8732, test_loss: 0.9638, test_f1: 0.5327
 epoch: 77, train_loss: 0.8792, test_loss: 0.9703, test_f1: 0.5087
 epoch: 78, train_loss: 0.8742, test_loss: 0.9731, test_f1: 0.5217
 epoch: 79, train_loss: 0.8762, test_loss: 0.9465, test_f1: 0.5251
 epoch: 80, train_loss: 0.8783, test_loss: 0.9621, test_f1: 0.5455
 epoch: 81, train_loss: 0.8704, test_loss: 0.9530, test_f1: 0.5171
 epoch: 82, train_loss: 0.8852, test_loss: 0.9894, test_f1: 0.4984
 epoch: 83, train_loss: 0.9361, test_loss: 0.9781, test_f1: 0.5092
 epoch: 84, train_loss: 0.8729, test_loss: 0.9526, test_f1: 0.5004
 epoch: 85, train_loss: 0.8711, test_loss: 1.0154, test_f1: 0.5273
 epoch: 86, train_loss: 0.8696, test_loss: 1.0083, test_f1: 0.4895
 epoch: 87, train_loss: 0.8689, test_loss: 0.9804, test_f1: 0.5261
 epoch: 88, train_loss: 0.8676, test_loss: 0.9759, test_f1: 0.4920
 epoch: 89, train_loss: 0.8833, test_loss: 0.9978, test_f1: 0.5012
 epoch: 90, train_loss: 0.8753, test_loss: 0.9962, test_f1: 0.5024
 epoch: 91, train_loss: 0.8667, test_loss: 1.0055, test_f1: 0.5373
 epoch: 92, train_loss: 0.8604, test_loss: 1.0186, test_f1: 0.4955
 epoch: 93, train_loss: 0.8524, test_loss: 0.9950, test_f1: 0.4804
 epoch: 94, train_loss: 0.8629, test_loss: 1.0143, test_f1: 0.5113
 epoch: 95, train_loss: 0.8768, test_loss: 0.9983, test_f1: 0.5137
 epoch: 96, train_loss: 0.8704, test_loss: 0.9894, test_f1: 0.4925
 epoch: 97, train_loss: 0.8739, test_loss: 0.9818, test_f1: 0.5021
 epoch: 98, train_loss: 0.8763, test_loss: 1.0029, test_f1: 0.4935
 epoch: 99, train_loss: 0.8551, test_loss: 0.9753, test_f1: 0.5066
##################ITERATION #8 ****************************************
 epoch: 0, train_loss: 1.2836, test_loss: 1.3225, test_f1: 0.2477
 epoch: 1, train_loss: 1.2109, test_loss: 1.1385, test_f1: 0.3577
 epoch: 2, train_loss: 1.1534, test_loss: 1.0479, test_f1: 0.4473
 epoch: 3, train_loss: 1.1031, test_loss: 1.1648, test_f1: 0.4104
 epoch: 4, train_loss: 1.0745, test_loss: 0.9651, test_f1: 0.4394
 epoch: 5, train_loss: 1.0386, test_loss: 0.9258, test_f1: 0.5083
 epoch: 6, train_loss: 1.0337, test_loss: 0.9361, test_f1: 0.4937
 epoch: 7, train_loss: 1.0256, test_loss: 0.9820, test_f1: 0.4468
 epoch: 8, train_loss: 1.0238, test_loss: 1.0147, test_f1: 0.4420
 epoch: 9, train_loss: 0.9984, test_loss: 0.9794, test_f1: 0.4759
 epoch: 10, train_loss: 0.9898, test_loss: 0.9283, test_f1: 0.4530
 epoch: 11, train_loss: 0.9849, test_loss: 0.9819, test_f1: 0.4673
 epoch: 12, train_loss: 0.9835, test_loss: 0.9862, test_f1: 0.4808
 epoch: 13, train_loss: 0.9632, test_loss: 0.9204, test_f1: 0.4789
 epoch: 14, train_loss: 0.9840, test_loss: 0.9692, test_f1: 0.4658
 epoch: 15, train_loss: 0.9653, test_loss: 1.0297, test_f1: 0.4779
 epoch: 16, train_loss: 0.9458, test_loss: 0.9664, test_f1: 0.4872
 epoch: 17, train_loss: 0.9623, test_loss: 0.9776, test_f1: 0.4836
 epoch: 18, train_loss: 0.9543, test_loss: 1.0385, test_f1: 0.4981
 epoch: 19, train_loss: 0.9570, test_loss: 0.9029, test_f1: 0.4809
 epoch: 20, train_loss: 0.9518, test_loss: 1.1005, test_f1: 0.4936
 epoch: 21, train_loss: 0.9465, test_loss: 0.9918, test_f1: 0.4640
 epoch: 22, train_loss: 0.9364, test_loss: 0.9451, test_f1: 0.4785
 epoch: 23, train_loss: 0.9459, test_loss: 1.0068, test_f1: 0.4760
 epoch: 24, train_loss: 0.9383, test_loss: 0.9777, test_f1: 0.5049
 epoch: 25, train_loss: 0.9426, test_loss: 1.0115, test_f1: 0.5051
 epoch: 26, train_loss: 0.9318, test_loss: 1.0370, test_f1: 0.4694
 epoch: 27, train_loss: 0.9303, test_loss: 1.0065, test_f1: 0.5114
 epoch: 28, train_loss: 0.9314, test_loss: 0.9849, test_f1: 0.5165
 epoch: 29, train_loss: 0.9394, test_loss: 1.0184, test_f1: 0.5161
 epoch: 30, train_loss: 0.9313, test_loss: 0.9953, test_f1: 0.5124
 epoch: 31, train_loss: 0.9389, test_loss: 1.0028, test_f1: 0.4996
 epoch: 32, train_loss: 0.9155, test_loss: 1.0008, test_f1: 0.5161
 epoch: 33, train_loss: 0.9526, test_loss: 1.0722, test_f1: 0.4414
 epoch: 34, train_loss: 0.9460, test_loss: 1.0097, test_f1: 0.5066
 epoch: 35, train_loss: 0.9385, test_loss: 1.0950, test_f1: 0.5002
 epoch: 36, train_loss: 0.9363, test_loss: 1.2404, test_f1: 0.4856
 epoch: 37, train_loss: 0.9372, test_loss: 1.0009, test_f1: 0.5099
 epoch: 38, train_loss: 0.9193, test_loss: 1.0695, test_f1: 0.5135
 epoch: 39, train_loss: 0.9136, test_loss: 0.9636, test_f1: 0.5422
 epoch: 40, train_loss: 0.9124, test_loss: 1.0402, test_f1: 0.5211
 epoch: 41, train_loss: 0.9152, test_loss: 0.9849, test_f1: 0.5392
 epoch: 42, train_loss: 0.9166, test_loss: 1.0388, test_f1: 0.4823
 epoch: 43, train_loss: 0.9162, test_loss: 1.0048, test_f1: 0.5141
 epoch: 44, train_loss: 0.8969, test_loss: 1.1825, test_f1: 0.5142
 epoch: 45, train_loss: 0.8989, test_loss: 1.1256, test_f1: 0.4963
 epoch: 46, train_loss: 0.9065, test_loss: 1.1186, test_f1: 0.4897
 epoch: 47, train_loss: 0.9150, test_loss: 0.9710, test_f1: 0.5395
 epoch: 48, train_loss: 0.9070, test_loss: 1.0075, test_f1: 0.5356
 epoch: 49, train_loss: 0.8964, test_loss: 0.9809, test_f1: 0.5075
 epoch: 50, train_loss: 0.9047, test_loss: 1.0634, test_f1: 0.4830
 epoch: 51, train_loss: 0.8713, test_loss: 0.9993, test_f1: 0.4987
 epoch: 52, train_loss: 0.8637, test_loss: 1.0226, test_f1: 0.4893
 epoch: 53, train_loss: 0.8867, test_loss: 1.0046, test_f1: 0.4997
 epoch: 54, train_loss: 0.8593, test_loss: 1.0697, test_f1: 0.4823
 epoch: 55, train_loss: 0.8571, test_loss: 1.0301, test_f1: 0.4834
 epoch: 56, train_loss: 0.8621, test_loss: 1.0338, test_f1: 0.5268
 epoch: 57, train_loss: 0.8553, test_loss: 0.9641, test_f1: 0.5101
 epoch: 58, train_loss: 0.8559, test_loss: 1.0045, test_f1: 0.5291
 epoch: 59, train_loss: 0.8593, test_loss: 1.0494, test_f1: 0.4973
 epoch: 60, train_loss: 0.8439, test_loss: 0.9963, test_f1: 0.5354
 epoch: 61, train_loss: 0.8462, test_loss: 1.0678, test_f1: 0.5222
 epoch: 62, train_loss: 0.8388, test_loss: 1.0926, test_f1: 0.5058
 epoch: 63, train_loss: 0.8442, test_loss: 0.9751, test_f1: 0.5316
 epoch: 64, train_loss: 0.8504, test_loss: 0.9337, test_f1: 0.5685
 epoch: 65, train_loss: 0.8567, test_loss: 0.9567, test_f1: 0.5445
 epoch: 66, train_loss: 0.8405, test_loss: 1.0780, test_f1: 0.5208
 epoch: 67, train_loss: 0.8426, test_loss: 0.9644, test_f1: 0.5657
 epoch: 68, train_loss: 0.8381, test_loss: 0.9227, test_f1: 0.5478
 epoch: 69, train_loss: 0.8157, test_loss: 1.1233, test_f1: 0.5065
 epoch: 70, train_loss: 0.8438, test_loss: 0.9298, test_f1: 0.5587
 epoch: 71, train_loss: 0.8631, test_loss: 0.9945, test_f1: 0.5409
 epoch: 72, train_loss: 0.8488, test_loss: 0.9839, test_f1: 0.5517
 epoch: 73, train_loss: 0.8433, test_loss: 0.9731, test_f1: 0.5632
 epoch: 74, train_loss: 0.8262, test_loss: 0.9799, test_f1: 0.5247
 epoch: 75, train_loss: 0.8349, test_loss: 0.9825, test_f1: 0.5519
 epoch: 76, train_loss: 0.8271, test_loss: 0.9548, test_f1: 0.5422
 epoch: 77, train_loss: 0.8350, test_loss: 0.9586, test_f1: 0.5529
 epoch: 78, train_loss: 0.8358, test_loss: 1.0126, test_f1: 0.5220
 epoch: 79, train_loss: 0.8345, test_loss: 0.9941, test_f1: 0.5581
 epoch: 80, train_loss: 0.8190, test_loss: 1.0101, test_f1: 0.5431
 epoch: 81, train_loss: 0.8189, test_loss: 0.9606, test_f1: 0.5776
 epoch: 82, train_loss: 0.8198, test_loss: 1.0189, test_f1: 0.5487
 epoch: 83, train_loss: 0.8268, test_loss: 0.9504, test_f1: 0.5693
 epoch: 84, train_loss: 0.8243, test_loss: 0.9420, test_f1: 0.5914
 epoch: 85, train_loss: 0.8193, test_loss: 1.0149, test_f1: 0.5413
 epoch: 86, train_loss: 0.8179, test_loss: 0.9815, test_f1: 0.5605
 epoch: 87, train_loss: 0.8107, test_loss: 0.9585, test_f1: 0.5838
 epoch: 88, train_loss: 0.8266, test_loss: 0.9765, test_f1: 0.5669
 epoch: 89, train_loss: 0.8371, test_loss: 1.0241, test_f1: 0.5180
 epoch: 90, train_loss: 0.8572, test_loss: 1.0425, test_f1: 0.5304
 epoch: 91, train_loss: 0.8346, test_loss: 0.9685, test_f1: 0.5474
 epoch: 92, train_loss: 0.8222, test_loss: 0.9748, test_f1: 0.5900
 epoch: 93, train_loss: 0.8077, test_loss: 0.9669, test_f1: 0.5913
 epoch: 94, train_loss: 0.8192, test_loss: 0.9401, test_f1: 0.5707
 epoch: 95, train_loss: 0.8000, test_loss: 0.9601, test_f1: 0.5318
 epoch: 96, train_loss: 0.7991, test_loss: 0.9780, test_f1: 0.5649
 epoch: 97, train_loss: 0.7996, test_loss: 0.9659, test_f1: 0.5689
 epoch: 98, train_loss: 0.8023, test_loss: 0.9394, test_f1: 0.5434
 epoch: 99, train_loss: 0.8031, test_loss: 0.9899, test_f1: 0.5546
##################ITERATION #9 ****************************************
 epoch: 0, train_loss: 1.2807, test_loss: 1.1911, test_f1: 0.4599
 epoch: 1, train_loss: 1.1953, test_loss: 1.0938, test_f1: 0.4298
 epoch: 2, train_loss: 1.1590, test_loss: 1.0422, test_f1: 0.4647
 epoch: 3, train_loss: 1.1292, test_loss: 1.0482, test_f1: 0.4533
 epoch: 4, train_loss: 1.1176, test_loss: 1.0446, test_f1: 0.4221
 epoch: 5, train_loss: 1.0884, test_loss: 1.0485, test_f1: 0.4448
 epoch: 6, train_loss: 1.0535, test_loss: 0.9954, test_f1: 0.4553
 epoch: 7, train_loss: 1.0601, test_loss: 0.9633, test_f1: 0.4563
 epoch: 8, train_loss: 1.0424, test_loss: 0.9458, test_f1: 0.4681
 epoch: 9, train_loss: 1.0218, test_loss: 1.0299, test_f1: 0.4771
 epoch: 10, train_loss: 1.0223, test_loss: 1.0746, test_f1: 0.4785
 epoch: 11, train_loss: 1.0096, test_loss: 0.9742, test_f1: 0.4573
 epoch: 12, train_loss: 1.0074, test_loss: 1.0192, test_f1: 0.4806
 epoch: 13, train_loss: 1.0212, test_loss: 0.9979, test_f1: 0.5094
 epoch: 14, train_loss: 0.9951, test_loss: 1.0240, test_f1: 0.4731
 epoch: 15, train_loss: 0.9940, test_loss: 0.9948, test_f1: 0.4938
 epoch: 16, train_loss: 0.9815, test_loss: 0.9955, test_f1: 0.5108
 epoch: 17, train_loss: 0.9830, test_loss: 0.9711, test_f1: 0.5465
 epoch: 18, train_loss: 0.9768, test_loss: 0.9767, test_f1: 0.5222
 epoch: 19, train_loss: 0.9736, test_loss: 0.9813, test_f1: 0.4624
 epoch: 20, train_loss: 0.9559, test_loss: 0.9296, test_f1: 0.5089
 epoch: 21, train_loss: 0.9408, test_loss: 1.0220, test_f1: 0.4863
 epoch: 22, train_loss: 0.9611, test_loss: 0.9390, test_f1: 0.4932
 epoch: 23, train_loss: 0.9448, test_loss: 1.0580, test_f1: 0.4912
 epoch: 24, train_loss: 0.9451, test_loss: 0.9790, test_f1: 0.5012
 epoch: 25, train_loss: 0.9544, test_loss: 1.0528, test_f1: 0.4883
 epoch: 26, train_loss: 0.9475, test_loss: 0.9692, test_f1: 0.4993
 epoch: 27, train_loss: 0.9538, test_loss: 1.0756, test_f1: 0.4693
 epoch: 28, train_loss: 0.9347, test_loss: 1.0615, test_f1: 0.4850
 epoch: 29, train_loss: 0.9385, test_loss: 1.0212, test_f1: 0.4862
 epoch: 30, train_loss: 0.9372, test_loss: 0.9650, test_f1: 0.5054
 epoch: 31, train_loss: 0.9269, test_loss: 1.0198, test_f1: 0.4976
 epoch: 32, train_loss: 0.9304, test_loss: 0.9814, test_f1: 0.5028
 epoch: 33, train_loss: 0.9381, test_loss: 2.4547, test_f1: 0.4786
 epoch: 34, train_loss: 0.9370, test_loss: 1.0781, test_f1: 0.5024
 epoch: 35, train_loss: 0.9268, test_loss: 1.0531, test_f1: 0.4822
 epoch: 36, train_loss: 0.9206, test_loss: 1.0516, test_f1: 0.5100
 epoch: 37, train_loss: 0.9186, test_loss: 1.0405, test_f1: 0.5253
 epoch: 38, train_loss: 0.9227, test_loss: 1.0281, test_f1: 0.5290
 epoch: 39, train_loss: 0.9288, test_loss: 0.9629, test_f1: 0.5193
 epoch: 40, train_loss: 0.9193, test_loss: 1.0559, test_f1: 0.5162
 epoch: 41, train_loss: 0.9158, test_loss: 0.9755, test_f1: 0.5276
 epoch: 42, train_loss: 0.9191, test_loss: 1.0309, test_f1: 0.5124
 epoch: 43, train_loss: 0.9352, test_loss: 0.9863, test_f1: 0.5077
 epoch: 44, train_loss: 0.9182, test_loss: 0.9797, test_f1: 0.5145
 epoch: 45, train_loss: 0.9111, test_loss: 0.9778, test_f1: 0.5409
 epoch: 46, train_loss: 0.9107, test_loss: 0.9963, test_f1: 0.5094
 epoch: 47, train_loss: 0.9042, test_loss: 0.9899, test_f1: 0.5060
 epoch: 48, train_loss: 0.8926, test_loss: 1.2387, test_f1: 0.5208
 epoch: 49, train_loss: 0.9023, test_loss: 0.9990, test_f1: 0.5587
 epoch: 50, train_loss: 0.9015, test_loss: 0.9850, test_f1: 0.5194
 epoch: 51, train_loss: 0.8784, test_loss: 0.9549, test_f1: 0.5223
 epoch: 52, train_loss: 0.8744, test_loss: 0.9644, test_f1: 0.5323
 epoch: 53, train_loss: 0.8686, test_loss: 1.1208, test_f1: 0.5250
 epoch: 54, train_loss: 0.8761, test_loss: 0.9549, test_f1: 0.5521
 epoch: 55, train_loss: 0.8673, test_loss: 1.0971, test_f1: 0.5121
 epoch: 56, train_loss: 0.8695, test_loss: 0.9503, test_f1: 0.5523
 epoch: 57, train_loss: 0.8716, test_loss: 0.9823, test_f1: 0.5388
 epoch: 58, train_loss: 0.8598, test_loss: 1.1038, test_f1: 0.5375
 epoch: 59, train_loss: 0.8632, test_loss: 0.9625, test_f1: 0.5145
 epoch: 60, train_loss: 0.8572, test_loss: 1.1014, test_f1: 0.5380
 epoch: 61, train_loss: 0.8572, test_loss: 1.0857, test_f1: 0.5361
 epoch: 62, train_loss: 0.8513, test_loss: 0.9685, test_f1: 0.5544
 epoch: 63, train_loss: 0.8494, test_loss: 0.9468, test_f1: 0.5772
 epoch: 64, train_loss: 0.8585, test_loss: 0.9655, test_f1: 0.5310
 epoch: 65, train_loss: 0.8647, test_loss: 0.9828, test_f1: 0.5256
 epoch: 66, train_loss: 0.8442, test_loss: 1.1335, test_f1: 0.5182
 epoch: 67, train_loss: 0.8459, test_loss: 1.1550, test_f1: 0.5584
 epoch: 68, train_loss: 0.8486, test_loss: 0.9669, test_f1: 0.5660
 epoch: 69, train_loss: 0.8484, test_loss: 1.1028, test_f1: 0.5315
 epoch: 70, train_loss: 0.8424, test_loss: 1.0010, test_f1: 0.5508
 epoch: 71, train_loss: 0.8438, test_loss: 1.0549, test_f1: 0.5243
 epoch: 72, train_loss: 0.8277, test_loss: 0.9599, test_f1: 0.5548
 epoch: 73, train_loss: 0.8341, test_loss: 0.9591, test_f1: 0.5263
 epoch: 74, train_loss: 0.8431, test_loss: 1.0236, test_f1: 0.5763
 epoch: 75, train_loss: 0.8341, test_loss: 0.9700, test_f1: 0.5374
 epoch: 76, train_loss: 0.8210, test_loss: 0.9581, test_f1: 0.5379
 epoch: 77, train_loss: 0.8276, test_loss: 0.9724, test_f1: 0.5840
 epoch: 78, train_loss: 0.8344, test_loss: 0.9556, test_f1: 0.5214
 epoch: 79, train_loss: 0.8243, test_loss: 0.9370, test_f1: 0.5370
 epoch: 80, train_loss: 0.8377, test_loss: 0.9924, test_f1: 0.5557
 epoch: 81, train_loss: 0.8336, test_loss: 0.9707, test_f1: 0.5348
 epoch: 82, train_loss: 0.8360, test_loss: 1.0040, test_f1: 0.5345
 epoch: 83, train_loss: 0.8216, test_loss: 0.9565, test_f1: 0.5393
 epoch: 84, train_loss: 0.8345, test_loss: 0.9763, test_f1: 0.5284
 epoch: 85, train_loss: 0.8224, test_loss: 0.9656, test_f1: 0.5750
 epoch: 86, train_loss: 0.8269, test_loss: 0.9550, test_f1: 0.5727
 epoch: 87, train_loss: 0.8162, test_loss: 1.0290, test_f1: 0.5421
 epoch: 88, train_loss: 0.8241, test_loss: 1.0882, test_f1: 0.5628
 epoch: 89, train_loss: 0.8318, test_loss: 1.1046, test_f1: 0.4982
 epoch: 90, train_loss: 0.9634, test_loss: 0.9507, test_f1: 0.5683
 epoch: 91, train_loss: 0.9106, test_loss: 0.9829, test_f1: 0.5354
 epoch: 92, train_loss: 0.8970, test_loss: 0.9639, test_f1: 0.5510
 epoch: 93, train_loss: 0.8832, test_loss: 0.9655, test_f1: 0.5494
 epoch: 94, train_loss: 0.8757, test_loss: 1.0168, test_f1: 0.5072
 epoch: 95, train_loss: 0.8655, test_loss: 0.9653, test_f1: 0.5389
 epoch: 96, train_loss: 0.8599, test_loss: 0.9727, test_f1: 0.5083
 epoch: 97, train_loss: 0.8589, test_loss: 0.9813, test_f1: 0.5436
 epoch: 98, train_loss: 0.8463, test_loss: 0.9482, test_f1: 0.5210
 epoch: 99, train_loss: 0.8513, test_loss: 0.9627, test_f1: 0.5671

Training completed in 1108.23 seconds
Best F1: 0.5914 at epoch 84
Mean F1 across iterations: 0.5634  0.0213
========================FINAL RESULTS================================
FEGIN weighted F1: 0.5914  0.0213
python main.py --data ltspice_examples --representation component_component --model FEGIN --layers 4 --hiddens 16 --batch_size 32 --lr 0.01 --emb_size 512 --epochs 100 --save_appendix component_component_L4_H16_BS32_LR0.01_E512 --no_val
-----



STDERR:
  File "main.py", line 370, in <module>
    main()
  File "main.py", line 254, in main
    dataset = dataset_class(
  File "/home/philip/projects/ltspice_examples_code_repo/Circuit-Completion-Using-GNNs/component_classification_with_link_prediction_head/evaluation/FEGIN/kernel/circuit_datasets.py", line 15, in __init__
    self.data, self.slices = torch.load(self.processed_paths[0])
  File "/home/philip/.local/lib/python3.8/site-packages/torch/serialization.py", line 1040, in load
    warnings.warn(
  File "/usr/lib/python3.8/warnings.py", line 109, in _showwarnmsg
    sw(msg.message, msg.category, msg.filename, msg.lineno,
  File "main.py", line 47, in warn_with_traceback
    traceback.print_stack(file=log)
/home/philip/projects/ltspice_examples_code_repo/Circuit-Completion-Using-GNNs/component_classification_with_link_prediction_head/evaluation/FEGIN/kernel/circuit_datasets.py:15: FutureWarning: You are using `torch.load` with `weights_only=False` (the current default value), which uses the default pickle module implicitly. It is possible to construct malicious pickle data which will execute arbitrary code during unpickling (See https://github.com/pytorch/pytorch/blob/main/SECURITY.md#untrusted-models for more details). In a future release, the default value for `weights_only` will be flipped to `True`. This limits the functions that could be executed during unpickling. Arbitrary objects will no longer be allowed to be loaded via this mode unless they are explicitly allowlisted by the user via `torch.serialization.add_safe_globals`. We recommend you start setting `weights_only=True` for any use case where you don't have full control of the loaded file. Please open an issue on GitHub for any issues related to this experimental feature.
  self.data, self.slices = torch.load(self.processed_paths[0])
