STDOUT:
Results will be saved in /home/philip/projects/ltspice_examples_code_repo/Circuit-Completion-Using-GNNs/component_classification_with_link_prediction_head/evaluation/FEGIN/results/model_FEGIN_dataset_ltspice_demos
Command line input: python main.py --data ltspice_demos --representation component_pin --model FEGIN --layers 5 --hiddens 64 --batch_size 128 --lr 0.001 --emb_size 250 --epochs 100 --save_appendix component_pin_L5_H64_BS128_LR0.001_E250 --no_val
 is saved.
-----
ltspice_demos - FEGIN
Using 5 layers, 64 hidden units, h = 2
Loading component_pin representation dataset
ENTERED
Training FEGIN on component_pin representation
Train: 1565, Test: 383
##################ITERATION #0 ****************************************
 epoch: 0, train_loss: 1.3560, test_loss: 1.3411, test_f1: 0.1365
 epoch: 1, train_loss: 1.2288, test_loss: 1.2952, test_f1: 0.3453
 epoch: 2, train_loss: 1.1610, test_loss: 1.2613, test_f1: 0.3494
 epoch: 3, train_loss: 1.1259, test_loss: 1.2234, test_f1: 0.3623
 epoch: 4, train_loss: 1.0883, test_loss: 1.2009, test_f1: 0.4387
 epoch: 5, train_loss: 1.0389, test_loss: 1.1393, test_f1: 0.4443
 epoch: 6, train_loss: 0.9903, test_loss: 1.0781, test_f1: 0.4581
 epoch: 7, train_loss: 0.9458, test_loss: 1.0722, test_f1: 0.4733
 epoch: 8, train_loss: 0.9307, test_loss: 1.0405, test_f1: 0.5226
 epoch: 9, train_loss: 0.9194, test_loss: 1.0983, test_f1: 0.5081
 epoch: 10, train_loss: 0.8887, test_loss: 1.0997, test_f1: 0.4860
 epoch: 11, train_loss: 0.8572, test_loss: 1.0215, test_f1: 0.5583
 epoch: 12, train_loss: 0.8396, test_loss: 1.0834, test_f1: 0.5575
 epoch: 13, train_loss: 0.8333, test_loss: 1.0003, test_f1: 0.6052
 epoch: 14, train_loss: 0.7971, test_loss: 1.0186, test_f1: 0.5829
 epoch: 15, train_loss: 0.7626, test_loss: 1.0603, test_f1: 0.5167
 epoch: 16, train_loss: 0.7455, test_loss: 0.9712, test_f1: 0.6234
 epoch: 17, train_loss: 0.7404, test_loss: 1.1160, test_f1: 0.5118
 epoch: 18, train_loss: 0.7401, test_loss: 1.0131, test_f1: 0.5980
 epoch: 19, train_loss: 0.7162, test_loss: 1.0641, test_f1: 0.5540
 epoch: 20, train_loss: 0.7161, test_loss: 1.0010, test_f1: 0.5771
 epoch: 21, train_loss: 0.6906, test_loss: 1.0614, test_f1: 0.5744
 epoch: 22, train_loss: 0.6904, test_loss: 1.0582, test_f1: 0.5728
 epoch: 23, train_loss: 0.6738, test_loss: 1.0746, test_f1: 0.5718
 epoch: 24, train_loss: 0.6607, test_loss: 1.1330, test_f1: 0.5485
 epoch: 25, train_loss: 0.6609, test_loss: 1.0100, test_f1: 0.5761
 epoch: 26, train_loss: 0.6342, test_loss: 1.0836, test_f1: 0.5407
 epoch: 27, train_loss: 0.6395, test_loss: 1.0377, test_f1: 0.5763
 epoch: 28, train_loss: 0.6624, test_loss: 1.0915, test_f1: 0.5696
 epoch: 29, train_loss: 0.6204, test_loss: 1.0134, test_f1: 0.5976
 epoch: 30, train_loss: 0.6013, test_loss: 1.1232, test_f1: 0.5710
 epoch: 31, train_loss: 0.6097, test_loss: 1.1857, test_f1: 0.5275
 epoch: 32, train_loss: 0.6114, test_loss: 1.0484, test_f1: 0.6084
 epoch: 33, train_loss: 0.5967, test_loss: 1.0619, test_f1: 0.5185
 epoch: 34, train_loss: 0.5657, test_loss: 1.1480, test_f1: 0.5439
 epoch: 35, train_loss: 0.5755, test_loss: 1.0916, test_f1: 0.5859
 epoch: 36, train_loss: 0.5669, test_loss: 1.0949, test_f1: 0.5824
 epoch: 37, train_loss: 0.5554, test_loss: 1.0880, test_f1: 0.5765
 epoch: 38, train_loss: 0.5516, test_loss: 1.1438, test_f1: 0.5755
 epoch: 39, train_loss: 0.5353, test_loss: 1.2064, test_f1: 0.5405
 epoch: 40, train_loss: 0.5264, test_loss: 1.2177, test_f1: 0.5953
 epoch: 41, train_loss: 0.5141, test_loss: 1.2016, test_f1: 0.5931
 epoch: 42, train_loss: 0.5147, test_loss: 1.1275, test_f1: 0.6090
 epoch: 43, train_loss: 0.5004, test_loss: 1.2733, test_f1: 0.5753
 epoch: 44, train_loss: 0.4519, test_loss: 1.3010, test_f1: 0.5839
 epoch: 45, train_loss: 0.4588, test_loss: 1.2220, test_f1: 0.6173
 epoch: 46, train_loss: 0.4698, test_loss: 1.2570, test_f1: 0.6041
 epoch: 47, train_loss: 0.4600, test_loss: 1.2554, test_f1: 0.6075
 epoch: 48, train_loss: 0.4595, test_loss: 1.2496, test_f1: 0.6034
 epoch: 49, train_loss: 0.4209, test_loss: 1.2228, test_f1: 0.6465
 epoch: 50, train_loss: 0.4239, test_loss: 1.3135, test_f1: 0.6453
 epoch: 51, train_loss: 0.3904, test_loss: 1.3674, test_f1: 0.5518
 epoch: 52, train_loss: 0.3807, test_loss: 1.3617, test_f1: 0.5988
 epoch: 53, train_loss: 0.3496, test_loss: 1.4061, test_f1: 0.6351
 epoch: 54, train_loss: 0.3593, test_loss: 1.3705, test_f1: 0.5967
 epoch: 55, train_loss: 0.3357, test_loss: 1.3300, test_f1: 0.6331
 epoch: 56, train_loss: 0.3055, test_loss: 1.4543, test_f1: 0.6393
 epoch: 57, train_loss: 0.2980, test_loss: 1.4565, test_f1: 0.5937
 epoch: 58, train_loss: 0.2986, test_loss: 1.4344, test_f1: 0.6291
 epoch: 59, train_loss: 0.2873, test_loss: 1.5672, test_f1: 0.6157
 epoch: 60, train_loss: 0.3135, test_loss: 1.6111, test_f1: 0.6230
 epoch: 61, train_loss: 0.2996, test_loss: 1.5324, test_f1: 0.6109
 epoch: 62, train_loss: 0.2864, test_loss: 1.5014, test_f1: 0.6080
 epoch: 63, train_loss: 0.2856, test_loss: 1.4871, test_f1: 0.6163
 epoch: 64, train_loss: 0.2792, test_loss: 1.5258, test_f1: 0.6056
 epoch: 65, train_loss: 0.3033, test_loss: 1.5296, test_f1: 0.6069
 epoch: 66, train_loss: 0.2712, test_loss: 1.5704, test_f1: 0.5921
 epoch: 67, train_loss: 0.2793, test_loss: 1.6142, test_f1: 0.6336
 epoch: 68, train_loss: 0.2709, test_loss: 1.7383, test_f1: 0.5610
 epoch: 69, train_loss: 0.2465, test_loss: 1.5223, test_f1: 0.6297
 epoch: 70, train_loss: 0.2508, test_loss: 1.7885, test_f1: 0.5955
 epoch: 71, train_loss: 0.2541, test_loss: 1.6311, test_f1: 0.6273
 epoch: 72, train_loss: 0.2311, test_loss: 1.6367, test_f1: 0.5880
 epoch: 73, train_loss: 0.2473, test_loss: 1.6869, test_f1: 0.6104
 epoch: 74, train_loss: 0.2205, test_loss: 1.7328, test_f1: 0.5661
 epoch: 75, train_loss: 0.2022, test_loss: 1.6511, test_f1: 0.6296
 epoch: 76, train_loss: 0.2220, test_loss: 1.7397, test_f1: 0.6067
 epoch: 77, train_loss: 0.2242, test_loss: 1.7137, test_f1: 0.6300
 epoch: 78, train_loss: 0.2154, test_loss: 1.6196, test_f1: 0.6467
 epoch: 79, train_loss: 0.2047, test_loss: 1.9126, test_f1: 0.5999
 epoch: 80, train_loss: 0.2085, test_loss: 1.7664, test_f1: 0.5974
 epoch: 81, train_loss: 0.2288, test_loss: 1.7713, test_f1: 0.6070
 epoch: 82, train_loss: 0.2233, test_loss: 1.8578, test_f1: 0.6106
 epoch: 83, train_loss: 0.2423, test_loss: 1.8407, test_f1: 0.6565
 epoch: 84, train_loss: 0.2233, test_loss: 1.7166, test_f1: 0.6269
 epoch: 85, train_loss: 0.2242, test_loss: 1.5971, test_f1: 0.6381
 epoch: 86, train_loss: 0.2258, test_loss: 1.6672, test_f1: 0.6221
 epoch: 87, train_loss: 0.2291, test_loss: 1.8375, test_f1: 0.6350
 epoch: 88, train_loss: 0.2041, test_loss: 1.7577, test_f1: 0.6419
 epoch: 89, train_loss: 0.1985, test_loss: 1.7857, test_f1: 0.6288
 epoch: 90, train_loss: 0.2099, test_loss: 1.7781, test_f1: 0.6316
 epoch: 91, train_loss: 0.1856, test_loss: 1.8744, test_f1: 0.6372
 epoch: 92, train_loss: 0.1773, test_loss: 1.8290, test_f1: 0.6422
 epoch: 93, train_loss: 0.1778, test_loss: 2.1597, test_f1: 0.5747
 epoch: 94, train_loss: 0.1758, test_loss: 1.9831, test_f1: 0.6108
 epoch: 95, train_loss: 0.1986, test_loss: 2.0361, test_f1: 0.6195
 epoch: 96, train_loss: 0.1888, test_loss: 1.9903, test_f1: 0.6615
 epoch: 97, train_loss: 0.1758, test_loss: 1.9134, test_f1: 0.6247
 epoch: 98, train_loss: 0.2158, test_loss: 2.0601, test_f1: 0.5805
 epoch: 99, train_loss: 0.1708, test_loss: 2.1190, test_f1: 0.6201
##################ITERATION #1 ****************************************
 epoch: 0, train_loss: 1.2351, test_loss: 1.2999, test_f1: 0.3103
 epoch: 1, train_loss: 1.0885, test_loss: 1.2864, test_f1: 0.2613
 epoch: 2, train_loss: 0.9976, test_loss: 1.2842, test_f1: 0.2616
 epoch: 3, train_loss: 0.9408, test_loss: 1.1613, test_f1: 0.3027
 epoch: 4, train_loss: 0.8880, test_loss: 1.0968, test_f1: 0.5228
 epoch: 5, train_loss: 0.8349, test_loss: 1.0609, test_f1: 0.5271
 epoch: 6, train_loss: 0.8075, test_loss: 1.0304, test_f1: 0.5376
 epoch: 7, train_loss: 0.7859, test_loss: 1.0375, test_f1: 0.5500
 epoch: 8, train_loss: 0.7602, test_loss: 1.0053, test_f1: 0.5747
 epoch: 9, train_loss: 0.7285, test_loss: 1.0453, test_f1: 0.5778
 epoch: 10, train_loss: 0.6975, test_loss: 1.0886, test_f1: 0.5810
 epoch: 11, train_loss: 0.6998, test_loss: 1.1263, test_f1: 0.5866
 epoch: 12, train_loss: 0.6840, test_loss: 1.1259, test_f1: 0.5674
 epoch: 13, train_loss: 0.6692, test_loss: 1.1709, test_f1: 0.5679
 epoch: 14, train_loss: 0.6503, test_loss: 1.1451, test_f1: 0.5676
 epoch: 15, train_loss: 0.6548, test_loss: 1.1672, test_f1: 0.5634
 epoch: 16, train_loss: 0.6486, test_loss: 1.0653, test_f1: 0.5743
 epoch: 17, train_loss: 0.6311, test_loss: 0.9820, test_f1: 0.6365
 epoch: 18, train_loss: 0.6094, test_loss: 1.1164, test_f1: 0.5972
 epoch: 19, train_loss: 0.5900, test_loss: 1.1086, test_f1: 0.6217
 epoch: 20, train_loss: 0.5639, test_loss: 1.0417, test_f1: 0.6428
 epoch: 21, train_loss: 0.5332, test_loss: 1.2064, test_f1: 0.5935
 epoch: 22, train_loss: 0.5608, test_loss: 1.1488, test_f1: 0.6032
 epoch: 23, train_loss: 0.5506, test_loss: 1.1421, test_f1: 0.6110
 epoch: 24, train_loss: 0.5668, test_loss: 1.1054, test_f1: 0.6233
 epoch: 25, train_loss: 0.5606, test_loss: 1.3345, test_f1: 0.5378
 epoch: 26, train_loss: 0.5297, test_loss: 1.1521, test_f1: 0.6388
 epoch: 27, train_loss: 0.5355, test_loss: 1.1710, test_f1: 0.5901
 epoch: 28, train_loss: 0.5213, test_loss: 1.2293, test_f1: 0.5450
 epoch: 29, train_loss: 0.4897, test_loss: 1.1446, test_f1: 0.5931
 epoch: 30, train_loss: 0.4693, test_loss: 1.1716, test_f1: 0.6419
 epoch: 31, train_loss: 0.4686, test_loss: 1.0963, test_f1: 0.6513
 epoch: 32, train_loss: 0.4440, test_loss: 1.3681, test_f1: 0.6408
 epoch: 33, train_loss: 0.4184, test_loss: 1.3434, test_f1: 0.5600
 epoch: 34, train_loss: 0.4201, test_loss: 1.3172, test_f1: 0.6290
 epoch: 35, train_loss: 0.4112, test_loss: 1.3498, test_f1: 0.5829
 epoch: 36, train_loss: 0.3943, test_loss: 1.3412, test_f1: 0.6414
 epoch: 37, train_loss: 0.4164, test_loss: 1.3636, test_f1: 0.6261
 epoch: 38, train_loss: 0.4067, test_loss: 1.3799, test_f1: 0.6232
 epoch: 39, train_loss: 0.3916, test_loss: 1.5746, test_f1: 0.6498
 epoch: 40, train_loss: 0.3678, test_loss: 1.3913, test_f1: 0.5973
 epoch: 41, train_loss: 0.3724, test_loss: 1.6271, test_f1: 0.5579
 epoch: 42, train_loss: 0.4015, test_loss: 1.4093, test_f1: 0.6310
 epoch: 43, train_loss: 0.3775, test_loss: 1.4768, test_f1: 0.6485
 epoch: 44, train_loss: 0.3484, test_loss: 1.4722, test_f1: 0.6116
 epoch: 45, train_loss: 0.3386, test_loss: 1.4145, test_f1: 0.6628
 epoch: 46, train_loss: 0.3165, test_loss: 1.3976, test_f1: 0.6196
 epoch: 47, train_loss: 0.3233, test_loss: 1.5989, test_f1: 0.6326
 epoch: 48, train_loss: 0.3415, test_loss: 1.5068, test_f1: 0.6307
 epoch: 49, train_loss: 0.3493, test_loss: 1.5647, test_f1: 0.6103
 epoch: 50, train_loss: 0.3122, test_loss: 1.5820, test_f1: 0.6189
 epoch: 51, train_loss: 0.2829, test_loss: 1.6000, test_f1: 0.6388
 epoch: 52, train_loss: 0.2517, test_loss: 1.8175, test_f1: 0.6448
 epoch: 53, train_loss: 0.2416, test_loss: 1.6681, test_f1: 0.6541
 epoch: 54, train_loss: 0.2368, test_loss: 1.5791, test_f1: 0.6643
 epoch: 55, train_loss: 0.2219, test_loss: 1.6761, test_f1: 0.6353
 epoch: 56, train_loss: 0.2007, test_loss: 1.7659, test_f1: 0.6388
 epoch: 57, train_loss: 0.2083, test_loss: 1.7748, test_f1: 0.6559
 epoch: 58, train_loss: 0.2071, test_loss: 1.7649, test_f1: 0.6538
 epoch: 59, train_loss: 0.1965, test_loss: 1.8633, test_f1: 0.6739
 epoch: 60, train_loss: 0.1858, test_loss: 1.9229, test_f1: 0.6515
 epoch: 61, train_loss: 0.1994, test_loss: 1.9221, test_f1: 0.6542
 epoch: 62, train_loss: 0.2108, test_loss: 2.0993, test_f1: 0.6259
 epoch: 63, train_loss: 0.1903, test_loss: 1.7874, test_f1: 0.6780
 epoch: 64, train_loss: 0.1962, test_loss: 2.1226, test_f1: 0.6075
 epoch: 65, train_loss: 0.2091, test_loss: 2.0935, test_f1: 0.6492
 epoch: 66, train_loss: 0.2278, test_loss: 2.0810, test_f1: 0.5955
 epoch: 67, train_loss: 0.1684, test_loss: 2.1540, test_f1: 0.6248
 epoch: 68, train_loss: 0.1783, test_loss: 2.1251, test_f1: 0.6566
 epoch: 69, train_loss: 0.1939, test_loss: 1.9378, test_f1: 0.6517
 epoch: 70, train_loss: 0.1875, test_loss: 2.1475, test_f1: 0.6194
 epoch: 71, train_loss: 0.2107, test_loss: 2.3983, test_f1: 0.5687
 epoch: 72, train_loss: 0.2017, test_loss: 2.0843, test_f1: 0.6438
 epoch: 73, train_loss: 0.1850, test_loss: 2.0389, test_f1: 0.6545
 epoch: 74, train_loss: 0.1624, test_loss: 2.2054, test_f1: 0.6421
 epoch: 75, train_loss: 0.1691, test_loss: 2.1674, test_f1: 0.6172
 epoch: 76, train_loss: 0.1539, test_loss: 2.2297, test_f1: 0.6390
 epoch: 77, train_loss: 0.1427, test_loss: 2.1758, test_f1: 0.6619
 epoch: 78, train_loss: 0.1472, test_loss: 2.1871, test_f1: 0.6233
 epoch: 79, train_loss: 0.1500, test_loss: 2.3996, test_f1: 0.6203
 epoch: 80, train_loss: 0.1715, test_loss: 2.3453, test_f1: 0.6344
 epoch: 81, train_loss: 0.1649, test_loss: 2.2272, test_f1: 0.6406
 epoch: 82, train_loss: 0.1800, test_loss: 2.2489, test_f1: 0.6213
 epoch: 83, train_loss: 0.1552, test_loss: 2.2217, test_f1: 0.6032
 epoch: 84, train_loss: 0.1782, test_loss: 2.0540, test_f1: 0.6075
 epoch: 85, train_loss: 0.1885, test_loss: 2.4549, test_f1: 0.5909
 epoch: 86, train_loss: 0.1375, test_loss: 2.4680, test_f1: 0.6310
 epoch: 87, train_loss: 0.1446, test_loss: 2.5327, test_f1: 0.6158
 epoch: 88, train_loss: 0.1403, test_loss: 2.1918, test_f1: 0.6517
 epoch: 89, train_loss: 0.1507, test_loss: 2.3024, test_f1: 0.6547
 epoch: 90, train_loss: 0.1232, test_loss: 2.3685, test_f1: 0.6138
 epoch: 91, train_loss: 0.1428, test_loss: 2.3222, test_f1: 0.6383
 epoch: 92, train_loss: 0.1400, test_loss: 2.3383, test_f1: 0.6200
 epoch: 93, train_loss: 0.1124, test_loss: 2.4110, test_f1: 0.6235
 epoch: 94, train_loss: 0.1012, test_loss: 2.4402, test_f1: 0.6032
 epoch: 95, train_loss: 0.1124, test_loss: 2.4996, test_f1: 0.6326
 epoch: 96, train_loss: 0.1212, test_loss: 2.6537, test_f1: 0.6336
 epoch: 97, train_loss: 0.1155, test_loss: 2.4977, test_f1: 0.6217
 epoch: 98, train_loss: 0.1131, test_loss: 2.4931, test_f1: 0.6390
 epoch: 99, train_loss: 0.1199, test_loss: 2.6948, test_f1: 0.6018
##################ITERATION #2 ****************************************
 epoch: 0, train_loss: 1.2412, test_loss: 1.3022, test_f1: 0.3391
 epoch: 1, train_loss: 1.0605, test_loss: 1.3465, test_f1: 0.1869
 epoch: 2, train_loss: 0.9745, test_loss: 1.3280, test_f1: 0.3495
 epoch: 3, train_loss: 0.9245, test_loss: 1.2087, test_f1: 0.3721
 epoch: 4, train_loss: 0.8789, test_loss: 1.0938, test_f1: 0.5531
 epoch: 5, train_loss: 0.8403, test_loss: 0.9887, test_f1: 0.5702
 epoch: 6, train_loss: 0.8225, test_loss: 0.9433, test_f1: 0.6282
 epoch: 7, train_loss: 0.8061, test_loss: 0.9907, test_f1: 0.5667
 epoch: 8, train_loss: 0.7682, test_loss: 0.9535, test_f1: 0.6011
 epoch: 9, train_loss: 0.7698, test_loss: 1.0281, test_f1: 0.5415
 epoch: 10, train_loss: 0.7412, test_loss: 1.2405, test_f1: 0.5312
 epoch: 11, train_loss: 0.7325, test_loss: 1.0033, test_f1: 0.5703
 epoch: 12, train_loss: 0.6946, test_loss: 0.9679, test_f1: 0.5809
 epoch: 13, train_loss: 0.6793, test_loss: 1.1684, test_f1: 0.6095
 epoch: 14, train_loss: 0.6563, test_loss: 1.0490, test_f1: 0.6044
 epoch: 15, train_loss: 0.6670, test_loss: 1.1507, test_f1: 0.4791
 epoch: 16, train_loss: 0.6444, test_loss: 1.0181, test_f1: 0.6066
 epoch: 17, train_loss: 0.6326, test_loss: 1.0637, test_f1: 0.5355
 epoch: 18, train_loss: 0.6263, test_loss: 1.3220, test_f1: 0.5423
 epoch: 19, train_loss: 0.6497, test_loss: 1.0184, test_f1: 0.5865
 epoch: 20, train_loss: 0.6279, test_loss: 1.0425, test_f1: 0.5537
 epoch: 21, train_loss: 0.6011, test_loss: 1.0854, test_f1: 0.6109
 epoch: 22, train_loss: 0.5757, test_loss: 1.0351, test_f1: 0.6048
 epoch: 23, train_loss: 0.5713, test_loss: 1.3861, test_f1: 0.4698
 epoch: 24, train_loss: 0.5535, test_loss: 1.1870, test_f1: 0.5762
 epoch: 25, train_loss: 0.5814, test_loss: 1.3932, test_f1: 0.5288
 epoch: 26, train_loss: 0.5505, test_loss: 0.9827, test_f1: 0.6294
 epoch: 27, train_loss: 0.5243, test_loss: 1.6577, test_f1: 0.4763
 epoch: 28, train_loss: 0.4984, test_loss: 1.1622, test_f1: 0.6121
 epoch: 29, train_loss: 0.4704, test_loss: 1.2492, test_f1: 0.5826
 epoch: 30, train_loss: 0.4625, test_loss: 1.2833, test_f1: 0.5473
 epoch: 31, train_loss: 0.4789, test_loss: 1.2363, test_f1: 0.5655
 epoch: 32, train_loss: 0.5046, test_loss: 1.3385, test_f1: 0.5231
 epoch: 33, train_loss: 0.4703, test_loss: 1.3513, test_f1: 0.5795
 epoch: 34, train_loss: 0.4493, test_loss: 1.3489, test_f1: 0.5791
 epoch: 35, train_loss: 0.4287, test_loss: 1.2735, test_f1: 0.5952
 epoch: 36, train_loss: 0.4846, test_loss: 1.3501, test_f1: 0.6122
 epoch: 37, train_loss: 0.4574, test_loss: 1.9407, test_f1: 0.4609
 epoch: 38, train_loss: 0.5215, test_loss: 1.2261, test_f1: 0.6017
 epoch: 39, train_loss: 0.4539, test_loss: 1.3445, test_f1: 0.5835
 epoch: 40, train_loss: 0.4140, test_loss: 1.3342, test_f1: 0.5640
 epoch: 41, train_loss: 0.3969, test_loss: 1.4610, test_f1: 0.6154
 epoch: 42, train_loss: 0.4068, test_loss: 1.6376, test_f1: 0.5030
 epoch: 43, train_loss: 0.4016, test_loss: 1.2873, test_f1: 0.6166
 epoch: 44, train_loss: 0.3928, test_loss: 1.3331, test_f1: 0.5975
 epoch: 45, train_loss: 0.3659, test_loss: 1.6105, test_f1: 0.5305
 epoch: 46, train_loss: 0.3784, test_loss: 1.6232, test_f1: 0.5704
 epoch: 47, train_loss: 0.3384, test_loss: 1.7330, test_f1: 0.5944
 epoch: 48, train_loss: 0.3391, test_loss: 1.6197, test_f1: 0.5912
 epoch: 49, train_loss: 0.4014, test_loss: 1.5778, test_f1: 0.6015
 epoch: 50, train_loss: 0.3657, test_loss: 1.4887, test_f1: 0.5746
 epoch: 51, train_loss: 0.3369, test_loss: 1.4678, test_f1: 0.6112
 epoch: 52, train_loss: 0.2992, test_loss: 1.4458, test_f1: 0.6318
 epoch: 53, train_loss: 0.2718, test_loss: 1.5550, test_f1: 0.6116
 epoch: 54, train_loss: 0.2798, test_loss: 1.4997, test_f1: 0.6243
 epoch: 55, train_loss: 0.2634, test_loss: 1.7069, test_f1: 0.6034
 epoch: 56, train_loss: 0.2616, test_loss: 1.6953, test_f1: 0.6074
 epoch: 57, train_loss: 0.2452, test_loss: 1.8123, test_f1: 0.5941
 epoch: 58, train_loss: 0.2208, test_loss: 1.9966, test_f1: 0.5749
 epoch: 59, train_loss: 0.2400, test_loss: 1.7019, test_f1: 0.6120
 epoch: 60, train_loss: 0.2380, test_loss: 1.8916, test_f1: 0.5756
 epoch: 61, train_loss: 0.2433, test_loss: 1.9901, test_f1: 0.5578
 epoch: 62, train_loss: 0.2416, test_loss: 1.8434, test_f1: 0.5888
 epoch: 63, train_loss: 0.2277, test_loss: 1.9617, test_f1: 0.5797
 epoch: 64, train_loss: 0.2256, test_loss: 1.8326, test_f1: 0.5769
 epoch: 65, train_loss: 0.2463, test_loss: 1.9381, test_f1: 0.5976
 epoch: 66, train_loss: 0.2037, test_loss: 1.7834, test_f1: 0.6308
 epoch: 67, train_loss: 0.2030, test_loss: 1.9542, test_f1: 0.5908
 epoch: 68, train_loss: 0.2066, test_loss: 2.1751, test_f1: 0.5734
 epoch: 69, train_loss: 0.1985, test_loss: 2.1187, test_f1: 0.5860
 epoch: 70, train_loss: 0.2233, test_loss: 2.1870, test_f1: 0.5668
 epoch: 71, train_loss: 0.2080, test_loss: 1.9606, test_f1: 0.6342
 epoch: 72, train_loss: 0.1867, test_loss: 2.2720, test_f1: 0.5568
 epoch: 73, train_loss: 0.1997, test_loss: 2.1222, test_f1: 0.5925
 epoch: 74, train_loss: 0.2047, test_loss: 1.9239, test_f1: 0.6268
 epoch: 75, train_loss: 0.1884, test_loss: 1.7013, test_f1: 0.6462
 epoch: 76, train_loss: 0.2211, test_loss: 1.9932, test_f1: 0.5976
 epoch: 77, train_loss: 0.2077, test_loss: 2.1408, test_f1: 0.5841
 epoch: 78, train_loss: 0.2025, test_loss: 2.2664, test_f1: 0.5465
 epoch: 79, train_loss: 0.1969, test_loss: 2.1580, test_f1: 0.5943
 epoch: 80, train_loss: 0.1842, test_loss: 2.0628, test_f1: 0.6357
 epoch: 81, train_loss: 0.2018, test_loss: 2.3741, test_f1: 0.5707
 epoch: 82, train_loss: 0.1676, test_loss: 2.3405, test_f1: 0.5695
 epoch: 83, train_loss: 0.1713, test_loss: 2.2962, test_f1: 0.6020
 epoch: 84, train_loss: 0.2029, test_loss: 2.2429, test_f1: 0.5788
 epoch: 85, train_loss: 0.1738, test_loss: 2.1516, test_f1: 0.6156
 epoch: 86, train_loss: 0.1730, test_loss: 2.3133, test_f1: 0.5781
 epoch: 87, train_loss: 0.1612, test_loss: 2.3430, test_f1: 0.5883
 epoch: 88, train_loss: 0.1556, test_loss: 2.3891, test_f1: 0.5956
 epoch: 89, train_loss: 0.1759, test_loss: 2.4203, test_f1: 0.6009
 epoch: 90, train_loss: 0.1521, test_loss: 2.5071, test_f1: 0.5931
 epoch: 91, train_loss: 0.1716, test_loss: 2.2743, test_f1: 0.6037
 epoch: 92, train_loss: 0.1566, test_loss: 2.4629, test_f1: 0.5894
 epoch: 93, train_loss: 0.1779, test_loss: 2.4953, test_f1: 0.5867
 epoch: 94, train_loss: 0.1460, test_loss: 2.1155, test_f1: 0.6566
 epoch: 95, train_loss: 0.1700, test_loss: 2.2184, test_f1: 0.6144
 epoch: 96, train_loss: 0.1944, test_loss: 2.4214, test_f1: 0.6253
 epoch: 97, train_loss: 0.1627, test_loss: 2.5942, test_f1: 0.6068
 epoch: 98, train_loss: 0.1772, test_loss: 2.6161, test_f1: 0.5935
 epoch: 99, train_loss: 0.1782, test_loss: 2.2001, test_f1: 0.5924
##################ITERATION #3 ****************************************
 epoch: 0, train_loss: 1.2230, test_loss: 1.2972, test_f1: 0.2976
 epoch: 1, train_loss: 1.0589, test_loss: 1.3555, test_f1: 0.2630
 epoch: 2, train_loss: 0.9784, test_loss: 1.2797, test_f1: 0.3357
 epoch: 3, train_loss: 0.9353, test_loss: 1.2017, test_f1: 0.4658
 epoch: 4, train_loss: 0.8941, test_loss: 1.0473, test_f1: 0.5608
 epoch: 5, train_loss: 0.8706, test_loss: 1.0210, test_f1: 0.5681
 epoch: 6, train_loss: 0.8208, test_loss: 1.0147, test_f1: 0.5700
 epoch: 7, train_loss: 0.8049, test_loss: 1.0570, test_f1: 0.5756
 epoch: 8, train_loss: 0.7739, test_loss: 1.0767, test_f1: 0.5250
 epoch: 9, train_loss: 0.7672, test_loss: 1.0284, test_f1: 0.5321
 epoch: 10, train_loss: 0.7333, test_loss: 1.1906, test_f1: 0.4647
 epoch: 11, train_loss: 0.7324, test_loss: 1.0653, test_f1: 0.5645
 epoch: 12, train_loss: 0.6799, test_loss: 1.0723, test_f1: 0.5615
 epoch: 13, train_loss: 0.6646, test_loss: 1.5665, test_f1: 0.4829
 epoch: 14, train_loss: 0.6998, test_loss: 1.1349, test_f1: 0.5625
 epoch: 15, train_loss: 0.6490, test_loss: 1.1242, test_f1: 0.5796
 epoch: 16, train_loss: 0.6090, test_loss: 1.0703, test_f1: 0.5567
 epoch: 17, train_loss: 0.6284, test_loss: 1.0486, test_f1: 0.6293
 epoch: 18, train_loss: 0.5816, test_loss: 1.1538, test_f1: 0.5862
 epoch: 19, train_loss: 0.5707, test_loss: 1.1299, test_f1: 0.5893
 epoch: 20, train_loss: 0.5720, test_loss: 1.2009, test_f1: 0.5652
 epoch: 21, train_loss: 0.5451, test_loss: 1.1391, test_f1: 0.6588
 epoch: 22, train_loss: 0.5216, test_loss: 1.2810, test_f1: 0.6190
 epoch: 23, train_loss: 0.5242, test_loss: 1.2425, test_f1: 0.5625
 epoch: 24, train_loss: 0.5289, test_loss: 1.4386, test_f1: 0.5308
 epoch: 25, train_loss: 0.5642, test_loss: 1.6855, test_f1: 0.5435
 epoch: 26, train_loss: 0.5221, test_loss: 1.1503, test_f1: 0.6168
 epoch: 27, train_loss: 0.4861, test_loss: 1.1209, test_f1: 0.6091
 epoch: 28, train_loss: 0.4922, test_loss: 1.4380, test_f1: 0.5351
 epoch: 29, train_loss: 0.4732, test_loss: 1.3264, test_f1: 0.5510
 epoch: 30, train_loss: 0.4616, test_loss: 1.2183, test_f1: 0.5804
 epoch: 31, train_loss: 0.4519, test_loss: 1.3367, test_f1: 0.5161
 epoch: 32, train_loss: 0.4477, test_loss: 1.3468, test_f1: 0.6315
 epoch: 33, train_loss: 0.4285, test_loss: 1.4016, test_f1: 0.5706
 epoch: 34, train_loss: 0.3993, test_loss: 1.4199, test_f1: 0.5801
 epoch: 35, train_loss: 0.3984, test_loss: 1.5414, test_f1: 0.5815
 epoch: 36, train_loss: 0.4110, test_loss: 1.3228, test_f1: 0.5797
 epoch: 37, train_loss: 0.4615, test_loss: 1.4870, test_f1: 0.5871
 epoch: 38, train_loss: 0.4006, test_loss: 1.8807, test_f1: 0.4978
 epoch: 39, train_loss: 0.3917, test_loss: 1.4622, test_f1: 0.5634
 epoch: 40, train_loss: 0.3726, test_loss: 1.5880, test_f1: 0.5803
 epoch: 41, train_loss: 0.3403, test_loss: 1.6620, test_f1: 0.6024
 epoch: 42, train_loss: 0.3610, test_loss: 1.5361, test_f1: 0.6288
 epoch: 43, train_loss: 0.3740, test_loss: 1.6639, test_f1: 0.5799
 epoch: 44, train_loss: 0.3722, test_loss: 1.5457, test_f1: 0.5789
 epoch: 45, train_loss: 0.3569, test_loss: 1.6115, test_f1: 0.5897
 epoch: 46, train_loss: 0.3439, test_loss: 1.6796, test_f1: 0.5782
 epoch: 47, train_loss: 0.3298, test_loss: 1.7024, test_f1: 0.6021
 epoch: 48, train_loss: 0.3570, test_loss: 1.4110, test_f1: 0.6165
 epoch: 49, train_loss: 0.3655, test_loss: 1.6850, test_f1: 0.5970
 epoch: 50, train_loss: 0.3065, test_loss: 1.7396, test_f1: 0.5860
 epoch: 51, train_loss: 0.2778, test_loss: 1.7991, test_f1: 0.5810
 epoch: 52, train_loss: 0.2545, test_loss: 1.7414, test_f1: 0.5737
 epoch: 53, train_loss: 0.2324, test_loss: 1.7404, test_f1: 0.6044
 epoch: 54, train_loss: 0.2391, test_loss: 1.7642, test_f1: 0.5854
 epoch: 55, train_loss: 0.2474, test_loss: 2.0038, test_f1: 0.5836
 epoch: 56, train_loss: 0.2189, test_loss: 2.0226, test_f1: 0.5693
 epoch: 57, train_loss: 0.2264, test_loss: 2.0572, test_f1: 0.5688
 epoch: 58, train_loss: 0.2020, test_loss: 2.1036, test_f1: 0.5958
 epoch: 59, train_loss: 0.2066, test_loss: 2.0199, test_f1: 0.5805
 epoch: 60, train_loss: 0.2064, test_loss: 2.1098, test_f1: 0.5786
 epoch: 61, train_loss: 0.2121, test_loss: 2.2696, test_f1: 0.5763
 epoch: 62, train_loss: 0.1857, test_loss: 2.1077, test_f1: 0.5779
 epoch: 63, train_loss: 0.2021, test_loss: 2.2270, test_f1: 0.5974
 epoch: 64, train_loss: 0.2175, test_loss: 2.2446, test_f1: 0.5584
 epoch: 65, train_loss: 0.2198, test_loss: 2.2279, test_f1: 0.5735
 epoch: 66, train_loss: 0.2057, test_loss: 2.2875, test_f1: 0.5697
 epoch: 67, train_loss: 0.1867, test_loss: 2.3557, test_f1: 0.5783
 epoch: 68, train_loss: 0.1955, test_loss: 2.2477, test_f1: 0.5825
 epoch: 69, train_loss: 0.1754, test_loss: 2.3304, test_f1: 0.5667
 epoch: 70, train_loss: 0.1858, test_loss: 2.2875, test_f1: 0.5890
 epoch: 71, train_loss: 0.1969, test_loss: 2.4866, test_f1: 0.5865
 epoch: 72, train_loss: 0.1822, test_loss: 2.4450, test_f1: 0.5758
 epoch: 73, train_loss: 0.1985, test_loss: 2.3813, test_f1: 0.5824
 epoch: 74, train_loss: 0.2035, test_loss: 2.4194, test_f1: 0.5643
 epoch: 75, train_loss: 0.2149, test_loss: 2.6531, test_f1: 0.5653
 epoch: 76, train_loss: 0.2236, test_loss: 2.5543, test_f1: 0.5349
 epoch: 77, train_loss: 0.1935, test_loss: 2.5734, test_f1: 0.5453
 epoch: 78, train_loss: 0.1739, test_loss: 2.6273, test_f1: 0.5734
 epoch: 79, train_loss: 0.1691, test_loss: 2.6545, test_f1: 0.5747
 epoch: 80, train_loss: 0.1552, test_loss: 2.6459, test_f1: 0.5675
 epoch: 81, train_loss: 0.1462, test_loss: 2.6834, test_f1: 0.5784
 epoch: 82, train_loss: 0.1677, test_loss: 2.4965, test_f1: 0.5919
 epoch: 83, train_loss: 0.1401, test_loss: 2.5814, test_f1: 0.5893
 epoch: 84, train_loss: 0.1483, test_loss: 2.7688, test_f1: 0.5952
 epoch: 85, train_loss: 0.1571, test_loss: 2.9394, test_f1: 0.5691
 epoch: 86, train_loss: 0.1353, test_loss: 2.8274, test_f1: 0.5768
 epoch: 87, train_loss: 0.1440, test_loss: 2.6801, test_f1: 0.5944
 epoch: 88, train_loss: 0.1284, test_loss: 2.7745, test_f1: 0.5651
 epoch: 89, train_loss: 0.1437, test_loss: 2.8787, test_f1: 0.5685
 epoch: 90, train_loss: 0.1735, test_loss: 2.8467, test_f1: 0.5538
 epoch: 91, train_loss: 0.1630, test_loss: 2.7569, test_f1: 0.5823
 epoch: 92, train_loss: 0.1251, test_loss: 2.7073, test_f1: 0.5877
 epoch: 93, train_loss: 0.1269, test_loss: 2.8826, test_f1: 0.5654
 epoch: 94, train_loss: 0.1280, test_loss: 2.8980, test_f1: 0.5743
 epoch: 95, train_loss: 0.1236, test_loss: 2.9065, test_f1: 0.5740
 epoch: 96, train_loss: 0.1127, test_loss: 2.9863, test_f1: 0.5722
 epoch: 97, train_loss: 0.1314, test_loss: 2.8018, test_f1: 0.5792
 epoch: 98, train_loss: 0.1305, test_loss: 2.9529, test_f1: 0.5671
 epoch: 99, train_loss: 0.1552, test_loss: 2.8392, test_f1: 0.5813
##################ITERATION #4 ****************************************
 epoch: 0, train_loss: 1.2548, test_loss: 1.3464, test_f1: 0.1408
 epoch: 1, train_loss: 1.0614, test_loss: 1.3881, test_f1: 0.2327
 epoch: 2, train_loss: 0.9791, test_loss: 1.3100, test_f1: 0.4051
 epoch: 3, train_loss: 0.9334, test_loss: 1.1443, test_f1: 0.4885
 epoch: 4, train_loss: 0.8964, test_loss: 0.9882, test_f1: 0.5754
 epoch: 5, train_loss: 0.8610, test_loss: 0.9970, test_f1: 0.5861
 epoch: 6, train_loss: 0.8266, test_loss: 1.0139, test_f1: 0.5638
 epoch: 7, train_loss: 0.7775, test_loss: 1.0935, test_f1: 0.5238
 epoch: 8, train_loss: 0.7639, test_loss: 1.0354, test_f1: 0.5785
 epoch: 9, train_loss: 0.7414, test_loss: 1.0251, test_f1: 0.5837
 epoch: 10, train_loss: 0.7141, test_loss: 1.1222, test_f1: 0.5394
 epoch: 11, train_loss: 0.7125, test_loss: 1.2007, test_f1: 0.5613
 epoch: 12, train_loss: 0.7105, test_loss: 1.2668, test_f1: 0.5233
 epoch: 13, train_loss: 0.7054, test_loss: 1.2105, test_f1: 0.5249
 epoch: 14, train_loss: 0.6799, test_loss: 1.2208, test_f1: 0.5734
 epoch: 15, train_loss: 0.6334, test_loss: 1.1184, test_f1: 0.5736
 epoch: 16, train_loss: 0.6247, test_loss: 1.2910, test_f1: 0.5482
 epoch: 17, train_loss: 0.6174, test_loss: 1.3638, test_f1: 0.5860
 epoch: 18, train_loss: 0.5987, test_loss: 1.2324, test_f1: 0.5702
 epoch: 19, train_loss: 0.6245, test_loss: 1.3114, test_f1: 0.5322
 epoch: 20, train_loss: 0.6394, test_loss: 1.1672, test_f1: 0.5951
 epoch: 21, train_loss: 0.5792, test_loss: 1.4379, test_f1: 0.5560
 epoch: 22, train_loss: 0.5904, test_loss: 1.2801, test_f1: 0.5986
 epoch: 23, train_loss: 0.5671, test_loss: 1.1908, test_f1: 0.6399
 epoch: 24, train_loss: 0.5412, test_loss: 1.3299, test_f1: 0.5796
 epoch: 25, train_loss: 0.5290, test_loss: 1.7674, test_f1: 0.5858
 epoch: 26, train_loss: 0.5408, test_loss: 1.6339, test_f1: 0.5816
 epoch: 27, train_loss: 0.5444, test_loss: 1.6022, test_f1: 0.5396
 epoch: 28, train_loss: 0.5104, test_loss: 1.3272, test_f1: 0.6372
 epoch: 29, train_loss: 0.5023, test_loss: 1.3530, test_f1: 0.6455
 epoch: 30, train_loss: 0.4855, test_loss: 1.5106, test_f1: 0.5841
 epoch: 31, train_loss: 0.4609, test_loss: 1.6178, test_f1: 0.6245
 epoch: 32, train_loss: 0.4505, test_loss: 1.5129, test_f1: 0.6556
 epoch: 33, train_loss: 0.4669, test_loss: 1.5787, test_f1: 0.6184
 epoch: 34, train_loss: 0.4651, test_loss: 1.5844, test_f1: 0.6285
 epoch: 35, train_loss: 0.4642, test_loss: 1.4835, test_f1: 0.6249
 epoch: 36, train_loss: 0.4409, test_loss: 1.6589, test_f1: 0.6138
 epoch: 37, train_loss: 0.4011, test_loss: 1.6969, test_f1: 0.5919
 epoch: 38, train_loss: 0.4201, test_loss: 1.7288, test_f1: 0.5801
 epoch: 39, train_loss: 0.3928, test_loss: 1.7195, test_f1: 0.5837
 epoch: 40, train_loss: 0.4268, test_loss: 1.7064, test_f1: 0.5738
 epoch: 41, train_loss: 0.4163, test_loss: 1.9211, test_f1: 0.5803
 epoch: 42, train_loss: 0.4077, test_loss: 1.6288, test_f1: 0.6057
 epoch: 43, train_loss: 0.3737, test_loss: 1.8172, test_f1: 0.5781
 epoch: 44, train_loss: 0.3572, test_loss: 1.7612, test_f1: 0.5856
 epoch: 45, train_loss: 0.3506, test_loss: 1.9372, test_f1: 0.5807
 epoch: 46, train_loss: 0.3370, test_loss: 1.9256, test_f1: 0.5811
 epoch: 47, train_loss: 0.4111, test_loss: 1.7640, test_f1: 0.5853
 epoch: 48, train_loss: 0.3701, test_loss: 1.5756, test_f1: 0.6022
 epoch: 49, train_loss: 0.3631, test_loss: 1.9639, test_f1: 0.5884
 epoch: 50, train_loss: 0.3584, test_loss: 1.8519, test_f1: 0.6317
 epoch: 51, train_loss: 0.3087, test_loss: 1.6618, test_f1: 0.6127
 epoch: 52, train_loss: 0.2957, test_loss: 1.7360, test_f1: 0.6132
 epoch: 53, train_loss: 0.2793, test_loss: 1.8192, test_f1: 0.6135
 epoch: 54, train_loss: 0.2626, test_loss: 1.8819, test_f1: 0.5959
 epoch: 55, train_loss: 0.2598, test_loss: 1.8902, test_f1: 0.5709
 epoch: 56, train_loss: 0.2370, test_loss: 1.8406, test_f1: 0.5604
 epoch: 57, train_loss: 0.2323, test_loss: 1.8384, test_f1: 0.6020
 epoch: 58, train_loss: 0.2180, test_loss: 1.9114, test_f1: 0.6249
 epoch: 59, train_loss: 0.2349, test_loss: 2.1342, test_f1: 0.5635
 epoch: 60, train_loss: 0.2157, test_loss: 2.0307, test_f1: 0.6047
 epoch: 61, train_loss: 0.2274, test_loss: 2.1263, test_f1: 0.6122
 epoch: 62, train_loss: 0.2372, test_loss: 2.0406, test_f1: 0.5949
 epoch: 63, train_loss: 0.2110, test_loss: 1.9638, test_f1: 0.6135
 epoch: 64, train_loss: 0.2360, test_loss: 1.9718, test_f1: 0.6015
 epoch: 65, train_loss: 0.2178, test_loss: 2.0787, test_f1: 0.6265
 epoch: 66, train_loss: 0.2044, test_loss: 2.3580, test_f1: 0.6278
 epoch: 67, train_loss: 0.2365, test_loss: 2.1241, test_f1: 0.6372
 epoch: 68, train_loss: 0.2157, test_loss: 2.3190, test_f1: 0.6165
 epoch: 69, train_loss: 0.2027, test_loss: 2.0368, test_f1: 0.6348
 epoch: 70, train_loss: 0.2068, test_loss: 2.3393, test_f1: 0.5949
 epoch: 71, train_loss: 0.1744, test_loss: 2.2609, test_f1: 0.6256
 epoch: 72, train_loss: 0.1684, test_loss: 2.1869, test_f1: 0.6158
 epoch: 73, train_loss: 0.1442, test_loss: 2.1749, test_f1: 0.6022
 epoch: 74, train_loss: 0.1560, test_loss: 2.3969, test_f1: 0.6141
 epoch: 75, train_loss: 0.1710, test_loss: 2.4376, test_f1: 0.6071
 epoch: 76, train_loss: 0.1710, test_loss: 2.3393, test_f1: 0.6443
 epoch: 77, train_loss: 0.1701, test_loss: 2.3263, test_f1: 0.6000
 epoch: 78, train_loss: 0.1719, test_loss: 2.5002, test_f1: 0.6207
 epoch: 79, train_loss: 0.1602, test_loss: 2.4075, test_f1: 0.6246
 epoch: 80, train_loss: 0.1813, test_loss: 2.3746, test_f1: 0.6313
 epoch: 81, train_loss: 0.1740, test_loss: 2.4655, test_f1: 0.6118
 epoch: 82, train_loss: 0.1655, test_loss: 2.5164, test_f1: 0.5904
 epoch: 83, train_loss: 0.1657, test_loss: 2.3914, test_f1: 0.6126
 epoch: 84, train_loss: 0.1553, test_loss: 2.6601, test_f1: 0.5729
 epoch: 85, train_loss: 0.1620, test_loss: 2.7526, test_f1: 0.6048
 epoch: 86, train_loss: 0.1788, test_loss: 2.4223, test_f1: 0.6240
 epoch: 87, train_loss: 0.1751, test_loss: 2.3100, test_f1: 0.6303
 epoch: 88, train_loss: 0.1567, test_loss: 2.5210, test_f1: 0.6269
 epoch: 89, train_loss: 0.1697, test_loss: 2.7448, test_f1: 0.5984
 epoch: 90, train_loss: 0.1870, test_loss: 2.8759, test_f1: 0.6079
 epoch: 91, train_loss: 0.1516, test_loss: 2.7996, test_f1: 0.6049
 epoch: 92, train_loss: 0.1511, test_loss: 2.5647, test_f1: 0.6089
 epoch: 93, train_loss: 0.1467, test_loss: 2.4544, test_f1: 0.6252
 epoch: 94, train_loss: 0.1667, test_loss: 2.4842, test_f1: 0.5948
 epoch: 95, train_loss: 0.1337, test_loss: 2.8073, test_f1: 0.6267
 epoch: 96, train_loss: 0.1288, test_loss: 2.8143, test_f1: 0.5892
 epoch: 97, train_loss: 0.1540, test_loss: 2.5064, test_f1: 0.6096
 epoch: 98, train_loss: 0.1503, test_loss: 2.5111, test_f1: 0.6373
 epoch: 99, train_loss: 0.1356, test_loss: 2.7798, test_f1: 0.6176
##################ITERATION #5 ****************************************
 epoch: 0, train_loss: 1.2496, test_loss: 1.3598, test_f1: 0.1365
 epoch: 1, train_loss: 1.0830, test_loss: 1.3946, test_f1: 0.3371
 epoch: 2, train_loss: 0.9984, test_loss: 1.2925, test_f1: 0.3624
 epoch: 3, train_loss: 0.9332, test_loss: 1.2147, test_f1: 0.4281
 epoch: 4, train_loss: 0.9170, test_loss: 1.1014, test_f1: 0.5010
 epoch: 5, train_loss: 0.8704, test_loss: 1.0759, test_f1: 0.5367
 epoch: 6, train_loss: 0.8347, test_loss: 1.0978, test_f1: 0.4956
 epoch: 7, train_loss: 0.8080, test_loss: 1.0623, test_f1: 0.5341
 epoch: 8, train_loss: 0.7750, test_loss: 1.0464, test_f1: 0.5449
 epoch: 9, train_loss: 0.7600, test_loss: 1.1185, test_f1: 0.5593
 epoch: 10, train_loss: 0.7596, test_loss: 0.9986, test_f1: 0.5867
 epoch: 11, train_loss: 0.7189, test_loss: 1.1250, test_f1: 0.5316
 epoch: 12, train_loss: 0.6978, test_loss: 1.1678, test_f1: 0.5050
 epoch: 13, train_loss: 0.6855, test_loss: 1.1067, test_f1: 0.5587
 epoch: 14, train_loss: 0.6550, test_loss: 1.1740, test_f1: 0.5330
 epoch: 15, train_loss: 0.6585, test_loss: 1.0963, test_f1: 0.5833
 epoch: 16, train_loss: 0.6316, test_loss: 1.1618, test_f1: 0.5954
 epoch: 17, train_loss: 0.6406, test_loss: 1.1898, test_f1: 0.5668
 epoch: 18, train_loss: 0.6367, test_loss: 1.1489, test_f1: 0.5612
 epoch: 19, train_loss: 0.6053, test_loss: 1.0196, test_f1: 0.5666
 epoch: 20, train_loss: 0.5993, test_loss: 1.1574, test_f1: 0.5642
 epoch: 21, train_loss: 0.5593, test_loss: 1.1214, test_f1: 0.6054
 epoch: 22, train_loss: 0.5638, test_loss: 1.0662, test_f1: 0.6076
 epoch: 23, train_loss: 0.5421, test_loss: 1.1631, test_f1: 0.5655
 epoch: 24, train_loss: 0.5464, test_loss: 1.2876, test_f1: 0.5777
 epoch: 25, train_loss: 0.5377, test_loss: 1.2862, test_f1: 0.5373
 epoch: 26, train_loss: 0.5166, test_loss: 1.1012, test_f1: 0.5597
 epoch: 27, train_loss: 0.5089, test_loss: 1.2707, test_f1: 0.5670
 epoch: 28, train_loss: 0.5206, test_loss: 1.2863, test_f1: 0.5821
 epoch: 29, train_loss: 0.4965, test_loss: 1.2972, test_f1: 0.5712
 epoch: 30, train_loss: 0.4551, test_loss: 1.3219, test_f1: 0.5597
 epoch: 31, train_loss: 0.4773, test_loss: 1.4530, test_f1: 0.5316
 epoch: 32, train_loss: 0.4766, test_loss: 1.3244, test_f1: 0.6200
 epoch: 33, train_loss: 0.4464, test_loss: 1.4140, test_f1: 0.5547
 epoch: 34, train_loss: 0.4400, test_loss: 1.5081, test_f1: 0.6017
 epoch: 35, train_loss: 0.4386, test_loss: 1.4634, test_f1: 0.6030
 epoch: 36, train_loss: 0.4026, test_loss: 1.4022, test_f1: 0.5954
 epoch: 37, train_loss: 0.4150, test_loss: 1.3747, test_f1: 0.6121
 epoch: 38, train_loss: 0.4080, test_loss: 1.5467, test_f1: 0.5928
 epoch: 39, train_loss: 0.4036, test_loss: 1.3570, test_f1: 0.5976
 epoch: 40, train_loss: 0.4241, test_loss: 1.2404, test_f1: 0.6339
 epoch: 41, train_loss: 0.4178, test_loss: 1.6515, test_f1: 0.5450
 epoch: 42, train_loss: 0.3955, test_loss: 1.4276, test_f1: 0.5842
 epoch: 43, train_loss: 0.3834, test_loss: 1.3409, test_f1: 0.5843
 epoch: 44, train_loss: 0.3768, test_loss: 1.6927, test_f1: 0.5889
 epoch: 45, train_loss: 0.3944, test_loss: 1.5253, test_f1: 0.5837
 epoch: 46, train_loss: 0.3714, test_loss: 1.4960, test_f1: 0.5627
 epoch: 47, train_loss: 0.3624, test_loss: 1.5443, test_f1: 0.5997
 epoch: 48, train_loss: 0.3415, test_loss: 1.5272, test_f1: 0.6118
 epoch: 49, train_loss: 0.3645, test_loss: 1.7329, test_f1: 0.5973
 epoch: 50, train_loss: 0.3809, test_loss: 1.4364, test_f1: 0.6166
 epoch: 51, train_loss: 0.3086, test_loss: 1.5401, test_f1: 0.6321
 epoch: 52, train_loss: 0.2853, test_loss: 1.5309, test_f1: 0.6196
 epoch: 53, train_loss: 0.2549, test_loss: 1.5688, test_f1: 0.6115
 epoch: 54, train_loss: 0.2429, test_loss: 1.6750, test_f1: 0.6150
 epoch: 55, train_loss: 0.2415, test_loss: 1.6708, test_f1: 0.6226
 epoch: 56, train_loss: 0.2312, test_loss: 1.7441, test_f1: 0.6077
 epoch: 57, train_loss: 0.2347, test_loss: 1.7045, test_f1: 0.6212
 epoch: 58, train_loss: 0.2212, test_loss: 1.9014, test_f1: 0.6238
 epoch: 59, train_loss: 0.2192, test_loss: 1.8935, test_f1: 0.6125
 epoch: 60, train_loss: 0.2114, test_loss: 1.9416, test_f1: 0.6025
 epoch: 61, train_loss: 0.2228, test_loss: 1.8621, test_f1: 0.6235
 epoch: 62, train_loss: 0.2493, test_loss: 1.9064, test_f1: 0.6207
 epoch: 63, train_loss: 0.2057, test_loss: 1.8840, test_f1: 0.6257
 epoch: 64, train_loss: 0.2150, test_loss: 1.9877, test_f1: 0.5963
 epoch: 65, train_loss: 0.1934, test_loss: 1.7225, test_f1: 0.6278
 epoch: 66, train_loss: 0.1861, test_loss: 1.9161, test_f1: 0.6136
 epoch: 67, train_loss: 0.1839, test_loss: 1.8273, test_f1: 0.6243
 epoch: 68, train_loss: 0.1898, test_loss: 2.0873, test_f1: 0.6096
 epoch: 69, train_loss: 0.1996, test_loss: 1.9279, test_f1: 0.5940
 epoch: 70, train_loss: 0.2160, test_loss: 2.1893, test_f1: 0.5937
 epoch: 71, train_loss: 0.2161, test_loss: 2.1188, test_f1: 0.6001
 epoch: 72, train_loss: 0.2198, test_loss: 2.0542, test_f1: 0.6172
 epoch: 73, train_loss: 0.2106, test_loss: 2.0739, test_f1: 0.6066
 epoch: 74, train_loss: 0.1911, test_loss: 2.0141, test_f1: 0.6218
 epoch: 75, train_loss: 0.1705, test_loss: 2.2073, test_f1: 0.5913
 epoch: 76, train_loss: 0.1770, test_loss: 2.4085, test_f1: 0.5861
 epoch: 77, train_loss: 0.1899, test_loss: 2.5174, test_f1: 0.5484
 epoch: 78, train_loss: 0.1704, test_loss: 2.2717, test_f1: 0.5899
 epoch: 79, train_loss: 0.1565, test_loss: 2.4405, test_f1: 0.6064
 epoch: 80, train_loss: 0.1804, test_loss: 2.3256, test_f1: 0.6039
 epoch: 81, train_loss: 0.1672, test_loss: 2.1173, test_f1: 0.6174
 epoch: 82, train_loss: 0.1472, test_loss: 2.0573, test_f1: 0.5702
 epoch: 83, train_loss: 0.1686, test_loss: 2.1422, test_f1: 0.6067
 epoch: 84, train_loss: 0.1734, test_loss: 2.1121, test_f1: 0.6189
 epoch: 85, train_loss: 0.1870, test_loss: 2.3795, test_f1: 0.5870
 epoch: 86, train_loss: 0.1510, test_loss: 2.1913, test_f1: 0.6032
 epoch: 87, train_loss: 0.1307, test_loss: 2.3155, test_f1: 0.5934
 epoch: 88, train_loss: 0.1277, test_loss: 2.3016, test_f1: 0.6014
 epoch: 89, train_loss: 0.1643, test_loss: 2.4074, test_f1: 0.6341
 epoch: 90, train_loss: 0.1820, test_loss: 2.2920, test_f1: 0.6125
 epoch: 91, train_loss: 0.1881, test_loss: 2.2219, test_f1: 0.6200
 epoch: 92, train_loss: 0.1864, test_loss: 2.4207, test_f1: 0.5879
 epoch: 93, train_loss: 0.2124, test_loss: 2.6868, test_f1: 0.5817
 epoch: 94, train_loss: 0.1928, test_loss: 2.5809, test_f1: 0.5427
 epoch: 95, train_loss: 0.1941, test_loss: 2.5860, test_f1: 0.5613
 epoch: 96, train_loss: 0.1619, test_loss: 2.2174, test_f1: 0.6182
 epoch: 97, train_loss: 0.1472, test_loss: 2.1078, test_f1: 0.6178
 epoch: 98, train_loss: 0.1573, test_loss: 2.3065, test_f1: 0.6237
 epoch: 99, train_loss: 0.1771, test_loss: 2.2852, test_f1: 0.5823
##################ITERATION #6 ****************************************
 epoch: 0, train_loss: 1.2630, test_loss: 1.3449, test_f1: 0.2970
 epoch: 1, train_loss: 1.0529, test_loss: 1.3388, test_f1: 0.3092
 epoch: 2, train_loss: 0.9741, test_loss: 1.2011, test_f1: 0.4264
 epoch: 3, train_loss: 0.9084, test_loss: 1.1087, test_f1: 0.4756
 epoch: 4, train_loss: 0.9258, test_loss: 1.1702, test_f1: 0.5377
 epoch: 5, train_loss: 0.8864, test_loss: 1.1330, test_f1: 0.5639
 epoch: 6, train_loss: 0.8478, test_loss: 1.0488, test_f1: 0.5667
 epoch: 7, train_loss: 0.8304, test_loss: 1.0331, test_f1: 0.5420
 epoch: 8, train_loss: 0.8079, test_loss: 1.1587, test_f1: 0.5098
 epoch: 9, train_loss: 0.7670, test_loss: 1.0735, test_f1: 0.5203
 epoch: 10, train_loss: 0.7437, test_loss: 1.0480, test_f1: 0.5685
 epoch: 11, train_loss: 0.7674, test_loss: 1.0785, test_f1: 0.5694
 epoch: 12, train_loss: 0.7347, test_loss: 1.0172, test_f1: 0.5419
 epoch: 13, train_loss: 0.7161, test_loss: 1.0457, test_f1: 0.6288
 epoch: 14, train_loss: 0.6895, test_loss: 1.1605, test_f1: 0.5783
 epoch: 15, train_loss: 0.6646, test_loss: 1.0739, test_f1: 0.5717
 epoch: 16, train_loss: 0.6750, test_loss: 1.1793, test_f1: 0.5529
 epoch: 17, train_loss: 0.6665, test_loss: 1.0199, test_f1: 0.6181
 epoch: 18, train_loss: 0.6525, test_loss: 1.1382, test_f1: 0.5571
 epoch: 19, train_loss: 0.6564, test_loss: 1.0761, test_f1: 0.5604
 epoch: 20, train_loss: 0.6387, test_loss: 1.0737, test_f1: 0.5624
 epoch: 21, train_loss: 0.6255, test_loss: 1.0890, test_f1: 0.5339
 epoch: 22, train_loss: 0.6214, test_loss: 1.2601, test_f1: 0.5452
 epoch: 23, train_loss: 0.5897, test_loss: 1.2566, test_f1: 0.5583
 epoch: 24, train_loss: 0.5671, test_loss: 1.3805, test_f1: 0.5334
 epoch: 25, train_loss: 0.5723, test_loss: 1.2930, test_f1: 0.4946
 epoch: 26, train_loss: 0.5537, test_loss: 1.2737, test_f1: 0.5493
 epoch: 27, train_loss: 0.5338, test_loss: 1.1501, test_f1: 0.5920
 epoch: 28, train_loss: 0.5426, test_loss: 1.3751, test_f1: 0.5494
 epoch: 29, train_loss: 0.5418, test_loss: 1.3231, test_f1: 0.5402
 epoch: 30, train_loss: 0.5325, test_loss: 1.2219, test_f1: 0.5642
 epoch: 31, train_loss: 0.5136, test_loss: 1.3223, test_f1: 0.6064
 epoch: 32, train_loss: 0.5007, test_loss: 1.3851, test_f1: 0.5660
 epoch: 33, train_loss: 0.5066, test_loss: 1.4184, test_f1: 0.5515
 epoch: 34, train_loss: 0.5132, test_loss: 1.4395, test_f1: 0.5395
 epoch: 35, train_loss: 0.5010, test_loss: 1.3401, test_f1: 0.5718
 epoch: 36, train_loss: 0.4881, test_loss: 1.3268, test_f1: 0.5800
 epoch: 37, train_loss: 0.4958, test_loss: 1.2977, test_f1: 0.5772
 epoch: 38, train_loss: 0.4269, test_loss: 1.3578, test_f1: 0.5427
 epoch: 39, train_loss: 0.4409, test_loss: 1.5486, test_f1: 0.5635
 epoch: 40, train_loss: 0.4501, test_loss: 1.4638, test_f1: 0.5435
 epoch: 41, train_loss: 0.4174, test_loss: 1.3337, test_f1: 0.5968
 epoch: 42, train_loss: 0.3928, test_loss: 1.4490, test_f1: 0.5454
 epoch: 43, train_loss: 0.4243, test_loss: 1.5643, test_f1: 0.5562
 epoch: 44, train_loss: 0.3930, test_loss: 1.4681, test_f1: 0.5263
 epoch: 45, train_loss: 0.3805, test_loss: 1.3368, test_f1: 0.5869
 epoch: 46, train_loss: 0.3663, test_loss: 1.3908, test_f1: 0.6053
 epoch: 47, train_loss: 0.3843, test_loss: 1.4720, test_f1: 0.5580
 epoch: 48, train_loss: 0.3434, test_loss: 1.6104, test_f1: 0.5623
 epoch: 49, train_loss: 0.3156, test_loss: 1.6096, test_f1: 0.5913
 epoch: 50, train_loss: 0.3232, test_loss: 1.4976, test_f1: 0.6021
 epoch: 51, train_loss: 0.3015, test_loss: 1.5551, test_f1: 0.6314
 epoch: 52, train_loss: 0.2726, test_loss: 1.5741, test_f1: 0.6409
 epoch: 53, train_loss: 0.2560, test_loss: 1.6196, test_f1: 0.6193
 epoch: 54, train_loss: 0.2668, test_loss: 1.7069, test_f1: 0.5951
 epoch: 55, train_loss: 0.2703, test_loss: 1.7526, test_f1: 0.6087
 epoch: 56, train_loss: 0.2656, test_loss: 1.6084, test_f1: 0.6115
 epoch: 57, train_loss: 0.2469, test_loss: 1.6447, test_f1: 0.6394
 epoch: 58, train_loss: 0.2386, test_loss: 1.6146, test_f1: 0.6248
 epoch: 59, train_loss: 0.2741, test_loss: 1.6687, test_f1: 0.6400
 epoch: 60, train_loss: 0.2335, test_loss: 1.8396, test_f1: 0.5843
 epoch: 61, train_loss: 0.2194, test_loss: 1.7045, test_f1: 0.6084
 epoch: 62, train_loss: 0.2378, test_loss: 1.7411, test_f1: 0.6386
 epoch: 63, train_loss: 0.2649, test_loss: 1.6737, test_f1: 0.6144
 epoch: 64, train_loss: 0.2165, test_loss: 1.9143, test_f1: 0.5645
 epoch: 65, train_loss: 0.1984, test_loss: 1.7734, test_f1: 0.6317
 epoch: 66, train_loss: 0.2118, test_loss: 1.8237, test_f1: 0.5967
 epoch: 67, train_loss: 0.1968, test_loss: 1.8179, test_f1: 0.6369
 epoch: 68, train_loss: 0.1990, test_loss: 1.8854, test_f1: 0.6139
 epoch: 69, train_loss: 0.2292, test_loss: 1.9080, test_f1: 0.6041
 epoch: 70, train_loss: 0.2073, test_loss: 1.8475, test_f1: 0.6111
 epoch: 71, train_loss: 0.1861, test_loss: 1.7746, test_f1: 0.6455
 epoch: 72, train_loss: 0.1736, test_loss: 1.8705, test_f1: 0.6218
 epoch: 73, train_loss: 0.1793, test_loss: 1.7687, test_f1: 0.6646
 epoch: 74, train_loss: 0.1733, test_loss: 1.8100, test_f1: 0.6420
 epoch: 75, train_loss: 0.1603, test_loss: 1.9072, test_f1: 0.6219
 epoch: 76, train_loss: 0.1660, test_loss: 2.0229, test_f1: 0.6308
 epoch: 77, train_loss: 0.1668, test_loss: 1.9652, test_f1: 0.6380
 epoch: 78, train_loss: 0.1736, test_loss: 1.9827, test_f1: 0.6123
 epoch: 79, train_loss: 0.1588, test_loss: 1.9511, test_f1: 0.6025
 epoch: 80, train_loss: 0.1498, test_loss: 1.9600, test_f1: 0.6432
 epoch: 81, train_loss: 0.1474, test_loss: 2.0115, test_f1: 0.6168
 epoch: 82, train_loss: 0.1391, test_loss: 2.2483, test_f1: 0.5845
 epoch: 83, train_loss: 0.1394, test_loss: 1.9541, test_f1: 0.6120
 epoch: 84, train_loss: 0.1549, test_loss: 2.0701, test_f1: 0.6166
 epoch: 85, train_loss: 0.1499, test_loss: 2.1083, test_f1: 0.6315
 epoch: 86, train_loss: 0.2171, test_loss: 2.0039, test_f1: 0.5886
 epoch: 87, train_loss: 0.2091, test_loss: 2.0188, test_f1: 0.5849
 epoch: 88, train_loss: 0.1694, test_loss: 2.2278, test_f1: 0.5505
 epoch: 89, train_loss: 0.1744, test_loss: 2.0449, test_f1: 0.6064
 epoch: 90, train_loss: 0.1721, test_loss: 2.0255, test_f1: 0.6620
 epoch: 91, train_loss: 0.1491, test_loss: 2.0759, test_f1: 0.6254
 epoch: 92, train_loss: 0.1355, test_loss: 2.1125, test_f1: 0.5992
 epoch: 93, train_loss: 0.1892, test_loss: 2.1961, test_f1: 0.5767
 epoch: 94, train_loss: 0.1776, test_loss: 2.1021, test_f1: 0.6597
 epoch: 95, train_loss: 0.1519, test_loss: 2.1290, test_f1: 0.6140
 epoch: 96, train_loss: 0.1433, test_loss: 2.1895, test_f1: 0.6069
 epoch: 97, train_loss: 0.1410, test_loss: 2.1300, test_f1: 0.6267
 epoch: 98, train_loss: 0.1482, test_loss: 2.1358, test_f1: 0.6534
 epoch: 99, train_loss: 0.1370, test_loss: 2.1833, test_f1: 0.6065
##################ITERATION #7 ****************************************
 epoch: 0, train_loss: 1.3036, test_loss: 1.3649, test_f1: 0.3034
 epoch: 1, train_loss: 1.0616, test_loss: 1.3242, test_f1: 0.2238
 epoch: 2, train_loss: 1.0057, test_loss: 1.2527, test_f1: 0.2897
 epoch: 3, train_loss: 0.9465, test_loss: 1.1672, test_f1: 0.4335
 epoch: 4, train_loss: 0.9013, test_loss: 1.0352, test_f1: 0.5418
 epoch: 5, train_loss: 0.8598, test_loss: 0.9825, test_f1: 0.6278
 epoch: 6, train_loss: 0.8535, test_loss: 0.9939, test_f1: 0.5835
 epoch: 7, train_loss: 0.8284, test_loss: 0.9756, test_f1: 0.5892
 epoch: 8, train_loss: 0.8065, test_loss: 1.0657, test_f1: 0.5542
 epoch: 9, train_loss: 0.7685, test_loss: 0.9963, test_f1: 0.5682
 epoch: 10, train_loss: 0.7539, test_loss: 1.0695, test_f1: 0.5375
 epoch: 11, train_loss: 0.7337, test_loss: 1.2392, test_f1: 0.5796
 epoch: 12, train_loss: 0.7373, test_loss: 1.0368, test_f1: 0.5243
 epoch: 13, train_loss: 0.7071, test_loss: 1.0589, test_f1: 0.6226
 epoch: 14, train_loss: 0.7080, test_loss: 1.0418, test_f1: 0.5850
 epoch: 15, train_loss: 0.7040, test_loss: 1.0817, test_f1: 0.5970
 epoch: 16, train_loss: 0.6946, test_loss: 1.0253, test_f1: 0.5406
 epoch: 17, train_loss: 0.6835, test_loss: 1.1632, test_f1: 0.5922
 epoch: 18, train_loss: 0.6445, test_loss: 1.1203, test_f1: 0.6005
 epoch: 19, train_loss: 0.6354, test_loss: 1.2233, test_f1: 0.5327
 epoch: 20, train_loss: 0.6106, test_loss: 1.2471, test_f1: 0.5104
 epoch: 21, train_loss: 0.5942, test_loss: 1.1594, test_f1: 0.6419
 epoch: 22, train_loss: 0.5923, test_loss: 1.1867, test_f1: 0.5844
 epoch: 23, train_loss: 0.5766, test_loss: 1.2490, test_f1: 0.5911
 epoch: 24, train_loss: 0.5827, test_loss: 1.1506, test_f1: 0.5797
 epoch: 25, train_loss: 0.5897, test_loss: 1.2023, test_f1: 0.5643
 epoch: 26, train_loss: 0.5500, test_loss: 1.0654, test_f1: 0.5977
 epoch: 27, train_loss: 0.5291, test_loss: 1.1652, test_f1: 0.5460
 epoch: 28, train_loss: 0.5272, test_loss: 1.2744, test_f1: 0.5837
 epoch: 29, train_loss: 0.5609, test_loss: 1.4026, test_f1: 0.5858
 epoch: 30, train_loss: 0.4989, test_loss: 1.5132, test_f1: 0.5882
 epoch: 31, train_loss: 0.4945, test_loss: 1.5234, test_f1: 0.5535
 epoch: 32, train_loss: 0.4951, test_loss: 1.3263, test_f1: 0.5953
 epoch: 33, train_loss: 0.4713, test_loss: 1.2644, test_f1: 0.6259
 epoch: 34, train_loss: 0.4612, test_loss: 1.4206, test_f1: 0.5961
 epoch: 35, train_loss: 0.4812, test_loss: 1.3699, test_f1: 0.6088
 epoch: 36, train_loss: 0.4563, test_loss: 1.2700, test_f1: 0.6370
 epoch: 37, train_loss: 0.4864, test_loss: 1.2220, test_f1: 0.5877
 epoch: 38, train_loss: 0.4867, test_loss: 1.5249, test_f1: 0.5886
 epoch: 39, train_loss: 0.4867, test_loss: 1.3375, test_f1: 0.6005
 epoch: 40, train_loss: 0.4187, test_loss: 1.3188, test_f1: 0.5793
 epoch: 41, train_loss: 0.4617, test_loss: 1.4318, test_f1: 0.5919
 epoch: 42, train_loss: 0.4212, test_loss: 1.3280, test_f1: 0.6084
 epoch: 43, train_loss: 0.4296, test_loss: 1.4880, test_f1: 0.6094
 epoch: 44, train_loss: 0.4210, test_loss: 1.4840, test_f1: 0.6414
 epoch: 45, train_loss: 0.3873, test_loss: 1.5149, test_f1: 0.6135
 epoch: 46, train_loss: 0.3959, test_loss: 1.4474, test_f1: 0.6344
 epoch: 47, train_loss: 0.3534, test_loss: 1.4619, test_f1: 0.6087
 epoch: 48, train_loss: 0.4198, test_loss: 1.4935, test_f1: 0.6330
 epoch: 49, train_loss: 0.3790, test_loss: 1.4360, test_f1: 0.6345
 epoch: 50, train_loss: 0.3910, test_loss: 1.4683, test_f1: 0.6283
 epoch: 51, train_loss: 0.3399, test_loss: 1.3925, test_f1: 0.6319
 epoch: 52, train_loss: 0.2997, test_loss: 1.5429, test_f1: 0.6265
 epoch: 53, train_loss: 0.3024, test_loss: 1.4873, test_f1: 0.6315
 epoch: 54, train_loss: 0.2809, test_loss: 1.4530, test_f1: 0.6416
 epoch: 55, train_loss: 0.2810, test_loss: 1.6040, test_f1: 0.6273
 epoch: 56, train_loss: 0.2854, test_loss: 1.6658, test_f1: 0.6284
 epoch: 57, train_loss: 0.2830, test_loss: 1.4246, test_f1: 0.6384
 epoch: 58, train_loss: 0.2926, test_loss: 1.3933, test_f1: 0.6406
 epoch: 59, train_loss: 0.2744, test_loss: 1.5443, test_f1: 0.6281
 epoch: 60, train_loss: 0.2595, test_loss: 1.6086, test_f1: 0.6147
 epoch: 61, train_loss: 0.2520, test_loss: 1.6568, test_f1: 0.6269
 epoch: 62, train_loss: 0.2407, test_loss: 1.7593, test_f1: 0.5891
 epoch: 63, train_loss: 0.2124, test_loss: 1.6555, test_f1: 0.6286
 epoch: 64, train_loss: 0.2394, test_loss: 1.7342, test_f1: 0.6224
 epoch: 65, train_loss: 0.2177, test_loss: 1.7679, test_f1: 0.6267
 epoch: 66, train_loss: 0.2201, test_loss: 1.8479, test_f1: 0.6128
 epoch: 67, train_loss: 0.2215, test_loss: 1.9702, test_f1: 0.6244
 epoch: 68, train_loss: 0.2255, test_loss: 1.9372, test_f1: 0.6341
 epoch: 69, train_loss: 0.2328, test_loss: 1.8800, test_f1: 0.6286
 epoch: 70, train_loss: 0.2008, test_loss: 1.8433, test_f1: 0.6088
 epoch: 71, train_loss: 0.2290, test_loss: 1.7866, test_f1: 0.5888
 epoch: 72, train_loss: 0.2158, test_loss: 1.8091, test_f1: 0.6093
 epoch: 73, train_loss: 0.1999, test_loss: 1.8431, test_f1: 0.6363
 epoch: 74, train_loss: 0.2116, test_loss: 1.8777, test_f1: 0.5979
 epoch: 75, train_loss: 0.2179, test_loss: 1.8691, test_f1: 0.6453
 epoch: 76, train_loss: 0.2038, test_loss: 1.9409, test_f1: 0.6108
 epoch: 77, train_loss: 0.1786, test_loss: 1.9795, test_f1: 0.6601
 epoch: 78, train_loss: 0.1942, test_loss: 2.0295, test_f1: 0.6196
 epoch: 79, train_loss: 0.1882, test_loss: 1.9651, test_f1: 0.6481
 epoch: 80, train_loss: 0.2132, test_loss: 2.0323, test_f1: 0.6229
 epoch: 81, train_loss: 0.2033, test_loss: 1.9289, test_f1: 0.6090
 epoch: 82, train_loss: 0.1819, test_loss: 1.9762, test_f1: 0.6251
 epoch: 83, train_loss: 0.2087, test_loss: 2.0961, test_f1: 0.6041
 epoch: 84, train_loss: 0.1967, test_loss: 2.2575, test_f1: 0.6163
 epoch: 85, train_loss: 0.1965, test_loss: 2.0045, test_f1: 0.6096
 epoch: 86, train_loss: 0.1647, test_loss: 2.1154, test_f1: 0.6089
 epoch: 87, train_loss: 0.1776, test_loss: 2.2244, test_f1: 0.6186
 epoch: 88, train_loss: 0.2435, test_loss: 2.0104, test_f1: 0.6159
 epoch: 89, train_loss: 0.2156, test_loss: 2.0844, test_f1: 0.6038
 epoch: 90, train_loss: 0.1821, test_loss: 1.9685, test_f1: 0.6494
 epoch: 91, train_loss: 0.2008, test_loss: 1.9649, test_f1: 0.5952
 epoch: 92, train_loss: 0.1658, test_loss: 2.1155, test_f1: 0.6288
 epoch: 93, train_loss: 0.1708, test_loss: 2.0462, test_f1: 0.6276
 epoch: 94, train_loss: 0.1482, test_loss: 2.0818, test_f1: 0.6076
 epoch: 95, train_loss: 0.1565, test_loss: 1.9643, test_f1: 0.6388
 epoch: 96, train_loss: 0.1603, test_loss: 2.1522, test_f1: 0.6274
 epoch: 97, train_loss: 0.1770, test_loss: 2.0378, test_f1: 0.6102
 epoch: 98, train_loss: 0.1608, test_loss: 1.9993, test_f1: 0.6416
 epoch: 99, train_loss: 0.1379, test_loss: 2.0178, test_f1: 0.6438
##################ITERATION #8 ****************************************
 epoch: 0, train_loss: 1.3716, test_loss: 1.3362, test_f1: 0.1365
 epoch: 1, train_loss: 1.0997, test_loss: 1.3471, test_f1: 0.3489
 epoch: 2, train_loss: 0.9983, test_loss: 1.3222, test_f1: 0.4120
 epoch: 3, train_loss: 0.9711, test_loss: 1.1615, test_f1: 0.4264
 epoch: 4, train_loss: 0.9337, test_loss: 1.0960, test_f1: 0.5435
 epoch: 5, train_loss: 0.9036, test_loss: 1.0339, test_f1: 0.5817
 epoch: 6, train_loss: 0.8750, test_loss: 1.0409, test_f1: 0.5628
 epoch: 7, train_loss: 0.8409, test_loss: 1.0054, test_f1: 0.5877
 epoch: 8, train_loss: 0.8279, test_loss: 1.0087, test_f1: 0.5768
 epoch: 9, train_loss: 0.8084, test_loss: 1.0232, test_f1: 0.5482
 epoch: 10, train_loss: 0.7906, test_loss: 1.0662, test_f1: 0.5296
 epoch: 11, train_loss: 0.7495, test_loss: 1.0468, test_f1: 0.5619
 epoch: 12, train_loss: 0.7279, test_loss: 1.0190, test_f1: 0.5867
 epoch: 13, train_loss: 0.7252, test_loss: 1.0335, test_f1: 0.5921
 epoch: 14, train_loss: 0.7143, test_loss: 1.0563, test_f1: 0.5933
 epoch: 15, train_loss: 0.7004, test_loss: 1.1299, test_f1: 0.5354
 epoch: 16, train_loss: 0.6742, test_loss: 1.0521, test_f1: 0.6061
 epoch: 17, train_loss: 0.6588, test_loss: 1.0375, test_f1: 0.5671
 epoch: 18, train_loss: 0.6423, test_loss: 1.0848, test_f1: 0.6042
 epoch: 19, train_loss: 0.6209, test_loss: 1.1227, test_f1: 0.6022
 epoch: 20, train_loss: 0.5927, test_loss: 1.1975, test_f1: 0.5803
 epoch: 21, train_loss: 0.5988, test_loss: 1.1433, test_f1: 0.5740
 epoch: 22, train_loss: 0.5937, test_loss: 1.1908, test_f1: 0.6040
 epoch: 23, train_loss: 0.5679, test_loss: 1.0736, test_f1: 0.6095
 epoch: 24, train_loss: 0.5597, test_loss: 1.2088, test_f1: 0.6501
 epoch: 25, train_loss: 0.5672, test_loss: 1.2327, test_f1: 0.5587
 epoch: 26, train_loss: 0.5787, test_loss: 1.2147, test_f1: 0.6171
 epoch: 27, train_loss: 0.6016, test_loss: 1.2769, test_f1: 0.6107
 epoch: 28, train_loss: 0.5638, test_loss: 1.1607, test_f1: 0.6116
 epoch: 29, train_loss: 0.5447, test_loss: 1.1663, test_f1: 0.5938
 epoch: 30, train_loss: 0.5235, test_loss: 1.2176, test_f1: 0.6226
 epoch: 31, train_loss: 0.5183, test_loss: 1.2592, test_f1: 0.6156
 epoch: 32, train_loss: 0.4961, test_loss: 1.4308, test_f1: 0.6130
 epoch: 33, train_loss: 0.4753, test_loss: 1.3680, test_f1: 0.6076
 epoch: 34, train_loss: 0.4597, test_loss: 1.3188, test_f1: 0.5980
 epoch: 35, train_loss: 0.4689, test_loss: 1.2705, test_f1: 0.6266
 epoch: 36, train_loss: 0.4527, test_loss: 1.3831, test_f1: 0.6372
 epoch: 37, train_loss: 0.4249, test_loss: 1.4171, test_f1: 0.6145
 epoch: 38, train_loss: 0.4243, test_loss: 1.3506, test_f1: 0.6344
 epoch: 39, train_loss: 0.4017, test_loss: 1.4577, test_f1: 0.6385
 epoch: 40, train_loss: 0.4405, test_loss: 1.3361, test_f1: 0.6380
 epoch: 41, train_loss: 0.4345, test_loss: 1.4020, test_f1: 0.5888
 epoch: 42, train_loss: 0.4075, test_loss: 1.5045, test_f1: 0.5833
 epoch: 43, train_loss: 0.4234, test_loss: 1.6690, test_f1: 0.6296
 epoch: 44, train_loss: 0.3649, test_loss: 1.5485, test_f1: 0.6277
 epoch: 45, train_loss: 0.4090, test_loss: 1.5559, test_f1: 0.5957
 epoch: 46, train_loss: 0.4107, test_loss: 1.6695, test_f1: 0.6249
 epoch: 47, train_loss: 0.3705, test_loss: 1.6316, test_f1: 0.6090
 epoch: 48, train_loss: 0.3486, test_loss: 1.7119, test_f1: 0.6090
 epoch: 49, train_loss: 0.3638, test_loss: 1.4414, test_f1: 0.6534
 epoch: 50, train_loss: 0.3709, test_loss: 1.5460, test_f1: 0.5939
 epoch: 51, train_loss: 0.3195, test_loss: 1.6823, test_f1: 0.6128
 epoch: 52, train_loss: 0.2958, test_loss: 1.5827, test_f1: 0.6330
 epoch: 53, train_loss: 0.2738, test_loss: 1.7081, test_f1: 0.6260
 epoch: 54, train_loss: 0.2537, test_loss: 1.7360, test_f1: 0.6222
 epoch: 55, train_loss: 0.2441, test_loss: 1.6826, test_f1: 0.6260
 epoch: 56, train_loss: 0.2635, test_loss: 1.7676, test_f1: 0.6273
 epoch: 57, train_loss: 0.2593, test_loss: 1.7260, test_f1: 0.6241
 epoch: 58, train_loss: 0.2537, test_loss: 1.9173, test_f1: 0.6181
 epoch: 59, train_loss: 0.2453, test_loss: 1.9742, test_f1: 0.6270
 epoch: 60, train_loss: 0.2244, test_loss: 1.9668, test_f1: 0.6228
 epoch: 61, train_loss: 0.2347, test_loss: 1.8474, test_f1: 0.6493
 epoch: 62, train_loss: 0.2402, test_loss: 2.0765, test_f1: 0.6042
 epoch: 63, train_loss: 0.2275, test_loss: 2.0757, test_f1: 0.6043
 epoch: 64, train_loss: 0.2233, test_loss: 2.0217, test_f1: 0.6058
 epoch: 65, train_loss: 0.2352, test_loss: 2.0630, test_f1: 0.6400
 epoch: 66, train_loss: 0.2294, test_loss: 1.9806, test_f1: 0.6406
 epoch: 67, train_loss: 0.2202, test_loss: 2.1668, test_f1: 0.5982
 epoch: 68, train_loss: 0.2009, test_loss: 2.0562, test_f1: 0.6283
 epoch: 69, train_loss: 0.2317, test_loss: 2.1615, test_f1: 0.5972
 epoch: 70, train_loss: 0.1966, test_loss: 2.0338, test_f1: 0.6516
 epoch: 71, train_loss: 0.1949, test_loss: 2.1066, test_f1: 0.6228
 epoch: 72, train_loss: 0.1987, test_loss: 1.9825, test_f1: 0.6416
 epoch: 73, train_loss: 0.1965, test_loss: 1.9987, test_f1: 0.6372
 epoch: 74, train_loss: 0.2044, test_loss: 2.3163, test_f1: 0.5897
 epoch: 75, train_loss: 0.1889, test_loss: 2.1757, test_f1: 0.6181
 epoch: 76, train_loss: 0.1758, test_loss: 2.4660, test_f1: 0.6182
 epoch: 77, train_loss: 0.1724, test_loss: 2.1097, test_f1: 0.6429
 epoch: 78, train_loss: 0.2288, test_loss: 2.2278, test_f1: 0.6165
 epoch: 79, train_loss: 0.1937, test_loss: 2.2605, test_f1: 0.6038
 epoch: 80, train_loss: 0.1773, test_loss: 2.3240, test_f1: 0.6037
 epoch: 81, train_loss: 0.1945, test_loss: 2.2392, test_f1: 0.6081
 epoch: 82, train_loss: 0.1992, test_loss: 2.3471, test_f1: 0.5766
 epoch: 83, train_loss: 0.2007, test_loss: 2.0272, test_f1: 0.6372
 epoch: 84, train_loss: 0.1624, test_loss: 2.1715, test_f1: 0.6173
 epoch: 85, train_loss: 0.1565, test_loss: 2.2395, test_f1: 0.6348
 epoch: 86, train_loss: 0.2251, test_loss: 2.2354, test_f1: 0.6074
 epoch: 87, train_loss: 0.1869, test_loss: 2.2471, test_f1: 0.6133
 epoch: 88, train_loss: 0.1753, test_loss: 2.3092, test_f1: 0.6310
 epoch: 89, train_loss: 0.1537, test_loss: 2.1656, test_f1: 0.6545
 epoch: 90, train_loss: 0.1506, test_loss: 2.3126, test_f1: 0.6417
 epoch: 91, train_loss: 0.1649, test_loss: 2.4097, test_f1: 0.6419
 epoch: 92, train_loss: 0.1507, test_loss: 2.2984, test_f1: 0.6150
 epoch: 93, train_loss: 0.1513, test_loss: 2.2946, test_f1: 0.6302
 epoch: 94, train_loss: 0.1401, test_loss: 2.4185, test_f1: 0.6389
 epoch: 95, train_loss: 0.1595, test_loss: 2.4308, test_f1: 0.6315
 epoch: 96, train_loss: 0.1521, test_loss: 2.4415, test_f1: 0.6113
 epoch: 97, train_loss: 0.1552, test_loss: 2.3608, test_f1: 0.6393
 epoch: 98, train_loss: 0.1776, test_loss: 2.3443, test_f1: 0.6295
 epoch: 99, train_loss: 0.1630, test_loss: 2.3691, test_f1: 0.6297
##################ITERATION #9 ****************************************
 epoch: 0, train_loss: 1.4363, test_loss: 1.4316, test_f1: 0.1365
 epoch: 1, train_loss: 1.1314, test_loss: 1.3663, test_f1: 0.3032
 epoch: 2, train_loss: 1.0179, test_loss: 1.2599, test_f1: 0.4279
 epoch: 3, train_loss: 0.9883, test_loss: 1.1577, test_f1: 0.4976
 epoch: 4, train_loss: 0.9269, test_loss: 1.1107, test_f1: 0.5078
 epoch: 5, train_loss: 0.8787, test_loss: 1.0702, test_f1: 0.5467
 epoch: 6, train_loss: 0.8610, test_loss: 1.1011, test_f1: 0.5606
 epoch: 7, train_loss: 0.8235, test_loss: 1.1264, test_f1: 0.5076
 epoch: 8, train_loss: 0.7891, test_loss: 1.0877, test_f1: 0.5309
 epoch: 9, train_loss: 0.7779, test_loss: 1.0896, test_f1: 0.5569
 epoch: 10, train_loss: 0.7818, test_loss: 1.0378, test_f1: 0.5411
 epoch: 11, train_loss: 0.7416, test_loss: 1.0357, test_f1: 0.5687
 epoch: 12, train_loss: 0.7257, test_loss: 1.0628, test_f1: 0.5663
 epoch: 13, train_loss: 0.7083, test_loss: 0.9980, test_f1: 0.5991
 epoch: 14, train_loss: 0.6972, test_loss: 1.1600, test_f1: 0.5488
 epoch: 15, train_loss: 0.6847, test_loss: 1.0765, test_f1: 0.5735
 epoch: 16, train_loss: 0.6557, test_loss: 1.0803, test_f1: 0.5796
 epoch: 17, train_loss: 0.6696, test_loss: 1.1310, test_f1: 0.6044
 epoch: 18, train_loss: 0.6275, test_loss: 1.1593, test_f1: 0.6192
 epoch: 19, train_loss: 0.6267, test_loss: 1.0572, test_f1: 0.6288
 epoch: 20, train_loss: 0.6051, test_loss: 1.1655, test_f1: 0.5851
 epoch: 21, train_loss: 0.5994, test_loss: 1.1404, test_f1: 0.5950
 epoch: 22, train_loss: 0.5921, test_loss: 1.2832, test_f1: 0.5717
 epoch: 23, train_loss: 0.5911, test_loss: 1.2506, test_f1: 0.6193
 epoch: 24, train_loss: 0.5980, test_loss: 1.0774, test_f1: 0.5659
 epoch: 25, train_loss: 0.5697, test_loss: 1.3057, test_f1: 0.5699
 epoch: 26, train_loss: 0.5188, test_loss: 1.0737, test_f1: 0.6208
 epoch: 27, train_loss: 0.5376, test_loss: 1.3352, test_f1: 0.5372
 epoch: 28, train_loss: 0.5349, test_loss: 1.1056, test_f1: 0.6156
 epoch: 29, train_loss: 0.5244, test_loss: 1.2205, test_f1: 0.5850
 epoch: 30, train_loss: 0.5073, test_loss: 1.2736, test_f1: 0.5464
 epoch: 31, train_loss: 0.5072, test_loss: 1.2174, test_f1: 0.6092
 epoch: 32, train_loss: 0.4939, test_loss: 1.2479, test_f1: 0.6170
 epoch: 33, train_loss: 0.4750, test_loss: 1.2956, test_f1: 0.6068
 epoch: 34, train_loss: 0.4427, test_loss: 1.2615, test_f1: 0.6167
 epoch: 35, train_loss: 0.4466, test_loss: 1.4504, test_f1: 0.6274
 epoch: 36, train_loss: 0.4168, test_loss: 1.4526, test_f1: 0.6082
 epoch: 37, train_loss: 0.4699, test_loss: 1.2736, test_f1: 0.6330
 epoch: 38, train_loss: 0.4834, test_loss: 1.3538, test_f1: 0.5982
 epoch: 39, train_loss: 0.4423, test_loss: 1.5522, test_f1: 0.5874
 epoch: 40, train_loss: 0.4071, test_loss: 1.4992, test_f1: 0.6287
 epoch: 41, train_loss: 0.4318, test_loss: 1.4118, test_f1: 0.5925
 epoch: 42, train_loss: 0.4076, test_loss: 1.4009, test_f1: 0.6300
 epoch: 43, train_loss: 0.3841, test_loss: 1.5838, test_f1: 0.5792
 epoch: 44, train_loss: 0.3998, test_loss: 1.3599, test_f1: 0.6214
 epoch: 45, train_loss: 0.4091, test_loss: 1.5276, test_f1: 0.6150
 epoch: 46, train_loss: 0.3731, test_loss: 1.4416, test_f1: 0.6138
 epoch: 47, train_loss: 0.3885, test_loss: 1.5095, test_f1: 0.5797
 epoch: 48, train_loss: 0.3578, test_loss: 1.7377, test_f1: 0.5850
 epoch: 49, train_loss: 0.3623, test_loss: 1.5764, test_f1: 0.6096
 epoch: 50, train_loss: 0.3537, test_loss: 1.5037, test_f1: 0.6452
 epoch: 51, train_loss: 0.3285, test_loss: 1.6173, test_f1: 0.6100
 epoch: 52, train_loss: 0.2986, test_loss: 1.5587, test_f1: 0.6388
 epoch: 53, train_loss: 0.2969, test_loss: 1.7577, test_f1: 0.6060
 epoch: 54, train_loss: 0.2839, test_loss: 1.7074, test_f1: 0.6058
 epoch: 55, train_loss: 0.2709, test_loss: 1.6403, test_f1: 0.6515
 epoch: 56, train_loss: 0.2663, test_loss: 1.6558, test_f1: 0.6593
 epoch: 57, train_loss: 0.2593, test_loss: 1.7104, test_f1: 0.6590
 epoch: 58, train_loss: 0.2579, test_loss: 1.7685, test_f1: 0.6218
 epoch: 59, train_loss: 0.2428, test_loss: 1.6605, test_f1: 0.6272
 epoch: 60, train_loss: 0.2392, test_loss: 1.7407, test_f1: 0.6201
 epoch: 61, train_loss: 0.2351, test_loss: 1.7851, test_f1: 0.6246
 epoch: 62, train_loss: 0.2300, test_loss: 1.8203, test_f1: 0.6058
 epoch: 63, train_loss: 0.2207, test_loss: 1.8101, test_f1: 0.5980
 epoch: 64, train_loss: 0.2187, test_loss: 1.8434, test_f1: 0.6051
 epoch: 65, train_loss: 0.2223, test_loss: 1.9414, test_f1: 0.6060
 epoch: 66, train_loss: 0.2599, test_loss: 2.0290, test_f1: 0.6055
 epoch: 67, train_loss: 0.2232, test_loss: 1.6604, test_f1: 0.6344
 epoch: 68, train_loss: 0.1973, test_loss: 1.8194, test_f1: 0.5890
 epoch: 69, train_loss: 0.2150, test_loss: 1.9447, test_f1: 0.6253
 epoch: 70, train_loss: 0.2091, test_loss: 1.9228, test_f1: 0.6267
 epoch: 71, train_loss: 0.2132, test_loss: 1.8408, test_f1: 0.6205
 epoch: 72, train_loss: 0.2259, test_loss: 1.7966, test_f1: 0.6051
 epoch: 73, train_loss: 0.2285, test_loss: 2.0940, test_f1: 0.5888
 epoch: 74, train_loss: 0.2290, test_loss: 1.8858, test_f1: 0.6517
 epoch: 75, train_loss: 0.2240, test_loss: 2.0215, test_f1: 0.5889
 epoch: 76, train_loss: 0.1837, test_loss: 1.8871, test_f1: 0.6100
 epoch: 77, train_loss: 0.1818, test_loss: 2.0314, test_f1: 0.6008
 epoch: 78, train_loss: 0.1883, test_loss: 1.9799, test_f1: 0.6043
 epoch: 79, train_loss: 0.2019, test_loss: 2.1264, test_f1: 0.6099
 epoch: 80, train_loss: 0.1738, test_loss: 2.0549, test_f1: 0.6380
 epoch: 81, train_loss: 0.2120, test_loss: 1.9415, test_f1: 0.6155
 epoch: 82, train_loss: 0.2628, test_loss: 1.9957, test_f1: 0.6119
 epoch: 83, train_loss: 0.2393, test_loss: 2.0037, test_f1: 0.6008
 epoch: 84, train_loss: 0.1965, test_loss: 1.9555, test_f1: 0.6245
 epoch: 85, train_loss: 0.1769, test_loss: 2.0381, test_f1: 0.6339
 epoch: 86, train_loss: 0.1783, test_loss: 1.8708, test_f1: 0.6259
 epoch: 87, train_loss: 0.2027, test_loss: 1.9638, test_f1: 0.6373
 epoch: 88, train_loss: 0.2082, test_loss: 2.0355, test_f1: 0.6225
 epoch: 89, train_loss: 0.1767, test_loss: 2.1122, test_f1: 0.6152
 epoch: 90, train_loss: 0.1661, test_loss: 2.2293, test_f1: 0.6088
 epoch: 91, train_loss: 0.1591, test_loss: 2.2521, test_f1: 0.5956
 epoch: 92, train_loss: 0.1604, test_loss: 2.0502, test_f1: 0.6264
 epoch: 93, train_loss: 0.1792, test_loss: 2.1486, test_f1: 0.6161
 epoch: 94, train_loss: 0.1545, test_loss: 2.0673, test_f1: 0.6151
 epoch: 95, train_loss: 0.1441, test_loss: 2.2108, test_f1: 0.6140
 epoch: 96, train_loss: 0.1328, test_loss: 2.3121, test_f1: 0.6040
 epoch: 97, train_loss: 0.1963, test_loss: 2.2341, test_f1: 0.6074
 epoch: 98, train_loss: 0.1780, test_loss: 2.3272, test_f1: 0.6162
 epoch: 99, train_loss: 0.1460, test_loss: 2.2159, test_f1: 0.6166

Training completed in 375.20 seconds
Best F1: 0.6780 at epoch 63
Mean F1 across iterations: 0.6583  0.0102
========================FINAL RESULTS================================
FEGIN weighted F1: 0.6780  0.0102
python main.py --data ltspice_demos --representation component_pin --model FEGIN --layers 5 --hiddens 64 --batch_size 128 --lr 0.001 --emb_size 250 --epochs 100 --save_appendix component_pin_L5_H64_BS128_LR0.001_E250 --no_val
-----



STDERR:
  File "main.py", line 370, in <module>
    main()
  File "main.py", line 254, in main
    dataset = dataset_class(
  File "/home/philip/projects/ltspice_examples_code_repo/Circuit-Completion-Using-GNNs/component_classification_with_link_prediction_head/evaluation/FEGIN/kernel/circuit_datasets.py", line 15, in __init__
    self.data, self.slices = torch.load(self.processed_paths[0])
  File "/home/philip/.local/lib/python3.8/site-packages/torch/serialization.py", line 1040, in load
    warnings.warn(
  File "/usr/lib/python3.8/warnings.py", line 109, in _showwarnmsg
    sw(msg.message, msg.category, msg.filename, msg.lineno,
  File "main.py", line 47, in warn_with_traceback
    traceback.print_stack(file=log)
/home/philip/projects/ltspice_examples_code_repo/Circuit-Completion-Using-GNNs/component_classification_with_link_prediction_head/evaluation/FEGIN/kernel/circuit_datasets.py:15: FutureWarning: You are using `torch.load` with `weights_only=False` (the current default value), which uses the default pickle module implicitly. It is possible to construct malicious pickle data which will execute arbitrary code during unpickling (See https://github.com/pytorch/pytorch/blob/main/SECURITY.md#untrusted-models for more details). In a future release, the default value for `weights_only` will be flipped to `True`. This limits the functions that could be executed during unpickling. Arbitrary objects will no longer be allowed to be loaded via this mode unless they are explicitly allowlisted by the user via `torch.serialization.add_safe_globals`. We recommend you start setting `weights_only=True` for any use case where you don't have full control of the loaded file. Please open an issue on GitHub for any issues related to this experimental feature.
  self.data, self.slices = torch.load(self.processed_paths[0])
