STDOUT:
Results will be saved in /home/philip/projects/ltspice_examples_code_repo/Circuit-Completion-Using-GNNs/component_classification_with_link_prediction_head/evaluation/FEGIN/results/model_FEGIN_dataset_ltspice_demos
Command line input: python main.py --data ltspice_demos --representation component_pin --model FEGIN --layers 3 --hiddens 64 --batch_size 128 --lr 0.01 --emb_size 250 --epochs 100 --save_appendix component_pin_L3_H64_BS128_LR0.01_E250 --no_val
 is saved.
-----
ltspice_demos - FEGIN
Using 3 layers, 64 hidden units, h = 2
Loading component_pin representation dataset
ENTERED
Training FEGIN on component_pin representation
Train: 1565, Test: 383
##################ITERATION #0 ****************************************
 epoch: 0, train_loss: 1.2444, test_loss: 1.3136, test_f1: 0.2698
 epoch: 1, train_loss: 1.1471, test_loss: 1.3024, test_f1: 0.3329
 epoch: 2, train_loss: 1.0570, test_loss: 1.3739, test_f1: 0.3412
 epoch: 3, train_loss: 0.9742, test_loss: 1.2114, test_f1: 0.4196
 epoch: 4, train_loss: 0.9053, test_loss: 1.1790, test_f1: 0.4624
 epoch: 5, train_loss: 0.8697, test_loss: 0.9938, test_f1: 0.4478
 epoch: 6, train_loss: 0.8702, test_loss: 0.9190, test_f1: 0.5037
 epoch: 7, train_loss: 0.8204, test_loss: 1.2875, test_f1: 0.4325
 epoch: 8, train_loss: 0.8187, test_loss: 1.3437, test_f1: 0.4669
 epoch: 9, train_loss: 0.7780, test_loss: 1.3003, test_f1: 0.4940
 epoch: 10, train_loss: 0.7586, test_loss: 1.1338, test_f1: 0.5581
 epoch: 11, train_loss: 0.7483, test_loss: 1.7249, test_f1: 0.5235
 epoch: 12, train_loss: 0.7313, test_loss: 1.2128, test_f1: 0.4667
 epoch: 13, train_loss: 0.7450, test_loss: 0.9743, test_f1: 0.6347
 epoch: 14, train_loss: 0.7264, test_loss: 1.0192, test_f1: 0.6176
 epoch: 15, train_loss: 0.6899, test_loss: 1.2717, test_f1: 0.5979
 epoch: 16, train_loss: 0.7026, test_loss: 1.0743, test_f1: 0.5358
 epoch: 17, train_loss: 0.7128, test_loss: 0.9675, test_f1: 0.5563
 epoch: 18, train_loss: 0.7186, test_loss: 1.0102, test_f1: 0.5762
 epoch: 19, train_loss: 0.6964, test_loss: 1.0030, test_f1: 0.6216
 epoch: 20, train_loss: 0.6810, test_loss: 1.0169, test_f1: 0.6220
 epoch: 21, train_loss: 0.6868, test_loss: 0.9872, test_f1: 0.5480
 epoch: 22, train_loss: 0.6588, test_loss: 1.0112, test_f1: 0.6275
 epoch: 23, train_loss: 0.6557, test_loss: 1.4323, test_f1: 0.4730
 epoch: 24, train_loss: 0.6439, test_loss: 1.0845, test_f1: 0.5969
 epoch: 25, train_loss: 0.6207, test_loss: 1.0487, test_f1: 0.6335
 epoch: 26, train_loss: 0.6161, test_loss: 1.3159, test_f1: 0.5347
 epoch: 27, train_loss: 0.6274, test_loss: 1.2291, test_f1: 0.5574
 epoch: 28, train_loss: 0.6205, test_loss: 1.0567, test_f1: 0.5430
 epoch: 29, train_loss: 0.5894, test_loss: 1.1975, test_f1: 0.6253
 epoch: 30, train_loss: 0.5977, test_loss: 1.4151, test_f1: 0.4912
 epoch: 31, train_loss: 0.6493, test_loss: 1.1413, test_f1: 0.6351
 epoch: 32, train_loss: 0.6175, test_loss: 1.2837, test_f1: 0.5480
 epoch: 33, train_loss: 0.5959, test_loss: 1.1578, test_f1: 0.5939
 epoch: 34, train_loss: 0.5662, test_loss: 1.2273, test_f1: 0.5777
 epoch: 35, train_loss: 0.5865, test_loss: 1.1012, test_f1: 0.6057
 epoch: 36, train_loss: 0.5618, test_loss: 1.1125, test_f1: 0.6139
 epoch: 37, train_loss: 0.5340, test_loss: 1.2209, test_f1: 0.6165
 epoch: 38, train_loss: 0.5248, test_loss: 1.5457, test_f1: 0.6521
 epoch: 39, train_loss: 0.5115, test_loss: 1.1523, test_f1: 0.6356
 epoch: 40, train_loss: 0.4868, test_loss: 1.4661, test_f1: 0.6187
 epoch: 41, train_loss: 0.4783, test_loss: 1.5410, test_f1: 0.5881
 epoch: 42, train_loss: 0.4828, test_loss: 1.9309, test_f1: 0.5523
 epoch: 43, train_loss: 0.4846, test_loss: 1.6925, test_f1: 0.5660
 epoch: 44, train_loss: 0.4934, test_loss: 1.5767, test_f1: 0.6283
 epoch: 45, train_loss: 0.4930, test_loss: 1.4909, test_f1: 0.6220
 epoch: 46, train_loss: 0.5145, test_loss: 1.3727, test_f1: 0.5175
 epoch: 47, train_loss: 0.5378, test_loss: 1.6481, test_f1: 0.6146
 epoch: 48, train_loss: 0.5227, test_loss: 1.1048, test_f1: 0.6407
 epoch: 49, train_loss: 0.5236, test_loss: 1.1850, test_f1: 0.6126
 epoch: 50, train_loss: 0.4730, test_loss: 1.1254, test_f1: 0.6767
 epoch: 51, train_loss: 0.4329, test_loss: 1.3763, test_f1: 0.6594
 epoch: 52, train_loss: 0.4301, test_loss: 1.2478, test_f1: 0.6459
 epoch: 53, train_loss: 0.4011, test_loss: 1.1910, test_f1: 0.6610
 epoch: 54, train_loss: 0.3894, test_loss: 1.6817, test_f1: 0.6552
 epoch: 55, train_loss: 0.3814, test_loss: 1.4531, test_f1: 0.6370
 epoch: 56, train_loss: 0.3724, test_loss: 1.5561, test_f1: 0.6513
 epoch: 57, train_loss: 0.3565, test_loss: 1.4306, test_f1: 0.6572
 epoch: 58, train_loss: 0.3351, test_loss: 1.7128, test_f1: 0.6511
 epoch: 59, train_loss: 0.3438, test_loss: 1.8337, test_f1: 0.6418
 epoch: 60, train_loss: 0.3464, test_loss: 1.7363, test_f1: 0.6545
 epoch: 61, train_loss: 0.3351, test_loss: 1.6613, test_f1: 0.6362
 epoch: 62, train_loss: 0.3548, test_loss: 2.0024, test_f1: 0.5830
 epoch: 63, train_loss: 0.3997, test_loss: 1.5468, test_f1: 0.6434
 epoch: 64, train_loss: 0.3892, test_loss: 1.7359, test_f1: 0.6507
 epoch: 65, train_loss: 0.3366, test_loss: 1.7737, test_f1: 0.6237
 epoch: 66, train_loss: 0.3323, test_loss: 1.3158, test_f1: 0.6724
 epoch: 67, train_loss: 0.3186, test_loss: 2.0932, test_f1: 0.6644
 epoch: 68, train_loss: 0.3077, test_loss: 1.9993, test_f1: 0.6037
 epoch: 69, train_loss: 0.3274, test_loss: 1.7581, test_f1: 0.6566
 epoch: 70, train_loss: 0.3023, test_loss: 1.8331, test_f1: 0.6636
 epoch: 71, train_loss: 0.3050, test_loss: 1.7297, test_f1: 0.6862
 epoch: 72, train_loss: 0.3195, test_loss: 1.9790, test_f1: 0.6691
 epoch: 73, train_loss: 0.2842, test_loss: 1.8204, test_f1: 0.6637
 epoch: 74, train_loss: 0.2780, test_loss: 1.7586, test_f1: 0.6683
 epoch: 75, train_loss: 0.2694, test_loss: 1.9390, test_f1: 0.6445
 epoch: 76, train_loss: 0.2665, test_loss: 1.9903, test_f1: 0.6557
 epoch: 77, train_loss: 0.2459, test_loss: 2.1032, test_f1: 0.5948
 epoch: 78, train_loss: 0.2663, test_loss: 2.1322, test_f1: 0.6530
 epoch: 79, train_loss: 0.2564, test_loss: 1.9920, test_f1: 0.6638
 epoch: 80, train_loss: 0.2773, test_loss: 2.1629, test_f1: 0.6527
 epoch: 81, train_loss: 0.2926, test_loss: 2.1802, test_f1: 0.6412
 epoch: 82, train_loss: 0.2934, test_loss: 2.0821, test_f1: 0.6026
 epoch: 83, train_loss: 0.2789, test_loss: 1.9908, test_f1: 0.6538
 epoch: 84, train_loss: 0.2721, test_loss: 2.8691, test_f1: 0.6298
 epoch: 85, train_loss: 0.2374, test_loss: 2.1882, test_f1: 0.6468
 epoch: 86, train_loss: 0.2574, test_loss: 2.2443, test_f1: 0.6775
 epoch: 87, train_loss: 0.2607, test_loss: 2.9207, test_f1: 0.6494
 epoch: 88, train_loss: 0.2717, test_loss: 2.0825, test_f1: 0.6637
 epoch: 89, train_loss: 0.2852, test_loss: 1.8680, test_f1: 0.6723
 epoch: 90, train_loss: 0.2585, test_loss: 2.0723, test_f1: 0.6343
 epoch: 91, train_loss: 0.2441, test_loss: 2.7911, test_f1: 0.6538
 epoch: 92, train_loss: 0.2372, test_loss: 2.5924, test_f1: 0.6580
 epoch: 93, train_loss: 0.2254, test_loss: 2.9715, test_f1: 0.6377
 epoch: 94, train_loss: 0.2280, test_loss: 2.7531, test_f1: 0.6614
 epoch: 95, train_loss: 0.2450, test_loss: 2.5174, test_f1: 0.6425
 epoch: 96, train_loss: 0.2355, test_loss: 2.3668, test_f1: 0.6453
 epoch: 97, train_loss: 0.2263, test_loss: 2.3035, test_f1: 0.6237
 epoch: 98, train_loss: 0.2307, test_loss: 3.3530, test_f1: 0.6281
 epoch: 99, train_loss: 0.1999, test_loss: 2.4407, test_f1: 0.6523
##################ITERATION #1 ****************************************
 epoch: 0, train_loss: 1.2054, test_loss: 1.4672, test_f1: 0.2465
 epoch: 1, train_loss: 1.0271, test_loss: 1.3665, test_f1: 0.3876
 epoch: 2, train_loss: 0.9203, test_loss: 1.1563, test_f1: 0.4566
 epoch: 3, train_loss: 0.8753, test_loss: 1.0714, test_f1: 0.5130
 epoch: 4, train_loss: 0.8326, test_loss: 1.0871, test_f1: 0.4929
 epoch: 5, train_loss: 0.8142, test_loss: 1.0937, test_f1: 0.4768
 epoch: 6, train_loss: 0.8312, test_loss: 2.3197, test_f1: 0.2861
 epoch: 7, train_loss: 0.7714, test_loss: 0.9988, test_f1: 0.4595
 epoch: 8, train_loss: 0.8044, test_loss: 1.7687, test_f1: 0.3592
 epoch: 9, train_loss: 0.8529, test_loss: 0.9839, test_f1: 0.5803
 epoch: 10, train_loss: 0.8084, test_loss: 1.0623, test_f1: 0.5216
 epoch: 11, train_loss: 0.7706, test_loss: 1.5093, test_f1: 0.3560
 epoch: 12, train_loss: 0.7805, test_loss: 1.1156, test_f1: 0.5409
 epoch: 13, train_loss: 0.7646, test_loss: 1.0371, test_f1: 0.5888
 epoch: 14, train_loss: 0.7393, test_loss: 1.3771, test_f1: 0.5528
 epoch: 15, train_loss: 0.7454, test_loss: 1.1801, test_f1: 0.5359
 epoch: 16, train_loss: 0.7278, test_loss: 1.0962, test_f1: 0.4861
 epoch: 17, train_loss: 0.7338, test_loss: 0.9977, test_f1: 0.5795
 epoch: 18, train_loss: 0.7099, test_loss: 1.0663, test_f1: 0.5505
 epoch: 19, train_loss: 0.7210, test_loss: 1.0578, test_f1: 0.5618
 epoch: 20, train_loss: 0.6738, test_loss: 1.2403, test_f1: 0.4968
 epoch: 21, train_loss: 0.6825, test_loss: 1.7347, test_f1: 0.4717
 epoch: 22, train_loss: 0.6823, test_loss: 0.9531, test_f1: 0.5967
 epoch: 23, train_loss: 0.6741, test_loss: 1.2791, test_f1: 0.5699
 epoch: 24, train_loss: 0.6559, test_loss: 0.9987, test_f1: 0.6180
 epoch: 25, train_loss: 0.6779, test_loss: 0.9000, test_f1: 0.6151
 epoch: 26, train_loss: 0.6441, test_loss: 1.3889, test_f1: 0.5728
 epoch: 27, train_loss: 0.6450, test_loss: 1.0792, test_f1: 0.6423
 epoch: 28, train_loss: 0.6532, test_loss: 1.1571, test_f1: 0.6083
 epoch: 29, train_loss: 0.6370, test_loss: 0.9829, test_f1: 0.6581
 epoch: 30, train_loss: 0.5935, test_loss: 1.6838, test_f1: 0.5602
 epoch: 31, train_loss: 0.6049, test_loss: 1.5101, test_f1: 0.5019
 epoch: 32, train_loss: 0.6301, test_loss: 1.1622, test_f1: 0.5722
 epoch: 33, train_loss: 0.6018, test_loss: 1.5056, test_f1: 0.5918
 epoch: 34, train_loss: 0.6124, test_loss: 1.2770, test_f1: 0.5708
 epoch: 35, train_loss: 0.5909, test_loss: 1.2009, test_f1: 0.5815
 epoch: 36, train_loss: 0.5900, test_loss: 1.4108, test_f1: 0.6029
 epoch: 37, train_loss: 0.5748, test_loss: 1.4577, test_f1: 0.5464
 epoch: 38, train_loss: 0.5574, test_loss: 1.4601, test_f1: 0.6224
 epoch: 39, train_loss: 0.5613, test_loss: 1.3382, test_f1: 0.5855
 epoch: 40, train_loss: 0.5821, test_loss: 1.1530, test_f1: 0.5959
 epoch: 41, train_loss: 0.6137, test_loss: 1.1024, test_f1: 0.5103
 epoch: 42, train_loss: 0.6038, test_loss: 1.0455, test_f1: 0.6482
 epoch: 43, train_loss: 0.5599, test_loss: 1.0302, test_f1: 0.6491
 epoch: 44, train_loss: 0.5392, test_loss: 1.1290, test_f1: 0.6132
 epoch: 45, train_loss: 0.5228, test_loss: 1.2452, test_f1: 0.6067
 epoch: 46, train_loss: 0.5493, test_loss: 1.7396, test_f1: 0.4994
 epoch: 47, train_loss: 0.6013, test_loss: 1.1828, test_f1: 0.5996
 epoch: 48, train_loss: 0.5202, test_loss: 1.1343, test_f1: 0.6284
 epoch: 49, train_loss: 0.5025, test_loss: 1.5081, test_f1: 0.6197
 epoch: 50, train_loss: 0.5093, test_loss: 1.2854, test_f1: 0.6113
 epoch: 51, train_loss: 0.4465, test_loss: 1.2942, test_f1: 0.6282
 epoch: 52, train_loss: 0.4161, test_loss: 1.6045, test_f1: 0.6001
 epoch: 53, train_loss: 0.4120, test_loss: 1.5139, test_f1: 0.6430
 epoch: 54, train_loss: 0.4122, test_loss: 1.3032, test_f1: 0.6322
 epoch: 55, train_loss: 0.4143, test_loss: 1.4031, test_f1: 0.6411
 epoch: 56, train_loss: 0.4323, test_loss: 1.3371, test_f1: 0.6381
 epoch: 57, train_loss: 0.3674, test_loss: 1.4289, test_f1: 0.6477
 epoch: 58, train_loss: 0.3492, test_loss: 1.6529, test_f1: 0.5896
 epoch: 59, train_loss: 0.3956, test_loss: 1.3867, test_f1: 0.6424
 epoch: 60, train_loss: 0.4081, test_loss: 1.2353, test_f1: 0.6624
 epoch: 61, train_loss: 0.4031, test_loss: 1.3884, test_f1: 0.6326
 epoch: 62, train_loss: 0.3516, test_loss: 1.4907, test_f1: 0.6317
 epoch: 63, train_loss: 0.4068, test_loss: 1.3132, test_f1: 0.6526
 epoch: 64, train_loss: 0.3712, test_loss: 1.4261, test_f1: 0.6327
 epoch: 65, train_loss: 0.3369, test_loss: 1.7428, test_f1: 0.6013
 epoch: 66, train_loss: 0.4383, test_loss: 1.6429, test_f1: 0.6268
 epoch: 67, train_loss: 0.3728, test_loss: 1.8725, test_f1: 0.5521
 epoch: 68, train_loss: 0.3546, test_loss: 1.6279, test_f1: 0.6189
 epoch: 69, train_loss: 0.3313, test_loss: 1.7477, test_f1: 0.6211
 epoch: 70, train_loss: 0.3142, test_loss: 2.0248, test_f1: 0.5976
 epoch: 71, train_loss: 0.3685, test_loss: 1.3533, test_f1: 0.6499
 epoch: 72, train_loss: 0.3714, test_loss: 1.5920, test_f1: 0.6159
 epoch: 73, train_loss: 0.3444, test_loss: 1.5083, test_f1: 0.6465
 epoch: 74, train_loss: 0.3303, test_loss: 1.6276, test_f1: 0.6267
 epoch: 75, train_loss: 0.3190, test_loss: 1.6434, test_f1: 0.6437
 epoch: 76, train_loss: 0.2886, test_loss: 1.6915, test_f1: 0.5859
 epoch: 77, train_loss: 0.3125, test_loss: 1.3468, test_f1: 0.6563
 epoch: 78, train_loss: 0.3408, test_loss: 1.8724, test_f1: 0.6153
 epoch: 79, train_loss: 0.3060, test_loss: 1.9695, test_f1: 0.6366
 epoch: 80, train_loss: 0.3139, test_loss: 1.8052, test_f1: 0.6356
 epoch: 81, train_loss: 0.3532, test_loss: 1.5823, test_f1: 0.6637
 epoch: 82, train_loss: 0.3259, test_loss: 1.4643, test_f1: 0.6589
 epoch: 83, train_loss: 0.3376, test_loss: 1.8158, test_f1: 0.6427
 epoch: 84, train_loss: 0.2914, test_loss: 2.0121, test_f1: 0.6350
 epoch: 85, train_loss: 0.2724, test_loss: 2.0926, test_f1: 0.6524
 epoch: 86, train_loss: 0.3375, test_loss: 1.9009, test_f1: 0.6129
 epoch: 87, train_loss: 0.2947, test_loss: 1.8516, test_f1: 0.6032
 epoch: 88, train_loss: 0.3246, test_loss: 1.7579, test_f1: 0.6610
 epoch: 89, train_loss: 0.2969, test_loss: 1.9051, test_f1: 0.6198
 epoch: 90, train_loss: 0.2962, test_loss: 1.8220, test_f1: 0.5777
 epoch: 91, train_loss: 0.3468, test_loss: 1.7979, test_f1: 0.6446
 epoch: 92, train_loss: 0.3167, test_loss: 2.0537, test_f1: 0.5860
 epoch: 93, train_loss: 0.2920, test_loss: 1.8660, test_f1: 0.6166
 epoch: 94, train_loss: 0.2715, test_loss: 1.7713, test_f1: 0.6700
 epoch: 95, train_loss: 0.2773, test_loss: 1.8619, test_f1: 0.5908
 epoch: 96, train_loss: 0.2305, test_loss: 1.7821, test_f1: 0.6199
 epoch: 97, train_loss: 0.2361, test_loss: 2.2346, test_f1: 0.6341
 epoch: 98, train_loss: 0.3052, test_loss: 2.0780, test_f1: 0.6165
 epoch: 99, train_loss: 0.2523, test_loss: 1.8546, test_f1: 0.6646
##################ITERATION #2 ****************************************
 epoch: 0, train_loss: 1.2160, test_loss: 1.5669, test_f1: 0.3159
 epoch: 1, train_loss: 0.9877, test_loss: 1.3889, test_f1: 0.3179
 epoch: 2, train_loss: 0.9106, test_loss: 1.3404, test_f1: 0.4520
 epoch: 3, train_loss: 0.8589, test_loss: 1.1699, test_f1: 0.4903
 epoch: 4, train_loss: 0.8689, test_loss: 1.0911, test_f1: 0.5522
 epoch: 5, train_loss: 0.8257, test_loss: 1.3852, test_f1: 0.5062
 epoch: 6, train_loss: 0.7987, test_loss: 1.9690, test_f1: 0.4039
 epoch: 7, train_loss: 0.8354, test_loss: 1.1278, test_f1: 0.4868
 epoch: 8, train_loss: 0.7766, test_loss: 1.0924, test_f1: 0.6022
 epoch: 9, train_loss: 0.7837, test_loss: 1.1052, test_f1: 0.5726
 epoch: 10, train_loss: 0.7433, test_loss: 1.5612, test_f1: 0.4943
 epoch: 11, train_loss: 0.7869, test_loss: 1.0863, test_f1: 0.5380
 epoch: 12, train_loss: 0.7349, test_loss: 1.2131, test_f1: 0.5965
 epoch: 13, train_loss: 0.7277, test_loss: 1.3950, test_f1: 0.5095
 epoch: 14, train_loss: 0.7264, test_loss: 1.1521, test_f1: 0.5428
 epoch: 15, train_loss: 0.7466, test_loss: 1.2606, test_f1: 0.5615
 epoch: 16, train_loss: 0.7136, test_loss: 1.1584, test_f1: 0.5537
 epoch: 17, train_loss: 0.6966, test_loss: 1.5127, test_f1: 0.5254
 epoch: 18, train_loss: 0.6936, test_loss: 1.2959, test_f1: 0.6162
 epoch: 19, train_loss: 0.6909, test_loss: 1.1148, test_f1: 0.6422
 epoch: 20, train_loss: 0.6550, test_loss: 1.2864, test_f1: 0.6266
 epoch: 21, train_loss: 0.6540, test_loss: 1.0961, test_f1: 0.6374
 epoch: 22, train_loss: 0.6917, test_loss: 1.0108, test_f1: 0.5757
 epoch: 23, train_loss: 0.6655, test_loss: 1.5777, test_f1: 0.5765
 epoch: 24, train_loss: 0.6456, test_loss: 1.4570, test_f1: 0.5760
 epoch: 25, train_loss: 0.6432, test_loss: 1.0791, test_f1: 0.5917
 epoch: 26, train_loss: 0.6527, test_loss: 1.1257, test_f1: 0.5400
 epoch: 27, train_loss: 0.6287, test_loss: 1.2658, test_f1: 0.5900
 epoch: 28, train_loss: 0.6208, test_loss: 1.1489, test_f1: 0.5303
 epoch: 29, train_loss: 0.6231, test_loss: 1.2846, test_f1: 0.5789
 epoch: 30, train_loss: 0.6199, test_loss: 1.0785, test_f1: 0.5373
 epoch: 31, train_loss: 0.6133, test_loss: 1.4268, test_f1: 0.5030
 epoch: 32, train_loss: 0.5781, test_loss: 1.2620, test_f1: 0.5296
 epoch: 33, train_loss: 0.6059, test_loss: 1.2231, test_f1: 0.6274
 epoch: 34, train_loss: 0.5613, test_loss: 1.2508, test_f1: 0.6332
 epoch: 35, train_loss: 0.5272, test_loss: 1.2922, test_f1: 0.5733
 epoch: 36, train_loss: 0.5793, test_loss: 1.3633, test_f1: 0.5983
 epoch: 37, train_loss: 0.5659, test_loss: 1.2473, test_f1: 0.6142
 epoch: 38, train_loss: 0.5378, test_loss: 1.3601, test_f1: 0.6012
 epoch: 39, train_loss: 0.5169, test_loss: 1.5144, test_f1: 0.6259
 epoch: 40, train_loss: 0.5790, test_loss: 1.5192, test_f1: 0.5252
 epoch: 41, train_loss: 0.5551, test_loss: 1.6135, test_f1: 0.5978
 epoch: 42, train_loss: 0.5244, test_loss: 1.3457, test_f1: 0.4296
 epoch: 43, train_loss: 0.5164, test_loss: 2.6774, test_f1: 0.4473
 epoch: 44, train_loss: 0.5397, test_loss: 1.4405, test_f1: 0.5292
 epoch: 45, train_loss: 0.5318, test_loss: 1.6931, test_f1: 0.4511
 epoch: 46, train_loss: 0.4994, test_loss: 1.2437, test_f1: 0.6492
 epoch: 47, train_loss: 0.4795, test_loss: 1.3777, test_f1: 0.6219
 epoch: 48, train_loss: 0.5130, test_loss: 1.5338, test_f1: 0.5936
 epoch: 49, train_loss: 0.4660, test_loss: 1.4249, test_f1: 0.6005
 epoch: 50, train_loss: 0.5047, test_loss: 1.3133, test_f1: 0.6994
 epoch: 51, train_loss: 0.4443, test_loss: 1.5076, test_f1: 0.6024
 epoch: 52, train_loss: 0.4200, test_loss: 1.4527, test_f1: 0.6297
 epoch: 53, train_loss: 0.3818, test_loss: 1.6051, test_f1: 0.6031
 epoch: 54, train_loss: 0.4009, test_loss: 1.7086, test_f1: 0.6169
 epoch: 55, train_loss: 0.3685, test_loss: 1.6407, test_f1: 0.6079
 epoch: 56, train_loss: 0.3716, test_loss: 1.6656, test_f1: 0.5894
 epoch: 57, train_loss: 0.3617, test_loss: 1.5374, test_f1: 0.6298
 epoch: 58, train_loss: 0.3635, test_loss: 1.6366, test_f1: 0.6127
 epoch: 59, train_loss: 0.3798, test_loss: 1.8212, test_f1: 0.5753
 epoch: 60, train_loss: 0.3889, test_loss: 1.8404, test_f1: 0.6216
 epoch: 61, train_loss: 0.3335, test_loss: 1.8112, test_f1: 0.6053
 epoch: 62, train_loss: 0.3152, test_loss: 1.9638, test_f1: 0.6265
 epoch: 63, train_loss: 0.3530, test_loss: 1.9237, test_f1: 0.5815
 epoch: 64, train_loss: 0.3198, test_loss: 1.8838, test_f1: 0.6382
 epoch: 65, train_loss: 0.3091, test_loss: 1.7208, test_f1: 0.6406
 epoch: 66, train_loss: 0.2908, test_loss: 1.8089, test_f1: 0.6452
 epoch: 67, train_loss: 0.2814, test_loss: 1.8882, test_f1: 0.6002
 epoch: 68, train_loss: 0.2851, test_loss: 2.0111, test_f1: 0.5982
 epoch: 69, train_loss: 0.2756, test_loss: 2.1214, test_f1: 0.6096
 epoch: 70, train_loss: 0.3204, test_loss: 1.9654, test_f1: 0.6053
 epoch: 71, train_loss: 0.2860, test_loss: 1.9292, test_f1: 0.6413
 epoch: 72, train_loss: 0.3176, test_loss: 2.3818, test_f1: 0.6204
 epoch: 73, train_loss: 0.2771, test_loss: 2.4078, test_f1: 0.6005
 epoch: 74, train_loss: 0.2599, test_loss: 2.4368, test_f1: 0.6406
 epoch: 75, train_loss: 0.2848, test_loss: 1.8620, test_f1: 0.6762
 epoch: 76, train_loss: 0.2775, test_loss: 2.1944, test_f1: 0.6325
 epoch: 77, train_loss: 0.3769, test_loss: 2.1738, test_f1: 0.5895
 epoch: 78, train_loss: 0.3442, test_loss: 1.9214, test_f1: 0.5678
 epoch: 79, train_loss: 0.2986, test_loss: 1.9812, test_f1: 0.6343
 epoch: 80, train_loss: 0.2603, test_loss: 2.0592, test_f1: 0.6275
 epoch: 81, train_loss: 0.2916, test_loss: 1.9680, test_f1: 0.6114
 epoch: 82, train_loss: 0.2723, test_loss: 2.1637, test_f1: 0.6485
 epoch: 83, train_loss: 0.2930, test_loss: 2.0264, test_f1: 0.6095
 epoch: 84, train_loss: 0.2968, test_loss: 2.8350, test_f1: 0.5351
 epoch: 85, train_loss: 0.2590, test_loss: 1.8748, test_f1: 0.6031
 epoch: 86, train_loss: 0.2389, test_loss: 2.0499, test_f1: 0.5956
 epoch: 87, train_loss: 0.2482, test_loss: 2.2889, test_f1: 0.6368
 epoch: 88, train_loss: 0.2492, test_loss: 2.3343, test_f1: 0.6083
 epoch: 89, train_loss: 0.2751, test_loss: 2.3434, test_f1: 0.5971
 epoch: 90, train_loss: 0.2856, test_loss: 1.9942, test_f1: 0.6287
 epoch: 91, train_loss: 0.2712, test_loss: 2.3882, test_f1: 0.6036
 epoch: 92, train_loss: 0.2276, test_loss: 2.5390, test_f1: 0.6249
 epoch: 93, train_loss: 0.2824, test_loss: 2.0418, test_f1: 0.6338
 epoch: 94, train_loss: 0.2647, test_loss: 2.2763, test_f1: 0.5549
 epoch: 95, train_loss: 0.3233, test_loss: 1.8530, test_f1: 0.6218
 epoch: 96, train_loss: 0.2514, test_loss: 2.3173, test_f1: 0.6378
 epoch: 97, train_loss: 0.2511, test_loss: 2.1229, test_f1: 0.6188
 epoch: 98, train_loss: 0.2279, test_loss: 2.3267, test_f1: 0.6243
 epoch: 99, train_loss: 0.1881, test_loss: 2.2489, test_f1: 0.6172
##################ITERATION #3 ****************************************
 epoch: 0, train_loss: 1.3335, test_loss: 1.5821, test_f1: 0.2844
 epoch: 1, train_loss: 0.9684, test_loss: 1.7571, test_f1: 0.1585
 epoch: 2, train_loss: 0.9069, test_loss: 1.3761, test_f1: 0.3825
 epoch: 3, train_loss: 0.8449, test_loss: 1.5619, test_f1: 0.4613
 epoch: 4, train_loss: 0.7978, test_loss: 1.2431, test_f1: 0.4716
 epoch: 5, train_loss: 0.7704, test_loss: 1.5310, test_f1: 0.5288
 epoch: 6, train_loss: 0.7697, test_loss: 1.0449, test_f1: 0.5769
 epoch: 7, train_loss: 0.7453, test_loss: 1.0871, test_f1: 0.5299
 epoch: 8, train_loss: 0.7407, test_loss: 1.1102, test_f1: 0.5508
 epoch: 9, train_loss: 0.7186, test_loss: 1.0973, test_f1: 0.5125
 epoch: 10, train_loss: 0.7194, test_loss: 0.9995, test_f1: 0.6140
 epoch: 11, train_loss: 0.7479, test_loss: 1.0887, test_f1: 0.5919
 epoch: 12, train_loss: 0.7251, test_loss: 0.9661, test_f1: 0.6406
 epoch: 13, train_loss: 0.7108, test_loss: 1.0072, test_f1: 0.6278
 epoch: 14, train_loss: 0.6643, test_loss: 1.0134, test_f1: 0.6052
 epoch: 15, train_loss: 0.6435, test_loss: 1.1157, test_f1: 0.5759
 epoch: 16, train_loss: 0.6628, test_loss: 1.1416, test_f1: 0.6054
 epoch: 17, train_loss: 0.6472, test_loss: 0.9190, test_f1: 0.6487
 epoch: 18, train_loss: 0.6657, test_loss: 1.3972, test_f1: 0.5883
 epoch: 19, train_loss: 0.6879, test_loss: 1.2232, test_f1: 0.5572
 epoch: 20, train_loss: 0.6291, test_loss: 1.0884, test_f1: 0.6101
 epoch: 21, train_loss: 0.6214, test_loss: 1.0188, test_f1: 0.6173
 epoch: 22, train_loss: 0.6470, test_loss: 1.2630, test_f1: 0.5118
 epoch: 23, train_loss: 0.6081, test_loss: 1.1083, test_f1: 0.5471
 epoch: 24, train_loss: 0.6237, test_loss: 1.1501, test_f1: 0.5987
 epoch: 25, train_loss: 0.6011, test_loss: 1.0490, test_f1: 0.6791
 epoch: 26, train_loss: 0.6190, test_loss: 1.1093, test_f1: 0.5319
 epoch: 27, train_loss: 0.6187, test_loss: 1.2240, test_f1: 0.5710
 epoch: 28, train_loss: 0.6088, test_loss: 0.9304, test_f1: 0.6668
 epoch: 29, train_loss: 0.5600, test_loss: 1.2009, test_f1: 0.5936
 epoch: 30, train_loss: 0.5516, test_loss: 0.9711, test_f1: 0.6854
 epoch: 31, train_loss: 0.5932, test_loss: 0.9694, test_f1: 0.6638
 epoch: 32, train_loss: 0.5485, test_loss: 1.1412, test_f1: 0.6449
 epoch: 33, train_loss: 0.5831, test_loss: 1.1778, test_f1: 0.6012
 epoch: 34, train_loss: 0.5711, test_loss: 0.9497, test_f1: 0.6603
 epoch: 35, train_loss: 0.5366, test_loss: 1.0441, test_f1: 0.6378
 epoch: 36, train_loss: 0.5263, test_loss: 1.2912, test_f1: 0.5496
 epoch: 37, train_loss: 0.5383, test_loss: 1.1435, test_f1: 0.5884
 epoch: 38, train_loss: 0.4966, test_loss: 1.2320, test_f1: 0.6226
 epoch: 39, train_loss: 0.5260, test_loss: 1.0816, test_f1: 0.5865
 epoch: 40, train_loss: 0.6107, test_loss: 1.0047, test_f1: 0.6019
 epoch: 41, train_loss: 0.5906, test_loss: 1.1127, test_f1: 0.6043
 epoch: 42, train_loss: 0.5627, test_loss: 0.9776, test_f1: 0.6398
 epoch: 43, train_loss: 0.5375, test_loss: 1.2226, test_f1: 0.5661
 epoch: 44, train_loss: 0.5472, test_loss: 1.1339, test_f1: 0.6176
 epoch: 45, train_loss: 0.5324, test_loss: 1.2358, test_f1: 0.6037
 epoch: 46, train_loss: 0.5358, test_loss: 1.1178, test_f1: 0.6277
 epoch: 47, train_loss: 0.5089, test_loss: 1.0674, test_f1: 0.6484
 epoch: 48, train_loss: 0.5093, test_loss: 1.6798, test_f1: 0.4832
 epoch: 49, train_loss: 0.4389, test_loss: 1.2598, test_f1: 0.6001
 epoch: 50, train_loss: 0.4549, test_loss: 1.3458, test_f1: 0.6015
 epoch: 51, train_loss: 0.4307, test_loss: 1.1546, test_f1: 0.6306
 epoch: 52, train_loss: 0.3953, test_loss: 1.3887, test_f1: 0.6374
 epoch: 53, train_loss: 0.3730, test_loss: 1.5025, test_f1: 0.6305
 epoch: 54, train_loss: 0.3593, test_loss: 1.4385, test_f1: 0.6312
 epoch: 55, train_loss: 0.3791, test_loss: 1.2633, test_f1: 0.6374
 epoch: 56, train_loss: 0.3516, test_loss: 1.5793, test_f1: 0.5784
 epoch: 57, train_loss: 0.3508, test_loss: 1.5022, test_f1: 0.6002
 epoch: 58, train_loss: 0.3260, test_loss: 1.5501, test_f1: 0.6139
 epoch: 59, train_loss: 0.3526, test_loss: 1.5679, test_f1: 0.6244
 epoch: 60, train_loss: 0.3790, test_loss: 1.4546, test_f1: 0.6334
 epoch: 61, train_loss: 0.3320, test_loss: 1.7635, test_f1: 0.5901
 epoch: 62, train_loss: 0.3390, test_loss: 1.5928, test_f1: 0.6242
 epoch: 63, train_loss: 0.3467, test_loss: 1.8610, test_f1: 0.5638
 epoch: 64, train_loss: 0.3533, test_loss: 1.6165, test_f1: 0.5935
 epoch: 65, train_loss: 0.3306, test_loss: 1.5133, test_f1: 0.6092
 epoch: 66, train_loss: 0.3112, test_loss: 1.6758, test_f1: 0.5704
 epoch: 67, train_loss: 0.3356, test_loss: 1.6915, test_f1: 0.5943
 epoch: 68, train_loss: 0.3213, test_loss: 2.1105, test_f1: 0.5889
 epoch: 69, train_loss: 0.3047, test_loss: 1.7249, test_f1: 0.6155
 epoch: 70, train_loss: 0.2924, test_loss: 1.4748, test_f1: 0.6885
 epoch: 71, train_loss: 0.2929, test_loss: 1.7113, test_f1: 0.5968
 epoch: 72, train_loss: 0.3635, test_loss: 1.6685, test_f1: 0.6352
 epoch: 73, train_loss: 0.3467, test_loss: 1.6754, test_f1: 0.5844
 epoch: 74, train_loss: 0.3127, test_loss: 1.3709, test_f1: 0.6784
 epoch: 75, train_loss: 0.3087, test_loss: 1.4978, test_f1: 0.6395
 epoch: 76, train_loss: 0.2703, test_loss: 1.9343, test_f1: 0.5748
 epoch: 77, train_loss: 0.3331, test_loss: 1.6919, test_f1: 0.6196
 epoch: 78, train_loss: 0.3193, test_loss: 1.6158, test_f1: 0.6143
 epoch: 79, train_loss: 0.2767, test_loss: 1.4813, test_f1: 0.5930
 epoch: 80, train_loss: 0.2931, test_loss: 1.5559, test_f1: 0.6396
 epoch: 81, train_loss: 0.2795, test_loss: 1.9449, test_f1: 0.5982
 epoch: 82, train_loss: 0.2800, test_loss: 1.5952, test_f1: 0.6127
 epoch: 83, train_loss: 0.2707, test_loss: 1.7169, test_f1: 0.6159
 epoch: 84, train_loss: 0.2530, test_loss: 2.0035, test_f1: 0.6524
 epoch: 85, train_loss: 0.2722, test_loss: 2.0805, test_f1: 0.5761
 epoch: 86, train_loss: 0.2636, test_loss: 1.6916, test_f1: 0.6246
 epoch: 87, train_loss: 0.2562, test_loss: 1.7021, test_f1: 0.6753
 epoch: 88, train_loss: 0.2804, test_loss: 1.9010, test_f1: 0.6433
 epoch: 89, train_loss: 0.2550, test_loss: 1.5423, test_f1: 0.6419
 epoch: 90, train_loss: 0.2462, test_loss: 1.8504, test_f1: 0.6641
 epoch: 91, train_loss: 0.2398, test_loss: 1.9987, test_f1: 0.6256
 epoch: 92, train_loss: 0.2133, test_loss: 1.7756, test_f1: 0.6452
 epoch: 93, train_loss: 0.2374, test_loss: 1.7043, test_f1: 0.6682
 epoch: 94, train_loss: 0.2428, test_loss: 1.9696, test_f1: 0.6636
 epoch: 95, train_loss: 0.2130, test_loss: 3.2174, test_f1: 0.5305
 epoch: 96, train_loss: 0.2674, test_loss: 1.9759, test_f1: 0.6024
 epoch: 97, train_loss: 0.2496, test_loss: 1.8825, test_f1: 0.6304
 epoch: 98, train_loss: 0.2338, test_loss: 2.0068, test_f1: 0.6754
 epoch: 99, train_loss: 0.2061, test_loss: 2.6149, test_f1: 0.5972
##################ITERATION #4 ****************************************
 epoch: 0, train_loss: 1.5193, test_loss: 1.3740, test_f1: 0.1432
 epoch: 1, train_loss: 1.0438, test_loss: 1.3557, test_f1: 0.2075
 epoch: 2, train_loss: 0.9330, test_loss: 1.1167, test_f1: 0.5277
 epoch: 3, train_loss: 0.8610, test_loss: 1.2616, test_f1: 0.4845
 epoch: 4, train_loss: 0.8377, test_loss: 1.1304, test_f1: 0.5608
 epoch: 5, train_loss: 0.8154, test_loss: 1.0366, test_f1: 0.5788
 epoch: 6, train_loss: 0.8115, test_loss: 0.9976, test_f1: 0.5147
 epoch: 7, train_loss: 0.8054, test_loss: 1.0484, test_f1: 0.5556
 epoch: 8, train_loss: 0.7762, test_loss: 1.1649, test_f1: 0.4761
 epoch: 9, train_loss: 0.7447, test_loss: 1.6524, test_f1: 0.3890
 epoch: 10, train_loss: 0.7194, test_loss: 0.9914, test_f1: 0.5788
 epoch: 11, train_loss: 0.7046, test_loss: 1.6622, test_f1: 0.4619
 epoch: 12, train_loss: 0.6970, test_loss: 1.0879, test_f1: 0.5845
 epoch: 13, train_loss: 0.7062, test_loss: 0.9746, test_f1: 0.5501
 epoch: 14, train_loss: 0.7101, test_loss: 1.2618, test_f1: 0.6075
 epoch: 15, train_loss: 0.6749, test_loss: 1.0984, test_f1: 0.6110
 epoch: 16, train_loss: 0.6945, test_loss: 1.0924, test_f1: 0.5766
 epoch: 17, train_loss: 0.6886, test_loss: 1.1697, test_f1: 0.5400
 epoch: 18, train_loss: 0.6882, test_loss: 1.2345, test_f1: 0.5221
 epoch: 19, train_loss: 0.7007, test_loss: 1.2978, test_f1: 0.5365
 epoch: 20, train_loss: 0.6625, test_loss: 1.1528, test_f1: 0.5927
 epoch: 21, train_loss: 0.6794, test_loss: 1.1161, test_f1: 0.5574
 epoch: 22, train_loss: 0.6879, test_loss: 1.0356, test_f1: 0.5758
 epoch: 23, train_loss: 0.6380, test_loss: 1.4376, test_f1: 0.5643
 epoch: 24, train_loss: 0.6542, test_loss: 1.4964, test_f1: 0.5597
 epoch: 25, train_loss: 0.6410, test_loss: 1.1965, test_f1: 0.5895
 epoch: 26, train_loss: 0.6334, test_loss: 1.4077, test_f1: 0.6107
 epoch: 27, train_loss: 0.5913, test_loss: 1.1292, test_f1: 0.6219
 epoch: 28, train_loss: 0.5724, test_loss: 1.0114, test_f1: 0.6527
 epoch: 29, train_loss: 0.5840, test_loss: 1.0653, test_f1: 0.6058
 epoch: 30, train_loss: 0.5852, test_loss: 1.0693, test_f1: 0.6314
 epoch: 31, train_loss: 0.5705, test_loss: 1.4839, test_f1: 0.6000
 epoch: 32, train_loss: 0.5360, test_loss: 1.1997, test_f1: 0.6435
 epoch: 33, train_loss: 0.5802, test_loss: 1.6828, test_f1: 0.5552
 epoch: 34, train_loss: 0.5652, test_loss: 1.5296, test_f1: 0.5504
 epoch: 35, train_loss: 0.5948, test_loss: 1.6393, test_f1: 0.5230
 epoch: 36, train_loss: 0.5639, test_loss: 1.4729, test_f1: 0.5684
 epoch: 37, train_loss: 0.5367, test_loss: 1.3276, test_f1: 0.6204
 epoch: 38, train_loss: 0.5485, test_loss: 1.6875, test_f1: 0.5938
 epoch: 39, train_loss: 0.5489, test_loss: 1.3785, test_f1: 0.5750
 epoch: 40, train_loss: 0.5302, test_loss: 1.3808, test_f1: 0.6116
 epoch: 41, train_loss: 0.4862, test_loss: 1.7251, test_f1: 0.5755
 epoch: 42, train_loss: 0.5336, test_loss: 1.4778, test_f1: 0.6162
 epoch: 43, train_loss: 0.5127, test_loss: 1.7539, test_f1: 0.6103
 epoch: 44, train_loss: 0.5060, test_loss: 1.5463, test_f1: 0.6493
 epoch: 45, train_loss: 0.5138, test_loss: 1.3733, test_f1: 0.6037
 epoch: 46, train_loss: 0.4801, test_loss: 1.6046, test_f1: 0.6464
 epoch: 47, train_loss: 0.4489, test_loss: 1.3545, test_f1: 0.6285
 epoch: 48, train_loss: 0.4485, test_loss: 1.4623, test_f1: 0.6235
 epoch: 49, train_loss: 0.5066, test_loss: 2.1702, test_f1: 0.5745
 epoch: 50, train_loss: 0.5311, test_loss: 1.2162, test_f1: 0.5490
 epoch: 51, train_loss: 0.4588, test_loss: 1.2031, test_f1: 0.6462
 epoch: 52, train_loss: 0.4043, test_loss: 1.4381, test_f1: 0.6245
 epoch: 53, train_loss: 0.3974, test_loss: 1.6026, test_f1: 0.6349
 epoch: 54, train_loss: 0.3742, test_loss: 1.4851, test_f1: 0.6444
 epoch: 55, train_loss: 0.3582, test_loss: 1.4739, test_f1: 0.6119
 epoch: 56, train_loss: 0.3696, test_loss: 2.1619, test_f1: 0.5811
 epoch: 57, train_loss: 0.3757, test_loss: 1.4755, test_f1: 0.6280
 epoch: 58, train_loss: 0.3443, test_loss: 1.4770, test_f1: 0.6157
 epoch: 59, train_loss: 0.3699, test_loss: 1.9520, test_f1: 0.6150
 epoch: 60, train_loss: 0.3443, test_loss: 1.8025, test_f1: 0.6114
 epoch: 61, train_loss: 0.3299, test_loss: 1.4653, test_f1: 0.6372
 epoch: 62, train_loss: 0.3274, test_loss: 2.0837, test_f1: 0.5860
 epoch: 63, train_loss: 0.4224, test_loss: 1.4694, test_f1: 0.6414
 epoch: 64, train_loss: 0.3985, test_loss: 1.8027, test_f1: 0.6708
 epoch: 65, train_loss: 0.3283, test_loss: 1.6157, test_f1: 0.5939
 epoch: 66, train_loss: 0.3199, test_loss: 2.3225, test_f1: 0.6024
 epoch: 67, train_loss: 0.3372, test_loss: 1.7666, test_f1: 0.5951
 epoch: 68, train_loss: 0.3236, test_loss: 2.0489, test_f1: 0.5741
 epoch: 69, train_loss: 0.3676, test_loss: 2.4215, test_f1: 0.5812
 epoch: 70, train_loss: 0.3760, test_loss: 1.8611, test_f1: 0.5747
 epoch: 71, train_loss: 0.3188, test_loss: 1.8580, test_f1: 0.6134
 epoch: 72, train_loss: 0.3009, test_loss: 1.6785, test_f1: 0.6405
 epoch: 73, train_loss: 0.3121, test_loss: 1.5546, test_f1: 0.6136
 epoch: 74, train_loss: 0.3126, test_loss: 1.6338, test_f1: 0.6539
 epoch: 75, train_loss: 0.3083, test_loss: 1.8568, test_f1: 0.5815
 epoch: 76, train_loss: 0.2807, test_loss: 1.8585, test_f1: 0.6157
 epoch: 77, train_loss: 0.2625, test_loss: 2.1519, test_f1: 0.6406
 epoch: 78, train_loss: 0.2761, test_loss: 2.1729, test_f1: 0.6375
 epoch: 79, train_loss: 0.2869, test_loss: 2.0491, test_f1: 0.6633
 epoch: 80, train_loss: 0.3706, test_loss: 2.0858, test_f1: 0.5930
 epoch: 81, train_loss: 0.3012, test_loss: 1.8103, test_f1: 0.6126
 epoch: 82, train_loss: 0.2978, test_loss: 2.0501, test_f1: 0.5774
 epoch: 83, train_loss: 0.2956, test_loss: 1.9730, test_f1: 0.6035
 epoch: 84, train_loss: 0.2802, test_loss: 2.8289, test_f1: 0.6086
 epoch: 85, train_loss: 0.2677, test_loss: 1.9427, test_f1: 0.6217
 epoch: 86, train_loss: 0.2949, test_loss: 2.7203, test_f1: 0.6215
 epoch: 87, train_loss: 0.2694, test_loss: 2.7030, test_f1: 0.6218
 epoch: 88, train_loss: 0.2476, test_loss: 1.9304, test_f1: 0.6606
 epoch: 89, train_loss: 0.2262, test_loss: 1.8199, test_f1: 0.6429
 epoch: 90, train_loss: 0.2260, test_loss: 2.4304, test_f1: 0.6409
 epoch: 91, train_loss: 0.2444, test_loss: 2.0553, test_f1: 0.6152
 epoch: 92, train_loss: 0.2194, test_loss: 2.8630, test_f1: 0.6005
 epoch: 93, train_loss: 0.2509, test_loss: 2.3931, test_f1: 0.5639
 epoch: 94, train_loss: 0.2163, test_loss: 2.8178, test_f1: 0.6099
 epoch: 95, train_loss: 0.2294, test_loss: 2.6318, test_f1: 0.6208
 epoch: 96, train_loss: 0.2313, test_loss: 2.1664, test_f1: 0.6355
 epoch: 97, train_loss: 0.3774, test_loss: 2.1260, test_f1: 0.6313
 epoch: 98, train_loss: 0.2974, test_loss: 2.0331, test_f1: 0.6539
 epoch: 99, train_loss: 0.2527, test_loss: 2.1254, test_f1: 0.6428
##################ITERATION #5 ****************************************
 epoch: 0, train_loss: 1.3923, test_loss: 1.6242, test_f1: 0.3434
 epoch: 1, train_loss: 1.0237, test_loss: 1.5005, test_f1: 0.3438
 epoch: 2, train_loss: 0.9641, test_loss: 1.3126, test_f1: 0.4081
 epoch: 3, train_loss: 0.9351, test_loss: 1.0096, test_f1: 0.5698
 epoch: 4, train_loss: 0.8770, test_loss: 1.0469, test_f1: 0.5122
 epoch: 5, train_loss: 0.8555, test_loss: 1.0153, test_f1: 0.5819
 epoch: 6, train_loss: 0.8192, test_loss: 1.1436, test_f1: 0.4629
 epoch: 7, train_loss: 0.8143, test_loss: 1.0591, test_f1: 0.5312
 epoch: 8, train_loss: 0.7705, test_loss: 1.0231, test_f1: 0.5396
 epoch: 9, train_loss: 0.7524, test_loss: 1.0389, test_f1: 0.5604
 epoch: 10, train_loss: 0.7563, test_loss: 1.0015, test_f1: 0.6294
 epoch: 11, train_loss: 0.7355, test_loss: 1.2930, test_f1: 0.4322
 epoch: 12, train_loss: 0.7361, test_loss: 1.1338, test_f1: 0.5720
 epoch: 13, train_loss: 0.7205, test_loss: 1.1307, test_f1: 0.6118
 epoch: 14, train_loss: 0.6979, test_loss: 1.6458, test_f1: 0.4814
 epoch: 15, train_loss: 0.6704, test_loss: 1.1105, test_f1: 0.6178
 epoch: 16, train_loss: 0.6836, test_loss: 1.0324, test_f1: 0.6221
 epoch: 17, train_loss: 0.6560, test_loss: 1.0211, test_f1: 0.6011
 epoch: 18, train_loss: 0.6557, test_loss: 1.1183, test_f1: 0.6019
 epoch: 19, train_loss: 0.7134, test_loss: 0.9787, test_f1: 0.5786
 epoch: 20, train_loss: 0.6454, test_loss: 1.2127, test_f1: 0.5301
 epoch: 21, train_loss: 0.6189, test_loss: 1.0605, test_f1: 0.5513
 epoch: 22, train_loss: 0.6237, test_loss: 1.1328, test_f1: 0.5895
 epoch: 23, train_loss: 0.5797, test_loss: 1.1896, test_f1: 0.5441
 epoch: 24, train_loss: 0.6188, test_loss: 1.1568, test_f1: 0.5855
 epoch: 25, train_loss: 0.6039, test_loss: 1.1144, test_f1: 0.6267
 epoch: 26, train_loss: 0.5971, test_loss: 1.2725, test_f1: 0.6150
 epoch: 27, train_loss: 0.5615, test_loss: 1.0017, test_f1: 0.6311
 epoch: 28, train_loss: 0.5752, test_loss: 0.9309, test_f1: 0.6482
 epoch: 29, train_loss: 0.6192, test_loss: 1.1025, test_f1: 0.6267
 epoch: 30, train_loss: 0.5606, test_loss: 1.1822, test_f1: 0.5585
 epoch: 31, train_loss: 0.5398, test_loss: 1.3238, test_f1: 0.5260
 epoch: 32, train_loss: 0.5564, test_loss: 1.0310, test_f1: 0.5986
 epoch: 33, train_loss: 0.5523, test_loss: 1.2019, test_f1: 0.5326
 epoch: 34, train_loss: 0.5707, test_loss: 1.4456, test_f1: 0.5716
 epoch: 35, train_loss: 0.5700, test_loss: 1.2059, test_f1: 0.6222
 epoch: 36, train_loss: 0.5300, test_loss: 1.1496, test_f1: 0.5860
 epoch: 37, train_loss: 0.5423, test_loss: 1.3524, test_f1: 0.5587
 epoch: 38, train_loss: 0.4770, test_loss: 1.2649, test_f1: 0.5890
 epoch: 39, train_loss: 0.4818, test_loss: 1.2390, test_f1: 0.6188
 epoch: 40, train_loss: 0.5157, test_loss: 1.1944, test_f1: 0.5897
 epoch: 41, train_loss: 0.4687, test_loss: 1.2740, test_f1: 0.5968
 epoch: 42, train_loss: 0.4906, test_loss: 1.1669, test_f1: 0.6122
 epoch: 43, train_loss: 0.5065, test_loss: 1.3094, test_f1: 0.5500
 epoch: 44, train_loss: 0.4964, test_loss: 1.3018, test_f1: 0.5725
 epoch: 45, train_loss: 0.4601, test_loss: 1.1880, test_f1: 0.6481
 epoch: 46, train_loss: 0.4592, test_loss: 1.1833, test_f1: 0.5896
 epoch: 47, train_loss: 0.4283, test_loss: 1.2657, test_f1: 0.5876
 epoch: 48, train_loss: 0.4340, test_loss: 1.3595, test_f1: 0.5578
 epoch: 49, train_loss: 0.4217, test_loss: 1.2476, test_f1: 0.6219
 epoch: 50, train_loss: 0.5126, test_loss: 1.9726, test_f1: 0.4840
 epoch: 51, train_loss: 0.4560, test_loss: 1.4061, test_f1: 0.5955
 epoch: 52, train_loss: 0.3913, test_loss: 1.2664, test_f1: 0.6259
 epoch: 53, train_loss: 0.3513, test_loss: 1.2946, test_f1: 0.6040
 epoch: 54, train_loss: 0.3333, test_loss: 1.3286, test_f1: 0.5928
 epoch: 55, train_loss: 0.3263, test_loss: 1.3642, test_f1: 0.5944
 epoch: 56, train_loss: 0.3136, test_loss: 1.2951, test_f1: 0.6250
 epoch: 57, train_loss: 0.3413, test_loss: 1.2529, test_f1: 0.6259
 epoch: 58, train_loss: 0.3122, test_loss: 1.4202, test_f1: 0.6197
 epoch: 59, train_loss: 0.3230, test_loss: 1.6750, test_f1: 0.5875
 epoch: 60, train_loss: 0.3242, test_loss: 1.6792, test_f1: 0.5941
 epoch: 61, train_loss: 0.3390, test_loss: 1.4799, test_f1: 0.6202
 epoch: 62, train_loss: 0.3046, test_loss: 1.4282, test_f1: 0.6476
 epoch: 63, train_loss: 0.3307, test_loss: 1.3744, test_f1: 0.6273
 epoch: 64, train_loss: 0.3287, test_loss: 1.5053, test_f1: 0.5801
 epoch: 65, train_loss: 0.2693, test_loss: 1.5411, test_f1: 0.6230
 epoch: 66, train_loss: 0.3017, test_loss: 1.6880, test_f1: 0.5533
 epoch: 67, train_loss: 0.2573, test_loss: 1.3875, test_f1: 0.6167
 epoch: 68, train_loss: 0.2698, test_loss: 1.6982, test_f1: 0.6141
 epoch: 69, train_loss: 0.3030, test_loss: 1.5579, test_f1: 0.6138
 epoch: 70, train_loss: 0.2562, test_loss: 1.6225, test_f1: 0.6338
 epoch: 71, train_loss: 0.2615, test_loss: 1.8240, test_f1: 0.5716
 epoch: 72, train_loss: 0.2783, test_loss: 1.6365, test_f1: 0.5765
 epoch: 73, train_loss: 0.2516, test_loss: 1.6735, test_f1: 0.6371
 epoch: 74, train_loss: 0.2650, test_loss: 2.1636, test_f1: 0.5537
 epoch: 75, train_loss: 0.2445, test_loss: 1.5030, test_f1: 0.6265
 epoch: 76, train_loss: 0.2405, test_loss: 1.9368, test_f1: 0.6280
 epoch: 77, train_loss: 0.2919, test_loss: 1.7458, test_f1: 0.6199
 epoch: 78, train_loss: 0.2567, test_loss: 1.7514, test_f1: 0.6067
 epoch: 79, train_loss: 0.2726, test_loss: 1.5950, test_f1: 0.6225
 epoch: 80, train_loss: 0.2276, test_loss: 1.6549, test_f1: 0.6306
 epoch: 81, train_loss: 0.2258, test_loss: 1.7857, test_f1: 0.6079
 epoch: 82, train_loss: 0.2152, test_loss: 1.6794, test_f1: 0.6153
 epoch: 83, train_loss: 0.2339, test_loss: 1.9742, test_f1: 0.5942
 epoch: 84, train_loss: 0.2728, test_loss: 1.6858, test_f1: 0.6288
 epoch: 85, train_loss: 0.2434, test_loss: 1.7298, test_f1: 0.5923
 epoch: 86, train_loss: 0.2360, test_loss: 1.6167, test_f1: 0.6555
 epoch: 87, train_loss: 0.2139, test_loss: 1.4683, test_f1: 0.6576
 epoch: 88, train_loss: 0.2471, test_loss: 1.8923, test_f1: 0.5949
 epoch: 89, train_loss: 0.1897, test_loss: 1.7229, test_f1: 0.6323
 epoch: 90, train_loss: 0.2378, test_loss: 1.7149, test_f1: 0.6301
 epoch: 91, train_loss: 0.2205, test_loss: 1.9812, test_f1: 0.5986
 epoch: 92, train_loss: 0.2348, test_loss: 1.8607, test_f1: 0.6039
 epoch: 93, train_loss: 0.2418, test_loss: 1.6508, test_f1: 0.5920
 epoch: 94, train_loss: 0.2052, test_loss: 1.6316, test_f1: 0.6216
 epoch: 95, train_loss: 0.2181, test_loss: 1.9520, test_f1: 0.5883
 epoch: 96, train_loss: 0.2043, test_loss: 1.8916, test_f1: 0.6087
 epoch: 97, train_loss: 0.2025, test_loss: 2.0296, test_f1: 0.6070
 epoch: 98, train_loss: 0.2454, test_loss: 1.9088, test_f1: 0.6093
 epoch: 99, train_loss: 0.2268, test_loss: 1.3816, test_f1: 0.6561
##################ITERATION #6 ****************************************
 epoch: 0, train_loss: 1.4864, test_loss: 1.5413, test_f1: 0.3507
 epoch: 1, train_loss: 1.0751, test_loss: 1.2656, test_f1: 0.3642
 epoch: 2, train_loss: 0.9608, test_loss: 1.1331, test_f1: 0.5248
 epoch: 3, train_loss: 0.9140, test_loss: 1.0384, test_f1: 0.4541
 epoch: 4, train_loss: 0.8925, test_loss: 1.0494, test_f1: 0.4784
 epoch: 5, train_loss: 0.8660, test_loss: 1.2542, test_f1: 0.3742
 epoch: 6, train_loss: 0.8319, test_loss: 1.3511, test_f1: 0.4219
 epoch: 7, train_loss: 0.7857, test_loss: 1.3585, test_f1: 0.4714
 epoch: 8, train_loss: 0.7795, test_loss: 0.9985, test_f1: 0.6035
 epoch: 9, train_loss: 0.7967, test_loss: 1.0130, test_f1: 0.5558
 epoch: 10, train_loss: 0.7830, test_loss: 1.0323, test_f1: 0.5443
 epoch: 11, train_loss: 0.7669, test_loss: 1.1293, test_f1: 0.5026
 epoch: 12, train_loss: 0.7536, test_loss: 0.9648, test_f1: 0.6011
 epoch: 13, train_loss: 0.7258, test_loss: 2.7189, test_f1: 0.2295
 epoch: 14, train_loss: 0.7583, test_loss: 1.4556, test_f1: 0.4910
 epoch: 15, train_loss: 0.7309, test_loss: 0.9157, test_f1: 0.6343
 epoch: 16, train_loss: 0.7007, test_loss: 1.1710, test_f1: 0.5708
 epoch: 17, train_loss: 0.6630, test_loss: 1.0540, test_f1: 0.6346
 epoch: 18, train_loss: 0.6974, test_loss: 0.9009, test_f1: 0.6376
 epoch: 19, train_loss: 0.6876, test_loss: 0.9394, test_f1: 0.5091
 epoch: 20, train_loss: 0.6632, test_loss: 0.9923, test_f1: 0.6107
 epoch: 21, train_loss: 0.6477, test_loss: 1.0289, test_f1: 0.6557
 epoch: 22, train_loss: 0.6115, test_loss: 1.0556, test_f1: 0.6147
 epoch: 23, train_loss: 0.6075, test_loss: 1.0913, test_f1: 0.5989
 epoch: 24, train_loss: 0.6610, test_loss: 1.1448, test_f1: 0.5556
 epoch: 25, train_loss: 0.6072, test_loss: 0.9317, test_f1: 0.6483
 epoch: 26, train_loss: 0.6267, test_loss: 1.0907, test_f1: 0.5547
 epoch: 27, train_loss: 0.6047, test_loss: 1.0384, test_f1: 0.6419
 epoch: 28, train_loss: 0.5958, test_loss: 1.1803, test_f1: 0.6108
 epoch: 29, train_loss: 0.5553, test_loss: 1.1529, test_f1: 0.6276
 epoch: 30, train_loss: 0.6080, test_loss: 1.0668, test_f1: 0.6429
 epoch: 31, train_loss: 0.5769, test_loss: 1.0116, test_f1: 0.5977
 epoch: 32, train_loss: 0.5947, test_loss: 1.3236, test_f1: 0.6163
 epoch: 33, train_loss: 0.5727, test_loss: 1.1152, test_f1: 0.6188
 epoch: 34, train_loss: 0.5701, test_loss: 1.1624, test_f1: 0.6250
 epoch: 35, train_loss: 0.5207, test_loss: 1.2898, test_f1: 0.5342
 epoch: 36, train_loss: 0.5473, test_loss: 1.1073, test_f1: 0.6303
 epoch: 37, train_loss: 0.5692, test_loss: 0.9769, test_f1: 0.5912
 epoch: 38, train_loss: 0.5174, test_loss: 1.2046, test_f1: 0.5807
 epoch: 39, train_loss: 0.4969, test_loss: 1.2186, test_f1: 0.5832
 epoch: 40, train_loss: 0.5014, test_loss: 1.3027, test_f1: 0.5804
 epoch: 41, train_loss: 0.5717, test_loss: 1.1193, test_f1: 0.5677
 epoch: 42, train_loss: 0.5657, test_loss: 1.0700, test_f1: 0.6499
 epoch: 43, train_loss: 0.5112, test_loss: 1.1825, test_f1: 0.6098
 epoch: 44, train_loss: 0.4847, test_loss: 1.1261, test_f1: 0.6760
 epoch: 45, train_loss: 0.4888, test_loss: 1.2967, test_f1: 0.5720
 epoch: 46, train_loss: 0.4736, test_loss: 1.4360, test_f1: 0.6096
 epoch: 47, train_loss: 0.4634, test_loss: 1.2915, test_f1: 0.6035
 epoch: 48, train_loss: 0.4750, test_loss: 1.3436, test_f1: 0.6477
 epoch: 49, train_loss: 0.4924, test_loss: 1.0955, test_f1: 0.6346
 epoch: 50, train_loss: 0.4713, test_loss: 1.3973, test_f1: 0.5818
 epoch: 51, train_loss: 0.4389, test_loss: 1.4095, test_f1: 0.5965
 epoch: 52, train_loss: 0.4213, test_loss: 1.3982, test_f1: 0.6367
 epoch: 53, train_loss: 0.3881, test_loss: 1.5907, test_f1: 0.5993
 epoch: 54, train_loss: 0.3673, test_loss: 1.3160, test_f1: 0.5905
 epoch: 55, train_loss: 0.3691, test_loss: 1.3399, test_f1: 0.6483
 epoch: 56, train_loss: 0.3403, test_loss: 1.4012, test_f1: 0.6718
 epoch: 57, train_loss: 0.3552, test_loss: 1.4966, test_f1: 0.6728
 epoch: 58, train_loss: 0.3468, test_loss: 1.5444, test_f1: 0.6430
 epoch: 59, train_loss: 0.3738, test_loss: 1.3793, test_f1: 0.6420
 epoch: 60, train_loss: 0.3703, test_loss: 1.4985, test_f1: 0.6320
 epoch: 61, train_loss: 0.3557, test_loss: 1.4067, test_f1: 0.6591
 epoch: 62, train_loss: 0.3580, test_loss: 1.6009, test_f1: 0.6405
 epoch: 63, train_loss: 0.3625, test_loss: 1.4533, test_f1: 0.6425
 epoch: 64, train_loss: 0.3545, test_loss: 1.3768, test_f1: 0.6713
 epoch: 65, train_loss: 0.3165, test_loss: 1.4585, test_f1: 0.6457
 epoch: 66, train_loss: 0.3253, test_loss: 1.5860, test_f1: 0.6029
 epoch: 67, train_loss: 0.3516, test_loss: 1.5187, test_f1: 0.6595
 epoch: 68, train_loss: 0.3066, test_loss: 1.5974, test_f1: 0.6696
 epoch: 69, train_loss: 0.2865, test_loss: 1.5683, test_f1: 0.6784
 epoch: 70, train_loss: 0.3010, test_loss: 1.6628, test_f1: 0.6353
 epoch: 71, train_loss: 0.2930, test_loss: 1.8163, test_f1: 0.6521
 epoch: 72, train_loss: 0.3034, test_loss: 1.7700, test_f1: 0.6652
 epoch: 73, train_loss: 0.3099, test_loss: 1.6505, test_f1: 0.6619
 epoch: 74, train_loss: 0.2933, test_loss: 1.4735, test_f1: 0.6322
 epoch: 75, train_loss: 0.3561, test_loss: 1.7850, test_f1: 0.6255
 epoch: 76, train_loss: 0.3484, test_loss: 1.4383, test_f1: 0.6418
 epoch: 77, train_loss: 0.3199, test_loss: 1.8047, test_f1: 0.5846
 epoch: 78, train_loss: 0.2635, test_loss: 1.6858, test_f1: 0.6768
 epoch: 79, train_loss: 0.3198, test_loss: 1.8168, test_f1: 0.6144
 epoch: 80, train_loss: 0.3177, test_loss: 1.7659, test_f1: 0.5979
 epoch: 81, train_loss: 0.2869, test_loss: 1.6070, test_f1: 0.6627
 epoch: 82, train_loss: 0.2846, test_loss: 1.5434, test_f1: 0.6939
 epoch: 83, train_loss: 0.2488, test_loss: 2.1328, test_f1: 0.6357
 epoch: 84, train_loss: 0.2981, test_loss: 1.8143, test_f1: 0.6164
 epoch: 85, train_loss: 0.2687, test_loss: 1.7942, test_f1: 0.6641
 epoch: 86, train_loss: 0.2515, test_loss: 1.7540, test_f1: 0.6974
 epoch: 87, train_loss: 0.2396, test_loss: 1.9419, test_f1: 0.6841
 epoch: 88, train_loss: 0.2919, test_loss: 1.7798, test_f1: 0.6042
 epoch: 89, train_loss: 0.2649, test_loss: 1.7863, test_f1: 0.6538
 epoch: 90, train_loss: 0.2854, test_loss: 1.6326, test_f1: 0.6510
 epoch: 91, train_loss: 0.2816, test_loss: 1.7011, test_f1: 0.6763
 epoch: 92, train_loss: 0.3234, test_loss: 1.9251, test_f1: 0.6641
 epoch: 93, train_loss: 0.2554, test_loss: 1.8150, test_f1: 0.6606
 epoch: 94, train_loss: 0.2660, test_loss: 1.8715, test_f1: 0.6364
 epoch: 95, train_loss: 0.2449, test_loss: 1.9459, test_f1: 0.6191
 epoch: 96, train_loss: 0.2638, test_loss: 1.7434, test_f1: 0.6591
 epoch: 97, train_loss: 0.2801, test_loss: 1.7046, test_f1: 0.6562
 epoch: 98, train_loss: 0.2302, test_loss: 1.7588, test_f1: 0.6728
 epoch: 99, train_loss: 0.2544, test_loss: 1.9375, test_f1: 0.6625
##################ITERATION #7 ****************************************
 epoch: 0, train_loss: 1.4490, test_loss: 1.3796, test_f1: 0.2565
 epoch: 1, train_loss: 1.0569, test_loss: 1.3926, test_f1: 0.3690
 epoch: 2, train_loss: 0.9339, test_loss: 1.3024, test_f1: 0.2593
 epoch: 3, train_loss: 0.8997, test_loss: 1.0846, test_f1: 0.3961
 epoch: 4, train_loss: 0.8501, test_loss: 1.0592, test_f1: 0.5507
 epoch: 5, train_loss: 0.8210, test_loss: 1.0376, test_f1: 0.5436
 epoch: 6, train_loss: 0.7914, test_loss: 0.9574, test_f1: 0.5912
 epoch: 7, train_loss: 0.8003, test_loss: 1.0276, test_f1: 0.4922
 epoch: 8, train_loss: 0.7734, test_loss: 1.3049, test_f1: 0.4188
 epoch: 9, train_loss: 0.7659, test_loss: 2.4902, test_f1: 0.3585
 epoch: 10, train_loss: 0.7571, test_loss: 1.7160, test_f1: 0.5413
 epoch: 11, train_loss: 0.7483, test_loss: 1.1897, test_f1: 0.5503
 epoch: 12, train_loss: 0.7354, test_loss: 1.1425, test_f1: 0.5388
 epoch: 13, train_loss: 0.7127, test_loss: 1.0237, test_f1: 0.6177
 epoch: 14, train_loss: 0.7009, test_loss: 1.3507, test_f1: 0.5400
 epoch: 15, train_loss: 0.7119, test_loss: 1.2362, test_f1: 0.6068
 epoch: 16, train_loss: 0.6896, test_loss: 0.9607, test_f1: 0.6633
 epoch: 17, train_loss: 0.6761, test_loss: 1.0970, test_f1: 0.5520
 epoch: 18, train_loss: 0.6844, test_loss: 1.2101, test_f1: 0.5744
 epoch: 19, train_loss: 0.6712, test_loss: 1.1548, test_f1: 0.5309
 epoch: 20, train_loss: 0.6576, test_loss: 1.1890, test_f1: 0.5517
 epoch: 21, train_loss: 0.6572, test_loss: 1.0693, test_f1: 0.6280
 epoch: 22, train_loss: 0.6775, test_loss: 1.3359, test_f1: 0.5379
 epoch: 23, train_loss: 0.6617, test_loss: 1.2792, test_f1: 0.6140
 epoch: 24, train_loss: 0.6330, test_loss: 1.1487, test_f1: 0.6186
 epoch: 25, train_loss: 0.6528, test_loss: 1.1286, test_f1: 0.6165
 epoch: 26, train_loss: 0.6433, test_loss: 1.0381, test_f1: 0.6243
 epoch: 27, train_loss: 0.6204, test_loss: 1.2029, test_f1: 0.5570
 epoch: 28, train_loss: 0.6212, test_loss: 1.3122, test_f1: 0.4697
 epoch: 29, train_loss: 0.5975, test_loss: 1.1725, test_f1: 0.5799
 epoch: 30, train_loss: 0.6003, test_loss: 1.5128, test_f1: 0.6021
 epoch: 31, train_loss: 0.5632, test_loss: 1.6842, test_f1: 0.5269
 epoch: 32, train_loss: 0.5539, test_loss: 1.1791, test_f1: 0.5311
 epoch: 33, train_loss: 0.5956, test_loss: 1.5660, test_f1: 0.5643
 epoch: 34, train_loss: 0.5815, test_loss: 1.2870, test_f1: 0.6234
 epoch: 35, train_loss: 0.5421, test_loss: 1.1864, test_f1: 0.6072
 epoch: 36, train_loss: 0.6455, test_loss: 1.2629, test_f1: 0.5924
 epoch: 37, train_loss: 0.6137, test_loss: 1.1998, test_f1: 0.6210
 epoch: 38, train_loss: 0.5872, test_loss: 1.4335, test_f1: 0.5817
 epoch: 39, train_loss: 0.5389, test_loss: 1.2480, test_f1: 0.6100
 epoch: 40, train_loss: 0.5579, test_loss: 1.1571, test_f1: 0.5743
 epoch: 41, train_loss: 0.5581, test_loss: 1.2318, test_f1: 0.5834
 epoch: 42, train_loss: 0.5489, test_loss: 1.3229, test_f1: 0.6415
 epoch: 43, train_loss: 0.5214, test_loss: 1.2711, test_f1: 0.6421
 epoch: 44, train_loss: 0.4888, test_loss: 1.2127, test_f1: 0.6031
 epoch: 45, train_loss: 0.4821, test_loss: 1.2062, test_f1: 0.6248
 epoch: 46, train_loss: 0.5729, test_loss: 1.4251, test_f1: 0.6058
 epoch: 47, train_loss: 0.5761, test_loss: 1.2650, test_f1: 0.6337
 epoch: 48, train_loss: 0.5194, test_loss: 1.0394, test_f1: 0.6458
 epoch: 49, train_loss: 0.4939, test_loss: 1.3101, test_f1: 0.5977
 epoch: 50, train_loss: 0.4663, test_loss: 1.1957, test_f1: 0.6317
 epoch: 51, train_loss: 0.4418, test_loss: 1.3386, test_f1: 0.6417
 epoch: 52, train_loss: 0.4476, test_loss: 1.3206, test_f1: 0.6337
 epoch: 53, train_loss: 0.4124, test_loss: 1.5895, test_f1: 0.6243
 epoch: 54, train_loss: 0.4099, test_loss: 1.7140, test_f1: 0.5967
 epoch: 55, train_loss: 0.4002, test_loss: 1.7190, test_f1: 0.6118
 epoch: 56, train_loss: 0.3719, test_loss: 1.3998, test_f1: 0.6442
 epoch: 57, train_loss: 0.4040, test_loss: 1.5855, test_f1: 0.6437
 epoch: 58, train_loss: 0.3546, test_loss: 1.5581, test_f1: 0.6230
 epoch: 59, train_loss: 0.3592, test_loss: 1.5690, test_f1: 0.6146
 epoch: 60, train_loss: 0.3380, test_loss: 1.6567, test_f1: 0.6075
 epoch: 61, train_loss: 0.3856, test_loss: 1.5022, test_f1: 0.6377
 epoch: 62, train_loss: 0.3757, test_loss: 1.7099, test_f1: 0.6257
 epoch: 63, train_loss: 0.3583, test_loss: 1.7422, test_f1: 0.6528
 epoch: 64, train_loss: 0.4368, test_loss: 1.3819, test_f1: 0.6274
 epoch: 65, train_loss: 0.4185, test_loss: 1.9276, test_f1: 0.6169
 epoch: 66, train_loss: 0.4105, test_loss: 1.3333, test_f1: 0.6609
 epoch: 67, train_loss: 0.4051, test_loss: 1.2830, test_f1: 0.6684
 epoch: 68, train_loss: 0.3457, test_loss: 1.5686, test_f1: 0.6252
 epoch: 69, train_loss: 0.3323, test_loss: 1.7227, test_f1: 0.6032
 epoch: 70, train_loss: 0.3565, test_loss: 1.8367, test_f1: 0.6190
 epoch: 71, train_loss: 0.3218, test_loss: 1.6015, test_f1: 0.6296
 epoch: 72, train_loss: 0.3276, test_loss: 1.8110, test_f1: 0.6205
 epoch: 73, train_loss: 0.3334, test_loss: 1.7051, test_f1: 0.6599
 epoch: 74, train_loss: 0.3227, test_loss: 1.6351, test_f1: 0.6480
 epoch: 75, train_loss: 0.3374, test_loss: 1.6897, test_f1: 0.6765
 epoch: 76, train_loss: 0.2993, test_loss: 1.6485, test_f1: 0.6631
 epoch: 77, train_loss: 0.3034, test_loss: 1.5857, test_f1: 0.6602
 epoch: 78, train_loss: 0.3104, test_loss: 1.9936, test_f1: 0.6138
 epoch: 79, train_loss: 0.3153, test_loss: 2.1006, test_f1: 0.6264
 epoch: 80, train_loss: 0.3065, test_loss: 2.1346, test_f1: 0.6157
 epoch: 81, train_loss: 0.3548, test_loss: 1.9636, test_f1: 0.6596
 epoch: 82, train_loss: 0.3724, test_loss: 1.7916, test_f1: 0.6110
 epoch: 83, train_loss: 0.3351, test_loss: 1.9971, test_f1: 0.6364
 epoch: 84, train_loss: 0.2990, test_loss: 1.7277, test_f1: 0.6002
 epoch: 85, train_loss: 0.3045, test_loss: 1.6240, test_f1: 0.6221
 epoch: 86, train_loss: 0.3433, test_loss: 1.6857, test_f1: 0.6529
 epoch: 87, train_loss: 0.3257, test_loss: 1.5421, test_f1: 0.6290
 epoch: 88, train_loss: 0.3208, test_loss: 1.9806, test_f1: 0.6021
 epoch: 89, train_loss: 0.2849, test_loss: 1.9773, test_f1: 0.6407
 epoch: 90, train_loss: 0.3353, test_loss: 1.9579, test_f1: 0.6381
 epoch: 91, train_loss: 0.3005, test_loss: 1.9335, test_f1: 0.6081
 epoch: 92, train_loss: 0.3234, test_loss: 1.8851, test_f1: 0.5552
 epoch: 93, train_loss: 0.3337, test_loss: 1.7900, test_f1: 0.6726
 epoch: 94, train_loss: 0.2908, test_loss: 1.9489, test_f1: 0.6299
 epoch: 95, train_loss: 0.2980, test_loss: 1.6842, test_f1: 0.6495
 epoch: 96, train_loss: 0.2701, test_loss: 1.9174, test_f1: 0.6110
 epoch: 97, train_loss: 0.2690, test_loss: 2.1454, test_f1: 0.6072
 epoch: 98, train_loss: 0.2303, test_loss: 2.0802, test_f1: 0.6271
 epoch: 99, train_loss: 0.2753, test_loss: 2.0952, test_f1: 0.6527
##################ITERATION #8 ****************************************
 epoch: 0, train_loss: 1.4279, test_loss: 1.4710, test_f1: 0.4054
 epoch: 1, train_loss: 0.9947, test_loss: 1.2076, test_f1: 0.4118
 epoch: 2, train_loss: 0.9070, test_loss: 1.0486, test_f1: 0.5397
 epoch: 3, train_loss: 0.9082, test_loss: 1.1100, test_f1: 0.4222
 epoch: 4, train_loss: 0.8974, test_loss: 1.1327, test_f1: 0.5209
 epoch: 5, train_loss: 0.8449, test_loss: 1.4104, test_f1: 0.3713
 epoch: 6, train_loss: 0.8331, test_loss: 1.2019, test_f1: 0.3939
 epoch: 7, train_loss: 0.7981, test_loss: 0.9712, test_f1: 0.5822
 epoch: 8, train_loss: 0.7718, test_loss: 1.1071, test_f1: 0.5754
 epoch: 9, train_loss: 0.7521, test_loss: 0.9702, test_f1: 0.5411
 epoch: 10, train_loss: 0.7627, test_loss: 0.9368, test_f1: 0.5735
 epoch: 11, train_loss: 0.7499, test_loss: 1.1839, test_f1: 0.5792
 epoch: 12, train_loss: 0.7956, test_loss: 0.9616, test_f1: 0.5561
 epoch: 13, train_loss: 0.7558, test_loss: 1.1098, test_f1: 0.5591
 epoch: 14, train_loss: 0.7619, test_loss: 1.0225, test_f1: 0.5377
 epoch: 15, train_loss: 0.7412, test_loss: 1.2726, test_f1: 0.5528
 epoch: 16, train_loss: 0.7205, test_loss: 1.2362, test_f1: 0.4984
 epoch: 17, train_loss: 0.6913, test_loss: 1.1489, test_f1: 0.5137
 epoch: 18, train_loss: 0.7250, test_loss: 1.3524, test_f1: 0.4779
 epoch: 19, train_loss: 0.7180, test_loss: 1.0637, test_f1: 0.5743
 epoch: 20, train_loss: 0.7100, test_loss: 1.0011, test_f1: 0.6147
 epoch: 21, train_loss: 0.7026, test_loss: 1.5110, test_f1: 0.5042
 epoch: 22, train_loss: 0.6678, test_loss: 1.3320, test_f1: 0.5589
 epoch: 23, train_loss: 0.6421, test_loss: 1.0185, test_f1: 0.6412
 epoch: 24, train_loss: 0.6094, test_loss: 1.0099, test_f1: 0.6102
 epoch: 25, train_loss: 0.6323, test_loss: 1.1683, test_f1: 0.6402
 epoch: 26, train_loss: 0.6146, test_loss: 1.0627, test_f1: 0.6632
 epoch: 27, train_loss: 0.6188, test_loss: 1.2304, test_f1: 0.5865
 epoch: 28, train_loss: 0.6866, test_loss: 0.9625, test_f1: 0.6591
 epoch: 29, train_loss: 0.6636, test_loss: 1.2874, test_f1: 0.4492
 epoch: 30, train_loss: 0.6583, test_loss: 1.0818, test_f1: 0.5656
 epoch: 31, train_loss: 0.6167, test_loss: 1.7408, test_f1: 0.5121
 epoch: 32, train_loss: 0.6003, test_loss: 1.6406, test_f1: 0.4293
 epoch: 33, train_loss: 0.5940, test_loss: 1.1949, test_f1: 0.6834
 epoch: 34, train_loss: 0.6168, test_loss: 1.2639, test_f1: 0.6180
 epoch: 35, train_loss: 0.5864, test_loss: 1.7338, test_f1: 0.4860
 epoch: 36, train_loss: 0.5662, test_loss: 1.2062, test_f1: 0.6266
 epoch: 37, train_loss: 0.5441, test_loss: 1.2175, test_f1: 0.6311
 epoch: 38, train_loss: 0.5796, test_loss: 1.1744, test_f1: 0.6287
 epoch: 39, train_loss: 0.6000, test_loss: 1.1032, test_f1: 0.6367
 epoch: 40, train_loss: 0.5594, test_loss: 1.0659, test_f1: 0.6285
 epoch: 41, train_loss: 0.5828, test_loss: 1.2377, test_f1: 0.6049
 epoch: 42, train_loss: 0.5807, test_loss: 1.1522, test_f1: 0.6026
 epoch: 43, train_loss: 0.5319, test_loss: 1.0555, test_f1: 0.6155
 epoch: 44, train_loss: 0.5191, test_loss: 1.6915, test_f1: 0.5471
 epoch: 45, train_loss: 0.5278, test_loss: 1.3383, test_f1: 0.5605
 epoch: 46, train_loss: 0.5216, test_loss: 1.2493, test_f1: 0.5535
 epoch: 47, train_loss: 0.5192, test_loss: 1.5538, test_f1: 0.4681
 epoch: 48, train_loss: 0.4936, test_loss: 1.3885, test_f1: 0.6266
 epoch: 49, train_loss: 0.5048, test_loss: 1.9586, test_f1: 0.5433
 epoch: 50, train_loss: 0.6154, test_loss: 1.5397, test_f1: 0.5851
 epoch: 51, train_loss: 0.5453, test_loss: 1.1778, test_f1: 0.6525
 epoch: 52, train_loss: 0.4874, test_loss: 1.0472, test_f1: 0.6572
 epoch: 53, train_loss: 0.4561, test_loss: 1.1387, test_f1: 0.6564
 epoch: 54, train_loss: 0.4163, test_loss: 1.3581, test_f1: 0.6537
 epoch: 55, train_loss: 0.4262, test_loss: 1.1989, test_f1: 0.6212
 epoch: 56, train_loss: 0.4162, test_loss: 1.2701, test_f1: 0.6074
 epoch: 57, train_loss: 0.3904, test_loss: 1.2465, test_f1: 0.6551
 epoch: 58, train_loss: 0.3950, test_loss: 1.3101, test_f1: 0.6372
 epoch: 59, train_loss: 0.3678, test_loss: 1.3546, test_f1: 0.6136
 epoch: 60, train_loss: 0.3663, test_loss: 1.4513, test_f1: 0.6289
 epoch: 61, train_loss: 0.3749, test_loss: 1.7357, test_f1: 0.6310
 epoch: 62, train_loss: 0.3781, test_loss: 1.8363, test_f1: 0.5386
 epoch: 63, train_loss: 0.3771, test_loss: 1.5209, test_f1: 0.6665
 epoch: 64, train_loss: 0.3673, test_loss: 1.5665, test_f1: 0.5739
 epoch: 65, train_loss: 0.3693, test_loss: 1.4531, test_f1: 0.6656
 epoch: 66, train_loss: 0.3768, test_loss: 1.4837, test_f1: 0.6141
 epoch: 67, train_loss: 0.3629, test_loss: 1.6659, test_f1: 0.6306
 epoch: 68, train_loss: 0.3618, test_loss: 1.4297, test_f1: 0.6978
 epoch: 69, train_loss: 0.3831, test_loss: 1.7155, test_f1: 0.5555
 epoch: 70, train_loss: 0.3730, test_loss: 1.2823, test_f1: 0.6421
 epoch: 71, train_loss: 0.3308, test_loss: 1.5101, test_f1: 0.6067
 epoch: 72, train_loss: 0.3233, test_loss: 1.9224, test_f1: 0.6103
 epoch: 73, train_loss: 0.3166, test_loss: 1.5715, test_f1: 0.6647
 epoch: 74, train_loss: 0.3274, test_loss: 1.6244, test_f1: 0.5918
 epoch: 75, train_loss: 0.3377, test_loss: 1.5133, test_f1: 0.6616
 epoch: 76, train_loss: 0.3032, test_loss: 1.7448, test_f1: 0.6169
 epoch: 77, train_loss: 0.2948, test_loss: 1.7889, test_f1: 0.6317
 epoch: 78, train_loss: 0.3146, test_loss: 1.6742, test_f1: 0.6156
 epoch: 79, train_loss: 0.3099, test_loss: 2.1353, test_f1: 0.6104
 epoch: 80, train_loss: 0.2970, test_loss: 1.7408, test_f1: 0.6229
 epoch: 81, train_loss: 0.3542, test_loss: 1.7073, test_f1: 0.5847
 epoch: 82, train_loss: 0.3571, test_loss: 1.6079, test_f1: 0.6595
 epoch: 83, train_loss: 0.3525, test_loss: 1.6366, test_f1: 0.6094
 epoch: 84, train_loss: 0.3571, test_loss: 1.4783, test_f1: 0.6672
 epoch: 85, train_loss: 0.3380, test_loss: 1.4815, test_f1: 0.6558
 epoch: 86, train_loss: 0.3014, test_loss: 1.7728, test_f1: 0.6395
 epoch: 87, train_loss: 0.3221, test_loss: 2.0421, test_f1: 0.5726
 epoch: 88, train_loss: 0.3146, test_loss: 1.8015, test_f1: 0.5953
 epoch: 89, train_loss: 0.2913, test_loss: 1.8687, test_f1: 0.6397
 epoch: 90, train_loss: 0.2738, test_loss: 2.0051, test_f1: 0.6302
 epoch: 91, train_loss: 0.2712, test_loss: 1.9690, test_f1: 0.6563
 epoch: 92, train_loss: 0.2669, test_loss: 1.8995, test_f1: 0.6210
 epoch: 93, train_loss: 0.2605, test_loss: 2.1207, test_f1: 0.6196
 epoch: 94, train_loss: 0.2591, test_loss: 1.7688, test_f1: 0.6226
 epoch: 95, train_loss: 0.2514, test_loss: 2.0194, test_f1: 0.6394
 epoch: 96, train_loss: 0.2666, test_loss: 1.7636, test_f1: 0.6343
 epoch: 97, train_loss: 0.2819, test_loss: 1.5798, test_f1: 0.6661
 epoch: 98, train_loss: 0.2891, test_loss: 1.8745, test_f1: 0.6268
 epoch: 99, train_loss: 0.2638, test_loss: 1.9098, test_f1: 0.6186
##################ITERATION #9 ****************************************
 epoch: 0, train_loss: 1.4803, test_loss: 1.5275, test_f1: 0.3476
 epoch: 1, train_loss: 1.0029, test_loss: 1.2807, test_f1: 0.3732
 epoch: 2, train_loss: 0.9046, test_loss: 1.1151, test_f1: 0.5128
 epoch: 3, train_loss: 0.8753, test_loss: 0.9868, test_f1: 0.5438
 epoch: 4, train_loss: 0.8375, test_loss: 1.1473, test_f1: 0.4139
 epoch: 5, train_loss: 0.7967, test_loss: 0.9421, test_f1: 0.6366
 epoch: 6, train_loss: 0.7853, test_loss: 1.2310, test_f1: 0.5141
 epoch: 7, train_loss: 0.7905, test_loss: 0.9644, test_f1: 0.6002
 epoch: 8, train_loss: 0.7806, test_loss: 0.9144, test_f1: 0.6079
 epoch: 9, train_loss: 0.7929, test_loss: 0.9077, test_f1: 0.6065
 epoch: 10, train_loss: 0.7736, test_loss: 1.2148, test_f1: 0.4721
 epoch: 11, train_loss: 0.7280, test_loss: 1.2795, test_f1: 0.5669
 epoch: 12, train_loss: 0.7207, test_loss: 1.0795, test_f1: 0.5121
 epoch: 13, train_loss: 0.7294, test_loss: 1.0701, test_f1: 0.5031
 epoch: 14, train_loss: 0.7428, test_loss: 1.1126, test_f1: 0.5312
 epoch: 15, train_loss: 0.7127, test_loss: 0.9610, test_f1: 0.6166
 epoch: 16, train_loss: 0.6985, test_loss: 1.0883, test_f1: 0.6059
 epoch: 17, train_loss: 0.6816, test_loss: 1.1449, test_f1: 0.6055
 epoch: 18, train_loss: 0.6705, test_loss: 1.0455, test_f1: 0.5647
 epoch: 19, train_loss: 0.6587, test_loss: 0.9866, test_f1: 0.6468
 epoch: 20, train_loss: 0.6709, test_loss: 1.0269, test_f1: 0.5226
 epoch: 21, train_loss: 0.6682, test_loss: 1.2487, test_f1: 0.5974
 epoch: 22, train_loss: 0.6581, test_loss: 0.9676, test_f1: 0.6268
 epoch: 23, train_loss: 0.6680, test_loss: 1.3693, test_f1: 0.4969
 epoch: 24, train_loss: 0.6294, test_loss: 1.1793, test_f1: 0.6105
 epoch: 25, train_loss: 0.6369, test_loss: 1.2194, test_f1: 0.5602
 epoch: 26, train_loss: 0.6574, test_loss: 1.3157, test_f1: 0.5136
 epoch: 27, train_loss: 0.6510, test_loss: 1.2441, test_f1: 0.5735
 epoch: 28, train_loss: 0.6208, test_loss: 1.2137, test_f1: 0.6030
 epoch: 29, train_loss: 0.6046, test_loss: 1.3237, test_f1: 0.5494
 epoch: 30, train_loss: 0.6077, test_loss: 1.1290, test_f1: 0.5656
 epoch: 31, train_loss: 0.5826, test_loss: 1.1242, test_f1: 0.6274
 epoch: 32, train_loss: 0.5495, test_loss: 1.2156, test_f1: 0.6097
 epoch: 33, train_loss: 0.5680, test_loss: 1.3110, test_f1: 0.5828
 epoch: 34, train_loss: 0.6315, test_loss: 1.3017, test_f1: 0.5331
 epoch: 35, train_loss: 0.6359, test_loss: 1.0446, test_f1: 0.6234
 epoch: 36, train_loss: 0.5914, test_loss: 1.0386, test_f1: 0.6410
 epoch: 37, train_loss: 0.5775, test_loss: 1.0124, test_f1: 0.6120
 epoch: 38, train_loss: 0.5645, test_loss: 1.0533, test_f1: 0.6422
 epoch: 39, train_loss: 0.5769, test_loss: 1.0973, test_f1: 0.6827
 epoch: 40, train_loss: 0.5337, test_loss: 1.1970, test_f1: 0.6106
 epoch: 41, train_loss: 0.5169, test_loss: 1.2105, test_f1: 0.6060
 epoch: 42, train_loss: 0.5155, test_loss: 1.0837, test_f1: 0.6559
 epoch: 43, train_loss: 0.5536, test_loss: 1.2377, test_f1: 0.5731
 epoch: 44, train_loss: 0.5235, test_loss: 1.3883, test_f1: 0.5372
 epoch: 45, train_loss: 0.5082, test_loss: 1.3780, test_f1: 0.5691
 epoch: 46, train_loss: 0.5187, test_loss: 1.1921, test_f1: 0.5659
 epoch: 47, train_loss: 0.5511, test_loss: 1.1599, test_f1: 0.6516
 epoch: 48, train_loss: 0.5161, test_loss: 1.4520, test_f1: 0.6133
 epoch: 49, train_loss: 0.5187, test_loss: 1.1904, test_f1: 0.4819
 epoch: 50, train_loss: 0.4836, test_loss: 1.0432, test_f1: 0.6458
 epoch: 51, train_loss: 0.4673, test_loss: 1.2197, test_f1: 0.6594
 epoch: 52, train_loss: 0.4727, test_loss: 1.2238, test_f1: 0.6657
 epoch: 53, train_loss: 0.4108, test_loss: 1.3100, test_f1: 0.6070
 epoch: 54, train_loss: 0.4086, test_loss: 1.3960, test_f1: 0.6692
 epoch: 55, train_loss: 0.3973, test_loss: 1.2685, test_f1: 0.6418
 epoch: 56, train_loss: 0.4137, test_loss: 1.1875, test_f1: 0.6700
 epoch: 57, train_loss: 0.3832, test_loss: 1.5375, test_f1: 0.6457
 epoch: 58, train_loss: 0.3768, test_loss: 1.3742, test_f1: 0.6062
 epoch: 59, train_loss: 0.3992, test_loss: 1.3819, test_f1: 0.6110
 epoch: 60, train_loss: 0.3688, test_loss: 1.4605, test_f1: 0.5889
 epoch: 61, train_loss: 0.3976, test_loss: 1.3341, test_f1: 0.6618
 epoch: 62, train_loss: 0.3669, test_loss: 1.3712, test_f1: 0.6221
 epoch: 63, train_loss: 0.4138, test_loss: 1.6630, test_f1: 0.5592
 epoch: 64, train_loss: 0.3592, test_loss: 1.4751, test_f1: 0.6094
 epoch: 65, train_loss: 0.3586, test_loss: 1.4805, test_f1: 0.6105
 epoch: 66, train_loss: 0.3263, test_loss: 1.3282, test_f1: 0.6323
 epoch: 67, train_loss: 0.3214, test_loss: 1.5616, test_f1: 0.5878
 epoch: 68, train_loss: 0.3406, test_loss: 1.5960, test_f1: 0.6453
 epoch: 69, train_loss: 0.3155, test_loss: 1.4870, test_f1: 0.6407
 epoch: 70, train_loss: 0.4023, test_loss: 1.3563, test_f1: 0.6367
 epoch: 71, train_loss: 0.3545, test_loss: 1.5312, test_f1: 0.6306
 epoch: 72, train_loss: 0.3991, test_loss: 1.7907, test_f1: 0.6127
 epoch: 73, train_loss: 0.3546, test_loss: 1.5091, test_f1: 0.6395
 epoch: 74, train_loss: 0.3149, test_loss: 1.4479, test_f1: 0.6518
 epoch: 75, train_loss: 0.3282, test_loss: 1.4843, test_f1: 0.6476
 epoch: 76, train_loss: 0.3184, test_loss: 1.6438, test_f1: 0.6273
 epoch: 77, train_loss: 0.3630, test_loss: 1.5007, test_f1: 0.5916
 epoch: 78, train_loss: 0.3215, test_loss: 1.6117, test_f1: 0.6020
 epoch: 79, train_loss: 0.2969, test_loss: 1.5574, test_f1: 0.6306
 epoch: 80, train_loss: 0.3097, test_loss: 1.8892, test_f1: 0.6077
 epoch: 81, train_loss: 0.3547, test_loss: 1.5837, test_f1: 0.5948
 epoch: 82, train_loss: 0.3413, test_loss: 1.7031, test_f1: 0.5916
 epoch: 83, train_loss: 0.3140, test_loss: 1.5500, test_f1: 0.6195
 epoch: 84, train_loss: 0.2699, test_loss: 1.6885, test_f1: 0.5965
 epoch: 85, train_loss: 0.2647, test_loss: 1.9872, test_f1: 0.6262
 epoch: 86, train_loss: 0.2782, test_loss: 1.7146, test_f1: 0.6124
 epoch: 87, train_loss: 0.3097, test_loss: 1.9496, test_f1: 0.6082
 epoch: 88, train_loss: 0.3104, test_loss: 1.8353, test_f1: 0.6427
 epoch: 89, train_loss: 0.2979, test_loss: 1.9510, test_f1: 0.6071
 epoch: 90, train_loss: 0.2736, test_loss: 1.5047, test_f1: 0.6137
 epoch: 91, train_loss: 0.3120, test_loss: 1.6030, test_f1: 0.6275
 epoch: 92, train_loss: 0.3358, test_loss: 1.4607, test_f1: 0.6491
 epoch: 93, train_loss: 0.3004, test_loss: 1.7222, test_f1: 0.6092
 epoch: 94, train_loss: 0.2801, test_loss: 1.5411, test_f1: 0.6223
 epoch: 95, train_loss: 0.2840, test_loss: 1.7644, test_f1: 0.5857
 epoch: 96, train_loss: 0.2862, test_loss: 1.7920, test_f1: 0.5853
 epoch: 97, train_loss: 0.2937, test_loss: 1.7193, test_f1: 0.6633
 epoch: 98, train_loss: 0.2752, test_loss: 2.0053, test_f1: 0.6212
 epoch: 99, train_loss: 0.2762, test_loss: 2.1072, test_f1: 0.6046

Training completed in 456.42 seconds
Best F1: 0.6994 at epoch 50
Mean F1 across iterations: 0.6827  0.0132
========================FINAL RESULTS================================
FEGIN weighted F1: 0.6994  0.0132
python main.py --data ltspice_demos --representation component_pin --model FEGIN --layers 3 --hiddens 64 --batch_size 128 --lr 0.01 --emb_size 250 --epochs 100 --save_appendix component_pin_L3_H64_BS128_LR0.01_E250 --no_val
-----



STDERR:
  File "main.py", line 370, in <module>
    main()
  File "main.py", line 254, in main
    dataset = dataset_class(
  File "/home/philip/projects/ltspice_examples_code_repo/Circuit-Completion-Using-GNNs/component_classification_with_link_prediction_head/evaluation/FEGIN/kernel/circuit_datasets.py", line 15, in __init__
    self.data, self.slices = torch.load(self.processed_paths[0])
  File "/home/philip/.local/lib/python3.8/site-packages/torch/serialization.py", line 1040, in load
    warnings.warn(
  File "/usr/lib/python3.8/warnings.py", line 109, in _showwarnmsg
    sw(msg.message, msg.category, msg.filename, msg.lineno,
  File "main.py", line 47, in warn_with_traceback
    traceback.print_stack(file=log)
/home/philip/projects/ltspice_examples_code_repo/Circuit-Completion-Using-GNNs/component_classification_with_link_prediction_head/evaluation/FEGIN/kernel/circuit_datasets.py:15: FutureWarning: You are using `torch.load` with `weights_only=False` (the current default value), which uses the default pickle module implicitly. It is possible to construct malicious pickle data which will execute arbitrary code during unpickling (See https://github.com/pytorch/pytorch/blob/main/SECURITY.md#untrusted-models for more details). In a future release, the default value for `weights_only` will be flipped to `True`. This limits the functions that could be executed during unpickling. Arbitrary objects will no longer be allowed to be loaded via this mode unless they are explicitly allowlisted by the user via `torch.serialization.add_safe_globals`. We recommend you start setting `weights_only=True` for any use case where you don't have full control of the loaded file. Please open an issue on GitHub for any issues related to this experimental feature.
  self.data, self.slices = torch.load(self.processed_paths[0])
