STDOUT:
Results will be saved in /home/philip/projects/ltspice_examples_code_repo/Circuit-Completion-Using-GNNs/component_classification_with_link_prediction_head/evaluation/FEGIN/results/model_FEGIN_dataset_ltspice_examples
Command line input: python main.py --data ltspice_examples --representation component_component --model FEGIN --layers 6 --hiddens 64 --batch_size 256 --lr 0.0001 --emb_size 250 --epochs 100 --save_appendix component_component_L6_H64_BS256_LR0.0001_E250 --no_val
 is saved.
-----
ltspice_examples - FEGIN
Using 6 layers, 64 hidden units, h = 2
Loading component_component representation dataset
ENTERED
Training FEGIN on component_component representation
Train: 3556, Test: 845
##################ITERATION #0 ****************************************
 epoch: 0, train_loss: 1.3604, test_loss: 1.3647, test_f1: 0.2274
 epoch: 1, train_loss: 1.3529, test_loss: 1.3592, test_f1: 0.2555
 epoch: 2, train_loss: 1.3468, test_loss: 1.3497, test_f1: 0.2666
 epoch: 3, train_loss: 1.3412, test_loss: 1.3393, test_f1: 0.2685
 epoch: 4, train_loss: 1.3343, test_loss: 1.3296, test_f1: 0.2660
 epoch: 5, train_loss: 1.3269, test_loss: 1.3192, test_f1: 0.2796
 epoch: 6, train_loss: 1.3183, test_loss: 1.3092, test_f1: 0.3055
 epoch: 7, train_loss: 1.3092, test_loss: 1.2978, test_f1: 0.3052
 epoch: 8, train_loss: 1.2989, test_loss: 1.2866, test_f1: 0.3052
 epoch: 9, train_loss: 1.2877, test_loss: 1.2742, test_f1: 0.3084
 epoch: 10, train_loss: 1.2776, test_loss: 1.2626, test_f1: 0.3117
 epoch: 11, train_loss: 1.2683, test_loss: 1.2508, test_f1: 0.3125
 epoch: 12, train_loss: 1.2560, test_loss: 1.2391, test_f1: 0.3125
 epoch: 13, train_loss: 1.2484, test_loss: 1.2283, test_f1: 0.3166
 epoch: 14, train_loss: 1.2393, test_loss: 1.2197, test_f1: 0.3170
 epoch: 15, train_loss: 1.2304, test_loss: 1.2095, test_f1: 0.3080
 epoch: 16, train_loss: 1.2213, test_loss: 1.2016, test_f1: 0.3262
 epoch: 17, train_loss: 1.2160, test_loss: 1.1928, test_f1: 0.3321
 epoch: 18, train_loss: 1.2111, test_loss: 1.1859, test_f1: 0.3395
 epoch: 19, train_loss: 1.1988, test_loss: 1.1798, test_f1: 0.3471
 epoch: 20, train_loss: 1.1960, test_loss: 1.1731, test_f1: 0.3377
 epoch: 21, train_loss: 1.1858, test_loss: 1.1653, test_f1: 0.3529
 epoch: 22, train_loss: 1.1767, test_loss: 1.1589, test_f1: 0.3535
 epoch: 23, train_loss: 1.1759, test_loss: 1.1586, test_f1: 0.3454
 epoch: 24, train_loss: 1.1648, test_loss: 1.1490, test_f1: 0.3497
 epoch: 25, train_loss: 1.1556, test_loss: 1.1407, test_f1: 0.3497
 epoch: 26, train_loss: 1.1444, test_loss: 1.1361, test_f1: 0.3470
 epoch: 27, train_loss: 1.1395, test_loss: 1.1334, test_f1: 0.3568
 epoch: 28, train_loss: 1.1298, test_loss: 1.1373, test_f1: 0.3539
 epoch: 29, train_loss: 1.1212, test_loss: 1.1267, test_f1: 0.3561
 epoch: 30, train_loss: 1.1180, test_loss: 1.1192, test_f1: 0.3589
 epoch: 31, train_loss: 1.1070, test_loss: 1.1168, test_f1: 0.3650
 epoch: 32, train_loss: 1.0975, test_loss: 1.1107, test_f1: 0.3619
 epoch: 33, train_loss: 1.0935, test_loss: 1.1152, test_f1: 0.3613
 epoch: 34, train_loss: 1.0843, test_loss: 1.1094, test_f1: 0.3545
 epoch: 35, train_loss: 1.0827, test_loss: 1.1167, test_f1: 0.3620
 epoch: 36, train_loss: 1.0729, test_loss: 1.1008, test_f1: 0.3751
 epoch: 37, train_loss: 1.0586, test_loss: 1.1055, test_f1: 0.3944
 epoch: 38, train_loss: 1.0485, test_loss: 1.1054, test_f1: 0.4210
 epoch: 39, train_loss: 1.0514, test_loss: 1.0977, test_f1: 0.4282
 epoch: 40, train_loss: 1.0437, test_loss: 1.0958, test_f1: 0.4480
 epoch: 41, train_loss: 1.0376, test_loss: 1.0941, test_f1: 0.4412
 epoch: 42, train_loss: 1.0255, test_loss: 1.0921, test_f1: 0.4482
 epoch: 43, train_loss: 1.0247, test_loss: 1.0950, test_f1: 0.4529
 epoch: 44, train_loss: 1.0215, test_loss: 1.0958, test_f1: 0.4398
 epoch: 45, train_loss: 1.0089, test_loss: 1.0921, test_f1: 0.4390
 epoch: 46, train_loss: 0.9997, test_loss: 1.1014, test_f1: 0.4404
 epoch: 47, train_loss: 1.0016, test_loss: 1.0994, test_f1: 0.4461
 epoch: 48, train_loss: 0.9910, test_loss: 1.1112, test_f1: 0.4411
 epoch: 49, train_loss: 0.9889, test_loss: 1.1039, test_f1: 0.4412
 epoch: 50, train_loss: 0.9780, test_loss: 1.0908, test_f1: 0.4505
 epoch: 51, train_loss: 0.9704, test_loss: 1.1037, test_f1: 0.4548
 epoch: 52, train_loss: 0.9756, test_loss: 1.1085, test_f1: 0.4465
 epoch: 53, train_loss: 0.9618, test_loss: 1.0988, test_f1: 0.4486
 epoch: 54, train_loss: 0.9648, test_loss: 1.0960, test_f1: 0.4472
 epoch: 55, train_loss: 0.9708, test_loss: 1.1061, test_f1: 0.4498
 epoch: 56, train_loss: 0.9512, test_loss: 1.1100, test_f1: 0.4500
 epoch: 57, train_loss: 0.9603, test_loss: 1.1026, test_f1: 0.4446
 epoch: 58, train_loss: 0.9563, test_loss: 1.1119, test_f1: 0.4471
 epoch: 59, train_loss: 0.9501, test_loss: 1.1033, test_f1: 0.4534
 epoch: 60, train_loss: 0.9420, test_loss: 1.1057, test_f1: 0.4518
 epoch: 61, train_loss: 0.9498, test_loss: 1.1085, test_f1: 0.4487
 epoch: 62, train_loss: 0.9458, test_loss: 1.1075, test_f1: 0.4542
 epoch: 63, train_loss: 0.9379, test_loss: 1.1134, test_f1: 0.4542
 epoch: 64, train_loss: 0.9532, test_loss: 1.1175, test_f1: 0.4497
 epoch: 65, train_loss: 0.9369, test_loss: 1.1203, test_f1: 0.4558
 epoch: 66, train_loss: 0.9439, test_loss: 1.1093, test_f1: 0.4565
 epoch: 67, train_loss: 0.9381, test_loss: 1.1093, test_f1: 0.4490
 epoch: 68, train_loss: 0.9347, test_loss: 1.1200, test_f1: 0.4501
 epoch: 69, train_loss: 0.9274, test_loss: 1.1135, test_f1: 0.4570
 epoch: 70, train_loss: 0.9351, test_loss: 1.1076, test_f1: 0.4539
 epoch: 71, train_loss: 0.9303, test_loss: 1.1136, test_f1: 0.4511
 epoch: 72, train_loss: 0.9252, test_loss: 1.1180, test_f1: 0.4583
 epoch: 73, train_loss: 0.9203, test_loss: 1.1197, test_f1: 0.4676
 epoch: 74, train_loss: 0.9182, test_loss: 1.1271, test_f1: 0.4663
 epoch: 75, train_loss: 0.9187, test_loss: 1.1179, test_f1: 0.4609
 epoch: 76, train_loss: 0.9200, test_loss: 1.1240, test_f1: 0.4631
 epoch: 77, train_loss: 0.9234, test_loss: 1.1268, test_f1: 0.4617
 epoch: 78, train_loss: 0.9097, test_loss: 1.1280, test_f1: 0.4649
 epoch: 79, train_loss: 0.9129, test_loss: 1.1303, test_f1: 0.4583
 epoch: 80, train_loss: 0.9153, test_loss: 1.1420, test_f1: 0.4718
 epoch: 81, train_loss: 0.9018, test_loss: 1.1554, test_f1: 0.4649
 epoch: 82, train_loss: 0.9095, test_loss: 1.1523, test_f1: 0.4654
 epoch: 83, train_loss: 0.9175, test_loss: 1.1407, test_f1: 0.4666
 epoch: 84, train_loss: 0.9098, test_loss: 1.1328, test_f1: 0.4664
 epoch: 85, train_loss: 0.9052, test_loss: 1.1469, test_f1: 0.4681
 epoch: 86, train_loss: 0.9116, test_loss: 1.1399, test_f1: 0.4604
 epoch: 87, train_loss: 0.9178, test_loss: 1.1449, test_f1: 0.4573
 epoch: 88, train_loss: 0.8963, test_loss: 1.1498, test_f1: 0.4627
 epoch: 89, train_loss: 0.8891, test_loss: 1.1425, test_f1: 0.4676
 epoch: 90, train_loss: 0.8937, test_loss: 1.1433, test_f1: 0.4667
 epoch: 91, train_loss: 0.8977, test_loss: 1.1350, test_f1: 0.4669
 epoch: 92, train_loss: 0.8922, test_loss: 1.1442, test_f1: 0.4483
 epoch: 93, train_loss: 0.8895, test_loss: 1.1595, test_f1: 0.4444
 epoch: 94, train_loss: 0.8992, test_loss: 1.1489, test_f1: 0.4645
 epoch: 95, train_loss: 0.8838, test_loss: 1.1497, test_f1: 0.4682
 epoch: 96, train_loss: 0.8795, test_loss: 1.1484, test_f1: 0.4459
 epoch: 97, train_loss: 0.8719, test_loss: 1.1520, test_f1: 0.4562
 epoch: 98, train_loss: 0.8862, test_loss: 1.1437, test_f1: 0.4544
 epoch: 99, train_loss: 0.8695, test_loss: 1.1569, test_f1: 0.4479
##################ITERATION #1 ****************************************
 epoch: 0, train_loss: 1.3362, test_loss: 1.3451, test_f1: 0.2274
 epoch: 1, train_loss: 1.3209, test_loss: 1.3321, test_f1: 0.2274
 epoch: 2, train_loss: 1.3106, test_loss: 1.3214, test_f1: 0.2274
 epoch: 3, train_loss: 1.2988, test_loss: 1.3055, test_f1: 0.2274
 epoch: 4, train_loss: 1.2883, test_loss: 1.2898, test_f1: 0.2549
 epoch: 5, train_loss: 1.2771, test_loss: 1.2728, test_f1: 0.2645
 epoch: 6, train_loss: 1.2661, test_loss: 1.2562, test_f1: 0.2896
 epoch: 7, train_loss: 1.2542, test_loss: 1.2406, test_f1: 0.3074
 epoch: 8, train_loss: 1.2435, test_loss: 1.2273, test_f1: 0.3166
 epoch: 9, train_loss: 1.2349, test_loss: 1.2132, test_f1: 0.3201
 epoch: 10, train_loss: 1.2219, test_loss: 1.2011, test_f1: 0.3211
 epoch: 11, train_loss: 1.2106, test_loss: 1.1895, test_f1: 0.3288
 epoch: 12, train_loss: 1.2028, test_loss: 1.1786, test_f1: 0.3352
 epoch: 13, train_loss: 1.1947, test_loss: 1.1691, test_f1: 0.3533
 epoch: 14, train_loss: 1.1840, test_loss: 1.1576, test_f1: 0.3784
 epoch: 15, train_loss: 1.1771, test_loss: 1.1497, test_f1: 0.3812
 epoch: 16, train_loss: 1.1686, test_loss: 1.1395, test_f1: 0.3963
 epoch: 17, train_loss: 1.1607, test_loss: 1.1310, test_f1: 0.4028
 epoch: 18, train_loss: 1.1518, test_loss: 1.1235, test_f1: 0.4127
 epoch: 19, train_loss: 1.1498, test_loss: 1.1183, test_f1: 0.4083
 epoch: 20, train_loss: 1.1391, test_loss: 1.1123, test_f1: 0.4257
 epoch: 21, train_loss: 1.1317, test_loss: 1.1043, test_f1: 0.4282
 epoch: 22, train_loss: 1.1231, test_loss: 1.0985, test_f1: 0.4281
 epoch: 23, train_loss: 1.1141, test_loss: 1.0951, test_f1: 0.4300
 epoch: 24, train_loss: 1.1092, test_loss: 1.0886, test_f1: 0.4300
 epoch: 25, train_loss: 1.1002, test_loss: 1.0827, test_f1: 0.4287
 epoch: 26, train_loss: 1.0956, test_loss: 1.0834, test_f1: 0.4330
 epoch: 27, train_loss: 1.0859, test_loss: 1.0756, test_f1: 0.4380
 epoch: 28, train_loss: 1.0752, test_loss: 1.0716, test_f1: 0.4378
 epoch: 29, train_loss: 1.0755, test_loss: 1.0686, test_f1: 0.4533
 epoch: 30, train_loss: 1.0641, test_loss: 1.0576, test_f1: 0.4597
 epoch: 31, train_loss: 1.0563, test_loss: 1.0613, test_f1: 0.4465
 epoch: 32, train_loss: 1.0500, test_loss: 1.0521, test_f1: 0.4738
 epoch: 33, train_loss: 1.0389, test_loss: 1.0580, test_f1: 0.4747
 epoch: 34, train_loss: 1.0348, test_loss: 1.0522, test_f1: 0.4589
 epoch: 35, train_loss: 1.0212, test_loss: 1.0513, test_f1: 0.4541
 epoch: 36, train_loss: 1.0222, test_loss: 1.0439, test_f1: 0.4585
 epoch: 37, train_loss: 1.0162, test_loss: 1.0463, test_f1: 0.4629
 epoch: 38, train_loss: 1.0061, test_loss: 1.0416, test_f1: 0.4947
 epoch: 39, train_loss: 1.0012, test_loss: 1.0482, test_f1: 0.4692
 epoch: 40, train_loss: 0.9973, test_loss: 1.0310, test_f1: 0.4871
 epoch: 41, train_loss: 0.9922, test_loss: 1.0455, test_f1: 0.4712
 epoch: 42, train_loss: 0.9809, test_loss: 1.0416, test_f1: 0.4720
 epoch: 43, train_loss: 0.9747, test_loss: 1.0389, test_f1: 0.4681
 epoch: 44, train_loss: 0.9705, test_loss: 1.0346, test_f1: 0.4838
 epoch: 45, train_loss: 0.9632, test_loss: 1.0491, test_f1: 0.4698
 epoch: 46, train_loss: 0.9628, test_loss: 1.0385, test_f1: 0.4668
 epoch: 47, train_loss: 0.9506, test_loss: 1.0381, test_f1: 0.4775
 epoch: 48, train_loss: 0.9459, test_loss: 1.0229, test_f1: 0.4811
 epoch: 49, train_loss: 0.9487, test_loss: 1.0450, test_f1: 0.4880
 epoch: 50, train_loss: 0.9313, test_loss: 1.0352, test_f1: 0.4792
 epoch: 51, train_loss: 0.9204, test_loss: 1.0348, test_f1: 0.4766
 epoch: 52, train_loss: 0.9165, test_loss: 1.0337, test_f1: 0.4799
 epoch: 53, train_loss: 0.9156, test_loss: 1.0403, test_f1: 0.4632
 epoch: 54, train_loss: 0.9177, test_loss: 1.0479, test_f1: 0.4531
 epoch: 55, train_loss: 0.9090, test_loss: 1.0440, test_f1: 0.4622
 epoch: 56, train_loss: 0.9030, test_loss: 1.0472, test_f1: 0.4672
 epoch: 57, train_loss: 0.9091, test_loss: 1.0474, test_f1: 0.4603
 epoch: 58, train_loss: 0.9058, test_loss: 1.0493, test_f1: 0.4669
 epoch: 59, train_loss: 0.9041, test_loss: 1.0415, test_f1: 0.4656
 epoch: 60, train_loss: 0.9017, test_loss: 1.0513, test_f1: 0.4897
 epoch: 61, train_loss: 0.8917, test_loss: 1.0486, test_f1: 0.4831
 epoch: 62, train_loss: 0.8967, test_loss: 1.0506, test_f1: 0.4905
 epoch: 63, train_loss: 0.8821, test_loss: 1.0634, test_f1: 0.4850
 epoch: 64, train_loss: 0.8781, test_loss: 1.0728, test_f1: 0.4803
 epoch: 65, train_loss: 0.8970, test_loss: 1.0579, test_f1: 0.4806
 epoch: 66, train_loss: 0.8868, test_loss: 1.0576, test_f1: 0.4737
 epoch: 67, train_loss: 0.8836, test_loss: 1.0620, test_f1: 0.4844
 epoch: 68, train_loss: 0.8766, test_loss: 1.0750, test_f1: 0.4639
 epoch: 69, train_loss: 0.8708, test_loss: 1.0692, test_f1: 0.4765
 epoch: 70, train_loss: 0.8620, test_loss: 1.0556, test_f1: 0.4713
 epoch: 71, train_loss: 0.8643, test_loss: 1.0722, test_f1: 0.4767
 epoch: 72, train_loss: 0.8659, test_loss: 1.0758, test_f1: 0.4696
 epoch: 73, train_loss: 0.8599, test_loss: 1.0673, test_f1: 0.4697
 epoch: 74, train_loss: 0.8700, test_loss: 1.0719, test_f1: 0.4859
 epoch: 75, train_loss: 0.8572, test_loss: 1.0754, test_f1: 0.4604
 epoch: 76, train_loss: 0.8633, test_loss: 1.0634, test_f1: 0.4629
 epoch: 77, train_loss: 0.8572, test_loss: 1.0530, test_f1: 0.4628
 epoch: 78, train_loss: 0.8501, test_loss: 1.0632, test_f1: 0.4665
 epoch: 79, train_loss: 0.8544, test_loss: 1.0805, test_f1: 0.4620
 epoch: 80, train_loss: 0.8555, test_loss: 1.0767, test_f1: 0.4678
 epoch: 81, train_loss: 0.8400, test_loss: 1.0724, test_f1: 0.4835
 epoch: 82, train_loss: 0.8229, test_loss: 1.0620, test_f1: 0.4814
 epoch: 83, train_loss: 0.8434, test_loss: 1.0889, test_f1: 0.4786
 epoch: 84, train_loss: 0.8397, test_loss: 1.1011, test_f1: 0.4669
 epoch: 85, train_loss: 0.8437, test_loss: 1.0890, test_f1: 0.4916
 epoch: 86, train_loss: 0.8383, test_loss: 1.0964, test_f1: 0.4850
 epoch: 87, train_loss: 0.8391, test_loss: 1.0969, test_f1: 0.4821
 epoch: 88, train_loss: 0.8362, test_loss: 1.0882, test_f1: 0.4717
 epoch: 89, train_loss: 0.8316, test_loss: 1.0915, test_f1: 0.4752
 epoch: 90, train_loss: 0.8273, test_loss: 1.0903, test_f1: 0.4613
 epoch: 91, train_loss: 0.8213, test_loss: 1.0939, test_f1: 0.4788
 epoch: 92, train_loss: 0.8248, test_loss: 1.1010, test_f1: 0.4696
 epoch: 93, train_loss: 0.8239, test_loss: 1.1020, test_f1: 0.4785
 epoch: 94, train_loss: 0.8380, test_loss: 1.0870, test_f1: 0.4767
 epoch: 95, train_loss: 0.8227, test_loss: 1.0929, test_f1: 0.4685
 epoch: 96, train_loss: 0.8129, test_loss: 1.1033, test_f1: 0.4837
 epoch: 97, train_loss: 0.8048, test_loss: 1.1077, test_f1: 0.4818
 epoch: 98, train_loss: 0.8293, test_loss: 1.0944, test_f1: 0.4777
 epoch: 99, train_loss: 0.8158, test_loss: 1.1293, test_f1: 0.4665
##################ITERATION #2 ****************************************
 epoch: 0, train_loss: 1.3215, test_loss: 1.3390, test_f1: 0.2274
 epoch: 1, train_loss: 1.2947, test_loss: 1.3197, test_f1: 0.2274
 epoch: 2, train_loss: 1.2789, test_loss: 1.2899, test_f1: 0.2274
 epoch: 3, train_loss: 1.2674, test_loss: 1.2625, test_f1: 0.2431
 epoch: 4, train_loss: 1.2548, test_loss: 1.2435, test_f1: 0.3025
 epoch: 5, train_loss: 1.2446, test_loss: 1.2306, test_f1: 0.3156
 epoch: 6, train_loss: 1.2366, test_loss: 1.2199, test_f1: 0.3262
 epoch: 7, train_loss: 1.2225, test_loss: 1.2100, test_f1: 0.3218
 epoch: 8, train_loss: 1.2158, test_loss: 1.1996, test_f1: 0.3466
 epoch: 9, train_loss: 1.2032, test_loss: 1.1912, test_f1: 0.3777
 epoch: 10, train_loss: 1.1957, test_loss: 1.1802, test_f1: 0.3977
 epoch: 11, train_loss: 1.1848, test_loss: 1.1718, test_f1: 0.4313
 epoch: 12, train_loss: 1.1746, test_loss: 1.1633, test_f1: 0.4421
 epoch: 13, train_loss: 1.1615, test_loss: 1.1538, test_f1: 0.4551
 epoch: 14, train_loss: 1.1547, test_loss: 1.1448, test_f1: 0.4663
 epoch: 15, train_loss: 1.1413, test_loss: 1.1362, test_f1: 0.4624
 epoch: 16, train_loss: 1.1361, test_loss: 1.1290, test_f1: 0.4680
 epoch: 17, train_loss: 1.1260, test_loss: 1.1231, test_f1: 0.4593
 epoch: 18, train_loss: 1.1203, test_loss: 1.1143, test_f1: 0.4630
 epoch: 19, train_loss: 1.1073, test_loss: 1.1094, test_f1: 0.4553
 epoch: 20, train_loss: 1.0994, test_loss: 1.1029, test_f1: 0.4618
 epoch: 21, train_loss: 1.0990, test_loss: 1.0945, test_f1: 0.4565
 epoch: 22, train_loss: 1.0830, test_loss: 1.0916, test_f1: 0.4646
 epoch: 23, train_loss: 1.0670, test_loss: 1.0851, test_f1: 0.4634
 epoch: 24, train_loss: 1.0611, test_loss: 1.0790, test_f1: 0.4624
 epoch: 25, train_loss: 1.0493, test_loss: 1.0779, test_f1: 0.4624
 epoch: 26, train_loss: 1.0448, test_loss: 1.0710, test_f1: 0.4645
 epoch: 27, train_loss: 1.0405, test_loss: 1.0768, test_f1: 0.4601
 epoch: 28, train_loss: 1.0271, test_loss: 1.0734, test_f1: 0.4500
 epoch: 29, train_loss: 1.0194, test_loss: 1.0664, test_f1: 0.4676
 epoch: 30, train_loss: 1.0124, test_loss: 1.0651, test_f1: 0.4643
 epoch: 31, train_loss: 1.0059, test_loss: 1.0662, test_f1: 0.4665
 epoch: 32, train_loss: 1.0046, test_loss: 1.0570, test_f1: 0.4608
 epoch: 33, train_loss: 0.9903, test_loss: 1.0640, test_f1: 0.4526
 epoch: 34, train_loss: 0.9846, test_loss: 1.0590, test_f1: 0.4618
 epoch: 35, train_loss: 0.9758, test_loss: 1.0616, test_f1: 0.4557
 epoch: 36, train_loss: 0.9737, test_loss: 1.0583, test_f1: 0.4520
 epoch: 37, train_loss: 0.9630, test_loss: 1.0570, test_f1: 0.4504
 epoch: 38, train_loss: 0.9676, test_loss: 1.0652, test_f1: 0.4428
 epoch: 39, train_loss: 0.9614, test_loss: 1.0511, test_f1: 0.4601
 epoch: 40, train_loss: 0.9403, test_loss: 1.0555, test_f1: 0.4599
 epoch: 41, train_loss: 0.9405, test_loss: 1.0716, test_f1: 0.4343
 epoch: 42, train_loss: 0.9383, test_loss: 1.0548, test_f1: 0.4504
 epoch: 43, train_loss: 0.9203, test_loss: 1.0660, test_f1: 0.4579
 epoch: 44, train_loss: 0.9285, test_loss: 1.0575, test_f1: 0.4578
 epoch: 45, train_loss: 0.9185, test_loss: 1.0601, test_f1: 0.4503
 epoch: 46, train_loss: 0.9086, test_loss: 1.0606, test_f1: 0.4490
 epoch: 47, train_loss: 0.9064, test_loss: 1.0765, test_f1: 0.4555
 epoch: 48, train_loss: 0.9042, test_loss: 1.0807, test_f1: 0.4652
 epoch: 49, train_loss: 0.8902, test_loss: 1.0771, test_f1: 0.4591
 epoch: 50, train_loss: 0.9002, test_loss: 1.0848, test_f1: 0.4529
 epoch: 51, train_loss: 0.8839, test_loss: 1.0650, test_f1: 0.4613
 epoch: 52, train_loss: 0.8821, test_loss: 1.0728, test_f1: 0.4551
 epoch: 53, train_loss: 0.8782, test_loss: 1.0807, test_f1: 0.4501
 epoch: 54, train_loss: 0.8832, test_loss: 1.0901, test_f1: 0.4539
 epoch: 55, train_loss: 0.8694, test_loss: 1.0830, test_f1: 0.4632
 epoch: 56, train_loss: 0.8719, test_loss: 1.0843, test_f1: 0.4663
 epoch: 57, train_loss: 0.8603, test_loss: 1.0944, test_f1: 0.4601
 epoch: 58, train_loss: 0.8709, test_loss: 1.0963, test_f1: 0.4622
 epoch: 59, train_loss: 0.8590, test_loss: 1.0812, test_f1: 0.4737
 epoch: 60, train_loss: 0.8629, test_loss: 1.0861, test_f1: 0.4632
 epoch: 61, train_loss: 0.8569, test_loss: 1.1012, test_f1: 0.4619
 epoch: 62, train_loss: 0.8707, test_loss: 1.0985, test_f1: 0.4650
 epoch: 63, train_loss: 0.8477, test_loss: 1.1182, test_f1: 0.4609
 epoch: 64, train_loss: 0.8501, test_loss: 1.0987, test_f1: 0.4621
 epoch: 65, train_loss: 0.8507, test_loss: 1.0943, test_f1: 0.4653
 epoch: 66, train_loss: 0.8575, test_loss: 1.1037, test_f1: 0.4632
 epoch: 67, train_loss: 0.8455, test_loss: 1.1016, test_f1: 0.4696
 epoch: 68, train_loss: 0.8508, test_loss: 1.1262, test_f1: 0.4558
 epoch: 69, train_loss: 0.8455, test_loss: 1.1224, test_f1: 0.4535
 epoch: 70, train_loss: 0.8442, test_loss: 1.1113, test_f1: 0.4622
 epoch: 71, train_loss: 0.8328, test_loss: 1.1180, test_f1: 0.4543
 epoch: 72, train_loss: 0.8436, test_loss: 1.1237, test_f1: 0.4629
 epoch: 73, train_loss: 0.8344, test_loss: 1.1112, test_f1: 0.4569
 epoch: 74, train_loss: 0.8228, test_loss: 1.1204, test_f1: 0.4502
 epoch: 75, train_loss: 0.8351, test_loss: 1.1091, test_f1: 0.4676
 epoch: 76, train_loss: 0.8332, test_loss: 1.1191, test_f1: 0.4567
 epoch: 77, train_loss: 0.8218, test_loss: 1.1291, test_f1: 0.4441
 epoch: 78, train_loss: 0.8248, test_loss: 1.1255, test_f1: 0.4694
 epoch: 79, train_loss: 0.8278, test_loss: 1.1392, test_f1: 0.4641
 epoch: 80, train_loss: 0.8173, test_loss: 1.1375, test_f1: 0.4584
 epoch: 81, train_loss: 0.8194, test_loss: 1.1692, test_f1: 0.4579
 epoch: 82, train_loss: 0.8325, test_loss: 1.1523, test_f1: 0.4697
 epoch: 83, train_loss: 0.8188, test_loss: 1.1472, test_f1: 0.4581
 epoch: 84, train_loss: 0.8111, test_loss: 1.1475, test_f1: 0.4715
 epoch: 85, train_loss: 0.8113, test_loss: 1.1380, test_f1: 0.4705
 epoch: 86, train_loss: 0.8009, test_loss: 1.1290, test_f1: 0.4655
 epoch: 87, train_loss: 0.8147, test_loss: 1.1409, test_f1: 0.4655
 epoch: 88, train_loss: 0.8048, test_loss: 1.1536, test_f1: 0.4655
 epoch: 89, train_loss: 0.8002, test_loss: 1.1496, test_f1: 0.4641
 epoch: 90, train_loss: 0.8056, test_loss: 1.1486, test_f1: 0.4676
 epoch: 91, train_loss: 0.7968, test_loss: 1.1500, test_f1: 0.4761
 epoch: 92, train_loss: 0.8031, test_loss: 1.1421, test_f1: 0.4683
 epoch: 93, train_loss: 0.7910, test_loss: 1.1391, test_f1: 0.4715
 epoch: 94, train_loss: 0.7927, test_loss: 1.1563, test_f1: 0.4687
 epoch: 95, train_loss: 0.7900, test_loss: 1.1536, test_f1: 0.4729
 epoch: 96, train_loss: 0.7938, test_loss: 1.1595, test_f1: 0.4696
 epoch: 97, train_loss: 0.7854, test_loss: 1.1515, test_f1: 0.4729
 epoch: 98, train_loss: 0.7959, test_loss: 1.1599, test_f1: 0.4654
 epoch: 99, train_loss: 0.7844, test_loss: 1.1537, test_f1: 0.4632
##################ITERATION #3 ****************************************
 epoch: 0, train_loss: 1.3067, test_loss: 1.3238, test_f1: 0.2274
 epoch: 1, train_loss: 1.2829, test_loss: 1.3036, test_f1: 0.2274
 epoch: 2, train_loss: 1.2730, test_loss: 1.2751, test_f1: 0.2556
 epoch: 3, train_loss: 1.2581, test_loss: 1.2506, test_f1: 0.2666
 epoch: 4, train_loss: 1.2511, test_loss: 1.2349, test_f1: 0.2901
 epoch: 5, train_loss: 1.2424, test_loss: 1.2225, test_f1: 0.3049
 epoch: 6, train_loss: 1.2340, test_loss: 1.2119, test_f1: 0.3218
 epoch: 7, train_loss: 1.2223, test_loss: 1.2040, test_f1: 0.3359
 epoch: 8, train_loss: 1.2164, test_loss: 1.1973, test_f1: 0.3455
 epoch: 9, train_loss: 1.2070, test_loss: 1.1890, test_f1: 0.3515
 epoch: 10, train_loss: 1.1979, test_loss: 1.1833, test_f1: 0.3489
 epoch: 11, train_loss: 1.1876, test_loss: 1.1772, test_f1: 0.3566
 epoch: 12, train_loss: 1.1857, test_loss: 1.1700, test_f1: 0.3636
 epoch: 13, train_loss: 1.1805, test_loss: 1.1633, test_f1: 0.3904
 epoch: 14, train_loss: 1.1709, test_loss: 1.1574, test_f1: 0.4186
 epoch: 15, train_loss: 1.1680, test_loss: 1.1534, test_f1: 0.4253
 epoch: 16, train_loss: 1.1588, test_loss: 1.1481, test_f1: 0.4455
 epoch: 17, train_loss: 1.1615, test_loss: 1.1439, test_f1: 0.4446
 epoch: 18, train_loss: 1.1486, test_loss: 1.1386, test_f1: 0.4344
 epoch: 19, train_loss: 1.1453, test_loss: 1.1367, test_f1: 0.4434
 epoch: 20, train_loss: 1.1337, test_loss: 1.1294, test_f1: 0.4418
 epoch: 21, train_loss: 1.1314, test_loss: 1.1293, test_f1: 0.4337
 epoch: 22, train_loss: 1.1231, test_loss: 1.1277, test_f1: 0.4233
 epoch: 23, train_loss: 1.1270, test_loss: 1.1203, test_f1: 0.4302
 epoch: 24, train_loss: 1.1107, test_loss: 1.1180, test_f1: 0.4312
 epoch: 25, train_loss: 1.1090, test_loss: 1.1166, test_f1: 0.4248
 epoch: 26, train_loss: 1.1017, test_loss: 1.1122, test_f1: 0.4306
 epoch: 27, train_loss: 1.0963, test_loss: 1.1010, test_f1: 0.4476
 epoch: 28, train_loss: 1.0918, test_loss: 1.0941, test_f1: 0.4621
 epoch: 29, train_loss: 1.0868, test_loss: 1.0978, test_f1: 0.4512
 epoch: 30, train_loss: 1.0692, test_loss: 1.0951, test_f1: 0.4573
 epoch: 31, train_loss: 1.0670, test_loss: 1.0898, test_f1: 0.4591
 epoch: 32, train_loss: 1.0684, test_loss: 1.0899, test_f1: 0.4566
 epoch: 33, train_loss: 1.0555, test_loss: 1.0886, test_f1: 0.4628
 epoch: 34, train_loss: 1.0444, test_loss: 1.0812, test_f1: 0.4588
 epoch: 35, train_loss: 1.0443, test_loss: 1.0811, test_f1: 0.4482
 epoch: 36, train_loss: 1.0386, test_loss: 1.0724, test_f1: 0.4481
 epoch: 37, train_loss: 1.0292, test_loss: 1.0743, test_f1: 0.4698
 epoch: 38, train_loss: 1.0224, test_loss: 1.0792, test_f1: 0.4693
 epoch: 39, train_loss: 1.0218, test_loss: 1.0680, test_f1: 0.4673
 epoch: 40, train_loss: 1.0202, test_loss: 1.0591, test_f1: 0.4650
 epoch: 41, train_loss: 1.0072, test_loss: 1.0584, test_f1: 0.4605
 epoch: 42, train_loss: 1.0030, test_loss: 1.0729, test_f1: 0.4562
 epoch: 43, train_loss: 0.9966, test_loss: 1.0636, test_f1: 0.4644
 epoch: 44, train_loss: 0.9989, test_loss: 1.0580, test_f1: 0.4627
 epoch: 45, train_loss: 0.9834, test_loss: 1.0513, test_f1: 0.4549
 epoch: 46, train_loss: 0.9756, test_loss: 1.0419, test_f1: 0.4702
 epoch: 47, train_loss: 0.9799, test_loss: 1.0621, test_f1: 0.4657
 epoch: 48, train_loss: 0.9741, test_loss: 1.0835, test_f1: 0.4794
 epoch: 49, train_loss: 0.9682, test_loss: 1.0648, test_f1: 0.4600
 epoch: 50, train_loss: 0.9689, test_loss: 1.0723, test_f1: 0.4555
 epoch: 51, train_loss: 0.9493, test_loss: 1.0673, test_f1: 0.4677
 epoch: 52, train_loss: 0.9581, test_loss: 1.0694, test_f1: 0.4594
 epoch: 53, train_loss: 0.9523, test_loss: 1.0622, test_f1: 0.4624
 epoch: 54, train_loss: 0.9616, test_loss: 1.0695, test_f1: 0.4575
 epoch: 55, train_loss: 0.9510, test_loss: 1.0609, test_f1: 0.4529
 epoch: 56, train_loss: 0.9414, test_loss: 1.0643, test_f1: 0.4698
 epoch: 57, train_loss: 0.9375, test_loss: 1.0674, test_f1: 0.4598
 epoch: 58, train_loss: 0.9404, test_loss: 1.0682, test_f1: 0.4587
 epoch: 59, train_loss: 0.9288, test_loss: 1.0604, test_f1: 0.4647
 epoch: 60, train_loss: 0.9422, test_loss: 1.0665, test_f1: 0.4502
 epoch: 61, train_loss: 0.9241, test_loss: 1.0692, test_f1: 0.4564
 epoch: 62, train_loss: 0.9215, test_loss: 1.0644, test_f1: 0.4558
 epoch: 63, train_loss: 0.9320, test_loss: 1.0688, test_f1: 0.4692
 epoch: 64, train_loss: 0.9197, test_loss: 1.0773, test_f1: 0.4653
 epoch: 65, train_loss: 0.9236, test_loss: 1.0746, test_f1: 0.4611
 epoch: 66, train_loss: 0.9237, test_loss: 1.0577, test_f1: 0.4546
 epoch: 67, train_loss: 0.9131, test_loss: 1.0634, test_f1: 0.4524
 epoch: 68, train_loss: 0.9108, test_loss: 1.0734, test_f1: 0.4533
 epoch: 69, train_loss: 0.9176, test_loss: 1.0713, test_f1: 0.4529
 epoch: 70, train_loss: 0.9145, test_loss: 1.0827, test_f1: 0.4576
 epoch: 71, train_loss: 0.9086, test_loss: 1.0809, test_f1: 0.4592
 epoch: 72, train_loss: 0.9137, test_loss: 1.0795, test_f1: 0.4573
 epoch: 73, train_loss: 0.9016, test_loss: 1.0740, test_f1: 0.4638
 epoch: 74, train_loss: 0.9098, test_loss: 1.0894, test_f1: 0.4594
 epoch: 75, train_loss: 0.9141, test_loss: 1.0892, test_f1: 0.4670
 epoch: 76, train_loss: 0.9096, test_loss: 1.0918, test_f1: 0.4637
 epoch: 77, train_loss: 0.8976, test_loss: 1.0871, test_f1: 0.4600
 epoch: 78, train_loss: 0.9121, test_loss: 1.0953, test_f1: 0.4629
 epoch: 79, train_loss: 0.8991, test_loss: 1.0901, test_f1: 0.4668
 epoch: 80, train_loss: 0.8897, test_loss: 1.0860, test_f1: 0.4639
 epoch: 81, train_loss: 0.8971, test_loss: 1.0838, test_f1: 0.4622
 epoch: 82, train_loss: 0.8744, test_loss: 1.0884, test_f1: 0.4645
 epoch: 83, train_loss: 0.8925, test_loss: 1.0953, test_f1: 0.4626
 epoch: 84, train_loss: 0.8824, test_loss: 1.0955, test_f1: 0.4607
 epoch: 85, train_loss: 0.8871, test_loss: 1.0931, test_f1: 0.4581
 epoch: 86, train_loss: 0.8832, test_loss: 1.0992, test_f1: 0.4601
 epoch: 87, train_loss: 0.8853, test_loss: 1.1061, test_f1: 0.4570
 epoch: 88, train_loss: 0.8852, test_loss: 1.1020, test_f1: 0.4664
 epoch: 89, train_loss: 0.8755, test_loss: 1.0957, test_f1: 0.4572
 epoch: 90, train_loss: 0.8782, test_loss: 1.1167, test_f1: 0.4576
 epoch: 91, train_loss: 0.8887, test_loss: 1.1004, test_f1: 0.4626
 epoch: 92, train_loss: 0.8785, test_loss: 1.1070, test_f1: 0.4611
 epoch: 93, train_loss: 0.8676, test_loss: 1.1038, test_f1: 0.4645
 epoch: 94, train_loss: 0.8596, test_loss: 1.0909, test_f1: 0.4668
 epoch: 95, train_loss: 0.8704, test_loss: 1.1002, test_f1: 0.4616
 epoch: 96, train_loss: 0.8690, test_loss: 1.1119, test_f1: 0.4675
 epoch: 97, train_loss: 0.8677, test_loss: 1.1144, test_f1: 0.4687
 epoch: 98, train_loss: 0.8640, test_loss: 1.1146, test_f1: 0.4679
 epoch: 99, train_loss: 0.8546, test_loss: 1.1224, test_f1: 0.4689
##################ITERATION #4 ****************************************
 epoch: 0, train_loss: 1.3105, test_loss: 1.3123, test_f1: 0.2274
 epoch: 1, train_loss: 1.2779, test_loss: 1.2917, test_f1: 0.2274
 epoch: 2, train_loss: 1.2636, test_loss: 1.2634, test_f1: 0.2555
 epoch: 3, train_loss: 1.2549, test_loss: 1.2374, test_f1: 0.2958
 epoch: 4, train_loss: 1.2447, test_loss: 1.2207, test_f1: 0.3164
 epoch: 5, train_loss: 1.2348, test_loss: 1.2099, test_f1: 0.3422
 epoch: 6, train_loss: 1.2232, test_loss: 1.2017, test_f1: 0.3782
 epoch: 7, train_loss: 1.2163, test_loss: 1.1950, test_f1: 0.3928
 epoch: 8, train_loss: 1.2114, test_loss: 1.1880, test_f1: 0.4008
 epoch: 9, train_loss: 1.2030, test_loss: 1.1804, test_f1: 0.3994
 epoch: 10, train_loss: 1.1981, test_loss: 1.1749, test_f1: 0.4081
 epoch: 11, train_loss: 1.1911, test_loss: 1.1706, test_f1: 0.4214
 epoch: 12, train_loss: 1.1822, test_loss: 1.1642, test_f1: 0.4215
 epoch: 13, train_loss: 1.1784, test_loss: 1.1592, test_f1: 0.4213
 epoch: 14, train_loss: 1.1719, test_loss: 1.1547, test_f1: 0.4212
 epoch: 15, train_loss: 1.1634, test_loss: 1.1519, test_f1: 0.4182
 epoch: 16, train_loss: 1.1616, test_loss: 1.1459, test_f1: 0.4246
 epoch: 17, train_loss: 1.1532, test_loss: 1.1427, test_f1: 0.4243
 epoch: 18, train_loss: 1.1441, test_loss: 1.1383, test_f1: 0.4266
 epoch: 19, train_loss: 1.1452, test_loss: 1.1341, test_f1: 0.4153
 epoch: 20, train_loss: 1.1355, test_loss: 1.1292, test_f1: 0.4137
 epoch: 21, train_loss: 1.1362, test_loss: 1.1230, test_f1: 0.4172
 epoch: 22, train_loss: 1.1273, test_loss: 1.1188, test_f1: 0.4303
 epoch: 23, train_loss: 1.1171, test_loss: 1.1120, test_f1: 0.4359
 epoch: 24, train_loss: 1.1145, test_loss: 1.1127, test_f1: 0.4391
 epoch: 25, train_loss: 1.1083, test_loss: 1.1061, test_f1: 0.4344
 epoch: 26, train_loss: 1.0953, test_loss: 1.1039, test_f1: 0.4329
 epoch: 27, train_loss: 1.0943, test_loss: 1.1022, test_f1: 0.4278
 epoch: 28, train_loss: 1.0951, test_loss: 1.1020, test_f1: 0.4299
 epoch: 29, train_loss: 1.0837, test_loss: 1.0923, test_f1: 0.4311
 epoch: 30, train_loss: 1.0763, test_loss: 1.0899, test_f1: 0.4446
 epoch: 31, train_loss: 1.0723, test_loss: 1.0811, test_f1: 0.4349
 epoch: 32, train_loss: 1.0636, test_loss: 1.0806, test_f1: 0.4384
 epoch: 33, train_loss: 1.0518, test_loss: 1.0689, test_f1: 0.4296
 epoch: 34, train_loss: 1.0521, test_loss: 1.0659, test_f1: 0.4439
 epoch: 35, train_loss: 1.0315, test_loss: 1.0724, test_f1: 0.4517
 epoch: 36, train_loss: 1.0373, test_loss: 1.0614, test_f1: 0.4567
 epoch: 37, train_loss: 1.0295, test_loss: 1.0600, test_f1: 0.4442
 epoch: 38, train_loss: 1.0269, test_loss: 1.0541, test_f1: 0.4470
 epoch: 39, train_loss: 1.0238, test_loss: 1.0564, test_f1: 0.4420
 epoch: 40, train_loss: 1.0113, test_loss: 1.0464, test_f1: 0.4468
 epoch: 41, train_loss: 1.0061, test_loss: 1.0506, test_f1: 0.4508
 epoch: 42, train_loss: 0.9965, test_loss: 1.0623, test_f1: 0.4462
 epoch: 43, train_loss: 0.9937, test_loss: 1.0627, test_f1: 0.4477
 epoch: 44, train_loss: 0.9795, test_loss: 1.0470, test_f1: 0.4707
 epoch: 45, train_loss: 0.9896, test_loss: 1.0491, test_f1: 0.4579
 epoch: 46, train_loss: 0.9808, test_loss: 1.0594, test_f1: 0.4516
 epoch: 47, train_loss: 0.9646, test_loss: 1.0573, test_f1: 0.4582
 epoch: 48, train_loss: 0.9784, test_loss: 1.0491, test_f1: 0.4671
 epoch: 49, train_loss: 0.9585, test_loss: 1.0420, test_f1: 0.4750
 epoch: 50, train_loss: 0.9469, test_loss: 1.0445, test_f1: 0.4675
 epoch: 51, train_loss: 0.9423, test_loss: 1.0680, test_f1: 0.4627
 epoch: 52, train_loss: 0.9445, test_loss: 1.0511, test_f1: 0.4648
 epoch: 53, train_loss: 0.9373, test_loss: 1.0500, test_f1: 0.4637
 epoch: 54, train_loss: 0.9233, test_loss: 1.0546, test_f1: 0.4691
 epoch: 55, train_loss: 0.9484, test_loss: 1.0600, test_f1: 0.4649
 epoch: 56, train_loss: 0.9331, test_loss: 1.0633, test_f1: 0.4674
 epoch: 57, train_loss: 0.9394, test_loss: 1.0549, test_f1: 0.4615
 epoch: 58, train_loss: 0.9211, test_loss: 1.0591, test_f1: 0.4574
 epoch: 59, train_loss: 0.9154, test_loss: 1.0696, test_f1: 0.4554
 epoch: 60, train_loss: 0.9150, test_loss: 1.0544, test_f1: 0.4645
 epoch: 61, train_loss: 0.9286, test_loss: 1.0653, test_f1: 0.4617
 epoch: 62, train_loss: 0.9114, test_loss: 1.0580, test_f1: 0.4551
 epoch: 63, train_loss: 0.9190, test_loss: 1.0636, test_f1: 0.4520
 epoch: 64, train_loss: 0.9026, test_loss: 1.0646, test_f1: 0.4616
 epoch: 65, train_loss: 0.9026, test_loss: 1.0779, test_f1: 0.4588
 epoch: 66, train_loss: 0.9002, test_loss: 1.0803, test_f1: 0.4473
 epoch: 67, train_loss: 0.9076, test_loss: 1.0710, test_f1: 0.4565
 epoch: 68, train_loss: 0.8952, test_loss: 1.0587, test_f1: 0.4672
 epoch: 69, train_loss: 0.9039, test_loss: 1.0728, test_f1: 0.4598
 epoch: 70, train_loss: 0.8945, test_loss: 1.0669, test_f1: 0.4497
 epoch: 71, train_loss: 0.8977, test_loss: 1.0715, test_f1: 0.4600
 epoch: 72, train_loss: 0.8891, test_loss: 1.0769, test_f1: 0.4531
 epoch: 73, train_loss: 0.8885, test_loss: 1.0918, test_f1: 0.4546
 epoch: 74, train_loss: 0.8923, test_loss: 1.0694, test_f1: 0.4598
 epoch: 75, train_loss: 0.8801, test_loss: 1.0784, test_f1: 0.4551
 epoch: 76, train_loss: 0.8841, test_loss: 1.0542, test_f1: 0.4641
 epoch: 77, train_loss: 0.8805, test_loss: 1.0846, test_f1: 0.4495
 epoch: 78, train_loss: 0.8760, test_loss: 1.0683, test_f1: 0.4636
 epoch: 79, train_loss: 0.8921, test_loss: 1.0798, test_f1: 0.4554
 epoch: 80, train_loss: 0.8768, test_loss: 1.0884, test_f1: 0.4601
 epoch: 81, train_loss: 0.8865, test_loss: 1.0913, test_f1: 0.4537
 epoch: 82, train_loss: 0.8744, test_loss: 1.0748, test_f1: 0.4550
 epoch: 83, train_loss: 0.8733, test_loss: 1.0971, test_f1: 0.4563
 epoch: 84, train_loss: 0.8720, test_loss: 1.0827, test_f1: 0.4542
 epoch: 85, train_loss: 0.8713, test_loss: 1.0846, test_f1: 0.4619
 epoch: 86, train_loss: 0.8670, test_loss: 1.0946, test_f1: 0.4540
 epoch: 87, train_loss: 0.8720, test_loss: 1.0830, test_f1: 0.4624
 epoch: 88, train_loss: 0.8557, test_loss: 1.1004, test_f1: 0.4566
 epoch: 89, train_loss: 0.8606, test_loss: 1.0987, test_f1: 0.4554
 epoch: 90, train_loss: 0.8619, test_loss: 1.1046, test_f1: 0.4553
 epoch: 91, train_loss: 0.8558, test_loss: 1.0919, test_f1: 0.4542
 epoch: 92, train_loss: 0.8666, test_loss: 1.1014, test_f1: 0.4594
 epoch: 93, train_loss: 0.8563, test_loss: 1.1069, test_f1: 0.4571
 epoch: 94, train_loss: 0.8407, test_loss: 1.0977, test_f1: 0.4618
 epoch: 95, train_loss: 0.8536, test_loss: 1.1238, test_f1: 0.4649
 epoch: 96, train_loss: 0.8585, test_loss: 1.1073, test_f1: 0.4554
 epoch: 97, train_loss: 0.8475, test_loss: 1.1104, test_f1: 0.4624
 epoch: 98, train_loss: 0.8489, test_loss: 1.1077, test_f1: 0.4641
 epoch: 99, train_loss: 0.8595, test_loss: 1.1048, test_f1: 0.4593
##################ITERATION #5 ****************************************
 epoch: 0, train_loss: 1.3182, test_loss: 1.3122, test_f1: 0.2274
 epoch: 1, train_loss: 1.2722, test_loss: 1.2942, test_f1: 0.2274
 epoch: 2, train_loss: 1.2593, test_loss: 1.2682, test_f1: 0.2848
 epoch: 3, train_loss: 1.2402, test_loss: 1.2472, test_f1: 0.2983
 epoch: 4, train_loss: 1.2316, test_loss: 1.2369, test_f1: 0.3203
 epoch: 5, train_loss: 1.2197, test_loss: 1.2599, test_f1: 0.3478
 epoch: 6, train_loss: 1.2097, test_loss: 1.2297, test_f1: 0.4049
 epoch: 7, train_loss: 1.2012, test_loss: 1.1886, test_f1: 0.4229
 epoch: 8, train_loss: 1.1909, test_loss: 1.1736, test_f1: 0.4280
 epoch: 9, train_loss: 1.1808, test_loss: 1.1636, test_f1: 0.4246
 epoch: 10, train_loss: 1.1802, test_loss: 1.1536, test_f1: 0.4316
 epoch: 11, train_loss: 1.1617, test_loss: 1.1471, test_f1: 0.4299
 epoch: 12, train_loss: 1.1592, test_loss: 1.1389, test_f1: 0.4245
 epoch: 13, train_loss: 1.1499, test_loss: 1.1391, test_f1: 0.4322
 epoch: 14, train_loss: 1.1425, test_loss: 1.1395, test_f1: 0.4318
 epoch: 15, train_loss: 1.1328, test_loss: 1.1388, test_f1: 0.4429
 epoch: 16, train_loss: 1.1310, test_loss: 1.1310, test_f1: 0.4385
 epoch: 17, train_loss: 1.1359, test_loss: 1.1334, test_f1: 0.4454
 epoch: 18, train_loss: 1.1121, test_loss: 1.1462, test_f1: 0.4342
 epoch: 19, train_loss: 1.1162, test_loss: 1.1343, test_f1: 0.4388
 epoch: 20, train_loss: 1.1050, test_loss: 1.1221, test_f1: 0.4424
 epoch: 21, train_loss: 1.1012, test_loss: 1.1129, test_f1: 0.4515
 epoch: 22, train_loss: 1.0939, test_loss: 1.1219, test_f1: 0.4497
 epoch: 23, train_loss: 1.0902, test_loss: 1.1517, test_f1: 0.4394
 epoch: 24, train_loss: 1.0787, test_loss: 1.1368, test_f1: 0.4662
 epoch: 25, train_loss: 1.0800, test_loss: 1.1155, test_f1: 0.4616
 epoch: 26, train_loss: 1.0670, test_loss: 1.1612, test_f1: 0.4570
 epoch: 27, train_loss: 1.0682, test_loss: 1.2135, test_f1: 0.4589
 epoch: 28, train_loss: 1.0594, test_loss: 1.1846, test_f1: 0.4527
 epoch: 29, train_loss: 1.0558, test_loss: 1.1789, test_f1: 0.4588
 epoch: 30, train_loss: 1.0393, test_loss: 1.1384, test_f1: 0.4553
 epoch: 31, train_loss: 1.0532, test_loss: 1.0950, test_f1: 0.4498
 epoch: 32, train_loss: 1.0427, test_loss: 1.1040, test_f1: 0.4550
 epoch: 33, train_loss: 1.0269, test_loss: 1.0921, test_f1: 0.4485
 epoch: 34, train_loss: 1.0261, test_loss: 1.0848, test_f1: 0.4703
 epoch: 35, train_loss: 1.0292, test_loss: 1.0943, test_f1: 0.4590
 epoch: 36, train_loss: 1.0207, test_loss: 1.1053, test_f1: 0.4560
 epoch: 37, train_loss: 1.0083, test_loss: 1.1089, test_f1: 0.4591
 epoch: 38, train_loss: 0.9998, test_loss: 1.1395, test_f1: 0.4586
 epoch: 39, train_loss: 0.9946, test_loss: 1.1346, test_f1: 0.4419
 epoch: 40, train_loss: 0.9955, test_loss: 1.1415, test_f1: 0.4524
 epoch: 41, train_loss: 0.9938, test_loss: 1.0966, test_f1: 0.4488
 epoch: 42, train_loss: 0.9909, test_loss: 1.0642, test_f1: 0.4571
 epoch: 43, train_loss: 0.9800, test_loss: 1.0631, test_f1: 0.4564
 epoch: 44, train_loss: 0.9662, test_loss: 1.0841, test_f1: 0.4434
 epoch: 45, train_loss: 0.9707, test_loss: 1.1287, test_f1: 0.4434
 epoch: 46, train_loss: 0.9571, test_loss: 1.1316, test_f1: 0.4500
 epoch: 47, train_loss: 0.9735, test_loss: 1.1216, test_f1: 0.4458
 epoch: 48, train_loss: 0.9582, test_loss: 1.0781, test_f1: 0.4455
 epoch: 49, train_loss: 0.9496, test_loss: 1.0679, test_f1: 0.4570
 epoch: 50, train_loss: 0.9479, test_loss: 1.0700, test_f1: 0.4503
 epoch: 51, train_loss: 0.9464, test_loss: 1.0818, test_f1: 0.4528
 epoch: 52, train_loss: 0.9346, test_loss: 1.0849, test_f1: 0.4471
 epoch: 53, train_loss: 0.9263, test_loss: 1.0879, test_f1: 0.4450
 epoch: 54, train_loss: 0.9158, test_loss: 1.0628, test_f1: 0.4564
 epoch: 55, train_loss: 0.9319, test_loss: 1.0788, test_f1: 0.4536
 epoch: 56, train_loss: 0.9171, test_loss: 1.0914, test_f1: 0.4620
 epoch: 57, train_loss: 0.9294, test_loss: 1.0840, test_f1: 0.4510
 epoch: 58, train_loss: 0.9243, test_loss: 1.0670, test_f1: 0.4444
 epoch: 59, train_loss: 0.9147, test_loss: 1.0724, test_f1: 0.4526
 epoch: 60, train_loss: 0.9230, test_loss: 1.0874, test_f1: 0.4537
 epoch: 61, train_loss: 0.9189, test_loss: 1.0914, test_f1: 0.4588
 epoch: 62, train_loss: 0.9063, test_loss: 1.0853, test_f1: 0.4564
 epoch: 63, train_loss: 0.9136, test_loss: 1.0796, test_f1: 0.4519
 epoch: 64, train_loss: 0.9177, test_loss: 1.0746, test_f1: 0.4477
 epoch: 65, train_loss: 0.9028, test_loss: 1.0887, test_f1: 0.4470
 epoch: 66, train_loss: 0.9140, test_loss: 1.0975, test_f1: 0.4510
 epoch: 67, train_loss: 0.9034, test_loss: 1.1010, test_f1: 0.4494
 epoch: 68, train_loss: 0.8963, test_loss: 1.0869, test_f1: 0.4599
 epoch: 69, train_loss: 0.8858, test_loss: 1.0890, test_f1: 0.4527
 epoch: 70, train_loss: 0.8908, test_loss: 1.0901, test_f1: 0.4641
 epoch: 71, train_loss: 0.8863, test_loss: 1.0830, test_f1: 0.4773
 epoch: 72, train_loss: 0.8928, test_loss: 1.0957, test_f1: 0.4577
 epoch: 73, train_loss: 0.8960, test_loss: 1.1061, test_f1: 0.4576
 epoch: 74, train_loss: 0.8931, test_loss: 1.1128, test_f1: 0.4449
 epoch: 75, train_loss: 0.8803, test_loss: 1.1161, test_f1: 0.4507
 epoch: 76, train_loss: 0.8917, test_loss: 1.1176, test_f1: 0.4644
 epoch: 77, train_loss: 0.8760, test_loss: 1.1206, test_f1: 0.4502
 epoch: 78, train_loss: 0.8759, test_loss: 1.1195, test_f1: 0.4595
 epoch: 79, train_loss: 0.8816, test_loss: 1.0814, test_f1: 0.4872
 epoch: 80, train_loss: 0.8882, test_loss: 1.0920, test_f1: 0.4805
 epoch: 81, train_loss: 0.8671, test_loss: 1.0834, test_f1: 0.4824
 epoch: 82, train_loss: 0.8591, test_loss: 1.0941, test_f1: 0.4805
 epoch: 83, train_loss: 0.8616, test_loss: 1.0909, test_f1: 0.4659
 epoch: 84, train_loss: 0.8693, test_loss: 1.0870, test_f1: 0.4610
 epoch: 85, train_loss: 0.8601, test_loss: 1.0976, test_f1: 0.4730
 epoch: 86, train_loss: 0.8566, test_loss: 1.1046, test_f1: 0.4530
 epoch: 87, train_loss: 0.8469, test_loss: 1.1065, test_f1: 0.4580
 epoch: 88, train_loss: 0.8562, test_loss: 1.1111, test_f1: 0.4566
 epoch: 89, train_loss: 0.8525, test_loss: 1.1059, test_f1: 0.4637
 epoch: 90, train_loss: 0.8678, test_loss: 1.1241, test_f1: 0.4645
 epoch: 91, train_loss: 0.8661, test_loss: 1.1135, test_f1: 0.4586
 epoch: 92, train_loss: 0.8567, test_loss: 1.1006, test_f1: 0.4605
 epoch: 93, train_loss: 0.8464, test_loss: 1.1195, test_f1: 0.4619
 epoch: 94, train_loss: 0.8565, test_loss: 1.1317, test_f1: 0.4603
 epoch: 95, train_loss: 0.8525, test_loss: 1.1077, test_f1: 0.4596
 epoch: 96, train_loss: 0.8379, test_loss: 1.1121, test_f1: 0.4594
 epoch: 97, train_loss: 0.8408, test_loss: 1.1260, test_f1: 0.4555
 epoch: 98, train_loss: 0.8297, test_loss: 1.1104, test_f1: 0.4585
 epoch: 99, train_loss: 0.8269, test_loss: 1.1194, test_f1: 0.4561
##################ITERATION #6 ****************************************
 epoch: 0, train_loss: 1.3109, test_loss: 1.3068, test_f1: 0.2274
 epoch: 1, train_loss: 1.2673, test_loss: 1.2902, test_f1: 0.2427
 epoch: 2, train_loss: 1.2512, test_loss: 1.2751, test_f1: 0.2597
 epoch: 3, train_loss: 1.2452, test_loss: 1.2520, test_f1: 0.3048
 epoch: 4, train_loss: 1.2366, test_loss: 1.2256, test_f1: 0.3737
 epoch: 5, train_loss: 1.2150, test_loss: 1.2105, test_f1: 0.4188
 epoch: 6, train_loss: 1.2180, test_loss: 1.1973, test_f1: 0.4109
 epoch: 7, train_loss: 1.2076, test_loss: 1.1876, test_f1: 0.4093
 epoch: 8, train_loss: 1.1987, test_loss: 1.1794, test_f1: 0.4180
 epoch: 9, train_loss: 1.1977, test_loss: 1.1732, test_f1: 0.4155
 epoch: 10, train_loss: 1.1839, test_loss: 1.1695, test_f1: 0.4152
 epoch: 11, train_loss: 1.1799, test_loss: 1.1673, test_f1: 0.4196
 epoch: 12, train_loss: 1.1663, test_loss: 1.1593, test_f1: 0.4376
 epoch: 13, train_loss: 1.1617, test_loss: 1.1510, test_f1: 0.4289
 epoch: 14, train_loss: 1.1537, test_loss: 1.1480, test_f1: 0.4506
 epoch: 15, train_loss: 1.1517, test_loss: 1.1503, test_f1: 0.4486
 epoch: 16, train_loss: 1.1483, test_loss: 1.1384, test_f1: 0.4499
 epoch: 17, train_loss: 1.1387, test_loss: 1.1340, test_f1: 0.4501
 epoch: 18, train_loss: 1.1314, test_loss: 1.1202, test_f1: 0.4572
 epoch: 19, train_loss: 1.1228, test_loss: 1.1116, test_f1: 0.4596
 epoch: 20, train_loss: 1.1132, test_loss: 1.1049, test_f1: 0.4492
 epoch: 21, train_loss: 1.1055, test_loss: 1.1064, test_f1: 0.4575
 epoch: 22, train_loss: 1.1012, test_loss: 1.1045, test_f1: 0.4587
 epoch: 23, train_loss: 1.0989, test_loss: 1.0951, test_f1: 0.4631
 epoch: 24, train_loss: 1.0950, test_loss: 1.0904, test_f1: 0.4517
 epoch: 25, train_loss: 1.0878, test_loss: 1.0819, test_f1: 0.4508
 epoch: 26, train_loss: 1.0858, test_loss: 1.0896, test_f1: 0.4512
 epoch: 27, train_loss: 1.0786, test_loss: 1.0816, test_f1: 0.4525
 epoch: 28, train_loss: 1.0689, test_loss: 1.0755, test_f1: 0.4523
 epoch: 29, train_loss: 1.0704, test_loss: 1.0719, test_f1: 0.4548
 epoch: 30, train_loss: 1.0664, test_loss: 1.0732, test_f1: 0.4601
 epoch: 31, train_loss: 1.0605, test_loss: 1.0675, test_f1: 0.4610
 epoch: 32, train_loss: 1.0584, test_loss: 1.0548, test_f1: 0.4656
 epoch: 33, train_loss: 1.0537, test_loss: 1.0516, test_f1: 0.4589
 epoch: 34, train_loss: 1.0389, test_loss: 1.0559, test_f1: 0.4669
 epoch: 35, train_loss: 1.0324, test_loss: 1.0648, test_f1: 0.4448
 epoch: 36, train_loss: 1.0318, test_loss: 1.0516, test_f1: 0.4564
 epoch: 37, train_loss: 1.0245, test_loss: 1.0419, test_f1: 0.4544
 epoch: 38, train_loss: 1.0230, test_loss: 1.0590, test_f1: 0.4532
 epoch: 39, train_loss: 1.0161, test_loss: 1.0512, test_f1: 0.4645
 epoch: 40, train_loss: 1.0172, test_loss: 1.0437, test_f1: 0.4604
 epoch: 41, train_loss: 1.0082, test_loss: 1.0496, test_f1: 0.4552
 epoch: 42, train_loss: 1.0096, test_loss: 1.0434, test_f1: 0.4740
 epoch: 43, train_loss: 1.0048, test_loss: 1.0523, test_f1: 0.4529
 epoch: 44, train_loss: 0.9946, test_loss: 1.0485, test_f1: 0.4533
 epoch: 45, train_loss: 0.9826, test_loss: 1.0353, test_f1: 0.4564
 epoch: 46, train_loss: 0.9815, test_loss: 1.0447, test_f1: 0.4534
 epoch: 47, train_loss: 0.9700, test_loss: 1.0434, test_f1: 0.4740
 epoch: 48, train_loss: 0.9819, test_loss: 1.0387, test_f1: 0.4797
 epoch: 49, train_loss: 0.9668, test_loss: 1.0470, test_f1: 0.4650
 epoch: 50, train_loss: 0.9764, test_loss: 1.0453, test_f1: 0.4563
 epoch: 51, train_loss: 0.9617, test_loss: 1.0540, test_f1: 0.4587
 epoch: 52, train_loss: 0.9588, test_loss: 1.0466, test_f1: 0.4566
 epoch: 53, train_loss: 0.9575, test_loss: 1.0342, test_f1: 0.4619
 epoch: 54, train_loss: 0.9544, test_loss: 1.0463, test_f1: 0.4742
 epoch: 55, train_loss: 0.9501, test_loss: 1.0464, test_f1: 0.4683
 epoch: 56, train_loss: 0.9342, test_loss: 1.0597, test_f1: 0.4539
 epoch: 57, train_loss: 0.9557, test_loss: 1.0502, test_f1: 0.4765
 epoch: 58, train_loss: 0.9454, test_loss: 1.0465, test_f1: 0.4651
 epoch: 59, train_loss: 0.9478, test_loss: 1.0501, test_f1: 0.4663
 epoch: 60, train_loss: 0.9405, test_loss: 1.0421, test_f1: 0.4623
 epoch: 61, train_loss: 0.9335, test_loss: 1.0443, test_f1: 0.4658
 epoch: 62, train_loss: 0.9371, test_loss: 1.0481, test_f1: 0.4650
 epoch: 63, train_loss: 0.9368, test_loss: 1.0423, test_f1: 0.4651
 epoch: 64, train_loss: 0.9320, test_loss: 1.0405, test_f1: 0.4607
 epoch: 65, train_loss: 0.9309, test_loss: 1.0422, test_f1: 0.4550
 epoch: 66, train_loss: 0.9399, test_loss: 1.0385, test_f1: 0.4590
 epoch: 67, train_loss: 0.9187, test_loss: 1.0459, test_f1: 0.4630
 epoch: 68, train_loss: 0.9168, test_loss: 1.0499, test_f1: 0.4608
 epoch: 69, train_loss: 0.9184, test_loss: 1.0471, test_f1: 0.4604
 epoch: 70, train_loss: 0.9192, test_loss: 1.0518, test_f1: 0.4586
 epoch: 71, train_loss: 0.9127, test_loss: 1.0524, test_f1: 0.4570
 epoch: 72, train_loss: 0.9153, test_loss: 1.0396, test_f1: 0.4641
 epoch: 73, train_loss: 0.9023, test_loss: 1.0456, test_f1: 0.4557
 epoch: 74, train_loss: 0.9164, test_loss: 1.0435, test_f1: 0.4689
 epoch: 75, train_loss: 0.9083, test_loss: 1.0527, test_f1: 0.4582
 epoch: 76, train_loss: 0.9106, test_loss: 1.0416, test_f1: 0.4718
 epoch: 77, train_loss: 0.9032, test_loss: 1.0571, test_f1: 0.4584
 epoch: 78, train_loss: 0.8953, test_loss: 1.0702, test_f1: 0.4536
 epoch: 79, train_loss: 0.9055, test_loss: 1.0518, test_f1: 0.4605
 epoch: 80, train_loss: 0.8922, test_loss: 1.0488, test_f1: 0.4674
 epoch: 81, train_loss: 0.8996, test_loss: 1.0596, test_f1: 0.4638
 epoch: 82, train_loss: 0.9096, test_loss: 1.0581, test_f1: 0.4622
 epoch: 83, train_loss: 0.8920, test_loss: 1.0689, test_f1: 0.4557
 epoch: 84, train_loss: 0.8792, test_loss: 1.0590, test_f1: 0.4546
 epoch: 85, train_loss: 0.8833, test_loss: 1.0647, test_f1: 0.4573
 epoch: 86, train_loss: 0.9043, test_loss: 1.0864, test_f1: 0.4563
 epoch: 87, train_loss: 0.8861, test_loss: 1.0719, test_f1: 0.4562
 epoch: 88, train_loss: 0.8870, test_loss: 1.0644, test_f1: 0.4661
 epoch: 89, train_loss: 0.8787, test_loss: 1.0731, test_f1: 0.4627
 epoch: 90, train_loss: 0.8855, test_loss: 1.0729, test_f1: 0.4650
 epoch: 91, train_loss: 0.8851, test_loss: 1.0712, test_f1: 0.4661
 epoch: 92, train_loss: 0.8819, test_loss: 1.0836, test_f1: 0.4664
 epoch: 93, train_loss: 0.8859, test_loss: 1.0675, test_f1: 0.4633
 epoch: 94, train_loss: 0.8756, test_loss: 1.0809, test_f1: 0.4561
 epoch: 95, train_loss: 0.8702, test_loss: 1.0960, test_f1: 0.4581
 epoch: 96, train_loss: 0.8687, test_loss: 1.0938, test_f1: 0.4558
 epoch: 97, train_loss: 0.8642, test_loss: 1.0961, test_f1: 0.4588
 epoch: 98, train_loss: 0.8626, test_loss: 1.0833, test_f1: 0.4622
 epoch: 99, train_loss: 0.8863, test_loss: 1.0754, test_f1: 0.4772
##################ITERATION #7 ****************************************
 epoch: 0, train_loss: 1.3009, test_loss: 1.3010, test_f1: 0.2274
 epoch: 1, train_loss: 1.2617, test_loss: 1.2849, test_f1: 0.2274
 epoch: 2, train_loss: 1.2451, test_loss: 1.2666, test_f1: 0.2552
 epoch: 3, train_loss: 1.2294, test_loss: 1.2359, test_f1: 0.3307
 epoch: 4, train_loss: 1.2209, test_loss: 1.2115, test_f1: 0.3749
 epoch: 5, train_loss: 1.2100, test_loss: 1.1994, test_f1: 0.4015
 epoch: 6, train_loss: 1.2046, test_loss: 1.1886, test_f1: 0.4272
 epoch: 7, train_loss: 1.1974, test_loss: 1.1816, test_f1: 0.4190
 epoch: 8, train_loss: 1.1847, test_loss: 1.1739, test_f1: 0.4238
 epoch: 9, train_loss: 1.1856, test_loss: 1.1667, test_f1: 0.4352
 epoch: 10, train_loss: 1.1775, test_loss: 1.1598, test_f1: 0.4415
 epoch: 11, train_loss: 1.1670, test_loss: 1.1566, test_f1: 0.4517
 epoch: 12, train_loss: 1.1583, test_loss: 1.1488, test_f1: 0.4449
 epoch: 13, train_loss: 1.1555, test_loss: 1.1386, test_f1: 0.4432
 epoch: 14, train_loss: 1.1424, test_loss: 1.1347, test_f1: 0.4472
 epoch: 15, train_loss: 1.1416, test_loss: 1.1282, test_f1: 0.4482
 epoch: 16, train_loss: 1.1387, test_loss: 1.1199, test_f1: 0.4525
 epoch: 17, train_loss: 1.1304, test_loss: 1.1197, test_f1: 0.4554
 epoch: 18, train_loss: 1.1268, test_loss: 1.1125, test_f1: 0.4625
 epoch: 19, train_loss: 1.1205, test_loss: 1.1076, test_f1: 0.4587
 epoch: 20, train_loss: 1.1145, test_loss: 1.1016, test_f1: 0.4559
 epoch: 21, train_loss: 1.1088, test_loss: 1.0956, test_f1: 0.4660
 epoch: 22, train_loss: 1.1067, test_loss: 1.0886, test_f1: 0.4652
 epoch: 23, train_loss: 1.0985, test_loss: 1.0816, test_f1: 0.4721
 epoch: 24, train_loss: 1.0943, test_loss: 1.0803, test_f1: 0.4638
 epoch: 25, train_loss: 1.0844, test_loss: 1.0731, test_f1: 0.4634
 epoch: 26, train_loss: 1.0731, test_loss: 1.0748, test_f1: 0.4617
 epoch: 27, train_loss: 1.0750, test_loss: 1.0716, test_f1: 0.4682
 epoch: 28, train_loss: 1.0637, test_loss: 1.0616, test_f1: 0.4735
 epoch: 29, train_loss: 1.0545, test_loss: 1.0633, test_f1: 0.4676
 epoch: 30, train_loss: 1.0584, test_loss: 1.0578, test_f1: 0.4775
 epoch: 31, train_loss: 1.0520, test_loss: 1.0553, test_f1: 0.4700
 epoch: 32, train_loss: 1.0381, test_loss: 1.0572, test_f1: 0.4735
 epoch: 33, train_loss: 1.0343, test_loss: 1.0550, test_f1: 0.4832
 epoch: 34, train_loss: 1.0339, test_loss: 1.0506, test_f1: 0.4762
 epoch: 35, train_loss: 1.0298, test_loss: 1.0485, test_f1: 0.4861
 epoch: 36, train_loss: 1.0264, test_loss: 1.0395, test_f1: 0.4823
 epoch: 37, train_loss: 1.0198, test_loss: 1.0539, test_f1: 0.4799
 epoch: 38, train_loss: 1.0011, test_loss: 1.0424, test_f1: 0.4728
 epoch: 39, train_loss: 0.9988, test_loss: 1.0445, test_f1: 0.4683
 epoch: 40, train_loss: 0.9978, test_loss: 1.0475, test_f1: 0.4769
 epoch: 41, train_loss: 0.9956, test_loss: 1.0484, test_f1: 0.4743
 epoch: 42, train_loss: 0.9959, test_loss: 1.0388, test_f1: 0.4790
 epoch: 43, train_loss: 0.9866, test_loss: 1.0382, test_f1: 0.4766
 epoch: 44, train_loss: 0.9872, test_loss: 1.0510, test_f1: 0.4553
 epoch: 45, train_loss: 0.9739, test_loss: 1.0404, test_f1: 0.4666
 epoch: 46, train_loss: 0.9698, test_loss: 1.0490, test_f1: 0.4751
 epoch: 47, train_loss: 0.9749, test_loss: 1.0404, test_f1: 0.4742
 epoch: 48, train_loss: 0.9662, test_loss: 1.0702, test_f1: 0.4522
 epoch: 49, train_loss: 0.9622, test_loss: 1.0646, test_f1: 0.4608
 epoch: 50, train_loss: 0.9508, test_loss: 1.0461, test_f1: 0.4684
 epoch: 51, train_loss: 0.9407, test_loss: 1.0480, test_f1: 0.4624
 epoch: 52, train_loss: 0.9425, test_loss: 1.0426, test_f1: 0.4724
 epoch: 53, train_loss: 0.9450, test_loss: 1.0502, test_f1: 0.4672
 epoch: 54, train_loss: 0.9332, test_loss: 1.0477, test_f1: 0.4654
 epoch: 55, train_loss: 0.9423, test_loss: 1.0623, test_f1: 0.4700
 epoch: 56, train_loss: 0.9384, test_loss: 1.0703, test_f1: 0.4492
 epoch: 57, train_loss: 0.9346, test_loss: 1.0512, test_f1: 0.4749
 epoch: 58, train_loss: 0.9282, test_loss: 1.0530, test_f1: 0.4541
 epoch: 59, train_loss: 0.9275, test_loss: 1.0502, test_f1: 0.4574
 epoch: 60, train_loss: 0.9201, test_loss: 1.0619, test_f1: 0.4588
 epoch: 61, train_loss: 0.9210, test_loss: 1.0622, test_f1: 0.4594
 epoch: 62, train_loss: 0.9258, test_loss: 1.0839, test_f1: 0.4470
 epoch: 63, train_loss: 0.9227, test_loss: 1.0827, test_f1: 0.4482
 epoch: 64, train_loss: 0.9261, test_loss: 1.0559, test_f1: 0.4471
 epoch: 65, train_loss: 0.9046, test_loss: 1.0627, test_f1: 0.4493
 epoch: 66, train_loss: 0.9068, test_loss: 1.0828, test_f1: 0.4552
 epoch: 67, train_loss: 0.9052, test_loss: 1.0780, test_f1: 0.4577
 epoch: 68, train_loss: 0.8993, test_loss: 1.0770, test_f1: 0.4544
 epoch: 69, train_loss: 0.9007, test_loss: 1.0761, test_f1: 0.4603
 epoch: 70, train_loss: 0.9075, test_loss: 1.0753, test_f1: 0.4616
 epoch: 71, train_loss: 0.8930, test_loss: 1.0784, test_f1: 0.4548
 epoch: 72, train_loss: 0.8864, test_loss: 1.0782, test_f1: 0.4593
 epoch: 73, train_loss: 0.8936, test_loss: 1.0747, test_f1: 0.4564
 epoch: 74, train_loss: 0.8840, test_loss: 1.0823, test_f1: 0.4598
 epoch: 75, train_loss: 0.8849, test_loss: 1.0770, test_f1: 0.4515
 epoch: 76, train_loss: 0.8867, test_loss: 1.0895, test_f1: 0.4617
 epoch: 77, train_loss: 0.8940, test_loss: 1.0929, test_f1: 0.4498
 epoch: 78, train_loss: 0.8851, test_loss: 1.0983, test_f1: 0.4479
 epoch: 79, train_loss: 0.8767, test_loss: 1.0961, test_f1: 0.4471
 epoch: 80, train_loss: 0.8826, test_loss: 1.1102, test_f1: 0.4428
 epoch: 81, train_loss: 0.8727, test_loss: 1.1028, test_f1: 0.4544
 epoch: 82, train_loss: 0.8781, test_loss: 1.1039, test_f1: 0.4511
 epoch: 83, train_loss: 0.8643, test_loss: 1.1110, test_f1: 0.4490
 epoch: 84, train_loss: 0.8756, test_loss: 1.0996, test_f1: 0.4575
 epoch: 85, train_loss: 0.8672, test_loss: 1.0968, test_f1: 0.4552
 epoch: 86, train_loss: 0.8700, test_loss: 1.0877, test_f1: 0.4552
 epoch: 87, train_loss: 0.8811, test_loss: 1.0984, test_f1: 0.4606
 epoch: 88, train_loss: 0.8660, test_loss: 1.1006, test_f1: 0.4620
 epoch: 89, train_loss: 0.8672, test_loss: 1.0992, test_f1: 0.4589
 epoch: 90, train_loss: 0.8528, test_loss: 1.1112, test_f1: 0.4493
 epoch: 91, train_loss: 0.8562, test_loss: 1.1098, test_f1: 0.4546
 epoch: 92, train_loss: 0.8572, test_loss: 1.1211, test_f1: 0.4630
 epoch: 93, train_loss: 0.8550, test_loss: 1.1205, test_f1: 0.4466
 epoch: 94, train_loss: 0.8613, test_loss: 1.1327, test_f1: 0.4502
 epoch: 95, train_loss: 0.8590, test_loss: 1.1218, test_f1: 0.4522
 epoch: 96, train_loss: 0.8491, test_loss: 1.1193, test_f1: 0.4562
 epoch: 97, train_loss: 0.8570, test_loss: 1.1286, test_f1: 0.4470
 epoch: 98, train_loss: 0.8636, test_loss: 1.1252, test_f1: 0.4440
 epoch: 99, train_loss: 0.8549, test_loss: 1.1210, test_f1: 0.4476
##################ITERATION #8 ****************************************
 epoch: 0, train_loss: 1.3757, test_loss: 1.3500, test_f1: 0.2244
 epoch: 1, train_loss: 1.2989, test_loss: 1.3008, test_f1: 0.2274
 epoch: 2, train_loss: 1.2824, test_loss: 1.2715, test_f1: 0.2490
 epoch: 3, train_loss: 1.2670, test_loss: 1.2389, test_f1: 0.3462
 epoch: 4, train_loss: 1.2404, test_loss: 1.2105, test_f1: 0.3625
 epoch: 5, train_loss: 1.2329, test_loss: 1.1921, test_f1: 0.3985
 epoch: 6, train_loss: 1.2179, test_loss: 1.1792, test_f1: 0.4096
 epoch: 7, train_loss: 1.2063, test_loss: 1.1685, test_f1: 0.4139
 epoch: 8, train_loss: 1.2024, test_loss: 1.1578, test_f1: 0.4143
 epoch: 9, train_loss: 1.1918, test_loss: 1.1494, test_f1: 0.4083
 epoch: 10, train_loss: 1.1861, test_loss: 1.1441, test_f1: 0.4126
 epoch: 11, train_loss: 1.1864, test_loss: 1.1377, test_f1: 0.4058
 epoch: 12, train_loss: 1.1730, test_loss: 1.1300, test_f1: 0.4149
 epoch: 13, train_loss: 1.1693, test_loss: 1.1257, test_f1: 0.4089
 epoch: 14, train_loss: 1.1581, test_loss: 1.1211, test_f1: 0.4125
 epoch: 15, train_loss: 1.1513, test_loss: 1.1133, test_f1: 0.4227
 epoch: 16, train_loss: 1.1445, test_loss: 1.1107, test_f1: 0.4194
 epoch: 17, train_loss: 1.1454, test_loss: 1.1080, test_f1: 0.4149
 epoch: 18, train_loss: 1.1320, test_loss: 1.1026, test_f1: 0.4204
 epoch: 19, train_loss: 1.1275, test_loss: 1.0968, test_f1: 0.4185
 epoch: 20, train_loss: 1.1131, test_loss: 1.0958, test_f1: 0.4316
 epoch: 21, train_loss: 1.1124, test_loss: 1.0898, test_f1: 0.4326
 epoch: 22, train_loss: 1.1154, test_loss: 1.0867, test_f1: 0.4298
 epoch: 23, train_loss: 1.1155, test_loss: 1.0828, test_f1: 0.4396
 epoch: 24, train_loss: 1.1060, test_loss: 1.0753, test_f1: 0.4426
 epoch: 25, train_loss: 1.0970, test_loss: 1.0719, test_f1: 0.4392
 epoch: 26, train_loss: 1.0928, test_loss: 1.0677, test_f1: 0.4422
 epoch: 27, train_loss: 1.0905, test_loss: 1.0650, test_f1: 0.4396
 epoch: 28, train_loss: 1.0822, test_loss: 1.0588, test_f1: 0.4545
 epoch: 29, train_loss: 1.0738, test_loss: 1.0496, test_f1: 0.4581
 epoch: 30, train_loss: 1.0753, test_loss: 1.0454, test_f1: 0.4600
 epoch: 31, train_loss: 1.0645, test_loss: 1.0415, test_f1: 0.4611
 epoch: 32, train_loss: 1.0635, test_loss: 1.0366, test_f1: 0.4676
 epoch: 33, train_loss: 1.0538, test_loss: 1.0284, test_f1: 0.4639
 epoch: 34, train_loss: 1.0486, test_loss: 1.0232, test_f1: 0.4688
 epoch: 35, train_loss: 1.0442, test_loss: 1.0272, test_f1: 0.4681
 epoch: 36, train_loss: 1.0311, test_loss: 1.0231, test_f1: 0.4620
 epoch: 37, train_loss: 1.0374, test_loss: 1.0228, test_f1: 0.4736
 epoch: 38, train_loss: 1.0277, test_loss: 1.0234, test_f1: 0.4708
 epoch: 39, train_loss: 1.0186, test_loss: 1.0137, test_f1: 0.4695
 epoch: 40, train_loss: 1.0204, test_loss: 1.0058, test_f1: 0.4679
 epoch: 41, train_loss: 1.0069, test_loss: 1.0043, test_f1: 0.4779
 epoch: 42, train_loss: 1.0047, test_loss: 1.0094, test_f1: 0.4767
 epoch: 43, train_loss: 1.0058, test_loss: 1.0013, test_f1: 0.4661
 epoch: 44, train_loss: 1.0052, test_loss: 0.9993, test_f1: 0.4713
 epoch: 45, train_loss: 0.9948, test_loss: 0.9958, test_f1: 0.4754
 epoch: 46, train_loss: 0.9821, test_loss: 0.9977, test_f1: 0.4738
 epoch: 47, train_loss: 0.9940, test_loss: 0.9887, test_f1: 0.4740
 epoch: 48, train_loss: 0.9730, test_loss: 0.9850, test_f1: 0.4821
 epoch: 49, train_loss: 0.9735, test_loss: 0.9848, test_f1: 0.4817
 epoch: 50, train_loss: 0.9674, test_loss: 0.9916, test_f1: 0.4704
 epoch: 51, train_loss: 0.9608, test_loss: 0.9881, test_f1: 0.4783
 epoch: 52, train_loss: 0.9652, test_loss: 0.9845, test_f1: 0.4858
 epoch: 53, train_loss: 0.9638, test_loss: 0.9847, test_f1: 0.4900
 epoch: 54, train_loss: 0.9566, test_loss: 0.9838, test_f1: 0.4879
 epoch: 55, train_loss: 0.9500, test_loss: 0.9853, test_f1: 0.4850
 epoch: 56, train_loss: 0.9490, test_loss: 0.9868, test_f1: 0.4776
 epoch: 57, train_loss: 0.9412, test_loss: 0.9819, test_f1: 0.4798
 epoch: 58, train_loss: 0.9526, test_loss: 0.9837, test_f1: 0.4843
 epoch: 59, train_loss: 0.9503, test_loss: 0.9878, test_f1: 0.4705
 epoch: 60, train_loss: 0.9292, test_loss: 0.9889, test_f1: 0.4746
 epoch: 61, train_loss: 0.9300, test_loss: 0.9850, test_f1: 0.4793
 epoch: 62, train_loss: 0.9340, test_loss: 0.9893, test_f1: 0.4791
 epoch: 63, train_loss: 0.9270, test_loss: 0.9915, test_f1: 0.4746
 epoch: 64, train_loss: 0.9222, test_loss: 0.9875, test_f1: 0.4810
 epoch: 65, train_loss: 0.9243, test_loss: 0.9834, test_f1: 0.4769
 epoch: 66, train_loss: 0.9323, test_loss: 0.9834, test_f1: 0.4805
 epoch: 67, train_loss: 0.9210, test_loss: 0.9848, test_f1: 0.4847
 epoch: 68, train_loss: 0.9252, test_loss: 0.9889, test_f1: 0.4797
 epoch: 69, train_loss: 0.9202, test_loss: 0.9864, test_f1: 0.4828
 epoch: 70, train_loss: 0.9084, test_loss: 0.9811, test_f1: 0.4879
 epoch: 71, train_loss: 0.9088, test_loss: 0.9847, test_f1: 0.4770
 epoch: 72, train_loss: 0.9154, test_loss: 0.9893, test_f1: 0.4812
 epoch: 73, train_loss: 0.8981, test_loss: 0.9887, test_f1: 0.4712
 epoch: 74, train_loss: 0.9058, test_loss: 0.9838, test_f1: 0.4803
 epoch: 75, train_loss: 0.8930, test_loss: 0.9867, test_f1: 0.4922
 epoch: 76, train_loss: 0.9083, test_loss: 0.9889, test_f1: 0.4837
 epoch: 77, train_loss: 0.8924, test_loss: 0.9889, test_f1: 0.4852
 epoch: 78, train_loss: 0.9004, test_loss: 0.9921, test_f1: 0.4828
 epoch: 79, train_loss: 0.8969, test_loss: 0.9995, test_f1: 0.4730
 epoch: 80, train_loss: 0.8879, test_loss: 0.9997, test_f1: 0.4797
 epoch: 81, train_loss: 0.8813, test_loss: 0.9932, test_f1: 0.4786
 epoch: 82, train_loss: 0.8843, test_loss: 0.9968, test_f1: 0.4834
 epoch: 83, train_loss: 0.8895, test_loss: 0.9951, test_f1: 0.4841
 epoch: 84, train_loss: 0.8886, test_loss: 0.9941, test_f1: 0.4852
 epoch: 85, train_loss: 0.8921, test_loss: 0.9895, test_f1: 0.4784
 epoch: 86, train_loss: 0.8739, test_loss: 0.9985, test_f1: 0.4780
 epoch: 87, train_loss: 0.8757, test_loss: 0.9967, test_f1: 0.4778
 epoch: 88, train_loss: 0.8797, test_loss: 0.9989, test_f1: 0.4753
 epoch: 89, train_loss: 0.8718, test_loss: 0.9992, test_f1: 0.4695
 epoch: 90, train_loss: 0.8796, test_loss: 1.0047, test_f1: 0.4793
 epoch: 91, train_loss: 0.8645, test_loss: 1.0000, test_f1: 0.4710
 epoch: 92, train_loss: 0.8723, test_loss: 1.0036, test_f1: 0.4655
 epoch: 93, train_loss: 0.8653, test_loss: 1.0003, test_f1: 0.4671
 epoch: 94, train_loss: 0.8637, test_loss: 0.9980, test_f1: 0.4754
 epoch: 95, train_loss: 0.8639, test_loss: 1.0003, test_f1: 0.4675
 epoch: 96, train_loss: 0.8548, test_loss: 1.0057, test_f1: 0.4746
 epoch: 97, train_loss: 0.8614, test_loss: 1.0129, test_f1: 0.4732
 epoch: 98, train_loss: 0.8612, test_loss: 1.0062, test_f1: 0.4795
 epoch: 99, train_loss: 0.8485, test_loss: 1.0050, test_f1: 0.4761
##################ITERATION #9 ****************************************
 epoch: 0, train_loss: 1.3374, test_loss: 1.3145, test_f1: 0.2274
 epoch: 1, train_loss: 1.2813, test_loss: 1.2966, test_f1: 0.2274
 epoch: 2, train_loss: 1.2616, test_loss: 1.2696, test_f1: 0.2555
 epoch: 3, train_loss: 1.2426, test_loss: 1.2449, test_f1: 0.2971
 epoch: 4, train_loss: 1.2250, test_loss: 1.2227, test_f1: 0.3607
 epoch: 5, train_loss: 1.2211, test_loss: 1.2022, test_f1: 0.3779
 epoch: 6, train_loss: 1.2023, test_loss: 1.1854, test_f1: 0.3977
 epoch: 7, train_loss: 1.1953, test_loss: 1.1906, test_f1: 0.3897
 epoch: 8, train_loss: 1.1833, test_loss: 1.1819, test_f1: 0.4019
 epoch: 9, train_loss: 1.1738, test_loss: 1.1842, test_f1: 0.4087
 epoch: 10, train_loss: 1.1661, test_loss: 1.1861, test_f1: 0.4094
 epoch: 11, train_loss: 1.1573, test_loss: 1.1548, test_f1: 0.4123
 epoch: 12, train_loss: 1.1512, test_loss: 1.1515, test_f1: 0.4208
 epoch: 13, train_loss: 1.1429, test_loss: 1.1434, test_f1: 0.4198
 epoch: 14, train_loss: 1.1357, test_loss: 1.1190, test_f1: 0.4345
 epoch: 15, train_loss: 1.1287, test_loss: 1.1084, test_f1: 0.4335
 epoch: 16, train_loss: 1.1261, test_loss: 1.1054, test_f1: 0.4440
 epoch: 17, train_loss: 1.1137, test_loss: 1.1023, test_f1: 0.4491
 epoch: 18, train_loss: 1.1168, test_loss: 1.0980, test_f1: 0.4393
 epoch: 19, train_loss: 1.0965, test_loss: 1.0878, test_f1: 0.4569
 epoch: 20, train_loss: 1.0962, test_loss: 1.0892, test_f1: 0.4567
 epoch: 21, train_loss: 1.0849, test_loss: 1.0975, test_f1: 0.4434
 epoch: 22, train_loss: 1.0808, test_loss: 1.0795, test_f1: 0.4517
 epoch: 23, train_loss: 1.0745, test_loss: 1.0727, test_f1: 0.4653
 epoch: 24, train_loss: 1.0657, test_loss: 1.0731, test_f1: 0.4717
 epoch: 25, train_loss: 1.0572, test_loss: 1.0627, test_f1: 0.4632
 epoch: 26, train_loss: 1.0442, test_loss: 1.0607, test_f1: 0.4688
 epoch: 27, train_loss: 1.0488, test_loss: 1.0936, test_f1: 0.4385
 epoch: 28, train_loss: 1.0415, test_loss: 1.0847, test_f1: 0.4434
 epoch: 29, train_loss: 1.0262, test_loss: 1.0577, test_f1: 0.4603
 epoch: 30, train_loss: 1.0303, test_loss: 1.0481, test_f1: 0.4545
 epoch: 31, train_loss: 1.0282, test_loss: 1.0480, test_f1: 0.4597
 epoch: 32, train_loss: 1.0291, test_loss: 1.0446, test_f1: 0.4748
 epoch: 33, train_loss: 1.0151, test_loss: 1.0419, test_f1: 0.4613
 epoch: 34, train_loss: 1.0164, test_loss: 1.0377, test_f1: 0.4684
 epoch: 35, train_loss: 1.0010, test_loss: 1.0333, test_f1: 0.4791
 epoch: 36, train_loss: 0.9971, test_loss: 1.0401, test_f1: 0.4682
 epoch: 37, train_loss: 0.9901, test_loss: 1.0429, test_f1: 0.4652
 epoch: 38, train_loss: 0.9798, test_loss: 1.0358, test_f1: 0.4589
 epoch: 39, train_loss: 0.9767, test_loss: 1.0432, test_f1: 0.4757
 epoch: 40, train_loss: 0.9813, test_loss: 1.0467, test_f1: 0.4647
 epoch: 41, train_loss: 0.9719, test_loss: 1.0386, test_f1: 0.4697
 epoch: 42, train_loss: 0.9633, test_loss: 1.0328, test_f1: 0.4553
 epoch: 43, train_loss: 0.9582, test_loss: 1.0512, test_f1: 0.4557
 epoch: 44, train_loss: 0.9564, test_loss: 1.0533, test_f1: 0.4475
 epoch: 45, train_loss: 0.9563, test_loss: 1.0356, test_f1: 0.4676
 epoch: 46, train_loss: 0.9548, test_loss: 1.0359, test_f1: 0.4653
 epoch: 47, train_loss: 0.9426, test_loss: 1.0390, test_f1: 0.4669
 epoch: 48, train_loss: 0.9358, test_loss: 1.0442, test_f1: 0.4591
 epoch: 49, train_loss: 0.9447, test_loss: 1.0399, test_f1: 0.4570
 epoch: 50, train_loss: 0.9497, test_loss: 1.0658, test_f1: 0.4487
 epoch: 51, train_loss: 0.9238, test_loss: 1.0696, test_f1: 0.4461
 epoch: 52, train_loss: 0.9210, test_loss: 1.0607, test_f1: 0.4548
 epoch: 53, train_loss: 0.9133, test_loss: 1.0829, test_f1: 0.4473
 epoch: 54, train_loss: 0.9160, test_loss: 1.0633, test_f1: 0.4531
 epoch: 55, train_loss: 0.9206, test_loss: 1.0736, test_f1: 0.4466
 epoch: 56, train_loss: 0.9125, test_loss: 1.0701, test_f1: 0.4492
 epoch: 57, train_loss: 0.9067, test_loss: 1.0805, test_f1: 0.4457
 epoch: 58, train_loss: 0.9060, test_loss: 1.0757, test_f1: 0.4436
 epoch: 59, train_loss: 0.9117, test_loss: 1.0670, test_f1: 0.4506
 epoch: 60, train_loss: 0.8995, test_loss: 1.0738, test_f1: 0.4469
 epoch: 61, train_loss: 0.8996, test_loss: 1.0673, test_f1: 0.4370
 epoch: 62, train_loss: 0.9037, test_loss: 1.0841, test_f1: 0.4367
 epoch: 63, train_loss: 0.8996, test_loss: 1.0781, test_f1: 0.4401
 epoch: 64, train_loss: 0.8857, test_loss: 1.0666, test_f1: 0.4433
 epoch: 65, train_loss: 0.8894, test_loss: 1.0632, test_f1: 0.4458
 epoch: 66, train_loss: 0.8781, test_loss: 1.0796, test_f1: 0.4520
 epoch: 67, train_loss: 0.8930, test_loss: 1.0734, test_f1: 0.4510
 epoch: 68, train_loss: 0.8755, test_loss: 1.0637, test_f1: 0.4510
 epoch: 69, train_loss: 0.9002, test_loss: 1.0626, test_f1: 0.4503
 epoch: 70, train_loss: 0.8814, test_loss: 1.0898, test_f1: 0.4533
 epoch: 71, train_loss: 0.8836, test_loss: 1.0734, test_f1: 0.4367
 epoch: 72, train_loss: 0.8884, test_loss: 1.0790, test_f1: 0.4509
 epoch: 73, train_loss: 0.8643, test_loss: 1.0688, test_f1: 0.4551
 epoch: 74, train_loss: 0.8762, test_loss: 1.0710, test_f1: 0.4548
 epoch: 75, train_loss: 0.8666, test_loss: 1.0917, test_f1: 0.4449
 epoch: 76, train_loss: 0.8700, test_loss: 1.0904, test_f1: 0.4388
 epoch: 77, train_loss: 0.8635, test_loss: 1.0755, test_f1: 0.4508
 epoch: 78, train_loss: 0.8681, test_loss: 1.1010, test_f1: 0.4392
 epoch: 79, train_loss: 0.8672, test_loss: 1.0947, test_f1: 0.4430
 epoch: 80, train_loss: 0.8673, test_loss: 1.0984, test_f1: 0.4486
 epoch: 81, train_loss: 0.8806, test_loss: 1.1043, test_f1: 0.4428
 epoch: 82, train_loss: 0.8511, test_loss: 1.1045, test_f1: 0.4478
 epoch: 83, train_loss: 0.8429, test_loss: 1.1092, test_f1: 0.4443
 epoch: 84, train_loss: 0.8505, test_loss: 1.1015, test_f1: 0.4519
 epoch: 85, train_loss: 0.8461, test_loss: 1.1052, test_f1: 0.4258
 epoch: 86, train_loss: 0.8537, test_loss: 1.1145, test_f1: 0.4318
 epoch: 87, train_loss: 0.8488, test_loss: 1.1422, test_f1: 0.4354
 epoch: 88, train_loss: 0.8494, test_loss: 1.1224, test_f1: 0.4301
 epoch: 89, train_loss: 0.8522, test_loss: 1.1348, test_f1: 0.4316
 epoch: 90, train_loss: 0.8494, test_loss: 1.1363, test_f1: 0.4331
 epoch: 91, train_loss: 0.8259, test_loss: 1.1207, test_f1: 0.4508
 epoch: 92, train_loss: 0.8402, test_loss: 1.1182, test_f1: 0.4284
 epoch: 93, train_loss: 0.8315, test_loss: 1.1245, test_f1: 0.4310
 epoch: 94, train_loss: 0.8400, test_loss: 1.1169, test_f1: 0.4369
 epoch: 95, train_loss: 0.8555, test_loss: 1.1414, test_f1: 0.4295
 epoch: 96, train_loss: 0.8240, test_loss: 1.1281, test_f1: 0.4386
 epoch: 97, train_loss: 0.8354, test_loss: 1.1346, test_f1: 0.4406
 epoch: 98, train_loss: 0.8265, test_loss: 1.1612, test_f1: 0.4282
 epoch: 99, train_loss: 0.8392, test_loss: 1.1239, test_f1: 0.4368

Training completed in 440.44 seconds
Best F1: 0.4947 at epoch 38
Mean F1 across iterations: 0.4821  0.0072
========================FINAL RESULTS================================
FEGIN weighted F1: 0.4947  0.0072
python main.py --data ltspice_examples --representation component_component --model FEGIN --layers 6 --hiddens 64 --batch_size 256 --lr 0.0001 --emb_size 250 --epochs 100 --save_appendix component_component_L6_H64_BS256_LR0.0001_E250 --no_val
-----



STDERR:
  File "main.py", line 370, in <module>
    main()
  File "main.py", line 254, in main
    dataset = dataset_class(
  File "/home/philip/projects/ltspice_examples_code_repo/Circuit-Completion-Using-GNNs/component_classification_with_link_prediction_head/evaluation/FEGIN/kernel/circuit_datasets.py", line 15, in __init__
    self.data, self.slices = torch.load(self.processed_paths[0])
  File "/home/philip/.local/lib/python3.8/site-packages/torch/serialization.py", line 1040, in load
    warnings.warn(
  File "/usr/lib/python3.8/warnings.py", line 109, in _showwarnmsg
    sw(msg.message, msg.category, msg.filename, msg.lineno,
  File "main.py", line 47, in warn_with_traceback
    traceback.print_stack(file=log)
/home/philip/projects/ltspice_examples_code_repo/Circuit-Completion-Using-GNNs/component_classification_with_link_prediction_head/evaluation/FEGIN/kernel/circuit_datasets.py:15: FutureWarning: You are using `torch.load` with `weights_only=False` (the current default value), which uses the default pickle module implicitly. It is possible to construct malicious pickle data which will execute arbitrary code during unpickling (See https://github.com/pytorch/pytorch/blob/main/SECURITY.md#untrusted-models for more details). In a future release, the default value for `weights_only` will be flipped to `True`. This limits the functions that could be executed during unpickling. Arbitrary objects will no longer be allowed to be loaded via this mode unless they are explicitly allowlisted by the user via `torch.serialization.add_safe_globals`. We recommend you start setting `weights_only=True` for any use case where you don't have full control of the loaded file. Please open an issue on GitHub for any issues related to this experimental feature.
  self.data, self.slices = torch.load(self.processed_paths[0])
