STDOUT:
Results will be saved in /home/philip/projects/ltspice_examples_code_repo/Circuit-Completion-Using-GNNs/component_classification_with_link_prediction_head/evaluation/FEGIN/results/model_FEGIN_dataset_ltspice_demos
Command line input: python main.py --data ltspice_demos --representation component_pin_net --model FEGIN --layers 6 --hiddens 128 --batch_size 32 --lr 0.001 --emb_size 128 --epochs 100 --save_appendix component_pin_net_L6_H128_BS32_LR0.001_E128 --no_val
 is saved.
-----
ltspice_demos - FEGIN
Using 6 layers, 128 hidden units, h = 2
Loading component_pin_net representation dataset
ENTERED
Training FEGIN on component_pin_net representation
Train: 1565, Test: 383
##################ITERATION #0 ****************************************
 epoch: 0, train_loss: 1.1860, test_loss: 1.1277, test_f1: 0.4290
 epoch: 1, train_loss: 1.0174, test_loss: 1.0595, test_f1: 0.3942
 epoch: 2, train_loss: 0.9716, test_loss: 1.0225, test_f1: 0.4741
 epoch: 3, train_loss: 0.9305, test_loss: 1.0248, test_f1: 0.5060
 epoch: 4, train_loss: 0.9253, test_loss: 1.0345, test_f1: 0.5664
 epoch: 5, train_loss: 0.8917, test_loss: 0.9979, test_f1: 0.5418
 epoch: 6, train_loss: 0.8719, test_loss: 0.9815, test_f1: 0.5716
 epoch: 7, train_loss: 0.8132, test_loss: 1.0781, test_f1: 0.5500
 epoch: 8, train_loss: 0.7855, test_loss: 1.2391, test_f1: 0.5342
 epoch: 9, train_loss: 0.7846, test_loss: 0.9762, test_f1: 0.6058
 epoch: 10, train_loss: 0.7603, test_loss: 1.2706, test_f1: 0.5379
 epoch: 11, train_loss: 0.6985, test_loss: 1.0606, test_f1: 0.5174
 epoch: 12, train_loss: 0.7111, test_loss: 1.0816, test_f1: 0.5308
 epoch: 13, train_loss: 0.7162, test_loss: 1.1715, test_f1: 0.5163
 epoch: 14, train_loss: 0.6748, test_loss: 1.0072, test_f1: 0.5756
 epoch: 15, train_loss: 0.6687, test_loss: 0.9669, test_f1: 0.6345
 epoch: 16, train_loss: 0.6376, test_loss: 1.1516, test_f1: 0.5609
 epoch: 17, train_loss: 0.6195, test_loss: 1.0651, test_f1: 0.6416
 epoch: 18, train_loss: 0.6170, test_loss: 1.0728, test_f1: 0.5782
 epoch: 19, train_loss: 0.6103, test_loss: 1.0638, test_f1: 0.6348
 epoch: 20, train_loss: 0.6146, test_loss: 1.1531, test_f1: 0.5969
 epoch: 21, train_loss: 0.5903, test_loss: 1.1337, test_f1: 0.6353
 epoch: 22, train_loss: 0.5685, test_loss: 1.1638, test_f1: 0.6122
 epoch: 23, train_loss: 0.5654, test_loss: 1.3209, test_f1: 0.5581
 epoch: 24, train_loss: 0.5134, test_loss: 1.1838, test_f1: 0.5941
 epoch: 25, train_loss: 0.5434, test_loss: 1.3551, test_f1: 0.6022
 epoch: 26, train_loss: 0.5271, test_loss: 1.2873, test_f1: 0.6086
 epoch: 27, train_loss: 0.5002, test_loss: 1.3395, test_f1: 0.6192
 epoch: 28, train_loss: 0.5326, test_loss: 1.0066, test_f1: 0.6013
 epoch: 29, train_loss: 0.5681, test_loss: 1.2467, test_f1: 0.5856
 epoch: 30, train_loss: 0.5329, test_loss: 1.1917, test_f1: 0.6405
 epoch: 31, train_loss: 0.4872, test_loss: 1.2569, test_f1: 0.5971
 epoch: 32, train_loss: 0.4846, test_loss: 1.1282, test_f1: 0.6299
 epoch: 33, train_loss: 0.4258, test_loss: 1.4146, test_f1: 0.6376
 epoch: 34, train_loss: 0.4589, test_loss: 1.1873, test_f1: 0.6589
 epoch: 35, train_loss: 0.4497, test_loss: 1.3788, test_f1: 0.6109
 epoch: 36, train_loss: 0.4380, test_loss: 1.2681, test_f1: 0.6224
 epoch: 37, train_loss: 0.4678, test_loss: 1.4024, test_f1: 0.6034
 epoch: 38, train_loss: 0.4490, test_loss: 1.3017, test_f1: 0.6494
 epoch: 39, train_loss: 0.4118, test_loss: 1.4864, test_f1: 0.6230
 epoch: 40, train_loss: 0.4246, test_loss: 1.3925, test_f1: 0.6245
 epoch: 41, train_loss: 0.3810, test_loss: 1.5777, test_f1: 0.6231
 epoch: 42, train_loss: 0.3926, test_loss: 1.5227, test_f1: 0.6593
 epoch: 43, train_loss: 0.3855, test_loss: 1.6022, test_f1: 0.6231
 epoch: 44, train_loss: 0.3797, test_loss: 1.5092, test_f1: 0.6493
 epoch: 45, train_loss: 0.3735, test_loss: 1.5904, test_f1: 0.6435
 epoch: 46, train_loss: 0.3726, test_loss: 1.5846, test_f1: 0.6602
 epoch: 47, train_loss: 0.4053, test_loss: 1.6046, test_f1: 0.6414
 epoch: 48, train_loss: 0.3507, test_loss: 1.5794, test_f1: 0.6580
 epoch: 49, train_loss: 0.3621, test_loss: 1.8263, test_f1: 0.6404
 epoch: 50, train_loss: 0.3291, test_loss: 1.7976, test_f1: 0.6350
 epoch: 51, train_loss: 0.2709, test_loss: 1.7902, test_f1: 0.6345
 epoch: 52, train_loss: 0.2599, test_loss: 1.9769, test_f1: 0.6878
 epoch: 53, train_loss: 0.2586, test_loss: 1.9292, test_f1: 0.6730
 epoch: 54, train_loss: 0.2769, test_loss: 1.8379, test_f1: 0.6776
 epoch: 55, train_loss: 0.2470, test_loss: 1.9845, test_f1: 0.6594
 epoch: 56, train_loss: 0.2345, test_loss: 2.1851, test_f1: 0.6554
 epoch: 57, train_loss: 0.2254, test_loss: 2.2178, test_f1: 0.6493
 epoch: 58, train_loss: 0.2351, test_loss: 2.0320, test_f1: 0.6526
 epoch: 59, train_loss: 0.2098, test_loss: 2.2439, test_f1: 0.6663
 epoch: 60, train_loss: 0.2121, test_loss: 2.1961, test_f1: 0.6642
 epoch: 61, train_loss: 0.2078, test_loss: 2.4265, test_f1: 0.6418
 epoch: 62, train_loss: 0.2073, test_loss: 2.1873, test_f1: 0.6472
 epoch: 63, train_loss: 0.2068, test_loss: 2.2767, test_f1: 0.6543
 epoch: 64, train_loss: 0.2038, test_loss: 2.2957, test_f1: 0.6450
 epoch: 65, train_loss: 0.2240, test_loss: 2.3346, test_f1: 0.6581
 epoch: 66, train_loss: 0.2170, test_loss: 2.3430, test_f1: 0.6634
 epoch: 67, train_loss: 0.1968, test_loss: 2.4999, test_f1: 0.6383
 epoch: 68, train_loss: 0.1940, test_loss: 2.2819, test_f1: 0.6838
 epoch: 69, train_loss: 0.1873, test_loss: 2.4336, test_f1: 0.6499
 epoch: 70, train_loss: 0.1893, test_loss: 2.5909, test_f1: 0.6483
 epoch: 71, train_loss: 0.1913, test_loss: 2.5995, test_f1: 0.6542
 epoch: 72, train_loss: 0.1667, test_loss: 2.6200, test_f1: 0.6529
 epoch: 73, train_loss: 0.1774, test_loss: 2.7556, test_f1: 0.6480
 epoch: 74, train_loss: 0.1473, test_loss: 2.6853, test_f1: 0.6405
 epoch: 75, train_loss: 0.1787, test_loss: 2.8126, test_f1: 0.6430
 epoch: 76, train_loss: 0.1932, test_loss: 2.5239, test_f1: 0.6566
 epoch: 77, train_loss: 0.1539, test_loss: 2.7415, test_f1: 0.6339
 epoch: 78, train_loss: 0.1684, test_loss: 2.6399, test_f1: 0.6445
 epoch: 79, train_loss: 0.1580, test_loss: 3.0065, test_f1: 0.6244
 epoch: 80, train_loss: 0.1557, test_loss: 2.6455, test_f1: 0.6752
 epoch: 81, train_loss: 0.1913, test_loss: 2.7521, test_f1: 0.6400
 epoch: 82, train_loss: 0.1807, test_loss: 2.6551, test_f1: 0.6469
 epoch: 83, train_loss: 0.1333, test_loss: 2.9029, test_f1: 0.6305
 epoch: 84, train_loss: 0.1382, test_loss: 2.6976, test_f1: 0.6447
 epoch: 85, train_loss: 0.1677, test_loss: 2.6888, test_f1: 0.6575
 epoch: 86, train_loss: 0.1379, test_loss: 2.7938, test_f1: 0.6593
 epoch: 87, train_loss: 0.1298, test_loss: 2.9327, test_f1: 0.6486
 epoch: 88, train_loss: 0.1239, test_loss: 2.9103, test_f1: 0.6543
 epoch: 89, train_loss: 0.1395, test_loss: 2.9804, test_f1: 0.6215
 epoch: 90, train_loss: 0.1434, test_loss: 2.9487, test_f1: 0.6263
 epoch: 91, train_loss: 0.1589, test_loss: 3.0889, test_f1: 0.6118
 epoch: 92, train_loss: 0.1591, test_loss: 2.9286, test_f1: 0.6247
 epoch: 93, train_loss: 0.1518, test_loss: 2.5996, test_f1: 0.6587
 epoch: 94, train_loss: 0.1022, test_loss: 3.0514, test_f1: 0.6479
 epoch: 95, train_loss: 0.1066, test_loss: 3.0436, test_f1: 0.6427
 epoch: 96, train_loss: 0.1333, test_loss: 2.8272, test_f1: 0.6774
 epoch: 97, train_loss: 0.1179, test_loss: 2.9722, test_f1: 0.6600
 epoch: 98, train_loss: 0.0990, test_loss: 3.0577, test_f1: 0.6302
 epoch: 99, train_loss: 0.1233, test_loss: 3.2461, test_f1: 0.6414
##################ITERATION #1 ****************************************
 epoch: 0, train_loss: 1.0901, test_loss: 1.2147, test_f1: 0.2782
 epoch: 1, train_loss: 0.9652, test_loss: 1.0428, test_f1: 0.5374
 epoch: 2, train_loss: 0.8971, test_loss: 1.0040, test_f1: 0.5672
 epoch: 3, train_loss: 0.8621, test_loss: 0.9922, test_f1: 0.5637
 epoch: 4, train_loss: 0.8355, test_loss: 1.0306, test_f1: 0.5286
 epoch: 5, train_loss: 0.8228, test_loss: 0.9648, test_f1: 0.6137
 epoch: 6, train_loss: 0.7460, test_loss: 1.2159, test_f1: 0.5386
 epoch: 7, train_loss: 0.7463, test_loss: 1.1044, test_f1: 0.4864
 epoch: 8, train_loss: 0.7484, test_loss: 1.0179, test_f1: 0.5699
 epoch: 9, train_loss: 0.6969, test_loss: 1.1202, test_f1: 0.5757
 epoch: 10, train_loss: 0.6944, test_loss: 1.1919, test_f1: 0.5251
 epoch: 11, train_loss: 0.6662, test_loss: 1.0446, test_f1: 0.6321
 epoch: 12, train_loss: 0.6512, test_loss: 0.9319, test_f1: 0.6489
 epoch: 13, train_loss: 0.6354, test_loss: 1.0947, test_f1: 0.6226
 epoch: 14, train_loss: 0.6208, test_loss: 1.0762, test_f1: 0.6344
 epoch: 15, train_loss: 0.6306, test_loss: 1.1325, test_f1: 0.5315
 epoch: 16, train_loss: 0.5974, test_loss: 1.0666, test_f1: 0.6080
 epoch: 17, train_loss: 0.5712, test_loss: 1.0975, test_f1: 0.6241
 epoch: 18, train_loss: 0.5882, test_loss: 1.1878, test_f1: 0.5756
 epoch: 19, train_loss: 0.5388, test_loss: 1.0974, test_f1: 0.5934
 epoch: 20, train_loss: 0.5652, test_loss: 1.0924, test_f1: 0.6354
 epoch: 21, train_loss: 0.5265, test_loss: 1.2066, test_f1: 0.6243
 epoch: 22, train_loss: 0.5334, test_loss: 1.1110, test_f1: 0.5960
 epoch: 23, train_loss: 0.5171, test_loss: 1.1582, test_f1: 0.6193
 epoch: 24, train_loss: 0.4970, test_loss: 1.2483, test_f1: 0.6057
 epoch: 25, train_loss: 0.4967, test_loss: 1.3310, test_f1: 0.5712
 epoch: 26, train_loss: 0.4539, test_loss: 1.3916, test_f1: 0.6341
 epoch: 27, train_loss: 0.4580, test_loss: 1.2088, test_f1: 0.6007
 epoch: 28, train_loss: 0.4820, test_loss: 1.3384, test_f1: 0.6018
 epoch: 29, train_loss: 0.4538, test_loss: 1.4981, test_f1: 0.5753
 epoch: 30, train_loss: 0.4453, test_loss: 1.3180, test_f1: 0.6186
 epoch: 31, train_loss: 0.4456, test_loss: 1.5244, test_f1: 0.5544
 epoch: 32, train_loss: 0.4066, test_loss: 1.6480, test_f1: 0.5431
 epoch: 33, train_loss: 0.3896, test_loss: 1.5959, test_f1: 0.6508
 epoch: 34, train_loss: 0.4285, test_loss: 1.5852, test_f1: 0.5715
 epoch: 35, train_loss: 0.4131, test_loss: 1.5465, test_f1: 0.5695
 epoch: 36, train_loss: 0.3854, test_loss: 1.4326, test_f1: 0.6525
 epoch: 37, train_loss: 0.3998, test_loss: 1.7258, test_f1: 0.5579
 epoch: 38, train_loss: 0.4164, test_loss: 1.3076, test_f1: 0.6383
 epoch: 39, train_loss: 0.3634, test_loss: 1.4957, test_f1: 0.5998
 epoch: 40, train_loss: 0.3260, test_loss: 1.6681, test_f1: 0.5988
 epoch: 41, train_loss: 0.3545, test_loss: 1.6947, test_f1: 0.6253
 epoch: 42, train_loss: 0.3668, test_loss: 1.6401, test_f1: 0.6015
 epoch: 43, train_loss: 0.3384, test_loss: 1.6524, test_f1: 0.6000
 epoch: 44, train_loss: 0.3288, test_loss: 1.6972, test_f1: 0.5961
 epoch: 45, train_loss: 0.3248, test_loss: 1.8229, test_f1: 0.6164
 epoch: 46, train_loss: 0.3479, test_loss: 1.6521, test_f1: 0.5964
 epoch: 47, train_loss: 0.3378, test_loss: 1.6564, test_f1: 0.6326
 epoch: 48, train_loss: 0.3134, test_loss: 1.7837, test_f1: 0.6428
 epoch: 49, train_loss: 0.2965, test_loss: 2.0158, test_f1: 0.6246
 epoch: 50, train_loss: 0.3032, test_loss: 1.9984, test_f1: 0.5548
 epoch: 51, train_loss: 0.2250, test_loss: 1.9041, test_f1: 0.6094
 epoch: 52, train_loss: 0.2372, test_loss: 1.9039, test_f1: 0.6391
 epoch: 53, train_loss: 0.2147, test_loss: 2.0267, test_f1: 0.6148
 epoch: 54, train_loss: 0.1933, test_loss: 2.0539, test_f1: 0.6294
 epoch: 55, train_loss: 0.1963, test_loss: 2.2154, test_f1: 0.6348
 epoch: 56, train_loss: 0.1996, test_loss: 2.2079, test_f1: 0.6230
 epoch: 57, train_loss: 0.1885, test_loss: 2.3459, test_f1: 0.5983
 epoch: 58, train_loss: 0.2003, test_loss: 2.3024, test_f1: 0.6064
 epoch: 59, train_loss: 0.1874, test_loss: 2.3387, test_f1: 0.5571
 epoch: 60, train_loss: 0.1803, test_loss: 2.2308, test_f1: 0.6176
 epoch: 61, train_loss: 0.1784, test_loss: 2.4894, test_f1: 0.6022
 epoch: 62, train_loss: 0.1881, test_loss: 2.5403, test_f1: 0.5840
 epoch: 63, train_loss: 0.1747, test_loss: 2.2541, test_f1: 0.6145
 epoch: 64, train_loss: 0.1375, test_loss: 2.4032, test_f1: 0.6214
 epoch: 65, train_loss: 0.1528, test_loss: 2.6291, test_f1: 0.5998
 epoch: 66, train_loss: 0.2066, test_loss: 2.4856, test_f1: 0.6060
 epoch: 67, train_loss: 0.1895, test_loss: 2.4535, test_f1: 0.5884
 epoch: 68, train_loss: 0.1658, test_loss: 2.4268, test_f1: 0.5788
 epoch: 69, train_loss: 0.1521, test_loss: 2.4917, test_f1: 0.6280
 epoch: 70, train_loss: 0.1404, test_loss: 2.6654, test_f1: 0.5818
 epoch: 71, train_loss: 0.1432, test_loss: 2.6196, test_f1: 0.5993
 epoch: 72, train_loss: 0.1556, test_loss: 2.7782, test_f1: 0.6080
 epoch: 73, train_loss: 0.1413, test_loss: 2.8439, test_f1: 0.5549
 epoch: 74, train_loss: 0.1395, test_loss: 2.8108, test_f1: 0.5850
 epoch: 75, train_loss: 0.1277, test_loss: 2.7651, test_f1: 0.6192
 epoch: 76, train_loss: 0.1465, test_loss: 2.8049, test_f1: 0.5858
 epoch: 77, train_loss: 0.1368, test_loss: 2.8376, test_f1: 0.6249
 epoch: 78, train_loss: 0.1511, test_loss: 2.8264, test_f1: 0.5701
 epoch: 79, train_loss: 0.1491, test_loss: 2.6492, test_f1: 0.6058
 epoch: 80, train_loss: 0.1361, test_loss: 2.6410, test_f1: 0.6071
 epoch: 81, train_loss: 0.1398, test_loss: 2.7241, test_f1: 0.6100
 epoch: 82, train_loss: 0.1188, test_loss: 2.7008, test_f1: 0.6140
 epoch: 83, train_loss: 0.1632, test_loss: 2.7310, test_f1: 0.6142
 epoch: 84, train_loss: 0.1196, test_loss: 2.8538, test_f1: 0.6150
 epoch: 85, train_loss: 0.1309, test_loss: 3.3080, test_f1: 0.5437
 epoch: 86, train_loss: 0.1353, test_loss: 3.1504, test_f1: 0.5944
 epoch: 87, train_loss: 0.1085, test_loss: 3.0938, test_f1: 0.5944
 epoch: 88, train_loss: 0.1211, test_loss: 3.1150, test_f1: 0.6228
 epoch: 89, train_loss: 0.1378, test_loss: 3.0874, test_f1: 0.5912
 epoch: 90, train_loss: 0.1029, test_loss: 3.2359, test_f1: 0.5941
 epoch: 91, train_loss: 0.1241, test_loss: 3.1840, test_f1: 0.5872
 epoch: 92, train_loss: 0.1288, test_loss: 3.3093, test_f1: 0.5966
 epoch: 93, train_loss: 0.1194, test_loss: 3.2008, test_f1: 0.5862
 epoch: 94, train_loss: 0.1190, test_loss: 3.4834, test_f1: 0.5887
 epoch: 95, train_loss: 0.1365, test_loss: 3.0108, test_f1: 0.5640
 epoch: 96, train_loss: 0.1333, test_loss: 2.8811, test_f1: 0.6327
 epoch: 97, train_loss: 0.1411, test_loss: 3.0477, test_f1: 0.6113
 epoch: 98, train_loss: 0.1577, test_loss: 2.7808, test_f1: 0.6146
 epoch: 99, train_loss: 0.1026, test_loss: 2.9914, test_f1: 0.6203
##################ITERATION #2 ****************************************
 epoch: 0, train_loss: 1.1386, test_loss: 1.2430, test_f1: 0.3257
 epoch: 1, train_loss: 0.9818, test_loss: 1.0203, test_f1: 0.5387
 epoch: 2, train_loss: 0.9074, test_loss: 1.0372, test_f1: 0.5259
 epoch: 3, train_loss: 0.8755, test_loss: 1.0297, test_f1: 0.5020
 epoch: 4, train_loss: 0.8632, test_loss: 1.1909, test_f1: 0.4794
 epoch: 5, train_loss: 0.8494, test_loss: 1.0516, test_f1: 0.5479
 epoch: 6, train_loss: 0.8143, test_loss: 1.0123, test_f1: 0.5812
 epoch: 7, train_loss: 0.7752, test_loss: 1.1550, test_f1: 0.4992
 epoch: 8, train_loss: 0.7582, test_loss: 1.0226, test_f1: 0.5657
 epoch: 9, train_loss: 0.7420, test_loss: 1.0692, test_f1: 0.5555
 epoch: 10, train_loss: 0.7266, test_loss: 0.9868, test_f1: 0.6159
 epoch: 11, train_loss: 0.6751, test_loss: 1.1076, test_f1: 0.5968
 epoch: 12, train_loss: 0.7069, test_loss: 1.0016, test_f1: 0.6159
 epoch: 13, train_loss: 0.6892, test_loss: 1.2069, test_f1: 0.5441
 epoch: 14, train_loss: 0.6385, test_loss: 1.1484, test_f1: 0.5878
 epoch: 15, train_loss: 0.6138, test_loss: 1.1332, test_f1: 0.5868
 epoch: 16, train_loss: 0.5963, test_loss: 1.1953, test_f1: 0.5881
 epoch: 17, train_loss: 0.5846, test_loss: 1.2249, test_f1: 0.6176
 epoch: 18, train_loss: 0.5967, test_loss: 1.1475, test_f1: 0.6370
 epoch: 19, train_loss: 0.5718, test_loss: 1.2310, test_f1: 0.6087
 epoch: 20, train_loss: 0.5558, test_loss: 1.1690, test_f1: 0.6075
 epoch: 21, train_loss: 0.5373, test_loss: 1.3073, test_f1: 0.5990
 epoch: 22, train_loss: 0.5653, test_loss: 1.0981, test_f1: 0.5859
 epoch: 23, train_loss: 0.5453, test_loss: 1.2402, test_f1: 0.6622
 epoch: 24, train_loss: 0.5092, test_loss: 1.1333, test_f1: 0.6289
 epoch: 25, train_loss: 0.4922, test_loss: 1.3107, test_f1: 0.6045
 epoch: 26, train_loss: 0.4837, test_loss: 1.3922, test_f1: 0.5907
 epoch: 27, train_loss: 0.4674, test_loss: 1.4038, test_f1: 0.6141
 epoch: 28, train_loss: 0.4506, test_loss: 1.3381, test_f1: 0.6116
 epoch: 29, train_loss: 0.4588, test_loss: 1.2966, test_f1: 0.5865
 epoch: 30, train_loss: 0.4447, test_loss: 1.4420, test_f1: 0.6085
 epoch: 31, train_loss: 0.4133, test_loss: 1.4199, test_f1: 0.6298
 epoch: 32, train_loss: 0.4188, test_loss: 1.5333, test_f1: 0.5932
 epoch: 33, train_loss: 0.3945, test_loss: 1.6216, test_f1: 0.5847
 epoch: 34, train_loss: 0.4237, test_loss: 1.5426, test_f1: 0.6301
 epoch: 35, train_loss: 0.4114, test_loss: 1.5030, test_f1: 0.6318
 epoch: 36, train_loss: 0.3797, test_loss: 1.7469, test_f1: 0.5956
 epoch: 37, train_loss: 0.3712, test_loss: 1.7511, test_f1: 0.5595
 epoch: 38, train_loss: 0.3823, test_loss: 1.5214, test_f1: 0.6274
 epoch: 39, train_loss: 0.3359, test_loss: 1.5922, test_f1: 0.6650
 epoch: 40, train_loss: 0.3846, test_loss: 1.6811, test_f1: 0.6133
 epoch: 41, train_loss: 0.3663, test_loss: 1.7675, test_f1: 0.6137
 epoch: 42, train_loss: 0.3498, test_loss: 1.7976, test_f1: 0.5905
 epoch: 43, train_loss: 0.3386, test_loss: 1.6950, test_f1: 0.6224
 epoch: 44, train_loss: 0.2947, test_loss: 1.9070, test_f1: 0.5874
 epoch: 45, train_loss: 0.3560, test_loss: 2.0073, test_f1: 0.5773
 epoch: 46, train_loss: 0.3385, test_loss: 2.0626, test_f1: 0.5512
 epoch: 47, train_loss: 0.2957, test_loss: 1.8086, test_f1: 0.6100
 epoch: 48, train_loss: 0.3351, test_loss: 2.1426, test_f1: 0.5617
 epoch: 49, train_loss: 0.3063, test_loss: 1.8748, test_f1: 0.6166
 epoch: 50, train_loss: 0.3483, test_loss: 1.8798, test_f1: 0.6533
 epoch: 51, train_loss: 0.2503, test_loss: 1.8827, test_f1: 0.5989
 epoch: 52, train_loss: 0.2211, test_loss: 1.9578, test_f1: 0.6144
 epoch: 53, train_loss: 0.2253, test_loss: 1.9436, test_f1: 0.6123
 epoch: 54, train_loss: 0.1890, test_loss: 2.1987, test_f1: 0.6140
 epoch: 55, train_loss: 0.2318, test_loss: 2.1372, test_f1: 0.6059
 epoch: 56, train_loss: 0.1824, test_loss: 2.1608, test_f1: 0.6222
 epoch: 57, train_loss: 0.1923, test_loss: 2.3024, test_f1: 0.5761
 epoch: 58, train_loss: 0.1920, test_loss: 2.2105, test_f1: 0.6025
 epoch: 59, train_loss: 0.2158, test_loss: 2.4760, test_f1: 0.5896
 epoch: 60, train_loss: 0.1916, test_loss: 2.2275, test_f1: 0.6203
 epoch: 61, train_loss: 0.1762, test_loss: 2.3396, test_f1: 0.6114
 epoch: 62, train_loss: 0.1680, test_loss: 2.4477, test_f1: 0.6015
 epoch: 63, train_loss: 0.1982, test_loss: 2.6802, test_f1: 0.5777
 epoch: 64, train_loss: 0.1883, test_loss: 2.5273, test_f1: 0.5707
 epoch: 65, train_loss: 0.2121, test_loss: 2.3509, test_f1: 0.6164
 epoch: 66, train_loss: 0.1600, test_loss: 2.5970, test_f1: 0.5660
 epoch: 67, train_loss: 0.1424, test_loss: 2.8548, test_f1: 0.6061
 epoch: 68, train_loss: 0.1438, test_loss: 2.9030, test_f1: 0.5939
 epoch: 69, train_loss: 0.1465, test_loss: 2.9107, test_f1: 0.5686
 epoch: 70, train_loss: 0.1455, test_loss: 2.8004, test_f1: 0.6129
 epoch: 71, train_loss: 0.1674, test_loss: 2.7868, test_f1: 0.5782
 epoch: 72, train_loss: 0.1471, test_loss: 2.7790, test_f1: 0.6004
 epoch: 73, train_loss: 0.1307, test_loss: 3.1976, test_f1: 0.5545
 epoch: 74, train_loss: 0.1832, test_loss: 2.5709, test_f1: 0.6252
 epoch: 75, train_loss: 0.1819, test_loss: 3.0130, test_f1: 0.5815
 epoch: 76, train_loss: 0.1360, test_loss: 3.0865, test_f1: 0.5779
 epoch: 77, train_loss: 0.1515, test_loss: 2.7617, test_f1: 0.5870
 epoch: 78, train_loss: 0.1806, test_loss: 2.7170, test_f1: 0.6178
 epoch: 79, train_loss: 0.1598, test_loss: 2.7517, test_f1: 0.6094
 epoch: 80, train_loss: 0.1463, test_loss: 2.7395, test_f1: 0.5992
 epoch: 81, train_loss: 0.1578, test_loss: 2.7535, test_f1: 0.6027
 epoch: 82, train_loss: 0.1726, test_loss: 2.7450, test_f1: 0.5662
 epoch: 83, train_loss: 0.1295, test_loss: 2.8920, test_f1: 0.6219
 epoch: 84, train_loss: 0.1206, test_loss: 3.1942, test_f1: 0.5728
 epoch: 85, train_loss: 0.1160, test_loss: 2.8335, test_f1: 0.6049
 epoch: 86, train_loss: 0.1186, test_loss: 3.0850, test_f1: 0.6135
 epoch: 87, train_loss: 0.1412, test_loss: 3.0292, test_f1: 0.5913
 epoch: 88, train_loss: 0.1329, test_loss: 3.0719, test_f1: 0.5710
 epoch: 89, train_loss: 0.1395, test_loss: 3.2171, test_f1: 0.5767
 epoch: 90, train_loss: 0.1111, test_loss: 3.2074, test_f1: 0.5790
 epoch: 91, train_loss: 0.1110, test_loss: 3.1745, test_f1: 0.5981
 epoch: 92, train_loss: 0.1115, test_loss: 3.1992, test_f1: 0.5920
 epoch: 93, train_loss: 0.1180, test_loss: 3.0960, test_f1: 0.6008
 epoch: 94, train_loss: 0.1138, test_loss: 3.1992, test_f1: 0.5916
 epoch: 95, train_loss: 0.1181, test_loss: 3.2714, test_f1: 0.6067
 epoch: 96, train_loss: 0.1114, test_loss: 3.4359, test_f1: 0.5796
 epoch: 97, train_loss: 0.1099, test_loss: 3.3458, test_f1: 0.6123
 epoch: 98, train_loss: 0.1526, test_loss: 3.0686, test_f1: 0.5698
 epoch: 99, train_loss: 0.1398, test_loss: 3.1661, test_f1: 0.6218
##################ITERATION #3 ****************************************
 epoch: 0, train_loss: 1.1528, test_loss: 1.1142, test_f1: 0.4381
 epoch: 1, train_loss: 0.9834, test_loss: 1.0402, test_f1: 0.5219
 epoch: 2, train_loss: 0.9088, test_loss: 1.0357, test_f1: 0.5459
 epoch: 3, train_loss: 0.8891, test_loss: 0.9943, test_f1: 0.5505
 epoch: 4, train_loss: 0.8458, test_loss: 1.0169, test_f1: 0.5514
 epoch: 5, train_loss: 0.8146, test_loss: 1.0523, test_f1: 0.5619
 epoch: 6, train_loss: 0.7721, test_loss: 1.0465, test_f1: 0.5639
 epoch: 7, train_loss: 0.7543, test_loss: 1.0454, test_f1: 0.6417
 epoch: 8, train_loss: 0.7418, test_loss: 1.1386, test_f1: 0.5304
 epoch: 9, train_loss: 0.7194, test_loss: 1.0432, test_f1: 0.5967
 epoch: 10, train_loss: 0.7077, test_loss: 1.1897, test_f1: 0.5473
 epoch: 11, train_loss: 0.6745, test_loss: 1.1126, test_f1: 0.6034
 epoch: 12, train_loss: 0.6297, test_loss: 1.1440, test_f1: 0.5868
 epoch: 13, train_loss: 0.6477, test_loss: 1.0912, test_f1: 0.5919
 epoch: 14, train_loss: 0.6169, test_loss: 1.1475, test_f1: 0.6147
 epoch: 15, train_loss: 0.5762, test_loss: 1.2379, test_f1: 0.5342
 epoch: 16, train_loss: 0.5795, test_loss: 1.0643, test_f1: 0.6126
 epoch: 17, train_loss: 0.5713, test_loss: 1.3966, test_f1: 0.5310
 epoch: 18, train_loss: 0.5519, test_loss: 1.2140, test_f1: 0.6324
 epoch: 19, train_loss: 0.5081, test_loss: 1.3097, test_f1: 0.5947
 epoch: 20, train_loss: 0.5485, test_loss: 1.2889, test_f1: 0.5788
 epoch: 21, train_loss: 0.5375, test_loss: 1.3555, test_f1: 0.6048
 epoch: 22, train_loss: 0.5239, test_loss: 1.2203, test_f1: 0.6625
 epoch: 23, train_loss: 0.5172, test_loss: 1.3055, test_f1: 0.5897
 epoch: 24, train_loss: 0.4986, test_loss: 1.3114, test_f1: 0.5976
 epoch: 25, train_loss: 0.4604, test_loss: 1.3045, test_f1: 0.6109
 epoch: 26, train_loss: 0.4714, test_loss: 1.3939, test_f1: 0.6339
 epoch: 27, train_loss: 0.4937, test_loss: 1.3269, test_f1: 0.5343
 epoch: 28, train_loss: 0.4677, test_loss: 1.3824, test_f1: 0.6161
 epoch: 29, train_loss: 0.4308, test_loss: 1.4849, test_f1: 0.5723
 epoch: 30, train_loss: 0.4198, test_loss: 1.5308, test_f1: 0.5978
 epoch: 31, train_loss: 0.4330, test_loss: 1.5166, test_f1: 0.5807
 epoch: 32, train_loss: 0.4307, test_loss: 1.4803, test_f1: 0.6237
 epoch: 33, train_loss: 0.3977, test_loss: 1.4735, test_f1: 0.6242
 epoch: 34, train_loss: 0.4327, test_loss: 1.4670, test_f1: 0.5916
 epoch: 35, train_loss: 0.3991, test_loss: 1.7384, test_f1: 0.5711
 epoch: 36, train_loss: 0.3952, test_loss: 1.5891, test_f1: 0.6004
 epoch: 37, train_loss: 0.3656, test_loss: 1.5729, test_f1: 0.6520
 epoch: 38, train_loss: 0.3835, test_loss: 1.7479, test_f1: 0.5711
 epoch: 39, train_loss: 0.3555, test_loss: 1.7574, test_f1: 0.5988
 epoch: 40, train_loss: 0.3599, test_loss: 2.0345, test_f1: 0.5734
 epoch: 41, train_loss: 0.3635, test_loss: 1.6215, test_f1: 0.6127
 epoch: 42, train_loss: 0.3375, test_loss: 1.7264, test_f1: 0.5955
 epoch: 43, train_loss: 0.3564, test_loss: 1.6268, test_f1: 0.6228
 epoch: 44, train_loss: 0.3644, test_loss: 1.6584, test_f1: 0.6207
 epoch: 45, train_loss: 0.2908, test_loss: 1.6836, test_f1: 0.6228
 epoch: 46, train_loss: 0.2738, test_loss: 1.8582, test_f1: 0.6017
 epoch: 47, train_loss: 0.3261, test_loss: 1.7545, test_f1: 0.5930
 epoch: 48, train_loss: 0.3189, test_loss: 1.7500, test_f1: 0.6096
 epoch: 49, train_loss: 0.3413, test_loss: 2.1395, test_f1: 0.5481
 epoch: 50, train_loss: 0.3255, test_loss: 1.8957, test_f1: 0.6219
 epoch: 51, train_loss: 0.2477, test_loss: 2.0809, test_f1: 0.6169
 epoch: 52, train_loss: 0.2248, test_loss: 1.9139, test_f1: 0.6233
 epoch: 53, train_loss: 0.2164, test_loss: 1.9953, test_f1: 0.6206
 epoch: 54, train_loss: 0.1910, test_loss: 2.3164, test_f1: 0.5530
 epoch: 55, train_loss: 0.1983, test_loss: 2.3011, test_f1: 0.5667
 epoch: 56, train_loss: 0.2068, test_loss: 2.2629, test_f1: 0.6090
 epoch: 57, train_loss: 0.2168, test_loss: 2.3182, test_f1: 0.5946
 epoch: 58, train_loss: 0.1685, test_loss: 2.4072, test_f1: 0.5889
 epoch: 59, train_loss: 0.2111, test_loss: 2.2905, test_f1: 0.5985
 epoch: 60, train_loss: 0.1867, test_loss: 2.6511, test_f1: 0.5657
 epoch: 61, train_loss: 0.1878, test_loss: 2.5100, test_f1: 0.5775
 epoch: 62, train_loss: 0.1868, test_loss: 2.2237, test_f1: 0.6196
 epoch: 63, train_loss: 0.1936, test_loss: 2.3137, test_f1: 0.5995
 epoch: 64, train_loss: 0.2102, test_loss: 2.3665, test_f1: 0.5766
 epoch: 65, train_loss: 0.1843, test_loss: 2.3945, test_f1: 0.5798
 epoch: 66, train_loss: 0.1636, test_loss: 2.5431, test_f1: 0.5978
 epoch: 67, train_loss: 0.1497, test_loss: 2.6397, test_f1: 0.5924
 epoch: 68, train_loss: 0.1508, test_loss: 2.6715, test_f1: 0.5750
 epoch: 69, train_loss: 0.1775, test_loss: 2.6734, test_f1: 0.5691
 epoch: 70, train_loss: 0.1955, test_loss: 2.7099, test_f1: 0.5867
 epoch: 71, train_loss: 0.1647, test_loss: 2.7655, test_f1: 0.5776
 epoch: 72, train_loss: 0.1663, test_loss: 2.7950, test_f1: 0.5747
 epoch: 73, train_loss: 0.1336, test_loss: 2.8069, test_f1: 0.5409
 epoch: 74, train_loss: 0.1307, test_loss: 2.6622, test_f1: 0.6014
 epoch: 75, train_loss: 0.1475, test_loss: 2.9603, test_f1: 0.5770
 epoch: 76, train_loss: 0.1420, test_loss: 2.7821, test_f1: 0.6060
 epoch: 77, train_loss: 0.1391, test_loss: 2.8149, test_f1: 0.5932
 epoch: 78, train_loss: 0.1685, test_loss: 2.8117, test_f1: 0.5907
 epoch: 79, train_loss: 0.1255, test_loss: 2.7901, test_f1: 0.5704
 epoch: 80, train_loss: 0.1657, test_loss: 2.9065, test_f1: 0.5607
 epoch: 81, train_loss: 0.1519, test_loss: 2.8648, test_f1: 0.5987
 epoch: 82, train_loss: 0.1227, test_loss: 2.8194, test_f1: 0.6057
 epoch: 83, train_loss: 0.1405, test_loss: 3.1652, test_f1: 0.5801
 epoch: 84, train_loss: 0.1395, test_loss: 3.2571, test_f1: 0.5873
 epoch: 85, train_loss: 0.1289, test_loss: 3.3097, test_f1: 0.5561
 epoch: 86, train_loss: 0.1389, test_loss: 3.3077, test_f1: 0.5775
 epoch: 87, train_loss: 0.1207, test_loss: 3.2440, test_f1: 0.5928
 epoch: 88, train_loss: 0.1271, test_loss: 3.2316, test_f1: 0.6082
 epoch: 89, train_loss: 0.1425, test_loss: 3.2283, test_f1: 0.6154
 epoch: 90, train_loss: 0.1749, test_loss: 3.1791, test_f1: 0.5674
 epoch: 91, train_loss: 0.1281, test_loss: 3.0975, test_f1: 0.5919
 epoch: 92, train_loss: 0.1056, test_loss: 3.2627, test_f1: 0.5918
 epoch: 93, train_loss: 0.1303, test_loss: 3.2305, test_f1: 0.5979
 epoch: 94, train_loss: 0.1378, test_loss: 3.4167, test_f1: 0.5483
 epoch: 95, train_loss: 0.1155, test_loss: 3.3017, test_f1: 0.5667
 epoch: 96, train_loss: 0.1267, test_loss: 3.2685, test_f1: 0.5689
 epoch: 97, train_loss: 0.1151, test_loss: 3.3014, test_f1: 0.5908
 epoch: 98, train_loss: 0.1153, test_loss: 3.2810, test_f1: 0.5815
 epoch: 99, train_loss: 0.1089, test_loss: 3.2881, test_f1: 0.5957
##################ITERATION #4 ****************************************
 epoch: 0, train_loss: 1.2323, test_loss: 1.3062, test_f1: 0.3594
 epoch: 1, train_loss: 0.9763, test_loss: 1.0785, test_f1: 0.4985
 epoch: 2, train_loss: 0.9142, test_loss: 1.1049, test_f1: 0.5163
 epoch: 3, train_loss: 0.8824, test_loss: 1.3076, test_f1: 0.3960
 epoch: 4, train_loss: 0.8767, test_loss: 1.1213, test_f1: 0.5537
 epoch: 5, train_loss: 0.8181, test_loss: 1.2073, test_f1: 0.5061
 epoch: 6, train_loss: 0.7780, test_loss: 1.1528, test_f1: 0.5089
 epoch: 7, train_loss: 0.7871, test_loss: 1.0808, test_f1: 0.5882
 epoch: 8, train_loss: 0.7339, test_loss: 1.2396, test_f1: 0.4530
 epoch: 9, train_loss: 0.7286, test_loss: 1.1086, test_f1: 0.5750
 epoch: 10, train_loss: 0.6996, test_loss: 1.1506, test_f1: 0.5339
 epoch: 11, train_loss: 0.7123, test_loss: 1.1285, test_f1: 0.5763
 epoch: 12, train_loss: 0.6796, test_loss: 1.0971, test_f1: 0.6190
 epoch: 13, train_loss: 0.6672, test_loss: 1.1190, test_f1: 0.5512
 epoch: 14, train_loss: 0.6465, test_loss: 1.2861, test_f1: 0.5175
 epoch: 15, train_loss: 0.6716, test_loss: 1.1547, test_f1: 0.5656
 epoch: 16, train_loss: 0.6043, test_loss: 1.0769, test_f1: 0.6383
 epoch: 17, train_loss: 0.5869, test_loss: 1.1294, test_f1: 0.6120
 epoch: 18, train_loss: 0.5601, test_loss: 1.1707, test_f1: 0.6334
 epoch: 19, train_loss: 0.5476, test_loss: 1.1687, test_f1: 0.6358
 epoch: 20, train_loss: 0.5529, test_loss: 1.2616, test_f1: 0.5855
 epoch: 21, train_loss: 0.5667, test_loss: 1.2660, test_f1: 0.5804
 epoch: 22, train_loss: 0.5477, test_loss: 1.2284, test_f1: 0.6030
 epoch: 23, train_loss: 0.5249, test_loss: 1.0915, test_f1: 0.5906
 epoch: 24, train_loss: 0.5010, test_loss: 1.2558, test_f1: 0.5851
 epoch: 25, train_loss: 0.4987, test_loss: 1.2789, test_f1: 0.6311
 epoch: 26, train_loss: 0.4836, test_loss: 1.5192, test_f1: 0.5250
 epoch: 27, train_loss: 0.4473, test_loss: 1.3985, test_f1: 0.5979
 epoch: 28, train_loss: 0.4581, test_loss: 1.3929, test_f1: 0.5936
 epoch: 29, train_loss: 0.4552, test_loss: 1.3868, test_f1: 0.5693
 epoch: 30, train_loss: 0.4255, test_loss: 1.4270, test_f1: 0.5725
 epoch: 31, train_loss: 0.4280, test_loss: 1.3254, test_f1: 0.6191
 epoch: 32, train_loss: 0.4388, test_loss: 1.3669, test_f1: 0.6505
 epoch: 33, train_loss: 0.4314, test_loss: 1.3763, test_f1: 0.6103
 epoch: 34, train_loss: 0.4144, test_loss: 1.4965, test_f1: 0.6158
 epoch: 35, train_loss: 0.4012, test_loss: 1.5552, test_f1: 0.6146
 epoch: 36, train_loss: 0.3745, test_loss: 1.4619, test_f1: 0.6100
 epoch: 37, train_loss: 0.3848, test_loss: 1.4639, test_f1: 0.6113
 epoch: 38, train_loss: 0.3914, test_loss: 1.4938, test_f1: 0.6225
 epoch: 39, train_loss: 0.4007, test_loss: 1.5170, test_f1: 0.6269
 epoch: 40, train_loss: 0.3300, test_loss: 1.6917, test_f1: 0.5810
 epoch: 41, train_loss: 0.3436, test_loss: 1.5365, test_f1: 0.6602
 epoch: 42, train_loss: 0.3702, test_loss: 1.6600, test_f1: 0.6173
 epoch: 43, train_loss: 0.3750, test_loss: 1.6936, test_f1: 0.5953
 epoch: 44, train_loss: 0.3576, test_loss: 1.4496, test_f1: 0.6197
 epoch: 45, train_loss: 0.3041, test_loss: 1.5973, test_f1: 0.6263
 epoch: 46, train_loss: 0.3475, test_loss: 1.7792, test_f1: 0.6286
 epoch: 47, train_loss: 0.3105, test_loss: 1.7793, test_f1: 0.6214
 epoch: 48, train_loss: 0.3081, test_loss: 1.8733, test_f1: 0.6278
 epoch: 49, train_loss: 0.2695, test_loss: 1.9191, test_f1: 0.6150
 epoch: 50, train_loss: 0.3090, test_loss: 1.9691, test_f1: 0.6141
 epoch: 51, train_loss: 0.2628, test_loss: 1.8058, test_f1: 0.6494
 epoch: 52, train_loss: 0.2171, test_loss: 1.9867, test_f1: 0.6216
 epoch: 53, train_loss: 0.1863, test_loss: 2.1285, test_f1: 0.6372
 epoch: 54, train_loss: 0.1977, test_loss: 2.2260, test_f1: 0.6220
 epoch: 55, train_loss: 0.2189, test_loss: 1.8708, test_f1: 0.6805
 epoch: 56, train_loss: 0.1989, test_loss: 2.1253, test_f1: 0.5993
 epoch: 57, train_loss: 0.1799, test_loss: 2.2728, test_f1: 0.6158
 epoch: 58, train_loss: 0.1733, test_loss: 2.2336, test_f1: 0.6358
 epoch: 59, train_loss: 0.1756, test_loss: 2.2403, test_f1: 0.6055
 epoch: 60, train_loss: 0.1666, test_loss: 2.3905, test_f1: 0.6071
 epoch: 61, train_loss: 0.1827, test_loss: 2.1709, test_f1: 0.6520
 epoch: 62, train_loss: 0.1783, test_loss: 2.2534, test_f1: 0.6516
 epoch: 63, train_loss: 0.1619, test_loss: 2.2293, test_f1: 0.6423
 epoch: 64, train_loss: 0.1438, test_loss: 2.4697, test_f1: 0.6202
 epoch: 65, train_loss: 0.1879, test_loss: 2.4080, test_f1: 0.6544
 epoch: 66, train_loss: 0.1330, test_loss: 2.5064, test_f1: 0.6229
 epoch: 67, train_loss: 0.1789, test_loss: 2.3925, test_f1: 0.6436
 epoch: 68, train_loss: 0.1605, test_loss: 2.4714, test_f1: 0.5942
 epoch: 69, train_loss: 0.1663, test_loss: 2.5639, test_f1: 0.6249
 epoch: 70, train_loss: 0.1385, test_loss: 2.6265, test_f1: 0.6314
 epoch: 71, train_loss: 0.1447, test_loss: 2.8910, test_f1: 0.6158
 epoch: 72, train_loss: 0.1294, test_loss: 2.8726, test_f1: 0.6069
 epoch: 73, train_loss: 0.1321, test_loss: 2.7800, test_f1: 0.5707
 epoch: 74, train_loss: 0.1314, test_loss: 2.8131, test_f1: 0.6097
 epoch: 75, train_loss: 0.1621, test_loss: 2.8425, test_f1: 0.6069
 epoch: 76, train_loss: 0.1568, test_loss: 2.9391, test_f1: 0.6202
 epoch: 77, train_loss: 0.1508, test_loss: 2.7717, test_f1: 0.6147
 epoch: 78, train_loss: 0.1492, test_loss: 2.5065, test_f1: 0.6288
 epoch: 79, train_loss: 0.1535, test_loss: 2.6957, test_f1: 0.6048
 epoch: 80, train_loss: 0.1404, test_loss: 3.0703, test_f1: 0.5818
 epoch: 81, train_loss: 0.1499, test_loss: 2.7574, test_f1: 0.6080
 epoch: 82, train_loss: 0.1343, test_loss: 2.6688, test_f1: 0.6347
 epoch: 83, train_loss: 0.1250, test_loss: 2.8220, test_f1: 0.6116
 epoch: 84, train_loss: 0.1642, test_loss: 2.6039, test_f1: 0.6368
 epoch: 85, train_loss: 0.1432, test_loss: 2.8949, test_f1: 0.5960
 epoch: 86, train_loss: 0.1070, test_loss: 3.1303, test_f1: 0.5881
 epoch: 87, train_loss: 0.1596, test_loss: 2.9741, test_f1: 0.5534
 epoch: 88, train_loss: 0.1206, test_loss: 2.9308, test_f1: 0.6025
 epoch: 89, train_loss: 0.1049, test_loss: 3.0486, test_f1: 0.6096
 epoch: 90, train_loss: 0.1271, test_loss: 3.0995, test_f1: 0.5982
 epoch: 91, train_loss: 0.1182, test_loss: 3.2276, test_f1: 0.5706
 epoch: 92, train_loss: 0.1079, test_loss: 3.1886, test_f1: 0.5974
 epoch: 93, train_loss: 0.1337, test_loss: 3.1364, test_f1: 0.5910
 epoch: 94, train_loss: 0.1306, test_loss: 2.8571, test_f1: 0.6398
 epoch: 95, train_loss: 0.1231, test_loss: 3.0200, test_f1: 0.6243
 epoch: 96, train_loss: 0.0986, test_loss: 3.1362, test_f1: 0.6270
 epoch: 97, train_loss: 0.1288, test_loss: 3.1994, test_f1: 0.6298
 epoch: 98, train_loss: 0.0988, test_loss: 3.0496, test_f1: 0.6077
 epoch: 99, train_loss: 0.1245, test_loss: 3.0646, test_f1: 0.6105
##################ITERATION #5 ****************************************
 epoch: 0, train_loss: 1.2701, test_loss: 1.3916, test_f1: 0.2426
 epoch: 1, train_loss: 1.0240, test_loss: 1.0857, test_f1: 0.4697
 epoch: 2, train_loss: 0.9518, test_loss: 1.0932, test_f1: 0.5498
 epoch: 3, train_loss: 0.9098, test_loss: 1.0695, test_f1: 0.4237
 epoch: 4, train_loss: 0.8565, test_loss: 0.9911, test_f1: 0.5649
 epoch: 5, train_loss: 0.8326, test_loss: 1.1050, test_f1: 0.5199
 epoch: 6, train_loss: 0.7963, test_loss: 1.0677, test_f1: 0.5856
 epoch: 7, train_loss: 0.7825, test_loss: 1.0849, test_f1: 0.5321
 epoch: 8, train_loss: 0.7635, test_loss: 1.1009, test_f1: 0.5400
 epoch: 9, train_loss: 0.7435, test_loss: 1.1154, test_f1: 0.5168
 epoch: 10, train_loss: 0.7075, test_loss: 1.0720, test_f1: 0.5758
 epoch: 11, train_loss: 0.7004, test_loss: 1.0792, test_f1: 0.5954
 epoch: 12, train_loss: 0.6729, test_loss: 1.1801, test_f1: 0.5336
 epoch: 13, train_loss: 0.6486, test_loss: 1.0604, test_f1: 0.5823
 epoch: 14, train_loss: 0.6516, test_loss: 1.1865, test_f1: 0.5959
 epoch: 15, train_loss: 0.6441, test_loss: 1.1582, test_f1: 0.5866
 epoch: 16, train_loss: 0.6188, test_loss: 1.1357, test_f1: 0.5810
 epoch: 17, train_loss: 0.6167, test_loss: 1.1272, test_f1: 0.6348
 epoch: 18, train_loss: 0.5807, test_loss: 1.2410, test_f1: 0.5724
 epoch: 19, train_loss: 0.6047, test_loss: 1.1520, test_f1: 0.5583
 epoch: 20, train_loss: 0.5768, test_loss: 1.3103, test_f1: 0.5566
 epoch: 21, train_loss: 0.5503, test_loss: 1.3465, test_f1: 0.5962
 epoch: 22, train_loss: 0.5434, test_loss: 1.2116, test_f1: 0.6370
 epoch: 23, train_loss: 0.5321, test_loss: 1.3674, test_f1: 0.5494
 epoch: 24, train_loss: 0.5330, test_loss: 1.2051, test_f1: 0.6394
 epoch: 25, train_loss: 0.5151, test_loss: 1.3132, test_f1: 0.5858
 epoch: 26, train_loss: 0.5115, test_loss: 1.4129, test_f1: 0.5989
 epoch: 27, train_loss: 0.4981, test_loss: 1.5842, test_f1: 0.5486
 epoch: 28, train_loss: 0.4854, test_loss: 1.4224, test_f1: 0.5974
 epoch: 29, train_loss: 0.4784, test_loss: 1.3174, test_f1: 0.6036
 epoch: 30, train_loss: 0.4859, test_loss: 1.3361, test_f1: 0.6182
 epoch: 31, train_loss: 0.4478, test_loss: 1.5238, test_f1: 0.6233
 epoch: 32, train_loss: 0.4606, test_loss: 1.3395, test_f1: 0.6267
 epoch: 33, train_loss: 0.4230, test_loss: 1.5846, test_f1: 0.5915
 epoch: 34, train_loss: 0.4287, test_loss: 1.5643, test_f1: 0.5708
 epoch: 35, train_loss: 0.4470, test_loss: 1.4827, test_f1: 0.6186
 epoch: 36, train_loss: 0.4246, test_loss: 1.4382, test_f1: 0.6425
 epoch: 37, train_loss: 0.4177, test_loss: 1.4917, test_f1: 0.5979
 epoch: 38, train_loss: 0.3573, test_loss: 1.5410, test_f1: 0.6071
 epoch: 39, train_loss: 0.3800, test_loss: 1.7330, test_f1: 0.5493
 epoch: 40, train_loss: 0.3752, test_loss: 1.6716, test_f1: 0.6098
 epoch: 41, train_loss: 0.3767, test_loss: 1.8381, test_f1: 0.5690
 epoch: 42, train_loss: 0.3690, test_loss: 1.8260, test_f1: 0.5801
 epoch: 43, train_loss: 0.3311, test_loss: 1.5802, test_f1: 0.5922
 epoch: 44, train_loss: 0.3829, test_loss: 1.6719, test_f1: 0.5822
 epoch: 45, train_loss: 0.3483, test_loss: 1.6892, test_f1: 0.6591
 epoch: 46, train_loss: 0.3507, test_loss: 1.7173, test_f1: 0.6179
 epoch: 47, train_loss: 0.3334, test_loss: 1.8237, test_f1: 0.6198
 epoch: 48, train_loss: 0.3435, test_loss: 1.7053, test_f1: 0.6070
 epoch: 49, train_loss: 0.3177, test_loss: 2.1806, test_f1: 0.5736
 epoch: 50, train_loss: 0.3306, test_loss: 1.8384, test_f1: 0.6197
 epoch: 51, train_loss: 0.2417, test_loss: 1.9542, test_f1: 0.6062
 epoch: 52, train_loss: 0.2633, test_loss: 1.9443, test_f1: 0.6287
 epoch: 53, train_loss: 0.2176, test_loss: 2.0297, test_f1: 0.6344
 epoch: 54, train_loss: 0.2267, test_loss: 2.0935, test_f1: 0.6166
 epoch: 55, train_loss: 0.2150, test_loss: 2.0845, test_f1: 0.6231
 epoch: 56, train_loss: 0.1829, test_loss: 2.2174, test_f1: 0.6224
 epoch: 57, train_loss: 0.2289, test_loss: 2.2989, test_f1: 0.6077
 epoch: 58, train_loss: 0.1944, test_loss: 2.2129, test_f1: 0.6078
 epoch: 59, train_loss: 0.2039, test_loss: 2.1731, test_f1: 0.6314
 epoch: 60, train_loss: 0.2012, test_loss: 2.2853, test_f1: 0.6067
 epoch: 61, train_loss: 0.2089, test_loss: 2.2465, test_f1: 0.6073
 epoch: 62, train_loss: 0.1770, test_loss: 2.2977, test_f1: 0.5902
 epoch: 63, train_loss: 0.1882, test_loss: 2.1821, test_f1: 0.6379
 epoch: 64, train_loss: 0.1790, test_loss: 2.3398, test_f1: 0.6003
 epoch: 65, train_loss: 0.1943, test_loss: 2.3217, test_f1: 0.6123
 epoch: 66, train_loss: 0.1868, test_loss: 2.3450, test_f1: 0.6074
 epoch: 67, train_loss: 0.1605, test_loss: 2.3165, test_f1: 0.6171
 epoch: 68, train_loss: 0.1883, test_loss: 2.2365, test_f1: 0.6125
 epoch: 69, train_loss: 0.1711, test_loss: 2.4818, test_f1: 0.6384
 epoch: 70, train_loss: 0.1384, test_loss: 2.3863, test_f1: 0.6209
 epoch: 71, train_loss: 0.1594, test_loss: 2.5304, test_f1: 0.6276
 epoch: 72, train_loss: 0.1782, test_loss: 2.5936, test_f1: 0.5961
 epoch: 73, train_loss: 0.1594, test_loss: 2.4036, test_f1: 0.6250
 epoch: 74, train_loss: 0.1727, test_loss: 2.6770, test_f1: 0.5961
 epoch: 75, train_loss: 0.1651, test_loss: 2.5586, test_f1: 0.6226
 epoch: 76, train_loss: 0.1823, test_loss: 2.6317, test_f1: 0.6154
 epoch: 77, train_loss: 0.1526, test_loss: 2.7198, test_f1: 0.6019
 epoch: 78, train_loss: 0.1327, test_loss: 2.8210, test_f1: 0.6080
 epoch: 79, train_loss: 0.1516, test_loss: 2.4981, test_f1: 0.6291
 epoch: 80, train_loss: 0.1175, test_loss: 2.7582, test_f1: 0.6051
 epoch: 81, train_loss: 0.1303, test_loss: 2.7197, test_f1: 0.6008
 epoch: 82, train_loss: 0.1415, test_loss: 2.8379, test_f1: 0.6110
 epoch: 83, train_loss: 0.1328, test_loss: 2.8114, test_f1: 0.6195
 epoch: 84, train_loss: 0.1292, test_loss: 2.7540, test_f1: 0.6081
 epoch: 85, train_loss: 0.1497, test_loss: 2.6669, test_f1: 0.6031
 epoch: 86, train_loss: 0.1231, test_loss: 2.9600, test_f1: 0.5967
 epoch: 87, train_loss: 0.1099, test_loss: 2.7751, test_f1: 0.6006
 epoch: 88, train_loss: 0.1667, test_loss: 2.6952, test_f1: 0.6278
 epoch: 89, train_loss: 0.1057, test_loss: 3.1510, test_f1: 0.6016
 epoch: 90, train_loss: 0.1332, test_loss: 2.6988, test_f1: 0.6302
 epoch: 91, train_loss: 0.1744, test_loss: 2.8558, test_f1: 0.6375
 epoch: 92, train_loss: 0.1460, test_loss: 2.7145, test_f1: 0.5991
 epoch: 93, train_loss: 0.1414, test_loss: 2.7210, test_f1: 0.5837
 epoch: 94, train_loss: 0.1140, test_loss: 2.5770, test_f1: 0.6383
 epoch: 95, train_loss: 0.1198, test_loss: 3.0807, test_f1: 0.6025
 epoch: 96, train_loss: 0.1164, test_loss: 2.9820, test_f1: 0.6010
 epoch: 97, train_loss: 0.1352, test_loss: 3.1032, test_f1: 0.6157
 epoch: 98, train_loss: 0.1452, test_loss: 2.8891, test_f1: 0.6282
 epoch: 99, train_loss: 0.1185, test_loss: 2.9138, test_f1: 0.6152
##################ITERATION #6 ****************************************
 epoch: 0, train_loss: 1.2683, test_loss: 1.2508, test_f1: 0.4253
 epoch: 1, train_loss: 0.9937, test_loss: 1.0664, test_f1: 0.4926
 epoch: 2, train_loss: 0.9523, test_loss: 1.0535, test_f1: 0.5383
 epoch: 3, train_loss: 0.9282, test_loss: 1.0258, test_f1: 0.5601
 epoch: 4, train_loss: 0.8685, test_loss: 1.0774, test_f1: 0.5650
 epoch: 5, train_loss: 0.8414, test_loss: 1.0286, test_f1: 0.5507
 epoch: 6, train_loss: 0.7952, test_loss: 1.0625, test_f1: 0.6105
 epoch: 7, train_loss: 0.7803, test_loss: 1.0780, test_f1: 0.5354
 epoch: 8, train_loss: 0.7429, test_loss: 1.0904, test_f1: 0.5277
 epoch: 9, train_loss: 0.7234, test_loss: 1.0446, test_f1: 0.5867
 epoch: 10, train_loss: 0.7201, test_loss: 1.0605, test_f1: 0.6083
 epoch: 11, train_loss: 0.6888, test_loss: 1.0415, test_f1: 0.6059
 epoch: 12, train_loss: 0.6860, test_loss: 1.1274, test_f1: 0.5981
 epoch: 13, train_loss: 0.6753, test_loss: 1.0411, test_f1: 0.6666
 epoch: 14, train_loss: 0.6320, test_loss: 1.1569, test_f1: 0.6289
 epoch: 15, train_loss: 0.6318, test_loss: 1.0930, test_f1: 0.6169
 epoch: 16, train_loss: 0.5880, test_loss: 1.1543, test_f1: 0.6149
 epoch: 17, train_loss: 0.6063, test_loss: 1.1991, test_f1: 0.5652
 epoch: 18, train_loss: 0.5488, test_loss: 1.2559, test_f1: 0.5928
 epoch: 19, train_loss: 0.5856, test_loss: 1.2460, test_f1: 0.6438
 epoch: 20, train_loss: 0.5934, test_loss: 1.2862, test_f1: 0.5234
 epoch: 21, train_loss: 0.5603, test_loss: 1.1858, test_f1: 0.6194
 epoch: 22, train_loss: 0.5230, test_loss: 1.1362, test_f1: 0.6048
 epoch: 23, train_loss: 0.5355, test_loss: 1.3197, test_f1: 0.6052
 epoch: 24, train_loss: 0.5393, test_loss: 1.3037, test_f1: 0.6003
 epoch: 25, train_loss: 0.5021, test_loss: 1.2657, test_f1: 0.6438
 epoch: 26, train_loss: 0.4752, test_loss: 1.4640, test_f1: 0.5695
 epoch: 27, train_loss: 0.4867, test_loss: 1.4153, test_f1: 0.5844
 epoch: 28, train_loss: 0.4839, test_loss: 1.4100, test_f1: 0.6198
 epoch: 29, train_loss: 0.4833, test_loss: 1.4027, test_f1: 0.6102
 epoch: 30, train_loss: 0.4871, test_loss: 1.3199, test_f1: 0.6438
 epoch: 31, train_loss: 0.4431, test_loss: 1.4627, test_f1: 0.6309
 epoch: 32, train_loss: 0.4685, test_loss: 1.3889, test_f1: 0.6311
 epoch: 33, train_loss: 0.4188, test_loss: 1.5066, test_f1: 0.5836
 epoch: 34, train_loss: 0.4339, test_loss: 1.5112, test_f1: 0.6259
 epoch: 35, train_loss: 0.4439, test_loss: 1.4506, test_f1: 0.6185
 epoch: 36, train_loss: 0.3750, test_loss: 1.5537, test_f1: 0.6277
 epoch: 37, train_loss: 0.3836, test_loss: 1.9328, test_f1: 0.5461
 epoch: 38, train_loss: 0.3595, test_loss: 1.7148, test_f1: 0.5985
 epoch: 39, train_loss: 0.3687, test_loss: 1.6986, test_f1: 0.6007
 epoch: 40, train_loss: 0.3962, test_loss: 1.7144, test_f1: 0.6050
 epoch: 41, train_loss: 0.3738, test_loss: 1.5958, test_f1: 0.6046
 epoch: 42, train_loss: 0.3940, test_loss: 1.7442, test_f1: 0.5814
 epoch: 43, train_loss: 0.3424, test_loss: 1.7458, test_f1: 0.6230
 epoch: 44, train_loss: 0.3162, test_loss: 1.6555, test_f1: 0.6023
 epoch: 45, train_loss: 0.3451, test_loss: 1.5726, test_f1: 0.6163
 epoch: 46, train_loss: 0.3223, test_loss: 1.6218, test_f1: 0.6237
 epoch: 47, train_loss: 0.3225, test_loss: 1.8927, test_f1: 0.6178
 epoch: 48, train_loss: 0.3379, test_loss: 1.6727, test_f1: 0.6161
 epoch: 49, train_loss: 0.3074, test_loss: 1.8155, test_f1: 0.6429
 epoch: 50, train_loss: 0.3003, test_loss: 1.9621, test_f1: 0.6064
 epoch: 51, train_loss: 0.2711, test_loss: 1.8323, test_f1: 0.5812
 epoch: 52, train_loss: 0.2260, test_loss: 1.9663, test_f1: 0.6053
 epoch: 53, train_loss: 0.1987, test_loss: 2.1838, test_f1: 0.5730
 epoch: 54, train_loss: 0.2379, test_loss: 1.9876, test_f1: 0.5869
 epoch: 55, train_loss: 0.2074, test_loss: 2.2712, test_f1: 0.5783
 epoch: 56, train_loss: 0.1671, test_loss: 2.2575, test_f1: 0.5909
 epoch: 57, train_loss: 0.1804, test_loss: 2.2254, test_f1: 0.5975
 epoch: 58, train_loss: 0.1527, test_loss: 2.3824, test_f1: 0.5982
 epoch: 59, train_loss: 0.1939, test_loss: 2.3117, test_f1: 0.5820
 epoch: 60, train_loss: 0.1979, test_loss: 2.4063, test_f1: 0.5672
 epoch: 61, train_loss: 0.1806, test_loss: 2.2789, test_f1: 0.6194
 epoch: 62, train_loss: 0.1634, test_loss: 2.5000, test_f1: 0.5571
 epoch: 63, train_loss: 0.1592, test_loss: 2.4924, test_f1: 0.6204
 epoch: 64, train_loss: 0.1964, test_loss: 2.2276, test_f1: 0.5831
 epoch: 65, train_loss: 0.1505, test_loss: 2.4505, test_f1: 0.5907
 epoch: 66, train_loss: 0.1617, test_loss: 2.5182, test_f1: 0.5960
 epoch: 67, train_loss: 0.1649, test_loss: 2.5102, test_f1: 0.5820
 epoch: 68, train_loss: 0.1513, test_loss: 2.4132, test_f1: 0.5946
 epoch: 69, train_loss: 0.2126, test_loss: 2.4037, test_f1: 0.6129
 epoch: 70, train_loss: 0.1662, test_loss: 2.5111, test_f1: 0.5987
 epoch: 71, train_loss: 0.1492, test_loss: 2.4261, test_f1: 0.6045
 epoch: 72, train_loss: 0.1340, test_loss: 2.5888, test_f1: 0.5965
 epoch: 73, train_loss: 0.1489, test_loss: 2.8022, test_f1: 0.5582
 epoch: 74, train_loss: 0.1569, test_loss: 2.7129, test_f1: 0.5691
 epoch: 75, train_loss: 0.1299, test_loss: 2.7205, test_f1: 0.5859
 epoch: 76, train_loss: 0.1392, test_loss: 2.7092, test_f1: 0.6113
 epoch: 77, train_loss: 0.1614, test_loss: 2.7522, test_f1: 0.5854
 epoch: 78, train_loss: 0.1756, test_loss: 2.7033, test_f1: 0.5926
 epoch: 79, train_loss: 0.1492, test_loss: 2.9237, test_f1: 0.5849
 epoch: 80, train_loss: 0.1534, test_loss: 2.8181, test_f1: 0.5651
 epoch: 81, train_loss: 0.1245, test_loss: 2.7791, test_f1: 0.6114
 epoch: 82, train_loss: 0.1410, test_loss: 2.7370, test_f1: 0.5789
 epoch: 83, train_loss: 0.1310, test_loss: 2.7487, test_f1: 0.5685
 epoch: 84, train_loss: 0.1268, test_loss: 2.8316, test_f1: 0.5886
 epoch: 85, train_loss: 0.1493, test_loss: 2.9125, test_f1: 0.5615
 epoch: 86, train_loss: 0.1398, test_loss: 2.5752, test_f1: 0.5807
 epoch: 87, train_loss: 0.1377, test_loss: 2.9441, test_f1: 0.5625
 epoch: 88, train_loss: 0.1226, test_loss: 2.9834, test_f1: 0.5794
 epoch: 89, train_loss: 0.1223, test_loss: 3.0465, test_f1: 0.5670
 epoch: 90, train_loss: 0.1196, test_loss: 3.0510, test_f1: 0.5796
 epoch: 91, train_loss: 0.0991, test_loss: 2.9866, test_f1: 0.5729
 epoch: 92, train_loss: 0.1279, test_loss: 3.0150, test_f1: 0.5622
 epoch: 93, train_loss: 0.1353, test_loss: 2.8802, test_f1: 0.5663
 epoch: 94, train_loss: 0.1389, test_loss: 3.0039, test_f1: 0.5717
 epoch: 95, train_loss: 0.1343, test_loss: 3.0316, test_f1: 0.5671
 epoch: 96, train_loss: 0.1328, test_loss: 2.7330, test_f1: 0.5912
 epoch: 97, train_loss: 0.1110, test_loss: 2.8924, test_f1: 0.5976
 epoch: 98, train_loss: 0.0880, test_loss: 3.0878, test_f1: 0.5768
 epoch: 99, train_loss: 0.1024, test_loss: 3.1975, test_f1: 0.5795
##################ITERATION #7 ****************************************
 epoch: 0, train_loss: 1.3159, test_loss: 1.2145, test_f1: 0.3811
 epoch: 1, train_loss: 0.9928, test_loss: 1.0514, test_f1: 0.5919
 epoch: 2, train_loss: 0.9406, test_loss: 1.1035, test_f1: 0.5191
 epoch: 3, train_loss: 0.8751, test_loss: 1.0598, test_f1: 0.5615
 epoch: 4, train_loss: 0.8596, test_loss: 1.0989, test_f1: 0.5286
 epoch: 5, train_loss: 0.8312, test_loss: 1.0996, test_f1: 0.5615
 epoch: 6, train_loss: 0.7970, test_loss: 1.0458, test_f1: 0.5452
 epoch: 7, train_loss: 0.7703, test_loss: 1.0497, test_f1: 0.5946
 epoch: 8, train_loss: 0.7391, test_loss: 1.0809, test_f1: 0.5996
 epoch: 9, train_loss: 0.7289, test_loss: 1.1096, test_f1: 0.5936
 epoch: 10, train_loss: 0.6892, test_loss: 1.1511, test_f1: 0.5912
 epoch: 11, train_loss: 0.6860, test_loss: 1.1517, test_f1: 0.6096
 epoch: 12, train_loss: 0.6792, test_loss: 1.1215, test_f1: 0.6054
 epoch: 13, train_loss: 0.6683, test_loss: 1.0540, test_f1: 0.6091
 epoch: 14, train_loss: 0.6424, test_loss: 1.0907, test_f1: 0.6119
 epoch: 15, train_loss: 0.6364, test_loss: 1.1717, test_f1: 0.6132
 epoch: 16, train_loss: 0.6175, test_loss: 1.1823, test_f1: 0.6270
 epoch: 17, train_loss: 0.6088, test_loss: 1.2587, test_f1: 0.6004
 epoch: 18, train_loss: 0.5990, test_loss: 1.1298, test_f1: 0.5932
 epoch: 19, train_loss: 0.5590, test_loss: 1.2870, test_f1: 0.6073
 epoch: 20, train_loss: 0.6361, test_loss: 1.0769, test_f1: 0.6216
 epoch: 21, train_loss: 0.5716, test_loss: 1.1890, test_f1: 0.6253
 epoch: 22, train_loss: 0.5233, test_loss: 1.4788, test_f1: 0.5519
 epoch: 23, train_loss: 0.5302, test_loss: 1.3253, test_f1: 0.6205
 epoch: 24, train_loss: 0.5539, test_loss: 1.2768, test_f1: 0.5875
 epoch: 25, train_loss: 0.5290, test_loss: 1.1887, test_f1: 0.6836
 epoch: 26, train_loss: 0.4902, test_loss: 1.2230, test_f1: 0.5945
 epoch: 27, train_loss: 0.5113, test_loss: 1.2031, test_f1: 0.6418
 epoch: 28, train_loss: 0.4483, test_loss: 1.3825, test_f1: 0.6633
 epoch: 29, train_loss: 0.4490, test_loss: 1.4605, test_f1: 0.6023
 epoch: 30, train_loss: 0.4370, test_loss: 1.3919, test_f1: 0.6031
 epoch: 31, train_loss: 0.4139, test_loss: 1.5282, test_f1: 0.6337
 epoch: 32, train_loss: 0.4066, test_loss: 1.5919, test_f1: 0.6186
 epoch: 33, train_loss: 0.4170, test_loss: 1.6512, test_f1: 0.6125
 epoch: 34, train_loss: 0.4083, test_loss: 1.5544, test_f1: 0.5794
 epoch: 35, train_loss: 0.3759, test_loss: 1.6515, test_f1: 0.6347
 epoch: 36, train_loss: 0.3942, test_loss: 1.5007, test_f1: 0.6045
 epoch: 37, train_loss: 0.3780, test_loss: 1.5662, test_f1: 0.5972
 epoch: 38, train_loss: 0.3966, test_loss: 1.6102, test_f1: 0.6081
 epoch: 39, train_loss: 0.3798, test_loss: 1.5487, test_f1: 0.6241
 epoch: 40, train_loss: 0.4000, test_loss: 1.4419, test_f1: 0.6471
 epoch: 41, train_loss: 0.3569, test_loss: 1.5328, test_f1: 0.5919
 epoch: 42, train_loss: 0.3299, test_loss: 1.7001, test_f1: 0.6061
 epoch: 43, train_loss: 0.3369, test_loss: 1.6809, test_f1: 0.6237
 epoch: 44, train_loss: 0.3353, test_loss: 1.6160, test_f1: 0.6049
 epoch: 45, train_loss: 0.2920, test_loss: 1.7625, test_f1: 0.6194
 epoch: 46, train_loss: 0.3298, test_loss: 1.7162, test_f1: 0.6403
 epoch: 47, train_loss: 0.3061, test_loss: 1.8216, test_f1: 0.6409
 epoch: 48, train_loss: 0.3065, test_loss: 1.9616, test_f1: 0.6003
 epoch: 49, train_loss: 0.3268, test_loss: 1.8423, test_f1: 0.5975
 epoch: 50, train_loss: 0.3175, test_loss: 1.9415, test_f1: 0.6107
 epoch: 51, train_loss: 0.2396, test_loss: 1.9006, test_f1: 0.6247
 epoch: 52, train_loss: 0.2424, test_loss: 1.7962, test_f1: 0.6404
 epoch: 53, train_loss: 0.1968, test_loss: 1.9502, test_f1: 0.6219
 epoch: 54, train_loss: 0.2149, test_loss: 2.0295, test_f1: 0.6389
 epoch: 55, train_loss: 0.1924, test_loss: 1.9995, test_f1: 0.6426
 epoch: 56, train_loss: 0.1860, test_loss: 2.0537, test_f1: 0.6513
 epoch: 57, train_loss: 0.1710, test_loss: 2.2592, test_f1: 0.5939
 epoch: 58, train_loss: 0.1638, test_loss: 2.2785, test_f1: 0.6085
 epoch: 59, train_loss: 0.1721, test_loss: 2.1966, test_f1: 0.6230
 epoch: 60, train_loss: 0.1935, test_loss: 2.3177, test_f1: 0.6244
 epoch: 61, train_loss: 0.1729, test_loss: 2.3252, test_f1: 0.6211
 epoch: 62, train_loss: 0.1651, test_loss: 2.4321, test_f1: 0.5772
 epoch: 63, train_loss: 0.2219, test_loss: 2.1689, test_f1: 0.6363
 epoch: 64, train_loss: 0.1564, test_loss: 2.5273, test_f1: 0.6229
 epoch: 65, train_loss: 0.1622, test_loss: 2.5880, test_f1: 0.6208
 epoch: 66, train_loss: 0.1726, test_loss: 2.3837, test_f1: 0.6084
 epoch: 67, train_loss: 0.1897, test_loss: 2.5878, test_f1: 0.5773
 epoch: 68, train_loss: 0.1642, test_loss: 2.4177, test_f1: 0.6259
 epoch: 69, train_loss: 0.1442, test_loss: 2.5327, test_f1: 0.6251
 epoch: 70, train_loss: 0.1465, test_loss: 2.5393, test_f1: 0.6154
 epoch: 71, train_loss: 0.1638, test_loss: 2.7495, test_f1: 0.5985
 epoch: 72, train_loss: 0.1804, test_loss: 2.4887, test_f1: 0.6248
 epoch: 73, train_loss: 0.1494, test_loss: 2.6453, test_f1: 0.5695
 epoch: 74, train_loss: 0.1318, test_loss: 2.6377, test_f1: 0.5850
 epoch: 75, train_loss: 0.1247, test_loss: 2.7613, test_f1: 0.5911
 epoch: 76, train_loss: 0.1524, test_loss: 2.6618, test_f1: 0.6064
 epoch: 77, train_loss: 0.1322, test_loss: 2.9832, test_f1: 0.5876
 epoch: 78, train_loss: 0.1631, test_loss: 2.8594, test_f1: 0.6115
 epoch: 79, train_loss: 0.1548, test_loss: 2.9066, test_f1: 0.6105
 epoch: 80, train_loss: 0.1376, test_loss: 2.8145, test_f1: 0.5964
 epoch: 81, train_loss: 0.1873, test_loss: 2.6689, test_f1: 0.6449
 epoch: 82, train_loss: 0.1460, test_loss: 2.8431, test_f1: 0.5872
 epoch: 83, train_loss: 0.1346, test_loss: 2.8668, test_f1: 0.6042
 epoch: 84, train_loss: 0.1152, test_loss: 2.6984, test_f1: 0.6138
 epoch: 85, train_loss: 0.1595, test_loss: 3.0776, test_f1: 0.5781
 epoch: 86, train_loss: 0.1440, test_loss: 2.9305, test_f1: 0.5781
 epoch: 87, train_loss: 0.1342, test_loss: 2.8614, test_f1: 0.6000
 epoch: 88, train_loss: 0.1238, test_loss: 2.9609, test_f1: 0.6196
 epoch: 89, train_loss: 0.1088, test_loss: 2.9486, test_f1: 0.6159
 epoch: 90, train_loss: 0.1241, test_loss: 3.1774, test_f1: 0.6343
 epoch: 91, train_loss: 0.1312, test_loss: 2.8202, test_f1: 0.6416
 epoch: 92, train_loss: 0.1248, test_loss: 3.0829, test_f1: 0.6103
 epoch: 93, train_loss: 0.1190, test_loss: 3.1221, test_f1: 0.6276
 epoch: 94, train_loss: 0.1007, test_loss: 3.1408, test_f1: 0.5944
 epoch: 95, train_loss: 0.0935, test_loss: 3.1692, test_f1: 0.6140
 epoch: 96, train_loss: 0.0947, test_loss: 3.3024, test_f1: 0.5756
 epoch: 97, train_loss: 0.1274, test_loss: 3.1240, test_f1: 0.6028
 epoch: 98, train_loss: 0.1218, test_loss: 3.3678, test_f1: 0.6010
 epoch: 99, train_loss: 0.1080, test_loss: 3.1639, test_f1: 0.5779
##################ITERATION #8 ****************************************
 epoch: 0, train_loss: 1.3608, test_loss: 1.3046, test_f1: 0.4021
 epoch: 1, train_loss: 1.0240, test_loss: 1.0665, test_f1: 0.5177
 epoch: 2, train_loss: 0.9643, test_loss: 1.0720, test_f1: 0.5725
 epoch: 3, train_loss: 0.9166, test_loss: 1.1699, test_f1: 0.4422
 epoch: 4, train_loss: 0.8914, test_loss: 1.1345, test_f1: 0.4697
 epoch: 5, train_loss: 0.8622, test_loss: 1.1318, test_f1: 0.5039
 epoch: 6, train_loss: 0.8294, test_loss: 1.1489, test_f1: 0.5489
 epoch: 7, train_loss: 0.8118, test_loss: 1.0848, test_f1: 0.5758
 epoch: 8, train_loss: 0.8065, test_loss: 1.0743, test_f1: 0.5613
 epoch: 9, train_loss: 0.7828, test_loss: 1.1905, test_f1: 0.5067
 epoch: 10, train_loss: 0.7590, test_loss: 1.0528, test_f1: 0.6243
 epoch: 11, train_loss: 0.7256, test_loss: 1.0712, test_f1: 0.6180
 epoch: 12, train_loss: 0.6952, test_loss: 1.0813, test_f1: 0.6004
 epoch: 13, train_loss: 0.7032, test_loss: 1.1515, test_f1: 0.6229
 epoch: 14, train_loss: 0.6548, test_loss: 1.0651, test_f1: 0.6049
 epoch: 15, train_loss: 0.6424, test_loss: 0.9948, test_f1: 0.6142
 epoch: 16, train_loss: 0.6385, test_loss: 1.2298, test_f1: 0.5381
 epoch: 17, train_loss: 0.6264, test_loss: 1.2827, test_f1: 0.5951
 epoch: 18, train_loss: 0.6371, test_loss: 1.1005, test_f1: 0.6474
 epoch: 19, train_loss: 0.5922, test_loss: 1.1400, test_f1: 0.5976
 epoch: 20, train_loss: 0.5935, test_loss: 1.0817, test_f1: 0.6086
 epoch: 21, train_loss: 0.5399, test_loss: 1.2121, test_f1: 0.5792
 epoch: 22, train_loss: 0.5608, test_loss: 1.2037, test_f1: 0.5737
 epoch: 23, train_loss: 0.5663, test_loss: 1.2552, test_f1: 0.5997
 epoch: 24, train_loss: 0.5103, test_loss: 1.4344, test_f1: 0.5427
 epoch: 25, train_loss: 0.5209, test_loss: 1.3474, test_f1: 0.6538
 epoch: 26, train_loss: 0.5236, test_loss: 1.3601, test_f1: 0.5815
 epoch: 27, train_loss: 0.4955, test_loss: 1.3132, test_f1: 0.6243
 epoch: 28, train_loss: 0.4822, test_loss: 1.3698, test_f1: 0.5186
 epoch: 29, train_loss: 0.4684, test_loss: 1.3114, test_f1: 0.5883
 epoch: 30, train_loss: 0.4949, test_loss: 1.5795, test_f1: 0.5535
 epoch: 31, train_loss: 0.4992, test_loss: 1.1910, test_f1: 0.6179
 epoch: 32, train_loss: 0.4261, test_loss: 1.3762, test_f1: 0.5721
 epoch: 33, train_loss: 0.4280, test_loss: 1.4647, test_f1: 0.6326
 epoch: 34, train_loss: 0.4041, test_loss: 1.4182, test_f1: 0.6302
 epoch: 35, train_loss: 0.4020, test_loss: 1.3080, test_f1: 0.5949
 epoch: 36, train_loss: 0.4004, test_loss: 1.6684, test_f1: 0.5939
 epoch: 37, train_loss: 0.4088, test_loss: 1.3479, test_f1: 0.6307
 epoch: 38, train_loss: 0.4036, test_loss: 1.4939, test_f1: 0.6010
 epoch: 39, train_loss: 0.3983, test_loss: 1.4616, test_f1: 0.6382
 epoch: 40, train_loss: 0.4112, test_loss: 1.4822, test_f1: 0.6139
 epoch: 41, train_loss: 0.3386, test_loss: 1.6239, test_f1: 0.5900
 epoch: 42, train_loss: 0.3526, test_loss: 1.7343, test_f1: 0.6048
 epoch: 43, train_loss: 0.3426, test_loss: 1.5621, test_f1: 0.6438
 epoch: 44, train_loss: 0.3415, test_loss: 1.7559, test_f1: 0.5919
 epoch: 45, train_loss: 0.3101, test_loss: 1.6473, test_f1: 0.6616
 epoch: 46, train_loss: 0.2936, test_loss: 1.8239, test_f1: 0.6210
 epoch: 47, train_loss: 0.3545, test_loss: 1.5759, test_f1: 0.6161
 epoch: 48, train_loss: 0.3023, test_loss: 2.1232, test_f1: 0.5893
 epoch: 49, train_loss: 0.3370, test_loss: 1.7085, test_f1: 0.5836
 epoch: 50, train_loss: 0.2882, test_loss: 1.7130, test_f1: 0.6262
 epoch: 51, train_loss: 0.2784, test_loss: 1.8249, test_f1: 0.6004
 epoch: 52, train_loss: 0.2314, test_loss: 1.7681, test_f1: 0.6674
 epoch: 53, train_loss: 0.2117, test_loss: 1.9923, test_f1: 0.6131
 epoch: 54, train_loss: 0.1999, test_loss: 1.9668, test_f1: 0.5983
 epoch: 55, train_loss: 0.1962, test_loss: 1.9452, test_f1: 0.5890
 epoch: 56, train_loss: 0.2008, test_loss: 2.0818, test_f1: 0.6118
 epoch: 57, train_loss: 0.1901, test_loss: 2.0583, test_f1: 0.6261
 epoch: 58, train_loss: 0.1934, test_loss: 1.9347, test_f1: 0.6352
 epoch: 59, train_loss: 0.2036, test_loss: 2.0428, test_f1: 0.6282
 epoch: 60, train_loss: 0.1998, test_loss: 2.2253, test_f1: 0.5939
 epoch: 61, train_loss: 0.2074, test_loss: 2.0056, test_f1: 0.6213
 epoch: 62, train_loss: 0.1741, test_loss: 2.0208, test_f1: 0.6253
 epoch: 63, train_loss: 0.1689, test_loss: 2.1880, test_f1: 0.6116
 epoch: 64, train_loss: 0.1902, test_loss: 2.4634, test_f1: 0.5489
 epoch: 65, train_loss: 0.1583, test_loss: 2.3152, test_f1: 0.6190
 epoch: 66, train_loss: 0.1603, test_loss: 2.4376, test_f1: 0.6157
 epoch: 67, train_loss: 0.1478, test_loss: 2.5545, test_f1: 0.5521
 epoch: 68, train_loss: 0.1633, test_loss: 2.2640, test_f1: 0.5927
 epoch: 69, train_loss: 0.1896, test_loss: 2.5626, test_f1: 0.5595
 epoch: 70, train_loss: 0.1532, test_loss: 2.4366, test_f1: 0.5967
 epoch: 71, train_loss: 0.1777, test_loss: 2.5004, test_f1: 0.5996
 epoch: 72, train_loss: 0.1700, test_loss: 2.4760, test_f1: 0.6277
 epoch: 73, train_loss: 0.1531, test_loss: 2.5692, test_f1: 0.5623
 epoch: 74, train_loss: 0.1680, test_loss: 2.4539, test_f1: 0.5822
 epoch: 75, train_loss: 0.1232, test_loss: 2.4947, test_f1: 0.6065
 epoch: 76, train_loss: 0.1308, test_loss: 2.6035, test_f1: 0.6128
 epoch: 77, train_loss: 0.1296, test_loss: 2.5067, test_f1: 0.6019
 epoch: 78, train_loss: 0.1350, test_loss: 2.4403, test_f1: 0.6201
 epoch: 79, train_loss: 0.1677, test_loss: 2.4297, test_f1: 0.6002
 epoch: 80, train_loss: 0.1186, test_loss: 2.8961, test_f1: 0.5640
 epoch: 81, train_loss: 0.1241, test_loss: 2.4003, test_f1: 0.6151
 epoch: 82, train_loss: 0.1285, test_loss: 2.8605, test_f1: 0.6033
 epoch: 83, train_loss: 0.1148, test_loss: 3.0794, test_f1: 0.5580
 epoch: 84, train_loss: 0.1431, test_loss: 2.9826, test_f1: 0.5700
 epoch: 85, train_loss: 0.1301, test_loss: 3.0324, test_f1: 0.5647
 epoch: 86, train_loss: 0.1489, test_loss: 3.1146, test_f1: 0.5750
 epoch: 87, train_loss: 0.1652, test_loss: 2.6978, test_f1: 0.5654
 epoch: 88, train_loss: 0.1460, test_loss: 2.5602, test_f1: 0.6118
 epoch: 89, train_loss: 0.1565, test_loss: 2.7410, test_f1: 0.6052
 epoch: 90, train_loss: 0.1403, test_loss: 2.4226, test_f1: 0.6190
 epoch: 91, train_loss: 0.1151, test_loss: 2.7736, test_f1: 0.5808
 epoch: 92, train_loss: 0.1110, test_loss: 2.6498, test_f1: 0.6122
 epoch: 93, train_loss: 0.1608, test_loss: 2.8510, test_f1: 0.5939
 epoch: 94, train_loss: 0.1510, test_loss: 2.8653, test_f1: 0.5484
 epoch: 95, train_loss: 0.1348, test_loss: 2.7852, test_f1: 0.6008
 epoch: 96, train_loss: 0.1102, test_loss: 2.9575, test_f1: 0.5749
 epoch: 97, train_loss: 0.1307, test_loss: 3.1254, test_f1: 0.5388
 epoch: 98, train_loss: 0.1063, test_loss: 2.8589, test_f1: 0.5385
 epoch: 99, train_loss: 0.1234, test_loss: 3.1566, test_f1: 0.5940
##################ITERATION #9 ****************************************
 epoch: 0, train_loss: 1.4319, test_loss: 1.3075, test_f1: 0.2392
 epoch: 1, train_loss: 1.0104, test_loss: 1.1790, test_f1: 0.3886
 epoch: 2, train_loss: 0.9298, test_loss: 1.1076, test_f1: 0.5251
 epoch: 3, train_loss: 0.8886, test_loss: 1.0904, test_f1: 0.4970
 epoch: 4, train_loss: 0.8580, test_loss: 1.1093, test_f1: 0.4724
 epoch: 5, train_loss: 0.8215, test_loss: 1.0504, test_f1: 0.5509
 epoch: 6, train_loss: 0.7946, test_loss: 1.1116, test_f1: 0.5079
 epoch: 7, train_loss: 0.7853, test_loss: 1.1079, test_f1: 0.5736
 epoch: 8, train_loss: 0.7474, test_loss: 1.0989, test_f1: 0.5717
 epoch: 9, train_loss: 0.7405, test_loss: 1.1777, test_f1: 0.5621
 epoch: 10, train_loss: 0.7259, test_loss: 1.0522, test_f1: 0.5964
 epoch: 11, train_loss: 0.6685, test_loss: 1.1374, test_f1: 0.6389
 epoch: 12, train_loss: 0.6626, test_loss: 1.3551, test_f1: 0.5265
 epoch: 13, train_loss: 0.6712, test_loss: 1.1518, test_f1: 0.5745
 epoch: 14, train_loss: 0.6536, test_loss: 1.1367, test_f1: 0.5939
 epoch: 15, train_loss: 0.6356, test_loss: 1.2541, test_f1: 0.5531
 epoch: 16, train_loss: 0.6231, test_loss: 1.1956, test_f1: 0.5498
 epoch: 17, train_loss: 0.5823, test_loss: 1.3055, test_f1: 0.5759
 epoch: 18, train_loss: 0.6036, test_loss: 1.0989, test_f1: 0.6343
 epoch: 19, train_loss: 0.5797, test_loss: 1.3413, test_f1: 0.5314
 epoch: 20, train_loss: 0.5763, test_loss: 1.1556, test_f1: 0.6376
 epoch: 21, train_loss: 0.5381, test_loss: 1.0512, test_f1: 0.6423
 epoch: 22, train_loss: 0.5135, test_loss: 1.3520, test_f1: 0.5282
 epoch: 23, train_loss: 0.5687, test_loss: 1.1773, test_f1: 0.5816
 epoch: 24, train_loss: 0.5100, test_loss: 1.2902, test_f1: 0.6008
 epoch: 25, train_loss: 0.4680, test_loss: 1.4428, test_f1: 0.5887
 epoch: 26, train_loss: 0.4998, test_loss: 1.3389, test_f1: 0.5652
 epoch: 27, train_loss: 0.4679, test_loss: 1.3009, test_f1: 0.5753
 epoch: 28, train_loss: 0.4463, test_loss: 1.3081, test_f1: 0.6065
 epoch: 29, train_loss: 0.4827, test_loss: 1.2619, test_f1: 0.5666
 epoch: 30, train_loss: 0.4615, test_loss: 1.2900, test_f1: 0.6302
 epoch: 31, train_loss: 0.4395, test_loss: 1.4803, test_f1: 0.5639
 epoch: 32, train_loss: 0.4076, test_loss: 1.4347, test_f1: 0.5986
 epoch: 33, train_loss: 0.4212, test_loss: 1.4487, test_f1: 0.5633
 epoch: 34, train_loss: 0.4012, test_loss: 1.5022, test_f1: 0.5729
 epoch: 35, train_loss: 0.4189, test_loss: 1.4055, test_f1: 0.5898
 epoch: 36, train_loss: 0.4050, test_loss: 1.4425, test_f1: 0.6116
 epoch: 37, train_loss: 0.4015, test_loss: 1.3580, test_f1: 0.6185
 epoch: 38, train_loss: 0.3734, test_loss: 1.4112, test_f1: 0.6113
 epoch: 39, train_loss: 0.3758, test_loss: 1.3679, test_f1: 0.6148
 epoch: 40, train_loss: 0.3647, test_loss: 1.4888, test_f1: 0.6040
 epoch: 41, train_loss: 0.3467, test_loss: 2.1271, test_f1: 0.5162
 epoch: 42, train_loss: 0.3248, test_loss: 1.6108, test_f1: 0.6118
 epoch: 43, train_loss: 0.3337, test_loss: 1.6680, test_f1: 0.5940
 epoch: 44, train_loss: 0.3707, test_loss: 1.5339, test_f1: 0.6153
 epoch: 45, train_loss: 0.3358, test_loss: 1.6660, test_f1: 0.6026
 epoch: 46, train_loss: 0.3558, test_loss: 1.7028, test_f1: 0.6089
 epoch: 47, train_loss: 0.3043, test_loss: 1.5500, test_f1: 0.5920
 epoch: 48, train_loss: 0.3545, test_loss: 1.6047, test_f1: 0.5590
 epoch: 49, train_loss: 0.3218, test_loss: 1.4611, test_f1: 0.6121
 epoch: 50, train_loss: 0.3223, test_loss: 1.5848, test_f1: 0.6113
 epoch: 51, train_loss: 0.2660, test_loss: 1.6523, test_f1: 0.6184
 epoch: 52, train_loss: 0.2315, test_loss: 1.6995, test_f1: 0.6177
 epoch: 53, train_loss: 0.2353, test_loss: 1.6774, test_f1: 0.6135
 epoch: 54, train_loss: 0.2299, test_loss: 1.8103, test_f1: 0.6039
 epoch: 55, train_loss: 0.1906, test_loss: 1.8934, test_f1: 0.5981
 epoch: 56, train_loss: 0.2339, test_loss: 1.8853, test_f1: 0.6063
 epoch: 57, train_loss: 0.2175, test_loss: 1.9040, test_f1: 0.6018
 epoch: 58, train_loss: 0.1781, test_loss: 1.8940, test_f1: 0.5993
 epoch: 59, train_loss: 0.1881, test_loss: 1.8573, test_f1: 0.6051
 epoch: 60, train_loss: 0.1776, test_loss: 1.9469, test_f1: 0.6071
 epoch: 61, train_loss: 0.1980, test_loss: 1.8053, test_f1: 0.6314
 epoch: 62, train_loss: 0.1888, test_loss: 1.9818, test_f1: 0.6132
 epoch: 63, train_loss: 0.1801, test_loss: 1.9126, test_f1: 0.6299
 epoch: 64, train_loss: 0.1929, test_loss: 1.9328, test_f1: 0.6013
 epoch: 65, train_loss: 0.1818, test_loss: 2.0744, test_f1: 0.6051
 epoch: 66, train_loss: 0.1786, test_loss: 2.0873, test_f1: 0.5948
 epoch: 67, train_loss: 0.1902, test_loss: 2.0555, test_f1: 0.5985
 epoch: 68, train_loss: 0.1568, test_loss: 2.3450, test_f1: 0.6080
 epoch: 69, train_loss: 0.1658, test_loss: 2.1005, test_f1: 0.5924
 epoch: 70, train_loss: 0.1635, test_loss: 2.2926, test_f1: 0.5986
 epoch: 71, train_loss: 0.1531, test_loss: 2.3294, test_f1: 0.5656
 epoch: 72, train_loss: 0.1760, test_loss: 2.2015, test_f1: 0.6035
 epoch: 73, train_loss: 0.1728, test_loss: 2.1464, test_f1: 0.5913
 epoch: 74, train_loss: 0.1525, test_loss: 2.2251, test_f1: 0.6108
 epoch: 75, train_loss: 0.1617, test_loss: 2.1620, test_f1: 0.5954
 epoch: 76, train_loss: 0.1585, test_loss: 2.0363, test_f1: 0.6077
 epoch: 77, train_loss: 0.1527, test_loss: 2.2284, test_f1: 0.6007
 epoch: 78, train_loss: 0.1647, test_loss: 2.1013, test_f1: 0.5968
 epoch: 79, train_loss: 0.1563, test_loss: 2.0616, test_f1: 0.6070
 epoch: 80, train_loss: 0.1355, test_loss: 2.5290, test_f1: 0.5678
 epoch: 81, train_loss: 0.1488, test_loss: 2.1852, test_f1: 0.5997
 epoch: 82, train_loss: 0.1480, test_loss: 2.3302, test_f1: 0.5930
 epoch: 83, train_loss: 0.1577, test_loss: 2.2860, test_f1: 0.5960
 epoch: 84, train_loss: 0.1464, test_loss: 2.2659, test_f1: 0.5910
 epoch: 85, train_loss: 0.1478, test_loss: 2.1699, test_f1: 0.5974
 epoch: 86, train_loss: 0.1479, test_loss: 2.4293, test_f1: 0.6325
 epoch: 87, train_loss: 0.1089, test_loss: 2.3117, test_f1: 0.6111
 epoch: 88, train_loss: 0.1252, test_loss: 2.2360, test_f1: 0.6066
 epoch: 89, train_loss: 0.1463, test_loss: 2.2526, test_f1: 0.6066
 epoch: 90, train_loss: 0.1157, test_loss: 2.4923, test_f1: 0.5958
 epoch: 91, train_loss: 0.1403, test_loss: 2.3522, test_f1: 0.5736
 epoch: 92, train_loss: 0.1413, test_loss: 2.3742, test_f1: 0.6010
 epoch: 93, train_loss: 0.1341, test_loss: 2.3360, test_f1: 0.6208
 epoch: 94, train_loss: 0.1311, test_loss: 2.4842, test_f1: 0.6006
 epoch: 95, train_loss: 0.1357, test_loss: 2.2424, test_f1: 0.6083
 epoch: 96, train_loss: 0.1443, test_loss: 2.4079, test_f1: 0.5906
 epoch: 97, train_loss: 0.1220, test_loss: 2.5400, test_f1: 0.6113
 epoch: 98, train_loss: 0.1161, test_loss: 2.5428, test_f1: 0.5844
 epoch: 99, train_loss: 0.1026, test_loss: 2.5794, test_f1: 0.5982

Training completed in 1197.92 seconds
Best F1: 0.6878 at epoch 52
Mean F1 across iterations: 0.6667  0.0134
========================FINAL RESULTS================================
FEGIN weighted F1: 0.6878  0.0134
python main.py --data ltspice_demos --representation component_pin_net --model FEGIN --layers 6 --hiddens 128 --batch_size 32 --lr 0.001 --emb_size 128 --epochs 100 --save_appendix component_pin_net_L6_H128_BS32_LR0.001_E128 --no_val
-----



STDERR:
  File "main.py", line 370, in <module>
    main()
  File "main.py", line 254, in main
    dataset = dataset_class(
  File "/home/philip/projects/ltspice_examples_code_repo/Circuit-Completion-Using-GNNs/component_classification_with_link_prediction_head/evaluation/FEGIN/kernel/circuit_datasets.py", line 15, in __init__
    self.data, self.slices = torch.load(self.processed_paths[0])
  File "/home/philip/.local/lib/python3.8/site-packages/torch/serialization.py", line 1040, in load
    warnings.warn(
  File "/usr/lib/python3.8/warnings.py", line 109, in _showwarnmsg
    sw(msg.message, msg.category, msg.filename, msg.lineno,
  File "main.py", line 47, in warn_with_traceback
    traceback.print_stack(file=log)
/home/philip/projects/ltspice_examples_code_repo/Circuit-Completion-Using-GNNs/component_classification_with_link_prediction_head/evaluation/FEGIN/kernel/circuit_datasets.py:15: FutureWarning: You are using `torch.load` with `weights_only=False` (the current default value), which uses the default pickle module implicitly. It is possible to construct malicious pickle data which will execute arbitrary code during unpickling (See https://github.com/pytorch/pytorch/blob/main/SECURITY.md#untrusted-models for more details). In a future release, the default value for `weights_only` will be flipped to `True`. This limits the functions that could be executed during unpickling. Arbitrary objects will no longer be allowed to be loaded via this mode unless they are explicitly allowlisted by the user via `torch.serialization.add_safe_globals`. We recommend you start setting `weights_only=True` for any use case where you don't have full control of the loaded file. Please open an issue on GitHub for any issues related to this experimental feature.
  self.data, self.slices = torch.load(self.processed_paths[0])
