STDOUT:
Results will be saved in /home/philip/projects/ltspice_examples_code_repo/Circuit-Completion-Using-GNNs/component_classification_with_link_prediction_head/evaluation/FEGIN/results/model_FEGIN_dataset_ltspice_demos
Command line input: python main.py --data ltspice_demos --representation component_pin --model FEGIN --layers 3 --hiddens 128 --batch_size 64 --lr 0.01 --emb_size 512 --epochs 100 --save_appendix component_pin_L3_H128_BS64_LR0.01_E512 --no_val
 is saved.
-----
ltspice_demos - FEGIN
Using 3 layers, 128 hidden units, h = 2
Loading component_pin representation dataset
ENTERED
Training FEGIN on component_pin representation
Train: 1565, Test: 383
##################ITERATION #0 ****************************************
 epoch: 0, train_loss: 1.1937, test_loss: 1.6386, test_f1: 0.2835
 epoch: 1, train_loss: 1.0508, test_loss: 1.1491, test_f1: 0.4263
 epoch: 2, train_loss: 0.9798, test_loss: 1.0755, test_f1: 0.4697
 epoch: 3, train_loss: 0.9143, test_loss: 1.0102, test_f1: 0.5099
 epoch: 4, train_loss: 0.8598, test_loss: 1.0408, test_f1: 0.4348
 epoch: 5, train_loss: 0.8270, test_loss: 1.1997, test_f1: 0.5220
 epoch: 6, train_loss: 0.8535, test_loss: 1.0910, test_f1: 0.5174
 epoch: 7, train_loss: 0.8069, test_loss: 1.0892, test_f1: 0.4754
 epoch: 8, train_loss: 0.8055, test_loss: 1.0857, test_f1: 0.4953
 epoch: 9, train_loss: 0.7890, test_loss: 1.2155, test_f1: 0.4693
 epoch: 10, train_loss: 0.7873, test_loss: 2.6968, test_f1: 0.3122
 epoch: 11, train_loss: 0.7559, test_loss: 1.7630, test_f1: 0.5849
 epoch: 12, train_loss: 0.7656, test_loss: 1.3671, test_f1: 0.4955
 epoch: 13, train_loss: 0.7354, test_loss: 1.2812, test_f1: 0.5618
 epoch: 14, train_loss: 0.7949, test_loss: 1.0739, test_f1: 0.5430
 epoch: 15, train_loss: 0.7262, test_loss: 1.2884, test_f1: 0.4881
 epoch: 16, train_loss: 0.7111, test_loss: 1.3060, test_f1: 0.5789
 epoch: 17, train_loss: 0.7225, test_loss: 1.3009, test_f1: 0.5771
 epoch: 18, train_loss: 0.7052, test_loss: 1.0373, test_f1: 0.5309
 epoch: 19, train_loss: 0.7108, test_loss: 1.1913, test_f1: 0.4939
 epoch: 20, train_loss: 0.7011, test_loss: 1.5705, test_f1: 0.4614
 epoch: 21, train_loss: 0.6800, test_loss: 1.3559, test_f1: 0.4616
 epoch: 22, train_loss: 0.6761, test_loss: 1.1815, test_f1: 0.6447
 epoch: 23, train_loss: 0.6511, test_loss: 1.2639, test_f1: 0.5945
 epoch: 24, train_loss: 0.6824, test_loss: 1.0732, test_f1: 0.5987
 epoch: 25, train_loss: 0.6564, test_loss: 1.2877, test_f1: 0.5781
 epoch: 26, train_loss: 0.6406, test_loss: 1.2124, test_f1: 0.5735
 epoch: 27, train_loss: 0.6173, test_loss: 1.2842, test_f1: 0.5864
 epoch: 28, train_loss: 0.6010, test_loss: 1.0985, test_f1: 0.6355
 epoch: 29, train_loss: 0.5887, test_loss: 1.2159, test_f1: 0.6009
 epoch: 30, train_loss: 0.6068, test_loss: 1.3036, test_f1: 0.4965
 epoch: 31, train_loss: 0.5650, test_loss: 1.3029, test_f1: 0.5093
 epoch: 32, train_loss: 0.6133, test_loss: 1.4095, test_f1: 0.6297
 epoch: 33, train_loss: 0.5798, test_loss: 1.2110, test_f1: 0.6158
 epoch: 34, train_loss: 0.6018, test_loss: 1.0193, test_f1: 0.5855
 epoch: 35, train_loss: 0.5677, test_loss: 1.6283, test_f1: 0.6610
 epoch: 36, train_loss: 0.5618, test_loss: 1.0793, test_f1: 0.6157
 epoch: 37, train_loss: 0.5669, test_loss: 1.4307, test_f1: 0.5944
 epoch: 38, train_loss: 0.5341, test_loss: 1.3147, test_f1: 0.5907
 epoch: 39, train_loss: 0.5202, test_loss: 0.9804, test_f1: 0.6202
 epoch: 40, train_loss: 0.5454, test_loss: 1.1223, test_f1: 0.6581
 epoch: 41, train_loss: 0.5002, test_loss: 2.0678, test_f1: 0.5764
 epoch: 42, train_loss: 0.5115, test_loss: 2.1747, test_f1: 0.6489
 epoch: 43, train_loss: 0.5228, test_loss: 1.3792, test_f1: 0.6162
 epoch: 44, train_loss: 0.4971, test_loss: 1.2987, test_f1: 0.5967
 epoch: 45, train_loss: 0.4666, test_loss: 1.9296, test_f1: 0.6078
 epoch: 46, train_loss: 0.4800, test_loss: 2.2541, test_f1: 0.6012
 epoch: 47, train_loss: 0.4720, test_loss: 1.0870, test_f1: 0.6327
 epoch: 48, train_loss: 0.4459, test_loss: 1.1754, test_f1: 0.6414
 epoch: 49, train_loss: 0.4594, test_loss: 1.8405, test_f1: 0.5455
 epoch: 50, train_loss: 0.4567, test_loss: 1.9614, test_f1: 0.6221
 epoch: 51, train_loss: 0.3732, test_loss: 1.6615, test_f1: 0.6525
 epoch: 52, train_loss: 0.3772, test_loss: 1.5505, test_f1: 0.6393
 epoch: 53, train_loss: 0.3578, test_loss: 1.4116, test_f1: 0.6573
 epoch: 54, train_loss: 0.3687, test_loss: 1.6407, test_f1: 0.6810
 epoch: 55, train_loss: 0.3323, test_loss: 1.5670, test_f1: 0.6351
 epoch: 56, train_loss: 0.3199, test_loss: 2.2047, test_f1: 0.6968
 epoch: 57, train_loss: 0.3197, test_loss: 1.7404, test_f1: 0.6199
 epoch: 58, train_loss: 0.2862, test_loss: 2.8906, test_f1: 0.6666
 epoch: 59, train_loss: 0.3331, test_loss: 1.8190, test_f1: 0.6389
 epoch: 60, train_loss: 0.2968, test_loss: 2.0978, test_f1: 0.6668
 epoch: 61, train_loss: 0.2828, test_loss: 2.1850, test_f1: 0.6137
 epoch: 62, train_loss: 0.2926, test_loss: 2.0904, test_f1: 0.6653
 epoch: 63, train_loss: 0.2675, test_loss: 1.9496, test_f1: 0.6636
 epoch: 64, train_loss: 0.2891, test_loss: 2.1621, test_f1: 0.6540
 epoch: 65, train_loss: 0.2608, test_loss: 2.3285, test_f1: 0.6337
 epoch: 66, train_loss: 0.2435, test_loss: 2.2689, test_f1: 0.6412
 epoch: 67, train_loss: 0.2531, test_loss: 2.3099, test_f1: 0.6564
 epoch: 68, train_loss: 0.2630, test_loss: 2.2527, test_f1: 0.6538
 epoch: 69, train_loss: 0.2694, test_loss: 2.5626, test_f1: 0.6176
 epoch: 70, train_loss: 0.2543, test_loss: 2.1968, test_f1: 0.6528
 epoch: 71, train_loss: 0.2448, test_loss: 3.1177, test_f1: 0.6185
 epoch: 72, train_loss: 0.2430, test_loss: 2.1735, test_f1: 0.6147
 epoch: 73, train_loss: 0.2227, test_loss: 3.3715, test_f1: 0.6179
 epoch: 74, train_loss: 0.2160, test_loss: 2.6520, test_f1: 0.6293
 epoch: 75, train_loss: 0.2243, test_loss: 2.6688, test_f1: 0.6431
 epoch: 76, train_loss: 0.2518, test_loss: 2.5754, test_f1: 0.5816
 epoch: 77, train_loss: 0.2700, test_loss: 2.2193, test_f1: 0.6314
 epoch: 78, train_loss: 0.2293, test_loss: 2.3840, test_f1: 0.6220
 epoch: 79, train_loss: 0.2240, test_loss: 2.8176, test_f1: 0.6439
 epoch: 80, train_loss: 0.2215, test_loss: 1.9809, test_f1: 0.6412
 epoch: 81, train_loss: 0.2070, test_loss: 2.3693, test_f1: 0.6114
 epoch: 82, train_loss: 0.2118, test_loss: 2.1991, test_f1: 0.6767
 epoch: 83, train_loss: 0.1811, test_loss: 3.2631, test_f1: 0.6355
 epoch: 84, train_loss: 0.2516, test_loss: 2.3454, test_f1: 0.6865
 epoch: 85, train_loss: 0.1641, test_loss: 2.5167, test_f1: 0.6662
 epoch: 86, train_loss: 0.1798, test_loss: 2.6480, test_f1: 0.5962
 epoch: 87, train_loss: 0.2392, test_loss: 2.6423, test_f1: 0.5955
 epoch: 88, train_loss: 0.2132, test_loss: 2.3825, test_f1: 0.6545
 epoch: 89, train_loss: 0.1762, test_loss: 2.5339, test_f1: 0.6492
 epoch: 90, train_loss: 0.2075, test_loss: 2.8962, test_f1: 0.6433
 epoch: 91, train_loss: 0.1334, test_loss: 2.8678, test_f1: 0.6326
 epoch: 92, train_loss: 0.1345, test_loss: 3.3073, test_f1: 0.6103
 epoch: 93, train_loss: 0.1699, test_loss: 3.0534, test_f1: 0.6284
 epoch: 94, train_loss: 0.1457, test_loss: 3.0520, test_f1: 0.6347
 epoch: 95, train_loss: 0.1753, test_loss: 2.7339, test_f1: 0.6574
 epoch: 96, train_loss: 0.2295, test_loss: 2.4817, test_f1: 0.6290
 epoch: 97, train_loss: 0.1924, test_loss: 2.3654, test_f1: 0.6326
 epoch: 98, train_loss: 0.1697, test_loss: 2.7146, test_f1: 0.6326
 epoch: 99, train_loss: 0.1521, test_loss: 2.8722, test_f1: 0.6251
##################ITERATION #1 ****************************************
 epoch: 0, train_loss: 1.2198, test_loss: 2.2011, test_f1: 0.2421
 epoch: 1, train_loss: 1.0082, test_loss: 2.0405, test_f1: 0.2306
 epoch: 2, train_loss: 0.9183, test_loss: 1.0120, test_f1: 0.5293
 epoch: 3, train_loss: 0.8763, test_loss: 1.0391, test_f1: 0.4909
 epoch: 4, train_loss: 0.8648, test_loss: 1.1316, test_f1: 0.5496
 epoch: 5, train_loss: 0.8197, test_loss: 1.0216, test_f1: 0.5838
 epoch: 6, train_loss: 0.7873, test_loss: 1.0597, test_f1: 0.5423
 epoch: 7, train_loss: 0.8049, test_loss: 1.0290, test_f1: 0.5786
 epoch: 8, train_loss: 0.8031, test_loss: 1.1553, test_f1: 0.5464
 epoch: 9, train_loss: 0.7918, test_loss: 0.9601, test_f1: 0.6056
 epoch: 10, train_loss: 0.7643, test_loss: 1.3246, test_f1: 0.5390
 epoch: 11, train_loss: 0.7563, test_loss: 1.1133, test_f1: 0.5922
 epoch: 12, train_loss: 0.7335, test_loss: 1.0679, test_f1: 0.4733
 epoch: 13, train_loss: 0.7451, test_loss: 1.0701, test_f1: 0.5112
 epoch: 14, train_loss: 0.7341, test_loss: 2.0838, test_f1: 0.4544
 epoch: 15, train_loss: 0.6963, test_loss: 1.1306, test_f1: 0.5779
 epoch: 16, train_loss: 0.7490, test_loss: 1.1981, test_f1: 0.5439
 epoch: 17, train_loss: 0.7231, test_loss: 1.2466, test_f1: 0.5500
 epoch: 18, train_loss: 0.7171, test_loss: 1.1969, test_f1: 0.4667
 epoch: 19, train_loss: 0.6817, test_loss: 1.1495, test_f1: 0.5765
 epoch: 20, train_loss: 0.7220, test_loss: 1.2338, test_f1: 0.4874
 epoch: 21, train_loss: 0.6830, test_loss: 1.2997, test_f1: 0.6372
 epoch: 22, train_loss: 0.6756, test_loss: 1.5868, test_f1: 0.4671
 epoch: 23, train_loss: 0.6649, test_loss: 1.6192, test_f1: 0.4785
 epoch: 24, train_loss: 0.6562, test_loss: 1.0739, test_f1: 0.5486
 epoch: 25, train_loss: 0.6542, test_loss: 1.4072, test_f1: 0.5444
 epoch: 26, train_loss: 0.6515, test_loss: 1.1158, test_f1: 0.4841
 epoch: 27, train_loss: 0.6498, test_loss: 1.3181, test_f1: 0.5592
 epoch: 28, train_loss: 0.6328, test_loss: 1.2454, test_f1: 0.5986
 epoch: 29, train_loss: 0.6566, test_loss: 1.3327, test_f1: 0.5791
 epoch: 30, train_loss: 0.5938, test_loss: 1.0891, test_f1: 0.6154
 epoch: 31, train_loss: 0.6626, test_loss: 1.1314, test_f1: 0.5960
 epoch: 32, train_loss: 0.6422, test_loss: 1.2464, test_f1: 0.5359
 epoch: 33, train_loss: 0.6074, test_loss: 1.5343, test_f1: 0.5685
 epoch: 34, train_loss: 0.5550, test_loss: 1.5004, test_f1: 0.6584
 epoch: 35, train_loss: 0.5878, test_loss: 1.5649, test_f1: 0.6683
 epoch: 36, train_loss: 0.5801, test_loss: 1.3522, test_f1: 0.6587
 epoch: 37, train_loss: 0.5772, test_loss: 1.6261, test_f1: 0.5413
 epoch: 38, train_loss: 0.5689, test_loss: 1.5418, test_f1: 0.6628
 epoch: 39, train_loss: 0.5888, test_loss: 1.4023, test_f1: 0.6337
 epoch: 40, train_loss: 0.5531, test_loss: 1.3151, test_f1: 0.5594
 epoch: 41, train_loss: 0.5486, test_loss: 2.0056, test_f1: 0.5156
 epoch: 42, train_loss: 0.5716, test_loss: 1.6221, test_f1: 0.6045
 epoch: 43, train_loss: 0.5630, test_loss: 1.2636, test_f1: 0.5951
 epoch: 44, train_loss: 0.5411, test_loss: 1.7046, test_f1: 0.5297
 epoch: 45, train_loss: 0.5107, test_loss: 1.4542, test_f1: 0.6123
 epoch: 46, train_loss: 0.5073, test_loss: 1.4299, test_f1: 0.6309
 epoch: 47, train_loss: 0.4688, test_loss: 1.2572, test_f1: 0.5759
 epoch: 48, train_loss: 0.5150, test_loss: 1.4962, test_f1: 0.4972
 epoch: 49, train_loss: 0.4715, test_loss: 1.4617, test_f1: 0.5962
 epoch: 50, train_loss: 0.4733, test_loss: 1.3838, test_f1: 0.6021
 epoch: 51, train_loss: 0.4301, test_loss: 1.5874, test_f1: 0.6346
 epoch: 52, train_loss: 0.4114, test_loss: 1.5795, test_f1: 0.6384
 epoch: 53, train_loss: 0.3925, test_loss: 1.4546, test_f1: 0.6203
 epoch: 54, train_loss: 0.3877, test_loss: 1.4766, test_f1: 0.6290
 epoch: 55, train_loss: 0.3826, test_loss: 1.6769, test_f1: 0.6191
 epoch: 56, train_loss: 0.3436, test_loss: 1.8288, test_f1: 0.6489
 epoch: 57, train_loss: 0.3502, test_loss: 2.0266, test_f1: 0.6528
 epoch: 58, train_loss: 0.3593, test_loss: 1.9555, test_f1: 0.6493
 epoch: 59, train_loss: 0.3509, test_loss: 2.0569, test_f1: 0.6578
 epoch: 60, train_loss: 0.3383, test_loss: 1.7307, test_f1: 0.7107
 epoch: 61, train_loss: 0.3193, test_loss: 1.7486, test_f1: 0.5934
 epoch: 62, train_loss: 0.3335, test_loss: 1.8645, test_f1: 0.6348
 epoch: 63, train_loss: 0.3431, test_loss: 1.7713, test_f1: 0.6249
 epoch: 64, train_loss: 0.2860, test_loss: 1.6167, test_f1: 0.6917
 epoch: 65, train_loss: 0.3249, test_loss: 1.7691, test_f1: 0.6646
 epoch: 66, train_loss: 0.3000, test_loss: 2.1148, test_f1: 0.6232
 epoch: 67, train_loss: 0.2950, test_loss: 1.8866, test_f1: 0.6367
 epoch: 68, train_loss: 0.3060, test_loss: 1.5365, test_f1: 0.6483
 epoch: 69, train_loss: 0.2824, test_loss: 2.2602, test_f1: 0.6324
 epoch: 70, train_loss: 0.2741, test_loss: 2.0485, test_f1: 0.6732
 epoch: 71, train_loss: 0.2883, test_loss: 2.4003, test_f1: 0.6388
 epoch: 72, train_loss: 0.3021, test_loss: 1.7664, test_f1: 0.6584
 epoch: 73, train_loss: 0.2732, test_loss: 1.9673, test_f1: 0.6497
 epoch: 74, train_loss: 0.2689, test_loss: 2.0014, test_f1: 0.6567
 epoch: 75, train_loss: 0.2641, test_loss: 2.1150, test_f1: 0.6277
 epoch: 76, train_loss: 0.2677, test_loss: 2.2440, test_f1: 0.6024
 epoch: 77, train_loss: 0.2551, test_loss: 2.0894, test_f1: 0.6324
 epoch: 78, train_loss: 0.2530, test_loss: 2.1121, test_f1: 0.6485
 epoch: 79, train_loss: 0.2959, test_loss: 2.1097, test_f1: 0.6408
 epoch: 80, train_loss: 0.2643, test_loss: 2.1754, test_f1: 0.6313
 epoch: 81, train_loss: 0.2567, test_loss: 1.9818, test_f1: 0.6360
 epoch: 82, train_loss: 0.2126, test_loss: 2.1120, test_f1: 0.6101
 epoch: 83, train_loss: 0.2444, test_loss: 1.9877, test_f1: 0.6721
 epoch: 84, train_loss: 0.2282, test_loss: 2.1461, test_f1: 0.6794
 epoch: 85, train_loss: 0.2160, test_loss: 2.3533, test_f1: 0.6196
 epoch: 86, train_loss: 0.2124, test_loss: 2.4226, test_f1: 0.6325
 epoch: 87, train_loss: 0.1932, test_loss: 2.2688, test_f1: 0.6772
 epoch: 88, train_loss: 0.2068, test_loss: 2.1655, test_f1: 0.6237
 epoch: 89, train_loss: 0.2698, test_loss: 2.2630, test_f1: 0.6299
 epoch: 90, train_loss: 0.2564, test_loss: 2.1532, test_f1: 0.6408
 epoch: 91, train_loss: 0.1857, test_loss: 2.9943, test_f1: 0.6441
 epoch: 92, train_loss: 0.2203, test_loss: 2.1702, test_f1: 0.6341
 epoch: 93, train_loss: 0.1953, test_loss: 2.4153, test_f1: 0.6728
 epoch: 94, train_loss: 0.1826, test_loss: 2.5973, test_f1: 0.6559
 epoch: 95, train_loss: 0.1973, test_loss: 2.6100, test_f1: 0.6256
 epoch: 96, train_loss: 0.2368, test_loss: 2.3694, test_f1: 0.6210
 epoch: 97, train_loss: 0.2064, test_loss: 2.3591, test_f1: 0.6436
 epoch: 98, train_loss: 0.2727, test_loss: 2.2913, test_f1: 0.6701
 epoch: 99, train_loss: 0.2004, test_loss: 2.1385, test_f1: 0.6813
##################ITERATION #2 ****************************************
 epoch: 0, train_loss: 1.2057, test_loss: 1.2910, test_f1: 0.3876
 epoch: 1, train_loss: 0.9983, test_loss: 1.0203, test_f1: 0.5047
 epoch: 2, train_loss: 0.9244, test_loss: 1.0708, test_f1: 0.4569
 epoch: 3, train_loss: 0.8696, test_loss: 1.0835, test_f1: 0.4637
 epoch: 4, train_loss: 0.8400, test_loss: 1.1676, test_f1: 0.4747
 epoch: 5, train_loss: 0.8766, test_loss: 1.1399, test_f1: 0.5728
 epoch: 6, train_loss: 0.8403, test_loss: 1.0030, test_f1: 0.5213
 epoch: 7, train_loss: 0.8050, test_loss: 1.0482, test_f1: 0.5033
 epoch: 8, train_loss: 0.7776, test_loss: 1.0531, test_f1: 0.5969
 epoch: 9, train_loss: 0.8030, test_loss: 1.1403, test_f1: 0.5120
 epoch: 10, train_loss: 0.7723, test_loss: 1.1844, test_f1: 0.5213
 epoch: 11, train_loss: 0.7484, test_loss: 0.9970, test_f1: 0.6068
 epoch: 12, train_loss: 0.7588, test_loss: 1.2774, test_f1: 0.5283
 epoch: 13, train_loss: 0.7770, test_loss: 1.3121, test_f1: 0.4844
 epoch: 14, train_loss: 0.7488, test_loss: 1.0251, test_f1: 0.6085
 epoch: 15, train_loss: 0.7405, test_loss: 1.0604, test_f1: 0.5844
 epoch: 16, train_loss: 0.7254, test_loss: 1.2121, test_f1: 0.5466
 epoch: 17, train_loss: 0.7199, test_loss: 1.2321, test_f1: 0.5428
 epoch: 18, train_loss: 0.7086, test_loss: 1.0609, test_f1: 0.5788
 epoch: 19, train_loss: 0.7559, test_loss: 1.1893, test_f1: 0.5996
 epoch: 20, train_loss: 0.7030, test_loss: 1.0060, test_f1: 0.6050
 epoch: 21, train_loss: 0.6764, test_loss: 1.1555, test_f1: 0.5379
 epoch: 22, train_loss: 0.6688, test_loss: 1.3357, test_f1: 0.5880
 epoch: 23, train_loss: 0.6934, test_loss: 1.1085, test_f1: 0.5645
 epoch: 24, train_loss: 0.6874, test_loss: 1.0185, test_f1: 0.5970
 epoch: 25, train_loss: 0.6703, test_loss: 1.2618, test_f1: 0.5287
 epoch: 26, train_loss: 0.6620, test_loss: 0.9838, test_f1: 0.6392
 epoch: 27, train_loss: 0.6261, test_loss: 1.3343, test_f1: 0.6013
 epoch: 28, train_loss: 0.6418, test_loss: 1.3174, test_f1: 0.5415
 epoch: 29, train_loss: 0.6636, test_loss: 1.1492, test_f1: 0.5709
 epoch: 30, train_loss: 0.6426, test_loss: 1.1514, test_f1: 0.5452
 epoch: 31, train_loss: 0.6315, test_loss: 1.3690, test_f1: 0.5821
 epoch: 32, train_loss: 0.6388, test_loss: 1.0424, test_f1: 0.5589
 epoch: 33, train_loss: 0.6270, test_loss: 0.9331, test_f1: 0.6696
 epoch: 34, train_loss: 0.6096, test_loss: 1.2156, test_f1: 0.5787
 epoch: 35, train_loss: 0.5926, test_loss: 0.9374, test_f1: 0.6615
 epoch: 36, train_loss: 0.6062, test_loss: 1.0202, test_f1: 0.5931
 epoch: 37, train_loss: 0.5678, test_loss: 1.0871, test_f1: 0.5788
 epoch: 38, train_loss: 0.5663, test_loss: 0.9425, test_f1: 0.6306
 epoch: 39, train_loss: 0.5643, test_loss: 1.7632, test_f1: 0.4014
 epoch: 40, train_loss: 0.5148, test_loss: 1.1287, test_f1: 0.5968
 epoch: 41, train_loss: 0.5341, test_loss: 1.1712, test_f1: 0.6453
 epoch: 42, train_loss: 0.5551, test_loss: 1.0513, test_f1: 0.5991
 epoch: 43, train_loss: 0.5356, test_loss: 1.2113, test_f1: 0.6073
 epoch: 44, train_loss: 0.5385, test_loss: 0.9982, test_f1: 0.6147
 epoch: 45, train_loss: 0.5379, test_loss: 3.1606, test_f1: 0.4020
 epoch: 46, train_loss: 0.5311, test_loss: 0.9911, test_f1: 0.6422
 epoch: 47, train_loss: 0.5129, test_loss: 1.0743, test_f1: 0.6289
 epoch: 48, train_loss: 0.5219, test_loss: 1.0473, test_f1: 0.6175
 epoch: 49, train_loss: 0.5368, test_loss: 1.4033, test_f1: 0.5311
 epoch: 50, train_loss: 0.5494, test_loss: 1.0557, test_f1: 0.6213
 epoch: 51, train_loss: 0.4792, test_loss: 1.2308, test_f1: 0.6261
 epoch: 52, train_loss: 0.4521, test_loss: 1.2576, test_f1: 0.6254
 epoch: 53, train_loss: 0.4254, test_loss: 1.2258, test_f1: 0.5872
 epoch: 54, train_loss: 0.4247, test_loss: 1.1409, test_f1: 0.6370
 epoch: 55, train_loss: 0.3951, test_loss: 1.3707, test_f1: 0.6528
 epoch: 56, train_loss: 0.3851, test_loss: 1.4835, test_f1: 0.6006
 epoch: 57, train_loss: 0.4054, test_loss: 1.1697, test_f1: 0.6446
 epoch: 58, train_loss: 0.3754, test_loss: 1.3419, test_f1: 0.6393
 epoch: 59, train_loss: 0.3448, test_loss: 1.4915, test_f1: 0.6320
 epoch: 60, train_loss: 0.3665, test_loss: 1.6477, test_f1: 0.6388
 epoch: 61, train_loss: 0.3595, test_loss: 1.4249, test_f1: 0.6421
 epoch: 62, train_loss: 0.3502, test_loss: 1.6205, test_f1: 0.6457
 epoch: 63, train_loss: 0.3479, test_loss: 1.4952, test_f1: 0.6436
 epoch: 64, train_loss: 0.3645, test_loss: 1.5292, test_f1: 0.6529
 epoch: 65, train_loss: 0.3261, test_loss: 1.4625, test_f1: 0.6671
 epoch: 66, train_loss: 0.3254, test_loss: 1.6121, test_f1: 0.6435
 epoch: 67, train_loss: 0.3216, test_loss: 1.5810, test_f1: 0.6422
 epoch: 68, train_loss: 0.3332, test_loss: 2.0411, test_f1: 0.6254
 epoch: 69, train_loss: 0.3149, test_loss: 1.2985, test_f1: 0.6432
 epoch: 70, train_loss: 0.3181, test_loss: 1.6006, test_f1: 0.6629
 epoch: 71, train_loss: 0.3548, test_loss: 1.3841, test_f1: 0.6529
 epoch: 72, train_loss: 0.3235, test_loss: 1.9228, test_f1: 0.6203
 epoch: 73, train_loss: 0.3512, test_loss: 1.4363, test_f1: 0.6615
 epoch: 74, train_loss: 0.2918, test_loss: 1.5308, test_f1: 0.6627
 epoch: 75, train_loss: 0.2917, test_loss: 1.9873, test_f1: 0.6216
 epoch: 76, train_loss: 0.3106, test_loss: 1.5663, test_f1: 0.6305
 epoch: 77, train_loss: 0.3162, test_loss: 1.7671, test_f1: 0.6748
 epoch: 78, train_loss: 0.3336, test_loss: 1.6436, test_f1: 0.6759
 epoch: 79, train_loss: 0.2972, test_loss: 1.5930, test_f1: 0.6491
 epoch: 80, train_loss: 0.2501, test_loss: 1.5901, test_f1: 0.6643
 epoch: 81, train_loss: 0.2372, test_loss: 2.1594, test_f1: 0.6132
 epoch: 82, train_loss: 0.2836, test_loss: 1.5589, test_f1: 0.6554
 epoch: 83, train_loss: 0.3113, test_loss: 1.5550, test_f1: 0.6748
 epoch: 84, train_loss: 0.2789, test_loss: 1.8116, test_f1: 0.5954
 epoch: 85, train_loss: 0.2603, test_loss: 1.9719, test_f1: 0.5921
 epoch: 86, train_loss: 0.2602, test_loss: 1.7181, test_f1: 0.6468
 epoch: 87, train_loss: 0.2430, test_loss: 2.0052, test_f1: 0.6355
 epoch: 88, train_loss: 0.2276, test_loss: 1.8679, test_f1: 0.6342
 epoch: 89, train_loss: 0.2098, test_loss: 2.0502, test_f1: 0.6461
 epoch: 90, train_loss: 0.2274, test_loss: 2.1288, test_f1: 0.6557
 epoch: 91, train_loss: 0.2391, test_loss: 2.2729, test_f1: 0.6249
 epoch: 92, train_loss: 0.2399, test_loss: 1.7403, test_f1: 0.7010
 epoch: 93, train_loss: 0.2242, test_loss: 1.8987, test_f1: 0.6301
 epoch: 94, train_loss: 0.2038, test_loss: 1.6972, test_f1: 0.6973
 epoch: 95, train_loss: 0.2112, test_loss: 1.9820, test_f1: 0.6466
 epoch: 96, train_loss: 0.2137, test_loss: 2.1791, test_f1: 0.6134
 epoch: 97, train_loss: 0.2411, test_loss: 1.8899, test_f1: 0.6814
 epoch: 98, train_loss: 0.1841, test_loss: 2.0001, test_f1: 0.6473
 epoch: 99, train_loss: 0.1958, test_loss: 1.9420, test_f1: 0.6679
##################ITERATION #3 ****************************************
 epoch: 0, train_loss: 1.2552, test_loss: 1.3843, test_f1: 0.2456
 epoch: 1, train_loss: 0.9956, test_loss: 1.1672, test_f1: 0.4984
 epoch: 2, train_loss: 0.9350, test_loss: 1.0898, test_f1: 0.5277
 epoch: 3, train_loss: 0.8832, test_loss: 1.8215, test_f1: 0.3759
 epoch: 4, train_loss: 0.8760, test_loss: 0.9921, test_f1: 0.5788
 epoch: 5, train_loss: 0.8312, test_loss: 1.1947, test_f1: 0.4948
 epoch: 6, train_loss: 0.7943, test_loss: 1.3915, test_f1: 0.5060
 epoch: 7, train_loss: 0.8123, test_loss: 1.5442, test_f1: 0.4131
 epoch: 8, train_loss: 0.7818, test_loss: 0.9825, test_f1: 0.5584
 epoch: 9, train_loss: 0.7801, test_loss: 1.1156, test_f1: 0.5552
 epoch: 10, train_loss: 0.7987, test_loss: 1.2466, test_f1: 0.4622
 epoch: 11, train_loss: 0.7758, test_loss: 1.0217, test_f1: 0.5639
 epoch: 12, train_loss: 0.7262, test_loss: 0.9696, test_f1: 0.5535
 epoch: 13, train_loss: 0.7076, test_loss: 1.0304, test_f1: 0.5595
 epoch: 14, train_loss: 0.7116, test_loss: 0.8830, test_f1: 0.5653
 epoch: 15, train_loss: 0.7247, test_loss: 1.0099, test_f1: 0.5774
 epoch: 16, train_loss: 0.7181, test_loss: 1.6523, test_f1: 0.4982
 epoch: 17, train_loss: 0.6971, test_loss: 1.1260, test_f1: 0.5402
 epoch: 18, train_loss: 0.7083, test_loss: 1.1133, test_f1: 0.5145
 epoch: 19, train_loss: 0.6645, test_loss: 1.1699, test_f1: 0.5825
 epoch: 20, train_loss: 0.6645, test_loss: 1.4847, test_f1: 0.5268
 epoch: 21, train_loss: 0.6643, test_loss: 1.3491, test_f1: 0.5468
 epoch: 22, train_loss: 0.6241, test_loss: 1.0621, test_f1: 0.5521
 epoch: 23, train_loss: 0.6732, test_loss: 1.7245, test_f1: 0.4655
 epoch: 24, train_loss: 0.7098, test_loss: 1.0641, test_f1: 0.5561
 epoch: 25, train_loss: 0.6843, test_loss: 1.1541, test_f1: 0.5409
 epoch: 26, train_loss: 0.6189, test_loss: 1.4135, test_f1: 0.5747
 epoch: 27, train_loss: 0.6034, test_loss: 1.0983, test_f1: 0.5990
 epoch: 28, train_loss: 0.6202, test_loss: 1.7614, test_f1: 0.5765
 epoch: 29, train_loss: 0.5974, test_loss: 1.1828, test_f1: 0.5777
 epoch: 30, train_loss: 0.6057, test_loss: 1.2683, test_f1: 0.6197
 epoch: 31, train_loss: 0.5882, test_loss: 1.1205, test_f1: 0.6072
 epoch: 32, train_loss: 0.5931, test_loss: 1.0405, test_f1: 0.6131
 epoch: 33, train_loss: 0.5488, test_loss: 1.3110, test_f1: 0.5687
 epoch: 34, train_loss: 0.5281, test_loss: 1.1296, test_f1: 0.6372
 epoch: 35, train_loss: 0.5673, test_loss: 1.0192, test_f1: 0.6373
 epoch: 36, train_loss: 0.5322, test_loss: 1.4630, test_f1: 0.5945
 epoch: 37, train_loss: 0.5232, test_loss: 1.1295, test_f1: 0.6180
 epoch: 38, train_loss: 0.5564, test_loss: 1.2163, test_f1: 0.4582
 epoch: 39, train_loss: 0.5511, test_loss: 1.4346, test_f1: 0.5726
 epoch: 40, train_loss: 0.5338, test_loss: 1.3517, test_f1: 0.6388
 epoch: 41, train_loss: 0.5117, test_loss: 1.4246, test_f1: 0.5435
 epoch: 42, train_loss: 0.5276, test_loss: 1.3776, test_f1: 0.6327
 epoch: 43, train_loss: 0.5182, test_loss: 1.4356, test_f1: 0.5763
 epoch: 44, train_loss: 0.5055, test_loss: 1.2882, test_f1: 0.6190
 epoch: 45, train_loss: 0.4872, test_loss: 1.3760, test_f1: 0.6810
 epoch: 46, train_loss: 0.4700, test_loss: 1.5413, test_f1: 0.5575
 epoch: 47, train_loss: 0.4986, test_loss: 1.4793, test_f1: 0.6349
 epoch: 48, train_loss: 0.4767, test_loss: 1.8860, test_f1: 0.5537
 epoch: 49, train_loss: 0.4772, test_loss: 1.6601, test_f1: 0.5733
 epoch: 50, train_loss: 0.5108, test_loss: 1.3847, test_f1: 0.6299
 epoch: 51, train_loss: 0.4720, test_loss: 1.5515, test_f1: 0.5991
 epoch: 52, train_loss: 0.4019, test_loss: 1.4913, test_f1: 0.6339
 epoch: 53, train_loss: 0.3811, test_loss: 1.4836, test_f1: 0.6287
 epoch: 54, train_loss: 0.4172, test_loss: 1.4486, test_f1: 0.6381
 epoch: 55, train_loss: 0.4078, test_loss: 1.7821, test_f1: 0.6147
 epoch: 56, train_loss: 0.3627, test_loss: 1.7282, test_f1: 0.5967
 epoch: 57, train_loss: 0.3720, test_loss: 1.5899, test_f1: 0.6379
 epoch: 58, train_loss: 0.3397, test_loss: 1.9217, test_f1: 0.6246
 epoch: 59, train_loss: 0.3301, test_loss: 1.8984, test_f1: 0.6236
 epoch: 60, train_loss: 0.3391, test_loss: 2.2172, test_f1: 0.5907
 epoch: 61, train_loss: 0.3690, test_loss: 2.0613, test_f1: 0.5925
 epoch: 62, train_loss: 0.3146, test_loss: 1.9581, test_f1: 0.6076
 epoch: 63, train_loss: 0.3019, test_loss: 2.1732, test_f1: 0.5805
 epoch: 64, train_loss: 0.3036, test_loss: 2.0030, test_f1: 0.6048
 epoch: 65, train_loss: 0.3171, test_loss: 2.2680, test_f1: 0.6274
 epoch: 66, train_loss: 0.3279, test_loss: 2.5584, test_f1: 0.5952
 epoch: 67, train_loss: 0.3190, test_loss: 2.4637, test_f1: 0.5790
 epoch: 68, train_loss: 0.3067, test_loss: 2.4208, test_f1: 0.5800
 epoch: 69, train_loss: 0.2994, test_loss: 1.9793, test_f1: 0.6443
 epoch: 70, train_loss: 0.3121, test_loss: 2.2131, test_f1: 0.6018
 epoch: 71, train_loss: 0.3086, test_loss: 1.9689, test_f1: 0.6342
 epoch: 72, train_loss: 0.2762, test_loss: 2.1333, test_f1: 0.6238
 epoch: 73, train_loss: 0.2423, test_loss: 2.1999, test_f1: 0.6495
 epoch: 74, train_loss: 0.2625, test_loss: 2.3695, test_f1: 0.6228
 epoch: 75, train_loss: 0.2445, test_loss: 2.5375, test_f1: 0.6464
 epoch: 76, train_loss: 0.2213, test_loss: 2.3178, test_f1: 0.6796
 epoch: 77, train_loss: 0.2836, test_loss: 2.0199, test_f1: 0.6361
 epoch: 78, train_loss: 0.2977, test_loss: 1.7363, test_f1: 0.6600
 epoch: 79, train_loss: 0.3092, test_loss: 2.5152, test_f1: 0.6228
 epoch: 80, train_loss: 0.2439, test_loss: 2.0543, test_f1: 0.6495
 epoch: 81, train_loss: 0.2330, test_loss: 2.2803, test_f1: 0.5946
 epoch: 82, train_loss: 0.2296, test_loss: 2.8202, test_f1: 0.6077
 epoch: 83, train_loss: 0.2295, test_loss: 2.2912, test_f1: 0.6418
 epoch: 84, train_loss: 0.2393, test_loss: 2.5231, test_f1: 0.5845
 epoch: 85, train_loss: 0.2560, test_loss: 2.2511, test_f1: 0.6329
 epoch: 86, train_loss: 0.1994, test_loss: 2.4894, test_f1: 0.6487
 epoch: 87, train_loss: 0.2085, test_loss: 3.0151, test_f1: 0.6416
 epoch: 88, train_loss: 0.2329, test_loss: 2.7520, test_f1: 0.6066
 epoch: 89, train_loss: 0.2454, test_loss: 2.2187, test_f1: 0.6141
 epoch: 90, train_loss: 0.2124, test_loss: 2.2763, test_f1: 0.6273
 epoch: 91, train_loss: 0.1985, test_loss: 2.6492, test_f1: 0.6413
 epoch: 92, train_loss: 0.2164, test_loss: 2.5200, test_f1: 0.5959
 epoch: 93, train_loss: 0.2579, test_loss: 2.1630, test_f1: 0.6310
 epoch: 94, train_loss: 0.2587, test_loss: 2.5165, test_f1: 0.5771
 epoch: 95, train_loss: 0.2301, test_loss: 2.2570, test_f1: 0.6321
 epoch: 96, train_loss: 0.2241, test_loss: 2.4080, test_f1: 0.6147
 epoch: 97, train_loss: 0.1987, test_loss: 2.7245, test_f1: 0.6343
 epoch: 98, train_loss: 0.2694, test_loss: 2.2179, test_f1: 0.6111
 epoch: 99, train_loss: 0.2085, test_loss: 2.5484, test_f1: 0.6612
##################ITERATION #4 ****************************************
 epoch: 0, train_loss: 1.1595, test_loss: 1.3340, test_f1: 0.4110
 epoch: 1, train_loss: 0.9157, test_loss: 1.3042, test_f1: 0.3945
 epoch: 2, train_loss: 0.8719, test_loss: 0.9537, test_f1: 0.4918
 epoch: 3, train_loss: 0.8431, test_loss: 1.0307, test_f1: 0.4313
 epoch: 4, train_loss: 0.8510, test_loss: 1.0111, test_f1: 0.5675
 epoch: 5, train_loss: 0.8164, test_loss: 1.0181, test_f1: 0.5787
 epoch: 6, train_loss: 0.8590, test_loss: 1.0851, test_f1: 0.5385
 epoch: 7, train_loss: 0.8051, test_loss: 1.1817, test_f1: 0.4996
 epoch: 8, train_loss: 0.7853, test_loss: 1.0178, test_f1: 0.4558
 epoch: 9, train_loss: 0.7988, test_loss: 1.0086, test_f1: 0.5208
 epoch: 10, train_loss: 0.7969, test_loss: 1.0092, test_f1: 0.4943
 epoch: 11, train_loss: 0.7531, test_loss: 1.1061, test_f1: 0.5824
 epoch: 12, train_loss: 0.7788, test_loss: 1.1101, test_f1: 0.5630
 epoch: 13, train_loss: 0.7621, test_loss: 1.0243, test_f1: 0.5394
 epoch: 14, train_loss: 0.7441, test_loss: 1.0752, test_f1: 0.5427
 epoch: 15, train_loss: 0.7257, test_loss: 1.0955, test_f1: 0.5730
 epoch: 16, train_loss: 0.7380, test_loss: 0.9841, test_f1: 0.6341
 epoch: 17, train_loss: 0.7512, test_loss: 1.2212, test_f1: 0.5849
 epoch: 18, train_loss: 0.7235, test_loss: 1.0655, test_f1: 0.5756
 epoch: 19, train_loss: 0.7455, test_loss: 1.1552, test_f1: 0.5652
 epoch: 20, train_loss: 0.7514, test_loss: 0.9167, test_f1: 0.5425
 epoch: 21, train_loss: 0.7423, test_loss: 0.9532, test_f1: 0.5999
 epoch: 22, train_loss: 0.7217, test_loss: 1.2344, test_f1: 0.6308
 epoch: 23, train_loss: 0.7136, test_loss: 1.3670, test_f1: 0.5728
 epoch: 24, train_loss: 0.7163, test_loss: 0.9708, test_f1: 0.5181
 epoch: 25, train_loss: 0.7285, test_loss: 1.3983, test_f1: 0.5604
 epoch: 26, train_loss: 0.7282, test_loss: 1.0366, test_f1: 0.5719
 epoch: 27, train_loss: 0.7087, test_loss: 1.1300, test_f1: 0.5853
 epoch: 28, train_loss: 0.7100, test_loss: 1.0864, test_f1: 0.6073
 epoch: 29, train_loss: 0.7365, test_loss: 1.0135, test_f1: 0.6402
 epoch: 30, train_loss: 0.7110, test_loss: 1.0260, test_f1: 0.6265
 epoch: 31, train_loss: 0.6876, test_loss: 1.1387, test_f1: 0.5842
 epoch: 32, train_loss: 0.6870, test_loss: 1.0240, test_f1: 0.6241
 epoch: 33, train_loss: 0.6885, test_loss: 1.0455, test_f1: 0.5829
 epoch: 34, train_loss: 0.6829, test_loss: 0.8971, test_f1: 0.5040
 epoch: 35, train_loss: 0.6738, test_loss: 1.0201, test_f1: 0.6343
 epoch: 36, train_loss: 0.6915, test_loss: 1.2615, test_f1: 0.5605
 epoch: 37, train_loss: 0.6423, test_loss: 1.1386, test_f1: 0.5377
 epoch: 38, train_loss: 0.6415, test_loss: 1.0540, test_f1: 0.6005
 epoch: 39, train_loss: 0.6344, test_loss: 1.5268, test_f1: 0.5426
 epoch: 40, train_loss: 0.6526, test_loss: 1.1846, test_f1: 0.5277
 epoch: 41, train_loss: 0.6401, test_loss: 1.1598, test_f1: 0.6304
 epoch: 42, train_loss: 0.6192, test_loss: 1.5823, test_f1: 0.5035
 epoch: 43, train_loss: 0.6278, test_loss: 1.3662, test_f1: 0.5883
 epoch: 44, train_loss: 0.6716, test_loss: 1.1871, test_f1: 0.6320
 epoch: 45, train_loss: 0.6101, test_loss: 1.4511, test_f1: 0.6156
 epoch: 46, train_loss: 0.5837, test_loss: 1.0844, test_f1: 0.6124
 epoch: 47, train_loss: 0.6051, test_loss: 1.2254, test_f1: 0.5590
 epoch: 48, train_loss: 0.6370, test_loss: 1.3207, test_f1: 0.5971
 epoch: 49, train_loss: 0.5940, test_loss: 1.3319, test_f1: 0.5871
 epoch: 50, train_loss: 0.5650, test_loss: 1.4460, test_f1: 0.5998
 epoch: 51, train_loss: 0.5321, test_loss: 1.1682, test_f1: 0.6368
 epoch: 52, train_loss: 0.5010, test_loss: 1.1371, test_f1: 0.6101
 epoch: 53, train_loss: 0.5133, test_loss: 1.2286, test_f1: 0.6232
 epoch: 54, train_loss: 0.4772, test_loss: 1.3947, test_f1: 0.6218
 epoch: 55, train_loss: 0.4847, test_loss: 1.5318, test_f1: 0.6214
 epoch: 56, train_loss: 0.4661, test_loss: 1.4351, test_f1: 0.5827
 epoch: 57, train_loss: 0.4782, test_loss: 1.5776, test_f1: 0.5623
 epoch: 58, train_loss: 0.4411, test_loss: 1.4521, test_f1: 0.5922
 epoch: 59, train_loss: 0.4392, test_loss: 1.8811, test_f1: 0.5711
 epoch: 60, train_loss: 0.4161, test_loss: 1.6499, test_f1: 0.6567
 epoch: 61, train_loss: 0.4333, test_loss: 1.5119, test_f1: 0.6367
 epoch: 62, train_loss: 0.4905, test_loss: 1.5558, test_f1: 0.5885
 epoch: 63, train_loss: 0.4266, test_loss: 1.6042, test_f1: 0.6385
 epoch: 64, train_loss: 0.4197, test_loss: 1.3803, test_f1: 0.6242
 epoch: 65, train_loss: 0.3926, test_loss: 1.3758, test_f1: 0.5927
 epoch: 66, train_loss: 0.4067, test_loss: 1.6061, test_f1: 0.6106
 epoch: 67, train_loss: 0.4160, test_loss: 2.1474, test_f1: 0.5519
 epoch: 68, train_loss: 0.4499, test_loss: 1.6876, test_f1: 0.6309
 epoch: 69, train_loss: 0.3951, test_loss: 1.5301, test_f1: 0.6300
 epoch: 70, train_loss: 0.3413, test_loss: 1.6336, test_f1: 0.5850
 epoch: 71, train_loss: 0.3697, test_loss: 1.7901, test_f1: 0.6224
 epoch: 72, train_loss: 0.3868, test_loss: 1.6984, test_f1: 0.6369
 epoch: 73, train_loss: 0.3587, test_loss: 2.0312, test_f1: 0.5930
 epoch: 74, train_loss: 0.3387, test_loss: 1.6012, test_f1: 0.6303
 epoch: 75, train_loss: 0.3415, test_loss: 1.7269, test_f1: 0.6009
 epoch: 76, train_loss: 0.3241, test_loss: 1.8439, test_f1: 0.6175
 epoch: 77, train_loss: 0.3346, test_loss: 1.8655, test_f1: 0.5811
 epoch: 78, train_loss: 0.3301, test_loss: 2.1556, test_f1: 0.5678
 epoch: 79, train_loss: 0.3265, test_loss: 1.8431, test_f1: 0.6370
 epoch: 80, train_loss: 0.3434, test_loss: 2.0442, test_f1: 0.5875
 epoch: 81, train_loss: 0.3228, test_loss: 1.6307, test_f1: 0.6503
 epoch: 82, train_loss: 0.2728, test_loss: 2.1029, test_f1: 0.5628
 epoch: 83, train_loss: 0.3077, test_loss: 2.2515, test_f1: 0.6060
 epoch: 84, train_loss: 0.3058, test_loss: 1.9865, test_f1: 0.5711
 epoch: 85, train_loss: 0.2595, test_loss: 2.4886, test_f1: 0.5842
 epoch: 86, train_loss: 0.2774, test_loss: 1.8714, test_f1: 0.6392
 epoch: 87, train_loss: 0.3381, test_loss: 1.7406, test_f1: 0.5993
 epoch: 88, train_loss: 0.2644, test_loss: 1.8439, test_f1: 0.6889
 epoch: 89, train_loss: 0.2578, test_loss: 2.3317, test_f1: 0.5840
 epoch: 90, train_loss: 0.2792, test_loss: 2.0596, test_f1: 0.6255
 epoch: 91, train_loss: 0.2400, test_loss: 2.1039, test_f1: 0.6344
 epoch: 92, train_loss: 0.2692, test_loss: 1.8861, test_f1: 0.6435
 epoch: 93, train_loss: 0.2639, test_loss: 2.1194, test_f1: 0.6094
 epoch: 94, train_loss: 0.2524, test_loss: 2.2113, test_f1: 0.6326
 epoch: 95, train_loss: 0.2366, test_loss: 2.1875, test_f1: 0.6731
 epoch: 96, train_loss: 0.3360, test_loss: 1.9883, test_f1: 0.5595
 epoch: 97, train_loss: 0.2957, test_loss: 1.7414, test_f1: 0.6082
 epoch: 98, train_loss: 0.2201, test_loss: 2.1938, test_f1: 0.6440
 epoch: 99, train_loss: 0.2702, test_loss: 2.3620, test_f1: 0.5993
##################ITERATION #5 ****************************************
 epoch: 0, train_loss: 1.2268, test_loss: 1.1658, test_f1: 0.4100
 epoch: 1, train_loss: 1.0069, test_loss: 1.0143, test_f1: 0.5150
 epoch: 2, train_loss: 0.9335, test_loss: 1.0792, test_f1: 0.4779
 epoch: 3, train_loss: 0.8983, test_loss: 1.1716, test_f1: 0.4491
 epoch: 4, train_loss: 0.8852, test_loss: 1.1295, test_f1: 0.5449
 epoch: 5, train_loss: 0.8725, test_loss: 1.1627, test_f1: 0.5203
 epoch: 6, train_loss: 0.8263, test_loss: 0.9648, test_f1: 0.6059
 epoch: 7, train_loss: 0.8453, test_loss: 1.1162, test_f1: 0.4443
 epoch: 8, train_loss: 0.8030, test_loss: 1.3228, test_f1: 0.4662
 epoch: 9, train_loss: 0.8093, test_loss: 1.0852, test_f1: 0.5558
 epoch: 10, train_loss: 0.8036, test_loss: 1.0657, test_f1: 0.4639
 epoch: 11, train_loss: 0.7626, test_loss: 1.0311, test_f1: 0.5572
 epoch: 12, train_loss: 0.7643, test_loss: 1.0640, test_f1: 0.4930
 epoch: 13, train_loss: 0.7507, test_loss: 1.3238, test_f1: 0.4871
 epoch: 14, train_loss: 0.7441, test_loss: 0.9426, test_f1: 0.5944
 epoch: 15, train_loss: 0.7302, test_loss: 0.9775, test_f1: 0.5888
 epoch: 16, train_loss: 0.7313, test_loss: 1.2421, test_f1: 0.5600
 epoch: 17, train_loss: 0.7165, test_loss: 1.1658, test_f1: 0.6346
 epoch: 18, train_loss: 0.7529, test_loss: 1.1689, test_f1: 0.4679
 epoch: 19, train_loss: 0.7312, test_loss: 1.0139, test_f1: 0.5901
 epoch: 20, train_loss: 0.7348, test_loss: 1.3138, test_f1: 0.5231
 epoch: 21, train_loss: 0.7189, test_loss: 1.0238, test_f1: 0.6039
 epoch: 22, train_loss: 0.6990, test_loss: 0.9478, test_f1: 0.6003
 epoch: 23, train_loss: 0.6929, test_loss: 0.9732, test_f1: 0.5900
 epoch: 24, train_loss: 0.6645, test_loss: 1.0703, test_f1: 0.6073
 epoch: 25, train_loss: 0.6569, test_loss: 1.2236, test_f1: 0.6003
 epoch: 26, train_loss: 0.6704, test_loss: 0.9726, test_f1: 0.6044
 epoch: 27, train_loss: 0.6701, test_loss: 0.9665, test_f1: 0.6560
 epoch: 28, train_loss: 0.6661, test_loss: 1.5111, test_f1: 0.5338
 epoch: 29, train_loss: 0.6424, test_loss: 1.2842, test_f1: 0.5275
 epoch: 30, train_loss: 0.6215, test_loss: 1.1330, test_f1: 0.5951
 epoch: 31, train_loss: 0.6035, test_loss: 1.1542, test_f1: 0.5106
 epoch: 32, train_loss: 0.6399, test_loss: 1.1158, test_f1: 0.6088
 epoch: 33, train_loss: 0.5886, test_loss: 1.3714, test_f1: 0.5513
 epoch: 34, train_loss: 0.6080, test_loss: 1.1284, test_f1: 0.6020
 epoch: 35, train_loss: 0.5718, test_loss: 1.1340, test_f1: 0.6219
 epoch: 36, train_loss: 0.5633, test_loss: 1.2687, test_f1: 0.6269
 epoch: 37, train_loss: 0.5599, test_loss: 1.4365, test_f1: 0.6053
 epoch: 38, train_loss: 0.5899, test_loss: 1.0934, test_f1: 0.5744
 epoch: 39, train_loss: 0.5933, test_loss: 1.4587, test_f1: 0.6404
 epoch: 40, train_loss: 0.5511, test_loss: 1.2137, test_f1: 0.6321
 epoch: 41, train_loss: 0.5634, test_loss: 1.1425, test_f1: 0.6385
 epoch: 42, train_loss: 0.5584, test_loss: 1.3339, test_f1: 0.6059
 epoch: 43, train_loss: 0.5294, test_loss: 1.1642, test_f1: 0.6161
 epoch: 44, train_loss: 0.5195, test_loss: 1.3451, test_f1: 0.5692
 epoch: 45, train_loss: 0.5144, test_loss: 1.0934, test_f1: 0.6593
 epoch: 46, train_loss: 0.5118, test_loss: 1.0420, test_f1: 0.6292
 epoch: 47, train_loss: 0.5486, test_loss: 1.7093, test_f1: 0.6509
 epoch: 48, train_loss: 0.5102, test_loss: 1.4739, test_f1: 0.5456
 epoch: 49, train_loss: 0.5000, test_loss: 1.8142, test_f1: 0.5687
 epoch: 50, train_loss: 0.5262, test_loss: 1.3859, test_f1: 0.5853
 epoch: 51, train_loss: 0.4841, test_loss: 1.4431, test_f1: 0.6285
 epoch: 52, train_loss: 0.4239, test_loss: 1.4635, test_f1: 0.6354
 epoch: 53, train_loss: 0.4214, test_loss: 1.4049, test_f1: 0.6327
 epoch: 54, train_loss: 0.4017, test_loss: 1.4378, test_f1: 0.6215
 epoch: 55, train_loss: 0.4000, test_loss: 1.5345, test_f1: 0.6274
 epoch: 56, train_loss: 0.4033, test_loss: 1.6239, test_f1: 0.6081
 epoch: 57, train_loss: 0.3595, test_loss: 2.0430, test_f1: 0.6259
 epoch: 58, train_loss: 0.3406, test_loss: 1.8011, test_f1: 0.6018
 epoch: 59, train_loss: 0.3452, test_loss: 1.7165, test_f1: 0.6688
 epoch: 60, train_loss: 0.3482, test_loss: 1.5344, test_f1: 0.6606
 epoch: 61, train_loss: 0.3616, test_loss: 1.6797, test_f1: 0.6314
 epoch: 62, train_loss: 0.3366, test_loss: 1.7296, test_f1: 0.6533
 epoch: 63, train_loss: 0.3474, test_loss: 1.7936, test_f1: 0.6214
 epoch: 64, train_loss: 0.3183, test_loss: 2.0361, test_f1: 0.5859
 epoch: 65, train_loss: 0.3154, test_loss: 1.8386, test_f1: 0.6419
 epoch: 66, train_loss: 0.3375, test_loss: 1.6154, test_f1: 0.6677
 epoch: 67, train_loss: 0.3020, test_loss: 1.9402, test_f1: 0.6708
 epoch: 68, train_loss: 0.2992, test_loss: 2.1140, test_f1: 0.6433
 epoch: 69, train_loss: 0.3666, test_loss: 2.2193, test_f1: 0.6006
 epoch: 70, train_loss: 0.3035, test_loss: 1.9542, test_f1: 0.6016
 epoch: 71, train_loss: 0.3380, test_loss: 1.7580, test_f1: 0.6688
 epoch: 72, train_loss: 0.3181, test_loss: 1.8887, test_f1: 0.6227
 epoch: 73, train_loss: 0.3059, test_loss: 1.9374, test_f1: 0.6053
 epoch: 74, train_loss: 0.2998, test_loss: 1.9565, test_f1: 0.6633
 epoch: 75, train_loss: 0.2693, test_loss: 1.9808, test_f1: 0.6274
 epoch: 76, train_loss: 0.2829, test_loss: 1.9909, test_f1: 0.6474
 epoch: 77, train_loss: 0.2244, test_loss: 2.4963, test_f1: 0.6011
 epoch: 78, train_loss: 0.2842, test_loss: 1.9029, test_f1: 0.6687
 epoch: 79, train_loss: 0.2537, test_loss: 2.0608, test_f1: 0.6621
 epoch: 80, train_loss: 0.2627, test_loss: 2.2539, test_f1: 0.6376
 epoch: 81, train_loss: 0.2222, test_loss: 2.3145, test_f1: 0.6678
 epoch: 82, train_loss: 0.2521, test_loss: 2.0908, test_f1: 0.6548
 epoch: 83, train_loss: 0.2153, test_loss: 2.2214, test_f1: 0.5991
 epoch: 84, train_loss: 0.2467, test_loss: 2.0578, test_f1: 0.6377
 epoch: 85, train_loss: 0.2485, test_loss: 2.4149, test_f1: 0.6325
 epoch: 86, train_loss: 0.2563, test_loss: 2.1833, test_f1: 0.6538
 epoch: 87, train_loss: 0.2907, test_loss: 2.2207, test_f1: 0.6578
 epoch: 88, train_loss: 0.2841, test_loss: 2.1941, test_f1: 0.6538
 epoch: 89, train_loss: 0.2639, test_loss: 2.3200, test_f1: 0.6218
 epoch: 90, train_loss: 0.2507, test_loss: 2.2460, test_f1: 0.6399
 epoch: 91, train_loss: 0.2676, test_loss: 2.0807, test_f1: 0.6423
 epoch: 92, train_loss: 0.2374, test_loss: 2.2651, test_f1: 0.6369
 epoch: 93, train_loss: 0.2427, test_loss: 2.1214, test_f1: 0.6432
 epoch: 94, train_loss: 0.2171, test_loss: 2.0904, test_f1: 0.6522
 epoch: 95, train_loss: 0.2486, test_loss: 2.1593, test_f1: 0.6732
 epoch: 96, train_loss: 0.2587, test_loss: 2.4650, test_f1: 0.6459
 epoch: 97, train_loss: 0.2046, test_loss: 2.5237, test_f1: 0.6524
 epoch: 98, train_loss: 0.1997, test_loss: 2.3620, test_f1: 0.6543
 epoch: 99, train_loss: 0.2294, test_loss: 2.0377, test_f1: 0.6317
##################ITERATION #6 ****************************************
 epoch: 0, train_loss: 1.2447, test_loss: 1.7740, test_f1: 0.3393
 epoch: 1, train_loss: 0.9114, test_loss: 0.9752, test_f1: 0.5797
 epoch: 2, train_loss: 0.8826, test_loss: 1.0839, test_f1: 0.4696
 epoch: 3, train_loss: 0.8336, test_loss: 0.9933, test_f1: 0.5344
 epoch: 4, train_loss: 0.8292, test_loss: 0.9746, test_f1: 0.6240
 epoch: 5, train_loss: 0.8009, test_loss: 1.1316, test_f1: 0.5231
 epoch: 6, train_loss: 0.8403, test_loss: 1.2323, test_f1: 0.5658
 epoch: 7, train_loss: 0.7884, test_loss: 1.0193, test_f1: 0.5040
 epoch: 8, train_loss: 0.7785, test_loss: 1.0301, test_f1: 0.6165
 epoch: 9, train_loss: 0.7497, test_loss: 0.9472, test_f1: 0.6014
 epoch: 10, train_loss: 0.7670, test_loss: 1.0961, test_f1: 0.5556
 epoch: 11, train_loss: 0.7491, test_loss: 1.0447, test_f1: 0.6248
 epoch: 12, train_loss: 0.6976, test_loss: 1.3592, test_f1: 0.5494
 epoch: 13, train_loss: 0.7038, test_loss: 1.5755, test_f1: 0.4754
 epoch: 14, train_loss: 0.7239, test_loss: 1.3089, test_f1: 0.5570
 epoch: 15, train_loss: 0.6943, test_loss: 1.3714, test_f1: 0.5540
 epoch: 16, train_loss: 0.7167, test_loss: 1.0106, test_f1: 0.6054
 epoch: 17, train_loss: 0.6799, test_loss: 1.2294, test_f1: 0.5878
 epoch: 18, train_loss: 0.6803, test_loss: 1.0194, test_f1: 0.5862
 epoch: 19, train_loss: 0.6605, test_loss: 1.1424, test_f1: 0.6525
 epoch: 20, train_loss: 0.6194, test_loss: 1.2615, test_f1: 0.5568
 epoch: 21, train_loss: 0.6366, test_loss: 0.9655, test_f1: 0.6148
 epoch: 22, train_loss: 0.6336, test_loss: 1.2012, test_f1: 0.6126
 epoch: 23, train_loss: 0.6766, test_loss: 0.9746, test_f1: 0.5643
 epoch: 24, train_loss: 0.6506, test_loss: 1.3284, test_f1: 0.5856
 epoch: 25, train_loss: 0.6253, test_loss: 1.4619, test_f1: 0.5682
 epoch: 26, train_loss: 0.5922, test_loss: 0.9831, test_f1: 0.6156
 epoch: 27, train_loss: 0.6064, test_loss: 1.2228, test_f1: 0.6241
 epoch: 28, train_loss: 0.5695, test_loss: 1.4172, test_f1: 0.5733
 epoch: 29, train_loss: 0.6161, test_loss: 1.3379, test_f1: 0.4940
 epoch: 30, train_loss: 0.5867, test_loss: 1.2425, test_f1: 0.6441
 epoch: 31, train_loss: 0.5408, test_loss: 1.1985, test_f1: 0.5306
 epoch: 32, train_loss: 0.5738, test_loss: 1.6657, test_f1: 0.5266
 epoch: 33, train_loss: 0.5710, test_loss: 1.1919, test_f1: 0.6254
 epoch: 34, train_loss: 0.5292, test_loss: 1.4243, test_f1: 0.6215
 epoch: 35, train_loss: 0.5240, test_loss: 1.3106, test_f1: 0.6383
 epoch: 36, train_loss: 0.4980, test_loss: 1.4146, test_f1: 0.6260
 epoch: 37, train_loss: 0.5153, test_loss: 1.6829, test_f1: 0.5529
 epoch: 38, train_loss: 0.5667, test_loss: 1.4548, test_f1: 0.6078
 epoch: 39, train_loss: 0.5487, test_loss: 1.2075, test_f1: 0.5764
 epoch: 40, train_loss: 0.5335, test_loss: 1.4112, test_f1: 0.5862
 epoch: 41, train_loss: 0.4743, test_loss: 1.2019, test_f1: 0.6447
 epoch: 42, train_loss: 0.4870, test_loss: 1.2807, test_f1: 0.6322
 epoch: 43, train_loss: 0.4780, test_loss: 1.1443, test_f1: 0.6910
 epoch: 44, train_loss: 0.4374, test_loss: 1.2781, test_f1: 0.6657
 epoch: 45, train_loss: 0.5289, test_loss: 1.3873, test_f1: 0.6322
 epoch: 46, train_loss: 0.5034, test_loss: 0.9873, test_f1: 0.6678
 epoch: 47, train_loss: 0.4673, test_loss: 1.1190, test_f1: 0.6497
 epoch: 48, train_loss: 0.4511, test_loss: 1.2118, test_f1: 0.6766
 epoch: 49, train_loss: 0.4458, test_loss: 1.3708, test_f1: 0.6305
 epoch: 50, train_loss: 0.4326, test_loss: 1.3212, test_f1: 0.6783
 epoch: 51, train_loss: 0.3694, test_loss: 1.5837, test_f1: 0.6478
 epoch: 52, train_loss: 0.3259, test_loss: 1.7315, test_f1: 0.5964
 epoch: 53, train_loss: 0.3211, test_loss: 1.7928, test_f1: 0.6225
 epoch: 54, train_loss: 0.3385, test_loss: 1.6211, test_f1: 0.6914
 epoch: 55, train_loss: 0.3547, test_loss: 1.6217, test_f1: 0.6240
 epoch: 56, train_loss: 0.3112, test_loss: 1.5924, test_f1: 0.6383
 epoch: 57, train_loss: 0.3380, test_loss: 1.8031, test_f1: 0.6107
 epoch: 58, train_loss: 0.3522, test_loss: 1.4518, test_f1: 0.6617
 epoch: 59, train_loss: 0.3311, test_loss: 1.8138, test_f1: 0.6501
 epoch: 60, train_loss: 0.2996, test_loss: 1.3029, test_f1: 0.6952
 epoch: 61, train_loss: 0.2723, test_loss: 2.0320, test_f1: 0.6253
 epoch: 62, train_loss: 0.2827, test_loss: 1.6512, test_f1: 0.6324
 epoch: 63, train_loss: 0.2773, test_loss: 1.7717, test_f1: 0.6337
 epoch: 64, train_loss: 0.3507, test_loss: 1.7603, test_f1: 0.6247
 epoch: 65, train_loss: 0.3235, test_loss: 1.7586, test_f1: 0.6383
 epoch: 66, train_loss: 0.2718, test_loss: 1.5668, test_f1: 0.6271
 epoch: 67, train_loss: 0.2773, test_loss: 2.1575, test_f1: 0.6065
 epoch: 68, train_loss: 0.2847, test_loss: 1.8954, test_f1: 0.5909
 epoch: 69, train_loss: 0.2654, test_loss: 1.7902, test_f1: 0.6297
 epoch: 70, train_loss: 0.2680, test_loss: 1.9388, test_f1: 0.6204
 epoch: 71, train_loss: 0.2310, test_loss: 2.2012, test_f1: 0.6069
 epoch: 72, train_loss: 0.2500, test_loss: 1.7444, test_f1: 0.6362
 epoch: 73, train_loss: 0.2365, test_loss: 2.2749, test_f1: 0.5810
 epoch: 74, train_loss: 0.2427, test_loss: 1.8913, test_f1: 0.6006
 epoch: 75, train_loss: 0.2170, test_loss: 1.9964, test_f1: 0.5975
 epoch: 76, train_loss: 0.2202, test_loss: 2.1424, test_f1: 0.6212
 epoch: 77, train_loss: 0.1837, test_loss: 2.4131, test_f1: 0.5797
 epoch: 78, train_loss: 0.1981, test_loss: 2.4094, test_f1: 0.5984
 epoch: 79, train_loss: 0.2267, test_loss: 2.0419, test_f1: 0.6248
 epoch: 80, train_loss: 0.2413, test_loss: 2.3330, test_f1: 0.5768
 epoch: 81, train_loss: 0.2129, test_loss: 2.5053, test_f1: 0.5947
 epoch: 82, train_loss: 0.1961, test_loss: 2.2360, test_f1: 0.6268
 epoch: 83, train_loss: 0.2164, test_loss: 2.7992, test_f1: 0.6190
 epoch: 84, train_loss: 0.2186, test_loss: 2.4395, test_f1: 0.5546
 epoch: 85, train_loss: 0.2028, test_loss: 2.3776, test_f1: 0.6085
 epoch: 86, train_loss: 0.2164, test_loss: 2.1617, test_f1: 0.6310
 epoch: 87, train_loss: 0.1878, test_loss: 2.2625, test_f1: 0.6633
 epoch: 88, train_loss: 0.1735, test_loss: 2.6420, test_f1: 0.6023
 epoch: 89, train_loss: 0.1946, test_loss: 2.4511, test_f1: 0.5948
 epoch: 90, train_loss: 0.1671, test_loss: 2.4659, test_f1: 0.6134
 epoch: 91, train_loss: 0.2056, test_loss: 2.4122, test_f1: 0.6356
 epoch: 92, train_loss: 0.2154, test_loss: 2.3900, test_f1: 0.6088
 epoch: 93, train_loss: 0.2145, test_loss: 2.7586, test_f1: 0.5884
 epoch: 94, train_loss: 0.2122, test_loss: 2.0315, test_f1: 0.6373
 epoch: 95, train_loss: 0.1683, test_loss: 2.2834, test_f1: 0.6047
 epoch: 96, train_loss: 0.1698, test_loss: 2.4252, test_f1: 0.6235
 epoch: 97, train_loss: 0.1847, test_loss: 2.0478, test_f1: 0.6482
 epoch: 98, train_loss: 0.1715, test_loss: 1.8939, test_f1: 0.6183
 epoch: 99, train_loss: 0.1647, test_loss: 2.5243, test_f1: 0.6348
##################ITERATION #7 ****************************************
 epoch: 0, train_loss: 1.2077, test_loss: 1.1225, test_f1: 0.4452
 epoch: 1, train_loss: 0.9611, test_loss: 1.0338, test_f1: 0.5429
 epoch: 2, train_loss: 0.9272, test_loss: 1.0144, test_f1: 0.5548
 epoch: 3, train_loss: 0.8898, test_loss: 1.1605, test_f1: 0.4306
 epoch: 4, train_loss: 0.8769, test_loss: 1.0491, test_f1: 0.4690
 epoch: 5, train_loss: 0.8558, test_loss: 1.1275, test_f1: 0.4763
 epoch: 6, train_loss: 0.8357, test_loss: 1.0088, test_f1: 0.5463
 epoch: 7, train_loss: 0.8538, test_loss: 1.0054, test_f1: 0.5349
 epoch: 8, train_loss: 0.8080, test_loss: 1.0036, test_f1: 0.5187
 epoch: 9, train_loss: 0.7955, test_loss: 0.9919, test_f1: 0.6311
 epoch: 10, train_loss: 0.7838, test_loss: 1.0363, test_f1: 0.5775
 epoch: 11, train_loss: 0.7767, test_loss: 1.0626, test_f1: 0.4973
 epoch: 12, train_loss: 0.7918, test_loss: 0.9908, test_f1: 0.6065
 epoch: 13, train_loss: 0.7976, test_loss: 0.9883, test_f1: 0.6455
 epoch: 14, train_loss: 0.7450, test_loss: 0.9798, test_f1: 0.6050
 epoch: 15, train_loss: 0.7671, test_loss: 1.1776, test_f1: 0.5214
 epoch: 16, train_loss: 0.7545, test_loss: 1.2166, test_f1: 0.5504
 epoch: 17, train_loss: 0.7415, test_loss: 1.1151, test_f1: 0.5607
 epoch: 18, train_loss: 0.7161, test_loss: 1.6158, test_f1: 0.4922
 epoch: 19, train_loss: 0.7087, test_loss: 1.2288, test_f1: 0.5255
 epoch: 20, train_loss: 0.7146, test_loss: 1.0807, test_f1: 0.6004
 epoch: 21, train_loss: 0.6712, test_loss: 1.1453, test_f1: 0.5841
 epoch: 22, train_loss: 0.6751, test_loss: 1.0917, test_f1: 0.6686
 epoch: 23, train_loss: 0.6579, test_loss: 1.1069, test_f1: 0.6064
 epoch: 24, train_loss: 0.6495, test_loss: 1.5276, test_f1: 0.4966
 epoch: 25, train_loss: 0.6545, test_loss: 1.1223, test_f1: 0.6098
 epoch: 26, train_loss: 0.6886, test_loss: 1.6497, test_f1: 0.4537
 epoch: 27, train_loss: 0.6962, test_loss: 0.9151, test_f1: 0.6186
 epoch: 28, train_loss: 0.6524, test_loss: 0.9805, test_f1: 0.5691
 epoch: 29, train_loss: 0.6478, test_loss: 1.0324, test_f1: 0.5194
 epoch: 30, train_loss: 0.6691, test_loss: 1.2011, test_f1: 0.5777
 epoch: 31, train_loss: 0.6276, test_loss: 1.1394, test_f1: 0.5493
 epoch: 32, train_loss: 0.6415, test_loss: 1.1002, test_f1: 0.5688
 epoch: 33, train_loss: 0.6285, test_loss: 1.0924, test_f1: 0.5118
 epoch: 34, train_loss: 0.6405, test_loss: 1.1585, test_f1: 0.6151
 epoch: 35, train_loss: 0.6142, test_loss: 1.2065, test_f1: 0.5532
 epoch: 36, train_loss: 0.5994, test_loss: 1.0940, test_f1: 0.6100
 epoch: 37, train_loss: 0.5911, test_loss: 1.7280, test_f1: 0.5042
 epoch: 38, train_loss: 0.5982, test_loss: 1.1481, test_f1: 0.5248
 epoch: 39, train_loss: 0.5811, test_loss: 1.1167, test_f1: 0.5931
 epoch: 40, train_loss: 0.6600, test_loss: 1.1444, test_f1: 0.6133
 epoch: 41, train_loss: 0.6310, test_loss: 1.2393, test_f1: 0.6023
 epoch: 42, train_loss: 0.6458, test_loss: 1.0536, test_f1: 0.6161
 epoch: 43, train_loss: 0.5995, test_loss: 1.3677, test_f1: 0.5951
 epoch: 44, train_loss: 0.5680, test_loss: 1.0567, test_f1: 0.5952
 epoch: 45, train_loss: 0.5743, test_loss: 1.2021, test_f1: 0.6233
 epoch: 46, train_loss: 0.6072, test_loss: 0.9309, test_f1: 0.6794
 epoch: 47, train_loss: 0.5654, test_loss: 1.1463, test_f1: 0.6124
 epoch: 48, train_loss: 0.5386, test_loss: 1.0242, test_f1: 0.6266
 epoch: 49, train_loss: 0.5478, test_loss: 1.2265, test_f1: 0.5756
 epoch: 50, train_loss: 0.5251, test_loss: 1.4329, test_f1: 0.6374
 epoch: 51, train_loss: 0.4771, test_loss: 1.1880, test_f1: 0.6673
 epoch: 52, train_loss: 0.4541, test_loss: 1.3340, test_f1: 0.6426
 epoch: 53, train_loss: 0.4435, test_loss: 1.1349, test_f1: 0.6875
 epoch: 54, train_loss: 0.4347, test_loss: 1.4407, test_f1: 0.6087
 epoch: 55, train_loss: 0.4389, test_loss: 1.3446, test_f1: 0.6833
 epoch: 56, train_loss: 0.4498, test_loss: 1.4787, test_f1: 0.6360
 epoch: 57, train_loss: 0.4462, test_loss: 1.3988, test_f1: 0.6742
 epoch: 58, train_loss: 0.4181, test_loss: 1.3481, test_f1: 0.6208
 epoch: 59, train_loss: 0.3881, test_loss: 1.2291, test_f1: 0.6667
 epoch: 60, train_loss: 0.4166, test_loss: 1.5874, test_f1: 0.6032
 epoch: 61, train_loss: 0.4272, test_loss: 1.2708, test_f1: 0.6478
 epoch: 62, train_loss: 0.4246, test_loss: 1.2756, test_f1: 0.6404
 epoch: 63, train_loss: 0.4545, test_loss: 1.7840, test_f1: 0.6027
 epoch: 64, train_loss: 0.4212, test_loss: 1.6534, test_f1: 0.6224
 epoch: 65, train_loss: 0.3863, test_loss: 1.3171, test_f1: 0.6855
 epoch: 66, train_loss: 0.3779, test_loss: 1.3488, test_f1: 0.6666
 epoch: 67, train_loss: 0.3401, test_loss: 1.4877, test_f1: 0.6403
 epoch: 68, train_loss: 0.3361, test_loss: 1.8585, test_f1: 0.6425
 epoch: 69, train_loss: 0.3695, test_loss: 1.6445, test_f1: 0.5811
 epoch: 70, train_loss: 0.3512, test_loss: 1.5313, test_f1: 0.6399
 epoch: 71, train_loss: 0.3383, test_loss: 1.7247, test_f1: 0.6800
 epoch: 72, train_loss: 0.3338, test_loss: 1.6918, test_f1: 0.6297
 epoch: 73, train_loss: 0.3367, test_loss: 1.5886, test_f1: 0.6809
 epoch: 74, train_loss: 0.3507, test_loss: 1.5148, test_f1: 0.6055
 epoch: 75, train_loss: 0.3536, test_loss: 1.5272, test_f1: 0.6962
 epoch: 76, train_loss: 0.3065, test_loss: 1.6565, test_f1: 0.6719
 epoch: 77, train_loss: 0.3511, test_loss: 1.8198, test_f1: 0.6492
 epoch: 78, train_loss: 0.3372, test_loss: 1.6220, test_f1: 0.6070
 epoch: 79, train_loss: 0.3323, test_loss: 1.7961, test_f1: 0.6664
 epoch: 80, train_loss: 0.3088, test_loss: 1.7958, test_f1: 0.6762
 epoch: 81, train_loss: 0.3677, test_loss: 1.5914, test_f1: 0.6418
 epoch: 82, train_loss: 0.3547, test_loss: 1.6391, test_f1: 0.6134
 epoch: 83, train_loss: 0.3312, test_loss: 1.6946, test_f1: 0.6289
 epoch: 84, train_loss: 0.2922, test_loss: 2.1762, test_f1: 0.6428
 epoch: 85, train_loss: 0.3108, test_loss: 1.7304, test_f1: 0.7217
 epoch: 86, train_loss: 0.2755, test_loss: 1.6730, test_f1: 0.6232
 epoch: 87, train_loss: 0.2847, test_loss: 1.8793, test_f1: 0.6687
 epoch: 88, train_loss: 0.3233, test_loss: 1.8396, test_f1: 0.6707
 epoch: 89, train_loss: 0.2938, test_loss: 1.6780, test_f1: 0.6185
 epoch: 90, train_loss: 0.3005, test_loss: 1.6081, test_f1: 0.6711
 epoch: 91, train_loss: 0.3085, test_loss: 1.7336, test_f1: 0.6065
 epoch: 92, train_loss: 0.2646, test_loss: 1.7415, test_f1: 0.6782
 epoch: 93, train_loss: 0.2507, test_loss: 1.8037, test_f1: 0.6597
 epoch: 94, train_loss: 0.2714, test_loss: 1.9512, test_f1: 0.6634
 epoch: 95, train_loss: 0.2720, test_loss: 1.9603, test_f1: 0.6629
 epoch: 96, train_loss: 0.2616, test_loss: 1.9527, test_f1: 0.6010
 epoch: 97, train_loss: 0.2812, test_loss: 1.5725, test_f1: 0.6371
 epoch: 98, train_loss: 0.2590, test_loss: 1.6334, test_f1: 0.7014
 epoch: 99, train_loss: 0.2566, test_loss: 1.6967, test_f1: 0.6335
##################ITERATION #8 ****************************************
 epoch: 0, train_loss: 1.1958, test_loss: 1.1048, test_f1: 0.4228
 epoch: 1, train_loss: 0.9526, test_loss: 1.0254, test_f1: 0.4735
 epoch: 2, train_loss: 0.9312, test_loss: 1.4135, test_f1: 0.3063
 epoch: 3, train_loss: 0.8591, test_loss: 1.1583, test_f1: 0.4348
 epoch: 4, train_loss: 0.8648, test_loss: 0.9948, test_f1: 0.4855
 epoch: 5, train_loss: 0.8238, test_loss: 1.1107, test_f1: 0.4726
 epoch: 6, train_loss: 0.8447, test_loss: 1.2381, test_f1: 0.4990
 epoch: 7, train_loss: 0.7969, test_loss: 1.2667, test_f1: 0.5000
 epoch: 8, train_loss: 0.8129, test_loss: 0.9500, test_f1: 0.6150
 epoch: 9, train_loss: 0.7793, test_loss: 1.1727, test_f1: 0.4773
 epoch: 10, train_loss: 0.8715, test_loss: 1.3857, test_f1: 0.5321
 epoch: 11, train_loss: 0.8352, test_loss: 1.0063, test_f1: 0.5982
 epoch: 12, train_loss: 0.7942, test_loss: 0.9579, test_f1: 0.5878
 epoch: 13, train_loss: 0.7484, test_loss: 0.9612, test_f1: 0.5970
 epoch: 14, train_loss: 0.7413, test_loss: 0.9827, test_f1: 0.6010
 epoch: 15, train_loss: 0.7319, test_loss: 1.0355, test_f1: 0.6289
 epoch: 16, train_loss: 0.7022, test_loss: 1.0474, test_f1: 0.6167
 epoch: 17, train_loss: 0.6886, test_loss: 1.2223, test_f1: 0.5354
 epoch: 18, train_loss: 0.6824, test_loss: 1.4587, test_f1: 0.6028
 epoch: 19, train_loss: 0.6756, test_loss: 1.0383, test_f1: 0.6191
 epoch: 20, train_loss: 0.7285, test_loss: 1.1193, test_f1: 0.5798
 epoch: 21, train_loss: 0.7294, test_loss: 1.0023, test_f1: 0.5592
 epoch: 22, train_loss: 0.6613, test_loss: 1.3646, test_f1: 0.5891
 epoch: 23, train_loss: 0.6903, test_loss: 1.3550, test_f1: 0.5623
 epoch: 24, train_loss: 0.6765, test_loss: 1.3812, test_f1: 0.5485
 epoch: 25, train_loss: 0.6618, test_loss: 1.1251, test_f1: 0.6278
 epoch: 26, train_loss: 0.6876, test_loss: 1.1099, test_f1: 0.6223
 epoch: 27, train_loss: 0.6875, test_loss: 1.3811, test_f1: 0.4999
 epoch: 28, train_loss: 0.6549, test_loss: 1.6689, test_f1: 0.5562
 epoch: 29, train_loss: 0.6395, test_loss: 1.3618, test_f1: 0.5569
 epoch: 30, train_loss: 0.6275, test_loss: 1.2799, test_f1: 0.6002
 epoch: 31, train_loss: 0.6276, test_loss: 1.3158, test_f1: 0.6751
 epoch: 32, train_loss: 0.6467, test_loss: 1.4653, test_f1: 0.6142
 epoch: 33, train_loss: 0.6036, test_loss: 1.2010, test_f1: 0.6234
 epoch: 34, train_loss: 0.6018, test_loss: 1.2005, test_f1: 0.6176
 epoch: 35, train_loss: 0.5773, test_loss: 2.0205, test_f1: 0.5853
 epoch: 36, train_loss: 0.5958, test_loss: 1.1641, test_f1: 0.6279
 epoch: 37, train_loss: 0.5949, test_loss: 1.2205, test_f1: 0.6120
 epoch: 38, train_loss: 0.5940, test_loss: 1.2459, test_f1: 0.5981
 epoch: 39, train_loss: 0.6078, test_loss: 1.3241, test_f1: 0.5880
 epoch: 40, train_loss: 0.5690, test_loss: 1.6706, test_f1: 0.5540
 epoch: 41, train_loss: 0.5759, test_loss: 1.3338, test_f1: 0.6042
 epoch: 42, train_loss: 0.5683, test_loss: 1.1954, test_f1: 0.6774
 epoch: 43, train_loss: 0.5440, test_loss: 1.2887, test_f1: 0.6214
 epoch: 44, train_loss: 0.5238, test_loss: 1.6139, test_f1: 0.6189
 epoch: 45, train_loss: 0.5317, test_loss: 1.6356, test_f1: 0.5628
 epoch: 46, train_loss: 0.5536, test_loss: 1.5002, test_f1: 0.5916
 epoch: 47, train_loss: 0.5747, test_loss: 1.6434, test_f1: 0.6056
 epoch: 48, train_loss: 0.5196, test_loss: 1.4363, test_f1: 0.6344
 epoch: 49, train_loss: 0.5497, test_loss: 1.4413, test_f1: 0.6533
 epoch: 50, train_loss: 0.4976, test_loss: 1.8145, test_f1: 0.6186
 epoch: 51, train_loss: 0.4394, test_loss: 1.6748, test_f1: 0.6249
 epoch: 52, train_loss: 0.4093, test_loss: 1.9892, test_f1: 0.6267
 epoch: 53, train_loss: 0.4186, test_loss: 1.6992, test_f1: 0.6399
 epoch: 54, train_loss: 0.3992, test_loss: 1.7676, test_f1: 0.6350
 epoch: 55, train_loss: 0.3997, test_loss: 2.0687, test_f1: 0.6356
 epoch: 56, train_loss: 0.3961, test_loss: 1.5920, test_f1: 0.6625
 epoch: 57, train_loss: 0.3936, test_loss: 1.8230, test_f1: 0.6420
 epoch: 58, train_loss: 0.3890, test_loss: 1.7157, test_f1: 0.6305
 epoch: 59, train_loss: 0.3757, test_loss: 1.9637, test_f1: 0.6152
 epoch: 60, train_loss: 0.3736, test_loss: 1.7743, test_f1: 0.6172
 epoch: 61, train_loss: 0.3669, test_loss: 2.3314, test_f1: 0.6381
 epoch: 62, train_loss: 0.3686, test_loss: 2.5625, test_f1: 0.5953
 epoch: 63, train_loss: 0.3762, test_loss: 2.0783, test_f1: 0.6010
 epoch: 64, train_loss: 0.3897, test_loss: 1.6978, test_f1: 0.6363
 epoch: 65, train_loss: 0.3447, test_loss: 1.8183, test_f1: 0.5711
 epoch: 66, train_loss: 0.3337, test_loss: 1.9589, test_f1: 0.6344
 epoch: 67, train_loss: 0.3136, test_loss: 2.2352, test_f1: 0.6395
 epoch: 68, train_loss: 0.3097, test_loss: 1.9563, test_f1: 0.6158
 epoch: 69, train_loss: 0.3275, test_loss: 2.4769, test_f1: 0.6072
 epoch: 70, train_loss: 0.2989, test_loss: 2.1527, test_f1: 0.6410
 epoch: 71, train_loss: 0.3312, test_loss: 2.3810, test_f1: 0.5967
 epoch: 72, train_loss: 0.2823, test_loss: 2.2585, test_f1: 0.6134
 epoch: 73, train_loss: 0.2407, test_loss: 2.3950, test_f1: 0.6195
 epoch: 74, train_loss: 0.2822, test_loss: 2.6919, test_f1: 0.5851
 epoch: 75, train_loss: 0.3184, test_loss: 2.1610, test_f1: 0.6112
 epoch: 76, train_loss: 0.3195, test_loss: 2.2972, test_f1: 0.6037
 epoch: 77, train_loss: 0.3325, test_loss: 2.1266, test_f1: 0.6269
 epoch: 78, train_loss: 0.3144, test_loss: 2.2490, test_f1: 0.5839
 epoch: 79, train_loss: 0.3110, test_loss: 2.4289, test_f1: 0.5824
 epoch: 80, train_loss: 0.3314, test_loss: 2.3126, test_f1: 0.6413
 epoch: 81, train_loss: 0.2836, test_loss: 2.1800, test_f1: 0.6156
 epoch: 82, train_loss: 0.2614, test_loss: 2.3461, test_f1: 0.6289
 epoch: 83, train_loss: 0.2398, test_loss: 2.7866, test_f1: 0.5879
 epoch: 84, train_loss: 0.2697, test_loss: 2.1316, test_f1: 0.6417
 epoch: 85, train_loss: 0.2512, test_loss: 2.1770, test_f1: 0.6305
 epoch: 86, train_loss: 0.2427, test_loss: 2.4132, test_f1: 0.6276
 epoch: 87, train_loss: 0.2425, test_loss: 2.4335, test_f1: 0.6301
 epoch: 88, train_loss: 0.2772, test_loss: 2.4930, test_f1: 0.6116
 epoch: 89, train_loss: 0.2516, test_loss: 2.2276, test_f1: 0.6154
 epoch: 90, train_loss: 0.2473, test_loss: 2.4340, test_f1: 0.6192
 epoch: 91, train_loss: 0.2865, test_loss: 2.0764, test_f1: 0.6401
 epoch: 92, train_loss: 0.2470, test_loss: 2.3358, test_f1: 0.6382
 epoch: 93, train_loss: 0.2174, test_loss: 2.2726, test_f1: 0.6394
 epoch: 94, train_loss: 0.2226, test_loss: 2.4935, test_f1: 0.6573
 epoch: 95, train_loss: 0.2163, test_loss: 3.2517, test_f1: 0.6287
 epoch: 96, train_loss: 0.2340, test_loss: 2.7722, test_f1: 0.5762
 epoch: 97, train_loss: 0.2102, test_loss: 2.4642, test_f1: 0.6356
 epoch: 98, train_loss: 0.2118, test_loss: 2.3855, test_f1: 0.6214
 epoch: 99, train_loss: 0.1809, test_loss: 2.6025, test_f1: 0.6325
##################ITERATION #9 ****************************************
 epoch: 0, train_loss: 1.3299, test_loss: 1.3468, test_f1: 0.2266
 epoch: 1, train_loss: 1.0333, test_loss: 1.1313, test_f1: 0.5013
 epoch: 2, train_loss: 0.9443, test_loss: 1.0421, test_f1: 0.5495
 epoch: 3, train_loss: 0.9089, test_loss: 1.3065, test_f1: 0.4655
 epoch: 4, train_loss: 0.8625, test_loss: 1.0121, test_f1: 0.5417
 epoch: 5, train_loss: 0.8287, test_loss: 1.1200, test_f1: 0.4650
 epoch: 6, train_loss: 0.8109, test_loss: 1.0908, test_f1: 0.5644
 epoch: 7, train_loss: 0.8081, test_loss: 1.2765, test_f1: 0.4537
 epoch: 8, train_loss: 0.7950, test_loss: 1.0364, test_f1: 0.5545
 epoch: 9, train_loss: 0.7726, test_loss: 1.0753, test_f1: 0.5280
 epoch: 10, train_loss: 0.7977, test_loss: 1.1486, test_f1: 0.5061
 epoch: 11, train_loss: 0.7419, test_loss: 1.6176, test_f1: 0.5022
 epoch: 12, train_loss: 0.7414, test_loss: 1.1677, test_f1: 0.5085
 epoch: 13, train_loss: 0.7400, test_loss: 1.0116, test_f1: 0.5423
 epoch: 14, train_loss: 0.7362, test_loss: 0.9751, test_f1: 0.6295
 epoch: 15, train_loss: 0.7381, test_loss: 1.2247, test_f1: 0.5106
 epoch: 16, train_loss: 0.7304, test_loss: 1.5837, test_f1: 0.4512
 epoch: 17, train_loss: 0.7314, test_loss: 1.1972, test_f1: 0.5941
 epoch: 18, train_loss: 0.7185, test_loss: 1.1198, test_f1: 0.5722
 epoch: 19, train_loss: 0.6961, test_loss: 1.0140, test_f1: 0.6112
 epoch: 20, train_loss: 0.6641, test_loss: 1.2134, test_f1: 0.6037
 epoch: 21, train_loss: 0.6502, test_loss: 1.4290, test_f1: 0.4891
 epoch: 22, train_loss: 0.6708, test_loss: 1.0264, test_f1: 0.6420
 epoch: 23, train_loss: 0.7124, test_loss: 1.0534, test_f1: 0.5254
 epoch: 24, train_loss: 0.6540, test_loss: 1.1630, test_f1: 0.5799
 epoch: 25, train_loss: 0.6501, test_loss: 1.2484, test_f1: 0.5636
 epoch: 26, train_loss: 0.6599, test_loss: 1.1769, test_f1: 0.5996
 epoch: 27, train_loss: 0.6259, test_loss: 1.1352, test_f1: 0.5735
 epoch: 28, train_loss: 0.6895, test_loss: 1.1004, test_f1: 0.5342
 epoch: 29, train_loss: 0.6497, test_loss: 1.3728, test_f1: 0.6083
 epoch: 30, train_loss: 0.6340, test_loss: 1.2042, test_f1: 0.6211
 epoch: 31, train_loss: 0.5977, test_loss: 1.4919, test_f1: 0.6092
 epoch: 32, train_loss: 0.6114, test_loss: 1.1025, test_f1: 0.5648
 epoch: 33, train_loss: 0.6073, test_loss: 1.1672, test_f1: 0.6074
 epoch: 34, train_loss: 0.5600, test_loss: 1.0810, test_f1: 0.6066
 epoch: 35, train_loss: 0.5827, test_loss: 1.6106, test_f1: 0.5853
 epoch: 36, train_loss: 0.5336, test_loss: 1.1581, test_f1: 0.6018
 epoch: 37, train_loss: 0.6244, test_loss: 1.0199, test_f1: 0.6739
 epoch: 38, train_loss: 0.5961, test_loss: 1.1871, test_f1: 0.5445
 epoch: 39, train_loss: 0.5546, test_loss: 1.2307, test_f1: 0.6152
 epoch: 40, train_loss: 0.5046, test_loss: 1.3534, test_f1: 0.6249
 epoch: 41, train_loss: 0.5118, test_loss: 1.3696, test_f1: 0.4943
 epoch: 42, train_loss: 0.5281, test_loss: 1.1872, test_f1: 0.6072
 epoch: 43, train_loss: 0.5389, test_loss: 1.2419, test_f1: 0.6186
 epoch: 44, train_loss: 0.5456, test_loss: 1.1184, test_f1: 0.6037
 epoch: 45, train_loss: 0.4721, test_loss: 1.1058, test_f1: 0.6615
 epoch: 46, train_loss: 0.4642, test_loss: 1.3974, test_f1: 0.6089
 epoch: 47, train_loss: 0.4895, test_loss: 1.3518, test_f1: 0.5593
 epoch: 48, train_loss: 0.4679, test_loss: 1.1719, test_f1: 0.6513
 epoch: 49, train_loss: 0.5114, test_loss: 1.2272, test_f1: 0.5981
 epoch: 50, train_loss: 0.4770, test_loss: 1.4727, test_f1: 0.4776
 epoch: 51, train_loss: 0.4509, test_loss: 1.3468, test_f1: 0.6418
 epoch: 52, train_loss: 0.3926, test_loss: 1.4700, test_f1: 0.6403
 epoch: 53, train_loss: 0.4028, test_loss: 1.3264, test_f1: 0.6059
 epoch: 54, train_loss: 0.3872, test_loss: 1.7065, test_f1: 0.6454
 epoch: 55, train_loss: 0.3748, test_loss: 1.4554, test_f1: 0.6498
 epoch: 56, train_loss: 0.3473, test_loss: 1.8155, test_f1: 0.6500
 epoch: 57, train_loss: 0.3486, test_loss: 1.7013, test_f1: 0.6427
 epoch: 58, train_loss: 0.3731, test_loss: 1.3912, test_f1: 0.6554
 epoch: 59, train_loss: 0.3285, test_loss: 1.6777, test_f1: 0.6628
 epoch: 60, train_loss: 0.3528, test_loss: 1.5154, test_f1: 0.6747
 epoch: 61, train_loss: 0.3601, test_loss: 1.6235, test_f1: 0.6536
 epoch: 62, train_loss: 0.3345, test_loss: 1.4720, test_f1: 0.6360
 epoch: 63, train_loss: 0.3194, test_loss: 1.6380, test_f1: 0.6129
 epoch: 64, train_loss: 0.3679, test_loss: 1.6719, test_f1: 0.6323
 epoch: 65, train_loss: 0.3086, test_loss: 1.6575, test_f1: 0.6521
 epoch: 66, train_loss: 0.2840, test_loss: 1.9872, test_f1: 0.6114
 epoch: 67, train_loss: 0.3245, test_loss: 1.5664, test_f1: 0.6423
 epoch: 68, train_loss: 0.3355, test_loss: 1.6058, test_f1: 0.6383
 epoch: 69, train_loss: 0.2794, test_loss: 1.7950, test_f1: 0.6436
 epoch: 70, train_loss: 0.2560, test_loss: 2.1692, test_f1: 0.6112
 epoch: 71, train_loss: 0.2711, test_loss: 1.6952, test_f1: 0.6444
 epoch: 72, train_loss: 0.2739, test_loss: 1.9223, test_f1: 0.6558
 epoch: 73, train_loss: 0.2671, test_loss: 1.6902, test_f1: 0.6390
 epoch: 74, train_loss: 0.2638, test_loss: 1.7324, test_f1: 0.6566
 epoch: 75, train_loss: 0.2456, test_loss: 1.9397, test_f1: 0.6366
 epoch: 76, train_loss: 0.2708, test_loss: 2.0369, test_f1: 0.6718
 epoch: 77, train_loss: 0.2591, test_loss: 1.7621, test_f1: 0.6424
 epoch: 78, train_loss: 0.3040, test_loss: 2.1490, test_f1: 0.6435
 epoch: 79, train_loss: 0.2686, test_loss: 1.9145, test_f1: 0.6612
 epoch: 80, train_loss: 0.2637, test_loss: 1.8413, test_f1: 0.6853
 epoch: 81, train_loss: 0.2308, test_loss: 1.8906, test_f1: 0.6628
 epoch: 82, train_loss: 0.2326, test_loss: 1.9744, test_f1: 0.6649
 epoch: 83, train_loss: 0.2146, test_loss: 1.9307, test_f1: 0.6503
 epoch: 84, train_loss: 0.2149, test_loss: 1.8048, test_f1: 0.6946
 epoch: 85, train_loss: 0.1883, test_loss: 2.0321, test_f1: 0.6691
 epoch: 86, train_loss: 0.2632, test_loss: 2.4080, test_f1: 0.6539
 epoch: 87, train_loss: 0.2337, test_loss: 1.9504, test_f1: 0.6399
 epoch: 88, train_loss: 0.2354, test_loss: 2.2959, test_f1: 0.6394
 epoch: 89, train_loss: 0.2633, test_loss: 1.9090, test_f1: 0.6701
 epoch: 90, train_loss: 0.1894, test_loss: 2.1186, test_f1: 0.6488
 epoch: 91, train_loss: 0.2199, test_loss: 2.2245, test_f1: 0.6258
 epoch: 92, train_loss: 0.2462, test_loss: 1.8883, test_f1: 0.6548
 epoch: 93, train_loss: 0.2519, test_loss: 1.9746, test_f1: 0.6716
 epoch: 94, train_loss: 0.2079, test_loss: 2.1467, test_f1: 0.6261
 epoch: 95, train_loss: 0.1904, test_loss: 1.9613, test_f1: 0.6414
 epoch: 96, train_loss: 0.2108, test_loss: 1.8681, test_f1: 0.6517
 epoch: 97, train_loss: 0.1633, test_loss: 2.6191, test_f1: 0.6454
 epoch: 98, train_loss: 0.2148, test_loss: 2.0018, test_f1: 0.6584
 epoch: 99, train_loss: 0.1786, test_loss: 2.3347, test_f1: 0.6569

Training completed in 422.39 seconds
Best F1: 0.7217 at epoch 85
Mean F1 across iterations: 0.6940  0.0142
========================FINAL RESULTS================================
FEGIN weighted F1: 0.7217  0.0142
python main.py --data ltspice_demos --representation component_pin --model FEGIN --layers 3 --hiddens 128 --batch_size 64 --lr 0.01 --emb_size 512 --epochs 100 --save_appendix component_pin_L3_H128_BS64_LR0.01_E512 --no_val
-----



STDERR:
  File "main.py", line 370, in <module>
    main()
  File "main.py", line 254, in main
    dataset = dataset_class(
  File "/home/philip/projects/ltspice_examples_code_repo/Circuit-Completion-Using-GNNs/component_classification_with_link_prediction_head/evaluation/FEGIN/kernel/circuit_datasets.py", line 15, in __init__
    self.data, self.slices = torch.load(self.processed_paths[0])
  File "/home/philip/.local/lib/python3.8/site-packages/torch/serialization.py", line 1040, in load
    warnings.warn(
  File "/usr/lib/python3.8/warnings.py", line 109, in _showwarnmsg
    sw(msg.message, msg.category, msg.filename, msg.lineno,
  File "main.py", line 47, in warn_with_traceback
    traceback.print_stack(file=log)
/home/philip/projects/ltspice_examples_code_repo/Circuit-Completion-Using-GNNs/component_classification_with_link_prediction_head/evaluation/FEGIN/kernel/circuit_datasets.py:15: FutureWarning: You are using `torch.load` with `weights_only=False` (the current default value), which uses the default pickle module implicitly. It is possible to construct malicious pickle data which will execute arbitrary code during unpickling (See https://github.com/pytorch/pytorch/blob/main/SECURITY.md#untrusted-models for more details). In a future release, the default value for `weights_only` will be flipped to `True`. This limits the functions that could be executed during unpickling. Arbitrary objects will no longer be allowed to be loaded via this mode unless they are explicitly allowlisted by the user via `torch.serialization.add_safe_globals`. We recommend you start setting `weights_only=True` for any use case where you don't have full control of the loaded file. Please open an issue on GitHub for any issues related to this experimental feature.
  self.data, self.slices = torch.load(self.processed_paths[0])
