STDOUT:
Results will be saved in /home/philip/projects/ltspice_examples_code_repo/Circuit-Completion-Using-GNNs/component_classification_with_link_prediction_head/evaluation/FEGIN/results/model_FEGIN_dataset_ltspice_examples
Command line input: python main.py --data ltspice_examples --representation component_component --model FEGIN --layers 4 --hiddens 16 --batch_size 128 --lr 0.001 --emb_size 250 --epochs 100 --save_appendix component_component_L4_H16_BS128_LR0.001_E250 --no_val
 is saved.
-----
ltspice_examples - FEGIN
Using 4 layers, 16 hidden units, h = 2
Loading component_component representation dataset
ENTERED
Training FEGIN on component_component representation
Train: 3556, Test: 845
##################ITERATION #0 ****************************************
 epoch: 0, train_loss: 1.3474, test_loss: 1.3455, test_f1: 0.2274
 epoch: 1, train_loss: 1.3260, test_loss: 1.3282, test_f1: 0.2274
 epoch: 2, train_loss: 1.3081, test_loss: 1.3081, test_f1: 0.2274
 epoch: 3, train_loss: 1.2875, test_loss: 1.2834, test_f1: 0.2274
 epoch: 4, train_loss: 1.2688, test_loss: 1.2536, test_f1: 0.2274
 epoch: 5, train_loss: 1.2540, test_loss: 1.2281, test_f1: 0.2274
 epoch: 6, train_loss: 1.2404, test_loss: 1.2191, test_f1: 0.2274
 epoch: 7, train_loss: 1.2357, test_loss: 1.2150, test_f1: 0.2492
 epoch: 8, train_loss: 1.2221, test_loss: 1.2048, test_f1: 0.3048
 epoch: 9, train_loss: 1.2178, test_loss: 1.2020, test_f1: 0.3217
 epoch: 10, train_loss: 1.2087, test_loss: 1.1883, test_f1: 0.3565
 epoch: 11, train_loss: 1.1935, test_loss: 1.1750, test_f1: 0.3732
 epoch: 12, train_loss: 1.1884, test_loss: 1.1615, test_f1: 0.3647
 epoch: 13, train_loss: 1.1723, test_loss: 1.1577, test_f1: 0.3849
 epoch: 14, train_loss: 1.1693, test_loss: 1.1581, test_f1: 0.4339
 epoch: 15, train_loss: 1.1539, test_loss: 1.1266, test_f1: 0.4347
 epoch: 16, train_loss: 1.1476, test_loss: 1.1323, test_f1: 0.4516
 epoch: 17, train_loss: 1.1411, test_loss: 1.1184, test_f1: 0.4429
 epoch: 18, train_loss: 1.1295, test_loss: 1.1324, test_f1: 0.4561
 epoch: 19, train_loss: 1.1207, test_loss: 1.0926, test_f1: 0.4600
 epoch: 20, train_loss: 1.1088, test_loss: 1.0773, test_f1: 0.4853
 epoch: 21, train_loss: 1.1046, test_loss: 1.0845, test_f1: 0.4704
 epoch: 22, train_loss: 1.1017, test_loss: 1.0597, test_f1: 0.4492
 epoch: 23, train_loss: 1.0839, test_loss: 1.0713, test_f1: 0.4724
 epoch: 24, train_loss: 1.0804, test_loss: 1.0780, test_f1: 0.4561
 epoch: 25, train_loss: 1.0704, test_loss: 1.0502, test_f1: 0.4711
 epoch: 26, train_loss: 1.0585, test_loss: 1.0258, test_f1: 0.4710
 epoch: 27, train_loss: 1.0609, test_loss: 1.0365, test_f1: 0.4560
 epoch: 28, train_loss: 1.0437, test_loss: 1.0822, test_f1: 0.4471
 epoch: 29, train_loss: 1.0358, test_loss: 1.0264, test_f1: 0.4534
 epoch: 30, train_loss: 1.0273, test_loss: 1.0094, test_f1: 0.4730
 epoch: 31, train_loss: 1.0134, test_loss: 1.0059, test_f1: 0.4536
 epoch: 32, train_loss: 1.0157, test_loss: 0.9996, test_f1: 0.4677
 epoch: 33, train_loss: 0.9943, test_loss: 1.0173, test_f1: 0.4613
 epoch: 34, train_loss: 1.0074, test_loss: 1.0120, test_f1: 0.4705
 epoch: 35, train_loss: 0.9922, test_loss: 1.0406, test_f1: 0.4604
 epoch: 36, train_loss: 0.9861, test_loss: 0.9929, test_f1: 0.4614
 epoch: 37, train_loss: 0.9931, test_loss: 1.0100, test_f1: 0.4562
 epoch: 38, train_loss: 0.9807, test_loss: 1.0075, test_f1: 0.4696
 epoch: 39, train_loss: 0.9686, test_loss: 0.9999, test_f1: 0.4679
 epoch: 40, train_loss: 0.9667, test_loss: 0.9877, test_f1: 0.4728
 epoch: 41, train_loss: 0.9682, test_loss: 1.0013, test_f1: 0.4787
 epoch: 42, train_loss: 0.9638, test_loss: 1.0105, test_f1: 0.4783
 epoch: 43, train_loss: 0.9569, test_loss: 0.9778, test_f1: 0.4764
 epoch: 44, train_loss: 0.9544, test_loss: 1.0513, test_f1: 0.4767
 epoch: 45, train_loss: 0.9496, test_loss: 1.0026, test_f1: 0.4955
 epoch: 46, train_loss: 0.9493, test_loss: 0.9965, test_f1: 0.4870
 epoch: 47, train_loss: 0.9493, test_loss: 1.0310, test_f1: 0.4706
 epoch: 48, train_loss: 0.9375, test_loss: 1.0011, test_f1: 0.4619
 epoch: 49, train_loss: 0.9390, test_loss: 1.0690, test_f1: 0.4655
 epoch: 50, train_loss: 0.9335, test_loss: 1.0088, test_f1: 0.4809
 epoch: 51, train_loss: 0.9179, test_loss: 1.0622, test_f1: 0.4661
 epoch: 52, train_loss: 0.9203, test_loss: 1.0411, test_f1: 0.4683
 epoch: 53, train_loss: 0.9136, test_loss: 1.0720, test_f1: 0.4829
 epoch: 54, train_loss: 0.9173, test_loss: 1.0316, test_f1: 0.4653
 epoch: 55, train_loss: 0.9142, test_loss: 1.0677, test_f1: 0.4719
 epoch: 56, train_loss: 0.9106, test_loss: 1.0315, test_f1: 0.4788
 epoch: 57, train_loss: 0.9106, test_loss: 1.0287, test_f1: 0.4697
 epoch: 58, train_loss: 0.9073, test_loss: 1.0536, test_f1: 0.4684
 epoch: 59, train_loss: 0.8931, test_loss: 1.0548, test_f1: 0.4731
 epoch: 60, train_loss: 0.8999, test_loss: 1.0756, test_f1: 0.4611
 epoch: 61, train_loss: 0.8992, test_loss: 1.0344, test_f1: 0.4733
 epoch: 62, train_loss: 0.8924, test_loss: 1.0526, test_f1: 0.4930
 epoch: 63, train_loss: 0.8923, test_loss: 1.0356, test_f1: 0.4758
 epoch: 64, train_loss: 0.9004, test_loss: 1.0334, test_f1: 0.4684
 epoch: 65, train_loss: 0.8851, test_loss: 1.0421, test_f1: 0.4774
 epoch: 66, train_loss: 0.8907, test_loss: 1.0660, test_f1: 0.4776
 epoch: 67, train_loss: 0.8823, test_loss: 1.0732, test_f1: 0.4740
 epoch: 68, train_loss: 0.8855, test_loss: 1.0910, test_f1: 0.4592
 epoch: 69, train_loss: 0.8817, test_loss: 1.0721, test_f1: 0.4659
 epoch: 70, train_loss: 0.8777, test_loss: 1.0645, test_f1: 0.4472
 epoch: 71, train_loss: 0.8783, test_loss: 1.1024, test_f1: 0.4513
 epoch: 72, train_loss: 0.8797, test_loss: 1.1224, test_f1: 0.4586
 epoch: 73, train_loss: 0.8785, test_loss: 1.0915, test_f1: 0.4446
 epoch: 74, train_loss: 0.8877, test_loss: 1.1124, test_f1: 0.4668
 epoch: 75, train_loss: 0.8910, test_loss: 1.1024, test_f1: 0.4612
 epoch: 76, train_loss: 0.8715, test_loss: 1.0769, test_f1: 0.4529
 epoch: 77, train_loss: 0.8797, test_loss: 1.0734, test_f1: 0.4797
 epoch: 78, train_loss: 0.8700, test_loss: 1.0607, test_f1: 0.4648
 epoch: 79, train_loss: 0.8706, test_loss: 1.0939, test_f1: 0.4723
 epoch: 80, train_loss: 0.8691, test_loss: 1.0592, test_f1: 0.4578
 epoch: 81, train_loss: 0.8751, test_loss: 1.1401, test_f1: 0.4563
 epoch: 82, train_loss: 0.8676, test_loss: 1.0861, test_f1: 0.4606
 epoch: 83, train_loss: 0.8747, test_loss: 1.0862, test_f1: 0.4674
 epoch: 84, train_loss: 0.8617, test_loss: 1.0918, test_f1: 0.4640
 epoch: 85, train_loss: 0.8517, test_loss: 1.0925, test_f1: 0.4626
 epoch: 86, train_loss: 0.8725, test_loss: 1.0733, test_f1: 0.4561
 epoch: 87, train_loss: 0.8613, test_loss: 1.0752, test_f1: 0.4862
 epoch: 88, train_loss: 0.8640, test_loss: 1.0650, test_f1: 0.4671
 epoch: 89, train_loss: 0.8644, test_loss: 1.1132, test_f1: 0.4753
 epoch: 90, train_loss: 0.8699, test_loss: 1.0949, test_f1: 0.4538
 epoch: 91, train_loss: 0.8610, test_loss: 1.1088, test_f1: 0.4575
 epoch: 92, train_loss: 0.8630, test_loss: 1.1206, test_f1: 0.4613
 epoch: 93, train_loss: 0.8569, test_loss: 1.0867, test_f1: 0.4875
 epoch: 94, train_loss: 0.8635, test_loss: 1.1015, test_f1: 0.4546
 epoch: 95, train_loss: 0.8416, test_loss: 1.0816, test_f1: 0.4535
 epoch: 96, train_loss: 0.8517, test_loss: 1.0880, test_f1: 0.4642
 epoch: 97, train_loss: 0.8562, test_loss: 1.1046, test_f1: 0.4599
 epoch: 98, train_loss: 0.8667, test_loss: 1.0864, test_f1: 0.4901
 epoch: 99, train_loss: 0.8442, test_loss: 1.1021, test_f1: 0.4654
##################ITERATION #1 ****************************************
 epoch: 0, train_loss: 1.3591, test_loss: 1.3159, test_f1: 0.2274
 epoch: 1, train_loss: 1.2815, test_loss: 1.2753, test_f1: 0.2555
 epoch: 2, train_loss: 1.2593, test_loss: 1.2411, test_f1: 0.2627
 epoch: 3, train_loss: 1.2389, test_loss: 1.2063, test_f1: 0.2934
 epoch: 4, train_loss: 1.2203, test_loss: 1.1651, test_f1: 0.3706
 epoch: 5, train_loss: 1.1983, test_loss: 1.1473, test_f1: 0.4018
 epoch: 6, train_loss: 1.1775, test_loss: 1.1319, test_f1: 0.4216
 epoch: 7, train_loss: 1.1692, test_loss: 1.1145, test_f1: 0.4252
 epoch: 8, train_loss: 1.1490, test_loss: 1.1128, test_f1: 0.4223
 epoch: 9, train_loss: 1.1354, test_loss: 1.0837, test_f1: 0.4407
 epoch: 10, train_loss: 1.1197, test_loss: 1.0748, test_f1: 0.4442
 epoch: 11, train_loss: 1.1147, test_loss: 1.0697, test_f1: 0.4176
 epoch: 12, train_loss: 1.1045, test_loss: 1.0447, test_f1: 0.4347
 epoch: 13, train_loss: 1.0906, test_loss: 1.0440, test_f1: 0.4530
 epoch: 14, train_loss: 1.0928, test_loss: 1.0443, test_f1: 0.4435
 epoch: 15, train_loss: 1.0790, test_loss: 1.0267, test_f1: 0.4579
 epoch: 16, train_loss: 1.0678, test_loss: 1.0112, test_f1: 0.4837
 epoch: 17, train_loss: 1.0611, test_loss: 1.0110, test_f1: 0.4440
 epoch: 18, train_loss: 1.0562, test_loss: 1.0187, test_f1: 0.4663
 epoch: 19, train_loss: 1.0501, test_loss: 1.0033, test_f1: 0.4531
 epoch: 20, train_loss: 1.0353, test_loss: 0.9797, test_f1: 0.4777
 epoch: 21, train_loss: 1.0362, test_loss: 0.9906, test_f1: 0.4644
 epoch: 22, train_loss: 1.0331, test_loss: 1.0059, test_f1: 0.4726
 epoch: 23, train_loss: 1.0156, test_loss: 1.0312, test_f1: 0.4469
 epoch: 24, train_loss: 1.0222, test_loss: 0.9904, test_f1: 0.4578
 epoch: 25, train_loss: 1.0195, test_loss: 0.9956, test_f1: 0.4701
 epoch: 26, train_loss: 1.0144, test_loss: 0.9952, test_f1: 0.4666
 epoch: 27, train_loss: 1.0176, test_loss: 0.9698, test_f1: 0.4661
 epoch: 28, train_loss: 1.0068, test_loss: 0.9505, test_f1: 0.4786
 epoch: 29, train_loss: 0.9975, test_loss: 0.9826, test_f1: 0.4677
 epoch: 30, train_loss: 1.0019, test_loss: 0.9548, test_f1: 0.4992
 epoch: 31, train_loss: 0.9904, test_loss: 0.9536, test_f1: 0.4855
 epoch: 32, train_loss: 0.9872, test_loss: 0.9563, test_f1: 0.4946
 epoch: 33, train_loss: 0.9766, test_loss: 0.9597, test_f1: 0.4659
 epoch: 34, train_loss: 0.9788, test_loss: 0.9782, test_f1: 0.4656
 epoch: 35, train_loss: 0.9781, test_loss: 0.9591, test_f1: 0.4802
 epoch: 36, train_loss: 0.9768, test_loss: 0.9723, test_f1: 0.4885
 epoch: 37, train_loss: 0.9731, test_loss: 0.9649, test_f1: 0.4912
 epoch: 38, train_loss: 0.9648, test_loss: 0.9851, test_f1: 0.4730
 epoch: 39, train_loss: 0.9604, test_loss: 0.9456, test_f1: 0.4965
 epoch: 40, train_loss: 0.9641, test_loss: 0.9858, test_f1: 0.4819
 epoch: 41, train_loss: 0.9513, test_loss: 0.9741, test_f1: 0.4922
 epoch: 42, train_loss: 0.9564, test_loss: 1.0121, test_f1: 0.4712
 epoch: 43, train_loss: 0.9583, test_loss: 0.9730, test_f1: 0.4880
 epoch: 44, train_loss: 0.9437, test_loss: 0.9821, test_f1: 0.4773
 epoch: 45, train_loss: 0.9445, test_loss: 0.9779, test_f1: 0.4874
 epoch: 46, train_loss: 0.9321, test_loss: 0.9849, test_f1: 0.4743
 epoch: 47, train_loss: 0.9273, test_loss: 0.9784, test_f1: 0.4889
 epoch: 48, train_loss: 0.9364, test_loss: 0.9986, test_f1: 0.4761
 epoch: 49, train_loss: 0.9369, test_loss: 0.9991, test_f1: 0.4734
 epoch: 50, train_loss: 0.9296, test_loss: 1.0216, test_f1: 0.4740
 epoch: 51, train_loss: 0.9245, test_loss: 0.9967, test_f1: 0.4794
 epoch: 52, train_loss: 0.9193, test_loss: 0.9987, test_f1: 0.4942
 epoch: 53, train_loss: 0.9179, test_loss: 1.0092, test_f1: 0.4910
 epoch: 54, train_loss: 0.9179, test_loss: 1.0182, test_f1: 0.4706
 epoch: 55, train_loss: 0.9132, test_loss: 0.9928, test_f1: 0.4966
 epoch: 56, train_loss: 0.8993, test_loss: 1.0060, test_f1: 0.4805
 epoch: 57, train_loss: 0.8970, test_loss: 1.0105, test_f1: 0.4901
 epoch: 58, train_loss: 0.9061, test_loss: 1.0270, test_f1: 0.4727
 epoch: 59, train_loss: 0.9099, test_loss: 1.0127, test_f1: 0.4767
 epoch: 60, train_loss: 0.8947, test_loss: 1.0169, test_f1: 0.4803
 epoch: 61, train_loss: 0.9010, test_loss: 1.0053, test_f1: 0.4848
 epoch: 62, train_loss: 0.9060, test_loss: 1.0212, test_f1: 0.4708
 epoch: 63, train_loss: 0.9023, test_loss: 1.0219, test_f1: 0.4712
 epoch: 64, train_loss: 0.8989, test_loss: 1.0115, test_f1: 0.4843
 epoch: 65, train_loss: 0.8929, test_loss: 1.0162, test_f1: 0.4787
 epoch: 66, train_loss: 0.9013, test_loss: 1.0351, test_f1: 0.4699
 epoch: 67, train_loss: 0.9026, test_loss: 1.0382, test_f1: 0.4833
 epoch: 68, train_loss: 0.8921, test_loss: 1.0369, test_f1: 0.4596
 epoch: 69, train_loss: 0.8860, test_loss: 1.0339, test_f1: 0.4668
 epoch: 70, train_loss: 0.8916, test_loss: 1.0496, test_f1: 0.4639
 epoch: 71, train_loss: 0.8994, test_loss: 1.0217, test_f1: 0.4796
 epoch: 72, train_loss: 0.8835, test_loss: 1.0488, test_f1: 0.4541
 epoch: 73, train_loss: 0.8864, test_loss: 1.0618, test_f1: 0.4658
 epoch: 74, train_loss: 0.8815, test_loss: 1.0379, test_f1: 0.4677
 epoch: 75, train_loss: 0.8884, test_loss: 1.0427, test_f1: 0.4705
 epoch: 76, train_loss: 0.8816, test_loss: 1.0653, test_f1: 0.4637
 epoch: 77, train_loss: 0.8955, test_loss: 1.0680, test_f1: 0.4607
 epoch: 78, train_loss: 0.8772, test_loss: 1.0574, test_f1: 0.4586
 epoch: 79, train_loss: 0.8754, test_loss: 1.0613, test_f1: 0.4655
 epoch: 80, train_loss: 0.8869, test_loss: 1.0780, test_f1: 0.4467
 epoch: 81, train_loss: 0.8757, test_loss: 1.0818, test_f1: 0.4825
 epoch: 82, train_loss: 0.8639, test_loss: 1.0628, test_f1: 0.4611
 epoch: 83, train_loss: 0.8675, test_loss: 1.1115, test_f1: 0.4577
 epoch: 84, train_loss: 0.8655, test_loss: 1.0674, test_f1: 0.4630
 epoch: 85, train_loss: 0.8717, test_loss: 1.1000, test_f1: 0.4729
 epoch: 86, train_loss: 0.8713, test_loss: 1.1179, test_f1: 0.4583
 epoch: 87, train_loss: 0.8744, test_loss: 1.1086, test_f1: 0.4507
 epoch: 88, train_loss: 0.8884, test_loss: 1.0831, test_f1: 0.4613
 epoch: 89, train_loss: 0.8719, test_loss: 1.0736, test_f1: 0.4551
 epoch: 90, train_loss: 0.8621, test_loss: 1.1197, test_f1: 0.4479
 epoch: 91, train_loss: 0.8651, test_loss: 1.0789, test_f1: 0.4657
 epoch: 92, train_loss: 0.8585, test_loss: 1.1327, test_f1: 0.4545
 epoch: 93, train_loss: 0.8604, test_loss: 1.0601, test_f1: 0.4530
 epoch: 94, train_loss: 0.8547, test_loss: 1.1577, test_f1: 0.4399
 epoch: 95, train_loss: 0.8633, test_loss: 1.0626, test_f1: 0.4673
 epoch: 96, train_loss: 0.8631, test_loss: 1.1227, test_f1: 0.4521
 epoch: 97, train_loss: 0.8601, test_loss: 1.1273, test_f1: 0.4689
 epoch: 98, train_loss: 0.8561, test_loss: 1.0892, test_f1: 0.4430
 epoch: 99, train_loss: 0.8642, test_loss: 1.0763, test_f1: 0.4633
##################ITERATION #2 ****************************************
 epoch: 0, train_loss: 1.3750, test_loss: 1.3209, test_f1: 0.2274
 epoch: 1, train_loss: 1.2858, test_loss: 1.2751, test_f1: 0.2322
 epoch: 2, train_loss: 1.2670, test_loss: 1.2479, test_f1: 0.2613
 epoch: 3, train_loss: 1.2540, test_loss: 1.2365, test_f1: 0.2555
 epoch: 4, train_loss: 1.2393, test_loss: 1.2173, test_f1: 0.2783
 epoch: 5, train_loss: 1.2350, test_loss: 1.2051, test_f1: 0.2805
 epoch: 6, train_loss: 1.2254, test_loss: 1.1973, test_f1: 0.3023
 epoch: 7, train_loss: 1.2152, test_loss: 1.1898, test_f1: 0.3261
 epoch: 8, train_loss: 1.2087, test_loss: 1.1809, test_f1: 0.3730
 epoch: 9, train_loss: 1.1990, test_loss: 1.1733, test_f1: 0.3737
 epoch: 10, train_loss: 1.1933, test_loss: 1.1637, test_f1: 0.3708
 epoch: 11, train_loss: 1.1801, test_loss: 1.1587, test_f1: 0.3867
 epoch: 12, train_loss: 1.1724, test_loss: 1.1441, test_f1: 0.3912
 epoch: 13, train_loss: 1.1603, test_loss: 1.1406, test_f1: 0.3974
 epoch: 14, train_loss: 1.1560, test_loss: 1.1209, test_f1: 0.4167
 epoch: 15, train_loss: 1.1417, test_loss: 1.1149, test_f1: 0.4134
 epoch: 16, train_loss: 1.1439, test_loss: 1.1059, test_f1: 0.4273
 epoch: 17, train_loss: 1.1346, test_loss: 1.1165, test_f1: 0.4093
 epoch: 18, train_loss: 1.1322, test_loss: 1.1016, test_f1: 0.4306
 epoch: 19, train_loss: 1.1191, test_loss: 1.0984, test_f1: 0.4509
 epoch: 20, train_loss: 1.1198, test_loss: 1.0811, test_f1: 0.4455
 epoch: 21, train_loss: 1.1092, test_loss: 1.0819, test_f1: 0.4277
 epoch: 22, train_loss: 1.0964, test_loss: 1.0761, test_f1: 0.4398
 epoch: 23, train_loss: 1.0928, test_loss: 1.0555, test_f1: 0.4429
 epoch: 24, train_loss: 1.1024, test_loss: 1.0518, test_f1: 0.4484
 epoch: 25, train_loss: 1.0842, test_loss: 1.0622, test_f1: 0.4649
 epoch: 26, train_loss: 1.0816, test_loss: 1.0594, test_f1: 0.4429
 epoch: 27, train_loss: 1.0799, test_loss: 1.0395, test_f1: 0.4550
 epoch: 28, train_loss: 1.0568, test_loss: 1.0681, test_f1: 0.4292
 epoch: 29, train_loss: 1.0615, test_loss: 1.0417, test_f1: 0.4494
 epoch: 30, train_loss: 1.0482, test_loss: 1.0388, test_f1: 0.4561
 epoch: 31, train_loss: 1.0488, test_loss: 1.0516, test_f1: 0.4284
 epoch: 32, train_loss: 1.0444, test_loss: 1.0460, test_f1: 0.4496
 epoch: 33, train_loss: 1.0470, test_loss: 1.0316, test_f1: 0.4425
 epoch: 34, train_loss: 1.0407, test_loss: 1.0414, test_f1: 0.4502
 epoch: 35, train_loss: 1.0268, test_loss: 1.0296, test_f1: 0.4724
 epoch: 36, train_loss: 1.0263, test_loss: 1.0319, test_f1: 0.4483
 epoch: 37, train_loss: 1.0321, test_loss: 1.0368, test_f1: 0.4474
 epoch: 38, train_loss: 1.0269, test_loss: 1.0294, test_f1: 0.4440
 epoch: 39, train_loss: 1.0117, test_loss: 1.0127, test_f1: 0.4473
 epoch: 40, train_loss: 1.0135, test_loss: 1.0177, test_f1: 0.4431
 epoch: 41, train_loss: 1.0205, test_loss: 1.0441, test_f1: 0.4503
 epoch: 42, train_loss: 0.9975, test_loss: 1.0424, test_f1: 0.4615
 epoch: 43, train_loss: 1.0036, test_loss: 1.0327, test_f1: 0.4609
 epoch: 44, train_loss: 1.0005, test_loss: 1.0276, test_f1: 0.4494
 epoch: 45, train_loss: 0.9924, test_loss: 1.0578, test_f1: 0.4500
 epoch: 46, train_loss: 0.9933, test_loss: 1.0445, test_f1: 0.4537
 epoch: 47, train_loss: 0.9979, test_loss: 1.0309, test_f1: 0.4671
 epoch: 48, train_loss: 0.9872, test_loss: 1.0372, test_f1: 0.4800
 epoch: 49, train_loss: 0.9855, test_loss: 1.0260, test_f1: 0.4597
 epoch: 50, train_loss: 0.9835, test_loss: 1.0363, test_f1: 0.4710
 epoch: 51, train_loss: 0.9733, test_loss: 1.0240, test_f1: 0.4578
 epoch: 52, train_loss: 0.9697, test_loss: 1.0302, test_f1: 0.4560
 epoch: 53, train_loss: 0.9610, test_loss: 1.0307, test_f1: 0.4730
 epoch: 54, train_loss: 0.9591, test_loss: 1.0318, test_f1: 0.4731
 epoch: 55, train_loss: 0.9646, test_loss: 1.0267, test_f1: 0.4680
 epoch: 56, train_loss: 0.9675, test_loss: 1.0356, test_f1: 0.4640
 epoch: 57, train_loss: 0.9556, test_loss: 1.0185, test_f1: 0.4672
 epoch: 58, train_loss: 0.9557, test_loss: 1.0237, test_f1: 0.4780
 epoch: 59, train_loss: 0.9561, test_loss: 1.0276, test_f1: 0.4772
 epoch: 60, train_loss: 0.9536, test_loss: 1.0477, test_f1: 0.4703
 epoch: 61, train_loss: 0.9605, test_loss: 1.0342, test_f1: 0.4654
 epoch: 62, train_loss: 0.9499, test_loss: 1.0482, test_f1: 0.4725
 epoch: 63, train_loss: 0.9527, test_loss: 1.0315, test_f1: 0.4766
 epoch: 64, train_loss: 0.9494, test_loss: 1.0525, test_f1: 0.4766
 epoch: 65, train_loss: 0.9353, test_loss: 1.0425, test_f1: 0.4712
 epoch: 66, train_loss: 0.9457, test_loss: 1.0316, test_f1: 0.4715
 epoch: 67, train_loss: 0.9416, test_loss: 1.0164, test_f1: 0.4876
 epoch: 68, train_loss: 0.9437, test_loss: 1.0369, test_f1: 0.4763
 epoch: 69, train_loss: 0.9389, test_loss: 1.0248, test_f1: 0.4685
 epoch: 70, train_loss: 0.9446, test_loss: 1.0283, test_f1: 0.4834
 epoch: 71, train_loss: 0.9444, test_loss: 1.0356, test_f1: 0.4874
 epoch: 72, train_loss: 0.9312, test_loss: 1.0395, test_f1: 0.4735
 epoch: 73, train_loss: 0.9374, test_loss: 1.0452, test_f1: 0.4801
 epoch: 74, train_loss: 0.9329, test_loss: 1.0474, test_f1: 0.4823
 epoch: 75, train_loss: 0.9277, test_loss: 1.0377, test_f1: 0.4721
 epoch: 76, train_loss: 0.9370, test_loss: 1.0350, test_f1: 0.4784
 epoch: 77, train_loss: 0.9301, test_loss: 1.0480, test_f1: 0.4832
 epoch: 78, train_loss: 0.9258, test_loss: 1.0298, test_f1: 0.4765
 epoch: 79, train_loss: 0.9260, test_loss: 1.0460, test_f1: 0.4823
 epoch: 80, train_loss: 0.9246, test_loss: 1.0596, test_f1: 0.4696
 epoch: 81, train_loss: 0.9305, test_loss: 1.0555, test_f1: 0.4866
 epoch: 82, train_loss: 0.9315, test_loss: 1.0465, test_f1: 0.4842
 epoch: 83, train_loss: 0.9236, test_loss: 1.0378, test_f1: 0.4840
 epoch: 84, train_loss: 0.9320, test_loss: 1.0443, test_f1: 0.4933
 epoch: 85, train_loss: 0.9209, test_loss: 1.0258, test_f1: 0.4738
 epoch: 86, train_loss: 0.9226, test_loss: 1.0458, test_f1: 0.4804
 epoch: 87, train_loss: 0.9154, test_loss: 1.0306, test_f1: 0.4894
 epoch: 88, train_loss: 0.9096, test_loss: 1.0269, test_f1: 0.4895
 epoch: 89, train_loss: 0.9250, test_loss: 1.0411, test_f1: 0.4795
 epoch: 90, train_loss: 0.9156, test_loss: 1.0542, test_f1: 0.4747
 epoch: 91, train_loss: 0.9112, test_loss: 1.0518, test_f1: 0.4746
 epoch: 92, train_loss: 0.9248, test_loss: 1.0335, test_f1: 0.4871
 epoch: 93, train_loss: 0.9191, test_loss: 1.0569, test_f1: 0.4858
 epoch: 94, train_loss: 0.9097, test_loss: 1.0420, test_f1: 0.4899
 epoch: 95, train_loss: 0.8954, test_loss: 1.0324, test_f1: 0.4841
 epoch: 96, train_loss: 0.9173, test_loss: 1.0636, test_f1: 0.4851
 epoch: 97, train_loss: 0.8924, test_loss: 1.0463, test_f1: 0.4828
 epoch: 98, train_loss: 0.9043, test_loss: 1.0610, test_f1: 0.4878
 epoch: 99, train_loss: 0.9020, test_loss: 1.0491, test_f1: 0.4782
##################ITERATION #3 ****************************************
 epoch: 0, train_loss: 1.3289, test_loss: 1.2826, test_f1: 0.2274
 epoch: 1, train_loss: 1.2639, test_loss: 1.2389, test_f1: 0.2773
 epoch: 2, train_loss: 1.2391, test_loss: 1.2037, test_f1: 0.3338
 epoch: 3, train_loss: 1.2271, test_loss: 1.1776, test_f1: 0.3474
 epoch: 4, train_loss: 1.2093, test_loss: 1.1652, test_f1: 0.3975
 epoch: 5, train_loss: 1.1976, test_loss: 1.1435, test_f1: 0.4107
 epoch: 6, train_loss: 1.1837, test_loss: 1.1245, test_f1: 0.4160
 epoch: 7, train_loss: 1.1768, test_loss: 1.1207, test_f1: 0.4163
 epoch: 8, train_loss: 1.1703, test_loss: 1.1024, test_f1: 0.4399
 epoch: 9, train_loss: 1.1486, test_loss: 1.0828, test_f1: 0.4485
 epoch: 10, train_loss: 1.1486, test_loss: 1.0746, test_f1: 0.4548
 epoch: 11, train_loss: 1.1450, test_loss: 1.0678, test_f1: 0.4459
 epoch: 12, train_loss: 1.1271, test_loss: 1.0572, test_f1: 0.4534
 epoch: 13, train_loss: 1.1308, test_loss: 1.0409, test_f1: 0.4598
 epoch: 14, train_loss: 1.1237, test_loss: 1.0307, test_f1: 0.4651
 epoch: 15, train_loss: 1.1100, test_loss: 1.0264, test_f1: 0.4741
 epoch: 16, train_loss: 1.1013, test_loss: 1.0258, test_f1: 0.4715
 epoch: 17, train_loss: 1.0904, test_loss: 1.0123, test_f1: 0.4763
 epoch: 18, train_loss: 1.0900, test_loss: 1.0070, test_f1: 0.4727
 epoch: 19, train_loss: 1.0839, test_loss: 1.0100, test_f1: 0.4735
 epoch: 20, train_loss: 1.0790, test_loss: 0.9927, test_f1: 0.4884
 epoch: 21, train_loss: 1.0674, test_loss: 0.9939, test_f1: 0.4784
 epoch: 22, train_loss: 1.0644, test_loss: 0.9911, test_f1: 0.4900
 epoch: 23, train_loss: 1.0571, test_loss: 0.9836, test_f1: 0.4796
 epoch: 24, train_loss: 1.0578, test_loss: 0.9804, test_f1: 0.4944
 epoch: 25, train_loss: 1.0482, test_loss: 0.9712, test_f1: 0.4891
 epoch: 26, train_loss: 1.0462, test_loss: 0.9635, test_f1: 0.5010
 epoch: 27, train_loss: 1.0451, test_loss: 0.9792, test_f1: 0.4759
 epoch: 28, train_loss: 1.0498, test_loss: 0.9556, test_f1: 0.4970
 epoch: 29, train_loss: 1.0355, test_loss: 0.9576, test_f1: 0.4857
 epoch: 30, train_loss: 1.0184, test_loss: 0.9648, test_f1: 0.4820
 epoch: 31, train_loss: 1.0121, test_loss: 0.9478, test_f1: 0.4892
 epoch: 32, train_loss: 1.0221, test_loss: 0.9587, test_f1: 0.4889
 epoch: 33, train_loss: 1.0046, test_loss: 0.9510, test_f1: 0.4888
 epoch: 34, train_loss: 1.0093, test_loss: 0.9561, test_f1: 0.4822
 epoch: 35, train_loss: 1.0008, test_loss: 0.9365, test_f1: 0.4924
 epoch: 36, train_loss: 0.9903, test_loss: 0.9371, test_f1: 0.4796
 epoch: 37, train_loss: 1.0083, test_loss: 0.9466, test_f1: 0.4936
 epoch: 38, train_loss: 0.9886, test_loss: 0.9447, test_f1: 0.4833
 epoch: 39, train_loss: 0.9953, test_loss: 0.9394, test_f1: 0.4925
 epoch: 40, train_loss: 0.9919, test_loss: 0.9385, test_f1: 0.4922
 epoch: 41, train_loss: 0.9768, test_loss: 0.9382, test_f1: 0.4972
 epoch: 42, train_loss: 0.9782, test_loss: 0.9476, test_f1: 0.4928
 epoch: 43, train_loss: 0.9789, test_loss: 0.9357, test_f1: 0.4901
 epoch: 44, train_loss: 0.9708, test_loss: 0.9174, test_f1: 0.5102
 epoch: 45, train_loss: 0.9699, test_loss: 0.9114, test_f1: 0.5098
 epoch: 46, train_loss: 0.9672, test_loss: 0.9223, test_f1: 0.5012
 epoch: 47, train_loss: 0.9516, test_loss: 0.9203, test_f1: 0.5074
 epoch: 48, train_loss: 0.9499, test_loss: 0.9102, test_f1: 0.5029
 epoch: 49, train_loss: 0.9405, test_loss: 0.9132, test_f1: 0.4963
 epoch: 50, train_loss: 0.9565, test_loss: 0.9266, test_f1: 0.4998
 epoch: 51, train_loss: 0.9473, test_loss: 0.9137, test_f1: 0.4946
 epoch: 52, train_loss: 0.9432, test_loss: 0.9107, test_f1: 0.4946
 epoch: 53, train_loss: 0.9449, test_loss: 0.9109, test_f1: 0.4995
 epoch: 54, train_loss: 0.9360, test_loss: 0.9114, test_f1: 0.4902
 epoch: 55, train_loss: 0.9280, test_loss: 0.9242, test_f1: 0.4772
 epoch: 56, train_loss: 0.9352, test_loss: 0.9200, test_f1: 0.4980
 epoch: 57, train_loss: 0.9269, test_loss: 0.9181, test_f1: 0.4932
 epoch: 58, train_loss: 0.9264, test_loss: 0.9124, test_f1: 0.4952
 epoch: 59, train_loss: 0.9344, test_loss: 0.9173, test_f1: 0.4915
 epoch: 60, train_loss: 0.9269, test_loss: 0.9161, test_f1: 0.4882
 epoch: 61, train_loss: 0.9323, test_loss: 0.9095, test_f1: 0.4967
 epoch: 62, train_loss: 0.9263, test_loss: 0.9187, test_f1: 0.4906
 epoch: 63, train_loss: 0.9181, test_loss: 0.9143, test_f1: 0.4845
 epoch: 64, train_loss: 0.9169, test_loss: 0.9106, test_f1: 0.5006
 epoch: 65, train_loss: 0.9186, test_loss: 0.9073, test_f1: 0.5018
 epoch: 66, train_loss: 0.9305, test_loss: 0.9127, test_f1: 0.4957
 epoch: 67, train_loss: 0.9220, test_loss: 0.9195, test_f1: 0.4961
 epoch: 68, train_loss: 0.9130, test_loss: 0.8987, test_f1: 0.4982
 epoch: 69, train_loss: 0.9170, test_loss: 0.9112, test_f1: 0.5022
 epoch: 70, train_loss: 0.9116, test_loss: 0.9056, test_f1: 0.4964
 epoch: 71, train_loss: 0.9131, test_loss: 0.9194, test_f1: 0.4900
 epoch: 72, train_loss: 0.9236, test_loss: 0.9169, test_f1: 0.4914
 epoch: 73, train_loss: 0.9193, test_loss: 0.9022, test_f1: 0.5102
 epoch: 74, train_loss: 0.9181, test_loss: 0.9096, test_f1: 0.5029
 epoch: 75, train_loss: 0.9101, test_loss: 0.9056, test_f1: 0.4887
 epoch: 76, train_loss: 0.9045, test_loss: 0.9113, test_f1: 0.4904
 epoch: 77, train_loss: 0.9110, test_loss: 0.9121, test_f1: 0.5028
 epoch: 78, train_loss: 0.8998, test_loss: 0.9034, test_f1: 0.5031
 epoch: 79, train_loss: 0.9066, test_loss: 0.9019, test_f1: 0.4950
 epoch: 80, train_loss: 0.9044, test_loss: 0.9135, test_f1: 0.4905
 epoch: 81, train_loss: 0.9127, test_loss: 0.9112, test_f1: 0.4956
 epoch: 82, train_loss: 0.9138, test_loss: 0.9103, test_f1: 0.4980
 epoch: 83, train_loss: 0.9013, test_loss: 0.9011, test_f1: 0.5057
 epoch: 84, train_loss: 0.8984, test_loss: 0.9041, test_f1: 0.4972
 epoch: 85, train_loss: 0.9119, test_loss: 0.9089, test_f1: 0.4939
 epoch: 86, train_loss: 0.8930, test_loss: 0.9083, test_f1: 0.4969
 epoch: 87, train_loss: 0.9008, test_loss: 0.9000, test_f1: 0.4978
 epoch: 88, train_loss: 0.9068, test_loss: 0.9062, test_f1: 0.4904
 epoch: 89, train_loss: 0.8953, test_loss: 0.9036, test_f1: 0.5004
 epoch: 90, train_loss: 0.9028, test_loss: 0.9125, test_f1: 0.4970
 epoch: 91, train_loss: 0.9001, test_loss: 0.9044, test_f1: 0.5056
 epoch: 92, train_loss: 0.8953, test_loss: 0.9083, test_f1: 0.4910
 epoch: 93, train_loss: 0.8856, test_loss: 0.9104, test_f1: 0.4890
 epoch: 94, train_loss: 0.8925, test_loss: 0.9049, test_f1: 0.5077
 epoch: 95, train_loss: 0.8989, test_loss: 0.9150, test_f1: 0.5012
 epoch: 96, train_loss: 0.8852, test_loss: 0.9123, test_f1: 0.4985
 epoch: 97, train_loss: 0.8861, test_loss: 0.9210, test_f1: 0.4979
 epoch: 98, train_loss: 0.8786, test_loss: 0.9211, test_f1: 0.4855
 epoch: 99, train_loss: 0.8856, test_loss: 0.9102, test_f1: 0.4946
##################ITERATION #4 ****************************************
 epoch: 0, train_loss: 1.3588, test_loss: 1.2956, test_f1: 0.2274
 epoch: 1, train_loss: 1.2588, test_loss: 1.2515, test_f1: 0.2300
 epoch: 2, train_loss: 1.2376, test_loss: 1.2230, test_f1: 0.2782
 epoch: 3, train_loss: 1.2343, test_loss: 1.1998, test_f1: 0.3275
 epoch: 4, train_loss: 1.2205, test_loss: 1.1976, test_f1: 0.3355
 epoch: 5, train_loss: 1.2115, test_loss: 1.1901, test_f1: 0.3430
 epoch: 6, train_loss: 1.2029, test_loss: 1.1776, test_f1: 0.3459
 epoch: 7, train_loss: 1.1949, test_loss: 1.1729, test_f1: 0.3851
 epoch: 8, train_loss: 1.1923, test_loss: 1.1542, test_f1: 0.3773
 epoch: 9, train_loss: 1.1708, test_loss: 1.1593, test_f1: 0.3888
 epoch: 10, train_loss: 1.1682, test_loss: 1.1383, test_f1: 0.3998
 epoch: 11, train_loss: 1.1616, test_loss: 1.1375, test_f1: 0.4030
 epoch: 12, train_loss: 1.1559, test_loss: 1.1218, test_f1: 0.4042
 epoch: 13, train_loss: 1.1489, test_loss: 1.1147, test_f1: 0.4228
 epoch: 14, train_loss: 1.1452, test_loss: 1.1187, test_f1: 0.4051
 epoch: 15, train_loss: 1.1398, test_loss: 1.1121, test_f1: 0.4010
 epoch: 16, train_loss: 1.1355, test_loss: 1.0993, test_f1: 0.4158
 epoch: 17, train_loss: 1.1195, test_loss: 1.0976, test_f1: 0.3841
 epoch: 18, train_loss: 1.1210, test_loss: 1.1026, test_f1: 0.4079
 epoch: 19, train_loss: 1.1228, test_loss: 1.0970, test_f1: 0.4068
 epoch: 20, train_loss: 1.1029, test_loss: 1.0883, test_f1: 0.4119
 epoch: 21, train_loss: 1.1045, test_loss: 1.0812, test_f1: 0.4003
 epoch: 22, train_loss: 1.0987, test_loss: 1.0936, test_f1: 0.4253
 epoch: 23, train_loss: 1.0967, test_loss: 1.0806, test_f1: 0.3921
 epoch: 24, train_loss: 1.0885, test_loss: 1.0677, test_f1: 0.4145
 epoch: 25, train_loss: 1.0860, test_loss: 1.0672, test_f1: 0.4114
 epoch: 26, train_loss: 1.0754, test_loss: 1.0537, test_f1: 0.4152
 epoch: 27, train_loss: 1.0798, test_loss: 1.0577, test_f1: 0.4211
 epoch: 28, train_loss: 1.0742, test_loss: 1.0602, test_f1: 0.4217
 epoch: 29, train_loss: 1.0615, test_loss: 1.0556, test_f1: 0.4056
 epoch: 30, train_loss: 1.0516, test_loss: 1.0486, test_f1: 0.3941
 epoch: 31, train_loss: 1.0615, test_loss: 1.0453, test_f1: 0.4208
 epoch: 32, train_loss: 1.0596, test_loss: 1.0565, test_f1: 0.4084
 epoch: 33, train_loss: 1.0516, test_loss: 1.0470, test_f1: 0.4141
 epoch: 34, train_loss: 1.0522, test_loss: 1.0389, test_f1: 0.4331
 epoch: 35, train_loss: 1.0525, test_loss: 1.0309, test_f1: 0.4330
 epoch: 36, train_loss: 1.0358, test_loss: 1.0378, test_f1: 0.4329
 epoch: 37, train_loss: 1.0371, test_loss: 1.0272, test_f1: 0.4334
 epoch: 38, train_loss: 1.0357, test_loss: 1.0403, test_f1: 0.4254
 epoch: 39, train_loss: 1.0308, test_loss: 1.0311, test_f1: 0.4244
 epoch: 40, train_loss: 1.0266, test_loss: 1.0380, test_f1: 0.4482
 epoch: 41, train_loss: 1.0273, test_loss: 1.0114, test_f1: 0.4691
 epoch: 42, train_loss: 1.0244, test_loss: 1.0440, test_f1: 0.4368
 epoch: 43, train_loss: 1.0139, test_loss: 1.0397, test_f1: 0.4427
 epoch: 44, train_loss: 1.0062, test_loss: 1.0092, test_f1: 0.4578
 epoch: 45, train_loss: 1.0026, test_loss: 1.0629, test_f1: 0.4304
 epoch: 46, train_loss: 0.9965, test_loss: 1.0477, test_f1: 0.4375
 epoch: 47, train_loss: 0.9990, test_loss: 1.0680, test_f1: 0.4278
 epoch: 48, train_loss: 0.9901, test_loss: 1.0200, test_f1: 0.4417
 epoch: 49, train_loss: 0.9933, test_loss: 1.0600, test_f1: 0.4393
 epoch: 50, train_loss: 0.9887, test_loss: 1.0339, test_f1: 0.4438
 epoch: 51, train_loss: 0.9886, test_loss: 1.0268, test_f1: 0.4504
 epoch: 52, train_loss: 0.9718, test_loss: 1.0306, test_f1: 0.4631
 epoch: 53, train_loss: 0.9695, test_loss: 1.0400, test_f1: 0.4476
 epoch: 54, train_loss: 0.9688, test_loss: 1.0311, test_f1: 0.4529
 epoch: 55, train_loss: 0.9699, test_loss: 1.0507, test_f1: 0.4566
 epoch: 56, train_loss: 0.9608, test_loss: 1.0363, test_f1: 0.4682
 epoch: 57, train_loss: 0.9663, test_loss: 1.0249, test_f1: 0.4621
 epoch: 58, train_loss: 0.9673, test_loss: 1.0547, test_f1: 0.4640
 epoch: 59, train_loss: 0.9516, test_loss: 1.0162, test_f1: 0.4629
 epoch: 60, train_loss: 0.9548, test_loss: 1.0248, test_f1: 0.4659
 epoch: 61, train_loss: 0.9626, test_loss: 1.0409, test_f1: 0.4683
 epoch: 62, train_loss: 0.9562, test_loss: 1.0286, test_f1: 0.4678
 epoch: 63, train_loss: 0.9455, test_loss: 1.0323, test_f1: 0.4593
 epoch: 64, train_loss: 0.9560, test_loss: 1.0420, test_f1: 0.4597
 epoch: 65, train_loss: 0.9455, test_loss: 1.0405, test_f1: 0.4646
 epoch: 66, train_loss: 0.9458, test_loss: 1.0343, test_f1: 0.4562
 epoch: 67, train_loss: 0.9420, test_loss: 1.0219, test_f1: 0.4684
 epoch: 68, train_loss: 0.9456, test_loss: 1.0397, test_f1: 0.4710
 epoch: 69, train_loss: 0.9463, test_loss: 1.0370, test_f1: 0.4518
 epoch: 70, train_loss: 0.9474, test_loss: 1.0257, test_f1: 0.4780
 epoch: 71, train_loss: 0.9456, test_loss: 1.0478, test_f1: 0.4715
 epoch: 72, train_loss: 0.9475, test_loss: 1.0120, test_f1: 0.4673
 epoch: 73, train_loss: 0.9387, test_loss: 1.0447, test_f1: 0.4633
 epoch: 74, train_loss: 0.9413, test_loss: 1.0319, test_f1: 0.4759
 epoch: 75, train_loss: 0.9275, test_loss: 1.0452, test_f1: 0.4530
 epoch: 76, train_loss: 0.9333, test_loss: 1.0369, test_f1: 0.4580
 epoch: 77, train_loss: 0.9293, test_loss: 1.0468, test_f1: 0.4637
 epoch: 78, train_loss: 0.9218, test_loss: 1.0636, test_f1: 0.4609
 epoch: 79, train_loss: 0.9359, test_loss: 1.0470, test_f1: 0.4837
 epoch: 80, train_loss: 0.9254, test_loss: 1.0515, test_f1: 0.4534
 epoch: 81, train_loss: 0.9364, test_loss: 1.0504, test_f1: 0.4678
 epoch: 82, train_loss: 0.9332, test_loss: 1.0439, test_f1: 0.4666
 epoch: 83, train_loss: 0.9301, test_loss: 1.0677, test_f1: 0.4634
 epoch: 84, train_loss: 0.9197, test_loss: 1.0457, test_f1: 0.4734
 epoch: 85, train_loss: 0.9174, test_loss: 1.0271, test_f1: 0.4781
 epoch: 86, train_loss: 0.9209, test_loss: 1.0448, test_f1: 0.4833
 epoch: 87, train_loss: 0.9154, test_loss: 1.0525, test_f1: 0.4781
 epoch: 88, train_loss: 0.9247, test_loss: 1.0694, test_f1: 0.4580
 epoch: 89, train_loss: 0.9104, test_loss: 1.0786, test_f1: 0.4703
 epoch: 90, train_loss: 0.9133, test_loss: 1.0594, test_f1: 0.4699
 epoch: 91, train_loss: 0.9068, test_loss: 1.0515, test_f1: 0.4702
 epoch: 92, train_loss: 0.9055, test_loss: 1.0641, test_f1: 0.4838
 epoch: 93, train_loss: 0.9072, test_loss: 1.0614, test_f1: 0.4554
 epoch: 94, train_loss: 0.9091, test_loss: 1.0615, test_f1: 0.4695
 epoch: 95, train_loss: 0.9079, test_loss: 1.0553, test_f1: 0.4734
 epoch: 96, train_loss: 0.9034, test_loss: 1.0676, test_f1: 0.4670
 epoch: 97, train_loss: 0.9001, test_loss: 1.0767, test_f1: 0.4653
 epoch: 98, train_loss: 0.9047, test_loss: 1.0820, test_f1: 0.4573
 epoch: 99, train_loss: 0.9012, test_loss: 1.0879, test_f1: 0.4562
##################ITERATION #5 ****************************************
 epoch: 0, train_loss: 1.3661, test_loss: 1.3169, test_f1: 0.2274
 epoch: 1, train_loss: 1.2545, test_loss: 1.2638, test_f1: 0.2447
 epoch: 2, train_loss: 1.2408, test_loss: 1.2255, test_f1: 0.2884
 epoch: 3, train_loss: 1.2229, test_loss: 1.2075, test_f1: 0.3251
 epoch: 4, train_loss: 1.2025, test_loss: 1.1925, test_f1: 0.3537
 epoch: 5, train_loss: 1.2099, test_loss: 1.1865, test_f1: 0.3673
 epoch: 6, train_loss: 1.1860, test_loss: 1.1677, test_f1: 0.3970
 epoch: 7, train_loss: 1.1853, test_loss: 1.1619, test_f1: 0.4006
 epoch: 8, train_loss: 1.1783, test_loss: 1.1464, test_f1: 0.4031
 epoch: 9, train_loss: 1.1658, test_loss: 1.1288, test_f1: 0.4326
 epoch: 10, train_loss: 1.1599, test_loss: 1.1185, test_f1: 0.4237
 epoch: 11, train_loss: 1.1473, test_loss: 1.0970, test_f1: 0.4407
 epoch: 12, train_loss: 1.1414, test_loss: 1.0972, test_f1: 0.4257
 epoch: 13, train_loss: 1.1294, test_loss: 1.0944, test_f1: 0.4229
 epoch: 14, train_loss: 1.1205, test_loss: 1.0778, test_f1: 0.4571
 epoch: 15, train_loss: 1.1187, test_loss: 1.0758, test_f1: 0.4472
 epoch: 16, train_loss: 1.1038, test_loss: 1.0625, test_f1: 0.4575
 epoch: 17, train_loss: 1.0998, test_loss: 1.0549, test_f1: 0.4324
 epoch: 18, train_loss: 1.0861, test_loss: 1.0496, test_f1: 0.4482
 epoch: 19, train_loss: 1.0812, test_loss: 1.0547, test_f1: 0.4406
 epoch: 20, train_loss: 1.0673, test_loss: 1.0396, test_f1: 0.4480
 epoch: 21, train_loss: 1.0647, test_loss: 1.0324, test_f1: 0.4581
 epoch: 22, train_loss: 1.0635, test_loss: 1.0446, test_f1: 0.4598
 epoch: 23, train_loss: 1.0418, test_loss: 1.0271, test_f1: 0.4483
 epoch: 24, train_loss: 1.0511, test_loss: 1.0299, test_f1: 0.4589
 epoch: 25, train_loss: 1.0365, test_loss: 1.0074, test_f1: 0.4675
 epoch: 26, train_loss: 1.0321, test_loss: 1.0322, test_f1: 0.4658
 epoch: 27, train_loss: 1.0406, test_loss: 1.0287, test_f1: 0.4575
 epoch: 28, train_loss: 1.0250, test_loss: 1.0302, test_f1: 0.4815
 epoch: 29, train_loss: 1.0080, test_loss: 1.0071, test_f1: 0.4746
 epoch: 30, train_loss: 1.0097, test_loss: 1.0413, test_f1: 0.4743
 epoch: 31, train_loss: 1.0105, test_loss: 1.0399, test_f1: 0.4708
 epoch: 32, train_loss: 1.0087, test_loss: 1.0151, test_f1: 0.4693
 epoch: 33, train_loss: 1.0051, test_loss: 1.0421, test_f1: 0.4810
 epoch: 34, train_loss: 0.9928, test_loss: 1.0435, test_f1: 0.4823
 epoch: 35, train_loss: 0.9996, test_loss: 1.0219, test_f1: 0.4768
 epoch: 36, train_loss: 0.9861, test_loss: 1.0293, test_f1: 0.5004
 epoch: 37, train_loss: 0.9828, test_loss: 1.0449, test_f1: 0.4782
 epoch: 38, train_loss: 0.9919, test_loss: 1.0525, test_f1: 0.5008
 epoch: 39, train_loss: 0.9784, test_loss: 1.0374, test_f1: 0.4844
 epoch: 40, train_loss: 0.9702, test_loss: 1.0189, test_f1: 0.4794
 epoch: 41, train_loss: 0.9590, test_loss: 1.0735, test_f1: 0.4747
 epoch: 42, train_loss: 0.9758, test_loss: 1.0389, test_f1: 0.4985
 epoch: 43, train_loss: 0.9718, test_loss: 1.0362, test_f1: 0.4884
 epoch: 44, train_loss: 0.9570, test_loss: 1.0493, test_f1: 0.4833
 epoch: 45, train_loss: 0.9583, test_loss: 1.0558, test_f1: 0.5087
 epoch: 46, train_loss: 0.9607, test_loss: 1.0642, test_f1: 0.4909
 epoch: 47, train_loss: 0.9569, test_loss: 1.0429, test_f1: 0.4919
 epoch: 48, train_loss: 0.9371, test_loss: 1.0427, test_f1: 0.4934
 epoch: 49, train_loss: 0.9356, test_loss: 1.0447, test_f1: 0.4942
 epoch: 50, train_loss: 0.9391, test_loss: 1.0961, test_f1: 0.4611
 epoch: 51, train_loss: 0.9293, test_loss: 1.0661, test_f1: 0.4840
 epoch: 52, train_loss: 0.9274, test_loss: 1.0711, test_f1: 0.4848
 epoch: 53, train_loss: 0.9280, test_loss: 1.0471, test_f1: 0.4941
 epoch: 54, train_loss: 0.9290, test_loss: 1.0587, test_f1: 0.4994
 epoch: 55, train_loss: 0.9089, test_loss: 1.0620, test_f1: 0.4989
 epoch: 56, train_loss: 0.9198, test_loss: 1.0772, test_f1: 0.4938
 epoch: 57, train_loss: 0.9154, test_loss: 1.1405, test_f1: 0.4750
 epoch: 58, train_loss: 0.9134, test_loss: 1.1100, test_f1: 0.4724
 epoch: 59, train_loss: 0.9219, test_loss: 1.0969, test_f1: 0.4745
 epoch: 60, train_loss: 0.9131, test_loss: 1.1216, test_f1: 0.4833
 epoch: 61, train_loss: 0.9193, test_loss: 1.1381, test_f1: 0.4686
 epoch: 62, train_loss: 0.9106, test_loss: 1.1371, test_f1: 0.4950
 epoch: 63, train_loss: 0.9082, test_loss: 1.1337, test_f1: 0.4625
 epoch: 64, train_loss: 0.8961, test_loss: 1.0915, test_f1: 0.4945
 epoch: 65, train_loss: 0.9057, test_loss: 1.1193, test_f1: 0.4779
 epoch: 66, train_loss: 0.9013, test_loss: 1.1136, test_f1: 0.4784
 epoch: 67, train_loss: 0.9038, test_loss: 1.1251, test_f1: 0.4948
 epoch: 68, train_loss: 0.9074, test_loss: 1.1510, test_f1: 0.4815
 epoch: 69, train_loss: 0.8946, test_loss: 1.1473, test_f1: 0.4688
 epoch: 70, train_loss: 0.8956, test_loss: 1.1107, test_f1: 0.4863
 epoch: 71, train_loss: 0.8993, test_loss: 1.1288, test_f1: 0.4793
 epoch: 72, train_loss: 0.9084, test_loss: 1.1159, test_f1: 0.4704
 epoch: 73, train_loss: 0.8944, test_loss: 1.1385, test_f1: 0.4732
 epoch: 74, train_loss: 0.8851, test_loss: 1.1541, test_f1: 0.4911
 epoch: 75, train_loss: 0.8881, test_loss: 1.1540, test_f1: 0.4930
 epoch: 76, train_loss: 0.8897, test_loss: 1.1446, test_f1: 0.4860
 epoch: 77, train_loss: 0.8820, test_loss: 1.1847, test_f1: 0.4797
 epoch: 78, train_loss: 0.8880, test_loss: 1.1495, test_f1: 0.4889
 epoch: 79, train_loss: 0.8887, test_loss: 1.1610, test_f1: 0.4731
 epoch: 80, train_loss: 0.8746, test_loss: 1.2129, test_f1: 0.4870
 epoch: 81, train_loss: 0.8855, test_loss: 1.1927, test_f1: 0.5039
 epoch: 82, train_loss: 0.8764, test_loss: 1.1837, test_f1: 0.4809
 epoch: 83, train_loss: 0.8715, test_loss: 1.1560, test_f1: 0.4832
 epoch: 84, train_loss: 0.8719, test_loss: 1.2000, test_f1: 0.4816
 epoch: 85, train_loss: 0.8679, test_loss: 1.1406, test_f1: 0.5083
 epoch: 86, train_loss: 0.8808, test_loss: 1.1860, test_f1: 0.4922
 epoch: 87, train_loss: 0.8749, test_loss: 1.1716, test_f1: 0.4856
 epoch: 88, train_loss: 0.8704, test_loss: 1.1329, test_f1: 0.4976
 epoch: 89, train_loss: 0.8598, test_loss: 1.1167, test_f1: 0.5082
 epoch: 90, train_loss: 0.8649, test_loss: 1.1560, test_f1: 0.5066
 epoch: 91, train_loss: 0.8746, test_loss: 1.1157, test_f1: 0.5041
 epoch: 92, train_loss: 0.8636, test_loss: 1.1290, test_f1: 0.4878
 epoch: 93, train_loss: 0.8666, test_loss: 1.1939, test_f1: 0.4994
 epoch: 94, train_loss: 0.8451, test_loss: 1.1519, test_f1: 0.4939
 epoch: 95, train_loss: 0.8760, test_loss: 1.1841, test_f1: 0.4963
 epoch: 96, train_loss: 0.8621, test_loss: 1.1475, test_f1: 0.4992
 epoch: 97, train_loss: 0.8574, test_loss: 1.1748, test_f1: 0.5041
 epoch: 98, train_loss: 0.8636, test_loss: 1.1816, test_f1: 0.5084
 epoch: 99, train_loss: 0.8567, test_loss: 1.1801, test_f1: 0.4987
##################ITERATION #6 ****************************************
 epoch: 0, train_loss: 1.4213, test_loss: 1.3406, test_f1: 0.2274
 epoch: 1, train_loss: 1.3047, test_loss: 1.2980, test_f1: 0.2711
 epoch: 2, train_loss: 1.2757, test_loss: 1.2664, test_f1: 0.2797
 epoch: 3, train_loss: 1.2592, test_loss: 1.2364, test_f1: 0.3180
 epoch: 4, train_loss: 1.2505, test_loss: 1.2240, test_f1: 0.3368
 epoch: 5, train_loss: 1.2375, test_loss: 1.2172, test_f1: 0.3169
 epoch: 6, train_loss: 1.2245, test_loss: 1.1930, test_f1: 0.3832
 epoch: 7, train_loss: 1.2207, test_loss: 1.1901, test_f1: 0.4059
 epoch: 8, train_loss: 1.2122, test_loss: 1.1846, test_f1: 0.3663
 epoch: 9, train_loss: 1.2024, test_loss: 1.1767, test_f1: 0.3691
 epoch: 10, train_loss: 1.2010, test_loss: 1.1643, test_f1: 0.3869
 epoch: 11, train_loss: 1.1861, test_loss: 1.1558, test_f1: 0.4005
 epoch: 12, train_loss: 1.1787, test_loss: 1.1480, test_f1: 0.4112
 epoch: 13, train_loss: 1.1792, test_loss: 1.1478, test_f1: 0.4124
 epoch: 14, train_loss: 1.1727, test_loss: 1.1303, test_f1: 0.3985
 epoch: 15, train_loss: 1.1609, test_loss: 1.1213, test_f1: 0.4136
 epoch: 16, train_loss: 1.1598, test_loss: 1.1181, test_f1: 0.4213
 epoch: 17, train_loss: 1.1488, test_loss: 1.1109, test_f1: 0.4103
 epoch: 18, train_loss: 1.1485, test_loss: 1.1041, test_f1: 0.4395
 epoch: 19, train_loss: 1.1370, test_loss: 1.1004, test_f1: 0.4123
 epoch: 20, train_loss: 1.1372, test_loss: 1.0939, test_f1: 0.4349
 epoch: 21, train_loss: 1.1216, test_loss: 1.0990, test_f1: 0.4307
 epoch: 22, train_loss: 1.1196, test_loss: 1.1065, test_f1: 0.4470
 epoch: 23, train_loss: 1.1081, test_loss: 1.0703, test_f1: 0.4229
 epoch: 24, train_loss: 1.1089, test_loss: 1.0849, test_f1: 0.4460
 epoch: 25, train_loss: 1.1145, test_loss: 1.1429, test_f1: 0.4378
 epoch: 26, train_loss: 1.1017, test_loss: 1.0583, test_f1: 0.4415
 epoch: 27, train_loss: 1.0887, test_loss: 1.0856, test_f1: 0.4476
 epoch: 28, train_loss: 1.0904, test_loss: 1.1907, test_f1: 0.4371
 epoch: 29, train_loss: 1.0814, test_loss: 1.0752, test_f1: 0.4347
 epoch: 30, train_loss: 1.0790, test_loss: 1.1577, test_f1: 0.4303
 epoch: 31, train_loss: 1.0758, test_loss: 1.2619, test_f1: 0.4511
 epoch: 32, train_loss: 1.0667, test_loss: 1.3685, test_f1: 0.4367
 epoch: 33, train_loss: 1.0763, test_loss: 1.0243, test_f1: 0.4440
 epoch: 34, train_loss: 1.0646, test_loss: 1.0143, test_f1: 0.4656
 epoch: 35, train_loss: 1.0636, test_loss: 1.0465, test_f1: 0.4669
 epoch: 36, train_loss: 1.0491, test_loss: 1.0417, test_f1: 0.4432
 epoch: 37, train_loss: 1.0714, test_loss: 1.0157, test_f1: 0.4664
 epoch: 38, train_loss: 1.0605, test_loss: 1.0619, test_f1: 0.4355
 epoch: 39, train_loss: 1.0517, test_loss: 1.0579, test_f1: 0.4706
 epoch: 40, train_loss: 1.0479, test_loss: 1.1215, test_f1: 0.4718
 epoch: 41, train_loss: 1.0334, test_loss: 1.0216, test_f1: 0.4316
 epoch: 42, train_loss: 1.0233, test_loss: 0.9851, test_f1: 0.4772
 epoch: 43, train_loss: 1.0379, test_loss: 0.9921, test_f1: 0.4693
 epoch: 44, train_loss: 1.0290, test_loss: 1.0445, test_f1: 0.4473
 epoch: 45, train_loss: 1.0316, test_loss: 1.0578, test_f1: 0.4498
 epoch: 46, train_loss: 1.0171, test_loss: 0.9781, test_f1: 0.4690
 epoch: 47, train_loss: 1.0217, test_loss: 0.9918, test_f1: 0.4709
 epoch: 48, train_loss: 1.0052, test_loss: 1.0182, test_f1: 0.4510
 epoch: 49, train_loss: 1.0100, test_loss: 0.9735, test_f1: 0.4728
 epoch: 50, train_loss: 1.0185, test_loss: 0.9831, test_f1: 0.4540
 epoch: 51, train_loss: 1.0091, test_loss: 0.9954, test_f1: 0.4524
 epoch: 52, train_loss: 1.0068, test_loss: 0.9770, test_f1: 0.4696
 epoch: 53, train_loss: 0.9912, test_loss: 0.9822, test_f1: 0.4667
 epoch: 54, train_loss: 0.9934, test_loss: 0.9914, test_f1: 0.4723
 epoch: 55, train_loss: 0.9929, test_loss: 0.9836, test_f1: 0.4600
 epoch: 56, train_loss: 0.9969, test_loss: 0.9814, test_f1: 0.4573
 epoch: 57, train_loss: 0.9968, test_loss: 0.9797, test_f1: 0.4585
 epoch: 58, train_loss: 0.9893, test_loss: 0.9838, test_f1: 0.4644
 epoch: 59, train_loss: 0.9929, test_loss: 0.9814, test_f1: 0.4618
 epoch: 60, train_loss: 0.9781, test_loss: 0.9664, test_f1: 0.4808
 epoch: 61, train_loss: 0.9881, test_loss: 0.9963, test_f1: 0.4657
 epoch: 62, train_loss: 0.9890, test_loss: 0.9839, test_f1: 0.4592
 epoch: 63, train_loss: 0.9877, test_loss: 0.9715, test_f1: 0.4698
 epoch: 64, train_loss: 0.9829, test_loss: 0.9895, test_f1: 0.4522
 epoch: 65, train_loss: 0.9822, test_loss: 0.9714, test_f1: 0.4667
 epoch: 66, train_loss: 0.9712, test_loss: 0.9690, test_f1: 0.4651
 epoch: 67, train_loss: 0.9760, test_loss: 0.9713, test_f1: 0.4671
 epoch: 68, train_loss: 0.9751, test_loss: 0.9606, test_f1: 0.4619
 epoch: 69, train_loss: 0.9846, test_loss: 0.9756, test_f1: 0.4630
 epoch: 70, train_loss: 0.9744, test_loss: 0.9682, test_f1: 0.4748
 epoch: 71, train_loss: 0.9662, test_loss: 0.9594, test_f1: 0.4719
 epoch: 72, train_loss: 0.9676, test_loss: 0.9583, test_f1: 0.4737
 epoch: 73, train_loss: 0.9625, test_loss: 0.9765, test_f1: 0.4753
 epoch: 74, train_loss: 0.9614, test_loss: 0.9694, test_f1: 0.4677
 epoch: 75, train_loss: 0.9668, test_loss: 0.9787, test_f1: 0.4633
 epoch: 76, train_loss: 0.9669, test_loss: 0.9740, test_f1: 0.4618
 epoch: 77, train_loss: 0.9601, test_loss: 0.9699, test_f1: 0.4610
 epoch: 78, train_loss: 0.9594, test_loss: 0.9682, test_f1: 0.4711
 epoch: 79, train_loss: 0.9586, test_loss: 0.9745, test_f1: 0.4733
 epoch: 80, train_loss: 0.9755, test_loss: 0.9948, test_f1: 0.4625
 epoch: 81, train_loss: 0.9527, test_loss: 0.9734, test_f1: 0.4765
 epoch: 82, train_loss: 0.9608, test_loss: 0.9711, test_f1: 0.4761
 epoch: 83, train_loss: 0.9541, test_loss: 0.9764, test_f1: 0.4759
 epoch: 84, train_loss: 0.9567, test_loss: 0.9627, test_f1: 0.4809
 epoch: 85, train_loss: 0.9541, test_loss: 0.9798, test_f1: 0.4752
 epoch: 86, train_loss: 0.9499, test_loss: 0.9914, test_f1: 0.4700
 epoch: 87, train_loss: 0.9616, test_loss: 1.0041, test_f1: 0.4696
 epoch: 88, train_loss: 0.9409, test_loss: 0.9632, test_f1: 0.4873
 epoch: 89, train_loss: 0.9470, test_loss: 0.9784, test_f1: 0.4827
 epoch: 90, train_loss: 0.9489, test_loss: 0.9958, test_f1: 0.4806
 epoch: 91, train_loss: 0.9625, test_loss: 0.9592, test_f1: 0.4931
 epoch: 92, train_loss: 0.9542, test_loss: 0.9852, test_f1: 0.4877
 epoch: 93, train_loss: 0.9479, test_loss: 0.9748, test_f1: 0.4894
 epoch: 94, train_loss: 0.9307, test_loss: 0.9702, test_f1: 0.4832
 epoch: 95, train_loss: 0.9468, test_loss: 0.9678, test_f1: 0.4907
 epoch: 96, train_loss: 0.9523, test_loss: 1.0169, test_f1: 0.4668
 epoch: 97, train_loss: 0.9275, test_loss: 0.9586, test_f1: 0.4946
 epoch: 98, train_loss: 0.9485, test_loss: 0.9897, test_f1: 0.4816
 epoch: 99, train_loss: 0.9368, test_loss: 0.9828, test_f1: 0.4835
##################ITERATION #7 ****************************************
 epoch: 0, train_loss: 1.3855, test_loss: 1.3632, test_f1: 0.2440
 epoch: 1, train_loss: 1.2711, test_loss: 1.2568, test_f1: 0.3027
 epoch: 2, train_loss: 1.2573, test_loss: 1.2117, test_f1: 0.3476
 epoch: 3, train_loss: 1.2428, test_loss: 1.2008, test_f1: 0.3292
 epoch: 4, train_loss: 1.2302, test_loss: 1.1974, test_f1: 0.3394
 epoch: 5, train_loss: 1.2218, test_loss: 1.1766, test_f1: 0.3579
 epoch: 6, train_loss: 1.2183, test_loss: 1.1688, test_f1: 0.3871
 epoch: 7, train_loss: 1.2057, test_loss: 1.1533, test_f1: 0.3863
 epoch: 8, train_loss: 1.2090, test_loss: 1.1559, test_f1: 0.3860
 epoch: 9, train_loss: 1.1941, test_loss: 1.1618, test_f1: 0.3869
 epoch: 10, train_loss: 1.2001, test_loss: 1.1424, test_f1: 0.4092
 epoch: 11, train_loss: 1.1736, test_loss: 1.1182, test_f1: 0.4091
 epoch: 12, train_loss: 1.1712, test_loss: 1.1135, test_f1: 0.4144
 epoch: 13, train_loss: 1.1622, test_loss: 1.1143, test_f1: 0.4096
 epoch: 14, train_loss: 1.1624, test_loss: 1.1160, test_f1: 0.4010
 epoch: 15, train_loss: 1.1574, test_loss: 1.0990, test_f1: 0.4121
 epoch: 16, train_loss: 1.1513, test_loss: 1.0938, test_f1: 0.4312
 epoch: 17, train_loss: 1.1467, test_loss: 1.0995, test_f1: 0.4151
 epoch: 18, train_loss: 1.1359, test_loss: 1.0859, test_f1: 0.4287
 epoch: 19, train_loss: 1.1282, test_loss: 1.0920, test_f1: 0.4256
 epoch: 20, train_loss: 1.1325, test_loss: 1.0733, test_f1: 0.4433
 epoch: 21, train_loss: 1.1208, test_loss: 1.0791, test_f1: 0.4529
 epoch: 22, train_loss: 1.1191, test_loss: 1.0752, test_f1: 0.4432
 epoch: 23, train_loss: 1.1203, test_loss: 1.0614, test_f1: 0.4452
 epoch: 24, train_loss: 1.1128, test_loss: 1.0604, test_f1: 0.4308
 epoch: 25, train_loss: 1.1116, test_loss: 1.0518, test_f1: 0.4239
 epoch: 26, train_loss: 1.1027, test_loss: 1.0525, test_f1: 0.4527
 epoch: 27, train_loss: 1.0940, test_loss: 1.0459, test_f1: 0.4498
 epoch: 28, train_loss: 1.0977, test_loss: 1.0460, test_f1: 0.4435
 epoch: 29, train_loss: 1.0973, test_loss: 1.0419, test_f1: 0.4437
 epoch: 30, train_loss: 1.0876, test_loss: 1.0475, test_f1: 0.4589
 epoch: 31, train_loss: 1.0864, test_loss: 1.0270, test_f1: 0.4458
 epoch: 32, train_loss: 1.0794, test_loss: 1.0365, test_f1: 0.4412
 epoch: 33, train_loss: 1.0746, test_loss: 1.0248, test_f1: 0.4615
 epoch: 34, train_loss: 1.0803, test_loss: 1.0358, test_f1: 0.4362
 epoch: 35, train_loss: 1.0628, test_loss: 1.0275, test_f1: 0.4647
 epoch: 36, train_loss: 1.0656, test_loss: 1.0110, test_f1: 0.4575
 epoch: 37, train_loss: 1.0670, test_loss: 1.0193, test_f1: 0.4350
 epoch: 38, train_loss: 1.0586, test_loss: 1.0425, test_f1: 0.4490
 epoch: 39, train_loss: 1.0545, test_loss: 1.0094, test_f1: 0.4559
 epoch: 40, train_loss: 1.0509, test_loss: 1.0067, test_f1: 0.4627
 epoch: 41, train_loss: 1.0373, test_loss: 1.0048, test_f1: 0.4624
 epoch: 42, train_loss: 1.0455, test_loss: 1.0052, test_f1: 0.4783
 epoch: 43, train_loss: 1.0380, test_loss: 1.0029, test_f1: 0.4664
 epoch: 44, train_loss: 1.0286, test_loss: 1.0028, test_f1: 0.4705
 epoch: 45, train_loss: 1.0345, test_loss: 1.0059, test_f1: 0.4489
 epoch: 46, train_loss: 1.0384, test_loss: 1.0007, test_f1: 0.4575
 epoch: 47, train_loss: 1.0170, test_loss: 0.9930, test_f1: 0.4646
 epoch: 48, train_loss: 1.0151, test_loss: 0.9808, test_f1: 0.4769
 epoch: 49, train_loss: 1.0127, test_loss: 0.9843, test_f1: 0.4784
 epoch: 50, train_loss: 1.0098, test_loss: 0.9701, test_f1: 0.4961
 epoch: 51, train_loss: 1.0110, test_loss: 1.0057, test_f1: 0.4585
 epoch: 52, train_loss: 1.0032, test_loss: 0.9717, test_f1: 0.4818
 epoch: 53, train_loss: 1.0018, test_loss: 0.9941, test_f1: 0.4739
 epoch: 54, train_loss: 0.9995, test_loss: 0.9619, test_f1: 0.4856
 epoch: 55, train_loss: 1.0028, test_loss: 0.9869, test_f1: 0.4631
 epoch: 56, train_loss: 1.0010, test_loss: 0.9842, test_f1: 0.4821
 epoch: 57, train_loss: 0.9845, test_loss: 0.9584, test_f1: 0.4871
 epoch: 58, train_loss: 0.9822, test_loss: 0.9666, test_f1: 0.4906
 epoch: 59, train_loss: 0.9849, test_loss: 0.9744, test_f1: 0.4987
 epoch: 60, train_loss: 0.9860, test_loss: 0.9554, test_f1: 0.5000
 epoch: 61, train_loss: 0.9885, test_loss: 0.9677, test_f1: 0.4966
 epoch: 62, train_loss: 0.9823, test_loss: 0.9733, test_f1: 0.4819
 epoch: 63, train_loss: 0.9803, test_loss: 0.9513, test_f1: 0.4952
 epoch: 64, train_loss: 0.9833, test_loss: 0.9785, test_f1: 0.4847
 epoch: 65, train_loss: 0.9843, test_loss: 0.9791, test_f1: 0.4930
 epoch: 66, train_loss: 0.9725, test_loss: 0.9672, test_f1: 0.4800
 epoch: 67, train_loss: 0.9735, test_loss: 0.9887, test_f1: 0.5008
 epoch: 68, train_loss: 0.9756, test_loss: 0.9591, test_f1: 0.4890
 epoch: 69, train_loss: 0.9783, test_loss: 0.9768, test_f1: 0.4785
 epoch: 70, train_loss: 0.9735, test_loss: 0.9795, test_f1: 0.4733
 epoch: 71, train_loss: 0.9713, test_loss: 0.9603, test_f1: 0.5103
 epoch: 72, train_loss: 0.9708, test_loss: 0.9855, test_f1: 0.4980
 epoch: 73, train_loss: 0.9577, test_loss: 0.9497, test_f1: 0.5050
 epoch: 74, train_loss: 0.9704, test_loss: 0.9559, test_f1: 0.5028
 epoch: 75, train_loss: 0.9583, test_loss: 0.9638, test_f1: 0.4953
 epoch: 76, train_loss: 0.9594, test_loss: 0.9432, test_f1: 0.5105
 epoch: 77, train_loss: 0.9542, test_loss: 0.9645, test_f1: 0.5087
 epoch: 78, train_loss: 0.9536, test_loss: 0.9701, test_f1: 0.5101
 epoch: 79, train_loss: 0.9627, test_loss: 0.9498, test_f1: 0.5144
 epoch: 80, train_loss: 0.9486, test_loss: 0.9666, test_f1: 0.5002
 epoch: 81, train_loss: 0.9519, test_loss: 0.9542, test_f1: 0.5130
 epoch: 82, train_loss: 0.9524, test_loss: 0.9470, test_f1: 0.5141
 epoch: 83, train_loss: 0.9605, test_loss: 0.9454, test_f1: 0.5065
 epoch: 84, train_loss: 0.9447, test_loss: 0.9475, test_f1: 0.5052
 epoch: 85, train_loss: 0.9470, test_loss: 0.9575, test_f1: 0.5040
 epoch: 86, train_loss: 0.9413, test_loss: 0.9542, test_f1: 0.5000
 epoch: 87, train_loss: 0.9484, test_loss: 0.9753, test_f1: 0.4980
 epoch: 88, train_loss: 0.9400, test_loss: 0.9500, test_f1: 0.5021
 epoch: 89, train_loss: 0.9516, test_loss: 0.9557, test_f1: 0.4986
 epoch: 90, train_loss: 0.9471, test_loss: 0.9686, test_f1: 0.4995
 epoch: 91, train_loss: 0.9495, test_loss: 0.9632, test_f1: 0.5042
 epoch: 92, train_loss: 0.9324, test_loss: 0.9499, test_f1: 0.5163
 epoch: 93, train_loss: 0.9367, test_loss: 0.9801, test_f1: 0.4977
 epoch: 94, train_loss: 0.9354, test_loss: 0.9897, test_f1: 0.4806
 epoch: 95, train_loss: 0.9250, test_loss: 0.9714, test_f1: 0.4866
 epoch: 96, train_loss: 0.9273, test_loss: 0.9767, test_f1: 0.4992
 epoch: 97, train_loss: 0.9447, test_loss: 0.9793, test_f1: 0.4826
 epoch: 98, train_loss: 0.9410, test_loss: 1.0117, test_f1: 0.4881
 epoch: 99, train_loss: 0.9245, test_loss: 0.9873, test_f1: 0.4848
##################ITERATION #8 ****************************************
 epoch: 0, train_loss: 1.8349, test_loss: 1.4005, test_f1: 0.2274
 epoch: 1, train_loss: 1.4111, test_loss: 1.3202, test_f1: 0.2631
 epoch: 2, train_loss: 1.3507, test_loss: 1.2659, test_f1: 0.3252
 epoch: 3, train_loss: 1.3189, test_loss: 1.2445, test_f1: 0.3136
 epoch: 4, train_loss: 1.2870, test_loss: 1.2278, test_f1: 0.3051
 epoch: 5, train_loss: 1.2732, test_loss: 1.2191, test_f1: 0.2920
 epoch: 6, train_loss: 1.2615, test_loss: 1.2077, test_f1: 0.3047
 epoch: 7, train_loss: 1.2418, test_loss: 1.2027, test_f1: 0.3001
 epoch: 8, train_loss: 1.2298, test_loss: 1.1917, test_f1: 0.3140
 epoch: 9, train_loss: 1.2217, test_loss: 1.1809, test_f1: 0.3088
 epoch: 10, train_loss: 1.2035, test_loss: 1.1695, test_f1: 0.3487
 epoch: 11, train_loss: 1.2034, test_loss: 1.1571, test_f1: 0.3545
 epoch: 12, train_loss: 1.1853, test_loss: 1.1468, test_f1: 0.3525
 epoch: 13, train_loss: 1.1806, test_loss: 1.1345, test_f1: 0.3672
 epoch: 14, train_loss: 1.1639, test_loss: 1.1197, test_f1: 0.3811
 epoch: 15, train_loss: 1.1501, test_loss: 1.1070, test_f1: 0.3937
 epoch: 16, train_loss: 1.1452, test_loss: 1.0887, test_f1: 0.4268
 epoch: 17, train_loss: 1.1383, test_loss: 1.0902, test_f1: 0.4314
 epoch: 18, train_loss: 1.1335, test_loss: 1.0626, test_f1: 0.4423
 epoch: 19, train_loss: 1.1238, test_loss: 1.0580, test_f1: 0.4459
 epoch: 20, train_loss: 1.1119, test_loss: 1.0620, test_f1: 0.4399
 epoch: 21, train_loss: 1.0982, test_loss: 1.0350, test_f1: 0.4672
 epoch: 22, train_loss: 1.1077, test_loss: 1.0340, test_f1: 0.4483
 epoch: 23, train_loss: 1.0933, test_loss: 1.0180, test_f1: 0.4590
 epoch: 24, train_loss: 1.0849, test_loss: 1.0425, test_f1: 0.4380
 epoch: 25, train_loss: 1.0738, test_loss: 1.0147, test_f1: 0.4541
 epoch: 26, train_loss: 1.0716, test_loss: 1.0088, test_f1: 0.4538
 epoch: 27, train_loss: 1.0747, test_loss: 1.0168, test_f1: 0.4429
 epoch: 28, train_loss: 1.0704, test_loss: 0.9940, test_f1: 0.4536
 epoch: 29, train_loss: 1.0557, test_loss: 0.9883, test_f1: 0.4602
 epoch: 30, train_loss: 1.0579, test_loss: 0.9847, test_f1: 0.4657
 epoch: 31, train_loss: 1.0601, test_loss: 0.9863, test_f1: 0.4691
 epoch: 32, train_loss: 1.0339, test_loss: 0.9781, test_f1: 0.4580
 epoch: 33, train_loss: 1.0292, test_loss: 0.9639, test_f1: 0.4810
 epoch: 34, train_loss: 1.0369, test_loss: 0.9696, test_f1: 0.4648
 epoch: 35, train_loss: 1.0288, test_loss: 0.9688, test_f1: 0.4719
 epoch: 36, train_loss: 1.0234, test_loss: 1.0006, test_f1: 0.4497
 epoch: 37, train_loss: 1.0229, test_loss: 0.9499, test_f1: 0.4675
 epoch: 38, train_loss: 1.0187, test_loss: 0.9387, test_f1: 0.4813
 epoch: 39, train_loss: 1.0132, test_loss: 0.9382, test_f1: 0.4768
 epoch: 40, train_loss: 1.0103, test_loss: 0.9549, test_f1: 0.4592
 epoch: 41, train_loss: 0.9904, test_loss: 0.9248, test_f1: 0.4802
 epoch: 42, train_loss: 0.9870, test_loss: 0.9229, test_f1: 0.4955
 epoch: 43, train_loss: 0.9935, test_loss: 0.9476, test_f1: 0.4752
 epoch: 44, train_loss: 0.9979, test_loss: 1.1870, test_f1: 0.4355
 epoch: 45, train_loss: 0.9957, test_loss: 0.9214, test_f1: 0.4904
 epoch: 46, train_loss: 0.9756, test_loss: 0.9215, test_f1: 0.4784
 epoch: 47, train_loss: 0.9724, test_loss: 0.9548, test_f1: 0.4838
 epoch: 48, train_loss: 0.9673, test_loss: 0.8830, test_f1: 0.4973
 epoch: 49, train_loss: 0.9577, test_loss: 0.8851, test_f1: 0.4980
 epoch: 50, train_loss: 0.9649, test_loss: 0.8966, test_f1: 0.4988
 epoch: 51, train_loss: 0.9600, test_loss: 0.8849, test_f1: 0.5073
 epoch: 52, train_loss: 0.9520, test_loss: 0.8944, test_f1: 0.5002
 epoch: 53, train_loss: 0.9522, test_loss: 0.8840, test_f1: 0.5014
 epoch: 54, train_loss: 0.9569, test_loss: 0.8776, test_f1: 0.5015
 epoch: 55, train_loss: 0.9472, test_loss: 0.8796, test_f1: 0.4966
 epoch: 56, train_loss: 0.9396, test_loss: 0.8872, test_f1: 0.4993
 epoch: 57, train_loss: 0.9384, test_loss: 0.8825, test_f1: 0.5135
 epoch: 58, train_loss: 0.9342, test_loss: 0.8809, test_f1: 0.4968
 epoch: 59, train_loss: 0.9514, test_loss: 0.8830, test_f1: 0.4957
 epoch: 60, train_loss: 0.9326, test_loss: 0.8731, test_f1: 0.4994
 epoch: 61, train_loss: 0.9269, test_loss: 0.8796, test_f1: 0.5062
 epoch: 62, train_loss: 0.9228, test_loss: 0.8763, test_f1: 0.5031
 epoch: 63, train_loss: 0.9404, test_loss: 0.8744, test_f1: 0.5058
 epoch: 64, train_loss: 0.9325, test_loss: 0.8762, test_f1: 0.5093
 epoch: 65, train_loss: 0.9269, test_loss: 0.8747, test_f1: 0.4955
 epoch: 66, train_loss: 0.9273, test_loss: 0.8732, test_f1: 0.5036
 epoch: 67, train_loss: 0.9234, test_loss: 0.8695, test_f1: 0.4999
 epoch: 68, train_loss: 0.9255, test_loss: 0.8731, test_f1: 0.4989
 epoch: 69, train_loss: 0.9174, test_loss: 0.8704, test_f1: 0.4937
 epoch: 70, train_loss: 0.9186, test_loss: 0.8863, test_f1: 0.4878
 epoch: 71, train_loss: 0.9158, test_loss: 0.8702, test_f1: 0.5083
 epoch: 72, train_loss: 0.9217, test_loss: 0.8674, test_f1: 0.4892
 epoch: 73, train_loss: 0.9172, test_loss: 0.8706, test_f1: 0.4861
 epoch: 74, train_loss: 0.9193, test_loss: 0.8750, test_f1: 0.4968
 epoch: 75, train_loss: 0.9148, test_loss: 0.8765, test_f1: 0.4927
 epoch: 76, train_loss: 0.9164, test_loss: 0.8763, test_f1: 0.4835
 epoch: 77, train_loss: 0.9239, test_loss: 0.8818, test_f1: 0.4830
 epoch: 78, train_loss: 0.9148, test_loss: 0.8792, test_f1: 0.4978
 epoch: 79, train_loss: 0.9076, test_loss: 0.8769, test_f1: 0.4862
 epoch: 80, train_loss: 0.9040, test_loss: 0.8744, test_f1: 0.5044
 epoch: 81, train_loss: 0.9053, test_loss: 0.8798, test_f1: 0.4872
 epoch: 82, train_loss: 0.9128, test_loss: 0.8754, test_f1: 0.4904
 epoch: 83, train_loss: 0.9098, test_loss: 0.8795, test_f1: 0.4997
 epoch: 84, train_loss: 0.9080, test_loss: 0.8769, test_f1: 0.4944
 epoch: 85, train_loss: 0.9037, test_loss: 0.8850, test_f1: 0.4998
 epoch: 86, train_loss: 0.9094, test_loss: 0.8810, test_f1: 0.5088
 epoch: 87, train_loss: 0.9114, test_loss: 0.8854, test_f1: 0.4937
 epoch: 88, train_loss: 0.9110, test_loss: 0.8838, test_f1: 0.4885
 epoch: 89, train_loss: 0.9030, test_loss: 0.8791, test_f1: 0.5032
 epoch: 90, train_loss: 0.8967, test_loss: 0.8864, test_f1: 0.4997
 epoch: 91, train_loss: 0.8999, test_loss: 0.8947, test_f1: 0.4891
 epoch: 92, train_loss: 0.8998, test_loss: 0.8880, test_f1: 0.5076
 epoch: 93, train_loss: 0.8927, test_loss: 0.8944, test_f1: 0.5024
 epoch: 94, train_loss: 0.8988, test_loss: 0.8950, test_f1: 0.4859
 epoch: 95, train_loss: 0.8933, test_loss: 0.8862, test_f1: 0.4843
 epoch: 96, train_loss: 0.9039, test_loss: 0.8885, test_f1: 0.4940
 epoch: 97, train_loss: 0.8915, test_loss: 0.8821, test_f1: 0.4958
 epoch: 98, train_loss: 0.8871, test_loss: 0.8780, test_f1: 0.5058
 epoch: 99, train_loss: 0.8861, test_loss: 0.8826, test_f1: 0.5229
##################ITERATION #9 ****************************************
 epoch: 0, train_loss: 1.7089, test_loss: 1.3379, test_f1: 0.2815
 epoch: 1, train_loss: 1.3549, test_loss: 1.2751, test_f1: 0.2574
 epoch: 2, train_loss: 1.3062, test_loss: 1.2314, test_f1: 0.2789
 epoch: 3, train_loss: 1.2857, test_loss: 1.2118, test_f1: 0.3263
 epoch: 4, train_loss: 1.2524, test_loss: 1.2066, test_f1: 0.3121
 epoch: 5, train_loss: 1.2453, test_loss: 1.1926, test_f1: 0.3593
 epoch: 6, train_loss: 1.2256, test_loss: 1.1846, test_f1: 0.3498
 epoch: 7, train_loss: 1.2176, test_loss: 1.1755, test_f1: 0.3707
 epoch: 8, train_loss: 1.2101, test_loss: 1.1661, test_f1: 0.3530
 epoch: 9, train_loss: 1.1886, test_loss: 1.1589, test_f1: 0.3690
 epoch: 10, train_loss: 1.1839, test_loss: 1.1444, test_f1: 0.3965
 epoch: 11, train_loss: 1.1788, test_loss: 1.1413, test_f1: 0.3897
 epoch: 12, train_loss: 1.1691, test_loss: 1.1452, test_f1: 0.3834
 epoch: 13, train_loss: 1.1644, test_loss: 1.1293, test_f1: 0.3871
 epoch: 14, train_loss: 1.1562, test_loss: 1.1205, test_f1: 0.3983
 epoch: 15, train_loss: 1.1526, test_loss: 1.1207, test_f1: 0.3934
 epoch: 16, train_loss: 1.1478, test_loss: 1.1038, test_f1: 0.4200
 epoch: 17, train_loss: 1.1417, test_loss: 1.1070, test_f1: 0.3958
 epoch: 18, train_loss: 1.1378, test_loss: 1.0953, test_f1: 0.4149
 epoch: 19, train_loss: 1.1266, test_loss: 1.1049, test_f1: 0.4046
 epoch: 20, train_loss: 1.1341, test_loss: 1.0911, test_f1: 0.4162
 epoch: 21, train_loss: 1.1187, test_loss: 1.0832, test_f1: 0.4120
 epoch: 22, train_loss: 1.1235, test_loss: 1.0831, test_f1: 0.4200
 epoch: 23, train_loss: 1.1203, test_loss: 1.0666, test_f1: 0.4275
 epoch: 24, train_loss: 1.1095, test_loss: 1.0628, test_f1: 0.4277
 epoch: 25, train_loss: 1.0980, test_loss: 1.0668, test_f1: 0.4216
 epoch: 26, train_loss: 1.1052, test_loss: 1.0624, test_f1: 0.4210
 epoch: 27, train_loss: 1.0897, test_loss: 1.0643, test_f1: 0.4216
 epoch: 28, train_loss: 1.0868, test_loss: 1.0397, test_f1: 0.4403
 epoch: 29, train_loss: 1.0727, test_loss: 1.0431, test_f1: 0.4416
 epoch: 30, train_loss: 1.0779, test_loss: 1.0429, test_f1: 0.4412
 epoch: 31, train_loss: 1.0688, test_loss: 1.0300, test_f1: 0.4531
 epoch: 32, train_loss: 1.0648, test_loss: 1.0328, test_f1: 0.4552
 epoch: 33, train_loss: 1.0699, test_loss: 1.0282, test_f1: 0.4558
 epoch: 34, train_loss: 1.0505, test_loss: 1.0039, test_f1: 0.4543
 epoch: 35, train_loss: 1.0561, test_loss: 1.0221, test_f1: 0.4453
 epoch: 36, train_loss: 1.0570, test_loss: 1.0046, test_f1: 0.4534
 epoch: 37, train_loss: 1.0438, test_loss: 1.0411, test_f1: 0.4452
 epoch: 38, train_loss: 1.0537, test_loss: 1.0077, test_f1: 0.4419
 epoch: 39, train_loss: 1.0356, test_loss: 1.0128, test_f1: 0.4544
 epoch: 40, train_loss: 1.0363, test_loss: 0.9922, test_f1: 0.4680
 epoch: 41, train_loss: 1.0343, test_loss: 0.9877, test_f1: 0.4699
 epoch: 42, train_loss: 1.0299, test_loss: 0.9928, test_f1: 0.4574
 epoch: 43, train_loss: 1.0249, test_loss: 0.9764, test_f1: 0.4714
 epoch: 44, train_loss: 1.0230, test_loss: 0.9804, test_f1: 0.4674
 epoch: 45, train_loss: 1.0173, test_loss: 0.9686, test_f1: 0.4776
 epoch: 46, train_loss: 1.0212, test_loss: 0.9670, test_f1: 0.4806
 epoch: 47, train_loss: 1.0168, test_loss: 0.9734, test_f1: 0.4776
 epoch: 48, train_loss: 1.0105, test_loss: 0.9727, test_f1: 0.4740
 epoch: 49, train_loss: 1.0034, test_loss: 0.9665, test_f1: 0.4703
 epoch: 50, train_loss: 0.9948, test_loss: 0.9639, test_f1: 0.4667
 epoch: 51, train_loss: 0.9858, test_loss: 0.9556, test_f1: 0.4678
 epoch: 52, train_loss: 0.9921, test_loss: 0.9526, test_f1: 0.4754
 epoch: 53, train_loss: 0.9913, test_loss: 0.9595, test_f1: 0.4625
 epoch: 54, train_loss: 0.9888, test_loss: 0.9551, test_f1: 0.4619
 epoch: 55, train_loss: 0.9838, test_loss: 0.9346, test_f1: 0.4911
 epoch: 56, train_loss: 0.9840, test_loss: 0.9488, test_f1: 0.4689
 epoch: 57, train_loss: 0.9850, test_loss: 0.9323, test_f1: 0.4920
 epoch: 58, train_loss: 0.9766, test_loss: 0.9413, test_f1: 0.4793
 epoch: 59, train_loss: 0.9748, test_loss: 0.9399, test_f1: 0.4840
 epoch: 60, train_loss: 0.9720, test_loss: 0.9399, test_f1: 0.4804
 epoch: 61, train_loss: 0.9665, test_loss: 0.9344, test_f1: 0.4798
 epoch: 62, train_loss: 0.9672, test_loss: 0.9463, test_f1: 0.4750
 epoch: 63, train_loss: 0.9712, test_loss: 0.9470, test_f1: 0.4775
 epoch: 64, train_loss: 0.9694, test_loss: 0.9359, test_f1: 0.4703
 epoch: 65, train_loss: 0.9670, test_loss: 0.9309, test_f1: 0.4776
 epoch: 66, train_loss: 0.9578, test_loss: 0.9325, test_f1: 0.4747
 epoch: 67, train_loss: 0.9568, test_loss: 0.9326, test_f1: 0.4872
 epoch: 68, train_loss: 0.9557, test_loss: 0.9397, test_f1: 0.4834
 epoch: 69, train_loss: 0.9533, test_loss: 0.9246, test_f1: 0.4935
 epoch: 70, train_loss: 0.9538, test_loss: 0.9493, test_f1: 0.4749
 epoch: 71, train_loss: 0.9411, test_loss: 0.9489, test_f1: 0.4860
 epoch: 72, train_loss: 0.9487, test_loss: 0.9479, test_f1: 0.4728
 epoch: 73, train_loss: 0.9424, test_loss: 0.9307, test_f1: 0.4724
 epoch: 74, train_loss: 0.9420, test_loss: 0.9286, test_f1: 0.4884
 epoch: 75, train_loss: 0.9473, test_loss: 0.9355, test_f1: 0.4927
 epoch: 76, train_loss: 0.9408, test_loss: 0.9416, test_f1: 0.4811
 epoch: 77, train_loss: 0.9396, test_loss: 0.9242, test_f1: 0.4810
 epoch: 78, train_loss: 0.9386, test_loss: 0.9354, test_f1: 0.4969
 epoch: 79, train_loss: 0.9448, test_loss: 0.9331, test_f1: 0.4798
 epoch: 80, train_loss: 0.9460, test_loss: 0.9313, test_f1: 0.4949
 epoch: 81, train_loss: 0.9379, test_loss: 0.9359, test_f1: 0.4854
 epoch: 82, train_loss: 0.9431, test_loss: 0.9628, test_f1: 0.4904
 epoch: 83, train_loss: 0.9358, test_loss: 0.9243, test_f1: 0.4818
 epoch: 84, train_loss: 0.9322, test_loss: 0.9299, test_f1: 0.4836
 epoch: 85, train_loss: 0.9273, test_loss: 0.9173, test_f1: 0.4845
 epoch: 86, train_loss: 0.9226, test_loss: 0.9227, test_f1: 0.4824
 epoch: 87, train_loss: 0.9238, test_loss: 0.9360, test_f1: 0.4785
 epoch: 88, train_loss: 0.9217, test_loss: 0.9448, test_f1: 0.4855
 epoch: 89, train_loss: 0.9186, test_loss: 0.9316, test_f1: 0.4885
 epoch: 90, train_loss: 0.9310, test_loss: 0.9271, test_f1: 0.4915
 epoch: 91, train_loss: 0.9189, test_loss: 0.9455, test_f1: 0.4880
 epoch: 92, train_loss: 0.9217, test_loss: 0.9254, test_f1: 0.4829
 epoch: 93, train_loss: 0.9159, test_loss: 0.9508, test_f1: 0.4800
 epoch: 94, train_loss: 0.9151, test_loss: 0.9214, test_f1: 0.4965
 epoch: 95, train_loss: 0.9148, test_loss: 0.9383, test_f1: 0.4783
 epoch: 96, train_loss: 0.9080, test_loss: 0.9540, test_f1: 0.4810
 epoch: 97, train_loss: 0.9235, test_loss: 0.9496, test_f1: 0.4821
 epoch: 98, train_loss: 0.9071, test_loss: 0.9494, test_f1: 0.4912
 epoch: 99, train_loss: 0.9297, test_loss: 0.9342, test_f1: 0.4825

Training completed in 478.49 seconds
Best F1: 0.5229 at epoch 99
Mean F1 across iterations: 0.5021  0.0114
========================FINAL RESULTS================================
FEGIN weighted F1: 0.5229  0.0114
python main.py --data ltspice_examples --representation component_component --model FEGIN --layers 4 --hiddens 16 --batch_size 128 --lr 0.001 --emb_size 250 --epochs 100 --save_appendix component_component_L4_H16_BS128_LR0.001_E250 --no_val
-----



STDERR:
  File "main.py", line 370, in <module>
    main()
  File "main.py", line 254, in main
    dataset = dataset_class(
  File "/home/philip/projects/ltspice_examples_code_repo/Circuit-Completion-Using-GNNs/component_classification_with_link_prediction_head/evaluation/FEGIN/kernel/circuit_datasets.py", line 15, in __init__
    self.data, self.slices = torch.load(self.processed_paths[0])
  File "/home/philip/.local/lib/python3.8/site-packages/torch/serialization.py", line 1040, in load
    warnings.warn(
  File "/usr/lib/python3.8/warnings.py", line 109, in _showwarnmsg
    sw(msg.message, msg.category, msg.filename, msg.lineno,
  File "main.py", line 47, in warn_with_traceback
    traceback.print_stack(file=log)
/home/philip/projects/ltspice_examples_code_repo/Circuit-Completion-Using-GNNs/component_classification_with_link_prediction_head/evaluation/FEGIN/kernel/circuit_datasets.py:15: FutureWarning: You are using `torch.load` with `weights_only=False` (the current default value), which uses the default pickle module implicitly. It is possible to construct malicious pickle data which will execute arbitrary code during unpickling (See https://github.com/pytorch/pytorch/blob/main/SECURITY.md#untrusted-models for more details). In a future release, the default value for `weights_only` will be flipped to `True`. This limits the functions that could be executed during unpickling. Arbitrary objects will no longer be allowed to be loaded via this mode unless they are explicitly allowlisted by the user via `torch.serialization.add_safe_globals`. We recommend you start setting `weights_only=True` for any use case where you don't have full control of the loaded file. Please open an issue on GitHub for any issues related to this experimental feature.
  self.data, self.slices = torch.load(self.processed_paths[0])
