STDOUT:
Results will be saved in /home/philip/projects/ltspice_examples_code_repo/Circuit-Completion-Using-GNNs/component_classification_with_link_prediction_head/evaluation/FEGIN/results/model_FEGIN_dataset_ltspice_examples
Command line input: python main.py --data ltspice_examples --representation component_pin_net --model FEGIN --layers 3 --hiddens 16 --batch_size 128 --lr 0.001 --emb_size 128 --epochs 100 --save_appendix component_pin_net_L3_H16_BS128_LR0.001_E128 --no_val
 is saved.
-----
ltspice_examples - FEGIN
Using 3 layers, 16 hidden units, h = 2
Loading component_pin_net representation dataset
ENTERED
Training FEGIN on component_pin_net representation
Train: 3558, Test: 846
##################ITERATION #0 ****************************************
 epoch: 0, train_loss: 1.3434, test_loss: 1.3425, test_f1: 0.2270
 epoch: 1, train_loss: 1.3179, test_loss: 1.3256, test_f1: 0.2270
 epoch: 2, train_loss: 1.2818, test_loss: 1.2476, test_f1: 0.3366
 epoch: 3, train_loss: 1.2125, test_loss: 1.1654, test_f1: 0.3422
 epoch: 4, train_loss: 1.1494, test_loss: 1.1163, test_f1: 0.3422
 epoch: 5, train_loss: 1.1002, test_loss: 1.1227, test_f1: 0.3413
 epoch: 6, train_loss: 1.0776, test_loss: 1.0714, test_f1: 0.3681
 epoch: 7, train_loss: 1.0609, test_loss: 1.0604, test_f1: 0.3442
 epoch: 8, train_loss: 1.0564, test_loss: 1.0414, test_f1: 0.3606
 epoch: 9, train_loss: 1.0462, test_loss: 1.0554, test_f1: 0.3551
 epoch: 10, train_loss: 1.0389, test_loss: 1.0352, test_f1: 0.3603
 epoch: 11, train_loss: 1.0339, test_loss: 1.0269, test_f1: 0.3447
 epoch: 12, train_loss: 1.0336, test_loss: 1.0599, test_f1: 0.3408
 epoch: 13, train_loss: 1.0247, test_loss: 1.0326, test_f1: 0.3430
 epoch: 14, train_loss: 1.0124, test_loss: 0.9938, test_f1: 0.3611
 epoch: 15, train_loss: 1.0046, test_loss: 1.0010, test_f1: 0.3959
 epoch: 16, train_loss: 0.9862, test_loss: 1.0095, test_f1: 0.4552
 epoch: 17, train_loss: 0.9764, test_loss: 0.9770, test_f1: 0.4715
 epoch: 18, train_loss: 0.9660, test_loss: 0.9949, test_f1: 0.4764
 epoch: 19, train_loss: 0.9575, test_loss: 0.9686, test_f1: 0.4704
 epoch: 20, train_loss: 0.9429, test_loss: 0.9824, test_f1: 0.4624
 epoch: 21, train_loss: 0.9472, test_loss: 0.9709, test_f1: 0.4759
 epoch: 22, train_loss: 0.9407, test_loss: 0.9655, test_f1: 0.4858
 epoch: 23, train_loss: 0.9242, test_loss: 0.9192, test_f1: 0.4829
 epoch: 24, train_loss: 0.9428, test_loss: 0.9492, test_f1: 0.4744
 epoch: 25, train_loss: 0.9208, test_loss: 0.9535, test_f1: 0.4785
 epoch: 26, train_loss: 0.9178, test_loss: 0.9049, test_f1: 0.4983
 epoch: 27, train_loss: 0.9219, test_loss: 0.9674, test_f1: 0.4785
 epoch: 28, train_loss: 0.9217, test_loss: 0.9020, test_f1: 0.4832
 epoch: 29, train_loss: 0.9162, test_loss: 0.9350, test_f1: 0.5025
 epoch: 30, train_loss: 0.9141, test_loss: 0.8968, test_f1: 0.5115
 epoch: 31, train_loss: 0.9054, test_loss: 0.9059, test_f1: 0.5082
 epoch: 32, train_loss: 0.8939, test_loss: 0.9065, test_f1: 0.5018
 epoch: 33, train_loss: 0.8974, test_loss: 1.0174, test_f1: 0.4501
 epoch: 34, train_loss: 0.8844, test_loss: 0.8946, test_f1: 0.5000
 epoch: 35, train_loss: 0.8904, test_loss: 0.8671, test_f1: 0.5168
 epoch: 36, train_loss: 0.8881, test_loss: 0.9096, test_f1: 0.5289
 epoch: 37, train_loss: 0.8849, test_loss: 0.8675, test_f1: 0.5276
 epoch: 38, train_loss: 0.8859, test_loss: 0.9064, test_f1: 0.5185
 epoch: 39, train_loss: 0.8736, test_loss: 0.8520, test_f1: 0.5261
 epoch: 40, train_loss: 0.8675, test_loss: 0.8665, test_f1: 0.5462
 epoch: 41, train_loss: 0.8692, test_loss: 0.8492, test_f1: 0.5313
 epoch: 42, train_loss: 0.8676, test_loss: 0.8635, test_f1: 0.5275
 epoch: 43, train_loss: 0.8588, test_loss: 0.9317, test_f1: 0.4925
 epoch: 44, train_loss: 0.8641, test_loss: 0.9405, test_f1: 0.5261
 epoch: 45, train_loss: 0.8588, test_loss: 0.8550, test_f1: 0.5397
 epoch: 46, train_loss: 0.8549, test_loss: 0.8494, test_f1: 0.5310
 epoch: 47, train_loss: 0.8571, test_loss: 0.8603, test_f1: 0.5304
 epoch: 48, train_loss: 0.8457, test_loss: 0.9029, test_f1: 0.5071
 epoch: 49, train_loss: 0.8548, test_loss: 0.9023, test_f1: 0.5179
 epoch: 50, train_loss: 0.8483, test_loss: 0.9603, test_f1: 0.4938
 epoch: 51, train_loss: 0.8414, test_loss: 0.8899, test_f1: 0.5103
 epoch: 52, train_loss: 0.8270, test_loss: 0.8540, test_f1: 0.5538
 epoch: 53, train_loss: 0.8362, test_loss: 0.9054, test_f1: 0.4994
 epoch: 54, train_loss: 0.8357, test_loss: 0.8768, test_f1: 0.5187
 epoch: 55, train_loss: 0.8234, test_loss: 0.8702, test_f1: 0.5304
 epoch: 56, train_loss: 0.8259, test_loss: 0.8725, test_f1: 0.5274
 epoch: 57, train_loss: 0.8235, test_loss: 0.8679, test_f1: 0.5220
 epoch: 58, train_loss: 0.8278, test_loss: 0.8651, test_f1: 0.5497
 epoch: 59, train_loss: 0.8230, test_loss: 0.8553, test_f1: 0.5352
 epoch: 60, train_loss: 0.8191, test_loss: 0.8679, test_f1: 0.5456
 epoch: 61, train_loss: 0.8227, test_loss: 0.8559, test_f1: 0.5429
 epoch: 62, train_loss: 0.8089, test_loss: 0.8544, test_f1: 0.5427
 epoch: 63, train_loss: 0.8245, test_loss: 0.8520, test_f1: 0.5388
 epoch: 64, train_loss: 0.8238, test_loss: 0.8646, test_f1: 0.5633
 epoch: 65, train_loss: 0.8170, test_loss: 0.8726, test_f1: 0.5118
 epoch: 66, train_loss: 0.8084, test_loss: 0.8572, test_f1: 0.5658
 epoch: 67, train_loss: 0.8053, test_loss: 0.8529, test_f1: 0.5375
 epoch: 68, train_loss: 0.8071, test_loss: 0.8613, test_f1: 0.5343
 epoch: 69, train_loss: 0.8060, test_loss: 0.8655, test_f1: 0.5423
 epoch: 70, train_loss: 0.8127, test_loss: 0.8748, test_f1: 0.5234
 epoch: 71, train_loss: 0.8123, test_loss: 0.8656, test_f1: 0.5332
 epoch: 72, train_loss: 0.8079, test_loss: 0.8700, test_f1: 0.5216
 epoch: 73, train_loss: 0.8128, test_loss: 0.8737, test_f1: 0.5240
 epoch: 74, train_loss: 0.8137, test_loss: 0.8621, test_f1: 0.5615
 epoch: 75, train_loss: 0.7982, test_loss: 0.8635, test_f1: 0.5414
 epoch: 76, train_loss: 0.8098, test_loss: 0.8521, test_f1: 0.5389
 epoch: 77, train_loss: 0.8014, test_loss: 0.8541, test_f1: 0.5373
 epoch: 78, train_loss: 0.8050, test_loss: 0.8867, test_f1: 0.5389
 epoch: 79, train_loss: 0.8036, test_loss: 0.8645, test_f1: 0.5321
 epoch: 80, train_loss: 0.7949, test_loss: 0.8700, test_f1: 0.5488
 epoch: 81, train_loss: 0.7949, test_loss: 0.8557, test_f1: 0.5462
 epoch: 82, train_loss: 0.7993, test_loss: 0.8675, test_f1: 0.5421
 epoch: 83, train_loss: 0.7987, test_loss: 0.8792, test_f1: 0.5711
 epoch: 84, train_loss: 0.7953, test_loss: 0.8610, test_f1: 0.5301
 epoch: 85, train_loss: 0.7990, test_loss: 0.8758, test_f1: 0.5298
 epoch: 86, train_loss: 0.8005, test_loss: 0.8756, test_f1: 0.5255
 epoch: 87, train_loss: 0.7967, test_loss: 0.8902, test_f1: 0.5115
 epoch: 88, train_loss: 0.7958, test_loss: 0.8679, test_f1: 0.5404
 epoch: 89, train_loss: 0.7943, test_loss: 0.8752, test_f1: 0.5449
 epoch: 90, train_loss: 0.7874, test_loss: 0.8744, test_f1: 0.5394
 epoch: 91, train_loss: 0.7849, test_loss: 0.8772, test_f1: 0.5385
 epoch: 92, train_loss: 0.7733, test_loss: 0.8711, test_f1: 0.5260
 epoch: 93, train_loss: 0.7963, test_loss: 0.8669, test_f1: 0.5423
 epoch: 94, train_loss: 0.7896, test_loss: 0.8669, test_f1: 0.5299
 epoch: 95, train_loss: 0.7847, test_loss: 0.9035, test_f1: 0.5247
 epoch: 96, train_loss: 0.7815, test_loss: 0.8793, test_f1: 0.5414
 epoch: 97, train_loss: 0.7842, test_loss: 0.8997, test_f1: 0.5203
 epoch: 98, train_loss: 0.7854, test_loss: 0.8676, test_f1: 0.5347
 epoch: 99, train_loss: 0.7836, test_loss: 0.8745, test_f1: 0.5270
##################ITERATION #1 ****************************************
 epoch: 0, train_loss: 1.2952, test_loss: 1.3124, test_f1: 0.2270
 epoch: 1, train_loss: 1.2152, test_loss: 1.2334, test_f1: 0.2270
 epoch: 2, train_loss: 1.1634, test_loss: 1.1218, test_f1: 0.3583
 epoch: 3, train_loss: 1.1189, test_loss: 1.0760, test_f1: 0.4082
 epoch: 4, train_loss: 1.0838, test_loss: 1.0514, test_f1: 0.4186
 epoch: 5, train_loss: 1.0567, test_loss: 1.0403, test_f1: 0.4272
 epoch: 6, train_loss: 1.0381, test_loss: 1.0172, test_f1: 0.4601
 epoch: 7, train_loss: 1.0307, test_loss: 0.9911, test_f1: 0.4577
 epoch: 8, train_loss: 1.0208, test_loss: 0.9851, test_f1: 0.4795
 epoch: 9, train_loss: 1.0139, test_loss: 0.9697, test_f1: 0.4863
 epoch: 10, train_loss: 0.9980, test_loss: 0.9629, test_f1: 0.4829
 epoch: 11, train_loss: 0.9884, test_loss: 0.9465, test_f1: 0.5017
 epoch: 12, train_loss: 0.9919, test_loss: 0.9433, test_f1: 0.5180
 epoch: 13, train_loss: 0.9833, test_loss: 0.9413, test_f1: 0.5227
 epoch: 14, train_loss: 0.9651, test_loss: 0.9620, test_f1: 0.4967
 epoch: 15, train_loss: 0.9654, test_loss: 0.9299, test_f1: 0.5258
 epoch: 16, train_loss: 0.9647, test_loss: 0.9361, test_f1: 0.4897
 epoch: 17, train_loss: 0.9497, test_loss: 0.9309, test_f1: 0.5026
 epoch: 18, train_loss: 0.9474, test_loss: 0.9316, test_f1: 0.4945
 epoch: 19, train_loss: 0.9419, test_loss: 0.9157, test_f1: 0.5012
 epoch: 20, train_loss: 0.9397, test_loss: 0.9196, test_f1: 0.5019
 epoch: 21, train_loss: 0.9357, test_loss: 0.8939, test_f1: 0.5282
 epoch: 22, train_loss: 0.9323, test_loss: 0.9049, test_f1: 0.5124
 epoch: 23, train_loss: 0.9256, test_loss: 0.8852, test_f1: 0.5426
 epoch: 24, train_loss: 0.9194, test_loss: 0.9050, test_f1: 0.5206
 epoch: 25, train_loss: 0.9103, test_loss: 0.9045, test_f1: 0.5382
 epoch: 26, train_loss: 0.9183, test_loss: 0.9090, test_f1: 0.5211
 epoch: 27, train_loss: 0.9057, test_loss: 0.8986, test_f1: 0.5183
 epoch: 28, train_loss: 0.8954, test_loss: 0.8533, test_f1: 0.5541
 epoch: 29, train_loss: 0.8946, test_loss: 0.9092, test_f1: 0.5123
 epoch: 30, train_loss: 0.9075, test_loss: 0.9053, test_f1: 0.5229
 epoch: 31, train_loss: 0.8886, test_loss: 0.8783, test_f1: 0.5420
 epoch: 32, train_loss: 0.8994, test_loss: 0.8498, test_f1: 0.5504
 epoch: 33, train_loss: 0.8911, test_loss: 0.8594, test_f1: 0.5510
 epoch: 34, train_loss: 0.8833, test_loss: 0.8557, test_f1: 0.5553
 epoch: 35, train_loss: 0.8804, test_loss: 0.8430, test_f1: 0.5679
 epoch: 36, train_loss: 0.8719, test_loss: 0.8603, test_f1: 0.5305
 epoch: 37, train_loss: 0.8636, test_loss: 0.8579, test_f1: 0.5459
 epoch: 38, train_loss: 0.8760, test_loss: 0.9040, test_f1: 0.5307
 epoch: 39, train_loss: 0.8752, test_loss: 0.8395, test_f1: 0.5549
 epoch: 40, train_loss: 0.8598, test_loss: 0.8581, test_f1: 0.5333
 epoch: 41, train_loss: 0.8715, test_loss: 0.8871, test_f1: 0.5380
 epoch: 42, train_loss: 0.8632, test_loss: 0.9148, test_f1: 0.5338
 epoch: 43, train_loss: 0.8671, test_loss: 0.8674, test_f1: 0.5201
 epoch: 44, train_loss: 0.8539, test_loss: 0.8388, test_f1: 0.5562
 epoch: 45, train_loss: 0.8629, test_loss: 0.8575, test_f1: 0.5334
 epoch: 46, train_loss: 0.8569, test_loss: 0.8556, test_f1: 0.5471
 epoch: 47, train_loss: 0.8602, test_loss: 0.8784, test_f1: 0.5269
 epoch: 48, train_loss: 0.8300, test_loss: 0.9010, test_f1: 0.5493
 epoch: 49, train_loss: 0.8521, test_loss: 0.8449, test_f1: 0.5387
 epoch: 50, train_loss: 0.8461, test_loss: 0.8605, test_f1: 0.5475
 epoch: 51, train_loss: 0.8440, test_loss: 0.8750, test_f1: 0.5353
 epoch: 52, train_loss: 0.8406, test_loss: 0.8602, test_f1: 0.5240
 epoch: 53, train_loss: 0.8316, test_loss: 0.8869, test_f1: 0.5403
 epoch: 54, train_loss: 0.8327, test_loss: 0.8478, test_f1: 0.5470
 epoch: 55, train_loss: 0.8342, test_loss: 0.8556, test_f1: 0.5495
 epoch: 56, train_loss: 0.8333, test_loss: 0.8631, test_f1: 0.5301
 epoch: 57, train_loss: 0.8306, test_loss: 0.8528, test_f1: 0.5384
 epoch: 58, train_loss: 0.8357, test_loss: 0.8805, test_f1: 0.5250
 epoch: 59, train_loss: 0.8158, test_loss: 0.9026, test_f1: 0.5228
 epoch: 60, train_loss: 0.8253, test_loss: 0.8878, test_f1: 0.5459
 epoch: 61, train_loss: 0.8252, test_loss: 0.9153, test_f1: 0.5276
 epoch: 62, train_loss: 0.8265, test_loss: 0.8828, test_f1: 0.5418
 epoch: 63, train_loss: 0.8270, test_loss: 0.8525, test_f1: 0.5434
 epoch: 64, train_loss: 0.8232, test_loss: 0.9089, test_f1: 0.5291
 epoch: 65, train_loss: 0.8298, test_loss: 0.8846, test_f1: 0.5348
 epoch: 66, train_loss: 0.8160, test_loss: 0.8756, test_f1: 0.5454
 epoch: 67, train_loss: 0.8196, test_loss: 0.8549, test_f1: 0.5276
 epoch: 68, train_loss: 0.8153, test_loss: 0.8516, test_f1: 0.5486
 epoch: 69, train_loss: 0.8153, test_loss: 0.8655, test_f1: 0.5546
 epoch: 70, train_loss: 0.8160, test_loss: 0.8682, test_f1: 0.5236
 epoch: 71, train_loss: 0.8161, test_loss: 0.8839, test_f1: 0.5646
 epoch: 72, train_loss: 0.8150, test_loss: 0.8694, test_f1: 0.5254
 epoch: 73, train_loss: 0.8241, test_loss: 0.8521, test_f1: 0.5394
 epoch: 74, train_loss: 0.8175, test_loss: 0.8724, test_f1: 0.5429
 epoch: 75, train_loss: 0.8037, test_loss: 0.9109, test_f1: 0.5187
 epoch: 76, train_loss: 0.8201, test_loss: 0.8948, test_f1: 0.5399
 epoch: 77, train_loss: 0.8010, test_loss: 0.8739, test_f1: 0.5320
 epoch: 78, train_loss: 0.8050, test_loss: 0.8744, test_f1: 0.5394
 epoch: 79, train_loss: 0.8035, test_loss: 0.8735, test_f1: 0.5259
 epoch: 80, train_loss: 0.8084, test_loss: 0.8415, test_f1: 0.5465
 epoch: 81, train_loss: 0.8037, test_loss: 0.9194, test_f1: 0.5397
 epoch: 82, train_loss: 0.8104, test_loss: 0.8853, test_f1: 0.5419
 epoch: 83, train_loss: 0.8009, test_loss: 0.8803, test_f1: 0.5381
 epoch: 84, train_loss: 0.8008, test_loss: 0.8924, test_f1: 0.5437
 epoch: 85, train_loss: 0.8020, test_loss: 0.9046, test_f1: 0.5355
 epoch: 86, train_loss: 0.8077, test_loss: 0.8995, test_f1: 0.5320
 epoch: 87, train_loss: 0.8028, test_loss: 0.9171, test_f1: 0.5213
 epoch: 88, train_loss: 0.7920, test_loss: 0.9095, test_f1: 0.5336
 epoch: 89, train_loss: 0.8049, test_loss: 0.9320, test_f1: 0.5334
 epoch: 90, train_loss: 0.7893, test_loss: 0.8704, test_f1: 0.5350
 epoch: 91, train_loss: 0.8076, test_loss: 0.9038, test_f1: 0.5330
 epoch: 92, train_loss: 0.7928, test_loss: 0.8749, test_f1: 0.5490
 epoch: 93, train_loss: 0.7976, test_loss: 0.9022, test_f1: 0.5363
 epoch: 94, train_loss: 0.8005, test_loss: 0.9220, test_f1: 0.5221
 epoch: 95, train_loss: 0.7884, test_loss: 0.9102, test_f1: 0.5360
 epoch: 96, train_loss: 0.7871, test_loss: 0.8827, test_f1: 0.5481
 epoch: 97, train_loss: 0.7978, test_loss: 0.9167, test_f1: 0.5360
 epoch: 98, train_loss: 0.7953, test_loss: 0.8513, test_f1: 0.5481
 epoch: 99, train_loss: 0.8010, test_loss: 0.8716, test_f1: 0.5354
##################ITERATION #2 ****************************************
 epoch: 0, train_loss: 1.2737, test_loss: 1.2898, test_f1: 0.2270
 epoch: 1, train_loss: 1.1401, test_loss: 1.1227, test_f1: 0.3335
 epoch: 2, train_loss: 1.0957, test_loss: 1.0635, test_f1: 0.3578
 epoch: 3, train_loss: 1.0688, test_loss: 1.0529, test_f1: 0.3706
 epoch: 4, train_loss: 1.0560, test_loss: 1.0457, test_f1: 0.3761
 epoch: 5, train_loss: 1.0447, test_loss: 1.0380, test_f1: 0.4047
 epoch: 6, train_loss: 1.0339, test_loss: 1.0323, test_f1: 0.3835
 epoch: 7, train_loss: 1.0259, test_loss: 1.0362, test_f1: 0.3932
 epoch: 8, train_loss: 1.0211, test_loss: 1.0383, test_f1: 0.3869
 epoch: 9, train_loss: 1.0068, test_loss: 1.0149, test_f1: 0.4145
 epoch: 10, train_loss: 0.9920, test_loss: 0.9763, test_f1: 0.4619
 epoch: 11, train_loss: 0.9861, test_loss: 0.9949, test_f1: 0.4450
 epoch: 12, train_loss: 0.9673, test_loss: 0.9666, test_f1: 0.4853
 epoch: 13, train_loss: 0.9649, test_loss: 0.9785, test_f1: 0.5175
 epoch: 14, train_loss: 0.9515, test_loss: 0.9877, test_f1: 0.4908
 epoch: 15, train_loss: 0.9560, test_loss: 0.9796, test_f1: 0.4915
 epoch: 16, train_loss: 0.9524, test_loss: 0.9868, test_f1: 0.4838
 epoch: 17, train_loss: 0.9492, test_loss: 0.9924, test_f1: 0.4714
 epoch: 18, train_loss: 0.9433, test_loss: 0.9602, test_f1: 0.4993
 epoch: 19, train_loss: 0.9435, test_loss: 0.9511, test_f1: 0.4613
 epoch: 20, train_loss: 0.9284, test_loss: 0.9483, test_f1: 0.4988
 epoch: 21, train_loss: 0.9279, test_loss: 0.9782, test_f1: 0.4798
 epoch: 22, train_loss: 0.9236, test_loss: 0.9408, test_f1: 0.5109
 epoch: 23, train_loss: 0.9201, test_loss: 0.9485, test_f1: 0.5215
 epoch: 24, train_loss: 0.9070, test_loss: 0.9796, test_f1: 0.4972
 epoch: 25, train_loss: 0.9121, test_loss: 0.9249, test_f1: 0.5068
 epoch: 26, train_loss: 0.9067, test_loss: 0.9379, test_f1: 0.5271
 epoch: 27, train_loss: 0.8947, test_loss: 0.9225, test_f1: 0.4990
 epoch: 28, train_loss: 0.9082, test_loss: 0.9450, test_f1: 0.4865
 epoch: 29, train_loss: 0.9011, test_loss: 0.9404, test_f1: 0.5078
 epoch: 30, train_loss: 0.8923, test_loss: 0.9105, test_f1: 0.5107
 epoch: 31, train_loss: 0.8868, test_loss: 0.9396, test_f1: 0.4803
 epoch: 32, train_loss: 0.8822, test_loss: 0.9126, test_f1: 0.4972
 epoch: 33, train_loss: 0.8849, test_loss: 0.9269, test_f1: 0.4982
 epoch: 34, train_loss: 0.8757, test_loss: 0.9024, test_f1: 0.5216
 epoch: 35, train_loss: 0.8769, test_loss: 0.8850, test_f1: 0.5051
 epoch: 36, train_loss: 0.8820, test_loss: 0.9042, test_f1: 0.5193
 epoch: 37, train_loss: 0.8806, test_loss: 0.9282, test_f1: 0.5089
 epoch: 38, train_loss: 0.8650, test_loss: 0.8903, test_f1: 0.5258
 epoch: 39, train_loss: 0.8570, test_loss: 0.8869, test_f1: 0.5129
 epoch: 40, train_loss: 0.8588, test_loss: 0.8564, test_f1: 0.5298
 epoch: 41, train_loss: 0.8585, test_loss: 0.9123, test_f1: 0.5000
 epoch: 42, train_loss: 0.8472, test_loss: 0.8588, test_f1: 0.5383
 epoch: 43, train_loss: 0.8520, test_loss: 0.8612, test_f1: 0.5290
 epoch: 44, train_loss: 0.8568, test_loss: 0.9105, test_f1: 0.4952
 epoch: 45, train_loss: 0.8542, test_loss: 0.8396, test_f1: 0.5342
 epoch: 46, train_loss: 0.8486, test_loss: 0.8820, test_f1: 0.5182
 epoch: 47, train_loss: 0.8549, test_loss: 0.8701, test_f1: 0.5035
 epoch: 48, train_loss: 0.8411, test_loss: 0.8722, test_f1: 0.5266
 epoch: 49, train_loss: 0.8437, test_loss: 0.8928, test_f1: 0.5117
 epoch: 50, train_loss: 0.8418, test_loss: 0.8775, test_f1: 0.5120
 epoch: 51, train_loss: 0.8320, test_loss: 0.8924, test_f1: 0.5266
 epoch: 52, train_loss: 0.8229, test_loss: 0.8878, test_f1: 0.5400
 epoch: 53, train_loss: 0.8245, test_loss: 0.8658, test_f1: 0.5457
 epoch: 54, train_loss: 0.8269, test_loss: 0.8621, test_f1: 0.5315
 epoch: 55, train_loss: 0.8210, test_loss: 0.8694, test_f1: 0.5155
 epoch: 56, train_loss: 0.8134, test_loss: 0.8810, test_f1: 0.5207
 epoch: 57, train_loss: 0.8119, test_loss: 0.8655, test_f1: 0.5286
 epoch: 58, train_loss: 0.8157, test_loss: 0.8699, test_f1: 0.5475
 epoch: 59, train_loss: 0.8173, test_loss: 0.8535, test_f1: 0.5265
 epoch: 60, train_loss: 0.8193, test_loss: 0.8687, test_f1: 0.5307
 epoch: 61, train_loss: 0.8069, test_loss: 0.8646, test_f1: 0.5326
 epoch: 62, train_loss: 0.8125, test_loss: 0.8779, test_f1: 0.5312
 epoch: 63, train_loss: 0.8096, test_loss: 0.8800, test_f1: 0.5327
 epoch: 64, train_loss: 0.8103, test_loss: 0.8872, test_f1: 0.5325
 epoch: 65, train_loss: 0.8167, test_loss: 0.8665, test_f1: 0.5044
 epoch: 66, train_loss: 0.8035, test_loss: 0.8945, test_f1: 0.5335
 epoch: 67, train_loss: 0.8023, test_loss: 0.8712, test_f1: 0.5240
 epoch: 68, train_loss: 0.8052, test_loss: 0.8885, test_f1: 0.5308
 epoch: 69, train_loss: 0.8042, test_loss: 0.8951, test_f1: 0.5178
 epoch: 70, train_loss: 0.7964, test_loss: 0.8826, test_f1: 0.5355
 epoch: 71, train_loss: 0.7964, test_loss: 0.8819, test_f1: 0.5220
 epoch: 72, train_loss: 0.7877, test_loss: 0.8804, test_f1: 0.5463
 epoch: 73, train_loss: 0.7914, test_loss: 0.8850, test_f1: 0.5308
 epoch: 74, train_loss: 0.7959, test_loss: 0.9018, test_f1: 0.5349
 epoch: 75, train_loss: 0.7988, test_loss: 0.8865, test_f1: 0.5234
 epoch: 76, train_loss: 0.7899, test_loss: 0.8960, test_f1: 0.5353
 epoch: 77, train_loss: 0.7896, test_loss: 0.8941, test_f1: 0.5273
 epoch: 78, train_loss: 0.8011, test_loss: 0.9016, test_f1: 0.5441
 epoch: 79, train_loss: 0.7847, test_loss: 0.8956, test_f1: 0.5234
 epoch: 80, train_loss: 0.7954, test_loss: 0.8789, test_f1: 0.5239
 epoch: 81, train_loss: 0.7843, test_loss: 0.9050, test_f1: 0.5089
 epoch: 82, train_loss: 0.7873, test_loss: 0.9043, test_f1: 0.5284
 epoch: 83, train_loss: 0.7881, test_loss: 0.9160, test_f1: 0.5395
 epoch: 84, train_loss: 0.7760, test_loss: 0.8886, test_f1: 0.5346
 epoch: 85, train_loss: 0.7792, test_loss: 0.9090, test_f1: 0.5241
 epoch: 86, train_loss: 0.7714, test_loss: 0.8864, test_f1: 0.5378
 epoch: 87, train_loss: 0.7824, test_loss: 0.9168, test_f1: 0.5389
 epoch: 88, train_loss: 0.7746, test_loss: 0.9071, test_f1: 0.5344
 epoch: 89, train_loss: 0.7713, test_loss: 0.8976, test_f1: 0.5214
 epoch: 90, train_loss: 0.7786, test_loss: 0.8803, test_f1: 0.5376
 epoch: 91, train_loss: 0.7749, test_loss: 0.8932, test_f1: 0.5434
 epoch: 92, train_loss: 0.7798, test_loss: 0.8992, test_f1: 0.5384
 epoch: 93, train_loss: 0.7781, test_loss: 0.8962, test_f1: 0.5461
 epoch: 94, train_loss: 0.7701, test_loss: 0.8884, test_f1: 0.5504
 epoch: 95, train_loss: 0.7678, test_loss: 0.8968, test_f1: 0.5400
 epoch: 96, train_loss: 0.7717, test_loss: 0.9094, test_f1: 0.5373
 epoch: 97, train_loss: 0.7750, test_loss: 0.8983, test_f1: 0.5425
 epoch: 98, train_loss: 0.7596, test_loss: 0.8952, test_f1: 0.5496
 epoch: 99, train_loss: 0.7714, test_loss: 0.8994, test_f1: 0.5374
##################ITERATION #3 ****************************************
 epoch: 0, train_loss: 1.2233, test_loss: 1.2857, test_f1: 0.2270
 epoch: 1, train_loss: 1.1146, test_loss: 1.1231, test_f1: 0.3412
 epoch: 2, train_loss: 1.0771, test_loss: 1.0459, test_f1: 0.3462
 epoch: 3, train_loss: 1.0475, test_loss: 1.0349, test_f1: 0.3583
 epoch: 4, train_loss: 1.0392, test_loss: 1.0423, test_f1: 0.3628
 epoch: 5, train_loss: 1.0293, test_loss: 1.0211, test_f1: 0.3850
 epoch: 6, train_loss: 1.0200, test_loss: 1.0137, test_f1: 0.3936
 epoch: 7, train_loss: 1.0061, test_loss: 0.9997, test_f1: 0.4272
 epoch: 8, train_loss: 1.0060, test_loss: 1.0231, test_f1: 0.4407
 epoch: 9, train_loss: 0.9923, test_loss: 1.0092, test_f1: 0.4586
 epoch: 10, train_loss: 0.9867, test_loss: 1.0030, test_f1: 0.4705
 epoch: 11, train_loss: 0.9716, test_loss: 0.9728, test_f1: 0.4798
 epoch: 12, train_loss: 0.9657, test_loss: 0.9782, test_f1: 0.4802
 epoch: 13, train_loss: 0.9528, test_loss: 0.9663, test_f1: 0.4827
 epoch: 14, train_loss: 0.9447, test_loss: 0.9497, test_f1: 0.4891
 epoch: 15, train_loss: 0.9402, test_loss: 0.9564, test_f1: 0.4771
 epoch: 16, train_loss: 0.9429, test_loss: 0.9994, test_f1: 0.4908
 epoch: 17, train_loss: 0.9321, test_loss: 0.9474, test_f1: 0.4924
 epoch: 18, train_loss: 0.9448, test_loss: 0.9843, test_f1: 0.4630
 epoch: 19, train_loss: 0.9328, test_loss: 0.9694, test_f1: 0.5049
 epoch: 20, train_loss: 0.9195, test_loss: 0.9481, test_f1: 0.4975
 epoch: 21, train_loss: 0.9141, test_loss: 0.9274, test_f1: 0.4917
 epoch: 22, train_loss: 0.9068, test_loss: 0.9516, test_f1: 0.4975
 epoch: 23, train_loss: 0.8965, test_loss: 0.9391, test_f1: 0.5039
 epoch: 24, train_loss: 0.9126, test_loss: 0.9603, test_f1: 0.4983
 epoch: 25, train_loss: 0.8985, test_loss: 0.9557, test_f1: 0.5086
 epoch: 26, train_loss: 0.8981, test_loss: 0.9495, test_f1: 0.4919
 epoch: 27, train_loss: 0.9010, test_loss: 0.9485, test_f1: 0.4960
 epoch: 28, train_loss: 0.8964, test_loss: 0.9277, test_f1: 0.5183
 epoch: 29, train_loss: 0.8876, test_loss: 0.9142, test_f1: 0.5187
 epoch: 30, train_loss: 0.8824, test_loss: 0.9185, test_f1: 0.5117
 epoch: 31, train_loss: 0.8796, test_loss: 0.9242, test_f1: 0.5099
 epoch: 32, train_loss: 0.8819, test_loss: 0.9530, test_f1: 0.4866
 epoch: 33, train_loss: 0.8676, test_loss: 0.8729, test_f1: 0.5245
 epoch: 34, train_loss: 0.8753, test_loss: 0.9895, test_f1: 0.4814
 epoch: 35, train_loss: 0.8674, test_loss: 0.9323, test_f1: 0.5003
 epoch: 36, train_loss: 0.8736, test_loss: 0.9128, test_f1: 0.5248
 epoch: 37, train_loss: 0.8592, test_loss: 0.9179, test_f1: 0.5312
 epoch: 38, train_loss: 0.8564, test_loss: 0.9273, test_f1: 0.5228
 epoch: 39, train_loss: 0.8613, test_loss: 0.9367, test_f1: 0.4995
 epoch: 40, train_loss: 0.8535, test_loss: 0.9399, test_f1: 0.5170
 epoch: 41, train_loss: 0.8667, test_loss: 0.9619, test_f1: 0.5078
 epoch: 42, train_loss: 0.8488, test_loss: 0.9355, test_f1: 0.5246
 epoch: 43, train_loss: 0.8501, test_loss: 0.9249, test_f1: 0.5069
 epoch: 44, train_loss: 0.8588, test_loss: 0.9062, test_f1: 0.5299
 epoch: 45, train_loss: 0.8397, test_loss: 0.9613, test_f1: 0.5065
 epoch: 46, train_loss: 0.8466, test_loss: 0.8968, test_f1: 0.5541
 epoch: 47, train_loss: 0.8423, test_loss: 0.8939, test_f1: 0.5366
 epoch: 48, train_loss: 0.8441, test_loss: 0.9584, test_f1: 0.4857
 epoch: 49, train_loss: 0.8455, test_loss: 0.9302, test_f1: 0.5229
 epoch: 50, train_loss: 0.8308, test_loss: 0.8992, test_f1: 0.5329
 epoch: 51, train_loss: 0.8202, test_loss: 0.9055, test_f1: 0.5240
 epoch: 52, train_loss: 0.8303, test_loss: 0.9115, test_f1: 0.5292
 epoch: 53, train_loss: 0.8294, test_loss: 0.9351, test_f1: 0.5090
 epoch: 54, train_loss: 0.8200, test_loss: 0.9441, test_f1: 0.5053
 epoch: 55, train_loss: 0.8264, test_loss: 0.9389, test_f1: 0.5154
 epoch: 56, train_loss: 0.8179, test_loss: 0.9297, test_f1: 0.5222
 epoch: 57, train_loss: 0.8087, test_loss: 0.9123, test_f1: 0.5357
 epoch: 58, train_loss: 0.8171, test_loss: 0.9062, test_f1: 0.5308
 epoch: 59, train_loss: 0.8233, test_loss: 0.9230, test_f1: 0.5410
 epoch: 60, train_loss: 0.8136, test_loss: 0.9260, test_f1: 0.5199
 epoch: 61, train_loss: 0.8054, test_loss: 0.9143, test_f1: 0.5359
 epoch: 62, train_loss: 0.7976, test_loss: 0.9303, test_f1: 0.5290
 epoch: 63, train_loss: 0.8135, test_loss: 0.9594, test_f1: 0.5382
 epoch: 64, train_loss: 0.8051, test_loss: 0.9327, test_f1: 0.5149
 epoch: 65, train_loss: 0.8002, test_loss: 0.9279, test_f1: 0.5331
 epoch: 66, train_loss: 0.8099, test_loss: 0.9486, test_f1: 0.5247
 epoch: 67, train_loss: 0.8133, test_loss: 0.9141, test_f1: 0.5295
 epoch: 68, train_loss: 0.7979, test_loss: 0.9462, test_f1: 0.5176
 epoch: 69, train_loss: 0.7927, test_loss: 0.9635, test_f1: 0.5269
 epoch: 70, train_loss: 0.7971, test_loss: 0.9345, test_f1: 0.5243
 epoch: 71, train_loss: 0.7883, test_loss: 0.9798, test_f1: 0.5210
 epoch: 72, train_loss: 0.8041, test_loss: 0.9436, test_f1: 0.5395
 epoch: 73, train_loss: 0.7971, test_loss: 0.9887, test_f1: 0.5077
 epoch: 74, train_loss: 0.7983, test_loss: 0.9293, test_f1: 0.5364
 epoch: 75, train_loss: 0.7940, test_loss: 0.9377, test_f1: 0.5245
 epoch: 76, train_loss: 0.8027, test_loss: 0.9311, test_f1: 0.5244
 epoch: 77, train_loss: 0.7857, test_loss: 0.9485, test_f1: 0.5270
 epoch: 78, train_loss: 0.7920, test_loss: 0.9558, test_f1: 0.5268
 epoch: 79, train_loss: 0.7897, test_loss: 0.9351, test_f1: 0.5358
 epoch: 80, train_loss: 0.7873, test_loss: 0.9400, test_f1: 0.5255
 epoch: 81, train_loss: 0.7902, test_loss: 0.9552, test_f1: 0.5279
 epoch: 82, train_loss: 0.7854, test_loss: 0.9431, test_f1: 0.5234
 epoch: 83, train_loss: 0.7844, test_loss: 0.9499, test_f1: 0.5481
 epoch: 84, train_loss: 0.7843, test_loss: 0.9665, test_f1: 0.5246
 epoch: 85, train_loss: 0.7896, test_loss: 0.9577, test_f1: 0.5297
 epoch: 86, train_loss: 0.7739, test_loss: 0.9671, test_f1: 0.5297
 epoch: 87, train_loss: 0.7784, test_loss: 0.9677, test_f1: 0.5214
 epoch: 88, train_loss: 0.7813, test_loss: 0.9396, test_f1: 0.5250
 epoch: 89, train_loss: 0.7871, test_loss: 0.9797, test_f1: 0.5286
 epoch: 90, train_loss: 0.7822, test_loss: 1.0017, test_f1: 0.5221
 epoch: 91, train_loss: 0.7800, test_loss: 0.9516, test_f1: 0.5242
 epoch: 92, train_loss: 0.7816, test_loss: 0.9870, test_f1: 0.5205
 epoch: 93, train_loss: 0.7712, test_loss: 0.9588, test_f1: 0.5231
 epoch: 94, train_loss: 0.7771, test_loss: 0.9455, test_f1: 0.5340
 epoch: 95, train_loss: 0.7802, test_loss: 0.9441, test_f1: 0.5444
 epoch: 96, train_loss: 0.7749, test_loss: 0.9801, test_f1: 0.5034
 epoch: 97, train_loss: 0.7720, test_loss: 0.9687, test_f1: 0.5409
 epoch: 98, train_loss: 0.7780, test_loss: 0.9564, test_f1: 0.5240
 epoch: 99, train_loss: 0.7775, test_loss: 0.9488, test_f1: 0.5379
##################ITERATION #4 ****************************************
 epoch: 0, train_loss: 1.2360, test_loss: 1.4184, test_f1: 0.2619
 epoch: 1, train_loss: 1.1036, test_loss: 1.0918, test_f1: 0.4268
 epoch: 2, train_loss: 1.0727, test_loss: 1.0112, test_f1: 0.4336
 epoch: 3, train_loss: 1.0319, test_loss: 0.9873, test_f1: 0.4654
 epoch: 4, train_loss: 1.0157, test_loss: 0.9703, test_f1: 0.4589
 epoch: 5, train_loss: 1.0038, test_loss: 1.0000, test_f1: 0.4455
 epoch: 6, train_loss: 0.9985, test_loss: 0.9442, test_f1: 0.4825
 epoch: 7, train_loss: 0.9697, test_loss: 0.9572, test_f1: 0.4999
 epoch: 8, train_loss: 0.9717, test_loss: 0.9736, test_f1: 0.4874
 epoch: 9, train_loss: 0.9621, test_loss: 0.9643, test_f1: 0.4875
 epoch: 10, train_loss: 0.9467, test_loss: 0.9415, test_f1: 0.4816
 epoch: 11, train_loss: 0.9430, test_loss: 0.8941, test_f1: 0.4878
 epoch: 12, train_loss: 0.9258, test_loss: 0.9558, test_f1: 0.5073
 epoch: 13, train_loss: 0.9299, test_loss: 0.8814, test_f1: 0.4858
 epoch: 14, train_loss: 0.9276, test_loss: 0.9123, test_f1: 0.4702
 epoch: 15, train_loss: 0.9090, test_loss: 0.9347, test_f1: 0.5203
 epoch: 16, train_loss: 0.9062, test_loss: 0.8503, test_f1: 0.5254
 epoch: 17, train_loss: 0.8911, test_loss: 0.8877, test_f1: 0.5230
 epoch: 18, train_loss: 0.8914, test_loss: 0.8846, test_f1: 0.5396
 epoch: 19, train_loss: 0.8916, test_loss: 0.9184, test_f1: 0.5321
 epoch: 20, train_loss: 0.8988, test_loss: 0.8579, test_f1: 0.5211
 epoch: 21, train_loss: 0.8758, test_loss: 0.8601, test_f1: 0.5156
 epoch: 22, train_loss: 0.8614, test_loss: 0.8762, test_f1: 0.5346
 epoch: 23, train_loss: 0.8603, test_loss: 0.8484, test_f1: 0.5432
 epoch: 24, train_loss: 0.8584, test_loss: 0.8804, test_f1: 0.5265
 epoch: 25, train_loss: 0.8576, test_loss: 0.8729, test_f1: 0.5249
 epoch: 26, train_loss: 0.8484, test_loss: 0.8545, test_f1: 0.5407
 epoch: 27, train_loss: 0.8500, test_loss: 0.8805, test_f1: 0.5413
 epoch: 28, train_loss: 0.8470, test_loss: 0.8219, test_f1: 0.5494
 epoch: 29, train_loss: 0.8438, test_loss: 0.9098, test_f1: 0.5542
 epoch: 30, train_loss: 0.8498, test_loss: 0.8159, test_f1: 0.5506
 epoch: 31, train_loss: 0.8470, test_loss: 0.8098, test_f1: 0.5410
 epoch: 32, train_loss: 0.8335, test_loss: 0.8848, test_f1: 0.5390
 epoch: 33, train_loss: 0.8307, test_loss: 0.8213, test_f1: 0.5461
 epoch: 34, train_loss: 0.8225, test_loss: 0.8303, test_f1: 0.5538
 epoch: 35, train_loss: 0.8089, test_loss: 0.8183, test_f1: 0.5571
 epoch: 36, train_loss: 0.8184, test_loss: 0.8802, test_f1: 0.5436
 epoch: 37, train_loss: 0.8175, test_loss: 0.8141, test_f1: 0.5427
 epoch: 38, train_loss: 0.8262, test_loss: 0.7925, test_f1: 0.5652
 epoch: 39, train_loss: 0.8069, test_loss: 0.8156, test_f1: 0.5606
 epoch: 40, train_loss: 0.8093, test_loss: 0.8948, test_f1: 0.5425
 epoch: 41, train_loss: 0.8099, test_loss: 0.8048, test_f1: 0.5685
 epoch: 42, train_loss: 0.7995, test_loss: 0.8036, test_f1: 0.5580
 epoch: 43, train_loss: 0.8027, test_loss: 0.8254, test_f1: 0.5542
 epoch: 44, train_loss: 0.7964, test_loss: 0.8808, test_f1: 0.5551
 epoch: 45, train_loss: 0.7933, test_loss: 0.8335, test_f1: 0.5595
 epoch: 46, train_loss: 0.7948, test_loss: 0.9241, test_f1: 0.5794
 epoch: 47, train_loss: 0.7769, test_loss: 0.7823, test_f1: 0.5803
 epoch: 48, train_loss: 0.7849, test_loss: 0.7860, test_f1: 0.5772
 epoch: 49, train_loss: 0.7743, test_loss: 0.8277, test_f1: 0.5672
 epoch: 50, train_loss: 0.7871, test_loss: 0.7747, test_f1: 0.5881
 epoch: 51, train_loss: 0.7727, test_loss: 0.8767, test_f1: 0.5794
 epoch: 52, train_loss: 0.7734, test_loss: 0.8145, test_f1: 0.5835
 epoch: 53, train_loss: 0.7674, test_loss: 0.8134, test_f1: 0.5791
 epoch: 54, train_loss: 0.7733, test_loss: 0.8337, test_f1: 0.5784
 epoch: 55, train_loss: 0.7678, test_loss: 0.8342, test_f1: 0.5586
 epoch: 56, train_loss: 0.7572, test_loss: 0.8363, test_f1: 0.5773
 epoch: 57, train_loss: 0.7615, test_loss: 0.8608, test_f1: 0.5602
 epoch: 58, train_loss: 0.7548, test_loss: 0.8332, test_f1: 0.5609
 epoch: 59, train_loss: 0.7587, test_loss: 0.8720, test_f1: 0.5684
 epoch: 60, train_loss: 0.7653, test_loss: 0.8424, test_f1: 0.5682
 epoch: 61, train_loss: 0.7534, test_loss: 0.8088, test_f1: 0.5696
 epoch: 62, train_loss: 0.7491, test_loss: 0.8396, test_f1: 0.5761
 epoch: 63, train_loss: 0.7507, test_loss: 0.7904, test_f1: 0.5710
 epoch: 64, train_loss: 0.7653, test_loss: 0.8013, test_f1: 0.5725
 epoch: 65, train_loss: 0.7547, test_loss: 0.8311, test_f1: 0.5838
 epoch: 66, train_loss: 0.7526, test_loss: 0.7985, test_f1: 0.5876
 epoch: 67, train_loss: 0.7509, test_loss: 0.8242, test_f1: 0.5843
 epoch: 68, train_loss: 0.7530, test_loss: 0.7677, test_f1: 0.5863
 epoch: 69, train_loss: 0.7427, test_loss: 0.8028, test_f1: 0.5889
 epoch: 70, train_loss: 0.7442, test_loss: 0.8473, test_f1: 0.5850
 epoch: 71, train_loss: 0.7464, test_loss: 0.8228, test_f1: 0.5906
 epoch: 72, train_loss: 0.7456, test_loss: 0.8434, test_f1: 0.5841
 epoch: 73, train_loss: 0.7472, test_loss: 0.8074, test_f1: 0.5831
 epoch: 74, train_loss: 0.7530, test_loss: 0.8529, test_f1: 0.5729
 epoch: 75, train_loss: 0.7506, test_loss: 0.8421, test_f1: 0.5868
 epoch: 76, train_loss: 0.7405, test_loss: 0.8318, test_f1: 0.5799
 epoch: 77, train_loss: 0.7355, test_loss: 0.8742, test_f1: 0.5600
 epoch: 78, train_loss: 0.7376, test_loss: 0.8196, test_f1: 0.5931
 epoch: 79, train_loss: 0.7393, test_loss: 0.8055, test_f1: 0.5854
 epoch: 80, train_loss: 0.7278, test_loss: 0.8227, test_f1: 0.5869
 epoch: 81, train_loss: 0.7371, test_loss: 0.8722, test_f1: 0.6003
 epoch: 82, train_loss: 0.7402, test_loss: 0.8343, test_f1: 0.5810
 epoch: 83, train_loss: 0.7321, test_loss: 0.8308, test_f1: 0.5803
 epoch: 84, train_loss: 0.7469, test_loss: 0.8162, test_f1: 0.5899
 epoch: 85, train_loss: 0.7311, test_loss: 0.8623, test_f1: 0.5888
 epoch: 86, train_loss: 0.7423, test_loss: 0.8117, test_f1: 0.5832
 epoch: 87, train_loss: 0.7336, test_loss: 0.7932, test_f1: 0.5831
 epoch: 88, train_loss: 0.7275, test_loss: 0.8506, test_f1: 0.5903
 epoch: 89, train_loss: 0.7280, test_loss: 0.8853, test_f1: 0.5719
 epoch: 90, train_loss: 0.7309, test_loss: 0.8167, test_f1: 0.5939
 epoch: 91, train_loss: 0.7264, test_loss: 0.8163, test_f1: 0.6021
 epoch: 92, train_loss: 0.7271, test_loss: 0.8611, test_f1: 0.5959
 epoch: 93, train_loss: 0.7188, test_loss: 0.8750, test_f1: 0.5969
 epoch: 94, train_loss: 0.7269, test_loss: 0.8135, test_f1: 0.5935
 epoch: 95, train_loss: 0.7249, test_loss: 0.9026, test_f1: 0.5939
 epoch: 96, train_loss: 0.7337, test_loss: 0.7908, test_f1: 0.5923
 epoch: 97, train_loss: 0.7275, test_loss: 0.8315, test_f1: 0.5892
 epoch: 98, train_loss: 0.7408, test_loss: 0.8246, test_f1: 0.5988
 epoch: 99, train_loss: 0.7150, test_loss: 0.8770, test_f1: 0.5922
##################ITERATION #5 ****************************************
 epoch: 0, train_loss: 1.3565, test_loss: 1.3800, test_f1: 0.2270
 epoch: 1, train_loss: 1.1398, test_loss: 1.2498, test_f1: 0.2592
 epoch: 2, train_loss: 1.0913, test_loss: 1.0759, test_f1: 0.4080
 epoch: 3, train_loss: 1.0640, test_loss: 1.0316, test_f1: 0.4528
 epoch: 4, train_loss: 1.0416, test_loss: 1.0029, test_f1: 0.4787
 epoch: 5, train_loss: 1.0344, test_loss: 1.0226, test_f1: 0.4588
 epoch: 6, train_loss: 1.0136, test_loss: 0.9827, test_f1: 0.4727
 epoch: 7, train_loss: 0.9908, test_loss: 0.9590, test_f1: 0.4980
 epoch: 8, train_loss: 0.9855, test_loss: 0.9587, test_f1: 0.4994
 epoch: 9, train_loss: 0.9714, test_loss: 0.9842, test_f1: 0.4720
 epoch: 10, train_loss: 0.9615, test_loss: 0.9299, test_f1: 0.4882
 epoch: 11, train_loss: 0.9604, test_loss: 0.9333, test_f1: 0.5263
 epoch: 12, train_loss: 0.9435, test_loss: 0.9430, test_f1: 0.5005
 epoch: 13, train_loss: 0.9247, test_loss: 0.9018, test_f1: 0.5150
 epoch: 14, train_loss: 0.9277, test_loss: 0.9199, test_f1: 0.4959
 epoch: 15, train_loss: 0.9216, test_loss: 0.9126, test_f1: 0.5260
 epoch: 16, train_loss: 0.9243, test_loss: 0.9254, test_f1: 0.5101
 epoch: 17, train_loss: 0.9122, test_loss: 0.9081, test_f1: 0.5235
 epoch: 18, train_loss: 0.9024, test_loss: 0.9105, test_f1: 0.5341
 epoch: 19, train_loss: 0.8990, test_loss: 0.8870, test_f1: 0.5296
 epoch: 20, train_loss: 0.8962, test_loss: 0.9057, test_f1: 0.5252
 epoch: 21, train_loss: 0.8870, test_loss: 0.8840, test_f1: 0.5306
 epoch: 22, train_loss: 0.8733, test_loss: 0.8918, test_f1: 0.5391
 epoch: 23, train_loss: 0.8849, test_loss: 0.8806, test_f1: 0.5364
 epoch: 24, train_loss: 0.8726, test_loss: 0.8983, test_f1: 0.5234
 epoch: 25, train_loss: 0.8583, test_loss: 0.8728, test_f1: 0.5242
 epoch: 26, train_loss: 0.8700, test_loss: 0.8902, test_f1: 0.5248
 epoch: 27, train_loss: 0.8658, test_loss: 0.8878, test_f1: 0.5347
 epoch: 28, train_loss: 0.8610, test_loss: 0.8918, test_f1: 0.5526
 epoch: 29, train_loss: 0.8630, test_loss: 0.8680, test_f1: 0.5560
 epoch: 30, train_loss: 0.8595, test_loss: 0.8714, test_f1: 0.5419
 epoch: 31, train_loss: 0.8550, test_loss: 0.8592, test_f1: 0.5428
 epoch: 32, train_loss: 0.8392, test_loss: 0.8605, test_f1: 0.5410
 epoch: 33, train_loss: 0.8430, test_loss: 0.8985, test_f1: 0.5541
 epoch: 34, train_loss: 0.8441, test_loss: 0.8580, test_f1: 0.5498
 epoch: 35, train_loss: 0.8394, test_loss: 0.8995, test_f1: 0.5338
 epoch: 36, train_loss: 0.8384, test_loss: 0.8440, test_f1: 0.5517
 epoch: 37, train_loss: 0.8281, test_loss: 0.8589, test_f1: 0.5502
 epoch: 38, train_loss: 0.8143, test_loss: 0.8875, test_f1: 0.5661
 epoch: 39, train_loss: 0.8191, test_loss: 0.8715, test_f1: 0.5479
 epoch: 40, train_loss: 0.8090, test_loss: 0.8707, test_f1: 0.5529
 epoch: 41, train_loss: 0.8226, test_loss: 0.8629, test_f1: 0.5552
 epoch: 42, train_loss: 0.8061, test_loss: 0.8502, test_f1: 0.5679
 epoch: 43, train_loss: 0.8019, test_loss: 0.9118, test_f1: 0.5379
 epoch: 44, train_loss: 0.8152, test_loss: 0.8750, test_f1: 0.5586
 epoch: 45, train_loss: 0.8063, test_loss: 0.8016, test_f1: 0.5665
 epoch: 46, train_loss: 0.7976, test_loss: 0.8331, test_f1: 0.5768
 epoch: 47, train_loss: 0.7952, test_loss: 0.9009, test_f1: 0.5264
 epoch: 48, train_loss: 0.7888, test_loss: 0.8598, test_f1: 0.5820
 epoch: 49, train_loss: 0.7943, test_loss: 0.8506, test_f1: 0.5503
 epoch: 50, train_loss: 0.7923, test_loss: 0.8663, test_f1: 0.5382
 epoch: 51, train_loss: 0.7793, test_loss: 0.8436, test_f1: 0.5857
 epoch: 52, train_loss: 0.7695, test_loss: 0.8356, test_f1: 0.5515
 epoch: 53, train_loss: 0.7808, test_loss: 0.8610, test_f1: 0.5871
 epoch: 54, train_loss: 0.7764, test_loss: 0.8257, test_f1: 0.5737
 epoch: 55, train_loss: 0.7740, test_loss: 0.8162, test_f1: 0.5800
 epoch: 56, train_loss: 0.7729, test_loss: 0.8557, test_f1: 0.5846
 epoch: 57, train_loss: 0.7710, test_loss: 0.8204, test_f1: 0.5605
 epoch: 58, train_loss: 0.7777, test_loss: 0.8495, test_f1: 0.5558
 epoch: 59, train_loss: 0.7549, test_loss: 0.8523, test_f1: 0.5660
 epoch: 60, train_loss: 0.7658, test_loss: 0.8352, test_f1: 0.5603
 epoch: 61, train_loss: 0.7697, test_loss: 0.8579, test_f1: 0.5485
 epoch: 62, train_loss: 0.7598, test_loss: 0.8306, test_f1: 0.5611
 epoch: 63, train_loss: 0.7563, test_loss: 0.8164, test_f1: 0.5790
 epoch: 64, train_loss: 0.7626, test_loss: 0.8447, test_f1: 0.5461
 epoch: 65, train_loss: 0.7533, test_loss: 0.8427, test_f1: 0.5662
 epoch: 66, train_loss: 0.7645, test_loss: 0.8055, test_f1: 0.5895
 epoch: 67, train_loss: 0.7557, test_loss: 0.8022, test_f1: 0.5864
 epoch: 68, train_loss: 0.7463, test_loss: 0.8667, test_f1: 0.5574
 epoch: 69, train_loss: 0.7590, test_loss: 0.8226, test_f1: 0.5643
 epoch: 70, train_loss: 0.7489, test_loss: 0.8608, test_f1: 0.5871
 epoch: 71, train_loss: 0.7510, test_loss: 0.8289, test_f1: 0.5906
 epoch: 72, train_loss: 0.7592, test_loss: 0.8659, test_f1: 0.5761
 epoch: 73, train_loss: 0.7602, test_loss: 0.8818, test_f1: 0.5933
 epoch: 74, train_loss: 0.7503, test_loss: 0.8467, test_f1: 0.5926
 epoch: 75, train_loss: 0.7288, test_loss: 0.8549, test_f1: 0.5777
 epoch: 76, train_loss: 0.7468, test_loss: 0.8487, test_f1: 0.5696
 epoch: 77, train_loss: 0.7433, test_loss: 0.8221, test_f1: 0.5753
 epoch: 78, train_loss: 0.7336, test_loss: 0.8291, test_f1: 0.5929
 epoch: 79, train_loss: 0.7400, test_loss: 0.8311, test_f1: 0.5635
 epoch: 80, train_loss: 0.7417, test_loss: 0.8294, test_f1: 0.5644
 epoch: 81, train_loss: 0.7428, test_loss: 0.8280, test_f1: 0.5847
 epoch: 82, train_loss: 0.7480, test_loss: 0.8271, test_f1: 0.5824
 epoch: 83, train_loss: 0.7428, test_loss: 0.7976, test_f1: 0.5920
 epoch: 84, train_loss: 0.7405, test_loss: 0.8463, test_f1: 0.5514
 epoch: 85, train_loss: 0.7394, test_loss: 0.8256, test_f1: 0.6041
 epoch: 86, train_loss: 0.7312, test_loss: 0.8478, test_f1: 0.5883
 epoch: 87, train_loss: 0.7317, test_loss: 0.8599, test_f1: 0.5597
 epoch: 88, train_loss: 0.7403, test_loss: 0.8253, test_f1: 0.5983
 epoch: 89, train_loss: 0.7395, test_loss: 0.8266, test_f1: 0.5857
 epoch: 90, train_loss: 0.7254, test_loss: 0.8400, test_f1: 0.5723
 epoch: 91, train_loss: 0.7398, test_loss: 0.7889, test_f1: 0.5962
 epoch: 92, train_loss: 0.7439, test_loss: 0.8143, test_f1: 0.5991
 epoch: 93, train_loss: 0.7373, test_loss: 0.8390, test_f1: 0.5840
 epoch: 94, train_loss: 0.7503, test_loss: 0.8213, test_f1: 0.5908
 epoch: 95, train_loss: 0.7371, test_loss: 0.8287, test_f1: 0.5688
 epoch: 96, train_loss: 0.7209, test_loss: 0.8277, test_f1: 0.5689
 epoch: 97, train_loss: 0.7218, test_loss: 0.8009, test_f1: 0.5895
 epoch: 98, train_loss: 0.7238, test_loss: 0.8066, test_f1: 0.5950
 epoch: 99, train_loss: 0.7229, test_loss: 0.7948, test_f1: 0.5815
##################ITERATION #6 ****************************************
 epoch: 0, train_loss: 1.2949, test_loss: 1.4179, test_f1: 0.2270
 epoch: 1, train_loss: 1.1138, test_loss: 1.1185, test_f1: 0.3285
 epoch: 2, train_loss: 1.0826, test_loss: 1.0562, test_f1: 0.4153
 epoch: 3, train_loss: 1.0625, test_loss: 1.0357, test_f1: 0.4364
 epoch: 4, train_loss: 1.0462, test_loss: 1.0356, test_f1: 0.4572
 epoch: 5, train_loss: 1.0299, test_loss: 1.0284, test_f1: 0.4503
 epoch: 6, train_loss: 1.0250, test_loss: 1.0182, test_f1: 0.4421
 epoch: 7, train_loss: 1.0068, test_loss: 1.0045, test_f1: 0.4750
 epoch: 8, train_loss: 1.0065, test_loss: 1.0195, test_f1: 0.4656
 epoch: 9, train_loss: 1.0048, test_loss: 1.0008, test_f1: 0.4803
 epoch: 10, train_loss: 0.9920, test_loss: 1.0038, test_f1: 0.4728
 epoch: 11, train_loss: 0.9869, test_loss: 0.9900, test_f1: 0.4595
 epoch: 12, train_loss: 0.9769, test_loss: 0.9960, test_f1: 0.4741
 epoch: 13, train_loss: 0.9726, test_loss: 0.9907, test_f1: 0.5021
 epoch: 14, train_loss: 0.9626, test_loss: 0.9675, test_f1: 0.4958
 epoch: 15, train_loss: 0.9595, test_loss: 0.9685, test_f1: 0.5020
 epoch: 16, train_loss: 0.9559, test_loss: 0.9559, test_f1: 0.5019
 epoch: 17, train_loss: 0.9542, test_loss: 0.9631, test_f1: 0.4881
 epoch: 18, train_loss: 0.9355, test_loss: 0.9380, test_f1: 0.4842
 epoch: 19, train_loss: 0.9385, test_loss: 0.9638, test_f1: 0.4921
 epoch: 20, train_loss: 0.9399, test_loss: 0.9703, test_f1: 0.4850
 epoch: 21, train_loss: 0.9353, test_loss: 0.9276, test_f1: 0.5010
 epoch: 22, train_loss: 0.9282, test_loss: 0.9512, test_f1: 0.5337
 epoch: 23, train_loss: 0.9196, test_loss: 0.9565, test_f1: 0.5239
 epoch: 24, train_loss: 0.9190, test_loss: 0.9338, test_f1: 0.4958
 epoch: 25, train_loss: 0.9126, test_loss: 0.9179, test_f1: 0.5056
 epoch: 26, train_loss: 0.9085, test_loss: 0.9333, test_f1: 0.5299
 epoch: 27, train_loss: 0.9129, test_loss: 0.9400, test_f1: 0.5063
 epoch: 28, train_loss: 0.9053, test_loss: 0.9249, test_f1: 0.5160
 epoch: 29, train_loss: 0.8892, test_loss: 0.9342, test_f1: 0.4981
 epoch: 30, train_loss: 0.8975, test_loss: 0.9216, test_f1: 0.5219
 epoch: 31, train_loss: 0.8922, test_loss: 0.9142, test_f1: 0.5319
 epoch: 32, train_loss: 0.8864, test_loss: 0.9305, test_f1: 0.5252
 epoch: 33, train_loss: 0.8812, test_loss: 0.9708, test_f1: 0.4979
 epoch: 34, train_loss: 0.8772, test_loss: 0.9277, test_f1: 0.4976
 epoch: 35, train_loss: 0.8778, test_loss: 0.9138, test_f1: 0.5215
 epoch: 36, train_loss: 0.8751, test_loss: 0.9095, test_f1: 0.5196
 epoch: 37, train_loss: 0.8619, test_loss: 0.9010, test_f1: 0.5230
 epoch: 38, train_loss: 0.8676, test_loss: 0.9030, test_f1: 0.5186
 epoch: 39, train_loss: 0.8672, test_loss: 0.9288, test_f1: 0.5240
 epoch: 40, train_loss: 0.8659, test_loss: 0.8834, test_f1: 0.5171
 epoch: 41, train_loss: 0.8713, test_loss: 0.9496, test_f1: 0.5307
 epoch: 42, train_loss: 0.8591, test_loss: 0.9197, test_f1: 0.5366
 epoch: 43, train_loss: 0.8552, test_loss: 0.9598, test_f1: 0.5279
 epoch: 44, train_loss: 0.8527, test_loss: 0.9466, test_f1: 0.5074
 epoch: 45, train_loss: 0.8553, test_loss: 0.9088, test_f1: 0.5190
 epoch: 46, train_loss: 0.8534, test_loss: 0.9327, test_f1: 0.5324
 epoch: 47, train_loss: 0.8395, test_loss: 0.9200, test_f1: 0.5153
 epoch: 48, train_loss: 0.8297, test_loss: 0.8741, test_f1: 0.5441
 epoch: 49, train_loss: 0.8469, test_loss: 0.9262, test_f1: 0.5113
 epoch: 50, train_loss: 0.8471, test_loss: 0.9292, test_f1: 0.5335
 epoch: 51, train_loss: 0.8333, test_loss: 0.9078, test_f1: 0.5254
 epoch: 52, train_loss: 0.8480, test_loss: 0.8717, test_f1: 0.5169
 epoch: 53, train_loss: 0.8302, test_loss: 0.8864, test_f1: 0.5226
 epoch: 54, train_loss: 0.8261, test_loss: 0.8873, test_f1: 0.5289
 epoch: 55, train_loss: 0.8234, test_loss: 0.8781, test_f1: 0.5369
 epoch: 56, train_loss: 0.8337, test_loss: 0.9296, test_f1: 0.5297
 epoch: 57, train_loss: 0.8167, test_loss: 0.9106, test_f1: 0.5277
 epoch: 58, train_loss: 0.8116, test_loss: 0.9363, test_f1: 0.5176
 epoch: 59, train_loss: 0.8213, test_loss: 0.9030, test_f1: 0.5226
 epoch: 60, train_loss: 0.8118, test_loss: 0.8723, test_f1: 0.5249
 epoch: 61, train_loss: 0.8149, test_loss: 0.8844, test_f1: 0.5366
 epoch: 62, train_loss: 0.8081, test_loss: 0.8888, test_f1: 0.5207
 epoch: 63, train_loss: 0.8144, test_loss: 0.8690, test_f1: 0.5354
 epoch: 64, train_loss: 0.8185, test_loss: 0.9060, test_f1: 0.5259
 epoch: 65, train_loss: 0.8062, test_loss: 0.9038, test_f1: 0.5259
 epoch: 66, train_loss: 0.8090, test_loss: 0.8913, test_f1: 0.5235
 epoch: 67, train_loss: 0.8021, test_loss: 0.8864, test_f1: 0.5381
 epoch: 68, train_loss: 0.8172, test_loss: 0.9137, test_f1: 0.5197
 epoch: 69, train_loss: 0.8092, test_loss: 0.9239, test_f1: 0.5099
 epoch: 70, train_loss: 0.8118, test_loss: 0.8822, test_f1: 0.5197
 epoch: 71, train_loss: 0.7999, test_loss: 0.9193, test_f1: 0.5207
 epoch: 72, train_loss: 0.8058, test_loss: 0.8959, test_f1: 0.5420
 epoch: 73, train_loss: 0.8030, test_loss: 0.9002, test_f1: 0.5285
 epoch: 74, train_loss: 0.8043, test_loss: 0.9087, test_f1: 0.5260
 epoch: 75, train_loss: 0.7897, test_loss: 0.8773, test_f1: 0.5171
 epoch: 76, train_loss: 0.7862, test_loss: 0.9130, test_f1: 0.5229
 epoch: 77, train_loss: 0.7964, test_loss: 0.8776, test_f1: 0.5343
 epoch: 78, train_loss: 0.7997, test_loss: 0.9036, test_f1: 0.5215
 epoch: 79, train_loss: 0.7943, test_loss: 0.9175, test_f1: 0.5276
 epoch: 80, train_loss: 0.7935, test_loss: 0.8966, test_f1: 0.5502
 epoch: 81, train_loss: 0.7937, test_loss: 0.9152, test_f1: 0.5383
 epoch: 82, train_loss: 0.7930, test_loss: 0.9090, test_f1: 0.5178
 epoch: 83, train_loss: 0.7801, test_loss: 0.8931, test_f1: 0.5201
 epoch: 84, train_loss: 0.7943, test_loss: 0.9002, test_f1: 0.5546
 epoch: 85, train_loss: 0.7879, test_loss: 0.9311, test_f1: 0.5236
 epoch: 86, train_loss: 0.7805, test_loss: 0.9034, test_f1: 0.5379
 epoch: 87, train_loss: 0.7762, test_loss: 0.9041, test_f1: 0.5226
 epoch: 88, train_loss: 0.7704, test_loss: 0.9156, test_f1: 0.5335
 epoch: 89, train_loss: 0.7802, test_loss: 0.9332, test_f1: 0.5471
 epoch: 90, train_loss: 0.7841, test_loss: 0.9332, test_f1: 0.5258
 epoch: 91, train_loss: 0.7828, test_loss: 0.8968, test_f1: 0.5207
 epoch: 92, train_loss: 0.7754, test_loss: 0.8842, test_f1: 0.5414
 epoch: 93, train_loss: 0.7722, test_loss: 0.8761, test_f1: 0.5425
 epoch: 94, train_loss: 0.7793, test_loss: 0.8603, test_f1: 0.5435
 epoch: 95, train_loss: 0.7817, test_loss: 0.8762, test_f1: 0.5595
 epoch: 96, train_loss: 0.7729, test_loss: 0.8800, test_f1: 0.5280
 epoch: 97, train_loss: 0.7764, test_loss: 0.8946, test_f1: 0.5336
 epoch: 98, train_loss: 0.7821, test_loss: 0.8874, test_f1: 0.5350
 epoch: 99, train_loss: 0.7719, test_loss: 0.8915, test_f1: 0.5277
##################ITERATION #7 ****************************************
 epoch: 0, train_loss: 1.5084, test_loss: 1.3972, test_f1: 0.1234
 epoch: 1, train_loss: 1.1763, test_loss: 1.1557, test_f1: 0.4090
 epoch: 2, train_loss: 1.1280, test_loss: 1.0805, test_f1: 0.4436
 epoch: 3, train_loss: 1.0978, test_loss: 1.0685, test_f1: 0.4100
 epoch: 4, train_loss: 1.0710, test_loss: 1.0496, test_f1: 0.4461
 epoch: 5, train_loss: 1.0542, test_loss: 1.0309, test_f1: 0.4609
 epoch: 6, train_loss: 1.0351, test_loss: 1.0312, test_f1: 0.4428
 epoch: 7, train_loss: 1.0344, test_loss: 1.0277, test_f1: 0.4649
 epoch: 8, train_loss: 1.0161, test_loss: 1.0193, test_f1: 0.4596
 epoch: 9, train_loss: 1.0012, test_loss: 1.0098, test_f1: 0.4754
 epoch: 10, train_loss: 0.9958, test_loss: 1.0100, test_f1: 0.4688
 epoch: 11, train_loss: 0.9974, test_loss: 1.0081, test_f1: 0.4752
 epoch: 12, train_loss: 0.9803, test_loss: 0.9849, test_f1: 0.4810
 epoch: 13, train_loss: 0.9757, test_loss: 0.9904, test_f1: 0.4887
 epoch: 14, train_loss: 0.9607, test_loss: 0.9800, test_f1: 0.4689
 epoch: 15, train_loss: 0.9580, test_loss: 0.9928, test_f1: 0.5027
 epoch: 16, train_loss: 0.9596, test_loss: 0.9917, test_f1: 0.5048
 epoch: 17, train_loss: 0.9589, test_loss: 0.9868, test_f1: 0.4920
 epoch: 18, train_loss: 0.9520, test_loss: 0.9757, test_f1: 0.4860
 epoch: 19, train_loss: 0.9333, test_loss: 0.9602, test_f1: 0.4965
 epoch: 20, train_loss: 0.9318, test_loss: 0.9689, test_f1: 0.5004
 epoch: 21, train_loss: 0.9254, test_loss: 0.9604, test_f1: 0.5172
 epoch: 22, train_loss: 0.9312, test_loss: 0.9698, test_f1: 0.5027
 epoch: 23, train_loss: 0.9243, test_loss: 0.9947, test_f1: 0.5085
 epoch: 24, train_loss: 0.9241, test_loss: 0.9705, test_f1: 0.4835
 epoch: 25, train_loss: 0.9100, test_loss: 0.9690, test_f1: 0.4976
 epoch: 26, train_loss: 0.9103, test_loss: 0.9502, test_f1: 0.5094
 epoch: 27, train_loss: 0.9049, test_loss: 0.9591, test_f1: 0.5180
 epoch: 28, train_loss: 0.9007, test_loss: 0.9606, test_f1: 0.4914
 epoch: 29, train_loss: 0.9034, test_loss: 0.9587, test_f1: 0.4882
 epoch: 30, train_loss: 0.8898, test_loss: 0.9579, test_f1: 0.5001
 epoch: 31, train_loss: 0.8823, test_loss: 0.9903, test_f1: 0.4780
 epoch: 32, train_loss: 0.8879, test_loss: 0.9486, test_f1: 0.5045
 epoch: 33, train_loss: 0.8808, test_loss: 0.9995, test_f1: 0.4990
 epoch: 34, train_loss: 0.8904, test_loss: 0.9302, test_f1: 0.4905
 epoch: 35, train_loss: 0.8839, test_loss: 0.9311, test_f1: 0.5079
 epoch: 36, train_loss: 0.8602, test_loss: 0.9396, test_f1: 0.5158
 epoch: 37, train_loss: 0.8678, test_loss: 0.9334, test_f1: 0.5099
 epoch: 38, train_loss: 0.8714, test_loss: 0.9288, test_f1: 0.5212
 epoch: 39, train_loss: 0.8687, test_loss: 0.9424, test_f1: 0.5315
 epoch: 40, train_loss: 0.8547, test_loss: 0.9069, test_f1: 0.5273
 epoch: 41, train_loss: 0.8599, test_loss: 0.9364, test_f1: 0.5086
 epoch: 42, train_loss: 0.8514, test_loss: 0.9417, test_f1: 0.5130
 epoch: 43, train_loss: 0.8521, test_loss: 0.9310, test_f1: 0.5047
 epoch: 44, train_loss: 0.8453, test_loss: 0.9430, test_f1: 0.5038
 epoch: 45, train_loss: 0.8440, test_loss: 0.9293, test_f1: 0.5070
 epoch: 46, train_loss: 0.8363, test_loss: 0.9193, test_f1: 0.5027
 epoch: 47, train_loss: 0.8415, test_loss: 0.9607, test_f1: 0.5067
 epoch: 48, train_loss: 0.8473, test_loss: 0.9324, test_f1: 0.5073
 epoch: 49, train_loss: 0.8351, test_loss: 0.9237, test_f1: 0.5237
 epoch: 50, train_loss: 0.8333, test_loss: 0.9402, test_f1: 0.5383
 epoch: 51, train_loss: 0.8209, test_loss: 0.9276, test_f1: 0.5268
 epoch: 52, train_loss: 0.8146, test_loss: 0.9253, test_f1: 0.5247
 epoch: 53, train_loss: 0.8148, test_loss: 0.9082, test_f1: 0.5167
 epoch: 54, train_loss: 0.8158, test_loss: 0.9044, test_f1: 0.5074
 epoch: 55, train_loss: 0.8093, test_loss: 0.9022, test_f1: 0.5245
 epoch: 56, train_loss: 0.8105, test_loss: 0.9157, test_f1: 0.5292
 epoch: 57, train_loss: 0.8080, test_loss: 0.9080, test_f1: 0.5444
 epoch: 58, train_loss: 0.8035, test_loss: 0.9251, test_f1: 0.5296
 epoch: 59, train_loss: 0.8131, test_loss: 0.9307, test_f1: 0.5397
 epoch: 60, train_loss: 0.8064, test_loss: 0.9212, test_f1: 0.5345
 epoch: 61, train_loss: 0.8112, test_loss: 0.9071, test_f1: 0.5293
 epoch: 62, train_loss: 0.8016, test_loss: 0.9211, test_f1: 0.5085
 epoch: 63, train_loss: 0.8000, test_loss: 0.9236, test_f1: 0.5238
 epoch: 64, train_loss: 0.7920, test_loss: 0.9261, test_f1: 0.5441
 epoch: 65, train_loss: 0.7923, test_loss: 0.9367, test_f1: 0.5321
 epoch: 66, train_loss: 0.7845, test_loss: 0.9254, test_f1: 0.5229
 epoch: 67, train_loss: 0.8040, test_loss: 0.9295, test_f1: 0.5429
 epoch: 68, train_loss: 0.7956, test_loss: 0.9291, test_f1: 0.5149
 epoch: 69, train_loss: 0.7988, test_loss: 0.9428, test_f1: 0.5169
 epoch: 70, train_loss: 0.7744, test_loss: 0.9404, test_f1: 0.5165
 epoch: 71, train_loss: 0.7904, test_loss: 0.9404, test_f1: 0.5391
 epoch: 72, train_loss: 0.7886, test_loss: 0.9249, test_f1: 0.5390
 epoch: 73, train_loss: 0.7852, test_loss: 0.9444, test_f1: 0.5366
 epoch: 74, train_loss: 0.7967, test_loss: 0.9475, test_f1: 0.5165
 epoch: 75, train_loss: 0.7892, test_loss: 0.9378, test_f1: 0.5480
 epoch: 76, train_loss: 0.7862, test_loss: 0.9375, test_f1: 0.5391
 epoch: 77, train_loss: 0.7756, test_loss: 0.9553, test_f1: 0.5503
 epoch: 78, train_loss: 0.7741, test_loss: 0.9722, test_f1: 0.5421
 epoch: 79, train_loss: 0.7824, test_loss: 0.9578, test_f1: 0.5339
 epoch: 80, train_loss: 0.7747, test_loss: 0.9347, test_f1: 0.5493
 epoch: 81, train_loss: 0.7788, test_loss: 0.9343, test_f1: 0.5324
 epoch: 82, train_loss: 0.7787, test_loss: 0.9581, test_f1: 0.5519
 epoch: 83, train_loss: 0.7730, test_loss: 0.9563, test_f1: 0.5343
 epoch: 84, train_loss: 0.7825, test_loss: 0.9695, test_f1: 0.5405
 epoch: 85, train_loss: 0.7781, test_loss: 0.9812, test_f1: 0.5123
 epoch: 86, train_loss: 0.7720, test_loss: 0.9455, test_f1: 0.5371
 epoch: 87, train_loss: 0.7684, test_loss: 0.9788, test_f1: 0.5489
 epoch: 88, train_loss: 0.7769, test_loss: 0.9801, test_f1: 0.5559
 epoch: 89, train_loss: 0.7610, test_loss: 0.9708, test_f1: 0.5408
 epoch: 90, train_loss: 0.7638, test_loss: 0.9792, test_f1: 0.5505
 epoch: 91, train_loss: 0.7737, test_loss: 0.9648, test_f1: 0.5429
 epoch: 92, train_loss: 0.7713, test_loss: 0.9426, test_f1: 0.5531
 epoch: 93, train_loss: 0.7647, test_loss: 0.9586, test_f1: 0.5467
 epoch: 94, train_loss: 0.7727, test_loss: 0.9602, test_f1: 0.5540
 epoch: 95, train_loss: 0.7701, test_loss: 0.9569, test_f1: 0.5459
 epoch: 96, train_loss: 0.7602, test_loss: 0.9716, test_f1: 0.5617
 epoch: 97, train_loss: 0.7697, test_loss: 0.9744, test_f1: 0.5438
 epoch: 98, train_loss: 0.7578, test_loss: 0.9892, test_f1: 0.5434
 epoch: 99, train_loss: 0.7632, test_loss: 1.0303, test_f1: 0.5461
##################ITERATION #8 ****************************************
 epoch: 0, train_loss: 1.4142, test_loss: 1.4285, test_f1: 0.2270
 epoch: 1, train_loss: 1.1409, test_loss: 1.1964, test_f1: 0.3010
 epoch: 2, train_loss: 1.0847, test_loss: 1.0055, test_f1: 0.4621
 epoch: 3, train_loss: 1.0471, test_loss: 0.9625, test_f1: 0.4851
 epoch: 4, train_loss: 1.0161, test_loss: 0.9752, test_f1: 0.4862
 epoch: 5, train_loss: 1.0127, test_loss: 0.9423, test_f1: 0.4930
 epoch: 6, train_loss: 0.9966, test_loss: 0.9405, test_f1: 0.4731
 epoch: 7, train_loss: 0.9919, test_loss: 0.9348, test_f1: 0.4788
 epoch: 8, train_loss: 0.9777, test_loss: 0.9291, test_f1: 0.4819
 epoch: 9, train_loss: 0.9672, test_loss: 0.9230, test_f1: 0.4986
 epoch: 10, train_loss: 0.9463, test_loss: 0.9114, test_f1: 0.5029
 epoch: 11, train_loss: 0.9527, test_loss: 0.9124, test_f1: 0.5098
 epoch: 12, train_loss: 0.9439, test_loss: 0.8919, test_f1: 0.5068
 epoch: 13, train_loss: 0.9315, test_loss: 0.8846, test_f1: 0.5440
 epoch: 14, train_loss: 0.9282, test_loss: 0.8784, test_f1: 0.5354
 epoch: 15, train_loss: 0.9148, test_loss: 0.8741, test_f1: 0.5385
 epoch: 16, train_loss: 0.9117, test_loss: 0.8707, test_f1: 0.5457
 epoch: 17, train_loss: 0.9078, test_loss: 0.8657, test_f1: 0.5710
 epoch: 18, train_loss: 0.8962, test_loss: 0.8519, test_f1: 0.5770
 epoch: 19, train_loss: 0.8894, test_loss: 0.8506, test_f1: 0.5521
 epoch: 20, train_loss: 0.8863, test_loss: 0.8401, test_f1: 0.5868
 epoch: 21, train_loss: 0.8812, test_loss: 0.8444, test_f1: 0.5552
 epoch: 22, train_loss: 0.8818, test_loss: 0.8414, test_f1: 0.5533
 epoch: 23, train_loss: 0.8853, test_loss: 0.8477, test_f1: 0.5736
 epoch: 24, train_loss: 0.8817, test_loss: 0.8532, test_f1: 0.5272
 epoch: 25, train_loss: 0.8727, test_loss: 0.8382, test_f1: 0.5590
 epoch: 26, train_loss: 0.8664, test_loss: 0.8341, test_f1: 0.5738
 epoch: 27, train_loss: 0.8582, test_loss: 0.8233, test_f1: 0.5526
 epoch: 28, train_loss: 0.8538, test_loss: 0.8408, test_f1: 0.5478
 epoch: 29, train_loss: 0.8549, test_loss: 0.8314, test_f1: 0.5652
 epoch: 30, train_loss: 0.8449, test_loss: 0.8251, test_f1: 0.5609
 epoch: 31, train_loss: 0.8503, test_loss: 0.8113, test_f1: 0.5707
 epoch: 32, train_loss: 0.8410, test_loss: 0.8189, test_f1: 0.5749
 epoch: 33, train_loss: 0.8428, test_loss: 0.8174, test_f1: 0.5416
 epoch: 34, train_loss: 0.8412, test_loss: 0.8165, test_f1: 0.5599
 epoch: 35, train_loss: 0.8333, test_loss: 0.8029, test_f1: 0.5764
 epoch: 36, train_loss: 0.8330, test_loss: 0.8401, test_f1: 0.5566
 epoch: 37, train_loss: 0.8363, test_loss: 0.8013, test_f1: 0.5553
 epoch: 38, train_loss: 0.8281, test_loss: 0.8070, test_f1: 0.5643
 epoch: 39, train_loss: 0.8221, test_loss: 0.8257, test_f1: 0.5606
 epoch: 40, train_loss: 0.8182, test_loss: 0.8030, test_f1: 0.5842
 epoch: 41, train_loss: 0.8180, test_loss: 0.8293, test_f1: 0.5489
 epoch: 42, train_loss: 0.8184, test_loss: 0.8053, test_f1: 0.5721
 epoch: 43, train_loss: 0.8134, test_loss: 0.7859, test_f1: 0.5769
 epoch: 44, train_loss: 0.8123, test_loss: 0.8097, test_f1: 0.5520
 epoch: 45, train_loss: 0.8043, test_loss: 0.7754, test_f1: 0.5898
 epoch: 46, train_loss: 0.8180, test_loss: 0.7956, test_f1: 0.5583
 epoch: 47, train_loss: 0.8128, test_loss: 0.8225, test_f1: 0.5497
 epoch: 48, train_loss: 0.8035, test_loss: 0.7807, test_f1: 0.5733
 epoch: 49, train_loss: 0.7969, test_loss: 0.7847, test_f1: 0.5689
 epoch: 50, train_loss: 0.8051, test_loss: 0.7897, test_f1: 0.5830
 epoch: 51, train_loss: 0.7930, test_loss: 0.7859, test_f1: 0.5700
 epoch: 52, train_loss: 0.7855, test_loss: 0.7875, test_f1: 0.5671
 epoch: 53, train_loss: 0.7923, test_loss: 0.7787, test_f1: 0.5752
 epoch: 54, train_loss: 0.7632, test_loss: 0.7710, test_f1: 0.5822
 epoch: 55, train_loss: 0.7795, test_loss: 0.7838, test_f1: 0.5783
 epoch: 56, train_loss: 0.7901, test_loss: 0.7717, test_f1: 0.5977
 epoch: 57, train_loss: 0.7815, test_loss: 0.7777, test_f1: 0.5739
 epoch: 58, train_loss: 0.7895, test_loss: 0.7631, test_f1: 0.5740
 epoch: 59, train_loss: 0.7795, test_loss: 0.7750, test_f1: 0.5847
 epoch: 60, train_loss: 0.7680, test_loss: 0.7623, test_f1: 0.5802
 epoch: 61, train_loss: 0.7749, test_loss: 0.7673, test_f1: 0.5720
 epoch: 62, train_loss: 0.7686, test_loss: 0.7591, test_f1: 0.5823
 epoch: 63, train_loss: 0.7734, test_loss: 0.7584, test_f1: 0.6009
 epoch: 64, train_loss: 0.7620, test_loss: 0.7698, test_f1: 0.5902
 epoch: 65, train_loss: 0.7522, test_loss: 0.7639, test_f1: 0.5910
 epoch: 66, train_loss: 0.7690, test_loss: 0.7499, test_f1: 0.6231
 epoch: 67, train_loss: 0.7708, test_loss: 0.7639, test_f1: 0.5950
 epoch: 68, train_loss: 0.7726, test_loss: 0.7623, test_f1: 0.6051
 epoch: 69, train_loss: 0.7578, test_loss: 0.7591, test_f1: 0.5941
 epoch: 70, train_loss: 0.7642, test_loss: 0.7492, test_f1: 0.6093
 epoch: 71, train_loss: 0.7650, test_loss: 0.7548, test_f1: 0.5948
 epoch: 72, train_loss: 0.7500, test_loss: 0.7521, test_f1: 0.5953
 epoch: 73, train_loss: 0.7409, test_loss: 0.7692, test_f1: 0.5804
 epoch: 74, train_loss: 0.7584, test_loss: 0.7573, test_f1: 0.6034
 epoch: 75, train_loss: 0.7649, test_loss: 0.7598, test_f1: 0.5882
 epoch: 76, train_loss: 0.7459, test_loss: 0.7904, test_f1: 0.6146
 epoch: 77, train_loss: 0.7465, test_loss: 0.7532, test_f1: 0.5985
 epoch: 78, train_loss: 0.7575, test_loss: 0.7603, test_f1: 0.5823
 epoch: 79, train_loss: 0.7472, test_loss: 0.7545, test_f1: 0.6223
 epoch: 80, train_loss: 0.7549, test_loss: 0.7439, test_f1: 0.5970
 epoch: 81, train_loss: 0.7446, test_loss: 0.7447, test_f1: 0.6128
 epoch: 82, train_loss: 0.7533, test_loss: 0.7421, test_f1: 0.6038
 epoch: 83, train_loss: 0.7493, test_loss: 0.7488, test_f1: 0.5941
 epoch: 84, train_loss: 0.7484, test_loss: 0.7425, test_f1: 0.6139
 epoch: 85, train_loss: 0.7349, test_loss: 0.7454, test_f1: 0.5901
 epoch: 86, train_loss: 0.7305, test_loss: 0.7522, test_f1: 0.5967
 epoch: 87, train_loss: 0.7461, test_loss: 0.7580, test_f1: 0.6040
 epoch: 88, train_loss: 0.7343, test_loss: 0.7413, test_f1: 0.6180
 epoch: 89, train_loss: 0.7293, test_loss: 0.7732, test_f1: 0.6055
 epoch: 90, train_loss: 0.7382, test_loss: 0.7587, test_f1: 0.6130
 epoch: 91, train_loss: 0.7389, test_loss: 0.7400, test_f1: 0.5970
 epoch: 92, train_loss: 0.7401, test_loss: 0.7727, test_f1: 0.6044
 epoch: 93, train_loss: 0.7302, test_loss: 0.7590, test_f1: 0.6133
 epoch: 94, train_loss: 0.7402, test_loss: 0.7526, test_f1: 0.6038
 epoch: 95, train_loss: 0.7385, test_loss: 0.7767, test_f1: 0.5970
 epoch: 96, train_loss: 0.7299, test_loss: 0.7527, test_f1: 0.6123
 epoch: 97, train_loss: 0.7259, test_loss: 0.7526, test_f1: 0.5854
 epoch: 98, train_loss: 0.7290, test_loss: 0.7515, test_f1: 0.6197
 epoch: 99, train_loss: 0.7388, test_loss: 0.7579, test_f1: 0.5999
##################ITERATION #9 ****************************************
 epoch: 0, train_loss: 1.4589, test_loss: 1.3701, test_f1: 0.2270
 epoch: 1, train_loss: 1.1582, test_loss: 1.1252, test_f1: 0.4197
 epoch: 2, train_loss: 1.0945, test_loss: 1.0228, test_f1: 0.4560
 epoch: 3, train_loss: 1.0631, test_loss: 1.0038, test_f1: 0.4601
 epoch: 4, train_loss: 1.0557, test_loss: 0.9650, test_f1: 0.4852
 epoch: 5, train_loss: 1.0306, test_loss: 0.9613, test_f1: 0.4822
 epoch: 6, train_loss: 1.0077, test_loss: 0.9556, test_f1: 0.4923
 epoch: 7, train_loss: 1.0026, test_loss: 0.9688, test_f1: 0.4648
 epoch: 8, train_loss: 0.9931, test_loss: 0.9588, test_f1: 0.4770
 epoch: 9, train_loss: 0.9771, test_loss: 0.9379, test_f1: 0.4724
 epoch: 10, train_loss: 0.9762, test_loss: 0.9188, test_f1: 0.5095
 epoch: 11, train_loss: 0.9663, test_loss: 0.9216, test_f1: 0.5110
 epoch: 12, train_loss: 0.9705, test_loss: 0.9238, test_f1: 0.5051
 epoch: 13, train_loss: 0.9615, test_loss: 0.9223, test_f1: 0.5180
 epoch: 14, train_loss: 0.9600, test_loss: 0.9260, test_f1: 0.4955
 epoch: 15, train_loss: 0.9545, test_loss: 0.9293, test_f1: 0.5130
 epoch: 16, train_loss: 0.9379, test_loss: 0.9219, test_f1: 0.5124
 epoch: 17, train_loss: 0.9367, test_loss: 0.9079, test_f1: 0.5046
 epoch: 18, train_loss: 0.9367, test_loss: 0.9142, test_f1: 0.5124
 epoch: 19, train_loss: 0.9325, test_loss: 0.8857, test_f1: 0.5395
 epoch: 20, train_loss: 0.9272, test_loss: 0.9040, test_f1: 0.5272
 epoch: 21, train_loss: 0.9266, test_loss: 0.9186, test_f1: 0.4901
 epoch: 22, train_loss: 0.9283, test_loss: 0.8811, test_f1: 0.5242
 epoch: 23, train_loss: 0.9171, test_loss: 0.8804, test_f1: 0.5250
 epoch: 24, train_loss: 0.9194, test_loss: 0.8769, test_f1: 0.5363
 epoch: 25, train_loss: 0.9209, test_loss: 0.8832, test_f1: 0.5201
 epoch: 26, train_loss: 0.9060, test_loss: 0.8807, test_f1: 0.5273
 epoch: 27, train_loss: 0.9167, test_loss: 0.8662, test_f1: 0.5369
 epoch: 28, train_loss: 0.8969, test_loss: 0.8685, test_f1: 0.5366
 epoch: 29, train_loss: 0.9203, test_loss: 0.8655, test_f1: 0.5466
 epoch: 30, train_loss: 0.8996, test_loss: 0.8600, test_f1: 0.5471
 epoch: 31, train_loss: 0.8870, test_loss: 0.8386, test_f1: 0.5655
 epoch: 32, train_loss: 0.8929, test_loss: 0.8914, test_f1: 0.5202
 epoch: 33, train_loss: 0.8911, test_loss: 0.8626, test_f1: 0.5253
 epoch: 34, train_loss: 0.8835, test_loss: 0.8666, test_f1: 0.5230
 epoch: 35, train_loss: 0.8797, test_loss: 0.8585, test_f1: 0.5252
 epoch: 36, train_loss: 0.8818, test_loss: 0.8714, test_f1: 0.5278
 epoch: 37, train_loss: 0.8671, test_loss: 0.8675, test_f1: 0.5427
 epoch: 38, train_loss: 0.8645, test_loss: 0.9126, test_f1: 0.5273
 epoch: 39, train_loss: 0.8755, test_loss: 0.8670, test_f1: 0.5318
 epoch: 40, train_loss: 0.8785, test_loss: 0.8349, test_f1: 0.5574
 epoch: 41, train_loss: 0.8641, test_loss: 0.8838, test_f1: 0.5256
 epoch: 42, train_loss: 0.8569, test_loss: 0.8338, test_f1: 0.5617
 epoch: 43, train_loss: 0.8531, test_loss: 0.8404, test_f1: 0.5593
 epoch: 44, train_loss: 0.8508, test_loss: 0.8482, test_f1: 0.5408
 epoch: 45, train_loss: 0.8512, test_loss: 0.8274, test_f1: 0.5669
 epoch: 46, train_loss: 0.8453, test_loss: 0.8567, test_f1: 0.5395
 epoch: 47, train_loss: 0.8537, test_loss: 0.8518, test_f1: 0.5505
 epoch: 48, train_loss: 0.8385, test_loss: 0.8435, test_f1: 0.5532
 epoch: 49, train_loss: 0.8277, test_loss: 0.8443, test_f1: 0.5643
 epoch: 50, train_loss: 0.8295, test_loss: 0.8810, test_f1: 0.5236
 epoch: 51, train_loss: 0.8267, test_loss: 0.8450, test_f1: 0.5421
 epoch: 52, train_loss: 0.8184, test_loss: 0.8340, test_f1: 0.5709
 epoch: 53, train_loss: 0.8139, test_loss: 0.8482, test_f1: 0.5593
 epoch: 54, train_loss: 0.8158, test_loss: 0.8066, test_f1: 0.5803
 epoch: 55, train_loss: 0.8199, test_loss: 0.8366, test_f1: 0.5734
 epoch: 56, train_loss: 0.8229, test_loss: 0.8058, test_f1: 0.5764
 epoch: 57, train_loss: 0.8159, test_loss: 0.8248, test_f1: 0.5591
 epoch: 58, train_loss: 0.8210, test_loss: 0.8334, test_f1: 0.5685
 epoch: 59, train_loss: 0.8209, test_loss: 0.8260, test_f1: 0.5625
 epoch: 60, train_loss: 0.8141, test_loss: 0.8231, test_f1: 0.5588
 epoch: 61, train_loss: 0.7992, test_loss: 0.8025, test_f1: 0.5812
 epoch: 62, train_loss: 0.7971, test_loss: 0.7974, test_f1: 0.5879
 epoch: 63, train_loss: 0.7997, test_loss: 0.8094, test_f1: 0.5749
 epoch: 64, train_loss: 0.8080, test_loss: 0.8257, test_f1: 0.5608
 epoch: 65, train_loss: 0.8018, test_loss: 0.7915, test_f1: 0.5954
 epoch: 66, train_loss: 0.7937, test_loss: 0.8096, test_f1: 0.5810
 epoch: 67, train_loss: 0.8102, test_loss: 0.7993, test_f1: 0.5935
 epoch: 68, train_loss: 0.8017, test_loss: 0.8105, test_f1: 0.5682
 epoch: 69, train_loss: 0.7993, test_loss: 0.8018, test_f1: 0.5723
 epoch: 70, train_loss: 0.7995, test_loss: 0.8263, test_f1: 0.5708
 epoch: 71, train_loss: 0.8046, test_loss: 0.8067, test_f1: 0.5749
 epoch: 72, train_loss: 0.7986, test_loss: 0.7963, test_f1: 0.5947
 epoch: 73, train_loss: 0.7882, test_loss: 0.8091, test_f1: 0.5759
 epoch: 74, train_loss: 0.8028, test_loss: 0.8198, test_f1: 0.5677
 epoch: 75, train_loss: 0.7821, test_loss: 0.7985, test_f1: 0.5866
 epoch: 76, train_loss: 0.7907, test_loss: 0.8120, test_f1: 0.5618
 epoch: 77, train_loss: 0.7886, test_loss: 0.7981, test_f1: 0.6070
 epoch: 78, train_loss: 0.7819, test_loss: 0.8549, test_f1: 0.5529
 epoch: 79, train_loss: 0.7838, test_loss: 0.8196, test_f1: 0.5762
 epoch: 80, train_loss: 0.7815, test_loss: 0.8077, test_f1: 0.5743
 epoch: 81, train_loss: 0.7841, test_loss: 0.8052, test_f1: 0.5897
 epoch: 82, train_loss: 0.7820, test_loss: 0.8059, test_f1: 0.5763
 epoch: 83, train_loss: 0.7806, test_loss: 0.8370, test_f1: 0.5615
 epoch: 84, train_loss: 0.7826, test_loss: 0.7939, test_f1: 0.6001
 epoch: 85, train_loss: 0.7783, test_loss: 0.8272, test_f1: 0.5800
 epoch: 86, train_loss: 0.7930, test_loss: 0.8034, test_f1: 0.5812
 epoch: 87, train_loss: 0.7743, test_loss: 0.8057, test_f1: 0.5926
 epoch: 88, train_loss: 0.7723, test_loss: 0.8051, test_f1: 0.5784
 epoch: 89, train_loss: 0.7751, test_loss: 0.8189, test_f1: 0.5723
 epoch: 90, train_loss: 0.7797, test_loss: 0.8211, test_f1: 0.5925
 epoch: 91, train_loss: 0.7775, test_loss: 0.8405, test_f1: 0.5770
 epoch: 92, train_loss: 0.7705, test_loss: 0.8314, test_f1: 0.5788
 epoch: 93, train_loss: 0.7704, test_loss: 0.8053, test_f1: 0.6011
 epoch: 94, train_loss: 0.7761, test_loss: 0.8245, test_f1: 0.5876
 epoch: 95, train_loss: 0.7743, test_loss: 0.8353, test_f1: 0.5631
 epoch: 96, train_loss: 0.7733, test_loss: 0.8204, test_f1: 0.5841
 epoch: 97, train_loss: 0.7728, test_loss: 0.8081, test_f1: 0.5918
 epoch: 98, train_loss: 0.7625, test_loss: 0.8336, test_f1: 0.5807
 epoch: 99, train_loss: 0.7642, test_loss: 0.8275, test_f1: 0.5713

Training completed in 498.38 seconds
Best F1: 0.6231 at epoch 66
Mean F1 across iterations: 0.5801  0.0249
========================FINAL RESULTS================================
FEGIN weighted F1: 0.6231  0.0249
python main.py --data ltspice_examples --representation component_pin_net --model FEGIN --layers 3 --hiddens 16 --batch_size 128 --lr 0.001 --emb_size 128 --epochs 100 --save_appendix component_pin_net_L3_H16_BS128_LR0.001_E128 --no_val
-----



STDERR:
  File "main.py", line 370, in <module>
    main()
  File "main.py", line 254, in main
    dataset = dataset_class(
  File "/home/philip/projects/ltspice_examples_code_repo/Circuit-Completion-Using-GNNs/component_classification_with_link_prediction_head/evaluation/FEGIN/kernel/circuit_datasets.py", line 15, in __init__
    self.data, self.slices = torch.load(self.processed_paths[0])
  File "/home/philip/.local/lib/python3.8/site-packages/torch/serialization.py", line 1040, in load
    warnings.warn(
  File "/usr/lib/python3.8/warnings.py", line 109, in _showwarnmsg
    sw(msg.message, msg.category, msg.filename, msg.lineno,
  File "main.py", line 47, in warn_with_traceback
    traceback.print_stack(file=log)
/home/philip/projects/ltspice_examples_code_repo/Circuit-Completion-Using-GNNs/component_classification_with_link_prediction_head/evaluation/FEGIN/kernel/circuit_datasets.py:15: FutureWarning: You are using `torch.load` with `weights_only=False` (the current default value), which uses the default pickle module implicitly. It is possible to construct malicious pickle data which will execute arbitrary code during unpickling (See https://github.com/pytorch/pytorch/blob/main/SECURITY.md#untrusted-models for more details). In a future release, the default value for `weights_only` will be flipped to `True`. This limits the functions that could be executed during unpickling. Arbitrary objects will no longer be allowed to be loaded via this mode unless they are explicitly allowlisted by the user via `torch.serialization.add_safe_globals`. We recommend you start setting `weights_only=True` for any use case where you don't have full control of the loaded file. Please open an issue on GitHub for any issues related to this experimental feature.
  self.data, self.slices = torch.load(self.processed_paths[0])
