STDOUT:
Results will be saved in /home/philip/projects/ltspice_examples_code_repo/Circuit-Completion-Using-GNNs/component_classification_with_link_prediction_head/evaluation/FEGIN/results/model_FEGIN_dataset_ltspice_examples
Command line input: python main.py --data ltspice_examples --representation component_net --model FEGIN --layers 6 --hiddens 64 --batch_size 64 --lr 0.0001 --emb_size 512 --epochs 100 --save_appendix component_net_L6_H64_BS64_LR0.0001_E512 --no_val
 is saved.
-----
ltspice_examples - FEGIN
Using 6 layers, 64 hidden units, h = 2
Loading component_net representation dataset
ENTERED
Training FEGIN on component_net representation
Train: 3558, Test: 846
##################ITERATION #0 ****************************************
 epoch: 0, train_loss: 1.3850, test_loss: 1.3690, test_f1: 0.0967
 epoch: 1, train_loss: 1.3425, test_loss: 1.3142, test_f1: 0.2583
 epoch: 2, train_loss: 1.3071, test_loss: 1.2769, test_f1: 0.2703
 epoch: 3, train_loss: 1.2724, test_loss: 1.2415, test_f1: 0.2501
 epoch: 4, train_loss: 1.2445, test_loss: 1.2181, test_f1: 0.2497
 epoch: 5, train_loss: 1.2226, test_loss: 1.1981, test_f1: 0.2704
 epoch: 6, train_loss: 1.2021, test_loss: 1.1698, test_f1: 0.2892
 epoch: 7, train_loss: 1.1891, test_loss: 1.1526, test_f1: 0.3348
 epoch: 8, train_loss: 1.1687, test_loss: 1.1338, test_f1: 0.3936
 epoch: 9, train_loss: 1.1471, test_loss: 1.1101, test_f1: 0.4555
 epoch: 10, train_loss: 1.1279, test_loss: 1.0919, test_f1: 0.4965
 epoch: 11, train_loss: 1.1034, test_loss: 1.0580, test_f1: 0.5134
 epoch: 12, train_loss: 1.0865, test_loss: 1.0476, test_f1: 0.4948
 epoch: 13, train_loss: 1.0647, test_loss: 1.0253, test_f1: 0.4820
 epoch: 14, train_loss: 1.0450, test_loss: 1.0079, test_f1: 0.5113
 epoch: 15, train_loss: 1.0183, test_loss: 0.9833, test_f1: 0.5081
 epoch: 16, train_loss: 0.9984, test_loss: 0.9728, test_f1: 0.5030
 epoch: 17, train_loss: 0.9761, test_loss: 0.9636, test_f1: 0.4953
 epoch: 18, train_loss: 0.9672, test_loss: 0.9461, test_f1: 0.5142
 epoch: 19, train_loss: 0.9495, test_loss: 0.9271, test_f1: 0.4888
 epoch: 20, train_loss: 0.9378, test_loss: 0.9435, test_f1: 0.5116
 epoch: 21, train_loss: 0.9251, test_loss: 0.9240, test_f1: 0.5424
 epoch: 22, train_loss: 0.9155, test_loss: 0.9183, test_f1: 0.5221
 epoch: 23, train_loss: 0.9113, test_loss: 0.9230, test_f1: 0.5289
 epoch: 24, train_loss: 0.9003, test_loss: 0.9364, test_f1: 0.4991
 epoch: 25, train_loss: 0.8860, test_loss: 0.9296, test_f1: 0.5171
 epoch: 26, train_loss: 0.8894, test_loss: 0.9172, test_f1: 0.5286
 epoch: 27, train_loss: 0.8883, test_loss: 0.9255, test_f1: 0.5212
 epoch: 28, train_loss: 0.8753, test_loss: 0.9292, test_f1: 0.5340
 epoch: 29, train_loss: 0.8723, test_loss: 0.9178, test_f1: 0.5305
 epoch: 30, train_loss: 0.8656, test_loss: 0.9141, test_f1: 0.5314
 epoch: 31, train_loss: 0.8561, test_loss: 0.9100, test_f1: 0.5346
 epoch: 32, train_loss: 0.8531, test_loss: 0.9356, test_f1: 0.5060
 epoch: 33, train_loss: 0.8510, test_loss: 0.9263, test_f1: 0.5392
 epoch: 34, train_loss: 0.8271, test_loss: 0.9341, test_f1: 0.5061
 epoch: 35, train_loss: 0.8425, test_loss: 0.9430, test_f1: 0.5099
 epoch: 36, train_loss: 0.8324, test_loss: 0.9330, test_f1: 0.5385
 epoch: 37, train_loss: 0.8299, test_loss: 0.9130, test_f1: 0.5295
 epoch: 38, train_loss: 0.8286, test_loss: 0.9196, test_f1: 0.5207
 epoch: 39, train_loss: 0.8227, test_loss: 0.9320, test_f1: 0.5215
 epoch: 40, train_loss: 0.8250, test_loss: 0.9268, test_f1: 0.5448
 epoch: 41, train_loss: 0.8205, test_loss: 0.9515, test_f1: 0.5421
 epoch: 42, train_loss: 0.8157, test_loss: 0.9202, test_f1: 0.5391
 epoch: 43, train_loss: 0.8108, test_loss: 0.9482, test_f1: 0.5337
 epoch: 44, train_loss: 0.8010, test_loss: 0.9748, test_f1: 0.5078
 epoch: 45, train_loss: 0.8067, test_loss: 0.9371, test_f1: 0.5435
 epoch: 46, train_loss: 0.8083, test_loss: 0.9295, test_f1: 0.5647
 epoch: 47, train_loss: 0.8059, test_loss: 0.9297, test_f1: 0.5450
 epoch: 48, train_loss: 0.7973, test_loss: 0.9294, test_f1: 0.5416
 epoch: 49, train_loss: 0.8021, test_loss: 0.9762, test_f1: 0.5363
 epoch: 50, train_loss: 0.7965, test_loss: 0.9586, test_f1: 0.5508
 epoch: 51, train_loss: 0.7925, test_loss: 0.9317, test_f1: 0.5566
 epoch: 52, train_loss: 0.7785, test_loss: 0.9431, test_f1: 0.5467
 epoch: 53, train_loss: 0.7738, test_loss: 0.9289, test_f1: 0.5575
 epoch: 54, train_loss: 0.7644, test_loss: 0.9389, test_f1: 0.5436
 epoch: 55, train_loss: 0.7774, test_loss: 0.9353, test_f1: 0.5522
 epoch: 56, train_loss: 0.7711, test_loss: 0.9452, test_f1: 0.5491
 epoch: 57, train_loss: 0.7597, test_loss: 0.9401, test_f1: 0.5592
 epoch: 58, train_loss: 0.7713, test_loss: 0.9404, test_f1: 0.5477
 epoch: 59, train_loss: 0.7701, test_loss: 0.9389, test_f1: 0.5449
 epoch: 60, train_loss: 0.7638, test_loss: 0.9750, test_f1: 0.5391
 epoch: 61, train_loss: 0.7629, test_loss: 0.9467, test_f1: 0.5505
 epoch: 62, train_loss: 0.7593, test_loss: 0.9539, test_f1: 0.5548
 epoch: 63, train_loss: 0.7670, test_loss: 0.9539, test_f1: 0.5506
 epoch: 64, train_loss: 0.7510, test_loss: 0.9483, test_f1: 0.5525
 epoch: 65, train_loss: 0.7686, test_loss: 0.9499, test_f1: 0.5606
 epoch: 66, train_loss: 0.7634, test_loss: 0.9401, test_f1: 0.5613
 epoch: 67, train_loss: 0.7521, test_loss: 0.9402, test_f1: 0.5624
 epoch: 68, train_loss: 0.7570, test_loss: 0.9359, test_f1: 0.5509
 epoch: 69, train_loss: 0.7531, test_loss: 0.9667, test_f1: 0.5514
 epoch: 70, train_loss: 0.7475, test_loss: 0.9475, test_f1: 0.5542
 epoch: 71, train_loss: 0.7412, test_loss: 0.9503, test_f1: 0.5532
 epoch: 72, train_loss: 0.7589, test_loss: 0.9551, test_f1: 0.5742
 epoch: 73, train_loss: 0.7464, test_loss: 0.9649, test_f1: 0.5739
 epoch: 74, train_loss: 0.7413, test_loss: 0.9673, test_f1: 0.5787
 epoch: 75, train_loss: 0.7483, test_loss: 0.9553, test_f1: 0.5551
 epoch: 76, train_loss: 0.7463, test_loss: 0.9710, test_f1: 0.5655
 epoch: 77, train_loss: 0.7391, test_loss: 0.9434, test_f1: 0.5734
 epoch: 78, train_loss: 0.7333, test_loss: 0.9800, test_f1: 0.5630
 epoch: 79, train_loss: 0.7390, test_loss: 0.9754, test_f1: 0.5531
 epoch: 80, train_loss: 0.7436, test_loss: 0.9720, test_f1: 0.5736
 epoch: 81, train_loss: 0.7454, test_loss: 0.9454, test_f1: 0.5629
 epoch: 82, train_loss: 0.7490, test_loss: 0.9507, test_f1: 0.5654
 epoch: 83, train_loss: 0.7333, test_loss: 0.9762, test_f1: 0.5541
 epoch: 84, train_loss: 0.7297, test_loss: 0.9564, test_f1: 0.5574
 epoch: 85, train_loss: 0.7301, test_loss: 0.9545, test_f1: 0.5559
 epoch: 86, train_loss: 0.7432, test_loss: 0.9422, test_f1: 0.5647
 epoch: 87, train_loss: 0.7213, test_loss: 0.9635, test_f1: 0.5439
 epoch: 88, train_loss: 0.7289, test_loss: 0.9516, test_f1: 0.5782
 epoch: 89, train_loss: 0.7326, test_loss: 0.9696, test_f1: 0.5811
 epoch: 90, train_loss: 0.7440, test_loss: 0.9644, test_f1: 0.5562
 epoch: 91, train_loss: 0.7313, test_loss: 0.9731, test_f1: 0.5654
 epoch: 92, train_loss: 0.7319, test_loss: 0.9668, test_f1: 0.5714
 epoch: 93, train_loss: 0.7394, test_loss: 0.9454, test_f1: 0.5980
 epoch: 94, train_loss: 0.7373, test_loss: 0.9579, test_f1: 0.5799
 epoch: 95, train_loss: 0.7226, test_loss: 0.9617, test_f1: 0.5811
 epoch: 96, train_loss: 0.7234, test_loss: 0.9631, test_f1: 0.5649
 epoch: 97, train_loss: 0.7226, test_loss: 0.9664, test_f1: 0.5724
 epoch: 98, train_loss: 0.7191, test_loss: 0.9541, test_f1: 0.5806
 epoch: 99, train_loss: 0.7207, test_loss: 0.9539, test_f1: 0.5684
##################ITERATION #1 ****************************************
 epoch: 0, train_loss: 1.3100, test_loss: 1.2959, test_f1: 0.2270
 epoch: 1, train_loss: 1.2453, test_loss: 1.2109, test_f1: 0.3741
 epoch: 2, train_loss: 1.2129, test_loss: 1.1677, test_f1: 0.4114
 epoch: 3, train_loss: 1.1794, test_loss: 1.1187, test_f1: 0.4400
 epoch: 4, train_loss: 1.1408, test_loss: 1.0812, test_f1: 0.4502
 epoch: 5, train_loss: 1.1003, test_loss: 1.0434, test_f1: 0.4590
 epoch: 6, train_loss: 1.0723, test_loss: 1.0071, test_f1: 0.4916
 epoch: 7, train_loss: 1.0443, test_loss: 0.9794, test_f1: 0.4988
 epoch: 8, train_loss: 1.0292, test_loss: 0.9667, test_f1: 0.4944
 epoch: 9, train_loss: 1.0035, test_loss: 0.9542, test_f1: 0.5016
 epoch: 10, train_loss: 0.9855, test_loss: 0.9414, test_f1: 0.5049
 epoch: 11, train_loss: 0.9750, test_loss: 0.9512, test_f1: 0.4849
 epoch: 12, train_loss: 0.9605, test_loss: 0.9266, test_f1: 0.5028
 epoch: 13, train_loss: 0.9472, test_loss: 0.9266, test_f1: 0.4955
 epoch: 14, train_loss: 0.9429, test_loss: 0.9066, test_f1: 0.5172
 epoch: 15, train_loss: 0.9300, test_loss: 0.9218, test_f1: 0.5174
 epoch: 16, train_loss: 0.9286, test_loss: 0.9070, test_f1: 0.5076
 epoch: 17, train_loss: 0.9207, test_loss: 0.9196, test_f1: 0.4985
 epoch: 18, train_loss: 0.9021, test_loss: 0.9112, test_f1: 0.5222
 epoch: 19, train_loss: 0.9051, test_loss: 0.9167, test_f1: 0.5089
 epoch: 20, train_loss: 0.9016, test_loss: 0.9115, test_f1: 0.5115
 epoch: 21, train_loss: 0.8848, test_loss: 0.9128, test_f1: 0.5242
 epoch: 22, train_loss: 0.8882, test_loss: 0.9127, test_f1: 0.5123
 epoch: 23, train_loss: 0.8704, test_loss: 0.9186, test_f1: 0.5236
 epoch: 24, train_loss: 0.8715, test_loss: 0.9157, test_f1: 0.5292
 epoch: 25, train_loss: 0.8617, test_loss: 0.9089, test_f1: 0.5350
 epoch: 26, train_loss: 0.8660, test_loss: 0.9072, test_f1: 0.5505
 epoch: 27, train_loss: 0.8566, test_loss: 0.9046, test_f1: 0.5462
 epoch: 28, train_loss: 0.8560, test_loss: 0.8917, test_f1: 0.5386
 epoch: 29, train_loss: 0.8499, test_loss: 0.9241, test_f1: 0.5347
 epoch: 30, train_loss: 0.8444, test_loss: 0.9307, test_f1: 0.5335
 epoch: 31, train_loss: 0.8361, test_loss: 0.9297, test_f1: 0.5486
 epoch: 32, train_loss: 0.8393, test_loss: 0.9048, test_f1: 0.5608
 epoch: 33, train_loss: 0.8331, test_loss: 0.9053, test_f1: 0.5635
 epoch: 34, train_loss: 0.8388, test_loss: 0.9138, test_f1: 0.5511
 epoch: 35, train_loss: 0.8229, test_loss: 0.9002, test_f1: 0.5822
 epoch: 36, train_loss: 0.8152, test_loss: 0.9109, test_f1: 0.5571
 epoch: 37, train_loss: 0.8155, test_loss: 0.9270, test_f1: 0.5627
 epoch: 38, train_loss: 0.8074, test_loss: 0.9006, test_f1: 0.5617
 epoch: 39, train_loss: 0.8146, test_loss: 0.9237, test_f1: 0.5644
 epoch: 40, train_loss: 0.8167, test_loss: 0.9272, test_f1: 0.5689
 epoch: 41, train_loss: 0.8148, test_loss: 0.9237, test_f1: 0.5540
 epoch: 42, train_loss: 0.8031, test_loss: 0.8957, test_f1: 0.5757
 epoch: 43, train_loss: 0.7940, test_loss: 0.8973, test_f1: 0.5782
 epoch: 44, train_loss: 0.7897, test_loss: 0.9297, test_f1: 0.5477
 epoch: 45, train_loss: 0.8001, test_loss: 0.8963, test_f1: 0.5878
 epoch: 46, train_loss: 0.8178, test_loss: 0.9008, test_f1: 0.5871
 epoch: 47, train_loss: 0.8021, test_loss: 0.8935, test_f1: 0.5712
 epoch: 48, train_loss: 0.7943, test_loss: 0.9141, test_f1: 0.5875
 epoch: 49, train_loss: 0.7712, test_loss: 0.9222, test_f1: 0.5746
 epoch: 50, train_loss: 0.7819, test_loss: 0.9013, test_f1: 0.5875
 epoch: 51, train_loss: 0.7743, test_loss: 0.9158, test_f1: 0.5770
 epoch: 52, train_loss: 0.7666, test_loss: 0.9169, test_f1: 0.5785
 epoch: 53, train_loss: 0.7669, test_loss: 0.9052, test_f1: 0.5912
 epoch: 54, train_loss: 0.7650, test_loss: 0.9166, test_f1: 0.5734
 epoch: 55, train_loss: 0.7650, test_loss: 0.9160, test_f1: 0.5708
 epoch: 56, train_loss: 0.7526, test_loss: 0.9017, test_f1: 0.5884
 epoch: 57, train_loss: 0.7623, test_loss: 0.8939, test_f1: 0.5898
 epoch: 58, train_loss: 0.7656, test_loss: 0.8972, test_f1: 0.5898
 epoch: 59, train_loss: 0.7611, test_loss: 0.8937, test_f1: 0.5922
 epoch: 60, train_loss: 0.7556, test_loss: 0.8976, test_f1: 0.5991
 epoch: 61, train_loss: 0.7621, test_loss: 0.9149, test_f1: 0.5814
 epoch: 62, train_loss: 0.7558, test_loss: 0.8884, test_f1: 0.5989
 epoch: 63, train_loss: 0.7564, test_loss: 0.8933, test_f1: 0.5846
 epoch: 64, train_loss: 0.7457, test_loss: 0.9024, test_f1: 0.5965
 epoch: 65, train_loss: 0.7422, test_loss: 0.9061, test_f1: 0.5836
 epoch: 66, train_loss: 0.7497, test_loss: 0.8995, test_f1: 0.5858
 epoch: 67, train_loss: 0.7474, test_loss: 0.9057, test_f1: 0.5936
 epoch: 68, train_loss: 0.7500, test_loss: 0.9065, test_f1: 0.5885
 epoch: 69, train_loss: 0.7443, test_loss: 0.9008, test_f1: 0.5987
 epoch: 70, train_loss: 0.7431, test_loss: 0.8967, test_f1: 0.5854
 epoch: 71, train_loss: 0.7395, test_loss: 0.8923, test_f1: 0.6042
 epoch: 72, train_loss: 0.7455, test_loss: 0.9075, test_f1: 0.5820
 epoch: 73, train_loss: 0.7332, test_loss: 0.9106, test_f1: 0.5898
 epoch: 74, train_loss: 0.7368, test_loss: 0.9002, test_f1: 0.5894
 epoch: 75, train_loss: 0.7401, test_loss: 0.8994, test_f1: 0.5843
 epoch: 76, train_loss: 0.7300, test_loss: 0.9054, test_f1: 0.5875
 epoch: 77, train_loss: 0.7227, test_loss: 0.9084, test_f1: 0.5788
 epoch: 78, train_loss: 0.7224, test_loss: 0.9099, test_f1: 0.5845
 epoch: 79, train_loss: 0.7279, test_loss: 0.9108, test_f1: 0.5931
 epoch: 80, train_loss: 0.7289, test_loss: 0.9020, test_f1: 0.5876
 epoch: 81, train_loss: 0.7246, test_loss: 0.8924, test_f1: 0.5994
 epoch: 82, train_loss: 0.7237, test_loss: 0.9104, test_f1: 0.5865
 epoch: 83, train_loss: 0.7183, test_loss: 0.9011, test_f1: 0.5969
 epoch: 84, train_loss: 0.7151, test_loss: 0.9139, test_f1: 0.5986
 epoch: 85, train_loss: 0.7046, test_loss: 0.9215, test_f1: 0.5838
 epoch: 86, train_loss: 0.7174, test_loss: 0.9068, test_f1: 0.5857
 epoch: 87, train_loss: 0.7231, test_loss: 0.9175, test_f1: 0.5801
 epoch: 88, train_loss: 0.7131, test_loss: 0.9028, test_f1: 0.5961
 epoch: 89, train_loss: 0.7118, test_loss: 0.8886, test_f1: 0.5995
 epoch: 90, train_loss: 0.7168, test_loss: 0.9102, test_f1: 0.5980
 epoch: 91, train_loss: 0.7019, test_loss: 0.9137, test_f1: 0.5876
 epoch: 92, train_loss: 0.7128, test_loss: 0.9061, test_f1: 0.5910
 epoch: 93, train_loss: 0.7028, test_loss: 0.8964, test_f1: 0.5974
 epoch: 94, train_loss: 0.7083, test_loss: 0.9123, test_f1: 0.5893
 epoch: 95, train_loss: 0.7021, test_loss: 0.9188, test_f1: 0.5905
 epoch: 96, train_loss: 0.6967, test_loss: 0.9225, test_f1: 0.5815
 epoch: 97, train_loss: 0.7066, test_loss: 0.9130, test_f1: 0.5967
 epoch: 98, train_loss: 0.7069, test_loss: 0.9222, test_f1: 0.5814
 epoch: 99, train_loss: 0.6978, test_loss: 0.9243, test_f1: 0.5948
##################ITERATION #2 ****************************************
 epoch: 0, train_loss: 1.2676, test_loss: 1.2421, test_f1: 0.2368
 epoch: 1, train_loss: 1.1827, test_loss: 1.1295, test_f1: 0.4144
 epoch: 2, train_loss: 1.1434, test_loss: 1.0801, test_f1: 0.4262
 epoch: 3, train_loss: 1.1080, test_loss: 1.0463, test_f1: 0.4574
 epoch: 4, train_loss: 1.0768, test_loss: 1.0210, test_f1: 0.4784
 epoch: 5, train_loss: 1.0578, test_loss: 0.9963, test_f1: 0.4870
 epoch: 6, train_loss: 1.0336, test_loss: 0.9807, test_f1: 0.4967
 epoch: 7, train_loss: 1.0195, test_loss: 0.9668, test_f1: 0.4756
 epoch: 8, train_loss: 1.0031, test_loss: 0.9606, test_f1: 0.4791
 epoch: 9, train_loss: 0.9828, test_loss: 0.9467, test_f1: 0.4909
 epoch: 10, train_loss: 0.9815, test_loss: 0.9481, test_f1: 0.4934
 epoch: 11, train_loss: 0.9683, test_loss: 0.9223, test_f1: 0.5095
 epoch: 12, train_loss: 0.9560, test_loss: 0.9174, test_f1: 0.5048
 epoch: 13, train_loss: 0.9533, test_loss: 0.9136, test_f1: 0.5131
 epoch: 14, train_loss: 0.9357, test_loss: 0.9239, test_f1: 0.5069
 epoch: 15, train_loss: 0.9253, test_loss: 0.9102, test_f1: 0.5251
 epoch: 16, train_loss: 0.9232, test_loss: 0.9262, test_f1: 0.5278
 epoch: 17, train_loss: 0.9223, test_loss: 0.9120, test_f1: 0.5223
 epoch: 18, train_loss: 0.9109, test_loss: 0.8995, test_f1: 0.5208
 epoch: 19, train_loss: 0.9061, test_loss: 0.8941, test_f1: 0.5293
 epoch: 20, train_loss: 0.8983, test_loss: 0.9249, test_f1: 0.5088
 epoch: 21, train_loss: 0.8914, test_loss: 0.9026, test_f1: 0.5319
 epoch: 22, train_loss: 0.8934, test_loss: 0.9345, test_f1: 0.5108
 epoch: 23, train_loss: 0.8868, test_loss: 0.9093, test_f1: 0.5337
 epoch: 24, train_loss: 0.8864, test_loss: 0.9120, test_f1: 0.5247
 epoch: 25, train_loss: 0.8694, test_loss: 0.9043, test_f1: 0.5243
 epoch: 26, train_loss: 0.8763, test_loss: 0.9118, test_f1: 0.5197
 epoch: 27, train_loss: 0.8630, test_loss: 0.9377, test_f1: 0.5198
 epoch: 28, train_loss: 0.8573, test_loss: 0.9142, test_f1: 0.5259
 epoch: 29, train_loss: 0.8552, test_loss: 0.9098, test_f1: 0.5198
 epoch: 30, train_loss: 0.8519, test_loss: 0.8871, test_f1: 0.5411
 epoch: 31, train_loss: 0.8566, test_loss: 0.9054, test_f1: 0.5255
 epoch: 32, train_loss: 0.8440, test_loss: 0.9221, test_f1: 0.5320
 epoch: 33, train_loss: 0.8409, test_loss: 0.9169, test_f1: 0.5245
 epoch: 34, train_loss: 0.8428, test_loss: 0.9346, test_f1: 0.5276
 epoch: 35, train_loss: 0.8462, test_loss: 0.9288, test_f1: 0.5305
 epoch: 36, train_loss: 0.8347, test_loss: 0.9178, test_f1: 0.5319
 epoch: 37, train_loss: 0.8207, test_loss: 0.9299, test_f1: 0.5171
 epoch: 38, train_loss: 0.8217, test_loss: 0.9102, test_f1: 0.5324
 epoch: 39, train_loss: 0.8164, test_loss: 0.9313, test_f1: 0.5327
 epoch: 40, train_loss: 0.8093, test_loss: 0.9208, test_f1: 0.5416
 epoch: 41, train_loss: 0.8097, test_loss: 0.9064, test_f1: 0.5318
 epoch: 42, train_loss: 0.8125, test_loss: 0.9180, test_f1: 0.5451
 epoch: 43, train_loss: 0.8037, test_loss: 0.9039, test_f1: 0.5551
 epoch: 44, train_loss: 0.8002, test_loss: 0.9182, test_f1: 0.5481
 epoch: 45, train_loss: 0.8067, test_loss: 0.9191, test_f1: 0.5515
 epoch: 46, train_loss: 0.8024, test_loss: 0.9293, test_f1: 0.5495
 epoch: 47, train_loss: 0.8033, test_loss: 0.9213, test_f1: 0.5655
 epoch: 48, train_loss: 0.7844, test_loss: 0.9388, test_f1: 0.5591
 epoch: 49, train_loss: 0.7823, test_loss: 0.9480, test_f1: 0.5444
 epoch: 50, train_loss: 0.7802, test_loss: 0.9262, test_f1: 0.5622
 epoch: 51, train_loss: 0.7728, test_loss: 0.9191, test_f1: 0.5530
 epoch: 52, train_loss: 0.7774, test_loss: 0.9192, test_f1: 0.5533
 epoch: 53, train_loss: 0.7729, test_loss: 0.9110, test_f1: 0.5823
 epoch: 54, train_loss: 0.7657, test_loss: 0.9159, test_f1: 0.5540
 epoch: 55, train_loss: 0.7645, test_loss: 0.9227, test_f1: 0.5577
 epoch: 56, train_loss: 0.7704, test_loss: 0.9292, test_f1: 0.5623
 epoch: 57, train_loss: 0.7629, test_loss: 0.9350, test_f1: 0.5447
 epoch: 58, train_loss: 0.7670, test_loss: 0.9372, test_f1: 0.5504
 epoch: 59, train_loss: 0.7540, test_loss: 0.9254, test_f1: 0.5528
 epoch: 60, train_loss: 0.7616, test_loss: 0.9182, test_f1: 0.5653
 epoch: 61, train_loss: 0.7664, test_loss: 0.9212, test_f1: 0.5867
 epoch: 62, train_loss: 0.7647, test_loss: 0.9229, test_f1: 0.5765
 epoch: 63, train_loss: 0.7585, test_loss: 0.9294, test_f1: 0.5863
 epoch: 64, train_loss: 0.7496, test_loss: 0.9460, test_f1: 0.5641
 epoch: 65, train_loss: 0.7474, test_loss: 0.9466, test_f1: 0.5720
 epoch: 66, train_loss: 0.7576, test_loss: 0.9339, test_f1: 0.5599
 epoch: 67, train_loss: 0.7553, test_loss: 0.9278, test_f1: 0.5692
 epoch: 68, train_loss: 0.7457, test_loss: 0.9286, test_f1: 0.5720
 epoch: 69, train_loss: 0.7500, test_loss: 0.9344, test_f1: 0.5721
 epoch: 70, train_loss: 0.7457, test_loss: 0.9634, test_f1: 0.5801
 epoch: 71, train_loss: 0.7290, test_loss: 0.9324, test_f1: 0.5957
 epoch: 72, train_loss: 0.7402, test_loss: 0.9467, test_f1: 0.5706
 epoch: 73, train_loss: 0.7406, test_loss: 0.9599, test_f1: 0.5710
 epoch: 74, train_loss: 0.7446, test_loss: 0.9400, test_f1: 0.5827
 epoch: 75, train_loss: 0.7340, test_loss: 0.9511, test_f1: 0.5972
 epoch: 76, train_loss: 0.7459, test_loss: 0.9437, test_f1: 0.5960
 epoch: 77, train_loss: 0.7293, test_loss: 0.9450, test_f1: 0.5844
 epoch: 78, train_loss: 0.7308, test_loss: 0.9346, test_f1: 0.5737
 epoch: 79, train_loss: 0.7333, test_loss: 0.9492, test_f1: 0.5993
 epoch: 80, train_loss: 0.7298, test_loss: 0.9283, test_f1: 0.5863
 epoch: 81, train_loss: 0.7264, test_loss: 0.9471, test_f1: 0.5944
 epoch: 82, train_loss: 0.7282, test_loss: 0.9556, test_f1: 0.5848
 epoch: 83, train_loss: 0.7217, test_loss: 0.9571, test_f1: 0.5886
 epoch: 84, train_loss: 0.7343, test_loss: 0.9573, test_f1: 0.5934
 epoch: 85, train_loss: 0.7215, test_loss: 0.9494, test_f1: 0.5938
 epoch: 86, train_loss: 0.7212, test_loss: 0.9410, test_f1: 0.5967
 epoch: 87, train_loss: 0.7194, test_loss: 0.9652, test_f1: 0.5892
 epoch: 88, train_loss: 0.7244, test_loss: 0.9513, test_f1: 0.6069
 epoch: 89, train_loss: 0.7148, test_loss: 0.9635, test_f1: 0.5713
 epoch: 90, train_loss: 0.7203, test_loss: 0.9619, test_f1: 0.5777
 epoch: 91, train_loss: 0.7266, test_loss: 0.9749, test_f1: 0.5845
 epoch: 92, train_loss: 0.7198, test_loss: 0.9728, test_f1: 0.5905
 epoch: 93, train_loss: 0.7184, test_loss: 0.9776, test_f1: 0.5991
 epoch: 94, train_loss: 0.7134, test_loss: 0.9727, test_f1: 0.5914
 epoch: 95, train_loss: 0.7071, test_loss: 0.9718, test_f1: 0.5812
 epoch: 96, train_loss: 0.7132, test_loss: 0.9776, test_f1: 0.5972
 epoch: 97, train_loss: 0.7064, test_loss: 0.9696, test_f1: 0.5883
 epoch: 98, train_loss: 0.7114, test_loss: 0.9767, test_f1: 0.5877
 epoch: 99, train_loss: 0.7269, test_loss: 0.9977, test_f1: 0.5795
##################ITERATION #3 ****************************************
 epoch: 0, train_loss: 1.2684, test_loss: 1.2214, test_f1: 0.3770
 epoch: 1, train_loss: 1.1842, test_loss: 1.1341, test_f1: 0.4346
 epoch: 2, train_loss: 1.1486, test_loss: 1.0953, test_f1: 0.4351
 epoch: 3, train_loss: 1.1239, test_loss: 1.0702, test_f1: 0.4581
 epoch: 4, train_loss: 1.0973, test_loss: 1.0402, test_f1: 0.4668
 epoch: 5, train_loss: 1.0749, test_loss: 1.0170, test_f1: 0.4680
 epoch: 6, train_loss: 1.0485, test_loss: 1.0082, test_f1: 0.4754
 epoch: 7, train_loss: 1.0421, test_loss: 0.9870, test_f1: 0.5138
 epoch: 8, train_loss: 1.0101, test_loss: 0.9688, test_f1: 0.5078
 epoch: 9, train_loss: 1.0001, test_loss: 0.9651, test_f1: 0.5132
 epoch: 10, train_loss: 0.9865, test_loss: 0.9671, test_f1: 0.5017
 epoch: 11, train_loss: 0.9655, test_loss: 0.9513, test_f1: 0.5111
 epoch: 12, train_loss: 0.9632, test_loss: 0.9556, test_f1: 0.5029
 epoch: 13, train_loss: 0.9453, test_loss: 0.9605, test_f1: 0.5138
 epoch: 14, train_loss: 0.9386, test_loss: 0.9515, test_f1: 0.5243
 epoch: 15, train_loss: 0.9335, test_loss: 0.9664, test_f1: 0.5228
 epoch: 16, train_loss: 0.9193, test_loss: 0.9736, test_f1: 0.5246
 epoch: 17, train_loss: 0.9186, test_loss: 0.9763, test_f1: 0.5276
 epoch: 18, train_loss: 0.9099, test_loss: 0.9652, test_f1: 0.5188
 epoch: 19, train_loss: 0.9066, test_loss: 0.9482, test_f1: 0.5294
 epoch: 20, train_loss: 0.8967, test_loss: 0.9531, test_f1: 0.5272
 epoch: 21, train_loss: 0.8971, test_loss: 0.9736, test_f1: 0.5275
 epoch: 22, train_loss: 0.8821, test_loss: 0.9642, test_f1: 0.5346
 epoch: 23, train_loss: 0.8809, test_loss: 0.9615, test_f1: 0.5206
 epoch: 24, train_loss: 0.8774, test_loss: 0.9731, test_f1: 0.5367
 epoch: 25, train_loss: 0.8789, test_loss: 0.9980, test_f1: 0.5203
 epoch: 26, train_loss: 0.8556, test_loss: 0.9777, test_f1: 0.5449
 epoch: 27, train_loss: 0.8594, test_loss: 0.9733, test_f1: 0.5436
 epoch: 28, train_loss: 0.8505, test_loss: 0.9946, test_f1: 0.5380
 epoch: 29, train_loss: 0.8509, test_loss: 0.9606, test_f1: 0.5314
 epoch: 30, train_loss: 0.8475, test_loss: 0.9774, test_f1: 0.5625
 epoch: 31, train_loss: 0.8437, test_loss: 0.9860, test_f1: 0.5699
 epoch: 32, train_loss: 0.8462, test_loss: 0.9941, test_f1: 0.5625
 epoch: 33, train_loss: 0.8328, test_loss: 0.9845, test_f1: 0.5570
 epoch: 34, train_loss: 0.8342, test_loss: 0.9884, test_f1: 0.5435
 epoch: 35, train_loss: 0.8197, test_loss: 0.9856, test_f1: 0.5534
 epoch: 36, train_loss: 0.8177, test_loss: 0.9694, test_f1: 0.5560
 epoch: 37, train_loss: 0.8144, test_loss: 1.0063, test_f1: 0.5672
 epoch: 38, train_loss: 0.8112, test_loss: 0.9828, test_f1: 0.5554
 epoch: 39, train_loss: 0.8143, test_loss: 1.0082, test_f1: 0.5625
 epoch: 40, train_loss: 0.8100, test_loss: 1.0037, test_f1: 0.5522
 epoch: 41, train_loss: 0.8032, test_loss: 1.0162, test_f1: 0.5585
 epoch: 42, train_loss: 0.7923, test_loss: 1.0123, test_f1: 0.5657
 epoch: 43, train_loss: 0.7994, test_loss: 1.0041, test_f1: 0.5741
 epoch: 44, train_loss: 0.7955, test_loss: 1.0206, test_f1: 0.5518
 epoch: 45, train_loss: 0.7959, test_loss: 1.0006, test_f1: 0.5681
 epoch: 46, train_loss: 0.7896, test_loss: 1.0278, test_f1: 0.5530
 epoch: 47, train_loss: 0.7992, test_loss: 1.0189, test_f1: 0.5532
 epoch: 48, train_loss: 0.7838, test_loss: 1.0012, test_f1: 0.5595
 epoch: 49, train_loss: 0.7851, test_loss: 1.0067, test_f1: 0.5776
 epoch: 50, train_loss: 0.7694, test_loss: 1.0096, test_f1: 0.5807
 epoch: 51, train_loss: 0.7649, test_loss: 0.9839, test_f1: 0.5647
 epoch: 52, train_loss: 0.7739, test_loss: 1.0068, test_f1: 0.5655
 epoch: 53, train_loss: 0.7524, test_loss: 1.0092, test_f1: 0.5724
 epoch: 54, train_loss: 0.7610, test_loss: 1.0252, test_f1: 0.5650
 epoch: 55, train_loss: 0.7598, test_loss: 1.0035, test_f1: 0.5684
 epoch: 56, train_loss: 0.7524, test_loss: 1.0204, test_f1: 0.5697
 epoch: 57, train_loss: 0.7592, test_loss: 1.0109, test_f1: 0.5754
 epoch: 58, train_loss: 0.7558, test_loss: 1.0127, test_f1: 0.5827
 epoch: 59, train_loss: 0.7504, test_loss: 1.0118, test_f1: 0.5778
 epoch: 60, train_loss: 0.7568, test_loss: 1.0164, test_f1: 0.5702
 epoch: 61, train_loss: 0.7516, test_loss: 1.0347, test_f1: 0.5707
 epoch: 62, train_loss: 0.7439, test_loss: 1.0291, test_f1: 0.5670
 epoch: 63, train_loss: 0.7444, test_loss: 1.0188, test_f1: 0.5723
 epoch: 64, train_loss: 0.7454, test_loss: 1.0194, test_f1: 0.5646
 epoch: 65, train_loss: 0.7469, test_loss: 1.0237, test_f1: 0.5830
 epoch: 66, train_loss: 0.7378, test_loss: 1.0253, test_f1: 0.5710
 epoch: 67, train_loss: 0.7415, test_loss: 1.0243, test_f1: 0.5681
 epoch: 68, train_loss: 0.7475, test_loss: 1.0253, test_f1: 0.5658
 epoch: 69, train_loss: 0.7328, test_loss: 1.0334, test_f1: 0.5660
 epoch: 70, train_loss: 0.7306, test_loss: 1.0211, test_f1: 0.5743
 epoch: 71, train_loss: 0.7401, test_loss: 1.0309, test_f1: 0.5665
 epoch: 72, train_loss: 0.7256, test_loss: 1.0073, test_f1: 0.5786
 epoch: 73, train_loss: 0.7251, test_loss: 1.0293, test_f1: 0.5714
 epoch: 74, train_loss: 0.7284, test_loss: 1.0237, test_f1: 0.5775
 epoch: 75, train_loss: 0.7245, test_loss: 1.0362, test_f1: 0.5782
 epoch: 76, train_loss: 0.7278, test_loss: 1.0422, test_f1: 0.5755
 epoch: 77, train_loss: 0.7227, test_loss: 1.0379, test_f1: 0.5617
 epoch: 78, train_loss: 0.7192, test_loss: 1.0310, test_f1: 0.5644
 epoch: 79, train_loss: 0.7141, test_loss: 1.0325, test_f1: 0.5704
 epoch: 80, train_loss: 0.7191, test_loss: 1.0495, test_f1: 0.5720
 epoch: 81, train_loss: 0.7067, test_loss: 1.0331, test_f1: 0.5837
 epoch: 82, train_loss: 0.7143, test_loss: 1.0477, test_f1: 0.5733
 epoch: 83, train_loss: 0.7198, test_loss: 1.0471, test_f1: 0.5692
 epoch: 84, train_loss: 0.7131, test_loss: 1.0533, test_f1: 0.5712
 epoch: 85, train_loss: 0.7089, test_loss: 1.0509, test_f1: 0.5658
 epoch: 86, train_loss: 0.7143, test_loss: 1.0546, test_f1: 0.5769
 epoch: 87, train_loss: 0.7161, test_loss: 1.0407, test_f1: 0.5774
 epoch: 88, train_loss: 0.7108, test_loss: 1.0505, test_f1: 0.5717
 epoch: 89, train_loss: 0.7058, test_loss: 1.0517, test_f1: 0.5719
 epoch: 90, train_loss: 0.7087, test_loss: 1.0522, test_f1: 0.5799
 epoch: 91, train_loss: 0.7128, test_loss: 1.0541, test_f1: 0.5782
 epoch: 92, train_loss: 0.6883, test_loss: 1.0688, test_f1: 0.5827
 epoch: 93, train_loss: 0.7054, test_loss: 1.0446, test_f1: 0.5765
 epoch: 94, train_loss: 0.6956, test_loss: 1.0481, test_f1: 0.5859
 epoch: 95, train_loss: 0.7014, test_loss: 1.0537, test_f1: 0.5741
 epoch: 96, train_loss: 0.7030, test_loss: 1.0509, test_f1: 0.5789
 epoch: 97, train_loss: 0.7038, test_loss: 1.0490, test_f1: 0.5835
 epoch: 98, train_loss: 0.6963, test_loss: 1.0524, test_f1: 0.5734
 epoch: 99, train_loss: 0.7009, test_loss: 1.0745, test_f1: 0.5834
##################ITERATION #4 ****************************************
 epoch: 0, train_loss: 1.2562, test_loss: 1.2722, test_f1: 0.2945
 epoch: 1, train_loss: 1.1642, test_loss: 1.0988, test_f1: 0.4259
 epoch: 2, train_loss: 1.1308, test_loss: 1.0693, test_f1: 0.4291
 epoch: 3, train_loss: 1.1080, test_loss: 1.0396, test_f1: 0.4582
 epoch: 4, train_loss: 1.0893, test_loss: 1.0222, test_f1: 0.4697
 epoch: 5, train_loss: 1.0608, test_loss: 1.0093, test_f1: 0.4839
 epoch: 6, train_loss: 1.0434, test_loss: 0.9851, test_f1: 0.5035
 epoch: 7, train_loss: 1.0347, test_loss: 0.9725, test_f1: 0.5077
 epoch: 8, train_loss: 1.0223, test_loss: 0.9674, test_f1: 0.4961
 epoch: 9, train_loss: 1.0010, test_loss: 0.9711, test_f1: 0.4991
 epoch: 10, train_loss: 0.9881, test_loss: 0.9472, test_f1: 0.5118
 epoch: 11, train_loss: 0.9865, test_loss: 0.9506, test_f1: 0.5151
 epoch: 12, train_loss: 0.9719, test_loss: 0.9382, test_f1: 0.5133
 epoch: 13, train_loss: 0.9609, test_loss: 0.9403, test_f1: 0.5086
 epoch: 14, train_loss: 0.9607, test_loss: 0.9435, test_f1: 0.5102
 epoch: 15, train_loss: 0.9647, test_loss: 0.9374, test_f1: 0.5256
 epoch: 16, train_loss: 0.9594, test_loss: 0.9363, test_f1: 0.5281
 epoch: 17, train_loss: 0.9354, test_loss: 0.9378, test_f1: 0.5183
 epoch: 18, train_loss: 0.9346, test_loss: 0.9458, test_f1: 0.5276
 epoch: 19, train_loss: 0.9257, test_loss: 0.9648, test_f1: 0.5153
 epoch: 20, train_loss: 0.9212, test_loss: 0.9300, test_f1: 0.5385
 epoch: 21, train_loss: 0.9178, test_loss: 0.9653, test_f1: 0.5291
 epoch: 22, train_loss: 0.9185, test_loss: 0.9415, test_f1: 0.5292
 epoch: 23, train_loss: 0.9066, test_loss: 0.9461, test_f1: 0.5393
 epoch: 24, train_loss: 0.9068, test_loss: 0.9387, test_f1: 0.5375
 epoch: 25, train_loss: 0.9025, test_loss: 0.9551, test_f1: 0.5093
 epoch: 26, train_loss: 0.8931, test_loss: 0.9353, test_f1: 0.5204
 epoch: 27, train_loss: 0.8893, test_loss: 0.9527, test_f1: 0.5385
 epoch: 28, train_loss: 0.8811, test_loss: 0.9655, test_f1: 0.5210
 epoch: 29, train_loss: 0.8814, test_loss: 0.9433, test_f1: 0.5264
 epoch: 30, train_loss: 0.8745, test_loss: 0.9363, test_f1: 0.5309
 epoch: 31, train_loss: 0.8803, test_loss: 0.9658, test_f1: 0.5299
 epoch: 32, train_loss: 0.8661, test_loss: 0.9385, test_f1: 0.5308
 epoch: 33, train_loss: 0.8723, test_loss: 0.9527, test_f1: 0.5219
 epoch: 34, train_loss: 0.8651, test_loss: 0.9559, test_f1: 0.5405
 epoch: 35, train_loss: 0.8584, test_loss: 0.9555, test_f1: 0.5385
 epoch: 36, train_loss: 0.8523, test_loss: 0.9503, test_f1: 0.5432
 epoch: 37, train_loss: 0.8386, test_loss: 0.9404, test_f1: 0.5576
 epoch: 38, train_loss: 0.8452, test_loss: 0.9439, test_f1: 0.5523
 epoch: 39, train_loss: 0.8441, test_loss: 0.9691, test_f1: 0.5317
 epoch: 40, train_loss: 0.8335, test_loss: 0.9505, test_f1: 0.5371
 epoch: 41, train_loss: 0.8348, test_loss: 0.9669, test_f1: 0.5546
 epoch: 42, train_loss: 0.8403, test_loss: 0.9514, test_f1: 0.5639
 epoch: 43, train_loss: 0.8327, test_loss: 0.9632, test_f1: 0.5639
 epoch: 44, train_loss: 0.8272, test_loss: 0.9420, test_f1: 0.5691
 epoch: 45, train_loss: 0.8175, test_loss: 0.9601, test_f1: 0.5602
 epoch: 46, train_loss: 0.8151, test_loss: 0.9601, test_f1: 0.5467
 epoch: 47, train_loss: 0.8199, test_loss: 0.9482, test_f1: 0.5623
 epoch: 48, train_loss: 0.8087, test_loss: 0.9513, test_f1: 0.5421
 epoch: 49, train_loss: 0.8091, test_loss: 0.9620, test_f1: 0.5502
 epoch: 50, train_loss: 0.8112, test_loss: 0.9421, test_f1: 0.5640
 epoch: 51, train_loss: 0.8036, test_loss: 0.9688, test_f1: 0.5663
 epoch: 52, train_loss: 0.7982, test_loss: 0.9572, test_f1: 0.5459
 epoch: 53, train_loss: 0.7911, test_loss: 0.9572, test_f1: 0.5622
 epoch: 54, train_loss: 0.7876, test_loss: 0.9660, test_f1: 0.5691
 epoch: 55, train_loss: 0.7910, test_loss: 0.9655, test_f1: 0.5492
 epoch: 56, train_loss: 0.7891, test_loss: 0.9569, test_f1: 0.5572
 epoch: 57, train_loss: 0.7937, test_loss: 0.9570, test_f1: 0.5652
 epoch: 58, train_loss: 0.7907, test_loss: 0.9439, test_f1: 0.5549
 epoch: 59, train_loss: 0.7823, test_loss: 0.9579, test_f1: 0.5722
 epoch: 60, train_loss: 0.7831, test_loss: 0.9691, test_f1: 0.5706
 epoch: 61, train_loss: 0.7769, test_loss: 0.9533, test_f1: 0.5768
 epoch: 62, train_loss: 0.7715, test_loss: 0.9643, test_f1: 0.5577
 epoch: 63, train_loss: 0.7760, test_loss: 0.9597, test_f1: 0.5553
 epoch: 64, train_loss: 0.7771, test_loss: 0.9527, test_f1: 0.5664
 epoch: 65, train_loss: 0.7699, test_loss: 0.9876, test_f1: 0.5487
 epoch: 66, train_loss: 0.7630, test_loss: 0.9730, test_f1: 0.5496
 epoch: 67, train_loss: 0.7706, test_loss: 0.9857, test_f1: 0.5593
 epoch: 68, train_loss: 0.7692, test_loss: 0.9667, test_f1: 0.5637
 epoch: 69, train_loss: 0.7742, test_loss: 0.9797, test_f1: 0.5492
 epoch: 70, train_loss: 0.7686, test_loss: 0.9755, test_f1: 0.5579
 epoch: 71, train_loss: 0.7611, test_loss: 0.9936, test_f1: 0.5587
 epoch: 72, train_loss: 0.7641, test_loss: 0.9668, test_f1: 0.5702
 epoch: 73, train_loss: 0.7635, test_loss: 0.9717, test_f1: 0.5651
 epoch: 74, train_loss: 0.7545, test_loss: 0.9724, test_f1: 0.5657
 epoch: 75, train_loss: 0.7661, test_loss: 0.9691, test_f1: 0.5716
 epoch: 76, train_loss: 0.7596, test_loss: 0.9716, test_f1: 0.5692
 epoch: 77, train_loss: 0.7612, test_loss: 0.9823, test_f1: 0.5599
 epoch: 78, train_loss: 0.7596, test_loss: 0.9644, test_f1: 0.5879
 epoch: 79, train_loss: 0.7635, test_loss: 0.9779, test_f1: 0.5600
 epoch: 80, train_loss: 0.7658, test_loss: 0.9860, test_f1: 0.5854
 epoch: 81, train_loss: 0.7501, test_loss: 0.9753, test_f1: 0.5743
 epoch: 82, train_loss: 0.7513, test_loss: 0.9853, test_f1: 0.5639
 epoch: 83, train_loss: 0.7441, test_loss: 0.9712, test_f1: 0.5766
 epoch: 84, train_loss: 0.7460, test_loss: 0.9823, test_f1: 0.5644
 epoch: 85, train_loss: 0.7567, test_loss: 0.9849, test_f1: 0.5717
 epoch: 86, train_loss: 0.7463, test_loss: 0.9746, test_f1: 0.5964
 epoch: 87, train_loss: 0.7497, test_loss: 0.9764, test_f1: 0.5824
 epoch: 88, train_loss: 0.7359, test_loss: 0.9785, test_f1: 0.5883
 epoch: 89, train_loss: 0.7430, test_loss: 0.9742, test_f1: 0.5919
 epoch: 90, train_loss: 0.7478, test_loss: 0.9843, test_f1: 0.5724
 epoch: 91, train_loss: 0.7403, test_loss: 0.9925, test_f1: 0.5818
 epoch: 92, train_loss: 0.7352, test_loss: 0.9862, test_f1: 0.5797
 epoch: 93, train_loss: 0.7398, test_loss: 0.9874, test_f1: 0.5794
 epoch: 94, train_loss: 0.7461, test_loss: 0.9838, test_f1: 0.5762
 epoch: 95, train_loss: 0.7510, test_loss: 0.9933, test_f1: 0.5738
 epoch: 96, train_loss: 0.7285, test_loss: 0.9820, test_f1: 0.5748
 epoch: 97, train_loss: 0.7313, test_loss: 0.9780, test_f1: 0.5796
 epoch: 98, train_loss: 0.7292, test_loss: 0.9805, test_f1: 0.5894
 epoch: 99, train_loss: 0.7280, test_loss: 0.9719, test_f1: 0.5827
##################ITERATION #5 ****************************************
 epoch: 0, train_loss: 1.2477, test_loss: 1.2170, test_f1: 0.3911
 epoch: 1, train_loss: 1.1523, test_loss: 1.0769, test_f1: 0.4729
 epoch: 2, train_loss: 1.1190, test_loss: 1.0250, test_f1: 0.4772
 epoch: 3, train_loss: 1.0943, test_loss: 1.0009, test_f1: 0.4948
 epoch: 4, train_loss: 1.0631, test_loss: 0.9741, test_f1: 0.4892
 epoch: 5, train_loss: 1.0425, test_loss: 0.9705, test_f1: 0.4969
 epoch: 6, train_loss: 1.0121, test_loss: 0.9588, test_f1: 0.5138
 epoch: 7, train_loss: 1.0109, test_loss: 0.9480, test_f1: 0.5140
 epoch: 8, train_loss: 0.9938, test_loss: 0.9365, test_f1: 0.5137
 epoch: 9, train_loss: 0.9795, test_loss: 0.9323, test_f1: 0.5144
 epoch: 10, train_loss: 0.9717, test_loss: 0.9384, test_f1: 0.5006
 epoch: 11, train_loss: 0.9723, test_loss: 0.9280, test_f1: 0.4922
 epoch: 12, train_loss: 0.9523, test_loss: 0.9351, test_f1: 0.5145
 epoch: 13, train_loss: 0.9388, test_loss: 0.9358, test_f1: 0.5184
 epoch: 14, train_loss: 0.9263, test_loss: 0.9406, test_f1: 0.5168
 epoch: 15, train_loss: 0.9214, test_loss: 0.9235, test_f1: 0.5235
 epoch: 16, train_loss: 0.9197, test_loss: 0.9272, test_f1: 0.5190
 epoch: 17, train_loss: 0.9088, test_loss: 0.9236, test_f1: 0.5253
 epoch: 18, train_loss: 0.9080, test_loss: 0.9122, test_f1: 0.5216
 epoch: 19, train_loss: 0.9015, test_loss: 0.9152, test_f1: 0.5253
 epoch: 20, train_loss: 0.8877, test_loss: 0.9188, test_f1: 0.5188
 epoch: 21, train_loss: 0.8842, test_loss: 0.9261, test_f1: 0.5608
 epoch: 22, train_loss: 0.8840, test_loss: 0.9289, test_f1: 0.5362
 epoch: 23, train_loss: 0.8819, test_loss: 0.9151, test_f1: 0.5415
 epoch: 24, train_loss: 0.8728, test_loss: 0.9179, test_f1: 0.5571
 epoch: 25, train_loss: 0.8727, test_loss: 0.9114, test_f1: 0.5503
 epoch: 26, train_loss: 0.8682, test_loss: 0.9245, test_f1: 0.5425
 epoch: 27, train_loss: 0.8612, test_loss: 0.9262, test_f1: 0.5655
 epoch: 28, train_loss: 0.8551, test_loss: 0.9244, test_f1: 0.5445
 epoch: 29, train_loss: 0.8464, test_loss: 0.9113, test_f1: 0.5499
 epoch: 30, train_loss: 0.8494, test_loss: 0.9131, test_f1: 0.5635
 epoch: 31, train_loss: 0.8417, test_loss: 0.9211, test_f1: 0.5753
 epoch: 32, train_loss: 0.8398, test_loss: 0.9082, test_f1: 0.5891
 epoch: 33, train_loss: 0.8359, test_loss: 0.9209, test_f1: 0.5741
 epoch: 34, train_loss: 0.8349, test_loss: 0.9142, test_f1: 0.5837
 epoch: 35, train_loss: 0.8216, test_loss: 0.9396, test_f1: 0.5463
 epoch: 36, train_loss: 0.8242, test_loss: 0.9446, test_f1: 0.5576
 epoch: 37, train_loss: 0.8280, test_loss: 0.9137, test_f1: 0.5814
 epoch: 38, train_loss: 0.8159, test_loss: 0.9164, test_f1: 0.5582
 epoch: 39, train_loss: 0.8205, test_loss: 0.9229, test_f1: 0.5685
 epoch: 40, train_loss: 0.8084, test_loss: 0.9353, test_f1: 0.5680
 epoch: 41, train_loss: 0.8132, test_loss: 0.9234, test_f1: 0.5807
 epoch: 42, train_loss: 0.8019, test_loss: 0.9142, test_f1: 0.5677
 epoch: 43, train_loss: 0.7963, test_loss: 0.9271, test_f1: 0.5681
 epoch: 44, train_loss: 0.8046, test_loss: 0.9155, test_f1: 0.5811
 epoch: 45, train_loss: 0.8071, test_loss: 0.9293, test_f1: 0.5852
 epoch: 46, train_loss: 0.7944, test_loss: 0.9207, test_f1: 0.5747
 epoch: 47, train_loss: 0.7942, test_loss: 0.9300, test_f1: 0.5648
 epoch: 48, train_loss: 0.7898, test_loss: 0.9322, test_f1: 0.5879
 epoch: 49, train_loss: 0.7942, test_loss: 0.9483, test_f1: 0.5817
 epoch: 50, train_loss: 0.7819, test_loss: 0.9144, test_f1: 0.6066
 epoch: 51, train_loss: 0.7788, test_loss: 0.9206, test_f1: 0.6028
 epoch: 52, train_loss: 0.7673, test_loss: 0.9175, test_f1: 0.5984
 epoch: 53, train_loss: 0.7624, test_loss: 0.9216, test_f1: 0.5888
 epoch: 54, train_loss: 0.7678, test_loss: 0.9190, test_f1: 0.5936
 epoch: 55, train_loss: 0.7570, test_loss: 0.9249, test_f1: 0.5893
 epoch: 56, train_loss: 0.7548, test_loss: 0.9440, test_f1: 0.5919
 epoch: 57, train_loss: 0.7672, test_loss: 0.9318, test_f1: 0.5832
 epoch: 58, train_loss: 0.7550, test_loss: 0.9191, test_f1: 0.5863
 epoch: 59, train_loss: 0.7609, test_loss: 0.9290, test_f1: 0.6029
 epoch: 60, train_loss: 0.7645, test_loss: 0.9231, test_f1: 0.6010
 epoch: 61, train_loss: 0.7538, test_loss: 0.9211, test_f1: 0.6077
 epoch: 62, train_loss: 0.7509, test_loss: 0.9133, test_f1: 0.6142
 epoch: 63, train_loss: 0.7656, test_loss: 0.9088, test_f1: 0.6104
 epoch: 64, train_loss: 0.7449, test_loss: 0.9140, test_f1: 0.6062
 epoch: 65, train_loss: 0.7456, test_loss: 0.9122, test_f1: 0.5991
 epoch: 66, train_loss: 0.7357, test_loss: 0.9283, test_f1: 0.6090
 epoch: 67, train_loss: 0.7476, test_loss: 0.9140, test_f1: 0.6005
 epoch: 68, train_loss: 0.7416, test_loss: 0.9131, test_f1: 0.6146
 epoch: 69, train_loss: 0.7417, test_loss: 0.9151, test_f1: 0.6122
 epoch: 70, train_loss: 0.7391, test_loss: 0.9041, test_f1: 0.6135
 epoch: 71, train_loss: 0.7306, test_loss: 0.9143, test_f1: 0.6157
 epoch: 72, train_loss: 0.7311, test_loss: 0.9121, test_f1: 0.6128
 epoch: 73, train_loss: 0.7326, test_loss: 0.9118, test_f1: 0.6117
 epoch: 74, train_loss: 0.7344, test_loss: 0.9156, test_f1: 0.6116
 epoch: 75, train_loss: 0.7267, test_loss: 0.9169, test_f1: 0.6151
 epoch: 76, train_loss: 0.7312, test_loss: 0.9237, test_f1: 0.6184
 epoch: 77, train_loss: 0.7339, test_loss: 0.9218, test_f1: 0.6169
 epoch: 78, train_loss: 0.7312, test_loss: 0.9233, test_f1: 0.6099
 epoch: 79, train_loss: 0.7255, test_loss: 0.9095, test_f1: 0.6116
 epoch: 80, train_loss: 0.7235, test_loss: 0.9217, test_f1: 0.6112
 epoch: 81, train_loss: 0.7307, test_loss: 0.9117, test_f1: 0.6215
 epoch: 82, train_loss: 0.7113, test_loss: 0.9206, test_f1: 0.6075
 epoch: 83, train_loss: 0.7256, test_loss: 0.9300, test_f1: 0.6002
 epoch: 84, train_loss: 0.7213, test_loss: 0.9281, test_f1: 0.5943
 epoch: 85, train_loss: 0.7136, test_loss: 0.9410, test_f1: 0.5947
 epoch: 86, train_loss: 0.7037, test_loss: 0.9193, test_f1: 0.6100
 epoch: 87, train_loss: 0.7103, test_loss: 0.9337, test_f1: 0.5968
 epoch: 88, train_loss: 0.7157, test_loss: 0.9354, test_f1: 0.6004
 epoch: 89, train_loss: 0.7013, test_loss: 0.9410, test_f1: 0.5989
 epoch: 90, train_loss: 0.7141, test_loss: 0.9228, test_f1: 0.6153
 epoch: 91, train_loss: 0.7070, test_loss: 0.9294, test_f1: 0.6188
 epoch: 92, train_loss: 0.7117, test_loss: 0.9229, test_f1: 0.6055
 epoch: 93, train_loss: 0.7097, test_loss: 0.9242, test_f1: 0.6163
 epoch: 94, train_loss: 0.7043, test_loss: 0.9203, test_f1: 0.6196
 epoch: 95, train_loss: 0.7107, test_loss: 0.9210, test_f1: 0.6115
 epoch: 96, train_loss: 0.6899, test_loss: 0.9228, test_f1: 0.6044
 epoch: 97, train_loss: 0.7081, test_loss: 0.9412, test_f1: 0.6064
 epoch: 98, train_loss: 0.7050, test_loss: 0.9236, test_f1: 0.6026
 epoch: 99, train_loss: 0.7097, test_loss: 0.9239, test_f1: 0.6047
##################ITERATION #6 ****************************************
 epoch: 0, train_loss: 1.2492, test_loss: 1.1960, test_f1: 0.3467
 epoch: 1, train_loss: 1.1567, test_loss: 1.0930, test_f1: 0.4056
 epoch: 2, train_loss: 1.1270, test_loss: 1.0710, test_f1: 0.4146
 epoch: 3, train_loss: 1.1135, test_loss: 1.0314, test_f1: 0.4306
 epoch: 4, train_loss: 1.0817, test_loss: 1.0257, test_f1: 0.4325
 epoch: 5, train_loss: 1.0742, test_loss: 1.0013, test_f1: 0.4408
 epoch: 6, train_loss: 1.0658, test_loss: 0.9749, test_f1: 0.4831
 epoch: 7, train_loss: 1.0475, test_loss: 0.9826, test_f1: 0.4826
 epoch: 8, train_loss: 1.0288, test_loss: 0.9674, test_f1: 0.4947
 epoch: 9, train_loss: 1.0192, test_loss: 0.9470, test_f1: 0.4817
 epoch: 10, train_loss: 1.0003, test_loss: 0.9606, test_f1: 0.4785
 epoch: 11, train_loss: 1.0002, test_loss: 0.9474, test_f1: 0.4943
 epoch: 12, train_loss: 0.9869, test_loss: 0.9544, test_f1: 0.4868
 epoch: 13, train_loss: 0.9882, test_loss: 0.9695, test_f1: 0.4956
 epoch: 14, train_loss: 0.9836, test_loss: 0.9514, test_f1: 0.4988
 epoch: 15, train_loss: 0.9631, test_loss: 0.9524, test_f1: 0.5136
 epoch: 16, train_loss: 0.9498, test_loss: 0.9403, test_f1: 0.5024
 epoch: 17, train_loss: 0.9451, test_loss: 0.9448, test_f1: 0.5029
 epoch: 18, train_loss: 0.9460, test_loss: 0.9388, test_f1: 0.5050
 epoch: 19, train_loss: 0.9325, test_loss: 0.9465, test_f1: 0.5160
 epoch: 20, train_loss: 0.9298, test_loss: 0.9517, test_f1: 0.5098
 epoch: 21, train_loss: 0.9263, test_loss: 0.9397, test_f1: 0.5207
 epoch: 22, train_loss: 0.9232, test_loss: 0.9487, test_f1: 0.5142
 epoch: 23, train_loss: 0.9120, test_loss: 0.9498, test_f1: 0.5179
 epoch: 24, train_loss: 0.9095, test_loss: 0.9416, test_f1: 0.5291
 epoch: 25, train_loss: 0.9033, test_loss: 0.9397, test_f1: 0.5247
 epoch: 26, train_loss: 0.9003, test_loss: 0.9366, test_f1: 0.5290
 epoch: 27, train_loss: 0.8921, test_loss: 0.9565, test_f1: 0.5117
 epoch: 28, train_loss: 0.8900, test_loss: 0.9544, test_f1: 0.5311
 epoch: 29, train_loss: 0.8900, test_loss: 0.9414, test_f1: 0.5461
 epoch: 30, train_loss: 0.8772, test_loss: 0.9445, test_f1: 0.5279
 epoch: 31, train_loss: 0.8732, test_loss: 0.9478, test_f1: 0.5394
 epoch: 32, train_loss: 0.8705, test_loss: 0.9464, test_f1: 0.5351
 epoch: 33, train_loss: 0.8677, test_loss: 0.9447, test_f1: 0.5444
 epoch: 34, train_loss: 0.8692, test_loss: 0.9550, test_f1: 0.5143
 epoch: 35, train_loss: 0.8488, test_loss: 0.9505, test_f1: 0.5459
 epoch: 36, train_loss: 0.8469, test_loss: 0.9524, test_f1: 0.5286
 epoch: 37, train_loss: 0.8484, test_loss: 0.9583, test_f1: 0.5430
 epoch: 38, train_loss: 0.8631, test_loss: 0.9550, test_f1: 0.5274
 epoch: 39, train_loss: 0.8401, test_loss: 0.9504, test_f1: 0.5510
 epoch: 40, train_loss: 0.8322, test_loss: 0.9607, test_f1: 0.5391
 epoch: 41, train_loss: 0.8330, test_loss: 0.9366, test_f1: 0.5411
 epoch: 42, train_loss: 0.8356, test_loss: 0.9465, test_f1: 0.5541
 epoch: 43, train_loss: 0.8207, test_loss: 0.9548, test_f1: 0.5474
 epoch: 44, train_loss: 0.8286, test_loss: 0.9573, test_f1: 0.5393
 epoch: 45, train_loss: 0.8325, test_loss: 0.9651, test_f1: 0.5469
 epoch: 46, train_loss: 0.8200, test_loss: 0.9463, test_f1: 0.5481
 epoch: 47, train_loss: 0.8048, test_loss: 0.9435, test_f1: 0.5616
 epoch: 48, train_loss: 0.8106, test_loss: 0.9673, test_f1: 0.5560
 epoch: 49, train_loss: 0.8137, test_loss: 0.9678, test_f1: 0.5524
 epoch: 50, train_loss: 0.8083, test_loss: 0.9450, test_f1: 0.5787
 epoch: 51, train_loss: 0.7963, test_loss: 0.9508, test_f1: 0.5688
 epoch: 52, train_loss: 0.7977, test_loss: 0.9681, test_f1: 0.5614
 epoch: 53, train_loss: 0.7927, test_loss: 0.9626, test_f1: 0.5608
 epoch: 54, train_loss: 0.7895, test_loss: 0.9561, test_f1: 0.5608
 epoch: 55, train_loss: 0.7809, test_loss: 0.9519, test_f1: 0.5557
 epoch: 56, train_loss: 0.7852, test_loss: 0.9649, test_f1: 0.5811
 epoch: 57, train_loss: 0.7895, test_loss: 0.9541, test_f1: 0.5772
 epoch: 58, train_loss: 0.7701, test_loss: 0.9454, test_f1: 0.5787
 epoch: 59, train_loss: 0.7809, test_loss: 0.9507, test_f1: 0.5688
 epoch: 60, train_loss: 0.7746, test_loss: 0.9661, test_f1: 0.5694
 epoch: 61, train_loss: 0.7691, test_loss: 0.9776, test_f1: 0.5677
 epoch: 62, train_loss: 0.7623, test_loss: 0.9578, test_f1: 0.5746
 epoch: 63, train_loss: 0.7878, test_loss: 0.9720, test_f1: 0.5671
 epoch: 64, train_loss: 0.7688, test_loss: 0.9735, test_f1: 0.5642
 epoch: 65, train_loss: 0.7583, test_loss: 0.9792, test_f1: 0.5659
 epoch: 66, train_loss: 0.7600, test_loss: 0.9794, test_f1: 0.5556
 epoch: 67, train_loss: 0.7637, test_loss: 0.9894, test_f1: 0.5632
 epoch: 68, train_loss: 0.7757, test_loss: 0.9503, test_f1: 0.5772
 epoch: 69, train_loss: 0.7514, test_loss: 0.9506, test_f1: 0.5838
 epoch: 70, train_loss: 0.7525, test_loss: 0.9650, test_f1: 0.5785
 epoch: 71, train_loss: 0.7549, test_loss: 0.9622, test_f1: 0.5745
 epoch: 72, train_loss: 0.7633, test_loss: 0.9798, test_f1: 0.5756
 epoch: 73, train_loss: 0.7501, test_loss: 0.9538, test_f1: 0.5900
 epoch: 74, train_loss: 0.7497, test_loss: 0.9806, test_f1: 0.5739
 epoch: 75, train_loss: 0.7537, test_loss: 0.9623, test_f1: 0.5687
 epoch: 76, train_loss: 0.7510, test_loss: 0.9907, test_f1: 0.5786
 epoch: 77, train_loss: 0.7448, test_loss: 0.9845, test_f1: 0.5806
 epoch: 78, train_loss: 0.7483, test_loss: 0.9775, test_f1: 0.5770
 epoch: 79, train_loss: 0.7457, test_loss: 0.9771, test_f1: 0.5826
 epoch: 80, train_loss: 0.7444, test_loss: 0.9644, test_f1: 0.5759
 epoch: 81, train_loss: 0.7291, test_loss: 0.9680, test_f1: 0.5940
 epoch: 82, train_loss: 0.7385, test_loss: 0.9709, test_f1: 0.5743
 epoch: 83, train_loss: 0.7353, test_loss: 0.9713, test_f1: 0.5923
 epoch: 84, train_loss: 0.7366, test_loss: 0.9716, test_f1: 0.5941
 epoch: 85, train_loss: 0.7324, test_loss: 0.9746, test_f1: 0.5886
 epoch: 86, train_loss: 0.7356, test_loss: 0.9867, test_f1: 0.5792
 epoch: 87, train_loss: 0.7250, test_loss: 0.9737, test_f1: 0.5870
 epoch: 88, train_loss: 0.7244, test_loss: 0.9913, test_f1: 0.5832
 epoch: 89, train_loss: 0.7313, test_loss: 0.9751, test_f1: 0.5893
 epoch: 90, train_loss: 0.7256, test_loss: 0.9886, test_f1: 0.5780
 epoch: 91, train_loss: 0.7360, test_loss: 0.9742, test_f1: 0.5892
 epoch: 92, train_loss: 0.7256, test_loss: 0.9745, test_f1: 0.5883
 epoch: 93, train_loss: 0.7272, test_loss: 0.9683, test_f1: 0.5980
 epoch: 94, train_loss: 0.7197, test_loss: 0.9576, test_f1: 0.5919
 epoch: 95, train_loss: 0.7263, test_loss: 0.9754, test_f1: 0.5899
 epoch: 96, train_loss: 0.7079, test_loss: 0.9629, test_f1: 0.5843
 epoch: 97, train_loss: 0.7147, test_loss: 0.9779, test_f1: 0.5879
 epoch: 98, train_loss: 0.7202, test_loss: 0.9777, test_f1: 0.5923
 epoch: 99, train_loss: 0.7084, test_loss: 0.9871, test_f1: 0.5809
##################ITERATION #7 ****************************************
 epoch: 0, train_loss: 1.2963, test_loss: 1.1858, test_f1: 0.3273
 epoch: 1, train_loss: 1.1754, test_loss: 1.0752, test_f1: 0.4164
 epoch: 2, train_loss: 1.1433, test_loss: 1.0375, test_f1: 0.4789
 epoch: 3, train_loss: 1.1222, test_loss: 1.0188, test_f1: 0.4881
 epoch: 4, train_loss: 1.0855, test_loss: 0.9996, test_f1: 0.4659
 epoch: 5, train_loss: 1.0680, test_loss: 0.9863, test_f1: 0.4814
 epoch: 6, train_loss: 1.0464, test_loss: 0.9635, test_f1: 0.5255
 epoch: 7, train_loss: 1.0275, test_loss: 0.9598, test_f1: 0.5083
 epoch: 8, train_loss: 1.0060, test_loss: 0.9475, test_f1: 0.5077
 epoch: 9, train_loss: 0.9974, test_loss: 0.9339, test_f1: 0.5174
 epoch: 10, train_loss: 0.9916, test_loss: 0.9472, test_f1: 0.4885
 epoch: 11, train_loss: 0.9848, test_loss: 0.9356, test_f1: 0.5064
 epoch: 12, train_loss: 0.9695, test_loss: 0.9366, test_f1: 0.5180
 epoch: 13, train_loss: 0.9573, test_loss: 0.9739, test_f1: 0.5033
 epoch: 14, train_loss: 0.9598, test_loss: 0.9190, test_f1: 0.5110
 epoch: 15, train_loss: 0.9443, test_loss: 0.9338, test_f1: 0.4973
 epoch: 16, train_loss: 0.9402, test_loss: 0.9383, test_f1: 0.5298
 epoch: 17, train_loss: 0.9302, test_loss: 0.9259, test_f1: 0.5134
 epoch: 18, train_loss: 0.9215, test_loss: 0.9382, test_f1: 0.5197
 epoch: 19, train_loss: 0.9159, test_loss: 0.9255, test_f1: 0.5285
 epoch: 20, train_loss: 0.9114, test_loss: 0.9281, test_f1: 0.5358
 epoch: 21, train_loss: 0.9030, test_loss: 0.9274, test_f1: 0.5266
 epoch: 22, train_loss: 0.8981, test_loss: 0.9306, test_f1: 0.5203
 epoch: 23, train_loss: 0.8887, test_loss: 0.9369, test_f1: 0.5291
 epoch: 24, train_loss: 0.8811, test_loss: 0.9350, test_f1: 0.5368
 epoch: 25, train_loss: 0.8792, test_loss: 0.9415, test_f1: 0.5515
 epoch: 26, train_loss: 0.8883, test_loss: 0.9103, test_f1: 0.5420
 epoch: 27, train_loss: 0.8723, test_loss: 0.8979, test_f1: 0.5361
 epoch: 28, train_loss: 0.8780, test_loss: 0.9239, test_f1: 0.5452
 epoch: 29, train_loss: 0.8577, test_loss: 0.9170, test_f1: 0.5648
 epoch: 30, train_loss: 0.8500, test_loss: 0.9090, test_f1: 0.5517
 epoch: 31, train_loss: 0.8580, test_loss: 0.9317, test_f1: 0.5537
 epoch: 32, train_loss: 0.8489, test_loss: 0.9402, test_f1: 0.5516
 epoch: 33, train_loss: 0.8517, test_loss: 0.9278, test_f1: 0.5489
 epoch: 34, train_loss: 0.8484, test_loss: 0.9311, test_f1: 0.5555
 epoch: 35, train_loss: 0.8400, test_loss: 0.9127, test_f1: 0.5702
 epoch: 36, train_loss: 0.8352, test_loss: 0.9308, test_f1: 0.5720
 epoch: 37, train_loss: 0.8343, test_loss: 0.9229, test_f1: 0.5912
 epoch: 38, train_loss: 0.8394, test_loss: 0.9390, test_f1: 0.5775
 epoch: 39, train_loss: 0.8332, test_loss: 0.9189, test_f1: 0.5605
 epoch: 40, train_loss: 0.8093, test_loss: 0.9307, test_f1: 0.5589
 epoch: 41, train_loss: 0.8147, test_loss: 0.9424, test_f1: 0.5820
 epoch: 42, train_loss: 0.8203, test_loss: 0.9300, test_f1: 0.5600
 epoch: 43, train_loss: 0.8128, test_loss: 0.9182, test_f1: 0.5590
 epoch: 44, train_loss: 0.8048, test_loss: 0.9405, test_f1: 0.5713
 epoch: 45, train_loss: 0.8061, test_loss: 0.9130, test_f1: 0.5956
 epoch: 46, train_loss: 0.7981, test_loss: 0.9278, test_f1: 0.5628
 epoch: 47, train_loss: 0.7950, test_loss: 0.9005, test_f1: 0.5743
 epoch: 48, train_loss: 0.7965, test_loss: 0.9361, test_f1: 0.5763
 epoch: 49, train_loss: 0.7899, test_loss: 0.9102, test_f1: 0.5946
 epoch: 50, train_loss: 0.7873, test_loss: 0.9102, test_f1: 0.5850
 epoch: 51, train_loss: 0.7694, test_loss: 0.9035, test_f1: 0.5964
 epoch: 52, train_loss: 0.7824, test_loss: 0.9243, test_f1: 0.5832
 epoch: 53, train_loss: 0.7793, test_loss: 0.9150, test_f1: 0.5852
 epoch: 54, train_loss: 0.7617, test_loss: 0.9285, test_f1: 0.6018
 epoch: 55, train_loss: 0.7621, test_loss: 0.9308, test_f1: 0.5800
 epoch: 56, train_loss: 0.7669, test_loss: 0.9175, test_f1: 0.5877
 epoch: 57, train_loss: 0.7716, test_loss: 0.9233, test_f1: 0.6068
 epoch: 58, train_loss: 0.7633, test_loss: 0.9236, test_f1: 0.5848
 epoch: 59, train_loss: 0.7612, test_loss: 0.9332, test_f1: 0.5895
 epoch: 60, train_loss: 0.7564, test_loss: 0.9355, test_f1: 0.6066
 epoch: 61, train_loss: 0.7620, test_loss: 0.9380, test_f1: 0.6049
 epoch: 62, train_loss: 0.7541, test_loss: 0.9159, test_f1: 0.5797
 epoch: 63, train_loss: 0.7532, test_loss: 0.9370, test_f1: 0.6110
 epoch: 64, train_loss: 0.7569, test_loss: 0.9182, test_f1: 0.5853
 epoch: 65, train_loss: 0.7495, test_loss: 0.9266, test_f1: 0.5988
 epoch: 66, train_loss: 0.7327, test_loss: 0.9271, test_f1: 0.5984
 epoch: 67, train_loss: 0.7582, test_loss: 0.9024, test_f1: 0.6042
 epoch: 68, train_loss: 0.7361, test_loss: 0.9086, test_f1: 0.5954
 epoch: 69, train_loss: 0.7554, test_loss: 0.9185, test_f1: 0.5772
 epoch: 70, train_loss: 0.7452, test_loss: 0.9377, test_f1: 0.5908
 epoch: 71, train_loss: 0.7315, test_loss: 0.9415, test_f1: 0.6104
 epoch: 72, train_loss: 0.7427, test_loss: 0.9202, test_f1: 0.6012
 epoch: 73, train_loss: 0.7339, test_loss: 0.9230, test_f1: 0.6132
 epoch: 74, train_loss: 0.7461, test_loss: 0.9573, test_f1: 0.5976
 epoch: 75, train_loss: 0.7426, test_loss: 0.9075, test_f1: 0.5979
 epoch: 76, train_loss: 0.7390, test_loss: 0.9352, test_f1: 0.5999
 epoch: 77, train_loss: 0.7310, test_loss: 0.9383, test_f1: 0.5924
 epoch: 78, train_loss: 0.7341, test_loss: 0.9160, test_f1: 0.6225
 epoch: 79, train_loss: 0.7406, test_loss: 0.9031, test_f1: 0.6086
 epoch: 80, train_loss: 0.7329, test_loss: 0.9332, test_f1: 0.6064
 epoch: 81, train_loss: 0.7204, test_loss: 0.9174, test_f1: 0.5944
 epoch: 82, train_loss: 0.7250, test_loss: 0.9254, test_f1: 0.6010
 epoch: 83, train_loss: 0.7254, test_loss: 0.9223, test_f1: 0.6009
 epoch: 84, train_loss: 0.7224, test_loss: 0.9101, test_f1: 0.6070
 epoch: 85, train_loss: 0.7298, test_loss: 0.9121, test_f1: 0.6235
 epoch: 86, train_loss: 0.7090, test_loss: 0.9193, test_f1: 0.6023
 epoch: 87, train_loss: 0.7205, test_loss: 0.9163, test_f1: 0.6174
 epoch: 88, train_loss: 0.7112, test_loss: 0.9245, test_f1: 0.6181
 epoch: 89, train_loss: 0.7156, test_loss: 0.9433, test_f1: 0.6145
 epoch: 90, train_loss: 0.7190, test_loss: 0.9399, test_f1: 0.6012
 epoch: 91, train_loss: 0.7198, test_loss: 0.9322, test_f1: 0.5959
 epoch: 92, train_loss: 0.7096, test_loss: 0.9607, test_f1: 0.6010
 epoch: 93, train_loss: 0.7014, test_loss: 0.9384, test_f1: 0.5995
 epoch: 94, train_loss: 0.7044, test_loss: 0.9323, test_f1: 0.6094
 epoch: 95, train_loss: 0.7055, test_loss: 0.9278, test_f1: 0.6168
 epoch: 96, train_loss: 0.7133, test_loss: 0.9407, test_f1: 0.6279
 epoch: 97, train_loss: 0.7041, test_loss: 0.9183, test_f1: 0.5894
 epoch: 98, train_loss: 0.7143, test_loss: 0.9354, test_f1: 0.5958
 epoch: 99, train_loss: 0.6961, test_loss: 0.9297, test_f1: 0.6031
##################ITERATION #8 ****************************************
 epoch: 0, train_loss: 1.2399, test_loss: 1.2214, test_f1: 0.3128
 epoch: 1, train_loss: 1.1445, test_loss: 1.0769, test_f1: 0.4232
 epoch: 2, train_loss: 1.1146, test_loss: 1.0621, test_f1: 0.4673
 epoch: 3, train_loss: 1.0844, test_loss: 1.0353, test_f1: 0.4450
 epoch: 4, train_loss: 1.0640, test_loss: 1.0205, test_f1: 0.4498
 epoch: 5, train_loss: 1.0428, test_loss: 1.0363, test_f1: 0.4636
 epoch: 6, train_loss: 1.0263, test_loss: 1.0271, test_f1: 0.4565
 epoch: 7, train_loss: 1.0123, test_loss: 1.0034, test_f1: 0.4755
 epoch: 8, train_loss: 0.9993, test_loss: 0.9997, test_f1: 0.4694
 epoch: 9, train_loss: 0.9901, test_loss: 0.9888, test_f1: 0.4798
 epoch: 10, train_loss: 0.9756, test_loss: 0.9956, test_f1: 0.4799
 epoch: 11, train_loss: 0.9735, test_loss: 1.0063, test_f1: 0.4904
 epoch: 12, train_loss: 0.9549, test_loss: 1.0031, test_f1: 0.4735
 epoch: 13, train_loss: 0.9523, test_loss: 0.9865, test_f1: 0.4994
 epoch: 14, train_loss: 0.9477, test_loss: 0.9933, test_f1: 0.4945
 epoch: 15, train_loss: 0.9378, test_loss: 0.9849, test_f1: 0.4942
 epoch: 16, train_loss: 0.9198, test_loss: 0.9896, test_f1: 0.5026
 epoch: 17, train_loss: 0.9186, test_loss: 1.0004, test_f1: 0.5015
 epoch: 18, train_loss: 0.9059, test_loss: 0.9869, test_f1: 0.5191
 epoch: 19, train_loss: 0.9003, test_loss: 0.9941, test_f1: 0.4890
 epoch: 20, train_loss: 0.9033, test_loss: 0.9907, test_f1: 0.5182
 epoch: 21, train_loss: 0.8925, test_loss: 0.9945, test_f1: 0.5103
 epoch: 22, train_loss: 0.8864, test_loss: 1.0031, test_f1: 0.5049
 epoch: 23, train_loss: 0.8873, test_loss: 0.9819, test_f1: 0.5032
 epoch: 24, train_loss: 0.8751, test_loss: 0.9915, test_f1: 0.4876
 epoch: 25, train_loss: 0.8833, test_loss: 0.9912, test_f1: 0.5191
 epoch: 26, train_loss: 0.8734, test_loss: 0.9975, test_f1: 0.5173
 epoch: 27, train_loss: 0.8625, test_loss: 1.0018, test_f1: 0.5201
 epoch: 28, train_loss: 0.8780, test_loss: 1.0090, test_f1: 0.5188
 epoch: 29, train_loss: 0.8581, test_loss: 0.9989, test_f1: 0.5254
 epoch: 30, train_loss: 0.8820, test_loss: 0.9989, test_f1: 0.5257
 epoch: 31, train_loss: 0.8566, test_loss: 1.0177, test_f1: 0.5184
 epoch: 32, train_loss: 0.8502, test_loss: 0.9742, test_f1: 0.5296
 epoch: 33, train_loss: 0.8389, test_loss: 0.9843, test_f1: 0.5294
 epoch: 34, train_loss: 0.8518, test_loss: 0.9976, test_f1: 0.5287
 epoch: 35, train_loss: 0.8470, test_loss: 0.9931, test_f1: 0.5248
 epoch: 36, train_loss: 0.8271, test_loss: 0.9913, test_f1: 0.5157
 epoch: 37, train_loss: 0.8283, test_loss: 1.0001, test_f1: 0.5277
 epoch: 38, train_loss: 0.8270, test_loss: 0.9891, test_f1: 0.5418
 epoch: 39, train_loss: 0.8279, test_loss: 0.9959, test_f1: 0.5497
 epoch: 40, train_loss: 0.8160, test_loss: 1.0028, test_f1: 0.5508
 epoch: 41, train_loss: 0.8195, test_loss: 1.0176, test_f1: 0.5220
 epoch: 42, train_loss: 0.8212, test_loss: 1.0047, test_f1: 0.5444
 epoch: 43, train_loss: 0.8062, test_loss: 1.0111, test_f1: 0.5448
 epoch: 44, train_loss: 0.8074, test_loss: 1.0235, test_f1: 0.5220
 epoch: 45, train_loss: 0.8028, test_loss: 0.9930, test_f1: 0.5357
 epoch: 46, train_loss: 0.8164, test_loss: 1.0034, test_f1: 0.5323
 epoch: 47, train_loss: 0.8009, test_loss: 0.9978, test_f1: 0.5744
 epoch: 48, train_loss: 0.7962, test_loss: 1.0043, test_f1: 0.5441
 epoch: 49, train_loss: 0.8096, test_loss: 0.9977, test_f1: 0.5602
 epoch: 50, train_loss: 0.7848, test_loss: 0.9996, test_f1: 0.5554
 epoch: 51, train_loss: 0.7801, test_loss: 1.0012, test_f1: 0.5667
 epoch: 52, train_loss: 0.7704, test_loss: 0.9995, test_f1: 0.5618
 epoch: 53, train_loss: 0.7717, test_loss: 0.9974, test_f1: 0.5515
 epoch: 54, train_loss: 0.7691, test_loss: 1.0007, test_f1: 0.5434
 epoch: 55, train_loss: 0.7751, test_loss: 1.0013, test_f1: 0.5384
 epoch: 56, train_loss: 0.7582, test_loss: 1.0013, test_f1: 0.5466
 epoch: 57, train_loss: 0.7697, test_loss: 0.9978, test_f1: 0.5523
 epoch: 58, train_loss: 0.7649, test_loss: 0.9952, test_f1: 0.5443
 epoch: 59, train_loss: 0.7660, test_loss: 0.9994, test_f1: 0.5431
 epoch: 60, train_loss: 0.7615, test_loss: 1.0097, test_f1: 0.5596
 epoch: 61, train_loss: 0.7643, test_loss: 1.0146, test_f1: 0.5389
 epoch: 62, train_loss: 0.7566, test_loss: 0.9983, test_f1: 0.5563
 epoch: 63, train_loss: 0.7593, test_loss: 1.0145, test_f1: 0.5523
 epoch: 64, train_loss: 0.7689, test_loss: 1.0266, test_f1: 0.5506
 epoch: 65, train_loss: 0.7625, test_loss: 1.0328, test_f1: 0.5244
 epoch: 66, train_loss: 0.7642, test_loss: 1.0137, test_f1: 0.5736
 epoch: 67, train_loss: 0.7560, test_loss: 1.0234, test_f1: 0.5500
 epoch: 68, train_loss: 0.7500, test_loss: 1.0004, test_f1: 0.5668
 epoch: 69, train_loss: 0.7576, test_loss: 1.0213, test_f1: 0.5517
 epoch: 70, train_loss: 0.7545, test_loss: 1.0190, test_f1: 0.5530
 epoch: 71, train_loss: 0.7531, test_loss: 1.0266, test_f1: 0.5640
 epoch: 72, train_loss: 0.7540, test_loss: 1.0267, test_f1: 0.5605
 epoch: 73, train_loss: 0.7521, test_loss: 1.0183, test_f1: 0.5624
 epoch: 74, train_loss: 0.7456, test_loss: 1.0486, test_f1: 0.5553
 epoch: 75, train_loss: 0.7436, test_loss: 1.0082, test_f1: 0.5685
 epoch: 76, train_loss: 0.7426, test_loss: 1.0129, test_f1: 0.5700
 epoch: 77, train_loss: 0.7301, test_loss: 1.0267, test_f1: 0.5625
 epoch: 78, train_loss: 0.7397, test_loss: 1.0369, test_f1: 0.5632
 epoch: 79, train_loss: 0.7314, test_loss: 1.0335, test_f1: 0.5738
 epoch: 80, train_loss: 0.7394, test_loss: 1.0314, test_f1: 0.5700
 epoch: 81, train_loss: 0.7322, test_loss: 1.0317, test_f1: 0.5574
 epoch: 82, train_loss: 0.7438, test_loss: 1.0240, test_f1: 0.5647
 epoch: 83, train_loss: 0.7319, test_loss: 1.0280, test_f1: 0.5682
 epoch: 84, train_loss: 0.7367, test_loss: 1.0402, test_f1: 0.5658
 epoch: 85, train_loss: 0.7109, test_loss: 1.0441, test_f1: 0.5605
 epoch: 86, train_loss: 0.7312, test_loss: 1.0353, test_f1: 0.5630
 epoch: 87, train_loss: 0.7351, test_loss: 1.0211, test_f1: 0.5658
 epoch: 88, train_loss: 0.7245, test_loss: 1.0311, test_f1: 0.5647
 epoch: 89, train_loss: 0.7338, test_loss: 1.0462, test_f1: 0.5730
 epoch: 90, train_loss: 0.7310, test_loss: 1.0511, test_f1: 0.5642
 epoch: 91, train_loss: 0.7195, test_loss: 1.0499, test_f1: 0.5748
 epoch: 92, train_loss: 0.7213, test_loss: 1.0365, test_f1: 0.5760
 epoch: 93, train_loss: 0.7205, test_loss: 1.0291, test_f1: 0.5927
 epoch: 94, train_loss: 0.7092, test_loss: 1.0365, test_f1: 0.5836
 epoch: 95, train_loss: 0.7100, test_loss: 1.0508, test_f1: 0.5775
 epoch: 96, train_loss: 0.7087, test_loss: 1.0279, test_f1: 0.5735
 epoch: 97, train_loss: 0.7135, test_loss: 1.0349, test_f1: 0.5851
 epoch: 98, train_loss: 0.7054, test_loss: 1.0429, test_f1: 0.5849
 epoch: 99, train_loss: 0.7095, test_loss: 1.0265, test_f1: 0.5910
##################ITERATION #9 ****************************************
 epoch: 0, train_loss: 1.3120, test_loss: 1.2023, test_f1: 0.3548
 epoch: 1, train_loss: 1.1684, test_loss: 1.0814, test_f1: 0.4386
 epoch: 2, train_loss: 1.1349, test_loss: 1.0538, test_f1: 0.4887
 epoch: 3, train_loss: 1.1080, test_loss: 1.0065, test_f1: 0.5000
 epoch: 4, train_loss: 1.0854, test_loss: 0.9924, test_f1: 0.4942
 epoch: 5, train_loss: 1.0665, test_loss: 0.9933, test_f1: 0.5015
 epoch: 6, train_loss: 1.0472, test_loss: 0.9801, test_f1: 0.5033
 epoch: 7, train_loss: 1.0284, test_loss: 0.9679, test_f1: 0.4959
 epoch: 8, train_loss: 1.0133, test_loss: 0.9523, test_f1: 0.5023
 epoch: 9, train_loss: 1.0020, test_loss: 0.9736, test_f1: 0.5024
 epoch: 10, train_loss: 0.9860, test_loss: 0.9521, test_f1: 0.5061
 epoch: 11, train_loss: 0.9823, test_loss: 0.9411, test_f1: 0.4950
 epoch: 12, train_loss: 0.9744, test_loss: 0.9733, test_f1: 0.4943
 epoch: 13, train_loss: 0.9818, test_loss: 0.9624, test_f1: 0.4951
 epoch: 14, train_loss: 0.9558, test_loss: 0.9445, test_f1: 0.5115
 epoch: 15, train_loss: 0.9641, test_loss: 0.9368, test_f1: 0.5137
 epoch: 16, train_loss: 0.9503, test_loss: 0.9401, test_f1: 0.5121
 epoch: 17, train_loss: 0.9435, test_loss: 0.9258, test_f1: 0.5081
 epoch: 18, train_loss: 0.9318, test_loss: 0.9447, test_f1: 0.5078
 epoch: 19, train_loss: 0.9184, test_loss: 0.9347, test_f1: 0.5126
 epoch: 20, train_loss: 0.9173, test_loss: 0.9288, test_f1: 0.5057
 epoch: 21, train_loss: 0.9165, test_loss: 0.9251, test_f1: 0.5150
 epoch: 22, train_loss: 0.9146, test_loss: 0.9193, test_f1: 0.5157
 epoch: 23, train_loss: 0.9071, test_loss: 0.9420, test_f1: 0.4994
 epoch: 24, train_loss: 0.8949, test_loss: 0.9413, test_f1: 0.5138
 epoch: 25, train_loss: 0.8965, test_loss: 0.9563, test_f1: 0.5052
 epoch: 26, train_loss: 0.8895, test_loss: 0.9278, test_f1: 0.5037
 epoch: 27, train_loss: 0.8958, test_loss: 0.9073, test_f1: 0.5091
 epoch: 28, train_loss: 0.8885, test_loss: 0.9354, test_f1: 0.5150
 epoch: 29, train_loss: 0.8766, test_loss: 0.9227, test_f1: 0.5076
 epoch: 30, train_loss: 0.8720, test_loss: 0.9392, test_f1: 0.5154
 epoch: 31, train_loss: 0.8734, test_loss: 0.9326, test_f1: 0.5089
 epoch: 32, train_loss: 0.8682, test_loss: 0.9297, test_f1: 0.5185
 epoch: 33, train_loss: 0.8681, test_loss: 0.9294, test_f1: 0.5348
 epoch: 34, train_loss: 0.8564, test_loss: 0.9371, test_f1: 0.5252
 epoch: 35, train_loss: 0.8475, test_loss: 0.9268, test_f1: 0.5198
 epoch: 36, train_loss: 0.8413, test_loss: 0.9337, test_f1: 0.5418
 epoch: 37, train_loss: 0.8431, test_loss: 0.9400, test_f1: 0.5169
 epoch: 38, train_loss: 0.8534, test_loss: 0.9289, test_f1: 0.5134
 epoch: 39, train_loss: 0.8412, test_loss: 0.9278, test_f1: 0.5393
 epoch: 40, train_loss: 0.8287, test_loss: 0.9334, test_f1: 0.5355
 epoch: 41, train_loss: 0.8362, test_loss: 0.9410, test_f1: 0.5221
 epoch: 42, train_loss: 0.8272, test_loss: 0.9407, test_f1: 0.5389
 epoch: 43, train_loss: 0.8232, test_loss: 0.9436, test_f1: 0.5211
 epoch: 44, train_loss: 0.8273, test_loss: 0.9471, test_f1: 0.5298
 epoch: 45, train_loss: 0.8162, test_loss: 0.9395, test_f1: 0.5347
 epoch: 46, train_loss: 0.8094, test_loss: 0.9365, test_f1: 0.5435
 epoch: 47, train_loss: 0.8137, test_loss: 0.9296, test_f1: 0.5407
 epoch: 48, train_loss: 0.8106, test_loss: 0.9376, test_f1: 0.5461
 epoch: 49, train_loss: 0.8151, test_loss: 0.9341, test_f1: 0.5293
 epoch: 50, train_loss: 0.8034, test_loss: 0.9288, test_f1: 0.5430
 epoch: 51, train_loss: 0.8029, test_loss: 0.9307, test_f1: 0.5564
 epoch: 52, train_loss: 0.7908, test_loss: 0.9205, test_f1: 0.5378
 epoch: 53, train_loss: 0.7918, test_loss: 0.9323, test_f1: 0.5556
 epoch: 54, train_loss: 0.7933, test_loss: 0.9201, test_f1: 0.5647
 epoch: 55, train_loss: 0.7883, test_loss: 0.9221, test_f1: 0.5423
 epoch: 56, train_loss: 0.7828, test_loss: 0.9142, test_f1: 0.5540
 epoch: 57, train_loss: 0.7829, test_loss: 0.9305, test_f1: 0.5563
 epoch: 58, train_loss: 0.7884, test_loss: 0.9157, test_f1: 0.5816
 epoch: 59, train_loss: 0.7772, test_loss: 0.9211, test_f1: 0.5589
 epoch: 60, train_loss: 0.7829, test_loss: 0.9210, test_f1: 0.5689
 epoch: 61, train_loss: 0.7730, test_loss: 0.9364, test_f1: 0.5665
 epoch: 62, train_loss: 0.7703, test_loss: 0.9361, test_f1: 0.5637
 epoch: 63, train_loss: 0.7766, test_loss: 0.9320, test_f1: 0.5583
 epoch: 64, train_loss: 0.7720, test_loss: 0.9317, test_f1: 0.5640
 epoch: 65, train_loss: 0.7807, test_loss: 0.9321, test_f1: 0.5811
 epoch: 66, train_loss: 0.7693, test_loss: 0.9351, test_f1: 0.5664
 epoch: 67, train_loss: 0.7641, test_loss: 0.9310, test_f1: 0.5723
 epoch: 68, train_loss: 0.7669, test_loss: 0.9209, test_f1: 0.5670
 epoch: 69, train_loss: 0.7662, test_loss: 0.9213, test_f1: 0.5938
 epoch: 70, train_loss: 0.7653, test_loss: 0.9232, test_f1: 0.5712
 epoch: 71, train_loss: 0.7596, test_loss: 0.9155, test_f1: 0.5735
 epoch: 72, train_loss: 0.7551, test_loss: 0.9306, test_f1: 0.5724
 epoch: 73, train_loss: 0.7652, test_loss: 0.9288, test_f1: 0.5790
 epoch: 74, train_loss: 0.7555, test_loss: 0.9293, test_f1: 0.5831
 epoch: 75, train_loss: 0.7508, test_loss: 0.9415, test_f1: 0.5774
 epoch: 76, train_loss: 0.7575, test_loss: 0.9437, test_f1: 0.6012
 epoch: 77, train_loss: 0.7468, test_loss: 0.9381, test_f1: 0.5804
 epoch: 78, train_loss: 0.7504, test_loss: 0.9384, test_f1: 0.5780
 epoch: 79, train_loss: 0.7470, test_loss: 0.9303, test_f1: 0.5789
 epoch: 80, train_loss: 0.7473, test_loss: 0.9297, test_f1: 0.6014
 epoch: 81, train_loss: 0.7378, test_loss: 0.9386, test_f1: 0.5724
 epoch: 82, train_loss: 0.7445, test_loss: 0.9318, test_f1: 0.5806
 epoch: 83, train_loss: 0.7399, test_loss: 0.9441, test_f1: 0.5759
 epoch: 84, train_loss: 0.7442, test_loss: 0.9410, test_f1: 0.5768
 epoch: 85, train_loss: 0.7418, test_loss: 0.9371, test_f1: 0.6017
 epoch: 86, train_loss: 0.7394, test_loss: 0.9437, test_f1: 0.5893
 epoch: 87, train_loss: 0.7447, test_loss: 0.9497, test_f1: 0.6009
 epoch: 88, train_loss: 0.7329, test_loss: 0.9437, test_f1: 0.5977
 epoch: 89, train_loss: 0.7211, test_loss: 0.9434, test_f1: 0.6080
 epoch: 90, train_loss: 0.7297, test_loss: 0.9439, test_f1: 0.6004
 epoch: 91, train_loss: 0.7267, test_loss: 0.9424, test_f1: 0.6020
 epoch: 92, train_loss: 0.7171, test_loss: 0.9485, test_f1: 0.6058
 epoch: 93, train_loss: 0.7333, test_loss: 0.9531, test_f1: 0.5965
 epoch: 94, train_loss: 0.7272, test_loss: 0.9545, test_f1: 0.6004
 epoch: 95, train_loss: 0.7334, test_loss: 0.9607, test_f1: 0.5994
 epoch: 96, train_loss: 0.7312, test_loss: 0.9638, test_f1: 0.6033
 epoch: 97, train_loss: 0.7211, test_loss: 0.9520, test_f1: 0.6033
 epoch: 98, train_loss: 0.7195, test_loss: 0.9581, test_f1: 0.6071
 epoch: 99, train_loss: 0.7191, test_loss: 0.9638, test_f1: 0.5991

Training completed in 863.06 seconds
Best F1: 0.6279 at epoch 96
Mean F1 across iterations: 0.6040  0.0122
========================FINAL RESULTS================================
FEGIN weighted F1: 0.6279  0.0122
python main.py --data ltspice_examples --representation component_net --model FEGIN --layers 6 --hiddens 64 --batch_size 64 --lr 0.0001 --emb_size 512 --epochs 100 --save_appendix component_net_L6_H64_BS64_LR0.0001_E512 --no_val
-----



STDERR:
  File "main.py", line 370, in <module>
    main()
  File "main.py", line 254, in main
    dataset = dataset_class(
  File "/home/philip/projects/ltspice_examples_code_repo/Circuit-Completion-Using-GNNs/component_classification_with_link_prediction_head/evaluation/FEGIN/kernel/circuit_datasets.py", line 15, in __init__
    self.data, self.slices = torch.load(self.processed_paths[0])
  File "/home/philip/.local/lib/python3.8/site-packages/torch/serialization.py", line 1040, in load
    warnings.warn(
  File "/usr/lib/python3.8/warnings.py", line 109, in _showwarnmsg
    sw(msg.message, msg.category, msg.filename, msg.lineno,
  File "main.py", line 47, in warn_with_traceback
    traceback.print_stack(file=log)
/home/philip/projects/ltspice_examples_code_repo/Circuit-Completion-Using-GNNs/component_classification_with_link_prediction_head/evaluation/FEGIN/kernel/circuit_datasets.py:15: FutureWarning: You are using `torch.load` with `weights_only=False` (the current default value), which uses the default pickle module implicitly. It is possible to construct malicious pickle data which will execute arbitrary code during unpickling (See https://github.com/pytorch/pytorch/blob/main/SECURITY.md#untrusted-models for more details). In a future release, the default value for `weights_only` will be flipped to `True`. This limits the functions that could be executed during unpickling. Arbitrary objects will no longer be allowed to be loaded via this mode unless they are explicitly allowlisted by the user via `torch.serialization.add_safe_globals`. We recommend you start setting `weights_only=True` for any use case where you don't have full control of the loaded file. Please open an issue on GitHub for any issues related to this experimental feature.
  self.data, self.slices = torch.load(self.processed_paths[0])
