STDOUT:
Results will be saved in /home/philip/projects/ltspice_examples_code_repo/Circuit-Completion-Using-GNNs/component_classification_with_link_prediction_head/evaluation/FEGIN/results/model_FEGIN_dataset_ltspice_demos
Command line input: python main.py --data ltspice_demos --representation component_component --model FEGIN --layers 2 --hiddens 64 --batch_size 32 --lr 0.01 --emb_size 512 --epochs 100 --save_appendix component_component_L2_H64_BS32_LR0.01_E512 --no_val
 is saved.
-----
ltspice_demos - FEGIN
Using 2 layers, 64 hidden units, h = 2
Loading component_component representation dataset
ENTERED
Training FEGIN on component_component representation
Train: 1565, Test: 383
##################ITERATION #0 ****************************************
 epoch: 0, train_loss: 1.2430, test_loss: 1.2472, test_f1: 0.3225
 epoch: 1, train_loss: 1.1349, test_loss: 1.2137, test_f1: 0.4441
 epoch: 2, train_loss: 1.0690, test_loss: 1.1445, test_f1: 0.3583
 epoch: 3, train_loss: 1.0223, test_loss: 1.6061, test_f1: 0.3212
 epoch: 4, train_loss: 0.9769, test_loss: 1.0376, test_f1: 0.5790
 epoch: 5, train_loss: 0.9629, test_loss: 1.1104, test_f1: 0.3941
 epoch: 6, train_loss: 0.9339, test_loss: 1.0651, test_f1: 0.5669
 epoch: 7, train_loss: 0.9035, test_loss: 1.4795, test_f1: 0.4371
 epoch: 8, train_loss: 0.9176, test_loss: 0.9872, test_f1: 0.5326
 epoch: 9, train_loss: 0.8970, test_loss: 1.0430, test_f1: 0.4635
 epoch: 10, train_loss: 0.8671, test_loss: 1.3087, test_f1: 0.5143
 epoch: 11, train_loss: 0.8676, test_loss: 1.0500, test_f1: 0.5609
 epoch: 12, train_loss: 0.8564, test_loss: 0.9483, test_f1: 0.5842
 epoch: 13, train_loss: 0.8514, test_loss: 1.0036, test_f1: 0.5595
 epoch: 14, train_loss: 0.8353, test_loss: 0.9783, test_f1: 0.6040
 epoch: 15, train_loss: 0.8185, test_loss: 1.0379, test_f1: 0.5504
 epoch: 16, train_loss: 0.8255, test_loss: 1.0710, test_f1: 0.5425
 epoch: 17, train_loss: 0.8102, test_loss: 1.1001, test_f1: 0.5798
 epoch: 18, train_loss: 0.8110, test_loss: 1.1667, test_f1: 0.5672
 epoch: 19, train_loss: 0.7969, test_loss: 1.2666, test_f1: 0.5202
 epoch: 20, train_loss: 0.8194, test_loss: 1.3568, test_f1: 0.4776
 epoch: 21, train_loss: 0.8022, test_loss: 1.0970, test_f1: 0.5983
 epoch: 22, train_loss: 0.7948, test_loss: 1.2200, test_f1: 0.5228
 epoch: 23, train_loss: 0.8001, test_loss: 1.0550, test_f1: 0.4907
 epoch: 24, train_loss: 0.7698, test_loss: 1.0428, test_f1: 0.5765
 epoch: 25, train_loss: 0.7585, test_loss: 1.1466, test_f1: 0.5303
 epoch: 26, train_loss: 0.7917, test_loss: 1.0519, test_f1: 0.5795
 epoch: 27, train_loss: 0.7848, test_loss: 1.0786, test_f1: 0.5770
 epoch: 28, train_loss: 0.7636, test_loss: 1.3488, test_f1: 0.5851
 epoch: 29, train_loss: 0.7631, test_loss: 1.0337, test_f1: 0.6157
 epoch: 30, train_loss: 0.7541, test_loss: 1.0555, test_f1: 0.5748
 epoch: 31, train_loss: 0.7531, test_loss: 1.5368, test_f1: 0.4618
 epoch: 32, train_loss: 0.7528, test_loss: 1.2729, test_f1: 0.5367
 epoch: 33, train_loss: 0.7570, test_loss: 1.2634, test_f1: 0.4287
 epoch: 34, train_loss: 0.7369, test_loss: 1.3632, test_f1: 0.5519
 epoch: 35, train_loss: 0.7477, test_loss: 1.2665, test_f1: 0.5551
 epoch: 36, train_loss: 0.7439, test_loss: 1.6467, test_f1: 0.5664
 epoch: 37, train_loss: 0.7091, test_loss: 1.1791, test_f1: 0.5414
 epoch: 38, train_loss: 0.7187, test_loss: 1.0568, test_f1: 0.5742
 epoch: 39, train_loss: 0.7340, test_loss: 1.0194, test_f1: 0.5791
 epoch: 40, train_loss: 0.7303, test_loss: 1.2742, test_f1: 0.5833
 epoch: 41, train_loss: 0.6977, test_loss: 1.1936, test_f1: 0.5521
 epoch: 42, train_loss: 0.7159, test_loss: 1.5561, test_f1: 0.5728
 epoch: 43, train_loss: 0.6995, test_loss: 1.0784, test_f1: 0.5832
 epoch: 44, train_loss: 0.7875, test_loss: 1.5533, test_f1: 0.4115
 epoch: 45, train_loss: 0.9095, test_loss: 1.1722, test_f1: 0.5591
 epoch: 46, train_loss: 0.8387, test_loss: 1.0900, test_f1: 0.5468
 epoch: 47, train_loss: 0.7955, test_loss: 1.0471, test_f1: 0.5113
 epoch: 48, train_loss: 0.7728, test_loss: 1.2370, test_f1: 0.5514
 epoch: 49, train_loss: 0.7665, test_loss: 1.1623, test_f1: 0.5875
 epoch: 50, train_loss: 0.7757, test_loss: 1.1889, test_f1: 0.5882
 epoch: 51, train_loss: 0.7216, test_loss: 1.1215, test_f1: 0.5793
 epoch: 52, train_loss: 0.6846, test_loss: 1.2002, test_f1: 0.5605
 epoch: 53, train_loss: 0.7002, test_loss: 1.2040, test_f1: 0.5898
 epoch: 54, train_loss: 0.6910, test_loss: 1.1986, test_f1: 0.5865
 epoch: 55, train_loss: 0.6673, test_loss: 1.2463, test_f1: 0.5673
 epoch: 56, train_loss: 0.6762, test_loss: 1.3262, test_f1: 0.5900
 epoch: 57, train_loss: 0.6546, test_loss: 1.2590, test_f1: 0.5727
 epoch: 58, train_loss: 0.6590, test_loss: 1.3081, test_f1: 0.5642
 epoch: 59, train_loss: 0.6592, test_loss: 1.3641, test_f1: 0.5422
 epoch: 60, train_loss: 0.6590, test_loss: 1.3004, test_f1: 0.5803
 epoch: 61, train_loss: 0.6497, test_loss: 1.3647, test_f1: 0.5599
 epoch: 62, train_loss: 0.6453, test_loss: 1.1769, test_f1: 0.5611
 epoch: 63, train_loss: 0.6358, test_loss: 1.3528, test_f1: 0.5603
 epoch: 64, train_loss: 0.6204, test_loss: 1.3537, test_f1: 0.5722
 epoch: 65, train_loss: 0.5994, test_loss: 1.4420, test_f1: 0.5602
 epoch: 66, train_loss: 0.6034, test_loss: 1.5433, test_f1: 0.5615
 epoch: 67, train_loss: 0.6304, test_loss: 1.5419, test_f1: 0.5270
 epoch: 68, train_loss: 0.6209, test_loss: 1.2331, test_f1: 0.6128
 epoch: 69, train_loss: 0.6283, test_loss: 1.3505, test_f1: 0.5655
 epoch: 70, train_loss: 0.6075, test_loss: 1.4165, test_f1: 0.5540
 epoch: 71, train_loss: 0.6088, test_loss: 1.3163, test_f1: 0.5665
 epoch: 72, train_loss: 0.5632, test_loss: 1.7367, test_f1: 0.5533
 epoch: 73, train_loss: 0.5856, test_loss: 1.7734, test_f1: 0.5290
 epoch: 74, train_loss: 0.6200, test_loss: 1.5901, test_f1: 0.5359
 epoch: 75, train_loss: 0.5770, test_loss: 1.6318, test_f1: 0.5249
 epoch: 76, train_loss: 0.5763, test_loss: 1.5932, test_f1: 0.5450
 epoch: 77, train_loss: 0.5531, test_loss: 1.6146, test_f1: 0.5776
 epoch: 78, train_loss: 0.5794, test_loss: 1.7600, test_f1: 0.5681
 epoch: 79, train_loss: 0.5537, test_loss: 1.9145, test_f1: 0.5262
 epoch: 80, train_loss: 0.5845, test_loss: 1.5609, test_f1: 0.5827
 epoch: 81, train_loss: 0.5666, test_loss: 1.7398, test_f1: 0.5634
 epoch: 82, train_loss: 0.5919, test_loss: 1.5782, test_f1: 0.5637
 epoch: 83, train_loss: 0.5500, test_loss: 1.8245, test_f1: 0.5265
 epoch: 84, train_loss: 0.5587, test_loss: 1.6134, test_f1: 0.5277
 epoch: 85, train_loss: 0.5494, test_loss: 1.6137, test_f1: 0.5737
 epoch: 86, train_loss: 0.5645, test_loss: 1.7041, test_f1: 0.5450
 epoch: 87, train_loss: 0.5612, test_loss: 1.5734, test_f1: 0.5272
 epoch: 88, train_loss: 0.5389, test_loss: 1.5023, test_f1: 0.5371
 epoch: 89, train_loss: 0.5299, test_loss: 1.9106, test_f1: 0.5179
 epoch: 90, train_loss: 0.5286, test_loss: 1.9067, test_f1: 0.5078
 epoch: 91, train_loss: 0.5593, test_loss: 1.7319, test_f1: 0.5026
 epoch: 92, train_loss: 0.5237, test_loss: 1.9186, test_f1: 0.5212
 epoch: 93, train_loss: 0.5458, test_loss: 1.7044, test_f1: 0.5204
 epoch: 94, train_loss: 0.5332, test_loss: 1.6894, test_f1: 0.5071
 epoch: 95, train_loss: 0.5232, test_loss: 1.8442, test_f1: 0.5483
 epoch: 96, train_loss: 0.5090, test_loss: 1.6979, test_f1: 0.5737
 epoch: 97, train_loss: 0.5511, test_loss: 1.6895, test_f1: 0.5350
 epoch: 98, train_loss: 0.5227, test_loss: 1.8035, test_f1: 0.5268
 epoch: 99, train_loss: 0.5389, test_loss: 1.7095, test_f1: 0.5411
##################ITERATION #1 ****************************************
 epoch: 0, train_loss: 1.2295, test_loss: 1.2704, test_f1: 0.3129
 epoch: 1, train_loss: 1.1332, test_loss: 1.2404, test_f1: 0.3780
 epoch: 2, train_loss: 1.0886, test_loss: 1.3100, test_f1: 0.3999
 epoch: 3, train_loss: 1.0341, test_loss: 1.3528, test_f1: 0.4546
 epoch: 4, train_loss: 0.9942, test_loss: 1.0663, test_f1: 0.5170
 epoch: 5, train_loss: 0.9673, test_loss: 1.1033, test_f1: 0.5392
 epoch: 6, train_loss: 0.9307, test_loss: 1.0329, test_f1: 0.5292
 epoch: 7, train_loss: 0.8974, test_loss: 1.0841, test_f1: 0.4136
 epoch: 8, train_loss: 0.8847, test_loss: 1.0571, test_f1: 0.5411
 epoch: 9, train_loss: 0.8843, test_loss: 1.0260, test_f1: 0.5528
 epoch: 10, train_loss: 0.8794, test_loss: 1.0202, test_f1: 0.4419
 epoch: 11, train_loss: 0.8868, test_loss: 1.0298, test_f1: 0.5520
 epoch: 12, train_loss: 0.8725, test_loss: 1.0278, test_f1: 0.5241
 epoch: 13, train_loss: 0.8395, test_loss: 1.1112, test_f1: 0.3933
 epoch: 14, train_loss: 0.8276, test_loss: 1.0621, test_f1: 0.5787
 epoch: 15, train_loss: 0.8566, test_loss: 0.9843, test_f1: 0.6001
 epoch: 16, train_loss: 0.8534, test_loss: 1.0700, test_f1: 0.5501
 epoch: 17, train_loss: 0.8305, test_loss: 1.0865, test_f1: 0.5361
 epoch: 18, train_loss: 0.8359, test_loss: 1.0895, test_f1: 0.4946
 epoch: 19, train_loss: 0.8481, test_loss: 1.0364, test_f1: 0.5706
 epoch: 20, train_loss: 0.8121, test_loss: 1.0360, test_f1: 0.5943
 epoch: 21, train_loss: 0.8224, test_loss: 1.1055, test_f1: 0.5075
 epoch: 22, train_loss: 0.8071, test_loss: 1.1303, test_f1: 0.5351
 epoch: 23, train_loss: 0.8120, test_loss: 1.0652, test_f1: 0.5452
 epoch: 24, train_loss: 0.7881, test_loss: 1.0862, test_f1: 0.5663
 epoch: 25, train_loss: 0.8035, test_loss: 1.1699, test_f1: 0.5763
 epoch: 26, train_loss: 0.8355, test_loss: 1.0223, test_f1: 0.5580
 epoch: 27, train_loss: 0.7922, test_loss: 1.0881, test_f1: 0.5552
 epoch: 28, train_loss: 0.7812, test_loss: 1.3705, test_f1: 0.5141
 epoch: 29, train_loss: 0.7792, test_loss: 1.0271, test_f1: 0.5950
 epoch: 30, train_loss: 0.8021, test_loss: 1.2757, test_f1: 0.5548
 epoch: 31, train_loss: 0.7883, test_loss: 1.0938, test_f1: 0.5668
 epoch: 32, train_loss: 0.7826, test_loss: 1.1630, test_f1: 0.5603
 epoch: 33, train_loss: 0.8021, test_loss: 1.2496, test_f1: 0.5849
 epoch: 34, train_loss: 0.7781, test_loss: 1.0135, test_f1: 0.5740
 epoch: 35, train_loss: 0.7772, test_loss: 1.0932, test_f1: 0.5129
 epoch: 36, train_loss: 0.7687, test_loss: 1.3884, test_f1: 0.4651
 epoch: 37, train_loss: 0.7602, test_loss: 1.1422, test_f1: 0.5159
 epoch: 38, train_loss: 0.7741, test_loss: 1.1816, test_f1: 0.5401
 epoch: 39, train_loss: 0.7550, test_loss: 1.0768, test_f1: 0.5874
 epoch: 40, train_loss: 0.7548, test_loss: 1.0950, test_f1: 0.5491
 epoch: 41, train_loss: 0.7361, test_loss: 1.1493, test_f1: 0.5342
 epoch: 42, train_loss: 0.7442, test_loss: 1.1509, test_f1: 0.5261
 epoch: 43, train_loss: 0.7494, test_loss: 1.0653, test_f1: 0.5920
 epoch: 44, train_loss: 0.7482, test_loss: 1.3970, test_f1: 0.4780
 epoch: 45, train_loss: 0.7240, test_loss: 1.1654, test_f1: 0.5375
 epoch: 46, train_loss: 0.7162, test_loss: 1.5323, test_f1: 0.5822
 epoch: 47, train_loss: 0.7253, test_loss: 1.2147, test_f1: 0.5790
 epoch: 48, train_loss: 0.7169, test_loss: 1.3182, test_f1: 0.5188
 epoch: 49, train_loss: 0.7043, test_loss: 1.7102, test_f1: 0.5284
 epoch: 50, train_loss: 0.6956, test_loss: 1.4850, test_f1: 0.5476
 epoch: 51, train_loss: 0.6730, test_loss: 1.2176, test_f1: 0.5480
 epoch: 52, train_loss: 0.6576, test_loss: 1.3744, test_f1: 0.5588
 epoch: 53, train_loss: 0.6491, test_loss: 1.3100, test_f1: 0.5638
 epoch: 54, train_loss: 0.6401, test_loss: 1.3743, test_f1: 0.5490
 epoch: 55, train_loss: 0.6201, test_loss: 1.3782, test_f1: 0.5570
 epoch: 56, train_loss: 0.6298, test_loss: 1.4538, test_f1: 0.5532
 epoch: 57, train_loss: 0.6198, test_loss: 1.2910, test_f1: 0.5801
 epoch: 58, train_loss: 0.6417, test_loss: 1.3688, test_f1: 0.5445
 epoch: 59, train_loss: 0.6342, test_loss: 1.2669, test_f1: 0.5872
 epoch: 60, train_loss: 0.5907, test_loss: 1.3642, test_f1: 0.5791
 epoch: 61, train_loss: 0.6090, test_loss: 1.6139, test_f1: 0.5645
 epoch: 62, train_loss: 0.6083, test_loss: 1.3816, test_f1: 0.5578
 epoch: 63, train_loss: 0.5904, test_loss: 1.4453, test_f1: 0.5763
 epoch: 64, train_loss: 0.5986, test_loss: 1.8508, test_f1: 0.5030
 epoch: 65, train_loss: 0.5918, test_loss: 1.5280, test_f1: 0.5279
 epoch: 66, train_loss: 0.5974, test_loss: 1.4930, test_f1: 0.5757
 epoch: 67, train_loss: 0.6093, test_loss: 1.4828, test_f1: 0.5645
 epoch: 68, train_loss: 0.5771, test_loss: 1.5354, test_f1: 0.5285
 epoch: 69, train_loss: 0.5770, test_loss: 1.4616, test_f1: 0.5668
 epoch: 70, train_loss: 0.5682, test_loss: 1.5675, test_f1: 0.5822
 epoch: 71, train_loss: 0.5675, test_loss: 1.5335, test_f1: 0.5933
 epoch: 72, train_loss: 0.5542, test_loss: 1.4605, test_f1: 0.5886
 epoch: 73, train_loss: 0.5823, test_loss: 1.6469, test_f1: 0.5476
 epoch: 74, train_loss: 0.5553, test_loss: 1.4116, test_f1: 0.6047
 epoch: 75, train_loss: 0.5671, test_loss: 1.5405, test_f1: 0.5171
 epoch: 76, train_loss: 0.5809, test_loss: 1.8352, test_f1: 0.5668
 epoch: 77, train_loss: 0.5591, test_loss: 1.5698, test_f1: 0.5864
 epoch: 78, train_loss: 0.5553, test_loss: 1.6400, test_f1: 0.5512
 epoch: 79, train_loss: 0.5812, test_loss: 1.4455, test_f1: 0.5997
 epoch: 80, train_loss: 0.5677, test_loss: 1.5884, test_f1: 0.5864
 epoch: 81, train_loss: 0.5353, test_loss: 1.4979, test_f1: 0.5670
 epoch: 82, train_loss: 0.5372, test_loss: 1.6648, test_f1: 0.5329
 epoch: 83, train_loss: 0.5470, test_loss: 2.0299, test_f1: 0.5467
 epoch: 84, train_loss: 0.5439, test_loss: 1.6554, test_f1: 0.5726
 epoch: 85, train_loss: 0.5433, test_loss: 1.4443, test_f1: 0.5562
 epoch: 86, train_loss: 0.5441, test_loss: 1.6889, test_f1: 0.5558
 epoch: 87, train_loss: 0.5089, test_loss: 1.6677, test_f1: 0.5636
 epoch: 88, train_loss: 0.5411, test_loss: 1.7049, test_f1: 0.5292
 epoch: 89, train_loss: 0.5143, test_loss: 1.6760, test_f1: 0.5530
 epoch: 90, train_loss: 0.5143, test_loss: 1.6599, test_f1: 0.5745
 epoch: 91, train_loss: 0.4798, test_loss: 1.7303, test_f1: 0.5737
 epoch: 92, train_loss: 0.5032, test_loss: 1.7722, test_f1: 0.5861
 epoch: 93, train_loss: 0.5106, test_loss: 2.2534, test_f1: 0.5364
 epoch: 94, train_loss: 0.4918, test_loss: 1.8728, test_f1: 0.5761
 epoch: 95, train_loss: 0.4946, test_loss: 2.2091, test_f1: 0.5486
 epoch: 96, train_loss: 0.5061, test_loss: 1.9222, test_f1: 0.5357
 epoch: 97, train_loss: 0.5060, test_loss: 1.9816, test_f1: 0.5347
 epoch: 98, train_loss: 0.4834, test_loss: 1.9883, test_f1: 0.5503
 epoch: 99, train_loss: 0.5163, test_loss: 2.0628, test_f1: 0.5637
##################ITERATION #2 ****************************************
 epoch: 0, train_loss: 1.2364, test_loss: 1.2827, test_f1: 0.3334
 epoch: 1, train_loss: 1.0882, test_loss: 1.1801, test_f1: 0.3837
 epoch: 2, train_loss: 1.0609, test_loss: 1.2068, test_f1: 0.4604
 epoch: 3, train_loss: 1.0017, test_loss: 1.0937, test_f1: 0.5507
 epoch: 4, train_loss: 0.9431, test_loss: 1.3645, test_f1: 0.4316
 epoch: 5, train_loss: 0.9411, test_loss: 1.1879, test_f1: 0.4562
 epoch: 6, train_loss: 0.9100, test_loss: 1.1016, test_f1: 0.5280
 epoch: 7, train_loss: 0.9011, test_loss: 1.0886, test_f1: 0.5411
 epoch: 8, train_loss: 0.8745, test_loss: 1.0048, test_f1: 0.5614
 epoch: 9, train_loss: 0.8632, test_loss: 0.9877, test_f1: 0.5795
 epoch: 10, train_loss: 0.8790, test_loss: 1.0277, test_f1: 0.5399
 epoch: 11, train_loss: 0.8458, test_loss: 1.0707, test_f1: 0.4609
 epoch: 12, train_loss: 0.8231, test_loss: 1.5113, test_f1: 0.3397
 epoch: 13, train_loss: 0.8648, test_loss: 1.1680, test_f1: 0.5166
 epoch: 14, train_loss: 0.8317, test_loss: 1.1081, test_f1: 0.5188
 epoch: 15, train_loss: 0.8165, test_loss: 1.1053, test_f1: 0.5678
 epoch: 16, train_loss: 0.8222, test_loss: 1.1045, test_f1: 0.5315
 epoch: 17, train_loss: 0.8229, test_loss: 1.1622, test_f1: 0.4497
 epoch: 18, train_loss: 0.8212, test_loss: 1.0898, test_f1: 0.5172
 epoch: 19, train_loss: 0.7950, test_loss: 1.1251, test_f1: 0.5212
 epoch: 20, train_loss: 0.7721, test_loss: 1.0495, test_f1: 0.5802
 epoch: 21, train_loss: 0.7920, test_loss: 1.1257, test_f1: 0.5829
 epoch: 22, train_loss: 0.7673, test_loss: 1.2091, test_f1: 0.5379
 epoch: 23, train_loss: 0.7744, test_loss: 1.1958, test_f1: 0.5152
 epoch: 24, train_loss: 0.7789, test_loss: 1.7076, test_f1: 0.4286
 epoch: 25, train_loss: 0.7929, test_loss: 1.0978, test_f1: 0.5756
 epoch: 26, train_loss: 0.7839, test_loss: 1.0747, test_f1: 0.5941
 epoch: 27, train_loss: 0.7570, test_loss: 1.2419, test_f1: 0.6312
 epoch: 28, train_loss: 0.7419, test_loss: 1.1266, test_f1: 0.5516
 epoch: 29, train_loss: 0.7379, test_loss: 1.1213, test_f1: 0.5545
 epoch: 30, train_loss: 0.7369, test_loss: 1.0399, test_f1: 0.6166
 epoch: 31, train_loss: 0.7338, test_loss: 1.1673, test_f1: 0.5861
 epoch: 32, train_loss: 0.6926, test_loss: 1.2858, test_f1: 0.5302
 epoch: 33, train_loss: 0.7413, test_loss: 1.3692, test_f1: 0.5185
 epoch: 34, train_loss: 0.7170, test_loss: 1.0306, test_f1: 0.5717
 epoch: 35, train_loss: 0.7148, test_loss: 1.8130, test_f1: 0.4673
 epoch: 36, train_loss: 0.7177, test_loss: 1.1672, test_f1: 0.5411
 epoch: 37, train_loss: 0.7084, test_loss: 1.1738, test_f1: 0.6136
 epoch: 38, train_loss: 0.7575, test_loss: 1.3116, test_f1: 0.5827
 epoch: 39, train_loss: 0.7330, test_loss: 1.1256, test_f1: 0.5227
 epoch: 40, train_loss: 0.6938, test_loss: 1.4380, test_f1: 0.5176
 epoch: 41, train_loss: 0.7036, test_loss: 1.1298, test_f1: 0.5827
 epoch: 42, train_loss: 0.7345, test_loss: 1.1029, test_f1: 0.5713
 epoch: 43, train_loss: 0.7037, test_loss: 1.0848, test_f1: 0.5875
 epoch: 44, train_loss: 0.6860, test_loss: 1.2058, test_f1: 0.5603
 epoch: 45, train_loss: 0.6596, test_loss: 1.1581, test_f1: 0.5971
 epoch: 46, train_loss: 0.6690, test_loss: 1.1289, test_f1: 0.5609
 epoch: 47, train_loss: 0.6742, test_loss: 1.1624, test_f1: 0.6348
 epoch: 48, train_loss: 0.6985, test_loss: 1.3628, test_f1: 0.5403
 epoch: 49, train_loss: 0.7030, test_loss: 1.2549, test_f1: 0.5432
 epoch: 50, train_loss: 0.6730, test_loss: 1.1027, test_f1: 0.5901
 epoch: 51, train_loss: 0.6164, test_loss: 1.1916, test_f1: 0.6147
 epoch: 52, train_loss: 0.6004, test_loss: 1.2478, test_f1: 0.5755
 epoch: 53, train_loss: 0.5863, test_loss: 1.3142, test_f1: 0.5884
 epoch: 54, train_loss: 0.5623, test_loss: 1.3736, test_f1: 0.5863
 epoch: 55, train_loss: 0.5660, test_loss: 1.5077, test_f1: 0.6072
 epoch: 56, train_loss: 0.5796, test_loss: 1.4945, test_f1: 0.5817
 epoch: 57, train_loss: 0.5636, test_loss: 1.5089, test_f1: 0.5774
 epoch: 58, train_loss: 0.5672, test_loss: 1.2291, test_f1: 0.5884
 epoch: 59, train_loss: 0.5744, test_loss: 1.3682, test_f1: 0.5419
 epoch: 60, train_loss: 0.5400, test_loss: 1.3290, test_f1: 0.6120
 epoch: 61, train_loss: 0.5332, test_loss: 1.4591, test_f1: 0.5711
 epoch: 62, train_loss: 0.5369, test_loss: 1.1879, test_f1: 0.5947
 epoch: 63, train_loss: 0.5267, test_loss: 1.5476, test_f1: 0.6170
 epoch: 64, train_loss: 0.5635, test_loss: 1.5517, test_f1: 0.5880
 epoch: 65, train_loss: 0.5097, test_loss: 1.6041, test_f1: 0.6047
 epoch: 66, train_loss: 0.5040, test_loss: 1.5489, test_f1: 0.6161
 epoch: 67, train_loss: 0.5274, test_loss: 1.3939, test_f1: 0.6048
 epoch: 68, train_loss: 0.5076, test_loss: 1.4721, test_f1: 0.6043
 epoch: 69, train_loss: 0.5098, test_loss: 1.4707, test_f1: 0.6303
 epoch: 70, train_loss: 0.5006, test_loss: 1.7445, test_f1: 0.5350
 epoch: 71, train_loss: 0.5186, test_loss: 1.9002, test_f1: 0.5520
 epoch: 72, train_loss: 0.5131, test_loss: 1.5623, test_f1: 0.6063
 epoch: 73, train_loss: 0.5220, test_loss: 1.4589, test_f1: 0.5963
 epoch: 74, train_loss: 0.5194, test_loss: 1.3883, test_f1: 0.6116
 epoch: 75, train_loss: 0.4893, test_loss: 1.5077, test_f1: 0.5963
 epoch: 76, train_loss: 0.4867, test_loss: 1.7023, test_f1: 0.5969
 epoch: 77, train_loss: 0.4870, test_loss: 1.5000, test_f1: 0.5900
 epoch: 78, train_loss: 0.4870, test_loss: 1.5788, test_f1: 0.6198
 epoch: 79, train_loss: 0.5236, test_loss: 1.3790, test_f1: 0.6057
 epoch: 80, train_loss: 0.4855, test_loss: 1.5497, test_f1: 0.6312
 epoch: 81, train_loss: 0.4438, test_loss: 1.4247, test_f1: 0.6190
 epoch: 82, train_loss: 0.4889, test_loss: 1.7787, test_f1: 0.5856
 epoch: 83, train_loss: 0.4672, test_loss: 1.4466, test_f1: 0.6207
 epoch: 84, train_loss: 0.4914, test_loss: 1.5361, test_f1: 0.6285
 epoch: 85, train_loss: 0.4495, test_loss: 1.7280, test_f1: 0.6306
 epoch: 86, train_loss: 0.4226, test_loss: 1.4920, test_f1: 0.6382
 epoch: 87, train_loss: 0.4878, test_loss: 1.7757, test_f1: 0.5895
 epoch: 88, train_loss: 0.4465, test_loss: 1.5004, test_f1: 0.6404
 epoch: 89, train_loss: 0.4643, test_loss: 1.4398, test_f1: 0.6187
 epoch: 90, train_loss: 0.4746, test_loss: 1.5117, test_f1: 0.6195
 epoch: 91, train_loss: 0.4308, test_loss: 1.5603, test_f1: 0.6422
 epoch: 92, train_loss: 0.4253, test_loss: 1.5090, test_f1: 0.6629
 epoch: 93, train_loss: 0.4178, test_loss: 1.4690, test_f1: 0.6195
 epoch: 94, train_loss: 0.4415, test_loss: 1.4289, test_f1: 0.6199
 epoch: 95, train_loss: 0.4630, test_loss: 1.5502, test_f1: 0.6420
 epoch: 96, train_loss: 0.4440, test_loss: 1.5249, test_f1: 0.6231
 epoch: 97, train_loss: 0.4059, test_loss: 1.5686, test_f1: 0.6303
 epoch: 98, train_loss: 0.4295, test_loss: 1.4933, test_f1: 0.6269
 epoch: 99, train_loss: 0.4241, test_loss: 1.8347, test_f1: 0.5639
##################ITERATION #3 ****************************************
 epoch: 0, train_loss: 1.2102, test_loss: 1.1833, test_f1: 0.3408
 epoch: 1, train_loss: 1.0696, test_loss: 1.1738, test_f1: 0.5040
 epoch: 2, train_loss: 1.0142, test_loss: 1.1322, test_f1: 0.4397
 epoch: 3, train_loss: 0.9769, test_loss: 1.0651, test_f1: 0.5140
 epoch: 4, train_loss: 0.9249, test_loss: 1.3148, test_f1: 0.3894
 epoch: 5, train_loss: 0.9072, test_loss: 1.2981, test_f1: 0.3968
 epoch: 6, train_loss: 0.8882, test_loss: 1.0394, test_f1: 0.5191
 epoch: 7, train_loss: 0.8591, test_loss: 1.3021, test_f1: 0.4269
 epoch: 8, train_loss: 0.8772, test_loss: 0.9996, test_f1: 0.5497
 epoch: 9, train_loss: 0.8499, test_loss: 1.1173, test_f1: 0.5329
 epoch: 10, train_loss: 0.8386, test_loss: 0.9910, test_f1: 0.6047
 epoch: 11, train_loss: 0.8477, test_loss: 0.9890, test_f1: 0.5843
 epoch: 12, train_loss: 0.8276, test_loss: 1.0513, test_f1: 0.5445
 epoch: 13, train_loss: 0.8261, test_loss: 1.0766, test_f1: 0.5848
 epoch: 14, train_loss: 0.8232, test_loss: 1.2432, test_f1: 0.4834
 epoch: 15, train_loss: 0.8489, test_loss: 1.2549, test_f1: 0.5052
 epoch: 16, train_loss: 0.8042, test_loss: 0.9809, test_f1: 0.5786
 epoch: 17, train_loss: 0.8307, test_loss: 1.0854, test_f1: 0.5672
 epoch: 18, train_loss: 0.8081, test_loss: 0.9864, test_f1: 0.5070
 epoch: 19, train_loss: 0.8064, test_loss: 1.0736, test_f1: 0.5164
 epoch: 20, train_loss: 0.7916, test_loss: 0.9986, test_f1: 0.5843
 epoch: 21, train_loss: 0.7894, test_loss: 0.9659, test_f1: 0.6027
 epoch: 22, train_loss: 0.7937, test_loss: 0.9367, test_f1: 0.6333
 epoch: 23, train_loss: 0.7794, test_loss: 1.3508, test_f1: 0.4733
 epoch: 24, train_loss: 0.7944, test_loss: 1.0137, test_f1: 0.5691
 epoch: 25, train_loss: 0.7678, test_loss: 1.0893, test_f1: 0.5616
 epoch: 26, train_loss: 0.7569, test_loss: 1.1344, test_f1: 0.6264
 epoch: 27, train_loss: 0.7703, test_loss: 0.9675, test_f1: 0.5592
 epoch: 28, train_loss: 0.7612, test_loss: 1.0848, test_f1: 0.5505
 epoch: 29, train_loss: 0.7460, test_loss: 1.0806, test_f1: 0.5288
 epoch: 30, train_loss: 0.7489, test_loss: 1.0168, test_f1: 0.5502
 epoch: 31, train_loss: 0.7820, test_loss: 1.8400, test_f1: 0.4245
 epoch: 32, train_loss: 0.7739, test_loss: 1.1688, test_f1: 0.5701
 epoch: 33, train_loss: 0.7226, test_loss: 1.8347, test_f1: 0.5351
 epoch: 34, train_loss: 0.7385, test_loss: 1.0030, test_f1: 0.5646
 epoch: 35, train_loss: 0.7372, test_loss: 1.1135, test_f1: 0.4942
 epoch: 36, train_loss: 0.7840, test_loss: 1.1630, test_f1: 0.5040
 epoch: 37, train_loss: 0.7567, test_loss: 1.1376, test_f1: 0.5270
 epoch: 38, train_loss: 0.7284, test_loss: 1.1535, test_f1: 0.5781
 epoch: 39, train_loss: 0.7469, test_loss: 1.5473, test_f1: 0.6150
 epoch: 40, train_loss: 0.7379, test_loss: 1.0450, test_f1: 0.5776
 epoch: 41, train_loss: 0.7143, test_loss: 1.0137, test_f1: 0.5997
 epoch: 42, train_loss: 0.7145, test_loss: 1.1745, test_f1: 0.5758
 epoch: 43, train_loss: 0.7069, test_loss: 1.0430, test_f1: 0.5865
 epoch: 44, train_loss: 0.6863, test_loss: 1.0801, test_f1: 0.5944
 epoch: 45, train_loss: 0.7160, test_loss: 1.0730, test_f1: 0.5619
 epoch: 46, train_loss: 0.7350, test_loss: 1.0215, test_f1: 0.5870
 epoch: 47, train_loss: 0.6986, test_loss: 1.1217, test_f1: 0.5814
 epoch: 48, train_loss: 0.7030, test_loss: 1.0349, test_f1: 0.6197
 epoch: 49, train_loss: 0.7004, test_loss: 1.0506, test_f1: 0.5746
 epoch: 50, train_loss: 0.7177, test_loss: 1.1524, test_f1: 0.5899
 epoch: 51, train_loss: 0.6598, test_loss: 1.1281, test_f1: 0.5892
 epoch: 52, train_loss: 0.6385, test_loss: 1.1920, test_f1: 0.5967
 epoch: 53, train_loss: 0.6328, test_loss: 1.2939, test_f1: 0.6065
 epoch: 54, train_loss: 0.6215, test_loss: 1.3924, test_f1: 0.5953
 epoch: 55, train_loss: 0.6069, test_loss: 1.3600, test_f1: 0.5868
 epoch: 56, train_loss: 0.6057, test_loss: 1.7226, test_f1: 0.5060
 epoch: 57, train_loss: 0.5930, test_loss: 1.2389, test_f1: 0.6254
 epoch: 58, train_loss: 0.6100, test_loss: 1.4608, test_f1: 0.5831
 epoch: 59, train_loss: 0.5633, test_loss: 1.3474, test_f1: 0.6221
 epoch: 60, train_loss: 0.6033, test_loss: 1.3644, test_f1: 0.5903
 epoch: 61, train_loss: 0.5673, test_loss: 1.7262, test_f1: 0.5713
 epoch: 62, train_loss: 0.5736, test_loss: 1.5896, test_f1: 0.5767
 epoch: 63, train_loss: 0.5700, test_loss: 1.5653, test_f1: 0.5641
 epoch: 64, train_loss: 0.5541, test_loss: 1.5800, test_f1: 0.5852
 epoch: 65, train_loss: 0.5621, test_loss: 1.6652, test_f1: 0.6156
 epoch: 66, train_loss: 0.5873, test_loss: 1.4617, test_f1: 0.5291
 epoch: 67, train_loss: 0.5859, test_loss: 1.2267, test_f1: 0.5692
 epoch: 68, train_loss: 0.5466, test_loss: 1.3053, test_f1: 0.6063
 epoch: 69, train_loss: 0.5457, test_loss: 1.7368, test_f1: 0.5532
 epoch: 70, train_loss: 0.5692, test_loss: 1.6220, test_f1: 0.5748
 epoch: 71, train_loss: 0.5471, test_loss: 1.4324, test_f1: 0.5978
 epoch: 72, train_loss: 0.5418, test_loss: 1.6340, test_f1: 0.5532
 epoch: 73, train_loss: 0.5366, test_loss: 1.4066, test_f1: 0.6712
 epoch: 74, train_loss: 0.5151, test_loss: 1.3964, test_f1: 0.6157
 epoch: 75, train_loss: 0.5275, test_loss: 1.5542, test_f1: 0.5921
 epoch: 76, train_loss: 0.4992, test_loss: 1.5461, test_f1: 0.6082
 epoch: 77, train_loss: 0.5224, test_loss: 1.6837, test_f1: 0.5852
 epoch: 78, train_loss: 0.5027, test_loss: 1.8324, test_f1: 0.5897
 epoch: 79, train_loss: 0.5108, test_loss: 1.8332, test_f1: 0.6331
 epoch: 80, train_loss: 0.5047, test_loss: 1.4915, test_f1: 0.5940
 epoch: 81, train_loss: 0.5296, test_loss: 1.8572, test_f1: 0.5486
 epoch: 82, train_loss: 0.4899, test_loss: 1.6071, test_f1: 0.5922
 epoch: 83, train_loss: 0.5423, test_loss: 1.2630, test_f1: 0.6649
 epoch: 84, train_loss: 0.5097, test_loss: 1.4059, test_f1: 0.6236
 epoch: 85, train_loss: 0.4931, test_loss: 1.6270, test_f1: 0.5499
 epoch: 86, train_loss: 0.5046, test_loss: 1.6429, test_f1: 0.5745
 epoch: 87, train_loss: 0.4733, test_loss: 1.5264, test_f1: 0.6393
 epoch: 88, train_loss: 0.4854, test_loss: 1.9161, test_f1: 0.6086
 epoch: 89, train_loss: 0.5085, test_loss: 1.6824, test_f1: 0.5775
 epoch: 90, train_loss: 0.4691, test_loss: 1.5433, test_f1: 0.5851
 epoch: 91, train_loss: 0.4692, test_loss: 1.5173, test_f1: 0.6086
 epoch: 92, train_loss: 0.4635, test_loss: 2.0423, test_f1: 0.5946
 epoch: 93, train_loss: 0.4520, test_loss: 1.6003, test_f1: 0.6327
 epoch: 94, train_loss: 0.4581, test_loss: 1.6959, test_f1: 0.6041
 epoch: 95, train_loss: 0.4551, test_loss: 1.9659, test_f1: 0.5857
 epoch: 96, train_loss: 0.4547, test_loss: 1.8198, test_f1: 0.6195
 epoch: 97, train_loss: 0.4593, test_loss: 1.8410, test_f1: 0.5771
 epoch: 98, train_loss: 0.4270, test_loss: 2.1147, test_f1: 0.5705
 epoch: 99, train_loss: 0.4501, test_loss: 2.1380, test_f1: 0.5680
##################ITERATION #4 ****************************************
 epoch: 0, train_loss: 1.2786, test_loss: 1.2612, test_f1: 0.3476
 epoch: 1, train_loss: 1.1331, test_loss: 1.1900, test_f1: 0.4087
 epoch: 2, train_loss: 1.0779, test_loss: 1.2492, test_f1: 0.3872
 epoch: 3, train_loss: 0.9983, test_loss: 1.0259, test_f1: 0.5802
 epoch: 4, train_loss: 0.9962, test_loss: 1.3163, test_f1: 0.4101
 epoch: 5, train_loss: 0.9511, test_loss: 1.0634, test_f1: 0.5091
 epoch: 6, train_loss: 0.9124, test_loss: 0.9850, test_f1: 0.5731
 epoch: 7, train_loss: 0.8937, test_loss: 1.0522, test_f1: 0.4812
 epoch: 8, train_loss: 0.9211, test_loss: 0.9871, test_f1: 0.5839
 epoch: 9, train_loss: 0.8727, test_loss: 0.9936, test_f1: 0.5361
 epoch: 10, train_loss: 0.8456, test_loss: 0.9541, test_f1: 0.5763
 epoch: 11, train_loss: 0.8541, test_loss: 1.0626, test_f1: 0.5461
 epoch: 12, train_loss: 0.8479, test_loss: 0.9987, test_f1: 0.5743
 epoch: 13, train_loss: 0.8560, test_loss: 1.0451, test_f1: 0.5774
 epoch: 14, train_loss: 0.8400, test_loss: 0.9998, test_f1: 0.5720
 epoch: 15, train_loss: 0.8342, test_loss: 1.0017, test_f1: 0.5906
 epoch: 16, train_loss: 0.8423, test_loss: 1.0370, test_f1: 0.5307
 epoch: 17, train_loss: 0.8306, test_loss: 0.9756, test_f1: 0.5766
 epoch: 18, train_loss: 0.8179, test_loss: 0.9779, test_f1: 0.5890
 epoch: 19, train_loss: 0.8308, test_loss: 0.9360, test_f1: 0.6428
 epoch: 20, train_loss: 0.8227, test_loss: 1.0250, test_f1: 0.5698
 epoch: 21, train_loss: 0.8283, test_loss: 1.0493, test_f1: 0.6077
 epoch: 22, train_loss: 0.8070, test_loss: 1.0052, test_f1: 0.5835
 epoch: 23, train_loss: 0.8149, test_loss: 0.9790, test_f1: 0.5537
 epoch: 24, train_loss: 0.8183, test_loss: 0.9885, test_f1: 0.6253
 epoch: 25, train_loss: 0.7940, test_loss: 1.0113, test_f1: 0.5973
 epoch: 26, train_loss: 0.7757, test_loss: 1.1277, test_f1: 0.5284
 epoch: 27, train_loss: 0.7996, test_loss: 1.0199, test_f1: 0.5756
 epoch: 28, train_loss: 0.7650, test_loss: 1.0068, test_f1: 0.5873
 epoch: 29, train_loss: 0.7886, test_loss: 0.9791, test_f1: 0.6026
 epoch: 30, train_loss: 0.7702, test_loss: 1.0253, test_f1: 0.5981
 epoch: 31, train_loss: 0.7583, test_loss: 1.1046, test_f1: 0.5277
 epoch: 32, train_loss: 0.7533, test_loss: 0.9930, test_f1: 0.5357
 epoch: 33, train_loss: 0.7766, test_loss: 1.0599, test_f1: 0.5933
 epoch: 34, train_loss: 0.7363, test_loss: 1.0101, test_f1: 0.5904
 epoch: 35, train_loss: 0.7497, test_loss: 0.9475, test_f1: 0.5932
 epoch: 36, train_loss: 0.7636, test_loss: 1.0273, test_f1: 0.5823
 epoch: 37, train_loss: 0.7531, test_loss: 0.9977, test_f1: 0.6032
 epoch: 38, train_loss: 0.7562, test_loss: 1.0258, test_f1: 0.6096
 epoch: 39, train_loss: 0.7299, test_loss: 1.0227, test_f1: 0.5894
 epoch: 40, train_loss: 0.7224, test_loss: 0.9673, test_f1: 0.6121
 epoch: 41, train_loss: 0.7879, test_loss: 1.0077, test_f1: 0.6125
 epoch: 42, train_loss: 0.7419, test_loss: 1.0562, test_f1: 0.5902
 epoch: 43, train_loss: 0.7427, test_loss: 1.1294, test_f1: 0.5942
 epoch: 44, train_loss: 0.6826, test_loss: 1.3091, test_f1: 0.5684
 epoch: 45, train_loss: 0.7000, test_loss: 1.0175, test_f1: 0.5697
 epoch: 46, train_loss: 0.7186, test_loss: 0.9821, test_f1: 0.6041
 epoch: 47, train_loss: 0.7133, test_loss: 1.2053, test_f1: 0.5464
 epoch: 48, train_loss: 0.6699, test_loss: 1.2030, test_f1: 0.5699
 epoch: 49, train_loss: 0.6785, test_loss: 1.1524, test_f1: 0.5168
 epoch: 50, train_loss: 0.7288, test_loss: 1.1805, test_f1: 0.5538
 epoch: 51, train_loss: 0.6672, test_loss: 1.1555, test_f1: 0.6238
 epoch: 52, train_loss: 0.6320, test_loss: 1.1494, test_f1: 0.6118
 epoch: 53, train_loss: 0.6265, test_loss: 1.2914, test_f1: 0.6067
 epoch: 54, train_loss: 0.6362, test_loss: 1.2221, test_f1: 0.6295
 epoch: 55, train_loss: 0.6210, test_loss: 1.1894, test_f1: 0.5908
 epoch: 56, train_loss: 0.5956, test_loss: 1.3185, test_f1: 0.5954
 epoch: 57, train_loss: 0.6117, test_loss: 1.3832, test_f1: 0.5932
 epoch: 58, train_loss: 0.5831, test_loss: 1.3436, test_f1: 0.5874
 epoch: 59, train_loss: 0.5966, test_loss: 1.3728, test_f1: 0.5517
 epoch: 60, train_loss: 0.5948, test_loss: 1.3578, test_f1: 0.6256
 epoch: 61, train_loss: 0.5900, test_loss: 1.5401, test_f1: 0.6002
 epoch: 62, train_loss: 0.6103, test_loss: 1.3459, test_f1: 0.6125
 epoch: 63, train_loss: 0.5873, test_loss: 1.5163, test_f1: 0.5882
 epoch: 64, train_loss: 0.5744, test_loss: 1.3218, test_f1: 0.6031
 epoch: 65, train_loss: 0.5685, test_loss: 1.2725, test_f1: 0.5714
 epoch: 66, train_loss: 0.5704, test_loss: 1.3210, test_f1: 0.5704
 epoch: 67, train_loss: 0.5703, test_loss: 1.4578, test_f1: 0.5148
 epoch: 68, train_loss: 0.5658, test_loss: 1.4592, test_f1: 0.5391
 epoch: 69, train_loss: 0.5338, test_loss: 1.5737, test_f1: 0.5837
 epoch: 70, train_loss: 0.5404, test_loss: 1.3489, test_f1: 0.6312
 epoch: 71, train_loss: 0.5421, test_loss: 1.5531, test_f1: 0.5890
 epoch: 72, train_loss: 0.5358, test_loss: 1.5174, test_f1: 0.5986
 epoch: 73, train_loss: 0.5150, test_loss: 1.5915, test_f1: 0.6034
 epoch: 74, train_loss: 0.5285, test_loss: 1.5770, test_f1: 0.6418
 epoch: 75, train_loss: 0.5186, test_loss: 1.4294, test_f1: 0.5496
 epoch: 76, train_loss: 0.5130, test_loss: 1.3948, test_f1: 0.6215
 epoch: 77, train_loss: 0.5231, test_loss: 1.5986, test_f1: 0.5742
 epoch: 78, train_loss: 0.5112, test_loss: 1.5561, test_f1: 0.6037
 epoch: 79, train_loss: 0.5286, test_loss: 1.5848, test_f1: 0.5559
 epoch: 80, train_loss: 0.5169, test_loss: 1.6646, test_f1: 0.5798
 epoch: 81, train_loss: 0.4934, test_loss: 1.6376, test_f1: 0.5625
 epoch: 82, train_loss: 0.4980, test_loss: 1.4742, test_f1: 0.5936
 epoch: 83, train_loss: 0.4920, test_loss: 1.5472, test_f1: 0.5602
 epoch: 84, train_loss: 0.4954, test_loss: 1.6767, test_f1: 0.5533
 epoch: 85, train_loss: 0.4962, test_loss: 1.6065, test_f1: 0.6195
 epoch: 86, train_loss: 0.4941, test_loss: 1.7262, test_f1: 0.5889
 epoch: 87, train_loss: 0.4773, test_loss: 1.6597, test_f1: 0.5817
 epoch: 88, train_loss: 0.4760, test_loss: 1.6626, test_f1: 0.5672
 epoch: 89, train_loss: 0.4563, test_loss: 1.7547, test_f1: 0.6225
 epoch: 90, train_loss: 0.4880, test_loss: 1.7439, test_f1: 0.5852
 epoch: 91, train_loss: 0.5130, test_loss: 1.4935, test_f1: 0.6119
 epoch: 92, train_loss: 0.4612, test_loss: 1.7115, test_f1: 0.6413
 epoch: 93, train_loss: 0.4836, test_loss: 1.5912, test_f1: 0.5726
 epoch: 94, train_loss: 0.4677, test_loss: 1.7428, test_f1: 0.5779
 epoch: 95, train_loss: 0.4728, test_loss: 1.7827, test_f1: 0.6212
 epoch: 96, train_loss: 0.4624, test_loss: 1.6137, test_f1: 0.5368
 epoch: 97, train_loss: 0.4730, test_loss: 1.6616, test_f1: 0.5807
 epoch: 98, train_loss: 0.4618, test_loss: 1.6225, test_f1: 0.6011
 epoch: 99, train_loss: 0.4191, test_loss: 1.7631, test_f1: 0.5995
##################ITERATION #5 ****************************************
 epoch: 0, train_loss: 1.2769, test_loss: 1.3608, test_f1: 0.2959
 epoch: 1, train_loss: 1.0831, test_loss: 1.3692, test_f1: 0.3110
 epoch: 2, train_loss: 0.9980, test_loss: 1.3588, test_f1: 0.3157
 epoch: 3, train_loss: 0.9606, test_loss: 1.1281, test_f1: 0.5280
 epoch: 4, train_loss: 0.9559, test_loss: 1.2188, test_f1: 0.3210
 epoch: 5, train_loss: 0.9312, test_loss: 1.0721, test_f1: 0.4783
 epoch: 6, train_loss: 0.9191, test_loss: 1.2316, test_f1: 0.3723
 epoch: 7, train_loss: 0.8924, test_loss: 0.9804, test_f1: 0.4831
 epoch: 8, train_loss: 0.8886, test_loss: 1.0806, test_f1: 0.5310
 epoch: 9, train_loss: 0.8753, test_loss: 1.1485, test_f1: 0.4784
 epoch: 10, train_loss: 0.8744, test_loss: 1.2135, test_f1: 0.4457
 epoch: 11, train_loss: 0.8920, test_loss: 1.2866, test_f1: 0.4676
 epoch: 12, train_loss: 0.9352, test_loss: 1.0646, test_f1: 0.4557
 epoch: 13, train_loss: 0.8742, test_loss: 1.0431, test_f1: 0.5802
 epoch: 14, train_loss: 0.8538, test_loss: 0.9614, test_f1: 0.5689
 epoch: 15, train_loss: 0.8259, test_loss: 1.2462, test_f1: 0.4791
 epoch: 16, train_loss: 0.8720, test_loss: 1.0097, test_f1: 0.5437
 epoch: 17, train_loss: 0.8404, test_loss: 1.1220, test_f1: 0.4737
 epoch: 18, train_loss: 0.8335, test_loss: 1.0757, test_f1: 0.5067
 epoch: 19, train_loss: 0.8145, test_loss: 1.0357, test_f1: 0.5016
 epoch: 20, train_loss: 0.8248, test_loss: 1.1013, test_f1: 0.5574
 epoch: 21, train_loss: 0.8331, test_loss: 1.8400, test_f1: 0.3341
 epoch: 22, train_loss: 0.9146, test_loss: 1.0795, test_f1: 0.5403
 epoch: 23, train_loss: 0.8928, test_loss: 1.1819, test_f1: 0.4767
 epoch: 24, train_loss: 0.8600, test_loss: 1.0421, test_f1: 0.5484
 epoch: 25, train_loss: 0.8513, test_loss: 1.0928, test_f1: 0.5291
 epoch: 26, train_loss: 0.8284, test_loss: 1.1942, test_f1: 0.5478
 epoch: 27, train_loss: 0.8402, test_loss: 1.3477, test_f1: 0.4556
 epoch: 28, train_loss: 0.8299, test_loss: 1.1183, test_f1: 0.5734
 epoch: 29, train_loss: 0.8232, test_loss: 1.0740, test_f1: 0.5230
 epoch: 30, train_loss: 0.7944, test_loss: 1.0590, test_f1: 0.5087
 epoch: 31, train_loss: 0.8196, test_loss: 1.0197, test_f1: 0.5441
 epoch: 32, train_loss: 0.8053, test_loss: 1.0911, test_f1: 0.5793
 epoch: 33, train_loss: 0.7917, test_loss: 1.0755, test_f1: 0.5046
 epoch: 34, train_loss: 0.8019, test_loss: 1.0312, test_f1: 0.5793
 epoch: 35, train_loss: 0.8001, test_loss: 1.6059, test_f1: 0.5159
 epoch: 36, train_loss: 0.7828, test_loss: 1.0246, test_f1: 0.6282
 epoch: 37, train_loss: 0.7804, test_loss: 1.0611, test_f1: 0.6051
 epoch: 38, train_loss: 0.8052, test_loss: 1.0967, test_f1: 0.6235
 epoch: 39, train_loss: 0.7730, test_loss: 1.2992, test_f1: 0.6232
 epoch: 40, train_loss: 0.7567, test_loss: 1.2121, test_f1: 0.5440
 epoch: 41, train_loss: 0.7462, test_loss: 1.1561, test_f1: 0.5931
 epoch: 42, train_loss: 0.7413, test_loss: 1.1649, test_f1: 0.5534
 epoch: 43, train_loss: 0.7523, test_loss: 1.1130, test_f1: 0.6301
 epoch: 44, train_loss: 0.7493, test_loss: 1.2509, test_f1: 0.5802
 epoch: 45, train_loss: 0.7667, test_loss: 1.1907, test_f1: 0.5744
 epoch: 46, train_loss: 0.7605, test_loss: 1.1035, test_f1: 0.5483
 epoch: 47, train_loss: 0.7345, test_loss: 1.1323, test_f1: 0.5596
 epoch: 48, train_loss: 0.7471, test_loss: 1.8321, test_f1: 0.4597
 epoch: 49, train_loss: 0.7986, test_loss: 1.4269, test_f1: 0.3815
 epoch: 50, train_loss: 0.7794, test_loss: 1.0344, test_f1: 0.5460
 epoch: 51, train_loss: 0.7149, test_loss: 1.2130, test_f1: 0.5739
 epoch: 52, train_loss: 0.6863, test_loss: 1.2121, test_f1: 0.5838
 epoch: 53, train_loss: 0.6808, test_loss: 1.3021, test_f1: 0.5951
 epoch: 54, train_loss: 0.6861, test_loss: 1.2987, test_f1: 0.5472
 epoch: 55, train_loss: 0.6892, test_loss: 1.2630, test_f1: 0.5956
 epoch: 56, train_loss: 0.6624, test_loss: 1.1437, test_f1: 0.6024
 epoch: 57, train_loss: 0.6706, test_loss: 1.4332, test_f1: 0.5313
 epoch: 58, train_loss: 0.6508, test_loss: 1.1651, test_f1: 0.5516
 epoch: 59, train_loss: 0.6880, test_loss: 1.1745, test_f1: 0.5145
 epoch: 60, train_loss: 0.7057, test_loss: 1.3036, test_f1: 0.5693
 epoch: 61, train_loss: 0.6501, test_loss: 1.2677, test_f1: 0.5059
 epoch: 62, train_loss: 0.6159, test_loss: 1.4025, test_f1: 0.5559
 epoch: 63, train_loss: 0.6392, test_loss: 1.2103, test_f1: 0.5497
 epoch: 64, train_loss: 0.6400, test_loss: 1.2442, test_f1: 0.6038
 epoch: 65, train_loss: 0.6216, test_loss: 1.3136, test_f1: 0.6065
 epoch: 66, train_loss: 0.6159, test_loss: 1.2985, test_f1: 0.5653
 epoch: 67, train_loss: 0.5887, test_loss: 1.6073, test_f1: 0.5459
 epoch: 68, train_loss: 0.6117, test_loss: 1.2100, test_f1: 0.5902
 epoch: 69, train_loss: 0.6179, test_loss: 1.3335, test_f1: 0.5875
 epoch: 70, train_loss: 0.6021, test_loss: 1.3723, test_f1: 0.5394
 epoch: 71, train_loss: 0.5956, test_loss: 1.3437, test_f1: 0.5813
 epoch: 72, train_loss: 0.6003, test_loss: 1.4958, test_f1: 0.5644
 epoch: 73, train_loss: 0.6060, test_loss: 1.2141, test_f1: 0.5526
 epoch: 74, train_loss: 0.6177, test_loss: 1.2877, test_f1: 0.5846
 epoch: 75, train_loss: 0.5574, test_loss: 1.4522, test_f1: 0.5590
 epoch: 76, train_loss: 0.5939, test_loss: 1.3413, test_f1: 0.5693
 epoch: 77, train_loss: 0.5835, test_loss: 1.4967, test_f1: 0.5391
 epoch: 78, train_loss: 0.5784, test_loss: 1.3651, test_f1: 0.5361
 epoch: 79, train_loss: 0.5634, test_loss: 1.5342, test_f1: 0.5616
 epoch: 80, train_loss: 0.5799, test_loss: 1.3527, test_f1: 0.6007
 epoch: 81, train_loss: 0.6081, test_loss: 1.4998, test_f1: 0.5797
 epoch: 82, train_loss: 0.5788, test_loss: 1.3340, test_f1: 0.5636
 epoch: 83, train_loss: 0.5528, test_loss: 1.5681, test_f1: 0.5652
 epoch: 84, train_loss: 0.5524, test_loss: 1.3864, test_f1: 0.5871
 epoch: 85, train_loss: 0.5528, test_loss: 1.5938, test_f1: 0.5837
 epoch: 86, train_loss: 0.5604, test_loss: 1.3269, test_f1: 0.5780
 epoch: 87, train_loss: 0.5526, test_loss: 1.4428, test_f1: 0.5855
 epoch: 88, train_loss: 0.5647, test_loss: 1.5191, test_f1: 0.5824
 epoch: 89, train_loss: 0.5452, test_loss: 1.4493, test_f1: 0.6119
 epoch: 90, train_loss: 0.5081, test_loss: 1.6914, test_f1: 0.5934
 epoch: 91, train_loss: 0.5286, test_loss: 1.4354, test_f1: 0.5748
 epoch: 92, train_loss: 0.5480, test_loss: 1.6941, test_f1: 0.6112
 epoch: 93, train_loss: 0.5281, test_loss: 1.9220, test_f1: 0.5540
 epoch: 94, train_loss: 0.5343, test_loss: 1.4926, test_f1: 0.6018
 epoch: 95, train_loss: 0.5177, test_loss: 1.6140, test_f1: 0.6017
 epoch: 96, train_loss: 0.5156, test_loss: 1.8336, test_f1: 0.5235
 epoch: 97, train_loss: 0.5143, test_loss: 1.6226, test_f1: 0.5814
 epoch: 98, train_loss: 0.5045, test_loss: 1.6614, test_f1: 0.5461
 epoch: 99, train_loss: 0.5317, test_loss: 1.6955, test_f1: 0.5577
##################ITERATION #6 ****************************************
 epoch: 0, train_loss: 1.2490, test_loss: 1.2569, test_f1: 0.2943
 epoch: 1, train_loss: 1.0757, test_loss: 1.4773, test_f1: 0.3351
 epoch: 2, train_loss: 1.0145, test_loss: 1.1723, test_f1: 0.4063
 epoch: 3, train_loss: 0.9689, test_loss: 1.6309, test_f1: 0.3261
 epoch: 4, train_loss: 0.9415, test_loss: 1.1551, test_f1: 0.3797
 epoch: 5, train_loss: 0.8924, test_loss: 1.2032, test_f1: 0.4451
 epoch: 6, train_loss: 0.8691, test_loss: 1.3475, test_f1: 0.4014
 epoch: 7, train_loss: 0.8833, test_loss: 1.0379, test_f1: 0.5081
 epoch: 8, train_loss: 0.8600, test_loss: 1.2034, test_f1: 0.4116
 epoch: 9, train_loss: 0.8663, test_loss: 1.0976, test_f1: 0.4963
 epoch: 10, train_loss: 0.8681, test_loss: 1.0259, test_f1: 0.4693
 epoch: 11, train_loss: 0.8678, test_loss: 1.0244, test_f1: 0.4836
 epoch: 12, train_loss: 0.8451, test_loss: 1.0631, test_f1: 0.5704
 epoch: 13, train_loss: 0.8429, test_loss: 1.0624, test_f1: 0.4868
 epoch: 14, train_loss: 0.8398, test_loss: 1.0403, test_f1: 0.5229
 epoch: 15, train_loss: 0.8634, test_loss: 1.0365, test_f1: 0.5388
 epoch: 16, train_loss: 0.8299, test_loss: 1.1198, test_f1: 0.5775
 epoch: 17, train_loss: 0.8365, test_loss: 1.0587, test_f1: 0.5780
 epoch: 18, train_loss: 0.8302, test_loss: 1.1769, test_f1: 0.5382
 epoch: 19, train_loss: 0.7962, test_loss: 1.0589, test_f1: 0.5410
 epoch: 20, train_loss: 0.8171, test_loss: 1.0520, test_f1: 0.5322
 epoch: 21, train_loss: 0.8104, test_loss: 1.0026, test_f1: 0.5458
 epoch: 22, train_loss: 0.8058, test_loss: 1.0583, test_f1: 0.5376
 epoch: 23, train_loss: 0.8200, test_loss: 1.1263, test_f1: 0.5622
 epoch: 24, train_loss: 0.7996, test_loss: 1.1144, test_f1: 0.5569
 epoch: 25, train_loss: 0.7833, test_loss: 1.4522, test_f1: 0.4284
 epoch: 26, train_loss: 0.8133, test_loss: 1.0537, test_f1: 0.6069
 epoch: 27, train_loss: 0.7746, test_loss: 1.5661, test_f1: 0.4882
 epoch: 28, train_loss: 0.7822, test_loss: 1.0893, test_f1: 0.5741
 epoch: 29, train_loss: 0.7747, test_loss: 1.4554, test_f1: 0.4031
 epoch: 30, train_loss: 0.7868, test_loss: 1.1997, test_f1: 0.5423
 epoch: 31, train_loss: 0.8076, test_loss: 1.2316, test_f1: 0.4870
 epoch: 32, train_loss: 0.7875, test_loss: 1.7985, test_f1: 0.3681
 epoch: 33, train_loss: 0.7829, test_loss: 1.0986, test_f1: 0.6080
 epoch: 34, train_loss: 0.7877, test_loss: 1.0737, test_f1: 0.6029
 epoch: 35, train_loss: 0.7603, test_loss: 1.2535, test_f1: 0.4955
 epoch: 36, train_loss: 0.7701, test_loss: 1.0267, test_f1: 0.5820
 epoch: 37, train_loss: 0.7915, test_loss: 1.1102, test_f1: 0.5403
 epoch: 38, train_loss: 0.7563, test_loss: 1.1724, test_f1: 0.5586
 epoch: 39, train_loss: 0.7562, test_loss: 1.2911, test_f1: 0.5019
 epoch: 40, train_loss: 0.7492, test_loss: 1.3046, test_f1: 0.5834
 epoch: 41, train_loss: 0.7235, test_loss: 1.1842, test_f1: 0.5689
 epoch: 42, train_loss: 0.7410, test_loss: 1.0980, test_f1: 0.5719
 epoch: 43, train_loss: 0.7481, test_loss: 1.0704, test_f1: 0.5879
 epoch: 44, train_loss: 0.7042, test_loss: 1.3776, test_f1: 0.4327
 epoch: 45, train_loss: 0.7401, test_loss: 1.0965, test_f1: 0.5751
 epoch: 46, train_loss: 0.7098, test_loss: 1.0992, test_f1: 0.5739
 epoch: 47, train_loss: 0.7248, test_loss: 1.0854, test_f1: 0.6049
 epoch: 48, train_loss: 0.7363, test_loss: 1.1214, test_f1: 0.5832
 epoch: 49, train_loss: 0.7216, test_loss: 1.0436, test_f1: 0.5788
 epoch: 50, train_loss: 0.7081, test_loss: 1.3261, test_f1: 0.4843
 epoch: 51, train_loss: 0.6826, test_loss: 1.0564, test_f1: 0.6171
 epoch: 52, train_loss: 0.6515, test_loss: 1.1539, test_f1: 0.5926
 epoch: 53, train_loss: 0.6506, test_loss: 1.2812, test_f1: 0.5875
 epoch: 54, train_loss: 0.6434, test_loss: 1.3114, test_f1: 0.5760
 epoch: 55, train_loss: 0.6111, test_loss: 1.2566, test_f1: 0.5866
 epoch: 56, train_loss: 0.6022, test_loss: 1.2424, test_f1: 0.6163
 epoch: 57, train_loss: 0.6123, test_loss: 1.2319, test_f1: 0.6142
 epoch: 58, train_loss: 0.6203, test_loss: 1.3178, test_f1: 0.5920
 epoch: 59, train_loss: 0.6168, test_loss: 1.4097, test_f1: 0.6347
 epoch: 60, train_loss: 0.6118, test_loss: 1.2922, test_f1: 0.6085
 epoch: 61, train_loss: 0.6060, test_loss: 1.4385, test_f1: 0.6166
 epoch: 62, train_loss: 0.6050, test_loss: 1.5776, test_f1: 0.5419
 epoch: 63, train_loss: 0.5868, test_loss: 1.3367, test_f1: 0.6270
 epoch: 64, train_loss: 0.6143, test_loss: 1.3625, test_f1: 0.5859
 epoch: 65, train_loss: 0.5944, test_loss: 1.4649, test_f1: 0.5782
 epoch: 66, train_loss: 0.5904, test_loss: 1.3406, test_f1: 0.5763
 epoch: 67, train_loss: 0.5783, test_loss: 1.5640, test_f1: 0.5474
 epoch: 68, train_loss: 0.5811, test_loss: 1.4767, test_f1: 0.5785
 epoch: 69, train_loss: 0.5916, test_loss: 1.4954, test_f1: 0.5921
 epoch: 70, train_loss: 0.6058, test_loss: 1.6273, test_f1: 0.5548
 epoch: 71, train_loss: 0.5835, test_loss: 1.3198, test_f1: 0.5912
 epoch: 72, train_loss: 0.5555, test_loss: 1.2378, test_f1: 0.5758
 epoch: 73, train_loss: 0.5944, test_loss: 1.6609, test_f1: 0.5241
 epoch: 74, train_loss: 0.5618, test_loss: 1.3449, test_f1: 0.5754
 epoch: 75, train_loss: 0.5507, test_loss: 1.5079, test_f1: 0.5471
 epoch: 76, train_loss: 0.5471, test_loss: 1.4089, test_f1: 0.5711
 epoch: 77, train_loss: 0.5543, test_loss: 1.4805, test_f1: 0.5431
 epoch: 78, train_loss: 0.5603, test_loss: 1.5387, test_f1: 0.6253
 epoch: 79, train_loss: 0.5511, test_loss: 1.7257, test_f1: 0.5039
 epoch: 80, train_loss: 0.5392, test_loss: 1.8694, test_f1: 0.5737
 epoch: 81, train_loss: 0.5514, test_loss: 1.6580, test_f1: 0.6031
 epoch: 82, train_loss: 0.5343, test_loss: 1.4965, test_f1: 0.6133
 epoch: 83, train_loss: 0.5396, test_loss: 1.3778, test_f1: 0.6026
 epoch: 84, train_loss: 0.5410, test_loss: 1.4578, test_f1: 0.5814
 epoch: 85, train_loss: 0.5345, test_loss: 1.4557, test_f1: 0.5807
 epoch: 86, train_loss: 0.5148, test_loss: 1.5253, test_f1: 0.5529
 epoch: 87, train_loss: 0.5153, test_loss: 1.4886, test_f1: 0.5740
 epoch: 88, train_loss: 0.5260, test_loss: 1.4817, test_f1: 0.5795
 epoch: 89, train_loss: 0.5012, test_loss: 1.5242, test_f1: 0.5579
 epoch: 90, train_loss: 0.5301, test_loss: 1.5009, test_f1: 0.5344
 epoch: 91, train_loss: 0.5065, test_loss: 1.4909, test_f1: 0.5587
 epoch: 92, train_loss: 0.5132, test_loss: 1.5387, test_f1: 0.5250
 epoch: 93, train_loss: 0.5275, test_loss: 1.5594, test_f1: 0.5785
 epoch: 94, train_loss: 0.5195, test_loss: 1.5799, test_f1: 0.5676
 epoch: 95, train_loss: 0.5073, test_loss: 1.7883, test_f1: 0.5576
 epoch: 96, train_loss: 0.4787, test_loss: 1.6724, test_f1: 0.5346
 epoch: 97, train_loss: 0.5119, test_loss: 1.5332, test_f1: 0.5852
 epoch: 98, train_loss: 0.5068, test_loss: 1.6630, test_f1: 0.5786
 epoch: 99, train_loss: 0.4914, test_loss: 1.6907, test_f1: 0.5651
##################ITERATION #7 ****************************************
 epoch: 0, train_loss: 1.2926, test_loss: 1.4056, test_f1: 0.2281
 epoch: 1, train_loss: 1.1358, test_loss: 1.1826, test_f1: 0.4257
 epoch: 2, train_loss: 1.0666, test_loss: 1.1401, test_f1: 0.4200
 epoch: 3, train_loss: 1.0318, test_loss: 1.1819, test_f1: 0.3794
 epoch: 4, train_loss: 0.9969, test_loss: 1.1442, test_f1: 0.4879
 epoch: 5, train_loss: 0.9481, test_loss: 1.0716, test_f1: 0.4409
 epoch: 6, train_loss: 0.9208, test_loss: 1.2288, test_f1: 0.4883
 epoch: 7, train_loss: 0.9000, test_loss: 1.0749, test_f1: 0.4478
 epoch: 8, train_loss: 0.9083, test_loss: 1.4037, test_f1: 0.4554
 epoch: 9, train_loss: 0.8612, test_loss: 1.1236, test_f1: 0.5077
 epoch: 10, train_loss: 0.8726, test_loss: 1.0183, test_f1: 0.5700
 epoch: 11, train_loss: 0.8551, test_loss: 1.8571, test_f1: 0.3611
 epoch: 12, train_loss: 0.8551, test_loss: 1.1184, test_f1: 0.5422
 epoch: 13, train_loss: 0.8315, test_loss: 1.2648, test_f1: 0.4979
 epoch: 14, train_loss: 0.8011, test_loss: 0.9505, test_f1: 0.6115
 epoch: 15, train_loss: 0.8204, test_loss: 1.1905, test_f1: 0.4918
 epoch: 16, train_loss: 0.8217, test_loss: 1.2186, test_f1: 0.5531
 epoch: 17, train_loss: 0.8607, test_loss: 0.9592, test_f1: 0.5822
 epoch: 18, train_loss: 0.8221, test_loss: 1.0763, test_f1: 0.5239
 epoch: 19, train_loss: 0.8145, test_loss: 1.0665, test_f1: 0.5994
 epoch: 20, train_loss: 0.8321, test_loss: 1.1135, test_f1: 0.5000
 epoch: 21, train_loss: 0.8062, test_loss: 1.1570, test_f1: 0.5376
 epoch: 22, train_loss: 0.7764, test_loss: 1.2082, test_f1: 0.5371
 epoch: 23, train_loss: 0.7952, test_loss: 1.0269, test_f1: 0.5636
 epoch: 24, train_loss: 0.7839, test_loss: 1.0529, test_f1: 0.5752
 epoch: 25, train_loss: 0.8224, test_loss: 1.1772, test_f1: 0.4934
 epoch: 26, train_loss: 0.7726, test_loss: 1.0358, test_f1: 0.5569
 epoch: 27, train_loss: 0.7460, test_loss: 1.0968, test_f1: 0.6132
 epoch: 28, train_loss: 0.7182, test_loss: 1.2479, test_f1: 0.5958
 epoch: 29, train_loss: 0.7611, test_loss: 1.0910, test_f1: 0.6034
 epoch: 30, train_loss: 0.7521, test_loss: 1.0178, test_f1: 0.6022
 epoch: 31, train_loss: 0.7419, test_loss: 1.1817, test_f1: 0.6056
 epoch: 32, train_loss: 0.7341, test_loss: 1.2451, test_f1: 0.5796
 epoch: 33, train_loss: 0.7375, test_loss: 1.0796, test_f1: 0.5868
 epoch: 34, train_loss: 0.7224, test_loss: 1.1210, test_f1: 0.6356
 epoch: 35, train_loss: 0.7075, test_loss: 1.1261, test_f1: 0.5883
 epoch: 36, train_loss: 0.6829, test_loss: 1.1121, test_f1: 0.6349
 epoch: 37, train_loss: 0.6800, test_loss: 1.6504, test_f1: 0.5951
 epoch: 38, train_loss: 0.7534, test_loss: 1.1766, test_f1: 0.5984
 epoch: 39, train_loss: 0.7531, test_loss: 1.0477, test_f1: 0.6103
 epoch: 40, train_loss: 0.7091, test_loss: 1.2005, test_f1: 0.5718
 epoch: 41, train_loss: 0.7024, test_loss: 1.2890, test_f1: 0.6147
 epoch: 42, train_loss: 0.6967, test_loss: 1.1985, test_f1: 0.6144
 epoch: 43, train_loss: 0.6961, test_loss: 1.5609, test_f1: 0.4420
 epoch: 44, train_loss: 0.7014, test_loss: 1.1333, test_f1: 0.5827
 epoch: 45, train_loss: 0.6609, test_loss: 1.1910, test_f1: 0.6457
 epoch: 46, train_loss: 0.6697, test_loss: 1.2154, test_f1: 0.5764
 epoch: 47, train_loss: 0.6528, test_loss: 1.2020, test_f1: 0.5574
 epoch: 48, train_loss: 0.6721, test_loss: 1.2374, test_f1: 0.5601
 epoch: 49, train_loss: 0.6702, test_loss: 1.1900, test_f1: 0.6212
 epoch: 50, train_loss: 0.6582, test_loss: 1.3057, test_f1: 0.5977
 epoch: 51, train_loss: 0.6185, test_loss: 1.3323, test_f1: 0.5853
 epoch: 52, train_loss: 0.5823, test_loss: 1.3144, test_f1: 0.6321
 epoch: 53, train_loss: 0.5893, test_loss: 1.2530, test_f1: 0.6023
 epoch: 54, train_loss: 0.5741, test_loss: 1.3694, test_f1: 0.6076
 epoch: 55, train_loss: 0.5591, test_loss: 1.2701, test_f1: 0.6115
 epoch: 56, train_loss: 0.5785, test_loss: 1.3695, test_f1: 0.6013
 epoch: 57, train_loss: 0.5492, test_loss: 1.3263, test_f1: 0.6349
 epoch: 58, train_loss: 0.5671, test_loss: 4.3664, test_f1: 0.6015
 epoch: 59, train_loss: 0.5644, test_loss: 1.3123, test_f1: 0.6103
 epoch: 60, train_loss: 0.5602, test_loss: 1.4012, test_f1: 0.5847
 epoch: 61, train_loss: 0.5535, test_loss: 1.2936, test_f1: 0.6447
 epoch: 62, train_loss: 0.5415, test_loss: 1.3618, test_f1: 0.5875
 epoch: 63, train_loss: 0.5409, test_loss: 1.4307, test_f1: 0.5750
 epoch: 64, train_loss: 0.5103, test_loss: 1.5353, test_f1: 0.6209
 epoch: 65, train_loss: 0.5005, test_loss: 1.4125, test_f1: 0.6227
 epoch: 66, train_loss: 0.5248, test_loss: 1.4181, test_f1: 0.5726
 epoch: 67, train_loss: 0.5093, test_loss: 1.3960, test_f1: 0.6038
 epoch: 68, train_loss: 0.4932, test_loss: 1.5460, test_f1: 0.5809
 epoch: 69, train_loss: 0.5334, test_loss: 1.2817, test_f1: 0.6511
 epoch: 70, train_loss: 0.5274, test_loss: 1.4905, test_f1: 0.5962
 epoch: 71, train_loss: 0.4936, test_loss: 1.3332, test_f1: 0.6360
 epoch: 72, train_loss: 0.5188, test_loss: 1.3563, test_f1: 0.6258
 epoch: 73, train_loss: 0.4973, test_loss: 1.3606, test_f1: 0.6331
 epoch: 74, train_loss: 0.4929, test_loss: 1.5191, test_f1: 0.6174
 epoch: 75, train_loss: 0.4645, test_loss: 1.6102, test_f1: 0.5950
 epoch: 76, train_loss: 0.4644, test_loss: 1.4481, test_f1: 0.6256
 epoch: 77, train_loss: 0.4883, test_loss: 1.4601, test_f1: 0.5819
 epoch: 78, train_loss: 0.4828, test_loss: 1.6311, test_f1: 0.6323
 epoch: 79, train_loss: 0.4498, test_loss: 1.6873, test_f1: 0.5995
 epoch: 80, train_loss: 0.4927, test_loss: 1.6603, test_f1: 0.6126
 epoch: 81, train_loss: 0.4390, test_loss: 1.5874, test_f1: 0.6353
 epoch: 82, train_loss: 0.4613, test_loss: 1.6973, test_f1: 0.5964
 epoch: 83, train_loss: 0.4283, test_loss: 1.5628, test_f1: 0.6136
 epoch: 84, train_loss: 0.4642, test_loss: 1.5358, test_f1: 0.6055
 epoch: 85, train_loss: 0.4363, test_loss: 1.5724, test_f1: 0.6359
 epoch: 86, train_loss: 0.4393, test_loss: 1.7410, test_f1: 0.6257
 epoch: 87, train_loss: 0.4618, test_loss: 1.8878, test_f1: 0.6150
 epoch: 88, train_loss: 0.4253, test_loss: 1.7208, test_f1: 0.5809
 epoch: 89, train_loss: 0.4443, test_loss: 1.4487, test_f1: 0.5740
 epoch: 90, train_loss: 0.4257, test_loss: 1.4800, test_f1: 0.6250
 epoch: 91, train_loss: 0.4361, test_loss: 1.5320, test_f1: 0.6134
 epoch: 92, train_loss: 0.4292, test_loss: 1.6755, test_f1: 0.6138
 epoch: 93, train_loss: 0.4393, test_loss: 1.7054, test_f1: 0.6106
 epoch: 94, train_loss: 0.4566, test_loss: 1.7615, test_f1: 0.5837
 epoch: 95, train_loss: 0.4000, test_loss: 1.6917, test_f1: 0.6085
 epoch: 96, train_loss: 0.4353, test_loss: 1.6364, test_f1: 0.6173
 epoch: 97, train_loss: 0.4296, test_loss: 1.8108, test_f1: 0.6174
 epoch: 98, train_loss: 0.4319, test_loss: 1.5768, test_f1: 0.6255
 epoch: 99, train_loss: 0.4316, test_loss: 1.4953, test_f1: 0.6375
##################ITERATION #8 ****************************************
 epoch: 0, train_loss: 1.2540, test_loss: 1.2732, test_f1: 0.2336
 epoch: 1, train_loss: 1.1410, test_loss: 1.2063, test_f1: 0.4778
 epoch: 2, train_loss: 1.1015, test_loss: 1.2583, test_f1: 0.4781
 epoch: 3, train_loss: 1.0343, test_loss: 1.1519, test_f1: 0.5063
 epoch: 4, train_loss: 0.9745, test_loss: 1.0526, test_f1: 0.5431
 epoch: 5, train_loss: 0.9523, test_loss: 1.1813, test_f1: 0.3481
 epoch: 6, train_loss: 0.9613, test_loss: 1.2239, test_f1: 0.4175
 epoch: 7, train_loss: 0.9043, test_loss: 1.0598, test_f1: 0.4471
 epoch: 8, train_loss: 0.8793, test_loss: 1.1612, test_f1: 0.5544
 epoch: 9, train_loss: 0.8583, test_loss: 1.1029, test_f1: 0.4951
 epoch: 10, train_loss: 0.8871, test_loss: 1.1296, test_f1: 0.5239
 epoch: 11, train_loss: 0.8468, test_loss: 1.0843, test_f1: 0.5216
 epoch: 12, train_loss: 0.8451, test_loss: 1.0177, test_f1: 0.5565
 epoch: 13, train_loss: 0.8283, test_loss: 1.0568, test_f1: 0.5802
 epoch: 14, train_loss: 0.8458, test_loss: 1.1139, test_f1: 0.5327
 epoch: 15, train_loss: 0.8160, test_loss: 1.6864, test_f1: 0.3024
 epoch: 16, train_loss: 0.8551, test_loss: 1.3064, test_f1: 0.5040
 epoch: 17, train_loss: 0.8392, test_loss: 1.1388, test_f1: 0.5371
 epoch: 18, train_loss: 0.8678, test_loss: 1.1064, test_f1: 0.4953
 epoch: 19, train_loss: 0.8130, test_loss: 1.3599, test_f1: 0.5732
 epoch: 20, train_loss: 0.7932, test_loss: 1.1368, test_f1: 0.5527
 epoch: 21, train_loss: 0.7703, test_loss: 1.2268, test_f1: 0.5247
 epoch: 22, train_loss: 0.7575, test_loss: 1.3660, test_f1: 0.5444
 epoch: 23, train_loss: 0.7729, test_loss: 1.0377, test_f1: 0.5684
 epoch: 24, train_loss: 0.7826, test_loss: 1.2732, test_f1: 0.6000
 epoch: 25, train_loss: 0.7552, test_loss: 1.5140, test_f1: 0.5654
 epoch: 26, train_loss: 0.7666, test_loss: 1.0865, test_f1: 0.5929
 epoch: 27, train_loss: 0.7730, test_loss: 1.3661, test_f1: 0.5274
 epoch: 28, train_loss: 0.7691, test_loss: 1.2414, test_f1: 0.5678
 epoch: 29, train_loss: 0.7510, test_loss: 1.2716, test_f1: 0.5662
 epoch: 30, train_loss: 0.7184, test_loss: 1.4366, test_f1: 0.5696
 epoch: 31, train_loss: 0.7455, test_loss: 1.1506, test_f1: 0.5589
 epoch: 32, train_loss: 0.7351, test_loss: 1.6119, test_f1: 0.5540
 epoch: 33, train_loss: 0.7228, test_loss: 1.1626, test_f1: 0.5663
 epoch: 34, train_loss: 0.7267, test_loss: 1.2196, test_f1: 0.5762
 epoch: 35, train_loss: 0.7262, test_loss: 1.4026, test_f1: 0.6162
 epoch: 36, train_loss: 0.7133, test_loss: 1.3088, test_f1: 0.5130
 epoch: 37, train_loss: 0.7327, test_loss: 1.0450, test_f1: 0.5696
 epoch: 38, train_loss: 0.7545, test_loss: 0.9806, test_f1: 0.6128
 epoch: 39, train_loss: 0.6906, test_loss: 1.4389, test_f1: 0.5327
 epoch: 40, train_loss: 0.7110, test_loss: 1.1767, test_f1: 0.5474
 epoch: 41, train_loss: 0.6748, test_loss: 1.3793, test_f1: 0.5364
 epoch: 42, train_loss: 0.6889, test_loss: 1.3631, test_f1: 0.6240
 epoch: 43, train_loss: 0.6904, test_loss: 1.6578, test_f1: 0.5975
 epoch: 44, train_loss: 0.6966, test_loss: 1.6570, test_f1: 0.5458
 epoch: 45, train_loss: 0.6660, test_loss: 1.4225, test_f1: 0.5587
 epoch: 46, train_loss: 0.6613, test_loss: 1.3972, test_f1: 0.6109
 epoch: 47, train_loss: 0.6664, test_loss: 1.8249, test_f1: 0.5582
 epoch: 48, train_loss: 0.6440, test_loss: 1.4239, test_f1: 0.5411
 epoch: 49, train_loss: 0.6645, test_loss: 1.3828, test_f1: 0.5796
 epoch: 50, train_loss: 0.6564, test_loss: 1.4068, test_f1: 0.6307
 epoch: 51, train_loss: 0.5978, test_loss: 1.6957, test_f1: 0.5877
 epoch: 52, train_loss: 0.5913, test_loss: 1.5250, test_f1: 0.5360
 epoch: 53, train_loss: 0.5676, test_loss: 1.5662, test_f1: 0.6102
 epoch: 54, train_loss: 0.5579, test_loss: 1.8891, test_f1: 0.6328
 epoch: 55, train_loss: 0.5812, test_loss: 1.5703, test_f1: 0.5611
 epoch: 56, train_loss: 0.5636, test_loss: 1.3191, test_f1: 0.6097
 epoch: 57, train_loss: 0.5651, test_loss: 1.4813, test_f1: 0.6081
 epoch: 58, train_loss: 0.5651, test_loss: 1.7345, test_f1: 0.5907
 epoch: 59, train_loss: 0.5580, test_loss: 1.6099, test_f1: 0.6216
 epoch: 60, train_loss: 0.5396, test_loss: 2.1270, test_f1: 0.5763
 epoch: 61, train_loss: 0.5207, test_loss: 1.4545, test_f1: 0.5642
 epoch: 62, train_loss: 0.5057, test_loss: 1.6582, test_f1: 0.5811
 epoch: 63, train_loss: 0.5197, test_loss: 2.3071, test_f1: 0.5779
 epoch: 64, train_loss: 0.4870, test_loss: 2.0029, test_f1: 0.5633
 epoch: 65, train_loss: 0.5362, test_loss: 1.5855, test_f1: 0.6200
 epoch: 66, train_loss: 0.5022, test_loss: 2.2058, test_f1: 0.5970
 epoch: 67, train_loss: 0.4951, test_loss: 2.3149, test_f1: 0.5519
 epoch: 68, train_loss: 0.5089, test_loss: 1.9494, test_f1: 0.6085
 epoch: 69, train_loss: 0.4859, test_loss: 2.2930, test_f1: 0.6158
 epoch: 70, train_loss: 0.4862, test_loss: 2.4644, test_f1: 0.5480
 epoch: 71, train_loss: 0.4973, test_loss: 2.0563, test_f1: 0.5984
 epoch: 72, train_loss: 0.4704, test_loss: 2.1540, test_f1: 0.5925
 epoch: 73, train_loss: 0.4488, test_loss: 2.2840, test_f1: 0.5199
 epoch: 74, train_loss: 0.5016, test_loss: 1.6939, test_f1: 0.5785
 epoch: 75, train_loss: 0.4445, test_loss: 2.4236, test_f1: 0.5492
 epoch: 76, train_loss: 0.4731, test_loss: 2.8117, test_f1: 0.6251
 epoch: 77, train_loss: 0.4511, test_loss: 2.9210, test_f1: 0.4937
 epoch: 78, train_loss: 0.4667, test_loss: 3.4688, test_f1: 0.5711
 epoch: 79, train_loss: 0.4441, test_loss: 2.7620, test_f1: 0.6382
 epoch: 80, train_loss: 0.4408, test_loss: 2.6949, test_f1: 0.5383
 epoch: 81, train_loss: 0.4696, test_loss: 2.4456, test_f1: 0.5713
 epoch: 82, train_loss: 0.4427, test_loss: 2.0244, test_f1: 0.5757
 epoch: 83, train_loss: 0.4498, test_loss: 2.0815, test_f1: 0.6028
 epoch: 84, train_loss: 0.4124, test_loss: 2.6925, test_f1: 0.5620
 epoch: 85, train_loss: 0.4052, test_loss: 2.1240, test_f1: 0.5956
 epoch: 86, train_loss: 0.4068, test_loss: 3.0042, test_f1: 0.6413
 epoch: 87, train_loss: 0.4329, test_loss: 2.1318, test_f1: 0.5409
 epoch: 88, train_loss: 0.4512, test_loss: 1.8962, test_f1: 0.6374
 epoch: 89, train_loss: 0.4107, test_loss: 2.1200, test_f1: 0.5789
 epoch: 90, train_loss: 0.4308, test_loss: 1.5515, test_f1: 0.5804
 epoch: 91, train_loss: 0.4313, test_loss: 2.0017, test_f1: 0.6046
 epoch: 92, train_loss: 0.3976, test_loss: 2.2394, test_f1: 0.5356
 epoch: 93, train_loss: 0.3900, test_loss: 2.9894, test_f1: 0.5431
 epoch: 94, train_loss: 0.3953, test_loss: 2.0119, test_f1: 0.5400
 epoch: 95, train_loss: 0.4032, test_loss: 2.4190, test_f1: 0.5737
 epoch: 96, train_loss: 0.3910, test_loss: 1.5976, test_f1: 0.5753
 epoch: 97, train_loss: 0.3865, test_loss: 2.8205, test_f1: 0.5375
 epoch: 98, train_loss: 0.4068, test_loss: 2.4490, test_f1: 0.5936
 epoch: 99, train_loss: 0.3950, test_loss: 2.5759, test_f1: 0.5722
##################ITERATION #9 ****************************************
 epoch: 0, train_loss: 1.2749, test_loss: 1.2145, test_f1: 0.3138
 epoch: 1, train_loss: 1.0842, test_loss: 1.2648, test_f1: 0.3996
 epoch: 2, train_loss: 1.0158, test_loss: 1.0680, test_f1: 0.5318
 epoch: 3, train_loss: 0.9627, test_loss: 1.1052, test_f1: 0.5397
 epoch: 4, train_loss: 0.9236, test_loss: 1.0844, test_f1: 0.5494
 epoch: 5, train_loss: 0.9186, test_loss: 1.0363, test_f1: 0.5058
 epoch: 6, train_loss: 0.9063, test_loss: 0.9891, test_f1: 0.5769
 epoch: 7, train_loss: 0.8954, test_loss: 0.9928, test_f1: 0.4878
 epoch: 8, train_loss: 0.8842, test_loss: 1.0739, test_f1: 0.4705
 epoch: 9, train_loss: 0.8664, test_loss: 1.0516, test_f1: 0.5128
 epoch: 10, train_loss: 0.8795, test_loss: 1.6953, test_f1: 0.3302
 epoch: 11, train_loss: 0.8719, test_loss: 1.1636, test_f1: 0.4525
 epoch: 12, train_loss: 0.8589, test_loss: 1.0544, test_f1: 0.5113
 epoch: 13, train_loss: 0.8390, test_loss: 1.0539, test_f1: 0.4535
 epoch: 14, train_loss: 0.8412, test_loss: 1.1473, test_f1: 0.5664
 epoch: 15, train_loss: 0.8683, test_loss: 1.0656, test_f1: 0.5124
 epoch: 16, train_loss: 0.8224, test_loss: 1.0499, test_f1: 0.5705
 epoch: 17, train_loss: 0.8035, test_loss: 1.1039, test_f1: 0.5341
 epoch: 18, train_loss: 0.8012, test_loss: 1.0234, test_f1: 0.5584
 epoch: 19, train_loss: 0.8392, test_loss: 1.0311, test_f1: 0.5275
 epoch: 20, train_loss: 0.8253, test_loss: 1.1268, test_f1: 0.5613
 epoch: 21, train_loss: 0.7923, test_loss: 1.1987, test_f1: 0.5721
 epoch: 22, train_loss: 0.8162, test_loss: 1.1590, test_f1: 0.5634
 epoch: 23, train_loss: 0.8416, test_loss: 1.0694, test_f1: 0.5217
 epoch: 24, train_loss: 0.8055, test_loss: 1.1173, test_f1: 0.5507
 epoch: 25, train_loss: 0.7795, test_loss: 0.9886, test_f1: 0.5799
 epoch: 26, train_loss: 0.8029, test_loss: 1.0169, test_f1: 0.6009
 epoch: 27, train_loss: 0.7851, test_loss: 1.0267, test_f1: 0.5614
 epoch: 28, train_loss: 0.7631, test_loss: 1.0771, test_f1: 0.5572
 epoch: 29, train_loss: 0.7856, test_loss: 1.0882, test_f1: 0.5634
 epoch: 30, train_loss: 0.8353, test_loss: 0.9782, test_f1: 0.6026
 epoch: 31, train_loss: 0.7738, test_loss: 0.9806, test_f1: 0.5969
 epoch: 32, train_loss: 0.7921, test_loss: 1.1832, test_f1: 0.5088
 epoch: 33, train_loss: 0.7629, test_loss: 1.0765, test_f1: 0.5489
 epoch: 34, train_loss: 0.7535, test_loss: 1.1023, test_f1: 0.6163
 epoch: 35, train_loss: 0.7360, test_loss: 1.1401, test_f1: 0.5638
 epoch: 36, train_loss: 0.7888, test_loss: 1.3392, test_f1: 0.4873
 epoch: 37, train_loss: 0.7410, test_loss: 1.1132, test_f1: 0.5786
 epoch: 38, train_loss: 0.7272, test_loss: 1.1461, test_f1: 0.5328
 epoch: 39, train_loss: 0.7357, test_loss: 1.1491, test_f1: 0.5601
 epoch: 40, train_loss: 0.7398, test_loss: 0.9902, test_f1: 0.5984
 epoch: 41, train_loss: 0.7272, test_loss: 1.1571, test_f1: 0.5794
 epoch: 42, train_loss: 0.7317, test_loss: 1.3536, test_f1: 0.5709
 epoch: 43, train_loss: 0.7168, test_loss: 1.2604, test_f1: 0.5443
 epoch: 44, train_loss: 0.7377, test_loss: 1.3031, test_f1: 0.5509
 epoch: 45, train_loss: 0.7089, test_loss: 1.3929, test_f1: 0.5511
 epoch: 46, train_loss: 0.7494, test_loss: 1.6984, test_f1: 0.4906
 epoch: 47, train_loss: 0.6909, test_loss: 1.3805, test_f1: 0.5195
 epoch: 48, train_loss: 0.7121, test_loss: 1.2199, test_f1: 0.6111
 epoch: 49, train_loss: 0.7550, test_loss: 1.0775, test_f1: 0.6057
 epoch: 50, train_loss: 0.6965, test_loss: 1.5712, test_f1: 0.5415
 epoch: 51, train_loss: 0.6680, test_loss: 1.2497, test_f1: 0.5804
 epoch: 52, train_loss: 0.6530, test_loss: 1.2194, test_f1: 0.6050
 epoch: 53, train_loss: 0.6177, test_loss: 1.3229, test_f1: 0.6061
 epoch: 54, train_loss: 0.6208, test_loss: 1.2988, test_f1: 0.5832
 epoch: 55, train_loss: 0.5856, test_loss: 1.3411, test_f1: 0.5811
 epoch: 56, train_loss: 0.6021, test_loss: 1.2958, test_f1: 0.5817
 epoch: 57, train_loss: 0.5929, test_loss: 1.1928, test_f1: 0.6336
 epoch: 58, train_loss: 0.5947, test_loss: 1.2466, test_f1: 0.5666
 epoch: 59, train_loss: 0.6114, test_loss: 1.3677, test_f1: 0.5515
 epoch: 60, train_loss: 0.5908, test_loss: 1.3637, test_f1: 0.5779
 epoch: 61, train_loss: 0.5792, test_loss: 1.5485, test_f1: 0.6069
 epoch: 62, train_loss: 0.5825, test_loss: 1.7513, test_f1: 0.5820
 epoch: 63, train_loss: 0.5734, test_loss: 1.4976, test_f1: 0.5853
 epoch: 64, train_loss: 0.5820, test_loss: 2.0389, test_f1: 0.5862
 epoch: 65, train_loss: 0.5768, test_loss: 1.4720, test_f1: 0.5947
 epoch: 66, train_loss: 0.5435, test_loss: 1.6938, test_f1: 0.5794
 epoch: 67, train_loss: 0.5580, test_loss: 1.4079, test_f1: 0.5953
 epoch: 68, train_loss: 0.5535, test_loss: 1.6968, test_f1: 0.5541
 epoch: 69, train_loss: 0.5297, test_loss: 1.4565, test_f1: 0.6125
 epoch: 70, train_loss: 0.5496, test_loss: 1.4924, test_f1: 0.5772
 epoch: 71, train_loss: 0.5133, test_loss: 1.5959, test_f1: 0.6012
 epoch: 72, train_loss: 0.5453, test_loss: 1.4185, test_f1: 0.6325
 epoch: 73, train_loss: 0.5368, test_loss: 1.4694, test_f1: 0.5724
 epoch: 74, train_loss: 0.5151, test_loss: 1.4388, test_f1: 0.6012
 epoch: 75, train_loss: 0.5181, test_loss: 1.6594, test_f1: 0.5910
 epoch: 76, train_loss: 0.4990, test_loss: 3.0777, test_f1: 0.5406
 epoch: 77, train_loss: 0.5186, test_loss: 2.2347, test_f1: 0.5917
 epoch: 78, train_loss: 0.5054, test_loss: 1.6583, test_f1: 0.5687
 epoch: 79, train_loss: 0.4962, test_loss: 1.4683, test_f1: 0.5659
 epoch: 80, train_loss: 0.4875, test_loss: 1.7591, test_f1: 0.6071
 epoch: 81, train_loss: 0.4770, test_loss: 1.7907, test_f1: 0.5787
 epoch: 82, train_loss: 0.4764, test_loss: 1.6498, test_f1: 0.6336
 epoch: 83, train_loss: 0.4678, test_loss: 1.8683, test_f1: 0.5627
 epoch: 84, train_loss: 0.4607, test_loss: 1.9666, test_f1: 0.5153
 epoch: 85, train_loss: 0.4776, test_loss: 1.8151, test_f1: 0.5659
 epoch: 86, train_loss: 0.4851, test_loss: 1.7004, test_f1: 0.5806
 epoch: 87, train_loss: 0.4917, test_loss: 1.7068, test_f1: 0.5966
 epoch: 88, train_loss: 0.4656, test_loss: 1.7591, test_f1: 0.6211
 epoch: 89, train_loss: 0.4469, test_loss: 1.7595, test_f1: 0.5812
 epoch: 90, train_loss: 0.4469, test_loss: 1.7065, test_f1: 0.5971
 epoch: 91, train_loss: 0.4428, test_loss: 1.8687, test_f1: 0.6074
 epoch: 92, train_loss: 0.4328, test_loss: 2.3419, test_f1: 0.5892
 epoch: 93, train_loss: 0.4601, test_loss: 1.7701, test_f1: 0.5725
 epoch: 94, train_loss: 0.4094, test_loss: 2.2709, test_f1: 0.5657
 epoch: 95, train_loss: 0.4500, test_loss: 1.9368, test_f1: 0.5922
 epoch: 96, train_loss: 0.4402, test_loss: 2.5422, test_f1: 0.5824
 epoch: 97, train_loss: 0.4291, test_loss: 1.8678, test_f1: 0.5755
 epoch: 98, train_loss: 0.4165, test_loss: 2.0378, test_f1: 0.5812
 epoch: 99, train_loss: 0.4183, test_loss: 1.9356, test_f1: 0.5591

Training completed in 502.96 seconds
Best F1: 0.6712 at epoch 73
Mean F1 across iterations: 0.6388  0.0190
========================FINAL RESULTS================================
FEGIN weighted F1: 0.6712  0.0190
python main.py --data ltspice_demos --representation component_component --model FEGIN --layers 2 --hiddens 64 --batch_size 32 --lr 0.01 --emb_size 512 --epochs 100 --save_appendix component_component_L2_H64_BS32_LR0.01_E512 --no_val
-----



STDERR:
  File "main.py", line 370, in <module>
    main()
  File "main.py", line 254, in main
    dataset = dataset_class(
  File "/home/philip/projects/ltspice_examples_code_repo/Circuit-Completion-Using-GNNs/component_classification_with_link_prediction_head/evaluation/FEGIN/kernel/circuit_datasets.py", line 15, in __init__
    self.data, self.slices = torch.load(self.processed_paths[0])
  File "/home/philip/.local/lib/python3.8/site-packages/torch/serialization.py", line 1040, in load
    warnings.warn(
  File "/usr/lib/python3.8/warnings.py", line 109, in _showwarnmsg
    sw(msg.message, msg.category, msg.filename, msg.lineno,
  File "main.py", line 47, in warn_with_traceback
    traceback.print_stack(file=log)
/home/philip/projects/ltspice_examples_code_repo/Circuit-Completion-Using-GNNs/component_classification_with_link_prediction_head/evaluation/FEGIN/kernel/circuit_datasets.py:15: FutureWarning: You are using `torch.load` with `weights_only=False` (the current default value), which uses the default pickle module implicitly. It is possible to construct malicious pickle data which will execute arbitrary code during unpickling (See https://github.com/pytorch/pytorch/blob/main/SECURITY.md#untrusted-models for more details). In a future release, the default value for `weights_only` will be flipped to `True`. This limits the functions that could be executed during unpickling. Arbitrary objects will no longer be allowed to be loaded via this mode unless they are explicitly allowlisted by the user via `torch.serialization.add_safe_globals`. We recommend you start setting `weights_only=True` for any use case where you don't have full control of the loaded file. Please open an issue on GitHub for any issues related to this experimental feature.
  self.data, self.slices = torch.load(self.processed_paths[0])
