STDOUT:
Results will be saved in /home/philip/projects/ltspice_examples_code_repo/Circuit-Completion-Using-GNNs/component_classification_with_link_prediction_head/evaluation/FEGIN/results/model_FEGIN_dataset_ltspice_demos
Command line input: python main.py --data ltspice_demos --representation component_component --model FEGIN --layers 2 --hiddens 64 --batch_size 32 --lr 0.01 --emb_size 512 --epochs 100 --save_appendix component_component_L2_H64_BS32_LR0.01_E512 --no_val
 is saved.
-----
ltspice_demos - FEGIN
Using 2 layers, 64 hidden units, h = 2
Loading component_component representation dataset
ENTERED
Training FEGIN on component_component representation
Train: 1565, Test: 383
##################ITERATION #0 ****************************************
 epoch: 0, train_loss: 1.2611, test_loss: 1.4201, test_f1: 0.3143
 epoch: 1, train_loss: 1.1660, test_loss: 1.2001, test_f1: 0.4036
 epoch: 2, train_loss: 1.0955, test_loss: 1.2083, test_f1: 0.3204
 epoch: 3, train_loss: 1.0374, test_loss: 1.1794, test_f1: 0.3873
 epoch: 4, train_loss: 1.0067, test_loss: 1.0854, test_f1: 0.5088
 epoch: 5, train_loss: 0.9714, test_loss: 1.0975, test_f1: 0.5426
 epoch: 6, train_loss: 0.9615, test_loss: 1.0326, test_f1: 0.5643
 epoch: 7, train_loss: 0.9229, test_loss: 1.0573, test_f1: 0.5560
 epoch: 8, train_loss: 0.8743, test_loss: 1.0242, test_f1: 0.4107
 epoch: 9, train_loss: 0.8872, test_loss: 0.9929, test_f1: 0.4510
 epoch: 10, train_loss: 0.8626, test_loss: 1.0845, test_f1: 0.5400
 epoch: 11, train_loss: 0.8786, test_loss: 1.0604, test_f1: 0.5818
 epoch: 12, train_loss: 0.8565, test_loss: 1.0627, test_f1: 0.5385
 epoch: 13, train_loss: 0.8408, test_loss: 1.0959, test_f1: 0.4881
 epoch: 14, train_loss: 0.8220, test_loss: 1.0394, test_f1: 0.4637
 epoch: 15, train_loss: 0.8481, test_loss: 1.1863, test_f1: 0.5221
 epoch: 16, train_loss: 0.8515, test_loss: 1.0430, test_f1: 0.5899
 epoch: 17, train_loss: 0.8194, test_loss: 1.4732, test_f1: 0.4454
 epoch: 18, train_loss: 0.8017, test_loss: 1.0346, test_f1: 0.6077
 epoch: 19, train_loss: 0.8218, test_loss: 1.1480, test_f1: 0.4496
 epoch: 20, train_loss: 0.8310, test_loss: 1.1560, test_f1: 0.5364
 epoch: 21, train_loss: 0.7886, test_loss: 0.9522, test_f1: 0.5988
 epoch: 22, train_loss: 0.7780, test_loss: 1.2515, test_f1: 0.5143
 epoch: 23, train_loss: 0.7881, test_loss: 1.0990, test_f1: 0.5322
 epoch: 24, train_loss: 0.8065, test_loss: 1.1310, test_f1: 0.6079
 epoch: 25, train_loss: 0.7736, test_loss: 1.2636, test_f1: 0.6010
 epoch: 26, train_loss: 0.7808, test_loss: 0.9642, test_f1: 0.5998
 epoch: 27, train_loss: 0.7955, test_loss: 1.0095, test_f1: 0.6255
 epoch: 28, train_loss: 0.7808, test_loss: 1.0197, test_f1: 0.5698
 epoch: 29, train_loss: 0.7689, test_loss: 0.9966, test_f1: 0.6175
 epoch: 30, train_loss: 0.7789, test_loss: 1.1001, test_f1: 0.5476
 epoch: 31, train_loss: 0.7652, test_loss: 1.2072, test_f1: 0.5513
 epoch: 32, train_loss: 0.7748, test_loss: 1.1628, test_f1: 0.6089
 epoch: 33, train_loss: 0.7391, test_loss: 1.2325, test_f1: 0.6240
 epoch: 34, train_loss: 0.7743, test_loss: 0.9985, test_f1: 0.5726
 epoch: 35, train_loss: 0.7448, test_loss: 1.2301, test_f1: 0.5630
 epoch: 36, train_loss: 0.7262, test_loss: 1.2064, test_f1: 0.5341
 epoch: 37, train_loss: 0.7196, test_loss: 1.1567, test_f1: 0.5725
 epoch: 38, train_loss: 0.7242, test_loss: 1.1339, test_f1: 0.6337
 epoch: 39, train_loss: 0.7202, test_loss: 1.0752, test_f1: 0.5558
 epoch: 40, train_loss: 0.7198, test_loss: 1.1183, test_f1: 0.5588
 epoch: 41, train_loss: 0.7036, test_loss: 1.2010, test_f1: 0.5932
 epoch: 42, train_loss: 0.7359, test_loss: 1.0573, test_f1: 0.5983
 epoch: 43, train_loss: 0.7025, test_loss: 1.1732, test_f1: 0.5737
 epoch: 44, train_loss: 0.6833, test_loss: 1.1772, test_f1: 0.5684
 epoch: 45, train_loss: 0.6747, test_loss: 1.1060, test_f1: 0.6106
 epoch: 46, train_loss: 0.6761, test_loss: 1.1390, test_f1: 0.6080
 epoch: 47, train_loss: 0.6553, test_loss: 1.4114, test_f1: 0.5891
 epoch: 48, train_loss: 0.6598, test_loss: 1.1621, test_f1: 0.5788
 epoch: 49, train_loss: 0.6778, test_loss: 1.1909, test_f1: 0.5550
 epoch: 50, train_loss: 0.6638, test_loss: 1.1379, test_f1: 0.5976
 epoch: 51, train_loss: 0.6125, test_loss: 1.2249, test_f1: 0.6395
 epoch: 52, train_loss: 0.5817, test_loss: 1.2323, test_f1: 0.6194
 epoch: 53, train_loss: 0.6155, test_loss: 1.3081, test_f1: 0.5184
 epoch: 54, train_loss: 0.5764, test_loss: 1.3134, test_f1: 0.6084
 epoch: 55, train_loss: 0.5858, test_loss: 1.3625, test_f1: 0.5934
 epoch: 56, train_loss: 0.5766, test_loss: 1.5227, test_f1: 0.6091
 epoch: 57, train_loss: 0.5722, test_loss: 1.3358, test_f1: 0.5908
 epoch: 58, train_loss: 0.5642, test_loss: 1.3690, test_f1: 0.5920
 epoch: 59, train_loss: 0.5785, test_loss: 1.2905, test_f1: 0.5952
 epoch: 60, train_loss: 0.5687, test_loss: 1.3247, test_f1: 0.6221
 epoch: 61, train_loss: 0.5596, test_loss: 1.2873, test_f1: 0.6169
 epoch: 62, train_loss: 0.5639, test_loss: 1.3391, test_f1: 0.5505
 epoch: 63, train_loss: 0.5373, test_loss: 1.3858, test_f1: 0.6403
 epoch: 64, train_loss: 0.5317, test_loss: 1.4961, test_f1: 0.5874
 epoch: 65, train_loss: 0.5017, test_loss: 1.4569, test_f1: 0.6596
 epoch: 66, train_loss: 0.5356, test_loss: 1.3636, test_f1: 0.6204
 epoch: 67, train_loss: 0.5250, test_loss: 1.3755, test_f1: 0.6185
 epoch: 68, train_loss: 0.5227, test_loss: 1.3702, test_f1: 0.6294
 epoch: 69, train_loss: 0.5397, test_loss: 1.3324, test_f1: 0.5941
 epoch: 70, train_loss: 0.5263, test_loss: 1.5088, test_f1: 0.5913
 epoch: 71, train_loss: 0.5443, test_loss: 1.2858, test_f1: 0.5925
 epoch: 72, train_loss: 0.4889, test_loss: 1.3863, test_f1: 0.6115
 epoch: 73, train_loss: 0.5016, test_loss: 1.6733, test_f1: 0.5792
 epoch: 74, train_loss: 0.5287, test_loss: 1.4398, test_f1: 0.5665
 epoch: 75, train_loss: 0.5319, test_loss: 1.3168, test_f1: 0.5780
 epoch: 76, train_loss: 0.5078, test_loss: 1.3838, test_f1: 0.6234
 epoch: 77, train_loss: 0.4562, test_loss: 1.4514, test_f1: 0.6047
 epoch: 78, train_loss: 0.4981, test_loss: 1.3603, test_f1: 0.6183
 epoch: 79, train_loss: 0.4538, test_loss: 1.4249, test_f1: 0.6388
 epoch: 80, train_loss: 0.4885, test_loss: 1.4975, test_f1: 0.6150
 epoch: 81, train_loss: 0.4543, test_loss: 1.5035, test_f1: 0.5929
 epoch: 82, train_loss: 0.4610, test_loss: 1.4523, test_f1: 0.5983
 epoch: 83, train_loss: 0.4651, test_loss: 1.5103, test_f1: 0.5900
 epoch: 84, train_loss: 0.4710, test_loss: 1.5610, test_f1: 0.6209
 epoch: 85, train_loss: 0.4427, test_loss: 1.6466, test_f1: 0.6046
 epoch: 86, train_loss: 0.4361, test_loss: 1.6075, test_f1: 0.6113
 epoch: 87, train_loss: 0.4719, test_loss: 1.5365, test_f1: 0.6113
 epoch: 88, train_loss: 0.4565, test_loss: 1.3448, test_f1: 0.6216
 epoch: 89, train_loss: 0.4590, test_loss: 1.6356, test_f1: 0.6026
 epoch: 90, train_loss: 0.4780, test_loss: 1.8214, test_f1: 0.6169
 epoch: 91, train_loss: 0.4634, test_loss: 1.7197, test_f1: 0.6166
 epoch: 92, train_loss: 0.4228, test_loss: 1.7942, test_f1: 0.5867
 epoch: 93, train_loss: 0.4697, test_loss: 1.8038, test_f1: 0.5918
 epoch: 94, train_loss: 0.4480, test_loss: 1.6153, test_f1: 0.6168
 epoch: 95, train_loss: 0.4413, test_loss: 1.6602, test_f1: 0.6486
 epoch: 96, train_loss: 0.4150, test_loss: 1.9415, test_f1: 0.5990
 epoch: 97, train_loss: 0.4284, test_loss: 1.7287, test_f1: 0.6249
 epoch: 98, train_loss: 0.4225, test_loss: 1.7312, test_f1: 0.6589
 epoch: 99, train_loss: 0.4635, test_loss: 1.7725, test_f1: 0.6057
##################ITERATION #1 ****************************************
 epoch: 0, train_loss: 1.2180, test_loss: 1.2789, test_f1: 0.3484
 epoch: 1, train_loss: 1.1168, test_loss: 1.1548, test_f1: 0.3388
 epoch: 2, train_loss: 1.0411, test_loss: 1.1282, test_f1: 0.4797
 epoch: 3, train_loss: 1.0042, test_loss: 1.1181, test_f1: 0.4921
 epoch: 4, train_loss: 0.9852, test_loss: 1.0985, test_f1: 0.5190
 epoch: 5, train_loss: 0.9491, test_loss: 1.0578, test_f1: 0.5578
 epoch: 6, train_loss: 0.9214, test_loss: 1.0227, test_f1: 0.4770
 epoch: 7, train_loss: 0.8965, test_loss: 0.9865, test_f1: 0.4992
 epoch: 8, train_loss: 0.9094, test_loss: 1.2794, test_f1: 0.4513
 epoch: 9, train_loss: 0.8786, test_loss: 1.5108, test_f1: 0.4235
 epoch: 10, train_loss: 0.8800, test_loss: 0.9868, test_f1: 0.5067
 epoch: 11, train_loss: 0.8929, test_loss: 1.0955, test_f1: 0.5264
 epoch: 12, train_loss: 0.8822, test_loss: 1.0230, test_f1: 0.4445
 epoch: 13, train_loss: 0.8579, test_loss: 0.9994, test_f1: 0.4402
 epoch: 14, train_loss: 0.8487, test_loss: 1.0382, test_f1: 0.5730
 epoch: 15, train_loss: 0.8360, test_loss: 0.9781, test_f1: 0.5509
 epoch: 16, train_loss: 0.8326, test_loss: 1.0648, test_f1: 0.5342
 epoch: 17, train_loss: 0.8400, test_loss: 1.0607, test_f1: 0.5911
 epoch: 18, train_loss: 0.8305, test_loss: 1.0929, test_f1: 0.5988
 epoch: 19, train_loss: 0.8426, test_loss: 1.1929, test_f1: 0.5740
 epoch: 20, train_loss: 0.8234, test_loss: 1.0341, test_f1: 0.5806
 epoch: 21, train_loss: 0.8088, test_loss: 1.2342, test_f1: 0.4838
 epoch: 22, train_loss: 0.8129, test_loss: 1.0848, test_f1: 0.5656
 epoch: 23, train_loss: 0.7831, test_loss: 0.9952, test_f1: 0.6012
 epoch: 24, train_loss: 0.7651, test_loss: 0.9768, test_f1: 0.5393
 epoch: 25, train_loss: 0.8038, test_loss: 1.1064, test_f1: 0.5756
 epoch: 26, train_loss: 0.8069, test_loss: 0.9812, test_f1: 0.6097
 epoch: 27, train_loss: 0.7960, test_loss: 1.0023, test_f1: 0.5683
 epoch: 28, train_loss: 0.8175, test_loss: 1.1389, test_f1: 0.5894
 epoch: 29, train_loss: 0.7873, test_loss: 1.0817, test_f1: 0.5722
 epoch: 30, train_loss: 0.7560, test_loss: 1.1860, test_f1: 0.6186
 epoch: 31, train_loss: 0.7561, test_loss: 1.0301, test_f1: 0.5825
 epoch: 32, train_loss: 0.7508, test_loss: 1.2110, test_f1: 0.5394
 epoch: 33, train_loss: 0.7795, test_loss: 1.0095, test_f1: 0.6088
 epoch: 34, train_loss: 0.7600, test_loss: 0.9832, test_f1: 0.5835
 epoch: 35, train_loss: 0.7534, test_loss: 1.0668, test_f1: 0.5589
 epoch: 36, train_loss: 0.7473, test_loss: 1.2407, test_f1: 0.5460
 epoch: 37, train_loss: 0.7380, test_loss: 1.2460, test_f1: 0.6290
 epoch: 38, train_loss: 0.7507, test_loss: 1.0149, test_f1: 0.5293
 epoch: 39, train_loss: 0.7515, test_loss: 1.1195, test_f1: 0.5425
 epoch: 40, train_loss: 0.7142, test_loss: 1.1293, test_f1: 0.5880
 epoch: 41, train_loss: 0.7242, test_loss: 1.3545, test_f1: 0.6323
 epoch: 42, train_loss: 0.7272, test_loss: 1.1173, test_f1: 0.6172
 epoch: 43, train_loss: 0.7073, test_loss: 1.1370, test_f1: 0.6526
 epoch: 44, train_loss: 0.7134, test_loss: 1.2781, test_f1: 0.6303
 epoch: 45, train_loss: 0.6821, test_loss: 1.1945, test_f1: 0.5858
 epoch: 46, train_loss: 0.6940, test_loss: 1.1473, test_f1: 0.5707
 epoch: 47, train_loss: 0.7435, test_loss: 1.0922, test_f1: 0.5627
 epoch: 48, train_loss: 0.7496, test_loss: 1.1101, test_f1: 0.5707
 epoch: 49, train_loss: 0.7843, test_loss: 1.0364, test_f1: 0.5366
 epoch: 50, train_loss: 0.7342, test_loss: 1.2985, test_f1: 0.4953
 epoch: 51, train_loss: 0.6682, test_loss: 1.0880, test_f1: 0.5507
 epoch: 52, train_loss: 0.6396, test_loss: 1.1630, test_f1: 0.5911
 epoch: 53, train_loss: 0.6343, test_loss: 1.1949, test_f1: 0.5696
 epoch: 54, train_loss: 0.6204, test_loss: 1.2017, test_f1: 0.5969
 epoch: 55, train_loss: 0.6357, test_loss: 1.2528, test_f1: 0.5992
 epoch: 56, train_loss: 0.6266, test_loss: 1.2765, test_f1: 0.5437
 epoch: 57, train_loss: 0.6050, test_loss: 1.2555, test_f1: 0.5484
 epoch: 58, train_loss: 0.6177, test_loss: 1.3067, test_f1: 0.5393
 epoch: 59, train_loss: 0.6166, test_loss: 1.2927, test_f1: 0.5754
 epoch: 60, train_loss: 0.6117, test_loss: 1.3320, test_f1: 0.5746
 epoch: 61, train_loss: 0.6016, test_loss: 1.4188, test_f1: 0.5967
 epoch: 62, train_loss: 0.5827, test_loss: 1.3841, test_f1: 0.6038
 epoch: 63, train_loss: 0.5989, test_loss: 1.2926, test_f1: 0.6403
 epoch: 64, train_loss: 0.5767, test_loss: 1.4218, test_f1: 0.5694
 epoch: 65, train_loss: 0.5835, test_loss: 1.3792, test_f1: 0.5884
 epoch: 66, train_loss: 0.5695, test_loss: 1.5791, test_f1: 0.5451
 epoch: 67, train_loss: 0.5768, test_loss: 1.6779, test_f1: 0.5291
 epoch: 68, train_loss: 0.6887, test_loss: 1.2288, test_f1: 0.6378
 epoch: 69, train_loss: 0.5916, test_loss: 1.4277, test_f1: 0.6148
 epoch: 70, train_loss: 0.5644, test_loss: 1.5039, test_f1: 0.5757
 epoch: 71, train_loss: 0.5756, test_loss: 1.4526, test_f1: 0.5916
 epoch: 72, train_loss: 0.5615, test_loss: 1.5413, test_f1: 0.5610
 epoch: 73, train_loss: 0.5606, test_loss: 1.6002, test_f1: 0.6179
 epoch: 74, train_loss: 0.5466, test_loss: 1.4608, test_f1: 0.5899
 epoch: 75, train_loss: 0.5347, test_loss: 1.4994, test_f1: 0.5863
 epoch: 76, train_loss: 0.5677, test_loss: 1.6480, test_f1: 0.5793
 epoch: 77, train_loss: 0.5468, test_loss: 1.5966, test_f1: 0.6093
 epoch: 78, train_loss: 0.5244, test_loss: 1.6785, test_f1: 0.5534
 epoch: 79, train_loss: 0.5447, test_loss: 1.5900, test_f1: 0.5954
 epoch: 80, train_loss: 0.5472, test_loss: 1.4724, test_f1: 0.5865
 epoch: 81, train_loss: 0.5310, test_loss: 1.6634, test_f1: 0.5587
 epoch: 82, train_loss: 0.5169, test_loss: 1.7734, test_f1: 0.5637
 epoch: 83, train_loss: 0.4995, test_loss: 1.8952, test_f1: 0.5901
 epoch: 84, train_loss: 0.5025, test_loss: 1.8789, test_f1: 0.5677
 epoch: 85, train_loss: 0.4948, test_loss: 1.8124, test_f1: 0.5907
 epoch: 86, train_loss: 0.5141, test_loss: 1.8989, test_f1: 0.5894
 epoch: 87, train_loss: 0.5135, test_loss: 1.8274, test_f1: 0.6083
 epoch: 88, train_loss: 0.5103, test_loss: 1.9635, test_f1: 0.5242
 epoch: 89, train_loss: 0.4978, test_loss: 1.7498, test_f1: 0.5701
 epoch: 90, train_loss: 0.4685, test_loss: 1.7745, test_f1: 0.5832
 epoch: 91, train_loss: 0.4843, test_loss: 1.8022, test_f1: 0.5587
 epoch: 92, train_loss: 0.4839, test_loss: 1.8436, test_f1: 0.5998
 epoch: 93, train_loss: 0.4945, test_loss: 2.2604, test_f1: 0.5703
 epoch: 94, train_loss: 0.4491, test_loss: 2.4356, test_f1: 0.5781
 epoch: 95, train_loss: 0.4823, test_loss: 2.2218, test_f1: 0.5880
 epoch: 96, train_loss: 0.4926, test_loss: 1.9988, test_f1: 0.5273
 epoch: 97, train_loss: 0.4988, test_loss: 1.7674, test_f1: 0.5499
 epoch: 98, train_loss: 0.4403, test_loss: 2.0347, test_f1: 0.5604
 epoch: 99, train_loss: 0.4678, test_loss: 2.0231, test_f1: 0.5753
##################ITERATION #2 ****************************************
 epoch: 0, train_loss: 1.2047, test_loss: 1.2545, test_f1: 0.3485
 epoch: 1, train_loss: 1.0736, test_loss: 1.1189, test_f1: 0.4970
 epoch: 2, train_loss: 0.9782, test_loss: 1.1498, test_f1: 0.4722
 epoch: 3, train_loss: 0.9524, test_loss: 1.0343, test_f1: 0.5493
 epoch: 4, train_loss: 0.9142, test_loss: 1.0249, test_f1: 0.5720
 epoch: 5, train_loss: 0.8870, test_loss: 1.1991, test_f1: 0.4502
 epoch: 6, train_loss: 0.8831, test_loss: 1.0315, test_f1: 0.5473
 epoch: 7, train_loss: 0.8624, test_loss: 0.9641, test_f1: 0.5673
 epoch: 8, train_loss: 0.8511, test_loss: 1.7455, test_f1: 0.4221
 epoch: 9, train_loss: 0.8749, test_loss: 1.1050, test_f1: 0.5271
 epoch: 10, train_loss: 0.8500, test_loss: 1.0326, test_f1: 0.5599
 epoch: 11, train_loss: 0.8328, test_loss: 1.1166, test_f1: 0.4592
 epoch: 12, train_loss: 0.8343, test_loss: 1.0266, test_f1: 0.5103
 epoch: 13, train_loss: 0.8404, test_loss: 1.0377, test_f1: 0.5621
 epoch: 14, train_loss: 0.8299, test_loss: 1.0201, test_f1: 0.5908
 epoch: 15, train_loss: 0.8242, test_loss: 1.0816, test_f1: 0.5761
 epoch: 16, train_loss: 0.8054, test_loss: 1.1483, test_f1: 0.5438
 epoch: 17, train_loss: 0.8124, test_loss: 1.2062, test_f1: 0.5581
 epoch: 18, train_loss: 0.7974, test_loss: 1.5748, test_f1: 0.5493
 epoch: 19, train_loss: 0.8409, test_loss: 1.2021, test_f1: 0.5337
 epoch: 20, train_loss: 0.7810, test_loss: 1.1158, test_f1: 0.5776
 epoch: 21, train_loss: 0.8106, test_loss: 1.0767, test_f1: 0.5870
 epoch: 22, train_loss: 0.7669, test_loss: 1.1497, test_f1: 0.5412
 epoch: 23, train_loss: 0.7534, test_loss: 1.4230, test_f1: 0.4396
 epoch: 24, train_loss: 0.7964, test_loss: 1.1625, test_f1: 0.5358
 epoch: 25, train_loss: 0.8182, test_loss: 1.0825, test_f1: 0.5810
 epoch: 26, train_loss: 0.7510, test_loss: 1.1805, test_f1: 0.5978
 epoch: 27, train_loss: 0.7515, test_loss: 1.2565, test_f1: 0.5555
 epoch: 28, train_loss: 0.8033, test_loss: 1.1181, test_f1: 0.4974
 epoch: 29, train_loss: 0.7405, test_loss: 1.0845, test_f1: 0.5933
 epoch: 30, train_loss: 0.7386, test_loss: 1.0368, test_f1: 0.6116
 epoch: 31, train_loss: 0.7504, test_loss: 1.1633, test_f1: 0.5580
 epoch: 32, train_loss: 0.7041, test_loss: 1.0951, test_f1: 0.5701
 epoch: 33, train_loss: 0.6989, test_loss: 1.3147, test_f1: 0.5457
 epoch: 34, train_loss: 0.6984, test_loss: 1.0946, test_f1: 0.5711
 epoch: 35, train_loss: 0.7280, test_loss: 1.1697, test_f1: 0.6249
 epoch: 36, train_loss: 0.7097, test_loss: 1.1085, test_f1: 0.6121
 epoch: 37, train_loss: 0.7034, test_loss: 1.1083, test_f1: 0.6328
 epoch: 38, train_loss: 0.7007, test_loss: 1.1520, test_f1: 0.5653
 epoch: 39, train_loss: 0.6761, test_loss: 1.2093, test_f1: 0.5827
 epoch: 40, train_loss: 0.6785, test_loss: 1.4330, test_f1: 0.4997
 epoch: 41, train_loss: 0.6754, test_loss: 1.0651, test_f1: 0.5880
 epoch: 42, train_loss: 0.6786, test_loss: 1.0230, test_f1: 0.6204
 epoch: 43, train_loss: 0.6729, test_loss: 1.1768, test_f1: 0.5392
 epoch: 44, train_loss: 0.6607, test_loss: 1.2064, test_f1: 0.5627
 epoch: 45, train_loss: 0.6484, test_loss: 1.1925, test_f1: 0.5808
 epoch: 46, train_loss: 0.6690, test_loss: 1.1244, test_f1: 0.5998
 epoch: 47, train_loss: 0.6527, test_loss: 1.4860, test_f1: 0.5323
 epoch: 48, train_loss: 0.6623, test_loss: 1.3518, test_f1: 0.5899
 epoch: 49, train_loss: 0.6500, test_loss: 1.2978, test_f1: 0.5371
 epoch: 50, train_loss: 0.6467, test_loss: 1.0926, test_f1: 0.5911
 epoch: 51, train_loss: 0.6214, test_loss: 1.1575, test_f1: 0.5601
 epoch: 52, train_loss: 0.5809, test_loss: 1.2002, test_f1: 0.5934
 epoch: 53, train_loss: 0.5750, test_loss: 1.2038, test_f1: 0.5924
 epoch: 54, train_loss: 0.5646, test_loss: 1.4262, test_f1: 0.5543
 epoch: 55, train_loss: 0.5748, test_loss: 1.3652, test_f1: 0.5931
 epoch: 56, train_loss: 0.5526, test_loss: 1.4460, test_f1: 0.5542
 epoch: 57, train_loss: 0.5468, test_loss: 1.4519, test_f1: 0.5437
 epoch: 58, train_loss: 0.5312, test_loss: 1.3562, test_f1: 0.5884
 epoch: 59, train_loss: 0.5235, test_loss: 1.3726, test_f1: 0.5823
 epoch: 60, train_loss: 0.5170, test_loss: 1.4624, test_f1: 0.5610
 epoch: 61, train_loss: 0.5400, test_loss: 1.4164, test_f1: 0.5711
 epoch: 62, train_loss: 0.5438, test_loss: 1.4891, test_f1: 0.5676
 epoch: 63, train_loss: 0.5255, test_loss: 1.3773, test_f1: 0.6029
 epoch: 64, train_loss: 0.5373, test_loss: 1.4029, test_f1: 0.6125
 epoch: 65, train_loss: 0.4984, test_loss: 1.5637, test_f1: 0.5514
 epoch: 66, train_loss: 0.4709, test_loss: 1.4093, test_f1: 0.5816
 epoch: 67, train_loss: 0.4883, test_loss: 1.7579, test_f1: 0.5537
 epoch: 68, train_loss: 0.4860, test_loss: 1.7330, test_f1: 0.5765
 epoch: 69, train_loss: 0.5015, test_loss: 1.7611, test_f1: 0.5742
 epoch: 70, train_loss: 0.4743, test_loss: 1.5677, test_f1: 0.5831
 epoch: 71, train_loss: 0.5333, test_loss: 1.4534, test_f1: 0.6316
 epoch: 72, train_loss: 0.4982, test_loss: 1.5217, test_f1: 0.6056
 epoch: 73, train_loss: 0.4863, test_loss: 1.4681, test_f1: 0.5913
 epoch: 74, train_loss: 0.5002, test_loss: 1.5320, test_f1: 0.5731
 epoch: 75, train_loss: 0.4977, test_loss: 1.6739, test_f1: 0.5771
 epoch: 76, train_loss: 0.4629, test_loss: 1.7213, test_f1: 0.5792
 epoch: 77, train_loss: 0.4515, test_loss: 1.7340, test_f1: 0.5868
 epoch: 78, train_loss: 0.4864, test_loss: 1.4406, test_f1: 0.6191
 epoch: 79, train_loss: 0.4569, test_loss: 1.8279, test_f1: 0.5436
 epoch: 80, train_loss: 0.4521, test_loss: 1.6721, test_f1: 0.5770
 epoch: 81, train_loss: 0.4177, test_loss: 1.8908, test_f1: 0.5929
 epoch: 82, train_loss: 0.4498, test_loss: 1.7648, test_f1: 0.5919
 epoch: 83, train_loss: 0.4710, test_loss: 1.7175, test_f1: 0.5527
 epoch: 84, train_loss: 0.4335, test_loss: 1.7635, test_f1: 0.5984
 epoch: 85, train_loss: 0.4360, test_loss: 1.9638, test_f1: 0.5950
 epoch: 86, train_loss: 0.4132, test_loss: 2.0064, test_f1: 0.5775
 epoch: 87, train_loss: 0.4105, test_loss: 1.9734, test_f1: 0.5554
 epoch: 88, train_loss: 0.4407, test_loss: 1.6869, test_f1: 0.5880
 epoch: 89, train_loss: 0.4285, test_loss: 1.9448, test_f1: 0.5863
 epoch: 90, train_loss: 0.4009, test_loss: 1.9057, test_f1: 0.5848
 epoch: 91, train_loss: 0.4401, test_loss: 2.1232, test_f1: 0.6080
 epoch: 92, train_loss: 0.4414, test_loss: 1.7230, test_f1: 0.5995
 epoch: 93, train_loss: 0.4230, test_loss: 2.0229, test_f1: 0.5717
 epoch: 94, train_loss: 0.3946, test_loss: 1.9854, test_f1: 0.5977
 epoch: 95, train_loss: 0.3761, test_loss: 2.1294, test_f1: 0.5970
 epoch: 96, train_loss: 0.4559, test_loss: 2.0060, test_f1: 0.5888
 epoch: 97, train_loss: 0.4808, test_loss: 1.8221, test_f1: 0.5809
 epoch: 98, train_loss: 0.6017, test_loss: 1.3934, test_f1: 0.6110
 epoch: 99, train_loss: 0.4550, test_loss: 1.7915, test_f1: 0.5930
##################ITERATION #3 ****************************************
 epoch: 0, train_loss: 1.2278, test_loss: 1.4815, test_f1: 0.3005
 epoch: 1, train_loss: 1.1319, test_loss: 1.1969, test_f1: 0.4119
 epoch: 2, train_loss: 1.0681, test_loss: 1.2537, test_f1: 0.3545
 epoch: 3, train_loss: 1.0567, test_loss: 1.1395, test_f1: 0.4230
 epoch: 4, train_loss: 1.0245, test_loss: 1.1456, test_f1: 0.5019
 epoch: 5, train_loss: 0.9612, test_loss: 0.9887, test_f1: 0.5322
 epoch: 6, train_loss: 0.9149, test_loss: 1.0289, test_f1: 0.5132
 epoch: 7, train_loss: 0.9081, test_loss: 1.0612, test_f1: 0.5161
 epoch: 8, train_loss: 0.8968, test_loss: 0.9975, test_f1: 0.5470
 epoch: 9, train_loss: 0.8728, test_loss: 1.0042, test_f1: 0.5542
 epoch: 10, train_loss: 0.8927, test_loss: 1.0200, test_f1: 0.5200
 epoch: 11, train_loss: 0.8617, test_loss: 1.2557, test_f1: 0.5071
 epoch: 12, train_loss: 0.8494, test_loss: 1.0941, test_f1: 0.5452
 epoch: 13, train_loss: 0.8866, test_loss: 1.0987, test_f1: 0.5652
 epoch: 14, train_loss: 0.8359, test_loss: 1.0090, test_f1: 0.5968
 epoch: 15, train_loss: 0.8383, test_loss: 1.0011, test_f1: 0.5706
 epoch: 16, train_loss: 0.8260, test_loss: 1.0198, test_f1: 0.5873
 epoch: 17, train_loss: 0.8383, test_loss: 1.0974, test_f1: 0.5195
 epoch: 18, train_loss: 0.8052, test_loss: 1.0554, test_f1: 0.5554
 epoch: 19, train_loss: 0.7938, test_loss: 0.9805, test_f1: 0.5460
 epoch: 20, train_loss: 0.8016, test_loss: 0.9880, test_f1: 0.5987
 epoch: 21, train_loss: 0.8042, test_loss: 0.9916, test_f1: 0.5761
 epoch: 22, train_loss: 0.8069, test_loss: 1.0784, test_f1: 0.5730
 epoch: 23, train_loss: 0.7814, test_loss: 1.0920, test_f1: 0.5466
 epoch: 24, train_loss: 0.7779, test_loss: 1.0952, test_f1: 0.5465
 epoch: 25, train_loss: 0.7971, test_loss: 1.0246, test_f1: 0.5814
 epoch: 26, train_loss: 0.7486, test_loss: 1.2022, test_f1: 0.5343
 epoch: 27, train_loss: 0.7522, test_loss: 1.1054, test_f1: 0.5836
 epoch: 28, train_loss: 0.7615, test_loss: 1.0597, test_f1: 0.6216
 epoch: 29, train_loss: 0.7573, test_loss: 1.2250, test_f1: 0.6200
 epoch: 30, train_loss: 0.7830, test_loss: 1.1102, test_f1: 0.5251
 epoch: 31, train_loss: 0.8478, test_loss: 1.0562, test_f1: 0.5194
 epoch: 32, train_loss: 0.7846, test_loss: 1.0970, test_f1: 0.5767
 epoch: 33, train_loss: 0.7569, test_loss: 1.1347, test_f1: 0.5972
 epoch: 34, train_loss: 0.7624, test_loss: 1.3626, test_f1: 0.5774
 epoch: 35, train_loss: 0.7435, test_loss: 1.0391, test_f1: 0.5514
 epoch: 36, train_loss: 0.7358, test_loss: 1.1630, test_f1: 0.5713
 epoch: 37, train_loss: 0.7384, test_loss: 1.1898, test_f1: 0.6019
 epoch: 38, train_loss: 0.7393, test_loss: 1.2598, test_f1: 0.4947
 epoch: 39, train_loss: 0.7207, test_loss: 1.0093, test_f1: 0.5956
 epoch: 40, train_loss: 0.7041, test_loss: 1.1274, test_f1: 0.5209
 epoch: 41, train_loss: 0.7115, test_loss: 1.2939, test_f1: 0.6032
 epoch: 42, train_loss: 0.7030, test_loss: 1.3630, test_f1: 0.5563
 epoch: 43, train_loss: 0.7202, test_loss: 1.6671, test_f1: 0.5383
 epoch: 44, train_loss: 0.6982, test_loss: 1.1023, test_f1: 0.5774
 epoch: 45, train_loss: 0.6893, test_loss: 1.5487, test_f1: 0.5428
 epoch: 46, train_loss: 0.7041, test_loss: 1.2310, test_f1: 0.5847
 epoch: 47, train_loss: 0.6891, test_loss: 1.2931, test_f1: 0.6279
 epoch: 48, train_loss: 0.6808, test_loss: 1.3322, test_f1: 0.5952
 epoch: 49, train_loss: 0.6908, test_loss: 1.3097, test_f1: 0.5626
 epoch: 50, train_loss: 0.7085, test_loss: 1.1864, test_f1: 0.5810
 epoch: 51, train_loss: 0.6568, test_loss: 1.3280, test_f1: 0.5902
 epoch: 52, train_loss: 0.6165, test_loss: 1.4302, test_f1: 0.5925
 epoch: 53, train_loss: 0.6170, test_loss: 1.4890, test_f1: 0.5457
 epoch: 54, train_loss: 0.6048, test_loss: 1.8793, test_f1: 0.5553
 epoch: 55, train_loss: 0.5821, test_loss: 1.9642, test_f1: 0.5907
 epoch: 56, train_loss: 0.6008, test_loss: 1.7376, test_f1: 0.5608
 epoch: 57, train_loss: 0.5740, test_loss: 1.9794, test_f1: 0.5818
 epoch: 58, train_loss: 0.5877, test_loss: 1.8769, test_f1: 0.5968
 epoch: 59, train_loss: 0.5740, test_loss: 1.6724, test_f1: 0.6071
 epoch: 60, train_loss: 0.5763, test_loss: 1.7527, test_f1: 0.5920
 epoch: 61, train_loss: 0.5545, test_loss: 1.9386, test_f1: 0.5372
 epoch: 62, train_loss: 0.5459, test_loss: 1.9359, test_f1: 0.5856
 epoch: 63, train_loss: 0.5517, test_loss: 1.9623, test_f1: 0.5553
 epoch: 64, train_loss: 0.5581, test_loss: 2.1190, test_f1: 0.5375
 epoch: 65, train_loss: 0.5505, test_loss: 1.9125, test_f1: 0.5665
 epoch: 66, train_loss: 0.5503, test_loss: 2.2281, test_f1: 0.5803
 epoch: 67, train_loss: 0.5301, test_loss: 2.2237, test_f1: 0.5780
 epoch: 68, train_loss: 0.5099, test_loss: 1.9312, test_f1: 0.5607
 epoch: 69, train_loss: 0.5110, test_loss: 2.1768, test_f1: 0.5704
 epoch: 70, train_loss: 0.5200, test_loss: 1.8959, test_f1: 0.5785
 epoch: 71, train_loss: 0.5373, test_loss: 2.0819, test_f1: 0.5279
 epoch: 72, train_loss: 0.5215, test_loss: 1.9897, test_f1: 0.5590
 epoch: 73, train_loss: 0.5140, test_loss: 2.2452, test_f1: 0.5428
 epoch: 74, train_loss: 0.5034, test_loss: 1.9156, test_f1: 0.5857
 epoch: 75, train_loss: 0.5182, test_loss: 1.9835, test_f1: 0.5714
 epoch: 76, train_loss: 0.4830, test_loss: 2.6550, test_f1: 0.5603
 epoch: 77, train_loss: 0.5104, test_loss: 2.1414, test_f1: 0.5350
 epoch: 78, train_loss: 0.4978, test_loss: 2.0320, test_f1: 0.5546
 epoch: 79, train_loss: 0.4761, test_loss: 2.3181, test_f1: 0.5530
 epoch: 80, train_loss: 0.4783, test_loss: 2.2620, test_f1: 0.5586
 epoch: 81, train_loss: 0.5106, test_loss: 2.0059, test_f1: 0.5690
 epoch: 82, train_loss: 0.4703, test_loss: 2.3065, test_f1: 0.5455
 epoch: 83, train_loss: 0.4693, test_loss: 2.7223, test_f1: 0.5711
 epoch: 84, train_loss: 0.4586, test_loss: 2.1170, test_f1: 0.5471
 epoch: 85, train_loss: 0.4723, test_loss: 2.1094, test_f1: 0.5537
 epoch: 86, train_loss: 0.4704, test_loss: 2.6085, test_f1: 0.5048
 epoch: 87, train_loss: 0.4694, test_loss: 2.2693, test_f1: 0.5206
 epoch: 88, train_loss: 0.4771, test_loss: 2.5405, test_f1: 0.5279
 epoch: 89, train_loss: 0.4650, test_loss: 2.4767, test_f1: 0.5267
 epoch: 90, train_loss: 0.4304, test_loss: 2.0850, test_f1: 0.5510
 epoch: 91, train_loss: 0.4564, test_loss: 2.6952, test_f1: 0.5643
 epoch: 92, train_loss: 0.4808, test_loss: 2.1338, test_f1: 0.5321
 epoch: 93, train_loss: 0.4333, test_loss: 2.3498, test_f1: 0.5516
 epoch: 94, train_loss: 0.4445, test_loss: 2.0547, test_f1: 0.5485
 epoch: 95, train_loss: 0.4519, test_loss: 2.3914, test_f1: 0.5526
 epoch: 96, train_loss: 0.4326, test_loss: 2.0659, test_f1: 0.5542
 epoch: 97, train_loss: 0.4320, test_loss: 2.2759, test_f1: 0.5555
 epoch: 98, train_loss: 0.4153, test_loss: 2.1101, test_f1: 0.5652
 epoch: 99, train_loss: 0.4489, test_loss: 2.5038, test_f1: 0.5587
##################ITERATION #4 ****************************************
 epoch: 0, train_loss: 1.2601, test_loss: 1.2528, test_f1: 0.3414
 epoch: 1, train_loss: 1.1018, test_loss: 1.1388, test_f1: 0.3515
 epoch: 2, train_loss: 1.0655, test_loss: 1.1447, test_f1: 0.4070
 epoch: 3, train_loss: 1.0002, test_loss: 1.0508, test_f1: 0.5691
 epoch: 4, train_loss: 0.9746, test_loss: 1.1184, test_f1: 0.5281
 epoch: 5, train_loss: 0.9451, test_loss: 1.1008, test_f1: 0.4538
 epoch: 6, train_loss: 0.9398, test_loss: 1.1049, test_f1: 0.4676
 epoch: 7, train_loss: 0.9071, test_loss: 1.0421, test_f1: 0.5632
 epoch: 8, train_loss: 0.9046, test_loss: 1.4306, test_f1: 0.3306
 epoch: 9, train_loss: 0.8969, test_loss: 1.2068, test_f1: 0.4449
 epoch: 10, train_loss: 0.8780, test_loss: 1.0802, test_f1: 0.5134
 epoch: 11, train_loss: 0.8716, test_loss: 1.1364, test_f1: 0.5081
 epoch: 12, train_loss: 0.8894, test_loss: 1.0016, test_f1: 0.5506
 epoch: 13, train_loss: 0.8813, test_loss: 1.0610, test_f1: 0.5281
 epoch: 14, train_loss: 0.8897, test_loss: 1.0522, test_f1: 0.4855
 epoch: 15, train_loss: 0.8828, test_loss: 1.0002, test_f1: 0.5334
 epoch: 16, train_loss: 0.8442, test_loss: 1.2389, test_f1: 0.3868
 epoch: 17, train_loss: 0.8561, test_loss: 1.1761, test_f1: 0.4397
 epoch: 18, train_loss: 0.8500, test_loss: 1.0797, test_f1: 0.4497
 epoch: 19, train_loss: 0.8594, test_loss: 1.0412, test_f1: 0.5550
 epoch: 20, train_loss: 0.8430, test_loss: 1.0920, test_f1: 0.5115
 epoch: 21, train_loss: 0.8272, test_loss: 1.0300, test_f1: 0.5595
 epoch: 22, train_loss: 0.8264, test_loss: 1.0095, test_f1: 0.5945
 epoch: 23, train_loss: 0.8199, test_loss: 0.9591, test_f1: 0.4600
 epoch: 24, train_loss: 0.8246, test_loss: 1.0586, test_f1: 0.6024
 epoch: 25, train_loss: 0.7971, test_loss: 1.0218, test_f1: 0.5310
 epoch: 26, train_loss: 0.8073, test_loss: 1.0303, test_f1: 0.5885
 epoch: 27, train_loss: 0.8295, test_loss: 1.0274, test_f1: 0.5601
 epoch: 28, train_loss: 0.8116, test_loss: 0.9991, test_f1: 0.5633
 epoch: 29, train_loss: 0.7953, test_loss: 1.2880, test_f1: 0.5102
 epoch: 30, train_loss: 0.7988, test_loss: 1.2922, test_f1: 0.5342
 epoch: 31, train_loss: 0.8231, test_loss: 1.1018, test_f1: 0.5316
 epoch: 32, train_loss: 0.8053, test_loss: 1.1116, test_f1: 0.5775
 epoch: 33, train_loss: 0.8168, test_loss: 1.1237, test_f1: 0.4869
 epoch: 34, train_loss: 0.7883, test_loss: 1.3164, test_f1: 0.5027
 epoch: 35, train_loss: 0.8368, test_loss: 1.3022, test_f1: 0.5475
 epoch: 36, train_loss: 0.7938, test_loss: 1.2182, test_f1: 0.5442
 epoch: 37, train_loss: 0.7983, test_loss: 1.1661, test_f1: 0.4728
 epoch: 38, train_loss: 0.8301, test_loss: 1.2220, test_f1: 0.4797
 epoch: 39, train_loss: 0.7931, test_loss: 1.0241, test_f1: 0.5879
 epoch: 40, train_loss: 0.7689, test_loss: 1.3177, test_f1: 0.5202
 epoch: 41, train_loss: 0.8099, test_loss: 1.3695, test_f1: 0.4648
 epoch: 42, train_loss: 0.7744, test_loss: 1.4660, test_f1: 0.4950
 epoch: 43, train_loss: 0.7904, test_loss: 1.4999, test_f1: 0.5232
 epoch: 44, train_loss: 0.7613, test_loss: 1.4026, test_f1: 0.4986
 epoch: 45, train_loss: 0.8051, test_loss: 1.2227, test_f1: 0.5286
 epoch: 46, train_loss: 0.8324, test_loss: 1.0852, test_f1: 0.5295
 epoch: 47, train_loss: 0.8105, test_loss: 1.1461, test_f1: 0.4743
 epoch: 48, train_loss: 0.7705, test_loss: 1.1382, test_f1: 0.5562
 epoch: 49, train_loss: 0.7538, test_loss: 1.3359, test_f1: 0.5551
 epoch: 50, train_loss: 0.7574, test_loss: 1.2880, test_f1: 0.5717
 epoch: 51, train_loss: 0.7274, test_loss: 1.2258, test_f1: 0.5870
 epoch: 52, train_loss: 0.7137, test_loss: 1.3430, test_f1: 0.5743
 epoch: 53, train_loss: 0.6976, test_loss: 1.3425, test_f1: 0.5894
 epoch: 54, train_loss: 0.7001, test_loss: 1.2358, test_f1: 0.5369
 epoch: 55, train_loss: 0.6905, test_loss: 1.4364, test_f1: 0.4849
 epoch: 56, train_loss: 0.6970, test_loss: 1.3017, test_f1: 0.5710
 epoch: 57, train_loss: 0.6811, test_loss: 1.4697, test_f1: 0.5764
 epoch: 58, train_loss: 0.6859, test_loss: 1.5193, test_f1: 0.5618
 epoch: 59, train_loss: 0.7112, test_loss: 1.1760, test_f1: 0.5690
 epoch: 60, train_loss: 0.6841, test_loss: 1.2309, test_f1: 0.5651
 epoch: 61, train_loss: 0.6786, test_loss: 1.2911, test_f1: 0.5937
 epoch: 62, train_loss: 0.6743, test_loss: 1.5048, test_f1: 0.5539
 epoch: 63, train_loss: 0.6679, test_loss: 1.1961, test_f1: 0.6262
 epoch: 64, train_loss: 0.6521, test_loss: 1.6319, test_f1: 0.5483
 epoch: 65, train_loss: 0.6679, test_loss: 1.2325, test_f1: 0.5872
 epoch: 66, train_loss: 0.6521, test_loss: 1.4023, test_f1: 0.6146
 epoch: 67, train_loss: 0.6315, test_loss: 1.7860, test_f1: 0.5393
 epoch: 68, train_loss: 0.6424, test_loss: 1.3316, test_f1: 0.5934
 epoch: 69, train_loss: 0.6468, test_loss: 1.2382, test_f1: 0.6250
 epoch: 70, train_loss: 0.6256, test_loss: 1.2836, test_f1: 0.6294
 epoch: 71, train_loss: 0.6378, test_loss: 1.4383, test_f1: 0.5942
 epoch: 72, train_loss: 0.6265, test_loss: 1.5220, test_f1: 0.6143
 epoch: 73, train_loss: 0.6096, test_loss: 1.4244, test_f1: 0.6526
 epoch: 74, train_loss: 0.6095, test_loss: 1.6133, test_f1: 0.5424
 epoch: 75, train_loss: 0.6279, test_loss: 1.4008, test_f1: 0.6288
 epoch: 76, train_loss: 0.6324, test_loss: 1.3663, test_f1: 0.5965
 epoch: 77, train_loss: 0.6102, test_loss: 1.2828, test_f1: 0.6371
 epoch: 78, train_loss: 0.6004, test_loss: 1.4381, test_f1: 0.6273
 epoch: 79, train_loss: 0.6005, test_loss: 1.3139, test_f1: 0.6274
 epoch: 80, train_loss: 0.5752, test_loss: 1.3293, test_f1: 0.5942
 epoch: 81, train_loss: 0.5809, test_loss: 1.4612, test_f1: 0.5977
 epoch: 82, train_loss: 0.5798, test_loss: 1.4829, test_f1: 0.6445
 epoch: 83, train_loss: 0.6066, test_loss: 1.7677, test_f1: 0.6033
 epoch: 84, train_loss: 0.5996, test_loss: 1.4936, test_f1: 0.6652
 epoch: 85, train_loss: 0.5770, test_loss: 1.7303, test_f1: 0.5852
 epoch: 86, train_loss: 0.5616, test_loss: 1.7190, test_f1: 0.6159
 epoch: 87, train_loss: 0.5587, test_loss: 1.3760, test_f1: 0.5973
 epoch: 88, train_loss: 0.5726, test_loss: 1.7156, test_f1: 0.5722
 epoch: 89, train_loss: 0.5790, test_loss: 1.6051, test_f1: 0.5537
 epoch: 90, train_loss: 0.5433, test_loss: 1.5201, test_f1: 0.5825
 epoch: 91, train_loss: 0.5691, test_loss: 1.4005, test_f1: 0.6297
 epoch: 92, train_loss: 0.5605, test_loss: 1.3454, test_f1: 0.6568
 epoch: 93, train_loss: 0.5471, test_loss: 1.6414, test_f1: 0.6143
 epoch: 94, train_loss: 0.5488, test_loss: 1.7732, test_f1: 0.6043
 epoch: 95, train_loss: 0.5126, test_loss: 1.5939, test_f1: 0.5827
 epoch: 96, train_loss: 0.5293, test_loss: 1.5870, test_f1: 0.5973
 epoch: 97, train_loss: 0.5570, test_loss: 1.7005, test_f1: 0.6170
 epoch: 98, train_loss: 0.5376, test_loss: 1.5830, test_f1: 0.5941
 epoch: 99, train_loss: 0.5239, test_loss: 1.6919, test_f1: 0.6037
##################ITERATION #5 ****************************************
 epoch: 0, train_loss: 1.2909, test_loss: 1.3125, test_f1: 0.2569
 epoch: 1, train_loss: 1.1015, test_loss: 1.2653, test_f1: 0.4977
 epoch: 2, train_loss: 1.0350, test_loss: 1.1161, test_f1: 0.5404
 epoch: 3, train_loss: 0.9733, test_loss: 1.1519, test_f1: 0.4545
 epoch: 4, train_loss: 0.9438, test_loss: 1.1444, test_f1: 0.3440
 epoch: 5, train_loss: 0.9748, test_loss: 1.0968, test_f1: 0.5408
 epoch: 6, train_loss: 0.9418, test_loss: 1.0597, test_f1: 0.5258
 epoch: 7, train_loss: 0.9288, test_loss: 1.0606, test_f1: 0.4319
 epoch: 8, train_loss: 0.8981, test_loss: 1.1398, test_f1: 0.4963
 epoch: 9, train_loss: 0.8965, test_loss: 1.0036, test_f1: 0.4466
 epoch: 10, train_loss: 0.8767, test_loss: 1.4543, test_f1: 0.4208
 epoch: 11, train_loss: 0.8891, test_loss: 1.0425, test_f1: 0.5429
 epoch: 12, train_loss: 0.8916, test_loss: 1.4962, test_f1: 0.4825
 epoch: 13, train_loss: 0.8955, test_loss: 1.1810, test_f1: 0.5062
 epoch: 14, train_loss: 0.8582, test_loss: 1.0235, test_f1: 0.5601
 epoch: 15, train_loss: 0.9044, test_loss: 1.0301, test_f1: 0.5547
 epoch: 16, train_loss: 0.8860, test_loss: 1.2784, test_f1: 0.5262
 epoch: 17, train_loss: 0.8804, test_loss: 1.2044, test_f1: 0.4520
 epoch: 18, train_loss: 0.8657, test_loss: 1.2933, test_f1: 0.4837
 epoch: 19, train_loss: 0.8619, test_loss: 0.9913, test_f1: 0.6134
 epoch: 20, train_loss: 0.8558, test_loss: 1.0833, test_f1: 0.5280
 epoch: 21, train_loss: 0.8648, test_loss: 1.1197, test_f1: 0.4851
 epoch: 22, train_loss: 0.8552, test_loss: 1.0741, test_f1: 0.4934
 epoch: 23, train_loss: 0.8222, test_loss: 1.4052, test_f1: 0.4564
 epoch: 24, train_loss: 0.8232, test_loss: 1.5927, test_f1: 0.4159
 epoch: 25, train_loss: 0.8215, test_loss: 1.0818, test_f1: 0.5601
 epoch: 26, train_loss: 0.8315, test_loss: 1.0801, test_f1: 0.5644
 epoch: 27, train_loss: 0.8411, test_loss: 1.0051, test_f1: 0.5560
 epoch: 28, train_loss: 0.8217, test_loss: 1.4183, test_f1: 0.5291
 epoch: 29, train_loss: 0.8035, test_loss: 1.3060, test_f1: 0.4696
 epoch: 30, train_loss: 0.8187, test_loss: 1.0400, test_f1: 0.5065
 epoch: 31, train_loss: 0.8240, test_loss: 1.1867, test_f1: 0.5359
 epoch: 32, train_loss: 0.8018, test_loss: 1.1457, test_f1: 0.5218
 epoch: 33, train_loss: 0.8285, test_loss: 1.0738, test_f1: 0.5561
 epoch: 34, train_loss: 0.8152, test_loss: 1.2354, test_f1: 0.5747
 epoch: 35, train_loss: 0.7944, test_loss: 1.0558, test_f1: 0.5650
 epoch: 36, train_loss: 0.7941, test_loss: 1.0951, test_f1: 0.5484
 epoch: 37, train_loss: 0.7800, test_loss: 1.2552, test_f1: 0.5347
 epoch: 38, train_loss: 0.7909, test_loss: 1.2770, test_f1: 0.5603
 epoch: 39, train_loss: 0.7786, test_loss: 1.2664, test_f1: 0.4836
 epoch: 40, train_loss: 0.7854, test_loss: 1.3720, test_f1: 0.5437
 epoch: 41, train_loss: 0.8120, test_loss: 1.3424, test_f1: 0.5736
 epoch: 42, train_loss: 0.7712, test_loss: 1.0470, test_f1: 0.5728
 epoch: 43, train_loss: 0.8059, test_loss: 1.3821, test_f1: 0.5366
 epoch: 44, train_loss: 0.7694, test_loss: 1.4016, test_f1: 0.5316
 epoch: 45, train_loss: 0.7786, test_loss: 1.1459, test_f1: 0.5753
 epoch: 46, train_loss: 0.7809, test_loss: 1.1559, test_f1: 0.5391
 epoch: 47, train_loss: 0.7712, test_loss: 1.0704, test_f1: 0.5067
 epoch: 48, train_loss: 0.7608, test_loss: 1.3480, test_f1: 0.5143
 epoch: 49, train_loss: 0.7677, test_loss: 1.2409, test_f1: 0.5766
 epoch: 50, train_loss: 0.8067, test_loss: 1.2258, test_f1: 0.5557
 epoch: 51, train_loss: 0.7613, test_loss: 1.1166, test_f1: 0.6068
 epoch: 52, train_loss: 0.7319, test_loss: 1.3311, test_f1: 0.5230
 epoch: 53, train_loss: 0.7228, test_loss: 1.3278, test_f1: 0.6144
 epoch: 54, train_loss: 0.7082, test_loss: 1.4753, test_f1: 0.5741
 epoch: 55, train_loss: 0.7010, test_loss: 1.5783, test_f1: 0.5470
 epoch: 56, train_loss: 0.7156, test_loss: 1.2780, test_f1: 0.5664
 epoch: 57, train_loss: 0.7082, test_loss: 1.5259, test_f1: 0.5303
 epoch: 58, train_loss: 0.7140, test_loss: 1.1925, test_f1: 0.5512
 epoch: 59, train_loss: 0.7067, test_loss: 1.2320, test_f1: 0.5549
 epoch: 60, train_loss: 0.7131, test_loss: 1.4608, test_f1: 0.5423
 epoch: 61, train_loss: 0.6901, test_loss: 1.2730, test_f1: 0.5894
 epoch: 62, train_loss: 0.6820, test_loss: 1.3919, test_f1: 0.5745
 epoch: 63, train_loss: 0.6765, test_loss: 1.4765, test_f1: 0.5330
 epoch: 64, train_loss: 0.6693, test_loss: 1.4451, test_f1: 0.5849
 epoch: 65, train_loss: 0.6751, test_loss: 1.3065, test_f1: 0.5776
 epoch: 66, train_loss: 0.6754, test_loss: 1.5309, test_f1: 0.5517
 epoch: 67, train_loss: 0.6617, test_loss: 1.5163, test_f1: 0.5414
 epoch: 68, train_loss: 0.6741, test_loss: 1.6007, test_f1: 0.5361
 epoch: 69, train_loss: 0.6476, test_loss: 1.3640, test_f1: 0.5589
 epoch: 70, train_loss: 0.6615, test_loss: 1.6626, test_f1: 0.5609
 epoch: 71, train_loss: 0.6725, test_loss: 1.3403, test_f1: 0.5739
 epoch: 72, train_loss: 0.6875, test_loss: 1.5226, test_f1: 0.5763
 epoch: 73, train_loss: 0.6860, test_loss: 1.5919, test_f1: 0.5410
 epoch: 74, train_loss: 0.6645, test_loss: 1.7264, test_f1: 0.5498
 epoch: 75, train_loss: 0.6560, test_loss: 1.5694, test_f1: 0.5872
 epoch: 76, train_loss: 0.6328, test_loss: 1.6360, test_f1: 0.5940
 epoch: 77, train_loss: 0.6568, test_loss: 1.6094, test_f1: 0.5738
 epoch: 78, train_loss: 0.6125, test_loss: 1.7242, test_f1: 0.5584
 epoch: 79, train_loss: 0.6124, test_loss: 2.0780, test_f1: 0.5564
 epoch: 80, train_loss: 0.6308, test_loss: 1.7264, test_f1: 0.5510
 epoch: 81, train_loss: 0.6148, test_loss: 1.7458, test_f1: 0.5855
 epoch: 82, train_loss: 0.6167, test_loss: 1.8251, test_f1: 0.6063
 epoch: 83, train_loss: 0.6174, test_loss: 1.9870, test_f1: 0.5871
 epoch: 84, train_loss: 0.6012, test_loss: 2.0443, test_f1: 0.5824
 epoch: 85, train_loss: 0.6154, test_loss: 1.8106, test_f1: 0.5947
 epoch: 86, train_loss: 0.6197, test_loss: 1.5238, test_f1: 0.5240
 epoch: 87, train_loss: 0.5866, test_loss: 1.8395, test_f1: 0.5643
 epoch: 88, train_loss: 0.5872, test_loss: 2.1449, test_f1: 0.5587
 epoch: 89, train_loss: 0.6190, test_loss: 1.7263, test_f1: 0.6088
 epoch: 90, train_loss: 0.6278, test_loss: 1.3905, test_f1: 0.5707
 epoch: 91, train_loss: 0.5778, test_loss: 1.7921, test_f1: 0.5810
 epoch: 92, train_loss: 0.6051, test_loss: 1.3840, test_f1: 0.5858
 epoch: 93, train_loss: 0.6046, test_loss: 1.6216, test_f1: 0.5526
 epoch: 94, train_loss: 0.5822, test_loss: 1.6990, test_f1: 0.5122
 epoch: 95, train_loss: 0.5670, test_loss: 1.7781, test_f1: 0.5747
 epoch: 96, train_loss: 0.5728, test_loss: 1.6168, test_f1: 0.5378
 epoch: 97, train_loss: 0.5658, test_loss: 1.8229, test_f1: 0.5769
 epoch: 98, train_loss: 0.5587, test_loss: 1.5520, test_f1: 0.6047
 epoch: 99, train_loss: 0.5602, test_loss: 1.7957, test_f1: 0.5713
##################ITERATION #6 ****************************************
 epoch: 0, train_loss: 1.2220, test_loss: 1.2204, test_f1: 0.3676
 epoch: 1, train_loss: 1.0975, test_loss: 1.2623, test_f1: 0.3862
 epoch: 2, train_loss: 1.0232, test_loss: 1.1702, test_f1: 0.4721
 epoch: 3, train_loss: 0.9646, test_loss: 1.1093, test_f1: 0.5333
 epoch: 4, train_loss: 0.9441, test_loss: 1.0587, test_f1: 0.4805
 epoch: 5, train_loss: 0.9114, test_loss: 1.0342, test_f1: 0.5539
 epoch: 6, train_loss: 0.9034, test_loss: 1.1661, test_f1: 0.4595
 epoch: 7, train_loss: 0.8837, test_loss: 1.0419, test_f1: 0.5300
 epoch: 8, train_loss: 0.8855, test_loss: 1.0423, test_f1: 0.5418
 epoch: 9, train_loss: 0.8741, test_loss: 1.0960, test_f1: 0.5001
 epoch: 10, train_loss: 0.8696, test_loss: 1.3651, test_f1: 0.3984
 epoch: 11, train_loss: 0.8790, test_loss: 1.2281, test_f1: 0.5577
 epoch: 12, train_loss: 0.8573, test_loss: 1.0731, test_f1: 0.5573
 epoch: 13, train_loss: 0.8657, test_loss: 1.1437, test_f1: 0.5580
 epoch: 14, train_loss: 0.8578, test_loss: 1.0934, test_f1: 0.5585
 epoch: 15, train_loss: 0.8429, test_loss: 1.1250, test_f1: 0.4848
 epoch: 16, train_loss: 0.8399, test_loss: 1.0956, test_f1: 0.5114
 epoch: 17, train_loss: 0.8200, test_loss: 1.4380, test_f1: 0.4038
 epoch: 18, train_loss: 0.8461, test_loss: 1.0754, test_f1: 0.5184
 epoch: 19, train_loss: 0.8421, test_loss: 1.1841, test_f1: 0.4435
 epoch: 20, train_loss: 0.8260, test_loss: 1.0386, test_f1: 0.5589
 epoch: 21, train_loss: 0.8096, test_loss: 1.0455, test_f1: 0.5543
 epoch: 22, train_loss: 0.8324, test_loss: 1.0828, test_f1: 0.5490
 epoch: 23, train_loss: 0.8394, test_loss: 1.0587, test_f1: 0.5635
 epoch: 24, train_loss: 0.8339, test_loss: 1.0905, test_f1: 0.5693
 epoch: 25, train_loss: 0.8258, test_loss: 1.0587, test_f1: 0.5452
 epoch: 26, train_loss: 0.8129, test_loss: 1.1937, test_f1: 0.5159
 epoch: 27, train_loss: 0.7987, test_loss: 1.0991, test_f1: 0.5536
 epoch: 28, train_loss: 0.7873, test_loss: 1.0844, test_f1: 0.5107
 epoch: 29, train_loss: 0.7998, test_loss: 1.2748, test_f1: 0.4756
 epoch: 30, train_loss: 0.8185, test_loss: 1.0333, test_f1: 0.5479
 epoch: 31, train_loss: 0.8005, test_loss: 1.1103, test_f1: 0.5687
 epoch: 32, train_loss: 0.7955, test_loss: 1.0574, test_f1: 0.5552
 epoch: 33, train_loss: 0.7856, test_loss: 1.0706, test_f1: 0.4795
 epoch: 34, train_loss: 0.8203, test_loss: 1.0935, test_f1: 0.5676
 epoch: 35, train_loss: 0.7912, test_loss: 1.3400, test_f1: 0.4776
 epoch: 36, train_loss: 0.8111, test_loss: 1.2818, test_f1: 0.5114
 epoch: 37, train_loss: 0.7901, test_loss: 1.3516, test_f1: 0.5354
 epoch: 38, train_loss: 0.7808, test_loss: 1.1547, test_f1: 0.5496
 epoch: 39, train_loss: 0.7613, test_loss: 1.1189, test_f1: 0.5412
 epoch: 40, train_loss: 0.7723, test_loss: 1.3419, test_f1: 0.4948
 epoch: 41, train_loss: 0.7673, test_loss: 1.0596, test_f1: 0.5779
 epoch: 42, train_loss: 0.7593, test_loss: 1.3759, test_f1: 0.5374
 epoch: 43, train_loss: 0.7710, test_loss: 1.0828, test_f1: 0.5565
 epoch: 44, train_loss: 0.7501, test_loss: 1.3702, test_f1: 0.5746
 epoch: 45, train_loss: 0.7420, test_loss: 1.3678, test_f1: 0.5131
 epoch: 46, train_loss: 0.7112, test_loss: 1.3115, test_f1: 0.5283
 epoch: 47, train_loss: 0.7110, test_loss: 1.1377, test_f1: 0.5979
 epoch: 48, train_loss: 0.7568, test_loss: 1.3089, test_f1: 0.5696
 epoch: 49, train_loss: 0.7293, test_loss: 1.7787, test_f1: 0.5486
 epoch: 50, train_loss: 0.7340, test_loss: 1.3258, test_f1: 0.4942
 epoch: 51, train_loss: 0.7726, test_loss: 1.1647, test_f1: 0.5483
 epoch: 52, train_loss: 0.7005, test_loss: 1.1689, test_f1: 0.5302
 epoch: 53, train_loss: 0.6687, test_loss: 1.2120, test_f1: 0.5706
 epoch: 54, train_loss: 0.6947, test_loss: 1.3910, test_f1: 0.6013
 epoch: 55, train_loss: 0.6689, test_loss: 1.3472, test_f1: 0.5513
 epoch: 56, train_loss: 0.6487, test_loss: 1.3071, test_f1: 0.5384
 epoch: 57, train_loss: 0.6342, test_loss: 1.2049, test_f1: 0.6134
 epoch: 58, train_loss: 0.6265, test_loss: 1.5276, test_f1: 0.5416
 epoch: 59, train_loss: 0.6436, test_loss: 1.6107, test_f1: 0.5228
 epoch: 60, train_loss: 0.6344, test_loss: 1.3675, test_f1: 0.5408
 epoch: 61, train_loss: 0.6470, test_loss: 1.3838, test_f1: 0.5564
 epoch: 62, train_loss: 0.6275, test_loss: 1.6290, test_f1: 0.5639
 epoch: 63, train_loss: 0.6146, test_loss: 1.5053, test_f1: 0.5442
 epoch: 64, train_loss: 0.6250, test_loss: 1.4998, test_f1: 0.5186
 epoch: 65, train_loss: 0.5893, test_loss: 1.6240, test_f1: 0.5439
 epoch: 66, train_loss: 0.6145, test_loss: 1.3001, test_f1: 0.5363
 epoch: 67, train_loss: 0.5843, test_loss: 1.9753, test_f1: 0.5246
 epoch: 68, train_loss: 0.6025, test_loss: 1.7928, test_f1: 0.5162
 epoch: 69, train_loss: 0.5802, test_loss: 1.8999, test_f1: 0.5599
 epoch: 70, train_loss: 0.5863, test_loss: 1.9160, test_f1: 0.5833
 epoch: 71, train_loss: 0.6545, test_loss: 1.3150, test_f1: 0.5896
 epoch: 72, train_loss: 0.6016, test_loss: 1.4933, test_f1: 0.5395
 epoch: 73, train_loss: 0.5881, test_loss: 2.6298, test_f1: 0.5048
 epoch: 74, train_loss: 0.5601, test_loss: 1.5019, test_f1: 0.5400
 epoch: 75, train_loss: 0.5758, test_loss: 2.7046, test_f1: 0.5468
 epoch: 76, train_loss: 0.5848, test_loss: 2.1104, test_f1: 0.4985
 epoch: 77, train_loss: 0.5837, test_loss: 1.9576, test_f1: 0.5320
 epoch: 78, train_loss: 0.5629, test_loss: 1.4918, test_f1: 0.5250
 epoch: 79, train_loss: 0.5739, test_loss: 1.7683, test_f1: 0.5792
 epoch: 80, train_loss: 0.5572, test_loss: 1.8564, test_f1: 0.5353
 epoch: 81, train_loss: 0.6014, test_loss: 1.6892, test_f1: 0.5103
 epoch: 82, train_loss: 0.5577, test_loss: 1.7906, test_f1: 0.5371
 epoch: 83, train_loss: 0.5320, test_loss: 1.5948, test_f1: 0.5493
 epoch: 84, train_loss: 0.5130, test_loss: 1.6322, test_f1: 0.5451
 epoch: 85, train_loss: 0.5436, test_loss: 1.6893, test_f1: 0.5276
 epoch: 86, train_loss: 0.5412, test_loss: 1.7391, test_f1: 0.5264
 epoch: 87, train_loss: 0.5389, test_loss: 1.6140, test_f1: 0.5276
 epoch: 88, train_loss: 0.5200, test_loss: 1.6052, test_f1: 0.5263
 epoch: 89, train_loss: 0.5076, test_loss: 1.9439, test_f1: 0.5545
 epoch: 90, train_loss: 0.5054, test_loss: 2.1032, test_f1: 0.5076
 epoch: 91, train_loss: 0.4964, test_loss: 1.8871, test_f1: 0.5240
 epoch: 92, train_loss: 0.5004, test_loss: 2.2543, test_f1: 0.5179
 epoch: 93, train_loss: 0.5251, test_loss: 1.8417, test_f1: 0.5385
 epoch: 94, train_loss: 0.5056, test_loss: 2.0724, test_f1: 0.4786
 epoch: 95, train_loss: 0.4924, test_loss: 1.7458, test_f1: 0.4893
 epoch: 96, train_loss: 0.4849, test_loss: 1.4063, test_f1: 0.5376
 epoch: 97, train_loss: 0.5082, test_loss: 1.4778, test_f1: 0.5338
 epoch: 98, train_loss: 0.5237, test_loss: 2.1362, test_f1: 0.5014
 epoch: 99, train_loss: 0.5164, test_loss: 2.3550, test_f1: 0.4923
##################ITERATION #7 ****************************************
 epoch: 0, train_loss: 1.2470, test_loss: 1.3773, test_f1: 0.3406
 epoch: 1, train_loss: 1.0828, test_loss: 1.5327, test_f1: 0.3258
 epoch: 2, train_loss: 1.0132, test_loss: 1.3267, test_f1: 0.5452
 epoch: 3, train_loss: 0.9744, test_loss: 1.1961, test_f1: 0.4280
 epoch: 4, train_loss: 0.9233, test_loss: 1.0401, test_f1: 0.5100
 epoch: 5, train_loss: 0.9277, test_loss: 1.0757, test_f1: 0.4631
 epoch: 6, train_loss: 0.9298, test_loss: 1.0486, test_f1: 0.5787
 epoch: 7, train_loss: 0.9153, test_loss: 1.0058, test_f1: 0.5073
 epoch: 8, train_loss: 0.8741, test_loss: 1.0816, test_f1: 0.5479
 epoch: 9, train_loss: 0.8776, test_loss: 1.1203, test_f1: 0.4781
 epoch: 10, train_loss: 0.8486, test_loss: 1.0367, test_f1: 0.5422
 epoch: 11, train_loss: 0.8789, test_loss: 1.0880, test_f1: 0.4791
 epoch: 12, train_loss: 0.9233, test_loss: 1.2074, test_f1: 0.4379
 epoch: 13, train_loss: 0.8795, test_loss: 1.0729, test_f1: 0.5155
 epoch: 14, train_loss: 0.8247, test_loss: 1.0158, test_f1: 0.5402
 epoch: 15, train_loss: 0.8179, test_loss: 1.3218, test_f1: 0.5214
 epoch: 16, train_loss: 0.8491, test_loss: 1.3032, test_f1: 0.5176
 epoch: 17, train_loss: 0.8089, test_loss: 1.1187, test_f1: 0.4933
 epoch: 18, train_loss: 0.7964, test_loss: 1.2738, test_f1: 0.5132
 epoch: 19, train_loss: 0.7890, test_loss: 1.3658, test_f1: 0.4729
 epoch: 20, train_loss: 0.7888, test_loss: 1.0488, test_f1: 0.6231
 epoch: 21, train_loss: 0.7692, test_loss: 1.0881, test_f1: 0.5772
 epoch: 22, train_loss: 0.7680, test_loss: 1.0394, test_f1: 0.5407
 epoch: 23, train_loss: 0.8034, test_loss: 1.0056, test_f1: 0.6128
 epoch: 24, train_loss: 0.7779, test_loss: 1.0193, test_f1: 0.5857
 epoch: 25, train_loss: 0.7652, test_loss: 1.5075, test_f1: 0.5788
 epoch: 26, train_loss: 0.7698, test_loss: 2.0622, test_f1: 0.4705
 epoch: 27, train_loss: 0.7705, test_loss: 1.1032, test_f1: 0.5608
 epoch: 28, train_loss: 0.8322, test_loss: 1.0872, test_f1: 0.6107
 epoch: 29, train_loss: 0.7641, test_loss: 1.4632, test_f1: 0.5011
 epoch: 30, train_loss: 0.7577, test_loss: 1.3496, test_f1: 0.5352
 epoch: 31, train_loss: 0.7504, test_loss: 1.1866, test_f1: 0.5590
 epoch: 32, train_loss: 0.7431, test_loss: 1.1395, test_f1: 0.5885
 epoch: 33, train_loss: 0.7122, test_loss: 1.0052, test_f1: 0.5888
 epoch: 34, train_loss: 0.7258, test_loss: 1.2291, test_f1: 0.5790
 epoch: 35, train_loss: 0.7414, test_loss: 1.1496, test_f1: 0.5813
 epoch: 36, train_loss: 0.7480, test_loss: 1.0636, test_f1: 0.5729
 epoch: 37, train_loss: 0.7396, test_loss: 1.3761, test_f1: 0.5477
 epoch: 38, train_loss: 0.7515, test_loss: 1.0289, test_f1: 0.5924
 epoch: 39, train_loss: 0.7234, test_loss: 1.1214, test_f1: 0.5616
 epoch: 40, train_loss: 0.6955, test_loss: 1.2336, test_f1: 0.5822
 epoch: 41, train_loss: 0.7078, test_loss: 1.2059, test_f1: 0.5880
 epoch: 42, train_loss: 0.6929, test_loss: 1.2223, test_f1: 0.5435
 epoch: 43, train_loss: 0.7292, test_loss: 1.3360, test_f1: 0.5611
 epoch: 44, train_loss: 0.6953, test_loss: 1.2734, test_f1: 0.5864
 epoch: 45, train_loss: 0.6880, test_loss: 1.1921, test_f1: 0.6052
 epoch: 46, train_loss: 0.7136, test_loss: 1.4209, test_f1: 0.5412
 epoch: 47, train_loss: 0.6960, test_loss: 1.3186, test_f1: 0.5647
 epoch: 48, train_loss: 0.6762, test_loss: 1.4320, test_f1: 0.5760
 epoch: 49, train_loss: 0.7234, test_loss: 1.4155, test_f1: 0.5730
 epoch: 50, train_loss: 0.6587, test_loss: 1.3756, test_f1: 0.5639
 epoch: 51, train_loss: 0.6262, test_loss: 1.6331, test_f1: 0.5746
 epoch: 52, train_loss: 0.6171, test_loss: 1.2982, test_f1: 0.5904
 epoch: 53, train_loss: 0.5855, test_loss: 1.7264, test_f1: 0.5552
 epoch: 54, train_loss: 0.6042, test_loss: 1.4880, test_f1: 0.5873
 epoch: 55, train_loss: 0.5736, test_loss: 1.5324, test_f1: 0.5747
 epoch: 56, train_loss: 0.5789, test_loss: 1.6197, test_f1: 0.5749
 epoch: 57, train_loss: 0.6394, test_loss: 1.6049, test_f1: 0.5340
 epoch: 58, train_loss: 0.6278, test_loss: 1.1712, test_f1: 0.5707
 epoch: 59, train_loss: 0.5967, test_loss: 1.2645, test_f1: 0.5671
 epoch: 60, train_loss: 0.5954, test_loss: 1.5754, test_f1: 0.6011
 epoch: 61, train_loss: 0.6023, test_loss: 1.6648, test_f1: 0.5854
 epoch: 62, train_loss: 0.5764, test_loss: 2.1916, test_f1: 0.5899
 epoch: 63, train_loss: 0.5703, test_loss: 1.7653, test_f1: 0.5878
 epoch: 64, train_loss: 0.5780, test_loss: 1.4698, test_f1: 0.5511
 epoch: 65, train_loss: 0.5548, test_loss: 1.7720, test_f1: 0.5850
 epoch: 66, train_loss: 0.5862, test_loss: 2.5586, test_f1: 0.5423
 epoch: 67, train_loss: 0.5506, test_loss: 1.7619, test_f1: 0.6163
 epoch: 68, train_loss: 0.5332, test_loss: 2.0740, test_f1: 0.5524
 epoch: 69, train_loss: 0.5513, test_loss: 1.6966, test_f1: 0.5512
 epoch: 70, train_loss: 0.5731, test_loss: 1.3397, test_f1: 0.5849
 epoch: 71, train_loss: 0.5398, test_loss: 2.0349, test_f1: 0.5344
 epoch: 72, train_loss: 0.5512, test_loss: 2.5093, test_f1: 0.5726
 epoch: 73, train_loss: 0.5366, test_loss: 1.5618, test_f1: 0.5590
 epoch: 74, train_loss: 0.5253, test_loss: 2.9664, test_f1: 0.4329
 epoch: 75, train_loss: 0.5627, test_loss: 2.0042, test_f1: 0.5865
 epoch: 76, train_loss: 0.5054, test_loss: 2.5980, test_f1: 0.5826
 epoch: 77, train_loss: 0.5308, test_loss: 2.0341, test_f1: 0.5793
 epoch: 78, train_loss: 0.5047, test_loss: 2.0137, test_f1: 0.5726
 epoch: 79, train_loss: 0.4897, test_loss: 2.3595, test_f1: 0.5965
 epoch: 80, train_loss: 0.5309, test_loss: 2.1396, test_f1: 0.5674
 epoch: 81, train_loss: 0.4887, test_loss: 1.8702, test_f1: 0.5709
 epoch: 82, train_loss: 0.4962, test_loss: 1.5873, test_f1: 0.5914
 epoch: 83, train_loss: 0.4847, test_loss: 1.9800, test_f1: 0.6086
 epoch: 84, train_loss: 0.4972, test_loss: 2.1401, test_f1: 0.5729
 epoch: 85, train_loss: 0.4994, test_loss: 2.0125, test_f1: 0.5770
 epoch: 86, train_loss: 0.4703, test_loss: 2.1664, test_f1: 0.5861
 epoch: 87, train_loss: 0.4694, test_loss: 2.4822, test_f1: 0.5899
 epoch: 88, train_loss: 0.4886, test_loss: 2.2733, test_f1: 0.5538
 epoch: 89, train_loss: 0.4830, test_loss: 3.0193, test_f1: 0.5940
 epoch: 90, train_loss: 0.5048, test_loss: 2.4133, test_f1: 0.5762
 epoch: 91, train_loss: 0.4942, test_loss: 2.2331, test_f1: 0.5399
 epoch: 92, train_loss: 0.4830, test_loss: 2.0516, test_f1: 0.5902
 epoch: 93, train_loss: 0.4965, test_loss: 2.3673, test_f1: 0.6164
 epoch: 94, train_loss: 0.5143, test_loss: 2.4852, test_f1: 0.5953
 epoch: 95, train_loss: 0.4820, test_loss: 2.5410, test_f1: 0.6063
 epoch: 96, train_loss: 0.4711, test_loss: 2.3606, test_f1: 0.5581
 epoch: 97, train_loss: 0.4365, test_loss: 1.8501, test_f1: 0.6102
 epoch: 98, train_loss: 0.4395, test_loss: 2.4220, test_f1: 0.5596
 epoch: 99, train_loss: 0.4503, test_loss: 1.7865, test_f1: 0.5680
##################ITERATION #8 ****************************************
 epoch: 0, train_loss: 1.2663, test_loss: 1.2339, test_f1: 0.3846
 epoch: 1, train_loss: 1.1004, test_loss: 1.1359, test_f1: 0.4643
 epoch: 2, train_loss: 1.0161, test_loss: 1.1061, test_f1: 0.5124
 epoch: 3, train_loss: 0.9771, test_loss: 1.8076, test_f1: 0.3251
 epoch: 4, train_loss: 0.9278, test_loss: 1.1064, test_f1: 0.5034
 epoch: 5, train_loss: 0.8953, test_loss: 1.0763, test_f1: 0.4990
 epoch: 6, train_loss: 0.8909, test_loss: 1.0074, test_f1: 0.5503
 epoch: 7, train_loss: 0.8786, test_loss: 1.1042, test_f1: 0.5108
 epoch: 8, train_loss: 0.8799, test_loss: 1.0209, test_f1: 0.5670
 epoch: 9, train_loss: 0.8296, test_loss: 1.0172, test_f1: 0.5518
 epoch: 10, train_loss: 0.8329, test_loss: 1.2807, test_f1: 0.4777
 epoch: 11, train_loss: 0.8357, test_loss: 1.1006, test_f1: 0.5145
 epoch: 12, train_loss: 0.8341, test_loss: 0.9856, test_f1: 0.5611
 epoch: 13, train_loss: 0.8385, test_loss: 1.0744, test_f1: 0.5245
 epoch: 14, train_loss: 0.8346, test_loss: 1.3953, test_f1: 0.4602
 epoch: 15, train_loss: 0.8394, test_loss: 1.1465, test_f1: 0.4932
 epoch: 16, train_loss: 0.8394, test_loss: 1.0237, test_f1: 0.5788
 epoch: 17, train_loss: 0.8322, test_loss: 1.1495, test_f1: 0.5500
 epoch: 18, train_loss: 0.8408, test_loss: 1.2175, test_f1: 0.5737
 epoch: 19, train_loss: 0.7870, test_loss: 1.2367, test_f1: 0.5414
 epoch: 20, train_loss: 0.7808, test_loss: 1.2301, test_f1: 0.5431
 epoch: 21, train_loss: 0.7898, test_loss: 1.2083, test_f1: 0.4868
 epoch: 22, train_loss: 0.7703, test_loss: 1.2153, test_f1: 0.5591
 epoch: 23, train_loss: 0.8008, test_loss: 1.0247, test_f1: 0.6051
 epoch: 24, train_loss: 0.7900, test_loss: 1.2665, test_f1: 0.5479
 epoch: 25, train_loss: 0.7566, test_loss: 1.2170, test_f1: 0.5411
 epoch: 26, train_loss: 0.7589, test_loss: 1.1982, test_f1: 0.5389
 epoch: 27, train_loss: 0.7720, test_loss: 1.3089, test_f1: 0.6079
 epoch: 28, train_loss: 0.8283, test_loss: 1.0076, test_f1: 0.5641
 epoch: 29, train_loss: 0.7879, test_loss: 1.1007, test_f1: 0.5321
 epoch: 30, train_loss: 0.7515, test_loss: 1.4051, test_f1: 0.6039
 epoch: 31, train_loss: 0.7584, test_loss: 1.2630, test_f1: 0.5925
 epoch: 32, train_loss: 0.7529, test_loss: 1.2237, test_f1: 0.5939
 epoch: 33, train_loss: 0.7433, test_loss: 1.0748, test_f1: 0.5794
 epoch: 34, train_loss: 0.7638, test_loss: 0.9769, test_f1: 0.5770
 epoch: 35, train_loss: 0.7579, test_loss: 1.4351, test_f1: 0.5904
 epoch: 36, train_loss: 0.7491, test_loss: 1.1324, test_f1: 0.5549
 epoch: 37, train_loss: 0.7073, test_loss: 1.3728, test_f1: 0.5437
 epoch: 38, train_loss: 0.7299, test_loss: 1.9442, test_f1: 0.4840
 epoch: 39, train_loss: 0.7262, test_loss: 1.0889, test_f1: 0.6089
 epoch: 40, train_loss: 0.7257, test_loss: 1.0866, test_f1: 0.5753
 epoch: 41, train_loss: 0.6914, test_loss: 1.1465, test_f1: 0.5375
 epoch: 42, train_loss: 0.7071, test_loss: 1.0538, test_f1: 0.5824
 epoch: 43, train_loss: 0.7284, test_loss: 1.0267, test_f1: 0.5687
 epoch: 44, train_loss: 0.7112, test_loss: 2.0181, test_f1: 0.5913
 epoch: 45, train_loss: 0.6895, test_loss: 1.2054, test_f1: 0.5099
 epoch: 46, train_loss: 0.6986, test_loss: 1.3809, test_f1: 0.5530
 epoch: 47, train_loss: 0.6732, test_loss: 1.2243, test_f1: 0.5827
 epoch: 48, train_loss: 0.6577, test_loss: 0.9901, test_f1: 0.5869
 epoch: 49, train_loss: 0.6859, test_loss: 1.7339, test_f1: 0.4879
 epoch: 50, train_loss: 0.6764, test_loss: 1.6909, test_f1: 0.6023
 epoch: 51, train_loss: 0.7004, test_loss: 1.6607, test_f1: 0.5126
 epoch: 52, train_loss: 0.6508, test_loss: 1.5172, test_f1: 0.6054
 epoch: 53, train_loss: 0.6200, test_loss: 1.4749, test_f1: 0.5960
 epoch: 54, train_loss: 0.6207, test_loss: 1.4695, test_f1: 0.5547
 epoch: 55, train_loss: 0.6138, test_loss: 1.4973, test_f1: 0.5956
 epoch: 56, train_loss: 0.6086, test_loss: 1.2428, test_f1: 0.5907
 epoch: 57, train_loss: 0.5961, test_loss: 1.3382, test_f1: 0.5957
 epoch: 58, train_loss: 0.6206, test_loss: 1.1524, test_f1: 0.5811
 epoch: 59, train_loss: 0.6009, test_loss: 1.6062, test_f1: 0.5807
 epoch: 60, train_loss: 0.5952, test_loss: 1.3847, test_f1: 0.5921
 epoch: 61, train_loss: 0.5933, test_loss: 1.1182, test_f1: 0.6220
 epoch: 62, train_loss: 0.5688, test_loss: 1.7327, test_f1: 0.5894
 epoch: 63, train_loss: 0.5895, test_loss: 1.3728, test_f1: 0.5661
 epoch: 64, train_loss: 0.5641, test_loss: 2.1453, test_f1: 0.5467
 epoch: 65, train_loss: 0.5838, test_loss: 1.6428, test_f1: 0.6174
 epoch: 66, train_loss: 0.5593, test_loss: 1.9450, test_f1: 0.5459
 epoch: 67, train_loss: 0.5693, test_loss: 1.8996, test_f1: 0.5423
 epoch: 68, train_loss: 0.5892, test_loss: 1.8535, test_f1: 0.5719
 epoch: 69, train_loss: 0.5853, test_loss: 1.4734, test_f1: 0.5796
 epoch: 70, train_loss: 0.5298, test_loss: 1.3121, test_f1: 0.5946
 epoch: 71, train_loss: 0.5341, test_loss: 1.7748, test_f1: 0.5907
 epoch: 72, train_loss: 0.5661, test_loss: 1.5286, test_f1: 0.5521
 epoch: 73, train_loss: 0.5161, test_loss: 2.1150, test_f1: 0.5785
 epoch: 74, train_loss: 0.5427, test_loss: 1.3634, test_f1: 0.5919
 epoch: 75, train_loss: 0.5549, test_loss: 1.7362, test_f1: 0.5424
 epoch: 76, train_loss: 0.5460, test_loss: 1.6984, test_f1: 0.5640
 epoch: 77, train_loss: 0.5271, test_loss: 1.2057, test_f1: 0.5748
 epoch: 78, train_loss: 0.5489, test_loss: 1.2309, test_f1: 0.6074
 epoch: 79, train_loss: 0.5244, test_loss: 1.2107, test_f1: 0.6013
 epoch: 80, train_loss: 0.5354, test_loss: 1.3297, test_f1: 0.5825
 epoch: 81, train_loss: 0.5065, test_loss: 1.4122, test_f1: 0.5940
 epoch: 82, train_loss: 0.5032, test_loss: 1.5054, test_f1: 0.6244
 epoch: 83, train_loss: 0.5195, test_loss: 1.9226, test_f1: 0.5392
 epoch: 84, train_loss: 0.5017, test_loss: 1.5485, test_f1: 0.5975
 epoch: 85, train_loss: 0.4911, test_loss: 1.7067, test_f1: 0.5642
 epoch: 86, train_loss: 0.4944, test_loss: 1.6559, test_f1: 0.5811
 epoch: 87, train_loss: 0.4976, test_loss: 2.0626, test_f1: 0.5928
 epoch: 88, train_loss: 0.4933, test_loss: 2.3580, test_f1: 0.6242
 epoch: 89, train_loss: 0.5025, test_loss: 2.4313, test_f1: 0.5802
 epoch: 90, train_loss: 0.5104, test_loss: 1.5767, test_f1: 0.5794
 epoch: 91, train_loss: 0.5167, test_loss: 1.7687, test_f1: 0.5506
 epoch: 92, train_loss: 0.4564, test_loss: 1.8703, test_f1: 0.6271
 epoch: 93, train_loss: 0.5018, test_loss: 2.1791, test_f1: 0.5963
 epoch: 94, train_loss: 0.5143, test_loss: 1.9241, test_f1: 0.5447
 epoch: 95, train_loss: 0.4819, test_loss: 2.5551, test_f1: 0.5761
 epoch: 96, train_loss: 0.4887, test_loss: 2.0153, test_f1: 0.5841
 epoch: 97, train_loss: 0.4701, test_loss: 2.3323, test_f1: 0.5780
 epoch: 98, train_loss: 0.4711, test_loss: 2.3985, test_f1: 0.5876
 epoch: 99, train_loss: 0.4686, test_loss: 2.2743, test_f1: 0.5380
##################ITERATION #9 ****************************************
 epoch: 0, train_loss: 1.2541, test_loss: 1.4944, test_f1: 0.3939
 epoch: 1, train_loss: 1.0567, test_loss: 1.2756, test_f1: 0.3762
 epoch: 2, train_loss: 0.9874, test_loss: 1.0583, test_f1: 0.5284
 epoch: 3, train_loss: 0.9392, test_loss: 1.0330, test_f1: 0.4967
 epoch: 4, train_loss: 0.9258, test_loss: 1.0254, test_f1: 0.5345
 epoch: 5, train_loss: 0.8810, test_loss: 1.0294, test_f1: 0.5323
 epoch: 6, train_loss: 0.8733, test_loss: 1.0509, test_f1: 0.5522
 epoch: 7, train_loss: 0.8569, test_loss: 1.1031, test_f1: 0.4951
 epoch: 8, train_loss: 0.8609, test_loss: 1.0749, test_f1: 0.5799
 epoch: 9, train_loss: 0.8543, test_loss: 1.1862, test_f1: 0.4827
 epoch: 10, train_loss: 0.8796, test_loss: 1.0886, test_f1: 0.6196
 epoch: 11, train_loss: 0.8259, test_loss: 1.5655, test_f1: 0.3823
 epoch: 12, train_loss: 0.8608, test_loss: 1.1016, test_f1: 0.5647
 epoch: 13, train_loss: 0.8188, test_loss: 1.0649, test_f1: 0.4860
 epoch: 14, train_loss: 0.8092, test_loss: 1.1162, test_f1: 0.5406
 epoch: 15, train_loss: 0.8098, test_loss: 1.0702, test_f1: 0.5932
 epoch: 16, train_loss: 0.7929, test_loss: 1.0736, test_f1: 0.5477
 epoch: 17, train_loss: 0.7960, test_loss: 1.4992, test_f1: 0.5566
 epoch: 18, train_loss: 0.7840, test_loss: 1.3035, test_f1: 0.5411
 epoch: 19, train_loss: 0.7924, test_loss: 1.2368, test_f1: 0.5794
 epoch: 20, train_loss: 0.7710, test_loss: 1.7671, test_f1: 0.4809
 epoch: 21, train_loss: 0.7734, test_loss: 1.1202, test_f1: 0.5689
 epoch: 22, train_loss: 0.7960, test_loss: 1.0514, test_f1: 0.5747
 epoch: 23, train_loss: 0.7675, test_loss: 1.4849, test_f1: 0.5136
 epoch: 24, train_loss: 0.7885, test_loss: 1.0065, test_f1: 0.6112
 epoch: 25, train_loss: 0.7379, test_loss: 1.0018, test_f1: 0.5381
 epoch: 26, train_loss: 0.7446, test_loss: 1.4860, test_f1: 0.5674
 epoch: 27, train_loss: 0.7600, test_loss: 1.1584, test_f1: 0.5308
 epoch: 28, train_loss: 0.7544, test_loss: 1.4645, test_f1: 0.5674
 epoch: 29, train_loss: 0.7224, test_loss: 1.2379, test_f1: 0.4999
 epoch: 30, train_loss: 0.7378, test_loss: 1.2419, test_f1: 0.5638
 epoch: 31, train_loss: 0.7523, test_loss: 1.1298, test_f1: 0.5902
 epoch: 32, train_loss: 0.7287, test_loss: 1.2642, test_f1: 0.5412
 epoch: 33, train_loss: 0.7239, test_loss: 1.0687, test_f1: 0.5569
 epoch: 34, train_loss: 0.7320, test_loss: 1.1778, test_f1: 0.6076
 epoch: 35, train_loss: 0.7264, test_loss: 1.4007, test_f1: 0.5690
 epoch: 36, train_loss: 0.7549, test_loss: 1.1673, test_f1: 0.5567
 epoch: 37, train_loss: 0.7150, test_loss: 1.1691, test_f1: 0.6030
 epoch: 38, train_loss: 0.7034, test_loss: 1.4006, test_f1: 0.5735
 epoch: 39, train_loss: 0.7030, test_loss: 1.1864, test_f1: 0.5669
 epoch: 40, train_loss: 0.7033, test_loss: 1.2163, test_f1: 0.5621
 epoch: 41, train_loss: 0.6918, test_loss: 1.0554, test_f1: 0.6164
 epoch: 42, train_loss: 0.7300, test_loss: 1.1132, test_f1: 0.6237
 epoch: 43, train_loss: 0.6946, test_loss: 1.1252, test_f1: 0.5801
 epoch: 44, train_loss: 0.6976, test_loss: 1.6445, test_f1: 0.5695
 epoch: 45, train_loss: 0.6886, test_loss: 1.2134, test_f1: 0.6040
 epoch: 46, train_loss: 0.7053, test_loss: 1.1498, test_f1: 0.5136
 epoch: 47, train_loss: 0.6613, test_loss: 1.0661, test_f1: 0.6246
 epoch: 48, train_loss: 0.7264, test_loss: 1.2678, test_f1: 0.5651
 epoch: 49, train_loss: 0.7028, test_loss: 1.1703, test_f1: 0.5557
 epoch: 50, train_loss: 0.6838, test_loss: 1.1940, test_f1: 0.5864
 epoch: 51, train_loss: 0.6485, test_loss: 1.1637, test_f1: 0.5997
 epoch: 52, train_loss: 0.6157, test_loss: 1.2739, test_f1: 0.5577
 epoch: 53, train_loss: 0.5841, test_loss: 1.2823, test_f1: 0.5898
 epoch: 54, train_loss: 0.5892, test_loss: 1.5816, test_f1: 0.5617
 epoch: 55, train_loss: 0.5754, test_loss: 1.3928, test_f1: 0.5639
 epoch: 56, train_loss: 0.6207, test_loss: 1.7916, test_f1: 0.5258
 epoch: 57, train_loss: 0.5839, test_loss: 1.3595, test_f1: 0.5824
 epoch: 58, train_loss: 0.5526, test_loss: 1.2865, test_f1: 0.5563
 epoch: 59, train_loss: 0.5633, test_loss: 1.3885, test_f1: 0.5488
 epoch: 60, train_loss: 0.5552, test_loss: 1.4601, test_f1: 0.5595
 epoch: 61, train_loss: 0.5521, test_loss: 1.5415, test_f1: 0.5352
 epoch: 62, train_loss: 0.5433, test_loss: 1.4657, test_f1: 0.5522
 epoch: 63, train_loss: 0.5426, test_loss: 1.5727, test_f1: 0.5011
 epoch: 64, train_loss: 0.5360, test_loss: 1.5523, test_f1: 0.5454
 epoch: 65, train_loss: 0.5338, test_loss: 1.8719, test_f1: 0.5335
 epoch: 66, train_loss: 0.5090, test_loss: 1.9379, test_f1: 0.5571
 epoch: 67, train_loss: 0.5451, test_loss: 1.6004, test_f1: 0.5783
 epoch: 68, train_loss: 0.5236, test_loss: 1.6841, test_f1: 0.5086
 epoch: 69, train_loss: 0.5292, test_loss: 1.6909, test_f1: 0.5758
 epoch: 70, train_loss: 0.5310, test_loss: 1.8642, test_f1: 0.4959
 epoch: 71, train_loss: 0.5209, test_loss: 1.7108, test_f1: 0.5294
 epoch: 72, train_loss: 0.4924, test_loss: 1.7260, test_f1: 0.5263
 epoch: 73, train_loss: 0.5185, test_loss: 1.5829, test_f1: 0.5626
 epoch: 74, train_loss: 0.4818, test_loss: 1.7357, test_f1: 0.5496
 epoch: 75, train_loss: 0.4864, test_loss: 1.7283, test_f1: 0.5548
 epoch: 76, train_loss: 0.4967, test_loss: 1.6106, test_f1: 0.5423
 epoch: 77, train_loss: 0.5232, test_loss: 1.7472, test_f1: 0.5264
 epoch: 78, train_loss: 0.4767, test_loss: 1.7640, test_f1: 0.5703
 epoch: 79, train_loss: 0.4641, test_loss: 1.9024, test_f1: 0.5290
 epoch: 80, train_loss: 0.4792, test_loss: 1.6341, test_f1: 0.5496
 epoch: 81, train_loss: 0.4904, test_loss: 1.8041, test_f1: 0.5258
 epoch: 82, train_loss: 0.4647, test_loss: 1.9438, test_f1: 0.5300
 epoch: 83, train_loss: 0.4609, test_loss: 1.9184, test_f1: 0.5441
 epoch: 84, train_loss: 0.4853, test_loss: 1.9744, test_f1: 0.5089
 epoch: 85, train_loss: 0.5130, test_loss: 1.7048, test_f1: 0.5509
 epoch: 86, train_loss: 0.4644, test_loss: 1.7455, test_f1: 0.5387
 epoch: 87, train_loss: 0.4232, test_loss: 1.7657, test_f1: 0.5934
 epoch: 88, train_loss: 0.4317, test_loss: 1.8937, test_f1: 0.5510
 epoch: 89, train_loss: 0.4627, test_loss: 1.8279, test_f1: 0.5395
 epoch: 90, train_loss: 0.4294, test_loss: 1.7957, test_f1: 0.5572
 epoch: 91, train_loss: 0.4408, test_loss: 2.0178, test_f1: 0.5482
 epoch: 92, train_loss: 0.4238, test_loss: 1.7922, test_f1: 0.5551
 epoch: 93, train_loss: 0.4829, test_loss: 1.5229, test_f1: 0.5980
 epoch: 94, train_loss: 0.4161, test_loss: 1.7526, test_f1: 0.5442
 epoch: 95, train_loss: 0.4318, test_loss: 1.9296, test_f1: 0.5393
 epoch: 96, train_loss: 0.4480, test_loss: 1.9572, test_f1: 0.5622
 epoch: 97, train_loss: 0.4612, test_loss: 2.0638, test_f1: 0.5459
 epoch: 98, train_loss: 0.4293, test_loss: 1.6988, test_f1: 0.5886
 epoch: 99, train_loss: 0.3991, test_loss: 2.0228, test_f1: 0.5588

Training completed in 497.01 seconds
Best F1: 0.6652 at epoch 84
Mean F1 across iterations: 0.6341  0.0175
========================FINAL RESULTS================================
FEGIN weighted F1: 0.6652  0.0175
python main.py --data ltspice_demos --representation component_component --model FEGIN --layers 2 --hiddens 64 --batch_size 32 --lr 0.01 --emb_size 512 --epochs 100 --save_appendix component_component_L2_H64_BS32_LR0.01_E512 --no_val
-----



STDERR:
  File "main.py", line 370, in <module>
    main()
  File "main.py", line 254, in main
    dataset = dataset_class(
  File "/home/philip/projects/ltspice_examples_code_repo/Circuit-Completion-Using-GNNs/component_classification_with_link_prediction_head/evaluation/FEGIN/kernel/circuit_datasets.py", line 15, in __init__
    self.data, self.slices = torch.load(self.processed_paths[0])
  File "/home/philip/.local/lib/python3.8/site-packages/torch/serialization.py", line 1040, in load
    warnings.warn(
  File "/usr/lib/python3.8/warnings.py", line 109, in _showwarnmsg
    sw(msg.message, msg.category, msg.filename, msg.lineno,
  File "main.py", line 47, in warn_with_traceback
    traceback.print_stack(file=log)
/home/philip/projects/ltspice_examples_code_repo/Circuit-Completion-Using-GNNs/component_classification_with_link_prediction_head/evaluation/FEGIN/kernel/circuit_datasets.py:15: FutureWarning: You are using `torch.load` with `weights_only=False` (the current default value), which uses the default pickle module implicitly. It is possible to construct malicious pickle data which will execute arbitrary code during unpickling (See https://github.com/pytorch/pytorch/blob/main/SECURITY.md#untrusted-models for more details). In a future release, the default value for `weights_only` will be flipped to `True`. This limits the functions that could be executed during unpickling. Arbitrary objects will no longer be allowed to be loaded via this mode unless they are explicitly allowlisted by the user via `torch.serialization.add_safe_globals`. We recommend you start setting `weights_only=True` for any use case where you don't have full control of the loaded file. Please open an issue on GitHub for any issues related to this experimental feature.
  self.data, self.slices = torch.load(self.processed_paths[0])
