STDOUT:
Results will be saved in /home/philip/projects/ltspice_examples_code_repo/Circuit-Completion-Using-GNNs/component_classification_with_link_prediction_head/evaluation/FEGIN/results/model_FEGIN_dataset_ltspice_examples
Command line input: python main.py --data ltspice_examples --representation component_component --model FEGIN --layers 3 --hiddens 16 --batch_size 64 --lr 0.0001 --emb_size 512 --epochs 100 --save_appendix component_component_L3_H16_BS64_LR0.0001_E512 --no_val
 is saved.
-----
ltspice_examples - FEGIN
Using 3 layers, 16 hidden units, h = 2
Loading component_component representation dataset
ENTERED
Training FEGIN on component_component representation
Train: 3556, Test: 845
##################ITERATION #0 ****************************************
 epoch: 0, train_loss: 1.3631, test_loss: 1.3546, test_f1: 0.2629
 epoch: 1, train_loss: 1.3561, test_loss: 1.3489, test_f1: 0.2356
 epoch: 2, train_loss: 1.3506, test_loss: 1.3433, test_f1: 0.2276
 epoch: 3, train_loss: 1.3459, test_loss: 1.3382, test_f1: 0.2274
 epoch: 4, train_loss: 1.3403, test_loss: 1.3331, test_f1: 0.2274
 epoch: 5, train_loss: 1.3341, test_loss: 1.3292, test_f1: 0.2274
 epoch: 6, train_loss: 1.3291, test_loss: 1.3228, test_f1: 0.2274
 epoch: 7, train_loss: 1.3247, test_loss: 1.3169, test_f1: 0.2274
 epoch: 8, train_loss: 1.3190, test_loss: 1.3135, test_f1: 0.2274
 epoch: 9, train_loss: 1.3145, test_loss: 1.3084, test_f1: 0.2274
 epoch: 10, train_loss: 1.3071, test_loss: 1.3034, test_f1: 0.2274
 epoch: 11, train_loss: 1.3053, test_loss: 1.2995, test_f1: 0.2274
 epoch: 12, train_loss: 1.2980, test_loss: 1.2961, test_f1: 0.2274
 epoch: 13, train_loss: 1.2967, test_loss: 1.2925, test_f1: 0.2274
 epoch: 14, train_loss: 1.2918, test_loss: 1.2902, test_f1: 0.2274
 epoch: 15, train_loss: 1.2919, test_loss: 1.2863, test_f1: 0.2274
 epoch: 16, train_loss: 1.2880, test_loss: 1.2844, test_f1: 0.2274
 epoch: 17, train_loss: 1.2853, test_loss: 1.2816, test_f1: 0.2274
 epoch: 18, train_loss: 1.2825, test_loss: 1.2807, test_f1: 0.2274
 epoch: 19, train_loss: 1.2773, test_loss: 1.2785, test_f1: 0.2274
 epoch: 20, train_loss: 1.2778, test_loss: 1.2769, test_f1: 0.2274
 epoch: 21, train_loss: 1.2691, test_loss: 1.2745, test_f1: 0.2274
 epoch: 22, train_loss: 1.2781, test_loss: 1.2718, test_f1: 0.2274
 epoch: 23, train_loss: 1.2731, test_loss: 1.2705, test_f1: 0.2274
 epoch: 24, train_loss: 1.2696, test_loss: 1.2693, test_f1: 0.2274
 epoch: 25, train_loss: 1.2661, test_loss: 1.2659, test_f1: 0.2274
 epoch: 26, train_loss: 1.2654, test_loss: 1.2642, test_f1: 0.2274
 epoch: 27, train_loss: 1.2594, test_loss: 1.2624, test_f1: 0.2274
 epoch: 28, train_loss: 1.2600, test_loss: 1.2601, test_f1: 0.2274
 epoch: 29, train_loss: 1.2571, test_loss: 1.2561, test_f1: 0.2274
 epoch: 30, train_loss: 1.2522, test_loss: 1.2544, test_f1: 0.2274
 epoch: 31, train_loss: 1.2479, test_loss: 1.2523, test_f1: 0.2274
 epoch: 32, train_loss: 1.2501, test_loss: 1.2503, test_f1: 0.2274
 epoch: 33, train_loss: 1.2462, test_loss: 1.2464, test_f1: 0.2428
 epoch: 34, train_loss: 1.2463, test_loss: 1.2464, test_f1: 0.2706
 epoch: 35, train_loss: 1.2441, test_loss: 1.2414, test_f1: 0.3028
 epoch: 36, train_loss: 1.2407, test_loss: 1.2397, test_f1: 0.3253
 epoch: 37, train_loss: 1.2381, test_loss: 1.2370, test_f1: 0.3338
 epoch: 38, train_loss: 1.2381, test_loss: 1.2337, test_f1: 0.3322
 epoch: 39, train_loss: 1.2330, test_loss: 1.2310, test_f1: 0.3426
 epoch: 40, train_loss: 1.2321, test_loss: 1.2281, test_f1: 0.3477
 epoch: 41, train_loss: 1.2295, test_loss: 1.2278, test_f1: 0.3542
 epoch: 42, train_loss: 1.2320, test_loss: 1.2237, test_f1: 0.3554
 epoch: 43, train_loss: 1.2206, test_loss: 1.2224, test_f1: 0.3523
 epoch: 44, train_loss: 1.2264, test_loss: 1.2213, test_f1: 0.3504
 epoch: 45, train_loss: 1.2183, test_loss: 1.2186, test_f1: 0.3461
 epoch: 46, train_loss: 1.2191, test_loss: 1.2165, test_f1: 0.3425
 epoch: 47, train_loss: 1.2246, test_loss: 1.2124, test_f1: 0.3470
 epoch: 48, train_loss: 1.2180, test_loss: 1.2128, test_f1: 0.3395
 epoch: 49, train_loss: 1.2154, test_loss: 1.2115, test_f1: 0.3501
 epoch: 50, train_loss: 1.2128, test_loss: 1.2085, test_f1: 0.3413
 epoch: 51, train_loss: 1.2082, test_loss: 1.2065, test_f1: 0.3470
 epoch: 52, train_loss: 1.2094, test_loss: 1.2073, test_f1: 0.3432
 epoch: 53, train_loss: 1.2112, test_loss: 1.2066, test_f1: 0.3463
 epoch: 54, train_loss: 1.2172, test_loss: 1.2040, test_f1: 0.3428
 epoch: 55, train_loss: 1.2090, test_loss: 1.2036, test_f1: 0.3440
 epoch: 56, train_loss: 1.2053, test_loss: 1.2036, test_f1: 0.3443
 epoch: 57, train_loss: 1.2088, test_loss: 1.2032, test_f1: 0.3387
 epoch: 58, train_loss: 1.2103, test_loss: 1.2012, test_f1: 0.3404
 epoch: 59, train_loss: 1.2080, test_loss: 1.2016, test_f1: 0.3381
 epoch: 60, train_loss: 1.2071, test_loss: 1.2012, test_f1: 0.3418
 epoch: 61, train_loss: 1.2065, test_loss: 1.1993, test_f1: 0.3432
 epoch: 62, train_loss: 1.2049, test_loss: 1.1989, test_f1: 0.3421
 epoch: 63, train_loss: 1.2026, test_loss: 1.1998, test_f1: 0.3407
 epoch: 64, train_loss: 1.2063, test_loss: 1.1977, test_f1: 0.3404
 epoch: 65, train_loss: 1.2043, test_loss: 1.1987, test_f1: 0.3431
 epoch: 66, train_loss: 1.2024, test_loss: 1.1957, test_f1: 0.3476
 epoch: 67, train_loss: 1.1977, test_loss: 1.1944, test_f1: 0.3484
 epoch: 68, train_loss: 1.1974, test_loss: 1.1946, test_f1: 0.3414
 epoch: 69, train_loss: 1.2021, test_loss: 1.1938, test_f1: 0.3450
 epoch: 70, train_loss: 1.2037, test_loss: 1.1936, test_f1: 0.3469
 epoch: 71, train_loss: 1.1994, test_loss: 1.1936, test_f1: 0.3461
 epoch: 72, train_loss: 1.1963, test_loss: 1.1921, test_f1: 0.3477
 epoch: 73, train_loss: 1.1974, test_loss: 1.1919, test_f1: 0.3528
 epoch: 74, train_loss: 1.1954, test_loss: 1.1915, test_f1: 0.3464
 epoch: 75, train_loss: 1.1953, test_loss: 1.1908, test_f1: 0.3467
 epoch: 76, train_loss: 1.1993, test_loss: 1.1906, test_f1: 0.3486
 epoch: 77, train_loss: 1.1905, test_loss: 1.1906, test_f1: 0.3482
 epoch: 78, train_loss: 1.1948, test_loss: 1.1880, test_f1: 0.3434
 epoch: 79, train_loss: 1.1966, test_loss: 1.1904, test_f1: 0.3474
 epoch: 80, train_loss: 1.1955, test_loss: 1.1896, test_f1: 0.3457
 epoch: 81, train_loss: 1.1920, test_loss: 1.1863, test_f1: 0.3505
 epoch: 82, train_loss: 1.1902, test_loss: 1.1880, test_f1: 0.3487
 epoch: 83, train_loss: 1.1867, test_loss: 1.1868, test_f1: 0.3489
 epoch: 84, train_loss: 1.1915, test_loss: 1.1863, test_f1: 0.3489
 epoch: 85, train_loss: 1.1863, test_loss: 1.1858, test_f1: 0.3477
 epoch: 86, train_loss: 1.1944, test_loss: 1.1849, test_f1: 0.3445
 epoch: 87, train_loss: 1.1880, test_loss: 1.1847, test_f1: 0.3451
 epoch: 88, train_loss: 1.1857, test_loss: 1.1856, test_f1: 0.3442
 epoch: 89, train_loss: 1.1872, test_loss: 1.1844, test_f1: 0.3459
 epoch: 90, train_loss: 1.1868, test_loss: 1.1844, test_f1: 0.3448
 epoch: 91, train_loss: 1.1840, test_loss: 1.1813, test_f1: 0.3489
 epoch: 92, train_loss: 1.1788, test_loss: 1.1836, test_f1: 0.3472
 epoch: 93, train_loss: 1.1870, test_loss: 1.1825, test_f1: 0.3468
 epoch: 94, train_loss: 1.1855, test_loss: 1.1828, test_f1: 0.3488
 epoch: 95, train_loss: 1.1844, test_loss: 1.1809, test_f1: 0.3464
 epoch: 96, train_loss: 1.1841, test_loss: 1.1790, test_f1: 0.3501
 epoch: 97, train_loss: 1.1832, test_loss: 1.1794, test_f1: 0.3475
 epoch: 98, train_loss: 1.1788, test_loss: 1.1806, test_f1: 0.3460
 epoch: 99, train_loss: 1.1795, test_loss: 1.1791, test_f1: 0.3479
##################ITERATION #1 ****************************************
 epoch: 0, train_loss: 1.3206, test_loss: 1.3225, test_f1: 0.2274
 epoch: 1, train_loss: 1.3144, test_loss: 1.3167, test_f1: 0.2274
 epoch: 2, train_loss: 1.3087, test_loss: 1.3122, test_f1: 0.2274
 epoch: 3, train_loss: 1.3050, test_loss: 1.3070, test_f1: 0.2274
 epoch: 4, train_loss: 1.3017, test_loss: 1.3031, test_f1: 0.2274
 epoch: 5, train_loss: 1.2991, test_loss: 1.3003, test_f1: 0.2274
 epoch: 6, train_loss: 1.2970, test_loss: 1.2967, test_f1: 0.2274
 epoch: 7, train_loss: 1.2930, test_loss: 1.2940, test_f1: 0.2274
 epoch: 8, train_loss: 1.2920, test_loss: 1.2904, test_f1: 0.2274
 epoch: 9, train_loss: 1.2869, test_loss: 1.2864, test_f1: 0.2274
 epoch: 10, train_loss: 1.2865, test_loss: 1.2830, test_f1: 0.2274
 epoch: 11, train_loss: 1.2827, test_loss: 1.2807, test_f1: 0.2274
 epoch: 12, train_loss: 1.2805, test_loss: 1.2784, test_f1: 0.2274
 epoch: 13, train_loss: 1.2789, test_loss: 1.2765, test_f1: 0.2274
 epoch: 14, train_loss: 1.2775, test_loss: 1.2727, test_f1: 0.2274
 epoch: 15, train_loss: 1.2753, test_loss: 1.2681, test_f1: 0.2264
 epoch: 16, train_loss: 1.2731, test_loss: 1.2668, test_f1: 0.2274
 epoch: 17, train_loss: 1.2727, test_loss: 1.2641, test_f1: 0.2266
 epoch: 18, train_loss: 1.2708, test_loss: 1.2623, test_f1: 0.2274
 epoch: 19, train_loss: 1.2676, test_loss: 1.2586, test_f1: 0.2555
 epoch: 20, train_loss: 1.2680, test_loss: 1.2556, test_f1: 0.2390
 epoch: 21, train_loss: 1.2659, test_loss: 1.2522, test_f1: 0.2555
 epoch: 22, train_loss: 1.2605, test_loss: 1.2488, test_f1: 0.2555
 epoch: 23, train_loss: 1.2627, test_loss: 1.2455, test_f1: 0.2555
 epoch: 24, train_loss: 1.2597, test_loss: 1.2426, test_f1: 0.2555
 epoch: 25, train_loss: 1.2571, test_loss: 1.2410, test_f1: 0.2555
 epoch: 26, train_loss: 1.2501, test_loss: 1.2362, test_f1: 0.2690
 epoch: 27, train_loss: 1.2515, test_loss: 1.2333, test_f1: 0.2579
 epoch: 28, train_loss: 1.2469, test_loss: 1.2323, test_f1: 0.2601
 epoch: 29, train_loss: 1.2486, test_loss: 1.2280, test_f1: 0.2712
 epoch: 30, train_loss: 1.2483, test_loss: 1.2260, test_f1: 0.2603
 epoch: 31, train_loss: 1.2417, test_loss: 1.2245, test_f1: 0.2635
 epoch: 32, train_loss: 1.2433, test_loss: 1.2215, test_f1: 0.2756
 epoch: 33, train_loss: 1.2425, test_loss: 1.2206, test_f1: 0.2651
 epoch: 34, train_loss: 1.2394, test_loss: 1.2164, test_f1: 0.2756
 epoch: 35, train_loss: 1.2378, test_loss: 1.2157, test_f1: 0.2946
 epoch: 36, train_loss: 1.2374, test_loss: 1.2136, test_f1: 0.3023
 epoch: 37, train_loss: 1.2340, test_loss: 1.2116, test_f1: 0.3023
 epoch: 38, train_loss: 1.2355, test_loss: 1.2091, test_f1: 0.3084
 epoch: 39, train_loss: 1.2340, test_loss: 1.2056, test_f1: 0.3183
 epoch: 40, train_loss: 1.2309, test_loss: 1.2055, test_f1: 0.3167
 epoch: 41, train_loss: 1.2319, test_loss: 1.2044, test_f1: 0.3183
 epoch: 42, train_loss: 1.2338, test_loss: 1.2016, test_f1: 0.3143
 epoch: 43, train_loss: 1.2285, test_loss: 1.2007, test_f1: 0.3207
 epoch: 44, train_loss: 1.2273, test_loss: 1.2016, test_f1: 0.3150
 epoch: 45, train_loss: 1.2276, test_loss: 1.1980, test_f1: 0.3261
 epoch: 46, train_loss: 1.2242, test_loss: 1.1985, test_f1: 0.3316
 epoch: 47, train_loss: 1.2232, test_loss: 1.1953, test_f1: 0.3306
 epoch: 48, train_loss: 1.2193, test_loss: 1.1948, test_f1: 0.3297
 epoch: 49, train_loss: 1.2202, test_loss: 1.1927, test_f1: 0.3347
 epoch: 50, train_loss: 1.2185, test_loss: 1.1912, test_f1: 0.3330
 epoch: 51, train_loss: 1.2230, test_loss: 1.1909, test_f1: 0.3324
 epoch: 52, train_loss: 1.2177, test_loss: 1.1902, test_f1: 0.3358
 epoch: 53, train_loss: 1.2197, test_loss: 1.1890, test_f1: 0.3308
 epoch: 54, train_loss: 1.2123, test_loss: 1.1887, test_f1: 0.3338
 epoch: 55, train_loss: 1.2154, test_loss: 1.1895, test_f1: 0.3218
 epoch: 56, train_loss: 1.2154, test_loss: 1.1878, test_f1: 0.3358
 epoch: 57, train_loss: 1.2137, test_loss: 1.1873, test_f1: 0.3338
 epoch: 58, train_loss: 1.2167, test_loss: 1.1877, test_f1: 0.3358
 epoch: 59, train_loss: 1.2154, test_loss: 1.1864, test_f1: 0.3368
 epoch: 60, train_loss: 1.2133, test_loss: 1.1865, test_f1: 0.3474
 epoch: 61, train_loss: 1.2101, test_loss: 1.1839, test_f1: 0.3457
 epoch: 62, train_loss: 1.2135, test_loss: 1.1836, test_f1: 0.3457
 epoch: 63, train_loss: 1.2103, test_loss: 1.1824, test_f1: 0.3457
 epoch: 64, train_loss: 1.2090, test_loss: 1.1827, test_f1: 0.3351
 epoch: 65, train_loss: 1.2102, test_loss: 1.1835, test_f1: 0.3453
 epoch: 66, train_loss: 1.2085, test_loss: 1.1812, test_f1: 0.3423
 epoch: 67, train_loss: 1.2062, test_loss: 1.1808, test_f1: 0.3393
 epoch: 68, train_loss: 1.2114, test_loss: 1.1817, test_f1: 0.3483
 epoch: 69, train_loss: 1.2103, test_loss: 1.1824, test_f1: 0.3391
 epoch: 70, train_loss: 1.2077, test_loss: 1.1795, test_f1: 0.3464
 epoch: 71, train_loss: 1.2074, test_loss: 1.1791, test_f1: 0.3460
 epoch: 72, train_loss: 1.2048, test_loss: 1.1788, test_f1: 0.3381
 epoch: 73, train_loss: 1.2106, test_loss: 1.1774, test_f1: 0.3495
 epoch: 74, train_loss: 1.2068, test_loss: 1.1774, test_f1: 0.3476
 epoch: 75, train_loss: 1.2084, test_loss: 1.1780, test_f1: 0.3500
 epoch: 76, train_loss: 1.2082, test_loss: 1.1767, test_f1: 0.3499
 epoch: 77, train_loss: 1.1998, test_loss: 1.1778, test_f1: 0.3512
 epoch: 78, train_loss: 1.2038, test_loss: 1.1760, test_f1: 0.3461
 epoch: 79, train_loss: 1.2028, test_loss: 1.1758, test_f1: 0.3499
 epoch: 80, train_loss: 1.1977, test_loss: 1.1747, test_f1: 0.3477
 epoch: 81, train_loss: 1.1967, test_loss: 1.1737, test_f1: 0.3431
 epoch: 82, train_loss: 1.2038, test_loss: 1.1735, test_f1: 0.3484
 epoch: 83, train_loss: 1.1974, test_loss: 1.1724, test_f1: 0.3417
 epoch: 84, train_loss: 1.1991, test_loss: 1.1720, test_f1: 0.3458
 epoch: 85, train_loss: 1.1955, test_loss: 1.1721, test_f1: 0.3453
 epoch: 86, train_loss: 1.1975, test_loss: 1.1727, test_f1: 0.3429
 epoch: 87, train_loss: 1.1981, test_loss: 1.1714, test_f1: 0.3472
 epoch: 88, train_loss: 1.1956, test_loss: 1.1697, test_f1: 0.3479
 epoch: 89, train_loss: 1.1976, test_loss: 1.1714, test_f1: 0.3460
 epoch: 90, train_loss: 1.1977, test_loss: 1.1703, test_f1: 0.3363
 epoch: 91, train_loss: 1.1925, test_loss: 1.1679, test_f1: 0.3455
 epoch: 92, train_loss: 1.1909, test_loss: 1.1688, test_f1: 0.3545
 epoch: 93, train_loss: 1.1974, test_loss: 1.1665, test_f1: 0.3503
 epoch: 94, train_loss: 1.1886, test_loss: 1.1662, test_f1: 0.3539
 epoch: 95, train_loss: 1.1870, test_loss: 1.1650, test_f1: 0.3487
 epoch: 96, train_loss: 1.1869, test_loss: 1.1644, test_f1: 0.3416
 epoch: 97, train_loss: 1.1877, test_loss: 1.1650, test_f1: 0.3495
 epoch: 98, train_loss: 1.1886, test_loss: 1.1633, test_f1: 0.3577
 epoch: 99, train_loss: 1.1909, test_loss: 1.1631, test_f1: 0.3572
##################ITERATION #2 ****************************************
 epoch: 0, train_loss: 1.3086, test_loss: 1.3142, test_f1: 0.2274
 epoch: 1, train_loss: 1.3023, test_loss: 1.3072, test_f1: 0.2274
 epoch: 2, train_loss: 1.2990, test_loss: 1.3020, test_f1: 0.2274
 epoch: 3, train_loss: 1.2919, test_loss: 1.2983, test_f1: 0.2274
 epoch: 4, train_loss: 1.2890, test_loss: 1.2926, test_f1: 0.2274
 epoch: 5, train_loss: 1.2852, test_loss: 1.2874, test_f1: 0.2274
 epoch: 6, train_loss: 1.2804, test_loss: 1.2826, test_f1: 0.2274
 epoch: 7, train_loss: 1.2739, test_loss: 1.2781, test_f1: 0.2274
 epoch: 8, train_loss: 1.2750, test_loss: 1.2721, test_f1: 0.2274
 epoch: 9, train_loss: 1.2685, test_loss: 1.2678, test_f1: 0.2274
 epoch: 10, train_loss: 1.2641, test_loss: 1.2629, test_f1: 0.2325
 epoch: 11, train_loss: 1.2638, test_loss: 1.2594, test_f1: 0.2449
 epoch: 12, train_loss: 1.2578, test_loss: 1.2555, test_f1: 0.2513
 epoch: 13, train_loss: 1.2570, test_loss: 1.2509, test_f1: 0.2535
 epoch: 14, train_loss: 1.2532, test_loss: 1.2460, test_f1: 0.2941
 epoch: 15, train_loss: 1.2500, test_loss: 1.2409, test_f1: 0.2918
 epoch: 16, train_loss: 1.2494, test_loss: 1.2385, test_f1: 0.2977
 epoch: 17, train_loss: 1.2478, test_loss: 1.2340, test_f1: 0.3071
 epoch: 18, train_loss: 1.2440, test_loss: 1.2313, test_f1: 0.3104
 epoch: 19, train_loss: 1.2440, test_loss: 1.2287, test_f1: 0.3175
 epoch: 20, train_loss: 1.2335, test_loss: 1.2257, test_f1: 0.3167
 epoch: 21, train_loss: 1.2385, test_loss: 1.2224, test_f1: 0.3256
 epoch: 22, train_loss: 1.2341, test_loss: 1.2214, test_f1: 0.3265
 epoch: 23, train_loss: 1.2344, test_loss: 1.2185, test_f1: 0.3275
 epoch: 24, train_loss: 1.2331, test_loss: 1.2183, test_f1: 0.3300
 epoch: 25, train_loss: 1.2282, test_loss: 1.2146, test_f1: 0.3292
 epoch: 26, train_loss: 1.2249, test_loss: 1.2134, test_f1: 0.3294
 epoch: 27, train_loss: 1.2266, test_loss: 1.2112, test_f1: 0.3264
 epoch: 28, train_loss: 1.2242, test_loss: 1.2098, test_f1: 0.3266
 epoch: 29, train_loss: 1.2227, test_loss: 1.2086, test_f1: 0.3295
 epoch: 30, train_loss: 1.2213, test_loss: 1.2087, test_f1: 0.3289
 epoch: 31, train_loss: 1.2236, test_loss: 1.2072, test_f1: 0.3306
 epoch: 32, train_loss: 1.2173, test_loss: 1.2038, test_f1: 0.3316
 epoch: 33, train_loss: 1.2207, test_loss: 1.2014, test_f1: 0.3367
 epoch: 34, train_loss: 1.2222, test_loss: 1.2011, test_f1: 0.3318
 epoch: 35, train_loss: 1.2255, test_loss: 1.2009, test_f1: 0.3361
 epoch: 36, train_loss: 1.2159, test_loss: 1.1978, test_f1: 0.3367
 epoch: 37, train_loss: 1.2138, test_loss: 1.1983, test_f1: 0.3385
 epoch: 38, train_loss: 1.2121, test_loss: 1.1981, test_f1: 0.3403
 epoch: 39, train_loss: 1.2123, test_loss: 1.1966, test_f1: 0.3409
 epoch: 40, train_loss: 1.2115, test_loss: 1.1947, test_f1: 0.3404
 epoch: 41, train_loss: 1.2131, test_loss: 1.1940, test_f1: 0.3399
 epoch: 42, train_loss: 1.2078, test_loss: 1.1946, test_f1: 0.3408
 epoch: 43, train_loss: 1.2121, test_loss: 1.1955, test_f1: 0.3399
 epoch: 44, train_loss: 1.2088, test_loss: 1.1933, test_f1: 0.3400
 epoch: 45, train_loss: 1.2080, test_loss: 1.1924, test_f1: 0.3428
 epoch: 46, train_loss: 1.2096, test_loss: 1.1895, test_f1: 0.3406
 epoch: 47, train_loss: 1.2057, test_loss: 1.1924, test_f1: 0.3424
 epoch: 48, train_loss: 1.2057, test_loss: 1.1895, test_f1: 0.3404
 epoch: 49, train_loss: 1.2023, test_loss: 1.1911, test_f1: 0.3414
 epoch: 50, train_loss: 1.2037, test_loss: 1.1883, test_f1: 0.3422
 epoch: 51, train_loss: 1.2011, test_loss: 1.1874, test_f1: 0.3418
 epoch: 52, train_loss: 1.2045, test_loss: 1.1879, test_f1: 0.3409
 epoch: 53, train_loss: 1.2003, test_loss: 1.1879, test_f1: 0.3422
 epoch: 54, train_loss: 1.2043, test_loss: 1.1886, test_f1: 0.3422
 epoch: 55, train_loss: 1.1998, test_loss: 1.1878, test_f1: 0.3473
 epoch: 56, train_loss: 1.1976, test_loss: 1.1873, test_f1: 0.3475
 epoch: 57, train_loss: 1.1944, test_loss: 1.1870, test_f1: 0.3422
 epoch: 58, train_loss: 1.2015, test_loss: 1.1861, test_f1: 0.3474
 epoch: 59, train_loss: 1.2003, test_loss: 1.1869, test_f1: 0.3398
 epoch: 60, train_loss: 1.1905, test_loss: 1.1859, test_f1: 0.3455
 epoch: 61, train_loss: 1.1958, test_loss: 1.1858, test_f1: 0.3419
 epoch: 62, train_loss: 1.1977, test_loss: 1.1852, test_f1: 0.3422
 epoch: 63, train_loss: 1.2003, test_loss: 1.1853, test_f1: 0.3452
 epoch: 64, train_loss: 1.1952, test_loss: 1.1855, test_f1: 0.3447
 epoch: 65, train_loss: 1.1970, test_loss: 1.1850, test_f1: 0.3424
 epoch: 66, train_loss: 1.1916, test_loss: 1.1842, test_f1: 0.3450
 epoch: 67, train_loss: 1.1950, test_loss: 1.1839, test_f1: 0.3450
 epoch: 68, train_loss: 1.1959, test_loss: 1.1845, test_f1: 0.3400
 epoch: 69, train_loss: 1.1887, test_loss: 1.1835, test_f1: 0.3450
 epoch: 70, train_loss: 1.1944, test_loss: 1.1837, test_f1: 0.3417
 epoch: 71, train_loss: 1.1910, test_loss: 1.1842, test_f1: 0.3447
 epoch: 72, train_loss: 1.1871, test_loss: 1.1830, test_f1: 0.3454
 epoch: 73, train_loss: 1.1842, test_loss: 1.1841, test_f1: 0.3457
 epoch: 74, train_loss: 1.1930, test_loss: 1.1827, test_f1: 0.3455
 epoch: 75, train_loss: 1.1885, test_loss: 1.1830, test_f1: 0.3436
 epoch: 76, train_loss: 1.1929, test_loss: 1.1827, test_f1: 0.3396
 epoch: 77, train_loss: 1.1894, test_loss: 1.1820, test_f1: 0.3474
 epoch: 78, train_loss: 1.1884, test_loss: 1.1811, test_f1: 0.3360
 epoch: 79, train_loss: 1.1927, test_loss: 1.1811, test_f1: 0.3416
 epoch: 80, train_loss: 1.1862, test_loss: 1.1832, test_f1: 0.3413
 epoch: 81, train_loss: 1.1893, test_loss: 1.1827, test_f1: 0.3437
 epoch: 82, train_loss: 1.1855, test_loss: 1.1815, test_f1: 0.3445
 epoch: 83, train_loss: 1.1933, test_loss: 1.1817, test_f1: 0.3408
 epoch: 84, train_loss: 1.1861, test_loss: 1.1805, test_f1: 0.3469
 epoch: 85, train_loss: 1.1891, test_loss: 1.1791, test_f1: 0.3453
 epoch: 86, train_loss: 1.1832, test_loss: 1.1807, test_f1: 0.3437
 epoch: 87, train_loss: 1.1891, test_loss: 1.1798, test_f1: 0.3508
 epoch: 88, train_loss: 1.1860, test_loss: 1.1797, test_f1: 0.3473
 epoch: 89, train_loss: 1.1893, test_loss: 1.1822, test_f1: 0.3421
 epoch: 90, train_loss: 1.1803, test_loss: 1.1820, test_f1: 0.3417
 epoch: 91, train_loss: 1.1816, test_loss: 1.1817, test_f1: 0.3437
 epoch: 92, train_loss: 1.1843, test_loss: 1.1804, test_f1: 0.3450
 epoch: 93, train_loss: 1.1812, test_loss: 1.1813, test_f1: 0.3450
 epoch: 94, train_loss: 1.1781, test_loss: 1.1804, test_f1: 0.3454
 epoch: 95, train_loss: 1.1830, test_loss: 1.1784, test_f1: 0.3461
 epoch: 96, train_loss: 1.1789, test_loss: 1.1779, test_f1: 0.3509
 epoch: 97, train_loss: 1.1859, test_loss: 1.1792, test_f1: 0.3509
 epoch: 98, train_loss: 1.1790, test_loss: 1.1788, test_f1: 0.3521
 epoch: 99, train_loss: 1.1773, test_loss: 1.1775, test_f1: 0.3516
##################ITERATION #3 ****************************************
 epoch: 0, train_loss: 1.3109, test_loss: 1.3192, test_f1: 0.2274
 epoch: 1, train_loss: 1.3033, test_loss: 1.3117, test_f1: 0.2274
 epoch: 2, train_loss: 1.3008, test_loss: 1.3077, test_f1: 0.2274
 epoch: 3, train_loss: 1.2953, test_loss: 1.3032, test_f1: 0.2274
 epoch: 4, train_loss: 1.2944, test_loss: 1.3006, test_f1: 0.2274
 epoch: 5, train_loss: 1.2891, test_loss: 1.2964, test_f1: 0.2274
 epoch: 6, train_loss: 1.2880, test_loss: 1.2948, test_f1: 0.2274
 epoch: 7, train_loss: 1.2836, test_loss: 1.2903, test_f1: 0.2274
 epoch: 8, train_loss: 1.2790, test_loss: 1.2871, test_f1: 0.2274
 epoch: 9, train_loss: 1.2771, test_loss: 1.2831, test_f1: 0.2274
 epoch: 10, train_loss: 1.2721, test_loss: 1.2809, test_f1: 0.2274
 epoch: 11, train_loss: 1.2711, test_loss: 1.2752, test_f1: 0.2274
 epoch: 12, train_loss: 1.2628, test_loss: 1.2689, test_f1: 0.2274
 epoch: 13, train_loss: 1.2635, test_loss: 1.2674, test_f1: 0.2274
 epoch: 14, train_loss: 1.2644, test_loss: 1.2617, test_f1: 0.2274
 epoch: 15, train_loss: 1.2657, test_loss: 1.2603, test_f1: 0.2327
 epoch: 16, train_loss: 1.2554, test_loss: 1.2569, test_f1: 0.2327
 epoch: 17, train_loss: 1.2546, test_loss: 1.2540, test_f1: 0.2327
 epoch: 18, train_loss: 1.2525, test_loss: 1.2530, test_f1: 0.2327
 epoch: 19, train_loss: 1.2520, test_loss: 1.2467, test_f1: 0.2327
 epoch: 20, train_loss: 1.2499, test_loss: 1.2451, test_f1: 0.2327
 epoch: 21, train_loss: 1.2442, test_loss: 1.2394, test_f1: 0.2378
 epoch: 22, train_loss: 1.2456, test_loss: 1.2384, test_f1: 0.2378
 epoch: 23, train_loss: 1.2442, test_loss: 1.2343, test_f1: 0.2377
 epoch: 24, train_loss: 1.2417, test_loss: 1.2323, test_f1: 0.2325
 epoch: 25, train_loss: 1.2377, test_loss: 1.2327, test_f1: 0.2365
 epoch: 26, train_loss: 1.2299, test_loss: 1.2253, test_f1: 0.2451
 epoch: 27, train_loss: 1.2345, test_loss: 1.2226, test_f1: 0.2539
 epoch: 28, train_loss: 1.2303, test_loss: 1.2214, test_f1: 0.2540
 epoch: 29, train_loss: 1.2289, test_loss: 1.2160, test_f1: 0.2551
 epoch: 30, train_loss: 1.2264, test_loss: 1.2159, test_f1: 0.2545
 epoch: 31, train_loss: 1.2239, test_loss: 1.2124, test_f1: 0.2659
 epoch: 32, train_loss: 1.2176, test_loss: 1.2108, test_f1: 0.2725
 epoch: 33, train_loss: 1.2191, test_loss: 1.2084, test_f1: 0.2692
 epoch: 34, train_loss: 1.2175, test_loss: 1.2029, test_f1: 0.2738
 epoch: 35, train_loss: 1.2207, test_loss: 1.2025, test_f1: 0.2751
 epoch: 36, train_loss: 1.2124, test_loss: 1.1955, test_f1: 0.2840
 epoch: 37, train_loss: 1.2155, test_loss: 1.1973, test_f1: 0.2943
 epoch: 38, train_loss: 1.2082, test_loss: 1.1961, test_f1: 0.3058
 epoch: 39, train_loss: 1.2100, test_loss: 1.1922, test_f1: 0.3149
 epoch: 40, train_loss: 1.2080, test_loss: 1.1906, test_f1: 0.3209
 epoch: 41, train_loss: 1.2120, test_loss: 1.1849, test_f1: 0.3221
 epoch: 42, train_loss: 1.2056, test_loss: 1.1844, test_f1: 0.3309
 epoch: 43, train_loss: 1.1980, test_loss: 1.1783, test_f1: 0.3368
 epoch: 44, train_loss: 1.2028, test_loss: 1.1731, test_f1: 0.3311
 epoch: 45, train_loss: 1.1991, test_loss: 1.1779, test_f1: 0.3299
 epoch: 46, train_loss: 1.1960, test_loss: 1.1756, test_f1: 0.3532
 epoch: 47, train_loss: 1.1963, test_loss: 1.1730, test_f1: 0.3621
 epoch: 48, train_loss: 1.1870, test_loss: 1.1672, test_f1: 0.3667
 epoch: 49, train_loss: 1.1921, test_loss: 1.1694, test_f1: 0.3732
 epoch: 50, train_loss: 1.1840, test_loss: 1.1656, test_f1: 0.3870
 epoch: 51, train_loss: 1.1885, test_loss: 1.1625, test_f1: 0.3802
 epoch: 52, train_loss: 1.1840, test_loss: 1.1645, test_f1: 0.3841
 epoch: 53, train_loss: 1.1868, test_loss: 1.1600, test_f1: 0.3875
 epoch: 54, train_loss: 1.1880, test_loss: 1.1613, test_f1: 0.3820
 epoch: 55, train_loss: 1.1806, test_loss: 1.1601, test_f1: 0.3903
 epoch: 56, train_loss: 1.1818, test_loss: 1.1586, test_f1: 0.3824
 epoch: 57, train_loss: 1.1804, test_loss: 1.1585, test_f1: 0.3809
 epoch: 58, train_loss: 1.1790, test_loss: 1.1595, test_f1: 0.3884
 epoch: 59, train_loss: 1.1833, test_loss: 1.1566, test_f1: 0.4062
 epoch: 60, train_loss: 1.1785, test_loss: 1.1569, test_f1: 0.4030
 epoch: 61, train_loss: 1.1821, test_loss: 1.1562, test_f1: 0.3963
 epoch: 62, train_loss: 1.1804, test_loss: 1.1556, test_f1: 0.4039
 epoch: 63, train_loss: 1.1790, test_loss: 1.1579, test_f1: 0.3913
 epoch: 64, train_loss: 1.1743, test_loss: 1.1535, test_f1: 0.4052
 epoch: 65, train_loss: 1.1825, test_loss: 1.1537, test_f1: 0.4002
 epoch: 66, train_loss: 1.1729, test_loss: 1.1530, test_f1: 0.4014
 epoch: 67, train_loss: 1.1754, test_loss: 1.1527, test_f1: 0.3975
 epoch: 68, train_loss: 1.1655, test_loss: 1.1520, test_f1: 0.4119
 epoch: 69, train_loss: 1.1702, test_loss: 1.1515, test_f1: 0.3981
 epoch: 70, train_loss: 1.1704, test_loss: 1.1511, test_f1: 0.4017
 epoch: 71, train_loss: 1.1650, test_loss: 1.1495, test_f1: 0.3950
 epoch: 72, train_loss: 1.1692, test_loss: 1.1494, test_f1: 0.3978
 epoch: 73, train_loss: 1.1572, test_loss: 1.1436, test_f1: 0.4090
 epoch: 74, train_loss: 1.1705, test_loss: 1.1433, test_f1: 0.4076
 epoch: 75, train_loss: 1.1665, test_loss: 1.1476, test_f1: 0.4196
 epoch: 76, train_loss: 1.1714, test_loss: 1.1498, test_f1: 0.4166
 epoch: 77, train_loss: 1.1621, test_loss: 1.1428, test_f1: 0.4151
 epoch: 78, train_loss: 1.1724, test_loss: 1.1420, test_f1: 0.4181
 epoch: 79, train_loss: 1.1618, test_loss: 1.1433, test_f1: 0.4161
 epoch: 80, train_loss: 1.1614, test_loss: 1.1403, test_f1: 0.4149
 epoch: 81, train_loss: 1.1661, test_loss: 1.1398, test_f1: 0.4242
 epoch: 82, train_loss: 1.1686, test_loss: 1.1393, test_f1: 0.4223
 epoch: 83, train_loss: 1.1526, test_loss: 1.1397, test_f1: 0.4244
 epoch: 84, train_loss: 1.1647, test_loss: 1.1397, test_f1: 0.4213
 epoch: 85, train_loss: 1.1627, test_loss: 1.1410, test_f1: 0.4171
 epoch: 86, train_loss: 1.1630, test_loss: 1.1367, test_f1: 0.4148
 epoch: 87, train_loss: 1.1604, test_loss: 1.1399, test_f1: 0.4151
 epoch: 88, train_loss: 1.1604, test_loss: 1.1396, test_f1: 0.4214
 epoch: 89, train_loss: 1.1584, test_loss: 1.1373, test_f1: 0.4234
 epoch: 90, train_loss: 1.1633, test_loss: 1.1395, test_f1: 0.4105
 epoch: 91, train_loss: 1.1566, test_loss: 1.1341, test_f1: 0.4043
 epoch: 92, train_loss: 1.1565, test_loss: 1.1387, test_f1: 0.4122
 epoch: 93, train_loss: 1.1548, test_loss: 1.1348, test_f1: 0.4130
 epoch: 94, train_loss: 1.1597, test_loss: 1.1320, test_f1: 0.4182
 epoch: 95, train_loss: 1.1522, test_loss: 1.1298, test_f1: 0.4322
 epoch: 96, train_loss: 1.1512, test_loss: 1.1323, test_f1: 0.4173
 epoch: 97, train_loss: 1.1483, test_loss: 1.1328, test_f1: 0.4128
 epoch: 98, train_loss: 1.1520, test_loss: 1.1327, test_f1: 0.4136
 epoch: 99, train_loss: 1.1606, test_loss: 1.1321, test_f1: 0.4164
##################ITERATION #4 ****************************************
 epoch: 0, train_loss: 1.3066, test_loss: 1.3073, test_f1: 0.2274
 epoch: 1, train_loss: 1.3004, test_loss: 1.2979, test_f1: 0.2274
 epoch: 2, train_loss: 1.2887, test_loss: 1.2920, test_f1: 0.2274
 epoch: 3, train_loss: 1.2857, test_loss: 1.2861, test_f1: 0.2274
 epoch: 4, train_loss: 1.2848, test_loss: 1.2824, test_f1: 0.2274
 epoch: 5, train_loss: 1.2769, test_loss: 1.2797, test_f1: 0.2274
 epoch: 6, train_loss: 1.2763, test_loss: 1.2736, test_f1: 0.2274
 epoch: 7, train_loss: 1.2707, test_loss: 1.2676, test_f1: 0.2325
 epoch: 8, train_loss: 1.2694, test_loss: 1.2652, test_f1: 0.2325
 epoch: 9, train_loss: 1.2613, test_loss: 1.2616, test_f1: 0.2435
 epoch: 10, train_loss: 1.2600, test_loss: 1.2550, test_f1: 0.2605
 epoch: 11, train_loss: 1.2588, test_loss: 1.2534, test_f1: 0.2658
 epoch: 12, train_loss: 1.2504, test_loss: 1.2496, test_f1: 0.2822
 epoch: 13, train_loss: 1.2510, test_loss: 1.2453, test_f1: 0.2748
 epoch: 14, train_loss: 1.2457, test_loss: 1.2429, test_f1: 0.2970
 epoch: 15, train_loss: 1.2439, test_loss: 1.2392, test_f1: 0.3013
 epoch: 16, train_loss: 1.2435, test_loss: 1.2361, test_f1: 0.2943
 epoch: 17, train_loss: 1.2417, test_loss: 1.2338, test_f1: 0.3032
 epoch: 18, train_loss: 1.2305, test_loss: 1.2293, test_f1: 0.3092
 epoch: 19, train_loss: 1.2321, test_loss: 1.2260, test_f1: 0.3268
 epoch: 20, train_loss: 1.2327, test_loss: 1.2247, test_f1: 0.3342
 epoch: 21, train_loss: 1.2298, test_loss: 1.2173, test_f1: 0.3300
 epoch: 22, train_loss: 1.2227, test_loss: 1.2139, test_f1: 0.3391
 epoch: 23, train_loss: 1.2244, test_loss: 1.2122, test_f1: 0.3313
 epoch: 24, train_loss: 1.2182, test_loss: 1.2083, test_f1: 0.3312
 epoch: 25, train_loss: 1.2173, test_loss: 1.2062, test_f1: 0.3359
 epoch: 26, train_loss: 1.2150, test_loss: 1.2020, test_f1: 0.3389
 epoch: 27, train_loss: 1.2112, test_loss: 1.1971, test_f1: 0.3418
 epoch: 28, train_loss: 1.2088, test_loss: 1.1925, test_f1: 0.3431
 epoch: 29, train_loss: 1.2058, test_loss: 1.1908, test_f1: 0.3426
 epoch: 30, train_loss: 1.2089, test_loss: 1.1890, test_f1: 0.3415
 epoch: 31, train_loss: 1.1987, test_loss: 1.1833, test_f1: 0.3424
 epoch: 32, train_loss: 1.1972, test_loss: 1.1816, test_f1: 0.3466
 epoch: 33, train_loss: 1.1965, test_loss: 1.1761, test_f1: 0.3502
 epoch: 34, train_loss: 1.1939, test_loss: 1.1753, test_f1: 0.3472
 epoch: 35, train_loss: 1.1920, test_loss: 1.1702, test_f1: 0.3641
 epoch: 36, train_loss: 1.1935, test_loss: 1.1689, test_f1: 0.3621
 epoch: 37, train_loss: 1.1903, test_loss: 1.1648, test_f1: 0.3757
 epoch: 38, train_loss: 1.1838, test_loss: 1.1595, test_f1: 0.3750
 epoch: 39, train_loss: 1.1876, test_loss: 1.1580, test_f1: 0.3767
 epoch: 40, train_loss: 1.1793, test_loss: 1.1536, test_f1: 0.3810
 epoch: 41, train_loss: 1.1791, test_loss: 1.1499, test_f1: 0.3936
 epoch: 42, train_loss: 1.1854, test_loss: 1.1481, test_f1: 0.4048
 epoch: 43, train_loss: 1.1768, test_loss: 1.1439, test_f1: 0.4001
 epoch: 44, train_loss: 1.1750, test_loss: 1.1415, test_f1: 0.3967
 epoch: 45, train_loss: 1.1684, test_loss: 1.1387, test_f1: 0.3988
 epoch: 46, train_loss: 1.1791, test_loss: 1.1341, test_f1: 0.4148
 epoch: 47, train_loss: 1.1763, test_loss: 1.1351, test_f1: 0.4138
 epoch: 48, train_loss: 1.1697, test_loss: 1.1311, test_f1: 0.4136
 epoch: 49, train_loss: 1.1679, test_loss: 1.1318, test_f1: 0.4148
 epoch: 50, train_loss: 1.1677, test_loss: 1.1228, test_f1: 0.4137
 epoch: 51, train_loss: 1.1580, test_loss: 1.1216, test_f1: 0.4169
 epoch: 52, train_loss: 1.1585, test_loss: 1.1245, test_f1: 0.4116
 epoch: 53, train_loss: 1.1585, test_loss: 1.1235, test_f1: 0.4124
 epoch: 54, train_loss: 1.1564, test_loss: 1.1178, test_f1: 0.4195
 epoch: 55, train_loss: 1.1586, test_loss: 1.1188, test_f1: 0.4136
 epoch: 56, train_loss: 1.1614, test_loss: 1.1188, test_f1: 0.4156
 epoch: 57, train_loss: 1.1592, test_loss: 1.1165, test_f1: 0.4194
 epoch: 58, train_loss: 1.1631, test_loss: 1.1175, test_f1: 0.4192
 epoch: 59, train_loss: 1.1531, test_loss: 1.1191, test_f1: 0.4235
 epoch: 60, train_loss: 1.1547, test_loss: 1.1136, test_f1: 0.4276
 epoch: 61, train_loss: 1.1546, test_loss: 1.1113, test_f1: 0.4298
 epoch: 62, train_loss: 1.1566, test_loss: 1.1108, test_f1: 0.4353
 epoch: 63, train_loss: 1.1545, test_loss: 1.1103, test_f1: 0.4278
 epoch: 64, train_loss: 1.1529, test_loss: 1.1107, test_f1: 0.4302
 epoch: 65, train_loss: 1.1447, test_loss: 1.1085, test_f1: 0.4271
 epoch: 66, train_loss: 1.1480, test_loss: 1.1053, test_f1: 0.4347
 epoch: 67, train_loss: 1.1476, test_loss: 1.1059, test_f1: 0.4341
 epoch: 68, train_loss: 1.1514, test_loss: 1.1058, test_f1: 0.4306
 epoch: 69, train_loss: 1.1493, test_loss: 1.1057, test_f1: 0.4298
 epoch: 70, train_loss: 1.1532, test_loss: 1.1048, test_f1: 0.4317
 epoch: 71, train_loss: 1.1443, test_loss: 1.1018, test_f1: 0.4311
 epoch: 72, train_loss: 1.1493, test_loss: 1.1009, test_f1: 0.4312
 epoch: 73, train_loss: 1.1456, test_loss: 1.1043, test_f1: 0.4264
 epoch: 74, train_loss: 1.1418, test_loss: 1.1032, test_f1: 0.4318
 epoch: 75, train_loss: 1.1444, test_loss: 1.1008, test_f1: 0.4322
 epoch: 76, train_loss: 1.1380, test_loss: 1.1003, test_f1: 0.4342
 epoch: 77, train_loss: 1.1398, test_loss: 1.1021, test_f1: 0.4311
 epoch: 78, train_loss: 1.1412, test_loss: 1.0979, test_f1: 0.4311
 epoch: 79, train_loss: 1.1385, test_loss: 1.0999, test_f1: 0.4313
 epoch: 80, train_loss: 1.1447, test_loss: 1.0976, test_f1: 0.4335
 epoch: 81, train_loss: 1.1386, test_loss: 1.0961, test_f1: 0.4344
 epoch: 82, train_loss: 1.1399, test_loss: 1.0972, test_f1: 0.4361
 epoch: 83, train_loss: 1.1364, test_loss: 1.0934, test_f1: 0.4352
 epoch: 84, train_loss: 1.1369, test_loss: 1.0933, test_f1: 0.4333
 epoch: 85, train_loss: 1.1363, test_loss: 1.0923, test_f1: 0.4313
 epoch: 86, train_loss: 1.1351, test_loss: 1.0925, test_f1: 0.4335
 epoch: 87, train_loss: 1.1399, test_loss: 1.0909, test_f1: 0.4346
 epoch: 88, train_loss: 1.1336, test_loss: 1.0919, test_f1: 0.4358
 epoch: 89, train_loss: 1.1457, test_loss: 1.0892, test_f1: 0.4338
 epoch: 90, train_loss: 1.1302, test_loss: 1.0901, test_f1: 0.4328
 epoch: 91, train_loss: 1.1383, test_loss: 1.0923, test_f1: 0.4427
 epoch: 92, train_loss: 1.1299, test_loss: 1.0916, test_f1: 0.4339
 epoch: 93, train_loss: 1.1272, test_loss: 1.0868, test_f1: 0.4355
 epoch: 94, train_loss: 1.1295, test_loss: 1.0877, test_f1: 0.4398
 epoch: 95, train_loss: 1.1309, test_loss: 1.0828, test_f1: 0.4326
 epoch: 96, train_loss: 1.1338, test_loss: 1.0815, test_f1: 0.4374
 epoch: 97, train_loss: 1.1268, test_loss: 1.0840, test_f1: 0.4352
 epoch: 98, train_loss: 1.1303, test_loss: 1.0830, test_f1: 0.4416
 epoch: 99, train_loss: 1.1322, test_loss: 1.0850, test_f1: 0.4431
##################ITERATION #5 ****************************************
 epoch: 0, train_loss: 1.3035, test_loss: 1.2996, test_f1: 0.2274
 epoch: 1, train_loss: 1.2886, test_loss: 1.2865, test_f1: 0.2274
 epoch: 2, train_loss: 1.2851, test_loss: 1.2794, test_f1: 0.2274
 epoch: 3, train_loss: 1.2771, test_loss: 1.2715, test_f1: 0.2266
 epoch: 4, train_loss: 1.2696, test_loss: 1.2648, test_f1: 0.2262
 epoch: 5, train_loss: 1.2644, test_loss: 1.2593, test_f1: 0.2410
 epoch: 6, train_loss: 1.2643, test_loss: 1.2523, test_f1: 0.2552
 epoch: 7, train_loss: 1.2616, test_loss: 1.2467, test_f1: 0.2618
 epoch: 8, train_loss: 1.2550, test_loss: 1.2410, test_f1: 0.2740
 epoch: 9, train_loss: 1.2526, test_loss: 1.2395, test_f1: 0.2914
 epoch: 10, train_loss: 1.2447, test_loss: 1.2332, test_f1: 0.3022
 epoch: 11, train_loss: 1.2438, test_loss: 1.2302, test_f1: 0.3081
 epoch: 12, train_loss: 1.2438, test_loss: 1.2246, test_f1: 0.3059
 epoch: 13, train_loss: 1.2386, test_loss: 1.2228, test_f1: 0.3125
 epoch: 14, train_loss: 1.2380, test_loss: 1.2196, test_f1: 0.3180
 epoch: 15, train_loss: 1.2385, test_loss: 1.2179, test_f1: 0.3246
 epoch: 16, train_loss: 1.2330, test_loss: 1.2129, test_f1: 0.3233
 epoch: 17, train_loss: 1.2359, test_loss: 1.2122, test_f1: 0.3309
 epoch: 18, train_loss: 1.2336, test_loss: 1.2107, test_f1: 0.3330
 epoch: 19, train_loss: 1.2341, test_loss: 1.2087, test_f1: 0.3339
 epoch: 20, train_loss: 1.2276, test_loss: 1.2056, test_f1: 0.3535
 epoch: 21, train_loss: 1.2293, test_loss: 1.2063, test_f1: 0.3509
 epoch: 22, train_loss: 1.2212, test_loss: 1.2039, test_f1: 0.3593
 epoch: 23, train_loss: 1.2191, test_loss: 1.2024, test_f1: 0.3442
 epoch: 24, train_loss: 1.2231, test_loss: 1.2012, test_f1: 0.3727
 epoch: 25, train_loss: 1.2260, test_loss: 1.1979, test_f1: 0.3653
 epoch: 26, train_loss: 1.2193, test_loss: 1.1994, test_f1: 0.3614
 epoch: 27, train_loss: 1.2202, test_loss: 1.1983, test_f1: 0.3664
 epoch: 28, train_loss: 1.2117, test_loss: 1.1982, test_f1: 0.3718
 epoch: 29, train_loss: 1.2175, test_loss: 1.1972, test_f1: 0.3750
 epoch: 30, train_loss: 1.2154, test_loss: 1.1939, test_f1: 0.3615
 epoch: 31, train_loss: 1.2089, test_loss: 1.1941, test_f1: 0.3770
 epoch: 32, train_loss: 1.2106, test_loss: 1.1947, test_f1: 0.3779
 epoch: 33, train_loss: 1.2031, test_loss: 1.1926, test_f1: 0.3839
 epoch: 34, train_loss: 1.2030, test_loss: 1.1946, test_f1: 0.3849
 epoch: 35, train_loss: 1.2076, test_loss: 1.1933, test_f1: 0.3775
 epoch: 36, train_loss: 1.2062, test_loss: 1.1891, test_f1: 0.3765
 epoch: 37, train_loss: 1.2015, test_loss: 1.1908, test_f1: 0.3862
 epoch: 38, train_loss: 1.2005, test_loss: 1.1891, test_f1: 0.3824
 epoch: 39, train_loss: 1.2015, test_loss: 1.1884, test_f1: 0.3834
 epoch: 40, train_loss: 1.2047, test_loss: 1.1877, test_f1: 0.3848
 epoch: 41, train_loss: 1.2007, test_loss: 1.1870, test_f1: 0.3903
 epoch: 42, train_loss: 1.1981, test_loss: 1.1850, test_f1: 0.3864
 epoch: 43, train_loss: 1.1982, test_loss: 1.1861, test_f1: 0.3850
 epoch: 44, train_loss: 1.1981, test_loss: 1.1851, test_f1: 0.3849
 epoch: 45, train_loss: 1.1981, test_loss: 1.1831, test_f1: 0.3844
 epoch: 46, train_loss: 1.1964, test_loss: 1.1855, test_f1: 0.3851
 epoch: 47, train_loss: 1.1941, test_loss: 1.1807, test_f1: 0.3816
 epoch: 48, train_loss: 1.1925, test_loss: 1.1843, test_f1: 0.3893
 epoch: 49, train_loss: 1.1917, test_loss: 1.1824, test_f1: 0.3889
 epoch: 50, train_loss: 1.1952, test_loss: 1.1817, test_f1: 0.3871
 epoch: 51, train_loss: 1.1898, test_loss: 1.1794, test_f1: 0.3894
 epoch: 52, train_loss: 1.1973, test_loss: 1.1805, test_f1: 0.3888
 epoch: 53, train_loss: 1.1914, test_loss: 1.1785, test_f1: 0.3837
 epoch: 54, train_loss: 1.1914, test_loss: 1.1812, test_f1: 0.3865
 epoch: 55, train_loss: 1.1929, test_loss: 1.1798, test_f1: 0.3904
 epoch: 56, train_loss: 1.1869, test_loss: 1.1784, test_f1: 0.3907
 epoch: 57, train_loss: 1.1883, test_loss: 1.1783, test_f1: 0.3919
 epoch: 58, train_loss: 1.1846, test_loss: 1.1793, test_f1: 0.3892
 epoch: 59, train_loss: 1.1797, test_loss: 1.1796, test_f1: 0.3953
 epoch: 60, train_loss: 1.1821, test_loss: 1.1762, test_f1: 0.3909
 epoch: 61, train_loss: 1.1845, test_loss: 1.1757, test_f1: 0.3927
 epoch: 62, train_loss: 1.1816, test_loss: 1.1743, test_f1: 0.3908
 epoch: 63, train_loss: 1.1818, test_loss: 1.1762, test_f1: 0.3948
 epoch: 64, train_loss: 1.1849, test_loss: 1.1793, test_f1: 0.3925
 epoch: 65, train_loss: 1.1882, test_loss: 1.1754, test_f1: 0.3919
 epoch: 66, train_loss: 1.1811, test_loss: 1.1740, test_f1: 0.3918
 epoch: 67, train_loss: 1.1807, test_loss: 1.1715, test_f1: 0.3854
 epoch: 68, train_loss: 1.1778, test_loss: 1.1735, test_f1: 0.3907
 epoch: 69, train_loss: 1.1813, test_loss: 1.1718, test_f1: 0.3879
 epoch: 70, train_loss: 1.1825, test_loss: 1.1731, test_f1: 0.3944
 epoch: 71, train_loss: 1.1785, test_loss: 1.1719, test_f1: 0.3911
 epoch: 72, train_loss: 1.1799, test_loss: 1.1724, test_f1: 0.3886
 epoch: 73, train_loss: 1.1778, test_loss: 1.1720, test_f1: 0.3896
 epoch: 74, train_loss: 1.1772, test_loss: 1.1701, test_f1: 0.3907
 epoch: 75, train_loss: 1.1752, test_loss: 1.1702, test_f1: 0.3904
 epoch: 76, train_loss: 1.1753, test_loss: 1.1708, test_f1: 0.3859
 epoch: 77, train_loss: 1.1787, test_loss: 1.1711, test_f1: 0.3878
 epoch: 78, train_loss: 1.1723, test_loss: 1.1688, test_f1: 0.3954
 epoch: 79, train_loss: 1.1713, test_loss: 1.1676, test_f1: 0.3939
 epoch: 80, train_loss: 1.1748, test_loss: 1.1674, test_f1: 0.3968
 epoch: 81, train_loss: 1.1795, test_loss: 1.1656, test_f1: 0.3921
 epoch: 82, train_loss: 1.1765, test_loss: 1.1624, test_f1: 0.3890
 epoch: 83, train_loss: 1.1758, test_loss: 1.1675, test_f1: 0.3934
 epoch: 84, train_loss: 1.1765, test_loss: 1.1636, test_f1: 0.3957
 epoch: 85, train_loss: 1.1669, test_loss: 1.1628, test_f1: 0.3965
 epoch: 86, train_loss: 1.1727, test_loss: 1.1613, test_f1: 0.3965
 epoch: 87, train_loss: 1.1765, test_loss: 1.1628, test_f1: 0.3946
 epoch: 88, train_loss: 1.1721, test_loss: 1.1604, test_f1: 0.3917
 epoch: 89, train_loss: 1.1692, test_loss: 1.1623, test_f1: 0.3944
 epoch: 90, train_loss: 1.1662, test_loss: 1.1579, test_f1: 0.3964
 epoch: 91, train_loss: 1.1725, test_loss: 1.1557, test_f1: 0.3984
 epoch: 92, train_loss: 1.1639, test_loss: 1.1616, test_f1: 0.3974
 epoch: 93, train_loss: 1.1751, test_loss: 1.1575, test_f1: 0.3982
 epoch: 94, train_loss: 1.1719, test_loss: 1.1559, test_f1: 0.4022
 epoch: 95, train_loss: 1.1610, test_loss: 1.1581, test_f1: 0.4001
 epoch: 96, train_loss: 1.1634, test_loss: 1.1544, test_f1: 0.3958
 epoch: 97, train_loss: 1.1586, test_loss: 1.1557, test_f1: 0.4051
 epoch: 98, train_loss: 1.1684, test_loss: 1.1547, test_f1: 0.4029
 epoch: 99, train_loss: 1.1699, test_loss: 1.1580, test_f1: 0.4019
##################ITERATION #6 ****************************************
 epoch: 0, train_loss: 1.3055, test_loss: 1.2959, test_f1: 0.2555
 epoch: 1, train_loss: 1.2951, test_loss: 1.2868, test_f1: 0.2667
 epoch: 2, train_loss: 1.2829, test_loss: 1.2797, test_f1: 0.2726
 epoch: 3, train_loss: 1.2836, test_loss: 1.2734, test_f1: 0.2711
 epoch: 4, train_loss: 1.2771, test_loss: 1.2680, test_f1: 0.2719
 epoch: 5, train_loss: 1.2712, test_loss: 1.2649, test_f1: 0.2713
 epoch: 6, train_loss: 1.2669, test_loss: 1.2597, test_f1: 0.2713
 epoch: 7, train_loss: 1.2657, test_loss: 1.2560, test_f1: 0.2735
 epoch: 8, train_loss: 1.2645, test_loss: 1.2532, test_f1: 0.2755
 epoch: 9, train_loss: 1.2597, test_loss: 1.2483, test_f1: 0.2714
 epoch: 10, train_loss: 1.2603, test_loss: 1.2446, test_f1: 0.2756
 epoch: 11, train_loss: 1.2567, test_loss: 1.2416, test_f1: 0.2810
 epoch: 12, train_loss: 1.2540, test_loss: 1.2382, test_f1: 0.2810
 epoch: 13, train_loss: 1.2507, test_loss: 1.2358, test_f1: 0.2830
 epoch: 14, train_loss: 1.2508, test_loss: 1.2357, test_f1: 0.2830
 epoch: 15, train_loss: 1.2471, test_loss: 1.2324, test_f1: 0.2919
 epoch: 16, train_loss: 1.2476, test_loss: 1.2322, test_f1: 0.2872
 epoch: 17, train_loss: 1.2452, test_loss: 1.2319, test_f1: 0.2930
 epoch: 18, train_loss: 1.2453, test_loss: 1.2301, test_f1: 0.2964
 epoch: 19, train_loss: 1.2355, test_loss: 1.2265, test_f1: 0.2983
 epoch: 20, train_loss: 1.2436, test_loss: 1.2253, test_f1: 0.3068
 epoch: 21, train_loss: 1.2383, test_loss: 1.2212, test_f1: 0.3076
 epoch: 22, train_loss: 1.2386, test_loss: 1.2203, test_f1: 0.3076
 epoch: 23, train_loss: 1.2361, test_loss: 1.2193, test_f1: 0.3117
 epoch: 24, train_loss: 1.2337, test_loss: 1.2150, test_f1: 0.3250
 epoch: 25, train_loss: 1.2382, test_loss: 1.2150, test_f1: 0.3324
 epoch: 26, train_loss: 1.2314, test_loss: 1.2143, test_f1: 0.3316
 epoch: 27, train_loss: 1.2318, test_loss: 1.2120, test_f1: 0.3306
 epoch: 28, train_loss: 1.2266, test_loss: 1.2097, test_f1: 0.3330
 epoch: 29, train_loss: 1.2236, test_loss: 1.2098, test_f1: 0.3431
 epoch: 30, train_loss: 1.2266, test_loss: 1.2085, test_f1: 0.3461
 epoch: 31, train_loss: 1.2251, test_loss: 1.2061, test_f1: 0.3345
 epoch: 32, train_loss: 1.2244, test_loss: 1.2042, test_f1: 0.3405
 epoch: 33, train_loss: 1.2184, test_loss: 1.2014, test_f1: 0.3434
 epoch: 34, train_loss: 1.2134, test_loss: 1.2005, test_f1: 0.3504
 epoch: 35, train_loss: 1.2160, test_loss: 1.1978, test_f1: 0.3571
 epoch: 36, train_loss: 1.2188, test_loss: 1.1965, test_f1: 0.3505
 epoch: 37, train_loss: 1.2162, test_loss: 1.1971, test_f1: 0.3595
 epoch: 38, train_loss: 1.2144, test_loss: 1.1934, test_f1: 0.3481
 epoch: 39, train_loss: 1.2150, test_loss: 1.1925, test_f1: 0.3370
 epoch: 40, train_loss: 1.2085, test_loss: 1.1921, test_f1: 0.3509
 epoch: 41, train_loss: 1.2031, test_loss: 1.1880, test_f1: 0.3629
 epoch: 42, train_loss: 1.2054, test_loss: 1.1845, test_f1: 0.3569
 epoch: 43, train_loss: 1.2027, test_loss: 1.1866, test_f1: 0.3648
 epoch: 44, train_loss: 1.2021, test_loss: 1.1857, test_f1: 0.3635
 epoch: 45, train_loss: 1.1991, test_loss: 1.1830, test_f1: 0.3677
 epoch: 46, train_loss: 1.1998, test_loss: 1.1842, test_f1: 0.3631
 epoch: 47, train_loss: 1.2013, test_loss: 1.1800, test_f1: 0.3646
 epoch: 48, train_loss: 1.1911, test_loss: 1.1813, test_f1: 0.3812
 epoch: 49, train_loss: 1.1967, test_loss: 1.1794, test_f1: 0.3754
 epoch: 50, train_loss: 1.1959, test_loss: 1.1815, test_f1: 0.3699
 epoch: 51, train_loss: 1.1937, test_loss: 1.1767, test_f1: 0.3822
 epoch: 52, train_loss: 1.1924, test_loss: 1.1747, test_f1: 0.3785
 epoch: 53, train_loss: 1.1898, test_loss: 1.1767, test_f1: 0.3792
 epoch: 54, train_loss: 1.1890, test_loss: 1.1773, test_f1: 0.3825
 epoch: 55, train_loss: 1.1862, test_loss: 1.1739, test_f1: 0.3896
 epoch: 56, train_loss: 1.1916, test_loss: 1.1741, test_f1: 0.3794
 epoch: 57, train_loss: 1.1909, test_loss: 1.1762, test_f1: 0.3772
 epoch: 58, train_loss: 1.1901, test_loss: 1.1769, test_f1: 0.3791
 epoch: 59, train_loss: 1.1950, test_loss: 1.1744, test_f1: 0.3864
 epoch: 60, train_loss: 1.1847, test_loss: 1.1735, test_f1: 0.3813
 epoch: 61, train_loss: 1.1825, test_loss: 1.1730, test_f1: 0.3837
 epoch: 62, train_loss: 1.1927, test_loss: 1.1716, test_f1: 0.3870
 epoch: 63, train_loss: 1.1862, test_loss: 1.1757, test_f1: 0.3739
 epoch: 64, train_loss: 1.1851, test_loss: 1.1725, test_f1: 0.3811
 epoch: 65, train_loss: 1.1799, test_loss: 1.1710, test_f1: 0.3834
 epoch: 66, train_loss: 1.1852, test_loss: 1.1697, test_f1: 0.3872
 epoch: 67, train_loss: 1.1885, test_loss: 1.1693, test_f1: 0.3894
 epoch: 68, train_loss: 1.1822, test_loss: 1.1703, test_f1: 0.3884
 epoch: 69, train_loss: 1.1803, test_loss: 1.1701, test_f1: 0.3865
 epoch: 70, train_loss: 1.1824, test_loss: 1.1677, test_f1: 0.3819
 epoch: 71, train_loss: 1.1782, test_loss: 1.1684, test_f1: 0.3813
 epoch: 72, train_loss: 1.1803, test_loss: 1.1667, test_f1: 0.3854
 epoch: 73, train_loss: 1.1813, test_loss: 1.1652, test_f1: 0.3844
 epoch: 74, train_loss: 1.1762, test_loss: 1.1690, test_f1: 0.3846
 epoch: 75, train_loss: 1.1755, test_loss: 1.1668, test_f1: 0.3973
 epoch: 76, train_loss: 1.1793, test_loss: 1.1654, test_f1: 0.3984
 epoch: 77, train_loss: 1.1770, test_loss: 1.1653, test_f1: 0.4020
 epoch: 78, train_loss: 1.1739, test_loss: 1.1657, test_f1: 0.3925
 epoch: 79, train_loss: 1.1794, test_loss: 1.1667, test_f1: 0.3905
 epoch: 80, train_loss: 1.1851, test_loss: 1.1648, test_f1: 0.3957
 epoch: 81, train_loss: 1.1724, test_loss: 1.1663, test_f1: 0.3962
 epoch: 82, train_loss: 1.1687, test_loss: 1.1641, test_f1: 0.3944
 epoch: 83, train_loss: 1.1723, test_loss: 1.1643, test_f1: 0.3933
 epoch: 84, train_loss: 1.1779, test_loss: 1.1629, test_f1: 0.3976
 epoch: 85, train_loss: 1.1719, test_loss: 1.1637, test_f1: 0.4005
 epoch: 86, train_loss: 1.1710, test_loss: 1.1624, test_f1: 0.3926
 epoch: 87, train_loss: 1.1817, test_loss: 1.1625, test_f1: 0.4040
 epoch: 88, train_loss: 1.1727, test_loss: 1.1603, test_f1: 0.3921
 epoch: 89, train_loss: 1.1717, test_loss: 1.1586, test_f1: 0.3947
 epoch: 90, train_loss: 1.1661, test_loss: 1.1604, test_f1: 0.3960
 epoch: 91, train_loss: 1.1641, test_loss: 1.1613, test_f1: 0.3911
 epoch: 92, train_loss: 1.1656, test_loss: 1.1609, test_f1: 0.3940
 epoch: 93, train_loss: 1.1658, test_loss: 1.1576, test_f1: 0.4088
 epoch: 94, train_loss: 1.1641, test_loss: 1.1592, test_f1: 0.3986
 epoch: 95, train_loss: 1.1670, test_loss: 1.1580, test_f1: 0.3983
 epoch: 96, train_loss: 1.1648, test_loss: 1.1582, test_f1: 0.3928
 epoch: 97, train_loss: 1.1674, test_loss: 1.1548, test_f1: 0.4038
 epoch: 98, train_loss: 1.1683, test_loss: 1.1569, test_f1: 0.4053
 epoch: 99, train_loss: 1.1609, test_loss: 1.1560, test_f1: 0.4021
##################ITERATION #7 ****************************************
 epoch: 0, train_loss: 1.3204, test_loss: 1.3129, test_f1: 0.2274
 epoch: 1, train_loss: 1.3029, test_loss: 1.2966, test_f1: 0.2389
 epoch: 2, train_loss: 1.2822, test_loss: 1.2887, test_f1: 0.2322
 epoch: 3, train_loss: 1.2832, test_loss: 1.2820, test_f1: 0.2447
 epoch: 4, train_loss: 1.2814, test_loss: 1.2747, test_f1: 0.2547
 epoch: 5, train_loss: 1.2804, test_loss: 1.2680, test_f1: 0.2603
 epoch: 6, train_loss: 1.2719, test_loss: 1.2624, test_f1: 0.2817
 epoch: 7, train_loss: 1.2605, test_loss: 1.2571, test_f1: 0.2801
 epoch: 8, train_loss: 1.2708, test_loss: 1.2532, test_f1: 0.2956
 epoch: 9, train_loss: 1.2625, test_loss: 1.2527, test_f1: 0.2861
 epoch: 10, train_loss: 1.2593, test_loss: 1.2482, test_f1: 0.2956
 epoch: 11, train_loss: 1.2527, test_loss: 1.2430, test_f1: 0.3013
 epoch: 12, train_loss: 1.2524, test_loss: 1.2416, test_f1: 0.3084
 epoch: 13, train_loss: 1.2498, test_loss: 1.2366, test_f1: 0.3083
 epoch: 14, train_loss: 1.2395, test_loss: 1.2327, test_f1: 0.3099
 epoch: 15, train_loss: 1.2407, test_loss: 1.2283, test_f1: 0.3257
 epoch: 16, train_loss: 1.2389, test_loss: 1.2234, test_f1: 0.3376
 epoch: 17, train_loss: 1.2349, test_loss: 1.2232, test_f1: 0.3260
 epoch: 18, train_loss: 1.2338, test_loss: 1.2206, test_f1: 0.3234
 epoch: 19, train_loss: 1.2348, test_loss: 1.2136, test_f1: 0.3468
 epoch: 20, train_loss: 1.2257, test_loss: 1.2152, test_f1: 0.3346
 epoch: 21, train_loss: 1.2207, test_loss: 1.2111, test_f1: 0.3421
 epoch: 22, train_loss: 1.2293, test_loss: 1.2058, test_f1: 0.3488
 epoch: 23, train_loss: 1.2208, test_loss: 1.2050, test_f1: 0.3455
 epoch: 24, train_loss: 1.2169, test_loss: 1.2000, test_f1: 0.3461
 epoch: 25, train_loss: 1.2234, test_loss: 1.1975, test_f1: 0.3589
 epoch: 26, train_loss: 1.2152, test_loss: 1.1936, test_f1: 0.3618
 epoch: 27, train_loss: 1.2103, test_loss: 1.1915, test_f1: 0.3422
 epoch: 28, train_loss: 1.2084, test_loss: 1.1889, test_f1: 0.3643
 epoch: 29, train_loss: 1.2073, test_loss: 1.1855, test_f1: 0.3624
 epoch: 30, train_loss: 1.2025, test_loss: 1.1823, test_f1: 0.3545
 epoch: 31, train_loss: 1.2021, test_loss: 1.1803, test_f1: 0.3450
 epoch: 32, train_loss: 1.1996, test_loss: 1.1776, test_f1: 0.3706
 epoch: 33, train_loss: 1.2008, test_loss: 1.1749, test_f1: 0.3409
 epoch: 34, train_loss: 1.1923, test_loss: 1.1757, test_f1: 0.3423
 epoch: 35, train_loss: 1.1975, test_loss: 1.1685, test_f1: 0.3512
 epoch: 36, train_loss: 1.1847, test_loss: 1.1671, test_f1: 0.3732
 epoch: 37, train_loss: 1.1903, test_loss: 1.1628, test_f1: 0.3570
 epoch: 38, train_loss: 1.1866, test_loss: 1.1589, test_f1: 0.3515
 epoch: 39, train_loss: 1.1835, test_loss: 1.1594, test_f1: 0.3483
 epoch: 40, train_loss: 1.1775, test_loss: 1.1537, test_f1: 0.3685
 epoch: 41, train_loss: 1.1773, test_loss: 1.1517, test_f1: 0.3582
 epoch: 42, train_loss: 1.1726, test_loss: 1.1506, test_f1: 0.4074
 epoch: 43, train_loss: 1.1796, test_loss: 1.1467, test_f1: 0.3857
 epoch: 44, train_loss: 1.1687, test_loss: 1.1464, test_f1: 0.3876
 epoch: 45, train_loss: 1.1709, test_loss: 1.1417, test_f1: 0.4203
 epoch: 46, train_loss: 1.1744, test_loss: 1.1403, test_f1: 0.4293
 epoch: 47, train_loss: 1.1655, test_loss: 1.1376, test_f1: 0.4285
 epoch: 48, train_loss: 1.1618, test_loss: 1.1347, test_f1: 0.4137
 epoch: 49, train_loss: 1.1619, test_loss: 1.1346, test_f1: 0.4202
 epoch: 50, train_loss: 1.1601, test_loss: 1.1301, test_f1: 0.4178
 epoch: 51, train_loss: 1.1582, test_loss: 1.1312, test_f1: 0.4153
 epoch: 52, train_loss: 1.1679, test_loss: 1.1290, test_f1: 0.4546
 epoch: 53, train_loss: 1.1602, test_loss: 1.1269, test_f1: 0.4347
 epoch: 54, train_loss: 1.1596, test_loss: 1.1257, test_f1: 0.4421
 epoch: 55, train_loss: 1.1553, test_loss: 1.1258, test_f1: 0.4425
 epoch: 56, train_loss: 1.1587, test_loss: 1.1242, test_f1: 0.4570
 epoch: 57, train_loss: 1.1572, test_loss: 1.1258, test_f1: 0.4256
 epoch: 58, train_loss: 1.1546, test_loss: 1.1258, test_f1: 0.4290
 epoch: 59, train_loss: 1.1505, test_loss: 1.1252, test_f1: 0.4283
 epoch: 60, train_loss: 1.1528, test_loss: 1.1211, test_f1: 0.4493
 epoch: 61, train_loss: 1.1507, test_loss: 1.1192, test_f1: 0.4478
 epoch: 62, train_loss: 1.1463, test_loss: 1.1168, test_f1: 0.4510
 epoch: 63, train_loss: 1.1437, test_loss: 1.1163, test_f1: 0.4368
 epoch: 64, train_loss: 1.1511, test_loss: 1.1164, test_f1: 0.4379
 epoch: 65, train_loss: 1.1490, test_loss: 1.1177, test_f1: 0.4339
 epoch: 66, train_loss: 1.1444, test_loss: 1.1148, test_f1: 0.4558
 epoch: 67, train_loss: 1.1565, test_loss: 1.1115, test_f1: 0.4534
 epoch: 68, train_loss: 1.1454, test_loss: 1.1128, test_f1: 0.4359
 epoch: 69, train_loss: 1.1471, test_loss: 1.1075, test_f1: 0.4583
 epoch: 70, train_loss: 1.1455, test_loss: 1.1115, test_f1: 0.4351
 epoch: 71, train_loss: 1.1376, test_loss: 1.1082, test_f1: 0.4394
 epoch: 72, train_loss: 1.1460, test_loss: 1.1069, test_f1: 0.4611
 epoch: 73, train_loss: 1.1438, test_loss: 1.1071, test_f1: 0.4318
 epoch: 74, train_loss: 1.1377, test_loss: 1.1053, test_f1: 0.4411
 epoch: 75, train_loss: 1.1375, test_loss: 1.1060, test_f1: 0.4635
 epoch: 76, train_loss: 1.1437, test_loss: 1.1045, test_f1: 0.4419
 epoch: 77, train_loss: 1.1410, test_loss: 1.1038, test_f1: 0.4622
 epoch: 78, train_loss: 1.1426, test_loss: 1.1037, test_f1: 0.4711
 epoch: 79, train_loss: 1.1398, test_loss: 1.1025, test_f1: 0.4636
 epoch: 80, train_loss: 1.1427, test_loss: 1.1014, test_f1: 0.4617
 epoch: 81, train_loss: 1.1364, test_loss: 1.0999, test_f1: 0.4486
 epoch: 82, train_loss: 1.1361, test_loss: 1.0992, test_f1: 0.4504
 epoch: 83, train_loss: 1.1404, test_loss: 1.0997, test_f1: 0.4330
 epoch: 84, train_loss: 1.1372, test_loss: 1.0972, test_f1: 0.4675
 epoch: 85, train_loss: 1.1267, test_loss: 1.0971, test_f1: 0.4646
 epoch: 86, train_loss: 1.1320, test_loss: 1.0953, test_f1: 0.4510
 epoch: 87, train_loss: 1.1321, test_loss: 1.0942, test_f1: 0.4547
 epoch: 88, train_loss: 1.1366, test_loss: 1.0960, test_f1: 0.4568
 epoch: 89, train_loss: 1.1325, test_loss: 1.0943, test_f1: 0.4660
 epoch: 90, train_loss: 1.1350, test_loss: 1.0936, test_f1: 0.4766
 epoch: 91, train_loss: 1.1319, test_loss: 1.0933, test_f1: 0.4555
 epoch: 92, train_loss: 1.1290, test_loss: 1.0911, test_f1: 0.4658
 epoch: 93, train_loss: 1.1346, test_loss: 1.0947, test_f1: 0.4649
 epoch: 94, train_loss: 1.1395, test_loss: 1.0892, test_f1: 0.4684
 epoch: 95, train_loss: 1.1237, test_loss: 1.0884, test_f1: 0.4792
 epoch: 96, train_loss: 1.1404, test_loss: 1.0890, test_f1: 0.4761
 epoch: 97, train_loss: 1.1226, test_loss: 1.0919, test_f1: 0.4820
 epoch: 98, train_loss: 1.1330, test_loss: 1.0895, test_f1: 0.4663
 epoch: 99, train_loss: 1.1290, test_loss: 1.0875, test_f1: 0.4806
##################ITERATION #8 ****************************************
 epoch: 0, train_loss: 1.3415, test_loss: 1.3186, test_f1: 0.2582
 epoch: 1, train_loss: 1.3131, test_loss: 1.2986, test_f1: 0.2582
 epoch: 2, train_loss: 1.2981, test_loss: 1.2882, test_f1: 0.2582
 epoch: 3, train_loss: 1.2851, test_loss: 1.2769, test_f1: 0.2672
 epoch: 4, train_loss: 1.2802, test_loss: 1.2633, test_f1: 0.2569
 epoch: 5, train_loss: 1.2700, test_loss: 1.2562, test_f1: 0.2748
 epoch: 6, train_loss: 1.2685, test_loss: 1.2454, test_f1: 0.2778
 epoch: 7, train_loss: 1.2601, test_loss: 1.2389, test_f1: 0.2871
 epoch: 8, train_loss: 1.2576, test_loss: 1.2314, test_f1: 0.3021
 epoch: 9, train_loss: 1.2529, test_loss: 1.2260, test_f1: 0.3054
 epoch: 10, train_loss: 1.2444, test_loss: 1.2141, test_f1: 0.3151
 epoch: 11, train_loss: 1.2380, test_loss: 1.2096, test_f1: 0.3209
 epoch: 12, train_loss: 1.2330, test_loss: 1.2027, test_f1: 0.3260
 epoch: 13, train_loss: 1.2285, test_loss: 1.1988, test_f1: 0.3355
 epoch: 14, train_loss: 1.2259, test_loss: 1.1953, test_f1: 0.3318
 epoch: 15, train_loss: 1.2239, test_loss: 1.1831, test_f1: 0.3359
 epoch: 16, train_loss: 1.2175, test_loss: 1.1765, test_f1: 0.3218
 epoch: 17, train_loss: 1.2159, test_loss: 1.1740, test_f1: 0.3282
 epoch: 18, train_loss: 1.2122, test_loss: 1.1732, test_f1: 0.3251
 epoch: 19, train_loss: 1.2073, test_loss: 1.1686, test_f1: 0.3348
 epoch: 20, train_loss: 1.2055, test_loss: 1.1619, test_f1: 0.3404
 epoch: 21, train_loss: 1.1996, test_loss: 1.1542, test_f1: 0.3528
 epoch: 22, train_loss: 1.1971, test_loss: 1.1492, test_f1: 0.3660
 epoch: 23, train_loss: 1.1907, test_loss: 1.1450, test_f1: 0.3735
 epoch: 24, train_loss: 1.1933, test_loss: 1.1408, test_f1: 0.3725
 epoch: 25, train_loss: 1.1911, test_loss: 1.1378, test_f1: 0.3887
 epoch: 26, train_loss: 1.1847, test_loss: 1.1331, test_f1: 0.3844
 epoch: 27, train_loss: 1.1840, test_loss: 1.1288, test_f1: 0.3945
 epoch: 28, train_loss: 1.1831, test_loss: 1.1257, test_f1: 0.3989
 epoch: 29, train_loss: 1.1784, test_loss: 1.1243, test_f1: 0.3981
 epoch: 30, train_loss: 1.1745, test_loss: 1.1198, test_f1: 0.3981
 epoch: 31, train_loss: 1.1633, test_loss: 1.1156, test_f1: 0.4086
 epoch: 32, train_loss: 1.1606, test_loss: 1.1124, test_f1: 0.4076
 epoch: 33, train_loss: 1.1695, test_loss: 1.1090, test_f1: 0.4272
 epoch: 34, train_loss: 1.1642, test_loss: 1.1038, test_f1: 0.4368
 epoch: 35, train_loss: 1.1612, test_loss: 1.1020, test_f1: 0.4416
 epoch: 36, train_loss: 1.1636, test_loss: 1.0983, test_f1: 0.4478
 epoch: 37, train_loss: 1.1558, test_loss: 1.0958, test_f1: 0.4454
 epoch: 38, train_loss: 1.1541, test_loss: 1.0914, test_f1: 0.4455
 epoch: 39, train_loss: 1.1550, test_loss: 1.0908, test_f1: 0.4480
 epoch: 40, train_loss: 1.1493, test_loss: 1.0869, test_f1: 0.4484
 epoch: 41, train_loss: 1.1522, test_loss: 1.0862, test_f1: 0.4541
 epoch: 42, train_loss: 1.1554, test_loss: 1.0832, test_f1: 0.4633
 epoch: 43, train_loss: 1.1443, test_loss: 1.0766, test_f1: 0.4638
 epoch: 44, train_loss: 1.1471, test_loss: 1.0747, test_f1: 0.4638
 epoch: 45, train_loss: 1.1408, test_loss: 1.0736, test_f1: 0.4765
 epoch: 46, train_loss: 1.1379, test_loss: 1.0675, test_f1: 0.4729
 epoch: 47, train_loss: 1.1326, test_loss: 1.0662, test_f1: 0.4762
 epoch: 48, train_loss: 1.1342, test_loss: 1.0658, test_f1: 0.4622
 epoch: 49, train_loss: 1.1432, test_loss: 1.0626, test_f1: 0.4728
 epoch: 50, train_loss: 1.1443, test_loss: 1.0616, test_f1: 0.4673
 epoch: 51, train_loss: 1.1328, test_loss: 1.0582, test_f1: 0.4651
 epoch: 52, train_loss: 1.1361, test_loss: 1.0567, test_f1: 0.4822
 epoch: 53, train_loss: 1.1301, test_loss: 1.0601, test_f1: 0.4678
 epoch: 54, train_loss: 1.1302, test_loss: 1.0565, test_f1: 0.4685
 epoch: 55, train_loss: 1.1313, test_loss: 1.0563, test_f1: 0.4742
 epoch: 56, train_loss: 1.1255, test_loss: 1.0529, test_f1: 0.4772
 epoch: 57, train_loss: 1.1213, test_loss: 1.0491, test_f1: 0.4780
 epoch: 58, train_loss: 1.1201, test_loss: 1.0505, test_f1: 0.4767
 epoch: 59, train_loss: 1.1167, test_loss: 1.0480, test_f1: 0.4758
 epoch: 60, train_loss: 1.1209, test_loss: 1.0473, test_f1: 0.4908
 epoch: 61, train_loss: 1.1214, test_loss: 1.0465, test_f1: 0.4925
 epoch: 62, train_loss: 1.1120, test_loss: 1.0484, test_f1: 0.4737
 epoch: 63, train_loss: 1.1181, test_loss: 1.0444, test_f1: 0.4727
 epoch: 64, train_loss: 1.1207, test_loss: 1.0428, test_f1: 0.4863
 epoch: 65, train_loss: 1.1212, test_loss: 1.0418, test_f1: 0.4697
 epoch: 66, train_loss: 1.1195, test_loss: 1.0420, test_f1: 0.4734
 epoch: 67, train_loss: 1.1151, test_loss: 1.0371, test_f1: 0.4836
 epoch: 68, train_loss: 1.1099, test_loss: 1.0348, test_f1: 0.4738
 epoch: 69, train_loss: 1.1153, test_loss: 1.0386, test_f1: 0.4872
 epoch: 70, train_loss: 1.1075, test_loss: 1.0354, test_f1: 0.4880
 epoch: 71, train_loss: 1.1071, test_loss: 1.0387, test_f1: 0.4836
 epoch: 72, train_loss: 1.1063, test_loss: 1.0359, test_f1: 0.4943
 epoch: 73, train_loss: 1.1081, test_loss: 1.0322, test_f1: 0.4899
 epoch: 74, train_loss: 1.1140, test_loss: 1.0320, test_f1: 0.4815
 epoch: 75, train_loss: 1.1192, test_loss: 1.0300, test_f1: 0.4906
 epoch: 76, train_loss: 1.1031, test_loss: 1.0302, test_f1: 0.4894
 epoch: 77, train_loss: 1.1079, test_loss: 1.0310, test_f1: 0.4921
 epoch: 78, train_loss: 1.1049, test_loss: 1.0287, test_f1: 0.4951
 epoch: 79, train_loss: 1.1047, test_loss: 1.0232, test_f1: 0.4839
 epoch: 80, train_loss: 1.1087, test_loss: 1.0270, test_f1: 0.4938
 epoch: 81, train_loss: 1.1061, test_loss: 1.0213, test_f1: 0.4925
 epoch: 82, train_loss: 1.1033, test_loss: 1.0246, test_f1: 0.4959
 epoch: 83, train_loss: 1.0996, test_loss: 1.0202, test_f1: 0.4904
 epoch: 84, train_loss: 1.1081, test_loss: 1.0219, test_f1: 0.4984
 epoch: 85, train_loss: 1.1056, test_loss: 1.0213, test_f1: 0.4962
 epoch: 86, train_loss: 1.0947, test_loss: 1.0178, test_f1: 0.4926
 epoch: 87, train_loss: 1.1013, test_loss: 1.0220, test_f1: 0.5002
 epoch: 88, train_loss: 1.0986, test_loss: 1.0218, test_f1: 0.4938
 epoch: 89, train_loss: 1.1031, test_loss: 1.0216, test_f1: 0.4950
 epoch: 90, train_loss: 1.0923, test_loss: 1.0181, test_f1: 0.4851
 epoch: 91, train_loss: 1.0912, test_loss: 1.0139, test_f1: 0.4948
 epoch: 92, train_loss: 1.0954, test_loss: 1.0153, test_f1: 0.5002
 epoch: 93, train_loss: 1.0928, test_loss: 1.0147, test_f1: 0.4965
 epoch: 94, train_loss: 1.0940, test_loss: 1.0154, test_f1: 0.5018
 epoch: 95, train_loss: 1.1022, test_loss: 1.0125, test_f1: 0.4950
 epoch: 96, train_loss: 1.0974, test_loss: 1.0065, test_f1: 0.5033
 epoch: 97, train_loss: 1.0903, test_loss: 1.0137, test_f1: 0.4998
 epoch: 98, train_loss: 1.0993, test_loss: 1.0111, test_f1: 0.4923
 epoch: 99, train_loss: 1.0905, test_loss: 1.0060, test_f1: 0.5023
##################ITERATION #9 ****************************************
 epoch: 0, train_loss: 1.3388, test_loss: 1.3323, test_f1: 0.2589
 epoch: 1, train_loss: 1.3165, test_loss: 1.3238, test_f1: 0.2589
 epoch: 2, train_loss: 1.3076, test_loss: 1.3131, test_f1: 0.2589
 epoch: 3, train_loss: 1.2997, test_loss: 1.3044, test_f1: 0.2589
 epoch: 4, train_loss: 1.2891, test_loss: 1.2977, test_f1: 0.2589
 epoch: 5, train_loss: 1.2807, test_loss: 1.2904, test_f1: 0.2589
 epoch: 6, train_loss: 1.2764, test_loss: 1.2856, test_f1: 0.2589
 epoch: 7, train_loss: 1.2727, test_loss: 1.2814, test_f1: 0.2589
 epoch: 8, train_loss: 1.2682, test_loss: 1.2764, test_f1: 0.2589
 epoch: 9, train_loss: 1.2692, test_loss: 1.2697, test_f1: 0.2598
 epoch: 10, train_loss: 1.2626, test_loss: 1.2673, test_f1: 0.2664
 epoch: 11, train_loss: 1.2624, test_loss: 1.2668, test_f1: 0.2678
 epoch: 12, train_loss: 1.2608, test_loss: 1.2624, test_f1: 0.2643
 epoch: 13, train_loss: 1.2556, test_loss: 1.2596, test_f1: 0.2700
 epoch: 14, train_loss: 1.2540, test_loss: 1.2570, test_f1: 0.2836
 epoch: 15, train_loss: 1.2549, test_loss: 1.2578, test_f1: 0.2830
 epoch: 16, train_loss: 1.2542, test_loss: 1.2546, test_f1: 0.2778
 epoch: 17, train_loss: 1.2500, test_loss: 1.2525, test_f1: 0.2932
 epoch: 18, train_loss: 1.2515, test_loss: 1.2470, test_f1: 0.2877
 epoch: 19, train_loss: 1.2484, test_loss: 1.2423, test_f1: 0.2971
 epoch: 20, train_loss: 1.2464, test_loss: 1.2398, test_f1: 0.2997
 epoch: 21, train_loss: 1.2469, test_loss: 1.2389, test_f1: 0.2869
 epoch: 22, train_loss: 1.2436, test_loss: 1.2408, test_f1: 0.2932
 epoch: 23, train_loss: 1.2444, test_loss: 1.2341, test_f1: 0.2961
 epoch: 24, train_loss: 1.2408, test_loss: 1.2311, test_f1: 0.2962
 epoch: 25, train_loss: 1.2406, test_loss: 1.2287, test_f1: 0.2958
 epoch: 26, train_loss: 1.2406, test_loss: 1.2284, test_f1: 0.3181
 epoch: 27, train_loss: 1.2404, test_loss: 1.2265, test_f1: 0.3051
 epoch: 28, train_loss: 1.2330, test_loss: 1.2247, test_f1: 0.2979
 epoch: 29, train_loss: 1.2292, test_loss: 1.2214, test_f1: 0.3012
 epoch: 30, train_loss: 1.2350, test_loss: 1.2201, test_f1: 0.2979
 epoch: 31, train_loss: 1.2268, test_loss: 1.2153, test_f1: 0.3035
 epoch: 32, train_loss: 1.2316, test_loss: 1.2143, test_f1: 0.3014
 epoch: 33, train_loss: 1.2294, test_loss: 1.2120, test_f1: 0.3030
 epoch: 34, train_loss: 1.2242, test_loss: 1.2088, test_f1: 0.3052
 epoch: 35, train_loss: 1.2307, test_loss: 1.2074, test_f1: 0.3060
 epoch: 36, train_loss: 1.2252, test_loss: 1.2042, test_f1: 0.3298
 epoch: 37, train_loss: 1.2259, test_loss: 1.2064, test_f1: 0.3307
 epoch: 38, train_loss: 1.2239, test_loss: 1.2025, test_f1: 0.3290
 epoch: 39, train_loss: 1.2216, test_loss: 1.1986, test_f1: 0.3296
 epoch: 40, train_loss: 1.2208, test_loss: 1.1986, test_f1: 0.3299
 epoch: 41, train_loss: 1.2195, test_loss: 1.1961, test_f1: 0.3273
 epoch: 42, train_loss: 1.2166, test_loss: 1.1929, test_f1: 0.3275
 epoch: 43, train_loss: 1.2127, test_loss: 1.1908, test_f1: 0.3274
 epoch: 44, train_loss: 1.2145, test_loss: 1.1886, test_f1: 0.3274
 epoch: 45, train_loss: 1.2120, test_loss: 1.1844, test_f1: 0.3282
 epoch: 46, train_loss: 1.2113, test_loss: 1.1835, test_f1: 0.3289
 epoch: 47, train_loss: 1.2002, test_loss: 1.1817, test_f1: 0.3321
 epoch: 48, train_loss: 1.2064, test_loss: 1.1788, test_f1: 0.3328
 epoch: 49, train_loss: 1.2095, test_loss: 1.1802, test_f1: 0.3330
 epoch: 50, train_loss: 1.2089, test_loss: 1.1761, test_f1: 0.3320
 epoch: 51, train_loss: 1.2072, test_loss: 1.1724, test_f1: 0.3327
 epoch: 52, train_loss: 1.2096, test_loss: 1.1748, test_f1: 0.3275
 epoch: 53, train_loss: 1.1994, test_loss: 1.1728, test_f1: 0.3325
 epoch: 54, train_loss: 1.1956, test_loss: 1.1726, test_f1: 0.3322
 epoch: 55, train_loss: 1.2066, test_loss: 1.1698, test_f1: 0.3333
 epoch: 56, train_loss: 1.2002, test_loss: 1.1704, test_f1: 0.3341
 epoch: 57, train_loss: 1.1997, test_loss: 1.1701, test_f1: 0.3310
 epoch: 58, train_loss: 1.2045, test_loss: 1.1706, test_f1: 0.3338
 epoch: 59, train_loss: 1.1974, test_loss: 1.1688, test_f1: 0.3340
 epoch: 60, train_loss: 1.2063, test_loss: 1.1701, test_f1: 0.3332
 epoch: 61, train_loss: 1.2000, test_loss: 1.1673, test_f1: 0.3306
 epoch: 62, train_loss: 1.1978, test_loss: 1.1660, test_f1: 0.3340
 epoch: 63, train_loss: 1.1987, test_loss: 1.1656, test_f1: 0.3376
 epoch: 64, train_loss: 1.1931, test_loss: 1.1639, test_f1: 0.3327
 epoch: 65, train_loss: 1.1949, test_loss: 1.1650, test_f1: 0.3348
 epoch: 66, train_loss: 1.1909, test_loss: 1.1617, test_f1: 0.3340
 epoch: 67, train_loss: 1.1955, test_loss: 1.1636, test_f1: 0.3364
 epoch: 68, train_loss: 1.1991, test_loss: 1.1635, test_f1: 0.3366
 epoch: 69, train_loss: 1.1927, test_loss: 1.1603, test_f1: 0.3377
 epoch: 70, train_loss: 1.1954, test_loss: 1.1602, test_f1: 0.3356
 epoch: 71, train_loss: 1.1951, test_loss: 1.1591, test_f1: 0.3245
 epoch: 72, train_loss: 1.1969, test_loss: 1.1601, test_f1: 0.3231
 epoch: 73, train_loss: 1.1921, test_loss: 1.1614, test_f1: 0.3266
 epoch: 74, train_loss: 1.1864, test_loss: 1.1593, test_f1: 0.3309
 epoch: 75, train_loss: 1.1866, test_loss: 1.1585, test_f1: 0.3324
 epoch: 76, train_loss: 1.1874, test_loss: 1.1572, test_f1: 0.3298
 epoch: 77, train_loss: 1.1877, test_loss: 1.1534, test_f1: 0.3396
 epoch: 78, train_loss: 1.1871, test_loss: 1.1542, test_f1: 0.3312
 epoch: 79, train_loss: 1.1905, test_loss: 1.1510, test_f1: 0.3437
 epoch: 80, train_loss: 1.1850, test_loss: 1.1504, test_f1: 0.3325
 epoch: 81, train_loss: 1.1887, test_loss: 1.1525, test_f1: 0.3396
 epoch: 82, train_loss: 1.1810, test_loss: 1.1519, test_f1: 0.3340
 epoch: 83, train_loss: 1.1872, test_loss: 1.1502, test_f1: 0.3335
 epoch: 84, train_loss: 1.1845, test_loss: 1.1485, test_f1: 0.3328
 epoch: 85, train_loss: 1.1932, test_loss: 1.1483, test_f1: 0.3419
 epoch: 86, train_loss: 1.1820, test_loss: 1.1496, test_f1: 0.3363
 epoch: 87, train_loss: 1.1840, test_loss: 1.1500, test_f1: 0.3419
 epoch: 88, train_loss: 1.1891, test_loss: 1.1456, test_f1: 0.3355
 epoch: 89, train_loss: 1.1854, test_loss: 1.1460, test_f1: 0.3364
 epoch: 90, train_loss: 1.1859, test_loss: 1.1460, test_f1: 0.3375
 epoch: 91, train_loss: 1.1815, test_loss: 1.1450, test_f1: 0.3396
 epoch: 92, train_loss: 1.1844, test_loss: 1.1467, test_f1: 0.3422
 epoch: 93, train_loss: 1.1760, test_loss: 1.1426, test_f1: 0.3396
 epoch: 94, train_loss: 1.1810, test_loss: 1.1420, test_f1: 0.3458
 epoch: 95, train_loss: 1.1794, test_loss: 1.1414, test_f1: 0.3445
 epoch: 96, train_loss: 1.1807, test_loss: 1.1392, test_f1: 0.3396
 epoch: 97, train_loss: 1.1780, test_loss: 1.1419, test_f1: 0.3550
 epoch: 98, train_loss: 1.1769, test_loss: 1.1391, test_f1: 0.3543
 epoch: 99, train_loss: 1.1796, test_loss: 1.1391, test_f1: 0.3502

Training completed in 611.27 seconds
Best F1: 0.5033 at epoch 96
Mean F1 across iterations: 0.4095  0.0525
========================FINAL RESULTS================================
FEGIN weighted F1: 0.5033  0.0525
python main.py --data ltspice_examples --representation component_component --model FEGIN --layers 3 --hiddens 16 --batch_size 64 --lr 0.0001 --emb_size 512 --epochs 100 --save_appendix component_component_L3_H16_BS64_LR0.0001_E512 --no_val
-----



STDERR:
  File "main.py", line 370, in <module>
    main()
  File "main.py", line 254, in main
    dataset = dataset_class(
  File "/home/philip/projects/ltspice_examples_code_repo/Circuit-Completion-Using-GNNs/component_classification_with_link_prediction_head/evaluation/FEGIN/kernel/circuit_datasets.py", line 15, in __init__
    self.data, self.slices = torch.load(self.processed_paths[0])
  File "/home/philip/.local/lib/python3.8/site-packages/torch/serialization.py", line 1040, in load
    warnings.warn(
  File "/usr/lib/python3.8/warnings.py", line 109, in _showwarnmsg
    sw(msg.message, msg.category, msg.filename, msg.lineno,
  File "main.py", line 47, in warn_with_traceback
    traceback.print_stack(file=log)
/home/philip/projects/ltspice_examples_code_repo/Circuit-Completion-Using-GNNs/component_classification_with_link_prediction_head/evaluation/FEGIN/kernel/circuit_datasets.py:15: FutureWarning: You are using `torch.load` with `weights_only=False` (the current default value), which uses the default pickle module implicitly. It is possible to construct malicious pickle data which will execute arbitrary code during unpickling (See https://github.com/pytorch/pytorch/blob/main/SECURITY.md#untrusted-models for more details). In a future release, the default value for `weights_only` will be flipped to `True`. This limits the functions that could be executed during unpickling. Arbitrary objects will no longer be allowed to be loaded via this mode unless they are explicitly allowlisted by the user via `torch.serialization.add_safe_globals`. We recommend you start setting `weights_only=True` for any use case where you don't have full control of the loaded file. Please open an issue on GitHub for any issues related to this experimental feature.
  self.data, self.slices = torch.load(self.processed_paths[0])
