STDOUT:
Results will be saved in /home/philip/projects/ltspice_examples_code_repo/Circuit-Completion-Using-GNNs/component_classification_with_link_prediction_head/evaluation/FEGIN/results/model_FEGIN_dataset_ltspice_examples
Command line input: python main.py --data ltspice_examples --representation component_pin_net --model FEGIN --layers 3 --hiddens 128 --batch_size 256 --lr 0.0001 --emb_size 128 --epochs 100 --save_appendix component_pin_net_L3_H128_BS256_LR0.0001_E128 --no_val
 is saved.
-----
ltspice_examples - FEGIN
Using 3 layers, 128 hidden units, h = 2
Loading component_pin_net representation dataset
ENTERED
Training FEGIN on component_pin_net representation
Train: 3558, Test: 846
##################ITERATION #0 ****************************************
 epoch: 0, train_loss: 1.3891, test_loss: 1.3914, test_f1: 0.0304
 epoch: 1, train_loss: 1.3687, test_loss: 1.3830, test_f1: 0.2117
 epoch: 2, train_loss: 1.3500, test_loss: 1.3684, test_f1: 0.2270
 epoch: 3, train_loss: 1.3258, test_loss: 1.3400, test_f1: 0.2270
 epoch: 4, train_loss: 1.2943, test_loss: 1.2920, test_f1: 0.2270
 epoch: 5, train_loss: 1.2611, test_loss: 1.2444, test_f1: 0.2392
 epoch: 6, train_loss: 1.2351, test_loss: 1.2128, test_f1: 0.2671
 epoch: 7, train_loss: 1.2117, test_loss: 1.1884, test_f1: 0.2903
 epoch: 8, train_loss: 1.1928, test_loss: 1.1695, test_f1: 0.3372
 epoch: 9, train_loss: 1.1762, test_loss: 1.1546, test_f1: 0.3467
 epoch: 10, train_loss: 1.1640, test_loss: 1.1403, test_f1: 0.3536
 epoch: 11, train_loss: 1.1486, test_loss: 1.1266, test_f1: 0.3545
 epoch: 12, train_loss: 1.1343, test_loss: 1.1083, test_f1: 0.3811
 epoch: 13, train_loss: 1.1132, test_loss: 1.0909, test_f1: 0.3976
 epoch: 14, train_loss: 1.0917, test_loss: 1.0684, test_f1: 0.4399
 epoch: 15, train_loss: 1.0657, test_loss: 1.0467, test_f1: 0.4602
 epoch: 16, train_loss: 1.0423, test_loss: 1.0222, test_f1: 0.4612
 epoch: 17, train_loss: 1.0198, test_loss: 1.0069, test_f1: 0.4754
 epoch: 18, train_loss: 1.0010, test_loss: 0.9900, test_f1: 0.4963
 epoch: 19, train_loss: 0.9841, test_loss: 0.9902, test_f1: 0.4833
 epoch: 20, train_loss: 0.9657, test_loss: 0.9760, test_f1: 0.4895
 epoch: 21, train_loss: 0.9526, test_loss: 0.9602, test_f1: 0.4940
 epoch: 22, train_loss: 0.9428, test_loss: 0.9518, test_f1: 0.5152
 epoch: 23, train_loss: 0.9242, test_loss: 0.9371, test_f1: 0.5133
 epoch: 24, train_loss: 0.9129, test_loss: 0.9358, test_f1: 0.5362
 epoch: 25, train_loss: 0.9067, test_loss: 0.9385, test_f1: 0.5026
 epoch: 26, train_loss: 0.9010, test_loss: 0.9179, test_f1: 0.5258
 epoch: 27, train_loss: 0.8841, test_loss: 0.9330, test_f1: 0.5165
 epoch: 28, train_loss: 0.8766, test_loss: 0.9215, test_f1: 0.5307
 epoch: 29, train_loss: 0.8679, test_loss: 0.9149, test_f1: 0.5446
 epoch: 30, train_loss: 0.8610, test_loss: 0.8979, test_f1: 0.5435
 epoch: 31, train_loss: 0.8556, test_loss: 0.9135, test_f1: 0.5350
 epoch: 32, train_loss: 0.8505, test_loss: 0.9114, test_f1: 0.5360
 epoch: 33, train_loss: 0.8435, test_loss: 0.8872, test_f1: 0.5343
 epoch: 34, train_loss: 0.8353, test_loss: 0.8990, test_f1: 0.5424
 epoch: 35, train_loss: 0.8338, test_loss: 0.8975, test_f1: 0.5520
 epoch: 36, train_loss: 0.8263, test_loss: 0.8853, test_f1: 0.5435
 epoch: 37, train_loss: 0.8169, test_loss: 0.9032, test_f1: 0.5397
 epoch: 38, train_loss: 0.8109, test_loss: 0.8887, test_f1: 0.5457
 epoch: 39, train_loss: 0.8046, test_loss: 0.8907, test_f1: 0.5502
 epoch: 40, train_loss: 0.7982, test_loss: 0.9079, test_f1: 0.5279
 epoch: 41, train_loss: 0.7981, test_loss: 0.8976, test_f1: 0.5475
 epoch: 42, train_loss: 0.7911, test_loss: 0.8687, test_f1: 0.5548
 epoch: 43, train_loss: 0.7899, test_loss: 0.9071, test_f1: 0.5611
 epoch: 44, train_loss: 0.7903, test_loss: 0.8841, test_f1: 0.5500
 epoch: 45, train_loss: 0.7745, test_loss: 0.9435, test_f1: 0.5368
 epoch: 46, train_loss: 0.7791, test_loss: 0.8683, test_f1: 0.5420
 epoch: 47, train_loss: 0.7767, test_loss: 0.8937, test_f1: 0.5644
 epoch: 48, train_loss: 0.7735, test_loss: 0.9234, test_f1: 0.5389
 epoch: 49, train_loss: 0.7718, test_loss: 0.8951, test_f1: 0.5407
 epoch: 50, train_loss: 0.7689, test_loss: 0.8988, test_f1: 0.5414
 epoch: 51, train_loss: 0.7530, test_loss: 0.8900, test_f1: 0.5585
 epoch: 52, train_loss: 0.7492, test_loss: 0.8782, test_f1: 0.5490
 epoch: 53, train_loss: 0.7433, test_loss: 0.8829, test_f1: 0.5546
 epoch: 54, train_loss: 0.7488, test_loss: 0.8888, test_f1: 0.5496
 epoch: 55, train_loss: 0.7517, test_loss: 0.9030, test_f1: 0.5582
 epoch: 56, train_loss: 0.7399, test_loss: 0.8854, test_f1: 0.5591
 epoch: 57, train_loss: 0.7342, test_loss: 0.8748, test_f1: 0.5448
 epoch: 58, train_loss: 0.7354, test_loss: 0.8980, test_f1: 0.5577
 epoch: 59, train_loss: 0.7368, test_loss: 0.8998, test_f1: 0.5488
 epoch: 60, train_loss: 0.7283, test_loss: 0.9044, test_f1: 0.5571
 epoch: 61, train_loss: 0.7305, test_loss: 0.9139, test_f1: 0.5553
 epoch: 62, train_loss: 0.7318, test_loss: 0.8915, test_f1: 0.5526
 epoch: 63, train_loss: 0.7319, test_loss: 0.9169, test_f1: 0.5651
 epoch: 64, train_loss: 0.7258, test_loss: 0.8881, test_f1: 0.5547
 epoch: 65, train_loss: 0.7210, test_loss: 0.8889, test_f1: 0.5616
 epoch: 66, train_loss: 0.7165, test_loss: 0.9177, test_f1: 0.5570
 epoch: 67, train_loss: 0.7139, test_loss: 0.8950, test_f1: 0.5623
 epoch: 68, train_loss: 0.7196, test_loss: 0.9042, test_f1: 0.5635
 epoch: 69, train_loss: 0.7138, test_loss: 0.8941, test_f1: 0.5586
 epoch: 70, train_loss: 0.7168, test_loss: 0.8989, test_f1: 0.5714
 epoch: 71, train_loss: 0.7082, test_loss: 0.8855, test_f1: 0.5707
 epoch: 72, train_loss: 0.7116, test_loss: 0.9127, test_f1: 0.5713
 epoch: 73, train_loss: 0.7092, test_loss: 0.8806, test_f1: 0.5709
 epoch: 74, train_loss: 0.7045, test_loss: 0.9108, test_f1: 0.5606
 epoch: 75, train_loss: 0.7066, test_loss: 0.9248, test_f1: 0.5561
 epoch: 76, train_loss: 0.7130, test_loss: 0.8892, test_f1: 0.5636
 epoch: 77, train_loss: 0.7059, test_loss: 0.9164, test_f1: 0.5663
 epoch: 78, train_loss: 0.6995, test_loss: 0.9190, test_f1: 0.5577
 epoch: 79, train_loss: 0.6920, test_loss: 0.9244, test_f1: 0.5608
 epoch: 80, train_loss: 0.6930, test_loss: 0.9198, test_f1: 0.5728
 epoch: 81, train_loss: 0.6960, test_loss: 0.9268, test_f1: 0.5760
 epoch: 82, train_loss: 0.6891, test_loss: 0.9060, test_f1: 0.5763
 epoch: 83, train_loss: 0.6889, test_loss: 0.9213, test_f1: 0.5886
 epoch: 84, train_loss: 0.6967, test_loss: 0.9232, test_f1: 0.5798
 epoch: 85, train_loss: 0.6898, test_loss: 0.9084, test_f1: 0.5813
 epoch: 86, train_loss: 0.6847, test_loss: 0.9283, test_f1: 0.5826
 epoch: 87, train_loss: 0.6917, test_loss: 0.9158, test_f1: 0.5899
 epoch: 88, train_loss: 0.6814, test_loss: 0.9022, test_f1: 0.5956
 epoch: 89, train_loss: 0.6781, test_loss: 0.9270, test_f1: 0.5735
 epoch: 90, train_loss: 0.6904, test_loss: 0.9178, test_f1: 0.5948
 epoch: 91, train_loss: 0.6671, test_loss: 0.9144, test_f1: 0.5946
 epoch: 92, train_loss: 0.6705, test_loss: 0.9274, test_f1: 0.5784
 epoch: 93, train_loss: 0.6767, test_loss: 0.9395, test_f1: 0.5911
 epoch: 94, train_loss: 0.6680, test_loss: 0.9161, test_f1: 0.5830
 epoch: 95, train_loss: 0.6754, test_loss: 0.9210, test_f1: 0.5969
 epoch: 96, train_loss: 0.6749, test_loss: 0.9285, test_f1: 0.5946
 epoch: 97, train_loss: 0.6635, test_loss: 0.9330, test_f1: 0.5920
 epoch: 98, train_loss: 0.6677, test_loss: 0.9329, test_f1: 0.5995
 epoch: 99, train_loss: 0.6587, test_loss: 0.9490, test_f1: 0.5976
##################ITERATION #1 ****************************************
 epoch: 0, train_loss: 1.3437, test_loss: 1.3688, test_f1: 0.2270
 epoch: 1, train_loss: 1.2792, test_loss: 1.3376, test_f1: 0.2270
 epoch: 2, train_loss: 1.2357, test_loss: 1.2990, test_f1: 0.2270
 epoch: 3, train_loss: 1.1892, test_loss: 1.2306, test_f1: 0.2270
 epoch: 4, train_loss: 1.1501, test_loss: 1.1426, test_f1: 0.3783
 epoch: 5, train_loss: 1.1128, test_loss: 1.0870, test_f1: 0.4109
 epoch: 6, train_loss: 1.0775, test_loss: 1.0510, test_f1: 0.4315
 epoch: 7, train_loss: 1.0535, test_loss: 1.0277, test_f1: 0.4584
 epoch: 8, train_loss: 1.0273, test_loss: 1.0090, test_f1: 0.4787
 epoch: 9, train_loss: 1.0038, test_loss: 0.9936, test_f1: 0.5010
 epoch: 10, train_loss: 0.9894, test_loss: 0.9842, test_f1: 0.5131
 epoch: 11, train_loss: 0.9715, test_loss: 0.9668, test_f1: 0.5090
 epoch: 12, train_loss: 0.9608, test_loss: 0.9578, test_f1: 0.5301
 epoch: 13, train_loss: 0.9487, test_loss: 0.9530, test_f1: 0.5311
 epoch: 14, train_loss: 0.9377, test_loss: 0.9372, test_f1: 0.5480
 epoch: 15, train_loss: 0.9294, test_loss: 0.9384, test_f1: 0.5296
 epoch: 16, train_loss: 0.9238, test_loss: 0.9219, test_f1: 0.5297
 epoch: 17, train_loss: 0.9130, test_loss: 0.9343, test_f1: 0.5359
 epoch: 18, train_loss: 0.8974, test_loss: 0.9071, test_f1: 0.5487
 epoch: 19, train_loss: 0.8899, test_loss: 0.9026, test_f1: 0.5359
 epoch: 20, train_loss: 0.8855, test_loss: 0.9039, test_f1: 0.5463
 epoch: 21, train_loss: 0.8761, test_loss: 0.8838, test_f1: 0.5536
 epoch: 22, train_loss: 0.8692, test_loss: 0.8978, test_f1: 0.5468
 epoch: 23, train_loss: 0.8668, test_loss: 0.8713, test_f1: 0.5457
 epoch: 24, train_loss: 0.8554, test_loss: 0.8902, test_f1: 0.5501
 epoch: 25, train_loss: 0.8482, test_loss: 0.9009, test_f1: 0.5392
 epoch: 26, train_loss: 0.8550, test_loss: 0.8670, test_f1: 0.5499
 epoch: 27, train_loss: 0.8391, test_loss: 0.8766, test_f1: 0.5582
 epoch: 28, train_loss: 0.8301, test_loss: 0.8575, test_f1: 0.5525
 epoch: 29, train_loss: 0.8302, test_loss: 0.8810, test_f1: 0.5671
 epoch: 30, train_loss: 0.8279, test_loss: 0.8627, test_f1: 0.5763
 epoch: 31, train_loss: 0.8198, test_loss: 0.8521, test_f1: 0.5630
 epoch: 32, train_loss: 0.8092, test_loss: 0.8415, test_f1: 0.5550
 epoch: 33, train_loss: 0.8056, test_loss: 0.8477, test_f1: 0.5682
 epoch: 34, train_loss: 0.8061, test_loss: 0.8367, test_f1: 0.5617
 epoch: 35, train_loss: 0.7947, test_loss: 0.8901, test_f1: 0.5518
 epoch: 36, train_loss: 0.7896, test_loss: 0.8459, test_f1: 0.5699
 epoch: 37, train_loss: 0.7832, test_loss: 0.8432, test_f1: 0.5660
 epoch: 38, train_loss: 0.7808, test_loss: 0.8233, test_f1: 0.5770
 epoch: 39, train_loss: 0.7713, test_loss: 0.8618, test_f1: 0.5592
 epoch: 40, train_loss: 0.7672, test_loss: 0.8492, test_f1: 0.5676
 epoch: 41, train_loss: 0.7555, test_loss: 0.8570, test_f1: 0.5590
 epoch: 42, train_loss: 0.7617, test_loss: 0.8501, test_f1: 0.5545
 epoch: 43, train_loss: 0.7485, test_loss: 0.8196, test_f1: 0.5757
 epoch: 44, train_loss: 0.7486, test_loss: 0.8427, test_f1: 0.5705
 epoch: 45, train_loss: 0.7548, test_loss: 0.8528, test_f1: 0.5803
 epoch: 46, train_loss: 0.7416, test_loss: 0.8489, test_f1: 0.5634
 epoch: 47, train_loss: 0.7391, test_loss: 0.8669, test_f1: 0.5699
 epoch: 48, train_loss: 0.7373, test_loss: 0.8509, test_f1: 0.5795
 epoch: 49, train_loss: 0.7307, test_loss: 0.8462, test_f1: 0.5642
 epoch: 50, train_loss: 0.7292, test_loss: 0.8306, test_f1: 0.5631
 epoch: 51, train_loss: 0.7092, test_loss: 0.8418, test_f1: 0.5617
 epoch: 52, train_loss: 0.7063, test_loss: 0.8488, test_f1: 0.5576
 epoch: 53, train_loss: 0.7048, test_loss: 0.8375, test_f1: 0.5723
 epoch: 54, train_loss: 0.7092, test_loss: 0.8423, test_f1: 0.5867
 epoch: 55, train_loss: 0.7071, test_loss: 0.8194, test_f1: 0.5618
 epoch: 56, train_loss: 0.6960, test_loss: 0.8383, test_f1: 0.5705
 epoch: 57, train_loss: 0.6991, test_loss: 0.8438, test_f1: 0.5788
 epoch: 58, train_loss: 0.6887, test_loss: 0.8359, test_f1: 0.5741
 epoch: 59, train_loss: 0.6949, test_loss: 0.8701, test_f1: 0.5849
 epoch: 60, train_loss: 0.6893, test_loss: 0.8466, test_f1: 0.5833
 epoch: 61, train_loss: 0.6867, test_loss: 0.8514, test_f1: 0.5642
 epoch: 62, train_loss: 0.6832, test_loss: 0.8632, test_f1: 0.5644
 epoch: 63, train_loss: 0.6855, test_loss: 0.8527, test_f1: 0.5759
 epoch: 64, train_loss: 0.6840, test_loss: 0.8422, test_f1: 0.5674
 epoch: 65, train_loss: 0.6747, test_loss: 0.8652, test_f1: 0.5759
 epoch: 66, train_loss: 0.6732, test_loss: 0.8670, test_f1: 0.5735
 epoch: 67, train_loss: 0.6753, test_loss: 0.8550, test_f1: 0.5680
 epoch: 68, train_loss: 0.6685, test_loss: 0.8592, test_f1: 0.5675
 epoch: 69, train_loss: 0.6731, test_loss: 0.8614, test_f1: 0.5853
 epoch: 70, train_loss: 0.6704, test_loss: 0.8639, test_f1: 0.5760
 epoch: 71, train_loss: 0.6694, test_loss: 0.8427, test_f1: 0.5773
 epoch: 72, train_loss: 0.6640, test_loss: 0.8611, test_f1: 0.5854
 epoch: 73, train_loss: 0.6634, test_loss: 0.8618, test_f1: 0.5750
 epoch: 74, train_loss: 0.6540, test_loss: 0.8617, test_f1: 0.5729
 epoch: 75, train_loss: 0.6534, test_loss: 0.8640, test_f1: 0.5743
 epoch: 76, train_loss: 0.6584, test_loss: 0.8657, test_f1: 0.5714
 epoch: 77, train_loss: 0.6512, test_loss: 0.8674, test_f1: 0.5829
 epoch: 78, train_loss: 0.6469, test_loss: 0.8814, test_f1: 0.5723
 epoch: 79, train_loss: 0.6522, test_loss: 0.8682, test_f1: 0.5881
 epoch: 80, train_loss: 0.6495, test_loss: 0.8894, test_f1: 0.5900
 epoch: 81, train_loss: 0.6423, test_loss: 0.8619, test_f1: 0.5786
 epoch: 82, train_loss: 0.6481, test_loss: 0.8682, test_f1: 0.5879
 epoch: 83, train_loss: 0.6350, test_loss: 0.8909, test_f1: 0.5716
 epoch: 84, train_loss: 0.6350, test_loss: 0.8766, test_f1: 0.5839
 epoch: 85, train_loss: 0.6422, test_loss: 0.8741, test_f1: 0.5762
 epoch: 86, train_loss: 0.6455, test_loss: 0.8845, test_f1: 0.5804
 epoch: 87, train_loss: 0.6450, test_loss: 0.8753, test_f1: 0.5816
 epoch: 88, train_loss: 0.6351, test_loss: 0.8654, test_f1: 0.5789
 epoch: 89, train_loss: 0.6358, test_loss: 0.8660, test_f1: 0.5997
 epoch: 90, train_loss: 0.6332, test_loss: 0.8943, test_f1: 0.5802
 epoch: 91, train_loss: 0.6299, test_loss: 0.8776, test_f1: 0.5799
 epoch: 92, train_loss: 0.6253, test_loss: 0.8932, test_f1: 0.5699
 epoch: 93, train_loss: 0.6305, test_loss: 0.8909, test_f1: 0.5894
 epoch: 94, train_loss: 0.6208, test_loss: 0.8876, test_f1: 0.5783
 epoch: 95, train_loss: 0.6219, test_loss: 0.8864, test_f1: 0.5821
 epoch: 96, train_loss: 0.6102, test_loss: 0.8897, test_f1: 0.5831
 epoch: 97, train_loss: 0.6117, test_loss: 0.8992, test_f1: 0.5847
 epoch: 98, train_loss: 0.6068, test_loss: 0.8948, test_f1: 0.5813
 epoch: 99, train_loss: 0.6133, test_loss: 0.8963, test_f1: 0.5778
##################ITERATION #2 ****************************************
 epoch: 0, train_loss: 1.3077, test_loss: 1.3516, test_f1: 0.2270
 epoch: 1, train_loss: 1.2251, test_loss: 1.3151, test_f1: 0.2270
 epoch: 2, train_loss: 1.1745, test_loss: 1.2802, test_f1: 0.2270
 epoch: 3, train_loss: 1.1285, test_loss: 1.1925, test_f1: 0.2320
 epoch: 4, train_loss: 1.0869, test_loss: 1.0818, test_f1: 0.4015
 epoch: 5, train_loss: 1.0530, test_loss: 1.0304, test_f1: 0.4526
 epoch: 6, train_loss: 1.0306, test_loss: 1.0036, test_f1: 0.4841
 epoch: 7, train_loss: 1.0050, test_loss: 0.9872, test_f1: 0.4984
 epoch: 8, train_loss: 0.9908, test_loss: 0.9723, test_f1: 0.4929
 epoch: 9, train_loss: 0.9751, test_loss: 0.9601, test_f1: 0.5018
 epoch: 10, train_loss: 0.9646, test_loss: 0.9524, test_f1: 0.4924
 epoch: 11, train_loss: 0.9576, test_loss: 0.9427, test_f1: 0.5173
 epoch: 12, train_loss: 0.9479, test_loss: 0.9384, test_f1: 0.5187
 epoch: 13, train_loss: 0.9303, test_loss: 0.9300, test_f1: 0.5403
 epoch: 14, train_loss: 0.9268, test_loss: 0.9208, test_f1: 0.5286
 epoch: 15, train_loss: 0.9160, test_loss: 0.9167, test_f1: 0.5416
 epoch: 16, train_loss: 0.9078, test_loss: 0.9163, test_f1: 0.5211
 epoch: 17, train_loss: 0.8981, test_loss: 0.9021, test_f1: 0.5477
 epoch: 18, train_loss: 0.8877, test_loss: 0.8861, test_f1: 0.5499
 epoch: 19, train_loss: 0.8883, test_loss: 0.8941, test_f1: 0.5575
 epoch: 20, train_loss: 0.8799, test_loss: 0.8752, test_f1: 0.5572
 epoch: 21, train_loss: 0.8734, test_loss: 0.8946, test_f1: 0.5177
 epoch: 22, train_loss: 0.8607, test_loss: 0.8781, test_f1: 0.5629
 epoch: 23, train_loss: 0.8599, test_loss: 0.8650, test_f1: 0.5435
 epoch: 24, train_loss: 0.8424, test_loss: 0.8623, test_f1: 0.5617
 epoch: 25, train_loss: 0.8434, test_loss: 0.8820, test_f1: 0.5482
 epoch: 26, train_loss: 0.8375, test_loss: 0.8555, test_f1: 0.5532
 epoch: 27, train_loss: 0.8285, test_loss: 0.8497, test_f1: 0.5485
 epoch: 28, train_loss: 0.8203, test_loss: 0.9054, test_f1: 0.5360
 epoch: 29, train_loss: 0.8199, test_loss: 0.8409, test_f1: 0.5476
 epoch: 30, train_loss: 0.8083, test_loss: 0.8531, test_f1: 0.5516
 epoch: 31, train_loss: 0.7999, test_loss: 0.8498, test_f1: 0.5528
 epoch: 32, train_loss: 0.7954, test_loss: 0.8544, test_f1: 0.5510
 epoch: 33, train_loss: 0.7920, test_loss: 0.8610, test_f1: 0.5501
 epoch: 34, train_loss: 0.7904, test_loss: 0.8383, test_f1: 0.5498
 epoch: 35, train_loss: 0.7779, test_loss: 0.8284, test_f1: 0.5591
 epoch: 36, train_loss: 0.7802, test_loss: 0.8363, test_f1: 0.5499
 epoch: 37, train_loss: 0.7620, test_loss: 0.8414, test_f1: 0.5530
 epoch: 38, train_loss: 0.7623, test_loss: 0.8593, test_f1: 0.5474
 epoch: 39, train_loss: 0.7595, test_loss: 0.8247, test_f1: 0.5649
 epoch: 40, train_loss: 0.7516, test_loss: 0.8329, test_f1: 0.5509
 epoch: 41, train_loss: 0.7375, test_loss: 0.8508, test_f1: 0.5517
 epoch: 42, train_loss: 0.7359, test_loss: 0.8296, test_f1: 0.5610
 epoch: 43, train_loss: 0.7363, test_loss: 0.8363, test_f1: 0.5682
 epoch: 44, train_loss: 0.7323, test_loss: 0.8435, test_f1: 0.5689
 epoch: 45, train_loss: 0.7280, test_loss: 0.8351, test_f1: 0.5486
 epoch: 46, train_loss: 0.7212, test_loss: 0.8419, test_f1: 0.5576
 epoch: 47, train_loss: 0.7169, test_loss: 0.8649, test_f1: 0.5517
 epoch: 48, train_loss: 0.7100, test_loss: 0.8389, test_f1: 0.5650
 epoch: 49, train_loss: 0.7018, test_loss: 0.8919, test_f1: 0.5405
 epoch: 50, train_loss: 0.7090, test_loss: 0.8480, test_f1: 0.5707
 epoch: 51, train_loss: 0.6922, test_loss: 0.8402, test_f1: 0.5678
 epoch: 52, train_loss: 0.6844, test_loss: 0.8480, test_f1: 0.5631
 epoch: 53, train_loss: 0.6889, test_loss: 0.8436, test_f1: 0.5765
 epoch: 54, train_loss: 0.6742, test_loss: 0.8435, test_f1: 0.5656
 epoch: 55, train_loss: 0.6724, test_loss: 0.8471, test_f1: 0.5766
 epoch: 56, train_loss: 0.6728, test_loss: 0.8488, test_f1: 0.5706
 epoch: 57, train_loss: 0.6731, test_loss: 0.8703, test_f1: 0.5646
 epoch: 58, train_loss: 0.6656, test_loss: 0.8474, test_f1: 0.5758
 epoch: 59, train_loss: 0.6602, test_loss: 0.8466, test_f1: 0.5704
 epoch: 60, train_loss: 0.6629, test_loss: 0.8383, test_f1: 0.5794
 epoch: 61, train_loss: 0.6625, test_loss: 0.8476, test_f1: 0.5882
 epoch: 62, train_loss: 0.6630, test_loss: 0.8554, test_f1: 0.5718
 epoch: 63, train_loss: 0.6555, test_loss: 0.8458, test_f1: 0.5776
 epoch: 64, train_loss: 0.6515, test_loss: 0.8545, test_f1: 0.5822
 epoch: 65, train_loss: 0.6495, test_loss: 0.8530, test_f1: 0.5823
 epoch: 66, train_loss: 0.6520, test_loss: 0.8617, test_f1: 0.5708
 epoch: 67, train_loss: 0.6447, test_loss: 0.8332, test_f1: 0.5856
 epoch: 68, train_loss: 0.6376, test_loss: 0.8616, test_f1: 0.5859
 epoch: 69, train_loss: 0.6411, test_loss: 0.8620, test_f1: 0.5751
 epoch: 70, train_loss: 0.6317, test_loss: 0.8485, test_f1: 0.5785
 epoch: 71, train_loss: 0.6395, test_loss: 0.8597, test_f1: 0.5851
 epoch: 72, train_loss: 0.6327, test_loss: 0.8568, test_f1: 0.5841
 epoch: 73, train_loss: 0.6234, test_loss: 0.8419, test_f1: 0.5735
 epoch: 74, train_loss: 0.6270, test_loss: 0.8799, test_f1: 0.5834
 epoch: 75, train_loss: 0.6255, test_loss: 0.8716, test_f1: 0.5768
 epoch: 76, train_loss: 0.6168, test_loss: 0.8616, test_f1: 0.5799
 epoch: 77, train_loss: 0.6221, test_loss: 0.8697, test_f1: 0.5701
 epoch: 78, train_loss: 0.6170, test_loss: 0.8776, test_f1: 0.5701
 epoch: 79, train_loss: 0.6157, test_loss: 0.8787, test_f1: 0.5769
 epoch: 80, train_loss: 0.6186, test_loss: 0.8683, test_f1: 0.5882
 epoch: 81, train_loss: 0.6148, test_loss: 0.8741, test_f1: 0.5861
 epoch: 82, train_loss: 0.6093, test_loss: 0.8932, test_f1: 0.5806
 epoch: 83, train_loss: 0.6125, test_loss: 0.8621, test_f1: 0.5946
 epoch: 84, train_loss: 0.6060, test_loss: 0.8918, test_f1: 0.5807
 epoch: 85, train_loss: 0.6073, test_loss: 0.8980, test_f1: 0.5824
 epoch: 86, train_loss: 0.5919, test_loss: 0.8808, test_f1: 0.5778
 epoch: 87, train_loss: 0.5957, test_loss: 0.8776, test_f1: 0.5882
 epoch: 88, train_loss: 0.6008, test_loss: 0.8974, test_f1: 0.5853
 epoch: 89, train_loss: 0.5965, test_loss: 0.9137, test_f1: 0.5790
 epoch: 90, train_loss: 0.5973, test_loss: 0.8715, test_f1: 0.5961
 epoch: 91, train_loss: 0.5838, test_loss: 0.9150, test_f1: 0.5687
 epoch: 92, train_loss: 0.5951, test_loss: 0.8952, test_f1: 0.5873
 epoch: 93, train_loss: 0.5916, test_loss: 0.8960, test_f1: 0.5855
 epoch: 94, train_loss: 0.5828, test_loss: 0.9155, test_f1: 0.5777
 epoch: 95, train_loss: 0.5889, test_loss: 0.9020, test_f1: 0.5769
 epoch: 96, train_loss: 0.5813, test_loss: 0.9048, test_f1: 0.5848
 epoch: 97, train_loss: 0.5967, test_loss: 0.9027, test_f1: 0.5848
 epoch: 98, train_loss: 0.5732, test_loss: 0.9101, test_f1: 0.5824
 epoch: 99, train_loss: 0.5877, test_loss: 0.9052, test_f1: 0.5866
##################ITERATION #3 ****************************************
 epoch: 0, train_loss: 1.2670, test_loss: 1.3308, test_f1: 0.2270
 epoch: 1, train_loss: 1.1641, test_loss: 1.2815, test_f1: 0.2270
 epoch: 2, train_loss: 1.1090, test_loss: 1.1967, test_f1: 0.2506
 epoch: 3, train_loss: 1.0710, test_loss: 1.0907, test_f1: 0.3671
 epoch: 4, train_loss: 1.0406, test_loss: 1.0426, test_f1: 0.4534
 epoch: 5, train_loss: 1.0154, test_loss: 1.0176, test_f1: 0.4691
 epoch: 6, train_loss: 0.9932, test_loss: 0.9994, test_f1: 0.4972
 epoch: 7, train_loss: 0.9780, test_loss: 0.9831, test_f1: 0.5146
 epoch: 8, train_loss: 0.9689, test_loss: 0.9695, test_f1: 0.5188
 epoch: 9, train_loss: 0.9530, test_loss: 0.9555, test_f1: 0.5094
 epoch: 10, train_loss: 0.9445, test_loss: 0.9505, test_f1: 0.5231
 epoch: 11, train_loss: 0.9303, test_loss: 0.9454, test_f1: 0.5264
 epoch: 12, train_loss: 0.9306, test_loss: 0.9412, test_f1: 0.5310
 epoch: 13, train_loss: 0.9141, test_loss: 0.9277, test_f1: 0.5400
 epoch: 14, train_loss: 0.9092, test_loss: 0.9282, test_f1: 0.5219
 epoch: 15, train_loss: 0.9008, test_loss: 0.9268, test_f1: 0.5284
 epoch: 16, train_loss: 0.8938, test_loss: 0.9198, test_f1: 0.5399
 epoch: 17, train_loss: 0.8901, test_loss: 0.9261, test_f1: 0.5276
 epoch: 18, train_loss: 0.8756, test_loss: 0.9188, test_f1: 0.5302
 epoch: 19, train_loss: 0.8661, test_loss: 0.9151, test_f1: 0.5385
 epoch: 20, train_loss: 0.8557, test_loss: 0.9038, test_f1: 0.5348
 epoch: 21, train_loss: 0.8548, test_loss: 0.9133, test_f1: 0.5353
 epoch: 22, train_loss: 0.8548, test_loss: 0.9001, test_f1: 0.5424
 epoch: 23, train_loss: 0.8430, test_loss: 0.8980, test_f1: 0.5354
 epoch: 24, train_loss: 0.8374, test_loss: 0.8805, test_f1: 0.5373
 epoch: 25, train_loss: 0.8228, test_loss: 0.8818, test_f1: 0.5569
 epoch: 26, train_loss: 0.8142, test_loss: 0.8670, test_f1: 0.5441
 epoch: 27, train_loss: 0.8131, test_loss: 0.8866, test_f1: 0.5473
 epoch: 28, train_loss: 0.8111, test_loss: 0.9151, test_f1: 0.5342
 epoch: 29, train_loss: 0.8078, test_loss: 0.8731, test_f1: 0.5488
 epoch: 30, train_loss: 0.8075, test_loss: 0.8545, test_f1: 0.5487
 epoch: 31, train_loss: 0.7901, test_loss: 0.8714, test_f1: 0.5528
 epoch: 32, train_loss: 0.7857, test_loss: 0.8545, test_f1: 0.5534
 epoch: 33, train_loss: 0.7745, test_loss: 0.8724, test_f1: 0.5523
 epoch: 34, train_loss: 0.7681, test_loss: 0.8637, test_f1: 0.5628
 epoch: 35, train_loss: 0.7674, test_loss: 0.8567, test_f1: 0.5748
 epoch: 36, train_loss: 0.7585, test_loss: 0.8661, test_f1: 0.5697
 epoch: 37, train_loss: 0.7523, test_loss: 0.8393, test_f1: 0.5644
 epoch: 38, train_loss: 0.7487, test_loss: 0.8403, test_f1: 0.5835
 epoch: 39, train_loss: 0.7412, test_loss: 0.8438, test_f1: 0.5836
 epoch: 40, train_loss: 0.7352, test_loss: 0.8453, test_f1: 0.5899
 epoch: 41, train_loss: 0.7227, test_loss: 0.8758, test_f1: 0.5571
 epoch: 42, train_loss: 0.7251, test_loss: 0.8527, test_f1: 0.5937
 epoch: 43, train_loss: 0.7216, test_loss: 0.8505, test_f1: 0.5953
 epoch: 44, train_loss: 0.7162, test_loss: 0.8677, test_f1: 0.6010
 epoch: 45, train_loss: 0.7112, test_loss: 0.8410, test_f1: 0.5949
 epoch: 46, train_loss: 0.6985, test_loss: 0.8466, test_f1: 0.5986
 epoch: 47, train_loss: 0.7116, test_loss: 0.8326, test_f1: 0.5890
 epoch: 48, train_loss: 0.6968, test_loss: 0.8568, test_f1: 0.5828
 epoch: 49, train_loss: 0.6964, test_loss: 0.8500, test_f1: 0.6115
 epoch: 50, train_loss: 0.6835, test_loss: 0.8345, test_f1: 0.6094
 epoch: 51, train_loss: 0.6794, test_loss: 0.8464, test_f1: 0.6005
 epoch: 52, train_loss: 0.6674, test_loss: 0.8401, test_f1: 0.6001
 epoch: 53, train_loss: 0.6646, test_loss: 0.8619, test_f1: 0.6074
 epoch: 54, train_loss: 0.6667, test_loss: 0.8490, test_f1: 0.6111
 epoch: 55, train_loss: 0.6561, test_loss: 0.8557, test_f1: 0.6122
 epoch: 56, train_loss: 0.6621, test_loss: 0.8512, test_f1: 0.5984
 epoch: 57, train_loss: 0.6641, test_loss: 0.8634, test_f1: 0.6013
 epoch: 58, train_loss: 0.6605, test_loss: 0.8593, test_f1: 0.6028
 epoch: 59, train_loss: 0.6633, test_loss: 0.8517, test_f1: 0.6195
 epoch: 60, train_loss: 0.6523, test_loss: 0.8480, test_f1: 0.6026
 epoch: 61, train_loss: 0.6540, test_loss: 0.8713, test_f1: 0.5975
 epoch: 62, train_loss: 0.6475, test_loss: 0.8574, test_f1: 0.6116
 epoch: 63, train_loss: 0.6420, test_loss: 0.8573, test_f1: 0.6073
 epoch: 64, train_loss: 0.6444, test_loss: 0.8609, test_f1: 0.6060
 epoch: 65, train_loss: 0.6452, test_loss: 0.8707, test_f1: 0.6102
 epoch: 66, train_loss: 0.6356, test_loss: 0.8806, test_f1: 0.6136
 epoch: 67, train_loss: 0.6441, test_loss: 0.8769, test_f1: 0.6051
 epoch: 68, train_loss: 0.6426, test_loss: 0.8598, test_f1: 0.6102
 epoch: 69, train_loss: 0.6402, test_loss: 0.8808, test_f1: 0.6134
 epoch: 70, train_loss: 0.6264, test_loss: 0.8804, test_f1: 0.6102
 epoch: 71, train_loss: 0.6311, test_loss: 0.8754, test_f1: 0.6226
 epoch: 72, train_loss: 0.6238, test_loss: 0.8918, test_f1: 0.6025
 epoch: 73, train_loss: 0.6252, test_loss: 0.8748, test_f1: 0.6314
 epoch: 74, train_loss: 0.6221, test_loss: 0.8762, test_f1: 0.6022
 epoch: 75, train_loss: 0.6159, test_loss: 0.8819, test_f1: 0.6336
 epoch: 76, train_loss: 0.6083, test_loss: 0.8880, test_f1: 0.6092
 epoch: 77, train_loss: 0.6140, test_loss: 0.8972, test_f1: 0.6145
 epoch: 78, train_loss: 0.6127, test_loss: 0.8818, test_f1: 0.6180
 epoch: 79, train_loss: 0.6122, test_loss: 0.8975, test_f1: 0.6142
 epoch: 80, train_loss: 0.6126, test_loss: 0.8887, test_f1: 0.6233
 epoch: 81, train_loss: 0.6081, test_loss: 0.8915, test_f1: 0.5989
 epoch: 82, train_loss: 0.6135, test_loss: 0.8894, test_f1: 0.6410
 epoch: 83, train_loss: 0.6047, test_loss: 0.9155, test_f1: 0.6022
 epoch: 84, train_loss: 0.5977, test_loss: 0.8832, test_f1: 0.6371
 epoch: 85, train_loss: 0.6053, test_loss: 0.9106, test_f1: 0.6308
 epoch: 86, train_loss: 0.6085, test_loss: 0.8934, test_f1: 0.6254
 epoch: 87, train_loss: 0.5936, test_loss: 0.9114, test_f1: 0.6386
 epoch: 88, train_loss: 0.6058, test_loss: 0.9152, test_f1: 0.6239
 epoch: 89, train_loss: 0.5921, test_loss: 0.9215, test_f1: 0.6419
 epoch: 90, train_loss: 0.5972, test_loss: 0.9067, test_f1: 0.6504
 epoch: 91, train_loss: 0.5835, test_loss: 0.9160, test_f1: 0.6339
 epoch: 92, train_loss: 0.5878, test_loss: 0.9019, test_f1: 0.6483
 epoch: 93, train_loss: 0.6021, test_loss: 0.8992, test_f1: 0.6382
 epoch: 94, train_loss: 0.5844, test_loss: 0.9067, test_f1: 0.6105
 epoch: 95, train_loss: 0.5869, test_loss: 0.9373, test_f1: 0.6155
 epoch: 96, train_loss: 0.5822, test_loss: 0.9243, test_f1: 0.6426
 epoch: 97, train_loss: 0.5834, test_loss: 0.9271, test_f1: 0.6423
 epoch: 98, train_loss: 0.5852, test_loss: 0.9132, test_f1: 0.6375
 epoch: 99, train_loss: 0.5659, test_loss: 0.9306, test_f1: 0.6327
##################ITERATION #4 ****************************************
 epoch: 0, train_loss: 1.2528, test_loss: 1.3259, test_f1: 0.2270
 epoch: 1, train_loss: 1.1264, test_loss: 1.3026, test_f1: 0.2270
 epoch: 2, train_loss: 1.0725, test_loss: 1.2283, test_f1: 0.2591
 epoch: 3, train_loss: 1.0357, test_loss: 1.1086, test_f1: 0.3613
 epoch: 4, train_loss: 1.0059, test_loss: 1.0412, test_f1: 0.4675
 epoch: 5, train_loss: 0.9841, test_loss: 0.9874, test_f1: 0.4934
 epoch: 6, train_loss: 0.9667, test_loss: 0.9576, test_f1: 0.5144
 epoch: 7, train_loss: 0.9554, test_loss: 0.9363, test_f1: 0.5309
 epoch: 8, train_loss: 0.9389, test_loss: 0.9211, test_f1: 0.5441
 epoch: 9, train_loss: 0.9331, test_loss: 0.9122, test_f1: 0.5447
 epoch: 10, train_loss: 0.9233, test_loss: 0.9031, test_f1: 0.5386
 epoch: 11, train_loss: 0.9089, test_loss: 0.8993, test_f1: 0.5351
 epoch: 12, train_loss: 0.8986, test_loss: 0.8887, test_f1: 0.5360
 epoch: 13, train_loss: 0.8914, test_loss: 0.8792, test_f1: 0.5488
 epoch: 14, train_loss: 0.8866, test_loss: 0.8751, test_f1: 0.5502
 epoch: 15, train_loss: 0.8750, test_loss: 0.8693, test_f1: 0.5392
 epoch: 16, train_loss: 0.8696, test_loss: 0.8624, test_f1: 0.5479
 epoch: 17, train_loss: 0.8624, test_loss: 0.8499, test_f1: 0.5536
 epoch: 18, train_loss: 0.8480, test_loss: 0.8439, test_f1: 0.5572
 epoch: 19, train_loss: 0.8416, test_loss: 0.8357, test_f1: 0.5445
 epoch: 20, train_loss: 0.8329, test_loss: 0.8281, test_f1: 0.5513
 epoch: 21, train_loss: 0.8295, test_loss: 0.8319, test_f1: 0.5541
 epoch: 22, train_loss: 0.8183, test_loss: 0.8303, test_f1: 0.5610
 epoch: 23, train_loss: 0.8137, test_loss: 0.8218, test_f1: 0.5619
 epoch: 24, train_loss: 0.7968, test_loss: 0.8050, test_f1: 0.5555
 epoch: 25, train_loss: 0.7928, test_loss: 0.8188, test_f1: 0.5609
 epoch: 26, train_loss: 0.7885, test_loss: 0.8059, test_f1: 0.5602
 epoch: 27, train_loss: 0.7800, test_loss: 0.8058, test_f1: 0.5657
 epoch: 28, train_loss: 0.7786, test_loss: 0.8115, test_f1: 0.5524
 epoch: 29, train_loss: 0.7607, test_loss: 0.7893, test_f1: 0.5795
 epoch: 30, train_loss: 0.7619, test_loss: 0.8155, test_f1: 0.5768
 epoch: 31, train_loss: 0.7576, test_loss: 0.8157, test_f1: 0.5724
 epoch: 32, train_loss: 0.7470, test_loss: 0.7863, test_f1: 0.5885
 epoch: 33, train_loss: 0.7494, test_loss: 0.7784, test_f1: 0.5968
 epoch: 34, train_loss: 0.7349, test_loss: 0.7893, test_f1: 0.5799
 epoch: 35, train_loss: 0.7299, test_loss: 0.7840, test_f1: 0.5864
 epoch: 36, train_loss: 0.7212, test_loss: 0.7757, test_f1: 0.5852
 epoch: 37, train_loss: 0.7240, test_loss: 0.7811, test_f1: 0.5680
 epoch: 38, train_loss: 0.7109, test_loss: 0.7711, test_f1: 0.5947
 epoch: 39, train_loss: 0.7102, test_loss: 0.7914, test_f1: 0.5859
 epoch: 40, train_loss: 0.7008, test_loss: 0.7735, test_f1: 0.5907
 epoch: 41, train_loss: 0.7020, test_loss: 0.7707, test_f1: 0.6022
 epoch: 42, train_loss: 0.6912, test_loss: 0.7955, test_f1: 0.5801
 epoch: 43, train_loss: 0.6973, test_loss: 0.8057, test_f1: 0.5787
 epoch: 44, train_loss: 0.6914, test_loss: 0.7739, test_f1: 0.6005
 epoch: 45, train_loss: 0.6796, test_loss: 0.7863, test_f1: 0.5848
 epoch: 46, train_loss: 0.6672, test_loss: 0.7675, test_f1: 0.5972
 epoch: 47, train_loss: 0.6709, test_loss: 0.7809, test_f1: 0.5844
 epoch: 48, train_loss: 0.6701, test_loss: 0.8129, test_f1: 0.5792
 epoch: 49, train_loss: 0.6624, test_loss: 0.7700, test_f1: 0.6030
 epoch: 50, train_loss: 0.6546, test_loss: 0.7503, test_f1: 0.6093
 epoch: 51, train_loss: 0.6539, test_loss: 0.7765, test_f1: 0.6091
 epoch: 52, train_loss: 0.6461, test_loss: 0.7713, test_f1: 0.6144
 epoch: 53, train_loss: 0.6334, test_loss: 0.7765, test_f1: 0.6066
 epoch: 54, train_loss: 0.6362, test_loss: 0.7705, test_f1: 0.6146
 epoch: 55, train_loss: 0.6390, test_loss: 0.7722, test_f1: 0.6229
 epoch: 56, train_loss: 0.6370, test_loss: 0.7846, test_f1: 0.5964
 epoch: 57, train_loss: 0.6308, test_loss: 0.7726, test_f1: 0.6136
 epoch: 58, train_loss: 0.6133, test_loss: 0.7871, test_f1: 0.6080
 epoch: 59, train_loss: 0.6177, test_loss: 0.7806, test_f1: 0.6089
 epoch: 60, train_loss: 0.6242, test_loss: 0.7955, test_f1: 0.6041
 epoch: 61, train_loss: 0.6130, test_loss: 0.7946, test_f1: 0.6136
 epoch: 62, train_loss: 0.6068, test_loss: 0.8037, test_f1: 0.6196
 epoch: 63, train_loss: 0.6125, test_loss: 0.7995, test_f1: 0.6099
 epoch: 64, train_loss: 0.6104, test_loss: 0.7944, test_f1: 0.6069
 epoch: 65, train_loss: 0.5996, test_loss: 0.7932, test_f1: 0.6268
 epoch: 66, train_loss: 0.6085, test_loss: 0.7982, test_f1: 0.6419
 epoch: 67, train_loss: 0.6102, test_loss: 0.8016, test_f1: 0.6107
 epoch: 68, train_loss: 0.6000, test_loss: 0.7903, test_f1: 0.5992
 epoch: 69, train_loss: 0.6012, test_loss: 0.8002, test_f1: 0.6415
 epoch: 70, train_loss: 0.5919, test_loss: 0.8081, test_f1: 0.6301
 epoch: 71, train_loss: 0.5923, test_loss: 0.8161, test_f1: 0.6301
 epoch: 72, train_loss: 0.5890, test_loss: 0.8012, test_f1: 0.6335
 epoch: 73, train_loss: 0.5961, test_loss: 0.8077, test_f1: 0.6335
 epoch: 74, train_loss: 0.5815, test_loss: 0.8142, test_f1: 0.6404
 epoch: 75, train_loss: 0.5837, test_loss: 0.8256, test_f1: 0.6482
 epoch: 76, train_loss: 0.5928, test_loss: 0.8359, test_f1: 0.6379
 epoch: 77, train_loss: 0.5916, test_loss: 0.8419, test_f1: 0.6289
 epoch: 78, train_loss: 0.5857, test_loss: 0.8255, test_f1: 0.6362
 epoch: 79, train_loss: 0.5911, test_loss: 0.8415, test_f1: 0.6446
 epoch: 80, train_loss: 0.5801, test_loss: 0.8464, test_f1: 0.6423
 epoch: 81, train_loss: 0.5764, test_loss: 0.8238, test_f1: 0.6381
 epoch: 82, train_loss: 0.5770, test_loss: 0.8355, test_f1: 0.6527
 epoch: 83, train_loss: 0.5680, test_loss: 0.8462, test_f1: 0.6352
 epoch: 84, train_loss: 0.5744, test_loss: 0.8399, test_f1: 0.6397
 epoch: 85, train_loss: 0.5680, test_loss: 0.8397, test_f1: 0.6308
 epoch: 86, train_loss: 0.5705, test_loss: 0.8585, test_f1: 0.6324
 epoch: 87, train_loss: 0.5653, test_loss: 0.8423, test_f1: 0.6431
 epoch: 88, train_loss: 0.5551, test_loss: 0.8494, test_f1: 0.6390
 epoch: 89, train_loss: 0.5581, test_loss: 0.8648, test_f1: 0.6404
 epoch: 90, train_loss: 0.5474, test_loss: 0.8649, test_f1: 0.6343
 epoch: 91, train_loss: 0.5583, test_loss: 0.8687, test_f1: 0.6254
 epoch: 92, train_loss: 0.5517, test_loss: 0.8458, test_f1: 0.6301
 epoch: 93, train_loss: 0.5517, test_loss: 0.8588, test_f1: 0.6391
 epoch: 94, train_loss: 0.5494, test_loss: 0.8758, test_f1: 0.6547
 epoch: 95, train_loss: 0.5463, test_loss: 0.8679, test_f1: 0.6504
 epoch: 96, train_loss: 0.5488, test_loss: 0.8595, test_f1: 0.6205
 epoch: 97, train_loss: 0.5534, test_loss: 0.8909, test_f1: 0.6331
 epoch: 98, train_loss: 0.5370, test_loss: 0.8823, test_f1: 0.6413
 epoch: 99, train_loss: 0.5437, test_loss: 0.9093, test_f1: 0.6118
##################ITERATION #5 ****************************************
 epoch: 0, train_loss: 1.2099, test_loss: 1.3094, test_f1: 0.2270
 epoch: 1, train_loss: 1.0863, test_loss: 1.2769, test_f1: 0.2396
 epoch: 2, train_loss: 1.0460, test_loss: 1.1927, test_f1: 0.3083
 epoch: 3, train_loss: 1.0214, test_loss: 1.0639, test_f1: 0.4737
 epoch: 4, train_loss: 0.9958, test_loss: 0.9979, test_f1: 0.4917
 epoch: 5, train_loss: 0.9836, test_loss: 0.9768, test_f1: 0.5130
 epoch: 6, train_loss: 0.9636, test_loss: 0.9677, test_f1: 0.5324
 epoch: 7, train_loss: 0.9556, test_loss: 0.9526, test_f1: 0.5308
 epoch: 8, train_loss: 0.9418, test_loss: 0.9459, test_f1: 0.5249
 epoch: 9, train_loss: 0.9294, test_loss: 0.9377, test_f1: 0.5218
 epoch: 10, train_loss: 0.9138, test_loss: 0.9274, test_f1: 0.5407
 epoch: 11, train_loss: 0.9076, test_loss: 0.9241, test_f1: 0.5497
 epoch: 12, train_loss: 0.8944, test_loss: 0.9144, test_f1: 0.5546
 epoch: 13, train_loss: 0.8900, test_loss: 0.9045, test_f1: 0.5486
 epoch: 14, train_loss: 0.8834, test_loss: 0.9069, test_f1: 0.5584
 epoch: 15, train_loss: 0.8705, test_loss: 0.8983, test_f1: 0.5550
 epoch: 16, train_loss: 0.8575, test_loss: 0.8856, test_f1: 0.5595
 epoch: 17, train_loss: 0.8575, test_loss: 0.8871, test_f1: 0.5632
 epoch: 18, train_loss: 0.8567, test_loss: 0.8933, test_f1: 0.5564
 epoch: 19, train_loss: 0.8360, test_loss: 0.8750, test_f1: 0.5609
 epoch: 20, train_loss: 0.8428, test_loss: 0.8893, test_f1: 0.5455
 epoch: 21, train_loss: 0.8296, test_loss: 0.8774, test_f1: 0.5623
 epoch: 22, train_loss: 0.8199, test_loss: 0.8691, test_f1: 0.5530
 epoch: 23, train_loss: 0.8116, test_loss: 0.8579, test_f1: 0.5711
 epoch: 24, train_loss: 0.8009, test_loss: 0.8709, test_f1: 0.5566
 epoch: 25, train_loss: 0.7938, test_loss: 0.8732, test_f1: 0.5592
 epoch: 26, train_loss: 0.7821, test_loss: 0.8495, test_f1: 0.5653
 epoch: 27, train_loss: 0.7815, test_loss: 0.8515, test_f1: 0.5753
 epoch: 28, train_loss: 0.7828, test_loss: 0.8689, test_f1: 0.5540
 epoch: 29, train_loss: 0.7750, test_loss: 0.8508, test_f1: 0.5662
 epoch: 30, train_loss: 0.7519, test_loss: 0.8538, test_f1: 0.5567
 epoch: 31, train_loss: 0.7596, test_loss: 0.8852, test_f1: 0.5574
 epoch: 32, train_loss: 0.7541, test_loss: 0.8510, test_f1: 0.5726
 epoch: 33, train_loss: 0.7479, test_loss: 0.8522, test_f1: 0.5834
 epoch: 34, train_loss: 0.7421, test_loss: 0.8442, test_f1: 0.5838
 epoch: 35, train_loss: 0.7342, test_loss: 0.8474, test_f1: 0.5907
 epoch: 36, train_loss: 0.7235, test_loss: 0.8527, test_f1: 0.6066
 epoch: 37, train_loss: 0.7238, test_loss: 0.8850, test_f1: 0.5931
 epoch: 38, train_loss: 0.7183, test_loss: 0.8422, test_f1: 0.5871
 epoch: 39, train_loss: 0.7120, test_loss: 0.8409, test_f1: 0.5995
 epoch: 40, train_loss: 0.7078, test_loss: 0.8412, test_f1: 0.6246
 epoch: 41, train_loss: 0.6969, test_loss: 0.8585, test_f1: 0.6165
 epoch: 42, train_loss: 0.6859, test_loss: 0.8654, test_f1: 0.6004
 epoch: 43, train_loss: 0.6869, test_loss: 0.8506, test_f1: 0.6345
 epoch: 44, train_loss: 0.6867, test_loss: 0.8746, test_f1: 0.6160
 epoch: 45, train_loss: 0.6798, test_loss: 0.8396, test_f1: 0.6232
 epoch: 46, train_loss: 0.6660, test_loss: 0.8649, test_f1: 0.6302
 epoch: 47, train_loss: 0.6616, test_loss: 0.8747, test_f1: 0.6257
 epoch: 48, train_loss: 0.6667, test_loss: 0.8555, test_f1: 0.6403
 epoch: 49, train_loss: 0.6669, test_loss: 0.8773, test_f1: 0.6321
 epoch: 50, train_loss: 0.6476, test_loss: 0.8833, test_f1: 0.6256
 epoch: 51, train_loss: 0.6516, test_loss: 0.8720, test_f1: 0.6284
 epoch: 52, train_loss: 0.6323, test_loss: 0.8542, test_f1: 0.6406
 epoch: 53, train_loss: 0.6356, test_loss: 0.8757, test_f1: 0.6314
 epoch: 54, train_loss: 0.6327, test_loss: 0.8797, test_f1: 0.6310
 epoch: 55, train_loss: 0.6245, test_loss: 0.8872, test_f1: 0.6336
 epoch: 56, train_loss: 0.6193, test_loss: 0.8860, test_f1: 0.6274
 epoch: 57, train_loss: 0.6225, test_loss: 0.8944, test_f1: 0.6442
 epoch: 58, train_loss: 0.6141, test_loss: 0.8828, test_f1: 0.6461
 epoch: 59, train_loss: 0.6072, test_loss: 0.8867, test_f1: 0.6374
 epoch: 60, train_loss: 0.6191, test_loss: 0.9097, test_f1: 0.6442
 epoch: 61, train_loss: 0.6095, test_loss: 0.8940, test_f1: 0.6356
 epoch: 62, train_loss: 0.6048, test_loss: 0.8992, test_f1: 0.6375
 epoch: 63, train_loss: 0.6091, test_loss: 0.9173, test_f1: 0.6358
 epoch: 64, train_loss: 0.6019, test_loss: 0.9087, test_f1: 0.6424
 epoch: 65, train_loss: 0.5927, test_loss: 0.9194, test_f1: 0.6419
 epoch: 66, train_loss: 0.5978, test_loss: 0.9156, test_f1: 0.6554
 epoch: 67, train_loss: 0.5958, test_loss: 0.9341, test_f1: 0.6466
 epoch: 68, train_loss: 0.5997, test_loss: 0.9169, test_f1: 0.6527
 epoch: 69, train_loss: 0.5847, test_loss: 0.9294, test_f1: 0.6526
 epoch: 70, train_loss: 0.5887, test_loss: 0.9204, test_f1: 0.6644
 epoch: 71, train_loss: 0.5864, test_loss: 0.9411, test_f1: 0.6517
 epoch: 72, train_loss: 0.5855, test_loss: 0.9326, test_f1: 0.6543
 epoch: 73, train_loss: 0.5812, test_loss: 0.9360, test_f1: 0.6572
 epoch: 74, train_loss: 0.5812, test_loss: 0.9308, test_f1: 0.6593
 epoch: 75, train_loss: 0.5718, test_loss: 0.9322, test_f1: 0.6425
 epoch: 76, train_loss: 0.5768, test_loss: 0.9379, test_f1: 0.6507
 epoch: 77, train_loss: 0.5726, test_loss: 0.9553, test_f1: 0.6453
 epoch: 78, train_loss: 0.5669, test_loss: 0.9405, test_f1: 0.6558
 epoch: 79, train_loss: 0.5723, test_loss: 0.9397, test_f1: 0.6593
 epoch: 80, train_loss: 0.5604, test_loss: 0.9578, test_f1: 0.6540
 epoch: 81, train_loss: 0.5606, test_loss: 0.9460, test_f1: 0.6485
 epoch: 82, train_loss: 0.5677, test_loss: 0.9499, test_f1: 0.6498
 epoch: 83, train_loss: 0.5633, test_loss: 0.9604, test_f1: 0.6545
 epoch: 84, train_loss: 0.5543, test_loss: 0.9513, test_f1: 0.6500
 epoch: 85, train_loss: 0.5512, test_loss: 0.9407, test_f1: 0.6379
 epoch: 86, train_loss: 0.5590, test_loss: 0.9572, test_f1: 0.6582
 epoch: 87, train_loss: 0.5615, test_loss: 0.9504, test_f1: 0.6444
 epoch: 88, train_loss: 0.5509, test_loss: 0.9582, test_f1: 0.6322
 epoch: 89, train_loss: 0.5541, test_loss: 0.9619, test_f1: 0.6450
 epoch: 90, train_loss: 0.5493, test_loss: 0.9708, test_f1: 0.6486
 epoch: 91, train_loss: 0.5355, test_loss: 0.9708, test_f1: 0.6476
 epoch: 92, train_loss: 0.5310, test_loss: 0.9952, test_f1: 0.6412
 epoch: 93, train_loss: 0.5442, test_loss: 0.9930, test_f1: 0.6435
 epoch: 94, train_loss: 0.5387, test_loss: 1.0010, test_f1: 0.6319
 epoch: 95, train_loss: 0.5392, test_loss: 0.9700, test_f1: 0.6536
 epoch: 96, train_loss: 0.5403, test_loss: 0.9730, test_f1: 0.6578
 epoch: 97, train_loss: 0.5293, test_loss: 0.9977, test_f1: 0.6495
 epoch: 98, train_loss: 0.5389, test_loss: 0.9912, test_f1: 0.6519
 epoch: 99, train_loss: 0.5324, test_loss: 0.9856, test_f1: 0.6418
##################ITERATION #6 ****************************************
 epoch: 0, train_loss: 1.2631, test_loss: 1.3227, test_f1: 0.2270
 epoch: 1, train_loss: 1.1074, test_loss: 1.3424, test_f1: 0.2270
 epoch: 2, train_loss: 1.0536, test_loss: 1.3266, test_f1: 0.2270
 epoch: 3, train_loss: 1.0261, test_loss: 1.1982, test_f1: 0.2355
 epoch: 4, train_loss: 0.9988, test_loss: 1.0716, test_f1: 0.4057
 epoch: 5, train_loss: 0.9855, test_loss: 0.9930, test_f1: 0.4746
 epoch: 6, train_loss: 0.9659, test_loss: 0.9681, test_f1: 0.5080
 epoch: 7, train_loss: 0.9669, test_loss: 0.9591, test_f1: 0.5091
 epoch: 8, train_loss: 0.9471, test_loss: 0.9546, test_f1: 0.5250
 epoch: 9, train_loss: 0.9384, test_loss: 0.9454, test_f1: 0.5158
 epoch: 10, train_loss: 0.9345, test_loss: 0.9360, test_f1: 0.5251
 epoch: 11, train_loss: 0.9164, test_loss: 0.9287, test_f1: 0.5352
 epoch: 12, train_loss: 0.9069, test_loss: 0.9162, test_f1: 0.5242
 epoch: 13, train_loss: 0.8990, test_loss: 0.9113, test_f1: 0.5258
 epoch: 14, train_loss: 0.8939, test_loss: 0.8993, test_f1: 0.5318
 epoch: 15, train_loss: 0.8764, test_loss: 0.8872, test_f1: 0.5299
 epoch: 16, train_loss: 0.8715, test_loss: 0.8845, test_f1: 0.5400
 epoch: 17, train_loss: 0.8655, test_loss: 0.8813, test_f1: 0.5555
 epoch: 18, train_loss: 0.8532, test_loss: 0.8790, test_f1: 0.5481
 epoch: 19, train_loss: 0.8497, test_loss: 0.8736, test_f1: 0.5473
 epoch: 20, train_loss: 0.8394, test_loss: 0.8647, test_f1: 0.5563
 epoch: 21, train_loss: 0.8330, test_loss: 0.8456, test_f1: 0.5574
 epoch: 22, train_loss: 0.8224, test_loss: 0.8579, test_f1: 0.5495
 epoch: 23, train_loss: 0.8170, test_loss: 0.8393, test_f1: 0.5698
 epoch: 24, train_loss: 0.8079, test_loss: 0.8405, test_f1: 0.5702
 epoch: 25, train_loss: 0.8008, test_loss: 0.8349, test_f1: 0.5709
 epoch: 26, train_loss: 0.7955, test_loss: 0.8318, test_f1: 0.5637
 epoch: 27, train_loss: 0.7899, test_loss: 0.8273, test_f1: 0.5629
 epoch: 28, train_loss: 0.7802, test_loss: 0.8240, test_f1: 0.5629
 epoch: 29, train_loss: 0.7776, test_loss: 0.8228, test_f1: 0.5650
 epoch: 30, train_loss: 0.7737, test_loss: 0.8121, test_f1: 0.5796
 epoch: 31, train_loss: 0.7637, test_loss: 0.8259, test_f1: 0.5853
 epoch: 32, train_loss: 0.7641, test_loss: 0.8046, test_f1: 0.5806
 epoch: 33, train_loss: 0.7549, test_loss: 0.8007, test_f1: 0.5786
 epoch: 34, train_loss: 0.7481, test_loss: 0.8062, test_f1: 0.5903
 epoch: 35, train_loss: 0.7471, test_loss: 0.8098, test_f1: 0.5859
 epoch: 36, train_loss: 0.7398, test_loss: 0.8055, test_f1: 0.5980
 epoch: 37, train_loss: 0.7343, test_loss: 0.8005, test_f1: 0.5694
 epoch: 38, train_loss: 0.7302, test_loss: 0.8095, test_f1: 0.5988
 epoch: 39, train_loss: 0.7275, test_loss: 0.7939, test_f1: 0.6023
 epoch: 40, train_loss: 0.7253, test_loss: 0.7952, test_f1: 0.5968
 epoch: 41, train_loss: 0.7217, test_loss: 0.8007, test_f1: 0.6245
 epoch: 42, train_loss: 0.7173, test_loss: 0.7990, test_f1: 0.6163
 epoch: 43, train_loss: 0.7101, test_loss: 0.7821, test_f1: 0.6016
 epoch: 44, train_loss: 0.6985, test_loss: 0.7929, test_f1: 0.5844
 epoch: 45, train_loss: 0.6996, test_loss: 0.7870, test_f1: 0.6104
 epoch: 46, train_loss: 0.6858, test_loss: 0.7735, test_f1: 0.6113
 epoch: 47, train_loss: 0.6905, test_loss: 0.7902, test_f1: 0.6022
 epoch: 48, train_loss: 0.6781, test_loss: 0.7822, test_f1: 0.6239
 epoch: 49, train_loss: 0.6875, test_loss: 0.7753, test_f1: 0.6122
 epoch: 50, train_loss: 0.6687, test_loss: 0.7769, test_f1: 0.6124
 epoch: 51, train_loss: 0.6641, test_loss: 0.7858, test_f1: 0.6221
 epoch: 52, train_loss: 0.6570, test_loss: 0.7610, test_f1: 0.6068
 epoch: 53, train_loss: 0.6585, test_loss: 0.7725, test_f1: 0.6144
 epoch: 54, train_loss: 0.6628, test_loss: 0.7797, test_f1: 0.6219
 epoch: 55, train_loss: 0.6503, test_loss: 0.7866, test_f1: 0.6256
 epoch: 56, train_loss: 0.6434, test_loss: 0.7900, test_f1: 0.6253
 epoch: 57, train_loss: 0.6418, test_loss: 0.7806, test_f1: 0.6071
 epoch: 58, train_loss: 0.6431, test_loss: 0.7896, test_f1: 0.6227
 epoch: 59, train_loss: 0.6468, test_loss: 0.7920, test_f1: 0.6016
 epoch: 60, train_loss: 0.6430, test_loss: 0.7867, test_f1: 0.6161
 epoch: 61, train_loss: 0.6358, test_loss: 0.7922, test_f1: 0.6275
 epoch: 62, train_loss: 0.6407, test_loss: 0.8118, test_f1: 0.6021
 epoch: 63, train_loss: 0.6341, test_loss: 0.8069, test_f1: 0.6228
 epoch: 64, train_loss: 0.6237, test_loss: 0.7917, test_f1: 0.6226
 epoch: 65, train_loss: 0.6242, test_loss: 0.7986, test_f1: 0.6034
 epoch: 66, train_loss: 0.6262, test_loss: 0.7984, test_f1: 0.6173
 epoch: 67, train_loss: 0.6257, test_loss: 0.7957, test_f1: 0.6157
 epoch: 68, train_loss: 0.6163, test_loss: 0.7918, test_f1: 0.6253
 epoch: 69, train_loss: 0.6167, test_loss: 0.8160, test_f1: 0.6150
 epoch: 70, train_loss: 0.6224, test_loss: 0.7919, test_f1: 0.6206
 epoch: 71, train_loss: 0.6210, test_loss: 0.7932, test_f1: 0.6232
 epoch: 72, train_loss: 0.6191, test_loss: 0.8102, test_f1: 0.6237
 epoch: 73, train_loss: 0.6119, test_loss: 0.8099, test_f1: 0.6181
 epoch: 74, train_loss: 0.6114, test_loss: 0.7961, test_f1: 0.6400
 epoch: 75, train_loss: 0.6119, test_loss: 0.7947, test_f1: 0.6260
 epoch: 76, train_loss: 0.6071, test_loss: 0.7967, test_f1: 0.6373
 epoch: 77, train_loss: 0.6091, test_loss: 0.8065, test_f1: 0.6194
 epoch: 78, train_loss: 0.5903, test_loss: 0.8041, test_f1: 0.6364
 epoch: 79, train_loss: 0.6013, test_loss: 0.8100, test_f1: 0.6215
 epoch: 80, train_loss: 0.5966, test_loss: 0.8009, test_f1: 0.6387
 epoch: 81, train_loss: 0.6037, test_loss: 0.8040, test_f1: 0.6222
 epoch: 82, train_loss: 0.5948, test_loss: 0.8129, test_f1: 0.6361
 epoch: 83, train_loss: 0.5883, test_loss: 0.8232, test_f1: 0.6243
 epoch: 84, train_loss: 0.5848, test_loss: 0.8119, test_f1: 0.6348
 epoch: 85, train_loss: 0.5873, test_loss: 0.8111, test_f1: 0.6253
 epoch: 86, train_loss: 0.5814, test_loss: 0.8277, test_f1: 0.6328
 epoch: 87, train_loss: 0.5868, test_loss: 0.8154, test_f1: 0.6384
 epoch: 88, train_loss: 0.5853, test_loss: 0.8246, test_f1: 0.6318
 epoch: 89, train_loss: 0.5732, test_loss: 0.8205, test_f1: 0.6306
 epoch: 90, train_loss: 0.5695, test_loss: 0.8176, test_f1: 0.6223
 epoch: 91, train_loss: 0.5758, test_loss: 0.8265, test_f1: 0.6382
 epoch: 92, train_loss: 0.5655, test_loss: 0.8317, test_f1: 0.6376
 epoch: 93, train_loss: 0.5658, test_loss: 0.8304, test_f1: 0.6311
 epoch: 94, train_loss: 0.5755, test_loss: 0.8193, test_f1: 0.6319
 epoch: 95, train_loss: 0.5667, test_loss: 0.8317, test_f1: 0.6328
 epoch: 96, train_loss: 0.5608, test_loss: 0.8422, test_f1: 0.6227
 epoch: 97, train_loss: 0.5565, test_loss: 0.8420, test_f1: 0.6371
 epoch: 98, train_loss: 0.5661, test_loss: 0.8459, test_f1: 0.6425
 epoch: 99, train_loss: 0.5580, test_loss: 0.8822, test_f1: 0.6305
##################ITERATION #7 ****************************************
 epoch: 0, train_loss: 1.2118, test_loss: 1.3069, test_f1: 0.2270
 epoch: 1, train_loss: 1.0620, test_loss: 1.2809, test_f1: 0.2307
 epoch: 2, train_loss: 1.0322, test_loss: 1.2471, test_f1: 0.3220
 epoch: 3, train_loss: 0.9982, test_loss: 1.0882, test_f1: 0.4588
 epoch: 4, train_loss: 0.9945, test_loss: 1.0263, test_f1: 0.4642
 epoch: 5, train_loss: 0.9677, test_loss: 0.9990, test_f1: 0.4743
 epoch: 6, train_loss: 0.9534, test_loss: 0.9675, test_f1: 0.5177
 epoch: 7, train_loss: 0.9398, test_loss: 0.9378, test_f1: 0.5206
 epoch: 8, train_loss: 0.9291, test_loss: 0.9385, test_f1: 0.5289
 epoch: 9, train_loss: 0.9155, test_loss: 0.9149, test_f1: 0.5229
 epoch: 10, train_loss: 0.9102, test_loss: 0.9166, test_f1: 0.5441
 epoch: 11, train_loss: 0.9074, test_loss: 0.9254, test_f1: 0.5260
 epoch: 12, train_loss: 0.8948, test_loss: 0.8916, test_f1: 0.5495
 epoch: 13, train_loss: 0.8878, test_loss: 0.9036, test_f1: 0.5478
 epoch: 14, train_loss: 0.8724, test_loss: 0.8914, test_f1: 0.5601
 epoch: 15, train_loss: 0.8667, test_loss: 0.8772, test_f1: 0.5517
 epoch: 16, train_loss: 0.8500, test_loss: 0.8936, test_f1: 0.5485
 epoch: 17, train_loss: 0.8390, test_loss: 0.8882, test_f1: 0.5450
 epoch: 18, train_loss: 0.8414, test_loss: 0.8808, test_f1: 0.5399
 epoch: 19, train_loss: 0.8382, test_loss: 0.8810, test_f1: 0.5340
 epoch: 20, train_loss: 0.8228, test_loss: 0.8947, test_f1: 0.5430
 epoch: 21, train_loss: 0.8163, test_loss: 0.8685, test_f1: 0.5473
 epoch: 22, train_loss: 0.8145, test_loss: 0.8763, test_f1: 0.5431
 epoch: 23, train_loss: 0.8051, test_loss: 0.8582, test_f1: 0.5487
 epoch: 24, train_loss: 0.8010, test_loss: 0.8750, test_f1: 0.5486
 epoch: 25, train_loss: 0.7850, test_loss: 0.8519, test_f1: 0.5717
 epoch: 26, train_loss: 0.7801, test_loss: 0.8595, test_f1: 0.5568
 epoch: 27, train_loss: 0.7802, test_loss: 0.8497, test_f1: 0.5710
 epoch: 28, train_loss: 0.7687, test_loss: 0.8615, test_f1: 0.5532
 epoch: 29, train_loss: 0.7707, test_loss: 0.8591, test_f1: 0.5711
 epoch: 30, train_loss: 0.7738, test_loss: 0.8477, test_f1: 0.5702
 epoch: 31, train_loss: 0.7560, test_loss: 0.8429, test_f1: 0.5766
 epoch: 32, train_loss: 0.7609, test_loss: 0.8316, test_f1: 0.5690
 epoch: 33, train_loss: 0.7456, test_loss: 0.8342, test_f1: 0.5752
 epoch: 34, train_loss: 0.7412, test_loss: 0.8535, test_f1: 0.5776
 epoch: 35, train_loss: 0.7383, test_loss: 0.8105, test_f1: 0.5670
 epoch: 36, train_loss: 0.7257, test_loss: 0.8276, test_f1: 0.5922
 epoch: 37, train_loss: 0.7211, test_loss: 0.8367, test_f1: 0.5590
 epoch: 38, train_loss: 0.7238, test_loss: 0.8174, test_f1: 0.5846
 epoch: 39, train_loss: 0.7161, test_loss: 0.8500, test_f1: 0.5732
 epoch: 40, train_loss: 0.7125, test_loss: 0.8259, test_f1: 0.5923
 epoch: 41, train_loss: 0.7038, test_loss: 0.8237, test_f1: 0.5697
 epoch: 42, train_loss: 0.6926, test_loss: 0.8391, test_f1: 0.5619
 epoch: 43, train_loss: 0.6861, test_loss: 0.8123, test_f1: 0.5906
 epoch: 44, train_loss: 0.6896, test_loss: 0.8419, test_f1: 0.5729
 epoch: 45, train_loss: 0.6838, test_loss: 0.9046, test_f1: 0.5712
 epoch: 46, train_loss: 0.6785, test_loss: 0.8388, test_f1: 0.5805
 epoch: 47, train_loss: 0.6771, test_loss: 0.8234, test_f1: 0.5752
 epoch: 48, train_loss: 0.6744, test_loss: 0.8452, test_f1: 0.5952
 epoch: 49, train_loss: 0.6692, test_loss: 0.8253, test_f1: 0.5813
 epoch: 50, train_loss: 0.6663, test_loss: 0.8241, test_f1: 0.5772
 epoch: 51, train_loss: 0.6587, test_loss: 0.8211, test_f1: 0.5910
 epoch: 52, train_loss: 0.6546, test_loss: 0.8166, test_f1: 0.5777
 epoch: 53, train_loss: 0.6488, test_loss: 0.8315, test_f1: 0.5791
 epoch: 54, train_loss: 0.6470, test_loss: 0.8187, test_f1: 0.5830
 epoch: 55, train_loss: 0.6424, test_loss: 0.8257, test_f1: 0.5958
 epoch: 56, train_loss: 0.6463, test_loss: 0.8300, test_f1: 0.5966
 epoch: 57, train_loss: 0.6411, test_loss: 0.8381, test_f1: 0.5943
 epoch: 58, train_loss: 0.6313, test_loss: 0.8330, test_f1: 0.6011
 epoch: 59, train_loss: 0.6367, test_loss: 0.8361, test_f1: 0.5848
 epoch: 60, train_loss: 0.6412, test_loss: 0.8309, test_f1: 0.5861
 epoch: 61, train_loss: 0.6360, test_loss: 0.8337, test_f1: 0.5963
 epoch: 62, train_loss: 0.6259, test_loss: 0.8448, test_f1: 0.5897
 epoch: 63, train_loss: 0.6315, test_loss: 0.8384, test_f1: 0.6050
 epoch: 64, train_loss: 0.6215, test_loss: 0.8415, test_f1: 0.5884
 epoch: 65, train_loss: 0.6192, test_loss: 0.8411, test_f1: 0.6078
 epoch: 66, train_loss: 0.6173, test_loss: 0.8220, test_f1: 0.6012
 epoch: 67, train_loss: 0.6154, test_loss: 0.8284, test_f1: 0.6214
 epoch: 68, train_loss: 0.6241, test_loss: 0.8667, test_f1: 0.6248
 epoch: 69, train_loss: 0.6123, test_loss: 0.8597, test_f1: 0.6111
 epoch: 70, train_loss: 0.6023, test_loss: 0.8534, test_f1: 0.5864
 epoch: 71, train_loss: 0.5992, test_loss: 0.8500, test_f1: 0.6081
 epoch: 72, train_loss: 0.6109, test_loss: 0.8274, test_f1: 0.6179
 epoch: 73, train_loss: 0.6084, test_loss: 0.8508, test_f1: 0.6099
 epoch: 74, train_loss: 0.5963, test_loss: 0.8411, test_f1: 0.6235
 epoch: 75, train_loss: 0.6025, test_loss: 0.8522, test_f1: 0.6047
 epoch: 76, train_loss: 0.5992, test_loss: 0.8579, test_f1: 0.6109
 epoch: 77, train_loss: 0.5937, test_loss: 0.8524, test_f1: 0.6184
 epoch: 78, train_loss: 0.5887, test_loss: 0.8638, test_f1: 0.6028
 epoch: 79, train_loss: 0.5916, test_loss: 0.8719, test_f1: 0.6129
 epoch: 80, train_loss: 0.5892, test_loss: 0.8697, test_f1: 0.6235
 epoch: 81, train_loss: 0.5912, test_loss: 0.8644, test_f1: 0.6313
 epoch: 82, train_loss: 0.5813, test_loss: 0.8661, test_f1: 0.6410
 epoch: 83, train_loss: 0.5785, test_loss: 0.8715, test_f1: 0.6443
 epoch: 84, train_loss: 0.5902, test_loss: 0.8641, test_f1: 0.6139
 epoch: 85, train_loss: 0.5750, test_loss: 0.8904, test_f1: 0.6254
 epoch: 86, train_loss: 0.5739, test_loss: 0.8606, test_f1: 0.6393
 epoch: 87, train_loss: 0.5816, test_loss: 0.8707, test_f1: 0.6428
 epoch: 88, train_loss: 0.5719, test_loss: 0.8549, test_f1: 0.6310
 epoch: 89, train_loss: 0.5679, test_loss: 0.8782, test_f1: 0.6407
 epoch: 90, train_loss: 0.5670, test_loss: 0.8707, test_f1: 0.6343
 epoch: 91, train_loss: 0.5696, test_loss: 0.8913, test_f1: 0.6323
 epoch: 92, train_loss: 0.5635, test_loss: 0.8906, test_f1: 0.6372
 epoch: 93, train_loss: 0.5633, test_loss: 0.8565, test_f1: 0.6267
 epoch: 94, train_loss: 0.5710, test_loss: 0.8792, test_f1: 0.6394
 epoch: 95, train_loss: 0.5545, test_loss: 0.8874, test_f1: 0.6314
 epoch: 96, train_loss: 0.5591, test_loss: 0.8707, test_f1: 0.6454
 epoch: 97, train_loss: 0.5621, test_loss: 0.8704, test_f1: 0.6473
 epoch: 98, train_loss: 0.5490, test_loss: 0.8659, test_f1: 0.6502
 epoch: 99, train_loss: 0.5467, test_loss: 0.9093, test_f1: 0.6475
##################ITERATION #8 ****************************************
 epoch: 0, train_loss: 1.2486, test_loss: 1.2969, test_f1: 0.2270
 epoch: 1, train_loss: 1.0895, test_loss: 1.2658, test_f1: 0.2270
 epoch: 2, train_loss: 1.0399, test_loss: 1.2099, test_f1: 0.2270
 epoch: 3, train_loss: 1.0165, test_loss: 1.1404, test_f1: 0.3034
 epoch: 4, train_loss: 0.9913, test_loss: 1.0333, test_f1: 0.4404
 epoch: 5, train_loss: 0.9766, test_loss: 0.9782, test_f1: 0.4905
 epoch: 6, train_loss: 0.9564, test_loss: 0.9620, test_f1: 0.5231
 epoch: 7, train_loss: 0.9405, test_loss: 0.9539, test_f1: 0.5294
 epoch: 8, train_loss: 0.9413, test_loss: 0.9426, test_f1: 0.5124
 epoch: 9, train_loss: 0.9216, test_loss: 0.9422, test_f1: 0.5044
 epoch: 10, train_loss: 0.9038, test_loss: 0.9317, test_f1: 0.5263
 epoch: 11, train_loss: 0.9019, test_loss: 0.9279, test_f1: 0.5143
 epoch: 12, train_loss: 0.8986, test_loss: 0.9192, test_f1: 0.5251
 epoch: 13, train_loss: 0.8891, test_loss: 0.9074, test_f1: 0.5355
 epoch: 14, train_loss: 0.8711, test_loss: 0.9119, test_f1: 0.5353
 epoch: 15, train_loss: 0.8637, test_loss: 0.9012, test_f1: 0.5250
 epoch: 16, train_loss: 0.8564, test_loss: 0.8966, test_f1: 0.5278
 epoch: 17, train_loss: 0.8477, test_loss: 0.8872, test_f1: 0.5352
 epoch: 18, train_loss: 0.8464, test_loss: 0.8805, test_f1: 0.5488
 epoch: 19, train_loss: 0.8319, test_loss: 0.8833, test_f1: 0.5461
 epoch: 20, train_loss: 0.8253, test_loss: 0.8810, test_f1: 0.5362
 epoch: 21, train_loss: 0.8151, test_loss: 0.8780, test_f1: 0.5530
 epoch: 22, train_loss: 0.8132, test_loss: 0.8663, test_f1: 0.5479
 epoch: 23, train_loss: 0.8106, test_loss: 0.8558, test_f1: 0.5519
 epoch: 24, train_loss: 0.7957, test_loss: 0.8623, test_f1: 0.5537
 epoch: 25, train_loss: 0.7827, test_loss: 0.8521, test_f1: 0.5651
 epoch: 26, train_loss: 0.7710, test_loss: 0.8533, test_f1: 0.5659
 epoch: 27, train_loss: 0.7720, test_loss: 0.8569, test_f1: 0.5662
 epoch: 28, train_loss: 0.7688, test_loss: 0.8598, test_f1: 0.5382
 epoch: 29, train_loss: 0.7696, test_loss: 0.8647, test_f1: 0.5575
 epoch: 30, train_loss: 0.7584, test_loss: 0.8531, test_f1: 0.5530
 epoch: 31, train_loss: 0.7631, test_loss: 0.8604, test_f1: 0.5801
 epoch: 32, train_loss: 0.7429, test_loss: 0.8399, test_f1: 0.5743
 epoch: 33, train_loss: 0.7447, test_loss: 0.8243, test_f1: 0.5808
 epoch: 34, train_loss: 0.7382, test_loss: 0.8257, test_f1: 0.5752
 epoch: 35, train_loss: 0.7270, test_loss: 0.8228, test_f1: 0.5878
 epoch: 36, train_loss: 0.7280, test_loss: 0.8411, test_f1: 0.5559
 epoch: 37, train_loss: 0.7236, test_loss: 0.8333, test_f1: 0.5837
 epoch: 38, train_loss: 0.7221, test_loss: 0.8160, test_f1: 0.5836
 epoch: 39, train_loss: 0.7077, test_loss: 0.8201, test_f1: 0.5721
 epoch: 40, train_loss: 0.7015, test_loss: 0.8303, test_f1: 0.5653
 epoch: 41, train_loss: 0.6943, test_loss: 0.8185, test_f1: 0.5779
 epoch: 42, train_loss: 0.6960, test_loss: 0.8294, test_f1: 0.5696
 epoch: 43, train_loss: 0.6982, test_loss: 0.8060, test_f1: 0.5838
 epoch: 44, train_loss: 0.6784, test_loss: 0.8034, test_f1: 0.5987
 epoch: 45, train_loss: 0.6827, test_loss: 0.8116, test_f1: 0.5794
 epoch: 46, train_loss: 0.6732, test_loss: 0.7988, test_f1: 0.6000
 epoch: 47, train_loss: 0.6635, test_loss: 0.8110, test_f1: 0.5573
 epoch: 48, train_loss: 0.6636, test_loss: 0.8204, test_f1: 0.6112
 epoch: 49, train_loss: 0.6598, test_loss: 0.8405, test_f1: 0.5759
 epoch: 50, train_loss: 0.6648, test_loss: 0.8191, test_f1: 0.5880
 epoch: 51, train_loss: 0.6523, test_loss: 0.8107, test_f1: 0.5938
 epoch: 52, train_loss: 0.6532, test_loss: 0.8119, test_f1: 0.6009
 epoch: 53, train_loss: 0.6497, test_loss: 0.8071, test_f1: 0.5872
 epoch: 54, train_loss: 0.6506, test_loss: 0.8042, test_f1: 0.5945
 epoch: 55, train_loss: 0.6315, test_loss: 0.8120, test_f1: 0.5942
 epoch: 56, train_loss: 0.6433, test_loss: 0.8087, test_f1: 0.6015
 epoch: 57, train_loss: 0.6294, test_loss: 0.8142, test_f1: 0.5949
 epoch: 58, train_loss: 0.6378, test_loss: 0.8036, test_f1: 0.5889
 epoch: 59, train_loss: 0.6259, test_loss: 0.8054, test_f1: 0.5885
 epoch: 60, train_loss: 0.6287, test_loss: 0.8136, test_f1: 0.5967
 epoch: 61, train_loss: 0.6341, test_loss: 0.7921, test_f1: 0.6296
 epoch: 62, train_loss: 0.6306, test_loss: 0.7951, test_f1: 0.6294
 epoch: 63, train_loss: 0.6201, test_loss: 0.8337, test_f1: 0.5806
 epoch: 64, train_loss: 0.6150, test_loss: 0.8076, test_f1: 0.6242
 epoch: 65, train_loss: 0.6028, test_loss: 0.8029, test_f1: 0.6523
 epoch: 66, train_loss: 0.6216, test_loss: 0.7915, test_f1: 0.6574
 epoch: 67, train_loss: 0.6072, test_loss: 0.8150, test_f1: 0.6167
 epoch: 68, train_loss: 0.6105, test_loss: 0.8181, test_f1: 0.6214
 epoch: 69, train_loss: 0.5975, test_loss: 0.8063, test_f1: 0.6309
 epoch: 70, train_loss: 0.6123, test_loss: 0.8063, test_f1: 0.6133
 epoch: 71, train_loss: 0.6050, test_loss: 0.7999, test_f1: 0.6523
 epoch: 72, train_loss: 0.5940, test_loss: 0.8182, test_f1: 0.6391
 epoch: 73, train_loss: 0.5964, test_loss: 0.7914, test_f1: 0.6551
 epoch: 74, train_loss: 0.5816, test_loss: 0.8223, test_f1: 0.6334
 epoch: 75, train_loss: 0.5974, test_loss: 0.8154, test_f1: 0.6239
 epoch: 76, train_loss: 0.5834, test_loss: 0.8199, test_f1: 0.6324
 epoch: 77, train_loss: 0.5836, test_loss: 0.8113, test_f1: 0.6473
 epoch: 78, train_loss: 0.5805, test_loss: 0.8281, test_f1: 0.6337
 epoch: 79, train_loss: 0.5833, test_loss: 0.8353, test_f1: 0.6366
 epoch: 80, train_loss: 0.5804, test_loss: 0.8212, test_f1: 0.6280
 epoch: 81, train_loss: 0.5713, test_loss: 0.8383, test_f1: 0.6215
 epoch: 82, train_loss: 0.5702, test_loss: 0.8248, test_f1: 0.6356
 epoch: 83, train_loss: 0.5673, test_loss: 0.8614, test_f1: 0.6283
 epoch: 84, train_loss: 0.5856, test_loss: 0.8668, test_f1: 0.6272
 epoch: 85, train_loss: 0.5631, test_loss: 0.8390, test_f1: 0.6285
 epoch: 86, train_loss: 0.5751, test_loss: 0.8301, test_f1: 0.6458
 epoch: 87, train_loss: 0.5713, test_loss: 0.8369, test_f1: 0.6125
 epoch: 88, train_loss: 0.5693, test_loss: 0.8479, test_f1: 0.6250
 epoch: 89, train_loss: 0.5617, test_loss: 0.8764, test_f1: 0.6169
 epoch: 90, train_loss: 0.5562, test_loss: 0.8359, test_f1: 0.6246
 epoch: 91, train_loss: 0.5542, test_loss: 0.8553, test_f1: 0.6264
 epoch: 92, train_loss: 0.5656, test_loss: 0.8446, test_f1: 0.6382
 epoch: 93, train_loss: 0.5540, test_loss: 0.8324, test_f1: 0.6315
 epoch: 94, train_loss: 0.5586, test_loss: 0.8404, test_f1: 0.6216
 epoch: 95, train_loss: 0.5424, test_loss: 0.8414, test_f1: 0.6137
 epoch: 96, train_loss: 0.5474, test_loss: 0.8589, test_f1: 0.6216
 epoch: 97, train_loss: 0.5482, test_loss: 0.8607, test_f1: 0.6253
 epoch: 98, train_loss: 0.5432, test_loss: 0.8286, test_f1: 0.6346
 epoch: 99, train_loss: 0.5356, test_loss: 0.8611, test_f1: 0.6191
##################ITERATION #9 ****************************************
 epoch: 0, train_loss: 1.2640, test_loss: 1.2896, test_f1: 0.2270
 epoch: 1, train_loss: 1.0852, test_loss: 1.2432, test_f1: 0.2270
 epoch: 2, train_loss: 1.0580, test_loss: 1.1660, test_f1: 0.2945
 epoch: 3, train_loss: 1.0223, test_loss: 1.0540, test_f1: 0.4436
 epoch: 4, train_loss: 0.9863, test_loss: 0.9994, test_f1: 0.5103
 epoch: 5, train_loss: 0.9838, test_loss: 0.9578, test_f1: 0.5222
 epoch: 6, train_loss: 0.9696, test_loss: 0.9354, test_f1: 0.5338
 epoch: 7, train_loss: 0.9430, test_loss: 0.9120, test_f1: 0.5224
 epoch: 8, train_loss: 0.9332, test_loss: 0.9051, test_f1: 0.5352
 epoch: 9, train_loss: 0.9240, test_loss: 0.8948, test_f1: 0.5372
 epoch: 10, train_loss: 0.9089, test_loss: 0.8961, test_f1: 0.5246
 epoch: 11, train_loss: 0.9033, test_loss: 0.8889, test_f1: 0.5417
 epoch: 12, train_loss: 0.8993, test_loss: 0.8817, test_f1: 0.5309
 epoch: 13, train_loss: 0.8839, test_loss: 0.8807, test_f1: 0.5366
 epoch: 14, train_loss: 0.8694, test_loss: 0.8712, test_f1: 0.5392
 epoch: 15, train_loss: 0.8593, test_loss: 0.8599, test_f1: 0.5530
 epoch: 16, train_loss: 0.8542, test_loss: 0.8472, test_f1: 0.5489
 epoch: 17, train_loss: 0.8494, test_loss: 0.8475, test_f1: 0.5498
 epoch: 18, train_loss: 0.8367, test_loss: 0.8397, test_f1: 0.5657
 epoch: 19, train_loss: 0.8271, test_loss: 0.8528, test_f1: 0.5604
 epoch: 20, train_loss: 0.8273, test_loss: 0.8327, test_f1: 0.5597
 epoch: 21, train_loss: 0.8135, test_loss: 0.8359, test_f1: 0.5535
 epoch: 22, train_loss: 0.8108, test_loss: 0.8423, test_f1: 0.5410
 epoch: 23, train_loss: 0.8018, test_loss: 0.8320, test_f1: 0.5571
 epoch: 24, train_loss: 0.7981, test_loss: 0.8358, test_f1: 0.5518
 epoch: 25, train_loss: 0.7881, test_loss: 0.8152, test_f1: 0.5651
 epoch: 26, train_loss: 0.7753, test_loss: 0.8022, test_f1: 0.5699
 epoch: 27, train_loss: 0.7752, test_loss: 0.7947, test_f1: 0.5734
 epoch: 28, train_loss: 0.7718, test_loss: 0.8044, test_f1: 0.5832
 epoch: 29, train_loss: 0.7533, test_loss: 0.8197, test_f1: 0.5961
 epoch: 30, train_loss: 0.7622, test_loss: 0.8117, test_f1: 0.5818
 epoch: 31, train_loss: 0.7493, test_loss: 0.8091, test_f1: 0.5727
 epoch: 32, train_loss: 0.7557, test_loss: 0.8192, test_f1: 0.5836
 epoch: 33, train_loss: 0.7427, test_loss: 0.7979, test_f1: 0.5657
 epoch: 34, train_loss: 0.7264, test_loss: 0.8043, test_f1: 0.5950
 epoch: 35, train_loss: 0.7356, test_loss: 0.7941, test_f1: 0.5990
 epoch: 36, train_loss: 0.7271, test_loss: 0.7800, test_f1: 0.6074
 epoch: 37, train_loss: 0.7232, test_loss: 0.7842, test_f1: 0.5965
 epoch: 38, train_loss: 0.7110, test_loss: 0.8087, test_f1: 0.6163
 epoch: 39, train_loss: 0.7191, test_loss: 0.7974, test_f1: 0.5977
 epoch: 40, train_loss: 0.7124, test_loss: 0.8246, test_f1: 0.6168
 epoch: 41, train_loss: 0.7147, test_loss: 0.7825, test_f1: 0.6090
 epoch: 42, train_loss: 0.6937, test_loss: 0.7782, test_f1: 0.6065
 epoch: 43, train_loss: 0.6977, test_loss: 0.7991, test_f1: 0.6157
 epoch: 44, train_loss: 0.6871, test_loss: 0.7854, test_f1: 0.6127
 epoch: 45, train_loss: 0.6891, test_loss: 0.8109, test_f1: 0.6035
 epoch: 46, train_loss: 0.6772, test_loss: 0.8319, test_f1: 0.6042
 epoch: 47, train_loss: 0.6691, test_loss: 0.8010, test_f1: 0.6110
 epoch: 48, train_loss: 0.6710, test_loss: 0.8050, test_f1: 0.6258
 epoch: 49, train_loss: 0.6684, test_loss: 0.7844, test_f1: 0.6108
 epoch: 50, train_loss: 0.6585, test_loss: 0.8073, test_f1: 0.6150
 epoch: 51, train_loss: 0.6443, test_loss: 0.7906, test_f1: 0.6149
 epoch: 52, train_loss: 0.6494, test_loss: 0.7980, test_f1: 0.6189
 epoch: 53, train_loss: 0.6416, test_loss: 0.7994, test_f1: 0.6044
 epoch: 54, train_loss: 0.6342, test_loss: 0.7988, test_f1: 0.6190
 epoch: 55, train_loss: 0.6446, test_loss: 0.7754, test_f1: 0.6082
 epoch: 56, train_loss: 0.6289, test_loss: 0.7968, test_f1: 0.6248
 epoch: 57, train_loss: 0.6420, test_loss: 0.7884, test_f1: 0.6079
 epoch: 58, train_loss: 0.6329, test_loss: 0.8105, test_f1: 0.6268
 epoch: 59, train_loss: 0.6250, test_loss: 0.7963, test_f1: 0.6287
 epoch: 60, train_loss: 0.6266, test_loss: 0.8173, test_f1: 0.6139
 epoch: 61, train_loss: 0.6277, test_loss: 0.8242, test_f1: 0.6299
 epoch: 62, train_loss: 0.6288, test_loss: 0.8055, test_f1: 0.6179
 epoch: 63, train_loss: 0.6281, test_loss: 0.8095, test_f1: 0.6188
 epoch: 64, train_loss: 0.6157, test_loss: 0.8303, test_f1: 0.6261
 epoch: 65, train_loss: 0.6131, test_loss: 0.8011, test_f1: 0.6304
 epoch: 66, train_loss: 0.6068, test_loss: 0.7908, test_f1: 0.6382
 epoch: 67, train_loss: 0.6027, test_loss: 0.8059, test_f1: 0.6326
 epoch: 68, train_loss: 0.6016, test_loss: 0.7989, test_f1: 0.6405
 epoch: 69, train_loss: 0.6019, test_loss: 0.7848, test_f1: 0.6463
 epoch: 70, train_loss: 0.5980, test_loss: 0.8020, test_f1: 0.6445
 epoch: 71, train_loss: 0.5910, test_loss: 0.8282, test_f1: 0.6370
 epoch: 72, train_loss: 0.6063, test_loss: 0.8114, test_f1: 0.6372
 epoch: 73, train_loss: 0.6053, test_loss: 0.8192, test_f1: 0.6358
 epoch: 74, train_loss: 0.6072, test_loss: 0.8245, test_f1: 0.6423
 epoch: 75, train_loss: 0.5937, test_loss: 0.8215, test_f1: 0.6427
 epoch: 76, train_loss: 0.5844, test_loss: 0.8272, test_f1: 0.6492
 epoch: 77, train_loss: 0.5908, test_loss: 0.8163, test_f1: 0.6505
 epoch: 78, train_loss: 0.5915, test_loss: 0.8225, test_f1: 0.6438
 epoch: 79, train_loss: 0.5877, test_loss: 0.8586, test_f1: 0.6317
 epoch: 80, train_loss: 0.5863, test_loss: 0.8494, test_f1: 0.6392
 epoch: 81, train_loss: 0.5792, test_loss: 0.8420, test_f1: 0.6377
 epoch: 82, train_loss: 0.5860, test_loss: 0.8460, test_f1: 0.6427
 epoch: 83, train_loss: 0.5732, test_loss: 0.8675, test_f1: 0.6338
 epoch: 84, train_loss: 0.5855, test_loss: 0.8397, test_f1: 0.6192
 epoch: 85, train_loss: 0.5790, test_loss: 0.8489, test_f1: 0.6392
 epoch: 86, train_loss: 0.5694, test_loss: 0.8519, test_f1: 0.6171
 epoch: 87, train_loss: 0.5723, test_loss: 0.8497, test_f1: 0.6230
 epoch: 88, train_loss: 0.5772, test_loss: 0.8623, test_f1: 0.6534
 epoch: 89, train_loss: 0.5631, test_loss: 0.8402, test_f1: 0.6438
 epoch: 90, train_loss: 0.5559, test_loss: 0.8664, test_f1: 0.6427
 epoch: 91, train_loss: 0.5572, test_loss: 0.8500, test_f1: 0.6269
 epoch: 92, train_loss: 0.5670, test_loss: 0.8591, test_f1: 0.6399
 epoch: 93, train_loss: 0.5677, test_loss: 0.8667, test_f1: 0.6393
 epoch: 94, train_loss: 0.5565, test_loss: 0.8637, test_f1: 0.6353
 epoch: 95, train_loss: 0.5621, test_loss: 0.8584, test_f1: 0.6387
 epoch: 96, train_loss: 0.5555, test_loss: 0.8424, test_f1: 0.6470
 epoch: 97, train_loss: 0.5554, test_loss: 0.8842, test_f1: 0.6363
 epoch: 98, train_loss: 0.5529, test_loss: 0.8670, test_f1: 0.6363
 epoch: 99, train_loss: 0.5470, test_loss: 0.8709, test_f1: 0.6305

Training completed in 460.20 seconds
Best F1: 0.6644 at epoch 70
Mean F1 across iterations: 0.6368  0.0257
========================FINAL RESULTS================================
FEGIN weighted F1: 0.6644  0.0257
python main.py --data ltspice_examples --representation component_pin_net --model FEGIN --layers 3 --hiddens 128 --batch_size 256 --lr 0.0001 --emb_size 128 --epochs 100 --save_appendix component_pin_net_L3_H128_BS256_LR0.0001_E128 --no_val
-----



STDERR:
  File "main.py", line 370, in <module>
    main()
  File "main.py", line 254, in main
    dataset = dataset_class(
  File "/home/philip/projects/ltspice_examples_code_repo/Circuit-Completion-Using-GNNs/component_classification_with_link_prediction_head/evaluation/FEGIN/kernel/circuit_datasets.py", line 15, in __init__
    self.data, self.slices = torch.load(self.processed_paths[0])
  File "/home/philip/.local/lib/python3.8/site-packages/torch/serialization.py", line 1040, in load
    warnings.warn(
  File "/usr/lib/python3.8/warnings.py", line 109, in _showwarnmsg
    sw(msg.message, msg.category, msg.filename, msg.lineno,
  File "main.py", line 47, in warn_with_traceback
    traceback.print_stack(file=log)
/home/philip/projects/ltspice_examples_code_repo/Circuit-Completion-Using-GNNs/component_classification_with_link_prediction_head/evaluation/FEGIN/kernel/circuit_datasets.py:15: FutureWarning: You are using `torch.load` with `weights_only=False` (the current default value), which uses the default pickle module implicitly. It is possible to construct malicious pickle data which will execute arbitrary code during unpickling (See https://github.com/pytorch/pytorch/blob/main/SECURITY.md#untrusted-models for more details). In a future release, the default value for `weights_only` will be flipped to `True`. This limits the functions that could be executed during unpickling. Arbitrary objects will no longer be allowed to be loaded via this mode unless they are explicitly allowlisted by the user via `torch.serialization.add_safe_globals`. We recommend you start setting `weights_only=True` for any use case where you don't have full control of the loaded file. Please open an issue on GitHub for any issues related to this experimental feature.
  self.data, self.slices = torch.load(self.processed_paths[0])
