STDOUT:
Results will be saved in /home/philip/projects/ltspice_examples_code_repo/Circuit-Completion-Using-GNNs/component_classification_with_link_prediction_head/evaluation/FEGIN/results/model_FEGIN_dataset_ltspice_examples
Command line input: python main.py --data ltspice_examples --representation component_pin_net --model FEGIN --layers 2 --hiddens 64 --batch_size 256 --lr 0.01 --emb_size 128 --epochs 100 --save_appendix component_pin_net_L2_H64_BS256_LR0.01_E128 --no_val
 is saved.
-----
ltspice_examples - FEGIN
Using 2 layers, 64 hidden units, h = 2
Loading component_pin_net representation dataset
ENTERED
Training FEGIN on component_pin_net representation
Train: 3558, Test: 846
##################ITERATION #0 ****************************************
 epoch: 0, train_loss: 1.2063, test_loss: 1.4503, test_f1: 0.2270
 epoch: 1, train_loss: 1.0110, test_loss: 1.3619, test_f1: 0.2845
 epoch: 2, train_loss: 0.9791, test_loss: 1.2610, test_f1: 0.3565
 epoch: 3, train_loss: 0.9627, test_loss: 0.9965, test_f1: 0.4527
 epoch: 4, train_loss: 0.9369, test_loss: 0.9050, test_f1: 0.5308
 epoch: 5, train_loss: 0.9240, test_loss: 0.9249, test_f1: 0.4843
 epoch: 6, train_loss: 0.9049, test_loss: 0.9198, test_f1: 0.5044
 epoch: 7, train_loss: 0.8859, test_loss: 1.3145, test_f1: 0.4391
 epoch: 8, train_loss: 0.8706, test_loss: 1.0645, test_f1: 0.4630
 epoch: 9, train_loss: 0.8381, test_loss: 0.8459, test_f1: 0.5515
 epoch: 10, train_loss: 0.8328, test_loss: 0.8493, test_f1: 0.5723
 epoch: 11, train_loss: 0.8188, test_loss: 0.8658, test_f1: 0.5989
 epoch: 12, train_loss: 0.8004, test_loss: 1.1618, test_f1: 0.4830
 epoch: 13, train_loss: 0.7872, test_loss: 0.8267, test_f1: 0.5874
 epoch: 14, train_loss: 0.7681, test_loss: 1.0984, test_f1: 0.5652
 epoch: 15, train_loss: 0.7628, test_loss: 0.8762, test_f1: 0.5936
 epoch: 16, train_loss: 0.7436, test_loss: 0.8443, test_f1: 0.6176
 epoch: 17, train_loss: 0.7230, test_loss: 0.8077, test_f1: 0.6249
 epoch: 18, train_loss: 0.7165, test_loss: 1.0116, test_f1: 0.5664
 epoch: 19, train_loss: 0.6995, test_loss: 0.9793, test_f1: 0.5633
 epoch: 20, train_loss: 0.7205, test_loss: 0.8642, test_f1: 0.5984
 epoch: 21, train_loss: 0.7054, test_loss: 0.9386, test_f1: 0.5719
 epoch: 22, train_loss: 0.6922, test_loss: 1.0410, test_f1: 0.5701
 epoch: 23, train_loss: 0.6766, test_loss: 0.9241, test_f1: 0.5916
 epoch: 24, train_loss: 0.6595, test_loss: 0.8924, test_f1: 0.6080
 epoch: 25, train_loss: 0.6315, test_loss: 0.9585, test_f1: 0.5668
 epoch: 26, train_loss: 0.6532, test_loss: 0.8973, test_f1: 0.6692
 epoch: 27, train_loss: 0.6344, test_loss: 1.0084, test_f1: 0.6069
 epoch: 28, train_loss: 0.6405, test_loss: 0.9283, test_f1: 0.6356
 epoch: 29, train_loss: 0.6256, test_loss: 0.9286, test_f1: 0.6064
 epoch: 30, train_loss: 0.6190, test_loss: 0.8672, test_f1: 0.6365
 epoch: 31, train_loss: 0.5953, test_loss: 0.9041, test_f1: 0.6643
 epoch: 32, train_loss: 0.6029, test_loss: 1.0134, test_f1: 0.5868
 epoch: 33, train_loss: 0.5851, test_loss: 0.9159, test_f1: 0.6452
 epoch: 34, train_loss: 0.5672, test_loss: 1.0087, test_f1: 0.5909
 epoch: 35, train_loss: 0.6042, test_loss: 1.4405, test_f1: 0.5217
 epoch: 36, train_loss: 0.5977, test_loss: 0.9688, test_f1: 0.6451
 epoch: 37, train_loss: 0.5602, test_loss: 1.0453, test_f1: 0.5880
 epoch: 38, train_loss: 0.5435, test_loss: 0.9191, test_f1: 0.6585
 epoch: 39, train_loss: 0.5677, test_loss: 1.1897, test_f1: 0.5642
 epoch: 40, train_loss: 0.5632, test_loss: 0.8489, test_f1: 0.6725
 epoch: 41, train_loss: 0.5278, test_loss: 1.0995, test_f1: 0.6381
 epoch: 42, train_loss: 0.5344, test_loss: 1.1005, test_f1: 0.6075
 epoch: 43, train_loss: 0.5242, test_loss: 1.0923, test_f1: 0.6653
 epoch: 44, train_loss: 0.5182, test_loss: 1.0658, test_f1: 0.5532
 epoch: 45, train_loss: 0.5453, test_loss: 0.9377, test_f1: 0.6486
 epoch: 46, train_loss: 0.5043, test_loss: 0.8341, test_f1: 0.6732
 epoch: 47, train_loss: 0.5266, test_loss: 1.0679, test_f1: 0.6352
 epoch: 48, train_loss: 0.5171, test_loss: 0.9644, test_f1: 0.6649
 epoch: 49, train_loss: 0.4873, test_loss: 1.1210, test_f1: 0.6373
 epoch: 50, train_loss: 0.4831, test_loss: 1.2236, test_f1: 0.6412
 epoch: 51, train_loss: 0.4713, test_loss: 1.0769, test_f1: 0.6682
 epoch: 52, train_loss: 0.4392, test_loss: 1.0683, test_f1: 0.6430
 epoch: 53, train_loss: 0.4133, test_loss: 1.0459, test_f1: 0.6783
 epoch: 54, train_loss: 0.4127, test_loss: 1.2161, test_f1: 0.6779
 epoch: 55, train_loss: 0.3971, test_loss: 1.1352, test_f1: 0.6701
 epoch: 56, train_loss: 0.3988, test_loss: 1.0917, test_f1: 0.6758
 epoch: 57, train_loss: 0.4021, test_loss: 1.1251, test_f1: 0.6598
 epoch: 58, train_loss: 0.3740, test_loss: 1.1479, test_f1: 0.6656
 epoch: 59, train_loss: 0.3814, test_loss: 1.2852, test_f1: 0.6625
 epoch: 60, train_loss: 0.3738, test_loss: 1.1160, test_f1: 0.6551
 epoch: 61, train_loss: 0.3750, test_loss: 1.2420, test_f1: 0.6700
 epoch: 62, train_loss: 0.3765, test_loss: 1.1725, test_f1: 0.6845
 epoch: 63, train_loss: 0.3884, test_loss: 1.2776, test_f1: 0.6658
 epoch: 64, train_loss: 0.3894, test_loss: 1.3831, test_f1: 0.6506
 epoch: 65, train_loss: 0.3755, test_loss: 1.1713, test_f1: 0.6477
 epoch: 66, train_loss: 0.3741, test_loss: 1.2956, test_f1: 0.6523
 epoch: 67, train_loss: 0.3702, test_loss: 1.3685, test_f1: 0.6225
 epoch: 68, train_loss: 0.3595, test_loss: 1.2172, test_f1: 0.6749
 epoch: 69, train_loss: 0.3671, test_loss: 1.3267, test_f1: 0.6552
 epoch: 70, train_loss: 0.3661, test_loss: 1.3096, test_f1: 0.6590
 epoch: 71, train_loss: 0.3405, test_loss: 1.3426, test_f1: 0.6546
 epoch: 72, train_loss: 0.3426, test_loss: 1.1346, test_f1: 0.6526
 epoch: 73, train_loss: 0.3507, test_loss: 1.2579, test_f1: 0.6531
 epoch: 74, train_loss: 0.3507, test_loss: 1.4513, test_f1: 0.6357
 epoch: 75, train_loss: 0.3567, test_loss: 1.2279, test_f1: 0.6781
 epoch: 76, train_loss: 0.3256, test_loss: 1.3883, test_f1: 0.6448
 epoch: 77, train_loss: 0.3209, test_loss: 1.2795, test_f1: 0.6512
 epoch: 78, train_loss: 0.3344, test_loss: 1.3569, test_f1: 0.6563
 epoch: 79, train_loss: 0.3441, test_loss: 1.3241, test_f1: 0.6627
 epoch: 80, train_loss: 0.3335, test_loss: 1.2868, test_f1: 0.6491
 epoch: 81, train_loss: 0.3384, test_loss: 1.2958, test_f1: 0.6696
 epoch: 82, train_loss: 0.3129, test_loss: 1.3368, test_f1: 0.6325
 epoch: 83, train_loss: 0.3142, test_loss: 1.4403, test_f1: 0.6603
 epoch: 84, train_loss: 0.3252, test_loss: 1.4072, test_f1: 0.6426
 epoch: 85, train_loss: 0.3132, test_loss: 1.3609, test_f1: 0.6460
 epoch: 86, train_loss: 0.3006, test_loss: 1.3850, test_f1: 0.6592
 epoch: 87, train_loss: 0.2968, test_loss: 1.3188, test_f1: 0.6739
 epoch: 88, train_loss: 0.3135, test_loss: 1.4168, test_f1: 0.6467
 epoch: 89, train_loss: 0.3299, test_loss: 1.3776, test_f1: 0.6612
 epoch: 90, train_loss: 0.3152, test_loss: 1.2699, test_f1: 0.6598
 epoch: 91, train_loss: 0.2975, test_loss: 1.4921, test_f1: 0.6494
 epoch: 92, train_loss: 0.2987, test_loss: 1.1662, test_f1: 0.6692
 epoch: 93, train_loss: 0.3081, test_loss: 1.4575, test_f1: 0.6550
 epoch: 94, train_loss: 0.3130, test_loss: 1.2138, test_f1: 0.6742
 epoch: 95, train_loss: 0.2833, test_loss: 1.4430, test_f1: 0.6662
 epoch: 96, train_loss: 0.2994, test_loss: 1.2774, test_f1: 0.6598
 epoch: 97, train_loss: 0.3072, test_loss: 1.5095, test_f1: 0.6222
 epoch: 98, train_loss: 0.2920, test_loss: 1.3702, test_f1: 0.6607
 epoch: 99, train_loss: 0.3146, test_loss: 1.3373, test_f1: 0.6320
##################ITERATION #1 ****************************************
 epoch: 0, train_loss: 1.2258, test_loss: 1.4969, test_f1: 0.2270
 epoch: 1, train_loss: 1.0124, test_loss: 1.3805, test_f1: 0.2348
 epoch: 2, train_loss: 0.9729, test_loss: 1.0208, test_f1: 0.4444
 epoch: 3, train_loss: 0.9314, test_loss: 0.9288, test_f1: 0.4808
 epoch: 4, train_loss: 0.9180, test_loss: 0.8985, test_f1: 0.5053
 epoch: 5, train_loss: 0.8918, test_loss: 1.0906, test_f1: 0.4076
 epoch: 6, train_loss: 0.8516, test_loss: 0.8986, test_f1: 0.5397
 epoch: 7, train_loss: 0.8378, test_loss: 0.9404, test_f1: 0.5344
 epoch: 8, train_loss: 0.8041, test_loss: 0.9116, test_f1: 0.5248
 epoch: 9, train_loss: 0.8063, test_loss: 1.0018, test_f1: 0.5022
 epoch: 10, train_loss: 0.7972, test_loss: 0.9646, test_f1: 0.5572
 epoch: 11, train_loss: 0.7861, test_loss: 0.8263, test_f1: 0.5761
 epoch: 12, train_loss: 0.7664, test_loss: 1.0118, test_f1: 0.5120
 epoch: 13, train_loss: 0.7701, test_loss: 0.8924, test_f1: 0.5695
 epoch: 14, train_loss: 0.7469, test_loss: 0.9089, test_f1: 0.6030
 epoch: 15, train_loss: 0.7342, test_loss: 1.0838, test_f1: 0.5198
 epoch: 16, train_loss: 0.7413, test_loss: 0.9056, test_f1: 0.6028
 epoch: 17, train_loss: 0.7186, test_loss: 0.8753, test_f1: 0.6177
 epoch: 18, train_loss: 0.6866, test_loss: 0.9584, test_f1: 0.5585
 epoch: 19, train_loss: 0.6720, test_loss: 0.9899, test_f1: 0.5760
 epoch: 20, train_loss: 0.6521, test_loss: 0.8567, test_f1: 0.6505
 epoch: 21, train_loss: 0.6511, test_loss: 0.9384, test_f1: 0.6042
 epoch: 22, train_loss: 0.6497, test_loss: 0.9991, test_f1: 0.5905
 epoch: 23, train_loss: 0.6545, test_loss: 0.8617, test_f1: 0.6229
 epoch: 24, train_loss: 0.6375, test_loss: 0.8274, test_f1: 0.6451
 epoch: 25, train_loss: 0.6361, test_loss: 0.9293, test_f1: 0.5988
 epoch: 26, train_loss: 0.6266, test_loss: 2.5032, test_f1: 0.3787
 epoch: 27, train_loss: 0.6222, test_loss: 0.8253, test_f1: 0.6340
 epoch: 28, train_loss: 0.5966, test_loss: 1.0920, test_f1: 0.6293
 epoch: 29, train_loss: 0.5888, test_loss: 0.8178, test_f1: 0.6801
 epoch: 30, train_loss: 0.6110, test_loss: 0.8443, test_f1: 0.6046
 epoch: 31, train_loss: 0.5644, test_loss: 0.8168, test_f1: 0.6320
 epoch: 32, train_loss: 0.5787, test_loss: 1.0313, test_f1: 0.5729
 epoch: 33, train_loss: 0.5822, test_loss: 0.8994, test_f1: 0.5965
 epoch: 34, train_loss: 0.5852, test_loss: 0.8862, test_f1: 0.6333
 epoch: 35, train_loss: 0.5567, test_loss: 0.8728, test_f1: 0.6606
 epoch: 36, train_loss: 0.5649, test_loss: 0.8739, test_f1: 0.6463
 epoch: 37, train_loss: 0.5746, test_loss: 0.9471, test_f1: 0.6142
 epoch: 38, train_loss: 0.5362, test_loss: 0.8494, test_f1: 0.6343
 epoch: 39, train_loss: 0.5316, test_loss: 1.0651, test_f1: 0.5906
 epoch: 40, train_loss: 0.5187, test_loss: 0.9144, test_f1: 0.5945
 epoch: 41, train_loss: 0.5251, test_loss: 0.8741, test_f1: 0.6100
 epoch: 42, train_loss: 0.5212, test_loss: 0.9635, test_f1: 0.6241
 epoch: 43, train_loss: 0.5068, test_loss: 1.0322, test_f1: 0.6270
 epoch: 44, train_loss: 0.4895, test_loss: 0.8464, test_f1: 0.6593
 epoch: 45, train_loss: 0.4682, test_loss: 0.9935, test_f1: 0.6526
 epoch: 46, train_loss: 0.4961, test_loss: 1.1758, test_f1: 0.5988
 epoch: 47, train_loss: 0.4965, test_loss: 1.0332, test_f1: 0.6281
 epoch: 48, train_loss: 0.4849, test_loss: 1.0462, test_f1: 0.6514
 epoch: 49, train_loss: 0.4773, test_loss: 0.9736, test_f1: 0.6710
 epoch: 50, train_loss: 0.4628, test_loss: 1.0364, test_f1: 0.6629
 epoch: 51, train_loss: 0.4288, test_loss: 0.9255, test_f1: 0.6724
 epoch: 52, train_loss: 0.3960, test_loss: 0.9637, test_f1: 0.6659
 epoch: 53, train_loss: 0.4074, test_loss: 0.9382, test_f1: 0.6750
 epoch: 54, train_loss: 0.3914, test_loss: 1.0726, test_f1: 0.6639
 epoch: 55, train_loss: 0.3928, test_loss: 0.9375, test_f1: 0.6806
 epoch: 56, train_loss: 0.3639, test_loss: 1.0250, test_f1: 0.6656
 epoch: 57, train_loss: 0.3775, test_loss: 1.0419, test_f1: 0.6695
 epoch: 58, train_loss: 0.3632, test_loss: 1.0611, test_f1: 0.6649
 epoch: 59, train_loss: 0.3646, test_loss: 1.1801, test_f1: 0.6297
 epoch: 60, train_loss: 0.3648, test_loss: 1.0992, test_f1: 0.6592
 epoch: 61, train_loss: 0.3660, test_loss: 1.0972, test_f1: 0.6684
 epoch: 62, train_loss: 0.3485, test_loss: 1.0993, test_f1: 0.6566
 epoch: 63, train_loss: 0.3366, test_loss: 1.0433, test_f1: 0.6879
 epoch: 64, train_loss: 0.3446, test_loss: 1.1199, test_f1: 0.6632
 epoch: 65, train_loss: 0.3376, test_loss: 1.2278, test_f1: 0.6750
 epoch: 66, train_loss: 0.3374, test_loss: 1.1305, test_f1: 0.6595
 epoch: 67, train_loss: 0.3588, test_loss: 1.3076, test_f1: 0.6192
 epoch: 68, train_loss: 0.3256, test_loss: 1.2059, test_f1: 0.6686
 epoch: 69, train_loss: 0.3567, test_loss: 1.2376, test_f1: 0.6545
 epoch: 70, train_loss: 0.3477, test_loss: 1.2697, test_f1: 0.6777
 epoch: 71, train_loss: 0.3493, test_loss: 1.3032, test_f1: 0.6625
 epoch: 72, train_loss: 0.3477, test_loss: 1.1936, test_f1: 0.6486
 epoch: 73, train_loss: 0.3279, test_loss: 1.3317, test_f1: 0.6628
 epoch: 74, train_loss: 0.3231, test_loss: 1.2523, test_f1: 0.6393
 epoch: 75, train_loss: 0.3306, test_loss: 1.2336, test_f1: 0.6572
 epoch: 76, train_loss: 0.3238, test_loss: 1.3030, test_f1: 0.6254
 epoch: 77, train_loss: 0.3030, test_loss: 1.1904, test_f1: 0.6564
 epoch: 78, train_loss: 0.3055, test_loss: 1.2867, test_f1: 0.6507
 epoch: 79, train_loss: 0.3158, test_loss: 1.1997, test_f1: 0.6464
 epoch: 80, train_loss: 0.3012, test_loss: 1.1752, test_f1: 0.6725
 epoch: 81, train_loss: 0.3085, test_loss: 1.2521, test_f1: 0.6511
 epoch: 82, train_loss: 0.3192, test_loss: 1.3322, test_f1: 0.6537
 epoch: 83, train_loss: 0.3179, test_loss: 1.2716, test_f1: 0.6572
 epoch: 84, train_loss: 0.2946, test_loss: 1.2715, test_f1: 0.6507
 epoch: 85, train_loss: 0.3168, test_loss: 1.3488, test_f1: 0.6407
 epoch: 86, train_loss: 0.2955, test_loss: 1.3730, test_f1: 0.6177
 epoch: 87, train_loss: 0.2985, test_loss: 1.3254, test_f1: 0.6206
 epoch: 88, train_loss: 0.3001, test_loss: 1.2981, test_f1: 0.6404
 epoch: 89, train_loss: 0.2998, test_loss: 1.2904, test_f1: 0.6691
 epoch: 90, train_loss: 0.3253, test_loss: 1.1787, test_f1: 0.6716
 epoch: 91, train_loss: 0.3102, test_loss: 1.3259, test_f1: 0.6537
 epoch: 92, train_loss: 0.2780, test_loss: 1.2959, test_f1: 0.6371
 epoch: 93, train_loss: 0.2797, test_loss: 1.2774, test_f1: 0.6417
 epoch: 94, train_loss: 0.2690, test_loss: 1.3656, test_f1: 0.6625
 epoch: 95, train_loss: 0.2857, test_loss: 1.4751, test_f1: 0.6579
 epoch: 96, train_loss: 0.2699, test_loss: 1.3962, test_f1: 0.6554
 epoch: 97, train_loss: 0.2759, test_loss: 1.4962, test_f1: 0.6747
 epoch: 98, train_loss: 0.2676, test_loss: 1.3934, test_f1: 0.6571
 epoch: 99, train_loss: 0.2834, test_loss: 1.3001, test_f1: 0.6815
##################ITERATION #2 ****************************************
 epoch: 0, train_loss: 1.2937, test_loss: 1.5984, test_f1: 0.2270
 epoch: 1, train_loss: 1.0135, test_loss: 1.1390, test_f1: 0.3758
 epoch: 2, train_loss: 0.9660, test_loss: 1.0284, test_f1: 0.3606
 epoch: 3, train_loss: 0.9368, test_loss: 0.9681, test_f1: 0.4145
 epoch: 4, train_loss: 0.9125, test_loss: 0.9147, test_f1: 0.5307
 epoch: 5, train_loss: 0.8983, test_loss: 0.9094, test_f1: 0.5059
 epoch: 6, train_loss: 0.8851, test_loss: 0.9415, test_f1: 0.5254
 epoch: 7, train_loss: 0.8648, test_loss: 0.9154, test_f1: 0.5025
 epoch: 8, train_loss: 0.8431, test_loss: 1.0754, test_f1: 0.4991
 epoch: 9, train_loss: 0.8401, test_loss: 0.9987, test_f1: 0.5451
 epoch: 10, train_loss: 0.8236, test_loss: 0.9291, test_f1: 0.5728
 epoch: 11, train_loss: 0.8110, test_loss: 0.9857, test_f1: 0.5358
 epoch: 12, train_loss: 0.7929, test_loss: 0.9139, test_f1: 0.5590
 epoch: 13, train_loss: 0.7777, test_loss: 1.1533, test_f1: 0.5205
 epoch: 14, train_loss: 0.7575, test_loss: 0.9821, test_f1: 0.6087
 epoch: 15, train_loss: 0.7633, test_loss: 1.0048, test_f1: 0.5394
 epoch: 16, train_loss: 0.7567, test_loss: 1.6528, test_f1: 0.4633
 epoch: 17, train_loss: 0.7631, test_loss: 0.8441, test_f1: 0.6050
 epoch: 18, train_loss: 0.7369, test_loss: 1.1477, test_f1: 0.5243
 epoch: 19, train_loss: 0.7120, test_loss: 1.0229, test_f1: 0.5778
 epoch: 20, train_loss: 0.7145, test_loss: 1.0066, test_f1: 0.5704
 epoch: 21, train_loss: 0.7126, test_loss: 0.9143, test_f1: 0.5813
 epoch: 22, train_loss: 0.6755, test_loss: 0.9451, test_f1: 0.6097
 epoch: 23, train_loss: 0.6766, test_loss: 0.9906, test_f1: 0.6327
 epoch: 24, train_loss: 0.6582, test_loss: 1.0283, test_f1: 0.6355
 epoch: 25, train_loss: 0.6582, test_loss: 0.9198, test_f1: 0.6376
 epoch: 26, train_loss: 0.6561, test_loss: 0.8219, test_f1: 0.6279
 epoch: 27, train_loss: 0.6505, test_loss: 1.0787, test_f1: 0.5702
 epoch: 28, train_loss: 0.6319, test_loss: 0.9725, test_f1: 0.6098
 epoch: 29, train_loss: 0.6511, test_loss: 0.9550, test_f1: 0.6277
 epoch: 30, train_loss: 0.6305, test_loss: 0.9756, test_f1: 0.6236
 epoch: 31, train_loss: 0.6135, test_loss: 1.1027, test_f1: 0.5907
 epoch: 32, train_loss: 0.6289, test_loss: 0.9728, test_f1: 0.6114
 epoch: 33, train_loss: 0.6353, test_loss: 1.0360, test_f1: 0.6107
 epoch: 34, train_loss: 0.5923, test_loss: 0.9744, test_f1: 0.6437
 epoch: 35, train_loss: 0.5973, test_loss: 1.0260, test_f1: 0.6471
 epoch: 36, train_loss: 0.5900, test_loss: 1.1195, test_f1: 0.5860
 epoch: 37, train_loss: 0.5686, test_loss: 1.0203, test_f1: 0.6254
 epoch: 38, train_loss: 0.5608, test_loss: 1.0754, test_f1: 0.6273
 epoch: 39, train_loss: 0.5529, test_loss: 1.0861, test_f1: 0.6453
 epoch: 40, train_loss: 0.5625, test_loss: 1.2012, test_f1: 0.6294
 epoch: 41, train_loss: 0.5560, test_loss: 1.2080, test_f1: 0.5765
 epoch: 42, train_loss: 0.5554, test_loss: 0.9797, test_f1: 0.6238
 epoch: 43, train_loss: 0.5614, test_loss: 1.0100, test_f1: 0.6539
 epoch: 44, train_loss: 0.5681, test_loss: 1.3669, test_f1: 0.5624
 epoch: 45, train_loss: 0.5326, test_loss: 1.2009, test_f1: 0.6390
 epoch: 46, train_loss: 0.5404, test_loss: 1.3158, test_f1: 0.6185
 epoch: 47, train_loss: 0.5226, test_loss: 1.3359, test_f1: 0.5883
 epoch: 48, train_loss: 0.5111, test_loss: 1.1294, test_f1: 0.6653
 epoch: 49, train_loss: 0.5138, test_loss: 1.1973, test_f1: 0.6223
 epoch: 50, train_loss: 0.5400, test_loss: 1.1041, test_f1: 0.6506
 epoch: 51, train_loss: 0.5000, test_loss: 1.0434, test_f1: 0.6750
 epoch: 52, train_loss: 0.4710, test_loss: 1.2923, test_f1: 0.6342
 epoch: 53, train_loss: 0.4673, test_loss: 1.2002, test_f1: 0.6558
 epoch: 54, train_loss: 0.4597, test_loss: 1.1663, test_f1: 0.6462
 epoch: 55, train_loss: 0.4239, test_loss: 1.3148, test_f1: 0.6106
 epoch: 56, train_loss: 0.4340, test_loss: 1.2811, test_f1: 0.6533
 epoch: 57, train_loss: 0.4275, test_loss: 1.1973, test_f1: 0.6494
 epoch: 58, train_loss: 0.4119, test_loss: 1.2664, test_f1: 0.6682
 epoch: 59, train_loss: 0.4031, test_loss: 1.2507, test_f1: 0.6434
 epoch: 60, train_loss: 0.4127, test_loss: 1.1896, test_f1: 0.6552
 epoch: 61, train_loss: 0.4102, test_loss: 1.2694, test_f1: 0.6322
 epoch: 62, train_loss: 0.4192, test_loss: 1.2130, test_f1: 0.6670
 epoch: 63, train_loss: 0.4057, test_loss: 1.3447, test_f1: 0.6750
 epoch: 64, train_loss: 0.3970, test_loss: 1.3257, test_f1: 0.6168
 epoch: 65, train_loss: 0.4040, test_loss: 1.2550, test_f1: 0.6589
 epoch: 66, train_loss: 0.4057, test_loss: 1.3493, test_f1: 0.6570
 epoch: 67, train_loss: 0.4001, test_loss: 1.2530, test_f1: 0.6401
 epoch: 68, train_loss: 0.3847, test_loss: 1.2541, test_f1: 0.6540
 epoch: 69, train_loss: 0.3942, test_loss: 1.3722, test_f1: 0.6348
 epoch: 70, train_loss: 0.3860, test_loss: 1.4750, test_f1: 0.6535
 epoch: 71, train_loss: 0.3931, test_loss: 1.4176, test_f1: 0.6455
 epoch: 72, train_loss: 0.3787, test_loss: 1.5005, test_f1: 0.6231
 epoch: 73, train_loss: 0.4028, test_loss: 1.5762, test_f1: 0.6280
 epoch: 74, train_loss: 0.3959, test_loss: 1.3710, test_f1: 0.6425
 epoch: 75, train_loss: 0.3672, test_loss: 1.3314, test_f1: 0.6360
 epoch: 76, train_loss: 0.3689, test_loss: 1.4098, test_f1: 0.6439
 epoch: 77, train_loss: 0.3834, test_loss: 1.5024, test_f1: 0.6421
 epoch: 78, train_loss: 0.3776, test_loss: 1.3740, test_f1: 0.6198
 epoch: 79, train_loss: 0.3681, test_loss: 1.4329, test_f1: 0.6619
 epoch: 80, train_loss: 0.3749, test_loss: 1.3698, test_f1: 0.6280
 epoch: 81, train_loss: 0.3700, test_loss: 1.4088, test_f1: 0.6482
 epoch: 82, train_loss: 0.3743, test_loss: 1.4863, test_f1: 0.6558
 epoch: 83, train_loss: 0.3407, test_loss: 1.3467, test_f1: 0.6315
 epoch: 84, train_loss: 0.3292, test_loss: 1.5193, test_f1: 0.6242
 epoch: 85, train_loss: 0.3753, test_loss: 1.3907, test_f1: 0.6513
 epoch: 86, train_loss: 0.3765, test_loss: 1.2821, test_f1: 0.6401
 epoch: 87, train_loss: 0.3689, test_loss: 1.5061, test_f1: 0.6197
 epoch: 88, train_loss: 0.3402, test_loss: 1.4561, test_f1: 0.6717
 epoch: 89, train_loss: 0.3335, test_loss: 1.5265, test_f1: 0.6542
 epoch: 90, train_loss: 0.3246, test_loss: 1.5210, test_f1: 0.6195
 epoch: 91, train_loss: 0.3391, test_loss: 1.4873, test_f1: 0.6579
 epoch: 92, train_loss: 0.3439, test_loss: 1.5115, test_f1: 0.6424
 epoch: 93, train_loss: 0.3244, test_loss: 1.5227, test_f1: 0.6394
 epoch: 94, train_loss: 0.3187, test_loss: 1.5506, test_f1: 0.6571
 epoch: 95, train_loss: 0.3171, test_loss: 1.4623, test_f1: 0.6519
 epoch: 96, train_loss: 0.3184, test_loss: 1.6543, test_f1: 0.6193
 epoch: 97, train_loss: 0.3255, test_loss: 1.4528, test_f1: 0.6649
 epoch: 98, train_loss: 0.3218, test_loss: 1.7509, test_f1: 0.6214
 epoch: 99, train_loss: 0.3379, test_loss: 1.5333, test_f1: 0.6471
##################ITERATION #3 ****************************************
 epoch: 0, train_loss: 1.4845, test_loss: 1.5093, test_f1: 0.2270
 epoch: 1, train_loss: 1.0176, test_loss: 1.1931, test_f1: 0.3568
 epoch: 2, train_loss: 0.9711, test_loss: 1.0131, test_f1: 0.3749
 epoch: 3, train_loss: 0.9498, test_loss: 0.9478, test_f1: 0.5257
 epoch: 4, train_loss: 0.9244, test_loss: 1.1636, test_f1: 0.4811
 epoch: 5, train_loss: 0.9072, test_loss: 0.9245, test_f1: 0.5500
 epoch: 6, train_loss: 0.8957, test_loss: 1.0439, test_f1: 0.4722
 epoch: 7, train_loss: 0.8866, test_loss: 0.9383, test_f1: 0.5040
 epoch: 8, train_loss: 0.8463, test_loss: 0.9304, test_f1: 0.5429
 epoch: 9, train_loss: 0.8413, test_loss: 0.9462, test_f1: 0.5569
 epoch: 10, train_loss: 0.8256, test_loss: 0.9288, test_f1: 0.5689
 epoch: 11, train_loss: 0.8137, test_loss: 1.2035, test_f1: 0.4857
 epoch: 12, train_loss: 0.8023, test_loss: 0.8273, test_f1: 0.6094
 epoch: 13, train_loss: 0.7952, test_loss: 0.8626, test_f1: 0.5907
 epoch: 14, train_loss: 0.7802, test_loss: 0.7808, test_f1: 0.6316
 epoch: 15, train_loss: 0.7713, test_loss: 0.9187, test_f1: 0.5389
 epoch: 16, train_loss: 0.7611, test_loss: 1.1743, test_f1: 0.5344
 epoch: 17, train_loss: 0.7452, test_loss: 0.8079, test_f1: 0.6152
 epoch: 18, train_loss: 0.7286, test_loss: 0.9498, test_f1: 0.5680
 epoch: 19, train_loss: 0.7073, test_loss: 0.8436, test_f1: 0.6342
 epoch: 20, train_loss: 0.7220, test_loss: 1.0182, test_f1: 0.5847
 epoch: 21, train_loss: 0.7173, test_loss: 0.7384, test_f1: 0.6522
 epoch: 22, train_loss: 0.6969, test_loss: 0.9971, test_f1: 0.5965
 epoch: 23, train_loss: 0.6807, test_loss: 0.9163, test_f1: 0.5721
 epoch: 24, train_loss: 0.6726, test_loss: 0.8312, test_f1: 0.6299
 epoch: 25, train_loss: 0.6651, test_loss: 0.9308, test_f1: 0.6402
 epoch: 26, train_loss: 0.6537, test_loss: 0.9253, test_f1: 0.6343
 epoch: 27, train_loss: 0.6454, test_loss: 1.0062, test_f1: 0.6212
 epoch: 28, train_loss: 0.6385, test_loss: 1.0779, test_f1: 0.5859
 epoch: 29, train_loss: 0.6571, test_loss: 0.8378, test_f1: 0.6127
 epoch: 30, train_loss: 0.6329, test_loss: 0.9297, test_f1: 0.6275
 epoch: 31, train_loss: 0.6237, test_loss: 1.0416, test_f1: 0.5911
 epoch: 32, train_loss: 0.6160, test_loss: 1.0769, test_f1: 0.5949
 epoch: 33, train_loss: 0.6024, test_loss: 0.8674, test_f1: 0.6269
 epoch: 34, train_loss: 0.5839, test_loss: 1.2776, test_f1: 0.5826
 epoch: 35, train_loss: 0.5697, test_loss: 0.8974, test_f1: 0.6445
 epoch: 36, train_loss: 0.5876, test_loss: 0.8089, test_f1: 0.6613
 epoch: 37, train_loss: 0.5756, test_loss: 1.0239, test_f1: 0.6685
 epoch: 38, train_loss: 0.5594, test_loss: 0.8441, test_f1: 0.6641
 epoch: 39, train_loss: 0.5707, test_loss: 1.0014, test_f1: 0.6164
 epoch: 40, train_loss: 0.5488, test_loss: 1.1839, test_f1: 0.5699
 epoch: 41, train_loss: 0.5493, test_loss: 0.8980, test_f1: 0.6571
 epoch: 42, train_loss: 0.5547, test_loss: 1.0248, test_f1: 0.6120
 epoch: 43, train_loss: 0.5495, test_loss: 0.9010, test_f1: 0.6629
 epoch: 44, train_loss: 0.5268, test_loss: 1.2272, test_f1: 0.5744
 epoch: 45, train_loss: 0.5193, test_loss: 1.2889, test_f1: 0.5965
 epoch: 46, train_loss: 0.5117, test_loss: 0.9870, test_f1: 0.6299
 epoch: 47, train_loss: 0.5150, test_loss: 0.9670, test_f1: 0.6456
 epoch: 48, train_loss: 0.5136, test_loss: 0.9358, test_f1: 0.6434
 epoch: 49, train_loss: 0.4940, test_loss: 1.1521, test_f1: 0.6260
 epoch: 50, train_loss: 0.4879, test_loss: 0.8285, test_f1: 0.6938
 epoch: 51, train_loss: 0.4653, test_loss: 0.9460, test_f1: 0.6806
 epoch: 52, train_loss: 0.4467, test_loss: 0.8954, test_f1: 0.6836
 epoch: 53, train_loss: 0.4171, test_loss: 0.9466, test_f1: 0.6726
 epoch: 54, train_loss: 0.4041, test_loss: 0.9392, test_f1: 0.7010
 epoch: 55, train_loss: 0.4008, test_loss: 0.9204, test_f1: 0.6939
 epoch: 56, train_loss: 0.3921, test_loss: 1.0038, test_f1: 0.6774
 epoch: 57, train_loss: 0.3939, test_loss: 0.9867, test_f1: 0.6813
 epoch: 58, train_loss: 0.3972, test_loss: 1.0340, test_f1: 0.6511
 epoch: 59, train_loss: 0.4095, test_loss: 1.0548, test_f1: 0.6627
 epoch: 60, train_loss: 0.3950, test_loss: 0.9642, test_f1: 0.6940
 epoch: 61, train_loss: 0.3746, test_loss: 1.0341, test_f1: 0.6759
 epoch: 62, train_loss: 0.3824, test_loss: 0.9300, test_f1: 0.7017
 epoch: 63, train_loss: 0.3948, test_loss: 1.0645, test_f1: 0.6668
 epoch: 64, train_loss: 0.3786, test_loss: 1.2528, test_f1: 0.6424
 epoch: 65, train_loss: 0.3466, test_loss: 1.2209, test_f1: 0.6629
 epoch: 66, train_loss: 0.3747, test_loss: 1.1120, test_f1: 0.6780
 epoch: 67, train_loss: 0.3710, test_loss: 1.0545, test_f1: 0.6626
 epoch: 68, train_loss: 0.3689, test_loss: 1.0740, test_f1: 0.6888
 epoch: 69, train_loss: 0.3661, test_loss: 1.2510, test_f1: 0.6511
 epoch: 70, train_loss: 0.3657, test_loss: 1.0306, test_f1: 0.6800
 epoch: 71, train_loss: 0.3464, test_loss: 1.1714, test_f1: 0.6868
 epoch: 72, train_loss: 0.3577, test_loss: 1.0499, test_f1: 0.6804
 epoch: 73, train_loss: 0.3480, test_loss: 1.0942, test_f1: 0.6761
 epoch: 74, train_loss: 0.3550, test_loss: 1.2069, test_f1: 0.6613
 epoch: 75, train_loss: 0.3693, test_loss: 1.1147, test_f1: 0.6598
 epoch: 76, train_loss: 0.3596, test_loss: 1.1063, test_f1: 0.6664
 epoch: 77, train_loss: 0.3564, test_loss: 1.1353, test_f1: 0.6584
 epoch: 78, train_loss: 0.3462, test_loss: 1.0664, test_f1: 0.6819
 epoch: 79, train_loss: 0.3172, test_loss: 1.1263, test_f1: 0.6780
 epoch: 80, train_loss: 0.3368, test_loss: 1.1200, test_f1: 0.6629
 epoch: 81, train_loss: 0.3345, test_loss: 1.1362, test_f1: 0.6704
 epoch: 82, train_loss: 0.3525, test_loss: 1.0445, test_f1: 0.6846
 epoch: 83, train_loss: 0.3325, test_loss: 1.0955, test_f1: 0.6811
 epoch: 84, train_loss: 0.3192, test_loss: 1.0488, test_f1: 0.7026
 epoch: 85, train_loss: 0.3036, test_loss: 1.2142, test_f1: 0.6641
 epoch: 86, train_loss: 0.3159, test_loss: 1.3594, test_f1: 0.6216
 epoch: 87, train_loss: 0.3334, test_loss: 1.0360, test_f1: 0.6866
 epoch: 88, train_loss: 0.3285, test_loss: 1.2114, test_f1: 0.6768
 epoch: 89, train_loss: 0.3203, test_loss: 1.3144, test_f1: 0.6487
 epoch: 90, train_loss: 0.3125, test_loss: 1.1293, test_f1: 0.6723
 epoch: 91, train_loss: 0.3181, test_loss: 1.2196, test_f1: 0.6749
 epoch: 92, train_loss: 0.3069, test_loss: 1.2335, test_f1: 0.6751
 epoch: 93, train_loss: 0.3252, test_loss: 1.0226, test_f1: 0.6731
 epoch: 94, train_loss: 0.3401, test_loss: 1.1467, test_f1: 0.6636
 epoch: 95, train_loss: 0.3370, test_loss: 1.0974, test_f1: 0.6876
 epoch: 96, train_loss: 0.3260, test_loss: 1.2058, test_f1: 0.6585
 epoch: 97, train_loss: 0.3095, test_loss: 1.2056, test_f1: 0.6740
 epoch: 98, train_loss: 0.3007, test_loss: 1.1244, test_f1: 0.6764
 epoch: 99, train_loss: 0.2924, test_loss: 1.2784, test_f1: 0.6661
##################ITERATION #4 ****************************************
 epoch: 0, train_loss: 1.3129, test_loss: 1.7214, test_f1: 0.2392
 epoch: 1, train_loss: 1.0134, test_loss: 1.2973, test_f1: 0.3014
 epoch: 2, train_loss: 0.9828, test_loss: 1.0008, test_f1: 0.4257
 epoch: 3, train_loss: 0.9600, test_loss: 0.9797, test_f1: 0.4707
 epoch: 4, train_loss: 0.9384, test_loss: 0.9198, test_f1: 0.5097
 epoch: 5, train_loss: 0.9123, test_loss: 1.1427, test_f1: 0.4864
 epoch: 6, train_loss: 0.8941, test_loss: 0.9970, test_f1: 0.4861
 epoch: 7, train_loss: 0.8833, test_loss: 0.9587, test_f1: 0.5274
 epoch: 8, train_loss: 0.8824, test_loss: 0.9451, test_f1: 0.5182
 epoch: 9, train_loss: 0.8638, test_loss: 0.9129, test_f1: 0.5505
 epoch: 10, train_loss: 0.8350, test_loss: 1.0249, test_f1: 0.5403
 epoch: 11, train_loss: 0.8298, test_loss: 1.0475, test_f1: 0.5532
 epoch: 12, train_loss: 0.8223, test_loss: 0.9264, test_f1: 0.5797
 epoch: 13, train_loss: 0.7991, test_loss: 0.8355, test_f1: 0.5980
 epoch: 14, train_loss: 0.7789, test_loss: 0.8572, test_f1: 0.6025
 epoch: 15, train_loss: 0.7729, test_loss: 1.0497, test_f1: 0.5502
 epoch: 16, train_loss: 0.7701, test_loss: 0.9447, test_f1: 0.5669
 epoch: 17, train_loss: 0.7444, test_loss: 0.8631, test_f1: 0.6016
 epoch: 18, train_loss: 0.7390, test_loss: 0.9705, test_f1: 0.5652
 epoch: 19, train_loss: 0.7172, test_loss: 0.9190, test_f1: 0.5594
 epoch: 20, train_loss: 0.7123, test_loss: 0.8714, test_f1: 0.5726
 epoch: 21, train_loss: 0.7134, test_loss: 0.9069, test_f1: 0.5815
 epoch: 22, train_loss: 0.6872, test_loss: 0.9763, test_f1: 0.5612
 epoch: 23, train_loss: 0.6857, test_loss: 0.9132, test_f1: 0.6233
 epoch: 24, train_loss: 0.6744, test_loss: 0.8605, test_f1: 0.5890
 epoch: 25, train_loss: 0.6658, test_loss: 0.8914, test_f1: 0.5940
 epoch: 26, train_loss: 0.6636, test_loss: 1.0994, test_f1: 0.5393
 epoch: 27, train_loss: 0.6579, test_loss: 0.8983, test_f1: 0.6030
 epoch: 28, train_loss: 0.6537, test_loss: 0.8785, test_f1: 0.6111
 epoch: 29, train_loss: 0.6062, test_loss: 0.9509, test_f1: 0.6152
 epoch: 30, train_loss: 0.6312, test_loss: 0.9091, test_f1: 0.5827
 epoch: 31, train_loss: 0.6219, test_loss: 0.8123, test_f1: 0.6141
 epoch: 32, train_loss: 0.6200, test_loss: 0.9646, test_f1: 0.5804
 epoch: 33, train_loss: 0.6335, test_loss: 0.8244, test_f1: 0.6164
 epoch: 34, train_loss: 0.6236, test_loss: 1.0775, test_f1: 0.5895
 epoch: 35, train_loss: 0.5996, test_loss: 0.9710, test_f1: 0.6426
 epoch: 36, train_loss: 0.5815, test_loss: 0.8912, test_f1: 0.6421
 epoch: 37, train_loss: 0.5794, test_loss: 0.9484, test_f1: 0.6639
 epoch: 38, train_loss: 0.5658, test_loss: 0.9257, test_f1: 0.6244
 epoch: 39, train_loss: 0.5689, test_loss: 0.9560, test_f1: 0.6104
 epoch: 40, train_loss: 0.5719, test_loss: 0.9418, test_f1: 0.6467
 epoch: 41, train_loss: 0.5676, test_loss: 0.8992, test_f1: 0.6296
 epoch: 42, train_loss: 0.5663, test_loss: 1.0307, test_f1: 0.5963
 epoch: 43, train_loss: 0.5478, test_loss: 1.1928, test_f1: 0.5851
 epoch: 44, train_loss: 0.5260, test_loss: 0.9429, test_f1: 0.6556
 epoch: 45, train_loss: 0.5466, test_loss: 1.1507, test_f1: 0.5979
 epoch: 46, train_loss: 0.5270, test_loss: 1.1142, test_f1: 0.6051
 epoch: 47, train_loss: 0.5252, test_loss: 0.9327, test_f1: 0.6196
 epoch: 48, train_loss: 0.5335, test_loss: 1.2804, test_f1: 0.6074
 epoch: 49, train_loss: 0.5324, test_loss: 1.3987, test_f1: 0.5570
 epoch: 50, train_loss: 0.5437, test_loss: 1.6611, test_f1: 0.4881
 epoch: 51, train_loss: 0.5291, test_loss: 1.2303, test_f1: 0.5604
 epoch: 52, train_loss: 0.4859, test_loss: 0.9918, test_f1: 0.6483
 epoch: 53, train_loss: 0.4591, test_loss: 0.9644, test_f1: 0.6478
 epoch: 54, train_loss: 0.4452, test_loss: 1.0680, test_f1: 0.6103
 epoch: 55, train_loss: 0.4447, test_loss: 1.0743, test_f1: 0.6186
 epoch: 56, train_loss: 0.4336, test_loss: 1.0464, test_f1: 0.6466
 epoch: 57, train_loss: 0.4292, test_loss: 1.0557, test_f1: 0.6384
 epoch: 58, train_loss: 0.4211, test_loss: 1.1139, test_f1: 0.6155
 epoch: 59, train_loss: 0.4260, test_loss: 1.0494, test_f1: 0.6457
 epoch: 60, train_loss: 0.4071, test_loss: 1.1254, test_f1: 0.6412
 epoch: 61, train_loss: 0.3938, test_loss: 1.2342, test_f1: 0.6151
 epoch: 62, train_loss: 0.4280, test_loss: 1.1220, test_f1: 0.6614
 epoch: 63, train_loss: 0.4195, test_loss: 1.1382, test_f1: 0.6549
 epoch: 64, train_loss: 0.3932, test_loss: 1.1714, test_f1: 0.6535
 epoch: 65, train_loss: 0.3912, test_loss: 1.1151, test_f1: 0.6401
 epoch: 66, train_loss: 0.3879, test_loss: 1.3583, test_f1: 0.6037
 epoch: 67, train_loss: 0.3980, test_loss: 1.1919, test_f1: 0.6487
 epoch: 68, train_loss: 0.3910, test_loss: 1.1427, test_f1: 0.6396
 epoch: 69, train_loss: 0.3848, test_loss: 1.0563, test_f1: 0.6721
 epoch: 70, train_loss: 0.3844, test_loss: 1.2208, test_f1: 0.6359
 epoch: 71, train_loss: 0.4037, test_loss: 1.2154, test_f1: 0.6609
 epoch: 72, train_loss: 0.4047, test_loss: 1.4895, test_f1: 0.5731
 epoch: 73, train_loss: 0.3988, test_loss: 1.1697, test_f1: 0.6496
 epoch: 74, train_loss: 0.3775, test_loss: 1.1299, test_f1: 0.6569
 epoch: 75, train_loss: 0.3824, test_loss: 1.3725, test_f1: 0.6241
 epoch: 76, train_loss: 0.3620, test_loss: 1.2487, test_f1: 0.6388
 epoch: 77, train_loss: 0.3757, test_loss: 1.2323, test_f1: 0.6626
 epoch: 78, train_loss: 0.3568, test_loss: 1.3318, test_f1: 0.6291
 epoch: 79, train_loss: 0.3424, test_loss: 1.4309, test_f1: 0.6190
 epoch: 80, train_loss: 0.3528, test_loss: 1.2868, test_f1: 0.6618
 epoch: 81, train_loss: 0.3528, test_loss: 1.4411, test_f1: 0.6416
 epoch: 82, train_loss: 0.3618, test_loss: 1.5518, test_f1: 0.5889
 epoch: 83, train_loss: 0.3439, test_loss: 1.3343, test_f1: 0.6579
 epoch: 84, train_loss: 0.3456, test_loss: 1.2294, test_f1: 0.6260
 epoch: 85, train_loss: 0.3616, test_loss: 1.4645, test_f1: 0.6042
 epoch: 86, train_loss: 0.4161, test_loss: 1.2724, test_f1: 0.6408
 epoch: 87, train_loss: 0.3723, test_loss: 1.2842, test_f1: 0.6295
 epoch: 88, train_loss: 0.3367, test_loss: 1.2093, test_f1: 0.6658
 epoch: 89, train_loss: 0.3326, test_loss: 1.3145, test_f1: 0.6406
 epoch: 90, train_loss: 0.3376, test_loss: 1.3858, test_f1: 0.6339
 epoch: 91, train_loss: 0.3382, test_loss: 1.3545, test_f1: 0.6544
 epoch: 92, train_loss: 0.3477, test_loss: 1.4247, test_f1: 0.5907
 epoch: 93, train_loss: 0.3466, test_loss: 1.1952, test_f1: 0.6611
 epoch: 94, train_loss: 0.3265, test_loss: 1.4117, test_f1: 0.6703
 epoch: 95, train_loss: 0.3503, test_loss: 1.4551, test_f1: 0.6329
 epoch: 96, train_loss: 0.3215, test_loss: 1.4104, test_f1: 0.6298
 epoch: 97, train_loss: 0.3416, test_loss: 1.3724, test_f1: 0.6495
 epoch: 98, train_loss: 0.3248, test_loss: 1.3591, test_f1: 0.6603
 epoch: 99, train_loss: 0.3254, test_loss: 1.6332, test_f1: 0.6232
##################ITERATION #5 ****************************************
 epoch: 0, train_loss: 1.4673, test_loss: 1.5846, test_f1: 0.2270
 epoch: 1, train_loss: 1.0121, test_loss: 1.2265, test_f1: 0.2500
 epoch: 2, train_loss: 0.9843, test_loss: 1.0527, test_f1: 0.4215
 epoch: 3, train_loss: 0.9528, test_loss: 0.9995, test_f1: 0.4761
 epoch: 4, train_loss: 0.9331, test_loss: 0.9820, test_f1: 0.5279
 epoch: 5, train_loss: 0.9139, test_loss: 1.0086, test_f1: 0.5311
 epoch: 6, train_loss: 0.8763, test_loss: 0.9737, test_f1: 0.4770
 epoch: 7, train_loss: 0.8636, test_loss: 0.8820, test_f1: 0.5220
 epoch: 8, train_loss: 0.8680, test_loss: 1.0922, test_f1: 0.4898
 epoch: 9, train_loss: 0.8690, test_loss: 0.9573, test_f1: 0.5569
 epoch: 10, train_loss: 0.8422, test_loss: 0.9449, test_f1: 0.5226
 epoch: 11, train_loss: 0.8252, test_loss: 0.9150, test_f1: 0.5895
 epoch: 12, train_loss: 0.8288, test_loss: 0.9626, test_f1: 0.5409
 epoch: 13, train_loss: 0.8057, test_loss: 0.9220, test_f1: 0.5725
 epoch: 14, train_loss: 0.7840, test_loss: 0.9546, test_f1: 0.5516
 epoch: 15, train_loss: 0.7831, test_loss: 1.0993, test_f1: 0.5084
 epoch: 16, train_loss: 0.7692, test_loss: 0.8739, test_f1: 0.5955
 epoch: 17, train_loss: 0.7510, test_loss: 0.9084, test_f1: 0.6227
 epoch: 18, train_loss: 0.7492, test_loss: 0.9229, test_f1: 0.5893
 epoch: 19, train_loss: 0.7432, test_loss: 0.8621, test_f1: 0.6056
 epoch: 20, train_loss: 0.7392, test_loss: 0.8495, test_f1: 0.6464
 epoch: 21, train_loss: 0.7287, test_loss: 0.8311, test_f1: 0.6495
 epoch: 22, train_loss: 0.7144, test_loss: 1.1031, test_f1: 0.5405
 epoch: 23, train_loss: 0.7103, test_loss: 0.9535, test_f1: 0.6082
 epoch: 24, train_loss: 0.7095, test_loss: 0.8995, test_f1: 0.6139
 epoch: 25, train_loss: 0.6908, test_loss: 0.8102, test_f1: 0.6265
 epoch: 26, train_loss: 0.6672, test_loss: 0.7700, test_f1: 0.6500
 epoch: 27, train_loss: 0.6674, test_loss: 0.9255, test_f1: 0.5805
 epoch: 28, train_loss: 0.6752, test_loss: 0.8591, test_f1: 0.6204
 epoch: 29, train_loss: 0.6647, test_loss: 0.9365, test_f1: 0.6439
 epoch: 30, train_loss: 0.6395, test_loss: 0.8380, test_f1: 0.6243
 epoch: 31, train_loss: 0.6427, test_loss: 0.8849, test_f1: 0.6138
 epoch: 32, train_loss: 0.6308, test_loss: 1.0179, test_f1: 0.5229
 epoch: 33, train_loss: 0.6305, test_loss: 0.8408, test_f1: 0.6012
 epoch: 34, train_loss: 0.6196, test_loss: 0.9068, test_f1: 0.5957
 epoch: 35, train_loss: 0.6213, test_loss: 0.8607, test_f1: 0.6192
 epoch: 36, train_loss: 0.6153, test_loss: 0.9186, test_f1: 0.6175
 epoch: 37, train_loss: 0.6065, test_loss: 0.9394, test_f1: 0.6158
 epoch: 38, train_loss: 0.5926, test_loss: 1.4317, test_f1: 0.5138
 epoch: 39, train_loss: 0.6001, test_loss: 0.9172, test_f1: 0.6293
 epoch: 40, train_loss: 0.6013, test_loss: 0.9314, test_f1: 0.6200
 epoch: 41, train_loss: 0.5973, test_loss: 1.1207, test_f1: 0.5625
 epoch: 42, train_loss: 0.5833, test_loss: 1.1263, test_f1: 0.5737
 epoch: 43, train_loss: 0.5860, test_loss: 0.8751, test_f1: 0.6543
 epoch: 44, train_loss: 0.5670, test_loss: 1.2659, test_f1: 0.5317
 epoch: 45, train_loss: 0.5577, test_loss: 1.0338, test_f1: 0.6330
 epoch: 46, train_loss: 0.5548, test_loss: 0.9779, test_f1: 0.6050
 epoch: 47, train_loss: 0.5681, test_loss: 0.8739, test_f1: 0.6308
 epoch: 48, train_loss: 0.5507, test_loss: 0.9896, test_f1: 0.6437
 epoch: 49, train_loss: 0.5241, test_loss: 1.0892, test_f1: 0.6357
 epoch: 50, train_loss: 0.5407, test_loss: 1.1552, test_f1: 0.5792
 epoch: 51, train_loss: 0.5282, test_loss: 0.9269, test_f1: 0.6527
 epoch: 52, train_loss: 0.4798, test_loss: 1.0151, test_f1: 0.6594
 epoch: 53, train_loss: 0.4749, test_loss: 0.9385, test_f1: 0.6719
 epoch: 54, train_loss: 0.4584, test_loss: 0.9626, test_f1: 0.6725
 epoch: 55, train_loss: 0.4535, test_loss: 1.1854, test_f1: 0.6236
 epoch: 56, train_loss: 0.4515, test_loss: 0.9989, test_f1: 0.6787
 epoch: 57, train_loss: 0.4415, test_loss: 1.0253, test_f1: 0.6647
 epoch: 58, train_loss: 0.4448, test_loss: 0.9776, test_f1: 0.6428
 epoch: 59, train_loss: 0.4335, test_loss: 1.0970, test_f1: 0.6642
 epoch: 60, train_loss: 0.4356, test_loss: 0.9718, test_f1: 0.6768
 epoch: 61, train_loss: 0.4277, test_loss: 1.0559, test_f1: 0.6755
 epoch: 62, train_loss: 0.4171, test_loss: 1.0257, test_f1: 0.6735
 epoch: 63, train_loss: 0.4244, test_loss: 1.1619, test_f1: 0.6431
 epoch: 64, train_loss: 0.4412, test_loss: 1.1022, test_f1: 0.6572
 epoch: 65, train_loss: 0.4279, test_loss: 0.9869, test_f1: 0.6735
 epoch: 66, train_loss: 0.4270, test_loss: 1.0201, test_f1: 0.6763
 epoch: 67, train_loss: 0.4429, test_loss: 1.3783, test_f1: 0.6206
 epoch: 68, train_loss: 0.4244, test_loss: 1.1417, test_f1: 0.6693
 epoch: 69, train_loss: 0.3901, test_loss: 1.0575, test_f1: 0.6383
 epoch: 70, train_loss: 0.4038, test_loss: 1.2384, test_f1: 0.6147
 epoch: 71, train_loss: 0.3987, test_loss: 1.1495, test_f1: 0.6600
 epoch: 72, train_loss: 0.4116, test_loss: 1.1664, test_f1: 0.6386
 epoch: 73, train_loss: 0.4135, test_loss: 1.1528, test_f1: 0.6649
 epoch: 74, train_loss: 0.3951, test_loss: 1.3202, test_f1: 0.6289
 epoch: 75, train_loss: 0.3926, test_loss: 1.1213, test_f1: 0.6754
 epoch: 76, train_loss: 0.3847, test_loss: 1.2869, test_f1: 0.6472
 epoch: 77, train_loss: 0.3963, test_loss: 1.3279, test_f1: 0.6368
 epoch: 78, train_loss: 0.3869, test_loss: 1.2255, test_f1: 0.6479
 epoch: 79, train_loss: 0.3799, test_loss: 1.2554, test_f1: 0.6673
 epoch: 80, train_loss: 0.3786, test_loss: 1.2431, test_f1: 0.6485
 epoch: 81, train_loss: 0.3791, test_loss: 1.3436, test_f1: 0.6620
 epoch: 82, train_loss: 0.3706, test_loss: 1.2981, test_f1: 0.6582
 epoch: 83, train_loss: 0.3666, test_loss: 1.3674, test_f1: 0.6470
 epoch: 84, train_loss: 0.3720, test_loss: 1.2526, test_f1: 0.6679
 epoch: 85, train_loss: 0.3564, test_loss: 1.6635, test_f1: 0.5964
 epoch: 86, train_loss: 0.3668, test_loss: 1.2493, test_f1: 0.6658
 epoch: 87, train_loss: 0.3700, test_loss: 1.3455, test_f1: 0.6451
 epoch: 88, train_loss: 0.3542, test_loss: 1.2900, test_f1: 0.6468
 epoch: 89, train_loss: 0.3524, test_loss: 1.3474, test_f1: 0.6577
 epoch: 90, train_loss: 0.3541, test_loss: 1.4181, test_f1: 0.6515
 epoch: 91, train_loss: 0.3306, test_loss: 1.3258, test_f1: 0.6675
 epoch: 92, train_loss: 0.3445, test_loss: 1.4115, test_f1: 0.6519
 epoch: 93, train_loss: 0.3728, test_loss: 1.3038, test_f1: 0.6459
 epoch: 94, train_loss: 0.3616, test_loss: 1.5753, test_f1: 0.6357
 epoch: 95, train_loss: 0.3649, test_loss: 1.3510, test_f1: 0.6628
 epoch: 96, train_loss: 0.3767, test_loss: 1.3621, test_f1: 0.6334
 epoch: 97, train_loss: 0.3491, test_loss: 1.3035, test_f1: 0.6646
 epoch: 98, train_loss: 0.3129, test_loss: 1.4520, test_f1: 0.6359
 epoch: 99, train_loss: 0.3242, test_loss: 1.4903, test_f1: 0.6573
##################ITERATION #6 ****************************************
 epoch: 0, train_loss: 1.4712, test_loss: 1.3550, test_f1: 0.1481
 epoch: 1, train_loss: 1.0317, test_loss: 1.0621, test_f1: 0.4824
 epoch: 2, train_loss: 0.9579, test_loss: 1.0083, test_f1: 0.4842
 epoch: 3, train_loss: 0.9318, test_loss: 1.0075, test_f1: 0.4937
 epoch: 4, train_loss: 0.9104, test_loss: 0.9880, test_f1: 0.4759
 epoch: 5, train_loss: 0.8828, test_loss: 0.8945, test_f1: 0.4795
 epoch: 6, train_loss: 0.8725, test_loss: 0.9319, test_f1: 0.5643
 epoch: 7, train_loss: 0.8524, test_loss: 0.9284, test_f1: 0.5210
 epoch: 8, train_loss: 0.8299, test_loss: 1.1821, test_f1: 0.5220
 epoch: 9, train_loss: 0.8148, test_loss: 0.9323, test_f1: 0.5768
 epoch: 10, train_loss: 0.8139, test_loss: 1.4116, test_f1: 0.4704
 epoch: 11, train_loss: 0.8107, test_loss: 0.8983, test_f1: 0.5778
 epoch: 12, train_loss: 0.7947, test_loss: 0.9649, test_f1: 0.5693
 epoch: 13, train_loss: 0.7845, test_loss: 1.0508, test_f1: 0.5325
 epoch: 14, train_loss: 0.7638, test_loss: 0.9548, test_f1: 0.5847
 epoch: 15, train_loss: 0.7726, test_loss: 0.9958, test_f1: 0.5178
 epoch: 16, train_loss: 0.7479, test_loss: 0.9599, test_f1: 0.5625
 epoch: 17, train_loss: 0.7302, test_loss: 1.0997, test_f1: 0.6073
 epoch: 18, train_loss: 0.7218, test_loss: 1.2022, test_f1: 0.5307
 epoch: 19, train_loss: 0.7031, test_loss: 1.4285, test_f1: 0.5327
 epoch: 20, train_loss: 0.7165, test_loss: 0.9539, test_f1: 0.6111
 epoch: 21, train_loss: 0.7005, test_loss: 0.9704, test_f1: 0.6118
 epoch: 22, train_loss: 0.6797, test_loss: 0.9843, test_f1: 0.6484
 epoch: 23, train_loss: 0.6834, test_loss: 1.4550, test_f1: 0.4599
 epoch: 24, train_loss: 0.6837, test_loss: 1.2122, test_f1: 0.5591
 epoch: 25, train_loss: 0.6651, test_loss: 0.9569, test_f1: 0.6533
 epoch: 26, train_loss: 0.6464, test_loss: 1.0564, test_f1: 0.6204
 epoch: 27, train_loss: 0.6484, test_loss: 1.0784, test_f1: 0.5970
 epoch: 28, train_loss: 0.6456, test_loss: 1.1012, test_f1: 0.5734
 epoch: 29, train_loss: 0.6269, test_loss: 1.1305, test_f1: 0.6123
 epoch: 30, train_loss: 0.6438, test_loss: 1.1194, test_f1: 0.6328
 epoch: 31, train_loss: 0.6437, test_loss: 1.1387, test_f1: 0.6543
 epoch: 32, train_loss: 0.6192, test_loss: 1.1605, test_f1: 0.6068
 epoch: 33, train_loss: 0.6089, test_loss: 0.8772, test_f1: 0.6364
 epoch: 34, train_loss: 0.6087, test_loss: 1.2697, test_f1: 0.5852
 epoch: 35, train_loss: 0.6084, test_loss: 1.1750, test_f1: 0.6071
 epoch: 36, train_loss: 0.5987, test_loss: 1.0926, test_f1: 0.5977
 epoch: 37, train_loss: 0.6052, test_loss: 1.0338, test_f1: 0.6541
 epoch: 38, train_loss: 0.5879, test_loss: 1.2114, test_f1: 0.5549
 epoch: 39, train_loss: 0.5850, test_loss: 1.2021, test_f1: 0.5988
 epoch: 40, train_loss: 0.5842, test_loss: 1.1684, test_f1: 0.5986
 epoch: 41, train_loss: 0.5904, test_loss: 1.0819, test_f1: 0.6309
 epoch: 42, train_loss: 0.5994, test_loss: 1.2354, test_f1: 0.5916
 epoch: 43, train_loss: 0.5843, test_loss: 1.2722, test_f1: 0.5783
 epoch: 44, train_loss: 0.6077, test_loss: 1.2629, test_f1: 0.6246
 epoch: 45, train_loss: 0.5702, test_loss: 1.1585, test_f1: 0.6156
 epoch: 46, train_loss: 0.5561, test_loss: 1.0898, test_f1: 0.6250
 epoch: 47, train_loss: 0.5352, test_loss: 1.3283, test_f1: 0.6007
 epoch: 48, train_loss: 0.5396, test_loss: 1.5670, test_f1: 0.5688
 epoch: 49, train_loss: 0.5343, test_loss: 1.2632, test_f1: 0.5997
 epoch: 50, train_loss: 0.5238, test_loss: 1.2213, test_f1: 0.6229
 epoch: 51, train_loss: 0.4992, test_loss: 1.2402, test_f1: 0.6572
 epoch: 52, train_loss: 0.4730, test_loss: 1.1012, test_f1: 0.6552
 epoch: 53, train_loss: 0.4809, test_loss: 1.0827, test_f1: 0.6719
 epoch: 54, train_loss: 0.4590, test_loss: 1.2929, test_f1: 0.6288
 epoch: 55, train_loss: 0.4492, test_loss: 1.1864, test_f1: 0.6439
 epoch: 56, train_loss: 0.4390, test_loss: 1.0874, test_f1: 0.6580
 epoch: 57, train_loss: 0.4341, test_loss: 1.2000, test_f1: 0.6410
 epoch: 58, train_loss: 0.4395, test_loss: 1.4234, test_f1: 0.6082
 epoch: 59, train_loss: 0.4425, test_loss: 1.2767, test_f1: 0.6437
 epoch: 60, train_loss: 0.4262, test_loss: 1.3612, test_f1: 0.6200
 epoch: 61, train_loss: 0.4283, test_loss: 1.2575, test_f1: 0.6412
 epoch: 62, train_loss: 0.4206, test_loss: 1.2602, test_f1: 0.6339
 epoch: 63, train_loss: 0.4065, test_loss: 1.2879, test_f1: 0.6405
 epoch: 64, train_loss: 0.4182, test_loss: 1.2757, test_f1: 0.6186
 epoch: 65, train_loss: 0.4227, test_loss: 1.2303, test_f1: 0.6393
 epoch: 66, train_loss: 0.4157, test_loss: 1.3763, test_f1: 0.6295
 epoch: 67, train_loss: 0.4339, test_loss: 1.2035, test_f1: 0.6445
 epoch: 68, train_loss: 0.4030, test_loss: 1.2586, test_f1: 0.6383
 epoch: 69, train_loss: 0.4203, test_loss: 1.1941, test_f1: 0.6275
 epoch: 70, train_loss: 0.4177, test_loss: 1.5051, test_f1: 0.6163
 epoch: 71, train_loss: 0.4027, test_loss: 1.1948, test_f1: 0.6625
 epoch: 72, train_loss: 0.3800, test_loss: 1.1566, test_f1: 0.6203
 epoch: 73, train_loss: 0.4072, test_loss: 1.5447, test_f1: 0.6118
 epoch: 74, train_loss: 0.3931, test_loss: 1.2259, test_f1: 0.6711
 epoch: 75, train_loss: 0.3795, test_loss: 1.4555, test_f1: 0.6053
 epoch: 76, train_loss: 0.3907, test_loss: 1.2726, test_f1: 0.6342
 epoch: 77, train_loss: 0.3909, test_loss: 1.2195, test_f1: 0.6683
 epoch: 78, train_loss: 0.3929, test_loss: 1.5924, test_f1: 0.6068
 epoch: 79, train_loss: 0.3942, test_loss: 1.4714, test_f1: 0.6364
 epoch: 80, train_loss: 0.3872, test_loss: 1.2691, test_f1: 0.6468
 epoch: 81, train_loss: 0.3649, test_loss: 1.2304, test_f1: 0.6652
 epoch: 82, train_loss: 0.3603, test_loss: 1.3221, test_f1: 0.6375
 epoch: 83, train_loss: 0.3808, test_loss: 1.5228, test_f1: 0.6691
 epoch: 84, train_loss: 0.3850, test_loss: 1.6201, test_f1: 0.6498
 epoch: 85, train_loss: 0.3653, test_loss: 1.4715, test_f1: 0.6483
 epoch: 86, train_loss: 0.3556, test_loss: 1.3614, test_f1: 0.6624
 epoch: 87, train_loss: 0.3566, test_loss: 1.4918, test_f1: 0.6283
 epoch: 88, train_loss: 0.3716, test_loss: 1.4383, test_f1: 0.6243
 epoch: 89, train_loss: 0.3578, test_loss: 2.0385, test_f1: 0.5699
 epoch: 90, train_loss: 0.3467, test_loss: 1.6088, test_f1: 0.6552
 epoch: 91, train_loss: 0.3382, test_loss: 1.5490, test_f1: 0.6515
 epoch: 92, train_loss: 0.3402, test_loss: 1.4083, test_f1: 0.6406
 epoch: 93, train_loss: 0.3722, test_loss: 1.4495, test_f1: 0.6598
 epoch: 94, train_loss: 0.3554, test_loss: 1.6371, test_f1: 0.6106
 epoch: 95, train_loss: 0.3513, test_loss: 1.5135, test_f1: 0.6560
 epoch: 96, train_loss: 0.3384, test_loss: 1.4862, test_f1: 0.6543
 epoch: 97, train_loss: 0.3372, test_loss: 1.4298, test_f1: 0.6596
 epoch: 98, train_loss: 0.3400, test_loss: 1.3790, test_f1: 0.6379
 epoch: 99, train_loss: 0.3445, test_loss: 1.5132, test_f1: 0.6417
##################ITERATION #7 ****************************************
 epoch: 0, train_loss: 1.4391, test_loss: 1.5571, test_f1: 0.2826
 epoch: 1, train_loss: 1.0107, test_loss: 1.1700, test_f1: 0.2728
 epoch: 2, train_loss: 0.9641, test_loss: 0.9643, test_f1: 0.4933
 epoch: 3, train_loss: 0.9333, test_loss: 0.9737, test_f1: 0.5060
 epoch: 4, train_loss: 0.9197, test_loss: 0.9385, test_f1: 0.5173
 epoch: 5, train_loss: 0.9057, test_loss: 0.9361, test_f1: 0.5359
 epoch: 6, train_loss: 0.8794, test_loss: 0.9620, test_f1: 0.5009
 epoch: 7, train_loss: 0.8821, test_loss: 0.9234, test_f1: 0.5380
 epoch: 8, train_loss: 0.8628, test_loss: 0.9107, test_f1: 0.5414
 epoch: 9, train_loss: 0.8420, test_loss: 0.9126, test_f1: 0.5960
 epoch: 10, train_loss: 0.8265, test_loss: 0.8872, test_f1: 0.5249
 epoch: 11, train_loss: 0.8115, test_loss: 0.8780, test_f1: 0.5656
 epoch: 12, train_loss: 0.7927, test_loss: 0.8550, test_f1: 0.5953
 epoch: 13, train_loss: 0.7830, test_loss: 0.8960, test_f1: 0.6217
 epoch: 14, train_loss: 0.7764, test_loss: 0.9335, test_f1: 0.5814
 epoch: 15, train_loss: 0.7594, test_loss: 0.9722, test_f1: 0.5580
 epoch: 16, train_loss: 0.7576, test_loss: 0.8722, test_f1: 0.5716
 epoch: 17, train_loss: 0.7505, test_loss: 0.8922, test_f1: 0.5824
 epoch: 18, train_loss: 0.7267, test_loss: 1.0179, test_f1: 0.5540
 epoch: 19, train_loss: 0.7278, test_loss: 0.9566, test_f1: 0.5957
 epoch: 20, train_loss: 0.7133, test_loss: 0.8992, test_f1: 0.6084
 epoch: 21, train_loss: 0.7021, test_loss: 1.1746, test_f1: 0.5531
 epoch: 22, train_loss: 0.7266, test_loss: 0.9765, test_f1: 0.5943
 epoch: 23, train_loss: 0.7129, test_loss: 1.4814, test_f1: 0.4924
 epoch: 24, train_loss: 0.7021, test_loss: 0.8595, test_f1: 0.5939
 epoch: 25, train_loss: 0.6935, test_loss: 0.9078, test_f1: 0.6321
 epoch: 26, train_loss: 0.6687, test_loss: 0.9328, test_f1: 0.5933
 epoch: 27, train_loss: 0.6454, test_loss: 0.9056, test_f1: 0.6331
 epoch: 28, train_loss: 0.6405, test_loss: 0.8977, test_f1: 0.6200
 epoch: 29, train_loss: 0.6487, test_loss: 0.9630, test_f1: 0.6094
 epoch: 30, train_loss: 0.6420, test_loss: 0.9149, test_f1: 0.6680
 epoch: 31, train_loss: 0.6346, test_loss: 1.0779, test_f1: 0.6104
 epoch: 32, train_loss: 0.6548, test_loss: 1.0726, test_f1: 0.5991
 epoch: 33, train_loss: 0.6386, test_loss: 0.9229, test_f1: 0.6367
 epoch: 34, train_loss: 0.6265, test_loss: 0.9537, test_f1: 0.6229
 epoch: 35, train_loss: 0.6365, test_loss: 0.8569, test_f1: 0.6613
 epoch: 36, train_loss: 0.6163, test_loss: 0.8845, test_f1: 0.6770
 epoch: 37, train_loss: 0.5970, test_loss: 0.9436, test_f1: 0.6520
 epoch: 38, train_loss: 0.5977, test_loss: 0.9832, test_f1: 0.6366
 epoch: 39, train_loss: 0.5950, test_loss: 0.9661, test_f1: 0.6182
 epoch: 40, train_loss: 0.5851, test_loss: 1.0072, test_f1: 0.6374
 epoch: 41, train_loss: 0.5940, test_loss: 0.9111, test_f1: 0.6701
 epoch: 42, train_loss: 0.5723, test_loss: 0.9409, test_f1: 0.6451
 epoch: 43, train_loss: 0.5724, test_loss: 0.9868, test_f1: 0.6652
 epoch: 44, train_loss: 0.5659, test_loss: 0.9467, test_f1: 0.6474
 epoch: 45, train_loss: 0.5682, test_loss: 1.0756, test_f1: 0.6584
 epoch: 46, train_loss: 0.5571, test_loss: 1.1411, test_f1: 0.6325
 epoch: 47, train_loss: 0.5610, test_loss: 0.9354, test_f1: 0.6116
 epoch: 48, train_loss: 0.5691, test_loss: 0.8954, test_f1: 0.6203
 epoch: 49, train_loss: 0.5716, test_loss: 1.1082, test_f1: 0.6329
 epoch: 50, train_loss: 0.5573, test_loss: 1.0278, test_f1: 0.6448
 epoch: 51, train_loss: 0.5151, test_loss: 0.9265, test_f1: 0.6698
 epoch: 52, train_loss: 0.5006, test_loss: 1.0191, test_f1: 0.6756
 epoch: 53, train_loss: 0.4781, test_loss: 0.9558, test_f1: 0.6641
 epoch: 54, train_loss: 0.4574, test_loss: 0.9849, test_f1: 0.6591
 epoch: 55, train_loss: 0.4551, test_loss: 0.9780, test_f1: 0.6697
 epoch: 56, train_loss: 0.4585, test_loss: 1.0070, test_f1: 0.6616
 epoch: 57, train_loss: 0.4673, test_loss: 1.0501, test_f1: 0.6683
 epoch: 58, train_loss: 0.4327, test_loss: 1.0221, test_f1: 0.6733
 epoch: 59, train_loss: 0.4454, test_loss: 1.0809, test_f1: 0.6425
 epoch: 60, train_loss: 0.4292, test_loss: 1.0865, test_f1: 0.6683
 epoch: 61, train_loss: 0.4528, test_loss: 1.0804, test_f1: 0.6798
 epoch: 62, train_loss: 0.4441, test_loss: 1.0731, test_f1: 0.6724
 epoch: 63, train_loss: 0.4322, test_loss: 1.1036, test_f1: 0.6658
 epoch: 64, train_loss: 0.4293, test_loss: 1.3515, test_f1: 0.5909
 epoch: 65, train_loss: 0.4328, test_loss: 1.0244, test_f1: 0.6704
 epoch: 66, train_loss: 0.4469, test_loss: 1.1862, test_f1: 0.6597
 epoch: 67, train_loss: 0.4194, test_loss: 1.1476, test_f1: 0.6327
 epoch: 68, train_loss: 0.4231, test_loss: 1.1038, test_f1: 0.6770
 epoch: 69, train_loss: 0.4266, test_loss: 1.1058, test_f1: 0.6534
 epoch: 70, train_loss: 0.4252, test_loss: 1.2008, test_f1: 0.6812
 epoch: 71, train_loss: 0.4069, test_loss: 1.0678, test_f1: 0.6825
 epoch: 72, train_loss: 0.4087, test_loss: 1.1232, test_f1: 0.6668
 epoch: 73, train_loss: 0.3871, test_loss: 1.1724, test_f1: 0.6830
 epoch: 74, train_loss: 0.3968, test_loss: 1.1108, test_f1: 0.6638
 epoch: 75, train_loss: 0.4053, test_loss: 1.1695, test_f1: 0.6691
 epoch: 76, train_loss: 0.4143, test_loss: 1.2363, test_f1: 0.6810
 epoch: 77, train_loss: 0.3942, test_loss: 1.1315, test_f1: 0.6904
 epoch: 78, train_loss: 0.4121, test_loss: 1.1198, test_f1: 0.6770
 epoch: 79, train_loss: 0.4001, test_loss: 1.1587, test_f1: 0.6899
 epoch: 80, train_loss: 0.3961, test_loss: 1.2072, test_f1: 0.6324
 epoch: 81, train_loss: 0.3906, test_loss: 1.2242, test_f1: 0.6564
 epoch: 82, train_loss: 0.3906, test_loss: 1.2849, test_f1: 0.6536
 epoch: 83, train_loss: 0.3857, test_loss: 1.2329, test_f1: 0.6921
 epoch: 84, train_loss: 0.3756, test_loss: 1.2084, test_f1: 0.6660
 epoch: 85, train_loss: 0.3915, test_loss: 1.3031, test_f1: 0.6226
 epoch: 86, train_loss: 0.3797, test_loss: 1.5487, test_f1: 0.6072
 epoch: 87, train_loss: 0.3738, test_loss: 1.2806, test_f1: 0.6608
 epoch: 88, train_loss: 0.3764, test_loss: 1.3069, test_f1: 0.6795
 epoch: 89, train_loss: 0.3954, test_loss: 1.3296, test_f1: 0.6594
 epoch: 90, train_loss: 0.3797, test_loss: 1.1970, test_f1: 0.6618
 epoch: 91, train_loss: 0.3612, test_loss: 1.3103, test_f1: 0.6842
 epoch: 92, train_loss: 0.3938, test_loss: 1.2428, test_f1: 0.6651
 epoch: 93, train_loss: 0.3707, test_loss: 1.2740, test_f1: 0.6788
 epoch: 94, train_loss: 0.3798, test_loss: 1.3218, test_f1: 0.6585
 epoch: 95, train_loss: 0.3606, test_loss: 1.4144, test_f1: 0.6549
 epoch: 96, train_loss: 0.3576, test_loss: 1.2456, test_f1: 0.6717
 epoch: 97, train_loss: 0.3629, test_loss: 1.4912, test_f1: 0.6700
 epoch: 98, train_loss: 0.3810, test_loss: 1.4660, test_f1: 0.5986
 epoch: 99, train_loss: 0.3738, test_loss: 1.2548, test_f1: 0.6659
##################ITERATION #8 ****************************************
 epoch: 0, train_loss: 1.6219, test_loss: 1.2856, test_f1: 0.2811
 epoch: 1, train_loss: 1.0297, test_loss: 1.1160, test_f1: 0.4121
 epoch: 2, train_loss: 0.9913, test_loss: 1.0478, test_f1: 0.3598
 epoch: 3, train_loss: 0.9543, test_loss: 0.9692, test_f1: 0.4548
 epoch: 4, train_loss: 0.9277, test_loss: 0.9883, test_f1: 0.5172
 epoch: 5, train_loss: 0.9182, test_loss: 1.0634, test_f1: 0.4821
 epoch: 6, train_loss: 0.8895, test_loss: 1.0180, test_f1: 0.5296
 epoch: 7, train_loss: 0.8649, test_loss: 1.0589, test_f1: 0.5187
 epoch: 8, train_loss: 0.8490, test_loss: 0.9988, test_f1: 0.5290
 epoch: 9, train_loss: 0.8286, test_loss: 0.9171, test_f1: 0.5389
 epoch: 10, train_loss: 0.8276, test_loss: 1.0620, test_f1: 0.5432
 epoch: 11, train_loss: 0.8100, test_loss: 1.0112, test_f1: 0.5872
 epoch: 12, train_loss: 0.7813, test_loss: 1.0745, test_f1: 0.5709
 epoch: 13, train_loss: 0.7861, test_loss: 1.0198, test_f1: 0.5844
 epoch: 14, train_loss: 0.7792, test_loss: 1.0320, test_f1: 0.5982
 epoch: 15, train_loss: 0.7607, test_loss: 0.9019, test_f1: 0.5901
 epoch: 16, train_loss: 0.7404, test_loss: 0.9383, test_f1: 0.5770
 epoch: 17, train_loss: 0.7230, test_loss: 1.1820, test_f1: 0.5562
 epoch: 18, train_loss: 0.7013, test_loss: 0.9405, test_f1: 0.6194
 epoch: 19, train_loss: 0.6925, test_loss: 1.1922, test_f1: 0.5299
 epoch: 20, train_loss: 0.7033, test_loss: 0.9015, test_f1: 0.5919
 epoch: 21, train_loss: 0.7000, test_loss: 1.0084, test_f1: 0.5898
 epoch: 22, train_loss: 0.6823, test_loss: 1.5185, test_f1: 0.4822
 epoch: 23, train_loss: 0.6796, test_loss: 1.1404, test_f1: 0.6277
 epoch: 24, train_loss: 0.6597, test_loss: 0.9564, test_f1: 0.6240
 epoch: 25, train_loss: 0.6614, test_loss: 1.0949, test_f1: 0.6088
 epoch: 26, train_loss: 0.6782, test_loss: 1.1290, test_f1: 0.6283
 epoch: 27, train_loss: 0.6528, test_loss: 0.9491, test_f1: 0.6463
 epoch: 28, train_loss: 0.6467, test_loss: 1.0455, test_f1: 0.6182
 epoch: 29, train_loss: 0.6300, test_loss: 1.0417, test_f1: 0.6080
 epoch: 30, train_loss: 0.6105, test_loss: 1.1987, test_f1: 0.6289
 epoch: 31, train_loss: 0.6199, test_loss: 1.0788, test_f1: 0.6348
 epoch: 32, train_loss: 0.6183, test_loss: 0.9611, test_f1: 0.6433
 epoch: 33, train_loss: 0.6121, test_loss: 1.1367, test_f1: 0.6049
 epoch: 34, train_loss: 0.5959, test_loss: 1.0838, test_f1: 0.5997
 epoch: 35, train_loss: 0.5756, test_loss: 1.0951, test_f1: 0.6122
 epoch: 36, train_loss: 0.5683, test_loss: 1.0118, test_f1: 0.6359
 epoch: 37, train_loss: 0.5762, test_loss: 1.2603, test_f1: 0.6390
 epoch: 38, train_loss: 0.5712, test_loss: 1.2884, test_f1: 0.5961
 epoch: 39, train_loss: 0.5815, test_loss: 1.1304, test_f1: 0.6388
 epoch: 40, train_loss: 0.5515, test_loss: 1.1131, test_f1: 0.6575
 epoch: 41, train_loss: 0.5434, test_loss: 1.2086, test_f1: 0.6341
 epoch: 42, train_loss: 0.5416, test_loss: 1.0269, test_f1: 0.6418
 epoch: 43, train_loss: 0.5599, test_loss: 1.0360, test_f1: 0.6648
 epoch: 44, train_loss: 0.5413, test_loss: 1.3457, test_f1: 0.6527
 epoch: 45, train_loss: 0.5380, test_loss: 1.2768, test_f1: 0.6461
 epoch: 46, train_loss: 0.5051, test_loss: 1.1506, test_f1: 0.6387
 epoch: 47, train_loss: 0.5175, test_loss: 1.4601, test_f1: 0.6016
 epoch: 48, train_loss: 0.5161, test_loss: 1.1812, test_f1: 0.6885
 epoch: 49, train_loss: 0.4977, test_loss: 1.3609, test_f1: 0.6026
 epoch: 50, train_loss: 0.5055, test_loss: 1.2561, test_f1: 0.6557
 epoch: 51, train_loss: 0.4792, test_loss: 1.3186, test_f1: 0.6192
 epoch: 52, train_loss: 0.4587, test_loss: 1.1937, test_f1: 0.6291
 epoch: 53, train_loss: 0.4360, test_loss: 1.2153, test_f1: 0.6350
 epoch: 54, train_loss: 0.4290, test_loss: 1.3511, test_f1: 0.6384
 epoch: 55, train_loss: 0.4211, test_loss: 1.4041, test_f1: 0.6579
 epoch: 56, train_loss: 0.4128, test_loss: 1.3613, test_f1: 0.6636
 epoch: 57, train_loss: 0.4275, test_loss: 1.4034, test_f1: 0.6333
 epoch: 58, train_loss: 0.4330, test_loss: 1.4720, test_f1: 0.6511
 epoch: 59, train_loss: 0.3974, test_loss: 1.5443, test_f1: 0.6695
 epoch: 60, train_loss: 0.4179, test_loss: 1.4876, test_f1: 0.6439
 epoch: 61, train_loss: 0.3965, test_loss: 1.4887, test_f1: 0.6361
 epoch: 62, train_loss: 0.3983, test_loss: 1.4238, test_f1: 0.6491
 epoch: 63, train_loss: 0.3928, test_loss: 1.3930, test_f1: 0.6643
 epoch: 64, train_loss: 0.3919, test_loss: 1.4108, test_f1: 0.6626
 epoch: 65, train_loss: 0.3985, test_loss: 1.4400, test_f1: 0.6447
 epoch: 66, train_loss: 0.3890, test_loss: 1.6184, test_f1: 0.6608
 epoch: 67, train_loss: 0.3807, test_loss: 1.4715, test_f1: 0.6627
 epoch: 68, train_loss: 0.3912, test_loss: 1.5543, test_f1: 0.6591
 epoch: 69, train_loss: 0.3789, test_loss: 1.4945, test_f1: 0.6606
 epoch: 70, train_loss: 0.3635, test_loss: 1.5519, test_f1: 0.6737
 epoch: 71, train_loss: 0.3862, test_loss: 1.5869, test_f1: 0.6257
 epoch: 72, train_loss: 0.3557, test_loss: 1.5297, test_f1: 0.6729
 epoch: 73, train_loss: 0.3556, test_loss: 1.5673, test_f1: 0.6653
 epoch: 74, train_loss: 0.3936, test_loss: 1.6788, test_f1: 0.6584
 epoch: 75, train_loss: 0.3768, test_loss: 1.5218, test_f1: 0.6847
 epoch: 76, train_loss: 0.3766, test_loss: 1.7608, test_f1: 0.6523
 epoch: 77, train_loss: 0.3549, test_loss: 1.8015, test_f1: 0.6372
 epoch: 78, train_loss: 0.3656, test_loss: 1.6262, test_f1: 0.6588
 epoch: 79, train_loss: 0.3805, test_loss: 1.6694, test_f1: 0.6625
 epoch: 80, train_loss: 0.3633, test_loss: 1.5243, test_f1: 0.6620
 epoch: 81, train_loss: 0.3439, test_loss: 1.6127, test_f1: 0.6372
 epoch: 82, train_loss: 0.3728, test_loss: 1.6128, test_f1: 0.6484
 epoch: 83, train_loss: 0.3513, test_loss: 1.5362, test_f1: 0.6363
 epoch: 84, train_loss: 0.3328, test_loss: 1.5602, test_f1: 0.6689
 epoch: 85, train_loss: 0.3570, test_loss: 1.7013, test_f1: 0.6470
 epoch: 86, train_loss: 0.3579, test_loss: 1.5804, test_f1: 0.6705
 epoch: 87, train_loss: 0.3606, test_loss: 1.5841, test_f1: 0.6467
 epoch: 88, train_loss: 0.3362, test_loss: 1.7006, test_f1: 0.6564
 epoch: 89, train_loss: 0.3443, test_loss: 1.6675, test_f1: 0.6653
 epoch: 90, train_loss: 0.3413, test_loss: 1.6763, test_f1: 0.6473
 epoch: 91, train_loss: 0.3345, test_loss: 1.6786, test_f1: 0.6581
 epoch: 92, train_loss: 0.3205, test_loss: 1.8806, test_f1: 0.6302
 epoch: 93, train_loss: 0.3170, test_loss: 1.7375, test_f1: 0.6617
 epoch: 94, train_loss: 0.3217, test_loss: 1.6480, test_f1: 0.6386
 epoch: 95, train_loss: 0.3367, test_loss: 1.6612, test_f1: 0.6589
 epoch: 96, train_loss: 0.3400, test_loss: 1.6294, test_f1: 0.6596
 epoch: 97, train_loss: 0.3209, test_loss: 1.8356, test_f1: 0.6387
 epoch: 98, train_loss: 0.3144, test_loss: 1.8318, test_f1: 0.6530
 epoch: 99, train_loss: 0.3391, test_loss: 1.8474, test_f1: 0.6302
##################ITERATION #9 ****************************************
 epoch: 0, train_loss: 1.5785, test_loss: 1.3636, test_f1: 0.2392
 epoch: 1, train_loss: 1.0219, test_loss: 1.0963, test_f1: 0.3694
 epoch: 2, train_loss: 0.9686, test_loss: 0.9927, test_f1: 0.4754
 epoch: 3, train_loss: 0.9512, test_loss: 0.9449, test_f1: 0.5053
 epoch: 4, train_loss: 0.9296, test_loss: 0.9234, test_f1: 0.5084
 epoch: 5, train_loss: 0.9049, test_loss: 0.9116, test_f1: 0.5141
 epoch: 6, train_loss: 0.8891, test_loss: 0.9084, test_f1: 0.5198
 epoch: 7, train_loss: 0.8704, test_loss: 0.9247, test_f1: 0.5219
 epoch: 8, train_loss: 0.8519, test_loss: 0.9450, test_f1: 0.5350
 epoch: 9, train_loss: 0.8534, test_loss: 0.9198, test_f1: 0.5715
 epoch: 10, train_loss: 0.8416, test_loss: 1.0263, test_f1: 0.5024
 epoch: 11, train_loss: 0.8204, test_loss: 0.9537, test_f1: 0.5124
 epoch: 12, train_loss: 0.8225, test_loss: 0.9858, test_f1: 0.5081
 epoch: 13, train_loss: 0.8023, test_loss: 0.8555, test_f1: 0.6156
 epoch: 14, train_loss: 0.7909, test_loss: 1.1023, test_f1: 0.4336
 epoch: 15, train_loss: 0.7770, test_loss: 0.8536, test_f1: 0.6021
 epoch: 16, train_loss: 0.7676, test_loss: 0.8866, test_f1: 0.5848
 epoch: 17, train_loss: 0.7495, test_loss: 0.9878, test_f1: 0.5837
 epoch: 18, train_loss: 0.7358, test_loss: 1.1899, test_f1: 0.5225
 epoch: 19, train_loss: 0.7224, test_loss: 0.9921, test_f1: 0.5810
 epoch: 20, train_loss: 0.7228, test_loss: 1.1056, test_f1: 0.5607
 epoch: 21, train_loss: 0.7017, test_loss: 0.8833, test_f1: 0.6079
 epoch: 22, train_loss: 0.7061, test_loss: 0.9823, test_f1: 0.5885
 epoch: 23, train_loss: 0.6972, test_loss: 1.0726, test_f1: 0.5510
 epoch: 24, train_loss: 0.6746, test_loss: 1.4287, test_f1: 0.5109
 epoch: 25, train_loss: 0.6809, test_loss: 0.9837, test_f1: 0.6264
 epoch: 26, train_loss: 0.6725, test_loss: 1.0516, test_f1: 0.5941
 epoch: 27, train_loss: 0.7033, test_loss: 1.0772, test_f1: 0.5996
 epoch: 28, train_loss: 0.6836, test_loss: 0.9749, test_f1: 0.6097
 epoch: 29, train_loss: 0.6521, test_loss: 1.0097, test_f1: 0.6285
 epoch: 30, train_loss: 0.6525, test_loss: 1.0466, test_f1: 0.5972
 epoch: 31, train_loss: 0.6622, test_loss: 1.0409, test_f1: 0.5992
 epoch: 32, train_loss: 0.6550, test_loss: 0.9546, test_f1: 0.6084
 epoch: 33, train_loss: 0.6167, test_loss: 0.9715, test_f1: 0.6289
 epoch: 34, train_loss: 0.5954, test_loss: 1.0531, test_f1: 0.6595
 epoch: 35, train_loss: 0.6204, test_loss: 1.1282, test_f1: 0.6211
 epoch: 36, train_loss: 0.6193, test_loss: 1.0512, test_f1: 0.6475
 epoch: 37, train_loss: 0.6249, test_loss: 1.1053, test_f1: 0.6286
 epoch: 38, train_loss: 0.5919, test_loss: 1.6670, test_f1: 0.5387
 epoch: 39, train_loss: 0.5959, test_loss: 0.8721, test_f1: 0.6568
 epoch: 40, train_loss: 0.6137, test_loss: 1.1879, test_f1: 0.5504
 epoch: 41, train_loss: 0.6279, test_loss: 0.9943, test_f1: 0.6460
 epoch: 42, train_loss: 0.5812, test_loss: 1.0893, test_f1: 0.6470
 epoch: 43, train_loss: 0.5589, test_loss: 1.0647, test_f1: 0.6374
 epoch: 44, train_loss: 0.5572, test_loss: 1.3133, test_f1: 0.6131
 epoch: 45, train_loss: 0.5383, test_loss: 1.3206, test_f1: 0.5969
 epoch: 46, train_loss: 0.5551, test_loss: 1.2340, test_f1: 0.6294
 epoch: 47, train_loss: 0.5734, test_loss: 1.4619, test_f1: 0.5702
 epoch: 48, train_loss: 0.5473, test_loss: 1.1978, test_f1: 0.6750
 epoch: 49, train_loss: 0.5283, test_loss: 1.1637, test_f1: 0.6656
 epoch: 50, train_loss: 0.5462, test_loss: 1.1709, test_f1: 0.6468
 epoch: 51, train_loss: 0.5183, test_loss: 1.1969, test_f1: 0.6748
 epoch: 52, train_loss: 0.4899, test_loss: 1.3064, test_f1: 0.6571
 epoch: 53, train_loss: 0.4593, test_loss: 1.1934, test_f1: 0.6689
 epoch: 54, train_loss: 0.4824, test_loss: 1.2539, test_f1: 0.6747
 epoch: 55, train_loss: 0.4470, test_loss: 1.1996, test_f1: 0.6844
 epoch: 56, train_loss: 0.4490, test_loss: 1.2628, test_f1: 0.6787
 epoch: 57, train_loss: 0.4588, test_loss: 1.3464, test_f1: 0.6818
 epoch: 58, train_loss: 0.4560, test_loss: 1.3690, test_f1: 0.6737
 epoch: 59, train_loss: 0.4446, test_loss: 1.3197, test_f1: 0.6690
 epoch: 60, train_loss: 0.4228, test_loss: 1.2815, test_f1: 0.6828
 epoch: 61, train_loss: 0.4420, test_loss: 1.3259, test_f1: 0.6702
 epoch: 62, train_loss: 0.4128, test_loss: 1.4276, test_f1: 0.6646
 epoch: 63, train_loss: 0.4240, test_loss: 1.6233, test_f1: 0.6292
 epoch: 64, train_loss: 0.4150, test_loss: 1.4362, test_f1: 0.6504
 epoch: 65, train_loss: 0.3987, test_loss: 1.3931, test_f1: 0.6582
 epoch: 66, train_loss: 0.4353, test_loss: 1.4085, test_f1: 0.6690
 epoch: 67, train_loss: 0.4162, test_loss: 1.3126, test_f1: 0.6732
 epoch: 68, train_loss: 0.4101, test_loss: 1.6384, test_f1: 0.6379
 epoch: 69, train_loss: 0.4134, test_loss: 1.6367, test_f1: 0.6617
 epoch: 70, train_loss: 0.3803, test_loss: 1.4253, test_f1: 0.6865
 epoch: 71, train_loss: 0.3928, test_loss: 1.4268, test_f1: 0.6735
 epoch: 72, train_loss: 0.4016, test_loss: 1.3856, test_f1: 0.6663
 epoch: 73, train_loss: 0.4197, test_loss: 1.3976, test_f1: 0.6671
 epoch: 74, train_loss: 0.4121, test_loss: 1.4843, test_f1: 0.6673
 epoch: 75, train_loss: 0.4034, test_loss: 1.4503, test_f1: 0.6473
 epoch: 76, train_loss: 0.3952, test_loss: 1.4758, test_f1: 0.6465
 epoch: 77, train_loss: 0.4051, test_loss: 1.4667, test_f1: 0.6750
 epoch: 78, train_loss: 0.3952, test_loss: 1.5494, test_f1: 0.6652
 epoch: 79, train_loss: 0.3643, test_loss: 1.5395, test_f1: 0.6744
 epoch: 80, train_loss: 0.3662, test_loss: 1.5705, test_f1: 0.6652
 epoch: 81, train_loss: 0.3691, test_loss: 1.4945, test_f1: 0.6691
 epoch: 82, train_loss: 0.3673, test_loss: 1.6589, test_f1: 0.6215
 epoch: 83, train_loss: 0.4010, test_loss: 1.4585, test_f1: 0.6986
 epoch: 84, train_loss: 0.3726, test_loss: 1.5628, test_f1: 0.6388
 epoch: 85, train_loss: 0.3586, test_loss: 1.5603, test_f1: 0.6297
 epoch: 86, train_loss: 0.3804, test_loss: 1.6491, test_f1: 0.6605
 epoch: 87, train_loss: 0.3555, test_loss: 1.7333, test_f1: 0.6493
 epoch: 88, train_loss: 0.3535, test_loss: 1.6204, test_f1: 0.6528
 epoch: 89, train_loss: 0.3783, test_loss: 1.6504, test_f1: 0.6603
 epoch: 90, train_loss: 0.3440, test_loss: 1.8108, test_f1: 0.6422
 epoch: 91, train_loss: 0.3401, test_loss: 1.9138, test_f1: 0.6337
 epoch: 92, train_loss: 0.3406, test_loss: 1.8696, test_f1: 0.6374
 epoch: 93, train_loss: 0.3847, test_loss: 1.6092, test_f1: 0.6696
 epoch: 94, train_loss: 0.3519, test_loss: 1.5181, test_f1: 0.6794
 epoch: 95, train_loss: 0.3380, test_loss: 1.8426, test_f1: 0.6560
 epoch: 96, train_loss: 0.3345, test_loss: 1.8564, test_f1: 0.6538
 epoch: 97, train_loss: 0.3424, test_loss: 1.9467, test_f1: 0.6445
 epoch: 98, train_loss: 0.3306, test_loss: 1.8172, test_f1: 0.6840
 epoch: 99, train_loss: 0.3037, test_loss: 1.7955, test_f1: 0.6864

Training completed in 406.02 seconds
Best F1: 0.7026 at epoch 84
Mean F1 across iterations: 0.6852  0.0102
========================FINAL RESULTS================================
FEGIN weighted F1: 0.7026  0.0102
python main.py --data ltspice_examples --representation component_pin_net --model FEGIN --layers 2 --hiddens 64 --batch_size 256 --lr 0.01 --emb_size 128 --epochs 100 --save_appendix component_pin_net_L2_H64_BS256_LR0.01_E128 --no_val
-----



STDERR:
  File "main.py", line 370, in <module>
    main()
  File "main.py", line 254, in main
    dataset = dataset_class(
  File "/home/philip/projects/ltspice_examples_code_repo/Circuit-Completion-Using-GNNs/component_classification_with_link_prediction_head/evaluation/FEGIN/kernel/circuit_datasets.py", line 15, in __init__
    self.data, self.slices = torch.load(self.processed_paths[0])
  File "/home/philip/.local/lib/python3.8/site-packages/torch/serialization.py", line 1040, in load
    warnings.warn(
  File "/usr/lib/python3.8/warnings.py", line 109, in _showwarnmsg
    sw(msg.message, msg.category, msg.filename, msg.lineno,
  File "main.py", line 47, in warn_with_traceback
    traceback.print_stack(file=log)
/home/philip/projects/ltspice_examples_code_repo/Circuit-Completion-Using-GNNs/component_classification_with_link_prediction_head/evaluation/FEGIN/kernel/circuit_datasets.py:15: FutureWarning: You are using `torch.load` with `weights_only=False` (the current default value), which uses the default pickle module implicitly. It is possible to construct malicious pickle data which will execute arbitrary code during unpickling (See https://github.com/pytorch/pytorch/blob/main/SECURITY.md#untrusted-models for more details). In a future release, the default value for `weights_only` will be flipped to `True`. This limits the functions that could be executed during unpickling. Arbitrary objects will no longer be allowed to be loaded via this mode unless they are explicitly allowlisted by the user via `torch.serialization.add_safe_globals`. We recommend you start setting `weights_only=True` for any use case where you don't have full control of the loaded file. Please open an issue on GitHub for any issues related to this experimental feature.
  self.data, self.slices = torch.load(self.processed_paths[0])
