STDOUT:
Results will be saved in /home/philip/projects/llm_inference_code_repo/Circuit-Completion-Using-GNNs/component_classification_with_link_prediction_head/evaluation/FEGIN/results/model_FEGIN_dataset_ltspice_examples
Command line input: python main.py --data ltspice_examples --representation component_net --model FEGIN --layers 4 --hiddens 32 --batch_size 256 --lr 0.0001 --emb_size 128 --epochs 100 --save_appendix component_net_L4_H32_BS256_LR0.0001_E128 --no_val
 is saved.
-----
ltspice_examples - FEGIN
Using 4 layers, 32 hidden units, h = 2
Loading component_net representation dataset
ENTERED
Training FEGIN on component_net representation
Train: 3558, Test: 846
##################ITERATION #0 ****************************************
 epoch: 0, train_loss: 1.3595, test_loss: 1.3610, test_f1: 0.2270
 epoch: 1, train_loss: 1.3549, test_loss: 1.3595, test_f1: 0.2270
 epoch: 2, train_loss: 1.3529, test_loss: 1.3583, test_f1: 0.2270
 epoch: 3, train_loss: 1.3504, test_loss: 1.3554, test_f1: 0.2270
 epoch: 4, train_loss: 1.3480, test_loss: 1.3520, test_f1: 0.2270
 epoch: 5, train_loss: 1.3454, test_loss: 1.3485, test_f1: 0.2270
 epoch: 6, train_loss: 1.3430, test_loss: 1.3451, test_f1: 0.2270
 epoch: 7, train_loss: 1.3394, test_loss: 1.3421, test_f1: 0.2270
 epoch: 8, train_loss: 1.3368, test_loss: 1.3390, test_f1: 0.2270
 epoch: 9, train_loss: 1.3334, test_loss: 1.3358, test_f1: 0.2270
 epoch: 10, train_loss: 1.3308, test_loss: 1.3326, test_f1: 0.2270
 epoch: 11, train_loss: 1.3270, test_loss: 1.3295, test_f1: 0.2270
 epoch: 12, train_loss: 1.3233, test_loss: 1.3265, test_f1: 0.2270
 epoch: 13, train_loss: 1.3192, test_loss: 1.3233, test_f1: 0.2270
 epoch: 14, train_loss: 1.3150, test_loss: 1.3194, test_f1: 0.2270
 epoch: 15, train_loss: 1.3121, test_loss: 1.3158, test_f1: 0.2270
 epoch: 16, train_loss: 1.3063, test_loss: 1.3125, test_f1: 0.2270
 epoch: 17, train_loss: 1.3034, test_loss: 1.3087, test_f1: 0.2270
 epoch: 18, train_loss: 1.2986, test_loss: 1.3044, test_f1: 0.2270
 epoch: 19, train_loss: 1.2938, test_loss: 1.2986, test_f1: 0.2270
 epoch: 20, train_loss: 1.2875, test_loss: 1.2957, test_f1: 0.2270
 epoch: 21, train_loss: 1.2841, test_loss: 1.2919, test_f1: 0.2270
 epoch: 22, train_loss: 1.2823, test_loss: 1.2874, test_f1: 0.2270
 epoch: 23, train_loss: 1.2773, test_loss: 1.2842, test_f1: 0.2370
 epoch: 24, train_loss: 1.2719, test_loss: 1.2810, test_f1: 0.2396
 epoch: 25, train_loss: 1.2699, test_loss: 1.2754, test_f1: 0.2446
 epoch: 26, train_loss: 1.2633, test_loss: 1.2723, test_f1: 0.2610
 epoch: 27, train_loss: 1.2626, test_loss: 1.2681, test_f1: 0.2763
 epoch: 28, train_loss: 1.2548, test_loss: 1.2620, test_f1: 0.2832
 epoch: 29, train_loss: 1.2516, test_loss: 1.2574, test_f1: 0.2943
 epoch: 30, train_loss: 1.2487, test_loss: 1.2519, test_f1: 0.3074
 epoch: 31, train_loss: 1.2397, test_loss: 1.2477, test_f1: 0.3175
 epoch: 32, train_loss: 1.2370, test_loss: 1.2401, test_f1: 0.3239
 epoch: 33, train_loss: 1.2314, test_loss: 1.2346, test_f1: 0.3278
 epoch: 34, train_loss: 1.2261, test_loss: 1.2302, test_f1: 0.3301
 epoch: 35, train_loss: 1.2239, test_loss: 1.2226, test_f1: 0.3383
 epoch: 36, train_loss: 1.2108, test_loss: 1.2165, test_f1: 0.3538
 epoch: 37, train_loss: 1.2082, test_loss: 1.2100, test_f1: 0.3628
 epoch: 38, train_loss: 1.2053, test_loss: 1.2020, test_f1: 0.3791
 epoch: 39, train_loss: 1.1985, test_loss: 1.1947, test_f1: 0.3860
 epoch: 40, train_loss: 1.1924, test_loss: 1.1880, test_f1: 0.4141
 epoch: 41, train_loss: 1.1871, test_loss: 1.1802, test_f1: 0.4171
 epoch: 42, train_loss: 1.1790, test_loss: 1.1731, test_f1: 0.4352
 epoch: 43, train_loss: 1.1710, test_loss: 1.1671, test_f1: 0.4299
 epoch: 44, train_loss: 1.1717, test_loss: 1.1586, test_f1: 0.4379
 epoch: 45, train_loss: 1.1663, test_loss: 1.1531, test_f1: 0.4378
 epoch: 46, train_loss: 1.1588, test_loss: 1.1463, test_f1: 0.4470
 epoch: 47, train_loss: 1.1496, test_loss: 1.1394, test_f1: 0.4571
 epoch: 48, train_loss: 1.1444, test_loss: 1.1335, test_f1: 0.4500
 epoch: 49, train_loss: 1.1425, test_loss: 1.1277, test_f1: 0.4568
 epoch: 50, train_loss: 1.1300, test_loss: 1.1213, test_f1: 0.4722
 epoch: 51, train_loss: 1.1304, test_loss: 1.1176, test_f1: 0.4647
 epoch: 52, train_loss: 1.1242, test_loss: 1.1149, test_f1: 0.4656
 epoch: 53, train_loss: 1.1233, test_loss: 1.1113, test_f1: 0.4633
 epoch: 54, train_loss: 1.1225, test_loss: 1.1067, test_f1: 0.4616
 epoch: 55, train_loss: 1.1166, test_loss: 1.1046, test_f1: 0.4692
 epoch: 56, train_loss: 1.1137, test_loss: 1.1018, test_f1: 0.4705
 epoch: 57, train_loss: 1.1105, test_loss: 1.0981, test_f1: 0.4725
 epoch: 58, train_loss: 1.1150, test_loss: 1.0960, test_f1: 0.4746
 epoch: 59, train_loss: 1.1080, test_loss: 1.0938, test_f1: 0.4668
 epoch: 60, train_loss: 1.1037, test_loss: 1.0927, test_f1: 0.4722
 epoch: 61, train_loss: 1.1011, test_loss: 1.0885, test_f1: 0.4738
 epoch: 62, train_loss: 1.1022, test_loss: 1.0856, test_f1: 0.4756
 epoch: 63, train_loss: 1.1009, test_loss: 1.0842, test_f1: 0.4794
 epoch: 64, train_loss: 1.0913, test_loss: 1.0805, test_f1: 0.4736
 epoch: 65, train_loss: 1.0932, test_loss: 1.0784, test_f1: 0.4749
 epoch: 66, train_loss: 1.0924, test_loss: 1.0764, test_f1: 0.4791
 epoch: 67, train_loss: 1.0874, test_loss: 1.0752, test_f1: 0.4835
 epoch: 68, train_loss: 1.0780, test_loss: 1.0724, test_f1: 0.4799
 epoch: 69, train_loss: 1.0858, test_loss: 1.0694, test_f1: 0.4857
 epoch: 70, train_loss: 1.0820, test_loss: 1.0666, test_f1: 0.4853
 epoch: 71, train_loss: 1.0790, test_loss: 1.0660, test_f1: 0.4835
 epoch: 72, train_loss: 1.0721, test_loss: 1.0648, test_f1: 0.4838
 epoch: 73, train_loss: 1.0777, test_loss: 1.0606, test_f1: 0.4832
 epoch: 74, train_loss: 1.0740, test_loss: 1.0574, test_f1: 0.4834
 epoch: 75, train_loss: 1.0775, test_loss: 1.0561, test_f1: 0.4844
 epoch: 76, train_loss: 1.0657, test_loss: 1.0527, test_f1: 0.4839
 epoch: 77, train_loss: 1.0645, test_loss: 1.0518, test_f1: 0.4878
 epoch: 78, train_loss: 1.0633, test_loss: 1.0486, test_f1: 0.4879
 epoch: 79, train_loss: 1.0608, test_loss: 1.0478, test_f1: 0.4900
 epoch: 80, train_loss: 1.0631, test_loss: 1.0445, test_f1: 0.4938
 epoch: 81, train_loss: 1.0606, test_loss: 1.0436, test_f1: 0.4958
 epoch: 82, train_loss: 1.0551, test_loss: 1.0447, test_f1: 0.4903
 epoch: 83, train_loss: 1.0572, test_loss: 1.0401, test_f1: 0.5005
 epoch: 84, train_loss: 1.0586, test_loss: 1.0406, test_f1: 0.4934
 epoch: 85, train_loss: 1.0499, test_loss: 1.0363, test_f1: 0.4978
 epoch: 86, train_loss: 1.0489, test_loss: 1.0360, test_f1: 0.4907
 epoch: 87, train_loss: 1.0462, test_loss: 1.0335, test_f1: 0.5004
 epoch: 88, train_loss: 1.0404, test_loss: 1.0300, test_f1: 0.4968
 epoch: 89, train_loss: 1.0453, test_loss: 1.0281, test_f1: 0.5006
 epoch: 90, train_loss: 1.0432, test_loss: 1.0273, test_f1: 0.4911
 epoch: 91, train_loss: 1.0375, test_loss: 1.0232, test_f1: 0.5003
 epoch: 92, train_loss: 1.0355, test_loss: 1.0234, test_f1: 0.4968
 epoch: 93, train_loss: 1.0392, test_loss: 1.0238, test_f1: 0.4912
 epoch: 94, train_loss: 1.0294, test_loss: 1.0180, test_f1: 0.4932
 epoch: 95, train_loss: 1.0246, test_loss: 1.0152, test_f1: 0.4965
 epoch: 96, train_loss: 1.0205, test_loss: 1.0176, test_f1: 0.4920
 epoch: 97, train_loss: 1.0270, test_loss: 1.0146, test_f1: 0.4921
 epoch: 98, train_loss: 1.0213, test_loss: 1.0113, test_f1: 0.4961
 epoch: 99, train_loss: 1.0228, test_loss: 1.0101, test_f1: 0.4989
##################ITERATION #1 ****************************************
 epoch: 0, train_loss: 1.3331, test_loss: 1.3410, test_f1: 0.2270
 epoch: 1, train_loss: 1.3255, test_loss: 1.3381, test_f1: 0.2270
 epoch: 2, train_loss: 1.3212, test_loss: 1.3328, test_f1: 0.2270
 epoch: 3, train_loss: 1.3158, test_loss: 1.3226, test_f1: 0.2270
 epoch: 4, train_loss: 1.3108, test_loss: 1.3118, test_f1: 0.2270
 epoch: 5, train_loss: 1.3058, test_loss: 1.3027, test_f1: 0.2270
 epoch: 6, train_loss: 1.2992, test_loss: 1.2960, test_f1: 0.2270
 epoch: 7, train_loss: 1.2947, test_loss: 1.2911, test_f1: 0.2270
 epoch: 8, train_loss: 1.2881, test_loss: 1.2851, test_f1: 0.2270
 epoch: 9, train_loss: 1.2817, test_loss: 1.2794, test_f1: 0.2270
 epoch: 10, train_loss: 1.2764, test_loss: 1.2733, test_f1: 0.2270
 epoch: 11, train_loss: 1.2696, test_loss: 1.2669, test_f1: 0.2270
 epoch: 12, train_loss: 1.2666, test_loss: 1.2600, test_f1: 0.2270
 epoch: 13, train_loss: 1.2595, test_loss: 1.2538, test_f1: 0.2270
 epoch: 14, train_loss: 1.2507, test_loss: 1.2469, test_f1: 0.2320
 epoch: 15, train_loss: 1.2476, test_loss: 1.2396, test_f1: 0.2514
 epoch: 16, train_loss: 1.2407, test_loss: 1.2332, test_f1: 0.2786
 epoch: 17, train_loss: 1.2339, test_loss: 1.2259, test_f1: 0.2971
 epoch: 18, train_loss: 1.2301, test_loss: 1.2194, test_f1: 0.3178
 epoch: 19, train_loss: 1.2214, test_loss: 1.2130, test_f1: 0.3274
 epoch: 20, train_loss: 1.2198, test_loss: 1.2085, test_f1: 0.3462
 epoch: 21, train_loss: 1.2103, test_loss: 1.2013, test_f1: 0.3542
 epoch: 22, train_loss: 1.2046, test_loss: 1.1941, test_f1: 0.3648
 epoch: 23, train_loss: 1.1994, test_loss: 1.1896, test_f1: 0.3624
 epoch: 24, train_loss: 1.1960, test_loss: 1.1820, test_f1: 0.3691
 epoch: 25, train_loss: 1.1854, test_loss: 1.1742, test_f1: 0.3715
 epoch: 26, train_loss: 1.1813, test_loss: 1.1671, test_f1: 0.3868
 epoch: 27, train_loss: 1.1760, test_loss: 1.1610, test_f1: 0.3875
 epoch: 28, train_loss: 1.1669, test_loss: 1.1543, test_f1: 0.3971
 epoch: 29, train_loss: 1.1634, test_loss: 1.1486, test_f1: 0.4045
 epoch: 30, train_loss: 1.1577, test_loss: 1.1426, test_f1: 0.4108
 epoch: 31, train_loss: 1.1585, test_loss: 1.1358, test_f1: 0.4167
 epoch: 32, train_loss: 1.1443, test_loss: 1.1325, test_f1: 0.4220
 epoch: 33, train_loss: 1.1416, test_loss: 1.1240, test_f1: 0.4301
 epoch: 34, train_loss: 1.1324, test_loss: 1.1165, test_f1: 0.4339
 epoch: 35, train_loss: 1.1261, test_loss: 1.1128, test_f1: 0.4324
 epoch: 36, train_loss: 1.1222, test_loss: 1.1081, test_f1: 0.4475
 epoch: 37, train_loss: 1.1166, test_loss: 1.0987, test_f1: 0.4468
 epoch: 38, train_loss: 1.1126, test_loss: 1.0932, test_f1: 0.4458
 epoch: 39, train_loss: 1.1121, test_loss: 1.0876, test_f1: 0.4530
 epoch: 40, train_loss: 1.1006, test_loss: 1.0834, test_f1: 0.4552
 epoch: 41, train_loss: 1.0933, test_loss: 1.0766, test_f1: 0.4541
 epoch: 42, train_loss: 1.0971, test_loss: 1.0718, test_f1: 0.4577
 epoch: 43, train_loss: 1.0860, test_loss: 1.0707, test_f1: 0.4595
 epoch: 44, train_loss: 1.0890, test_loss: 1.0631, test_f1: 0.4765
 epoch: 45, train_loss: 1.0784, test_loss: 1.0587, test_f1: 0.4722
 epoch: 46, train_loss: 1.0706, test_loss: 1.0539, test_f1: 0.4849
 epoch: 47, train_loss: 1.0703, test_loss: 1.0501, test_f1: 0.4851
 epoch: 48, train_loss: 1.0647, test_loss: 1.0431, test_f1: 0.4848
 epoch: 49, train_loss: 1.0639, test_loss: 1.0375, test_f1: 0.4876
 epoch: 50, train_loss: 1.0552, test_loss: 1.0369, test_f1: 0.4913
 epoch: 51, train_loss: 1.0561, test_loss: 1.0323, test_f1: 0.4946
 epoch: 52, train_loss: 1.0471, test_loss: 1.0286, test_f1: 0.4938
 epoch: 53, train_loss: 1.0422, test_loss: 1.0270, test_f1: 0.4961
 epoch: 54, train_loss: 1.0382, test_loss: 1.0260, test_f1: 0.4960
 epoch: 55, train_loss: 1.0401, test_loss: 1.0269, test_f1: 0.4884
 epoch: 56, train_loss: 1.0350, test_loss: 1.0217, test_f1: 0.4967
 epoch: 57, train_loss: 1.0327, test_loss: 1.0191, test_f1: 0.4934
 epoch: 58, train_loss: 1.0301, test_loss: 1.0153, test_f1: 0.4974
 epoch: 59, train_loss: 1.0360, test_loss: 1.0151, test_f1: 0.4913
 epoch: 60, train_loss: 1.0280, test_loss: 1.0115, test_f1: 0.4920
 epoch: 61, train_loss: 1.0210, test_loss: 1.0118, test_f1: 0.4903
 epoch: 62, train_loss: 1.0237, test_loss: 1.0098, test_f1: 0.4905
 epoch: 63, train_loss: 1.0175, test_loss: 1.0065, test_f1: 0.4936
 epoch: 64, train_loss: 1.0225, test_loss: 1.0042, test_f1: 0.4922
 epoch: 65, train_loss: 1.0166, test_loss: 1.0044, test_f1: 0.4905
 epoch: 66, train_loss: 1.0129, test_loss: 0.9987, test_f1: 0.4896
 epoch: 67, train_loss: 1.0129, test_loss: 0.9996, test_f1: 0.4883
 epoch: 68, train_loss: 1.0150, test_loss: 1.0010, test_f1: 0.4840
 epoch: 69, train_loss: 1.0063, test_loss: 0.9968, test_f1: 0.4895
 epoch: 70, train_loss: 1.0138, test_loss: 0.9956, test_f1: 0.4917
 epoch: 71, train_loss: 1.0032, test_loss: 0.9953, test_f1: 0.4851
 epoch: 72, train_loss: 0.9951, test_loss: 0.9917, test_f1: 0.4930
 epoch: 73, train_loss: 0.9975, test_loss: 0.9887, test_f1: 0.4833
 epoch: 74, train_loss: 1.0036, test_loss: 0.9892, test_f1: 0.4868
 epoch: 75, train_loss: 0.9991, test_loss: 0.9885, test_f1: 0.4837
 epoch: 76, train_loss: 1.0047, test_loss: 0.9864, test_f1: 0.4840
 epoch: 77, train_loss: 0.9962, test_loss: 0.9818, test_f1: 0.4888
 epoch: 78, train_loss: 0.9880, test_loss: 0.9815, test_f1: 0.4908
 epoch: 79, train_loss: 0.9918, test_loss: 0.9809, test_f1: 0.4873
 epoch: 80, train_loss: 0.9876, test_loss: 0.9796, test_f1: 0.4897
 epoch: 81, train_loss: 0.9897, test_loss: 0.9790, test_f1: 0.4859
 epoch: 82, train_loss: 0.9848, test_loss: 0.9803, test_f1: 0.4890
 epoch: 83, train_loss: 0.9813, test_loss: 0.9758, test_f1: 0.4886
 epoch: 84, train_loss: 0.9815, test_loss: 0.9694, test_f1: 0.4911
 epoch: 85, train_loss: 0.9829, test_loss: 0.9706, test_f1: 0.4933
 epoch: 86, train_loss: 0.9865, test_loss: 0.9696, test_f1: 0.4956
 epoch: 87, train_loss: 0.9728, test_loss: 0.9689, test_f1: 0.4926
 epoch: 88, train_loss: 0.9788, test_loss: 0.9658, test_f1: 0.4930
 epoch: 89, train_loss: 0.9696, test_loss: 0.9655, test_f1: 0.4953
 epoch: 90, train_loss: 0.9779, test_loss: 0.9695, test_f1: 0.4917
 epoch: 91, train_loss: 0.9734, test_loss: 0.9648, test_f1: 0.4950
 epoch: 92, train_loss: 0.9642, test_loss: 0.9644, test_f1: 0.4939
 epoch: 93, train_loss: 0.9696, test_loss: 0.9697, test_f1: 0.4942
 epoch: 94, train_loss: 0.9561, test_loss: 0.9634, test_f1: 0.4962
 epoch: 95, train_loss: 0.9606, test_loss: 0.9635, test_f1: 0.4990
 epoch: 96, train_loss: 0.9614, test_loss: 0.9605, test_f1: 0.4954
 epoch: 97, train_loss: 0.9653, test_loss: 0.9559, test_f1: 0.4983
 epoch: 98, train_loss: 0.9576, test_loss: 0.9547, test_f1: 0.4960
 epoch: 99, train_loss: 0.9589, test_loss: 0.9532, test_f1: 0.5018
##################ITERATION #2 ****************************************
 epoch: 0, train_loss: 1.3212, test_loss: 1.3259, test_f1: 0.2270
 epoch: 1, train_loss: 1.3071, test_loss: 1.3243, test_f1: 0.2270
 epoch: 2, train_loss: 1.2973, test_loss: 1.3166, test_f1: 0.2270
 epoch: 3, train_loss: 1.2912, test_loss: 1.3080, test_f1: 0.2270
 epoch: 4, train_loss: 1.2829, test_loss: 1.2918, test_f1: 0.2270
 epoch: 5, train_loss: 1.2757, test_loss: 1.2781, test_f1: 0.2385
 epoch: 6, train_loss: 1.2672, test_loss: 1.2671, test_f1: 0.2551
 epoch: 7, train_loss: 1.2623, test_loss: 1.2556, test_f1: 0.2914
 epoch: 8, train_loss: 1.2519, test_loss: 1.2462, test_f1: 0.3178
 epoch: 9, train_loss: 1.2464, test_loss: 1.2372, test_f1: 0.3315
 epoch: 10, train_loss: 1.2379, test_loss: 1.2294, test_f1: 0.3471
 epoch: 11, train_loss: 1.2299, test_loss: 1.2219, test_f1: 0.3564
 epoch: 12, train_loss: 1.2218, test_loss: 1.2136, test_f1: 0.3673
 epoch: 13, train_loss: 1.2146, test_loss: 1.2052, test_f1: 0.3725
 epoch: 14, train_loss: 1.2064, test_loss: 1.1965, test_f1: 0.3734
 epoch: 15, train_loss: 1.1993, test_loss: 1.1884, test_f1: 0.3733
 epoch: 16, train_loss: 1.1967, test_loss: 1.1800, test_f1: 0.3810
 epoch: 17, train_loss: 1.1907, test_loss: 1.1714, test_f1: 0.3859
 epoch: 18, train_loss: 1.1815, test_loss: 1.1613, test_f1: 0.3877
 epoch: 19, train_loss: 1.1740, test_loss: 1.1510, test_f1: 0.3900
 epoch: 20, train_loss: 1.1657, test_loss: 1.1420, test_f1: 0.3943
 epoch: 21, train_loss: 1.1576, test_loss: 1.1347, test_f1: 0.4020
 epoch: 22, train_loss: 1.1462, test_loss: 1.1242, test_f1: 0.4024
 epoch: 23, train_loss: 1.1392, test_loss: 1.1149, test_f1: 0.4045
 epoch: 24, train_loss: 1.1343, test_loss: 1.1045, test_f1: 0.4107
 epoch: 25, train_loss: 1.1291, test_loss: 1.0970, test_f1: 0.4199
 epoch: 26, train_loss: 1.1184, test_loss: 1.0877, test_f1: 0.4285
 epoch: 27, train_loss: 1.1076, test_loss: 1.0775, test_f1: 0.4305
 epoch: 28, train_loss: 1.1036, test_loss: 1.0690, test_f1: 0.4411
 epoch: 29, train_loss: 1.0944, test_loss: 1.0592, test_f1: 0.4450
 epoch: 30, train_loss: 1.0893, test_loss: 1.0525, test_f1: 0.4502
 epoch: 31, train_loss: 1.0786, test_loss: 1.0443, test_f1: 0.4540
 epoch: 32, train_loss: 1.0695, test_loss: 1.0359, test_f1: 0.4538
 epoch: 33, train_loss: 1.0715, test_loss: 1.0294, test_f1: 0.4585
 epoch: 34, train_loss: 1.0613, test_loss: 1.0246, test_f1: 0.4667
 epoch: 35, train_loss: 1.0600, test_loss: 1.0200, test_f1: 0.4726
 epoch: 36, train_loss: 1.0470, test_loss: 1.0107, test_f1: 0.4725
 epoch: 37, train_loss: 1.0429, test_loss: 1.0074, test_f1: 0.4688
 epoch: 38, train_loss: 1.0369, test_loss: 0.9999, test_f1: 0.4761
 epoch: 39, train_loss: 1.0314, test_loss: 0.9932, test_f1: 0.4781
 epoch: 40, train_loss: 1.0274, test_loss: 0.9900, test_f1: 0.4754
 epoch: 41, train_loss: 1.0149, test_loss: 0.9858, test_f1: 0.4788
 epoch: 42, train_loss: 1.0188, test_loss: 0.9824, test_f1: 0.4808
 epoch: 43, train_loss: 1.0167, test_loss: 0.9804, test_f1: 0.4842
 epoch: 44, train_loss: 1.0067, test_loss: 0.9766, test_f1: 0.4879
 epoch: 45, train_loss: 1.0035, test_loss: 0.9728, test_f1: 0.4877
 epoch: 46, train_loss: 1.0004, test_loss: 0.9715, test_f1: 0.4815
 epoch: 47, train_loss: 0.9928, test_loss: 0.9645, test_f1: 0.4802
 epoch: 48, train_loss: 0.9943, test_loss: 0.9634, test_f1: 0.4743
 epoch: 49, train_loss: 0.9858, test_loss: 0.9599, test_f1: 0.4934
 epoch: 50, train_loss: 0.9834, test_loss: 0.9564, test_f1: 0.4945
 epoch: 51, train_loss: 0.9766, test_loss: 0.9559, test_f1: 0.4935
 epoch: 52, train_loss: 0.9733, test_loss: 0.9552, test_f1: 0.4964
 epoch: 53, train_loss: 0.9739, test_loss: 0.9535, test_f1: 0.4967
 epoch: 54, train_loss: 0.9739, test_loss: 0.9530, test_f1: 0.4976
 epoch: 55, train_loss: 0.9724, test_loss: 0.9499, test_f1: 0.4968
 epoch: 56, train_loss: 0.9695, test_loss: 0.9502, test_f1: 0.4989
 epoch: 57, train_loss: 0.9761, test_loss: 0.9511, test_f1: 0.4964
 epoch: 58, train_loss: 0.9614, test_loss: 0.9491, test_f1: 0.4988
 epoch: 59, train_loss: 0.9676, test_loss: 0.9481, test_f1: 0.4989
 epoch: 60, train_loss: 0.9570, test_loss: 0.9489, test_f1: 0.4966
 epoch: 61, train_loss: 0.9662, test_loss: 0.9454, test_f1: 0.4977
 epoch: 62, train_loss: 0.9646, test_loss: 0.9450, test_f1: 0.4969
 epoch: 63, train_loss: 0.9571, test_loss: 0.9431, test_f1: 0.5000
 epoch: 64, train_loss: 0.9550, test_loss: 0.9434, test_f1: 0.4966
 epoch: 65, train_loss: 0.9581, test_loss: 0.9413, test_f1: 0.5001
 epoch: 66, train_loss: 0.9560, test_loss: 0.9397, test_f1: 0.4996
 epoch: 67, train_loss: 0.9534, test_loss: 0.9394, test_f1: 0.5000
 epoch: 68, train_loss: 0.9544, test_loss: 0.9413, test_f1: 0.4988
 epoch: 69, train_loss: 0.9461, test_loss: 0.9379, test_f1: 0.5011
 epoch: 70, train_loss: 0.9484, test_loss: 0.9386, test_f1: 0.5011
 epoch: 71, train_loss: 0.9501, test_loss: 0.9333, test_f1: 0.5001
 epoch: 72, train_loss: 0.9484, test_loss: 0.9365, test_f1: 0.5032
 epoch: 73, train_loss: 0.9444, test_loss: 0.9355, test_f1: 0.5053
 epoch: 74, train_loss: 0.9464, test_loss: 0.9335, test_f1: 0.5010
 epoch: 75, train_loss: 0.9424, test_loss: 0.9340, test_f1: 0.5039
 epoch: 76, train_loss: 0.9427, test_loss: 0.9354, test_f1: 0.5073
 epoch: 77, train_loss: 0.9368, test_loss: 0.9354, test_f1: 0.5052
 epoch: 78, train_loss: 0.9373, test_loss: 0.9352, test_f1: 0.5041
 epoch: 79, train_loss: 0.9383, test_loss: 0.9364, test_f1: 0.5051
 epoch: 80, train_loss: 0.9325, test_loss: 0.9345, test_f1: 0.5054
 epoch: 81, train_loss: 0.9287, test_loss: 0.9295, test_f1: 0.5086
 epoch: 82, train_loss: 0.9324, test_loss: 0.9287, test_f1: 0.5087
 epoch: 83, train_loss: 0.9294, test_loss: 0.9267, test_f1: 0.5084
 epoch: 84, train_loss: 0.9392, test_loss: 0.9276, test_f1: 0.5077
 epoch: 85, train_loss: 0.9285, test_loss: 0.9282, test_f1: 0.5110
 epoch: 86, train_loss: 0.9220, test_loss: 0.9271, test_f1: 0.5108
 epoch: 87, train_loss: 0.9291, test_loss: 0.9298, test_f1: 0.5097
 epoch: 88, train_loss: 0.9317, test_loss: 0.9269, test_f1: 0.5098
 epoch: 89, train_loss: 0.9281, test_loss: 0.9284, test_f1: 0.5087
 epoch: 90, train_loss: 0.9210, test_loss: 0.9273, test_f1: 0.5088
 epoch: 91, train_loss: 0.9234, test_loss: 0.9248, test_f1: 0.5108
 epoch: 92, train_loss: 0.9209, test_loss: 0.9231, test_f1: 0.5117
 epoch: 93, train_loss: 0.9269, test_loss: 0.9273, test_f1: 0.5085
 epoch: 94, train_loss: 0.9199, test_loss: 0.9252, test_f1: 0.5085
 epoch: 95, train_loss: 0.9172, test_loss: 0.9251, test_f1: 0.5119
 epoch: 96, train_loss: 0.9158, test_loss: 0.9232, test_f1: 0.5129
 epoch: 97, train_loss: 0.9168, test_loss: 0.9214, test_f1: 0.5119
 epoch: 98, train_loss: 0.9172, test_loss: 0.9216, test_f1: 0.5142
 epoch: 99, train_loss: 0.9176, test_loss: 0.9208, test_f1: 0.5086
##################ITERATION #3 ****************************************
 epoch: 0, train_loss: 1.3232, test_loss: 1.3166, test_f1: 0.2270
 epoch: 1, train_loss: 1.2984, test_loss: 1.3114, test_f1: 0.2270
 epoch: 2, train_loss: 1.2873, test_loss: 1.3018, test_f1: 0.2270
 epoch: 3, train_loss: 1.2749, test_loss: 1.2905, test_f1: 0.2270
 epoch: 4, train_loss: 1.2672, test_loss: 1.2658, test_f1: 0.2368
 epoch: 5, train_loss: 1.2548, test_loss: 1.2422, test_f1: 0.2690
 epoch: 6, train_loss: 1.2466, test_loss: 1.2261, test_f1: 0.2834
 epoch: 7, train_loss: 1.2347, test_loss: 1.2133, test_f1: 0.3009
 epoch: 8, train_loss: 1.2250, test_loss: 1.2034, test_f1: 0.3166
 epoch: 9, train_loss: 1.2214, test_loss: 1.1940, test_f1: 0.3298
 epoch: 10, train_loss: 1.2110, test_loss: 1.1845, test_f1: 0.3451
 epoch: 11, train_loss: 1.2002, test_loss: 1.1758, test_f1: 0.3474
 epoch: 12, train_loss: 1.1942, test_loss: 1.1658, test_f1: 0.3617
 epoch: 13, train_loss: 1.1883, test_loss: 1.1572, test_f1: 0.3809
 epoch: 14, train_loss: 1.1814, test_loss: 1.1476, test_f1: 0.3902
 epoch: 15, train_loss: 1.1735, test_loss: 1.1381, test_f1: 0.4102
 epoch: 16, train_loss: 1.1713, test_loss: 1.1295, test_f1: 0.4133
 epoch: 17, train_loss: 1.1562, test_loss: 1.1193, test_f1: 0.4221
 epoch: 18, train_loss: 1.1445, test_loss: 1.1124, test_f1: 0.4136
 epoch: 19, train_loss: 1.1392, test_loss: 1.1050, test_f1: 0.4172
 epoch: 20, train_loss: 1.1315, test_loss: 1.0957, test_f1: 0.4283
 epoch: 21, train_loss: 1.1246, test_loss: 1.0872, test_f1: 0.4533
 epoch: 22, train_loss: 1.1190, test_loss: 1.0807, test_f1: 0.4494
 epoch: 23, train_loss: 1.1077, test_loss: 1.0737, test_f1: 0.4626
 epoch: 24, train_loss: 1.1035, test_loss: 1.0674, test_f1: 0.4632
 epoch: 25, train_loss: 1.0954, test_loss: 1.0611, test_f1: 0.4679
 epoch: 26, train_loss: 1.0900, test_loss: 1.0552, test_f1: 0.4712
 epoch: 27, train_loss: 1.0804, test_loss: 1.0500, test_f1: 0.4699
 epoch: 28, train_loss: 1.0723, test_loss: 1.0424, test_f1: 0.4791
 epoch: 29, train_loss: 1.0678, test_loss: 1.0369, test_f1: 0.4826
 epoch: 30, train_loss: 1.0652, test_loss: 1.0311, test_f1: 0.4778
 epoch: 31, train_loss: 1.0576, test_loss: 1.0256, test_f1: 0.4856
 epoch: 32, train_loss: 1.0528, test_loss: 1.0215, test_f1: 0.4845
 epoch: 33, train_loss: 1.0483, test_loss: 1.0164, test_f1: 0.4844
 epoch: 34, train_loss: 1.0435, test_loss: 1.0110, test_f1: 0.4906
 epoch: 35, train_loss: 1.0354, test_loss: 1.0058, test_f1: 0.4951
 epoch: 36, train_loss: 1.0350, test_loss: 1.0024, test_f1: 0.4807
 epoch: 37, train_loss: 1.0281, test_loss: 0.9994, test_f1: 0.4756
 epoch: 38, train_loss: 1.0188, test_loss: 0.9923, test_f1: 0.4828
 epoch: 39, train_loss: 1.0230, test_loss: 0.9895, test_f1: 0.4827
 epoch: 40, train_loss: 1.0093, test_loss: 0.9869, test_f1: 0.4764
 epoch: 41, train_loss: 1.0098, test_loss: 0.9822, test_f1: 0.4801
 epoch: 42, train_loss: 1.0077, test_loss: 0.9773, test_f1: 0.4880
 epoch: 43, train_loss: 0.9967, test_loss: 0.9755, test_f1: 0.4853
 epoch: 44, train_loss: 0.9952, test_loss: 0.9723, test_f1: 0.4856
 epoch: 45, train_loss: 0.9841, test_loss: 0.9688, test_f1: 0.4855
 epoch: 46, train_loss: 0.9875, test_loss: 0.9660, test_f1: 0.4869
 epoch: 47, train_loss: 0.9834, test_loss: 0.9632, test_f1: 0.4840
 epoch: 48, train_loss: 0.9816, test_loss: 0.9604, test_f1: 0.4853
 epoch: 49, train_loss: 0.9716, test_loss: 0.9584, test_f1: 0.4969
 epoch: 50, train_loss: 0.9670, test_loss: 0.9529, test_f1: 0.4990
 epoch: 51, train_loss: 0.9668, test_loss: 0.9527, test_f1: 0.4975
 epoch: 52, train_loss: 0.9641, test_loss: 0.9523, test_f1: 0.4959
 epoch: 53, train_loss: 0.9600, test_loss: 0.9502, test_f1: 0.4879
 epoch: 54, train_loss: 0.9560, test_loss: 0.9486, test_f1: 0.4933
 epoch: 55, train_loss: 0.9538, test_loss: 0.9468, test_f1: 0.4977
 epoch: 56, train_loss: 0.9599, test_loss: 0.9469, test_f1: 0.4946
 epoch: 57, train_loss: 0.9591, test_loss: 0.9457, test_f1: 0.4975
 epoch: 58, train_loss: 0.9552, test_loss: 0.9444, test_f1: 0.4957
 epoch: 59, train_loss: 0.9499, test_loss: 0.9438, test_f1: 0.4947
 epoch: 60, train_loss: 0.9565, test_loss: 0.9428, test_f1: 0.4982
 epoch: 61, train_loss: 0.9526, test_loss: 0.9414, test_f1: 0.4975
 epoch: 62, train_loss: 0.9461, test_loss: 0.9407, test_f1: 0.4974
 epoch: 63, train_loss: 0.9485, test_loss: 0.9397, test_f1: 0.5016
 epoch: 64, train_loss: 0.9444, test_loss: 0.9403, test_f1: 0.5005
 epoch: 65, train_loss: 0.9440, test_loss: 0.9394, test_f1: 0.4997
 epoch: 66, train_loss: 0.9508, test_loss: 0.9393, test_f1: 0.5046
 epoch: 67, train_loss: 0.9444, test_loss: 0.9389, test_f1: 0.4968
 epoch: 68, train_loss: 0.9410, test_loss: 0.9384, test_f1: 0.5016
 epoch: 69, train_loss: 0.9429, test_loss: 0.9352, test_f1: 0.5016
 epoch: 70, train_loss: 0.9309, test_loss: 0.9355, test_f1: 0.5052
 epoch: 71, train_loss: 0.9346, test_loss: 0.9343, test_f1: 0.5026
 epoch: 72, train_loss: 0.9353, test_loss: 0.9315, test_f1: 0.5041
 epoch: 73, train_loss: 0.9368, test_loss: 0.9311, test_f1: 0.5003
 epoch: 74, train_loss: 0.9381, test_loss: 0.9316, test_f1: 0.5047
 epoch: 75, train_loss: 0.9271, test_loss: 0.9325, test_f1: 0.5017
 epoch: 76, train_loss: 0.9199, test_loss: 0.9314, test_f1: 0.4997
 epoch: 77, train_loss: 0.9349, test_loss: 0.9309, test_f1: 0.5034
 epoch: 78, train_loss: 0.9267, test_loss: 0.9312, test_f1: 0.5029
 epoch: 79, train_loss: 0.9252, test_loss: 0.9289, test_f1: 0.5017
 epoch: 80, train_loss: 0.9277, test_loss: 0.9293, test_f1: 0.5011
 epoch: 81, train_loss: 0.9277, test_loss: 0.9310, test_f1: 0.5073
 epoch: 82, train_loss: 0.9197, test_loss: 0.9297, test_f1: 0.5081
 epoch: 83, train_loss: 0.9252, test_loss: 0.9285, test_f1: 0.5099
 epoch: 84, train_loss: 0.9155, test_loss: 0.9258, test_f1: 0.5069
 epoch: 85, train_loss: 0.9217, test_loss: 0.9274, test_f1: 0.5110
 epoch: 86, train_loss: 0.9211, test_loss: 0.9267, test_f1: 0.5177
 epoch: 87, train_loss: 0.9174, test_loss: 0.9287, test_f1: 0.5089
 epoch: 88, train_loss: 0.9169, test_loss: 0.9265, test_f1: 0.5098
 epoch: 89, train_loss: 0.9181, test_loss: 0.9239, test_f1: 0.5162
 epoch: 90, train_loss: 0.9165, test_loss: 0.9233, test_f1: 0.5168
 epoch: 91, train_loss: 0.9108, test_loss: 0.9238, test_f1: 0.5141
 epoch: 92, train_loss: 0.9096, test_loss: 0.9225, test_f1: 0.5276
 epoch: 93, train_loss: 0.9099, test_loss: 0.9219, test_f1: 0.5155
 epoch: 94, train_loss: 0.9095, test_loss: 0.9188, test_f1: 0.5276
 epoch: 95, train_loss: 0.9106, test_loss: 0.9194, test_f1: 0.5312
 epoch: 96, train_loss: 0.9086, test_loss: 0.9203, test_f1: 0.5158
 epoch: 97, train_loss: 0.9071, test_loss: 0.9190, test_f1: 0.5177
 epoch: 98, train_loss: 0.9071, test_loss: 0.9186, test_f1: 0.5303
 epoch: 99, train_loss: 0.9028, test_loss: 0.9202, test_f1: 0.5359
##################ITERATION #4 ****************************************
 epoch: 0, train_loss: 1.3060, test_loss: 1.3102, test_f1: 0.2270
 epoch: 1, train_loss: 1.2844, test_loss: 1.3018, test_f1: 0.2270
 epoch: 2, train_loss: 1.2708, test_loss: 1.2858, test_f1: 0.2270
 epoch: 3, train_loss: 1.2677, test_loss: 1.2680, test_f1: 0.2270
 epoch: 4, train_loss: 1.2529, test_loss: 1.2501, test_f1: 0.2570
 epoch: 5, train_loss: 1.2501, test_loss: 1.2378, test_f1: 0.2728
 epoch: 6, train_loss: 1.2417, test_loss: 1.2282, test_f1: 0.2865
 epoch: 7, train_loss: 1.2352, test_loss: 1.2203, test_f1: 0.2961
 epoch: 8, train_loss: 1.2248, test_loss: 1.2126, test_f1: 0.3034
 epoch: 9, train_loss: 1.2204, test_loss: 1.2050, test_f1: 0.3114
 epoch: 10, train_loss: 1.2088, test_loss: 1.1968, test_f1: 0.3209
 epoch: 11, train_loss: 1.2056, test_loss: 1.1876, test_f1: 0.3263
 epoch: 12, train_loss: 1.2022, test_loss: 1.1792, test_f1: 0.3345
 epoch: 13, train_loss: 1.1930, test_loss: 1.1712, test_f1: 0.3520
 epoch: 14, train_loss: 1.1843, test_loss: 1.1642, test_f1: 0.3590
 epoch: 15, train_loss: 1.1690, test_loss: 1.1555, test_f1: 0.3620
 epoch: 16, train_loss: 1.1681, test_loss: 1.1450, test_f1: 0.3639
 epoch: 17, train_loss: 1.1639, test_loss: 1.1371, test_f1: 0.3869
 epoch: 18, train_loss: 1.1535, test_loss: 1.1280, test_f1: 0.3986
 epoch: 19, train_loss: 1.1481, test_loss: 1.1203, test_f1: 0.4025
 epoch: 20, train_loss: 1.1437, test_loss: 1.1119, test_f1: 0.4047
 epoch: 21, train_loss: 1.1368, test_loss: 1.1053, test_f1: 0.4131
 epoch: 22, train_loss: 1.1275, test_loss: 1.0967, test_f1: 0.4178
 epoch: 23, train_loss: 1.1246, test_loss: 1.0879, test_f1: 0.4250
 epoch: 24, train_loss: 1.1155, test_loss: 1.0796, test_f1: 0.4244
 epoch: 25, train_loss: 1.1073, test_loss: 1.0736, test_f1: 0.4295
 epoch: 26, train_loss: 1.1106, test_loss: 1.0664, test_f1: 0.4338
 epoch: 27, train_loss: 1.0921, test_loss: 1.0593, test_f1: 0.4388
 epoch: 28, train_loss: 1.0862, test_loss: 1.0515, test_f1: 0.4404
 epoch: 29, train_loss: 1.0825, test_loss: 1.0435, test_f1: 0.4401
 epoch: 30, train_loss: 1.0750, test_loss: 1.0361, test_f1: 0.4556
 epoch: 31, train_loss: 1.0681, test_loss: 1.0301, test_f1: 0.4570
 epoch: 32, train_loss: 1.0581, test_loss: 1.0205, test_f1: 0.4587
 epoch: 33, train_loss: 1.0574, test_loss: 1.0169, test_f1: 0.4634
 epoch: 34, train_loss: 1.0519, test_loss: 1.0112, test_f1: 0.4705
 epoch: 35, train_loss: 1.0391, test_loss: 1.0082, test_f1: 0.4683
 epoch: 36, train_loss: 1.0396, test_loss: 1.0010, test_f1: 0.4687
 epoch: 37, train_loss: 1.0330, test_loss: 0.9981, test_f1: 0.4711
 epoch: 38, train_loss: 1.0230, test_loss: 0.9916, test_f1: 0.4730
 epoch: 39, train_loss: 1.0263, test_loss: 0.9850, test_f1: 0.4716
 epoch: 40, train_loss: 1.0167, test_loss: 0.9833, test_f1: 0.4680
 epoch: 41, train_loss: 1.0118, test_loss: 0.9822, test_f1: 0.4680
 epoch: 42, train_loss: 1.0096, test_loss: 0.9752, test_f1: 0.4716
 epoch: 43, train_loss: 0.9962, test_loss: 0.9695, test_f1: 0.4745
 epoch: 44, train_loss: 0.9965, test_loss: 0.9663, test_f1: 0.4763
 epoch: 45, train_loss: 0.9908, test_loss: 0.9632, test_f1: 0.4773
 epoch: 46, train_loss: 0.9883, test_loss: 0.9649, test_f1: 0.4770
 epoch: 47, train_loss: 0.9791, test_loss: 0.9631, test_f1: 0.4771
 epoch: 48, train_loss: 0.9802, test_loss: 0.9573, test_f1: 0.4771
 epoch: 49, train_loss: 0.9756, test_loss: 0.9536, test_f1: 0.4703
 epoch: 50, train_loss: 0.9760, test_loss: 0.9529, test_f1: 0.4806
 epoch: 51, train_loss: 0.9746, test_loss: 0.9505, test_f1: 0.4808
 epoch: 52, train_loss: 0.9695, test_loss: 0.9496, test_f1: 0.4850
 epoch: 53, train_loss: 0.9645, test_loss: 0.9475, test_f1: 0.4814
 epoch: 54, train_loss: 0.9684, test_loss: 0.9470, test_f1: 0.4776
 epoch: 55, train_loss: 0.9602, test_loss: 0.9440, test_f1: 0.4790
 epoch: 56, train_loss: 0.9568, test_loss: 0.9425, test_f1: 0.4841
 epoch: 57, train_loss: 0.9635, test_loss: 0.9417, test_f1: 0.4954
 epoch: 58, train_loss: 0.9596, test_loss: 0.9419, test_f1: 0.4854
 epoch: 59, train_loss: 0.9508, test_loss: 0.9425, test_f1: 0.4868
 epoch: 60, train_loss: 0.9476, test_loss: 0.9415, test_f1: 0.4817
 epoch: 61, train_loss: 0.9567, test_loss: 0.9415, test_f1: 0.4836
 epoch: 62, train_loss: 0.9458, test_loss: 0.9415, test_f1: 0.4865
 epoch: 63, train_loss: 0.9506, test_loss: 0.9438, test_f1: 0.4918
 epoch: 64, train_loss: 0.9484, test_loss: 0.9437, test_f1: 0.4869
 epoch: 65, train_loss: 0.9442, test_loss: 0.9412, test_f1: 0.4928
 epoch: 66, train_loss: 0.9413, test_loss: 0.9381, test_f1: 0.4998
 epoch: 67, train_loss: 0.9473, test_loss: 0.9386, test_f1: 0.4979
 epoch: 68, train_loss: 0.9450, test_loss: 0.9376, test_f1: 0.4956
 epoch: 69, train_loss: 0.9397, test_loss: 0.9328, test_f1: 0.5088
 epoch: 70, train_loss: 0.9446, test_loss: 0.9343, test_f1: 0.4994
 epoch: 71, train_loss: 0.9346, test_loss: 0.9334, test_f1: 0.5042
 epoch: 72, train_loss: 0.9406, test_loss: 0.9390, test_f1: 0.5040
 epoch: 73, train_loss: 0.9401, test_loss: 0.9421, test_f1: 0.5061
 epoch: 74, train_loss: 0.9389, test_loss: 0.9353, test_f1: 0.5125
 epoch: 75, train_loss: 0.9270, test_loss: 0.9338, test_f1: 0.5158
 epoch: 76, train_loss: 0.9339, test_loss: 0.9320, test_f1: 0.5126
 epoch: 77, train_loss: 0.9279, test_loss: 0.9315, test_f1: 0.5144
 epoch: 78, train_loss: 0.9270, test_loss: 0.9307, test_f1: 0.5144
 epoch: 79, train_loss: 0.9242, test_loss: 0.9320, test_f1: 0.5164
 epoch: 80, train_loss: 0.9227, test_loss: 0.9298, test_f1: 0.5219
 epoch: 81, train_loss: 0.9205, test_loss: 0.9304, test_f1: 0.5245
 epoch: 82, train_loss: 0.9229, test_loss: 0.9298, test_f1: 0.5251
 epoch: 83, train_loss: 0.9218, test_loss: 0.9287, test_f1: 0.5249
 epoch: 84, train_loss: 0.9223, test_loss: 0.9292, test_f1: 0.5238
 epoch: 85, train_loss: 0.9231, test_loss: 0.9306, test_f1: 0.5232
 epoch: 86, train_loss: 0.9189, test_loss: 0.9278, test_f1: 0.5240
 epoch: 87, train_loss: 0.9172, test_loss: 0.9268, test_f1: 0.5228
 epoch: 88, train_loss: 0.9236, test_loss: 0.9303, test_f1: 0.5251
 epoch: 89, train_loss: 0.9118, test_loss: 0.9293, test_f1: 0.5227
 epoch: 90, train_loss: 0.9097, test_loss: 0.9273, test_f1: 0.5217
 epoch: 91, train_loss: 0.9078, test_loss: 0.9268, test_f1: 0.5257
 epoch: 92, train_loss: 0.9146, test_loss: 0.9267, test_f1: 0.5237
 epoch: 93, train_loss: 0.9071, test_loss: 0.9262, test_f1: 0.5256
 epoch: 94, train_loss: 0.9002, test_loss: 0.9265, test_f1: 0.5223
 epoch: 95, train_loss: 0.9127, test_loss: 0.9249, test_f1: 0.5211
 epoch: 96, train_loss: 0.9100, test_loss: 0.9255, test_f1: 0.5270
 epoch: 97, train_loss: 0.9061, test_loss: 0.9284, test_f1: 0.5238
 epoch: 98, train_loss: 0.9085, test_loss: 0.9252, test_f1: 0.5212
 epoch: 99, train_loss: 0.9032, test_loss: 0.9264, test_f1: 0.5240
##################ITERATION #5 ****************************************
 epoch: 0, train_loss: 1.3442, test_loss: 1.3320, test_f1: 0.2270
 epoch: 1, train_loss: 1.3042, test_loss: 1.3156, test_f1: 0.2270
 epoch: 2, train_loss: 1.2792, test_loss: 1.2909, test_f1: 0.2270
 epoch: 3, train_loss: 1.2628, test_loss: 1.2629, test_f1: 0.2270
 epoch: 4, train_loss: 1.2452, test_loss: 1.2259, test_f1: 0.2317
 epoch: 5, train_loss: 1.2293, test_loss: 1.1932, test_f1: 0.3077
 epoch: 6, train_loss: 1.2185, test_loss: 1.1736, test_f1: 0.3245
 epoch: 7, train_loss: 1.2075, test_loss: 1.1597, test_f1: 0.3474
 epoch: 8, train_loss: 1.1976, test_loss: 1.1494, test_f1: 0.3697
 epoch: 9, train_loss: 1.1874, test_loss: 1.1401, test_f1: 0.3825
 epoch: 10, train_loss: 1.1832, test_loss: 1.1319, test_f1: 0.3910
 epoch: 11, train_loss: 1.1747, test_loss: 1.1225, test_f1: 0.3988
 epoch: 12, train_loss: 1.1668, test_loss: 1.1163, test_f1: 0.4105
 epoch: 13, train_loss: 1.1642, test_loss: 1.1074, test_f1: 0.4257
 epoch: 14, train_loss: 1.1497, test_loss: 1.1012, test_f1: 0.4290
 epoch: 15, train_loss: 1.1510, test_loss: 1.0938, test_f1: 0.4282
 epoch: 16, train_loss: 1.1385, test_loss: 1.0861, test_f1: 0.4356
 epoch: 17, train_loss: 1.1303, test_loss: 1.0791, test_f1: 0.4447
 epoch: 18, train_loss: 1.1240, test_loss: 1.0734, test_f1: 0.4538
 epoch: 19, train_loss: 1.1132, test_loss: 1.0645, test_f1: 0.4533
 epoch: 20, train_loss: 1.1142, test_loss: 1.0581, test_f1: 0.4506
 epoch: 21, train_loss: 1.1078, test_loss: 1.0502, test_f1: 0.4616
 epoch: 22, train_loss: 1.0994, test_loss: 1.0443, test_f1: 0.4635
 epoch: 23, train_loss: 1.0903, test_loss: 1.0386, test_f1: 0.4680
 epoch: 24, train_loss: 1.0920, test_loss: 1.0314, test_f1: 0.4695
 epoch: 25, train_loss: 1.0843, test_loss: 1.0243, test_f1: 0.4781
 epoch: 26, train_loss: 1.0767, test_loss: 1.0195, test_f1: 0.4731
 epoch: 27, train_loss: 1.0725, test_loss: 1.0143, test_f1: 0.4729
 epoch: 28, train_loss: 1.0747, test_loss: 1.0089, test_f1: 0.4713
 epoch: 29, train_loss: 1.0618, test_loss: 1.0042, test_f1: 0.4683
 epoch: 30, train_loss: 1.0531, test_loss: 0.9976, test_f1: 0.4735
 epoch: 31, train_loss: 1.0467, test_loss: 0.9943, test_f1: 0.4736
 epoch: 32, train_loss: 1.0474, test_loss: 0.9910, test_f1: 0.4896
 epoch: 33, train_loss: 1.0420, test_loss: 0.9858, test_f1: 0.4886
 epoch: 34, train_loss: 1.0361, test_loss: 0.9805, test_f1: 0.4889
 epoch: 35, train_loss: 1.0305, test_loss: 0.9761, test_f1: 0.4861
 epoch: 36, train_loss: 1.0259, test_loss: 0.9742, test_f1: 0.4942
 epoch: 37, train_loss: 1.0235, test_loss: 0.9716, test_f1: 0.4929
 epoch: 38, train_loss: 1.0198, test_loss: 0.9650, test_f1: 0.4974
 epoch: 39, train_loss: 1.0181, test_loss: 0.9617, test_f1: 0.4966
 epoch: 40, train_loss: 1.0126, test_loss: 0.9578, test_f1: 0.4957
 epoch: 41, train_loss: 1.0116, test_loss: 0.9549, test_f1: 0.4886
 epoch: 42, train_loss: 1.0017, test_loss: 0.9485, test_f1: 0.5008
 epoch: 43, train_loss: 1.0014, test_loss: 0.9466, test_f1: 0.4866
 epoch: 44, train_loss: 0.9932, test_loss: 0.9435, test_f1: 0.4820
 epoch: 45, train_loss: 1.0008, test_loss: 0.9416, test_f1: 0.4896
 epoch: 46, train_loss: 0.9942, test_loss: 0.9366, test_f1: 0.4869
 epoch: 47, train_loss: 0.9964, test_loss: 0.9374, test_f1: 0.4863
 epoch: 48, train_loss: 0.9823, test_loss: 0.9365, test_f1: 0.4912
 epoch: 49, train_loss: 0.9818, test_loss: 0.9323, test_f1: 0.4901
 epoch: 50, train_loss: 0.9760, test_loss: 0.9310, test_f1: 0.4831
 epoch: 51, train_loss: 0.9726, test_loss: 0.9281, test_f1: 0.4908
 epoch: 52, train_loss: 0.9757, test_loss: 0.9266, test_f1: 0.4890
 epoch: 53, train_loss: 0.9689, test_loss: 0.9272, test_f1: 0.4881
 epoch: 54, train_loss: 0.9704, test_loss: 0.9264, test_f1: 0.4853
 epoch: 55, train_loss: 0.9714, test_loss: 0.9257, test_f1: 0.4874
 epoch: 56, train_loss: 0.9597, test_loss: 0.9251, test_f1: 0.4903
 epoch: 57, train_loss: 0.9590, test_loss: 0.9269, test_f1: 0.4854
 epoch: 58, train_loss: 0.9666, test_loss: 0.9226, test_f1: 0.4951
 epoch: 59, train_loss: 0.9599, test_loss: 0.9210, test_f1: 0.4895
 epoch: 60, train_loss: 0.9621, test_loss: 0.9200, test_f1: 0.4908
 epoch: 61, train_loss: 0.9582, test_loss: 0.9192, test_f1: 0.4926
 epoch: 62, train_loss: 0.9542, test_loss: 0.9170, test_f1: 0.4998
 epoch: 63, train_loss: 0.9607, test_loss: 0.9172, test_f1: 0.4973
 epoch: 64, train_loss: 0.9547, test_loss: 0.9195, test_f1: 0.4947
 epoch: 65, train_loss: 0.9542, test_loss: 0.9178, test_f1: 0.5048
 epoch: 66, train_loss: 0.9523, test_loss: 0.9131, test_f1: 0.5103
 epoch: 67, train_loss: 0.9559, test_loss: 0.9137, test_f1: 0.5005
 epoch: 68, train_loss: 0.9497, test_loss: 0.9176, test_f1: 0.4930
 epoch: 69, train_loss: 0.9455, test_loss: 0.9159, test_f1: 0.5010
 epoch: 70, train_loss: 0.9374, test_loss: 0.9113, test_f1: 0.5072
 epoch: 71, train_loss: 0.9456, test_loss: 0.9134, test_f1: 0.5114
 epoch: 72, train_loss: 0.9420, test_loss: 0.9119, test_f1: 0.4996
 epoch: 73, train_loss: 0.9430, test_loss: 0.9106, test_f1: 0.5127
 epoch: 74, train_loss: 0.9388, test_loss: 0.9097, test_f1: 0.5147
 epoch: 75, train_loss: 0.9366, test_loss: 0.9075, test_f1: 0.5118
 epoch: 76, train_loss: 0.9396, test_loss: 0.9054, test_f1: 0.5137
 epoch: 77, train_loss: 0.9432, test_loss: 0.9082, test_f1: 0.5106
 epoch: 78, train_loss: 0.9333, test_loss: 0.9100, test_f1: 0.5088
 epoch: 79, train_loss: 0.9299, test_loss: 0.9085, test_f1: 0.5148
 epoch: 80, train_loss: 0.9254, test_loss: 0.9095, test_f1: 0.5098
 epoch: 81, train_loss: 0.9354, test_loss: 0.9067, test_f1: 0.5140
 epoch: 82, train_loss: 0.9393, test_loss: 0.9062, test_f1: 0.5186
 epoch: 83, train_loss: 0.9262, test_loss: 0.9014, test_f1: 0.5162
 epoch: 84, train_loss: 0.9366, test_loss: 0.8995, test_f1: 0.5128
 epoch: 85, train_loss: 0.9194, test_loss: 0.9003, test_f1: 0.5138
 epoch: 86, train_loss: 0.9258, test_loss: 0.8989, test_f1: 0.5138
 epoch: 87, train_loss: 0.9259, test_loss: 0.9018, test_f1: 0.5133
 epoch: 88, train_loss: 0.9233, test_loss: 0.8996, test_f1: 0.5153
 epoch: 89, train_loss: 0.9243, test_loss: 0.9014, test_f1: 0.5109
 epoch: 90, train_loss: 0.9231, test_loss: 0.9005, test_f1: 0.5134
 epoch: 91, train_loss: 0.9314, test_loss: 0.9008, test_f1: 0.5154
 epoch: 92, train_loss: 0.9181, test_loss: 0.8982, test_f1: 0.5151
 epoch: 93, train_loss: 0.9184, test_loss: 0.8943, test_f1: 0.5146
 epoch: 94, train_loss: 0.9210, test_loss: 0.8917, test_f1: 0.5192
 epoch: 95, train_loss: 0.9234, test_loss: 0.8937, test_f1: 0.5179
 epoch: 96, train_loss: 0.9134, test_loss: 0.8947, test_f1: 0.5169
 epoch: 97, train_loss: 0.9192, test_loss: 0.8960, test_f1: 0.5179
 epoch: 98, train_loss: 0.9208, test_loss: 0.8950, test_f1: 0.5166
 epoch: 99, train_loss: 0.9147, test_loss: 0.8932, test_f1: 0.5179
##################ITERATION #6 ****************************************
 epoch: 0, train_loss: 1.3014, test_loss: 1.3154, test_f1: 0.2270
 epoch: 1, train_loss: 1.2796, test_loss: 1.3094, test_f1: 0.2270
 epoch: 2, train_loss: 1.2592, test_loss: 1.2927, test_f1: 0.2270
 epoch: 3, train_loss: 1.2436, test_loss: 1.2703, test_f1: 0.2270
 epoch: 4, train_loss: 1.2375, test_loss: 1.2334, test_f1: 0.2420
 epoch: 5, train_loss: 1.2285, test_loss: 1.2027, test_f1: 0.3048
 epoch: 6, train_loss: 1.2195, test_loss: 1.1814, test_f1: 0.3335
 epoch: 7, train_loss: 1.2089, test_loss: 1.1690, test_f1: 0.3470
 epoch: 8, train_loss: 1.2022, test_loss: 1.1572, test_f1: 0.3570
 epoch: 9, train_loss: 1.1904, test_loss: 1.1485, test_f1: 0.3648
 epoch: 10, train_loss: 1.1917, test_loss: 1.1408, test_f1: 0.3691
 epoch: 11, train_loss: 1.1764, test_loss: 1.1335, test_f1: 0.3776
 epoch: 12, train_loss: 1.1754, test_loss: 1.1263, test_f1: 0.3818
 epoch: 13, train_loss: 1.1648, test_loss: 1.1190, test_f1: 0.3914
 epoch: 14, train_loss: 1.1528, test_loss: 1.1129, test_f1: 0.3967
 epoch: 15, train_loss: 1.1562, test_loss: 1.1059, test_f1: 0.3991
 epoch: 16, train_loss: 1.1484, test_loss: 1.1015, test_f1: 0.3981
 epoch: 17, train_loss: 1.1389, test_loss: 1.0944, test_f1: 0.4070
 epoch: 18, train_loss: 1.1377, test_loss: 1.0893, test_f1: 0.4079
 epoch: 19, train_loss: 1.1349, test_loss: 1.0834, test_f1: 0.4131
 epoch: 20, train_loss: 1.1259, test_loss: 1.0766, test_f1: 0.4265
 epoch: 21, train_loss: 1.1232, test_loss: 1.0696, test_f1: 0.4352
 epoch: 22, train_loss: 1.1179, test_loss: 1.0646, test_f1: 0.4405
 epoch: 23, train_loss: 1.1105, test_loss: 1.0602, test_f1: 0.4275
 epoch: 24, train_loss: 1.1061, test_loss: 1.0541, test_f1: 0.4360
 epoch: 25, train_loss: 1.0986, test_loss: 1.0485, test_f1: 0.4412
 epoch: 26, train_loss: 1.0902, test_loss: 1.0441, test_f1: 0.4380
 epoch: 27, train_loss: 1.0919, test_loss: 1.0381, test_f1: 0.4425
 epoch: 28, train_loss: 1.0805, test_loss: 1.0362, test_f1: 0.4391
 epoch: 29, train_loss: 1.0815, test_loss: 1.0322, test_f1: 0.4414
 epoch: 30, train_loss: 1.0723, test_loss: 1.0262, test_f1: 0.4610
 epoch: 31, train_loss: 1.0708, test_loss: 1.0208, test_f1: 0.4654
 epoch: 32, train_loss: 1.0628, test_loss: 1.0168, test_f1: 0.4692
 epoch: 33, train_loss: 1.0594, test_loss: 1.0119, test_f1: 0.4731
 epoch: 34, train_loss: 1.0527, test_loss: 1.0083, test_f1: 0.4687
 epoch: 35, train_loss: 1.0467, test_loss: 1.0018, test_f1: 0.4689
 epoch: 36, train_loss: 1.0447, test_loss: 0.9967, test_f1: 0.4694
 epoch: 37, train_loss: 1.0399, test_loss: 0.9910, test_f1: 0.4680
 epoch: 38, train_loss: 1.0398, test_loss: 0.9893, test_f1: 0.4728
 epoch: 39, train_loss: 1.0348, test_loss: 0.9841, test_f1: 0.4709
 epoch: 40, train_loss: 1.0254, test_loss: 0.9815, test_f1: 0.4794
 epoch: 41, train_loss: 1.0247, test_loss: 0.9772, test_f1: 0.4785
 epoch: 42, train_loss: 1.0162, test_loss: 0.9742, test_f1: 0.4754
 epoch: 43, train_loss: 1.0165, test_loss: 0.9725, test_f1: 0.4799
 epoch: 44, train_loss: 1.0149, test_loss: 0.9709, test_f1: 0.4777
 epoch: 45, train_loss: 1.0042, test_loss: 0.9726, test_f1: 0.4780
 epoch: 46, train_loss: 1.0131, test_loss: 0.9712, test_f1: 0.4803
 epoch: 47, train_loss: 1.0086, test_loss: 0.9663, test_f1: 0.4780
 epoch: 48, train_loss: 1.0063, test_loss: 0.9668, test_f1: 0.4802
 epoch: 49, train_loss: 1.0021, test_loss: 0.9601, test_f1: 0.4810
 epoch: 50, train_loss: 0.9892, test_loss: 0.9581, test_f1: 0.4906
 epoch: 51, train_loss: 0.9971, test_loss: 0.9560, test_f1: 0.4905
 epoch: 52, train_loss: 0.9958, test_loss: 0.9541, test_f1: 0.4877
 epoch: 53, train_loss: 0.9869, test_loss: 0.9518, test_f1: 0.4889
 epoch: 54, train_loss: 0.9881, test_loss: 0.9541, test_f1: 0.4894
 epoch: 55, train_loss: 0.9820, test_loss: 0.9522, test_f1: 0.4854
 epoch: 56, train_loss: 0.9864, test_loss: 0.9523, test_f1: 0.4897
 epoch: 57, train_loss: 0.9840, test_loss: 0.9520, test_f1: 0.4887
 epoch: 58, train_loss: 0.9770, test_loss: 0.9497, test_f1: 0.4804
 epoch: 59, train_loss: 0.9765, test_loss: 0.9493, test_f1: 0.4858
 epoch: 60, train_loss: 0.9772, test_loss: 0.9530, test_f1: 0.4886
 epoch: 61, train_loss: 0.9813, test_loss: 0.9482, test_f1: 0.4998
 epoch: 62, train_loss: 0.9800, test_loss: 0.9466, test_f1: 0.4991
 epoch: 63, train_loss: 0.9663, test_loss: 0.9460, test_f1: 0.5001
 epoch: 64, train_loss: 0.9755, test_loss: 0.9463, test_f1: 0.4987
 epoch: 65, train_loss: 0.9649, test_loss: 0.9470, test_f1: 0.4951
 epoch: 66, train_loss: 0.9663, test_loss: 0.9456, test_f1: 0.4932
 epoch: 67, train_loss: 0.9753, test_loss: 0.9441, test_f1: 0.4902
 epoch: 68, train_loss: 0.9713, test_loss: 0.9464, test_f1: 0.4981
 epoch: 69, train_loss: 0.9712, test_loss: 0.9468, test_f1: 0.4913
 epoch: 70, train_loss: 0.9607, test_loss: 0.9449, test_f1: 0.4938
 epoch: 71, train_loss: 0.9669, test_loss: 0.9450, test_f1: 0.4932
 epoch: 72, train_loss: 0.9652, test_loss: 0.9436, test_f1: 0.4920
 epoch: 73, train_loss: 0.9596, test_loss: 0.9441, test_f1: 0.4958
 epoch: 74, train_loss: 0.9576, test_loss: 0.9446, test_f1: 0.4987
 epoch: 75, train_loss: 0.9512, test_loss: 0.9453, test_f1: 0.4897
 epoch: 76, train_loss: 0.9510, test_loss: 0.9444, test_f1: 0.4886
 epoch: 77, train_loss: 0.9598, test_loss: 0.9418, test_f1: 0.4907
 epoch: 78, train_loss: 0.9531, test_loss: 0.9422, test_f1: 0.4928
 epoch: 79, train_loss: 0.9541, test_loss: 0.9389, test_f1: 0.4989
 epoch: 80, train_loss: 0.9553, test_loss: 0.9416, test_f1: 0.4961
 epoch: 81, train_loss: 0.9483, test_loss: 0.9439, test_f1: 0.4908
 epoch: 82, train_loss: 0.9529, test_loss: 0.9423, test_f1: 0.4979
 epoch: 83, train_loss: 0.9516, test_loss: 0.9438, test_f1: 0.4865
 epoch: 84, train_loss: 0.9468, test_loss: 0.9401, test_f1: 0.4998
 epoch: 85, train_loss: 0.9463, test_loss: 0.9409, test_f1: 0.5009
 epoch: 86, train_loss: 0.9488, test_loss: 0.9456, test_f1: 0.4911
 epoch: 87, train_loss: 0.9451, test_loss: 0.9414, test_f1: 0.5042
 epoch: 88, train_loss: 0.9471, test_loss: 0.9432, test_f1: 0.4986
 epoch: 89, train_loss: 0.9418, test_loss: 0.9407, test_f1: 0.4987
 epoch: 90, train_loss: 0.9455, test_loss: 0.9361, test_f1: 0.4977
 epoch: 91, train_loss: 0.9443, test_loss: 0.9341, test_f1: 0.4997
 epoch: 92, train_loss: 0.9364, test_loss: 0.9384, test_f1: 0.4962
 epoch: 93, train_loss: 0.9377, test_loss: 0.9347, test_f1: 0.5018
 epoch: 94, train_loss: 0.9429, test_loss: 0.9344, test_f1: 0.4992
 epoch: 95, train_loss: 0.9346, test_loss: 0.9406, test_f1: 0.5032
 epoch: 96, train_loss: 0.9390, test_loss: 0.9395, test_f1: 0.5008
 epoch: 97, train_loss: 0.9280, test_loss: 0.9377, test_f1: 0.5034
 epoch: 98, train_loss: 0.9310, test_loss: 0.9345, test_f1: 0.5008
 epoch: 99, train_loss: 0.9375, test_loss: 0.9337, test_f1: 0.5065
##################ITERATION #7 ****************************************
 epoch: 0, train_loss: 1.3509, test_loss: 1.3303, test_f1: 0.2270
 epoch: 1, train_loss: 1.3032, test_loss: 1.3259, test_f1: 0.2270
 epoch: 2, train_loss: 1.2860, test_loss: 1.3017, test_f1: 0.2270
 epoch: 3, train_loss: 1.2675, test_loss: 1.2685, test_f1: 0.2270
 epoch: 4, train_loss: 1.2510, test_loss: 1.2429, test_f1: 0.2297
 epoch: 5, train_loss: 1.2396, test_loss: 1.2182, test_f1: 0.2322
 epoch: 6, train_loss: 1.2245, test_loss: 1.1972, test_f1: 0.2489
 epoch: 7, train_loss: 1.2098, test_loss: 1.1763, test_f1: 0.2790
 epoch: 8, train_loss: 1.1969, test_loss: 1.1609, test_f1: 0.3285
 epoch: 9, train_loss: 1.1894, test_loss: 1.1480, test_f1: 0.3830
 epoch: 10, train_loss: 1.1781, test_loss: 1.1336, test_f1: 0.4070
 epoch: 11, train_loss: 1.1638, test_loss: 1.1205, test_f1: 0.4217
 epoch: 12, train_loss: 1.1475, test_loss: 1.1070, test_f1: 0.4326
 epoch: 13, train_loss: 1.1454, test_loss: 1.0948, test_f1: 0.4351
 epoch: 14, train_loss: 1.1262, test_loss: 1.0825, test_f1: 0.4450
 epoch: 15, train_loss: 1.1282, test_loss: 1.0701, test_f1: 0.4449
 epoch: 16, train_loss: 1.1199, test_loss: 1.0609, test_f1: 0.4556
 epoch: 17, train_loss: 1.1077, test_loss: 1.0537, test_f1: 0.4556
 epoch: 18, train_loss: 1.1043, test_loss: 1.0428, test_f1: 0.4578
 epoch: 19, train_loss: 1.0948, test_loss: 1.0371, test_f1: 0.4661
 epoch: 20, train_loss: 1.0863, test_loss: 1.0295, test_f1: 0.4628
 epoch: 21, train_loss: 1.0764, test_loss: 1.0216, test_f1: 0.4663
 epoch: 22, train_loss: 1.0691, test_loss: 1.0174, test_f1: 0.4679
 epoch: 23, train_loss: 1.0691, test_loss: 1.0143, test_f1: 0.4759
 epoch: 24, train_loss: 1.0711, test_loss: 1.0070, test_f1: 0.4749
 epoch: 25, train_loss: 1.0536, test_loss: 0.9968, test_f1: 0.4762
 epoch: 26, train_loss: 1.0537, test_loss: 0.9955, test_f1: 0.4726
 epoch: 27, train_loss: 1.0452, test_loss: 0.9925, test_f1: 0.4695
 epoch: 28, train_loss: 1.0379, test_loss: 0.9872, test_f1: 0.4686
 epoch: 29, train_loss: 1.0304, test_loss: 0.9833, test_f1: 0.4650
 epoch: 30, train_loss: 1.0332, test_loss: 0.9835, test_f1: 0.4682
 epoch: 31, train_loss: 1.0273, test_loss: 0.9844, test_f1: 0.4799
 epoch: 32, train_loss: 1.0243, test_loss: 0.9805, test_f1: 0.4794
 epoch: 33, train_loss: 1.0132, test_loss: 0.9763, test_f1: 0.4792
 epoch: 34, train_loss: 1.0116, test_loss: 0.9699, test_f1: 0.4808
 epoch: 35, train_loss: 1.0041, test_loss: 0.9672, test_f1: 0.4790
 epoch: 36, train_loss: 1.0037, test_loss: 0.9648, test_f1: 0.4779
 epoch: 37, train_loss: 1.0017, test_loss: 0.9611, test_f1: 0.4813
 epoch: 38, train_loss: 1.0023, test_loss: 0.9603, test_f1: 0.4791
 epoch: 39, train_loss: 0.9952, test_loss: 0.9588, test_f1: 0.4887
 epoch: 40, train_loss: 0.9926, test_loss: 0.9574, test_f1: 0.4837
 epoch: 41, train_loss: 0.9915, test_loss: 0.9601, test_f1: 0.4829
 epoch: 42, train_loss: 0.9789, test_loss: 0.9578, test_f1: 0.4970
 epoch: 43, train_loss: 0.9715, test_loss: 0.9618, test_f1: 0.4892
 epoch: 44, train_loss: 0.9772, test_loss: 0.9551, test_f1: 0.4893
 epoch: 45, train_loss: 0.9763, test_loss: 0.9604, test_f1: 0.4942
 epoch: 46, train_loss: 0.9699, test_loss: 0.9538, test_f1: 0.4927
 epoch: 47, train_loss: 0.9780, test_loss: 0.9460, test_f1: 0.4898
 epoch: 48, train_loss: 0.9651, test_loss: 0.9476, test_f1: 0.4904
 epoch: 49, train_loss: 0.9612, test_loss: 0.9466, test_f1: 0.4901
 epoch: 50, train_loss: 0.9670, test_loss: 0.9507, test_f1: 0.4891
 epoch: 51, train_loss: 0.9670, test_loss: 0.9511, test_f1: 0.4932
 epoch: 52, train_loss: 0.9590, test_loss: 0.9458, test_f1: 0.4932
 epoch: 53, train_loss: 0.9575, test_loss: 0.9457, test_f1: 0.4924
 epoch: 54, train_loss: 0.9584, test_loss: 0.9480, test_f1: 0.4919
 epoch: 55, train_loss: 0.9499, test_loss: 0.9476, test_f1: 0.4876
 epoch: 56, train_loss: 0.9502, test_loss: 0.9495, test_f1: 0.4905
 epoch: 57, train_loss: 0.9555, test_loss: 0.9444, test_f1: 0.4910
 epoch: 58, train_loss: 0.9458, test_loss: 0.9480, test_f1: 0.4905
 epoch: 59, train_loss: 0.9536, test_loss: 0.9394, test_f1: 0.4896
 epoch: 60, train_loss: 0.9483, test_loss: 0.9449, test_f1: 0.4894
 epoch: 61, train_loss: 0.9512, test_loss: 0.9425, test_f1: 0.4871
 epoch: 62, train_loss: 0.9567, test_loss: 0.9440, test_f1: 0.4963
 epoch: 63, train_loss: 0.9433, test_loss: 0.9431, test_f1: 0.4888
 epoch: 64, train_loss: 0.9468, test_loss: 0.9424, test_f1: 0.4859
 epoch: 65, train_loss: 0.9427, test_loss: 0.9440, test_f1: 0.5017
 epoch: 66, train_loss: 0.9440, test_loss: 0.9463, test_f1: 0.4981
 epoch: 67, train_loss: 0.9473, test_loss: 0.9498, test_f1: 0.4883
 epoch: 68, train_loss: 0.9333, test_loss: 0.9455, test_f1: 0.5001
 epoch: 69, train_loss: 0.9406, test_loss: 0.9441, test_f1: 0.5011
 epoch: 70, train_loss: 0.9454, test_loss: 0.9480, test_f1: 0.4969
 epoch: 71, train_loss: 0.9344, test_loss: 0.9463, test_f1: 0.4959
 epoch: 72, train_loss: 0.9395, test_loss: 0.9500, test_f1: 0.4983
 epoch: 73, train_loss: 0.9344, test_loss: 0.9602, test_f1: 0.4950
 epoch: 74, train_loss: 0.9379, test_loss: 0.9623, test_f1: 0.5010
 epoch: 75, train_loss: 0.9341, test_loss: 0.9556, test_f1: 0.4996
 epoch: 76, train_loss: 0.9266, test_loss: 0.9510, test_f1: 0.4979
 epoch: 77, train_loss: 0.9374, test_loss: 0.9591, test_f1: 0.5003
 epoch: 78, train_loss: 0.9303, test_loss: 0.9551, test_f1: 0.4976
 epoch: 79, train_loss: 0.9315, test_loss: 0.9582, test_f1: 0.4986
 epoch: 80, train_loss: 0.9282, test_loss: 0.9597, test_f1: 0.4996
 epoch: 81, train_loss: 0.9276, test_loss: 0.9548, test_f1: 0.4942
 epoch: 82, train_loss: 0.9228, test_loss: 0.9579, test_f1: 0.5075
 epoch: 83, train_loss: 0.9272, test_loss: 0.9578, test_f1: 0.5018
 epoch: 84, train_loss: 0.9220, test_loss: 0.9622, test_f1: 0.4969
 epoch: 85, train_loss: 0.9216, test_loss: 0.9625, test_f1: 0.5055
 epoch: 86, train_loss: 0.9284, test_loss: 0.9628, test_f1: 0.5025
 epoch: 87, train_loss: 0.9300, test_loss: 0.9564, test_f1: 0.5040
 epoch: 88, train_loss: 0.9222, test_loss: 0.9536, test_f1: 0.4987
 epoch: 89, train_loss: 0.9272, test_loss: 0.9625, test_f1: 0.5049
 epoch: 90, train_loss: 0.9297, test_loss: 0.9721, test_f1: 0.5036
 epoch: 91, train_loss: 0.9185, test_loss: 0.9715, test_f1: 0.4959
 epoch: 92, train_loss: 0.9195, test_loss: 0.9674, test_f1: 0.4988
 epoch: 93, train_loss: 0.9180, test_loss: 0.9488, test_f1: 0.5033
 epoch: 94, train_loss: 0.9130, test_loss: 0.9577, test_f1: 0.5028
 epoch: 95, train_loss: 0.9168, test_loss: 0.9638, test_f1: 0.5030
 epoch: 96, train_loss: 0.9176, test_loss: 0.9644, test_f1: 0.5084
 epoch: 97, train_loss: 0.9056, test_loss: 0.9622, test_f1: 0.5054
 epoch: 98, train_loss: 0.9159, test_loss: 0.9633, test_f1: 0.5062
 epoch: 99, train_loss: 0.9098, test_loss: 0.9661, test_f1: 0.5137
##################ITERATION #8 ****************************************
 epoch: 0, train_loss: 1.3265, test_loss: 1.3366, test_f1: 0.2270
 epoch: 1, train_loss: 1.2644, test_loss: 1.3291, test_f1: 0.2270
 epoch: 2, train_loss: 1.2456, test_loss: 1.2925, test_f1: 0.2270
 epoch: 3, train_loss: 1.2333, test_loss: 1.2324, test_f1: 0.2570
 epoch: 4, train_loss: 1.2165, test_loss: 1.1948, test_f1: 0.2841
 epoch: 5, train_loss: 1.2026, test_loss: 1.1750, test_f1: 0.3008
 epoch: 6, train_loss: 1.1975, test_loss: 1.1599, test_f1: 0.3149
 epoch: 7, train_loss: 1.1779, test_loss: 1.1444, test_f1: 0.3199
 epoch: 8, train_loss: 1.1746, test_loss: 1.1337, test_f1: 0.3190
 epoch: 9, train_loss: 1.1656, test_loss: 1.1235, test_f1: 0.3394
 epoch: 10, train_loss: 1.1530, test_loss: 1.1151, test_f1: 0.3692
 epoch: 11, train_loss: 1.1515, test_loss: 1.1084, test_f1: 0.3758
 epoch: 12, train_loss: 1.1415, test_loss: 1.1005, test_f1: 0.3877
 epoch: 13, train_loss: 1.1324, test_loss: 1.0939, test_f1: 0.3988
 epoch: 14, train_loss: 1.1248, test_loss: 1.0859, test_f1: 0.4072
 epoch: 15, train_loss: 1.1197, test_loss: 1.0801, test_f1: 0.4197
 epoch: 16, train_loss: 1.1085, test_loss: 1.0719, test_f1: 0.4210
 epoch: 17, train_loss: 1.1035, test_loss: 1.0629, test_f1: 0.4363
 epoch: 18, train_loss: 1.0928, test_loss: 1.0575, test_f1: 0.4377
 epoch: 19, train_loss: 1.0851, test_loss: 1.0483, test_f1: 0.4516
 epoch: 20, train_loss: 1.0862, test_loss: 1.0409, test_f1: 0.4653
 epoch: 21, train_loss: 1.0805, test_loss: 1.0356, test_f1: 0.4705
 epoch: 22, train_loss: 1.0650, test_loss: 1.0300, test_f1: 0.4755
 epoch: 23, train_loss: 1.0675, test_loss: 1.0261, test_f1: 0.4739
 epoch: 24, train_loss: 1.0599, test_loss: 1.0210, test_f1: 0.4689
 epoch: 25, train_loss: 1.0554, test_loss: 1.0177, test_f1: 0.4716
 epoch: 26, train_loss: 1.0434, test_loss: 1.0129, test_f1: 0.4813
 epoch: 27, train_loss: 1.0328, test_loss: 1.0097, test_f1: 0.4853
 epoch: 28, train_loss: 1.0347, test_loss: 1.0054, test_f1: 0.4870
 epoch: 29, train_loss: 1.0292, test_loss: 0.9988, test_f1: 0.4840
 epoch: 30, train_loss: 1.0268, test_loss: 0.9966, test_f1: 0.4763
 epoch: 31, train_loss: 1.0205, test_loss: 0.9923, test_f1: 0.4869
 epoch: 32, train_loss: 1.0178, test_loss: 0.9885, test_f1: 0.4959
 epoch: 33, train_loss: 1.0135, test_loss: 0.9842, test_f1: 0.4914
 epoch: 34, train_loss: 1.0139, test_loss: 0.9819, test_f1: 0.4890
 epoch: 35, train_loss: 0.9995, test_loss: 0.9802, test_f1: 0.4926
 epoch: 36, train_loss: 0.9927, test_loss: 0.9783, test_f1: 0.4911
 epoch: 37, train_loss: 1.0042, test_loss: 0.9748, test_f1: 0.4983
 epoch: 38, train_loss: 0.9945, test_loss: 0.9711, test_f1: 0.5002
 epoch: 39, train_loss: 0.9891, test_loss: 0.9663, test_f1: 0.4939
 epoch: 40, train_loss: 0.9890, test_loss: 0.9651, test_f1: 0.5024
 epoch: 41, train_loss: 0.9848, test_loss: 0.9645, test_f1: 0.5013
 epoch: 42, train_loss: 0.9788, test_loss: 0.9685, test_f1: 0.5060
 epoch: 43, train_loss: 0.9818, test_loss: 0.9617, test_f1: 0.4992
 epoch: 44, train_loss: 0.9725, test_loss: 0.9615, test_f1: 0.5087
 epoch: 45, train_loss: 0.9744, test_loss: 0.9620, test_f1: 0.5028
 epoch: 46, train_loss: 0.9706, test_loss: 0.9583, test_f1: 0.5040
 epoch: 47, train_loss: 0.9685, test_loss: 0.9547, test_f1: 0.5187
 epoch: 48, train_loss: 0.9637, test_loss: 0.9596, test_f1: 0.5145
 epoch: 49, train_loss: 0.9636, test_loss: 0.9533, test_f1: 0.5176
 epoch: 50, train_loss: 0.9538, test_loss: 0.9505, test_f1: 0.5178
 epoch: 51, train_loss: 0.9578, test_loss: 0.9516, test_f1: 0.5146
 epoch: 52, train_loss: 0.9588, test_loss: 0.9505, test_f1: 0.5190
 epoch: 53, train_loss: 0.9481, test_loss: 0.9507, test_f1: 0.5188
 epoch: 54, train_loss: 0.9512, test_loss: 0.9513, test_f1: 0.5180
 epoch: 55, train_loss: 0.9544, test_loss: 0.9530, test_f1: 0.5188
 epoch: 56, train_loss: 0.9525, test_loss: 0.9498, test_f1: 0.5180
 epoch: 57, train_loss: 0.9504, test_loss: 0.9494, test_f1: 0.5180
 epoch: 58, train_loss: 0.9453, test_loss: 0.9513, test_f1: 0.5170
 epoch: 59, train_loss: 0.9440, test_loss: 0.9517, test_f1: 0.5118
 epoch: 60, train_loss: 0.9478, test_loss: 0.9510, test_f1: 0.5104
 epoch: 61, train_loss: 0.9426, test_loss: 0.9519, test_f1: 0.5108
 epoch: 62, train_loss: 0.9441, test_loss: 0.9502, test_f1: 0.5134
 epoch: 63, train_loss: 0.9394, test_loss: 0.9488, test_f1: 0.5152
 epoch: 64, train_loss: 0.9376, test_loss: 0.9509, test_f1: 0.5112
 epoch: 65, train_loss: 0.9384, test_loss: 0.9481, test_f1: 0.5152
 epoch: 66, train_loss: 0.9407, test_loss: 0.9482, test_f1: 0.5113
 epoch: 67, train_loss: 0.9353, test_loss: 0.9473, test_f1: 0.5128
 epoch: 68, train_loss: 0.9373, test_loss: 0.9477, test_f1: 0.5173
 epoch: 69, train_loss: 0.9414, test_loss: 0.9491, test_f1: 0.5188
 epoch: 70, train_loss: 0.9368, test_loss: 0.9489, test_f1: 0.5188
 epoch: 71, train_loss: 0.9330, test_loss: 0.9491, test_f1: 0.5159
 epoch: 72, train_loss: 0.9269, test_loss: 0.9466, test_f1: 0.5095
 epoch: 73, train_loss: 0.9279, test_loss: 0.9425, test_f1: 0.5163
 epoch: 74, train_loss: 0.9303, test_loss: 0.9487, test_f1: 0.5129
 epoch: 75, train_loss: 0.9344, test_loss: 0.9501, test_f1: 0.5175
 epoch: 76, train_loss: 0.9305, test_loss: 0.9482, test_f1: 0.5236
 epoch: 77, train_loss: 0.9334, test_loss: 0.9486, test_f1: 0.5179
 epoch: 78, train_loss: 0.9307, test_loss: 0.9498, test_f1: 0.5222
 epoch: 79, train_loss: 0.9344, test_loss: 0.9473, test_f1: 0.5130
 epoch: 80, train_loss: 0.9206, test_loss: 0.9464, test_f1: 0.5269
 epoch: 81, train_loss: 0.9263, test_loss: 0.9455, test_f1: 0.5203
 epoch: 82, train_loss: 0.9272, test_loss: 0.9496, test_f1: 0.5244
 epoch: 83, train_loss: 0.9201, test_loss: 0.9499, test_f1: 0.5206
 epoch: 84, train_loss: 0.9131, test_loss: 0.9503, test_f1: 0.5235
 epoch: 85, train_loss: 0.9275, test_loss: 0.9471, test_f1: 0.5232
 epoch: 86, train_loss: 0.9265, test_loss: 0.9465, test_f1: 0.5228
 epoch: 87, train_loss: 0.9219, test_loss: 0.9451, test_f1: 0.5243
 epoch: 88, train_loss: 0.9215, test_loss: 0.9448, test_f1: 0.5300
 epoch: 89, train_loss: 0.9163, test_loss: 0.9462, test_f1: 0.5273
 epoch: 90, train_loss: 0.9131, test_loss: 0.9452, test_f1: 0.5257
 epoch: 91, train_loss: 0.9143, test_loss: 0.9477, test_f1: 0.5302
 epoch: 92, train_loss: 0.9083, test_loss: 0.9441, test_f1: 0.5225
 epoch: 93, train_loss: 0.9177, test_loss: 0.9420, test_f1: 0.5245
 epoch: 94, train_loss: 0.9082, test_loss: 0.9425, test_f1: 0.5230
 epoch: 95, train_loss: 0.9130, test_loss: 0.9456, test_f1: 0.5264
 epoch: 96, train_loss: 0.9071, test_loss: 0.9440, test_f1: 0.5213
 epoch: 97, train_loss: 0.9168, test_loss: 0.9439, test_f1: 0.5272
 epoch: 98, train_loss: 0.9059, test_loss: 0.9428, test_f1: 0.5254
 epoch: 99, train_loss: 0.9061, test_loss: 0.9385, test_f1: 0.5262
##################ITERATION #9 ****************************************
 epoch: 0, train_loss: 1.3185, test_loss: 1.3193, test_f1: 0.2270
 epoch: 1, train_loss: 1.2879, test_loss: 1.3070, test_f1: 0.2270
 epoch: 2, train_loss: 1.2620, test_loss: 1.2756, test_f1: 0.2270
 epoch: 3, train_loss: 1.2562, test_loss: 1.2325, test_f1: 0.2344
 epoch: 4, train_loss: 1.2416, test_loss: 1.2053, test_f1: 0.2799
 epoch: 5, train_loss: 1.2283, test_loss: 1.1889, test_f1: 0.2878
 epoch: 6, train_loss: 1.2246, test_loss: 1.1783, test_f1: 0.2924
 epoch: 7, train_loss: 1.2113, test_loss: 1.1684, test_f1: 0.3078
 epoch: 8, train_loss: 1.2071, test_loss: 1.1592, test_f1: 0.3185
 epoch: 9, train_loss: 1.1980, test_loss: 1.1514, test_f1: 0.3195
 epoch: 10, train_loss: 1.1847, test_loss: 1.1429, test_f1: 0.3302
 epoch: 11, train_loss: 1.1860, test_loss: 1.1345, test_f1: 0.3500
 epoch: 12, train_loss: 1.1828, test_loss: 1.1275, test_f1: 0.3575
 epoch: 13, train_loss: 1.1655, test_loss: 1.1212, test_f1: 0.3662
 epoch: 14, train_loss: 1.1580, test_loss: 1.1148, test_f1: 0.3765
 epoch: 15, train_loss: 1.1607, test_loss: 1.1106, test_f1: 0.3782
 epoch: 16, train_loss: 1.1523, test_loss: 1.1001, test_f1: 0.3954
 epoch: 17, train_loss: 1.1456, test_loss: 1.0955, test_f1: 0.4027
 epoch: 18, train_loss: 1.1345, test_loss: 1.0880, test_f1: 0.4152
 epoch: 19, train_loss: 1.1306, test_loss: 1.0779, test_f1: 0.4288
 epoch: 20, train_loss: 1.1206, test_loss: 1.0725, test_f1: 0.4363
 epoch: 21, train_loss: 1.1197, test_loss: 1.0679, test_f1: 0.4365
 epoch: 22, train_loss: 1.1113, test_loss: 1.0578, test_f1: 0.4372
 epoch: 23, train_loss: 1.1015, test_loss: 1.0558, test_f1: 0.4421
 epoch: 24, train_loss: 1.0993, test_loss: 1.0490, test_f1: 0.4442
 epoch: 25, train_loss: 1.0935, test_loss: 1.0425, test_f1: 0.4472
 epoch: 26, train_loss: 1.0818, test_loss: 1.0394, test_f1: 0.4523
 epoch: 27, train_loss: 1.0861, test_loss: 1.0326, test_f1: 0.4509
 epoch: 28, train_loss: 1.0817, test_loss: 1.0240, test_f1: 0.4483
 epoch: 29, train_loss: 1.0694, test_loss: 1.0204, test_f1: 0.4541
 epoch: 30, train_loss: 1.0686, test_loss: 1.0170, test_f1: 0.4563
 epoch: 31, train_loss: 1.0504, test_loss: 1.0054, test_f1: 0.4541
 epoch: 32, train_loss: 1.0522, test_loss: 1.0073, test_f1: 0.4591
 epoch: 33, train_loss: 1.0548, test_loss: 0.9982, test_f1: 0.4741
 epoch: 34, train_loss: 1.0359, test_loss: 0.9941, test_f1: 0.4753
 epoch: 35, train_loss: 1.0413, test_loss: 0.9899, test_f1: 0.4861
 epoch: 36, train_loss: 1.0358, test_loss: 0.9862, test_f1: 0.4848
 epoch: 37, train_loss: 1.0280, test_loss: 0.9816, test_f1: 0.4813
 epoch: 38, train_loss: 1.0225, test_loss: 0.9712, test_f1: 0.4887
 epoch: 39, train_loss: 1.0166, test_loss: 0.9693, test_f1: 0.4957
 epoch: 40, train_loss: 1.0151, test_loss: 0.9719, test_f1: 0.4864
 epoch: 41, train_loss: 1.0022, test_loss: 0.9717, test_f1: 0.4661
 epoch: 42, train_loss: 1.0043, test_loss: 0.9636, test_f1: 0.4911
 epoch: 43, train_loss: 0.9999, test_loss: 0.9540, test_f1: 0.4925
 epoch: 44, train_loss: 1.0001, test_loss: 0.9614, test_f1: 0.4783
 epoch: 45, train_loss: 0.9886, test_loss: 0.9483, test_f1: 0.4894
 epoch: 46, train_loss: 0.9915, test_loss: 0.9534, test_f1: 0.4830
 epoch: 47, train_loss: 0.9918, test_loss: 0.9478, test_f1: 0.4797
 epoch: 48, train_loss: 0.9823, test_loss: 0.9419, test_f1: 0.4800
 epoch: 49, train_loss: 0.9766, test_loss: 0.9474, test_f1: 0.4840
 epoch: 50, train_loss: 0.9677, test_loss: 0.9384, test_f1: 0.4922
 epoch: 51, train_loss: 0.9692, test_loss: 0.9387, test_f1: 0.4851
 epoch: 52, train_loss: 0.9721, test_loss: 0.9365, test_f1: 0.4878
 epoch: 53, train_loss: 0.9722, test_loss: 0.9328, test_f1: 0.4868
 epoch: 54, train_loss: 0.9638, test_loss: 0.9322, test_f1: 0.4868
 epoch: 55, train_loss: 0.9636, test_loss: 0.9356, test_f1: 0.4866
 epoch: 56, train_loss: 0.9630, test_loss: 0.9344, test_f1: 0.4890
 epoch: 57, train_loss: 0.9590, test_loss: 0.9288, test_f1: 0.4914
 epoch: 58, train_loss: 0.9606, test_loss: 0.9311, test_f1: 0.4894
 epoch: 59, train_loss: 0.9567, test_loss: 0.9261, test_f1: 0.4897
 epoch: 60, train_loss: 0.9635, test_loss: 0.9280, test_f1: 0.4945
 epoch: 61, train_loss: 0.9562, test_loss: 0.9246, test_f1: 0.4940
 epoch: 62, train_loss: 0.9484, test_loss: 0.9238, test_f1: 0.4948
 epoch: 63, train_loss: 0.9552, test_loss: 0.9256, test_f1: 0.4920
 epoch: 64, train_loss: 0.9502, test_loss: 0.9276, test_f1: 0.4884
 epoch: 65, train_loss: 0.9577, test_loss: 0.9226, test_f1: 0.4902
 epoch: 66, train_loss: 0.9519, test_loss: 0.9241, test_f1: 0.4910
 epoch: 67, train_loss: 0.9523, test_loss: 0.9208, test_f1: 0.4933
 epoch: 68, train_loss: 0.9451, test_loss: 0.9201, test_f1: 0.4887
 epoch: 69, train_loss: 0.9492, test_loss: 0.9224, test_f1: 0.4917
 epoch: 70, train_loss: 0.9446, test_loss: 0.9214, test_f1: 0.4932
 epoch: 71, train_loss: 0.9457, test_loss: 0.9189, test_f1: 0.4992
 epoch: 72, train_loss: 0.9472, test_loss: 0.9211, test_f1: 0.4924
 epoch: 73, train_loss: 0.9362, test_loss: 0.9174, test_f1: 0.4961
 epoch: 74, train_loss: 0.9360, test_loss: 0.9143, test_f1: 0.4884
 epoch: 75, train_loss: 0.9374, test_loss: 0.9202, test_f1: 0.4931
 epoch: 76, train_loss: 0.9419, test_loss: 0.9143, test_f1: 0.4911
 epoch: 77, train_loss: 0.9403, test_loss: 0.9123, test_f1: 0.4932
 epoch: 78, train_loss: 0.9353, test_loss: 0.9123, test_f1: 0.4978
 epoch: 79, train_loss: 0.9344, test_loss: 0.9116, test_f1: 0.4990
 epoch: 80, train_loss: 0.9259, test_loss: 0.9117, test_f1: 0.4956
 epoch: 81, train_loss: 0.9363, test_loss: 0.9151, test_f1: 0.4983
 epoch: 82, train_loss: 0.9323, test_loss: 0.9119, test_f1: 0.5082
 epoch: 83, train_loss: 0.9417, test_loss: 0.9127, test_f1: 0.5003
 epoch: 84, train_loss: 0.9320, test_loss: 0.9100, test_f1: 0.5007
 epoch: 85, train_loss: 0.9431, test_loss: 0.9113, test_f1: 0.4962
 epoch: 86, train_loss: 0.9298, test_loss: 0.9127, test_f1: 0.5069
 epoch: 87, train_loss: 0.9296, test_loss: 0.9122, test_f1: 0.5022
 epoch: 88, train_loss: 0.9242, test_loss: 0.9119, test_f1: 0.4948
 epoch: 89, train_loss: 0.9264, test_loss: 0.9117, test_f1: 0.5029
 epoch: 90, train_loss: 0.9261, test_loss: 0.9108, test_f1: 0.5071
 epoch: 91, train_loss: 0.9235, test_loss: 0.9062, test_f1: 0.5068
 epoch: 92, train_loss: 0.9219, test_loss: 0.9070, test_f1: 0.5095
 epoch: 93, train_loss: 0.9273, test_loss: 0.9083, test_f1: 0.5158
 epoch: 94, train_loss: 0.9157, test_loss: 0.9102, test_f1: 0.5081
 epoch: 95, train_loss: 0.9277, test_loss: 0.9082, test_f1: 0.5101
 epoch: 96, train_loss: 0.9136, test_loss: 0.9100, test_f1: 0.5098
 epoch: 97, train_loss: 0.9174, test_loss: 0.9066, test_f1: 0.5078
 epoch: 98, train_loss: 0.9169, test_loss: 0.9089, test_f1: 0.5096
 epoch: 99, train_loss: 0.9162, test_loss: 0.9024, test_f1: 0.5070

Training completed in 553.86 seconds
Best F1: 0.5359 at epoch 99
Mean F1 across iterations: 0.5165  0.0112
========================FINAL RESULTS================================
FEGIN weighted F1: 0.5359  0.0112
python main.py --data ltspice_examples --representation component_net --model FEGIN --layers 4 --hiddens 32 --batch_size 256 --lr 0.0001 --emb_size 128 --epochs 100 --save_appendix component_net_L4_H32_BS256_LR0.0001_E128 --no_val
-----



STDERR:
  File "main.py", line 370, in <module>
    main()
  File "main.py", line 254, in main
    dataset = dataset_class(
  File "/home/philip/projects/llm_inference_code_repo/Circuit-Completion-Using-GNNs/component_classification_with_link_prediction_head/evaluation/FEGIN/kernel/circuit_datasets.py", line 15, in __init__
    self.data, self.slices = torch.load(self.processed_paths[0])
  File "/home/philip/.local/lib/python3.8/site-packages/torch/serialization.py", line 1040, in load
    warnings.warn(
  File "/usr/lib/python3.8/warnings.py", line 109, in _showwarnmsg
    sw(msg.message, msg.category, msg.filename, msg.lineno,
  File "main.py", line 47, in warn_with_traceback
    traceback.print_stack(file=log)
/home/philip/projects/llm_inference_code_repo/Circuit-Completion-Using-GNNs/component_classification_with_link_prediction_head/evaluation/FEGIN/kernel/circuit_datasets.py:15: FutureWarning: You are using `torch.load` with `weights_only=False` (the current default value), which uses the default pickle module implicitly. It is possible to construct malicious pickle data which will execute arbitrary code during unpickling (See https://github.com/pytorch/pytorch/blob/main/SECURITY.md#untrusted-models for more details). In a future release, the default value for `weights_only` will be flipped to `True`. This limits the functions that could be executed during unpickling. Arbitrary objects will no longer be allowed to be loaded via this mode unless they are explicitly allowlisted by the user via `torch.serialization.add_safe_globals`. We recommend you start setting `weights_only=True` for any use case where you don't have full control of the loaded file. Please open an issue on GitHub for any issues related to this experimental feature.
  self.data, self.slices = torch.load(self.processed_paths[0])
