STDOUT:
Results will be saved in /home/philip/projects/ltspice_examples_code_repo/Circuit-Completion-Using-GNNs/component_classification_with_link_prediction_head/evaluation/FEGIN/results/model_FEGIN_dataset_ltspice_examples
Command line input: python main.py --data ltspice_examples --representation component_component --model FEGIN --layers 4 --hiddens 32 --batch_size 32 --lr 0.0001 --emb_size 250 --epochs 100 --save_appendix component_component_L4_H32_BS32_LR0.0001_E250 --no_val
 is saved.
-----
ltspice_examples - FEGIN
Using 4 layers, 32 hidden units, h = 2
Loading component_component representation dataset
ENTERED
Training FEGIN on component_component representation
Train: 3556, Test: 845
##################ITERATION #0 ****************************************
 epoch: 0, train_loss: 1.3803, test_loss: 1.3725, test_f1: 0.1604
 epoch: 1, train_loss: 1.3619, test_loss: 1.3588, test_f1: 0.2036
 epoch: 2, train_loss: 1.3458, test_loss: 1.3404, test_f1: 0.2650
 epoch: 3, train_loss: 1.3288, test_loss: 1.3190, test_f1: 0.2303
 epoch: 4, train_loss: 1.3113, test_loss: 1.3017, test_f1: 0.2274
 epoch: 5, train_loss: 1.2962, test_loss: 1.2906, test_f1: 0.2274
 epoch: 6, train_loss: 1.2827, test_loss: 1.2750, test_f1: 0.2274
 epoch: 7, train_loss: 1.2703, test_loss: 1.2614, test_f1: 0.2274
 epoch: 8, train_loss: 1.2603, test_loss: 1.2478, test_f1: 0.2274
 epoch: 9, train_loss: 1.2538, test_loss: 1.2408, test_f1: 0.2336
 epoch: 10, train_loss: 1.2408, test_loss: 1.2293, test_f1: 0.2440
 epoch: 11, train_loss: 1.2386, test_loss: 1.2247, test_f1: 0.2803
 epoch: 12, train_loss: 1.2311, test_loss: 1.2184, test_f1: 0.2933
 epoch: 13, train_loss: 1.2259, test_loss: 1.2095, test_f1: 0.2851
 epoch: 14, train_loss: 1.2220, test_loss: 1.2067, test_f1: 0.3089
 epoch: 15, train_loss: 1.2159, test_loss: 1.1992, test_f1: 0.3054
 epoch: 16, train_loss: 1.2125, test_loss: 1.1954, test_f1: 0.3236
 epoch: 17, train_loss: 1.2058, test_loss: 1.1916, test_f1: 0.3246
 epoch: 18, train_loss: 1.1978, test_loss: 1.1831, test_f1: 0.3586
 epoch: 19, train_loss: 1.1943, test_loss: 1.1796, test_f1: 0.3578
 epoch: 20, train_loss: 1.1884, test_loss: 1.1764, test_f1: 0.3515
 epoch: 21, train_loss: 1.1847, test_loss: 1.1650, test_f1: 0.3831
 epoch: 22, train_loss: 1.1783, test_loss: 1.1589, test_f1: 0.3645
 epoch: 23, train_loss: 1.1739, test_loss: 1.1494, test_f1: 0.3742
 epoch: 24, train_loss: 1.1715, test_loss: 1.1442, test_f1: 0.3801
 epoch: 25, train_loss: 1.1633, test_loss: 1.1358, test_f1: 0.3809
 epoch: 26, train_loss: 1.1583, test_loss: 1.1342, test_f1: 0.3672
 epoch: 27, train_loss: 1.1557, test_loss: 1.1286, test_f1: 0.3856
 epoch: 28, train_loss: 1.1510, test_loss: 1.1272, test_f1: 0.3547
 epoch: 29, train_loss: 1.1476, test_loss: 1.1241, test_f1: 0.4046
 epoch: 30, train_loss: 1.1516, test_loss: 1.1172, test_f1: 0.3991
 epoch: 31, train_loss: 1.1410, test_loss: 1.1168, test_f1: 0.4295
 epoch: 32, train_loss: 1.1390, test_loss: 1.1136, test_f1: 0.4138
 epoch: 33, train_loss: 1.1290, test_loss: 1.1039, test_f1: 0.4348
 epoch: 34, train_loss: 1.1346, test_loss: 1.1090, test_f1: 0.4317
 epoch: 35, train_loss: 1.1277, test_loss: 1.1063, test_f1: 0.4372
 epoch: 36, train_loss: 1.1194, test_loss: 1.1031, test_f1: 0.4471
 epoch: 37, train_loss: 1.1186, test_loss: 1.0975, test_f1: 0.4473
 epoch: 38, train_loss: 1.1159, test_loss: 1.0903, test_f1: 0.4597
 epoch: 39, train_loss: 1.1171, test_loss: 1.0901, test_f1: 0.4410
 epoch: 40, train_loss: 1.1140, test_loss: 1.0876, test_f1: 0.4467
 epoch: 41, train_loss: 1.1081, test_loss: 1.0901, test_f1: 0.4452
 epoch: 42, train_loss: 1.1092, test_loss: 1.0878, test_f1: 0.4431
 epoch: 43, train_loss: 1.1055, test_loss: 1.0854, test_f1: 0.4520
 epoch: 44, train_loss: 1.0909, test_loss: 1.0812, test_f1: 0.4481
 epoch: 45, train_loss: 1.0971, test_loss: 1.0803, test_f1: 0.4455
 epoch: 46, train_loss: 1.0950, test_loss: 1.0959, test_f1: 0.4390
 epoch: 47, train_loss: 1.0915, test_loss: 1.0942, test_f1: 0.4251
 epoch: 48, train_loss: 1.0881, test_loss: 1.0754, test_f1: 0.4370
 epoch: 49, train_loss: 1.0881, test_loss: 1.0576, test_f1: 0.4626
 epoch: 50, train_loss: 1.0795, test_loss: 1.0750, test_f1: 0.4340
 epoch: 51, train_loss: 1.0785, test_loss: 1.0732, test_f1: 0.4472
 epoch: 52, train_loss: 1.0852, test_loss: 1.0755, test_f1: 0.4442
 epoch: 53, train_loss: 1.0748, test_loss: 1.0724, test_f1: 0.4465
 epoch: 54, train_loss: 1.0684, test_loss: 1.0740, test_f1: 0.4447
 epoch: 55, train_loss: 1.0643, test_loss: 1.0694, test_f1: 0.4530
 epoch: 56, train_loss: 1.0702, test_loss: 1.0690, test_f1: 0.4371
 epoch: 57, train_loss: 1.0711, test_loss: 1.0676, test_f1: 0.4496
 epoch: 58, train_loss: 1.0642, test_loss: 1.0738, test_f1: 0.4487
 epoch: 59, train_loss: 1.0560, test_loss: 1.0682, test_f1: 0.4499
 epoch: 60, train_loss: 1.0634, test_loss: 1.0764, test_f1: 0.4482
 epoch: 61, train_loss: 1.0739, test_loss: 1.0642, test_f1: 0.4440
 epoch: 62, train_loss: 1.0552, test_loss: 1.0956, test_f1: 0.4406
 epoch: 63, train_loss: 1.0524, test_loss: 1.0599, test_f1: 0.4574
 epoch: 64, train_loss: 1.0654, test_loss: 1.0622, test_f1: 0.4570
 epoch: 65, train_loss: 1.0585, test_loss: 1.0630, test_f1: 0.4495
 epoch: 66, train_loss: 1.0561, test_loss: 1.0518, test_f1: 0.4595
 epoch: 67, train_loss: 1.0492, test_loss: 1.0647, test_f1: 0.4616
 epoch: 68, train_loss: 1.0580, test_loss: 1.0640, test_f1: 0.4585
 epoch: 69, train_loss: 1.0526, test_loss: 1.0538, test_f1: 0.4591
 epoch: 70, train_loss: 1.0626, test_loss: 1.0567, test_f1: 0.4495
 epoch: 71, train_loss: 1.0519, test_loss: 1.0562, test_f1: 0.4559
 epoch: 72, train_loss: 1.0496, test_loss: 1.0589, test_f1: 0.4582
 epoch: 73, train_loss: 1.0577, test_loss: 1.0528, test_f1: 0.4621
 epoch: 74, train_loss: 1.0574, test_loss: 1.0497, test_f1: 0.4624
 epoch: 75, train_loss: 1.0541, test_loss: 1.0564, test_f1: 0.4709
 epoch: 76, train_loss: 1.0545, test_loss: 1.0606, test_f1: 0.4679
 epoch: 77, train_loss: 1.0487, test_loss: 1.0532, test_f1: 0.4597
 epoch: 78, train_loss: 1.0455, test_loss: 1.0566, test_f1: 0.4592
 epoch: 79, train_loss: 1.0476, test_loss: 1.0511, test_f1: 0.4686
 epoch: 80, train_loss: 1.0409, test_loss: 1.0561, test_f1: 0.4638
 epoch: 81, train_loss: 1.0358, test_loss: 1.0590, test_f1: 0.4556
 epoch: 82, train_loss: 1.0419, test_loss: 1.0498, test_f1: 0.4554
 epoch: 83, train_loss: 1.0428, test_loss: 1.0435, test_f1: 0.4477
 epoch: 84, train_loss: 1.0443, test_loss: 1.0534, test_f1: 0.4581
 epoch: 85, train_loss: 1.0433, test_loss: 1.0607, test_f1: 0.4591
 epoch: 86, train_loss: 1.0424, test_loss: 1.0622, test_f1: 0.4490
 epoch: 87, train_loss: 1.0424, test_loss: 1.0492, test_f1: 0.4655
 epoch: 88, train_loss: 1.0402, test_loss: 1.0429, test_f1: 0.4689
 epoch: 89, train_loss: 1.0310, test_loss: 1.0454, test_f1: 0.4639
 epoch: 90, train_loss: 1.0321, test_loss: 1.0440, test_f1: 0.4590
 epoch: 91, train_loss: 1.0288, test_loss: 1.0414, test_f1: 0.4658
 epoch: 92, train_loss: 1.0403, test_loss: 1.0593, test_f1: 0.4552
 epoch: 93, train_loss: 1.0295, test_loss: 1.0488, test_f1: 0.4486
 epoch: 94, train_loss: 1.0415, test_loss: 1.0471, test_f1: 0.4739
 epoch: 95, train_loss: 1.0234, test_loss: 1.0560, test_f1: 0.4714
 epoch: 96, train_loss: 1.0281, test_loss: 1.0368, test_f1: 0.4637
 epoch: 97, train_loss: 1.0291, test_loss: 1.0455, test_f1: 0.4631
 epoch: 98, train_loss: 1.0251, test_loss: 1.0470, test_f1: 0.4554
 epoch: 99, train_loss: 1.0222, test_loss: 1.0509, test_f1: 0.4580
##################ITERATION #1 ****************************************
 epoch: 0, train_loss: 1.3621, test_loss: 1.3394, test_f1: 0.2729
 epoch: 1, train_loss: 1.3144, test_loss: 1.3042, test_f1: 0.2628
 epoch: 2, train_loss: 1.2919, test_loss: 1.2803, test_f1: 0.2640
 epoch: 3, train_loss: 1.2744, test_loss: 1.2602, test_f1: 0.2899
 epoch: 4, train_loss: 1.2638, test_loss: 1.2393, test_f1: 0.3141
 epoch: 5, train_loss: 1.2509, test_loss: 1.2287, test_f1: 0.3231
 epoch: 6, train_loss: 1.2428, test_loss: 1.2206, test_f1: 0.3299
 epoch: 7, train_loss: 1.2338, test_loss: 1.2117, test_f1: 0.3310
 epoch: 8, train_loss: 1.2272, test_loss: 1.2053, test_f1: 0.3364
 epoch: 9, train_loss: 1.2215, test_loss: 1.1981, test_f1: 0.3774
 epoch: 10, train_loss: 1.2167, test_loss: 1.1888, test_f1: 0.3928
 epoch: 11, train_loss: 1.2099, test_loss: 1.1840, test_f1: 0.3985
 epoch: 12, train_loss: 1.2019, test_loss: 1.1801, test_f1: 0.4015
 epoch: 13, train_loss: 1.1983, test_loss: 1.1694, test_f1: 0.4095
 epoch: 14, train_loss: 1.1924, test_loss: 1.1646, test_f1: 0.4117
 epoch: 15, train_loss: 1.1966, test_loss: 1.1541, test_f1: 0.4145
 epoch: 16, train_loss: 1.1877, test_loss: 1.1547, test_f1: 0.4148
 epoch: 17, train_loss: 1.1778, test_loss: 1.1425, test_f1: 0.4213
 epoch: 18, train_loss: 1.1865, test_loss: 1.1377, test_f1: 0.4262
 epoch: 19, train_loss: 1.1758, test_loss: 1.1299, test_f1: 0.4390
 epoch: 20, train_loss: 1.1729, test_loss: 1.1266, test_f1: 0.4226
 epoch: 21, train_loss: 1.1763, test_loss: 1.1263, test_f1: 0.4276
 epoch: 22, train_loss: 1.1685, test_loss: 1.1197, test_f1: 0.4462
 epoch: 23, train_loss: 1.1572, test_loss: 1.1206, test_f1: 0.4220
 epoch: 24, train_loss: 1.1558, test_loss: 1.1095, test_f1: 0.4319
 epoch: 25, train_loss: 1.1494, test_loss: 1.1022, test_f1: 0.4319
 epoch: 26, train_loss: 1.1544, test_loss: 1.0941, test_f1: 0.4421
 epoch: 27, train_loss: 1.1503, test_loss: 1.0911, test_f1: 0.4395
 epoch: 28, train_loss: 1.1385, test_loss: 1.0949, test_f1: 0.4392
 epoch: 29, train_loss: 1.1391, test_loss: 1.0926, test_f1: 0.4347
 epoch: 30, train_loss: 1.1302, test_loss: 1.0831, test_f1: 0.4375
 epoch: 31, train_loss: 1.1263, test_loss: 1.0784, test_f1: 0.4442
 epoch: 32, train_loss: 1.1310, test_loss: 1.0767, test_f1: 0.4441
 epoch: 33, train_loss: 1.1372, test_loss: 1.0833, test_f1: 0.4333
 epoch: 34, train_loss: 1.1163, test_loss: 1.0737, test_f1: 0.4439
 epoch: 35, train_loss: 1.1191, test_loss: 1.0696, test_f1: 0.4642
 epoch: 36, train_loss: 1.1226, test_loss: 1.0612, test_f1: 0.4515
 epoch: 37, train_loss: 1.1124, test_loss: 1.0656, test_f1: 0.4457
 epoch: 38, train_loss: 1.1065, test_loss: 1.0538, test_f1: 0.4518
 epoch: 39, train_loss: 1.1044, test_loss: 1.0539, test_f1: 0.4726
 epoch: 40, train_loss: 1.0990, test_loss: 1.0521, test_f1: 0.4844
 epoch: 41, train_loss: 1.1021, test_loss: 1.0667, test_f1: 0.4343
 epoch: 42, train_loss: 1.0962, test_loss: 1.0518, test_f1: 0.4371
 epoch: 43, train_loss: 1.0876, test_loss: 1.0491, test_f1: 0.4501
 epoch: 44, train_loss: 1.0870, test_loss: 1.0372, test_f1: 0.4459
 epoch: 45, train_loss: 1.0931, test_loss: 1.0364, test_f1: 0.4458
 epoch: 46, train_loss: 1.0868, test_loss: 1.0518, test_f1: 0.4406
 epoch: 47, train_loss: 1.0800, test_loss: 1.0347, test_f1: 0.4614
 epoch: 48, train_loss: 1.0755, test_loss: 1.0242, test_f1: 0.4698
 epoch: 49, train_loss: 1.0787, test_loss: 1.0301, test_f1: 0.4439
 epoch: 50, train_loss: 1.0716, test_loss: 1.0414, test_f1: 0.4630
 epoch: 51, train_loss: 1.0717, test_loss: 1.0330, test_f1: 0.4522
 epoch: 52, train_loss: 1.0752, test_loss: 1.0285, test_f1: 0.4467
 epoch: 53, train_loss: 1.0700, test_loss: 1.0238, test_f1: 0.4631
 epoch: 54, train_loss: 1.0717, test_loss: 1.0147, test_f1: 0.4611
 epoch: 55, train_loss: 1.0668, test_loss: 1.0235, test_f1: 0.4569
 epoch: 56, train_loss: 1.0688, test_loss: 1.0288, test_f1: 0.4725
 epoch: 57, train_loss: 1.0637, test_loss: 1.0171, test_f1: 0.4667
 epoch: 58, train_loss: 1.0660, test_loss: 1.0174, test_f1: 0.4809
 epoch: 59, train_loss: 1.0601, test_loss: 1.0218, test_f1: 0.4684
 epoch: 60, train_loss: 1.0649, test_loss: 1.0231, test_f1: 0.4709
 epoch: 61, train_loss: 1.0576, test_loss: 1.0343, test_f1: 0.4661
 epoch: 62, train_loss: 1.0509, test_loss: 1.0205, test_f1: 0.4632
 epoch: 63, train_loss: 1.0562, test_loss: 1.0260, test_f1: 0.4661
 epoch: 64, train_loss: 1.0435, test_loss: 1.0323, test_f1: 0.4550
 epoch: 65, train_loss: 1.0530, test_loss: 1.0185, test_f1: 0.4774
 epoch: 66, train_loss: 1.0520, test_loss: 1.0271, test_f1: 0.4781
 epoch: 67, train_loss: 1.0557, test_loss: 1.0193, test_f1: 0.4666
 epoch: 68, train_loss: 1.0570, test_loss: 1.0034, test_f1: 0.4805
 epoch: 69, train_loss: 1.0551, test_loss: 1.0122, test_f1: 0.4638
 epoch: 70, train_loss: 1.0514, test_loss: 1.0167, test_f1: 0.4853
 epoch: 71, train_loss: 1.0538, test_loss: 1.0136, test_f1: 0.4740
 epoch: 72, train_loss: 1.0456, test_loss: 1.0209, test_f1: 0.4732
 epoch: 73, train_loss: 1.0563, test_loss: 1.0259, test_f1: 0.4653
 epoch: 74, train_loss: 1.0587, test_loss: 1.0070, test_f1: 0.4826
 epoch: 75, train_loss: 1.0341, test_loss: 1.0253, test_f1: 0.4668
 epoch: 76, train_loss: 1.0430, test_loss: 0.9989, test_f1: 0.4601
 epoch: 77, train_loss: 1.0434, test_loss: 1.0124, test_f1: 0.4815
 epoch: 78, train_loss: 1.0439, test_loss: 1.0150, test_f1: 0.4703
 epoch: 79, train_loss: 1.0416, test_loss: 1.0205, test_f1: 0.4812
 epoch: 80, train_loss: 1.0482, test_loss: 1.0251, test_f1: 0.4702
 epoch: 81, train_loss: 1.0459, test_loss: 1.0047, test_f1: 0.4879
 epoch: 82, train_loss: 1.0397, test_loss: 1.0204, test_f1: 0.4594
 epoch: 83, train_loss: 1.0427, test_loss: 1.0099, test_f1: 0.4793
 epoch: 84, train_loss: 1.0319, test_loss: 0.9981, test_f1: 0.4869
 epoch: 85, train_loss: 1.0383, test_loss: 1.0138, test_f1: 0.4764
 epoch: 86, train_loss: 1.0380, test_loss: 1.0242, test_f1: 0.4785
 epoch: 87, train_loss: 1.0343, test_loss: 1.0109, test_f1: 0.4766
 epoch: 88, train_loss: 1.0260, test_loss: 0.9941, test_f1: 0.4770
 epoch: 89, train_loss: 1.0325, test_loss: 1.0077, test_f1: 0.4922
 epoch: 90, train_loss: 1.0256, test_loss: 1.0062, test_f1: 0.4760
 epoch: 91, train_loss: 1.0279, test_loss: 1.0011, test_f1: 0.4837
 epoch: 92, train_loss: 1.0251, test_loss: 1.0103, test_f1: 0.4695
 epoch: 93, train_loss: 1.0309, test_loss: 1.0171, test_f1: 0.4633
 epoch: 94, train_loss: 1.0262, test_loss: 1.0134, test_f1: 0.4800
 epoch: 95, train_loss: 1.0305, test_loss: 1.0092, test_f1: 0.4531
 epoch: 96, train_loss: 1.0438, test_loss: 1.0024, test_f1: 0.4554
 epoch: 97, train_loss: 1.0263, test_loss: 1.0129, test_f1: 0.4612
 epoch: 98, train_loss: 1.0216, test_loss: 0.9950, test_f1: 0.4604
 epoch: 99, train_loss: 1.0319, test_loss: 1.0005, test_f1: 0.4591
##################ITERATION #2 ****************************************
 epoch: 0, train_loss: 1.3112, test_loss: 1.2879, test_f1: 0.2960
 epoch: 1, train_loss: 1.2781, test_loss: 1.2710, test_f1: 0.2888
 epoch: 2, train_loss: 1.2658, test_loss: 1.2532, test_f1: 0.2864
 epoch: 3, train_loss: 1.2523, test_loss: 1.2368, test_f1: 0.2908
 epoch: 4, train_loss: 1.2398, test_loss: 1.2214, test_f1: 0.2928
 epoch: 5, train_loss: 1.2294, test_loss: 1.2102, test_f1: 0.3001
 epoch: 6, train_loss: 1.2234, test_loss: 1.1958, test_f1: 0.3360
 epoch: 7, train_loss: 1.2175, test_loss: 1.1884, test_f1: 0.3592
 epoch: 8, train_loss: 1.2067, test_loss: 1.1761, test_f1: 0.3844
 epoch: 9, train_loss: 1.1972, test_loss: 1.1657, test_f1: 0.3952
 epoch: 10, train_loss: 1.1915, test_loss: 1.1585, test_f1: 0.4149
 epoch: 11, train_loss: 1.1922, test_loss: 1.1566, test_f1: 0.4188
 epoch: 12, train_loss: 1.1762, test_loss: 1.1402, test_f1: 0.4264
 epoch: 13, train_loss: 1.1730, test_loss: 1.1357, test_f1: 0.4267
 epoch: 14, train_loss: 1.1706, test_loss: 1.1251, test_f1: 0.4384
 epoch: 15, train_loss: 1.1596, test_loss: 1.1232, test_f1: 0.4401
 epoch: 16, train_loss: 1.1544, test_loss: 1.1091, test_f1: 0.4454
 epoch: 17, train_loss: 1.1469, test_loss: 1.1098, test_f1: 0.4471
 epoch: 18, train_loss: 1.1424, test_loss: 1.1068, test_f1: 0.4374
 epoch: 19, train_loss: 1.1433, test_loss: 1.0978, test_f1: 0.4384
 epoch: 20, train_loss: 1.1322, test_loss: 1.0891, test_f1: 0.4449
 epoch: 21, train_loss: 1.1291, test_loss: 1.0784, test_f1: 0.4469
 epoch: 22, train_loss: 1.1253, test_loss: 1.0742, test_f1: 0.4530
 epoch: 23, train_loss: 1.1272, test_loss: 1.0837, test_f1: 0.4341
 epoch: 24, train_loss: 1.1172, test_loss: 1.0690, test_f1: 0.4496
 epoch: 25, train_loss: 1.1112, test_loss: 1.0684, test_f1: 0.4418
 epoch: 26, train_loss: 1.1148, test_loss: 1.0676, test_f1: 0.4513
 epoch: 27, train_loss: 1.1185, test_loss: 1.0594, test_f1: 0.4609
 epoch: 28, train_loss: 1.1131, test_loss: 1.0524, test_f1: 0.4525
 epoch: 29, train_loss: 1.1069, test_loss: 1.0516, test_f1: 0.4458
 epoch: 30, train_loss: 1.0919, test_loss: 1.0569, test_f1: 0.4433
 epoch: 31, train_loss: 1.0977, test_loss: 1.0485, test_f1: 0.4526
 epoch: 32, train_loss: 1.0967, test_loss: 1.0381, test_f1: 0.4461
 epoch: 33, train_loss: 1.0906, test_loss: 1.0416, test_f1: 0.4587
 epoch: 34, train_loss: 1.0790, test_loss: 1.0451, test_f1: 0.4514
 epoch: 35, train_loss: 1.0835, test_loss: 1.0443, test_f1: 0.4499
 epoch: 36, train_loss: 1.0852, test_loss: 1.0333, test_f1: 0.4453
 epoch: 37, train_loss: 1.0769, test_loss: 1.0358, test_f1: 0.4622
 epoch: 38, train_loss: 1.0671, test_loss: 1.0230, test_f1: 0.4663
 epoch: 39, train_loss: 1.0729, test_loss: 1.0272, test_f1: 0.4520
 epoch: 40, train_loss: 1.0641, test_loss: 1.0333, test_f1: 0.4448
 epoch: 41, train_loss: 1.0550, test_loss: 1.0259, test_f1: 0.4588
 epoch: 42, train_loss: 1.0697, test_loss: 1.0591, test_f1: 0.4489
 epoch: 43, train_loss: 1.0605, test_loss: 1.0359, test_f1: 0.4422
 epoch: 44, train_loss: 1.0714, test_loss: 1.0230, test_f1: 0.4472
 epoch: 45, train_loss: 1.0637, test_loss: 1.0297, test_f1: 0.4469
 epoch: 46, train_loss: 1.0611, test_loss: 1.0311, test_f1: 0.4589
 epoch: 47, train_loss: 1.0570, test_loss: 1.0092, test_f1: 0.4605
 epoch: 48, train_loss: 1.0530, test_loss: 1.0306, test_f1: 0.4522
 epoch: 49, train_loss: 1.0468, test_loss: 1.0090, test_f1: 0.4586
 epoch: 50, train_loss: 1.0427, test_loss: 1.0195, test_f1: 0.4616
 epoch: 51, train_loss: 1.0401, test_loss: 1.0157, test_f1: 0.4544
 epoch: 52, train_loss: 1.0404, test_loss: 1.0182, test_f1: 0.4575
 epoch: 53, train_loss: 1.0405, test_loss: 1.0250, test_f1: 0.4397
 epoch: 54, train_loss: 1.0462, test_loss: 1.0206, test_f1: 0.4608
 epoch: 55, train_loss: 1.0423, test_loss: 1.0175, test_f1: 0.4621
 epoch: 56, train_loss: 1.0456, test_loss: 1.0204, test_f1: 0.4574
 epoch: 57, train_loss: 1.0284, test_loss: 1.0241, test_f1: 0.4535
 epoch: 58, train_loss: 1.0447, test_loss: 1.0173, test_f1: 0.4638
 epoch: 59, train_loss: 1.0352, test_loss: 1.0249, test_f1: 0.4526
 epoch: 60, train_loss: 1.0367, test_loss: 1.0142, test_f1: 0.4537
 epoch: 61, train_loss: 1.0419, test_loss: 1.0001, test_f1: 0.4634
 epoch: 62, train_loss: 1.0375, test_loss: 1.0031, test_f1: 0.4565
 epoch: 63, train_loss: 1.0245, test_loss: 1.0037, test_f1: 0.4736
 epoch: 64, train_loss: 1.0309, test_loss: 1.0136, test_f1: 0.4751
 epoch: 65, train_loss: 1.0235, test_loss: 0.9982, test_f1: 0.4567
 epoch: 66, train_loss: 1.0153, test_loss: 1.0136, test_f1: 0.4584
 epoch: 67, train_loss: 1.0303, test_loss: 1.0028, test_f1: 0.4747
 epoch: 68, train_loss: 1.0291, test_loss: 1.0228, test_f1: 0.4592
 epoch: 69, train_loss: 1.0252, test_loss: 1.0092, test_f1: 0.4592
 epoch: 70, train_loss: 1.0347, test_loss: 1.0039, test_f1: 0.4582
 epoch: 71, train_loss: 1.0220, test_loss: 1.0154, test_f1: 0.4516
 epoch: 72, train_loss: 1.0176, test_loss: 0.9995, test_f1: 0.4711
 epoch: 73, train_loss: 1.0283, test_loss: 1.0061, test_f1: 0.4750
 epoch: 74, train_loss: 1.0097, test_loss: 0.9984, test_f1: 0.4743
 epoch: 75, train_loss: 1.0118, test_loss: 0.9972, test_f1: 0.4717
 epoch: 76, train_loss: 1.0179, test_loss: 1.0093, test_f1: 0.4685
 epoch: 77, train_loss: 1.0223, test_loss: 1.0185, test_f1: 0.4677
 epoch: 78, train_loss: 1.0150, test_loss: 0.9940, test_f1: 0.4849
 epoch: 79, train_loss: 1.0227, test_loss: 0.9925, test_f1: 0.4815
 epoch: 80, train_loss: 1.0152, test_loss: 1.0189, test_f1: 0.4517
 epoch: 81, train_loss: 1.0153, test_loss: 1.0133, test_f1: 0.4572
 epoch: 82, train_loss: 1.0120, test_loss: 0.9947, test_f1: 0.4775
 epoch: 83, train_loss: 1.0134, test_loss: 1.0018, test_f1: 0.4657
 epoch: 84, train_loss: 1.0078, test_loss: 0.9969, test_f1: 0.4653
 epoch: 85, train_loss: 1.0164, test_loss: 1.0009, test_f1: 0.4720
 epoch: 86, train_loss: 1.0095, test_loss: 0.9912, test_f1: 0.4815
 epoch: 87, train_loss: 1.0128, test_loss: 0.9885, test_f1: 0.4791
 epoch: 88, train_loss: 1.0115, test_loss: 1.0117, test_f1: 0.4576
 epoch: 89, train_loss: 1.0149, test_loss: 0.9985, test_f1: 0.4744
 epoch: 90, train_loss: 1.0067, test_loss: 0.9912, test_f1: 0.4725
 epoch: 91, train_loss: 1.0071, test_loss: 0.9939, test_f1: 0.4722
 epoch: 92, train_loss: 1.0073, test_loss: 0.9892, test_f1: 0.4722
 epoch: 93, train_loss: 1.0071, test_loss: 0.9986, test_f1: 0.4787
 epoch: 94, train_loss: 0.9956, test_loss: 0.9835, test_f1: 0.4837
 epoch: 95, train_loss: 0.9953, test_loss: 1.0023, test_f1: 0.4665
 epoch: 96, train_loss: 0.9979, test_loss: 0.9906, test_f1: 0.4640
 epoch: 97, train_loss: 0.9881, test_loss: 0.9996, test_f1: 0.4772
 epoch: 98, train_loss: 1.0012, test_loss: 0.9959, test_f1: 0.4673
 epoch: 99, train_loss: 1.0032, test_loss: 0.9870, test_f1: 0.4735
##################ITERATION #3 ****************************************
 epoch: 0, train_loss: 1.3144, test_loss: 1.2976, test_f1: 0.2271
 epoch: 1, train_loss: 1.2713, test_loss: 1.2777, test_f1: 0.2301
 epoch: 2, train_loss: 1.2586, test_loss: 1.2532, test_f1: 0.2274
 epoch: 3, train_loss: 1.2524, test_loss: 1.2528, test_f1: 0.2274
 epoch: 4, train_loss: 1.2425, test_loss: 1.2250, test_f1: 0.2541
 epoch: 5, train_loss: 1.2305, test_loss: 1.2049, test_f1: 0.2925
 epoch: 6, train_loss: 1.2173, test_loss: 1.1990, test_f1: 0.3266
 epoch: 7, train_loss: 1.2096, test_loss: 1.1943, test_f1: 0.3873
 epoch: 8, train_loss: 1.2030, test_loss: 1.1703, test_f1: 0.3922
 epoch: 9, train_loss: 1.1943, test_loss: 1.1607, test_f1: 0.3870
 epoch: 10, train_loss: 1.1930, test_loss: 1.1582, test_f1: 0.3909
 epoch: 11, train_loss: 1.1804, test_loss: 1.1528, test_f1: 0.3929
 epoch: 12, train_loss: 1.1782, test_loss: 1.1367, test_f1: 0.4004
 epoch: 13, train_loss: 1.1622, test_loss: 1.1295, test_f1: 0.4318
 epoch: 14, train_loss: 1.1668, test_loss: 1.1202, test_f1: 0.4088
 epoch: 15, train_loss: 1.1601, test_loss: 1.1185, test_f1: 0.4303
 epoch: 16, train_loss: 1.1546, test_loss: 1.1084, test_f1: 0.4336
 epoch: 17, train_loss: 1.1480, test_loss: 1.1053, test_f1: 0.4359
 epoch: 18, train_loss: 1.1481, test_loss: 1.0986, test_f1: 0.4365
 epoch: 19, train_loss: 1.1422, test_loss: 1.0946, test_f1: 0.4649
 epoch: 20, train_loss: 1.1330, test_loss: 1.0870, test_f1: 0.4435
 epoch: 21, train_loss: 1.1431, test_loss: 1.0800, test_f1: 0.4526
 epoch: 22, train_loss: 1.1328, test_loss: 1.0761, test_f1: 0.4525
 epoch: 23, train_loss: 1.1264, test_loss: 1.0811, test_f1: 0.4710
 epoch: 24, train_loss: 1.1190, test_loss: 1.0993, test_f1: 0.4420
 epoch: 25, train_loss: 1.1182, test_loss: 1.0601, test_f1: 0.4606
 epoch: 26, train_loss: 1.1169, test_loss: 1.0988, test_f1: 0.4477
 epoch: 27, train_loss: 1.1120, test_loss: 1.0547, test_f1: 0.4725
 epoch: 28, train_loss: 1.1044, test_loss: 1.0502, test_f1: 0.4736
 epoch: 29, train_loss: 1.0969, test_loss: 1.0437, test_f1: 0.4680
 epoch: 30, train_loss: 1.0984, test_loss: 1.0459, test_f1: 0.4724
 epoch: 31, train_loss: 1.0932, test_loss: 1.0376, test_f1: 0.4840
 epoch: 32, train_loss: 1.0844, test_loss: 1.0305, test_f1: 0.4739
 epoch: 33, train_loss: 1.0940, test_loss: 1.0540, test_f1: 0.4761
 epoch: 34, train_loss: 1.0836, test_loss: 1.0233, test_f1: 0.4764
 epoch: 35, train_loss: 1.0844, test_loss: 1.0218, test_f1: 0.4790
 epoch: 36, train_loss: 1.0773, test_loss: 1.0167, test_f1: 0.4886
 epoch: 37, train_loss: 1.0707, test_loss: 1.0146, test_f1: 0.5094
 epoch: 38, train_loss: 1.0706, test_loss: 1.0021, test_f1: 0.5007
 epoch: 39, train_loss: 1.0634, test_loss: 0.9996, test_f1: 0.5197
 epoch: 40, train_loss: 1.0596, test_loss: 0.9880, test_f1: 0.5077
 epoch: 41, train_loss: 1.0637, test_loss: 0.9903, test_f1: 0.5240
 epoch: 42, train_loss: 1.0563, test_loss: 0.9935, test_f1: 0.5215
 epoch: 43, train_loss: 1.0493, test_loss: 0.9822, test_f1: 0.5158
 epoch: 44, train_loss: 1.0566, test_loss: 0.9819, test_f1: 0.5117
 epoch: 45, train_loss: 1.0379, test_loss: 0.9787, test_f1: 0.5072
 epoch: 46, train_loss: 1.0414, test_loss: 0.9663, test_f1: 0.5232
 epoch: 47, train_loss: 1.0407, test_loss: 0.9815, test_f1: 0.4909
 epoch: 48, train_loss: 1.0420, test_loss: 0.9589, test_f1: 0.5091
 epoch: 49, train_loss: 1.0321, test_loss: 0.9623, test_f1: 0.5127
 epoch: 50, train_loss: 1.0284, test_loss: 0.9549, test_f1: 0.5058
 epoch: 51, train_loss: 1.0270, test_loss: 0.9742, test_f1: 0.5229
 epoch: 52, train_loss: 1.0209, test_loss: 0.9766, test_f1: 0.5042
 epoch: 53, train_loss: 1.0255, test_loss: 0.9667, test_f1: 0.5204
 epoch: 54, train_loss: 1.0269, test_loss: 0.9577, test_f1: 0.5181
 epoch: 55, train_loss: 1.0172, test_loss: 0.9678, test_f1: 0.5131
 epoch: 56, train_loss: 1.0230, test_loss: 0.9552, test_f1: 0.5044
 epoch: 57, train_loss: 1.0161, test_loss: 0.9620, test_f1: 0.5030
 epoch: 58, train_loss: 1.0145, test_loss: 0.9456, test_f1: 0.5083
 epoch: 59, train_loss: 1.0195, test_loss: 0.9567, test_f1: 0.4986
 epoch: 60, train_loss: 1.0144, test_loss: 0.9506, test_f1: 0.5052
 epoch: 61, train_loss: 1.0161, test_loss: 0.9537, test_f1: 0.4881
 epoch: 62, train_loss: 1.0139, test_loss: 0.9452, test_f1: 0.5055
 epoch: 63, train_loss: 1.0064, test_loss: 0.9415, test_f1: 0.5184
 epoch: 64, train_loss: 1.0074, test_loss: 0.9434, test_f1: 0.5052
 epoch: 65, train_loss: 1.0072, test_loss: 0.9455, test_f1: 0.5194
 epoch: 66, train_loss: 0.9992, test_loss: 0.9488, test_f1: 0.4838
 epoch: 67, train_loss: 1.0078, test_loss: 0.9687, test_f1: 0.4986
 epoch: 68, train_loss: 0.9990, test_loss: 1.0126, test_f1: 0.4755
 epoch: 69, train_loss: 1.0046, test_loss: 1.0230, test_f1: 0.4811
 epoch: 70, train_loss: 0.9916, test_loss: 0.9613, test_f1: 0.5017
 epoch: 71, train_loss: 1.0037, test_loss: 0.9480, test_f1: 0.5146
 epoch: 72, train_loss: 0.9985, test_loss: 0.9425, test_f1: 0.5106
 epoch: 73, train_loss: 1.0041, test_loss: 0.9339, test_f1: 0.5119
 epoch: 74, train_loss: 0.9915, test_loss: 0.9393, test_f1: 0.5101
 epoch: 75, train_loss: 0.9841, test_loss: 0.9420, test_f1: 0.5085
 epoch: 76, train_loss: 0.9998, test_loss: 0.9381, test_f1: 0.5099
 epoch: 77, train_loss: 0.9918, test_loss: 0.9360, test_f1: 0.5043
 epoch: 78, train_loss: 0.9851, test_loss: 0.9541, test_f1: 0.4998
 epoch: 79, train_loss: 0.9942, test_loss: 0.9489, test_f1: 0.4889
 epoch: 80, train_loss: 0.9772, test_loss: 0.9362, test_f1: 0.5072
 epoch: 81, train_loss: 0.9767, test_loss: 0.9359, test_f1: 0.5088
 epoch: 82, train_loss: 0.9838, test_loss: 0.9434, test_f1: 0.4988
 epoch: 83, train_loss: 0.9941, test_loss: 0.9403, test_f1: 0.4938
 epoch: 84, train_loss: 0.9780, test_loss: 0.9303, test_f1: 0.5067
 epoch: 85, train_loss: 0.9823, test_loss: 0.9398, test_f1: 0.4927
 epoch: 86, train_loss: 0.9782, test_loss: 0.9365, test_f1: 0.5073
 epoch: 87, train_loss: 0.9733, test_loss: 0.9291, test_f1: 0.5022
 epoch: 88, train_loss: 0.9771, test_loss: 0.9549, test_f1: 0.4903
 epoch: 89, train_loss: 0.9703, test_loss: 0.9243, test_f1: 0.5099
 epoch: 90, train_loss: 0.9731, test_loss: 0.9396, test_f1: 0.5070
 epoch: 91, train_loss: 0.9727, test_loss: 0.9325, test_f1: 0.5053
 epoch: 92, train_loss: 0.9725, test_loss: 0.9414, test_f1: 0.5005
 epoch: 93, train_loss: 0.9726, test_loss: 0.9329, test_f1: 0.5005
 epoch: 94, train_loss: 0.9759, test_loss: 0.9349, test_f1: 0.5065
 epoch: 95, train_loss: 0.9662, test_loss: 0.9274, test_f1: 0.5081
 epoch: 96, train_loss: 0.9740, test_loss: 0.9361, test_f1: 0.4874
 epoch: 97, train_loss: 0.9746, test_loss: 0.9389, test_f1: 0.4901
 epoch: 98, train_loss: 0.9707, test_loss: 0.9398, test_f1: 0.5082
 epoch: 99, train_loss: 0.9657, test_loss: 0.9327, test_f1: 0.4986
##################ITERATION #4 ****************************************
 epoch: 0, train_loss: 1.2936, test_loss: 1.2606, test_f1: 0.2614
 epoch: 1, train_loss: 1.2582, test_loss: 1.2351, test_f1: 0.2708
 epoch: 2, train_loss: 1.2461, test_loss: 1.2223, test_f1: 0.2570
 epoch: 3, train_loss: 1.2379, test_loss: 1.2071, test_f1: 0.2714
 epoch: 4, train_loss: 1.2277, test_loss: 1.1991, test_f1: 0.3060
 epoch: 5, train_loss: 1.2217, test_loss: 1.1907, test_f1: 0.3271
 epoch: 6, train_loss: 1.2154, test_loss: 1.1767, test_f1: 0.3570
 epoch: 7, train_loss: 1.2057, test_loss: 1.1703, test_f1: 0.3694
 epoch: 8, train_loss: 1.2034, test_loss: 1.1640, test_f1: 0.3862
 epoch: 9, train_loss: 1.2018, test_loss: 1.1595, test_f1: 0.4081
 epoch: 10, train_loss: 1.1912, test_loss: 1.1516, test_f1: 0.4387
 epoch: 11, train_loss: 1.1842, test_loss: 1.1477, test_f1: 0.4202
 epoch: 12, train_loss: 1.1798, test_loss: 1.1370, test_f1: 0.4365
 epoch: 13, train_loss: 1.1667, test_loss: 1.1373, test_f1: 0.4408
 epoch: 14, train_loss: 1.1669, test_loss: 1.1244, test_f1: 0.4542
 epoch: 15, train_loss: 1.1639, test_loss: 1.1111, test_f1: 0.4406
 epoch: 16, train_loss: 1.1592, test_loss: 1.1161, test_f1: 0.4407
 epoch: 17, train_loss: 1.1577, test_loss: 1.1125, test_f1: 0.4241
 epoch: 18, train_loss: 1.1442, test_loss: 1.1067, test_f1: 0.4519
 epoch: 19, train_loss: 1.1489, test_loss: 1.1025, test_f1: 0.4572
 epoch: 20, train_loss: 1.1447, test_loss: 1.1047, test_f1: 0.4433
 epoch: 21, train_loss: 1.1389, test_loss: 1.0947, test_f1: 0.4542
 epoch: 22, train_loss: 1.1346, test_loss: 1.0901, test_f1: 0.4463
 epoch: 23, train_loss: 1.1321, test_loss: 1.0862, test_f1: 0.4596
 epoch: 24, train_loss: 1.1220, test_loss: 1.0882, test_f1: 0.4378
 epoch: 25, train_loss: 1.1218, test_loss: 1.0807, test_f1: 0.4460
 epoch: 26, train_loss: 1.1104, test_loss: 1.0762, test_f1: 0.4470
 epoch: 27, train_loss: 1.1146, test_loss: 1.0807, test_f1: 0.4503
 epoch: 28, train_loss: 1.1063, test_loss: 1.0725, test_f1: 0.4683
 epoch: 29, train_loss: 1.1006, test_loss: 1.0731, test_f1: 0.4434
 epoch: 30, train_loss: 1.1023, test_loss: 1.0668, test_f1: 0.4429
 epoch: 31, train_loss: 1.1002, test_loss: 1.0724, test_f1: 0.4342
 epoch: 32, train_loss: 1.0904, test_loss: 1.0638, test_f1: 0.4312
 epoch: 33, train_loss: 1.1063, test_loss: 1.0704, test_f1: 0.4408
 epoch: 34, train_loss: 1.0836, test_loss: 1.0590, test_f1: 0.4297
 epoch: 35, train_loss: 1.0846, test_loss: 1.0529, test_f1: 0.4370
 epoch: 36, train_loss: 1.0768, test_loss: 1.0552, test_f1: 0.4288
 epoch: 37, train_loss: 1.0823, test_loss: 1.0472, test_f1: 0.4268
 epoch: 38, train_loss: 1.0767, test_loss: 1.0479, test_f1: 0.4803
 epoch: 39, train_loss: 1.0814, test_loss: 1.0469, test_f1: 0.4371
 epoch: 40, train_loss: 1.0612, test_loss: 1.0579, test_f1: 0.4342
 epoch: 41, train_loss: 1.0654, test_loss: 1.0451, test_f1: 0.4425
 epoch: 42, train_loss: 1.0709, test_loss: 1.0356, test_f1: 0.4524
 epoch: 43, train_loss: 1.0640, test_loss: 1.0406, test_f1: 0.4277
 epoch: 44, train_loss: 1.0550, test_loss: 1.0333, test_f1: 0.4461
 epoch: 45, train_loss: 1.0526, test_loss: 1.0291, test_f1: 0.4513
 epoch: 46, train_loss: 1.0499, test_loss: 1.0401, test_f1: 0.4523
 epoch: 47, train_loss: 1.0540, test_loss: 1.0321, test_f1: 0.4570
 epoch: 48, train_loss: 1.0465, test_loss: 1.0227, test_f1: 0.4472
 epoch: 49, train_loss: 1.0363, test_loss: 1.0238, test_f1: 0.4529
 epoch: 50, train_loss: 1.0468, test_loss: 1.0298, test_f1: 0.4535
 epoch: 51, train_loss: 1.0409, test_loss: 1.0311, test_f1: 0.4551
 epoch: 52, train_loss: 1.0366, test_loss: 1.0299, test_f1: 0.4529
 epoch: 53, train_loss: 1.0333, test_loss: 1.0258, test_f1: 0.4499
 epoch: 54, train_loss: 1.0303, test_loss: 1.0249, test_f1: 0.4611
 epoch: 55, train_loss: 1.0337, test_loss: 1.0436, test_f1: 0.4375
 epoch: 56, train_loss: 1.0287, test_loss: 1.0204, test_f1: 0.4616
 epoch: 57, train_loss: 1.0238, test_loss: 1.0277, test_f1: 0.4662
 epoch: 58, train_loss: 1.0315, test_loss: 1.0334, test_f1: 0.4454
 epoch: 59, train_loss: 1.0350, test_loss: 1.0220, test_f1: 0.4503
 epoch: 60, train_loss: 1.0285, test_loss: 1.0264, test_f1: 0.4619
 epoch: 61, train_loss: 1.0206, test_loss: 1.0217, test_f1: 0.4747
 epoch: 62, train_loss: 1.0207, test_loss: 1.0284, test_f1: 0.4550
 epoch: 63, train_loss: 1.0158, test_loss: 1.0215, test_f1: 0.4765
 epoch: 64, train_loss: 1.0175, test_loss: 1.0265, test_f1: 0.4711
 epoch: 65, train_loss: 1.0191, test_loss: 1.0235, test_f1: 0.4724
 epoch: 66, train_loss: 1.0204, test_loss: 1.0112, test_f1: 0.4685
 epoch: 67, train_loss: 1.0202, test_loss: 1.0148, test_f1: 0.4585
 epoch: 68, train_loss: 1.0156, test_loss: 1.0294, test_f1: 0.4638
 epoch: 69, train_loss: 1.0127, test_loss: 1.0170, test_f1: 0.4508
 epoch: 70, train_loss: 1.0216, test_loss: 1.0225, test_f1: 0.4632
 epoch: 71, train_loss: 1.0026, test_loss: 1.0197, test_f1: 0.4781
 epoch: 72, train_loss: 1.0063, test_loss: 1.0109, test_f1: 0.4794
 epoch: 73, train_loss: 1.0144, test_loss: 1.0283, test_f1: 0.4655
 epoch: 74, train_loss: 1.0135, test_loss: 1.0320, test_f1: 0.4667
 epoch: 75, train_loss: 1.0033, test_loss: 1.0099, test_f1: 0.4568
 epoch: 76, train_loss: 1.0113, test_loss: 1.0147, test_f1: 0.4673
 epoch: 77, train_loss: 1.0110, test_loss: 1.0131, test_f1: 0.4751
 epoch: 78, train_loss: 1.0124, test_loss: 1.0216, test_f1: 0.4695
 epoch: 79, train_loss: 1.0151, test_loss: 1.0175, test_f1: 0.4654
 epoch: 80, train_loss: 1.0057, test_loss: 1.0191, test_f1: 0.4496
 epoch: 81, train_loss: 1.0119, test_loss: 1.0158, test_f1: 0.4792
 epoch: 82, train_loss: 1.0011, test_loss: 1.0078, test_f1: 0.4612
 epoch: 83, train_loss: 1.0081, test_loss: 0.9964, test_f1: 0.4577
 epoch: 84, train_loss: 1.0038, test_loss: 1.0089, test_f1: 0.4622
 epoch: 85, train_loss: 1.0064, test_loss: 1.0093, test_f1: 0.4610
 epoch: 86, train_loss: 0.9983, test_loss: 1.0155, test_f1: 0.4724
 epoch: 87, train_loss: 0.9985, test_loss: 1.0273, test_f1: 0.4585
 epoch: 88, train_loss: 1.0081, test_loss: 1.0073, test_f1: 0.4609
 epoch: 89, train_loss: 0.9938, test_loss: 1.0202, test_f1: 0.4814
 epoch: 90, train_loss: 1.0013, test_loss: 1.0139, test_f1: 0.4851
 epoch: 91, train_loss: 0.9951, test_loss: 1.0203, test_f1: 0.4689
 epoch: 92, train_loss: 0.9900, test_loss: 1.0110, test_f1: 0.4563
 epoch: 93, train_loss: 0.9884, test_loss: 1.0085, test_f1: 0.4729
 epoch: 94, train_loss: 0.9947, test_loss: 1.0020, test_f1: 0.4599
 epoch: 95, train_loss: 0.9936, test_loss: 1.0074, test_f1: 0.4749
 epoch: 96, train_loss: 0.9859, test_loss: 1.0054, test_f1: 0.4802
 epoch: 97, train_loss: 0.9794, test_loss: 1.0018, test_f1: 0.4720
 epoch: 98, train_loss: 0.9816, test_loss: 1.0237, test_f1: 0.4646
 epoch: 99, train_loss: 0.9847, test_loss: 1.0148, test_f1: 0.4579
##################ITERATION #5 ****************************************
 epoch: 0, train_loss: 1.2924, test_loss: 1.3052, test_f1: 0.2585
 epoch: 1, train_loss: 1.2540, test_loss: 1.2409, test_f1: 0.3192
 epoch: 2, train_loss: 1.2389, test_loss: 1.2234, test_f1: 0.3036
 epoch: 3, train_loss: 1.2314, test_loss: 1.2091, test_f1: 0.3891
 epoch: 4, train_loss: 1.2314, test_loss: 1.1974, test_f1: 0.3918
 epoch: 5, train_loss: 1.2209, test_loss: 1.1931, test_f1: 0.4071
 epoch: 6, train_loss: 1.2149, test_loss: 1.1762, test_f1: 0.4141
 epoch: 7, train_loss: 1.2105, test_loss: 1.1736, test_f1: 0.4155
 epoch: 8, train_loss: 1.2095, test_loss: 1.1612, test_f1: 0.4123
 epoch: 9, train_loss: 1.2035, test_loss: 1.1564, test_f1: 0.4140
 epoch: 10, train_loss: 1.2047, test_loss: 1.1484, test_f1: 0.4234
 epoch: 11, train_loss: 1.1917, test_loss: 1.1434, test_f1: 0.4116
 epoch: 12, train_loss: 1.1844, test_loss: 1.1302, test_f1: 0.4466
 epoch: 13, train_loss: 1.1810, test_loss: 1.1289, test_f1: 0.4460
 epoch: 14, train_loss: 1.1795, test_loss: 1.1295, test_f1: 0.4330
 epoch: 15, train_loss: 1.1712, test_loss: 1.1186, test_f1: 0.4473
 epoch: 16, train_loss: 1.1733, test_loss: 1.1090, test_f1: 0.4504
 epoch: 17, train_loss: 1.1758, test_loss: 1.1102, test_f1: 0.4494
 epoch: 18, train_loss: 1.1616, test_loss: 1.0994, test_f1: 0.4626
 epoch: 19, train_loss: 1.1667, test_loss: 1.1030, test_f1: 0.4639
 epoch: 20, train_loss: 1.1521, test_loss: 1.1009, test_f1: 0.4586
 epoch: 21, train_loss: 1.1617, test_loss: 1.0925, test_f1: 0.4688
 epoch: 22, train_loss: 1.1523, test_loss: 1.0870, test_f1: 0.4640
 epoch: 23, train_loss: 1.1472, test_loss: 1.1310, test_f1: 0.4480
 epoch: 24, train_loss: 1.1407, test_loss: 1.0888, test_f1: 0.4862
 epoch: 25, train_loss: 1.1431, test_loss: 1.0943, test_f1: 0.4583
 epoch: 26, train_loss: 1.1343, test_loss: 1.0910, test_f1: 0.4745
 epoch: 27, train_loss: 1.1377, test_loss: 1.0829, test_f1: 0.4622
 epoch: 28, train_loss: 1.1397, test_loss: 1.0876, test_f1: 0.4614
 epoch: 29, train_loss: 1.1476, test_loss: 1.0727, test_f1: 0.4831
 epoch: 30, train_loss: 1.1306, test_loss: 1.1154, test_f1: 0.4505
 epoch: 31, train_loss: 1.1226, test_loss: 1.0762, test_f1: 0.4776
 epoch: 32, train_loss: 1.1143, test_loss: 1.1148, test_f1: 0.4267
 epoch: 33, train_loss: 1.1211, test_loss: 1.1055, test_f1: 0.4441
 epoch: 34, train_loss: 1.1118, test_loss: 1.0990, test_f1: 0.4472
 epoch: 35, train_loss: 1.1060, test_loss: 1.0586, test_f1: 0.4808
 epoch: 36, train_loss: 1.1019, test_loss: 1.0797, test_f1: 0.4666
 epoch: 37, train_loss: 1.1069, test_loss: 1.0458, test_f1: 0.4823
 epoch: 38, train_loss: 1.1112, test_loss: 1.1267, test_f1: 0.4275
 epoch: 39, train_loss: 1.1093, test_loss: 1.0341, test_f1: 0.4646
 epoch: 40, train_loss: 1.1039, test_loss: 1.1067, test_f1: 0.4507
 epoch: 41, train_loss: 1.1074, test_loss: 1.0366, test_f1: 0.4878
 epoch: 42, train_loss: 1.0912, test_loss: 1.0406, test_f1: 0.4687
 epoch: 43, train_loss: 1.0856, test_loss: 1.0675, test_f1: 0.4747
 epoch: 44, train_loss: 1.0989, test_loss: 1.0306, test_f1: 0.4596
 epoch: 45, train_loss: 1.0819, test_loss: 1.1089, test_f1: 0.4461
 epoch: 46, train_loss: 1.0910, test_loss: 1.0247, test_f1: 0.4679
 epoch: 47, train_loss: 1.0824, test_loss: 1.0670, test_f1: 0.4396
 epoch: 48, train_loss: 1.0854, test_loss: 1.0254, test_f1: 0.4647
 epoch: 49, train_loss: 1.0786, test_loss: 1.0422, test_f1: 0.4567
 epoch: 50, train_loss: 1.0718, test_loss: 1.0079, test_f1: 0.4745
 epoch: 51, train_loss: 1.0653, test_loss: 1.0244, test_f1: 0.4550
 epoch: 52, train_loss: 1.0642, test_loss: 1.0259, test_f1: 0.4660
 epoch: 53, train_loss: 1.0654, test_loss: 1.0064, test_f1: 0.4765
 epoch: 54, train_loss: 1.0740, test_loss: 1.0209, test_f1: 0.4732
 epoch: 55, train_loss: 1.0659, test_loss: 1.0691, test_f1: 0.4547
 epoch: 56, train_loss: 1.0635, test_loss: 1.0593, test_f1: 0.4538
 epoch: 57, train_loss: 1.0618, test_loss: 1.0324, test_f1: 0.4543
 epoch: 58, train_loss: 1.0652, test_loss: 1.0277, test_f1: 0.4631
 epoch: 59, train_loss: 1.0698, test_loss: 1.0119, test_f1: 0.4701
 epoch: 60, train_loss: 1.0574, test_loss: 1.0316, test_f1: 0.4655
 epoch: 61, train_loss: 1.0654, test_loss: 1.0276, test_f1: 0.4633
 epoch: 62, train_loss: 1.0600, test_loss: 1.0227, test_f1: 0.4668
 epoch: 63, train_loss: 1.0638, test_loss: 1.0277, test_f1: 0.4582
 epoch: 64, train_loss: 1.0498, test_loss: 1.0155, test_f1: 0.4737
 epoch: 65, train_loss: 1.0572, test_loss: 1.0070, test_f1: 0.4762
 epoch: 66, train_loss: 1.0607, test_loss: 1.0308, test_f1: 0.4583
 epoch: 67, train_loss: 1.0555, test_loss: 0.9968, test_f1: 0.4700
 epoch: 68, train_loss: 1.0502, test_loss: 1.0100, test_f1: 0.4774
 epoch: 69, train_loss: 1.0561, test_loss: 1.0019, test_f1: 0.4698
 epoch: 70, train_loss: 1.0466, test_loss: 0.9993, test_f1: 0.4791
 epoch: 71, train_loss: 1.0460, test_loss: 1.0156, test_f1: 0.4717
 epoch: 72, train_loss: 1.0446, test_loss: 1.0954, test_f1: 0.4514
 epoch: 73, train_loss: 1.0454, test_loss: 0.9999, test_f1: 0.4725
 epoch: 74, train_loss: 1.0403, test_loss: 1.0047, test_f1: 0.4774
 epoch: 75, train_loss: 1.0447, test_loss: 1.0193, test_f1: 0.4727
 epoch: 76, train_loss: 1.0489, test_loss: 0.9863, test_f1: 0.4697
 epoch: 77, train_loss: 1.0474, test_loss: 1.0142, test_f1: 0.4673
 epoch: 78, train_loss: 1.0456, test_loss: 1.0633, test_f1: 0.4637
 epoch: 79, train_loss: 1.0445, test_loss: 0.9997, test_f1: 0.4748
 epoch: 80, train_loss: 1.0394, test_loss: 1.0071, test_f1: 0.4773
 epoch: 81, train_loss: 1.0465, test_loss: 1.0104, test_f1: 0.4635
 epoch: 82, train_loss: 1.0405, test_loss: 1.0502, test_f1: 0.4713
 epoch: 83, train_loss: 1.0393, test_loss: 1.0184, test_f1: 0.4636
 epoch: 84, train_loss: 1.0302, test_loss: 0.9909, test_f1: 0.4786
 epoch: 85, train_loss: 1.0262, test_loss: 1.0348, test_f1: 0.4534
 epoch: 86, train_loss: 1.0285, test_loss: 0.9909, test_f1: 0.4632
 epoch: 87, train_loss: 1.0318, test_loss: 0.9955, test_f1: 0.4769
 epoch: 88, train_loss: 1.0324, test_loss: 0.9863, test_f1: 0.4818
 epoch: 89, train_loss: 1.0313, test_loss: 1.0027, test_f1: 0.4695
 epoch: 90, train_loss: 1.0300, test_loss: 0.9963, test_f1: 0.4776
 epoch: 91, train_loss: 1.0341, test_loss: 1.0319, test_f1: 0.4700
 epoch: 92, train_loss: 1.0350, test_loss: 0.9808, test_f1: 0.4765
 epoch: 93, train_loss: 1.0295, test_loss: 0.9935, test_f1: 0.4618
 epoch: 94, train_loss: 1.0235, test_loss: 0.9937, test_f1: 0.4690
 epoch: 95, train_loss: 1.0076, test_loss: 1.0043, test_f1: 0.4748
 epoch: 96, train_loss: 1.0366, test_loss: 1.0120, test_f1: 0.4689
 epoch: 97, train_loss: 1.0217, test_loss: 1.0759, test_f1: 0.4751
 epoch: 98, train_loss: 1.0241, test_loss: 1.0510, test_f1: 0.4718
 epoch: 99, train_loss: 1.0255, test_loss: 0.9888, test_f1: 0.4691
##################ITERATION #6 ****************************************
 epoch: 0, train_loss: 1.3093, test_loss: 1.2372, test_f1: 0.2381
 epoch: 1, train_loss: 1.2620, test_loss: 1.2158, test_f1: 0.2588
 epoch: 2, train_loss: 1.2484, test_loss: 1.1996, test_f1: 0.2928
 epoch: 3, train_loss: 1.2423, test_loss: 1.1894, test_f1: 0.3244
 epoch: 4, train_loss: 1.2376, test_loss: 1.1805, test_f1: 0.3700
 epoch: 5, train_loss: 1.2199, test_loss: 1.1697, test_f1: 0.4022
 epoch: 6, train_loss: 1.2154, test_loss: 1.1657, test_f1: 0.3872
 epoch: 7, train_loss: 1.2021, test_loss: 1.1611, test_f1: 0.4017
 epoch: 8, train_loss: 1.1992, test_loss: 1.1538, test_f1: 0.4011
 epoch: 9, train_loss: 1.1824, test_loss: 1.1445, test_f1: 0.4090
 epoch: 10, train_loss: 1.1931, test_loss: 1.1425, test_f1: 0.4075
 epoch: 11, train_loss: 1.1897, test_loss: 1.1377, test_f1: 0.4461
 epoch: 12, train_loss: 1.1772, test_loss: 1.1353, test_f1: 0.4432
 epoch: 13, train_loss: 1.1788, test_loss: 1.1287, test_f1: 0.4340
 epoch: 14, train_loss: 1.1770, test_loss: 1.1310, test_f1: 0.4164
 epoch: 15, train_loss: 1.1720, test_loss: 1.1201, test_f1: 0.4222
 epoch: 16, train_loss: 1.1603, test_loss: 1.1167, test_f1: 0.4454
 epoch: 17, train_loss: 1.1652, test_loss: 1.1220, test_f1: 0.4325
 epoch: 18, train_loss: 1.1486, test_loss: 1.1123, test_f1: 0.4459
 epoch: 19, train_loss: 1.1520, test_loss: 1.1017, test_f1: 0.4264
 epoch: 20, train_loss: 1.1558, test_loss: 1.1030, test_f1: 0.4455
 epoch: 21, train_loss: 1.1484, test_loss: 1.0978, test_f1: 0.4166
 epoch: 22, train_loss: 1.1487, test_loss: 1.0997, test_f1: 0.4515
 epoch: 23, train_loss: 1.1436, test_loss: 1.0874, test_f1: 0.4470
 epoch: 24, train_loss: 1.1416, test_loss: 1.0952, test_f1: 0.4283
 epoch: 25, train_loss: 1.1457, test_loss: 1.0926, test_f1: 0.4335
 epoch: 26, train_loss: 1.1369, test_loss: 1.0864, test_f1: 0.4694
 epoch: 27, train_loss: 1.1325, test_loss: 1.0787, test_f1: 0.4406
 epoch: 28, train_loss: 1.1318, test_loss: 1.0769, test_f1: 0.4781
 epoch: 29, train_loss: 1.1291, test_loss: 1.0754, test_f1: 0.4524
 epoch: 30, train_loss: 1.1244, test_loss: 1.0729, test_f1: 0.4394
 epoch: 31, train_loss: 1.1147, test_loss: 1.0700, test_f1: 0.4434
 epoch: 32, train_loss: 1.1275, test_loss: 1.0679, test_f1: 0.4565
 epoch: 33, train_loss: 1.1179, test_loss: 1.0673, test_f1: 0.4421
 epoch: 34, train_loss: 1.1061, test_loss: 1.0641, test_f1: 0.4346
 epoch: 35, train_loss: 1.1202, test_loss: 1.0487, test_f1: 0.4694
 epoch: 36, train_loss: 1.1065, test_loss: 1.0586, test_f1: 0.4508
 epoch: 37, train_loss: 1.1046, test_loss: 1.0537, test_f1: 0.4561
 epoch: 38, train_loss: 1.1022, test_loss: 1.0508, test_f1: 0.4474
 epoch: 39, train_loss: 1.0990, test_loss: 1.0457, test_f1: 0.4500
 epoch: 40, train_loss: 1.0967, test_loss: 1.0511, test_f1: 0.4521
 epoch: 41, train_loss: 1.1043, test_loss: 1.0548, test_f1: 0.4462
 epoch: 42, train_loss: 1.0958, test_loss: 1.0471, test_f1: 0.4708
 epoch: 43, train_loss: 1.0890, test_loss: 1.0428, test_f1: 0.4587
 epoch: 44, train_loss: 1.0957, test_loss: 1.0340, test_f1: 0.4531
 epoch: 45, train_loss: 1.0880, test_loss: 1.0433, test_f1: 0.4736
 epoch: 46, train_loss: 1.0812, test_loss: 1.0358, test_f1: 0.4582
 epoch: 47, train_loss: 1.0814, test_loss: 1.0245, test_f1: 0.4619
 epoch: 48, train_loss: 1.0697, test_loss: 1.0190, test_f1: 0.4684
 epoch: 49, train_loss: 1.0697, test_loss: 1.0117, test_f1: 0.4804
 epoch: 50, train_loss: 1.0707, test_loss: 1.0188, test_f1: 0.4612
 epoch: 51, train_loss: 1.0751, test_loss: 1.0227, test_f1: 0.4826
 epoch: 52, train_loss: 1.0730, test_loss: 1.0250, test_f1: 0.4766
 epoch: 53, train_loss: 1.0612, test_loss: 1.0025, test_f1: 0.4883
 epoch: 54, train_loss: 1.0602, test_loss: 1.0245, test_f1: 0.4769
 epoch: 55, train_loss: 1.0580, test_loss: 1.0377, test_f1: 0.4780
 epoch: 56, train_loss: 1.0647, test_loss: 1.0093, test_f1: 0.4794
 epoch: 57, train_loss: 1.0559, test_loss: 1.0104, test_f1: 0.4749
 epoch: 58, train_loss: 1.0616, test_loss: 0.9985, test_f1: 0.4741
 epoch: 59, train_loss: 1.0677, test_loss: 1.0058, test_f1: 0.4825
 epoch: 60, train_loss: 1.0590, test_loss: 1.0242, test_f1: 0.4724
 epoch: 61, train_loss: 1.0615, test_loss: 1.0049, test_f1: 0.4687
 epoch: 62, train_loss: 1.0594, test_loss: 0.9973, test_f1: 0.4869
 epoch: 63, train_loss: 1.0505, test_loss: 0.9961, test_f1: 0.4933
 epoch: 64, train_loss: 1.0555, test_loss: 1.0154, test_f1: 0.4741
 epoch: 65, train_loss: 1.0537, test_loss: 1.0350, test_f1: 0.4716
 epoch: 66, train_loss: 1.0532, test_loss: 1.0083, test_f1: 0.4821
 epoch: 67, train_loss: 1.0630, test_loss: 1.0135, test_f1: 0.4807
 epoch: 68, train_loss: 1.0533, test_loss: 1.0312, test_f1: 0.4794
 epoch: 69, train_loss: 1.0469, test_loss: 1.0023, test_f1: 0.4824
 epoch: 70, train_loss: 1.0566, test_loss: 1.0079, test_f1: 0.4841
 epoch: 71, train_loss: 1.0444, test_loss: 1.0139, test_f1: 0.4882
 epoch: 72, train_loss: 1.0503, test_loss: 1.0043, test_f1: 0.4772
 epoch: 73, train_loss: 1.0492, test_loss: 1.0056, test_f1: 0.4881
 epoch: 74, train_loss: 1.0448, test_loss: 1.0206, test_f1: 0.4673
 epoch: 75, train_loss: 1.0557, test_loss: 0.9919, test_f1: 0.4862
 epoch: 76, train_loss: 1.0439, test_loss: 0.9965, test_f1: 0.4802
 epoch: 77, train_loss: 1.0406, test_loss: 0.9994, test_f1: 0.4826
 epoch: 78, train_loss: 1.0420, test_loss: 0.9917, test_f1: 0.4878
 epoch: 79, train_loss: 1.0421, test_loss: 0.9932, test_f1: 0.4883
 epoch: 80, train_loss: 1.0391, test_loss: 0.9815, test_f1: 0.4914
 epoch: 81, train_loss: 1.0388, test_loss: 0.9858, test_f1: 0.4950
 epoch: 82, train_loss: 1.0421, test_loss: 0.9916, test_f1: 0.4855
 epoch: 83, train_loss: 1.0338, test_loss: 0.9988, test_f1: 0.4865
 epoch: 84, train_loss: 1.0385, test_loss: 0.9889, test_f1: 0.4834
 epoch: 85, train_loss: 1.0482, test_loss: 0.9923, test_f1: 0.4983
 epoch: 86, train_loss: 1.0331, test_loss: 0.9878, test_f1: 0.4700
 epoch: 87, train_loss: 1.0379, test_loss: 0.9870, test_f1: 0.4963
 epoch: 88, train_loss: 1.0342, test_loss: 0.9947, test_f1: 0.4925
 epoch: 89, train_loss: 1.0310, test_loss: 0.9913, test_f1: 0.4819
 epoch: 90, train_loss: 1.0355, test_loss: 0.9916, test_f1: 0.4829
 epoch: 91, train_loss: 1.0247, test_loss: 0.9844, test_f1: 0.4987
 epoch: 92, train_loss: 1.0366, test_loss: 0.9925, test_f1: 0.4847
 epoch: 93, train_loss: 1.0277, test_loss: 0.9903, test_f1: 0.4788
 epoch: 94, train_loss: 1.0272, test_loss: 0.9850, test_f1: 0.4961
 epoch: 95, train_loss: 1.0248, test_loss: 0.9925, test_f1: 0.4591
 epoch: 96, train_loss: 1.0235, test_loss: 0.9887, test_f1: 0.4622
 epoch: 97, train_loss: 1.0203, test_loss: 1.0284, test_f1: 0.4864
 epoch: 98, train_loss: 1.0181, test_loss: 0.9848, test_f1: 0.5037
 epoch: 99, train_loss: 1.0252, test_loss: 0.9928, test_f1: 0.4775
##################ITERATION #7 ****************************************
 epoch: 0, train_loss: 1.3270, test_loss: 1.3497, test_f1: 0.2734
 epoch: 1, train_loss: 1.2845, test_loss: 1.3135, test_f1: 0.2793
 epoch: 2, train_loss: 1.2695, test_loss: 1.2759, test_f1: 0.2927
 epoch: 3, train_loss: 1.2499, test_loss: 1.3168, test_f1: 0.2995
 epoch: 4, train_loss: 1.2455, test_loss: 1.2777, test_f1: 0.3131
 epoch: 5, train_loss: 1.2349, test_loss: 1.2241, test_f1: 0.3467
 epoch: 6, train_loss: 1.2341, test_loss: 1.2417, test_f1: 0.3535
 epoch: 7, train_loss: 1.2266, test_loss: 1.1948, test_f1: 0.3658
 epoch: 8, train_loss: 1.2208, test_loss: 1.2442, test_f1: 0.3827
 epoch: 9, train_loss: 1.2209, test_loss: 1.1751, test_f1: 0.3904
 epoch: 10, train_loss: 1.2122, test_loss: 1.1796, test_f1: 0.3885
 epoch: 11, train_loss: 1.2071, test_loss: 1.1683, test_f1: 0.4102
 epoch: 12, train_loss: 1.1997, test_loss: 1.2816, test_f1: 0.4137
 epoch: 13, train_loss: 1.1947, test_loss: 1.1639, test_f1: 0.4262
 epoch: 14, train_loss: 1.1884, test_loss: 1.1861, test_f1: 0.4460
 epoch: 15, train_loss: 1.1967, test_loss: 1.1451, test_f1: 0.4216
 epoch: 16, train_loss: 1.1760, test_loss: 1.1326, test_f1: 0.4332
 epoch: 17, train_loss: 1.1697, test_loss: 1.1263, test_f1: 0.4470
 epoch: 18, train_loss: 1.1737, test_loss: 1.1356, test_f1: 0.4378
 epoch: 19, train_loss: 1.1732, test_loss: 1.1722, test_f1: 0.4517
 epoch: 20, train_loss: 1.1637, test_loss: 1.1370, test_f1: 0.4391
 epoch: 21, train_loss: 1.1532, test_loss: 1.1139, test_f1: 0.4457
 epoch: 22, train_loss: 1.1626, test_loss: 1.1121, test_f1: 0.4560
 epoch: 23, train_loss: 1.1504, test_loss: 1.1545, test_f1: 0.4550
 epoch: 24, train_loss: 1.1437, test_loss: 1.1123, test_f1: 0.4547
 epoch: 25, train_loss: 1.1333, test_loss: 1.1042, test_f1: 0.4489
 epoch: 26, train_loss: 1.1491, test_loss: 1.1131, test_f1: 0.4388
 epoch: 27, train_loss: 1.1327, test_loss: 1.0878, test_f1: 0.4502
 epoch: 28, train_loss: 1.1260, test_loss: 1.0810, test_f1: 0.4512
 epoch: 29, train_loss: 1.1230, test_loss: 1.1091, test_f1: 0.4554
 epoch: 30, train_loss: 1.1205, test_loss: 1.0719, test_f1: 0.4480
 epoch: 31, train_loss: 1.1188, test_loss: 1.0694, test_f1: 0.4585
 epoch: 32, train_loss: 1.1146, test_loss: 1.0779, test_f1: 0.4589
 epoch: 33, train_loss: 1.1134, test_loss: 1.0999, test_f1: 0.4596
 epoch: 34, train_loss: 1.1084, test_loss: 1.0817, test_f1: 0.4507
 epoch: 35, train_loss: 1.1091, test_loss: 1.0757, test_f1: 0.4618
 epoch: 36, train_loss: 1.1042, test_loss: 1.0978, test_f1: 0.4431
 epoch: 37, train_loss: 1.1017, test_loss: 1.0882, test_f1: 0.4468
 epoch: 38, train_loss: 1.1095, test_loss: 1.0743, test_f1: 0.4523
 epoch: 39, train_loss: 1.1054, test_loss: 1.0828, test_f1: 0.4605
 epoch: 40, train_loss: 1.0927, test_loss: 1.0593, test_f1: 0.4520
 epoch: 41, train_loss: 1.0885, test_loss: 1.0931, test_f1: 0.4591
 epoch: 42, train_loss: 1.1006, test_loss: 1.0753, test_f1: 0.4475
 epoch: 43, train_loss: 1.0900, test_loss: 1.0699, test_f1: 0.4626
 epoch: 44, train_loss: 1.0921, test_loss: 1.0636, test_f1: 0.4578
 epoch: 45, train_loss: 1.0789, test_loss: 1.0597, test_f1: 0.4521
 epoch: 46, train_loss: 1.0774, test_loss: 1.0640, test_f1: 0.4719
 epoch: 47, train_loss: 1.0877, test_loss: 1.0518, test_f1: 0.4618
 epoch: 48, train_loss: 1.0779, test_loss: 1.0285, test_f1: 0.4643
 epoch: 49, train_loss: 1.0784, test_loss: 1.0281, test_f1: 0.4672
 epoch: 50, train_loss: 1.0725, test_loss: 1.0670, test_f1: 0.4621
 epoch: 51, train_loss: 1.0818, test_loss: 1.0608, test_f1: 0.4646
 epoch: 52, train_loss: 1.0664, test_loss: 1.0696, test_f1: 0.4631
 epoch: 53, train_loss: 1.0687, test_loss: 1.0541, test_f1: 0.4597
 epoch: 54, train_loss: 1.0695, test_loss: 1.0299, test_f1: 0.4622
 epoch: 55, train_loss: 1.0592, test_loss: 1.0429, test_f1: 0.4674
 epoch: 56, train_loss: 1.0697, test_loss: 1.0352, test_f1: 0.4637
 epoch: 57, train_loss: 1.0686, test_loss: 1.0693, test_f1: 0.4696
 epoch: 58, train_loss: 1.0491, test_loss: 1.0384, test_f1: 0.4613
 epoch: 59, train_loss: 1.0611, test_loss: 1.0401, test_f1: 0.4654
 epoch: 60, train_loss: 1.0561, test_loss: 1.0280, test_f1: 0.4651
 epoch: 61, train_loss: 1.0480, test_loss: 1.0345, test_f1: 0.4627
 epoch: 62, train_loss: 1.0546, test_loss: 1.0341, test_f1: 0.4609
 epoch: 63, train_loss: 1.0531, test_loss: 1.0334, test_f1: 0.4726
 epoch: 64, train_loss: 1.0550, test_loss: 1.0485, test_f1: 0.4601
 epoch: 65, train_loss: 1.0541, test_loss: 1.0511, test_f1: 0.4584
 epoch: 66, train_loss: 1.0492, test_loss: 1.0383, test_f1: 0.4690
 epoch: 67, train_loss: 1.0552, test_loss: 1.0542, test_f1: 0.4743
 epoch: 68, train_loss: 1.0561, test_loss: 1.0306, test_f1: 0.4661
 epoch: 69, train_loss: 1.0507, test_loss: 1.0325, test_f1: 0.4673
 epoch: 70, train_loss: 1.0540, test_loss: 1.0257, test_f1: 0.4698
 epoch: 71, train_loss: 1.0428, test_loss: 1.0195, test_f1: 0.4557
 epoch: 72, train_loss: 1.0417, test_loss: 1.0264, test_f1: 0.4677
 epoch: 73, train_loss: 1.0394, test_loss: 1.0750, test_f1: 0.4654
 epoch: 74, train_loss: 1.0482, test_loss: 1.0483, test_f1: 0.4586
 epoch: 75, train_loss: 1.0433, test_loss: 1.0316, test_f1: 0.4645
 epoch: 76, train_loss: 1.0414, test_loss: 1.0538, test_f1: 0.4542
 epoch: 77, train_loss: 1.0463, test_loss: 1.0250, test_f1: 0.4564
 epoch: 78, train_loss: 1.0344, test_loss: 1.0125, test_f1: 0.4758
 epoch: 79, train_loss: 1.0368, test_loss: 1.0303, test_f1: 0.4546
 epoch: 80, train_loss: 1.0370, test_loss: 1.0197, test_f1: 0.4605
 epoch: 81, train_loss: 1.0346, test_loss: 1.0214, test_f1: 0.4574
 epoch: 82, train_loss: 1.0492, test_loss: 1.0281, test_f1: 0.4596
 epoch: 83, train_loss: 1.0369, test_loss: 1.0162, test_f1: 0.4567
 epoch: 84, train_loss: 1.0358, test_loss: 1.0158, test_f1: 0.4656
 epoch: 85, train_loss: 1.0332, test_loss: 1.0418, test_f1: 0.4683
 epoch: 86, train_loss: 1.0322, test_loss: 1.0204, test_f1: 0.4655
 epoch: 87, train_loss: 1.0307, test_loss: 1.0264, test_f1: 0.4604
 epoch: 88, train_loss: 1.0347, test_loss: 1.0191, test_f1: 0.4596
 epoch: 89, train_loss: 1.0262, test_loss: 1.0118, test_f1: 0.4592
 epoch: 90, train_loss: 1.0383, test_loss: 1.0081, test_f1: 0.4623
 epoch: 91, train_loss: 1.0199, test_loss: 1.0287, test_f1: 0.4746
 epoch: 92, train_loss: 1.0235, test_loss: 1.0226, test_f1: 0.4626
 epoch: 93, train_loss: 1.0282, test_loss: 1.0156, test_f1: 0.4778
 epoch: 94, train_loss: 1.0303, test_loss: 1.0229, test_f1: 0.4732
 epoch: 95, train_loss: 1.0308, test_loss: 1.0172, test_f1: 0.4803
 epoch: 96, train_loss: 1.0215, test_loss: 1.0157, test_f1: 0.4614
 epoch: 97, train_loss: 1.0322, test_loss: 0.9944, test_f1: 0.4830
 epoch: 98, train_loss: 1.0219, test_loss: 1.0163, test_f1: 0.4719
 epoch: 99, train_loss: 1.0290, test_loss: 1.0202, test_f1: 0.4701
##################ITERATION #8 ****************************************
 epoch: 0, train_loss: 1.2991, test_loss: 1.2559, test_f1: 0.2926
 epoch: 1, train_loss: 1.2575, test_loss: 1.2317, test_f1: 0.3392
 epoch: 2, train_loss: 1.2502, test_loss: 1.2122, test_f1: 0.3191
 epoch: 3, train_loss: 1.2387, test_loss: 1.2027, test_f1: 0.3547
 epoch: 4, train_loss: 1.2228, test_loss: 1.1909, test_f1: 0.3478
 epoch: 5, train_loss: 1.2067, test_loss: 1.1846, test_f1: 0.3876
 epoch: 6, train_loss: 1.2100, test_loss: 1.1643, test_f1: 0.4208
 epoch: 7, train_loss: 1.2056, test_loss: 1.1568, test_f1: 0.4238
 epoch: 8, train_loss: 1.1955, test_loss: 1.1513, test_f1: 0.4367
 epoch: 9, train_loss: 1.1895, test_loss: 1.1450, test_f1: 0.4464
 epoch: 10, train_loss: 1.1796, test_loss: 1.1330, test_f1: 0.4444
 epoch: 11, train_loss: 1.1751, test_loss: 1.1304, test_f1: 0.4386
 epoch: 12, train_loss: 1.1605, test_loss: 1.1187, test_f1: 0.4166
 epoch: 13, train_loss: 1.1570, test_loss: 1.1073, test_f1: 0.4307
 epoch: 14, train_loss: 1.1526, test_loss: 1.1014, test_f1: 0.4359
 epoch: 15, train_loss: 1.1501, test_loss: 1.1022, test_f1: 0.4363
 epoch: 16, train_loss: 1.1420, test_loss: 1.0938, test_f1: 0.4376
 epoch: 17, train_loss: 1.1389, test_loss: 1.0864, test_f1: 0.4446
 epoch: 18, train_loss: 1.1325, test_loss: 1.0897, test_f1: 0.4410
 epoch: 19, train_loss: 1.1372, test_loss: 1.0786, test_f1: 0.4484
 epoch: 20, train_loss: 1.1220, test_loss: 1.0782, test_f1: 0.4432
 epoch: 21, train_loss: 1.1197, test_loss: 1.0639, test_f1: 0.4504
 epoch: 22, train_loss: 1.1133, test_loss: 1.0633, test_f1: 0.4426
 epoch: 23, train_loss: 1.1166, test_loss: 1.0599, test_f1: 0.4573
 epoch: 24, train_loss: 1.1066, test_loss: 1.0572, test_f1: 0.4420
 epoch: 25, train_loss: 1.0983, test_loss: 1.0578, test_f1: 0.4504
 epoch: 26, train_loss: 1.1029, test_loss: 1.0536, test_f1: 0.4440
 epoch: 27, train_loss: 1.0937, test_loss: 1.0433, test_f1: 0.4633
 epoch: 28, train_loss: 1.0998, test_loss: 1.0409, test_f1: 0.4618
 epoch: 29, train_loss: 1.0853, test_loss: 1.0389, test_f1: 0.4629
 epoch: 30, train_loss: 1.0810, test_loss: 1.0388, test_f1: 0.4577
 epoch: 31, train_loss: 1.0900, test_loss: 1.0288, test_f1: 0.4653
 epoch: 32, train_loss: 1.0776, test_loss: 1.0281, test_f1: 0.4699
 epoch: 33, train_loss: 1.0688, test_loss: 1.0233, test_f1: 0.4780
 epoch: 34, train_loss: 1.0748, test_loss: 1.0177, test_f1: 0.4780
 epoch: 35, train_loss: 1.0752, test_loss: 1.0029, test_f1: 0.4921
 epoch: 36, train_loss: 1.0624, test_loss: 1.0162, test_f1: 0.4903
 epoch: 37, train_loss: 1.0698, test_loss: 1.0023, test_f1: 0.4837
 epoch: 38, train_loss: 1.0688, test_loss: 1.0184, test_f1: 0.4778
 epoch: 39, train_loss: 1.0570, test_loss: 1.0030, test_f1: 0.4794
 epoch: 40, train_loss: 1.0562, test_loss: 1.0214, test_f1: 0.4666
 epoch: 41, train_loss: 1.0574, test_loss: 0.9898, test_f1: 0.4796
 epoch: 42, train_loss: 1.0479, test_loss: 1.0035, test_f1: 0.4754
 epoch: 43, train_loss: 1.0634, test_loss: 0.9952, test_f1: 0.4811
 epoch: 44, train_loss: 1.0506, test_loss: 1.0046, test_f1: 0.4804
 epoch: 45, train_loss: 1.0459, test_loss: 1.0035, test_f1: 0.4694
 epoch: 46, train_loss: 1.0461, test_loss: 0.9839, test_f1: 0.4773
 epoch: 47, train_loss: 1.0400, test_loss: 0.9984, test_f1: 0.4766
 epoch: 48, train_loss: 1.0367, test_loss: 0.9934, test_f1: 0.4819
 epoch: 49, train_loss: 1.0235, test_loss: 0.9894, test_f1: 0.4792
 epoch: 50, train_loss: 1.0353, test_loss: 1.0084, test_f1: 0.4910
 epoch: 51, train_loss: 1.0286, test_loss: 0.9966, test_f1: 0.4783
 epoch: 52, train_loss: 1.0312, test_loss: 0.9960, test_f1: 0.4703
 epoch: 53, train_loss: 1.0291, test_loss: 0.9865, test_f1: 0.4858
 epoch: 54, train_loss: 1.0247, test_loss: 0.9969, test_f1: 0.4733
 epoch: 55, train_loss: 1.0363, test_loss: 0.9770, test_f1: 0.4898
 epoch: 56, train_loss: 1.0217, test_loss: 0.9847, test_f1: 0.4975
 epoch: 57, train_loss: 1.0269, test_loss: 0.9746, test_f1: 0.4893
 epoch: 58, train_loss: 1.0210, test_loss: 1.0045, test_f1: 0.4761
 epoch: 59, train_loss: 1.0068, test_loss: 0.9742, test_f1: 0.4807
 epoch: 60, train_loss: 1.0173, test_loss: 0.9988, test_f1: 0.4708
 epoch: 61, train_loss: 1.0145, test_loss: 0.9730, test_f1: 0.4864
 epoch: 62, train_loss: 1.0145, test_loss: 0.9867, test_f1: 0.4872
 epoch: 63, train_loss: 1.0194, test_loss: 0.9940, test_f1: 0.4593
 epoch: 64, train_loss: 1.0253, test_loss: 0.9853, test_f1: 0.4722
 epoch: 65, train_loss: 1.0109, test_loss: 0.9888, test_f1: 0.4659
 epoch: 66, train_loss: 1.0152, test_loss: 0.9701, test_f1: 0.4914
 epoch: 67, train_loss: 1.0121, test_loss: 0.9726, test_f1: 0.4761
 epoch: 68, train_loss: 1.0110, test_loss: 0.9762, test_f1: 0.4759
 epoch: 69, train_loss: 1.0059, test_loss: 0.9722, test_f1: 0.4809
 epoch: 70, train_loss: 1.0144, test_loss: 0.9705, test_f1: 0.4788
 epoch: 71, train_loss: 1.0107, test_loss: 0.9830, test_f1: 0.4722
 epoch: 72, train_loss: 1.0110, test_loss: 0.9929, test_f1: 0.4670
 epoch: 73, train_loss: 1.0058, test_loss: 0.9849, test_f1: 0.4781
 epoch: 74, train_loss: 1.0080, test_loss: 0.9713, test_f1: 0.4886
 epoch: 75, train_loss: 1.0052, test_loss: 0.9801, test_f1: 0.4811
 epoch: 76, train_loss: 1.0084, test_loss: 0.9813, test_f1: 0.4768
 epoch: 77, train_loss: 0.9917, test_loss: 0.9741, test_f1: 0.4811
 epoch: 78, train_loss: 1.0009, test_loss: 0.9772, test_f1: 0.4755
 epoch: 79, train_loss: 0.9965, test_loss: 0.9839, test_f1: 0.4687
 epoch: 80, train_loss: 1.0031, test_loss: 0.9801, test_f1: 0.4771
 epoch: 81, train_loss: 0.9985, test_loss: 0.9874, test_f1: 0.4703
 epoch: 82, train_loss: 1.0006, test_loss: 0.9830, test_f1: 0.4622
 epoch: 83, train_loss: 0.9869, test_loss: 0.9751, test_f1: 0.4827
 epoch: 84, train_loss: 0.9947, test_loss: 0.9757, test_f1: 0.4896
 epoch: 85, train_loss: 0.9916, test_loss: 0.9800, test_f1: 0.4663
 epoch: 86, train_loss: 0.9906, test_loss: 0.9709, test_f1: 0.4821
 epoch: 87, train_loss: 0.9933, test_loss: 0.9956, test_f1: 0.4675
 epoch: 88, train_loss: 0.9858, test_loss: 0.9870, test_f1: 0.4705
 epoch: 89, train_loss: 0.9856, test_loss: 0.9699, test_f1: 0.4911
 epoch: 90, train_loss: 0.9895, test_loss: 0.9867, test_f1: 0.4730
 epoch: 91, train_loss: 0.9935, test_loss: 0.9800, test_f1: 0.4779
 epoch: 92, train_loss: 0.9921, test_loss: 0.9836, test_f1: 0.4726
 epoch: 93, train_loss: 0.9855, test_loss: 0.9765, test_f1: 0.4955
 epoch: 94, train_loss: 0.9883, test_loss: 0.9697, test_f1: 0.4917
 epoch: 95, train_loss: 0.9861, test_loss: 0.9780, test_f1: 0.4735
 epoch: 96, train_loss: 0.9854, test_loss: 0.9891, test_f1: 0.4741
 epoch: 97, train_loss: 0.9822, test_loss: 0.9932, test_f1: 0.4749
 epoch: 98, train_loss: 0.9776, test_loss: 0.9956, test_f1: 0.4704
 epoch: 99, train_loss: 0.9919, test_loss: 1.0030, test_f1: 0.4723
##################ITERATION #9 ****************************************
 epoch: 0, train_loss: 1.3555, test_loss: 1.2588, test_f1: 0.2591
 epoch: 1, train_loss: 1.2703, test_loss: 1.2256, test_f1: 0.3192
 epoch: 2, train_loss: 1.2495, test_loss: 1.2123, test_f1: 0.3799
 epoch: 3, train_loss: 1.2404, test_loss: 1.2036, test_f1: 0.3476
 epoch: 4, train_loss: 1.2249, test_loss: 1.1911, test_f1: 0.3904
 epoch: 5, train_loss: 1.2221, test_loss: 1.1796, test_f1: 0.4078
 epoch: 6, train_loss: 1.2107, test_loss: 1.1707, test_f1: 0.4044
 epoch: 7, train_loss: 1.2033, test_loss: 1.1623, test_f1: 0.4004
 epoch: 8, train_loss: 1.1989, test_loss: 1.1521, test_f1: 0.4056
 epoch: 9, train_loss: 1.1952, test_loss: 1.1517, test_f1: 0.4043
 epoch: 10, train_loss: 1.1928, test_loss: 1.1441, test_f1: 0.4068
 epoch: 11, train_loss: 1.1895, test_loss: 1.1359, test_f1: 0.4060
 epoch: 12, train_loss: 1.1825, test_loss: 1.1292, test_f1: 0.4201
 epoch: 13, train_loss: 1.1722, test_loss: 1.1223, test_f1: 0.4224
 epoch: 14, train_loss: 1.1706, test_loss: 1.1190, test_f1: 0.4267
 epoch: 15, train_loss: 1.1651, test_loss: 1.1132, test_f1: 0.4187
 epoch: 16, train_loss: 1.1576, test_loss: 1.1072, test_f1: 0.4371
 epoch: 17, train_loss: 1.1552, test_loss: 1.0981, test_f1: 0.4264
 epoch: 18, train_loss: 1.1500, test_loss: 1.0955, test_f1: 0.4306
 epoch: 19, train_loss: 1.1399, test_loss: 1.0979, test_f1: 0.4274
 epoch: 20, train_loss: 1.1367, test_loss: 1.0843, test_f1: 0.4396
 epoch: 21, train_loss: 1.1347, test_loss: 1.0865, test_f1: 0.4266
 epoch: 22, train_loss: 1.1292, test_loss: 1.0849, test_f1: 0.4377
 epoch: 23, train_loss: 1.1302, test_loss: 1.0790, test_f1: 0.4384
 epoch: 24, train_loss: 1.1255, test_loss: 1.0821, test_f1: 0.4302
 epoch: 25, train_loss: 1.1270, test_loss: 1.0789, test_f1: 0.4266
 epoch: 26, train_loss: 1.1249, test_loss: 1.0654, test_f1: 0.4413
 epoch: 27, train_loss: 1.1183, test_loss: 1.0598, test_f1: 0.4479
 epoch: 28, train_loss: 1.1193, test_loss: 1.0550, test_f1: 0.4516
 epoch: 29, train_loss: 1.1139, test_loss: 1.0539, test_f1: 0.4557
 epoch: 30, train_loss: 1.1077, test_loss: 1.0573, test_f1: 0.4409
 epoch: 31, train_loss: 1.1085, test_loss: 1.0458, test_f1: 0.4471
 epoch: 32, train_loss: 1.0972, test_loss: 1.0596, test_f1: 0.4268
 epoch: 33, train_loss: 1.1091, test_loss: 1.0559, test_f1: 0.4188
 epoch: 34, train_loss: 1.0961, test_loss: 1.0329, test_f1: 0.4469
 epoch: 35, train_loss: 1.0986, test_loss: 1.0460, test_f1: 0.4512
 epoch: 36, train_loss: 1.1016, test_loss: 1.0439, test_f1: 0.4291
 epoch: 37, train_loss: 1.0956, test_loss: 1.0416, test_f1: 0.4224
 epoch: 38, train_loss: 1.0826, test_loss: 1.0417, test_f1: 0.4183
 epoch: 39, train_loss: 1.0761, test_loss: 1.0327, test_f1: 0.4505
 epoch: 40, train_loss: 1.0842, test_loss: 1.0448, test_f1: 0.4312
 epoch: 41, train_loss: 1.0744, test_loss: 1.0333, test_f1: 0.4352
 epoch: 42, train_loss: 1.0768, test_loss: 1.0056, test_f1: 0.4459
 epoch: 43, train_loss: 1.0727, test_loss: 1.0341, test_f1: 0.4518
 epoch: 44, train_loss: 1.0757, test_loss: 1.0235, test_f1: 0.4389
 epoch: 45, train_loss: 1.0639, test_loss: 1.0221, test_f1: 0.4491
 epoch: 46, train_loss: 1.0637, test_loss: 1.0260, test_f1: 0.4471
 epoch: 47, train_loss: 1.0572, test_loss: 1.0519, test_f1: 0.4424
 epoch: 48, train_loss: 1.0600, test_loss: 1.0546, test_f1: 0.4521
 epoch: 49, train_loss: 1.0631, test_loss: 0.9997, test_f1: 0.4430
 epoch: 50, train_loss: 1.0462, test_loss: 1.0077, test_f1: 0.4462
 epoch: 51, train_loss: 1.0584, test_loss: 1.0383, test_f1: 0.4492
 epoch: 52, train_loss: 1.0472, test_loss: 1.0244, test_f1: 0.4600
 epoch: 53, train_loss: 1.0425, test_loss: 1.0357, test_f1: 0.4661
 epoch: 54, train_loss: 1.0449, test_loss: 1.0352, test_f1: 0.4536
 epoch: 55, train_loss: 1.0396, test_loss: 1.0251, test_f1: 0.4515
 epoch: 56, train_loss: 1.0556, test_loss: 1.0261, test_f1: 0.4669
 epoch: 57, train_loss: 1.0343, test_loss: 1.0053, test_f1: 0.4706
 epoch: 58, train_loss: 1.0302, test_loss: 1.0013, test_f1: 0.4564
 epoch: 59, train_loss: 1.0346, test_loss: 0.9986, test_f1: 0.4670
 epoch: 60, train_loss: 1.0475, test_loss: 0.9861, test_f1: 0.4750
 epoch: 61, train_loss: 1.0392, test_loss: 1.0012, test_f1: 0.4537
 epoch: 62, train_loss: 1.0322, test_loss: 1.0354, test_f1: 0.4603
 epoch: 63, train_loss: 1.0355, test_loss: 0.9840, test_f1: 0.4553
 epoch: 64, train_loss: 1.0327, test_loss: 1.0191, test_f1: 0.4670
 epoch: 65, train_loss: 1.0237, test_loss: 1.0015, test_f1: 0.4640
 epoch: 66, train_loss: 1.0355, test_loss: 0.9836, test_f1: 0.4665
 epoch: 67, train_loss: 1.0374, test_loss: 0.9967, test_f1: 0.4591
 epoch: 68, train_loss: 1.0397, test_loss: 1.0091, test_f1: 0.4600
 epoch: 69, train_loss: 1.0200, test_loss: 1.0283, test_f1: 0.4709
 epoch: 70, train_loss: 1.0290, test_loss: 1.0336, test_f1: 0.4586
 epoch: 71, train_loss: 1.0189, test_loss: 1.0703, test_f1: 0.4599
 epoch: 72, train_loss: 1.0337, test_loss: 1.0112, test_f1: 0.4699
 epoch: 73, train_loss: 1.0313, test_loss: 0.9770, test_f1: 0.4718
 epoch: 74, train_loss: 1.0112, test_loss: 0.9769, test_f1: 0.4730
 epoch: 75, train_loss: 1.0241, test_loss: 1.0138, test_f1: 0.4487
 epoch: 76, train_loss: 1.0210, test_loss: 1.0491, test_f1: 0.4724
 epoch: 77, train_loss: 1.0157, test_loss: 1.0370, test_f1: 0.4711
 epoch: 78, train_loss: 1.0169, test_loss: 1.0293, test_f1: 0.4701
 epoch: 79, train_loss: 1.0157, test_loss: 0.9995, test_f1: 0.4718
 epoch: 80, train_loss: 1.0271, test_loss: 1.0392, test_f1: 0.4626
 epoch: 81, train_loss: 1.0126, test_loss: 1.0236, test_f1: 0.4693
 epoch: 82, train_loss: 1.0168, test_loss: 1.0877, test_f1: 0.4650
 epoch: 83, train_loss: 1.0164, test_loss: 0.9871, test_f1: 0.4473
 epoch: 84, train_loss: 1.0160, test_loss: 0.9965, test_f1: 0.4584
 epoch: 85, train_loss: 1.0135, test_loss: 0.9840, test_f1: 0.4615
 epoch: 86, train_loss: 1.0106, test_loss: 1.0082, test_f1: 0.4747
 epoch: 87, train_loss: 1.0183, test_loss: 0.9589, test_f1: 0.4901
 epoch: 88, train_loss: 1.0049, test_loss: 1.0018, test_f1: 0.4603
 epoch: 89, train_loss: 1.0021, test_loss: 1.0131, test_f1: 0.4798
 epoch: 90, train_loss: 1.0028, test_loss: 1.0088, test_f1: 0.4557
 epoch: 91, train_loss: 1.0013, test_loss: 1.0358, test_f1: 0.4622
 epoch: 92, train_loss: 1.0074, test_loss: 1.0479, test_f1: 0.4833
 epoch: 93, train_loss: 1.0053, test_loss: 0.9926, test_f1: 0.4576
 epoch: 94, train_loss: 1.0021, test_loss: 1.0112, test_f1: 0.4650
 epoch: 95, train_loss: 0.9966, test_loss: 1.0998, test_f1: 0.4793
 epoch: 96, train_loss: 0.9984, test_loss: 0.9645, test_f1: 0.4777
 epoch: 97, train_loss: 0.9846, test_loss: 0.9780, test_f1: 0.4684
 epoch: 98, train_loss: 1.0094, test_loss: 0.9558, test_f1: 0.4770
 epoch: 99, train_loss: 0.9981, test_loss: 0.9936, test_f1: 0.4628

Training completed in 1126.09 seconds
Best F1: 0.5240 at epoch 41
Mean F1 across iterations: 0.4922  0.0131
========================FINAL RESULTS================================
FEGIN weighted F1: 0.5240  0.0131
python main.py --data ltspice_examples --representation component_component --model FEGIN --layers 4 --hiddens 32 --batch_size 32 --lr 0.0001 --emb_size 250 --epochs 100 --save_appendix component_component_L4_H32_BS32_LR0.0001_E250 --no_val
-----



STDERR:
  File "main.py", line 370, in <module>
    main()
  File "main.py", line 254, in main
    dataset = dataset_class(
  File "/home/philip/projects/ltspice_examples_code_repo/Circuit-Completion-Using-GNNs/component_classification_with_link_prediction_head/evaluation/FEGIN/kernel/circuit_datasets.py", line 15, in __init__
    self.data, self.slices = torch.load(self.processed_paths[0])
  File "/home/philip/.local/lib/python3.8/site-packages/torch/serialization.py", line 1040, in load
    warnings.warn(
  File "/usr/lib/python3.8/warnings.py", line 109, in _showwarnmsg
    sw(msg.message, msg.category, msg.filename, msg.lineno,
  File "main.py", line 47, in warn_with_traceback
    traceback.print_stack(file=log)
/home/philip/projects/ltspice_examples_code_repo/Circuit-Completion-Using-GNNs/component_classification_with_link_prediction_head/evaluation/FEGIN/kernel/circuit_datasets.py:15: FutureWarning: You are using `torch.load` with `weights_only=False` (the current default value), which uses the default pickle module implicitly. It is possible to construct malicious pickle data which will execute arbitrary code during unpickling (See https://github.com/pytorch/pytorch/blob/main/SECURITY.md#untrusted-models for more details). In a future release, the default value for `weights_only` will be flipped to `True`. This limits the functions that could be executed during unpickling. Arbitrary objects will no longer be allowed to be loaded via this mode unless they are explicitly allowlisted by the user via `torch.serialization.add_safe_globals`. We recommend you start setting `weights_only=True` for any use case where you don't have full control of the loaded file. Please open an issue on GitHub for any issues related to this experimental feature.
  self.data, self.slices = torch.load(self.processed_paths[0])
