STDOUT:
Results will be saved in /home/philip/projects/ltspice_examples_code_repo/Circuit-Completion-Using-GNNs/component_classification_with_link_prediction_head/evaluation/FEGIN/results/model_FEGIN_dataset_ltspice_examples
Command line input: python main.py --data ltspice_examples --representation component_pin --model FEGIN --layers 5 --hiddens 32 --batch_size 32 --lr 0.0001 --emb_size 250 --epochs 100 --save_appendix component_pin_L5_H32_BS32_LR0.0001_E250 --no_val
 is saved.
-----
ltspice_examples - FEGIN
Using 5 layers, 32 hidden units, h = 2
Loading component_pin representation dataset
ENTERED
Training FEGIN on component_pin representation
Train: 3560, Test: 848
##################ITERATION #0 ****************************************
 epoch: 0, train_loss: 1.3900, test_loss: 1.3756, test_f1: 0.1019
 epoch: 1, train_loss: 1.3612, test_loss: 1.3495, test_f1: 0.2443
 epoch: 2, train_loss: 1.3283, test_loss: 1.3174, test_f1: 0.2311
 epoch: 3, train_loss: 1.2936, test_loss: 1.2857, test_f1: 0.2260
 epoch: 4, train_loss: 1.2661, test_loss: 1.2608, test_f1: 0.2268
 epoch: 5, train_loss: 1.2491, test_loss: 1.2394, test_f1: 0.2336
 epoch: 6, train_loss: 1.2378, test_loss: 1.2250, test_f1: 0.2351
 epoch: 7, train_loss: 1.2245, test_loss: 1.2083, test_f1: 0.2405
 epoch: 8, train_loss: 1.2113, test_loss: 1.1942, test_f1: 0.2413
 epoch: 9, train_loss: 1.1996, test_loss: 1.1834, test_f1: 0.2307
 epoch: 10, train_loss: 1.1879, test_loss: 1.1725, test_f1: 0.3203
 epoch: 11, train_loss: 1.1742, test_loss: 1.1600, test_f1: 0.3332
 epoch: 12, train_loss: 1.1658, test_loss: 1.1392, test_f1: 0.3361
 epoch: 13, train_loss: 1.1516, test_loss: 1.1266, test_f1: 0.3588
 epoch: 14, train_loss: 1.1265, test_loss: 1.1020, test_f1: 0.3551
 epoch: 15, train_loss: 1.1092, test_loss: 1.0772, test_f1: 0.3568
 epoch: 16, train_loss: 1.0875, test_loss: 1.0549, test_f1: 0.3586
 epoch: 17, train_loss: 1.0646, test_loss: 1.0387, test_f1: 0.3595
 epoch: 18, train_loss: 1.0432, test_loss: 1.0271, test_f1: 0.3465
 epoch: 19, train_loss: 1.0364, test_loss: 1.0153, test_f1: 0.3936
 epoch: 20, train_loss: 1.0223, test_loss: 1.0087, test_f1: 0.3745
 epoch: 21, train_loss: 1.0132, test_loss: 1.0028, test_f1: 0.4219
 epoch: 22, train_loss: 1.0046, test_loss: 0.9955, test_f1: 0.3986
 epoch: 23, train_loss: 0.9919, test_loss: 0.9935, test_f1: 0.4437
 epoch: 24, train_loss: 0.9897, test_loss: 0.9962, test_f1: 0.4642
 epoch: 25, train_loss: 0.9723, test_loss: 0.9858, test_f1: 0.4841
 epoch: 26, train_loss: 0.9692, test_loss: 0.9801, test_f1: 0.4826
 epoch: 27, train_loss: 0.9714, test_loss: 0.9849, test_f1: 0.4898
 epoch: 28, train_loss: 0.9660, test_loss: 0.9864, test_f1: 0.4786
 epoch: 29, train_loss: 0.9528, test_loss: 0.9992, test_f1: 0.4631
 epoch: 30, train_loss: 0.9519, test_loss: 0.9852, test_f1: 0.4630
 epoch: 31, train_loss: 0.9364, test_loss: 0.9774, test_f1: 0.4837
 epoch: 32, train_loss: 0.9384, test_loss: 0.9751, test_f1: 0.4884
 epoch: 33, train_loss: 0.9357, test_loss: 0.9673, test_f1: 0.4869
 epoch: 34, train_loss: 0.9299, test_loss: 0.9557, test_f1: 0.5075
 epoch: 35, train_loss: 0.9292, test_loss: 0.9580, test_f1: 0.4802
 epoch: 36, train_loss: 0.9174, test_loss: 0.9603, test_f1: 0.4866
 epoch: 37, train_loss: 0.9221, test_loss: 0.9496, test_f1: 0.5003
 epoch: 38, train_loss: 0.9121, test_loss: 0.9553, test_f1: 0.4920
 epoch: 39, train_loss: 0.9183, test_loss: 0.9406, test_f1: 0.5259
 epoch: 40, train_loss: 0.9082, test_loss: 0.9461, test_f1: 0.4901
 epoch: 41, train_loss: 0.9113, test_loss: 0.9513, test_f1: 0.5282
 epoch: 42, train_loss: 0.9050, test_loss: 0.9576, test_f1: 0.4821
 epoch: 43, train_loss: 0.8976, test_loss: 0.9325, test_f1: 0.5241
 epoch: 44, train_loss: 0.8823, test_loss: 0.9378, test_f1: 0.5200
 epoch: 45, train_loss: 0.9045, test_loss: 0.9295, test_f1: 0.5182
 epoch: 46, train_loss: 0.8915, test_loss: 0.9382, test_f1: 0.5156
 epoch: 47, train_loss: 0.8866, test_loss: 0.9356, test_f1: 0.5171
 epoch: 48, train_loss: 0.8847, test_loss: 0.9350, test_f1: 0.4834
 epoch: 49, train_loss: 0.8884, test_loss: 0.9285, test_f1: 0.4982
 epoch: 50, train_loss: 0.8838, test_loss: 0.9245, test_f1: 0.5202
 epoch: 51, train_loss: 0.8707, test_loss: 0.9356, test_f1: 0.5347
 epoch: 52, train_loss: 0.8752, test_loss: 0.9314, test_f1: 0.5164
 epoch: 53, train_loss: 0.8714, test_loss: 0.9156, test_f1: 0.5127
 epoch: 54, train_loss: 0.8665, test_loss: 0.9163, test_f1: 0.5049
 epoch: 55, train_loss: 0.8655, test_loss: 0.9188, test_f1: 0.5191
 epoch: 56, train_loss: 0.8629, test_loss: 0.9328, test_f1: 0.5082
 epoch: 57, train_loss: 0.8668, test_loss: 0.9305, test_f1: 0.5278
 epoch: 58, train_loss: 0.8648, test_loss: 0.9305, test_f1: 0.5194
 epoch: 59, train_loss: 0.8605, test_loss: 0.9300, test_f1: 0.5127
 epoch: 60, train_loss: 0.8691, test_loss: 0.9348, test_f1: 0.5303
 epoch: 61, train_loss: 0.8553, test_loss: 0.9448, test_f1: 0.5092
 epoch: 62, train_loss: 0.8485, test_loss: 0.9349, test_f1: 0.5095
 epoch: 63, train_loss: 0.8562, test_loss: 0.9415, test_f1: 0.5050
 epoch: 64, train_loss: 0.8610, test_loss: 0.9321, test_f1: 0.5247
 epoch: 65, train_loss: 0.8613, test_loss: 0.9197, test_f1: 0.4977
 epoch: 66, train_loss: 0.8625, test_loss: 0.9316, test_f1: 0.5080
 epoch: 67, train_loss: 0.8487, test_loss: 0.9235, test_f1: 0.5106
 epoch: 68, train_loss: 0.8563, test_loss: 0.9171, test_f1: 0.5171
 epoch: 69, train_loss: 0.8469, test_loss: 0.9295, test_f1: 0.5074
 epoch: 70, train_loss: 0.8525, test_loss: 0.9496, test_f1: 0.5005
 epoch: 71, train_loss: 0.8512, test_loss: 0.9240, test_f1: 0.5145
 epoch: 72, train_loss: 0.8528, test_loss: 0.9182, test_f1: 0.5104
 epoch: 73, train_loss: 0.8509, test_loss: 0.9199, test_f1: 0.5121
 epoch: 74, train_loss: 0.8511, test_loss: 0.9200, test_f1: 0.5159
 epoch: 75, train_loss: 0.8489, test_loss: 0.9308, test_f1: 0.5167
 epoch: 76, train_loss: 0.8564, test_loss: 0.9257, test_f1: 0.5212
 epoch: 77, train_loss: 0.8394, test_loss: 0.9144, test_f1: 0.5055
 epoch: 78, train_loss: 0.8387, test_loss: 0.9281, test_f1: 0.5185
 epoch: 79, train_loss: 0.8426, test_loss: 0.9102, test_f1: 0.5146
 epoch: 80, train_loss: 0.8425, test_loss: 0.9187, test_f1: 0.5099
 epoch: 81, train_loss: 0.8368, test_loss: 0.9221, test_f1: 0.5157
 epoch: 82, train_loss: 0.8362, test_loss: 0.9241, test_f1: 0.5178
 epoch: 83, train_loss: 0.8423, test_loss: 0.9205, test_f1: 0.5190
 epoch: 84, train_loss: 0.8325, test_loss: 0.9214, test_f1: 0.5229
 epoch: 85, train_loss: 0.8308, test_loss: 0.9128, test_f1: 0.5159
 epoch: 86, train_loss: 0.8302, test_loss: 0.9289, test_f1: 0.5044
 epoch: 87, train_loss: 0.8388, test_loss: 0.9121, test_f1: 0.5203
 epoch: 88, train_loss: 0.8244, test_loss: 0.9321, test_f1: 0.5146
 epoch: 89, train_loss: 0.8326, test_loss: 0.9091, test_f1: 0.5130
 epoch: 90, train_loss: 0.8334, test_loss: 0.9000, test_f1: 0.5257
 epoch: 91, train_loss: 0.8352, test_loss: 0.9183, test_f1: 0.5179
 epoch: 92, train_loss: 0.8239, test_loss: 0.9140, test_f1: 0.5207
 epoch: 93, train_loss: 0.8260, test_loss: 0.9340, test_f1: 0.5128
 epoch: 94, train_loss: 0.8108, test_loss: 0.9213, test_f1: 0.5279
 epoch: 95, train_loss: 0.8173, test_loss: 0.9320, test_f1: 0.5046
 epoch: 96, train_loss: 0.8261, test_loss: 0.9213, test_f1: 0.5097
 epoch: 97, train_loss: 0.8170, test_loss: 0.9223, test_f1: 0.5183
 epoch: 98, train_loss: 0.8128, test_loss: 0.8956, test_f1: 0.5243
 epoch: 99, train_loss: 0.8264, test_loss: 0.9384, test_f1: 0.5061
##################ITERATION #1 ****************************************
 epoch: 0, train_loss: 1.3323, test_loss: 1.2848, test_f1: 0.2323
 epoch: 1, train_loss: 1.2679, test_loss: 1.2302, test_f1: 0.3003
 epoch: 2, train_loss: 1.2297, test_loss: 1.1883, test_f1: 0.3250
 epoch: 3, train_loss: 1.1971, test_loss: 1.1530, test_f1: 0.3381
 epoch: 4, train_loss: 1.1644, test_loss: 1.1206, test_f1: 0.3407
 epoch: 5, train_loss: 1.1333, test_loss: 1.0965, test_f1: 0.3397
 epoch: 6, train_loss: 1.1142, test_loss: 1.0739, test_f1: 0.3438
 epoch: 7, train_loss: 1.0984, test_loss: 1.0526, test_f1: 0.3438
 epoch: 8, train_loss: 1.0773, test_loss: 1.0521, test_f1: 0.3429
 epoch: 9, train_loss: 1.0666, test_loss: 1.0395, test_f1: 0.3442
 epoch: 10, train_loss: 1.0521, test_loss: 1.0371, test_f1: 0.3498
 epoch: 11, train_loss: 1.0483, test_loss: 1.0406, test_f1: 0.3916
 epoch: 12, train_loss: 1.0400, test_loss: 1.0260, test_f1: 0.3887
 epoch: 13, train_loss: 1.0314, test_loss: 1.0250, test_f1: 0.4298
 epoch: 14, train_loss: 1.0288, test_loss: 1.0303, test_f1: 0.4264
 epoch: 15, train_loss: 1.0218, test_loss: 1.0142, test_f1: 0.4275
 epoch: 16, train_loss: 1.0030, test_loss: 1.0134, test_f1: 0.4320
 epoch: 17, train_loss: 1.0054, test_loss: 1.0205, test_f1: 0.4462
 epoch: 18, train_loss: 1.0013, test_loss: 0.9922, test_f1: 0.4525
 epoch: 19, train_loss: 0.9917, test_loss: 0.9964, test_f1: 0.4570
 epoch: 20, train_loss: 0.9878, test_loss: 0.9933, test_f1: 0.4449
 epoch: 21, train_loss: 0.9856, test_loss: 0.9720, test_f1: 0.4712
 epoch: 22, train_loss: 0.9783, test_loss: 0.9806, test_f1: 0.4658
 epoch: 23, train_loss: 0.9820, test_loss: 1.0071, test_f1: 0.4524
 epoch: 24, train_loss: 0.9714, test_loss: 0.9880, test_f1: 0.4674
 epoch: 25, train_loss: 0.9689, test_loss: 0.9950, test_f1: 0.4556
 epoch: 26, train_loss: 0.9649, test_loss: 0.9910, test_f1: 0.4771
 epoch: 27, train_loss: 0.9616, test_loss: 0.9860, test_f1: 0.4803
 epoch: 28, train_loss: 0.9548, test_loss: 0.9898, test_f1: 0.4912
 epoch: 29, train_loss: 0.9467, test_loss: 0.9901, test_f1: 0.4849
 epoch: 30, train_loss: 0.9429, test_loss: 0.9985, test_f1: 0.4785
 epoch: 31, train_loss: 0.9402, test_loss: 0.9744, test_f1: 0.5004
 epoch: 32, train_loss: 0.9410, test_loss: 0.9737, test_f1: 0.5039
 epoch: 33, train_loss: 0.9351, test_loss: 0.9790, test_f1: 0.5059
 epoch: 34, train_loss: 0.9240, test_loss: 0.9793, test_f1: 0.5041
 epoch: 35, train_loss: 0.9190, test_loss: 0.9697, test_f1: 0.5072
 epoch: 36, train_loss: 0.9108, test_loss: 0.9541, test_f1: 0.4905
 epoch: 37, train_loss: 0.9152, test_loss: 0.9326, test_f1: 0.5103
 epoch: 38, train_loss: 0.9147, test_loss: 0.9395, test_f1: 0.5012
 epoch: 39, train_loss: 0.9079, test_loss: 0.9543, test_f1: 0.4923
 epoch: 40, train_loss: 0.9109, test_loss: 0.9667, test_f1: 0.4904
 epoch: 41, train_loss: 0.8927, test_loss: 0.9505, test_f1: 0.5039
 epoch: 42, train_loss: 0.8942, test_loss: 0.9472, test_f1: 0.5154
 epoch: 43, train_loss: 0.8875, test_loss: 0.9877, test_f1: 0.5120
 epoch: 44, train_loss: 0.8891, test_loss: 0.9503, test_f1: 0.5201
 epoch: 45, train_loss: 0.8884, test_loss: 0.9308, test_f1: 0.5039
 epoch: 46, train_loss: 0.8799, test_loss: 0.9283, test_f1: 0.5159
 epoch: 47, train_loss: 0.8820, test_loss: 0.9922, test_f1: 0.4651
 epoch: 48, train_loss: 0.8716, test_loss: 0.9578, test_f1: 0.5190
 epoch: 49, train_loss: 0.8698, test_loss: 0.9413, test_f1: 0.5107
 epoch: 50, train_loss: 0.8657, test_loss: 0.9475, test_f1: 0.5106
 epoch: 51, train_loss: 0.8573, test_loss: 0.9294, test_f1: 0.5185
 epoch: 52, train_loss: 0.8571, test_loss: 0.9196, test_f1: 0.5203
 epoch: 53, train_loss: 0.8516, test_loss: 0.8982, test_f1: 0.5127
 epoch: 54, train_loss: 0.8530, test_loss: 0.9286, test_f1: 0.5142
 epoch: 55, train_loss: 0.8580, test_loss: 0.9197, test_f1: 0.5169
 epoch: 56, train_loss: 0.8519, test_loss: 0.9548, test_f1: 0.5179
 epoch: 57, train_loss: 0.8381, test_loss: 0.9193, test_f1: 0.5181
 epoch: 58, train_loss: 0.8473, test_loss: 0.9397, test_f1: 0.5096
 epoch: 59, train_loss: 0.8424, test_loss: 0.9474, test_f1: 0.5227
 epoch: 60, train_loss: 0.8486, test_loss: 0.9404, test_f1: 0.5226
 epoch: 61, train_loss: 0.8528, test_loss: 0.9407, test_f1: 0.5223
 epoch: 62, train_loss: 0.8438, test_loss: 0.9176, test_f1: 0.5241
 epoch: 63, train_loss: 0.8477, test_loss: 0.9410, test_f1: 0.5148
 epoch: 64, train_loss: 0.8398, test_loss: 0.9511, test_f1: 0.5104
 epoch: 65, train_loss: 0.8381, test_loss: 0.9327, test_f1: 0.5273
 epoch: 66, train_loss: 0.8431, test_loss: 0.9337, test_f1: 0.5047
 epoch: 67, train_loss: 0.8323, test_loss: 0.9251, test_f1: 0.5272
 epoch: 68, train_loss: 0.8353, test_loss: 0.9529, test_f1: 0.5165
 epoch: 69, train_loss: 0.8303, test_loss: 0.9246, test_f1: 0.5172
 epoch: 70, train_loss: 0.8477, test_loss: 0.9206, test_f1: 0.5297
 epoch: 71, train_loss: 0.8356, test_loss: 0.9324, test_f1: 0.5169
 epoch: 72, train_loss: 0.8341, test_loss: 0.9421, test_f1: 0.5162
 epoch: 73, train_loss: 0.8186, test_loss: 0.9398, test_f1: 0.5246
 epoch: 74, train_loss: 0.8310, test_loss: 0.9050, test_f1: 0.5178
 epoch: 75, train_loss: 0.8268, test_loss: 0.9214, test_f1: 0.5147
 epoch: 76, train_loss: 0.8270, test_loss: 0.9193, test_f1: 0.5319
 epoch: 77, train_loss: 0.8205, test_loss: 0.9197, test_f1: 0.5156
 epoch: 78, train_loss: 0.8240, test_loss: 0.9226, test_f1: 0.5201
 epoch: 79, train_loss: 0.8227, test_loss: 0.9270, test_f1: 0.5284
 epoch: 80, train_loss: 0.8245, test_loss: 0.9151, test_f1: 0.5187
 epoch: 81, train_loss: 0.8240, test_loss: 0.9200, test_f1: 0.5251
 epoch: 82, train_loss: 0.8208, test_loss: 0.9348, test_f1: 0.5145
 epoch: 83, train_loss: 0.8205, test_loss: 0.9235, test_f1: 0.5259
 epoch: 84, train_loss: 0.8183, test_loss: 0.9231, test_f1: 0.5236
 epoch: 85, train_loss: 0.8120, test_loss: 0.9108, test_f1: 0.5359
 epoch: 86, train_loss: 0.8106, test_loss: 0.9370, test_f1: 0.5246
 epoch: 87, train_loss: 0.8099, test_loss: 0.9243, test_f1: 0.5236
 epoch: 88, train_loss: 0.8170, test_loss: 0.9310, test_f1: 0.5271
 epoch: 89, train_loss: 0.8145, test_loss: 0.9234, test_f1: 0.5282
 epoch: 90, train_loss: 0.8083, test_loss: 0.9062, test_f1: 0.5212
 epoch: 91, train_loss: 0.8001, test_loss: 0.9160, test_f1: 0.5306
 epoch: 92, train_loss: 0.7990, test_loss: 0.9042, test_f1: 0.5211
 epoch: 93, train_loss: 0.8135, test_loss: 0.9553, test_f1: 0.5236
 epoch: 94, train_loss: 0.8030, test_loss: 0.8993, test_f1: 0.5205
 epoch: 95, train_loss: 0.7998, test_loss: 0.9404, test_f1: 0.5167
 epoch: 96, train_loss: 0.8052, test_loss: 0.9110, test_f1: 0.5323
 epoch: 97, train_loss: 0.7982, test_loss: 0.8997, test_f1: 0.5233
 epoch: 98, train_loss: 0.8088, test_loss: 0.9442, test_f1: 0.5292
 epoch: 99, train_loss: 0.7959, test_loss: 0.9559, test_f1: 0.5172
##################ITERATION #2 ****************************************
 epoch: 0, train_loss: 1.2926, test_loss: 1.2452, test_f1: 0.2260
 epoch: 1, train_loss: 1.2474, test_loss: 1.1987, test_f1: 0.3146
 epoch: 2, train_loss: 1.2081, test_loss: 1.1613, test_f1: 0.3312
 epoch: 3, train_loss: 1.1705, test_loss: 1.1195, test_f1: 0.3396
 epoch: 4, train_loss: 1.1459, test_loss: 1.0906, test_f1: 0.3692
 epoch: 5, train_loss: 1.1144, test_loss: 1.0647, test_f1: 0.3930
 epoch: 6, train_loss: 1.0972, test_loss: 1.0509, test_f1: 0.4071
 epoch: 7, train_loss: 1.0797, test_loss: 1.0437, test_f1: 0.4104
 epoch: 8, train_loss: 1.0680, test_loss: 1.0358, test_f1: 0.4277
 epoch: 9, train_loss: 1.0566, test_loss: 1.0416, test_f1: 0.4341
 epoch: 10, train_loss: 1.0527, test_loss: 1.0315, test_f1: 0.4186
 epoch: 11, train_loss: 1.0320, test_loss: 1.0294, test_f1: 0.4416
 epoch: 12, train_loss: 1.0370, test_loss: 1.0365, test_f1: 0.4398
 epoch: 13, train_loss: 1.0313, test_loss: 1.0339, test_f1: 0.4659
 epoch: 14, train_loss: 1.0248, test_loss: 1.0232, test_f1: 0.4529
 epoch: 15, train_loss: 1.0131, test_loss: 1.0369, test_f1: 0.4657
 epoch: 16, train_loss: 1.0098, test_loss: 1.0274, test_f1: 0.4634
 epoch: 17, train_loss: 1.0091, test_loss: 1.0287, test_f1: 0.4713
 epoch: 18, train_loss: 0.9965, test_loss: 1.0313, test_f1: 0.4594
 epoch: 19, train_loss: 1.0028, test_loss: 1.0179, test_f1: 0.4805
 epoch: 20, train_loss: 0.9990, test_loss: 1.0237, test_f1: 0.4697
 epoch: 21, train_loss: 0.9909, test_loss: 1.0238, test_f1: 0.4689
 epoch: 22, train_loss: 0.9894, test_loss: 1.0157, test_f1: 0.4775
 epoch: 23, train_loss: 0.9785, test_loss: 1.0180, test_f1: 0.4888
 epoch: 24, train_loss: 0.9766, test_loss: 1.0063, test_f1: 0.4870
 epoch: 25, train_loss: 0.9806, test_loss: 1.0196, test_f1: 0.4976
 epoch: 26, train_loss: 0.9765, test_loss: 1.0185, test_f1: 0.4833
 epoch: 27, train_loss: 0.9694, test_loss: 1.0184, test_f1: 0.5011
 epoch: 28, train_loss: 0.9695, test_loss: 1.0131, test_f1: 0.4932
 epoch: 29, train_loss: 0.9520, test_loss: 1.0094, test_f1: 0.4810
 epoch: 30, train_loss: 0.9590, test_loss: 1.0137, test_f1: 0.4875
 epoch: 31, train_loss: 0.9574, test_loss: 0.9984, test_f1: 0.5033
 epoch: 32, train_loss: 0.9480, test_loss: 1.0080, test_f1: 0.5058
 epoch: 33, train_loss: 0.9582, test_loss: 1.0097, test_f1: 0.4833
 epoch: 34, train_loss: 0.9486, test_loss: 0.9978, test_f1: 0.4905
 epoch: 35, train_loss: 0.9501, test_loss: 0.9868, test_f1: 0.4960
 epoch: 36, train_loss: 0.9368, test_loss: 0.9762, test_f1: 0.5063
 epoch: 37, train_loss: 0.9351, test_loss: 0.9920, test_f1: 0.4911
 epoch: 38, train_loss: 0.9336, test_loss: 0.9759, test_f1: 0.5148
 epoch: 39, train_loss: 0.9261, test_loss: 0.9799, test_f1: 0.4856
 epoch: 40, train_loss: 0.9358, test_loss: 0.9798, test_f1: 0.4909
 epoch: 41, train_loss: 0.9265, test_loss: 0.9758, test_f1: 0.4887
 epoch: 42, train_loss: 0.9248, test_loss: 0.9836, test_f1: 0.5096
 epoch: 43, train_loss: 0.9127, test_loss: 0.9763, test_f1: 0.4992
 epoch: 44, train_loss: 0.9204, test_loss: 0.9736, test_f1: 0.5179
 epoch: 45, train_loss: 0.9147, test_loss: 0.9693, test_f1: 0.5022
 epoch: 46, train_loss: 0.9144, test_loss: 0.9611, test_f1: 0.5016
 epoch: 47, train_loss: 0.9094, test_loss: 0.9740, test_f1: 0.5104
 epoch: 48, train_loss: 0.9118, test_loss: 0.9758, test_f1: 0.5060
 epoch: 49, train_loss: 0.8992, test_loss: 0.9676, test_f1: 0.5147
 epoch: 50, train_loss: 0.9057, test_loss: 0.9654, test_f1: 0.4890
 epoch: 51, train_loss: 0.8917, test_loss: 0.9699, test_f1: 0.5072
 epoch: 52, train_loss: 0.8874, test_loss: 0.9570, test_f1: 0.5231
 epoch: 53, train_loss: 0.8996, test_loss: 0.9509, test_f1: 0.5154
 epoch: 54, train_loss: 0.8933, test_loss: 0.9528, test_f1: 0.5054
 epoch: 55, train_loss: 0.8994, test_loss: 0.9529, test_f1: 0.5137
 epoch: 56, train_loss: 0.8862, test_loss: 0.9755, test_f1: 0.5211
 epoch: 57, train_loss: 0.8893, test_loss: 0.9529, test_f1: 0.5083
 epoch: 58, train_loss: 0.8902, test_loss: 0.9630, test_f1: 0.5147
 epoch: 59, train_loss: 0.8854, test_loss: 0.9634, test_f1: 0.5039
 epoch: 60, train_loss: 0.8806, test_loss: 0.9582, test_f1: 0.5123
 epoch: 61, train_loss: 0.8826, test_loss: 0.9533, test_f1: 0.5208
 epoch: 62, train_loss: 0.8872, test_loss: 0.9555, test_f1: 0.5219
 epoch: 63, train_loss: 0.8775, test_loss: 0.9496, test_f1: 0.5091
 epoch: 64, train_loss: 0.8740, test_loss: 0.9466, test_f1: 0.5352
 epoch: 65, train_loss: 0.8761, test_loss: 0.9366, test_f1: 0.5222
 epoch: 66, train_loss: 0.8815, test_loss: 0.9562, test_f1: 0.5183
 epoch: 67, train_loss: 0.8834, test_loss: 0.9458, test_f1: 0.5028
 epoch: 68, train_loss: 0.8720, test_loss: 0.9516, test_f1: 0.5017
 epoch: 69, train_loss: 0.8717, test_loss: 0.9596, test_f1: 0.5084
 epoch: 70, train_loss: 0.8736, test_loss: 0.9411, test_f1: 0.5178
 epoch: 71, train_loss: 0.8704, test_loss: 0.9463, test_f1: 0.5247
 epoch: 72, train_loss: 0.8779, test_loss: 0.9476, test_f1: 0.5171
 epoch: 73, train_loss: 0.8674, test_loss: 0.9452, test_f1: 0.5192
 epoch: 74, train_loss: 0.8706, test_loss: 0.9506, test_f1: 0.5246
 epoch: 75, train_loss: 0.8655, test_loss: 0.9401, test_f1: 0.5106
 epoch: 76, train_loss: 0.8658, test_loss: 0.9691, test_f1: 0.5272
 epoch: 77, train_loss: 0.8685, test_loss: 0.9506, test_f1: 0.5398
 epoch: 78, train_loss: 0.8563, test_loss: 0.9656, test_f1: 0.5189
 epoch: 79, train_loss: 0.8610, test_loss: 0.9586, test_f1: 0.5216
 epoch: 80, train_loss: 0.8582, test_loss: 0.9454, test_f1: 0.5221
 epoch: 81, train_loss: 0.8607, test_loss: 0.9401, test_f1: 0.5337
 epoch: 82, train_loss: 0.8601, test_loss: 0.9430, test_f1: 0.5197
 epoch: 83, train_loss: 0.8584, test_loss: 0.9409, test_f1: 0.5107
 epoch: 84, train_loss: 0.8619, test_loss: 0.9427, test_f1: 0.5123
 epoch: 85, train_loss: 0.8671, test_loss: 0.9468, test_f1: 0.5100
 epoch: 86, train_loss: 0.8712, test_loss: 0.9515, test_f1: 0.5244
 epoch: 87, train_loss: 0.8618, test_loss: 0.9364, test_f1: 0.5090
 epoch: 88, train_loss: 0.8626, test_loss: 0.9572, test_f1: 0.5192
 epoch: 89, train_loss: 0.8533, test_loss: 0.9398, test_f1: 0.5253
 epoch: 90, train_loss: 0.8541, test_loss: 0.9509, test_f1: 0.5165
 epoch: 91, train_loss: 0.8471, test_loss: 0.9503, test_f1: 0.5392
 epoch: 92, train_loss: 0.8532, test_loss: 0.9482, test_f1: 0.5187
 epoch: 93, train_loss: 0.8587, test_loss: 0.9486, test_f1: 0.5312
 epoch: 94, train_loss: 0.8560, test_loss: 0.9541, test_f1: 0.5175
 epoch: 95, train_loss: 0.8559, test_loss: 0.9490, test_f1: 0.5249
 epoch: 96, train_loss: 0.8458, test_loss: 0.9375, test_f1: 0.5230
 epoch: 97, train_loss: 0.8525, test_loss: 0.9424, test_f1: 0.5373
 epoch: 98, train_loss: 0.8448, test_loss: 0.9541, test_f1: 0.5263
 epoch: 99, train_loss: 0.8452, test_loss: 0.9527, test_f1: 0.5125
##################ITERATION #3 ****************************************
 epoch: 0, train_loss: 1.2704, test_loss: 1.2096, test_f1: 0.2543
 epoch: 1, train_loss: 1.2197, test_loss: 1.1702, test_f1: 0.3230
 epoch: 2, train_loss: 1.1833, test_loss: 1.1271, test_f1: 0.3394
 epoch: 3, train_loss: 1.1507, test_loss: 1.0957, test_f1: 0.4161
 epoch: 4, train_loss: 1.1268, test_loss: 1.0840, test_f1: 0.4196
 epoch: 5, train_loss: 1.1085, test_loss: 1.0628, test_f1: 0.4299
 epoch: 6, train_loss: 1.0893, test_loss: 1.0557, test_f1: 0.4309
 epoch: 7, train_loss: 1.0726, test_loss: 1.0407, test_f1: 0.4544
 epoch: 8, train_loss: 1.0553, test_loss: 1.0323, test_f1: 0.4582
 epoch: 9, train_loss: 1.0508, test_loss: 1.0190, test_f1: 0.4748
 epoch: 10, train_loss: 1.0309, test_loss: 1.0287, test_f1: 0.4642
 epoch: 11, train_loss: 1.0251, test_loss: 1.0085, test_f1: 0.4738
 epoch: 12, train_loss: 1.0147, test_loss: 1.0086, test_f1: 0.4713
 epoch: 13, train_loss: 1.0036, test_loss: 0.9910, test_f1: 0.4878
 epoch: 14, train_loss: 1.0011, test_loss: 0.9884, test_f1: 0.4881
 epoch: 15, train_loss: 0.9949, test_loss: 0.9981, test_f1: 0.4679
 epoch: 16, train_loss: 0.9839, test_loss: 0.9897, test_f1: 0.4783
 epoch: 17, train_loss: 0.9848, test_loss: 0.9845, test_f1: 0.4817
 epoch: 18, train_loss: 0.9762, test_loss: 0.9900, test_f1: 0.4866
 epoch: 19, train_loss: 0.9746, test_loss: 0.9861, test_f1: 0.4972
 epoch: 20, train_loss: 0.9676, test_loss: 0.9910, test_f1: 0.4876
 epoch: 21, train_loss: 0.9608, test_loss: 0.9806, test_f1: 0.4948
 epoch: 22, train_loss: 0.9554, test_loss: 0.9659, test_f1: 0.5012
 epoch: 23, train_loss: 0.9571, test_loss: 0.9526, test_f1: 0.5079
 epoch: 24, train_loss: 0.9435, test_loss: 0.9567, test_f1: 0.5018
 epoch: 25, train_loss: 0.9377, test_loss: 0.9650, test_f1: 0.5068
 epoch: 26, train_loss: 0.9417, test_loss: 0.9521, test_f1: 0.5130
 epoch: 27, train_loss: 0.9295, test_loss: 0.9590, test_f1: 0.5130
 epoch: 28, train_loss: 0.9281, test_loss: 0.9391, test_f1: 0.4970
 epoch: 29, train_loss: 0.9282, test_loss: 0.9818, test_f1: 0.4893
 epoch: 30, train_loss: 0.9266, test_loss: 0.9726, test_f1: 0.5351
 epoch: 31, train_loss: 0.9282, test_loss: 0.9773, test_f1: 0.5076
 epoch: 32, train_loss: 0.9147, test_loss: 0.9324, test_f1: 0.5032
 epoch: 33, train_loss: 0.9193, test_loss: 0.9741, test_f1: 0.5037
 epoch: 34, train_loss: 0.9109, test_loss: 0.9534, test_f1: 0.5249
 epoch: 35, train_loss: 0.9062, test_loss: 0.9556, test_f1: 0.5147
 epoch: 36, train_loss: 0.9059, test_loss: 0.9618, test_f1: 0.5268
 epoch: 37, train_loss: 0.9019, test_loss: 0.9833, test_f1: 0.5207
 epoch: 38, train_loss: 0.9001, test_loss: 0.9642, test_f1: 0.5378
 epoch: 39, train_loss: 0.9047, test_loss: 0.9489, test_f1: 0.5030
 epoch: 40, train_loss: 0.8909, test_loss: 0.9642, test_f1: 0.5222
 epoch: 41, train_loss: 0.8914, test_loss: 0.9737, test_f1: 0.5353
 epoch: 42, train_loss: 0.8914, test_loss: 0.9685, test_f1: 0.5395
 epoch: 43, train_loss: 0.8921, test_loss: 0.9852, test_f1: 0.4956
 epoch: 44, train_loss: 0.8812, test_loss: 0.9644, test_f1: 0.5108
 epoch: 45, train_loss: 0.8810, test_loss: 0.9671, test_f1: 0.5108
 epoch: 46, train_loss: 0.8847, test_loss: 0.9500, test_f1: 0.5329
 epoch: 47, train_loss: 0.8866, test_loss: 0.9717, test_f1: 0.5357
 epoch: 48, train_loss: 0.8716, test_loss: 0.9621, test_f1: 0.5316
 epoch: 49, train_loss: 0.8713, test_loss: 0.9960, test_f1: 0.5205
 epoch: 50, train_loss: 0.8787, test_loss: 1.0087, test_f1: 0.5059
 epoch: 51, train_loss: 0.8561, test_loss: 1.0111, test_f1: 0.5059
 epoch: 52, train_loss: 0.8696, test_loss: 0.9911, test_f1: 0.5287
 epoch: 53, train_loss: 0.8631, test_loss: 0.9721, test_f1: 0.5046
 epoch: 54, train_loss: 0.8725, test_loss: 0.9775, test_f1: 0.5539
 epoch: 55, train_loss: 0.8644, test_loss: 1.0063, test_f1: 0.5141
 epoch: 56, train_loss: 0.8601, test_loss: 0.9832, test_f1: 0.5612
 epoch: 57, train_loss: 0.8570, test_loss: 0.9944, test_f1: 0.5357
 epoch: 58, train_loss: 0.8525, test_loss: 0.9683, test_f1: 0.5287
 epoch: 59, train_loss: 0.8673, test_loss: 0.9824, test_f1: 0.5291
 epoch: 60, train_loss: 0.8496, test_loss: 0.9662, test_f1: 0.5327
 epoch: 61, train_loss: 0.8593, test_loss: 0.9696, test_f1: 0.5633
 epoch: 62, train_loss: 0.8587, test_loss: 0.9590, test_f1: 0.5157
 epoch: 63, train_loss: 0.8594, test_loss: 0.9769, test_f1: 0.5446
 epoch: 64, train_loss: 0.8596, test_loss: 0.9695, test_f1: 0.5149
 epoch: 65, train_loss: 0.8508, test_loss: 0.9755, test_f1: 0.5361
 epoch: 66, train_loss: 0.8417, test_loss: 0.9640, test_f1: 0.5308
 epoch: 67, train_loss: 0.8534, test_loss: 0.9946, test_f1: 0.5255
 epoch: 68, train_loss: 0.8498, test_loss: 0.9692, test_f1: 0.5245
 epoch: 69, train_loss: 0.8512, test_loss: 0.9566, test_f1: 0.5272
 epoch: 70, train_loss: 0.8425, test_loss: 0.9778, test_f1: 0.5195
 epoch: 71, train_loss: 0.8545, test_loss: 0.9895, test_f1: 0.5516
 epoch: 72, train_loss: 0.8497, test_loss: 0.9642, test_f1: 0.5640
 epoch: 73, train_loss: 0.8370, test_loss: 0.9806, test_f1: 0.5240
 epoch: 74, train_loss: 0.8394, test_loss: 0.9988, test_f1: 0.5334
 epoch: 75, train_loss: 0.8489, test_loss: 0.9971, test_f1: 0.5061
 epoch: 76, train_loss: 0.8500, test_loss: 0.9617, test_f1: 0.5453
 epoch: 77, train_loss: 0.8396, test_loss: 0.9857, test_f1: 0.4918
 epoch: 78, train_loss: 0.8351, test_loss: 0.9861, test_f1: 0.5071
 epoch: 79, train_loss: 0.8405, test_loss: 0.9662, test_f1: 0.5217
 epoch: 80, train_loss: 0.8391, test_loss: 0.9664, test_f1: 0.5291
 epoch: 81, train_loss: 0.8459, test_loss: 0.9756, test_f1: 0.5429
 epoch: 82, train_loss: 0.8321, test_loss: 0.9625, test_f1: 0.5251
 epoch: 83, train_loss: 0.8358, test_loss: 0.9900, test_f1: 0.5446
 epoch: 84, train_loss: 0.8407, test_loss: 0.9894, test_f1: 0.4966
 epoch: 85, train_loss: 0.8263, test_loss: 0.9981, test_f1: 0.5307
 epoch: 86, train_loss: 0.8267, test_loss: 0.9806, test_f1: 0.5268
 epoch: 87, train_loss: 0.8297, test_loss: 0.9748, test_f1: 0.5379
 epoch: 88, train_loss: 0.8348, test_loss: 0.9685, test_f1: 0.5371
 epoch: 89, train_loss: 0.8229, test_loss: 0.9730, test_f1: 0.5115
 epoch: 90, train_loss: 0.8257, test_loss: 0.9813, test_f1: 0.5377
 epoch: 91, train_loss: 0.8171, test_loss: 0.9859, test_f1: 0.5270
 epoch: 92, train_loss: 0.8239, test_loss: 0.9637, test_f1: 0.5342
 epoch: 93, train_loss: 0.8254, test_loss: 0.9951, test_f1: 0.5317
 epoch: 94, train_loss: 0.8243, test_loss: 0.9914, test_f1: 0.5200
 epoch: 95, train_loss: 0.8171, test_loss: 0.9991, test_f1: 0.5336
 epoch: 96, train_loss: 0.8264, test_loss: 0.9671, test_f1: 0.5608
 epoch: 97, train_loss: 0.8198, test_loss: 0.9711, test_f1: 0.5358
 epoch: 98, train_loss: 0.8141, test_loss: 0.9656, test_f1: 0.5101
 epoch: 99, train_loss: 0.8200, test_loss: 0.9897, test_f1: 0.5262
##################ITERATION #4 ****************************************
 epoch: 0, train_loss: 1.2860, test_loss: 1.2575, test_f1: 0.2260
 epoch: 1, train_loss: 1.2509, test_loss: 1.2366, test_f1: 0.2291
 epoch: 2, train_loss: 1.2358, test_loss: 1.2166, test_f1: 0.2558
 epoch: 3, train_loss: 1.2169, test_loss: 1.1766, test_f1: 0.3640
 epoch: 4, train_loss: 1.1945, test_loss: 1.1490, test_f1: 0.3983
 epoch: 5, train_loss: 1.1668, test_loss: 1.1192, test_f1: 0.3963
 epoch: 6, train_loss: 1.1461, test_loss: 1.1016, test_f1: 0.4155
 epoch: 7, train_loss: 1.1255, test_loss: 1.0924, test_f1: 0.4123
 epoch: 8, train_loss: 1.1065, test_loss: 1.0807, test_f1: 0.4161
 epoch: 9, train_loss: 1.0911, test_loss: 1.0792, test_f1: 0.4116
 epoch: 10, train_loss: 1.0743, test_loss: 1.0635, test_f1: 0.4174
 epoch: 11, train_loss: 1.0645, test_loss: 1.0583, test_f1: 0.4075
 epoch: 12, train_loss: 1.0516, test_loss: 1.0465, test_f1: 0.4235
 epoch: 13, train_loss: 1.0530, test_loss: 1.0399, test_f1: 0.4210
 epoch: 14, train_loss: 1.0413, test_loss: 1.0389, test_f1: 0.4323
 epoch: 15, train_loss: 1.0299, test_loss: 1.0272, test_f1: 0.4294
 epoch: 16, train_loss: 1.0239, test_loss: 1.0278, test_f1: 0.4310
 epoch: 17, train_loss: 1.0162, test_loss: 1.0215, test_f1: 0.4784
 epoch: 18, train_loss: 1.0114, test_loss: 1.0418, test_f1: 0.4666
 epoch: 19, train_loss: 1.0089, test_loss: 1.0141, test_f1: 0.4854
 epoch: 20, train_loss: 1.0032, test_loss: 1.0159, test_f1: 0.4856
 epoch: 21, train_loss: 0.9996, test_loss: 1.0037, test_f1: 0.4774
 epoch: 22, train_loss: 0.9934, test_loss: 1.0059, test_f1: 0.4768
 epoch: 23, train_loss: 0.9843, test_loss: 1.0162, test_f1: 0.4896
 epoch: 24, train_loss: 0.9831, test_loss: 1.0001, test_f1: 0.4839
 epoch: 25, train_loss: 0.9783, test_loss: 0.9955, test_f1: 0.4893
 epoch: 26, train_loss: 0.9787, test_loss: 0.9939, test_f1: 0.4744
 epoch: 27, train_loss: 0.9646, test_loss: 0.9794, test_f1: 0.4802
 epoch: 28, train_loss: 0.9733, test_loss: 0.9724, test_f1: 0.4836
 epoch: 29, train_loss: 0.9693, test_loss: 0.9777, test_f1: 0.4794
 epoch: 30, train_loss: 0.9576, test_loss: 0.9854, test_f1: 0.4923
 epoch: 31, train_loss: 0.9580, test_loss: 0.9762, test_f1: 0.4925
 epoch: 32, train_loss: 0.9420, test_loss: 0.9689, test_f1: 0.4826
 epoch: 33, train_loss: 0.9521, test_loss: 0.9662, test_f1: 0.4871
 epoch: 34, train_loss: 0.9394, test_loss: 0.9786, test_f1: 0.4842
 epoch: 35, train_loss: 0.9440, test_loss: 0.9825, test_f1: 0.4685
 epoch: 36, train_loss: 0.9329, test_loss: 0.9646, test_f1: 0.4868
 epoch: 37, train_loss: 0.9330, test_loss: 0.9666, test_f1: 0.4948
 epoch: 38, train_loss: 0.9234, test_loss: 0.9538, test_f1: 0.5074
 epoch: 39, train_loss: 0.9299, test_loss: 0.9459, test_f1: 0.4982
 epoch: 40, train_loss: 0.9207, test_loss: 0.9516, test_f1: 0.4989
 epoch: 41, train_loss: 0.9255, test_loss: 0.9641, test_f1: 0.4928
 epoch: 42, train_loss: 0.9181, test_loss: 0.9567, test_f1: 0.5005
 epoch: 43, train_loss: 0.9116, test_loss: 0.9659, test_f1: 0.4868
 epoch: 44, train_loss: 0.9167, test_loss: 0.9654, test_f1: 0.5009
 epoch: 45, train_loss: 0.9006, test_loss: 0.9635, test_f1: 0.5128
 epoch: 46, train_loss: 0.9084, test_loss: 0.9546, test_f1: 0.5049
 epoch: 47, train_loss: 0.9096, test_loss: 0.9443, test_f1: 0.5089
 epoch: 48, train_loss: 0.9118, test_loss: 0.9582, test_f1: 0.5080
 epoch: 49, train_loss: 0.9014, test_loss: 0.9697, test_f1: 0.5159
 epoch: 50, train_loss: 0.9074, test_loss: 0.9551, test_f1: 0.5141
 epoch: 51, train_loss: 0.8966, test_loss: 0.9563, test_f1: 0.5173
 epoch: 52, train_loss: 0.8909, test_loss: 0.9600, test_f1: 0.5054
 epoch: 53, train_loss: 0.8937, test_loss: 0.9660, test_f1: 0.4955
 epoch: 54, train_loss: 0.8924, test_loss: 0.9556, test_f1: 0.5247
 epoch: 55, train_loss: 0.8886, test_loss: 0.9559, test_f1: 0.5133
 epoch: 56, train_loss: 0.8882, test_loss: 0.9643, test_f1: 0.4964
 epoch: 57, train_loss: 0.8913, test_loss: 0.9620, test_f1: 0.5019
 epoch: 58, train_loss: 0.8828, test_loss: 0.9545, test_f1: 0.5150
 epoch: 59, train_loss: 0.8773, test_loss: 0.9510, test_f1: 0.5151
 epoch: 60, train_loss: 0.8827, test_loss: 0.9516, test_f1: 0.5145
 epoch: 61, train_loss: 0.8884, test_loss: 0.9547, test_f1: 0.5239
 epoch: 62, train_loss: 0.8793, test_loss: 0.9492, test_f1: 0.5127
 epoch: 63, train_loss: 0.8834, test_loss: 0.9664, test_f1: 0.5063
 epoch: 64, train_loss: 0.8788, test_loss: 0.9463, test_f1: 0.5148
 epoch: 65, train_loss: 0.8716, test_loss: 0.9512, test_f1: 0.5050
 epoch: 66, train_loss: 0.8823, test_loss: 0.9539, test_f1: 0.5185
 epoch: 67, train_loss: 0.8804, test_loss: 0.9548, test_f1: 0.5130
 epoch: 68, train_loss: 0.8829, test_loss: 0.9726, test_f1: 0.5048
 epoch: 69, train_loss: 0.8689, test_loss: 0.9564, test_f1: 0.5021
 epoch: 70, train_loss: 0.8735, test_loss: 0.9345, test_f1: 0.5153
 epoch: 71, train_loss: 0.8721, test_loss: 0.9704, test_f1: 0.5018
 epoch: 72, train_loss: 0.8731, test_loss: 0.9532, test_f1: 0.5092
 epoch: 73, train_loss: 0.8664, test_loss: 0.9614, test_f1: 0.5076
 epoch: 74, train_loss: 0.8683, test_loss: 0.9513, test_f1: 0.5082
 epoch: 75, train_loss: 0.8648, test_loss: 0.9586, test_f1: 0.4849
 epoch: 76, train_loss: 0.8798, test_loss: 0.9369, test_f1: 0.5196
 epoch: 77, train_loss: 0.8751, test_loss: 0.9403, test_f1: 0.5214
 epoch: 78, train_loss: 0.8697, test_loss: 0.9559, test_f1: 0.5058
 epoch: 79, train_loss: 0.8566, test_loss: 0.9553, test_f1: 0.5126
 epoch: 80, train_loss: 0.8633, test_loss: 0.9377, test_f1: 0.5308
 epoch: 81, train_loss: 0.8644, test_loss: 0.9694, test_f1: 0.5040
 epoch: 82, train_loss: 0.8548, test_loss: 0.9663, test_f1: 0.5080
 epoch: 83, train_loss: 0.8576, test_loss: 0.9458, test_f1: 0.5301
 epoch: 84, train_loss: 0.8669, test_loss: 0.9600, test_f1: 0.5072
 epoch: 85, train_loss: 0.8636, test_loss: 0.9420, test_f1: 0.5194
 epoch: 86, train_loss: 0.8580, test_loss: 0.9637, test_f1: 0.5071
 epoch: 87, train_loss: 0.8585, test_loss: 0.9363, test_f1: 0.5082
 epoch: 88, train_loss: 0.8562, test_loss: 0.9659, test_f1: 0.5067
 epoch: 89, train_loss: 0.8554, test_loss: 0.9561, test_f1: 0.5042
 epoch: 90, train_loss: 0.8608, test_loss: 0.9720, test_f1: 0.4991
 epoch: 91, train_loss: 0.8659, test_loss: 0.9614, test_f1: 0.5096
 epoch: 92, train_loss: 0.8528, test_loss: 0.9628, test_f1: 0.5197
 epoch: 93, train_loss: 0.8512, test_loss: 0.9526, test_f1: 0.5136
 epoch: 94, train_loss: 0.8479, test_loss: 0.9462, test_f1: 0.5224
 epoch: 95, train_loss: 0.8485, test_loss: 0.9510, test_f1: 0.5272
 epoch: 96, train_loss: 0.8476, test_loss: 0.9601, test_f1: 0.5077
 epoch: 97, train_loss: 0.8422, test_loss: 0.9594, test_f1: 0.5133
 epoch: 98, train_loss: 0.8495, test_loss: 0.9489, test_f1: 0.5247
 epoch: 99, train_loss: 0.8410, test_loss: 0.9416, test_f1: 0.5181
##################ITERATION #5 ****************************************
 epoch: 0, train_loss: 1.2905, test_loss: 1.2194, test_f1: 0.2387
 epoch: 1, train_loss: 1.2138, test_loss: 1.1769, test_f1: 0.3775
 epoch: 2, train_loss: 1.1766, test_loss: 1.1439, test_f1: 0.3970
 epoch: 3, train_loss: 1.1520, test_loss: 1.1130, test_f1: 0.3935
 epoch: 4, train_loss: 1.1242, test_loss: 1.1050, test_f1: 0.3777
 epoch: 5, train_loss: 1.1077, test_loss: 1.0727, test_f1: 0.4275
 epoch: 6, train_loss: 1.0857, test_loss: 1.0670, test_f1: 0.4613
 epoch: 7, train_loss: 1.0756, test_loss: 1.0667, test_f1: 0.4586
 epoch: 8, train_loss: 1.0621, test_loss: 1.0519, test_f1: 0.4649
 epoch: 9, train_loss: 1.0483, test_loss: 1.0598, test_f1: 0.4705
 epoch: 10, train_loss: 1.0406, test_loss: 1.0370, test_f1: 0.4626
 epoch: 11, train_loss: 1.0297, test_loss: 1.0491, test_f1: 0.4645
 epoch: 12, train_loss: 1.0244, test_loss: 1.0436, test_f1: 0.4623
 epoch: 13, train_loss: 1.0110, test_loss: 1.0253, test_f1: 0.4666
 epoch: 14, train_loss: 0.9992, test_loss: 1.0250, test_f1: 0.4788
 epoch: 15, train_loss: 0.9997, test_loss: 1.0320, test_f1: 0.4758
 epoch: 16, train_loss: 0.9830, test_loss: 1.0336, test_f1: 0.5051
 epoch: 17, train_loss: 0.9896, test_loss: 1.0057, test_f1: 0.4997
 epoch: 18, train_loss: 0.9823, test_loss: 1.0033, test_f1: 0.4944
 epoch: 19, train_loss: 0.9751, test_loss: 1.0340, test_f1: 0.5077
 epoch: 20, train_loss: 0.9786, test_loss: 1.0183, test_f1: 0.4970
 epoch: 21, train_loss: 0.9620, test_loss: 1.0110, test_f1: 0.4956
 epoch: 22, train_loss: 0.9627, test_loss: 1.0000, test_f1: 0.5054
 epoch: 23, train_loss: 0.9552, test_loss: 0.9675, test_f1: 0.5163
 epoch: 24, train_loss: 0.9544, test_loss: 1.0044, test_f1: 0.5186
 epoch: 25, train_loss: 0.9484, test_loss: 0.9834, test_f1: 0.5102
 epoch: 26, train_loss: 0.9409, test_loss: 0.9998, test_f1: 0.5135
 epoch: 27, train_loss: 0.9357, test_loss: 0.9884, test_f1: 0.5186
 epoch: 28, train_loss: 0.9390, test_loss: 1.0193, test_f1: 0.5283
 epoch: 29, train_loss: 0.9331, test_loss: 0.9915, test_f1: 0.5424
 epoch: 30, train_loss: 0.9239, test_loss: 0.9636, test_f1: 0.5180
 epoch: 31, train_loss: 0.9266, test_loss: 1.0187, test_f1: 0.5279
 epoch: 32, train_loss: 0.9206, test_loss: 0.9517, test_f1: 0.5465
 epoch: 33, train_loss: 0.9125, test_loss: 0.9713, test_f1: 0.5282
 epoch: 34, train_loss: 0.9122, test_loss: 0.9835, test_f1: 0.5592
 epoch: 35, train_loss: 0.9216, test_loss: 0.9767, test_f1: 0.5411
 epoch: 36, train_loss: 0.9116, test_loss: 0.9884, test_f1: 0.5411
 epoch: 37, train_loss: 0.9125, test_loss: 1.0313, test_f1: 0.5270
 epoch: 38, train_loss: 0.9152, test_loss: 1.0096, test_f1: 0.5478
 epoch: 39, train_loss: 0.9042, test_loss: 1.0385, test_f1: 0.5481
 epoch: 40, train_loss: 0.9033, test_loss: 0.9803, test_f1: 0.5528
 epoch: 41, train_loss: 0.8998, test_loss: 1.0196, test_f1: 0.5430
 epoch: 42, train_loss: 0.8901, test_loss: 0.9779, test_f1: 0.5367
 epoch: 43, train_loss: 0.8867, test_loss: 0.9757, test_f1: 0.5642
 epoch: 44, train_loss: 0.8966, test_loss: 1.0264, test_f1: 0.5395
 epoch: 45, train_loss: 0.8903, test_loss: 1.0175, test_f1: 0.5162
 epoch: 46, train_loss: 0.8810, test_loss: 0.9707, test_f1: 0.5590
 epoch: 47, train_loss: 0.8808, test_loss: 0.9938, test_f1: 0.5549
 epoch: 48, train_loss: 0.8831, test_loss: 0.9637, test_f1: 0.5481
 epoch: 49, train_loss: 0.8854, test_loss: 0.9838, test_f1: 0.5466
 epoch: 50, train_loss: 0.8802, test_loss: 1.0295, test_f1: 0.5337
 epoch: 51, train_loss: 0.8659, test_loss: 0.9932, test_f1: 0.5550
 epoch: 52, train_loss: 0.8662, test_loss: 0.9862, test_f1: 0.5638
 epoch: 53, train_loss: 0.8614, test_loss: 0.9866, test_f1: 0.5605
 epoch: 54, train_loss: 0.8682, test_loss: 1.0167, test_f1: 0.5601
 epoch: 55, train_loss: 0.8584, test_loss: 0.9729, test_f1: 0.5826
 epoch: 56, train_loss: 0.8653, test_loss: 0.9746, test_f1: 0.5660
 epoch: 57, train_loss: 0.8614, test_loss: 0.9845, test_f1: 0.5578
 epoch: 58, train_loss: 0.8563, test_loss: 0.9885, test_f1: 0.5545
 epoch: 59, train_loss: 0.8634, test_loss: 0.9771, test_f1: 0.5659
 epoch: 60, train_loss: 0.8621, test_loss: 0.9598, test_f1: 0.5787
 epoch: 61, train_loss: 0.8631, test_loss: 0.9955, test_f1: 0.5592
 epoch: 62, train_loss: 0.8620, test_loss: 0.9914, test_f1: 0.5425
 epoch: 63, train_loss: 0.8507, test_loss: 1.0049, test_f1: 0.5548
 epoch: 64, train_loss: 0.8482, test_loss: 0.9980, test_f1: 0.5631
 epoch: 65, train_loss: 0.8520, test_loss: 0.9688, test_f1: 0.5760
 epoch: 66, train_loss: 0.8464, test_loss: 0.9964, test_f1: 0.5399
 epoch: 67, train_loss: 0.8642, test_loss: 0.9452, test_f1: 0.5795
 epoch: 68, train_loss: 0.8558, test_loss: 0.9957, test_f1: 0.5651
 epoch: 69, train_loss: 0.8514, test_loss: 0.9730, test_f1: 0.5721
 epoch: 70, train_loss: 0.8584, test_loss: 1.0114, test_f1: 0.5545
 epoch: 71, train_loss: 0.8547, test_loss: 0.9711, test_f1: 0.5627
 epoch: 72, train_loss: 0.8541, test_loss: 1.0497, test_f1: 0.5512
 epoch: 73, train_loss: 0.8543, test_loss: 0.9924, test_f1: 0.5679
 epoch: 74, train_loss: 0.8417, test_loss: 0.9868, test_f1: 0.5501
 epoch: 75, train_loss: 0.8457, test_loss: 1.0166, test_f1: 0.5555
 epoch: 76, train_loss: 0.8432, test_loss: 0.9567, test_f1: 0.5729
 epoch: 77, train_loss: 0.8424, test_loss: 0.9867, test_f1: 0.5777
 epoch: 78, train_loss: 0.8425, test_loss: 0.9612, test_f1: 0.5592
 epoch: 79, train_loss: 0.8537, test_loss: 0.9948, test_f1: 0.5674
 epoch: 80, train_loss: 0.8375, test_loss: 0.9765, test_f1: 0.5608
 epoch: 81, train_loss: 0.8383, test_loss: 0.9834, test_f1: 0.5555
 epoch: 82, train_loss: 0.8293, test_loss: 0.9665, test_f1: 0.5652
 epoch: 83, train_loss: 0.8327, test_loss: 0.9633, test_f1: 0.5733
 epoch: 84, train_loss: 0.8428, test_loss: 0.9812, test_f1: 0.5711
 epoch: 85, train_loss: 0.8367, test_loss: 0.9917, test_f1: 0.5632
 epoch: 86, train_loss: 0.8389, test_loss: 0.9727, test_f1: 0.5628
 epoch: 87, train_loss: 0.8376, test_loss: 0.9960, test_f1: 0.5576
 epoch: 88, train_loss: 0.8284, test_loss: 1.0082, test_f1: 0.5555
 epoch: 89, train_loss: 0.8358, test_loss: 1.0006, test_f1: 0.5536
 epoch: 90, train_loss: 0.8251, test_loss: 0.9916, test_f1: 0.5597
 epoch: 91, train_loss: 0.8403, test_loss: 1.0667, test_f1: 0.5493
 epoch: 92, train_loss: 0.8321, test_loss: 0.9817, test_f1: 0.5514
 epoch: 93, train_loss: 0.8283, test_loss: 0.9937, test_f1: 0.5490
 epoch: 94, train_loss: 0.8278, test_loss: 1.0048, test_f1: 0.5646
 epoch: 95, train_loss: 0.8313, test_loss: 0.9638, test_f1: 0.5787
 epoch: 96, train_loss: 0.8285, test_loss: 0.9657, test_f1: 0.5651
 epoch: 97, train_loss: 0.8258, test_loss: 1.0126, test_f1: 0.5623
 epoch: 98, train_loss: 0.8247, test_loss: 0.9774, test_f1: 0.5611
 epoch: 99, train_loss: 0.8255, test_loss: 0.9830, test_f1: 0.5738
##################ITERATION #6 ****************************************
 epoch: 0, train_loss: 1.3297, test_loss: 1.1937, test_f1: 0.3217
 epoch: 1, train_loss: 1.2121, test_loss: 1.1298, test_f1: 0.4156
 epoch: 2, train_loss: 1.1662, test_loss: 1.0899, test_f1: 0.4134
 epoch: 3, train_loss: 1.1433, test_loss: 1.0743, test_f1: 0.4121
 epoch: 4, train_loss: 1.1132, test_loss: 1.0661, test_f1: 0.4049
 epoch: 5, train_loss: 1.0911, test_loss: 1.0394, test_f1: 0.4307
 epoch: 6, train_loss: 1.0731, test_loss: 1.0256, test_f1: 0.4585
 epoch: 7, train_loss: 1.0589, test_loss: 1.0227, test_f1: 0.4688
 epoch: 8, train_loss: 1.0467, test_loss: 1.0102, test_f1: 0.4702
 epoch: 9, train_loss: 1.0379, test_loss: 1.0082, test_f1: 0.4606
 epoch: 10, train_loss: 1.0300, test_loss: 1.0239, test_f1: 0.4453
 epoch: 11, train_loss: 1.0184, test_loss: 0.9871, test_f1: 0.4698
 epoch: 12, train_loss: 1.0015, test_loss: 1.0025, test_f1: 0.4774
 epoch: 13, train_loss: 0.9969, test_loss: 1.0002, test_f1: 0.4839
 epoch: 14, train_loss: 0.9862, test_loss: 0.9837, test_f1: 0.4801
 epoch: 15, train_loss: 0.9883, test_loss: 0.9753, test_f1: 0.4839
 epoch: 16, train_loss: 0.9763, test_loss: 0.9983, test_f1: 0.4804
 epoch: 17, train_loss: 0.9760, test_loss: 0.9809, test_f1: 0.4813
 epoch: 18, train_loss: 0.9749, test_loss: 0.9550, test_f1: 0.4888
 epoch: 19, train_loss: 0.9607, test_loss: 0.9605, test_f1: 0.4926
 epoch: 20, train_loss: 0.9514, test_loss: 0.9529, test_f1: 0.4994
 epoch: 21, train_loss: 0.9516, test_loss: 0.9717, test_f1: 0.5001
 epoch: 22, train_loss: 0.9447, test_loss: 0.9780, test_f1: 0.4903
 epoch: 23, train_loss: 0.9390, test_loss: 0.9471, test_f1: 0.5110
 epoch: 24, train_loss: 0.9331, test_loss: 0.9510, test_f1: 0.4869
 epoch: 25, train_loss: 0.9352, test_loss: 0.9537, test_f1: 0.5077
 epoch: 26, train_loss: 0.9274, test_loss: 0.9387, test_f1: 0.5022
 epoch: 27, train_loss: 0.9293, test_loss: 0.9509, test_f1: 0.5063
 epoch: 28, train_loss: 0.9201, test_loss: 0.9603, test_f1: 0.4902
 epoch: 29, train_loss: 0.9133, test_loss: 0.9726, test_f1: 0.4994
 epoch: 30, train_loss: 0.9073, test_loss: 0.9891, test_f1: 0.5049
 epoch: 31, train_loss: 0.9026, test_loss: 0.9237, test_f1: 0.5107
 epoch: 32, train_loss: 0.9003, test_loss: 0.9387, test_f1: 0.5055
 epoch: 33, train_loss: 0.8987, test_loss: 0.9663, test_f1: 0.5108
 epoch: 34, train_loss: 0.8964, test_loss: 0.9397, test_f1: 0.5088
 epoch: 35, train_loss: 0.9023, test_loss: 0.9586, test_f1: 0.5129
 epoch: 36, train_loss: 0.8871, test_loss: 0.9319, test_f1: 0.5098
 epoch: 37, train_loss: 0.8962, test_loss: 0.8933, test_f1: 0.5138
 epoch: 38, train_loss: 0.8837, test_loss: 0.9535, test_f1: 0.5162
 epoch: 39, train_loss: 0.8831, test_loss: 0.9412, test_f1: 0.5022
 epoch: 40, train_loss: 0.8784, test_loss: 0.9565, test_f1: 0.5233
 epoch: 41, train_loss: 0.8755, test_loss: 0.9663, test_f1: 0.5271
 epoch: 42, train_loss: 0.8735, test_loss: 0.9321, test_f1: 0.5277
 epoch: 43, train_loss: 0.8802, test_loss: 0.9314, test_f1: 0.5248
 epoch: 44, train_loss: 0.8715, test_loss: 0.9113, test_f1: 0.5422
 epoch: 45, train_loss: 0.8660, test_loss: 0.9252, test_f1: 0.5197
 epoch: 46, train_loss: 0.8742, test_loss: 0.9278, test_f1: 0.5359
 epoch: 47, train_loss: 0.8626, test_loss: 0.9072, test_f1: 0.5333
 epoch: 48, train_loss: 0.8531, test_loss: 0.9315, test_f1: 0.5171
 epoch: 49, train_loss: 0.8545, test_loss: 0.9235, test_f1: 0.5163
 epoch: 50, train_loss: 0.8488, test_loss: 0.9324, test_f1: 0.5427
 epoch: 51, train_loss: 0.8475, test_loss: 0.9296, test_f1: 0.5165
 epoch: 52, train_loss: 0.8439, test_loss: 0.9246, test_f1: 0.5277
 epoch: 53, train_loss: 0.8435, test_loss: 0.9332, test_f1: 0.5240
 epoch: 54, train_loss: 0.8532, test_loss: 0.9265, test_f1: 0.5206
 epoch: 55, train_loss: 0.8524, test_loss: 0.9194, test_f1: 0.5241
 epoch: 56, train_loss: 0.8361, test_loss: 0.9142, test_f1: 0.5426
 epoch: 57, train_loss: 0.8363, test_loss: 0.9141, test_f1: 0.5258
 epoch: 58, train_loss: 0.8267, test_loss: 0.9035, test_f1: 0.5421
 epoch: 59, train_loss: 0.8365, test_loss: 0.9195, test_f1: 0.5409
 epoch: 60, train_loss: 0.8405, test_loss: 0.9465, test_f1: 0.5257
 epoch: 61, train_loss: 0.8298, test_loss: 0.9249, test_f1: 0.5332
 epoch: 62, train_loss: 0.8244, test_loss: 0.9435, test_f1: 0.5421
 epoch: 63, train_loss: 0.8335, test_loss: 0.9250, test_f1: 0.5357
 epoch: 64, train_loss: 0.8317, test_loss: 0.9426, test_f1: 0.5310
 epoch: 65, train_loss: 0.8217, test_loss: 0.9245, test_f1: 0.5287
 epoch: 66, train_loss: 0.8311, test_loss: 0.9410, test_f1: 0.5359
 epoch: 67, train_loss: 0.8189, test_loss: 0.9558, test_f1: 0.5419
 epoch: 68, train_loss: 0.8243, test_loss: 0.9420, test_f1: 0.5287
 epoch: 69, train_loss: 0.8239, test_loss: 0.9825, test_f1: 0.5184
 epoch: 70, train_loss: 0.8156, test_loss: 0.9500, test_f1: 0.5366
 epoch: 71, train_loss: 0.8189, test_loss: 0.9132, test_f1: 0.5427
 epoch: 72, train_loss: 0.8210, test_loss: 0.8977, test_f1: 0.5442
 epoch: 73, train_loss: 0.8288, test_loss: 0.9263, test_f1: 0.5388
 epoch: 74, train_loss: 0.8255, test_loss: 0.9218, test_f1: 0.5407
 epoch: 75, train_loss: 0.8280, test_loss: 0.9228, test_f1: 0.5432
 epoch: 76, train_loss: 0.8066, test_loss: 0.9220, test_f1: 0.5380
 epoch: 77, train_loss: 0.8232, test_loss: 0.9406, test_f1: 0.5304
 epoch: 78, train_loss: 0.8159, test_loss: 0.9598, test_f1: 0.5292
 epoch: 79, train_loss: 0.8160, test_loss: 0.9325, test_f1: 0.5430
 epoch: 80, train_loss: 0.8047, test_loss: 0.9460, test_f1: 0.5277
 epoch: 81, train_loss: 0.8138, test_loss: 0.9299, test_f1: 0.5414
 epoch: 82, train_loss: 0.8064, test_loss: 0.9562, test_f1: 0.5414
 epoch: 83, train_loss: 0.7980, test_loss: 0.9240, test_f1: 0.5391
 epoch: 84, train_loss: 0.7976, test_loss: 0.9461, test_f1: 0.5447
 epoch: 85, train_loss: 0.7984, test_loss: 0.9469, test_f1: 0.5423
 epoch: 86, train_loss: 0.7952, test_loss: 0.9574, test_f1: 0.5412
 epoch: 87, train_loss: 0.7962, test_loss: 0.9345, test_f1: 0.5375
 epoch: 88, train_loss: 0.7931, test_loss: 0.9467, test_f1: 0.5425
 epoch: 89, train_loss: 0.7996, test_loss: 0.9574, test_f1: 0.5413
 epoch: 90, train_loss: 0.7977, test_loss: 0.9290, test_f1: 0.5436
 epoch: 91, train_loss: 0.7857, test_loss: 0.9512, test_f1: 0.5308
 epoch: 92, train_loss: 0.7996, test_loss: 0.9524, test_f1: 0.5312
 epoch: 93, train_loss: 0.7942, test_loss: 0.9399, test_f1: 0.5394
 epoch: 94, train_loss: 0.7956, test_loss: 0.9416, test_f1: 0.5422
 epoch: 95, train_loss: 0.7982, test_loss: 0.9620, test_f1: 0.5379
 epoch: 96, train_loss: 0.8043, test_loss: 0.9344, test_f1: 0.5349
 epoch: 97, train_loss: 0.7935, test_loss: 0.9490, test_f1: 0.5372
 epoch: 98, train_loss: 0.7892, test_loss: 0.9417, test_f1: 0.5433
 epoch: 99, train_loss: 0.7953, test_loss: 0.9274, test_f1: 0.5450
##################ITERATION #7 ****************************************
 epoch: 0, train_loss: 1.2788, test_loss: 1.2080, test_f1: 0.2875
 epoch: 1, train_loss: 1.2124, test_loss: 1.1640, test_f1: 0.3821
 epoch: 2, train_loss: 1.1858, test_loss: 1.1376, test_f1: 0.4011
 epoch: 3, train_loss: 1.1690, test_loss: 1.1186, test_f1: 0.4185
 epoch: 4, train_loss: 1.1405, test_loss: 1.0928, test_f1: 0.4525
 epoch: 5, train_loss: 1.1179, test_loss: 1.0719, test_f1: 0.4486
 epoch: 6, train_loss: 1.1042, test_loss: 1.0577, test_f1: 0.4390
 epoch: 7, train_loss: 1.0851, test_loss: 1.0508, test_f1: 0.4429
 epoch: 8, train_loss: 1.0703, test_loss: 1.0477, test_f1: 0.4108
 epoch: 9, train_loss: 1.0651, test_loss: 1.0352, test_f1: 0.4320
 epoch: 10, train_loss: 1.0516, test_loss: 1.0315, test_f1: 0.4502
 epoch: 11, train_loss: 1.0358, test_loss: 1.0181, test_f1: 0.4543
 epoch: 12, train_loss: 1.0314, test_loss: 1.0279, test_f1: 0.4598
 epoch: 13, train_loss: 1.0292, test_loss: 0.9964, test_f1: 0.4758
 epoch: 14, train_loss: 1.0074, test_loss: 1.0034, test_f1: 0.4855
 epoch: 15, train_loss: 1.0007, test_loss: 0.9946, test_f1: 0.4709
 epoch: 16, train_loss: 1.0020, test_loss: 1.0005, test_f1: 0.4783
 epoch: 17, train_loss: 0.9940, test_loss: 0.9796, test_f1: 0.4806
 epoch: 18, train_loss: 0.9865, test_loss: 0.9881, test_f1: 0.4872
 epoch: 19, train_loss: 0.9843, test_loss: 1.0132, test_f1: 0.4704
 epoch: 20, train_loss: 0.9729, test_loss: 0.9962, test_f1: 0.4887
 epoch: 21, train_loss: 0.9703, test_loss: 0.9704, test_f1: 0.4800
 epoch: 22, train_loss: 0.9728, test_loss: 0.9839, test_f1: 0.4732
 epoch: 23, train_loss: 0.9626, test_loss: 0.9702, test_f1: 0.4963
 epoch: 24, train_loss: 0.9488, test_loss: 0.9560, test_f1: 0.4880
 epoch: 25, train_loss: 0.9502, test_loss: 0.9827, test_f1: 0.4943
 epoch: 26, train_loss: 0.9474, test_loss: 0.9674, test_f1: 0.4937
 epoch: 27, train_loss: 0.9519, test_loss: 0.9656, test_f1: 0.4996
 epoch: 28, train_loss: 0.9368, test_loss: 0.9545, test_f1: 0.4999
 epoch: 29, train_loss: 0.9353, test_loss: 0.9559, test_f1: 0.5108
 epoch: 30, train_loss: 0.9163, test_loss: 0.9403, test_f1: 0.5089
 epoch: 31, train_loss: 0.9267, test_loss: 0.9125, test_f1: 0.4879
 epoch: 32, train_loss: 0.9193, test_loss: 0.9189, test_f1: 0.5080
 epoch: 33, train_loss: 0.9152, test_loss: 0.9509, test_f1: 0.4924
 epoch: 34, train_loss: 0.9146, test_loss: 0.8903, test_f1: 0.5083
 epoch: 35, train_loss: 0.9053, test_loss: 0.8926, test_f1: 0.5013
 epoch: 36, train_loss: 0.9059, test_loss: 0.8946, test_f1: 0.5104
 epoch: 37, train_loss: 0.8963, test_loss: 0.9233, test_f1: 0.5169
 epoch: 38, train_loss: 0.8943, test_loss: 0.9633, test_f1: 0.5060
 epoch: 39, train_loss: 0.8917, test_loss: 0.9389, test_f1: 0.5069
 epoch: 40, train_loss: 0.8926, test_loss: 0.9574, test_f1: 0.5069
 epoch: 41, train_loss: 0.8899, test_loss: 0.9311, test_f1: 0.5213
 epoch: 42, train_loss: 0.8842, test_loss: 0.9091, test_f1: 0.5224
 epoch: 43, train_loss: 0.8838, test_loss: 0.9248, test_f1: 0.5204
 epoch: 44, train_loss: 0.8865, test_loss: 0.8695, test_f1: 0.5294
 epoch: 45, train_loss: 0.8922, test_loss: 0.9248, test_f1: 0.5064
 epoch: 46, train_loss: 0.8824, test_loss: 0.9232, test_f1: 0.5184
 epoch: 47, train_loss: 0.8705, test_loss: 0.9385, test_f1: 0.5220
 epoch: 48, train_loss: 0.8683, test_loss: 0.9448, test_f1: 0.5106
 epoch: 49, train_loss: 0.8677, test_loss: 0.9512, test_f1: 0.5221
 epoch: 50, train_loss: 0.8706, test_loss: 0.9013, test_f1: 0.5299
 epoch: 51, train_loss: 0.8640, test_loss: 0.8681, test_f1: 0.5302
 epoch: 52, train_loss: 0.8549, test_loss: 0.9408, test_f1: 0.5208
 epoch: 53, train_loss: 0.8551, test_loss: 0.8715, test_f1: 0.5257
 epoch: 54, train_loss: 0.8676, test_loss: 0.8942, test_f1: 0.5341
 epoch: 55, train_loss: 0.8494, test_loss: 0.9012, test_f1: 0.5322
 epoch: 56, train_loss: 0.8604, test_loss: 0.8625, test_f1: 0.5226
 epoch: 57, train_loss: 0.8651, test_loss: 0.8463, test_f1: 0.5412
 epoch: 58, train_loss: 0.8550, test_loss: 0.8720, test_f1: 0.5340
 epoch: 59, train_loss: 0.8690, test_loss: 0.8936, test_f1: 0.5344
 epoch: 60, train_loss: 0.8473, test_loss: 0.8668, test_f1: 0.5321
 epoch: 61, train_loss: 0.8408, test_loss: 0.8756, test_f1: 0.5376
 epoch: 62, train_loss: 0.8463, test_loss: 0.8444, test_f1: 0.5296
 epoch: 63, train_loss: 0.8459, test_loss: 0.8954, test_f1: 0.5288
 epoch: 64, train_loss: 0.8622, test_loss: 0.9093, test_f1: 0.5353
 epoch: 65, train_loss: 0.8495, test_loss: 0.9046, test_f1: 0.5332
 epoch: 66, train_loss: 0.8497, test_loss: 0.8934, test_f1: 0.5305
 epoch: 67, train_loss: 0.8585, test_loss: 0.9171, test_f1: 0.5322
 epoch: 68, train_loss: 0.8416, test_loss: 0.9280, test_f1: 0.5285
 epoch: 69, train_loss: 0.8390, test_loss: 0.9026, test_f1: 0.5380
 epoch: 70, train_loss: 0.8387, test_loss: 0.9125, test_f1: 0.5371
 epoch: 71, train_loss: 0.8567, test_loss: 0.9197, test_f1: 0.5382
 epoch: 72, train_loss: 0.8380, test_loss: 0.8934, test_f1: 0.5159
 epoch: 73, train_loss: 0.8377, test_loss: 0.9070, test_f1: 0.5354
 epoch: 74, train_loss: 0.8470, test_loss: 0.8778, test_f1: 0.5252
 epoch: 75, train_loss: 0.8380, test_loss: 0.8578, test_f1: 0.5390
 epoch: 76, train_loss: 0.8396, test_loss: 0.8757, test_f1: 0.5390
 epoch: 77, train_loss: 0.8296, test_loss: 0.8758, test_f1: 0.5230
 epoch: 78, train_loss: 0.8324, test_loss: 0.9055, test_f1: 0.5337
 epoch: 79, train_loss: 0.8431, test_loss: 0.9296, test_f1: 0.5232
 epoch: 80, train_loss: 0.8342, test_loss: 0.8874, test_f1: 0.5284
 epoch: 81, train_loss: 0.8244, test_loss: 0.9197, test_f1: 0.5297
 epoch: 82, train_loss: 0.8401, test_loss: 0.9129, test_f1: 0.5345
 epoch: 83, train_loss: 0.8358, test_loss: 0.9123, test_f1: 0.5261
 epoch: 84, train_loss: 0.8387, test_loss: 0.9025, test_f1: 0.5286
 epoch: 85, train_loss: 0.8197, test_loss: 0.8844, test_f1: 0.5378
 epoch: 86, train_loss: 0.8119, test_loss: 0.9234, test_f1: 0.5267
 epoch: 87, train_loss: 0.8317, test_loss: 0.8439, test_f1: 0.5369
 epoch: 88, train_loss: 0.8375, test_loss: 0.8704, test_f1: 0.5311
 epoch: 89, train_loss: 0.8166, test_loss: 0.8959, test_f1: 0.5351
 epoch: 90, train_loss: 0.8218, test_loss: 0.9132, test_f1: 0.5239
 epoch: 91, train_loss: 0.8289, test_loss: 0.8604, test_f1: 0.5328
 epoch: 92, train_loss: 0.8237, test_loss: 0.9070, test_f1: 0.5294
 epoch: 93, train_loss: 0.8265, test_loss: 0.8955, test_f1: 0.5215
 epoch: 94, train_loss: 0.8273, test_loss: 0.9060, test_f1: 0.5218
 epoch: 95, train_loss: 0.8151, test_loss: 0.9050, test_f1: 0.5379
 epoch: 96, train_loss: 0.8182, test_loss: 0.8764, test_f1: 0.5330
 epoch: 97, train_loss: 0.8223, test_loss: 0.9071, test_f1: 0.5288
 epoch: 98, train_loss: 0.8152, test_loss: 0.9250, test_f1: 0.5205
 epoch: 99, train_loss: 0.8182, test_loss: 0.8420, test_f1: 0.5201
##################ITERATION #8 ****************************************
 epoch: 0, train_loss: 1.3428, test_loss: 1.2079, test_f1: 0.2587
 epoch: 1, train_loss: 1.2225, test_loss: 1.1588, test_f1: 0.3113
 epoch: 2, train_loss: 1.2038, test_loss: 1.1428, test_f1: 0.3770
 epoch: 3, train_loss: 1.1610, test_loss: 1.1131, test_f1: 0.3906
 epoch: 4, train_loss: 1.1419, test_loss: 1.0993, test_f1: 0.3938
 epoch: 5, train_loss: 1.1216, test_loss: 1.0812, test_f1: 0.4330
 epoch: 6, train_loss: 1.0995, test_loss: 1.0746, test_f1: 0.4283
 epoch: 7, train_loss: 1.0841, test_loss: 1.0623, test_f1: 0.4366
 epoch: 8, train_loss: 1.0703, test_loss: 1.0506, test_f1: 0.4561
 epoch: 9, train_loss: 1.0638, test_loss: 1.0372, test_f1: 0.4794
 epoch: 10, train_loss: 1.0525, test_loss: 1.0391, test_f1: 0.4719
 epoch: 11, train_loss: 1.0500, test_loss: 1.0316, test_f1: 0.4810
 epoch: 12, train_loss: 1.0357, test_loss: 1.0343, test_f1: 0.4795
 epoch: 13, train_loss: 1.0255, test_loss: 1.0334, test_f1: 0.4760
 epoch: 14, train_loss: 1.0216, test_loss: 1.0255, test_f1: 0.4741
 epoch: 15, train_loss: 1.0086, test_loss: 1.0366, test_f1: 0.4714
 epoch: 16, train_loss: 0.9994, test_loss: 1.0321, test_f1: 0.4942
 epoch: 17, train_loss: 0.9940, test_loss: 1.0226, test_f1: 0.4908
 epoch: 18, train_loss: 0.9956, test_loss: 1.0272, test_f1: 0.4871
 epoch: 19, train_loss: 0.9871, test_loss: 1.0367, test_f1: 0.4812
 epoch: 20, train_loss: 0.9859, test_loss: 1.0332, test_f1: 0.5089
 epoch: 21, train_loss: 0.9763, test_loss: 1.0199, test_f1: 0.5090
 epoch: 22, train_loss: 0.9702, test_loss: 1.0201, test_f1: 0.4982
 epoch: 23, train_loss: 0.9718, test_loss: 1.0182, test_f1: 0.4927
 epoch: 24, train_loss: 0.9517, test_loss: 1.0066, test_f1: 0.4960
 epoch: 25, train_loss: 0.9591, test_loss: 1.0174, test_f1: 0.4910
 epoch: 26, train_loss: 0.9569, test_loss: 0.9987, test_f1: 0.5121
 epoch: 27, train_loss: 0.9489, test_loss: 1.0035, test_f1: 0.4926
 epoch: 28, train_loss: 0.9417, test_loss: 0.9953, test_f1: 0.5001
 epoch: 29, train_loss: 0.9394, test_loss: 0.9904, test_f1: 0.4994
 epoch: 30, train_loss: 0.9387, test_loss: 0.9979, test_f1: 0.5110
 epoch: 31, train_loss: 0.9314, test_loss: 0.9967, test_f1: 0.5079
 epoch: 32, train_loss: 0.9237, test_loss: 0.9820, test_f1: 0.5133
 epoch: 33, train_loss: 0.9179, test_loss: 0.9860, test_f1: 0.5110
 epoch: 34, train_loss: 0.9218, test_loss: 1.0037, test_f1: 0.5479
 epoch: 35, train_loss: 0.9047, test_loss: 0.9919, test_f1: 0.5177
 epoch: 36, train_loss: 0.9068, test_loss: 0.9768, test_f1: 0.5295
 epoch: 37, train_loss: 0.9099, test_loss: 0.9954, test_f1: 0.5343
 epoch: 38, train_loss: 0.8993, test_loss: 0.9859, test_f1: 0.5157
 epoch: 39, train_loss: 0.8964, test_loss: 0.9605, test_f1: 0.5412
 epoch: 40, train_loss: 0.9022, test_loss: 0.9659, test_f1: 0.5302
 epoch: 41, train_loss: 0.8942, test_loss: 0.9733, test_f1: 0.5235
 epoch: 42, train_loss: 0.8921, test_loss: 0.9792, test_f1: 0.5377
 epoch: 43, train_loss: 0.8964, test_loss: 0.9676, test_f1: 0.5264
 epoch: 44, train_loss: 0.8966, test_loss: 0.9615, test_f1: 0.5364
 epoch: 45, train_loss: 0.8910, test_loss: 0.9808, test_f1: 0.5173
 epoch: 46, train_loss: 0.8770, test_loss: 0.9581, test_f1: 0.5578
 epoch: 47, train_loss: 0.8723, test_loss: 0.9663, test_f1: 0.5143
 epoch: 48, train_loss: 0.8771, test_loss: 0.9582, test_f1: 0.5274
 epoch: 49, train_loss: 0.8726, test_loss: 0.9640, test_f1: 0.5574
 epoch: 50, train_loss: 0.8769, test_loss: 0.9476, test_f1: 0.5614
 epoch: 51, train_loss: 0.8614, test_loss: 0.9440, test_f1: 0.5603
 epoch: 52, train_loss: 0.8673, test_loss: 0.9553, test_f1: 0.5494
 epoch: 53, train_loss: 0.8593, test_loss: 0.9411, test_f1: 0.5613
 epoch: 54, train_loss: 0.8547, test_loss: 0.9455, test_f1: 0.5613
 epoch: 55, train_loss: 0.8594, test_loss: 0.9409, test_f1: 0.5603
 epoch: 56, train_loss: 0.8568, test_loss: 0.9529, test_f1: 0.5460
 epoch: 57, train_loss: 0.8562, test_loss: 0.9653, test_f1: 0.5540
 epoch: 58, train_loss: 0.8506, test_loss: 0.9455, test_f1: 0.5447
 epoch: 59, train_loss: 0.8525, test_loss: 0.9504, test_f1: 0.5643
 epoch: 60, train_loss: 0.8538, test_loss: 0.9513, test_f1: 0.5455
 epoch: 61, train_loss: 0.8552, test_loss: 0.9428, test_f1: 0.5448
 epoch: 62, train_loss: 0.8502, test_loss: 0.9388, test_f1: 0.5364
 epoch: 63, train_loss: 0.8534, test_loss: 0.9335, test_f1: 0.5736
 epoch: 64, train_loss: 0.8425, test_loss: 0.9437, test_f1: 0.5437
 epoch: 65, train_loss: 0.8498, test_loss: 0.9355, test_f1: 0.5460
 epoch: 66, train_loss: 0.8519, test_loss: 0.9449, test_f1: 0.5595
 epoch: 67, train_loss: 0.8550, test_loss: 0.9400, test_f1: 0.5466
 epoch: 68, train_loss: 0.8408, test_loss: 0.9374, test_f1: 0.5417
 epoch: 69, train_loss: 0.8428, test_loss: 0.9365, test_f1: 0.5592
 epoch: 70, train_loss: 0.8400, test_loss: 0.9342, test_f1: 0.5424
 epoch: 71, train_loss: 0.8361, test_loss: 0.9313, test_f1: 0.5353
 epoch: 72, train_loss: 0.8340, test_loss: 0.9411, test_f1: 0.5753
 epoch: 73, train_loss: 0.8372, test_loss: 0.9339, test_f1: 0.5429
 epoch: 74, train_loss: 0.8430, test_loss: 0.9371, test_f1: 0.5475
 epoch: 75, train_loss: 0.8328, test_loss: 0.9295, test_f1: 0.5616
 epoch: 76, train_loss: 0.8391, test_loss: 0.9459, test_f1: 0.5727
 epoch: 77, train_loss: 0.8328, test_loss: 0.9274, test_f1: 0.5598
 epoch: 78, train_loss: 0.8348, test_loss: 0.9378, test_f1: 0.5424
 epoch: 79, train_loss: 0.8124, test_loss: 0.9234, test_f1: 0.5539
 epoch: 80, train_loss: 0.8269, test_loss: 0.9352, test_f1: 0.5374
 epoch: 81, train_loss: 0.8315, test_loss: 0.9350, test_f1: 0.5424
 epoch: 82, train_loss: 0.8434, test_loss: 0.9325, test_f1: 0.5493
 epoch: 83, train_loss: 0.8187, test_loss: 0.9300, test_f1: 0.5426
 epoch: 84, train_loss: 0.8294, test_loss: 0.9249, test_f1: 0.5782
 epoch: 85, train_loss: 0.8264, test_loss: 0.9214, test_f1: 0.5536
 epoch: 86, train_loss: 0.8274, test_loss: 0.9319, test_f1: 0.5486
 epoch: 87, train_loss: 0.8227, test_loss: 0.9292, test_f1: 0.5515
 epoch: 88, train_loss: 0.8220, test_loss: 0.9235, test_f1: 0.5698
 epoch: 89, train_loss: 0.8145, test_loss: 0.9132, test_f1: 0.5670
 epoch: 90, train_loss: 0.8282, test_loss: 0.9157, test_f1: 0.5599
 epoch: 91, train_loss: 0.8187, test_loss: 0.9272, test_f1: 0.5647
 epoch: 92, train_loss: 0.8035, test_loss: 0.9251, test_f1: 0.5518
 epoch: 93, train_loss: 0.8147, test_loss: 0.9137, test_f1: 0.5790
 epoch: 94, train_loss: 0.8184, test_loss: 0.9197, test_f1: 0.5676
 epoch: 95, train_loss: 0.8148, test_loss: 0.9236, test_f1: 0.5611
 epoch: 96, train_loss: 0.8219, test_loss: 0.9270, test_f1: 0.5747
 epoch: 97, train_loss: 0.8092, test_loss: 0.9269, test_f1: 0.5471
 epoch: 98, train_loss: 0.8153, test_loss: 0.9174, test_f1: 0.5703
 epoch: 99, train_loss: 0.8150, test_loss: 0.9204, test_f1: 0.5607
##################ITERATION #9 ****************************************
 epoch: 0, train_loss: 1.2895, test_loss: 1.1794, test_f1: 0.3271
 epoch: 1, train_loss: 1.2182, test_loss: 1.1472, test_f1: 0.3677
 epoch: 2, train_loss: 1.1938, test_loss: 1.1318, test_f1: 0.3874
 epoch: 3, train_loss: 1.1574, test_loss: 1.1138, test_f1: 0.3894
 epoch: 4, train_loss: 1.1456, test_loss: 1.0947, test_f1: 0.4230
 epoch: 5, train_loss: 1.1289, test_loss: 1.0812, test_f1: 0.3987
 epoch: 6, train_loss: 1.1194, test_loss: 1.0606, test_f1: 0.4114
 epoch: 7, train_loss: 1.1035, test_loss: 1.0438, test_f1: 0.4193
 epoch: 8, train_loss: 1.0926, test_loss: 1.0554, test_f1: 0.4052
 epoch: 9, train_loss: 1.0807, test_loss: 1.0311, test_f1: 0.4259
 epoch: 10, train_loss: 1.0592, test_loss: 1.0385, test_f1: 0.4216
 epoch: 11, train_loss: 1.0588, test_loss: 1.0193, test_f1: 0.4271
 epoch: 12, train_loss: 1.0369, test_loss: 1.0288, test_f1: 0.4046
 epoch: 13, train_loss: 1.0483, test_loss: 1.0240, test_f1: 0.4268
 epoch: 14, train_loss: 1.0311, test_loss: 1.0111, test_f1: 0.4517
 epoch: 15, train_loss: 1.0231, test_loss: 1.0050, test_f1: 0.4339
 epoch: 16, train_loss: 1.0149, test_loss: 1.0111, test_f1: 0.4104
 epoch: 17, train_loss: 1.0123, test_loss: 1.0237, test_f1: 0.4284
 epoch: 18, train_loss: 0.9931, test_loss: 1.0040, test_f1: 0.4680
 epoch: 19, train_loss: 1.0042, test_loss: 1.0184, test_f1: 0.4424
 epoch: 20, train_loss: 0.9940, test_loss: 1.0085, test_f1: 0.4450
 epoch: 21, train_loss: 0.9769, test_loss: 1.0045, test_f1: 0.4534
 epoch: 22, train_loss: 0.9826, test_loss: 1.0018, test_f1: 0.4701
 epoch: 23, train_loss: 0.9724, test_loss: 1.0161, test_f1: 0.4623
 epoch: 24, train_loss: 0.9733, test_loss: 1.0047, test_f1: 0.4766
 epoch: 25, train_loss: 0.9593, test_loss: 1.0451, test_f1: 0.4386
 epoch: 26, train_loss: 0.9644, test_loss: 1.0141, test_f1: 0.4658
 epoch: 27, train_loss: 0.9574, test_loss: 1.0151, test_f1: 0.4518
 epoch: 28, train_loss: 0.9449, test_loss: 1.0144, test_f1: 0.4612
 epoch: 29, train_loss: 0.9378, test_loss: 1.0057, test_f1: 0.4617
 epoch: 30, train_loss: 0.9539, test_loss: 1.0131, test_f1: 0.4654
 epoch: 31, train_loss: 0.9296, test_loss: 1.0036, test_f1: 0.4672
 epoch: 32, train_loss: 0.9315, test_loss: 1.0207, test_f1: 0.4563
 epoch: 33, train_loss: 0.9271, test_loss: 0.9911, test_f1: 0.4805
 epoch: 34, train_loss: 0.9212, test_loss: 1.0078, test_f1: 0.4661
 epoch: 35, train_loss: 0.9232, test_loss: 1.0042, test_f1: 0.4787
 epoch: 36, train_loss: 0.9265, test_loss: 1.0081, test_f1: 0.4650
 epoch: 37, train_loss: 0.9306, test_loss: 1.0125, test_f1: 0.4778
 epoch: 38, train_loss: 0.9184, test_loss: 1.0099, test_f1: 0.4824
 epoch: 39, train_loss: 0.9170, test_loss: 1.0085, test_f1: 0.4788
 epoch: 40, train_loss: 0.9200, test_loss: 1.0411, test_f1: 0.4644
 epoch: 41, train_loss: 0.9124, test_loss: 1.0213, test_f1: 0.4653
 epoch: 42, train_loss: 0.8986, test_loss: 1.0052, test_f1: 0.4756
 epoch: 43, train_loss: 0.9069, test_loss: 1.0108, test_f1: 0.4994
 epoch: 44, train_loss: 0.9063, test_loss: 0.9897, test_f1: 0.4816
 epoch: 45, train_loss: 0.8944, test_loss: 1.0043, test_f1: 0.4879
 epoch: 46, train_loss: 0.8949, test_loss: 1.0868, test_f1: 0.4611
 epoch: 47, train_loss: 0.8926, test_loss: 1.0315, test_f1: 0.4704
 epoch: 48, train_loss: 0.8959, test_loss: 1.0250, test_f1: 0.4744
 epoch: 49, train_loss: 0.8885, test_loss: 0.9904, test_f1: 0.4923
 epoch: 50, train_loss: 0.8837, test_loss: 0.9988, test_f1: 0.4923
 epoch: 51, train_loss: 0.8809, test_loss: 0.9828, test_f1: 0.4909
 epoch: 52, train_loss: 0.8802, test_loss: 1.0415, test_f1: 0.4588
 epoch: 53, train_loss: 0.8748, test_loss: 1.0227, test_f1: 0.4832
 epoch: 54, train_loss: 0.8785, test_loss: 0.9854, test_f1: 0.4966
 epoch: 55, train_loss: 0.8779, test_loss: 0.9932, test_f1: 0.4962
 epoch: 56, train_loss: 0.8807, test_loss: 1.0212, test_f1: 0.4646
 epoch: 57, train_loss: 0.8767, test_loss: 0.9736, test_f1: 0.4835
 epoch: 58, train_loss: 0.8775, test_loss: 1.0014, test_f1: 0.4931
 epoch: 59, train_loss: 0.8759, test_loss: 1.0110, test_f1: 0.4831
 epoch: 60, train_loss: 0.8670, test_loss: 0.9848, test_f1: 0.4927
 epoch: 61, train_loss: 0.8685, test_loss: 0.9720, test_f1: 0.5007
 epoch: 62, train_loss: 0.8658, test_loss: 0.9925, test_f1: 0.4945
 epoch: 63, train_loss: 0.8662, test_loss: 0.9862, test_f1: 0.5137
 epoch: 64, train_loss: 0.8672, test_loss: 0.9656, test_f1: 0.4943
 epoch: 65, train_loss: 0.8675, test_loss: 1.0258, test_f1: 0.4717
 epoch: 66, train_loss: 0.8567, test_loss: 0.9650, test_f1: 0.5063
 epoch: 67, train_loss: 0.8659, test_loss: 1.0151, test_f1: 0.4798
 epoch: 68, train_loss: 0.8601, test_loss: 0.9760, test_f1: 0.4988
 epoch: 69, train_loss: 0.8676, test_loss: 1.0098, test_f1: 0.4898
 epoch: 70, train_loss: 0.8478, test_loss: 0.9740, test_f1: 0.5098
 epoch: 71, train_loss: 0.8504, test_loss: 0.9985, test_f1: 0.4820
 epoch: 72, train_loss: 0.8619, test_loss: 0.9999, test_f1: 0.4689
 epoch: 73, train_loss: 0.8557, test_loss: 0.9966, test_f1: 0.4967
 epoch: 74, train_loss: 0.8656, test_loss: 0.9629, test_f1: 0.5072
 epoch: 75, train_loss: 0.8526, test_loss: 0.9655, test_f1: 0.5167
 epoch: 76, train_loss: 0.8529, test_loss: 0.9895, test_f1: 0.4802
 epoch: 77, train_loss: 0.8564, test_loss: 0.9804, test_f1: 0.5066
 epoch: 78, train_loss: 0.8570, test_loss: 0.9824, test_f1: 0.5092
 epoch: 79, train_loss: 0.8516, test_loss: 0.9811, test_f1: 0.4981
 epoch: 80, train_loss: 0.8508, test_loss: 0.9774, test_f1: 0.5130
 epoch: 81, train_loss: 0.8380, test_loss: 0.9745, test_f1: 0.5023
 epoch: 82, train_loss: 0.8405, test_loss: 0.9732, test_f1: 0.5231
 epoch: 83, train_loss: 0.8429, test_loss: 0.9760, test_f1: 0.5046
 epoch: 84, train_loss: 0.8551, test_loss: 0.9687, test_f1: 0.5027
 epoch: 85, train_loss: 0.8336, test_loss: 0.9732, test_f1: 0.5033
 epoch: 86, train_loss: 0.8325, test_loss: 0.9618, test_f1: 0.5130
 epoch: 87, train_loss: 0.8371, test_loss: 1.0097, test_f1: 0.4969
 epoch: 88, train_loss: 0.8428, test_loss: 0.9753, test_f1: 0.5033
 epoch: 89, train_loss: 0.8397, test_loss: 0.9685, test_f1: 0.5009
 epoch: 90, train_loss: 0.8376, test_loss: 0.9616, test_f1: 0.5200
 epoch: 91, train_loss: 0.8424, test_loss: 0.9855, test_f1: 0.4985
 epoch: 92, train_loss: 0.8347, test_loss: 0.9840, test_f1: 0.4947
 epoch: 93, train_loss: 0.8348, test_loss: 0.9688, test_f1: 0.5116
 epoch: 94, train_loss: 0.8457, test_loss: 0.9975, test_f1: 0.5043
 epoch: 95, train_loss: 0.8380, test_loss: 1.0083, test_f1: 0.5131
 epoch: 96, train_loss: 0.8349, test_loss: 0.9843, test_f1: 0.5112
 epoch: 97, train_loss: 0.8287, test_loss: 0.9926, test_f1: 0.4990
 epoch: 98, train_loss: 0.8412, test_loss: 0.9708, test_f1: 0.5140
 epoch: 99, train_loss: 0.8415, test_loss: 0.9524, test_f1: 0.5321

Training completed in 1293.10 seconds
Best F1: 0.5826 at epoch 55
Mean F1 across iterations: 0.5485  0.0185
========================FINAL RESULTS================================
FEGIN weighted F1: 0.5826  0.0185
python main.py --data ltspice_examples --representation component_pin --model FEGIN --layers 5 --hiddens 32 --batch_size 32 --lr 0.0001 --emb_size 250 --epochs 100 --save_appendix component_pin_L5_H32_BS32_LR0.0001_E250 --no_val
-----



STDERR:
  File "main.py", line 370, in <module>
    main()
  File "main.py", line 254, in main
    dataset = dataset_class(
  File "/home/philip/projects/ltspice_examples_code_repo/Circuit-Completion-Using-GNNs/component_classification_with_link_prediction_head/evaluation/FEGIN/kernel/circuit_datasets.py", line 15, in __init__
    self.data, self.slices = torch.load(self.processed_paths[0])
  File "/home/philip/.local/lib/python3.8/site-packages/torch/serialization.py", line 1040, in load
    warnings.warn(
  File "/usr/lib/python3.8/warnings.py", line 109, in _showwarnmsg
    sw(msg.message, msg.category, msg.filename, msg.lineno,
  File "main.py", line 47, in warn_with_traceback
    traceback.print_stack(file=log)
/home/philip/projects/ltspice_examples_code_repo/Circuit-Completion-Using-GNNs/component_classification_with_link_prediction_head/evaluation/FEGIN/kernel/circuit_datasets.py:15: FutureWarning: You are using `torch.load` with `weights_only=False` (the current default value), which uses the default pickle module implicitly. It is possible to construct malicious pickle data which will execute arbitrary code during unpickling (See https://github.com/pytorch/pytorch/blob/main/SECURITY.md#untrusted-models for more details). In a future release, the default value for `weights_only` will be flipped to `True`. This limits the functions that could be executed during unpickling. Arbitrary objects will no longer be allowed to be loaded via this mode unless they are explicitly allowlisted by the user via `torch.serialization.add_safe_globals`. We recommend you start setting `weights_only=True` for any use case where you don't have full control of the loaded file. Please open an issue on GitHub for any issues related to this experimental feature.
  self.data, self.slices = torch.load(self.processed_paths[0])
