STDOUT:
Results will be saved in /home/philip/projects/ltspice_examples_code_repo/Circuit-Completion-Using-GNNs/component_classification_with_link_prediction_head/evaluation/FEGIN/results/model_FEGIN_dataset_ltspice_examples
Command line input: python main.py --data ltspice_examples --representation component_pin_net --model FEGIN --layers 4 --hiddens 16 --batch_size 32 --lr 0.01 --emb_size 250 --epochs 100 --save_appendix component_pin_net_L4_H16_BS32_LR0.01_E250 --no_val
 is saved.
-----
ltspice_examples - FEGIN
Using 4 layers, 16 hidden units, h = 2
Loading component_pin_net representation dataset
ENTERED
Training FEGIN on component_pin_net representation
Train: 3558, Test: 846
##################ITERATION #0 ****************************************
 epoch: 0, train_loss: 1.1712, test_loss: 1.1087, test_f1: 0.3423
 epoch: 1, train_loss: 1.0487, test_loss: 1.1180, test_f1: 0.4701
 epoch: 2, train_loss: 1.0231, test_loss: 1.0141, test_f1: 0.4645
 epoch: 3, train_loss: 1.0033, test_loss: 1.0166, test_f1: 0.4821
 epoch: 4, train_loss: 0.9938, test_loss: 1.1221, test_f1: 0.4388
 epoch: 5, train_loss: 0.9940, test_loss: 1.0157, test_f1: 0.4782
 epoch: 6, train_loss: 0.9844, test_loss: 1.0385, test_f1: 0.4547
 epoch: 7, train_loss: 0.9638, test_loss: 1.0097, test_f1: 0.4651
 epoch: 8, train_loss: 0.9747, test_loss: 1.0225, test_f1: 0.4909
 epoch: 9, train_loss: 0.9741, test_loss: 1.0371, test_f1: 0.4880
 epoch: 10, train_loss: 0.9615, test_loss: 1.0189, test_f1: 0.4330
 epoch: 11, train_loss: 0.9569, test_loss: 1.0107, test_f1: 0.4563
 epoch: 12, train_loss: 0.9486, test_loss: 0.9854, test_f1: 0.4767
 epoch: 13, train_loss: 0.9460, test_loss: 0.9925, test_f1: 0.4867
 epoch: 14, train_loss: 0.9390, test_loss: 0.9996, test_f1: 0.5199
 epoch: 15, train_loss: 0.9304, test_loss: 1.0340, test_f1: 0.4756
 epoch: 16, train_loss: 0.9361, test_loss: 1.0649, test_f1: 0.3752
 epoch: 17, train_loss: 0.9963, test_loss: 1.0142, test_f1: 0.4888
 epoch: 18, train_loss: 0.9660, test_loss: 0.9843, test_f1: 0.4635
 epoch: 19, train_loss: 0.9494, test_loss: 1.0365, test_f1: 0.4771
 epoch: 20, train_loss: 0.9406, test_loss: 1.0004, test_f1: 0.4564
 epoch: 21, train_loss: 0.9418, test_loss: 0.9737, test_f1: 0.4801
 epoch: 22, train_loss: 0.9486, test_loss: 0.9196, test_f1: 0.4943
 epoch: 23, train_loss: 0.9202, test_loss: 0.9505, test_f1: 0.5472
 epoch: 24, train_loss: 0.9229, test_loss: 0.9273, test_f1: 0.5265
 epoch: 25, train_loss: 0.9193, test_loss: 0.9880, test_f1: 0.5506
 epoch: 26, train_loss: 0.9169, test_loss: 0.9942, test_f1: 0.5138
 epoch: 27, train_loss: 0.9133, test_loss: 0.9513, test_f1: 0.5201
 epoch: 28, train_loss: 0.8892, test_loss: 0.9573, test_f1: 0.5421
 epoch: 29, train_loss: 0.9011, test_loss: 0.9038, test_f1: 0.5524
 epoch: 30, train_loss: 0.8913, test_loss: 0.9566, test_f1: 0.4951
 epoch: 31, train_loss: 0.8841, test_loss: 0.9432, test_f1: 0.5247
 epoch: 32, train_loss: 0.8922, test_loss: 0.9133, test_f1: 0.5202
 epoch: 33, train_loss: 0.8651, test_loss: 0.9682, test_f1: 0.5240
 epoch: 34, train_loss: 0.8882, test_loss: 0.8905, test_f1: 0.5204
 epoch: 35, train_loss: 0.8716, test_loss: 0.8930, test_f1: 0.4946
 epoch: 36, train_loss: 0.8688, test_loss: 0.8698, test_f1: 0.6015
 epoch: 37, train_loss: 0.8582, test_loss: 0.9428, test_f1: 0.5238
 epoch: 38, train_loss: 0.8526, test_loss: 0.8909, test_f1: 0.6126
 epoch: 39, train_loss: 0.8636, test_loss: 0.8799, test_f1: 0.5297
 epoch: 40, train_loss: 0.8660, test_loss: 0.8998, test_f1: 0.5510
 epoch: 41, train_loss: 0.8556, test_loss: 0.8649, test_f1: 0.5403
 epoch: 42, train_loss: 0.8459, test_loss: 0.8471, test_f1: 0.5928
 epoch: 43, train_loss: 0.8617, test_loss: 0.8125, test_f1: 0.5446
 epoch: 44, train_loss: 0.8548, test_loss: 0.8744, test_f1: 0.6200
 epoch: 45, train_loss: 0.8473, test_loss: 0.8871, test_f1: 0.5995
 epoch: 46, train_loss: 0.8391, test_loss: 0.8765, test_f1: 0.5971
 epoch: 47, train_loss: 0.8416, test_loss: 0.8549, test_f1: 0.6110
 epoch: 48, train_loss: 0.8419, test_loss: 0.8514, test_f1: 0.5603
 epoch: 49, train_loss: 0.8549, test_loss: 0.8508, test_f1: 0.5699
 epoch: 50, train_loss: 0.8594, test_loss: 0.8457, test_f1: 0.5410
 epoch: 51, train_loss: 0.8290, test_loss: 0.8878, test_f1: 0.5449
 epoch: 52, train_loss: 0.8139, test_loss: 0.8793, test_f1: 0.5573
 epoch: 53, train_loss: 0.8060, test_loss: 0.8670, test_f1: 0.6040
 epoch: 54, train_loss: 0.7954, test_loss: 0.8371, test_f1: 0.6078
 epoch: 55, train_loss: 0.7944, test_loss: 0.8557, test_f1: 0.6161
 epoch: 56, train_loss: 0.7950, test_loss: 0.8677, test_f1: 0.6106
 epoch: 57, train_loss: 0.8003, test_loss: 0.8558, test_f1: 0.5654
 epoch: 58, train_loss: 0.7958, test_loss: 0.8622, test_f1: 0.5551
 epoch: 59, train_loss: 0.7948, test_loss: 0.8377, test_f1: 0.6239
 epoch: 60, train_loss: 0.7967, test_loss: 0.8660, test_f1: 0.5629
 epoch: 61, train_loss: 0.8036, test_loss: 0.8668, test_f1: 0.6202
 epoch: 62, train_loss: 0.8021, test_loss: 0.8573, test_f1: 0.5961
 epoch: 63, train_loss: 0.7911, test_loss: 0.8271, test_f1: 0.6261
 epoch: 64, train_loss: 0.7853, test_loss: 0.8577, test_f1: 0.5852
 epoch: 65, train_loss: 0.7976, test_loss: 0.8534, test_f1: 0.5956
 epoch: 66, train_loss: 0.7831, test_loss: 0.8092, test_f1: 0.5880
 epoch: 67, train_loss: 0.7782, test_loss: 0.8398, test_f1: 0.6004
 epoch: 68, train_loss: 0.7812, test_loss: 0.8711, test_f1: 0.6124
 epoch: 69, train_loss: 0.8017, test_loss: 0.8853, test_f1: 0.5917
 epoch: 70, train_loss: 0.7940, test_loss: 0.8831, test_f1: 0.6304
 epoch: 71, train_loss: 0.7796, test_loss: 0.8874, test_f1: 0.6194
 epoch: 72, train_loss: 0.7835, test_loss: 0.8543, test_f1: 0.6501
 epoch: 73, train_loss: 0.7569, test_loss: 0.8527, test_f1: 0.6270
 epoch: 74, train_loss: 0.7838, test_loss: 0.8415, test_f1: 0.6444
 epoch: 75, train_loss: 0.7887, test_loss: 0.8570, test_f1: 0.6054
 epoch: 76, train_loss: 0.7793, test_loss: 0.8435, test_f1: 0.5936
 epoch: 77, train_loss: 0.7733, test_loss: 0.8417, test_f1: 0.6259
 epoch: 78, train_loss: 0.7711, test_loss: 0.8855, test_f1: 0.5845
 epoch: 79, train_loss: 0.7785, test_loss: 0.8293, test_f1: 0.5903
 epoch: 80, train_loss: 0.7706, test_loss: 0.8522, test_f1: 0.6366
 epoch: 81, train_loss: 0.7662, test_loss: 0.8498, test_f1: 0.6271
 epoch: 82, train_loss: 0.7648, test_loss: 0.8215, test_f1: 0.6575
 epoch: 83, train_loss: 0.7658, test_loss: 0.8369, test_f1: 0.6311
 epoch: 84, train_loss: 0.7665, test_loss: 0.8370, test_f1: 0.6380
 epoch: 85, train_loss: 0.7668, test_loss: 0.8394, test_f1: 0.6339
 epoch: 86, train_loss: 0.7658, test_loss: 0.8186, test_f1: 0.6338
 epoch: 87, train_loss: 0.7533, test_loss: 0.8553, test_f1: 0.6240
 epoch: 88, train_loss: 0.7536, test_loss: 0.8507, test_f1: 0.5574
 epoch: 89, train_loss: 0.7503, test_loss: 0.8456, test_f1: 0.6033
 epoch: 90, train_loss: 0.7706, test_loss: 0.8260, test_f1: 0.6698
 epoch: 91, train_loss: 0.7599, test_loss: 0.8237, test_f1: 0.6451
 epoch: 92, train_loss: 0.7557, test_loss: 0.8285, test_f1: 0.6235
 epoch: 93, train_loss: 0.7565, test_loss: 0.8466, test_f1: 0.6386
 epoch: 94, train_loss: 0.7461, test_loss: 0.8634, test_f1: 0.5481
 epoch: 95, train_loss: 0.7676, test_loss: 0.8425, test_f1: 0.6088
 epoch: 96, train_loss: 0.7496, test_loss: 0.8317, test_f1: 0.6196
 epoch: 97, train_loss: 0.7541, test_loss: 0.8411, test_f1: 0.6637
 epoch: 98, train_loss: 0.7559, test_loss: 0.8481, test_f1: 0.6074
 epoch: 99, train_loss: 0.7472, test_loss: 0.8204, test_f1: 0.6646
##################ITERATION #1 ****************************************
 epoch: 0, train_loss: 1.1099, test_loss: 1.1064, test_f1: 0.4090
 epoch: 1, train_loss: 1.0304, test_loss: 1.0615, test_f1: 0.5153
 epoch: 2, train_loss: 0.9981, test_loss: 1.0365, test_f1: 0.4465
 epoch: 3, train_loss: 0.9965, test_loss: 1.0565, test_f1: 0.4998
 epoch: 4, train_loss: 0.9783, test_loss: 1.0828, test_f1: 0.4834
 epoch: 5, train_loss: 0.9688, test_loss: 1.0019, test_f1: 0.4798
 epoch: 6, train_loss: 0.9607, test_loss: 1.0258, test_f1: 0.4951
 epoch: 7, train_loss: 0.9968, test_loss: 1.0334, test_f1: 0.5340
 epoch: 8, train_loss: 0.9520, test_loss: 0.9975, test_f1: 0.5027
 epoch: 9, train_loss: 0.9706, test_loss: 0.9723, test_f1: 0.5052
 epoch: 10, train_loss: 0.9428, test_loss: 0.9424, test_f1: 0.5064
 epoch: 11, train_loss: 0.9533, test_loss: 0.9367, test_f1: 0.5402
 epoch: 12, train_loss: 0.9336, test_loss: 0.9503, test_f1: 0.4869
 epoch: 13, train_loss: 0.9278, test_loss: 0.9463, test_f1: 0.5860
 epoch: 14, train_loss: 0.9203, test_loss: 1.1696, test_f1: 0.4773
 epoch: 15, train_loss: 0.9142, test_loss: 0.9504, test_f1: 0.5223
 epoch: 16, train_loss: 0.9163, test_loss: 0.9212, test_f1: 0.5361
 epoch: 17, train_loss: 0.9123, test_loss: 1.0055, test_f1: 0.4967
 epoch: 18, train_loss: 0.9151, test_loss: 0.9407, test_f1: 0.4844
 epoch: 19, train_loss: 0.8998, test_loss: 1.4002, test_f1: 0.4181
 epoch: 20, train_loss: 0.9014, test_loss: 0.8865, test_f1: 0.5232
 epoch: 21, train_loss: 0.8898, test_loss: 0.9103, test_f1: 0.5364
 epoch: 22, train_loss: 0.9047, test_loss: 1.0006, test_f1: 0.5067
 epoch: 23, train_loss: 0.8948, test_loss: 0.9697, test_f1: 0.5169
 epoch: 24, train_loss: 0.8748, test_loss: 0.9016, test_f1: 0.5168
 epoch: 25, train_loss: 0.8809, test_loss: 0.8945, test_f1: 0.5303
 epoch: 26, train_loss: 0.8739, test_loss: 0.8460, test_f1: 0.5605
 epoch: 27, train_loss: 0.8605, test_loss: 0.8776, test_f1: 0.5344
 epoch: 28, train_loss: 0.8584, test_loss: 0.9657, test_f1: 0.5027
 epoch: 29, train_loss: 0.8644, test_loss: 0.8396, test_f1: 0.5238
 epoch: 30, train_loss: 0.8668, test_loss: 0.8435, test_f1: 0.5555
 epoch: 31, train_loss: 0.8552, test_loss: 0.9633, test_f1: 0.4485
 epoch: 32, train_loss: 0.8479, test_loss: 0.8815, test_f1: 0.5478
 epoch: 33, train_loss: 0.8569, test_loss: 0.9133, test_f1: 0.5278
 epoch: 34, train_loss: 0.8536, test_loss: 0.8438, test_f1: 0.5567
 epoch: 35, train_loss: 0.8450, test_loss: 0.8556, test_f1: 0.5432
 epoch: 36, train_loss: 0.8742, test_loss: 0.8808, test_f1: 0.5471
 epoch: 37, train_loss: 0.8516, test_loss: 0.8059, test_f1: 0.5963
 epoch: 38, train_loss: 0.8411, test_loss: 0.8792, test_f1: 0.5391
 epoch: 39, train_loss: 0.8538, test_loss: 0.8650, test_f1: 0.5383
 epoch: 40, train_loss: 0.8581, test_loss: 0.9618, test_f1: 0.5550
 epoch: 41, train_loss: 0.8323, test_loss: 0.8317, test_f1: 0.5559
 epoch: 42, train_loss: 0.8343, test_loss: 0.9156, test_f1: 0.5341
 epoch: 43, train_loss: 0.8141, test_loss: 0.8321, test_f1: 0.5431
 epoch: 44, train_loss: 0.8317, test_loss: 0.7954, test_f1: 0.6196
 epoch: 45, train_loss: 0.8145, test_loss: 0.7910, test_f1: 0.6179
 epoch: 46, train_loss: 0.8577, test_loss: 0.8317, test_f1: 0.5427
 epoch: 47, train_loss: 0.8358, test_loss: 0.8610, test_f1: 0.5567
 epoch: 48, train_loss: 0.8358, test_loss: 0.9179, test_f1: 0.5259
 epoch: 49, train_loss: 0.8610, test_loss: 0.8587, test_f1: 0.5288
 epoch: 50, train_loss: 0.8472, test_loss: 0.8199, test_f1: 0.5579
 epoch: 51, train_loss: 0.8066, test_loss: 0.8256, test_f1: 0.6269
 epoch: 52, train_loss: 0.8009, test_loss: 0.8216, test_f1: 0.5811
 epoch: 53, train_loss: 0.7870, test_loss: 0.8261, test_f1: 0.5966
 epoch: 54, train_loss: 0.7906, test_loss: 0.8580, test_f1: 0.5743
 epoch: 55, train_loss: 0.8046, test_loss: 0.8116, test_f1: 0.5889
 epoch: 56, train_loss: 0.7932, test_loss: 0.8150, test_f1: 0.6207
 epoch: 57, train_loss: 0.7813, test_loss: 0.8199, test_f1: 0.5854
 epoch: 58, train_loss: 0.7869, test_loss: 0.8011, test_f1: 0.5959
 epoch: 59, train_loss: 0.7742, test_loss: 0.7923, test_f1: 0.5671
 epoch: 60, train_loss: 0.7763, test_loss: 0.8044, test_f1: 0.5939
 epoch: 61, train_loss: 0.7693, test_loss: 0.7800, test_f1: 0.6118
 epoch: 62, train_loss: 0.7632, test_loss: 0.8068, test_f1: 0.5852
 epoch: 63, train_loss: 0.7602, test_loss: 0.7889, test_f1: 0.6036
 epoch: 64, train_loss: 0.7759, test_loss: 0.7888, test_f1: 0.6079
 epoch: 65, train_loss: 0.7694, test_loss: 0.8113, test_f1: 0.5768
 epoch: 66, train_loss: 0.7793, test_loss: 0.7899, test_f1: 0.6199
 epoch: 67, train_loss: 0.7859, test_loss: 0.8040, test_f1: 0.5775
 epoch: 68, train_loss: 0.7642, test_loss: 0.7818, test_f1: 0.5969
 epoch: 69, train_loss: 0.7454, test_loss: 0.8139, test_f1: 0.6138
 epoch: 70, train_loss: 0.7608, test_loss: 0.7934, test_f1: 0.5902
 epoch: 71, train_loss: 0.7468, test_loss: 0.7921, test_f1: 0.6185
 epoch: 72, train_loss: 0.7669, test_loss: 0.8230, test_f1: 0.5814
 epoch: 73, train_loss: 0.7603, test_loss: 0.8061, test_f1: 0.5925
 epoch: 74, train_loss: 0.7384, test_loss: 0.8141, test_f1: 0.6139
 epoch: 75, train_loss: 0.7772, test_loss: 0.8163, test_f1: 0.6002
 epoch: 76, train_loss: 0.7688, test_loss: 0.8291, test_f1: 0.6104
 epoch: 77, train_loss: 0.7565, test_loss: 0.7878, test_f1: 0.6098
 epoch: 78, train_loss: 0.7449, test_loss: 0.8255, test_f1: 0.6400
 epoch: 79, train_loss: 0.8084, test_loss: 0.8499, test_f1: 0.5952
 epoch: 80, train_loss: 0.7891, test_loss: 0.7972, test_f1: 0.6023
 epoch: 81, train_loss: 0.7729, test_loss: 0.8000, test_f1: 0.6272
 epoch: 82, train_loss: 0.7548, test_loss: 0.8081, test_f1: 0.5841
 epoch: 83, train_loss: 0.7637, test_loss: 0.8251, test_f1: 0.6195
 epoch: 84, train_loss: 0.7429, test_loss: 0.8183, test_f1: 0.5911
 epoch: 85, train_loss: 0.7665, test_loss: 0.8079, test_f1: 0.5843
 epoch: 86, train_loss: 0.7500, test_loss: 0.8068, test_f1: 0.6022
 epoch: 87, train_loss: 0.7513, test_loss: 0.7850, test_f1: 0.6048
 epoch: 88, train_loss: 0.7379, test_loss: 0.7847, test_f1: 0.5972
 epoch: 89, train_loss: 0.7267, test_loss: 0.7986, test_f1: 0.5930
 epoch: 90, train_loss: 0.7342, test_loss: 0.8226, test_f1: 0.5769
 epoch: 91, train_loss: 0.7528, test_loss: 0.7992, test_f1: 0.5883
 epoch: 92, train_loss: 0.7411, test_loss: 0.7849, test_f1: 0.6012
 epoch: 93, train_loss: 0.7474, test_loss: 0.7786, test_f1: 0.5823
 epoch: 94, train_loss: 0.7392, test_loss: 0.8080, test_f1: 0.6340
 epoch: 95, train_loss: 0.7285, test_loss: 0.8203, test_f1: 0.6395
 epoch: 96, train_loss: 0.7280, test_loss: 0.8331, test_f1: 0.6330
 epoch: 97, train_loss: 0.7430, test_loss: 0.8234, test_f1: 0.5941
 epoch: 98, train_loss: 0.7510, test_loss: 0.7713, test_f1: 0.5984
 epoch: 99, train_loss: 0.7537, test_loss: 0.8500, test_f1: 0.6251
##################ITERATION #2 ****************************************
 epoch: 0, train_loss: 1.1224, test_loss: 1.1125, test_f1: 0.3499
 epoch: 1, train_loss: 1.0412, test_loss: 1.0678, test_f1: 0.4622
 epoch: 2, train_loss: 1.0220, test_loss: 1.0770, test_f1: 0.4339
 epoch: 3, train_loss: 1.0026, test_loss: 1.0910, test_f1: 0.4433
 epoch: 4, train_loss: 0.9854, test_loss: 1.0483, test_f1: 0.5098
 epoch: 5, train_loss: 0.9782, test_loss: 0.9711, test_f1: 0.4679
 epoch: 6, train_loss: 0.9654, test_loss: 1.0491, test_f1: 0.4294
 epoch: 7, train_loss: 0.9616, test_loss: 0.9964, test_f1: 0.4947
 epoch: 8, train_loss: 0.9588, test_loss: 1.0102, test_f1: 0.4835
 epoch: 9, train_loss: 0.9488, test_loss: 0.9847, test_f1: 0.5104
 epoch: 10, train_loss: 0.9404, test_loss: 1.0406, test_f1: 0.3972
 epoch: 11, train_loss: 0.9374, test_loss: 0.9565, test_f1: 0.4853
 epoch: 12, train_loss: 0.9277, test_loss: 1.0029, test_f1: 0.4737
 epoch: 13, train_loss: 0.9361, test_loss: 0.9464, test_f1: 0.5070
 epoch: 14, train_loss: 0.9256, test_loss: 0.9562, test_f1: 0.4929
 epoch: 15, train_loss: 0.9299, test_loss: 0.9490, test_f1: 0.5068
 epoch: 16, train_loss: 0.9172, test_loss: 0.9748, test_f1: 0.5043
 epoch: 17, train_loss: 0.9153, test_loss: 0.9056, test_f1: 0.5158
 epoch: 18, train_loss: 0.9028, test_loss: 0.9131, test_f1: 0.5759
 epoch: 19, train_loss: 0.9221, test_loss: 0.9701, test_f1: 0.5110
 epoch: 20, train_loss: 0.9447, test_loss: 0.9547, test_f1: 0.4914
 epoch: 21, train_loss: 0.9470, test_loss: 0.9666, test_f1: 0.4954
 epoch: 22, train_loss: 0.9439, test_loss: 0.9374, test_f1: 0.5471
 epoch: 23, train_loss: 0.9256, test_loss: 0.9317, test_f1: 0.5161
 epoch: 24, train_loss: 0.9116, test_loss: 0.9087, test_f1: 0.5196
 epoch: 25, train_loss: 0.9173, test_loss: 0.8692, test_f1: 0.5368
 epoch: 26, train_loss: 0.8948, test_loss: 0.9054, test_f1: 0.5100
 epoch: 27, train_loss: 0.8940, test_loss: 0.8679, test_f1: 0.5479
 epoch: 28, train_loss: 0.8776, test_loss: 0.8769, test_f1: 0.5423
 epoch: 29, train_loss: 0.8712, test_loss: 0.8708, test_f1: 0.5500
 epoch: 30, train_loss: 0.8792, test_loss: 0.9049, test_f1: 0.5183
 epoch: 31, train_loss: 0.8806, test_loss: 0.9101, test_f1: 0.5418
 epoch: 32, train_loss: 0.8721, test_loss: 0.8916, test_f1: 0.5163
 epoch: 33, train_loss: 0.8779, test_loss: 0.8380, test_f1: 0.5290
 epoch: 34, train_loss: 0.8711, test_loss: 0.8681, test_f1: 0.5489
 epoch: 35, train_loss: 0.8624, test_loss: 0.9800, test_f1: 0.4905
 epoch: 36, train_loss: 0.8838, test_loss: 0.9047, test_f1: 0.5304
 epoch: 37, train_loss: 0.8806, test_loss: 0.8479, test_f1: 0.5990
 epoch: 38, train_loss: 0.8580, test_loss: 0.8806, test_f1: 0.5296
 epoch: 39, train_loss: 0.8630, test_loss: 0.8608, test_f1: 0.5789
 epoch: 40, train_loss: 0.8624, test_loss: 0.9134, test_f1: 0.5121
 epoch: 41, train_loss: 0.8583, test_loss: 0.8559, test_f1: 0.5663
 epoch: 42, train_loss: 0.8485, test_loss: 0.8548, test_f1: 0.5541
 epoch: 43, train_loss: 0.8459, test_loss: 0.8506, test_f1: 0.6127
 epoch: 44, train_loss: 0.8522, test_loss: 0.8664, test_f1: 0.5362
 epoch: 45, train_loss: 0.8482, test_loss: 0.8681, test_f1: 0.5873
 epoch: 46, train_loss: 0.8566, test_loss: 0.8596, test_f1: 0.5398
 epoch: 47, train_loss: 0.8432, test_loss: 0.8279, test_f1: 0.5839
 epoch: 48, train_loss: 0.8250, test_loss: 0.8484, test_f1: 0.5919
 epoch: 49, train_loss: 0.8405, test_loss: 0.9327, test_f1: 0.5019
 epoch: 50, train_loss: 0.8196, test_loss: 0.8933, test_f1: 0.5328
 epoch: 51, train_loss: 0.8052, test_loss: 0.8826, test_f1: 0.5433
 epoch: 52, train_loss: 0.8036, test_loss: 0.8508, test_f1: 0.6240
 epoch: 53, train_loss: 0.8031, test_loss: 0.8542, test_f1: 0.5710
 epoch: 54, train_loss: 0.8011, test_loss: 0.8543, test_f1: 0.5749
 epoch: 55, train_loss: 0.7979, test_loss: 0.8452, test_f1: 0.5780
 epoch: 56, train_loss: 0.7941, test_loss: 0.8616, test_f1: 0.5729
 epoch: 57, train_loss: 0.7895, test_loss: 0.8493, test_f1: 0.6048
 epoch: 58, train_loss: 0.7802, test_loss: 0.8419, test_f1: 0.5819
 epoch: 59, train_loss: 0.7742, test_loss: 0.8709, test_f1: 0.5963
 epoch: 60, train_loss: 0.7922, test_loss: 0.8676, test_f1: 0.6037
 epoch: 61, train_loss: 0.7952, test_loss: 0.8694, test_f1: 0.6069
 epoch: 62, train_loss: 0.7852, test_loss: 0.8263, test_f1: 0.5905
 epoch: 63, train_loss: 0.7938, test_loss: 0.8193, test_f1: 0.5841
 epoch: 64, train_loss: 0.7714, test_loss: 0.8467, test_f1: 0.6004
 epoch: 65, train_loss: 0.7784, test_loss: 0.8361, test_f1: 0.6103
 epoch: 66, train_loss: 0.7834, test_loss: 0.8432, test_f1: 0.5891
 epoch: 67, train_loss: 0.7705, test_loss: 0.8571, test_f1: 0.5979
 epoch: 68, train_loss: 0.7765, test_loss: 0.8431, test_f1: 0.5662
 epoch: 69, train_loss: 0.7740, test_loss: 0.8286, test_f1: 0.6316
 epoch: 70, train_loss: 0.7789, test_loss: 0.8373, test_f1: 0.5890
 epoch: 71, train_loss: 0.7721, test_loss: 0.8265, test_f1: 0.5760
 epoch: 72, train_loss: 0.7662, test_loss: 0.8363, test_f1: 0.6216
 epoch: 73, train_loss: 0.7724, test_loss: 0.8505, test_f1: 0.5866
 epoch: 74, train_loss: 0.7738, test_loss: 0.8013, test_f1: 0.6104
 epoch: 75, train_loss: 0.7754, test_loss: 0.8108, test_f1: 0.6120
 epoch: 76, train_loss: 0.7638, test_loss: 0.8191, test_f1: 0.6181
 epoch: 77, train_loss: 0.7731, test_loss: 0.8512, test_f1: 0.5933
 epoch: 78, train_loss: 0.7645, test_loss: 0.8206, test_f1: 0.6266
 epoch: 79, train_loss: 0.7740, test_loss: 0.8386, test_f1: 0.5990
 epoch: 80, train_loss: 0.7459, test_loss: 0.8626, test_f1: 0.5995
 epoch: 81, train_loss: 0.7487, test_loss: 0.8476, test_f1: 0.6210
 epoch: 82, train_loss: 0.7665, test_loss: 0.8890, test_f1: 0.5895
 epoch: 83, train_loss: 0.7556, test_loss: 0.8293, test_f1: 0.6155
 epoch: 84, train_loss: 0.7553, test_loss: 0.8533, test_f1: 0.6177
 epoch: 85, train_loss: 0.7575, test_loss: 0.8556, test_f1: 0.5831
 epoch: 86, train_loss: 0.7610, test_loss: 0.8580, test_f1: 0.6115
 epoch: 87, train_loss: 0.7505, test_loss: 0.8189, test_f1: 0.6661
 epoch: 88, train_loss: 0.7461, test_loss: 0.8694, test_f1: 0.6100
 epoch: 89, train_loss: 0.7422, test_loss: 0.8263, test_f1: 0.6132
 epoch: 90, train_loss: 0.7441, test_loss: 0.8574, test_f1: 0.5928
 epoch: 91, train_loss: 0.7412, test_loss: 0.8984, test_f1: 0.6213
 epoch: 92, train_loss: 0.7386, test_loss: 0.8468, test_f1: 0.6170
 epoch: 93, train_loss: 0.7538, test_loss: 0.8688, test_f1: 0.6124
 epoch: 94, train_loss: 0.7667, test_loss: 0.8477, test_f1: 0.6040
 epoch: 95, train_loss: 0.7277, test_loss: 0.8799, test_f1: 0.6235
 epoch: 96, train_loss: 0.7565, test_loss: 0.8796, test_f1: 0.6099
 epoch: 97, train_loss: 0.7464, test_loss: 0.8587, test_f1: 0.6133
 epoch: 98, train_loss: 0.7447, test_loss: 0.8983, test_f1: 0.6129
 epoch: 99, train_loss: 0.7296, test_loss: 0.8407, test_f1: 0.5941
##################ITERATION #3 ****************************************
 epoch: 0, train_loss: 1.1226, test_loss: 1.1115, test_f1: 0.4412
 epoch: 1, train_loss: 1.0225, test_loss: 1.0348, test_f1: 0.4597
 epoch: 2, train_loss: 1.0193, test_loss: 1.3096, test_f1: 0.3878
 epoch: 3, train_loss: 1.0139, test_loss: 1.0153, test_f1: 0.4990
 epoch: 4, train_loss: 0.9842, test_loss: 1.0431, test_f1: 0.4939
 epoch: 5, train_loss: 0.9797, test_loss: 1.0358, test_f1: 0.4610
 epoch: 6, train_loss: 0.9750, test_loss: 0.9638, test_f1: 0.4788
 epoch: 7, train_loss: 0.9651, test_loss: 1.0110, test_f1: 0.4761
 epoch: 8, train_loss: 0.9755, test_loss: 1.0046, test_f1: 0.4837
 epoch: 9, train_loss: 0.9716, test_loss: 1.0047, test_f1: 0.5546
 epoch: 10, train_loss: 0.9722, test_loss: 1.0313, test_f1: 0.4753
 epoch: 11, train_loss: 0.9435, test_loss: 1.0489, test_f1: 0.4906
 epoch: 12, train_loss: 0.9593, test_loss: 1.0284, test_f1: 0.5128
 epoch: 13, train_loss: 0.9471, test_loss: 1.1008, test_f1: 0.5198
 epoch: 14, train_loss: 0.9257, test_loss: 1.0206, test_f1: 0.5019
 epoch: 15, train_loss: 0.9375, test_loss: 0.8924, test_f1: 0.5274
 epoch: 16, train_loss: 0.9300, test_loss: 0.9320, test_f1: 0.5066
 epoch: 17, train_loss: 0.9198, test_loss: 1.0000, test_f1: 0.4605
 epoch: 18, train_loss: 0.9308, test_loss: 0.9368, test_f1: 0.5184
 epoch: 19, train_loss: 0.9214, test_loss: 0.9271, test_f1: 0.5260
 epoch: 20, train_loss: 0.9052, test_loss: 0.8957, test_f1: 0.5243
 epoch: 21, train_loss: 0.9083, test_loss: 0.9439, test_f1: 0.5546
 epoch: 22, train_loss: 0.9162, test_loss: 0.9498, test_f1: 0.5349
 epoch: 23, train_loss: 0.9034, test_loss: 0.9098, test_f1: 0.5747
 epoch: 24, train_loss: 0.9085, test_loss: 0.9215, test_f1: 0.5265
 epoch: 25, train_loss: 0.8996, test_loss: 0.9394, test_f1: 0.5278
 epoch: 26, train_loss: 0.9102, test_loss: 0.9062, test_f1: 0.5197
 epoch: 27, train_loss: 0.8999, test_loss: 0.9317, test_f1: 0.5591
 epoch: 28, train_loss: 0.8933, test_loss: 0.9261, test_f1: 0.5263
 epoch: 29, train_loss: 0.8814, test_loss: 0.8815, test_f1: 0.5626
 epoch: 30, train_loss: 0.8914, test_loss: 0.9292, test_f1: 0.5712
 epoch: 31, train_loss: 0.8929, test_loss: 1.0241, test_f1: 0.5046
 epoch: 32, train_loss: 0.8848, test_loss: 0.9501, test_f1: 0.5336
 epoch: 33, train_loss: 0.8935, test_loss: 0.9197, test_f1: 0.5341
 epoch: 34, train_loss: 0.9079, test_loss: 0.8983, test_f1: 0.5424
 epoch: 35, train_loss: 0.8880, test_loss: 0.9317, test_f1: 0.5317
 epoch: 36, train_loss: 0.8800, test_loss: 0.9140, test_f1: 0.5249
 epoch: 37, train_loss: 0.8761, test_loss: 0.9002, test_f1: 0.5326
 epoch: 38, train_loss: 0.9156, test_loss: 0.9243, test_f1: 0.5336
 epoch: 39, train_loss: 0.8823, test_loss: 0.9348, test_f1: 0.5676
 epoch: 40, train_loss: 0.8797, test_loss: 0.9530, test_f1: 0.5144
 epoch: 41, train_loss: 0.8736, test_loss: 0.9708, test_f1: 0.5131
 epoch: 42, train_loss: 0.8727, test_loss: 0.8956, test_f1: 0.5655
 epoch: 43, train_loss: 0.8655, test_loss: 0.8814, test_f1: 0.5704
 epoch: 44, train_loss: 0.8700, test_loss: 0.9555, test_f1: 0.5194
 epoch: 45, train_loss: 0.8669, test_loss: 0.8989, test_f1: 0.5232
 epoch: 46, train_loss: 0.8566, test_loss: 0.9323, test_f1: 0.5361
 epoch: 47, train_loss: 0.8755, test_loss: 0.8872, test_f1: 0.5174
 epoch: 48, train_loss: 0.8565, test_loss: 0.9402, test_f1: 0.5831
 epoch: 49, train_loss: 0.8486, test_loss: 0.9030, test_f1: 0.5453
 epoch: 50, train_loss: 0.8753, test_loss: 0.9041, test_f1: 0.5544
 epoch: 51, train_loss: 0.8548, test_loss: 0.8647, test_f1: 0.5425
 epoch: 52, train_loss: 0.8427, test_loss: 0.8657, test_f1: 0.5395
 epoch: 53, train_loss: 0.8400, test_loss: 0.8794, test_f1: 0.5344
 epoch: 54, train_loss: 0.8248, test_loss: 0.8611, test_f1: 0.5387
 epoch: 55, train_loss: 0.8406, test_loss: 0.8917, test_f1: 0.5352
 epoch: 56, train_loss: 0.8300, test_loss: 0.8415, test_f1: 0.5461
 epoch: 57, train_loss: 0.8305, test_loss: 0.8847, test_f1: 0.5651
 epoch: 58, train_loss: 0.8471, test_loss: 0.8710, test_f1: 0.5637
 epoch: 59, train_loss: 0.8178, test_loss: 0.8722, test_f1: 0.5873
 epoch: 60, train_loss: 0.8245, test_loss: 0.8981, test_f1: 0.5334
 epoch: 61, train_loss: 0.8247, test_loss: 0.8927, test_f1: 0.5243
 epoch: 62, train_loss: 0.8105, test_loss: 0.8659, test_f1: 0.5629
 epoch: 63, train_loss: 0.8281, test_loss: 0.8613, test_f1: 0.5495
 epoch: 64, train_loss: 0.8082, test_loss: 0.8741, test_f1: 0.5884
 epoch: 65, train_loss: 0.8103, test_loss: 0.8442, test_f1: 0.5695
 epoch: 66, train_loss: 0.8089, test_loss: 0.8685, test_f1: 0.5522
 epoch: 67, train_loss: 0.8186, test_loss: 0.8469, test_f1: 0.5726
 epoch: 68, train_loss: 0.8218, test_loss: 0.8746, test_f1: 0.5592
 epoch: 69, train_loss: 0.8153, test_loss: 0.8510, test_f1: 0.5671
 epoch: 70, train_loss: 0.8156, test_loss: 0.8373, test_f1: 0.5608
 epoch: 71, train_loss: 0.8025, test_loss: 0.8668, test_f1: 0.5566
 epoch: 72, train_loss: 0.8208, test_loss: 0.8677, test_f1: 0.5635
 epoch: 73, train_loss: 0.8166, test_loss: 0.8707, test_f1: 0.5750
 epoch: 74, train_loss: 0.8178, test_loss: 0.8848, test_f1: 0.5954
 epoch: 75, train_loss: 0.8142, test_loss: 0.8195, test_f1: 0.5916
 epoch: 76, train_loss: 0.8011, test_loss: 0.8131, test_f1: 0.5823
 epoch: 77, train_loss: 0.7976, test_loss: 0.8327, test_f1: 0.5687
 epoch: 78, train_loss: 0.8100, test_loss: 0.8316, test_f1: 0.5600
 epoch: 79, train_loss: 0.7979, test_loss: 0.8959, test_f1: 0.5721
 epoch: 80, train_loss: 0.8055, test_loss: 0.8620, test_f1: 0.5549
 epoch: 81, train_loss: 0.8060, test_loss: 0.8087, test_f1: 0.5990
 epoch: 82, train_loss: 0.8028, test_loss: 0.8814, test_f1: 0.6092
 epoch: 83, train_loss: 0.7892, test_loss: 0.8300, test_f1: 0.5812
 epoch: 84, train_loss: 0.7954, test_loss: 0.8553, test_f1: 0.5883
 epoch: 85, train_loss: 0.8070, test_loss: 0.8662, test_f1: 0.5744
 epoch: 86, train_loss: 0.8047, test_loss: 0.9163, test_f1: 0.5949
 epoch: 87, train_loss: 0.7968, test_loss: 0.8790, test_f1: 0.5659
 epoch: 88, train_loss: 0.8085, test_loss: 0.8818, test_f1: 0.5845
 epoch: 89, train_loss: 0.7791, test_loss: 0.8983, test_f1: 0.5962
 epoch: 90, train_loss: 0.8077, test_loss: 0.9115, test_f1: 0.5867
 epoch: 91, train_loss: 0.8008, test_loss: 0.9013, test_f1: 0.6276
 epoch: 92, train_loss: 0.7910, test_loss: 0.8618, test_f1: 0.5814
 epoch: 93, train_loss: 0.8048, test_loss: 0.8948, test_f1: 0.6278
 epoch: 94, train_loss: 0.7966, test_loss: 0.8911, test_f1: 0.5777
 epoch: 95, train_loss: 0.8037, test_loss: 0.8864, test_f1: 0.5730
 epoch: 96, train_loss: 0.7979, test_loss: 0.8892, test_f1: 0.5796
 epoch: 97, train_loss: 0.8020, test_loss: 0.8647, test_f1: 0.6258
 epoch: 98, train_loss: 0.7962, test_loss: 0.8176, test_f1: 0.6016
 epoch: 99, train_loss: 0.7946, test_loss: 0.8799, test_f1: 0.5827
##################ITERATION #4 ****************************************
 epoch: 0, train_loss: 1.1190, test_loss: 1.0904, test_f1: 0.4787
 epoch: 1, train_loss: 1.0326, test_loss: 1.1348, test_f1: 0.4164
 epoch: 2, train_loss: 1.0091, test_loss: 1.0797, test_f1: 0.4054
 epoch: 3, train_loss: 1.0054, test_loss: 1.0189, test_f1: 0.4674
 epoch: 4, train_loss: 0.9812, test_loss: 1.0201, test_f1: 0.4682
 epoch: 5, train_loss: 0.9775, test_loss: 0.9908, test_f1: 0.4834
 epoch: 6, train_loss: 0.9705, test_loss: 1.0410, test_f1: 0.4753
 epoch: 7, train_loss: 0.9645, test_loss: 1.0317, test_f1: 0.4750
 epoch: 8, train_loss: 0.9609, test_loss: 0.9694, test_f1: 0.5010
 epoch: 9, train_loss: 0.9509, test_loss: 1.0061, test_f1: 0.4848
 epoch: 10, train_loss: 0.9552, test_loss: 0.9094, test_f1: 0.5197
 epoch: 11, train_loss: 0.9487, test_loss: 1.0034, test_f1: 0.5061
 epoch: 12, train_loss: 0.9494, test_loss: 0.9955, test_f1: 0.4836
 epoch: 13, train_loss: 0.9421, test_loss: 0.9932, test_f1: 0.4942
 epoch: 14, train_loss: 0.9315, test_loss: 1.1618, test_f1: 0.4353
 epoch: 15, train_loss: 0.9584, test_loss: 1.1584, test_f1: 0.4193
 epoch: 16, train_loss: 0.9468, test_loss: 0.9208, test_f1: 0.5006
 epoch: 17, train_loss: 0.9341, test_loss: 1.0127, test_f1: 0.4632
 epoch: 18, train_loss: 0.9366, test_loss: 0.9648, test_f1: 0.5082
 epoch: 19, train_loss: 0.9234, test_loss: 1.0037, test_f1: 0.4834
 epoch: 20, train_loss: 0.9267, test_loss: 1.0366, test_f1: 0.4854
 epoch: 21, train_loss: 0.9296, test_loss: 1.0066, test_f1: 0.5099
 epoch: 22, train_loss: 0.9095, test_loss: 1.0483, test_f1: 0.5209
 epoch: 23, train_loss: 0.9241, test_loss: 1.0174, test_f1: 0.5573
 epoch: 24, train_loss: 0.9003, test_loss: 1.0444, test_f1: 0.5223
 epoch: 25, train_loss: 0.9056, test_loss: 1.0473, test_f1: 0.4804
 epoch: 26, train_loss: 0.9115, test_loss: 1.0523, test_f1: 0.4843
 epoch: 27, train_loss: 0.9073, test_loss: 1.0501, test_f1: 0.5015
 epoch: 28, train_loss: 0.9011, test_loss: 0.9414, test_f1: 0.4986
 epoch: 29, train_loss: 0.9009, test_loss: 1.0842, test_f1: 0.4878
 epoch: 30, train_loss: 0.8978, test_loss: 0.9725, test_f1: 0.4942
 epoch: 31, train_loss: 0.9113, test_loss: 1.0016, test_f1: 0.5700
 epoch: 32, train_loss: 0.8990, test_loss: 1.0681, test_f1: 0.5198
 epoch: 33, train_loss: 0.8796, test_loss: 1.0032, test_f1: 0.5599
 epoch: 34, train_loss: 0.8803, test_loss: 0.9070, test_f1: 0.5508
 epoch: 35, train_loss: 0.8734, test_loss: 0.8947, test_f1: 0.5358
 epoch: 36, train_loss: 0.8827, test_loss: 0.9538, test_f1: 0.5409
 epoch: 37, train_loss: 0.8811, test_loss: 0.9560, test_f1: 0.5340
 epoch: 38, train_loss: 0.8686, test_loss: 1.0041, test_f1: 0.5306
 epoch: 39, train_loss: 0.8592, test_loss: 0.9751, test_f1: 0.5836
 epoch: 40, train_loss: 0.8700, test_loss: 0.9821, test_f1: 0.5162
 epoch: 41, train_loss: 0.8646, test_loss: 1.0244, test_f1: 0.5081
 epoch: 42, train_loss: 0.8698, test_loss: 1.0720, test_f1: 0.4820
 epoch: 43, train_loss: 0.8777, test_loss: 0.9550, test_f1: 0.5470
 epoch: 44, train_loss: 0.8921, test_loss: 0.9082, test_f1: 0.5529
 epoch: 45, train_loss: 0.8948, test_loss: 0.9330, test_f1: 0.5320
 epoch: 46, train_loss: 0.8834, test_loss: 0.8752, test_f1: 0.5509
 epoch: 47, train_loss: 0.8617, test_loss: 0.7982, test_f1: 0.5534
 epoch: 48, train_loss: 0.8592, test_loss: 1.0399, test_f1: 0.4816
 epoch: 49, train_loss: 0.8616, test_loss: 0.9362, test_f1: 0.5426
 epoch: 50, train_loss: 0.8596, test_loss: 0.9658, test_f1: 0.5282
 epoch: 51, train_loss: 0.8305, test_loss: 0.9041, test_f1: 0.6027
 epoch: 52, train_loss: 0.8404, test_loss: 0.8663, test_f1: 0.6184
 epoch: 53, train_loss: 0.8174, test_loss: 0.9037, test_f1: 0.5777
 epoch: 54, train_loss: 0.8322, test_loss: 0.9156, test_f1: 0.6139
 epoch: 55, train_loss: 0.8276, test_loss: 0.9492, test_f1: 0.5467
 epoch: 56, train_loss: 0.8275, test_loss: 0.9526, test_f1: 0.5707
 epoch: 57, train_loss: 0.8185, test_loss: 0.9082, test_f1: 0.6073
 epoch: 58, train_loss: 0.8041, test_loss: 0.9112, test_f1: 0.6172
 epoch: 59, train_loss: 0.8060, test_loss: 0.9060, test_f1: 0.5923
 epoch: 60, train_loss: 0.8165, test_loss: 0.9265, test_f1: 0.5692
 epoch: 61, train_loss: 0.8071, test_loss: 0.9317, test_f1: 0.5897
 epoch: 62, train_loss: 0.8108, test_loss: 0.9825, test_f1: 0.5565
 epoch: 63, train_loss: 0.8088, test_loss: 0.8783, test_f1: 0.6065
 epoch: 64, train_loss: 0.8173, test_loss: 0.9259, test_f1: 0.5632
 epoch: 65, train_loss: 0.8086, test_loss: 0.9076, test_f1: 0.5977
 epoch: 66, train_loss: 0.8109, test_loss: 0.8842, test_f1: 0.5904
 epoch: 67, train_loss: 0.8133, test_loss: 0.8926, test_f1: 0.5914
 epoch: 68, train_loss: 0.8112, test_loss: 0.9166, test_f1: 0.5684
 epoch: 69, train_loss: 0.7995, test_loss: 0.9353, test_f1: 0.5619
 epoch: 70, train_loss: 0.8036, test_loss: 0.8939, test_f1: 0.5855
 epoch: 71, train_loss: 0.8035, test_loss: 0.9204, test_f1: 0.5890
 epoch: 72, train_loss: 0.8002, test_loss: 0.8372, test_f1: 0.6364
 epoch: 73, train_loss: 0.7967, test_loss: 0.9396, test_f1: 0.5472
 epoch: 74, train_loss: 0.8019, test_loss: 0.8378, test_f1: 0.5733
 epoch: 75, train_loss: 0.7914, test_loss: 0.9274, test_f1: 0.5850
 epoch: 76, train_loss: 0.7960, test_loss: 0.9000, test_f1: 0.6249
 epoch: 77, train_loss: 0.7926, test_loss: 0.8215, test_f1: 0.6310
 epoch: 78, train_loss: 0.7837, test_loss: 0.7880, test_f1: 0.6115
 epoch: 79, train_loss: 0.7874, test_loss: 0.9406, test_f1: 0.5936
 epoch: 80, train_loss: 0.7775, test_loss: 1.0157, test_f1: 0.5701
 epoch: 81, train_loss: 0.7893, test_loss: 0.9193, test_f1: 0.6141
 epoch: 82, train_loss: 0.8020, test_loss: 0.8331, test_f1: 0.6139
 epoch: 83, train_loss: 0.7916, test_loss: 0.9369, test_f1: 0.5955
 epoch: 84, train_loss: 0.7895, test_loss: 0.9020, test_f1: 0.6110
 epoch: 85, train_loss: 0.7906, test_loss: 0.8985, test_f1: 0.6485
 epoch: 86, train_loss: 0.7940, test_loss: 0.8625, test_f1: 0.6154
 epoch: 87, train_loss: 0.7901, test_loss: 0.8968, test_f1: 0.6148
 epoch: 88, train_loss: 0.8008, test_loss: 0.8401, test_f1: 0.6207
 epoch: 89, train_loss: 0.7800, test_loss: 0.9278, test_f1: 0.6141
 epoch: 90, train_loss: 0.7790, test_loss: 0.8806, test_f1: 0.6435
 epoch: 91, train_loss: 0.7703, test_loss: 0.8592, test_f1: 0.6179
 epoch: 92, train_loss: 0.8016, test_loss: 0.8230, test_f1: 0.6320
 epoch: 93, train_loss: 0.7844, test_loss: 0.8442, test_f1: 0.6220
 epoch: 94, train_loss: 0.7870, test_loss: 0.9407, test_f1: 0.6117
 epoch: 95, train_loss: 0.7808, test_loss: 0.8259, test_f1: 0.6361
 epoch: 96, train_loss: 0.7746, test_loss: 0.8861, test_f1: 0.5925
 epoch: 97, train_loss: 0.7724, test_loss: 0.9741, test_f1: 0.5868
 epoch: 98, train_loss: 0.7866, test_loss: 0.8995, test_f1: 0.6023
 epoch: 99, train_loss: 0.7795, test_loss: 0.8929, test_f1: 0.6120
##################ITERATION #5 ****************************************
 epoch: 0, train_loss: 1.1177, test_loss: 1.1372, test_f1: 0.3611
 epoch: 1, train_loss: 1.0398, test_loss: 0.9980, test_f1: 0.4374
 epoch: 2, train_loss: 0.9996, test_loss: 1.0484, test_f1: 0.4773
 epoch: 3, train_loss: 0.9967, test_loss: 1.0290, test_f1: 0.4872
 epoch: 4, train_loss: 0.9743, test_loss: 0.9209, test_f1: 0.5119
 epoch: 5, train_loss: 0.9771, test_loss: 0.9982, test_f1: 0.4913
 epoch: 6, train_loss: 0.9608, test_loss: 1.0054, test_f1: 0.4590
 epoch: 7, train_loss: 0.9485, test_loss: 0.9672, test_f1: 0.5109
 epoch: 8, train_loss: 0.9409, test_loss: 0.9594, test_f1: 0.5233
 epoch: 9, train_loss: 0.9515, test_loss: 0.8984, test_f1: 0.5091
 epoch: 10, train_loss: 0.9272, test_loss: 0.9618, test_f1: 0.5129
 epoch: 11, train_loss: 0.9196, test_loss: 0.9600, test_f1: 0.4959
 epoch: 12, train_loss: 0.9131, test_loss: 0.9101, test_f1: 0.5279
 epoch: 13, train_loss: 0.9049, test_loss: 0.9436, test_f1: 0.5298
 epoch: 14, train_loss: 0.9010, test_loss: 0.9804, test_f1: 0.4941
 epoch: 15, train_loss: 0.9109, test_loss: 0.8659, test_f1: 0.5272
 epoch: 16, train_loss: 0.9047, test_loss: 0.9460, test_f1: 0.5232
 epoch: 17, train_loss: 0.9022, test_loss: 0.8560, test_f1: 0.5368
 epoch: 18, train_loss: 0.8992, test_loss: 0.9255, test_f1: 0.5176
 epoch: 19, train_loss: 0.8788, test_loss: 0.8898, test_f1: 0.5124
 epoch: 20, train_loss: 0.8829, test_loss: 0.8562, test_f1: 0.5338
 epoch: 21, train_loss: 0.8801, test_loss: 0.8719, test_f1: 0.5142
 epoch: 22, train_loss: 0.8815, test_loss: 0.8690, test_f1: 0.5278
 epoch: 23, train_loss: 0.8774, test_loss: 0.8570, test_f1: 0.5645
 epoch: 24, train_loss: 0.8586, test_loss: 0.8764, test_f1: 0.5456
 epoch: 25, train_loss: 0.8726, test_loss: 0.8808, test_f1: 0.5394
 epoch: 26, train_loss: 0.8658, test_loss: 0.8945, test_f1: 0.5658
 epoch: 27, train_loss: 0.8731, test_loss: 0.9052, test_f1: 0.5440
 epoch: 28, train_loss: 0.8539, test_loss: 0.8817, test_f1: 0.5334
 epoch: 29, train_loss: 0.8599, test_loss: 0.8946, test_f1: 0.5568
 epoch: 30, train_loss: 0.8454, test_loss: 0.8873, test_f1: 0.5605
 epoch: 31, train_loss: 0.8456, test_loss: 0.8819, test_f1: 0.5453
 epoch: 32, train_loss: 0.8600, test_loss: 0.8766, test_f1: 0.5446
 epoch: 33, train_loss: 0.8513, test_loss: 0.8434, test_f1: 0.5408
 epoch: 34, train_loss: 0.8489, test_loss: 0.8588, test_f1: 0.5618
 epoch: 35, train_loss: 0.8326, test_loss: 0.8321, test_f1: 0.5523
 epoch: 36, train_loss: 0.8366, test_loss: 0.8758, test_f1: 0.5364
 epoch: 37, train_loss: 0.8558, test_loss: 0.8831, test_f1: 0.5481
 epoch: 38, train_loss: 0.8447, test_loss: 0.8673, test_f1: 0.5666
 epoch: 39, train_loss: 0.8223, test_loss: 0.8914, test_f1: 0.5772
 epoch: 40, train_loss: 0.8422, test_loss: 1.0034, test_f1: 0.4894
 epoch: 41, train_loss: 0.8654, test_loss: 0.8617, test_f1: 0.5399
 epoch: 42, train_loss: 0.8347, test_loss: 0.8594, test_f1: 0.5448
 epoch: 43, train_loss: 0.8185, test_loss: 0.8479, test_f1: 0.5589
 epoch: 44, train_loss: 0.8160, test_loss: 0.9121, test_f1: 0.5388
 epoch: 45, train_loss: 0.8291, test_loss: 0.8556, test_f1: 0.5845
 epoch: 46, train_loss: 0.8114, test_loss: 0.8112, test_f1: 0.5757
 epoch: 47, train_loss: 0.8227, test_loss: 0.8723, test_f1: 0.5946
 epoch: 48, train_loss: 0.8133, test_loss: 0.8372, test_f1: 0.6132
 epoch: 49, train_loss: 0.8132, test_loss: 0.9891, test_f1: 0.5031
 epoch: 50, train_loss: 0.8134, test_loss: 0.9331, test_f1: 0.5634
 epoch: 51, train_loss: 0.7857, test_loss: 0.8486, test_f1: 0.5913
 epoch: 52, train_loss: 0.7858, test_loss: 0.8307, test_f1: 0.6072
 epoch: 53, train_loss: 0.7858, test_loss: 0.8262, test_f1: 0.6219
 epoch: 54, train_loss: 0.7802, test_loss: 0.8103, test_f1: 0.6403
 epoch: 55, train_loss: 0.7803, test_loss: 0.9087, test_f1: 0.5886
 epoch: 56, train_loss: 0.7831, test_loss: 0.8735, test_f1: 0.5903
 epoch: 57, train_loss: 0.7799, test_loss: 0.9290, test_f1: 0.5444
 epoch: 58, train_loss: 0.7828, test_loss: 0.8290, test_f1: 0.5997
 epoch: 59, train_loss: 0.7858, test_loss: 0.8489, test_f1: 0.5827
 epoch: 60, train_loss: 0.7763, test_loss: 0.8372, test_f1: 0.6236
 epoch: 61, train_loss: 0.7569, test_loss: 0.8094, test_f1: 0.6156
 epoch: 62, train_loss: 0.7713, test_loss: 0.8153, test_f1: 0.6349
 epoch: 63, train_loss: 0.7800, test_loss: 0.7711, test_f1: 0.6194
 epoch: 64, train_loss: 0.7685, test_loss: 0.7813, test_f1: 0.6180
 epoch: 65, train_loss: 0.7699, test_loss: 0.8126, test_f1: 0.6364
 epoch: 66, train_loss: 0.7644, test_loss: 0.8341, test_f1: 0.6238
 epoch: 67, train_loss: 0.7631, test_loss: 0.8120, test_f1: 0.6127
 epoch: 68, train_loss: 0.7623, test_loss: 0.8400, test_f1: 0.6007
 epoch: 69, train_loss: 0.7489, test_loss: 0.8447, test_f1: 0.6312
 epoch: 70, train_loss: 0.7683, test_loss: 0.7652, test_f1: 0.6503
 epoch: 71, train_loss: 0.7734, test_loss: 0.7711, test_f1: 0.6380
 epoch: 72, train_loss: 0.7552, test_loss: 0.8185, test_f1: 0.5917
 epoch: 73, train_loss: 0.7572, test_loss: 0.8652, test_f1: 0.6079
 epoch: 74, train_loss: 0.7631, test_loss: 0.8360, test_f1: 0.6255
 epoch: 75, train_loss: 0.7638, test_loss: 0.8213, test_f1: 0.6237
 epoch: 76, train_loss: 0.7607, test_loss: 0.7708, test_f1: 0.6407
 epoch: 77, train_loss: 0.7344, test_loss: 0.8280, test_f1: 0.6469
 epoch: 78, train_loss: 0.7523, test_loss: 0.8083, test_f1: 0.6449
 epoch: 79, train_loss: 0.7475, test_loss: 0.7989, test_f1: 0.6341
 epoch: 80, train_loss: 0.7538, test_loss: 0.8113, test_f1: 0.5907
 epoch: 81, train_loss: 0.7543, test_loss: 0.8035, test_f1: 0.6392
 epoch: 82, train_loss: 0.7445, test_loss: 0.8263, test_f1: 0.6519
 epoch: 83, train_loss: 0.7418, test_loss: 0.7837, test_f1: 0.5953
 epoch: 84, train_loss: 0.7476, test_loss: 0.8760, test_f1: 0.5959
 epoch: 85, train_loss: 0.7503, test_loss: 0.8442, test_f1: 0.6006
 epoch: 86, train_loss: 0.7546, test_loss: 0.8467, test_f1: 0.6360
 epoch: 87, train_loss: 0.7489, test_loss: 0.8378, test_f1: 0.6283
 epoch: 88, train_loss: 0.7413, test_loss: 0.8853, test_f1: 0.5682
 epoch: 89, train_loss: 0.7426, test_loss: 0.8060, test_f1: 0.6311
 epoch: 90, train_loss: 0.7324, test_loss: 0.8237, test_f1: 0.6696
 epoch: 91, train_loss: 0.7560, test_loss: 0.7748, test_f1: 0.5958
 epoch: 92, train_loss: 0.7462, test_loss: 0.8246, test_f1: 0.6482
 epoch: 93, train_loss: 0.7441, test_loss: 0.8503, test_f1: 0.6206
 epoch: 94, train_loss: 0.7347, test_loss: 0.8385, test_f1: 0.6489
 epoch: 95, train_loss: 0.7476, test_loss: 0.7475, test_f1: 0.6280
 epoch: 96, train_loss: 0.7629, test_loss: 0.8703, test_f1: 0.6276
 epoch: 97, train_loss: 0.7445, test_loss: 0.8263, test_f1: 0.6421
 epoch: 98, train_loss: 0.7405, test_loss: 0.8328, test_f1: 0.6000
 epoch: 99, train_loss: 0.7370, test_loss: 0.8213, test_f1: 0.6486
##################ITERATION #6 ****************************************
 epoch: 0, train_loss: 1.1212, test_loss: 1.0905, test_f1: 0.3374
 epoch: 1, train_loss: 1.0476, test_loss: 1.1121, test_f1: 0.4168
 epoch: 2, train_loss: 1.0269, test_loss: 1.0691, test_f1: 0.4461
 epoch: 3, train_loss: 0.9989, test_loss: 1.0704, test_f1: 0.4878
 epoch: 4, train_loss: 0.9973, test_loss: 1.1254, test_f1: 0.3908
 epoch: 5, train_loss: 0.9831, test_loss: 1.0050, test_f1: 0.4589
 epoch: 6, train_loss: 0.9637, test_loss: 1.0236, test_f1: 0.4601
 epoch: 7, train_loss: 0.9709, test_loss: 1.0191, test_f1: 0.4928
 epoch: 8, train_loss: 0.9585, test_loss: 1.0129, test_f1: 0.4922
 epoch: 9, train_loss: 0.9560, test_loss: 1.0323, test_f1: 0.4193
 epoch: 10, train_loss: 0.9674, test_loss: 1.0596, test_f1: 0.4811
 epoch: 11, train_loss: 0.9546, test_loss: 1.0398, test_f1: 0.4398
 epoch: 12, train_loss: 0.9386, test_loss: 0.9985, test_f1: 0.5003
 epoch: 13, train_loss: 0.9453, test_loss: 1.0277, test_f1: 0.4761
 epoch: 14, train_loss: 0.9452, test_loss: 1.0507, test_f1: 0.5086
 epoch: 15, train_loss: 0.9459, test_loss: 1.0784, test_f1: 0.4716
 epoch: 16, train_loss: 0.9224, test_loss: 1.1112, test_f1: 0.4732
 epoch: 17, train_loss: 0.9284, test_loss: 0.9876, test_f1: 0.5584
 epoch: 18, train_loss: 0.9292, test_loss: 1.0214, test_f1: 0.4908
 epoch: 19, train_loss: 0.9263, test_loss: 0.9504, test_f1: 0.4842
 epoch: 20, train_loss: 0.9229, test_loss: 0.9507, test_f1: 0.5555
 epoch: 21, train_loss: 0.9185, test_loss: 0.9493, test_f1: 0.5975
 epoch: 22, train_loss: 0.9193, test_loss: 0.9644, test_f1: 0.5716
 epoch: 23, train_loss: 0.9075, test_loss: 0.9545, test_f1: 0.5628
 epoch: 24, train_loss: 0.9151, test_loss: 0.9791, test_f1: 0.5726
 epoch: 25, train_loss: 0.9070, test_loss: 0.9676, test_f1: 0.4957
 epoch: 26, train_loss: 0.9008, test_loss: 0.9332, test_f1: 0.5205
 epoch: 27, train_loss: 0.8930, test_loss: 0.9143, test_f1: 0.5642
 epoch: 28, train_loss: 0.8939, test_loss: 0.8967, test_f1: 0.5409
 epoch: 29, train_loss: 0.8924, test_loss: 0.9198, test_f1: 0.5130
 epoch: 30, train_loss: 0.8864, test_loss: 0.8936, test_f1: 0.5872
 epoch: 31, train_loss: 0.8851, test_loss: 0.9774, test_f1: 0.5301
 epoch: 32, train_loss: 0.8903, test_loss: 0.8773, test_f1: 0.5203
 epoch: 33, train_loss: 0.8992, test_loss: 0.9559, test_f1: 0.5703
 epoch: 34, train_loss: 0.8823, test_loss: 0.9116, test_f1: 0.5885
 epoch: 35, train_loss: 0.9044, test_loss: 0.9366, test_f1: 0.4928
 epoch: 36, train_loss: 0.8589, test_loss: 0.9098, test_f1: 0.5322
 epoch: 37, train_loss: 0.8647, test_loss: 0.9183, test_f1: 0.5274
 epoch: 38, train_loss: 0.8622, test_loss: 0.9142, test_f1: 0.5276
 epoch: 39, train_loss: 0.8603, test_loss: 0.9929, test_f1: 0.4823
 epoch: 40, train_loss: 0.8689, test_loss: 0.9003, test_f1: 0.5558
 epoch: 41, train_loss: 0.8588, test_loss: 0.8926, test_f1: 0.5454
 epoch: 42, train_loss: 0.8667, test_loss: 0.8877, test_f1: 0.5754
 epoch: 43, train_loss: 0.8613, test_loss: 0.9004, test_f1: 0.5472
 epoch: 44, train_loss: 0.8523, test_loss: 0.9073, test_f1: 0.5864
 epoch: 45, train_loss: 0.8472, test_loss: 0.9147, test_f1: 0.5590
 epoch: 46, train_loss: 0.8613, test_loss: 0.9154, test_f1: 0.5736
 epoch: 47, train_loss: 0.8511, test_loss: 0.9782, test_f1: 0.5197
 epoch: 48, train_loss: 0.8426, test_loss: 0.9276, test_f1: 0.5376
 epoch: 49, train_loss: 0.8519, test_loss: 0.9008, test_f1: 0.5670
 epoch: 50, train_loss: 0.8591, test_loss: 0.9700, test_f1: 0.5166
 epoch: 51, train_loss: 0.8412, test_loss: 0.9228, test_f1: 0.5745
 epoch: 52, train_loss: 0.8296, test_loss: 0.9421, test_f1: 0.5606
 epoch: 53, train_loss: 0.8245, test_loss: 0.9035, test_f1: 0.5661
 epoch: 54, train_loss: 0.8219, test_loss: 0.9219, test_f1: 0.5510
 epoch: 55, train_loss: 0.8256, test_loss: 0.9631, test_f1: 0.5366
 epoch: 56, train_loss: 0.8079, test_loss: 0.9118, test_f1: 0.5352
 epoch: 57, train_loss: 0.8094, test_loss: 0.9414, test_f1: 0.5877
 epoch: 58, train_loss: 0.8186, test_loss: 0.9323, test_f1: 0.5840
 epoch: 59, train_loss: 0.8069, test_loss: 0.8901, test_f1: 0.5586
 epoch: 60, train_loss: 0.8126, test_loss: 0.9466, test_f1: 0.5518
 epoch: 61, train_loss: 0.8048, test_loss: 0.9217, test_f1: 0.5619
 epoch: 62, train_loss: 0.8050, test_loss: 0.8934, test_f1: 0.5924
 epoch: 63, train_loss: 0.7997, test_loss: 0.8952, test_f1: 0.5752
 epoch: 64, train_loss: 0.8036, test_loss: 0.8745, test_f1: 0.5901
 epoch: 65, train_loss: 0.7984, test_loss: 0.8905, test_f1: 0.6010
 epoch: 66, train_loss: 0.8047, test_loss: 0.8904, test_f1: 0.5499
 epoch: 67, train_loss: 0.8011, test_loss: 0.8903, test_f1: 0.5759
 epoch: 68, train_loss: 0.8049, test_loss: 0.8858, test_f1: 0.5438
 epoch: 69, train_loss: 0.7958, test_loss: 0.9357, test_f1: 0.5673
 epoch: 70, train_loss: 0.7924, test_loss: 0.8641, test_f1: 0.5523
 epoch: 71, train_loss: 0.7860, test_loss: 0.8624, test_f1: 0.5631
 epoch: 72, train_loss: 0.7757, test_loss: 0.8863, test_f1: 0.5981
 epoch: 73, train_loss: 0.8000, test_loss: 0.8639, test_f1: 0.5820
 epoch: 74, train_loss: 0.7964, test_loss: 0.8730, test_f1: 0.5622
 epoch: 75, train_loss: 0.7836, test_loss: 0.8824, test_f1: 0.6230
 epoch: 76, train_loss: 0.7864, test_loss: 0.8553, test_f1: 0.5789
 epoch: 77, train_loss: 0.7816, test_loss: 0.8528, test_f1: 0.5882
 epoch: 78, train_loss: 0.7854, test_loss: 0.8979, test_f1: 0.5747
 epoch: 79, train_loss: 0.7835, test_loss: 0.8826, test_f1: 0.5956
 epoch: 80, train_loss: 0.7762, test_loss: 0.9063, test_f1: 0.5982
 epoch: 81, train_loss: 0.7929, test_loss: 0.8815, test_f1: 0.5596
 epoch: 82, train_loss: 0.7865, test_loss: 0.8797, test_f1: 0.5930
 epoch: 83, train_loss: 0.7859, test_loss: 0.9050, test_f1: 0.5704
 epoch: 84, train_loss: 0.7729, test_loss: 0.8869, test_f1: 0.5684
 epoch: 85, train_loss: 0.7645, test_loss: 0.9109, test_f1: 0.5746
 epoch: 86, train_loss: 0.7742, test_loss: 0.8907, test_f1: 0.5794
 epoch: 87, train_loss: 0.7736, test_loss: 0.8875, test_f1: 0.5500
 epoch: 88, train_loss: 0.7729, test_loss: 0.8781, test_f1: 0.5870
 epoch: 89, train_loss: 0.8070, test_loss: 0.8569, test_f1: 0.5383
 epoch: 90, train_loss: 0.7757, test_loss: 0.8573, test_f1: 0.5856
 epoch: 91, train_loss: 0.7892, test_loss: 0.8477, test_f1: 0.6089
 epoch: 92, train_loss: 0.7828, test_loss: 0.8816, test_f1: 0.6011
 epoch: 93, train_loss: 0.7660, test_loss: 0.9005, test_f1: 0.5823
 epoch: 94, train_loss: 0.7659, test_loss: 0.8659, test_f1: 0.6140
 epoch: 95, train_loss: 0.7858, test_loss: 0.8295, test_f1: 0.5752
 epoch: 96, train_loss: 0.7642, test_loss: 0.9015, test_f1: 0.5631
 epoch: 97, train_loss: 0.7730, test_loss: 0.9081, test_f1: 0.5917
 epoch: 98, train_loss: 0.7865, test_loss: 0.8687, test_f1: 0.5724
 epoch: 99, train_loss: 0.7730, test_loss: 0.8737, test_f1: 0.6038
##################ITERATION #7 ****************************************
 epoch: 0, train_loss: 1.1112, test_loss: 1.0675, test_f1: 0.4191
 epoch: 1, train_loss: 1.0115, test_loss: 1.0178, test_f1: 0.5079
 epoch: 2, train_loss: 1.0007, test_loss: 1.0137, test_f1: 0.4282
 epoch: 3, train_loss: 1.0018, test_loss: 1.0631, test_f1: 0.4495
 epoch: 4, train_loss: 0.9872, test_loss: 1.0218, test_f1: 0.4806
 epoch: 5, train_loss: 0.9993, test_loss: 1.1052, test_f1: 0.4407
 epoch: 6, train_loss: 0.9817, test_loss: 1.0050, test_f1: 0.4808
 epoch: 7, train_loss: 0.9706, test_loss: 1.0042, test_f1: 0.4611
 epoch: 8, train_loss: 0.9609, test_loss: 1.0196, test_f1: 0.5202
 epoch: 9, train_loss: 0.9533, test_loss: 0.9844, test_f1: 0.5159
 epoch: 10, train_loss: 0.9535, test_loss: 0.9020, test_f1: 0.5193
 epoch: 11, train_loss: 0.9449, test_loss: 0.9391, test_f1: 0.5122
 epoch: 12, train_loss: 0.9304, test_loss: 0.9480, test_f1: 0.5206
 epoch: 13, train_loss: 0.9277, test_loss: 0.9297, test_f1: 0.5029
 epoch: 14, train_loss: 0.9170, test_loss: 0.9518, test_f1: 0.5400
 epoch: 15, train_loss: 0.9148, test_loss: 0.9951, test_f1: 0.5102
 epoch: 16, train_loss: 0.9175, test_loss: 0.9188, test_f1: 0.5592
 epoch: 17, train_loss: 0.9053, test_loss: 0.9479, test_f1: 0.5495
 epoch: 18, train_loss: 0.9081, test_loss: 0.9616, test_f1: 0.4981
 epoch: 19, train_loss: 0.9099, test_loss: 0.9400, test_f1: 0.5338
 epoch: 20, train_loss: 0.9154, test_loss: 0.9813, test_f1: 0.5242
 epoch: 21, train_loss: 0.9045, test_loss: 0.9727, test_f1: 0.4978
 epoch: 22, train_loss: 0.8972, test_loss: 0.9463, test_f1: 0.5263
 epoch: 23, train_loss: 0.9024, test_loss: 0.9758, test_f1: 0.4830
 epoch: 24, train_loss: 0.9018, test_loss: 0.9379, test_f1: 0.5227
 epoch: 25, train_loss: 0.8855, test_loss: 1.0009, test_f1: 0.5202
 epoch: 26, train_loss: 0.8831, test_loss: 0.9035, test_f1: 0.5347
 epoch: 27, train_loss: 0.8958, test_loss: 0.9239, test_f1: 0.4973
 epoch: 28, train_loss: 0.9052, test_loss: 0.8761, test_f1: 0.5224
 epoch: 29, train_loss: 0.8980, test_loss: 0.9342, test_f1: 0.5225
 epoch: 30, train_loss: 0.8895, test_loss: 0.9479, test_f1: 0.5008
 epoch: 31, train_loss: 0.8782, test_loss: 0.8996, test_f1: 0.5194
 epoch: 32, train_loss: 0.8684, test_loss: 0.9188, test_f1: 0.5205
 epoch: 33, train_loss: 0.8782, test_loss: 0.9246, test_f1: 0.4999
 epoch: 34, train_loss: 0.8724, test_loss: 0.9422, test_f1: 0.5193
 epoch: 35, train_loss: 0.8643, test_loss: 0.8870, test_f1: 0.5868
 epoch: 36, train_loss: 0.8633, test_loss: 0.8892, test_f1: 0.5425
 epoch: 37, train_loss: 0.8583, test_loss: 0.9358, test_f1: 0.5156
 epoch: 38, train_loss: 0.8592, test_loss: 0.9554, test_f1: 0.5271
 epoch: 39, train_loss: 0.8766, test_loss: 0.8626, test_f1: 0.5410
 epoch: 40, train_loss: 0.8812, test_loss: 0.9134, test_f1: 0.5114
 epoch: 41, train_loss: 0.8614, test_loss: 0.8810, test_f1: 0.5471
 epoch: 42, train_loss: 0.8762, test_loss: 0.9175, test_f1: 0.5786
 epoch: 43, train_loss: 0.8604, test_loss: 0.8994, test_f1: 0.5579
 epoch: 44, train_loss: 0.8468, test_loss: 0.8752, test_f1: 0.5513
 epoch: 45, train_loss: 0.8404, test_loss: 0.8899, test_f1: 0.5551
 epoch: 46, train_loss: 0.8620, test_loss: 0.8089, test_f1: 0.5950
 epoch: 47, train_loss: 0.8694, test_loss: 0.8637, test_f1: 0.5407
 epoch: 48, train_loss: 0.8342, test_loss: 0.8707, test_f1: 0.5558
 epoch: 49, train_loss: 0.8419, test_loss: 0.9447, test_f1: 0.5161
 epoch: 50, train_loss: 0.8200, test_loss: 0.8356, test_f1: 0.5715
 epoch: 51, train_loss: 0.8195, test_loss: 0.8137, test_f1: 0.5672
 epoch: 52, train_loss: 0.8198, test_loss: 0.8560, test_f1: 0.5733
 epoch: 53, train_loss: 0.8058, test_loss: 0.8552, test_f1: 0.5559
 epoch: 54, train_loss: 0.8140, test_loss: 0.8327, test_f1: 0.6162
 epoch: 55, train_loss: 0.8016, test_loss: 0.8317, test_f1: 0.6232
 epoch: 56, train_loss: 0.8028, test_loss: 0.8080, test_f1: 0.6290
 epoch: 57, train_loss: 0.7983, test_loss: 0.8486, test_f1: 0.5756
 epoch: 58, train_loss: 0.7970, test_loss: 0.8379, test_f1: 0.5748
 epoch: 59, train_loss: 0.7920, test_loss: 0.8424, test_f1: 0.5941
 epoch: 60, train_loss: 0.8017, test_loss: 0.8346, test_f1: 0.5778
 epoch: 61, train_loss: 0.8051, test_loss: 0.8721, test_f1: 0.6268
 epoch: 62, train_loss: 0.7852, test_loss: 0.8781, test_f1: 0.5719
 epoch: 63, train_loss: 0.7886, test_loss: 0.8534, test_f1: 0.5762
 epoch: 64, train_loss: 0.7886, test_loss: 0.8737, test_f1: 0.5977
 epoch: 65, train_loss: 0.7915, test_loss: 0.8263, test_f1: 0.6007
 epoch: 66, train_loss: 0.7918, test_loss: 0.8286, test_f1: 0.5968
 epoch: 67, train_loss: 0.7849, test_loss: 0.8345, test_f1: 0.5716
 epoch: 68, train_loss: 0.7942, test_loss: 0.8269, test_f1: 0.5743
 epoch: 69, train_loss: 0.7700, test_loss: 0.8230, test_f1: 0.5875
 epoch: 70, train_loss: 0.7814, test_loss: 0.8271, test_f1: 0.5781
 epoch: 71, train_loss: 0.7728, test_loss: 0.8313, test_f1: 0.5721
 epoch: 72, train_loss: 0.7672, test_loss: 0.8217, test_f1: 0.5898
 epoch: 73, train_loss: 0.8277, test_loss: 0.8422, test_f1: 0.5463
 epoch: 74, train_loss: 0.8198, test_loss: 0.8308, test_f1: 0.5535
 epoch: 75, train_loss: 0.8163, test_loss: 0.8278, test_f1: 0.5414
 epoch: 76, train_loss: 0.7918, test_loss: 0.8522, test_f1: 0.5683
 epoch: 77, train_loss: 0.7826, test_loss: 0.8341, test_f1: 0.5680
 epoch: 78, train_loss: 0.7692, test_loss: 0.8262, test_f1: 0.5665
 epoch: 79, train_loss: 0.7949, test_loss: 0.8422, test_f1: 0.6083
 epoch: 80, train_loss: 0.7800, test_loss: 0.8571, test_f1: 0.5880
 epoch: 81, train_loss: 0.7793, test_loss: 0.8273, test_f1: 0.5935
 epoch: 82, train_loss: 0.7666, test_loss: 0.8408, test_f1: 0.5772
 epoch: 83, train_loss: 0.7752, test_loss: 0.7997, test_f1: 0.6154
 epoch: 84, train_loss: 0.7637, test_loss: 0.8531, test_f1: 0.5740
 epoch: 85, train_loss: 0.7592, test_loss: 0.8564, test_f1: 0.6096
 epoch: 86, train_loss: 0.7541, test_loss: 0.8061, test_f1: 0.5891
 epoch: 87, train_loss: 0.7718, test_loss: 0.8518, test_f1: 0.5867
 epoch: 88, train_loss: 0.7729, test_loss: 0.8235, test_f1: 0.5945
 epoch: 89, train_loss: 0.7663, test_loss: 0.7898, test_f1: 0.5856
 epoch: 90, train_loss: 0.7758, test_loss: 0.7957, test_f1: 0.5927
 epoch: 91, train_loss: 0.7559, test_loss: 0.8912, test_f1: 0.5407
 epoch: 92, train_loss: 0.7680, test_loss: 0.8304, test_f1: 0.5822
 epoch: 93, train_loss: 0.7639, test_loss: 0.8218, test_f1: 0.5837
 epoch: 94, train_loss: 0.7642, test_loss: 0.8849, test_f1: 0.5636
 epoch: 95, train_loss: 0.7523, test_loss: 0.8310, test_f1: 0.5818
 epoch: 96, train_loss: 0.7446, test_loss: 0.8137, test_f1: 0.6075
 epoch: 97, train_loss: 0.7515, test_loss: 0.8264, test_f1: 0.5821
 epoch: 98, train_loss: 0.7488, test_loss: 0.8545, test_f1: 0.5720
 epoch: 99, train_loss: 0.7492, test_loss: 0.8328, test_f1: 0.5691
##################ITERATION #8 ****************************************
 epoch: 0, train_loss: 1.1042, test_loss: 1.0006, test_f1: 0.4522
 epoch: 1, train_loss: 0.9889, test_loss: 0.9462, test_f1: 0.4631
 epoch: 2, train_loss: 0.9814, test_loss: 1.1141, test_f1: 0.4987
 epoch: 3, train_loss: 0.9606, test_loss: 0.9888, test_f1: 0.4880
 epoch: 4, train_loss: 0.9561, test_loss: 1.0430, test_f1: 0.4769
 epoch: 5, train_loss: 0.9421, test_loss: 0.9823, test_f1: 0.5147
 epoch: 6, train_loss: 0.9223, test_loss: 0.9635, test_f1: 0.5203
 epoch: 7, train_loss: 0.9414, test_loss: 1.0549, test_f1: 0.4702
 epoch: 8, train_loss: 0.9401, test_loss: 0.8974, test_f1: 0.4958
 epoch: 9, train_loss: 0.9254, test_loss: 1.0243, test_f1: 0.4883
 epoch: 10, train_loss: 0.9096, test_loss: 0.9147, test_f1: 0.5373
 epoch: 11, train_loss: 0.9025, test_loss: 0.8962, test_f1: 0.5021
 epoch: 12, train_loss: 0.9138, test_loss: 0.8902, test_f1: 0.5285
 epoch: 13, train_loss: 0.9050, test_loss: 0.9270, test_f1: 0.5102
 epoch: 14, train_loss: 0.9203, test_loss: 0.9014, test_f1: 0.5554
 epoch: 15, train_loss: 0.9082, test_loss: 0.9074, test_f1: 0.5381
 epoch: 16, train_loss: 0.8890, test_loss: 0.9102, test_f1: 0.5321
 epoch: 17, train_loss: 0.8910, test_loss: 0.8649, test_f1: 0.5389
 epoch: 18, train_loss: 0.8951, test_loss: 0.8758, test_f1: 0.5523
 epoch: 19, train_loss: 0.8868, test_loss: 0.9345, test_f1: 0.4772
 epoch: 20, train_loss: 0.8754, test_loss: 0.9484, test_f1: 0.5131
 epoch: 21, train_loss: 0.8986, test_loss: 0.9014, test_f1: 0.5171
 epoch: 22, train_loss: 0.9006, test_loss: 0.9168, test_f1: 0.5282
 epoch: 23, train_loss: 0.8697, test_loss: 0.8702, test_f1: 0.5275
 epoch: 24, train_loss: 0.8823, test_loss: 0.9065, test_f1: 0.5174
 epoch: 25, train_loss: 0.8793, test_loss: 0.8956, test_f1: 0.5273
 epoch: 26, train_loss: 0.8789, test_loss: 0.8907, test_f1: 0.5446
 epoch: 27, train_loss: 0.8585, test_loss: 0.8997, test_f1: 0.5341
 epoch: 28, train_loss: 0.8668, test_loss: 0.8438, test_f1: 0.5390
 epoch: 29, train_loss: 0.8762, test_loss: 0.8870, test_f1: 0.5322
 epoch: 30, train_loss: 0.8605, test_loss: 0.8698, test_f1: 0.5415
 epoch: 31, train_loss: 0.8527, test_loss: 0.8940, test_f1: 0.5169
 epoch: 32, train_loss: 0.8541, test_loss: 0.9674, test_f1: 0.5157
 epoch: 33, train_loss: 0.8541, test_loss: 0.8481, test_f1: 0.5331
 epoch: 34, train_loss: 0.8469, test_loss: 0.9106, test_f1: 0.5257
 epoch: 35, train_loss: 0.8428, test_loss: 0.8871, test_f1: 0.5363
 epoch: 36, train_loss: 0.8540, test_loss: 0.8422, test_f1: 0.5311
 epoch: 37, train_loss: 0.8448, test_loss: 0.8802, test_f1: 0.5376
 epoch: 38, train_loss: 0.8489, test_loss: 0.9086, test_f1: 0.5772
 epoch: 39, train_loss: 0.8506, test_loss: 0.8514, test_f1: 0.5641
 epoch: 40, train_loss: 0.8857, test_loss: 0.9698, test_f1: 0.5016
 epoch: 41, train_loss: 0.8755, test_loss: 0.8743, test_f1: 0.5321
 epoch: 42, train_loss: 0.8704, test_loss: 0.8603, test_f1: 0.5564
 epoch: 43, train_loss: 0.8440, test_loss: 0.8493, test_f1: 0.5334
 epoch: 44, train_loss: 0.8352, test_loss: 4.2207, test_f1: 0.3771
 epoch: 45, train_loss: 0.8389, test_loss: 0.8874, test_f1: 0.6003
 epoch: 46, train_loss: 0.8507, test_loss: 0.8624, test_f1: 0.5318
 epoch: 47, train_loss: 0.8345, test_loss: 0.8848, test_f1: 0.5332
 epoch: 48, train_loss: 0.8392, test_loss: 0.8834, test_f1: 0.5335
 epoch: 49, train_loss: 0.8412, test_loss: 0.9376, test_f1: 0.5762
 epoch: 50, train_loss: 0.8471, test_loss: 0.8826, test_f1: 0.5424
 epoch: 51, train_loss: 0.8177, test_loss: 0.8719, test_f1: 0.5668
 epoch: 52, train_loss: 0.8080, test_loss: 0.8299, test_f1: 0.5719
 epoch: 53, train_loss: 0.7960, test_loss: 0.8330, test_f1: 0.6064
 epoch: 54, train_loss: 0.8000, test_loss: 0.8445, test_f1: 0.5950
 epoch: 55, train_loss: 0.7996, test_loss: 0.8409, test_f1: 0.6222
 epoch: 56, train_loss: 0.7966, test_loss: 0.8477, test_f1: 0.5716
 epoch: 57, train_loss: 0.7879, test_loss: 0.8528, test_f1: 0.5777
 epoch: 58, train_loss: 0.7861, test_loss: 0.8891, test_f1: 0.5595
 epoch: 59, train_loss: 0.7952, test_loss: 0.8684, test_f1: 0.5762
 epoch: 60, train_loss: 0.7849, test_loss: 0.8493, test_f1: 0.5958
 epoch: 61, train_loss: 0.8036, test_loss: 0.8718, test_f1: 0.5944
 epoch: 62, train_loss: 0.7984, test_loss: 0.8629, test_f1: 0.5844
 epoch: 63, train_loss: 0.7777, test_loss: 0.8429, test_f1: 0.5745
 epoch: 64, train_loss: 0.7753, test_loss: 0.8450, test_f1: 0.6035
 epoch: 65, train_loss: 0.7817, test_loss: 0.8435, test_f1: 0.5947
 epoch: 66, train_loss: 0.7639, test_loss: 0.8504, test_f1: 0.6209
 epoch: 67, train_loss: 0.7668, test_loss: 0.8674, test_f1: 0.6010
 epoch: 68, train_loss: 0.7721, test_loss: 0.8496, test_f1: 0.6121
 epoch: 69, train_loss: 0.7836, test_loss: 0.8952, test_f1: 0.5888
 epoch: 70, train_loss: 0.7823, test_loss: 0.9476, test_f1: 0.5452
 epoch: 71, train_loss: 0.7841, test_loss: 0.8228, test_f1: 0.6161
 epoch: 72, train_loss: 0.7909, test_loss: 0.8371, test_f1: 0.6110
 epoch: 73, train_loss: 0.7677, test_loss: 0.8241, test_f1: 0.6075
 epoch: 74, train_loss: 0.7768, test_loss: 0.8163, test_f1: 0.6267
 epoch: 75, train_loss: 0.7744, test_loss: 0.8279, test_f1: 0.6006
 epoch: 76, train_loss: 0.7563, test_loss: 0.8210, test_f1: 0.5930
 epoch: 77, train_loss: 0.7811, test_loss: 0.8306, test_f1: 0.5932
 epoch: 78, train_loss: 0.7648, test_loss: 0.8154, test_f1: 0.6108
 epoch: 79, train_loss: 0.7632, test_loss: 0.8342, test_f1: 0.6070
 epoch: 80, train_loss: 0.7684, test_loss: 0.8311, test_f1: 0.6036
 epoch: 81, train_loss: 0.7654, test_loss: 0.8356, test_f1: 0.6188
 epoch: 82, train_loss: 0.7608, test_loss: 0.8370, test_f1: 0.6020
 epoch: 83, train_loss: 0.7542, test_loss: 0.8247, test_f1: 0.6009
 epoch: 84, train_loss: 0.7573, test_loss: 0.8269, test_f1: 0.6305
 epoch: 85, train_loss: 0.7495, test_loss: 0.8040, test_f1: 0.6369
 epoch: 86, train_loss: 0.7643, test_loss: 0.8107, test_f1: 0.6202
 epoch: 87, train_loss: 0.7433, test_loss: 0.8068, test_f1: 0.6094
 epoch: 88, train_loss: 0.7746, test_loss: 0.8030, test_f1: 0.6083
 epoch: 89, train_loss: 0.7573, test_loss: 0.8079, test_f1: 0.6148
 epoch: 90, train_loss: 0.7642, test_loss: 0.8002, test_f1: 0.6046
 epoch: 91, train_loss: 0.7464, test_loss: 0.8090, test_f1: 0.6165
 epoch: 92, train_loss: 0.7287, test_loss: 0.8120, test_f1: 0.6025
 epoch: 93, train_loss: 0.7584, test_loss: 0.8210, test_f1: 0.6083
 epoch: 94, train_loss: 0.7541, test_loss: 0.8130, test_f1: 0.6254
 epoch: 95, train_loss: 0.7492, test_loss: 0.8064, test_f1: 0.6305
 epoch: 96, train_loss: 0.7596, test_loss: 0.7924, test_f1: 0.5979
 epoch: 97, train_loss: 0.7458, test_loss: 0.7887, test_f1: 0.6367
 epoch: 98, train_loss: 0.7567, test_loss: 0.7936, test_f1: 0.6111
 epoch: 99, train_loss: 0.7485, test_loss: 0.7973, test_f1: 0.6191
##################ITERATION #9 ****************************************
 epoch: 0, train_loss: 1.1252, test_loss: 1.0704, test_f1: 0.5068
 epoch: 1, train_loss: 1.0285, test_loss: 1.0327, test_f1: 0.4686
 epoch: 2, train_loss: 0.9964, test_loss: 1.0464, test_f1: 0.5363
 epoch: 3, train_loss: 0.9834, test_loss: 1.2037, test_f1: 0.4394
 epoch: 4, train_loss: 1.0010, test_loss: 1.0341, test_f1: 0.4762
 epoch: 5, train_loss: 0.9863, test_loss: 1.0554, test_f1: 0.4400
 epoch: 6, train_loss: 0.9621, test_loss: 1.0148, test_f1: 0.4947
 epoch: 7, train_loss: 0.9602, test_loss: 1.0057, test_f1: 0.5284
 epoch: 8, train_loss: 0.9537, test_loss: 0.9866, test_f1: 0.4948
 epoch: 9, train_loss: 0.9827, test_loss: 1.0271, test_f1: 0.4509
 epoch: 10, train_loss: 0.9785, test_loss: 0.9786, test_f1: 0.5085
 epoch: 11, train_loss: 0.9489, test_loss: 1.0222, test_f1: 0.4742
 epoch: 12, train_loss: 0.9397, test_loss: 0.9557, test_f1: 0.5043
 epoch: 13, train_loss: 0.9214, test_loss: 0.9871, test_f1: 0.4930
 epoch: 14, train_loss: 0.9223, test_loss: 0.9911, test_f1: 0.5137
 epoch: 15, train_loss: 0.9179, test_loss: 0.9752, test_f1: 0.5109
 epoch: 16, train_loss: 0.9143, test_loss: 0.9344, test_f1: 0.5185
 epoch: 17, train_loss: 0.9047, test_loss: 0.9247, test_f1: 0.5111
 epoch: 18, train_loss: 0.9218, test_loss: 0.9391, test_f1: 0.5083
 epoch: 19, train_loss: 0.8918, test_loss: 0.9127, test_f1: 0.5660
 epoch: 20, train_loss: 0.8824, test_loss: 0.8871, test_f1: 0.5596
 epoch: 21, train_loss: 0.9000, test_loss: 0.9146, test_f1: 0.5648
 epoch: 22, train_loss: 0.8851, test_loss: 0.9169, test_f1: 0.5437
 epoch: 23, train_loss: 0.8829, test_loss: 0.9037, test_f1: 0.5371
 epoch: 24, train_loss: 0.8892, test_loss: 0.8804, test_f1: 0.5650
 epoch: 25, train_loss: 0.8765, test_loss: 0.8903, test_f1: 0.5345
 epoch: 26, train_loss: 0.8786, test_loss: 0.8824, test_f1: 0.5599
 epoch: 27, train_loss: 0.8814, test_loss: 0.8822, test_f1: 0.5308
 epoch: 28, train_loss: 0.8775, test_loss: 0.8677, test_f1: 0.5382
 epoch: 29, train_loss: 0.8841, test_loss: 0.9625, test_f1: 0.5148
 epoch: 30, train_loss: 0.8757, test_loss: 0.8994, test_f1: 0.5198
 epoch: 31, train_loss: 0.8704, test_loss: 0.8870, test_f1: 0.5503
 epoch: 32, train_loss: 0.8664, test_loss: 0.8850, test_f1: 0.5525
 epoch: 33, train_loss: 0.8793, test_loss: 0.9056, test_f1: 0.5410
 epoch: 34, train_loss: 0.8644, test_loss: 0.8618, test_f1: 0.5669
 epoch: 35, train_loss: 0.8780, test_loss: 0.8745, test_f1: 0.5792
 epoch: 36, train_loss: 0.8796, test_loss: 0.8917, test_f1: 0.5631
 epoch: 37, train_loss: 0.8437, test_loss: 0.8848, test_f1: 0.5305
 epoch: 38, train_loss: 0.8431, test_loss: 0.8946, test_f1: 0.5534
 epoch: 39, train_loss: 0.8575, test_loss: 0.8958, test_f1: 0.5335
 epoch: 40, train_loss: 0.8532, test_loss: 0.8850, test_f1: 0.5626
 epoch: 41, train_loss: 0.8522, test_loss: 0.8493, test_f1: 0.5356
 epoch: 42, train_loss: 0.8474, test_loss: 0.8785, test_f1: 0.5787
 epoch: 43, train_loss: 0.8434, test_loss: 0.8645, test_f1: 0.5656
 epoch: 44, train_loss: 0.8555, test_loss: 0.9079, test_f1: 0.5846
 epoch: 45, train_loss: 0.8525, test_loss: 0.8981, test_f1: 0.5613
 epoch: 46, train_loss: 0.8499, test_loss: 0.9299, test_f1: 0.5393
 epoch: 47, train_loss: 0.8278, test_loss: 0.8882, test_f1: 0.5706
 epoch: 48, train_loss: 0.8435, test_loss: 0.8934, test_f1: 0.5596
 epoch: 49, train_loss: 0.8339, test_loss: 0.8565, test_f1: 0.5782
 epoch: 50, train_loss: 0.8288, test_loss: 0.8999, test_f1: 0.5654
 epoch: 51, train_loss: 0.8254, test_loss: 0.9038, test_f1: 0.5523
 epoch: 52, train_loss: 0.8029, test_loss: 0.8609, test_f1: 0.5609
 epoch: 53, train_loss: 0.8118, test_loss: 0.8750, test_f1: 0.5772
 epoch: 54, train_loss: 0.8056, test_loss: 0.8778, test_f1: 0.5804
 epoch: 55, train_loss: 0.7950, test_loss: 0.8510, test_f1: 0.5960
 epoch: 56, train_loss: 0.8127, test_loss: 0.8638, test_f1: 0.5775
 epoch: 57, train_loss: 0.8143, test_loss: 0.8910, test_f1: 0.5772
 epoch: 58, train_loss: 0.8055, test_loss: 0.8719, test_f1: 0.5593
 epoch: 59, train_loss: 0.8127, test_loss: 0.8782, test_f1: 0.5931
 epoch: 60, train_loss: 0.7887, test_loss: 0.8476, test_f1: 0.5836
 epoch: 61, train_loss: 0.8008, test_loss: 0.8995, test_f1: 0.5840
 epoch: 62, train_loss: 0.8111, test_loss: 0.8704, test_f1: 0.5822
 epoch: 63, train_loss: 0.8078, test_loss: 0.8424, test_f1: 0.6180
 epoch: 64, train_loss: 0.8085, test_loss: 0.8675, test_f1: 0.5776
 epoch: 65, train_loss: 0.7929, test_loss: 0.8755, test_f1: 0.6069
 epoch: 66, train_loss: 0.7849, test_loss: 0.8976, test_f1: 0.5838
 epoch: 67, train_loss: 0.8003, test_loss: 0.8803, test_f1: 0.5629
 epoch: 68, train_loss: 0.7890, test_loss: 0.8748, test_f1: 0.6039
 epoch: 69, train_loss: 0.7881, test_loss: 0.8434, test_f1: 0.5975
 epoch: 70, train_loss: 0.7916, test_loss: 0.8593, test_f1: 0.5772
 epoch: 71, train_loss: 0.7888, test_loss: 0.8520, test_f1: 0.5992
 epoch: 72, train_loss: 0.7847, test_loss: 0.8491, test_f1: 0.5850
 epoch: 73, train_loss: 0.7990, test_loss: 0.8524, test_f1: 0.5800
 epoch: 74, train_loss: 0.7871, test_loss: 0.8542, test_f1: 0.5876
 epoch: 75, train_loss: 0.7845, test_loss: 0.8594, test_f1: 0.5786
 epoch: 76, train_loss: 0.7840, test_loss: 0.8866, test_f1: 0.5932
 epoch: 77, train_loss: 0.7966, test_loss: 0.8589, test_f1: 0.6021
 epoch: 78, train_loss: 0.7852, test_loss: 0.8433, test_f1: 0.6267
 epoch: 79, train_loss: 0.7876, test_loss: 0.8859, test_f1: 0.5859
 epoch: 80, train_loss: 0.7882, test_loss: 0.8985, test_f1: 0.5664
 epoch: 81, train_loss: 0.7817, test_loss: 0.8648, test_f1: 0.6095
 epoch: 82, train_loss: 0.7740, test_loss: 0.8539, test_f1: 0.6003
 epoch: 83, train_loss: 0.7856, test_loss: 0.8998, test_f1: 0.5926
 epoch: 84, train_loss: 0.7955, test_loss: 0.8518, test_f1: 0.5938
 epoch: 85, train_loss: 0.7785, test_loss: 0.8123, test_f1: 0.6062
 epoch: 86, train_loss: 0.7740, test_loss: 0.8485, test_f1: 0.6104
 epoch: 87, train_loss: 0.7785, test_loss: 0.8336, test_f1: 0.6234
 epoch: 88, train_loss: 0.7666, test_loss: 0.8478, test_f1: 0.6089
 epoch: 89, train_loss: 0.7791, test_loss: 0.8648, test_f1: 0.5953
 epoch: 90, train_loss: 0.7787, test_loss: 0.8582, test_f1: 0.5786
 epoch: 91, train_loss: 0.7735, test_loss: 0.8404, test_f1: 0.6167
 epoch: 92, train_loss: 0.7699, test_loss: 0.8450, test_f1: 0.6070
 epoch: 93, train_loss: 0.7594, test_loss: 0.8893, test_f1: 0.5814
 epoch: 94, train_loss: 0.7752, test_loss: 0.8462, test_f1: 0.5923
 epoch: 95, train_loss: 0.7751, test_loss: 0.8630, test_f1: 0.5887
 epoch: 96, train_loss: 0.7688, test_loss: 0.8554, test_f1: 0.6106
 epoch: 97, train_loss: 0.7717, test_loss: 0.8589, test_f1: 0.5973
 epoch: 98, train_loss: 0.7549, test_loss: 0.8286, test_f1: 0.6286
 epoch: 99, train_loss: 0.7645, test_loss: 0.8222, test_f1: 0.5855

Training completed in 2018.45 seconds
Best F1: 0.6698 at epoch 90
Mean F1 across iterations: 0.6439  0.0175
========================FINAL RESULTS================================
FEGIN weighted F1: 0.6698  0.0175
python main.py --data ltspice_examples --representation component_pin_net --model FEGIN --layers 4 --hiddens 16 --batch_size 32 --lr 0.01 --emb_size 250 --epochs 100 --save_appendix component_pin_net_L4_H16_BS32_LR0.01_E250 --no_val
-----



STDERR:
  File "main.py", line 370, in <module>
    main()
  File "main.py", line 254, in main
    dataset = dataset_class(
  File "/home/philip/projects/ltspice_examples_code_repo/Circuit-Completion-Using-GNNs/component_classification_with_link_prediction_head/evaluation/FEGIN/kernel/circuit_datasets.py", line 15, in __init__
    self.data, self.slices = torch.load(self.processed_paths[0])
  File "/home/philip/.local/lib/python3.8/site-packages/torch/serialization.py", line 1040, in load
    warnings.warn(
  File "/usr/lib/python3.8/warnings.py", line 109, in _showwarnmsg
    sw(msg.message, msg.category, msg.filename, msg.lineno,
  File "main.py", line 47, in warn_with_traceback
    traceback.print_stack(file=log)
/home/philip/projects/ltspice_examples_code_repo/Circuit-Completion-Using-GNNs/component_classification_with_link_prediction_head/evaluation/FEGIN/kernel/circuit_datasets.py:15: FutureWarning: You are using `torch.load` with `weights_only=False` (the current default value), which uses the default pickle module implicitly. It is possible to construct malicious pickle data which will execute arbitrary code during unpickling (See https://github.com/pytorch/pytorch/blob/main/SECURITY.md#untrusted-models for more details). In a future release, the default value for `weights_only` will be flipped to `True`. This limits the functions that could be executed during unpickling. Arbitrary objects will no longer be allowed to be loaded via this mode unless they are explicitly allowlisted by the user via `torch.serialization.add_safe_globals`. We recommend you start setting `weights_only=True` for any use case where you don't have full control of the loaded file. Please open an issue on GitHub for any issues related to this experimental feature.
  self.data, self.slices = torch.load(self.processed_paths[0])
