STDOUT:
Results will be saved in /home/philip/projects/ltspice_examples_code_repo/Circuit-Completion-Using-GNNs/component_classification_with_link_prediction_head/evaluation/FEGIN/results/model_FEGIN_dataset_ltspice_demos
Command line input: python main.py --data ltspice_demos --representation component_pin_net --model FEGIN --layers 6 --hiddens 128 --batch_size 32 --lr 0.001 --emb_size 128 --epochs 100 --save_appendix component_pin_net_L6_H128_BS32_LR0.001_E128 --no_val
 is saved.
-----
ltspice_demos - FEGIN
Using 6 layers, 128 hidden units, h = 2
Loading component_pin_net representation dataset
ENTERED
Training FEGIN on component_pin_net representation
Train: 1565, Test: 383
##################ITERATION #0 ****************************************
 epoch: 0, train_loss: 1.1824, test_loss: 1.1242, test_f1: 0.4308
 epoch: 1, train_loss: 1.0011, test_loss: 1.0756, test_f1: 0.4211
 epoch: 2, train_loss: 0.9682, test_loss: 1.0433, test_f1: 0.5139
 epoch: 3, train_loss: 0.9268, test_loss: 1.0316, test_f1: 0.4713
 epoch: 4, train_loss: 0.9061, test_loss: 1.0208, test_f1: 0.5435
 epoch: 5, train_loss: 0.8926, test_loss: 0.9907, test_f1: 0.5535
 epoch: 6, train_loss: 0.8750, test_loss: 1.0746, test_f1: 0.5585
 epoch: 7, train_loss: 0.8416, test_loss: 1.0355, test_f1: 0.5375
 epoch: 8, train_loss: 0.8037, test_loss: 1.0215, test_f1: 0.5993
 epoch: 9, train_loss: 0.8039, test_loss: 1.1718, test_f1: 0.4594
 epoch: 10, train_loss: 0.7766, test_loss: 0.9900, test_f1: 0.5561
 epoch: 11, train_loss: 0.7135, test_loss: 1.1166, test_f1: 0.4642
 epoch: 12, train_loss: 0.7248, test_loss: 1.1601, test_f1: 0.5165
 epoch: 13, train_loss: 0.6958, test_loss: 1.1535, test_f1: 0.5415
 epoch: 14, train_loss: 0.6849, test_loss: 0.9720, test_f1: 0.5626
 epoch: 15, train_loss: 0.6681, test_loss: 1.1137, test_f1: 0.5747
 epoch: 16, train_loss: 0.6505, test_loss: 0.9888, test_f1: 0.6467
 epoch: 17, train_loss: 0.6410, test_loss: 1.0808, test_f1: 0.6192
 epoch: 18, train_loss: 0.5984, test_loss: 1.1521, test_f1: 0.5858
 epoch: 19, train_loss: 0.6246, test_loss: 1.0449, test_f1: 0.6659
 epoch: 20, train_loss: 0.6040, test_loss: 1.5496, test_f1: 0.5575
 epoch: 21, train_loss: 0.6066, test_loss: 1.1444, test_f1: 0.5815
 epoch: 22, train_loss: 0.5323, test_loss: 1.1785, test_f1: 0.5897
 epoch: 23, train_loss: 0.5577, test_loss: 1.2195, test_f1: 0.6360
 epoch: 24, train_loss: 0.5500, test_loss: 1.2724, test_f1: 0.6126
 epoch: 25, train_loss: 0.5640, test_loss: 1.2893, test_f1: 0.5699
 epoch: 26, train_loss: 0.5577, test_loss: 1.3289, test_f1: 0.6456
 epoch: 27, train_loss: 0.4912, test_loss: 1.2721, test_f1: 0.6347
 epoch: 28, train_loss: 0.4924, test_loss: 1.4799, test_f1: 0.5410
 epoch: 29, train_loss: 0.5172, test_loss: 1.3660, test_f1: 0.6034
 epoch: 30, train_loss: 0.4992, test_loss: 1.2759, test_f1: 0.6131
 epoch: 31, train_loss: 0.4699, test_loss: 1.2421, test_f1: 0.6440
 epoch: 32, train_loss: 0.4650, test_loss: 1.2603, test_f1: 0.6470
 epoch: 33, train_loss: 0.4548, test_loss: 1.4833, test_f1: 0.6352
 epoch: 34, train_loss: 0.4744, test_loss: 1.4323, test_f1: 0.6060
 epoch: 35, train_loss: 0.4462, test_loss: 1.3612, test_f1: 0.6329
 epoch: 36, train_loss: 0.4355, test_loss: 1.4326, test_f1: 0.6351
 epoch: 37, train_loss: 0.4664, test_loss: 1.4172, test_f1: 0.6474
 epoch: 38, train_loss: 0.4202, test_loss: 1.5117, test_f1: 0.5938
 epoch: 39, train_loss: 0.4099, test_loss: 1.5183, test_f1: 0.6093
 epoch: 40, train_loss: 0.4243, test_loss: 1.4310, test_f1: 0.6644
 epoch: 41, train_loss: 0.4043, test_loss: 1.6464, test_f1: 0.6045
 epoch: 42, train_loss: 0.3588, test_loss: 1.7133, test_f1: 0.6402
 epoch: 43, train_loss: 0.3833, test_loss: 1.5897, test_f1: 0.6518
 epoch: 44, train_loss: 0.3689, test_loss: 1.8042, test_f1: 0.6281
 epoch: 45, train_loss: 0.3566, test_loss: 1.7668, test_f1: 0.6089
 epoch: 46, train_loss: 0.3471, test_loss: 1.4838, test_f1: 0.6157
 epoch: 47, train_loss: 0.4236, test_loss: 1.3934, test_f1: 0.6433
 epoch: 48, train_loss: 0.3797, test_loss: 1.3542, test_f1: 0.6322
 epoch: 49, train_loss: 0.3627, test_loss: 1.7318, test_f1: 0.6357
 epoch: 50, train_loss: 0.3372, test_loss: 1.5451, test_f1: 0.6511
 epoch: 51, train_loss: 0.2846, test_loss: 1.6570, test_f1: 0.6549
 epoch: 52, train_loss: 0.2637, test_loss: 1.9019, test_f1: 0.6532
 epoch: 53, train_loss: 0.2693, test_loss: 1.8525, test_f1: 0.6645
 epoch: 54, train_loss: 0.2554, test_loss: 2.1454, test_f1: 0.6171
 epoch: 55, train_loss: 0.2424, test_loss: 1.9307, test_f1: 0.6255
 epoch: 56, train_loss: 0.2287, test_loss: 1.9814, test_f1: 0.6325
 epoch: 57, train_loss: 0.2275, test_loss: 2.0336, test_f1: 0.6749
 epoch: 58, train_loss: 0.2239, test_loss: 2.1012, test_f1: 0.6547
 epoch: 59, train_loss: 0.2111, test_loss: 2.2759, test_f1: 0.6644
 epoch: 60, train_loss: 0.1978, test_loss: 2.2008, test_f1: 0.6555
 epoch: 61, train_loss: 0.1932, test_loss: 2.3542, test_f1: 0.6360
 epoch: 62, train_loss: 0.2293, test_loss: 2.3903, test_f1: 0.6316
 epoch: 63, train_loss: 0.2131, test_loss: 2.1771, test_f1: 0.6299
 epoch: 64, train_loss: 0.1967, test_loss: 2.3759, test_f1: 0.6450
 epoch: 65, train_loss: 0.2218, test_loss: 2.5339, test_f1: 0.6224
 epoch: 66, train_loss: 0.2272, test_loss: 2.3952, test_f1: 0.6430
 epoch: 67, train_loss: 0.1759, test_loss: 2.4608, test_f1: 0.6403
 epoch: 68, train_loss: 0.1992, test_loss: 2.3276, test_f1: 0.6539
 epoch: 69, train_loss: 0.1845, test_loss: 2.4240, test_f1: 0.6741
 epoch: 70, train_loss: 0.1853, test_loss: 2.5374, test_f1: 0.6298
 epoch: 71, train_loss: 0.1603, test_loss: 2.4569, test_f1: 0.6516
 epoch: 72, train_loss: 0.1732, test_loss: 2.7229, test_f1: 0.6620
 epoch: 73, train_loss: 0.2189, test_loss: 2.4076, test_f1: 0.6383
 epoch: 74, train_loss: 0.1629, test_loss: 2.6169, test_f1: 0.6126
 epoch: 75, train_loss: 0.1804, test_loss: 2.6813, test_f1: 0.6565
 epoch: 76, train_loss: 0.1924, test_loss: 2.7092, test_f1: 0.6378
 epoch: 77, train_loss: 0.1695, test_loss: 2.6727, test_f1: 0.6226
 epoch: 78, train_loss: 0.1420, test_loss: 2.6974, test_f1: 0.6263
 epoch: 79, train_loss: 0.1498, test_loss: 3.0512, test_f1: 0.6105
 epoch: 80, train_loss: 0.1344, test_loss: 2.7063, test_f1: 0.6433
 epoch: 81, train_loss: 0.1640, test_loss: 2.6691, test_f1: 0.6364
 epoch: 82, train_loss: 0.1594, test_loss: 2.8064, test_f1: 0.6638
 epoch: 83, train_loss: 0.1572, test_loss: 2.8457, test_f1: 0.6271
 epoch: 84, train_loss: 0.1664, test_loss: 2.8951, test_f1: 0.6063
 epoch: 85, train_loss: 0.1360, test_loss: 2.7073, test_f1: 0.6536
 epoch: 86, train_loss: 0.1222, test_loss: 3.0821, test_f1: 0.6582
 epoch: 87, train_loss: 0.0995, test_loss: 3.1087, test_f1: 0.6417
 epoch: 88, train_loss: 0.0899, test_loss: 3.2473, test_f1: 0.6388
 epoch: 89, train_loss: 0.1574, test_loss: 3.1671, test_f1: 0.6470
 epoch: 90, train_loss: 0.1459, test_loss: 3.2930, test_f1: 0.6273
 epoch: 91, train_loss: 0.1639, test_loss: 3.0976, test_f1: 0.6450
 epoch: 92, train_loss: 0.1405, test_loss: 2.9906, test_f1: 0.6423
 epoch: 93, train_loss: 0.1398, test_loss: 3.3523, test_f1: 0.6401
 epoch: 94, train_loss: 0.1298, test_loss: 3.0790, test_f1: 0.6500
 epoch: 95, train_loss: 0.1311, test_loss: 3.0204, test_f1: 0.6534
 epoch: 96, train_loss: 0.1188, test_loss: 3.2244, test_f1: 0.6275
 epoch: 97, train_loss: 0.1182, test_loss: 3.3957, test_f1: 0.6504
 epoch: 98, train_loss: 0.1272, test_loss: 3.2339, test_f1: 0.6579
 epoch: 99, train_loss: 0.1454, test_loss: 2.9356, test_f1: 0.6290
##################ITERATION #1 ****************************************
 epoch: 0, train_loss: 1.1021, test_loss: 1.1200, test_f1: 0.4011
 epoch: 1, train_loss: 0.9798, test_loss: 1.0123, test_f1: 0.4988
 epoch: 2, train_loss: 0.9085, test_loss: 0.9872, test_f1: 0.5450
 epoch: 3, train_loss: 0.8848, test_loss: 0.9838, test_f1: 0.5786
 epoch: 4, train_loss: 0.8423, test_loss: 0.9912, test_f1: 0.5307
 epoch: 5, train_loss: 0.8268, test_loss: 0.9638, test_f1: 0.5947
 epoch: 6, train_loss: 0.7782, test_loss: 0.9898, test_f1: 0.4984
 epoch: 7, train_loss: 0.7570, test_loss: 0.9306, test_f1: 0.6603
 epoch: 8, train_loss: 0.7664, test_loss: 1.0006, test_f1: 0.6075
 epoch: 9, train_loss: 0.7045, test_loss: 1.0331, test_f1: 0.5645
 epoch: 10, train_loss: 0.7030, test_loss: 1.0600, test_f1: 0.5433
 epoch: 11, train_loss: 0.6552, test_loss: 1.0886, test_f1: 0.5579
 epoch: 12, train_loss: 0.6613, test_loss: 1.0341, test_f1: 0.6186
 epoch: 13, train_loss: 0.6336, test_loss: 1.1463, test_f1: 0.5644
 epoch: 14, train_loss: 0.6471, test_loss: 1.0243, test_f1: 0.6032
 epoch: 15, train_loss: 0.6371, test_loss: 1.0078, test_f1: 0.5945
 epoch: 16, train_loss: 0.5985, test_loss: 1.1419, test_f1: 0.6043
 epoch: 17, train_loss: 0.6064, test_loss: 1.0848, test_f1: 0.6104
 epoch: 18, train_loss: 0.6023, test_loss: 1.1031, test_f1: 0.6369
 epoch: 19, train_loss: 0.5419, test_loss: 1.0858, test_f1: 0.6246
 epoch: 20, train_loss: 0.5517, test_loss: 1.1811, test_f1: 0.5947
 epoch: 21, train_loss: 0.5336, test_loss: 1.1437, test_f1: 0.6229
 epoch: 22, train_loss: 0.5499, test_loss: 1.1683, test_f1: 0.6112
 epoch: 23, train_loss: 0.5087, test_loss: 1.1877, test_f1: 0.5810
 epoch: 24, train_loss: 0.5172, test_loss: 1.2519, test_f1: 0.6507
 epoch: 25, train_loss: 0.4976, test_loss: 1.2659, test_f1: 0.6183
 epoch: 26, train_loss: 0.5031, test_loss: 1.1857, test_f1: 0.6551
 epoch: 27, train_loss: 0.4860, test_loss: 1.1844, test_f1: 0.6397
 epoch: 28, train_loss: 0.4741, test_loss: 1.3277, test_f1: 0.6420
 epoch: 29, train_loss: 0.4667, test_loss: 1.4239, test_f1: 0.6312
 epoch: 30, train_loss: 0.4379, test_loss: 1.4203, test_f1: 0.6550
 epoch: 31, train_loss: 0.4649, test_loss: 1.4987, test_f1: 0.5332
 epoch: 32, train_loss: 0.4089, test_loss: 1.5976, test_f1: 0.5903
 epoch: 33, train_loss: 0.4141, test_loss: 1.5176, test_f1: 0.6541
 epoch: 34, train_loss: 0.3966, test_loss: 1.6058, test_f1: 0.6541
 epoch: 35, train_loss: 0.3952, test_loss: 1.5882, test_f1: 0.6307
 epoch: 36, train_loss: 0.3785, test_loss: 1.6961, test_f1: 0.6406
 epoch: 37, train_loss: 0.4038, test_loss: 1.7487, test_f1: 0.5941
 epoch: 38, train_loss: 0.3769, test_loss: 1.6412, test_f1: 0.6403
 epoch: 39, train_loss: 0.3627, test_loss: 1.5411, test_f1: 0.6154
 epoch: 40, train_loss: 0.3588, test_loss: 1.5980, test_f1: 0.6071
 epoch: 41, train_loss: 0.3336, test_loss: 1.8622, test_f1: 0.6171
 epoch: 42, train_loss: 0.3561, test_loss: 1.7673, test_f1: 0.6446
 epoch: 43, train_loss: 0.3195, test_loss: 1.7796, test_f1: 0.6573
 epoch: 44, train_loss: 0.3368, test_loss: 1.8733, test_f1: 0.6044
 epoch: 45, train_loss: 0.2945, test_loss: 1.9577, test_f1: 0.5749
 epoch: 46, train_loss: 0.3356, test_loss: 1.9383, test_f1: 0.5755
 epoch: 47, train_loss: 0.3500, test_loss: 1.5804, test_f1: 0.5869
 epoch: 48, train_loss: 0.3577, test_loss: 1.8763, test_f1: 0.6354
 epoch: 49, train_loss: 0.2975, test_loss: 1.9990, test_f1: 0.6105
 epoch: 50, train_loss: 0.3214, test_loss: 2.1148, test_f1: 0.6061
 epoch: 51, train_loss: 0.2462, test_loss: 2.0168, test_f1: 0.6318
 epoch: 52, train_loss: 0.2438, test_loss: 2.1222, test_f1: 0.6091
 epoch: 53, train_loss: 0.2230, test_loss: 2.2412, test_f1: 0.6130
 epoch: 54, train_loss: 0.2109, test_loss: 2.2027, test_f1: 0.6135
 epoch: 55, train_loss: 0.2168, test_loss: 2.2838, test_f1: 0.5968
 epoch: 56, train_loss: 0.2192, test_loss: 2.2708, test_f1: 0.6417
 epoch: 57, train_loss: 0.2047, test_loss: 2.3750, test_f1: 0.6195
 epoch: 58, train_loss: 0.2322, test_loss: 2.3844, test_f1: 0.5919
 epoch: 59, train_loss: 0.1816, test_loss: 2.4948, test_f1: 0.5943
 epoch: 60, train_loss: 0.1912, test_loss: 2.6003, test_f1: 0.5897
 epoch: 61, train_loss: 0.2327, test_loss: 2.5009, test_f1: 0.5959
 epoch: 62, train_loss: 0.1842, test_loss: 2.6651, test_f1: 0.6055
 epoch: 63, train_loss: 0.1668, test_loss: 2.7823, test_f1: 0.5920
 epoch: 64, train_loss: 0.1589, test_loss: 2.7613, test_f1: 0.6067
 epoch: 65, train_loss: 0.1554, test_loss: 2.8428, test_f1: 0.6205
 epoch: 66, train_loss: 0.2075, test_loss: 2.7252, test_f1: 0.6001
 epoch: 67, train_loss: 0.1814, test_loss: 2.6606, test_f1: 0.6001
 epoch: 68, train_loss: 0.1658, test_loss: 2.7648, test_f1: 0.5903
 epoch: 69, train_loss: 0.1843, test_loss: 2.6030, test_f1: 0.6261
 epoch: 70, train_loss: 0.1915, test_loss: 2.8262, test_f1: 0.5941
 epoch: 71, train_loss: 0.1602, test_loss: 2.7213, test_f1: 0.6246
 epoch: 72, train_loss: 0.1735, test_loss: 2.8313, test_f1: 0.6307
 epoch: 73, train_loss: 0.1661, test_loss: 2.7751, test_f1: 0.6207
 epoch: 74, train_loss: 0.1514, test_loss: 2.8694, test_f1: 0.6036
 epoch: 75, train_loss: 0.1306, test_loss: 2.9510, test_f1: 0.6276
 epoch: 76, train_loss: 0.1474, test_loss: 3.0246, test_f1: 0.6261
 epoch: 77, train_loss: 0.1453, test_loss: 2.9981, test_f1: 0.6245
 epoch: 78, train_loss: 0.1499, test_loss: 3.1872, test_f1: 0.6166
 epoch: 79, train_loss: 0.1463, test_loss: 3.0377, test_f1: 0.6104
 epoch: 80, train_loss: 0.1423, test_loss: 2.9279, test_f1: 0.6338
 epoch: 81, train_loss: 0.1450, test_loss: 3.1860, test_f1: 0.6082
 epoch: 82, train_loss: 0.1419, test_loss: 2.8336, test_f1: 0.6033
 epoch: 83, train_loss: 0.1458, test_loss: 3.2322, test_f1: 0.5940
 epoch: 84, train_loss: 0.1314, test_loss: 3.3150, test_f1: 0.5822
 epoch: 85, train_loss: 0.1647, test_loss: 3.3694, test_f1: 0.6102
 epoch: 86, train_loss: 0.1572, test_loss: 3.0605, test_f1: 0.5959
 epoch: 87, train_loss: 0.1393, test_loss: 3.0551, test_f1: 0.6139
 epoch: 88, train_loss: 0.1493, test_loss: 3.1531, test_f1: 0.5967
 epoch: 89, train_loss: 0.1440, test_loss: 3.1771, test_f1: 0.6167
 epoch: 90, train_loss: 0.1087, test_loss: 3.3493, test_f1: 0.6014
 epoch: 91, train_loss: 0.1404, test_loss: 3.0950, test_f1: 0.5983
 epoch: 92, train_loss: 0.1327, test_loss: 3.2401, test_f1: 0.6065
 epoch: 93, train_loss: 0.1434, test_loss: 3.3080, test_f1: 0.5923
 epoch: 94, train_loss: 0.1390, test_loss: 3.2607, test_f1: 0.5964
 epoch: 95, train_loss: 0.1360, test_loss: 3.2349, test_f1: 0.6030
 epoch: 96, train_loss: 0.1209, test_loss: 3.1747, test_f1: 0.6048
 epoch: 97, train_loss: 0.1245, test_loss: 3.2165, test_f1: 0.6120
 epoch: 98, train_loss: 0.1428, test_loss: 3.1627, test_f1: 0.6085
 epoch: 99, train_loss: 0.1232, test_loss: 3.2455, test_f1: 0.5981
##################ITERATION #2 ****************************************
 epoch: 0, train_loss: 1.1093, test_loss: 1.1934, test_f1: 0.4160
 epoch: 1, train_loss: 0.9928, test_loss: 1.0286, test_f1: 0.5438
 epoch: 2, train_loss: 0.9404, test_loss: 1.0384, test_f1: 0.5383
 epoch: 3, train_loss: 0.8840, test_loss: 1.0869, test_f1: 0.5169
 epoch: 4, train_loss: 0.8664, test_loss: 1.0482, test_f1: 0.5043
 epoch: 5, train_loss: 0.8524, test_loss: 1.0946, test_f1: 0.5818
 epoch: 6, train_loss: 0.7921, test_loss: 1.0701, test_f1: 0.5296
 epoch: 7, train_loss: 0.7910, test_loss: 1.0233, test_f1: 0.5503
 epoch: 8, train_loss: 0.7593, test_loss: 1.1439, test_f1: 0.5607
 epoch: 9, train_loss: 0.7437, test_loss: 1.0294, test_f1: 0.6016
 epoch: 10, train_loss: 0.7065, test_loss: 1.0071, test_f1: 0.5422
 epoch: 11, train_loss: 0.6895, test_loss: 1.3319, test_f1: 0.5276
 epoch: 12, train_loss: 0.7099, test_loss: 0.9988, test_f1: 0.6461
 epoch: 13, train_loss: 0.6725, test_loss: 1.0591, test_f1: 0.6519
 epoch: 14, train_loss: 0.6432, test_loss: 1.0889, test_f1: 0.6286
 epoch: 15, train_loss: 0.6118, test_loss: 1.0680, test_f1: 0.6534
 epoch: 16, train_loss: 0.6000, test_loss: 1.2655, test_f1: 0.5964
 epoch: 17, train_loss: 0.5797, test_loss: 1.2137, test_f1: 0.6077
 epoch: 18, train_loss: 0.5948, test_loss: 1.0528, test_f1: 0.6090
 epoch: 19, train_loss: 0.5775, test_loss: 1.0944, test_f1: 0.6513
 epoch: 20, train_loss: 0.5496, test_loss: 1.1473, test_f1: 0.6210
 epoch: 21, train_loss: 0.5248, test_loss: 1.2302, test_f1: 0.6360
 epoch: 22, train_loss: 0.5707, test_loss: 1.1162, test_f1: 0.5972
 epoch: 23, train_loss: 0.5603, test_loss: 1.1741, test_f1: 0.6226
 epoch: 24, train_loss: 0.5193, test_loss: 1.2208, test_f1: 0.6039
 epoch: 25, train_loss: 0.5111, test_loss: 1.3344, test_f1: 0.6261
 epoch: 26, train_loss: 0.4829, test_loss: 1.3521, test_f1: 0.6067
 epoch: 27, train_loss: 0.5013, test_loss: 1.1459, test_f1: 0.6343
 epoch: 28, train_loss: 0.4551, test_loss: 1.2242, test_f1: 0.6596
 epoch: 29, train_loss: 0.4524, test_loss: 1.4062, test_f1: 0.5888
 epoch: 30, train_loss: 0.4746, test_loss: 1.2072, test_f1: 0.6449
 epoch: 31, train_loss: 0.4257, test_loss: 1.3998, test_f1: 0.6623
 epoch: 32, train_loss: 0.4196, test_loss: 1.4155, test_f1: 0.6133
 epoch: 33, train_loss: 0.3969, test_loss: 1.3823, test_f1: 0.6569
 epoch: 34, train_loss: 0.3882, test_loss: 1.5269, test_f1: 0.6393
 epoch: 35, train_loss: 0.4122, test_loss: 1.5553, test_f1: 0.5835
 epoch: 36, train_loss: 0.4140, test_loss: 1.4635, test_f1: 0.6184
 epoch: 37, train_loss: 0.3824, test_loss: 1.4251, test_f1: 0.6190
 epoch: 38, train_loss: 0.3766, test_loss: 1.5860, test_f1: 0.6287
 epoch: 39, train_loss: 0.3643, test_loss: 1.6344, test_f1: 0.6315
 epoch: 40, train_loss: 0.3800, test_loss: 1.6316, test_f1: 0.6373
 epoch: 41, train_loss: 0.3416, test_loss: 1.6500, test_f1: 0.6182
 epoch: 42, train_loss: 0.3559, test_loss: 1.8397, test_f1: 0.5760
 epoch: 43, train_loss: 0.3529, test_loss: 1.3923, test_f1: 0.6443
 epoch: 44, train_loss: 0.3317, test_loss: 1.8503, test_f1: 0.5761
 epoch: 45, train_loss: 0.3365, test_loss: 1.5328, test_f1: 0.6668
 epoch: 46, train_loss: 0.3366, test_loss: 1.8552, test_f1: 0.5888
 epoch: 47, train_loss: 0.3510, test_loss: 1.6564, test_f1: 0.6070
 epoch: 48, train_loss: 0.3341, test_loss: 1.7696, test_f1: 0.5754
 epoch: 49, train_loss: 0.3161, test_loss: 2.0874, test_f1: 0.5794
 epoch: 50, train_loss: 0.3212, test_loss: 1.9151, test_f1: 0.5928
 epoch: 51, train_loss: 0.2481, test_loss: 1.9735, test_f1: 0.5938
 epoch: 52, train_loss: 0.2072, test_loss: 1.9879, test_f1: 0.6017
 epoch: 53, train_loss: 0.2363, test_loss: 2.0123, test_f1: 0.6383
 epoch: 54, train_loss: 0.2294, test_loss: 2.1252, test_f1: 0.6065
 epoch: 55, train_loss: 0.2115, test_loss: 2.0565, test_f1: 0.5911
 epoch: 56, train_loss: 0.1927, test_loss: 2.2681, test_f1: 0.6045
 epoch: 57, train_loss: 0.1839, test_loss: 2.3357, test_f1: 0.5491
 epoch: 58, train_loss: 0.1862, test_loss: 2.5015, test_f1: 0.5629
 epoch: 59, train_loss: 0.2085, test_loss: 2.4767, test_f1: 0.5840
 epoch: 60, train_loss: 0.2159, test_loss: 2.4003, test_f1: 0.5902
 epoch: 61, train_loss: 0.2097, test_loss: 2.2891, test_f1: 0.6134
 epoch: 62, train_loss: 0.1838, test_loss: 2.6200, test_f1: 0.5512
 epoch: 63, train_loss: 0.1867, test_loss: 2.5223, test_f1: 0.5835
 epoch: 64, train_loss: 0.1824, test_loss: 2.3495, test_f1: 0.6030
 epoch: 65, train_loss: 0.1771, test_loss: 2.4070, test_f1: 0.5948
 epoch: 66, train_loss: 0.1417, test_loss: 2.5542, test_f1: 0.5826
 epoch: 67, train_loss: 0.1413, test_loss: 2.8699, test_f1: 0.5718
 epoch: 68, train_loss: 0.1503, test_loss: 2.6284, test_f1: 0.5897
 epoch: 69, train_loss: 0.1886, test_loss: 2.7799, test_f1: 0.5762
 epoch: 70, train_loss: 0.1396, test_loss: 2.6165, test_f1: 0.6061
 epoch: 71, train_loss: 0.1695, test_loss: 2.7794, test_f1: 0.6005
 epoch: 72, train_loss: 0.1639, test_loss: 2.8791, test_f1: 0.5643
 epoch: 73, train_loss: 0.1600, test_loss: 2.7331, test_f1: 0.5732
 epoch: 74, train_loss: 0.1468, test_loss: 2.9166, test_f1: 0.5748
 epoch: 75, train_loss: 0.1721, test_loss: 2.7205, test_f1: 0.5656
 epoch: 76, train_loss: 0.1509, test_loss: 3.0549, test_f1: 0.5910
 epoch: 77, train_loss: 0.1717, test_loss: 2.7905, test_f1: 0.6007
 epoch: 78, train_loss: 0.1895, test_loss: 2.5866, test_f1: 0.6427
 epoch: 79, train_loss: 0.1409, test_loss: 2.8177, test_f1: 0.5707
 epoch: 80, train_loss: 0.1275, test_loss: 2.7628, test_f1: 0.6189
 epoch: 81, train_loss: 0.1377, test_loss: 2.7066, test_f1: 0.6034
 epoch: 82, train_loss: 0.1605, test_loss: 2.7833, test_f1: 0.6098
 epoch: 83, train_loss: 0.1168, test_loss: 2.9759, test_f1: 0.6041
 epoch: 84, train_loss: 0.1239, test_loss: 3.0662, test_f1: 0.5936
 epoch: 85, train_loss: 0.0967, test_loss: 2.9293, test_f1: 0.6094
 epoch: 86, train_loss: 0.1234, test_loss: 3.0329, test_f1: 0.5804
 epoch: 87, train_loss: 0.1231, test_loss: 3.0342, test_f1: 0.6002
 epoch: 88, train_loss: 0.1283, test_loss: 2.7377, test_f1: 0.5898
 epoch: 89, train_loss: 0.1314, test_loss: 2.8400, test_f1: 0.5883
 epoch: 90, train_loss: 0.1103, test_loss: 2.9198, test_f1: 0.6040
 epoch: 91, train_loss: 0.1093, test_loss: 3.0484, test_f1: 0.6243
 epoch: 92, train_loss: 0.1094, test_loss: 3.0472, test_f1: 0.6173
 epoch: 93, train_loss: 0.0938, test_loss: 3.1012, test_f1: 0.5909
 epoch: 94, train_loss: 0.1510, test_loss: 3.0848, test_f1: 0.5781
 epoch: 95, train_loss: 0.1569, test_loss: 2.9764, test_f1: 0.5839
 epoch: 96, train_loss: 0.1576, test_loss: 3.0242, test_f1: 0.5975
 epoch: 97, train_loss: 0.1025, test_loss: 2.9452, test_f1: 0.5891
 epoch: 98, train_loss: 0.0897, test_loss: 3.1869, test_f1: 0.5904
 epoch: 99, train_loss: 0.1105, test_loss: 2.9213, test_f1: 0.6166
##################ITERATION #3 ****************************************
 epoch: 0, train_loss: 1.1716, test_loss: 1.2123, test_f1: 0.4057
 epoch: 1, train_loss: 0.9807, test_loss: 1.0325, test_f1: 0.5359
 epoch: 2, train_loss: 0.9240, test_loss: 1.0233, test_f1: 0.5292
 epoch: 3, train_loss: 0.8869, test_loss: 0.9963, test_f1: 0.5736
 epoch: 4, train_loss: 0.8840, test_loss: 1.0048, test_f1: 0.5315
 epoch: 5, train_loss: 0.8275, test_loss: 1.0568, test_f1: 0.5488
 epoch: 6, train_loss: 0.7888, test_loss: 1.0862, test_f1: 0.5979
 epoch: 7, train_loss: 0.7774, test_loss: 1.0083, test_f1: 0.5964
 epoch: 8, train_loss: 0.7781, test_loss: 1.0437, test_f1: 0.5777
 epoch: 9, train_loss: 0.7381, test_loss: 1.2445, test_f1: 0.5107
 epoch: 10, train_loss: 0.7172, test_loss: 1.1969, test_f1: 0.5473
 epoch: 11, train_loss: 0.6770, test_loss: 1.0749, test_f1: 0.5757
 epoch: 12, train_loss: 0.6725, test_loss: 1.0158, test_f1: 0.6373
 epoch: 13, train_loss: 0.6664, test_loss: 1.2401, test_f1: 0.5385
 epoch: 14, train_loss: 0.6561, test_loss: 1.2154, test_f1: 0.5528
 epoch: 15, train_loss: 0.6237, test_loss: 1.1274, test_f1: 0.6168
 epoch: 16, train_loss: 0.6063, test_loss: 1.1409, test_f1: 0.6010
 epoch: 17, train_loss: 0.5982, test_loss: 1.1988, test_f1: 0.5969
 epoch: 18, train_loss: 0.5746, test_loss: 1.3553, test_f1: 0.5355
 epoch: 19, train_loss: 0.5583, test_loss: 1.3900, test_f1: 0.5629
 epoch: 20, train_loss: 0.5879, test_loss: 1.2840, test_f1: 0.5645
 epoch: 21, train_loss: 0.5838, test_loss: 1.2432, test_f1: 0.5733
 epoch: 22, train_loss: 0.5908, test_loss: 1.3263, test_f1: 0.5513
 epoch: 23, train_loss: 0.5190, test_loss: 1.2653, test_f1: 0.6174
 epoch: 24, train_loss: 0.4993, test_loss: 1.3273, test_f1: 0.5822
 epoch: 25, train_loss: 0.4903, test_loss: 1.4329, test_f1: 0.5860
 epoch: 26, train_loss: 0.4741, test_loss: 1.4934, test_f1: 0.6362
 epoch: 27, train_loss: 0.4840, test_loss: 1.3433, test_f1: 0.5800
 epoch: 28, train_loss: 0.4956, test_loss: 1.3457, test_f1: 0.5703
 epoch: 29, train_loss: 0.4649, test_loss: 1.3964, test_f1: 0.6129
 epoch: 30, train_loss: 0.4685, test_loss: 1.4337, test_f1: 0.5855
 epoch: 31, train_loss: 0.4338, test_loss: 1.3699, test_f1: 0.6365
 epoch: 32, train_loss: 0.4173, test_loss: 1.5399, test_f1: 0.6019
 epoch: 33, train_loss: 0.4189, test_loss: 1.3435, test_f1: 0.6290
 epoch: 34, train_loss: 0.4229, test_loss: 1.5654, test_f1: 0.6028
 epoch: 35, train_loss: 0.4139, test_loss: 1.5485, test_f1: 0.6129
 epoch: 36, train_loss: 0.4379, test_loss: 1.5732, test_f1: 0.5993
 epoch: 37, train_loss: 0.3706, test_loss: 1.7415, test_f1: 0.6193
 epoch: 38, train_loss: 0.3813, test_loss: 1.5468, test_f1: 0.6014
 epoch: 39, train_loss: 0.3941, test_loss: 1.5512, test_f1: 0.6380
 epoch: 40, train_loss: 0.3452, test_loss: 1.6187, test_f1: 0.5943
 epoch: 41, train_loss: 0.4059, test_loss: 1.6875, test_f1: 0.6171
 epoch: 42, train_loss: 0.3759, test_loss: 1.6259, test_f1: 0.6206
 epoch: 43, train_loss: 0.3798, test_loss: 2.0480, test_f1: 0.5835
 epoch: 44, train_loss: 0.3939, test_loss: 1.6284, test_f1: 0.6357
 epoch: 45, train_loss: 0.3339, test_loss: 1.8593, test_f1: 0.5893
 epoch: 46, train_loss: 0.2895, test_loss: 1.9806, test_f1: 0.5953
 epoch: 47, train_loss: 0.3359, test_loss: 1.8043, test_f1: 0.5797
 epoch: 48, train_loss: 0.3327, test_loss: 1.8470, test_f1: 0.5529
 epoch: 49, train_loss: 0.3500, test_loss: 1.8976, test_f1: 0.6015
 epoch: 50, train_loss: 0.3011, test_loss: 2.2330, test_f1: 0.5891
 epoch: 51, train_loss: 0.2527, test_loss: 2.0912, test_f1: 0.5966
 epoch: 52, train_loss: 0.2345, test_loss: 2.0535, test_f1: 0.6100
 epoch: 53, train_loss: 0.2297, test_loss: 2.0061, test_f1: 0.6010
 epoch: 54, train_loss: 0.2129, test_loss: 2.1033, test_f1: 0.6182
 epoch: 55, train_loss: 0.2122, test_loss: 2.0680, test_f1: 0.6208
 epoch: 56, train_loss: 0.2204, test_loss: 2.3409, test_f1: 0.5844
 epoch: 57, train_loss: 0.2376, test_loss: 2.0630, test_f1: 0.5958
 epoch: 58, train_loss: 0.1914, test_loss: 2.2184, test_f1: 0.5803
 epoch: 59, train_loss: 0.2024, test_loss: 2.4623, test_f1: 0.5801
 epoch: 60, train_loss: 0.1952, test_loss: 2.3747, test_f1: 0.5860
 epoch: 61, train_loss: 0.1909, test_loss: 2.5311, test_f1: 0.5787
 epoch: 62, train_loss: 0.1677, test_loss: 2.2689, test_f1: 0.6035
 epoch: 63, train_loss: 0.1998, test_loss: 2.2517, test_f1: 0.6263
 epoch: 64, train_loss: 0.1901, test_loss: 2.3699, test_f1: 0.6036
 epoch: 65, train_loss: 0.1749, test_loss: 2.4773, test_f1: 0.6132
 epoch: 66, train_loss: 0.1857, test_loss: 2.5493, test_f1: 0.6180
 epoch: 67, train_loss: 0.1874, test_loss: 2.3881, test_f1: 0.6016
 epoch: 68, train_loss: 0.1686, test_loss: 2.3731, test_f1: 0.6195
 epoch: 69, train_loss: 0.1919, test_loss: 2.8518, test_f1: 0.5714
 epoch: 70, train_loss: 0.1892, test_loss: 2.4676, test_f1: 0.5892
 epoch: 71, train_loss: 0.1638, test_loss: 2.4549, test_f1: 0.6061
 epoch: 72, train_loss: 0.1589, test_loss: 2.7275, test_f1: 0.5637
 epoch: 73, train_loss: 0.1501, test_loss: 2.6398, test_f1: 0.5914
 epoch: 74, train_loss: 0.1178, test_loss: 2.8097, test_f1: 0.6098
 epoch: 75, train_loss: 0.1310, test_loss: 2.9875, test_f1: 0.5791
 epoch: 76, train_loss: 0.1459, test_loss: 2.5497, test_f1: 0.5943
 epoch: 77, train_loss: 0.1885, test_loss: 2.9348, test_f1: 0.5794
 epoch: 78, train_loss: 0.1989, test_loss: 2.6243, test_f1: 0.6016
 epoch: 79, train_loss: 0.1516, test_loss: 2.7284, test_f1: 0.5922
 epoch: 80, train_loss: 0.1788, test_loss: 2.7283, test_f1: 0.5563
 epoch: 81, train_loss: 0.1447, test_loss: 2.7308, test_f1: 0.5973
 epoch: 82, train_loss: 0.1360, test_loss: 2.7862, test_f1: 0.6072
 epoch: 83, train_loss: 0.1500, test_loss: 3.0075, test_f1: 0.5912
 epoch: 84, train_loss: 0.1312, test_loss: 2.9273, test_f1: 0.6136
 epoch: 85, train_loss: 0.1189, test_loss: 2.9794, test_f1: 0.5803
 epoch: 86, train_loss: 0.1415, test_loss: 2.8273, test_f1: 0.6361
 epoch: 87, train_loss: 0.1282, test_loss: 2.9958, test_f1: 0.5636
 epoch: 88, train_loss: 0.1137, test_loss: 3.1218, test_f1: 0.5929
 epoch: 89, train_loss: 0.1168, test_loss: 3.0052, test_f1: 0.6111
 epoch: 90, train_loss: 0.1314, test_loss: 2.9669, test_f1: 0.6023
 epoch: 91, train_loss: 0.1292, test_loss: 2.9621, test_f1: 0.6025
 epoch: 92, train_loss: 0.1305, test_loss: 3.0259, test_f1: 0.6172
 epoch: 93, train_loss: 0.1256, test_loss: 2.7944, test_f1: 0.6170
 epoch: 94, train_loss: 0.1133, test_loss: 2.9302, test_f1: 0.6102
 epoch: 95, train_loss: 0.1100, test_loss: 3.0289, test_f1: 0.5950
 epoch: 96, train_loss: 0.1068, test_loss: 3.0518, test_f1: 0.5978
 epoch: 97, train_loss: 0.1409, test_loss: 3.1134, test_f1: 0.5792
 epoch: 98, train_loss: 0.1125, test_loss: 2.9894, test_f1: 0.5971
 epoch: 99, train_loss: 0.1199, test_loss: 3.0820, test_f1: 0.6102
##################ITERATION #4 ****************************************
 epoch: 0, train_loss: 1.2129, test_loss: 1.1500, test_f1: 0.3716
 epoch: 1, train_loss: 0.9984, test_loss: 0.9877, test_f1: 0.5312
 epoch: 2, train_loss: 0.9212, test_loss: 1.0869, test_f1: 0.5066
 epoch: 3, train_loss: 0.8844, test_loss: 1.0700, test_f1: 0.5379
 epoch: 4, train_loss: 0.8681, test_loss: 1.0991, test_f1: 0.5617
 epoch: 5, train_loss: 0.8232, test_loss: 1.1028, test_f1: 0.5167
 epoch: 6, train_loss: 0.7895, test_loss: 1.1210, test_f1: 0.5567
 epoch: 7, train_loss: 0.7933, test_loss: 1.0515, test_f1: 0.5900
 epoch: 8, train_loss: 0.7317, test_loss: 1.0585, test_f1: 0.5726
 epoch: 9, train_loss: 0.7273, test_loss: 1.0457, test_f1: 0.6384
 epoch: 10, train_loss: 0.7111, test_loss: 1.0587, test_f1: 0.5802
 epoch: 11, train_loss: 0.7009, test_loss: 1.0221, test_f1: 0.6389
 epoch: 12, train_loss: 0.6871, test_loss: 1.1200, test_f1: 0.6024
 epoch: 13, train_loss: 0.6589, test_loss: 1.0544, test_f1: 0.6036
 epoch: 14, train_loss: 0.6500, test_loss: 1.0225, test_f1: 0.6250
 epoch: 15, train_loss: 0.6450, test_loss: 1.0176, test_f1: 0.6295
 epoch: 16, train_loss: 0.5699, test_loss: 1.0721, test_f1: 0.6412
 epoch: 17, train_loss: 0.5818, test_loss: 1.1648, test_f1: 0.6178
 epoch: 18, train_loss: 0.5701, test_loss: 1.4561, test_f1: 0.5336
 epoch: 19, train_loss: 0.5563, test_loss: 1.2034, test_f1: 0.6099
 epoch: 20, train_loss: 0.5585, test_loss: 1.1582, test_f1: 0.5856
 epoch: 21, train_loss: 0.5319, test_loss: 1.1483, test_f1: 0.6021
 epoch: 22, train_loss: 0.5268, test_loss: 1.1424, test_f1: 0.6453
 epoch: 23, train_loss: 0.5373, test_loss: 1.1631, test_f1: 0.5814
 epoch: 24, train_loss: 0.4946, test_loss: 1.2271, test_f1: 0.6336
 epoch: 25, train_loss: 0.4996, test_loss: 1.2012, test_f1: 0.6560
 epoch: 26, train_loss: 0.4725, test_loss: 1.3360, test_f1: 0.5756
 epoch: 27, train_loss: 0.4523, test_loss: 1.5433, test_f1: 0.5819
 epoch: 28, train_loss: 0.4841, test_loss: 1.2846, test_f1: 0.6095
 epoch: 29, train_loss: 0.4354, test_loss: 1.5011, test_f1: 0.6151
 epoch: 30, train_loss: 0.4275, test_loss: 1.4461, test_f1: 0.6354
 epoch: 31, train_loss: 0.3873, test_loss: 1.4432, test_f1: 0.6250
 epoch: 32, train_loss: 0.4203, test_loss: 1.6021, test_f1: 0.6470
 epoch: 33, train_loss: 0.4186, test_loss: 1.3825, test_f1: 0.5816
 epoch: 34, train_loss: 0.3920, test_loss: 1.6003, test_f1: 0.5782
 epoch: 35, train_loss: 0.4073, test_loss: 1.4740, test_f1: 0.6432
 epoch: 36, train_loss: 0.3308, test_loss: 1.7630, test_f1: 0.5945
 epoch: 37, train_loss: 0.3697, test_loss: 1.5339, test_f1: 0.6120
 epoch: 38, train_loss: 0.3730, test_loss: 1.8759, test_f1: 0.6174
 epoch: 39, train_loss: 0.3526, test_loss: 1.6391, test_f1: 0.5240
 epoch: 40, train_loss: 0.3525, test_loss: 1.7892, test_f1: 0.6257
 epoch: 41, train_loss: 0.3509, test_loss: 1.8330, test_f1: 0.6157
 epoch: 42, train_loss: 0.3362, test_loss: 1.6770, test_f1: 0.5959
 epoch: 43, train_loss: 0.3615, test_loss: 1.9702, test_f1: 0.5570
 epoch: 44, train_loss: 0.3154, test_loss: 1.7537, test_f1: 0.6106
 epoch: 45, train_loss: 0.2827, test_loss: 1.9025, test_f1: 0.6411
 epoch: 46, train_loss: 0.2997, test_loss: 1.8231, test_f1: 0.5951
 epoch: 47, train_loss: 0.2859, test_loss: 1.9056, test_f1: 0.5910
 epoch: 48, train_loss: 0.2860, test_loss: 1.8646, test_f1: 0.5958
 epoch: 49, train_loss: 0.2679, test_loss: 1.9939, test_f1: 0.5736
 epoch: 50, train_loss: 0.2582, test_loss: 2.3846, test_f1: 0.5538
 epoch: 51, train_loss: 0.2435, test_loss: 2.0262, test_f1: 0.6197
 epoch: 52, train_loss: 0.1837, test_loss: 2.2648, test_f1: 0.5792
 epoch: 53, train_loss: 0.1827, test_loss: 2.2486, test_f1: 0.5806
 epoch: 54, train_loss: 0.1701, test_loss: 2.4080, test_f1: 0.5973
 epoch: 55, train_loss: 0.1862, test_loss: 2.3275, test_f1: 0.5917
 epoch: 56, train_loss: 0.1828, test_loss: 2.3831, test_f1: 0.6022
 epoch: 57, train_loss: 0.1731, test_loss: 2.2829, test_f1: 0.5922
 epoch: 58, train_loss: 0.1693, test_loss: 2.2886, test_f1: 0.6292
 epoch: 59, train_loss: 0.1469, test_loss: 2.5109, test_f1: 0.5709
 epoch: 60, train_loss: 0.1719, test_loss: 2.6430, test_f1: 0.5837
 epoch: 61, train_loss: 0.1614, test_loss: 2.5267, test_f1: 0.5675
 epoch: 62, train_loss: 0.1554, test_loss: 2.4382, test_f1: 0.6177
 epoch: 63, train_loss: 0.1528, test_loss: 2.5828, test_f1: 0.5935
 epoch: 64, train_loss: 0.1422, test_loss: 2.7745, test_f1: 0.6125
 epoch: 65, train_loss: 0.1967, test_loss: 2.5821, test_f1: 0.5978
 epoch: 66, train_loss: 0.1450, test_loss: 2.6556, test_f1: 0.5860
 epoch: 67, train_loss: 0.1352, test_loss: 2.5221, test_f1: 0.5899
 epoch: 68, train_loss: 0.1394, test_loss: 2.7575, test_f1: 0.5516
 epoch: 69, train_loss: 0.1649, test_loss: 2.5928, test_f1: 0.6043
 epoch: 70, train_loss: 0.1186, test_loss: 2.8510, test_f1: 0.6062
 epoch: 71, train_loss: 0.1234, test_loss: 2.8035, test_f1: 0.6050
 epoch: 72, train_loss: 0.1282, test_loss: 3.0600, test_f1: 0.5764
 epoch: 73, train_loss: 0.1394, test_loss: 2.8987, test_f1: 0.5857
 epoch: 74, train_loss: 0.1209, test_loss: 3.1594, test_f1: 0.5844
 epoch: 75, train_loss: 0.1288, test_loss: 2.9800, test_f1: 0.5603
 epoch: 76, train_loss: 0.1378, test_loss: 3.0981, test_f1: 0.5473
 epoch: 77, train_loss: 0.1321, test_loss: 3.3201, test_f1: 0.5777
 epoch: 78, train_loss: 0.1073, test_loss: 3.0013, test_f1: 0.5811
 epoch: 79, train_loss: 0.1246, test_loss: 3.4401, test_f1: 0.5545
 epoch: 80, train_loss: 0.1275, test_loss: 3.2939, test_f1: 0.5392
 epoch: 81, train_loss: 0.1472, test_loss: 3.2330, test_f1: 0.5894
 epoch: 82, train_loss: 0.1356, test_loss: 2.8927, test_f1: 0.5731
 epoch: 83, train_loss: 0.1408, test_loss: 3.0829, test_f1: 0.5765
 epoch: 84, train_loss: 0.1583, test_loss: 2.9831, test_f1: 0.5744
 epoch: 85, train_loss: 0.1562, test_loss: 2.9489, test_f1: 0.5630
 epoch: 86, train_loss: 0.1062, test_loss: 3.0680, test_f1: 0.5691
 epoch: 87, train_loss: 0.1470, test_loss: 3.1066, test_f1: 0.5602
 epoch: 88, train_loss: 0.1321, test_loss: 2.9954, test_f1: 0.5890
 epoch: 89, train_loss: 0.1324, test_loss: 3.0501, test_f1: 0.5566
 epoch: 90, train_loss: 0.1130, test_loss: 2.9912, test_f1: 0.5822
 epoch: 91, train_loss: 0.1245, test_loss: 3.2759, test_f1: 0.5680
 epoch: 92, train_loss: 0.1065, test_loss: 3.2730, test_f1: 0.5689
 epoch: 93, train_loss: 0.1260, test_loss: 3.0084, test_f1: 0.5593
 epoch: 94, train_loss: 0.1188, test_loss: 3.0716, test_f1: 0.5634
 epoch: 95, train_loss: 0.1038, test_loss: 3.2964, test_f1: 0.5426
 epoch: 96, train_loss: 0.0915, test_loss: 3.2737, test_f1: 0.5515
 epoch: 97, train_loss: 0.1200, test_loss: 3.2076, test_f1: 0.6020
 epoch: 98, train_loss: 0.1141, test_loss: 3.3353, test_f1: 0.5579
 epoch: 99, train_loss: 0.0945, test_loss: 3.4076, test_f1: 0.5480
##################ITERATION #5 ****************************************
 epoch: 0, train_loss: 1.2950, test_loss: 1.3287, test_f1: 0.3437
 epoch: 1, train_loss: 0.9959, test_loss: 1.0781, test_f1: 0.4929
 epoch: 2, train_loss: 0.9219, test_loss: 1.1321, test_f1: 0.5211
 epoch: 3, train_loss: 0.8727, test_loss: 1.0145, test_f1: 0.5643
 epoch: 4, train_loss: 0.8436, test_loss: 1.0579, test_f1: 0.5324
 epoch: 5, train_loss: 0.8336, test_loss: 1.0484, test_f1: 0.5775
 epoch: 6, train_loss: 0.7898, test_loss: 1.0224, test_f1: 0.5880
 epoch: 7, train_loss: 0.7783, test_loss: 1.1339, test_f1: 0.5468
 epoch: 8, train_loss: 0.7542, test_loss: 1.1458, test_f1: 0.4946
 epoch: 9, train_loss: 0.7405, test_loss: 1.0504, test_f1: 0.6411
 epoch: 10, train_loss: 0.7060, test_loss: 1.1891, test_f1: 0.5756
 epoch: 11, train_loss: 0.6812, test_loss: 1.1545, test_f1: 0.5985
 epoch: 12, train_loss: 0.6755, test_loss: 1.1340, test_f1: 0.5646
 epoch: 13, train_loss: 0.6644, test_loss: 1.1057, test_f1: 0.6082
 epoch: 14, train_loss: 0.6398, test_loss: 1.2326, test_f1: 0.5744
 epoch: 15, train_loss: 0.6401, test_loss: 1.2392, test_f1: 0.5673
 epoch: 16, train_loss: 0.6234, test_loss: 1.2024, test_f1: 0.5917
 epoch: 17, train_loss: 0.6018, test_loss: 1.1858, test_f1: 0.6066
 epoch: 18, train_loss: 0.6018, test_loss: 1.1889, test_f1: 0.5962
 epoch: 19, train_loss: 0.6112, test_loss: 1.1263, test_f1: 0.6110
 epoch: 20, train_loss: 0.5531, test_loss: 1.2395, test_f1: 0.6020
 epoch: 21, train_loss: 0.5444, test_loss: 1.3532, test_f1: 0.6119
 epoch: 22, train_loss: 0.5267, test_loss: 1.3681, test_f1: 0.5711
 epoch: 23, train_loss: 0.5598, test_loss: 1.2784, test_f1: 0.6119
 epoch: 24, train_loss: 0.5331, test_loss: 1.1296, test_f1: 0.6394
 epoch: 25, train_loss: 0.5286, test_loss: 1.3384, test_f1: 0.6004
 epoch: 26, train_loss: 0.5197, test_loss: 1.3063, test_f1: 0.6402
 epoch: 27, train_loss: 0.4980, test_loss: 1.4019, test_f1: 0.5844
 epoch: 28, train_loss: 0.4622, test_loss: 1.3157, test_f1: 0.5641
 epoch: 29, train_loss: 0.5022, test_loss: 1.3725, test_f1: 0.5719
 epoch: 30, train_loss: 0.5025, test_loss: 1.2932, test_f1: 0.6247
 epoch: 31, train_loss: 0.4316, test_loss: 1.3832, test_f1: 0.6028
 epoch: 32, train_loss: 0.4447, test_loss: 1.4317, test_f1: 0.6138
 epoch: 33, train_loss: 0.3952, test_loss: 1.5614, test_f1: 0.5717
 epoch: 34, train_loss: 0.4690, test_loss: 1.3058, test_f1: 0.5905
 epoch: 35, train_loss: 0.4453, test_loss: 1.3783, test_f1: 0.6711
 epoch: 36, train_loss: 0.4175, test_loss: 1.4013, test_f1: 0.6582
 epoch: 37, train_loss: 0.3619, test_loss: 1.5740, test_f1: 0.5996
 epoch: 38, train_loss: 0.4009, test_loss: 1.4035, test_f1: 0.6330
 epoch: 39, train_loss: 0.3561, test_loss: 1.7312, test_f1: 0.5912
 epoch: 40, train_loss: 0.3876, test_loss: 1.6345, test_f1: 0.6390
 epoch: 41, train_loss: 0.3702, test_loss: 1.6223, test_f1: 0.6066
 epoch: 42, train_loss: 0.3699, test_loss: 1.6878, test_f1: 0.5671
 epoch: 43, train_loss: 0.3417, test_loss: 1.6289, test_f1: 0.5993
 epoch: 44, train_loss: 0.3782, test_loss: 1.7913, test_f1: 0.6171
 epoch: 45, train_loss: 0.3518, test_loss: 1.6666, test_f1: 0.6154
 epoch: 46, train_loss: 0.3458, test_loss: 1.5717, test_f1: 0.6379
 epoch: 47, train_loss: 0.3135, test_loss: 2.1030, test_f1: 0.5748
 epoch: 48, train_loss: 0.3255, test_loss: 1.9663, test_f1: 0.5605
 epoch: 49, train_loss: 0.2996, test_loss: 1.8152, test_f1: 0.5926
 epoch: 50, train_loss: 0.3009, test_loss: 1.7929, test_f1: 0.6125
 epoch: 51, train_loss: 0.2393, test_loss: 1.9782, test_f1: 0.6133
 epoch: 52, train_loss: 0.2535, test_loss: 1.9613, test_f1: 0.6033
 epoch: 53, train_loss: 0.2193, test_loss: 2.0517, test_f1: 0.6210
 epoch: 54, train_loss: 0.2005, test_loss: 2.2969, test_f1: 0.5879
 epoch: 55, train_loss: 0.1877, test_loss: 2.1888, test_f1: 0.5972
 epoch: 56, train_loss: 0.1870, test_loss: 2.2948, test_f1: 0.6068
 epoch: 57, train_loss: 0.2181, test_loss: 2.2626, test_f1: 0.6000
 epoch: 58, train_loss: 0.2011, test_loss: 2.1940, test_f1: 0.6103
 epoch: 59, train_loss: 0.1857, test_loss: 2.2737, test_f1: 0.5952
 epoch: 60, train_loss: 0.1756, test_loss: 2.2074, test_f1: 0.6066
 epoch: 61, train_loss: 0.1837, test_loss: 2.4669, test_f1: 0.6080
 epoch: 62, train_loss: 0.1841, test_loss: 2.3433, test_f1: 0.5968
 epoch: 63, train_loss: 0.1785, test_loss: 2.3647, test_f1: 0.6146
 epoch: 64, train_loss: 0.1980, test_loss: 2.2698, test_f1: 0.6276
 epoch: 65, train_loss: 0.2068, test_loss: 2.3869, test_f1: 0.6233
 epoch: 66, train_loss: 0.1568, test_loss: 2.5723, test_f1: 0.5874
 epoch: 67, train_loss: 0.1439, test_loss: 2.6611, test_f1: 0.5818
 epoch: 68, train_loss: 0.1753, test_loss: 2.4353, test_f1: 0.6095
 epoch: 69, train_loss: 0.1586, test_loss: 2.5639, test_f1: 0.5849
 epoch: 70, train_loss: 0.1609, test_loss: 2.3805, test_f1: 0.5784
 epoch: 71, train_loss: 0.1615, test_loss: 2.6412, test_f1: 0.5931
 epoch: 72, train_loss: 0.1502, test_loss: 2.8382, test_f1: 0.5989
 epoch: 73, train_loss: 0.1422, test_loss: 2.5776, test_f1: 0.5927
 epoch: 74, train_loss: 0.1387, test_loss: 2.6296, test_f1: 0.5879
 epoch: 75, train_loss: 0.1635, test_loss: 2.7663, test_f1: 0.6551
 epoch: 76, train_loss: 0.1514, test_loss: 2.7598, test_f1: 0.6182
 epoch: 77, train_loss: 0.1215, test_loss: 2.8404, test_f1: 0.5847
 epoch: 78, train_loss: 0.1061, test_loss: 2.7859, test_f1: 0.6049
 epoch: 79, train_loss: 0.1881, test_loss: 2.6404, test_f1: 0.5906
 epoch: 80, train_loss: 0.1327, test_loss: 2.8315, test_f1: 0.5884
 epoch: 81, train_loss: 0.1298, test_loss: 2.9141, test_f1: 0.5989
 epoch: 82, train_loss: 0.1483, test_loss: 3.3366, test_f1: 0.5715
 epoch: 83, train_loss: 0.1563, test_loss: 3.0671, test_f1: 0.5590
 epoch: 84, train_loss: 0.1343, test_loss: 2.9777, test_f1: 0.5924
 epoch: 85, train_loss: 0.1413, test_loss: 2.8037, test_f1: 0.5921
 epoch: 86, train_loss: 0.1382, test_loss: 2.9270, test_f1: 0.5572
 epoch: 87, train_loss: 0.1142, test_loss: 2.9517, test_f1: 0.5776
 epoch: 88, train_loss: 0.1527, test_loss: 2.8061, test_f1: 0.5890
 epoch: 89, train_loss: 0.1182, test_loss: 2.9575, test_f1: 0.5837
 epoch: 90, train_loss: 0.1155, test_loss: 2.9882, test_f1: 0.5739
 epoch: 91, train_loss: 0.1277, test_loss: 2.8332, test_f1: 0.5896
 epoch: 92, train_loss: 0.1253, test_loss: 3.0902, test_f1: 0.5592
 epoch: 93, train_loss: 0.1534, test_loss: 2.9458, test_f1: 0.5707
 epoch: 94, train_loss: 0.1283, test_loss: 3.0690, test_f1: 0.5682
 epoch: 95, train_loss: 0.1061, test_loss: 3.3412, test_f1: 0.5604
 epoch: 96, train_loss: 0.1029, test_loss: 3.1673, test_f1: 0.5785
 epoch: 97, train_loss: 0.1228, test_loss: 3.3269, test_f1: 0.5904
 epoch: 98, train_loss: 0.1111, test_loss: 3.1738, test_f1: 0.5793
 epoch: 99, train_loss: 0.1077, test_loss: 3.2646, test_f1: 0.5924
##################ITERATION #6 ****************************************
 epoch: 0, train_loss: 1.2876, test_loss: 1.2055, test_f1: 0.3031
 epoch: 1, train_loss: 0.9893, test_loss: 1.0486, test_f1: 0.5381
 epoch: 2, train_loss: 0.9257, test_loss: 1.0310, test_f1: 0.5376
 epoch: 3, train_loss: 0.8979, test_loss: 1.0016, test_f1: 0.5605
 epoch: 4, train_loss: 0.8771, test_loss: 1.1017, test_f1: 0.5988
 epoch: 5, train_loss: 0.8175, test_loss: 1.0320, test_f1: 0.5492
 epoch: 6, train_loss: 0.7968, test_loss: 1.0802, test_f1: 0.5978
 epoch: 7, train_loss: 0.7837, test_loss: 1.1911, test_f1: 0.4600
 epoch: 8, train_loss: 0.7546, test_loss: 1.0853, test_f1: 0.5786
 epoch: 9, train_loss: 0.7138, test_loss: 1.0266, test_f1: 0.5830
 epoch: 10, train_loss: 0.6862, test_loss: 1.0803, test_f1: 0.5737
 epoch: 11, train_loss: 0.6838, test_loss: 1.0831, test_f1: 0.6178
 epoch: 12, train_loss: 0.6721, test_loss: 1.0846, test_f1: 0.6058
 epoch: 13, train_loss: 0.6539, test_loss: 1.1084, test_f1: 0.5743
 epoch: 14, train_loss: 0.6287, test_loss: 1.0669, test_f1: 0.6173
 epoch: 15, train_loss: 0.6271, test_loss: 1.0881, test_f1: 0.6196
 epoch: 16, train_loss: 0.5736, test_loss: 1.0665, test_f1: 0.6174
 epoch: 17, train_loss: 0.5819, test_loss: 1.0793, test_f1: 0.6026
 epoch: 18, train_loss: 0.5798, test_loss: 1.3682, test_f1: 0.5356
 epoch: 19, train_loss: 0.5681, test_loss: 1.2201, test_f1: 0.5981
 epoch: 20, train_loss: 0.6011, test_loss: 1.4830, test_f1: 0.4713
 epoch: 21, train_loss: 0.5595, test_loss: 1.1480, test_f1: 0.6043
 epoch: 22, train_loss: 0.5314, test_loss: 1.2034, test_f1: 0.6153
 epoch: 23, train_loss: 0.5219, test_loss: 1.2954, test_f1: 0.5986
 epoch: 24, train_loss: 0.5343, test_loss: 1.2751, test_f1: 0.5580
 epoch: 25, train_loss: 0.5075, test_loss: 1.0707, test_f1: 0.6276
 epoch: 26, train_loss: 0.4775, test_loss: 1.6190, test_f1: 0.5618
 epoch: 27, train_loss: 0.4656, test_loss: 1.3625, test_f1: 0.6104
 epoch: 28, train_loss: 0.4471, test_loss: 1.4416, test_f1: 0.6091
 epoch: 29, train_loss: 0.4688, test_loss: 1.3107, test_f1: 0.5302
 epoch: 30, train_loss: 0.4905, test_loss: 1.2904, test_f1: 0.6491
 epoch: 31, train_loss: 0.4189, test_loss: 1.2894, test_f1: 0.6514
 epoch: 32, train_loss: 0.4554, test_loss: 1.3610, test_f1: 0.6091
 epoch: 33, train_loss: 0.4130, test_loss: 1.4308, test_f1: 0.5626
 epoch: 34, train_loss: 0.4287, test_loss: 1.4255, test_f1: 0.6407
 epoch: 35, train_loss: 0.3876, test_loss: 1.5857, test_f1: 0.6144
 epoch: 36, train_loss: 0.3896, test_loss: 1.5217, test_f1: 0.6179
 epoch: 37, train_loss: 0.4150, test_loss: 1.6155, test_f1: 0.6073
 epoch: 38, train_loss: 0.3555, test_loss: 1.4650, test_f1: 0.6630
 epoch: 39, train_loss: 0.3357, test_loss: 1.6934, test_f1: 0.6203
 epoch: 40, train_loss: 0.3572, test_loss: 1.7283, test_f1: 0.5644
 epoch: 41, train_loss: 0.3718, test_loss: 1.4693, test_f1: 0.6472
 epoch: 42, train_loss: 0.3592, test_loss: 1.7521, test_f1: 0.5636
 epoch: 43, train_loss: 0.3357, test_loss: 1.6818, test_f1: 0.6444
 epoch: 44, train_loss: 0.3399, test_loss: 1.7744, test_f1: 0.5380
 epoch: 45, train_loss: 0.3572, test_loss: 1.6496, test_f1: 0.6036
 epoch: 46, train_loss: 0.3233, test_loss: 1.6423, test_f1: 0.6461
 epoch: 47, train_loss: 0.3222, test_loss: 1.7007, test_f1: 0.5733
 epoch: 48, train_loss: 0.2960, test_loss: 1.7113, test_f1: 0.6151
 epoch: 49, train_loss: 0.3014, test_loss: 1.5990, test_f1: 0.6154
 epoch: 50, train_loss: 0.2803, test_loss: 1.9660, test_f1: 0.5730
 epoch: 51, train_loss: 0.2633, test_loss: 1.7533, test_f1: 0.5983
 epoch: 52, train_loss: 0.2155, test_loss: 1.9040, test_f1: 0.6191
 epoch: 53, train_loss: 0.2198, test_loss: 2.0123, test_f1: 0.6015
 epoch: 54, train_loss: 0.2299, test_loss: 1.7899, test_f1: 0.6277
 epoch: 55, train_loss: 0.2123, test_loss: 2.0423, test_f1: 0.5853
 epoch: 56, train_loss: 0.1669, test_loss: 1.9634, test_f1: 0.6266
 epoch: 57, train_loss: 0.1956, test_loss: 2.0377, test_f1: 0.5906
 epoch: 58, train_loss: 0.1904, test_loss: 2.1953, test_f1: 0.6112
 epoch: 59, train_loss: 0.1898, test_loss: 2.1465, test_f1: 0.6347
 epoch: 60, train_loss: 0.1758, test_loss: 2.3903, test_f1: 0.5941
 epoch: 61, train_loss: 0.2192, test_loss: 2.0329, test_f1: 0.6118
 epoch: 62, train_loss: 0.1676, test_loss: 2.2889, test_f1: 0.5937
 epoch: 63, train_loss: 0.1735, test_loss: 2.4026, test_f1: 0.5803
 epoch: 64, train_loss: 0.2029, test_loss: 2.1591, test_f1: 0.5929
 epoch: 65, train_loss: 0.1532, test_loss: 2.3277, test_f1: 0.6004
 epoch: 66, train_loss: 0.1797, test_loss: 2.3025, test_f1: 0.5963
 epoch: 67, train_loss: 0.1838, test_loss: 2.3905, test_f1: 0.5934
 epoch: 68, train_loss: 0.1457, test_loss: 2.5089, test_f1: 0.5712
 epoch: 69, train_loss: 0.1667, test_loss: 2.4191, test_f1: 0.5994
 epoch: 70, train_loss: 0.1652, test_loss: 2.6164, test_f1: 0.5895
 epoch: 71, train_loss: 0.1830, test_loss: 2.3809, test_f1: 0.6273
 epoch: 72, train_loss: 0.1600, test_loss: 2.3567, test_f1: 0.6127
 epoch: 73, train_loss: 0.1465, test_loss: 2.5691, test_f1: 0.5926
 epoch: 74, train_loss: 0.1442, test_loss: 2.6325, test_f1: 0.6003
 epoch: 75, train_loss: 0.1423, test_loss: 2.5157, test_f1: 0.5927
 epoch: 76, train_loss: 0.1265, test_loss: 2.4531, test_f1: 0.6186
 epoch: 77, train_loss: 0.1639, test_loss: 2.5767, test_f1: 0.6141
 epoch: 78, train_loss: 0.1394, test_loss: 2.5070, test_f1: 0.6194
 epoch: 79, train_loss: 0.1301, test_loss: 2.4519, test_f1: 0.5969
 epoch: 80, train_loss: 0.1437, test_loss: 2.5116, test_f1: 0.6023
 epoch: 81, train_loss: 0.1302, test_loss: 2.6603, test_f1: 0.5951
 epoch: 82, train_loss: 0.1312, test_loss: 2.5518, test_f1: 0.6348
 epoch: 83, train_loss: 0.1620, test_loss: 2.7898, test_f1: 0.6009
 epoch: 84, train_loss: 0.1515, test_loss: 2.6528, test_f1: 0.6158
 epoch: 85, train_loss: 0.1520, test_loss: 2.7506, test_f1: 0.5985
 epoch: 86, train_loss: 0.1498, test_loss: 2.6351, test_f1: 0.5839
 epoch: 87, train_loss: 0.1538, test_loss: 2.5437, test_f1: 0.6221
 epoch: 88, train_loss: 0.1154, test_loss: 2.9910, test_f1: 0.5510
 epoch: 89, train_loss: 0.1033, test_loss: 2.5964, test_f1: 0.6058
 epoch: 90, train_loss: 0.1510, test_loss: 2.9563, test_f1: 0.5768
 epoch: 91, train_loss: 0.1330, test_loss: 2.6390, test_f1: 0.5810
 epoch: 92, train_loss: 0.1070, test_loss: 2.8368, test_f1: 0.6061
 epoch: 93, train_loss: 0.1305, test_loss: 2.7129, test_f1: 0.5990
 epoch: 94, train_loss: 0.1555, test_loss: 2.6575, test_f1: 0.6095
 epoch: 95, train_loss: 0.1195, test_loss: 2.8138, test_f1: 0.5991
 epoch: 96, train_loss: 0.1448, test_loss: 2.7303, test_f1: 0.5990
 epoch: 97, train_loss: 0.1296, test_loss: 2.9703, test_f1: 0.5684
 epoch: 98, train_loss: 0.0997, test_loss: 2.6014, test_f1: 0.5980
 epoch: 99, train_loss: 0.1194, test_loss: 2.9667, test_f1: 0.5883
##################ITERATION #7 ****************************************
 epoch: 0, train_loss: 1.3113, test_loss: 1.3461, test_f1: 0.2571
 epoch: 1, train_loss: 1.0003, test_loss: 1.0263, test_f1: 0.5215
 epoch: 2, train_loss: 0.9436, test_loss: 1.1168, test_f1: 0.4908
 epoch: 3, train_loss: 0.8792, test_loss: 1.0914, test_f1: 0.5473
 epoch: 4, train_loss: 0.8791, test_loss: 0.9937, test_f1: 0.5515
 epoch: 5, train_loss: 0.8254, test_loss: 0.9808, test_f1: 0.6011
 epoch: 6, train_loss: 0.8061, test_loss: 1.0416, test_f1: 0.5412
 epoch: 7, train_loss: 0.7732, test_loss: 1.0707, test_f1: 0.5855
 epoch: 8, train_loss: 0.7463, test_loss: 1.0610, test_f1: 0.5566
 epoch: 9, train_loss: 0.7230, test_loss: 1.1208, test_f1: 0.5911
 epoch: 10, train_loss: 0.7270, test_loss: 1.0991, test_f1: 0.5461
 epoch: 11, train_loss: 0.6745, test_loss: 1.1451, test_f1: 0.6075
 epoch: 12, train_loss: 0.6811, test_loss: 1.1467, test_f1: 0.5569
 epoch: 13, train_loss: 0.6528, test_loss: 1.2000, test_f1: 0.5997
 epoch: 14, train_loss: 0.6133, test_loss: 1.2204, test_f1: 0.6323
 epoch: 15, train_loss: 0.6258, test_loss: 1.2157, test_f1: 0.5695
 epoch: 16, train_loss: 0.5906, test_loss: 1.1663, test_f1: 0.5960
 epoch: 17, train_loss: 0.6006, test_loss: 1.4972, test_f1: 0.5972
 epoch: 18, train_loss: 0.6046, test_loss: 1.0900, test_f1: 0.5925
 epoch: 19, train_loss: 0.5942, test_loss: 1.2153, test_f1: 0.6133
 epoch: 20, train_loss: 0.5685, test_loss: 1.2060, test_f1: 0.6136
 epoch: 21, train_loss: 0.6012, test_loss: 1.3289, test_f1: 0.5854
 epoch: 22, train_loss: 0.5447, test_loss: 1.3618, test_f1: 0.5727
 epoch: 23, train_loss: 0.5532, test_loss: 1.1810, test_f1: 0.6350
 epoch: 24, train_loss: 0.5773, test_loss: 1.1671, test_f1: 0.6396
 epoch: 25, train_loss: 0.5381, test_loss: 1.3097, test_f1: 0.6425
 epoch: 26, train_loss: 0.5247, test_loss: 1.3758, test_f1: 0.5826
 epoch: 27, train_loss: 0.5216, test_loss: 1.2940, test_f1: 0.6346
 epoch: 28, train_loss: 0.5051, test_loss: 1.3417, test_f1: 0.6422
 epoch: 29, train_loss: 0.4680, test_loss: 1.5904, test_f1: 0.5970
 epoch: 30, train_loss: 0.4778, test_loss: 1.6307, test_f1: 0.5725
 epoch: 31, train_loss: 0.4428, test_loss: 1.4892, test_f1: 0.6344
 epoch: 32, train_loss: 0.4434, test_loss: 1.4592, test_f1: 0.6194
 epoch: 33, train_loss: 0.4285, test_loss: 1.5600, test_f1: 0.6356
 epoch: 34, train_loss: 0.3888, test_loss: 1.5928, test_f1: 0.6423
 epoch: 35, train_loss: 0.3845, test_loss: 1.6779, test_f1: 0.5985
 epoch: 36, train_loss: 0.4060, test_loss: 1.5483, test_f1: 0.6117
 epoch: 37, train_loss: 0.3987, test_loss: 1.6603, test_f1: 0.6268
 epoch: 38, train_loss: 0.4222, test_loss: 1.5329, test_f1: 0.6159
 epoch: 39, train_loss: 0.4037, test_loss: 1.5251, test_f1: 0.6150
 epoch: 40, train_loss: 0.4029, test_loss: 1.6545, test_f1: 0.5974
 epoch: 41, train_loss: 0.3744, test_loss: 1.6549, test_f1: 0.5951
 epoch: 42, train_loss: 0.3364, test_loss: 1.7898, test_f1: 0.6341
 epoch: 43, train_loss: 0.3292, test_loss: 1.7539, test_f1: 0.6156
 epoch: 44, train_loss: 0.3496, test_loss: 1.6646, test_f1: 0.5703
 epoch: 45, train_loss: 0.3173, test_loss: 1.8501, test_f1: 0.6024
 epoch: 46, train_loss: 0.3587, test_loss: 1.7916, test_f1: 0.5781
 epoch: 47, train_loss: 0.3190, test_loss: 1.9447, test_f1: 0.6376
 epoch: 48, train_loss: 0.3070, test_loss: 1.9338, test_f1: 0.5879
 epoch: 49, train_loss: 0.3243, test_loss: 1.8323, test_f1: 0.5885
 epoch: 50, train_loss: 0.2952, test_loss: 1.9236, test_f1: 0.5760
 epoch: 51, train_loss: 0.2585, test_loss: 1.9336, test_f1: 0.6015
 epoch: 52, train_loss: 0.2404, test_loss: 1.9983, test_f1: 0.5968
 epoch: 53, train_loss: 0.2029, test_loss: 2.1322, test_f1: 0.6373
 epoch: 54, train_loss: 0.2363, test_loss: 2.0803, test_f1: 0.5873
 epoch: 55, train_loss: 0.2040, test_loss: 2.1852, test_f1: 0.5723
 epoch: 56, train_loss: 0.1786, test_loss: 2.3272, test_f1: 0.6067
 epoch: 57, train_loss: 0.2052, test_loss: 2.3977, test_f1: 0.5801
 epoch: 58, train_loss: 0.1811, test_loss: 2.2132, test_f1: 0.6018
 epoch: 59, train_loss: 0.1698, test_loss: 2.3591, test_f1: 0.5948
 epoch: 60, train_loss: 0.1795, test_loss: 2.3585, test_f1: 0.5733
 epoch: 61, train_loss: 0.1698, test_loss: 2.3260, test_f1: 0.5861
 epoch: 62, train_loss: 0.1701, test_loss: 2.5641, test_f1: 0.5823
 epoch: 63, train_loss: 0.2319, test_loss: 2.1881, test_f1: 0.6076
 epoch: 64, train_loss: 0.1687, test_loss: 2.4198, test_f1: 0.5824
 epoch: 65, train_loss: 0.1717, test_loss: 2.3894, test_f1: 0.5899
 epoch: 66, train_loss: 0.1886, test_loss: 2.5290, test_f1: 0.5861
 epoch: 67, train_loss: 0.1838, test_loss: 2.4518, test_f1: 0.5730
 epoch: 68, train_loss: 0.1692, test_loss: 2.4832, test_f1: 0.6032
 epoch: 69, train_loss: 0.1587, test_loss: 2.4989, test_f1: 0.5663
 epoch: 70, train_loss: 0.1696, test_loss: 2.5373, test_f1: 0.5745
 epoch: 71, train_loss: 0.1528, test_loss: 2.5197, test_f1: 0.5828
 epoch: 72, train_loss: 0.1986, test_loss: 2.3776, test_f1: 0.5943
 epoch: 73, train_loss: 0.1672, test_loss: 2.5512, test_f1: 0.5790
 epoch: 74, train_loss: 0.1462, test_loss: 2.6563, test_f1: 0.5772
 epoch: 75, train_loss: 0.1287, test_loss: 2.7673, test_f1: 0.5758
 epoch: 76, train_loss: 0.1406, test_loss: 2.7688, test_f1: 0.5915
 epoch: 77, train_loss: 0.1290, test_loss: 3.1083, test_f1: 0.5742
 epoch: 78, train_loss: 0.1400, test_loss: 2.7760, test_f1: 0.5820
 epoch: 79, train_loss: 0.1469, test_loss: 2.9194, test_f1: 0.5799
 epoch: 80, train_loss: 0.1623, test_loss: 2.8148, test_f1: 0.5909
 epoch: 81, train_loss: 0.1557, test_loss: 3.0438, test_f1: 0.5862
 epoch: 82, train_loss: 0.1473, test_loss: 3.0390, test_f1: 0.5512
 epoch: 83, train_loss: 0.1310, test_loss: 2.9071, test_f1: 0.5730
 epoch: 84, train_loss: 0.1388, test_loss: 2.8780, test_f1: 0.5769
 epoch: 85, train_loss: 0.1762, test_loss: 2.8284, test_f1: 0.5838
 epoch: 86, train_loss: 0.1486, test_loss: 2.9887, test_f1: 0.5553
 epoch: 87, train_loss: 0.1224, test_loss: 2.8218, test_f1: 0.5760
 epoch: 88, train_loss: 0.1479, test_loss: 2.7454, test_f1: 0.5680
 epoch: 89, train_loss: 0.1134, test_loss: 2.9308, test_f1: 0.5812
 epoch: 90, train_loss: 0.1124, test_loss: 2.9743, test_f1: 0.5802
 epoch: 91, train_loss: 0.1261, test_loss: 2.8468, test_f1: 0.5763
 epoch: 92, train_loss: 0.1013, test_loss: 3.0469, test_f1: 0.5769
 epoch: 93, train_loss: 0.1102, test_loss: 3.1028, test_f1: 0.5812
 epoch: 94, train_loss: 0.1178, test_loss: 3.0586, test_f1: 0.5644
 epoch: 95, train_loss: 0.1234, test_loss: 3.1990, test_f1: 0.5763
 epoch: 96, train_loss: 0.1117, test_loss: 3.1543, test_f1: 0.5727
 epoch: 97, train_loss: 0.1357, test_loss: 3.0004, test_f1: 0.5689
 epoch: 98, train_loss: 0.0939, test_loss: 3.3621, test_f1: 0.5333
 epoch: 99, train_loss: 0.1117, test_loss: 3.2191, test_f1: 0.5760
##################ITERATION #8 ****************************************
 epoch: 0, train_loss: 1.2963, test_loss: 1.3496, test_f1: 0.3643
 epoch: 1, train_loss: 1.0221, test_loss: 1.0702, test_f1: 0.5335
 epoch: 2, train_loss: 0.9608, test_loss: 1.1342, test_f1: 0.5276
 epoch: 3, train_loss: 0.9086, test_loss: 1.0569, test_f1: 0.5026
 epoch: 4, train_loss: 0.8608, test_loss: 1.0494, test_f1: 0.5406
 epoch: 5, train_loss: 0.8441, test_loss: 1.1018, test_f1: 0.5102
 epoch: 6, train_loss: 0.8017, test_loss: 1.1035, test_f1: 0.5249
 epoch: 7, train_loss: 0.7903, test_loss: 1.0967, test_f1: 0.5540
 epoch: 8, train_loss: 0.7624, test_loss: 1.1204, test_f1: 0.5598
 epoch: 9, train_loss: 0.7467, test_loss: 1.3053, test_f1: 0.4860
 epoch: 10, train_loss: 0.7319, test_loss: 1.0590, test_f1: 0.5556
 epoch: 11, train_loss: 0.6921, test_loss: 1.1824, test_f1: 0.5875
 epoch: 12, train_loss: 0.6916, test_loss: 1.0875, test_f1: 0.5840
 epoch: 13, train_loss: 0.6711, test_loss: 1.2004, test_f1: 0.5749
 epoch: 14, train_loss: 0.6591, test_loss: 1.1630, test_f1: 0.5930
 epoch: 15, train_loss: 0.6184, test_loss: 1.3299, test_f1: 0.5672
 epoch: 16, train_loss: 0.6293, test_loss: 1.1187, test_f1: 0.6012
 epoch: 17, train_loss: 0.5933, test_loss: 1.1889, test_f1: 0.5957
 epoch: 18, train_loss: 0.5978, test_loss: 1.2631, test_f1: 0.5863
 epoch: 19, train_loss: 0.5842, test_loss: 1.2107, test_f1: 0.5837
 epoch: 20, train_loss: 0.5534, test_loss: 1.3359, test_f1: 0.6011
 epoch: 21, train_loss: 0.5433, test_loss: 1.2634, test_f1: 0.6244
 epoch: 22, train_loss: 0.5012, test_loss: 1.3431, test_f1: 0.5933
 epoch: 23, train_loss: 0.5379, test_loss: 1.3540, test_f1: 0.6177
 epoch: 24, train_loss: 0.4968, test_loss: 1.5409, test_f1: 0.5389
 epoch: 25, train_loss: 0.5113, test_loss: 1.2090, test_f1: 0.6207
 epoch: 26, train_loss: 0.5235, test_loss: 1.2933, test_f1: 0.6115
 epoch: 27, train_loss: 0.4688, test_loss: 1.5434, test_f1: 0.5901
 epoch: 28, train_loss: 0.4969, test_loss: 1.3613, test_f1: 0.5984
 epoch: 29, train_loss: 0.4743, test_loss: 1.2564, test_f1: 0.6129
 epoch: 30, train_loss: 0.4485, test_loss: 1.4324, test_f1: 0.6250
 epoch: 31, train_loss: 0.4559, test_loss: 1.5080, test_f1: 0.5605
 epoch: 32, train_loss: 0.4198, test_loss: 1.4356, test_f1: 0.6120
 epoch: 33, train_loss: 0.4540, test_loss: 1.5470, test_f1: 0.5803
 epoch: 34, train_loss: 0.3992, test_loss: 1.3794, test_f1: 0.6231
 epoch: 35, train_loss: 0.4320, test_loss: 1.3777, test_f1: 0.6070
 epoch: 36, train_loss: 0.3826, test_loss: 1.4578, test_f1: 0.6158
 epoch: 37, train_loss: 0.3932, test_loss: 1.4539, test_f1: 0.6339
 epoch: 38, train_loss: 0.4155, test_loss: 1.4869, test_f1: 0.6026
 epoch: 39, train_loss: 0.4154, test_loss: 1.6345, test_f1: 0.5951
 epoch: 40, train_loss: 0.3744, test_loss: 1.4451, test_f1: 0.6374
 epoch: 41, train_loss: 0.3442, test_loss: 1.6377, test_f1: 0.6086
 epoch: 42, train_loss: 0.3798, test_loss: 1.6645, test_f1: 0.6115
 epoch: 43, train_loss: 0.3412, test_loss: 1.5764, test_f1: 0.6139
 epoch: 44, train_loss: 0.2966, test_loss: 1.7034, test_f1: 0.5867
 epoch: 45, train_loss: 0.3033, test_loss: 1.7740, test_f1: 0.6245
 epoch: 46, train_loss: 0.3319, test_loss: 1.5969, test_f1: 0.6186
 epoch: 47, train_loss: 0.3499, test_loss: 1.5548, test_f1: 0.6268
 epoch: 48, train_loss: 0.3360, test_loss: 1.7050, test_f1: 0.6187
 epoch: 49, train_loss: 0.2863, test_loss: 1.6059, test_f1: 0.6335
 epoch: 50, train_loss: 0.2754, test_loss: 1.8038, test_f1: 0.6483
 epoch: 51, train_loss: 0.2376, test_loss: 1.8847, test_f1: 0.6356
 epoch: 52, train_loss: 0.2225, test_loss: 1.9096, test_f1: 0.6365
 epoch: 53, train_loss: 0.2181, test_loss: 1.8959, test_f1: 0.6152
 epoch: 54, train_loss: 0.2088, test_loss: 2.0746, test_f1: 0.6033
 epoch: 55, train_loss: 0.1970, test_loss: 2.3130, test_f1: 0.5683
 epoch: 56, train_loss: 0.1883, test_loss: 2.1735, test_f1: 0.6053
 epoch: 57, train_loss: 0.2041, test_loss: 1.9903, test_f1: 0.6327
 epoch: 58, train_loss: 0.1971, test_loss: 2.0052, test_f1: 0.6249
 epoch: 59, train_loss: 0.1895, test_loss: 2.2415, test_f1: 0.6148
 epoch: 60, train_loss: 0.1913, test_loss: 2.2730, test_f1: 0.5875
 epoch: 61, train_loss: 0.2120, test_loss: 2.0174, test_f1: 0.5909
 epoch: 62, train_loss: 0.1676, test_loss: 2.1292, test_f1: 0.6185
 epoch: 63, train_loss: 0.1598, test_loss: 2.3475, test_f1: 0.5970
 epoch: 64, train_loss: 0.2134, test_loss: 2.2254, test_f1: 0.6101
 epoch: 65, train_loss: 0.1611, test_loss: 2.2732, test_f1: 0.6148
 epoch: 66, train_loss: 0.1654, test_loss: 2.4589, test_f1: 0.6053
 epoch: 67, train_loss: 0.1682, test_loss: 2.5189, test_f1: 0.5819
 epoch: 68, train_loss: 0.1802, test_loss: 2.1650, test_f1: 0.6114
 epoch: 69, train_loss: 0.1817, test_loss: 2.4870, test_f1: 0.5532
 epoch: 70, train_loss: 0.1430, test_loss: 2.3386, test_f1: 0.6208
 epoch: 71, train_loss: 0.1685, test_loss: 2.2878, test_f1: 0.6194
 epoch: 72, train_loss: 0.1319, test_loss: 2.4315, test_f1: 0.6289
 epoch: 73, train_loss: 0.1364, test_loss: 2.5138, test_f1: 0.6066
 epoch: 74, train_loss: 0.1255, test_loss: 2.5459, test_f1: 0.6289
 epoch: 75, train_loss: 0.1313, test_loss: 2.5682, test_f1: 0.5886
 epoch: 76, train_loss: 0.1233, test_loss: 2.4076, test_f1: 0.6249
 epoch: 77, train_loss: 0.1479, test_loss: 2.4057, test_f1: 0.6098
 epoch: 78, train_loss: 0.1550, test_loss: 2.3942, test_f1: 0.6238
 epoch: 79, train_loss: 0.1471, test_loss: 2.4630, test_f1: 0.5954
 epoch: 80, train_loss: 0.1007, test_loss: 2.5019, test_f1: 0.6462
 epoch: 81, train_loss: 0.1186, test_loss: 2.6307, test_f1: 0.6145
 epoch: 82, train_loss: 0.1358, test_loss: 2.6846, test_f1: 0.5964
 epoch: 83, train_loss: 0.1461, test_loss: 2.6515, test_f1: 0.5675
 epoch: 84, train_loss: 0.1444, test_loss: 2.5897, test_f1: 0.5867
 epoch: 85, train_loss: 0.1331, test_loss: 2.7497, test_f1: 0.5728
 epoch: 86, train_loss: 0.1517, test_loss: 2.7835, test_f1: 0.5749
 epoch: 87, train_loss: 0.1536, test_loss: 2.3710, test_f1: 0.6215
 epoch: 88, train_loss: 0.1422, test_loss: 2.6965, test_f1: 0.6025
 epoch: 89, train_loss: 0.1283, test_loss: 2.6501, test_f1: 0.5807
 epoch: 90, train_loss: 0.1432, test_loss: 2.2630, test_f1: 0.6143
 epoch: 91, train_loss: 0.1270, test_loss: 2.6050, test_f1: 0.5770
 epoch: 92, train_loss: 0.1047, test_loss: 2.6197, test_f1: 0.6015
 epoch: 93, train_loss: 0.1691, test_loss: 2.5835, test_f1: 0.5983
 epoch: 94, train_loss: 0.1122, test_loss: 2.4049, test_f1: 0.5980
 epoch: 95, train_loss: 0.1383, test_loss: 2.4295, test_f1: 0.6291
 epoch: 96, train_loss: 0.1164, test_loss: 2.5434, test_f1: 0.6207
 epoch: 97, train_loss: 0.1562, test_loss: 3.2018, test_f1: 0.5284
 epoch: 98, train_loss: 0.1416, test_loss: 2.8510, test_f1: 0.5928
 epoch: 99, train_loss: 0.1417, test_loss: 2.7391, test_f1: 0.5984
##################ITERATION #9 ****************************************
 epoch: 0, train_loss: 1.3302, test_loss: 1.3139, test_f1: 0.4478
 epoch: 1, train_loss: 1.0080, test_loss: 1.0787, test_f1: 0.5309
 epoch: 2, train_loss: 0.9437, test_loss: 1.0967, test_f1: 0.5348
 epoch: 3, train_loss: 0.8998, test_loss: 1.0808, test_f1: 0.5509
 epoch: 4, train_loss: 0.8523, test_loss: 1.0470, test_f1: 0.4957
 epoch: 5, train_loss: 0.8419, test_loss: 1.0318, test_f1: 0.5681
 epoch: 6, train_loss: 0.7913, test_loss: 1.1066, test_f1: 0.5398
 epoch: 7, train_loss: 0.7962, test_loss: 1.0333, test_f1: 0.5498
 epoch: 8, train_loss: 0.7751, test_loss: 1.0981, test_f1: 0.5616
 epoch: 9, train_loss: 0.7638, test_loss: 1.0187, test_f1: 0.6245
 epoch: 10, train_loss: 0.7679, test_loss: 1.1753, test_f1: 0.5741
 epoch: 11, train_loss: 0.7265, test_loss: 0.9738, test_f1: 0.6531
 epoch: 12, train_loss: 0.6713, test_loss: 1.1048, test_f1: 0.5795
 epoch: 13, train_loss: 0.6703, test_loss: 1.0917, test_f1: 0.5989
 epoch: 14, train_loss: 0.6719, test_loss: 0.9345, test_f1: 0.6638
 epoch: 15, train_loss: 0.6152, test_loss: 1.1153, test_f1: 0.5911
 epoch: 16, train_loss: 0.6169, test_loss: 1.0034, test_f1: 0.6056
 epoch: 17, train_loss: 0.5959, test_loss: 1.1088, test_f1: 0.6163
 epoch: 18, train_loss: 0.5668, test_loss: 1.0864, test_f1: 0.6615
 epoch: 19, train_loss: 0.5806, test_loss: 1.1843, test_f1: 0.6002
 epoch: 20, train_loss: 0.5647, test_loss: 1.1723, test_f1: 0.6214
 epoch: 21, train_loss: 0.5230, test_loss: 1.1473, test_f1: 0.6020
 epoch: 22, train_loss: 0.5310, test_loss: 1.1846, test_f1: 0.6166
 epoch: 23, train_loss: 0.5363, test_loss: 1.1384, test_f1: 0.6400
 epoch: 24, train_loss: 0.5273, test_loss: 1.1589, test_f1: 0.6317
 epoch: 25, train_loss: 0.4832, test_loss: 1.1541, test_f1: 0.6446
 epoch: 26, train_loss: 0.5046, test_loss: 1.1729, test_f1: 0.6088
 epoch: 27, train_loss: 0.4669, test_loss: 1.1794, test_f1: 0.6187
 epoch: 28, train_loss: 0.4582, test_loss: 1.4480, test_f1: 0.5884
 epoch: 29, train_loss: 0.4986, test_loss: 1.1922, test_f1: 0.6111
 epoch: 30, train_loss: 0.5000, test_loss: 1.1655, test_f1: 0.6790
 epoch: 31, train_loss: 0.4322, test_loss: 1.3843, test_f1: 0.6105
 epoch: 32, train_loss: 0.4466, test_loss: 1.2280, test_f1: 0.6419
 epoch: 33, train_loss: 0.4191, test_loss: 1.2381, test_f1: 0.6361
 epoch: 34, train_loss: 0.3640, test_loss: 1.2665, test_f1: 0.6518
 epoch: 35, train_loss: 0.4171, test_loss: 1.2951, test_f1: 0.6392
 epoch: 36, train_loss: 0.3954, test_loss: 1.3912, test_f1: 0.6120
 epoch: 37, train_loss: 0.3996, test_loss: 1.2083, test_f1: 0.6220
 epoch: 38, train_loss: 0.4031, test_loss: 1.3954, test_f1: 0.6532
 epoch: 39, train_loss: 0.3977, test_loss: 1.3346, test_f1: 0.6766
 epoch: 40, train_loss: 0.3610, test_loss: 1.6371, test_f1: 0.6066
 epoch: 41, train_loss: 0.3540, test_loss: 1.6230, test_f1: 0.5908
 epoch: 42, train_loss: 0.3198, test_loss: 1.5744, test_f1: 0.6236
 epoch: 43, train_loss: 0.3613, test_loss: 1.4175, test_f1: 0.6268
 epoch: 44, train_loss: 0.3472, test_loss: 1.5212, test_f1: 0.6599
 epoch: 45, train_loss: 0.3578, test_loss: 1.5221, test_f1: 0.6419
 epoch: 46, train_loss: 0.3187, test_loss: 1.5790, test_f1: 0.5952
 epoch: 47, train_loss: 0.3011, test_loss: 1.5932, test_f1: 0.6215
 epoch: 48, train_loss: 0.3245, test_loss: 1.5620, test_f1: 0.6329
 epoch: 49, train_loss: 0.3100, test_loss: 1.4678, test_f1: 0.6543
 epoch: 50, train_loss: 0.2826, test_loss: 1.4790, test_f1: 0.6572
 epoch: 51, train_loss: 0.2453, test_loss: 1.6180, test_f1: 0.6338
 epoch: 52, train_loss: 0.2118, test_loss: 1.6802, test_f1: 0.6706
 epoch: 53, train_loss: 0.2205, test_loss: 1.6646, test_f1: 0.6455
 epoch: 54, train_loss: 0.1935, test_loss: 1.7426, test_f1: 0.6459
 epoch: 55, train_loss: 0.1893, test_loss: 1.7462, test_f1: 0.6705
 epoch: 56, train_loss: 0.1954, test_loss: 1.8113, test_f1: 0.6827
 epoch: 57, train_loss: 0.2046, test_loss: 1.8890, test_f1: 0.6428
 epoch: 58, train_loss: 0.1879, test_loss: 1.7618, test_f1: 0.6593
 epoch: 59, train_loss: 0.1974, test_loss: 1.9151, test_f1: 0.6182
 epoch: 60, train_loss: 0.1850, test_loss: 1.8286, test_f1: 0.6566
 epoch: 61, train_loss: 0.1965, test_loss: 1.8554, test_f1: 0.6532
 epoch: 62, train_loss: 0.1597, test_loss: 1.9172, test_f1: 0.6361
 epoch: 63, train_loss: 0.1545, test_loss: 2.1080, test_f1: 0.6432
 epoch: 64, train_loss: 0.1788, test_loss: 1.8795, test_f1: 0.6487
 epoch: 65, train_loss: 0.1847, test_loss: 1.9911, test_f1: 0.6624
 epoch: 66, train_loss: 0.2046, test_loss: 1.8292, test_f1: 0.6422
 epoch: 67, train_loss: 0.1901, test_loss: 1.9299, test_f1: 0.6447
 epoch: 68, train_loss: 0.1663, test_loss: 1.9831, test_f1: 0.6594
 epoch: 69, train_loss: 0.1717, test_loss: 1.9557, test_f1: 0.6342
 epoch: 70, train_loss: 0.1568, test_loss: 1.9557, test_f1: 0.6473
 epoch: 71, train_loss: 0.1617, test_loss: 2.2405, test_f1: 0.6169
 epoch: 72, train_loss: 0.1554, test_loss: 1.8671, test_f1: 0.6458
 epoch: 73, train_loss: 0.1494, test_loss: 1.9198, test_f1: 0.6332
 epoch: 74, train_loss: 0.1512, test_loss: 2.0894, test_f1: 0.6244
 epoch: 75, train_loss: 0.1398, test_loss: 2.1634, test_f1: 0.6232
 epoch: 76, train_loss: 0.1588, test_loss: 2.0770, test_f1: 0.6528
 epoch: 77, train_loss: 0.1327, test_loss: 2.0993, test_f1: 0.6315
 epoch: 78, train_loss: 0.1218, test_loss: 2.0629, test_f1: 0.6338
 epoch: 79, train_loss: 0.1753, test_loss: 2.0771, test_f1: 0.6460
 epoch: 80, train_loss: 0.1278, test_loss: 2.3062, test_f1: 0.6330
 epoch: 81, train_loss: 0.1466, test_loss: 2.1749, test_f1: 0.6492
 epoch: 82, train_loss: 0.1771, test_loss: 2.2807, test_f1: 0.6451
 epoch: 83, train_loss: 0.1388, test_loss: 2.3013, test_f1: 0.6128
 epoch: 84, train_loss: 0.1169, test_loss: 2.3328, test_f1: 0.6360
 epoch: 85, train_loss: 0.1269, test_loss: 2.3094, test_f1: 0.6400
 epoch: 86, train_loss: 0.1537, test_loss: 2.4309, test_f1: 0.6199
 epoch: 87, train_loss: 0.1227, test_loss: 2.2271, test_f1: 0.6466
 epoch: 88, train_loss: 0.1236, test_loss: 2.2486, test_f1: 0.6503
 epoch: 89, train_loss: 0.1478, test_loss: 2.3771, test_f1: 0.6752
 epoch: 90, train_loss: 0.1260, test_loss: 2.3564, test_f1: 0.6409
 epoch: 91, train_loss: 0.1449, test_loss: 2.2284, test_f1: 0.6234
 epoch: 92, train_loss: 0.1058, test_loss: 2.4148, test_f1: 0.6171
 epoch: 93, train_loss: 0.1342, test_loss: 2.2927, test_f1: 0.6526
 epoch: 94, train_loss: 0.1305, test_loss: 2.5796, test_f1: 0.6171
 epoch: 95, train_loss: 0.1070, test_loss: 2.5519, test_f1: 0.6064
 epoch: 96, train_loss: 0.1112, test_loss: 2.4847, test_f1: 0.6341
 epoch: 97, train_loss: 0.1236, test_loss: 2.3644, test_f1: 0.6384
 epoch: 98, train_loss: 0.1384, test_loss: 2.8142, test_f1: 0.6285
 epoch: 99, train_loss: 0.1113, test_loss: 2.6391, test_f1: 0.6274

Training completed in 804.05 seconds
Best F1: 0.6827 at epoch 56
Mean F1 across iterations: 0.6604  0.0136
========================FINAL RESULTS================================
FEGIN weighted F1: 0.6827  0.0136
python main.py --data ltspice_demos --representation component_pin_net --model FEGIN --layers 6 --hiddens 128 --batch_size 32 --lr 0.001 --emb_size 128 --epochs 100 --save_appendix component_pin_net_L6_H128_BS32_LR0.001_E128 --no_val
-----



STDERR:
  File "main.py", line 370, in <module>
    main()
  File "main.py", line 254, in main
    dataset = dataset_class(
  File "/home/philip/projects/ltspice_examples_code_repo/Circuit-Completion-Using-GNNs/component_classification_with_link_prediction_head/evaluation/FEGIN/kernel/circuit_datasets.py", line 15, in __init__
    self.data, self.slices = torch.load(self.processed_paths[0])
  File "/home/philip/.local/lib/python3.8/site-packages/torch/serialization.py", line 1040, in load
    warnings.warn(
  File "/usr/lib/python3.8/warnings.py", line 109, in _showwarnmsg
    sw(msg.message, msg.category, msg.filename, msg.lineno,
  File "main.py", line 47, in warn_with_traceback
    traceback.print_stack(file=log)
/home/philip/projects/ltspice_examples_code_repo/Circuit-Completion-Using-GNNs/component_classification_with_link_prediction_head/evaluation/FEGIN/kernel/circuit_datasets.py:15: FutureWarning: You are using `torch.load` with `weights_only=False` (the current default value), which uses the default pickle module implicitly. It is possible to construct malicious pickle data which will execute arbitrary code during unpickling (See https://github.com/pytorch/pytorch/blob/main/SECURITY.md#untrusted-models for more details). In a future release, the default value for `weights_only` will be flipped to `True`. This limits the functions that could be executed during unpickling. Arbitrary objects will no longer be allowed to be loaded via this mode unless they are explicitly allowlisted by the user via `torch.serialization.add_safe_globals`. We recommend you start setting `weights_only=True` for any use case where you don't have full control of the loaded file. Please open an issue on GitHub for any issues related to this experimental feature.
  self.data, self.slices = torch.load(self.processed_paths[0])
