STDOUT:
Results will be saved in /home/philip/projects/llm_inference_code_repo/Circuit-Completion-Using-GNNs/component_classification_with_link_prediction_head/evaluation/FEGIN/results/model_FEGIN_dataset_ltspice_examples
Command line input: python main.py --data ltspice_examples --representation component_component --model FEGIN --layers 2 --hiddens 64 --batch_size 32 --lr 0.01 --emb_size 512 --epochs 100 --save_appendix component_component_L2_H64_BS32_LR0.01_E512 --no_val
 is saved.
-----
ltspice_examples - FEGIN
Using 2 layers, 64 hidden units, h = 2
Loading component_component representation dataset
ENTERED
Training FEGIN on component_component representation
Train: 3556, Test: 845
##################ITERATION #0 ****************************************
 epoch: 0, train_loss: 1.2686, test_loss: 1.1157, test_f1: 0.4526
 epoch: 1, train_loss: 1.1299, test_loss: 1.0222, test_f1: 0.4647
 epoch: 2, train_loss: 1.0702, test_loss: 0.9467, test_f1: 0.4599
 epoch: 3, train_loss: 1.0335, test_loss: 1.0767, test_f1: 0.4495
 epoch: 4, train_loss: 1.0134, test_loss: 0.9986, test_f1: 0.5020
 epoch: 5, train_loss: 0.9935, test_loss: 1.0350, test_f1: 0.5069
 epoch: 6, train_loss: 0.9782, test_loss: 0.9445, test_f1: 0.5001
 epoch: 7, train_loss: 0.9767, test_loss: 1.0500, test_f1: 0.4657
 epoch: 8, train_loss: 0.9675, test_loss: 1.0323, test_f1: 0.4967
 epoch: 9, train_loss: 0.9654, test_loss: 0.9557, test_f1: 0.5102
 epoch: 10, train_loss: 0.9468, test_loss: 1.0031, test_f1: 0.4813
 epoch: 11, train_loss: 0.9357, test_loss: 0.9988, test_f1: 0.5028
 epoch: 12, train_loss: 0.9346, test_loss: 1.0204, test_f1: 0.5212
 epoch: 13, train_loss: 0.9237, test_loss: 1.0797, test_f1: 0.4737
 epoch: 14, train_loss: 0.9312, test_loss: 1.1423, test_f1: 0.4860
 epoch: 15, train_loss: 0.9271, test_loss: 1.0487, test_f1: 0.5257
 epoch: 16, train_loss: 0.9085, test_loss: 1.0307, test_f1: 0.5154
 epoch: 17, train_loss: 0.9120, test_loss: 1.1086, test_f1: 0.5430
 epoch: 18, train_loss: 0.8980, test_loss: 1.0246, test_f1: 0.5144
 epoch: 19, train_loss: 0.8901, test_loss: 0.9875, test_f1: 0.5625
 epoch: 20, train_loss: 0.9043, test_loss: 0.9975, test_f1: 0.5366
 epoch: 21, train_loss: 0.8904, test_loss: 0.9840, test_f1: 0.5550
 epoch: 22, train_loss: 0.8927, test_loss: 0.9462, test_f1: 0.5208
 epoch: 23, train_loss: 0.8832, test_loss: 0.9592, test_f1: 0.5018
 epoch: 24, train_loss: 0.8906, test_loss: 1.0105, test_f1: 0.5316
 epoch: 25, train_loss: 0.8951, test_loss: 1.0490, test_f1: 0.5223
 epoch: 26, train_loss: 0.8669, test_loss: 0.9762, test_f1: 0.5937
 epoch: 27, train_loss: 0.8577, test_loss: 0.9569, test_f1: 0.5804
 epoch: 28, train_loss: 0.8550, test_loss: 0.9453, test_f1: 0.5452
 epoch: 29, train_loss: 0.9026, test_loss: 1.0251, test_f1: 0.4858
 epoch: 30, train_loss: 0.8818, test_loss: 1.0210, test_f1: 0.5368
 epoch: 31, train_loss: 0.8571, test_loss: 1.2184, test_f1: 0.5219
 epoch: 32, train_loss: 0.8567, test_loss: 0.9333, test_f1: 0.5734
 epoch: 33, train_loss: 0.8491, test_loss: 0.9388, test_f1: 0.5884
 epoch: 34, train_loss: 0.8385, test_loss: 0.9705, test_f1: 0.5587
 epoch: 35, train_loss: 0.8304, test_loss: 0.9764, test_f1: 0.5606
 epoch: 36, train_loss: 0.8343, test_loss: 1.0711, test_f1: 0.5582
 epoch: 37, train_loss: 0.8551, test_loss: 0.8964, test_f1: 0.5673
 epoch: 38, train_loss: 0.8267, test_loss: 0.9441, test_f1: 0.5823
 epoch: 39, train_loss: 0.8127, test_loss: 0.8987, test_f1: 0.5696
 epoch: 40, train_loss: 0.8178, test_loss: 0.9482, test_f1: 0.5516
 epoch: 41, train_loss: 0.8051, test_loss: 0.8903, test_f1: 0.5748
 epoch: 42, train_loss: 0.8287, test_loss: 0.9347, test_f1: 0.5558
 epoch: 43, train_loss: 0.8250, test_loss: 1.1368, test_f1: 0.5276
 epoch: 44, train_loss: 0.7983, test_loss: 0.9151, test_f1: 0.5759
 epoch: 45, train_loss: 0.8136, test_loss: 1.1215, test_f1: 0.5262
 epoch: 46, train_loss: 0.7928, test_loss: 1.0854, test_f1: 0.5919
 epoch: 47, train_loss: 0.8036, test_loss: 0.9233, test_f1: 0.5841
 epoch: 48, train_loss: 0.8014, test_loss: 1.0397, test_f1: 0.5453
 epoch: 49, train_loss: 0.7912, test_loss: 1.1173, test_f1: 0.5344
 epoch: 50, train_loss: 0.8098, test_loss: 0.8894, test_f1: 0.5827
 epoch: 51, train_loss: 0.7674, test_loss: 0.9225, test_f1: 0.5871
 epoch: 52, train_loss: 0.7641, test_loss: 1.0257, test_f1: 0.5811
 epoch: 53, train_loss: 0.7350, test_loss: 1.0338, test_f1: 0.5688
 epoch: 54, train_loss: 0.7232, test_loss: 1.0466, test_f1: 0.5809
 epoch: 55, train_loss: 0.7495, test_loss: 0.9237, test_f1: 0.5770
 epoch: 56, train_loss: 0.7592, test_loss: 0.9838, test_f1: 0.5742
 epoch: 57, train_loss: 0.7276, test_loss: 0.9133, test_f1: 0.5517
 epoch: 58, train_loss: 0.8601, test_loss: 0.9074, test_f1: 0.5850
 epoch: 59, train_loss: 0.7798, test_loss: 1.0275, test_f1: 0.5353
 epoch: 60, train_loss: 0.7648, test_loss: 0.9646, test_f1: 0.5722
 epoch: 61, train_loss: 0.7571, test_loss: 0.9720, test_f1: 0.5768
 epoch: 62, train_loss: 0.7320, test_loss: 0.9711, test_f1: 0.5791
 epoch: 63, train_loss: 0.7267, test_loss: 1.0182, test_f1: 0.5656
 epoch: 64, train_loss: 0.7072, test_loss: 1.0605, test_f1: 0.5656
 epoch: 65, train_loss: 0.7154, test_loss: 0.9977, test_f1: 0.5773
 epoch: 66, train_loss: 0.7099, test_loss: 1.0063, test_f1: 0.5429
 epoch: 67, train_loss: 0.7316, test_loss: 0.9692, test_f1: 0.5895
 epoch: 68, train_loss: 0.7011, test_loss: 1.0202, test_f1: 0.5611
 epoch: 69, train_loss: 0.6930, test_loss: 0.9126, test_f1: 0.5907
 epoch: 70, train_loss: 0.6970, test_loss: 0.9777, test_f1: 0.5867
 epoch: 71, train_loss: 0.7076, test_loss: 1.0577, test_f1: 0.5833
 epoch: 72, train_loss: 0.6918, test_loss: 1.0676, test_f1: 0.5603
 epoch: 73, train_loss: 0.6980, test_loss: 1.0598, test_f1: 0.5911
 epoch: 74, train_loss: 0.6834, test_loss: 1.1104, test_f1: 0.5525
 epoch: 75, train_loss: 0.6803, test_loss: 1.0925, test_f1: 0.5779
 epoch: 76, train_loss: 0.6703, test_loss: 1.1058, test_f1: 0.5629
 epoch: 77, train_loss: 0.6766, test_loss: 1.2593, test_f1: 0.5480
 epoch: 78, train_loss: 0.6755, test_loss: 1.2251, test_f1: 0.5636
 epoch: 79, train_loss: 0.6549, test_loss: 1.0478, test_f1: 0.5744
 epoch: 80, train_loss: 0.7246, test_loss: 0.9937, test_f1: 0.5592
 epoch: 81, train_loss: 0.6819, test_loss: 0.9515, test_f1: 0.5753
 epoch: 82, train_loss: 0.6662, test_loss: 1.1631, test_f1: 0.5822
 epoch: 83, train_loss: 0.6805, test_loss: 1.0064, test_f1: 0.5894
 epoch: 84, train_loss: 0.6729, test_loss: 1.2547, test_f1: 0.5180
 epoch: 85, train_loss: 0.6694, test_loss: 1.1272, test_f1: 0.5708
 epoch: 86, train_loss: 0.6607, test_loss: 1.0284, test_f1: 0.5677
 epoch: 87, train_loss: 0.6656, test_loss: 1.1406, test_f1: 0.5742
 epoch: 88, train_loss: 0.6901, test_loss: 1.0512, test_f1: 0.5823
 epoch: 89, train_loss: 0.6668, test_loss: 1.1687, test_f1: 0.5728
 epoch: 90, train_loss: 0.6464, test_loss: 1.0537, test_f1: 0.5843
 epoch: 91, train_loss: 0.6327, test_loss: 1.0302, test_f1: 0.5817
 epoch: 92, train_loss: 0.6665, test_loss: 1.1463, test_f1: 0.5987
 epoch: 93, train_loss: 0.6491, test_loss: 1.1317, test_f1: 0.5880
 epoch: 94, train_loss: 0.6590, test_loss: 1.1029, test_f1: 0.5789
 epoch: 95, train_loss: 0.6393, test_loss: 1.3507, test_f1: 0.5502
 epoch: 96, train_loss: 0.6401, test_loss: 1.0689, test_f1: 0.5805
 epoch: 97, train_loss: 0.6368, test_loss: 1.3196, test_f1: 0.5886
 epoch: 98, train_loss: 0.6475, test_loss: 1.1273, test_f1: 0.5671
 epoch: 99, train_loss: 0.6316, test_loss: 1.1295, test_f1: 0.5913
##################ITERATION #1 ****************************************
 epoch: 0, train_loss: 1.2614, test_loss: 1.2083, test_f1: 0.2965
 epoch: 1, train_loss: 1.1105, test_loss: 1.0844, test_f1: 0.4219
 epoch: 2, train_loss: 1.0671, test_loss: 0.9890, test_f1: 0.4902
 epoch: 3, train_loss: 1.0123, test_loss: 1.0059, test_f1: 0.4606
 epoch: 4, train_loss: 1.0038, test_loss: 1.0162, test_f1: 0.4911
 epoch: 5, train_loss: 0.9822, test_loss: 0.9482, test_f1: 0.4603
 epoch: 6, train_loss: 0.9650, test_loss: 1.0161, test_f1: 0.4969
 epoch: 7, train_loss: 0.9539, test_loss: 0.9073, test_f1: 0.5067
 epoch: 8, train_loss: 0.9477, test_loss: 1.0364, test_f1: 0.5066
 epoch: 9, train_loss: 0.9197, test_loss: 1.0237, test_f1: 0.4459
 epoch: 10, train_loss: 0.9425, test_loss: 1.0986, test_f1: 0.4963
 epoch: 11, train_loss: 0.8936, test_loss: 1.0756, test_f1: 0.5283
 epoch: 12, train_loss: 0.9203, test_loss: 1.0751, test_f1: 0.4940
 epoch: 13, train_loss: 0.9076, test_loss: 1.0714, test_f1: 0.5165
 epoch: 14, train_loss: 0.8866, test_loss: 1.0024, test_f1: 0.5218
 epoch: 15, train_loss: 0.9052, test_loss: 1.0102, test_f1: 0.4899
 epoch: 16, train_loss: 0.8846, test_loss: 1.0086, test_f1: 0.5141
 epoch: 17, train_loss: 0.8710, test_loss: 1.0359, test_f1: 0.5123
 epoch: 18, train_loss: 0.8786, test_loss: 0.9719, test_f1: 0.5267
 epoch: 19, train_loss: 0.8777, test_loss: 0.9852, test_f1: 0.4752
 epoch: 20, train_loss: 0.8780, test_loss: 0.9668, test_f1: 0.5233
 epoch: 21, train_loss: 0.8958, test_loss: 0.9280, test_f1: 0.5074
 epoch: 22, train_loss: 0.8835, test_loss: 1.0046, test_f1: 0.5360
 epoch: 23, train_loss: 0.8736, test_loss: 0.9131, test_f1: 0.5112
 epoch: 24, train_loss: 0.8903, test_loss: 1.0218, test_f1: 0.4901
 epoch: 25, train_loss: 0.8580, test_loss: 1.1277, test_f1: 0.5147
 epoch: 26, train_loss: 0.8735, test_loss: 1.1113, test_f1: 0.4785
 epoch: 27, train_loss: 0.8657, test_loss: 1.0101, test_f1: 0.5311
 epoch: 28, train_loss: 0.8699, test_loss: 1.2855, test_f1: 0.5280
 epoch: 29, train_loss: 0.8597, test_loss: 1.1106, test_f1: 0.5036
 epoch: 30, train_loss: 0.8673, test_loss: 1.1103, test_f1: 0.4972
 epoch: 31, train_loss: 0.8515, test_loss: 0.9698, test_f1: 0.5681
 epoch: 32, train_loss: 0.8436, test_loss: 1.0047, test_f1: 0.5403
 epoch: 33, train_loss: 0.8359, test_loss: 1.0079, test_f1: 0.5489
 epoch: 34, train_loss: 0.8580, test_loss: 1.0515, test_f1: 0.5477
 epoch: 35, train_loss: 0.8516, test_loss: 1.0548, test_f1: 0.5332
 epoch: 36, train_loss: 0.8489, test_loss: 1.0353, test_f1: 0.5314
 epoch: 37, train_loss: 0.8347, test_loss: 1.3945, test_f1: 0.5249
 epoch: 38, train_loss: 0.8434, test_loss: 0.9895, test_f1: 0.5615
 epoch: 39, train_loss: 0.8168, test_loss: 0.9054, test_f1: 0.5201
 epoch: 40, train_loss: 0.8213, test_loss: 1.0148, test_f1: 0.5792
 epoch: 41, train_loss: 0.8260, test_loss: 1.0704, test_f1: 0.4974
 epoch: 42, train_loss: 0.8118, test_loss: 0.8701, test_f1: 0.5577
 epoch: 43, train_loss: 0.8165, test_loss: 1.0709, test_f1: 0.5413
 epoch: 44, train_loss: 0.7871, test_loss: 1.0581, test_f1: 0.5501
 epoch: 45, train_loss: 0.7835, test_loss: 0.9801, test_f1: 0.5547
 epoch: 46, train_loss: 0.8019, test_loss: 1.0239, test_f1: 0.5451
 epoch: 47, train_loss: 0.8502, test_loss: 0.9686, test_f1: 0.5914
 epoch: 48, train_loss: 0.8178, test_loss: 0.9408, test_f1: 0.5793
 epoch: 49, train_loss: 0.7976, test_loss: 1.1582, test_f1: 0.5437
 epoch: 50, train_loss: 0.8189, test_loss: 1.0828, test_f1: 0.5499
 epoch: 51, train_loss: 0.7594, test_loss: 1.0311, test_f1: 0.5538
 epoch: 52, train_loss: 0.7371, test_loss: 0.9362, test_f1: 0.5492
 epoch: 53, train_loss: 0.7187, test_loss: 0.9907, test_f1: 0.5787
 epoch: 54, train_loss: 0.7365, test_loss: 1.1893, test_f1: 0.5374
 epoch: 55, train_loss: 0.7164, test_loss: 1.0108, test_f1: 0.5795
 epoch: 56, train_loss: 0.7121, test_loss: 0.9344, test_f1: 0.6072
 epoch: 57, train_loss: 0.7088, test_loss: 1.0245, test_f1: 0.5459
 epoch: 58, train_loss: 0.7114, test_loss: 0.9879, test_f1: 0.5737
 epoch: 59, train_loss: 0.7028, test_loss: 0.9973, test_f1: 0.5764
 epoch: 60, train_loss: 0.7014, test_loss: 1.1705, test_f1: 0.5567
 epoch: 61, train_loss: 0.7376, test_loss: 1.0259, test_f1: 0.5845
 epoch: 62, train_loss: 0.7223, test_loss: 1.0330, test_f1: 0.5630
 epoch: 63, train_loss: 0.7181, test_loss: 0.9949, test_f1: 0.5762
 epoch: 64, train_loss: 0.7165, test_loss: 0.8996, test_f1: 0.5865
 epoch: 65, train_loss: 0.7122, test_loss: 0.9326, test_f1: 0.5920
 epoch: 66, train_loss: 0.6998, test_loss: 1.1047, test_f1: 0.5823
 epoch: 67, train_loss: 0.6881, test_loss: 1.0380, test_f1: 0.5884
 epoch: 68, train_loss: 0.6898, test_loss: 1.0233, test_f1: 0.5756
 epoch: 69, train_loss: 0.6852, test_loss: 0.9415, test_f1: 0.5890
 epoch: 70, train_loss: 0.6629, test_loss: 1.0284, test_f1: 0.5688
 epoch: 71, train_loss: 0.6858, test_loss: 1.2097, test_f1: 0.5437
 epoch: 72, train_loss: 0.6841, test_loss: 1.1798, test_f1: 0.5739
 epoch: 73, train_loss: 0.6666, test_loss: 1.1109, test_f1: 0.5609
 epoch: 74, train_loss: 0.6659, test_loss: 1.1230, test_f1: 0.5661
 epoch: 75, train_loss: 0.6895, test_loss: 1.1640, test_f1: 0.5613
 epoch: 76, train_loss: 0.6697, test_loss: 1.2061, test_f1: 0.5728
 epoch: 77, train_loss: 0.6797, test_loss: 1.1735, test_f1: 0.5693
 epoch: 78, train_loss: 0.6637, test_loss: 1.3210, test_f1: 0.5801
 epoch: 79, train_loss: 0.6567, test_loss: 1.0545, test_f1: 0.5618
 epoch: 80, train_loss: 0.6646, test_loss: 1.1300, test_f1: 0.5587
 epoch: 81, train_loss: 0.6619, test_loss: 1.0475, test_f1: 0.5502
 epoch: 82, train_loss: 0.6533, test_loss: 1.1508, test_f1: 0.5767
 epoch: 83, train_loss: 0.6486, test_loss: 1.1350, test_f1: 0.5785
 epoch: 84, train_loss: 0.6491, test_loss: 1.1887, test_f1: 0.5888
 epoch: 85, train_loss: 0.6362, test_loss: 1.0122, test_f1: 0.5658
 epoch: 86, train_loss: 0.6518, test_loss: 1.0555, test_f1: 0.5394
 epoch: 87, train_loss: 0.6266, test_loss: 0.9574, test_f1: 0.5798
 epoch: 88, train_loss: 0.6334, test_loss: 1.0380, test_f1: 0.5837
 epoch: 89, train_loss: 0.6351, test_loss: 1.0421, test_f1: 0.5832
 epoch: 90, train_loss: 0.6472, test_loss: 1.1546, test_f1: 0.5791
 epoch: 91, train_loss: 0.6492, test_loss: 0.8480, test_f1: 0.5633
 epoch: 92, train_loss: 0.6472, test_loss: 1.0575, test_f1: 0.5713
 epoch: 93, train_loss: 0.6435, test_loss: 1.0929, test_f1: 0.6047
 epoch: 94, train_loss: 0.6628, test_loss: 1.2642, test_f1: 0.5882
 epoch: 95, train_loss: 0.6179, test_loss: 1.1011, test_f1: 0.6121
 epoch: 96, train_loss: 0.6343, test_loss: 1.3035, test_f1: 0.5987
 epoch: 97, train_loss: 0.6274, test_loss: 1.2841, test_f1: 0.5647
 epoch: 98, train_loss: 0.6545, test_loss: 1.0986, test_f1: 0.6019
 epoch: 99, train_loss: 0.6298, test_loss: 1.1435, test_f1: 0.5831
##################ITERATION #2 ****************************************
 epoch: 0, train_loss: 1.2887, test_loss: 1.2248, test_f1: 0.3540
 epoch: 1, train_loss: 1.1610, test_loss: 1.0400, test_f1: 0.4302
 epoch: 2, train_loss: 1.0944, test_loss: 1.0114, test_f1: 0.4305
 epoch: 3, train_loss: 1.0601, test_loss: 1.0324, test_f1: 0.4512
 epoch: 4, train_loss: 1.0300, test_loss: 0.9834, test_f1: 0.4645
 epoch: 5, train_loss: 1.0076, test_loss: 0.9698, test_f1: 0.4748
 epoch: 6, train_loss: 1.0107, test_loss: 1.0459, test_f1: 0.5023
 epoch: 7, train_loss: 0.9939, test_loss: 1.0794, test_f1: 0.4553
 epoch: 8, train_loss: 0.9689, test_loss: 1.0282, test_f1: 0.4277
 epoch: 9, train_loss: 0.9868, test_loss: 1.0166, test_f1: 0.4480
 epoch: 10, train_loss: 0.9744, test_loss: 1.0412, test_f1: 0.4652
 epoch: 11, train_loss: 0.9646, test_loss: 0.9886, test_f1: 0.5024
 epoch: 12, train_loss: 0.9566, test_loss: 1.0901, test_f1: 0.5449
 epoch: 13, train_loss: 0.9492, test_loss: 1.0686, test_f1: 0.5083
 epoch: 14, train_loss: 0.9208, test_loss: 1.0882, test_f1: 0.5354
 epoch: 15, train_loss: 0.9388, test_loss: 1.0517, test_f1: 0.5441
 epoch: 16, train_loss: 0.9222, test_loss: 1.0625, test_f1: 0.5384
 epoch: 17, train_loss: 0.9170, test_loss: 1.1106, test_f1: 0.5273
 epoch: 18, train_loss: 0.9121, test_loss: 0.9963, test_f1: 0.5695
 epoch: 19, train_loss: 0.9022, test_loss: 1.0881, test_f1: 0.5274
 epoch: 20, train_loss: 0.8927, test_loss: 1.1677, test_f1: 0.5066
 epoch: 21, train_loss: 0.9101, test_loss: 0.9417, test_f1: 0.5131
 epoch: 22, train_loss: 0.8938, test_loss: 1.0842, test_f1: 0.5497
 epoch: 23, train_loss: 0.8826, test_loss: 1.0481, test_f1: 0.5309
 epoch: 24, train_loss: 0.8807, test_loss: 1.0096, test_f1: 0.5385
 epoch: 25, train_loss: 0.8745, test_loss: 1.0623, test_f1: 0.5279
 epoch: 26, train_loss: 0.8708, test_loss: 1.0607, test_f1: 0.5508
 epoch: 27, train_loss: 0.8718, test_loss: 1.1703, test_f1: 0.5240
 epoch: 28, train_loss: 0.8689, test_loss: 1.0652, test_f1: 0.5359
 epoch: 29, train_loss: 0.8769, test_loss: 0.9688, test_f1: 0.5496
 epoch: 30, train_loss: 0.8541, test_loss: 1.1128, test_f1: 0.5634
 epoch: 31, train_loss: 0.8888, test_loss: 1.0679, test_f1: 0.5287
 epoch: 32, train_loss: 0.8621, test_loss: 0.9536, test_f1: 0.5608
 epoch: 33, train_loss: 0.8588, test_loss: 1.0050, test_f1: 0.5490
 epoch: 34, train_loss: 0.9251, test_loss: 0.9430, test_f1: 0.5321
 epoch: 35, train_loss: 0.8622, test_loss: 0.9527, test_f1: 0.5577
 epoch: 36, train_loss: 0.8496, test_loss: 1.0421, test_f1: 0.5307
 epoch: 37, train_loss: 0.8392, test_loss: 1.0454, test_f1: 0.5361
 epoch: 38, train_loss: 0.8283, test_loss: 1.0803, test_f1: 0.5729
 epoch: 39, train_loss: 0.8337, test_loss: 1.0950, test_f1: 0.5377
 epoch: 40, train_loss: 0.8313, test_loss: 1.0215, test_f1: 0.5512
 epoch: 41, train_loss: 0.8329, test_loss: 0.9985, test_f1: 0.5742
 epoch: 42, train_loss: 0.8307, test_loss: 1.1737, test_f1: 0.5598
 epoch: 43, train_loss: 0.8290, test_loss: 0.9103, test_f1: 0.5768
 epoch: 44, train_loss: 0.8177, test_loss: 0.9572, test_f1: 0.5881
 epoch: 45, train_loss: 0.7987, test_loss: 1.0717, test_f1: 0.5773
 epoch: 46, train_loss: 0.7990, test_loss: 1.0186, test_f1: 0.5722
 epoch: 47, train_loss: 0.8040, test_loss: 1.0046, test_f1: 0.5615
 epoch: 48, train_loss: 0.8013, test_loss: 1.0149, test_f1: 0.5406
 epoch: 49, train_loss: 0.7937, test_loss: 1.1590, test_f1: 0.5662
 epoch: 50, train_loss: 0.8074, test_loss: 1.0500, test_f1: 0.5711
 epoch: 51, train_loss: 0.7577, test_loss: 0.9746, test_f1: 0.5662
 epoch: 52, train_loss: 0.7617, test_loss: 0.9802, test_f1: 0.5638
 epoch: 53, train_loss: 0.7424, test_loss: 1.0116, test_f1: 0.5637
 epoch: 54, train_loss: 0.7294, test_loss: 0.9930, test_f1: 0.5851
 epoch: 55, train_loss: 0.7224, test_loss: 1.0937, test_f1: 0.5584
 epoch: 56, train_loss: 0.7403, test_loss: 1.0663, test_f1: 0.5521
 epoch: 57, train_loss: 0.7170, test_loss: 0.9705, test_f1: 0.5726
 epoch: 58, train_loss: 0.7811, test_loss: 1.1131, test_f1: 0.5678
 epoch: 59, train_loss: 0.7306, test_loss: 1.0065, test_f1: 0.5593
 epoch: 60, train_loss: 0.7095, test_loss: 1.1060, test_f1: 0.5886
 epoch: 61, train_loss: 0.7272, test_loss: 1.0187, test_f1: 0.5877
 epoch: 62, train_loss: 0.7213, test_loss: 1.0446, test_f1: 0.5778
 epoch: 63, train_loss: 0.6979, test_loss: 1.0816, test_f1: 0.5602
 epoch: 64, train_loss: 0.7093, test_loss: 1.0983, test_f1: 0.5780
 epoch: 65, train_loss: 0.7033, test_loss: 1.0585, test_f1: 0.5826
 epoch: 66, train_loss: 0.6924, test_loss: 1.0406, test_f1: 0.5642
 epoch: 67, train_loss: 0.6822, test_loss: 0.9182, test_f1: 0.5822
 epoch: 68, train_loss: 0.7032, test_loss: 0.9892, test_f1: 0.6060
 epoch: 69, train_loss: 0.7044, test_loss: 1.0767, test_f1: 0.5634
 epoch: 70, train_loss: 0.6796, test_loss: 1.0427, test_f1: 0.5942
 epoch: 71, train_loss: 0.6946, test_loss: 0.9689, test_f1: 0.5926
 epoch: 72, train_loss: 0.6868, test_loss: 1.0709, test_f1: 0.5953
 epoch: 73, train_loss: 0.6798, test_loss: 1.0700, test_f1: 0.5848
 epoch: 74, train_loss: 0.6773, test_loss: 1.0202, test_f1: 0.5914
 epoch: 75, train_loss: 0.6760, test_loss: 0.9838, test_f1: 0.5913
 epoch: 76, train_loss: 0.6670, test_loss: 1.0525, test_f1: 0.5705
 epoch: 77, train_loss: 0.6782, test_loss: 0.9336, test_f1: 0.5869
 epoch: 78, train_loss: 0.6788, test_loss: 1.0813, test_f1: 0.5910
 epoch: 79, train_loss: 0.6655, test_loss: 0.9298, test_f1: 0.5878
 epoch: 80, train_loss: 0.6697, test_loss: 1.1248, test_f1: 0.5432
 epoch: 81, train_loss: 0.6625, test_loss: 0.9795, test_f1: 0.5984
 epoch: 82, train_loss: 0.6638, test_loss: 1.0547, test_f1: 0.5858
 epoch: 83, train_loss: 0.6631, test_loss: 1.0540, test_f1: 0.6061
 epoch: 84, train_loss: 0.6409, test_loss: 1.0596, test_f1: 0.5523
 epoch: 85, train_loss: 0.6449, test_loss: 1.0219, test_f1: 0.5699
 epoch: 86, train_loss: 0.6454, test_loss: 1.1237, test_f1: 0.5922
 epoch: 87, train_loss: 0.6526, test_loss: 1.1642, test_f1: 0.5746
 epoch: 88, train_loss: 0.6310, test_loss: 1.0498, test_f1: 0.5835
 epoch: 89, train_loss: 0.6384, test_loss: 1.0601, test_f1: 0.5994
 epoch: 90, train_loss: 0.6646, test_loss: 0.9983, test_f1: 0.5706
 epoch: 91, train_loss: 0.6597, test_loss: 0.9554, test_f1: 0.5739
 epoch: 92, train_loss: 0.6453, test_loss: 1.0749, test_f1: 0.5828
 epoch: 93, train_loss: 0.6913, test_loss: 0.8928, test_f1: 0.6002
 epoch: 94, train_loss: 0.6374, test_loss: 0.9705, test_f1: 0.6072
 epoch: 95, train_loss: 0.6380, test_loss: 0.9307, test_f1: 0.5992
 epoch: 96, train_loss: 0.6288, test_loss: 0.9593, test_f1: 0.6023
 epoch: 97, train_loss: 0.6291, test_loss: 0.9334, test_f1: 0.5782
 epoch: 98, train_loss: 0.6124, test_loss: 0.9480, test_f1: 0.5991
 epoch: 99, train_loss: 0.6415, test_loss: 0.9631, test_f1: 0.5647
##################ITERATION #3 ****************************************
 epoch: 0, train_loss: 1.3037, test_loss: 1.2285, test_f1: 0.3873
 epoch: 1, train_loss: 1.1306, test_loss: 1.0309, test_f1: 0.4558
 epoch: 2, train_loss: 1.0623, test_loss: 0.9505, test_f1: 0.4559
 epoch: 3, train_loss: 1.0434, test_loss: 0.9626, test_f1: 0.4616
 epoch: 4, train_loss: 0.9869, test_loss: 0.9955, test_f1: 0.4412
 epoch: 5, train_loss: 0.9869, test_loss: 1.0418, test_f1: 0.5073
 epoch: 6, train_loss: 0.9611, test_loss: 1.0642, test_f1: 0.5180
 epoch: 7, train_loss: 0.9795, test_loss: 0.9887, test_f1: 0.5088
 epoch: 8, train_loss: 0.9428, test_loss: 1.0586, test_f1: 0.4729
 epoch: 9, train_loss: 0.9400, test_loss: 1.1042, test_f1: 0.4600
 epoch: 10, train_loss: 0.9458, test_loss: 0.9772, test_f1: 0.4998
 epoch: 11, train_loss: 0.9485, test_loss: 1.0590, test_f1: 0.5183
 epoch: 12, train_loss: 0.9473, test_loss: 1.1157, test_f1: 0.5066
 epoch: 13, train_loss: 0.9231, test_loss: 0.9418, test_f1: 0.5254
 epoch: 14, train_loss: 0.9114, test_loss: 1.0210, test_f1: 0.5365
 epoch: 15, train_loss: 0.9068, test_loss: 1.0639, test_f1: 0.5416
 epoch: 16, train_loss: 0.9257, test_loss: 1.0105, test_f1: 0.5090
 epoch: 17, train_loss: 0.9263, test_loss: 1.0235, test_f1: 0.5388
 epoch: 18, train_loss: 0.8851, test_loss: 1.0038, test_f1: 0.5042
 epoch: 19, train_loss: 0.8908, test_loss: 1.0499, test_f1: 0.5745
 epoch: 20, train_loss: 0.9360, test_loss: 1.5854, test_f1: 0.4528
 epoch: 21, train_loss: 0.8871, test_loss: 1.0837, test_f1: 0.5164
 epoch: 22, train_loss: 0.8643, test_loss: 1.0595, test_f1: 0.5436
 epoch: 23, train_loss: 0.8987, test_loss: 1.0506, test_f1: 0.5201
 epoch: 24, train_loss: 0.8898, test_loss: 1.0199, test_f1: 0.5646
 epoch: 25, train_loss: 0.8802, test_loss: 1.0225, test_f1: 0.5019
 epoch: 26, train_loss: 0.8745, test_loss: 1.0712, test_f1: 0.5127
 epoch: 27, train_loss: 0.8596, test_loss: 0.9965, test_f1: 0.5442
 epoch: 28, train_loss: 0.8709, test_loss: 1.0614, test_f1: 0.5368
 epoch: 29, train_loss: 0.8450, test_loss: 1.0105, test_f1: 0.5593
 epoch: 30, train_loss: 0.8357, test_loss: 0.9508, test_f1: 0.5403
 epoch: 31, train_loss: 0.8362, test_loss: 0.9664, test_f1: 0.5528
 epoch: 32, train_loss: 0.8489, test_loss: 1.0016, test_f1: 0.5344
 epoch: 33, train_loss: 0.8397, test_loss: 1.0935, test_f1: 0.5465
 epoch: 34, train_loss: 0.8123, test_loss: 1.0992, test_f1: 0.4859
 epoch: 35, train_loss: 0.8453, test_loss: 1.0791, test_f1: 0.5616
 epoch: 36, train_loss: 0.8420, test_loss: 1.0351, test_f1: 0.5740
 epoch: 37, train_loss: 0.8233, test_loss: 1.1719, test_f1: 0.5539
 epoch: 38, train_loss: 0.8203, test_loss: 0.9329, test_f1: 0.5664
 epoch: 39, train_loss: 0.8027, test_loss: 0.9648, test_f1: 0.5437
 epoch: 40, train_loss: 0.8102, test_loss: 1.0523, test_f1: 0.5655
 epoch: 41, train_loss: 0.7844, test_loss: 1.0210, test_f1: 0.5702
 epoch: 42, train_loss: 0.7940, test_loss: 1.2912, test_f1: 0.5428
 epoch: 43, train_loss: 0.8206, test_loss: 1.0553, test_f1: 0.5615
 epoch: 44, train_loss: 0.8045, test_loss: 1.0605, test_f1: 0.5490
 epoch: 45, train_loss: 0.7907, test_loss: 0.9395, test_f1: 0.5623
 epoch: 46, train_loss: 0.7895, test_loss: 1.4042, test_f1: 0.5173
 epoch: 47, train_loss: 0.7832, test_loss: 1.1085, test_f1: 0.5445
 epoch: 48, train_loss: 0.7950, test_loss: 0.9726, test_f1: 0.5675
 epoch: 49, train_loss: 0.7870, test_loss: 0.9862, test_f1: 0.5528
 epoch: 50, train_loss: 0.7883, test_loss: 1.0260, test_f1: 0.5777
 epoch: 51, train_loss: 0.7356, test_loss: 1.1075, test_f1: 0.5495
 epoch: 52, train_loss: 0.7241, test_loss: 1.0698, test_f1: 0.5460
 epoch: 53, train_loss: 0.7113, test_loss: 1.0592, test_f1: 0.5965
 epoch: 54, train_loss: 0.7237, test_loss: 1.1154, test_f1: 0.5835
 epoch: 55, train_loss: 0.7154, test_loss: 1.1295, test_f1: 0.5659
 epoch: 56, train_loss: 0.7360, test_loss: 1.2108, test_f1: 0.5784
 epoch: 57, train_loss: 0.7136, test_loss: 1.0250, test_f1: 0.5931
 epoch: 58, train_loss: 0.7084, test_loss: 1.0709, test_f1: 0.5733
 epoch: 59, train_loss: 0.7104, test_loss: 1.0991, test_f1: 0.5550
 epoch: 60, train_loss: 0.7326, test_loss: 1.0006, test_f1: 0.5846
 epoch: 61, train_loss: 0.6984, test_loss: 1.0864, test_f1: 0.5634
 epoch: 62, train_loss: 0.6925, test_loss: 1.0258, test_f1: 0.5885
 epoch: 63, train_loss: 0.6916, test_loss: 1.1120, test_f1: 0.5729
 epoch: 64, train_loss: 0.7043, test_loss: 1.0247, test_f1: 0.5747
 epoch: 65, train_loss: 0.6801, test_loss: 1.0584, test_f1: 0.5858
 epoch: 66, train_loss: 0.6777, test_loss: 1.1704, test_f1: 0.5944
 epoch: 67, train_loss: 0.6730, test_loss: 1.0837, test_f1: 0.5983
 epoch: 68, train_loss: 0.6687, test_loss: 1.0474, test_f1: 0.5796
 epoch: 69, train_loss: 0.7151, test_loss: 0.9915, test_f1: 0.5943
 epoch: 70, train_loss: 0.6675, test_loss: 1.0778, test_f1: 0.5748
 epoch: 71, train_loss: 0.6571, test_loss: 1.1189, test_f1: 0.6154
 epoch: 72, train_loss: 0.6698, test_loss: 1.0261, test_f1: 0.5746
 epoch: 73, train_loss: 0.6528, test_loss: 1.1430, test_f1: 0.5679
 epoch: 74, train_loss: 0.6691, test_loss: 1.0611, test_f1: 0.5777
 epoch: 75, train_loss: 0.6557, test_loss: 1.1049, test_f1: 0.5874
 epoch: 76, train_loss: 0.6776, test_loss: 1.0055, test_f1: 0.5807
 epoch: 77, train_loss: 0.6746, test_loss: 1.1166, test_f1: 0.5613
 epoch: 78, train_loss: 0.6470, test_loss: 1.1060, test_f1: 0.5697
 epoch: 79, train_loss: 0.6515, test_loss: 1.0671, test_f1: 0.5620
 epoch: 80, train_loss: 0.6544, test_loss: 1.0339, test_f1: 0.5881
 epoch: 81, train_loss: 0.6360, test_loss: 1.1162, test_f1: 0.5729
 epoch: 82, train_loss: 0.6424, test_loss: 1.2000, test_f1: 0.5601
 epoch: 83, train_loss: 0.6437, test_loss: 0.9837, test_f1: 0.5883
 epoch: 84, train_loss: 0.6405, test_loss: 1.0418, test_f1: 0.5692
 epoch: 85, train_loss: 0.6475, test_loss: 1.0627, test_f1: 0.5656
 epoch: 86, train_loss: 0.6283, test_loss: 1.0986, test_f1: 0.5636
 epoch: 87, train_loss: 0.6269, test_loss: 1.1287, test_f1: 0.5560
 epoch: 88, train_loss: 0.6245, test_loss: 1.2525, test_f1: 0.5365
 epoch: 89, train_loss: 0.6336, test_loss: 1.0827, test_f1: 0.5487
 epoch: 90, train_loss: 0.6331, test_loss: 1.1073, test_f1: 0.5596
 epoch: 91, train_loss: 0.6311, test_loss: 1.0642, test_f1: 0.5918
 epoch: 92, train_loss: 0.6427, test_loss: 1.1768, test_f1: 0.5577
 epoch: 93, train_loss: 0.6248, test_loss: 1.1961, test_f1: 0.5382
 epoch: 94, train_loss: 0.6403, test_loss: 0.9676, test_f1: 0.5676
 epoch: 95, train_loss: 0.6310, test_loss: 1.0824, test_f1: 0.5678
 epoch: 96, train_loss: 0.6188, test_loss: 1.0583, test_f1: 0.5827
 epoch: 97, train_loss: 0.6233, test_loss: 1.1825, test_f1: 0.5625
 epoch: 98, train_loss: 0.6247, test_loss: 1.1613, test_f1: 0.5715
 epoch: 99, train_loss: 0.6191, test_loss: 1.1472, test_f1: 0.5619
##################ITERATION #4 ****************************************
 epoch: 0, train_loss: 1.2441, test_loss: 1.0523, test_f1: 0.4546
 epoch: 1, train_loss: 1.0854, test_loss: 0.9836, test_f1: 0.4798
 epoch: 2, train_loss: 1.0553, test_loss: 1.0845, test_f1: 0.4195
 epoch: 3, train_loss: 1.0270, test_loss: 1.0093, test_f1: 0.4479
 epoch: 4, train_loss: 1.0122, test_loss: 1.0041, test_f1: 0.4911
 epoch: 5, train_loss: 0.9962, test_loss: 3.4254, test_f1: 0.4443
 epoch: 6, train_loss: 0.9853, test_loss: 1.0634, test_f1: 0.5224
 epoch: 7, train_loss: 0.9643, test_loss: 1.0281, test_f1: 0.4480
 epoch: 8, train_loss: 0.9637, test_loss: 0.9731, test_f1: 0.4659
 epoch: 9, train_loss: 0.9601, test_loss: 0.9904, test_f1: 0.4775
 epoch: 10, train_loss: 0.9470, test_loss: 0.9752, test_f1: 0.4815
 epoch: 11, train_loss: 0.9293, test_loss: 0.9940, test_f1: 0.4927
 epoch: 12, train_loss: 0.9258, test_loss: 0.9901, test_f1: 0.4880
 epoch: 13, train_loss: 0.9405, test_loss: 1.0050, test_f1: 0.5020
 epoch: 14, train_loss: 0.9192, test_loss: 0.9894, test_f1: 0.4930
 epoch: 15, train_loss: 0.9221, test_loss: 0.9554, test_f1: 0.4996
 epoch: 16, train_loss: 0.9009, test_loss: 1.0098, test_f1: 0.5186
 epoch: 17, train_loss: 0.8858, test_loss: 1.0790, test_f1: 0.4629
 epoch: 18, train_loss: 0.9304, test_loss: 0.9557, test_f1: 0.4914
 epoch: 19, train_loss: 0.8994, test_loss: 0.9099, test_f1: 0.5255
 epoch: 20, train_loss: 0.8813, test_loss: 0.9416, test_f1: 0.5860
 epoch: 21, train_loss: 0.9266, test_loss: 1.1948, test_f1: 0.5197
 epoch: 22, train_loss: 0.8792, test_loss: 0.9861, test_f1: 0.5097
 epoch: 23, train_loss: 0.8638, test_loss: 0.9540, test_f1: 0.5478
 epoch: 24, train_loss: 0.8573, test_loss: 0.9520, test_f1: 0.5693
 epoch: 25, train_loss: 0.8717, test_loss: 0.9378, test_f1: 0.5584
 epoch: 26, train_loss: 0.8693, test_loss: 0.9560, test_f1: 0.5533
 epoch: 27, train_loss: 0.8618, test_loss: 1.1136, test_f1: 0.5276
 epoch: 28, train_loss: 0.8500, test_loss: 1.2618, test_f1: 0.4828
 epoch: 29, train_loss: 0.8575, test_loss: 1.0218, test_f1: 0.5223
 epoch: 30, train_loss: 0.8355, test_loss: 1.0814, test_f1: 0.5781
 epoch: 31, train_loss: 0.8667, test_loss: 0.9691, test_f1: 0.5147
 epoch: 32, train_loss: 0.8340, test_loss: 0.9846, test_f1: 0.5221
 epoch: 33, train_loss: 0.8568, test_loss: 1.0007, test_f1: 0.5442
 epoch: 34, train_loss: 0.8259, test_loss: 0.9505, test_f1: 0.5708
 epoch: 35, train_loss: 0.8244, test_loss: 0.9746, test_f1: 0.5337
 epoch: 36, train_loss: 0.8201, test_loss: 0.9183, test_f1: 0.5687
 epoch: 37, train_loss: 0.7979, test_loss: 1.1761, test_f1: 0.5204
 epoch: 38, train_loss: 0.8148, test_loss: 0.9756, test_f1: 0.5640
 epoch: 39, train_loss: 0.8140, test_loss: 1.0583, test_f1: 0.5352
 epoch: 40, train_loss: 0.8015, test_loss: 1.1144, test_f1: 0.5391
 epoch: 41, train_loss: 0.8103, test_loss: 1.0172, test_f1: 0.5540
 epoch: 42, train_loss: 0.7990, test_loss: 1.1576, test_f1: 0.5191
 epoch: 43, train_loss: 0.7962, test_loss: 1.0291, test_f1: 0.5440
 epoch: 44, train_loss: 0.7702, test_loss: 0.9548, test_f1: 0.5297
 epoch: 45, train_loss: 0.7899, test_loss: 1.0581, test_f1: 0.5368
 epoch: 46, train_loss: 0.7821, test_loss: 1.0255, test_f1: 0.5501
 epoch: 47, train_loss: 0.7690, test_loss: 1.0717, test_f1: 0.5382
 epoch: 48, train_loss: 0.7800, test_loss: 1.0402, test_f1: 0.5581
 epoch: 49, train_loss: 0.7806, test_loss: 1.0488, test_f1: 0.5400
 epoch: 50, train_loss: 0.7643, test_loss: 1.1276, test_f1: 0.5284
 epoch: 51, train_loss: 0.7393, test_loss: 1.1134, test_f1: 0.5618
 epoch: 52, train_loss: 0.7225, test_loss: 1.3262, test_f1: 0.5384
 epoch: 53, train_loss: 0.7036, test_loss: 1.0550, test_f1: 0.5599
 epoch: 54, train_loss: 0.6992, test_loss: 1.0198, test_f1: 0.5722
 epoch: 55, train_loss: 0.7078, test_loss: 1.1445, test_f1: 0.5402
 epoch: 56, train_loss: 0.6886, test_loss: 1.1077, test_f1: 0.5441
 epoch: 57, train_loss: 0.6980, test_loss: 1.0247, test_f1: 0.5499
 epoch: 58, train_loss: 0.7028, test_loss: 1.1470, test_f1: 0.5601
 epoch: 59, train_loss: 0.7104, test_loss: 0.9270, test_f1: 0.5663
 epoch: 60, train_loss: 0.6837, test_loss: 1.1156, test_f1: 0.5738
 epoch: 61, train_loss: 0.6844, test_loss: 1.1578, test_f1: 0.5608
 epoch: 62, train_loss: 0.6906, test_loss: 1.0736, test_f1: 0.5517
 epoch: 63, train_loss: 0.6549, test_loss: 1.0012, test_f1: 0.5722
 epoch: 64, train_loss: 0.6659, test_loss: 0.9538, test_f1: 0.5540
 epoch: 65, train_loss: 0.6717, test_loss: 1.2030, test_f1: 0.5699
 epoch: 66, train_loss: 0.6672, test_loss: 1.1557, test_f1: 0.5673
 epoch: 67, train_loss: 0.6710, test_loss: 1.0932, test_f1: 0.5596
 epoch: 68, train_loss: 0.6702, test_loss: 1.0537, test_f1: 0.5622
 epoch: 69, train_loss: 0.6629, test_loss: 0.9699, test_f1: 0.5688
 epoch: 70, train_loss: 0.6412, test_loss: 0.9917, test_f1: 0.5608
 epoch: 71, train_loss: 0.6649, test_loss: 1.1949, test_f1: 0.5321
 epoch: 72, train_loss: 0.6553, test_loss: 1.1690, test_f1: 0.5552
 epoch: 73, train_loss: 0.6472, test_loss: 1.0064, test_f1: 0.5569
 epoch: 74, train_loss: 0.6312, test_loss: 1.1637, test_f1: 0.5654
 epoch: 75, train_loss: 0.6426, test_loss: 1.1777, test_f1: 0.5426
 epoch: 76, train_loss: 0.6313, test_loss: 1.2933, test_f1: 0.5355
 epoch: 77, train_loss: 0.6589, test_loss: 1.1519, test_f1: 0.5685
 epoch: 78, train_loss: 0.6116, test_loss: 1.2671, test_f1: 0.5526
 epoch: 79, train_loss: 0.6452, test_loss: 0.9610, test_f1: 0.5536
 epoch: 80, train_loss: 0.6245, test_loss: 1.1946, test_f1: 0.5172
 epoch: 81, train_loss: 0.6246, test_loss: 1.0596, test_f1: 0.5609
 epoch: 82, train_loss: 0.6401, test_loss: 1.0201, test_f1: 0.5708
 epoch: 83, train_loss: 0.6218, test_loss: 1.2950, test_f1: 0.5431
 epoch: 84, train_loss: 0.6403, test_loss: 1.0914, test_f1: 0.5536
 epoch: 85, train_loss: 0.6268, test_loss: 1.1695, test_f1: 0.5565
 epoch: 86, train_loss: 0.6342, test_loss: 1.2301, test_f1: 0.5436
 epoch: 87, train_loss: 0.6391, test_loss: 1.1369, test_f1: 0.5752
 epoch: 88, train_loss: 0.6261, test_loss: 1.2291, test_f1: 0.5912
 epoch: 89, train_loss: 0.6191, test_loss: 1.2286, test_f1: 0.5313
 epoch: 90, train_loss: 0.6042, test_loss: 1.2635, test_f1: 0.5615
 epoch: 91, train_loss: 0.6015, test_loss: 1.1975, test_f1: 0.5899
 epoch: 92, train_loss: 0.6091, test_loss: 1.0809, test_f1: 0.5766
 epoch: 93, train_loss: 0.6181, test_loss: 1.3004, test_f1: 0.5457
 epoch: 94, train_loss: 0.6492, test_loss: 1.4077, test_f1: 0.5395
 epoch: 95, train_loss: 0.6096, test_loss: 1.0510, test_f1: 0.5492
 epoch: 96, train_loss: 0.6276, test_loss: 1.1525, test_f1: 0.5541
 epoch: 97, train_loss: 0.6150, test_loss: 1.1543, test_f1: 0.5549
 epoch: 98, train_loss: 0.6128, test_loss: 1.0564, test_f1: 0.5417
 epoch: 99, train_loss: 0.6040, test_loss: 1.2133, test_f1: 0.5655
##################ITERATION #5 ****************************************
 epoch: 0, train_loss: 1.2549, test_loss: 1.2367, test_f1: 0.3066
 epoch: 1, train_loss: 1.1573, test_loss: 1.0546, test_f1: 0.4274
 epoch: 2, train_loss: 1.0959, test_loss: 1.0455, test_f1: 0.4362
 epoch: 3, train_loss: 1.0754, test_loss: 1.0289, test_f1: 0.4801
 epoch: 4, train_loss: 1.0509, test_loss: 1.0979, test_f1: 0.4678
 epoch: 5, train_loss: 1.0420, test_loss: 1.0198, test_f1: 0.4928
 epoch: 6, train_loss: 1.0249, test_loss: 0.9813, test_f1: 0.4592
 epoch: 7, train_loss: 1.0047, test_loss: 1.0622, test_f1: 0.4894
 epoch: 8, train_loss: 0.9876, test_loss: 1.0781, test_f1: 0.4704
 epoch: 9, train_loss: 0.9819, test_loss: 1.2087, test_f1: 0.4317
 epoch: 10, train_loss: 0.9832, test_loss: 0.9757, test_f1: 0.4976
 epoch: 11, train_loss: 0.9734, test_loss: 1.0001, test_f1: 0.4709
 epoch: 12, train_loss: 0.9552, test_loss: 1.0157, test_f1: 0.5060
 epoch: 13, train_loss: 0.9458, test_loss: 1.0895, test_f1: 0.4858
 epoch: 14, train_loss: 0.9335, test_loss: 1.1099, test_f1: 0.4743
 epoch: 15, train_loss: 0.9239, test_loss: 0.9722, test_f1: 0.5110
 epoch: 16, train_loss: 0.9217, test_loss: 1.0227, test_f1: 0.5265
 epoch: 17, train_loss: 0.9190, test_loss: 1.1395, test_f1: 0.5090
 epoch: 18, train_loss: 0.9172, test_loss: 1.1101, test_f1: 0.5122
 epoch: 19, train_loss: 0.9123, test_loss: 1.0988, test_f1: 0.5296
 epoch: 20, train_loss: 0.9041, test_loss: 1.0146, test_f1: 0.4928
 epoch: 21, train_loss: 0.9197, test_loss: 0.9956, test_f1: 0.4875
 epoch: 22, train_loss: 0.8741, test_loss: 1.1861, test_f1: 0.5215
 epoch: 23, train_loss: 0.8801, test_loss: 1.1163, test_f1: 0.4949
 epoch: 24, train_loss: 0.8883, test_loss: 1.1057, test_f1: 0.4916
 epoch: 25, train_loss: 0.8739, test_loss: 1.7653, test_f1: 0.4870
 epoch: 26, train_loss: 0.8958, test_loss: 0.9036, test_f1: 0.5147
 epoch: 27, train_loss: 0.8822, test_loss: 0.9968, test_f1: 0.5108
 epoch: 28, train_loss: 0.8733, test_loss: 1.0461, test_f1: 0.5623
 epoch: 29, train_loss: 0.8600, test_loss: 1.2266, test_f1: 0.5081
 epoch: 30, train_loss: 0.8926, test_loss: 1.2636, test_f1: 0.5122
 epoch: 31, train_loss: 0.8659, test_loss: 1.2253, test_f1: 0.5382
 epoch: 32, train_loss: 0.8601, test_loss: 1.0419, test_f1: 0.5527
 epoch: 33, train_loss: 0.8425, test_loss: 1.2749, test_f1: 0.4805
 epoch: 34, train_loss: 0.8308, test_loss: 1.0357, test_f1: 0.5281
 epoch: 35, train_loss: 0.8385, test_loss: 1.0341, test_f1: 0.5668
 epoch: 36, train_loss: 0.8271, test_loss: 1.0129, test_f1: 0.5229
 epoch: 37, train_loss: 0.8204, test_loss: 1.2695, test_f1: 0.5262
 epoch: 38, train_loss: 0.8284, test_loss: 1.0810, test_f1: 0.5285
 epoch: 39, train_loss: 0.8272, test_loss: 1.0266, test_f1: 0.4896
 epoch: 40, train_loss: 0.8239, test_loss: 1.0345, test_f1: 0.5498
 epoch: 41, train_loss: 0.8234, test_loss: 1.2274, test_f1: 0.5202
 epoch: 42, train_loss: 0.7952, test_loss: 1.2234, test_f1: 0.5435
 epoch: 43, train_loss: 0.8144, test_loss: 1.0505, test_f1: 0.5312
 epoch: 44, train_loss: 0.8188, test_loss: 1.0216, test_f1: 0.5194
 epoch: 45, train_loss: 0.8060, test_loss: 1.0399, test_f1: 0.5216
 epoch: 46, train_loss: 0.8210, test_loss: 1.2078, test_f1: 0.4754
 epoch: 47, train_loss: 0.8220, test_loss: 1.0432, test_f1: 0.5276
 epoch: 48, train_loss: 0.8078, test_loss: 1.0143, test_f1: 0.5065
 epoch: 49, train_loss: 0.8186, test_loss: 0.9534, test_f1: 0.5170
 epoch: 50, train_loss: 0.8071, test_loss: 1.1235, test_f1: 0.5305
 epoch: 51, train_loss: 0.7773, test_loss: 1.1108, test_f1: 0.5140
 epoch: 52, train_loss: 0.7685, test_loss: 0.9777, test_f1: 0.5748
 epoch: 53, train_loss: 0.7451, test_loss: 0.9744, test_f1: 0.5540
 epoch: 54, train_loss: 0.7420, test_loss: 1.0242, test_f1: 0.5701
 epoch: 55, train_loss: 0.7321, test_loss: 1.2829, test_f1: 0.5406
 epoch: 56, train_loss: 0.7211, test_loss: 1.1848, test_f1: 0.5467
 epoch: 57, train_loss: 0.7396, test_loss: 1.0282, test_f1: 0.5492
 epoch: 58, train_loss: 0.7498, test_loss: 0.9795, test_f1: 0.5433
 epoch: 59, train_loss: 0.7253, test_loss: 0.9904, test_f1: 0.5394
 epoch: 60, train_loss: 0.7227, test_loss: 1.0013, test_f1: 0.5519
 epoch: 61, train_loss: 0.7285, test_loss: 1.0625, test_f1: 0.5311
 epoch: 62, train_loss: 0.7252, test_loss: 1.0817, test_f1: 0.5492
 epoch: 63, train_loss: 0.7053, test_loss: 0.9815, test_f1: 0.5242
 epoch: 64, train_loss: 0.7089, test_loss: 1.1365, test_f1: 0.5495
 epoch: 65, train_loss: 0.7080, test_loss: 1.1818, test_f1: 0.5206
 epoch: 66, train_loss: 0.7136, test_loss: 1.0015, test_f1: 0.5450
 epoch: 67, train_loss: 0.7134, test_loss: 1.1457, test_f1: 0.5358
 epoch: 68, train_loss: 0.7013, test_loss: 1.2244, test_f1: 0.5417
 epoch: 69, train_loss: 0.7026, test_loss: 1.1010, test_f1: 0.5502
 epoch: 70, train_loss: 0.6999, test_loss: 1.5374, test_f1: 0.5074
 epoch: 71, train_loss: 0.7064, test_loss: 1.1825, test_f1: 0.5580
 epoch: 72, train_loss: 0.7193, test_loss: 1.0518, test_f1: 0.5645
 epoch: 73, train_loss: 0.7143, test_loss: 1.2092, test_f1: 0.5451
 epoch: 74, train_loss: 0.6978, test_loss: 1.0359, test_f1: 0.5747
 epoch: 75, train_loss: 0.6920, test_loss: 0.9923, test_f1: 0.5576
 epoch: 76, train_loss: 0.6914, test_loss: 1.0789, test_f1: 0.5762
 epoch: 77, train_loss: 0.6758, test_loss: 1.2217, test_f1: 0.5188
 epoch: 78, train_loss: 0.6672, test_loss: 1.2389, test_f1: 0.5499
 epoch: 79, train_loss: 0.6707, test_loss: 1.0910, test_f1: 0.5491
 epoch: 80, train_loss: 0.6631, test_loss: 1.0906, test_f1: 0.5545
 epoch: 81, train_loss: 0.6617, test_loss: 1.0980, test_f1: 0.5502
 epoch: 82, train_loss: 0.6826, test_loss: 1.0688, test_f1: 0.5467
 epoch: 83, train_loss: 0.6569, test_loss: 1.1059, test_f1: 0.5555
 epoch: 84, train_loss: 0.6689, test_loss: 1.1805, test_f1: 0.5438
 epoch: 85, train_loss: 0.6613, test_loss: 1.0932, test_f1: 0.5663
 epoch: 86, train_loss: 0.6770, test_loss: 1.1921, test_f1: 0.5170
 epoch: 87, train_loss: 0.6717, test_loss: 1.1578, test_f1: 0.5608
 epoch: 88, train_loss: 0.6544, test_loss: 1.2527, test_f1: 0.5389
 epoch: 89, train_loss: 0.6595, test_loss: 1.0864, test_f1: 0.5701
 epoch: 90, train_loss: 0.6567, test_loss: 1.1934, test_f1: 0.5812
 epoch: 91, train_loss: 0.6466, test_loss: 1.2499, test_f1: 0.5620
 epoch: 92, train_loss: 0.6771, test_loss: 1.1162, test_f1: 0.5591
 epoch: 93, train_loss: 0.6511, test_loss: 1.1718, test_f1: 0.5598
 epoch: 94, train_loss: 0.6303, test_loss: 1.3115, test_f1: 0.5670
 epoch: 95, train_loss: 0.6570, test_loss: 1.0655, test_f1: 0.5697
 epoch: 96, train_loss: 0.6548, test_loss: 1.1665, test_f1: 0.5827
 epoch: 97, train_loss: 0.6606, test_loss: 1.1303, test_f1: 0.5540
 epoch: 98, train_loss: 0.6259, test_loss: 1.1967, test_f1: 0.5180
 epoch: 99, train_loss: 0.6330, test_loss: 1.0867, test_f1: 0.5492
##################ITERATION #6 ****************************************
 epoch: 0, train_loss: 1.2551, test_loss: 1.1447, test_f1: 0.3952
 epoch: 1, train_loss: 1.1298, test_loss: 1.0958, test_f1: 0.4634
 epoch: 2, train_loss: 1.0738, test_loss: 1.2420, test_f1: 0.4234
 epoch: 3, train_loss: 1.0395, test_loss: 1.0004, test_f1: 0.4611
 epoch: 4, train_loss: 1.0080, test_loss: 0.9881, test_f1: 0.4497
 epoch: 5, train_loss: 0.9974, test_loss: 0.9630, test_f1: 0.4905
 epoch: 6, train_loss: 0.9817, test_loss: 0.9256, test_f1: 0.4872
 epoch: 7, train_loss: 0.9823, test_loss: 1.0094, test_f1: 0.5008
 epoch: 8, train_loss: 0.9557, test_loss: 0.9706, test_f1: 0.5137
 epoch: 9, train_loss: 0.9565, test_loss: 0.9827, test_f1: 0.4989
 epoch: 10, train_loss: 0.9394, test_loss: 0.9969, test_f1: 0.5011
 epoch: 11, train_loss: 0.9360, test_loss: 0.9826, test_f1: 0.5120
 epoch: 12, train_loss: 0.9481, test_loss: 1.0617, test_f1: 0.5133
 epoch: 13, train_loss: 0.9337, test_loss: 1.0163, test_f1: 0.4819
 epoch: 14, train_loss: 0.9097, test_loss: 1.0938, test_f1: 0.4827
 epoch: 15, train_loss: 0.9054, test_loss: 0.9562, test_f1: 0.4819
 epoch: 16, train_loss: 0.9192, test_loss: 0.9932, test_f1: 0.5402
 epoch: 17, train_loss: 0.9040, test_loss: 0.9827, test_f1: 0.5021
 epoch: 18, train_loss: 0.9084, test_loss: 1.1375, test_f1: 0.5034
 epoch: 19, train_loss: 0.8925, test_loss: 1.2096, test_f1: 0.4741
 epoch: 20, train_loss: 0.8935, test_loss: 1.1045, test_f1: 0.4967
 epoch: 21, train_loss: 0.9013, test_loss: 1.0862, test_f1: 0.5083
 epoch: 22, train_loss: 0.8802, test_loss: 1.0521, test_f1: 0.5017
 epoch: 23, train_loss: 0.8774, test_loss: 1.0379, test_f1: 0.4937
 epoch: 24, train_loss: 0.8662, test_loss: 1.3110, test_f1: 0.5179
 epoch: 25, train_loss: 0.8719, test_loss: 1.0554, test_f1: 0.5155
 epoch: 26, train_loss: 0.8595, test_loss: 0.9424, test_f1: 0.5272
 epoch: 27, train_loss: 0.8590, test_loss: 1.0874, test_f1: 0.4730
 epoch: 28, train_loss: 0.8668, test_loss: 1.0065, test_f1: 0.5118
 epoch: 29, train_loss: 0.8478, test_loss: 0.9938, test_f1: 0.5203
 epoch: 30, train_loss: 0.9211, test_loss: 0.9565, test_f1: 0.5140
 epoch: 31, train_loss: 0.8590, test_loss: 1.0162, test_f1: 0.5490
 epoch: 32, train_loss: 0.8515, test_loss: 0.9492, test_f1: 0.5218
 epoch: 33, train_loss: 0.8353, test_loss: 0.9929, test_f1: 0.5148
 epoch: 34, train_loss: 0.8386, test_loss: 1.0325, test_f1: 0.5300
 epoch: 35, train_loss: 0.8362, test_loss: 1.1127, test_f1: 0.5000
 epoch: 36, train_loss: 0.8306, test_loss: 1.0052, test_f1: 0.4869
 epoch: 37, train_loss: 0.8220, test_loss: 1.0601, test_f1: 0.4843
 epoch: 38, train_loss: 0.8286, test_loss: 1.0538, test_f1: 0.4930
 epoch: 39, train_loss: 0.8185, test_loss: 1.1585, test_f1: 0.4751
 epoch: 40, train_loss: 0.8351, test_loss: 0.9891, test_f1: 0.5195
 epoch: 41, train_loss: 0.8222, test_loss: 1.1216, test_f1: 0.5184
 epoch: 42, train_loss: 0.8184, test_loss: 0.9600, test_f1: 0.5273
 epoch: 43, train_loss: 0.8187, test_loss: 1.0624, test_f1: 0.4937
 epoch: 44, train_loss: 0.8046, test_loss: 1.2371, test_f1: 0.4769
 epoch: 45, train_loss: 0.8117, test_loss: 1.0552, test_f1: 0.4868
 epoch: 46, train_loss: 0.8106, test_loss: 1.0080, test_f1: 0.4790
 epoch: 47, train_loss: 0.8164, test_loss: 1.4936, test_f1: 0.4855
 epoch: 48, train_loss: 0.8188, test_loss: 1.1567, test_f1: 0.5152
 epoch: 49, train_loss: 0.8005, test_loss: 1.0961, test_f1: 0.4965
 epoch: 50, train_loss: 0.7996, test_loss: 0.9997, test_f1: 0.5258
 epoch: 51, train_loss: 0.7662, test_loss: 1.0696, test_f1: 0.5053
 epoch: 52, train_loss: 0.7550, test_loss: 1.1377, test_f1: 0.5574
 epoch: 53, train_loss: 0.7578, test_loss: 1.1285, test_f1: 0.5158
 epoch: 54, train_loss: 0.7595, test_loss: 1.1950, test_f1: 0.5156
 epoch: 55, train_loss: 0.7593, test_loss: 1.1850, test_f1: 0.5105
 epoch: 56, train_loss: 0.8828, test_loss: 1.1077, test_f1: 0.5050
 epoch: 57, train_loss: 0.8151, test_loss: 1.2915, test_f1: 0.4959
 epoch: 58, train_loss: 0.8003, test_loss: 1.1532, test_f1: 0.5172
 epoch: 59, train_loss: 0.7511, test_loss: 1.2549, test_f1: 0.4772
 epoch: 60, train_loss: 0.7670, test_loss: 1.5138, test_f1: 0.4941
 epoch: 61, train_loss: 0.7652, test_loss: 1.4241, test_f1: 0.4906
 epoch: 62, train_loss: 0.7476, test_loss: 1.2560, test_f1: 0.4869
 epoch: 63, train_loss: 0.7467, test_loss: 1.5301, test_f1: 0.4799
 epoch: 64, train_loss: 0.7410, test_loss: 1.2656, test_f1: 0.5075
 epoch: 65, train_loss: 0.7440, test_loss: 1.1315, test_f1: 0.5396
 epoch: 66, train_loss: 0.7345, test_loss: 1.3096, test_f1: 0.4837
 epoch: 67, train_loss: 0.7313, test_loss: 1.5249, test_f1: 0.4845
 epoch: 68, train_loss: 0.7406, test_loss: 1.4544, test_f1: 0.4870
 epoch: 69, train_loss: 0.7339, test_loss: 1.3805, test_f1: 0.4961
 epoch: 70, train_loss: 0.7147, test_loss: 1.1755, test_f1: 0.4886
 epoch: 71, train_loss: 0.7219, test_loss: 1.2634, test_f1: 0.4973
 epoch: 72, train_loss: 0.7286, test_loss: 1.3925, test_f1: 0.4970
 epoch: 73, train_loss: 0.7547, test_loss: 1.0898, test_f1: 0.5107
 epoch: 74, train_loss: 0.7371, test_loss: 1.2319, test_f1: 0.5048
 epoch: 75, train_loss: 0.7285, test_loss: 1.1708, test_f1: 0.5157
 epoch: 76, train_loss: 0.7029, test_loss: 1.2417, test_f1: 0.5170
 epoch: 77, train_loss: 0.7061, test_loss: 1.1567, test_f1: 0.5219
 epoch: 78, train_loss: 0.7058, test_loss: 1.0830, test_f1: 0.5397
 epoch: 79, train_loss: 0.6980, test_loss: 1.4291, test_f1: 0.5232
 epoch: 80, train_loss: 0.6912, test_loss: 1.2159, test_f1: 0.5246
 epoch: 81, train_loss: 0.7024, test_loss: 1.5817, test_f1: 0.5168
 epoch: 82, train_loss: 0.7034, test_loss: 1.2196, test_f1: 0.4920
 epoch: 83, train_loss: 0.6973, test_loss: 1.0142, test_f1: 0.5550
 epoch: 84, train_loss: 0.7021, test_loss: 1.2205, test_f1: 0.5408
 epoch: 85, train_loss: 0.6801, test_loss: 1.0002, test_f1: 0.5287
 epoch: 86, train_loss: 0.6885, test_loss: 1.3195, test_f1: 0.5155
 epoch: 87, train_loss: 0.6955, test_loss: 1.1785, test_f1: 0.5198
 epoch: 88, train_loss: 0.6830, test_loss: 1.1688, test_f1: 0.5427
 epoch: 89, train_loss: 0.6847, test_loss: 1.0950, test_f1: 0.5159
 epoch: 90, train_loss: 0.6821, test_loss: 1.2732, test_f1: 0.5230
 epoch: 91, train_loss: 0.6709, test_loss: 1.2696, test_f1: 0.5048
 epoch: 92, train_loss: 0.6598, test_loss: 1.2338, test_f1: 0.5034
 epoch: 93, train_loss: 0.6790, test_loss: 1.3930, test_f1: 0.5314
 epoch: 94, train_loss: 0.6731, test_loss: 1.1340, test_f1: 0.5484
 epoch: 95, train_loss: 0.6693, test_loss: 1.1936, test_f1: 0.5560
 epoch: 96, train_loss: 0.6723, test_loss: 1.4509, test_f1: 0.5031
 epoch: 97, train_loss: 0.6844, test_loss: 1.5542, test_f1: 0.5240
 epoch: 98, train_loss: 0.6898, test_loss: 1.3386, test_f1: 0.4986
 epoch: 99, train_loss: 0.6666, test_loss: 1.4823, test_f1: 0.5310
##################ITERATION #7 ****************************************
 epoch: 0, train_loss: 1.2793, test_loss: 1.2091, test_f1: 0.3933
 epoch: 1, train_loss: 1.1674, test_loss: 1.1588, test_f1: 0.4457
 epoch: 2, train_loss: 1.0925, test_loss: 1.1701, test_f1: 0.4196
 epoch: 3, train_loss: 1.0414, test_loss: 1.0015, test_f1: 0.4817
 epoch: 4, train_loss: 1.0237, test_loss: 0.9944, test_f1: 0.4890
 epoch: 5, train_loss: 1.0033, test_loss: 1.0250, test_f1: 0.4628
 epoch: 6, train_loss: 0.9848, test_loss: 0.9544, test_f1: 0.4866
 epoch: 7, train_loss: 0.9835, test_loss: 1.0369, test_f1: 0.4890
 epoch: 8, train_loss: 0.9707, test_loss: 0.9351, test_f1: 0.4682
 epoch: 9, train_loss: 0.9473, test_loss: 1.0207, test_f1: 0.5002
 epoch: 10, train_loss: 0.9393, test_loss: 1.0281, test_f1: 0.4671
 epoch: 11, train_loss: 0.9254, test_loss: 0.9672, test_f1: 0.5432
 epoch: 12, train_loss: 0.9301, test_loss: 0.9628, test_f1: 0.4843
 epoch: 13, train_loss: 0.9149, test_loss: 1.0377, test_f1: 0.4879
 epoch: 14, train_loss: 0.9481, test_loss: 1.0425, test_f1: 0.5109
 epoch: 15, train_loss: 0.9222, test_loss: 0.9768, test_f1: 0.5109
 epoch: 16, train_loss: 0.9094, test_loss: 0.9395, test_f1: 0.5444
 epoch: 17, train_loss: 0.8834, test_loss: 1.0192, test_f1: 0.5090
 epoch: 18, train_loss: 0.8818, test_loss: 1.0139, test_f1: 0.5135
 epoch: 19, train_loss: 0.8866, test_loss: 1.0228, test_f1: 0.5037
 epoch: 20, train_loss: 0.8664, test_loss: 1.0732, test_f1: 0.4814
 epoch: 21, train_loss: 0.8914, test_loss: 1.0190, test_f1: 0.5607
 epoch: 22, train_loss: 0.8714, test_loss: 0.9800, test_f1: 0.5060
 epoch: 23, train_loss: 0.8688, test_loss: 0.9780, test_f1: 0.5323
 epoch: 24, train_loss: 0.8726, test_loss: 0.9838, test_f1: 0.5286
 epoch: 25, train_loss: 0.8466, test_loss: 1.2785, test_f1: 0.4567
 epoch: 26, train_loss: 0.9649, test_loss: 1.2530, test_f1: 0.4910
 epoch: 27, train_loss: 0.9313, test_loss: 0.9867, test_f1: 0.5187
 epoch: 28, train_loss: 0.9016, test_loss: 1.0396, test_f1: 0.4748
 epoch: 29, train_loss: 0.9011, test_loss: 1.0266, test_f1: 0.5111
 epoch: 30, train_loss: 0.8974, test_loss: 1.0161, test_f1: 0.5098
 epoch: 31, train_loss: 0.8866, test_loss: 1.0750, test_f1: 0.4729
 epoch: 32, train_loss: 0.8926, test_loss: 1.0719, test_f1: 0.5242
 epoch: 33, train_loss: 0.8672, test_loss: 1.0958, test_f1: 0.4803
 epoch: 34, train_loss: 0.8433, test_loss: 1.0504, test_f1: 0.4973
 epoch: 35, train_loss: 0.8756, test_loss: 1.1120, test_f1: 0.4830
 epoch: 36, train_loss: 0.8497, test_loss: 1.0517, test_f1: 0.4889
 epoch: 37, train_loss: 0.8530, test_loss: 0.9779, test_f1: 0.5251
 epoch: 38, train_loss: 0.8563, test_loss: 1.1324, test_f1: 0.4865
 epoch: 39, train_loss: 0.8434, test_loss: 0.9737, test_f1: 0.5350
 epoch: 40, train_loss: 0.8661, test_loss: 0.9752, test_f1: 0.4985
 epoch: 41, train_loss: 0.8309, test_loss: 1.1178, test_f1: 0.5121
 epoch: 42, train_loss: 0.8356, test_loss: 1.0214, test_f1: 0.5287
 epoch: 43, train_loss: 0.8560, test_loss: 1.0909, test_f1: 0.5017
 epoch: 44, train_loss: 0.8294, test_loss: 1.0180, test_f1: 0.5094
 epoch: 45, train_loss: 0.8169, test_loss: 1.0605, test_f1: 0.5141
 epoch: 46, train_loss: 0.8309, test_loss: 0.9937, test_f1: 0.5120
 epoch: 47, train_loss: 0.8134, test_loss: 1.0848, test_f1: 0.4862
 epoch: 48, train_loss: 0.8211, test_loss: 0.9802, test_f1: 0.5330
 epoch: 49, train_loss: 0.8132, test_loss: 1.2202, test_f1: 0.4936
 epoch: 50, train_loss: 0.8021, test_loss: 1.0732, test_f1: 0.5286
 epoch: 51, train_loss: 0.7821, test_loss: 1.0323, test_f1: 0.5440
 epoch: 52, train_loss: 0.7563, test_loss: 1.0247, test_f1: 0.5473
 epoch: 53, train_loss: 0.7591, test_loss: 1.1102, test_f1: 0.5030
 epoch: 54, train_loss: 0.7579, test_loss: 1.0595, test_f1: 0.5151
 epoch: 55, train_loss: 0.7570, test_loss: 1.0632, test_f1: 0.5006
 epoch: 56, train_loss: 0.7462, test_loss: 1.0686, test_f1: 0.5539
 epoch: 57, train_loss: 0.7661, test_loss: 1.0116, test_f1: 0.5483
 epoch: 58, train_loss: 0.7483, test_loss: 1.0653, test_f1: 0.5700
 epoch: 59, train_loss: 0.7374, test_loss: 1.1104, test_f1: 0.5776
 epoch: 60, train_loss: 0.7560, test_loss: 1.0718, test_f1: 0.5742
 epoch: 61, train_loss: 0.7345, test_loss: 1.0684, test_f1: 0.5441
 epoch: 62, train_loss: 0.7342, test_loss: 1.0962, test_f1: 0.5363
 epoch: 63, train_loss: 0.7395, test_loss: 1.0986, test_f1: 0.5411
 epoch: 64, train_loss: 0.7327, test_loss: 1.1581, test_f1: 0.5212
 epoch: 65, train_loss: 0.7287, test_loss: 1.0795, test_f1: 0.5405
 epoch: 66, train_loss: 0.7235, test_loss: 1.0628, test_f1: 0.5453
 epoch: 67, train_loss: 0.7103, test_loss: 1.1566, test_f1: 0.5358
 epoch: 68, train_loss: 0.7379, test_loss: 0.9749, test_f1: 0.5824
 epoch: 69, train_loss: 0.7262, test_loss: 1.0717, test_f1: 0.5765
 epoch: 70, train_loss: 0.7172, test_loss: 1.0544, test_f1: 0.5766
 epoch: 71, train_loss: 0.7106, test_loss: 1.0472, test_f1: 0.5483
 epoch: 72, train_loss: 0.7147, test_loss: 1.1624, test_f1: 0.5348
 epoch: 73, train_loss: 0.7035, test_loss: 1.1938, test_f1: 0.5487
 epoch: 74, train_loss: 0.7116, test_loss: 1.1064, test_f1: 0.5305
 epoch: 75, train_loss: 0.7130, test_loss: 1.0071, test_f1: 0.5572
 epoch: 76, train_loss: 0.6912, test_loss: 1.0598, test_f1: 0.5772
 epoch: 77, train_loss: 0.6942, test_loss: 1.1057, test_f1: 0.5429
 epoch: 78, train_loss: 0.7012, test_loss: 1.1074, test_f1: 0.5769
 epoch: 79, train_loss: 0.6884, test_loss: 1.1315, test_f1: 0.5626
 epoch: 80, train_loss: 0.7161, test_loss: 1.0026, test_f1: 0.5786
 epoch: 81, train_loss: 0.6870, test_loss: 1.0160, test_f1: 0.5880
 epoch: 82, train_loss: 0.6740, test_loss: 1.0432, test_f1: 0.5692
 epoch: 83, train_loss: 0.6999, test_loss: 1.0832, test_f1: 0.5443
 epoch: 84, train_loss: 0.6865, test_loss: 1.0636, test_f1: 0.5715
 epoch: 85, train_loss: 0.7089, test_loss: 1.1135, test_f1: 0.5365
 epoch: 86, train_loss: 0.6792, test_loss: 1.0441, test_f1: 0.5401
 epoch: 87, train_loss: 0.6743, test_loss: 1.0764, test_f1: 0.5837
 epoch: 88, train_loss: 0.6959, test_loss: 1.0809, test_f1: 0.5262
 epoch: 89, train_loss: 0.7074, test_loss: 1.0853, test_f1: 0.5548
 epoch: 90, train_loss: 0.6843, test_loss: 1.0826, test_f1: 0.5615
 epoch: 91, train_loss: 0.6600, test_loss: 1.0894, test_f1: 0.5621
 epoch: 92, train_loss: 0.6785, test_loss: 1.1203, test_f1: 0.5305
 epoch: 93, train_loss: 0.6797, test_loss: 1.2070, test_f1: 0.5480
 epoch: 94, train_loss: 0.6680, test_loss: 1.1887, test_f1: 0.5328
 epoch: 95, train_loss: 0.6654, test_loss: 1.1703, test_f1: 0.5654
 epoch: 96, train_loss: 0.6432, test_loss: 1.1398, test_f1: 0.5547
 epoch: 97, train_loss: 0.6812, test_loss: 1.1618, test_f1: 0.5911
 epoch: 98, train_loss: 0.6506, test_loss: 1.1552, test_f1: 0.5765
 epoch: 99, train_loss: 0.6660, test_loss: 1.1523, test_f1: 0.5530
##################ITERATION #8 ****************************************
 epoch: 0, train_loss: 1.2700, test_loss: 1.1573, test_f1: 0.4297
 epoch: 1, train_loss: 1.1346, test_loss: 1.0642, test_f1: 0.4701
 epoch: 2, train_loss: 1.0896, test_loss: 0.9653, test_f1: 0.4651
 epoch: 3, train_loss: 1.0332, test_loss: 1.0044, test_f1: 0.4613
 epoch: 4, train_loss: 1.0048, test_loss: 1.0275, test_f1: 0.5145
 epoch: 5, train_loss: 0.9668, test_loss: 0.9287, test_f1: 0.4512
 epoch: 6, train_loss: 0.9766, test_loss: 0.9914, test_f1: 0.4571
 epoch: 7, train_loss: 0.9633, test_loss: 0.9974, test_f1: 0.4883
 epoch: 8, train_loss: 0.9443, test_loss: 1.0945, test_f1: 0.5007
 epoch: 9, train_loss: 0.9295, test_loss: 1.2391, test_f1: 0.4679
 epoch: 10, train_loss: 0.9466, test_loss: 0.9820, test_f1: 0.4979
 epoch: 11, train_loss: 0.9207, test_loss: 0.9452, test_f1: 0.4784
 epoch: 12, train_loss: 0.9558, test_loss: 1.0216, test_f1: 0.4866
 epoch: 13, train_loss: 0.9081, test_loss: 1.0127, test_f1: 0.4945
 epoch: 14, train_loss: 0.9105, test_loss: 0.9902, test_f1: 0.5383
 epoch: 15, train_loss: 0.9115, test_loss: 1.1301, test_f1: 0.4511
 epoch: 16, train_loss: 0.9059, test_loss: 0.9742, test_f1: 0.5009
 epoch: 17, train_loss: 0.8876, test_loss: 1.0887, test_f1: 0.5104
 epoch: 18, train_loss: 0.8954, test_loss: 1.1888, test_f1: 0.5133
 epoch: 19, train_loss: 0.8943, test_loss: 0.9840, test_f1: 0.5058
 epoch: 20, train_loss: 0.8954, test_loss: 1.2393, test_f1: 0.4731
 epoch: 21, train_loss: 0.9114, test_loss: 0.9676, test_f1: 0.4809
 epoch: 22, train_loss: 0.8881, test_loss: 1.1018, test_f1: 0.5031
 epoch: 23, train_loss: 0.8791, test_loss: 0.9610, test_f1: 0.5364
 epoch: 24, train_loss: 0.8902, test_loss: 0.9880, test_f1: 0.5061
 epoch: 25, train_loss: 0.8852, test_loss: 1.0942, test_f1: 0.4822
 epoch: 26, train_loss: 0.8882, test_loss: 1.0126, test_f1: 0.5455
 epoch: 27, train_loss: 0.8893, test_loss: 0.9816, test_f1: 0.4806
 epoch: 28, train_loss: 0.8776, test_loss: 1.0166, test_f1: 0.5044
 epoch: 29, train_loss: 0.8672, test_loss: 1.0487, test_f1: 0.5355
 epoch: 30, train_loss: 0.8757, test_loss: 0.8998, test_f1: 0.5147
 epoch: 31, train_loss: 0.8844, test_loss: 0.9860, test_f1: 0.4954
 epoch: 32, train_loss: 0.8648, test_loss: 1.4062, test_f1: 0.5178
 epoch: 33, train_loss: 0.9488, test_loss: 1.1073, test_f1: 0.5308
 epoch: 34, train_loss: 0.8914, test_loss: 1.2149, test_f1: 0.4884
 epoch: 35, train_loss: 0.8722, test_loss: 1.0097, test_f1: 0.5479
 epoch: 36, train_loss: 0.8650, test_loss: 0.9077, test_f1: 0.5287
 epoch: 37, train_loss: 0.8438, test_loss: 1.0827, test_f1: 0.5368
 epoch: 38, train_loss: 0.8780, test_loss: 1.0523, test_f1: 0.4839
 epoch: 39, train_loss: 0.8360, test_loss: 1.0042, test_f1: 0.5008
 epoch: 40, train_loss: 0.8528, test_loss: 1.2729, test_f1: 0.4892
 epoch: 41, train_loss: 0.8539, test_loss: 1.0127, test_f1: 0.4980
 epoch: 42, train_loss: 0.8489, test_loss: 1.0474, test_f1: 0.5178
 epoch: 43, train_loss: 0.8454, test_loss: 1.1546, test_f1: 0.5117
 epoch: 44, train_loss: 0.8621, test_loss: 1.2831, test_f1: 0.5229
 epoch: 45, train_loss: 0.8547, test_loss: 1.0743, test_f1: 0.5377
 epoch: 46, train_loss: 0.8407, test_loss: 1.0488, test_f1: 0.5082
 epoch: 47, train_loss: 0.8328, test_loss: 1.0337, test_f1: 0.5623
 epoch: 48, train_loss: 0.8365, test_loss: 0.9976, test_f1: 0.5386
 epoch: 49, train_loss: 0.8188, test_loss: 1.0721, test_f1: 0.5064
 epoch: 50, train_loss: 0.8419, test_loss: 0.9459, test_f1: 0.5380
 epoch: 51, train_loss: 0.8071, test_loss: 1.0084, test_f1: 0.5432
 epoch: 52, train_loss: 0.7864, test_loss: 1.0147, test_f1: 0.5368
 epoch: 53, train_loss: 0.7840, test_loss: 1.0697, test_f1: 0.4908
 epoch: 54, train_loss: 0.7976, test_loss: 1.2207, test_f1: 0.4870
 epoch: 55, train_loss: 0.7911, test_loss: 1.3771, test_f1: 0.4970
 epoch: 56, train_loss: 0.7841, test_loss: 1.0611, test_f1: 0.4967
 epoch: 57, train_loss: 0.7760, test_loss: 1.0774, test_f1: 0.5401
 epoch: 58, train_loss: 0.7924, test_loss: 1.1395, test_f1: 0.4991
 epoch: 59, train_loss: 0.7751, test_loss: 1.0345, test_f1: 0.4985
 epoch: 60, train_loss: 0.7838, test_loss: 0.9787, test_f1: 0.4906
 epoch: 61, train_loss: 0.7670, test_loss: 1.1159, test_f1: 0.5053
 epoch: 62, train_loss: 0.7724, test_loss: 1.1991, test_f1: 0.5217
 epoch: 63, train_loss: 0.7688, test_loss: 1.1465, test_f1: 0.5623
 epoch: 64, train_loss: 0.7749, test_loss: 1.1747, test_f1: 0.5189
 epoch: 65, train_loss: 0.7720, test_loss: 1.1668, test_f1: 0.5209
 epoch: 66, train_loss: 0.7643, test_loss: 1.2118, test_f1: 0.5056
 epoch: 67, train_loss: 0.7559, test_loss: 1.1084, test_f1: 0.5471
 epoch: 68, train_loss: 0.7574, test_loss: 1.0420, test_f1: 0.5182
 epoch: 69, train_loss: 0.7791, test_loss: 1.1331, test_f1: 0.5369
 epoch: 70, train_loss: 0.7670, test_loss: 1.2097, test_f1: 0.5057
 epoch: 71, train_loss: 0.7470, test_loss: 1.3029, test_f1: 0.5039
 epoch: 72, train_loss: 0.7492, test_loss: 1.1659, test_f1: 0.5054
 epoch: 73, train_loss: 0.7506, test_loss: 0.9928, test_f1: 0.5125
 epoch: 74, train_loss: 0.7620, test_loss: 1.1101, test_f1: 0.5244
 epoch: 75, train_loss: 0.7398, test_loss: 1.1979, test_f1: 0.5326
 epoch: 76, train_loss: 0.7418, test_loss: 1.1619, test_f1: 0.5694
 epoch: 77, train_loss: 0.7164, test_loss: 1.3811, test_f1: 0.5154
 epoch: 78, train_loss: 0.7257, test_loss: 1.2445, test_f1: 0.5489
 epoch: 79, train_loss: 0.7284, test_loss: 1.1026, test_f1: 0.5547
 epoch: 80, train_loss: 0.7465, test_loss: 1.3131, test_f1: 0.5331
 epoch: 81, train_loss: 0.7519, test_loss: 1.1899, test_f1: 0.5364
 epoch: 82, train_loss: 0.7341, test_loss: 1.1972, test_f1: 0.5387
 epoch: 83, train_loss: 0.7122, test_loss: 1.0387, test_f1: 0.5644
 epoch: 84, train_loss: 0.7181, test_loss: 1.2291, test_f1: 0.5307
 epoch: 85, train_loss: 0.7378, test_loss: 1.0998, test_f1: 0.5419
 epoch: 86, train_loss: 0.7349, test_loss: 1.3463, test_f1: 0.5287
 epoch: 87, train_loss: 0.7431, test_loss: 1.1199, test_f1: 0.5180
 epoch: 88, train_loss: 0.7161, test_loss: 1.2528, test_f1: 0.5230
 epoch: 89, train_loss: 0.7235, test_loss: 1.1629, test_f1: 0.5302
 epoch: 90, train_loss: 0.7332, test_loss: 1.1284, test_f1: 0.5407
 epoch: 91, train_loss: 0.7103, test_loss: 1.3358, test_f1: 0.5526
 epoch: 92, train_loss: 0.7182, test_loss: 1.3020, test_f1: 0.5234
 epoch: 93, train_loss: 0.7220, test_loss: 1.2104, test_f1: 0.5428
 epoch: 94, train_loss: 0.7065, test_loss: 1.3453, test_f1: 0.5310
 epoch: 95, train_loss: 0.6940, test_loss: 1.3770, test_f1: 0.5200
 epoch: 96, train_loss: 0.7017, test_loss: 1.0748, test_f1: 0.5445
 epoch: 97, train_loss: 0.6846, test_loss: 1.4173, test_f1: 0.5493
 epoch: 98, train_loss: 0.6840, test_loss: 1.3085, test_f1: 0.5228
 epoch: 99, train_loss: 0.6911, test_loss: 1.3463, test_f1: 0.5358
##################ITERATION #9 ****************************************
 epoch: 0, train_loss: 1.3486, test_loss: 1.2834, test_f1: 0.3031
 epoch: 1, train_loss: 1.2240, test_loss: 1.0905, test_f1: 0.4434
 epoch: 2, train_loss: 1.1586, test_loss: 1.0852, test_f1: 0.4293
 epoch: 3, train_loss: 1.0845, test_loss: 0.9755, test_f1: 0.4801
 epoch: 4, train_loss: 1.0660, test_loss: 0.9674, test_f1: 0.4794
 epoch: 5, train_loss: 1.0340, test_loss: 1.0283, test_f1: 0.4839
 epoch: 6, train_loss: 1.0096, test_loss: 1.0129, test_f1: 0.4779
 epoch: 7, train_loss: 0.9898, test_loss: 1.0335, test_f1: 0.4962
 epoch: 8, train_loss: 0.9758, test_loss: 1.0018, test_f1: 0.4890
 epoch: 9, train_loss: 0.9628, test_loss: 0.9939, test_f1: 0.5037
 epoch: 10, train_loss: 0.9560, test_loss: 1.0477, test_f1: 0.4712
 epoch: 11, train_loss: 0.9461, test_loss: 1.0908, test_f1: 0.4860
 epoch: 12, train_loss: 0.9381, test_loss: 0.9790, test_f1: 0.5082
 epoch: 13, train_loss: 0.9431, test_loss: 1.0632, test_f1: 0.5068
 epoch: 14, train_loss: 0.9235, test_loss: 1.0230, test_f1: 0.5103
 epoch: 15, train_loss: 0.9274, test_loss: 1.0657, test_f1: 0.5322
 epoch: 16, train_loss: 0.9099, test_loss: 0.9296, test_f1: 0.4789
 epoch: 17, train_loss: 0.9223, test_loss: 0.9894, test_f1: 0.4995
 epoch: 18, train_loss: 0.9252, test_loss: 0.9985, test_f1: 0.5082
 epoch: 19, train_loss: 0.9057, test_loss: 1.0650, test_f1: 0.4986
 epoch: 20, train_loss: 0.9012, test_loss: 1.0259, test_f1: 0.5312
 epoch: 21, train_loss: 0.8891, test_loss: 0.9692, test_f1: 0.5451
 epoch: 22, train_loss: 0.8738, test_loss: 0.8973, test_f1: 0.4991
 epoch: 23, train_loss: 0.8835, test_loss: 0.9622, test_f1: 0.5279
 epoch: 24, train_loss: 0.8934, test_loss: 0.9139, test_f1: 0.5121
 epoch: 25, train_loss: 0.8999, test_loss: 0.9320, test_f1: 0.5242
 epoch: 26, train_loss: 0.8752, test_loss: 1.0619, test_f1: 0.5037
 epoch: 27, train_loss: 0.8701, test_loss: 0.9898, test_f1: 0.5242
 epoch: 28, train_loss: 0.8573, test_loss: 0.9695, test_f1: 0.5167
 epoch: 29, train_loss: 0.8803, test_loss: 0.9096, test_f1: 0.5383
 epoch: 30, train_loss: 0.8628, test_loss: 1.0321, test_f1: 0.5694
 epoch: 31, train_loss: 0.8458, test_loss: 0.9905, test_f1: 0.5473
 epoch: 32, train_loss: 0.8635, test_loss: 0.9039, test_f1: 0.5536
 epoch: 33, train_loss: 0.8558, test_loss: 0.9775, test_f1: 0.5390
 epoch: 34, train_loss: 0.8468, test_loss: 0.9800, test_f1: 0.5113
 epoch: 35, train_loss: 0.8344, test_loss: 0.9672, test_f1: 0.5719
 epoch: 36, train_loss: 0.8307, test_loss: 0.9072, test_f1: 0.5561
 epoch: 37, train_loss: 0.8271, test_loss: 1.0045, test_f1: 0.5586
 epoch: 38, train_loss: 0.8356, test_loss: 0.9414, test_f1: 0.5440
 epoch: 39, train_loss: 0.8495, test_loss: 0.9146, test_f1: 0.5392
 epoch: 40, train_loss: 0.8195, test_loss: 1.0167, test_f1: 0.5163
 epoch: 41, train_loss: 0.8400, test_loss: 0.8948, test_f1: 0.5284
 epoch: 42, train_loss: 0.8407, test_loss: 0.9685, test_f1: 0.5244
 epoch: 43, train_loss: 0.8246, test_loss: 0.9916, test_f1: 0.5605
 epoch: 44, train_loss: 0.8330, test_loss: 0.9729, test_f1: 0.5510
 epoch: 45, train_loss: 0.8183, test_loss: 0.9730, test_f1: 0.5325
 epoch: 46, train_loss: 0.8194, test_loss: 0.9723, test_f1: 0.5332
 epoch: 47, train_loss: 0.8214, test_loss: 0.9340, test_f1: 0.5216
 epoch: 48, train_loss: 0.8099, test_loss: 0.8840, test_f1: 0.5348
 epoch: 49, train_loss: 0.7896, test_loss: 0.9743, test_f1: 0.5286
 epoch: 50, train_loss: 0.8050, test_loss: 0.9450, test_f1: 0.5105
 epoch: 51, train_loss: 0.7731, test_loss: 0.9858, test_f1: 0.5358
 epoch: 52, train_loss: 0.7591, test_loss: 0.9058, test_f1: 0.5515
 epoch: 53, train_loss: 0.7566, test_loss: 0.9293, test_f1: 0.5610
 epoch: 54, train_loss: 0.7514, test_loss: 0.9473, test_f1: 0.5539
 epoch: 55, train_loss: 0.7503, test_loss: 0.9661, test_f1: 0.5695
 epoch: 56, train_loss: 0.7394, test_loss: 0.9267, test_f1: 0.5616
 epoch: 57, train_loss: 0.7321, test_loss: 0.9779, test_f1: 0.5494
 epoch: 58, train_loss: 0.7335, test_loss: 0.9511, test_f1: 0.5703
 epoch: 59, train_loss: 0.7324, test_loss: 1.0874, test_f1: 0.5489
 epoch: 60, train_loss: 0.7537, test_loss: 1.0541, test_f1: 0.5284
 epoch: 61, train_loss: 0.7188, test_loss: 1.0947, test_f1: 0.5118
 epoch: 62, train_loss: 0.7201, test_loss: 0.9239, test_f1: 0.5652
 epoch: 63, train_loss: 0.8199, test_loss: 0.9092, test_f1: 0.5596
 epoch: 64, train_loss: 0.7393, test_loss: 0.9087, test_f1: 0.5617
 epoch: 65, train_loss: 0.7184, test_loss: 0.9636, test_f1: 0.5519
 epoch: 66, train_loss: 0.7000, test_loss: 0.9548, test_f1: 0.5355
 epoch: 67, train_loss: 0.7088, test_loss: 0.9095, test_f1: 0.5625
 epoch: 68, train_loss: 0.7053, test_loss: 0.8963, test_f1: 0.5442
 epoch: 69, train_loss: 0.7017, test_loss: 0.9428, test_f1: 0.5425
 epoch: 70, train_loss: 0.6861, test_loss: 1.0319, test_f1: 0.5758
 epoch: 71, train_loss: 0.7142, test_loss: 0.9996, test_f1: 0.5585
 epoch: 72, train_loss: 0.6914, test_loss: 1.0356, test_f1: 0.5611
 epoch: 73, train_loss: 0.6975, test_loss: 1.0341, test_f1: 0.5376
 epoch: 74, train_loss: 0.6933, test_loss: 1.0674, test_f1: 0.5202
 epoch: 75, train_loss: 0.6811, test_loss: 1.0524, test_f1: 0.5643
 epoch: 76, train_loss: 0.7009, test_loss: 0.9313, test_f1: 0.5606
 epoch: 77, train_loss: 0.6751, test_loss: 0.9417, test_f1: 0.5676
 epoch: 78, train_loss: 0.7070, test_loss: 0.9852, test_f1: 0.5520
 epoch: 79, train_loss: 0.6805, test_loss: 1.0210, test_f1: 0.5229
 epoch: 80, train_loss: 0.6811, test_loss: 0.9386, test_f1: 0.5673
 epoch: 81, train_loss: 0.6827, test_loss: 0.9817, test_f1: 0.5684
 epoch: 82, train_loss: 0.6823, test_loss: 0.9876, test_f1: 0.5698
 epoch: 83, train_loss: 0.6800, test_loss: 1.0703, test_f1: 0.5568
 epoch: 84, train_loss: 0.6535, test_loss: 1.0414, test_f1: 0.5482
 epoch: 85, train_loss: 0.6674, test_loss: 1.0426, test_f1: 0.5536
 epoch: 86, train_loss: 0.6626, test_loss: 1.0553, test_f1: 0.5565
 epoch: 87, train_loss: 0.7380, test_loss: 0.9269, test_f1: 0.5457
 epoch: 88, train_loss: 0.6818, test_loss: 1.0261, test_f1: 0.5415
 epoch: 89, train_loss: 0.6781, test_loss: 1.0213, test_f1: 0.5911
 epoch: 90, train_loss: 0.6496, test_loss: 1.0759, test_f1: 0.5809
 epoch: 91, train_loss: 0.6834, test_loss: 1.1038, test_f1: 0.5641
 epoch: 92, train_loss: 0.6633, test_loss: 1.1379, test_f1: 0.5442
 epoch: 93, train_loss: 0.6892, test_loss: 1.1451, test_f1: 0.5590
 epoch: 94, train_loss: 0.6454, test_loss: 1.0034, test_f1: 0.5551
 epoch: 95, train_loss: 0.6510, test_loss: 1.1125, test_f1: 0.5314
 epoch: 96, train_loss: 0.6424, test_loss: 1.1228, test_f1: 0.5658
 epoch: 97, train_loss: 0.6406, test_loss: 1.0902, test_f1: 0.5748
 epoch: 98, train_loss: 0.6538, test_loss: 1.0764, test_f1: 0.5471
 epoch: 99, train_loss: 0.6532, test_loss: 1.0351, test_f1: 0.5672

Training completed in 886.49 seconds
Best F1: 0.6154 at epoch 71
Mean F1 across iterations: 0.5916  0.0174
========================FINAL RESULTS================================
FEGIN weighted F1: 0.6154  0.0174
python main.py --data ltspice_examples --representation component_component --model FEGIN --layers 2 --hiddens 64 --batch_size 32 --lr 0.01 --emb_size 512 --epochs 100 --save_appendix component_component_L2_H64_BS32_LR0.01_E512 --no_val
-----



STDERR:
  File "main.py", line 370, in <module>
    main()
  File "main.py", line 254, in main
    dataset = dataset_class(
  File "/home/philip/projects/llm_inference_code_repo/Circuit-Completion-Using-GNNs/component_classification_with_link_prediction_head/evaluation/FEGIN/kernel/circuit_datasets.py", line 15, in __init__
    self.data, self.slices = torch.load(self.processed_paths[0])
  File "/home/philip/.local/lib/python3.8/site-packages/torch/serialization.py", line 1040, in load
    warnings.warn(
  File "/usr/lib/python3.8/warnings.py", line 109, in _showwarnmsg
    sw(msg.message, msg.category, msg.filename, msg.lineno,
  File "main.py", line 47, in warn_with_traceback
    traceback.print_stack(file=log)
/home/philip/projects/llm_inference_code_repo/Circuit-Completion-Using-GNNs/component_classification_with_link_prediction_head/evaluation/FEGIN/kernel/circuit_datasets.py:15: FutureWarning: You are using `torch.load` with `weights_only=False` (the current default value), which uses the default pickle module implicitly. It is possible to construct malicious pickle data which will execute arbitrary code during unpickling (See https://github.com/pytorch/pytorch/blob/main/SECURITY.md#untrusted-models for more details). In a future release, the default value for `weights_only` will be flipped to `True`. This limits the functions that could be executed during unpickling. Arbitrary objects will no longer be allowed to be loaded via this mode unless they are explicitly allowlisted by the user via `torch.serialization.add_safe_globals`. We recommend you start setting `weights_only=True` for any use case where you don't have full control of the loaded file. Please open an issue on GitHub for any issues related to this experimental feature.
  self.data, self.slices = torch.load(self.processed_paths[0])
