STDOUT:
Results will be saved in /home/philip/projects/ltspice_examples_code_repo/Circuit-Completion-Using-GNNs/component_classification_with_link_prediction_head/evaluation/FEGIN/results/model_FEGIN_dataset_ltspice_examples
Command line input: python main.py --data ltspice_examples --representation component_pin_net --model FEGIN --layers 6 --hiddens 16 --batch_size 64 --lr 0.01 --emb_size 512 --epochs 100 --save_appendix component_pin_net_L6_H16_BS64_LR0.01_E512 --no_val
 is saved.
-----
ltspice_examples - FEGIN
Using 6 layers, 16 hidden units, h = 2
Loading component_pin_net representation dataset
ENTERED
Training FEGIN on component_pin_net representation
Train: 3558, Test: 846
##################ITERATION #0 ****************************************
 epoch: 0, train_loss: 1.2064, test_loss: 1.2266, test_f1: 0.3186
 epoch: 1, train_loss: 1.0604, test_loss: 1.1080, test_f1: 0.3775
 epoch: 2, train_loss: 1.0240, test_loss: 1.0416, test_f1: 0.4235
 epoch: 3, train_loss: 0.9967, test_loss: 1.1006, test_f1: 0.4570
 epoch: 4, train_loss: 0.9923, test_loss: 0.9504, test_f1: 0.4796
 epoch: 5, train_loss: 0.9684, test_loss: 1.0924, test_f1: 0.4454
 epoch: 6, train_loss: 0.9830, test_loss: 1.0174, test_f1: 0.4588
 epoch: 7, train_loss: 0.9768, test_loss: 0.9242, test_f1: 0.4849
 epoch: 8, train_loss: 0.9546, test_loss: 1.0198, test_f1: 0.4391
 epoch: 9, train_loss: 0.9587, test_loss: 1.0170, test_f1: 0.4608
 epoch: 10, train_loss: 0.9471, test_loss: 1.0248, test_f1: 0.4633
 epoch: 11, train_loss: 0.9552, test_loss: 0.9128, test_f1: 0.5023
 epoch: 12, train_loss: 0.9353, test_loss: 0.9109, test_f1: 0.5093
 epoch: 13, train_loss: 0.9388, test_loss: 0.9105, test_f1: 0.5259
 epoch: 14, train_loss: 0.9206, test_loss: 0.9192, test_f1: 0.5023
 epoch: 15, train_loss: 0.8991, test_loss: 0.9371, test_f1: 0.4761
 epoch: 16, train_loss: 0.9077, test_loss: 0.9194, test_f1: 0.5015
 epoch: 17, train_loss: 0.9013, test_loss: 0.9016, test_f1: 0.5187
 epoch: 18, train_loss: 0.9140, test_loss: 0.8674, test_f1: 0.5197
 epoch: 19, train_loss: 0.8946, test_loss: 0.8749, test_f1: 0.5240
 epoch: 20, train_loss: 0.8818, test_loss: 1.0262, test_f1: 0.4981
 epoch: 21, train_loss: 0.8893, test_loss: 0.9768, test_f1: 0.4990
 epoch: 22, train_loss: 0.8845, test_loss: 0.8987, test_f1: 0.5293
 epoch: 23, train_loss: 0.8815, test_loss: 1.0196, test_f1: 0.4985
 epoch: 24, train_loss: 0.8731, test_loss: 0.8765, test_f1: 0.5644
 epoch: 25, train_loss: 0.8744, test_loss: 0.8615, test_f1: 0.5322
 epoch: 26, train_loss: 0.8615, test_loss: 0.8913, test_f1: 0.5079
 epoch: 27, train_loss: 0.8633, test_loss: 0.8190, test_f1: 0.5440
 epoch: 28, train_loss: 0.8546, test_loss: 0.8344, test_f1: 0.5131
 epoch: 29, train_loss: 0.8565, test_loss: 0.8597, test_f1: 0.5320
 epoch: 30, train_loss: 0.8372, test_loss: 0.8398, test_f1: 0.5448
 epoch: 31, train_loss: 0.8495, test_loss: 0.8725, test_f1: 0.5590
 epoch: 32, train_loss: 0.8593, test_loss: 0.8432, test_f1: 0.5350
 epoch: 33, train_loss: 0.8382, test_loss: 0.8392, test_f1: 0.5444
 epoch: 34, train_loss: 0.8278, test_loss: 0.8483, test_f1: 0.5968
 epoch: 35, train_loss: 0.8421, test_loss: 0.8835, test_f1: 0.5333
 epoch: 36, train_loss: 0.8205, test_loss: 0.7941, test_f1: 0.5530
 epoch: 37, train_loss: 0.8368, test_loss: 0.8666, test_f1: 0.5324
 epoch: 38, train_loss: 0.8366, test_loss: 0.8860, test_f1: 0.5271
 epoch: 39, train_loss: 0.8320, test_loss: 0.8301, test_f1: 0.5332
 epoch: 40, train_loss: 0.8140, test_loss: 0.8497, test_f1: 0.5414
 epoch: 41, train_loss: 0.7956, test_loss: 0.8314, test_f1: 0.5466
 epoch: 42, train_loss: 0.8219, test_loss: 0.7737, test_f1: 0.5816
 epoch: 43, train_loss: 0.8242, test_loss: 0.7727, test_f1: 0.5571
 epoch: 44, train_loss: 0.8093, test_loss: 0.7982, test_f1: 0.5461
 epoch: 45, train_loss: 0.8102, test_loss: 0.8405, test_f1: 0.5502
 epoch: 46, train_loss: 0.8048, test_loss: 0.7965, test_f1: 0.5762
 epoch: 47, train_loss: 0.7997, test_loss: 0.7886, test_f1: 0.5586
 epoch: 48, train_loss: 0.8050, test_loss: 0.7730, test_f1: 0.5951
 epoch: 49, train_loss: 0.7937, test_loss: 0.8791, test_f1: 0.5342
 epoch: 50, train_loss: 0.8023, test_loss: 0.8176, test_f1: 0.5314
 epoch: 51, train_loss: 0.7817, test_loss: 0.7958, test_f1: 0.5756
 epoch: 52, train_loss: 0.7838, test_loss: 0.8103, test_f1: 0.6012
 epoch: 53, train_loss: 0.7679, test_loss: 0.7831, test_f1: 0.5854
 epoch: 54, train_loss: 0.7758, test_loss: 0.8028, test_f1: 0.5952
 epoch: 55, train_loss: 0.7637, test_loss: 0.7939, test_f1: 0.5584
 epoch: 56, train_loss: 0.7586, test_loss: 0.7686, test_f1: 0.5845
 epoch: 57, train_loss: 0.7484, test_loss: 0.7759, test_f1: 0.6089
 epoch: 58, train_loss: 0.7530, test_loss: 0.7730, test_f1: 0.5873
 epoch: 59, train_loss: 0.7548, test_loss: 0.7663, test_f1: 0.6366
 epoch: 60, train_loss: 0.7546, test_loss: 0.8025, test_f1: 0.6073
 epoch: 61, train_loss: 0.7673, test_loss: 0.7624, test_f1: 0.5953
 epoch: 62, train_loss: 0.7552, test_loss: 0.7698, test_f1: 0.5875
 epoch: 63, train_loss: 0.7454, test_loss: 0.7556, test_f1: 0.6398
 epoch: 64, train_loss: 0.7588, test_loss: 0.7717, test_f1: 0.6211
 epoch: 65, train_loss: 0.7315, test_loss: 0.7880, test_f1: 0.6089
 epoch: 66, train_loss: 0.7381, test_loss: 0.7524, test_f1: 0.6327
 epoch: 67, train_loss: 0.7410, test_loss: 0.7423, test_f1: 0.6298
 epoch: 68, train_loss: 0.7298, test_loss: 0.7982, test_f1: 0.6166
 epoch: 69, train_loss: 0.7300, test_loss: 0.8230, test_f1: 0.6008
 epoch: 70, train_loss: 0.7453, test_loss: 0.7834, test_f1: 0.5787
 epoch: 71, train_loss: 0.7333, test_loss: 0.7740, test_f1: 0.5999
 epoch: 72, train_loss: 0.7336, test_loss: 0.7557, test_f1: 0.5987
 epoch: 73, train_loss: 0.7250, test_loss: 0.7433, test_f1: 0.6399
 epoch: 74, train_loss: 0.7339, test_loss: 0.8142, test_f1: 0.6064
 epoch: 75, train_loss: 0.7365, test_loss: 0.7755, test_f1: 0.6062
 epoch: 76, train_loss: 0.7309, test_loss: 0.8533, test_f1: 0.6238
 epoch: 77, train_loss: 0.7367, test_loss: 0.7486, test_f1: 0.6540
 epoch: 78, train_loss: 0.7355, test_loss: 0.7371, test_f1: 0.6364
 epoch: 79, train_loss: 0.7164, test_loss: 0.7618, test_f1: 0.6004
 epoch: 80, train_loss: 0.7113, test_loss: 0.8005, test_f1: 0.6450
 epoch: 81, train_loss: 0.7339, test_loss: 0.7344, test_f1: 0.5962
 epoch: 82, train_loss: 0.7217, test_loss: 0.7317, test_f1: 0.6503
 epoch: 83, train_loss: 0.7183, test_loss: 0.7584, test_f1: 0.6143
 epoch: 84, train_loss: 0.7217, test_loss: 0.7410, test_f1: 0.6480
 epoch: 85, train_loss: 0.7229, test_loss: 0.8028, test_f1: 0.5988
 epoch: 86, train_loss: 0.7186, test_loss: 0.8092, test_f1: 0.6376
 epoch: 87, train_loss: 0.7068, test_loss: 0.7534, test_f1: 0.6384
 epoch: 88, train_loss: 0.7203, test_loss: 0.7354, test_f1: 0.6376
 epoch: 89, train_loss: 0.7145, test_loss: 0.7573, test_f1: 0.6350
 epoch: 90, train_loss: 0.7121, test_loss: 0.7614, test_f1: 0.6473
 epoch: 91, train_loss: 0.7020, test_loss: 0.7670, test_f1: 0.6273
 epoch: 92, train_loss: 0.7107, test_loss: 0.7452, test_f1: 0.6579
 epoch: 93, train_loss: 0.6991, test_loss: 0.7535, test_f1: 0.6370
 epoch: 94, train_loss: 0.7380, test_loss: 0.7408, test_f1: 0.6640
 epoch: 95, train_loss: 0.7232, test_loss: 0.7504, test_f1: 0.5860
 epoch: 96, train_loss: 0.7026, test_loss: 0.7636, test_f1: 0.6466
 epoch: 97, train_loss: 0.7117, test_loss: 0.7345, test_f1: 0.6506
 epoch: 98, train_loss: 0.6981, test_loss: 0.7745, test_f1: 0.6366
 epoch: 99, train_loss: 0.7040, test_loss: 0.8094, test_f1: 0.5939
##################ITERATION #1 ****************************************
 epoch: 0, train_loss: 1.1094, test_loss: 1.0320, test_f1: 0.3868
 epoch: 1, train_loss: 1.0273, test_loss: 1.0933, test_f1: 0.3991
 epoch: 2, train_loss: 0.9986, test_loss: 1.0615, test_f1: 0.4498
 epoch: 3, train_loss: 0.9789, test_loss: 1.0333, test_f1: 0.4978
 epoch: 4, train_loss: 0.9553, test_loss: 1.0238, test_f1: 0.4735
 epoch: 5, train_loss: 0.9527, test_loss: 0.9666, test_f1: 0.4644
 epoch: 6, train_loss: 0.9462, test_loss: 0.9744, test_f1: 0.4688
 epoch: 7, train_loss: 0.9263, test_loss: 1.0596, test_f1: 0.4689
 epoch: 8, train_loss: 0.9449, test_loss: 0.9702, test_f1: 0.5159
 epoch: 9, train_loss: 0.9283, test_loss: 0.9923, test_f1: 0.5111
 epoch: 10, train_loss: 0.9414, test_loss: 1.1505, test_f1: 0.4493
 epoch: 11, train_loss: 0.9392, test_loss: 0.9276, test_f1: 0.5269
 epoch: 12, train_loss: 0.9138, test_loss: 1.1243, test_f1: 0.4442
 epoch: 13, train_loss: 0.9155, test_loss: 1.0194, test_f1: 0.5026
 epoch: 14, train_loss: 0.9243, test_loss: 0.9653, test_f1: 0.5121
 epoch: 15, train_loss: 0.9328, test_loss: 1.0373, test_f1: 0.4734
 epoch: 16, train_loss: 0.9567, test_loss: 1.0858, test_f1: 0.3840
 epoch: 17, train_loss: 0.9544, test_loss: 0.9834, test_f1: 0.4943
 epoch: 18, train_loss: 0.9297, test_loss: 0.9942, test_f1: 0.5030
 epoch: 19, train_loss: 0.9129, test_loss: 0.9687, test_f1: 0.4828
 epoch: 20, train_loss: 0.9164, test_loss: 0.9496, test_f1: 0.5091
 epoch: 21, train_loss: 0.8967, test_loss: 0.9304, test_f1: 0.5144
 epoch: 22, train_loss: 0.8977, test_loss: 0.9289, test_f1: 0.5313
 epoch: 23, train_loss: 0.8864, test_loss: 0.9460, test_f1: 0.4902
 epoch: 24, train_loss: 0.9031, test_loss: 0.9146, test_f1: 0.5067
 epoch: 25, train_loss: 0.8903, test_loss: 0.8736, test_f1: 0.5781
 epoch: 26, train_loss: 0.8761, test_loss: 0.9055, test_f1: 0.5263
 epoch: 27, train_loss: 0.8825, test_loss: 0.8846, test_f1: 0.5656
 epoch: 28, train_loss: 0.8714, test_loss: 0.9196, test_f1: 0.5048
 epoch: 29, train_loss: 0.8808, test_loss: 0.8787, test_f1: 0.5675
 epoch: 30, train_loss: 0.8741, test_loss: 0.9307, test_f1: 0.5305
 epoch: 31, train_loss: 0.8847, test_loss: 0.9019, test_f1: 0.5355
 epoch: 32, train_loss: 0.8740, test_loss: 0.9003, test_f1: 0.5380
 epoch: 33, train_loss: 0.8535, test_loss: 0.8707, test_f1: 0.5648
 epoch: 34, train_loss: 0.8504, test_loss: 0.8766, test_f1: 0.5965
 epoch: 35, train_loss: 0.8603, test_loss: 0.8830, test_f1: 0.5673
 epoch: 36, train_loss: 0.8697, test_loss: 0.8826, test_f1: 0.5538
 epoch: 37, train_loss: 0.8720, test_loss: 1.0313, test_f1: 0.4668
 epoch: 38, train_loss: 0.8696, test_loss: 0.8902, test_f1: 0.5625
 epoch: 39, train_loss: 1.0021, test_loss: 1.3293, test_f1: 0.3103
 epoch: 40, train_loss: 1.0455, test_loss: 0.9752, test_f1: 0.4766
 epoch: 41, train_loss: 0.9996, test_loss: 1.1270, test_f1: 0.4447
 epoch: 42, train_loss: 0.9683, test_loss: 0.9886, test_f1: 0.4905
 epoch: 43, train_loss: 0.9552, test_loss: 0.9974, test_f1: 0.5112
 epoch: 44, train_loss: 0.9417, test_loss: 0.9559, test_f1: 0.4978
 epoch: 45, train_loss: 0.9291, test_loss: 0.9502, test_f1: 0.4784
 epoch: 46, train_loss: 0.9215, test_loss: 1.4545, test_f1: 0.3502
 epoch: 47, train_loss: 1.0043, test_loss: 0.9891, test_f1: 0.5048
 epoch: 48, train_loss: 0.9516, test_loss: 0.9671, test_f1: 0.4855
 epoch: 49, train_loss: 0.9231, test_loss: 0.9297, test_f1: 0.4949
 epoch: 50, train_loss: 0.9065, test_loss: 0.9485, test_f1: 0.4994
 epoch: 51, train_loss: 0.9065, test_loss: 0.8994, test_f1: 0.5116
 epoch: 52, train_loss: 0.8870, test_loss: 0.9032, test_f1: 0.5199
 epoch: 53, train_loss: 0.8885, test_loss: 0.9220, test_f1: 0.5100
 epoch: 54, train_loss: 0.9042, test_loss: 0.9329, test_f1: 0.5336
 epoch: 55, train_loss: 0.9076, test_loss: 0.9326, test_f1: 0.5150
 epoch: 56, train_loss: 0.8817, test_loss: 0.9072, test_f1: 0.5129
 epoch: 57, train_loss: 0.8858, test_loss: 0.9419, test_f1: 0.5139
 epoch: 58, train_loss: 0.8832, test_loss: 0.8989, test_f1: 0.5233
 epoch: 59, train_loss: 0.8779, test_loss: 0.8876, test_f1: 0.5333
 epoch: 60, train_loss: 0.8711, test_loss: 0.8987, test_f1: 0.5336
 epoch: 61, train_loss: 0.8624, test_loss: 0.9002, test_f1: 0.5443
 epoch: 62, train_loss: 0.8515, test_loss: 0.8936, test_f1: 0.5439
 epoch: 63, train_loss: 0.8572, test_loss: 0.8982, test_f1: 0.5276
 epoch: 64, train_loss: 0.8679, test_loss: 0.9086, test_f1: 0.5301
 epoch: 65, train_loss: 0.8500, test_loss: 0.8788, test_f1: 0.5428
 epoch: 66, train_loss: 0.8537, test_loss: 0.9273, test_f1: 0.5459
 epoch: 67, train_loss: 0.8588, test_loss: 0.9089, test_f1: 0.5317
 epoch: 68, train_loss: 0.8465, test_loss: 0.8909, test_f1: 0.5420
 epoch: 69, train_loss: 0.8449, test_loss: 0.8913, test_f1: 0.5383
 epoch: 70, train_loss: 0.8442, test_loss: 0.8820, test_f1: 0.5244
 epoch: 71, train_loss: 0.8538, test_loss: 0.8775, test_f1: 0.5658
 epoch: 72, train_loss: 0.8501, test_loss: 0.8984, test_f1: 0.5313
 epoch: 73, train_loss: 0.8486, test_loss: 0.8674, test_f1: 0.5383
 epoch: 74, train_loss: 0.8444, test_loss: 0.8776, test_f1: 0.5405
 epoch: 75, train_loss: 0.8376, test_loss: 0.9125, test_f1: 0.5325
 epoch: 76, train_loss: 0.8231, test_loss: 0.8977, test_f1: 0.5287
 epoch: 77, train_loss: 0.8283, test_loss: 0.8869, test_f1: 0.5341
 epoch: 78, train_loss: 0.8364, test_loss: 0.9303, test_f1: 0.5216
 epoch: 79, train_loss: 0.8356, test_loss: 0.8711, test_f1: 0.5335
 epoch: 80, train_loss: 0.8277, test_loss: 0.8794, test_f1: 0.5280
 epoch: 81, train_loss: 0.8289, test_loss: 0.8836, test_f1: 0.5163
 epoch: 82, train_loss: 0.8242, test_loss: 0.8774, test_f1: 0.5411
 epoch: 83, train_loss: 0.8305, test_loss: 0.8561, test_f1: 0.5440
 epoch: 84, train_loss: 0.8222, test_loss: 0.8748, test_f1: 0.5501
 epoch: 85, train_loss: 0.8312, test_loss: 0.8718, test_f1: 0.5449
 epoch: 86, train_loss: 0.8184, test_loss: 0.8868, test_f1: 0.5526
 epoch: 87, train_loss: 0.8166, test_loss: 0.8758, test_f1: 0.5553
 epoch: 88, train_loss: 0.8242, test_loss: 0.8746, test_f1: 0.5416
 epoch: 89, train_loss: 0.8050, test_loss: 0.8772, test_f1: 0.5566
 epoch: 90, train_loss: 0.8038, test_loss: 0.8758, test_f1: 0.5566
 epoch: 91, train_loss: 0.7944, test_loss: 0.8887, test_f1: 0.5348
 epoch: 92, train_loss: 0.8131, test_loss: 0.8949, test_f1: 0.5233
 epoch: 93, train_loss: 0.8170, test_loss: 0.8898, test_f1: 0.5600
 epoch: 94, train_loss: 0.8224, test_loss: 0.8808, test_f1: 0.5538
 epoch: 95, train_loss: 0.8114, test_loss: 0.8779, test_f1: 0.5784
 epoch: 96, train_loss: 0.8035, test_loss: 0.8492, test_f1: 0.5746
 epoch: 97, train_loss: 0.7976, test_loss: 0.9162, test_f1: 0.5754
 epoch: 98, train_loss: 0.8089, test_loss: 0.8616, test_f1: 0.5943
 epoch: 99, train_loss: 0.7916, test_loss: 0.8796, test_f1: 0.6063
##################ITERATION #2 ****************************************
 epoch: 0, train_loss: 1.1088, test_loss: 1.1739, test_f1: 0.3579
 epoch: 1, train_loss: 1.0167, test_loss: 0.9740, test_f1: 0.5186
 epoch: 2, train_loss: 0.9998, test_loss: 0.9636, test_f1: 0.4891
 epoch: 3, train_loss: 0.9786, test_loss: 1.0404, test_f1: 0.4403
 epoch: 4, train_loss: 0.9644, test_loss: 0.9613, test_f1: 0.4954
 epoch: 5, train_loss: 0.9712, test_loss: 1.0775, test_f1: 0.4017
 epoch: 6, train_loss: 0.9667, test_loss: 1.0278, test_f1: 0.4324
 epoch: 7, train_loss: 0.9600, test_loss: 0.9551, test_f1: 0.5054
 epoch: 8, train_loss: 0.9468, test_loss: 1.0544, test_f1: 0.4394
 epoch: 9, train_loss: 0.9417, test_loss: 0.9911, test_f1: 0.4379
 epoch: 10, train_loss: 0.9570, test_loss: 1.0158, test_f1: 0.5187
 epoch: 11, train_loss: 0.9529, test_loss: 0.9289, test_f1: 0.4893
 epoch: 12, train_loss: 0.9438, test_loss: 1.0504, test_f1: 0.4956
 epoch: 13, train_loss: 0.9366, test_loss: 0.9445, test_f1: 0.4683
 epoch: 14, train_loss: 0.9044, test_loss: 0.9052, test_f1: 0.5320
 epoch: 15, train_loss: 0.9025, test_loss: 0.8124, test_f1: 0.5405
 epoch: 16, train_loss: 0.8975, test_loss: 0.9034, test_f1: 0.5093
 epoch: 17, train_loss: 0.8897, test_loss: 0.9623, test_f1: 0.5162
 epoch: 18, train_loss: 0.9036, test_loss: 0.8591, test_f1: 0.5639
 epoch: 19, train_loss: 0.8973, test_loss: 0.8983, test_f1: 0.4986
 epoch: 20, train_loss: 0.8906, test_loss: 0.9089, test_f1: 0.4784
 epoch: 21, train_loss: 0.8673, test_loss: 0.8578, test_f1: 0.5210
 epoch: 22, train_loss: 0.8816, test_loss: 0.8464, test_f1: 0.5125
 epoch: 23, train_loss: 0.8880, test_loss: 0.8689, test_f1: 0.5060
 epoch: 24, train_loss: 0.8728, test_loss: 0.8952, test_f1: 0.5213
 epoch: 25, train_loss: 0.8596, test_loss: 0.8586, test_f1: 0.5206
 epoch: 26, train_loss: 0.8710, test_loss: 0.8223, test_f1: 0.5221
 epoch: 27, train_loss: 0.8743, test_loss: 0.9464, test_f1: 0.4944
 epoch: 28, train_loss: 0.9135, test_loss: 0.9151, test_f1: 0.5115
 epoch: 29, train_loss: 0.8901, test_loss: 1.1240, test_f1: 0.4464
 epoch: 30, train_loss: 0.8871, test_loss: 0.7879, test_f1: 0.5651
 epoch: 31, train_loss: 0.8750, test_loss: 0.8350, test_f1: 0.5869
 epoch: 32, train_loss: 0.8513, test_loss: 0.7847, test_f1: 0.5530
 epoch: 33, train_loss: 0.8581, test_loss: 0.8158, test_f1: 0.5371
 epoch: 34, train_loss: 0.8470, test_loss: 0.7977, test_f1: 0.5742
 epoch: 35, train_loss: 0.8523, test_loss: 0.7978, test_f1: 0.5875
 epoch: 36, train_loss: 0.8495, test_loss: 0.7840, test_f1: 0.5494
 epoch: 37, train_loss: 0.8479, test_loss: 0.8128, test_f1: 0.5722
 epoch: 38, train_loss: 0.8500, test_loss: 0.8456, test_f1: 0.5761
 epoch: 39, train_loss: 0.8393, test_loss: 0.8376, test_f1: 0.5735
 epoch: 40, train_loss: 0.8436, test_loss: 0.8367, test_f1: 0.5117
 epoch: 41, train_loss: 0.8333, test_loss: 0.8074, test_f1: 0.5488
 epoch: 42, train_loss: 0.8360, test_loss: 0.8336, test_f1: 0.5965
 epoch: 43, train_loss: 0.8422, test_loss: 0.8172, test_f1: 0.5872
 epoch: 44, train_loss: 0.8421, test_loss: 0.8047, test_f1: 0.5391
 epoch: 45, train_loss: 0.8212, test_loss: 0.7884, test_f1: 0.5679
 epoch: 46, train_loss: 0.8140, test_loss: 0.8119, test_f1: 0.5696
 epoch: 47, train_loss: 0.8253, test_loss: 0.8110, test_f1: 0.5608
 epoch: 48, train_loss: 0.8255, test_loss: 0.8524, test_f1: 0.6021
 epoch: 49, train_loss: 0.8179, test_loss: 0.8542, test_f1: 0.5514
 epoch: 50, train_loss: 0.8282, test_loss: 0.8092, test_f1: 0.6015
 epoch: 51, train_loss: 0.7986, test_loss: 0.8255, test_f1: 0.5799
 epoch: 52, train_loss: 0.7863, test_loss: 0.8117, test_f1: 0.5756
 epoch: 53, train_loss: 0.7887, test_loss: 0.8061, test_f1: 0.5880
 epoch: 54, train_loss: 0.8052, test_loss: 0.7806, test_f1: 0.6005
 epoch: 55, train_loss: 0.7774, test_loss: 0.7844, test_f1: 0.5803
 epoch: 56, train_loss: 0.7811, test_loss: 0.7967, test_f1: 0.5949
 epoch: 57, train_loss: 0.7753, test_loss: 0.8550, test_f1: 0.5741
 epoch: 58, train_loss: 0.7631, test_loss: 0.8462, test_f1: 0.5615
 epoch: 59, train_loss: 0.7714, test_loss: 0.7833, test_f1: 0.6072
 epoch: 60, train_loss: 0.7828, test_loss: 0.8228, test_f1: 0.5961
 epoch: 61, train_loss: 0.7721, test_loss: 0.8475, test_f1: 0.5969
 epoch: 62, train_loss: 0.7589, test_loss: 0.8546, test_f1: 0.5985
 epoch: 63, train_loss: 0.7666, test_loss: 0.8481, test_f1: 0.6001
 epoch: 64, train_loss: 0.7705, test_loss: 0.8224, test_f1: 0.6113
 epoch: 65, train_loss: 0.7648, test_loss: 0.7893, test_f1: 0.6174
 epoch: 66, train_loss: 0.7636, test_loss: 0.7873, test_f1: 0.5944
 epoch: 67, train_loss: 0.7603, test_loss: 0.8248, test_f1: 0.5832
 epoch: 68, train_loss: 0.7557, test_loss: 0.8124, test_f1: 0.5995
 epoch: 69, train_loss: 0.7507, test_loss: 0.8199, test_f1: 0.6072
 epoch: 70, train_loss: 0.7556, test_loss: 0.8082, test_f1: 0.5941
 epoch: 71, train_loss: 0.7549, test_loss: 0.7937, test_f1: 0.6050
 epoch: 72, train_loss: 0.7558, test_loss: 0.8032, test_f1: 0.6078
 epoch: 73, train_loss: 0.7512, test_loss: 0.8423, test_f1: 0.6125
 epoch: 74, train_loss: 0.7480, test_loss: 0.8810, test_f1: 0.6065
 epoch: 75, train_loss: 0.7429, test_loss: 0.8632, test_f1: 0.5835
 epoch: 76, train_loss: 0.7537, test_loss: 0.7988, test_f1: 0.6019
 epoch: 77, train_loss: 0.7413, test_loss: 0.8225, test_f1: 0.5808
 epoch: 78, train_loss: 0.7443, test_loss: 0.8064, test_f1: 0.6236
 epoch: 79, train_loss: 0.7504, test_loss: 0.8219, test_f1: 0.6052
 epoch: 80, train_loss: 0.7457, test_loss: 0.7736, test_f1: 0.6138
 epoch: 81, train_loss: 0.7451, test_loss: 0.8086, test_f1: 0.6113
 epoch: 82, train_loss: 0.7560, test_loss: 0.7922, test_f1: 0.6267
 epoch: 83, train_loss: 0.7312, test_loss: 0.8454, test_f1: 0.6152
 epoch: 84, train_loss: 0.7401, test_loss: 0.7523, test_f1: 0.6186
 epoch: 85, train_loss: 0.7354, test_loss: 0.7681, test_f1: 0.6232
 epoch: 86, train_loss: 0.7273, test_loss: 0.8088, test_f1: 0.6037
 epoch: 87, train_loss: 0.7622, test_loss: 0.8402, test_f1: 0.6088
 epoch: 88, train_loss: 0.7260, test_loss: 0.7808, test_f1: 0.5952
 epoch: 89, train_loss: 0.7378, test_loss: 0.7729, test_f1: 0.5990
 epoch: 90, train_loss: 0.7327, test_loss: 0.7976, test_f1: 0.6028
 epoch: 91, train_loss: 0.7266, test_loss: 0.8032, test_f1: 0.5928
 epoch: 92, train_loss: 0.7196, test_loss: 0.7738, test_f1: 0.6191
 epoch: 93, train_loss: 0.7397, test_loss: 0.7673, test_f1: 0.6030
 epoch: 94, train_loss: 0.7310, test_loss: 0.7389, test_f1: 0.6307
 epoch: 95, train_loss: 0.7192, test_loss: 0.7778, test_f1: 0.6272
 epoch: 96, train_loss: 0.7297, test_loss: 0.7561, test_f1: 0.6171
 epoch: 97, train_loss: 0.7317, test_loss: 0.7574, test_f1: 0.6496
 epoch: 98, train_loss: 0.7268, test_loss: 0.7873, test_f1: 0.6137
 epoch: 99, train_loss: 0.7306, test_loss: 0.7701, test_f1: 0.6482
##################ITERATION #3 ****************************************
 epoch: 0, train_loss: 1.1875, test_loss: 1.0397, test_f1: 0.4780
 epoch: 1, train_loss: 1.0495, test_loss: 0.9838, test_f1: 0.4480
 epoch: 2, train_loss: 1.0096, test_loss: 0.9963, test_f1: 0.4723
 epoch: 3, train_loss: 0.9823, test_loss: 0.9705, test_f1: 0.4881
 epoch: 4, train_loss: 0.9758, test_loss: 1.0247, test_f1: 0.5020
 epoch: 5, train_loss: 0.9569, test_loss: 0.9925, test_f1: 0.4986
 epoch: 6, train_loss: 0.9516, test_loss: 0.9523, test_f1: 0.5156
 epoch: 7, train_loss: 0.9496, test_loss: 0.9780, test_f1: 0.4808
 epoch: 8, train_loss: 0.9362, test_loss: 0.9572, test_f1: 0.5128
 epoch: 9, train_loss: 0.9297, test_loss: 0.9131, test_f1: 0.5285
 epoch: 10, train_loss: 0.9236, test_loss: 0.9740, test_f1: 0.5187
 epoch: 11, train_loss: 0.9207, test_loss: 0.9699, test_f1: 0.4986
 epoch: 12, train_loss: 0.9030, test_loss: 0.9076, test_f1: 0.5510
 epoch: 13, train_loss: 0.8973, test_loss: 0.9496, test_f1: 0.4937
 epoch: 14, train_loss: 0.8961, test_loss: 0.8907, test_f1: 0.5360
 epoch: 15, train_loss: 0.8810, test_loss: 0.9512, test_f1: 0.5104
 epoch: 16, train_loss: 0.8864, test_loss: 0.8992, test_f1: 0.5426
 epoch: 17, train_loss: 0.8855, test_loss: 0.9080, test_f1: 0.5330
 epoch: 18, train_loss: 0.8866, test_loss: 0.9330, test_f1: 0.5280
 epoch: 19, train_loss: 0.8706, test_loss: 0.9056, test_f1: 0.5483
 epoch: 20, train_loss: 0.8686, test_loss: 0.9088, test_f1: 0.5037
 epoch: 21, train_loss: 0.8664, test_loss: 1.0023, test_f1: 0.4960
 epoch: 22, train_loss: 0.8748, test_loss: 0.8842, test_f1: 0.5184
 epoch: 23, train_loss: 0.8757, test_loss: 0.8651, test_f1: 0.5178
 epoch: 24, train_loss: 0.8500, test_loss: 0.8825, test_f1: 0.5281
 epoch: 25, train_loss: 0.8700, test_loss: 0.8913, test_f1: 0.5778
 epoch: 26, train_loss: 0.8273, test_loss: 0.9175, test_f1: 0.5162
 epoch: 27, train_loss: 0.8252, test_loss: 0.8428, test_f1: 0.5212
 epoch: 28, train_loss: 0.8354, test_loss: 0.9232, test_f1: 0.5401
 epoch: 29, train_loss: 0.8194, test_loss: 0.8229, test_f1: 0.5601
 epoch: 30, train_loss: 0.8382, test_loss: 0.8989, test_f1: 0.5343
 epoch: 31, train_loss: 0.8426, test_loss: 0.8479, test_f1: 0.5657
 epoch: 32, train_loss: 0.8174, test_loss: 0.8850, test_f1: 0.5256
 epoch: 33, train_loss: 0.8269, test_loss: 0.8435, test_f1: 0.5471
 epoch: 34, train_loss: 0.8079, test_loss: 1.0024, test_f1: 0.5110
 epoch: 35, train_loss: 0.8112, test_loss: 0.8186, test_f1: 0.5319
 epoch: 36, train_loss: 0.8055, test_loss: 0.8996, test_f1: 0.5498
 epoch: 37, train_loss: 0.8126, test_loss: 0.9785, test_f1: 0.5074
 epoch: 38, train_loss: 0.8076, test_loss: 0.9046, test_f1: 0.5589
 epoch: 39, train_loss: 0.8081, test_loss: 0.8413, test_f1: 0.5740
 epoch: 40, train_loss: 0.8082, test_loss: 0.9668, test_f1: 0.5012
 epoch: 41, train_loss: 0.7952, test_loss: 0.8741, test_f1: 0.5678
 epoch: 42, train_loss: 0.8118, test_loss: 0.8412, test_f1: 0.5520
 epoch: 43, train_loss: 0.8249, test_loss: 0.8889, test_f1: 0.5571
 epoch: 44, train_loss: 0.8204, test_loss: 0.8633, test_f1: 0.5584
 epoch: 45, train_loss: 0.7915, test_loss: 0.8599, test_f1: 0.5979
 epoch: 46, train_loss: 0.8084, test_loss: 0.8264, test_f1: 0.5704
 epoch: 47, train_loss: 0.8034, test_loss: 0.8166, test_f1: 0.5991
 epoch: 48, train_loss: 0.7974, test_loss: 0.8837, test_f1: 0.5584
 epoch: 49, train_loss: 0.7956, test_loss: 0.7660, test_f1: 0.5670
 epoch: 50, train_loss: 0.7973, test_loss: 0.7994, test_f1: 0.5941
 epoch: 51, train_loss: 0.7817, test_loss: 0.8313, test_f1: 0.5830
 epoch: 52, train_loss: 0.7589, test_loss: 0.8415, test_f1: 0.5923
 epoch: 53, train_loss: 0.7576, test_loss: 0.8607, test_f1: 0.5925
 epoch: 54, train_loss: 0.7494, test_loss: 0.7852, test_f1: 0.6107
 epoch: 55, train_loss: 0.7581, test_loss: 0.8310, test_f1: 0.5770
 epoch: 56, train_loss: 0.7382, test_loss: 0.8970, test_f1: 0.5748
 epoch: 57, train_loss: 0.7477, test_loss: 0.8415, test_f1: 0.6070
 epoch: 58, train_loss: 0.7347, test_loss: 0.7788, test_f1: 0.6038
 epoch: 59, train_loss: 0.7379, test_loss: 0.8626, test_f1: 0.6255
 epoch: 60, train_loss: 0.7456, test_loss: 0.8527, test_f1: 0.6061
 epoch: 61, train_loss: 0.7320, test_loss: 0.8602, test_f1: 0.5843
 epoch: 62, train_loss: 0.7386, test_loss: 0.8283, test_f1: 0.5882
 epoch: 63, train_loss: 0.7302, test_loss: 0.7941, test_f1: 0.6026
 epoch: 64, train_loss: 0.7425, test_loss: 0.7906, test_f1: 0.5938
 epoch: 65, train_loss: 0.7289, test_loss: 0.8726, test_f1: 0.5816
 epoch: 66, train_loss: 0.7280, test_loss: 0.7542, test_f1: 0.6223
 epoch: 67, train_loss: 0.7401, test_loss: 0.7521, test_f1: 0.6189
 epoch: 68, train_loss: 0.7300, test_loss: 0.8331, test_f1: 0.6147
 epoch: 69, train_loss: 0.7190, test_loss: 0.8091, test_f1: 0.6035
 epoch: 70, train_loss: 0.7225, test_loss: 0.8174, test_f1: 0.6255
 epoch: 71, train_loss: 0.7275, test_loss: 0.7981, test_f1: 0.6068
 epoch: 72, train_loss: 0.7084, test_loss: 0.8115, test_f1: 0.6200
 epoch: 73, train_loss: 0.7174, test_loss: 0.8004, test_f1: 0.6037
 epoch: 74, train_loss: 0.7185, test_loss: 0.8153, test_f1: 0.6281
 epoch: 75, train_loss: 0.7132, test_loss: 0.8106, test_f1: 0.6160
 epoch: 76, train_loss: 0.7242, test_loss: 0.8867, test_f1: 0.6311
 epoch: 77, train_loss: 0.7042, test_loss: 0.7870, test_f1: 0.6112
 epoch: 78, train_loss: 0.7069, test_loss: 0.8102, test_f1: 0.6086
 epoch: 79, train_loss: 0.7246, test_loss: 0.8754, test_f1: 0.5566
 epoch: 80, train_loss: 0.7041, test_loss: 0.7851, test_f1: 0.6368
 epoch: 81, train_loss: 0.7149, test_loss: 0.8544, test_f1: 0.5955
 epoch: 82, train_loss: 0.6994, test_loss: 0.7945, test_f1: 0.6238
 epoch: 83, train_loss: 0.7181, test_loss: 0.8135, test_f1: 0.5879
 epoch: 84, train_loss: 0.6988, test_loss: 0.7889, test_f1: 0.5842
 epoch: 85, train_loss: 0.7096, test_loss: 0.8208, test_f1: 0.6290
 epoch: 86, train_loss: 0.6961, test_loss: 0.8260, test_f1: 0.6329
 epoch: 87, train_loss: 0.7071, test_loss: 0.8699, test_f1: 0.5957
 epoch: 88, train_loss: 0.7144, test_loss: 0.8285, test_f1: 0.6215
 epoch: 89, train_loss: 0.7021, test_loss: 0.8366, test_f1: 0.6191
 epoch: 90, train_loss: 0.7027, test_loss: 0.8477, test_f1: 0.6341
 epoch: 91, train_loss: 0.6946, test_loss: 0.9178, test_f1: 0.5976
 epoch: 92, train_loss: 0.7044, test_loss: 0.8338, test_f1: 0.6075
 epoch: 93, train_loss: 0.6868, test_loss: 0.8031, test_f1: 0.6376
 epoch: 94, train_loss: 0.6952, test_loss: 0.9014, test_f1: 0.6126
 epoch: 95, train_loss: 0.6973, test_loss: 0.8357, test_f1: 0.6015
 epoch: 96, train_loss: 0.7024, test_loss: 0.8691, test_f1: 0.6105
 epoch: 97, train_loss: 0.7085, test_loss: 0.8382, test_f1: 0.5763
 epoch: 98, train_loss: 0.6865, test_loss: 0.8026, test_f1: 0.6148
 epoch: 99, train_loss: 0.6989, test_loss: 0.8939, test_f1: 0.5918
##################ITERATION #4 ****************************************
 epoch: 0, train_loss: 1.1575, test_loss: 1.0977, test_f1: 0.4389
 epoch: 1, train_loss: 1.0207, test_loss: 1.0310, test_f1: 0.4618
 epoch: 2, train_loss: 0.9802, test_loss: 1.0150, test_f1: 0.4620
 epoch: 3, train_loss: 0.9726, test_loss: 1.0536, test_f1: 0.4806
 epoch: 4, train_loss: 0.9704, test_loss: 0.9798, test_f1: 0.4743
 epoch: 5, train_loss: 0.9550, test_loss: 0.9894, test_f1: 0.4691
 epoch: 6, train_loss: 0.9321, test_loss: 0.9614, test_f1: 0.5095
 epoch: 7, train_loss: 0.9406, test_loss: 1.1141, test_f1: 0.4505
 epoch: 8, train_loss: 0.9406, test_loss: 0.9545, test_f1: 0.5056
 epoch: 9, train_loss: 0.9213, test_loss: 0.9801, test_f1: 0.4790
 epoch: 10, train_loss: 0.9097, test_loss: 0.9981, test_f1: 0.4656
 epoch: 11, train_loss: 0.9331, test_loss: 1.0028, test_f1: 0.4998
 epoch: 12, train_loss: 0.9238, test_loss: 0.8888, test_f1: 0.5033
 epoch: 13, train_loss: 0.9129, test_loss: 0.9580, test_f1: 0.5114
 epoch: 14, train_loss: 0.8981, test_loss: 0.8832, test_f1: 0.5147
 epoch: 15, train_loss: 0.9069, test_loss: 0.9024, test_f1: 0.4978
 epoch: 16, train_loss: 0.8932, test_loss: 1.1135, test_f1: 0.4525
 epoch: 17, train_loss: 0.8857, test_loss: 0.9514, test_f1: 0.5028
 epoch: 18, train_loss: 0.8984, test_loss: 0.8939, test_f1: 0.5203
 epoch: 19, train_loss: 0.8751, test_loss: 0.8568, test_f1: 0.5396
 epoch: 20, train_loss: 0.8695, test_loss: 0.8720, test_f1: 0.5137
 epoch: 21, train_loss: 0.9095, test_loss: 1.2907, test_f1: 0.4469
 epoch: 22, train_loss: 0.8862, test_loss: 0.9069, test_f1: 0.5128
 epoch: 23, train_loss: 0.8655, test_loss: 0.9319, test_f1: 0.4808
 epoch: 24, train_loss: 0.8669, test_loss: 0.8469, test_f1: 0.5175
 epoch: 25, train_loss: 0.8617, test_loss: 0.8474, test_f1: 0.5328
 epoch: 26, train_loss: 0.8546, test_loss: 0.9322, test_f1: 0.5322
 epoch: 27, train_loss: 0.8602, test_loss: 0.9532, test_f1: 0.4998
 epoch: 28, train_loss: 0.8655, test_loss: 0.8173, test_f1: 0.5447
 epoch: 29, train_loss: 0.8456, test_loss: 0.8424, test_f1: 0.5368
 epoch: 30, train_loss: 0.8354, test_loss: 0.8595, test_f1: 0.5375
 epoch: 31, train_loss: 0.8315, test_loss: 0.9783, test_f1: 0.5145
 epoch: 32, train_loss: 0.8477, test_loss: 2.3524, test_f1: 0.3523
 epoch: 33, train_loss: 0.8490, test_loss: 0.8421, test_f1: 0.5362
 epoch: 34, train_loss: 0.8351, test_loss: 0.8694, test_f1: 0.5490
 epoch: 35, train_loss: 0.8330, test_loss: 0.8401, test_f1: 0.5517
 epoch: 36, train_loss: 0.8251, test_loss: 0.8405, test_f1: 0.5305
 epoch: 37, train_loss: 0.8162, test_loss: 0.8618, test_f1: 0.5593
 epoch: 38, train_loss: 0.8046, test_loss: 0.8196, test_f1: 0.5396
 epoch: 39, train_loss: 0.8182, test_loss: 0.8438, test_f1: 0.5677
 epoch: 40, train_loss: 0.8117, test_loss: 0.7994, test_f1: 0.5861
 epoch: 41, train_loss: 0.8212, test_loss: 0.8101, test_f1: 0.5814
 epoch: 42, train_loss: 0.8064, test_loss: 0.8297, test_f1: 0.5747
 epoch: 43, train_loss: 0.8077, test_loss: 0.8013, test_f1: 0.5635
 epoch: 44, train_loss: 0.8097, test_loss: 0.8492, test_f1: 0.5374
 epoch: 45, train_loss: 0.7896, test_loss: 0.8047, test_f1: 0.5652
 epoch: 46, train_loss: 0.8046, test_loss: 0.8478, test_f1: 0.5381
 epoch: 47, train_loss: 0.8146, test_loss: 0.8522, test_f1: 0.5775
 epoch: 48, train_loss: 0.7874, test_loss: 0.8419, test_f1: 0.5322
 epoch: 49, train_loss: 0.8166, test_loss: 0.8120, test_f1: 0.5778
 epoch: 50, train_loss: 0.8268, test_loss: 0.8063, test_f1: 0.5755
 epoch: 51, train_loss: 0.7861, test_loss: 0.8033, test_f1: 0.5870
 epoch: 52, train_loss: 0.7790, test_loss: 0.7816, test_f1: 0.5778
 epoch: 53, train_loss: 0.7674, test_loss: 0.7945, test_f1: 0.5931
 epoch: 54, train_loss: 0.7600, test_loss: 0.8026, test_f1: 0.5728
 epoch: 55, train_loss: 0.7635, test_loss: 0.8276, test_f1: 0.5569
 epoch: 56, train_loss: 0.7620, test_loss: 0.8196, test_f1: 0.5982
 epoch: 57, train_loss: 0.7628, test_loss: 0.8047, test_f1: 0.5917
 epoch: 58, train_loss: 0.7501, test_loss: 0.8630, test_f1: 0.5789
 epoch: 59, train_loss: 0.7563, test_loss: 0.8461, test_f1: 0.6038
 epoch: 60, train_loss: 0.7620, test_loss: 0.8120, test_f1: 0.5981
 epoch: 61, train_loss: 0.7504, test_loss: 0.8156, test_f1: 0.5945
 epoch: 62, train_loss: 0.7337, test_loss: 0.8279, test_f1: 0.6035
 epoch: 63, train_loss: 0.7366, test_loss: 0.7983, test_f1: 0.6011
 epoch: 64, train_loss: 0.7509, test_loss: 0.8065, test_f1: 0.6012
 epoch: 65, train_loss: 0.7392, test_loss: 0.8486, test_f1: 0.5751
 epoch: 66, train_loss: 0.7285, test_loss: 0.8446, test_f1: 0.5867
 epoch: 67, train_loss: 0.7324, test_loss: 0.8835, test_f1: 0.5952
 epoch: 68, train_loss: 0.7424, test_loss: 0.8854, test_f1: 0.5774
 epoch: 69, train_loss: 0.7463, test_loss: 0.8004, test_f1: 0.6207
 epoch: 70, train_loss: 0.7282, test_loss: 0.8517, test_f1: 0.6090
 epoch: 71, train_loss: 0.7303, test_loss: 0.8000, test_f1: 0.6198
 epoch: 72, train_loss: 0.7385, test_loss: 0.8537, test_f1: 0.5684
 epoch: 73, train_loss: 0.7337, test_loss: 0.8268, test_f1: 0.5979
 epoch: 74, train_loss: 0.7378, test_loss: 0.8323, test_f1: 0.5835
 epoch: 75, train_loss: 0.7287, test_loss: 0.8277, test_f1: 0.6398
 epoch: 76, train_loss: 0.7499, test_loss: 0.8349, test_f1: 0.6094
 epoch: 77, train_loss: 0.7398, test_loss: 0.8201, test_f1: 0.6181
 epoch: 78, train_loss: 0.7262, test_loss: 0.8281, test_f1: 0.5935
 epoch: 79, train_loss: 0.7193, test_loss: 0.8212, test_f1: 0.5913
 epoch: 80, train_loss: 0.7143, test_loss: 0.8675, test_f1: 0.5864
 epoch: 81, train_loss: 0.7193, test_loss: 0.7915, test_f1: 0.6129
 epoch: 82, train_loss: 0.7164, test_loss: 0.8265, test_f1: 0.5979
 epoch: 83, train_loss: 0.7252, test_loss: 0.8333, test_f1: 0.6018
 epoch: 84, train_loss: 0.7090, test_loss: 0.8407, test_f1: 0.6258
 epoch: 85, train_loss: 0.7227, test_loss: 0.8386, test_f1: 0.6113
 epoch: 86, train_loss: 0.7079, test_loss: 0.8289, test_f1: 0.6248
 epoch: 87, train_loss: 0.7268, test_loss: 0.9279, test_f1: 0.5920
 epoch: 88, train_loss: 0.7388, test_loss: 0.8340, test_f1: 0.5947
 epoch: 89, train_loss: 0.7049, test_loss: 0.8985, test_f1: 0.5876
 epoch: 90, train_loss: 0.7040, test_loss: 0.8507, test_f1: 0.6167
 epoch: 91, train_loss: 0.6966, test_loss: 0.8520, test_f1: 0.6061
 epoch: 92, train_loss: 0.6960, test_loss: 0.8639, test_f1: 0.6131
 epoch: 93, train_loss: 0.7164, test_loss: 0.8395, test_f1: 0.6139
 epoch: 94, train_loss: 0.6974, test_loss: 0.9184, test_f1: 0.5917
 epoch: 95, train_loss: 0.7038, test_loss: 0.8511, test_f1: 0.6205
 epoch: 96, train_loss: 0.7078, test_loss: 0.8395, test_f1: 0.6045
 epoch: 97, train_loss: 0.7143, test_loss: 0.8694, test_f1: 0.6006
 epoch: 98, train_loss: 0.7270, test_loss: 0.8631, test_f1: 0.5978
 epoch: 99, train_loss: 0.7311, test_loss: 0.8367, test_f1: 0.6245
##################ITERATION #5 ****************************************
 epoch: 0, train_loss: 1.1137, test_loss: 1.3728, test_f1: 0.3208
 epoch: 1, train_loss: 1.0153, test_loss: 1.0533, test_f1: 0.4499
 epoch: 2, train_loss: 0.9945, test_loss: 1.1153, test_f1: 0.4023
 epoch: 3, train_loss: 0.9807, test_loss: 1.2679, test_f1: 0.4132
 epoch: 4, train_loss: 0.9669, test_loss: 1.0582, test_f1: 0.4887
 epoch: 5, train_loss: 0.9633, test_loss: 0.9796, test_f1: 0.4775
 epoch: 6, train_loss: 0.9435, test_loss: 0.9380, test_f1: 0.5428
 epoch: 7, train_loss: 0.9329, test_loss: 1.0235, test_f1: 0.4610
 epoch: 8, train_loss: 0.9243, test_loss: 0.9564, test_f1: 0.4934
 epoch: 9, train_loss: 0.9273, test_loss: 1.0524, test_f1: 0.4966
 epoch: 10, train_loss: 0.9078, test_loss: 0.9248, test_f1: 0.5243
 epoch: 11, train_loss: 0.8999, test_loss: 0.9848, test_f1: 0.4930
 epoch: 12, train_loss: 0.8977, test_loss: 1.0194, test_f1: 0.4811
 epoch: 13, train_loss: 0.9150, test_loss: 0.9322, test_f1: 0.5240
 epoch: 14, train_loss: 0.8948, test_loss: 0.9448, test_f1: 0.5109
 epoch: 15, train_loss: 0.8934, test_loss: 0.9592, test_f1: 0.5142
 epoch: 16, train_loss: 0.8786, test_loss: 0.8370, test_f1: 0.5429
 epoch: 17, train_loss: 0.8570, test_loss: 0.8859, test_f1: 0.5350
 epoch: 18, train_loss: 0.8647, test_loss: 1.0165, test_f1: 0.5030
 epoch: 19, train_loss: 0.8795, test_loss: 0.8758, test_f1: 0.5378
 epoch: 20, train_loss: 0.8833, test_loss: 1.1267, test_f1: 0.4900
 epoch: 21, train_loss: 0.8736, test_loss: 0.8739, test_f1: 0.5687
 epoch: 22, train_loss: 0.8841, test_loss: 0.8443, test_f1: 0.5470
 epoch: 23, train_loss: 0.8746, test_loss: 0.8797, test_f1: 0.5380
 epoch: 24, train_loss: 0.8582, test_loss: 0.8916, test_f1: 0.5365
 epoch: 25, train_loss: 0.8715, test_loss: 0.9598, test_f1: 0.5114
 epoch: 26, train_loss: 0.8778, test_loss: 0.8544, test_f1: 0.5420
 epoch: 27, train_loss: 0.8549, test_loss: 0.8364, test_f1: 0.5509
 epoch: 28, train_loss: 0.8433, test_loss: 0.8116, test_f1: 0.5823
 epoch: 29, train_loss: 0.8308, test_loss: 0.8081, test_f1: 0.6009
 epoch: 30, train_loss: 0.8237, test_loss: 0.8306, test_f1: 0.5749
 epoch: 31, train_loss: 0.8298, test_loss: 0.8333, test_f1: 0.5826
 epoch: 32, train_loss: 0.8363, test_loss: 0.8897, test_f1: 0.5553
 epoch: 33, train_loss: 0.8467, test_loss: 0.8941, test_f1: 0.5330
 epoch: 34, train_loss: 0.8347, test_loss: 0.8175, test_f1: 0.5861
 epoch: 35, train_loss: 0.8312, test_loss: 0.8443, test_f1: 0.5363
 epoch: 36, train_loss: 0.8266, test_loss: 0.8640, test_f1: 0.5745
 epoch: 37, train_loss: 0.8257, test_loss: 0.8209, test_f1: 0.5624
 epoch: 38, train_loss: 0.8252, test_loss: 0.8440, test_f1: 0.5682
 epoch: 39, train_loss: 0.8198, test_loss: 0.7802, test_f1: 0.6000
 epoch: 40, train_loss: 0.8187, test_loss: 0.8813, test_f1: 0.5796
 epoch: 41, train_loss: 0.8286, test_loss: 0.8883, test_f1: 0.5534
 epoch: 42, train_loss: 0.8419, test_loss: 0.9102, test_f1: 0.5246
 epoch: 43, train_loss: 0.8233, test_loss: 0.8374, test_f1: 0.5665
 epoch: 44, train_loss: 0.8229, test_loss: 0.8139, test_f1: 0.5817
 epoch: 45, train_loss: 0.8087, test_loss: 0.7726, test_f1: 0.5726
 epoch: 46, train_loss: 0.8062, test_loss: 0.9011, test_f1: 0.5362
 epoch: 47, train_loss: 0.8358, test_loss: 0.8533, test_f1: 0.5665
 epoch: 48, train_loss: 0.8058, test_loss: 0.8543, test_f1: 0.5810
 epoch: 49, train_loss: 0.8010, test_loss: 0.7850, test_f1: 0.6012
 epoch: 50, train_loss: 0.8248, test_loss: 0.8311, test_f1: 0.6164
 epoch: 51, train_loss: 0.7964, test_loss: 0.8099, test_f1: 0.5826
 epoch: 52, train_loss: 0.7884, test_loss: 0.8083, test_f1: 0.5940
 epoch: 53, train_loss: 0.7848, test_loss: 0.8072, test_f1: 0.5859
 epoch: 54, train_loss: 0.7771, test_loss: 0.8228, test_f1: 0.6044
 epoch: 55, train_loss: 0.7712, test_loss: 0.8085, test_f1: 0.6133
 epoch: 56, train_loss: 0.7759, test_loss: 0.8089, test_f1: 0.6273
 epoch: 57, train_loss: 0.7745, test_loss: 0.8206, test_f1: 0.5889
 epoch: 58, train_loss: 0.7607, test_loss: 0.8096, test_f1: 0.6070
 epoch: 59, train_loss: 0.7726, test_loss: 0.8044, test_f1: 0.6114
 epoch: 60, train_loss: 0.7692, test_loss: 0.8005, test_f1: 0.6072
 epoch: 61, train_loss: 0.7574, test_loss: 0.7909, test_f1: 0.6291
 epoch: 62, train_loss: 0.7794, test_loss: 0.9142, test_f1: 0.5840
 epoch: 63, train_loss: 0.7584, test_loss: 0.8212, test_f1: 0.5967
 epoch: 64, train_loss: 0.7607, test_loss: 0.7937, test_f1: 0.6247
 epoch: 65, train_loss: 0.7514, test_loss: 0.8138, test_f1: 0.6067
 epoch: 66, train_loss: 0.7523, test_loss: 0.8204, test_f1: 0.5847
 epoch: 67, train_loss: 0.7560, test_loss: 0.7884, test_f1: 0.6002
 epoch: 68, train_loss: 0.7578, test_loss: 0.8026, test_f1: 0.5970
 epoch: 69, train_loss: 0.7564, test_loss: 0.8214, test_f1: 0.6091
 epoch: 70, train_loss: 0.7539, test_loss: 0.8169, test_f1: 0.6102
 epoch: 71, train_loss: 0.7623, test_loss: 0.8280, test_f1: 0.6147
 epoch: 72, train_loss: 0.7519, test_loss: 0.8334, test_f1: 0.5948
 epoch: 73, train_loss: 0.7465, test_loss: 0.7953, test_f1: 0.6131
 epoch: 74, train_loss: 0.7503, test_loss: 0.8388, test_f1: 0.6279
 epoch: 75, train_loss: 0.7626, test_loss: 0.7733, test_f1: 0.6109
 epoch: 76, train_loss: 0.7393, test_loss: 0.7996, test_f1: 0.6125
 epoch: 77, train_loss: 0.7425, test_loss: 0.7985, test_f1: 0.6097
 epoch: 78, train_loss: 0.7338, test_loss: 0.7886, test_f1: 0.6301
 epoch: 79, train_loss: 0.7266, test_loss: 0.8204, test_f1: 0.6454
 epoch: 80, train_loss: 0.7424, test_loss: 0.8292, test_f1: 0.6304
 epoch: 81, train_loss: 0.7448, test_loss: 0.8231, test_f1: 0.6291
 epoch: 82, train_loss: 0.7430, test_loss: 0.8032, test_f1: 0.6267
 epoch: 83, train_loss: 0.7418, test_loss: 0.8483, test_f1: 0.6175
 epoch: 84, train_loss: 0.7408, test_loss: 0.8156, test_f1: 0.6061
 epoch: 85, train_loss: 0.7421, test_loss: 0.8667, test_f1: 0.5948
 epoch: 86, train_loss: 0.7397, test_loss: 0.8133, test_f1: 0.6221
 epoch: 87, train_loss: 0.7255, test_loss: 0.8201, test_f1: 0.6051
 epoch: 88, train_loss: 0.7368, test_loss: 0.8327, test_f1: 0.6059
 epoch: 89, train_loss: 0.7472, test_loss: 0.8148, test_f1: 0.6062
 epoch: 90, train_loss: 0.7458, test_loss: 0.8014, test_f1: 0.6299
 epoch: 91, train_loss: 0.7369, test_loss: 0.8073, test_f1: 0.6201
 epoch: 92, train_loss: 0.7484, test_loss: 0.8040, test_f1: 0.6104
 epoch: 93, train_loss: 0.7683, test_loss: 0.8741, test_f1: 0.6134
 epoch: 94, train_loss: 0.7228, test_loss: 0.8161, test_f1: 0.6249
 epoch: 95, train_loss: 0.7345, test_loss: 0.8190, test_f1: 0.6413
 epoch: 96, train_loss: 0.7291, test_loss: 0.8184, test_f1: 0.6298
 epoch: 97, train_loss: 0.7256, test_loss: 0.8013, test_f1: 0.6066
 epoch: 98, train_loss: 0.7328, test_loss: 0.7895, test_f1: 0.6153
 epoch: 99, train_loss: 0.7232, test_loss: 0.8275, test_f1: 0.6057
##################ITERATION #6 ****************************************
 epoch: 0, train_loss: 1.1446, test_loss: 1.1100, test_f1: 0.4212
 epoch: 1, train_loss: 1.0189, test_loss: 1.0539, test_f1: 0.4447
 epoch: 2, train_loss: 0.9818, test_loss: 1.0777, test_f1: 0.4545
 epoch: 3, train_loss: 0.9900, test_loss: 1.2552, test_f1: 0.3894
 epoch: 4, train_loss: 0.9733, test_loss: 1.0517, test_f1: 0.4235
 epoch: 5, train_loss: 0.9789, test_loss: 1.0624, test_f1: 0.4763
 epoch: 6, train_loss: 0.9567, test_loss: 1.0336, test_f1: 0.4592
 epoch: 7, train_loss: 0.9430, test_loss: 1.0495, test_f1: 0.5097
 epoch: 8, train_loss: 0.9483, test_loss: 0.9969, test_f1: 0.4526
 epoch: 9, train_loss: 0.9448, test_loss: 0.9979, test_f1: 0.4701
 epoch: 10, train_loss: 0.9285, test_loss: 0.9401, test_f1: 0.5178
 epoch: 11, train_loss: 0.9220, test_loss: 0.9826, test_f1: 0.4613
 epoch: 12, train_loss: 0.9184, test_loss: 0.9763, test_f1: 0.4834
 epoch: 13, train_loss: 0.9176, test_loss: 1.1025, test_f1: 0.4146
 epoch: 14, train_loss: 0.9065, test_loss: 0.9651, test_f1: 0.4962
 epoch: 15, train_loss: 0.9160, test_loss: 0.9469, test_f1: 0.5752
 epoch: 16, train_loss: 0.8876, test_loss: 0.9553, test_f1: 0.5001
 epoch: 17, train_loss: 0.9151, test_loss: 0.9836, test_f1: 0.4698
 epoch: 18, train_loss: 0.8996, test_loss: 0.9800, test_f1: 0.5106
 epoch: 19, train_loss: 0.9111, test_loss: 0.9682, test_f1: 0.4921
 epoch: 20, train_loss: 0.8915, test_loss: 0.9761, test_f1: 0.4969
 epoch: 21, train_loss: 0.8922, test_loss: 0.9983, test_f1: 0.5210
 epoch: 22, train_loss: 0.8697, test_loss: 0.9561, test_f1: 0.5070
 epoch: 23, train_loss: 0.8912, test_loss: 2.4812, test_f1: 0.3054
 epoch: 24, train_loss: 0.9187, test_loss: 0.9462, test_f1: 0.5252
 epoch: 25, train_loss: 0.8874, test_loss: 0.9342, test_f1: 0.5327
 epoch: 26, train_loss: 0.8871, test_loss: 0.9502, test_f1: 0.5013
 epoch: 27, train_loss: 0.8906, test_loss: 0.9344, test_f1: 0.5706
 epoch: 28, train_loss: 0.8750, test_loss: 0.9100, test_f1: 0.5048
 epoch: 29, train_loss: 0.8679, test_loss: 0.9207, test_f1: 0.4983
 epoch: 30, train_loss: 0.8656, test_loss: 1.0067, test_f1: 0.5162
 epoch: 31, train_loss: 0.8644, test_loss: 0.9202, test_f1: 0.5093
 epoch: 32, train_loss: 0.8679, test_loss: 0.9417, test_f1: 0.5351
 epoch: 33, train_loss: 0.8546, test_loss: 0.9266, test_f1: 0.5384
 epoch: 34, train_loss: 0.8421, test_loss: 0.9334, test_f1: 0.5091
 epoch: 35, train_loss: 0.8500, test_loss: 0.8748, test_f1: 0.5595
 epoch: 36, train_loss: 0.8435, test_loss: 0.9166, test_f1: 0.5006
 epoch: 37, train_loss: 0.8277, test_loss: 0.8826, test_f1: 0.5842
 epoch: 38, train_loss: 0.8319, test_loss: 0.9428, test_f1: 0.5335
 epoch: 39, train_loss: 0.8695, test_loss: 1.0280, test_f1: 0.5438
 epoch: 40, train_loss: 0.8555, test_loss: 0.8837, test_f1: 0.5763
 epoch: 41, train_loss: 0.8362, test_loss: 0.8888, test_f1: 0.5601
 epoch: 42, train_loss: 0.8443, test_loss: 0.8509, test_f1: 0.5654
 epoch: 43, train_loss: 0.8429, test_loss: 0.8701, test_f1: 0.5637
 epoch: 44, train_loss: 0.8282, test_loss: 0.8650, test_f1: 0.6112
 epoch: 45, train_loss: 0.8344, test_loss: 0.8995, test_f1: 0.5354
 epoch: 46, train_loss: 0.8461, test_loss: 0.9073, test_f1: 0.5736
 epoch: 47, train_loss: 0.8243, test_loss: 0.8859, test_f1: 0.5484
 epoch: 48, train_loss: 0.8260, test_loss: 0.8702, test_f1: 0.6063
 epoch: 49, train_loss: 0.8162, test_loss: 0.8721, test_f1: 0.5973
 epoch: 50, train_loss: 0.8328, test_loss: 0.8682, test_f1: 0.5592
 epoch: 51, train_loss: 0.8076, test_loss: 0.8312, test_f1: 0.6082
 epoch: 52, train_loss: 0.7915, test_loss: 0.8496, test_f1: 0.5712
 epoch: 53, train_loss: 0.7992, test_loss: 0.8209, test_f1: 0.5907
 epoch: 54, train_loss: 0.7794, test_loss: 0.8357, test_f1: 0.5895
 epoch: 55, train_loss: 0.7805, test_loss: 0.8313, test_f1: 0.6140
 epoch: 56, train_loss: 0.7789, test_loss: 0.8238, test_f1: 0.5785
 epoch: 57, train_loss: 0.7818, test_loss: 0.8404, test_f1: 0.5618
 epoch: 58, train_loss: 0.7846, test_loss: 0.8409, test_f1: 0.5812
 epoch: 59, train_loss: 0.7858, test_loss: 0.8423, test_f1: 0.6210
 epoch: 60, train_loss: 0.7891, test_loss: 0.8333, test_f1: 0.6074
 epoch: 61, train_loss: 0.7733, test_loss: 0.7957, test_f1: 0.6000
 epoch: 62, train_loss: 0.7601, test_loss: 0.8507, test_f1: 0.5863
 epoch: 63, train_loss: 0.7694, test_loss: 0.8664, test_f1: 0.6058
 epoch: 64, train_loss: 0.7736, test_loss: 0.8342, test_f1: 0.6139
 epoch: 65, train_loss: 0.7743, test_loss: 0.8217, test_f1: 0.6181
 epoch: 66, train_loss: 0.7632, test_loss: 0.8304, test_f1: 0.5723
 epoch: 67, train_loss: 0.7719, test_loss: 0.8937, test_f1: 0.6181
 epoch: 68, train_loss: 0.7682, test_loss: 0.9095, test_f1: 0.5953
 epoch: 69, train_loss: 0.7505, test_loss: 0.8939, test_f1: 0.6085
 epoch: 70, train_loss: 0.7703, test_loss: 0.8639, test_f1: 0.6084
 epoch: 71, train_loss: 0.7433, test_loss: 0.8907, test_f1: 0.6169
 epoch: 72, train_loss: 0.7607, test_loss: 0.8787, test_f1: 0.5904
 epoch: 73, train_loss: 0.7671, test_loss: 0.9016, test_f1: 0.6088
 epoch: 74, train_loss: 0.7611, test_loss: 0.9173, test_f1: 0.5548
 epoch: 75, train_loss: 0.7731, test_loss: 0.8331, test_f1: 0.6202
 epoch: 76, train_loss: 0.7465, test_loss: 0.8900, test_f1: 0.6181
 epoch: 77, train_loss: 0.7584, test_loss: 0.8961, test_f1: 0.5781
 epoch: 78, train_loss: 0.7535, test_loss: 0.8934, test_f1: 0.6111
 epoch: 79, train_loss: 0.7536, test_loss: 0.8714, test_f1: 0.5917
 epoch: 80, train_loss: 0.7527, test_loss: 0.8776, test_f1: 0.6024
 epoch: 81, train_loss: 0.7511, test_loss: 0.8826, test_f1: 0.6129
 epoch: 82, train_loss: 0.7481, test_loss: 0.8616, test_f1: 0.6042
 epoch: 83, train_loss: 0.7480, test_loss: 0.8683, test_f1: 0.6103
 epoch: 84, train_loss: 0.7378, test_loss: 0.8869, test_f1: 0.5961
 epoch: 85, train_loss: 0.7437, test_loss: 0.8682, test_f1: 0.6192
 epoch: 86, train_loss: 0.7516, test_loss: 0.8523, test_f1: 0.6107
 epoch: 87, train_loss: 0.7494, test_loss: 0.9060, test_f1: 0.5882
 epoch: 88, train_loss: 0.7483, test_loss: 0.8959, test_f1: 0.6084
 epoch: 89, train_loss: 0.7494, test_loss: 0.8633, test_f1: 0.6176
 epoch: 90, train_loss: 0.7408, test_loss: 0.9147, test_f1: 0.5982
 epoch: 91, train_loss: 0.7220, test_loss: 0.8959, test_f1: 0.5842
 epoch: 92, train_loss: 0.7349, test_loss: 0.9065, test_f1: 0.6196
 epoch: 93, train_loss: 0.7297, test_loss: 0.9228, test_f1: 0.5980
 epoch: 94, train_loss: 0.7405, test_loss: 0.9333, test_f1: 0.6199
 epoch: 95, train_loss: 0.7411, test_loss: 0.8825, test_f1: 0.6245
 epoch: 96, train_loss: 0.7230, test_loss: 0.9228, test_f1: 0.6147
 epoch: 97, train_loss: 0.7233, test_loss: 0.9013, test_f1: 0.6197
 epoch: 98, train_loss: 0.7131, test_loss: 0.8818, test_f1: 0.6187
 epoch: 99, train_loss: 0.7311, test_loss: 0.8855, test_f1: 0.6272
##################ITERATION #7 ****************************************
 epoch: 0, train_loss: 1.1275, test_loss: 1.0678, test_f1: 0.4849
 epoch: 1, train_loss: 1.0258, test_loss: 1.0365, test_f1: 0.4375
 epoch: 2, train_loss: 1.0068, test_loss: 1.0480, test_f1: 0.4475
 epoch: 3, train_loss: 0.9898, test_loss: 1.0970, test_f1: 0.4679
 epoch: 4, train_loss: 0.9742, test_loss: 0.9762, test_f1: 0.4660
 epoch: 5, train_loss: 0.9582, test_loss: 1.0908, test_f1: 0.4372
 epoch: 6, train_loss: 0.9555, test_loss: 1.0257, test_f1: 0.4885
 epoch: 7, train_loss: 0.9713, test_loss: 1.1518, test_f1: 0.4038
 epoch: 8, train_loss: 0.9908, test_loss: 1.2390, test_f1: 0.4227
 epoch: 9, train_loss: 0.9756, test_loss: 0.9726, test_f1: 0.5273
 epoch: 10, train_loss: 0.9570, test_loss: 0.9830, test_f1: 0.5076
 epoch: 11, train_loss: 0.9452, test_loss: 0.9974, test_f1: 0.4943
 epoch: 12, train_loss: 0.9365, test_loss: 1.0683, test_f1: 0.4673
 epoch: 13, train_loss: 0.9323, test_loss: 0.9982, test_f1: 0.4707
 epoch: 14, train_loss: 0.9154, test_loss: 1.0582, test_f1: 0.4969
 epoch: 15, train_loss: 0.9138, test_loss: 1.0218, test_f1: 0.5002
 epoch: 16, train_loss: 0.9213, test_loss: 1.3206, test_f1: 0.3411
 epoch: 17, train_loss: 0.9476, test_loss: 1.0426, test_f1: 0.5327
 epoch: 18, train_loss: 0.9168, test_loss: 0.9719, test_f1: 0.5052
 epoch: 19, train_loss: 0.9122, test_loss: 1.0052, test_f1: 0.4536
 epoch: 20, train_loss: 0.9002, test_loss: 1.0694, test_f1: 0.4562
 epoch: 21, train_loss: 0.8973, test_loss: 0.9515, test_f1: 0.5433
 epoch: 22, train_loss: 0.8895, test_loss: 1.0435, test_f1: 0.4939
 epoch: 23, train_loss: 0.8890, test_loss: 0.9776, test_f1: 0.4983
 epoch: 24, train_loss: 0.8903, test_loss: 1.0192, test_f1: 0.4787
 epoch: 25, train_loss: 0.8928, test_loss: 0.9356, test_f1: 0.5183
 epoch: 26, train_loss: 0.8852, test_loss: 1.0475, test_f1: 0.4790
 epoch: 27, train_loss: 0.8841, test_loss: 0.9663, test_f1: 0.5166
 epoch: 28, train_loss: 0.8762, test_loss: 0.9381, test_f1: 0.5282
 epoch: 29, train_loss: 0.8830, test_loss: 1.0154, test_f1: 0.4777
 epoch: 30, train_loss: 0.8727, test_loss: 0.9483, test_f1: 0.5173
 epoch: 31, train_loss: 0.8667, test_loss: 0.9365, test_f1: 0.5332
 epoch: 32, train_loss: 0.8712, test_loss: 0.9710, test_f1: 0.4711
 epoch: 33, train_loss: 0.8783, test_loss: 0.8933, test_f1: 0.5561
 epoch: 34, train_loss: 0.8650, test_loss: 0.8881, test_f1: 0.5416
 epoch: 35, train_loss: 0.8585, test_loss: 0.8970, test_f1: 0.5671
 epoch: 36, train_loss: 0.8603, test_loss: 0.9537, test_f1: 0.5131
 epoch: 37, train_loss: 0.8665, test_loss: 0.9865, test_f1: 0.4833
 epoch: 38, train_loss: 0.8570, test_loss: 0.8811, test_f1: 0.5529
 epoch: 39, train_loss: 0.8364, test_loss: 0.9427, test_f1: 0.5524
 epoch: 40, train_loss: 0.8470, test_loss: 0.8543, test_f1: 0.5505
 epoch: 41, train_loss: 0.8480, test_loss: 1.0048, test_f1: 0.4878
 epoch: 42, train_loss: 0.8400, test_loss: 0.8693, test_f1: 0.6017
 epoch: 43, train_loss: 0.8518, test_loss: 0.8935, test_f1: 0.5222
 epoch: 44, train_loss: 0.8284, test_loss: 0.8987, test_f1: 0.5398
 epoch: 45, train_loss: 0.8389, test_loss: 0.8526, test_f1: 0.5998
 epoch: 46, train_loss: 0.8364, test_loss: 0.9288, test_f1: 0.5168
 epoch: 47, train_loss: 0.8151, test_loss: 0.9578, test_f1: 0.5175
 epoch: 48, train_loss: 0.9278, test_loss: 1.0177, test_f1: 0.4687
 epoch: 49, train_loss: 0.9371, test_loss: 1.0132, test_f1: 0.4628
 epoch: 50, train_loss: 0.9030, test_loss: 0.9301, test_f1: 0.4982
 epoch: 51, train_loss: 0.8625, test_loss: 0.9576, test_f1: 0.4921
 epoch: 52, train_loss: 0.8703, test_loss: 0.9014, test_f1: 0.5138
 epoch: 53, train_loss: 0.8503, test_loss: 0.8857, test_f1: 0.5360
 epoch: 54, train_loss: 0.8305, test_loss: 0.8703, test_f1: 0.5561
 epoch: 55, train_loss: 0.8302, test_loss: 0.8496, test_f1: 0.5682
 epoch: 56, train_loss: 0.8333, test_loss: 0.8797, test_f1: 0.5632
 epoch: 57, train_loss: 0.8155, test_loss: 0.8698, test_f1: 0.5455
 epoch: 58, train_loss: 0.8202, test_loss: 0.8749, test_f1: 0.5556
 epoch: 59, train_loss: 0.8097, test_loss: 0.8826, test_f1: 0.5544
 epoch: 60, train_loss: 0.8177, test_loss: 0.9052, test_f1: 0.5199
 epoch: 61, train_loss: 0.8094, test_loss: 0.8892, test_f1: 0.5412
 epoch: 62, train_loss: 0.7942, test_loss: 0.9038, test_f1: 0.5558
 epoch: 63, train_loss: 0.8167, test_loss: 0.8848, test_f1: 0.5327
 epoch: 64, train_loss: 0.8108, test_loss: 0.8814, test_f1: 0.5399
 epoch: 65, train_loss: 0.7976, test_loss: 0.9357, test_f1: 0.5116
 epoch: 66, train_loss: 0.7910, test_loss: 0.8457, test_f1: 0.5782
 epoch: 67, train_loss: 0.8006, test_loss: 0.8502, test_f1: 0.5779
 epoch: 68, train_loss: 0.7844, test_loss: 0.8422, test_f1: 0.5949
 epoch: 69, train_loss: 0.7893, test_loss: 0.9711, test_f1: 0.4870
 epoch: 70, train_loss: 0.8023, test_loss: 0.9004, test_f1: 0.5225
 epoch: 71, train_loss: 0.7934, test_loss: 0.8674, test_f1: 0.5581
 epoch: 72, train_loss: 0.7923, test_loss: 1.0847, test_f1: 0.4611
 epoch: 73, train_loss: 0.7827, test_loss: 0.8549, test_f1: 0.5510
 epoch: 74, train_loss: 0.7756, test_loss: 0.8641, test_f1: 0.5619
 epoch: 75, train_loss: 0.7856, test_loss: 0.8468, test_f1: 0.5965
 epoch: 76, train_loss: 0.7690, test_loss: 0.8308, test_f1: 0.5678
 epoch: 77, train_loss: 0.7794, test_loss: 0.8842, test_f1: 0.5831
 epoch: 78, train_loss: 0.7759, test_loss: 0.8511, test_f1: 0.5825
 epoch: 79, train_loss: 0.7667, test_loss: 0.8251, test_f1: 0.6042
 epoch: 80, train_loss: 0.7676, test_loss: 0.8267, test_f1: 0.6371
 epoch: 81, train_loss: 0.7582, test_loss: 0.8452, test_f1: 0.6082
 epoch: 82, train_loss: 0.7943, test_loss: 0.8412, test_f1: 0.5868
 epoch: 83, train_loss: 0.7701, test_loss: 0.8889, test_f1: 0.5761
 epoch: 84, train_loss: 0.7744, test_loss: 0.8387, test_f1: 0.5796
 epoch: 85, train_loss: 0.7776, test_loss: 0.8554, test_f1: 0.6016
 epoch: 86, train_loss: 0.7547, test_loss: 0.9205, test_f1: 0.5658
 epoch: 87, train_loss: 0.7606, test_loss: 0.8609, test_f1: 0.5867
 epoch: 88, train_loss: 0.7623, test_loss: 0.8635, test_f1: 0.5925
 epoch: 89, train_loss: 0.7618, test_loss: 0.8923, test_f1: 0.5601
 epoch: 90, train_loss: 0.7418, test_loss: 0.8605, test_f1: 0.6230
 epoch: 91, train_loss: 0.7583, test_loss: 0.8408, test_f1: 0.6060
 epoch: 92, train_loss: 0.7537, test_loss: 0.8134, test_f1: 0.6174
 epoch: 93, train_loss: 0.7614, test_loss: 0.8695, test_f1: 0.6091
 epoch: 94, train_loss: 0.7517, test_loss: 0.8431, test_f1: 0.5933
 epoch: 95, train_loss: 0.7370, test_loss: 0.8482, test_f1: 0.5739
 epoch: 96, train_loss: 0.7529, test_loss: 0.8365, test_f1: 0.6376
 epoch: 97, train_loss: 0.7469, test_loss: 0.8682, test_f1: 0.6097
 epoch: 98, train_loss: 0.7536, test_loss: 0.8458, test_f1: 0.5922
 epoch: 99, train_loss: 0.7560, test_loss: 0.8375, test_f1: 0.6210
##################ITERATION #8 ****************************************
 epoch: 0, train_loss: 1.1505, test_loss: 1.1000, test_f1: 0.3422
 epoch: 1, train_loss: 1.0468, test_loss: 1.0934, test_f1: 0.3639
 epoch: 2, train_loss: 1.0342, test_loss: 1.1044, test_f1: 0.4296
 epoch: 3, train_loss: 0.9878, test_loss: 1.0494, test_f1: 0.4907
 epoch: 4, train_loss: 0.9754, test_loss: 0.9874, test_f1: 0.5089
 epoch: 5, train_loss: 0.9818, test_loss: 0.9569, test_f1: 0.5310
 epoch: 6, train_loss: 0.9721, test_loss: 0.9964, test_f1: 0.4594
 epoch: 7, train_loss: 0.9565, test_loss: 0.9828, test_f1: 0.5334
 epoch: 8, train_loss: 0.9584, test_loss: 0.9930, test_f1: 0.4801
 epoch: 9, train_loss: 0.9418, test_loss: 1.0114, test_f1: 0.4932
 epoch: 10, train_loss: 0.9367, test_loss: 1.0273, test_f1: 0.4917
 epoch: 11, train_loss: 0.9591, test_loss: 1.0311, test_f1: 0.4386
 epoch: 12, train_loss: 0.9220, test_loss: 0.9814, test_f1: 0.4794
 epoch: 13, train_loss: 0.9376, test_loss: 1.0450, test_f1: 0.4655
 epoch: 14, train_loss: 0.9286, test_loss: 0.9955, test_f1: 0.4999
 epoch: 15, train_loss: 0.9208, test_loss: 0.9787, test_f1: 0.5154
 epoch: 16, train_loss: 0.9347, test_loss: 1.0600, test_f1: 0.4467
 epoch: 17, train_loss: 0.9003, test_loss: 0.9916, test_f1: 0.5201
 epoch: 18, train_loss: 0.8885, test_loss: 0.9937, test_f1: 0.4666
 epoch: 19, train_loss: 0.8962, test_loss: 0.9493, test_f1: 0.5103
 epoch: 20, train_loss: 0.8854, test_loss: 0.9147, test_f1: 0.5599
 epoch: 21, train_loss: 0.8784, test_loss: 0.9221, test_f1: 0.5026
 epoch: 22, train_loss: 0.8901, test_loss: 0.8912, test_f1: 0.5093
 epoch: 23, train_loss: 0.8817, test_loss: 1.0171, test_f1: 0.4955
 epoch: 24, train_loss: 0.8863, test_loss: 0.9677, test_f1: 0.5514
 epoch: 25, train_loss: 0.8737, test_loss: 0.9575, test_f1: 0.4928
 epoch: 26, train_loss: 0.8767, test_loss: 0.9556, test_f1: 0.4981
 epoch: 27, train_loss: 0.8733, test_loss: 0.9278, test_f1: 0.5129
 epoch: 28, train_loss: 0.8657, test_loss: 0.9273, test_f1: 0.5209
 epoch: 29, train_loss: 0.8584, test_loss: 0.9084, test_f1: 0.5264
 epoch: 30, train_loss: 0.8778, test_loss: 1.0083, test_f1: 0.5022
 epoch: 31, train_loss: 0.8638, test_loss: 0.8876, test_f1: 0.5253
 epoch: 32, train_loss: 0.8641, test_loss: 0.9291, test_f1: 0.5331
 epoch: 33, train_loss: 0.8518, test_loss: 1.0559, test_f1: 0.4880
 epoch: 34, train_loss: 0.8588, test_loss: 0.9218, test_f1: 0.5158
 epoch: 35, train_loss: 0.8468, test_loss: 0.8954, test_f1: 0.5330
 epoch: 36, train_loss: 0.8493, test_loss: 0.8994, test_f1: 0.5277
 epoch: 37, train_loss: 0.8368, test_loss: 0.9246, test_f1: 0.4848
 epoch: 38, train_loss: 0.8443, test_loss: 0.8861, test_f1: 0.5297
 epoch: 39, train_loss: 0.8406, test_loss: 0.9647, test_f1: 0.4984
 epoch: 40, train_loss: 0.8417, test_loss: 0.9007, test_f1: 0.5173
 epoch: 41, train_loss: 0.8423, test_loss: 0.9491, test_f1: 0.5061
 epoch: 42, train_loss: 0.8461, test_loss: 0.9547, test_f1: 0.5019
 epoch: 43, train_loss: 0.8459, test_loss: 0.9746, test_f1: 0.5012
 epoch: 44, train_loss: 0.8324, test_loss: 0.9103, test_f1: 0.5113
 epoch: 45, train_loss: 0.8384, test_loss: 0.9042, test_f1: 0.5248
 epoch: 46, train_loss: 0.8269, test_loss: 0.8618, test_f1: 0.5264
 epoch: 47, train_loss: 0.8129, test_loss: 0.9148, test_f1: 0.5134
 epoch: 48, train_loss: 0.8378, test_loss: 0.8552, test_f1: 0.5448
 epoch: 49, train_loss: 0.8118, test_loss: 0.8792, test_f1: 0.5277
 epoch: 50, train_loss: 0.8269, test_loss: 0.9382, test_f1: 0.5458
 epoch: 51, train_loss: 0.8053, test_loss: 0.8876, test_f1: 0.5289
 epoch: 52, train_loss: 0.7851, test_loss: 0.8411, test_f1: 0.5515
 epoch: 53, train_loss: 0.7856, test_loss: 0.8556, test_f1: 0.5484
 epoch: 54, train_loss: 0.7769, test_loss: 0.8608, test_f1: 0.5377
 epoch: 55, train_loss: 0.7833, test_loss: 0.8309, test_f1: 0.5679
 epoch: 56, train_loss: 0.7933, test_loss: 0.8497, test_f1: 0.5386
 epoch: 57, train_loss: 0.7795, test_loss: 0.8729, test_f1: 0.5176
 epoch: 58, train_loss: 0.7909, test_loss: 0.8396, test_f1: 0.5461
 epoch: 59, train_loss: 0.7719, test_loss: 0.8412, test_f1: 0.5562
 epoch: 60, train_loss: 0.7652, test_loss: 0.8667, test_f1: 0.5364
 epoch: 61, train_loss: 0.7780, test_loss: 0.8389, test_f1: 0.5631
 epoch: 62, train_loss: 0.7735, test_loss: 0.8868, test_f1: 0.5362
 epoch: 63, train_loss: 0.7967, test_loss: 0.8465, test_f1: 0.5388
 epoch: 64, train_loss: 0.7660, test_loss: 0.8358, test_f1: 0.5435
 epoch: 65, train_loss: 0.7641, test_loss: 0.8222, test_f1: 0.5639
 epoch: 66, train_loss: 0.7689, test_loss: 0.8402, test_f1: 0.5498
 epoch: 67, train_loss: 0.7544, test_loss: 0.8647, test_f1: 0.5406
 epoch: 68, train_loss: 0.7601, test_loss: 0.8401, test_f1: 0.5519
 epoch: 69, train_loss: 0.7489, test_loss: 0.8499, test_f1: 0.5390
 epoch: 70, train_loss: 0.7426, test_loss: 0.8426, test_f1: 0.5578
 epoch: 71, train_loss: 0.7541, test_loss: 0.8612, test_f1: 0.5526
 epoch: 72, train_loss: 0.7426, test_loss: 0.8194, test_f1: 0.5584
 epoch: 73, train_loss: 0.7618, test_loss: 0.8177, test_f1: 0.5486
 epoch: 74, train_loss: 0.7715, test_loss: 0.8260, test_f1: 0.5993
 epoch: 75, train_loss: 0.7509, test_loss: 0.8208, test_f1: 0.5757
 epoch: 76, train_loss: 0.7493, test_loss: 0.8404, test_f1: 0.5694
 epoch: 77, train_loss: 0.7603, test_loss: 0.8418, test_f1: 0.5651
 epoch: 78, train_loss: 0.7365, test_loss: 0.8801, test_f1: 0.5406
 epoch: 79, train_loss: 0.7366, test_loss: 0.8482, test_f1: 0.5397
 epoch: 80, train_loss: 0.7567, test_loss: 0.8168, test_f1: 0.5609
 epoch: 81, train_loss: 0.7346, test_loss: 0.8577, test_f1: 0.5401
 epoch: 82, train_loss: 0.7494, test_loss: 0.7905, test_f1: 0.5693
 epoch: 83, train_loss: 0.7439, test_loss: 0.8571, test_f1: 0.5595
 epoch: 84, train_loss: 0.7329, test_loss: 0.8734, test_f1: 0.5167
 epoch: 85, train_loss: 0.7172, test_loss: 0.7947, test_f1: 0.5710
 epoch: 86, train_loss: 0.7338, test_loss: 0.8311, test_f1: 0.5570
 epoch: 87, train_loss: 0.7288, test_loss: 0.8693, test_f1: 0.5517
 epoch: 88, train_loss: 0.7351, test_loss: 0.8548, test_f1: 0.5513
 epoch: 89, train_loss: 0.7348, test_loss: 0.8423, test_f1: 0.5653
 epoch: 90, train_loss: 0.7348, test_loss: 0.8276, test_f1: 0.5712
 epoch: 91, train_loss: 0.7157, test_loss: 0.8477, test_f1: 0.5711
 epoch: 92, train_loss: 0.7088, test_loss: 0.8495, test_f1: 0.5652
 epoch: 93, train_loss: 0.7314, test_loss: 0.8619, test_f1: 0.5730
 epoch: 94, train_loss: 0.7354, test_loss: 0.8335, test_f1: 0.5451
 epoch: 95, train_loss: 0.7187, test_loss: 0.8390, test_f1: 0.5748
 epoch: 96, train_loss: 0.7260, test_loss: 0.8923, test_f1: 0.5618
 epoch: 97, train_loss: 0.7246, test_loss: 0.8294, test_f1: 0.5876
 epoch: 98, train_loss: 0.7191, test_loss: 0.8066, test_f1: 0.5712
 epoch: 99, train_loss: 0.7199, test_loss: 0.9592, test_f1: 0.5474
##################ITERATION #9 ****************************************
 epoch: 0, train_loss: 1.2275, test_loss: 1.0280, test_f1: 0.4127
 epoch: 1, train_loss: 1.0356, test_loss: 1.0060, test_f1: 0.4475
 epoch: 2, train_loss: 1.0178, test_loss: 1.1153, test_f1: 0.4145
 epoch: 3, train_loss: 1.0060, test_loss: 0.9694, test_f1: 0.5038
 epoch: 4, train_loss: 0.9808, test_loss: 0.9713, test_f1: 0.4772
 epoch: 5, train_loss: 0.9600, test_loss: 0.9493, test_f1: 0.4579
 epoch: 6, train_loss: 0.9509, test_loss: 0.9355, test_f1: 0.4987
 epoch: 7, train_loss: 0.9435, test_loss: 0.8881, test_f1: 0.5387
 epoch: 8, train_loss: 0.9408, test_loss: 0.9293, test_f1: 0.5019
 epoch: 9, train_loss: 0.9312, test_loss: 0.9697, test_f1: 0.5015
 epoch: 10, train_loss: 0.9780, test_loss: 1.0619, test_f1: 0.4316
 epoch: 11, train_loss: 0.9681, test_loss: 0.9147, test_f1: 0.5176
 epoch: 12, train_loss: 0.9544, test_loss: 0.8563, test_f1: 0.5252
 epoch: 13, train_loss: 0.9269, test_loss: 0.9075, test_f1: 0.5123
 epoch: 14, train_loss: 0.9308, test_loss: 0.9585, test_f1: 0.5414
 epoch: 15, train_loss: 0.9039, test_loss: 0.9494, test_f1: 0.5134
 epoch: 16, train_loss: 0.9066, test_loss: 0.8730, test_f1: 0.5491
 epoch: 17, train_loss: 0.9009, test_loss: 0.8872, test_f1: 0.4992
 epoch: 18, train_loss: 0.8950, test_loss: 0.9384, test_f1: 0.5154
 epoch: 19, train_loss: 0.9096, test_loss: 0.9244, test_f1: 0.5006
 epoch: 20, train_loss: 0.8888, test_loss: 0.8690, test_f1: 0.5231
 epoch: 21, train_loss: 0.8799, test_loss: 0.9385, test_f1: 0.5218
 epoch: 22, train_loss: 0.8718, test_loss: 0.8801, test_f1: 0.5159
 epoch: 23, train_loss: 0.8634, test_loss: 0.8376, test_f1: 0.5464
 epoch: 24, train_loss: 0.8669, test_loss: 0.8584, test_f1: 0.4855
 epoch: 25, train_loss: 0.8644, test_loss: 0.8314, test_f1: 0.5855
 epoch: 26, train_loss: 0.8517, test_loss: 0.8448, test_f1: 0.5630
 epoch: 27, train_loss: 0.8427, test_loss: 0.9285, test_f1: 0.5224
 epoch: 28, train_loss: 0.8295, test_loss: 0.8659, test_f1: 0.5230
 epoch: 29, train_loss: 0.8423, test_loss: 0.8539, test_f1: 0.5397
 epoch: 30, train_loss: 0.8374, test_loss: 0.8545, test_f1: 0.5420
 epoch: 31, train_loss: 0.8497, test_loss: 0.8256, test_f1: 0.5981
 epoch: 32, train_loss: 0.8392, test_loss: 0.8113, test_f1: 0.5682
 epoch: 33, train_loss: 0.8253, test_loss: 0.8508, test_f1: 0.5839
 epoch: 34, train_loss: 0.8410, test_loss: 0.8809, test_f1: 0.5858
 epoch: 35, train_loss: 0.8488, test_loss: 0.8835, test_f1: 0.5472
 epoch: 36, train_loss: 0.8469, test_loss: 0.8754, test_f1: 0.5240
 epoch: 37, train_loss: 0.8283, test_loss: 0.8476, test_f1: 0.5664
 epoch: 38, train_loss: 0.8337, test_loss: 0.9107, test_f1: 0.5655
 epoch: 39, train_loss: 0.8508, test_loss: 0.8510, test_f1: 0.5586
 epoch: 40, train_loss: 0.8198, test_loss: 0.8829, test_f1: 0.5355
 epoch: 41, train_loss: 0.8275, test_loss: 0.8567, test_f1: 0.5406
 epoch: 42, train_loss: 0.8280, test_loss: 0.8286, test_f1: 0.5610
 epoch: 43, train_loss: 0.8153, test_loss: 0.9192, test_f1: 0.5473
 epoch: 44, train_loss: 0.8008, test_loss: 0.8766, test_f1: 0.5771
 epoch: 45, train_loss: 0.8243, test_loss: 0.8450, test_f1: 0.6020
 epoch: 46, train_loss: 0.7952, test_loss: 1.0793, test_f1: 0.5186
 epoch: 47, train_loss: 0.8159, test_loss: 0.8600, test_f1: 0.5777
 epoch: 48, train_loss: 0.8029, test_loss: 0.8955, test_f1: 0.5601
 epoch: 49, train_loss: 0.8223, test_loss: 0.8583, test_f1: 0.6088
 epoch: 50, train_loss: 0.8359, test_loss: 0.8938, test_f1: 0.5863
 epoch: 51, train_loss: 0.7930, test_loss: 0.8638, test_f1: 0.6079
 epoch: 52, train_loss: 0.7707, test_loss: 0.8689, test_f1: 0.5827
 epoch: 53, train_loss: 0.7704, test_loss: 0.8665, test_f1: 0.6012
 epoch: 54, train_loss: 0.7619, test_loss: 0.9019, test_f1: 0.5901
 epoch: 55, train_loss: 0.7485, test_loss: 0.8907, test_f1: 0.6219
 epoch: 56, train_loss: 0.7619, test_loss: 0.8265, test_f1: 0.6239
 epoch: 57, train_loss: 0.7560, test_loss: 0.8661, test_f1: 0.6003
 epoch: 58, train_loss: 0.7588, test_loss: 0.8324, test_f1: 0.6101
 epoch: 59, train_loss: 0.7433, test_loss: 0.7889, test_f1: 0.6172
 epoch: 60, train_loss: 0.7576, test_loss: 0.8374, test_f1: 0.6369
 epoch: 61, train_loss: 0.7476, test_loss: 0.8637, test_f1: 0.6037
 epoch: 62, train_loss: 0.7359, test_loss: 0.8237, test_f1: 0.5479
 epoch: 63, train_loss: 0.7626, test_loss: 0.8582, test_f1: 0.5694
 epoch: 64, train_loss: 0.7431, test_loss: 0.8598, test_f1: 0.5858
 epoch: 65, train_loss: 0.7429, test_loss: 0.8370, test_f1: 0.5798
 epoch: 66, train_loss: 0.7491, test_loss: 0.8375, test_f1: 0.6128
 epoch: 67, train_loss: 0.7335, test_loss: 0.8089, test_f1: 0.6145
 epoch: 68, train_loss: 0.7421, test_loss: 0.8095, test_f1: 0.5801
 epoch: 69, train_loss: 0.7363, test_loss: 0.8512, test_f1: 0.6220
 epoch: 70, train_loss: 0.7315, test_loss: 0.9310, test_f1: 0.5665
 epoch: 71, train_loss: 0.7422, test_loss: 0.8137, test_f1: 0.6195
 epoch: 72, train_loss: 0.7291, test_loss: 0.8618, test_f1: 0.5937
 epoch: 73, train_loss: 0.7229, test_loss: 0.8287, test_f1: 0.6265
 epoch: 74, train_loss: 0.7195, test_loss: 0.9072, test_f1: 0.6134
 epoch: 75, train_loss: 0.7189, test_loss: 0.8393, test_f1: 0.5882
 epoch: 76, train_loss: 0.7188, test_loss: 0.8325, test_f1: 0.6013
 epoch: 77, train_loss: 0.7313, test_loss: 0.8363, test_f1: 0.6101
 epoch: 78, train_loss: 0.7373, test_loss: 0.8338, test_f1: 0.6071
 epoch: 79, train_loss: 0.7146, test_loss: 0.8584, test_f1: 0.6337
 epoch: 80, train_loss: 0.7121, test_loss: 0.8081, test_f1: 0.5677
 epoch: 81, train_loss: 0.7308, test_loss: 0.8280, test_f1: 0.6078
 epoch: 82, train_loss: 0.7342, test_loss: 0.8534, test_f1: 0.6073
 epoch: 83, train_loss: 0.7215, test_loss: 0.8350, test_f1: 0.6055
 epoch: 84, train_loss: 0.7151, test_loss: 0.8337, test_f1: 0.5863
 epoch: 85, train_loss: 0.7175, test_loss: 0.7793, test_f1: 0.6313
 epoch: 86, train_loss: 0.7000, test_loss: 0.8611, test_f1: 0.5940
 epoch: 87, train_loss: 0.7015, test_loss: 0.9162, test_f1: 0.5998
 epoch: 88, train_loss: 0.7108, test_loss: 0.8501, test_f1: 0.6252
 epoch: 89, train_loss: 0.7094, test_loss: 0.8132, test_f1: 0.6070
 epoch: 90, train_loss: 0.7047, test_loss: 0.8245, test_f1: 0.6165
 epoch: 91, train_loss: 0.7130, test_loss: 0.8053, test_f1: 0.6113
 epoch: 92, train_loss: 0.7105, test_loss: 0.8110, test_f1: 0.6248
 epoch: 93, train_loss: 0.7022, test_loss: 0.8111, test_f1: 0.6212
 epoch: 94, train_loss: 0.7154, test_loss: 0.8621, test_f1: 0.5991
 epoch: 95, train_loss: 0.7111, test_loss: 0.8278, test_f1: 0.6140
 epoch: 96, train_loss: 0.7119, test_loss: 0.8719, test_f1: 0.6390
 epoch: 97, train_loss: 0.7056, test_loss: 0.8255, test_f1: 0.6229
 epoch: 98, train_loss: 0.7022, test_loss: 0.8367, test_f1: 0.6217
 epoch: 99, train_loss: 0.7026, test_loss: 0.7963, test_f1: 0.6226

Training completed in 816.84 seconds
Best F1: 0.6640 at epoch 94
Mean F1 across iterations: 0.6346  0.0184
========================FINAL RESULTS================================
FEGIN weighted F1: 0.6640  0.0184
python main.py --data ltspice_examples --representation component_pin_net --model FEGIN --layers 6 --hiddens 16 --batch_size 64 --lr 0.01 --emb_size 512 --epochs 100 --save_appendix component_pin_net_L6_H16_BS64_LR0.01_E512 --no_val
-----



STDERR:
  File "main.py", line 370, in <module>
    main()
  File "main.py", line 254, in main
    dataset = dataset_class(
  File "/home/philip/projects/ltspice_examples_code_repo/Circuit-Completion-Using-GNNs/component_classification_with_link_prediction_head/evaluation/FEGIN/kernel/circuit_datasets.py", line 15, in __init__
    self.data, self.slices = torch.load(self.processed_paths[0])
  File "/home/philip/.local/lib/python3.8/site-packages/torch/serialization.py", line 1040, in load
    warnings.warn(
  File "/usr/lib/python3.8/warnings.py", line 109, in _showwarnmsg
    sw(msg.message, msg.category, msg.filename, msg.lineno,
  File "main.py", line 47, in warn_with_traceback
    traceback.print_stack(file=log)
/home/philip/projects/ltspice_examples_code_repo/Circuit-Completion-Using-GNNs/component_classification_with_link_prediction_head/evaluation/FEGIN/kernel/circuit_datasets.py:15: FutureWarning: You are using `torch.load` with `weights_only=False` (the current default value), which uses the default pickle module implicitly. It is possible to construct malicious pickle data which will execute arbitrary code during unpickling (See https://github.com/pytorch/pytorch/blob/main/SECURITY.md#untrusted-models for more details). In a future release, the default value for `weights_only` will be flipped to `True`. This limits the functions that could be executed during unpickling. Arbitrary objects will no longer be allowed to be loaded via this mode unless they are explicitly allowlisted by the user via `torch.serialization.add_safe_globals`. We recommend you start setting `weights_only=True` for any use case where you don't have full control of the loaded file. Please open an issue on GitHub for any issues related to this experimental feature.
  self.data, self.slices = torch.load(self.processed_paths[0])
