STDOUT:
Results will be saved in /home/philip/projects/ltspice_examples_code_repo/Circuit-Completion-Using-GNNs/component_classification_with_link_prediction_head/evaluation/FEGIN/results/model_FEGIN_dataset_ltspice_examples
Command line input: python main.py --data ltspice_examples --representation component_net --model FEGIN --layers 2 --hiddens 128 --batch_size 64 --lr 0.0001 --emb_size 128 --epochs 100 --save_appendix component_net_L2_H128_BS64_LR0.0001_E128 --no_val
 is saved.
-----
ltspice_examples - FEGIN
Using 2 layers, 128 hidden units, h = 2
Loading component_net representation dataset
ENTERED
Training FEGIN on component_net representation
Train: 3558, Test: 846
##################ITERATION #0 ****************************************
 epoch: 0, train_loss: 1.3556, test_loss: 1.3344, test_f1: 0.2270
 epoch: 1, train_loss: 1.2907, test_loss: 1.2708, test_f1: 0.2270
 epoch: 2, train_loss: 1.2498, test_loss: 1.2249, test_f1: 0.2611
 epoch: 3, train_loss: 1.2116, test_loss: 1.1769, test_f1: 0.2981
 epoch: 4, train_loss: 1.1703, test_loss: 1.1216, test_f1: 0.3761
 epoch: 5, train_loss: 1.1244, test_loss: 1.0718, test_f1: 0.4337
 epoch: 6, train_loss: 1.0725, test_loss: 1.0333, test_f1: 0.4576
 epoch: 7, train_loss: 1.0304, test_loss: 0.9984, test_f1: 0.4619
 epoch: 8, train_loss: 1.0009, test_loss: 0.9727, test_f1: 0.4581
 epoch: 9, train_loss: 0.9795, test_loss: 0.9587, test_f1: 0.4809
 epoch: 10, train_loss: 0.9647, test_loss: 0.9501, test_f1: 0.4736
 epoch: 11, train_loss: 0.9503, test_loss: 0.9373, test_f1: 0.4918
 epoch: 12, train_loss: 0.9396, test_loss: 0.9241, test_f1: 0.4847
 epoch: 13, train_loss: 0.9272, test_loss: 0.9236, test_f1: 0.5283
 epoch: 14, train_loss: 0.9218, test_loss: 0.9374, test_f1: 0.4902
 epoch: 15, train_loss: 0.9185, test_loss: 0.9364, test_f1: 0.5091
 epoch: 16, train_loss: 0.9023, test_loss: 0.9184, test_f1: 0.5148
 epoch: 17, train_loss: 0.9001, test_loss: 0.9475, test_f1: 0.5074
 epoch: 18, train_loss: 0.8912, test_loss: 0.9305, test_f1: 0.5249
 epoch: 19, train_loss: 0.8917, test_loss: 0.9085, test_f1: 0.5283
 epoch: 20, train_loss: 0.8730, test_loss: 0.9122, test_f1: 0.5273
 epoch: 21, train_loss: 0.8698, test_loss: 0.9009, test_f1: 0.5283
 epoch: 22, train_loss: 0.8560, test_loss: 0.8974, test_f1: 0.5249
 epoch: 23, train_loss: 0.8523, test_loss: 0.8935, test_f1: 0.5312
 epoch: 24, train_loss: 0.8532, test_loss: 0.9372, test_f1: 0.5298
 epoch: 25, train_loss: 0.8399, test_loss: 0.8905, test_f1: 0.5446
 epoch: 26, train_loss: 0.8343, test_loss: 0.9224, test_f1: 0.5271
 epoch: 27, train_loss: 0.8330, test_loss: 0.8980, test_f1: 0.5329
 epoch: 28, train_loss: 0.8353, test_loss: 0.9060, test_f1: 0.5287
 epoch: 29, train_loss: 0.8198, test_loss: 0.9555, test_f1: 0.5207
 epoch: 30, train_loss: 0.8137, test_loss: 0.9066, test_f1: 0.5283
 epoch: 31, train_loss: 0.8129, test_loss: 0.9071, test_f1: 0.5478
 epoch: 32, train_loss: 0.8021, test_loss: 0.9107, test_f1: 0.5364
 epoch: 33, train_loss: 0.8012, test_loss: 0.9014, test_f1: 0.5447
 epoch: 34, train_loss: 0.7976, test_loss: 0.8911, test_f1: 0.5411
 epoch: 35, train_loss: 0.7959, test_loss: 0.9116, test_f1: 0.5400
 epoch: 36, train_loss: 0.7882, test_loss: 0.9593, test_f1: 0.5284
 epoch: 37, train_loss: 0.7884, test_loss: 0.9188, test_f1: 0.5345
 epoch: 38, train_loss: 0.7755, test_loss: 0.9557, test_f1: 0.5236
 epoch: 39, train_loss: 0.7780, test_loss: 0.9193, test_f1: 0.5550
 epoch: 40, train_loss: 0.7687, test_loss: 0.9537, test_f1: 0.5388
 epoch: 41, train_loss: 0.7698, test_loss: 0.9401, test_f1: 0.5367
 epoch: 42, train_loss: 0.7599, test_loss: 0.9167, test_f1: 0.5431
 epoch: 43, train_loss: 0.7638, test_loss: 0.9245, test_f1: 0.5361
 epoch: 44, train_loss: 0.7596, test_loss: 0.9696, test_f1: 0.5130
 epoch: 45, train_loss: 0.7527, test_loss: 0.9293, test_f1: 0.5484
 epoch: 46, train_loss: 0.7428, test_loss: 0.9365, test_f1: 0.5450
 epoch: 47, train_loss: 0.7467, test_loss: 0.9267, test_f1: 0.5696
 epoch: 48, train_loss: 0.7437, test_loss: 0.9544, test_f1: 0.5498
 epoch: 49, train_loss: 0.7411, test_loss: 0.9340, test_f1: 0.5359
 epoch: 50, train_loss: 0.7268, test_loss: 0.9102, test_f1: 0.5853
 epoch: 51, train_loss: 0.7204, test_loss: 0.9184, test_f1: 0.5714
 epoch: 52, train_loss: 0.7165, test_loss: 0.9260, test_f1: 0.5780
 epoch: 53, train_loss: 0.7105, test_loss: 0.9309, test_f1: 0.5746
 epoch: 54, train_loss: 0.7066, test_loss: 0.9300, test_f1: 0.5855
 epoch: 55, train_loss: 0.7137, test_loss: 0.9274, test_f1: 0.5756
 epoch: 56, train_loss: 0.7025, test_loss: 0.9366, test_f1: 0.5600
 epoch: 57, train_loss: 0.7095, test_loss: 0.9404, test_f1: 0.5847
 epoch: 58, train_loss: 0.6973, test_loss: 0.9337, test_f1: 0.5817
 epoch: 59, train_loss: 0.7030, test_loss: 0.9441, test_f1: 0.5694
 epoch: 60, train_loss: 0.7081, test_loss: 0.9531, test_f1: 0.5923
 epoch: 61, train_loss: 0.6975, test_loss: 0.9381, test_f1: 0.5592
 epoch: 62, train_loss: 0.6843, test_loss: 0.9304, test_f1: 0.5972
 epoch: 63, train_loss: 0.6951, test_loss: 0.9393, test_f1: 0.5913
 epoch: 64, train_loss: 0.6926, test_loss: 0.9471, test_f1: 0.5561
 epoch: 65, train_loss: 0.6893, test_loss: 0.9346, test_f1: 0.5737
 epoch: 66, train_loss: 0.6838, test_loss: 0.9393, test_f1: 0.6014
 epoch: 67, train_loss: 0.6831, test_loss: 0.9413, test_f1: 0.5925
 epoch: 68, train_loss: 0.6804, test_loss: 0.9545, test_f1: 0.5940
 epoch: 69, train_loss: 0.6804, test_loss: 0.9442, test_f1: 0.6029
 epoch: 70, train_loss: 0.6625, test_loss: 0.9539, test_f1: 0.5995
 epoch: 71, train_loss: 0.6732, test_loss: 0.9515, test_f1: 0.5636
 epoch: 72, train_loss: 0.6707, test_loss: 0.9529, test_f1: 0.5944
 epoch: 73, train_loss: 0.6804, test_loss: 0.9376, test_f1: 0.6143
 epoch: 74, train_loss: 0.6672, test_loss: 0.9482, test_f1: 0.5914
 epoch: 75, train_loss: 0.6705, test_loss: 0.9433, test_f1: 0.6081
 epoch: 76, train_loss: 0.6658, test_loss: 0.9335, test_f1: 0.5979
 epoch: 77, train_loss: 0.6692, test_loss: 0.9586, test_f1: 0.5876
 epoch: 78, train_loss: 0.6608, test_loss: 0.9615, test_f1: 0.6004
 epoch: 79, train_loss: 0.6558, test_loss: 0.9517, test_f1: 0.6038
 epoch: 80, train_loss: 0.6720, test_loss: 0.9442, test_f1: 0.5936
 epoch: 81, train_loss: 0.6579, test_loss: 0.9379, test_f1: 0.5979
 epoch: 82, train_loss: 0.6561, test_loss: 0.9536, test_f1: 0.5949
 epoch: 83, train_loss: 0.6595, test_loss: 0.9305, test_f1: 0.6255
 epoch: 84, train_loss: 0.6544, test_loss: 0.9497, test_f1: 0.5966
 epoch: 85, train_loss: 0.6489, test_loss: 0.9485, test_f1: 0.6085
 epoch: 86, train_loss: 0.6538, test_loss: 0.9498, test_f1: 0.6248
 epoch: 87, train_loss: 0.6498, test_loss: 0.9486, test_f1: 0.5899
 epoch: 88, train_loss: 0.6493, test_loss: 0.9718, test_f1: 0.6047
 epoch: 89, train_loss: 0.6481, test_loss: 0.9474, test_f1: 0.6154
 epoch: 90, train_loss: 0.6477, test_loss: 0.9421, test_f1: 0.6137
 epoch: 91, train_loss: 0.6329, test_loss: 0.9580, test_f1: 0.6175
 epoch: 92, train_loss: 0.6521, test_loss: 0.9550, test_f1: 0.6244
 epoch: 93, train_loss: 0.6441, test_loss: 0.9470, test_f1: 0.6027
 epoch: 94, train_loss: 0.6413, test_loss: 0.9440, test_f1: 0.6174
 epoch: 95, train_loss: 0.6473, test_loss: 0.9437, test_f1: 0.6445
 epoch: 96, train_loss: 0.6474, test_loss: 0.9504, test_f1: 0.6115
 epoch: 97, train_loss: 0.6444, test_loss: 0.9597, test_f1: 0.6345
 epoch: 98, train_loss: 0.6250, test_loss: 0.9620, test_f1: 0.6046
 epoch: 99, train_loss: 0.6268, test_loss: 0.9575, test_f1: 0.6236
##################ITERATION #1 ****************************************
 epoch: 0, train_loss: 1.2711, test_loss: 1.2260, test_f1: 0.2651
 epoch: 1, train_loss: 1.1707, test_loss: 1.1205, test_f1: 0.4071
 epoch: 2, train_loss: 1.1187, test_loss: 1.0643, test_f1: 0.4371
 epoch: 3, train_loss: 1.0705, test_loss: 1.0155, test_f1: 0.4797
 epoch: 4, train_loss: 1.0293, test_loss: 0.9822, test_f1: 0.4844
 epoch: 5, train_loss: 1.0020, test_loss: 0.9463, test_f1: 0.4885
 epoch: 6, train_loss: 0.9624, test_loss: 0.9626, test_f1: 0.4927
 epoch: 7, train_loss: 0.9551, test_loss: 0.9341, test_f1: 0.5041
 epoch: 8, train_loss: 0.9384, test_loss: 0.9250, test_f1: 0.4983
 epoch: 9, train_loss: 0.9343, test_loss: 0.9264, test_f1: 0.4985
 epoch: 10, train_loss: 0.9137, test_loss: 0.9021, test_f1: 0.5257
 epoch: 11, train_loss: 0.9014, test_loss: 0.8745, test_f1: 0.5361
 epoch: 12, train_loss: 0.8967, test_loss: 0.8817, test_f1: 0.5312
 epoch: 13, train_loss: 0.8829, test_loss: 0.9026, test_f1: 0.5335
 epoch: 14, train_loss: 0.8800, test_loss: 0.8794, test_f1: 0.5303
 epoch: 15, train_loss: 0.8694, test_loss: 0.9062, test_f1: 0.5248
 epoch: 16, train_loss: 0.8701, test_loss: 0.9051, test_f1: 0.5347
 epoch: 17, train_loss: 0.8571, test_loss: 0.8672, test_f1: 0.5381
 epoch: 18, train_loss: 0.8473, test_loss: 0.9048, test_f1: 0.5294
 epoch: 19, train_loss: 0.8438, test_loss: 0.8789, test_f1: 0.5427
 epoch: 20, train_loss: 0.8386, test_loss: 0.8914, test_f1: 0.5258
 epoch: 21, train_loss: 0.8382, test_loss: 0.8704, test_f1: 0.5532
 epoch: 22, train_loss: 0.8264, test_loss: 0.8899, test_f1: 0.5406
 epoch: 23, train_loss: 0.8267, test_loss: 0.8707, test_f1: 0.5402
 epoch: 24, train_loss: 0.8156, test_loss: 0.8735, test_f1: 0.5416
 epoch: 25, train_loss: 0.8105, test_loss: 0.8654, test_f1: 0.5329
 epoch: 26, train_loss: 0.8045, test_loss: 0.9267, test_f1: 0.5404
 epoch: 27, train_loss: 0.8059, test_loss: 0.9218, test_f1: 0.5429
 epoch: 28, train_loss: 0.8036, test_loss: 0.8626, test_f1: 0.5426
 epoch: 29, train_loss: 0.7897, test_loss: 0.8992, test_f1: 0.5355
 epoch: 30, train_loss: 0.7878, test_loss: 0.8720, test_f1: 0.5560
 epoch: 31, train_loss: 0.7887, test_loss: 0.8649, test_f1: 0.5549
 epoch: 32, train_loss: 0.7820, test_loss: 0.8464, test_f1: 0.5664
 epoch: 33, train_loss: 0.7735, test_loss: 0.8983, test_f1: 0.5456
 epoch: 34, train_loss: 0.7608, test_loss: 0.9025, test_f1: 0.5440
 epoch: 35, train_loss: 0.7637, test_loss: 0.8810, test_f1: 0.5593
 epoch: 36, train_loss: 0.7589, test_loss: 0.8945, test_f1: 0.5591
 epoch: 37, train_loss: 0.7462, test_loss: 0.8777, test_f1: 0.5847
 epoch: 38, train_loss: 0.7567, test_loss: 0.8853, test_f1: 0.5606
 epoch: 39, train_loss: 0.7436, test_loss: 0.9037, test_f1: 0.5562
 epoch: 40, train_loss: 0.7336, test_loss: 0.8947, test_f1: 0.5487
 epoch: 41, train_loss: 0.7291, test_loss: 0.8998, test_f1: 0.5521
 epoch: 42, train_loss: 0.7396, test_loss: 0.8836, test_f1: 0.5526
 epoch: 43, train_loss: 0.7251, test_loss: 0.9139, test_f1: 0.5584
 epoch: 44, train_loss: 0.7157, test_loss: 0.8980, test_f1: 0.5534
 epoch: 45, train_loss: 0.7216, test_loss: 0.8806, test_f1: 0.5953
 epoch: 46, train_loss: 0.7204, test_loss: 0.9027, test_f1: 0.5821
 epoch: 47, train_loss: 0.7250, test_loss: 0.8938, test_f1: 0.6079
 epoch: 48, train_loss: 0.7145, test_loss: 0.8915, test_f1: 0.5910
 epoch: 49, train_loss: 0.7038, test_loss: 0.9027, test_f1: 0.5831
 epoch: 50, train_loss: 0.6997, test_loss: 0.8960, test_f1: 0.5676
 epoch: 51, train_loss: 0.6842, test_loss: 0.8987, test_f1: 0.5956
 epoch: 52, train_loss: 0.6780, test_loss: 0.8959, test_f1: 0.5909
 epoch: 53, train_loss: 0.6859, test_loss: 0.8868, test_f1: 0.6116
 epoch: 54, train_loss: 0.6760, test_loss: 0.9137, test_f1: 0.6010
 epoch: 55, train_loss: 0.6850, test_loss: 0.9024, test_f1: 0.5848
 epoch: 56, train_loss: 0.6703, test_loss: 0.9008, test_f1: 0.6129
 epoch: 57, train_loss: 0.6640, test_loss: 0.9544, test_f1: 0.5768
 epoch: 58, train_loss: 0.6629, test_loss: 0.9017, test_f1: 0.5997
 epoch: 59, train_loss: 0.6673, test_loss: 0.9470, test_f1: 0.5878
 epoch: 60, train_loss: 0.6566, test_loss: 0.8898, test_f1: 0.6004
 epoch: 61, train_loss: 0.6626, test_loss: 0.9178, test_f1: 0.6061
 epoch: 62, train_loss: 0.6586, test_loss: 0.9092, test_f1: 0.5962
 epoch: 63, train_loss: 0.6527, test_loss: 0.9102, test_f1: 0.6056
 epoch: 64, train_loss: 0.6585, test_loss: 0.9198, test_f1: 0.6005
 epoch: 65, train_loss: 0.6527, test_loss: 0.9091, test_f1: 0.5715
 epoch: 66, train_loss: 0.6473, test_loss: 0.9271, test_f1: 0.6109
 epoch: 67, train_loss: 0.6524, test_loss: 0.9078, test_f1: 0.6164
 epoch: 68, train_loss: 0.6407, test_loss: 0.9203, test_f1: 0.5924
 epoch: 69, train_loss: 0.6364, test_loss: 0.9310, test_f1: 0.6033
 epoch: 70, train_loss: 0.6317, test_loss: 0.9099, test_f1: 0.6211
 epoch: 71, train_loss: 0.6422, test_loss: 0.9276, test_f1: 0.6021
 epoch: 72, train_loss: 0.6272, test_loss: 0.9287, test_f1: 0.6071
 epoch: 73, train_loss: 0.6314, test_loss: 0.9062, test_f1: 0.6394
 epoch: 74, train_loss: 0.6318, test_loss: 0.9375, test_f1: 0.6210
 epoch: 75, train_loss: 0.6296, test_loss: 0.9148, test_f1: 0.6202
 epoch: 76, train_loss: 0.6269, test_loss: 0.9372, test_f1: 0.6134
 epoch: 77, train_loss: 0.6182, test_loss: 0.9343, test_f1: 0.6047
 epoch: 78, train_loss: 0.6311, test_loss: 0.9755, test_f1: 0.6080
 epoch: 79, train_loss: 0.6163, test_loss: 0.9383, test_f1: 0.6163
 epoch: 80, train_loss: 0.6157, test_loss: 0.9416, test_f1: 0.6153
 epoch: 81, train_loss: 0.6216, test_loss: 0.9237, test_f1: 0.6188
 epoch: 82, train_loss: 0.6246, test_loss: 0.9414, test_f1: 0.6282
 epoch: 83, train_loss: 0.6186, test_loss: 0.9455, test_f1: 0.6271
 epoch: 84, train_loss: 0.6214, test_loss: 0.9237, test_f1: 0.6086
 epoch: 85, train_loss: 0.6132, test_loss: 0.9573, test_f1: 0.6170
 epoch: 86, train_loss: 0.6135, test_loss: 0.9534, test_f1: 0.6202
 epoch: 87, train_loss: 0.6131, test_loss: 0.9232, test_f1: 0.6162
 epoch: 88, train_loss: 0.6050, test_loss: 0.9541, test_f1: 0.6100
 epoch: 89, train_loss: 0.6012, test_loss: 0.9644, test_f1: 0.6207
 epoch: 90, train_loss: 0.6028, test_loss: 0.9615, test_f1: 0.6175
 epoch: 91, train_loss: 0.6101, test_loss: 0.9506, test_f1: 0.6343
 epoch: 92, train_loss: 0.5922, test_loss: 0.9783, test_f1: 0.6229
 epoch: 93, train_loss: 0.5995, test_loss: 0.9650, test_f1: 0.6149
 epoch: 94, train_loss: 0.6009, test_loss: 0.9543, test_f1: 0.6329
 epoch: 95, train_loss: 0.5939, test_loss: 0.9658, test_f1: 0.6339
 epoch: 96, train_loss: 0.6003, test_loss: 0.9703, test_f1: 0.6264
 epoch: 97, train_loss: 0.5881, test_loss: 0.9534, test_f1: 0.6200
 epoch: 98, train_loss: 0.5821, test_loss: 0.9508, test_f1: 0.6275
 epoch: 99, train_loss: 0.5849, test_loss: 0.9665, test_f1: 0.6271
##################ITERATION #2 ****************************************
 epoch: 0, train_loss: 1.2289, test_loss: 1.1713, test_f1: 0.3423
 epoch: 1, train_loss: 1.1187, test_loss: 1.0629, test_f1: 0.4591
 epoch: 2, train_loss: 1.0626, test_loss: 1.0169, test_f1: 0.4673
 epoch: 3, train_loss: 1.0210, test_loss: 0.9796, test_f1: 0.5136
 epoch: 4, train_loss: 0.9938, test_loss: 0.9512, test_f1: 0.4995
 epoch: 5, train_loss: 0.9693, test_loss: 0.9404, test_f1: 0.5423
 epoch: 6, train_loss: 0.9435, test_loss: 0.9292, test_f1: 0.5350
 epoch: 7, train_loss: 0.9373, test_loss: 0.9142, test_f1: 0.5447
 epoch: 8, train_loss: 0.9220, test_loss: 0.9160, test_f1: 0.5301
 epoch: 9, train_loss: 0.9095, test_loss: 0.9148, test_f1: 0.5444
 epoch: 10, train_loss: 0.8988, test_loss: 0.8940, test_f1: 0.5697
 epoch: 11, train_loss: 0.8949, test_loss: 0.8940, test_f1: 0.5569
 epoch: 12, train_loss: 0.8824, test_loss: 0.8869, test_f1: 0.5463
 epoch: 13, train_loss: 0.8751, test_loss: 0.8886, test_f1: 0.5705
 epoch: 14, train_loss: 0.8666, test_loss: 0.8753, test_f1: 0.5638
 epoch: 15, train_loss: 0.8537, test_loss: 0.9114, test_f1: 0.5524
 epoch: 16, train_loss: 0.8484, test_loss: 0.8805, test_f1: 0.5606
 epoch: 17, train_loss: 0.8458, test_loss: 0.8748, test_f1: 0.5709
 epoch: 18, train_loss: 0.8398, test_loss: 0.8654, test_f1: 0.5602
 epoch: 19, train_loss: 0.8266, test_loss: 0.8921, test_f1: 0.5637
 epoch: 20, train_loss: 0.8255, test_loss: 0.8793, test_f1: 0.5574
 epoch: 21, train_loss: 0.8105, test_loss: 0.8827, test_f1: 0.5675
 epoch: 22, train_loss: 0.8153, test_loss: 0.8985, test_f1: 0.5492
 epoch: 23, train_loss: 0.7998, test_loss: 0.8847, test_f1: 0.5671
 epoch: 24, train_loss: 0.7994, test_loss: 0.8776, test_f1: 0.5473
 epoch: 25, train_loss: 0.7973, test_loss: 0.9121, test_f1: 0.5617
 epoch: 26, train_loss: 0.7873, test_loss: 0.8780, test_f1: 0.5631
 epoch: 27, train_loss: 0.7817, test_loss: 0.9309, test_f1: 0.5511
 epoch: 28, train_loss: 0.7829, test_loss: 0.9199, test_f1: 0.5703
 epoch: 29, train_loss: 0.7744, test_loss: 0.8936, test_f1: 0.5667
 epoch: 30, train_loss: 0.7693, test_loss: 0.8974, test_f1: 0.5609
 epoch: 31, train_loss: 0.7589, test_loss: 0.9248, test_f1: 0.5700
 epoch: 32, train_loss: 0.7514, test_loss: 0.8802, test_f1: 0.5838
 epoch: 33, train_loss: 0.7466, test_loss: 0.8766, test_f1: 0.5827
 epoch: 34, train_loss: 0.7430, test_loss: 0.9219, test_f1: 0.5945
 epoch: 35, train_loss: 0.7426, test_loss: 0.9164, test_f1: 0.5847
 epoch: 36, train_loss: 0.7338, test_loss: 0.9187, test_f1: 0.5942
 epoch: 37, train_loss: 0.7407, test_loss: 0.9278, test_f1: 0.5834
 epoch: 38, train_loss: 0.7271, test_loss: 0.9168, test_f1: 0.5842
 epoch: 39, train_loss: 0.7181, test_loss: 0.8953, test_f1: 0.5862
 epoch: 40, train_loss: 0.7223, test_loss: 0.9193, test_f1: 0.6062
 epoch: 41, train_loss: 0.7167, test_loss: 0.9227, test_f1: 0.5925
 epoch: 42, train_loss: 0.7011, test_loss: 0.9200, test_f1: 0.5914
 epoch: 43, train_loss: 0.7112, test_loss: 0.8847, test_f1: 0.5988
 epoch: 44, train_loss: 0.6987, test_loss: 0.8877, test_f1: 0.6121
 epoch: 45, train_loss: 0.7012, test_loss: 0.9427, test_f1: 0.5993
 epoch: 46, train_loss: 0.6922, test_loss: 0.8972, test_f1: 0.6236
 epoch: 47, train_loss: 0.6874, test_loss: 0.9233, test_f1: 0.6146
 epoch: 48, train_loss: 0.6940, test_loss: 0.9553, test_f1: 0.5705
 epoch: 49, train_loss: 0.6811, test_loss: 0.9671, test_f1: 0.5970
 epoch: 50, train_loss: 0.6874, test_loss: 0.9334, test_f1: 0.6024
 epoch: 51, train_loss: 0.6599, test_loss: 0.9205, test_f1: 0.6091
 epoch: 52, train_loss: 0.6629, test_loss: 0.9378, test_f1: 0.6097
 epoch: 53, train_loss: 0.6566, test_loss: 0.9417, test_f1: 0.5962
 epoch: 54, train_loss: 0.6533, test_loss: 0.9076, test_f1: 0.6166
 epoch: 55, train_loss: 0.6500, test_loss: 0.9298, test_f1: 0.6219
 epoch: 56, train_loss: 0.6508, test_loss: 0.9227, test_f1: 0.6246
 epoch: 57, train_loss: 0.6508, test_loss: 0.9221, test_f1: 0.6229
 epoch: 58, train_loss: 0.6438, test_loss: 0.9540, test_f1: 0.6284
 epoch: 59, train_loss: 0.6485, test_loss: 0.9752, test_f1: 0.6090
 epoch: 60, train_loss: 0.6441, test_loss: 0.9659, test_f1: 0.6102
 epoch: 61, train_loss: 0.6465, test_loss: 0.9590, test_f1: 0.6136
 epoch: 62, train_loss: 0.6319, test_loss: 0.9780, test_f1: 0.6126
 epoch: 63, train_loss: 0.6367, test_loss: 0.9815, test_f1: 0.6145
 epoch: 64, train_loss: 0.6347, test_loss: 0.9449, test_f1: 0.6214
 epoch: 65, train_loss: 0.6298, test_loss: 0.9585, test_f1: 0.6187
 epoch: 66, train_loss: 0.6286, test_loss: 0.9659, test_f1: 0.6126
 epoch: 67, train_loss: 0.6329, test_loss: 0.9540, test_f1: 0.6228
 epoch: 68, train_loss: 0.6297, test_loss: 0.9894, test_f1: 0.6229
 epoch: 69, train_loss: 0.6318, test_loss: 0.9679, test_f1: 0.6326
 epoch: 70, train_loss: 0.6174, test_loss: 0.9613, test_f1: 0.6270
 epoch: 71, train_loss: 0.6135, test_loss: 1.0009, test_f1: 0.6085
 epoch: 72, train_loss: 0.6084, test_loss: 0.9699, test_f1: 0.6309
 epoch: 73, train_loss: 0.6237, test_loss: 1.0070, test_f1: 0.6098
 epoch: 74, train_loss: 0.6119, test_loss: 0.9954, test_f1: 0.6161
 epoch: 75, train_loss: 0.6194, test_loss: 0.9594, test_f1: 0.6493
 epoch: 76, train_loss: 0.6014, test_loss: 0.9670, test_f1: 0.6407
 epoch: 77, train_loss: 0.6102, test_loss: 0.9998, test_f1: 0.6358
 epoch: 78, train_loss: 0.6000, test_loss: 0.9692, test_f1: 0.6397
 epoch: 79, train_loss: 0.5973, test_loss: 0.9828, test_f1: 0.6461
 epoch: 80, train_loss: 0.5946, test_loss: 0.9951, test_f1: 0.6327
 epoch: 81, train_loss: 0.6005, test_loss: 1.0036, test_f1: 0.6391
 epoch: 82, train_loss: 0.5915, test_loss: 1.0010, test_f1: 0.6267
 epoch: 83, train_loss: 0.5971, test_loss: 0.9826, test_f1: 0.6346
 epoch: 84, train_loss: 0.5998, test_loss: 0.9938, test_f1: 0.6256
 epoch: 85, train_loss: 0.5958, test_loss: 1.0063, test_f1: 0.6134
 epoch: 86, train_loss: 0.5761, test_loss: 1.0284, test_f1: 0.6200
 epoch: 87, train_loss: 0.5866, test_loss: 0.9873, test_f1: 0.6382
 epoch: 88, train_loss: 0.5918, test_loss: 1.0148, test_f1: 0.6242
 epoch: 89, train_loss: 0.5893, test_loss: 0.9850, test_f1: 0.6366
 epoch: 90, train_loss: 0.5844, test_loss: 0.9875, test_f1: 0.6376
 epoch: 91, train_loss: 0.5786, test_loss: 1.0117, test_f1: 0.6496
 epoch: 92, train_loss: 0.5811, test_loss: 0.9935, test_f1: 0.6407
 epoch: 93, train_loss: 0.5773, test_loss: 1.0169, test_f1: 0.6265
 epoch: 94, train_loss: 0.5892, test_loss: 0.9945, test_f1: 0.6550
 epoch: 95, train_loss: 0.5646, test_loss: 1.0244, test_f1: 0.6269
 epoch: 96, train_loss: 0.5814, test_loss: 1.0266, test_f1: 0.6534
 epoch: 97, train_loss: 0.5799, test_loss: 1.0204, test_f1: 0.6461
 epoch: 98, train_loss: 0.5625, test_loss: 1.0217, test_f1: 0.6375
 epoch: 99, train_loss: 0.5618, test_loss: 1.0335, test_f1: 0.6322
##################ITERATION #3 ****************************************
 epoch: 0, train_loss: 1.2100, test_loss: 1.1308, test_f1: 0.3669
 epoch: 1, train_loss: 1.0877, test_loss: 1.0158, test_f1: 0.4963
 epoch: 2, train_loss: 1.0456, test_loss: 0.9903, test_f1: 0.5046
 epoch: 3, train_loss: 1.0020, test_loss: 0.9616, test_f1: 0.5133
 epoch: 4, train_loss: 0.9768, test_loss: 0.9413, test_f1: 0.5052
 epoch: 5, train_loss: 0.9638, test_loss: 0.9354, test_f1: 0.5168
 epoch: 6, train_loss: 0.9436, test_loss: 0.9262, test_f1: 0.5187
 epoch: 7, train_loss: 0.9336, test_loss: 0.9114, test_f1: 0.5429
 epoch: 8, train_loss: 0.9133, test_loss: 0.9030, test_f1: 0.5553
 epoch: 9, train_loss: 0.9028, test_loss: 0.8986, test_f1: 0.5558
 epoch: 10, train_loss: 0.8999, test_loss: 0.8906, test_f1: 0.5487
 epoch: 11, train_loss: 0.8791, test_loss: 0.8960, test_f1: 0.5557
 epoch: 12, train_loss: 0.8740, test_loss: 0.8936, test_f1: 0.5617
 epoch: 13, train_loss: 0.8667, test_loss: 0.8965, test_f1: 0.5465
 epoch: 14, train_loss: 0.8655, test_loss: 0.8930, test_f1: 0.5507
 epoch: 15, train_loss: 0.8538, test_loss: 0.9058, test_f1: 0.5527
 epoch: 16, train_loss: 0.8458, test_loss: 0.9042, test_f1: 0.5345
 epoch: 17, train_loss: 0.8435, test_loss: 0.8901, test_f1: 0.5490
 epoch: 18, train_loss: 0.8335, test_loss: 0.9150, test_f1: 0.5390
 epoch: 19, train_loss: 0.8285, test_loss: 0.8874, test_f1: 0.5395
 epoch: 20, train_loss: 0.8230, test_loss: 0.8966, test_f1: 0.5292
 epoch: 21, train_loss: 0.8079, test_loss: 0.9169, test_f1: 0.5375
 epoch: 22, train_loss: 0.8142, test_loss: 0.9200, test_f1: 0.5445
 epoch: 23, train_loss: 0.8065, test_loss: 0.9011, test_f1: 0.5474
 epoch: 24, train_loss: 0.7974, test_loss: 0.9250, test_f1: 0.5413
 epoch: 25, train_loss: 0.7928, test_loss: 0.9125, test_f1: 0.5477
 epoch: 26, train_loss: 0.7933, test_loss: 0.9102, test_f1: 0.5400
 epoch: 27, train_loss: 0.7810, test_loss: 0.9140, test_f1: 0.5510
 epoch: 28, train_loss: 0.7818, test_loss: 0.9372, test_f1: 0.5810
 epoch: 29, train_loss: 0.7693, test_loss: 0.9195, test_f1: 0.5833
 epoch: 30, train_loss: 0.7560, test_loss: 0.9172, test_f1: 0.5849
 epoch: 31, train_loss: 0.7595, test_loss: 0.9465, test_f1: 0.5601
 epoch: 32, train_loss: 0.7706, test_loss: 0.9267, test_f1: 0.5763
 epoch: 33, train_loss: 0.7442, test_loss: 0.9283, test_f1: 0.5939
 epoch: 34, train_loss: 0.7423, test_loss: 0.9182, test_f1: 0.5907
 epoch: 35, train_loss: 0.7419, test_loss: 0.9430, test_f1: 0.5857
 epoch: 36, train_loss: 0.7438, test_loss: 0.9481, test_f1: 0.5931
 epoch: 37, train_loss: 0.7366, test_loss: 0.9399, test_f1: 0.5875
 epoch: 38, train_loss: 0.7340, test_loss: 0.9402, test_f1: 0.5979
 epoch: 39, train_loss: 0.7196, test_loss: 0.9383, test_f1: 0.5838
 epoch: 40, train_loss: 0.7245, test_loss: 0.9434, test_f1: 0.5977
 epoch: 41, train_loss: 0.7273, test_loss: 0.9187, test_f1: 0.6153
 epoch: 42, train_loss: 0.7139, test_loss: 0.9531, test_f1: 0.6055
 epoch: 43, train_loss: 0.7145, test_loss: 0.9591, test_f1: 0.6046
 epoch: 44, train_loss: 0.6965, test_loss: 0.9404, test_f1: 0.6220
 epoch: 45, train_loss: 0.7084, test_loss: 0.9709, test_f1: 0.5999
 epoch: 46, train_loss: 0.6822, test_loss: 0.9553, test_f1: 0.6079
 epoch: 47, train_loss: 0.6864, test_loss: 0.9657, test_f1: 0.5861
 epoch: 48, train_loss: 0.6864, test_loss: 0.9629, test_f1: 0.6201
 epoch: 49, train_loss: 0.6854, test_loss: 0.9648, test_f1: 0.6211
 epoch: 50, train_loss: 0.6789, test_loss: 0.9446, test_f1: 0.6060
 epoch: 51, train_loss: 0.6743, test_loss: 0.9621, test_f1: 0.6074
 epoch: 52, train_loss: 0.6740, test_loss: 0.9759, test_f1: 0.6075
 epoch: 53, train_loss: 0.6592, test_loss: 0.9695, test_f1: 0.6078
 epoch: 54, train_loss: 0.6628, test_loss: 0.9743, test_f1: 0.5995
 epoch: 55, train_loss: 0.6605, test_loss: 0.9639, test_f1: 0.6054
 epoch: 56, train_loss: 0.6594, test_loss: 0.9670, test_f1: 0.6140
 epoch: 57, train_loss: 0.6446, test_loss: 0.9888, test_f1: 0.6325
 epoch: 58, train_loss: 0.6478, test_loss: 0.9670, test_f1: 0.6093
 epoch: 59, train_loss: 0.6533, test_loss: 0.9835, test_f1: 0.6245
 epoch: 60, train_loss: 0.6484, test_loss: 0.9799, test_f1: 0.6170
 epoch: 61, train_loss: 0.6570, test_loss: 0.9697, test_f1: 0.6236
 epoch: 62, train_loss: 0.6504, test_loss: 0.9696, test_f1: 0.6103
 epoch: 63, train_loss: 0.6491, test_loss: 0.9910, test_f1: 0.6256
 epoch: 64, train_loss: 0.6393, test_loss: 0.9833, test_f1: 0.6408
 epoch: 65, train_loss: 0.6335, test_loss: 0.9835, test_f1: 0.6391
 epoch: 66, train_loss: 0.6393, test_loss: 1.0017, test_f1: 0.6385
 epoch: 67, train_loss: 0.6433, test_loss: 0.9955, test_f1: 0.6176
 epoch: 68, train_loss: 0.6423, test_loss: 0.9986, test_f1: 0.6248
 epoch: 69, train_loss: 0.6303, test_loss: 0.9992, test_f1: 0.6313
 epoch: 70, train_loss: 0.6322, test_loss: 1.0115, test_f1: 0.6230
 epoch: 71, train_loss: 0.6284, test_loss: 0.9897, test_f1: 0.6351
 epoch: 72, train_loss: 0.6395, test_loss: 0.9999, test_f1: 0.6162
 epoch: 73, train_loss: 0.6305, test_loss: 1.0183, test_f1: 0.6229
 epoch: 74, train_loss: 0.6238, test_loss: 1.0231, test_f1: 0.6285
 epoch: 75, train_loss: 0.6283, test_loss: 1.0049, test_f1: 0.6401
 epoch: 76, train_loss: 0.6292, test_loss: 1.0047, test_f1: 0.6412
 epoch: 77, train_loss: 0.6131, test_loss: 0.9992, test_f1: 0.6245
 epoch: 78, train_loss: 0.6058, test_loss: 1.0034, test_f1: 0.6240
 epoch: 79, train_loss: 0.6099, test_loss: 1.0100, test_f1: 0.6301
 epoch: 80, train_loss: 0.6135, test_loss: 1.0105, test_f1: 0.6443
 epoch: 81, train_loss: 0.6140, test_loss: 1.0011, test_f1: 0.6238
 epoch: 82, train_loss: 0.6025, test_loss: 0.9886, test_f1: 0.6594
 epoch: 83, train_loss: 0.6082, test_loss: 1.0208, test_f1: 0.6351
 epoch: 84, train_loss: 0.6037, test_loss: 1.0099, test_f1: 0.6323
 epoch: 85, train_loss: 0.6185, test_loss: 1.0275, test_f1: 0.6352
 epoch: 86, train_loss: 0.5972, test_loss: 0.9962, test_f1: 0.6563
 epoch: 87, train_loss: 0.5877, test_loss: 1.0218, test_f1: 0.6604
 epoch: 88, train_loss: 0.5865, test_loss: 1.0125, test_f1: 0.6495
 epoch: 89, train_loss: 0.5931, test_loss: 1.0447, test_f1: 0.6481
 epoch: 90, train_loss: 0.5990, test_loss: 1.0231, test_f1: 0.6411
 epoch: 91, train_loss: 0.5869, test_loss: 1.0199, test_f1: 0.6339
 epoch: 92, train_loss: 0.5925, test_loss: 1.0299, test_f1: 0.6403
 epoch: 93, train_loss: 0.5907, test_loss: 1.0221, test_f1: 0.6527
 epoch: 94, train_loss: 0.5913, test_loss: 1.0265, test_f1: 0.6459
 epoch: 95, train_loss: 0.5909, test_loss: 1.0321, test_f1: 0.6606
 epoch: 96, train_loss: 0.5995, test_loss: 1.0377, test_f1: 0.6352
 epoch: 97, train_loss: 0.5836, test_loss: 1.0431, test_f1: 0.6400
 epoch: 98, train_loss: 0.5814, test_loss: 1.0520, test_f1: 0.6182
 epoch: 99, train_loss: 0.5685, test_loss: 1.0391, test_f1: 0.6472
##################ITERATION #4 ****************************************
 epoch: 0, train_loss: 1.2251, test_loss: 1.1169, test_f1: 0.4319
 epoch: 1, train_loss: 1.1005, test_loss: 1.0068, test_f1: 0.4726
 epoch: 2, train_loss: 1.0631, test_loss: 0.9765, test_f1: 0.4806
 epoch: 3, train_loss: 1.0372, test_loss: 0.9568, test_f1: 0.4910
 epoch: 4, train_loss: 1.0092, test_loss: 0.9465, test_f1: 0.5061
 epoch: 5, train_loss: 0.9884, test_loss: 0.9397, test_f1: 0.5260
 epoch: 6, train_loss: 0.9895, test_loss: 0.9357, test_f1: 0.5144
 epoch: 7, train_loss: 0.9553, test_loss: 0.9216, test_f1: 0.5170
 epoch: 8, train_loss: 0.9415, test_loss: 0.9155, test_f1: 0.5316
 epoch: 9, train_loss: 0.9232, test_loss: 0.9057, test_f1: 0.5328
 epoch: 10, train_loss: 0.9192, test_loss: 0.9052, test_f1: 0.5286
 epoch: 11, train_loss: 0.9168, test_loss: 0.9074, test_f1: 0.5348
 epoch: 12, train_loss: 0.9041, test_loss: 0.8988, test_f1: 0.5402
 epoch: 13, train_loss: 0.8936, test_loss: 0.9018, test_f1: 0.5403
 epoch: 14, train_loss: 0.8908, test_loss: 0.9128, test_f1: 0.5354
 epoch: 15, train_loss: 0.8728, test_loss: 0.8986, test_f1: 0.5434
 epoch: 16, train_loss: 0.8750, test_loss: 0.8788, test_f1: 0.5438
 epoch: 17, train_loss: 0.8529, test_loss: 0.8865, test_f1: 0.5500
 epoch: 18, train_loss: 0.8650, test_loss: 0.8770, test_f1: 0.5394
 epoch: 19, train_loss: 0.8541, test_loss: 0.8758, test_f1: 0.5470
 epoch: 20, train_loss: 0.8421, test_loss: 0.8839, test_f1: 0.5695
 epoch: 21, train_loss: 0.8318, test_loss: 0.8789, test_f1: 0.5383
 epoch: 22, train_loss: 0.8278, test_loss: 0.8871, test_f1: 0.5535
 epoch: 23, train_loss: 0.8216, test_loss: 0.8908, test_f1: 0.5499
 epoch: 24, train_loss: 0.8149, test_loss: 0.8750, test_f1: 0.5557
 epoch: 25, train_loss: 0.8160, test_loss: 0.9027, test_f1: 0.5459
 epoch: 26, train_loss: 0.8211, test_loss: 0.8736, test_f1: 0.5699
 epoch: 27, train_loss: 0.7979, test_loss: 0.8768, test_f1: 0.5431
 epoch: 28, train_loss: 0.7957, test_loss: 0.8896, test_f1: 0.5625
 epoch: 29, train_loss: 0.7979, test_loss: 0.8765, test_f1: 0.5712
 epoch: 30, train_loss: 0.7864, test_loss: 0.8713, test_f1: 0.5742
 epoch: 31, train_loss: 0.7863, test_loss: 0.8719, test_f1: 0.5753
 epoch: 32, train_loss: 0.7803, test_loss: 0.8895, test_f1: 0.5754
 epoch: 33, train_loss: 0.7759, test_loss: 0.8730, test_f1: 0.5584
 epoch: 34, train_loss: 0.7739, test_loss: 0.9030, test_f1: 0.5496
 epoch: 35, train_loss: 0.7545, test_loss: 0.8845, test_f1: 0.5615
 epoch: 36, train_loss: 0.7602, test_loss: 0.8635, test_f1: 0.5962
 epoch: 37, train_loss: 0.7654, test_loss: 0.8612, test_f1: 0.5867
 epoch: 38, train_loss: 0.7544, test_loss: 0.8704, test_f1: 0.5901
 epoch: 39, train_loss: 0.7464, test_loss: 0.8943, test_f1: 0.5633
 epoch: 40, train_loss: 0.7473, test_loss: 0.8880, test_f1: 0.5826
 epoch: 41, train_loss: 0.7384, test_loss: 0.8631, test_f1: 0.5812
 epoch: 42, train_loss: 0.7493, test_loss: 0.8980, test_f1: 0.5757
 epoch: 43, train_loss: 0.7456, test_loss: 0.9125, test_f1: 0.5593
 epoch: 44, train_loss: 0.7346, test_loss: 0.8965, test_f1: 0.6003
 epoch: 45, train_loss: 0.7278, test_loss: 0.9044, test_f1: 0.5794
 epoch: 46, train_loss: 0.7219, test_loss: 0.8888, test_f1: 0.5907
 epoch: 47, train_loss: 0.7170, test_loss: 0.9089, test_f1: 0.5837
 epoch: 48, train_loss: 0.7120, test_loss: 0.8815, test_f1: 0.5901
 epoch: 49, train_loss: 0.7230, test_loss: 0.8758, test_f1: 0.6185
 epoch: 50, train_loss: 0.7089, test_loss: 0.8947, test_f1: 0.5989
 epoch: 51, train_loss: 0.7047, test_loss: 0.8957, test_f1: 0.6037
 epoch: 52, train_loss: 0.6968, test_loss: 0.8938, test_f1: 0.5985
 epoch: 53, train_loss: 0.6920, test_loss: 0.8897, test_f1: 0.6131
 epoch: 54, train_loss: 0.6796, test_loss: 0.9001, test_f1: 0.6054
 epoch: 55, train_loss: 0.6902, test_loss: 0.8977, test_f1: 0.6108
 epoch: 56, train_loss: 0.7040, test_loss: 0.8914, test_f1: 0.6087
 epoch: 57, train_loss: 0.6800, test_loss: 0.8928, test_f1: 0.6112
 epoch: 58, train_loss: 0.6769, test_loss: 0.8784, test_f1: 0.6115
 epoch: 59, train_loss: 0.6707, test_loss: 0.9005, test_f1: 0.6065
 epoch: 60, train_loss: 0.6867, test_loss: 0.9109, test_f1: 0.5942
 epoch: 61, train_loss: 0.6815, test_loss: 0.9107, test_f1: 0.5944
 epoch: 62, train_loss: 0.6706, test_loss: 0.9034, test_f1: 0.6163
 epoch: 63, train_loss: 0.6789, test_loss: 0.9124, test_f1: 0.6123
 epoch: 64, train_loss: 0.6759, test_loss: 0.9257, test_f1: 0.6067
 epoch: 65, train_loss: 0.6727, test_loss: 0.8965, test_f1: 0.6058
 epoch: 66, train_loss: 0.6724, test_loss: 0.9136, test_f1: 0.6064
 epoch: 67, train_loss: 0.6621, test_loss: 0.9177, test_f1: 0.6158
 epoch: 68, train_loss: 0.6607, test_loss: 0.9266, test_f1: 0.5973
 epoch: 69, train_loss: 0.6564, test_loss: 0.9228, test_f1: 0.6082
 epoch: 70, train_loss: 0.6598, test_loss: 0.9166, test_f1: 0.6026
 epoch: 71, train_loss: 0.6576, test_loss: 0.9360, test_f1: 0.5991
 epoch: 72, train_loss: 0.6649, test_loss: 0.9175, test_f1: 0.6222
 epoch: 73, train_loss: 0.6526, test_loss: 0.9334, test_f1: 0.6015
 epoch: 74, train_loss: 0.6578, test_loss: 0.9319, test_f1: 0.6139
 epoch: 75, train_loss: 0.6578, test_loss: 0.9095, test_f1: 0.6208
 epoch: 76, train_loss: 0.6582, test_loss: 0.9409, test_f1: 0.6039
 epoch: 77, train_loss: 0.6495, test_loss: 0.9367, test_f1: 0.6244
 epoch: 78, train_loss: 0.6522, test_loss: 0.9271, test_f1: 0.6256
 epoch: 79, train_loss: 0.6451, test_loss: 0.9297, test_f1: 0.6384
 epoch: 80, train_loss: 0.6378, test_loss: 0.9436, test_f1: 0.6160
 epoch: 81, train_loss: 0.6427, test_loss: 0.9459, test_f1: 0.6127
 epoch: 82, train_loss: 0.6370, test_loss: 0.9256, test_f1: 0.6120
 epoch: 83, train_loss: 0.6373, test_loss: 0.9242, test_f1: 0.6319
 epoch: 84, train_loss: 0.6341, test_loss: 0.9413, test_f1: 0.6289
 epoch: 85, train_loss: 0.6225, test_loss: 0.9399, test_f1: 0.6306
 epoch: 86, train_loss: 0.6332, test_loss: 0.9506, test_f1: 0.6168
 epoch: 87, train_loss: 0.6420, test_loss: 0.9109, test_f1: 0.6584
 epoch: 88, train_loss: 0.6255, test_loss: 0.9513, test_f1: 0.6293
 epoch: 89, train_loss: 0.6251, test_loss: 0.9516, test_f1: 0.6367
 epoch: 90, train_loss: 0.6249, test_loss: 0.9342, test_f1: 0.6343
 epoch: 91, train_loss: 0.6285, test_loss: 0.9233, test_f1: 0.6343
 epoch: 92, train_loss: 0.6267, test_loss: 0.9599, test_f1: 0.6208
 epoch: 93, train_loss: 0.6361, test_loss: 0.9389, test_f1: 0.6288
 epoch: 94, train_loss: 0.6185, test_loss: 0.9607, test_f1: 0.6260
 epoch: 95, train_loss: 0.6208, test_loss: 0.9587, test_f1: 0.6201
 epoch: 96, train_loss: 0.6171, test_loss: 0.9558, test_f1: 0.6280
 epoch: 97, train_loss: 0.6090, test_loss: 0.9560, test_f1: 0.6317
 epoch: 98, train_loss: 0.6160, test_loss: 0.9703, test_f1: 0.6338
 epoch: 99, train_loss: 0.6119, test_loss: 0.9820, test_f1: 0.6355
##################ITERATION #5 ****************************************
 epoch: 0, train_loss: 1.2393, test_loss: 1.0803, test_f1: 0.4537
 epoch: 1, train_loss: 1.0926, test_loss: 1.0077, test_f1: 0.4828
 epoch: 2, train_loss: 1.0601, test_loss: 0.9772, test_f1: 0.4885
 epoch: 3, train_loss: 1.0119, test_loss: 0.9599, test_f1: 0.4824
 epoch: 4, train_loss: 0.9874, test_loss: 0.9514, test_f1: 0.5062
 epoch: 5, train_loss: 0.9850, test_loss: 0.9349, test_f1: 0.5199
 epoch: 6, train_loss: 0.9601, test_loss: 0.9473, test_f1: 0.5119
 epoch: 7, train_loss: 0.9383, test_loss: 0.9327, test_f1: 0.5168
 epoch: 8, train_loss: 0.9303, test_loss: 0.9317, test_f1: 0.5212
 epoch: 9, train_loss: 0.9284, test_loss: 0.9191, test_f1: 0.5354
 epoch: 10, train_loss: 0.9097, test_loss: 0.9233, test_f1: 0.5301
 epoch: 11, train_loss: 0.9130, test_loss: 0.9246, test_f1: 0.5384
 epoch: 12, train_loss: 0.8936, test_loss: 0.9262, test_f1: 0.5201
 epoch: 13, train_loss: 0.8877, test_loss: 0.9134, test_f1: 0.5405
 epoch: 14, train_loss: 0.8785, test_loss: 0.9089, test_f1: 0.5332
 epoch: 15, train_loss: 0.8671, test_loss: 0.8974, test_f1: 0.5737
 epoch: 16, train_loss: 0.8561, test_loss: 0.9159, test_f1: 0.5373
 epoch: 17, train_loss: 0.8497, test_loss: 0.8993, test_f1: 0.5458
 epoch: 18, train_loss: 0.8417, test_loss: 0.9089, test_f1: 0.5403
 epoch: 19, train_loss: 0.8402, test_loss: 0.8977, test_f1: 0.5559
 epoch: 20, train_loss: 0.8400, test_loss: 0.9054, test_f1: 0.5414
 epoch: 21, train_loss: 0.8272, test_loss: 0.9237, test_f1: 0.5324
 epoch: 22, train_loss: 0.8312, test_loss: 0.9097, test_f1: 0.5618
 epoch: 23, train_loss: 0.8200, test_loss: 0.8992, test_f1: 0.5513
 epoch: 24, train_loss: 0.8048, test_loss: 0.8995, test_f1: 0.5649
 epoch: 25, train_loss: 0.7983, test_loss: 0.9061, test_f1: 0.5553
 epoch: 26, train_loss: 0.7941, test_loss: 0.9144, test_f1: 0.5581
 epoch: 27, train_loss: 0.8086, test_loss: 0.9213, test_f1: 0.5591
 epoch: 28, train_loss: 0.7946, test_loss: 0.9149, test_f1: 0.5679
 epoch: 29, train_loss: 0.7817, test_loss: 0.9136, test_f1: 0.5841
 epoch: 30, train_loss: 0.7776, test_loss: 0.9185, test_f1: 0.5578
 epoch: 31, train_loss: 0.7786, test_loss: 0.8969, test_f1: 0.5943
 epoch: 32, train_loss: 0.7670, test_loss: 0.9163, test_f1: 0.6026
 epoch: 33, train_loss: 0.7581, test_loss: 0.9065, test_f1: 0.5805
 epoch: 34, train_loss: 0.7612, test_loss: 0.9051, test_f1: 0.5970
 epoch: 35, train_loss: 0.7586, test_loss: 0.9025, test_f1: 0.5852
 epoch: 36, train_loss: 0.7569, test_loss: 0.9270, test_f1: 0.5832
 epoch: 37, train_loss: 0.7529, test_loss: 0.9336, test_f1: 0.5885
 epoch: 38, train_loss: 0.7366, test_loss: 0.9479, test_f1: 0.5940
 epoch: 39, train_loss: 0.7404, test_loss: 0.9199, test_f1: 0.6212
 epoch: 40, train_loss: 0.7268, test_loss: 0.9245, test_f1: 0.5944
 epoch: 41, train_loss: 0.7262, test_loss: 0.9179, test_f1: 0.6121
 epoch: 42, train_loss: 0.7315, test_loss: 0.9419, test_f1: 0.5820
 epoch: 43, train_loss: 0.7199, test_loss: 0.9327, test_f1: 0.6037
 epoch: 44, train_loss: 0.7121, test_loss: 0.9613, test_f1: 0.5956
 epoch: 45, train_loss: 0.7192, test_loss: 0.9386, test_f1: 0.6003
 epoch: 46, train_loss: 0.7092, test_loss: 0.9302, test_f1: 0.6174
 epoch: 47, train_loss: 0.7013, test_loss: 0.9371, test_f1: 0.6047
 epoch: 48, train_loss: 0.6929, test_loss: 0.9680, test_f1: 0.5930
 epoch: 49, train_loss: 0.6936, test_loss: 0.9688, test_f1: 0.6167
 epoch: 50, train_loss: 0.6899, test_loss: 0.9448, test_f1: 0.6153
 epoch: 51, train_loss: 0.6766, test_loss: 0.9661, test_f1: 0.6099
 epoch: 52, train_loss: 0.6832, test_loss: 0.9786, test_f1: 0.5982
 epoch: 53, train_loss: 0.6685, test_loss: 0.9570, test_f1: 0.6146
 epoch: 54, train_loss: 0.6674, test_loss: 0.9612, test_f1: 0.6226
 epoch: 55, train_loss: 0.6718, test_loss: 0.9688, test_f1: 0.6144
 epoch: 56, train_loss: 0.6734, test_loss: 0.9684, test_f1: 0.6059
 epoch: 57, train_loss: 0.6690, test_loss: 0.9497, test_f1: 0.6288
 epoch: 58, train_loss: 0.6552, test_loss: 0.9734, test_f1: 0.6042
 epoch: 59, train_loss: 0.6623, test_loss: 0.9734, test_f1: 0.6125
 epoch: 60, train_loss: 0.6507, test_loss: 0.9872, test_f1: 0.6245
 epoch: 61, train_loss: 0.6548, test_loss: 0.9750, test_f1: 0.6144
 epoch: 62, train_loss: 0.6461, test_loss: 0.9815, test_f1: 0.6157
 epoch: 63, train_loss: 0.6583, test_loss: 0.9893, test_f1: 0.6151
 epoch: 64, train_loss: 0.6494, test_loss: 0.9769, test_f1: 0.5957
 epoch: 65, train_loss: 0.6415, test_loss: 0.9838, test_f1: 0.6184
 epoch: 66, train_loss: 0.6462, test_loss: 0.9696, test_f1: 0.6394
 epoch: 67, train_loss: 0.6400, test_loss: 0.9819, test_f1: 0.6121
 epoch: 68, train_loss: 0.6438, test_loss: 0.9946, test_f1: 0.6152
 epoch: 69, train_loss: 0.6419, test_loss: 0.9961, test_f1: 0.6067
 epoch: 70, train_loss: 0.6346, test_loss: 0.9799, test_f1: 0.6096
 epoch: 71, train_loss: 0.6472, test_loss: 0.9959, test_f1: 0.6229
 epoch: 72, train_loss: 0.6314, test_loss: 0.9932, test_f1: 0.6204
 epoch: 73, train_loss: 0.6385, test_loss: 0.9797, test_f1: 0.6259
 epoch: 74, train_loss: 0.6528, test_loss: 0.9953, test_f1: 0.6327
 epoch: 75, train_loss: 0.6215, test_loss: 1.0388, test_f1: 0.6165
 epoch: 76, train_loss: 0.6391, test_loss: 0.9942, test_f1: 0.6337
 epoch: 77, train_loss: 0.6265, test_loss: 1.0056, test_f1: 0.6375
 epoch: 78, train_loss: 0.6304, test_loss: 1.0049, test_f1: 0.6284
 epoch: 79, train_loss: 0.6436, test_loss: 1.0097, test_f1: 0.6347
 epoch: 80, train_loss: 0.6169, test_loss: 1.0012, test_f1: 0.6263
 epoch: 81, train_loss: 0.6152, test_loss: 0.9948, test_f1: 0.6510
 epoch: 82, train_loss: 0.6145, test_loss: 1.0252, test_f1: 0.6267
 epoch: 83, train_loss: 0.6192, test_loss: 0.9981, test_f1: 0.6303
 epoch: 84, train_loss: 0.6115, test_loss: 1.0218, test_f1: 0.6194
 epoch: 85, train_loss: 0.6163, test_loss: 1.0282, test_f1: 0.6176
 epoch: 86, train_loss: 0.6138, test_loss: 1.0245, test_f1: 0.6514
 epoch: 87, train_loss: 0.6080, test_loss: 1.0484, test_f1: 0.6127
 epoch: 88, train_loss: 0.6126, test_loss: 1.0518, test_f1: 0.6216
 epoch: 89, train_loss: 0.6055, test_loss: 1.0143, test_f1: 0.6447
 epoch: 90, train_loss: 0.6047, test_loss: 1.0603, test_f1: 0.6271
 epoch: 91, train_loss: 0.5962, test_loss: 1.0454, test_f1: 0.6252
 epoch: 92, train_loss: 0.6022, test_loss: 1.0238, test_f1: 0.6449
 epoch: 93, train_loss: 0.6027, test_loss: 1.0280, test_f1: 0.6279
 epoch: 94, train_loss: 0.5989, test_loss: 1.0365, test_f1: 0.6519
 epoch: 95, train_loss: 0.5965, test_loss: 1.0436, test_f1: 0.6336
 epoch: 96, train_loss: 0.6095, test_loss: 1.0208, test_f1: 0.6462
 epoch: 97, train_loss: 0.5875, test_loss: 1.0305, test_f1: 0.6413
 epoch: 98, train_loss: 0.5994, test_loss: 1.0171, test_f1: 0.6406
 epoch: 99, train_loss: 0.5929, test_loss: 1.0233, test_f1: 0.6615
##################ITERATION #6 ****************************************
 epoch: 0, train_loss: 1.2305, test_loss: 1.0726, test_f1: 0.4256
 epoch: 1, train_loss: 1.0809, test_loss: 0.9791, test_f1: 0.4855
 epoch: 2, train_loss: 1.0535, test_loss: 0.9498, test_f1: 0.4965
 epoch: 3, train_loss: 1.0216, test_loss: 0.9420, test_f1: 0.5099
 epoch: 4, train_loss: 0.9941, test_loss: 0.9337, test_f1: 0.5160
 epoch: 5, train_loss: 0.9713, test_loss: 0.9301, test_f1: 0.5256
 epoch: 6, train_loss: 0.9614, test_loss: 0.9240, test_f1: 0.5204
 epoch: 7, train_loss: 0.9382, test_loss: 0.9085, test_f1: 0.5373
 epoch: 8, train_loss: 0.9471, test_loss: 0.9082, test_f1: 0.5240
 epoch: 9, train_loss: 0.9184, test_loss: 0.9134, test_f1: 0.5474
 epoch: 10, train_loss: 0.9192, test_loss: 0.8955, test_f1: 0.5280
 epoch: 11, train_loss: 0.9121, test_loss: 0.9147, test_f1: 0.5614
 epoch: 12, train_loss: 0.8961, test_loss: 0.9052, test_f1: 0.5334
 epoch: 13, train_loss: 0.8943, test_loss: 0.9143, test_f1: 0.5417
 epoch: 14, train_loss: 0.8906, test_loss: 0.9008, test_f1: 0.5580
 epoch: 15, train_loss: 0.8756, test_loss: 0.8865, test_f1: 0.5597
 epoch: 16, train_loss: 0.8636, test_loss: 0.8833, test_f1: 0.5671
 epoch: 17, train_loss: 0.8629, test_loss: 0.8728, test_f1: 0.5809
 epoch: 18, train_loss: 0.8472, test_loss: 0.8865, test_f1: 0.5561
 epoch: 19, train_loss: 0.8489, test_loss: 0.8738, test_f1: 0.5533
 epoch: 20, train_loss: 0.8482, test_loss: 0.8617, test_f1: 0.5731
 epoch: 21, train_loss: 0.8403, test_loss: 0.8675, test_f1: 0.5718
 epoch: 22, train_loss: 0.8223, test_loss: 0.8689, test_f1: 0.5691
 epoch: 23, train_loss: 0.8124, test_loss: 0.8753, test_f1: 0.5598
 epoch: 24, train_loss: 0.8187, test_loss: 0.9137, test_f1: 0.5831
 epoch: 25, train_loss: 0.8131, test_loss: 0.8703, test_f1: 0.5516
 epoch: 26, train_loss: 0.8070, test_loss: 0.8804, test_f1: 0.5759
 epoch: 27, train_loss: 0.7940, test_loss: 0.8818, test_f1: 0.5713
 epoch: 28, train_loss: 0.7921, test_loss: 0.8926, test_f1: 0.5956
 epoch: 29, train_loss: 0.7943, test_loss: 0.9258, test_f1: 0.5899
 epoch: 30, train_loss: 0.7862, test_loss: 0.8915, test_f1: 0.5664
 epoch: 31, train_loss: 0.7721, test_loss: 0.8938, test_f1: 0.5865
 epoch: 32, train_loss: 0.7827, test_loss: 0.8855, test_f1: 0.5722
 epoch: 33, train_loss: 0.7716, test_loss: 0.8892, test_f1: 0.6172
 epoch: 34, train_loss: 0.7558, test_loss: 0.8879, test_f1: 0.5765
 epoch: 35, train_loss: 0.7553, test_loss: 0.9082, test_f1: 0.5863
 epoch: 36, train_loss: 0.7607, test_loss: 0.9228, test_f1: 0.6158
 epoch: 37, train_loss: 0.7549, test_loss: 0.9222, test_f1: 0.5654
 epoch: 38, train_loss: 0.7476, test_loss: 0.9124, test_f1: 0.6162
 epoch: 39, train_loss: 0.7417, test_loss: 0.9100, test_f1: 0.5874
 epoch: 40, train_loss: 0.7327, test_loss: 0.8904, test_f1: 0.5787
 epoch: 41, train_loss: 0.7365, test_loss: 0.9145, test_f1: 0.5816
 epoch: 42, train_loss: 0.7314, test_loss: 0.9392, test_f1: 0.5678
 epoch: 43, train_loss: 0.7185, test_loss: 0.9313, test_f1: 0.5703
 epoch: 44, train_loss: 0.7238, test_loss: 0.9189, test_f1: 0.5987
 epoch: 45, train_loss: 0.7195, test_loss: 0.9495, test_f1: 0.5921
 epoch: 46, train_loss: 0.7207, test_loss: 0.9413, test_f1: 0.5674
 epoch: 47, train_loss: 0.7199, test_loss: 0.9102, test_f1: 0.5850
 epoch: 48, train_loss: 0.6976, test_loss: 0.9468, test_f1: 0.5870
 epoch: 49, train_loss: 0.6964, test_loss: 0.9198, test_f1: 0.6149
 epoch: 50, train_loss: 0.6969, test_loss: 0.9313, test_f1: 0.6048
 epoch: 51, train_loss: 0.6920, test_loss: 0.9165, test_f1: 0.5998
 epoch: 52, train_loss: 0.6865, test_loss: 0.9215, test_f1: 0.6035
 epoch: 53, train_loss: 0.6825, test_loss: 0.9369, test_f1: 0.5942
 epoch: 54, train_loss: 0.6783, test_loss: 0.9324, test_f1: 0.6118
 epoch: 55, train_loss: 0.6752, test_loss: 0.9143, test_f1: 0.6062
 epoch: 56, train_loss: 0.6670, test_loss: 0.9222, test_f1: 0.6109
 epoch: 57, train_loss: 0.6679, test_loss: 0.9388, test_f1: 0.6038
 epoch: 58, train_loss: 0.6756, test_loss: 0.9268, test_f1: 0.6033
 epoch: 59, train_loss: 0.6685, test_loss: 0.9549, test_f1: 0.6209
 epoch: 60, train_loss: 0.6736, test_loss: 0.9622, test_f1: 0.5906
 epoch: 61, train_loss: 0.6615, test_loss: 0.9517, test_f1: 0.5972
 epoch: 62, train_loss: 0.6561, test_loss: 0.9185, test_f1: 0.6185
 epoch: 63, train_loss: 0.6490, test_loss: 0.9361, test_f1: 0.6166
 epoch: 64, train_loss: 0.6592, test_loss: 0.9440, test_f1: 0.6155
 epoch: 65, train_loss: 0.6486, test_loss: 0.9382, test_f1: 0.6130
 epoch: 66, train_loss: 0.6479, test_loss: 0.9415, test_f1: 0.6246
 epoch: 67, train_loss: 0.6500, test_loss: 0.9321, test_f1: 0.6174
 epoch: 68, train_loss: 0.6472, test_loss: 0.9363, test_f1: 0.6170
 epoch: 69, train_loss: 0.6512, test_loss: 0.9499, test_f1: 0.6232
 epoch: 70, train_loss: 0.6506, test_loss: 0.9577, test_f1: 0.6230
 epoch: 71, train_loss: 0.6518, test_loss: 0.9608, test_f1: 0.6164
 epoch: 72, train_loss: 0.6390, test_loss: 0.9479, test_f1: 0.6177
 epoch: 73, train_loss: 0.6369, test_loss: 0.9595, test_f1: 0.6167
 epoch: 74, train_loss: 0.6269, test_loss: 0.9388, test_f1: 0.6167
 epoch: 75, train_loss: 0.6399, test_loss: 0.9457, test_f1: 0.6275
 epoch: 76, train_loss: 0.6216, test_loss: 0.9369, test_f1: 0.6245
 epoch: 77, train_loss: 0.6323, test_loss: 0.9570, test_f1: 0.6183
 epoch: 78, train_loss: 0.6223, test_loss: 0.9786, test_f1: 0.6140
 epoch: 79, train_loss: 0.6206, test_loss: 0.9530, test_f1: 0.6261
 epoch: 80, train_loss: 0.6381, test_loss: 0.9378, test_f1: 0.6200
 epoch: 81, train_loss: 0.6087, test_loss: 0.9547, test_f1: 0.6175
 epoch: 82, train_loss: 0.6206, test_loss: 0.9569, test_f1: 0.6273
 epoch: 83, train_loss: 0.6088, test_loss: 0.9555, test_f1: 0.6141
 epoch: 84, train_loss: 0.6112, test_loss: 0.9522, test_f1: 0.6299
 epoch: 85, train_loss: 0.6187, test_loss: 0.9657, test_f1: 0.6244
 epoch: 86, train_loss: 0.6110, test_loss: 0.9577, test_f1: 0.6209
 epoch: 87, train_loss: 0.6107, test_loss: 0.9526, test_f1: 0.6308
 epoch: 88, train_loss: 0.6130, test_loss: 0.9645, test_f1: 0.6222
 epoch: 89, train_loss: 0.5936, test_loss: 0.9580, test_f1: 0.6302
 epoch: 90, train_loss: 0.6023, test_loss: 0.9481, test_f1: 0.6277
 epoch: 91, train_loss: 0.6077, test_loss: 0.9764, test_f1: 0.6239
 epoch: 92, train_loss: 0.6008, test_loss: 0.9675, test_f1: 0.6392
 epoch: 93, train_loss: 0.5998, test_loss: 0.9569, test_f1: 0.6351
 epoch: 94, train_loss: 0.5996, test_loss: 0.9832, test_f1: 0.6269
 epoch: 95, train_loss: 0.6076, test_loss: 0.9419, test_f1: 0.6438
 epoch: 96, train_loss: 0.5898, test_loss: 0.9840, test_f1: 0.6292
 epoch: 97, train_loss: 0.5848, test_loss: 0.9677, test_f1: 0.6317
 epoch: 98, train_loss: 0.5957, test_loss: 0.9665, test_f1: 0.6315
 epoch: 99, train_loss: 0.5792, test_loss: 0.9686, test_f1: 0.6436
##################ITERATION #7 ****************************************
 epoch: 0, train_loss: 1.3077, test_loss: 1.1147, test_f1: 0.4319
 epoch: 1, train_loss: 1.1359, test_loss: 0.9845, test_f1: 0.5187
 epoch: 2, train_loss: 1.0674, test_loss: 0.9598, test_f1: 0.5227
 epoch: 3, train_loss: 1.0396, test_loss: 0.9388, test_f1: 0.5153
 epoch: 4, train_loss: 1.0084, test_loss: 0.9302, test_f1: 0.5258
 epoch: 5, train_loss: 0.9884, test_loss: 0.9201, test_f1: 0.5360
 epoch: 6, train_loss: 0.9690, test_loss: 0.8945, test_f1: 0.5397
 epoch: 7, train_loss: 0.9566, test_loss: 0.9070, test_f1: 0.5559
 epoch: 8, train_loss: 0.9462, test_loss: 0.9102, test_f1: 0.5624
 epoch: 9, train_loss: 0.9330, test_loss: 0.8903, test_f1: 0.5646
 epoch: 10, train_loss: 0.9203, test_loss: 0.9004, test_f1: 0.5445
 epoch: 11, train_loss: 0.9131, test_loss: 0.8892, test_f1: 0.5621
 epoch: 12, train_loss: 0.9084, test_loss: 0.8894, test_f1: 0.5747
 epoch: 13, train_loss: 0.9051, test_loss: 0.8919, test_f1: 0.5746
 epoch: 14, train_loss: 0.8876, test_loss: 0.9176, test_f1: 0.5611
 epoch: 15, train_loss: 0.8680, test_loss: 0.8887, test_f1: 0.5675
 epoch: 16, train_loss: 0.8609, test_loss: 0.9115, test_f1: 0.5603
 epoch: 17, train_loss: 0.8657, test_loss: 0.9321, test_f1: 0.5695
 epoch: 18, train_loss: 0.8585, test_loss: 0.9133, test_f1: 0.5966
 epoch: 19, train_loss: 0.8522, test_loss: 0.9183, test_f1: 0.5796
 epoch: 20, train_loss: 0.8441, test_loss: 0.8853, test_f1: 0.5871
 epoch: 21, train_loss: 0.8395, test_loss: 0.8894, test_f1: 0.5902
 epoch: 22, train_loss: 0.8380, test_loss: 0.8892, test_f1: 0.5804
 epoch: 23, train_loss: 0.8328, test_loss: 0.8683, test_f1: 0.5711
 epoch: 24, train_loss: 0.8228, test_loss: 0.8945, test_f1: 0.5881
 epoch: 25, train_loss: 0.8228, test_loss: 0.8963, test_f1: 0.6047
 epoch: 26, train_loss: 0.8179, test_loss: 0.8874, test_f1: 0.5818
 epoch: 27, train_loss: 0.8003, test_loss: 0.9084, test_f1: 0.5898
 epoch: 28, train_loss: 0.8075, test_loss: 0.8921, test_f1: 0.5990
 epoch: 29, train_loss: 0.8063, test_loss: 0.9032, test_f1: 0.5970
 epoch: 30, train_loss: 0.7991, test_loss: 0.8815, test_f1: 0.5845
 epoch: 31, train_loss: 0.7877, test_loss: 0.9165, test_f1: 0.6094
 epoch: 32, train_loss: 0.7873, test_loss: 0.8839, test_f1: 0.5972
 epoch: 33, train_loss: 0.7878, test_loss: 0.8627, test_f1: 0.5908
 epoch: 34, train_loss: 0.7754, test_loss: 0.8895, test_f1: 0.6207
 epoch: 35, train_loss: 0.7732, test_loss: 0.9039, test_f1: 0.6066
 epoch: 36, train_loss: 0.7770, test_loss: 0.9239, test_f1: 0.5911
 epoch: 37, train_loss: 0.7594, test_loss: 0.9499, test_f1: 0.6127
 epoch: 38, train_loss: 0.7546, test_loss: 0.8963, test_f1: 0.6267
 epoch: 39, train_loss: 0.7615, test_loss: 0.9130, test_f1: 0.6099
 epoch: 40, train_loss: 0.7562, test_loss: 0.8672, test_f1: 0.6306
 epoch: 41, train_loss: 0.7405, test_loss: 0.9058, test_f1: 0.6081
 epoch: 42, train_loss: 0.7440, test_loss: 0.9107, test_f1: 0.6227
 epoch: 43, train_loss: 0.7462, test_loss: 0.9326, test_f1: 0.5992
 epoch: 44, train_loss: 0.7499, test_loss: 0.9141, test_f1: 0.6164
 epoch: 45, train_loss: 0.7324, test_loss: 0.9081, test_f1: 0.6240
 epoch: 46, train_loss: 0.7342, test_loss: 0.9229, test_f1: 0.6341
 epoch: 47, train_loss: 0.7247, test_loss: 0.9162, test_f1: 0.6157
 epoch: 48, train_loss: 0.7214, test_loss: 0.9399, test_f1: 0.6187
 epoch: 49, train_loss: 0.7079, test_loss: 0.9224, test_f1: 0.6280
 epoch: 50, train_loss: 0.7029, test_loss: 0.9151, test_f1: 0.6346
 epoch: 51, train_loss: 0.7058, test_loss: 0.9207, test_f1: 0.6184
 epoch: 52, train_loss: 0.6983, test_loss: 0.9191, test_f1: 0.6264
 epoch: 53, train_loss: 0.7012, test_loss: 0.9102, test_f1: 0.6234
 epoch: 54, train_loss: 0.7039, test_loss: 0.9481, test_f1: 0.6309
 epoch: 55, train_loss: 0.6936, test_loss: 0.9387, test_f1: 0.6083
 epoch: 56, train_loss: 0.6925, test_loss: 0.9377, test_f1: 0.6191
 epoch: 57, train_loss: 0.6847, test_loss: 0.9366, test_f1: 0.6099
 epoch: 58, train_loss: 0.6803, test_loss: 0.9282, test_f1: 0.6466
 epoch: 59, train_loss: 0.6810, test_loss: 0.9272, test_f1: 0.6302
 epoch: 60, train_loss: 0.6815, test_loss: 0.9401, test_f1: 0.6214
 epoch: 61, train_loss: 0.6744, test_loss: 0.9390, test_f1: 0.6269
 epoch: 62, train_loss: 0.6737, test_loss: 0.9577, test_f1: 0.6425
 epoch: 63, train_loss: 0.6739, test_loss: 0.9489, test_f1: 0.6442
 epoch: 64, train_loss: 0.6766, test_loss: 0.9374, test_f1: 0.6414
 epoch: 65, train_loss: 0.6736, test_loss: 0.9332, test_f1: 0.6392
 epoch: 66, train_loss: 0.6731, test_loss: 0.9241, test_f1: 0.6555
 epoch: 67, train_loss: 0.6693, test_loss: 0.9338, test_f1: 0.6382
 epoch: 68, train_loss: 0.6746, test_loss: 0.9459, test_f1: 0.6459
 epoch: 69, train_loss: 0.6603, test_loss: 0.9387, test_f1: 0.6355
 epoch: 70, train_loss: 0.6665, test_loss: 0.9524, test_f1: 0.6459
 epoch: 71, train_loss: 0.6619, test_loss: 0.9653, test_f1: 0.6424
 epoch: 72, train_loss: 0.6551, test_loss: 0.9538, test_f1: 0.6493
 epoch: 73, train_loss: 0.6548, test_loss: 0.9513, test_f1: 0.6576
 epoch: 74, train_loss: 0.6558, test_loss: 0.9556, test_f1: 0.6468
 epoch: 75, train_loss: 0.6465, test_loss: 0.9588, test_f1: 0.6621
 epoch: 76, train_loss: 0.6385, test_loss: 0.9643, test_f1: 0.6392
 epoch: 77, train_loss: 0.6423, test_loss: 0.9630, test_f1: 0.6385
 epoch: 78, train_loss: 0.6460, test_loss: 0.9656, test_f1: 0.6491
 epoch: 79, train_loss: 0.6467, test_loss: 0.9742, test_f1: 0.6423
 epoch: 80, train_loss: 0.6379, test_loss: 0.9569, test_f1: 0.6460
 epoch: 81, train_loss: 0.6392, test_loss: 0.9467, test_f1: 0.6583
 epoch: 82, train_loss: 0.6416, test_loss: 0.9684, test_f1: 0.6451
 epoch: 83, train_loss: 0.6257, test_loss: 0.9624, test_f1: 0.6420
 epoch: 84, train_loss: 0.6166, test_loss: 0.9751, test_f1: 0.6471
 epoch: 85, train_loss: 0.6348, test_loss: 0.9568, test_f1: 0.6622
 epoch: 86, train_loss: 0.6408, test_loss: 0.9747, test_f1: 0.6487
 epoch: 87, train_loss: 0.6232, test_loss: 0.9573, test_f1: 0.6711
 epoch: 88, train_loss: 0.6284, test_loss: 0.9908, test_f1: 0.6502
 epoch: 89, train_loss: 0.6351, test_loss: 0.9912, test_f1: 0.6575
 epoch: 90, train_loss: 0.6268, test_loss: 0.9618, test_f1: 0.6485
 epoch: 91, train_loss: 0.6208, test_loss: 0.9469, test_f1: 0.6613
 epoch: 92, train_loss: 0.6217, test_loss: 0.9734, test_f1: 0.6485
 epoch: 93, train_loss: 0.6004, test_loss: 0.9835, test_f1: 0.6346
 epoch: 94, train_loss: 0.6152, test_loss: 0.9790, test_f1: 0.6647
 epoch: 95, train_loss: 0.6061, test_loss: 1.0008, test_f1: 0.6400
 epoch: 96, train_loss: 0.6120, test_loss: 0.9782, test_f1: 0.6668
 epoch: 97, train_loss: 0.6107, test_loss: 0.9868, test_f1: 0.6523
 epoch: 98, train_loss: 0.6072, test_loss: 0.9893, test_f1: 0.6401
 epoch: 99, train_loss: 0.6062, test_loss: 0.9717, test_f1: 0.6682
##################ITERATION #8 ****************************************
 epoch: 0, train_loss: 1.2639, test_loss: 1.0540, test_f1: 0.4605
 epoch: 1, train_loss: 1.1245, test_loss: 1.0155, test_f1: 0.4783
 epoch: 2, train_loss: 1.0739, test_loss: 0.9851, test_f1: 0.4927
 epoch: 3, train_loss: 1.0507, test_loss: 0.9783, test_f1: 0.5027
 epoch: 4, train_loss: 1.0221, test_loss: 0.9759, test_f1: 0.5021
 epoch: 5, train_loss: 1.0057, test_loss: 0.9648, test_f1: 0.5039
 epoch: 6, train_loss: 0.9811, test_loss: 0.9568, test_f1: 0.4931
 epoch: 7, train_loss: 0.9782, test_loss: 0.9453, test_f1: 0.5275
 epoch: 8, train_loss: 0.9511, test_loss: 0.9415, test_f1: 0.5444
 epoch: 9, train_loss: 0.9377, test_loss: 0.9288, test_f1: 0.5119
 epoch: 10, train_loss: 0.9284, test_loss: 0.9290, test_f1: 0.5389
 epoch: 11, train_loss: 0.9243, test_loss: 0.9261, test_f1: 0.5422
 epoch: 12, train_loss: 0.9174, test_loss: 0.9374, test_f1: 0.5632
 epoch: 13, train_loss: 0.8966, test_loss: 0.9225, test_f1: 0.5390
 epoch: 14, train_loss: 0.8999, test_loss: 0.9176, test_f1: 0.5494
 epoch: 15, train_loss: 0.8780, test_loss: 0.9209, test_f1: 0.5361
 epoch: 16, train_loss: 0.8819, test_loss: 0.8991, test_f1: 0.5701
 epoch: 17, train_loss: 0.8615, test_loss: 0.9227, test_f1: 0.5715
 epoch: 18, train_loss: 0.8723, test_loss: 0.8988, test_f1: 0.5648
 epoch: 19, train_loss: 0.8577, test_loss: 0.8988, test_f1: 0.5705
 epoch: 20, train_loss: 0.8446, test_loss: 0.8997, test_f1: 0.5692
 epoch: 21, train_loss: 0.8449, test_loss: 0.9014, test_f1: 0.5731
 epoch: 22, train_loss: 0.8272, test_loss: 0.8846, test_f1: 0.5771
 epoch: 23, train_loss: 0.8263, test_loss: 0.9044, test_f1: 0.5765
 epoch: 24, train_loss: 0.8321, test_loss: 0.8927, test_f1: 0.5944
 epoch: 25, train_loss: 0.8195, test_loss: 0.8935, test_f1: 0.5800
 epoch: 26, train_loss: 0.8129, test_loss: 0.8864, test_f1: 0.5820
 epoch: 27, train_loss: 0.8075, test_loss: 0.8826, test_f1: 0.5949
 epoch: 28, train_loss: 0.8047, test_loss: 0.8892, test_f1: 0.5961
 epoch: 29, train_loss: 0.8000, test_loss: 0.9144, test_f1: 0.5835
 epoch: 30, train_loss: 0.7920, test_loss: 0.8966, test_f1: 0.6103
 epoch: 31, train_loss: 0.7816, test_loss: 0.8822, test_f1: 0.5942
 epoch: 32, train_loss: 0.7913, test_loss: 0.8671, test_f1: 0.6042
 epoch: 33, train_loss: 0.7648, test_loss: 0.9071, test_f1: 0.5701
 epoch: 34, train_loss: 0.7666, test_loss: 0.8999, test_f1: 0.6303
 epoch: 35, train_loss: 0.7696, test_loss: 0.8942, test_f1: 0.5649
 epoch: 36, train_loss: 0.7578, test_loss: 0.9016, test_f1: 0.6226
 epoch: 37, train_loss: 0.7589, test_loss: 0.8745, test_f1: 0.5802
 epoch: 38, train_loss: 0.7558, test_loss: 0.9177, test_f1: 0.6137
 epoch: 39, train_loss: 0.7418, test_loss: 0.9192, test_f1: 0.5934
 epoch: 40, train_loss: 0.7394, test_loss: 0.8976, test_f1: 0.5955
 epoch: 41, train_loss: 0.7575, test_loss: 0.9142, test_f1: 0.6161
 epoch: 42, train_loss: 0.7391, test_loss: 0.9151, test_f1: 0.6063
 epoch: 43, train_loss: 0.7217, test_loss: 0.9225, test_f1: 0.6132
 epoch: 44, train_loss: 0.7209, test_loss: 0.9057, test_f1: 0.5938
 epoch: 45, train_loss: 0.7227, test_loss: 0.9141, test_f1: 0.5835
 epoch: 46, train_loss: 0.7176, test_loss: 0.9132, test_f1: 0.6170
 epoch: 47, train_loss: 0.7143, test_loss: 0.9286, test_f1: 0.5809
 epoch: 48, train_loss: 0.7103, test_loss: 0.9385, test_f1: 0.6228
 epoch: 49, train_loss: 0.7186, test_loss: 0.9584, test_f1: 0.6050
 epoch: 50, train_loss: 0.7077, test_loss: 0.9205, test_f1: 0.6037
 epoch: 51, train_loss: 0.7001, test_loss: 0.9234, test_f1: 0.6058
 epoch: 52, train_loss: 0.6903, test_loss: 0.9357, test_f1: 0.5925
 epoch: 53, train_loss: 0.6913, test_loss: 0.9288, test_f1: 0.5910
 epoch: 54, train_loss: 0.6860, test_loss: 0.9400, test_f1: 0.6072
 epoch: 55, train_loss: 0.6849, test_loss: 0.9220, test_f1: 0.6153
 epoch: 56, train_loss: 0.6847, test_loss: 0.9359, test_f1: 0.6169
 epoch: 57, train_loss: 0.6753, test_loss: 0.9377, test_f1: 0.6085
 epoch: 58, train_loss: 0.6627, test_loss: 0.9347, test_f1: 0.6258
 epoch: 59, train_loss: 0.6728, test_loss: 0.9358, test_f1: 0.6196
 epoch: 60, train_loss: 0.6705, test_loss: 0.9508, test_f1: 0.5909
 epoch: 61, train_loss: 0.6747, test_loss: 0.9311, test_f1: 0.6012
 epoch: 62, train_loss: 0.6598, test_loss: 0.9386, test_f1: 0.5949
 epoch: 63, train_loss: 0.6660, test_loss: 0.9519, test_f1: 0.6167
 epoch: 64, train_loss: 0.6620, test_loss: 0.9397, test_f1: 0.6042
 epoch: 65, train_loss: 0.6503, test_loss: 0.9429, test_f1: 0.6325
 epoch: 66, train_loss: 0.6647, test_loss: 0.9374, test_f1: 0.6270
 epoch: 67, train_loss: 0.6613, test_loss: 0.9423, test_f1: 0.6335
 epoch: 68, train_loss: 0.6556, test_loss: 0.9524, test_f1: 0.6177
 epoch: 69, train_loss: 0.6595, test_loss: 0.9504, test_f1: 0.6452
 epoch: 70, train_loss: 0.6521, test_loss: 0.9366, test_f1: 0.6278
 epoch: 71, train_loss: 0.6428, test_loss: 0.9392, test_f1: 0.6222
 epoch: 72, train_loss: 0.6537, test_loss: 0.9412, test_f1: 0.6471
 epoch: 73, train_loss: 0.6464, test_loss: 0.9629, test_f1: 0.6132
 epoch: 74, train_loss: 0.6402, test_loss: 0.9479, test_f1: 0.6316
 epoch: 75, train_loss: 0.6584, test_loss: 0.9814, test_f1: 0.6111
 epoch: 76, train_loss: 0.6368, test_loss: 0.9714, test_f1: 0.6151
 epoch: 77, train_loss: 0.6318, test_loss: 0.9397, test_f1: 0.6356
 epoch: 78, train_loss: 0.6363, test_loss: 0.9577, test_f1: 0.6326
 epoch: 79, train_loss: 0.6300, test_loss: 0.9672, test_f1: 0.6348
 epoch: 80, train_loss: 0.6252, test_loss: 0.9544, test_f1: 0.6177
 epoch: 81, train_loss: 0.6386, test_loss: 0.9787, test_f1: 0.6321
 epoch: 82, train_loss: 0.6265, test_loss: 0.9689, test_f1: 0.6274
 epoch: 83, train_loss: 0.6409, test_loss: 0.9578, test_f1: 0.6385
 epoch: 84, train_loss: 0.6260, test_loss: 0.9659, test_f1: 0.6177
 epoch: 85, train_loss: 0.6310, test_loss: 0.9557, test_f1: 0.6311
 epoch: 86, train_loss: 0.6193, test_loss: 0.9686, test_f1: 0.6324
 epoch: 87, train_loss: 0.6203, test_loss: 0.9607, test_f1: 0.6433
 epoch: 88, train_loss: 0.6149, test_loss: 0.9737, test_f1: 0.6514
 epoch: 89, train_loss: 0.6157, test_loss: 0.9788, test_f1: 0.6493
 epoch: 90, train_loss: 0.6071, test_loss: 0.9707, test_f1: 0.6445
 epoch: 91, train_loss: 0.6004, test_loss: 0.9771, test_f1: 0.6418
 epoch: 92, train_loss: 0.6227, test_loss: 0.9795, test_f1: 0.6471
 epoch: 93, train_loss: 0.6094, test_loss: 0.9733, test_f1: 0.6646
 epoch: 94, train_loss: 0.6180, test_loss: 0.9634, test_f1: 0.6417
 epoch: 95, train_loss: 0.6089, test_loss: 0.9757, test_f1: 0.6382
 epoch: 96, train_loss: 0.5963, test_loss: 0.9814, test_f1: 0.6546
 epoch: 97, train_loss: 0.6136, test_loss: 1.0012, test_f1: 0.6395
 epoch: 98, train_loss: 0.5975, test_loss: 1.0345, test_f1: 0.6259
 epoch: 99, train_loss: 0.6009, test_loss: 0.9988, test_f1: 0.6574
##################ITERATION #9 ****************************************
 epoch: 0, train_loss: 1.3171, test_loss: 1.0768, test_f1: 0.4205
 epoch: 1, train_loss: 1.1206, test_loss: 0.9821, test_f1: 0.4690
 epoch: 2, train_loss: 1.0826, test_loss: 0.9849, test_f1: 0.4702
 epoch: 3, train_loss: 1.0402, test_loss: 0.9560, test_f1: 0.5074
 epoch: 4, train_loss: 1.0139, test_loss: 0.9506, test_f1: 0.4983
 epoch: 5, train_loss: 0.9896, test_loss: 0.9399, test_f1: 0.5196
 epoch: 6, train_loss: 0.9781, test_loss: 0.9294, test_f1: 0.5189
 epoch: 7, train_loss: 0.9598, test_loss: 0.9212, test_f1: 0.5217
 epoch: 8, train_loss: 0.9511, test_loss: 0.9252, test_f1: 0.5212
 epoch: 9, train_loss: 0.9402, test_loss: 0.9307, test_f1: 0.5234
 epoch: 10, train_loss: 0.9251, test_loss: 0.9222, test_f1: 0.5275
 epoch: 11, train_loss: 0.9212, test_loss: 0.9168, test_f1: 0.5379
 epoch: 12, train_loss: 0.9199, test_loss: 0.8990, test_f1: 0.5374
 epoch: 13, train_loss: 0.9141, test_loss: 0.9052, test_f1: 0.5413
 epoch: 14, train_loss: 0.8898, test_loss: 0.8994, test_f1: 0.5455
 epoch: 15, train_loss: 0.8861, test_loss: 0.8942, test_f1: 0.5462
 epoch: 16, train_loss: 0.8772, test_loss: 0.8974, test_f1: 0.5569
 epoch: 17, train_loss: 0.8662, test_loss: 0.9257, test_f1: 0.5441
 epoch: 18, train_loss: 0.8643, test_loss: 0.9069, test_f1: 0.5435
 epoch: 19, train_loss: 0.8540, test_loss: 0.8816, test_f1: 0.5658
 epoch: 20, train_loss: 0.8416, test_loss: 0.8705, test_f1: 0.5534
 epoch: 21, train_loss: 0.8349, test_loss: 0.8881, test_f1: 0.5561
 epoch: 22, train_loss: 0.8290, test_loss: 0.8920, test_f1: 0.5422
 epoch: 23, train_loss: 0.8283, test_loss: 0.8775, test_f1: 0.5623
 epoch: 24, train_loss: 0.8272, test_loss: 0.8669, test_f1: 0.5743
 epoch: 25, train_loss: 0.8175, test_loss: 0.9166, test_f1: 0.5491
 epoch: 26, train_loss: 0.8216, test_loss: 0.9073, test_f1: 0.5732
 epoch: 27, train_loss: 0.8039, test_loss: 0.8866, test_f1: 0.5753
 epoch: 28, train_loss: 0.8150, test_loss: 0.8818, test_f1: 0.5777
 epoch: 29, train_loss: 0.7926, test_loss: 0.8726, test_f1: 0.5679
 epoch: 30, train_loss: 0.7977, test_loss: 0.8746, test_f1: 0.5904
 epoch: 31, train_loss: 0.7829, test_loss: 0.9043, test_f1: 0.6018
 epoch: 32, train_loss: 0.7843, test_loss: 0.9140, test_f1: 0.5717
 epoch: 33, train_loss: 0.7835, test_loss: 0.8717, test_f1: 0.5691
 epoch: 34, train_loss: 0.7708, test_loss: 0.8497, test_f1: 0.5836
 epoch: 35, train_loss: 0.7683, test_loss: 0.8897, test_f1: 0.5834
 epoch: 36, train_loss: 0.7697, test_loss: 0.9026, test_f1: 0.5741
 epoch: 37, train_loss: 0.7684, test_loss: 0.8901, test_f1: 0.5873
 epoch: 38, train_loss: 0.7558, test_loss: 0.8907, test_f1: 0.5744
 epoch: 39, train_loss: 0.7556, test_loss: 0.8623, test_f1: 0.5882
 epoch: 40, train_loss: 0.7476, test_loss: 0.8835, test_f1: 0.5865
 epoch: 41, train_loss: 0.7377, test_loss: 0.9027, test_f1: 0.5783
 epoch: 42, train_loss: 0.7469, test_loss: 0.9047, test_f1: 0.5955
 epoch: 43, train_loss: 0.7362, test_loss: 0.9147, test_f1: 0.5920
 epoch: 44, train_loss: 0.7285, test_loss: 0.8828, test_f1: 0.5966
 epoch: 45, train_loss: 0.7347, test_loss: 0.8965, test_f1: 0.6206
 epoch: 46, train_loss: 0.7221, test_loss: 0.8689, test_f1: 0.6135
 epoch: 47, train_loss: 0.7189, test_loss: 0.9215, test_f1: 0.5962
 epoch: 48, train_loss: 0.7214, test_loss: 0.8955, test_f1: 0.5986
 epoch: 49, train_loss: 0.7111, test_loss: 0.9073, test_f1: 0.5998
 epoch: 50, train_loss: 0.7221, test_loss: 0.8989, test_f1: 0.6255
 epoch: 51, train_loss: 0.7151, test_loss: 0.8987, test_f1: 0.6142
 epoch: 52, train_loss: 0.7030, test_loss: 0.9076, test_f1: 0.6032
 epoch: 53, train_loss: 0.6944, test_loss: 0.8924, test_f1: 0.6065
 epoch: 54, train_loss: 0.6892, test_loss: 0.8981, test_f1: 0.6138
 epoch: 55, train_loss: 0.6955, test_loss: 0.9012, test_f1: 0.6186
 epoch: 56, train_loss: 0.6915, test_loss: 0.9009, test_f1: 0.6107
 epoch: 57, train_loss: 0.6928, test_loss: 0.9079, test_f1: 0.6181
 epoch: 58, train_loss: 0.6829, test_loss: 0.8986, test_f1: 0.6129
 epoch: 59, train_loss: 0.6746, test_loss: 0.9093, test_f1: 0.6139
 epoch: 60, train_loss: 0.6847, test_loss: 0.8996, test_f1: 0.6188
 epoch: 61, train_loss: 0.6820, test_loss: 0.9120, test_f1: 0.6233
 epoch: 62, train_loss: 0.6720, test_loss: 0.9141, test_f1: 0.6336
 epoch: 63, train_loss: 0.6947, test_loss: 0.9031, test_f1: 0.6161
 epoch: 64, train_loss: 0.6743, test_loss: 0.9022, test_f1: 0.6246
 epoch: 65, train_loss: 0.6860, test_loss: 0.9220, test_f1: 0.6232
 epoch: 66, train_loss: 0.6708, test_loss: 0.9088, test_f1: 0.6272
 epoch: 67, train_loss: 0.6690, test_loss: 0.8980, test_f1: 0.6308
 epoch: 68, train_loss: 0.6733, test_loss: 0.9176, test_f1: 0.6255
 epoch: 69, train_loss: 0.6748, test_loss: 0.9039, test_f1: 0.6313
 epoch: 70, train_loss: 0.6609, test_loss: 0.9150, test_f1: 0.6019
 epoch: 71, train_loss: 0.6589, test_loss: 0.8933, test_f1: 0.6213
 epoch: 72, train_loss: 0.6575, test_loss: 0.9226, test_f1: 0.6194
 epoch: 73, train_loss: 0.6590, test_loss: 0.9301, test_f1: 0.6321
 epoch: 74, train_loss: 0.6536, test_loss: 0.9196, test_f1: 0.6304
 epoch: 75, train_loss: 0.6552, test_loss: 0.9153, test_f1: 0.6154
 epoch: 76, train_loss: 0.6452, test_loss: 0.9317, test_f1: 0.6309
 epoch: 77, train_loss: 0.6538, test_loss: 0.9246, test_f1: 0.6135
 epoch: 78, train_loss: 0.6455, test_loss: 0.9206, test_f1: 0.6208
 epoch: 79, train_loss: 0.6477, test_loss: 0.9232, test_f1: 0.6114
 epoch: 80, train_loss: 0.6477, test_loss: 0.9092, test_f1: 0.6145
 epoch: 81, train_loss: 0.6476, test_loss: 0.9267, test_f1: 0.6135
 epoch: 82, train_loss: 0.6520, test_loss: 0.9405, test_f1: 0.6268
 epoch: 83, train_loss: 0.6465, test_loss: 0.9378, test_f1: 0.6176
 epoch: 84, train_loss: 0.6393, test_loss: 0.9404, test_f1: 0.6131
 epoch: 85, train_loss: 0.6367, test_loss: 0.9359, test_f1: 0.6206
 epoch: 86, train_loss: 0.6411, test_loss: 0.9230, test_f1: 0.6289
 epoch: 87, train_loss: 0.6442, test_loss: 0.9291, test_f1: 0.6398
 epoch: 88, train_loss: 0.6305, test_loss: 0.9261, test_f1: 0.6171
 epoch: 89, train_loss: 0.6293, test_loss: 0.9241, test_f1: 0.6279
 epoch: 90, train_loss: 0.6277, test_loss: 0.9385, test_f1: 0.6248
 epoch: 91, train_loss: 0.6259, test_loss: 0.9390, test_f1: 0.6242
 epoch: 92, train_loss: 0.6215, test_loss: 0.9432, test_f1: 0.6139
 epoch: 93, train_loss: 0.6243, test_loss: 0.9436, test_f1: 0.6231
 epoch: 94, train_loss: 0.6280, test_loss: 0.9495, test_f1: 0.6137
 epoch: 95, train_loss: 0.6256, test_loss: 0.9401, test_f1: 0.6425
 epoch: 96, train_loss: 0.6200, test_loss: 0.9406, test_f1: 0.6332
 epoch: 97, train_loss: 0.6194, test_loss: 0.9370, test_f1: 0.6325
 epoch: 98, train_loss: 0.6101, test_loss: 0.9479, test_f1: 0.6425
 epoch: 99, train_loss: 0.6149, test_loss: 0.9552, test_f1: 0.6321

Training completed in 560.35 seconds
Best F1: 0.6711 at epoch 87
Mean F1 across iterations: 0.6542  0.0103
========================FINAL RESULTS================================
FEGIN weighted F1: 0.6711  0.0103
python main.py --data ltspice_examples --representation component_net --model FEGIN --layers 2 --hiddens 128 --batch_size 64 --lr 0.0001 --emb_size 128 --epochs 100 --save_appendix component_net_L2_H128_BS64_LR0.0001_E128 --no_val
-----



STDERR:
  File "main.py", line 370, in <module>
    main()
  File "main.py", line 254, in main
    dataset = dataset_class(
  File "/home/philip/projects/ltspice_examples_code_repo/Circuit-Completion-Using-GNNs/component_classification_with_link_prediction_head/evaluation/FEGIN/kernel/circuit_datasets.py", line 15, in __init__
    self.data, self.slices = torch.load(self.processed_paths[0])
  File "/home/philip/.local/lib/python3.8/site-packages/torch/serialization.py", line 1040, in load
    warnings.warn(
  File "/usr/lib/python3.8/warnings.py", line 109, in _showwarnmsg
    sw(msg.message, msg.category, msg.filename, msg.lineno,
  File "main.py", line 47, in warn_with_traceback
    traceback.print_stack(file=log)
/home/philip/projects/ltspice_examples_code_repo/Circuit-Completion-Using-GNNs/component_classification_with_link_prediction_head/evaluation/FEGIN/kernel/circuit_datasets.py:15: FutureWarning: You are using `torch.load` with `weights_only=False` (the current default value), which uses the default pickle module implicitly. It is possible to construct malicious pickle data which will execute arbitrary code during unpickling (See https://github.com/pytorch/pytorch/blob/main/SECURITY.md#untrusted-models for more details). In a future release, the default value for `weights_only` will be flipped to `True`. This limits the functions that could be executed during unpickling. Arbitrary objects will no longer be allowed to be loaded via this mode unless they are explicitly allowlisted by the user via `torch.serialization.add_safe_globals`. We recommend you start setting `weights_only=True` for any use case where you don't have full control of the loaded file. Please open an issue on GitHub for any issues related to this experimental feature.
  self.data, self.slices = torch.load(self.processed_paths[0])
