STDOUT:
Results will be saved in /home/philip/projects/ltspice_examples_code_repo/Circuit-Completion-Using-GNNs/component_classification_with_link_prediction_head/evaluation/FEGIN/results/model_FEGIN_dataset_ltspice_demos
Command line input: python main.py --data ltspice_demos --representation component_pin_net --model FEGIN --layers 3 --hiddens 128 --batch_size 32 --lr 0.0001 --emb_size 128 --epochs 100 --save_appendix component_pin_net_L3_H128_BS32_LR0.0001_E128 --no_val
 is saved.
-----
ltspice_demos - FEGIN
Using 3 layers, 128 hidden units, h = 2
Loading component_pin_net representation dataset
ENTERED
Training FEGIN on component_pin_net representation
Train: 1565, Test: 383
##################ITERATION #0 ****************************************
 epoch: 0, train_loss: 1.3644, test_loss: 1.3552, test_f1: 0.1425
 epoch: 1, train_loss: 1.2737, test_loss: 1.2658, test_f1: 0.3438
 epoch: 2, train_loss: 1.1895, test_loss: 1.2234, test_f1: 0.3532
 epoch: 3, train_loss: 1.1458, test_loss: 1.2051, test_f1: 0.4295
 epoch: 4, train_loss: 1.1234, test_loss: 1.1965, test_f1: 0.4326
 epoch: 5, train_loss: 1.1056, test_loss: 1.1899, test_f1: 0.4394
 epoch: 6, train_loss: 1.0868, test_loss: 1.1752, test_f1: 0.4450
 epoch: 7, train_loss: 1.0644, test_loss: 1.1666, test_f1: 0.4527
 epoch: 8, train_loss: 1.0492, test_loss: 1.1455, test_f1: 0.4501
 epoch: 9, train_loss: 1.0268, test_loss: 1.1323, test_f1: 0.4635
 epoch: 10, train_loss: 0.9978, test_loss: 1.1133, test_f1: 0.4645
 epoch: 11, train_loss: 0.9878, test_loss: 1.0935, test_f1: 0.4853
 epoch: 12, train_loss: 0.9717, test_loss: 1.0906, test_f1: 0.4820
 epoch: 13, train_loss: 0.9516, test_loss: 1.0901, test_f1: 0.4966
 epoch: 14, train_loss: 0.9438, test_loss: 1.0877, test_f1: 0.5105
 epoch: 15, train_loss: 0.9352, test_loss: 1.0696, test_f1: 0.5257
 epoch: 16, train_loss: 0.9341, test_loss: 1.0623, test_f1: 0.5516
 epoch: 17, train_loss: 0.9241, test_loss: 1.0446, test_f1: 0.5208
 epoch: 18, train_loss: 0.9069, test_loss: 1.0532, test_f1: 0.5526
 epoch: 19, train_loss: 0.8950, test_loss: 1.0596, test_f1: 0.5382
 epoch: 20, train_loss: 0.8935, test_loss: 1.0668, test_f1: 0.5355
 epoch: 21, train_loss: 0.8794, test_loss: 1.0497, test_f1: 0.5213
 epoch: 22, train_loss: 0.8829, test_loss: 1.0397, test_f1: 0.5465
 epoch: 23, train_loss: 0.8568, test_loss: 1.0092, test_f1: 0.5358
 epoch: 24, train_loss: 0.8455, test_loss: 1.0147, test_f1: 0.5229
 epoch: 25, train_loss: 0.8380, test_loss: 1.0457, test_f1: 0.5455
 epoch: 26, train_loss: 0.8364, test_loss: 1.0075, test_f1: 0.5432
 epoch: 27, train_loss: 0.8149, test_loss: 1.0241, test_f1: 0.5341
 epoch: 28, train_loss: 0.8174, test_loss: 1.0217, test_f1: 0.5576
 epoch: 29, train_loss: 0.7937, test_loss: 1.0320, test_f1: 0.5515
 epoch: 30, train_loss: 0.7838, test_loss: 1.0010, test_f1: 0.5565
 epoch: 31, train_loss: 0.7654, test_loss: 0.9860, test_f1: 0.5760
 epoch: 32, train_loss: 0.7605, test_loss: 1.0249, test_f1: 0.5788
 epoch: 33, train_loss: 0.7443, test_loss: 0.9653, test_f1: 0.5914
 epoch: 34, train_loss: 0.7325, test_loss: 1.0224, test_f1: 0.5943
 epoch: 35, train_loss: 0.7276, test_loss: 0.9944, test_f1: 0.5536
 epoch: 36, train_loss: 0.7038, test_loss: 0.9953, test_f1: 0.5902
 epoch: 37, train_loss: 0.6850, test_loss: 1.0722, test_f1: 0.5974
 epoch: 38, train_loss: 0.6785, test_loss: 1.0370, test_f1: 0.5848
 epoch: 39, train_loss: 0.6787, test_loss: 1.0012, test_f1: 0.5932
 epoch: 40, train_loss: 0.6656, test_loss: 1.0011, test_f1: 0.5922
 epoch: 41, train_loss: 0.6713, test_loss: 1.0552, test_f1: 0.6285
 epoch: 42, train_loss: 0.6299, test_loss: 1.0287, test_f1: 0.5966
 epoch: 43, train_loss: 0.6356, test_loss: 1.0452, test_f1: 0.6228
 epoch: 44, train_loss: 0.6279, test_loss: 1.0668, test_f1: 0.6109
 epoch: 45, train_loss: 0.6204, test_loss: 1.0178, test_f1: 0.6326
 epoch: 46, train_loss: 0.6049, test_loss: 1.0941, test_f1: 0.5882
 epoch: 47, train_loss: 0.6013, test_loss: 1.0595, test_f1: 0.6178
 epoch: 48, train_loss: 0.5842, test_loss: 1.1142, test_f1: 0.6377
 epoch: 49, train_loss: 0.5825, test_loss: 1.0557, test_f1: 0.6416
 epoch: 50, train_loss: 0.5788, test_loss: 1.0940, test_f1: 0.6189
 epoch: 51, train_loss: 0.5534, test_loss: 1.0543, test_f1: 0.6390
 epoch: 52, train_loss: 0.5347, test_loss: 1.0366, test_f1: 0.6524
 epoch: 53, train_loss: 0.5421, test_loss: 1.0428, test_f1: 0.6368
 epoch: 54, train_loss: 0.5330, test_loss: 1.0454, test_f1: 0.6490
 epoch: 55, train_loss: 0.5129, test_loss: 1.0690, test_f1: 0.6294
 epoch: 56, train_loss: 0.5237, test_loss: 1.0626, test_f1: 0.6248
 epoch: 57, train_loss: 0.5144, test_loss: 1.0557, test_f1: 0.6316
 epoch: 58, train_loss: 0.4979, test_loss: 1.0678, test_f1: 0.6443
 epoch: 59, train_loss: 0.5014, test_loss: 1.0980, test_f1: 0.6390
 epoch: 60, train_loss: 0.4982, test_loss: 1.0963, test_f1: 0.6271
 epoch: 61, train_loss: 0.4959, test_loss: 1.0955, test_f1: 0.6379
 epoch: 62, train_loss: 0.4937, test_loss: 1.1095, test_f1: 0.6459
 epoch: 63, train_loss: 0.4810, test_loss: 1.1009, test_f1: 0.6293
 epoch: 64, train_loss: 0.4775, test_loss: 1.1561, test_f1: 0.6285
 epoch: 65, train_loss: 0.4729, test_loss: 1.1096, test_f1: 0.6423
 epoch: 66, train_loss: 0.4778, test_loss: 1.1046, test_f1: 0.6533
 epoch: 67, train_loss: 0.4706, test_loss: 1.1653, test_f1: 0.6153
 epoch: 68, train_loss: 0.4621, test_loss: 1.1526, test_f1: 0.6278
 epoch: 69, train_loss: 0.4659, test_loss: 1.1780, test_f1: 0.6437
 epoch: 70, train_loss: 0.4519, test_loss: 1.1653, test_f1: 0.6445
 epoch: 71, train_loss: 0.4473, test_loss: 1.1630, test_f1: 0.6194
 epoch: 72, train_loss: 0.4433, test_loss: 1.1859, test_f1: 0.6361
 epoch: 73, train_loss: 0.4415, test_loss: 1.2056, test_f1: 0.6329
 epoch: 74, train_loss: 0.4399, test_loss: 1.2348, test_f1: 0.6231
 epoch: 75, train_loss: 0.4299, test_loss: 1.1864, test_f1: 0.6338
 epoch: 76, train_loss: 0.4426, test_loss: 1.2203, test_f1: 0.6380
 epoch: 77, train_loss: 0.4546, test_loss: 1.3243, test_f1: 0.6268
 epoch: 78, train_loss: 0.4189, test_loss: 1.2329, test_f1: 0.6418
 epoch: 79, train_loss: 0.4176, test_loss: 1.2714, test_f1: 0.6363
 epoch: 80, train_loss: 0.4090, test_loss: 1.2764, test_f1: 0.6322
 epoch: 81, train_loss: 0.4115, test_loss: 1.3177, test_f1: 0.6556
 epoch: 82, train_loss: 0.4162, test_loss: 1.2583, test_f1: 0.6412
 epoch: 83, train_loss: 0.3924, test_loss: 1.2998, test_f1: 0.6307
 epoch: 84, train_loss: 0.4032, test_loss: 1.3253, test_f1: 0.6166
 epoch: 85, train_loss: 0.4026, test_loss: 1.3359, test_f1: 0.6255
 epoch: 86, train_loss: 0.3956, test_loss: 1.3283, test_f1: 0.6239
 epoch: 87, train_loss: 0.4129, test_loss: 1.3148, test_f1: 0.6370
 epoch: 88, train_loss: 0.3938, test_loss: 1.3307, test_f1: 0.6299
 epoch: 89, train_loss: 0.3846, test_loss: 1.3530, test_f1: 0.6182
 epoch: 90, train_loss: 0.3756, test_loss: 1.3622, test_f1: 0.6344
 epoch: 91, train_loss: 0.3631, test_loss: 1.4193, test_f1: 0.6195
 epoch: 92, train_loss: 0.3639, test_loss: 1.3407, test_f1: 0.6293
 epoch: 93, train_loss: 0.3563, test_loss: 1.3661, test_f1: 0.6273
 epoch: 94, train_loss: 0.3642, test_loss: 1.3863, test_f1: 0.6250
 epoch: 95, train_loss: 0.3514, test_loss: 1.4001, test_f1: 0.6303
 epoch: 96, train_loss: 0.3802, test_loss: 1.4434, test_f1: 0.6178
 epoch: 97, train_loss: 0.3570, test_loss: 1.5079, test_f1: 0.5980
 epoch: 98, train_loss: 0.3635, test_loss: 1.4696, test_f1: 0.5931
 epoch: 99, train_loss: 0.3310, test_loss: 1.4848, test_f1: 0.6157
##################ITERATION #1 ****************************************
 epoch: 0, train_loss: 1.2482, test_loss: 1.2719, test_f1: 0.2971
 epoch: 1, train_loss: 1.1167, test_loss: 1.1555, test_f1: 0.4501
 epoch: 2, train_loss: 1.0603, test_loss: 1.1069, test_f1: 0.4780
 epoch: 3, train_loss: 1.0245, test_loss: 1.0861, test_f1: 0.5094
 epoch: 4, train_loss: 0.9979, test_loss: 1.0654, test_f1: 0.5199
 epoch: 5, train_loss: 0.9794, test_loss: 1.0498, test_f1: 0.5250
 epoch: 6, train_loss: 0.9564, test_loss: 1.0435, test_f1: 0.5391
 epoch: 7, train_loss: 0.9435, test_loss: 1.0321, test_f1: 0.5724
 epoch: 8, train_loss: 0.9310, test_loss: 1.0235, test_f1: 0.5631
 epoch: 9, train_loss: 0.9210, test_loss: 1.0096, test_f1: 0.5679
 epoch: 10, train_loss: 0.9064, test_loss: 1.0058, test_f1: 0.5581
 epoch: 11, train_loss: 0.8960, test_loss: 1.0037, test_f1: 0.5647
 epoch: 12, train_loss: 0.8833, test_loss: 0.9985, test_f1: 0.5539
 epoch: 13, train_loss: 0.8553, test_loss: 1.0073, test_f1: 0.5679
 epoch: 14, train_loss: 0.8462, test_loss: 0.9998, test_f1: 0.5607
 epoch: 15, train_loss: 0.8256, test_loss: 1.0038, test_f1: 0.5757
 epoch: 16, train_loss: 0.8327, test_loss: 0.9953, test_f1: 0.5771
 epoch: 17, train_loss: 0.8134, test_loss: 0.9863, test_f1: 0.5863
 epoch: 18, train_loss: 0.8004, test_loss: 1.0102, test_f1: 0.5781
 epoch: 19, train_loss: 0.7815, test_loss: 0.9898, test_f1: 0.5989
 epoch: 20, train_loss: 0.7644, test_loss: 0.9925, test_f1: 0.5883
 epoch: 21, train_loss: 0.7830, test_loss: 0.9758, test_f1: 0.5977
 epoch: 22, train_loss: 0.7433, test_loss: 1.0040, test_f1: 0.5980
 epoch: 23, train_loss: 0.7497, test_loss: 0.9762, test_f1: 0.6198
 epoch: 24, train_loss: 0.7227, test_loss: 0.9959, test_f1: 0.6192
 epoch: 25, train_loss: 0.7102, test_loss: 0.9978, test_f1: 0.6001
 epoch: 26, train_loss: 0.7019, test_loss: 0.9912, test_f1: 0.6006
 epoch: 27, train_loss: 0.6962, test_loss: 1.0019, test_f1: 0.6253
 epoch: 28, train_loss: 0.6836, test_loss: 1.0250, test_f1: 0.6094
 epoch: 29, train_loss: 0.6845, test_loss: 1.0596, test_f1: 0.5922
 epoch: 30, train_loss: 0.6694, test_loss: 1.0150, test_f1: 0.5882
 epoch: 31, train_loss: 0.6462, test_loss: 1.0192, test_f1: 0.6295
 epoch: 32, train_loss: 0.6641, test_loss: 1.0056, test_f1: 0.6344
 epoch: 33, train_loss: 0.6503, test_loss: 1.0570, test_f1: 0.6336
 epoch: 34, train_loss: 0.6189, test_loss: 1.0526, test_f1: 0.6181
 epoch: 35, train_loss: 0.6306, test_loss: 1.0409, test_f1: 0.5940
 epoch: 36, train_loss: 0.6093, test_loss: 1.0278, test_f1: 0.6384
 epoch: 37, train_loss: 0.6111, test_loss: 1.0416, test_f1: 0.6262
 epoch: 38, train_loss: 0.5958, test_loss: 1.0122, test_f1: 0.6383
 epoch: 39, train_loss: 0.5987, test_loss: 1.0690, test_f1: 0.6170
 epoch: 40, train_loss: 0.5909, test_loss: 1.0787, test_f1: 0.6364
 epoch: 41, train_loss: 0.5789, test_loss: 1.1085, test_f1: 0.6156
 epoch: 42, train_loss: 0.5967, test_loss: 1.0691, test_f1: 0.6155
 epoch: 43, train_loss: 0.5612, test_loss: 1.0632, test_f1: 0.6259
 epoch: 44, train_loss: 0.5595, test_loss: 1.0552, test_f1: 0.6567
 epoch: 45, train_loss: 0.5687, test_loss: 1.0717, test_f1: 0.6391
 epoch: 46, train_loss: 0.5670, test_loss: 1.0872, test_f1: 0.6203
 epoch: 47, train_loss: 0.5398, test_loss: 1.0654, test_f1: 0.6358
 epoch: 48, train_loss: 0.5401, test_loss: 1.0991, test_f1: 0.6399
 epoch: 49, train_loss: 0.5208, test_loss: 1.1051, test_f1: 0.6428
 epoch: 50, train_loss: 0.5212, test_loss: 1.1449, test_f1: 0.6224
 epoch: 51, train_loss: 0.4925, test_loss: 1.1313, test_f1: 0.6456
 epoch: 52, train_loss: 0.4894, test_loss: 1.1185, test_f1: 0.6374
 epoch: 53, train_loss: 0.4814, test_loss: 1.1242, test_f1: 0.6240
 epoch: 54, train_loss: 0.4782, test_loss: 1.1492, test_f1: 0.6445
 epoch: 55, train_loss: 0.4796, test_loss: 1.1532, test_f1: 0.6347
 epoch: 56, train_loss: 0.4651, test_loss: 1.1566, test_f1: 0.6479
 epoch: 57, train_loss: 0.4734, test_loss: 1.1358, test_f1: 0.6395
 epoch: 58, train_loss: 0.4619, test_loss: 1.1801, test_f1: 0.6506
 epoch: 59, train_loss: 0.4718, test_loss: 1.1601, test_f1: 0.6518
 epoch: 60, train_loss: 0.4677, test_loss: 1.1633, test_f1: 0.6579
 epoch: 61, train_loss: 0.4504, test_loss: 1.1698, test_f1: 0.6473
 epoch: 62, train_loss: 0.4523, test_loss: 1.1683, test_f1: 0.6534
 epoch: 63, train_loss: 0.4425, test_loss: 1.1959, test_f1: 0.6397
 epoch: 64, train_loss: 0.4390, test_loss: 1.2026, test_f1: 0.6536
 epoch: 65, train_loss: 0.4274, test_loss: 1.2326, test_f1: 0.6308
 epoch: 66, train_loss: 0.4327, test_loss: 1.2083, test_f1: 0.6495
 epoch: 67, train_loss: 0.4401, test_loss: 1.2079, test_f1: 0.6529
 epoch: 68, train_loss: 0.4368, test_loss: 1.1934, test_f1: 0.6476
 epoch: 69, train_loss: 0.4266, test_loss: 1.2441, test_f1: 0.6627
 epoch: 70, train_loss: 0.4022, test_loss: 1.2298, test_f1: 0.6568
 epoch: 71, train_loss: 0.4260, test_loss: 1.2331, test_f1: 0.6321
 epoch: 72, train_loss: 0.4285, test_loss: 1.2328, test_f1: 0.6468
 epoch: 73, train_loss: 0.3990, test_loss: 1.2491, test_f1: 0.6502
 epoch: 74, train_loss: 0.4114, test_loss: 1.2729, test_f1: 0.6346
 epoch: 75, train_loss: 0.4120, test_loss: 1.2538, test_f1: 0.6347
 epoch: 76, train_loss: 0.4261, test_loss: 1.2811, test_f1: 0.6358
 epoch: 77, train_loss: 0.3838, test_loss: 1.2959, test_f1: 0.6472
 epoch: 78, train_loss: 0.3992, test_loss: 1.2905, test_f1: 0.6541
 epoch: 79, train_loss: 0.4003, test_loss: 1.3213, test_f1: 0.6341
 epoch: 80, train_loss: 0.3979, test_loss: 1.2645, test_f1: 0.6411
 epoch: 81, train_loss: 0.3760, test_loss: 1.2905, test_f1: 0.6610
 epoch: 82, train_loss: 0.3833, test_loss: 1.3211, test_f1: 0.6495
 epoch: 83, train_loss: 0.3969, test_loss: 1.3012, test_f1: 0.6455
 epoch: 84, train_loss: 0.3873, test_loss: 1.3243, test_f1: 0.6163
 epoch: 85, train_loss: 0.3794, test_loss: 1.3502, test_f1: 0.6412
 epoch: 86, train_loss: 0.3668, test_loss: 1.3280, test_f1: 0.6376
 epoch: 87, train_loss: 0.3669, test_loss: 1.3530, test_f1: 0.6559
 epoch: 88, train_loss: 0.3617, test_loss: 1.3634, test_f1: 0.6247
 epoch: 89, train_loss: 0.3466, test_loss: 1.3412, test_f1: 0.6643
 epoch: 90, train_loss: 0.3745, test_loss: 1.3524, test_f1: 0.6452
 epoch: 91, train_loss: 0.3454, test_loss: 1.4082, test_f1: 0.6364
 epoch: 92, train_loss: 0.3623, test_loss: 1.3609, test_f1: 0.6571
 epoch: 93, train_loss: 0.3430, test_loss: 1.3651, test_f1: 0.6466
 epoch: 94, train_loss: 0.3585, test_loss: 1.3617, test_f1: 0.6551
 epoch: 95, train_loss: 0.3574, test_loss: 1.3794, test_f1: 0.6576
 epoch: 96, train_loss: 0.3324, test_loss: 1.3760, test_f1: 0.6266
 epoch: 97, train_loss: 0.3423, test_loss: 1.4023, test_f1: 0.6343
 epoch: 98, train_loss: 0.3339, test_loss: 1.3992, test_f1: 0.6193
 epoch: 99, train_loss: 0.3179, test_loss: 1.3587, test_f1: 0.6399
##################ITERATION #2 ****************************************
 epoch: 0, train_loss: 1.1828, test_loss: 1.2681, test_f1: 0.3168
 epoch: 1, train_loss: 1.0545, test_loss: 1.0946, test_f1: 0.4725
 epoch: 2, train_loss: 1.0199, test_loss: 1.0653, test_f1: 0.5153
 epoch: 3, train_loss: 0.9961, test_loss: 1.0516, test_f1: 0.5199
 epoch: 4, train_loss: 0.9736, test_loss: 1.0362, test_f1: 0.5092
 epoch: 5, train_loss: 0.9555, test_loss: 1.0335, test_f1: 0.5417
 epoch: 6, train_loss: 0.9326, test_loss: 1.0217, test_f1: 0.5151
 epoch: 7, train_loss: 0.9206, test_loss: 1.0202, test_f1: 0.5178
 epoch: 8, train_loss: 0.8970, test_loss: 1.0219, test_f1: 0.5391
 epoch: 9, train_loss: 0.9046, test_loss: 1.0018, test_f1: 0.5484
 epoch: 10, train_loss: 0.8797, test_loss: 1.0069, test_f1: 0.5466
 epoch: 11, train_loss: 0.8622, test_loss: 1.0105, test_f1: 0.5425
 epoch: 12, train_loss: 0.8584, test_loss: 0.9979, test_f1: 0.5582
 epoch: 13, train_loss: 0.8457, test_loss: 1.0033, test_f1: 0.5710
 epoch: 14, train_loss: 0.8258, test_loss: 1.0049, test_f1: 0.5694
 epoch: 15, train_loss: 0.8235, test_loss: 0.9999, test_f1: 0.5688
 epoch: 16, train_loss: 0.7984, test_loss: 1.0116, test_f1: 0.5717
 epoch: 17, train_loss: 0.7953, test_loss: 1.0342, test_f1: 0.5604
 epoch: 18, train_loss: 0.7833, test_loss: 1.0207, test_f1: 0.5833
 epoch: 19, train_loss: 0.7673, test_loss: 1.0434, test_f1: 0.5719
 epoch: 20, train_loss: 0.7506, test_loss: 1.0339, test_f1: 0.5798
 epoch: 21, train_loss: 0.7495, test_loss: 1.0381, test_f1: 0.5741
 epoch: 22, train_loss: 0.7391, test_loss: 1.0173, test_f1: 0.5862
 epoch: 23, train_loss: 0.7271, test_loss: 1.0410, test_f1: 0.5981
 epoch: 24, train_loss: 0.7034, test_loss: 1.0664, test_f1: 0.5622
 epoch: 25, train_loss: 0.6861, test_loss: 1.0705, test_f1: 0.5945
 epoch: 26, train_loss: 0.6851, test_loss: 1.0854, test_f1: 0.6028
 epoch: 27, train_loss: 0.6674, test_loss: 1.0667, test_f1: 0.5969
 epoch: 28, train_loss: 0.6722, test_loss: 1.0712, test_f1: 0.6099
 epoch: 29, train_loss: 0.6740, test_loss: 1.0817, test_f1: 0.6073
 epoch: 30, train_loss: 0.6531, test_loss: 1.0720, test_f1: 0.6028
 epoch: 31, train_loss: 0.6268, test_loss: 1.0625, test_f1: 0.6347
 epoch: 32, train_loss: 0.6059, test_loss: 1.0890, test_f1: 0.5964
 epoch: 33, train_loss: 0.6177, test_loss: 1.0751, test_f1: 0.6112
 epoch: 34, train_loss: 0.5990, test_loss: 1.1027, test_f1: 0.6168
 epoch: 35, train_loss: 0.5946, test_loss: 1.1365, test_f1: 0.6013
 epoch: 36, train_loss: 0.5995, test_loss: 1.1219, test_f1: 0.6113
 epoch: 37, train_loss: 0.5821, test_loss: 1.0895, test_f1: 0.6066
 epoch: 38, train_loss: 0.5670, test_loss: 1.1117, test_f1: 0.6247
 epoch: 39, train_loss: 0.5498, test_loss: 1.1899, test_f1: 0.5953
 epoch: 40, train_loss: 0.5538, test_loss: 1.1672, test_f1: 0.6103
 epoch: 41, train_loss: 0.5570, test_loss: 1.2073, test_f1: 0.5961
 epoch: 42, train_loss: 0.5474, test_loss: 1.2012, test_f1: 0.6206
 epoch: 43, train_loss: 0.5132, test_loss: 1.1847, test_f1: 0.6072
 epoch: 44, train_loss: 0.5217, test_loss: 1.1544, test_f1: 0.6025
 epoch: 45, train_loss: 0.5000, test_loss: 1.2104, test_f1: 0.6124
 epoch: 46, train_loss: 0.5018, test_loss: 1.2623, test_f1: 0.6149
 epoch: 47, train_loss: 0.4967, test_loss: 1.2539, test_f1: 0.6327
 epoch: 48, train_loss: 0.4695, test_loss: 1.2758, test_f1: 0.6175
 epoch: 49, train_loss: 0.4822, test_loss: 1.2915, test_f1: 0.5966
 epoch: 50, train_loss: 0.4807, test_loss: 1.3060, test_f1: 0.6269
 epoch: 51, train_loss: 0.4611, test_loss: 1.3534, test_f1: 0.6027
 epoch: 52, train_loss: 0.4462, test_loss: 1.3378, test_f1: 0.6253
 epoch: 53, train_loss: 0.4437, test_loss: 1.3060, test_f1: 0.6144
 epoch: 54, train_loss: 0.4253, test_loss: 1.3467, test_f1: 0.6177
 epoch: 55, train_loss: 0.4222, test_loss: 1.3641, test_f1: 0.6067
 epoch: 56, train_loss: 0.4272, test_loss: 1.3343, test_f1: 0.6108
 epoch: 57, train_loss: 0.4295, test_loss: 1.3942, test_f1: 0.5910
 epoch: 58, train_loss: 0.4132, test_loss: 1.3416, test_f1: 0.6220
 epoch: 59, train_loss: 0.4232, test_loss: 1.4202, test_f1: 0.6214
 epoch: 60, train_loss: 0.4096, test_loss: 1.4103, test_f1: 0.6025
 epoch: 61, train_loss: 0.4033, test_loss: 1.4108, test_f1: 0.6248
 epoch: 62, train_loss: 0.4015, test_loss: 1.4557, test_f1: 0.6225
 epoch: 63, train_loss: 0.4056, test_loss: 1.4939, test_f1: 0.6205
 epoch: 64, train_loss: 0.3993, test_loss: 1.5037, test_f1: 0.6200
 epoch: 65, train_loss: 0.4142, test_loss: 1.4769, test_f1: 0.6053
 epoch: 66, train_loss: 0.3929, test_loss: 1.5087, test_f1: 0.6120
 epoch: 67, train_loss: 0.3806, test_loss: 1.5380, test_f1: 0.6124
 epoch: 68, train_loss: 0.3659, test_loss: 1.4639, test_f1: 0.6153
 epoch: 69, train_loss: 0.3731, test_loss: 1.5294, test_f1: 0.6299
 epoch: 70, train_loss: 0.3687, test_loss: 1.5458, test_f1: 0.5949
 epoch: 71, train_loss: 0.3722, test_loss: 1.5689, test_f1: 0.5951
 epoch: 72, train_loss: 0.3799, test_loss: 1.5712, test_f1: 0.6097
 epoch: 73, train_loss: 0.3714, test_loss: 1.5249, test_f1: 0.6126
 epoch: 74, train_loss: 0.3477, test_loss: 1.6246, test_f1: 0.5918
 epoch: 75, train_loss: 0.3645, test_loss: 1.5915, test_f1: 0.5939
 epoch: 76, train_loss: 0.3550, test_loss: 1.5935, test_f1: 0.6070
 epoch: 77, train_loss: 0.3528, test_loss: 1.6679, test_f1: 0.5996
 epoch: 78, train_loss: 0.3422, test_loss: 1.6463, test_f1: 0.5830
 epoch: 79, train_loss: 0.3434, test_loss: 1.6407, test_f1: 0.5955
 epoch: 80, train_loss: 0.3352, test_loss: 1.6361, test_f1: 0.6075
 epoch: 81, train_loss: 0.3272, test_loss: 1.7074, test_f1: 0.6141
 epoch: 82, train_loss: 0.3332, test_loss: 1.7307, test_f1: 0.6068
 epoch: 83, train_loss: 0.3338, test_loss: 1.7001, test_f1: 0.6123
 epoch: 84, train_loss: 0.3288, test_loss: 1.7612, test_f1: 0.6049
 epoch: 85, train_loss: 0.3357, test_loss: 1.7536, test_f1: 0.5939
 epoch: 86, train_loss: 0.3200, test_loss: 1.6702, test_f1: 0.6135
 epoch: 87, train_loss: 0.3268, test_loss: 1.7704, test_f1: 0.5901
 epoch: 88, train_loss: 0.3000, test_loss: 1.7058, test_f1: 0.6122
 epoch: 89, train_loss: 0.3268, test_loss: 1.8090, test_f1: 0.5873
 epoch: 90, train_loss: 0.3150, test_loss: 1.7855, test_f1: 0.6099
 epoch: 91, train_loss: 0.3224, test_loss: 1.6902, test_f1: 0.6040
 epoch: 92, train_loss: 0.3428, test_loss: 1.8622, test_f1: 0.6099
 epoch: 93, train_loss: 0.2831, test_loss: 1.8647, test_f1: 0.6027
 epoch: 94, train_loss: 0.2850, test_loss: 1.8435, test_f1: 0.5928
 epoch: 95, train_loss: 0.3006, test_loss: 1.8162, test_f1: 0.5938
 epoch: 96, train_loss: 0.3063, test_loss: 1.8434, test_f1: 0.5941
 epoch: 97, train_loss: 0.3035, test_loss: 1.8507, test_f1: 0.6002
 epoch: 98, train_loss: 0.2879, test_loss: 1.8969, test_f1: 0.6037
 epoch: 99, train_loss: 0.2874, test_loss: 1.8511, test_f1: 0.6048
##################ITERATION #3 ****************************************
 epoch: 0, train_loss: 1.1745, test_loss: 1.2290, test_f1: 0.2722
 epoch: 1, train_loss: 1.0483, test_loss: 1.0807, test_f1: 0.4946
 epoch: 2, train_loss: 0.9937, test_loss: 1.0619, test_f1: 0.5112
 epoch: 3, train_loss: 0.9605, test_loss: 1.0452, test_f1: 0.5494
 epoch: 4, train_loss: 0.9451, test_loss: 1.0360, test_f1: 0.5440
 epoch: 5, train_loss: 0.9285, test_loss: 1.0252, test_f1: 0.5535
 epoch: 6, train_loss: 0.9107, test_loss: 1.0196, test_f1: 0.5473
 epoch: 7, train_loss: 0.8954, test_loss: 1.0194, test_f1: 0.5547
 epoch: 8, train_loss: 0.8711, test_loss: 1.0164, test_f1: 0.5533
 epoch: 9, train_loss: 0.8536, test_loss: 1.0234, test_f1: 0.5645
 epoch: 10, train_loss: 0.8574, test_loss: 1.0201, test_f1: 0.5466
 epoch: 11, train_loss: 0.8344, test_loss: 1.0193, test_f1: 0.5757
 epoch: 12, train_loss: 0.8450, test_loss: 1.0043, test_f1: 0.5777
 epoch: 13, train_loss: 0.7995, test_loss: 1.0156, test_f1: 0.5939
 epoch: 14, train_loss: 0.7979, test_loss: 1.0077, test_f1: 0.5929
 epoch: 15, train_loss: 0.7778, test_loss: 0.9942, test_f1: 0.5723
 epoch: 16, train_loss: 0.7676, test_loss: 1.0175, test_f1: 0.5882
 epoch: 17, train_loss: 0.7423, test_loss: 1.0082, test_f1: 0.6060
 epoch: 18, train_loss: 0.7308, test_loss: 1.0043, test_f1: 0.5954
 epoch: 19, train_loss: 0.7267, test_loss: 1.0087, test_f1: 0.5841
 epoch: 20, train_loss: 0.7022, test_loss: 1.0417, test_f1: 0.5981
 epoch: 21, train_loss: 0.7027, test_loss: 1.0462, test_f1: 0.5832
 epoch: 22, train_loss: 0.6790, test_loss: 1.0347, test_f1: 0.6261
 epoch: 23, train_loss: 0.6714, test_loss: 1.0292, test_f1: 0.6209
 epoch: 24, train_loss: 0.6535, test_loss: 1.0403, test_f1: 0.6228
 epoch: 25, train_loss: 0.6481, test_loss: 1.0767, test_f1: 0.5981
 epoch: 26, train_loss: 0.6376, test_loss: 1.0328, test_f1: 0.5958
 epoch: 27, train_loss: 0.6255, test_loss: 1.0440, test_f1: 0.6391
 epoch: 28, train_loss: 0.6206, test_loss: 1.0206, test_f1: 0.6372
 epoch: 29, train_loss: 0.5910, test_loss: 1.1052, test_f1: 0.6279
 epoch: 30, train_loss: 0.5809, test_loss: 1.1370, test_f1: 0.6096
 epoch: 31, train_loss: 0.5897, test_loss: 1.0873, test_f1: 0.6199
 epoch: 32, train_loss: 0.5624, test_loss: 1.0934, test_f1: 0.6161
 epoch: 33, train_loss: 0.5689, test_loss: 1.1596, test_f1: 0.6284
 epoch: 34, train_loss: 0.5713, test_loss: 1.1049, test_f1: 0.6558
 epoch: 35, train_loss: 0.5549, test_loss: 1.1240, test_f1: 0.6012
 epoch: 36, train_loss: 0.5387, test_loss: 1.1714, test_f1: 0.6062
 epoch: 37, train_loss: 0.5347, test_loss: 1.2356, test_f1: 0.6159
 epoch: 38, train_loss: 0.5233, test_loss: 1.1492, test_f1: 0.6076
 epoch: 39, train_loss: 0.5123, test_loss: 1.1921, test_f1: 0.6425
 epoch: 40, train_loss: 0.5042, test_loss: 1.2273, test_f1: 0.5999
 epoch: 41, train_loss: 0.5100, test_loss: 1.1984, test_f1: 0.6094
 epoch: 42, train_loss: 0.4876, test_loss: 1.2250, test_f1: 0.5995
 epoch: 43, train_loss: 0.4707, test_loss: 1.2305, test_f1: 0.6334
 epoch: 44, train_loss: 0.4641, test_loss: 1.2429, test_f1: 0.6101
 epoch: 45, train_loss: 0.4591, test_loss: 1.2365, test_f1: 0.6202
 epoch: 46, train_loss: 0.4581, test_loss: 1.2093, test_f1: 0.6242
 epoch: 47, train_loss: 0.4552, test_loss: 1.2411, test_f1: 0.6168
 epoch: 48, train_loss: 0.4546, test_loss: 1.2862, test_f1: 0.6365
 epoch: 49, train_loss: 0.4520, test_loss: 1.2690, test_f1: 0.6329
 epoch: 50, train_loss: 0.4339, test_loss: 1.2868, test_f1: 0.6222
 epoch: 51, train_loss: 0.4096, test_loss: 1.2890, test_f1: 0.6373
 epoch: 52, train_loss: 0.4131, test_loss: 1.2791, test_f1: 0.6224
 epoch: 53, train_loss: 0.3920, test_loss: 1.3204, test_f1: 0.6250
 epoch: 54, train_loss: 0.4064, test_loss: 1.3216, test_f1: 0.6194
 epoch: 55, train_loss: 0.3938, test_loss: 1.3558, test_f1: 0.6177
 epoch: 56, train_loss: 0.3937, test_loss: 1.2873, test_f1: 0.6384
 epoch: 57, train_loss: 0.3955, test_loss: 1.3329, test_f1: 0.6332
 epoch: 58, train_loss: 0.3827, test_loss: 1.3492, test_f1: 0.6282
 epoch: 59, train_loss: 0.3925, test_loss: 1.3507, test_f1: 0.6231
 epoch: 60, train_loss: 0.3629, test_loss: 1.3776, test_f1: 0.6369
 epoch: 61, train_loss: 0.3903, test_loss: 1.4007, test_f1: 0.6231
 epoch: 62, train_loss: 0.3745, test_loss: 1.4070, test_f1: 0.6226
 epoch: 63, train_loss: 0.3710, test_loss: 1.4214, test_f1: 0.6316
 epoch: 64, train_loss: 0.3455, test_loss: 1.4023, test_f1: 0.6523
 epoch: 65, train_loss: 0.3371, test_loss: 1.4345, test_f1: 0.6265
 epoch: 66, train_loss: 0.3443, test_loss: 1.4321, test_f1: 0.6244
 epoch: 67, train_loss: 0.3573, test_loss: 1.4793, test_f1: 0.6260
 epoch: 68, train_loss: 0.3627, test_loss: 1.4245, test_f1: 0.6278
 epoch: 69, train_loss: 0.3650, test_loss: 1.4371, test_f1: 0.6401
 epoch: 70, train_loss: 0.3392, test_loss: 1.4602, test_f1: 0.6369
 epoch: 71, train_loss: 0.3229, test_loss: 1.4545, test_f1: 0.6289
 epoch: 72, train_loss: 0.3288, test_loss: 1.4766, test_f1: 0.6547
 epoch: 73, train_loss: 0.3354, test_loss: 1.4982, test_f1: 0.6323
 epoch: 74, train_loss: 0.3286, test_loss: 1.5390, test_f1: 0.6193
 epoch: 75, train_loss: 0.3084, test_loss: 1.5878, test_f1: 0.6080
 epoch: 76, train_loss: 0.3116, test_loss: 1.5969, test_f1: 0.6129
 epoch: 77, train_loss: 0.3156, test_loss: 1.5523, test_f1: 0.6433
 epoch: 78, train_loss: 0.3043, test_loss: 1.5364, test_f1: 0.6314
 epoch: 79, train_loss: 0.3374, test_loss: 1.5712, test_f1: 0.6192
 epoch: 80, train_loss: 0.2923, test_loss: 1.5912, test_f1: 0.6354
 epoch: 81, train_loss: 0.3026, test_loss: 1.6210, test_f1: 0.6269
 epoch: 82, train_loss: 0.3218, test_loss: 1.5816, test_f1: 0.6381
 epoch: 83, train_loss: 0.2936, test_loss: 1.6907, test_f1: 0.6256
 epoch: 84, train_loss: 0.2973, test_loss: 1.6499, test_f1: 0.6303
 epoch: 85, train_loss: 0.3161, test_loss: 1.6295, test_f1: 0.6395
 epoch: 86, train_loss: 0.2836, test_loss: 1.6862, test_f1: 0.6223
 epoch: 87, train_loss: 0.2933, test_loss: 1.6965, test_f1: 0.6174
 epoch: 88, train_loss: 0.2749, test_loss: 1.6551, test_f1: 0.6388
 epoch: 89, train_loss: 0.2815, test_loss: 1.7072, test_f1: 0.6266
 epoch: 90, train_loss: 0.2833, test_loss: 1.6734, test_f1: 0.6548
 epoch: 91, train_loss: 0.2893, test_loss: 1.7060, test_f1: 0.6252
 epoch: 92, train_loss: 0.2916, test_loss: 1.6836, test_f1: 0.6258
 epoch: 93, train_loss: 0.2709, test_loss: 1.6739, test_f1: 0.6534
 epoch: 94, train_loss: 0.2658, test_loss: 1.7906, test_f1: 0.6368
 epoch: 95, train_loss: 0.2831, test_loss: 1.7185, test_f1: 0.6168
 epoch: 96, train_loss: 0.2672, test_loss: 1.7449, test_f1: 0.6223
 epoch: 97, train_loss: 0.2707, test_loss: 1.7606, test_f1: 0.6176
 epoch: 98, train_loss: 0.2816, test_loss: 1.7340, test_f1: 0.6348
 epoch: 99, train_loss: 0.2430, test_loss: 1.7848, test_f1: 0.6370
##################ITERATION #4 ****************************************
 epoch: 0, train_loss: 1.1440, test_loss: 1.1957, test_f1: 0.2601
 epoch: 1, train_loss: 1.0118, test_loss: 1.0591, test_f1: 0.4694
 epoch: 2, train_loss: 0.9781, test_loss: 1.0398, test_f1: 0.4730
 epoch: 3, train_loss: 0.9477, test_loss: 1.0335, test_f1: 0.5113
 epoch: 4, train_loss: 0.9442, test_loss: 1.0329, test_f1: 0.5005
 epoch: 5, train_loss: 0.9050, test_loss: 1.0189, test_f1: 0.5060
 epoch: 6, train_loss: 0.8808, test_loss: 1.0038, test_f1: 0.5190
 epoch: 7, train_loss: 0.8722, test_loss: 1.0063, test_f1: 0.5476
 epoch: 8, train_loss: 0.8510, test_loss: 0.9984, test_f1: 0.5693
 epoch: 9, train_loss: 0.8402, test_loss: 1.0053, test_f1: 0.5591
 epoch: 10, train_loss: 0.8163, test_loss: 0.9833, test_f1: 0.5716
 epoch: 11, train_loss: 0.7967, test_loss: 0.9771, test_f1: 0.5925
 epoch: 12, train_loss: 0.7882, test_loss: 0.9951, test_f1: 0.5769
 epoch: 13, train_loss: 0.7855, test_loss: 0.9876, test_f1: 0.5830
 epoch: 14, train_loss: 0.7488, test_loss: 0.9962, test_f1: 0.5836
 epoch: 15, train_loss: 0.7488, test_loss: 0.9814, test_f1: 0.5831
 epoch: 16, train_loss: 0.7231, test_loss: 0.9905, test_f1: 0.5960
 epoch: 17, train_loss: 0.7123, test_loss: 0.9767, test_f1: 0.6222
 epoch: 18, train_loss: 0.7038, test_loss: 1.0051, test_f1: 0.5930
 epoch: 19, train_loss: 0.6831, test_loss: 0.9861, test_f1: 0.6173
 epoch: 20, train_loss: 0.6842, test_loss: 0.9971, test_f1: 0.6116
 epoch: 21, train_loss: 0.6697, test_loss: 1.0126, test_f1: 0.5758
 epoch: 22, train_loss: 0.6540, test_loss: 1.0072, test_f1: 0.6006
 epoch: 23, train_loss: 0.6394, test_loss: 1.0117, test_f1: 0.6021
 epoch: 24, train_loss: 0.6302, test_loss: 1.0374, test_f1: 0.5942
 epoch: 25, train_loss: 0.6143, test_loss: 1.0431, test_f1: 0.6398
 epoch: 26, train_loss: 0.6076, test_loss: 1.0204, test_f1: 0.6212
 epoch: 27, train_loss: 0.6000, test_loss: 1.0096, test_f1: 0.6150
 epoch: 28, train_loss: 0.5931, test_loss: 1.0339, test_f1: 0.6129
 epoch: 29, train_loss: 0.5966, test_loss: 1.0598, test_f1: 0.6295
 epoch: 30, train_loss: 0.5670, test_loss: 1.0494, test_f1: 0.6043
 epoch: 31, train_loss: 0.5738, test_loss: 1.0775, test_f1: 0.6254
 epoch: 32, train_loss: 0.5590, test_loss: 1.0805, test_f1: 0.6208
 epoch: 33, train_loss: 0.5281, test_loss: 1.1027, test_f1: 0.5883
 epoch: 34, train_loss: 0.5434, test_loss: 1.1097, test_f1: 0.6305
 epoch: 35, train_loss: 0.5382, test_loss: 1.0517, test_f1: 0.6457
 epoch: 36, train_loss: 0.5232, test_loss: 1.0812, test_f1: 0.6227
 epoch: 37, train_loss: 0.5280, test_loss: 1.0671, test_f1: 0.6319
 epoch: 38, train_loss: 0.4851, test_loss: 1.0702, test_f1: 0.6558
 epoch: 39, train_loss: 0.4858, test_loss: 1.2008, test_f1: 0.6088
 epoch: 40, train_loss: 0.5032, test_loss: 1.1593, test_f1: 0.6360
 epoch: 41, train_loss: 0.4941, test_loss: 1.1556, test_f1: 0.6416
 epoch: 42, train_loss: 0.4829, test_loss: 1.1333, test_f1: 0.6598
 epoch: 43, train_loss: 0.4723, test_loss: 1.1622, test_f1: 0.6277
 epoch: 44, train_loss: 0.4841, test_loss: 1.1715, test_f1: 0.6601
 epoch: 45, train_loss: 0.4734, test_loss: 1.1857, test_f1: 0.6164
 epoch: 46, train_loss: 0.4652, test_loss: 1.1701, test_f1: 0.6175
 epoch: 47, train_loss: 0.4520, test_loss: 1.2161, test_f1: 0.6404
 epoch: 48, train_loss: 0.4314, test_loss: 1.3053, test_f1: 0.6157
 epoch: 49, train_loss: 0.4329, test_loss: 1.2384, test_f1: 0.6266
 epoch: 50, train_loss: 0.4486, test_loss: 1.2149, test_f1: 0.6339
 epoch: 51, train_loss: 0.4193, test_loss: 1.2083, test_f1: 0.6348
 epoch: 52, train_loss: 0.4115, test_loss: 1.2335, test_f1: 0.6350
 epoch: 53, train_loss: 0.3852, test_loss: 1.2215, test_f1: 0.6322
 epoch: 54, train_loss: 0.3814, test_loss: 1.2705, test_f1: 0.6493
 epoch: 55, train_loss: 0.3929, test_loss: 1.2449, test_f1: 0.6402
 epoch: 56, train_loss: 0.3789, test_loss: 1.2820, test_f1: 0.6349
 epoch: 57, train_loss: 0.3758, test_loss: 1.2652, test_f1: 0.6348
 epoch: 58, train_loss: 0.3563, test_loss: 1.2649, test_f1: 0.6418
 epoch: 59, train_loss: 0.3708, test_loss: 1.3375, test_f1: 0.6220
 epoch: 60, train_loss: 0.3593, test_loss: 1.3202, test_f1: 0.6344
 epoch: 61, train_loss: 0.3555, test_loss: 1.3533, test_f1: 0.6305
 epoch: 62, train_loss: 0.3604, test_loss: 1.3988, test_f1: 0.6112
 epoch: 63, train_loss: 0.3578, test_loss: 1.3294, test_f1: 0.6436
 epoch: 64, train_loss: 0.3543, test_loss: 1.3471, test_f1: 0.6310
 epoch: 65, train_loss: 0.3581, test_loss: 1.3885, test_f1: 0.6352
 epoch: 66, train_loss: 0.3532, test_loss: 1.3664, test_f1: 0.6493
 epoch: 67, train_loss: 0.3403, test_loss: 1.3550, test_f1: 0.6312
 epoch: 68, train_loss: 0.3446, test_loss: 1.3931, test_f1: 0.6241
 epoch: 69, train_loss: 0.3158, test_loss: 1.3579, test_f1: 0.6545
 epoch: 70, train_loss: 0.3322, test_loss: 1.4432, test_f1: 0.6390
 epoch: 71, train_loss: 0.3317, test_loss: 1.4393, test_f1: 0.6404
 epoch: 72, train_loss: 0.3201, test_loss: 1.4216, test_f1: 0.6281
 epoch: 73, train_loss: 0.3296, test_loss: 1.4272, test_f1: 0.6266
 epoch: 74, train_loss: 0.3244, test_loss: 1.4202, test_f1: 0.6407
 epoch: 75, train_loss: 0.3224, test_loss: 1.4225, test_f1: 0.6496
 epoch: 76, train_loss: 0.3047, test_loss: 1.4543, test_f1: 0.6435
 epoch: 77, train_loss: 0.3319, test_loss: 1.4126, test_f1: 0.6428
 epoch: 78, train_loss: 0.3108, test_loss: 1.4465, test_f1: 0.6532
 epoch: 79, train_loss: 0.3196, test_loss: 1.5168, test_f1: 0.6322
 epoch: 80, train_loss: 0.3062, test_loss: 1.4760, test_f1: 0.6323
 epoch: 81, train_loss: 0.3155, test_loss: 1.4683, test_f1: 0.6275
 epoch: 82, train_loss: 0.2859, test_loss: 1.5271, test_f1: 0.5975
 epoch: 83, train_loss: 0.3015, test_loss: 1.5751, test_f1: 0.6172
 epoch: 84, train_loss: 0.2867, test_loss: 1.4851, test_f1: 0.6355
 epoch: 85, train_loss: 0.2938, test_loss: 1.5408, test_f1: 0.6503
 epoch: 86, train_loss: 0.2827, test_loss: 1.5840, test_f1: 0.6145
 epoch: 87, train_loss: 0.2628, test_loss: 1.5776, test_f1: 0.6278
 epoch: 88, train_loss: 0.2817, test_loss: 1.5478, test_f1: 0.6396
 epoch: 89, train_loss: 0.2583, test_loss: 1.6045, test_f1: 0.6208
 epoch: 90, train_loss: 0.2755, test_loss: 1.6032, test_f1: 0.6168
 epoch: 91, train_loss: 0.2850, test_loss: 1.5551, test_f1: 0.6411
 epoch: 92, train_loss: 0.2891, test_loss: 1.6246, test_f1: 0.6495
 epoch: 93, train_loss: 0.2832, test_loss: 1.5842, test_f1: 0.6065
 epoch: 94, train_loss: 0.2673, test_loss: 1.5737, test_f1: 0.6258
 epoch: 95, train_loss: 0.2520, test_loss: 1.5859, test_f1: 0.6005
 epoch: 96, train_loss: 0.2815, test_loss: 1.6882, test_f1: 0.6306
 epoch: 97, train_loss: 0.2476, test_loss: 1.6614, test_f1: 0.6320
 epoch: 98, train_loss: 0.2547, test_loss: 1.6287, test_f1: 0.6011
 epoch: 99, train_loss: 0.2485, test_loss: 1.5749, test_f1: 0.6283
##################ITERATION #5 ****************************************
 epoch: 0, train_loss: 1.1664, test_loss: 1.2997, test_f1: 0.2568
 epoch: 1, train_loss: 1.0123, test_loss: 1.0427, test_f1: 0.5441
 epoch: 2, train_loss: 0.9847, test_loss: 1.0328, test_f1: 0.5661
 epoch: 3, train_loss: 0.9486, test_loss: 1.0270, test_f1: 0.5544
 epoch: 4, train_loss: 0.9216, test_loss: 1.0040, test_f1: 0.5529
 epoch: 5, train_loss: 0.9059, test_loss: 1.0019, test_f1: 0.5456
 epoch: 6, train_loss: 0.8823, test_loss: 0.9852, test_f1: 0.5696
 epoch: 7, train_loss: 0.8695, test_loss: 0.9960, test_f1: 0.5669
 epoch: 8, train_loss: 0.8627, test_loss: 0.9915, test_f1: 0.5916
 epoch: 9, train_loss: 0.8365, test_loss: 0.9693, test_f1: 0.5758
 epoch: 10, train_loss: 0.8166, test_loss: 0.9865, test_f1: 0.5513
 epoch: 11, train_loss: 0.8108, test_loss: 0.9871, test_f1: 0.6051
 epoch: 12, train_loss: 0.7871, test_loss: 0.9913, test_f1: 0.5742
 epoch: 13, train_loss: 0.7830, test_loss: 0.9782, test_f1: 0.6508
 epoch: 14, train_loss: 0.7535, test_loss: 0.9862, test_f1: 0.6123
 epoch: 15, train_loss: 0.7627, test_loss: 0.9961, test_f1: 0.5948
 epoch: 16, train_loss: 0.7248, test_loss: 0.9986, test_f1: 0.5776
 epoch: 17, train_loss: 0.7365, test_loss: 1.0148, test_f1: 0.6111
 epoch: 18, train_loss: 0.7277, test_loss: 0.9932, test_f1: 0.5957
 epoch: 19, train_loss: 0.7101, test_loss: 1.0063, test_f1: 0.5745
 epoch: 20, train_loss: 0.6891, test_loss: 1.0083, test_f1: 0.6125
 epoch: 21, train_loss: 0.6948, test_loss: 1.0693, test_f1: 0.6078
 epoch: 22, train_loss: 0.6867, test_loss: 1.0255, test_f1: 0.5973
 epoch: 23, train_loss: 0.6663, test_loss: 1.0199, test_f1: 0.6129
 epoch: 24, train_loss: 0.6483, test_loss: 1.0306, test_f1: 0.6092
 epoch: 25, train_loss: 0.6446, test_loss: 1.0193, test_f1: 0.6219
 epoch: 26, train_loss: 0.6441, test_loss: 1.0313, test_f1: 0.6168
 epoch: 27, train_loss: 0.6199, test_loss: 1.0766, test_f1: 0.6233
 epoch: 28, train_loss: 0.6150, test_loss: 1.0743, test_f1: 0.6128
 epoch: 29, train_loss: 0.6016, test_loss: 1.0768, test_f1: 0.6210
 epoch: 30, train_loss: 0.5875, test_loss: 1.0973, test_f1: 0.6033
 epoch: 31, train_loss: 0.6078, test_loss: 1.0376, test_f1: 0.6330
 epoch: 32, train_loss: 0.5699, test_loss: 1.0978, test_f1: 0.6268
 epoch: 33, train_loss: 0.5768, test_loss: 1.1301, test_f1: 0.6066
 epoch: 34, train_loss: 0.5573, test_loss: 1.0983, test_f1: 0.6126
 epoch: 35, train_loss: 0.5634, test_loss: 1.1418, test_f1: 0.5849
 epoch: 36, train_loss: 0.5491, test_loss: 1.1055, test_f1: 0.6194
 epoch: 37, train_loss: 0.5373, test_loss: 1.1062, test_f1: 0.6343
 epoch: 38, train_loss: 0.5178, test_loss: 1.1596, test_f1: 0.6308
 epoch: 39, train_loss: 0.5206, test_loss: 1.1471, test_f1: 0.6391
 epoch: 40, train_loss: 0.5011, test_loss: 1.1796, test_f1: 0.6107
 epoch: 41, train_loss: 0.4989, test_loss: 1.1702, test_f1: 0.5935
 epoch: 42, train_loss: 0.5024, test_loss: 1.1660, test_f1: 0.6260
 epoch: 43, train_loss: 0.4996, test_loss: 1.1674, test_f1: 0.6406
 epoch: 44, train_loss: 0.4916, test_loss: 1.2181, test_f1: 0.6526
 epoch: 45, train_loss: 0.4809, test_loss: 1.2558, test_f1: 0.6116
 epoch: 46, train_loss: 0.4784, test_loss: 1.2746, test_f1: 0.5869
 epoch: 47, train_loss: 0.4708, test_loss: 1.2531, test_f1: 0.6148
 epoch: 48, train_loss: 0.4565, test_loss: 1.2885, test_f1: 0.6317
 epoch: 49, train_loss: 0.4566, test_loss: 1.2731, test_f1: 0.6433
 epoch: 50, train_loss: 0.4354, test_loss: 1.3803, test_f1: 0.6073
 epoch: 51, train_loss: 0.4104, test_loss: 1.2921, test_f1: 0.6516
 epoch: 52, train_loss: 0.4056, test_loss: 1.2941, test_f1: 0.5927
 epoch: 53, train_loss: 0.4027, test_loss: 1.3113, test_f1: 0.6123
 epoch: 54, train_loss: 0.3991, test_loss: 1.3249, test_f1: 0.6235
 epoch: 55, train_loss: 0.4030, test_loss: 1.3460, test_f1: 0.6309
 epoch: 56, train_loss: 0.3947, test_loss: 1.3527, test_f1: 0.6124
 epoch: 57, train_loss: 0.3778, test_loss: 1.3929, test_f1: 0.5852
 epoch: 58, train_loss: 0.3820, test_loss: 1.3885, test_f1: 0.5977
 epoch: 59, train_loss: 0.3733, test_loss: 1.3618, test_f1: 0.6086
 epoch: 60, train_loss: 0.3659, test_loss: 1.3911, test_f1: 0.6152
 epoch: 61, train_loss: 0.3761, test_loss: 1.3977, test_f1: 0.5653
 epoch: 62, train_loss: 0.3730, test_loss: 1.4001, test_f1: 0.6254
 epoch: 63, train_loss: 0.3726, test_loss: 1.4599, test_f1: 0.6228
 epoch: 64, train_loss: 0.3597, test_loss: 1.3921, test_f1: 0.6152
 epoch: 65, train_loss: 0.3582, test_loss: 1.4654, test_f1: 0.6201
 epoch: 66, train_loss: 0.3670, test_loss: 1.4245, test_f1: 0.6125
 epoch: 67, train_loss: 0.3690, test_loss: 1.4540, test_f1: 0.6243
 epoch: 68, train_loss: 0.3390, test_loss: 1.4418, test_f1: 0.6383
 epoch: 69, train_loss: 0.3582, test_loss: 1.4821, test_f1: 0.6054
 epoch: 70, train_loss: 0.3497, test_loss: 1.4386, test_f1: 0.6362
 epoch: 71, train_loss: 0.3370, test_loss: 1.5296, test_f1: 0.5943
 epoch: 72, train_loss: 0.3392, test_loss: 1.5001, test_f1: 0.5910
 epoch: 73, train_loss: 0.3074, test_loss: 1.5386, test_f1: 0.5806
 epoch: 74, train_loss: 0.3198, test_loss: 1.5497, test_f1: 0.5792
 epoch: 75, train_loss: 0.3336, test_loss: 1.5483, test_f1: 0.5825
 epoch: 76, train_loss: 0.3222, test_loss: 1.5245, test_f1: 0.6210
 epoch: 77, train_loss: 0.3183, test_loss: 1.5633, test_f1: 0.6042
 epoch: 78, train_loss: 0.3289, test_loss: 1.5735, test_f1: 0.5983
 epoch: 79, train_loss: 0.2970, test_loss: 1.5771, test_f1: 0.5731
 epoch: 80, train_loss: 0.2983, test_loss: 1.5912, test_f1: 0.6078
 epoch: 81, train_loss: 0.3013, test_loss: 1.6188, test_f1: 0.6131
 epoch: 82, train_loss: 0.3015, test_loss: 1.6279, test_f1: 0.6449
 epoch: 83, train_loss: 0.3136, test_loss: 1.6149, test_f1: 0.6135
 epoch: 84, train_loss: 0.2888, test_loss: 1.6452, test_f1: 0.5926
 epoch: 85, train_loss: 0.2818, test_loss: 1.6476, test_f1: 0.6043
 epoch: 86, train_loss: 0.2867, test_loss: 1.6360, test_f1: 0.5886
 epoch: 87, train_loss: 0.2714, test_loss: 1.6504, test_f1: 0.5767
 epoch: 88, train_loss: 0.2876, test_loss: 1.6617, test_f1: 0.5842
 epoch: 89, train_loss: 0.2852, test_loss: 1.6232, test_f1: 0.6119
 epoch: 90, train_loss: 0.2841, test_loss: 1.6575, test_f1: 0.5873
 epoch: 91, train_loss: 0.2770, test_loss: 1.7123, test_f1: 0.5893
 epoch: 92, train_loss: 0.2645, test_loss: 1.7656, test_f1: 0.5793
 epoch: 93, train_loss: 0.2611, test_loss: 1.7541, test_f1: 0.6098
 epoch: 94, train_loss: 0.2850, test_loss: 1.7358, test_f1: 0.5795
 epoch: 95, train_loss: 0.2658, test_loss: 1.7512, test_f1: 0.5722
 epoch: 96, train_loss: 0.2697, test_loss: 1.7628, test_f1: 0.6148
 epoch: 97, train_loss: 0.2596, test_loss: 1.7620, test_f1: 0.6083
 epoch: 98, train_loss: 0.2673, test_loss: 1.7141, test_f1: 0.6079
 epoch: 99, train_loss: 0.2603, test_loss: 1.7957, test_f1: 0.6345
##################ITERATION #6 ****************************************
 epoch: 0, train_loss: 1.1622, test_loss: 1.2811, test_f1: 0.3004
 epoch: 1, train_loss: 1.0394, test_loss: 1.0692, test_f1: 0.4846
 epoch: 2, train_loss: 0.9925, test_loss: 1.0701, test_f1: 0.4918
 epoch: 3, train_loss: 0.9537, test_loss: 1.0580, test_f1: 0.5283
 epoch: 4, train_loss: 0.9267, test_loss: 1.0390, test_f1: 0.5324
 epoch: 5, train_loss: 0.9132, test_loss: 1.0291, test_f1: 0.5439
 epoch: 6, train_loss: 0.8834, test_loss: 1.0117, test_f1: 0.5423
 epoch: 7, train_loss: 0.8853, test_loss: 1.0073, test_f1: 0.5438
 epoch: 8, train_loss: 0.8629, test_loss: 1.0148, test_f1: 0.5793
 epoch: 9, train_loss: 0.8450, test_loss: 1.0004, test_f1: 0.5813
 epoch: 10, train_loss: 0.8304, test_loss: 0.9859, test_f1: 0.5694
 epoch: 11, train_loss: 0.8020, test_loss: 0.9923, test_f1: 0.5924
 epoch: 12, train_loss: 0.7928, test_loss: 0.9918, test_f1: 0.5712
 epoch: 13, train_loss: 0.7699, test_loss: 0.9710, test_f1: 0.6161
 epoch: 14, train_loss: 0.7610, test_loss: 0.9978, test_f1: 0.5647
 epoch: 15, train_loss: 0.7572, test_loss: 0.9960, test_f1: 0.6037
 epoch: 16, train_loss: 0.7481, test_loss: 1.0087, test_f1: 0.5946
 epoch: 17, train_loss: 0.7350, test_loss: 1.0161, test_f1: 0.5860
 epoch: 18, train_loss: 0.7170, test_loss: 1.0182, test_f1: 0.5824
 epoch: 19, train_loss: 0.7050, test_loss: 1.0022, test_f1: 0.6028
 epoch: 20, train_loss: 0.6925, test_loss: 1.0235, test_f1: 0.5801
 epoch: 21, train_loss: 0.6796, test_loss: 1.0447, test_f1: 0.5956
 epoch: 22, train_loss: 0.6789, test_loss: 1.0127, test_f1: 0.6116
 epoch: 23, train_loss: 0.6700, test_loss: 1.0119, test_f1: 0.6230
 epoch: 24, train_loss: 0.6552, test_loss: 1.0627, test_f1: 0.6070
 epoch: 25, train_loss: 0.6386, test_loss: 1.0352, test_f1: 0.5911
 epoch: 26, train_loss: 0.6416, test_loss: 1.0550, test_f1: 0.6067
 epoch: 27, train_loss: 0.6146, test_loss: 1.0359, test_f1: 0.6174
 epoch: 28, train_loss: 0.6169, test_loss: 1.0484, test_f1: 0.6155
 epoch: 29, train_loss: 0.6144, test_loss: 1.0564, test_f1: 0.6218
 epoch: 30, train_loss: 0.5935, test_loss: 1.0311, test_f1: 0.6319
 epoch: 31, train_loss: 0.5934, test_loss: 1.0462, test_f1: 0.6202
 epoch: 32, train_loss: 0.5887, test_loss: 1.0683, test_f1: 0.6342
 epoch: 33, train_loss: 0.5796, test_loss: 1.0898, test_f1: 0.6304
 epoch: 34, train_loss: 0.5735, test_loss: 1.0703, test_f1: 0.6527
 epoch: 35, train_loss: 0.5633, test_loss: 1.1091, test_f1: 0.6505
 epoch: 36, train_loss: 0.5465, test_loss: 1.1014, test_f1: 0.6040
 epoch: 37, train_loss: 0.5542, test_loss: 1.1292, test_f1: 0.6067
 epoch: 38, train_loss: 0.5349, test_loss: 1.1726, test_f1: 0.6347
 epoch: 39, train_loss: 0.5265, test_loss: 1.1540, test_f1: 0.6164
 epoch: 40, train_loss: 0.5078, test_loss: 1.1671, test_f1: 0.6382
 epoch: 41, train_loss: 0.5227, test_loss: 1.1731, test_f1: 0.6030
 epoch: 42, train_loss: 0.5020, test_loss: 1.1334, test_f1: 0.6247
 epoch: 43, train_loss: 0.5005, test_loss: 1.1730, test_f1: 0.6074
 epoch: 44, train_loss: 0.4777, test_loss: 1.1029, test_f1: 0.6352
 epoch: 45, train_loss: 0.4842, test_loss: 1.1100, test_f1: 0.6405
 epoch: 46, train_loss: 0.4821, test_loss: 1.1384, test_f1: 0.6371
 epoch: 47, train_loss: 0.4622, test_loss: 1.2083, test_f1: 0.6186
 epoch: 48, train_loss: 0.4662, test_loss: 1.2368, test_f1: 0.6494
 epoch: 49, train_loss: 0.4431, test_loss: 1.2708, test_f1: 0.6130
 epoch: 50, train_loss: 0.4288, test_loss: 1.2370, test_f1: 0.6173
 epoch: 51, train_loss: 0.4289, test_loss: 1.2170, test_f1: 0.6400
 epoch: 52, train_loss: 0.4140, test_loss: 1.2448, test_f1: 0.6315
 epoch: 53, train_loss: 0.4051, test_loss: 1.2478, test_f1: 0.6158
 epoch: 54, train_loss: 0.4012, test_loss: 1.2554, test_f1: 0.6454
 epoch: 55, train_loss: 0.3948, test_loss: 1.2711, test_f1: 0.6130
 epoch: 56, train_loss: 0.4049, test_loss: 1.2931, test_f1: 0.6344
 epoch: 57, train_loss: 0.3933, test_loss: 1.2597, test_f1: 0.6530
 epoch: 58, train_loss: 0.3886, test_loss: 1.2979, test_f1: 0.5993
 epoch: 59, train_loss: 0.3838, test_loss: 1.2714, test_f1: 0.6510
 epoch: 60, train_loss: 0.3820, test_loss: 1.2838, test_f1: 0.6502
 epoch: 61, train_loss: 0.3812, test_loss: 1.2479, test_f1: 0.6497
 epoch: 62, train_loss: 0.3609, test_loss: 1.3015, test_f1: 0.6445
 epoch: 63, train_loss: 0.3788, test_loss: 1.2631, test_f1: 0.6487
 epoch: 64, train_loss: 0.3641, test_loss: 1.2989, test_f1: 0.6347
 epoch: 65, train_loss: 0.3667, test_loss: 1.2915, test_f1: 0.6715
 epoch: 66, train_loss: 0.3588, test_loss: 1.3249, test_f1: 0.6400
 epoch: 67, train_loss: 0.3592, test_loss: 1.2755, test_f1: 0.6570
 epoch: 68, train_loss: 0.3732, test_loss: 1.3136, test_f1: 0.6281
 epoch: 69, train_loss: 0.3573, test_loss: 1.3428, test_f1: 0.6348
 epoch: 70, train_loss: 0.3604, test_loss: 1.3391, test_f1: 0.6421
 epoch: 71, train_loss: 0.3515, test_loss: 1.3477, test_f1: 0.6204
 epoch: 72, train_loss: 0.3379, test_loss: 1.3674, test_f1: 0.6420
 epoch: 73, train_loss: 0.3159, test_loss: 1.3718, test_f1: 0.6532
 epoch: 74, train_loss: 0.3198, test_loss: 1.4382, test_f1: 0.6243
 epoch: 75, train_loss: 0.3375, test_loss: 1.3593, test_f1: 0.6527
 epoch: 76, train_loss: 0.3348, test_loss: 1.3785, test_f1: 0.6404
 epoch: 77, train_loss: 0.3139, test_loss: 1.4129, test_f1: 0.6275
 epoch: 78, train_loss: 0.3228, test_loss: 1.3894, test_f1: 0.6349
 epoch: 79, train_loss: 0.3099, test_loss: 1.4297, test_f1: 0.6387
 epoch: 80, train_loss: 0.3121, test_loss: 1.4227, test_f1: 0.6433
 epoch: 81, train_loss: 0.3149, test_loss: 1.4240, test_f1: 0.6262
 epoch: 82, train_loss: 0.3101, test_loss: 1.4290, test_f1: 0.6416
 epoch: 83, train_loss: 0.3111, test_loss: 1.4641, test_f1: 0.6208
 epoch: 84, train_loss: 0.3077, test_loss: 1.4475, test_f1: 0.6605
 epoch: 85, train_loss: 0.3057, test_loss: 1.4718, test_f1: 0.6436
 epoch: 86, train_loss: 0.2983, test_loss: 1.4606, test_f1: 0.6619
 epoch: 87, train_loss: 0.2997, test_loss: 1.4389, test_f1: 0.6462
 epoch: 88, train_loss: 0.3164, test_loss: 1.5342, test_f1: 0.6555
 epoch: 89, train_loss: 0.2932, test_loss: 1.5697, test_f1: 0.6236
 epoch: 90, train_loss: 0.2864, test_loss: 1.5117, test_f1: 0.6628
 epoch: 91, train_loss: 0.2976, test_loss: 1.4923, test_f1: 0.6396
 epoch: 92, train_loss: 0.3049, test_loss: 1.4968, test_f1: 0.6693
 epoch: 93, train_loss: 0.2662, test_loss: 1.5249, test_f1: 0.6541
 epoch: 94, train_loss: 0.2645, test_loss: 1.5768, test_f1: 0.6323
 epoch: 95, train_loss: 0.2837, test_loss: 1.5612, test_f1: 0.6504
 epoch: 96, train_loss: 0.2858, test_loss: 1.5549, test_f1: 0.6199
 epoch: 97, train_loss: 0.2702, test_loss: 1.5489, test_f1: 0.6219
 epoch: 98, train_loss: 0.2710, test_loss: 1.6099, test_f1: 0.6359
 epoch: 99, train_loss: 0.2548, test_loss: 1.5873, test_f1: 0.6422
##################ITERATION #7 ****************************************
 epoch: 0, train_loss: 1.2224, test_loss: 1.2491, test_f1: 0.3046
 epoch: 1, train_loss: 1.0062, test_loss: 1.0442, test_f1: 0.5196
 epoch: 2, train_loss: 0.9798, test_loss: 1.0246, test_f1: 0.5327
 epoch: 3, train_loss: 0.9523, test_loss: 1.0128, test_f1: 0.5231
 epoch: 4, train_loss: 0.9043, test_loss: 1.0026, test_f1: 0.5368
 epoch: 5, train_loss: 0.9194, test_loss: 0.9879, test_f1: 0.5518
 epoch: 6, train_loss: 0.9014, test_loss: 1.0076, test_f1: 0.5636
 epoch: 7, train_loss: 0.8572, test_loss: 0.9968, test_f1: 0.5502
 epoch: 8, train_loss: 0.8569, test_loss: 0.9919, test_f1: 0.5572
 epoch: 9, train_loss: 0.8484, test_loss: 0.9985, test_f1: 0.5429
 epoch: 10, train_loss: 0.8393, test_loss: 1.0046, test_f1: 0.5406
 epoch: 11, train_loss: 0.8235, test_loss: 1.0061, test_f1: 0.5461
 epoch: 12, train_loss: 0.8021, test_loss: 0.9928, test_f1: 0.5744
 epoch: 13, train_loss: 0.7794, test_loss: 1.0174, test_f1: 0.5767
 epoch: 14, train_loss: 0.7551, test_loss: 1.0288, test_f1: 0.5692
 epoch: 15, train_loss: 0.7456, test_loss: 1.0027, test_f1: 0.5798
 epoch: 16, train_loss: 0.7192, test_loss: 1.0316, test_f1: 0.5630
 epoch: 17, train_loss: 0.7283, test_loss: 1.0151, test_f1: 0.5998
 epoch: 18, train_loss: 0.7177, test_loss: 0.9951, test_f1: 0.5907
 epoch: 19, train_loss: 0.7011, test_loss: 1.0169, test_f1: 0.5945
 epoch: 20, train_loss: 0.6946, test_loss: 1.0088, test_f1: 0.6175
 epoch: 21, train_loss: 0.6907, test_loss: 1.0196, test_f1: 0.6013
 epoch: 22, train_loss: 0.6696, test_loss: 0.9921, test_f1: 0.5867
 epoch: 23, train_loss: 0.6530, test_loss: 1.0236, test_f1: 0.6083
 epoch: 24, train_loss: 0.6528, test_loss: 1.0427, test_f1: 0.5947
 epoch: 25, train_loss: 0.6445, test_loss: 1.0725, test_f1: 0.5872
 epoch: 26, train_loss: 0.6358, test_loss: 1.0460, test_f1: 0.6227
 epoch: 27, train_loss: 0.6215, test_loss: 1.0695, test_f1: 0.6043
 epoch: 28, train_loss: 0.5964, test_loss: 1.0899, test_f1: 0.6148
 epoch: 29, train_loss: 0.6034, test_loss: 1.0658, test_f1: 0.6026
 epoch: 30, train_loss: 0.5950, test_loss: 1.0615, test_f1: 0.6031
 epoch: 31, train_loss: 0.6157, test_loss: 1.0957, test_f1: 0.6147
 epoch: 32, train_loss: 0.5950, test_loss: 1.0988, test_f1: 0.6228
 epoch: 33, train_loss: 0.5711, test_loss: 1.1258, test_f1: 0.6194
 epoch: 34, train_loss: 0.5461, test_loss: 1.0849, test_f1: 0.6588
 epoch: 35, train_loss: 0.5755, test_loss: 1.1260, test_f1: 0.6304
 epoch: 36, train_loss: 0.5476, test_loss: 1.1380, test_f1: 0.6284
 epoch: 37, train_loss: 0.5436, test_loss: 1.1663, test_f1: 0.6285
 epoch: 38, train_loss: 0.5305, test_loss: 1.1371, test_f1: 0.6275
 epoch: 39, train_loss: 0.5129, test_loss: 1.1994, test_f1: 0.6279
 epoch: 40, train_loss: 0.5358, test_loss: 1.2051, test_f1: 0.5905
 epoch: 41, train_loss: 0.5211, test_loss: 1.1751, test_f1: 0.6287
 epoch: 42, train_loss: 0.5031, test_loss: 1.1525, test_f1: 0.6013
 epoch: 43, train_loss: 0.5041, test_loss: 1.1688, test_f1: 0.6236
 epoch: 44, train_loss: 0.5121, test_loss: 1.2194, test_f1: 0.6291
 epoch: 45, train_loss: 0.4838, test_loss: 1.1998, test_f1: 0.6381
 epoch: 46, train_loss: 0.4797, test_loss: 1.2644, test_f1: 0.6367
 epoch: 47, train_loss: 0.5002, test_loss: 1.2363, test_f1: 0.6241
 epoch: 48, train_loss: 0.4837, test_loss: 1.2687, test_f1: 0.6261
 epoch: 49, train_loss: 0.4612, test_loss: 1.3312, test_f1: 0.6084
 epoch: 50, train_loss: 0.4702, test_loss: 1.2973, test_f1: 0.6300
 epoch: 51, train_loss: 0.4282, test_loss: 1.2801, test_f1: 0.6243
 epoch: 52, train_loss: 0.4220, test_loss: 1.3318, test_f1: 0.6293
 epoch: 53, train_loss: 0.4020, test_loss: 1.3247, test_f1: 0.6283
 epoch: 54, train_loss: 0.4044, test_loss: 1.3095, test_f1: 0.6301
 epoch: 55, train_loss: 0.4193, test_loss: 1.3149, test_f1: 0.6280
 epoch: 56, train_loss: 0.4165, test_loss: 1.3586, test_f1: 0.6251
 epoch: 57, train_loss: 0.3995, test_loss: 1.3200, test_f1: 0.6228
 epoch: 58, train_loss: 0.3891, test_loss: 1.3626, test_f1: 0.6268
 epoch: 59, train_loss: 0.3915, test_loss: 1.4132, test_f1: 0.6154
 epoch: 60, train_loss: 0.4031, test_loss: 1.3848, test_f1: 0.6287
 epoch: 61, train_loss: 0.3998, test_loss: 1.4034, test_f1: 0.6144
 epoch: 62, train_loss: 0.3856, test_loss: 1.4337, test_f1: 0.6156
 epoch: 63, train_loss: 0.3983, test_loss: 1.4460, test_f1: 0.6149
 epoch: 64, train_loss: 0.3856, test_loss: 1.3986, test_f1: 0.6203
 epoch: 65, train_loss: 0.3818, test_loss: 1.4391, test_f1: 0.5977
 epoch: 66, train_loss: 0.3804, test_loss: 1.4622, test_f1: 0.6240
 epoch: 67, train_loss: 0.3981, test_loss: 1.4768, test_f1: 0.6174
 epoch: 68, train_loss: 0.3520, test_loss: 1.5080, test_f1: 0.6066
 epoch: 69, train_loss: 0.3610, test_loss: 1.5269, test_f1: 0.6230
 epoch: 70, train_loss: 0.3561, test_loss: 1.4637, test_f1: 0.6173
 epoch: 71, train_loss: 0.3522, test_loss: 1.5216, test_f1: 0.6194
 epoch: 72, train_loss: 0.3576, test_loss: 1.5337, test_f1: 0.6248
 epoch: 73, train_loss: 0.3550, test_loss: 1.4778, test_f1: 0.6104
 epoch: 74, train_loss: 0.3465, test_loss: 1.4749, test_f1: 0.6365
 epoch: 75, train_loss: 0.3517, test_loss: 1.5286, test_f1: 0.6268
 epoch: 76, train_loss: 0.3319, test_loss: 1.5563, test_f1: 0.6085
 epoch: 77, train_loss: 0.3447, test_loss: 1.5560, test_f1: 0.6246
 epoch: 78, train_loss: 0.3292, test_loss: 1.5113, test_f1: 0.6283
 epoch: 79, train_loss: 0.3409, test_loss: 1.5316, test_f1: 0.6271
 epoch: 80, train_loss: 0.3342, test_loss: 1.6493, test_f1: 0.6209
 epoch: 81, train_loss: 0.3209, test_loss: 1.5689, test_f1: 0.6244
 epoch: 82, train_loss: 0.2929, test_loss: 1.6205, test_f1: 0.6264
 epoch: 83, train_loss: 0.3078, test_loss: 1.5850, test_f1: 0.6305
 epoch: 84, train_loss: 0.3156, test_loss: 1.6611, test_f1: 0.6202
 epoch: 85, train_loss: 0.3090, test_loss: 1.6305, test_f1: 0.6209
 epoch: 86, train_loss: 0.3335, test_loss: 1.6474, test_f1: 0.6118
 epoch: 87, train_loss: 0.3155, test_loss: 1.6132, test_f1: 0.6180
 epoch: 88, train_loss: 0.3091, test_loss: 1.6217, test_f1: 0.6201
 epoch: 89, train_loss: 0.3014, test_loss: 1.6896, test_f1: 0.6188
 epoch: 90, train_loss: 0.2930, test_loss: 1.7416, test_f1: 0.6057
 epoch: 91, train_loss: 0.3012, test_loss: 1.6287, test_f1: 0.6149
 epoch: 92, train_loss: 0.2923, test_loss: 1.6654, test_f1: 0.6274
 epoch: 93, train_loss: 0.2850, test_loss: 1.7372, test_f1: 0.6223
 epoch: 94, train_loss: 0.3018, test_loss: 1.6778, test_f1: 0.6297
 epoch: 95, train_loss: 0.2778, test_loss: 1.7423, test_f1: 0.6174
 epoch: 96, train_loss: 0.2765, test_loss: 1.6969, test_f1: 0.6254
 epoch: 97, train_loss: 0.2740, test_loss: 1.7681, test_f1: 0.6239
 epoch: 98, train_loss: 0.2653, test_loss: 1.8235, test_f1: 0.6277
 epoch: 99, train_loss: 0.2883, test_loss: 1.7302, test_f1: 0.6327
##################ITERATION #8 ****************************************
 epoch: 0, train_loss: 1.2334, test_loss: 1.5706, test_f1: 0.2583
 epoch: 1, train_loss: 1.0576, test_loss: 1.0304, test_f1: 0.5556
 epoch: 2, train_loss: 0.9982, test_loss: 1.0326, test_f1: 0.5522
 epoch: 3, train_loss: 0.9785, test_loss: 1.0345, test_f1: 0.5683
 epoch: 4, train_loss: 0.9160, test_loss: 1.0329, test_f1: 0.5627
 epoch: 5, train_loss: 0.8997, test_loss: 1.0114, test_f1: 0.5910
 epoch: 6, train_loss: 0.8797, test_loss: 1.0240, test_f1: 0.5576
 epoch: 7, train_loss: 0.8545, test_loss: 1.0068, test_f1: 0.5980
 epoch: 8, train_loss: 0.8587, test_loss: 0.9958, test_f1: 0.5764
 epoch: 9, train_loss: 0.8393, test_loss: 1.0059, test_f1: 0.5821
 epoch: 10, train_loss: 0.8193, test_loss: 0.9946, test_f1: 0.6268
 epoch: 11, train_loss: 0.7816, test_loss: 1.0046, test_f1: 0.5887
 epoch: 12, train_loss: 0.7910, test_loss: 1.0020, test_f1: 0.6026
 epoch: 13, train_loss: 0.7604, test_loss: 1.0402, test_f1: 0.5480
 epoch: 14, train_loss: 0.7542, test_loss: 0.9968, test_f1: 0.5932
 epoch: 15, train_loss: 0.7220, test_loss: 1.0364, test_f1: 0.5738
 epoch: 16, train_loss: 0.7304, test_loss: 1.0273, test_f1: 0.5764
 epoch: 17, train_loss: 0.7162, test_loss: 1.0533, test_f1: 0.5619
 epoch: 18, train_loss: 0.6964, test_loss: 1.0299, test_f1: 0.5884
 epoch: 19, train_loss: 0.6970, test_loss: 1.0501, test_f1: 0.5712
 epoch: 20, train_loss: 0.7103, test_loss: 1.0397, test_f1: 0.5977
 epoch: 21, train_loss: 0.6764, test_loss: 1.0750, test_f1: 0.6122
 epoch: 22, train_loss: 0.6527, test_loss: 1.0746, test_f1: 0.5669
 epoch: 23, train_loss: 0.6564, test_loss: 1.0663, test_f1: 0.5830
 epoch: 24, train_loss: 0.6280, test_loss: 1.1235, test_f1: 0.5584
 epoch: 25, train_loss: 0.6378, test_loss: 1.0847, test_f1: 0.5873
 epoch: 26, train_loss: 0.6076, test_loss: 1.1122, test_f1: 0.5748
 epoch: 27, train_loss: 0.5989, test_loss: 1.1265, test_f1: 0.5887
 epoch: 28, train_loss: 0.6198, test_loss: 1.0911, test_f1: 0.5912
 epoch: 29, train_loss: 0.5878, test_loss: 1.1169, test_f1: 0.5747
 epoch: 30, train_loss: 0.5749, test_loss: 1.1540, test_f1: 0.5748
 epoch: 31, train_loss: 0.5668, test_loss: 1.1497, test_f1: 0.5865
 epoch: 32, train_loss: 0.5578, test_loss: 1.1243, test_f1: 0.5855
 epoch: 33, train_loss: 0.5757, test_loss: 1.1314, test_f1: 0.6282
 epoch: 34, train_loss: 0.5476, test_loss: 1.1938, test_f1: 0.5599
 epoch: 35, train_loss: 0.5402, test_loss: 1.1543, test_f1: 0.5878
 epoch: 36, train_loss: 0.5317, test_loss: 1.1751, test_f1: 0.5937
 epoch: 37, train_loss: 0.5204, test_loss: 1.2266, test_f1: 0.5932
 epoch: 38, train_loss: 0.5062, test_loss: 1.2124, test_f1: 0.6112
 epoch: 39, train_loss: 0.5220, test_loss: 1.2633, test_f1: 0.5864
 epoch: 40, train_loss: 0.5048, test_loss: 1.2564, test_f1: 0.5931
 epoch: 41, train_loss: 0.4735, test_loss: 1.3241, test_f1: 0.5953
 epoch: 42, train_loss: 0.4826, test_loss: 1.2708, test_f1: 0.5754
 epoch: 43, train_loss: 0.4816, test_loss: 1.3048, test_f1: 0.5923
 epoch: 44, train_loss: 0.4855, test_loss: 1.3118, test_f1: 0.5656
 epoch: 45, train_loss: 0.4875, test_loss: 1.3343, test_f1: 0.5783
 epoch: 46, train_loss: 0.4527, test_loss: 1.3409, test_f1: 0.5901
 epoch: 47, train_loss: 0.4418, test_loss: 1.3328, test_f1: 0.5959
 epoch: 48, train_loss: 0.4280, test_loss: 1.3738, test_f1: 0.5861
 epoch: 49, train_loss: 0.4339, test_loss: 1.3729, test_f1: 0.5725
 epoch: 50, train_loss: 0.4298, test_loss: 1.4222, test_f1: 0.5807
 epoch: 51, train_loss: 0.3909, test_loss: 1.3779, test_f1: 0.6112
 epoch: 52, train_loss: 0.3925, test_loss: 1.3752, test_f1: 0.5963
 epoch: 53, train_loss: 0.3970, test_loss: 1.4569, test_f1: 0.5653
 epoch: 54, train_loss: 0.4165, test_loss: 1.4437, test_f1: 0.5832
 epoch: 55, train_loss: 0.3779, test_loss: 1.4164, test_f1: 0.5982
 epoch: 56, train_loss: 0.3900, test_loss: 1.4005, test_f1: 0.6262
 epoch: 57, train_loss: 0.3769, test_loss: 1.4568, test_f1: 0.5869
 epoch: 58, train_loss: 0.3873, test_loss: 1.4913, test_f1: 0.5730
 epoch: 59, train_loss: 0.3777, test_loss: 1.4535, test_f1: 0.5920
 epoch: 60, train_loss: 0.3616, test_loss: 1.4538, test_f1: 0.5932
 epoch: 61, train_loss: 0.3465, test_loss: 1.4599, test_f1: 0.5881
 epoch: 62, train_loss: 0.3584, test_loss: 1.5337, test_f1: 0.5751
 epoch: 63, train_loss: 0.3551, test_loss: 1.5160, test_f1: 0.5684
 epoch: 64, train_loss: 0.3440, test_loss: 1.5082, test_f1: 0.5841
 epoch: 65, train_loss: 0.3314, test_loss: 1.5305, test_f1: 0.5739
 epoch: 66, train_loss: 0.3330, test_loss: 1.6087, test_f1: 0.5969
 epoch: 67, train_loss: 0.3481, test_loss: 1.5207, test_f1: 0.5812
 epoch: 68, train_loss: 0.3335, test_loss: 1.5197, test_f1: 0.5751
 epoch: 69, train_loss: 0.3366, test_loss: 1.5163, test_f1: 0.5835
 epoch: 70, train_loss: 0.3499, test_loss: 1.6087, test_f1: 0.5784
 epoch: 71, train_loss: 0.3353, test_loss: 1.5862, test_f1: 0.5720
 epoch: 72, train_loss: 0.3197, test_loss: 1.6623, test_f1: 0.5640
 epoch: 73, train_loss: 0.3381, test_loss: 1.5970, test_f1: 0.5761
 epoch: 74, train_loss: 0.3123, test_loss: 1.6171, test_f1: 0.5614
 epoch: 75, train_loss: 0.3205, test_loss: 1.6878, test_f1: 0.5600
 epoch: 76, train_loss: 0.3112, test_loss: 1.7527, test_f1: 0.5547
 epoch: 77, train_loss: 0.3238, test_loss: 1.6448, test_f1: 0.5871
 epoch: 78, train_loss: 0.3007, test_loss: 1.5774, test_f1: 0.5934
 epoch: 79, train_loss: 0.3013, test_loss: 1.7793, test_f1: 0.5534
 epoch: 80, train_loss: 0.3188, test_loss: 1.7211, test_f1: 0.5630
 epoch: 81, train_loss: 0.2934, test_loss: 1.7747, test_f1: 0.5560
 epoch: 82, train_loss: 0.2717, test_loss: 1.8084, test_f1: 0.5470
 epoch: 83, train_loss: 0.2946, test_loss: 1.8361, test_f1: 0.5523
 epoch: 84, train_loss: 0.2726, test_loss: 1.8234, test_f1: 0.5560
 epoch: 85, train_loss: 0.2915, test_loss: 1.7182, test_f1: 0.5587
 epoch: 86, train_loss: 0.2734, test_loss: 1.7098, test_f1: 0.5884
 epoch: 87, train_loss: 0.2873, test_loss: 1.8624, test_f1: 0.5474
 epoch: 88, train_loss: 0.2779, test_loss: 1.8926, test_f1: 0.5532
 epoch: 89, train_loss: 0.2901, test_loss: 1.7859, test_f1: 0.5678
 epoch: 90, train_loss: 0.2915, test_loss: 1.8246, test_f1: 0.5610
 epoch: 91, train_loss: 0.2907, test_loss: 1.9096, test_f1: 0.5615
 epoch: 92, train_loss: 0.2673, test_loss: 1.9119, test_f1: 0.5646
 epoch: 93, train_loss: 0.2656, test_loss: 1.8542, test_f1: 0.5572
 epoch: 94, train_loss: 0.2629, test_loss: 1.8321, test_f1: 0.5601
 epoch: 95, train_loss: 0.2716, test_loss: 1.8002, test_f1: 0.5506
 epoch: 96, train_loss: 0.2698, test_loss: 1.8647, test_f1: 0.5585
 epoch: 97, train_loss: 0.2669, test_loss: 1.8270, test_f1: 0.5547
 epoch: 98, train_loss: 0.2664, test_loss: 1.9809, test_f1: 0.5666
 epoch: 99, train_loss: 0.2491, test_loss: 1.9631, test_f1: 0.5617
##################ITERATION #9 ****************************************
 epoch: 0, train_loss: 1.2518, test_loss: 1.2126, test_f1: 0.3606
 epoch: 1, train_loss: 1.0443, test_loss: 1.0806, test_f1: 0.5046
 epoch: 2, train_loss: 1.0076, test_loss: 1.0703, test_f1: 0.4877
 epoch: 3, train_loss: 0.9572, test_loss: 1.0385, test_f1: 0.5489
 epoch: 4, train_loss: 0.9217, test_loss: 1.0403, test_f1: 0.5416
 epoch: 5, train_loss: 0.9066, test_loss: 1.0277, test_f1: 0.5552
 epoch: 6, train_loss: 0.8785, test_loss: 1.0226, test_f1: 0.5812
 epoch: 7, train_loss: 0.8981, test_loss: 1.0347, test_f1: 0.4999
 epoch: 8, train_loss: 0.8453, test_loss: 1.0532, test_f1: 0.5708
 epoch: 9, train_loss: 0.8367, test_loss: 1.0404, test_f1: 0.5361
 epoch: 10, train_loss: 0.8074, test_loss: 1.0176, test_f1: 0.5070
 epoch: 11, train_loss: 0.7998, test_loss: 1.0108, test_f1: 0.5580
 epoch: 12, train_loss: 0.7821, test_loss: 1.0320, test_f1: 0.5394
 epoch: 13, train_loss: 0.7663, test_loss: 1.0595, test_f1: 0.5559
 epoch: 14, train_loss: 0.7503, test_loss: 1.0485, test_f1: 0.5680
 epoch: 15, train_loss: 0.7475, test_loss: 1.0755, test_f1: 0.5359
 epoch: 16, train_loss: 0.7341, test_loss: 1.0647, test_f1: 0.5548
 epoch: 17, train_loss: 0.7196, test_loss: 1.0567, test_f1: 0.5690
 epoch: 18, train_loss: 0.7151, test_loss: 1.0554, test_f1: 0.5778
 epoch: 19, train_loss: 0.7169, test_loss: 1.0511, test_f1: 0.5373
 epoch: 20, train_loss: 0.6859, test_loss: 1.0406, test_f1: 0.6034
 epoch: 21, train_loss: 0.6841, test_loss: 1.0773, test_f1: 0.5652
 epoch: 22, train_loss: 0.6677, test_loss: 1.0722, test_f1: 0.5692
 epoch: 23, train_loss: 0.6461, test_loss: 1.0755, test_f1: 0.5672
 epoch: 24, train_loss: 0.6404, test_loss: 1.0974, test_f1: 0.5886
 epoch: 25, train_loss: 0.6410, test_loss: 1.1258, test_f1: 0.5639
 epoch: 26, train_loss: 0.6208, test_loss: 1.0804, test_f1: 0.5872
 epoch: 27, train_loss: 0.5904, test_loss: 1.1598, test_f1: 0.5519
 epoch: 28, train_loss: 0.5953, test_loss: 1.0954, test_f1: 0.6094
 epoch: 29, train_loss: 0.5940, test_loss: 1.2134, test_f1: 0.5696
 epoch: 30, train_loss: 0.5823, test_loss: 1.1634, test_f1: 0.5606
 epoch: 31, train_loss: 0.5780, test_loss: 1.2117, test_f1: 0.5777
 epoch: 32, train_loss: 0.5570, test_loss: 1.2033, test_f1: 0.5630
 epoch: 33, train_loss: 0.5383, test_loss: 1.1572, test_f1: 0.5897
 epoch: 34, train_loss: 0.5546, test_loss: 1.1624, test_f1: 0.6129
 epoch: 35, train_loss: 0.5337, test_loss: 1.2207, test_f1: 0.5775
 epoch: 36, train_loss: 0.5351, test_loss: 1.2259, test_f1: 0.5753
 epoch: 37, train_loss: 0.5436, test_loss: 1.1572, test_f1: 0.6318
 epoch: 38, train_loss: 0.5117, test_loss: 1.2153, test_f1: 0.6295
 epoch: 39, train_loss: 0.4924, test_loss: 1.2534, test_f1: 0.6143
 epoch: 40, train_loss: 0.4998, test_loss: 1.2549, test_f1: 0.6229
 epoch: 41, train_loss: 0.4829, test_loss: 1.2475, test_f1: 0.6243
 epoch: 42, train_loss: 0.5038, test_loss: 1.2541, test_f1: 0.6318
 epoch: 43, train_loss: 0.4595, test_loss: 1.3003, test_f1: 0.6072
 epoch: 44, train_loss: 0.4643, test_loss: 1.3771, test_f1: 0.6178
 epoch: 45, train_loss: 0.4537, test_loss: 1.3680, test_f1: 0.6177
 epoch: 46, train_loss: 0.4523, test_loss: 1.3431, test_f1: 0.6241
 epoch: 47, train_loss: 0.4594, test_loss: 1.4071, test_f1: 0.6268
 epoch: 48, train_loss: 0.4334, test_loss: 1.4077, test_f1: 0.6445
 epoch: 49, train_loss: 0.4130, test_loss: 1.4818, test_f1: 0.6033
 epoch: 50, train_loss: 0.4472, test_loss: 1.3352, test_f1: 0.6216
 epoch: 51, train_loss: 0.4141, test_loss: 1.4229, test_f1: 0.6274
 epoch: 52, train_loss: 0.3932, test_loss: 1.3948, test_f1: 0.6425
 epoch: 53, train_loss: 0.4072, test_loss: 1.4255, test_f1: 0.6242
 epoch: 54, train_loss: 0.3883, test_loss: 1.4591, test_f1: 0.6474
 epoch: 55, train_loss: 0.3870, test_loss: 1.4689, test_f1: 0.6430
 epoch: 56, train_loss: 0.3853, test_loss: 1.4831, test_f1: 0.6639
 epoch: 57, train_loss: 0.3561, test_loss: 1.5147, test_f1: 0.6303
 epoch: 58, train_loss: 0.3704, test_loss: 1.4841, test_f1: 0.6366
 epoch: 59, train_loss: 0.3667, test_loss: 1.5106, test_f1: 0.6364
 epoch: 60, train_loss: 0.3623, test_loss: 1.5784, test_f1: 0.6291
 epoch: 61, train_loss: 0.3642, test_loss: 1.5166, test_f1: 0.6244
 epoch: 62, train_loss: 0.3677, test_loss: 1.5202, test_f1: 0.6277
 epoch: 63, train_loss: 0.3455, test_loss: 1.5669, test_f1: 0.6453
 epoch: 64, train_loss: 0.3490, test_loss: 1.5748, test_f1: 0.6408
 epoch: 65, train_loss: 0.3259, test_loss: 1.6277, test_f1: 0.6102
 epoch: 66, train_loss: 0.3482, test_loss: 1.5670, test_f1: 0.6660
 epoch: 67, train_loss: 0.3327, test_loss: 1.5941, test_f1: 0.6045
 epoch: 68, train_loss: 0.3212, test_loss: 1.6078, test_f1: 0.6201
 epoch: 69, train_loss: 0.3266, test_loss: 1.6088, test_f1: 0.6376
 epoch: 70, train_loss: 0.3268, test_loss: 1.6133, test_f1: 0.6360
 epoch: 71, train_loss: 0.3353, test_loss: 1.6847, test_f1: 0.6151
 epoch: 72, train_loss: 0.3254, test_loss: 1.6671, test_f1: 0.6125
 epoch: 73, train_loss: 0.3358, test_loss: 1.6295, test_f1: 0.6174
 epoch: 74, train_loss: 0.3225, test_loss: 1.7009, test_f1: 0.6165
 epoch: 75, train_loss: 0.2996, test_loss: 1.7450, test_f1: 0.6262
 epoch: 76, train_loss: 0.3109, test_loss: 1.7577, test_f1: 0.6290
 epoch: 77, train_loss: 0.3040, test_loss: 1.7283, test_f1: 0.5954
 epoch: 78, train_loss: 0.2979, test_loss: 1.7177, test_f1: 0.6169
 epoch: 79, train_loss: 0.3017, test_loss: 1.7657, test_f1: 0.6318
 epoch: 80, train_loss: 0.2920, test_loss: 1.7780, test_f1: 0.6235
 epoch: 81, train_loss: 0.2827, test_loss: 1.7698, test_f1: 0.6112
 epoch: 82, train_loss: 0.3020, test_loss: 1.7588, test_f1: 0.6252
 epoch: 83, train_loss: 0.2881, test_loss: 1.8126, test_f1: 0.6270
 epoch: 84, train_loss: 0.2831, test_loss: 1.8230, test_f1: 0.6044
 epoch: 85, train_loss: 0.2772, test_loss: 1.8487, test_f1: 0.6439
 epoch: 86, train_loss: 0.2934, test_loss: 1.9146, test_f1: 0.5937
 epoch: 87, train_loss: 0.2781, test_loss: 1.9030, test_f1: 0.5875
 epoch: 88, train_loss: 0.2749, test_loss: 1.8487, test_f1: 0.6358
 epoch: 89, train_loss: 0.2654, test_loss: 1.9165, test_f1: 0.6053
 epoch: 90, train_loss: 0.2585, test_loss: 1.8532, test_f1: 0.6195
 epoch: 91, train_loss: 0.2808, test_loss: 1.9332, test_f1: 0.5798
 epoch: 92, train_loss: 0.2648, test_loss: 1.8295, test_f1: 0.6142
 epoch: 93, train_loss: 0.2648, test_loss: 1.9088, test_f1: 0.5825
 epoch: 94, train_loss: 0.2718, test_loss: 1.9298, test_f1: 0.6470
 epoch: 95, train_loss: 0.2718, test_loss: 1.9337, test_f1: 0.6003
 epoch: 96, train_loss: 0.2754, test_loss: 1.9699, test_f1: 0.5832
 epoch: 97, train_loss: 0.2561, test_loss: 2.0347, test_f1: 0.5786
 epoch: 98, train_loss: 0.2283, test_loss: 2.0346, test_f1: 0.5687
 epoch: 99, train_loss: 0.2465, test_loss: 2.0009, test_f1: 0.6077

Training completed in 598.58 seconds
Best F1: 0.6715 at epoch 65
Mean F1 across iterations: 0.6548  0.0129
========================FINAL RESULTS================================
FEGIN weighted F1: 0.6715  0.0129
python main.py --data ltspice_demos --representation component_pin_net --model FEGIN --layers 3 --hiddens 128 --batch_size 32 --lr 0.0001 --emb_size 128 --epochs 100 --save_appendix component_pin_net_L3_H128_BS32_LR0.0001_E128 --no_val
-----



STDERR:
  File "main.py", line 370, in <module>
    main()
  File "main.py", line 254, in main
    dataset = dataset_class(
  File "/home/philip/projects/ltspice_examples_code_repo/Circuit-Completion-Using-GNNs/component_classification_with_link_prediction_head/evaluation/FEGIN/kernel/circuit_datasets.py", line 15, in __init__
    self.data, self.slices = torch.load(self.processed_paths[0])
  File "/home/philip/.local/lib/python3.8/site-packages/torch/serialization.py", line 1040, in load
    warnings.warn(
  File "/usr/lib/python3.8/warnings.py", line 109, in _showwarnmsg
    sw(msg.message, msg.category, msg.filename, msg.lineno,
  File "main.py", line 47, in warn_with_traceback
    traceback.print_stack(file=log)
/home/philip/projects/ltspice_examples_code_repo/Circuit-Completion-Using-GNNs/component_classification_with_link_prediction_head/evaluation/FEGIN/kernel/circuit_datasets.py:15: FutureWarning: You are using `torch.load` with `weights_only=False` (the current default value), which uses the default pickle module implicitly. It is possible to construct malicious pickle data which will execute arbitrary code during unpickling (See https://github.com/pytorch/pytorch/blob/main/SECURITY.md#untrusted-models for more details). In a future release, the default value for `weights_only` will be flipped to `True`. This limits the functions that could be executed during unpickling. Arbitrary objects will no longer be allowed to be loaded via this mode unless they are explicitly allowlisted by the user via `torch.serialization.add_safe_globals`. We recommend you start setting `weights_only=True` for any use case where you don't have full control of the loaded file. Please open an issue on GitHub for any issues related to this experimental feature.
  self.data, self.slices = torch.load(self.processed_paths[0])
