STDOUT:
Results will be saved in /home/philip/projects/ltspice_examples_code_repo/Circuit-Completion-Using-GNNs/component_classification_with_link_prediction_head/evaluation/FEGIN/results/model_FEGIN_dataset_ltspice_demos
Command line input: python main.py --data ltspice_demos --representation component_component --model FEGIN --layers 4 --hiddens 128 --batch_size 128 --lr 0.0001 --emb_size 128 --epochs 100 --save_appendix component_component_L4_H128_BS128_LR0.0001_E128 --no_val
 is saved.
-----
ltspice_demos - FEGIN
Using 4 layers, 128 hidden units, h = 2
Loading component_component representation dataset
ENTERED
Training FEGIN on component_component representation
Train: 1565, Test: 383
##################ITERATION #0 ****************************************
 epoch: 0, train_loss: 1.3693, test_loss: 1.3646, test_f1: 0.2281
 epoch: 1, train_loss: 1.3527, test_loss: 1.3587, test_f1: 0.2281
 epoch: 2, train_loss: 1.3425, test_loss: 1.3507, test_f1: 0.2281
 epoch: 3, train_loss: 1.3300, test_loss: 1.3398, test_f1: 0.2281
 epoch: 4, train_loss: 1.3166, test_loss: 1.3265, test_f1: 0.2281
 epoch: 5, train_loss: 1.3010, test_loss: 1.3129, test_f1: 0.2281
 epoch: 6, train_loss: 1.2795, test_loss: 1.2963, test_f1: 0.2281
 epoch: 7, train_loss: 1.2582, test_loss: 1.2787, test_f1: 0.2281
 epoch: 8, train_loss: 1.2345, test_loss: 1.2636, test_f1: 0.2281
 epoch: 9, train_loss: 1.2071, test_loss: 1.2527, test_f1: 0.2270
 epoch: 10, train_loss: 1.1862, test_loss: 1.2434, test_f1: 0.2216
 epoch: 11, train_loss: 1.1684, test_loss: 1.2338, test_f1: 0.3040
 epoch: 12, train_loss: 1.1516, test_loss: 1.2270, test_f1: 0.3275
 epoch: 13, train_loss: 1.1354, test_loss: 1.2225, test_f1: 0.3332
 epoch: 14, train_loss: 1.1214, test_loss: 1.2115, test_f1: 0.4147
 epoch: 15, train_loss: 1.1076, test_loss: 1.2102, test_f1: 0.4213
 epoch: 16, train_loss: 1.0926, test_loss: 1.2028, test_f1: 0.4301
 epoch: 17, train_loss: 1.0769, test_loss: 1.2001, test_f1: 0.4488
 epoch: 18, train_loss: 1.0670, test_loss: 1.1877, test_f1: 0.4548
 epoch: 19, train_loss: 1.0555, test_loss: 1.1958, test_f1: 0.4624
 epoch: 20, train_loss: 1.0368, test_loss: 1.1939, test_f1: 0.4698
 epoch: 21, train_loss: 1.0250, test_loss: 1.1857, test_f1: 0.4821
 epoch: 22, train_loss: 1.0139, test_loss: 1.1871, test_f1: 0.4719
 epoch: 23, train_loss: 0.9993, test_loss: 1.1946, test_f1: 0.4755
 epoch: 24, train_loss: 0.9870, test_loss: 1.1885, test_f1: 0.4772
 epoch: 25, train_loss: 0.9719, test_loss: 1.1888, test_f1: 0.4702
 epoch: 26, train_loss: 0.9559, test_loss: 1.1885, test_f1: 0.4664
 epoch: 27, train_loss: 0.9468, test_loss: 1.1887, test_f1: 0.4847
 epoch: 28, train_loss: 0.9373, test_loss: 1.1902, test_f1: 0.4801
 epoch: 29, train_loss: 0.9248, test_loss: 1.2019, test_f1: 0.4680
 epoch: 30, train_loss: 0.9145, test_loss: 1.2177, test_f1: 0.4785
 epoch: 31, train_loss: 0.9050, test_loss: 1.1969, test_f1: 0.4779
 epoch: 32, train_loss: 0.8769, test_loss: 1.2274, test_f1: 0.4750
 epoch: 33, train_loss: 0.8896, test_loss: 1.2056, test_f1: 0.4937
 epoch: 34, train_loss: 0.8709, test_loss: 1.2225, test_f1: 0.4839
 epoch: 35, train_loss: 0.8576, test_loss: 1.2523, test_f1: 0.4851
 epoch: 36, train_loss: 0.8320, test_loss: 1.2629, test_f1: 0.4862
 epoch: 37, train_loss: 0.8279, test_loss: 1.2517, test_f1: 0.4918
 epoch: 38, train_loss: 0.8073, test_loss: 1.2809, test_f1: 0.4841
 epoch: 39, train_loss: 0.8006, test_loss: 1.2952, test_f1: 0.4967
 epoch: 40, train_loss: 0.7963, test_loss: 1.2737, test_f1: 0.4921
 epoch: 41, train_loss: 0.7785, test_loss: 1.3185, test_f1: 0.5185
 epoch: 42, train_loss: 0.7667, test_loss: 1.2773, test_f1: 0.5042
 epoch: 43, train_loss: 0.7583, test_loss: 1.2933, test_f1: 0.5170
 epoch: 44, train_loss: 0.7473, test_loss: 1.3855, test_f1: 0.5337
 epoch: 45, train_loss: 0.7333, test_loss: 1.3605, test_f1: 0.5415
 epoch: 46, train_loss: 0.7286, test_loss: 1.3499, test_f1: 0.5510
 epoch: 47, train_loss: 0.7245, test_loss: 1.4548, test_f1: 0.5364
 epoch: 48, train_loss: 0.7166, test_loss: 1.3764, test_f1: 0.5693
 epoch: 49, train_loss: 0.7086, test_loss: 1.3832, test_f1: 0.5394
 epoch: 50, train_loss: 0.6779, test_loss: 1.4108, test_f1: 0.5399
 epoch: 51, train_loss: 0.6666, test_loss: 1.3773, test_f1: 0.5666
 epoch: 52, train_loss: 0.6586, test_loss: 1.4045, test_f1: 0.5470
 epoch: 53, train_loss: 0.6650, test_loss: 1.4277, test_f1: 0.5648
 epoch: 54, train_loss: 0.6759, test_loss: 1.4008, test_f1: 0.5522
 epoch: 55, train_loss: 0.6680, test_loss: 1.3917, test_f1: 0.5613
 epoch: 56, train_loss: 0.6482, test_loss: 1.4053, test_f1: 0.5376
 epoch: 57, train_loss: 0.6373, test_loss: 1.4477, test_f1: 0.5772
 epoch: 58, train_loss: 0.6304, test_loss: 1.4727, test_f1: 0.5571
 epoch: 59, train_loss: 0.6301, test_loss: 1.4616, test_f1: 0.5454
 epoch: 60, train_loss: 0.6226, test_loss: 1.4348, test_f1: 0.5595
 epoch: 61, train_loss: 0.6133, test_loss: 1.5006, test_f1: 0.5504
 epoch: 62, train_loss: 0.6155, test_loss: 1.4736, test_f1: 0.5325
 epoch: 63, train_loss: 0.6127, test_loss: 1.4711, test_f1: 0.5530
 epoch: 64, train_loss: 0.5903, test_loss: 1.4909, test_f1: 0.5682
 epoch: 65, train_loss: 0.5977, test_loss: 1.5577, test_f1: 0.5604
 epoch: 66, train_loss: 0.5908, test_loss: 1.5703, test_f1: 0.5438
 epoch: 67, train_loss: 0.6054, test_loss: 1.5040, test_f1: 0.5427
 epoch: 68, train_loss: 0.5919, test_loss: 1.4948, test_f1: 0.5694
 epoch: 69, train_loss: 0.5831, test_loss: 1.5578, test_f1: 0.5562
 epoch: 70, train_loss: 0.5872, test_loss: 1.5544, test_f1: 0.5566
 epoch: 71, train_loss: 0.5770, test_loss: 1.5530, test_f1: 0.5479
 epoch: 72, train_loss: 0.5746, test_loss: 1.5780, test_f1: 0.5444
 epoch: 73, train_loss: 0.5760, test_loss: 1.5011, test_f1: 0.5694
 epoch: 74, train_loss: 0.5639, test_loss: 1.5701, test_f1: 0.5490
 epoch: 75, train_loss: 0.5643, test_loss: 1.6016, test_f1: 0.5556
 epoch: 76, train_loss: 0.5742, test_loss: 1.5330, test_f1: 0.5596
 epoch: 77, train_loss: 0.5645, test_loss: 1.5430, test_f1: 0.5493
 epoch: 78, train_loss: 0.5665, test_loss: 1.4932, test_f1: 0.5590
 epoch: 79, train_loss: 0.5502, test_loss: 1.5081, test_f1: 0.5558
 epoch: 80, train_loss: 0.5390, test_loss: 1.5393, test_f1: 0.5535
 epoch: 81, train_loss: 0.5319, test_loss: 1.5664, test_f1: 0.5640
 epoch: 82, train_loss: 0.5310, test_loss: 1.6001, test_f1: 0.5502
 epoch: 83, train_loss: 0.5710, test_loss: 1.6163, test_f1: 0.5663
 epoch: 84, train_loss: 0.5490, test_loss: 1.6225, test_f1: 0.5437
 epoch: 85, train_loss: 0.5504, test_loss: 1.5156, test_f1: 0.5594
 epoch: 86, train_loss: 0.5294, test_loss: 1.5729, test_f1: 0.5509
 epoch: 87, train_loss: 0.5319, test_loss: 1.5910, test_f1: 0.5533
 epoch: 88, train_loss: 0.5007, test_loss: 1.5371, test_f1: 0.5686
 epoch: 89, train_loss: 0.5275, test_loss: 1.5584, test_f1: 0.5381
 epoch: 90, train_loss: 0.5164, test_loss: 1.6306, test_f1: 0.5622
 epoch: 91, train_loss: 0.5152, test_loss: 1.5630, test_f1: 0.5710
 epoch: 92, train_loss: 0.5015, test_loss: 1.5960, test_f1: 0.5473
 epoch: 93, train_loss: 0.5002, test_loss: 1.6017, test_f1: 0.5368
 epoch: 94, train_loss: 0.5095, test_loss: 1.5772, test_f1: 0.5516
 epoch: 95, train_loss: 0.5057, test_loss: 1.5905, test_f1: 0.5484
 epoch: 96, train_loss: 0.5112, test_loss: 1.6179, test_f1: 0.5584
 epoch: 97, train_loss: 0.4871, test_loss: 1.7027, test_f1: 0.5498
 epoch: 98, train_loss: 0.4960, test_loss: 1.7149, test_f1: 0.5618
 epoch: 99, train_loss: 0.4889, test_loss: 1.7234, test_f1: 0.5387
##################ITERATION #1 ****************************************
 epoch: 0, train_loss: 1.3300, test_loss: 1.3475, test_f1: 0.2281
 epoch: 1, train_loss: 1.2772, test_loss: 1.3272, test_f1: 0.2404
 epoch: 2, train_loss: 1.2454, test_loss: 1.3082, test_f1: 0.2659
 epoch: 3, train_loss: 1.2203, test_loss: 1.2871, test_f1: 0.2630
 epoch: 4, train_loss: 1.1991, test_loss: 1.2737, test_f1: 0.2842
 epoch: 5, train_loss: 1.1788, test_loss: 1.2480, test_f1: 0.3700
 epoch: 6, train_loss: 1.1611, test_loss: 1.2370, test_f1: 0.3840
 epoch: 7, train_loss: 1.1465, test_loss: 1.2274, test_f1: 0.4181
 epoch: 8, train_loss: 1.1303, test_loss: 1.2181, test_f1: 0.4292
 epoch: 9, train_loss: 1.1134, test_loss: 1.2016, test_f1: 0.4340
 epoch: 10, train_loss: 1.0986, test_loss: 1.2013, test_f1: 0.4294
 epoch: 11, train_loss: 1.0811, test_loss: 1.1942, test_f1: 0.4363
 epoch: 12, train_loss: 1.0631, test_loss: 1.1885, test_f1: 0.4432
 epoch: 13, train_loss: 1.0506, test_loss: 1.1891, test_f1: 0.4388
 epoch: 14, train_loss: 1.0293, test_loss: 1.1841, test_f1: 0.4486
 epoch: 15, train_loss: 1.0210, test_loss: 1.1945, test_f1: 0.4609
 epoch: 16, train_loss: 1.0041, test_loss: 1.2001, test_f1: 0.4809
 epoch: 17, train_loss: 0.9880, test_loss: 1.1979, test_f1: 0.5000
 epoch: 18, train_loss: 0.9771, test_loss: 1.1869, test_f1: 0.4932
 epoch: 19, train_loss: 0.9604, test_loss: 1.1861, test_f1: 0.5110
 epoch: 20, train_loss: 0.9455, test_loss: 1.2052, test_f1: 0.4976
 epoch: 21, train_loss: 0.9258, test_loss: 1.2028, test_f1: 0.4964
 epoch: 22, train_loss: 0.9107, test_loss: 1.1915, test_f1: 0.5014
 epoch: 23, train_loss: 0.9002, test_loss: 1.2173, test_f1: 0.5215
 epoch: 24, train_loss: 0.8864, test_loss: 1.2395, test_f1: 0.4958
 epoch: 25, train_loss: 0.8818, test_loss: 1.2293, test_f1: 0.5265
 epoch: 26, train_loss: 0.8491, test_loss: 1.2607, test_f1: 0.5391
 epoch: 27, train_loss: 0.8330, test_loss: 1.2954, test_f1: 0.5324
 epoch: 28, train_loss: 0.8377, test_loss: 1.2837, test_f1: 0.5258
 epoch: 29, train_loss: 0.8151, test_loss: 1.2951, test_f1: 0.5193
 epoch: 30, train_loss: 0.8040, test_loss: 1.3471, test_f1: 0.5279
 epoch: 31, train_loss: 0.8002, test_loss: 1.3319, test_f1: 0.5209
 epoch: 32, train_loss: 0.7793, test_loss: 1.4244, test_f1: 0.5309
 epoch: 33, train_loss: 0.7648, test_loss: 1.3784, test_f1: 0.5261
 epoch: 34, train_loss: 0.7531, test_loss: 1.4430, test_f1: 0.5249
 epoch: 35, train_loss: 0.7365, test_loss: 1.4234, test_f1: 0.5277
 epoch: 36, train_loss: 0.7433, test_loss: 1.4758, test_f1: 0.5222
 epoch: 37, train_loss: 0.7119, test_loss: 1.4999, test_f1: 0.5301
 epoch: 38, train_loss: 0.7086, test_loss: 1.5442, test_f1: 0.5110
 epoch: 39, train_loss: 0.6955, test_loss: 1.5799, test_f1: 0.5192
 epoch: 40, train_loss: 0.6981, test_loss: 1.5561, test_f1: 0.5256
 epoch: 41, train_loss: 0.6782, test_loss: 1.5924, test_f1: 0.5271
 epoch: 42, train_loss: 0.6826, test_loss: 1.6151, test_f1: 0.5311
 epoch: 43, train_loss: 0.6764, test_loss: 1.6328, test_f1: 0.5377
 epoch: 44, train_loss: 0.6574, test_loss: 1.6124, test_f1: 0.5356
 epoch: 45, train_loss: 0.6405, test_loss: 1.6252, test_f1: 0.5380
 epoch: 46, train_loss: 0.6345, test_loss: 1.6783, test_f1: 0.5389
 epoch: 47, train_loss: 0.6230, test_loss: 1.6783, test_f1: 0.5416
 epoch: 48, train_loss: 0.6261, test_loss: 1.7639, test_f1: 0.5384
 epoch: 49, train_loss: 0.6174, test_loss: 1.7544, test_f1: 0.5336
 epoch: 50, train_loss: 0.6050, test_loss: 1.8222, test_f1: 0.5495
 epoch: 51, train_loss: 0.5956, test_loss: 1.8526, test_f1: 0.5274
 epoch: 52, train_loss: 0.5880, test_loss: 1.8170, test_f1: 0.5263
 epoch: 53, train_loss: 0.5757, test_loss: 1.8308, test_f1: 0.5435
 epoch: 54, train_loss: 0.5748, test_loss: 1.8557, test_f1: 0.5421
 epoch: 55, train_loss: 0.5808, test_loss: 1.9098, test_f1: 0.5359
 epoch: 56, train_loss: 0.5767, test_loss: 1.8943, test_f1: 0.5321
 epoch: 57, train_loss: 0.5632, test_loss: 1.8885, test_f1: 0.5254
 epoch: 58, train_loss: 0.5586, test_loss: 1.8372, test_f1: 0.5125
 epoch: 59, train_loss: 0.5442, test_loss: 1.9021, test_f1: 0.5308
 epoch: 60, train_loss: 0.5493, test_loss: 1.9233, test_f1: 0.5338
 epoch: 61, train_loss: 0.5430, test_loss: 1.9374, test_f1: 0.5197
 epoch: 62, train_loss: 0.5458, test_loss: 1.9588, test_f1: 0.5391
 epoch: 63, train_loss: 0.5360, test_loss: 2.0244, test_f1: 0.5316
 epoch: 64, train_loss: 0.5211, test_loss: 2.0673, test_f1: 0.5204
 epoch: 65, train_loss: 0.5319, test_loss: 2.0674, test_f1: 0.5206
 epoch: 66, train_loss: 0.5300, test_loss: 2.0880, test_f1: 0.5131
 epoch: 67, train_loss: 0.5262, test_loss: 2.1186, test_f1: 0.5023
 epoch: 68, train_loss: 0.5208, test_loss: 2.0994, test_f1: 0.5102
 epoch: 69, train_loss: 0.5115, test_loss: 2.0617, test_f1: 0.5128
 epoch: 70, train_loss: 0.5193, test_loss: 2.0673, test_f1: 0.5133
 epoch: 71, train_loss: 0.5097, test_loss: 2.1199, test_f1: 0.5240
 epoch: 72, train_loss: 0.4911, test_loss: 2.1042, test_f1: 0.5213
 epoch: 73, train_loss: 0.5090, test_loss: 2.1264, test_f1: 0.5237
 epoch: 74, train_loss: 0.4968, test_loss: 2.0954, test_f1: 0.5368
 epoch: 75, train_loss: 0.5098, test_loss: 2.1244, test_f1: 0.5158
 epoch: 76, train_loss: 0.5007, test_loss: 2.2158, test_f1: 0.5201
 epoch: 77, train_loss: 0.4892, test_loss: 2.2019, test_f1: 0.5026
 epoch: 78, train_loss: 0.4808, test_loss: 2.2394, test_f1: 0.5181
 epoch: 79, train_loss: 0.4723, test_loss: 2.2871, test_f1: 0.5131
 epoch: 80, train_loss: 0.4860, test_loss: 2.3366, test_f1: 0.5096
 epoch: 81, train_loss: 0.4810, test_loss: 2.2787, test_f1: 0.5288
 epoch: 82, train_loss: 0.4679, test_loss: 2.3176, test_f1: 0.5217
 epoch: 83, train_loss: 0.4831, test_loss: 2.2769, test_f1: 0.5103
 epoch: 84, train_loss: 0.4713, test_loss: 2.2571, test_f1: 0.5019
 epoch: 85, train_loss: 0.4639, test_loss: 2.3323, test_f1: 0.5045
 epoch: 86, train_loss: 0.4553, test_loss: 2.2580, test_f1: 0.5046
 epoch: 87, train_loss: 0.4471, test_loss: 2.3715, test_f1: 0.5181
 epoch: 88, train_loss: 0.4646, test_loss: 2.2991, test_f1: 0.5114
 epoch: 89, train_loss: 0.4494, test_loss: 2.3846, test_f1: 0.5151
 epoch: 90, train_loss: 0.4550, test_loss: 2.4333, test_f1: 0.5150
 epoch: 91, train_loss: 0.4700, test_loss: 2.3585, test_f1: 0.5165
 epoch: 92, train_loss: 0.4612, test_loss: 2.4141, test_f1: 0.5252
 epoch: 93, train_loss: 0.4626, test_loss: 2.3628, test_f1: 0.5175
 epoch: 94, train_loss: 0.4482, test_loss: 2.4263, test_f1: 0.5094
 epoch: 95, train_loss: 0.4502, test_loss: 2.4615, test_f1: 0.5221
 epoch: 96, train_loss: 0.4650, test_loss: 2.4144, test_f1: 0.5122
 epoch: 97, train_loss: 0.4479, test_loss: 2.3865, test_f1: 0.5039
 epoch: 98, train_loss: 0.4235, test_loss: 2.4690, test_f1: 0.5121
 epoch: 99, train_loss: 0.4322, test_loss: 2.5174, test_f1: 0.5149
##################ITERATION #2 ****************************************
 epoch: 0, train_loss: 1.2822, test_loss: 1.3345, test_f1: 0.2404
 epoch: 1, train_loss: 1.2266, test_loss: 1.3204, test_f1: 0.2549
 epoch: 2, train_loss: 1.1859, test_loss: 1.3014, test_f1: 0.2716
 epoch: 3, train_loss: 1.1829, test_loss: 1.2754, test_f1: 0.2668
 epoch: 4, train_loss: 1.1541, test_loss: 1.2463, test_f1: 0.3142
 epoch: 5, train_loss: 1.1335, test_loss: 1.2256, test_f1: 0.3698
 epoch: 6, train_loss: 1.1144, test_loss: 1.1987, test_f1: 0.3813
 epoch: 7, train_loss: 1.1014, test_loss: 1.1852, test_f1: 0.4060
 epoch: 8, train_loss: 1.0805, test_loss: 1.1760, test_f1: 0.4357
 epoch: 9, train_loss: 1.0669, test_loss: 1.1700, test_f1: 0.4572
 epoch: 10, train_loss: 1.0530, test_loss: 1.1661, test_f1: 0.4455
 epoch: 11, train_loss: 1.0229, test_loss: 1.1608, test_f1: 0.4868
 epoch: 12, train_loss: 1.0095, test_loss: 1.1536, test_f1: 0.5149
 epoch: 13, train_loss: 1.0140, test_loss: 1.1693, test_f1: 0.5050
 epoch: 14, train_loss: 0.9925, test_loss: 1.1388, test_f1: 0.5413
 epoch: 15, train_loss: 0.9751, test_loss: 1.1244, test_f1: 0.5209
 epoch: 16, train_loss: 0.9695, test_loss: 1.1177, test_f1: 0.5151
 epoch: 17, train_loss: 0.9512, test_loss: 1.1164, test_f1: 0.4983
 epoch: 18, train_loss: 0.9410, test_loss: 1.1197, test_f1: 0.5222
 epoch: 19, train_loss: 0.9187, test_loss: 1.1198, test_f1: 0.5280
 epoch: 20, train_loss: 0.9040, test_loss: 1.1246, test_f1: 0.5403
 epoch: 21, train_loss: 0.9023, test_loss: 1.1246, test_f1: 0.4902
 epoch: 22, train_loss: 0.9036, test_loss: 1.1096, test_f1: 0.5515
 epoch: 23, train_loss: 0.8768, test_loss: 1.1142, test_f1: 0.5192
 epoch: 24, train_loss: 0.8640, test_loss: 1.1078, test_f1: 0.5125
 epoch: 25, train_loss: 0.8557, test_loss: 1.0971, test_f1: 0.5433
 epoch: 26, train_loss: 0.8370, test_loss: 1.1001, test_f1: 0.5373
 epoch: 27, train_loss: 0.8367, test_loss: 1.1041, test_f1: 0.5514
 epoch: 28, train_loss: 0.8251, test_loss: 1.1210, test_f1: 0.5629
 epoch: 29, train_loss: 0.8129, test_loss: 1.1395, test_f1: 0.5100
 epoch: 30, train_loss: 0.7992, test_loss: 1.1148, test_f1: 0.5371
 epoch: 31, train_loss: 0.7932, test_loss: 1.1514, test_f1: 0.5121
 epoch: 32, train_loss: 0.7787, test_loss: 1.1342, test_f1: 0.5416
 epoch: 33, train_loss: 0.7728, test_loss: 1.1153, test_f1: 0.5197
 epoch: 34, train_loss: 0.7713, test_loss: 1.1089, test_f1: 0.5744
 epoch: 35, train_loss: 0.7552, test_loss: 1.1459, test_f1: 0.5306
 epoch: 36, train_loss: 0.7496, test_loss: 1.1353, test_f1: 0.5516
 epoch: 37, train_loss: 0.7488, test_loss: 1.1250, test_f1: 0.5574
 epoch: 38, train_loss: 0.7322, test_loss: 1.1325, test_f1: 0.5623
 epoch: 39, train_loss: 0.7186, test_loss: 1.1951, test_f1: 0.5278
 epoch: 40, train_loss: 0.7129, test_loss: 1.1628, test_f1: 0.5758
 epoch: 41, train_loss: 0.6988, test_loss: 1.1415, test_f1: 0.5816
 epoch: 42, train_loss: 0.6850, test_loss: 1.1359, test_f1: 0.5789
 epoch: 43, train_loss: 0.6848, test_loss: 1.1992, test_f1: 0.5635
 epoch: 44, train_loss: 0.6824, test_loss: 1.1861, test_f1: 0.5732
 epoch: 45, train_loss: 0.6552, test_loss: 1.1742, test_f1: 0.5844
 epoch: 46, train_loss: 0.6677, test_loss: 1.2104, test_f1: 0.5435
 epoch: 47, train_loss: 0.6428, test_loss: 1.2234, test_f1: 0.5409
 epoch: 48, train_loss: 0.6420, test_loss: 1.2053, test_f1: 0.5643
 epoch: 49, train_loss: 0.6388, test_loss: 1.2196, test_f1: 0.5617
 epoch: 50, train_loss: 0.6260, test_loss: 1.2640, test_f1: 0.5588
 epoch: 51, train_loss: 0.6117, test_loss: 1.2532, test_f1: 0.5611
 epoch: 52, train_loss: 0.6201, test_loss: 1.2515, test_f1: 0.5719
 epoch: 53, train_loss: 0.6139, test_loss: 1.2858, test_f1: 0.5293
 epoch: 54, train_loss: 0.6040, test_loss: 1.2516, test_f1: 0.5661
 epoch: 55, train_loss: 0.5933, test_loss: 1.2737, test_f1: 0.5687
 epoch: 56, train_loss: 0.5903, test_loss: 1.2811, test_f1: 0.5709
 epoch: 57, train_loss: 0.5921, test_loss: 1.2605, test_f1: 0.5630
 epoch: 58, train_loss: 0.5814, test_loss: 1.2881, test_f1: 0.5600
 epoch: 59, train_loss: 0.5857, test_loss: 1.2926, test_f1: 0.5667
 epoch: 60, train_loss: 0.5763, test_loss: 1.3185, test_f1: 0.5649
 epoch: 61, train_loss: 0.5849, test_loss: 1.3074, test_f1: 0.5695
 epoch: 62, train_loss: 0.5826, test_loss: 1.2904, test_f1: 0.5749
 epoch: 63, train_loss: 0.5685, test_loss: 1.2986, test_f1: 0.5729
 epoch: 64, train_loss: 0.5564, test_loss: 1.3072, test_f1: 0.5643
 epoch: 65, train_loss: 0.5419, test_loss: 1.3190, test_f1: 0.5401
 epoch: 66, train_loss: 0.5347, test_loss: 1.3606, test_f1: 0.5503
 epoch: 67, train_loss: 0.5546, test_loss: 1.3587, test_f1: 0.5497
 epoch: 68, train_loss: 0.5364, test_loss: 1.3470, test_f1: 0.5635
 epoch: 69, train_loss: 0.5547, test_loss: 1.3344, test_f1: 0.5788
 epoch: 70, train_loss: 0.5411, test_loss: 1.3634, test_f1: 0.5426
 epoch: 71, train_loss: 0.5320, test_loss: 1.3699, test_f1: 0.5557
 epoch: 72, train_loss: 0.5183, test_loss: 1.3566, test_f1: 0.5420
 epoch: 73, train_loss: 0.5255, test_loss: 1.3786, test_f1: 0.5590
 epoch: 74, train_loss: 0.5155, test_loss: 1.3626, test_f1: 0.5652
 epoch: 75, train_loss: 0.5093, test_loss: 1.4393, test_f1: 0.5690
 epoch: 76, train_loss: 0.5167, test_loss: 1.4782, test_f1: 0.5607
 epoch: 77, train_loss: 0.5260, test_loss: 1.4254, test_f1: 0.5693
 epoch: 78, train_loss: 0.5243, test_loss: 1.3983, test_f1: 0.5590
 epoch: 79, train_loss: 0.5061, test_loss: 1.4183, test_f1: 0.5624
 epoch: 80, train_loss: 0.5031, test_loss: 1.4710, test_f1: 0.5634
 epoch: 81, train_loss: 0.4967, test_loss: 1.5002, test_f1: 0.5550
 epoch: 82, train_loss: 0.5047, test_loss: 1.4719, test_f1: 0.5432
 epoch: 83, train_loss: 0.5007, test_loss: 1.5033, test_f1: 0.5713
 epoch: 84, train_loss: 0.4778, test_loss: 1.4756, test_f1: 0.5620
 epoch: 85, train_loss: 0.4918, test_loss: 1.4683, test_f1: 0.5510
 epoch: 86, train_loss: 0.4970, test_loss: 1.4616, test_f1: 0.5802
 epoch: 87, train_loss: 0.4929, test_loss: 1.4611, test_f1: 0.5757
 epoch: 88, train_loss: 0.4841, test_loss: 1.4733, test_f1: 0.5627
 epoch: 89, train_loss: 0.4809, test_loss: 1.5628, test_f1: 0.5686
 epoch: 90, train_loss: 0.4915, test_loss: 1.4840, test_f1: 0.5735
 epoch: 91, train_loss: 0.4782, test_loss: 1.5028, test_f1: 0.5611
 epoch: 92, train_loss: 0.4752, test_loss: 1.5575, test_f1: 0.5637
 epoch: 93, train_loss: 0.4988, test_loss: 1.5495, test_f1: 0.5773
 epoch: 94, train_loss: 0.4647, test_loss: 1.5602, test_f1: 0.5869
 epoch: 95, train_loss: 0.4705, test_loss: 1.5142, test_f1: 0.5781
 epoch: 96, train_loss: 0.4748, test_loss: 1.5124, test_f1: 0.5761
 epoch: 97, train_loss: 0.4569, test_loss: 1.5569, test_f1: 0.5748
 epoch: 98, train_loss: 0.4513, test_loss: 1.5675, test_f1: 0.5728
 epoch: 99, train_loss: 0.4538, test_loss: 1.5214, test_f1: 0.5794
##################ITERATION #3 ****************************************
 epoch: 0, train_loss: 1.2540, test_loss: 1.3372, test_f1: 0.2630
 epoch: 1, train_loss: 1.1805, test_loss: 1.3155, test_f1: 0.2549
 epoch: 2, train_loss: 1.1744, test_loss: 1.2742, test_f1: 0.2932
 epoch: 3, train_loss: 1.1491, test_loss: 1.2384, test_f1: 0.3571
 epoch: 4, train_loss: 1.1247, test_loss: 1.2213, test_f1: 0.3829
 epoch: 5, train_loss: 1.1014, test_loss: 1.2033, test_f1: 0.4098
 epoch: 6, train_loss: 1.0812, test_loss: 1.1840, test_f1: 0.4249
 epoch: 7, train_loss: 1.0656, test_loss: 1.1721, test_f1: 0.4467
 epoch: 8, train_loss: 1.0487, test_loss: 1.1743, test_f1: 0.4243
 epoch: 9, train_loss: 1.0343, test_loss: 1.1902, test_f1: 0.4205
 epoch: 10, train_loss: 1.0245, test_loss: 1.1954, test_f1: 0.4478
 epoch: 11, train_loss: 1.0056, test_loss: 1.1725, test_f1: 0.4689
 epoch: 12, train_loss: 0.9971, test_loss: 1.1824, test_f1: 0.4876
 epoch: 13, train_loss: 0.9804, test_loss: 1.1827, test_f1: 0.4712
 epoch: 14, train_loss: 0.9688, test_loss: 1.1959, test_f1: 0.4463
 epoch: 15, train_loss: 0.9486, test_loss: 1.1655, test_f1: 0.4902
 epoch: 16, train_loss: 0.9323, test_loss: 1.1649, test_f1: 0.5073
 epoch: 17, train_loss: 0.9170, test_loss: 1.1758, test_f1: 0.5123
 epoch: 18, train_loss: 0.9218, test_loss: 1.1759, test_f1: 0.5075
 epoch: 19, train_loss: 0.9020, test_loss: 1.1658, test_f1: 0.5172
 epoch: 20, train_loss: 0.8885, test_loss: 1.1599, test_f1: 0.5301
 epoch: 21, train_loss: 0.8839, test_loss: 1.1648, test_f1: 0.5617
 epoch: 22, train_loss: 0.8637, test_loss: 1.1615, test_f1: 0.5471
 epoch: 23, train_loss: 0.8665, test_loss: 1.1524, test_f1: 0.5512
 epoch: 24, train_loss: 0.8603, test_loss: 1.1825, test_f1: 0.5648
 epoch: 25, train_loss: 0.8289, test_loss: 1.2271, test_f1: 0.5394
 epoch: 26, train_loss: 0.8264, test_loss: 1.2092, test_f1: 0.5449
 epoch: 27, train_loss: 0.8167, test_loss: 1.2234, test_f1: 0.5735
 epoch: 28, train_loss: 0.8145, test_loss: 1.2220, test_f1: 0.5787
 epoch: 29, train_loss: 0.7915, test_loss: 1.2291, test_f1: 0.5879
 epoch: 30, train_loss: 0.7863, test_loss: 1.1989, test_f1: 0.5800
 epoch: 31, train_loss: 0.7737, test_loss: 1.2551, test_f1: 0.5054
 epoch: 32, train_loss: 0.7645, test_loss: 1.2268, test_f1: 0.5734
 epoch: 33, train_loss: 0.7364, test_loss: 1.2511, test_f1: 0.5852
 epoch: 34, train_loss: 0.7588, test_loss: 1.1922, test_f1: 0.5857
 epoch: 35, train_loss: 0.7469, test_loss: 1.2365, test_f1: 0.5785
 epoch: 36, train_loss: 0.7340, test_loss: 1.2376, test_f1: 0.5778
 epoch: 37, train_loss: 0.7216, test_loss: 1.2368, test_f1: 0.5827
 epoch: 38, train_loss: 0.7255, test_loss: 1.3033, test_f1: 0.6087
 epoch: 39, train_loss: 0.7028, test_loss: 1.2939, test_f1: 0.6021
 epoch: 40, train_loss: 0.6862, test_loss: 1.2440, test_f1: 0.5783
 epoch: 41, train_loss: 0.6779, test_loss: 1.2777, test_f1: 0.5732
 epoch: 42, train_loss: 0.6854, test_loss: 1.3105, test_f1: 0.5658
 epoch: 43, train_loss: 0.6707, test_loss: 1.3531, test_f1: 0.5652
 epoch: 44, train_loss: 0.6648, test_loss: 1.3201, test_f1: 0.5945
 epoch: 45, train_loss: 0.6750, test_loss: 1.4490, test_f1: 0.5215
 epoch: 46, train_loss: 0.6645, test_loss: 1.3256, test_f1: 0.5920
 epoch: 47, train_loss: 0.6590, test_loss: 1.3267, test_f1: 0.5779
 epoch: 48, train_loss: 0.6333, test_loss: 1.3258, test_f1: 0.5955
 epoch: 49, train_loss: 0.6396, test_loss: 1.3301, test_f1: 0.5855
 epoch: 50, train_loss: 0.6186, test_loss: 1.4470, test_f1: 0.5940
 epoch: 51, train_loss: 0.6034, test_loss: 1.4785, test_f1: 0.5836
 epoch: 52, train_loss: 0.5940, test_loss: 1.5144, test_f1: 0.5679
 epoch: 53, train_loss: 0.6014, test_loss: 1.4777, test_f1: 0.5702
 epoch: 54, train_loss: 0.5924, test_loss: 1.4207, test_f1: 0.5613
 epoch: 55, train_loss: 0.5973, test_loss: 1.4272, test_f1: 0.5707
 epoch: 56, train_loss: 0.5864, test_loss: 1.4332, test_f1: 0.5599
 epoch: 57, train_loss: 0.5922, test_loss: 1.4095, test_f1: 0.5541
 epoch: 58, train_loss: 0.5702, test_loss: 1.4269, test_f1: 0.5570
 epoch: 59, train_loss: 0.5846, test_loss: 1.4827, test_f1: 0.5281
 epoch: 60, train_loss: 0.5979, test_loss: 1.4628, test_f1: 0.5960
 epoch: 61, train_loss: 0.5669, test_loss: 1.4450, test_f1: 0.5740
 epoch: 62, train_loss: 0.5539, test_loss: 1.4599, test_f1: 0.5622
 epoch: 63, train_loss: 0.5455, test_loss: 1.5079, test_f1: 0.5629
 epoch: 64, train_loss: 0.5415, test_loss: 1.5301, test_f1: 0.5510
 epoch: 65, train_loss: 0.5510, test_loss: 1.5696, test_f1: 0.5593
 epoch: 66, train_loss: 0.5544, test_loss: 1.5215, test_f1: 0.5389
 epoch: 67, train_loss: 0.5411, test_loss: 1.5332, test_f1: 0.5755
 epoch: 68, train_loss: 0.5416, test_loss: 1.5344, test_f1: 0.5377
 epoch: 69, train_loss: 0.5302, test_loss: 1.5472, test_f1: 0.5562
 epoch: 70, train_loss: 0.5373, test_loss: 1.5493, test_f1: 0.5509
 epoch: 71, train_loss: 0.5347, test_loss: 1.5788, test_f1: 0.5336
 epoch: 72, train_loss: 0.5133, test_loss: 1.6053, test_f1: 0.5546
 epoch: 73, train_loss: 0.5234, test_loss: 1.5978, test_f1: 0.5565
 epoch: 74, train_loss: 0.5076, test_loss: 1.5655, test_f1: 0.5557
 epoch: 75, train_loss: 0.5183, test_loss: 1.5473, test_f1: 0.5554
 epoch: 76, train_loss: 0.5075, test_loss: 1.5682, test_f1: 0.5456
 epoch: 77, train_loss: 0.5085, test_loss: 1.5356, test_f1: 0.5522
 epoch: 78, train_loss: 0.5253, test_loss: 1.5655, test_f1: 0.5335
 epoch: 79, train_loss: 0.5039, test_loss: 1.5843, test_f1: 0.5560
 epoch: 80, train_loss: 0.5063, test_loss: 1.6135, test_f1: 0.5403
 epoch: 81, train_loss: 0.5127, test_loss: 1.6736, test_f1: 0.5506
 epoch: 82, train_loss: 0.5233, test_loss: 1.6384, test_f1: 0.5369
 epoch: 83, train_loss: 0.5022, test_loss: 1.6222, test_f1: 0.5507
 epoch: 84, train_loss: 0.4991, test_loss: 1.6495, test_f1: 0.5677
 epoch: 85, train_loss: 0.4832, test_loss: 1.6767, test_f1: 0.5332
 epoch: 86, train_loss: 0.4941, test_loss: 1.6435, test_f1: 0.5392
 epoch: 87, train_loss: 0.4909, test_loss: 1.6792, test_f1: 0.5459
 epoch: 88, train_loss: 0.4810, test_loss: 1.6895, test_f1: 0.5508
 epoch: 89, train_loss: 0.4617, test_loss: 1.6949, test_f1: 0.5490
 epoch: 90, train_loss: 0.4793, test_loss: 1.7218, test_f1: 0.5508
 epoch: 91, train_loss: 0.4927, test_loss: 1.7057, test_f1: 0.5503
 epoch: 92, train_loss: 0.4681, test_loss: 1.7191, test_f1: 0.5514
 epoch: 93, train_loss: 0.4826, test_loss: 1.7317, test_f1: 0.5566
 epoch: 94, train_loss: 0.4631, test_loss: 1.7028, test_f1: 0.5471
 epoch: 95, train_loss: 0.4751, test_loss: 1.7407, test_f1: 0.5616
 epoch: 96, train_loss: 0.4561, test_loss: 1.7760, test_f1: 0.5596
 epoch: 97, train_loss: 0.4536, test_loss: 1.7528, test_f1: 0.5699
 epoch: 98, train_loss: 0.4548, test_loss: 1.7963, test_f1: 0.5742
 epoch: 99, train_loss: 0.4453, test_loss: 1.7417, test_f1: 0.5598
##################ITERATION #4 ****************************************
 epoch: 0, train_loss: 1.2801, test_loss: 1.3192, test_f1: 0.2281
 epoch: 1, train_loss: 1.1948, test_loss: 1.3022, test_f1: 0.2270
 epoch: 2, train_loss: 1.1488, test_loss: 1.2796, test_f1: 0.2386
 epoch: 3, train_loss: 1.1396, test_loss: 1.2213, test_f1: 0.3567
 epoch: 4, train_loss: 1.1069, test_loss: 1.1941, test_f1: 0.3863
 epoch: 5, train_loss: 1.0816, test_loss: 1.1796, test_f1: 0.4132
 epoch: 6, train_loss: 1.0728, test_loss: 1.1639, test_f1: 0.4086
 epoch: 7, train_loss: 1.0553, test_loss: 1.2014, test_f1: 0.4212
 epoch: 8, train_loss: 1.0341, test_loss: 1.1988, test_f1: 0.4733
 epoch: 9, train_loss: 1.0125, test_loss: 1.1479, test_f1: 0.5041
 epoch: 10, train_loss: 0.9912, test_loss: 1.1340, test_f1: 0.5049
 epoch: 11, train_loss: 0.9799, test_loss: 1.1433, test_f1: 0.5014
 epoch: 12, train_loss: 0.9844, test_loss: 1.1420, test_f1: 0.4897
 epoch: 13, train_loss: 0.9510, test_loss: 1.1256, test_f1: 0.4935
 epoch: 14, train_loss: 0.9436, test_loss: 1.1123, test_f1: 0.5200
 epoch: 15, train_loss: 0.9343, test_loss: 1.1397, test_f1: 0.5097
 epoch: 16, train_loss: 0.9044, test_loss: 1.1384, test_f1: 0.4936
 epoch: 17, train_loss: 0.8937, test_loss: 1.1306, test_f1: 0.5415
 epoch: 18, train_loss: 0.8786, test_loss: 1.1301, test_f1: 0.5314
 epoch: 19, train_loss: 0.8704, test_loss: 1.1819, test_f1: 0.5564
 epoch: 20, train_loss: 0.8704, test_loss: 1.1848, test_f1: 0.5553
 epoch: 21, train_loss: 0.8472, test_loss: 1.1804, test_f1: 0.5470
 epoch: 22, train_loss: 0.8305, test_loss: 1.1612, test_f1: 0.5609
 epoch: 23, train_loss: 0.8223, test_loss: 1.1500, test_f1: 0.5226
 epoch: 24, train_loss: 0.7960, test_loss: 1.1634, test_f1: 0.5211
 epoch: 25, train_loss: 0.8022, test_loss: 1.1532, test_f1: 0.5497
 epoch: 26, train_loss: 0.7933, test_loss: 1.1766, test_f1: 0.5372
 epoch: 27, train_loss: 0.7729, test_loss: 1.1925, test_f1: 0.5560
 epoch: 28, train_loss: 0.7652, test_loss: 1.3269, test_f1: 0.5714
 epoch: 29, train_loss: 0.7599, test_loss: 1.3095, test_f1: 0.5601
 epoch: 30, train_loss: 0.7267, test_loss: 1.2411, test_f1: 0.5376
 epoch: 31, train_loss: 0.7351, test_loss: 1.2790, test_f1: 0.5873
 epoch: 32, train_loss: 0.7196, test_loss: 1.3950, test_f1: 0.5760
 epoch: 33, train_loss: 0.7201, test_loss: 1.2992, test_f1: 0.5657
 epoch: 34, train_loss: 0.7088, test_loss: 1.2655, test_f1: 0.5176
 epoch: 35, train_loss: 0.6903, test_loss: 1.3001, test_f1: 0.5626
 epoch: 36, train_loss: 0.6713, test_loss: 1.2661, test_f1: 0.5608
 epoch: 37, train_loss: 0.6821, test_loss: 1.2198, test_f1: 0.5787
 epoch: 38, train_loss: 0.6567, test_loss: 1.2360, test_f1: 0.5598
 epoch: 39, train_loss: 0.6431, test_loss: 1.3168, test_f1: 0.5455
 epoch: 40, train_loss: 0.6498, test_loss: 1.3135, test_f1: 0.5980
 epoch: 41, train_loss: 0.6281, test_loss: 1.2965, test_f1: 0.5609
 epoch: 42, train_loss: 0.6326, test_loss: 1.3657, test_f1: 0.5671
 epoch: 43, train_loss: 0.6328, test_loss: 1.3778, test_f1: 0.5781
 epoch: 44, train_loss: 0.6176, test_loss: 1.3557, test_f1: 0.5651
 epoch: 45, train_loss: 0.6014, test_loss: 1.4308, test_f1: 0.5588
 epoch: 46, train_loss: 0.5882, test_loss: 1.5055, test_f1: 0.5479
 epoch: 47, train_loss: 0.5938, test_loss: 1.5385, test_f1: 0.5694
 epoch: 48, train_loss: 0.5686, test_loss: 1.5300, test_f1: 0.5739
 epoch: 49, train_loss: 0.5752, test_loss: 1.5654, test_f1: 0.5619
 epoch: 50, train_loss: 0.5554, test_loss: 1.6395, test_f1: 0.5631
 epoch: 51, train_loss: 0.5449, test_loss: 1.7557, test_f1: 0.5572
 epoch: 52, train_loss: 0.5612, test_loss: 1.8685, test_f1: 0.5661
 epoch: 53, train_loss: 0.5231, test_loss: 2.0521, test_f1: 0.5645
 epoch: 54, train_loss: 0.5092, test_loss: 1.9400, test_f1: 0.5514
 epoch: 55, train_loss: 0.5179, test_loss: 1.9747, test_f1: 0.5662
 epoch: 56, train_loss: 0.5150, test_loss: 2.1835, test_f1: 0.5410
 epoch: 57, train_loss: 0.5235, test_loss: 1.9572, test_f1: 0.5578
 epoch: 58, train_loss: 0.5246, test_loss: 2.0459, test_f1: 0.5501
 epoch: 59, train_loss: 0.5141, test_loss: 1.8636, test_f1: 0.5607
 epoch: 60, train_loss: 0.4867, test_loss: 1.8088, test_f1: 0.5608
 epoch: 61, train_loss: 0.4815, test_loss: 2.0048, test_f1: 0.5538
 epoch: 62, train_loss: 0.4873, test_loss: 1.8546, test_f1: 0.5339
 epoch: 63, train_loss: 0.4784, test_loss: 1.7796, test_f1: 0.5481
 epoch: 64, train_loss: 0.4844, test_loss: 1.7878, test_f1: 0.5555
 epoch: 65, train_loss: 0.4952, test_loss: 1.8651, test_f1: 0.5538
 epoch: 66, train_loss: 0.4845, test_loss: 1.9156, test_f1: 0.5528
 epoch: 67, train_loss: 0.4684, test_loss: 1.7724, test_f1: 0.5613
 epoch: 68, train_loss: 0.4858, test_loss: 1.7678, test_f1: 0.5521
 epoch: 69, train_loss: 0.4777, test_loss: 1.9004, test_f1: 0.5546
 epoch: 70, train_loss: 0.4689, test_loss: 1.9401, test_f1: 0.5554
 epoch: 71, train_loss: 0.4728, test_loss: 1.8754, test_f1: 0.5516
 epoch: 72, train_loss: 0.4875, test_loss: 1.9340, test_f1: 0.5548
 epoch: 73, train_loss: 0.4730, test_loss: 1.9193, test_f1: 0.5497
 epoch: 74, train_loss: 0.4581, test_loss: 1.9292, test_f1: 0.5605
 epoch: 75, train_loss: 0.4579, test_loss: 1.9882, test_f1: 0.5559
 epoch: 76, train_loss: 0.4375, test_loss: 1.9696, test_f1: 0.5677
 epoch: 77, train_loss: 0.4550, test_loss: 1.9490, test_f1: 0.5721
 epoch: 78, train_loss: 0.4329, test_loss: 1.8549, test_f1: 0.5554
 epoch: 79, train_loss: 0.4587, test_loss: 1.8170, test_f1: 0.5578
 epoch: 80, train_loss: 0.4452, test_loss: 1.7766, test_f1: 0.5642
 epoch: 81, train_loss: 0.4471, test_loss: 1.8632, test_f1: 0.5569
 epoch: 82, train_loss: 0.4629, test_loss: 1.8979, test_f1: 0.5542
 epoch: 83, train_loss: 0.4316, test_loss: 1.9819, test_f1: 0.5516
 epoch: 84, train_loss: 0.4265, test_loss: 2.0225, test_f1: 0.5481
 epoch: 85, train_loss: 0.4082, test_loss: 2.0895, test_f1: 0.5592
 epoch: 86, train_loss: 0.4112, test_loss: 2.1843, test_f1: 0.5584
 epoch: 87, train_loss: 0.4019, test_loss: 2.2637, test_f1: 0.5624
 epoch: 88, train_loss: 0.4379, test_loss: 2.2361, test_f1: 0.5638
 epoch: 89, train_loss: 0.4200, test_loss: 2.2043, test_f1: 0.5584
 epoch: 90, train_loss: 0.4212, test_loss: 2.2177, test_f1: 0.5522
 epoch: 91, train_loss: 0.4205, test_loss: 2.1984, test_f1: 0.5686
 epoch: 92, train_loss: 0.4185, test_loss: 2.2534, test_f1: 0.5627
 epoch: 93, train_loss: 0.4234, test_loss: 2.1059, test_f1: 0.5562
 epoch: 94, train_loss: 0.4129, test_loss: 2.1245, test_f1: 0.5631
 epoch: 95, train_loss: 0.4014, test_loss: 2.1294, test_f1: 0.5658
 epoch: 96, train_loss: 0.4237, test_loss: 2.1680, test_f1: 0.5578
 epoch: 97, train_loss: 0.3857, test_loss: 2.1172, test_f1: 0.5555
 epoch: 98, train_loss: 0.3887, test_loss: 2.1730, test_f1: 0.5335
 epoch: 99, train_loss: 0.4242, test_loss: 2.2608, test_f1: 0.5692
##################ITERATION #5 ****************************************
 epoch: 0, train_loss: 1.2837, test_loss: 1.3172, test_f1: 0.2674
 epoch: 1, train_loss: 1.2127, test_loss: 1.3014, test_f1: 0.2731
 epoch: 2, train_loss: 1.1793, test_loss: 1.2808, test_f1: 0.2828
 epoch: 3, train_loss: 1.1504, test_loss: 1.2515, test_f1: 0.3845
 epoch: 4, train_loss: 1.1314, test_loss: 1.2333, test_f1: 0.4023
 epoch: 5, train_loss: 1.1121, test_loss: 1.2637, test_f1: 0.4282
 epoch: 6, train_loss: 1.0911, test_loss: 1.2500, test_f1: 0.4635
 epoch: 7, train_loss: 1.0602, test_loss: 1.2208, test_f1: 0.4873
 epoch: 8, train_loss: 1.0448, test_loss: 1.3138, test_f1: 0.5010
 epoch: 9, train_loss: 1.0204, test_loss: 1.2858, test_f1: 0.5213
 epoch: 10, train_loss: 1.0095, test_loss: 1.2403, test_f1: 0.5395
 epoch: 11, train_loss: 1.0003, test_loss: 1.2023, test_f1: 0.5215
 epoch: 12, train_loss: 0.9794, test_loss: 1.2401, test_f1: 0.5086
 epoch: 13, train_loss: 0.9578, test_loss: 1.2714, test_f1: 0.5238
 epoch: 14, train_loss: 0.9460, test_loss: 1.3288, test_f1: 0.5339
 epoch: 15, train_loss: 0.9362, test_loss: 1.2612, test_f1: 0.5447
 epoch: 16, train_loss: 0.9411, test_loss: 1.4448, test_f1: 0.5467
 epoch: 17, train_loss: 0.9209, test_loss: 1.3041, test_f1: 0.5598
 epoch: 18, train_loss: 0.9091, test_loss: 1.2866, test_f1: 0.5621
 epoch: 19, train_loss: 0.8866, test_loss: 1.3430, test_f1: 0.5728
 epoch: 20, train_loss: 0.8819, test_loss: 1.2900, test_f1: 0.5735
 epoch: 21, train_loss: 0.8853, test_loss: 1.2885, test_f1: 0.5737
 epoch: 22, train_loss: 0.8629, test_loss: 1.3431, test_f1: 0.5715
 epoch: 23, train_loss: 0.8570, test_loss: 1.2740, test_f1: 0.5843
 epoch: 24, train_loss: 0.8567, test_loss: 1.3725, test_f1: 0.5502
 epoch: 25, train_loss: 0.8292, test_loss: 1.3960, test_f1: 0.5841
 epoch: 26, train_loss: 0.8218, test_loss: 1.2052, test_f1: 0.6085
 epoch: 27, train_loss: 0.8051, test_loss: 1.2530, test_f1: 0.5923
 epoch: 28, train_loss: 0.7926, test_loss: 1.2797, test_f1: 0.5648
 epoch: 29, train_loss: 0.7769, test_loss: 1.2877, test_f1: 0.5539
 epoch: 30, train_loss: 0.7883, test_loss: 1.2849, test_f1: 0.5828
 epoch: 31, train_loss: 0.7812, test_loss: 1.2213, test_f1: 0.5829
 epoch: 32, train_loss: 0.7495, test_loss: 1.3346, test_f1: 0.5670
 epoch: 33, train_loss: 0.7499, test_loss: 1.4178, test_f1: 0.5721
 epoch: 34, train_loss: 0.7386, test_loss: 1.2819, test_f1: 0.5945
 epoch: 35, train_loss: 0.7461, test_loss: 1.2361, test_f1: 0.5984
 epoch: 36, train_loss: 0.7339, test_loss: 1.1470, test_f1: 0.5907
 epoch: 37, train_loss: 0.7139, test_loss: 1.1582, test_f1: 0.5940
 epoch: 38, train_loss: 0.7031, test_loss: 1.2443, test_f1: 0.5790
 epoch: 39, train_loss: 0.6830, test_loss: 1.2285, test_f1: 0.5797
 epoch: 40, train_loss: 0.6910, test_loss: 1.2298, test_f1: 0.5766
 epoch: 41, train_loss: 0.6715, test_loss: 1.2205, test_f1: 0.5842
 epoch: 42, train_loss: 0.6581, test_loss: 1.2307, test_f1: 0.6090
 epoch: 43, train_loss: 0.6643, test_loss: 1.2773, test_f1: 0.6032
 epoch: 44, train_loss: 0.6734, test_loss: 1.2384, test_f1: 0.5976
 epoch: 45, train_loss: 0.6406, test_loss: 1.1705, test_f1: 0.5811
 epoch: 46, train_loss: 0.6455, test_loss: 1.1670, test_f1: 0.5846
 epoch: 47, train_loss: 0.6393, test_loss: 1.2044, test_f1: 0.6002
 epoch: 48, train_loss: 0.6246, test_loss: 1.2157, test_f1: 0.5614
 epoch: 49, train_loss: 0.6169, test_loss: 1.3441, test_f1: 0.5840
 epoch: 50, train_loss: 0.6294, test_loss: 1.4299, test_f1: 0.5876
 epoch: 51, train_loss: 0.6047, test_loss: 1.2008, test_f1: 0.5713
 epoch: 52, train_loss: 0.6047, test_loss: 1.2312, test_f1: 0.5767
 epoch: 53, train_loss: 0.6047, test_loss: 1.2162, test_f1: 0.5580
 epoch: 54, train_loss: 0.5900, test_loss: 1.1984, test_f1: 0.5538
 epoch: 55, train_loss: 0.5926, test_loss: 1.2314, test_f1: 0.5678
 epoch: 56, train_loss: 0.5736, test_loss: 1.2450, test_f1: 0.5918
 epoch: 57, train_loss: 0.5739, test_loss: 1.2430, test_f1: 0.5648
 epoch: 58, train_loss: 0.5645, test_loss: 1.2687, test_f1: 0.5760
 epoch: 59, train_loss: 0.5647, test_loss: 1.3166, test_f1: 0.5570
 epoch: 60, train_loss: 0.5575, test_loss: 1.2612, test_f1: 0.5699
 epoch: 61, train_loss: 0.5663, test_loss: 1.2693, test_f1: 0.5660
 epoch: 62, train_loss: 0.5527, test_loss: 1.2570, test_f1: 0.5902
 epoch: 63, train_loss: 0.5591, test_loss: 1.2712, test_f1: 0.5809
 epoch: 64, train_loss: 0.5512, test_loss: 1.2544, test_f1: 0.5670
 epoch: 65, train_loss: 0.5646, test_loss: 1.2441, test_f1: 0.5562
 epoch: 66, train_loss: 0.5499, test_loss: 1.2775, test_f1: 0.5846
 epoch: 67, train_loss: 0.5622, test_loss: 1.3190, test_f1: 0.5511
 epoch: 68, train_loss: 0.5634, test_loss: 1.3446, test_f1: 0.5595
 epoch: 69, train_loss: 0.5437, test_loss: 1.3336, test_f1: 0.5804
 epoch: 70, train_loss: 0.5194, test_loss: 1.2968, test_f1: 0.5736
 epoch: 71, train_loss: 0.5310, test_loss: 1.3199, test_f1: 0.5776
 epoch: 72, train_loss: 0.5133, test_loss: 1.3102, test_f1: 0.5690
 epoch: 73, train_loss: 0.5277, test_loss: 1.3569, test_f1: 0.5714
 epoch: 74, train_loss: 0.5297, test_loss: 1.3655, test_f1: 0.5740
 epoch: 75, train_loss: 0.5190, test_loss: 1.2956, test_f1: 0.5640
 epoch: 76, train_loss: 0.5081, test_loss: 1.3507, test_f1: 0.5581
 epoch: 77, train_loss: 0.5006, test_loss: 1.3554, test_f1: 0.5653
 epoch: 78, train_loss: 0.5105, test_loss: 1.3536, test_f1: 0.5579
 epoch: 79, train_loss: 0.4865, test_loss: 1.3862, test_f1: 0.5641
 epoch: 80, train_loss: 0.5020, test_loss: 1.3498, test_f1: 0.5584
 epoch: 81, train_loss: 0.4990, test_loss: 1.3419, test_f1: 0.5566
 epoch: 82, train_loss: 0.4934, test_loss: 1.3553, test_f1: 0.5535
 epoch: 83, train_loss: 0.4980, test_loss: 1.3536, test_f1: 0.5698
 epoch: 84, train_loss: 0.4952, test_loss: 1.3652, test_f1: 0.5564
 epoch: 85, train_loss: 0.4869, test_loss: 1.3929, test_f1: 0.5649
 epoch: 86, train_loss: 0.4838, test_loss: 1.3924, test_f1: 0.5671
 epoch: 87, train_loss: 0.4982, test_loss: 1.4484, test_f1: 0.5676
 epoch: 88, train_loss: 0.4787, test_loss: 1.5185, test_f1: 0.5737
 epoch: 89, train_loss: 0.4877, test_loss: 1.4996, test_f1: 0.5669
 epoch: 90, train_loss: 0.4875, test_loss: 1.4679, test_f1: 0.5569
 epoch: 91, train_loss: 0.4812, test_loss: 1.4601, test_f1: 0.5732
 epoch: 92, train_loss: 0.4484, test_loss: 1.5343, test_f1: 0.5736
 epoch: 93, train_loss: 0.4828, test_loss: 1.4877, test_f1: 0.5558
 epoch: 94, train_loss: 0.4706, test_loss: 1.5355, test_f1: 0.5621
 epoch: 95, train_loss: 0.4495, test_loss: 1.5302, test_f1: 0.5481
 epoch: 96, train_loss: 0.4463, test_loss: 1.4932, test_f1: 0.5511
 epoch: 97, train_loss: 0.4490, test_loss: 1.5467, test_f1: 0.5540
 epoch: 98, train_loss: 0.4607, test_loss: 1.5638, test_f1: 0.5681
 epoch: 99, train_loss: 0.4464, test_loss: 1.5521, test_f1: 0.5540
##################ITERATION #6 ****************************************
 epoch: 0, train_loss: 1.3058, test_loss: 1.3308, test_f1: 0.2205
 epoch: 1, train_loss: 1.2146, test_loss: 1.3085, test_f1: 0.2681
 epoch: 2, train_loss: 1.1670, test_loss: 1.2617, test_f1: 0.3001
 epoch: 3, train_loss: 1.1529, test_loss: 1.2378, test_f1: 0.3175
 epoch: 4, train_loss: 1.1453, test_loss: 1.2347, test_f1: 0.3558
 epoch: 5, train_loss: 1.1157, test_loss: 1.2259, test_f1: 0.3994
 epoch: 6, train_loss: 1.0944, test_loss: 1.2231, test_f1: 0.4262
 epoch: 7, train_loss: 1.0759, test_loss: 1.2397, test_f1: 0.4558
 epoch: 8, train_loss: 1.0546, test_loss: 1.2095, test_f1: 0.4750
 epoch: 9, train_loss: 1.0377, test_loss: 1.2028, test_f1: 0.4738
 epoch: 10, train_loss: 1.0128, test_loss: 1.1998, test_f1: 0.4931
 epoch: 11, train_loss: 1.0034, test_loss: 1.1925, test_f1: 0.4902
 epoch: 12, train_loss: 0.9890, test_loss: 1.1681, test_f1: 0.5032
 epoch: 13, train_loss: 0.9705, test_loss: 1.1463, test_f1: 0.5176
 epoch: 14, train_loss: 0.9416, test_loss: 1.1698, test_f1: 0.5081
 epoch: 15, train_loss: 0.9440, test_loss: 1.1785, test_f1: 0.5270
 epoch: 16, train_loss: 0.9351, test_loss: 1.1609, test_f1: 0.5396
 epoch: 17, train_loss: 0.9198, test_loss: 1.1651, test_f1: 0.5437
 epoch: 18, train_loss: 0.9080, test_loss: 1.1498, test_f1: 0.5313
 epoch: 19, train_loss: 0.8897, test_loss: 1.1486, test_f1: 0.5228
 epoch: 20, train_loss: 0.8763, test_loss: 1.1474, test_f1: 0.5499
 epoch: 21, train_loss: 0.8813, test_loss: 1.1278, test_f1: 0.5568
 epoch: 22, train_loss: 0.8622, test_loss: 1.1442, test_f1: 0.5556
 epoch: 23, train_loss: 0.8512, test_loss: 1.1693, test_f1: 0.5639
 epoch: 24, train_loss: 0.8468, test_loss: 1.1666, test_f1: 0.5555
 epoch: 25, train_loss: 0.8218, test_loss: 1.1985, test_f1: 0.5455
 epoch: 26, train_loss: 0.7977, test_loss: 1.2097, test_f1: 0.5635
 epoch: 27, train_loss: 0.8234, test_loss: 1.1959, test_f1: 0.5563
 epoch: 28, train_loss: 0.8024, test_loss: 1.1842, test_f1: 0.5582
 epoch: 29, train_loss: 0.7812, test_loss: 1.2147, test_f1: 0.5590
 epoch: 30, train_loss: 0.7788, test_loss: 1.2311, test_f1: 0.5606
 epoch: 31, train_loss: 0.7821, test_loss: 1.2376, test_f1: 0.5683
 epoch: 32, train_loss: 0.7575, test_loss: 1.2418, test_f1: 0.5530
 epoch: 33, train_loss: 0.7351, test_loss: 1.2250, test_f1: 0.5734
 epoch: 34, train_loss: 0.7435, test_loss: 1.2523, test_f1: 0.5697
 epoch: 35, train_loss: 0.7114, test_loss: 1.2709, test_f1: 0.5617
 epoch: 36, train_loss: 0.7256, test_loss: 1.2979, test_f1: 0.5427
 epoch: 37, train_loss: 0.7096, test_loss: 1.3472, test_f1: 0.5634
 epoch: 38, train_loss: 0.7021, test_loss: 1.3371, test_f1: 0.5470
 epoch: 39, train_loss: 0.6961, test_loss: 1.3407, test_f1: 0.5277
 epoch: 40, train_loss: 0.6817, test_loss: 1.3258, test_f1: 0.5588
 epoch: 41, train_loss: 0.6778, test_loss: 1.3418, test_f1: 0.5687
 epoch: 42, train_loss: 0.6751, test_loss: 1.3743, test_f1: 0.5678
 epoch: 43, train_loss: 0.6631, test_loss: 1.4033, test_f1: 0.5569
 epoch: 44, train_loss: 0.6512, test_loss: 1.4475, test_f1: 0.5531
 epoch: 45, train_loss: 0.6628, test_loss: 1.4623, test_f1: 0.5447
 epoch: 46, train_loss: 0.6348, test_loss: 1.3985, test_f1: 0.5593
 epoch: 47, train_loss: 0.6313, test_loss: 1.4953, test_f1: 0.5430
 epoch: 48, train_loss: 0.6387, test_loss: 1.4876, test_f1: 0.5488
 epoch: 49, train_loss: 0.6119, test_loss: 1.5107, test_f1: 0.5548
 epoch: 50, train_loss: 0.6184, test_loss: 1.4217, test_f1: 0.5723
 epoch: 51, train_loss: 0.5941, test_loss: 1.4938, test_f1: 0.5696
 epoch: 52, train_loss: 0.5916, test_loss: 1.5315, test_f1: 0.5510
 epoch: 53, train_loss: 0.5863, test_loss: 1.6104, test_f1: 0.5360
 epoch: 54, train_loss: 0.5939, test_loss: 1.5377, test_f1: 0.5526
 epoch: 55, train_loss: 0.5817, test_loss: 1.5574, test_f1: 0.5559
 epoch: 56, train_loss: 0.5723, test_loss: 1.5640, test_f1: 0.5666
 epoch: 57, train_loss: 0.5525, test_loss: 1.5335, test_f1: 0.5614
 epoch: 58, train_loss: 0.5749, test_loss: 1.5210, test_f1: 0.5614
 epoch: 59, train_loss: 0.5672, test_loss: 1.5776, test_f1: 0.5510
 epoch: 60, train_loss: 0.5590, test_loss: 1.6152, test_f1: 0.5604
 epoch: 61, train_loss: 0.5410, test_loss: 1.6722, test_f1: 0.5574
 epoch: 62, train_loss: 0.5547, test_loss: 1.6602, test_f1: 0.5495
 epoch: 63, train_loss: 0.5468, test_loss: 1.6758, test_f1: 0.5697
 epoch: 64, train_loss: 0.5410, test_loss: 1.6639, test_f1: 0.5527
 epoch: 65, train_loss: 0.5531, test_loss: 1.6472, test_f1: 0.5641
 epoch: 66, train_loss: 0.5337, test_loss: 1.6187, test_f1: 0.5654
 epoch: 67, train_loss: 0.5166, test_loss: 1.6164, test_f1: 0.5430
 epoch: 68, train_loss: 0.5279, test_loss: 1.6454, test_f1: 0.5514
 epoch: 69, train_loss: 0.5239, test_loss: 1.6984, test_f1: 0.5369
 epoch: 70, train_loss: 0.5373, test_loss: 1.6744, test_f1: 0.5469
 epoch: 71, train_loss: 0.5202, test_loss: 1.6879, test_f1: 0.5534
 epoch: 72, train_loss: 0.5243, test_loss: 1.6508, test_f1: 0.5683
 epoch: 73, train_loss: 0.5264, test_loss: 1.6555, test_f1: 0.5747
 epoch: 74, train_loss: 0.5174, test_loss: 1.7408, test_f1: 0.5698
 epoch: 75, train_loss: 0.5210, test_loss: 1.6953, test_f1: 0.5494
 epoch: 76, train_loss: 0.5045, test_loss: 1.7033, test_f1: 0.5476
 epoch: 77, train_loss: 0.5138, test_loss: 1.6897, test_f1: 0.5573
 epoch: 78, train_loss: 0.4956, test_loss: 1.6533, test_f1: 0.5503
 epoch: 79, train_loss: 0.5228, test_loss: 1.6920, test_f1: 0.5537
 epoch: 80, train_loss: 0.4875, test_loss: 1.6745, test_f1: 0.5667
 epoch: 81, train_loss: 0.5179, test_loss: 1.7570, test_f1: 0.5573
 epoch: 82, train_loss: 0.4958, test_loss: 1.7917, test_f1: 0.5364
 epoch: 83, train_loss: 0.4819, test_loss: 1.7295, test_f1: 0.5376
 epoch: 84, train_loss: 0.4993, test_loss: 1.7671, test_f1: 0.5538
 epoch: 85, train_loss: 0.4888, test_loss: 1.8119, test_f1: 0.5548
 epoch: 86, train_loss: 0.4683, test_loss: 1.8559, test_f1: 0.5488
 epoch: 87, train_loss: 0.4925, test_loss: 1.8057, test_f1: 0.5546
 epoch: 88, train_loss: 0.4770, test_loss: 1.7716, test_f1: 0.5729
 epoch: 89, train_loss: 0.4648, test_loss: 1.8070, test_f1: 0.5567
 epoch: 90, train_loss: 0.4852, test_loss: 1.7962, test_f1: 0.5702
 epoch: 91, train_loss: 0.4574, test_loss: 1.8429, test_f1: 0.5661
 epoch: 92, train_loss: 0.4861, test_loss: 1.8494, test_f1: 0.5627
 epoch: 93, train_loss: 0.4809, test_loss: 1.8282, test_f1: 0.5457
 epoch: 94, train_loss: 0.4747, test_loss: 1.8413, test_f1: 0.5563
 epoch: 95, train_loss: 0.4385, test_loss: 1.7959, test_f1: 0.5557
 epoch: 96, train_loss: 0.4799, test_loss: 1.9242, test_f1: 0.5377
 epoch: 97, train_loss: 0.4528, test_loss: 1.9719, test_f1: 0.5453
 epoch: 98, train_loss: 0.4695, test_loss: 1.8483, test_f1: 0.5591
 epoch: 99, train_loss: 0.4520, test_loss: 1.8328, test_f1: 0.5574
##################ITERATION #7 ****************************************
 epoch: 0, train_loss: 1.2787, test_loss: 1.3495, test_f1: 0.3132
 epoch: 1, train_loss: 1.1860, test_loss: 1.3041, test_f1: 0.3288
 epoch: 2, train_loss: 1.1446, test_loss: 1.2798, test_f1: 0.3450
 epoch: 3, train_loss: 1.1098, test_loss: 1.2686, test_f1: 0.4650
 epoch: 4, train_loss: 1.0948, test_loss: 1.2443, test_f1: 0.5169
 epoch: 5, train_loss: 1.0727, test_loss: 1.3053, test_f1: 0.5160
 epoch: 6, train_loss: 1.0569, test_loss: 1.3296, test_f1: 0.5000
 epoch: 7, train_loss: 1.0315, test_loss: 1.3086, test_f1: 0.4844
 epoch: 8, train_loss: 1.0161, test_loss: 1.3392, test_f1: 0.4626
 epoch: 9, train_loss: 0.9915, test_loss: 1.2712, test_f1: 0.5213
 epoch: 10, train_loss: 0.9847, test_loss: 1.2454, test_f1: 0.5200
 epoch: 11, train_loss: 0.9801, test_loss: 1.2922, test_f1: 0.5368
 epoch: 12, train_loss: 0.9693, test_loss: 1.2814, test_f1: 0.5337
 epoch: 13, train_loss: 0.9551, test_loss: 1.3140, test_f1: 0.5063
 epoch: 14, train_loss: 0.9448, test_loss: 1.3271, test_f1: 0.5041
 epoch: 15, train_loss: 0.9273, test_loss: 1.2822, test_f1: 0.5120
 epoch: 16, train_loss: 0.9062, test_loss: 1.2781, test_f1: 0.4941
 epoch: 17, train_loss: 0.9088, test_loss: 1.2768, test_f1: 0.5020
 epoch: 18, train_loss: 0.8746, test_loss: 1.2820, test_f1: 0.5152
 epoch: 19, train_loss: 0.8859, test_loss: 1.3315, test_f1: 0.5086
 epoch: 20, train_loss: 0.8568, test_loss: 1.3407, test_f1: 0.5338
 epoch: 21, train_loss: 0.8535, test_loss: 1.3196, test_f1: 0.5285
 epoch: 22, train_loss: 0.8539, test_loss: 1.2929, test_f1: 0.5332
 epoch: 23, train_loss: 0.8442, test_loss: 1.3982, test_f1: 0.5238
 epoch: 24, train_loss: 0.8143, test_loss: 1.4177, test_f1: 0.5097
 epoch: 25, train_loss: 0.8183, test_loss: 1.4259, test_f1: 0.5098
 epoch: 26, train_loss: 0.7887, test_loss: 1.4303, test_f1: 0.5397
 epoch: 27, train_loss: 0.8085, test_loss: 1.3958, test_f1: 0.5282
 epoch: 28, train_loss: 0.8016, test_loss: 1.3665, test_f1: 0.5439
 epoch: 29, train_loss: 0.7886, test_loss: 1.4715, test_f1: 0.5337
 epoch: 30, train_loss: 0.7854, test_loss: 1.4524, test_f1: 0.5518
 epoch: 31, train_loss: 0.7764, test_loss: 1.3979, test_f1: 0.5537
 epoch: 32, train_loss: 0.7586, test_loss: 1.4054, test_f1: 0.5281
 epoch: 33, train_loss: 0.7689, test_loss: 1.3798, test_f1: 0.5351
 epoch: 34, train_loss: 0.7696, test_loss: 1.4174, test_f1: 0.5359
 epoch: 35, train_loss: 0.7395, test_loss: 1.4405, test_f1: 0.5285
 epoch: 36, train_loss: 0.7385, test_loss: 1.4563, test_f1: 0.5222
 epoch: 37, train_loss: 0.7195, test_loss: 1.4602, test_f1: 0.5580
 epoch: 38, train_loss: 0.7357, test_loss: 1.4313, test_f1: 0.5330
 epoch: 39, train_loss: 0.7093, test_loss: 1.4944, test_f1: 0.5407
 epoch: 40, train_loss: 0.7007, test_loss: 1.5226, test_f1: 0.5474
 epoch: 41, train_loss: 0.6920, test_loss: 1.4869, test_f1: 0.5604
 epoch: 42, train_loss: 0.6844, test_loss: 1.4558, test_f1: 0.5372
 epoch: 43, train_loss: 0.6857, test_loss: 1.4018, test_f1: 0.5535
 epoch: 44, train_loss: 0.6625, test_loss: 1.4605, test_f1: 0.5405
 epoch: 45, train_loss: 0.6699, test_loss: 1.4631, test_f1: 0.5493
 epoch: 46, train_loss: 0.6725, test_loss: 1.4970, test_f1: 0.5455
 epoch: 47, train_loss: 0.6536, test_loss: 1.4709, test_f1: 0.5577
 epoch: 48, train_loss: 0.6791, test_loss: 1.4624, test_f1: 0.5699
 epoch: 49, train_loss: 0.6518, test_loss: 1.4379, test_f1: 0.5292
 epoch: 50, train_loss: 0.6608, test_loss: 1.4826, test_f1: 0.5418
 epoch: 51, train_loss: 0.6527, test_loss: 1.4732, test_f1: 0.5486
 epoch: 52, train_loss: 0.6309, test_loss: 1.4530, test_f1: 0.5562
 epoch: 53, train_loss: 0.6258, test_loss: 1.4821, test_f1: 0.5465
 epoch: 54, train_loss: 0.6151, test_loss: 1.5167, test_f1: 0.5583
 epoch: 55, train_loss: 0.6202, test_loss: 1.5265, test_f1: 0.5455
 epoch: 56, train_loss: 0.6258, test_loss: 1.5077, test_f1: 0.5415
 epoch: 57, train_loss: 0.6090, test_loss: 1.5030, test_f1: 0.5474
 epoch: 58, train_loss: 0.6120, test_loss: 1.5734, test_f1: 0.5443
 epoch: 59, train_loss: 0.5936, test_loss: 1.6148, test_f1: 0.5361
 epoch: 60, train_loss: 0.5882, test_loss: 1.5792, test_f1: 0.5325
 epoch: 61, train_loss: 0.6030, test_loss: 1.5811, test_f1: 0.5569
 epoch: 62, train_loss: 0.5931, test_loss: 1.5823, test_f1: 0.5489
 epoch: 63, train_loss: 0.6020, test_loss: 1.5437, test_f1: 0.5527
 epoch: 64, train_loss: 0.5948, test_loss: 1.6037, test_f1: 0.5468
 epoch: 65, train_loss: 0.5937, test_loss: 1.6633, test_f1: 0.5564
 epoch: 66, train_loss: 0.5989, test_loss: 1.7217, test_f1: 0.5542
 epoch: 67, train_loss: 0.5719, test_loss: 1.6904, test_f1: 0.5591
 epoch: 68, train_loss: 0.5808, test_loss: 1.6784, test_f1: 0.5539
 epoch: 69, train_loss: 0.5728, test_loss: 1.6786, test_f1: 0.5514
 epoch: 70, train_loss: 0.5769, test_loss: 1.6516, test_f1: 0.5522
 epoch: 71, train_loss: 0.5685, test_loss: 1.6674, test_f1: 0.5466
 epoch: 72, train_loss: 0.5923, test_loss: 1.6163, test_f1: 0.5566
 epoch: 73, train_loss: 0.5596, test_loss: 1.6563, test_f1: 0.5546
 epoch: 74, train_loss: 0.5680, test_loss: 1.6770, test_f1: 0.5614
 epoch: 75, train_loss: 0.5674, test_loss: 1.6848, test_f1: 0.5563
 epoch: 76, train_loss: 0.5620, test_loss: 1.6857, test_f1: 0.5586
 epoch: 77, train_loss: 0.5645, test_loss: 1.7291, test_f1: 0.5513
 epoch: 78, train_loss: 0.5290, test_loss: 1.6843, test_f1: 0.5518
 epoch: 79, train_loss: 0.5471, test_loss: 1.6879, test_f1: 0.5430
 epoch: 80, train_loss: 0.5449, test_loss: 1.6735, test_f1: 0.5376
 epoch: 81, train_loss: 0.5276, test_loss: 1.6629, test_f1: 0.5292
 epoch: 82, train_loss: 0.5355, test_loss: 1.6701, test_f1: 0.5459
 epoch: 83, train_loss: 0.5404, test_loss: 1.6530, test_f1: 0.5532
 epoch: 84, train_loss: 0.5334, test_loss: 1.6523, test_f1: 0.5503
 epoch: 85, train_loss: 0.5469, test_loss: 1.6524, test_f1: 0.5600
 epoch: 86, train_loss: 0.5234, test_loss: 1.6821, test_f1: 0.5624
 epoch: 87, train_loss: 0.5146, test_loss: 1.6642, test_f1: 0.5565
 epoch: 88, train_loss: 0.5137, test_loss: 1.6911, test_f1: 0.5523
 epoch: 89, train_loss: 0.5317, test_loss: 1.7196, test_f1: 0.5514
 epoch: 90, train_loss: 0.5283, test_loss: 1.7126, test_f1: 0.5481
 epoch: 91, train_loss: 0.5171, test_loss: 1.7388, test_f1: 0.5639
 epoch: 92, train_loss: 0.5111, test_loss: 1.7286, test_f1: 0.5660
 epoch: 93, train_loss: 0.5272, test_loss: 1.7097, test_f1: 0.5596
 epoch: 94, train_loss: 0.5243, test_loss: 1.6286, test_f1: 0.5548
 epoch: 95, train_loss: 0.4969, test_loss: 1.7905, test_f1: 0.5734
 epoch: 96, train_loss: 0.5076, test_loss: 1.7714, test_f1: 0.5644
 epoch: 97, train_loss: 0.4950, test_loss: 1.8617, test_f1: 0.5521
 epoch: 98, train_loss: 0.4999, test_loss: 1.8186, test_f1: 0.5610
 epoch: 99, train_loss: 0.5072, test_loss: 1.8124, test_f1: 0.5605
##################ITERATION #8 ****************************************
 epoch: 0, train_loss: 1.3115, test_loss: 1.3337, test_f1: 0.2281
 epoch: 1, train_loss: 1.2107, test_loss: 1.3384, test_f1: 0.3003
 epoch: 2, train_loss: 1.1650, test_loss: 1.3299, test_f1: 0.3859
 epoch: 3, train_loss: 1.1333, test_loss: 1.2645, test_f1: 0.4577
 epoch: 4, train_loss: 1.1191, test_loss: 1.2364, test_f1: 0.4687
 epoch: 5, train_loss: 1.0695, test_loss: 1.2080, test_f1: 0.5031
 epoch: 6, train_loss: 1.0583, test_loss: 1.1928, test_f1: 0.4929
 epoch: 7, train_loss: 1.0446, test_loss: 1.2476, test_f1: 0.5145
 epoch: 8, train_loss: 1.0277, test_loss: 1.2868, test_f1: 0.5413
 epoch: 9, train_loss: 1.0147, test_loss: 1.2721, test_f1: 0.5318
 epoch: 10, train_loss: 0.9948, test_loss: 1.2567, test_f1: 0.5366
 epoch: 11, train_loss: 0.9823, test_loss: 1.2715, test_f1: 0.5641
 epoch: 12, train_loss: 0.9619, test_loss: 1.2320, test_f1: 0.5504
 epoch: 13, train_loss: 0.9517, test_loss: 1.2447, test_f1: 0.5421
 epoch: 14, train_loss: 0.9658, test_loss: 1.2315, test_f1: 0.5328
 epoch: 15, train_loss: 0.9435, test_loss: 1.2316, test_f1: 0.5539
 epoch: 16, train_loss: 0.9048, test_loss: 1.2340, test_f1: 0.5551
 epoch: 17, train_loss: 0.8858, test_loss: 1.2429, test_f1: 0.5620
 epoch: 18, train_loss: 0.9151, test_loss: 1.2552, test_f1: 0.5799
 epoch: 19, train_loss: 0.8699, test_loss: 1.2520, test_f1: 0.5635
 epoch: 20, train_loss: 0.8879, test_loss: 1.2640, test_f1: 0.5635
 epoch: 21, train_loss: 0.8606, test_loss: 1.2874, test_f1: 0.5489
 epoch: 22, train_loss: 0.8469, test_loss: 1.2623, test_f1: 0.5608
 epoch: 23, train_loss: 0.8352, test_loss: 1.2527, test_f1: 0.5505
 epoch: 24, train_loss: 0.8360, test_loss: 1.2504, test_f1: 0.5529
 epoch: 25, train_loss: 0.8147, test_loss: 1.2584, test_f1: 0.5529
 epoch: 26, train_loss: 0.8227, test_loss: 1.2971, test_f1: 0.5439
 epoch: 27, train_loss: 0.7979, test_loss: 1.2110, test_f1: 0.5535
 epoch: 28, train_loss: 0.7833, test_loss: 1.2124, test_f1: 0.5437
 epoch: 29, train_loss: 0.7934, test_loss: 1.2569, test_f1: 0.5399
 epoch: 30, train_loss: 0.8089, test_loss: 1.3002, test_f1: 0.5382
 epoch: 31, train_loss: 0.7616, test_loss: 1.3310, test_f1: 0.5267
 epoch: 32, train_loss: 0.7630, test_loss: 1.3539, test_f1: 0.5451
 epoch: 33, train_loss: 0.7588, test_loss: 1.3467, test_f1: 0.5415
 epoch: 34, train_loss: 0.7455, test_loss: 1.3004, test_f1: 0.5483
 epoch: 35, train_loss: 0.7285, test_loss: 1.3134, test_f1: 0.5449
 epoch: 36, train_loss: 0.7185, test_loss: 1.2891, test_f1: 0.5463
 epoch: 37, train_loss: 0.7085, test_loss: 1.2991, test_f1: 0.5404
 epoch: 38, train_loss: 0.7226, test_loss: 1.2991, test_f1: 0.5603
 epoch: 39, train_loss: 0.7106, test_loss: 1.3051, test_f1: 0.5513
 epoch: 40, train_loss: 0.7158, test_loss: 1.2862, test_f1: 0.5589
 epoch: 41, train_loss: 0.6914, test_loss: 1.2087, test_f1: 0.5301
 epoch: 42, train_loss: 0.6805, test_loss: 1.2904, test_f1: 0.5365
 epoch: 43, train_loss: 0.6807, test_loss: 1.3178, test_f1: 0.5495
 epoch: 44, train_loss: 0.6771, test_loss: 1.3805, test_f1: 0.5540
 epoch: 45, train_loss: 0.6473, test_loss: 1.4058, test_f1: 0.5244
 epoch: 46, train_loss: 0.6590, test_loss: 1.4808, test_f1: 0.5500
 epoch: 47, train_loss: 0.6550, test_loss: 1.3331, test_f1: 0.5368
 epoch: 48, train_loss: 0.6471, test_loss: 1.3616, test_f1: 0.5368
 epoch: 49, train_loss: 0.6512, test_loss: 1.4174, test_f1: 0.5332
 epoch: 50, train_loss: 0.6373, test_loss: 1.5150, test_f1: 0.5451
 epoch: 51, train_loss: 0.6268, test_loss: 1.4213, test_f1: 0.5461
 epoch: 52, train_loss: 0.6336, test_loss: 1.4407, test_f1: 0.5416
 epoch: 53, train_loss: 0.6039, test_loss: 1.4153, test_f1: 0.5344
 epoch: 54, train_loss: 0.6294, test_loss: 1.4410, test_f1: 0.5312
 epoch: 55, train_loss: 0.5950, test_loss: 1.4291, test_f1: 0.5375
 epoch: 56, train_loss: 0.6282, test_loss: 1.4165, test_f1: 0.5346
 epoch: 57, train_loss: 0.5898, test_loss: 1.5210, test_f1: 0.5236
 epoch: 58, train_loss: 0.5680, test_loss: 1.4730, test_f1: 0.5229
 epoch: 59, train_loss: 0.5858, test_loss: 1.4469, test_f1: 0.5451
 epoch: 60, train_loss: 0.5748, test_loss: 1.4880, test_f1: 0.5484
 epoch: 61, train_loss: 0.5875, test_loss: 1.4627, test_f1: 0.5369
 epoch: 62, train_loss: 0.5837, test_loss: 1.4806, test_f1: 0.5289
 epoch: 63, train_loss: 0.5763, test_loss: 1.5347, test_f1: 0.5276
 epoch: 64, train_loss: 0.5762, test_loss: 1.5211, test_f1: 0.5290
 epoch: 65, train_loss: 0.5750, test_loss: 1.5222, test_f1: 0.5385
 epoch: 66, train_loss: 0.5726, test_loss: 1.5814, test_f1: 0.5371
 epoch: 67, train_loss: 0.5512, test_loss: 1.5508, test_f1: 0.5203
 epoch: 68, train_loss: 0.5623, test_loss: 1.5110, test_f1: 0.5375
 epoch: 69, train_loss: 0.5400, test_loss: 1.4783, test_f1: 0.5314
 epoch: 70, train_loss: 0.5665, test_loss: 1.5926, test_f1: 0.5328
 epoch: 71, train_loss: 0.5467, test_loss: 1.5401, test_f1: 0.5182
 epoch: 72, train_loss: 0.5453, test_loss: 1.5542, test_f1: 0.5272
 epoch: 73, train_loss: 0.5423, test_loss: 1.5248, test_f1: 0.5166
 epoch: 74, train_loss: 0.5336, test_loss: 1.6065, test_f1: 0.5337
 epoch: 75, train_loss: 0.5143, test_loss: 1.5741, test_f1: 0.5370
 epoch: 76, train_loss: 0.5366, test_loss: 1.5459, test_f1: 0.5232
 epoch: 77, train_loss: 0.5287, test_loss: 1.4966, test_f1: 0.5230
 epoch: 78, train_loss: 0.5388, test_loss: 1.4857, test_f1: 0.5408
 epoch: 79, train_loss: 0.5252, test_loss: 1.4445, test_f1: 0.5204
 epoch: 80, train_loss: 0.5139, test_loss: 1.4667, test_f1: 0.5194
 epoch: 81, train_loss: 0.5103, test_loss: 1.5114, test_f1: 0.5285
 epoch: 82, train_loss: 0.5105, test_loss: 1.5560, test_f1: 0.5266
 epoch: 83, train_loss: 0.5309, test_loss: 1.4617, test_f1: 0.5189
 epoch: 84, train_loss: 0.5207, test_loss: 1.5248, test_f1: 0.5232
 epoch: 85, train_loss: 0.4974, test_loss: 1.5621, test_f1: 0.5336
 epoch: 86, train_loss: 0.5044, test_loss: 1.5765, test_f1: 0.5388
 epoch: 87, train_loss: 0.5252, test_loss: 1.5005, test_f1: 0.5392
 epoch: 88, train_loss: 0.5076, test_loss: 1.6128, test_f1: 0.5201
 epoch: 89, train_loss: 0.5270, test_loss: 1.6168, test_f1: 0.5194
 epoch: 90, train_loss: 0.4877, test_loss: 1.6098, test_f1: 0.5462
 epoch: 91, train_loss: 0.4939, test_loss: 1.6470, test_f1: 0.5292
 epoch: 92, train_loss: 0.4984, test_loss: 1.5986, test_f1: 0.5115
 epoch: 93, train_loss: 0.4897, test_loss: 1.5760, test_f1: 0.5333
 epoch: 94, train_loss: 0.4787, test_loss: 1.5483, test_f1: 0.5131
 epoch: 95, train_loss: 0.4684, test_loss: 1.5642, test_f1: 0.5147
 epoch: 96, train_loss: 0.4766, test_loss: 1.6434, test_f1: 0.5427
 epoch: 97, train_loss: 0.4720, test_loss: 1.6212, test_f1: 0.5311
 epoch: 98, train_loss: 0.4596, test_loss: 1.6693, test_f1: 0.5456
 epoch: 99, train_loss: 0.4593, test_loss: 1.6397, test_f1: 0.5284
##################ITERATION #9 ****************************************
 epoch: 0, train_loss: 1.3620, test_loss: 1.3187, test_f1: 0.2904
 epoch: 1, train_loss: 1.2050, test_loss: 1.2927, test_f1: 0.3181
 epoch: 2, train_loss: 1.1827, test_loss: 1.3061, test_f1: 0.3944
 epoch: 3, train_loss: 1.1212, test_loss: 1.2521, test_f1: 0.4352
 epoch: 4, train_loss: 1.1146, test_loss: 1.2113, test_f1: 0.4773
 epoch: 5, train_loss: 1.1055, test_loss: 1.2036, test_f1: 0.4912
 epoch: 6, train_loss: 1.0709, test_loss: 1.2102, test_f1: 0.5021
 epoch: 7, train_loss: 1.0531, test_loss: 1.1824, test_f1: 0.5163
 epoch: 8, train_loss: 1.0428, test_loss: 1.1461, test_f1: 0.5347
 epoch: 9, train_loss: 1.0261, test_loss: 1.1444, test_f1: 0.5229
 epoch: 10, train_loss: 1.0072, test_loss: 1.1561, test_f1: 0.5126
 epoch: 11, train_loss: 0.9930, test_loss: 1.1675, test_f1: 0.5020
 epoch: 12, train_loss: 0.9939, test_loss: 1.1770, test_f1: 0.5038
 epoch: 13, train_loss: 0.9558, test_loss: 1.1599, test_f1: 0.5213
 epoch: 14, train_loss: 0.9451, test_loss: 1.1700, test_f1: 0.5257
 epoch: 15, train_loss: 0.9506, test_loss: 1.2089, test_f1: 0.5129
 epoch: 16, train_loss: 0.9283, test_loss: 1.2737, test_f1: 0.4979
 epoch: 17, train_loss: 0.9204, test_loss: 1.2168, test_f1: 0.4846
 epoch: 18, train_loss: 0.8966, test_loss: 1.2099, test_f1: 0.5124
 epoch: 19, train_loss: 0.9004, test_loss: 1.1661, test_f1: 0.5201
 epoch: 20, train_loss: 0.8938, test_loss: 1.1603, test_f1: 0.5196
 epoch: 21, train_loss: 0.8672, test_loss: 1.1442, test_f1: 0.5455
 epoch: 22, train_loss: 0.8568, test_loss: 1.1518, test_f1: 0.5242
 epoch: 23, train_loss: 0.8508, test_loss: 1.1586, test_f1: 0.5335
 epoch: 24, train_loss: 0.8376, test_loss: 1.1312, test_f1: 0.5477
 epoch: 25, train_loss: 0.8279, test_loss: 1.1443, test_f1: 0.5547
 epoch: 26, train_loss: 0.8228, test_loss: 1.1438, test_f1: 0.5548
 epoch: 27, train_loss: 0.8137, test_loss: 1.1563, test_f1: 0.5580
 epoch: 28, train_loss: 0.8163, test_loss: 1.1742, test_f1: 0.5527
 epoch: 29, train_loss: 0.7927, test_loss: 1.1947, test_f1: 0.5321
 epoch: 30, train_loss: 0.7938, test_loss: 1.1843, test_f1: 0.5503
 epoch: 31, train_loss: 0.7774, test_loss: 1.2273, test_f1: 0.5293
 epoch: 32, train_loss: 0.7784, test_loss: 1.3108, test_f1: 0.5430
 epoch: 33, train_loss: 0.7652, test_loss: 1.2821, test_f1: 0.5442
 epoch: 34, train_loss: 0.7640, test_loss: 1.1851, test_f1: 0.5529
 epoch: 35, train_loss: 0.7478, test_loss: 1.2381, test_f1: 0.5444
 epoch: 36, train_loss: 0.7557, test_loss: 1.2271, test_f1: 0.5213
 epoch: 37, train_loss: 0.7438, test_loss: 1.2546, test_f1: 0.5504
 epoch: 38, train_loss: 0.7192, test_loss: 1.3287, test_f1: 0.5516
 epoch: 39, train_loss: 0.7176, test_loss: 1.4912, test_f1: 0.5662
 epoch: 40, train_loss: 0.7211, test_loss: 1.4343, test_f1: 0.5527
 epoch: 41, train_loss: 0.7062, test_loss: 1.5369, test_f1: 0.5431
 epoch: 42, train_loss: 0.6976, test_loss: 1.4788, test_f1: 0.5395
 epoch: 43, train_loss: 0.6920, test_loss: 1.3258, test_f1: 0.5540
 epoch: 44, train_loss: 0.6764, test_loss: 1.3858, test_f1: 0.5556
 epoch: 45, train_loss: 0.6696, test_loss: 1.3019, test_f1: 0.5433
 epoch: 46, train_loss: 0.6686, test_loss: 1.3355, test_f1: 0.5392
 epoch: 47, train_loss: 0.6547, test_loss: 1.3568, test_f1: 0.5436
 epoch: 48, train_loss: 0.6670, test_loss: 1.3495, test_f1: 0.5443
 epoch: 49, train_loss: 0.6605, test_loss: 1.3428, test_f1: 0.5187
 epoch: 50, train_loss: 0.6413, test_loss: 1.3521, test_f1: 0.5403
 epoch: 51, train_loss: 0.6370, test_loss: 1.3609, test_f1: 0.5269
 epoch: 52, train_loss: 0.6400, test_loss: 1.3709, test_f1: 0.5216
 epoch: 53, train_loss: 0.6181, test_loss: 1.3491, test_f1: 0.5307
 epoch: 54, train_loss: 0.6250, test_loss: 1.2979, test_f1: 0.5328
 epoch: 55, train_loss: 0.6103, test_loss: 1.3143, test_f1: 0.5449
 epoch: 56, train_loss: 0.5948, test_loss: 1.3047, test_f1: 0.5506
 epoch: 57, train_loss: 0.6090, test_loss: 1.3682, test_f1: 0.5467
 epoch: 58, train_loss: 0.5839, test_loss: 1.3962, test_f1: 0.5309
 epoch: 59, train_loss: 0.5840, test_loss: 1.4193, test_f1: 0.5478
 epoch: 60, train_loss: 0.6066, test_loss: 1.3538, test_f1: 0.5474
 epoch: 61, train_loss: 0.5995, test_loss: 1.3907, test_f1: 0.5376
 epoch: 62, train_loss: 0.5757, test_loss: 1.4162, test_f1: 0.5413
 epoch: 63, train_loss: 0.5959, test_loss: 1.4256, test_f1: 0.5392
 epoch: 64, train_loss: 0.5744, test_loss: 1.3926, test_f1: 0.5501
 epoch: 65, train_loss: 0.5907, test_loss: 1.4163, test_f1: 0.5369
 epoch: 66, train_loss: 0.5740, test_loss: 1.3429, test_f1: 0.5308
 epoch: 67, train_loss: 0.5808, test_loss: 1.3793, test_f1: 0.5495
 epoch: 68, train_loss: 0.5770, test_loss: 1.3519, test_f1: 0.5401
 epoch: 69, train_loss: 0.5842, test_loss: 1.4782, test_f1: 0.5313
 epoch: 70, train_loss: 0.5665, test_loss: 1.4175, test_f1: 0.5401
 epoch: 71, train_loss: 0.5446, test_loss: 1.3587, test_f1: 0.5398
 epoch: 72, train_loss: 0.5465, test_loss: 1.3826, test_f1: 0.5445
 epoch: 73, train_loss: 0.5650, test_loss: 1.4024, test_f1: 0.5396
 epoch: 74, train_loss: 0.5366, test_loss: 1.3827, test_f1: 0.5514
 epoch: 75, train_loss: 0.5392, test_loss: 1.3325, test_f1: 0.5495
 epoch: 76, train_loss: 0.5330, test_loss: 1.3781, test_f1: 0.5544
 epoch: 77, train_loss: 0.5386, test_loss: 1.4216, test_f1: 0.5396
 epoch: 78, train_loss: 0.5621, test_loss: 1.4233, test_f1: 0.5450
 epoch: 79, train_loss: 0.5555, test_loss: 1.4024, test_f1: 0.5528
 epoch: 80, train_loss: 0.5271, test_loss: 1.4481, test_f1: 0.5486
 epoch: 81, train_loss: 0.5178, test_loss: 1.4699, test_f1: 0.5526
 epoch: 82, train_loss: 0.5233, test_loss: 1.4379, test_f1: 0.5467
 epoch: 83, train_loss: 0.5464, test_loss: 1.4476, test_f1: 0.5331
 epoch: 84, train_loss: 0.5225, test_loss: 1.5065, test_f1: 0.5326
 epoch: 85, train_loss: 0.5319, test_loss: 1.5039, test_f1: 0.5367
 epoch: 86, train_loss: 0.5139, test_loss: 1.4692, test_f1: 0.5410
 epoch: 87, train_loss: 0.5007, test_loss: 1.4430, test_f1: 0.5643
 epoch: 88, train_loss: 0.5100, test_loss: 1.4344, test_f1: 0.5592
 epoch: 89, train_loss: 0.5108, test_loss: 1.4697, test_f1: 0.5442
 epoch: 90, train_loss: 0.5075, test_loss: 1.4919, test_f1: 0.5510
 epoch: 91, train_loss: 0.5113, test_loss: 1.4861, test_f1: 0.5604
 epoch: 92, train_loss: 0.5027, test_loss: 1.4981, test_f1: 0.5529
 epoch: 93, train_loss: 0.5055, test_loss: 1.5412, test_f1: 0.5170
 epoch: 94, train_loss: 0.4773, test_loss: 1.4850, test_f1: 0.5452
 epoch: 95, train_loss: 0.4784, test_loss: 1.5675, test_f1: 0.5455
 epoch: 96, train_loss: 0.4713, test_loss: 1.5839, test_f1: 0.5367
 epoch: 97, train_loss: 0.4772, test_loss: 1.5976, test_f1: 0.5310
 epoch: 98, train_loss: 0.4851, test_loss: 1.6173, test_f1: 0.5322
 epoch: 99, train_loss: 0.4769, test_loss: 1.6018, test_f1: 0.5478

Training completed in 435.25 seconds
Best F1: 0.6090 at epoch 42
Mean F1 across iterations: 0.5823  0.0178
========================FINAL RESULTS================================
FEGIN weighted F1: 0.6090  0.0178
python main.py --data ltspice_demos --representation component_component --model FEGIN --layers 4 --hiddens 128 --batch_size 128 --lr 0.0001 --emb_size 128 --epochs 100 --save_appendix component_component_L4_H128_BS128_LR0.0001_E128 --no_val
-----



STDERR:
  File "main.py", line 370, in <module>
    main()
  File "main.py", line 254, in main
    dataset = dataset_class(
  File "/home/philip/projects/ltspice_examples_code_repo/Circuit-Completion-Using-GNNs/component_classification_with_link_prediction_head/evaluation/FEGIN/kernel/circuit_datasets.py", line 15, in __init__
    self.data, self.slices = torch.load(self.processed_paths[0])
  File "/home/philip/.local/lib/python3.8/site-packages/torch/serialization.py", line 1040, in load
    warnings.warn(
  File "/usr/lib/python3.8/warnings.py", line 109, in _showwarnmsg
    sw(msg.message, msg.category, msg.filename, msg.lineno,
  File "main.py", line 47, in warn_with_traceback
    traceback.print_stack(file=log)
/home/philip/projects/ltspice_examples_code_repo/Circuit-Completion-Using-GNNs/component_classification_with_link_prediction_head/evaluation/FEGIN/kernel/circuit_datasets.py:15: FutureWarning: You are using `torch.load` with `weights_only=False` (the current default value), which uses the default pickle module implicitly. It is possible to construct malicious pickle data which will execute arbitrary code during unpickling (See https://github.com/pytorch/pytorch/blob/main/SECURITY.md#untrusted-models for more details). In a future release, the default value for `weights_only` will be flipped to `True`. This limits the functions that could be executed during unpickling. Arbitrary objects will no longer be allowed to be loaded via this mode unless they are explicitly allowlisted by the user via `torch.serialization.add_safe_globals`. We recommend you start setting `weights_only=True` for any use case where you don't have full control of the loaded file. Please open an issue on GitHub for any issues related to this experimental feature.
  self.data, self.slices = torch.load(self.processed_paths[0])
