STDOUT:
Results will be saved in /home/philip/projects/ltspice_examples_code_repo/Circuit-Completion-Using-GNNs/component_classification_with_link_prediction_head/evaluation/FEGIN/results/model_FEGIN_dataset_ltspice_demos
Command line input: python main.py --data ltspice_demos --representation component_pin --model FEGIN --layers 4 --hiddens 64 --batch_size 256 --lr 0.0001 --emb_size 128 --epochs 100 --save_appendix component_pin_L4_H64_BS256_LR0.0001_E128 --no_val
 is saved.
-----
ltspice_demos - FEGIN
Using 4 layers, 64 hidden units, h = 2
Loading component_pin representation dataset
ENTERED
Training FEGIN on component_pin representation
Train: 1565, Test: 383
##################ITERATION #0 ****************************************
 epoch: 0, train_loss: 1.3941, test_loss: 1.3932, test_f1: 0.0301
 epoch: 1, train_loss: 1.3894, test_loss: 1.3912, test_f1: 0.0301
 epoch: 2, train_loss: 1.3871, test_loss: 1.3896, test_f1: 0.0301
 epoch: 3, train_loss: 1.3846, test_loss: 1.3883, test_f1: 0.0301
 epoch: 4, train_loss: 1.3821, test_loss: 1.3871, test_f1: 0.0301
 epoch: 5, train_loss: 1.3799, test_loss: 1.3856, test_f1: 0.0502
 epoch: 6, train_loss: 1.3769, test_loss: 1.3838, test_f1: 0.1165
 epoch: 7, train_loss: 1.3741, test_loss: 1.3815, test_f1: 0.1515
 epoch: 8, train_loss: 1.3717, test_loss: 1.3791, test_f1: 0.1718
 epoch: 9, train_loss: 1.3684, test_loss: 1.3767, test_f1: 0.2280
 epoch: 10, train_loss: 1.3653, test_loss: 1.3741, test_f1: 0.3677
 epoch: 11, train_loss: 1.3625, test_loss: 1.3713, test_f1: 0.3745
 epoch: 12, train_loss: 1.3581, test_loss: 1.3685, test_f1: 0.3982
 epoch: 13, train_loss: 1.3540, test_loss: 1.3651, test_f1: 0.4212
 epoch: 14, train_loss: 1.3503, test_loss: 1.3622, test_f1: 0.3935
 epoch: 15, train_loss: 1.3461, test_loss: 1.3590, test_f1: 0.3620
 epoch: 16, train_loss: 1.3397, test_loss: 1.3554, test_f1: 0.3647
 epoch: 17, train_loss: 1.3329, test_loss: 1.3512, test_f1: 0.3640
 epoch: 18, train_loss: 1.3272, test_loss: 1.3466, test_f1: 0.3532
 epoch: 19, train_loss: 1.3189, test_loss: 1.3414, test_f1: 0.3450
 epoch: 20, train_loss: 1.3103, test_loss: 1.3356, test_f1: 0.3448
 epoch: 21, train_loss: 1.3036, test_loss: 1.3303, test_f1: 0.3367
 epoch: 22, train_loss: 1.2924, test_loss: 1.3247, test_f1: 0.3220
 epoch: 23, train_loss: 1.2809, test_loss: 1.3174, test_f1: 0.3231
 epoch: 24, train_loss: 1.2701, test_loss: 1.3098, test_f1: 0.3229
 epoch: 25, train_loss: 1.2582, test_loss: 1.3021, test_f1: 0.3199
 epoch: 26, train_loss: 1.2491, test_loss: 1.2949, test_f1: 0.3250
 epoch: 27, train_loss: 1.2351, test_loss: 1.2885, test_f1: 0.3307
 epoch: 28, train_loss: 1.2214, test_loss: 1.2791, test_f1: 0.3380
 epoch: 29, train_loss: 1.2115, test_loss: 1.2710, test_f1: 0.3349
 epoch: 30, train_loss: 1.2049, test_loss: 1.2644, test_f1: 0.3384
 epoch: 31, train_loss: 1.1982, test_loss: 1.2588, test_f1: 0.3528
 epoch: 32, train_loss: 1.1928, test_loss: 1.2534, test_f1: 0.3567
 epoch: 33, train_loss: 1.1828, test_loss: 1.2466, test_f1: 0.3617
 epoch: 34, train_loss: 1.1769, test_loss: 1.2402, test_f1: 0.3845
 epoch: 35, train_loss: 1.1654, test_loss: 1.2344, test_f1: 0.4116
 epoch: 36, train_loss: 1.1613, test_loss: 1.2299, test_f1: 0.4216
 epoch: 37, train_loss: 1.1561, test_loss: 1.2245, test_f1: 0.4248
 epoch: 38, train_loss: 1.1514, test_loss: 1.2216, test_f1: 0.4248
 epoch: 39, train_loss: 1.1491, test_loss: 1.2194, test_f1: 0.4370
 epoch: 40, train_loss: 1.1418, test_loss: 1.2161, test_f1: 0.4483
 epoch: 41, train_loss: 1.1376, test_loss: 1.2119, test_f1: 0.4484
 epoch: 42, train_loss: 1.1314, test_loss: 1.2090, test_f1: 0.4478
 epoch: 43, train_loss: 1.1309, test_loss: 1.2067, test_f1: 0.4584
 epoch: 44, train_loss: 1.1276, test_loss: 1.2035, test_f1: 0.4521
 epoch: 45, train_loss: 1.1263, test_loss: 1.2014, test_f1: 0.4641
 epoch: 46, train_loss: 1.1176, test_loss: 1.1977, test_f1: 0.4478
 epoch: 47, train_loss: 1.1156, test_loss: 1.1946, test_f1: 0.4497
 epoch: 48, train_loss: 1.1084, test_loss: 1.1915, test_f1: 0.4497
 epoch: 49, train_loss: 1.1049, test_loss: 1.1910, test_f1: 0.4503
 epoch: 50, train_loss: 1.1002, test_loss: 1.1888, test_f1: 0.4503
 epoch: 51, train_loss: 1.0990, test_loss: 1.1863, test_f1: 0.4503
 epoch: 52, train_loss: 1.0977, test_loss: 1.1847, test_f1: 0.4496
 epoch: 53, train_loss: 1.0973, test_loss: 1.1866, test_f1: 0.4503
 epoch: 54, train_loss: 1.0907, test_loss: 1.1866, test_f1: 0.4517
 epoch: 55, train_loss: 1.0951, test_loss: 1.1847, test_f1: 0.4665
 epoch: 56, train_loss: 1.0896, test_loss: 1.1815, test_f1: 0.4529
 epoch: 57, train_loss: 1.0871, test_loss: 1.1785, test_f1: 0.4503
 epoch: 58, train_loss: 1.0908, test_loss: 1.1764, test_f1: 0.4504
 epoch: 59, train_loss: 1.0818, test_loss: 1.1750, test_f1: 0.4504
 epoch: 60, train_loss: 1.0862, test_loss: 1.1732, test_f1: 0.4504
 epoch: 61, train_loss: 1.0818, test_loss: 1.1721, test_f1: 0.4506
 epoch: 62, train_loss: 1.0781, test_loss: 1.1707, test_f1: 0.4500
 epoch: 63, train_loss: 1.0774, test_loss: 1.1694, test_f1: 0.4500
 epoch: 64, train_loss: 1.0726, test_loss: 1.1668, test_f1: 0.4500
 epoch: 65, train_loss: 1.0700, test_loss: 1.1670, test_f1: 0.4500
 epoch: 66, train_loss: 1.0687, test_loss: 1.1664, test_f1: 0.4499
 epoch: 67, train_loss: 1.0680, test_loss: 1.1656, test_f1: 0.4500
 epoch: 68, train_loss: 1.0658, test_loss: 1.1635, test_f1: 0.4495
 epoch: 69, train_loss: 1.0600, test_loss: 1.1596, test_f1: 0.4495
 epoch: 70, train_loss: 1.0604, test_loss: 1.1596, test_f1: 0.4495
 epoch: 71, train_loss: 1.0523, test_loss: 1.1571, test_f1: 0.4495
 epoch: 72, train_loss: 1.0532, test_loss: 1.1567, test_f1: 0.4495
 epoch: 73, train_loss: 1.0527, test_loss: 1.1558, test_f1: 0.4495
 epoch: 74, train_loss: 1.0518, test_loss: 1.1546, test_f1: 0.4490
 epoch: 75, train_loss: 1.0534, test_loss: 1.1526, test_f1: 0.4490
 epoch: 76, train_loss: 1.0471, test_loss: 1.1514, test_f1: 0.4486
 epoch: 77, train_loss: 1.0458, test_loss: 1.1480, test_f1: 0.4516
 epoch: 78, train_loss: 1.0388, test_loss: 1.1483, test_f1: 0.4476
 epoch: 79, train_loss: 1.0397, test_loss: 1.1463, test_f1: 0.4503
 epoch: 80, train_loss: 1.0360, test_loss: 1.1433, test_f1: 0.4503
 epoch: 81, train_loss: 1.0361, test_loss: 1.1403, test_f1: 0.4499
 epoch: 82, train_loss: 1.0295, test_loss: 1.1403, test_f1: 0.4507
 epoch: 83, train_loss: 1.0289, test_loss: 1.1373, test_f1: 0.4503
 epoch: 84, train_loss: 1.0266, test_loss: 1.1354, test_f1: 0.4503
 epoch: 85, train_loss: 1.0224, test_loss: 1.1318, test_f1: 0.4495
 epoch: 86, train_loss: 1.0268, test_loss: 1.1325, test_f1: 0.4495
 epoch: 87, train_loss: 1.0201, test_loss: 1.1297, test_f1: 0.4511
 epoch: 88, train_loss: 1.0173, test_loss: 1.1273, test_f1: 0.4516
 epoch: 89, train_loss: 1.0093, test_loss: 1.1272, test_f1: 0.4503
 epoch: 90, train_loss: 1.0104, test_loss: 1.1276, test_f1: 0.4499
 epoch: 91, train_loss: 1.0105, test_loss: 1.1284, test_f1: 0.4492
 epoch: 92, train_loss: 1.0098, test_loss: 1.1261, test_f1: 0.4503
 epoch: 93, train_loss: 1.0089, test_loss: 1.1235, test_f1: 0.4511
 epoch: 94, train_loss: 1.0040, test_loss: 1.1243, test_f1: 0.4510
 epoch: 95, train_loss: 1.0030, test_loss: 1.1193, test_f1: 0.4527
 epoch: 96, train_loss: 0.9971, test_loss: 1.1145, test_f1: 0.4516
 epoch: 97, train_loss: 0.9988, test_loss: 1.1127, test_f1: 0.4526
 epoch: 98, train_loss: 0.9953, test_loss: 1.1141, test_f1: 0.4503
 epoch: 99, train_loss: 0.9980, test_loss: 1.1150, test_f1: 0.4503
##################ITERATION #1 ****************************************
 epoch: 0, train_loss: 1.3496, test_loss: 1.3607, test_f1: 0.2404
 epoch: 1, train_loss: 1.3410, test_loss: 1.3582, test_f1: 0.2404
 epoch: 2, train_loss: 1.3357, test_loss: 1.3552, test_f1: 0.2248
 epoch: 3, train_loss: 1.3304, test_loss: 1.3520, test_f1: 0.2281
 epoch: 4, train_loss: 1.3253, test_loss: 1.3488, test_f1: 0.2281
 epoch: 5, train_loss: 1.3201, test_loss: 1.3450, test_f1: 0.2302
 epoch: 6, train_loss: 1.3127, test_loss: 1.3408, test_f1: 0.2432
 epoch: 7, train_loss: 1.3071, test_loss: 1.3360, test_f1: 0.2643
 epoch: 8, train_loss: 1.2987, test_loss: 1.3315, test_f1: 0.2630
 epoch: 9, train_loss: 1.2931, test_loss: 1.3263, test_f1: 0.2630
 epoch: 10, train_loss: 1.2858, test_loss: 1.3211, test_f1: 0.2615
 epoch: 11, train_loss: 1.2813, test_loss: 1.3160, test_f1: 0.2626
 epoch: 12, train_loss: 1.2704, test_loss: 1.3104, test_f1: 0.2618
 epoch: 13, train_loss: 1.2608, test_loss: 1.3050, test_f1: 0.2618
 epoch: 14, train_loss: 1.2556, test_loss: 1.2995, test_f1: 0.2618
 epoch: 15, train_loss: 1.2456, test_loss: 1.2940, test_f1: 0.2618
 epoch: 16, train_loss: 1.2376, test_loss: 1.2878, test_f1: 0.2587
 epoch: 17, train_loss: 1.2291, test_loss: 1.2816, test_f1: 0.2587
 epoch: 18, train_loss: 1.2200, test_loss: 1.2757, test_f1: 0.2587
 epoch: 19, train_loss: 1.2124, test_loss: 1.2698, test_f1: 0.2587
 epoch: 20, train_loss: 1.2069, test_loss: 1.2634, test_f1: 0.2573
 epoch: 21, train_loss: 1.1975, test_loss: 1.2571, test_f1: 0.2707
 epoch: 22, train_loss: 1.1915, test_loss: 1.2520, test_f1: 0.2979
 epoch: 23, train_loss: 1.1809, test_loss: 1.2466, test_f1: 0.3035
 epoch: 24, train_loss: 1.1775, test_loss: 1.2415, test_f1: 0.3239
 epoch: 25, train_loss: 1.1685, test_loss: 1.2360, test_f1: 0.3500
 epoch: 26, train_loss: 1.1604, test_loss: 1.2303, test_f1: 0.3651
 epoch: 27, train_loss: 1.1558, test_loss: 1.2235, test_f1: 0.3726
 epoch: 28, train_loss: 1.1502, test_loss: 1.2180, test_f1: 0.4007
 epoch: 29, train_loss: 1.1423, test_loss: 1.2130, test_f1: 0.4188
 epoch: 30, train_loss: 1.1411, test_loss: 1.2077, test_f1: 0.4270
 epoch: 31, train_loss: 1.1311, test_loss: 1.2063, test_f1: 0.4297
 epoch: 32, train_loss: 1.1257, test_loss: 1.2005, test_f1: 0.4297
 epoch: 33, train_loss: 1.1162, test_loss: 1.1932, test_f1: 0.4401
 epoch: 34, train_loss: 1.1157, test_loss: 1.1856, test_f1: 0.4401
 epoch: 35, train_loss: 1.1063, test_loss: 1.1800, test_f1: 0.4542
 epoch: 36, train_loss: 1.0972, test_loss: 1.1749, test_f1: 0.4461
 epoch: 37, train_loss: 1.0934, test_loss: 1.1710, test_f1: 0.4461
 epoch: 38, train_loss: 1.0859, test_loss: 1.1655, test_f1: 0.4461
 epoch: 39, train_loss: 1.0792, test_loss: 1.1620, test_f1: 0.4486
 epoch: 40, train_loss: 1.0788, test_loss: 1.1559, test_f1: 0.4495
 epoch: 41, train_loss: 1.0658, test_loss: 1.1489, test_f1: 0.4427
 epoch: 42, train_loss: 1.0634, test_loss: 1.1422, test_f1: 0.4436
 epoch: 43, train_loss: 1.0567, test_loss: 1.1401, test_f1: 0.4542
 epoch: 44, train_loss: 1.0524, test_loss: 1.1383, test_f1: 0.4473
 epoch: 45, train_loss: 1.0420, test_loss: 1.1338, test_f1: 0.4419
 epoch: 46, train_loss: 1.0406, test_loss: 1.1241, test_f1: 0.4522
 epoch: 47, train_loss: 1.0299, test_loss: 1.1185, test_f1: 0.4543
 epoch: 48, train_loss: 1.0282, test_loss: 1.1140, test_f1: 0.4517
 epoch: 49, train_loss: 1.0209, test_loss: 1.1080, test_f1: 0.4470
 epoch: 50, train_loss: 1.0223, test_loss: 1.1074, test_f1: 0.4530
 epoch: 51, train_loss: 1.0110, test_loss: 1.1052, test_f1: 0.4448
 epoch: 52, train_loss: 1.0108, test_loss: 1.1033, test_f1: 0.4488
 epoch: 53, train_loss: 1.0101, test_loss: 1.0938, test_f1: 0.4488
 epoch: 54, train_loss: 1.0056, test_loss: 1.0967, test_f1: 0.4517
 epoch: 55, train_loss: 1.0011, test_loss: 1.0955, test_f1: 0.4550
 epoch: 56, train_loss: 0.9962, test_loss: 1.0945, test_f1: 0.4524
 epoch: 57, train_loss: 0.9929, test_loss: 1.0929, test_f1: 0.4496
 epoch: 58, train_loss: 0.9907, test_loss: 1.0884, test_f1: 0.4496
 epoch: 59, train_loss: 0.9831, test_loss: 1.0882, test_f1: 0.4496
 epoch: 60, train_loss: 0.9888, test_loss: 1.0866, test_f1: 0.4496
 epoch: 61, train_loss: 0.9856, test_loss: 1.0805, test_f1: 0.4496
 epoch: 62, train_loss: 0.9816, test_loss: 1.0786, test_f1: 0.4520
 epoch: 63, train_loss: 0.9794, test_loss: 1.0816, test_f1: 0.4544
 epoch: 64, train_loss: 0.9738, test_loss: 1.0799, test_f1: 0.4481
 epoch: 65, train_loss: 0.9742, test_loss: 1.0720, test_f1: 0.4594
 epoch: 66, train_loss: 0.9726, test_loss: 1.0743, test_f1: 0.4594
 epoch: 67, train_loss: 0.9730, test_loss: 1.0765, test_f1: 0.4481
 epoch: 68, train_loss: 0.9701, test_loss: 1.0746, test_f1: 0.4468
 epoch: 69, train_loss: 0.9669, test_loss: 1.0707, test_f1: 0.4451
 epoch: 70, train_loss: 0.9576, test_loss: 1.0649, test_f1: 0.4521
 epoch: 71, train_loss: 0.9550, test_loss: 1.0634, test_f1: 0.4520
 epoch: 72, train_loss: 0.9570, test_loss: 1.0601, test_f1: 0.4509
 epoch: 73, train_loss: 0.9534, test_loss: 1.0578, test_f1: 0.4476
 epoch: 74, train_loss: 0.9566, test_loss: 1.0592, test_f1: 0.4455
 epoch: 75, train_loss: 0.9543, test_loss: 1.0615, test_f1: 0.4455
 epoch: 76, train_loss: 0.9470, test_loss: 1.0590, test_f1: 0.4454
 epoch: 77, train_loss: 0.9505, test_loss: 1.0540, test_f1: 0.4478
 epoch: 78, train_loss: 0.9528, test_loss: 1.0497, test_f1: 0.4478
 epoch: 79, train_loss: 0.9513, test_loss: 1.0468, test_f1: 0.4552
 epoch: 80, train_loss: 0.9439, test_loss: 1.0585, test_f1: 0.4449
 epoch: 81, train_loss: 0.9423, test_loss: 1.0537, test_f1: 0.4541
 epoch: 82, train_loss: 0.9430, test_loss: 1.0445, test_f1: 0.4546
 epoch: 83, train_loss: 0.9405, test_loss: 1.0487, test_f1: 0.4453
 epoch: 84, train_loss: 0.9386, test_loss: 1.0598, test_f1: 0.4343
 epoch: 85, train_loss: 0.9416, test_loss: 1.0569, test_f1: 0.4337
 epoch: 86, train_loss: 0.9361, test_loss: 1.0487, test_f1: 0.4474
 epoch: 87, train_loss: 0.9309, test_loss: 1.0503, test_f1: 0.4458
 epoch: 88, train_loss: 0.9342, test_loss: 1.0572, test_f1: 0.4430
 epoch: 89, train_loss: 0.9331, test_loss: 1.0496, test_f1: 0.4408
 epoch: 90, train_loss: 0.9294, test_loss: 1.0500, test_f1: 0.4544
 epoch: 91, train_loss: 0.9279, test_loss: 1.0494, test_f1: 0.4455
 epoch: 92, train_loss: 0.9222, test_loss: 1.0421, test_f1: 0.4426
 epoch: 93, train_loss: 0.9196, test_loss: 1.0351, test_f1: 0.4516
 epoch: 94, train_loss: 0.9240, test_loss: 1.0354, test_f1: 0.4498
 epoch: 95, train_loss: 0.9236, test_loss: 1.0385, test_f1: 0.4389
 epoch: 96, train_loss: 0.9181, test_loss: 1.0409, test_f1: 0.4347
 epoch: 97, train_loss: 0.9176, test_loss: 1.0351, test_f1: 0.4341
 epoch: 98, train_loss: 0.9117, test_loss: 1.0248, test_f1: 0.4599
 epoch: 99, train_loss: 0.9108, test_loss: 1.0284, test_f1: 0.4464
##################ITERATION #2 ****************************************
 epoch: 0, train_loss: 1.3216, test_loss: 1.3432, test_f1: 0.2281
 epoch: 1, train_loss: 1.3086, test_loss: 1.3414, test_f1: 0.2281
 epoch: 2, train_loss: 1.3002, test_loss: 1.3398, test_f1: 0.2281
 epoch: 3, train_loss: 1.2925, test_loss: 1.3370, test_f1: 0.2281
 epoch: 4, train_loss: 1.2851, test_loss: 1.3331, test_f1: 0.2281
 epoch: 5, train_loss: 1.2778, test_loss: 1.3295, test_f1: 0.2281
 epoch: 6, train_loss: 1.2677, test_loss: 1.3246, test_f1: 0.2281
 epoch: 7, train_loss: 1.2602, test_loss: 1.3195, test_f1: 0.2281
 epoch: 8, train_loss: 1.2502, test_loss: 1.3156, test_f1: 0.2281
 epoch: 9, train_loss: 1.2438, test_loss: 1.3117, test_f1: 0.2281
 epoch: 10, train_loss: 1.2370, test_loss: 1.3063, test_f1: 0.2281
 epoch: 11, train_loss: 1.2303, test_loss: 1.2990, test_f1: 0.2281
 epoch: 12, train_loss: 1.2221, test_loss: 1.2894, test_f1: 0.2281
 epoch: 13, train_loss: 1.2128, test_loss: 1.2768, test_f1: 0.2281
 epoch: 14, train_loss: 1.2044, test_loss: 1.2647, test_f1: 0.2759
 epoch: 15, train_loss: 1.1957, test_loss: 1.2543, test_f1: 0.2913
 epoch: 16, train_loss: 1.1880, test_loss: 1.2480, test_f1: 0.3083
 epoch: 17, train_loss: 1.1797, test_loss: 1.2407, test_f1: 0.3380
 epoch: 18, train_loss: 1.1721, test_loss: 1.2355, test_f1: 0.3494
 epoch: 19, train_loss: 1.1619, test_loss: 1.2290, test_f1: 0.3646
 epoch: 20, train_loss: 1.1531, test_loss: 1.2218, test_f1: 0.3550
 epoch: 21, train_loss: 1.1456, test_loss: 1.2145, test_f1: 0.3686
 epoch: 22, train_loss: 1.1364, test_loss: 1.2099, test_f1: 0.3672
 epoch: 23, train_loss: 1.1300, test_loss: 1.2055, test_f1: 0.3672
 epoch: 24, train_loss: 1.1194, test_loss: 1.2003, test_f1: 0.3674
 epoch: 25, train_loss: 1.1154, test_loss: 1.1908, test_f1: 0.3724
 epoch: 26, train_loss: 1.1078, test_loss: 1.1841, test_f1: 0.3812
 epoch: 27, train_loss: 1.0978, test_loss: 1.1816, test_f1: 0.3790
 epoch: 28, train_loss: 1.0913, test_loss: 1.1762, test_f1: 0.3824
 epoch: 29, train_loss: 1.0857, test_loss: 1.1693, test_f1: 0.3838
 epoch: 30, train_loss: 1.0784, test_loss: 1.1633, test_f1: 0.3838
 epoch: 31, train_loss: 1.0713, test_loss: 1.1559, test_f1: 0.3840
 epoch: 32, train_loss: 1.0635, test_loss: 1.1568, test_f1: 0.3827
 epoch: 33, train_loss: 1.0542, test_loss: 1.1554, test_f1: 0.3929
 epoch: 34, train_loss: 1.0520, test_loss: 1.1480, test_f1: 0.3953
 epoch: 35, train_loss: 1.0486, test_loss: 1.1363, test_f1: 0.3907
 epoch: 36, train_loss: 1.0397, test_loss: 1.1290, test_f1: 0.3973
 epoch: 37, train_loss: 1.0304, test_loss: 1.1289, test_f1: 0.3939
 epoch: 38, train_loss: 1.0227, test_loss: 1.1239, test_f1: 0.4122
 epoch: 39, train_loss: 1.0221, test_loss: 1.1207, test_f1: 0.4095
 epoch: 40, train_loss: 1.0109, test_loss: 1.1162, test_f1: 0.4252
 epoch: 41, train_loss: 1.0073, test_loss: 1.1108, test_f1: 0.4187
 epoch: 42, train_loss: 1.0023, test_loss: 1.1031, test_f1: 0.4304
 epoch: 43, train_loss: 0.9989, test_loss: 1.0993, test_f1: 0.4286
 epoch: 44, train_loss: 0.9946, test_loss: 1.1019, test_f1: 0.4181
 epoch: 45, train_loss: 0.9894, test_loss: 1.0914, test_f1: 0.4161
 epoch: 46, train_loss: 0.9844, test_loss: 1.0881, test_f1: 0.4263
 epoch: 47, train_loss: 0.9812, test_loss: 1.0867, test_f1: 0.4360
 epoch: 48, train_loss: 0.9761, test_loss: 1.0855, test_f1: 0.4228
 epoch: 49, train_loss: 0.9612, test_loss: 1.0871, test_f1: 0.4341
 epoch: 50, train_loss: 0.9568, test_loss: 1.0826, test_f1: 0.4340
 epoch: 51, train_loss: 0.9571, test_loss: 1.0780, test_f1: 0.4351
 epoch: 52, train_loss: 0.9517, test_loss: 1.0744, test_f1: 0.4412
 epoch: 53, train_loss: 0.9513, test_loss: 1.0705, test_f1: 0.4495
 epoch: 54, train_loss: 0.9480, test_loss: 1.0656, test_f1: 0.4495
 epoch: 55, train_loss: 0.9485, test_loss: 1.0716, test_f1: 0.4412
 epoch: 56, train_loss: 0.9518, test_loss: 1.0706, test_f1: 0.4461
 epoch: 57, train_loss: 0.9460, test_loss: 1.0697, test_f1: 0.4412
 epoch: 58, train_loss: 0.9397, test_loss: 1.0670, test_f1: 0.4412
 epoch: 59, train_loss: 0.9447, test_loss: 1.0621, test_f1: 0.4412
 epoch: 60, train_loss: 0.9352, test_loss: 1.0616, test_f1: 0.4430
 epoch: 61, train_loss: 0.9465, test_loss: 1.0639, test_f1: 0.4439
 epoch: 62, train_loss: 0.9391, test_loss: 1.0620, test_f1: 0.4495
 epoch: 63, train_loss: 0.9364, test_loss: 1.0535, test_f1: 0.4434
 epoch: 64, train_loss: 0.9329, test_loss: 1.0618, test_f1: 0.4313
 epoch: 65, train_loss: 0.9329, test_loss: 1.0591, test_f1: 0.4252
 epoch: 66, train_loss: 0.9340, test_loss: 1.0494, test_f1: 0.4412
 epoch: 67, train_loss: 0.9241, test_loss: 1.0534, test_f1: 0.4377
 epoch: 68, train_loss: 0.9267, test_loss: 1.0510, test_f1: 0.4412
 epoch: 69, train_loss: 0.9249, test_loss: 1.0484, test_f1: 0.4464
 epoch: 70, train_loss: 0.9198, test_loss: 1.0500, test_f1: 0.4424
 epoch: 71, train_loss: 0.9235, test_loss: 1.0541, test_f1: 0.4482
 epoch: 72, train_loss: 0.9180, test_loss: 1.0511, test_f1: 0.4569
 epoch: 73, train_loss: 0.9244, test_loss: 1.0432, test_f1: 0.4576
 epoch: 74, train_loss: 0.9146, test_loss: 1.0426, test_f1: 0.4549
 epoch: 75, train_loss: 0.9140, test_loss: 1.0435, test_f1: 0.4553
 epoch: 76, train_loss: 0.9215, test_loss: 1.0482, test_f1: 0.4522
 epoch: 77, train_loss: 0.9115, test_loss: 1.0380, test_f1: 0.4536
 epoch: 78, train_loss: 0.9106, test_loss: 1.0330, test_f1: 0.4612
 epoch: 79, train_loss: 0.9155, test_loss: 1.0337, test_f1: 0.4612
 epoch: 80, train_loss: 0.9160, test_loss: 1.0361, test_f1: 0.4587
 epoch: 81, train_loss: 0.9045, test_loss: 1.0333, test_f1: 0.4587
 epoch: 82, train_loss: 0.9120, test_loss: 1.0394, test_f1: 0.4575
 epoch: 83, train_loss: 0.9045, test_loss: 1.0364, test_f1: 0.4547
 epoch: 84, train_loss: 0.9088, test_loss: 1.0379, test_f1: 0.4430
 epoch: 85, train_loss: 0.8998, test_loss: 1.0416, test_f1: 0.4489
 epoch: 86, train_loss: 0.9035, test_loss: 1.0390, test_f1: 0.4499
 epoch: 87, train_loss: 0.8991, test_loss: 1.0283, test_f1: 0.4464
 epoch: 88, train_loss: 0.8945, test_loss: 1.0335, test_f1: 0.4511
 epoch: 89, train_loss: 0.8969, test_loss: 1.0303, test_f1: 0.4517
 epoch: 90, train_loss: 0.8994, test_loss: 1.0178, test_f1: 0.4484
 epoch: 91, train_loss: 0.8922, test_loss: 1.0217, test_f1: 0.4387
 epoch: 92, train_loss: 0.8916, test_loss: 1.0171, test_f1: 0.4359
 epoch: 93, train_loss: 0.8884, test_loss: 1.0255, test_f1: 0.4263
 epoch: 94, train_loss: 0.8930, test_loss: 1.0232, test_f1: 0.4424
 epoch: 95, train_loss: 0.8922, test_loss: 1.0269, test_f1: 0.4430
 epoch: 96, train_loss: 0.8835, test_loss: 1.0416, test_f1: 0.4405
 epoch: 97, train_loss: 0.8849, test_loss: 1.0451, test_f1: 0.4405
 epoch: 98, train_loss: 0.8877, test_loss: 1.0298, test_f1: 0.4430
 epoch: 99, train_loss: 0.8854, test_loss: 1.0213, test_f1: 0.4412
##################ITERATION #3 ****************************************
 epoch: 0, train_loss: 1.3074, test_loss: 1.3342, test_f1: 0.2281
 epoch: 1, train_loss: 1.2916, test_loss: 1.3276, test_f1: 0.2281
 epoch: 2, train_loss: 1.2831, test_loss: 1.3231, test_f1: 0.2281
 epoch: 3, train_loss: 1.2745, test_loss: 1.3196, test_f1: 0.2281
 epoch: 4, train_loss: 1.2674, test_loss: 1.3171, test_f1: 0.2281
 epoch: 5, train_loss: 1.2598, test_loss: 1.3147, test_f1: 0.2281
 epoch: 6, train_loss: 1.2520, test_loss: 1.3088, test_f1: 0.2281
 epoch: 7, train_loss: 1.2458, test_loss: 1.3024, test_f1: 0.2281
 epoch: 8, train_loss: 1.2385, test_loss: 1.2967, test_f1: 0.2281
 epoch: 9, train_loss: 1.2288, test_loss: 1.2930, test_f1: 0.2281
 epoch: 10, train_loss: 1.2241, test_loss: 1.2894, test_f1: 0.2281
 epoch: 11, train_loss: 1.2173, test_loss: 1.2852, test_f1: 0.2281
 epoch: 12, train_loss: 1.2102, test_loss: 1.2814, test_f1: 0.2281
 epoch: 13, train_loss: 1.2030, test_loss: 1.2765, test_f1: 0.2281
 epoch: 14, train_loss: 1.1976, test_loss: 1.2703, test_f1: 0.2281
 epoch: 15, train_loss: 1.1921, test_loss: 1.2662, test_f1: 0.2281
 epoch: 16, train_loss: 1.1807, test_loss: 1.2636, test_f1: 0.2390
 epoch: 17, train_loss: 1.1781, test_loss: 1.2607, test_f1: 0.2539
 epoch: 18, train_loss: 1.1694, test_loss: 1.2553, test_f1: 0.2718
 epoch: 19, train_loss: 1.1622, test_loss: 1.2509, test_f1: 0.2799
 epoch: 20, train_loss: 1.1573, test_loss: 1.2445, test_f1: 0.3083
 epoch: 21, train_loss: 1.1497, test_loss: 1.2429, test_f1: 0.3212
 epoch: 22, train_loss: 1.1424, test_loss: 1.2378, test_f1: 0.3261
 epoch: 23, train_loss: 1.1360, test_loss: 1.2311, test_f1: 0.3277
 epoch: 24, train_loss: 1.1289, test_loss: 1.2236, test_f1: 0.3288
 epoch: 25, train_loss: 1.1235, test_loss: 1.2181, test_f1: 0.3314
 epoch: 26, train_loss: 1.1201, test_loss: 1.2118, test_f1: 0.3314
 epoch: 27, train_loss: 1.1099, test_loss: 1.2067, test_f1: 0.3258
 epoch: 28, train_loss: 1.1033, test_loss: 1.2003, test_f1: 0.3283
 epoch: 29, train_loss: 1.0920, test_loss: 1.1971, test_f1: 0.3246
 epoch: 30, train_loss: 1.0857, test_loss: 1.1944, test_f1: 0.3229
 epoch: 31, train_loss: 1.0838, test_loss: 1.1890, test_f1: 0.3175
 epoch: 32, train_loss: 1.0758, test_loss: 1.1799, test_f1: 0.3280
 epoch: 33, train_loss: 1.0686, test_loss: 1.1717, test_f1: 0.3276
 epoch: 34, train_loss: 1.0670, test_loss: 1.1687, test_f1: 0.3215
 epoch: 35, train_loss: 1.0591, test_loss: 1.1682, test_f1: 0.3201
 epoch: 36, train_loss: 1.0528, test_loss: 1.1659, test_f1: 0.3182
 epoch: 37, train_loss: 1.0469, test_loss: 1.1619, test_f1: 0.3415
 epoch: 38, train_loss: 1.0415, test_loss: 1.1525, test_f1: 0.3368
 epoch: 39, train_loss: 1.0363, test_loss: 1.1461, test_f1: 0.3385
 epoch: 40, train_loss: 1.0325, test_loss: 1.1397, test_f1: 0.3658
 epoch: 41, train_loss: 1.0247, test_loss: 1.1473, test_f1: 0.3333
 epoch: 42, train_loss: 1.0167, test_loss: 1.1445, test_f1: 0.3392
 epoch: 43, train_loss: 1.0143, test_loss: 1.1365, test_f1: 0.3477
 epoch: 44, train_loss: 1.0120, test_loss: 1.1208, test_f1: 0.3501
 epoch: 45, train_loss: 1.0047, test_loss: 1.1122, test_f1: 0.3611
 epoch: 46, train_loss: 0.9982, test_loss: 1.1204, test_f1: 0.3658
 epoch: 47, train_loss: 1.0004, test_loss: 1.1354, test_f1: 0.3674
 epoch: 48, train_loss: 0.9944, test_loss: 1.1218, test_f1: 0.3877
 epoch: 49, train_loss: 0.9911, test_loss: 1.1070, test_f1: 0.3820
 epoch: 50, train_loss: 0.9841, test_loss: 1.1080, test_f1: 0.3738
 epoch: 51, train_loss: 0.9819, test_loss: 1.1062, test_f1: 0.3805
 epoch: 52, train_loss: 0.9777, test_loss: 1.1067, test_f1: 0.3851
 epoch: 53, train_loss: 0.9708, test_loss: 1.0984, test_f1: 0.3856
 epoch: 54, train_loss: 0.9734, test_loss: 1.0910, test_f1: 0.3861
 epoch: 55, train_loss: 0.9716, test_loss: 1.0872, test_f1: 0.3802
 epoch: 56, train_loss: 0.9649, test_loss: 1.0855, test_f1: 0.3779
 epoch: 57, train_loss: 0.9609, test_loss: 1.0857, test_f1: 0.3697
 epoch: 58, train_loss: 0.9624, test_loss: 1.0806, test_f1: 0.3791
 epoch: 59, train_loss: 0.9601, test_loss: 1.0796, test_f1: 0.3744
 epoch: 60, train_loss: 0.9582, test_loss: 1.0781, test_f1: 0.3705
 epoch: 61, train_loss: 0.9560, test_loss: 1.0752, test_f1: 0.3666
 epoch: 62, train_loss: 0.9593, test_loss: 1.0744, test_f1: 0.3720
 epoch: 63, train_loss: 0.9525, test_loss: 1.0779, test_f1: 0.3654
 epoch: 64, train_loss: 0.9480, test_loss: 1.0759, test_f1: 0.3497
 epoch: 65, train_loss: 0.9519, test_loss: 1.0760, test_f1: 0.3357
 epoch: 66, train_loss: 0.9448, test_loss: 1.0708, test_f1: 0.3345
 epoch: 67, train_loss: 0.9462, test_loss: 1.0674, test_f1: 0.3819
 epoch: 68, train_loss: 0.9466, test_loss: 1.0708, test_f1: 0.3785
 epoch: 69, train_loss: 0.9470, test_loss: 1.0695, test_f1: 0.3938
 epoch: 70, train_loss: 0.9445, test_loss: 1.0633, test_f1: 0.3898
 epoch: 71, train_loss: 0.9367, test_loss: 1.0596, test_f1: 0.3872
 epoch: 72, train_loss: 0.9319, test_loss: 1.0546, test_f1: 0.3945
 epoch: 73, train_loss: 0.9367, test_loss: 1.0524, test_f1: 0.3778
 epoch: 74, train_loss: 0.9357, test_loss: 1.0527, test_f1: 0.3773
 epoch: 75, train_loss: 0.9319, test_loss: 1.0532, test_f1: 0.3717
 epoch: 76, train_loss: 0.9284, test_loss: 1.0559, test_f1: 0.3870
 epoch: 77, train_loss: 0.9320, test_loss: 1.0560, test_f1: 0.3960
 epoch: 78, train_loss: 0.9223, test_loss: 1.0559, test_f1: 0.3909
 epoch: 79, train_loss: 0.9233, test_loss: 1.0541, test_f1: 0.3869
 epoch: 80, train_loss: 0.9182, test_loss: 1.0510, test_f1: 0.3882
 epoch: 81, train_loss: 0.9274, test_loss: 1.0482, test_f1: 0.3817
 epoch: 82, train_loss: 0.9185, test_loss: 1.0482, test_f1: 0.3890
 epoch: 83, train_loss: 0.9180, test_loss: 1.0497, test_f1: 0.3969
 epoch: 84, train_loss: 0.9128, test_loss: 1.0473, test_f1: 0.3930
 epoch: 85, train_loss: 0.9158, test_loss: 1.0424, test_f1: 0.3826
 epoch: 86, train_loss: 0.9150, test_loss: 1.0396, test_f1: 0.3906
 epoch: 87, train_loss: 0.9068, test_loss: 1.0375, test_f1: 0.3927
 epoch: 88, train_loss: 0.9143, test_loss: 1.0416, test_f1: 0.3906
 epoch: 89, train_loss: 0.9060, test_loss: 1.0396, test_f1: 0.3944
 epoch: 90, train_loss: 0.8989, test_loss: 1.0363, test_f1: 0.3873
 epoch: 91, train_loss: 0.9028, test_loss: 1.0317, test_f1: 0.3808
 epoch: 92, train_loss: 0.9019, test_loss: 1.0308, test_f1: 0.3975
 epoch: 93, train_loss: 0.9008, test_loss: 1.0291, test_f1: 0.3906
 epoch: 94, train_loss: 0.8999, test_loss: 1.0308, test_f1: 0.3946
 epoch: 95, train_loss: 0.8994, test_loss: 1.0343, test_f1: 0.3940
 epoch: 96, train_loss: 0.8962, test_loss: 1.0380, test_f1: 0.3958
 epoch: 97, train_loss: 0.8921, test_loss: 1.0327, test_f1: 0.3979
 epoch: 98, train_loss: 0.8930, test_loss: 1.0286, test_f1: 0.4002
 epoch: 99, train_loss: 0.8875, test_loss: 1.0229, test_f1: 0.3990
##################ITERATION #4 ****************************************
 epoch: 0, train_loss: 1.3012, test_loss: 1.3304, test_f1: 0.2281
 epoch: 1, train_loss: 1.2781, test_loss: 1.3230, test_f1: 0.2281
 epoch: 2, train_loss: 1.2599, test_loss: 1.3166, test_f1: 0.2281
 epoch: 3, train_loss: 1.2525, test_loss: 1.3112, test_f1: 0.2281
 epoch: 4, train_loss: 1.2368, test_loss: 1.3049, test_f1: 0.2281
 epoch: 5, train_loss: 1.2256, test_loss: 1.2988, test_f1: 0.2281
 epoch: 6, train_loss: 1.2163, test_loss: 1.2936, test_f1: 0.2281
 epoch: 7, train_loss: 1.2071, test_loss: 1.2863, test_f1: 0.2281
 epoch: 8, train_loss: 1.1964, test_loss: 1.2778, test_f1: 0.2281
 epoch: 9, train_loss: 1.1840, test_loss: 1.2683, test_f1: 0.2281
 epoch: 10, train_loss: 1.1737, test_loss: 1.2580, test_f1: 0.2500
 epoch: 11, train_loss: 1.1722, test_loss: 1.2477, test_f1: 0.3286
 epoch: 12, train_loss: 1.1596, test_loss: 1.2381, test_f1: 0.3478
 epoch: 13, train_loss: 1.1519, test_loss: 1.2292, test_f1: 0.3537
 epoch: 14, train_loss: 1.1427, test_loss: 1.2197, test_f1: 0.3592
 epoch: 15, train_loss: 1.1361, test_loss: 1.2119, test_f1: 0.3590
 epoch: 16, train_loss: 1.1243, test_loss: 1.2034, test_f1: 0.3616
 epoch: 17, train_loss: 1.1181, test_loss: 1.1950, test_f1: 0.3624
 epoch: 18, train_loss: 1.1105, test_loss: 1.1858, test_f1: 0.3649
 epoch: 19, train_loss: 1.1008, test_loss: 1.1763, test_f1: 0.3785
 epoch: 20, train_loss: 1.0893, test_loss: 1.1682, test_f1: 0.3695
 epoch: 21, train_loss: 1.0849, test_loss: 1.1620, test_f1: 0.3868
 epoch: 22, train_loss: 1.0737, test_loss: 1.1547, test_f1: 0.3993
 epoch: 23, train_loss: 1.0652, test_loss: 1.1491, test_f1: 0.4040
 epoch: 24, train_loss: 1.0617, test_loss: 1.1405, test_f1: 0.4118
 epoch: 25, train_loss: 1.0525, test_loss: 1.1351, test_f1: 0.4119
 epoch: 26, train_loss: 1.0505, test_loss: 1.1295, test_f1: 0.4160
 epoch: 27, train_loss: 1.0438, test_loss: 1.1254, test_f1: 0.4216
 epoch: 28, train_loss: 1.0363, test_loss: 1.1252, test_f1: 0.4236
 epoch: 29, train_loss: 1.0294, test_loss: 1.1196, test_f1: 0.4378
 epoch: 30, train_loss: 1.0253, test_loss: 1.1139, test_f1: 0.4448
 epoch: 31, train_loss: 1.0134, test_loss: 1.1110, test_f1: 0.4463
 epoch: 32, train_loss: 1.0068, test_loss: 1.1071, test_f1: 0.4486
 epoch: 33, train_loss: 1.0067, test_loss: 1.1021, test_f1: 0.4586
 epoch: 34, train_loss: 1.0049, test_loss: 1.1026, test_f1: 0.4585
 epoch: 35, train_loss: 0.9946, test_loss: 1.1030, test_f1: 0.4463
 epoch: 36, train_loss: 0.9923, test_loss: 1.0946, test_f1: 0.4636
 epoch: 37, train_loss: 0.9849, test_loss: 1.0904, test_f1: 0.4644
 epoch: 38, train_loss: 0.9810, test_loss: 1.0883, test_f1: 0.4580
 epoch: 39, train_loss: 0.9742, test_loss: 1.0836, test_f1: 0.4645
 epoch: 40, train_loss: 0.9775, test_loss: 1.0804, test_f1: 0.4638
 epoch: 41, train_loss: 0.9755, test_loss: 1.0782, test_f1: 0.4727
 epoch: 42, train_loss: 0.9637, test_loss: 1.0799, test_f1: 0.4671
 epoch: 43, train_loss: 0.9662, test_loss: 1.0776, test_f1: 0.4658
 epoch: 44, train_loss: 0.9549, test_loss: 1.0767, test_f1: 0.4515
 epoch: 45, train_loss: 0.9570, test_loss: 1.0749, test_f1: 0.4669
 epoch: 46, train_loss: 0.9541, test_loss: 1.0724, test_f1: 0.4676
 epoch: 47, train_loss: 0.9464, test_loss: 1.0752, test_f1: 0.4701
 epoch: 48, train_loss: 0.9433, test_loss: 1.0729, test_f1: 0.4658
 epoch: 49, train_loss: 0.9377, test_loss: 1.0631, test_f1: 0.4836
 epoch: 50, train_loss: 0.9482, test_loss: 1.0628, test_f1: 0.4689
 epoch: 51, train_loss: 0.9360, test_loss: 1.0663, test_f1: 0.4651
 epoch: 52, train_loss: 0.9388, test_loss: 1.0657, test_f1: 0.4707
 epoch: 53, train_loss: 0.9345, test_loss: 1.0592, test_f1: 0.4700
 epoch: 54, train_loss: 0.9345, test_loss: 1.0565, test_f1: 0.4722
 epoch: 55, train_loss: 0.9317, test_loss: 1.0529, test_f1: 0.4702
 epoch: 56, train_loss: 0.9241, test_loss: 1.0566, test_f1: 0.4702
 epoch: 57, train_loss: 0.9241, test_loss: 1.0558, test_f1: 0.4702
 epoch: 58, train_loss: 0.9269, test_loss: 1.0567, test_f1: 0.4745
 epoch: 59, train_loss: 0.9253, test_loss: 1.0552, test_f1: 0.4722
 epoch: 60, train_loss: 0.9202, test_loss: 1.0546, test_f1: 0.4669
 epoch: 61, train_loss: 0.9250, test_loss: 1.0523, test_f1: 0.4705
 epoch: 62, train_loss: 0.9159, test_loss: 1.0530, test_f1: 0.4682
 epoch: 63, train_loss: 0.9173, test_loss: 1.0527, test_f1: 0.4682
 epoch: 64, train_loss: 0.9163, test_loss: 1.0505, test_f1: 0.4705
 epoch: 65, train_loss: 0.9072, test_loss: 1.0489, test_f1: 0.4695
 epoch: 66, train_loss: 0.9065, test_loss: 1.0457, test_f1: 0.4666
 epoch: 67, train_loss: 0.9091, test_loss: 1.0468, test_f1: 0.4680
 epoch: 68, train_loss: 0.9130, test_loss: 1.0496, test_f1: 0.4672
 epoch: 69, train_loss: 0.9160, test_loss: 1.0488, test_f1: 0.4672
 epoch: 70, train_loss: 0.9000, test_loss: 1.0482, test_f1: 0.4654
 epoch: 71, train_loss: 0.9061, test_loss: 1.0435, test_f1: 0.4730
 epoch: 72, train_loss: 0.9078, test_loss: 1.0431, test_f1: 0.4527
 epoch: 73, train_loss: 0.8988, test_loss: 1.0444, test_f1: 0.4500
 epoch: 74, train_loss: 0.8888, test_loss: 1.0476, test_f1: 0.4508
 epoch: 75, train_loss: 0.8975, test_loss: 1.0452, test_f1: 0.4640
 epoch: 76, train_loss: 0.8953, test_loss: 1.0477, test_f1: 0.4543
 epoch: 77, train_loss: 0.8923, test_loss: 1.0431, test_f1: 0.4475
 epoch: 78, train_loss: 0.8966, test_loss: 1.0458, test_f1: 0.4512
 epoch: 79, train_loss: 0.8933, test_loss: 1.0429, test_f1: 0.4508
 epoch: 80, train_loss: 0.8817, test_loss: 1.0354, test_f1: 0.4479
 epoch: 81, train_loss: 0.9001, test_loss: 1.0273, test_f1: 0.4601
 epoch: 82, train_loss: 0.8882, test_loss: 1.0327, test_f1: 0.4672
 epoch: 83, train_loss: 0.8874, test_loss: 1.0257, test_f1: 0.4677
 epoch: 84, train_loss: 0.8872, test_loss: 1.0294, test_f1: 0.4475
 epoch: 85, train_loss: 0.8868, test_loss: 1.0339, test_f1: 0.4778
 epoch: 86, train_loss: 0.8802, test_loss: 1.0320, test_f1: 0.4815
 epoch: 87, train_loss: 0.8780, test_loss: 1.0304, test_f1: 0.4815
 epoch: 88, train_loss: 0.8763, test_loss: 1.0326, test_f1: 0.4716
 epoch: 89, train_loss: 0.8762, test_loss: 1.0354, test_f1: 0.4526
 epoch: 90, train_loss: 0.8784, test_loss: 1.0337, test_f1: 0.4732
 epoch: 91, train_loss: 0.8754, test_loss: 1.0363, test_f1: 0.4727
 epoch: 92, train_loss: 0.8725, test_loss: 1.0323, test_f1: 0.4685
 epoch: 93, train_loss: 0.8697, test_loss: 1.0273, test_f1: 0.4757
 epoch: 94, train_loss: 0.8689, test_loss: 1.0238, test_f1: 0.4667
 epoch: 95, train_loss: 0.8685, test_loss: 1.0265, test_f1: 0.4567
 epoch: 96, train_loss: 0.8606, test_loss: 1.0283, test_f1: 0.4550
 epoch: 97, train_loss: 0.8673, test_loss: 1.0332, test_f1: 0.4525
 epoch: 98, train_loss: 0.8665, test_loss: 1.0293, test_f1: 0.4675
 epoch: 99, train_loss: 0.8700, test_loss: 1.0325, test_f1: 0.4676
##################ITERATION #5 ****************************************
 epoch: 0, train_loss: 1.2939, test_loss: 1.3276, test_f1: 0.2281
 epoch: 1, train_loss: 1.2634, test_loss: 1.3207, test_f1: 0.2281
 epoch: 2, train_loss: 1.2522, test_loss: 1.3154, test_f1: 0.2281
 epoch: 3, train_loss: 1.2404, test_loss: 1.3123, test_f1: 0.2281
 epoch: 4, train_loss: 1.2300, test_loss: 1.3091, test_f1: 0.2281
 epoch: 5, train_loss: 1.2197, test_loss: 1.3027, test_f1: 0.2281
 epoch: 6, train_loss: 1.2111, test_loss: 1.2951, test_f1: 0.2281
 epoch: 7, train_loss: 1.2011, test_loss: 1.2857, test_f1: 0.2281
 epoch: 8, train_loss: 1.1897, test_loss: 1.2717, test_f1: 0.2281
 epoch: 9, train_loss: 1.1816, test_loss: 1.2617, test_f1: 0.2675
 epoch: 10, train_loss: 1.1658, test_loss: 1.2459, test_f1: 0.3018
 epoch: 11, train_loss: 1.1628, test_loss: 1.2359, test_f1: 0.3290
 epoch: 12, train_loss: 1.1565, test_loss: 1.2271, test_f1: 0.3344
 epoch: 13, train_loss: 1.1450, test_loss: 1.2197, test_f1: 0.3395
 epoch: 14, train_loss: 1.1421, test_loss: 1.2117, test_f1: 0.3365
 epoch: 15, train_loss: 1.1328, test_loss: 1.2046, test_f1: 0.3365
 epoch: 16, train_loss: 1.1209, test_loss: 1.1933, test_f1: 0.3333
 epoch: 17, train_loss: 1.1138, test_loss: 1.1856, test_f1: 0.3358
 epoch: 18, train_loss: 1.1116, test_loss: 1.1799, test_f1: 0.3270
 epoch: 19, train_loss: 1.1018, test_loss: 1.1770, test_f1: 0.3245
 epoch: 20, train_loss: 1.0896, test_loss: 1.1669, test_f1: 0.3312
 epoch: 21, train_loss: 1.0812, test_loss: 1.1630, test_f1: 0.3382
 epoch: 22, train_loss: 1.0780, test_loss: 1.1551, test_f1: 0.3515
 epoch: 23, train_loss: 1.0709, test_loss: 1.1525, test_f1: 0.3512
 epoch: 24, train_loss: 1.0598, test_loss: 1.1477, test_f1: 0.3487
 epoch: 25, train_loss: 1.0633, test_loss: 1.1452, test_f1: 0.3487
 epoch: 26, train_loss: 1.0547, test_loss: 1.1323, test_f1: 0.3580
 epoch: 27, train_loss: 1.0482, test_loss: 1.1321, test_f1: 0.3468
 epoch: 28, train_loss: 1.0423, test_loss: 1.1316, test_f1: 0.3459
 epoch: 29, train_loss: 1.0386, test_loss: 1.1239, test_f1: 0.3459
 epoch: 30, train_loss: 1.0319, test_loss: 1.1147, test_f1: 0.3466
 epoch: 31, train_loss: 1.0214, test_loss: 1.1113, test_f1: 0.3739
 epoch: 32, train_loss: 1.0189, test_loss: 1.1130, test_f1: 0.3864
 epoch: 33, train_loss: 1.0107, test_loss: 1.1125, test_f1: 0.4127
 epoch: 34, train_loss: 1.0149, test_loss: 1.1055, test_f1: 0.4173
 epoch: 35, train_loss: 1.0068, test_loss: 1.1053, test_f1: 0.4074
 epoch: 36, train_loss: 1.0033, test_loss: 1.1036, test_f1: 0.3910
 epoch: 37, train_loss: 1.0024, test_loss: 1.0972, test_f1: 0.3861
 epoch: 38, train_loss: 0.9886, test_loss: 1.0909, test_f1: 0.4118
 epoch: 39, train_loss: 0.9885, test_loss: 1.0831, test_f1: 0.4346
 epoch: 40, train_loss: 0.9834, test_loss: 1.0810, test_f1: 0.4320
 epoch: 41, train_loss: 0.9815, test_loss: 1.0784, test_f1: 0.4302
 epoch: 42, train_loss: 0.9764, test_loss: 1.0795, test_f1: 0.4302
 epoch: 43, train_loss: 0.9764, test_loss: 1.0782, test_f1: 0.4302
 epoch: 44, train_loss: 0.9652, test_loss: 1.0704, test_f1: 0.4381
 epoch: 45, train_loss: 0.9690, test_loss: 1.0709, test_f1: 0.4351
 epoch: 46, train_loss: 0.9652, test_loss: 1.0682, test_f1: 0.4375
 epoch: 47, train_loss: 0.9566, test_loss: 1.0682, test_f1: 0.4351
 epoch: 48, train_loss: 0.9528, test_loss: 1.0678, test_f1: 0.4353
 epoch: 49, train_loss: 0.9528, test_loss: 1.0749, test_f1: 0.4321
 epoch: 50, train_loss: 0.9502, test_loss: 1.0779, test_f1: 0.4309
 epoch: 51, train_loss: 0.9442, test_loss: 1.0711, test_f1: 0.4295
 epoch: 52, train_loss: 0.9443, test_loss: 1.0666, test_f1: 0.4283
 epoch: 53, train_loss: 0.9419, test_loss: 1.0588, test_f1: 0.4407
 epoch: 54, train_loss: 0.9446, test_loss: 1.0602, test_f1: 0.4297
 epoch: 55, train_loss: 0.9444, test_loss: 1.0606, test_f1: 0.4252
 epoch: 56, train_loss: 0.9307, test_loss: 1.0596, test_f1: 0.4251
 epoch: 57, train_loss: 0.9378, test_loss: 1.0583, test_f1: 0.4295
 epoch: 58, train_loss: 0.9366, test_loss: 1.0499, test_f1: 0.4392
 epoch: 59, train_loss: 0.9284, test_loss: 1.0495, test_f1: 0.4333
 epoch: 60, train_loss: 0.9307, test_loss: 1.0515, test_f1: 0.4352
 epoch: 61, train_loss: 0.9261, test_loss: 1.0568, test_f1: 0.4306
 epoch: 62, train_loss: 0.9231, test_loss: 1.0550, test_f1: 0.4330
 epoch: 63, train_loss: 0.9261, test_loss: 1.0546, test_f1: 0.4448
 epoch: 64, train_loss: 0.9242, test_loss: 1.0464, test_f1: 0.4448
 epoch: 65, train_loss: 0.9168, test_loss: 1.0482, test_f1: 0.4392
 epoch: 66, train_loss: 0.9169, test_loss: 1.0495, test_f1: 0.4367
 epoch: 67, train_loss: 0.9241, test_loss: 1.0467, test_f1: 0.4343
 epoch: 68, train_loss: 0.9175, test_loss: 1.0457, test_f1: 0.4340
 epoch: 69, train_loss: 0.9159, test_loss: 1.0469, test_f1: 0.4494
 epoch: 70, train_loss: 0.9106, test_loss: 1.0519, test_f1: 0.4369
 epoch: 71, train_loss: 0.9078, test_loss: 1.0517, test_f1: 0.4309
 epoch: 72, train_loss: 0.9095, test_loss: 1.0496, test_f1: 0.4342
 epoch: 73, train_loss: 0.9065, test_loss: 1.0536, test_f1: 0.4376
 epoch: 74, train_loss: 0.9017, test_loss: 1.0501, test_f1: 0.4333
 epoch: 75, train_loss: 0.9116, test_loss: 1.0408, test_f1: 0.4331
 epoch: 76, train_loss: 0.8966, test_loss: 1.0376, test_f1: 0.4391
 epoch: 77, train_loss: 0.8979, test_loss: 1.0408, test_f1: 0.4324
 epoch: 78, train_loss: 0.8991, test_loss: 1.0428, test_f1: 0.4391
 epoch: 79, train_loss: 0.9003, test_loss: 1.0427, test_f1: 0.4460
 epoch: 80, train_loss: 0.8974, test_loss: 1.0440, test_f1: 0.4469
 epoch: 81, train_loss: 0.8949, test_loss: 1.0472, test_f1: 0.4361
 epoch: 82, train_loss: 0.8895, test_loss: 1.0366, test_f1: 0.4464
 epoch: 83, train_loss: 0.8939, test_loss: 1.0333, test_f1: 0.4445
 epoch: 84, train_loss: 0.8854, test_loss: 1.0405, test_f1: 0.4464
 epoch: 85, train_loss: 0.8868, test_loss: 1.0457, test_f1: 0.4478
 epoch: 86, train_loss: 0.8837, test_loss: 1.0397, test_f1: 0.4450
 epoch: 87, train_loss: 0.8864, test_loss: 1.0422, test_f1: 0.4455
 epoch: 88, train_loss: 0.8889, test_loss: 1.0407, test_f1: 0.4385
 epoch: 89, train_loss: 0.8844, test_loss: 1.0500, test_f1: 0.4365
 epoch: 90, train_loss: 0.8827, test_loss: 1.0529, test_f1: 0.4363
 epoch: 91, train_loss: 0.8775, test_loss: 1.0464, test_f1: 0.4366
 epoch: 92, train_loss: 0.8774, test_loss: 1.0440, test_f1: 0.4313
 epoch: 93, train_loss: 0.8749, test_loss: 1.0390, test_f1: 0.4306
 epoch: 94, train_loss: 0.8760, test_loss: 1.0342, test_f1: 0.4366
 epoch: 95, train_loss: 0.8736, test_loss: 1.0322, test_f1: 0.4477
 epoch: 96, train_loss: 0.8650, test_loss: 1.0357, test_f1: 0.4369
 epoch: 97, train_loss: 0.8690, test_loss: 1.0422, test_f1: 0.4411
 epoch: 98, train_loss: 0.8731, test_loss: 1.0432, test_f1: 0.4496
 epoch: 99, train_loss: 0.8720, test_loss: 1.0438, test_f1: 0.4439
##################ITERATION #6 ****************************************
 epoch: 0, train_loss: 1.2733, test_loss: 1.3073, test_f1: 0.2281
 epoch: 1, train_loss: 1.2519, test_loss: 1.3031, test_f1: 0.2281
 epoch: 2, train_loss: 1.2370, test_loss: 1.2997, test_f1: 0.2281
 epoch: 3, train_loss: 1.2307, test_loss: 1.2979, test_f1: 0.2281
 epoch: 4, train_loss: 1.2168, test_loss: 1.2938, test_f1: 0.2281
 epoch: 5, train_loss: 1.2134, test_loss: 1.2894, test_f1: 0.2281
 epoch: 6, train_loss: 1.2006, test_loss: 1.2849, test_f1: 0.2281
 epoch: 7, train_loss: 1.1937, test_loss: 1.2765, test_f1: 0.2281
 epoch: 8, train_loss: 1.1939, test_loss: 1.2682, test_f1: 0.2259
 epoch: 9, train_loss: 1.1758, test_loss: 1.2558, test_f1: 0.2281
 epoch: 10, train_loss: 1.1695, test_loss: 1.2422, test_f1: 0.2390
 epoch: 11, train_loss: 1.1572, test_loss: 1.2307, test_f1: 0.2822
 epoch: 12, train_loss: 1.1527, test_loss: 1.2178, test_f1: 0.3040
 epoch: 13, train_loss: 1.1396, test_loss: 1.2107, test_f1: 0.3126
 epoch: 14, train_loss: 1.1312, test_loss: 1.2073, test_f1: 0.3454
 epoch: 15, train_loss: 1.1248, test_loss: 1.2016, test_f1: 0.3452
 epoch: 16, train_loss: 1.1150, test_loss: 1.1883, test_f1: 0.3587
 epoch: 17, train_loss: 1.1107, test_loss: 1.1821, test_f1: 0.3700
 epoch: 18, train_loss: 1.0968, test_loss: 1.1738, test_f1: 0.3754
 epoch: 19, train_loss: 1.0938, test_loss: 1.1650, test_f1: 0.3842
 epoch: 20, train_loss: 1.0821, test_loss: 1.1587, test_f1: 0.3862
 epoch: 21, train_loss: 1.0723, test_loss: 1.1488, test_f1: 0.3902
 epoch: 22, train_loss: 1.0684, test_loss: 1.1402, test_f1: 0.3902
 epoch: 23, train_loss: 1.0567, test_loss: 1.1365, test_f1: 0.3887
 epoch: 24, train_loss: 1.0494, test_loss: 1.1324, test_f1: 0.3932
 epoch: 25, train_loss: 1.0416, test_loss: 1.1271, test_f1: 0.3997
 epoch: 26, train_loss: 1.0339, test_loss: 1.1195, test_f1: 0.4077
 epoch: 27, train_loss: 1.0313, test_loss: 1.1181, test_f1: 0.4144
 epoch: 28, train_loss: 1.0269, test_loss: 1.1165, test_f1: 0.4043
 epoch: 29, train_loss: 1.0141, test_loss: 1.1069, test_f1: 0.4122
 epoch: 30, train_loss: 1.0100, test_loss: 1.1058, test_f1: 0.4177
 epoch: 31, train_loss: 1.0116, test_loss: 1.1028, test_f1: 0.4182
 epoch: 32, train_loss: 1.0008, test_loss: 1.0958, test_f1: 0.4414
 epoch: 33, train_loss: 0.9951, test_loss: 1.0937, test_f1: 0.4314
 epoch: 34, train_loss: 0.9894, test_loss: 1.0932, test_f1: 0.4350
 epoch: 35, train_loss: 0.9892, test_loss: 1.0932, test_f1: 0.4370
 epoch: 36, train_loss: 0.9839, test_loss: 1.0875, test_f1: 0.4333
 epoch: 37, train_loss: 0.9778, test_loss: 1.0821, test_f1: 0.4458
 epoch: 38, train_loss: 0.9755, test_loss: 1.0788, test_f1: 0.4528
 epoch: 39, train_loss: 0.9684, test_loss: 1.0778, test_f1: 0.4433
 epoch: 40, train_loss: 0.9642, test_loss: 1.0751, test_f1: 0.4513
 epoch: 41, train_loss: 0.9620, test_loss: 1.0716, test_f1: 0.4515
 epoch: 42, train_loss: 0.9532, test_loss: 1.0690, test_f1: 0.4578
 epoch: 43, train_loss: 0.9504, test_loss: 1.0709, test_f1: 0.4329
 epoch: 44, train_loss: 0.9432, test_loss: 1.0676, test_f1: 0.4443
 epoch: 45, train_loss: 0.9433, test_loss: 1.0620, test_f1: 0.4434
 epoch: 46, train_loss: 0.9418, test_loss: 1.0652, test_f1: 0.4390
 epoch: 47, train_loss: 0.9323, test_loss: 1.0584, test_f1: 0.4375
 epoch: 48, train_loss: 0.9329, test_loss: 1.0568, test_f1: 0.4347
 epoch: 49, train_loss: 0.9291, test_loss: 1.0561, test_f1: 0.4296
 epoch: 50, train_loss: 0.9297, test_loss: 1.0501, test_f1: 0.4330
 epoch: 51, train_loss: 0.9163, test_loss: 1.0479, test_f1: 0.4339
 epoch: 52, train_loss: 0.9164, test_loss: 1.0448, test_f1: 0.4403
 epoch: 53, train_loss: 0.9135, test_loss: 1.0439, test_f1: 0.4452
 epoch: 54, train_loss: 0.9195, test_loss: 1.0432, test_f1: 0.4471
 epoch: 55, train_loss: 0.9115, test_loss: 1.0433, test_f1: 0.4452
 epoch: 56, train_loss: 0.9080, test_loss: 1.0419, test_f1: 0.4459
 epoch: 57, train_loss: 0.9088, test_loss: 1.0398, test_f1: 0.4322
 epoch: 58, train_loss: 0.9136, test_loss: 1.0375, test_f1: 0.4396
 epoch: 59, train_loss: 0.9004, test_loss: 1.0390, test_f1: 0.4511
 epoch: 60, train_loss: 0.9068, test_loss: 1.0379, test_f1: 0.4511
 epoch: 61, train_loss: 0.8967, test_loss: 1.0354, test_f1: 0.4505
 epoch: 62, train_loss: 0.8969, test_loss: 1.0352, test_f1: 0.4448
 epoch: 63, train_loss: 0.8989, test_loss: 1.0369, test_f1: 0.4432
 epoch: 64, train_loss: 0.8913, test_loss: 1.0389, test_f1: 0.4465
 epoch: 65, train_loss: 0.8974, test_loss: 1.0394, test_f1: 0.4417
 epoch: 66, train_loss: 0.9024, test_loss: 1.0349, test_f1: 0.4459
 epoch: 67, train_loss: 0.8883, test_loss: 1.0316, test_f1: 0.4311
 epoch: 68, train_loss: 0.8984, test_loss: 1.0358, test_f1: 0.4182
 epoch: 69, train_loss: 0.8946, test_loss: 1.0352, test_f1: 0.4134
 epoch: 70, train_loss: 0.8845, test_loss: 1.0359, test_f1: 0.4219
 epoch: 71, train_loss: 0.8880, test_loss: 1.0345, test_f1: 0.4333
 epoch: 72, train_loss: 0.8827, test_loss: 1.0371, test_f1: 0.4251
 epoch: 73, train_loss: 0.8815, test_loss: 1.0406, test_f1: 0.4093
 epoch: 74, train_loss: 0.8923, test_loss: 1.0384, test_f1: 0.4088
 epoch: 75, train_loss: 0.8808, test_loss: 1.0399, test_f1: 0.4055
 epoch: 76, train_loss: 0.8796, test_loss: 1.0401, test_f1: 0.4148
 epoch: 77, train_loss: 0.8740, test_loss: 1.0367, test_f1: 0.4207
 epoch: 78, train_loss: 0.8749, test_loss: 1.0336, test_f1: 0.4206
 epoch: 79, train_loss: 0.8767, test_loss: 1.0381, test_f1: 0.4189
 epoch: 80, train_loss: 0.8667, test_loss: 1.0366, test_f1: 0.4221
 epoch: 81, train_loss: 0.8690, test_loss: 1.0393, test_f1: 0.4202
 epoch: 82, train_loss: 0.8675, test_loss: 1.0390, test_f1: 0.4231
 epoch: 83, train_loss: 0.8703, test_loss: 1.0364, test_f1: 0.4269
 epoch: 84, train_loss: 0.8686, test_loss: 1.0401, test_f1: 0.4245
 epoch: 85, train_loss: 0.8697, test_loss: 1.0375, test_f1: 0.4365
 epoch: 86, train_loss: 0.8609, test_loss: 1.0413, test_f1: 0.4490
 epoch: 87, train_loss: 0.8650, test_loss: 1.0415, test_f1: 0.4294
 epoch: 88, train_loss: 0.8643, test_loss: 1.0427, test_f1: 0.4360
 epoch: 89, train_loss: 0.8547, test_loss: 1.0408, test_f1: 0.4429
 epoch: 90, train_loss: 0.8648, test_loss: 1.0386, test_f1: 0.4453
 epoch: 91, train_loss: 0.8556, test_loss: 1.0427, test_f1: 0.4538
 epoch: 92, train_loss: 0.8498, test_loss: 1.0475, test_f1: 0.4578
 epoch: 93, train_loss: 0.8531, test_loss: 1.0432, test_f1: 0.4489
 epoch: 94, train_loss: 0.8479, test_loss: 1.0395, test_f1: 0.4395
 epoch: 95, train_loss: 0.8483, test_loss: 1.0405, test_f1: 0.4415
 epoch: 96, train_loss: 0.8479, test_loss: 1.0391, test_f1: 0.4471
 epoch: 97, train_loss: 0.8451, test_loss: 1.0393, test_f1: 0.4428
 epoch: 98, train_loss: 0.8473, test_loss: 1.0373, test_f1: 0.4553
 epoch: 99, train_loss: 0.8474, test_loss: 1.0401, test_f1: 0.4529
##################ITERATION #7 ****************************************
 epoch: 0, train_loss: 1.2891, test_loss: 1.3156, test_f1: 0.2281
 epoch: 1, train_loss: 1.2570, test_loss: 1.3127, test_f1: 0.2281
 epoch: 2, train_loss: 1.2435, test_loss: 1.3106, test_f1: 0.2281
 epoch: 3, train_loss: 1.2289, test_loss: 1.3092, test_f1: 0.2281
 epoch: 4, train_loss: 1.2146, test_loss: 1.3074, test_f1: 0.2281
 epoch: 5, train_loss: 1.2077, test_loss: 1.3053, test_f1: 0.2281
 epoch: 6, train_loss: 1.1922, test_loss: 1.2973, test_f1: 0.2281
 epoch: 7, train_loss: 1.1826, test_loss: 1.2816, test_f1: 0.2281
 epoch: 8, train_loss: 1.1693, test_loss: 1.2640, test_f1: 0.2281
 epoch: 9, train_loss: 1.1607, test_loss: 1.2497, test_f1: 0.2675
 epoch: 10, train_loss: 1.1539, test_loss: 1.2369, test_f1: 0.2913
 epoch: 11, train_loss: 1.1441, test_loss: 1.2300, test_f1: 0.3051
 epoch: 12, train_loss: 1.1359, test_loss: 1.2173, test_f1: 0.3317
 epoch: 13, train_loss: 1.1196, test_loss: 1.2090, test_f1: 0.3226
 epoch: 14, train_loss: 1.1188, test_loss: 1.2007, test_f1: 0.3220
 epoch: 15, train_loss: 1.1102, test_loss: 1.1972, test_f1: 0.3192
 epoch: 16, train_loss: 1.1011, test_loss: 1.1906, test_f1: 0.3188
 epoch: 17, train_loss: 1.0946, test_loss: 1.1845, test_f1: 0.3192
 epoch: 18, train_loss: 1.0903, test_loss: 1.1803, test_f1: 0.3192
 epoch: 19, train_loss: 1.0829, test_loss: 1.1749, test_f1: 0.3270
 epoch: 20, train_loss: 1.0747, test_loss: 1.1712, test_f1: 0.3294
 epoch: 21, train_loss: 1.0662, test_loss: 1.1653, test_f1: 0.3312
 epoch: 22, train_loss: 1.0556, test_loss: 1.1553, test_f1: 0.3306
 epoch: 23, train_loss: 1.0627, test_loss: 1.1497, test_f1: 0.3374
 epoch: 24, train_loss: 1.0480, test_loss: 1.1458, test_f1: 0.3602
 epoch: 25, train_loss: 1.0404, test_loss: 1.1426, test_f1: 0.3674
 epoch: 26, train_loss: 1.0470, test_loss: 1.1437, test_f1: 0.3574
 epoch: 27, train_loss: 1.0297, test_loss: 1.1323, test_f1: 0.3651
 epoch: 28, train_loss: 1.0281, test_loss: 1.1253, test_f1: 0.3771
 epoch: 29, train_loss: 1.0217, test_loss: 1.1235, test_f1: 0.3725
 epoch: 30, train_loss: 1.0147, test_loss: 1.1186, test_f1: 0.3749
 epoch: 31, train_loss: 1.0042, test_loss: 1.1143, test_f1: 0.3700
 epoch: 32, train_loss: 0.9997, test_loss: 1.1071, test_f1: 0.3771
 epoch: 33, train_loss: 0.9949, test_loss: 1.1029, test_f1: 0.3772
 epoch: 34, train_loss: 0.9923, test_loss: 1.1014, test_f1: 0.3726
 epoch: 35, train_loss: 0.9918, test_loss: 1.0916, test_f1: 0.3796
 epoch: 36, train_loss: 0.9823, test_loss: 1.0881, test_f1: 0.3886
 epoch: 37, train_loss: 0.9792, test_loss: 1.0959, test_f1: 0.3807
 epoch: 38, train_loss: 0.9836, test_loss: 1.0921, test_f1: 0.3824
 epoch: 39, train_loss: 0.9708, test_loss: 1.0856, test_f1: 0.3879
 epoch: 40, train_loss: 0.9724, test_loss: 1.0801, test_f1: 0.4008
 epoch: 41, train_loss: 0.9681, test_loss: 1.0795, test_f1: 0.4102
 epoch: 42, train_loss: 0.9588, test_loss: 1.0705, test_f1: 0.4095
 epoch: 43, train_loss: 0.9576, test_loss: 1.0690, test_f1: 0.4078
 epoch: 44, train_loss: 0.9536, test_loss: 1.0762, test_f1: 0.3976
 epoch: 45, train_loss: 0.9602, test_loss: 1.0772, test_f1: 0.4173
 epoch: 46, train_loss: 0.9498, test_loss: 1.0738, test_f1: 0.4303
 epoch: 47, train_loss: 0.9404, test_loss: 1.0636, test_f1: 0.4291
 epoch: 48, train_loss: 0.9398, test_loss: 1.0676, test_f1: 0.4398
 epoch: 49, train_loss: 0.9341, test_loss: 1.0695, test_f1: 0.4360
 epoch: 50, train_loss: 0.9261, test_loss: 1.0638, test_f1: 0.4330
 epoch: 51, train_loss: 0.9274, test_loss: 1.0613, test_f1: 0.4443
 epoch: 52, train_loss: 0.9268, test_loss: 1.0594, test_f1: 0.4474
 epoch: 53, train_loss: 0.9205, test_loss: 1.0584, test_f1: 0.4458
 epoch: 54, train_loss: 0.9195, test_loss: 1.0608, test_f1: 0.4419
 epoch: 55, train_loss: 0.9203, test_loss: 1.0606, test_f1: 0.4451
 epoch: 56, train_loss: 0.9168, test_loss: 1.0584, test_f1: 0.4442
 epoch: 57, train_loss: 0.9160, test_loss: 1.0598, test_f1: 0.4439
 epoch: 58, train_loss: 0.9081, test_loss: 1.0618, test_f1: 0.4448
 epoch: 59, train_loss: 0.9161, test_loss: 1.0616, test_f1: 0.4496
 epoch: 60, train_loss: 0.9132, test_loss: 1.0552, test_f1: 0.4515
 epoch: 61, train_loss: 0.9082, test_loss: 1.0540, test_f1: 0.4443
 epoch: 62, train_loss: 0.9160, test_loss: 1.0505, test_f1: 0.4493
 epoch: 63, train_loss: 0.9075, test_loss: 1.0491, test_f1: 0.4539
 epoch: 64, train_loss: 0.9035, test_loss: 1.0461, test_f1: 0.4486
 epoch: 65, train_loss: 0.9064, test_loss: 1.0459, test_f1: 0.4544
 epoch: 66, train_loss: 0.8979, test_loss: 1.0460, test_f1: 0.4472
 epoch: 67, train_loss: 0.8982, test_loss: 1.0498, test_f1: 0.4492
 epoch: 68, train_loss: 0.8928, test_loss: 1.0451, test_f1: 0.4472
 epoch: 69, train_loss: 0.9007, test_loss: 1.0447, test_f1: 0.4497
 epoch: 70, train_loss: 0.8941, test_loss: 1.0443, test_f1: 0.4519
 epoch: 71, train_loss: 0.8940, test_loss: 1.0448, test_f1: 0.4491
 epoch: 72, train_loss: 0.8884, test_loss: 1.0417, test_f1: 0.4452
 epoch: 73, train_loss: 0.8868, test_loss: 1.0376, test_f1: 0.4491
 epoch: 74, train_loss: 0.8871, test_loss: 1.0447, test_f1: 0.4472
 epoch: 75, train_loss: 0.8800, test_loss: 1.0398, test_f1: 0.4487
 epoch: 76, train_loss: 0.8819, test_loss: 1.0337, test_f1: 0.4516
 epoch: 77, train_loss: 0.8766, test_loss: 1.0335, test_f1: 0.4560
 epoch: 78, train_loss: 0.8825, test_loss: 1.0322, test_f1: 0.4536
 epoch: 79, train_loss: 0.8850, test_loss: 1.0381, test_f1: 0.4531
 epoch: 80, train_loss: 0.8804, test_loss: 1.0386, test_f1: 0.4597
 epoch: 81, train_loss: 0.8871, test_loss: 1.0373, test_f1: 0.4613
 epoch: 82, train_loss: 0.8773, test_loss: 1.0261, test_f1: 0.4596
 epoch: 83, train_loss: 0.8764, test_loss: 1.0200, test_f1: 0.4628
 epoch: 84, train_loss: 0.8701, test_loss: 1.0184, test_f1: 0.4576
 epoch: 85, train_loss: 0.8696, test_loss: 1.0237, test_f1: 0.4573
 epoch: 86, train_loss: 0.8719, test_loss: 1.0291, test_f1: 0.4543
 epoch: 87, train_loss: 0.8755, test_loss: 1.0212, test_f1: 0.4541
 epoch: 88, train_loss: 0.8729, test_loss: 1.0150, test_f1: 0.4637
 epoch: 89, train_loss: 0.8664, test_loss: 1.0155, test_f1: 0.4644
 epoch: 90, train_loss: 0.8624, test_loss: 1.0136, test_f1: 0.4640
 epoch: 91, train_loss: 0.8571, test_loss: 1.0111, test_f1: 0.4754
 epoch: 92, train_loss: 0.8591, test_loss: 1.0221, test_f1: 0.4782
 epoch: 93, train_loss: 0.8618, test_loss: 1.0178, test_f1: 0.4638
 epoch: 94, train_loss: 0.8576, test_loss: 1.0172, test_f1: 0.4831
 epoch: 95, train_loss: 0.8547, test_loss: 1.0261, test_f1: 0.4813
 epoch: 96, train_loss: 0.8521, test_loss: 1.0297, test_f1: 0.4884
 epoch: 97, train_loss: 0.8515, test_loss: 1.0227, test_f1: 0.4952
 epoch: 98, train_loss: 0.8564, test_loss: 1.0195, test_f1: 0.4888
 epoch: 99, train_loss: 0.8490, test_loss: 1.0196, test_f1: 0.4955
##################ITERATION #8 ****************************************
 epoch: 0, train_loss: 1.2893, test_loss: 1.3224, test_f1: 0.2281
 epoch: 1, train_loss: 1.2415, test_loss: 1.3173, test_f1: 0.2281
 epoch: 2, train_loss: 1.2223, test_loss: 1.3127, test_f1: 0.2281
 epoch: 3, train_loss: 1.2082, test_loss: 1.3007, test_f1: 0.2281
 epoch: 4, train_loss: 1.1982, test_loss: 1.2909, test_f1: 0.2281
 epoch: 5, train_loss: 1.1742, test_loss: 1.2804, test_f1: 0.2281
 epoch: 6, train_loss: 1.1657, test_loss: 1.2700, test_f1: 0.2281
 epoch: 7, train_loss: 1.1574, test_loss: 1.2588, test_f1: 0.2281
 epoch: 8, train_loss: 1.1395, test_loss: 1.2394, test_f1: 0.2281
 epoch: 9, train_loss: 1.1261, test_loss: 1.2219, test_f1: 0.2949
 epoch: 10, train_loss: 1.1155, test_loss: 1.2065, test_f1: 0.3317
 epoch: 11, train_loss: 1.1062, test_loss: 1.1955, test_f1: 0.3323
 epoch: 12, train_loss: 1.1013, test_loss: 1.1931, test_f1: 0.3485
 epoch: 13, train_loss: 1.0864, test_loss: 1.1913, test_f1: 0.3536
 epoch: 14, train_loss: 1.0824, test_loss: 1.1804, test_f1: 0.3553
 epoch: 15, train_loss: 1.0733, test_loss: 1.1706, test_f1: 0.3571
 epoch: 16, train_loss: 1.0550, test_loss: 1.1629, test_f1: 0.3636
 epoch: 17, train_loss: 1.0510, test_loss: 1.1522, test_f1: 0.3753
 epoch: 18, train_loss: 1.0441, test_loss: 1.1464, test_f1: 0.3744
 epoch: 19, train_loss: 1.0362, test_loss: 1.1467, test_f1: 0.3721
 epoch: 20, train_loss: 1.0317, test_loss: 1.1424, test_f1: 0.3807
 epoch: 21, train_loss: 1.0275, test_loss: 1.1316, test_f1: 0.3763
 epoch: 22, train_loss: 1.0178, test_loss: 1.1282, test_f1: 0.3925
 epoch: 23, train_loss: 1.0111, test_loss: 1.1184, test_f1: 0.3943
 epoch: 24, train_loss: 1.0069, test_loss: 1.1184, test_f1: 0.3974
 epoch: 25, train_loss: 1.0041, test_loss: 1.1150, test_f1: 0.3994
 epoch: 26, train_loss: 0.9903, test_loss: 1.1067, test_f1: 0.4028
 epoch: 27, train_loss: 0.9910, test_loss: 1.1008, test_f1: 0.4022
 epoch: 28, train_loss: 0.9809, test_loss: 1.1027, test_f1: 0.4023
 epoch: 29, train_loss: 0.9781, test_loss: 1.0958, test_f1: 0.4164
 epoch: 30, train_loss: 0.9705, test_loss: 1.0916, test_f1: 0.4099
 epoch: 31, train_loss: 0.9691, test_loss: 1.0975, test_f1: 0.4022
 epoch: 32, train_loss: 0.9618, test_loss: 1.0893, test_f1: 0.4069
 epoch: 33, train_loss: 0.9632, test_loss: 1.0913, test_f1: 0.4075
 epoch: 34, train_loss: 0.9571, test_loss: 1.0911, test_f1: 0.4058
 epoch: 35, train_loss: 0.9550, test_loss: 1.0921, test_f1: 0.4073
 epoch: 36, train_loss: 0.9493, test_loss: 1.0837, test_f1: 0.4085
 epoch: 37, train_loss: 0.9426, test_loss: 1.0780, test_f1: 0.4104
 epoch: 38, train_loss: 0.9324, test_loss: 1.0748, test_f1: 0.4104
 epoch: 39, train_loss: 0.9263, test_loss: 1.0726, test_f1: 0.4333
 epoch: 40, train_loss: 0.9263, test_loss: 1.0749, test_f1: 0.4388
 epoch: 41, train_loss: 0.9223, test_loss: 1.0874, test_f1: 0.4321
 epoch: 42, train_loss: 0.9220, test_loss: 1.0868, test_f1: 0.4327
 epoch: 43, train_loss: 0.9168, test_loss: 1.0763, test_f1: 0.4450
 epoch: 44, train_loss: 0.9095, test_loss: 1.0669, test_f1: 0.4443
 epoch: 45, train_loss: 0.9061, test_loss: 1.0733, test_f1: 0.4614
 epoch: 46, train_loss: 0.9052, test_loss: 1.0799, test_f1: 0.4636
 epoch: 47, train_loss: 0.9056, test_loss: 1.0801, test_f1: 0.4673
 epoch: 48, train_loss: 0.8974, test_loss: 1.0825, test_f1: 0.4526
 epoch: 49, train_loss: 0.9004, test_loss: 1.0730, test_f1: 0.4702
 epoch: 50, train_loss: 0.8898, test_loss: 1.0575, test_f1: 0.4908
 epoch: 51, train_loss: 0.8871, test_loss: 1.0529, test_f1: 0.4821
 epoch: 52, train_loss: 0.8824, test_loss: 1.0670, test_f1: 0.4872
 epoch: 53, train_loss: 0.8869, test_loss: 1.0554, test_f1: 0.4874
 epoch: 54, train_loss: 0.8899, test_loss: 1.0588, test_f1: 0.4794
 epoch: 55, train_loss: 0.8794, test_loss: 1.0682, test_f1: 0.4832
 epoch: 56, train_loss: 0.8787, test_loss: 1.0772, test_f1: 0.4903
 epoch: 57, train_loss: 0.8723, test_loss: 1.0790, test_f1: 0.5010
 epoch: 58, train_loss: 0.8819, test_loss: 1.0740, test_f1: 0.4980
 epoch: 59, train_loss: 0.8787, test_loss: 1.0717, test_f1: 0.4915
 epoch: 60, train_loss: 0.8712, test_loss: 1.0697, test_f1: 0.4956
 epoch: 61, train_loss: 0.8703, test_loss: 1.0765, test_f1: 0.4996
 epoch: 62, train_loss: 0.8714, test_loss: 1.0805, test_f1: 0.4933
 epoch: 63, train_loss: 0.8683, test_loss: 1.0729, test_f1: 0.5012
 epoch: 64, train_loss: 0.8596, test_loss: 1.0801, test_f1: 0.4994
 epoch: 65, train_loss: 0.8603, test_loss: 1.0761, test_f1: 0.4980
 epoch: 66, train_loss: 0.8565, test_loss: 1.0788, test_f1: 0.5023
 epoch: 67, train_loss: 0.8576, test_loss: 1.0821, test_f1: 0.5111
 epoch: 68, train_loss: 0.8651, test_loss: 1.0773, test_f1: 0.5188
 epoch: 69, train_loss: 0.8518, test_loss: 1.0642, test_f1: 0.5128
 epoch: 70, train_loss: 0.8566, test_loss: 1.0642, test_f1: 0.5237
 epoch: 71, train_loss: 0.8516, test_loss: 1.0754, test_f1: 0.5217
 epoch: 72, train_loss: 0.8540, test_loss: 1.0660, test_f1: 0.5126
 epoch: 73, train_loss: 0.8551, test_loss: 1.0755, test_f1: 0.5095
 epoch: 74, train_loss: 0.8471, test_loss: 1.0835, test_f1: 0.5145
 epoch: 75, train_loss: 0.8468, test_loss: 1.0897, test_f1: 0.5125
 epoch: 76, train_loss: 0.8373, test_loss: 1.0979, test_f1: 0.5217
 epoch: 77, train_loss: 0.8416, test_loss: 1.0886, test_f1: 0.5275
 epoch: 78, train_loss: 0.8380, test_loss: 1.0814, test_f1: 0.5236
 epoch: 79, train_loss: 0.8410, test_loss: 1.0757, test_f1: 0.5196
 epoch: 80, train_loss: 0.8422, test_loss: 1.0732, test_f1: 0.5280
 epoch: 81, train_loss: 0.8399, test_loss: 1.0747, test_f1: 0.5295
 epoch: 82, train_loss: 0.8441, test_loss: 1.0826, test_f1: 0.5231
 epoch: 83, train_loss: 0.8328, test_loss: 1.0751, test_f1: 0.5193
 epoch: 84, train_loss: 0.8302, test_loss: 1.0783, test_f1: 0.5255
 epoch: 85, train_loss: 0.8268, test_loss: 1.0878, test_f1: 0.5282
 epoch: 86, train_loss: 0.8311, test_loss: 1.0765, test_f1: 0.5245
 epoch: 87, train_loss: 0.8255, test_loss: 1.0680, test_f1: 0.5290
 epoch: 88, train_loss: 0.8242, test_loss: 1.0756, test_f1: 0.5229
 epoch: 89, train_loss: 0.8278, test_loss: 1.0712, test_f1: 0.5284
 epoch: 90, train_loss: 0.8278, test_loss: 1.0781, test_f1: 0.5171
 epoch: 91, train_loss: 0.8248, test_loss: 1.0866, test_f1: 0.5170
 epoch: 92, train_loss: 0.8221, test_loss: 1.0953, test_f1: 0.5127
 epoch: 93, train_loss: 0.8283, test_loss: 1.1001, test_f1: 0.5124
 epoch: 94, train_loss: 0.8126, test_loss: 1.1095, test_f1: 0.5184
 epoch: 95, train_loss: 0.8212, test_loss: 1.1050, test_f1: 0.5263
 epoch: 96, train_loss: 0.8198, test_loss: 1.1059, test_f1: 0.5258
 epoch: 97, train_loss: 0.8146, test_loss: 1.1095, test_f1: 0.5273
 epoch: 98, train_loss: 0.8139, test_loss: 1.0981, test_f1: 0.5270
 epoch: 99, train_loss: 0.8097, test_loss: 1.0948, test_f1: 0.5263
##################ITERATION #9 ****************************************
 epoch: 0, train_loss: 1.2621, test_loss: 1.2993, test_f1: 0.2281
 epoch: 1, train_loss: 1.2240, test_loss: 1.3109, test_f1: 0.2281
 epoch: 2, train_loss: 1.2017, test_loss: 1.3082, test_f1: 0.2281
 epoch: 3, train_loss: 1.1981, test_loss: 1.2966, test_f1: 0.2281
 epoch: 4, train_loss: 1.1789, test_loss: 1.2892, test_f1: 0.2281
 epoch: 5, train_loss: 1.1668, test_loss: 1.2880, test_f1: 0.2248
 epoch: 6, train_loss: 1.1576, test_loss: 1.2740, test_f1: 0.2281
 epoch: 7, train_loss: 1.1429, test_loss: 1.2517, test_f1: 0.2281
 epoch: 8, train_loss: 1.1447, test_loss: 1.2411, test_f1: 0.2642
 epoch: 9, train_loss: 1.1277, test_loss: 1.2232, test_f1: 0.3176
 epoch: 10, train_loss: 1.1149, test_loss: 1.2091, test_f1: 0.3223
 epoch: 11, train_loss: 1.1106, test_loss: 1.2001, test_f1: 0.3656
 epoch: 12, train_loss: 1.1022, test_loss: 1.1894, test_f1: 0.3780
 epoch: 13, train_loss: 1.1016, test_loss: 1.1815, test_f1: 0.3914
 epoch: 14, train_loss: 1.0899, test_loss: 1.1774, test_f1: 0.3993
 epoch: 15, train_loss: 1.0785, test_loss: 1.1721, test_f1: 0.3933
 epoch: 16, train_loss: 1.0770, test_loss: 1.1666, test_f1: 0.3988
 epoch: 17, train_loss: 1.0630, test_loss: 1.1618, test_f1: 0.4003
 epoch: 18, train_loss: 1.0587, test_loss: 1.1575, test_f1: 0.4025
 epoch: 19, train_loss: 1.0465, test_loss: 1.1577, test_f1: 0.4042
 epoch: 20, train_loss: 1.0490, test_loss: 1.1565, test_f1: 0.4043
 epoch: 21, train_loss: 1.0373, test_loss: 1.1526, test_f1: 0.4109
 epoch: 22, train_loss: 1.0367, test_loss: 1.1499, test_f1: 0.4117
 epoch: 23, train_loss: 1.0297, test_loss: 1.1473, test_f1: 0.4197
 epoch: 24, train_loss: 1.0236, test_loss: 1.1447, test_f1: 0.4129
 epoch: 25, train_loss: 1.0131, test_loss: 1.1445, test_f1: 0.4108
 epoch: 26, train_loss: 1.0126, test_loss: 1.1453, test_f1: 0.4164
 epoch: 27, train_loss: 1.0072, test_loss: 1.1437, test_f1: 0.4262
 epoch: 28, train_loss: 1.0009, test_loss: 1.1416, test_f1: 0.4335
 epoch: 29, train_loss: 0.9977, test_loss: 1.1382, test_f1: 0.4320
 epoch: 30, train_loss: 0.9957, test_loss: 1.1332, test_f1: 0.4414
 epoch: 31, train_loss: 0.9884, test_loss: 1.1282, test_f1: 0.4448
 epoch: 32, train_loss: 0.9805, test_loss: 1.1290, test_f1: 0.4442
 epoch: 33, train_loss: 0.9819, test_loss: 1.1324, test_f1: 0.4438
 epoch: 34, train_loss: 0.9752, test_loss: 1.1366, test_f1: 0.4470
 epoch: 35, train_loss: 0.9728, test_loss: 1.1322, test_f1: 0.4432
 epoch: 36, train_loss: 0.9734, test_loss: 1.1350, test_f1: 0.4456
 epoch: 37, train_loss: 0.9628, test_loss: 1.1327, test_f1: 0.4419
 epoch: 38, train_loss: 0.9580, test_loss: 1.1292, test_f1: 0.4497
 epoch: 39, train_loss: 0.9632, test_loss: 1.1261, test_f1: 0.4560
 epoch: 40, train_loss: 0.9548, test_loss: 1.1188, test_f1: 0.4513
 epoch: 41, train_loss: 0.9521, test_loss: 1.1166, test_f1: 0.4480
 epoch: 42, train_loss: 0.9471, test_loss: 1.1120, test_f1: 0.4501
 epoch: 43, train_loss: 0.9411, test_loss: 1.1135, test_f1: 0.4413
 epoch: 44, train_loss: 0.9389, test_loss: 1.1145, test_f1: 0.4356
 epoch: 45, train_loss: 0.9313, test_loss: 1.1247, test_f1: 0.4395
 epoch: 46, train_loss: 0.9349, test_loss: 1.1219, test_f1: 0.4339
 epoch: 47, train_loss: 0.9324, test_loss: 1.1130, test_f1: 0.4356
 epoch: 48, train_loss: 0.9295, test_loss: 1.1127, test_f1: 0.4306
 epoch: 49, train_loss: 0.9151, test_loss: 1.1130, test_f1: 0.4517
 epoch: 50, train_loss: 0.9280, test_loss: 1.1081, test_f1: 0.4473
 epoch: 51, train_loss: 0.9200, test_loss: 1.1204, test_f1: 0.4339
 epoch: 52, train_loss: 0.9137, test_loss: 1.1248, test_f1: 0.4294
 epoch: 53, train_loss: 0.9178, test_loss: 1.1255, test_f1: 0.4352
 epoch: 54, train_loss: 0.9068, test_loss: 1.1217, test_f1: 0.4498
 epoch: 55, train_loss: 0.9152, test_loss: 1.1203, test_f1: 0.4514
 epoch: 56, train_loss: 0.9102, test_loss: 1.1229, test_f1: 0.4453
 epoch: 57, train_loss: 0.9016, test_loss: 1.1279, test_f1: 0.4505
 epoch: 58, train_loss: 0.9065, test_loss: 1.1270, test_f1: 0.4520
 epoch: 59, train_loss: 0.9021, test_loss: 1.1231, test_f1: 0.4345
 epoch: 60, train_loss: 0.8982, test_loss: 1.1264, test_f1: 0.4370
 epoch: 61, train_loss: 0.9001, test_loss: 1.1188, test_f1: 0.4345
 epoch: 62, train_loss: 0.8964, test_loss: 1.1154, test_f1: 0.4422
 epoch: 63, train_loss: 0.8925, test_loss: 1.1194, test_f1: 0.4449
 epoch: 64, train_loss: 0.8963, test_loss: 1.1182, test_f1: 0.4361
 epoch: 65, train_loss: 0.8874, test_loss: 1.1293, test_f1: 0.4357
 epoch: 66, train_loss: 0.8944, test_loss: 1.1275, test_f1: 0.4365
 epoch: 67, train_loss: 0.8904, test_loss: 1.1282, test_f1: 0.4324
 epoch: 68, train_loss: 0.8931, test_loss: 1.1129, test_f1: 0.4386
 epoch: 69, train_loss: 0.8901, test_loss: 1.1110, test_f1: 0.4316
 epoch: 70, train_loss: 0.8882, test_loss: 1.1041, test_f1: 0.4300
 epoch: 71, train_loss: 0.8803, test_loss: 1.1198, test_f1: 0.4420
 epoch: 72, train_loss: 0.8828, test_loss: 1.1256, test_f1: 0.4408
 epoch: 73, train_loss: 0.8807, test_loss: 1.1280, test_f1: 0.4384
 epoch: 74, train_loss: 0.8800, test_loss: 1.1223, test_f1: 0.4422
 epoch: 75, train_loss: 0.8793, test_loss: 1.1268, test_f1: 0.4365
 epoch: 76, train_loss: 0.8821, test_loss: 1.1129, test_f1: 0.4377
 epoch: 77, train_loss: 0.8755, test_loss: 1.1091, test_f1: 0.4336
 epoch: 78, train_loss: 0.8776, test_loss: 1.1021, test_f1: 0.4444
 epoch: 79, train_loss: 0.8714, test_loss: 1.0991, test_f1: 0.4509
 epoch: 80, train_loss: 0.8659, test_loss: 1.1058, test_f1: 0.4465
 epoch: 81, train_loss: 0.8698, test_loss: 1.1053, test_f1: 0.4567
 epoch: 82, train_loss: 0.8656, test_loss: 1.1034, test_f1: 0.4381
 epoch: 83, train_loss: 0.8677, test_loss: 1.1055, test_f1: 0.4405
 epoch: 84, train_loss: 0.8658, test_loss: 1.1066, test_f1: 0.4485
 epoch: 85, train_loss: 0.8623, test_loss: 1.1078, test_f1: 0.4379
 epoch: 86, train_loss: 0.8662, test_loss: 1.1078, test_f1: 0.4361
 epoch: 87, train_loss: 0.8552, test_loss: 1.1112, test_f1: 0.4383
 epoch: 88, train_loss: 0.8621, test_loss: 1.0949, test_f1: 0.4477
 epoch: 89, train_loss: 0.8618, test_loss: 1.0870, test_f1: 0.4499
 epoch: 90, train_loss: 0.8547, test_loss: 1.0900, test_f1: 0.4475
 epoch: 91, train_loss: 0.8542, test_loss: 1.0955, test_f1: 0.4380
 epoch: 92, train_loss: 0.8485, test_loss: 1.1054, test_f1: 0.4527
 epoch: 93, train_loss: 0.8475, test_loss: 1.1195, test_f1: 0.4515
 epoch: 94, train_loss: 0.8493, test_loss: 1.1291, test_f1: 0.4501
 epoch: 95, train_loss: 0.8469, test_loss: 1.1311, test_f1: 0.4490
 epoch: 96, train_loss: 0.8485, test_loss: 1.1408, test_f1: 0.4438
 epoch: 97, train_loss: 0.8500, test_loss: 1.1316, test_f1: 0.4564
 epoch: 98, train_loss: 0.8444, test_loss: 1.1169, test_f1: 0.4564
 epoch: 99, train_loss: 0.8461, test_loss: 1.1138, test_f1: 0.4663

Training completed in 316.14 seconds
Best F1: 0.5295 at epoch 81
Mean F1 across iterations: 0.4670  0.0315
========================FINAL RESULTS================================
FEGIN weighted F1: 0.5295  0.0315
python main.py --data ltspice_demos --representation component_pin --model FEGIN --layers 4 --hiddens 64 --batch_size 256 --lr 0.0001 --emb_size 128 --epochs 100 --save_appendix component_pin_L4_H64_BS256_LR0.0001_E128 --no_val
-----



STDERR:
  File "main.py", line 370, in <module>
    main()
  File "main.py", line 254, in main
    dataset = dataset_class(
  File "/home/philip/projects/ltspice_examples_code_repo/Circuit-Completion-Using-GNNs/component_classification_with_link_prediction_head/evaluation/FEGIN/kernel/circuit_datasets.py", line 15, in __init__
    self.data, self.slices = torch.load(self.processed_paths[0])
  File "/home/philip/.local/lib/python3.8/site-packages/torch/serialization.py", line 1040, in load
    warnings.warn(
  File "/usr/lib/python3.8/warnings.py", line 109, in _showwarnmsg
    sw(msg.message, msg.category, msg.filename, msg.lineno,
  File "main.py", line 47, in warn_with_traceback
    traceback.print_stack(file=log)
/home/philip/projects/ltspice_examples_code_repo/Circuit-Completion-Using-GNNs/component_classification_with_link_prediction_head/evaluation/FEGIN/kernel/circuit_datasets.py:15: FutureWarning: You are using `torch.load` with `weights_only=False` (the current default value), which uses the default pickle module implicitly. It is possible to construct malicious pickle data which will execute arbitrary code during unpickling (See https://github.com/pytorch/pytorch/blob/main/SECURITY.md#untrusted-models for more details). In a future release, the default value for `weights_only` will be flipped to `True`. This limits the functions that could be executed during unpickling. Arbitrary objects will no longer be allowed to be loaded via this mode unless they are explicitly allowlisted by the user via `torch.serialization.add_safe_globals`. We recommend you start setting `weights_only=True` for any use case where you don't have full control of the loaded file. Please open an issue on GitHub for any issues related to this experimental feature.
  self.data, self.slices = torch.load(self.processed_paths[0])
