STDOUT:
Results will be saved in /home/philip/projects/ltspice_examples_code_repo/Circuit-Completion-Using-GNNs/component_classification_with_link_prediction_head/evaluation/FEGIN/results/model_FEGIN_dataset_ltspice_examples
Command line input: python main.py --data ltspice_examples --representation component_pin --model FEGIN --layers 3 --hiddens 16 --batch_size 64 --lr 0.001 --emb_size 250 --epochs 100 --save_appendix component_pin_L3_H16_BS64_LR0.001_E250 --no_val
 is saved.
-----
ltspice_examples - FEGIN
Using 3 layers, 16 hidden units, h = 2
Loading component_pin representation dataset
ENTERED
Training FEGIN on component_pin representation
Train: 3560, Test: 848
##################ITERATION #0 ****************************************
 epoch: 0, train_loss: 1.3313, test_loss: 1.3087, test_f1: 0.2260
 epoch: 1, train_loss: 1.2618, test_loss: 1.2109, test_f1: 0.3392
 epoch: 2, train_loss: 1.1614, test_loss: 1.0870, test_f1: 0.3410
 epoch: 3, train_loss: 1.0904, test_loss: 1.0906, test_f1: 0.3275
 epoch: 4, train_loss: 1.0644, test_loss: 1.0558, test_f1: 0.3395
 epoch: 5, train_loss: 1.0524, test_loss: 1.0212, test_f1: 0.3390
 epoch: 6, train_loss: 1.0352, test_loss: 1.0012, test_f1: 0.3519
 epoch: 7, train_loss: 1.0138, test_loss: 1.0571, test_f1: 0.3463
 epoch: 8, train_loss: 1.0047, test_loss: 0.9898, test_f1: 0.3553
 epoch: 9, train_loss: 0.9924, test_loss: 1.0057, test_f1: 0.4321
 epoch: 10, train_loss: 0.9864, test_loss: 0.9686, test_f1: 0.4206
 epoch: 11, train_loss: 0.9773, test_loss: 0.9728, test_f1: 0.4196
 epoch: 12, train_loss: 0.9763, test_loss: 1.0213, test_f1: 0.4357
 epoch: 13, train_loss: 0.9615, test_loss: 1.0103, test_f1: 0.4348
 epoch: 14, train_loss: 0.9569, test_loss: 0.9841, test_f1: 0.4628
 epoch: 15, train_loss: 0.9556, test_loss: 0.9790, test_f1: 0.4632
 epoch: 16, train_loss: 0.9420, test_loss: 1.0283, test_f1: 0.4201
 epoch: 17, train_loss: 0.9430, test_loss: 1.0120, test_f1: 0.4566
 epoch: 18, train_loss: 0.9353, test_loss: 0.9730, test_f1: 0.4636
 epoch: 19, train_loss: 0.9278, test_loss: 0.9923, test_f1: 0.4637
 epoch: 20, train_loss: 0.9367, test_loss: 0.9525, test_f1: 0.4763
 epoch: 21, train_loss: 0.9121, test_loss: 0.9391, test_f1: 0.4816
 epoch: 22, train_loss: 0.9166, test_loss: 0.9702, test_f1: 0.4760
 epoch: 23, train_loss: 0.9050, test_loss: 0.9794, test_f1: 0.4558
 epoch: 24, train_loss: 0.9109, test_loss: 0.9707, test_f1: 0.4960
 epoch: 25, train_loss: 0.9093, test_loss: 0.9672, test_f1: 0.4884
 epoch: 26, train_loss: 0.8859, test_loss: 0.9469, test_f1: 0.5150
 epoch: 27, train_loss: 0.8868, test_loss: 0.9448, test_f1: 0.4880
 epoch: 28, train_loss: 0.8800, test_loss: 0.9364, test_f1: 0.4919
 epoch: 29, train_loss: 0.8792, test_loss: 0.9250, test_f1: 0.5003
 epoch: 30, train_loss: 0.8692, test_loss: 0.9245, test_f1: 0.5029
 epoch: 31, train_loss: 0.8568, test_loss: 0.9231, test_f1: 0.5244
 epoch: 32, train_loss: 0.8563, test_loss: 0.9347, test_f1: 0.5280
 epoch: 33, train_loss: 0.8618, test_loss: 0.9444, test_f1: 0.5169
 epoch: 34, train_loss: 0.8510, test_loss: 0.9432, test_f1: 0.5299
 epoch: 35, train_loss: 0.8397, test_loss: 0.9338, test_f1: 0.5016
 epoch: 36, train_loss: 0.8377, test_loss: 0.9797, test_f1: 0.4786
 epoch: 37, train_loss: 0.8386, test_loss: 0.8989, test_f1: 0.5408
 epoch: 38, train_loss: 0.8339, test_loss: 0.9493, test_f1: 0.5144
 epoch: 39, train_loss: 0.8290, test_loss: 0.9347, test_f1: 0.5441
 epoch: 40, train_loss: 0.8241, test_loss: 0.9321, test_f1: 0.5377
 epoch: 41, train_loss: 0.8193, test_loss: 0.9510, test_f1: 0.5432
 epoch: 42, train_loss: 0.8157, test_loss: 0.9419, test_f1: 0.5301
 epoch: 43, train_loss: 0.8079, test_loss: 0.9266, test_f1: 0.5501
 epoch: 44, train_loss: 0.8156, test_loss: 0.9750, test_f1: 0.5381
 epoch: 45, train_loss: 0.8134, test_loss: 0.9129, test_f1: 0.5403
 epoch: 46, train_loss: 0.7996, test_loss: 0.9416, test_f1: 0.5408
 epoch: 47, train_loss: 0.8070, test_loss: 0.9043, test_f1: 0.5279
 epoch: 48, train_loss: 0.8028, test_loss: 0.9180, test_f1: 0.5423
 epoch: 49, train_loss: 0.7952, test_loss: 0.9592, test_f1: 0.5139
 epoch: 50, train_loss: 0.8097, test_loss: 0.8580, test_f1: 0.5439
 epoch: 51, train_loss: 0.7860, test_loss: 0.9198, test_f1: 0.5336
 epoch: 52, train_loss: 0.7932, test_loss: 0.9295, test_f1: 0.5353
 epoch: 53, train_loss: 0.7764, test_loss: 0.9030, test_f1: 0.5469
 epoch: 54, train_loss: 0.7682, test_loss: 0.9038, test_f1: 0.5371
 epoch: 55, train_loss: 0.7760, test_loss: 0.9199, test_f1: 0.5393
 epoch: 56, train_loss: 0.7670, test_loss: 0.9139, test_f1: 0.5321
 epoch: 57, train_loss: 0.7754, test_loss: 0.9147, test_f1: 0.5488
 epoch: 58, train_loss: 0.7671, test_loss: 0.9466, test_f1: 0.5454
 epoch: 59, train_loss: 0.7720, test_loss: 0.9014, test_f1: 0.5457
 epoch: 60, train_loss: 0.7707, test_loss: 0.9034, test_f1: 0.5456
 epoch: 61, train_loss: 0.7681, test_loss: 0.9200, test_f1: 0.5418
 epoch: 62, train_loss: 0.7702, test_loss: 0.9221, test_f1: 0.5521
 epoch: 63, train_loss: 0.7674, test_loss: 0.9512, test_f1: 0.5427
 epoch: 64, train_loss: 0.7575, test_loss: 0.9404, test_f1: 0.5472
 epoch: 65, train_loss: 0.7685, test_loss: 0.9005, test_f1: 0.5378
 epoch: 66, train_loss: 0.7612, test_loss: 0.9272, test_f1: 0.5509
 epoch: 67, train_loss: 0.7638, test_loss: 0.9928, test_f1: 0.5322
 epoch: 68, train_loss: 0.7552, test_loss: 0.9614, test_f1: 0.5442
 epoch: 69, train_loss: 0.7526, test_loss: 0.9190, test_f1: 0.5412
 epoch: 70, train_loss: 0.7567, test_loss: 1.0108, test_f1: 0.5359
 epoch: 71, train_loss: 0.7561, test_loss: 0.9186, test_f1: 0.5414
 epoch: 72, train_loss: 0.7438, test_loss: 0.9177, test_f1: 0.5426
 epoch: 73, train_loss: 0.7694, test_loss: 0.9246, test_f1: 0.5413
 epoch: 74, train_loss: 0.7656, test_loss: 0.9823, test_f1: 0.5186
 epoch: 75, train_loss: 0.7583, test_loss: 0.9478, test_f1: 0.5359
 epoch: 76, train_loss: 0.7457, test_loss: 0.9200, test_f1: 0.5469
 epoch: 77, train_loss: 0.7504, test_loss: 0.9246, test_f1: 0.5456
 epoch: 78, train_loss: 0.7501, test_loss: 0.9557, test_f1: 0.5242
 epoch: 79, train_loss: 0.7408, test_loss: 0.9459, test_f1: 0.5320
 epoch: 80, train_loss: 0.7535, test_loss: 0.9182, test_f1: 0.5444
 epoch: 81, train_loss: 0.7548, test_loss: 0.9175, test_f1: 0.5419
 epoch: 82, train_loss: 0.7456, test_loss: 0.9241, test_f1: 0.5393
 epoch: 83, train_loss: 0.7445, test_loss: 0.9281, test_f1: 0.5595
 epoch: 84, train_loss: 0.7432, test_loss: 0.8998, test_f1: 0.5634
 epoch: 85, train_loss: 0.7378, test_loss: 0.9319, test_f1: 0.5349
 epoch: 86, train_loss: 0.7455, test_loss: 1.0373, test_f1: 0.5285
 epoch: 87, train_loss: 0.7468, test_loss: 0.8983, test_f1: 0.5533
 epoch: 88, train_loss: 0.7356, test_loss: 1.0300, test_f1: 0.5305
 epoch: 89, train_loss: 0.7281, test_loss: 0.9275, test_f1: 0.5470
 epoch: 90, train_loss: 0.7305, test_loss: 0.9215, test_f1: 0.5512
 epoch: 91, train_loss: 0.7314, test_loss: 0.9368, test_f1: 0.5398
 epoch: 92, train_loss: 0.7312, test_loss: 0.9110, test_f1: 0.5472
 epoch: 93, train_loss: 0.7336, test_loss: 0.9287, test_f1: 0.5498
 epoch: 94, train_loss: 0.7311, test_loss: 0.9117, test_f1: 0.5582
 epoch: 95, train_loss: 0.7186, test_loss: 0.8757, test_f1: 0.5540
 epoch: 96, train_loss: 0.7307, test_loss: 0.9568, test_f1: 0.5468
 epoch: 97, train_loss: 0.7161, test_loss: 0.9007, test_f1: 0.5579
 epoch: 98, train_loss: 0.7377, test_loss: 0.9699, test_f1: 0.5541
 epoch: 99, train_loss: 0.7383, test_loss: 0.9114, test_f1: 0.5415
##################ITERATION #1 ****************************************
 epoch: 0, train_loss: 1.2739, test_loss: 1.2146, test_f1: 0.2621
 epoch: 1, train_loss: 1.1541, test_loss: 1.0797, test_f1: 0.3506
 epoch: 2, train_loss: 1.0637, test_loss: 1.0391, test_f1: 0.3429
 epoch: 3, train_loss: 1.0338, test_loss: 1.0285, test_f1: 0.3479
 epoch: 4, train_loss: 1.0266, test_loss: 1.0329, test_f1: 0.3497
 epoch: 5, train_loss: 1.0074, test_loss: 1.0081, test_f1: 0.3532
 epoch: 6, train_loss: 0.9979, test_loss: 1.0186, test_f1: 0.3728
 epoch: 7, train_loss: 1.0001, test_loss: 1.0015, test_f1: 0.3783
 epoch: 8, train_loss: 0.9898, test_loss: 0.9948, test_f1: 0.3777
 epoch: 9, train_loss: 0.9737, test_loss: 0.9869, test_f1: 0.4307
 epoch: 10, train_loss: 0.9694, test_loss: 0.9825, test_f1: 0.4749
 epoch: 11, train_loss: 0.9577, test_loss: 0.9832, test_f1: 0.4795
 epoch: 12, train_loss: 0.9526, test_loss: 0.9763, test_f1: 0.4898
 epoch: 13, train_loss: 0.9441, test_loss: 0.9592, test_f1: 0.4559
 epoch: 14, train_loss: 0.9393, test_loss: 0.9598, test_f1: 0.4877
 epoch: 15, train_loss: 0.9215, test_loss: 0.9222, test_f1: 0.5252
 epoch: 16, train_loss: 0.9188, test_loss: 0.9272, test_f1: 0.5026
 epoch: 17, train_loss: 0.9130, test_loss: 0.9992, test_f1: 0.4903
 epoch: 18, train_loss: 0.9132, test_loss: 0.9436, test_f1: 0.4985
 epoch: 19, train_loss: 0.8988, test_loss: 0.9130, test_f1: 0.5173
 epoch: 20, train_loss: 0.8939, test_loss: 0.8964, test_f1: 0.5217
 epoch: 21, train_loss: 0.8836, test_loss: 0.9219, test_f1: 0.5135
 epoch: 22, train_loss: 0.8792, test_loss: 0.9469, test_f1: 0.5224
 epoch: 23, train_loss: 0.8777, test_loss: 0.8959, test_f1: 0.5141
 epoch: 24, train_loss: 0.8733, test_loss: 0.9172, test_f1: 0.5168
 epoch: 25, train_loss: 0.8670, test_loss: 0.9226, test_f1: 0.5153
 epoch: 26, train_loss: 0.8692, test_loss: 0.8993, test_f1: 0.5292
 epoch: 27, train_loss: 0.8596, test_loss: 0.9036, test_f1: 0.5221
 epoch: 28, train_loss: 0.8599, test_loss: 0.9024, test_f1: 0.5067
 epoch: 29, train_loss: 0.8541, test_loss: 0.9118, test_f1: 0.5067
 epoch: 30, train_loss: 0.8659, test_loss: 0.9042, test_f1: 0.5300
 epoch: 31, train_loss: 0.8538, test_loss: 0.8818, test_f1: 0.5226
 epoch: 32, train_loss: 0.8404, test_loss: 0.8797, test_f1: 0.5288
 epoch: 33, train_loss: 0.8535, test_loss: 0.8681, test_f1: 0.5369
 epoch: 34, train_loss: 0.8401, test_loss: 0.8974, test_f1: 0.5115
 epoch: 35, train_loss: 0.8582, test_loss: 0.9278, test_f1: 0.5069
 epoch: 36, train_loss: 0.8472, test_loss: 0.9285, test_f1: 0.5232
 epoch: 37, train_loss: 0.8248, test_loss: 0.8765, test_f1: 0.5377
 epoch: 38, train_loss: 0.8502, test_loss: 0.9215, test_f1: 0.5133
 epoch: 39, train_loss: 0.8415, test_loss: 0.8882, test_f1: 0.5102
 epoch: 40, train_loss: 0.8386, test_loss: 0.8595, test_f1: 0.5493
 epoch: 41, train_loss: 0.8326, test_loss: 0.9134, test_f1: 0.5430
 epoch: 42, train_loss: 0.8285, test_loss: 0.8694, test_f1: 0.5476
 epoch: 43, train_loss: 0.8245, test_loss: 0.8749, test_f1: 0.5438
 epoch: 44, train_loss: 0.8135, test_loss: 0.8900, test_f1: 0.5276
 epoch: 45, train_loss: 0.8149, test_loss: 0.8989, test_f1: 0.5364
 epoch: 46, train_loss: 0.8186, test_loss: 0.8754, test_f1: 0.5386
 epoch: 47, train_loss: 0.8103, test_loss: 0.8976, test_f1: 0.5153
 epoch: 48, train_loss: 0.8066, test_loss: 0.8869, test_f1: 0.5163
 epoch: 49, train_loss: 0.8099, test_loss: 0.8980, test_f1: 0.5188
 epoch: 50, train_loss: 0.7968, test_loss: 0.8936, test_f1: 0.5341
 epoch: 51, train_loss: 0.8034, test_loss: 0.8687, test_f1: 0.5284
 epoch: 52, train_loss: 0.7958, test_loss: 0.8562, test_f1: 0.5388
 epoch: 53, train_loss: 0.7902, test_loss: 0.8957, test_f1: 0.5292
 epoch: 54, train_loss: 0.7957, test_loss: 0.9051, test_f1: 0.5217
 epoch: 55, train_loss: 0.7950, test_loss: 0.8681, test_f1: 0.5189
 epoch: 56, train_loss: 0.7715, test_loss: 0.8860, test_f1: 0.5288
 epoch: 57, train_loss: 0.7835, test_loss: 0.8639, test_f1: 0.5432
 epoch: 58, train_loss: 0.7911, test_loss: 0.8747, test_f1: 0.5291
 epoch: 59, train_loss: 0.7839, test_loss: 0.8708, test_f1: 0.5319
 epoch: 60, train_loss: 0.7891, test_loss: 0.8686, test_f1: 0.5456
 epoch: 61, train_loss: 0.7835, test_loss: 0.8889, test_f1: 0.5234
 epoch: 62, train_loss: 0.7862, test_loss: 0.8896, test_f1: 0.5175
 epoch: 63, train_loss: 0.7843, test_loss: 0.8833, test_f1: 0.5190
 epoch: 64, train_loss: 0.7824, test_loss: 0.8693, test_f1: 0.5359
 epoch: 65, train_loss: 0.7647, test_loss: 0.8716, test_f1: 0.5337
 epoch: 66, train_loss: 0.7713, test_loss: 0.8758, test_f1: 0.5354
 epoch: 67, train_loss: 0.7677, test_loss: 0.8758, test_f1: 0.5353
 epoch: 68, train_loss: 0.7702, test_loss: 0.8930, test_f1: 0.5277
 epoch: 69, train_loss: 0.7627, test_loss: 0.8885, test_f1: 0.5268
 epoch: 70, train_loss: 0.7591, test_loss: 0.9003, test_f1: 0.5224
 epoch: 71, train_loss: 0.7683, test_loss: 0.8965, test_f1: 0.5321
 epoch: 72, train_loss: 0.7661, test_loss: 0.8856, test_f1: 0.5288
 epoch: 73, train_loss: 0.7714, test_loss: 0.8905, test_f1: 0.5072
 epoch: 74, train_loss: 0.7578, test_loss: 0.8904, test_f1: 0.5266
 epoch: 75, train_loss: 0.7625, test_loss: 0.9095, test_f1: 0.5185
 epoch: 76, train_loss: 0.7627, test_loss: 0.9290, test_f1: 0.5156
 epoch: 77, train_loss: 0.7520, test_loss: 0.8966, test_f1: 0.5336
 epoch: 78, train_loss: 0.7729, test_loss: 0.9045, test_f1: 0.5318
 epoch: 79, train_loss: 0.7478, test_loss: 0.9037, test_f1: 0.5355
 epoch: 80, train_loss: 0.7572, test_loss: 0.8943, test_f1: 0.5287
 epoch: 81, train_loss: 0.7583, test_loss: 0.8915, test_f1: 0.5290
 epoch: 82, train_loss: 0.7440, test_loss: 0.9041, test_f1: 0.5316
 epoch: 83, train_loss: 0.7577, test_loss: 0.9179, test_f1: 0.5194
 epoch: 84, train_loss: 0.7552, test_loss: 0.9270, test_f1: 0.5089
 epoch: 85, train_loss: 0.7588, test_loss: 0.8990, test_f1: 0.5341
 epoch: 86, train_loss: 0.7561, test_loss: 0.9036, test_f1: 0.5296
 epoch: 87, train_loss: 0.7447, test_loss: 0.9166, test_f1: 0.5229
 epoch: 88, train_loss: 0.7578, test_loss: 0.8783, test_f1: 0.5351
 epoch: 89, train_loss: 0.7442, test_loss: 0.9016, test_f1: 0.5330
 epoch: 90, train_loss: 0.7460, test_loss: 0.9233, test_f1: 0.5285
 epoch: 91, train_loss: 0.7458, test_loss: 0.9163, test_f1: 0.5391
 epoch: 92, train_loss: 0.7401, test_loss: 0.9008, test_f1: 0.5384
 epoch: 93, train_loss: 0.7414, test_loss: 0.9230, test_f1: 0.5283
 epoch: 94, train_loss: 0.7464, test_loss: 0.9021, test_f1: 0.5292
 epoch: 95, train_loss: 0.7433, test_loss: 0.9159, test_f1: 0.5312
 epoch: 96, train_loss: 0.7373, test_loss: 0.8864, test_f1: 0.5491
 epoch: 97, train_loss: 0.7386, test_loss: 0.8866, test_f1: 0.5428
 epoch: 98, train_loss: 0.7304, test_loss: 0.9017, test_f1: 0.5530
 epoch: 99, train_loss: 0.7323, test_loss: 0.9025, test_f1: 0.5491
##################ITERATION #2 ****************************************
 epoch: 0, train_loss: 1.2306, test_loss: 1.1517, test_f1: 0.3365
 epoch: 1, train_loss: 1.1116, test_loss: 1.0751, test_f1: 0.3425
 epoch: 2, train_loss: 1.0649, test_loss: 1.0644, test_f1: 0.3628
 epoch: 3, train_loss: 1.0328, test_loss: 1.0547, test_f1: 0.3979
 epoch: 4, train_loss: 1.0139, test_loss: 1.0249, test_f1: 0.4062
 epoch: 5, train_loss: 1.0020, test_loss: 1.0309, test_f1: 0.4394
 epoch: 6, train_loss: 0.9907, test_loss: 1.0298, test_f1: 0.4555
 epoch: 7, train_loss: 0.9770, test_loss: 1.0426, test_f1: 0.4656
 epoch: 8, train_loss: 0.9668, test_loss: 0.9881, test_f1: 0.4844
 epoch: 9, train_loss: 0.9557, test_loss: 1.0469, test_f1: 0.4816
 epoch: 10, train_loss: 0.9554, test_loss: 1.0179, test_f1: 0.4865
 epoch: 11, train_loss: 0.9404, test_loss: 1.0381, test_f1: 0.4690
 epoch: 12, train_loss: 0.9308, test_loss: 1.0260, test_f1: 0.4871
 epoch: 13, train_loss: 0.9221, test_loss: 0.9603, test_f1: 0.4954
 epoch: 14, train_loss: 0.9287, test_loss: 1.0079, test_f1: 0.4765
 epoch: 15, train_loss: 0.9151, test_loss: 0.9810, test_f1: 0.4744
 epoch: 16, train_loss: 0.9032, test_loss: 1.0504, test_f1: 0.4582
 epoch: 17, train_loss: 0.8887, test_loss: 1.0215, test_f1: 0.4794
 epoch: 18, train_loss: 0.9028, test_loss: 1.0077, test_f1: 0.4766
 epoch: 19, train_loss: 0.8983, test_loss: 0.9772, test_f1: 0.4770
 epoch: 20, train_loss: 0.8783, test_loss: 0.9547, test_f1: 0.4949
 epoch: 21, train_loss: 0.8743, test_loss: 0.9895, test_f1: 0.4748
 epoch: 22, train_loss: 0.8680, test_loss: 1.0262, test_f1: 0.4662
 epoch: 23, train_loss: 0.8746, test_loss: 1.0767, test_f1: 0.4595
 epoch: 24, train_loss: 0.8596, test_loss: 0.9306, test_f1: 0.5022
 epoch: 25, train_loss: 0.8558, test_loss: 0.9626, test_f1: 0.4977
 epoch: 26, train_loss: 0.8545, test_loss: 0.9471, test_f1: 0.4961
 epoch: 27, train_loss: 0.8424, test_loss: 0.9159, test_f1: 0.5082
 epoch: 28, train_loss: 0.8525, test_loss: 0.9306, test_f1: 0.4923
 epoch: 29, train_loss: 0.8341, test_loss: 0.9827, test_f1: 0.4935
 epoch: 30, train_loss: 0.8319, test_loss: 0.9629, test_f1: 0.5100
 epoch: 31, train_loss: 0.8256, test_loss: 0.9352, test_f1: 0.5225
 epoch: 32, train_loss: 0.8324, test_loss: 0.9687, test_f1: 0.4921
 epoch: 33, train_loss: 0.8215, test_loss: 0.9511, test_f1: 0.5136
 epoch: 34, train_loss: 0.8233, test_loss: 0.9625, test_f1: 0.4961
 epoch: 35, train_loss: 0.8132, test_loss: 0.9679, test_f1: 0.5088
 epoch: 36, train_loss: 0.8249, test_loss: 1.1862, test_f1: 0.4702
 epoch: 37, train_loss: 0.8206, test_loss: 0.9857, test_f1: 0.4920
 epoch: 38, train_loss: 0.8217, test_loss: 0.9566, test_f1: 0.5132
 epoch: 39, train_loss: 0.8053, test_loss: 0.9441, test_f1: 0.5239
 epoch: 40, train_loss: 0.8006, test_loss: 1.0484, test_f1: 0.4959
 epoch: 41, train_loss: 0.8054, test_loss: 1.0754, test_f1: 0.4857
 epoch: 42, train_loss: 0.7925, test_loss: 0.9547, test_f1: 0.5004
 epoch: 43, train_loss: 0.7886, test_loss: 0.9188, test_f1: 0.5169
 epoch: 44, train_loss: 0.7949, test_loss: 1.0229, test_f1: 0.4960
 epoch: 45, train_loss: 0.8071, test_loss: 0.9257, test_f1: 0.4932
 epoch: 46, train_loss: 0.7999, test_loss: 0.9483, test_f1: 0.5109
 epoch: 47, train_loss: 0.7827, test_loss: 1.0097, test_f1: 0.5029
 epoch: 48, train_loss: 0.7762, test_loss: 0.8816, test_f1: 0.5291
 epoch: 49, train_loss: 0.7764, test_loss: 0.9207, test_f1: 0.4934
 epoch: 50, train_loss: 0.7782, test_loss: 1.1082, test_f1: 0.4563
 epoch: 51, train_loss: 0.7708, test_loss: 0.9204, test_f1: 0.5125
 epoch: 52, train_loss: 0.7598, test_loss: 0.9652, test_f1: 0.5153
 epoch: 53, train_loss: 0.7716, test_loss: 0.9556, test_f1: 0.5050
 epoch: 54, train_loss: 0.7614, test_loss: 0.9847, test_f1: 0.5021
 epoch: 55, train_loss: 0.7594, test_loss: 0.9518, test_f1: 0.5052
 epoch: 56, train_loss: 0.7596, test_loss: 0.9173, test_f1: 0.5168
 epoch: 57, train_loss: 0.7604, test_loss: 0.9631, test_f1: 0.5114
 epoch: 58, train_loss: 0.7519, test_loss: 1.0379, test_f1: 0.4984
 epoch: 59, train_loss: 0.7431, test_loss: 0.9085, test_f1: 0.5167
 epoch: 60, train_loss: 0.7564, test_loss: 0.9033, test_f1: 0.5026
 epoch: 61, train_loss: 0.7489, test_loss: 0.9256, test_f1: 0.5130
 epoch: 62, train_loss: 0.7471, test_loss: 0.9643, test_f1: 0.4927
 epoch: 63, train_loss: 0.7461, test_loss: 1.0531, test_f1: 0.4965
 epoch: 64, train_loss: 0.7462, test_loss: 0.9705, test_f1: 0.4964
 epoch: 65, train_loss: 0.7427, test_loss: 0.9162, test_f1: 0.5149
 epoch: 66, train_loss: 0.7316, test_loss: 0.9998, test_f1: 0.4993
 epoch: 67, train_loss: 0.7532, test_loss: 0.9193, test_f1: 0.5253
 epoch: 68, train_loss: 0.7464, test_loss: 1.1039, test_f1: 0.4749
 epoch: 69, train_loss: 0.7306, test_loss: 0.9981, test_f1: 0.4959
 epoch: 70, train_loss: 0.7405, test_loss: 1.0338, test_f1: 0.4893
 epoch: 71, train_loss: 0.7469, test_loss: 0.9314, test_f1: 0.5195
 epoch: 72, train_loss: 0.7365, test_loss: 0.9429, test_f1: 0.5199
 epoch: 73, train_loss: 0.7416, test_loss: 1.0014, test_f1: 0.5038
 epoch: 74, train_loss: 0.7326, test_loss: 0.9498, test_f1: 0.5021
 epoch: 75, train_loss: 0.7372, test_loss: 0.9781, test_f1: 0.4950
 epoch: 76, train_loss: 0.7269, test_loss: 0.9152, test_f1: 0.5172
 epoch: 77, train_loss: 0.7238, test_loss: 0.9912, test_f1: 0.5180
 epoch: 78, train_loss: 0.7278, test_loss: 0.9321, test_f1: 0.5161
 epoch: 79, train_loss: 0.7231, test_loss: 1.0010, test_f1: 0.4931
 epoch: 80, train_loss: 0.7366, test_loss: 0.9122, test_f1: 0.5194
 epoch: 81, train_loss: 0.7331, test_loss: 0.8887, test_f1: 0.5230
 epoch: 82, train_loss: 0.7364, test_loss: 1.1352, test_f1: 0.4821
 epoch: 83, train_loss: 0.7280, test_loss: 0.9377, test_f1: 0.5159
 epoch: 84, train_loss: 0.7236, test_loss: 1.0318, test_f1: 0.4907
 epoch: 85, train_loss: 0.7302, test_loss: 1.0032, test_f1: 0.4797
 epoch: 86, train_loss: 0.7264, test_loss: 0.9880, test_f1: 0.4953
 epoch: 87, train_loss: 0.7210, test_loss: 1.1201, test_f1: 0.4940
 epoch: 88, train_loss: 0.7273, test_loss: 1.0931, test_f1: 0.4780
 epoch: 89, train_loss: 0.7260, test_loss: 0.8757, test_f1: 0.5396
 epoch: 90, train_loss: 0.7244, test_loss: 0.8972, test_f1: 0.5290
 epoch: 91, train_loss: 0.7206, test_loss: 1.0143, test_f1: 0.4918
 epoch: 92, train_loss: 0.7184, test_loss: 0.9113, test_f1: 0.5252
 epoch: 93, train_loss: 0.7206, test_loss: 0.8826, test_f1: 0.5415
 epoch: 94, train_loss: 0.7143, test_loss: 0.9483, test_f1: 0.5144
 epoch: 95, train_loss: 0.7081, test_loss: 0.9278, test_f1: 0.5139
 epoch: 96, train_loss: 0.7077, test_loss: 0.9817, test_f1: 0.5042
 epoch: 97, train_loss: 0.7200, test_loss: 0.9196, test_f1: 0.5135
 epoch: 98, train_loss: 0.7087, test_loss: 1.0373, test_f1: 0.4949
 epoch: 99, train_loss: 0.7103, test_loss: 1.0163, test_f1: 0.4985
##################ITERATION #3 ****************************************
 epoch: 0, train_loss: 1.2999, test_loss: 1.1659, test_f1: 0.3091
 epoch: 1, train_loss: 1.1641, test_loss: 1.0672, test_f1: 0.4267
 epoch: 2, train_loss: 1.1107, test_loss: 1.0135, test_f1: 0.4490
 epoch: 3, train_loss: 1.0594, test_loss: 0.9778, test_f1: 0.4543
 epoch: 4, train_loss: 1.0312, test_loss: 0.9790, test_f1: 0.4589
 epoch: 5, train_loss: 1.0144, test_loss: 0.9788, test_f1: 0.4821
 epoch: 6, train_loss: 0.9989, test_loss: 1.0020, test_f1: 0.4450
 epoch: 7, train_loss: 0.9952, test_loss: 0.9690, test_f1: 0.4873
 epoch: 8, train_loss: 0.9813, test_loss: 0.9814, test_f1: 0.4868
 epoch: 9, train_loss: 0.9814, test_loss: 0.9789, test_f1: 0.4947
 epoch: 10, train_loss: 0.9642, test_loss: 0.9750, test_f1: 0.5092
 epoch: 11, train_loss: 0.9465, test_loss: 0.9760, test_f1: 0.5028
 epoch: 12, train_loss: 0.9495, test_loss: 0.9479, test_f1: 0.5091
 epoch: 13, train_loss: 0.9362, test_loss: 0.9694, test_f1: 0.5016
 epoch: 14, train_loss: 0.9347, test_loss: 0.9582, test_f1: 0.4911
 epoch: 15, train_loss: 0.9245, test_loss: 0.9690, test_f1: 0.5176
 epoch: 16, train_loss: 0.9271, test_loss: 0.9280, test_f1: 0.5259
 epoch: 17, train_loss: 0.9164, test_loss: 0.9320, test_f1: 0.5138
 epoch: 18, train_loss: 0.9144, test_loss: 0.9282, test_f1: 0.5207
 epoch: 19, train_loss: 0.9079, test_loss: 0.9608, test_f1: 0.5110
 epoch: 20, train_loss: 0.8997, test_loss: 0.9455, test_f1: 0.5111
 epoch: 21, train_loss: 0.9058, test_loss: 0.9252, test_f1: 0.5232
 epoch: 22, train_loss: 0.8956, test_loss: 0.9254, test_f1: 0.5246
 epoch: 23, train_loss: 0.8852, test_loss: 0.9410, test_f1: 0.5078
 epoch: 24, train_loss: 0.8854, test_loss: 0.9466, test_f1: 0.5434
 epoch: 25, train_loss: 0.8792, test_loss: 0.9983, test_f1: 0.4872
 epoch: 26, train_loss: 0.8742, test_loss: 0.9246, test_f1: 0.5252
 epoch: 27, train_loss: 0.8681, test_loss: 0.9368, test_f1: 0.5337
 epoch: 28, train_loss: 0.8755, test_loss: 0.9403, test_f1: 0.5250
 epoch: 29, train_loss: 0.8706, test_loss: 0.9625, test_f1: 0.5126
 epoch: 30, train_loss: 0.8497, test_loss: 0.9766, test_f1: 0.5051
 epoch: 31, train_loss: 0.8533, test_loss: 0.9374, test_f1: 0.5023
 epoch: 32, train_loss: 0.8539, test_loss: 0.9452, test_f1: 0.5127
 epoch: 33, train_loss: 0.8517, test_loss: 0.9263, test_f1: 0.5138
 epoch: 34, train_loss: 0.8368, test_loss: 1.0049, test_f1: 0.5093
 epoch: 35, train_loss: 0.8423, test_loss: 0.9388, test_f1: 0.5291
 epoch: 36, train_loss: 0.8391, test_loss: 0.9478, test_f1: 0.5172
 epoch: 37, train_loss: 0.8368, test_loss: 0.9157, test_f1: 0.5347
 epoch: 38, train_loss: 0.8373, test_loss: 0.9967, test_f1: 0.4827
 epoch: 39, train_loss: 0.8314, test_loss: 0.9395, test_f1: 0.5272
 epoch: 40, train_loss: 0.8222, test_loss: 0.9255, test_f1: 0.5441
 epoch: 41, train_loss: 0.8198, test_loss: 0.9401, test_f1: 0.5050
 epoch: 42, train_loss: 0.8278, test_loss: 0.9261, test_f1: 0.5254
 epoch: 43, train_loss: 0.8213, test_loss: 0.9303, test_f1: 0.5406
 epoch: 44, train_loss: 0.8234, test_loss: 0.9152, test_f1: 0.5455
 epoch: 45, train_loss: 0.8103, test_loss: 0.9682, test_f1: 0.5195
 epoch: 46, train_loss: 0.8148, test_loss: 0.9425, test_f1: 0.5224
 epoch: 47, train_loss: 0.8101, test_loss: 0.9752, test_f1: 0.5203
 epoch: 48, train_loss: 0.8035, test_loss: 0.9125, test_f1: 0.5326
 epoch: 49, train_loss: 0.8069, test_loss: 0.9030, test_f1: 0.5441
 epoch: 50, train_loss: 0.8034, test_loss: 0.9222, test_f1: 0.5309
 epoch: 51, train_loss: 0.7995, test_loss: 0.8927, test_f1: 0.5593
 epoch: 52, train_loss: 0.7847, test_loss: 0.8939, test_f1: 0.5482
 epoch: 53, train_loss: 0.7836, test_loss: 0.9174, test_f1: 0.5484
 epoch: 54, train_loss: 0.7789, test_loss: 0.9035, test_f1: 0.5401
 epoch: 55, train_loss: 0.7766, test_loss: 0.9188, test_f1: 0.5522
 epoch: 56, train_loss: 0.7900, test_loss: 0.8956, test_f1: 0.5504
 epoch: 57, train_loss: 0.7872, test_loss: 0.9009, test_f1: 0.5505
 epoch: 58, train_loss: 0.7834, test_loss: 0.9231, test_f1: 0.5288
 epoch: 59, train_loss: 0.7757, test_loss: 0.9196, test_f1: 0.5479
 epoch: 60, train_loss: 0.7789, test_loss: 0.9042, test_f1: 0.5499
 epoch: 61, train_loss: 0.7722, test_loss: 0.9240, test_f1: 0.5440
 epoch: 62, train_loss: 0.7720, test_loss: 0.9279, test_f1: 0.5227
 epoch: 63, train_loss: 0.7768, test_loss: 0.9390, test_f1: 0.5446
 epoch: 64, train_loss: 0.7709, test_loss: 0.9146, test_f1: 0.5517
 epoch: 65, train_loss: 0.7635, test_loss: 0.8991, test_f1: 0.5434
 epoch: 66, train_loss: 0.7747, test_loss: 0.9189, test_f1: 0.5556
 epoch: 67, train_loss: 0.7622, test_loss: 0.9024, test_f1: 0.5530
 epoch: 68, train_loss: 0.7621, test_loss: 0.8928, test_f1: 0.5603
 epoch: 69, train_loss: 0.7619, test_loss: 0.8951, test_f1: 0.5503
 epoch: 70, train_loss: 0.7651, test_loss: 0.9024, test_f1: 0.5478
 epoch: 71, train_loss: 0.7699, test_loss: 0.8973, test_f1: 0.5502
 epoch: 72, train_loss: 0.7514, test_loss: 0.9082, test_f1: 0.5555
 epoch: 73, train_loss: 0.7681, test_loss: 0.9196, test_f1: 0.5421
 epoch: 74, train_loss: 0.7529, test_loss: 0.8877, test_f1: 0.5571
 epoch: 75, train_loss: 0.7675, test_loss: 0.8931, test_f1: 0.5482
 epoch: 76, train_loss: 0.7459, test_loss: 0.8672, test_f1: 0.5607
 epoch: 77, train_loss: 0.7526, test_loss: 0.9145, test_f1: 0.5394
 epoch: 78, train_loss: 0.7489, test_loss: 0.8971, test_f1: 0.5594
 epoch: 79, train_loss: 0.7649, test_loss: 0.8835, test_f1: 0.5437
 epoch: 80, train_loss: 0.7538, test_loss: 0.8774, test_f1: 0.5612
 epoch: 81, train_loss: 0.7565, test_loss: 0.8892, test_f1: 0.5577
 epoch: 82, train_loss: 0.7475, test_loss: 0.8997, test_f1: 0.5531
 epoch: 83, train_loss: 0.7522, test_loss: 0.8630, test_f1: 0.5616
 epoch: 84, train_loss: 0.7646, test_loss: 0.8722, test_f1: 0.5560
 epoch: 85, train_loss: 0.7410, test_loss: 0.8975, test_f1: 0.5538
 epoch: 86, train_loss: 0.7338, test_loss: 0.8835, test_f1: 0.5434
 epoch: 87, train_loss: 0.7446, test_loss: 0.8774, test_f1: 0.5672
 epoch: 88, train_loss: 0.7592, test_loss: 0.9147, test_f1: 0.5304
 epoch: 89, train_loss: 0.7431, test_loss: 0.9150, test_f1: 0.5566
 epoch: 90, train_loss: 0.7462, test_loss: 0.8781, test_f1: 0.5465
 epoch: 91, train_loss: 0.7313, test_loss: 0.8764, test_f1: 0.5564
 epoch: 92, train_loss: 0.7399, test_loss: 0.8604, test_f1: 0.5696
 epoch: 93, train_loss: 0.7327, test_loss: 0.8675, test_f1: 0.5562
 epoch: 94, train_loss: 0.7367, test_loss: 0.8870, test_f1: 0.5536
 epoch: 95, train_loss: 0.7332, test_loss: 0.9768, test_f1: 0.5402
 epoch: 96, train_loss: 0.7337, test_loss: 0.8900, test_f1: 0.5668
 epoch: 97, train_loss: 0.7463, test_loss: 0.8889, test_f1: 0.5434
 epoch: 98, train_loss: 0.7341, test_loss: 0.9090, test_f1: 0.5564
 epoch: 99, train_loss: 0.7331, test_loss: 0.9011, test_f1: 0.5375
##################ITERATION #4 ****************************************
 epoch: 0, train_loss: 1.2356, test_loss: 1.0944, test_f1: 0.3666
 epoch: 1, train_loss: 1.1124, test_loss: 1.0626, test_f1: 0.4048
 epoch: 2, train_loss: 1.0763, test_loss: 1.0225, test_f1: 0.4442
 epoch: 3, train_loss: 1.0486, test_loss: 1.0239, test_f1: 0.4158
 epoch: 4, train_loss: 1.0406, test_loss: 1.0303, test_f1: 0.4307
 epoch: 5, train_loss: 1.0240, test_loss: 0.9863, test_f1: 0.4763
 epoch: 6, train_loss: 1.0124, test_loss: 0.9965, test_f1: 0.4481
 epoch: 7, train_loss: 1.0045, test_loss: 1.0115, test_f1: 0.4455
 epoch: 8, train_loss: 0.9917, test_loss: 0.9762, test_f1: 0.4927
 epoch: 9, train_loss: 0.9810, test_loss: 0.9699, test_f1: 0.4712
 epoch: 10, train_loss: 0.9702, test_loss: 0.9788, test_f1: 0.4658
 epoch: 11, train_loss: 0.9677, test_loss: 0.9548, test_f1: 0.4964
 epoch: 12, train_loss: 0.9606, test_loss: 0.9548, test_f1: 0.4877
 epoch: 13, train_loss: 0.9564, test_loss: 0.9836, test_f1: 0.4724
 epoch: 14, train_loss: 0.9526, test_loss: 0.9416, test_f1: 0.4953
 epoch: 15, train_loss: 0.9461, test_loss: 0.9524, test_f1: 0.4767
 epoch: 16, train_loss: 0.9505, test_loss: 0.9457, test_f1: 0.4960
 epoch: 17, train_loss: 0.9336, test_loss: 0.9572, test_f1: 0.4990
 epoch: 18, train_loss: 0.9382, test_loss: 0.9335, test_f1: 0.4993
 epoch: 19, train_loss: 0.9178, test_loss: 0.9374, test_f1: 0.4972
 epoch: 20, train_loss: 0.9135, test_loss: 0.9723, test_f1: 0.4977
 epoch: 21, train_loss: 0.9114, test_loss: 0.9566, test_f1: 0.5208
 epoch: 22, train_loss: 0.9156, test_loss: 0.9183, test_f1: 0.5316
 epoch: 23, train_loss: 0.9048, test_loss: 0.9533, test_f1: 0.5104
 epoch: 24, train_loss: 0.8874, test_loss: 0.9164, test_f1: 0.5280
 epoch: 25, train_loss: 0.8894, test_loss: 0.9131, test_f1: 0.5171
 epoch: 26, train_loss: 0.8988, test_loss: 0.9698, test_f1: 0.4951
 epoch: 27, train_loss: 0.8859, test_loss: 0.9286, test_f1: 0.5152
 epoch: 28, train_loss: 0.8897, test_loss: 0.9242, test_f1: 0.5281
 epoch: 29, train_loss: 0.8841, test_loss: 0.9217, test_f1: 0.5141
 epoch: 30, train_loss: 0.8667, test_loss: 0.9037, test_f1: 0.5259
 epoch: 31, train_loss: 0.8711, test_loss: 0.9614, test_f1: 0.5002
 epoch: 32, train_loss: 0.8615, test_loss: 0.9703, test_f1: 0.4921
 epoch: 33, train_loss: 0.8585, test_loss: 0.9207, test_f1: 0.5362
 epoch: 34, train_loss: 0.8514, test_loss: 0.9086, test_f1: 0.5308
 epoch: 35, train_loss: 0.8631, test_loss: 0.9264, test_f1: 0.5253
 epoch: 36, train_loss: 0.8628, test_loss: 0.9395, test_f1: 0.5074
 epoch: 37, train_loss: 0.8530, test_loss: 0.9333, test_f1: 0.4898
 epoch: 38, train_loss: 0.8469, test_loss: 0.9327, test_f1: 0.5143
 epoch: 39, train_loss: 0.8512, test_loss: 0.9303, test_f1: 0.5092
 epoch: 40, train_loss: 0.8422, test_loss: 0.9484, test_f1: 0.5146
 epoch: 41, train_loss: 0.8518, test_loss: 0.9173, test_f1: 0.5072
 epoch: 42, train_loss: 0.8374, test_loss: 0.9090, test_f1: 0.5228
 epoch: 43, train_loss: 0.8430, test_loss: 0.9058, test_f1: 0.5248
 epoch: 44, train_loss: 0.8451, test_loss: 0.8940, test_f1: 0.5355
 epoch: 45, train_loss: 0.8327, test_loss: 0.8976, test_f1: 0.5188
 epoch: 46, train_loss: 0.8336, test_loss: 0.9207, test_f1: 0.5253
 epoch: 47, train_loss: 0.8311, test_loss: 0.9379, test_f1: 0.5180
 epoch: 48, train_loss: 0.8315, test_loss: 0.9116, test_f1: 0.5194
 epoch: 49, train_loss: 0.8253, test_loss: 0.9293, test_f1: 0.5201
 epoch: 50, train_loss: 0.8643, test_loss: 0.8708, test_f1: 0.5181
 epoch: 51, train_loss: 0.8269, test_loss: 0.8971, test_f1: 0.5338
 epoch: 52, train_loss: 0.8179, test_loss: 0.9000, test_f1: 0.5035
 epoch: 53, train_loss: 0.8161, test_loss: 0.9088, test_f1: 0.5197
 epoch: 54, train_loss: 0.8129, test_loss: 0.8946, test_f1: 0.5321
 epoch: 55, train_loss: 0.8099, test_loss: 0.9059, test_f1: 0.5413
 epoch: 56, train_loss: 0.8031, test_loss: 0.9045, test_f1: 0.5229
 epoch: 57, train_loss: 0.8161, test_loss: 0.8947, test_f1: 0.5333
 epoch: 58, train_loss: 0.8040, test_loss: 0.9252, test_f1: 0.5129
 epoch: 59, train_loss: 0.8084, test_loss: 0.8836, test_f1: 0.5245
 epoch: 60, train_loss: 0.8034, test_loss: 0.8915, test_f1: 0.5296
 epoch: 61, train_loss: 0.8069, test_loss: 0.8954, test_f1: 0.5167
 epoch: 62, train_loss: 0.8021, test_loss: 0.9630, test_f1: 0.5189
 epoch: 63, train_loss: 0.7985, test_loss: 0.8953, test_f1: 0.5439
 epoch: 64, train_loss: 0.8008, test_loss: 0.9352, test_f1: 0.5270
 epoch: 65, train_loss: 0.7882, test_loss: 0.9269, test_f1: 0.5114
 epoch: 66, train_loss: 0.7968, test_loss: 0.8942, test_f1: 0.5416
 epoch: 67, train_loss: 0.7984, test_loss: 0.8924, test_f1: 0.5304
 epoch: 68, train_loss: 0.7831, test_loss: 0.8774, test_f1: 0.5302
 epoch: 69, train_loss: 0.7930, test_loss: 0.8968, test_f1: 0.5366
 epoch: 70, train_loss: 0.7912, test_loss: 0.8864, test_f1: 0.5373
 epoch: 71, train_loss: 0.7805, test_loss: 0.9111, test_f1: 0.5333
 epoch: 72, train_loss: 0.8033, test_loss: 0.9268, test_f1: 0.5129
 epoch: 73, train_loss: 0.7928, test_loss: 0.9106, test_f1: 0.5290
 epoch: 74, train_loss: 0.7908, test_loss: 0.8670, test_f1: 0.5461
 epoch: 75, train_loss: 0.7742, test_loss: 0.9022, test_f1: 0.5315
 epoch: 76, train_loss: 0.7883, test_loss: 0.9133, test_f1: 0.5482
 epoch: 77, train_loss: 0.7924, test_loss: 0.8652, test_f1: 0.5409
 epoch: 78, train_loss: 0.7753, test_loss: 0.8979, test_f1: 0.5371
 epoch: 79, train_loss: 0.7828, test_loss: 0.8951, test_f1: 0.5302
 epoch: 80, train_loss: 0.7943, test_loss: 0.8661, test_f1: 0.5484
 epoch: 81, train_loss: 0.7856, test_loss: 0.9020, test_f1: 0.5379
 epoch: 82, train_loss: 0.7895, test_loss: 0.9139, test_f1: 0.5509
 epoch: 83, train_loss: 0.7776, test_loss: 0.8884, test_f1: 0.5428
 epoch: 84, train_loss: 0.7814, test_loss: 0.8697, test_f1: 0.5456
 epoch: 85, train_loss: 0.7798, test_loss: 0.8814, test_f1: 0.5519
 epoch: 86, train_loss: 0.7751, test_loss: 0.9000, test_f1: 0.5360
 epoch: 87, train_loss: 0.7757, test_loss: 0.8838, test_f1: 0.5316
 epoch: 88, train_loss: 0.7754, test_loss: 0.8986, test_f1: 0.5424
 epoch: 89, train_loss: 0.7785, test_loss: 0.9050, test_f1: 0.5464
 epoch: 90, train_loss: 0.7808, test_loss: 0.9012, test_f1: 0.5461
 epoch: 91, train_loss: 0.7663, test_loss: 0.8832, test_f1: 0.5481
 epoch: 92, train_loss: 0.7741, test_loss: 0.8879, test_f1: 0.5517
 epoch: 93, train_loss: 0.7707, test_loss: 0.8609, test_f1: 0.5397
 epoch: 94, train_loss: 0.7758, test_loss: 0.8633, test_f1: 0.5528
 epoch: 95, train_loss: 0.7769, test_loss: 0.9050, test_f1: 0.5206
 epoch: 96, train_loss: 0.7686, test_loss: 0.9006, test_f1: 0.5289
 epoch: 97, train_loss: 0.7628, test_loss: 0.9028, test_f1: 0.5424
 epoch: 98, train_loss: 0.7611, test_loss: 0.8974, test_f1: 0.5193
 epoch: 99, train_loss: 0.7637, test_loss: 0.9127, test_f1: 0.5310
##################ITERATION #5 ****************************************
 epoch: 0, train_loss: 1.2548, test_loss: 1.2079, test_f1: 0.2286
 epoch: 1, train_loss: 1.1315, test_loss: 1.0896, test_f1: 0.3683
 epoch: 2, train_loss: 1.0846, test_loss: 1.0591, test_f1: 0.3784
 epoch: 3, train_loss: 1.0717, test_loss: 1.0566, test_f1: 0.4077
 epoch: 4, train_loss: 1.0419, test_loss: 1.0967, test_f1: 0.3759
 epoch: 5, train_loss: 1.0307, test_loss: 1.0412, test_f1: 0.4632
 epoch: 6, train_loss: 1.0175, test_loss: 1.0861, test_f1: 0.4118
 epoch: 7, train_loss: 1.0045, test_loss: 1.0551, test_f1: 0.4632
 epoch: 8, train_loss: 0.9912, test_loss: 1.0152, test_f1: 0.4841
 epoch: 9, train_loss: 0.9848, test_loss: 1.1162, test_f1: 0.4685
 epoch: 10, train_loss: 0.9574, test_loss: 0.9869, test_f1: 0.4969
 epoch: 11, train_loss: 0.9578, test_loss: 0.9857, test_f1: 0.4898
 epoch: 12, train_loss: 0.9394, test_loss: 1.0047, test_f1: 0.4996
 epoch: 13, train_loss: 0.9419, test_loss: 1.0084, test_f1: 0.4865
 epoch: 14, train_loss: 0.9164, test_loss: 1.0251, test_f1: 0.4833
 epoch: 15, train_loss: 0.9160, test_loss: 0.9479, test_f1: 0.5165
 epoch: 16, train_loss: 0.9243, test_loss: 1.0100, test_f1: 0.4870
 epoch: 17, train_loss: 0.9206, test_loss: 1.0101, test_f1: 0.4936
 epoch: 18, train_loss: 0.9027, test_loss: 0.9240, test_f1: 0.5109
 epoch: 19, train_loss: 0.8940, test_loss: 0.9724, test_f1: 0.5074
 epoch: 20, train_loss: 0.8873, test_loss: 0.9431, test_f1: 0.5260
 epoch: 21, train_loss: 0.8910, test_loss: 0.9781, test_f1: 0.5420
 epoch: 22, train_loss: 0.8776, test_loss: 0.9870, test_f1: 0.5146
 epoch: 23, train_loss: 0.8721, test_loss: 0.9514, test_f1: 0.5388
 epoch: 24, train_loss: 0.8834, test_loss: 0.9530, test_f1: 0.5439
 epoch: 25, train_loss: 0.8758, test_loss: 1.0106, test_f1: 0.5327
 epoch: 26, train_loss: 0.8755, test_loss: 0.9437, test_f1: 0.5300
 epoch: 27, train_loss: 0.8728, test_loss: 0.9497, test_f1: 0.5434
 epoch: 28, train_loss: 0.8828, test_loss: 0.9292, test_f1: 0.5414
 epoch: 29, train_loss: 0.8589, test_loss: 0.9526, test_f1: 0.5273
 epoch: 30, train_loss: 0.8510, test_loss: 0.9562, test_f1: 0.5421
 epoch: 31, train_loss: 0.8516, test_loss: 1.0052, test_f1: 0.5122
 epoch: 32, train_loss: 0.8560, test_loss: 0.9148, test_f1: 0.5490
 epoch: 33, train_loss: 0.8375, test_loss: 0.9338, test_f1: 0.5415
 epoch: 34, train_loss: 0.8359, test_loss: 0.9526, test_f1: 0.5363
 epoch: 35, train_loss: 0.8517, test_loss: 1.1409, test_f1: 0.4902
 epoch: 36, train_loss: 0.8502, test_loss: 0.9971, test_f1: 0.5215
 epoch: 37, train_loss: 0.8373, test_loss: 1.0034, test_f1: 0.5192
 epoch: 38, train_loss: 0.8319, test_loss: 0.9168, test_f1: 0.5409
 epoch: 39, train_loss: 0.8309, test_loss: 0.9462, test_f1: 0.5281
 epoch: 40, train_loss: 0.8366, test_loss: 0.9531, test_f1: 0.5484
 epoch: 41, train_loss: 0.8242, test_loss: 0.9893, test_f1: 0.5363
 epoch: 42, train_loss: 0.8281, test_loss: 0.9317, test_f1: 0.5440
 epoch: 43, train_loss: 0.8324, test_loss: 0.9395, test_f1: 0.5571
 epoch: 44, train_loss: 0.8294, test_loss: 0.9815, test_f1: 0.5311
 epoch: 45, train_loss: 0.8238, test_loss: 0.9189, test_f1: 0.5459
 epoch: 46, train_loss: 0.8274, test_loss: 0.9075, test_f1: 0.5531
 epoch: 47, train_loss: 0.8131, test_loss: 0.9574, test_f1: 0.5522
 epoch: 48, train_loss: 0.8249, test_loss: 0.8917, test_f1: 0.5516
 epoch: 49, train_loss: 0.8169, test_loss: 0.9973, test_f1: 0.5308
 epoch: 50, train_loss: 0.8125, test_loss: 0.9326, test_f1: 0.5388
 epoch: 51, train_loss: 0.7906, test_loss: 0.9434, test_f1: 0.5554
 epoch: 52, train_loss: 0.7913, test_loss: 0.9330, test_f1: 0.5416
 epoch: 53, train_loss: 0.7891, test_loss: 0.9367, test_f1: 0.5515
 epoch: 54, train_loss: 0.7928, test_loss: 0.9506, test_f1: 0.5595
 epoch: 55, train_loss: 0.7915, test_loss: 0.9438, test_f1: 0.5493
 epoch: 56, train_loss: 0.7939, test_loss: 0.9517, test_f1: 0.5423
 epoch: 57, train_loss: 0.8011, test_loss: 0.9387, test_f1: 0.5587
 epoch: 58, train_loss: 0.7855, test_loss: 0.9155, test_f1: 0.5461
 epoch: 59, train_loss: 0.7737, test_loss: 0.9068, test_f1: 0.5577
 epoch: 60, train_loss: 0.7804, test_loss: 0.9621, test_f1: 0.5496
 epoch: 61, train_loss: 0.7899, test_loss: 0.9417, test_f1: 0.5564
 epoch: 62, train_loss: 0.7892, test_loss: 0.9295, test_f1: 0.5467
 epoch: 63, train_loss: 0.7826, test_loss: 0.9474, test_f1: 0.5450
 epoch: 64, train_loss: 0.7814, test_loss: 0.9611, test_f1: 0.5410
 epoch: 65, train_loss: 0.7841, test_loss: 0.9139, test_f1: 0.5536
 epoch: 66, train_loss: 0.7845, test_loss: 0.9419, test_f1: 0.5396
 epoch: 67, train_loss: 0.7717, test_loss: 0.9248, test_f1: 0.5617
 epoch: 68, train_loss: 0.7749, test_loss: 0.9384, test_f1: 0.5624
 epoch: 69, train_loss: 0.7866, test_loss: 0.9409, test_f1: 0.5353
 epoch: 70, train_loss: 0.7828, test_loss: 0.9517, test_f1: 0.5486
 epoch: 71, train_loss: 0.7668, test_loss: 0.9278, test_f1: 0.5567
 epoch: 72, train_loss: 0.7775, test_loss: 0.9089, test_f1: 0.5612
 epoch: 73, train_loss: 0.7607, test_loss: 0.9287, test_f1: 0.5588
 epoch: 74, train_loss: 0.7816, test_loss: 0.9644, test_f1: 0.5605
 epoch: 75, train_loss: 0.7686, test_loss: 0.9620, test_f1: 0.5484
 epoch: 76, train_loss: 0.7623, test_loss: 0.9492, test_f1: 0.5380
 epoch: 77, train_loss: 0.7670, test_loss: 0.9166, test_f1: 0.5566
 epoch: 78, train_loss: 0.7764, test_loss: 0.9211, test_f1: 0.5574
 epoch: 79, train_loss: 0.7637, test_loss: 0.9277, test_f1: 0.5620
 epoch: 80, train_loss: 0.7668, test_loss: 0.9249, test_f1: 0.5551
 epoch: 81, train_loss: 0.7672, test_loss: 0.9630, test_f1: 0.5466
 epoch: 82, train_loss: 0.7637, test_loss: 0.9573, test_f1: 0.5555
 epoch: 83, train_loss: 0.7570, test_loss: 0.8978, test_f1: 0.5498
 epoch: 84, train_loss: 0.7621, test_loss: 0.9191, test_f1: 0.5560
 epoch: 85, train_loss: 0.7605, test_loss: 0.9191, test_f1: 0.5537
 epoch: 86, train_loss: 0.7625, test_loss: 0.9376, test_f1: 0.5623
 epoch: 87, train_loss: 0.7612, test_loss: 0.9465, test_f1: 0.5396
 epoch: 88, train_loss: 0.7697, test_loss: 0.9117, test_f1: 0.5459
 epoch: 89, train_loss: 0.7571, test_loss: 0.9041, test_f1: 0.5560
 epoch: 90, train_loss: 0.7479, test_loss: 0.9094, test_f1: 0.5640
 epoch: 91, train_loss: 0.7464, test_loss: 0.9131, test_f1: 0.5491
 epoch: 92, train_loss: 0.7463, test_loss: 0.9285, test_f1: 0.5458
 epoch: 93, train_loss: 0.7447, test_loss: 0.9009, test_f1: 0.5519
 epoch: 94, train_loss: 0.7544, test_loss: 0.8966, test_f1: 0.5581
 epoch: 95, train_loss: 0.7447, test_loss: 0.8916, test_f1: 0.5518
 epoch: 96, train_loss: 0.7446, test_loss: 0.9210, test_f1: 0.5492
 epoch: 97, train_loss: 0.7553, test_loss: 0.9369, test_f1: 0.5480
 epoch: 98, train_loss: 0.7633, test_loss: 0.9146, test_f1: 0.5570
 epoch: 99, train_loss: 0.7307, test_loss: 0.9192, test_f1: 0.5516
##################ITERATION #6 ****************************************
 epoch: 0, train_loss: 1.2457, test_loss: 1.1922, test_f1: 0.2765
 epoch: 1, train_loss: 1.0668, test_loss: 1.0198, test_f1: 0.4638
 epoch: 2, train_loss: 1.0370, test_loss: 0.9826, test_f1: 0.4651
 epoch: 3, train_loss: 1.0171, test_loss: 0.9902, test_f1: 0.4411
 epoch: 4, train_loss: 0.9812, test_loss: 0.9700, test_f1: 0.4888
 epoch: 5, train_loss: 0.9704, test_loss: 0.9590, test_f1: 0.4848
 epoch: 6, train_loss: 0.9675, test_loss: 0.9629, test_f1: 0.4977
 epoch: 7, train_loss: 0.9485, test_loss: 0.9907, test_f1: 0.4805
 epoch: 8, train_loss: 0.9367, test_loss: 0.9376, test_f1: 0.4999
 epoch: 9, train_loss: 0.9323, test_loss: 0.9767, test_f1: 0.4734
 epoch: 10, train_loss: 0.9179, test_loss: 0.9389, test_f1: 0.4832
 epoch: 11, train_loss: 0.9278, test_loss: 0.9567, test_f1: 0.4894
 epoch: 12, train_loss: 0.9075, test_loss: 1.0486, test_f1: 0.4710
 epoch: 13, train_loss: 0.9132, test_loss: 1.0143, test_f1: 0.4830
 epoch: 14, train_loss: 0.9033, test_loss: 0.9578, test_f1: 0.5056
 epoch: 15, train_loss: 0.9038, test_loss: 0.9513, test_f1: 0.4642
 epoch: 16, train_loss: 0.8794, test_loss: 1.0541, test_f1: 0.4847
 epoch: 17, train_loss: 0.8907, test_loss: 0.9546, test_f1: 0.5251
 epoch: 18, train_loss: 0.8769, test_loss: 0.9716, test_f1: 0.4778
 epoch: 19, train_loss: 0.8836, test_loss: 1.0344, test_f1: 0.4895
 epoch: 20, train_loss: 0.8778, test_loss: 0.9907, test_f1: 0.5113
 epoch: 21, train_loss: 0.8682, test_loss: 1.0654, test_f1: 0.4636
 epoch: 22, train_loss: 0.8574, test_loss: 0.8826, test_f1: 0.5321
 epoch: 23, train_loss: 0.8552, test_loss: 0.9055, test_f1: 0.5262
 epoch: 24, train_loss: 0.8565, test_loss: 0.8908, test_f1: 0.5210
 epoch: 25, train_loss: 0.8478, test_loss: 0.9014, test_f1: 0.4910
 epoch: 26, train_loss: 0.8504, test_loss: 0.8882, test_f1: 0.5065
 epoch: 27, train_loss: 0.8426, test_loss: 0.8640, test_f1: 0.5213
 epoch: 28, train_loss: 0.8311, test_loss: 0.8936, test_f1: 0.5059
 epoch: 29, train_loss: 0.8250, test_loss: 0.9125, test_f1: 0.4983
 epoch: 30, train_loss: 0.8306, test_loss: 0.8854, test_f1: 0.5166
 epoch: 31, train_loss: 0.8238, test_loss: 0.9126, test_f1: 0.4899
 epoch: 32, train_loss: 0.8156, test_loss: 1.1224, test_f1: 0.4694
 epoch: 33, train_loss: 0.8153, test_loss: 0.9520, test_f1: 0.4859
 epoch: 34, train_loss: 0.8186, test_loss: 0.9121, test_f1: 0.5135
 epoch: 35, train_loss: 0.8160, test_loss: 0.9181, test_f1: 0.5128
 epoch: 36, train_loss: 0.8097, test_loss: 1.0683, test_f1: 0.4951
 epoch: 37, train_loss: 0.8067, test_loss: 0.8764, test_f1: 0.5208
 epoch: 38, train_loss: 0.8070, test_loss: 0.9048, test_f1: 0.5154
 epoch: 39, train_loss: 0.8089, test_loss: 0.8899, test_f1: 0.5148
 epoch: 40, train_loss: 0.8048, test_loss: 0.8755, test_f1: 0.5222
 epoch: 41, train_loss: 0.7981, test_loss: 0.9207, test_f1: 0.5053
 epoch: 42, train_loss: 0.7916, test_loss: 0.9040, test_f1: 0.5070
 epoch: 43, train_loss: 0.7975, test_loss: 0.8616, test_f1: 0.5520
 epoch: 44, train_loss: 0.7979, test_loss: 0.8811, test_f1: 0.4982
 epoch: 45, train_loss: 0.7822, test_loss: 0.9016, test_f1: 0.5073
 epoch: 46, train_loss: 0.7817, test_loss: 0.9178, test_f1: 0.5171
 epoch: 47, train_loss: 0.7841, test_loss: 0.8971, test_f1: 0.5240
 epoch: 48, train_loss: 0.7810, test_loss: 0.9189, test_f1: 0.5224
 epoch: 49, train_loss: 0.7813, test_loss: 0.8553, test_f1: 0.5333
 epoch: 50, train_loss: 0.7853, test_loss: 0.8806, test_f1: 0.5230
 epoch: 51, train_loss: 0.7669, test_loss: 0.8431, test_f1: 0.5386
 epoch: 52, train_loss: 0.7536, test_loss: 0.8765, test_f1: 0.5175
 epoch: 53, train_loss: 0.7704, test_loss: 0.8602, test_f1: 0.5120
 epoch: 54, train_loss: 0.7607, test_loss: 0.8811, test_f1: 0.5021
 epoch: 55, train_loss: 0.7603, test_loss: 0.8500, test_f1: 0.5526
 epoch: 56, train_loss: 0.7503, test_loss: 0.8402, test_f1: 0.5440
 epoch: 57, train_loss: 0.7550, test_loss: 0.8808, test_f1: 0.5202
 epoch: 58, train_loss: 0.7567, test_loss: 0.8752, test_f1: 0.5449
 epoch: 59, train_loss: 0.7481, test_loss: 0.8662, test_f1: 0.5339
 epoch: 60, train_loss: 0.7495, test_loss: 0.8418, test_f1: 0.5232
 epoch: 61, train_loss: 0.7455, test_loss: 0.8551, test_f1: 0.5366
 epoch: 62, train_loss: 0.7427, test_loss: 0.8517, test_f1: 0.5509
 epoch: 63, train_loss: 0.7534, test_loss: 0.8772, test_f1: 0.5410
 epoch: 64, train_loss: 0.7496, test_loss: 0.8826, test_f1: 0.5408
 epoch: 65, train_loss: 0.7421, test_loss: 0.8525, test_f1: 0.5454
 epoch: 66, train_loss: 0.7333, test_loss: 0.8756, test_f1: 0.5279
 epoch: 67, train_loss: 0.7594, test_loss: 0.8684, test_f1: 0.5399
 epoch: 68, train_loss: 0.7360, test_loss: 0.9161, test_f1: 0.5321
 epoch: 69, train_loss: 0.7378, test_loss: 0.8557, test_f1: 0.5488
 epoch: 70, train_loss: 0.7435, test_loss: 0.8711, test_f1: 0.5508
 epoch: 71, train_loss: 0.7457, test_loss: 0.9258, test_f1: 0.5348
 epoch: 72, train_loss: 0.7297, test_loss: 0.8390, test_f1: 0.5513
 epoch: 73, train_loss: 0.7419, test_loss: 0.8810, test_f1: 0.5161
 epoch: 74, train_loss: 0.7457, test_loss: 0.8962, test_f1: 0.5317
 epoch: 75, train_loss: 0.7400, test_loss: 0.8544, test_f1: 0.5563
 epoch: 76, train_loss: 0.7405, test_loss: 0.8570, test_f1: 0.5462
 epoch: 77, train_loss: 0.7518, test_loss: 0.8486, test_f1: 0.5596
 epoch: 78, train_loss: 0.7343, test_loss: 0.8857, test_f1: 0.5437
 epoch: 79, train_loss: 0.7353, test_loss: 0.8561, test_f1: 0.5334
 epoch: 80, train_loss: 0.7276, test_loss: 0.8554, test_f1: 0.5490
 epoch: 81, train_loss: 0.7296, test_loss: 0.8666, test_f1: 0.5388
 epoch: 82, train_loss: 0.7132, test_loss: 0.8514, test_f1: 0.5559
 epoch: 83, train_loss: 0.7274, test_loss: 0.8493, test_f1: 0.5561
 epoch: 84, train_loss: 0.7245, test_loss: 0.8749, test_f1: 0.5423
 epoch: 85, train_loss: 0.7293, test_loss: 0.8775, test_f1: 0.5408
 epoch: 86, train_loss: 0.7288, test_loss: 0.8434, test_f1: 0.5441
 epoch: 87, train_loss: 0.7198, test_loss: 0.8639, test_f1: 0.5508
 epoch: 88, train_loss: 0.7224, test_loss: 0.9018, test_f1: 0.5390
 epoch: 89, train_loss: 0.7215, test_loss: 0.8911, test_f1: 0.5391
 epoch: 90, train_loss: 0.7324, test_loss: 0.8302, test_f1: 0.5445
 epoch: 91, train_loss: 0.7232, test_loss: 0.8872, test_f1: 0.5332
 epoch: 92, train_loss: 0.7425, test_loss: 0.9077, test_f1: 0.5501
 epoch: 93, train_loss: 0.7193, test_loss: 0.8589, test_f1: 0.5423
 epoch: 94, train_loss: 0.7188, test_loss: 0.8605, test_f1: 0.5645
 epoch: 95, train_loss: 0.7252, test_loss: 0.8565, test_f1: 0.5447
 epoch: 96, train_loss: 0.7148, test_loss: 0.8538, test_f1: 0.5576
 epoch: 97, train_loss: 0.7322, test_loss: 0.8691, test_f1: 0.5479
 epoch: 98, train_loss: 0.7317, test_loss: 0.8586, test_f1: 0.5315
 epoch: 99, train_loss: 0.7184, test_loss: 0.8348, test_f1: 0.5638
##################ITERATION #7 ****************************************
 epoch: 0, train_loss: 1.2681, test_loss: 1.2545, test_f1: 0.2759
 epoch: 1, train_loss: 1.1223, test_loss: 1.0423, test_f1: 0.3968
 epoch: 2, train_loss: 1.0891, test_loss: 1.0283, test_f1: 0.3784
 epoch: 3, train_loss: 1.0655, test_loss: 1.0248, test_f1: 0.4099
 epoch: 4, train_loss: 1.0486, test_loss: 1.0228, test_f1: 0.4018
 epoch: 5, train_loss: 1.0422, test_loss: 1.0153, test_f1: 0.4215
 epoch: 6, train_loss: 1.0237, test_loss: 0.9979, test_f1: 0.4557
 epoch: 7, train_loss: 1.0105, test_loss: 0.9992, test_f1: 0.4347
 epoch: 8, train_loss: 1.0068, test_loss: 0.9900, test_f1: 0.4730
 epoch: 9, train_loss: 0.9905, test_loss: 0.9872, test_f1: 0.4744
 epoch: 10, train_loss: 0.9765, test_loss: 0.9690, test_f1: 0.4964
 epoch: 11, train_loss: 0.9738, test_loss: 0.9844, test_f1: 0.5140
 epoch: 12, train_loss: 0.9690, test_loss: 0.9904, test_f1: 0.5016
 epoch: 13, train_loss: 0.9551, test_loss: 0.9631, test_f1: 0.5264
 epoch: 14, train_loss: 0.9483, test_loss: 0.9429, test_f1: 0.5373
 epoch: 15, train_loss: 0.9470, test_loss: 0.9486, test_f1: 0.5357
 epoch: 16, train_loss: 0.9375, test_loss: 0.9443, test_f1: 0.5060
 epoch: 17, train_loss: 0.9349, test_loss: 0.9643, test_f1: 0.5311
 epoch: 18, train_loss: 0.9280, test_loss: 0.9248, test_f1: 0.5491
 epoch: 19, train_loss: 0.9164, test_loss: 0.9422, test_f1: 0.5536
 epoch: 20, train_loss: 0.9184, test_loss: 0.9673, test_f1: 0.5235
 epoch: 21, train_loss: 0.9102, test_loss: 0.9426, test_f1: 0.5313
 epoch: 22, train_loss: 0.8979, test_loss: 0.9220, test_f1: 0.5641
 epoch: 23, train_loss: 0.9088, test_loss: 0.9068, test_f1: 0.5655
 epoch: 24, train_loss: 0.8934, test_loss: 0.9024, test_f1: 0.5678
 epoch: 25, train_loss: 0.8877, test_loss: 0.9138, test_f1: 0.5564
 epoch: 26, train_loss: 0.8799, test_loss: 0.9219, test_f1: 0.5497
 epoch: 27, train_loss: 0.8729, test_loss: 0.8903, test_f1: 0.5491
 epoch: 28, train_loss: 0.8754, test_loss: 0.8807, test_f1: 0.5641
 epoch: 29, train_loss: 0.8738, test_loss: 0.8933, test_f1: 0.5548
 epoch: 30, train_loss: 0.8672, test_loss: 0.8768, test_f1: 0.5520
 epoch: 31, train_loss: 0.8707, test_loss: 0.8879, test_f1: 0.5613
 epoch: 32, train_loss: 0.8638, test_loss: 0.8947, test_f1: 0.5248
 epoch: 33, train_loss: 0.8551, test_loss: 0.8793, test_f1: 0.5451
 epoch: 34, train_loss: 0.8570, test_loss: 0.8855, test_f1: 0.5673
 epoch: 35, train_loss: 0.8451, test_loss: 0.8911, test_f1: 0.5308
 epoch: 36, train_loss: 0.8365, test_loss: 0.8995, test_f1: 0.5280
 epoch: 37, train_loss: 0.8352, test_loss: 0.8758, test_f1: 0.5569
 epoch: 38, train_loss: 0.8451, test_loss: 0.9097, test_f1: 0.5232
 epoch: 39, train_loss: 0.8452, test_loss: 0.8829, test_f1: 0.5503
 epoch: 40, train_loss: 0.8390, test_loss: 0.8788, test_f1: 0.5394
 epoch: 41, train_loss: 0.8253, test_loss: 0.8860, test_f1: 0.5354
 epoch: 42, train_loss: 0.8240, test_loss: 0.9126, test_f1: 0.5434
 epoch: 43, train_loss: 0.8190, test_loss: 0.8912, test_f1: 0.5538
 epoch: 44, train_loss: 0.8217, test_loss: 0.8808, test_f1: 0.5544
 epoch: 45, train_loss: 0.8129, test_loss: 0.8775, test_f1: 0.5583
 epoch: 46, train_loss: 0.8112, test_loss: 0.8743, test_f1: 0.5401
 epoch: 47, train_loss: 0.8110, test_loss: 0.9022, test_f1: 0.5426
 epoch: 48, train_loss: 0.8044, test_loss: 0.9096, test_f1: 0.5392
 epoch: 49, train_loss: 0.8054, test_loss: 0.8988, test_f1: 0.5319
 epoch: 50, train_loss: 0.8031, test_loss: 0.8808, test_f1: 0.5549
 epoch: 51, train_loss: 0.7870, test_loss: 0.8904, test_f1: 0.5462
 epoch: 52, train_loss: 0.8006, test_loss: 0.8751, test_f1: 0.5497
 epoch: 53, train_loss: 0.7878, test_loss: 0.8723, test_f1: 0.5563
 epoch: 54, train_loss: 0.7846, test_loss: 0.8713, test_f1: 0.5572
 epoch: 55, train_loss: 0.7966, test_loss: 0.8835, test_f1: 0.5376
 epoch: 56, train_loss: 0.7834, test_loss: 0.8668, test_f1: 0.5510
 epoch: 57, train_loss: 0.7829, test_loss: 0.8732, test_f1: 0.5418
 epoch: 58, train_loss: 0.7848, test_loss: 0.8749, test_f1: 0.5438
 epoch: 59, train_loss: 0.7853, test_loss: 0.8785, test_f1: 0.5459
 epoch: 60, train_loss: 0.7777, test_loss: 0.8880, test_f1: 0.5180
 epoch: 61, train_loss: 0.7819, test_loss: 0.8711, test_f1: 0.5550
 epoch: 62, train_loss: 0.7862, test_loss: 0.8917, test_f1: 0.5274
 epoch: 63, train_loss: 0.7879, test_loss: 0.8720, test_f1: 0.5441
 epoch: 64, train_loss: 0.7849, test_loss: 0.8828, test_f1: 0.5526
 epoch: 65, train_loss: 0.7761, test_loss: 0.8708, test_f1: 0.5438
 epoch: 66, train_loss: 0.7748, test_loss: 0.8982, test_f1: 0.5212
 epoch: 67, train_loss: 0.7805, test_loss: 0.8703, test_f1: 0.5373
 epoch: 68, train_loss: 0.7644, test_loss: 0.8840, test_f1: 0.5314
 epoch: 69, train_loss: 0.7876, test_loss: 0.8850, test_f1: 0.5368
 epoch: 70, train_loss: 0.7575, test_loss: 0.8710, test_f1: 0.5347
 epoch: 71, train_loss: 0.7744, test_loss: 0.8779, test_f1: 0.5395
 epoch: 72, train_loss: 0.7682, test_loss: 0.8663, test_f1: 0.5466
 epoch: 73, train_loss: 0.7683, test_loss: 0.8799, test_f1: 0.5415
 epoch: 74, train_loss: 0.7602, test_loss: 0.8912, test_f1: 0.5279
 epoch: 75, train_loss: 0.7838, test_loss: 0.8743, test_f1: 0.5311
 epoch: 76, train_loss: 0.7682, test_loss: 0.8783, test_f1: 0.5399
 epoch: 77, train_loss: 0.7642, test_loss: 0.8702, test_f1: 0.5255
 epoch: 78, train_loss: 0.7588, test_loss: 0.8668, test_f1: 0.5341
 epoch: 79, train_loss: 0.7591, test_loss: 0.8724, test_f1: 0.5504
 epoch: 80, train_loss: 0.7665, test_loss: 0.8707, test_f1: 0.5442
 epoch: 81, train_loss: 0.7637, test_loss: 0.8723, test_f1: 0.5346
 epoch: 82, train_loss: 0.7510, test_loss: 0.8855, test_f1: 0.5409
 epoch: 83, train_loss: 0.7516, test_loss: 0.8629, test_f1: 0.5593
 epoch: 84, train_loss: 0.7562, test_loss: 0.9071, test_f1: 0.5287
 epoch: 85, train_loss: 0.7770, test_loss: 0.8708, test_f1: 0.5338
 epoch: 86, train_loss: 0.7561, test_loss: 0.8727, test_f1: 0.5382
 epoch: 87, train_loss: 0.7458, test_loss: 0.8583, test_f1: 0.5484
 epoch: 88, train_loss: 0.7495, test_loss: 0.8671, test_f1: 0.5472
 epoch: 89, train_loss: 0.7555, test_loss: 0.8652, test_f1: 0.5418
 epoch: 90, train_loss: 0.7536, test_loss: 0.8826, test_f1: 0.5405
 epoch: 91, train_loss: 0.7558, test_loss: 0.8587, test_f1: 0.5487
 epoch: 92, train_loss: 0.7457, test_loss: 0.8632, test_f1: 0.5418
 epoch: 93, train_loss: 0.7509, test_loss: 0.8714, test_f1: 0.5431
 epoch: 94, train_loss: 0.7498, test_loss: 0.8816, test_f1: 0.5332
 epoch: 95, train_loss: 0.7533, test_loss: 0.8642, test_f1: 0.5432
 epoch: 96, train_loss: 0.7502, test_loss: 0.8888, test_f1: 0.5330
 epoch: 97, train_loss: 0.7376, test_loss: 0.8785, test_f1: 0.5384
 epoch: 98, train_loss: 0.7511, test_loss: 0.8748, test_f1: 0.5411
 epoch: 99, train_loss: 0.7460, test_loss: 0.8731, test_f1: 0.5409
##################ITERATION #8 ****************************************
 epoch: 0, train_loss: 1.2994, test_loss: 1.2103, test_f1: 0.2930
 epoch: 1, train_loss: 1.1310, test_loss: 1.0325, test_f1: 0.4228
 epoch: 2, train_loss: 1.1002, test_loss: 1.0043, test_f1: 0.4056
 epoch: 3, train_loss: 1.0774, test_loss: 1.0121, test_f1: 0.3882
 epoch: 4, train_loss: 1.0563, test_loss: 0.9899, test_f1: 0.4247
 epoch: 5, train_loss: 1.0427, test_loss: 0.9853, test_f1: 0.4814
 epoch: 6, train_loss: 1.0354, test_loss: 0.9797, test_f1: 0.4570
 epoch: 7, train_loss: 1.0084, test_loss: 0.9871, test_f1: 0.4803
 epoch: 8, train_loss: 1.0106, test_loss: 0.9980, test_f1: 0.4682
 epoch: 9, train_loss: 0.9978, test_loss: 1.0027, test_f1: 0.4662
 epoch: 10, train_loss: 0.9889, test_loss: 0.9821, test_f1: 0.5076
 epoch: 11, train_loss: 0.9887, test_loss: 1.0168, test_f1: 0.4411
 epoch: 12, train_loss: 0.9750, test_loss: 1.0045, test_f1: 0.5054
 epoch: 13, train_loss: 0.9795, test_loss: 0.9934, test_f1: 0.5010
 epoch: 14, train_loss: 0.9719, test_loss: 0.9757, test_f1: 0.5047
 epoch: 15, train_loss: 0.9644, test_loss: 1.0025, test_f1: 0.4583
 epoch: 16, train_loss: 0.9563, test_loss: 0.9761, test_f1: 0.4794
 epoch: 17, train_loss: 0.9469, test_loss: 0.9735, test_f1: 0.4884
 epoch: 18, train_loss: 0.9406, test_loss: 0.9818, test_f1: 0.4820
 epoch: 19, train_loss: 0.9459, test_loss: 0.9360, test_f1: 0.5217
 epoch: 20, train_loss: 0.9390, test_loss: 0.9634, test_f1: 0.4896
 epoch: 21, train_loss: 0.9317, test_loss: 0.9500, test_f1: 0.5075
 epoch: 22, train_loss: 0.9250, test_loss: 0.9727, test_f1: 0.5022
 epoch: 23, train_loss: 0.9258, test_loss: 0.9444, test_f1: 0.5078
 epoch: 24, train_loss: 0.9160, test_loss: 0.9590, test_f1: 0.5004
 epoch: 25, train_loss: 0.9193, test_loss: 0.9477, test_f1: 0.5056
 epoch: 26, train_loss: 0.9062, test_loss: 0.9436, test_f1: 0.5144
 epoch: 27, train_loss: 0.9211, test_loss: 0.9559, test_f1: 0.5061
 epoch: 28, train_loss: 0.9096, test_loss: 0.9508, test_f1: 0.4981
 epoch: 29, train_loss: 0.9146, test_loss: 0.9624, test_f1: 0.5051
 epoch: 30, train_loss: 0.8995, test_loss: 0.9887, test_f1: 0.4715
 epoch: 31, train_loss: 0.9009, test_loss: 0.9643, test_f1: 0.5074
 epoch: 32, train_loss: 0.8973, test_loss: 0.9304, test_f1: 0.5128
 epoch: 33, train_loss: 0.8889, test_loss: 0.9502, test_f1: 0.5085
 epoch: 34, train_loss: 0.8944, test_loss: 0.9836, test_f1: 0.4709
 epoch: 35, train_loss: 0.9085, test_loss: 0.9464, test_f1: 0.4994
 epoch: 36, train_loss: 0.8890, test_loss: 0.9225, test_f1: 0.5381
 epoch: 37, train_loss: 0.8978, test_loss: 0.9304, test_f1: 0.5277
 epoch: 38, train_loss: 0.8889, test_loss: 0.9484, test_f1: 0.5123
 epoch: 39, train_loss: 0.8843, test_loss: 0.9303, test_f1: 0.5188
 epoch: 40, train_loss: 0.8837, test_loss: 0.9441, test_f1: 0.5256
 epoch: 41, train_loss: 0.8804, test_loss: 0.9236, test_f1: 0.5329
 epoch: 42, train_loss: 0.8694, test_loss: 0.9491, test_f1: 0.5046
 epoch: 43, train_loss: 0.8705, test_loss: 0.9370, test_f1: 0.5201
 epoch: 44, train_loss: 0.8691, test_loss: 0.9429, test_f1: 0.5044
 epoch: 45, train_loss: 0.8567, test_loss: 1.0097, test_f1: 0.4787
 epoch: 46, train_loss: 0.8582, test_loss: 0.9508, test_f1: 0.5080
 epoch: 47, train_loss: 0.8565, test_loss: 0.9101, test_f1: 0.5263
 epoch: 48, train_loss: 0.8571, test_loss: 0.9260, test_f1: 0.5356
 epoch: 49, train_loss: 0.8484, test_loss: 0.9399, test_f1: 0.5280
 epoch: 50, train_loss: 0.8440, test_loss: 0.9457, test_f1: 0.5064
 epoch: 51, train_loss: 0.8412, test_loss: 0.9066, test_f1: 0.5289
 epoch: 52, train_loss: 0.8164, test_loss: 0.9286, test_f1: 0.5171
 epoch: 53, train_loss: 0.8312, test_loss: 0.9222, test_f1: 0.5251
 epoch: 54, train_loss: 0.8434, test_loss: 0.9242, test_f1: 0.5264
 epoch: 55, train_loss: 0.8306, test_loss: 0.9040, test_f1: 0.5366
 epoch: 56, train_loss: 0.8244, test_loss: 0.9217, test_f1: 0.5213
 epoch: 57, train_loss: 0.8315, test_loss: 0.9234, test_f1: 0.5137
 epoch: 58, train_loss: 0.8259, test_loss: 0.9072, test_f1: 0.5282
 epoch: 59, train_loss: 0.8227, test_loss: 0.9105, test_f1: 0.5215
 epoch: 60, train_loss: 0.8109, test_loss: 0.9220, test_f1: 0.5294
 epoch: 61, train_loss: 0.8171, test_loss: 0.9383, test_f1: 0.5151
 epoch: 62, train_loss: 0.8195, test_loss: 0.9185, test_f1: 0.5172
 epoch: 63, train_loss: 0.8166, test_loss: 0.9128, test_f1: 0.5235
 epoch: 64, train_loss: 0.8157, test_loss: 0.9199, test_f1: 0.5159
 epoch: 65, train_loss: 0.8330, test_loss: 0.8970, test_f1: 0.5195
 epoch: 66, train_loss: 0.8131, test_loss: 0.9273, test_f1: 0.5103
 epoch: 67, train_loss: 0.8184, test_loss: 0.8979, test_f1: 0.5234
 epoch: 68, train_loss: 0.8034, test_loss: 0.9273, test_f1: 0.4998
 epoch: 69, train_loss: 0.8310, test_loss: 0.9034, test_f1: 0.5258
 epoch: 70, train_loss: 0.8100, test_loss: 0.9271, test_f1: 0.5099
 epoch: 71, train_loss: 0.8010, test_loss: 0.8980, test_f1: 0.5340
 epoch: 72, train_loss: 0.8113, test_loss: 0.9131, test_f1: 0.5219
 epoch: 73, train_loss: 0.8114, test_loss: 0.9289, test_f1: 0.5105
 epoch: 74, train_loss: 0.7996, test_loss: 0.9009, test_f1: 0.5243
 epoch: 75, train_loss: 0.8090, test_loss: 0.9235, test_f1: 0.5325
 epoch: 76, train_loss: 0.8033, test_loss: 0.9234, test_f1: 0.5136
 epoch: 77, train_loss: 0.8059, test_loss: 0.9281, test_f1: 0.5097
 epoch: 78, train_loss: 0.7943, test_loss: 0.8987, test_f1: 0.5217
 epoch: 79, train_loss: 0.7864, test_loss: 0.9133, test_f1: 0.5159
 epoch: 80, train_loss: 0.7924, test_loss: 0.8844, test_f1: 0.5241
 epoch: 81, train_loss: 0.7898, test_loss: 0.9057, test_f1: 0.5284
 epoch: 82, train_loss: 0.8045, test_loss: 0.9161, test_f1: 0.5062
 epoch: 83, train_loss: 0.7939, test_loss: 0.8905, test_f1: 0.5322
 epoch: 84, train_loss: 0.8087, test_loss: 0.9505, test_f1: 0.5091
 epoch: 85, train_loss: 0.8025, test_loss: 0.9166, test_f1: 0.5229
 epoch: 86, train_loss: 0.7993, test_loss: 0.9014, test_f1: 0.5145
 epoch: 87, train_loss: 0.7875, test_loss: 0.8868, test_f1: 0.5275
 epoch: 88, train_loss: 0.7975, test_loss: 0.9105, test_f1: 0.5263
 epoch: 89, train_loss: 0.7932, test_loss: 0.8704, test_f1: 0.5427
 epoch: 90, train_loss: 0.7837, test_loss: 0.8959, test_f1: 0.5317
 epoch: 91, train_loss: 0.7747, test_loss: 0.8908, test_f1: 0.5259
 epoch: 92, train_loss: 0.7870, test_loss: 0.9287, test_f1: 0.5217
 epoch: 93, train_loss: 0.7927, test_loss: 0.8965, test_f1: 0.5244
 epoch: 94, train_loss: 0.7965, test_loss: 0.9255, test_f1: 0.4982
 epoch: 95, train_loss: 0.7918, test_loss: 0.9136, test_f1: 0.5108
 epoch: 96, train_loss: 0.7880, test_loss: 0.9056, test_f1: 0.5156
 epoch: 97, train_loss: 0.7838, test_loss: 0.9038, test_f1: 0.5283
 epoch: 98, train_loss: 0.7890, test_loss: 0.9280, test_f1: 0.5156
 epoch: 99, train_loss: 0.7752, test_loss: 0.9355, test_f1: 0.4974
##################ITERATION #9 ****************************************
 epoch: 0, train_loss: 1.4432, test_loss: 1.2044, test_f1: 0.2764
 epoch: 1, train_loss: 1.1659, test_loss: 1.1387, test_f1: 0.3747
 epoch: 2, train_loss: 1.1094, test_loss: 1.0835, test_f1: 0.3998
 epoch: 3, train_loss: 1.1055, test_loss: 1.0773, test_f1: 0.3864
 epoch: 4, train_loss: 1.0681, test_loss: 1.0548, test_f1: 0.3956
 epoch: 5, train_loss: 1.0508, test_loss: 1.0510, test_f1: 0.4216
 epoch: 6, train_loss: 1.0347, test_loss: 1.0536, test_f1: 0.4326
 epoch: 7, train_loss: 1.0142, test_loss: 1.0365, test_f1: 0.4199
 epoch: 8, train_loss: 1.0083, test_loss: 1.0584, test_f1: 0.4279
 epoch: 9, train_loss: 0.9916, test_loss: 1.0203, test_f1: 0.4232
 epoch: 10, train_loss: 0.9918, test_loss: 1.0017, test_f1: 0.4678
 epoch: 11, train_loss: 0.9736, test_loss: 0.9943, test_f1: 0.4909
 epoch: 12, train_loss: 0.9798, test_loss: 0.9845, test_f1: 0.4936
 epoch: 13, train_loss: 0.9576, test_loss: 0.9693, test_f1: 0.4927
 epoch: 14, train_loss: 0.9401, test_loss: 0.9518, test_f1: 0.4869
 epoch: 15, train_loss: 0.9512, test_loss: 0.9395, test_f1: 0.4995
 epoch: 16, train_loss: 0.9395, test_loss: 0.9370, test_f1: 0.5120
 epoch: 17, train_loss: 0.9315, test_loss: 0.9311, test_f1: 0.5234
 epoch: 18, train_loss: 0.9262, test_loss: 0.9284, test_f1: 0.5156
 epoch: 19, train_loss: 0.9057, test_loss: 0.9245, test_f1: 0.5069
 epoch: 20, train_loss: 0.9034, test_loss: 0.9267, test_f1: 0.4999
 epoch: 21, train_loss: 0.9118, test_loss: 0.9088, test_f1: 0.5102
 epoch: 22, train_loss: 0.8949, test_loss: 0.8983, test_f1: 0.5359
 epoch: 23, train_loss: 0.8910, test_loss: 0.8941, test_f1: 0.5344
 epoch: 24, train_loss: 0.9085, test_loss: 0.9043, test_f1: 0.5191
 epoch: 25, train_loss: 0.8856, test_loss: 0.8930, test_f1: 0.5128
 epoch: 26, train_loss: 0.8780, test_loss: 0.8954, test_f1: 0.5433
 epoch: 27, train_loss: 0.8760, test_loss: 0.9007, test_f1: 0.5309
 epoch: 28, train_loss: 0.8769, test_loss: 0.9011, test_f1: 0.4895
 epoch: 29, train_loss: 0.8697, test_loss: 0.8960, test_f1: 0.4948
 epoch: 30, train_loss: 0.8572, test_loss: 0.8700, test_f1: 0.5285
 epoch: 31, train_loss: 0.8539, test_loss: 0.8904, test_f1: 0.5302
 epoch: 32, train_loss: 0.8578, test_loss: 0.8766, test_f1: 0.5310
 epoch: 33, train_loss: 0.8641, test_loss: 0.8827, test_f1: 0.5381
 epoch: 34, train_loss: 0.8484, test_loss: 0.9051, test_f1: 0.5092
 epoch: 35, train_loss: 0.8460, test_loss: 0.8600, test_f1: 0.5251
 epoch: 36, train_loss: 0.8478, test_loss: 0.8809, test_f1: 0.5228
 epoch: 37, train_loss: 0.8507, test_loss: 0.8802, test_f1: 0.5147
 epoch: 38, train_loss: 0.8296, test_loss: 0.8782, test_f1: 0.5399
 epoch: 39, train_loss: 0.8258, test_loss: 0.8793, test_f1: 0.5198
 epoch: 40, train_loss: 0.8399, test_loss: 0.8886, test_f1: 0.5177
 epoch: 41, train_loss: 0.8351, test_loss: 0.8746, test_f1: 0.5329
 epoch: 42, train_loss: 0.8241, test_loss: 0.8540, test_f1: 0.5367
 epoch: 43, train_loss: 0.8304, test_loss: 0.8725, test_f1: 0.5496
 epoch: 44, train_loss: 0.8151, test_loss: 0.9019, test_f1: 0.5279
 epoch: 45, train_loss: 0.8245, test_loss: 0.8952, test_f1: 0.5239
 epoch: 46, train_loss: 0.8201, test_loss: 0.8690, test_f1: 0.5277
 epoch: 47, train_loss: 0.8205, test_loss: 0.8695, test_f1: 0.5250
 epoch: 48, train_loss: 0.8003, test_loss: 0.8716, test_f1: 0.5364
 epoch: 49, train_loss: 0.8248, test_loss: 0.8593, test_f1: 0.5497
 epoch: 50, train_loss: 0.8038, test_loss: 0.8644, test_f1: 0.5389
 epoch: 51, train_loss: 0.7961, test_loss: 0.8581, test_f1: 0.5390
 epoch: 52, train_loss: 0.7926, test_loss: 0.8579, test_f1: 0.5282
 epoch: 53, train_loss: 0.7855, test_loss: 0.8563, test_f1: 0.5345
 epoch: 54, train_loss: 0.7924, test_loss: 0.8511, test_f1: 0.5428
 epoch: 55, train_loss: 0.7909, test_loss: 0.8655, test_f1: 0.5259
 epoch: 56, train_loss: 0.7993, test_loss: 0.8604, test_f1: 0.5379
 epoch: 57, train_loss: 0.7841, test_loss: 0.8693, test_f1: 0.5371
 epoch: 58, train_loss: 0.7747, test_loss: 0.8839, test_f1: 0.5188
 epoch: 59, train_loss: 0.7855, test_loss: 0.8624, test_f1: 0.5299
 epoch: 60, train_loss: 0.7778, test_loss: 0.8524, test_f1: 0.5536
 epoch: 61, train_loss: 0.7893, test_loss: 0.8565, test_f1: 0.5471
 epoch: 62, train_loss: 0.7777, test_loss: 0.8484, test_f1: 0.5407
 epoch: 63, train_loss: 0.7912, test_loss: 0.8568, test_f1: 0.5403
 epoch: 64, train_loss: 0.7773, test_loss: 0.8531, test_f1: 0.5559
 epoch: 65, train_loss: 0.7741, test_loss: 0.8415, test_f1: 0.5535
 epoch: 66, train_loss: 0.7685, test_loss: 0.8440, test_f1: 0.5556
 epoch: 67, train_loss: 0.7720, test_loss: 0.8721, test_f1: 0.5266
 epoch: 68, train_loss: 0.7679, test_loss: 0.8596, test_f1: 0.5511
 epoch: 69, train_loss: 0.7556, test_loss: 0.8609, test_f1: 0.5368
 epoch: 70, train_loss: 0.7560, test_loss: 0.8640, test_f1: 0.5584
 epoch: 71, train_loss: 0.7688, test_loss: 0.8667, test_f1: 0.5427
 epoch: 72, train_loss: 0.7768, test_loss: 0.8404, test_f1: 0.5538
 epoch: 73, train_loss: 0.7669, test_loss: 0.8708, test_f1: 0.5360
 epoch: 74, train_loss: 0.7708, test_loss: 0.8557, test_f1: 0.5478
 epoch: 75, train_loss: 0.7462, test_loss: 0.8479, test_f1: 0.5519
 epoch: 76, train_loss: 0.7521, test_loss: 0.8575, test_f1: 0.5428
 epoch: 77, train_loss: 0.7604, test_loss: 0.8657, test_f1: 0.5406
 epoch: 78, train_loss: 0.7414, test_loss: 0.8421, test_f1: 0.5639
 epoch: 79, train_loss: 0.7516, test_loss: 0.8681, test_f1: 0.5483
 epoch: 80, train_loss: 0.7515, test_loss: 0.8495, test_f1: 0.5572
 epoch: 81, train_loss: 0.7588, test_loss: 0.8467, test_f1: 0.5484
 epoch: 82, train_loss: 0.7568, test_loss: 0.8566, test_f1: 0.5401
 epoch: 83, train_loss: 0.7608, test_loss: 0.8672, test_f1: 0.5344
 epoch: 84, train_loss: 0.7604, test_loss: 0.8469, test_f1: 0.5641
 epoch: 85, train_loss: 0.7512, test_loss: 0.8620, test_f1: 0.5599
 epoch: 86, train_loss: 0.7509, test_loss: 0.8648, test_f1: 0.5443
 epoch: 87, train_loss: 0.7482, test_loss: 0.8566, test_f1: 0.5461
 epoch: 88, train_loss: 0.7383, test_loss: 0.8538, test_f1: 0.5438
 epoch: 89, train_loss: 0.7417, test_loss: 0.8612, test_f1: 0.5396
 epoch: 90, train_loss: 0.7378, test_loss: 0.8480, test_f1: 0.5659
 epoch: 91, train_loss: 0.7442, test_loss: 0.8531, test_f1: 0.5552
 epoch: 92, train_loss: 0.7579, test_loss: 0.8576, test_f1: 0.5539
 epoch: 93, train_loss: 0.7499, test_loss: 0.8491, test_f1: 0.5597
 epoch: 94, train_loss: 0.7436, test_loss: 0.8639, test_f1: 0.5453
 epoch: 95, train_loss: 0.7461, test_loss: 0.8397, test_f1: 0.5551
 epoch: 96, train_loss: 0.7350, test_loss: 0.8465, test_f1: 0.5670
 epoch: 97, train_loss: 0.7463, test_loss: 0.8746, test_f1: 0.5550
 epoch: 98, train_loss: 0.7386, test_loss: 0.8730, test_f1: 0.5330
 epoch: 99, train_loss: 0.7521, test_loss: 0.8718, test_f1: 0.5345

Training completed in 628.00 seconds
Best F1: 0.5696 at epoch 92
Mean F1 across iterations: 0.5586  0.0099
========================FINAL RESULTS================================
FEGIN weighted F1: 0.5696  0.0099
python main.py --data ltspice_examples --representation component_pin --model FEGIN --layers 3 --hiddens 16 --batch_size 64 --lr 0.001 --emb_size 250 --epochs 100 --save_appendix component_pin_L3_H16_BS64_LR0.001_E250 --no_val
-----



STDERR:
  File "main.py", line 370, in <module>
    main()
  File "main.py", line 254, in main
    dataset = dataset_class(
  File "/home/philip/projects/ltspice_examples_code_repo/Circuit-Completion-Using-GNNs/component_classification_with_link_prediction_head/evaluation/FEGIN/kernel/circuit_datasets.py", line 15, in __init__
    self.data, self.slices = torch.load(self.processed_paths[0])
  File "/home/philip/.local/lib/python3.8/site-packages/torch/serialization.py", line 1040, in load
    warnings.warn(
  File "/usr/lib/python3.8/warnings.py", line 109, in _showwarnmsg
    sw(msg.message, msg.category, msg.filename, msg.lineno,
  File "main.py", line 47, in warn_with_traceback
    traceback.print_stack(file=log)
/home/philip/projects/ltspice_examples_code_repo/Circuit-Completion-Using-GNNs/component_classification_with_link_prediction_head/evaluation/FEGIN/kernel/circuit_datasets.py:15: FutureWarning: You are using `torch.load` with `weights_only=False` (the current default value), which uses the default pickle module implicitly. It is possible to construct malicious pickle data which will execute arbitrary code during unpickling (See https://github.com/pytorch/pytorch/blob/main/SECURITY.md#untrusted-models for more details). In a future release, the default value for `weights_only` will be flipped to `True`. This limits the functions that could be executed during unpickling. Arbitrary objects will no longer be allowed to be loaded via this mode unless they are explicitly allowlisted by the user via `torch.serialization.add_safe_globals`. We recommend you start setting `weights_only=True` for any use case where you don't have full control of the loaded file. Please open an issue on GitHub for any issues related to this experimental feature.
  self.data, self.slices = torch.load(self.processed_paths[0])
