STDOUT:
Results will be saved in /home/philip/projects/ltspice_examples_code_repo/Circuit-Completion-Using-GNNs/component_classification_with_link_prediction_head/evaluation/FEGIN/results/model_FEGIN_dataset_ltspice_demos
Command line input: python main.py --data ltspice_demos --representation component_component --model FEGIN --layers 3 --hiddens 16 --batch_size 256 --lr 0.001 --emb_size 128 --epochs 100 --save_appendix component_component_L3_H16_BS256_LR0.001_E128 --no_val
 is saved.
-----
ltspice_demos - FEGIN
Using 3 layers, 16 hidden units, h = 2
Loading component_component representation dataset
ENTERED
Training FEGIN on component_component representation
Train: 1565, Test: 383
##################ITERATION #0 ****************************************
 epoch: 0, train_loss: 1.3337, test_loss: 1.3419, test_f1: 0.1836
 epoch: 1, train_loss: 1.3196, test_loss: 1.3360, test_f1: 0.3195
 epoch: 2, train_loss: 1.3084, test_loss: 1.3301, test_f1: 0.2586
 epoch: 3, train_loss: 1.2987, test_loss: 1.3231, test_f1: 0.2289
 epoch: 4, train_loss: 1.2896, test_loss: 1.3153, test_f1: 0.2289
 epoch: 5, train_loss: 1.2808, test_loss: 1.3083, test_f1: 0.2289
 epoch: 6, train_loss: 1.2703, test_loss: 1.3025, test_f1: 0.2289
 epoch: 7, train_loss: 1.2625, test_loss: 1.2988, test_f1: 0.2285
 epoch: 8, train_loss: 1.2572, test_loss: 1.2955, test_f1: 0.2285
 epoch: 9, train_loss: 1.2454, test_loss: 1.2909, test_f1: 0.2285
 epoch: 10, train_loss: 1.2447, test_loss: 1.2877, test_f1: 0.2289
 epoch: 11, train_loss: 1.2384, test_loss: 1.2871, test_f1: 0.2293
 epoch: 12, train_loss: 1.2283, test_loss: 1.2864, test_f1: 0.2293
 epoch: 13, train_loss: 1.2245, test_loss: 1.2844, test_f1: 0.2541
 epoch: 14, train_loss: 1.2187, test_loss: 1.2851, test_f1: 0.2713
 epoch: 15, train_loss: 1.2151, test_loss: 1.2810, test_f1: 0.2645
 epoch: 16, train_loss: 1.2034, test_loss: 1.2767, test_f1: 0.2678
 epoch: 17, train_loss: 1.2007, test_loss: 1.2790, test_f1: 0.2825
 epoch: 18, train_loss: 1.2000, test_loss: 1.2848, test_f1: 0.2793
 epoch: 19, train_loss: 1.1982, test_loss: 1.2929, test_f1: 0.2651
 epoch: 20, train_loss: 1.1901, test_loss: 1.2912, test_f1: 0.2719
 epoch: 21, train_loss: 1.1826, test_loss: 1.2734, test_f1: 0.2910
 epoch: 22, train_loss: 1.1844, test_loss: 1.2698, test_f1: 0.2850
 epoch: 23, train_loss: 1.1699, test_loss: 1.2737, test_f1: 0.2771
 epoch: 24, train_loss: 1.1727, test_loss: 1.2731, test_f1: 0.2711
 epoch: 25, train_loss: 1.1733, test_loss: 1.2725, test_f1: 0.2757
 epoch: 26, train_loss: 1.1660, test_loss: 1.2714, test_f1: 0.2778
 epoch: 27, train_loss: 1.1646, test_loss: 1.2716, test_f1: 0.2819
 epoch: 28, train_loss: 1.1497, test_loss: 1.2735, test_f1: 0.2916
 epoch: 29, train_loss: 1.1506, test_loss: 1.2749, test_f1: 0.2824
 epoch: 30, train_loss: 1.1397, test_loss: 1.2752, test_f1: 0.2832
 epoch: 31, train_loss: 1.1342, test_loss: 1.2869, test_f1: 0.2909
 epoch: 32, train_loss: 1.1320, test_loss: 1.2791, test_f1: 0.3147
 epoch: 33, train_loss: 1.1323, test_loss: 1.2859, test_f1: 0.3619
 epoch: 34, train_loss: 1.1282, test_loss: 1.2869, test_f1: 0.4034
 epoch: 35, train_loss: 1.1256, test_loss: 1.2865, test_f1: 0.3827
 epoch: 36, train_loss: 1.1186, test_loss: 1.2973, test_f1: 0.3782
 epoch: 37, train_loss: 1.1191, test_loss: 1.2876, test_f1: 0.3554
 epoch: 38, train_loss: 1.1123, test_loss: 1.2824, test_f1: 0.4287
 epoch: 39, train_loss: 1.0998, test_loss: 1.2898, test_f1: 0.4174
 epoch: 40, train_loss: 1.1011, test_loss: 1.2950, test_f1: 0.4173
 epoch: 41, train_loss: 1.0989, test_loss: 1.3044, test_f1: 0.3885
 epoch: 42, train_loss: 1.0999, test_loss: 1.2878, test_f1: 0.3955
 epoch: 43, train_loss: 1.0841, test_loss: 1.2867, test_f1: 0.3990
 epoch: 44, train_loss: 1.0796, test_loss: 1.2912, test_f1: 0.4229
 epoch: 45, train_loss: 1.0705, test_loss: 1.2872, test_f1: 0.4265
 epoch: 46, train_loss: 1.0810, test_loss: 1.2904, test_f1: 0.3551
 epoch: 47, train_loss: 1.0606, test_loss: 1.3285, test_f1: 0.3670
 epoch: 48, train_loss: 1.0727, test_loss: 1.3519, test_f1: 0.3666
 epoch: 49, train_loss: 1.0599, test_loss: 1.3563, test_f1: 0.3731
 epoch: 50, train_loss: 1.0590, test_loss: 1.3382, test_f1: 0.3791
 epoch: 51, train_loss: 1.0491, test_loss: 1.3253, test_f1: 0.3614
 epoch: 52, train_loss: 1.0457, test_loss: 1.3334, test_f1: 0.4027
 epoch: 53, train_loss: 1.0543, test_loss: 1.3332, test_f1: 0.3953
 epoch: 54, train_loss: 1.0538, test_loss: 1.3260, test_f1: 0.4031
 epoch: 55, train_loss: 1.0395, test_loss: 1.3123, test_f1: 0.4054
 epoch: 56, train_loss: 1.0443, test_loss: 1.3266, test_f1: 0.4142
 epoch: 57, train_loss: 1.0388, test_loss: 1.3578, test_f1: 0.4029
 epoch: 58, train_loss: 1.0394, test_loss: 1.3826, test_f1: 0.4038
 epoch: 59, train_loss: 1.0376, test_loss: 1.3529, test_f1: 0.4073
 epoch: 60, train_loss: 1.0337, test_loss: 1.3435, test_f1: 0.4094
 epoch: 61, train_loss: 1.0241, test_loss: 1.3322, test_f1: 0.4034
 epoch: 62, train_loss: 1.0269, test_loss: 1.3415, test_f1: 0.4047
 epoch: 63, train_loss: 1.0285, test_loss: 1.3537, test_f1: 0.4204
 epoch: 64, train_loss: 1.0220, test_loss: 1.3479, test_f1: 0.4199
 epoch: 65, train_loss: 1.0276, test_loss: 1.3378, test_f1: 0.4014
 epoch: 66, train_loss: 1.0208, test_loss: 1.3433, test_f1: 0.4116
 epoch: 67, train_loss: 1.0285, test_loss: 1.3577, test_f1: 0.4094
 epoch: 68, train_loss: 1.0236, test_loss: 1.3569, test_f1: 0.4048
 epoch: 69, train_loss: 1.0168, test_loss: 1.3562, test_f1: 0.4135
 epoch: 70, train_loss: 1.0130, test_loss: 1.3735, test_f1: 0.4061
 epoch: 71, train_loss: 1.0069, test_loss: 1.3633, test_f1: 0.4140
 epoch: 72, train_loss: 1.0212, test_loss: 1.3420, test_f1: 0.4163
 epoch: 73, train_loss: 1.0127, test_loss: 1.3332, test_f1: 0.4093
 epoch: 74, train_loss: 0.9996, test_loss: 1.3483, test_f1: 0.4094
 epoch: 75, train_loss: 1.0033, test_loss: 1.3520, test_f1: 0.4072
 epoch: 76, train_loss: 0.9978, test_loss: 1.3529, test_f1: 0.4095
 epoch: 77, train_loss: 1.0094, test_loss: 1.3561, test_f1: 0.4097
 epoch: 78, train_loss: 1.0161, test_loss: 1.3644, test_f1: 0.4169
 epoch: 79, train_loss: 0.9959, test_loss: 1.3665, test_f1: 0.4135
 epoch: 80, train_loss: 1.0091, test_loss: 1.3854, test_f1: 0.4145
 epoch: 81, train_loss: 1.0027, test_loss: 1.4153, test_f1: 0.4062
 epoch: 82, train_loss: 0.9936, test_loss: 1.3942, test_f1: 0.4187
 epoch: 83, train_loss: 1.0057, test_loss: 1.3809, test_f1: 0.4241
 epoch: 84, train_loss: 1.0014, test_loss: 1.3892, test_f1: 0.4189
 epoch: 85, train_loss: 0.9969, test_loss: 1.4114, test_f1: 0.4142
 epoch: 86, train_loss: 0.9875, test_loss: 1.4213, test_f1: 0.4221
 epoch: 87, train_loss: 0.9989, test_loss: 1.4063, test_f1: 0.4272
 epoch: 88, train_loss: 0.9822, test_loss: 1.3992, test_f1: 0.4365
 epoch: 89, train_loss: 0.9877, test_loss: 1.3869, test_f1: 0.4348
 epoch: 90, train_loss: 0.9918, test_loss: 1.3890, test_f1: 0.4339
 epoch: 91, train_loss: 0.9838, test_loss: 1.3759, test_f1: 0.4427
 epoch: 92, train_loss: 0.9785, test_loss: 1.3389, test_f1: 0.4290
 epoch: 93, train_loss: 0.9852, test_loss: 1.3515, test_f1: 0.4192
 epoch: 94, train_loss: 0.9854, test_loss: 1.3632, test_f1: 0.4232
 epoch: 95, train_loss: 0.9805, test_loss: 1.3701, test_f1: 0.4323
 epoch: 96, train_loss: 0.9861, test_loss: 1.3567, test_f1: 0.4298
 epoch: 97, train_loss: 0.9785, test_loss: 1.3690, test_f1: 0.4302
 epoch: 98, train_loss: 0.9781, test_loss: 1.3772, test_f1: 0.4424
 epoch: 99, train_loss: 0.9780, test_loss: 1.3836, test_f1: 0.4250
##################ITERATION #1 ****************************************
 epoch: 0, train_loss: 1.3131, test_loss: 1.3283, test_f1: 0.2885
 epoch: 1, train_loss: 1.2778, test_loss: 1.3203, test_f1: 0.2281
 epoch: 2, train_loss: 1.2656, test_loss: 1.3109, test_f1: 0.2281
 epoch: 3, train_loss: 1.2500, test_loss: 1.3024, test_f1: 0.2281
 epoch: 4, train_loss: 1.2430, test_loss: 1.2906, test_f1: 0.2281
 epoch: 5, train_loss: 1.2305, test_loss: 1.2807, test_f1: 0.2289
 epoch: 6, train_loss: 1.2188, test_loss: 1.2770, test_f1: 0.2289
 epoch: 7, train_loss: 1.2134, test_loss: 1.2708, test_f1: 0.2289
 epoch: 8, train_loss: 1.2054, test_loss: 1.2645, test_f1: 0.2289
 epoch: 9, train_loss: 1.2027, test_loss: 1.2583, test_f1: 0.2285
 epoch: 10, train_loss: 1.1912, test_loss: 1.2550, test_f1: 0.2285
 epoch: 11, train_loss: 1.1845, test_loss: 1.2498, test_f1: 0.2384
 epoch: 12, train_loss: 1.1755, test_loss: 1.2443, test_f1: 0.3310
 epoch: 13, train_loss: 1.1637, test_loss: 1.2413, test_f1: 0.3423
 epoch: 14, train_loss: 1.1554, test_loss: 1.2395, test_f1: 0.4066
 epoch: 15, train_loss: 1.1467, test_loss: 1.2340, test_f1: 0.4041
 epoch: 16, train_loss: 1.1400, test_loss: 1.2365, test_f1: 0.4096
 epoch: 17, train_loss: 1.1388, test_loss: 1.2327, test_f1: 0.4128
 epoch: 18, train_loss: 1.1199, test_loss: 1.2287, test_f1: 0.4207
 epoch: 19, train_loss: 1.1161, test_loss: 1.2214, test_f1: 0.4335
 epoch: 20, train_loss: 1.1150, test_loss: 1.2224, test_f1: 0.4257
 epoch: 21, train_loss: 1.1131, test_loss: 1.2270, test_f1: 0.4134
 epoch: 22, train_loss: 1.1009, test_loss: 1.2242, test_f1: 0.4236
 epoch: 23, train_loss: 1.0854, test_loss: 1.2196, test_f1: 0.4073
 epoch: 24, train_loss: 1.0900, test_loss: 1.1987, test_f1: 0.4187
 epoch: 25, train_loss: 1.0785, test_loss: 1.1976, test_f1: 0.4167
 epoch: 26, train_loss: 1.0745, test_loss: 1.1933, test_f1: 0.4248
 epoch: 27, train_loss: 1.0737, test_loss: 1.2003, test_f1: 0.4288
 epoch: 28, train_loss: 1.0594, test_loss: 1.2123, test_f1: 0.4220
 epoch: 29, train_loss: 1.0604, test_loss: 1.1881, test_f1: 0.4434
 epoch: 30, train_loss: 1.0638, test_loss: 1.1857, test_f1: 0.4630
 epoch: 31, train_loss: 1.0429, test_loss: 1.2086, test_f1: 0.4581
 epoch: 32, train_loss: 1.0574, test_loss: 1.1868, test_f1: 0.4565
 epoch: 33, train_loss: 1.0437, test_loss: 1.1949, test_f1: 0.4518
 epoch: 34, train_loss: 1.0421, test_loss: 1.2088, test_f1: 0.4282
 epoch: 35, train_loss: 1.0452, test_loss: 1.1995, test_f1: 0.4249
 epoch: 36, train_loss: 1.0494, test_loss: 1.2117, test_f1: 0.4390
 epoch: 37, train_loss: 1.0352, test_loss: 1.2131, test_f1: 0.4174
 epoch: 38, train_loss: 1.0248, test_loss: 1.2109, test_f1: 0.4443
 epoch: 39, train_loss: 1.0254, test_loss: 1.1924, test_f1: 0.4319
 epoch: 40, train_loss: 1.0162, test_loss: 1.1853, test_f1: 0.4404
 epoch: 41, train_loss: 1.0235, test_loss: 1.1980, test_f1: 0.4162
 epoch: 42, train_loss: 1.0123, test_loss: 1.2140, test_f1: 0.4158
 epoch: 43, train_loss: 1.0071, test_loss: 1.2174, test_f1: 0.4459
 epoch: 44, train_loss: 1.0164, test_loss: 1.2235, test_f1: 0.4292
 epoch: 45, train_loss: 0.9988, test_loss: 1.2312, test_f1: 0.4347
 epoch: 46, train_loss: 0.9993, test_loss: 1.2284, test_f1: 0.4277
 epoch: 47, train_loss: 0.9839, test_loss: 1.2288, test_f1: 0.4655
 epoch: 48, train_loss: 1.0059, test_loss: 1.2422, test_f1: 0.4488
 epoch: 49, train_loss: 0.9890, test_loss: 1.2386, test_f1: 0.4372
 epoch: 50, train_loss: 0.9890, test_loss: 1.2492, test_f1: 0.4473
 epoch: 51, train_loss: 0.9681, test_loss: 1.2517, test_f1: 0.4518
 epoch: 52, train_loss: 0.9855, test_loss: 1.2500, test_f1: 0.4607
 epoch: 53, train_loss: 0.9845, test_loss: 1.2551, test_f1: 0.4606
 epoch: 54, train_loss: 0.9846, test_loss: 1.2577, test_f1: 0.4657
 epoch: 55, train_loss: 0.9821, test_loss: 1.2642, test_f1: 0.4609
 epoch: 56, train_loss: 0.9741, test_loss: 1.2661, test_f1: 0.4591
 epoch: 57, train_loss: 0.9757, test_loss: 1.2707, test_f1: 0.4537
 epoch: 58, train_loss: 0.9743, test_loss: 1.2735, test_f1: 0.4345
 epoch: 59, train_loss: 0.9733, test_loss: 1.2676, test_f1: 0.4322
 epoch: 60, train_loss: 0.9691, test_loss: 1.2686, test_f1: 0.4665
 epoch: 61, train_loss: 0.9665, test_loss: 1.2689, test_f1: 0.4639
 epoch: 62, train_loss: 0.9686, test_loss: 1.2764, test_f1: 0.4587
 epoch: 63, train_loss: 0.9648, test_loss: 1.2843, test_f1: 0.4488
 epoch: 64, train_loss: 0.9578, test_loss: 1.2839, test_f1: 0.4462
 epoch: 65, train_loss: 0.9566, test_loss: 1.2818, test_f1: 0.4608
 epoch: 66, train_loss: 0.9647, test_loss: 1.2817, test_f1: 0.4534
 epoch: 67, train_loss: 0.9587, test_loss: 1.2949, test_f1: 0.4350
 epoch: 68, train_loss: 0.9648, test_loss: 1.2959, test_f1: 0.4275
 epoch: 69, train_loss: 0.9709, test_loss: 1.2888, test_f1: 0.4442
 epoch: 70, train_loss: 0.9735, test_loss: 1.2886, test_f1: 0.4712
 epoch: 71, train_loss: 0.9723, test_loss: 1.2869, test_f1: 0.4619
 epoch: 72, train_loss: 0.9665, test_loss: 1.2747, test_f1: 0.4540
 epoch: 73, train_loss: 0.9625, test_loss: 1.2797, test_f1: 0.4343
 epoch: 74, train_loss: 0.9662, test_loss: 1.2813, test_f1: 0.4322
 epoch: 75, train_loss: 0.9611, test_loss: 1.2818, test_f1: 0.4245
 epoch: 76, train_loss: 0.9553, test_loss: 1.2773, test_f1: 0.4493
 epoch: 77, train_loss: 0.9459, test_loss: 1.2806, test_f1: 0.4636
 epoch: 78, train_loss: 0.9575, test_loss: 1.2799, test_f1: 0.4589
 epoch: 79, train_loss: 0.9557, test_loss: 1.2821, test_f1: 0.4422
 epoch: 80, train_loss: 0.9573, test_loss: 1.2914, test_f1: 0.4379
 epoch: 81, train_loss: 0.9418, test_loss: 1.2995, test_f1: 0.4562
 epoch: 82, train_loss: 0.9497, test_loss: 1.3032, test_f1: 0.4480
 epoch: 83, train_loss: 0.9546, test_loss: 1.3067, test_f1: 0.4468
 epoch: 84, train_loss: 0.9555, test_loss: 1.3162, test_f1: 0.4269
 epoch: 85, train_loss: 0.9519, test_loss: 1.3169, test_f1: 0.4296
 epoch: 86, train_loss: 0.9440, test_loss: 1.3144, test_f1: 0.4444
 epoch: 87, train_loss: 0.9400, test_loss: 1.2964, test_f1: 0.4368
 epoch: 88, train_loss: 0.9526, test_loss: 1.2942, test_f1: 0.4466
 epoch: 89, train_loss: 0.9394, test_loss: 1.3045, test_f1: 0.4513
 epoch: 90, train_loss: 0.9368, test_loss: 1.3062, test_f1: 0.4443
 epoch: 91, train_loss: 0.9481, test_loss: 1.3082, test_f1: 0.4488
 epoch: 92, train_loss: 0.9351, test_loss: 1.3171, test_f1: 0.4373
 epoch: 93, train_loss: 0.9461, test_loss: 1.3195, test_f1: 0.4488
 epoch: 94, train_loss: 0.9441, test_loss: 1.3178, test_f1: 0.4545
 epoch: 95, train_loss: 0.9362, test_loss: 1.3213, test_f1: 0.4496
 epoch: 96, train_loss: 0.9207, test_loss: 1.3295, test_f1: 0.4398
 epoch: 97, train_loss: 0.9254, test_loss: 1.3444, test_f1: 0.4540
 epoch: 98, train_loss: 0.9381, test_loss: 1.3423, test_f1: 0.4662
 epoch: 99, train_loss: 0.9299, test_loss: 1.3346, test_f1: 0.4345
##################ITERATION #2 ****************************************
 epoch: 0, train_loss: 1.2847, test_loss: 1.3168, test_f1: 0.2293
 epoch: 1, train_loss: 1.2558, test_loss: 1.3084, test_f1: 0.2398
 epoch: 2, train_loss: 1.2413, test_loss: 1.2993, test_f1: 0.2518
 epoch: 3, train_loss: 1.2277, test_loss: 1.2865, test_f1: 0.2549
 epoch: 4, train_loss: 1.2233, test_loss: 1.2756, test_f1: 0.2687
 epoch: 5, train_loss: 1.2199, test_loss: 1.2649, test_f1: 0.3438
 epoch: 6, train_loss: 1.2050, test_loss: 1.2615, test_f1: 0.3615
 epoch: 7, train_loss: 1.1991, test_loss: 1.2550, test_f1: 0.3741
 epoch: 8, train_loss: 1.1907, test_loss: 1.2465, test_f1: 0.3580
 epoch: 9, train_loss: 1.1873, test_loss: 1.2365, test_f1: 0.3589
 epoch: 10, train_loss: 1.1818, test_loss: 1.2311, test_f1: 0.4049
 epoch: 11, train_loss: 1.1711, test_loss: 1.2256, test_f1: 0.4217
 epoch: 12, train_loss: 1.1632, test_loss: 1.2181, test_f1: 0.4224
 epoch: 13, train_loss: 1.1587, test_loss: 1.2209, test_f1: 0.4211
 epoch: 14, train_loss: 1.1492, test_loss: 1.2116, test_f1: 0.4349
 epoch: 15, train_loss: 1.1411, test_loss: 1.2112, test_f1: 0.4465
 epoch: 16, train_loss: 1.1410, test_loss: 1.2026, test_f1: 0.4482
 epoch: 17, train_loss: 1.1317, test_loss: 1.2151, test_f1: 0.4430
 epoch: 18, train_loss: 1.1286, test_loss: 1.2183, test_f1: 0.4407
 epoch: 19, train_loss: 1.1376, test_loss: 1.2145, test_f1: 0.4405
 epoch: 20, train_loss: 1.1237, test_loss: 1.2009, test_f1: 0.4537
 epoch: 21, train_loss: 1.1106, test_loss: 1.1973, test_f1: 0.4560
 epoch: 22, train_loss: 1.1191, test_loss: 1.2084, test_f1: 0.4632
 epoch: 23, train_loss: 1.1126, test_loss: 1.2048, test_f1: 0.4469
 epoch: 24, train_loss: 1.1124, test_loss: 1.2082, test_f1: 0.4699
 epoch: 25, train_loss: 1.0976, test_loss: 1.2136, test_f1: 0.4341
 epoch: 26, train_loss: 1.0978, test_loss: 1.2106, test_f1: 0.4333
 epoch: 27, train_loss: 1.1027, test_loss: 1.2110, test_f1: 0.4208
 epoch: 28, train_loss: 1.1026, test_loss: 1.2229, test_f1: 0.3894
 epoch: 29, train_loss: 1.0858, test_loss: 1.2234, test_f1: 0.3793
 epoch: 30, train_loss: 1.0983, test_loss: 1.2142, test_f1: 0.3980
 epoch: 31, train_loss: 1.0846, test_loss: 1.2021, test_f1: 0.3803
 epoch: 32, train_loss: 1.0781, test_loss: 1.2013, test_f1: 0.4028
 epoch: 33, train_loss: 1.0742, test_loss: 1.2108, test_f1: 0.4257
 epoch: 34, train_loss: 1.0705, test_loss: 1.2138, test_f1: 0.4405
 epoch: 35, train_loss: 1.0663, test_loss: 1.2187, test_f1: 0.4587
 epoch: 36, train_loss: 1.0734, test_loss: 1.2339, test_f1: 0.4586
 epoch: 37, train_loss: 1.0756, test_loss: 1.2376, test_f1: 0.4522
 epoch: 38, train_loss: 1.0742, test_loss: 1.2259, test_f1: 0.4202
 epoch: 39, train_loss: 1.0602, test_loss: 1.2222, test_f1: 0.4176
 epoch: 40, train_loss: 1.0698, test_loss: 1.2113, test_f1: 0.4174
 epoch: 41, train_loss: 1.0612, test_loss: 1.2089, test_f1: 0.4056
 epoch: 42, train_loss: 1.0502, test_loss: 1.2072, test_f1: 0.4281
 epoch: 43, train_loss: 1.0733, test_loss: 1.2065, test_f1: 0.4340
 epoch: 44, train_loss: 1.0570, test_loss: 1.2176, test_f1: 0.4415
 epoch: 45, train_loss: 1.0735, test_loss: 1.2235, test_f1: 0.4278
 epoch: 46, train_loss: 1.0643, test_loss: 1.2360, test_f1: 0.4051
 epoch: 47, train_loss: 1.0486, test_loss: 1.2527, test_f1: 0.3946
 epoch: 48, train_loss: 1.0546, test_loss: 1.2530, test_f1: 0.3938
 epoch: 49, train_loss: 1.0579, test_loss: 1.2520, test_f1: 0.4414
 epoch: 50, train_loss: 1.0461, test_loss: 1.2668, test_f1: 0.4251
 epoch: 51, train_loss: 1.0385, test_loss: 1.2612, test_f1: 0.4210
 epoch: 52, train_loss: 1.0398, test_loss: 1.2627, test_f1: 0.4272
 epoch: 53, train_loss: 1.0434, test_loss: 1.2587, test_f1: 0.4385
 epoch: 54, train_loss: 1.0376, test_loss: 1.2402, test_f1: 0.4510
 epoch: 55, train_loss: 1.0354, test_loss: 1.2460, test_f1: 0.4341
 epoch: 56, train_loss: 1.0401, test_loss: 1.2605, test_f1: 0.4304
 epoch: 57, train_loss: 1.0330, test_loss: 1.2672, test_f1: 0.4187
 epoch: 58, train_loss: 1.0255, test_loss: 1.2773, test_f1: 0.4222
 epoch: 59, train_loss: 1.0404, test_loss: 1.2909, test_f1: 0.4297
 epoch: 60, train_loss: 1.0296, test_loss: 1.2955, test_f1: 0.4293
 epoch: 61, train_loss: 1.0327, test_loss: 1.3211, test_f1: 0.4403
 epoch: 62, train_loss: 1.0277, test_loss: 1.2839, test_f1: 0.4408
 epoch: 63, train_loss: 1.0316, test_loss: 1.2827, test_f1: 0.4356
 epoch: 64, train_loss: 1.0391, test_loss: 1.2642, test_f1: 0.4441
 epoch: 65, train_loss: 1.0257, test_loss: 1.2511, test_f1: 0.4347
 epoch: 66, train_loss: 1.0406, test_loss: 1.2813, test_f1: 0.4418
 epoch: 67, train_loss: 1.0293, test_loss: 1.3888, test_f1: 0.4339
 epoch: 68, train_loss: 1.0256, test_loss: 1.3782, test_f1: 0.4192
 epoch: 69, train_loss: 1.0311, test_loss: 1.4789, test_f1: 0.4397
 epoch: 70, train_loss: 1.0210, test_loss: 1.4435, test_f1: 0.4297
 epoch: 71, train_loss: 1.0176, test_loss: 1.3398, test_f1: 0.4338
 epoch: 72, train_loss: 1.0219, test_loss: 1.3165, test_f1: 0.4275
 epoch: 73, train_loss: 1.0213, test_loss: 1.3275, test_f1: 0.4346
 epoch: 74, train_loss: 1.0143, test_loss: 1.4119, test_f1: 0.4434
 epoch: 75, train_loss: 1.0162, test_loss: 1.5466, test_f1: 0.4451
 epoch: 76, train_loss: 1.0174, test_loss: 1.4323, test_f1: 0.4433
 epoch: 77, train_loss: 1.0212, test_loss: 1.3768, test_f1: 0.4370
 epoch: 78, train_loss: 1.0181, test_loss: 1.3649, test_f1: 0.4451
 epoch: 79, train_loss: 1.0264, test_loss: 1.4312, test_f1: 0.4498
 epoch: 80, train_loss: 1.0072, test_loss: 1.4957, test_f1: 0.4385
 epoch: 81, train_loss: 1.0152, test_loss: 1.5351, test_f1: 0.4395
 epoch: 82, train_loss: 1.0129, test_loss: 1.4203, test_f1: 0.4364
 epoch: 83, train_loss: 1.0136, test_loss: 1.4673, test_f1: 0.4423
 epoch: 84, train_loss: 1.0107, test_loss: 1.4921, test_f1: 0.4429
 epoch: 85, train_loss: 1.0174, test_loss: 1.5335, test_f1: 0.4323
 epoch: 86, train_loss: 1.0051, test_loss: 1.6982, test_f1: 0.4364
 epoch: 87, train_loss: 1.0169, test_loss: 1.6355, test_f1: 0.4357
 epoch: 88, train_loss: 1.0258, test_loss: 1.5778, test_f1: 0.4355
 epoch: 89, train_loss: 1.0089, test_loss: 1.5552, test_f1: 0.4371
 epoch: 90, train_loss: 1.0032, test_loss: 1.5165, test_f1: 0.4347
 epoch: 91, train_loss: 1.0136, test_loss: 1.5322, test_f1: 0.4384
 epoch: 92, train_loss: 1.0098, test_loss: 1.8203, test_f1: 0.4466
 epoch: 93, train_loss: 1.0180, test_loss: 1.9253, test_f1: 0.4557
 epoch: 94, train_loss: 1.0072, test_loss: 2.0441, test_f1: 0.4452
 epoch: 95, train_loss: 1.0134, test_loss: 2.2348, test_f1: 0.4480
 epoch: 96, train_loss: 1.0034, test_loss: 1.9696, test_f1: 0.4407
 epoch: 97, train_loss: 1.0114, test_loss: 1.6566, test_f1: 0.4356
 epoch: 98, train_loss: 1.0056, test_loss: 1.7437, test_f1: 0.4374
 epoch: 99, train_loss: 1.0074, test_loss: 1.8128, test_f1: 0.4434
##################ITERATION #3 ****************************************
 epoch: 0, train_loss: 1.2641, test_loss: 1.3329, test_f1: 0.2281
 epoch: 1, train_loss: 1.2231, test_loss: 1.3244, test_f1: 0.2281
 epoch: 2, train_loss: 1.1969, test_loss: 1.3081, test_f1: 0.2281
 epoch: 3, train_loss: 1.2017, test_loss: 1.2899, test_f1: 0.2281
 epoch: 4, train_loss: 1.1801, test_loss: 1.2654, test_f1: 0.2281
 epoch: 5, train_loss: 1.1708, test_loss: 1.2521, test_f1: 0.2546
 epoch: 6, train_loss: 1.1673, test_loss: 1.2326, test_f1: 0.3260
 epoch: 7, train_loss: 1.1550, test_loss: 1.2218, test_f1: 0.4170
 epoch: 8, train_loss: 1.1402, test_loss: 1.2152, test_f1: 0.4434
 epoch: 9, train_loss: 1.1472, test_loss: 1.2134, test_f1: 0.4366
 epoch: 10, train_loss: 1.1474, test_loss: 1.2019, test_f1: 0.4331
 epoch: 11, train_loss: 1.1224, test_loss: 1.2038, test_f1: 0.4434
 epoch: 12, train_loss: 1.1278, test_loss: 1.1962, test_f1: 0.4285
 epoch: 13, train_loss: 1.1241, test_loss: 1.1844, test_f1: 0.4221
 epoch: 14, train_loss: 1.1070, test_loss: 1.1787, test_f1: 0.4307
 epoch: 15, train_loss: 1.1135, test_loss: 1.1696, test_f1: 0.4331
 epoch: 16, train_loss: 1.1101, test_loss: 1.1673, test_f1: 0.4468
 epoch: 17, train_loss: 1.1035, test_loss: 1.1678, test_f1: 0.4436
 epoch: 18, train_loss: 1.1007, test_loss: 1.1622, test_f1: 0.4582
 epoch: 19, train_loss: 1.0965, test_loss: 1.1590, test_f1: 0.4459
 epoch: 20, train_loss: 1.0940, test_loss: 1.1516, test_f1: 0.4497
 epoch: 21, train_loss: 1.0942, test_loss: 1.1505, test_f1: 0.4555
 epoch: 22, train_loss: 1.0885, test_loss: 1.1530, test_f1: 0.4500
 epoch: 23, train_loss: 1.0792, test_loss: 1.1474, test_f1: 0.4478
 epoch: 24, train_loss: 1.0782, test_loss: 1.1435, test_f1: 0.4808
 epoch: 25, train_loss: 1.0651, test_loss: 1.1438, test_f1: 0.4565
 epoch: 26, train_loss: 1.0667, test_loss: 1.1469, test_f1: 0.4555
 epoch: 27, train_loss: 1.0556, test_loss: 1.1370, test_f1: 0.4505
 epoch: 28, train_loss: 1.0568, test_loss: 1.1323, test_f1: 0.4482
 epoch: 29, train_loss: 1.0489, test_loss: 1.1356, test_f1: 0.4610
 epoch: 30, train_loss: 1.0383, test_loss: 1.1427, test_f1: 0.4681
 epoch: 31, train_loss: 1.0572, test_loss: 1.1390, test_f1: 0.4862
 epoch: 32, train_loss: 1.0399, test_loss: 1.1362, test_f1: 0.4621
 epoch: 33, train_loss: 1.0412, test_loss: 1.1393, test_f1: 0.4696
 epoch: 34, train_loss: 1.0421, test_loss: 1.1356, test_f1: 0.4624
 epoch: 35, train_loss: 1.0555, test_loss: 1.1457, test_f1: 0.4688
 epoch: 36, train_loss: 1.0433, test_loss: 1.1546, test_f1: 0.4721
 epoch: 37, train_loss: 1.0288, test_loss: 1.1520, test_f1: 0.4707
 epoch: 38, train_loss: 1.0419, test_loss: 1.1492, test_f1: 0.4648
 epoch: 39, train_loss: 1.0237, test_loss: 1.1474, test_f1: 0.4573
 epoch: 40, train_loss: 1.0170, test_loss: 1.1426, test_f1: 0.4879
 epoch: 41, train_loss: 1.0249, test_loss: 1.1458, test_f1: 0.4886
 epoch: 42, train_loss: 1.0179, test_loss: 1.1478, test_f1: 0.4793
 epoch: 43, train_loss: 1.0201, test_loss: 1.1511, test_f1: 0.4658
 epoch: 44, train_loss: 1.0167, test_loss: 1.1461, test_f1: 0.4800
 epoch: 45, train_loss: 1.0112, test_loss: 1.1418, test_f1: 0.4871
 epoch: 46, train_loss: 1.0159, test_loss: 1.1372, test_f1: 0.4789
 epoch: 47, train_loss: 0.9954, test_loss: 1.1383, test_f1: 0.4881
 epoch: 48, train_loss: 1.0067, test_loss: 1.1390, test_f1: 0.4812
 epoch: 49, train_loss: 1.0061, test_loss: 1.1356, test_f1: 0.4776
 epoch: 50, train_loss: 0.9891, test_loss: 1.1350, test_f1: 0.5065
 epoch: 51, train_loss: 0.9975, test_loss: 1.1360, test_f1: 0.5065
 epoch: 52, train_loss: 0.9758, test_loss: 1.1361, test_f1: 0.4893
 epoch: 53, train_loss: 0.9870, test_loss: 1.1359, test_f1: 0.4819
 epoch: 54, train_loss: 0.9916, test_loss: 1.1435, test_f1: 0.4843
 epoch: 55, train_loss: 0.9701, test_loss: 1.1535, test_f1: 0.4815
 epoch: 56, train_loss: 1.0007, test_loss: 1.1573, test_f1: 0.4788
 epoch: 57, train_loss: 0.9820, test_loss: 1.1634, test_f1: 0.4837
 epoch: 58, train_loss: 0.9853, test_loss: 1.1618, test_f1: 0.4960
 epoch: 59, train_loss: 0.9705, test_loss: 1.1560, test_f1: 0.5094
 epoch: 60, train_loss: 0.9849, test_loss: 1.1579, test_f1: 0.5116
 epoch: 61, train_loss: 0.9796, test_loss: 1.1601, test_f1: 0.5038
 epoch: 62, train_loss: 0.9794, test_loss: 1.1613, test_f1: 0.5188
 epoch: 63, train_loss: 0.9824, test_loss: 1.1599, test_f1: 0.5064
 epoch: 64, train_loss: 0.9763, test_loss: 1.1579, test_f1: 0.4939
 epoch: 65, train_loss: 0.9715, test_loss: 1.1635, test_f1: 0.4964
 epoch: 66, train_loss: 0.9766, test_loss: 1.1683, test_f1: 0.4941
 epoch: 67, train_loss: 0.9704, test_loss: 1.1691, test_f1: 0.4937
 epoch: 68, train_loss: 0.9780, test_loss: 1.1664, test_f1: 0.4911
 epoch: 69, train_loss: 0.9779, test_loss: 1.1613, test_f1: 0.5057
 epoch: 70, train_loss: 0.9640, test_loss: 1.1637, test_f1: 0.5106
 epoch: 71, train_loss: 0.9765, test_loss: 1.1610, test_f1: 0.4935
 epoch: 72, train_loss: 0.9714, test_loss: 1.1647, test_f1: 0.4982
 epoch: 73, train_loss: 0.9638, test_loss: 1.1683, test_f1: 0.4959
 epoch: 74, train_loss: 0.9679, test_loss: 1.1620, test_f1: 0.5162
 epoch: 75, train_loss: 0.9651, test_loss: 1.1700, test_f1: 0.4987
 epoch: 76, train_loss: 0.9585, test_loss: 1.1752, test_f1: 0.4882
 epoch: 77, train_loss: 0.9682, test_loss: 1.1726, test_f1: 0.4857
 epoch: 78, train_loss: 0.9613, test_loss: 1.1634, test_f1: 0.4883
 epoch: 79, train_loss: 0.9484, test_loss: 1.1631, test_f1: 0.4880
 epoch: 80, train_loss: 0.9585, test_loss: 1.1677, test_f1: 0.5031
 epoch: 81, train_loss: 0.9483, test_loss: 1.1696, test_f1: 0.5108
 epoch: 82, train_loss: 0.9567, test_loss: 1.1688, test_f1: 0.5281
 epoch: 83, train_loss: 0.9594, test_loss: 1.1689, test_f1: 0.5065
 epoch: 84, train_loss: 0.9559, test_loss: 1.1646, test_f1: 0.5044
 epoch: 85, train_loss: 0.9516, test_loss: 1.1645, test_f1: 0.4985
 epoch: 86, train_loss: 0.9443, test_loss: 1.1603, test_f1: 0.5032
 epoch: 87, train_loss: 0.9555, test_loss: 1.1760, test_f1: 0.4861
 epoch: 88, train_loss: 0.9572, test_loss: 1.1866, test_f1: 0.5056
 epoch: 89, train_loss: 0.9453, test_loss: 1.1722, test_f1: 0.4986
 epoch: 90, train_loss: 0.9462, test_loss: 1.1701, test_f1: 0.4940
 epoch: 91, train_loss: 0.9409, test_loss: 1.1680, test_f1: 0.5022
 epoch: 92, train_loss: 0.9478, test_loss: 1.1640, test_f1: 0.5070
 epoch: 93, train_loss: 0.9438, test_loss: 1.1625, test_f1: 0.5101
 epoch: 94, train_loss: 0.9444, test_loss: 1.1772, test_f1: 0.5072
 epoch: 95, train_loss: 0.9409, test_loss: 1.1855, test_f1: 0.5191
 epoch: 96, train_loss: 0.9426, test_loss: 1.1870, test_f1: 0.5129
 epoch: 97, train_loss: 0.9513, test_loss: 1.1831, test_f1: 0.5103
 epoch: 98, train_loss: 0.9331, test_loss: 1.1747, test_f1: 0.5333
 epoch: 99, train_loss: 0.9335, test_loss: 1.1735, test_f1: 0.5075
##################ITERATION #4 ****************************************
 epoch: 0, train_loss: 1.3458, test_loss: 1.3329, test_f1: 0.2281
 epoch: 1, train_loss: 1.2796, test_loss: 1.3244, test_f1: 0.2281
 epoch: 2, train_loss: 1.2558, test_loss: 1.3107, test_f1: 0.2628
 epoch: 3, train_loss: 1.2497, test_loss: 1.2990, test_f1: 0.2573
 epoch: 4, train_loss: 1.2394, test_loss: 1.2909, test_f1: 0.2624
 epoch: 5, train_loss: 1.2339, test_loss: 1.2776, test_f1: 0.2908
 epoch: 6, train_loss: 1.2168, test_loss: 1.2744, test_f1: 0.2860
 epoch: 7, train_loss: 1.2011, test_loss: 1.2680, test_f1: 0.2844
 epoch: 8, train_loss: 1.2127, test_loss: 1.2656, test_f1: 0.3063
 epoch: 9, train_loss: 1.2013, test_loss: 1.2681, test_f1: 0.3138
 epoch: 10, train_loss: 1.1831, test_loss: 1.2630, test_f1: 0.3322
 epoch: 11, train_loss: 1.1872, test_loss: 1.2560, test_f1: 0.3633
 epoch: 12, train_loss: 1.1738, test_loss: 1.2562, test_f1: 0.3673
 epoch: 13, train_loss: 1.1637, test_loss: 1.2501, test_f1: 0.3773
 epoch: 14, train_loss: 1.1602, test_loss: 1.2398, test_f1: 0.3718
 epoch: 15, train_loss: 1.1631, test_loss: 1.2418, test_f1: 0.3879
 epoch: 16, train_loss: 1.1503, test_loss: 1.2349, test_f1: 0.4027
 epoch: 17, train_loss: 1.1442, test_loss: 1.2350, test_f1: 0.3931
 epoch: 18, train_loss: 1.1445, test_loss: 1.2304, test_f1: 0.3897
 epoch: 19, train_loss: 1.1364, test_loss: 1.2187, test_f1: 0.3772
 epoch: 20, train_loss: 1.1285, test_loss: 1.2094, test_f1: 0.3764
 epoch: 21, train_loss: 1.1220, test_loss: 1.2021, test_f1: 0.3829
 epoch: 22, train_loss: 1.1214, test_loss: 1.1932, test_f1: 0.3906
 epoch: 23, train_loss: 1.1027, test_loss: 1.1948, test_f1: 0.4068
 epoch: 24, train_loss: 1.0960, test_loss: 1.1897, test_f1: 0.4004
 epoch: 25, train_loss: 1.0973, test_loss: 1.1837, test_f1: 0.4126
 epoch: 26, train_loss: 1.0976, test_loss: 1.1785, test_f1: 0.4091
 epoch: 27, train_loss: 1.0993, test_loss: 1.1802, test_f1: 0.4156
 epoch: 28, train_loss: 1.1012, test_loss: 1.1888, test_f1: 0.4265
 epoch: 29, train_loss: 1.0916, test_loss: 1.1971, test_f1: 0.4070
 epoch: 30, train_loss: 1.0846, test_loss: 1.2054, test_f1: 0.3929
 epoch: 31, train_loss: 1.0845, test_loss: 1.2025, test_f1: 0.3918
 epoch: 32, train_loss: 1.0695, test_loss: 1.1983, test_f1: 0.4063
 epoch: 33, train_loss: 1.0680, test_loss: 1.2007, test_f1: 0.3926
 epoch: 34, train_loss: 1.0734, test_loss: 1.2166, test_f1: 0.3914
 epoch: 35, train_loss: 1.0624, test_loss: 1.2177, test_f1: 0.3951
 epoch: 36, train_loss: 1.0528, test_loss: 1.2035, test_f1: 0.3907
 epoch: 37, train_loss: 1.0552, test_loss: 1.1988, test_f1: 0.3847
 epoch: 38, train_loss: 1.0555, test_loss: 1.1966, test_f1: 0.4128
 epoch: 39, train_loss: 1.0509, test_loss: 1.1998, test_f1: 0.4215
 epoch: 40, train_loss: 1.0439, test_loss: 1.2097, test_f1: 0.4258
 epoch: 41, train_loss: 1.0329, test_loss: 1.2093, test_f1: 0.4322
 epoch: 42, train_loss: 1.0392, test_loss: 1.2251, test_f1: 0.4140
 epoch: 43, train_loss: 1.0319, test_loss: 1.2411, test_f1: 0.4122
 epoch: 44, train_loss: 1.0299, test_loss: 1.2264, test_f1: 0.4106
 epoch: 45, train_loss: 1.0342, test_loss: 1.2372, test_f1: 0.4129
 epoch: 46, train_loss: 1.0244, test_loss: 1.2239, test_f1: 0.4257
 epoch: 47, train_loss: 1.0293, test_loss: 1.2448, test_f1: 0.3878
 epoch: 48, train_loss: 1.0187, test_loss: 1.2587, test_f1: 0.4040
 epoch: 49, train_loss: 1.0248, test_loss: 1.2490, test_f1: 0.4383
 epoch: 50, train_loss: 1.0125, test_loss: 1.2322, test_f1: 0.4497
 epoch: 51, train_loss: 1.0023, test_loss: 1.2378, test_f1: 0.4487
 epoch: 52, train_loss: 1.0070, test_loss: 1.2483, test_f1: 0.4505
 epoch: 53, train_loss: 0.9997, test_loss: 1.2480, test_f1: 0.4412
 epoch: 54, train_loss: 1.0107, test_loss: 1.2551, test_f1: 0.4353
 epoch: 55, train_loss: 1.0067, test_loss: 1.2618, test_f1: 0.4371
 epoch: 56, train_loss: 0.9942, test_loss: 1.2779, test_f1: 0.4408
 epoch: 57, train_loss: 1.0241, test_loss: 1.2764, test_f1: 0.4389
 epoch: 58, train_loss: 1.0029, test_loss: 1.2741, test_f1: 0.4268
 epoch: 59, train_loss: 0.9904, test_loss: 1.2792, test_f1: 0.4181
 epoch: 60, train_loss: 0.9967, test_loss: 1.2856, test_f1: 0.4195
 epoch: 61, train_loss: 0.9922, test_loss: 1.2938, test_f1: 0.4443
 epoch: 62, train_loss: 1.0074, test_loss: 1.3001, test_f1: 0.4205
 epoch: 63, train_loss: 0.9939, test_loss: 1.2815, test_f1: 0.4331
 epoch: 64, train_loss: 0.9862, test_loss: 1.2942, test_f1: 0.4397
 epoch: 65, train_loss: 0.9809, test_loss: 1.3172, test_f1: 0.4096
 epoch: 66, train_loss: 0.9931, test_loss: 1.3122, test_f1: 0.4012
 epoch: 67, train_loss: 0.9904, test_loss: 1.2998, test_f1: 0.4064
 epoch: 68, train_loss: 0.9901, test_loss: 1.3242, test_f1: 0.4048
 epoch: 69, train_loss: 0.9890, test_loss: 1.3539, test_f1: 0.4193
 epoch: 70, train_loss: 0.9814, test_loss: 1.3296, test_f1: 0.4357
 epoch: 71, train_loss: 0.9784, test_loss: 1.3194, test_f1: 0.4253
 epoch: 72, train_loss: 0.9696, test_loss: 1.3108, test_f1: 0.4119
 epoch: 73, train_loss: 0.9842, test_loss: 1.3249, test_f1: 0.4087
 epoch: 74, train_loss: 0.9772, test_loss: 1.3363, test_f1: 0.4121
 epoch: 75, train_loss: 0.9801, test_loss: 1.3219, test_f1: 0.4198
 epoch: 76, train_loss: 0.9899, test_loss: 1.3378, test_f1: 0.4253
 epoch: 77, train_loss: 0.9765, test_loss: 1.3493, test_f1: 0.4455
 epoch: 78, train_loss: 0.9743, test_loss: 1.3540, test_f1: 0.4200
 epoch: 79, train_loss: 0.9776, test_loss: 1.3465, test_f1: 0.4148
 epoch: 80, train_loss: 0.9784, test_loss: 1.3357, test_f1: 0.4225
 epoch: 81, train_loss: 0.9719, test_loss: 1.3347, test_f1: 0.4253
 epoch: 82, train_loss: 0.9675, test_loss: 1.3407, test_f1: 0.4276
 epoch: 83, train_loss: 0.9648, test_loss: 1.3567, test_f1: 0.4150
 epoch: 84, train_loss: 0.9676, test_loss: 1.3771, test_f1: 0.4299
 epoch: 85, train_loss: 0.9708, test_loss: 1.3944, test_f1: 0.4366
 epoch: 86, train_loss: 0.9853, test_loss: 1.4100, test_f1: 0.4473
 epoch: 87, train_loss: 0.9743, test_loss: 1.3858, test_f1: 0.4470
 epoch: 88, train_loss: 0.9704, test_loss: 1.3684, test_f1: 0.4430
 epoch: 89, train_loss: 0.9805, test_loss: 1.3813, test_f1: 0.4390
 epoch: 90, train_loss: 0.9677, test_loss: 1.3941, test_f1: 0.4385
 epoch: 91, train_loss: 0.9633, test_loss: 1.3801, test_f1: 0.4447
 epoch: 92, train_loss: 0.9522, test_loss: 1.3968, test_f1: 0.4358
 epoch: 93, train_loss: 0.9740, test_loss: 1.4209, test_f1: 0.4310
 epoch: 94, train_loss: 0.9452, test_loss: 1.4040, test_f1: 0.4349
 epoch: 95, train_loss: 0.9606, test_loss: 1.4096, test_f1: 0.4391
 epoch: 96, train_loss: 0.9598, test_loss: 1.4196, test_f1: 0.4360
 epoch: 97, train_loss: 0.9454, test_loss: 1.4411, test_f1: 0.4236
 epoch: 98, train_loss: 0.9479, test_loss: 1.4590, test_f1: 0.4172
 epoch: 99, train_loss: 0.9519, test_loss: 1.4485, test_f1: 0.4322
##################ITERATION #5 ****************************************
 epoch: 0, train_loss: 1.3511, test_loss: 1.3045, test_f1: 0.2281
 epoch: 1, train_loss: 1.2624, test_loss: 1.3001, test_f1: 0.2281
 epoch: 2, train_loss: 1.2481, test_loss: 1.2952, test_f1: 0.2281
 epoch: 3, train_loss: 1.2266, test_loss: 1.2903, test_f1: 0.2281
 epoch: 4, train_loss: 1.2210, test_loss: 1.2734, test_f1: 0.2281
 epoch: 5, train_loss: 1.2153, test_loss: 1.2543, test_f1: 0.2281
 epoch: 6, train_loss: 1.1977, test_loss: 1.2424, test_f1: 0.2496
 epoch: 7, train_loss: 1.1955, test_loss: 1.2333, test_f1: 0.2496
 epoch: 8, train_loss: 1.1870, test_loss: 1.2250, test_f1: 0.2641
 epoch: 9, train_loss: 1.1800, test_loss: 1.2180, test_f1: 0.2817
 epoch: 10, train_loss: 1.1689, test_loss: 1.2139, test_f1: 0.3592
 epoch: 11, train_loss: 1.1729, test_loss: 1.2120, test_f1: 0.3989
 epoch: 12, train_loss: 1.1509, test_loss: 1.2117, test_f1: 0.3937
 epoch: 13, train_loss: 1.1516, test_loss: 1.2196, test_f1: 0.3927
 epoch: 14, train_loss: 1.1416, test_loss: 1.2193, test_f1: 0.3892
 epoch: 15, train_loss: 1.1362, test_loss: 1.2134, test_f1: 0.4008
 epoch: 16, train_loss: 1.1349, test_loss: 1.2081, test_f1: 0.4214
 epoch: 17, train_loss: 1.1374, test_loss: 1.2011, test_f1: 0.4330
 epoch: 18, train_loss: 1.1260, test_loss: 1.1988, test_f1: 0.4166
 epoch: 19, train_loss: 1.1208, test_loss: 1.1910, test_f1: 0.4024
 epoch: 20, train_loss: 1.1111, test_loss: 1.1896, test_f1: 0.3961
 epoch: 21, train_loss: 1.1105, test_loss: 1.1898, test_f1: 0.4027
 epoch: 22, train_loss: 1.0925, test_loss: 1.1867, test_f1: 0.4080
 epoch: 23, train_loss: 1.0956, test_loss: 1.1910, test_f1: 0.4320
 epoch: 24, train_loss: 1.0782, test_loss: 1.1892, test_f1: 0.4543
 epoch: 25, train_loss: 1.0718, test_loss: 1.1750, test_f1: 0.4731
 epoch: 26, train_loss: 1.0781, test_loss: 1.1745, test_f1: 0.4243
 epoch: 27, train_loss: 1.0790, test_loss: 1.1705, test_f1: 0.4366
 epoch: 28, train_loss: 1.0638, test_loss: 1.1748, test_f1: 0.4467
 epoch: 29, train_loss: 1.0638, test_loss: 1.1768, test_f1: 0.4326
 epoch: 30, train_loss: 1.0626, test_loss: 1.1755, test_f1: 0.4204
 epoch: 31, train_loss: 1.0480, test_loss: 1.1810, test_f1: 0.4263
 epoch: 32, train_loss: 1.0486, test_loss: 1.1734, test_f1: 0.4231
 epoch: 33, train_loss: 1.0349, test_loss: 1.1787, test_f1: 0.4186
 epoch: 34, train_loss: 1.0376, test_loss: 1.1813, test_f1: 0.4299
 epoch: 35, train_loss: 1.0288, test_loss: 1.1724, test_f1: 0.3956
 epoch: 36, train_loss: 1.0306, test_loss: 1.1721, test_f1: 0.3995
 epoch: 37, train_loss: 1.0276, test_loss: 1.1767, test_f1: 0.4489
 epoch: 38, train_loss: 1.0281, test_loss: 1.1766, test_f1: 0.4653
 epoch: 39, train_loss: 1.0155, test_loss: 1.1782, test_f1: 0.4459
 epoch: 40, train_loss: 1.0081, test_loss: 1.1788, test_f1: 0.4388
 epoch: 41, train_loss: 1.0219, test_loss: 1.1777, test_f1: 0.4309
 epoch: 42, train_loss: 1.0043, test_loss: 1.1654, test_f1: 0.4563
 epoch: 43, train_loss: 1.0023, test_loss: 1.1621, test_f1: 0.4532
 epoch: 44, train_loss: 1.0093, test_loss: 1.1709, test_f1: 0.4839
 epoch: 45, train_loss: 1.0044, test_loss: 1.1811, test_f1: 0.4661
 epoch: 46, train_loss: 0.9929, test_loss: 1.1773, test_f1: 0.4751
 epoch: 47, train_loss: 0.9920, test_loss: 1.1696, test_f1: 0.4603
 epoch: 48, train_loss: 0.9898, test_loss: 1.1686, test_f1: 0.4882
 epoch: 49, train_loss: 0.9857, test_loss: 1.1653, test_f1: 0.4954
 epoch: 50, train_loss: 0.9889, test_loss: 1.1780, test_f1: 0.4926
 epoch: 51, train_loss: 0.9754, test_loss: 1.1871, test_f1: 0.4854
 epoch: 52, train_loss: 0.9874, test_loss: 1.1794, test_f1: 0.4828
 epoch: 53, train_loss: 0.9786, test_loss: 1.1837, test_f1: 0.4829
 epoch: 54, train_loss: 0.9776, test_loss: 1.1807, test_f1: 0.4902
 epoch: 55, train_loss: 0.9608, test_loss: 1.1805, test_f1: 0.4876
 epoch: 56, train_loss: 0.9759, test_loss: 1.1901, test_f1: 0.4828
 epoch: 57, train_loss: 0.9691, test_loss: 1.1902, test_f1: 0.4757
 epoch: 58, train_loss: 0.9745, test_loss: 1.1849, test_f1: 0.4932
 epoch: 59, train_loss: 0.9677, test_loss: 1.1913, test_f1: 0.4931
 epoch: 60, train_loss: 0.9546, test_loss: 1.1888, test_f1: 0.5056
 epoch: 61, train_loss: 0.9602, test_loss: 1.2015, test_f1: 0.4848
 epoch: 62, train_loss: 0.9606, test_loss: 1.1915, test_f1: 0.4956
 epoch: 63, train_loss: 0.9620, test_loss: 1.1910, test_f1: 0.5075
 epoch: 64, train_loss: 0.9519, test_loss: 1.1864, test_f1: 0.5130
 epoch: 65, train_loss: 0.9516, test_loss: 1.1804, test_f1: 0.5027
 epoch: 66, train_loss: 0.9565, test_loss: 1.1820, test_f1: 0.5102
 epoch: 67, train_loss: 0.9537, test_loss: 1.1704, test_f1: 0.4917
 epoch: 68, train_loss: 0.9540, test_loss: 1.1664, test_f1: 0.5054
 epoch: 69, train_loss: 0.9436, test_loss: 1.1734, test_f1: 0.5209
 epoch: 70, train_loss: 0.9520, test_loss: 1.1766, test_f1: 0.5306
 epoch: 71, train_loss: 0.9372, test_loss: 1.1851, test_f1: 0.5197
 epoch: 72, train_loss: 0.9477, test_loss: 1.2132, test_f1: 0.5205
 epoch: 73, train_loss: 0.9318, test_loss: 1.2081, test_f1: 0.5207
 epoch: 74, train_loss: 0.9251, test_loss: 1.2081, test_f1: 0.5343
 epoch: 75, train_loss: 0.9320, test_loss: 1.2104, test_f1: 0.5290
 epoch: 76, train_loss: 0.9223, test_loss: 1.2100, test_f1: 0.5427
 epoch: 77, train_loss: 0.9282, test_loss: 1.2043, test_f1: 0.5321
 epoch: 78, train_loss: 0.9212, test_loss: 1.2102, test_f1: 0.5244
 epoch: 79, train_loss: 0.9300, test_loss: 1.1999, test_f1: 0.5266
 epoch: 80, train_loss: 0.9220, test_loss: 1.2010, test_f1: 0.5291
 epoch: 81, train_loss: 0.9366, test_loss: 1.2008, test_f1: 0.5342
 epoch: 82, train_loss: 0.9222, test_loss: 1.1943, test_f1: 0.5244
 epoch: 83, train_loss: 0.9194, test_loss: 1.2014, test_f1: 0.5143
 epoch: 84, train_loss: 0.9181, test_loss: 1.2016, test_f1: 0.5365
 epoch: 85, train_loss: 0.9221, test_loss: 1.2033, test_f1: 0.5523
 epoch: 86, train_loss: 0.9059, test_loss: 1.2072, test_f1: 0.5533
 epoch: 87, train_loss: 0.9113, test_loss: 1.2126, test_f1: 0.5229
 epoch: 88, train_loss: 0.9261, test_loss: 1.2142, test_f1: 0.5183
 epoch: 89, train_loss: 0.9128, test_loss: 1.2196, test_f1: 0.5255
 epoch: 90, train_loss: 0.9100, test_loss: 1.2330, test_f1: 0.5250
 epoch: 91, train_loss: 0.9159, test_loss: 1.2196, test_f1: 0.5362
 epoch: 92, train_loss: 0.9135, test_loss: 1.2296, test_f1: 0.5279
 epoch: 93, train_loss: 0.9078, test_loss: 1.2175, test_f1: 0.5433
 epoch: 94, train_loss: 0.9043, test_loss: 1.2110, test_f1: 0.5294
 epoch: 95, train_loss: 0.8997, test_loss: 1.2075, test_f1: 0.5176
 epoch: 96, train_loss: 0.9077, test_loss: 1.2031, test_f1: 0.5224
 epoch: 97, train_loss: 0.8989, test_loss: 1.1961, test_f1: 0.5319
 epoch: 98, train_loss: 0.9032, test_loss: 1.2060, test_f1: 0.5362
 epoch: 99, train_loss: 0.9132, test_loss: 1.2090, test_f1: 0.5337
##################ITERATION #6 ****************************************
 epoch: 0, train_loss: 1.3070, test_loss: 1.3250, test_f1: 0.2281
 epoch: 1, train_loss: 1.2515, test_loss: 1.3209, test_f1: 0.2281
 epoch: 2, train_loss: 1.2371, test_loss: 1.3000, test_f1: 0.2289
 epoch: 3, train_loss: 1.2234, test_loss: 1.2815, test_f1: 0.2278
 epoch: 4, train_loss: 1.2076, test_loss: 1.2766, test_f1: 0.2703
 epoch: 5, train_loss: 1.1812, test_loss: 1.2624, test_f1: 0.3146
 epoch: 6, train_loss: 1.1799, test_loss: 1.2473, test_f1: 0.3559
 epoch: 7, train_loss: 1.1616, test_loss: 1.2270, test_f1: 0.3500
 epoch: 8, train_loss: 1.1599, test_loss: 1.2261, test_f1: 0.3501
 epoch: 9, train_loss: 1.1383, test_loss: 1.2131, test_f1: 0.3504
 epoch: 10, train_loss: 1.1339, test_loss: 1.2086, test_f1: 0.3589
 epoch: 11, train_loss: 1.1305, test_loss: 1.2086, test_f1: 0.3538
 epoch: 12, train_loss: 1.1391, test_loss: 1.2086, test_f1: 0.3460
 epoch: 13, train_loss: 1.1205, test_loss: 1.2316, test_f1: 0.3404
 epoch: 14, train_loss: 1.1205, test_loss: 1.2299, test_f1: 0.3421
 epoch: 15, train_loss: 1.1173, test_loss: 1.2217, test_f1: 0.3474
 epoch: 16, train_loss: 1.1154, test_loss: 1.2458, test_f1: 0.3651
 epoch: 17, train_loss: 1.1026, test_loss: 1.2385, test_f1: 0.3742
 epoch: 18, train_loss: 1.0984, test_loss: 1.2414, test_f1: 0.3710
 epoch: 19, train_loss: 1.0970, test_loss: 1.2220, test_f1: 0.3728
 epoch: 20, train_loss: 1.0878, test_loss: 1.2101, test_f1: 0.3703
 epoch: 21, train_loss: 1.0885, test_loss: 1.2086, test_f1: 0.3707
 epoch: 22, train_loss: 1.0942, test_loss: 1.2259, test_f1: 0.3483
 epoch: 23, train_loss: 1.0714, test_loss: 1.2150, test_f1: 0.3538
 epoch: 24, train_loss: 1.0751, test_loss: 1.2170, test_f1: 0.3490
 epoch: 25, train_loss: 1.0574, test_loss: 1.2094, test_f1: 0.3921
 epoch: 26, train_loss: 1.0670, test_loss: 1.1979, test_f1: 0.3877
 epoch: 27, train_loss: 1.0554, test_loss: 1.1949, test_f1: 0.3776
 epoch: 28, train_loss: 1.0553, test_loss: 1.1899, test_f1: 0.3777
 epoch: 29, train_loss: 1.0555, test_loss: 1.1826, test_f1: 0.3805
 epoch: 30, train_loss: 1.0528, test_loss: 1.1829, test_f1: 0.3913
 epoch: 31, train_loss: 1.0511, test_loss: 1.1826, test_f1: 0.3779
 epoch: 32, train_loss: 1.0432, test_loss: 1.1800, test_f1: 0.3910
 epoch: 33, train_loss: 1.0274, test_loss: 1.1679, test_f1: 0.3794
 epoch: 34, train_loss: 1.0285, test_loss: 1.1651, test_f1: 0.4009
 epoch: 35, train_loss: 1.0232, test_loss: 1.1575, test_f1: 0.4076
 epoch: 36, train_loss: 1.0183, test_loss: 1.1647, test_f1: 0.3996
 epoch: 37, train_loss: 1.0253, test_loss: 1.1723, test_f1: 0.4248
 epoch: 38, train_loss: 1.0104, test_loss: 1.1778, test_f1: 0.4086
 epoch: 39, train_loss: 1.0081, test_loss: 1.1429, test_f1: 0.3899
 epoch: 40, train_loss: 1.0148, test_loss: 1.1476, test_f1: 0.4090
 epoch: 41, train_loss: 1.0080, test_loss: 1.1422, test_f1: 0.4314
 epoch: 42, train_loss: 1.0092, test_loss: 1.1465, test_f1: 0.4437
 epoch: 43, train_loss: 0.9873, test_loss: 1.1509, test_f1: 0.4336
 epoch: 44, train_loss: 0.9953, test_loss: 1.1457, test_f1: 0.4469
 epoch: 45, train_loss: 0.9913, test_loss: 1.1391, test_f1: 0.4426
 epoch: 46, train_loss: 0.9777, test_loss: 1.1385, test_f1: 0.4794
 epoch: 47, train_loss: 0.9964, test_loss: 1.1361, test_f1: 0.4991
 epoch: 48, train_loss: 0.9844, test_loss: 1.1230, test_f1: 0.4807
 epoch: 49, train_loss: 0.9859, test_loss: 1.1034, test_f1: 0.4893
 epoch: 50, train_loss: 0.9818, test_loss: 1.1186, test_f1: 0.4626
 epoch: 51, train_loss: 0.9664, test_loss: 1.1266, test_f1: 0.4693
 epoch: 52, train_loss: 0.9675, test_loss: 1.1244, test_f1: 0.4631
 epoch: 53, train_loss: 0.9588, test_loss: 1.1181, test_f1: 0.4981
 epoch: 54, train_loss: 0.9728, test_loss: 1.1108, test_f1: 0.4857
 epoch: 55, train_loss: 0.9555, test_loss: 1.0998, test_f1: 0.4858
 epoch: 56, train_loss: 0.9548, test_loss: 1.1095, test_f1: 0.5147
 epoch: 57, train_loss: 0.9502, test_loss: 1.1066, test_f1: 0.5138
 epoch: 58, train_loss: 0.9552, test_loss: 1.1179, test_f1: 0.5020
 epoch: 59, train_loss: 0.9600, test_loss: 1.1120, test_f1: 0.5277
 epoch: 60, train_loss: 0.9618, test_loss: 1.1690, test_f1: 0.4742
 epoch: 61, train_loss: 0.9849, test_loss: 1.1706, test_f1: 0.4870
 epoch: 62, train_loss: 0.9856, test_loss: 1.1459, test_f1: 0.4977
 epoch: 63, train_loss: 0.9675, test_loss: 1.1218, test_f1: 0.5139
 epoch: 64, train_loss: 0.9567, test_loss: 1.1025, test_f1: 0.4986
 epoch: 65, train_loss: 0.9592, test_loss: 1.1092, test_f1: 0.5063
 epoch: 66, train_loss: 0.9516, test_loss: 1.0942, test_f1: 0.5068
 epoch: 67, train_loss: 0.9617, test_loss: 1.0994, test_f1: 0.4988
 epoch: 68, train_loss: 0.9547, test_loss: 1.1153, test_f1: 0.5035
 epoch: 69, train_loss: 0.9562, test_loss: 1.1202, test_f1: 0.5236
 epoch: 70, train_loss: 0.9487, test_loss: 1.1264, test_f1: 0.5076
 epoch: 71, train_loss: 0.9433, test_loss: 1.1212, test_f1: 0.4872
 epoch: 72, train_loss: 0.9476, test_loss: 1.1345, test_f1: 0.5050
 epoch: 73, train_loss: 0.9515, test_loss: 1.1201, test_f1: 0.5374
 epoch: 74, train_loss: 0.9454, test_loss: 1.1327, test_f1: 0.5322
 epoch: 75, train_loss: 0.9359, test_loss: 1.1311, test_f1: 0.5442
 epoch: 76, train_loss: 0.9462, test_loss: 1.0991, test_f1: 0.5422
 epoch: 77, train_loss: 0.9294, test_loss: 1.1135, test_f1: 0.5067
 epoch: 78, train_loss: 0.9306, test_loss: 1.1133, test_f1: 0.4818
 epoch: 79, train_loss: 0.9238, test_loss: 1.1248, test_f1: 0.4962
 epoch: 80, train_loss: 0.9308, test_loss: 1.0796, test_f1: 0.4899
 epoch: 81, train_loss: 0.9352, test_loss: 1.0772, test_f1: 0.5195
 epoch: 82, train_loss: 0.9243, test_loss: 1.1257, test_f1: 0.5013
 epoch: 83, train_loss: 0.9305, test_loss: 1.1013, test_f1: 0.5237
 epoch: 84, train_loss: 0.9272, test_loss: 1.1065, test_f1: 0.5309
 epoch: 85, train_loss: 0.9211, test_loss: 1.1198, test_f1: 0.5349
 epoch: 86, train_loss: 0.9146, test_loss: 1.0968, test_f1: 0.5263
 epoch: 87, train_loss: 0.9287, test_loss: 1.1117, test_f1: 0.5158
 epoch: 88, train_loss: 0.9260, test_loss: 1.0960, test_f1: 0.4890
 epoch: 89, train_loss: 0.9178, test_loss: 1.0939, test_f1: 0.4938
 epoch: 90, train_loss: 0.9320, test_loss: 1.0908, test_f1: 0.5143
 epoch: 91, train_loss: 0.9239, test_loss: 1.1088, test_f1: 0.4864
 epoch: 92, train_loss: 0.9228, test_loss: 1.1333, test_f1: 0.5328
 epoch: 93, train_loss: 0.9264, test_loss: 1.1875, test_f1: 0.5461
 epoch: 94, train_loss: 0.9363, test_loss: 1.1718, test_f1: 0.5544
 epoch: 95, train_loss: 0.9238, test_loss: 1.1266, test_f1: 0.5451
 epoch: 96, train_loss: 0.9299, test_loss: 1.0911, test_f1: 0.5402
 epoch: 97, train_loss: 0.9039, test_loss: 1.0882, test_f1: 0.4955
 epoch: 98, train_loss: 0.9037, test_loss: 1.0975, test_f1: 0.4973
 epoch: 99, train_loss: 0.9097, test_loss: 1.0889, test_f1: 0.5248
##################ITERATION #7 ****************************************
 epoch: 0, train_loss: 1.3102, test_loss: 1.4266, test_f1: 0.2148
 epoch: 1, train_loss: 1.2294, test_loss: 1.3560, test_f1: 0.2264
 epoch: 2, train_loss: 1.2277, test_loss: 1.3195, test_f1: 0.2723
 epoch: 3, train_loss: 1.1989, test_loss: 1.2959, test_f1: 0.3036
 epoch: 4, train_loss: 1.2037, test_loss: 1.2905, test_f1: 0.3279
 epoch: 5, train_loss: 1.1892, test_loss: 1.2900, test_f1: 0.3438
 epoch: 6, train_loss: 1.1874, test_loss: 1.2991, test_f1: 0.3357
 epoch: 7, train_loss: 1.1773, test_loss: 1.3026, test_f1: 0.3230
 epoch: 8, train_loss: 1.1680, test_loss: 1.2979, test_f1: 0.3101
 epoch: 9, train_loss: 1.1573, test_loss: 1.2928, test_f1: 0.3278
 epoch: 10, train_loss: 1.1614, test_loss: 1.2846, test_f1: 0.3368
 epoch: 11, train_loss: 1.1557, test_loss: 1.2737, test_f1: 0.3622
 epoch: 12, train_loss: 1.1419, test_loss: 1.2752, test_f1: 0.3508
 epoch: 13, train_loss: 1.1395, test_loss: 1.2832, test_f1: 0.3421
 epoch: 14, train_loss: 1.1362, test_loss: 1.2961, test_f1: 0.3420
 epoch: 15, train_loss: 1.1325, test_loss: 1.2890, test_f1: 0.3449
 epoch: 16, train_loss: 1.1201, test_loss: 1.2844, test_f1: 0.3571
 epoch: 17, train_loss: 1.1135, test_loss: 1.2950, test_f1: 0.3587
 epoch: 18, train_loss: 1.1185, test_loss: 1.3143, test_f1: 0.3590
 epoch: 19, train_loss: 1.1256, test_loss: 1.3311, test_f1: 0.3664
 epoch: 20, train_loss: 1.1090, test_loss: 1.3225, test_f1: 0.3577
 epoch: 21, train_loss: 1.1012, test_loss: 1.3298, test_f1: 0.3450
 epoch: 22, train_loss: 1.0974, test_loss: 1.3459, test_f1: 0.3461
 epoch: 23, train_loss: 1.0953, test_loss: 1.3738, test_f1: 0.4082
 epoch: 24, train_loss: 1.0859, test_loss: 1.3405, test_f1: 0.3550
 epoch: 25, train_loss: 1.0923, test_loss: 1.3387, test_f1: 0.3538
 epoch: 26, train_loss: 1.0816, test_loss: 1.3513, test_f1: 0.3559
 epoch: 27, train_loss: 1.0774, test_loss: 1.3689, test_f1: 0.3638
 epoch: 28, train_loss: 1.0750, test_loss: 1.3627, test_f1: 0.3658
 epoch: 29, train_loss: 1.0638, test_loss: 1.3533, test_f1: 0.3723
 epoch: 30, train_loss: 1.0668, test_loss: 1.3632, test_f1: 0.3793
 epoch: 31, train_loss: 1.0672, test_loss: 1.3570, test_f1: 0.3721
 epoch: 32, train_loss: 1.0641, test_loss: 1.4074, test_f1: 0.3882
 epoch: 33, train_loss: 1.0540, test_loss: 1.3932, test_f1: 0.3942
 epoch: 34, train_loss: 1.0535, test_loss: 1.3807, test_f1: 0.3927
 epoch: 35, train_loss: 1.0615, test_loss: 1.3955, test_f1: 0.4054
 epoch: 36, train_loss: 1.0431, test_loss: 1.3986, test_f1: 0.4151
 epoch: 37, train_loss: 1.0461, test_loss: 1.4190, test_f1: 0.4093
 epoch: 38, train_loss: 1.0448, test_loss: 1.4292, test_f1: 0.4014
 epoch: 39, train_loss: 1.0384, test_loss: 1.4119, test_f1: 0.4311
 epoch: 40, train_loss: 1.0297, test_loss: 1.3978, test_f1: 0.4424
 epoch: 41, train_loss: 1.0319, test_loss: 1.3970, test_f1: 0.4396
 epoch: 42, train_loss: 1.0396, test_loss: 1.4008, test_f1: 0.4342
 epoch: 43, train_loss: 1.0382, test_loss: 1.4012, test_f1: 0.4477
 epoch: 44, train_loss: 1.0230, test_loss: 1.4333, test_f1: 0.4075
 epoch: 45, train_loss: 1.0215, test_loss: 1.4641, test_f1: 0.4420
 epoch: 46, train_loss: 1.0287, test_loss: 1.3989, test_f1: 0.4328
 epoch: 47, train_loss: 1.0103, test_loss: 1.3081, test_f1: 0.4271
 epoch: 48, train_loss: 1.0312, test_loss: 1.3278, test_f1: 0.4242
 epoch: 49, train_loss: 1.0095, test_loss: 1.2787, test_f1: 0.4535
 epoch: 50, train_loss: 1.0167, test_loss: 1.3295, test_f1: 0.4196
 epoch: 51, train_loss: 1.0095, test_loss: 1.3463, test_f1: 0.4286
 epoch: 52, train_loss: 1.0020, test_loss: 1.3553, test_f1: 0.4096
 epoch: 53, train_loss: 0.9986, test_loss: 1.3714, test_f1: 0.4099
 epoch: 54, train_loss: 0.9920, test_loss: 1.3778, test_f1: 0.4184
 epoch: 55, train_loss: 0.9931, test_loss: 1.3678, test_f1: 0.4528
 epoch: 56, train_loss: 1.0043, test_loss: 1.3884, test_f1: 0.4486
 epoch: 57, train_loss: 0.9814, test_loss: 1.3872, test_f1: 0.4721
 epoch: 58, train_loss: 0.9849, test_loss: 1.3912, test_f1: 0.4531
 epoch: 59, train_loss: 0.9808, test_loss: 1.3905, test_f1: 0.4473
 epoch: 60, train_loss: 0.9848, test_loss: 1.3700, test_f1: 0.4376
 epoch: 61, train_loss: 0.9727, test_loss: 1.3573, test_f1: 0.4575
 epoch: 62, train_loss: 0.9782, test_loss: 1.3606, test_f1: 0.4639
 epoch: 63, train_loss: 0.9675, test_loss: 1.3701, test_f1: 0.4632
 epoch: 64, train_loss: 0.9801, test_loss: 1.3720, test_f1: 0.4662
 epoch: 65, train_loss: 0.9823, test_loss: 1.3737, test_f1: 0.4718
 epoch: 66, train_loss: 0.9775, test_loss: 1.3638, test_f1: 0.4539
 epoch: 67, train_loss: 0.9825, test_loss: 1.3691, test_f1: 0.4588
 epoch: 68, train_loss: 0.9659, test_loss: 1.3925, test_f1: 0.4385
 epoch: 69, train_loss: 0.9774, test_loss: 1.3960, test_f1: 0.4480
 epoch: 70, train_loss: 0.9619, test_loss: 1.3876, test_f1: 0.4649
 epoch: 71, train_loss: 0.9718, test_loss: 1.3738, test_f1: 0.4539
 epoch: 72, train_loss: 0.9629, test_loss: 1.3847, test_f1: 0.4418
 epoch: 73, train_loss: 0.9553, test_loss: 1.3846, test_f1: 0.4384
 epoch: 74, train_loss: 0.9703, test_loss: 1.3840, test_f1: 0.4607
 epoch: 75, train_loss: 0.9620, test_loss: 1.4051, test_f1: 0.4551
 epoch: 76, train_loss: 0.9595, test_loss: 1.4383, test_f1: 0.4452
 epoch: 77, train_loss: 0.9584, test_loss: 1.4395, test_f1: 0.4644
 epoch: 78, train_loss: 0.9621, test_loss: 1.4398, test_f1: 0.4450
 epoch: 79, train_loss: 0.9678, test_loss: 1.4094, test_f1: 0.4656
 epoch: 80, train_loss: 0.9608, test_loss: 1.4097, test_f1: 0.4658
 epoch: 81, train_loss: 0.9454, test_loss: 1.4145, test_f1: 0.4593
 epoch: 82, train_loss: 0.9455, test_loss: 1.4116, test_f1: 0.4678
 epoch: 83, train_loss: 0.9522, test_loss: 1.4172, test_f1: 0.4572
 epoch: 84, train_loss: 0.9560, test_loss: 1.4097, test_f1: 0.4668
 epoch: 85, train_loss: 0.9511, test_loss: 1.4032, test_f1: 0.4787
 epoch: 86, train_loss: 0.9495, test_loss: 1.3929, test_f1: 0.4920
 epoch: 87, train_loss: 0.9411, test_loss: 1.4003, test_f1: 0.4919
 epoch: 88, train_loss: 0.9515, test_loss: 1.4150, test_f1: 0.4621
 epoch: 89, train_loss: 0.9431, test_loss: 1.4435, test_f1: 0.4528
 epoch: 90, train_loss: 0.9388, test_loss: 1.4620, test_f1: 0.4470
 epoch: 91, train_loss: 0.9422, test_loss: 1.4299, test_f1: 0.4631
 epoch: 92, train_loss: 0.9362, test_loss: 1.4133, test_f1: 0.4771
 epoch: 93, train_loss: 0.9428, test_loss: 1.4183, test_f1: 0.4714
 epoch: 94, train_loss: 0.9301, test_loss: 1.4056, test_f1: 0.4734
 epoch: 95, train_loss: 0.9366, test_loss: 1.3796, test_f1: 0.4639
 epoch: 96, train_loss: 0.9374, test_loss: 1.3763, test_f1: 0.4968
 epoch: 97, train_loss: 0.9342, test_loss: 1.3728, test_f1: 0.4739
 epoch: 98, train_loss: 0.9266, test_loss: 1.3630, test_f1: 0.4922
 epoch: 99, train_loss: 0.9247, test_loss: 1.3650, test_f1: 0.4739
##################ITERATION #8 ****************************************
 epoch: 0, train_loss: 1.3232, test_loss: 1.3559, test_f1: 0.2281
 epoch: 1, train_loss: 1.2846, test_loss: 1.3464, test_f1: 0.2404
 epoch: 2, train_loss: 1.2674, test_loss: 1.3492, test_f1: 0.2404
 epoch: 3, train_loss: 1.2495, test_loss: 1.3615, test_f1: 0.2424
 epoch: 4, train_loss: 1.2362, test_loss: 1.3819, test_f1: 0.2401
 epoch: 5, train_loss: 1.2377, test_loss: 1.3894, test_f1: 0.2404
 epoch: 6, train_loss: 1.2265, test_loss: 1.3779, test_f1: 0.2414
 epoch: 7, train_loss: 1.2177, test_loss: 1.3768, test_f1: 0.2325
 epoch: 8, train_loss: 1.2221, test_loss: 1.3735, test_f1: 0.2430
 epoch: 9, train_loss: 1.2200, test_loss: 1.3582, test_f1: 0.2688
 epoch: 10, train_loss: 1.2056, test_loss: 1.3537, test_f1: 0.2674
 epoch: 11, train_loss: 1.1926, test_loss: 1.3659, test_f1: 0.2672
 epoch: 12, train_loss: 1.1920, test_loss: 1.3681, test_f1: 0.2867
 epoch: 13, train_loss: 1.1795, test_loss: 1.3656, test_f1: 0.2865
 epoch: 14, train_loss: 1.1752, test_loss: 1.3581, test_f1: 0.3015
 epoch: 15, train_loss: 1.1820, test_loss: 1.3600, test_f1: 0.3000
 epoch: 16, train_loss: 1.1692, test_loss: 1.3405, test_f1: 0.3103
 epoch: 17, train_loss: 1.1608, test_loss: 1.3315, test_f1: 0.3137
 epoch: 18, train_loss: 1.1618, test_loss: 1.3275, test_f1: 0.3323
 epoch: 19, train_loss: 1.1384, test_loss: 1.3750, test_f1: 0.3273
 epoch: 20, train_loss: 1.1316, test_loss: 1.3893, test_f1: 0.3290
 epoch: 21, train_loss: 1.1490, test_loss: 1.4286, test_f1: 0.3462
 epoch: 22, train_loss: 1.1430, test_loss: 1.4316, test_f1: 0.3540
 epoch: 23, train_loss: 1.1338, test_loss: 1.4002, test_f1: 0.3492
 epoch: 24, train_loss: 1.1262, test_loss: 1.3524, test_f1: 0.3583
 epoch: 25, train_loss: 1.1053, test_loss: 1.3610, test_f1: 0.3551
 epoch: 26, train_loss: 1.1082, test_loss: 1.3805, test_f1: 0.3634
 epoch: 27, train_loss: 1.0938, test_loss: 1.3662, test_f1: 0.3829
 epoch: 28, train_loss: 1.0918, test_loss: 1.3672, test_f1: 0.3798
 epoch: 29, train_loss: 1.0880, test_loss: 1.3373, test_f1: 0.4020
 epoch: 30, train_loss: 1.0774, test_loss: 1.3157, test_f1: 0.4062
 epoch: 31, train_loss: 1.0684, test_loss: 1.3468, test_f1: 0.4208
 epoch: 32, train_loss: 1.0682, test_loss: 1.3570, test_f1: 0.4139
 epoch: 33, train_loss: 1.0608, test_loss: 1.3110, test_f1: 0.4172
 epoch: 34, train_loss: 1.0738, test_loss: 1.3029, test_f1: 0.4152
 epoch: 35, train_loss: 1.0720, test_loss: 1.3439, test_f1: 0.4191
 epoch: 36, train_loss: 1.0634, test_loss: 1.3485, test_f1: 0.4280
 epoch: 37, train_loss: 1.0509, test_loss: 1.3019, test_f1: 0.4181
 epoch: 38, train_loss: 1.0445, test_loss: 1.2737, test_f1: 0.4194
 epoch: 39, train_loss: 1.0416, test_loss: 1.2591, test_f1: 0.4469
 epoch: 40, train_loss: 1.0382, test_loss: 1.2820, test_f1: 0.4423
 epoch: 41, train_loss: 1.0299, test_loss: 1.3355, test_f1: 0.4286
 epoch: 42, train_loss: 1.0430, test_loss: 1.3165, test_f1: 0.4296
 epoch: 43, train_loss: 1.0328, test_loss: 1.3506, test_f1: 0.4438
 epoch: 44, train_loss: 1.0155, test_loss: 1.3374, test_f1: 0.4718
 epoch: 45, train_loss: 1.0171, test_loss: 1.3959, test_f1: 0.4652
 epoch: 46, train_loss: 1.0160, test_loss: 1.3551, test_f1: 0.4812
 epoch: 47, train_loss: 1.0159, test_loss: 1.3433, test_f1: 0.4738
 epoch: 48, train_loss: 1.0101, test_loss: 1.3274, test_f1: 0.4768
 epoch: 49, train_loss: 1.0100, test_loss: 1.3290, test_f1: 0.4574
 epoch: 50, train_loss: 1.0070, test_loss: 1.3044, test_f1: 0.4619
 epoch: 51, train_loss: 1.0035, test_loss: 1.3348, test_f1: 0.4733
 epoch: 52, train_loss: 0.9900, test_loss: 1.3771, test_f1: 0.4685
 epoch: 53, train_loss: 0.9985, test_loss: 1.3945, test_f1: 0.4594
 epoch: 54, train_loss: 0.9952, test_loss: 1.3643, test_f1: 0.4691
 epoch: 55, train_loss: 1.0072, test_loss: 1.3789, test_f1: 0.4648
 epoch: 56, train_loss: 0.9902, test_loss: 1.3418, test_f1: 0.4773
 epoch: 57, train_loss: 0.9988, test_loss: 1.3341, test_f1: 0.4611
 epoch: 58, train_loss: 0.9882, test_loss: 1.3273, test_f1: 0.4594
 epoch: 59, train_loss: 0.9937, test_loss: 1.4067, test_f1: 0.4695
 epoch: 60, train_loss: 0.9957, test_loss: 1.4216, test_f1: 0.4688
 epoch: 61, train_loss: 0.9873, test_loss: 1.4509, test_f1: 0.4622
 epoch: 62, train_loss: 0.9895, test_loss: 1.3995, test_f1: 0.4687
 epoch: 63, train_loss: 0.9675, test_loss: 1.3917, test_f1: 0.4750
 epoch: 64, train_loss: 0.9767, test_loss: 1.3920, test_f1: 0.4791
 epoch: 65, train_loss: 0.9865, test_loss: 1.4332, test_f1: 0.4833
 epoch: 66, train_loss: 0.9703, test_loss: 1.4879, test_f1: 0.4746
 epoch: 67, train_loss: 0.9855, test_loss: 1.4776, test_f1: 0.4691
 epoch: 68, train_loss: 0.9633, test_loss: 1.4553, test_f1: 0.4769
 epoch: 69, train_loss: 0.9841, test_loss: 1.4694, test_f1: 0.4693
 epoch: 70, train_loss: 0.9731, test_loss: 1.4460, test_f1: 0.4691
 epoch: 71, train_loss: 0.9638, test_loss: 1.4631, test_f1: 0.4656
 epoch: 72, train_loss: 0.9635, test_loss: 1.4326, test_f1: 0.4713
 epoch: 73, train_loss: 0.9552, test_loss: 1.4120, test_f1: 0.4804
 epoch: 74, train_loss: 0.9626, test_loss: 1.4167, test_f1: 0.4770
 epoch: 75, train_loss: 0.9711, test_loss: 1.3856, test_f1: 0.4933
 epoch: 76, train_loss: 0.9512, test_loss: 1.4124, test_f1: 0.4763
 epoch: 77, train_loss: 0.9648, test_loss: 1.4258, test_f1: 0.4806
 epoch: 78, train_loss: 0.9509, test_loss: 1.4298, test_f1: 0.4753
 epoch: 79, train_loss: 0.9620, test_loss: 1.4758, test_f1: 0.4873
 epoch: 80, train_loss: 0.9555, test_loss: 1.4324, test_f1: 0.4882
 epoch: 81, train_loss: 0.9478, test_loss: 1.4359, test_f1: 0.4758
 epoch: 82, train_loss: 0.9552, test_loss: 1.4178, test_f1: 0.4812
 epoch: 83, train_loss: 0.9597, test_loss: 1.4325, test_f1: 0.4825
 epoch: 84, train_loss: 0.9669, test_loss: 1.4256, test_f1: 0.4896
 epoch: 85, train_loss: 0.9496, test_loss: 1.4171, test_f1: 0.5007
 epoch: 86, train_loss: 0.9411, test_loss: 1.4649, test_f1: 0.4946
 epoch: 87, train_loss: 0.9439, test_loss: 1.5299, test_f1: 0.4953
 epoch: 88, train_loss: 0.9481, test_loss: 1.4772, test_f1: 0.5083
 epoch: 89, train_loss: 0.9426, test_loss: 1.4914, test_f1: 0.5088
 epoch: 90, train_loss: 0.9450, test_loss: 1.4591, test_f1: 0.4964
 epoch: 91, train_loss: 0.9500, test_loss: 1.5013, test_f1: 0.5012
 epoch: 92, train_loss: 0.9461, test_loss: 1.4898, test_f1: 0.5009
 epoch: 93, train_loss: 0.9288, test_loss: 1.5181, test_f1: 0.5122
 epoch: 94, train_loss: 0.9417, test_loss: 1.5312, test_f1: 0.5165
 epoch: 95, train_loss: 0.9318, test_loss: 1.5056, test_f1: 0.4984
 epoch: 96, train_loss: 0.9443, test_loss: 1.4913, test_f1: 0.5091
 epoch: 97, train_loss: 0.9398, test_loss: 1.4848, test_f1: 0.5150
 epoch: 98, train_loss: 0.9428, test_loss: 1.5143, test_f1: 0.5208
 epoch: 99, train_loss: 0.9267, test_loss: 1.4967, test_f1: 0.5095
##################ITERATION #9 ****************************************
 epoch: 0, train_loss: 1.4082, test_loss: 1.3905, test_f1: 0.2281
 epoch: 1, train_loss: 1.3194, test_loss: 1.4029, test_f1: 0.3541
 epoch: 2, train_loss: 1.2888, test_loss: 1.3904, test_f1: 0.3169
 epoch: 3, train_loss: 1.2795, test_loss: 1.3751, test_f1: 0.2738
 epoch: 4, train_loss: 1.2776, test_loss: 1.3590, test_f1: 0.2642
 epoch: 5, train_loss: 1.2485, test_loss: 1.3433, test_f1: 0.2867
 epoch: 6, train_loss: 1.2444, test_loss: 1.3288, test_f1: 0.2920
 epoch: 7, train_loss: 1.2296, test_loss: 1.3179, test_f1: 0.3322
 epoch: 8, train_loss: 1.2327, test_loss: 1.3025, test_f1: 0.3034
 epoch: 9, train_loss: 1.2154, test_loss: 1.2938, test_f1: 0.3280
 epoch: 10, train_loss: 1.2172, test_loss: 1.2884, test_f1: 0.3399
 epoch: 11, train_loss: 1.2029, test_loss: 1.2794, test_f1: 0.3341
 epoch: 12, train_loss: 1.2002, test_loss: 1.2795, test_f1: 0.3467
 epoch: 13, train_loss: 1.1744, test_loss: 1.2735, test_f1: 0.3568
 epoch: 14, train_loss: 1.1856, test_loss: 1.2735, test_f1: 0.3605
 epoch: 15, train_loss: 1.1601, test_loss: 1.2710, test_f1: 0.3789
 epoch: 16, train_loss: 1.1464, test_loss: 1.2610, test_f1: 0.3989
 epoch: 17, train_loss: 1.1291, test_loss: 1.2530, test_f1: 0.4215
 epoch: 18, train_loss: 1.1252, test_loss: 1.2414, test_f1: 0.4224
 epoch: 19, train_loss: 1.1007, test_loss: 1.2188, test_f1: 0.4313
 epoch: 20, train_loss: 1.1070, test_loss: 1.2057, test_f1: 0.4344
 epoch: 21, train_loss: 1.1103, test_loss: 1.2127, test_f1: 0.4230
 epoch: 22, train_loss: 1.0896, test_loss: 1.2306, test_f1: 0.4555
 epoch: 23, train_loss: 1.0841, test_loss: 1.2614, test_f1: 0.4448
 epoch: 24, train_loss: 1.0936, test_loss: 1.2526, test_f1: 0.4411
 epoch: 25, train_loss: 1.0853, test_loss: 1.2399, test_f1: 0.4385
 epoch: 26, train_loss: 1.0639, test_loss: 1.2249, test_f1: 0.4244
 epoch: 27, train_loss: 1.0782, test_loss: 1.2447, test_f1: 0.4139
 epoch: 28, train_loss: 1.0662, test_loss: 1.2479, test_f1: 0.4159
 epoch: 29, train_loss: 1.0740, test_loss: 1.2580, test_f1: 0.4306
 epoch: 30, train_loss: 1.0379, test_loss: 1.2824, test_f1: 0.4375
 epoch: 31, train_loss: 1.0572, test_loss: 1.2953, test_f1: 0.4512
 epoch: 32, train_loss: 1.0508, test_loss: 1.2211, test_f1: 0.4413
 epoch: 33, train_loss: 1.0458, test_loss: 1.2442, test_f1: 0.4066
 epoch: 34, train_loss: 1.0479, test_loss: 1.2462, test_f1: 0.4281
 epoch: 35, train_loss: 1.0513, test_loss: 1.2743, test_f1: 0.4704
 epoch: 36, train_loss: 1.0507, test_loss: 1.2545, test_f1: 0.4523
 epoch: 37, train_loss: 1.0299, test_loss: 1.2444, test_f1: 0.4591
 epoch: 38, train_loss: 1.0349, test_loss: 1.2564, test_f1: 0.4783
 epoch: 39, train_loss: 1.0290, test_loss: 1.2593, test_f1: 0.4625
 epoch: 40, train_loss: 1.0371, test_loss: 1.2629, test_f1: 0.4471
 epoch: 41, train_loss: 1.0231, test_loss: 1.2617, test_f1: 0.4399
 epoch: 42, train_loss: 1.0148, test_loss: 1.2692, test_f1: 0.4419
 epoch: 43, train_loss: 1.0296, test_loss: 1.2777, test_f1: 0.4632
 epoch: 44, train_loss: 1.0139, test_loss: 1.2874, test_f1: 0.4690
 epoch: 45, train_loss: 1.0205, test_loss: 1.2897, test_f1: 0.4695
 epoch: 46, train_loss: 1.0068, test_loss: 1.2799, test_f1: 0.4694
 epoch: 47, train_loss: 1.0140, test_loss: 1.2981, test_f1: 0.4481
 epoch: 48, train_loss: 1.0150, test_loss: 1.2495, test_f1: 0.4842
 epoch: 49, train_loss: 1.0040, test_loss: 1.2584, test_f1: 0.4875
 epoch: 50, train_loss: 0.9997, test_loss: 1.2222, test_f1: 0.4850
 epoch: 51, train_loss: 1.0095, test_loss: 1.2448, test_f1: 0.4176
 epoch: 52, train_loss: 1.0102, test_loss: 1.2324, test_f1: 0.4295
 epoch: 53, train_loss: 1.0066, test_loss: 1.2259, test_f1: 0.4655
 epoch: 54, train_loss: 1.0095, test_loss: 1.2320, test_f1: 0.4460
 epoch: 55, train_loss: 0.9985, test_loss: 1.2460, test_f1: 0.4559
 epoch: 56, train_loss: 1.0026, test_loss: 1.2505, test_f1: 0.4474
 epoch: 57, train_loss: 1.0021, test_loss: 1.2484, test_f1: 0.4606
 epoch: 58, train_loss: 0.9981, test_loss: 1.2608, test_f1: 0.4753
 epoch: 59, train_loss: 0.9928, test_loss: 1.2692, test_f1: 0.4805
 epoch: 60, train_loss: 0.9943, test_loss: 1.2752, test_f1: 0.4486
 epoch: 61, train_loss: 1.0040, test_loss: 1.2804, test_f1: 0.4511
 epoch: 62, train_loss: 0.9802, test_loss: 1.2886, test_f1: 0.4813
 epoch: 63, train_loss: 0.9888, test_loss: 1.2927, test_f1: 0.4918
 epoch: 64, train_loss: 0.9943, test_loss: 1.2892, test_f1: 0.4526
 epoch: 65, train_loss: 0.9852, test_loss: 1.2887, test_f1: 0.4486
 epoch: 66, train_loss: 0.9833, test_loss: 1.2997, test_f1: 0.4472
 epoch: 67, train_loss: 0.9875, test_loss: 1.2965, test_f1: 0.4591
 epoch: 68, train_loss: 0.9866, test_loss: 1.3019, test_f1: 0.4641
 epoch: 69, train_loss: 0.9691, test_loss: 1.3207, test_f1: 0.4903
 epoch: 70, train_loss: 0.9823, test_loss: 1.3177, test_f1: 0.4617
 epoch: 71, train_loss: 0.9824, test_loss: 1.3117, test_f1: 0.4445
 epoch: 72, train_loss: 0.9829, test_loss: 1.3020, test_f1: 0.4553
 epoch: 73, train_loss: 0.9962, test_loss: 1.3108, test_f1: 0.4565
 epoch: 74, train_loss: 0.9917, test_loss: 1.3127, test_f1: 0.4394
 epoch: 75, train_loss: 0.9773, test_loss: 1.3195, test_f1: 0.4492
 epoch: 76, train_loss: 0.9783, test_loss: 1.3104, test_f1: 0.4638
 epoch: 77, train_loss: 0.9848, test_loss: 1.3129, test_f1: 0.4659
 epoch: 78, train_loss: 0.9775, test_loss: 1.3121, test_f1: 0.4663
 epoch: 79, train_loss: 0.9799, test_loss: 1.3167, test_f1: 0.4696
 epoch: 80, train_loss: 0.9725, test_loss: 1.3059, test_f1: 0.4832
 epoch: 81, train_loss: 0.9758, test_loss: 1.3061, test_f1: 0.4757
 epoch: 82, train_loss: 0.9748, test_loss: 1.3057, test_f1: 0.4593
 epoch: 83, train_loss: 0.9831, test_loss: 1.3047, test_f1: 0.4591
 epoch: 84, train_loss: 0.9648, test_loss: 1.3209, test_f1: 0.4633
 epoch: 85, train_loss: 0.9793, test_loss: 1.3037, test_f1: 0.4636
 epoch: 86, train_loss: 0.9702, test_loss: 1.3054, test_f1: 0.4757
 epoch: 87, train_loss: 0.9776, test_loss: 1.3175, test_f1: 0.4759
 epoch: 88, train_loss: 0.9841, test_loss: 1.3340, test_f1: 0.4552
 epoch: 89, train_loss: 0.9729, test_loss: 1.3466, test_f1: 0.4720
 epoch: 90, train_loss: 0.9671, test_loss: 1.3510, test_f1: 0.4243
 epoch: 91, train_loss: 0.9643, test_loss: 1.3830, test_f1: 0.4333
 epoch: 92, train_loss: 0.9624, test_loss: 1.3918, test_f1: 0.4493
 epoch: 93, train_loss: 0.9591, test_loss: 1.3566, test_f1: 0.4434
 epoch: 94, train_loss: 0.9635, test_loss: 1.3195, test_f1: 0.4433
 epoch: 95, train_loss: 0.9615, test_loss: 1.3139, test_f1: 0.4292
 epoch: 96, train_loss: 0.9602, test_loss: 1.3275, test_f1: 0.4460
 epoch: 97, train_loss: 0.9524, test_loss: 1.3311, test_f1: 0.4525
 epoch: 98, train_loss: 0.9521, test_loss: 1.3413, test_f1: 0.4512
 epoch: 99, train_loss: 0.9551, test_loss: 1.3502, test_f1: 0.4494

Training completed in 286.19 seconds
Best F1: 0.5544 at epoch 94
Mean F1 across iterations: 0.4985  0.0386
========================FINAL RESULTS================================
FEGIN weighted F1: 0.5544  0.0386
python main.py --data ltspice_demos --representation component_component --model FEGIN --layers 3 --hiddens 16 --batch_size 256 --lr 0.001 --emb_size 128 --epochs 100 --save_appendix component_component_L3_H16_BS256_LR0.001_E128 --no_val
-----



STDERR:
  File "main.py", line 370, in <module>
    main()
  File "main.py", line 254, in main
    dataset = dataset_class(
  File "/home/philip/projects/ltspice_examples_code_repo/Circuit-Completion-Using-GNNs/component_classification_with_link_prediction_head/evaluation/FEGIN/kernel/circuit_datasets.py", line 15, in __init__
    self.data, self.slices = torch.load(self.processed_paths[0])
  File "/home/philip/.local/lib/python3.8/site-packages/torch/serialization.py", line 1040, in load
    warnings.warn(
  File "/usr/lib/python3.8/warnings.py", line 109, in _showwarnmsg
    sw(msg.message, msg.category, msg.filename, msg.lineno,
  File "main.py", line 47, in warn_with_traceback
    traceback.print_stack(file=log)
/home/philip/projects/ltspice_examples_code_repo/Circuit-Completion-Using-GNNs/component_classification_with_link_prediction_head/evaluation/FEGIN/kernel/circuit_datasets.py:15: FutureWarning: You are using `torch.load` with `weights_only=False` (the current default value), which uses the default pickle module implicitly. It is possible to construct malicious pickle data which will execute arbitrary code during unpickling (See https://github.com/pytorch/pytorch/blob/main/SECURITY.md#untrusted-models for more details). In a future release, the default value for `weights_only` will be flipped to `True`. This limits the functions that could be executed during unpickling. Arbitrary objects will no longer be allowed to be loaded via this mode unless they are explicitly allowlisted by the user via `torch.serialization.add_safe_globals`. We recommend you start setting `weights_only=True` for any use case where you don't have full control of the loaded file. Please open an issue on GitHub for any issues related to this experimental feature.
  self.data, self.slices = torch.load(self.processed_paths[0])
