STDOUT:
Results will be saved in /home/philip/projects/ltspice_examples_code_repo/Circuit-Completion-Using-GNNs/component_classification_with_link_prediction_head/evaluation/FEGIN/results/model_FEGIN_dataset_ltspice_examples
Command line input: python main.py --data ltspice_examples --representation component_component --model FEGIN --layers 5 --hiddens 128 --batch_size 256 --lr 0.001 --emb_size 512 --epochs 100 --save_appendix component_component_L5_H128_BS256_LR0.001_E512 --no_val
 is saved.
-----
ltspice_examples - FEGIN
Using 5 layers, 128 hidden units, h = 2
Loading component_component representation dataset
ENTERED
Training FEGIN on component_component representation
Train: 3556, Test: 845
##################ITERATION #0 ****************************************
 epoch: 0, train_loss: 1.3139, test_loss: 1.2863, test_f1: 0.2589
 epoch: 1, train_loss: 1.1998, test_loss: 1.2134, test_f1: 0.3385
 epoch: 2, train_loss: 1.1500, test_loss: 1.1427, test_f1: 0.3878
 epoch: 3, train_loss: 1.1026, test_loss: 1.0945, test_f1: 0.4764
 epoch: 4, train_loss: 1.0507, test_loss: 1.0081, test_f1: 0.5027
 epoch: 5, train_loss: 1.0051, test_loss: 1.0907, test_f1: 0.4304
 epoch: 6, train_loss: 0.9559, test_loss: 0.9772, test_f1: 0.5129
 epoch: 7, train_loss: 0.9304, test_loss: 1.0521, test_f1: 0.5045
 epoch: 8, train_loss: 0.9199, test_loss: 0.9704, test_f1: 0.4985
 epoch: 9, train_loss: 0.8759, test_loss: 0.9932, test_f1: 0.4961
 epoch: 10, train_loss: 0.8539, test_loss: 1.1207, test_f1: 0.4695
 epoch: 11, train_loss: 0.8442, test_loss: 1.1546, test_f1: 0.4689
 epoch: 12, train_loss: 0.8182, test_loss: 1.0332, test_f1: 0.4880
 epoch: 13, train_loss: 0.8106, test_loss: 1.1333, test_f1: 0.5187
 epoch: 14, train_loss: 0.7711, test_loss: 1.1109, test_f1: 0.4923
 epoch: 15, train_loss: 0.7672, test_loss: 1.1124, test_f1: 0.5234
 epoch: 16, train_loss: 0.7603, test_loss: 1.1613, test_f1: 0.5565
 epoch: 17, train_loss: 0.7298, test_loss: 1.2841, test_f1: 0.5046
 epoch: 18, train_loss: 0.7336, test_loss: 1.2791, test_f1: 0.4909
 epoch: 19, train_loss: 0.7043, test_loss: 1.2162, test_f1: 0.5155
 epoch: 20, train_loss: 0.7180, test_loss: 1.2747, test_f1: 0.4986
 epoch: 21, train_loss: 0.6761, test_loss: 1.1482, test_f1: 0.5500
 epoch: 22, train_loss: 0.6609, test_loss: 1.4921, test_f1: 0.5180
 epoch: 23, train_loss: 0.6329, test_loss: 1.3462, test_f1: 0.5354
 epoch: 24, train_loss: 0.6120, test_loss: 1.6472, test_f1: 0.5154
 epoch: 25, train_loss: 0.6438, test_loss: 1.4560, test_f1: 0.5152
 epoch: 26, train_loss: 0.6601, test_loss: 1.2092, test_f1: 0.5422
 epoch: 27, train_loss: 0.6536, test_loss: 1.2901, test_f1: 0.5309
 epoch: 28, train_loss: 0.6171, test_loss: 1.2686, test_f1: 0.5618
 epoch: 29, train_loss: 0.6049, test_loss: 1.6608, test_f1: 0.5350
 epoch: 30, train_loss: 0.5740, test_loss: 1.4371, test_f1: 0.5283
 epoch: 31, train_loss: 0.5820, test_loss: 1.4662, test_f1: 0.5285
 epoch: 32, train_loss: 0.5633, test_loss: 1.7411, test_f1: 0.4776
 epoch: 33, train_loss: 0.5448, test_loss: 1.5018, test_f1: 0.5473
 epoch: 34, train_loss: 0.5186, test_loss: 1.7160, test_f1: 0.5166
 epoch: 35, train_loss: 0.5013, test_loss: 1.6613, test_f1: 0.5319
 epoch: 36, train_loss: 0.5342, test_loss: 1.6551, test_f1: 0.4955
 epoch: 37, train_loss: 0.5199, test_loss: 1.4703, test_f1: 0.5351
 epoch: 38, train_loss: 0.5139, test_loss: 1.8389, test_f1: 0.5199
 epoch: 39, train_loss: 0.5270, test_loss: 1.6822, test_f1: 0.5203
 epoch: 40, train_loss: 0.5241, test_loss: 1.6838, test_f1: 0.5323
 epoch: 41, train_loss: 0.4793, test_loss: 1.8742, test_f1: 0.5064
 epoch: 42, train_loss: 0.4549, test_loss: 1.9334, test_f1: 0.4988
 epoch: 43, train_loss: 0.4521, test_loss: 1.7913, test_f1: 0.5351
 epoch: 44, train_loss: 0.4538, test_loss: 1.9710, test_f1: 0.4980
 epoch: 45, train_loss: 0.4575, test_loss: 1.5806, test_f1: 0.5491
 epoch: 46, train_loss: 0.4558, test_loss: 1.9030, test_f1: 0.5156
 epoch: 47, train_loss: 0.4355, test_loss: 1.9865, test_f1: 0.4811
 epoch: 48, train_loss: 0.4162, test_loss: 2.0092, test_f1: 0.5330
 epoch: 49, train_loss: 0.4014, test_loss: 1.9755, test_f1: 0.5135
 epoch: 50, train_loss: 0.3712, test_loss: 2.2255, test_f1: 0.4836
 epoch: 51, train_loss: 0.3626, test_loss: 1.9290, test_f1: 0.5067
 epoch: 52, train_loss: 0.3272, test_loss: 2.0664, test_f1: 0.5040
 epoch: 53, train_loss: 0.3141, test_loss: 2.2040, test_f1: 0.5008
 epoch: 54, train_loss: 0.3044, test_loss: 2.3263, test_f1: 0.4915
 epoch: 55, train_loss: 0.2773, test_loss: 2.3462, test_f1: 0.4804
 epoch: 56, train_loss: 0.2853, test_loss: 2.3990, test_f1: 0.5100
 epoch: 57, train_loss: 0.2928, test_loss: 2.2702, test_f1: 0.5215
 epoch: 58, train_loss: 0.2891, test_loss: 2.5322, test_f1: 0.5062
 epoch: 59, train_loss: 0.2873, test_loss: 2.5829, test_f1: 0.4927
 epoch: 60, train_loss: 0.2826, test_loss: 2.2818, test_f1: 0.4986
 epoch: 61, train_loss: 0.2690, test_loss: 2.3887, test_f1: 0.5045
 epoch: 62, train_loss: 0.2530, test_loss: 2.6022, test_f1: 0.4907
 epoch: 63, train_loss: 0.2495, test_loss: 2.8136, test_f1: 0.4735
 epoch: 64, train_loss: 0.2556, test_loss: 2.8018, test_f1: 0.4985
 epoch: 65, train_loss: 0.2529, test_loss: 2.6069, test_f1: 0.5111
 epoch: 66, train_loss: 0.2420, test_loss: 2.7302, test_f1: 0.4984
 epoch: 67, train_loss: 0.2615, test_loss: 2.8364, test_f1: 0.4983
 epoch: 68, train_loss: 0.2455, test_loss: 2.6491, test_f1: 0.5197
 epoch: 69, train_loss: 0.2672, test_loss: 2.9269, test_f1: 0.5016
 epoch: 70, train_loss: 0.2678, test_loss: 2.8079, test_f1: 0.5247
 epoch: 71, train_loss: 0.2648, test_loss: 2.8961, test_f1: 0.4906
 epoch: 72, train_loss: 0.2514, test_loss: 2.6311, test_f1: 0.4919
 epoch: 73, train_loss: 0.2530, test_loss: 2.8836, test_f1: 0.4954
 epoch: 74, train_loss: 0.2234, test_loss: 2.9219, test_f1: 0.4957
 epoch: 75, train_loss: 0.2194, test_loss: 3.0133, test_f1: 0.4894
 epoch: 76, train_loss: 0.2313, test_loss: 2.9145, test_f1: 0.4903
 epoch: 77, train_loss: 0.2402, test_loss: 3.2301, test_f1: 0.4808
 epoch: 78, train_loss: 0.2279, test_loss: 2.8467, test_f1: 0.5210
 epoch: 79, train_loss: 0.2194, test_loss: 2.9116, test_f1: 0.4847
 epoch: 80, train_loss: 0.2041, test_loss: 3.4162, test_f1: 0.4862
 epoch: 81, train_loss: 0.2202, test_loss: 3.2080, test_f1: 0.4999
 epoch: 82, train_loss: 0.2125, test_loss: 3.4003, test_f1: 0.4894
 epoch: 83, train_loss: 0.2150, test_loss: 2.9403, test_f1: 0.5165
 epoch: 84, train_loss: 0.2224, test_loss: 3.2343, test_f1: 0.4901
 epoch: 85, train_loss: 0.2163, test_loss: 3.1513, test_f1: 0.5023
 epoch: 86, train_loss: 0.2062, test_loss: 3.1231, test_f1: 0.4951
 epoch: 87, train_loss: 0.2224, test_loss: 3.2019, test_f1: 0.5176
 epoch: 88, train_loss: 0.2015, test_loss: 3.0585, test_f1: 0.5108
 epoch: 89, train_loss: 0.1963, test_loss: 3.1437, test_f1: 0.4943
 epoch: 90, train_loss: 0.1912, test_loss: 3.0785, test_f1: 0.5054
 epoch: 91, train_loss: 0.1958, test_loss: 3.3120, test_f1: 0.4783
 epoch: 92, train_loss: 0.1973, test_loss: 3.4075, test_f1: 0.5092
 epoch: 93, train_loss: 0.1723, test_loss: 3.1080, test_f1: 0.5223
 epoch: 94, train_loss: 0.1814, test_loss: 3.3918, test_f1: 0.5073
 epoch: 95, train_loss: 0.1998, test_loss: 3.5301, test_f1: 0.4753
 epoch: 96, train_loss: 0.1853, test_loss: 3.3666, test_f1: 0.4998
 epoch: 97, train_loss: 0.1774, test_loss: 3.9079, test_f1: 0.4895
 epoch: 98, train_loss: 0.1825, test_loss: 3.4012, test_f1: 0.5068
 epoch: 99, train_loss: 0.1685, test_loss: 3.6646, test_f1: 0.4698
##################ITERATION #1 ****************************************
 epoch: 0, train_loss: 1.2467, test_loss: 1.2634, test_f1: 0.2274
 epoch: 1, train_loss: 1.1316, test_loss: 1.1699, test_f1: 0.3784
 epoch: 2, train_loss: 1.0733, test_loss: 1.0700, test_f1: 0.4778
 epoch: 3, train_loss: 1.0252, test_loss: 1.0170, test_f1: 0.4859
 epoch: 4, train_loss: 0.9895, test_loss: 1.0014, test_f1: 0.4926
 epoch: 5, train_loss: 0.9591, test_loss: 1.0047, test_f1: 0.5163
 epoch: 6, train_loss: 0.9207, test_loss: 1.0195, test_f1: 0.5130
 epoch: 7, train_loss: 0.8792, test_loss: 0.9892, test_f1: 0.5132
 epoch: 8, train_loss: 0.8712, test_loss: 1.0402, test_f1: 0.5053
 epoch: 9, train_loss: 0.8386, test_loss: 1.0712, test_f1: 0.5047
 epoch: 10, train_loss: 0.8201, test_loss: 1.1255, test_f1: 0.4604
 epoch: 11, train_loss: 0.7893, test_loss: 1.1313, test_f1: 0.5001
 epoch: 12, train_loss: 0.7897, test_loss: 1.1051, test_f1: 0.5168
 epoch: 13, train_loss: 0.7731, test_loss: 1.1288, test_f1: 0.5294
 epoch: 14, train_loss: 0.7651, test_loss: 1.1319, test_f1: 0.5284
 epoch: 15, train_loss: 0.7169, test_loss: 1.1253, test_f1: 0.5346
 epoch: 16, train_loss: 0.7051, test_loss: 1.1965, test_f1: 0.5154
 epoch: 17, train_loss: 0.6746, test_loss: 1.1723, test_f1: 0.5311
 epoch: 18, train_loss: 0.6829, test_loss: 1.2290, test_f1: 0.5016
 epoch: 19, train_loss: 0.6831, test_loss: 1.1796, test_f1: 0.5470
 epoch: 20, train_loss: 0.6758, test_loss: 1.1318, test_f1: 0.5400
 epoch: 21, train_loss: 0.6137, test_loss: 1.2941, test_f1: 0.5233
 epoch: 22, train_loss: 0.6152, test_loss: 1.2650, test_f1: 0.5390
 epoch: 23, train_loss: 0.6269, test_loss: 1.5066, test_f1: 0.5206
 epoch: 24, train_loss: 0.5946, test_loss: 1.3074, test_f1: 0.5449
 epoch: 25, train_loss: 0.5817, test_loss: 1.2958, test_f1: 0.5465
 epoch: 26, train_loss: 0.5716, test_loss: 1.4706, test_f1: 0.5052
 epoch: 27, train_loss: 0.5567, test_loss: 1.6187, test_f1: 0.5321
 epoch: 28, train_loss: 0.5584, test_loss: 1.3621, test_f1: 0.5530
 epoch: 29, train_loss: 0.5314, test_loss: 1.5108, test_f1: 0.5419
 epoch: 30, train_loss: 0.5290, test_loss: 1.4318, test_f1: 0.5169
 epoch: 31, train_loss: 0.5202, test_loss: 1.5519, test_f1: 0.5221
 epoch: 32, train_loss: 0.5238, test_loss: 1.2684, test_f1: 0.5536
 epoch: 33, train_loss: 0.5096, test_loss: 1.3980, test_f1: 0.5545
 epoch: 34, train_loss: 0.4758, test_loss: 1.5947, test_f1: 0.5203
 epoch: 35, train_loss: 0.5023, test_loss: 1.5772, test_f1: 0.5385
 epoch: 36, train_loss: 0.4899, test_loss: 1.7142, test_f1: 0.5251
 epoch: 37, train_loss: 0.4588, test_loss: 1.5537, test_f1: 0.5332
 epoch: 38, train_loss: 0.4700, test_loss: 1.3884, test_f1: 0.5338
 epoch: 39, train_loss: 0.4704, test_loss: 1.7618, test_f1: 0.5299
 epoch: 40, train_loss: 0.4551, test_loss: 1.5500, test_f1: 0.5282
 epoch: 41, train_loss: 0.4463, test_loss: 1.5675, test_f1: 0.5441
 epoch: 42, train_loss: 0.4358, test_loss: 1.3456, test_f1: 0.5340
 epoch: 43, train_loss: 0.4201, test_loss: 1.6872, test_f1: 0.5390
 epoch: 44, train_loss: 0.4131, test_loss: 1.4850, test_f1: 0.5592
 epoch: 45, train_loss: 0.3936, test_loss: 1.8049, test_f1: 0.5363
 epoch: 46, train_loss: 0.3635, test_loss: 1.9044, test_f1: 0.5332
 epoch: 47, train_loss: 0.3799, test_loss: 1.6579, test_f1: 0.5484
 epoch: 48, train_loss: 0.3999, test_loss: 1.8633, test_f1: 0.5131
 epoch: 49, train_loss: 0.3715, test_loss: 1.7019, test_f1: 0.5686
 epoch: 50, train_loss: 0.3729, test_loss: 1.9398, test_f1: 0.5427
 epoch: 51, train_loss: 0.3441, test_loss: 1.9595, test_f1: 0.5394
 epoch: 52, train_loss: 0.3039, test_loss: 1.9552, test_f1: 0.5383
 epoch: 53, train_loss: 0.2774, test_loss: 2.0070, test_f1: 0.5343
 epoch: 54, train_loss: 0.2584, test_loss: 2.0116, test_f1: 0.5716
 epoch: 55, train_loss: 0.2597, test_loss: 2.1783, test_f1: 0.5379
 epoch: 56, train_loss: 0.2620, test_loss: 2.1192, test_f1: 0.5539
 epoch: 57, train_loss: 0.2442, test_loss: 2.1894, test_f1: 0.5448
 epoch: 58, train_loss: 0.2324, test_loss: 2.2771, test_f1: 0.5217
 epoch: 59, train_loss: 0.2468, test_loss: 2.3718, test_f1: 0.5077
 epoch: 60, train_loss: 0.2405, test_loss: 2.3102, test_f1: 0.5201
 epoch: 61, train_loss: 0.2350, test_loss: 2.3254, test_f1: 0.5334
 epoch: 62, train_loss: 0.2246, test_loss: 2.2979, test_f1: 0.5395
 epoch: 63, train_loss: 0.2322, test_loss: 2.3698, test_f1: 0.5328
 epoch: 64, train_loss: 0.2313, test_loss: 2.3684, test_f1: 0.5234
 epoch: 65, train_loss: 0.2311, test_loss: 2.5841, test_f1: 0.5016
 epoch: 66, train_loss: 0.2535, test_loss: 2.5834, test_f1: 0.5160
 epoch: 67, train_loss: 0.2383, test_loss: 2.3095, test_f1: 0.5516
 epoch: 68, train_loss: 0.2343, test_loss: 2.4722, test_f1: 0.5342
 epoch: 69, train_loss: 0.2306, test_loss: 2.3494, test_f1: 0.5483
 epoch: 70, train_loss: 0.2355, test_loss: 2.4160, test_f1: 0.5282
 epoch: 71, train_loss: 0.2387, test_loss: 2.2780, test_f1: 0.5414
 epoch: 72, train_loss: 0.2170, test_loss: 2.3599, test_f1: 0.5571
 epoch: 73, train_loss: 0.2166, test_loss: 2.4887, test_f1: 0.5389
 epoch: 74, train_loss: 0.2048, test_loss: 2.4097, test_f1: 0.5533
 epoch: 75, train_loss: 0.1961, test_loss: 2.7843, test_f1: 0.5378
 epoch: 76, train_loss: 0.1975, test_loss: 2.5268, test_f1: 0.5195
 epoch: 77, train_loss: 0.1964, test_loss: 2.7007, test_f1: 0.5272
 epoch: 78, train_loss: 0.1824, test_loss: 2.5541, test_f1: 0.5594
 epoch: 79, train_loss: 0.1734, test_loss: 2.7471, test_f1: 0.5173
 epoch: 80, train_loss: 0.1847, test_loss: 2.6397, test_f1: 0.5561
 epoch: 81, train_loss: 0.1888, test_loss: 2.6433, test_f1: 0.5414
 epoch: 82, train_loss: 0.1819, test_loss: 2.9960, test_f1: 0.5113
 epoch: 83, train_loss: 0.1814, test_loss: 2.7333, test_f1: 0.5355
 epoch: 84, train_loss: 0.1746, test_loss: 2.7680, test_f1: 0.5460
 epoch: 85, train_loss: 0.1815, test_loss: 2.8468, test_f1: 0.5449
 epoch: 86, train_loss: 0.1767, test_loss: 2.5349, test_f1: 0.5357
 epoch: 87, train_loss: 0.1702, test_loss: 2.5619, test_f1: 0.5416
 epoch: 88, train_loss: 0.1699, test_loss: 2.4503, test_f1: 0.5484
 epoch: 89, train_loss: 0.1776, test_loss: 2.7823, test_f1: 0.5566
 epoch: 90, train_loss: 0.1701, test_loss: 2.6075, test_f1: 0.5553
 epoch: 91, train_loss: 0.1673, test_loss: 2.6939, test_f1: 0.5638
 epoch: 92, train_loss: 0.1874, test_loss: 2.9503, test_f1: 0.5431
 epoch: 93, train_loss: 0.2012, test_loss: 2.7232, test_f1: 0.5458
 epoch: 94, train_loss: 0.1765, test_loss: 2.7229, test_f1: 0.5298
 epoch: 95, train_loss: 0.1620, test_loss: 2.6973, test_f1: 0.5345
 epoch: 96, train_loss: 0.1718, test_loss: 2.6389, test_f1: 0.5562
 epoch: 97, train_loss: 0.1837, test_loss: 2.9742, test_f1: 0.5238
 epoch: 98, train_loss: 0.1682, test_loss: 2.6706, test_f1: 0.5467
 epoch: 99, train_loss: 0.1601, test_loss: 2.6676, test_f1: 0.5567
##################ITERATION #2 ****************************************
 epoch: 0, train_loss: 1.2775, test_loss: 1.2443, test_f1: 0.2986
 epoch: 1, train_loss: 1.1420, test_loss: 1.2326, test_f1: 0.3711
 epoch: 2, train_loss: 1.0731, test_loss: 1.1208, test_f1: 0.4532
 epoch: 3, train_loss: 1.0322, test_loss: 1.0922, test_f1: 0.4491
 epoch: 4, train_loss: 0.9886, test_loss: 1.0429, test_f1: 0.4474
 epoch: 5, train_loss: 0.9684, test_loss: 1.0521, test_f1: 0.4546
 epoch: 6, train_loss: 0.9374, test_loss: 0.9681, test_f1: 0.5126
 epoch: 7, train_loss: 0.9098, test_loss: 0.9805, test_f1: 0.4928
 epoch: 8, train_loss: 0.8841, test_loss: 0.9747, test_f1: 0.5201
 epoch: 9, train_loss: 0.8952, test_loss: 0.9822, test_f1: 0.5486
 epoch: 10, train_loss: 0.8847, test_loss: 1.1391, test_f1: 0.5070
 epoch: 11, train_loss: 0.8416, test_loss: 1.0661, test_f1: 0.4912
 epoch: 12, train_loss: 0.8166, test_loss: 1.0353, test_f1: 0.5231
 epoch: 13, train_loss: 0.8192, test_loss: 1.0161, test_f1: 0.5160
 epoch: 14, train_loss: 0.8105, test_loss: 1.1532, test_f1: 0.4864
 epoch: 15, train_loss: 0.7870, test_loss: 1.0708, test_f1: 0.5255
 epoch: 16, train_loss: 0.7920, test_loss: 1.0316, test_f1: 0.5022
 epoch: 17, train_loss: 0.7851, test_loss: 1.0856, test_f1: 0.5449
 epoch: 18, train_loss: 0.7636, test_loss: 1.1024, test_f1: 0.5424
 epoch: 19, train_loss: 0.7422, test_loss: 1.2578, test_f1: 0.5025
 epoch: 20, train_loss: 0.7193, test_loss: 1.1629, test_f1: 0.5215
 epoch: 21, train_loss: 0.7112, test_loss: 1.1679, test_f1: 0.5218
 epoch: 22, train_loss: 0.7208, test_loss: 1.5350, test_f1: 0.4819
 epoch: 23, train_loss: 0.7097, test_loss: 1.2832, test_f1: 0.5068
 epoch: 24, train_loss: 0.6724, test_loss: 1.1873, test_f1: 0.5101
 epoch: 25, train_loss: 0.6749, test_loss: 1.1906, test_f1: 0.5132
 epoch: 26, train_loss: 0.6598, test_loss: 1.4019, test_f1: 0.5018
 epoch: 27, train_loss: 0.6577, test_loss: 1.2871, test_f1: 0.5261
 epoch: 28, train_loss: 0.6427, test_loss: 1.3578, test_f1: 0.5310
 epoch: 29, train_loss: 0.6332, test_loss: 1.3693, test_f1: 0.5320
 epoch: 30, train_loss: 0.6291, test_loss: 1.3598, test_f1: 0.5386
 epoch: 31, train_loss: 0.6061, test_loss: 1.5694, test_f1: 0.4958
 epoch: 32, train_loss: 0.6079, test_loss: 1.4981, test_f1: 0.5264
 epoch: 33, train_loss: 0.5994, test_loss: 1.6229, test_f1: 0.5116
 epoch: 34, train_loss: 0.5756, test_loss: 1.4819, test_f1: 0.5084
 epoch: 35, train_loss: 0.5730, test_loss: 1.3148, test_f1: 0.5488
 epoch: 36, train_loss: 0.5604, test_loss: 1.6957, test_f1: 0.4786
 epoch: 37, train_loss: 0.5570, test_loss: 1.5834, test_f1: 0.5148
 epoch: 38, train_loss: 0.5395, test_loss: 1.7252, test_f1: 0.5125
 epoch: 39, train_loss: 0.5347, test_loss: 1.5860, test_f1: 0.5103
 epoch: 40, train_loss: 0.5225, test_loss: 1.8867, test_f1: 0.5044
 epoch: 41, train_loss: 0.5036, test_loss: 1.5571, test_f1: 0.5157
 epoch: 42, train_loss: 0.5233, test_loss: 1.6951, test_f1: 0.5138
 epoch: 43, train_loss: 0.5172, test_loss: 1.7142, test_f1: 0.5181
 epoch: 44, train_loss: 0.5228, test_loss: 1.7329, test_f1: 0.4848
 epoch: 45, train_loss: 0.4997, test_loss: 1.6088, test_f1: 0.5376
 epoch: 46, train_loss: 0.4809, test_loss: 2.0370, test_f1: 0.5027
 epoch: 47, train_loss: 0.4826, test_loss: 2.0917, test_f1: 0.5124
 epoch: 48, train_loss: 0.4831, test_loss: 1.7108, test_f1: 0.5257
 epoch: 49, train_loss: 0.4491, test_loss: 1.8492, test_f1: 0.5416
 epoch: 50, train_loss: 0.4497, test_loss: 1.6753, test_f1: 0.5342
 epoch: 51, train_loss: 0.4174, test_loss: 1.8259, test_f1: 0.5278
 epoch: 52, train_loss: 0.3896, test_loss: 1.9893, test_f1: 0.5220
 epoch: 53, train_loss: 0.3724, test_loss: 1.9693, test_f1: 0.5251
 epoch: 54, train_loss: 0.3507, test_loss: 1.9894, test_f1: 0.5175
 epoch: 55, train_loss: 0.3502, test_loss: 2.0551, test_f1: 0.5237
 epoch: 56, train_loss: 0.3478, test_loss: 2.0337, test_f1: 0.5269
 epoch: 57, train_loss: 0.3515, test_loss: 2.2873, test_f1: 0.5031
 epoch: 58, train_loss: 0.3368, test_loss: 2.1585, test_f1: 0.5132
 epoch: 59, train_loss: 0.3470, test_loss: 2.2716, test_f1: 0.5200
 epoch: 60, train_loss: 0.3418, test_loss: 2.3881, test_f1: 0.5151
 epoch: 61, train_loss: 0.3246, test_loss: 2.1249, test_f1: 0.5166
 epoch: 62, train_loss: 0.3066, test_loss: 2.2375, test_f1: 0.5133
 epoch: 63, train_loss: 0.3208, test_loss: 2.5621, test_f1: 0.5160
 epoch: 64, train_loss: 0.3056, test_loss: 2.3057, test_f1: 0.5178
 epoch: 65, train_loss: 0.3025, test_loss: 2.2794, test_f1: 0.4963
 epoch: 66, train_loss: 0.3084, test_loss: 2.2379, test_f1: 0.5252
 epoch: 67, train_loss: 0.3003, test_loss: 2.2436, test_f1: 0.5581
 epoch: 68, train_loss: 0.2987, test_loss: 2.4727, test_f1: 0.5028
 epoch: 69, train_loss: 0.3058, test_loss: 2.6527, test_f1: 0.4923
 epoch: 70, train_loss: 0.3058, test_loss: 2.5060, test_f1: 0.5223
 epoch: 71, train_loss: 0.2953, test_loss: 2.4172, test_f1: 0.5275
 epoch: 72, train_loss: 0.2759, test_loss: 2.5413, test_f1: 0.5064
 epoch: 73, train_loss: 0.2720, test_loss: 2.7942, test_f1: 0.5189
 epoch: 74, train_loss: 0.2752, test_loss: 2.3835, test_f1: 0.5357
 epoch: 75, train_loss: 0.2802, test_loss: 2.6658, test_f1: 0.5084
 epoch: 76, train_loss: 0.2760, test_loss: 2.5504, test_f1: 0.5038
 epoch: 77, train_loss: 0.2683, test_loss: 2.5277, test_f1: 0.5032
 epoch: 78, train_loss: 0.2793, test_loss: 2.6730, test_f1: 0.5116
 epoch: 79, train_loss: 0.2683, test_loss: 2.7913, test_f1: 0.5163
 epoch: 80, train_loss: 0.2672, test_loss: 2.6714, test_f1: 0.5126
 epoch: 81, train_loss: 0.2688, test_loss: 2.6065, test_f1: 0.5323
 epoch: 82, train_loss: 0.2877, test_loss: 2.7776, test_f1: 0.5272
 epoch: 83, train_loss: 0.2718, test_loss: 2.6114, test_f1: 0.5162
 epoch: 84, train_loss: 0.2812, test_loss: 2.6746, test_f1: 0.5134
 epoch: 85, train_loss: 0.2709, test_loss: 2.5646, test_f1: 0.5220
 epoch: 86, train_loss: 0.2749, test_loss: 2.5667, test_f1: 0.5112
 epoch: 87, train_loss: 0.2491, test_loss: 2.6681, test_f1: 0.5313
 epoch: 88, train_loss: 0.2460, test_loss: 3.1358, test_f1: 0.4939
 epoch: 89, train_loss: 0.2561, test_loss: 2.8476, test_f1: 0.5274
 epoch: 90, train_loss: 0.2474, test_loss: 2.7434, test_f1: 0.5171
 epoch: 91, train_loss: 0.2410, test_loss: 2.5688, test_f1: 0.5205
 epoch: 92, train_loss: 0.2301, test_loss: 2.7306, test_f1: 0.5330
 epoch: 93, train_loss: 0.2465, test_loss: 3.0339, test_f1: 0.5230
 epoch: 94, train_loss: 0.2307, test_loss: 2.7527, test_f1: 0.5326
 epoch: 95, train_loss: 0.2086, test_loss: 2.5999, test_f1: 0.5349
 epoch: 96, train_loss: 0.2097, test_loss: 3.2932, test_f1: 0.5016
 epoch: 97, train_loss: 0.2323, test_loss: 3.1669, test_f1: 0.5191
 epoch: 98, train_loss: 0.2533, test_loss: 2.6972, test_f1: 0.5434
 epoch: 99, train_loss: 0.2394, test_loss: 2.9537, test_f1: 0.5369
##################ITERATION #3 ****************************************
 epoch: 0, train_loss: 1.3260, test_loss: 1.2618, test_f1: 0.3443
 epoch: 1, train_loss: 1.1548, test_loss: 1.2265, test_f1: 0.3671
 epoch: 2, train_loss: 1.1059, test_loss: 1.1348, test_f1: 0.4032
 epoch: 3, train_loss: 1.0528, test_loss: 1.0633, test_f1: 0.4595
 epoch: 4, train_loss: 1.0160, test_loss: 1.0382, test_f1: 0.4701
 epoch: 5, train_loss: 0.9645, test_loss: 0.9907, test_f1: 0.5087
 epoch: 6, train_loss: 0.9492, test_loss: 0.9871, test_f1: 0.4969
 epoch: 7, train_loss: 0.9084, test_loss: 1.0033, test_f1: 0.5055
 epoch: 8, train_loss: 0.8933, test_loss: 1.1362, test_f1: 0.4758
 epoch: 9, train_loss: 0.8694, test_loss: 0.9935, test_f1: 0.5279
 epoch: 10, train_loss: 0.8396, test_loss: 1.0347, test_f1: 0.5172
 epoch: 11, train_loss: 0.8073, test_loss: 1.0554, test_f1: 0.5411
 epoch: 12, train_loss: 0.7895, test_loss: 1.0155, test_f1: 0.5385
 epoch: 13, train_loss: 0.7837, test_loss: 1.0956, test_f1: 0.5263
 epoch: 14, train_loss: 0.7586, test_loss: 1.0563, test_f1: 0.5290
 epoch: 15, train_loss: 0.7384, test_loss: 1.0869, test_f1: 0.5210
 epoch: 16, train_loss: 0.7079, test_loss: 1.1621, test_f1: 0.5036
 epoch: 17, train_loss: 0.6899, test_loss: 1.0987, test_f1: 0.5614
 epoch: 18, train_loss: 0.6848, test_loss: 1.3009, test_f1: 0.5099
 epoch: 19, train_loss: 0.6850, test_loss: 1.1301, test_f1: 0.5503
 epoch: 20, train_loss: 0.6817, test_loss: 1.3911, test_f1: 0.5009
 epoch: 21, train_loss: 0.6583, test_loss: 1.2632, test_f1: 0.5538
 epoch: 22, train_loss: 0.6296, test_loss: 1.2285, test_f1: 0.5393
 epoch: 23, train_loss: 0.6317, test_loss: 1.2474, test_f1: 0.5297
 epoch: 24, train_loss: 0.6114, test_loss: 1.3412, test_f1: 0.5387
 epoch: 25, train_loss: 0.6008, test_loss: 1.2932, test_f1: 0.5422
 epoch: 26, train_loss: 0.6096, test_loss: 1.4694, test_f1: 0.4921
 epoch: 27, train_loss: 0.6066, test_loss: 1.3590, test_f1: 0.5070
 epoch: 28, train_loss: 0.5995, test_loss: 1.4714, test_f1: 0.5450
 epoch: 29, train_loss: 0.5720, test_loss: 1.2977, test_f1: 0.5429
 epoch: 30, train_loss: 0.5595, test_loss: 1.5216, test_f1: 0.5434
 epoch: 31, train_loss: 0.5457, test_loss: 1.3685, test_f1: 0.5500
 epoch: 32, train_loss: 0.5151, test_loss: 1.4437, test_f1: 0.5653
 epoch: 33, train_loss: 0.4982, test_loss: 1.5430, test_f1: 0.5395
 epoch: 34, train_loss: 0.5172, test_loss: 1.8056, test_f1: 0.5544
 epoch: 35, train_loss: 0.5117, test_loss: 1.6605, test_f1: 0.5357
 epoch: 36, train_loss: 0.4905, test_loss: 1.5242, test_f1: 0.5387
 epoch: 37, train_loss: 0.4718, test_loss: 1.8069, test_f1: 0.5333
 epoch: 38, train_loss: 0.4661, test_loss: 1.6492, test_f1: 0.5553
 epoch: 39, train_loss: 0.4673, test_loss: 1.4472, test_f1: 0.5512
 epoch: 40, train_loss: 0.4667, test_loss: 1.8665, test_f1: 0.5454
 epoch: 41, train_loss: 0.4503, test_loss: 1.5667, test_f1: 0.5662
 epoch: 42, train_loss: 0.4319, test_loss: 1.5851, test_f1: 0.5623
 epoch: 43, train_loss: 0.4298, test_loss: 1.7093, test_f1: 0.5654
 epoch: 44, train_loss: 0.4657, test_loss: 1.6434, test_f1: 0.5498
 epoch: 45, train_loss: 0.4160, test_loss: 1.6108, test_f1: 0.5516
 epoch: 46, train_loss: 0.4094, test_loss: 1.9112, test_f1: 0.5378
 epoch: 47, train_loss: 0.4157, test_loss: 1.8963, test_f1: 0.5466
 epoch: 48, train_loss: 0.4023, test_loss: 1.9828, test_f1: 0.5509
 epoch: 49, train_loss: 0.4188, test_loss: 1.9653, test_f1: 0.5398
 epoch: 50, train_loss: 0.3993, test_loss: 1.8016, test_f1: 0.5260
 epoch: 51, train_loss: 0.3703, test_loss: 1.7881, test_f1: 0.5585
 epoch: 52, train_loss: 0.3190, test_loss: 1.9215, test_f1: 0.5549
 epoch: 53, train_loss: 0.3039, test_loss: 2.1589, test_f1: 0.5502
 epoch: 54, train_loss: 0.2882, test_loss: 2.0151, test_f1: 0.5640
 epoch: 55, train_loss: 0.2685, test_loss: 2.1412, test_f1: 0.5469
 epoch: 56, train_loss: 0.2770, test_loss: 2.0358, test_f1: 0.5664
 epoch: 57, train_loss: 0.2885, test_loss: 2.1130, test_f1: 0.5650
 epoch: 58, train_loss: 0.2914, test_loss: 2.2643, test_f1: 0.5702
 epoch: 59, train_loss: 0.2778, test_loss: 2.3347, test_f1: 0.5326
 epoch: 60, train_loss: 0.2731, test_loss: 2.2553, test_f1: 0.5511
 epoch: 61, train_loss: 0.2658, test_loss: 2.2202, test_f1: 0.5384
 epoch: 62, train_loss: 0.2639, test_loss: 2.5285, test_f1: 0.5341
 epoch: 63, train_loss: 0.2503, test_loss: 2.4630, test_f1: 0.5381
 epoch: 64, train_loss: 0.2604, test_loss: 2.3105, test_f1: 0.5345
 epoch: 65, train_loss: 0.2690, test_loss: 2.6104, test_f1: 0.5399
 epoch: 66, train_loss: 0.2648, test_loss: 2.3357, test_f1: 0.5436
 epoch: 67, train_loss: 0.2537, test_loss: 2.5518, test_f1: 0.5462
 epoch: 68, train_loss: 0.2430, test_loss: 2.4380, test_f1: 0.5494
 epoch: 69, train_loss: 0.2309, test_loss: 2.4710, test_f1: 0.5513
 epoch: 70, train_loss: 0.2411, test_loss: 2.5228, test_f1: 0.5521
 epoch: 71, train_loss: 0.2522, test_loss: 2.6029, test_f1: 0.5262
 epoch: 72, train_loss: 0.2369, test_loss: 2.2592, test_f1: 0.5634
 epoch: 73, train_loss: 0.2319, test_loss: 2.5345, test_f1: 0.5270
 epoch: 74, train_loss: 0.2298, test_loss: 2.5936, test_f1: 0.5421
 epoch: 75, train_loss: 0.2256, test_loss: 2.4589, test_f1: 0.5617
 epoch: 76, train_loss: 0.2204, test_loss: 2.6817, test_f1: 0.5489
 epoch: 77, train_loss: 0.2201, test_loss: 2.6535, test_f1: 0.5281
 epoch: 78, train_loss: 0.2201, test_loss: 2.9396, test_f1: 0.5404
 epoch: 79, train_loss: 0.2348, test_loss: 2.6780, test_f1: 0.5324
 epoch: 80, train_loss: 0.2100, test_loss: 2.5376, test_f1: 0.5292
 epoch: 81, train_loss: 0.2381, test_loss: 2.5713, test_f1: 0.5482
 epoch: 82, train_loss: 0.2124, test_loss: 2.7705, test_f1: 0.5424
 epoch: 83, train_loss: 0.2243, test_loss: 2.6594, test_f1: 0.5265
 epoch: 84, train_loss: 0.2018, test_loss: 2.9205, test_f1: 0.5322
 epoch: 85, train_loss: 0.2048, test_loss: 2.5672, test_f1: 0.5523
 epoch: 86, train_loss: 0.1917, test_loss: 2.6804, test_f1: 0.5322
 epoch: 87, train_loss: 0.1903, test_loss: 2.8698, test_f1: 0.5293
 epoch: 88, train_loss: 0.1911, test_loss: 2.9137, test_f1: 0.5543
 epoch: 89, train_loss: 0.1986, test_loss: 3.2189, test_f1: 0.5329
 epoch: 90, train_loss: 0.1948, test_loss: 2.7096, test_f1: 0.5448
 epoch: 91, train_loss: 0.1970, test_loss: 2.6913, test_f1: 0.5395
 epoch: 92, train_loss: 0.1951, test_loss: 2.8340, test_f1: 0.5467
 epoch: 93, train_loss: 0.1835, test_loss: 2.5844, test_f1: 0.5514
 epoch: 94, train_loss: 0.1876, test_loss: 2.8530, test_f1: 0.5495
 epoch: 95, train_loss: 0.1857, test_loss: 3.1855, test_f1: 0.5141
 epoch: 96, train_loss: 0.1862, test_loss: 3.1924, test_f1: 0.5331
 epoch: 97, train_loss: 0.1826, test_loss: 3.2191, test_f1: 0.5230
 epoch: 98, train_loss: 0.1897, test_loss: 3.0293, test_f1: 0.5265
 epoch: 99, train_loss: 0.1901, test_loss: 3.0346, test_f1: 0.5458
##################ITERATION #4 ****************************************
 epoch: 0, train_loss: 1.3459, test_loss: 1.2914, test_f1: 0.3043
 epoch: 1, train_loss: 1.1865, test_loss: 1.1846, test_f1: 0.4762
 epoch: 2, train_loss: 1.1225, test_loss: 1.0883, test_f1: 0.4567
 epoch: 3, train_loss: 1.0611, test_loss: 1.0544, test_f1: 0.4738
 epoch: 4, train_loss: 1.0335, test_loss: 1.0334, test_f1: 0.4897
 epoch: 5, train_loss: 1.0101, test_loss: 1.0787, test_f1: 0.5008
 epoch: 6, train_loss: 0.9780, test_loss: 0.9582, test_f1: 0.5356
 epoch: 7, train_loss: 0.9382, test_loss: 1.0229, test_f1: 0.5028
 epoch: 8, train_loss: 0.9246, test_loss: 0.9863, test_f1: 0.4977
 epoch: 9, train_loss: 0.8936, test_loss: 0.9558, test_f1: 0.5237
 epoch: 10, train_loss: 0.8802, test_loss: 0.9430, test_f1: 0.5264
 epoch: 11, train_loss: 0.8572, test_loss: 0.9902, test_f1: 0.5469
 epoch: 12, train_loss: 0.8614, test_loss: 1.0810, test_f1: 0.4772
 epoch: 13, train_loss: 0.8344, test_loss: 1.0009, test_f1: 0.5137
 epoch: 14, train_loss: 0.8041, test_loss: 1.0596, test_f1: 0.5123
 epoch: 15, train_loss: 0.7923, test_loss: 1.0335, test_f1: 0.5283
 epoch: 16, train_loss: 0.7795, test_loss: 1.1044, test_f1: 0.5493
 epoch: 17, train_loss: 0.7526, test_loss: 1.1947, test_f1: 0.5134
 epoch: 18, train_loss: 0.7430, test_loss: 1.1360, test_f1: 0.5352
 epoch: 19, train_loss: 0.7376, test_loss: 1.1728, test_f1: 0.5115
 epoch: 20, train_loss: 0.7249, test_loss: 1.2386, test_f1: 0.4554
 epoch: 21, train_loss: 0.7205, test_loss: 1.1732, test_f1: 0.5408
 epoch: 22, train_loss: 0.6853, test_loss: 1.2339, test_f1: 0.5036
 epoch: 23, train_loss: 0.6779, test_loss: 1.1559, test_f1: 0.5533
 epoch: 24, train_loss: 0.6405, test_loss: 1.2628, test_f1: 0.5506
 epoch: 25, train_loss: 0.6308, test_loss: 1.3926, test_f1: 0.5381
 epoch: 26, train_loss: 0.6453, test_loss: 1.2839, test_f1: 0.5371
 epoch: 27, train_loss: 0.6473, test_loss: 1.3819, test_f1: 0.5304
 epoch: 28, train_loss: 0.6247, test_loss: 1.1953, test_f1: 0.5422
 epoch: 29, train_loss: 0.6064, test_loss: 1.3734, test_f1: 0.5242
 epoch: 30, train_loss: 0.6014, test_loss: 1.2532, test_f1: 0.5383
 epoch: 31, train_loss: 0.5721, test_loss: 1.3919, test_f1: 0.5327
 epoch: 32, train_loss: 0.5660, test_loss: 1.4063, test_f1: 0.5381
 epoch: 33, train_loss: 0.5651, test_loss: 1.4965, test_f1: 0.5491
 epoch: 34, train_loss: 0.5732, test_loss: 1.3879, test_f1: 0.5500
 epoch: 35, train_loss: 0.5716, test_loss: 1.5444, test_f1: 0.5124
 epoch: 36, train_loss: 0.5424, test_loss: 1.6729, test_f1: 0.5212
 epoch: 37, train_loss: 0.5334, test_loss: 1.6175, test_f1: 0.5343
 epoch: 38, train_loss: 0.5235, test_loss: 1.7447, test_f1: 0.4843
 epoch: 39, train_loss: 0.5123, test_loss: 1.4478, test_f1: 0.5797
 epoch: 40, train_loss: 0.4959, test_loss: 1.5183, test_f1: 0.5481
 epoch: 41, train_loss: 0.4601, test_loss: 1.7221, test_f1: 0.5435
 epoch: 42, train_loss: 0.4559, test_loss: 1.7059, test_f1: 0.5530
 epoch: 43, train_loss: 0.4793, test_loss: 1.8307, test_f1: 0.5366
 epoch: 44, train_loss: 0.4925, test_loss: 1.8199, test_f1: 0.4956
 epoch: 45, train_loss: 0.4756, test_loss: 1.5105, test_f1: 0.5347
 epoch: 46, train_loss: 0.4738, test_loss: 1.5092, test_f1: 0.5682
 epoch: 47, train_loss: 0.4486, test_loss: 1.7402, test_f1: 0.5237
 epoch: 48, train_loss: 0.4518, test_loss: 1.4969, test_f1: 0.5596
 epoch: 49, train_loss: 0.4223, test_loss: 1.8664, test_f1: 0.5449
 epoch: 50, train_loss: 0.4075, test_loss: 1.5924, test_f1: 0.5462
 epoch: 51, train_loss: 0.3910, test_loss: 1.7911, test_f1: 0.5314
 epoch: 52, train_loss: 0.3444, test_loss: 1.7768, test_f1: 0.5533
 epoch: 53, train_loss: 0.3334, test_loss: 2.0797, test_f1: 0.5313
 epoch: 54, train_loss: 0.3291, test_loss: 1.8297, test_f1: 0.5608
 epoch: 55, train_loss: 0.3186, test_loss: 2.0035, test_f1: 0.5560
 epoch: 56, train_loss: 0.3187, test_loss: 1.9403, test_f1: 0.5231
 epoch: 57, train_loss: 0.3046, test_loss: 1.9549, test_f1: 0.5418
 epoch: 58, train_loss: 0.3087, test_loss: 2.0086, test_f1: 0.5522
 epoch: 59, train_loss: 0.3160, test_loss: 2.0952, test_f1: 0.5491
 epoch: 60, train_loss: 0.3087, test_loss: 2.0048, test_f1: 0.5629
 epoch: 61, train_loss: 0.2954, test_loss: 2.0743, test_f1: 0.5491
 epoch: 62, train_loss: 0.2841, test_loss: 2.0744, test_f1: 0.5601
 epoch: 63, train_loss: 0.2835, test_loss: 2.1588, test_f1: 0.5452
 epoch: 64, train_loss: 0.2969, test_loss: 2.1095, test_f1: 0.5361
 epoch: 65, train_loss: 0.2843, test_loss: 2.0352, test_f1: 0.5502
 epoch: 66, train_loss: 0.2855, test_loss: 2.0455, test_f1: 0.5639
 epoch: 67, train_loss: 0.2768, test_loss: 2.4162, test_f1: 0.5443
 epoch: 68, train_loss: 0.2878, test_loss: 2.2640, test_f1: 0.5391
 epoch: 69, train_loss: 0.2797, test_loss: 2.1259, test_f1: 0.5328
 epoch: 70, train_loss: 0.2750, test_loss: 2.3454, test_f1: 0.5422
 epoch: 71, train_loss: 0.2972, test_loss: 2.2041, test_f1: 0.5399
 epoch: 72, train_loss: 0.2616, test_loss: 2.1485, test_f1: 0.5482
 epoch: 73, train_loss: 0.2662, test_loss: 2.2012, test_f1: 0.5412
 epoch: 74, train_loss: 0.2492, test_loss: 2.3199, test_f1: 0.5280
 epoch: 75, train_loss: 0.2539, test_loss: 2.3388, test_f1: 0.5249
 epoch: 76, train_loss: 0.2614, test_loss: 2.2507, test_f1: 0.5601
 epoch: 77, train_loss: 0.2689, test_loss: 2.3625, test_f1: 0.5115
 epoch: 78, train_loss: 0.2668, test_loss: 2.3198, test_f1: 0.5306
 epoch: 79, train_loss: 0.2574, test_loss: 2.2060, test_f1: 0.5361
 epoch: 80, train_loss: 0.2392, test_loss: 2.3973, test_f1: 0.5382
 epoch: 81, train_loss: 0.2401, test_loss: 2.3498, test_f1: 0.5398
 epoch: 82, train_loss: 0.2443, test_loss: 2.2521, test_f1: 0.5531
 epoch: 83, train_loss: 0.2319, test_loss: 2.4083, test_f1: 0.5347
 epoch: 84, train_loss: 0.2149, test_loss: 2.3819, test_f1: 0.5543
 epoch: 85, train_loss: 0.2305, test_loss: 2.5143, test_f1: 0.5466
 epoch: 86, train_loss: 0.2182, test_loss: 2.4001, test_f1: 0.5485
 epoch: 87, train_loss: 0.2440, test_loss: 2.5078, test_f1: 0.5188
 epoch: 88, train_loss: 0.2159, test_loss: 2.4103, test_f1: 0.5467
 epoch: 89, train_loss: 0.2121, test_loss: 2.6728, test_f1: 0.5189
 epoch: 90, train_loss: 0.2182, test_loss: 2.7553, test_f1: 0.5370
 epoch: 91, train_loss: 0.2277, test_loss: 2.5166, test_f1: 0.5145
 epoch: 92, train_loss: 0.2301, test_loss: 2.4943, test_f1: 0.5405
 epoch: 93, train_loss: 0.2173, test_loss: 2.4279, test_f1: 0.5587
 epoch: 94, train_loss: 0.2041, test_loss: 2.4120, test_f1: 0.5481
 epoch: 95, train_loss: 0.2332, test_loss: 2.7755, test_f1: 0.5318
 epoch: 96, train_loss: 0.2032, test_loss: 2.5401, test_f1: 0.5390
 epoch: 97, train_loss: 0.1933, test_loss: 2.5610, test_f1: 0.5082
 epoch: 98, train_loss: 0.1999, test_loss: 2.7204, test_f1: 0.5381
 epoch: 99, train_loss: 0.2141, test_loss: 2.7278, test_f1: 0.5265
##################ITERATION #5 ****************************************
 epoch: 0, train_loss: 1.4117, test_loss: 1.2872, test_f1: 0.3347
 epoch: 1, train_loss: 1.2321, test_loss: 1.2042, test_f1: 0.3746
 epoch: 2, train_loss: 1.1721, test_loss: 1.1280, test_f1: 0.4289
 epoch: 3, train_loss: 1.1009, test_loss: 1.0574, test_f1: 0.4665
 epoch: 4, train_loss: 1.0643, test_loss: 1.0067, test_f1: 0.5119
 epoch: 5, train_loss: 1.0308, test_loss: 1.0535, test_f1: 0.4572
 epoch: 6, train_loss: 1.0059, test_loss: 1.0486, test_f1: 0.4893
 epoch: 7, train_loss: 0.9884, test_loss: 1.0283, test_f1: 0.4688
 epoch: 8, train_loss: 0.9565, test_loss: 1.0012, test_f1: 0.4803
 epoch: 9, train_loss: 0.9146, test_loss: 1.0842, test_f1: 0.4744
 epoch: 10, train_loss: 0.8932, test_loss: 1.0072, test_f1: 0.4666
 epoch: 11, train_loss: 0.8880, test_loss: 0.9907, test_f1: 0.5519
 epoch: 12, train_loss: 0.8555, test_loss: 1.0981, test_f1: 0.5007
 epoch: 13, train_loss: 0.8599, test_loss: 1.0390, test_f1: 0.5004
 epoch: 14, train_loss: 0.8262, test_loss: 1.0390, test_f1: 0.5397
 epoch: 15, train_loss: 0.7972, test_loss: 1.0628, test_f1: 0.5027
 epoch: 16, train_loss: 0.7709, test_loss: 1.0218, test_f1: 0.5321
 epoch: 17, train_loss: 0.7493, test_loss: 1.2307, test_f1: 0.4874
 epoch: 18, train_loss: 0.7616, test_loss: 1.0909, test_f1: 0.5247
 epoch: 19, train_loss: 0.7355, test_loss: 1.1076, test_f1: 0.5207
 epoch: 20, train_loss: 0.7353, test_loss: 1.1164, test_f1: 0.5111
 epoch: 21, train_loss: 0.6982, test_loss: 1.1160, test_f1: 0.5226
 epoch: 22, train_loss: 0.6797, test_loss: 1.2251, test_f1: 0.5131
 epoch: 23, train_loss: 0.6789, test_loss: 1.1748, test_f1: 0.5079
 epoch: 24, train_loss: 0.6671, test_loss: 1.1523, test_f1: 0.5187
 epoch: 25, train_loss: 0.6722, test_loss: 1.0838, test_f1: 0.5078
 epoch: 26, train_loss: 0.6646, test_loss: 1.2322, test_f1: 0.5152
 epoch: 27, train_loss: 0.6342, test_loss: 1.2315, test_f1: 0.5092
 epoch: 28, train_loss: 0.6261, test_loss: 1.3068, test_f1: 0.5181
 epoch: 29, train_loss: 0.6290, test_loss: 1.2735, test_f1: 0.5332
 epoch: 30, train_loss: 0.5995, test_loss: 1.4274, test_f1: 0.4849
 epoch: 31, train_loss: 0.5920, test_loss: 1.3191, test_f1: 0.5100
 epoch: 32, train_loss: 0.5863, test_loss: 1.3090, test_f1: 0.5403
 epoch: 33, train_loss: 0.5997, test_loss: 1.3989, test_f1: 0.5321
 epoch: 34, train_loss: 0.5488, test_loss: 1.3697, test_f1: 0.5186
 epoch: 35, train_loss: 0.5313, test_loss: 1.5091, test_f1: 0.4973
 epoch: 36, train_loss: 0.5492, test_loss: 1.3704, test_f1: 0.5291
 epoch: 37, train_loss: 0.5498, test_loss: 1.5987, test_f1: 0.5191
 epoch: 38, train_loss: 0.5143, test_loss: 1.5053, test_f1: 0.5112
 epoch: 39, train_loss: 0.5133, test_loss: 1.6341, test_f1: 0.5152
 epoch: 40, train_loss: 0.4956, test_loss: 1.4700, test_f1: 0.4992
 epoch: 41, train_loss: 0.5218, test_loss: 1.5326, test_f1: 0.5075
 epoch: 42, train_loss: 0.5029, test_loss: 1.8473, test_f1: 0.4792
 epoch: 43, train_loss: 0.4942, test_loss: 1.3186, test_f1: 0.5511
 epoch: 44, train_loss: 0.4972, test_loss: 1.4684, test_f1: 0.5230
 epoch: 45, train_loss: 0.4832, test_loss: 1.5678, test_f1: 0.5357
 epoch: 46, train_loss: 0.4668, test_loss: 1.6176, test_f1: 0.5191
 epoch: 47, train_loss: 0.4614, test_loss: 1.5352, test_f1: 0.5175
 epoch: 48, train_loss: 0.4502, test_loss: 1.6098, test_f1: 0.5630
 epoch: 49, train_loss: 0.4590, test_loss: 1.7848, test_f1: 0.5232
 epoch: 50, train_loss: 0.4277, test_loss: 1.6674, test_f1: 0.5123
 epoch: 51, train_loss: 0.3937, test_loss: 1.6459, test_f1: 0.5414
 epoch: 52, train_loss: 0.3672, test_loss: 1.7200, test_f1: 0.5364
 epoch: 53, train_loss: 0.3548, test_loss: 1.7775, test_f1: 0.5443
 epoch: 54, train_loss: 0.3291, test_loss: 1.7214, test_f1: 0.5252
 epoch: 55, train_loss: 0.3542, test_loss: 1.9284, test_f1: 0.5164
 epoch: 56, train_loss: 0.3295, test_loss: 1.7710, test_f1: 0.5445
 epoch: 57, train_loss: 0.3218, test_loss: 1.9559, test_f1: 0.5280
 epoch: 58, train_loss: 0.3383, test_loss: 1.8698, test_f1: 0.5456
 epoch: 59, train_loss: 0.3190, test_loss: 1.8532, test_f1: 0.5107
 epoch: 60, train_loss: 0.3142, test_loss: 1.9431, test_f1: 0.5249
 epoch: 61, train_loss: 0.3106, test_loss: 2.1636, test_f1: 0.5133
 epoch: 62, train_loss: 0.2954, test_loss: 1.9006, test_f1: 0.5525
 epoch: 63, train_loss: 0.3056, test_loss: 2.0380, test_f1: 0.5227
 epoch: 64, train_loss: 0.2984, test_loss: 2.0274, test_f1: 0.5433
 epoch: 65, train_loss: 0.2974, test_loss: 2.0482, test_f1: 0.5107
 epoch: 66, train_loss: 0.2934, test_loss: 2.1062, test_f1: 0.5378
 epoch: 67, train_loss: 0.2867, test_loss: 2.1049, test_f1: 0.5068
 epoch: 68, train_loss: 0.2837, test_loss: 2.2712, test_f1: 0.5150
 epoch: 69, train_loss: 0.2786, test_loss: 2.2508, test_f1: 0.5425
 epoch: 70, train_loss: 0.2819, test_loss: 2.4672, test_f1: 0.5214
 epoch: 71, train_loss: 0.3091, test_loss: 2.2024, test_f1: 0.5011
 epoch: 72, train_loss: 0.2745, test_loss: 1.9377, test_f1: 0.5509
 epoch: 73, train_loss: 0.2605, test_loss: 2.0979, test_f1: 0.5448
 epoch: 74, train_loss: 0.2432, test_loss: 2.1816, test_f1: 0.5298
 epoch: 75, train_loss: 0.2639, test_loss: 2.1999, test_f1: 0.5412
 epoch: 76, train_loss: 0.2669, test_loss: 2.1427, test_f1: 0.5448
 epoch: 77, train_loss: 0.2475, test_loss: 2.5382, test_f1: 0.5075
 epoch: 78, train_loss: 0.2531, test_loss: 2.1813, test_f1: 0.5420
 epoch: 79, train_loss: 0.2553, test_loss: 2.5119, test_f1: 0.5197
 epoch: 80, train_loss: 0.2670, test_loss: 2.0754, test_f1: 0.5518
 epoch: 81, train_loss: 0.2657, test_loss: 2.1556, test_f1: 0.5485
 epoch: 82, train_loss: 0.2404, test_loss: 2.3723, test_f1: 0.5268
 epoch: 83, train_loss: 0.2474, test_loss: 2.2863, test_f1: 0.5274
 epoch: 84, train_loss: 0.2501, test_loss: 2.5447, test_f1: 0.5344
 epoch: 85, train_loss: 0.2503, test_loss: 2.3046, test_f1: 0.5188
 epoch: 86, train_loss: 0.2411, test_loss: 2.4950, test_f1: 0.5307
 epoch: 87, train_loss: 0.2511, test_loss: 2.3900, test_f1: 0.5370
 epoch: 88, train_loss: 0.2267, test_loss: 2.4573, test_f1: 0.5231
 epoch: 89, train_loss: 0.2313, test_loss: 2.4075, test_f1: 0.5506
 epoch: 90, train_loss: 0.2244, test_loss: 2.3347, test_f1: 0.5298
 epoch: 91, train_loss: 0.2097, test_loss: 2.5875, test_f1: 0.5124
 epoch: 92, train_loss: 0.2110, test_loss: 2.4310, test_f1: 0.5375
 epoch: 93, train_loss: 0.2272, test_loss: 2.3901, test_f1: 0.5364
 epoch: 94, train_loss: 0.2155, test_loss: 2.5767, test_f1: 0.5470
 epoch: 95, train_loss: 0.2054, test_loss: 2.5015, test_f1: 0.5369
 epoch: 96, train_loss: 0.2034, test_loss: 2.5980, test_f1: 0.5441
 epoch: 97, train_loss: 0.1990, test_loss: 2.7086, test_f1: 0.5222
 epoch: 98, train_loss: 0.2175, test_loss: 2.5064, test_f1: 0.5432
 epoch: 99, train_loss: 0.2094, test_loss: 2.6260, test_f1: 0.5243
##################ITERATION #6 ****************************************
 epoch: 0, train_loss: 1.5761, test_loss: 1.2725, test_f1: 0.3719
 epoch: 1, train_loss: 1.2294, test_loss: 1.1819, test_f1: 0.4144
 epoch: 2, train_loss: 1.1185, test_loss: 1.0869, test_f1: 0.4291
 epoch: 3, train_loss: 1.0687, test_loss: 1.0439, test_f1: 0.4674
 epoch: 4, train_loss: 1.0299, test_loss: 1.0071, test_f1: 0.4681
 epoch: 5, train_loss: 0.9787, test_loss: 0.9837, test_f1: 0.5100
 epoch: 6, train_loss: 0.9602, test_loss: 0.9791, test_f1: 0.5255
 epoch: 7, train_loss: 0.9383, test_loss: 0.9712, test_f1: 0.5052
 epoch: 8, train_loss: 0.9089, test_loss: 1.0036, test_f1: 0.4983
 epoch: 9, train_loss: 0.8919, test_loss: 0.9546, test_f1: 0.5121
 epoch: 10, train_loss: 0.8735, test_loss: 1.1037, test_f1: 0.4799
 epoch: 11, train_loss: 0.8472, test_loss: 0.9591, test_f1: 0.5397
 epoch: 12, train_loss: 0.8113, test_loss: 1.0008, test_f1: 0.5284
 epoch: 13, train_loss: 0.7873, test_loss: 1.0489, test_f1: 0.4998
 epoch: 14, train_loss: 0.7886, test_loss: 1.0857, test_f1: 0.4951
 epoch: 15, train_loss: 0.7681, test_loss: 1.0328, test_f1: 0.5160
 epoch: 16, train_loss: 0.7413, test_loss: 1.1095, test_f1: 0.5074
 epoch: 17, train_loss: 0.7445, test_loss: 1.0849, test_f1: 0.5358
 epoch: 18, train_loss: 0.7173, test_loss: 1.1116, test_f1: 0.5111
 epoch: 19, train_loss: 0.7223, test_loss: 1.2447, test_f1: 0.4801
 epoch: 20, train_loss: 0.6982, test_loss: 1.1164, test_f1: 0.5129
 epoch: 21, train_loss: 0.6823, test_loss: 1.2009, test_f1: 0.5253
 epoch: 22, train_loss: 0.6561, test_loss: 1.2544, test_f1: 0.5035
 epoch: 23, train_loss: 0.6672, test_loss: 1.1547, test_f1: 0.5578
 epoch: 24, train_loss: 0.6425, test_loss: 1.2575, test_f1: 0.4988
 epoch: 25, train_loss: 0.6454, test_loss: 1.3209, test_f1: 0.5402
 epoch: 26, train_loss: 0.6342, test_loss: 1.3656, test_f1: 0.5147
 epoch: 27, train_loss: 0.6154, test_loss: 1.2994, test_f1: 0.5179
 epoch: 28, train_loss: 0.6113, test_loss: 1.2893, test_f1: 0.5181
 epoch: 29, train_loss: 0.6021, test_loss: 1.3181, test_f1: 0.5410
 epoch: 30, train_loss: 0.5829, test_loss: 1.3289, test_f1: 0.5497
 epoch: 31, train_loss: 0.5580, test_loss: 1.3667, test_f1: 0.5417
 epoch: 32, train_loss: 0.5586, test_loss: 1.4707, test_f1: 0.4867
 epoch: 33, train_loss: 0.5434, test_loss: 1.3212, test_f1: 0.5571
 epoch: 34, train_loss: 0.5217, test_loss: 1.4766, test_f1: 0.5155
 epoch: 35, train_loss: 0.5361, test_loss: 1.6119, test_f1: 0.4934
 epoch: 36, train_loss: 0.5114, test_loss: 1.6494, test_f1: 0.4965
 epoch: 37, train_loss: 0.5287, test_loss: 1.4079, test_f1: 0.5060
 epoch: 38, train_loss: 0.5238, test_loss: 1.3946, test_f1: 0.5135
 epoch: 39, train_loss: 0.4913, test_loss: 1.5361, test_f1: 0.5530
 epoch: 40, train_loss: 0.4837, test_loss: 1.8274, test_f1: 0.5141
 epoch: 41, train_loss: 0.4632, test_loss: 1.5324, test_f1: 0.5301
 epoch: 42, train_loss: 0.4720, test_loss: 1.7423, test_f1: 0.5032
 epoch: 43, train_loss: 0.4503, test_loss: 1.7811, test_f1: 0.4909
 epoch: 44, train_loss: 0.4584, test_loss: 1.7874, test_f1: 0.5150
 epoch: 45, train_loss: 0.4595, test_loss: 1.7479, test_f1: 0.5103
 epoch: 46, train_loss: 0.4627, test_loss: 1.4538, test_f1: 0.5252
 epoch: 47, train_loss: 0.4553, test_loss: 1.5419, test_f1: 0.5420
 epoch: 48, train_loss: 0.4487, test_loss: 1.8410, test_f1: 0.4961
 epoch: 49, train_loss: 0.4062, test_loss: 1.6515, test_f1: 0.5472
 epoch: 50, train_loss: 0.3854, test_loss: 1.7208, test_f1: 0.5303
 epoch: 51, train_loss: 0.3555, test_loss: 1.9259, test_f1: 0.5109
 epoch: 52, train_loss: 0.3361, test_loss: 1.8184, test_f1: 0.5356
 epoch: 53, train_loss: 0.3210, test_loss: 1.9849, test_f1: 0.5169
 epoch: 54, train_loss: 0.3152, test_loss: 2.0164, test_f1: 0.5105
 epoch: 55, train_loss: 0.3092, test_loss: 2.0004, test_f1: 0.5318
 epoch: 56, train_loss: 0.2879, test_loss: 2.0990, test_f1: 0.5343
 epoch: 57, train_loss: 0.2921, test_loss: 2.0359, test_f1: 0.5206
 epoch: 58, train_loss: 0.2681, test_loss: 2.2222, test_f1: 0.4985
 epoch: 59, train_loss: 0.2792, test_loss: 2.0851, test_f1: 0.5394
 epoch: 60, train_loss: 0.2728, test_loss: 2.1933, test_f1: 0.5295
 epoch: 61, train_loss: 0.2753, test_loss: 2.3845, test_f1: 0.5150
 epoch: 62, train_loss: 0.2870, test_loss: 2.3479, test_f1: 0.5029
 epoch: 63, train_loss: 0.2755, test_loss: 2.2253, test_f1: 0.4989
 epoch: 64, train_loss: 0.2804, test_loss: 2.2008, test_f1: 0.5200
 epoch: 65, train_loss: 0.2535, test_loss: 2.3569, test_f1: 0.5160
 epoch: 66, train_loss: 0.2518, test_loss: 2.4485, test_f1: 0.5119
 epoch: 67, train_loss: 0.2557, test_loss: 2.4101, test_f1: 0.5039
 epoch: 68, train_loss: 0.2642, test_loss: 2.3741, test_f1: 0.5171
 epoch: 69, train_loss: 0.2704, test_loss: 2.5632, test_f1: 0.5192
 epoch: 70, train_loss: 0.2398, test_loss: 2.3613, test_f1: 0.5412
 epoch: 71, train_loss: 0.2564, test_loss: 2.4432, test_f1: 0.5140
 epoch: 72, train_loss: 0.2464, test_loss: 2.4320, test_f1: 0.5100
 epoch: 73, train_loss: 0.2457, test_loss: 2.4056, test_f1: 0.5324
 epoch: 74, train_loss: 0.2680, test_loss: 2.6780, test_f1: 0.4937
 epoch: 75, train_loss: 0.2729, test_loss: 2.3914, test_f1: 0.5422
 epoch: 76, train_loss: 0.2420, test_loss: 2.4370, test_f1: 0.5253
 epoch: 77, train_loss: 0.2158, test_loss: 2.4385, test_f1: 0.5342
 epoch: 78, train_loss: 0.2326, test_loss: 2.3866, test_f1: 0.5300
 epoch: 79, train_loss: 0.2293, test_loss: 2.4549, test_f1: 0.5062
 epoch: 80, train_loss: 0.2203, test_loss: 2.5216, test_f1: 0.5090
 epoch: 81, train_loss: 0.2270, test_loss: 2.5924, test_f1: 0.5345
 epoch: 82, train_loss: 0.2205, test_loss: 2.4533, test_f1: 0.5302
 epoch: 83, train_loss: 0.2282, test_loss: 2.5576, test_f1: 0.5307
 epoch: 84, train_loss: 0.2153, test_loss: 2.5752, test_f1: 0.5184
 epoch: 85, train_loss: 0.2081, test_loss: 3.0393, test_f1: 0.4916
 epoch: 86, train_loss: 0.2149, test_loss: 2.5953, test_f1: 0.5197
 epoch: 87, train_loss: 0.2256, test_loss: 2.8118, test_f1: 0.4888
 epoch: 88, train_loss: 0.2178, test_loss: 2.5806, test_f1: 0.5152
 epoch: 89, train_loss: 0.2116, test_loss: 2.6046, test_f1: 0.5210
 epoch: 90, train_loss: 0.2149, test_loss: 2.9712, test_f1: 0.5103
 epoch: 91, train_loss: 0.2126, test_loss: 2.7670, test_f1: 0.5244
 epoch: 92, train_loss: 0.1943, test_loss: 2.8521, test_f1: 0.5212
 epoch: 93, train_loss: 0.1957, test_loss: 2.6480, test_f1: 0.5186
 epoch: 94, train_loss: 0.2051, test_loss: 2.9333, test_f1: 0.5194
 epoch: 95, train_loss: 0.2119, test_loss: 2.7772, test_f1: 0.5314
 epoch: 96, train_loss: 0.2093, test_loss: 2.6327, test_f1: 0.5290
 epoch: 97, train_loss: 0.1928, test_loss: 2.7195, test_f1: 0.5260
 epoch: 98, train_loss: 0.2010, test_loss: 3.0055, test_f1: 0.5264
 epoch: 99, train_loss: 0.2159, test_loss: 2.6113, test_f1: 0.4986
##################ITERATION #7 ****************************************
 epoch: 0, train_loss: 1.4850, test_loss: 1.3347, test_f1: 0.2970
 epoch: 1, train_loss: 1.1981, test_loss: 1.2118, test_f1: 0.3495
 epoch: 2, train_loss: 1.1018, test_loss: 1.1166, test_f1: 0.4383
 epoch: 3, train_loss: 1.0551, test_loss: 1.0524, test_f1: 0.4330
 epoch: 4, train_loss: 0.9980, test_loss: 0.9756, test_f1: 0.5220
 epoch: 5, train_loss: 0.9593, test_loss: 1.0185, test_f1: 0.4915
 epoch: 6, train_loss: 0.9357, test_loss: 0.9576, test_f1: 0.5460
 epoch: 7, train_loss: 0.9140, test_loss: 0.9841, test_f1: 0.4992
 epoch: 8, train_loss: 0.8865, test_loss: 0.9871, test_f1: 0.5226
 epoch: 9, train_loss: 0.8658, test_loss: 1.0615, test_f1: 0.5211
 epoch: 10, train_loss: 0.8544, test_loss: 1.0743, test_f1: 0.5085
 epoch: 11, train_loss: 0.8209, test_loss: 1.0250, test_f1: 0.5502
 epoch: 12, train_loss: 0.8081, test_loss: 1.0305, test_f1: 0.5182
 epoch: 13, train_loss: 0.7686, test_loss: 1.0986, test_f1: 0.5124
 epoch: 14, train_loss: 0.7622, test_loss: 1.1299, test_f1: 0.5461
 epoch: 15, train_loss: 0.7496, test_loss: 1.1044, test_f1: 0.5430
 epoch: 16, train_loss: 0.7392, test_loss: 0.9919, test_f1: 0.5952
 epoch: 17, train_loss: 0.7134, test_loss: 1.1462, test_f1: 0.5326
 epoch: 18, train_loss: 0.7001, test_loss: 1.1147, test_f1: 0.5585
 epoch: 19, train_loss: 0.6827, test_loss: 1.1423, test_f1: 0.5382
 epoch: 20, train_loss: 0.6788, test_loss: 1.1836, test_f1: 0.5450
 epoch: 21, train_loss: 0.6667, test_loss: 1.2463, test_f1: 0.5217
 epoch: 22, train_loss: 0.6675, test_loss: 1.1658, test_f1: 0.5752
 epoch: 23, train_loss: 0.6567, test_loss: 1.3491, test_f1: 0.5460
 epoch: 24, train_loss: 0.6601, test_loss: 1.4221, test_f1: 0.4972
 epoch: 25, train_loss: 0.6232, test_loss: 1.4215, test_f1: 0.5232
 epoch: 26, train_loss: 0.5954, test_loss: 1.3898, test_f1: 0.5387
 epoch: 27, train_loss: 0.5761, test_loss: 1.4164, test_f1: 0.5102
 epoch: 28, train_loss: 0.5720, test_loss: 1.4080, test_f1: 0.5279
 epoch: 29, train_loss: 0.5700, test_loss: 1.4293, test_f1: 0.5141
 epoch: 30, train_loss: 0.5554, test_loss: 1.6115, test_f1: 0.5199
 epoch: 31, train_loss: 0.5342, test_loss: 1.6830, test_f1: 0.5485
 epoch: 32, train_loss: 0.5426, test_loss: 1.5689, test_f1: 0.4806
 epoch: 33, train_loss: 0.5228, test_loss: 1.8147, test_f1: 0.5241
 epoch: 34, train_loss: 0.5188, test_loss: 1.6562, test_f1: 0.5301
 epoch: 35, train_loss: 0.4963, test_loss: 1.7925, test_f1: 0.5349
 epoch: 36, train_loss: 0.5153, test_loss: 1.6532, test_f1: 0.5524
 epoch: 37, train_loss: 0.5336, test_loss: 1.7726, test_f1: 0.5352
 epoch: 38, train_loss: 0.5082, test_loss: 1.4646, test_f1: 0.5646
 epoch: 39, train_loss: 0.4912, test_loss: 1.7289, test_f1: 0.5502
 epoch: 40, train_loss: 0.4615, test_loss: 2.0022, test_f1: 0.5459
 epoch: 41, train_loss: 0.4897, test_loss: 1.5435, test_f1: 0.5548
 epoch: 42, train_loss: 0.4796, test_loss: 1.5855, test_f1: 0.5414
 epoch: 43, train_loss: 0.4526, test_loss: 1.7383, test_f1: 0.5361
 epoch: 44, train_loss: 0.4609, test_loss: 1.9258, test_f1: 0.5314
 epoch: 45, train_loss: 0.4316, test_loss: 1.9283, test_f1: 0.5718
 epoch: 46, train_loss: 0.4255, test_loss: 1.8245, test_f1: 0.5424
 epoch: 47, train_loss: 0.4298, test_loss: 1.7363, test_f1: 0.5254
 epoch: 48, train_loss: 0.4299, test_loss: 1.6931, test_f1: 0.5518
 epoch: 49, train_loss: 0.4191, test_loss: 1.7768, test_f1: 0.5401
 epoch: 50, train_loss: 0.4016, test_loss: 1.7981, test_f1: 0.5573
 epoch: 51, train_loss: 0.3760, test_loss: 1.7273, test_f1: 0.5777
 epoch: 52, train_loss: 0.3267, test_loss: 1.8874, test_f1: 0.5635
 epoch: 53, train_loss: 0.2962, test_loss: 1.9557, test_f1: 0.5598
 epoch: 54, train_loss: 0.3039, test_loss: 1.9934, test_f1: 0.5541
 epoch: 55, train_loss: 0.2822, test_loss: 2.0908, test_f1: 0.5697
 epoch: 56, train_loss: 0.2905, test_loss: 2.1647, test_f1: 0.5354
 epoch: 57, train_loss: 0.2862, test_loss: 2.1332, test_f1: 0.5618
 epoch: 58, train_loss: 0.2790, test_loss: 2.2319, test_f1: 0.5225
 epoch: 59, train_loss: 0.2666, test_loss: 2.3282, test_f1: 0.5384
 epoch: 60, train_loss: 0.2674, test_loss: 2.2810, test_f1: 0.5588
 epoch: 61, train_loss: 0.2734, test_loss: 2.3058, test_f1: 0.5544
 epoch: 62, train_loss: 0.2569, test_loss: 2.5742, test_f1: 0.5077
 epoch: 63, train_loss: 0.2726, test_loss: 2.3415, test_f1: 0.5356
 epoch: 64, train_loss: 0.2729, test_loss: 2.3868, test_f1: 0.5534
 epoch: 65, train_loss: 0.2583, test_loss: 2.5246, test_f1: 0.5370
 epoch: 66, train_loss: 0.2602, test_loss: 2.5054, test_f1: 0.5252
 epoch: 67, train_loss: 0.2612, test_loss: 2.3456, test_f1: 0.5388
 epoch: 68, train_loss: 0.2612, test_loss: 2.4590, test_f1: 0.5345
 epoch: 69, train_loss: 0.2790, test_loss: 2.3926, test_f1: 0.5510
 epoch: 70, train_loss: 0.2560, test_loss: 2.4661, test_f1: 0.5162
 epoch: 71, train_loss: 0.2546, test_loss: 2.4437, test_f1: 0.5382
 epoch: 72, train_loss: 0.2511, test_loss: 2.4428, test_f1: 0.5473
 epoch: 73, train_loss: 0.2596, test_loss: 2.4127, test_f1: 0.5416
 epoch: 74, train_loss: 0.2365, test_loss: 2.2236, test_f1: 0.5638
 epoch: 75, train_loss: 0.2365, test_loss: 2.5527, test_f1: 0.5641
 epoch: 76, train_loss: 0.2207, test_loss: 2.6209, test_f1: 0.5368
 epoch: 77, train_loss: 0.2275, test_loss: 2.5551, test_f1: 0.5603
 epoch: 78, train_loss: 0.2393, test_loss: 2.5397, test_f1: 0.5642
 epoch: 79, train_loss: 0.2425, test_loss: 2.4525, test_f1: 0.5600
 epoch: 80, train_loss: 0.2199, test_loss: 2.6217, test_f1: 0.5473
 epoch: 81, train_loss: 0.2234, test_loss: 2.6297, test_f1: 0.5604
 epoch: 82, train_loss: 0.2292, test_loss: 2.6888, test_f1: 0.5433
 epoch: 83, train_loss: 0.2460, test_loss: 2.6722, test_f1: 0.5504
 epoch: 84, train_loss: 0.2247, test_loss: 2.9344, test_f1: 0.5325
 epoch: 85, train_loss: 0.2245, test_loss: 2.7427, test_f1: 0.5536
 epoch: 86, train_loss: 0.2093, test_loss: 2.9212, test_f1: 0.5307
 epoch: 87, train_loss: 0.2108, test_loss: 2.8168, test_f1: 0.5534
 epoch: 88, train_loss: 0.2082, test_loss: 2.7242, test_f1: 0.5340
 epoch: 89, train_loss: 0.2135, test_loss: 2.9345, test_f1: 0.5374
 epoch: 90, train_loss: 0.2092, test_loss: 2.8883, test_f1: 0.5317
 epoch: 91, train_loss: 0.2002, test_loss: 2.8282, test_f1: 0.5397
 epoch: 92, train_loss: 0.2013, test_loss: 2.6313, test_f1: 0.5364
 epoch: 93, train_loss: 0.2102, test_loss: 2.8981, test_f1: 0.5418
 epoch: 94, train_loss: 0.1994, test_loss: 3.1811, test_f1: 0.5178
 epoch: 95, train_loss: 0.2095, test_loss: 2.8838, test_f1: 0.5568
 epoch: 96, train_loss: 0.1885, test_loss: 3.0517, test_f1: 0.5338
 epoch: 97, train_loss: 0.2049, test_loss: 2.9160, test_f1: 0.5488
 epoch: 98, train_loss: 0.1907, test_loss: 3.0803, test_f1: 0.5086
 epoch: 99, train_loss: 0.1847, test_loss: 2.9652, test_f1: 0.5316
##################ITERATION #8 ****************************************
 epoch: 0, train_loss: 1.5756, test_loss: 1.2947, test_f1: 0.3243
 epoch: 1, train_loss: 1.2199, test_loss: 1.1847, test_f1: 0.3429
 epoch: 2, train_loss: 1.1307, test_loss: 1.1046, test_f1: 0.4649
 epoch: 3, train_loss: 1.0719, test_loss: 1.0324, test_f1: 0.5057
 epoch: 4, train_loss: 1.0285, test_loss: 1.0066, test_f1: 0.5223
 epoch: 5, train_loss: 0.9853, test_loss: 0.9667, test_f1: 0.5470
 epoch: 6, train_loss: 0.9526, test_loss: 0.9389, test_f1: 0.5315
 epoch: 7, train_loss: 0.9257, test_loss: 0.9527, test_f1: 0.5398
 epoch: 8, train_loss: 0.9015, test_loss: 0.9605, test_f1: 0.5220
 epoch: 9, train_loss: 0.8936, test_loss: 1.0404, test_f1: 0.4856
 epoch: 10, train_loss: 0.8790, test_loss: 0.9788, test_f1: 0.5183
 epoch: 11, train_loss: 0.8941, test_loss: 1.0284, test_f1: 0.4909
 epoch: 12, train_loss: 0.8603, test_loss: 1.0378, test_f1: 0.4776
 epoch: 13, train_loss: 0.8260, test_loss: 0.9848, test_f1: 0.5116
 epoch: 14, train_loss: 0.8042, test_loss: 1.1225, test_f1: 0.5160
 epoch: 15, train_loss: 0.8060, test_loss: 1.1100, test_f1: 0.5011
 epoch: 16, train_loss: 0.7878, test_loss: 1.1168, test_f1: 0.4924
 epoch: 17, train_loss: 0.7640, test_loss: 1.0884, test_f1: 0.5057
 epoch: 18, train_loss: 0.7687, test_loss: 1.2080, test_f1: 0.4900
 epoch: 19, train_loss: 0.7866, test_loss: 1.2037, test_f1: 0.4808
 epoch: 20, train_loss: 0.7458, test_loss: 1.0910, test_f1: 0.5051
 epoch: 21, train_loss: 0.7256, test_loss: 1.2732, test_f1: 0.4647
 epoch: 22, train_loss: 0.7324, test_loss: 1.1516, test_f1: 0.5325
 epoch: 23, train_loss: 0.7247, test_loss: 1.1058, test_f1: 0.5184
 epoch: 24, train_loss: 0.7388, test_loss: 1.2238, test_f1: 0.5064
 epoch: 25, train_loss: 0.7021, test_loss: 1.2899, test_f1: 0.4943
 epoch: 26, train_loss: 0.6878, test_loss: 1.1022, test_f1: 0.4980
 epoch: 27, train_loss: 0.6990, test_loss: 1.3809, test_f1: 0.5088
 epoch: 28, train_loss: 0.6707, test_loss: 1.1871, test_f1: 0.5177
 epoch: 29, train_loss: 0.6510, test_loss: 1.1896, test_f1: 0.5407
 epoch: 30, train_loss: 0.6352, test_loss: 1.2411, test_f1: 0.5054
 epoch: 31, train_loss: 0.6220, test_loss: 1.2329, test_f1: 0.5551
 epoch: 32, train_loss: 0.6081, test_loss: 1.3278, test_f1: 0.4916
 epoch: 33, train_loss: 0.6011, test_loss: 1.3916, test_f1: 0.5236
 epoch: 34, train_loss: 0.5964, test_loss: 1.2120, test_f1: 0.5216
 epoch: 35, train_loss: 0.5742, test_loss: 1.4985, test_f1: 0.5406
 epoch: 36, train_loss: 0.5777, test_loss: 1.4548, test_f1: 0.5286
 epoch: 37, train_loss: 0.5702, test_loss: 1.2262, test_f1: 0.5324
 epoch: 38, train_loss: 0.5613, test_loss: 1.6504, test_f1: 0.5026
 epoch: 39, train_loss: 0.5484, test_loss: 1.3202, test_f1: 0.5416
 epoch: 40, train_loss: 0.5579, test_loss: 1.4410, test_f1: 0.5448
 epoch: 41, train_loss: 0.5569, test_loss: 1.6157, test_f1: 0.5097
 epoch: 42, train_loss: 0.5422, test_loss: 1.3149, test_f1: 0.5252
 epoch: 43, train_loss: 0.5288, test_loss: 1.4189, test_f1: 0.5183
 epoch: 44, train_loss: 0.5566, test_loss: 1.4916, test_f1: 0.5208
 epoch: 45, train_loss: 0.5299, test_loss: 1.3816, test_f1: 0.5482
 epoch: 46, train_loss: 0.5045, test_loss: 1.7239, test_f1: 0.5371
 epoch: 47, train_loss: 0.4858, test_loss: 1.4776, test_f1: 0.5486
 epoch: 48, train_loss: 0.4812, test_loss: 1.6294, test_f1: 0.5371
 epoch: 49, train_loss: 0.4955, test_loss: 1.5023, test_f1: 0.5386
 epoch: 50, train_loss: 0.4641, test_loss: 1.5577, test_f1: 0.5183
 epoch: 51, train_loss: 0.4274, test_loss: 1.6190, test_f1: 0.5603
 epoch: 52, train_loss: 0.4043, test_loss: 1.6420, test_f1: 0.5501
 epoch: 53, train_loss: 0.3870, test_loss: 1.7269, test_f1: 0.5362
 epoch: 54, train_loss: 0.3799, test_loss: 1.8193, test_f1: 0.5348
 epoch: 55, train_loss: 0.3531, test_loss: 1.8974, test_f1: 0.5553
 epoch: 56, train_loss: 0.3616, test_loss: 1.8461, test_f1: 0.5372
 epoch: 57, train_loss: 0.3594, test_loss: 1.8361, test_f1: 0.5416
 epoch: 58, train_loss: 0.3883, test_loss: 2.0152, test_f1: 0.5387
 epoch: 59, train_loss: 0.3730, test_loss: 1.9555, test_f1: 0.5387
 epoch: 60, train_loss: 0.3594, test_loss: 1.7633, test_f1: 0.5468
 epoch: 61, train_loss: 0.3490, test_loss: 1.8646, test_f1: 0.5268
 epoch: 62, train_loss: 0.3396, test_loss: 1.9618, test_f1: 0.5382
 epoch: 63, train_loss: 0.3292, test_loss: 2.1390, test_f1: 0.5546
 epoch: 64, train_loss: 0.3333, test_loss: 1.9523, test_f1: 0.5280
 epoch: 65, train_loss: 0.3250, test_loss: 1.8507, test_f1: 0.5435
 epoch: 66, train_loss: 0.3409, test_loss: 2.1504, test_f1: 0.5305
 epoch: 67, train_loss: 0.3273, test_loss: 2.0421, test_f1: 0.5468
 epoch: 68, train_loss: 0.3182, test_loss: 1.8150, test_f1: 0.5572
 epoch: 69, train_loss: 0.3010, test_loss: 2.1378, test_f1: 0.5505
 epoch: 70, train_loss: 0.3199, test_loss: 2.0332, test_f1: 0.5353
 epoch: 71, train_loss: 0.3100, test_loss: 2.0833, test_f1: 0.5328
 epoch: 72, train_loss: 0.3030, test_loss: 1.9987, test_f1: 0.5430
 epoch: 73, train_loss: 0.3061, test_loss: 2.1691, test_f1: 0.5252
 epoch: 74, train_loss: 0.2969, test_loss: 2.0194, test_f1: 0.5508
 epoch: 75, train_loss: 0.3122, test_loss: 2.2262, test_f1: 0.5428
 epoch: 76, train_loss: 0.2736, test_loss: 2.1279, test_f1: 0.5115
 epoch: 77, train_loss: 0.2620, test_loss: 2.2305, test_f1: 0.5317
 epoch: 78, train_loss: 0.3003, test_loss: 2.3187, test_f1: 0.5440
 epoch: 79, train_loss: 0.3173, test_loss: 2.1276, test_f1: 0.5618
 epoch: 80, train_loss: 0.3184, test_loss: 2.2857, test_f1: 0.5334
 epoch: 81, train_loss: 0.2937, test_loss: 2.1709, test_f1: 0.5365
 epoch: 82, train_loss: 0.2839, test_loss: 2.1734, test_f1: 0.5579
 epoch: 83, train_loss: 0.2925, test_loss: 2.3572, test_f1: 0.5322
 epoch: 84, train_loss: 0.2671, test_loss: 2.4951, test_f1: 0.5316
 epoch: 85, train_loss: 0.2781, test_loss: 2.1091, test_f1: 0.5523
 epoch: 86, train_loss: 0.2835, test_loss: 2.3360, test_f1: 0.5389
 epoch: 87, train_loss: 0.2680, test_loss: 2.1781, test_f1: 0.5466
 epoch: 88, train_loss: 0.2582, test_loss: 2.2632, test_f1: 0.5502
 epoch: 89, train_loss: 0.2557, test_loss: 2.3985, test_f1: 0.5286
 epoch: 90, train_loss: 0.2632, test_loss: 2.2435, test_f1: 0.5364
 epoch: 91, train_loss: 0.2925, test_loss: 1.9865, test_f1: 0.5590
 epoch: 92, train_loss: 0.2895, test_loss: 2.5027, test_f1: 0.5321
 epoch: 93, train_loss: 0.2732, test_loss: 2.1452, test_f1: 0.5466
 epoch: 94, train_loss: 0.2796, test_loss: 2.4103, test_f1: 0.5288
 epoch: 95, train_loss: 0.2467, test_loss: 2.4007, test_f1: 0.5536
 epoch: 96, train_loss: 0.2453, test_loss: 2.2345, test_f1: 0.5697
 epoch: 97, train_loss: 0.2523, test_loss: 2.4799, test_f1: 0.5427
 epoch: 98, train_loss: 0.2763, test_loss: 2.3108, test_f1: 0.5501
 epoch: 99, train_loss: 0.2457, test_loss: 2.3750, test_f1: 0.5163
##################ITERATION #9 ****************************************
 epoch: 0, train_loss: 1.5418, test_loss: 1.2914, test_f1: 0.2555
 epoch: 1, train_loss: 1.2153, test_loss: 1.1773, test_f1: 0.4074
 epoch: 2, train_loss: 1.1169, test_loss: 1.1206, test_f1: 0.4282
 epoch: 3, train_loss: 1.0595, test_loss: 1.0629, test_f1: 0.4357
 epoch: 4, train_loss: 1.0191, test_loss: 1.0520, test_f1: 0.4563
 epoch: 5, train_loss: 1.0022, test_loss: 0.9603, test_f1: 0.5073
 epoch: 6, train_loss: 0.9807, test_loss: 0.9607, test_f1: 0.4714
 epoch: 7, train_loss: 0.9476, test_loss: 0.9852, test_f1: 0.4784
 epoch: 8, train_loss: 0.9371, test_loss: 1.0137, test_f1: 0.4684
 epoch: 9, train_loss: 0.8908, test_loss: 1.0808, test_f1: 0.5257
 epoch: 10, train_loss: 0.8783, test_loss: 1.0247, test_f1: 0.5008
 epoch: 11, train_loss: 0.8745, test_loss: 1.0064, test_f1: 0.5075
 epoch: 12, train_loss: 0.8534, test_loss: 0.9954, test_f1: 0.5792
 epoch: 13, train_loss: 0.8413, test_loss: 1.1147, test_f1: 0.4781
 epoch: 14, train_loss: 0.8265, test_loss: 1.0572, test_f1: 0.4908
 epoch: 15, train_loss: 0.7973, test_loss: 1.0393, test_f1: 0.5113
 epoch: 16, train_loss: 0.7729, test_loss: 1.1287, test_f1: 0.5144
 epoch: 17, train_loss: 0.7619, test_loss: 1.0459, test_f1: 0.5402
 epoch: 18, train_loss: 0.7659, test_loss: 1.0902, test_f1: 0.5055
 epoch: 19, train_loss: 0.7355, test_loss: 1.1639, test_f1: 0.4775
 epoch: 20, train_loss: 0.7480, test_loss: 1.1057, test_f1: 0.4771
 epoch: 21, train_loss: 0.7290, test_loss: 1.2063, test_f1: 0.5026
 epoch: 22, train_loss: 0.7145, test_loss: 1.3614, test_f1: 0.4895
 epoch: 23, train_loss: 0.7186, test_loss: 1.2695, test_f1: 0.5341
 epoch: 24, train_loss: 0.6877, test_loss: 1.2904, test_f1: 0.5182
 epoch: 25, train_loss: 0.6679, test_loss: 1.2985, test_f1: 0.5048
 epoch: 26, train_loss: 0.6451, test_loss: 1.4087, test_f1: 0.4885
 epoch: 27, train_loss: 0.6376, test_loss: 1.3544, test_f1: 0.5029
 epoch: 28, train_loss: 0.6412, test_loss: 1.3672, test_f1: 0.5388
 epoch: 29, train_loss: 0.6463, test_loss: 1.4158, test_f1: 0.5314
 epoch: 30, train_loss: 0.6092, test_loss: 1.4142, test_f1: 0.5211
 epoch: 31, train_loss: 0.5995, test_loss: 1.4309, test_f1: 0.5257
 epoch: 32, train_loss: 0.5836, test_loss: 1.3638, test_f1: 0.5545
 epoch: 33, train_loss: 0.5823, test_loss: 1.3278, test_f1: 0.5349
 epoch: 34, train_loss: 0.5706, test_loss: 1.5119, test_f1: 0.5349
 epoch: 35, train_loss: 0.5889, test_loss: 1.5071, test_f1: 0.5601
 epoch: 36, train_loss: 0.5671, test_loss: 1.4904, test_f1: 0.5116
 epoch: 37, train_loss: 0.5603, test_loss: 1.4258, test_f1: 0.5441
 epoch: 38, train_loss: 0.5554, test_loss: 1.6594, test_f1: 0.5073
 epoch: 39, train_loss: 0.5264, test_loss: 1.4430, test_f1: 0.5582
 epoch: 40, train_loss: 0.5187, test_loss: 1.6617, test_f1: 0.5096
 epoch: 41, train_loss: 0.5318, test_loss: 1.6677, test_f1: 0.5525
 epoch: 42, train_loss: 0.5310, test_loss: 1.6563, test_f1: 0.5353
 epoch: 43, train_loss: 0.5142, test_loss: 1.6789, test_f1: 0.5358
 epoch: 44, train_loss: 0.4855, test_loss: 1.6189, test_f1: 0.5304
 epoch: 45, train_loss: 0.4971, test_loss: 1.8124, test_f1: 0.5331
 epoch: 46, train_loss: 0.4939, test_loss: 1.6314, test_f1: 0.5605
 epoch: 47, train_loss: 0.4729, test_loss: 1.7272, test_f1: 0.5159
 epoch: 48, train_loss: 0.4968, test_loss: 1.7074, test_f1: 0.5307
 epoch: 49, train_loss: 0.4653, test_loss: 1.5576, test_f1: 0.5436
 epoch: 50, train_loss: 0.4590, test_loss: 1.7824, test_f1: 0.5583
 epoch: 51, train_loss: 0.4114, test_loss: 1.6737, test_f1: 0.5323
 epoch: 52, train_loss: 0.3836, test_loss: 1.8047, test_f1: 0.5417
 epoch: 53, train_loss: 0.3678, test_loss: 1.8764, test_f1: 0.5477
 epoch: 54, train_loss: 0.3405, test_loss: 1.9491, test_f1: 0.5449
 epoch: 55, train_loss: 0.3531, test_loss: 1.9620, test_f1: 0.5309
 epoch: 56, train_loss: 0.3492, test_loss: 1.9425, test_f1: 0.5320
 epoch: 57, train_loss: 0.3654, test_loss: 2.0602, test_f1: 0.5450
 epoch: 58, train_loss: 0.3438, test_loss: 2.0094, test_f1: 0.5385
 epoch: 59, train_loss: 0.3372, test_loss: 2.0261, test_f1: 0.5522
 epoch: 60, train_loss: 0.3347, test_loss: 2.1588, test_f1: 0.5213
 epoch: 61, train_loss: 0.3223, test_loss: 2.1231, test_f1: 0.5550
 epoch: 62, train_loss: 0.3134, test_loss: 2.0316, test_f1: 0.5523
 epoch: 63, train_loss: 0.3271, test_loss: 2.0243, test_f1: 0.5574
 epoch: 64, train_loss: 0.3139, test_loss: 2.1670, test_f1: 0.5471
 epoch: 65, train_loss: 0.2995, test_loss: 2.1286, test_f1: 0.5354
 epoch: 66, train_loss: 0.2876, test_loss: 2.0978, test_f1: 0.5253
 epoch: 67, train_loss: 0.2949, test_loss: 2.1362, test_f1: 0.5247
 epoch: 68, train_loss: 0.2786, test_loss: 2.2755, test_f1: 0.5218
 epoch: 69, train_loss: 0.2915, test_loss: 2.2929, test_f1: 0.5345
 epoch: 70, train_loss: 0.2717, test_loss: 2.2851, test_f1: 0.5490
 epoch: 71, train_loss: 0.2898, test_loss: 2.4827, test_f1: 0.5147
 epoch: 72, train_loss: 0.2986, test_loss: 2.3009, test_f1: 0.5298
 epoch: 73, train_loss: 0.2786, test_loss: 2.3060, test_f1: 0.5123
 epoch: 74, train_loss: 0.2782, test_loss: 2.3409, test_f1: 0.5311
 epoch: 75, train_loss: 0.2930, test_loss: 2.2990, test_f1: 0.5491
 epoch: 76, train_loss: 0.2717, test_loss: 2.3067, test_f1: 0.5374
 epoch: 77, train_loss: 0.2806, test_loss: 2.4899, test_f1: 0.5208
 epoch: 78, train_loss: 0.2668, test_loss: 2.3823, test_f1: 0.5334
 epoch: 79, train_loss: 0.2671, test_loss: 2.4259, test_f1: 0.5227
 epoch: 80, train_loss: 0.2679, test_loss: 2.3235, test_f1: 0.5448
 epoch: 81, train_loss: 0.2795, test_loss: 2.5338, test_f1: 0.5027
 epoch: 82, train_loss: 0.2573, test_loss: 2.3199, test_f1: 0.5409
 epoch: 83, train_loss: 0.2572, test_loss: 2.2894, test_f1: 0.5308
 epoch: 84, train_loss: 0.2211, test_loss: 2.4857, test_f1: 0.5286
 epoch: 85, train_loss: 0.2289, test_loss: 2.6628, test_f1: 0.5315
 epoch: 86, train_loss: 0.2606, test_loss: 2.5151, test_f1: 0.5380
 epoch: 87, train_loss: 0.2646, test_loss: 2.3378, test_f1: 0.5519
 epoch: 88, train_loss: 0.2663, test_loss: 2.5360, test_f1: 0.5462
 epoch: 89, train_loss: 0.2608, test_loss: 2.4725, test_f1: 0.5443
 epoch: 90, train_loss: 0.2574, test_loss: 2.4009, test_f1: 0.5441
 epoch: 91, train_loss: 0.2425, test_loss: 2.5518, test_f1: 0.5139
 epoch: 92, train_loss: 0.2515, test_loss: 2.5926, test_f1: 0.5231
 epoch: 93, train_loss: 0.2339, test_loss: 2.6066, test_f1: 0.5519
 epoch: 94, train_loss: 0.2303, test_loss: 2.7986, test_f1: 0.5133
 epoch: 95, train_loss: 0.2105, test_loss: 2.5947, test_f1: 0.5380
 epoch: 96, train_loss: 0.2111, test_loss: 2.7285, test_f1: 0.5467
 epoch: 97, train_loss: 0.2243, test_loss: 2.7532, test_f1: 0.5184
 epoch: 98, train_loss: 0.2387, test_loss: 2.5530, test_f1: 0.5567
 epoch: 99, train_loss: 0.2249, test_loss: 2.4560, test_f1: 0.5619

Training completed in 413.89 seconds
Best F1: 0.5952 at epoch 16
Mean F1 across iterations: 0.5706  0.0110
========================FINAL RESULTS================================
FEGIN weighted F1: 0.5952  0.0110
python main.py --data ltspice_examples --representation component_component --model FEGIN --layers 5 --hiddens 128 --batch_size 256 --lr 0.001 --emb_size 512 --epochs 100 --save_appendix component_component_L5_H128_BS256_LR0.001_E512 --no_val
-----



STDERR:
  File "main.py", line 370, in <module>
    main()
  File "main.py", line 254, in main
    dataset = dataset_class(
  File "/home/philip/projects/ltspice_examples_code_repo/Circuit-Completion-Using-GNNs/component_classification_with_link_prediction_head/evaluation/FEGIN/kernel/circuit_datasets.py", line 15, in __init__
    self.data, self.slices = torch.load(self.processed_paths[0])
  File "/home/philip/.local/lib/python3.8/site-packages/torch/serialization.py", line 1040, in load
    warnings.warn(
  File "/usr/lib/python3.8/warnings.py", line 109, in _showwarnmsg
    sw(msg.message, msg.category, msg.filename, msg.lineno,
  File "main.py", line 47, in warn_with_traceback
    traceback.print_stack(file=log)
/home/philip/projects/ltspice_examples_code_repo/Circuit-Completion-Using-GNNs/component_classification_with_link_prediction_head/evaluation/FEGIN/kernel/circuit_datasets.py:15: FutureWarning: You are using `torch.load` with `weights_only=False` (the current default value), which uses the default pickle module implicitly. It is possible to construct malicious pickle data which will execute arbitrary code during unpickling (See https://github.com/pytorch/pytorch/blob/main/SECURITY.md#untrusted-models for more details). In a future release, the default value for `weights_only` will be flipped to `True`. This limits the functions that could be executed during unpickling. Arbitrary objects will no longer be allowed to be loaded via this mode unless they are explicitly allowlisted by the user via `torch.serialization.add_safe_globals`. We recommend you start setting `weights_only=True` for any use case where you don't have full control of the loaded file. Please open an issue on GitHub for any issues related to this experimental feature.
  self.data, self.slices = torch.load(self.processed_paths[0])
