STDOUT:
Results will be saved in /home/philip/projects/ltspice_examples_code_repo/Circuit-Completion-Using-GNNs/component_classification_with_link_prediction_head/evaluation/FEGIN/results/model_FEGIN_dataset_ltspice_examples
Command line input: python main.py --data ltspice_examples --representation component_component --model FEGIN --layers 3 --hiddens 16 --batch_size 256 --lr 0.001 --emb_size 128 --epochs 100 --save_appendix component_component_L3_H16_BS256_LR0.001_E128 --no_val
 is saved.
-----
ltspice_examples - FEGIN
Using 3 layers, 16 hidden units, h = 2
Loading component_component representation dataset
ENTERED
Training FEGIN on component_component representation
Train: 3556, Test: 845
##################ITERATION #0 ****************************************
 epoch: 0, train_loss: 1.3529, test_loss: 1.3466, test_f1: 0.2274
 epoch: 1, train_loss: 1.3288, test_loss: 1.3299, test_f1: 0.2274
 epoch: 2, train_loss: 1.3120, test_loss: 1.3086, test_f1: 0.2274
 epoch: 3, train_loss: 1.2965, test_loss: 1.2915, test_f1: 0.2274
 epoch: 4, train_loss: 1.2840, test_loss: 1.2821, test_f1: 0.2274
 epoch: 5, train_loss: 1.2761, test_loss: 1.2745, test_f1: 0.2274
 epoch: 6, train_loss: 1.2614, test_loss: 1.2631, test_f1: 0.2274
 epoch: 7, train_loss: 1.2526, test_loss: 1.2493, test_f1: 0.3016
 epoch: 8, train_loss: 1.2460, test_loss: 1.2378, test_f1: 0.3443
 epoch: 9, train_loss: 1.2364, test_loss: 1.2270, test_f1: 0.3457
 epoch: 10, train_loss: 1.2343, test_loss: 1.2213, test_f1: 0.3340
 epoch: 11, train_loss: 1.2208, test_loss: 1.2129, test_f1: 0.3374
 epoch: 12, train_loss: 1.2132, test_loss: 1.2037, test_f1: 0.3411
 epoch: 13, train_loss: 1.2023, test_loss: 1.1972, test_f1: 0.3412
 epoch: 14, train_loss: 1.1976, test_loss: 1.1931, test_f1: 0.3366
 epoch: 15, train_loss: 1.1924, test_loss: 1.1815, test_f1: 0.3654
 epoch: 16, train_loss: 1.1919, test_loss: 1.1800, test_f1: 0.3531
 epoch: 17, train_loss: 1.1795, test_loss: 1.1756, test_f1: 0.3556
 epoch: 18, train_loss: 1.1688, test_loss: 1.1720, test_f1: 0.3405
 epoch: 19, train_loss: 1.1695, test_loss: 1.1722, test_f1: 0.3464
 epoch: 20, train_loss: 1.1628, test_loss: 1.1691, test_f1: 0.3475
 epoch: 21, train_loss: 1.1567, test_loss: 1.1566, test_f1: 0.3466
 epoch: 22, train_loss: 1.1470, test_loss: 1.1539, test_f1: 0.3496
 epoch: 23, train_loss: 1.1430, test_loss: 1.1553, test_f1: 0.3451
 epoch: 24, train_loss: 1.1431, test_loss: 1.1451, test_f1: 0.3603
 epoch: 25, train_loss: 1.1282, test_loss: 1.1434, test_f1: 0.4008
 epoch: 26, train_loss: 1.1199, test_loss: 1.1383, test_f1: 0.4208
 epoch: 27, train_loss: 1.1163, test_loss: 1.1317, test_f1: 0.4308
 epoch: 28, train_loss: 1.1150, test_loss: 1.1314, test_f1: 0.4361
 epoch: 29, train_loss: 1.1037, test_loss: 1.1203, test_f1: 0.4352
 epoch: 30, train_loss: 1.0972, test_loss: 1.1175, test_f1: 0.4468
 epoch: 31, train_loss: 1.0915, test_loss: 1.1001, test_f1: 0.4476
 epoch: 32, train_loss: 1.0817, test_loss: 1.0954, test_f1: 0.4509
 epoch: 33, train_loss: 1.0669, test_loss: 1.0917, test_f1: 0.4451
 epoch: 34, train_loss: 1.0785, test_loss: 1.1121, test_f1: 0.4398
 epoch: 35, train_loss: 1.0782, test_loss: 1.0889, test_f1: 0.4573
 epoch: 36, train_loss: 1.0684, test_loss: 1.0855, test_f1: 0.4471
 epoch: 37, train_loss: 1.0616, test_loss: 1.0822, test_f1: 0.4391
 epoch: 38, train_loss: 1.0528, test_loss: 1.0650, test_f1: 0.4397
 epoch: 39, train_loss: 1.0462, test_loss: 1.0623, test_f1: 0.4488
 epoch: 40, train_loss: 1.0357, test_loss: 1.0599, test_f1: 0.4488
 epoch: 41, train_loss: 1.0316, test_loss: 1.0578, test_f1: 0.4466
 epoch: 42, train_loss: 1.0378, test_loss: 1.0470, test_f1: 0.4666
 epoch: 43, train_loss: 1.0265, test_loss: 1.0445, test_f1: 0.4773
 epoch: 44, train_loss: 1.0163, test_loss: 1.0531, test_f1: 0.4740
 epoch: 45, train_loss: 1.0134, test_loss: 1.0386, test_f1: 0.4603
 epoch: 46, train_loss: 1.0164, test_loss: 1.0405, test_f1: 0.4686
 epoch: 47, train_loss: 1.0039, test_loss: 1.0261, test_f1: 0.4854
 epoch: 48, train_loss: 1.0097, test_loss: 1.0352, test_f1: 0.4742
 epoch: 49, train_loss: 1.0002, test_loss: 1.0150, test_f1: 0.5151
 epoch: 50, train_loss: 0.9930, test_loss: 1.0303, test_f1: 0.4779
 epoch: 51, train_loss: 0.9891, test_loss: 1.0175, test_f1: 0.5080
 epoch: 52, train_loss: 0.9839, test_loss: 1.0099, test_f1: 0.5112
 epoch: 53, train_loss: 0.9816, test_loss: 1.0184, test_f1: 0.5021
 epoch: 54, train_loss: 0.9695, test_loss: 1.0053, test_f1: 0.5076
 epoch: 55, train_loss: 0.9750, test_loss: 1.0083, test_f1: 0.5043
 epoch: 56, train_loss: 0.9760, test_loss: 1.0175, test_f1: 0.5160
 epoch: 57, train_loss: 0.9754, test_loss: 1.0075, test_f1: 0.5144
 epoch: 58, train_loss: 0.9672, test_loss: 1.0089, test_f1: 0.5135
 epoch: 59, train_loss: 0.9644, test_loss: 1.0036, test_f1: 0.5153
 epoch: 60, train_loss: 0.9688, test_loss: 1.0196, test_f1: 0.4921
 epoch: 61, train_loss: 0.9580, test_loss: 0.9968, test_f1: 0.5227
 epoch: 62, train_loss: 0.9655, test_loss: 0.9991, test_f1: 0.5176
 epoch: 63, train_loss: 0.9557, test_loss: 1.0131, test_f1: 0.4813
 epoch: 64, train_loss: 0.9560, test_loss: 0.9981, test_f1: 0.5016
 epoch: 65, train_loss: 0.9547, test_loss: 1.0018, test_f1: 0.4873
 epoch: 66, train_loss: 0.9522, test_loss: 0.9964, test_f1: 0.5032
 epoch: 67, train_loss: 0.9545, test_loss: 0.9996, test_f1: 0.5036
 epoch: 68, train_loss: 0.9522, test_loss: 0.9923, test_f1: 0.5084
 epoch: 69, train_loss: 0.9519, test_loss: 0.9973, test_f1: 0.5157
 epoch: 70, train_loss: 0.9569, test_loss: 0.9933, test_f1: 0.5189
 epoch: 71, train_loss: 0.9400, test_loss: 0.9862, test_f1: 0.5196
 epoch: 72, train_loss: 0.9390, test_loss: 0.9930, test_f1: 0.5077
 epoch: 73, train_loss: 0.9423, test_loss: 1.0073, test_f1: 0.4888
 epoch: 74, train_loss: 0.9426, test_loss: 0.9896, test_f1: 0.5031
 epoch: 75, train_loss: 0.9366, test_loss: 0.9959, test_f1: 0.5024
 epoch: 76, train_loss: 0.9396, test_loss: 0.9892, test_f1: 0.4991
 epoch: 77, train_loss: 0.9422, test_loss: 0.9726, test_f1: 0.5191
 epoch: 78, train_loss: 0.9410, test_loss: 0.9590, test_f1: 0.5174
 epoch: 79, train_loss: 0.9285, test_loss: 0.9758, test_f1: 0.5122
 epoch: 80, train_loss: 0.9205, test_loss: 0.9878, test_f1: 0.4981
 epoch: 81, train_loss: 0.9290, test_loss: 0.9902, test_f1: 0.4986
 epoch: 82, train_loss: 0.9261, test_loss: 0.9763, test_f1: 0.5173
 epoch: 83, train_loss: 0.9249, test_loss: 0.9633, test_f1: 0.5247
 epoch: 84, train_loss: 0.9300, test_loss: 0.9674, test_f1: 0.5200
 epoch: 85, train_loss: 0.9193, test_loss: 0.9884, test_f1: 0.5084
 epoch: 86, train_loss: 0.9165, test_loss: 0.9733, test_f1: 0.5084
 epoch: 87, train_loss: 0.9169, test_loss: 0.9616, test_f1: 0.5043
 epoch: 88, train_loss: 0.9166, test_loss: 0.9663, test_f1: 0.5170
 epoch: 89, train_loss: 0.9100, test_loss: 0.9779, test_f1: 0.5135
 epoch: 90, train_loss: 0.9146, test_loss: 0.9802, test_f1: 0.5005
 epoch: 91, train_loss: 0.9098, test_loss: 0.9714, test_f1: 0.5043
 epoch: 92, train_loss: 0.9104, test_loss: 0.9837, test_f1: 0.4983
 epoch: 93, train_loss: 0.9102, test_loss: 1.0006, test_f1: 0.4768
 epoch: 94, train_loss: 0.9016, test_loss: 0.9822, test_f1: 0.4966
 epoch: 95, train_loss: 0.9070, test_loss: 0.9839, test_f1: 0.5143
 epoch: 96, train_loss: 0.9016, test_loss: 0.9692, test_f1: 0.5117
 epoch: 97, train_loss: 0.9017, test_loss: 0.9819, test_f1: 0.5173
 epoch: 98, train_loss: 0.9079, test_loss: 0.9963, test_f1: 0.4819
 epoch: 99, train_loss: 0.8956, test_loss: 0.9923, test_f1: 0.4880
##################ITERATION #1 ****************************************
 epoch: 0, train_loss: 1.3761, test_loss: 1.3746, test_f1: 0.2274
 epoch: 1, train_loss: 1.3283, test_loss: 1.3460, test_f1: 0.2274
 epoch: 2, train_loss: 1.3016, test_loss: 1.3063, test_f1: 0.2555
 epoch: 3, train_loss: 1.2848, test_loss: 1.2778, test_f1: 0.2555
 epoch: 4, train_loss: 1.2662, test_loss: 1.2601, test_f1: 0.2549
 epoch: 5, train_loss: 1.2549, test_loss: 1.2414, test_f1: 0.2614
 epoch: 6, train_loss: 1.2361, test_loss: 1.2196, test_f1: 0.3078
 epoch: 7, train_loss: 1.2301, test_loss: 1.2087, test_f1: 0.3224
 epoch: 8, train_loss: 1.2191, test_loss: 1.2018, test_f1: 0.3324
 epoch: 9, train_loss: 1.2113, test_loss: 1.1868, test_f1: 0.3416
 epoch: 10, train_loss: 1.2000, test_loss: 1.1826, test_f1: 0.3621
 epoch: 11, train_loss: 1.1928, test_loss: 1.1713, test_f1: 0.3995
 epoch: 12, train_loss: 1.1854, test_loss: 1.1599, test_f1: 0.3938
 epoch: 13, train_loss: 1.1789, test_loss: 1.1556, test_f1: 0.4074
 epoch: 14, train_loss: 1.1726, test_loss: 1.1541, test_f1: 0.4139
 epoch: 15, train_loss: 1.1710, test_loss: 1.1497, test_f1: 0.4057
 epoch: 16, train_loss: 1.1606, test_loss: 1.1495, test_f1: 0.4111
 epoch: 17, train_loss: 1.1527, test_loss: 1.1409, test_f1: 0.4109
 epoch: 18, train_loss: 1.1547, test_loss: 1.1404, test_f1: 0.4144
 epoch: 19, train_loss: 1.1449, test_loss: 1.1386, test_f1: 0.4197
 epoch: 20, train_loss: 1.1409, test_loss: 1.1259, test_f1: 0.4218
 epoch: 21, train_loss: 1.1315, test_loss: 1.1297, test_f1: 0.4279
 epoch: 22, train_loss: 1.1294, test_loss: 1.1231, test_f1: 0.4261
 epoch: 23, train_loss: 1.1294, test_loss: 1.1181, test_f1: 0.4231
 epoch: 24, train_loss: 1.1236, test_loss: 1.1078, test_f1: 0.4570
 epoch: 25, train_loss: 1.1176, test_loss: 1.1178, test_f1: 0.4379
 epoch: 26, train_loss: 1.1093, test_loss: 1.1064, test_f1: 0.4397
 epoch: 27, train_loss: 1.1112, test_loss: 1.1054, test_f1: 0.4481
 epoch: 28, train_loss: 1.1034, test_loss: 1.0973, test_f1: 0.4522
 epoch: 29, train_loss: 1.1017, test_loss: 1.0799, test_f1: 0.4645
 epoch: 30, train_loss: 1.0935, test_loss: 1.3686, test_f1: 0.4237
 epoch: 31, train_loss: 1.1018, test_loss: 1.0953, test_f1: 0.4420
 epoch: 32, train_loss: 1.0934, test_loss: 1.0730, test_f1: 0.4520
 epoch: 33, train_loss: 1.0858, test_loss: 1.0663, test_f1: 0.4650
 epoch: 34, train_loss: 1.0754, test_loss: 1.0775, test_f1: 0.4647
 epoch: 35, train_loss: 1.0800, test_loss: 1.0664, test_f1: 0.4627
 epoch: 36, train_loss: 1.0715, test_loss: 1.0753, test_f1: 0.4634
 epoch: 37, train_loss: 1.0767, test_loss: 1.0611, test_f1: 0.4619
 epoch: 38, train_loss: 1.0588, test_loss: 1.0557, test_f1: 0.4804
 epoch: 39, train_loss: 1.0631, test_loss: 1.0745, test_f1: 0.4602
 epoch: 40, train_loss: 1.0587, test_loss: 1.0646, test_f1: 0.4669
 epoch: 41, train_loss: 1.0546, test_loss: 1.0501, test_f1: 0.4691
 epoch: 42, train_loss: 1.0421, test_loss: 1.0894, test_f1: 0.4763
 epoch: 43, train_loss: 1.0448, test_loss: 1.0397, test_f1: 0.4750
 epoch: 44, train_loss: 1.0437, test_loss: 1.0766, test_f1: 0.4490
 epoch: 45, train_loss: 1.0466, test_loss: 1.0579, test_f1: 0.4692
 epoch: 46, train_loss: 1.0456, test_loss: 1.0359, test_f1: 0.4779
 epoch: 47, train_loss: 1.0384, test_loss: 1.0438, test_f1: 0.4830
 epoch: 48, train_loss: 1.0293, test_loss: 1.0612, test_f1: 0.4526
 epoch: 49, train_loss: 1.0376, test_loss: 1.0759, test_f1: 0.4549
 epoch: 50, train_loss: 1.0280, test_loss: 1.0301, test_f1: 0.4969
 epoch: 51, train_loss: 1.0235, test_loss: 1.0447, test_f1: 0.4839
 epoch: 52, train_loss: 1.0232, test_loss: 1.0260, test_f1: 0.4791
 epoch: 53, train_loss: 1.0118, test_loss: 1.0386, test_f1: 0.4781
 epoch: 54, train_loss: 1.0112, test_loss: 1.0451, test_f1: 0.4619
 epoch: 55, train_loss: 1.0138, test_loss: 1.0355, test_f1: 0.4702
 epoch: 56, train_loss: 1.0202, test_loss: 1.0400, test_f1: 0.4797
 epoch: 57, train_loss: 1.0176, test_loss: 1.0207, test_f1: 0.4901
 epoch: 58, train_loss: 1.0072, test_loss: 1.0305, test_f1: 0.4740
 epoch: 59, train_loss: 1.0067, test_loss: 1.0399, test_f1: 0.4795
 epoch: 60, train_loss: 1.0074, test_loss: 1.0312, test_f1: 0.4836
 epoch: 61, train_loss: 1.0084, test_loss: 1.0158, test_f1: 0.4765
 epoch: 62, train_loss: 1.0003, test_loss: 1.0287, test_f1: 0.4668
 epoch: 63, train_loss: 0.9970, test_loss: 1.0271, test_f1: 0.4832
 epoch: 64, train_loss: 1.0101, test_loss: 1.0307, test_f1: 0.4748
 epoch: 65, train_loss: 1.0024, test_loss: 1.0335, test_f1: 0.4755
 epoch: 66, train_loss: 1.0007, test_loss: 1.0223, test_f1: 0.4786
 epoch: 67, train_loss: 1.0048, test_loss: 1.0333, test_f1: 0.4823
 epoch: 68, train_loss: 1.0004, test_loss: 1.0251, test_f1: 0.4867
 epoch: 69, train_loss: 0.9914, test_loss: 1.0181, test_f1: 0.4885
 epoch: 70, train_loss: 0.9889, test_loss: 1.0339, test_f1: 0.4767
 epoch: 71, train_loss: 0.9897, test_loss: 1.0150, test_f1: 0.4834
 epoch: 72, train_loss: 0.9861, test_loss: 1.0449, test_f1: 0.4747
 epoch: 73, train_loss: 0.9928, test_loss: 1.0140, test_f1: 0.4813
 epoch: 74, train_loss: 0.9855, test_loss: 1.0137, test_f1: 0.4802
 epoch: 75, train_loss: 0.9749, test_loss: 1.0012, test_f1: 0.4888
 epoch: 76, train_loss: 0.9797, test_loss: 1.0158, test_f1: 0.4705
 epoch: 77, train_loss: 0.9854, test_loss: 1.0194, test_f1: 0.4820
 epoch: 78, train_loss: 0.9837, test_loss: 1.0121, test_f1: 0.4751
 epoch: 79, train_loss: 0.9862, test_loss: 1.0214, test_f1: 0.4788
 epoch: 80, train_loss: 0.9723, test_loss: 1.0056, test_f1: 0.4833
 epoch: 81, train_loss: 0.9855, test_loss: 1.0091, test_f1: 0.4909
 epoch: 82, train_loss: 0.9756, test_loss: 1.0171, test_f1: 0.4756
 epoch: 83, train_loss: 0.9791, test_loss: 1.0088, test_f1: 0.4774
 epoch: 84, train_loss: 0.9708, test_loss: 1.0139, test_f1: 0.4902
 epoch: 85, train_loss: 0.9702, test_loss: 1.0008, test_f1: 0.4844
 epoch: 86, train_loss: 0.9666, test_loss: 1.0200, test_f1: 0.4794
 epoch: 87, train_loss: 0.9724, test_loss: 1.0096, test_f1: 0.4939
 epoch: 88, train_loss: 0.9805, test_loss: 1.0133, test_f1: 0.4899
 epoch: 89, train_loss: 0.9645, test_loss: 1.0214, test_f1: 0.4754
 epoch: 90, train_loss: 0.9749, test_loss: 1.0023, test_f1: 0.4957
 epoch: 91, train_loss: 0.9693, test_loss: 1.0044, test_f1: 0.4865
 epoch: 92, train_loss: 0.9714, test_loss: 1.0101, test_f1: 0.4878
 epoch: 93, train_loss: 0.9662, test_loss: 0.9910, test_f1: 0.4907
 epoch: 94, train_loss: 0.9559, test_loss: 1.0209, test_f1: 0.4816
 epoch: 95, train_loss: 0.9606, test_loss: 1.0084, test_f1: 0.4892
 epoch: 96, train_loss: 0.9574, test_loss: 1.0128, test_f1: 0.4802
 epoch: 97, train_loss: 0.9648, test_loss: 0.9954, test_f1: 0.5037
 epoch: 98, train_loss: 0.9610, test_loss: 1.0135, test_f1: 0.4794
 epoch: 99, train_loss: 0.9552, test_loss: 1.0002, test_f1: 0.4760
##################ITERATION #2 ****************************************
 epoch: 0, train_loss: 1.3512, test_loss: 1.3389, test_f1: 0.2274
 epoch: 1, train_loss: 1.2993, test_loss: 1.3104, test_f1: 0.2274
 epoch: 2, train_loss: 1.2758, test_loss: 1.2836, test_f1: 0.2274
 epoch: 3, train_loss: 1.2618, test_loss: 1.2565, test_f1: 0.2274
 epoch: 4, train_loss: 1.2562, test_loss: 1.2382, test_f1: 0.2274
 epoch: 5, train_loss: 1.2392, test_loss: 1.2250, test_f1: 0.2540
 epoch: 6, train_loss: 1.2334, test_loss: 1.2171, test_f1: 0.2742
 epoch: 7, train_loss: 1.2238, test_loss: 1.2020, test_f1: 0.2903
 epoch: 8, train_loss: 1.2189, test_loss: 1.1964, test_f1: 0.3152
 epoch: 9, train_loss: 1.2090, test_loss: 1.1899, test_f1: 0.3168
 epoch: 10, train_loss: 1.2031, test_loss: 1.1710, test_f1: 0.3401
 epoch: 11, train_loss: 1.1994, test_loss: 1.2067, test_f1: 0.3685
 epoch: 12, train_loss: 1.1896, test_loss: 1.1564, test_f1: 0.4053
 epoch: 13, train_loss: 1.1888, test_loss: 1.1634, test_f1: 0.4138
 epoch: 14, train_loss: 1.1819, test_loss: 1.1421, test_f1: 0.4049
 epoch: 15, train_loss: 1.1684, test_loss: 1.1384, test_f1: 0.4396
 epoch: 16, train_loss: 1.1621, test_loss: 1.1296, test_f1: 0.4512
 epoch: 17, train_loss: 1.1535, test_loss: 1.1434, test_f1: 0.4386
 epoch: 18, train_loss: 1.1507, test_loss: 1.1147, test_f1: 0.4434
 epoch: 19, train_loss: 1.1496, test_loss: 1.1177, test_f1: 0.4256
 epoch: 20, train_loss: 1.1427, test_loss: 1.0967, test_f1: 0.4779
 epoch: 21, train_loss: 1.1416, test_loss: 1.1076, test_f1: 0.4309
 epoch: 22, train_loss: 1.1318, test_loss: 1.0961, test_f1: 0.4473
 epoch: 23, train_loss: 1.1302, test_loss: 1.0927, test_f1: 0.4367
 epoch: 24, train_loss: 1.1234, test_loss: 1.1073, test_f1: 0.4200
 epoch: 25, train_loss: 1.1188, test_loss: 1.0944, test_f1: 0.4364
 epoch: 26, train_loss: 1.1151, test_loss: 1.0967, test_f1: 0.4204
 epoch: 27, train_loss: 1.1024, test_loss: 1.0650, test_f1: 0.4550
 epoch: 28, train_loss: 1.1067, test_loss: 1.0635, test_f1: 0.4343
 epoch: 29, train_loss: 1.1001, test_loss: 1.0792, test_f1: 0.4372
 epoch: 30, train_loss: 1.0908, test_loss: 1.0486, test_f1: 0.4818
 epoch: 31, train_loss: 1.0884, test_loss: 1.0423, test_f1: 0.4472
 epoch: 32, train_loss: 1.0867, test_loss: 1.0691, test_f1: 0.4284
 epoch: 33, train_loss: 1.0816, test_loss: 1.0482, test_f1: 0.4563
 epoch: 34, train_loss: 1.0778, test_loss: 1.0362, test_f1: 0.4684
 epoch: 35, train_loss: 1.0758, test_loss: 1.0480, test_f1: 0.4556
 epoch: 36, train_loss: 1.0728, test_loss: 1.0195, test_f1: 0.4775
 epoch: 37, train_loss: 1.0734, test_loss: 1.0398, test_f1: 0.4612
 epoch: 38, train_loss: 1.0676, test_loss: 1.0237, test_f1: 0.4670
 epoch: 39, train_loss: 1.0682, test_loss: 1.0259, test_f1: 0.4673
 epoch: 40, train_loss: 1.0597, test_loss: 1.0175, test_f1: 0.4825
 epoch: 41, train_loss: 1.0495, test_loss: 1.0090, test_f1: 0.4807
 epoch: 42, train_loss: 1.0502, test_loss: 1.0531, test_f1: 0.4616
 epoch: 43, train_loss: 1.0433, test_loss: 1.0060, test_f1: 0.4766
 epoch: 44, train_loss: 1.0377, test_loss: 1.0095, test_f1: 0.4654
 epoch: 45, train_loss: 1.0382, test_loss: 1.0168, test_f1: 0.4697
 epoch: 46, train_loss: 1.0426, test_loss: 1.0054, test_f1: 0.4746
 epoch: 47, train_loss: 1.0371, test_loss: 1.0083, test_f1: 0.4870
 epoch: 48, train_loss: 1.0272, test_loss: 1.0029, test_f1: 0.4798
 epoch: 49, train_loss: 1.0241, test_loss: 0.9945, test_f1: 0.4902
 epoch: 50, train_loss: 1.0252, test_loss: 0.9865, test_f1: 0.4867
 epoch: 51, train_loss: 1.0255, test_loss: 0.9939, test_f1: 0.4885
 epoch: 52, train_loss: 1.0122, test_loss: 0.9922, test_f1: 0.4939
 epoch: 53, train_loss: 1.0083, test_loss: 1.0174, test_f1: 0.4847
 epoch: 54, train_loss: 1.0072, test_loss: 0.9942, test_f1: 0.4925
 epoch: 55, train_loss: 1.0069, test_loss: 1.0002, test_f1: 0.5000
 epoch: 56, train_loss: 1.0099, test_loss: 0.9842, test_f1: 0.5148
 epoch: 57, train_loss: 1.0032, test_loss: 0.9924, test_f1: 0.5016
 epoch: 58, train_loss: 1.0085, test_loss: 0.9939, test_f1: 0.4896
 epoch: 59, train_loss: 1.0081, test_loss: 0.9851, test_f1: 0.5007
 epoch: 60, train_loss: 1.0069, test_loss: 1.0031, test_f1: 0.4968
 epoch: 61, train_loss: 1.0008, test_loss: 0.9924, test_f1: 0.4984
 epoch: 62, train_loss: 0.9998, test_loss: 0.9756, test_f1: 0.4981
 epoch: 63, train_loss: 0.9910, test_loss: 1.0011, test_f1: 0.4932
 epoch: 64, train_loss: 0.9957, test_loss: 0.9809, test_f1: 0.4889
 epoch: 65, train_loss: 1.0051, test_loss: 0.9807, test_f1: 0.4891
 epoch: 66, train_loss: 0.9915, test_loss: 0.9997, test_f1: 0.4863
 epoch: 67, train_loss: 1.0106, test_loss: 0.9791, test_f1: 0.5146
 epoch: 68, train_loss: 0.9864, test_loss: 0.9929, test_f1: 0.5169
 epoch: 69, train_loss: 0.9828, test_loss: 0.9817, test_f1: 0.4905
 epoch: 70, train_loss: 0.9876, test_loss: 0.9810, test_f1: 0.5111
 epoch: 71, train_loss: 0.9947, test_loss: 0.9752, test_f1: 0.4878
 epoch: 72, train_loss: 0.9801, test_loss: 0.9803, test_f1: 0.4979
 epoch: 73, train_loss: 0.9835, test_loss: 0.9809, test_f1: 0.5080
 epoch: 74, train_loss: 0.9848, test_loss: 0.9923, test_f1: 0.4897
 epoch: 75, train_loss: 0.9776, test_loss: 0.9847, test_f1: 0.4834
 epoch: 76, train_loss: 0.9879, test_loss: 0.9950, test_f1: 0.5220
 epoch: 77, train_loss: 0.9773, test_loss: 0.9957, test_f1: 0.5133
 epoch: 78, train_loss: 0.9840, test_loss: 0.9890, test_f1: 0.4843
 epoch: 79, train_loss: 0.9954, test_loss: 0.9864, test_f1: 0.5126
 epoch: 80, train_loss: 0.9688, test_loss: 0.9778, test_f1: 0.5207
 epoch: 81, train_loss: 0.9757, test_loss: 0.9981, test_f1: 0.4902
 epoch: 82, train_loss: 0.9769, test_loss: 1.0016, test_f1: 0.5099
 epoch: 83, train_loss: 0.9807, test_loss: 1.0158, test_f1: 0.5130
 epoch: 84, train_loss: 0.9809, test_loss: 0.9835, test_f1: 0.5082
 epoch: 85, train_loss: 0.9696, test_loss: 0.9901, test_f1: 0.5087
 epoch: 86, train_loss: 0.9819, test_loss: 0.9964, test_f1: 0.5007
 epoch: 87, train_loss: 0.9693, test_loss: 1.0238, test_f1: 0.4859
 epoch: 88, train_loss: 0.9701, test_loss: 1.0039, test_f1: 0.4861
 epoch: 89, train_loss: 0.9647, test_loss: 0.9767, test_f1: 0.4933
 epoch: 90, train_loss: 0.9667, test_loss: 0.9784, test_f1: 0.5067
 epoch: 91, train_loss: 0.9650, test_loss: 1.0138, test_f1: 0.5074
 epoch: 92, train_loss: 0.9646, test_loss: 0.9748, test_f1: 0.5019
 epoch: 93, train_loss: 0.9644, test_loss: 0.9867, test_f1: 0.4910
 epoch: 94, train_loss: 0.9604, test_loss: 1.0160, test_f1: 0.5032
 epoch: 95, train_loss: 0.9613, test_loss: 0.9952, test_f1: 0.4986
 epoch: 96, train_loss: 0.9713, test_loss: 0.9816, test_f1: 0.5250
 epoch: 97, train_loss: 0.9670, test_loss: 0.9818, test_f1: 0.5125
 epoch: 98, train_loss: 0.9604, test_loss: 0.9862, test_f1: 0.5146
 epoch: 99, train_loss: 0.9573, test_loss: 0.9924, test_f1: 0.5101
##################ITERATION #3 ****************************************
 epoch: 0, train_loss: 1.4800, test_loss: 1.4638, test_f1: 0.1635
 epoch: 1, train_loss: 1.3305, test_loss: 1.3576, test_f1: 0.2307
 epoch: 2, train_loss: 1.3045, test_loss: 1.3121, test_f1: 0.2274
 epoch: 3, train_loss: 1.2803, test_loss: 1.2845, test_f1: 0.2274
 epoch: 4, train_loss: 1.2742, test_loss: 1.2561, test_f1: 0.2274
 epoch: 5, train_loss: 1.2625, test_loss: 1.2371, test_f1: 0.2276
 epoch: 6, train_loss: 1.2476, test_loss: 1.2242, test_f1: 0.2690
 epoch: 7, train_loss: 1.2441, test_loss: 1.2138, test_f1: 0.2909
 epoch: 8, train_loss: 1.2296, test_loss: 1.2079, test_f1: 0.3116
 epoch: 9, train_loss: 1.2254, test_loss: 1.1956, test_f1: 0.3301
 epoch: 10, train_loss: 1.2171, test_loss: 1.1833, test_f1: 0.3405
 epoch: 11, train_loss: 1.2089, test_loss: 1.1731, test_f1: 0.3578
 epoch: 12, train_loss: 1.1989, test_loss: 1.1629, test_f1: 0.3644
 epoch: 13, train_loss: 1.1961, test_loss: 1.1508, test_f1: 0.3744
 epoch: 14, train_loss: 1.1825, test_loss: 1.1452, test_f1: 0.3783
 epoch: 15, train_loss: 1.1764, test_loss: 1.1405, test_f1: 0.3772
 epoch: 16, train_loss: 1.1733, test_loss: 1.1271, test_f1: 0.4049
 epoch: 17, train_loss: 1.1588, test_loss: 1.1177, test_f1: 0.4087
 epoch: 18, train_loss: 1.1504, test_loss: 1.1133, test_f1: 0.4031
 epoch: 19, train_loss: 1.1533, test_loss: 1.1052, test_f1: 0.4111
 epoch: 20, train_loss: 1.1436, test_loss: 1.0974, test_f1: 0.4313
 epoch: 21, train_loss: 1.1336, test_loss: 1.0910, test_f1: 0.4282
 epoch: 22, train_loss: 1.1274, test_loss: 1.0920, test_f1: 0.4175
 epoch: 23, train_loss: 1.1254, test_loss: 1.0923, test_f1: 0.4194
 epoch: 24, train_loss: 1.1189, test_loss: 1.0795, test_f1: 0.4186
 epoch: 25, train_loss: 1.1155, test_loss: 1.0758, test_f1: 0.4227
 epoch: 26, train_loss: 1.1101, test_loss: 1.0758, test_f1: 0.4219
 epoch: 27, train_loss: 1.1067, test_loss: 1.0673, test_f1: 0.4320
 epoch: 28, train_loss: 1.0904, test_loss: 1.0585, test_f1: 0.4311
 epoch: 29, train_loss: 1.0929, test_loss: 1.0619, test_f1: 0.4214
 epoch: 30, train_loss: 1.0783, test_loss: 1.0618, test_f1: 0.4209
 epoch: 31, train_loss: 1.0852, test_loss: 1.0556, test_f1: 0.4251
 epoch: 32, train_loss: 1.0782, test_loss: 1.0437, test_f1: 0.4423
 epoch: 33, train_loss: 1.0736, test_loss: 1.0602, test_f1: 0.4277
 epoch: 34, train_loss: 1.0666, test_loss: 1.0442, test_f1: 0.4347
 epoch: 35, train_loss: 1.0659, test_loss: 1.0476, test_f1: 0.4295
 epoch: 36, train_loss: 1.0538, test_loss: 1.0364, test_f1: 0.4313
 epoch: 37, train_loss: 1.0470, test_loss: 1.0440, test_f1: 0.4349
 epoch: 38, train_loss: 1.0418, test_loss: 1.0262, test_f1: 0.4388
 epoch: 39, train_loss: 1.0451, test_loss: 1.0541, test_f1: 0.4286
 epoch: 40, train_loss: 1.0420, test_loss: 1.0280, test_f1: 0.4335
 epoch: 41, train_loss: 1.0301, test_loss: 1.0309, test_f1: 0.4343
 epoch: 42, train_loss: 1.0337, test_loss: 1.0472, test_f1: 0.4398
 epoch: 43, train_loss: 1.0231, test_loss: 1.0496, test_f1: 0.4379
 epoch: 44, train_loss: 1.0242, test_loss: 1.0283, test_f1: 0.4336
 epoch: 45, train_loss: 1.0259, test_loss: 1.0176, test_f1: 0.4390
 epoch: 46, train_loss: 1.0225, test_loss: 1.0491, test_f1: 0.4323
 epoch: 47, train_loss: 1.0187, test_loss: 1.0334, test_f1: 0.4487
 epoch: 48, train_loss: 1.0068, test_loss: 1.0451, test_f1: 0.4361
 epoch: 49, train_loss: 1.0089, test_loss: 1.0283, test_f1: 0.4459
 epoch: 50, train_loss: 1.0084, test_loss: 1.0141, test_f1: 0.4408
 epoch: 51, train_loss: 1.0038, test_loss: 1.0229, test_f1: 0.4540
 epoch: 52, train_loss: 1.0030, test_loss: 1.0300, test_f1: 0.4378
 epoch: 53, train_loss: 0.9997, test_loss: 1.0317, test_f1: 0.4382
 epoch: 54, train_loss: 1.0031, test_loss: 1.0315, test_f1: 0.4391
 epoch: 55, train_loss: 0.9949, test_loss: 1.0276, test_f1: 0.4468
 epoch: 56, train_loss: 0.9954, test_loss: 1.0383, test_f1: 0.4399
 epoch: 57, train_loss: 0.9918, test_loss: 1.0332, test_f1: 0.4443
 epoch: 58, train_loss: 0.9919, test_loss: 1.0418, test_f1: 0.4456
 epoch: 59, train_loss: 0.9900, test_loss: 1.0308, test_f1: 0.4434
 epoch: 60, train_loss: 0.9912, test_loss: 1.0285, test_f1: 0.4464
 epoch: 61, train_loss: 0.9778, test_loss: 1.0335, test_f1: 0.4382
 epoch: 62, train_loss: 0.9849, test_loss: 1.0219, test_f1: 0.4549
 epoch: 63, train_loss: 0.9751, test_loss: 1.0181, test_f1: 0.4459
 epoch: 64, train_loss: 0.9817, test_loss: 1.0170, test_f1: 0.4507
 epoch: 65, train_loss: 0.9763, test_loss: 1.0296, test_f1: 0.4398
 epoch: 66, train_loss: 0.9755, test_loss: 1.0276, test_f1: 0.4473
 epoch: 67, train_loss: 0.9745, test_loss: 1.0295, test_f1: 0.4452
 epoch: 68, train_loss: 0.9683, test_loss: 1.0326, test_f1: 0.4416
 epoch: 69, train_loss: 0.9699, test_loss: 1.0166, test_f1: 0.4472
 epoch: 70, train_loss: 0.9766, test_loss: 1.0201, test_f1: 0.4487
 epoch: 71, train_loss: 0.9774, test_loss: 1.0128, test_f1: 0.4503
 epoch: 72, train_loss: 0.9674, test_loss: 1.0161, test_f1: 0.4450
 epoch: 73, train_loss: 0.9624, test_loss: 1.0344, test_f1: 0.4475
 epoch: 74, train_loss: 0.9745, test_loss: 1.0327, test_f1: 0.4465
 epoch: 75, train_loss: 0.9732, test_loss: 1.0109, test_f1: 0.4470
 epoch: 76, train_loss: 0.9624, test_loss: 1.0391, test_f1: 0.4469
 epoch: 77, train_loss: 0.9568, test_loss: 1.0407, test_f1: 0.4499
 epoch: 78, train_loss: 0.9674, test_loss: 1.0275, test_f1: 0.4576
 epoch: 79, train_loss: 0.9697, test_loss: 1.0211, test_f1: 0.4559
 epoch: 80, train_loss: 0.9643, test_loss: 1.0223, test_f1: 0.4507
 epoch: 81, train_loss: 0.9582, test_loss: 1.0327, test_f1: 0.4539
 epoch: 82, train_loss: 0.9586, test_loss: 1.0465, test_f1: 0.4521
 epoch: 83, train_loss: 0.9637, test_loss: 1.0414, test_f1: 0.4548
 epoch: 84, train_loss: 0.9541, test_loss: 1.0282, test_f1: 0.4537
 epoch: 85, train_loss: 0.9546, test_loss: 1.0386, test_f1: 0.4495
 epoch: 86, train_loss: 0.9545, test_loss: 1.0212, test_f1: 0.4574
 epoch: 87, train_loss: 0.9475, test_loss: 1.0320, test_f1: 0.4506
 epoch: 88, train_loss: 0.9510, test_loss: 1.0369, test_f1: 0.4556
 epoch: 89, train_loss: 0.9475, test_loss: 1.0322, test_f1: 0.4457
 epoch: 90, train_loss: 0.9455, test_loss: 1.0271, test_f1: 0.4657
 epoch: 91, train_loss: 0.9502, test_loss: 1.0392, test_f1: 0.4554
 epoch: 92, train_loss: 0.9465, test_loss: 1.0400, test_f1: 0.4537
 epoch: 93, train_loss: 0.9540, test_loss: 1.0346, test_f1: 0.4592
 epoch: 94, train_loss: 0.9446, test_loss: 1.0455, test_f1: 0.4683
 epoch: 95, train_loss: 0.9427, test_loss: 1.0355, test_f1: 0.4572
 epoch: 96, train_loss: 0.9460, test_loss: 1.0309, test_f1: 0.4600
 epoch: 97, train_loss: 0.9382, test_loss: 1.0072, test_f1: 0.4567
 epoch: 98, train_loss: 0.9422, test_loss: 1.0305, test_f1: 0.4622
 epoch: 99, train_loss: 0.9399, test_loss: 1.0343, test_f1: 0.4585
##################ITERATION #4 ****************************************
 epoch: 0, train_loss: 1.3461, test_loss: 1.3206, test_f1: 0.2274
 epoch: 1, train_loss: 1.2824, test_loss: 1.2905, test_f1: 0.2332
 epoch: 2, train_loss: 1.2635, test_loss: 1.2526, test_f1: 0.2497
 epoch: 3, train_loss: 1.2460, test_loss: 1.2273, test_f1: 0.2869
 epoch: 4, train_loss: 1.2363, test_loss: 1.2106, test_f1: 0.2919
 epoch: 5, train_loss: 1.2305, test_loss: 1.1976, test_f1: 0.3455
 epoch: 6, train_loss: 1.2188, test_loss: 1.1843, test_f1: 0.3677
 epoch: 7, train_loss: 1.2060, test_loss: 1.1743, test_f1: 0.3857
 epoch: 8, train_loss: 1.2014, test_loss: 1.1625, test_f1: 0.4094
 epoch: 9, train_loss: 1.1937, test_loss: 1.1473, test_f1: 0.3994
 epoch: 10, train_loss: 1.1819, test_loss: 1.1365, test_f1: 0.4256
 epoch: 11, train_loss: 1.1707, test_loss: 1.1314, test_f1: 0.4319
 epoch: 12, train_loss: 1.1711, test_loss: 1.1094, test_f1: 0.4254
 epoch: 13, train_loss: 1.1460, test_loss: 1.1040, test_f1: 0.4343
 epoch: 14, train_loss: 1.1384, test_loss: 1.0982, test_f1: 0.4478
 epoch: 15, train_loss: 1.1371, test_loss: 1.0815, test_f1: 0.4542
 epoch: 16, train_loss: 1.1311, test_loss: 1.0707, test_f1: 0.4648
 epoch: 17, train_loss: 1.1202, test_loss: 1.0671, test_f1: 0.4652
 epoch: 18, train_loss: 1.1153, test_loss: 1.0542, test_f1: 0.4648
 epoch: 19, train_loss: 1.1133, test_loss: 1.0448, test_f1: 0.4618
 epoch: 20, train_loss: 1.1007, test_loss: 1.0343, test_f1: 0.4620
 epoch: 21, train_loss: 1.0825, test_loss: 1.0351, test_f1: 0.4520
 epoch: 22, train_loss: 1.0917, test_loss: 1.0334, test_f1: 0.4598
 epoch: 23, train_loss: 1.0728, test_loss: 1.0313, test_f1: 0.4518
 epoch: 24, train_loss: 1.0780, test_loss: 1.0255, test_f1: 0.4547
 epoch: 25, train_loss: 1.0647, test_loss: 1.0172, test_f1: 0.4598
 epoch: 26, train_loss: 1.0498, test_loss: 1.0061, test_f1: 0.4832
 epoch: 27, train_loss: 1.0534, test_loss: 1.0077, test_f1: 0.4707
 epoch: 28, train_loss: 1.0565, test_loss: 0.9992, test_f1: 0.4520
 epoch: 29, train_loss: 1.0415, test_loss: 1.0116, test_f1: 0.4820
 epoch: 30, train_loss: 1.0420, test_loss: 0.9946, test_f1: 0.4616
 epoch: 31, train_loss: 1.0316, test_loss: 0.9938, test_f1: 0.4549
 epoch: 32, train_loss: 1.0337, test_loss: 0.9922, test_f1: 0.4749
 epoch: 33, train_loss: 1.0177, test_loss: 0.9904, test_f1: 0.4657
 epoch: 34, train_loss: 1.0272, test_loss: 0.9744, test_f1: 0.4643
 epoch: 35, train_loss: 1.0181, test_loss: 0.9885, test_f1: 0.4606
 epoch: 36, train_loss: 1.0134, test_loss: 0.9858, test_f1: 0.4553
 epoch: 37, train_loss: 1.0307, test_loss: 0.9823, test_f1: 0.4723
 epoch: 38, train_loss: 1.0088, test_loss: 0.9787, test_f1: 0.4690
 epoch: 39, train_loss: 1.0140, test_loss: 0.9659, test_f1: 0.4763
 epoch: 40, train_loss: 0.9999, test_loss: 0.9790, test_f1: 0.4652
 epoch: 41, train_loss: 1.0008, test_loss: 0.9703, test_f1: 0.4668
 epoch: 42, train_loss: 0.9908, test_loss: 0.9897, test_f1: 0.4566
 epoch: 43, train_loss: 1.0072, test_loss: 0.9684, test_f1: 0.4784
 epoch: 44, train_loss: 0.9934, test_loss: 0.9738, test_f1: 0.4734
 epoch: 45, train_loss: 0.9914, test_loss: 0.9770, test_f1: 0.4685
 epoch: 46, train_loss: 0.9761, test_loss: 0.9613, test_f1: 0.4829
 epoch: 47, train_loss: 0.9853, test_loss: 0.9534, test_f1: 0.4982
 epoch: 48, train_loss: 0.9836, test_loss: 0.9614, test_f1: 0.5094
 epoch: 49, train_loss: 0.9771, test_loss: 0.9666, test_f1: 0.4788
 epoch: 50, train_loss: 0.9716, test_loss: 0.9553, test_f1: 0.4877
 epoch: 51, train_loss: 0.9741, test_loss: 0.9550, test_f1: 0.4833
 epoch: 52, train_loss: 0.9650, test_loss: 0.9618, test_f1: 0.4884
 epoch: 53, train_loss: 0.9697, test_loss: 0.9598, test_f1: 0.4842
 epoch: 54, train_loss: 0.9733, test_loss: 0.9580, test_f1: 0.4756
 epoch: 55, train_loss: 0.9668, test_loss: 0.9619, test_f1: 0.4898
 epoch: 56, train_loss: 0.9576, test_loss: 0.9550, test_f1: 0.5057
 epoch: 57, train_loss: 0.9589, test_loss: 0.9729, test_f1: 0.4912
 epoch: 58, train_loss: 0.9579, test_loss: 0.9598, test_f1: 0.4851
 epoch: 59, train_loss: 0.9546, test_loss: 0.9726, test_f1: 0.4800
 epoch: 60, train_loss: 0.9514, test_loss: 0.9673, test_f1: 0.4947
 epoch: 61, train_loss: 0.9589, test_loss: 0.9602, test_f1: 0.4983
 epoch: 62, train_loss: 0.9449, test_loss: 0.9579, test_f1: 0.4854
 epoch: 63, train_loss: 0.9628, test_loss: 0.9527, test_f1: 0.4795
 epoch: 64, train_loss: 0.9486, test_loss: 0.9659, test_f1: 0.4807
 epoch: 65, train_loss: 0.9576, test_loss: 0.9641, test_f1: 0.4817
 epoch: 66, train_loss: 0.9571, test_loss: 0.9655, test_f1: 0.4678
 epoch: 67, train_loss: 0.9527, test_loss: 0.9724, test_f1: 0.4880
 epoch: 68, train_loss: 0.9539, test_loss: 0.9661, test_f1: 0.4929
 epoch: 69, train_loss: 0.9492, test_loss: 0.9611, test_f1: 0.4865
 epoch: 70, train_loss: 0.9452, test_loss: 0.9668, test_f1: 0.4987
 epoch: 71, train_loss: 0.9437, test_loss: 0.9638, test_f1: 0.4837
 epoch: 72, train_loss: 0.9513, test_loss: 0.9681, test_f1: 0.5058
 epoch: 73, train_loss: 0.9420, test_loss: 0.9745, test_f1: 0.5123
 epoch: 74, train_loss: 0.9473, test_loss: 0.9650, test_f1: 0.5178
 epoch: 75, train_loss: 0.9339, test_loss: 0.9622, test_f1: 0.5023
 epoch: 76, train_loss: 0.9408, test_loss: 0.9658, test_f1: 0.4932
 epoch: 77, train_loss: 0.9519, test_loss: 0.9581, test_f1: 0.5212
 epoch: 78, train_loss: 0.9374, test_loss: 0.9655, test_f1: 0.5092
 epoch: 79, train_loss: 0.9438, test_loss: 0.9608, test_f1: 0.5082
 epoch: 80, train_loss: 0.9344, test_loss: 0.9693, test_f1: 0.4993
 epoch: 81, train_loss: 0.9391, test_loss: 0.9693, test_f1: 0.5122
 epoch: 82, train_loss: 0.9218, test_loss: 0.9568, test_f1: 0.5012
 epoch: 83, train_loss: 0.9324, test_loss: 0.9658, test_f1: 0.5144
 epoch: 84, train_loss: 0.9342, test_loss: 0.9647, test_f1: 0.5048
 epoch: 85, train_loss: 0.9405, test_loss: 0.9596, test_f1: 0.5176
 epoch: 86, train_loss: 0.9402, test_loss: 0.9622, test_f1: 0.5192
 epoch: 87, train_loss: 0.9331, test_loss: 0.9861, test_f1: 0.5052
 epoch: 88, train_loss: 0.9281, test_loss: 0.9673, test_f1: 0.5043
 epoch: 89, train_loss: 0.9348, test_loss: 0.9612, test_f1: 0.5134
 epoch: 90, train_loss: 0.9268, test_loss: 0.9602, test_f1: 0.5234
 epoch: 91, train_loss: 0.9231, test_loss: 0.9613, test_f1: 0.5078
 epoch: 92, train_loss: 0.9126, test_loss: 0.9702, test_f1: 0.5078
 epoch: 93, train_loss: 0.9190, test_loss: 0.9571, test_f1: 0.5231
 epoch: 94, train_loss: 0.9188, test_loss: 0.9627, test_f1: 0.5133
 epoch: 95, train_loss: 0.9234, test_loss: 0.9654, test_f1: 0.5089
 epoch: 96, train_loss: 0.9369, test_loss: 0.9747, test_f1: 0.5036
 epoch: 97, train_loss: 0.9268, test_loss: 0.9628, test_f1: 0.5092
 epoch: 98, train_loss: 0.9165, test_loss: 0.9747, test_f1: 0.5047
 epoch: 99, train_loss: 0.9202, test_loss: 0.9563, test_f1: 0.5169
##################ITERATION #5 ****************************************
 epoch: 0, train_loss: 1.3534, test_loss: 1.3236, test_f1: 0.2274
 epoch: 1, train_loss: 1.2943, test_loss: 1.3137, test_f1: 0.2274
 epoch: 2, train_loss: 1.2768, test_loss: 1.2929, test_f1: 0.2473
 epoch: 3, train_loss: 1.2531, test_loss: 1.2600, test_f1: 0.2691
 epoch: 4, train_loss: 1.2434, test_loss: 1.2332, test_f1: 0.2763
 epoch: 5, train_loss: 1.2370, test_loss: 1.2137, test_f1: 0.3118
 epoch: 6, train_loss: 1.2277, test_loss: 1.1949, test_f1: 0.3113
 epoch: 7, train_loss: 1.2106, test_loss: 1.1814, test_f1: 0.3662
 epoch: 8, train_loss: 1.2144, test_loss: 1.1776, test_f1: 0.3852
 epoch: 9, train_loss: 1.2017, test_loss: 1.1743, test_f1: 0.3891
 epoch: 10, train_loss: 1.1939, test_loss: 1.1645, test_f1: 0.3936
 epoch: 11, train_loss: 1.1817, test_loss: 1.1618, test_f1: 0.3998
 epoch: 12, train_loss: 1.1733, test_loss: 1.1563, test_f1: 0.3897
 epoch: 13, train_loss: 1.1692, test_loss: 1.1481, test_f1: 0.4048
 epoch: 14, train_loss: 1.1673, test_loss: 1.1427, test_f1: 0.3825
 epoch: 15, train_loss: 1.1555, test_loss: 1.1450, test_f1: 0.4057
 epoch: 16, train_loss: 1.1458, test_loss: 1.1459, test_f1: 0.4050
 epoch: 17, train_loss: 1.1449, test_loss: 1.1409, test_f1: 0.4113
 epoch: 18, train_loss: 1.1470, test_loss: 1.1217, test_f1: 0.4171
 epoch: 19, train_loss: 1.1367, test_loss: 1.1236, test_f1: 0.4142
 epoch: 20, train_loss: 1.1247, test_loss: 1.1339, test_f1: 0.4150
 epoch: 21, train_loss: 1.1229, test_loss: 1.1222, test_f1: 0.4172
 epoch: 22, train_loss: 1.1209, test_loss: 1.1201, test_f1: 0.4231
 epoch: 23, train_loss: 1.1162, test_loss: 1.1142, test_f1: 0.4276
 epoch: 24, train_loss: 1.1153, test_loss: 1.1129, test_f1: 0.4253
 epoch: 25, train_loss: 1.1135, test_loss: 1.1090, test_f1: 0.4246
 epoch: 26, train_loss: 1.1021, test_loss: 1.1117, test_f1: 0.4274
 epoch: 27, train_loss: 1.1009, test_loss: 1.1076, test_f1: 0.4266
 epoch: 28, train_loss: 1.1045, test_loss: 1.1088, test_f1: 0.4320
 epoch: 29, train_loss: 1.0900, test_loss: 1.1027, test_f1: 0.4374
 epoch: 30, train_loss: 1.0820, test_loss: 1.0979, test_f1: 0.4318
 epoch: 31, train_loss: 1.0812, test_loss: 1.1045, test_f1: 0.4382
 epoch: 32, train_loss: 1.0800, test_loss: 1.1025, test_f1: 0.4422
 epoch: 33, train_loss: 1.0761, test_loss: 1.0989, test_f1: 0.4348
 epoch: 34, train_loss: 1.0805, test_loss: 1.0944, test_f1: 0.4332
 epoch: 35, train_loss: 1.0745, test_loss: 1.1081, test_f1: 0.4272
 epoch: 36, train_loss: 1.0674, test_loss: 1.1010, test_f1: 0.4347
 epoch: 37, train_loss: 1.0632, test_loss: 1.0874, test_f1: 0.4401
 epoch: 38, train_loss: 1.0636, test_loss: 1.0817, test_f1: 0.4372
 epoch: 39, train_loss: 1.0556, test_loss: 1.0921, test_f1: 0.4401
 epoch: 40, train_loss: 1.0415, test_loss: 1.0729, test_f1: 0.4441
 epoch: 41, train_loss: 1.0506, test_loss: 1.0725, test_f1: 0.4382
 epoch: 42, train_loss: 1.0432, test_loss: 1.0891, test_f1: 0.4320
 epoch: 43, train_loss: 1.0337, test_loss: 1.0620, test_f1: 0.4312
 epoch: 44, train_loss: 1.0398, test_loss: 1.0636, test_f1: 0.4277
 epoch: 45, train_loss: 1.0373, test_loss: 1.0572, test_f1: 0.4324
 epoch: 46, train_loss: 1.0366, test_loss: 1.0621, test_f1: 0.4385
 epoch: 47, train_loss: 1.0412, test_loss: 1.0788, test_f1: 0.4448
 epoch: 48, train_loss: 1.0281, test_loss: 1.0498, test_f1: 0.4347
 epoch: 49, train_loss: 1.0213, test_loss: 1.0447, test_f1: 0.4405
 epoch: 50, train_loss: 1.0187, test_loss: 1.0558, test_f1: 0.4375
 epoch: 51, train_loss: 1.0149, test_loss: 1.0490, test_f1: 0.4318
 epoch: 52, train_loss: 1.0086, test_loss: 1.0475, test_f1: 0.4380
 epoch: 53, train_loss: 1.0101, test_loss: 1.0527, test_f1: 0.4323
 epoch: 54, train_loss: 1.0132, test_loss: 1.0508, test_f1: 0.4335
 epoch: 55, train_loss: 0.9960, test_loss: 1.0411, test_f1: 0.4451
 epoch: 56, train_loss: 1.0055, test_loss: 1.0470, test_f1: 0.4409
 epoch: 57, train_loss: 0.9935, test_loss: 1.0450, test_f1: 0.4365
 epoch: 58, train_loss: 0.9990, test_loss: 1.0372, test_f1: 0.4392
 epoch: 59, train_loss: 1.0051, test_loss: 1.0390, test_f1: 0.4361
 epoch: 60, train_loss: 1.0042, test_loss: 1.0478, test_f1: 0.4394
 epoch: 61, train_loss: 1.0031, test_loss: 1.0658, test_f1: 0.4340
 epoch: 62, train_loss: 0.9938, test_loss: 1.0598, test_f1: 0.4251
 epoch: 63, train_loss: 1.0001, test_loss: 1.0526, test_f1: 0.4215
 epoch: 64, train_loss: 0.9919, test_loss: 1.0348, test_f1: 0.4288
 epoch: 65, train_loss: 0.9942, test_loss: 1.0585, test_f1: 0.4272
 epoch: 66, train_loss: 0.9900, test_loss: 1.0712, test_f1: 0.4198
 epoch: 67, train_loss: 0.9866, test_loss: 1.0397, test_f1: 0.4357
 epoch: 68, train_loss: 0.9840, test_loss: 1.0451, test_f1: 0.4191
 epoch: 69, train_loss: 0.9849, test_loss: 1.0512, test_f1: 0.4245
 epoch: 70, train_loss: 0.9808, test_loss: 1.0428, test_f1: 0.4377
 epoch: 71, train_loss: 0.9735, test_loss: 1.0526, test_f1: 0.4217
 epoch: 72, train_loss: 0.9829, test_loss: 1.0472, test_f1: 0.4170
 epoch: 73, train_loss: 0.9709, test_loss: 1.0456, test_f1: 0.4296
 epoch: 74, train_loss: 0.9767, test_loss: 1.0457, test_f1: 0.4279
 epoch: 75, train_loss: 0.9693, test_loss: 1.0717, test_f1: 0.4193
 epoch: 76, train_loss: 0.9776, test_loss: 1.0372, test_f1: 0.4356
 epoch: 77, train_loss: 0.9790, test_loss: 1.0466, test_f1: 0.4322
 epoch: 78, train_loss: 0.9735, test_loss: 1.0605, test_f1: 0.4209
 epoch: 79, train_loss: 0.9564, test_loss: 1.0676, test_f1: 0.4201
 epoch: 80, train_loss: 0.9630, test_loss: 1.0440, test_f1: 0.4302
 epoch: 81, train_loss: 0.9598, test_loss: 1.0429, test_f1: 0.4252
 epoch: 82, train_loss: 0.9630, test_loss: 1.0533, test_f1: 0.4157
 epoch: 83, train_loss: 0.9643, test_loss: 1.0830, test_f1: 0.4223
 epoch: 84, train_loss: 0.9684, test_loss: 1.0985, test_f1: 0.4260
 epoch: 85, train_loss: 0.9548, test_loss: 1.0918, test_f1: 0.4207
 epoch: 86, train_loss: 0.9623, test_loss: 1.0571, test_f1: 0.4304
 epoch: 87, train_loss: 0.9584, test_loss: 1.0535, test_f1: 0.4411
 epoch: 88, train_loss: 0.9697, test_loss: 1.0507, test_f1: 0.4210
 epoch: 89, train_loss: 0.9587, test_loss: 1.0621, test_f1: 0.4282
 epoch: 90, train_loss: 0.9486, test_loss: 1.0686, test_f1: 0.4295
 epoch: 91, train_loss: 0.9552, test_loss: 1.0731, test_f1: 0.4270
 epoch: 92, train_loss: 0.9551, test_loss: 1.0472, test_f1: 0.4323
 epoch: 93, train_loss: 0.9418, test_loss: 1.0699, test_f1: 0.4270
 epoch: 94, train_loss: 0.9444, test_loss: 1.0371, test_f1: 0.4264
 epoch: 95, train_loss: 0.9466, test_loss: 1.0580, test_f1: 0.4434
 epoch: 96, train_loss: 0.9566, test_loss: 1.1022, test_f1: 0.4334
 epoch: 97, train_loss: 0.9444, test_loss: 1.1146, test_f1: 0.4210
 epoch: 98, train_loss: 0.9426, test_loss: 1.0814, test_f1: 0.4266
 epoch: 99, train_loss: 0.9446, test_loss: 1.0633, test_f1: 0.4349
##################ITERATION #6 ****************************************
 epoch: 0, train_loss: 1.5389, test_loss: 1.3952, test_f1: 0.2274
 epoch: 1, train_loss: 1.3572, test_loss: 1.3605, test_f1: 0.2274
 epoch: 2, train_loss: 1.3227, test_loss: 1.3237, test_f1: 0.2300
 epoch: 3, train_loss: 1.2965, test_loss: 1.2883, test_f1: 0.2376
 epoch: 4, train_loss: 1.2842, test_loss: 1.2682, test_f1: 0.2485
 epoch: 5, train_loss: 1.2655, test_loss: 1.2495, test_f1: 0.2735
 epoch: 6, train_loss: 1.2584, test_loss: 1.2415, test_f1: 0.2603
 epoch: 7, train_loss: 1.2544, test_loss: 1.2352, test_f1: 0.2954
 epoch: 8, train_loss: 1.2511, test_loss: 1.2297, test_f1: 0.3329
 epoch: 9, train_loss: 1.2428, test_loss: 1.2238, test_f1: 0.3166
 epoch: 10, train_loss: 1.2345, test_loss: 1.2166, test_f1: 0.3564
 epoch: 11, train_loss: 1.2375, test_loss: 1.2105, test_f1: 0.3471
 epoch: 12, train_loss: 1.2192, test_loss: 1.2059, test_f1: 0.3647
 epoch: 13, train_loss: 1.2204, test_loss: 1.1989, test_f1: 0.3719
 epoch: 14, train_loss: 1.2092, test_loss: 1.1968, test_f1: 0.3806
 epoch: 15, train_loss: 1.2022, test_loss: 1.1870, test_f1: 0.3919
 epoch: 16, train_loss: 1.1969, test_loss: 1.1782, test_f1: 0.4059
 epoch: 17, train_loss: 1.1945, test_loss: 1.1734, test_f1: 0.4038
 epoch: 18, train_loss: 1.1918, test_loss: 1.1741, test_f1: 0.4040
 epoch: 19, train_loss: 1.1857, test_loss: 1.1592, test_f1: 0.4067
 epoch: 20, train_loss: 1.1777, test_loss: 1.1521, test_f1: 0.4153
 epoch: 21, train_loss: 1.1676, test_loss: 1.1461, test_f1: 0.4308
 epoch: 22, train_loss: 1.1690, test_loss: 1.1399, test_f1: 0.4308
 epoch: 23, train_loss: 1.1656, test_loss: 1.1349, test_f1: 0.4284
 epoch: 24, train_loss: 1.1577, test_loss: 1.1276, test_f1: 0.4321
 epoch: 25, train_loss: 1.1465, test_loss: 1.1240, test_f1: 0.4306
 epoch: 26, train_loss: 1.1402, test_loss: 1.1139, test_f1: 0.4358
 epoch: 27, train_loss: 1.1444, test_loss: 1.1025, test_f1: 0.4424
 epoch: 28, train_loss: 1.1367, test_loss: 1.0942, test_f1: 0.4405
 epoch: 29, train_loss: 1.1253, test_loss: 1.0743, test_f1: 0.4456
 epoch: 30, train_loss: 1.1045, test_loss: 1.0688, test_f1: 0.4441
 epoch: 31, train_loss: 1.1035, test_loss: 1.0553, test_f1: 0.4504
 epoch: 32, train_loss: 1.1087, test_loss: 1.0470, test_f1: 0.4456
 epoch: 33, train_loss: 1.0924, test_loss: 1.0476, test_f1: 0.4669
 epoch: 34, train_loss: 1.0873, test_loss: 1.0333, test_f1: 0.4541
 epoch: 35, train_loss: 1.0886, test_loss: 1.0205, test_f1: 0.4601
 epoch: 36, train_loss: 1.0717, test_loss: 1.0128, test_f1: 0.4689
 epoch: 37, train_loss: 1.0658, test_loss: 1.0089, test_f1: 0.4550
 epoch: 38, train_loss: 1.0555, test_loss: 0.9867, test_f1: 0.4708
 epoch: 39, train_loss: 1.0461, test_loss: 0.9915, test_f1: 0.4908
 epoch: 40, train_loss: 1.0498, test_loss: 0.9784, test_f1: 0.4620
 epoch: 41, train_loss: 1.0324, test_loss: 0.9682, test_f1: 0.4806
 epoch: 42, train_loss: 1.0316, test_loss: 0.9643, test_f1: 0.4879
 epoch: 43, train_loss: 1.0198, test_loss: 0.9596, test_f1: 0.4807
 epoch: 44, train_loss: 1.0123, test_loss: 0.9640, test_f1: 0.4755
 epoch: 45, train_loss: 1.0070, test_loss: 0.9458, test_f1: 0.4839
 epoch: 46, train_loss: 1.0185, test_loss: 0.9579, test_f1: 0.4817
 epoch: 47, train_loss: 0.9991, test_loss: 0.9475, test_f1: 0.4837
 epoch: 48, train_loss: 1.0027, test_loss: 0.9467, test_f1: 0.4832
 epoch: 49, train_loss: 0.9940, test_loss: 0.9415, test_f1: 0.4870
 epoch: 50, train_loss: 0.9848, test_loss: 0.9460, test_f1: 0.4939
 epoch: 51, train_loss: 0.9773, test_loss: 0.9360, test_f1: 0.4906
 epoch: 52, train_loss: 0.9825, test_loss: 0.9284, test_f1: 0.4908
 epoch: 53, train_loss: 0.9778, test_loss: 0.9307, test_f1: 0.4884
 epoch: 54, train_loss: 0.9683, test_loss: 0.9345, test_f1: 0.4936
 epoch: 55, train_loss: 0.9797, test_loss: 0.9351, test_f1: 0.4926
 epoch: 56, train_loss: 0.9741, test_loss: 0.9314, test_f1: 0.4836
 epoch: 57, train_loss: 0.9712, test_loss: 0.9255, test_f1: 0.4979
 epoch: 58, train_loss: 0.9611, test_loss: 0.9355, test_f1: 0.4874
 epoch: 59, train_loss: 0.9638, test_loss: 0.9312, test_f1: 0.4903
 epoch: 60, train_loss: 0.9604, test_loss: 0.9294, test_f1: 0.4947
 epoch: 61, train_loss: 0.9654, test_loss: 0.9199, test_f1: 0.4901
 epoch: 62, train_loss: 0.9570, test_loss: 0.9138, test_f1: 0.4880
 epoch: 63, train_loss: 0.9598, test_loss: 0.9229, test_f1: 0.4916
 epoch: 64, train_loss: 0.9611, test_loss: 0.9160, test_f1: 0.5038
 epoch: 65, train_loss: 0.9563, test_loss: 0.9198, test_f1: 0.5033
 epoch: 66, train_loss: 0.9522, test_loss: 0.9151, test_f1: 0.5052
 epoch: 67, train_loss: 0.9398, test_loss: 0.9147, test_f1: 0.5049
 epoch: 68, train_loss: 0.9514, test_loss: 0.9161, test_f1: 0.5041
 epoch: 69, train_loss: 0.9476, test_loss: 0.9142, test_f1: 0.4941
 epoch: 70, train_loss: 0.9299, test_loss: 0.9168, test_f1: 0.4954
 epoch: 71, train_loss: 0.9386, test_loss: 0.9260, test_f1: 0.4976
 epoch: 72, train_loss: 0.9401, test_loss: 0.9177, test_f1: 0.4960
 epoch: 73, train_loss: 0.9332, test_loss: 0.9167, test_f1: 0.4952
 epoch: 74, train_loss: 0.9472, test_loss: 0.9176, test_f1: 0.4952
 epoch: 75, train_loss: 0.9426, test_loss: 0.9090, test_f1: 0.5060
 epoch: 76, train_loss: 0.9350, test_loss: 0.9181, test_f1: 0.4917
 epoch: 77, train_loss: 0.9287, test_loss: 0.9095, test_f1: 0.4971
 epoch: 78, train_loss: 0.9268, test_loss: 0.9186, test_f1: 0.4913
 epoch: 79, train_loss: 0.9378, test_loss: 0.9057, test_f1: 0.5102
 epoch: 80, train_loss: 0.9330, test_loss: 0.9080, test_f1: 0.5006
 epoch: 81, train_loss: 0.9240, test_loss: 0.9012, test_f1: 0.5060
 epoch: 82, train_loss: 0.9323, test_loss: 0.9048, test_f1: 0.5121
 epoch: 83, train_loss: 0.9218, test_loss: 0.9038, test_f1: 0.5108
 epoch: 84, train_loss: 0.9208, test_loss: 0.9070, test_f1: 0.4956
 epoch: 85, train_loss: 0.9177, test_loss: 0.9015, test_f1: 0.5060
 epoch: 86, train_loss: 0.9273, test_loss: 0.9073, test_f1: 0.4970
 epoch: 87, train_loss: 0.9170, test_loss: 0.9084, test_f1: 0.4959
 epoch: 88, train_loss: 0.9246, test_loss: 0.9038, test_f1: 0.4981
 epoch: 89, train_loss: 0.9129, test_loss: 0.9005, test_f1: 0.4998
 epoch: 90, train_loss: 0.9047, test_loss: 0.9108, test_f1: 0.5009
 epoch: 91, train_loss: 0.9164, test_loss: 0.9139, test_f1: 0.4933
 epoch: 92, train_loss: 0.9081, test_loss: 0.9235, test_f1: 0.4942
 epoch: 93, train_loss: 0.9087, test_loss: 0.9000, test_f1: 0.5133
 epoch: 94, train_loss: 0.9114, test_loss: 0.9155, test_f1: 0.5039
 epoch: 95, train_loss: 0.8995, test_loss: 0.9118, test_f1: 0.5051
 epoch: 96, train_loss: 0.9022, test_loss: 0.9145, test_f1: 0.5084
 epoch: 97, train_loss: 0.9063, test_loss: 0.9013, test_f1: 0.5059
 epoch: 98, train_loss: 0.9018, test_loss: 0.9048, test_f1: 0.5030
 epoch: 99, train_loss: 0.9128, test_loss: 0.9084, test_f1: 0.5040
##################ITERATION #7 ****************************************
 epoch: 0, train_loss: 1.3462, test_loss: 1.3123, test_f1: 0.2274
 epoch: 1, train_loss: 1.2766, test_loss: 1.2738, test_f1: 0.2274
 epoch: 2, train_loss: 1.2585, test_loss: 1.2553, test_f1: 0.2669
 epoch: 3, train_loss: 1.2487, test_loss: 1.2289, test_f1: 0.2669
 epoch: 4, train_loss: 1.2462, test_loss: 1.2117, test_f1: 0.3036
 epoch: 5, train_loss: 1.2341, test_loss: 1.2023, test_f1: 0.3114
 epoch: 6, train_loss: 1.2367, test_loss: 1.1960, test_f1: 0.3339
 epoch: 7, train_loss: 1.2246, test_loss: 1.1872, test_f1: 0.3286
 epoch: 8, train_loss: 1.2224, test_loss: 1.1832, test_f1: 0.3507
 epoch: 9, train_loss: 1.2051, test_loss: 1.1755, test_f1: 0.3676
 epoch: 10, train_loss: 1.1986, test_loss: 1.1696, test_f1: 0.3585
 epoch: 11, train_loss: 1.1942, test_loss: 1.1627, test_f1: 0.3643
 epoch: 12, train_loss: 1.1947, test_loss: 1.1616, test_f1: 0.3654
 epoch: 13, train_loss: 1.1801, test_loss: 1.1572, test_f1: 0.3705
 epoch: 14, train_loss: 1.1904, test_loss: 1.1555, test_f1: 0.3681
 epoch: 15, train_loss: 1.1778, test_loss: 1.1413, test_f1: 0.3647
 epoch: 16, train_loss: 1.1756, test_loss: 1.1435, test_f1: 0.3713
 epoch: 17, train_loss: 1.1612, test_loss: 1.1441, test_f1: 0.3439
 epoch: 18, train_loss: 1.1569, test_loss: 1.1283, test_f1: 0.3624
 epoch: 19, train_loss: 1.1527, test_loss: 1.1314, test_f1: 0.3607
 epoch: 20, train_loss: 1.1478, test_loss: 1.1243, test_f1: 0.3806
 epoch: 21, train_loss: 1.1456, test_loss: 1.1080, test_f1: 0.3918
 epoch: 22, train_loss: 1.1364, test_loss: 1.1062, test_f1: 0.4050
 epoch: 23, train_loss: 1.1332, test_loss: 1.0979, test_f1: 0.4125
 epoch: 24, train_loss: 1.1247, test_loss: 1.0922, test_f1: 0.4091
 epoch: 25, train_loss: 1.1198, test_loss: 1.0917, test_f1: 0.4009
 epoch: 26, train_loss: 1.1127, test_loss: 1.0992, test_f1: 0.3910
 epoch: 27, train_loss: 1.1121, test_loss: 1.0960, test_f1: 0.4185
 epoch: 28, train_loss: 1.0976, test_loss: 1.0783, test_f1: 0.4129
 epoch: 29, train_loss: 1.0955, test_loss: 1.0843, test_f1: 0.4278
 epoch: 30, train_loss: 1.0887, test_loss: 1.0630, test_f1: 0.4277
 epoch: 31, train_loss: 1.0974, test_loss: 1.0600, test_f1: 0.4402
 epoch: 32, train_loss: 1.0813, test_loss: 1.0592, test_f1: 0.4365
 epoch: 33, train_loss: 1.0827, test_loss: 1.0672, test_f1: 0.4303
 epoch: 34, train_loss: 1.0706, test_loss: 1.0754, test_f1: 0.4243
 epoch: 35, train_loss: 1.0645, test_loss: 1.0601, test_f1: 0.4418
 epoch: 36, train_loss: 1.0588, test_loss: 1.0410, test_f1: 0.4459
 epoch: 37, train_loss: 1.0564, test_loss: 1.0439, test_f1: 0.4519
 epoch: 38, train_loss: 1.0505, test_loss: 1.0453, test_f1: 0.4432
 epoch: 39, train_loss: 1.0478, test_loss: 1.0423, test_f1: 0.4518
 epoch: 40, train_loss: 1.0317, test_loss: 1.0568, test_f1: 0.4695
 epoch: 41, train_loss: 1.0416, test_loss: 1.0329, test_f1: 0.4542
 epoch: 42, train_loss: 1.0308, test_loss: 1.0580, test_f1: 0.4583
 epoch: 43, train_loss: 1.0373, test_loss: 1.0397, test_f1: 0.4523
 epoch: 44, train_loss: 1.0347, test_loss: 1.0385, test_f1: 0.4600
 epoch: 45, train_loss: 1.0242, test_loss: 1.0192, test_f1: 0.4569
 epoch: 46, train_loss: 1.0243, test_loss: 1.0559, test_f1: 0.4560
 epoch: 47, train_loss: 1.0193, test_loss: 1.0451, test_f1: 0.4649
 epoch: 48, train_loss: 0.9998, test_loss: 1.0511, test_f1: 0.4513
 epoch: 49, train_loss: 0.9985, test_loss: 1.0441, test_f1: 0.4619
 epoch: 50, train_loss: 1.0108, test_loss: 1.0695, test_f1: 0.4449
 epoch: 51, train_loss: 0.9930, test_loss: 1.0415, test_f1: 0.4578
 epoch: 52, train_loss: 0.9982, test_loss: 1.0293, test_f1: 0.4680
 epoch: 53, train_loss: 0.9910, test_loss: 1.0382, test_f1: 0.4654
 epoch: 54, train_loss: 0.9881, test_loss: 1.0317, test_f1: 0.4678
 epoch: 55, train_loss: 0.9820, test_loss: 1.0366, test_f1: 0.4680
 epoch: 56, train_loss: 0.9910, test_loss: 1.0297, test_f1: 0.4682
 epoch: 57, train_loss: 0.9872, test_loss: 1.0553, test_f1: 0.4563
 epoch: 58, train_loss: 0.9839, test_loss: 1.0284, test_f1: 0.4747
 epoch: 59, train_loss: 0.9743, test_loss: 1.0644, test_f1: 0.4497
 epoch: 60, train_loss: 0.9809, test_loss: 1.0360, test_f1: 0.4729
 epoch: 61, train_loss: 0.9809, test_loss: 1.0416, test_f1: 0.4712
 epoch: 62, train_loss: 0.9654, test_loss: 1.0495, test_f1: 0.4680
 epoch: 63, train_loss: 0.9747, test_loss: 1.0426, test_f1: 0.4666
 epoch: 64, train_loss: 0.9620, test_loss: 1.0503, test_f1: 0.4686
 epoch: 65, train_loss: 0.9656, test_loss: 1.0422, test_f1: 0.4717
 epoch: 66, train_loss: 0.9655, test_loss: 1.0407, test_f1: 0.4722
 epoch: 67, train_loss: 0.9658, test_loss: 1.0564, test_f1: 0.4691
 epoch: 68, train_loss: 0.9718, test_loss: 1.0504, test_f1: 0.4680
 epoch: 69, train_loss: 0.9590, test_loss: 1.0637, test_f1: 0.4723
 epoch: 70, train_loss: 0.9506, test_loss: 1.0696, test_f1: 0.4649
 epoch: 71, train_loss: 0.9623, test_loss: 1.0627, test_f1: 0.4701
 epoch: 72, train_loss: 0.9587, test_loss: 1.0469, test_f1: 0.4617
 epoch: 73, train_loss: 0.9577, test_loss: 1.0524, test_f1: 0.4681
 epoch: 74, train_loss: 0.9511, test_loss: 1.0589, test_f1: 0.4670
 epoch: 75, train_loss: 0.9584, test_loss: 1.0683, test_f1: 0.4669
 epoch: 76, train_loss: 0.9485, test_loss: 1.0595, test_f1: 0.4572
 epoch: 77, train_loss: 0.9449, test_loss: 1.0639, test_f1: 0.4673
 epoch: 78, train_loss: 0.9466, test_loss: 1.0795, test_f1: 0.4507
 epoch: 79, train_loss: 0.9401, test_loss: 1.0775, test_f1: 0.4624
 epoch: 80, train_loss: 0.9431, test_loss: 1.0655, test_f1: 0.4679
 epoch: 81, train_loss: 0.9473, test_loss: 1.0659, test_f1: 0.4644
 epoch: 82, train_loss: 0.9460, test_loss: 1.0778, test_f1: 0.4580
 epoch: 83, train_loss: 0.9407, test_loss: 1.0663, test_f1: 0.4590
 epoch: 84, train_loss: 0.9416, test_loss: 1.0585, test_f1: 0.4684
 epoch: 85, train_loss: 0.9473, test_loss: 1.0690, test_f1: 0.4648
 epoch: 86, train_loss: 0.9406, test_loss: 1.0660, test_f1: 0.4681
 epoch: 87, train_loss: 0.9380, test_loss: 1.0638, test_f1: 0.4724
 epoch: 88, train_loss: 0.9460, test_loss: 1.0737, test_f1: 0.4632
 epoch: 89, train_loss: 0.9417, test_loss: 1.0645, test_f1: 0.4696
 epoch: 90, train_loss: 0.9377, test_loss: 1.1038, test_f1: 0.4473
 epoch: 91, train_loss: 0.9350, test_loss: 1.1011, test_f1: 0.4693
 epoch: 92, train_loss: 0.9352, test_loss: 1.0890, test_f1: 0.4611
 epoch: 93, train_loss: 0.9246, test_loss: 1.0736, test_f1: 0.4542
 epoch: 94, train_loss: 0.9256, test_loss: 1.0798, test_f1: 0.4674
 epoch: 95, train_loss: 0.9304, test_loss: 1.0789, test_f1: 0.4699
 epoch: 96, train_loss: 0.9319, test_loss: 1.0740, test_f1: 0.4724
 epoch: 97, train_loss: 0.9274, test_loss: 1.0912, test_f1: 0.4574
 epoch: 98, train_loss: 0.9261, test_loss: 1.1020, test_f1: 0.4590
 epoch: 99, train_loss: 0.9171, test_loss: 1.1067, test_f1: 0.4558
##################ITERATION #8 ****************************************
 epoch: 0, train_loss: 1.3512, test_loss: 1.3142, test_f1: 0.2274
 epoch: 1, train_loss: 1.2990, test_loss: 1.2894, test_f1: 0.2274
 epoch: 2, train_loss: 1.2651, test_loss: 1.2638, test_f1: 0.2444
 epoch: 3, train_loss: 1.2527, test_loss: 1.2433, test_f1: 0.2571
 epoch: 4, train_loss: 1.2347, test_loss: 1.2304, test_f1: 0.2828
 epoch: 5, train_loss: 1.2353, test_loss: 1.2157, test_f1: 0.3228
 epoch: 6, train_loss: 1.2243, test_loss: 1.1963, test_f1: 0.3345
 epoch: 7, train_loss: 1.2077, test_loss: 1.1737, test_f1: 0.3243
 epoch: 8, train_loss: 1.1966, test_loss: 1.1565, test_f1: 0.3932
 epoch: 9, train_loss: 1.1955, test_loss: 1.1412, test_f1: 0.4124
 epoch: 10, train_loss: 1.1875, test_loss: 1.1358, test_f1: 0.4145
 epoch: 11, train_loss: 1.1689, test_loss: 1.1299, test_f1: 0.4384
 epoch: 12, train_loss: 1.1667, test_loss: 1.1150, test_f1: 0.4399
 epoch: 13, train_loss: 1.1620, test_loss: 1.1067, test_f1: 0.4353
 epoch: 14, train_loss: 1.1568, test_loss: 1.0961, test_f1: 0.4555
 epoch: 15, train_loss: 1.1466, test_loss: 1.0854, test_f1: 0.4407
 epoch: 16, train_loss: 1.1411, test_loss: 1.0828, test_f1: 0.4553
 epoch: 17, train_loss: 1.1347, test_loss: 1.0677, test_f1: 0.4583
 epoch: 18, train_loss: 1.1265, test_loss: 1.0707, test_f1: 0.4577
 epoch: 19, train_loss: 1.1325, test_loss: 1.0598, test_f1: 0.4623
 epoch: 20, train_loss: 1.1163, test_loss: 1.0560, test_f1: 0.4639
 epoch: 21, train_loss: 1.1131, test_loss: 1.0461, test_f1: 0.4768
 epoch: 22, train_loss: 1.0989, test_loss: 1.0339, test_f1: 0.4866
 epoch: 23, train_loss: 1.1037, test_loss: 1.0280, test_f1: 0.4821
 epoch: 24, train_loss: 1.0837, test_loss: 1.0238, test_f1: 0.4807
 epoch: 25, train_loss: 1.0836, test_loss: 1.0077, test_f1: 0.4818
 epoch: 26, train_loss: 1.0773, test_loss: 1.0076, test_f1: 0.4892
 epoch: 27, train_loss: 1.0804, test_loss: 1.0080, test_f1: 0.4882
 epoch: 28, train_loss: 1.0610, test_loss: 0.9978, test_f1: 0.4796
 epoch: 29, train_loss: 1.0592, test_loss: 0.9957, test_f1: 0.4860
 epoch: 30, train_loss: 1.0582, test_loss: 0.9970, test_f1: 0.4796
 epoch: 31, train_loss: 1.0496, test_loss: 0.9793, test_f1: 0.4913
 epoch: 32, train_loss: 1.0511, test_loss: 1.0064, test_f1: 0.4839
 epoch: 33, train_loss: 1.0453, test_loss: 0.9747, test_f1: 0.5037
 epoch: 34, train_loss: 1.0285, test_loss: 0.9837, test_f1: 0.4903
 epoch: 35, train_loss: 1.0350, test_loss: 0.9855, test_f1: 0.4813
 epoch: 36, train_loss: 1.0333, test_loss: 0.9656, test_f1: 0.4947
 epoch: 37, train_loss: 1.0211, test_loss: 0.9740, test_f1: 0.4825
 epoch: 38, train_loss: 1.0178, test_loss: 0.9812, test_f1: 0.4780
 epoch: 39, train_loss: 1.0141, test_loss: 0.9726, test_f1: 0.4845
 epoch: 40, train_loss: 1.0068, test_loss: 0.9707, test_f1: 0.4811
 epoch: 41, train_loss: 1.0000, test_loss: 0.9791, test_f1: 0.4795
 epoch: 42, train_loss: 0.9967, test_loss: 0.9733, test_f1: 0.4802
 epoch: 43, train_loss: 1.0055, test_loss: 0.9745, test_f1: 0.4860
 epoch: 44, train_loss: 1.0015, test_loss: 0.9531, test_f1: 0.4809
 epoch: 45, train_loss: 0.9930, test_loss: 0.9571, test_f1: 0.4845
 epoch: 46, train_loss: 0.9918, test_loss: 0.9879, test_f1: 0.4719
 epoch: 47, train_loss: 0.9873, test_loss: 0.9877, test_f1: 0.4858
 epoch: 48, train_loss: 0.9895, test_loss: 0.9771, test_f1: 0.4796
 epoch: 49, train_loss: 0.9748, test_loss: 0.9835, test_f1: 0.4837
 epoch: 50, train_loss: 0.9863, test_loss: 1.0398, test_f1: 0.4719
 epoch: 51, train_loss: 0.9643, test_loss: 1.0761, test_f1: 0.4658
 epoch: 52, train_loss: 0.9656, test_loss: 0.9892, test_f1: 0.4744
 epoch: 53, train_loss: 0.9552, test_loss: 1.0113, test_f1: 0.4630
 epoch: 54, train_loss: 0.9707, test_loss: 0.9818, test_f1: 0.4806
 epoch: 55, train_loss: 0.9557, test_loss: 1.0121, test_f1: 0.4724
 epoch: 56, train_loss: 0.9650, test_loss: 1.0303, test_f1: 0.4684
 epoch: 57, train_loss: 0.9559, test_loss: 1.0221, test_f1: 0.4666
 epoch: 58, train_loss: 0.9474, test_loss: 1.0067, test_f1: 0.4647
 epoch: 59, train_loss: 0.9504, test_loss: 1.0085, test_f1: 0.4795
 epoch: 60, train_loss: 0.9513, test_loss: 1.0121, test_f1: 0.4892
 epoch: 61, train_loss: 0.9526, test_loss: 0.9976, test_f1: 0.4794
 epoch: 62, train_loss: 0.9460, test_loss: 0.9873, test_f1: 0.4841
 epoch: 63, train_loss: 0.9443, test_loss: 1.0208, test_f1: 0.4711
 epoch: 64, train_loss: 0.9543, test_loss: 1.0442, test_f1: 0.4703
 epoch: 65, train_loss: 0.9578, test_loss: 1.0166, test_f1: 0.4741
 epoch: 66, train_loss: 0.9425, test_loss: 1.0076, test_f1: 0.4813
 epoch: 67, train_loss: 0.9360, test_loss: 0.9975, test_f1: 0.4871
 epoch: 68, train_loss: 0.9423, test_loss: 1.0484, test_f1: 0.4633
 epoch: 69, train_loss: 0.9393, test_loss: 1.0083, test_f1: 0.4799
 epoch: 70, train_loss: 0.9412, test_loss: 0.9976, test_f1: 0.4911
 epoch: 71, train_loss: 0.9327, test_loss: 1.0349, test_f1: 0.4842
 epoch: 72, train_loss: 0.9293, test_loss: 1.0324, test_f1: 0.4781
 epoch: 73, train_loss: 0.9270, test_loss: 1.0174, test_f1: 0.4818
 epoch: 74, train_loss: 0.9316, test_loss: 0.9929, test_f1: 0.4925
 epoch: 75, train_loss: 0.9293, test_loss: 1.0102, test_f1: 0.4915
 epoch: 76, train_loss: 0.9347, test_loss: 1.0152, test_f1: 0.4842
 epoch: 77, train_loss: 0.9331, test_loss: 1.0122, test_f1: 0.4839
 epoch: 78, train_loss: 0.9300, test_loss: 1.0195, test_f1: 0.4799
 epoch: 79, train_loss: 0.9308, test_loss: 1.0081, test_f1: 0.4933
 epoch: 80, train_loss: 0.9284, test_loss: 1.0224, test_f1: 0.4980
 epoch: 81, train_loss: 0.9231, test_loss: 1.1882, test_f1: 0.4639
 epoch: 82, train_loss: 0.9227, test_loss: 1.0304, test_f1: 0.4929
 epoch: 83, train_loss: 0.9126, test_loss: 1.0195, test_f1: 0.4896
 epoch: 84, train_loss: 0.9113, test_loss: 1.0350, test_f1: 0.5010
 epoch: 85, train_loss: 0.9169, test_loss: 1.0201, test_f1: 0.4942
 epoch: 86, train_loss: 0.9102, test_loss: 1.0356, test_f1: 0.4991
 epoch: 87, train_loss: 0.9248, test_loss: 1.0222, test_f1: 0.4975
 epoch: 88, train_loss: 0.9134, test_loss: 1.0113, test_f1: 0.4953
 epoch: 89, train_loss: 0.9157, test_loss: 1.0200, test_f1: 0.4928
 epoch: 90, train_loss: 0.9105, test_loss: 0.9996, test_f1: 0.4950
 epoch: 91, train_loss: 0.8998, test_loss: 1.0118, test_f1: 0.4955
 epoch: 92, train_loss: 0.8994, test_loss: 1.0283, test_f1: 0.5055
 epoch: 93, train_loss: 0.9219, test_loss: 1.0403, test_f1: 0.5037
 epoch: 94, train_loss: 0.9006, test_loss: 1.0173, test_f1: 0.5025
 epoch: 95, train_loss: 0.9105, test_loss: 1.0367, test_f1: 0.5006
 epoch: 96, train_loss: 0.9086, test_loss: 1.0179, test_f1: 0.5016
 epoch: 97, train_loss: 0.8994, test_loss: 1.0285, test_f1: 0.5006
 epoch: 98, train_loss: 0.8970, test_loss: 1.0477, test_f1: 0.4972
 epoch: 99, train_loss: 0.9081, test_loss: 1.0482, test_f1: 0.4929
##################ITERATION #9 ****************************************
 epoch: 0, train_loss: 1.5632, test_loss: 1.3016, test_f1: 0.2274
 epoch: 1, train_loss: 1.3310, test_loss: 1.2777, test_f1: 0.2300
 epoch: 2, train_loss: 1.2902, test_loss: 1.2532, test_f1: 0.2402
 epoch: 3, train_loss: 1.2787, test_loss: 1.2438, test_f1: 0.2382
 epoch: 4, train_loss: 1.2558, test_loss: 1.2263, test_f1: 0.2477
 epoch: 5, train_loss: 1.2366, test_loss: 1.2057, test_f1: 0.2977
 epoch: 6, train_loss: 1.2361, test_loss: 1.1878, test_f1: 0.3461
 epoch: 7, train_loss: 1.2321, test_loss: 1.1824, test_f1: 0.3438
 epoch: 8, train_loss: 1.2246, test_loss: 1.1738, test_f1: 0.3573
 epoch: 9, train_loss: 1.2161, test_loss: 1.1665, test_f1: 0.3688
 epoch: 10, train_loss: 1.2149, test_loss: 1.1602, test_f1: 0.3666
 epoch: 11, train_loss: 1.2115, test_loss: 1.1519, test_f1: 0.3933
 epoch: 12, train_loss: 1.1931, test_loss: 1.1473, test_f1: 0.3896
 epoch: 13, train_loss: 1.1929, test_loss: 1.1442, test_f1: 0.4001
 epoch: 14, train_loss: 1.1792, test_loss: 1.1346, test_f1: 0.4078
 epoch: 15, train_loss: 1.1718, test_loss: 1.1262, test_f1: 0.4127
 epoch: 16, train_loss: 1.1638, test_loss: 1.1189, test_f1: 0.4144
 epoch: 17, train_loss: 1.1601, test_loss: 1.1100, test_f1: 0.4246
 epoch: 18, train_loss: 1.1549, test_loss: 1.1033, test_f1: 0.4213
 epoch: 19, train_loss: 1.1439, test_loss: 1.0987, test_f1: 0.4096
 epoch: 20, train_loss: 1.1452, test_loss: 1.0909, test_f1: 0.4207
 epoch: 21, train_loss: 1.1391, test_loss: 1.0846, test_f1: 0.4204
 epoch: 22, train_loss: 1.1366, test_loss: 1.0801, test_f1: 0.4293
 epoch: 23, train_loss: 1.1207, test_loss: 1.0722, test_f1: 0.4298
 epoch: 24, train_loss: 1.1215, test_loss: 1.0645, test_f1: 0.4267
 epoch: 25, train_loss: 1.1145, test_loss: 1.0550, test_f1: 0.4342
 epoch: 26, train_loss: 1.1121, test_loss: 1.0503, test_f1: 0.4297
 epoch: 27, train_loss: 1.1013, test_loss: 1.0421, test_f1: 0.4341
 epoch: 28, train_loss: 1.0903, test_loss: 1.0323, test_f1: 0.4422
 epoch: 29, train_loss: 1.0845, test_loss: 1.0234, test_f1: 0.4462
 epoch: 30, train_loss: 1.0779, test_loss: 1.0162, test_f1: 0.4432
 epoch: 31, train_loss: 1.0808, test_loss: 1.0084, test_f1: 0.4506
 epoch: 32, train_loss: 1.0665, test_loss: 1.0136, test_f1: 0.4473
 epoch: 33, train_loss: 1.0772, test_loss: 1.0009, test_f1: 0.4520
 epoch: 34, train_loss: 1.0516, test_loss: 0.9933, test_f1: 0.4502
 epoch: 35, train_loss: 1.0593, test_loss: 0.9898, test_f1: 0.4536
 epoch: 36, train_loss: 1.0469, test_loss: 0.9904, test_f1: 0.4556
 epoch: 37, train_loss: 1.0480, test_loss: 0.9837, test_f1: 0.4552
 epoch: 38, train_loss: 1.0525, test_loss: 0.9760, test_f1: 0.4573
 epoch: 39, train_loss: 1.0332, test_loss: 0.9771, test_f1: 0.4621
 epoch: 40, train_loss: 1.0340, test_loss: 0.9830, test_f1: 0.4580
 epoch: 41, train_loss: 1.0333, test_loss: 0.9735, test_f1: 0.4568
 epoch: 42, train_loss: 1.0374, test_loss: 0.9720, test_f1: 0.4704
 epoch: 43, train_loss: 1.0266, test_loss: 0.9686, test_f1: 0.4697
 epoch: 44, train_loss: 1.0177, test_loss: 0.9627, test_f1: 0.4617
 epoch: 45, train_loss: 1.0101, test_loss: 0.9599, test_f1: 0.4659
 epoch: 46, train_loss: 1.0013, test_loss: 0.9588, test_f1: 0.4662
 epoch: 47, train_loss: 1.0048, test_loss: 0.9593, test_f1: 0.4665
 epoch: 48, train_loss: 1.0048, test_loss: 0.9611, test_f1: 0.4685
 epoch: 49, train_loss: 1.0086, test_loss: 0.9595, test_f1: 0.4583
 epoch: 50, train_loss: 1.0063, test_loss: 0.9609, test_f1: 0.4617
 epoch: 51, train_loss: 0.9940, test_loss: 0.9547, test_f1: 0.4638
 epoch: 52, train_loss: 1.0016, test_loss: 0.9532, test_f1: 0.4640
 epoch: 53, train_loss: 0.9938, test_loss: 0.9571, test_f1: 0.4518
 epoch: 54, train_loss: 0.9905, test_loss: 0.9521, test_f1: 0.4709
 epoch: 55, train_loss: 0.9850, test_loss: 0.9568, test_f1: 0.4637
 epoch: 56, train_loss: 0.9845, test_loss: 0.9574, test_f1: 0.4552
 epoch: 57, train_loss: 0.9837, test_loss: 0.9582, test_f1: 0.4610
 epoch: 58, train_loss: 0.9775, test_loss: 0.9577, test_f1: 0.4540
 epoch: 59, train_loss: 0.9833, test_loss: 0.9589, test_f1: 0.4632
 epoch: 60, train_loss: 0.9763, test_loss: 0.9622, test_f1: 0.4570
 epoch: 61, train_loss: 0.9656, test_loss: 0.9536, test_f1: 0.4604
 epoch: 62, train_loss: 0.9770, test_loss: 0.9613, test_f1: 0.4552
 epoch: 63, train_loss: 0.9747, test_loss: 0.9662, test_f1: 0.4546
 epoch: 64, train_loss: 0.9737, test_loss: 0.9819, test_f1: 0.4538
 epoch: 65, train_loss: 0.9633, test_loss: 0.9644, test_f1: 0.4530
 epoch: 66, train_loss: 0.9680, test_loss: 0.9633, test_f1: 0.4590
 epoch: 67, train_loss: 0.9644, test_loss: 0.9745, test_f1: 0.4605
 epoch: 68, train_loss: 0.9606, test_loss: 0.9893, test_f1: 0.4545
 epoch: 69, train_loss: 0.9583, test_loss: 0.9717, test_f1: 0.4587
 epoch: 70, train_loss: 0.9582, test_loss: 0.9811, test_f1: 0.4597
 epoch: 71, train_loss: 0.9569, test_loss: 0.9671, test_f1: 0.4614
 epoch: 72, train_loss: 0.9653, test_loss: 0.9881, test_f1: 0.4603
 epoch: 73, train_loss: 0.9432, test_loss: 0.9752, test_f1: 0.4694
 epoch: 74, train_loss: 0.9591, test_loss: 0.9847, test_f1: 0.4614
 epoch: 75, train_loss: 0.9631, test_loss: 0.9850, test_f1: 0.4598
 epoch: 76, train_loss: 0.9529, test_loss: 0.9789, test_f1: 0.4634
 epoch: 77, train_loss: 0.9478, test_loss: 1.0025, test_f1: 0.4554
 epoch: 78, train_loss: 0.9492, test_loss: 0.9887, test_f1: 0.4592
 epoch: 79, train_loss: 0.9484, test_loss: 0.9947, test_f1: 0.4588
 epoch: 80, train_loss: 0.9396, test_loss: 0.9874, test_f1: 0.4640
 epoch: 81, train_loss: 0.9413, test_loss: 1.0040, test_f1: 0.4510
 epoch: 82, train_loss: 0.9389, test_loss: 0.9876, test_f1: 0.4614
 epoch: 83, train_loss: 0.9450, test_loss: 1.0212, test_f1: 0.4550
 epoch: 84, train_loss: 0.9494, test_loss: 1.0028, test_f1: 0.4623
 epoch: 85, train_loss: 0.9380, test_loss: 1.0040, test_f1: 0.4637
 epoch: 86, train_loss: 0.9372, test_loss: 1.0009, test_f1: 0.4594
 epoch: 87, train_loss: 0.9291, test_loss: 1.0210, test_f1: 0.4614
 epoch: 88, train_loss: 0.9370, test_loss: 1.0105, test_f1: 0.4612
 epoch: 89, train_loss: 0.9282, test_loss: 1.0112, test_f1: 0.4632
 epoch: 90, train_loss: 0.9353, test_loss: 1.0252, test_f1: 0.4587
 epoch: 91, train_loss: 0.9404, test_loss: 1.0044, test_f1: 0.4684
 epoch: 92, train_loss: 0.9316, test_loss: 1.0212, test_f1: 0.4615
 epoch: 93, train_loss: 0.9245, test_loss: 1.0164, test_f1: 0.4609
 epoch: 94, train_loss: 0.9220, test_loss: 1.0335, test_f1: 0.4599
 epoch: 95, train_loss: 0.9407, test_loss: 1.0284, test_f1: 0.4683
 epoch: 96, train_loss: 0.9226, test_loss: 1.0305, test_f1: 0.4626
 epoch: 97, train_loss: 0.9237, test_loss: 1.0394, test_f1: 0.4536
 epoch: 98, train_loss: 0.9251, test_loss: 1.0203, test_f1: 0.4696
 epoch: 99, train_loss: 0.9171, test_loss: 1.0434, test_f1: 0.4592

Training completed in 394.16 seconds
Best F1: 0.5250 at epoch 96
Mean F1 across iterations: 0.4955  0.0270
========================FINAL RESULTS================================
FEGIN weighted F1: 0.5250  0.0270
python main.py --data ltspice_examples --representation component_component --model FEGIN --layers 3 --hiddens 16 --batch_size 256 --lr 0.001 --emb_size 128 --epochs 100 --save_appendix component_component_L3_H16_BS256_LR0.001_E128 --no_val
-----



STDERR:
  File "main.py", line 370, in <module>
    main()
  File "main.py", line 254, in main
    dataset = dataset_class(
  File "/home/philip/projects/ltspice_examples_code_repo/Circuit-Completion-Using-GNNs/component_classification_with_link_prediction_head/evaluation/FEGIN/kernel/circuit_datasets.py", line 15, in __init__
    self.data, self.slices = torch.load(self.processed_paths[0])
  File "/home/philip/.local/lib/python3.8/site-packages/torch/serialization.py", line 1040, in load
    warnings.warn(
  File "/usr/lib/python3.8/warnings.py", line 109, in _showwarnmsg
    sw(msg.message, msg.category, msg.filename, msg.lineno,
  File "main.py", line 47, in warn_with_traceback
    traceback.print_stack(file=log)
/home/philip/projects/ltspice_examples_code_repo/Circuit-Completion-Using-GNNs/component_classification_with_link_prediction_head/evaluation/FEGIN/kernel/circuit_datasets.py:15: FutureWarning: You are using `torch.load` with `weights_only=False` (the current default value), which uses the default pickle module implicitly. It is possible to construct malicious pickle data which will execute arbitrary code during unpickling (See https://github.com/pytorch/pytorch/blob/main/SECURITY.md#untrusted-models for more details). In a future release, the default value for `weights_only` will be flipped to `True`. This limits the functions that could be executed during unpickling. Arbitrary objects will no longer be allowed to be loaded via this mode unless they are explicitly allowlisted by the user via `torch.serialization.add_safe_globals`. We recommend you start setting `weights_only=True` for any use case where you don't have full control of the loaded file. Please open an issue on GitHub for any issues related to this experimental feature.
  self.data, self.slices = torch.load(self.processed_paths[0])
