STDOUT:
Results will be saved in /home/philip/projects/ltspice_examples_code_repo/Circuit-Completion-Using-GNNs/component_classification_with_link_prediction_head/evaluation/FEGIN/results/model_FEGIN_dataset_ltspice_examples
Command line input: python main.py --data ltspice_examples --representation component_net --model FEGIN --layers 2 --hiddens 128 --batch_size 32 --lr 0.0001 --emb_size 128 --epochs 100 --save_appendix component_net_L2_H128_BS32_LR0.0001_E128 --no_val
 is saved.
-----
ltspice_examples - FEGIN
Using 2 layers, 128 hidden units, h = 2
Loading component_net representation dataset
ENTERED
Training FEGIN on component_net representation
Train: 3558, Test: 846
##################ITERATION #0 ****************************************
 epoch: 0, train_loss: 1.3299, test_loss: 1.2619, test_f1: 0.2270
 epoch: 1, train_loss: 1.2373, test_loss: 1.1992, test_f1: 0.2783
 epoch: 2, train_loss: 1.1882, test_loss: 1.1255, test_f1: 0.3553
 epoch: 3, train_loss: 1.1297, test_loss: 1.0605, test_f1: 0.4269
 epoch: 4, train_loss: 1.0657, test_loss: 1.0156, test_f1: 0.4441
 epoch: 5, train_loss: 1.0240, test_loss: 0.9965, test_f1: 0.4799
 epoch: 6, train_loss: 0.9904, test_loss: 0.9720, test_f1: 0.4611
 epoch: 7, train_loss: 0.9724, test_loss: 0.9506, test_f1: 0.4941
 epoch: 8, train_loss: 0.9575, test_loss: 0.9386, test_f1: 0.4939
 epoch: 9, train_loss: 0.9515, test_loss: 0.9389, test_f1: 0.4874
 epoch: 10, train_loss: 0.9336, test_loss: 0.9416, test_f1: 0.4846
 epoch: 11, train_loss: 0.9303, test_loss: 0.9381, test_f1: 0.4891
 epoch: 12, train_loss: 0.9152, test_loss: 0.9131, test_f1: 0.5126
 epoch: 13, train_loss: 0.9051, test_loss: 0.9278, test_f1: 0.5173
 epoch: 14, train_loss: 0.9039, test_loss: 0.9236, test_f1: 0.4898
 epoch: 15, train_loss: 0.8939, test_loss: 0.9321, test_f1: 0.5078
 epoch: 16, train_loss: 0.8826, test_loss: 0.9243, test_f1: 0.5088
 epoch: 17, train_loss: 0.8793, test_loss: 0.9101, test_f1: 0.5250
 epoch: 18, train_loss: 0.8744, test_loss: 0.9376, test_f1: 0.5138
 epoch: 19, train_loss: 0.8719, test_loss: 0.9124, test_f1: 0.5369
 epoch: 20, train_loss: 0.8606, test_loss: 0.9050, test_f1: 0.5290
 epoch: 21, train_loss: 0.8613, test_loss: 0.8923, test_f1: 0.5456
 epoch: 22, train_loss: 0.8412, test_loss: 0.9016, test_f1: 0.5229
 epoch: 23, train_loss: 0.8386, test_loss: 0.9194, test_f1: 0.5304
 epoch: 24, train_loss: 0.8420, test_loss: 0.8986, test_f1: 0.5352
 epoch: 25, train_loss: 0.8408, test_loss: 0.8991, test_f1: 0.5327
 epoch: 26, train_loss: 0.8242, test_loss: 0.9191, test_f1: 0.5340
 epoch: 27, train_loss: 0.8252, test_loss: 0.9142, test_f1: 0.5398
 epoch: 28, train_loss: 0.8101, test_loss: 0.9097, test_f1: 0.5208
 epoch: 29, train_loss: 0.8163, test_loss: 0.9018, test_f1: 0.5390
 epoch: 30, train_loss: 0.7980, test_loss: 0.9540, test_f1: 0.5305
 epoch: 31, train_loss: 0.8114, test_loss: 0.9167, test_f1: 0.5571
 epoch: 32, train_loss: 0.8052, test_loss: 0.9096, test_f1: 0.5691
 epoch: 33, train_loss: 0.7995, test_loss: 0.9158, test_f1: 0.5271
 epoch: 34, train_loss: 0.8058, test_loss: 0.9090, test_f1: 0.5462
 epoch: 35, train_loss: 0.7811, test_loss: 0.9082, test_f1: 0.5337
 epoch: 36, train_loss: 0.7853, test_loss: 0.9149, test_f1: 0.5222
 epoch: 37, train_loss: 0.7790, test_loss: 0.9110, test_f1: 0.5548
 epoch: 38, train_loss: 0.7732, test_loss: 0.9103, test_f1: 0.5194
 epoch: 39, train_loss: 0.7746, test_loss: 0.9058, test_f1: 0.5785
 epoch: 40, train_loss: 0.7656, test_loss: 0.9092, test_f1: 0.5860
 epoch: 41, train_loss: 0.7583, test_loss: 0.9023, test_f1: 0.5480
 epoch: 42, train_loss: 0.7604, test_loss: 0.9513, test_f1: 0.5606
 epoch: 43, train_loss: 0.7644, test_loss: 0.8841, test_f1: 0.5501
 epoch: 44, train_loss: 0.7620, test_loss: 0.9414, test_f1: 0.5470
 epoch: 45, train_loss: 0.7494, test_loss: 0.9324, test_f1: 0.5631
 epoch: 46, train_loss: 0.7376, test_loss: 0.9391, test_f1: 0.5580
 epoch: 47, train_loss: 0.7437, test_loss: 0.9346, test_f1: 0.5981
 epoch: 48, train_loss: 0.7462, test_loss: 0.9379, test_f1: 0.5753
 epoch: 49, train_loss: 0.7305, test_loss: 0.9685, test_f1: 0.5470
 epoch: 50, train_loss: 0.7294, test_loss: 0.9285, test_f1: 0.5934
 epoch: 51, train_loss: 0.7213, test_loss: 0.9124, test_f1: 0.6090
 epoch: 52, train_loss: 0.7182, test_loss: 0.9410, test_f1: 0.5816
 epoch: 53, train_loss: 0.7220, test_loss: 0.9369, test_f1: 0.5920
 epoch: 54, train_loss: 0.6963, test_loss: 0.9494, test_f1: 0.6177
 epoch: 55, train_loss: 0.7077, test_loss: 0.9487, test_f1: 0.6000
 epoch: 56, train_loss: 0.7032, test_loss: 0.9461, test_f1: 0.5765
 epoch: 57, train_loss: 0.7011, test_loss: 0.9298, test_f1: 0.6069
 epoch: 58, train_loss: 0.7015, test_loss: 0.9869, test_f1: 0.5838
 epoch: 59, train_loss: 0.6989, test_loss: 0.9544, test_f1: 0.6101
 epoch: 60, train_loss: 0.7015, test_loss: 0.9452, test_f1: 0.6096
 epoch: 61, train_loss: 0.6974, test_loss: 0.9517, test_f1: 0.6092
 epoch: 62, train_loss: 0.6915, test_loss: 0.9520, test_f1: 0.6024
 epoch: 63, train_loss: 0.6965, test_loss: 0.9828, test_f1: 0.6008
 epoch: 64, train_loss: 0.6989, test_loss: 0.9475, test_f1: 0.5984
 epoch: 65, train_loss: 0.6983, test_loss: 0.9156, test_f1: 0.6051
 epoch: 66, train_loss: 0.6849, test_loss: 0.9422, test_f1: 0.6155
 epoch: 67, train_loss: 0.6812, test_loss: 0.9483, test_f1: 0.6060
 epoch: 68, train_loss: 0.6867, test_loss: 0.9570, test_f1: 0.6010
 epoch: 69, train_loss: 0.6967, test_loss: 0.9700, test_f1: 0.6054
 epoch: 70, train_loss: 0.6867, test_loss: 0.9596, test_f1: 0.6120
 epoch: 71, train_loss: 0.6758, test_loss: 0.9322, test_f1: 0.6075
 epoch: 72, train_loss: 0.6752, test_loss: 0.9451, test_f1: 0.6200
 epoch: 73, train_loss: 0.6805, test_loss: 0.9590, test_f1: 0.6040
 epoch: 74, train_loss: 0.6730, test_loss: 0.9499, test_f1: 0.6139
 epoch: 75, train_loss: 0.6671, test_loss: 0.9522, test_f1: 0.6242
 epoch: 76, train_loss: 0.6695, test_loss: 0.9577, test_f1: 0.6199
 epoch: 77, train_loss: 0.6747, test_loss: 1.0118, test_f1: 0.5959
 epoch: 78, train_loss: 0.6731, test_loss: 0.9629, test_f1: 0.6162
 epoch: 79, train_loss: 0.6690, test_loss: 0.9718, test_f1: 0.6115
 epoch: 80, train_loss: 0.6706, test_loss: 1.0012, test_f1: 0.6057
 epoch: 81, train_loss: 0.6586, test_loss: 0.9562, test_f1: 0.6230
 epoch: 82, train_loss: 0.6728, test_loss: 0.9935, test_f1: 0.6014
 epoch: 83, train_loss: 0.6569, test_loss: 0.9481, test_f1: 0.6285
 epoch: 84, train_loss: 0.6691, test_loss: 0.9748, test_f1: 0.6119
 epoch: 85, train_loss: 0.6560, test_loss: 0.9804, test_f1: 0.6145
 epoch: 86, train_loss: 0.6592, test_loss: 0.9581, test_f1: 0.6212
 epoch: 87, train_loss: 0.6603, test_loss: 0.9607, test_f1: 0.6345
 epoch: 88, train_loss: 0.6539, test_loss: 0.9820, test_f1: 0.6141
 epoch: 89, train_loss: 0.6397, test_loss: 0.9756, test_f1: 0.6189
 epoch: 90, train_loss: 0.6547, test_loss: 0.9879, test_f1: 0.6302
 epoch: 91, train_loss: 0.6508, test_loss: 0.9732, test_f1: 0.6284
 epoch: 92, train_loss: 0.6477, test_loss: 0.9621, test_f1: 0.6281
 epoch: 93, train_loss: 0.6473, test_loss: 0.9927, test_f1: 0.6231
 epoch: 94, train_loss: 0.6283, test_loss: 1.0096, test_f1: 0.6113
 epoch: 95, train_loss: 0.6381, test_loss: 0.9917, test_f1: 0.6195
 epoch: 96, train_loss: 0.6544, test_loss: 1.0003, test_f1: 0.6229
 epoch: 97, train_loss: 0.6452, test_loss: 0.9915, test_f1: 0.6329
 epoch: 98, train_loss: 0.6247, test_loss: 1.0286, test_f1: 0.6061
 epoch: 99, train_loss: 0.6352, test_loss: 1.0327, test_f1: 0.6062
##################ITERATION #1 ****************************************
 epoch: 0, train_loss: 1.2277, test_loss: 1.1113, test_f1: 0.3784
 epoch: 1, train_loss: 1.1082, test_loss: 1.0346, test_f1: 0.4470
 epoch: 2, train_loss: 1.0516, test_loss: 0.9866, test_f1: 0.4635
 epoch: 3, train_loss: 1.0104, test_loss: 0.9587, test_f1: 0.4816
 epoch: 4, train_loss: 0.9842, test_loss: 0.9451, test_f1: 0.5082
 epoch: 5, train_loss: 0.9618, test_loss: 0.9324, test_f1: 0.5064
 epoch: 6, train_loss: 0.9441, test_loss: 0.9438, test_f1: 0.5012
 epoch: 7, train_loss: 0.9258, test_loss: 0.9210, test_f1: 0.5165
 epoch: 8, train_loss: 0.9140, test_loss: 0.9179, test_f1: 0.5209
 epoch: 9, train_loss: 0.9024, test_loss: 0.9090, test_f1: 0.5147
 epoch: 10, train_loss: 0.8879, test_loss: 0.9008, test_f1: 0.5444
 epoch: 11, train_loss: 0.8818, test_loss: 0.8833, test_f1: 0.5413
 epoch: 12, train_loss: 0.8734, test_loss: 0.8792, test_f1: 0.5611
 epoch: 13, train_loss: 0.8604, test_loss: 0.8903, test_f1: 0.5565
 epoch: 14, train_loss: 0.8581, test_loss: 0.8710, test_f1: 0.5494
 epoch: 15, train_loss: 0.8444, test_loss: 0.9247, test_f1: 0.5330
 epoch: 16, train_loss: 0.8387, test_loss: 0.9080, test_f1: 0.5481
 epoch: 17, train_loss: 0.8342, test_loss: 0.8850, test_f1: 0.5522
 epoch: 18, train_loss: 0.8346, test_loss: 0.8999, test_f1: 0.5541
 epoch: 19, train_loss: 0.8097, test_loss: 0.8910, test_f1: 0.5589
 epoch: 20, train_loss: 0.8046, test_loss: 0.8794, test_f1: 0.5714
 epoch: 21, train_loss: 0.8081, test_loss: 0.8757, test_f1: 0.5913
 epoch: 22, train_loss: 0.8065, test_loss: 0.8937, test_f1: 0.5716
 epoch: 23, train_loss: 0.7951, test_loss: 0.8646, test_f1: 0.5638
 epoch: 24, train_loss: 0.7978, test_loss: 0.8873, test_f1: 0.5583
 epoch: 25, train_loss: 0.7852, test_loss: 0.8703, test_f1: 0.5743
 epoch: 26, train_loss: 0.7744, test_loss: 0.8679, test_f1: 0.5921
 epoch: 27, train_loss: 0.7778, test_loss: 0.8765, test_f1: 0.5894
 epoch: 28, train_loss: 0.7690, test_loss: 0.8820, test_f1: 0.5852
 epoch: 29, train_loss: 0.7721, test_loss: 0.8917, test_f1: 0.6031
 epoch: 30, train_loss: 0.7520, test_loss: 0.8848, test_f1: 0.6092
 epoch: 31, train_loss: 0.7532, test_loss: 0.8806, test_f1: 0.5825
 epoch: 32, train_loss: 0.7593, test_loss: 0.8979, test_f1: 0.5892
 epoch: 33, train_loss: 0.7547, test_loss: 0.8747, test_f1: 0.6150
 epoch: 34, train_loss: 0.7387, test_loss: 0.9120, test_f1: 0.5915
 epoch: 35, train_loss: 0.7431, test_loss: 0.8873, test_f1: 0.6087
 epoch: 36, train_loss: 0.7389, test_loss: 0.8728, test_f1: 0.6330
 epoch: 37, train_loss: 0.7261, test_loss: 0.8918, test_f1: 0.6026
 epoch: 38, train_loss: 0.7209, test_loss: 0.8922, test_f1: 0.6230
 epoch: 39, train_loss: 0.7141, test_loss: 0.8911, test_f1: 0.6180
 epoch: 40, train_loss: 0.7065, test_loss: 0.8920, test_f1: 0.6143
 epoch: 41, train_loss: 0.7040, test_loss: 0.9206, test_f1: 0.6021
 epoch: 42, train_loss: 0.6994, test_loss: 0.8982, test_f1: 0.6199
 epoch: 43, train_loss: 0.6984, test_loss: 0.8990, test_f1: 0.6041
 epoch: 44, train_loss: 0.7013, test_loss: 0.8815, test_f1: 0.6379
 epoch: 45, train_loss: 0.6894, test_loss: 0.8939, test_f1: 0.6427
 epoch: 46, train_loss: 0.6885, test_loss: 0.8849, test_f1: 0.6472
 epoch: 47, train_loss: 0.6892, test_loss: 0.8872, test_f1: 0.6405
 epoch: 48, train_loss: 0.6939, test_loss: 0.9071, test_f1: 0.6357
 epoch: 49, train_loss: 0.6910, test_loss: 0.9024, test_f1: 0.6401
 epoch: 50, train_loss: 0.6664, test_loss: 0.9078, test_f1: 0.6327
 epoch: 51, train_loss: 0.6690, test_loss: 0.9058, test_f1: 0.6524
 epoch: 52, train_loss: 0.6524, test_loss: 0.8836, test_f1: 0.6525
 epoch: 53, train_loss: 0.6506, test_loss: 0.8944, test_f1: 0.6539
 epoch: 54, train_loss: 0.6525, test_loss: 0.9217, test_f1: 0.6412
 epoch: 55, train_loss: 0.6556, test_loss: 0.9075, test_f1: 0.6425
 epoch: 56, train_loss: 0.6525, test_loss: 0.9266, test_f1: 0.6457
 epoch: 57, train_loss: 0.6568, test_loss: 0.9092, test_f1: 0.6575
 epoch: 58, train_loss: 0.6492, test_loss: 0.8936, test_f1: 0.6584
 epoch: 59, train_loss: 0.6421, test_loss: 0.9028, test_f1: 0.6586
 epoch: 60, train_loss: 0.6481, test_loss: 0.8966, test_f1: 0.6644
 epoch: 61, train_loss: 0.6478, test_loss: 0.9247, test_f1: 0.6509
 epoch: 62, train_loss: 0.6349, test_loss: 0.9329, test_f1: 0.6479
 epoch: 63, train_loss: 0.6399, test_loss: 0.9129, test_f1: 0.6545
 epoch: 64, train_loss: 0.6372, test_loss: 0.9160, test_f1: 0.6651
 epoch: 65, train_loss: 0.6276, test_loss: 0.9161, test_f1: 0.6611
 epoch: 66, train_loss: 0.6314, test_loss: 0.9066, test_f1: 0.6752
 epoch: 67, train_loss: 0.6309, test_loss: 0.8931, test_f1: 0.6686
 epoch: 68, train_loss: 0.6245, test_loss: 0.9307, test_f1: 0.6568
 epoch: 69, train_loss: 0.6245, test_loss: 0.9059, test_f1: 0.6825
 epoch: 70, train_loss: 0.6317, test_loss: 0.9270, test_f1: 0.6678
 epoch: 71, train_loss: 0.6184, test_loss: 0.9139, test_f1: 0.6541
 epoch: 72, train_loss: 0.6153, test_loss: 0.9246, test_f1: 0.6701
 epoch: 73, train_loss: 0.6152, test_loss: 0.9190, test_f1: 0.6652
 epoch: 74, train_loss: 0.6152, test_loss: 0.9174, test_f1: 0.6601
 epoch: 75, train_loss: 0.6133, test_loss: 0.9306, test_f1: 0.6590
 epoch: 76, train_loss: 0.6096, test_loss: 0.9172, test_f1: 0.6757
 epoch: 77, train_loss: 0.6139, test_loss: 0.9262, test_f1: 0.6689
 epoch: 78, train_loss: 0.6137, test_loss: 0.9256, test_f1: 0.6732
 epoch: 79, train_loss: 0.6069, test_loss: 0.9132, test_f1: 0.6589
 epoch: 80, train_loss: 0.6080, test_loss: 0.9693, test_f1: 0.6663
 epoch: 81, train_loss: 0.6111, test_loss: 0.9389, test_f1: 0.6743
 epoch: 82, train_loss: 0.6135, test_loss: 0.9391, test_f1: 0.6668
 epoch: 83, train_loss: 0.6101, test_loss: 0.9582, test_f1: 0.6568
 epoch: 84, train_loss: 0.5989, test_loss: 0.9267, test_f1: 0.6700
 epoch: 85, train_loss: 0.5941, test_loss: 0.9239, test_f1: 0.6874
 epoch: 86, train_loss: 0.5939, test_loss: 0.9660, test_f1: 0.6487
 epoch: 87, train_loss: 0.6089, test_loss: 0.9405, test_f1: 0.6682
 epoch: 88, train_loss: 0.5910, test_loss: 0.9326, test_f1: 0.6721
 epoch: 89, train_loss: 0.5916, test_loss: 0.9605, test_f1: 0.6612
 epoch: 90, train_loss: 0.5950, test_loss: 0.9583, test_f1: 0.6561
 epoch: 91, train_loss: 0.5902, test_loss: 0.9732, test_f1: 0.6674
 epoch: 92, train_loss: 0.5943, test_loss: 0.9725, test_f1: 0.6653
 epoch: 93, train_loss: 0.5980, test_loss: 0.9562, test_f1: 0.6469
 epoch: 94, train_loss: 0.5860, test_loss: 0.9746, test_f1: 0.6476
 epoch: 95, train_loss: 0.5809, test_loss: 0.9725, test_f1: 0.6744
 epoch: 96, train_loss: 0.5911, test_loss: 0.9683, test_f1: 0.6809
 epoch: 97, train_loss: 0.5918, test_loss: 0.9700, test_f1: 0.6715
 epoch: 98, train_loss: 0.5712, test_loss: 0.9691, test_f1: 0.6726
 epoch: 99, train_loss: 0.5761, test_loss: 0.9499, test_f1: 0.6732
##################ITERATION #2 ****************************************
 epoch: 0, train_loss: 1.2006, test_loss: 1.0475, test_f1: 0.4646
 epoch: 1, train_loss: 1.0696, test_loss: 1.0007, test_f1: 0.4734
 epoch: 2, train_loss: 1.0319, test_loss: 0.9766, test_f1: 0.4913
 epoch: 3, train_loss: 0.9908, test_loss: 0.9569, test_f1: 0.4856
 epoch: 4, train_loss: 0.9755, test_loss: 0.9349, test_f1: 0.5162
 epoch: 5, train_loss: 0.9579, test_loss: 0.9344, test_f1: 0.5071
 epoch: 6, train_loss: 0.9450, test_loss: 0.9101, test_f1: 0.5158
 epoch: 7, train_loss: 0.9321, test_loss: 0.9227, test_f1: 0.5245
 epoch: 8, train_loss: 0.9195, test_loss: 0.8930, test_f1: 0.5176
 epoch: 9, train_loss: 0.9123, test_loss: 0.9049, test_f1: 0.5348
 epoch: 10, train_loss: 0.8977, test_loss: 0.8877, test_f1: 0.5487
 epoch: 11, train_loss: 0.8966, test_loss: 0.8745, test_f1: 0.5359
 epoch: 12, train_loss: 0.8799, test_loss: 0.8815, test_f1: 0.5303
 epoch: 13, train_loss: 0.8701, test_loss: 0.8678, test_f1: 0.5399
 epoch: 14, train_loss: 0.8667, test_loss: 0.8561, test_f1: 0.5554
 epoch: 15, train_loss: 0.8534, test_loss: 0.8839, test_f1: 0.5477
 epoch: 16, train_loss: 0.8442, test_loss: 0.9031, test_f1: 0.5668
 epoch: 17, train_loss: 0.8320, test_loss: 0.8735, test_f1: 0.5392
 epoch: 18, train_loss: 0.8335, test_loss: 0.8764, test_f1: 0.5405
 epoch: 19, train_loss: 0.8272, test_loss: 0.8974, test_f1: 0.5297
 epoch: 20, train_loss: 0.8106, test_loss: 0.8720, test_f1: 0.5541
 epoch: 21, train_loss: 0.8029, test_loss: 0.9092, test_f1: 0.5525
 epoch: 22, train_loss: 0.8066, test_loss: 0.8913, test_f1: 0.5417
 epoch: 23, train_loss: 0.7998, test_loss: 0.8989, test_f1: 0.5547
 epoch: 24, train_loss: 0.7980, test_loss: 0.9143, test_f1: 0.5388
 epoch: 25, train_loss: 0.7866, test_loss: 0.9298, test_f1: 0.5614
 epoch: 26, train_loss: 0.7990, test_loss: 0.9034, test_f1: 0.5654
 epoch: 27, train_loss: 0.7770, test_loss: 0.9415, test_f1: 0.5572
 epoch: 28, train_loss: 0.7736, test_loss: 0.8854, test_f1: 0.5604
 epoch: 29, train_loss: 0.7710, test_loss: 0.8688, test_f1: 0.5912
 epoch: 30, train_loss: 0.7670, test_loss: 0.8961, test_f1: 0.5528
 epoch: 31, train_loss: 0.7577, test_loss: 0.9546, test_f1: 0.5451
 epoch: 32, train_loss: 0.7632, test_loss: 0.9261, test_f1: 0.5900
 epoch: 33, train_loss: 0.7398, test_loss: 0.9261, test_f1: 0.5889
 epoch: 34, train_loss: 0.7425, test_loss: 0.9347, test_f1: 0.5931
 epoch: 35, train_loss: 0.7386, test_loss: 0.9292, test_f1: 0.6110
 epoch: 36, train_loss: 0.7398, test_loss: 0.9124, test_f1: 0.6187
 epoch: 37, train_loss: 0.7293, test_loss: 0.9400, test_f1: 0.5654
 epoch: 38, train_loss: 0.7331, test_loss: 0.9454, test_f1: 0.6156
 epoch: 39, train_loss: 0.7348, test_loss: 0.9077, test_f1: 0.5986
 epoch: 40, train_loss: 0.7206, test_loss: 0.9203, test_f1: 0.6367
 epoch: 41, train_loss: 0.7187, test_loss: 0.9535, test_f1: 0.6156
 epoch: 42, train_loss: 0.7062, test_loss: 0.9675, test_f1: 0.6149
 epoch: 43, train_loss: 0.7062, test_loss: 0.9094, test_f1: 0.6308
 epoch: 44, train_loss: 0.7074, test_loss: 0.9265, test_f1: 0.5984
 epoch: 45, train_loss: 0.7083, test_loss: 0.9729, test_f1: 0.6392
 epoch: 46, train_loss: 0.6948, test_loss: 0.9650, test_f1: 0.6227
 epoch: 47, train_loss: 0.6854, test_loss: 0.9363, test_f1: 0.6001
 epoch: 48, train_loss: 0.6895, test_loss: 0.9465, test_f1: 0.6333
 epoch: 49, train_loss: 0.6830, test_loss: 0.9579, test_f1: 0.6309
 epoch: 50, train_loss: 0.6833, test_loss: 0.9809, test_f1: 0.5903
 epoch: 51, train_loss: 0.6612, test_loss: 0.9341, test_f1: 0.6377
 epoch: 52, train_loss: 0.6618, test_loss: 0.9642, test_f1: 0.6140
 epoch: 53, train_loss: 0.6644, test_loss: 0.9883, test_f1: 0.6403
 epoch: 54, train_loss: 0.6529, test_loss: 0.9381, test_f1: 0.6468
 epoch: 55, train_loss: 0.6472, test_loss: 0.9821, test_f1: 0.6071
 epoch: 56, train_loss: 0.6553, test_loss: 0.9693, test_f1: 0.6419
 epoch: 57, train_loss: 0.6585, test_loss: 0.9666, test_f1: 0.6482
 epoch: 58, train_loss: 0.6481, test_loss: 0.9561, test_f1: 0.6594
 epoch: 59, train_loss: 0.6600, test_loss: 0.9638, test_f1: 0.6271
 epoch: 60, train_loss: 0.6426, test_loss: 0.9781, test_f1: 0.6463
 epoch: 61, train_loss: 0.6460, test_loss: 0.9517, test_f1: 0.6445
 epoch: 62, train_loss: 0.6402, test_loss: 1.0122, test_f1: 0.6478
 epoch: 63, train_loss: 0.6504, test_loss: 1.0128, test_f1: 0.6331
 epoch: 64, train_loss: 0.6489, test_loss: 0.9780, test_f1: 0.6405
 epoch: 65, train_loss: 0.6297, test_loss: 0.9744, test_f1: 0.6467
 epoch: 66, train_loss: 0.6352, test_loss: 0.9964, test_f1: 0.6509
 epoch: 67, train_loss: 0.6436, test_loss: 0.9963, test_f1: 0.6380
 epoch: 68, train_loss: 0.6222, test_loss: 0.9731, test_f1: 0.6505
 epoch: 69, train_loss: 0.6384, test_loss: 1.0027, test_f1: 0.6394
 epoch: 70, train_loss: 0.6277, test_loss: 0.9576, test_f1: 0.6513
 epoch: 71, train_loss: 0.6226, test_loss: 1.0006, test_f1: 0.6381
 epoch: 72, train_loss: 0.6249, test_loss: 1.0162, test_f1: 0.6246
 epoch: 73, train_loss: 0.6182, test_loss: 0.9718, test_f1: 0.6610
 epoch: 74, train_loss: 0.6230, test_loss: 1.0093, test_f1: 0.6626
 epoch: 75, train_loss: 0.6252, test_loss: 1.0111, test_f1: 0.6555
 epoch: 76, train_loss: 0.6146, test_loss: 0.9818, test_f1: 0.6450
 epoch: 77, train_loss: 0.6256, test_loss: 1.0281, test_f1: 0.6465
 epoch: 78, train_loss: 0.6165, test_loss: 0.9733, test_f1: 0.6476
 epoch: 79, train_loss: 0.6142, test_loss: 0.9836, test_f1: 0.6722
 epoch: 80, train_loss: 0.6072, test_loss: 1.0374, test_f1: 0.6534
 epoch: 81, train_loss: 0.6136, test_loss: 0.9604, test_f1: 0.6616
 epoch: 82, train_loss: 0.6089, test_loss: 0.9885, test_f1: 0.6297
 epoch: 83, train_loss: 0.6142, test_loss: 0.9881, test_f1: 0.6511
 epoch: 84, train_loss: 0.5966, test_loss: 0.9720, test_f1: 0.6511
 epoch: 85, train_loss: 0.6073, test_loss: 1.0298, test_f1: 0.6385
 epoch: 86, train_loss: 0.5857, test_loss: 0.9937, test_f1: 0.6826
 epoch: 87, train_loss: 0.5959, test_loss: 1.0077, test_f1: 0.6722
 epoch: 88, train_loss: 0.6027, test_loss: 1.0089, test_f1: 0.6583
 epoch: 89, train_loss: 0.5976, test_loss: 0.9937, test_f1: 0.6553
 epoch: 90, train_loss: 0.5941, test_loss: 1.0496, test_f1: 0.6463
 epoch: 91, train_loss: 0.5937, test_loss: 1.0380, test_f1: 0.6498
 epoch: 92, train_loss: 0.5841, test_loss: 1.0100, test_f1: 0.6355
 epoch: 93, train_loss: 0.5906, test_loss: 0.9925, test_f1: 0.6678
 epoch: 94, train_loss: 0.5854, test_loss: 0.9840, test_f1: 0.6658
 epoch: 95, train_loss: 0.5810, test_loss: 1.0042, test_f1: 0.6536
 epoch: 96, train_loss: 0.5885, test_loss: 1.0038, test_f1: 0.6655
 epoch: 97, train_loss: 0.5873, test_loss: 1.0238, test_f1: 0.6310
 epoch: 98, train_loss: 0.5706, test_loss: 1.0183, test_f1: 0.6759
 epoch: 99, train_loss: 0.5826, test_loss: 0.9829, test_f1: 0.6465
##################ITERATION #3 ****************************************
 epoch: 0, train_loss: 1.1875, test_loss: 1.0274, test_f1: 0.5013
 epoch: 1, train_loss: 1.0639, test_loss: 0.9842, test_f1: 0.4862
 epoch: 2, train_loss: 1.0323, test_loss: 0.9701, test_f1: 0.5020
 epoch: 3, train_loss: 0.9915, test_loss: 0.9511, test_f1: 0.5285
 epoch: 4, train_loss: 0.9787, test_loss: 0.9334, test_f1: 0.5053
 epoch: 5, train_loss: 0.9569, test_loss: 0.9267, test_f1: 0.4999
 epoch: 6, train_loss: 0.9428, test_loss: 0.9223, test_f1: 0.5078
 epoch: 7, train_loss: 0.9246, test_loss: 0.9243, test_f1: 0.5348
 epoch: 8, train_loss: 0.9206, test_loss: 0.9041, test_f1: 0.5419
 epoch: 9, train_loss: 0.9110, test_loss: 0.8933, test_f1: 0.5498
 epoch: 10, train_loss: 0.8895, test_loss: 0.9040, test_f1: 0.5552
 epoch: 11, train_loss: 0.8882, test_loss: 0.9015, test_f1: 0.5500
 epoch: 12, train_loss: 0.8863, test_loss: 0.9056, test_f1: 0.5679
 epoch: 13, train_loss: 0.8644, test_loss: 0.8923, test_f1: 0.5668
 epoch: 14, train_loss: 0.8535, test_loss: 0.8950, test_f1: 0.5305
 epoch: 15, train_loss: 0.8506, test_loss: 0.8967, test_f1: 0.5494
 epoch: 16, train_loss: 0.8536, test_loss: 0.8844, test_f1: 0.5873
 epoch: 17, train_loss: 0.8377, test_loss: 0.8751, test_f1: 0.5808
 epoch: 18, train_loss: 0.8261, test_loss: 0.8968, test_f1: 0.5490
 epoch: 19, train_loss: 0.8303, test_loss: 0.8642, test_f1: 0.5863
 epoch: 20, train_loss: 0.8248, test_loss: 0.8797, test_f1: 0.5916
 epoch: 21, train_loss: 0.8130, test_loss: 0.8760, test_f1: 0.5740
 epoch: 22, train_loss: 0.8153, test_loss: 0.8863, test_f1: 0.5863
 epoch: 23, train_loss: 0.8007, test_loss: 0.8744, test_f1: 0.5916
 epoch: 24, train_loss: 0.7981, test_loss: 0.8820, test_f1: 0.5958
 epoch: 25, train_loss: 0.7924, test_loss: 0.8624, test_f1: 0.6182
 epoch: 26, train_loss: 0.7903, test_loss: 0.9021, test_f1: 0.5902
 epoch: 27, train_loss: 0.7920, test_loss: 0.8936, test_f1: 0.6133
 epoch: 28, train_loss: 0.7842, test_loss: 0.9039, test_f1: 0.6131
 epoch: 29, train_loss: 0.7740, test_loss: 0.8878, test_f1: 0.6303
 epoch: 30, train_loss: 0.7764, test_loss: 0.8995, test_f1: 0.6011
 epoch: 31, train_loss: 0.7690, test_loss: 0.8750, test_f1: 0.5798
 epoch: 32, train_loss: 0.7664, test_loss: 0.9066, test_f1: 0.6187
 epoch: 33, train_loss: 0.7612, test_loss: 0.9074, test_f1: 0.6083
 epoch: 34, train_loss: 0.7503, test_loss: 0.9219, test_f1: 0.5953
 epoch: 35, train_loss: 0.7577, test_loss: 0.8918, test_f1: 0.6026
 epoch: 36, train_loss: 0.7562, test_loss: 0.8914, test_f1: 0.6381
 epoch: 37, train_loss: 0.7443, test_loss: 0.9067, test_f1: 0.6172
 epoch: 38, train_loss: 0.7280, test_loss: 0.9134, test_f1: 0.6428
 epoch: 39, train_loss: 0.7317, test_loss: 0.8766, test_f1: 0.6127
 epoch: 40, train_loss: 0.7325, test_loss: 0.8976, test_f1: 0.6225
 epoch: 41, train_loss: 0.7347, test_loss: 0.9062, test_f1: 0.5913
 epoch: 42, train_loss: 0.7349, test_loss: 0.9162, test_f1: 0.6081
 epoch: 43, train_loss: 0.7229, test_loss: 0.9207, test_f1: 0.6154
 epoch: 44, train_loss: 0.7159, test_loss: 0.8994, test_f1: 0.6258
 epoch: 45, train_loss: 0.7163, test_loss: 0.9083, test_f1: 0.6383
 epoch: 46, train_loss: 0.7117, test_loss: 0.8871, test_f1: 0.6284
 epoch: 47, train_loss: 0.7198, test_loss: 0.9144, test_f1: 0.6208
 epoch: 48, train_loss: 0.7052, test_loss: 0.9169, test_f1: 0.6365
 epoch: 49, train_loss: 0.7115, test_loss: 0.9102, test_f1: 0.6473
 epoch: 50, train_loss: 0.6997, test_loss: 0.8936, test_f1: 0.6256
 epoch: 51, train_loss: 0.6888, test_loss: 0.8984, test_f1: 0.6400
 epoch: 52, train_loss: 0.6873, test_loss: 0.9089, test_f1: 0.6073
 epoch: 53, train_loss: 0.6770, test_loss: 0.9244, test_f1: 0.6378
 epoch: 54, train_loss: 0.6816, test_loss: 0.9258, test_f1: 0.6288
 epoch: 55, train_loss: 0.6792, test_loss: 0.9300, test_f1: 0.6302
 epoch: 56, train_loss: 0.6665, test_loss: 0.9263, test_f1: 0.6307
 epoch: 57, train_loss: 0.6758, test_loss: 0.9291, test_f1: 0.6181
 epoch: 58, train_loss: 0.6642, test_loss: 0.9013, test_f1: 0.6478
 epoch: 59, train_loss: 0.6786, test_loss: 0.9368, test_f1: 0.6393
 epoch: 60, train_loss: 0.6763, test_loss: 0.9228, test_f1: 0.6268
 epoch: 61, train_loss: 0.6636, test_loss: 0.9082, test_f1: 0.6346
 epoch: 62, train_loss: 0.6640, test_loss: 0.9159, test_f1: 0.6480
 epoch: 63, train_loss: 0.6658, test_loss: 0.9167, test_f1: 0.6433
 epoch: 64, train_loss: 0.6597, test_loss: 0.9124, test_f1: 0.6562
 epoch: 65, train_loss: 0.6614, test_loss: 0.9095, test_f1: 0.6346
 epoch: 66, train_loss: 0.6635, test_loss: 0.9334, test_f1: 0.6552
 epoch: 67, train_loss: 0.6574, test_loss: 0.9127, test_f1: 0.6570
 epoch: 68, train_loss: 0.6627, test_loss: 0.9332, test_f1: 0.6645
 epoch: 69, train_loss: 0.6422, test_loss: 0.9302, test_f1: 0.6736
 epoch: 70, train_loss: 0.6528, test_loss: 0.9250, test_f1: 0.6647
 epoch: 71, train_loss: 0.6467, test_loss: 0.9199, test_f1: 0.6589
 epoch: 72, train_loss: 0.6454, test_loss: 0.9440, test_f1: 0.6637
 epoch: 73, train_loss: 0.6448, test_loss: 0.9376, test_f1: 0.6744
 epoch: 74, train_loss: 0.6520, test_loss: 0.9549, test_f1: 0.6744
 epoch: 75, train_loss: 0.6453, test_loss: 0.9351, test_f1: 0.6802
 epoch: 76, train_loss: 0.6482, test_loss: 0.9423, test_f1: 0.6708
 epoch: 77, train_loss: 0.6276, test_loss: 0.9472, test_f1: 0.6548
 epoch: 78, train_loss: 0.6325, test_loss: 0.9213, test_f1: 0.6885
 epoch: 79, train_loss: 0.6422, test_loss: 0.9484, test_f1: 0.6718
 epoch: 80, train_loss: 0.6303, test_loss: 0.9468, test_f1: 0.6546
 epoch: 81, train_loss: 0.6337, test_loss: 0.9348, test_f1: 0.6659
 epoch: 82, train_loss: 0.6309, test_loss: 0.9527, test_f1: 0.6650
 epoch: 83, train_loss: 0.6247, test_loss: 0.9493, test_f1: 0.6607
 epoch: 84, train_loss: 0.6204, test_loss: 0.9678, test_f1: 0.6690
 epoch: 85, train_loss: 0.6326, test_loss: 0.9664, test_f1: 0.6624
 epoch: 86, train_loss: 0.6232, test_loss: 0.9685, test_f1: 0.6643
 epoch: 87, train_loss: 0.6207, test_loss: 0.9410, test_f1: 0.6788
 epoch: 88, train_loss: 0.6190, test_loss: 0.9514, test_f1: 0.6659
 epoch: 89, train_loss: 0.6226, test_loss: 0.9592, test_f1: 0.6767
 epoch: 90, train_loss: 0.6177, test_loss: 0.9539, test_f1: 0.6631
 epoch: 91, train_loss: 0.6129, test_loss: 0.9474, test_f1: 0.6857
 epoch: 92, train_loss: 0.6112, test_loss: 0.9820, test_f1: 0.6721
 epoch: 93, train_loss: 0.6138, test_loss: 0.9405, test_f1: 0.6714
 epoch: 94, train_loss: 0.6104, test_loss: 0.9318, test_f1: 0.7013
 epoch: 95, train_loss: 0.6057, test_loss: 0.9841, test_f1: 0.6918
 epoch: 96, train_loss: 0.6103, test_loss: 0.9677, test_f1: 0.6923
 epoch: 97, train_loss: 0.6083, test_loss: 0.9638, test_f1: 0.6700
 epoch: 98, train_loss: 0.5994, test_loss: 0.9873, test_f1: 0.6655
 epoch: 99, train_loss: 0.5936, test_loss: 0.9782, test_f1: 0.6746
##################ITERATION #4 ****************************************
 epoch: 0, train_loss: 1.2076, test_loss: 1.0250, test_f1: 0.4536
 epoch: 1, train_loss: 1.0607, test_loss: 0.9726, test_f1: 0.4929
 epoch: 2, train_loss: 1.0166, test_loss: 0.9417, test_f1: 0.4995
 epoch: 3, train_loss: 0.9994, test_loss: 0.9365, test_f1: 0.5035
 epoch: 4, train_loss: 0.9704, test_loss: 0.9315, test_f1: 0.5209
 epoch: 5, train_loss: 0.9557, test_loss: 0.9299, test_f1: 0.5162
 epoch: 6, train_loss: 0.9498, test_loss: 0.9116, test_f1: 0.5190
 epoch: 7, train_loss: 0.9346, test_loss: 0.9176, test_f1: 0.5431
 epoch: 8, train_loss: 0.9150, test_loss: 0.9190, test_f1: 0.5352
 epoch: 9, train_loss: 0.9071, test_loss: 0.8863, test_f1: 0.5321
 epoch: 10, train_loss: 0.9009, test_loss: 0.8840, test_f1: 0.5398
 epoch: 11, train_loss: 0.8878, test_loss: 0.8998, test_f1: 0.5386
 epoch: 12, train_loss: 0.8902, test_loss: 0.8616, test_f1: 0.5406
 epoch: 13, train_loss: 0.8763, test_loss: 0.8871, test_f1: 0.5313
 epoch: 14, train_loss: 0.8665, test_loss: 0.8826, test_f1: 0.5381
 epoch: 15, train_loss: 0.8688, test_loss: 0.8811, test_f1: 0.5379
 epoch: 16, train_loss: 0.8641, test_loss: 0.8732, test_f1: 0.5394
 epoch: 17, train_loss: 0.8411, test_loss: 0.8717, test_f1: 0.5569
 epoch: 18, train_loss: 0.8470, test_loss: 0.8405, test_f1: 0.5774
 epoch: 19, train_loss: 0.8395, test_loss: 0.8837, test_f1: 0.5441
 epoch: 20, train_loss: 0.8393, test_loss: 0.8752, test_f1: 0.5667
 epoch: 21, train_loss: 0.8287, test_loss: 0.8534, test_f1: 0.5516
 epoch: 22, train_loss: 0.8204, test_loss: 0.8989, test_f1: 0.5483
 epoch: 23, train_loss: 0.8178, test_loss: 0.8922, test_f1: 0.5733
 epoch: 24, train_loss: 0.7966, test_loss: 0.8528, test_f1: 0.6058
 epoch: 25, train_loss: 0.7998, test_loss: 0.8462, test_f1: 0.5684
 epoch: 26, train_loss: 0.7994, test_loss: 0.8126, test_f1: 0.5777
 epoch: 27, train_loss: 0.7918, test_loss: 0.8404, test_f1: 0.6199
 epoch: 28, train_loss: 0.7836, test_loss: 0.8540, test_f1: 0.5804
 epoch: 29, train_loss: 0.7786, test_loss: 0.8611, test_f1: 0.5614
 epoch: 30, train_loss: 0.7746, test_loss: 0.8771, test_f1: 0.5793
 epoch: 31, train_loss: 0.7848, test_loss: 0.8694, test_f1: 0.5881
 epoch: 32, train_loss: 0.7711, test_loss: 0.8657, test_f1: 0.5708
 epoch: 33, train_loss: 0.7552, test_loss: 0.8526, test_f1: 0.5837
 epoch: 34, train_loss: 0.7553, test_loss: 0.9021, test_f1: 0.6130
 epoch: 35, train_loss: 0.7468, test_loss: 0.8744, test_f1: 0.6021
 epoch: 36, train_loss: 0.7597, test_loss: 0.8948, test_f1: 0.6023
 epoch: 37, train_loss: 0.7455, test_loss: 0.8605, test_f1: 0.5846
 epoch: 38, train_loss: 0.7249, test_loss: 0.8572, test_f1: 0.5920
 epoch: 39, train_loss: 0.7372, test_loss: 0.9122, test_f1: 0.6141
 epoch: 40, train_loss: 0.7382, test_loss: 0.8920, test_f1: 0.6243
 epoch: 41, train_loss: 0.7309, test_loss: 0.8874, test_f1: 0.6298
 epoch: 42, train_loss: 0.7238, test_loss: 0.8854, test_f1: 0.5997
 epoch: 43, train_loss: 0.7205, test_loss: 0.8868, test_f1: 0.6167
 epoch: 44, train_loss: 0.7199, test_loss: 0.8901, test_f1: 0.6041
 epoch: 45, train_loss: 0.7185, test_loss: 0.8807, test_f1: 0.6220
 epoch: 46, train_loss: 0.7160, test_loss: 0.8983, test_f1: 0.6164
 epoch: 47, train_loss: 0.7066, test_loss: 0.9008, test_f1: 0.6286
 epoch: 48, train_loss: 0.7072, test_loss: 0.8619, test_f1: 0.6400
 epoch: 49, train_loss: 0.7065, test_loss: 0.8881, test_f1: 0.6378
 epoch: 50, train_loss: 0.6982, test_loss: 0.8567, test_f1: 0.6389
 epoch: 51, train_loss: 0.6887, test_loss: 0.8650, test_f1: 0.6605
 epoch: 52, train_loss: 0.6730, test_loss: 0.8916, test_f1: 0.6412
 epoch: 53, train_loss: 0.6795, test_loss: 0.8542, test_f1: 0.6654
 epoch: 54, train_loss: 0.6866, test_loss: 0.8949, test_f1: 0.6346
 epoch: 55, train_loss: 0.6767, test_loss: 0.9249, test_f1: 0.6373
 epoch: 56, train_loss: 0.6805, test_loss: 0.8804, test_f1: 0.6411
 epoch: 57, train_loss: 0.6694, test_loss: 0.9138, test_f1: 0.6599
 epoch: 58, train_loss: 0.6762, test_loss: 0.8842, test_f1: 0.6603
 epoch: 59, train_loss: 0.6559, test_loss: 0.9040, test_f1: 0.6569
 epoch: 60, train_loss: 0.6557, test_loss: 0.8963, test_f1: 0.6445
 epoch: 61, train_loss: 0.6721, test_loss: 0.9014, test_f1: 0.6247
 epoch: 62, train_loss: 0.6669, test_loss: 0.8803, test_f1: 0.6570
 epoch: 63, train_loss: 0.6552, test_loss: 0.8876, test_f1: 0.6463
 epoch: 64, train_loss: 0.6606, test_loss: 0.8585, test_f1: 0.6762
 epoch: 65, train_loss: 0.6522, test_loss: 0.8808, test_f1: 0.6543
 epoch: 66, train_loss: 0.6544, test_loss: 0.9060, test_f1: 0.6492
 epoch: 67, train_loss: 0.6429, test_loss: 0.9009, test_f1: 0.6536
 epoch: 68, train_loss: 0.6374, test_loss: 0.8852, test_f1: 0.6584
 epoch: 69, train_loss: 0.6444, test_loss: 0.8862, test_f1: 0.6671
 epoch: 70, train_loss: 0.6378, test_loss: 0.8980, test_f1: 0.6297
 epoch: 71, train_loss: 0.6488, test_loss: 0.9285, test_f1: 0.6561
 epoch: 72, train_loss: 0.6362, test_loss: 0.8958, test_f1: 0.6524
 epoch: 73, train_loss: 0.6286, test_loss: 0.9304, test_f1: 0.6408
 epoch: 74, train_loss: 0.6235, test_loss: 0.8959, test_f1: 0.6625
 epoch: 75, train_loss: 0.6201, test_loss: 0.9122, test_f1: 0.6432
 epoch: 76, train_loss: 0.6322, test_loss: 0.8971, test_f1: 0.6461
 epoch: 77, train_loss: 0.6170, test_loss: 0.8791, test_f1: 0.6663
 epoch: 78, train_loss: 0.6174, test_loss: 0.9159, test_f1: 0.6418
 epoch: 79, train_loss: 0.6153, test_loss: 0.8808, test_f1: 0.6492
 epoch: 80, train_loss: 0.6073, test_loss: 0.8757, test_f1: 0.6570
 epoch: 81, train_loss: 0.6183, test_loss: 0.8899, test_f1: 0.6410
 epoch: 82, train_loss: 0.6153, test_loss: 0.9032, test_f1: 0.6423
 epoch: 83, train_loss: 0.6110, test_loss: 0.9033, test_f1: 0.6532
 epoch: 84, train_loss: 0.6196, test_loss: 0.9471, test_f1: 0.6309
 epoch: 85, train_loss: 0.6022, test_loss: 0.9057, test_f1: 0.6443
 epoch: 86, train_loss: 0.6090, test_loss: 0.9257, test_f1: 0.6334
 epoch: 87, train_loss: 0.5958, test_loss: 0.8860, test_f1: 0.6590
 epoch: 88, train_loss: 0.5874, test_loss: 0.9271, test_f1: 0.6560
 epoch: 89, train_loss: 0.5990, test_loss: 0.9384, test_f1: 0.6356
 epoch: 90, train_loss: 0.5990, test_loss: 0.9224, test_f1: 0.6476
 epoch: 91, train_loss: 0.5965, test_loss: 0.9044, test_f1: 0.6367
 epoch: 92, train_loss: 0.6033, test_loss: 0.9386, test_f1: 0.6404
 epoch: 93, train_loss: 0.5913, test_loss: 0.9116, test_f1: 0.6585
 epoch: 94, train_loss: 0.6026, test_loss: 0.9129, test_f1: 0.6683
 epoch: 95, train_loss: 0.5867, test_loss: 0.8691, test_f1: 0.6466
 epoch: 96, train_loss: 0.5806, test_loss: 0.9465, test_f1: 0.6457
 epoch: 97, train_loss: 0.5932, test_loss: 0.9631, test_f1: 0.6471
 epoch: 98, train_loss: 0.5985, test_loss: 0.9317, test_f1: 0.6655
 epoch: 99, train_loss: 0.5832, test_loss: 0.9377, test_f1: 0.6497
##################ITERATION #5 ****************************************
 epoch: 0, train_loss: 1.2218, test_loss: 1.0121, test_f1: 0.5036
 epoch: 1, train_loss: 1.0781, test_loss: 0.9795, test_f1: 0.5028
 epoch: 2, train_loss: 1.0312, test_loss: 0.9616, test_f1: 0.5175
 epoch: 3, train_loss: 1.0052, test_loss: 0.9605, test_f1: 0.4965
 epoch: 4, train_loss: 0.9776, test_loss: 0.9441, test_f1: 0.5006
 epoch: 5, train_loss: 0.9709, test_loss: 0.9298, test_f1: 0.5176
 epoch: 6, train_loss: 0.9547, test_loss: 0.9208, test_f1: 0.5299
 epoch: 7, train_loss: 0.9473, test_loss: 0.9124, test_f1: 0.5465
 epoch: 8, train_loss: 0.9289, test_loss: 0.9258, test_f1: 0.5327
 epoch: 9, train_loss: 0.9233, test_loss: 0.8982, test_f1: 0.5406
 epoch: 10, train_loss: 0.9105, test_loss: 0.9110, test_f1: 0.5204
 epoch: 11, train_loss: 0.9047, test_loss: 0.9056, test_f1: 0.5305
 epoch: 12, train_loss: 0.8908, test_loss: 0.9067, test_f1: 0.5517
 epoch: 13, train_loss: 0.8907, test_loss: 0.9050, test_f1: 0.5298
 epoch: 14, train_loss: 0.8730, test_loss: 0.8661, test_f1: 0.5743
 epoch: 15, train_loss: 0.8741, test_loss: 0.8782, test_f1: 0.5720
 epoch: 16, train_loss: 0.8615, test_loss: 0.9117, test_f1: 0.5308
 epoch: 17, train_loss: 0.8530, test_loss: 0.9068, test_f1: 0.5519
 epoch: 18, train_loss: 0.8437, test_loss: 0.9257, test_f1: 0.5270
 epoch: 19, train_loss: 0.8327, test_loss: 0.8787, test_f1: 0.5673
 epoch: 20, train_loss: 0.8355, test_loss: 0.8850, test_f1: 0.5500
 epoch: 21, train_loss: 0.8225, test_loss: 0.8759, test_f1: 0.5636
 epoch: 22, train_loss: 0.8287, test_loss: 0.8801, test_f1: 0.5652
 epoch: 23, train_loss: 0.8192, test_loss: 0.8775, test_f1: 0.5780
 epoch: 24, train_loss: 0.8159, test_loss: 0.8694, test_f1: 0.5867
 epoch: 25, train_loss: 0.8099, test_loss: 0.8761, test_f1: 0.5867
 epoch: 26, train_loss: 0.7955, test_loss: 0.8906, test_f1: 0.5365
 epoch: 27, train_loss: 0.8000, test_loss: 0.9193, test_f1: 0.5509
 epoch: 28, train_loss: 0.7902, test_loss: 0.8753, test_f1: 0.5824
 epoch: 29, train_loss: 0.7915, test_loss: 0.8533, test_f1: 0.6117
 epoch: 30, train_loss: 0.7902, test_loss: 0.8921, test_f1: 0.5559
 epoch: 31, train_loss: 0.7814, test_loss: 0.8581, test_f1: 0.6113
 epoch: 32, train_loss: 0.7845, test_loss: 0.8572, test_f1: 0.5978
 epoch: 33, train_loss: 0.7625, test_loss: 0.8920, test_f1: 0.5613
 epoch: 34, train_loss: 0.7667, test_loss: 0.9148, test_f1: 0.5829
 epoch: 35, train_loss: 0.7751, test_loss: 0.8763, test_f1: 0.6075
 epoch: 36, train_loss: 0.7666, test_loss: 0.9138, test_f1: 0.5868
 epoch: 37, train_loss: 0.7513, test_loss: 0.8884, test_f1: 0.6290
 epoch: 38, train_loss: 0.7712, test_loss: 0.9049, test_f1: 0.5607
 epoch: 39, train_loss: 0.7453, test_loss: 0.8814, test_f1: 0.5847
 epoch: 40, train_loss: 0.7506, test_loss: 0.8650, test_f1: 0.6030
 epoch: 41, train_loss: 0.7438, test_loss: 0.8755, test_f1: 0.6155
 epoch: 42, train_loss: 0.7440, test_loss: 0.9177, test_f1: 0.5924
 epoch: 43, train_loss: 0.7385, test_loss: 0.8777, test_f1: 0.6184
 epoch: 44, train_loss: 0.7341, test_loss: 0.9476, test_f1: 0.6151
 epoch: 45, train_loss: 0.7322, test_loss: 0.8713, test_f1: 0.6002
 epoch: 46, train_loss: 0.7154, test_loss: 0.8978, test_f1: 0.6157
 epoch: 47, train_loss: 0.7267, test_loss: 0.8856, test_f1: 0.6047
 epoch: 48, train_loss: 0.7197, test_loss: 0.9432, test_f1: 0.5633
 epoch: 49, train_loss: 0.7291, test_loss: 0.9136, test_f1: 0.6118
 epoch: 50, train_loss: 0.7189, test_loss: 0.8648, test_f1: 0.5986
 epoch: 51, train_loss: 0.7038, test_loss: 0.8938, test_f1: 0.5974
 epoch: 52, train_loss: 0.7074, test_loss: 0.9090, test_f1: 0.6149
 epoch: 53, train_loss: 0.7000, test_loss: 0.9003, test_f1: 0.6093
 epoch: 54, train_loss: 0.6961, test_loss: 0.9008, test_f1: 0.5970
 epoch: 55, train_loss: 0.6921, test_loss: 0.8966, test_f1: 0.6050
 epoch: 56, train_loss: 0.6995, test_loss: 0.9066, test_f1: 0.6291
 epoch: 57, train_loss: 0.6941, test_loss: 0.9248, test_f1: 0.6059
 epoch: 58, train_loss: 0.6883, test_loss: 0.9147, test_f1: 0.5871
 epoch: 59, train_loss: 0.6696, test_loss: 0.8991, test_f1: 0.6155
 epoch: 60, train_loss: 0.6694, test_loss: 0.9266, test_f1: 0.5913
 epoch: 61, train_loss: 0.6803, test_loss: 0.8860, test_f1: 0.6325
 epoch: 62, train_loss: 0.6652, test_loss: 0.8850, test_f1: 0.6180
 epoch: 63, train_loss: 0.6698, test_loss: 0.9014, test_f1: 0.6573
 epoch: 64, train_loss: 0.6691, test_loss: 0.9114, test_f1: 0.6102
 epoch: 65, train_loss: 0.6715, test_loss: 0.9230, test_f1: 0.6194
 epoch: 66, train_loss: 0.6669, test_loss: 0.8811, test_f1: 0.6274
 epoch: 67, train_loss: 0.6655, test_loss: 0.8973, test_f1: 0.6276
 epoch: 68, train_loss: 0.6575, test_loss: 0.9191, test_f1: 0.6343
 epoch: 69, train_loss: 0.6706, test_loss: 0.9317, test_f1: 0.6084
 epoch: 70, train_loss: 0.6546, test_loss: 0.9037, test_f1: 0.6292
 epoch: 71, train_loss: 0.6717, test_loss: 0.9324, test_f1: 0.6398
 epoch: 72, train_loss: 0.6699, test_loss: 0.9157, test_f1: 0.6322
 epoch: 73, train_loss: 0.6662, test_loss: 0.9086, test_f1: 0.6128
 epoch: 74, train_loss: 0.6552, test_loss: 0.9064, test_f1: 0.6354
 epoch: 75, train_loss: 0.6587, test_loss: 0.9453, test_f1: 0.6160
 epoch: 76, train_loss: 0.6463, test_loss: 0.9336, test_f1: 0.6333
 epoch: 77, train_loss: 0.6464, test_loss: 0.9096, test_f1: 0.6153
 epoch: 78, train_loss: 0.6561, test_loss: 0.8972, test_f1: 0.6484
 epoch: 79, train_loss: 0.6469, test_loss: 0.9158, test_f1: 0.6334
 epoch: 80, train_loss: 0.6460, test_loss: 0.9511, test_f1: 0.6149
 epoch: 81, train_loss: 0.6458, test_loss: 0.9202, test_f1: 0.6161
 epoch: 82, train_loss: 0.6481, test_loss: 0.8996, test_f1: 0.6286
 epoch: 83, train_loss: 0.6313, test_loss: 0.8876, test_f1: 0.6247
 epoch: 84, train_loss: 0.6357, test_loss: 0.9311, test_f1: 0.6282
 epoch: 85, train_loss: 0.6436, test_loss: 0.8923, test_f1: 0.6422
 epoch: 86, train_loss: 0.6456, test_loss: 0.9035, test_f1: 0.6048
 epoch: 87, train_loss: 0.6431, test_loss: 0.9200, test_f1: 0.6439
 epoch: 88, train_loss: 0.6251, test_loss: 0.9210, test_f1: 0.6417
 epoch: 89, train_loss: 0.6303, test_loss: 0.9295, test_f1: 0.6370
 epoch: 90, train_loss: 0.6307, test_loss: 0.9329, test_f1: 0.6281
 epoch: 91, train_loss: 0.6288, test_loss: 0.8914, test_f1: 0.6282
 epoch: 92, train_loss: 0.6243, test_loss: 0.9175, test_f1: 0.6115
 epoch: 93, train_loss: 0.6256, test_loss: 0.9159, test_f1: 0.6113
 epoch: 94, train_loss: 0.6212, test_loss: 0.9122, test_f1: 0.6511
 epoch: 95, train_loss: 0.6131, test_loss: 0.9209, test_f1: 0.6154
 epoch: 96, train_loss: 0.6108, test_loss: 0.9288, test_f1: 0.6079
 epoch: 97, train_loss: 0.6132, test_loss: 0.9146, test_f1: 0.6412
 epoch: 98, train_loss: 0.6282, test_loss: 0.9166, test_f1: 0.6200
 epoch: 99, train_loss: 0.6127, test_loss: 0.9397, test_f1: 0.6567
##################ITERATION #6 ****************************************
 epoch: 0, train_loss: 1.2378, test_loss: 1.0165, test_f1: 0.4468
 epoch: 1, train_loss: 1.0683, test_loss: 0.9710, test_f1: 0.4860
 epoch: 2, train_loss: 1.0357, test_loss: 0.9609, test_f1: 0.4923
 epoch: 3, train_loss: 1.0087, test_loss: 0.9597, test_f1: 0.4712
 epoch: 4, train_loss: 0.9805, test_loss: 0.9272, test_f1: 0.5076
 epoch: 5, train_loss: 0.9738, test_loss: 0.9335, test_f1: 0.4963
 epoch: 6, train_loss: 0.9465, test_loss: 0.9235, test_f1: 0.5273
 epoch: 7, train_loss: 0.9379, test_loss: 0.9218, test_f1: 0.5307
 epoch: 8, train_loss: 0.9328, test_loss: 0.9053, test_f1: 0.5149
 epoch: 9, train_loss: 0.9210, test_loss: 0.8996, test_f1: 0.5328
 epoch: 10, train_loss: 0.9105, test_loss: 0.8989, test_f1: 0.5222
 epoch: 11, train_loss: 0.8960, test_loss: 0.9038, test_f1: 0.5306
 epoch: 12, train_loss: 0.8929, test_loss: 0.8606, test_f1: 0.5401
 epoch: 13, train_loss: 0.8829, test_loss: 0.8989, test_f1: 0.5325
 epoch: 14, train_loss: 0.8765, test_loss: 0.9105, test_f1: 0.5252
 epoch: 15, train_loss: 0.8789, test_loss: 0.8844, test_f1: 0.5359
 epoch: 16, train_loss: 0.8568, test_loss: 0.8673, test_f1: 0.5544
 epoch: 17, train_loss: 0.8677, test_loss: 0.8763, test_f1: 0.5385
 epoch: 18, train_loss: 0.8471, test_loss: 0.8606, test_f1: 0.5396
 epoch: 19, train_loss: 0.8454, test_loss: 0.8659, test_f1: 0.5493
 epoch: 20, train_loss: 0.8384, test_loss: 0.8640, test_f1: 0.5396
 epoch: 21, train_loss: 0.8294, test_loss: 0.8739, test_f1: 0.5566
 epoch: 22, train_loss: 0.8221, test_loss: 0.8801, test_f1: 0.5567
 epoch: 23, train_loss: 0.8138, test_loss: 0.8710, test_f1: 0.5497
 epoch: 24, train_loss: 0.8302, test_loss: 0.8840, test_f1: 0.5653
 epoch: 25, train_loss: 0.8132, test_loss: 0.8885, test_f1: 0.5499
 epoch: 26, train_loss: 0.8120, test_loss: 0.8622, test_f1: 0.5744
 epoch: 27, train_loss: 0.7986, test_loss: 0.8772, test_f1: 0.5712
 epoch: 28, train_loss: 0.7995, test_loss: 0.8936, test_f1: 0.5744
 epoch: 29, train_loss: 0.7898, test_loss: 0.9078, test_f1: 0.5649
 epoch: 30, train_loss: 0.8011, test_loss: 0.8811, test_f1: 0.5695
 epoch: 31, train_loss: 0.7855, test_loss: 0.8803, test_f1: 0.5693
 epoch: 32, train_loss: 0.7778, test_loss: 0.8966, test_f1: 0.5701
 epoch: 33, train_loss: 0.7727, test_loss: 0.9068, test_f1: 0.5827
 epoch: 34, train_loss: 0.7728, test_loss: 0.8884, test_f1: 0.5854
 epoch: 35, train_loss: 0.7728, test_loss: 0.9077, test_f1: 0.5726
 epoch: 36, train_loss: 0.7764, test_loss: 0.9138, test_f1: 0.5961
 epoch: 37, train_loss: 0.7655, test_loss: 0.9087, test_f1: 0.5746
 epoch: 38, train_loss: 0.7480, test_loss: 0.8886, test_f1: 0.5870
 epoch: 39, train_loss: 0.7607, test_loss: 0.8705, test_f1: 0.5976
 epoch: 40, train_loss: 0.7521, test_loss: 0.8900, test_f1: 0.5959
 epoch: 41, train_loss: 0.7464, test_loss: 0.8823, test_f1: 0.5980
 epoch: 42, train_loss: 0.7570, test_loss: 0.9086, test_f1: 0.5750
 epoch: 43, train_loss: 0.7417, test_loss: 0.8838, test_f1: 0.5783
 epoch: 44, train_loss: 0.7334, test_loss: 0.8934, test_f1: 0.5808
 epoch: 45, train_loss: 0.7269, test_loss: 0.9254, test_f1: 0.5879
 epoch: 46, train_loss: 0.7197, test_loss: 0.9203, test_f1: 0.5971
 epoch: 47, train_loss: 0.7265, test_loss: 0.8927, test_f1: 0.5888
 epoch: 48, train_loss: 0.7265, test_loss: 0.9050, test_f1: 0.5936
 epoch: 49, train_loss: 0.7132, test_loss: 0.9062, test_f1: 0.6080
 epoch: 50, train_loss: 0.7133, test_loss: 0.8993, test_f1: 0.5878
 epoch: 51, train_loss: 0.7057, test_loss: 0.9008, test_f1: 0.6020
 epoch: 52, train_loss: 0.6948, test_loss: 0.8904, test_f1: 0.5998
 epoch: 53, train_loss: 0.6886, test_loss: 0.9052, test_f1: 0.6245
 epoch: 54, train_loss: 0.6966, test_loss: 0.9067, test_f1: 0.6072
 epoch: 55, train_loss: 0.6934, test_loss: 0.9224, test_f1: 0.5915
 epoch: 56, train_loss: 0.6834, test_loss: 0.8907, test_f1: 0.6155
 epoch: 57, train_loss: 0.6825, test_loss: 0.9049, test_f1: 0.6087
 epoch: 58, train_loss: 0.6751, test_loss: 0.8938, test_f1: 0.6104
 epoch: 59, train_loss: 0.6790, test_loss: 0.9265, test_f1: 0.6116
 epoch: 60, train_loss: 0.6771, test_loss: 0.9093, test_f1: 0.6142
 epoch: 61, train_loss: 0.6835, test_loss: 0.9061, test_f1: 0.6135
 epoch: 62, train_loss: 0.6727, test_loss: 0.9102, test_f1: 0.5939
 epoch: 63, train_loss: 0.6639, test_loss: 0.8999, test_f1: 0.6195
 epoch: 64, train_loss: 0.6783, test_loss: 0.8991, test_f1: 0.6273
 epoch: 65, train_loss: 0.6723, test_loss: 0.9133, test_f1: 0.6363
 epoch: 66, train_loss: 0.6610, test_loss: 0.9010, test_f1: 0.6355
 epoch: 67, train_loss: 0.6711, test_loss: 0.8741, test_f1: 0.6373
 epoch: 68, train_loss: 0.6638, test_loss: 0.9090, test_f1: 0.6021
 epoch: 69, train_loss: 0.6585, test_loss: 0.8998, test_f1: 0.6338
 epoch: 70, train_loss: 0.6586, test_loss: 0.8967, test_f1: 0.6237
 epoch: 71, train_loss: 0.6677, test_loss: 0.9087, test_f1: 0.6300
 epoch: 72, train_loss: 0.6514, test_loss: 0.9097, test_f1: 0.6446
 epoch: 73, train_loss: 0.6550, test_loss: 0.9146, test_f1: 0.6193
 epoch: 74, train_loss: 0.6437, test_loss: 0.9166, test_f1: 0.6428
 epoch: 75, train_loss: 0.6715, test_loss: 0.9176, test_f1: 0.6397
 epoch: 76, train_loss: 0.6370, test_loss: 0.9069, test_f1: 0.6072
 epoch: 77, train_loss: 0.6513, test_loss: 0.9252, test_f1: 0.6105
 epoch: 78, train_loss: 0.6457, test_loss: 0.9021, test_f1: 0.6498
 epoch: 79, train_loss: 0.6397, test_loss: 0.9236, test_f1: 0.6198
 epoch: 80, train_loss: 0.6540, test_loss: 0.9071, test_f1: 0.6195
 epoch: 81, train_loss: 0.6347, test_loss: 0.9298, test_f1: 0.6372
 epoch: 82, train_loss: 0.6409, test_loss: 0.9213, test_f1: 0.6461
 epoch: 83, train_loss: 0.6335, test_loss: 0.9439, test_f1: 0.5996
 epoch: 84, train_loss: 0.6263, test_loss: 0.9353, test_f1: 0.6394
 epoch: 85, train_loss: 0.6320, test_loss: 0.9355, test_f1: 0.6422
 epoch: 86, train_loss: 0.6211, test_loss: 0.9355, test_f1: 0.6430
 epoch: 87, train_loss: 0.6275, test_loss: 0.9190, test_f1: 0.6364
 epoch: 88, train_loss: 0.6464, test_loss: 0.9559, test_f1: 0.6163
 epoch: 89, train_loss: 0.6176, test_loss: 0.9040, test_f1: 0.6243
 epoch: 90, train_loss: 0.6192, test_loss: 0.9070, test_f1: 0.6351
 epoch: 91, train_loss: 0.6222, test_loss: 0.9534, test_f1: 0.6371
 epoch: 92, train_loss: 0.6172, test_loss: 0.9419, test_f1: 0.6381
 epoch: 93, train_loss: 0.6336, test_loss: 0.9286, test_f1: 0.6566
 epoch: 94, train_loss: 0.6318, test_loss: 0.9142, test_f1: 0.6318
 epoch: 95, train_loss: 0.6143, test_loss: 0.9072, test_f1: 0.6548
 epoch: 96, train_loss: 0.6193, test_loss: 0.9199, test_f1: 0.6465
 epoch: 97, train_loss: 0.6051, test_loss: 0.9380, test_f1: 0.6405
 epoch: 98, train_loss: 0.6085, test_loss: 0.9201, test_f1: 0.6319
 epoch: 99, train_loss: 0.6154, test_loss: 0.9510, test_f1: 0.6543
##################ITERATION #7 ****************************************
 epoch: 0, train_loss: 1.2624, test_loss: 1.0062, test_f1: 0.4924
 epoch: 1, train_loss: 1.0988, test_loss: 0.9560, test_f1: 0.4654
 epoch: 2, train_loss: 1.0378, test_loss: 0.9265, test_f1: 0.4570
 epoch: 3, train_loss: 1.0076, test_loss: 0.9273, test_f1: 0.5030
 epoch: 4, train_loss: 0.9807, test_loss: 0.9132, test_f1: 0.4901
 epoch: 5, train_loss: 0.9613, test_loss: 0.9176, test_f1: 0.4735
 epoch: 6, train_loss: 0.9516, test_loss: 0.8964, test_f1: 0.4925
 epoch: 7, train_loss: 0.9227, test_loss: 0.9188, test_f1: 0.4991
 epoch: 8, train_loss: 0.9224, test_loss: 0.9066, test_f1: 0.5095
 epoch: 9, train_loss: 0.9077, test_loss: 0.8728, test_f1: 0.5135
 epoch: 10, train_loss: 0.8992, test_loss: 0.8930, test_f1: 0.5386
 epoch: 11, train_loss: 0.8821, test_loss: 0.8852, test_f1: 0.5347
 epoch: 12, train_loss: 0.8791, test_loss: 0.8847, test_f1: 0.5456
 epoch: 13, train_loss: 0.8717, test_loss: 0.8751, test_f1: 0.5562
 epoch: 14, train_loss: 0.8665, test_loss: 0.8737, test_f1: 0.5602
 epoch: 15, train_loss: 0.8467, test_loss: 0.8842, test_f1: 0.5475
 epoch: 16, train_loss: 0.8439, test_loss: 0.8619, test_f1: 0.5598
 epoch: 17, train_loss: 0.8413, test_loss: 0.8754, test_f1: 0.5697
 epoch: 18, train_loss: 0.8318, test_loss: 0.8722, test_f1: 0.5830
 epoch: 19, train_loss: 0.8297, test_loss: 0.8892, test_f1: 0.5691
 epoch: 20, train_loss: 0.8275, test_loss: 0.8575, test_f1: 0.5713
 epoch: 21, train_loss: 0.8111, test_loss: 0.8483, test_f1: 0.5722
 epoch: 22, train_loss: 0.8034, test_loss: 0.8485, test_f1: 0.5836
 epoch: 23, train_loss: 0.7954, test_loss: 0.8495, test_f1: 0.6071
 epoch: 24, train_loss: 0.8011, test_loss: 0.8378, test_f1: 0.5853
 epoch: 25, train_loss: 0.7955, test_loss: 0.8310, test_f1: 0.5888
 epoch: 26, train_loss: 0.7781, test_loss: 0.8575, test_f1: 0.5899
 epoch: 27, train_loss: 0.7830, test_loss: 0.8475, test_f1: 0.5777
 epoch: 28, train_loss: 0.7597, test_loss: 0.8427, test_f1: 0.5804
 epoch: 29, train_loss: 0.7720, test_loss: 0.8343, test_f1: 0.5872
 epoch: 30, train_loss: 0.7666, test_loss: 0.8584, test_f1: 0.5851
 epoch: 31, train_loss: 0.7524, test_loss: 0.8354, test_f1: 0.5968
 epoch: 32, train_loss: 0.7549, test_loss: 0.8654, test_f1: 0.5842
 epoch: 33, train_loss: 0.7442, test_loss: 0.8422, test_f1: 0.5872
 epoch: 34, train_loss: 0.7376, test_loss: 0.8458, test_f1: 0.5999
 epoch: 35, train_loss: 0.7377, test_loss: 0.8484, test_f1: 0.6038
 epoch: 36, train_loss: 0.7477, test_loss: 0.8650, test_f1: 0.6114
 epoch: 37, train_loss: 0.7238, test_loss: 0.8738, test_f1: 0.6164
 epoch: 38, train_loss: 0.7301, test_loss: 0.8592, test_f1: 0.6208
 epoch: 39, train_loss: 0.7292, test_loss: 0.8548, test_f1: 0.5996
 epoch: 40, train_loss: 0.7168, test_loss: 0.8205, test_f1: 0.6053
 epoch: 41, train_loss: 0.7015, test_loss: 0.8740, test_f1: 0.5937
 epoch: 42, train_loss: 0.7068, test_loss: 0.8557, test_f1: 0.6243
 epoch: 43, train_loss: 0.7096, test_loss: 0.8728, test_f1: 0.5923
 epoch: 44, train_loss: 0.7229, test_loss: 0.8590, test_f1: 0.6058
 epoch: 45, train_loss: 0.7080, test_loss: 0.8618, test_f1: 0.6203
 epoch: 46, train_loss: 0.6906, test_loss: 0.8582, test_f1: 0.6068
 epoch: 47, train_loss: 0.6942, test_loss: 0.8642, test_f1: 0.6118
 epoch: 48, train_loss: 0.6813, test_loss: 0.8862, test_f1: 0.6013
 epoch: 49, train_loss: 0.6777, test_loss: 0.8526, test_f1: 0.6214
 epoch: 50, train_loss: 0.6928, test_loss: 0.8430, test_f1: 0.6422
 epoch: 51, train_loss: 0.6649, test_loss: 0.8506, test_f1: 0.6091
 epoch: 52, train_loss: 0.6518, test_loss: 0.8528, test_f1: 0.6323
 epoch: 53, train_loss: 0.6623, test_loss: 0.8349, test_f1: 0.6196
 epoch: 54, train_loss: 0.6596, test_loss: 0.8725, test_f1: 0.6294
 epoch: 55, train_loss: 0.6528, test_loss: 0.8658, test_f1: 0.6251
 epoch: 56, train_loss: 0.6482, test_loss: 0.8493, test_f1: 0.6246
 epoch: 57, train_loss: 0.6494, test_loss: 0.8867, test_f1: 0.6056
 epoch: 58, train_loss: 0.6442, test_loss: 0.8660, test_f1: 0.6204
 epoch: 59, train_loss: 0.6482, test_loss: 0.8539, test_f1: 0.6103
 epoch: 60, train_loss: 0.6460, test_loss: 0.8717, test_f1: 0.6236
 epoch: 61, train_loss: 0.6387, test_loss: 0.8428, test_f1: 0.6294
 epoch: 62, train_loss: 0.6409, test_loss: 0.8606, test_f1: 0.6458
 epoch: 63, train_loss: 0.6339, test_loss: 0.8684, test_f1: 0.6314
 epoch: 64, train_loss: 0.6372, test_loss: 0.8366, test_f1: 0.6461
 epoch: 65, train_loss: 0.6429, test_loss: 0.8535, test_f1: 0.6510
 epoch: 66, train_loss: 0.6385, test_loss: 0.8542, test_f1: 0.6410
 epoch: 67, train_loss: 0.6391, test_loss: 0.8687, test_f1: 0.6278
 epoch: 68, train_loss: 0.6205, test_loss: 0.8529, test_f1: 0.6387
 epoch: 69, train_loss: 0.6333, test_loss: 0.8620, test_f1: 0.6278
 epoch: 70, train_loss: 0.6354, test_loss: 0.8618, test_f1: 0.6219
 epoch: 71, train_loss: 0.6264, test_loss: 0.8552, test_f1: 0.6314
 epoch: 72, train_loss: 0.6174, test_loss: 0.8599, test_f1: 0.6390
 epoch: 73, train_loss: 0.6240, test_loss: 0.8701, test_f1: 0.6286
 epoch: 74, train_loss: 0.6127, test_loss: 0.8601, test_f1: 0.6434
 epoch: 75, train_loss: 0.6145, test_loss: 0.8744, test_f1: 0.6229
 epoch: 76, train_loss: 0.6136, test_loss: 0.8771, test_f1: 0.6493
 epoch: 77, train_loss: 0.6208, test_loss: 0.8784, test_f1: 0.6540
 epoch: 78, train_loss: 0.6038, test_loss: 0.9121, test_f1: 0.6255
 epoch: 79, train_loss: 0.6169, test_loss: 0.8561, test_f1: 0.6405
 epoch: 80, train_loss: 0.6150, test_loss: 0.8499, test_f1: 0.6492
 epoch: 81, train_loss: 0.6135, test_loss: 0.8596, test_f1: 0.6563
 epoch: 82, train_loss: 0.6038, test_loss: 0.9060, test_f1: 0.6234
 epoch: 83, train_loss: 0.6036, test_loss: 0.8653, test_f1: 0.6442
 epoch: 84, train_loss: 0.6019, test_loss: 0.8713, test_f1: 0.6512
 epoch: 85, train_loss: 0.6002, test_loss: 0.8737, test_f1: 0.6607
 epoch: 86, train_loss: 0.5940, test_loss: 0.8852, test_f1: 0.6797
 epoch: 87, train_loss: 0.5847, test_loss: 0.8763, test_f1: 0.6656
 epoch: 88, train_loss: 0.6012, test_loss: 0.9132, test_f1: 0.6303
 epoch: 89, train_loss: 0.5845, test_loss: 0.9070, test_f1: 0.6430
 epoch: 90, train_loss: 0.5879, test_loss: 0.8993, test_f1: 0.6667
 epoch: 91, train_loss: 0.5795, test_loss: 0.8716, test_f1: 0.6594
 epoch: 92, train_loss: 0.5937, test_loss: 0.8969, test_f1: 0.6436
 epoch: 93, train_loss: 0.6020, test_loss: 0.8735, test_f1: 0.6423
 epoch: 94, train_loss: 0.5850, test_loss: 0.8887, test_f1: 0.6574
 epoch: 95, train_loss: 0.5814, test_loss: 0.9015, test_f1: 0.6800
 epoch: 96, train_loss: 0.5787, test_loss: 0.9040, test_f1: 0.6530
 epoch: 97, train_loss: 0.5811, test_loss: 0.8982, test_f1: 0.6627
 epoch: 98, train_loss: 0.5839, test_loss: 0.9036, test_f1: 0.6601
 epoch: 99, train_loss: 0.5792, test_loss: 0.8849, test_f1: 0.6645
##################ITERATION #8 ****************************************
 epoch: 0, train_loss: 1.2505, test_loss: 1.0340, test_f1: 0.4673
 epoch: 1, train_loss: 1.0873, test_loss: 1.0270, test_f1: 0.4638
 epoch: 2, train_loss: 1.0393, test_loss: 0.9820, test_f1: 0.4788
 epoch: 3, train_loss: 1.0250, test_loss: 0.9599, test_f1: 0.4857
 epoch: 4, train_loss: 0.9960, test_loss: 0.9596, test_f1: 0.4835
 epoch: 5, train_loss: 0.9745, test_loss: 0.9515, test_f1: 0.4926
 epoch: 6, train_loss: 0.9643, test_loss: 0.9496, test_f1: 0.5027
 epoch: 7, train_loss: 0.9503, test_loss: 0.9368, test_f1: 0.5155
 epoch: 8, train_loss: 0.9421, test_loss: 0.9278, test_f1: 0.5428
 epoch: 9, train_loss: 0.9246, test_loss: 0.9154, test_f1: 0.5174
 epoch: 10, train_loss: 0.9158, test_loss: 0.9255, test_f1: 0.5268
 epoch: 11, train_loss: 0.9029, test_loss: 0.9109, test_f1: 0.5414
 epoch: 12, train_loss: 0.8939, test_loss: 0.9156, test_f1: 0.5193
 epoch: 13, train_loss: 0.8807, test_loss: 0.9077, test_f1: 0.5208
 epoch: 14, train_loss: 0.8773, test_loss: 0.8872, test_f1: 0.5057
 epoch: 15, train_loss: 0.8754, test_loss: 0.8753, test_f1: 0.5453
 epoch: 16, train_loss: 0.8600, test_loss: 0.8957, test_f1: 0.5461
 epoch: 17, train_loss: 0.8542, test_loss: 0.8889, test_f1: 0.5366
 epoch: 18, train_loss: 0.8490, test_loss: 0.9028, test_f1: 0.5619
 epoch: 19, train_loss: 0.8415, test_loss: 0.9120, test_f1: 0.5345
 epoch: 20, train_loss: 0.8368, test_loss: 0.8837, test_f1: 0.5599
 epoch: 21, train_loss: 0.8171, test_loss: 0.8975, test_f1: 0.5551
 epoch: 22, train_loss: 0.8315, test_loss: 0.8814, test_f1: 0.5584
 epoch: 23, train_loss: 0.8170, test_loss: 0.8773, test_f1: 0.5827
 epoch: 24, train_loss: 0.8098, test_loss: 0.8858, test_f1: 0.5766
 epoch: 25, train_loss: 0.8140, test_loss: 0.8891, test_f1: 0.5849
 epoch: 26, train_loss: 0.8139, test_loss: 0.8633, test_f1: 0.5808
 epoch: 27, train_loss: 0.8062, test_loss: 0.8759, test_f1: 0.5902
 epoch: 28, train_loss: 0.8083, test_loss: 0.8924, test_f1: 0.5973
 epoch: 29, train_loss: 0.8000, test_loss: 0.8912, test_f1: 0.5749
 epoch: 30, train_loss: 0.7874, test_loss: 0.8820, test_f1: 0.5931
 epoch: 31, train_loss: 0.7786, test_loss: 0.8706, test_f1: 0.5825
 epoch: 32, train_loss: 0.7658, test_loss: 0.8865, test_f1: 0.5875
 epoch: 33, train_loss: 0.7618, test_loss: 0.8817, test_f1: 0.5848
 epoch: 34, train_loss: 0.7637, test_loss: 0.8757, test_f1: 0.5877
 epoch: 35, train_loss: 0.7591, test_loss: 0.8677, test_f1: 0.6053
 epoch: 36, train_loss: 0.7459, test_loss: 0.8786, test_f1: 0.5949
 epoch: 37, train_loss: 0.7581, test_loss: 0.8596, test_f1: 0.6095
 epoch: 38, train_loss: 0.7398, test_loss: 0.8726, test_f1: 0.6073
 epoch: 39, train_loss: 0.7506, test_loss: 0.8703, test_f1: 0.6131
 epoch: 40, train_loss: 0.7398, test_loss: 0.8786, test_f1: 0.6253
 epoch: 41, train_loss: 0.7432, test_loss: 0.8598, test_f1: 0.6196
 epoch: 42, train_loss: 0.7361, test_loss: 0.8736, test_f1: 0.6315
 epoch: 43, train_loss: 0.7421, test_loss: 0.8746, test_f1: 0.6071
 epoch: 44, train_loss: 0.7321, test_loss: 0.8727, test_f1: 0.6079
 epoch: 45, train_loss: 0.7311, test_loss: 0.8788, test_f1: 0.5959
 epoch: 46, train_loss: 0.7142, test_loss: 0.8792, test_f1: 0.6261
 epoch: 47, train_loss: 0.7103, test_loss: 0.8783, test_f1: 0.6110
 epoch: 48, train_loss: 0.7035, test_loss: 0.8864, test_f1: 0.6358
 epoch: 49, train_loss: 0.7079, test_loss: 0.8966, test_f1: 0.6081
 epoch: 50, train_loss: 0.7083, test_loss: 0.8533, test_f1: 0.6261
 epoch: 51, train_loss: 0.6878, test_loss: 0.8760, test_f1: 0.6122
 epoch: 52, train_loss: 0.6788, test_loss: 0.8734, test_f1: 0.6174
 epoch: 53, train_loss: 0.6745, test_loss: 0.8704, test_f1: 0.6192
 epoch: 54, train_loss: 0.6829, test_loss: 0.8725, test_f1: 0.6187
 epoch: 55, train_loss: 0.6802, test_loss: 0.8799, test_f1: 0.6192
 epoch: 56, train_loss: 0.6732, test_loss: 0.8624, test_f1: 0.6111
 epoch: 57, train_loss: 0.6795, test_loss: 0.8746, test_f1: 0.6424
 epoch: 58, train_loss: 0.6660, test_loss: 0.8739, test_f1: 0.6188
 epoch: 59, train_loss: 0.6579, test_loss: 0.9081, test_f1: 0.5978
 epoch: 60, train_loss: 0.6655, test_loss: 0.8943, test_f1: 0.6046
 epoch: 61, train_loss: 0.6603, test_loss: 0.9000, test_f1: 0.6298
 epoch: 62, train_loss: 0.6536, test_loss: 0.8940, test_f1: 0.6316
 epoch: 63, train_loss: 0.6545, test_loss: 0.9008, test_f1: 0.6078
 epoch: 64, train_loss: 0.6602, test_loss: 0.8790, test_f1: 0.6265
 epoch: 65, train_loss: 0.6535, test_loss: 0.8703, test_f1: 0.6239
 epoch: 66, train_loss: 0.6539, test_loss: 0.8633, test_f1: 0.6211
 epoch: 67, train_loss: 0.6564, test_loss: 0.8827, test_f1: 0.6282
 epoch: 68, train_loss: 0.6490, test_loss: 0.8834, test_f1: 0.6374
 epoch: 69, train_loss: 0.6569, test_loss: 0.8804, test_f1: 0.6459
 epoch: 70, train_loss: 0.6463, test_loss: 0.8795, test_f1: 0.6412
 epoch: 71, train_loss: 0.6400, test_loss: 0.8777, test_f1: 0.6578
 epoch: 72, train_loss: 0.6391, test_loss: 0.8727, test_f1: 0.6154
 epoch: 73, train_loss: 0.6365, test_loss: 0.8761, test_f1: 0.6243
 epoch: 74, train_loss: 0.6307, test_loss: 0.9018, test_f1: 0.6325
 epoch: 75, train_loss: 0.6329, test_loss: 0.9094, test_f1: 0.6195
 epoch: 76, train_loss: 0.6509, test_loss: 0.9194, test_f1: 0.6242
 epoch: 77, train_loss: 0.6377, test_loss: 0.9042, test_f1: 0.6323
 epoch: 78, train_loss: 0.6202, test_loss: 0.9110, test_f1: 0.6383
 epoch: 79, train_loss: 0.6283, test_loss: 0.8898, test_f1: 0.6388
 epoch: 80, train_loss: 0.6208, test_loss: 0.8782, test_f1: 0.6158
 epoch: 81, train_loss: 0.6157, test_loss: 0.8819, test_f1: 0.6443
 epoch: 82, train_loss: 0.6171, test_loss: 0.8661, test_f1: 0.6212
 epoch: 83, train_loss: 0.6269, test_loss: 0.8896, test_f1: 0.6385
 epoch: 84, train_loss: 0.6306, test_loss: 0.8925, test_f1: 0.6171
 epoch: 85, train_loss: 0.6184, test_loss: 0.9355, test_f1: 0.6134
 epoch: 86, train_loss: 0.6049, test_loss: 0.9120, test_f1: 0.6265
 epoch: 87, train_loss: 0.6109, test_loss: 0.9093, test_f1: 0.6211
 epoch: 88, train_loss: 0.6087, test_loss: 0.9061, test_f1: 0.6153
 epoch: 89, train_loss: 0.6085, test_loss: 0.9198, test_f1: 0.6403
 epoch: 90, train_loss: 0.6017, test_loss: 0.9108, test_f1: 0.6318
 epoch: 91, train_loss: 0.6015, test_loss: 0.9259, test_f1: 0.6380
 epoch: 92, train_loss: 0.6067, test_loss: 0.9067, test_f1: 0.6267
 epoch: 93, train_loss: 0.5973, test_loss: 0.9145, test_f1: 0.6182
 epoch: 94, train_loss: 0.5957, test_loss: 0.8916, test_f1: 0.6329
 epoch: 95, train_loss: 0.6029, test_loss: 0.8933, test_f1: 0.6374
 epoch: 96, train_loss: 0.6149, test_loss: 0.9029, test_f1: 0.6477
 epoch: 97, train_loss: 0.5960, test_loss: 0.9391, test_f1: 0.6220
 epoch: 98, train_loss: 0.5844, test_loss: 0.9057, test_f1: 0.6376
 epoch: 99, train_loss: 0.5846, test_loss: 0.9281, test_f1: 0.6449
##################ITERATION #9 ****************************************
 epoch: 0, train_loss: 1.3090, test_loss: 1.0232, test_f1: 0.4671
 epoch: 1, train_loss: 1.1160, test_loss: 0.9940, test_f1: 0.4841
 epoch: 2, train_loss: 1.0726, test_loss: 0.9942, test_f1: 0.4510
 epoch: 3, train_loss: 1.0426, test_loss: 0.9713, test_f1: 0.4816
 epoch: 4, train_loss: 1.0138, test_loss: 0.9648, test_f1: 0.5220
 epoch: 5, train_loss: 0.9913, test_loss: 0.9474, test_f1: 0.4989
 epoch: 6, train_loss: 0.9637, test_loss: 0.9359, test_f1: 0.5199
 epoch: 7, train_loss: 0.9537, test_loss: 0.9345, test_f1: 0.5229
 epoch: 8, train_loss: 0.9411, test_loss: 0.9261, test_f1: 0.5196
 epoch: 9, train_loss: 0.9344, test_loss: 0.9317, test_f1: 0.5223
 epoch: 10, train_loss: 0.9309, test_loss: 0.9304, test_f1: 0.5213
 epoch: 11, train_loss: 0.9129, test_loss: 0.9217, test_f1: 0.5234
 epoch: 12, train_loss: 0.8996, test_loss: 0.9237, test_f1: 0.5273
 epoch: 13, train_loss: 0.8988, test_loss: 0.9320, test_f1: 0.5092
 epoch: 14, train_loss: 0.8827, test_loss: 0.9071, test_f1: 0.5243
 epoch: 15, train_loss: 0.8862, test_loss: 0.9013, test_f1: 0.5385
 epoch: 16, train_loss: 0.8663, test_loss: 0.9014, test_f1: 0.5442
 epoch: 17, train_loss: 0.8648, test_loss: 0.9052, test_f1: 0.5451
 epoch: 18, train_loss: 0.8571, test_loss: 0.8872, test_f1: 0.5432
 epoch: 19, train_loss: 0.8536, test_loss: 0.9105, test_f1: 0.5637
 epoch: 20, train_loss: 0.8480, test_loss: 0.8888, test_f1: 0.5657
 epoch: 21, train_loss: 0.8487, test_loss: 0.8757, test_f1: 0.5449
 epoch: 22, train_loss: 0.8445, test_loss: 0.8815, test_f1: 0.5389
 epoch: 23, train_loss: 0.8395, test_loss: 0.8920, test_f1: 0.5578
 epoch: 24, train_loss: 0.8308, test_loss: 0.8824, test_f1: 0.5598
 epoch: 25, train_loss: 0.8219, test_loss: 0.8963, test_f1: 0.5502
 epoch: 26, train_loss: 0.8333, test_loss: 0.8911, test_f1: 0.5710
 epoch: 27, train_loss: 0.8129, test_loss: 0.8940, test_f1: 0.5549
 epoch: 28, train_loss: 0.8107, test_loss: 0.8846, test_f1: 0.5533
 epoch: 29, train_loss: 0.8029, test_loss: 0.8736, test_f1: 0.5501
 epoch: 30, train_loss: 0.8054, test_loss: 0.8685, test_f1: 0.5663
 epoch: 31, train_loss: 0.7893, test_loss: 0.8532, test_f1: 0.5724
 epoch: 32, train_loss: 0.7916, test_loss: 0.8909, test_f1: 0.5678
 epoch: 33, train_loss: 0.7907, test_loss: 0.8675, test_f1: 0.5811
 epoch: 34, train_loss: 0.7816, test_loss: 0.8562, test_f1: 0.5821
 epoch: 35, train_loss: 0.7635, test_loss: 0.8791, test_f1: 0.5779
 epoch: 36, train_loss: 0.7766, test_loss: 0.8746, test_f1: 0.5874
 epoch: 37, train_loss: 0.7551, test_loss: 0.8728, test_f1: 0.5802
 epoch: 38, train_loss: 0.7580, test_loss: 0.8554, test_f1: 0.5769
 epoch: 39, train_loss: 0.7573, test_loss: 0.8610, test_f1: 0.5848
 epoch: 40, train_loss: 0.7512, test_loss: 0.8930, test_f1: 0.5778
 epoch: 41, train_loss: 0.7443, test_loss: 0.8907, test_f1: 0.5833
 epoch: 42, train_loss: 0.7487, test_loss: 0.8696, test_f1: 0.6102
 epoch: 43, train_loss: 0.7386, test_loss: 0.8712, test_f1: 0.5895
 epoch: 44, train_loss: 0.7483, test_loss: 0.8925, test_f1: 0.5999
 epoch: 45, train_loss: 0.7257, test_loss: 0.9095, test_f1: 0.6099
 epoch: 46, train_loss: 0.7308, test_loss: 0.8743, test_f1: 0.5896
 epoch: 47, train_loss: 0.7191, test_loss: 0.8808, test_f1: 0.6137
 epoch: 48, train_loss: 0.7265, test_loss: 0.8426, test_f1: 0.5907
 epoch: 49, train_loss: 0.7266, test_loss: 0.8933, test_f1: 0.6052
 epoch: 50, train_loss: 0.7102, test_loss: 0.8898, test_f1: 0.6029
 epoch: 51, train_loss: 0.7079, test_loss: 0.8885, test_f1: 0.6040
 epoch: 52, train_loss: 0.7044, test_loss: 0.9159, test_f1: 0.6116
 epoch: 53, train_loss: 0.6869, test_loss: 0.8723, test_f1: 0.6226
 epoch: 54, train_loss: 0.6899, test_loss: 0.8848, test_f1: 0.6094
 epoch: 55, train_loss: 0.6910, test_loss: 0.8835, test_f1: 0.6276
 epoch: 56, train_loss: 0.6716, test_loss: 0.8863, test_f1: 0.6125
 epoch: 57, train_loss: 0.6916, test_loss: 0.8753, test_f1: 0.6150
 epoch: 58, train_loss: 0.6840, test_loss: 0.8820, test_f1: 0.6110
 epoch: 59, train_loss: 0.6864, test_loss: 0.8499, test_f1: 0.6315
 epoch: 60, train_loss: 0.6933, test_loss: 0.8935, test_f1: 0.6094
 epoch: 61, train_loss: 0.6914, test_loss: 0.9047, test_f1: 0.6175
 epoch: 62, train_loss: 0.6822, test_loss: 0.8736, test_f1: 0.6043
 epoch: 63, train_loss: 0.6801, test_loss: 0.8999, test_f1: 0.6081
 epoch: 64, train_loss: 0.6562, test_loss: 0.8903, test_f1: 0.5941
 epoch: 65, train_loss: 0.6717, test_loss: 0.8921, test_f1: 0.6228
 epoch: 66, train_loss: 0.6643, test_loss: 0.8963, test_f1: 0.6192
 epoch: 67, train_loss: 0.6662, test_loss: 0.8906, test_f1: 0.6500
 epoch: 68, train_loss: 0.6786, test_loss: 0.9026, test_f1: 0.6508
 epoch: 69, train_loss: 0.6621, test_loss: 0.8920, test_f1: 0.6089
 epoch: 70, train_loss: 0.6563, test_loss: 0.9026, test_f1: 0.6123
 epoch: 71, train_loss: 0.6629, test_loss: 0.8980, test_f1: 0.6307
 epoch: 72, train_loss: 0.6752, test_loss: 0.9010, test_f1: 0.6132
 epoch: 73, train_loss: 0.6535, test_loss: 0.9237, test_f1: 0.6019
 epoch: 74, train_loss: 0.6600, test_loss: 0.8679, test_f1: 0.6185
 epoch: 75, train_loss: 0.6661, test_loss: 0.9141, test_f1: 0.6362
 epoch: 76, train_loss: 0.6584, test_loss: 0.9099, test_f1: 0.6256
 epoch: 77, train_loss: 0.6457, test_loss: 0.8912, test_f1: 0.6225
 epoch: 78, train_loss: 0.6485, test_loss: 0.9028, test_f1: 0.6235
 epoch: 79, train_loss: 0.6481, test_loss: 0.8682, test_f1: 0.6413
 epoch: 80, train_loss: 0.6522, test_loss: 0.8877, test_f1: 0.6423
 epoch: 81, train_loss: 0.6409, test_loss: 0.9185, test_f1: 0.6337
 epoch: 82, train_loss: 0.6477, test_loss: 0.8897, test_f1: 0.6338
 epoch: 83, train_loss: 0.6500, test_loss: 0.8932, test_f1: 0.6317
 epoch: 84, train_loss: 0.6219, test_loss: 0.8979, test_f1: 0.6278
 epoch: 85, train_loss: 0.6558, test_loss: 0.8970, test_f1: 0.6536
 epoch: 86, train_loss: 0.6418, test_loss: 0.8757, test_f1: 0.6565
 epoch: 87, train_loss: 0.6517, test_loss: 0.8830, test_f1: 0.6348
 epoch: 88, train_loss: 0.6383, test_loss: 0.8668, test_f1: 0.6325
 epoch: 89, train_loss: 0.6306, test_loss: 0.8772, test_f1: 0.6276
 epoch: 90, train_loss: 0.6431, test_loss: 0.9197, test_f1: 0.6235
 epoch: 91, train_loss: 0.6214, test_loss: 0.8992, test_f1: 0.6063
 epoch: 92, train_loss: 0.6275, test_loss: 0.8572, test_f1: 0.6488
 epoch: 93, train_loss: 0.6273, test_loss: 0.9026, test_f1: 0.6305
 epoch: 94, train_loss: 0.6290, test_loss: 0.8919, test_f1: 0.6140
 epoch: 95, train_loss: 0.6146, test_loss: 0.8986, test_f1: 0.6223
 epoch: 96, train_loss: 0.6241, test_loss: 0.8977, test_f1: 0.6426
 epoch: 97, train_loss: 0.6009, test_loss: 0.8864, test_f1: 0.6220
 epoch: 98, train_loss: 0.6122, test_loss: 0.8921, test_f1: 0.6538
 epoch: 99, train_loss: 0.6094, test_loss: 0.8760, test_f1: 0.6390

Training completed in 798.77 seconds
Best F1: 0.7013 at epoch 94
Mean F1 across iterations: 0.6690  0.0187
========================FINAL RESULTS================================
FEGIN weighted F1: 0.7013  0.0187
python main.py --data ltspice_examples --representation component_net --model FEGIN --layers 2 --hiddens 128 --batch_size 32 --lr 0.0001 --emb_size 128 --epochs 100 --save_appendix component_net_L2_H128_BS32_LR0.0001_E128 --no_val
-----



STDERR:
  File "main.py", line 370, in <module>
    main()
  File "main.py", line 254, in main
    dataset = dataset_class(
  File "/home/philip/projects/ltspice_examples_code_repo/Circuit-Completion-Using-GNNs/component_classification_with_link_prediction_head/evaluation/FEGIN/kernel/circuit_datasets.py", line 15, in __init__
    self.data, self.slices = torch.load(self.processed_paths[0])
  File "/home/philip/.local/lib/python3.8/site-packages/torch/serialization.py", line 1040, in load
    warnings.warn(
  File "/usr/lib/python3.8/warnings.py", line 109, in _showwarnmsg
    sw(msg.message, msg.category, msg.filename, msg.lineno,
  File "main.py", line 47, in warn_with_traceback
    traceback.print_stack(file=log)
/home/philip/projects/ltspice_examples_code_repo/Circuit-Completion-Using-GNNs/component_classification_with_link_prediction_head/evaluation/FEGIN/kernel/circuit_datasets.py:15: FutureWarning: You are using `torch.load` with `weights_only=False` (the current default value), which uses the default pickle module implicitly. It is possible to construct malicious pickle data which will execute arbitrary code during unpickling (See https://github.com/pytorch/pytorch/blob/main/SECURITY.md#untrusted-models for more details). In a future release, the default value for `weights_only` will be flipped to `True`. This limits the functions that could be executed during unpickling. Arbitrary objects will no longer be allowed to be loaded via this mode unless they are explicitly allowlisted by the user via `torch.serialization.add_safe_globals`. We recommend you start setting `weights_only=True` for any use case where you don't have full control of the loaded file. Please open an issue on GitHub for any issues related to this experimental feature.
  self.data, self.slices = torch.load(self.processed_paths[0])
