STDOUT:
Results will be saved in /home/philip/projects/ltspice_examples_code_repo/Circuit-Completion-Using-GNNs/component_classification_with_link_prediction_head/evaluation/FEGIN/results/model_FEGIN_dataset_ltspice_examples
Command line input: python main.py --data ltspice_examples --representation component_pin_net --model FEGIN --layers 3 --hiddens 128 --batch_size 256 --lr 0.0001 --emb_size 128 --epochs 100 --save_appendix component_pin_net_L3_H128_BS256_LR0.0001_E128 --no_val
 is saved.
-----
ltspice_examples - FEGIN
Using 3 layers, 128 hidden units, h = 2
Loading component_pin_net representation dataset
ENTERED
Training FEGIN on component_pin_net representation
Train: 3558, Test: 846
##################ITERATION #0 ****************************************
 epoch: 0, train_loss: 1.3891, test_loss: 1.3914, test_f1: 0.0304
 epoch: 1, train_loss: 1.3687, test_loss: 1.3830, test_f1: 0.2117
 epoch: 2, train_loss: 1.3500, test_loss: 1.3684, test_f1: 0.2270
 epoch: 3, train_loss: 1.3258, test_loss: 1.3400, test_f1: 0.2270
 epoch: 4, train_loss: 1.2943, test_loss: 1.2920, test_f1: 0.2270
 epoch: 5, train_loss: 1.2611, test_loss: 1.2443, test_f1: 0.2392
 epoch: 6, train_loss: 1.2351, test_loss: 1.2128, test_f1: 0.2671
 epoch: 7, train_loss: 1.2117, test_loss: 1.1884, test_f1: 0.2903
 epoch: 8, train_loss: 1.1928, test_loss: 1.1694, test_f1: 0.3360
 epoch: 9, train_loss: 1.1760, test_loss: 1.1545, test_f1: 0.3467
 epoch: 10, train_loss: 1.1638, test_loss: 1.1399, test_f1: 0.3536
 epoch: 11, train_loss: 1.1483, test_loss: 1.1262, test_f1: 0.3545
 epoch: 12, train_loss: 1.1340, test_loss: 1.1081, test_f1: 0.3841
 epoch: 13, train_loss: 1.1130, test_loss: 1.0903, test_f1: 0.3992
 epoch: 14, train_loss: 1.0912, test_loss: 1.0672, test_f1: 0.4335
 epoch: 15, train_loss: 1.0653, test_loss: 1.0459, test_f1: 0.4523
 epoch: 16, train_loss: 1.0417, test_loss: 1.0212, test_f1: 0.4562
 epoch: 17, train_loss: 1.0190, test_loss: 1.0066, test_f1: 0.4729
 epoch: 18, train_loss: 1.0001, test_loss: 0.9894, test_f1: 0.5009
 epoch: 19, train_loss: 0.9835, test_loss: 0.9869, test_f1: 0.4917
 epoch: 20, train_loss: 0.9650, test_loss: 0.9781, test_f1: 0.4942
 epoch: 21, train_loss: 0.9519, test_loss: 0.9584, test_f1: 0.4975
 epoch: 22, train_loss: 0.9429, test_loss: 0.9522, test_f1: 0.5195
 epoch: 23, train_loss: 0.9238, test_loss: 0.9352, test_f1: 0.5200
 epoch: 24, train_loss: 0.9138, test_loss: 0.9359, test_f1: 0.5382
 epoch: 25, train_loss: 0.9069, test_loss: 0.9455, test_f1: 0.4957
 epoch: 26, train_loss: 0.9007, test_loss: 0.9311, test_f1: 0.5243
 epoch: 27, train_loss: 0.8832, test_loss: 0.9257, test_f1: 0.5347
 epoch: 28, train_loss: 0.8758, test_loss: 0.9161, test_f1: 0.5434
 epoch: 29, train_loss: 0.8680, test_loss: 0.9129, test_f1: 0.5487
 epoch: 30, train_loss: 0.8615, test_loss: 0.8915, test_f1: 0.5433
 epoch: 31, train_loss: 0.8551, test_loss: 0.9100, test_f1: 0.5406
 epoch: 32, train_loss: 0.8519, test_loss: 0.9356, test_f1: 0.5320
 epoch: 33, train_loss: 0.8446, test_loss: 0.8987, test_f1: 0.5374
 epoch: 34, train_loss: 0.8328, test_loss: 0.9008, test_f1: 0.5472
 epoch: 35, train_loss: 0.8315, test_loss: 0.8838, test_f1: 0.5488
 epoch: 36, train_loss: 0.8265, test_loss: 0.8981, test_f1: 0.5387
 epoch: 37, train_loss: 0.8170, test_loss: 0.8961, test_f1: 0.5478
 epoch: 38, train_loss: 0.8110, test_loss: 0.8865, test_f1: 0.5568
 epoch: 39, train_loss: 0.8036, test_loss: 0.9019, test_f1: 0.5543
 epoch: 40, train_loss: 0.7980, test_loss: 0.8968, test_f1: 0.5367
 epoch: 41, train_loss: 0.7968, test_loss: 0.8857, test_f1: 0.5549
 epoch: 42, train_loss: 0.7918, test_loss: 0.8812, test_f1: 0.5449
 epoch: 43, train_loss: 0.7915, test_loss: 0.9163, test_f1: 0.5552
 epoch: 44, train_loss: 0.7918, test_loss: 0.8642, test_f1: 0.5557
 epoch: 45, train_loss: 0.7754, test_loss: 0.9234, test_f1: 0.5473
 epoch: 46, train_loss: 0.7777, test_loss: 0.8615, test_f1: 0.5566
 epoch: 47, train_loss: 0.7779, test_loss: 0.8845, test_f1: 0.5677
 epoch: 48, train_loss: 0.7722, test_loss: 0.9133, test_f1: 0.5466
 epoch: 49, train_loss: 0.7769, test_loss: 0.8971, test_f1: 0.5490
 epoch: 50, train_loss: 0.7699, test_loss: 0.9024, test_f1: 0.5554
 epoch: 51, train_loss: 0.7521, test_loss: 0.8897, test_f1: 0.5581
 epoch: 52, train_loss: 0.7508, test_loss: 0.8816, test_f1: 0.5556
 epoch: 53, train_loss: 0.7452, test_loss: 0.8905, test_f1: 0.5576
 epoch: 54, train_loss: 0.7506, test_loss: 0.8946, test_f1: 0.5617
 epoch: 55, train_loss: 0.7540, test_loss: 0.9007, test_f1: 0.5601
 epoch: 56, train_loss: 0.7395, test_loss: 0.8927, test_f1: 0.5580
 epoch: 57, train_loss: 0.7373, test_loss: 0.8894, test_f1: 0.5472
 epoch: 58, train_loss: 0.7378, test_loss: 0.8963, test_f1: 0.5688
 epoch: 59, train_loss: 0.7373, test_loss: 0.9041, test_f1: 0.5523
 epoch: 60, train_loss: 0.7301, test_loss: 0.8983, test_f1: 0.5588
 epoch: 61, train_loss: 0.7306, test_loss: 0.9006, test_f1: 0.5646
 epoch: 62, train_loss: 0.7314, test_loss: 0.8980, test_f1: 0.5580
 epoch: 63, train_loss: 0.7326, test_loss: 0.9107, test_f1: 0.5711
 epoch: 64, train_loss: 0.7270, test_loss: 0.8914, test_f1: 0.5516
 epoch: 65, train_loss: 0.7232, test_loss: 0.9017, test_f1: 0.5628
 epoch: 66, train_loss: 0.7185, test_loss: 0.9109, test_f1: 0.5579
 epoch: 67, train_loss: 0.7137, test_loss: 0.9027, test_f1: 0.5562
 epoch: 68, train_loss: 0.7208, test_loss: 0.8992, test_f1: 0.5597
 epoch: 69, train_loss: 0.7140, test_loss: 0.9053, test_f1: 0.5612
 epoch: 70, train_loss: 0.7162, test_loss: 0.8890, test_f1: 0.5736
 epoch: 71, train_loss: 0.7076, test_loss: 0.8970, test_f1: 0.5688
 epoch: 72, train_loss: 0.7091, test_loss: 0.9020, test_f1: 0.5641
 epoch: 73, train_loss: 0.7118, test_loss: 0.8986, test_f1: 0.5649
 epoch: 74, train_loss: 0.7044, test_loss: 0.9086, test_f1: 0.5594
 epoch: 75, train_loss: 0.7049, test_loss: 0.9193, test_f1: 0.5719
 epoch: 76, train_loss: 0.7127, test_loss: 0.9042, test_f1: 0.5626
 epoch: 77, train_loss: 0.7045, test_loss: 0.9163, test_f1: 0.5721
 epoch: 78, train_loss: 0.6974, test_loss: 0.9066, test_f1: 0.5609
 epoch: 79, train_loss: 0.6931, test_loss: 0.9246, test_f1: 0.5636
 epoch: 80, train_loss: 0.6916, test_loss: 0.9122, test_f1: 0.5721
 epoch: 81, train_loss: 0.6980, test_loss: 0.9077, test_f1: 0.5617
 epoch: 82, train_loss: 0.6876, test_loss: 0.9028, test_f1: 0.5759
 epoch: 83, train_loss: 0.6892, test_loss: 0.8998, test_f1: 0.5809
 epoch: 84, train_loss: 0.6944, test_loss: 0.9172, test_f1: 0.5684
 epoch: 85, train_loss: 0.6857, test_loss: 0.9100, test_f1: 0.5841
 epoch: 86, train_loss: 0.6852, test_loss: 0.9279, test_f1: 0.5722
 epoch: 87, train_loss: 0.6950, test_loss: 0.9290, test_f1: 0.5775
 epoch: 88, train_loss: 0.6864, test_loss: 0.9197, test_f1: 0.6000
 epoch: 89, train_loss: 0.6816, test_loss: 0.9236, test_f1: 0.5722
 epoch: 90, train_loss: 0.6878, test_loss: 0.9095, test_f1: 0.5836
 epoch: 91, train_loss: 0.6664, test_loss: 0.9110, test_f1: 0.5820
 epoch: 92, train_loss: 0.6691, test_loss: 0.9303, test_f1: 0.5605
 epoch: 93, train_loss: 0.6739, test_loss: 0.9250, test_f1: 0.5935
 epoch: 94, train_loss: 0.6651, test_loss: 0.9296, test_f1: 0.5914
 epoch: 95, train_loss: 0.6760, test_loss: 0.9283, test_f1: 0.5924
 epoch: 96, train_loss: 0.6783, test_loss: 0.9443, test_f1: 0.5730
 epoch: 97, train_loss: 0.6642, test_loss: 0.9361, test_f1: 0.5891
 epoch: 98, train_loss: 0.6663, test_loss: 0.9372, test_f1: 0.5684
 epoch: 99, train_loss: 0.6548, test_loss: 0.9309, test_f1: 0.5922
##################ITERATION #1 ****************************************
 epoch: 0, train_loss: 1.3437, test_loss: 1.3691, test_f1: 0.2270
 epoch: 1, train_loss: 1.2788, test_loss: 1.3379, test_f1: 0.2270
 epoch: 2, train_loss: 1.2352, test_loss: 1.2987, test_f1: 0.2270
 epoch: 3, train_loss: 1.1890, test_loss: 1.2298, test_f1: 0.2270
 epoch: 4, train_loss: 1.1500, test_loss: 1.1424, test_f1: 0.3791
 epoch: 5, train_loss: 1.1119, test_loss: 1.0855, test_f1: 0.4148
 epoch: 6, train_loss: 1.0767, test_loss: 1.0495, test_f1: 0.4402
 epoch: 7, train_loss: 1.0523, test_loss: 1.0274, test_f1: 0.4612
 epoch: 8, train_loss: 1.0262, test_loss: 1.0082, test_f1: 0.4783
 epoch: 9, train_loss: 1.0027, test_loss: 0.9916, test_f1: 0.5071
 epoch: 10, train_loss: 0.9876, test_loss: 0.9832, test_f1: 0.5133
 epoch: 11, train_loss: 0.9701, test_loss: 0.9705, test_f1: 0.5155
 epoch: 12, train_loss: 0.9601, test_loss: 0.9568, test_f1: 0.5278
 epoch: 13, train_loss: 0.9477, test_loss: 0.9503, test_f1: 0.5309
 epoch: 14, train_loss: 0.9375, test_loss: 0.9346, test_f1: 0.5476
 epoch: 15, train_loss: 0.9287, test_loss: 0.9568, test_f1: 0.5180
 epoch: 16, train_loss: 0.9223, test_loss: 0.9251, test_f1: 0.5369
 epoch: 17, train_loss: 0.9126, test_loss: 0.9327, test_f1: 0.5508
 epoch: 18, train_loss: 0.8975, test_loss: 0.9178, test_f1: 0.5632
 epoch: 19, train_loss: 0.8887, test_loss: 0.9005, test_f1: 0.5619
 epoch: 20, train_loss: 0.8856, test_loss: 0.9192, test_f1: 0.5441
 epoch: 21, train_loss: 0.8759, test_loss: 0.8918, test_f1: 0.5623
 epoch: 22, train_loss: 0.8690, test_loss: 0.8918, test_f1: 0.5571
 epoch: 23, train_loss: 0.8675, test_loss: 0.8929, test_f1: 0.5368
 epoch: 24, train_loss: 0.8566, test_loss: 0.8836, test_f1: 0.5496
 epoch: 25, train_loss: 0.8485, test_loss: 0.9110, test_f1: 0.5467
 epoch: 26, train_loss: 0.8539, test_loss: 0.8809, test_f1: 0.5378
 epoch: 27, train_loss: 0.8381, test_loss: 0.8735, test_f1: 0.5568
 epoch: 28, train_loss: 0.8308, test_loss: 0.8749, test_f1: 0.5489
 epoch: 29, train_loss: 0.8299, test_loss: 0.8708, test_f1: 0.5602
 epoch: 30, train_loss: 0.8279, test_loss: 0.8653, test_f1: 0.5759
 epoch: 31, train_loss: 0.8188, test_loss: 0.8734, test_f1: 0.5323
 epoch: 32, train_loss: 0.8099, test_loss: 0.8469, test_f1: 0.5631
 epoch: 33, train_loss: 0.8039, test_loss: 0.8613, test_f1: 0.5506
 epoch: 34, train_loss: 0.8053, test_loss: 0.8554, test_f1: 0.5487
 epoch: 35, train_loss: 0.7943, test_loss: 0.9055, test_f1: 0.5462
 epoch: 36, train_loss: 0.7892, test_loss: 0.8522, test_f1: 0.5541
 epoch: 37, train_loss: 0.7817, test_loss: 0.8475, test_f1: 0.5610
 epoch: 38, train_loss: 0.7776, test_loss: 0.8333, test_f1: 0.5555
 epoch: 39, train_loss: 0.7662, test_loss: 0.8642, test_f1: 0.5651
 epoch: 40, train_loss: 0.7640, test_loss: 0.8536, test_f1: 0.5685
 epoch: 41, train_loss: 0.7460, test_loss: 0.8458, test_f1: 0.5696
 epoch: 42, train_loss: 0.7496, test_loss: 0.8376, test_f1: 0.5606
 epoch: 43, train_loss: 0.7401, test_loss: 0.8282, test_f1: 0.5603
 epoch: 44, train_loss: 0.7387, test_loss: 0.8186, test_f1: 0.5599
 epoch: 45, train_loss: 0.7477, test_loss: 0.8426, test_f1: 0.5774
 epoch: 46, train_loss: 0.7349, test_loss: 0.8572, test_f1: 0.5663
 epoch: 47, train_loss: 0.7324, test_loss: 0.8720, test_f1: 0.5600
 epoch: 48, train_loss: 0.7269, test_loss: 0.8473, test_f1: 0.5680
 epoch: 49, train_loss: 0.7180, test_loss: 0.8422, test_f1: 0.5676
 epoch: 50, train_loss: 0.7205, test_loss: 0.8182, test_f1: 0.5809
 epoch: 51, train_loss: 0.6981, test_loss: 0.8316, test_f1: 0.5773
 epoch: 52, train_loss: 0.6953, test_loss: 0.8378, test_f1: 0.5748
 epoch: 53, train_loss: 0.6903, test_loss: 0.8350, test_f1: 0.5779
 epoch: 54, train_loss: 0.6936, test_loss: 0.8427, test_f1: 0.5780
 epoch: 55, train_loss: 0.6939, test_loss: 0.8364, test_f1: 0.5767
 epoch: 56, train_loss: 0.6840, test_loss: 0.8363, test_f1: 0.5760
 epoch: 57, train_loss: 0.6839, test_loss: 0.8472, test_f1: 0.5835
 epoch: 58, train_loss: 0.6784, test_loss: 0.8304, test_f1: 0.5829
 epoch: 59, train_loss: 0.6834, test_loss: 0.8501, test_f1: 0.5737
 epoch: 60, train_loss: 0.6759, test_loss: 0.8323, test_f1: 0.5852
 epoch: 61, train_loss: 0.6734, test_loss: 0.8607, test_f1: 0.5733
 epoch: 62, train_loss: 0.6737, test_loss: 0.8571, test_f1: 0.5656
 epoch: 63, train_loss: 0.6724, test_loss: 0.8457, test_f1: 0.5755
 epoch: 64, train_loss: 0.6717, test_loss: 0.8436, test_f1: 0.5703
 epoch: 65, train_loss: 0.6620, test_loss: 0.8617, test_f1: 0.5738
 epoch: 66, train_loss: 0.6599, test_loss: 0.8499, test_f1: 0.5828
 epoch: 67, train_loss: 0.6639, test_loss: 0.8558, test_f1: 0.5703
 epoch: 68, train_loss: 0.6543, test_loss: 0.8611, test_f1: 0.5725
 epoch: 69, train_loss: 0.6562, test_loss: 0.8613, test_f1: 0.5823
 epoch: 70, train_loss: 0.6563, test_loss: 0.8641, test_f1: 0.5865
 epoch: 71, train_loss: 0.6532, test_loss: 0.8342, test_f1: 0.5899
 epoch: 72, train_loss: 0.6498, test_loss: 0.8634, test_f1: 0.5777
 epoch: 73, train_loss: 0.6530, test_loss: 0.8584, test_f1: 0.5962
 epoch: 74, train_loss: 0.6405, test_loss: 0.8698, test_f1: 0.5743
 epoch: 75, train_loss: 0.6428, test_loss: 0.8566, test_f1: 0.5897
 epoch: 76, train_loss: 0.6465, test_loss: 0.8623, test_f1: 0.5780
 epoch: 77, train_loss: 0.6428, test_loss: 0.8737, test_f1: 0.6006
 epoch: 78, train_loss: 0.6339, test_loss: 0.8953, test_f1: 0.5765
 epoch: 79, train_loss: 0.6428, test_loss: 0.8754, test_f1: 0.5812
 epoch: 80, train_loss: 0.6407, test_loss: 0.8817, test_f1: 0.5882
 epoch: 81, train_loss: 0.6260, test_loss: 0.8942, test_f1: 0.5786
 epoch: 82, train_loss: 0.6346, test_loss: 0.8803, test_f1: 0.5892
 epoch: 83, train_loss: 0.6232, test_loss: 0.8895, test_f1: 0.5775
 epoch: 84, train_loss: 0.6221, test_loss: 0.8753, test_f1: 0.5943
 epoch: 85, train_loss: 0.6317, test_loss: 0.8848, test_f1: 0.5828
 epoch: 86, train_loss: 0.6310, test_loss: 0.8803, test_f1: 0.5768
 epoch: 87, train_loss: 0.6293, test_loss: 0.8720, test_f1: 0.5874
 epoch: 88, train_loss: 0.6202, test_loss: 0.8916, test_f1: 0.5709
 epoch: 89, train_loss: 0.6198, test_loss: 0.8776, test_f1: 0.5852
 epoch: 90, train_loss: 0.6188, test_loss: 0.8925, test_f1: 0.5794
 epoch: 91, train_loss: 0.6183, test_loss: 0.8759, test_f1: 0.5983
 epoch: 92, train_loss: 0.6125, test_loss: 0.8952, test_f1: 0.5709
 epoch: 93, train_loss: 0.6183, test_loss: 0.8929, test_f1: 0.6047
 epoch: 94, train_loss: 0.6083, test_loss: 0.8770, test_f1: 0.5866
 epoch: 95, train_loss: 0.6128, test_loss: 0.8979, test_f1: 0.5904
 epoch: 96, train_loss: 0.5977, test_loss: 0.8936, test_f1: 0.5935
 epoch: 97, train_loss: 0.6000, test_loss: 0.8881, test_f1: 0.5864
 epoch: 98, train_loss: 0.5938, test_loss: 0.9008, test_f1: 0.5858
 epoch: 99, train_loss: 0.6039, test_loss: 0.9101, test_f1: 0.5800
##################ITERATION #2 ****************************************
 epoch: 0, train_loss: 1.3088, test_loss: 1.3524, test_f1: 0.2270
 epoch: 1, train_loss: 1.2257, test_loss: 1.3157, test_f1: 0.2270
 epoch: 2, train_loss: 1.1749, test_loss: 1.2798, test_f1: 0.2270
 epoch: 3, train_loss: 1.1286, test_loss: 1.1931, test_f1: 0.2320
 epoch: 4, train_loss: 1.0869, test_loss: 1.0828, test_f1: 0.4077
 epoch: 5, train_loss: 1.0529, test_loss: 1.0299, test_f1: 0.4530
 epoch: 6, train_loss: 1.0304, test_loss: 1.0025, test_f1: 0.4883
 epoch: 7, train_loss: 1.0050, test_loss: 0.9853, test_f1: 0.4948
 epoch: 8, train_loss: 0.9905, test_loss: 0.9714, test_f1: 0.4994
 epoch: 9, train_loss: 0.9746, test_loss: 0.9595, test_f1: 0.5054
 epoch: 10, train_loss: 0.9645, test_loss: 0.9485, test_f1: 0.5006
 epoch: 11, train_loss: 0.9575, test_loss: 0.9403, test_f1: 0.5160
 epoch: 12, train_loss: 0.9480, test_loss: 0.9341, test_f1: 0.5255
 epoch: 13, train_loss: 0.9295, test_loss: 0.9250, test_f1: 0.5392
 epoch: 14, train_loss: 0.9273, test_loss: 0.9138, test_f1: 0.5278
 epoch: 15, train_loss: 0.9160, test_loss: 0.9135, test_f1: 0.5409
 epoch: 16, train_loss: 0.9079, test_loss: 0.9111, test_f1: 0.5191
 epoch: 17, train_loss: 0.8994, test_loss: 0.8983, test_f1: 0.5398
 epoch: 18, train_loss: 0.8895, test_loss: 0.8861, test_f1: 0.5605
 epoch: 19, train_loss: 0.8884, test_loss: 0.8868, test_f1: 0.5474
 epoch: 20, train_loss: 0.8787, test_loss: 0.8732, test_f1: 0.5606
 epoch: 21, train_loss: 0.8730, test_loss: 0.8922, test_f1: 0.5196
 epoch: 22, train_loss: 0.8599, test_loss: 0.8746, test_f1: 0.5696
 epoch: 23, train_loss: 0.8599, test_loss: 0.8686, test_f1: 0.5361
 epoch: 24, train_loss: 0.8421, test_loss: 0.8609, test_f1: 0.5632
 epoch: 25, train_loss: 0.8413, test_loss: 0.8974, test_f1: 0.5345
 epoch: 26, train_loss: 0.8373, test_loss: 0.8550, test_f1: 0.5494
 epoch: 27, train_loss: 0.8283, test_loss: 0.8511, test_f1: 0.5602
 epoch: 28, train_loss: 0.8196, test_loss: 0.8853, test_f1: 0.5548
 epoch: 29, train_loss: 0.8193, test_loss: 0.8431, test_f1: 0.5548
 epoch: 30, train_loss: 0.8036, test_loss: 0.8475, test_f1: 0.5685
 epoch: 31, train_loss: 0.7991, test_loss: 0.8431, test_f1: 0.5597
 epoch: 32, train_loss: 0.7934, test_loss: 0.8537, test_f1: 0.5681
 epoch: 33, train_loss: 0.7910, test_loss: 0.8623, test_f1: 0.5603
 epoch: 34, train_loss: 0.7872, test_loss: 0.8401, test_f1: 0.5465
 epoch: 35, train_loss: 0.7768, test_loss: 0.8325, test_f1: 0.5678
 epoch: 36, train_loss: 0.7768, test_loss: 0.8376, test_f1: 0.5747
 epoch: 37, train_loss: 0.7584, test_loss: 0.8483, test_f1: 0.5563
 epoch: 38, train_loss: 0.7582, test_loss: 0.8647, test_f1: 0.5502
 epoch: 39, train_loss: 0.7545, test_loss: 0.8453, test_f1: 0.5662
 epoch: 40, train_loss: 0.7459, test_loss: 0.8358, test_f1: 0.5562
 epoch: 41, train_loss: 0.7337, test_loss: 0.8544, test_f1: 0.5506
 epoch: 42, train_loss: 0.7351, test_loss: 0.8357, test_f1: 0.5682
 epoch: 43, train_loss: 0.7365, test_loss: 0.8440, test_f1: 0.5740
 epoch: 44, train_loss: 0.7285, test_loss: 0.8488, test_f1: 0.5553
 epoch: 45, train_loss: 0.7247, test_loss: 0.8358, test_f1: 0.5622
 epoch: 46, train_loss: 0.7194, test_loss: 0.8546, test_f1: 0.5425
 epoch: 47, train_loss: 0.7164, test_loss: 0.8461, test_f1: 0.5617
 epoch: 48, train_loss: 0.7087, test_loss: 0.8631, test_f1: 0.5606
 epoch: 49, train_loss: 0.7006, test_loss: 0.8626, test_f1: 0.5679
 epoch: 50, train_loss: 0.7034, test_loss: 0.8438, test_f1: 0.5695
 epoch: 51, train_loss: 0.6894, test_loss: 0.8402, test_f1: 0.5751
 epoch: 52, train_loss: 0.6836, test_loss: 0.8675, test_f1: 0.5696
 epoch: 53, train_loss: 0.6900, test_loss: 0.8655, test_f1: 0.5543
 epoch: 54, train_loss: 0.6738, test_loss: 0.8663, test_f1: 0.5622
 epoch: 55, train_loss: 0.6707, test_loss: 0.8576, test_f1: 0.5545
 epoch: 56, train_loss: 0.6725, test_loss: 0.8662, test_f1: 0.5666
 epoch: 57, train_loss: 0.6751, test_loss: 0.8733, test_f1: 0.5660
 epoch: 58, train_loss: 0.6670, test_loss: 0.8710, test_f1: 0.5610
 epoch: 59, train_loss: 0.6606, test_loss: 0.8664, test_f1: 0.5580
 epoch: 60, train_loss: 0.6622, test_loss: 0.8551, test_f1: 0.5609
 epoch: 61, train_loss: 0.6627, test_loss: 0.8657, test_f1: 0.5766
 epoch: 62, train_loss: 0.6669, test_loss: 0.8709, test_f1: 0.5719
 epoch: 63, train_loss: 0.6605, test_loss: 0.8656, test_f1: 0.5638
 epoch: 64, train_loss: 0.6559, test_loss: 0.8811, test_f1: 0.5543
 epoch: 65, train_loss: 0.6509, test_loss: 0.8794, test_f1: 0.5666
 epoch: 66, train_loss: 0.6523, test_loss: 0.8677, test_f1: 0.5680
 epoch: 67, train_loss: 0.6494, test_loss: 0.8615, test_f1: 0.5765
 epoch: 68, train_loss: 0.6382, test_loss: 0.8852, test_f1: 0.5623
 epoch: 69, train_loss: 0.6415, test_loss: 0.8799, test_f1: 0.5712
 epoch: 70, train_loss: 0.6353, test_loss: 0.8869, test_f1: 0.5711
 epoch: 71, train_loss: 0.6424, test_loss: 0.8830, test_f1: 0.5734
 epoch: 72, train_loss: 0.6327, test_loss: 0.8770, test_f1: 0.5645
 epoch: 73, train_loss: 0.6256, test_loss: 0.8788, test_f1: 0.5735
 epoch: 74, train_loss: 0.6279, test_loss: 0.8948, test_f1: 0.5725
 epoch: 75, train_loss: 0.6277, test_loss: 0.8964, test_f1: 0.5600
 epoch: 76, train_loss: 0.6210, test_loss: 0.8866, test_f1: 0.5742
 epoch: 77, train_loss: 0.6231, test_loss: 0.8862, test_f1: 0.5702
 epoch: 78, train_loss: 0.6224, test_loss: 0.8997, test_f1: 0.5635
 epoch: 79, train_loss: 0.6219, test_loss: 0.8983, test_f1: 0.5657
 epoch: 80, train_loss: 0.6226, test_loss: 0.8951, test_f1: 0.5622
 epoch: 81, train_loss: 0.6164, test_loss: 0.9238, test_f1: 0.5685
 epoch: 82, train_loss: 0.6139, test_loss: 0.9154, test_f1: 0.5707
 epoch: 83, train_loss: 0.6165, test_loss: 0.8935, test_f1: 0.5773
 epoch: 84, train_loss: 0.6109, test_loss: 0.9267, test_f1: 0.5636
 epoch: 85, train_loss: 0.6104, test_loss: 0.9325, test_f1: 0.5629
 epoch: 86, train_loss: 0.5967, test_loss: 0.9169, test_f1: 0.5708
 epoch: 87, train_loss: 0.5995, test_loss: 0.9230, test_f1: 0.5748
 epoch: 88, train_loss: 0.6033, test_loss: 0.9436, test_f1: 0.5808
 epoch: 89, train_loss: 0.5996, test_loss: 0.9372, test_f1: 0.5742
 epoch: 90, train_loss: 0.5985, test_loss: 0.9197, test_f1: 0.5756
 epoch: 91, train_loss: 0.5894, test_loss: 0.9447, test_f1: 0.5679
 epoch: 92, train_loss: 0.5987, test_loss: 0.9555, test_f1: 0.5728
 epoch: 93, train_loss: 0.5943, test_loss: 0.9388, test_f1: 0.5845
 epoch: 94, train_loss: 0.5861, test_loss: 0.9690, test_f1: 0.5577
 epoch: 95, train_loss: 0.5864, test_loss: 0.9508, test_f1: 0.5659
 epoch: 96, train_loss: 0.5802, test_loss: 0.9512, test_f1: 0.5897
 epoch: 97, train_loss: 0.5977, test_loss: 0.9301, test_f1: 0.5822
 epoch: 98, train_loss: 0.5770, test_loss: 0.9599, test_f1: 0.5758
 epoch: 99, train_loss: 0.5930, test_loss: 0.9581, test_f1: 0.5775
##################ITERATION #3 ****************************************
 epoch: 0, train_loss: 1.2673, test_loss: 1.3308, test_f1: 0.2270
 epoch: 1, train_loss: 1.1633, test_loss: 1.2808, test_f1: 0.2270
 epoch: 2, train_loss: 1.1083, test_loss: 1.1956, test_f1: 0.2506
 epoch: 3, train_loss: 1.0706, test_loss: 1.0900, test_f1: 0.3686
 epoch: 4, train_loss: 1.0403, test_loss: 1.0421, test_f1: 0.4554
 epoch: 5, train_loss: 1.0154, test_loss: 1.0178, test_f1: 0.4714
 epoch: 6, train_loss: 0.9934, test_loss: 1.0004, test_f1: 0.4979
 epoch: 7, train_loss: 0.9777, test_loss: 0.9825, test_f1: 0.5141
 epoch: 8, train_loss: 0.9678, test_loss: 0.9710, test_f1: 0.5199
 epoch: 9, train_loss: 0.9524, test_loss: 0.9581, test_f1: 0.5158
 epoch: 10, train_loss: 0.9428, test_loss: 0.9512, test_f1: 0.5313
 epoch: 11, train_loss: 0.9295, test_loss: 0.9468, test_f1: 0.5263
 epoch: 12, train_loss: 0.9305, test_loss: 0.9427, test_f1: 0.5322
 epoch: 13, train_loss: 0.9119, test_loss: 0.9296, test_f1: 0.5387
 epoch: 14, train_loss: 0.9067, test_loss: 0.9281, test_f1: 0.5303
 epoch: 15, train_loss: 0.8985, test_loss: 0.9331, test_f1: 0.5294
 epoch: 16, train_loss: 0.8917, test_loss: 0.9198, test_f1: 0.5420
 epoch: 17, train_loss: 0.8874, test_loss: 0.9325, test_f1: 0.5325
 epoch: 18, train_loss: 0.8732, test_loss: 0.9298, test_f1: 0.5262
 epoch: 19, train_loss: 0.8645, test_loss: 0.9183, test_f1: 0.5384
 epoch: 20, train_loss: 0.8530, test_loss: 0.9039, test_f1: 0.5346
 epoch: 21, train_loss: 0.8511, test_loss: 0.9080, test_f1: 0.5349
 epoch: 22, train_loss: 0.8512, test_loss: 0.8998, test_f1: 0.5406
 epoch: 23, train_loss: 0.8405, test_loss: 0.9243, test_f1: 0.5302
 epoch: 24, train_loss: 0.8355, test_loss: 0.8846, test_f1: 0.5413
 epoch: 25, train_loss: 0.8202, test_loss: 0.8761, test_f1: 0.5495
 epoch: 26, train_loss: 0.8102, test_loss: 0.8660, test_f1: 0.5503
 epoch: 27, train_loss: 0.8088, test_loss: 0.8949, test_f1: 0.5401
 epoch: 28, train_loss: 0.8035, test_loss: 0.9139, test_f1: 0.5430
 epoch: 29, train_loss: 0.8022, test_loss: 0.8643, test_f1: 0.5571
 epoch: 30, train_loss: 0.7982, test_loss: 0.8553, test_f1: 0.5558
 epoch: 31, train_loss: 0.7814, test_loss: 0.8578, test_f1: 0.5511
 epoch: 32, train_loss: 0.7798, test_loss: 0.8415, test_f1: 0.5608
 epoch: 33, train_loss: 0.7696, test_loss: 0.8713, test_f1: 0.5637
 epoch: 34, train_loss: 0.7629, test_loss: 0.8571, test_f1: 0.5662
 epoch: 35, train_loss: 0.7576, test_loss: 0.8542, test_f1: 0.5705
 epoch: 36, train_loss: 0.7502, test_loss: 0.8788, test_f1: 0.5739
 epoch: 37, train_loss: 0.7440, test_loss: 0.8298, test_f1: 0.5673
 epoch: 38, train_loss: 0.7401, test_loss: 0.8380, test_f1: 0.5805
 epoch: 39, train_loss: 0.7330, test_loss: 0.8455, test_f1: 0.5756
 epoch: 40, train_loss: 0.7288, test_loss: 0.8409, test_f1: 0.5693
 epoch: 41, train_loss: 0.7177, test_loss: 0.8648, test_f1: 0.5726
 epoch: 42, train_loss: 0.7205, test_loss: 0.8480, test_f1: 0.5960
 epoch: 43, train_loss: 0.7146, test_loss: 0.8599, test_f1: 0.5634
 epoch: 44, train_loss: 0.7123, test_loss: 0.8690, test_f1: 0.5930
 epoch: 45, train_loss: 0.7076, test_loss: 0.8538, test_f1: 0.5884
 epoch: 46, train_loss: 0.6930, test_loss: 0.8683, test_f1: 0.5966
 epoch: 47, train_loss: 0.7060, test_loss: 0.8413, test_f1: 0.5768
 epoch: 48, train_loss: 0.6913, test_loss: 0.8754, test_f1: 0.6071
 epoch: 49, train_loss: 0.6935, test_loss: 0.8772, test_f1: 0.5830
 epoch: 50, train_loss: 0.6830, test_loss: 0.8802, test_f1: 0.5690
 epoch: 51, train_loss: 0.6793, test_loss: 0.8481, test_f1: 0.6097
 epoch: 52, train_loss: 0.6678, test_loss: 0.8449, test_f1: 0.6004
 epoch: 53, train_loss: 0.6639, test_loss: 0.8667, test_f1: 0.5902
 epoch: 54, train_loss: 0.6643, test_loss: 0.8466, test_f1: 0.5942
 epoch: 55, train_loss: 0.6523, test_loss: 0.8591, test_f1: 0.6014
 epoch: 56, train_loss: 0.6584, test_loss: 0.8472, test_f1: 0.5978
 epoch: 57, train_loss: 0.6599, test_loss: 0.8620, test_f1: 0.6014
 epoch: 58, train_loss: 0.6551, test_loss: 0.8533, test_f1: 0.5949
 epoch: 59, train_loss: 0.6622, test_loss: 0.8386, test_f1: 0.6150
 epoch: 60, train_loss: 0.6511, test_loss: 0.8417, test_f1: 0.5991
 epoch: 61, train_loss: 0.6511, test_loss: 0.8552, test_f1: 0.5960
 epoch: 62, train_loss: 0.6433, test_loss: 0.8559, test_f1: 0.5923
 epoch: 63, train_loss: 0.6391, test_loss: 0.8557, test_f1: 0.6046
 epoch: 64, train_loss: 0.6424, test_loss: 0.8554, test_f1: 0.6023
 epoch: 65, train_loss: 0.6388, test_loss: 0.8630, test_f1: 0.5971
 epoch: 66, train_loss: 0.6310, test_loss: 0.8737, test_f1: 0.5911
 epoch: 67, train_loss: 0.6393, test_loss: 0.8701, test_f1: 0.5895
 epoch: 68, train_loss: 0.6409, test_loss: 0.8569, test_f1: 0.6090
 epoch: 69, train_loss: 0.6354, test_loss: 0.8912, test_f1: 0.5922
 epoch: 70, train_loss: 0.6221, test_loss: 0.8818, test_f1: 0.6031
 epoch: 71, train_loss: 0.6276, test_loss: 0.8691, test_f1: 0.6059
 epoch: 72, train_loss: 0.6205, test_loss: 0.8849, test_f1: 0.5879
 epoch: 73, train_loss: 0.6196, test_loss: 0.8656, test_f1: 0.6011
 epoch: 74, train_loss: 0.6205, test_loss: 0.8614, test_f1: 0.6035
 epoch: 75, train_loss: 0.6140, test_loss: 0.8755, test_f1: 0.6053
 epoch: 76, train_loss: 0.6085, test_loss: 0.8746, test_f1: 0.5942
 epoch: 77, train_loss: 0.6124, test_loss: 0.8809, test_f1: 0.6053
 epoch: 78, train_loss: 0.6091, test_loss: 0.8771, test_f1: 0.6050
 epoch: 79, train_loss: 0.6067, test_loss: 0.8852, test_f1: 0.5997
 epoch: 80, train_loss: 0.6104, test_loss: 0.8933, test_f1: 0.6270
 epoch: 81, train_loss: 0.6072, test_loss: 0.8901, test_f1: 0.6005
 epoch: 82, train_loss: 0.6085, test_loss: 0.8816, test_f1: 0.6190
 epoch: 83, train_loss: 0.6010, test_loss: 0.9088, test_f1: 0.6016
 epoch: 84, train_loss: 0.5957, test_loss: 0.8687, test_f1: 0.6242
 epoch: 85, train_loss: 0.6006, test_loss: 0.8799, test_f1: 0.6091
 epoch: 86, train_loss: 0.6005, test_loss: 0.8868, test_f1: 0.6145
 epoch: 87, train_loss: 0.5924, test_loss: 0.9159, test_f1: 0.6311
 epoch: 88, train_loss: 0.6011, test_loss: 0.9112, test_f1: 0.6303
 epoch: 89, train_loss: 0.5889, test_loss: 0.9006, test_f1: 0.6050
 epoch: 90, train_loss: 0.5962, test_loss: 0.8903, test_f1: 0.6266
 epoch: 91, train_loss: 0.5787, test_loss: 0.8946, test_f1: 0.6209
 epoch: 92, train_loss: 0.5858, test_loss: 0.8878, test_f1: 0.6245
 epoch: 93, train_loss: 0.6030, test_loss: 0.9089, test_f1: 0.6171
 epoch: 94, train_loss: 0.5840, test_loss: 0.8928, test_f1: 0.6228
 epoch: 95, train_loss: 0.5843, test_loss: 0.9093, test_f1: 0.6193
 epoch: 96, train_loss: 0.5808, test_loss: 0.9044, test_f1: 0.6141
 epoch: 97, train_loss: 0.5795, test_loss: 0.9197, test_f1: 0.6209
 epoch: 98, train_loss: 0.5796, test_loss: 0.9057, test_f1: 0.6178
 epoch: 99, train_loss: 0.5634, test_loss: 0.9038, test_f1: 0.6398
##################ITERATION #4 ****************************************
 epoch: 0, train_loss: 1.2533, test_loss: 1.3253, test_f1: 0.2270
 epoch: 1, train_loss: 1.1266, test_loss: 1.3022, test_f1: 0.2270
 epoch: 2, train_loss: 1.0724, test_loss: 1.2281, test_f1: 0.2570
 epoch: 3, train_loss: 1.0358, test_loss: 1.1094, test_f1: 0.3639
 epoch: 4, train_loss: 1.0059, test_loss: 1.0420, test_f1: 0.4611
 epoch: 5, train_loss: 0.9846, test_loss: 0.9872, test_f1: 0.4979
 epoch: 6, train_loss: 0.9667, test_loss: 0.9533, test_f1: 0.5267
 epoch: 7, train_loss: 0.9549, test_loss: 0.9313, test_f1: 0.5242
 epoch: 8, train_loss: 0.9382, test_loss: 0.9204, test_f1: 0.5442
 epoch: 9, train_loss: 0.9320, test_loss: 0.9106, test_f1: 0.5426
 epoch: 10, train_loss: 0.9237, test_loss: 0.9030, test_f1: 0.5379
 epoch: 11, train_loss: 0.9091, test_loss: 0.8979, test_f1: 0.5421
 epoch: 12, train_loss: 0.8984, test_loss: 0.8896, test_f1: 0.5320
 epoch: 13, train_loss: 0.8912, test_loss: 0.8820, test_f1: 0.5430
 epoch: 14, train_loss: 0.8869, test_loss: 0.8748, test_f1: 0.5488
 epoch: 15, train_loss: 0.8753, test_loss: 0.8692, test_f1: 0.5418
 epoch: 16, train_loss: 0.8701, test_loss: 0.8570, test_f1: 0.5498
 epoch: 17, train_loss: 0.8621, test_loss: 0.8530, test_f1: 0.5537
 epoch: 18, train_loss: 0.8474, test_loss: 0.8500, test_f1: 0.5524
 epoch: 19, train_loss: 0.8413, test_loss: 0.8378, test_f1: 0.5547
 epoch: 20, train_loss: 0.8310, test_loss: 0.8287, test_f1: 0.5532
 epoch: 21, train_loss: 0.8286, test_loss: 0.8325, test_f1: 0.5584
 epoch: 22, train_loss: 0.8170, test_loss: 0.8243, test_f1: 0.5542
 epoch: 23, train_loss: 0.8128, test_loss: 0.8199, test_f1: 0.5622
 epoch: 24, train_loss: 0.7964, test_loss: 0.8199, test_f1: 0.5529
 epoch: 25, train_loss: 0.7911, test_loss: 0.8139, test_f1: 0.5604
 epoch: 26, train_loss: 0.7859, test_loss: 0.8070, test_f1: 0.5620
 epoch: 27, train_loss: 0.7760, test_loss: 0.8169, test_f1: 0.5576
 epoch: 28, train_loss: 0.7761, test_loss: 0.8051, test_f1: 0.5581
 epoch: 29, train_loss: 0.7606, test_loss: 0.7916, test_f1: 0.5743
 epoch: 30, train_loss: 0.7629, test_loss: 0.8121, test_f1: 0.5649
 epoch: 31, train_loss: 0.7573, test_loss: 0.8193, test_f1: 0.5785
 epoch: 32, train_loss: 0.7455, test_loss: 0.7869, test_f1: 0.5755
 epoch: 33, train_loss: 0.7461, test_loss: 0.8012, test_f1: 0.5806
 epoch: 34, train_loss: 0.7313, test_loss: 0.7861, test_f1: 0.5723
 epoch: 35, train_loss: 0.7262, test_loss: 0.7913, test_f1: 0.5870
 epoch: 36, train_loss: 0.7212, test_loss: 0.7739, test_f1: 0.5796
 epoch: 37, train_loss: 0.7234, test_loss: 0.8008, test_f1: 0.5751
 epoch: 38, train_loss: 0.7086, test_loss: 0.7726, test_f1: 0.6030
 epoch: 39, train_loss: 0.7089, test_loss: 0.7824, test_f1: 0.5761
 epoch: 40, train_loss: 0.6990, test_loss: 0.7724, test_f1: 0.6009
 epoch: 41, train_loss: 0.7002, test_loss: 0.7830, test_f1: 0.6088
 epoch: 42, train_loss: 0.6906, test_loss: 0.7967, test_f1: 0.5953
 epoch: 43, train_loss: 0.6937, test_loss: 0.8004, test_f1: 0.5917
 epoch: 44, train_loss: 0.6852, test_loss: 0.7907, test_f1: 0.6040
 epoch: 45, train_loss: 0.6763, test_loss: 0.7982, test_f1: 0.5825
 epoch: 46, train_loss: 0.6663, test_loss: 0.7667, test_f1: 0.6075
 epoch: 47, train_loss: 0.6679, test_loss: 0.7784, test_f1: 0.5857
 epoch: 48, train_loss: 0.6652, test_loss: 0.7987, test_f1: 0.5989
 epoch: 49, train_loss: 0.6579, test_loss: 0.7841, test_f1: 0.5934
 epoch: 50, train_loss: 0.6539, test_loss: 0.7693, test_f1: 0.5989
 epoch: 51, train_loss: 0.6506, test_loss: 0.7912, test_f1: 0.6015
 epoch: 52, train_loss: 0.6416, test_loss: 0.7825, test_f1: 0.6190
 epoch: 53, train_loss: 0.6287, test_loss: 0.7780, test_f1: 0.6142
 epoch: 54, train_loss: 0.6314, test_loss: 0.7805, test_f1: 0.6183
 epoch: 55, train_loss: 0.6345, test_loss: 0.7823, test_f1: 0.6197
 epoch: 56, train_loss: 0.6293, test_loss: 0.7809, test_f1: 0.6152
 epoch: 57, train_loss: 0.6291, test_loss: 0.7840, test_f1: 0.6158
 epoch: 58, train_loss: 0.6120, test_loss: 0.7836, test_f1: 0.6274
 epoch: 59, train_loss: 0.6164, test_loss: 0.7932, test_f1: 0.6182
 epoch: 60, train_loss: 0.6216, test_loss: 0.8055, test_f1: 0.6087
 epoch: 61, train_loss: 0.6115, test_loss: 0.8010, test_f1: 0.6105
 epoch: 62, train_loss: 0.6036, test_loss: 0.8062, test_f1: 0.6140
 epoch: 63, train_loss: 0.6066, test_loss: 0.7936, test_f1: 0.6122
 epoch: 64, train_loss: 0.6084, test_loss: 0.7947, test_f1: 0.6177
 epoch: 65, train_loss: 0.5959, test_loss: 0.8093, test_f1: 0.6073
 epoch: 66, train_loss: 0.6048, test_loss: 0.8132, test_f1: 0.6162
 epoch: 67, train_loss: 0.6025, test_loss: 0.8109, test_f1: 0.6158
 epoch: 68, train_loss: 0.5974, test_loss: 0.7942, test_f1: 0.6222
 epoch: 69, train_loss: 0.5926, test_loss: 0.7943, test_f1: 0.6275
 epoch: 70, train_loss: 0.5869, test_loss: 0.8190, test_f1: 0.6117
 epoch: 71, train_loss: 0.5880, test_loss: 0.8152, test_f1: 0.6186
 epoch: 72, train_loss: 0.5863, test_loss: 0.8119, test_f1: 0.6179
 epoch: 73, train_loss: 0.5921, test_loss: 0.8174, test_f1: 0.6231
 epoch: 74, train_loss: 0.5796, test_loss: 0.8179, test_f1: 0.6259
 epoch: 75, train_loss: 0.5766, test_loss: 0.8242, test_f1: 0.6097
 epoch: 76, train_loss: 0.5896, test_loss: 0.8381, test_f1: 0.6302
 epoch: 77, train_loss: 0.5862, test_loss: 0.8406, test_f1: 0.6110
 epoch: 78, train_loss: 0.5798, test_loss: 0.8390, test_f1: 0.6284
 epoch: 79, train_loss: 0.5865, test_loss: 0.8295, test_f1: 0.6276
 epoch: 80, train_loss: 0.5741, test_loss: 0.8568, test_f1: 0.6154
 epoch: 81, train_loss: 0.5717, test_loss: 0.8302, test_f1: 0.6316
 epoch: 82, train_loss: 0.5765, test_loss: 0.8308, test_f1: 0.6203
 epoch: 83, train_loss: 0.5656, test_loss: 0.8529, test_f1: 0.6263
 epoch: 84, train_loss: 0.5698, test_loss: 0.8517, test_f1: 0.6401
 epoch: 85, train_loss: 0.5631, test_loss: 0.8693, test_f1: 0.6331
 epoch: 86, train_loss: 0.5641, test_loss: 0.8819, test_f1: 0.6330
 epoch: 87, train_loss: 0.5594, test_loss: 0.8386, test_f1: 0.6418
 epoch: 88, train_loss: 0.5470, test_loss: 0.8471, test_f1: 0.6434
 epoch: 89, train_loss: 0.5527, test_loss: 0.8567, test_f1: 0.6361
 epoch: 90, train_loss: 0.5425, test_loss: 0.8773, test_f1: 0.6386
 epoch: 91, train_loss: 0.5519, test_loss: 0.8789, test_f1: 0.6467
 epoch: 92, train_loss: 0.5464, test_loss: 0.8703, test_f1: 0.6310
 epoch: 93, train_loss: 0.5460, test_loss: 0.8797, test_f1: 0.6384
 epoch: 94, train_loss: 0.5435, test_loss: 0.8855, test_f1: 0.6531
 epoch: 95, train_loss: 0.5410, test_loss: 0.8906, test_f1: 0.6409
 epoch: 96, train_loss: 0.5454, test_loss: 0.8869, test_f1: 0.6363
 epoch: 97, train_loss: 0.5460, test_loss: 0.8896, test_f1: 0.6388
 epoch: 98, train_loss: 0.5343, test_loss: 0.9072, test_f1: 0.6459
 epoch: 99, train_loss: 0.5389, test_loss: 0.9167, test_f1: 0.6176
##################ITERATION #5 ****************************************
 epoch: 0, train_loss: 1.2106, test_loss: 1.3093, test_f1: 0.2270
 epoch: 1, train_loss: 1.0858, test_loss: 1.2767, test_f1: 0.2396
 epoch: 2, train_loss: 1.0460, test_loss: 1.1920, test_f1: 0.3071
 epoch: 3, train_loss: 1.0208, test_loss: 1.0656, test_f1: 0.4611
 epoch: 4, train_loss: 0.9964, test_loss: 0.9976, test_f1: 0.4903
 epoch: 5, train_loss: 0.9856, test_loss: 0.9772, test_f1: 0.5240
 epoch: 6, train_loss: 0.9660, test_loss: 0.9647, test_f1: 0.5331
 epoch: 7, train_loss: 0.9578, test_loss: 0.9495, test_f1: 0.5410
 epoch: 8, train_loss: 0.9444, test_loss: 0.9456, test_f1: 0.5474
 epoch: 9, train_loss: 0.9346, test_loss: 0.9363, test_f1: 0.5215
 epoch: 10, train_loss: 0.9197, test_loss: 0.9312, test_f1: 0.5381
 epoch: 11, train_loss: 0.9128, test_loss: 0.9272, test_f1: 0.5359
 epoch: 12, train_loss: 0.9015, test_loss: 0.9143, test_f1: 0.5472
 epoch: 13, train_loss: 0.8959, test_loss: 0.9028, test_f1: 0.5403
 epoch: 14, train_loss: 0.8872, test_loss: 0.9009, test_f1: 0.5519
 epoch: 15, train_loss: 0.8757, test_loss: 0.8898, test_f1: 0.5555
 epoch: 16, train_loss: 0.8627, test_loss: 0.8857, test_f1: 0.5572
 epoch: 17, train_loss: 0.8613, test_loss: 0.8890, test_f1: 0.5527
 epoch: 18, train_loss: 0.8574, test_loss: 0.8894, test_f1: 0.5542
 epoch: 19, train_loss: 0.8385, test_loss: 0.8762, test_f1: 0.5574
 epoch: 20, train_loss: 0.8445, test_loss: 0.8778, test_f1: 0.5514
 epoch: 21, train_loss: 0.8323, test_loss: 0.8728, test_f1: 0.5616
 epoch: 22, train_loss: 0.8218, test_loss: 0.8681, test_f1: 0.5536
 epoch: 23, train_loss: 0.8156, test_loss: 0.8530, test_f1: 0.5639
 epoch: 24, train_loss: 0.8020, test_loss: 0.8580, test_f1: 0.5593
 epoch: 25, train_loss: 0.7987, test_loss: 0.8670, test_f1: 0.5599
 epoch: 26, train_loss: 0.7856, test_loss: 0.8468, test_f1: 0.5669
 epoch: 27, train_loss: 0.7812, test_loss: 0.8489, test_f1: 0.5671
 epoch: 28, train_loss: 0.7837, test_loss: 0.8497, test_f1: 0.5576
 epoch: 29, train_loss: 0.7738, test_loss: 0.8467, test_f1: 0.5735
 epoch: 30, train_loss: 0.7546, test_loss: 0.8515, test_f1: 0.5605
 epoch: 31, train_loss: 0.7558, test_loss: 0.8757, test_f1: 0.5608
 epoch: 32, train_loss: 0.7536, test_loss: 0.8332, test_f1: 0.5615
 epoch: 33, train_loss: 0.7415, test_loss: 0.8432, test_f1: 0.5768
 epoch: 34, train_loss: 0.7418, test_loss: 0.8378, test_f1: 0.5741
 epoch: 35, train_loss: 0.7369, test_loss: 0.8321, test_f1: 0.5680
 epoch: 36, train_loss: 0.7247, test_loss: 0.8299, test_f1: 0.5761
 epoch: 37, train_loss: 0.7224, test_loss: 0.8498, test_f1: 0.5721
 epoch: 38, train_loss: 0.7167, test_loss: 0.8428, test_f1: 0.5794
 epoch: 39, train_loss: 0.7113, test_loss: 0.8365, test_f1: 0.5810
 epoch: 40, train_loss: 0.7041, test_loss: 0.8409, test_f1: 0.5827
 epoch: 41, train_loss: 0.6948, test_loss: 0.8276, test_f1: 0.6042
 epoch: 42, train_loss: 0.6867, test_loss: 0.8386, test_f1: 0.6047
 epoch: 43, train_loss: 0.6846, test_loss: 0.8425, test_f1: 0.6138
 epoch: 44, train_loss: 0.6842, test_loss: 0.8442, test_f1: 0.6129
 epoch: 45, train_loss: 0.6760, test_loss: 0.8417, test_f1: 0.5934
 epoch: 46, train_loss: 0.6614, test_loss: 0.8392, test_f1: 0.6261
 epoch: 47, train_loss: 0.6591, test_loss: 0.8349, test_f1: 0.6146
 epoch: 48, train_loss: 0.6649, test_loss: 0.8349, test_f1: 0.6052
 epoch: 49, train_loss: 0.6661, test_loss: 0.8629, test_f1: 0.6249
 epoch: 50, train_loss: 0.6411, test_loss: 0.8740, test_f1: 0.6150
 epoch: 51, train_loss: 0.6490, test_loss: 0.8776, test_f1: 0.6150
 epoch: 52, train_loss: 0.6281, test_loss: 0.8664, test_f1: 0.6318
 epoch: 53, train_loss: 0.6312, test_loss: 0.8656, test_f1: 0.6095
 epoch: 54, train_loss: 0.6303, test_loss: 0.8750, test_f1: 0.6196
 epoch: 55, train_loss: 0.6192, test_loss: 0.8879, test_f1: 0.6373
 epoch: 56, train_loss: 0.6175, test_loss: 0.8808, test_f1: 0.6141
 epoch: 57, train_loss: 0.6224, test_loss: 0.8776, test_f1: 0.6305
 epoch: 58, train_loss: 0.6132, test_loss: 0.8834, test_f1: 0.6195
 epoch: 59, train_loss: 0.6034, test_loss: 0.8836, test_f1: 0.6251
 epoch: 60, train_loss: 0.6173, test_loss: 0.8854, test_f1: 0.6360
 epoch: 61, train_loss: 0.6100, test_loss: 0.8961, test_f1: 0.6055
 epoch: 62, train_loss: 0.6015, test_loss: 0.8918, test_f1: 0.6311
 epoch: 63, train_loss: 0.6064, test_loss: 0.9014, test_f1: 0.6366
 epoch: 64, train_loss: 0.6003, test_loss: 0.8820, test_f1: 0.6369
 epoch: 65, train_loss: 0.5922, test_loss: 0.9294, test_f1: 0.6343
 epoch: 66, train_loss: 0.5956, test_loss: 0.9078, test_f1: 0.6457
 epoch: 67, train_loss: 0.5939, test_loss: 0.9138, test_f1: 0.6351
 epoch: 68, train_loss: 0.5988, test_loss: 0.9051, test_f1: 0.6402
 epoch: 69, train_loss: 0.5825, test_loss: 0.9158, test_f1: 0.6404
 epoch: 70, train_loss: 0.5879, test_loss: 0.9144, test_f1: 0.6311
 epoch: 71, train_loss: 0.5830, test_loss: 0.9152, test_f1: 0.6369
 epoch: 72, train_loss: 0.5828, test_loss: 0.9304, test_f1: 0.6407
 epoch: 73, train_loss: 0.5791, test_loss: 0.9246, test_f1: 0.6481
 epoch: 74, train_loss: 0.5739, test_loss: 0.9384, test_f1: 0.6556
 epoch: 75, train_loss: 0.5678, test_loss: 0.9362, test_f1: 0.6378
 epoch: 76, train_loss: 0.5793, test_loss: 0.9401, test_f1: 0.6357
 epoch: 77, train_loss: 0.5707, test_loss: 0.9299, test_f1: 0.6347
 epoch: 78, train_loss: 0.5639, test_loss: 0.9301, test_f1: 0.6447
 epoch: 79, train_loss: 0.5673, test_loss: 0.9443, test_f1: 0.6426
 epoch: 80, train_loss: 0.5601, test_loss: 0.9536, test_f1: 0.6322
 epoch: 81, train_loss: 0.5591, test_loss: 0.9537, test_f1: 0.6368
 epoch: 82, train_loss: 0.5641, test_loss: 0.9546, test_f1: 0.6501
 epoch: 83, train_loss: 0.5527, test_loss: 0.9444, test_f1: 0.6482
 epoch: 84, train_loss: 0.5506, test_loss: 0.9513, test_f1: 0.6351
 epoch: 85, train_loss: 0.5491, test_loss: 0.9646, test_f1: 0.6236
 epoch: 86, train_loss: 0.5577, test_loss: 0.9577, test_f1: 0.6394
 epoch: 87, train_loss: 0.5584, test_loss: 0.9516, test_f1: 0.6476
 epoch: 88, train_loss: 0.5474, test_loss: 0.9888, test_f1: 0.6270
 epoch: 89, train_loss: 0.5488, test_loss: 0.9616, test_f1: 0.6393
 epoch: 90, train_loss: 0.5440, test_loss: 0.9789, test_f1: 0.6311
 epoch: 91, train_loss: 0.5329, test_loss: 0.9735, test_f1: 0.6443
 epoch: 92, train_loss: 0.5331, test_loss: 0.9830, test_f1: 0.6432
 epoch: 93, train_loss: 0.5413, test_loss: 0.9843, test_f1: 0.6453
 epoch: 94, train_loss: 0.5354, test_loss: 0.9718, test_f1: 0.6277
 epoch: 95, train_loss: 0.5365, test_loss: 0.9804, test_f1: 0.6477
 epoch: 96, train_loss: 0.5344, test_loss: 0.9782, test_f1: 0.6502
 epoch: 97, train_loss: 0.5247, test_loss: 0.9848, test_f1: 0.6456
 epoch: 98, train_loss: 0.5336, test_loss: 0.9785, test_f1: 0.6305
 epoch: 99, train_loss: 0.5313, test_loss: 0.9970, test_f1: 0.6315
##################ITERATION #6 ****************************************
 epoch: 0, train_loss: 1.2671, test_loss: 1.3239, test_f1: 0.2270
 epoch: 1, train_loss: 1.1092, test_loss: 1.3410, test_f1: 0.2270
 epoch: 2, train_loss: 1.0547, test_loss: 1.3254, test_f1: 0.2270
 epoch: 3, train_loss: 1.0268, test_loss: 1.1993, test_f1: 0.2353
 epoch: 4, train_loss: 0.9989, test_loss: 1.0708, test_f1: 0.4112
 epoch: 5, train_loss: 0.9867, test_loss: 0.9927, test_f1: 0.4779
 epoch: 6, train_loss: 0.9667, test_loss: 0.9673, test_f1: 0.5120
 epoch: 7, train_loss: 0.9664, test_loss: 0.9585, test_f1: 0.5174
 epoch: 8, train_loss: 0.9477, test_loss: 0.9521, test_f1: 0.5226
 epoch: 9, train_loss: 0.9384, test_loss: 0.9463, test_f1: 0.5191
 epoch: 10, train_loss: 0.9360, test_loss: 0.9331, test_f1: 0.5296
 epoch: 11, train_loss: 0.9164, test_loss: 0.9286, test_f1: 0.5348
 epoch: 12, train_loss: 0.9070, test_loss: 0.9149, test_f1: 0.5246
 epoch: 13, train_loss: 0.8990, test_loss: 0.9087, test_f1: 0.5265
 epoch: 14, train_loss: 0.8944, test_loss: 0.9036, test_f1: 0.5310
 epoch: 15, train_loss: 0.8771, test_loss: 0.8966, test_f1: 0.5302
 epoch: 16, train_loss: 0.8721, test_loss: 0.8895, test_f1: 0.5409
 epoch: 17, train_loss: 0.8654, test_loss: 0.8857, test_f1: 0.5551
 epoch: 18, train_loss: 0.8529, test_loss: 0.8807, test_f1: 0.5506
 epoch: 19, train_loss: 0.8512, test_loss: 0.8714, test_f1: 0.5485
 epoch: 20, train_loss: 0.8415, test_loss: 0.8660, test_f1: 0.5579
 epoch: 21, train_loss: 0.8353, test_loss: 0.8556, test_f1: 0.5512
 epoch: 22, train_loss: 0.8247, test_loss: 0.8599, test_f1: 0.5623
 epoch: 23, train_loss: 0.8155, test_loss: 0.8563, test_f1: 0.5603
 epoch: 24, train_loss: 0.8080, test_loss: 0.8557, test_f1: 0.5583
 epoch: 25, train_loss: 0.8004, test_loss: 0.8357, test_f1: 0.5715
 epoch: 26, train_loss: 0.7975, test_loss: 0.8296, test_f1: 0.5724
 epoch: 27, train_loss: 0.7924, test_loss: 0.8255, test_f1: 0.5640
 epoch: 28, train_loss: 0.7836, test_loss: 0.8274, test_f1: 0.5515
 epoch: 29, train_loss: 0.7792, test_loss: 0.8269, test_f1: 0.5737
 epoch: 30, train_loss: 0.7751, test_loss: 0.8167, test_f1: 0.5792
 epoch: 31, train_loss: 0.7635, test_loss: 0.8208, test_f1: 0.5750
 epoch: 32, train_loss: 0.7627, test_loss: 0.8160, test_f1: 0.5711
 epoch: 33, train_loss: 0.7560, test_loss: 0.8094, test_f1: 0.5823
 epoch: 34, train_loss: 0.7474, test_loss: 0.8032, test_f1: 0.5856
 epoch: 35, train_loss: 0.7465, test_loss: 0.8183, test_f1: 0.5902
 epoch: 36, train_loss: 0.7389, test_loss: 0.8120, test_f1: 0.5920
 epoch: 37, train_loss: 0.7320, test_loss: 0.8159, test_f1: 0.5626
 epoch: 38, train_loss: 0.7289, test_loss: 0.8136, test_f1: 0.5984
 epoch: 39, train_loss: 0.7293, test_loss: 0.8237, test_f1: 0.6105
 epoch: 40, train_loss: 0.7240, test_loss: 0.8151, test_f1: 0.5780
 epoch: 41, train_loss: 0.7194, test_loss: 0.8251, test_f1: 0.6160
 epoch: 42, train_loss: 0.7185, test_loss: 0.8202, test_f1: 0.6204
 epoch: 43, train_loss: 0.7061, test_loss: 0.7995, test_f1: 0.5987
 epoch: 44, train_loss: 0.6989, test_loss: 0.8003, test_f1: 0.5781
 epoch: 45, train_loss: 0.7011, test_loss: 0.8138, test_f1: 0.5881
 epoch: 46, train_loss: 0.6867, test_loss: 0.8000, test_f1: 0.5850
 epoch: 47, train_loss: 0.6908, test_loss: 0.8151, test_f1: 0.6009
 epoch: 48, train_loss: 0.6767, test_loss: 0.8050, test_f1: 0.6067
 epoch: 49, train_loss: 0.6867, test_loss: 0.8054, test_f1: 0.5914
 epoch: 50, train_loss: 0.6715, test_loss: 0.8087, test_f1: 0.5827
 epoch: 51, train_loss: 0.6607, test_loss: 0.8271, test_f1: 0.6208
 epoch: 52, train_loss: 0.6558, test_loss: 0.8049, test_f1: 0.5901
 epoch: 53, train_loss: 0.6563, test_loss: 0.8099, test_f1: 0.6006
 epoch: 54, train_loss: 0.6643, test_loss: 0.8254, test_f1: 0.5974
 epoch: 55, train_loss: 0.6517, test_loss: 0.8015, test_f1: 0.6089
 epoch: 56, train_loss: 0.6471, test_loss: 0.8123, test_f1: 0.6021
 epoch: 57, train_loss: 0.6424, test_loss: 0.8157, test_f1: 0.5936
 epoch: 58, train_loss: 0.6465, test_loss: 0.8099, test_f1: 0.6160
 epoch: 59, train_loss: 0.6475, test_loss: 0.7971, test_f1: 0.5976
 epoch: 60, train_loss: 0.6460, test_loss: 0.8129, test_f1: 0.5953
 epoch: 61, train_loss: 0.6374, test_loss: 0.8141, test_f1: 0.6186
 epoch: 62, train_loss: 0.6443, test_loss: 0.8280, test_f1: 0.6083
 epoch: 63, train_loss: 0.6370, test_loss: 0.8206, test_f1: 0.6165
 epoch: 64, train_loss: 0.6281, test_loss: 0.8064, test_f1: 0.5961
 epoch: 65, train_loss: 0.6255, test_loss: 0.8148, test_f1: 0.6091
 epoch: 66, train_loss: 0.6282, test_loss: 0.8188, test_f1: 0.6119
 epoch: 67, train_loss: 0.6270, test_loss: 0.8185, test_f1: 0.6190
 epoch: 68, train_loss: 0.6200, test_loss: 0.8299, test_f1: 0.6149
 epoch: 69, train_loss: 0.6204, test_loss: 0.8392, test_f1: 0.6156
 epoch: 70, train_loss: 0.6248, test_loss: 0.8277, test_f1: 0.6178
 epoch: 71, train_loss: 0.6233, test_loss: 0.8306, test_f1: 0.6140
 epoch: 72, train_loss: 0.6219, test_loss: 0.8454, test_f1: 0.6127
 epoch: 73, train_loss: 0.6133, test_loss: 0.8383, test_f1: 0.6165
 epoch: 74, train_loss: 0.6113, test_loss: 0.8467, test_f1: 0.6336
 epoch: 75, train_loss: 0.6145, test_loss: 0.8520, test_f1: 0.6302
 epoch: 76, train_loss: 0.6093, test_loss: 0.8361, test_f1: 0.6261
 epoch: 77, train_loss: 0.6124, test_loss: 0.8693, test_f1: 0.6204
 epoch: 78, train_loss: 0.5962, test_loss: 0.8569, test_f1: 0.6254
 epoch: 79, train_loss: 0.6060, test_loss: 0.8595, test_f1: 0.6078
 epoch: 80, train_loss: 0.5977, test_loss: 0.8501, test_f1: 0.6297
 epoch: 81, train_loss: 0.6073, test_loss: 0.8522, test_f1: 0.6134
 epoch: 82, train_loss: 0.5975, test_loss: 0.8659, test_f1: 0.6224
 epoch: 83, train_loss: 0.5939, test_loss: 0.8462, test_f1: 0.6120
 epoch: 84, train_loss: 0.5888, test_loss: 0.8613, test_f1: 0.6231
 epoch: 85, train_loss: 0.5913, test_loss: 0.8862, test_f1: 0.6130
 epoch: 86, train_loss: 0.5851, test_loss: 0.8656, test_f1: 0.6323
 epoch: 87, train_loss: 0.5907, test_loss: 0.8682, test_f1: 0.6287
 epoch: 88, train_loss: 0.5888, test_loss: 0.8646, test_f1: 0.6103
 epoch: 89, train_loss: 0.5776, test_loss: 0.8636, test_f1: 0.6216
 epoch: 90, train_loss: 0.5739, test_loss: 0.8643, test_f1: 0.6305
 epoch: 91, train_loss: 0.5775, test_loss: 0.8846, test_f1: 0.6209
 epoch: 92, train_loss: 0.5693, test_loss: 0.8648, test_f1: 0.6251
 epoch: 93, train_loss: 0.5699, test_loss: 0.8688, test_f1: 0.6308
 epoch: 94, train_loss: 0.5838, test_loss: 0.8627, test_f1: 0.6349
 epoch: 95, train_loss: 0.5695, test_loss: 0.8623, test_f1: 0.6253
 epoch: 96, train_loss: 0.5629, test_loss: 0.8682, test_f1: 0.6210
 epoch: 97, train_loss: 0.5628, test_loss: 0.8904, test_f1: 0.6322
 epoch: 98, train_loss: 0.5685, test_loss: 0.8873, test_f1: 0.6300
 epoch: 99, train_loss: 0.5643, test_loss: 0.9120, test_f1: 0.6284
##################ITERATION #7 ****************************************
 epoch: 0, train_loss: 1.2114, test_loss: 1.3065, test_f1: 0.2270
 epoch: 1, train_loss: 1.0621, test_loss: 1.2824, test_f1: 0.2315
 epoch: 2, train_loss: 1.0319, test_loss: 1.2511, test_f1: 0.3335
 epoch: 3, train_loss: 0.9984, test_loss: 1.0829, test_f1: 0.4562
 epoch: 4, train_loss: 0.9911, test_loss: 1.0133, test_f1: 0.4703
 epoch: 5, train_loss: 0.9648, test_loss: 0.9945, test_f1: 0.4795
 epoch: 6, train_loss: 0.9512, test_loss: 0.9664, test_f1: 0.5086
 epoch: 7, train_loss: 0.9391, test_loss: 0.9356, test_f1: 0.5376
 epoch: 8, train_loss: 0.9287, test_loss: 0.9350, test_f1: 0.5393
 epoch: 9, train_loss: 0.9189, test_loss: 0.9204, test_f1: 0.5366
 epoch: 10, train_loss: 0.9121, test_loss: 0.9145, test_f1: 0.5413
 epoch: 11, train_loss: 0.9107, test_loss: 0.9161, test_f1: 0.5284
 epoch: 12, train_loss: 0.8959, test_loss: 0.9054, test_f1: 0.5518
 epoch: 13, train_loss: 0.8909, test_loss: 0.8986, test_f1: 0.5538
 epoch: 14, train_loss: 0.8765, test_loss: 0.9039, test_f1: 0.5505
 epoch: 15, train_loss: 0.8712, test_loss: 0.8803, test_f1: 0.5608
 epoch: 16, train_loss: 0.8543, test_loss: 0.8905, test_f1: 0.5512
 epoch: 17, train_loss: 0.8415, test_loss: 0.8847, test_f1: 0.5538
 epoch: 18, train_loss: 0.8512, test_loss: 0.8832, test_f1: 0.5405
 epoch: 19, train_loss: 0.8433, test_loss: 0.8851, test_f1: 0.5463
 epoch: 20, train_loss: 0.8293, test_loss: 0.8922, test_f1: 0.5488
 epoch: 21, train_loss: 0.8191, test_loss: 0.8717, test_f1: 0.5392
 epoch: 22, train_loss: 0.8206, test_loss: 0.8790, test_f1: 0.5549
 epoch: 23, train_loss: 0.8096, test_loss: 0.8706, test_f1: 0.5492
 epoch: 24, train_loss: 0.8069, test_loss: 0.8738, test_f1: 0.5561
 epoch: 25, train_loss: 0.7900, test_loss: 0.8542, test_f1: 0.5416
 epoch: 26, train_loss: 0.7862, test_loss: 0.8693, test_f1: 0.5377
 epoch: 27, train_loss: 0.7875, test_loss: 0.8577, test_f1: 0.5521
 epoch: 28, train_loss: 0.7732, test_loss: 0.8652, test_f1: 0.5524
 epoch: 29, train_loss: 0.7762, test_loss: 0.8753, test_f1: 0.5464
 epoch: 30, train_loss: 0.7788, test_loss: 0.8559, test_f1: 0.5629
 epoch: 31, train_loss: 0.7581, test_loss: 0.8521, test_f1: 0.5534
 epoch: 32, train_loss: 0.7640, test_loss: 0.8538, test_f1: 0.5558
 epoch: 33, train_loss: 0.7486, test_loss: 0.8353, test_f1: 0.5617
 epoch: 34, train_loss: 0.7474, test_loss: 0.8714, test_f1: 0.5556
 epoch: 35, train_loss: 0.7425, test_loss: 0.8117, test_f1: 0.5567
 epoch: 36, train_loss: 0.7295, test_loss: 0.8384, test_f1: 0.5711
 epoch: 37, train_loss: 0.7235, test_loss: 0.8380, test_f1: 0.5727
 epoch: 38, train_loss: 0.7253, test_loss: 0.8174, test_f1: 0.5803
 epoch: 39, train_loss: 0.7190, test_loss: 0.8514, test_f1: 0.5683
 epoch: 40, train_loss: 0.7193, test_loss: 0.8343, test_f1: 0.5951
 epoch: 41, train_loss: 0.7064, test_loss: 0.8173, test_f1: 0.5883
 epoch: 42, train_loss: 0.6955, test_loss: 0.8413, test_f1: 0.5855
 epoch: 43, train_loss: 0.6897, test_loss: 0.8161, test_f1: 0.5780
 epoch: 44, train_loss: 0.6903, test_loss: 0.8112, test_f1: 0.5733
 epoch: 45, train_loss: 0.6888, test_loss: 0.8438, test_f1: 0.5723
 epoch: 46, train_loss: 0.6855, test_loss: 0.8283, test_f1: 0.5849
 epoch: 47, train_loss: 0.6805, test_loss: 0.8046, test_f1: 0.5817
 epoch: 48, train_loss: 0.6755, test_loss: 0.8214, test_f1: 0.5997
 epoch: 49, train_loss: 0.6729, test_loss: 0.8098, test_f1: 0.6035
 epoch: 50, train_loss: 0.6691, test_loss: 0.8138, test_f1: 0.5903
 epoch: 51, train_loss: 0.6595, test_loss: 0.8144, test_f1: 0.5979
 epoch: 52, train_loss: 0.6568, test_loss: 0.8111, test_f1: 0.5856
 epoch: 53, train_loss: 0.6538, test_loss: 0.8121, test_f1: 0.5927
 epoch: 54, train_loss: 0.6518, test_loss: 0.8246, test_f1: 0.5804
 epoch: 55, train_loss: 0.6443, test_loss: 0.8073, test_f1: 0.5949
 epoch: 56, train_loss: 0.6485, test_loss: 0.8022, test_f1: 0.5959
 epoch: 57, train_loss: 0.6430, test_loss: 0.8137, test_f1: 0.5928
 epoch: 58, train_loss: 0.6372, test_loss: 0.8183, test_f1: 0.5938
 epoch: 59, train_loss: 0.6406, test_loss: 0.8144, test_f1: 0.5874
 epoch: 60, train_loss: 0.6450, test_loss: 0.8189, test_f1: 0.5898
 epoch: 61, train_loss: 0.6410, test_loss: 0.8179, test_f1: 0.5940
 epoch: 62, train_loss: 0.6332, test_loss: 0.8192, test_f1: 0.5876
 epoch: 63, train_loss: 0.6357, test_loss: 0.8331, test_f1: 0.5875
 epoch: 64, train_loss: 0.6287, test_loss: 0.8274, test_f1: 0.5902
 epoch: 65, train_loss: 0.6246, test_loss: 0.8167, test_f1: 0.6045
 epoch: 66, train_loss: 0.6224, test_loss: 0.8062, test_f1: 0.6110
 epoch: 67, train_loss: 0.6223, test_loss: 0.8093, test_f1: 0.6122
 epoch: 68, train_loss: 0.6280, test_loss: 0.8328, test_f1: 0.6022
 epoch: 69, train_loss: 0.6163, test_loss: 0.8281, test_f1: 0.6032
 epoch: 70, train_loss: 0.6087, test_loss: 0.8310, test_f1: 0.5892
 epoch: 71, train_loss: 0.6041, test_loss: 0.8422, test_f1: 0.5981
 epoch: 72, train_loss: 0.6130, test_loss: 0.8096, test_f1: 0.6132
 epoch: 73, train_loss: 0.6149, test_loss: 0.8336, test_f1: 0.6176
 epoch: 74, train_loss: 0.6006, test_loss: 0.8261, test_f1: 0.6257
 epoch: 75, train_loss: 0.6118, test_loss: 0.8427, test_f1: 0.6070
 epoch: 76, train_loss: 0.6027, test_loss: 0.8481, test_f1: 0.6148
 epoch: 77, train_loss: 0.5972, test_loss: 0.8590, test_f1: 0.6164
 epoch: 78, train_loss: 0.5955, test_loss: 0.8353, test_f1: 0.5964
 epoch: 79, train_loss: 0.5975, test_loss: 0.8436, test_f1: 0.6031
 epoch: 80, train_loss: 0.5936, test_loss: 0.8495, test_f1: 0.6184
 epoch: 81, train_loss: 0.5965, test_loss: 0.8471, test_f1: 0.6243
 epoch: 82, train_loss: 0.5845, test_loss: 0.8470, test_f1: 0.6203
 epoch: 83, train_loss: 0.5849, test_loss: 0.8391, test_f1: 0.6241
 epoch: 84, train_loss: 0.5914, test_loss: 0.8457, test_f1: 0.6377
 epoch: 85, train_loss: 0.5800, test_loss: 0.8753, test_f1: 0.6155
 epoch: 86, train_loss: 0.5740, test_loss: 0.8305, test_f1: 0.6319
 epoch: 87, train_loss: 0.5862, test_loss: 0.8471, test_f1: 0.6423
 epoch: 88, train_loss: 0.5764, test_loss: 0.8376, test_f1: 0.6405
 epoch: 89, train_loss: 0.5750, test_loss: 0.8779, test_f1: 0.6180
 epoch: 90, train_loss: 0.5748, test_loss: 0.8366, test_f1: 0.6300
 epoch: 91, train_loss: 0.5789, test_loss: 0.8711, test_f1: 0.6308
 epoch: 92, train_loss: 0.5695, test_loss: 0.8610, test_f1: 0.6295
 epoch: 93, train_loss: 0.5701, test_loss: 0.8299, test_f1: 0.6299
 epoch: 94, train_loss: 0.5737, test_loss: 0.8597, test_f1: 0.6339
 epoch: 95, train_loss: 0.5620, test_loss: 0.8752, test_f1: 0.6335
 epoch: 96, train_loss: 0.5654, test_loss: 0.8699, test_f1: 0.6300
 epoch: 97, train_loss: 0.5728, test_loss: 0.8697, test_f1: 0.6497
 epoch: 98, train_loss: 0.5560, test_loss: 0.8590, test_f1: 0.6360
 epoch: 99, train_loss: 0.5498, test_loss: 0.9049, test_f1: 0.6299
##################ITERATION #8 ****************************************
 epoch: 0, train_loss: 1.2500, test_loss: 1.2970, test_f1: 0.2270
 epoch: 1, train_loss: 1.0871, test_loss: 1.2650, test_f1: 0.2270
 epoch: 2, train_loss: 1.0381, test_loss: 1.2046, test_f1: 0.2270
 epoch: 3, train_loss: 1.0153, test_loss: 1.1370, test_f1: 0.3032
 epoch: 4, train_loss: 0.9924, test_loss: 1.0301, test_f1: 0.4370
 epoch: 5, train_loss: 0.9765, test_loss: 0.9774, test_f1: 0.4890
 epoch: 6, train_loss: 0.9568, test_loss: 0.9630, test_f1: 0.5186
 epoch: 7, train_loss: 0.9417, test_loss: 0.9555, test_f1: 0.5141
 epoch: 8, train_loss: 0.9431, test_loss: 0.9430, test_f1: 0.5129
 epoch: 9, train_loss: 0.9222, test_loss: 0.9481, test_f1: 0.5123
 epoch: 10, train_loss: 0.9073, test_loss: 0.9336, test_f1: 0.5226
 epoch: 11, train_loss: 0.9013, test_loss: 0.9222, test_f1: 0.5097
 epoch: 12, train_loss: 0.9006, test_loss: 0.9188, test_f1: 0.5183
 epoch: 13, train_loss: 0.8901, test_loss: 0.9131, test_f1: 0.5323
 epoch: 14, train_loss: 0.8715, test_loss: 0.9087, test_f1: 0.5207
 epoch: 15, train_loss: 0.8679, test_loss: 0.9046, test_f1: 0.5375
 epoch: 16, train_loss: 0.8596, test_loss: 0.8915, test_f1: 0.5443
 epoch: 17, train_loss: 0.8532, test_loss: 0.8866, test_f1: 0.5407
 epoch: 18, train_loss: 0.8503, test_loss: 0.8734, test_f1: 0.5517
 epoch: 19, train_loss: 0.8352, test_loss: 0.8697, test_f1: 0.5560
 epoch: 20, train_loss: 0.8249, test_loss: 0.8674, test_f1: 0.5493
 epoch: 21, train_loss: 0.8183, test_loss: 0.8583, test_f1: 0.5583
 epoch: 22, train_loss: 0.8195, test_loss: 0.8591, test_f1: 0.5520
 epoch: 23, train_loss: 0.8114, test_loss: 0.8532, test_f1: 0.5572
 epoch: 24, train_loss: 0.7958, test_loss: 0.8548, test_f1: 0.5600
 epoch: 25, train_loss: 0.7879, test_loss: 0.8455, test_f1: 0.5638
 epoch: 26, train_loss: 0.7779, test_loss: 0.8484, test_f1: 0.5636
 epoch: 27, train_loss: 0.7773, test_loss: 0.8622, test_f1: 0.5531
 epoch: 28, train_loss: 0.7721, test_loss: 0.8370, test_f1: 0.5653
 epoch: 29, train_loss: 0.7691, test_loss: 0.8364, test_f1: 0.5811
 epoch: 30, train_loss: 0.7540, test_loss: 0.8376, test_f1: 0.5650
 epoch: 31, train_loss: 0.7687, test_loss: 0.8441, test_f1: 0.5902
 epoch: 32, train_loss: 0.7440, test_loss: 0.8272, test_f1: 0.5627
 epoch: 33, train_loss: 0.7533, test_loss: 0.8274, test_f1: 0.5619
 epoch: 34, train_loss: 0.7462, test_loss: 0.8244, test_f1: 0.5768
 epoch: 35, train_loss: 0.7354, test_loss: 0.8253, test_f1: 0.5809
 epoch: 36, train_loss: 0.7388, test_loss: 0.8144, test_f1: 0.5742
 epoch: 37, train_loss: 0.7281, test_loss: 0.8305, test_f1: 0.5806
 epoch: 38, train_loss: 0.7264, test_loss: 0.8139, test_f1: 0.5814
 epoch: 39, train_loss: 0.7086, test_loss: 0.8272, test_f1: 0.5794
 epoch: 40, train_loss: 0.7076, test_loss: 0.8091, test_f1: 0.5778
 epoch: 41, train_loss: 0.6995, test_loss: 0.8004, test_f1: 0.5876
 epoch: 42, train_loss: 0.7017, test_loss: 0.7859, test_f1: 0.5931
 epoch: 43, train_loss: 0.6993, test_loss: 0.8179, test_f1: 0.5694
 epoch: 44, train_loss: 0.6834, test_loss: 0.7944, test_f1: 0.5865
 epoch: 45, train_loss: 0.6850, test_loss: 0.7991, test_f1: 0.5851
 epoch: 46, train_loss: 0.6762, test_loss: 0.7802, test_f1: 0.5959
 epoch: 47, train_loss: 0.6718, test_loss: 0.7847, test_f1: 0.5856
 epoch: 48, train_loss: 0.6719, test_loss: 0.8112, test_f1: 0.5877
 epoch: 49, train_loss: 0.6653, test_loss: 0.8179, test_f1: 0.5810
 epoch: 50, train_loss: 0.6680, test_loss: 0.7915, test_f1: 0.6018
 epoch: 51, train_loss: 0.6583, test_loss: 0.8008, test_f1: 0.6121
 epoch: 52, train_loss: 0.6567, test_loss: 0.8043, test_f1: 0.5987
 epoch: 53, train_loss: 0.6514, test_loss: 0.8072, test_f1: 0.5871
 epoch: 54, train_loss: 0.6545, test_loss: 0.7919, test_f1: 0.6043
 epoch: 55, train_loss: 0.6430, test_loss: 0.8036, test_f1: 0.5974
 epoch: 56, train_loss: 0.6527, test_loss: 0.8014, test_f1: 0.6097
 epoch: 57, train_loss: 0.6375, test_loss: 0.8055, test_f1: 0.5934
 epoch: 58, train_loss: 0.6444, test_loss: 0.7936, test_f1: 0.5919
 epoch: 59, train_loss: 0.6347, test_loss: 0.8008, test_f1: 0.6037
 epoch: 60, train_loss: 0.6323, test_loss: 0.8068, test_f1: 0.6162
 epoch: 61, train_loss: 0.6338, test_loss: 0.7833, test_f1: 0.6246
 epoch: 62, train_loss: 0.6369, test_loss: 0.7942, test_f1: 0.6344
 epoch: 63, train_loss: 0.6300, test_loss: 0.8166, test_f1: 0.6098
 epoch: 64, train_loss: 0.6232, test_loss: 0.8120, test_f1: 0.6194
 epoch: 65, train_loss: 0.6102, test_loss: 0.7903, test_f1: 0.6317
 epoch: 66, train_loss: 0.6248, test_loss: 0.7942, test_f1: 0.6447
 epoch: 67, train_loss: 0.6126, test_loss: 0.8085, test_f1: 0.6074
 epoch: 68, train_loss: 0.6148, test_loss: 0.8159, test_f1: 0.5953
 epoch: 69, train_loss: 0.6050, test_loss: 0.8089, test_f1: 0.6268
 epoch: 70, train_loss: 0.6197, test_loss: 0.8012, test_f1: 0.6267
 epoch: 71, train_loss: 0.6103, test_loss: 0.8031, test_f1: 0.6526
 epoch: 72, train_loss: 0.5978, test_loss: 0.8165, test_f1: 0.6224
 epoch: 73, train_loss: 0.5996, test_loss: 0.7930, test_f1: 0.6313
 epoch: 74, train_loss: 0.5904, test_loss: 0.8145, test_f1: 0.6321
 epoch: 75, train_loss: 0.6049, test_loss: 0.8231, test_f1: 0.6249
 epoch: 76, train_loss: 0.5898, test_loss: 0.8291, test_f1: 0.6507
 epoch: 77, train_loss: 0.5912, test_loss: 0.8188, test_f1: 0.6481
 epoch: 78, train_loss: 0.5900, test_loss: 0.8228, test_f1: 0.6607
 epoch: 79, train_loss: 0.5911, test_loss: 0.8357, test_f1: 0.6462
 epoch: 80, train_loss: 0.5814, test_loss: 0.8167, test_f1: 0.6463
 epoch: 81, train_loss: 0.5709, test_loss: 0.8352, test_f1: 0.6690
 epoch: 82, train_loss: 0.5705, test_loss: 0.8145, test_f1: 0.6501
 epoch: 83, train_loss: 0.5726, test_loss: 0.8488, test_f1: 0.6365
 epoch: 84, train_loss: 0.5897, test_loss: 0.8423, test_f1: 0.6452
 epoch: 85, train_loss: 0.5712, test_loss: 0.8192, test_f1: 0.6536
 epoch: 86, train_loss: 0.5765, test_loss: 0.8342, test_f1: 0.6396
 epoch: 87, train_loss: 0.5765, test_loss: 0.8379, test_f1: 0.6371
 epoch: 88, train_loss: 0.5718, test_loss: 0.8363, test_f1: 0.6359
 epoch: 89, train_loss: 0.5671, test_loss: 0.8414, test_f1: 0.6277
 epoch: 90, train_loss: 0.5628, test_loss: 0.8358, test_f1: 0.6496
 epoch: 91, train_loss: 0.5580, test_loss: 0.8315, test_f1: 0.6449
 epoch: 92, train_loss: 0.5709, test_loss: 0.8608, test_f1: 0.6422
 epoch: 93, train_loss: 0.5576, test_loss: 0.8589, test_f1: 0.6331
 epoch: 94, train_loss: 0.5603, test_loss: 0.8391, test_f1: 0.6417
 epoch: 95, train_loss: 0.5446, test_loss: 0.8490, test_f1: 0.6142
 epoch: 96, train_loss: 0.5524, test_loss: 0.8511, test_f1: 0.6456
 epoch: 97, train_loss: 0.5476, test_loss: 0.8793, test_f1: 0.6412
 epoch: 98, train_loss: 0.5527, test_loss: 0.8360, test_f1: 0.6358
 epoch: 99, train_loss: 0.5387, test_loss: 0.8604, test_f1: 0.6265
##################ITERATION #9 ****************************************
 epoch: 0, train_loss: 1.2648, test_loss: 1.2907, test_f1: 0.2270
 epoch: 1, train_loss: 1.0850, test_loss: 1.2468, test_f1: 0.2270
 epoch: 2, train_loss: 1.0600, test_loss: 1.1701, test_f1: 0.2969
 epoch: 3, train_loss: 1.0239, test_loss: 1.0584, test_f1: 0.4799
 epoch: 4, train_loss: 0.9874, test_loss: 0.9956, test_f1: 0.5128
 epoch: 5, train_loss: 0.9849, test_loss: 0.9651, test_f1: 0.5205
 epoch: 6, train_loss: 0.9740, test_loss: 0.9398, test_f1: 0.5351
 epoch: 7, train_loss: 0.9441, test_loss: 0.9230, test_f1: 0.5235
 epoch: 8, train_loss: 0.9368, test_loss: 0.9124, test_f1: 0.5324
 epoch: 9, train_loss: 0.9261, test_loss: 0.8959, test_f1: 0.5379
 epoch: 10, train_loss: 0.9087, test_loss: 0.8947, test_f1: 0.5282
 epoch: 11, train_loss: 0.9077, test_loss: 0.8905, test_f1: 0.5282
 epoch: 12, train_loss: 0.9034, test_loss: 0.8788, test_f1: 0.5335
 epoch: 13, train_loss: 0.8839, test_loss: 0.8798, test_f1: 0.5460
 epoch: 14, train_loss: 0.8715, test_loss: 0.8672, test_f1: 0.5488
 epoch: 15, train_loss: 0.8597, test_loss: 0.8624, test_f1: 0.5389
 epoch: 16, train_loss: 0.8551, test_loss: 0.8450, test_f1: 0.5502
 epoch: 17, train_loss: 0.8502, test_loss: 0.8548, test_f1: 0.5455
 epoch: 18, train_loss: 0.8384, test_loss: 0.8548, test_f1: 0.5444
 epoch: 19, train_loss: 0.8293, test_loss: 0.8548, test_f1: 0.5466
 epoch: 20, train_loss: 0.8267, test_loss: 0.8380, test_f1: 0.5644
 epoch: 21, train_loss: 0.8160, test_loss: 0.8352, test_f1: 0.5476
 epoch: 22, train_loss: 0.8129, test_loss: 0.8372, test_f1: 0.5658
 epoch: 23, train_loss: 0.8043, test_loss: 0.8373, test_f1: 0.5590
 epoch: 24, train_loss: 0.8013, test_loss: 0.8363, test_f1: 0.5731
 epoch: 25, train_loss: 0.7891, test_loss: 0.8277, test_f1: 0.5684
 epoch: 26, train_loss: 0.7786, test_loss: 0.8322, test_f1: 0.5582
 epoch: 27, train_loss: 0.7741, test_loss: 0.8205, test_f1: 0.5728
 epoch: 28, train_loss: 0.7703, test_loss: 0.8230, test_f1: 0.5654
 epoch: 29, train_loss: 0.7505, test_loss: 0.8323, test_f1: 0.5564
 epoch: 30, train_loss: 0.7557, test_loss: 0.8179, test_f1: 0.5710
 epoch: 31, train_loss: 0.7413, test_loss: 0.8321, test_f1: 0.5795
 epoch: 32, train_loss: 0.7522, test_loss: 0.8276, test_f1: 0.5851
 epoch: 33, train_loss: 0.7334, test_loss: 0.8222, test_f1: 0.5781
 epoch: 34, train_loss: 0.7216, test_loss: 0.8393, test_f1: 0.5823
 epoch: 35, train_loss: 0.7344, test_loss: 0.8089, test_f1: 0.5954
 epoch: 36, train_loss: 0.7226, test_loss: 0.8482, test_f1: 0.5963
 epoch: 37, train_loss: 0.7204, test_loss: 0.8214, test_f1: 0.5840
 epoch: 38, train_loss: 0.7084, test_loss: 0.8395, test_f1: 0.6048
 epoch: 39, train_loss: 0.7202, test_loss: 0.8002, test_f1: 0.5945
 epoch: 40, train_loss: 0.6996, test_loss: 0.8297, test_f1: 0.5834
 epoch: 41, train_loss: 0.7056, test_loss: 0.8365, test_f1: 0.5803
 epoch: 42, train_loss: 0.6867, test_loss: 0.8216, test_f1: 0.6246
 epoch: 43, train_loss: 0.6865, test_loss: 0.8328, test_f1: 0.6213
 epoch: 44, train_loss: 0.6774, test_loss: 0.8383, test_f1: 0.6057
 epoch: 45, train_loss: 0.6787, test_loss: 0.8611, test_f1: 0.6088
 epoch: 46, train_loss: 0.6712, test_loss: 0.8392, test_f1: 0.6193
 epoch: 47, train_loss: 0.6652, test_loss: 0.8243, test_f1: 0.6180
 epoch: 48, train_loss: 0.6609, test_loss: 0.8469, test_f1: 0.6219
 epoch: 49, train_loss: 0.6609, test_loss: 0.8554, test_f1: 0.6235
 epoch: 50, train_loss: 0.6529, test_loss: 0.8657, test_f1: 0.6286
 epoch: 51, train_loss: 0.6400, test_loss: 0.8372, test_f1: 0.6242
 epoch: 52, train_loss: 0.6388, test_loss: 0.8496, test_f1: 0.6262
 epoch: 53, train_loss: 0.6330, test_loss: 0.8451, test_f1: 0.6159
 epoch: 54, train_loss: 0.6304, test_loss: 0.8580, test_f1: 0.6212
 epoch: 55, train_loss: 0.6344, test_loss: 0.8320, test_f1: 0.6278
 epoch: 56, train_loss: 0.6240, test_loss: 0.8624, test_f1: 0.6163
 epoch: 57, train_loss: 0.6309, test_loss: 0.8556, test_f1: 0.6153
 epoch: 58, train_loss: 0.6288, test_loss: 0.8716, test_f1: 0.6190
 epoch: 59, train_loss: 0.6172, test_loss: 0.8563, test_f1: 0.6266
 epoch: 60, train_loss: 0.6172, test_loss: 0.8843, test_f1: 0.6078
 epoch: 61, train_loss: 0.6235, test_loss: 0.8682, test_f1: 0.6225
 epoch: 62, train_loss: 0.6197, test_loss: 0.8578, test_f1: 0.6273
 epoch: 63, train_loss: 0.6216, test_loss: 0.8732, test_f1: 0.6227
 epoch: 64, train_loss: 0.6064, test_loss: 0.8957, test_f1: 0.6143
 epoch: 65, train_loss: 0.6041, test_loss: 0.8807, test_f1: 0.6097
 epoch: 66, train_loss: 0.6017, test_loss: 0.8656, test_f1: 0.6283
 epoch: 67, train_loss: 0.5964, test_loss: 0.8848, test_f1: 0.6122
 epoch: 68, train_loss: 0.5927, test_loss: 0.8676, test_f1: 0.6323
 epoch: 69, train_loss: 0.5965, test_loss: 0.8884, test_f1: 0.6249
 epoch: 70, train_loss: 0.5890, test_loss: 0.8815, test_f1: 0.6263
 epoch: 71, train_loss: 0.5835, test_loss: 0.9140, test_f1: 0.6161
 epoch: 72, train_loss: 0.5959, test_loss: 0.8961, test_f1: 0.6294
 epoch: 73, train_loss: 0.5985, test_loss: 0.9275, test_f1: 0.6225
 epoch: 74, train_loss: 0.5979, test_loss: 0.9057, test_f1: 0.6157
 epoch: 75, train_loss: 0.5846, test_loss: 0.9113, test_f1: 0.6194
 epoch: 76, train_loss: 0.5752, test_loss: 0.9185, test_f1: 0.6154
 epoch: 77, train_loss: 0.5851, test_loss: 0.9054, test_f1: 0.6333
 epoch: 78, train_loss: 0.5801, test_loss: 0.9184, test_f1: 0.6340
 epoch: 79, train_loss: 0.5774, test_loss: 0.9121, test_f1: 0.6131
 epoch: 80, train_loss: 0.5740, test_loss: 0.9230, test_f1: 0.6254
 epoch: 81, train_loss: 0.5717, test_loss: 0.9091, test_f1: 0.6187
 epoch: 82, train_loss: 0.5752, test_loss: 0.9124, test_f1: 0.6170
 epoch: 83, train_loss: 0.5709, test_loss: 0.9328, test_f1: 0.6197
 epoch: 84, train_loss: 0.5787, test_loss: 0.9378, test_f1: 0.6176
 epoch: 85, train_loss: 0.5744, test_loss: 0.9021, test_f1: 0.6262
 epoch: 86, train_loss: 0.5644, test_loss: 0.8974, test_f1: 0.6335
 epoch: 87, train_loss: 0.5605, test_loss: 0.9810, test_f1: 0.5978
 epoch: 88, train_loss: 0.5715, test_loss: 0.9253, test_f1: 0.6234
 epoch: 89, train_loss: 0.5572, test_loss: 0.9206, test_f1: 0.6291
 epoch: 90, train_loss: 0.5527, test_loss: 0.9515, test_f1: 0.6201
 epoch: 91, train_loss: 0.5509, test_loss: 0.9409, test_f1: 0.6206
 epoch: 92, train_loss: 0.5587, test_loss: 0.9400, test_f1: 0.6249
 epoch: 93, train_loss: 0.5548, test_loss: 0.9512, test_f1: 0.6217
 epoch: 94, train_loss: 0.5512, test_loss: 0.9585, test_f1: 0.6213
 epoch: 95, train_loss: 0.5506, test_loss: 0.9443, test_f1: 0.6216
 epoch: 96, train_loss: 0.5497, test_loss: 0.9410, test_f1: 0.6206
 epoch: 97, train_loss: 0.5449, test_loss: 0.9582, test_f1: 0.6217
 epoch: 98, train_loss: 0.5441, test_loss: 0.9758, test_f1: 0.6263
 epoch: 99, train_loss: 0.5383, test_loss: 0.9872, test_f1: 0.6154

Training completed in 462.53 seconds
Best F1: 0.6690 at epoch 81
Mean F1 across iterations: 0.6331  0.0251
========================FINAL RESULTS================================
FEGIN weighted F1: 0.6690  0.0251
python main.py --data ltspice_examples --representation component_pin_net --model FEGIN --layers 3 --hiddens 128 --batch_size 256 --lr 0.0001 --emb_size 128 --epochs 100 --save_appendix component_pin_net_L3_H128_BS256_LR0.0001_E128 --no_val
-----



STDERR:
  File "main.py", line 370, in <module>
    main()
  File "main.py", line 254, in main
    dataset = dataset_class(
  File "/home/philip/projects/ltspice_examples_code_repo/Circuit-Completion-Using-GNNs/component_classification_with_link_prediction_head/evaluation/FEGIN/kernel/circuit_datasets.py", line 15, in __init__
    self.data, self.slices = torch.load(self.processed_paths[0])
  File "/home/philip/.local/lib/python3.8/site-packages/torch/serialization.py", line 1040, in load
    warnings.warn(
  File "/usr/lib/python3.8/warnings.py", line 109, in _showwarnmsg
    sw(msg.message, msg.category, msg.filename, msg.lineno,
  File "main.py", line 47, in warn_with_traceback
    traceback.print_stack(file=log)
/home/philip/projects/ltspice_examples_code_repo/Circuit-Completion-Using-GNNs/component_classification_with_link_prediction_head/evaluation/FEGIN/kernel/circuit_datasets.py:15: FutureWarning: You are using `torch.load` with `weights_only=False` (the current default value), which uses the default pickle module implicitly. It is possible to construct malicious pickle data which will execute arbitrary code during unpickling (See https://github.com/pytorch/pytorch/blob/main/SECURITY.md#untrusted-models for more details). In a future release, the default value for `weights_only` will be flipped to `True`. This limits the functions that could be executed during unpickling. Arbitrary objects will no longer be allowed to be loaded via this mode unless they are explicitly allowlisted by the user via `torch.serialization.add_safe_globals`. We recommend you start setting `weights_only=True` for any use case where you don't have full control of the loaded file. Please open an issue on GitHub for any issues related to this experimental feature.
  self.data, self.slices = torch.load(self.processed_paths[0])
