STDOUT:
Results will be saved in /home/philip/projects/ltspice_examples_code_repo/Circuit-Completion-Using-GNNs/component_classification_with_link_prediction_head/evaluation/FEGIN/results/model_FEGIN_dataset_ltspice_demos
Command line input: python main.py --data ltspice_demos --representation component_component --model FEGIN --layers 3 --hiddens 16 --batch_size 256 --lr 0.001 --emb_size 128 --epochs 100 --save_appendix component_component_L3_H16_BS256_LR0.001_E128 --no_val
 is saved.
-----
ltspice_demos - FEGIN
Using 3 layers, 16 hidden units, h = 2
Loading component_component representation dataset
ENTERED
Training FEGIN on component_component representation
Train: 1565, Test: 383
##################ITERATION #0 ****************************************
 epoch: 0, train_loss: 1.3337, test_loss: 1.3419, test_f1: 0.1836
 epoch: 1, train_loss: 1.3196, test_loss: 1.3360, test_f1: 0.3195
 epoch: 2, train_loss: 1.3084, test_loss: 1.3301, test_f1: 0.2586
 epoch: 3, train_loss: 1.2987, test_loss: 1.3231, test_f1: 0.2289
 epoch: 4, train_loss: 1.2896, test_loss: 1.3153, test_f1: 0.2289
 epoch: 5, train_loss: 1.2808, test_loss: 1.3083, test_f1: 0.2289
 epoch: 6, train_loss: 1.2703, test_loss: 1.3025, test_f1: 0.2289
 epoch: 7, train_loss: 1.2625, test_loss: 1.2987, test_f1: 0.2285
 epoch: 8, train_loss: 1.2572, test_loss: 1.2955, test_f1: 0.2285
 epoch: 9, train_loss: 1.2454, test_loss: 1.2909, test_f1: 0.2285
 epoch: 10, train_loss: 1.2447, test_loss: 1.2877, test_f1: 0.2289
 epoch: 11, train_loss: 1.2384, test_loss: 1.2871, test_f1: 0.2293
 epoch: 12, train_loss: 1.2283, test_loss: 1.2863, test_f1: 0.2293
 epoch: 13, train_loss: 1.2245, test_loss: 1.2842, test_f1: 0.2686
 epoch: 14, train_loss: 1.2187, test_loss: 1.2855, test_f1: 0.2713
 epoch: 15, train_loss: 1.2151, test_loss: 1.2814, test_f1: 0.2645
 epoch: 16, train_loss: 1.2033, test_loss: 1.2770, test_f1: 0.2643
 epoch: 17, train_loss: 1.2007, test_loss: 1.2794, test_f1: 0.2774
 epoch: 18, train_loss: 1.2002, test_loss: 1.2869, test_f1: 0.2795
 epoch: 19, train_loss: 1.1982, test_loss: 1.2944, test_f1: 0.2657
 epoch: 20, train_loss: 1.1903, test_loss: 1.2919, test_f1: 0.2822
 epoch: 21, train_loss: 1.1829, test_loss: 1.2763, test_f1: 0.2933
 epoch: 22, train_loss: 1.1848, test_loss: 1.2731, test_f1: 0.2871
 epoch: 23, train_loss: 1.1706, test_loss: 1.2779, test_f1: 0.2761
 epoch: 24, train_loss: 1.1727, test_loss: 1.2805, test_f1: 0.2701
 epoch: 25, train_loss: 1.1736, test_loss: 1.2886, test_f1: 0.2786
 epoch: 26, train_loss: 1.1664, test_loss: 1.2880, test_f1: 0.2711
 epoch: 27, train_loss: 1.1650, test_loss: 1.2852, test_f1: 0.2780
 epoch: 28, train_loss: 1.1497, test_loss: 1.2897, test_f1: 0.2858
 epoch: 29, train_loss: 1.1512, test_loss: 1.2953, test_f1: 0.2739
 epoch: 30, train_loss: 1.1398, test_loss: 1.2903, test_f1: 0.2841
 epoch: 31, train_loss: 1.1341, test_loss: 1.3070, test_f1: 0.2919
 epoch: 32, train_loss: 1.1327, test_loss: 1.3066, test_f1: 0.3073
 epoch: 33, train_loss: 1.1338, test_loss: 1.3079, test_f1: 0.3365
 epoch: 34, train_loss: 1.1297, test_loss: 1.3070, test_f1: 0.3918
 epoch: 35, train_loss: 1.1262, test_loss: 1.3140, test_f1: 0.3816
 epoch: 36, train_loss: 1.1179, test_loss: 1.3277, test_f1: 0.3707
 epoch: 37, train_loss: 1.1164, test_loss: 1.3277, test_f1: 0.3172
 epoch: 38, train_loss: 1.1120, test_loss: 1.3056, test_f1: 0.3885
 epoch: 39, train_loss: 1.0999, test_loss: 1.3075, test_f1: 0.4226
 epoch: 40, train_loss: 1.1020, test_loss: 1.3060, test_f1: 0.4105
 epoch: 41, train_loss: 1.0981, test_loss: 1.3221, test_f1: 0.3762
 epoch: 42, train_loss: 1.0954, test_loss: 1.3269, test_f1: 0.4045
 epoch: 43, train_loss: 1.0826, test_loss: 1.3616, test_f1: 0.3874
 epoch: 44, train_loss: 1.0829, test_loss: 1.3634, test_f1: 0.4205
 epoch: 45, train_loss: 1.0728, test_loss: 1.3461, test_f1: 0.4228
 epoch: 46, train_loss: 1.0798, test_loss: 1.3732, test_f1: 0.3123
 epoch: 47, train_loss: 1.0567, test_loss: 1.4228, test_f1: 0.3473
 epoch: 48, train_loss: 1.0670, test_loss: 1.4300, test_f1: 0.3467
 epoch: 49, train_loss: 1.0539, test_loss: 1.3971, test_f1: 0.3705
 epoch: 50, train_loss: 1.0530, test_loss: 1.3791, test_f1: 0.3272
 epoch: 51, train_loss: 1.0404, test_loss: 1.3676, test_f1: 0.3378
 epoch: 52, train_loss: 1.0419, test_loss: 1.3733, test_f1: 0.3734
 epoch: 53, train_loss: 1.0460, test_loss: 1.3364, test_f1: 0.3983
 epoch: 54, train_loss: 1.0439, test_loss: 1.3322, test_f1: 0.4075
 epoch: 55, train_loss: 1.0336, test_loss: 1.3221, test_f1: 0.4068
 epoch: 56, train_loss: 1.0406, test_loss: 1.3236, test_f1: 0.4050
 epoch: 57, train_loss: 1.0343, test_loss: 1.3332, test_f1: 0.4055
 epoch: 58, train_loss: 1.0358, test_loss: 1.3499, test_f1: 0.3876
 epoch: 59, train_loss: 1.0326, test_loss: 1.3474, test_f1: 0.4022
 epoch: 60, train_loss: 1.0307, test_loss: 1.3593, test_f1: 0.3898
 epoch: 61, train_loss: 1.0257, test_loss: 1.3366, test_f1: 0.3960
 epoch: 62, train_loss: 1.0231, test_loss: 1.3405, test_f1: 0.3851
 epoch: 63, train_loss: 1.0256, test_loss: 1.3577, test_f1: 0.3891
 epoch: 64, train_loss: 1.0183, test_loss: 1.3338, test_f1: 0.4052
 epoch: 65, train_loss: 1.0275, test_loss: 1.3209, test_f1: 0.3912
 epoch: 66, train_loss: 1.0166, test_loss: 1.3336, test_f1: 0.4128
 epoch: 67, train_loss: 1.0200, test_loss: 1.3595, test_f1: 0.4227
 epoch: 68, train_loss: 1.0207, test_loss: 1.3661, test_f1: 0.4119
 epoch: 69, train_loss: 1.0138, test_loss: 1.3654, test_f1: 0.4060
 epoch: 70, train_loss: 1.0087, test_loss: 1.3742, test_f1: 0.4017
 epoch: 71, train_loss: 1.0029, test_loss: 1.3574, test_f1: 0.4186
 epoch: 72, train_loss: 1.0157, test_loss: 1.3508, test_f1: 0.4198
 epoch: 73, train_loss: 1.0044, test_loss: 1.3194, test_f1: 0.4120
 epoch: 74, train_loss: 0.9954, test_loss: 1.3176, test_f1: 0.4171
 epoch: 75, train_loss: 0.9989, test_loss: 1.3172, test_f1: 0.4224
 epoch: 76, train_loss: 0.9951, test_loss: 1.3208, test_f1: 0.4203
 epoch: 77, train_loss: 1.0041, test_loss: 1.3317, test_f1: 0.3994
 epoch: 78, train_loss: 1.0083, test_loss: 1.3435, test_f1: 0.4112
 epoch: 79, train_loss: 0.9928, test_loss: 1.3452, test_f1: 0.4268
 epoch: 80, train_loss: 1.0137, test_loss: 1.3459, test_f1: 0.4234
 epoch: 81, train_loss: 1.0014, test_loss: 1.3677, test_f1: 0.4055
 epoch: 82, train_loss: 0.9916, test_loss: 1.3342, test_f1: 0.4083
 epoch: 83, train_loss: 1.0027, test_loss: 1.3329, test_f1: 0.4150
 epoch: 84, train_loss: 0.9961, test_loss: 1.3485, test_f1: 0.4096
 epoch: 85, train_loss: 0.9953, test_loss: 1.3471, test_f1: 0.4311
 epoch: 86, train_loss: 0.9919, test_loss: 1.3612, test_f1: 0.4291
 epoch: 87, train_loss: 0.9954, test_loss: 1.3509, test_f1: 0.4373
 epoch: 88, train_loss: 0.9813, test_loss: 1.3436, test_f1: 0.4379
 epoch: 89, train_loss: 0.9820, test_loss: 1.3508, test_f1: 0.4236
 epoch: 90, train_loss: 0.9855, test_loss: 1.3567, test_f1: 0.4236
 epoch: 91, train_loss: 0.9823, test_loss: 1.3446, test_f1: 0.4298
 epoch: 92, train_loss: 0.9731, test_loss: 1.3310, test_f1: 0.4120
 epoch: 93, train_loss: 0.9829, test_loss: 1.3428, test_f1: 0.4052
 epoch: 94, train_loss: 0.9862, test_loss: 1.3385, test_f1: 0.4319
 epoch: 95, train_loss: 0.9781, test_loss: 1.3512, test_f1: 0.4220
 epoch: 96, train_loss: 0.9851, test_loss: 1.3677, test_f1: 0.4213
 epoch: 97, train_loss: 0.9718, test_loss: 1.3692, test_f1: 0.4187
 epoch: 98, train_loss: 0.9741, test_loss: 1.3642, test_f1: 0.4085
 epoch: 99, train_loss: 0.9764, test_loss: 1.3465, test_f1: 0.4337
##################ITERATION #1 ****************************************
 epoch: 0, train_loss: 1.3140, test_loss: 1.3289, test_f1: 0.2820
 epoch: 1, train_loss: 1.2782, test_loss: 1.3205, test_f1: 0.2281
 epoch: 2, train_loss: 1.2657, test_loss: 1.3110, test_f1: 0.2281
 epoch: 3, train_loss: 1.2501, test_loss: 1.3022, test_f1: 0.2281
 epoch: 4, train_loss: 1.2426, test_loss: 1.2899, test_f1: 0.2289
 epoch: 5, train_loss: 1.2304, test_loss: 1.2800, test_f1: 0.2293
 epoch: 6, train_loss: 1.2195, test_loss: 1.2756, test_f1: 0.2293
 epoch: 7, train_loss: 1.2140, test_loss: 1.2696, test_f1: 0.2289
 epoch: 8, train_loss: 1.2051, test_loss: 1.2642, test_f1: 0.2289
 epoch: 9, train_loss: 1.2028, test_loss: 1.2589, test_f1: 0.2285
 epoch: 10, train_loss: 1.1911, test_loss: 1.2563, test_f1: 0.2285
 epoch: 11, train_loss: 1.1838, test_loss: 1.2504, test_f1: 0.2399
 epoch: 12, train_loss: 1.1749, test_loss: 1.2459, test_f1: 0.3136
 epoch: 13, train_loss: 1.1639, test_loss: 1.2447, test_f1: 0.3031
 epoch: 14, train_loss: 1.1557, test_loss: 1.2425, test_f1: 0.3484
 epoch: 15, train_loss: 1.1469, test_loss: 1.2343, test_f1: 0.3808
 epoch: 16, train_loss: 1.1403, test_loss: 1.2334, test_f1: 0.4009
 epoch: 17, train_loss: 1.1393, test_loss: 1.2288, test_f1: 0.4129
 epoch: 18, train_loss: 1.1200, test_loss: 1.2237, test_f1: 0.4099
 epoch: 19, train_loss: 1.1139, test_loss: 1.2190, test_f1: 0.4331
 epoch: 20, train_loss: 1.1142, test_loss: 1.2219, test_f1: 0.4232
 epoch: 21, train_loss: 1.1122, test_loss: 1.2229, test_f1: 0.4178
 epoch: 22, train_loss: 1.0994, test_loss: 1.2207, test_f1: 0.4254
 epoch: 23, train_loss: 1.0868, test_loss: 1.2031, test_f1: 0.4265
 epoch: 24, train_loss: 1.0932, test_loss: 1.1859, test_f1: 0.4320
 epoch: 25, train_loss: 1.0787, test_loss: 1.1942, test_f1: 0.4349
 epoch: 26, train_loss: 1.0758, test_loss: 1.1833, test_f1: 0.4463
 epoch: 27, train_loss: 1.0771, test_loss: 1.1909, test_f1: 0.4294
 epoch: 28, train_loss: 1.0585, test_loss: 1.2085, test_f1: 0.4250
 epoch: 29, train_loss: 1.0613, test_loss: 1.1863, test_f1: 0.4639
 epoch: 30, train_loss: 1.0640, test_loss: 1.1866, test_f1: 0.4517
 epoch: 31, train_loss: 1.0451, test_loss: 1.2116, test_f1: 0.4537
 epoch: 32, train_loss: 1.0587, test_loss: 1.1880, test_f1: 0.4300
 epoch: 33, train_loss: 1.0423, test_loss: 1.1903, test_f1: 0.4400
 epoch: 34, train_loss: 1.0450, test_loss: 1.1912, test_f1: 0.4303
 epoch: 35, train_loss: 1.0489, test_loss: 1.1850, test_f1: 0.4350
 epoch: 36, train_loss: 1.0536, test_loss: 1.2044, test_f1: 0.4578
 epoch: 37, train_loss: 1.0402, test_loss: 1.2031, test_f1: 0.4213
 epoch: 38, train_loss: 1.0299, test_loss: 1.2047, test_f1: 0.4312
 epoch: 39, train_loss: 1.0317, test_loss: 1.1960, test_f1: 0.4388
 epoch: 40, train_loss: 1.0202, test_loss: 1.1869, test_f1: 0.4499
 epoch: 41, train_loss: 1.0271, test_loss: 1.1884, test_f1: 0.4463
 epoch: 42, train_loss: 1.0088, test_loss: 1.2015, test_f1: 0.4374
 epoch: 43, train_loss: 1.0038, test_loss: 1.2130, test_f1: 0.4352
 epoch: 44, train_loss: 1.0155, test_loss: 1.2159, test_f1: 0.4150
 epoch: 45, train_loss: 1.0014, test_loss: 1.2243, test_f1: 0.4148
 epoch: 46, train_loss: 1.0031, test_loss: 1.2168, test_f1: 0.4248
 epoch: 47, train_loss: 0.9841, test_loss: 1.2162, test_f1: 0.4376
 epoch: 48, train_loss: 1.0072, test_loss: 1.2233, test_f1: 0.4269
 epoch: 49, train_loss: 0.9911, test_loss: 1.2320, test_f1: 0.4424
 epoch: 50, train_loss: 0.9932, test_loss: 1.2378, test_f1: 0.4492
 epoch: 51, train_loss: 0.9688, test_loss: 1.2432, test_f1: 0.4295
 epoch: 52, train_loss: 0.9895, test_loss: 1.2450, test_f1: 0.4394
 epoch: 53, train_loss: 0.9892, test_loss: 1.2520, test_f1: 0.4273
 epoch: 54, train_loss: 0.9878, test_loss: 1.2459, test_f1: 0.4342
 epoch: 55, train_loss: 0.9834, test_loss: 1.2505, test_f1: 0.4420
 epoch: 56, train_loss: 0.9762, test_loss: 1.2537, test_f1: 0.4369
 epoch: 57, train_loss: 0.9787, test_loss: 1.2620, test_f1: 0.4321
 epoch: 58, train_loss: 0.9765, test_loss: 1.2678, test_f1: 0.4153
 epoch: 59, train_loss: 0.9775, test_loss: 1.2588, test_f1: 0.4178
 epoch: 60, train_loss: 0.9750, test_loss: 1.2554, test_f1: 0.4277
 epoch: 61, train_loss: 0.9710, test_loss: 1.2560, test_f1: 0.4424
 epoch: 62, train_loss: 0.9725, test_loss: 1.2658, test_f1: 0.4250
 epoch: 63, train_loss: 0.9696, test_loss: 1.2738, test_f1: 0.4226
 epoch: 64, train_loss: 0.9618, test_loss: 1.2777, test_f1: 0.4420
 epoch: 65, train_loss: 0.9600, test_loss: 1.2751, test_f1: 0.4396
 epoch: 66, train_loss: 0.9636, test_loss: 1.2774, test_f1: 0.4419
 epoch: 67, train_loss: 0.9586, test_loss: 1.2886, test_f1: 0.4199
 epoch: 68, train_loss: 0.9635, test_loss: 1.2939, test_f1: 0.4176
 epoch: 69, train_loss: 0.9709, test_loss: 1.2848, test_f1: 0.4223
 epoch: 70, train_loss: 0.9729, test_loss: 1.2825, test_f1: 0.4372
 epoch: 71, train_loss: 0.9694, test_loss: 1.2823, test_f1: 0.4273
 epoch: 72, train_loss: 0.9619, test_loss: 1.2823, test_f1: 0.4153
 epoch: 73, train_loss: 0.9568, test_loss: 1.2952, test_f1: 0.4274
 epoch: 74, train_loss: 0.9690, test_loss: 1.2884, test_f1: 0.4254
 epoch: 75, train_loss: 0.9650, test_loss: 1.2881, test_f1: 0.4229
 epoch: 76, train_loss: 0.9545, test_loss: 1.2761, test_f1: 0.4395
 epoch: 77, train_loss: 0.9431, test_loss: 1.2954, test_f1: 0.4417
 epoch: 78, train_loss: 0.9624, test_loss: 1.3026, test_f1: 0.4227
 epoch: 79, train_loss: 0.9592, test_loss: 1.3111, test_f1: 0.4207
 epoch: 80, train_loss: 0.9564, test_loss: 1.3075, test_f1: 0.4331
 epoch: 81, train_loss: 0.9389, test_loss: 1.3057, test_f1: 0.4352
 epoch: 82, train_loss: 0.9451, test_loss: 1.3059, test_f1: 0.4412
 epoch: 83, train_loss: 0.9559, test_loss: 1.3220, test_f1: 0.4202
 epoch: 84, train_loss: 0.9527, test_loss: 1.3253, test_f1: 0.4177
 epoch: 85, train_loss: 0.9497, test_loss: 1.3236, test_f1: 0.4199
 epoch: 86, train_loss: 0.9461, test_loss: 1.3144, test_f1: 0.4250
 epoch: 87, train_loss: 0.9416, test_loss: 1.3022, test_f1: 0.4296
 epoch: 88, train_loss: 0.9509, test_loss: 1.2997, test_f1: 0.4368
 epoch: 89, train_loss: 0.9376, test_loss: 1.3191, test_f1: 0.4330
 epoch: 90, train_loss: 0.9361, test_loss: 1.3212, test_f1: 0.4328
 epoch: 91, train_loss: 0.9491, test_loss: 1.3277, test_f1: 0.4373
 epoch: 92, train_loss: 0.9326, test_loss: 1.3354, test_f1: 0.4232
 epoch: 93, train_loss: 0.9458, test_loss: 1.3270, test_f1: 0.4469
 epoch: 94, train_loss: 0.9437, test_loss: 1.3239, test_f1: 0.4395
 epoch: 95, train_loss: 0.9364, test_loss: 1.3259, test_f1: 0.4343
 epoch: 96, train_loss: 0.9257, test_loss: 1.3369, test_f1: 0.4324
 epoch: 97, train_loss: 0.9282, test_loss: 1.3513, test_f1: 0.4323
 epoch: 98, train_loss: 0.9385, test_loss: 1.3481, test_f1: 0.4298
 epoch: 99, train_loss: 0.9277, test_loss: 1.3431, test_f1: 0.4133
##################ITERATION #2 ****************************************
 epoch: 0, train_loss: 1.2849, test_loss: 1.3164, test_f1: 0.2289
 epoch: 1, train_loss: 1.2565, test_loss: 1.3085, test_f1: 0.2350
 epoch: 2, train_loss: 1.2419, test_loss: 1.3000, test_f1: 0.2490
 epoch: 3, train_loss: 1.2289, test_loss: 1.2877, test_f1: 0.2534
 epoch: 4, train_loss: 1.2240, test_loss: 1.2764, test_f1: 0.2548
 epoch: 5, train_loss: 1.2205, test_loss: 1.2650, test_f1: 0.3289
 epoch: 6, train_loss: 1.2063, test_loss: 1.2593, test_f1: 0.3547
 epoch: 7, train_loss: 1.2006, test_loss: 1.2526, test_f1: 0.3591
 epoch: 8, train_loss: 1.1899, test_loss: 1.2471, test_f1: 0.3734
 epoch: 9, train_loss: 1.1874, test_loss: 1.2390, test_f1: 0.3625
 epoch: 10, train_loss: 1.1819, test_loss: 1.2308, test_f1: 0.3995
 epoch: 11, train_loss: 1.1716, test_loss: 1.2272, test_f1: 0.4235
 epoch: 12, train_loss: 1.1621, test_loss: 1.2231, test_f1: 0.4319
 epoch: 13, train_loss: 1.1576, test_loss: 1.2211, test_f1: 0.4340
 epoch: 14, train_loss: 1.1491, test_loss: 1.2203, test_f1: 0.4229
 epoch: 15, train_loss: 1.1390, test_loss: 1.2020, test_f1: 0.4411
 epoch: 16, train_loss: 1.1420, test_loss: 1.1932, test_f1: 0.4482
 epoch: 17, train_loss: 1.1369, test_loss: 1.2031, test_f1: 0.4479
 epoch: 18, train_loss: 1.1299, test_loss: 1.2095, test_f1: 0.4473
 epoch: 19, train_loss: 1.1386, test_loss: 1.2123, test_f1: 0.4383
 epoch: 20, train_loss: 1.1253, test_loss: 1.2103, test_f1: 0.4486
 epoch: 21, train_loss: 1.1101, test_loss: 1.2088, test_f1: 0.4682
 epoch: 22, train_loss: 1.1237, test_loss: 1.2046, test_f1: 0.4512
 epoch: 23, train_loss: 1.1194, test_loss: 1.1933, test_f1: 0.4686
 epoch: 24, train_loss: 1.1187, test_loss: 1.2018, test_f1: 0.4471
 epoch: 25, train_loss: 1.1008, test_loss: 1.2088, test_f1: 0.4165
 epoch: 26, train_loss: 1.1014, test_loss: 1.2018, test_f1: 0.4349
 epoch: 27, train_loss: 1.1034, test_loss: 1.1868, test_f1: 0.4167
 epoch: 28, train_loss: 1.0996, test_loss: 1.2048, test_f1: 0.3642
 epoch: 29, train_loss: 1.0812, test_loss: 1.2167, test_f1: 0.3531
 epoch: 30, train_loss: 1.0952, test_loss: 1.2018, test_f1: 0.3218
 epoch: 31, train_loss: 1.0842, test_loss: 1.1959, test_f1: 0.3663
 epoch: 32, train_loss: 1.0826, test_loss: 1.2075, test_f1: 0.3848
 epoch: 33, train_loss: 1.0775, test_loss: 1.2027, test_f1: 0.4297
 epoch: 34, train_loss: 1.0702, test_loss: 1.1986, test_f1: 0.4583
 epoch: 35, train_loss: 1.0695, test_loss: 1.2241, test_f1: 0.4331
 epoch: 36, train_loss: 1.0712, test_loss: 1.2389, test_f1: 0.4199
 epoch: 37, train_loss: 1.0783, test_loss: 1.2334, test_f1: 0.4536
 epoch: 38, train_loss: 1.0721, test_loss: 1.2129, test_f1: 0.4421
 epoch: 39, train_loss: 1.0616, test_loss: 1.2006, test_f1: 0.4357
 epoch: 40, train_loss: 1.0682, test_loss: 1.6017, test_f1: 0.3604
 epoch: 41, train_loss: 1.0541, test_loss: 2.0410, test_f1: 0.3644
 epoch: 42, train_loss: 1.0467, test_loss: 1.7758, test_f1: 0.3279
 epoch: 43, train_loss: 1.0633, test_loss: 1.4127, test_f1: 0.3810
 epoch: 44, train_loss: 1.0509, test_loss: 1.2592, test_f1: 0.4053
 epoch: 45, train_loss: 1.0629, test_loss: 1.2216, test_f1: 0.3736
 epoch: 46, train_loss: 1.0656, test_loss: 1.2303, test_f1: 0.3567
 epoch: 47, train_loss: 1.0506, test_loss: 1.2383, test_f1: 0.3521
 epoch: 48, train_loss: 1.0541, test_loss: 1.6387, test_f1: 0.3677
 epoch: 49, train_loss: 1.0585, test_loss: 1.4040, test_f1: 0.4240
 epoch: 50, train_loss: 1.0451, test_loss: 1.2449, test_f1: 0.4220
 epoch: 51, train_loss: 1.0478, test_loss: 1.2949, test_f1: 0.4234
 epoch: 52, train_loss: 1.0418, test_loss: 1.5008, test_f1: 0.3847
 epoch: 53, train_loss: 1.0486, test_loss: 1.5940, test_f1: 0.4010
 epoch: 54, train_loss: 1.0470, test_loss: 1.5296, test_f1: 0.4216
 epoch: 55, train_loss: 1.0383, test_loss: 1.4392, test_f1: 0.3938
 epoch: 56, train_loss: 1.0377, test_loss: 1.2810, test_f1: 0.4035
 epoch: 57, train_loss: 1.0325, test_loss: 1.2731, test_f1: 0.4101
 epoch: 58, train_loss: 1.0255, test_loss: 1.2789, test_f1: 0.4090
 epoch: 59, train_loss: 1.0397, test_loss: 1.2871, test_f1: 0.4144
 epoch: 60, train_loss: 1.0271, test_loss: 1.3021, test_f1: 0.4208
 epoch: 61, train_loss: 1.0344, test_loss: 1.2853, test_f1: 0.4114
 epoch: 62, train_loss: 1.0268, test_loss: 1.2548, test_f1: 0.4367
 epoch: 63, train_loss: 1.0289, test_loss: 1.3269, test_f1: 0.4127
 epoch: 64, train_loss: 1.0366, test_loss: 1.3064, test_f1: 0.4086
 epoch: 65, train_loss: 1.0216, test_loss: 1.3143, test_f1: 0.4077
 epoch: 66, train_loss: 1.0342, test_loss: 1.2816, test_f1: 0.4246
 epoch: 67, train_loss: 1.0294, test_loss: 1.4098, test_f1: 0.4171
 epoch: 68, train_loss: 1.0249, test_loss: 1.6063, test_f1: 0.4116
 epoch: 69, train_loss: 1.0308, test_loss: 1.4513, test_f1: 0.3888
 epoch: 70, train_loss: 1.0202, test_loss: 1.3372, test_f1: 0.4148
 epoch: 71, train_loss: 1.0157, test_loss: 1.3069, test_f1: 0.4131
 epoch: 72, train_loss: 1.0204, test_loss: 1.2873, test_f1: 0.4191
 epoch: 73, train_loss: 1.0203, test_loss: 1.2626, test_f1: 0.4279
 epoch: 74, train_loss: 1.0205, test_loss: 1.2546, test_f1: 0.4275
 epoch: 75, train_loss: 1.0179, test_loss: 1.2843, test_f1: 0.4174
 epoch: 76, train_loss: 1.0214, test_loss: 1.3020, test_f1: 0.4247
 epoch: 77, train_loss: 1.0234, test_loss: 1.4070, test_f1: 0.4359
 epoch: 78, train_loss: 1.0169, test_loss: 1.3955, test_f1: 0.4391
 epoch: 79, train_loss: 1.0282, test_loss: 1.3775, test_f1: 0.4315
 epoch: 80, train_loss: 1.0072, test_loss: 1.3546, test_f1: 0.4234
 epoch: 81, train_loss: 1.0156, test_loss: 1.3292, test_f1: 0.4305
 epoch: 82, train_loss: 1.0138, test_loss: 1.2815, test_f1: 0.4318
 epoch: 83, train_loss: 1.0112, test_loss: 1.3091, test_f1: 0.4323
 epoch: 84, train_loss: 1.0092, test_loss: 1.3038, test_f1: 0.4254
 epoch: 85, train_loss: 1.0154, test_loss: 1.3176, test_f1: 0.4154
 epoch: 86, train_loss: 1.0029, test_loss: 1.3658, test_f1: 0.4118
 epoch: 87, train_loss: 1.0160, test_loss: 1.3341, test_f1: 0.4109
 epoch: 88, train_loss: 1.0318, test_loss: 1.3247, test_f1: 0.4027
 epoch: 89, train_loss: 1.0216, test_loss: 1.3345, test_f1: 0.4034
 epoch: 90, train_loss: 1.0086, test_loss: 1.3115, test_f1: 0.4028
 epoch: 91, train_loss: 1.0154, test_loss: 1.3172, test_f1: 0.3910
 epoch: 92, train_loss: 1.0079, test_loss: 1.4165, test_f1: 0.3895
 epoch: 93, train_loss: 1.0184, test_loss: 1.4011, test_f1: 0.3911
 epoch: 94, train_loss: 1.0091, test_loss: 1.3374, test_f1: 0.3798
 epoch: 95, train_loss: 1.0214, test_loss: 1.3160, test_f1: 0.3797
 epoch: 96, train_loss: 1.0132, test_loss: 1.2725, test_f1: 0.3876
 epoch: 97, train_loss: 1.0132, test_loss: 1.3832, test_f1: 0.3810
 epoch: 98, train_loss: 1.0054, test_loss: 1.4516, test_f1: 0.3848
 epoch: 99, train_loss: 1.0083, test_loss: 1.4508, test_f1: 0.3985
##################ITERATION #3 ****************************************
 epoch: 0, train_loss: 1.2632, test_loss: 1.3323, test_f1: 0.2281
 epoch: 1, train_loss: 1.2212, test_loss: 1.3234, test_f1: 0.2281
 epoch: 2, train_loss: 1.1954, test_loss: 1.3064, test_f1: 0.2281
 epoch: 3, train_loss: 1.1987, test_loss: 1.2879, test_f1: 0.2281
 epoch: 4, train_loss: 1.1783, test_loss: 1.2674, test_f1: 0.2281
 epoch: 5, train_loss: 1.1694, test_loss: 1.2497, test_f1: 0.2698
 epoch: 6, train_loss: 1.1658, test_loss: 1.2290, test_f1: 0.3221
 epoch: 7, train_loss: 1.1545, test_loss: 1.2211, test_f1: 0.4329
 epoch: 8, train_loss: 1.1392, test_loss: 1.2139, test_f1: 0.4343
 epoch: 9, train_loss: 1.1458, test_loss: 1.2083, test_f1: 0.4269
 epoch: 10, train_loss: 1.1440, test_loss: 1.2027, test_f1: 0.4290
 epoch: 11, train_loss: 1.1197, test_loss: 1.2069, test_f1: 0.4299
 epoch: 12, train_loss: 1.1260, test_loss: 1.2003, test_f1: 0.4352
 epoch: 13, train_loss: 1.1215, test_loss: 1.1849, test_f1: 0.4267
 epoch: 14, train_loss: 1.1037, test_loss: 1.1807, test_f1: 0.4271
 epoch: 15, train_loss: 1.1132, test_loss: 1.1738, test_f1: 0.4254
 epoch: 16, train_loss: 1.1095, test_loss: 1.1710, test_f1: 0.4452
 epoch: 17, train_loss: 1.1033, test_loss: 1.1724, test_f1: 0.4459
 epoch: 18, train_loss: 1.1006, test_loss: 1.1682, test_f1: 0.4504
 epoch: 19, train_loss: 1.0972, test_loss: 1.1618, test_f1: 0.4793
 epoch: 20, train_loss: 1.0921, test_loss: 1.1524, test_f1: 0.4704
 epoch: 21, train_loss: 1.0946, test_loss: 1.1519, test_f1: 0.4607
 epoch: 22, train_loss: 1.0885, test_loss: 1.1521, test_f1: 0.4610
 epoch: 23, train_loss: 1.0798, test_loss: 1.1487, test_f1: 0.4599
 epoch: 24, train_loss: 1.0778, test_loss: 1.1429, test_f1: 0.4899
 epoch: 25, train_loss: 1.0649, test_loss: 1.1401, test_f1: 0.4893
 epoch: 26, train_loss: 1.0646, test_loss: 1.1426, test_f1: 0.4774
 epoch: 27, train_loss: 1.0572, test_loss: 1.1333, test_f1: 0.4745
 epoch: 28, train_loss: 1.0554, test_loss: 1.1302, test_f1: 0.4648
 epoch: 29, train_loss: 1.0483, test_loss: 1.1309, test_f1: 0.4701
 epoch: 30, train_loss: 1.0391, test_loss: 1.1365, test_f1: 0.4806
 epoch: 31, train_loss: 1.0536, test_loss: 1.1333, test_f1: 0.4792
 epoch: 32, train_loss: 1.0391, test_loss: 1.1320, test_f1: 0.4750
 epoch: 33, train_loss: 1.0399, test_loss: 1.1373, test_f1: 0.4853
 epoch: 34, train_loss: 1.0412, test_loss: 1.1340, test_f1: 0.4838
 epoch: 35, train_loss: 1.0501, test_loss: 1.1361, test_f1: 0.4810
 epoch: 36, train_loss: 1.0377, test_loss: 1.1434, test_f1: 0.4911
 epoch: 37, train_loss: 1.0310, test_loss: 1.1435, test_f1: 0.4843
 epoch: 38, train_loss: 1.0447, test_loss: 1.1457, test_f1: 0.4766
 epoch: 39, train_loss: 1.0253, test_loss: 1.1531, test_f1: 0.4815
 epoch: 40, train_loss: 1.0203, test_loss: 1.1444, test_f1: 0.4977
 epoch: 41, train_loss: 1.0269, test_loss: 1.1383, test_f1: 0.4981
 epoch: 42, train_loss: 1.0201, test_loss: 1.1401, test_f1: 0.4955
 epoch: 43, train_loss: 1.0250, test_loss: 1.1407, test_f1: 0.4905
 epoch: 44, train_loss: 1.0247, test_loss: 1.1332, test_f1: 0.4942
 epoch: 45, train_loss: 1.0169, test_loss: 1.1307, test_f1: 0.4839
 epoch: 46, train_loss: 1.0127, test_loss: 1.1333, test_f1: 0.4982
 epoch: 47, train_loss: 0.9976, test_loss: 1.1405, test_f1: 0.4882
 epoch: 48, train_loss: 1.0058, test_loss: 1.1377, test_f1: 0.4927
 epoch: 49, train_loss: 1.0085, test_loss: 1.1352, test_f1: 0.4949
 epoch: 50, train_loss: 0.9950, test_loss: 1.1320, test_f1: 0.4942
 epoch: 51, train_loss: 1.0042, test_loss: 1.1308, test_f1: 0.4824
 epoch: 52, train_loss: 0.9811, test_loss: 1.1314, test_f1: 0.5003
 epoch: 53, train_loss: 0.9896, test_loss: 1.1343, test_f1: 0.5026
 epoch: 54, train_loss: 1.0037, test_loss: 1.1414, test_f1: 0.4973
 epoch: 55, train_loss: 0.9775, test_loss: 1.1507, test_f1: 0.4890
 epoch: 56, train_loss: 1.0071, test_loss: 1.1527, test_f1: 0.4914
 epoch: 57, train_loss: 0.9909, test_loss: 1.1553, test_f1: 0.4922
 epoch: 58, train_loss: 0.9956, test_loss: 1.1543, test_f1: 0.5127
 epoch: 59, train_loss: 0.9759, test_loss: 1.1443, test_f1: 0.4984
 epoch: 60, train_loss: 0.9912, test_loss: 1.1489, test_f1: 0.4952
 epoch: 61, train_loss: 0.9865, test_loss: 1.1572, test_f1: 0.4964
 epoch: 62, train_loss: 0.9815, test_loss: 1.1593, test_f1: 0.5017
 epoch: 63, train_loss: 0.9870, test_loss: 1.1547, test_f1: 0.4916
 epoch: 64, train_loss: 0.9794, test_loss: 1.1539, test_f1: 0.5046
 epoch: 65, train_loss: 0.9815, test_loss: 1.1617, test_f1: 0.5065
 epoch: 66, train_loss: 0.9872, test_loss: 1.1555, test_f1: 0.5094
 epoch: 67, train_loss: 0.9751, test_loss: 1.1535, test_f1: 0.5145
 epoch: 68, train_loss: 0.9818, test_loss: 1.1615, test_f1: 0.4916
 epoch: 69, train_loss: 0.9802, test_loss: 1.1626, test_f1: 0.4859
 epoch: 70, train_loss: 0.9712, test_loss: 1.1668, test_f1: 0.4837
 epoch: 71, train_loss: 0.9871, test_loss: 1.1655, test_f1: 0.4807
 epoch: 72, train_loss: 0.9786, test_loss: 1.1662, test_f1: 0.4813
 epoch: 73, train_loss: 0.9704, test_loss: 1.1781, test_f1: 0.4892
 epoch: 74, train_loss: 0.9726, test_loss: 1.1790, test_f1: 0.4914
 epoch: 75, train_loss: 0.9727, test_loss: 1.1795, test_f1: 0.4820
 epoch: 76, train_loss: 0.9655, test_loss: 1.1722, test_f1: 0.4912
 epoch: 77, train_loss: 0.9724, test_loss: 1.1700, test_f1: 0.4916
 epoch: 78, train_loss: 0.9687, test_loss: 1.1755, test_f1: 0.4751
 epoch: 79, train_loss: 0.9538, test_loss: 1.1721, test_f1: 0.4736
 epoch: 80, train_loss: 0.9606, test_loss: 1.1680, test_f1: 0.4858
 epoch: 81, train_loss: 0.9640, test_loss: 1.1680, test_f1: 0.4714
 epoch: 82, train_loss: 0.9623, test_loss: 1.1795, test_f1: 0.4785
 epoch: 83, train_loss: 0.9658, test_loss: 1.1795, test_f1: 0.4814
 epoch: 84, train_loss: 0.9624, test_loss: 1.1706, test_f1: 0.4768
 epoch: 85, train_loss: 0.9545, test_loss: 1.1732, test_f1: 0.4837
 epoch: 86, train_loss: 0.9508, test_loss: 1.1668, test_f1: 0.4861
 epoch: 87, train_loss: 0.9593, test_loss: 1.1725, test_f1: 0.4810
 epoch: 88, train_loss: 0.9611, test_loss: 1.1755, test_f1: 0.4764
 epoch: 89, train_loss: 0.9484, test_loss: 1.1640, test_f1: 0.4990
 epoch: 90, train_loss: 0.9538, test_loss: 1.1659, test_f1: 0.4945
 epoch: 91, train_loss: 0.9427, test_loss: 1.1693, test_f1: 0.4945
 epoch: 92, train_loss: 0.9522, test_loss: 1.1688, test_f1: 0.4870
 epoch: 93, train_loss: 0.9513, test_loss: 1.1674, test_f1: 0.4849
 epoch: 94, train_loss: 0.9489, test_loss: 1.1731, test_f1: 0.4967
 epoch: 95, train_loss: 0.9465, test_loss: 1.1766, test_f1: 0.4968
 epoch: 96, train_loss: 0.9441, test_loss: 1.1728, test_f1: 0.4938
 epoch: 97, train_loss: 0.9577, test_loss: 1.1767, test_f1: 0.4977
 epoch: 98, train_loss: 0.9372, test_loss: 1.1741, test_f1: 0.4801
 epoch: 99, train_loss: 0.9420, test_loss: 1.1728, test_f1: 0.4784
##################ITERATION #4 ****************************************
 epoch: 0, train_loss: 1.3468, test_loss: 1.3309, test_f1: 0.2281
 epoch: 1, train_loss: 1.2786, test_loss: 1.3222, test_f1: 0.2281
 epoch: 2, train_loss: 1.2530, test_loss: 1.3089, test_f1: 0.2601
 epoch: 3, train_loss: 1.2502, test_loss: 1.2979, test_f1: 0.2587
 epoch: 4, train_loss: 1.2381, test_loss: 1.2966, test_f1: 0.2651
 epoch: 5, train_loss: 1.2335, test_loss: 1.2900, test_f1: 0.2759
 epoch: 6, train_loss: 1.2165, test_loss: 1.2906, test_f1: 0.2877
 epoch: 7, train_loss: 1.2062, test_loss: 1.2905, test_f1: 0.2845
 epoch: 8, train_loss: 1.2121, test_loss: 1.2935, test_f1: 0.3011
 epoch: 9, train_loss: 1.2038, test_loss: 1.2911, test_f1: 0.3113
 epoch: 10, train_loss: 1.1861, test_loss: 1.2804, test_f1: 0.3140
 epoch: 11, train_loss: 1.1916, test_loss: 1.2649, test_f1: 0.3303
 epoch: 12, train_loss: 1.1787, test_loss: 1.2569, test_f1: 0.3588
 epoch: 13, train_loss: 1.1693, test_loss: 1.2515, test_f1: 0.3530
 epoch: 14, train_loss: 1.1648, test_loss: 1.2475, test_f1: 0.3635
 epoch: 15, train_loss: 1.1681, test_loss: 1.2386, test_f1: 0.3781
 epoch: 16, train_loss: 1.1557, test_loss: 1.2264, test_f1: 0.3704
 epoch: 17, train_loss: 1.1492, test_loss: 1.2176, test_f1: 0.3741
 epoch: 18, train_loss: 1.1495, test_loss: 1.2142, test_f1: 0.3812
 epoch: 19, train_loss: 1.1401, test_loss: 1.2099, test_f1: 0.4235
 epoch: 20, train_loss: 1.1370, test_loss: 1.2210, test_f1: 0.4144
 epoch: 21, train_loss: 1.1339, test_loss: 1.2155, test_f1: 0.4199
 epoch: 22, train_loss: 1.1323, test_loss: 1.2218, test_f1: 0.4233
 epoch: 23, train_loss: 1.1198, test_loss: 1.2165, test_f1: 0.4239
 epoch: 24, train_loss: 1.1082, test_loss: 1.2122, test_f1: 0.4240
 epoch: 25, train_loss: 1.1151, test_loss: 1.2109, test_f1: 0.4207
 epoch: 26, train_loss: 1.1112, test_loss: 1.2133, test_f1: 0.4082
 epoch: 27, train_loss: 1.1158, test_loss: 1.2150, test_f1: 0.4135
 epoch: 28, train_loss: 1.1062, test_loss: 1.2148, test_f1: 0.4183
 epoch: 29, train_loss: 1.1059, test_loss: 1.2109, test_f1: 0.4115
 epoch: 30, train_loss: 1.0951, test_loss: 1.2055, test_f1: 0.4316
 epoch: 31, train_loss: 1.1004, test_loss: 1.2033, test_f1: 0.4318
 epoch: 32, train_loss: 1.0814, test_loss: 1.1907, test_f1: 0.4419
 epoch: 33, train_loss: 1.0791, test_loss: 1.1910, test_f1: 0.4140
 epoch: 34, train_loss: 1.0749, test_loss: 1.2020, test_f1: 0.3977
 epoch: 35, train_loss: 1.0745, test_loss: 1.1978, test_f1: 0.3960
 epoch: 36, train_loss: 1.0605, test_loss: 1.1978, test_f1: 0.4000
 epoch: 37, train_loss: 1.0623, test_loss: 1.1955, test_f1: 0.4051
 epoch: 38, train_loss: 1.0701, test_loss: 1.1999, test_f1: 0.4123
 epoch: 39, train_loss: 1.0604, test_loss: 1.2091, test_f1: 0.4018
 epoch: 40, train_loss: 1.0580, test_loss: 1.2209, test_f1: 0.3944
 epoch: 41, train_loss: 1.0456, test_loss: 1.2171, test_f1: 0.3944
 epoch: 42, train_loss: 1.0560, test_loss: 1.2002, test_f1: 0.4020
 epoch: 43, train_loss: 1.0435, test_loss: 1.1997, test_f1: 0.4041
 epoch: 44, train_loss: 1.0440, test_loss: 1.1992, test_f1: 0.4071
 epoch: 45, train_loss: 1.0477, test_loss: 1.2034, test_f1: 0.4170
 epoch: 46, train_loss: 1.0309, test_loss: 1.2188, test_f1: 0.4065
 epoch: 47, train_loss: 1.0427, test_loss: 1.2233, test_f1: 0.4058
 epoch: 48, train_loss: 1.0249, test_loss: 1.2428, test_f1: 0.4087
 epoch: 49, train_loss: 1.0331, test_loss: 1.2493, test_f1: 0.4108
 epoch: 50, train_loss: 1.0301, test_loss: 1.2186, test_f1: 0.4227
 epoch: 51, train_loss: 1.0228, test_loss: 1.2237, test_f1: 0.4176
 epoch: 52, train_loss: 1.0180, test_loss: 1.2307, test_f1: 0.4110
 epoch: 53, train_loss: 1.0211, test_loss: 1.2282, test_f1: 0.4042
 epoch: 54, train_loss: 1.0233, test_loss: 1.2284, test_f1: 0.4094
 epoch: 55, train_loss: 1.0186, test_loss: 1.2347, test_f1: 0.3992
 epoch: 56, train_loss: 1.0124, test_loss: 1.2336, test_f1: 0.3947
 epoch: 57, train_loss: 1.0235, test_loss: 1.2349, test_f1: 0.3990
 epoch: 58, train_loss: 1.0141, test_loss: 1.2399, test_f1: 0.3898
 epoch: 59, train_loss: 1.0067, test_loss: 1.2478, test_f1: 0.3934
 epoch: 60, train_loss: 1.0142, test_loss: 1.2433, test_f1: 0.3958
 epoch: 61, train_loss: 1.0189, test_loss: 1.2638, test_f1: 0.3972
 epoch: 62, train_loss: 1.0231, test_loss: 1.2859, test_f1: 0.3906
 epoch: 63, train_loss: 1.0164, test_loss: 1.2883, test_f1: 0.3823
 epoch: 64, train_loss: 1.0019, test_loss: 1.3032, test_f1: 0.3988
 epoch: 65, train_loss: 1.0072, test_loss: 1.2988, test_f1: 0.3560
 epoch: 66, train_loss: 1.0041, test_loss: 1.2657, test_f1: 0.3453
 epoch: 67, train_loss: 1.0115, test_loss: 1.2326, test_f1: 0.3617
 epoch: 68, train_loss: 1.0122, test_loss: 1.2364, test_f1: 0.3672
 epoch: 69, train_loss: 1.0021, test_loss: 1.2461, test_f1: 0.3703
 epoch: 70, train_loss: 1.0090, test_loss: 1.2501, test_f1: 0.3602
 epoch: 71, train_loss: 1.0010, test_loss: 1.2589, test_f1: 0.3652
 epoch: 72, train_loss: 0.9932, test_loss: 1.2486, test_f1: 0.3753
 epoch: 73, train_loss: 1.0023, test_loss: 1.2464, test_f1: 0.3760
 epoch: 74, train_loss: 0.9958, test_loss: 1.2487, test_f1: 0.3816
 epoch: 75, train_loss: 0.9974, test_loss: 1.2455, test_f1: 0.4064
 epoch: 76, train_loss: 0.9922, test_loss: 1.2601, test_f1: 0.3858
 epoch: 77, train_loss: 0.9899, test_loss: 1.2665, test_f1: 0.3859
 epoch: 78, train_loss: 1.0021, test_loss: 1.2609, test_f1: 0.4184
 epoch: 79, train_loss: 0.9965, test_loss: 1.2697, test_f1: 0.4182
 epoch: 80, train_loss: 0.9885, test_loss: 1.2570, test_f1: 0.4093
 epoch: 81, train_loss: 0.9840, test_loss: 1.2484, test_f1: 0.4077
 epoch: 82, train_loss: 0.9906, test_loss: 1.2372, test_f1: 0.3965
 epoch: 83, train_loss: 0.9833, test_loss: 1.2581, test_f1: 0.3778
 epoch: 84, train_loss: 0.9812, test_loss: 1.2751, test_f1: 0.3762
 epoch: 85, train_loss: 0.9908, test_loss: 1.2894, test_f1: 0.3779
 epoch: 86, train_loss: 0.9917, test_loss: 1.2774, test_f1: 0.3794
 epoch: 87, train_loss: 0.9781, test_loss: 1.2723, test_f1: 0.3732
 epoch: 88, train_loss: 0.9808, test_loss: 1.2656, test_f1: 0.3742
 epoch: 89, train_loss: 0.9935, test_loss: 1.2807, test_f1: 0.3815
 epoch: 90, train_loss: 0.9890, test_loss: 1.2669, test_f1: 0.3924
 epoch: 91, train_loss: 0.9767, test_loss: 1.2678, test_f1: 0.3943
 epoch: 92, train_loss: 0.9748, test_loss: 1.2794, test_f1: 0.3839
 epoch: 93, train_loss: 0.9764, test_loss: 1.2864, test_f1: 0.3703
 epoch: 94, train_loss: 0.9655, test_loss: 1.2859, test_f1: 0.3701
 epoch: 95, train_loss: 0.9751, test_loss: 1.2843, test_f1: 0.3742
 epoch: 96, train_loss: 0.9685, test_loss: 1.2745, test_f1: 0.3707
 epoch: 97, train_loss: 0.9591, test_loss: 1.2640, test_f1: 0.3708
 epoch: 98, train_loss: 0.9681, test_loss: 1.2821, test_f1: 0.3767
 epoch: 99, train_loss: 0.9656, test_loss: 1.2809, test_f1: 0.3869
##################ITERATION #5 ****************************************
 epoch: 0, train_loss: 1.3359, test_loss: 1.3009, test_f1: 0.2281
 epoch: 1, train_loss: 1.2566, test_loss: 1.2985, test_f1: 0.2281
 epoch: 2, train_loss: 1.2448, test_loss: 1.2948, test_f1: 0.2281
 epoch: 3, train_loss: 1.2237, test_loss: 1.2898, test_f1: 0.2281
 epoch: 4, train_loss: 1.2218, test_loss: 1.2727, test_f1: 0.2281
 epoch: 5, train_loss: 1.2130, test_loss: 1.2542, test_f1: 0.2281
 epoch: 6, train_loss: 1.1964, test_loss: 1.2428, test_f1: 0.2496
 epoch: 7, train_loss: 1.1972, test_loss: 1.2343, test_f1: 0.2546
 epoch: 8, train_loss: 1.1885, test_loss: 1.2233, test_f1: 0.2731
 epoch: 9, train_loss: 1.1810, test_loss: 1.2125, test_f1: 0.2775
 epoch: 10, train_loss: 1.1712, test_loss: 1.2089, test_f1: 0.3102
 epoch: 11, train_loss: 1.1735, test_loss: 1.2100, test_f1: 0.3733
 epoch: 12, train_loss: 1.1515, test_loss: 1.2117, test_f1: 0.3827
 epoch: 13, train_loss: 1.1552, test_loss: 1.2198, test_f1: 0.3821
 epoch: 14, train_loss: 1.1473, test_loss: 1.2224, test_f1: 0.3852
 epoch: 15, train_loss: 1.1380, test_loss: 1.2134, test_f1: 0.4037
 epoch: 16, train_loss: 1.1356, test_loss: 1.2059, test_f1: 0.4090
 epoch: 17, train_loss: 1.1361, test_loss: 1.2053, test_f1: 0.4176
 epoch: 18, train_loss: 1.1311, test_loss: 1.2020, test_f1: 0.4154
 epoch: 19, train_loss: 1.1241, test_loss: 1.1974, test_f1: 0.4077
 epoch: 20, train_loss: 1.1156, test_loss: 1.1955, test_f1: 0.4051
 epoch: 21, train_loss: 1.1156, test_loss: 1.1950, test_f1: 0.3948
 epoch: 22, train_loss: 1.0949, test_loss: 1.1931, test_f1: 0.3936
 epoch: 23, train_loss: 1.0983, test_loss: 1.1968, test_f1: 0.4012
 epoch: 24, train_loss: 1.0834, test_loss: 1.1933, test_f1: 0.4134
 epoch: 25, train_loss: 1.0760, test_loss: 1.1793, test_f1: 0.4111
 epoch: 26, train_loss: 1.0791, test_loss: 1.1778, test_f1: 0.3994
 epoch: 27, train_loss: 1.0819, test_loss: 1.1685, test_f1: 0.4096
 epoch: 28, train_loss: 1.0654, test_loss: 1.1759, test_f1: 0.4046
 epoch: 29, train_loss: 1.0663, test_loss: 1.1824, test_f1: 0.4247
 epoch: 30, train_loss: 1.0627, test_loss: 1.1794, test_f1: 0.3992
 epoch: 31, train_loss: 1.0497, test_loss: 1.1775, test_f1: 0.3895
 epoch: 32, train_loss: 1.0506, test_loss: 1.1730, test_f1: 0.4118
 epoch: 33, train_loss: 1.0401, test_loss: 1.1721, test_f1: 0.4181
 epoch: 34, train_loss: 1.0383, test_loss: 1.1641, test_f1: 0.4138
 epoch: 35, train_loss: 1.0324, test_loss: 1.1587, test_f1: 0.4113
 epoch: 36, train_loss: 1.0335, test_loss: 1.1633, test_f1: 0.4309
 epoch: 37, train_loss: 1.0286, test_loss: 1.1686, test_f1: 0.4515
 epoch: 38, train_loss: 1.0322, test_loss: 1.1733, test_f1: 0.4672
 epoch: 39, train_loss: 1.0213, test_loss: 1.1711, test_f1: 0.4320
 epoch: 40, train_loss: 1.0144, test_loss: 1.1742, test_f1: 0.4077
 epoch: 41, train_loss: 1.0314, test_loss: 1.1787, test_f1: 0.4210
 epoch: 42, train_loss: 1.0071, test_loss: 1.1788, test_f1: 0.4434
 epoch: 43, train_loss: 1.0092, test_loss: 1.1870, test_f1: 0.4196
 epoch: 44, train_loss: 1.0148, test_loss: 1.1872, test_f1: 0.4428
 epoch: 45, train_loss: 1.0038, test_loss: 1.1875, test_f1: 0.4546
 epoch: 46, train_loss: 0.9989, test_loss: 1.1721, test_f1: 0.4373
 epoch: 47, train_loss: 1.0007, test_loss: 1.1867, test_f1: 0.4009
 epoch: 48, train_loss: 0.9953, test_loss: 1.1914, test_f1: 0.3892
 epoch: 49, train_loss: 0.9977, test_loss: 1.1938, test_f1: 0.4163
 epoch: 50, train_loss: 1.0045, test_loss: 1.1848, test_f1: 0.4674
 epoch: 51, train_loss: 0.9860, test_loss: 1.1857, test_f1: 0.4704
 epoch: 52, train_loss: 0.9900, test_loss: 1.1807, test_f1: 0.4676
 epoch: 53, train_loss: 0.9902, test_loss: 1.1821, test_f1: 0.4589
 epoch: 54, train_loss: 0.9900, test_loss: 1.1789, test_f1: 0.4535
 epoch: 55, train_loss: 0.9692, test_loss: 1.1743, test_f1: 0.4479
 epoch: 56, train_loss: 0.9877, test_loss: 1.1762, test_f1: 0.4361
 epoch: 57, train_loss: 0.9834, test_loss: 1.1769, test_f1: 0.4411
 epoch: 58, train_loss: 0.9838, test_loss: 1.1732, test_f1: 0.4467
 epoch: 59, train_loss: 0.9785, test_loss: 1.1798, test_f1: 0.4374
 epoch: 60, train_loss: 0.9632, test_loss: 1.1827, test_f1: 0.4586
 epoch: 61, train_loss: 0.9642, test_loss: 1.1869, test_f1: 0.4666
 epoch: 62, train_loss: 0.9637, test_loss: 1.1807, test_f1: 0.4748
 epoch: 63, train_loss: 0.9706, test_loss: 1.1770, test_f1: 0.4760
 epoch: 64, train_loss: 0.9599, test_loss: 1.1867, test_f1: 0.4762
 epoch: 65, train_loss: 0.9595, test_loss: 1.1826, test_f1: 0.4557
 epoch: 66, train_loss: 0.9665, test_loss: 1.1762, test_f1: 0.4597
 epoch: 67, train_loss: 0.9589, test_loss: 1.1668, test_f1: 0.4588
 epoch: 68, train_loss: 0.9623, test_loss: 1.1649, test_f1: 0.4586
 epoch: 69, train_loss: 0.9528, test_loss: 1.1794, test_f1: 0.4764
 epoch: 70, train_loss: 0.9609, test_loss: 1.1900, test_f1: 0.4633
 epoch: 71, train_loss: 0.9460, test_loss: 1.1825, test_f1: 0.4639
 epoch: 72, train_loss: 0.9593, test_loss: 1.1935, test_f1: 0.4797
 epoch: 73, train_loss: 0.9413, test_loss: 1.1972, test_f1: 0.4812
 epoch: 74, train_loss: 0.9369, test_loss: 1.2012, test_f1: 0.4736
 epoch: 75, train_loss: 0.9460, test_loss: 1.2057, test_f1: 0.4912
 epoch: 76, train_loss: 0.9372, test_loss: 1.1968, test_f1: 0.5053
 epoch: 77, train_loss: 0.9451, test_loss: 1.1883, test_f1: 0.4969
 epoch: 78, train_loss: 0.9371, test_loss: 1.1951, test_f1: 0.5013
 epoch: 79, train_loss: 0.9395, test_loss: 1.2015, test_f1: 0.5092
 epoch: 80, train_loss: 0.9354, test_loss: 1.2057, test_f1: 0.5017
 epoch: 81, train_loss: 0.9488, test_loss: 1.1999, test_f1: 0.4944
 epoch: 82, train_loss: 0.9289, test_loss: 1.1879, test_f1: 0.4991
 epoch: 83, train_loss: 0.9265, test_loss: 1.1868, test_f1: 0.4988
 epoch: 84, train_loss: 0.9286, test_loss: 1.1943, test_f1: 0.4891
 epoch: 85, train_loss: 0.9299, test_loss: 1.1987, test_f1: 0.4996
 epoch: 86, train_loss: 0.9180, test_loss: 1.1999, test_f1: 0.5075
 epoch: 87, train_loss: 0.9208, test_loss: 1.1930, test_f1: 0.5059
 epoch: 88, train_loss: 0.9333, test_loss: 1.1844, test_f1: 0.5006
 epoch: 89, train_loss: 0.9278, test_loss: 1.1985, test_f1: 0.5012
 epoch: 90, train_loss: 0.9185, test_loss: 1.2144, test_f1: 0.5033
 epoch: 91, train_loss: 0.9265, test_loss: 1.2134, test_f1: 0.4999
 epoch: 92, train_loss: 0.9226, test_loss: 1.2179, test_f1: 0.4961
 epoch: 93, train_loss: 0.9190, test_loss: 1.2096, test_f1: 0.4807
 epoch: 94, train_loss: 0.9128, test_loss: 1.1950, test_f1: 0.4985
 epoch: 95, train_loss: 0.9163, test_loss: 1.1958, test_f1: 0.5054
 epoch: 96, train_loss: 0.9194, test_loss: 1.1925, test_f1: 0.5310
 epoch: 97, train_loss: 0.9185, test_loss: 1.1914, test_f1: 0.5347
 epoch: 98, train_loss: 0.9074, test_loss: 1.2000, test_f1: 0.5291
 epoch: 99, train_loss: 0.9237, test_loss: 1.2105, test_f1: 0.5496
##################ITERATION #6 ****************************************
 epoch: 0, train_loss: 1.3015, test_loss: 1.3262, test_f1: 0.2281
 epoch: 1, train_loss: 1.2502, test_loss: 1.3211, test_f1: 0.2281
 epoch: 2, train_loss: 1.2364, test_loss: 1.3005, test_f1: 0.2281
 epoch: 3, train_loss: 1.2233, test_loss: 1.2817, test_f1: 0.2345
 epoch: 4, train_loss: 1.2084, test_loss: 1.2664, test_f1: 0.2376
 epoch: 5, train_loss: 1.1781, test_loss: 1.2550, test_f1: 0.3173
 epoch: 6, train_loss: 1.1776, test_loss: 1.2424, test_f1: 0.3656
 epoch: 7, train_loss: 1.1574, test_loss: 1.2206, test_f1: 0.3603
 epoch: 8, train_loss: 1.1559, test_loss: 1.2102, test_f1: 0.3621
 epoch: 9, train_loss: 1.1390, test_loss: 1.2016, test_f1: 0.3519
 epoch: 10, train_loss: 1.1293, test_loss: 1.1967, test_f1: 0.3526
 epoch: 11, train_loss: 1.1297, test_loss: 1.1915, test_f1: 0.3407
 epoch: 12, train_loss: 1.1340, test_loss: 1.1894, test_f1: 0.3585
 epoch: 13, train_loss: 1.1202, test_loss: 1.1801, test_f1: 0.3524
 epoch: 14, train_loss: 1.1152, test_loss: 1.1798, test_f1: 0.3472
 epoch: 15, train_loss: 1.1154, test_loss: 1.1947, test_f1: 0.3427
 epoch: 16, train_loss: 1.1115, test_loss: 1.1900, test_f1: 0.3638
 epoch: 17, train_loss: 1.1035, test_loss: 1.2139, test_f1: 0.3773
 epoch: 18, train_loss: 1.0956, test_loss: 1.2343, test_f1: 0.3804
 epoch: 19, train_loss: 1.0965, test_loss: 1.1820, test_f1: 0.3903
 epoch: 20, train_loss: 1.0886, test_loss: 1.1782, test_f1: 0.3859
 epoch: 21, train_loss: 1.0898, test_loss: 1.1681, test_f1: 0.4016
 epoch: 22, train_loss: 1.0943, test_loss: 1.1912, test_f1: 0.3886
 epoch: 23, train_loss: 1.0750, test_loss: 1.2668, test_f1: 0.3713
 epoch: 24, train_loss: 1.0785, test_loss: 1.2519, test_f1: 0.3704
 epoch: 25, train_loss: 1.0582, test_loss: 1.2259, test_f1: 0.3797
 epoch: 26, train_loss: 1.0687, test_loss: 1.2021, test_f1: 0.3905
 epoch: 27, train_loss: 1.0524, test_loss: 1.2021, test_f1: 0.3822
 epoch: 28, train_loss: 1.0576, test_loss: 1.2141, test_f1: 0.3791
 epoch: 29, train_loss: 1.0591, test_loss: 1.2117, test_f1: 0.3904
 epoch: 30, train_loss: 1.0516, test_loss: 1.1984, test_f1: 0.3807
 epoch: 31, train_loss: 1.0525, test_loss: 1.1593, test_f1: 0.3385
 epoch: 32, train_loss: 1.0447, test_loss: 1.1909, test_f1: 0.3308
 epoch: 33, train_loss: 1.0348, test_loss: 1.1557, test_f1: 0.3524
 epoch: 34, train_loss: 1.0335, test_loss: 1.1314, test_f1: 0.3786
 epoch: 35, train_loss: 1.0317, test_loss: 1.1416, test_f1: 0.3700
 epoch: 36, train_loss: 1.0220, test_loss: 1.1695, test_f1: 0.3731
 epoch: 37, train_loss: 1.0286, test_loss: 1.1736, test_f1: 0.3783
 epoch: 38, train_loss: 1.0232, test_loss: 1.1488, test_f1: 0.3850
 epoch: 39, train_loss: 1.0214, test_loss: 1.2107, test_f1: 0.3914
 epoch: 40, train_loss: 1.0250, test_loss: 1.2435, test_f1: 0.3884
 epoch: 41, train_loss: 1.0209, test_loss: 1.2919, test_f1: 0.3997
 epoch: 42, train_loss: 1.0182, test_loss: 1.3578, test_f1: 0.3935
 epoch: 43, train_loss: 1.0018, test_loss: 1.3639, test_f1: 0.3871
 epoch: 44, train_loss: 1.0094, test_loss: 1.3478, test_f1: 0.3883
 epoch: 45, train_loss: 1.0023, test_loss: 1.4925, test_f1: 0.4208
 epoch: 46, train_loss: 0.9946, test_loss: 1.3140, test_f1: 0.4187
 epoch: 47, train_loss: 1.0020, test_loss: 1.3587, test_f1: 0.4394
 epoch: 48, train_loss: 0.9933, test_loss: 1.4480, test_f1: 0.4236
 epoch: 49, train_loss: 0.9906, test_loss: 1.5585, test_f1: 0.4219
 epoch: 50, train_loss: 0.9929, test_loss: 1.4813, test_f1: 0.4304
 epoch: 51, train_loss: 0.9769, test_loss: 1.5015, test_f1: 0.4329
 epoch: 52, train_loss: 0.9817, test_loss: 1.4800, test_f1: 0.4440
 epoch: 53, train_loss: 0.9724, test_loss: 1.4399, test_f1: 0.4466
 epoch: 54, train_loss: 0.9810, test_loss: 1.4468, test_f1: 0.4490
 epoch: 55, train_loss: 0.9669, test_loss: 1.4316, test_f1: 0.4514
 epoch: 56, train_loss: 0.9689, test_loss: 1.4522, test_f1: 0.4562
 epoch: 57, train_loss: 0.9671, test_loss: 1.4625, test_f1: 0.4657
 epoch: 58, train_loss: 0.9647, test_loss: 1.7131, test_f1: 0.4637
 epoch: 59, train_loss: 0.9672, test_loss: 1.5884, test_f1: 0.4683
 epoch: 60, train_loss: 0.9639, test_loss: 1.5775, test_f1: 0.4585
 epoch: 61, train_loss: 0.9758, test_loss: 1.3502, test_f1: 0.4553
 epoch: 62, train_loss: 0.9763, test_loss: 1.2891, test_f1: 0.4542
 epoch: 63, train_loss: 0.9688, test_loss: 1.3675, test_f1: 0.4637
 epoch: 64, train_loss: 0.9608, test_loss: 1.3379, test_f1: 0.4493
 epoch: 65, train_loss: 0.9660, test_loss: 1.3638, test_f1: 0.4585
 epoch: 66, train_loss: 0.9563, test_loss: 1.3831, test_f1: 0.4608
 epoch: 67, train_loss: 0.9655, test_loss: 1.4045, test_f1: 0.4605
 epoch: 68, train_loss: 0.9557, test_loss: 1.4556, test_f1: 0.4713
 epoch: 69, train_loss: 0.9692, test_loss: 1.4872, test_f1: 0.4821
 epoch: 70, train_loss: 0.9568, test_loss: 1.5720, test_f1: 0.4791
 epoch: 71, train_loss: 0.9535, test_loss: 1.4844, test_f1: 0.4813
 epoch: 72, train_loss: 0.9588, test_loss: 1.4501, test_f1: 0.4703
 epoch: 73, train_loss: 0.9582, test_loss: 1.4289, test_f1: 0.4844
 epoch: 74, train_loss: 0.9580, test_loss: 1.4370, test_f1: 0.5009
 epoch: 75, train_loss: 0.9471, test_loss: 1.5158, test_f1: 0.4859
 epoch: 76, train_loss: 0.9608, test_loss: 1.5207, test_f1: 0.4902
 epoch: 77, train_loss: 0.9376, test_loss: 1.5212, test_f1: 0.4711
 epoch: 78, train_loss: 0.9405, test_loss: 1.5513, test_f1: 0.4611
 epoch: 79, train_loss: 0.9336, test_loss: 1.5038, test_f1: 0.4670
 epoch: 80, train_loss: 0.9455, test_loss: 1.4373, test_f1: 0.4703
 epoch: 81, train_loss: 0.9466, test_loss: 1.4680, test_f1: 0.4743
 epoch: 82, train_loss: 0.9399, test_loss: 1.5695, test_f1: 0.4825
 epoch: 83, train_loss: 0.9480, test_loss: 1.4941, test_f1: 0.4711
 epoch: 84, train_loss: 0.9385, test_loss: 1.4627, test_f1: 0.4727
 epoch: 85, train_loss: 0.9496, test_loss: 1.3958, test_f1: 0.4428
 epoch: 86, train_loss: 0.9559, test_loss: 1.4711, test_f1: 0.4606
 epoch: 87, train_loss: 0.9411, test_loss: 1.6601, test_f1: 0.4725
 epoch: 88, train_loss: 0.9381, test_loss: 1.2596, test_f1: 0.4635
 epoch: 89, train_loss: 0.9278, test_loss: 1.2796, test_f1: 0.4699
 epoch: 90, train_loss: 0.9444, test_loss: 1.3448, test_f1: 0.4882
 epoch: 91, train_loss: 0.9272, test_loss: 1.3157, test_f1: 0.4631
 epoch: 92, train_loss: 0.9402, test_loss: 1.4280, test_f1: 0.4595
 epoch: 93, train_loss: 0.9325, test_loss: 1.4274, test_f1: 0.4817
 epoch: 94, train_loss: 0.9274, test_loss: 1.6611, test_f1: 0.4983
 epoch: 95, train_loss: 0.9258, test_loss: 1.7416, test_f1: 0.4916
 epoch: 96, train_loss: 0.9316, test_loss: 1.7272, test_f1: 0.4796
 epoch: 97, train_loss: 0.9180, test_loss: 1.6738, test_f1: 0.4673
 epoch: 98, train_loss: 0.9146, test_loss: 1.7250, test_f1: 0.4618
 epoch: 99, train_loss: 0.9243, test_loss: 1.8433, test_f1: 0.4632
##################ITERATION #7 ****************************************
 epoch: 0, train_loss: 1.3082, test_loss: 1.4233, test_f1: 0.2441
 epoch: 1, train_loss: 1.2267, test_loss: 1.3543, test_f1: 0.2784
 epoch: 2, train_loss: 1.2273, test_loss: 1.3202, test_f1: 0.2797
 epoch: 3, train_loss: 1.1971, test_loss: 1.2951, test_f1: 0.2784
 epoch: 4, train_loss: 1.2032, test_loss: 1.2848, test_f1: 0.2999
 epoch: 5, train_loss: 1.1916, test_loss: 1.2811, test_f1: 0.3083
 epoch: 6, train_loss: 1.1848, test_loss: 1.2776, test_f1: 0.3109
 epoch: 7, train_loss: 1.1785, test_loss: 1.2781, test_f1: 0.3223
 epoch: 8, train_loss: 1.1687, test_loss: 1.2690, test_f1: 0.3246
 epoch: 9, train_loss: 1.1606, test_loss: 1.2638, test_f1: 0.3329
 epoch: 10, train_loss: 1.1628, test_loss: 1.2658, test_f1: 0.3525
 epoch: 11, train_loss: 1.1555, test_loss: 1.2583, test_f1: 0.3530
 epoch: 12, train_loss: 1.1465, test_loss: 1.2621, test_f1: 0.3554
 epoch: 13, train_loss: 1.1439, test_loss: 1.2737, test_f1: 0.3381
 epoch: 14, train_loss: 1.1405, test_loss: 1.2858, test_f1: 0.3474
 epoch: 15, train_loss: 1.1330, test_loss: 1.2857, test_f1: 0.3445
 epoch: 16, train_loss: 1.1267, test_loss: 1.2831, test_f1: 0.3591
 epoch: 17, train_loss: 1.1164, test_loss: 1.2876, test_f1: 0.3516
 epoch: 18, train_loss: 1.1214, test_loss: 1.2909, test_f1: 0.3589
 epoch: 19, train_loss: 1.1244, test_loss: 1.2952, test_f1: 0.3659
 epoch: 20, train_loss: 1.1132, test_loss: 1.2914, test_f1: 0.3605
 epoch: 21, train_loss: 1.1011, test_loss: 1.2972, test_f1: 0.3443
 epoch: 22, train_loss: 1.1008, test_loss: 1.2912, test_f1: 0.3525
 epoch: 23, train_loss: 1.0983, test_loss: 1.3024, test_f1: 0.3640
 epoch: 24, train_loss: 1.0936, test_loss: 1.3207, test_f1: 0.3300
 epoch: 25, train_loss: 1.0991, test_loss: 1.3361, test_f1: 0.3359
 epoch: 26, train_loss: 1.0921, test_loss: 1.3203, test_f1: 0.3466
 epoch: 27, train_loss: 1.0792, test_loss: 1.3192, test_f1: 0.3529
 epoch: 28, train_loss: 1.0843, test_loss: 1.3128, test_f1: 0.3640
 epoch: 29, train_loss: 1.0793, test_loss: 1.3028, test_f1: 0.3639
 epoch: 30, train_loss: 1.0809, test_loss: 1.3221, test_f1: 0.3420
 epoch: 31, train_loss: 1.0772, test_loss: 1.3340, test_f1: 0.3357
 epoch: 32, train_loss: 1.0733, test_loss: 1.3395, test_f1: 0.3745
 epoch: 33, train_loss: 1.0692, test_loss: 1.3389, test_f1: 0.3758
 epoch: 34, train_loss: 1.0672, test_loss: 1.3637, test_f1: 0.3930
 epoch: 35, train_loss: 1.0685, test_loss: 1.4049, test_f1: 0.3798
 epoch: 36, train_loss: 1.0588, test_loss: 1.4369, test_f1: 0.3867
 epoch: 37, train_loss: 1.0552, test_loss: 1.4929, test_f1: 0.3845
 epoch: 38, train_loss: 1.0564, test_loss: 1.5021, test_f1: 0.3969
 epoch: 39, train_loss: 1.0527, test_loss: 1.4465, test_f1: 0.4151
 epoch: 40, train_loss: 1.0444, test_loss: 1.4513, test_f1: 0.3960
 epoch: 41, train_loss: 1.0439, test_loss: 1.4449, test_f1: 0.3890
 epoch: 42, train_loss: 1.0482, test_loss: 1.3946, test_f1: 0.4066
 epoch: 43, train_loss: 1.0480, test_loss: 1.3573, test_f1: 0.4271
 epoch: 44, train_loss: 1.0322, test_loss: 1.3917, test_f1: 0.3914
 epoch: 45, train_loss: 1.0320, test_loss: 1.4379, test_f1: 0.3817
 epoch: 46, train_loss: 1.0329, test_loss: 1.4460, test_f1: 0.3788
 epoch: 47, train_loss: 1.0124, test_loss: 1.4560, test_f1: 0.3870
 epoch: 48, train_loss: 1.0352, test_loss: 1.4602, test_f1: 0.3878
 epoch: 49, train_loss: 1.0260, test_loss: 1.3418, test_f1: 0.4382
 epoch: 50, train_loss: 1.0189, test_loss: 1.3987, test_f1: 0.4018
 epoch: 51, train_loss: 1.0154, test_loss: 1.4317, test_f1: 0.3830
 epoch: 52, train_loss: 1.0087, test_loss: 1.4262, test_f1: 0.3682
 epoch: 53, train_loss: 0.9998, test_loss: 1.4256, test_f1: 0.3827
 epoch: 54, train_loss: 0.9988, test_loss: 1.4509, test_f1: 0.3811
 epoch: 55, train_loss: 1.0013, test_loss: 1.4684, test_f1: 0.3900
 epoch: 56, train_loss: 1.0148, test_loss: 1.5100, test_f1: 0.3724
 epoch: 57, train_loss: 0.9967, test_loss: 1.5027, test_f1: 0.3686
 epoch: 58, train_loss: 0.9997, test_loss: 1.4694, test_f1: 0.3756
 epoch: 59, train_loss: 0.9948, test_loss: 1.4862, test_f1: 0.3708
 epoch: 60, train_loss: 0.9930, test_loss: 1.4955, test_f1: 0.3809
 epoch: 61, train_loss: 0.9867, test_loss: 1.4942, test_f1: 0.3694
 epoch: 62, train_loss: 0.9971, test_loss: 1.4543, test_f1: 0.3772
 epoch: 63, train_loss: 0.9767, test_loss: 1.4652, test_f1: 0.3814
 epoch: 64, train_loss: 0.9924, test_loss: 1.4913, test_f1: 0.3959
 epoch: 65, train_loss: 0.9947, test_loss: 1.4567, test_f1: 0.3911
 epoch: 66, train_loss: 0.9903, test_loss: 1.4619, test_f1: 0.3850
 epoch: 67, train_loss: 0.9959, test_loss: 1.4581, test_f1: 0.3974
 epoch: 68, train_loss: 0.9852, test_loss: 1.4553, test_f1: 0.3935
 epoch: 69, train_loss: 0.9977, test_loss: 1.4594, test_f1: 0.3903
 epoch: 70, train_loss: 0.9789, test_loss: 1.4702, test_f1: 0.3734
 epoch: 71, train_loss: 0.9788, test_loss: 1.4568, test_f1: 0.3846
 epoch: 72, train_loss: 0.9791, test_loss: 1.5007, test_f1: 0.3822
 epoch: 73, train_loss: 0.9679, test_loss: 1.4980, test_f1: 0.3914
 epoch: 74, train_loss: 0.9859, test_loss: 1.4528, test_f1: 0.4057
 epoch: 75, train_loss: 0.9805, test_loss: 1.4474, test_f1: 0.4250
 epoch: 76, train_loss: 0.9733, test_loss: 1.4620, test_f1: 0.4198
 epoch: 77, train_loss: 0.9800, test_loss: 1.5167, test_f1: 0.4342
 epoch: 78, train_loss: 0.9805, test_loss: 1.6003, test_f1: 0.4046
 epoch: 79, train_loss: 0.9834, test_loss: 1.5808, test_f1: 0.4039
 epoch: 80, train_loss: 0.9696, test_loss: 1.5416, test_f1: 0.4206
 epoch: 81, train_loss: 0.9653, test_loss: 1.5417, test_f1: 0.4206
 epoch: 82, train_loss: 0.9682, test_loss: 1.5844, test_f1: 0.4099
 epoch: 83, train_loss: 0.9673, test_loss: 1.5382, test_f1: 0.4134
 epoch: 84, train_loss: 0.9682, test_loss: 1.5266, test_f1: 0.4120
 epoch: 85, train_loss: 0.9668, test_loss: 1.5198, test_f1: 0.4095
 epoch: 86, train_loss: 0.9620, test_loss: 1.4925, test_f1: 0.4133
 epoch: 87, train_loss: 0.9588, test_loss: 1.5012, test_f1: 0.3986
 epoch: 88, train_loss: 0.9617, test_loss: 1.5452, test_f1: 0.4011
 epoch: 89, train_loss: 0.9541, test_loss: 1.5351, test_f1: 0.4251
 epoch: 90, train_loss: 0.9608, test_loss: 1.5714, test_f1: 0.4238
 epoch: 91, train_loss: 0.9570, test_loss: 1.4902, test_f1: 0.4217
 epoch: 92, train_loss: 0.9517, test_loss: 1.5686, test_f1: 0.4218
 epoch: 93, train_loss: 0.9627, test_loss: 1.5777, test_f1: 0.4244
 epoch: 94, train_loss: 0.9511, test_loss: 1.5983, test_f1: 0.4383
 epoch: 95, train_loss: 0.9578, test_loss: 1.5560, test_f1: 0.4252
 epoch: 96, train_loss: 0.9529, test_loss: 1.5222, test_f1: 0.4223
 epoch: 97, train_loss: 0.9513, test_loss: 1.5207, test_f1: 0.4362
 epoch: 98, train_loss: 0.9454, test_loss: 1.4826, test_f1: 0.4275
 epoch: 99, train_loss: 0.9511, test_loss: 1.5197, test_f1: 0.4254
##################ITERATION #8 ****************************************
 epoch: 0, train_loss: 1.3202, test_loss: 1.3612, test_f1: 0.2281
 epoch: 1, train_loss: 1.2888, test_loss: 1.3447, test_f1: 0.2404
 epoch: 2, train_loss: 1.2689, test_loss: 1.3461, test_f1: 0.2404
 epoch: 3, train_loss: 1.2519, test_loss: 1.3594, test_f1: 0.2424
 epoch: 4, train_loss: 1.2366, test_loss: 1.3793, test_f1: 0.2403
 epoch: 5, train_loss: 1.2388, test_loss: 1.3899, test_f1: 0.2398
 epoch: 6, train_loss: 1.2275, test_loss: 1.3686, test_f1: 0.2390
 epoch: 7, train_loss: 1.2169, test_loss: 1.3555, test_f1: 0.2332
 epoch: 8, train_loss: 1.2203, test_loss: 1.3430, test_f1: 0.2379
 epoch: 9, train_loss: 1.2201, test_loss: 1.3245, test_f1: 0.2537
 epoch: 10, train_loss: 1.2016, test_loss: 1.3296, test_f1: 0.2508
 epoch: 11, train_loss: 1.1874, test_loss: 1.3470, test_f1: 0.2423
 epoch: 12, train_loss: 1.1873, test_loss: 1.3466, test_f1: 0.2598
 epoch: 13, train_loss: 1.1725, test_loss: 1.3376, test_f1: 0.2645
 epoch: 14, train_loss: 1.1707, test_loss: 1.3267, test_f1: 0.2764
 epoch: 15, train_loss: 1.1737, test_loss: 1.3310, test_f1: 0.2928
 epoch: 16, train_loss: 1.1612, test_loss: 1.3269, test_f1: 0.3014
 epoch: 17, train_loss: 1.1540, test_loss: 1.3263, test_f1: 0.3017
 epoch: 18, train_loss: 1.1508, test_loss: 1.3312, test_f1: 0.3554
 epoch: 19, train_loss: 1.1328, test_loss: 1.3436, test_f1: 0.3689
 epoch: 20, train_loss: 1.1260, test_loss: 1.3456, test_f1: 0.3696
 epoch: 21, train_loss: 1.1457, test_loss: 1.3258, test_f1: 0.3555
 epoch: 22, train_loss: 1.1372, test_loss: 1.3126, test_f1: 0.3891
 epoch: 23, train_loss: 1.1295, test_loss: 1.3172, test_f1: 0.3679
 epoch: 24, train_loss: 1.1169, test_loss: 1.3045, test_f1: 0.3735
 epoch: 25, train_loss: 1.1087, test_loss: 1.3069, test_f1: 0.3944
 epoch: 26, train_loss: 1.1086, test_loss: 1.2888, test_f1: 0.3838
 epoch: 27, train_loss: 1.0990, test_loss: 1.2650, test_f1: 0.3965
 epoch: 28, train_loss: 1.0919, test_loss: 1.2742, test_f1: 0.3928
 epoch: 29, train_loss: 1.0978, test_loss: 1.2810, test_f1: 0.4086
 epoch: 30, train_loss: 1.0829, test_loss: 1.2553, test_f1: 0.4052
 epoch: 31, train_loss: 1.0669, test_loss: 1.2577, test_f1: 0.4169
 epoch: 32, train_loss: 1.0745, test_loss: 1.2849, test_f1: 0.4251
 epoch: 33, train_loss: 1.0582, test_loss: 1.2915, test_f1: 0.4349
 epoch: 34, train_loss: 1.0714, test_loss: 1.2947, test_f1: 0.4332
 epoch: 35, train_loss: 1.0614, test_loss: 1.2925, test_f1: 0.4239
 epoch: 36, train_loss: 1.0615, test_loss: 1.3222, test_f1: 0.4274
 epoch: 37, train_loss: 1.0542, test_loss: 1.3253, test_f1: 0.4319
 epoch: 38, train_loss: 1.0405, test_loss: 1.3199, test_f1: 0.4393
 epoch: 39, train_loss: 1.0427, test_loss: 1.2954, test_f1: 0.4358
 epoch: 40, train_loss: 1.0373, test_loss: 1.3015, test_f1: 0.4299
 epoch: 41, train_loss: 1.0308, test_loss: 1.3173, test_f1: 0.4338
 epoch: 42, train_loss: 1.0424, test_loss: 1.3262, test_f1: 0.4359
 epoch: 43, train_loss: 1.0310, test_loss: 1.3214, test_f1: 0.4326
 epoch: 44, train_loss: 1.0145, test_loss: 1.3174, test_f1: 0.4445
 epoch: 45, train_loss: 1.0178, test_loss: 1.3422, test_f1: 0.4452
 epoch: 46, train_loss: 1.0150, test_loss: 1.3248, test_f1: 0.4507
 epoch: 47, train_loss: 1.0198, test_loss: 1.3181, test_f1: 0.4433
 epoch: 48, train_loss: 1.0101, test_loss: 1.3116, test_f1: 0.4552
 epoch: 49, train_loss: 1.0079, test_loss: 1.3160, test_f1: 0.4542
 epoch: 50, train_loss: 1.0066, test_loss: 1.3293, test_f1: 0.4454
 epoch: 51, train_loss: 1.0069, test_loss: 1.3679, test_f1: 0.4316
 epoch: 52, train_loss: 0.9850, test_loss: 1.3549, test_f1: 0.4345
 epoch: 53, train_loss: 1.0024, test_loss: 1.3483, test_f1: 0.4363
 epoch: 54, train_loss: 0.9965, test_loss: 1.3454, test_f1: 0.4500
 epoch: 55, train_loss: 1.0076, test_loss: 1.3609, test_f1: 0.4650
 epoch: 56, train_loss: 0.9936, test_loss: 1.3634, test_f1: 0.4454
 epoch: 57, train_loss: 0.9933, test_loss: 1.3943, test_f1: 0.4583
 epoch: 58, train_loss: 0.9869, test_loss: 1.3745, test_f1: 0.4506
 epoch: 59, train_loss: 0.9934, test_loss: 1.3720, test_f1: 0.4508
 epoch: 60, train_loss: 0.9962, test_loss: 1.3738, test_f1: 0.4429
 epoch: 61, train_loss: 0.9880, test_loss: 1.3817, test_f1: 0.4596
 epoch: 62, train_loss: 0.9893, test_loss: 1.3634, test_f1: 0.4601
 epoch: 63, train_loss: 0.9661, test_loss: 1.3718, test_f1: 0.4729
 epoch: 64, train_loss: 0.9745, test_loss: 1.3662, test_f1: 0.4750
 epoch: 65, train_loss: 0.9779, test_loss: 1.3716, test_f1: 0.4786
 epoch: 66, train_loss: 0.9703, test_loss: 1.3822, test_f1: 0.4769
 epoch: 67, train_loss: 0.9833, test_loss: 1.3670, test_f1: 0.4764
 epoch: 68, train_loss: 0.9669, test_loss: 1.3417, test_f1: 0.4751
 epoch: 69, train_loss: 0.9757, test_loss: 1.3457, test_f1: 0.4898
 epoch: 70, train_loss: 0.9747, test_loss: 1.3563, test_f1: 0.4750
 epoch: 71, train_loss: 0.9673, test_loss: 1.3733, test_f1: 0.4736
 epoch: 72, train_loss: 0.9635, test_loss: 1.3508, test_f1: 0.4719
 epoch: 73, train_loss: 0.9625, test_loss: 1.3494, test_f1: 0.4767
 epoch: 74, train_loss: 0.9653, test_loss: 1.3564, test_f1: 0.4898
 epoch: 75, train_loss: 0.9698, test_loss: 1.3351, test_f1: 0.4800
 epoch: 76, train_loss: 0.9552, test_loss: 1.3248, test_f1: 0.4921
 epoch: 77, train_loss: 0.9587, test_loss: 1.3400, test_f1: 0.4941
 epoch: 78, train_loss: 0.9527, test_loss: 1.3374, test_f1: 0.4952
 epoch: 79, train_loss: 0.9581, test_loss: 1.3472, test_f1: 0.4992
 epoch: 80, train_loss: 0.9579, test_loss: 1.3420, test_f1: 0.5029
 epoch: 81, train_loss: 0.9464, test_loss: 1.3428, test_f1: 0.5171
 epoch: 82, train_loss: 0.9521, test_loss: 1.3725, test_f1: 0.5037
 epoch: 83, train_loss: 0.9636, test_loss: 1.3815, test_f1: 0.5198
 epoch: 84, train_loss: 0.9694, test_loss: 1.3431, test_f1: 0.5220
 epoch: 85, train_loss: 0.9535, test_loss: 1.3425, test_f1: 0.5167
 epoch: 86, train_loss: 0.9426, test_loss: 1.3478, test_f1: 0.5109
 epoch: 87, train_loss: 0.9416, test_loss: 1.3710, test_f1: 0.5163
 epoch: 88, train_loss: 0.9494, test_loss: 1.3380, test_f1: 0.5083
 epoch: 89, train_loss: 0.9445, test_loss: 1.3522, test_f1: 0.5076
 epoch: 90, train_loss: 0.9446, test_loss: 1.3454, test_f1: 0.5014
 epoch: 91, train_loss: 0.9517, test_loss: 1.3781, test_f1: 0.5034
 epoch: 92, train_loss: 0.9423, test_loss: 1.5117, test_f1: 0.5021
 epoch: 93, train_loss: 0.9272, test_loss: 1.4966, test_f1: 0.5063
 epoch: 94, train_loss: 0.9393, test_loss: 1.4719, test_f1: 0.5088
 epoch: 95, train_loss: 0.9364, test_loss: 1.5019, test_f1: 0.5036
 epoch: 96, train_loss: 0.9445, test_loss: 1.4291, test_f1: 0.5309
 epoch: 97, train_loss: 0.9394, test_loss: 1.3632, test_f1: 0.5297
 epoch: 98, train_loss: 0.9396, test_loss: 1.3821, test_f1: 0.5349
 epoch: 99, train_loss: 0.9338, test_loss: 1.3722, test_f1: 0.5248
##################ITERATION #9 ****************************************
 epoch: 0, train_loss: 1.3986, test_loss: 1.3926, test_f1: 0.2281
 epoch: 1, train_loss: 1.3185, test_loss: 1.4059, test_f1: 0.3477
 epoch: 2, train_loss: 1.2920, test_loss: 1.3930, test_f1: 0.3145
 epoch: 3, train_loss: 1.2803, test_loss: 1.3771, test_f1: 0.2715
 epoch: 4, train_loss: 1.2792, test_loss: 1.3593, test_f1: 0.2857
 epoch: 5, train_loss: 1.2480, test_loss: 1.3432, test_f1: 0.2863
 epoch: 6, train_loss: 1.2409, test_loss: 1.3282, test_f1: 0.2980
 epoch: 7, train_loss: 1.2272, test_loss: 1.3108, test_f1: 0.3297
 epoch: 8, train_loss: 1.2319, test_loss: 1.2979, test_f1: 0.3070
 epoch: 9, train_loss: 1.2155, test_loss: 1.2868, test_f1: 0.3246
 epoch: 10, train_loss: 1.2135, test_loss: 1.2751, test_f1: 0.3385
 epoch: 11, train_loss: 1.2037, test_loss: 1.2671, test_f1: 0.3404
 epoch: 12, train_loss: 1.2010, test_loss: 1.2693, test_f1: 0.3628
 epoch: 13, train_loss: 1.1738, test_loss: 1.2696, test_f1: 0.3649
 epoch: 14, train_loss: 1.1897, test_loss: 1.2519, test_f1: 0.3720
 epoch: 15, train_loss: 1.1670, test_loss: 1.2568, test_f1: 0.3742
 epoch: 16, train_loss: 1.1533, test_loss: 1.2510, test_f1: 0.3716
 epoch: 17, train_loss: 1.1414, test_loss: 1.2265, test_f1: 0.3977
 epoch: 18, train_loss: 1.1392, test_loss: 1.2322, test_f1: 0.3846
 epoch: 19, train_loss: 1.1156, test_loss: 1.2512, test_f1: 0.3931
 epoch: 20, train_loss: 1.1156, test_loss: 1.2398, test_f1: 0.3862
 epoch: 21, train_loss: 1.1190, test_loss: 1.2347, test_f1: 0.3918
 epoch: 22, train_loss: 1.1037, test_loss: 1.2245, test_f1: 0.4066
 epoch: 23, train_loss: 1.0810, test_loss: 1.2438, test_f1: 0.3901
 epoch: 24, train_loss: 1.0986, test_loss: 1.2466, test_f1: 0.3936
 epoch: 25, train_loss: 1.0838, test_loss: 1.2300, test_f1: 0.4447
 epoch: 26, train_loss: 1.0668, test_loss: 1.2090, test_f1: 0.4520
 epoch: 27, train_loss: 1.0796, test_loss: 1.2172, test_f1: 0.4226
 epoch: 28, train_loss: 1.0664, test_loss: 1.2144, test_f1: 0.4163
 epoch: 29, train_loss: 1.0750, test_loss: 1.2271, test_f1: 0.4135
 epoch: 30, train_loss: 1.0420, test_loss: 1.2206, test_f1: 0.3929
 epoch: 31, train_loss: 1.0538, test_loss: 1.2280, test_f1: 0.4045
 epoch: 32, train_loss: 1.0391, test_loss: 1.2318, test_f1: 0.4083
 epoch: 33, train_loss: 1.0388, test_loss: 1.2394, test_f1: 0.4066
 epoch: 34, train_loss: 1.0463, test_loss: 1.2428, test_f1: 0.4264
 epoch: 35, train_loss: 1.0493, test_loss: 1.2417, test_f1: 0.4194
 epoch: 36, train_loss: 1.0455, test_loss: 1.2371, test_f1: 0.4377
 epoch: 37, train_loss: 1.0303, test_loss: 1.2417, test_f1: 0.4300
 epoch: 38, train_loss: 1.0349, test_loss: 1.2410, test_f1: 0.4318
 epoch: 39, train_loss: 1.0275, test_loss: 1.2579, test_f1: 0.4465
 epoch: 40, train_loss: 1.0296, test_loss: 1.2834, test_f1: 0.4388
 epoch: 41, train_loss: 1.0168, test_loss: 1.2764, test_f1: 0.4382
 epoch: 42, train_loss: 1.0079, test_loss: 1.2577, test_f1: 0.4523
 epoch: 43, train_loss: 1.0265, test_loss: 1.2572, test_f1: 0.4610
 epoch: 44, train_loss: 1.0124, test_loss: 1.2597, test_f1: 0.4550
 epoch: 45, train_loss: 1.0191, test_loss: 1.2611, test_f1: 0.4323
 epoch: 46, train_loss: 1.0094, test_loss: 1.3189, test_f1: 0.3837
 epoch: 47, train_loss: 1.0307, test_loss: 1.3081, test_f1: 0.4021
 epoch: 48, train_loss: 1.0109, test_loss: 1.2892, test_f1: 0.4567
 epoch: 49, train_loss: 1.0069, test_loss: 1.2973, test_f1: 0.4661
 epoch: 50, train_loss: 1.0044, test_loss: 1.2605, test_f1: 0.4635
 epoch: 51, train_loss: 0.9971, test_loss: 1.2544, test_f1: 0.4472
 epoch: 52, train_loss: 0.9927, test_loss: 1.2573, test_f1: 0.4427
 epoch: 53, train_loss: 0.9962, test_loss: 1.2655, test_f1: 0.4266
 epoch: 54, train_loss: 0.9944, test_loss: 1.2928, test_f1: 0.4172
 epoch: 55, train_loss: 0.9901, test_loss: 1.3003, test_f1: 0.4340
 epoch: 56, train_loss: 0.9890, test_loss: 1.2803, test_f1: 0.4429
 epoch: 57, train_loss: 0.9963, test_loss: 1.2683, test_f1: 0.4480
 epoch: 58, train_loss: 0.9893, test_loss: 1.2990, test_f1: 0.4498
 epoch: 59, train_loss: 0.9942, test_loss: 1.3020, test_f1: 0.4472
 epoch: 60, train_loss: 0.9885, test_loss: 1.3164, test_f1: 0.4336
 epoch: 61, train_loss: 0.9933, test_loss: 1.3258, test_f1: 0.4458
 epoch: 62, train_loss: 0.9765, test_loss: 1.3239, test_f1: 0.4621
 epoch: 63, train_loss: 0.9820, test_loss: 1.3130, test_f1: 0.4764
 epoch: 64, train_loss: 0.9888, test_loss: 1.2930, test_f1: 0.4612
 epoch: 65, train_loss: 0.9847, test_loss: 1.2902, test_f1: 0.4373
 epoch: 66, train_loss: 0.9789, test_loss: 1.3081, test_f1: 0.4315
 epoch: 67, train_loss: 0.9812, test_loss: 1.3170, test_f1: 0.4445
 epoch: 68, train_loss: 0.9820, test_loss: 1.3405, test_f1: 0.4452
 epoch: 69, train_loss: 0.9714, test_loss: 1.3694, test_f1: 0.4718
 epoch: 70, train_loss: 0.9764, test_loss: 1.3553, test_f1: 0.4601
 epoch: 71, train_loss: 0.9758, test_loss: 1.3373, test_f1: 0.4649
 epoch: 72, train_loss: 0.9763, test_loss: 1.3487, test_f1: 0.4667
 epoch: 73, train_loss: 0.9985, test_loss: 1.3681, test_f1: 0.4332
 epoch: 74, train_loss: 0.9824, test_loss: 1.3779, test_f1: 0.4561
 epoch: 75, train_loss: 0.9716, test_loss: 1.3796, test_f1: 0.4646
 epoch: 76, train_loss: 0.9755, test_loss: 1.3616, test_f1: 0.4732
 epoch: 77, train_loss: 0.9795, test_loss: 1.3801, test_f1: 0.4816
 epoch: 78, train_loss: 0.9726, test_loss: 1.3838, test_f1: 0.4864
 epoch: 79, train_loss: 0.9724, test_loss: 1.4100, test_f1: 0.4800
 epoch: 80, train_loss: 0.9662, test_loss: 1.3960, test_f1: 0.4727
 epoch: 81, train_loss: 0.9661, test_loss: 1.3692, test_f1: 0.4653
 epoch: 82, train_loss: 0.9688, test_loss: 1.3637, test_f1: 0.4668
 epoch: 83, train_loss: 0.9759, test_loss: 1.4063, test_f1: 0.4563
 epoch: 84, train_loss: 0.9575, test_loss: 1.4026, test_f1: 0.4581
 epoch: 85, train_loss: 0.9752, test_loss: 1.3736, test_f1: 0.4629
 epoch: 86, train_loss: 0.9556, test_loss: 1.3650, test_f1: 0.4500
 epoch: 87, train_loss: 0.9719, test_loss: 1.3874, test_f1: 0.4520
 epoch: 88, train_loss: 0.9713, test_loss: 1.4328, test_f1: 0.4385
 epoch: 89, train_loss: 0.9708, test_loss: 1.4420, test_f1: 0.4257
 epoch: 90, train_loss: 0.9556, test_loss: 1.3808, test_f1: 0.4598
 epoch: 91, train_loss: 0.9501, test_loss: 1.3440, test_f1: 0.4623
 epoch: 92, train_loss: 0.9609, test_loss: 1.3487, test_f1: 0.4675
 epoch: 93, train_loss: 0.9593, test_loss: 1.3635, test_f1: 0.4631
 epoch: 94, train_loss: 0.9646, test_loss: 1.3575, test_f1: 0.4749
 epoch: 95, train_loss: 0.9598, test_loss: 1.3553, test_f1: 0.4845
 epoch: 96, train_loss: 0.9548, test_loss: 1.3694, test_f1: 0.4723
 epoch: 97, train_loss: 0.9559, test_loss: 1.3873, test_f1: 0.4361
 epoch: 98, train_loss: 0.9545, test_loss: 1.3968, test_f1: 0.4503
 epoch: 99, train_loss: 0.9512, test_loss: 1.3990, test_f1: 0.4684

Training completed in 286.47 seconds
Best F1: 0.5496 at epoch 99
Mean F1 across iterations: 0.4837  0.0384
========================FINAL RESULTS================================
FEGIN weighted F1: 0.5496  0.0384
python main.py --data ltspice_demos --representation component_component --model FEGIN --layers 3 --hiddens 16 --batch_size 256 --lr 0.001 --emb_size 128 --epochs 100 --save_appendix component_component_L3_H16_BS256_LR0.001_E128 --no_val
-----



STDERR:
  File "main.py", line 370, in <module>
    main()
  File "main.py", line 254, in main
    dataset = dataset_class(
  File "/home/philip/projects/ltspice_examples_code_repo/Circuit-Completion-Using-GNNs/component_classification_with_link_prediction_head/evaluation/FEGIN/kernel/circuit_datasets.py", line 15, in __init__
    self.data, self.slices = torch.load(self.processed_paths[0])
  File "/home/philip/.local/lib/python3.8/site-packages/torch/serialization.py", line 1040, in load
    warnings.warn(
  File "/usr/lib/python3.8/warnings.py", line 109, in _showwarnmsg
    sw(msg.message, msg.category, msg.filename, msg.lineno,
  File "main.py", line 47, in warn_with_traceback
    traceback.print_stack(file=log)
/home/philip/projects/ltspice_examples_code_repo/Circuit-Completion-Using-GNNs/component_classification_with_link_prediction_head/evaluation/FEGIN/kernel/circuit_datasets.py:15: FutureWarning: You are using `torch.load` with `weights_only=False` (the current default value), which uses the default pickle module implicitly. It is possible to construct malicious pickle data which will execute arbitrary code during unpickling (See https://github.com/pytorch/pytorch/blob/main/SECURITY.md#untrusted-models for more details). In a future release, the default value for `weights_only` will be flipped to `True`. This limits the functions that could be executed during unpickling. Arbitrary objects will no longer be allowed to be loaded via this mode unless they are explicitly allowlisted by the user via `torch.serialization.add_safe_globals`. We recommend you start setting `weights_only=True` for any use case where you don't have full control of the loaded file. Please open an issue on GitHub for any issues related to this experimental feature.
  self.data, self.slices = torch.load(self.processed_paths[0])
