STDOUT:
Results will be saved in /home/philip/projects/ltspice_examples_code_repo/Circuit-Completion-Using-GNNs/component_classification_with_link_prediction_head/evaluation/FEGIN/results/model_FEGIN_dataset_ltspice_demos
Command line input: python main.py --data ltspice_demos --representation component_component --model FEGIN --layers 6 --hiddens 64 --batch_size 64 --lr 0.001 --emb_size 512 --epochs 100 --save_appendix component_component_L6_H64_BS64_LR0.001_E512 --no_val
 is saved.
-----
ltspice_demos - FEGIN
Using 6 layers, 64 hidden units, h = 2
Loading component_component representation dataset
ENTERED
Training FEGIN on component_component representation
Train: 1565, Test: 383
##################ITERATION #0 ****************************************
 epoch: 0, train_loss: 1.2752, test_loss: 1.2952, test_f1: 0.2281
 epoch: 1, train_loss: 1.1890, test_loss: 1.2550, test_f1: 0.3409
 epoch: 2, train_loss: 1.1534, test_loss: 1.2286, test_f1: 0.3747
 epoch: 3, train_loss: 1.1009, test_loss: 1.2089, test_f1: 0.3573
 epoch: 4, train_loss: 1.0706, test_loss: 1.2453, test_f1: 0.4277
 epoch: 5, train_loss: 1.0290, test_loss: 1.2220, test_f1: 0.4213
 epoch: 6, train_loss: 0.9972, test_loss: 1.2193, test_f1: 0.4312
 epoch: 7, train_loss: 0.9702, test_loss: 1.2495, test_f1: 0.4816
 epoch: 8, train_loss: 0.9374, test_loss: 1.2961, test_f1: 0.5273
 epoch: 9, train_loss: 0.8998, test_loss: 1.2579, test_f1: 0.4627
 epoch: 10, train_loss: 0.8968, test_loss: 1.2074, test_f1: 0.4913
 epoch: 11, train_loss: 0.8742, test_loss: 1.3659, test_f1: 0.5430
 epoch: 12, train_loss: 0.8350, test_loss: 1.2271, test_f1: 0.5134
 epoch: 13, train_loss: 0.8456, test_loss: 1.3479, test_f1: 0.4968
 epoch: 14, train_loss: 0.8207, test_loss: 1.1544, test_f1: 0.5121
 epoch: 15, train_loss: 0.8159, test_loss: 1.4038, test_f1: 0.5149
 epoch: 16, train_loss: 0.7854, test_loss: 1.3578, test_f1: 0.4997
 epoch: 17, train_loss: 0.7777, test_loss: 1.6802, test_f1: 0.4838
 epoch: 18, train_loss: 0.7943, test_loss: 1.5885, test_f1: 0.4845
 epoch: 19, train_loss: 0.7604, test_loss: 1.5363, test_f1: 0.5249
 epoch: 20, train_loss: 0.7359, test_loss: 1.5027, test_f1: 0.5035
 epoch: 21, train_loss: 0.6970, test_loss: 1.6379, test_f1: 0.5343
 epoch: 22, train_loss: 0.7121, test_loss: 1.8745, test_f1: 0.5260
 epoch: 23, train_loss: 0.6894, test_loss: 1.5150, test_f1: 0.5870
 epoch: 24, train_loss: 0.6756, test_loss: 1.5171, test_f1: 0.5602
 epoch: 25, train_loss: 0.6702, test_loss: 1.8436, test_f1: 0.4880
 epoch: 26, train_loss: 0.6425, test_loss: 1.9605, test_f1: 0.4847
 epoch: 27, train_loss: 0.6604, test_loss: 1.6210, test_f1: 0.5274
 epoch: 28, train_loss: 0.6353, test_loss: 1.7296, test_f1: 0.5020
 epoch: 29, train_loss: 0.6473, test_loss: 1.5144, test_f1: 0.5618
 epoch: 30, train_loss: 0.6322, test_loss: 1.7733, test_f1: 0.5481
 epoch: 31, train_loss: 0.6020, test_loss: 1.5694, test_f1: 0.5659
 epoch: 32, train_loss: 0.6308, test_loss: 1.5567, test_f1: 0.5530
 epoch: 33, train_loss: 0.5929, test_loss: 1.7795, test_f1: 0.4874
 epoch: 34, train_loss: 0.5839, test_loss: 1.5431, test_f1: 0.5749
 epoch: 35, train_loss: 0.5862, test_loss: 2.0571, test_f1: 0.4994
 epoch: 36, train_loss: 0.5596, test_loss: 1.7279, test_f1: 0.5202
 epoch: 37, train_loss: 0.5425, test_loss: 1.6975, test_f1: 0.5556
 epoch: 38, train_loss: 0.5411, test_loss: 1.8576, test_f1: 0.5016
 epoch: 39, train_loss: 0.5230, test_loss: 2.0137, test_f1: 0.4889
 epoch: 40, train_loss: 0.5544, test_loss: 1.8069, test_f1: 0.5234
 epoch: 41, train_loss: 0.5498, test_loss: 1.7836, test_f1: 0.5306
 epoch: 42, train_loss: 0.5270, test_loss: 2.0155, test_f1: 0.5104
 epoch: 43, train_loss: 0.5469, test_loss: 1.8984, test_f1: 0.4873
 epoch: 44, train_loss: 0.5066, test_loss: 2.2712, test_f1: 0.5340
 epoch: 45, train_loss: 0.4931, test_loss: 2.1872, test_f1: 0.5137
 epoch: 46, train_loss: 0.5053, test_loss: 1.9368, test_f1: 0.5197
 epoch: 47, train_loss: 0.4847, test_loss: 1.8858, test_f1: 0.5750
 epoch: 48, train_loss: 0.4620, test_loss: 2.2212, test_f1: 0.5501
 epoch: 49, train_loss: 0.4691, test_loss: 2.8002, test_f1: 0.5352
 epoch: 50, train_loss: 0.4701, test_loss: 2.1739, test_f1: 0.5360
 epoch: 51, train_loss: 0.4185, test_loss: 2.4484, test_f1: 0.5635
 epoch: 52, train_loss: 0.4076, test_loss: 2.4834, test_f1: 0.5407
 epoch: 53, train_loss: 0.3850, test_loss: 2.3352, test_f1: 0.5428
 epoch: 54, train_loss: 0.3797, test_loss: 2.2983, test_f1: 0.5104
 epoch: 55, train_loss: 0.3604, test_loss: 2.3145, test_f1: 0.5387
 epoch: 56, train_loss: 0.3659, test_loss: 2.3283, test_f1: 0.5481
 epoch: 57, train_loss: 0.3681, test_loss: 2.3703, test_f1: 0.5466
 epoch: 58, train_loss: 0.3776, test_loss: 2.7392, test_f1: 0.5226
 epoch: 59, train_loss: 0.3837, test_loss: 2.2418, test_f1: 0.5246
 epoch: 60, train_loss: 0.3754, test_loss: 2.1176, test_f1: 0.5475
 epoch: 61, train_loss: 0.3519, test_loss: 2.1926, test_f1: 0.5642
 epoch: 62, train_loss: 0.3721, test_loss: 2.1904, test_f1: 0.5762
 epoch: 63, train_loss: 0.3587, test_loss: 2.4339, test_f1: 0.5576
 epoch: 64, train_loss: 0.3772, test_loss: 2.6175, test_f1: 0.5636
 epoch: 65, train_loss: 0.3643, test_loss: 2.3478, test_f1: 0.5562
 epoch: 66, train_loss: 0.3494, test_loss: 2.2604, test_f1: 0.5636
 epoch: 67, train_loss: 0.3537, test_loss: 2.3761, test_f1: 0.5566
 epoch: 68, train_loss: 0.3462, test_loss: 2.3183, test_f1: 0.5357
 epoch: 69, train_loss: 0.3412, test_loss: 2.6015, test_f1: 0.5285
 epoch: 70, train_loss: 0.3243, test_loss: 2.5492, test_f1: 0.5431
 epoch: 71, train_loss: 0.3158, test_loss: 2.5726, test_f1: 0.5535
 epoch: 72, train_loss: 0.3046, test_loss: 2.4134, test_f1: 0.5441
 epoch: 73, train_loss: 0.3037, test_loss: 2.3061, test_f1: 0.5411
 epoch: 74, train_loss: 0.3121, test_loss: 2.7176, test_f1: 0.5567
 epoch: 75, train_loss: 0.3023, test_loss: 2.4814, test_f1: 0.5290
 epoch: 76, train_loss: 0.2739, test_loss: 2.7333, test_f1: 0.5672
 epoch: 77, train_loss: 0.3272, test_loss: 2.8414, test_f1: 0.5565
 epoch: 78, train_loss: 0.3060, test_loss: 3.0651, test_f1: 0.5513
 epoch: 79, train_loss: 0.3155, test_loss: 3.0452, test_f1: 0.5232
 epoch: 80, train_loss: 0.2877, test_loss: 3.0912, test_f1: 0.5516
 epoch: 81, train_loss: 0.2980, test_loss: 3.3273, test_f1: 0.5240
 epoch: 82, train_loss: 0.2712, test_loss: 2.7102, test_f1: 0.5710
 epoch: 83, train_loss: 0.2567, test_loss: 3.2220, test_f1: 0.5573
 epoch: 84, train_loss: 0.2755, test_loss: 3.2761, test_f1: 0.5673
 epoch: 85, train_loss: 0.2806, test_loss: 3.1318, test_f1: 0.5413
 epoch: 86, train_loss: 0.2796, test_loss: 3.0070, test_f1: 0.5582
 epoch: 87, train_loss: 0.2820, test_loss: 3.4651, test_f1: 0.5344
 epoch: 88, train_loss: 0.2976, test_loss: 2.9758, test_f1: 0.5253
 epoch: 89, train_loss: 0.2826, test_loss: 3.2689, test_f1: 0.5584
 epoch: 90, train_loss: 0.2652, test_loss: 2.8938, test_f1: 0.5543
 epoch: 91, train_loss: 0.2476, test_loss: 3.0342, test_f1: 0.5615
 epoch: 92, train_loss: 0.2428, test_loss: 3.3680, test_f1: 0.5632
 epoch: 93, train_loss: 0.2682, test_loss: 3.5172, test_f1: 0.5796
 epoch: 94, train_loss: 0.2737, test_loss: 2.9456, test_f1: 0.5569
 epoch: 95, train_loss: 0.2469, test_loss: 3.4152, test_f1: 0.5472
 epoch: 96, train_loss: 0.2542, test_loss: 3.1452, test_f1: 0.5684
 epoch: 97, train_loss: 0.2699, test_loss: 3.4102, test_f1: 0.5429
 epoch: 98, train_loss: 0.2540, test_loss: 3.3752, test_f1: 0.5573
 epoch: 99, train_loss: 0.2807, test_loss: 3.3260, test_f1: 0.5670
##################ITERATION #1 ****************************************
 epoch: 0, train_loss: 1.2050, test_loss: 1.2485, test_f1: 0.3064
 epoch: 1, train_loss: 1.1048, test_loss: 1.1669, test_f1: 0.4861
 epoch: 2, train_loss: 1.0394, test_loss: 1.1298, test_f1: 0.4900
 epoch: 3, train_loss: 0.9988, test_loss: 1.1110, test_f1: 0.5189
 epoch: 4, train_loss: 0.9769, test_loss: 1.1632, test_f1: 0.5047
 epoch: 5, train_loss: 0.9432, test_loss: 1.1753, test_f1: 0.4525
 epoch: 6, train_loss: 0.9205, test_loss: 1.1658, test_f1: 0.4972
 epoch: 7, train_loss: 0.8986, test_loss: 1.1017, test_f1: 0.5685
 epoch: 8, train_loss: 0.8707, test_loss: 1.1219, test_f1: 0.5376
 epoch: 9, train_loss: 0.8372, test_loss: 1.2027, test_f1: 0.5144
 epoch: 10, train_loss: 0.8382, test_loss: 1.1444, test_f1: 0.5635
 epoch: 11, train_loss: 0.8363, test_loss: 1.2952, test_f1: 0.5541
 epoch: 12, train_loss: 0.7951, test_loss: 1.3844, test_f1: 0.5119
 epoch: 13, train_loss: 0.7729, test_loss: 1.2740, test_f1: 0.5282
 epoch: 14, train_loss: 0.7777, test_loss: 1.2564, test_f1: 0.5725
 epoch: 15, train_loss: 0.7801, test_loss: 1.1589, test_f1: 0.5684
 epoch: 16, train_loss: 0.7436, test_loss: 1.2666, test_f1: 0.5549
 epoch: 17, train_loss: 0.7385, test_loss: 1.2518, test_f1: 0.5074
 epoch: 18, train_loss: 0.7607, test_loss: 1.3718, test_f1: 0.4984
 epoch: 19, train_loss: 0.7774, test_loss: 1.3273, test_f1: 0.5683
 epoch: 20, train_loss: 0.7090, test_loss: 1.4452, test_f1: 0.5515
 epoch: 21, train_loss: 0.7270, test_loss: 1.4482, test_f1: 0.5129
 epoch: 22, train_loss: 0.7143, test_loss: 1.3353, test_f1: 0.5774
 epoch: 23, train_loss: 0.7095, test_loss: 1.4930, test_f1: 0.5283
 epoch: 24, train_loss: 0.6814, test_loss: 1.4265, test_f1: 0.5319
 epoch: 25, train_loss: 0.6748, test_loss: 1.5389, test_f1: 0.5168
 epoch: 26, train_loss: 0.6437, test_loss: 1.4843, test_f1: 0.5603
 epoch: 27, train_loss: 0.6597, test_loss: 1.5714, test_f1: 0.5382
 epoch: 28, train_loss: 0.6463, test_loss: 1.6871, test_f1: 0.5403
 epoch: 29, train_loss: 0.6357, test_loss: 1.5771, test_f1: 0.5471
 epoch: 30, train_loss: 0.6303, test_loss: 1.6124, test_f1: 0.5596
 epoch: 31, train_loss: 0.6122, test_loss: 2.0285, test_f1: 0.5291
 epoch: 32, train_loss: 0.5908, test_loss: 2.1555, test_f1: 0.5665
 epoch: 33, train_loss: 0.5851, test_loss: 1.7197, test_f1: 0.5716
 epoch: 34, train_loss: 0.5769, test_loss: 2.0110, test_f1: 0.5519
 epoch: 35, train_loss: 0.6320, test_loss: 1.5561, test_f1: 0.5567
 epoch: 36, train_loss: 0.6200, test_loss: 1.6655, test_f1: 0.5307
 epoch: 37, train_loss: 0.5726, test_loss: 1.6669, test_f1: 0.4881
 epoch: 38, train_loss: 0.5444, test_loss: 2.1053, test_f1: 0.5473
 epoch: 39, train_loss: 0.5478, test_loss: 1.8033, test_f1: 0.5861
 epoch: 40, train_loss: 0.5527, test_loss: 1.6592, test_f1: 0.5788
 epoch: 41, train_loss: 0.5442, test_loss: 1.8547, test_f1: 0.5649
 epoch: 42, train_loss: 0.5322, test_loss: 1.7441, test_f1: 0.5850
 epoch: 43, train_loss: 0.5453, test_loss: 1.7894, test_f1: 0.5699
 epoch: 44, train_loss: 0.5306, test_loss: 2.2206, test_f1: 0.5155
 epoch: 45, train_loss: 0.5270, test_loss: 1.7366, test_f1: 0.5905
 epoch: 46, train_loss: 0.5096, test_loss: 2.4825, test_f1: 0.5605
 epoch: 47, train_loss: 0.5041, test_loss: 2.1169, test_f1: 0.5459
 epoch: 48, train_loss: 0.5358, test_loss: 1.8821, test_f1: 0.5975
 epoch: 49, train_loss: 0.5156, test_loss: 2.1418, test_f1: 0.5562
 epoch: 50, train_loss: 0.5042, test_loss: 2.0306, test_f1: 0.5492
 epoch: 51, train_loss: 0.4849, test_loss: 1.9508, test_f1: 0.5515
 epoch: 52, train_loss: 0.4155, test_loss: 1.9640, test_f1: 0.5833
 epoch: 53, train_loss: 0.4135, test_loss: 2.1487, test_f1: 0.5721
 epoch: 54, train_loss: 0.4191, test_loss: 2.3934, test_f1: 0.5436
 epoch: 55, train_loss: 0.3980, test_loss: 2.4045, test_f1: 0.5406
 epoch: 56, train_loss: 0.3840, test_loss: 2.2720, test_f1: 0.5773
 epoch: 57, train_loss: 0.3658, test_loss: 2.4697, test_f1: 0.5777
 epoch: 58, train_loss: 0.3705, test_loss: 2.6479, test_f1: 0.5847
 epoch: 59, train_loss: 0.3847, test_loss: 2.5561, test_f1: 0.5658
 epoch: 60, train_loss: 0.3974, test_loss: 2.6946, test_f1: 0.5976
 epoch: 61, train_loss: 0.3875, test_loss: 2.4220, test_f1: 0.5598
 epoch: 62, train_loss: 0.3683, test_loss: 2.5553, test_f1: 0.5744
 epoch: 63, train_loss: 0.3564, test_loss: 2.6377, test_f1: 0.5759
 epoch: 64, train_loss: 0.3665, test_loss: 2.4867, test_f1: 0.5356
 epoch: 65, train_loss: 0.3560, test_loss: 2.4828, test_f1: 0.5513
 epoch: 66, train_loss: 0.3509, test_loss: 2.6375, test_f1: 0.5498
 epoch: 67, train_loss: 0.3516, test_loss: 2.6315, test_f1: 0.5421
 epoch: 68, train_loss: 0.3722, test_loss: 2.5444, test_f1: 0.5369
 epoch: 69, train_loss: 0.3444, test_loss: 2.4555, test_f1: 0.5729
 epoch: 70, train_loss: 0.3648, test_loss: 2.9293, test_f1: 0.5429
 epoch: 71, train_loss: 0.3492, test_loss: 2.7852, test_f1: 0.5606
 epoch: 72, train_loss: 0.3257, test_loss: 2.5493, test_f1: 0.5634
 epoch: 73, train_loss: 0.3244, test_loss: 2.8764, test_f1: 0.5890
 epoch: 74, train_loss: 0.3491, test_loss: 2.5657, test_f1: 0.5632
 epoch: 75, train_loss: 0.3448, test_loss: 3.1123, test_f1: 0.5559
 epoch: 76, train_loss: 0.3487, test_loss: 2.9324, test_f1: 0.5939
 epoch: 77, train_loss: 0.3451, test_loss: 3.6759, test_f1: 0.5939
 epoch: 78, train_loss: 0.3383, test_loss: 2.6683, test_f1: 0.5889
 epoch: 79, train_loss: 0.3094, test_loss: 2.5706, test_f1: 0.5654
 epoch: 80, train_loss: 0.3075, test_loss: 3.1075, test_f1: 0.5614
 epoch: 81, train_loss: 0.2970, test_loss: 2.8107, test_f1: 0.5514
 epoch: 82, train_loss: 0.3030, test_loss: 2.8586, test_f1: 0.5667
 epoch: 83, train_loss: 0.3208, test_loss: 2.9326, test_f1: 0.5607
 epoch: 84, train_loss: 0.2829, test_loss: 3.0893, test_f1: 0.5638
 epoch: 85, train_loss: 0.2929, test_loss: 3.1510, test_f1: 0.5775
 epoch: 86, train_loss: 0.3108, test_loss: 3.3425, test_f1: 0.5373
 epoch: 87, train_loss: 0.2974, test_loss: 2.9100, test_f1: 0.5564
 epoch: 88, train_loss: 0.2693, test_loss: 3.1214, test_f1: 0.5770
 epoch: 89, train_loss: 0.2857, test_loss: 2.8878, test_f1: 0.5852
 epoch: 90, train_loss: 0.2784, test_loss: 2.8506, test_f1: 0.5976
 epoch: 91, train_loss: 0.2693, test_loss: 2.9990, test_f1: 0.5585
 epoch: 92, train_loss: 0.2787, test_loss: 3.0045, test_f1: 0.5721
 epoch: 93, train_loss: 0.2618, test_loss: 3.1220, test_f1: 0.5810
 epoch: 94, train_loss: 0.2797, test_loss: 3.0467, test_f1: 0.5530
 epoch: 95, train_loss: 0.3143, test_loss: 2.9288, test_f1: 0.5941
 epoch: 96, train_loss: 0.2965, test_loss: 3.0179, test_f1: 0.5482
 epoch: 97, train_loss: 0.2959, test_loss: 3.0056, test_f1: 0.5329
 epoch: 98, train_loss: 0.2663, test_loss: 3.3355, test_f1: 0.5411
 epoch: 99, train_loss: 0.2893, test_loss: 2.9061, test_f1: 0.5772
##################ITERATION #2 ****************************************
 epoch: 0, train_loss: 1.2163, test_loss: 1.3209, test_f1: 0.3126
 epoch: 1, train_loss: 1.1387, test_loss: 1.1994, test_f1: 0.4045
 epoch: 2, train_loss: 1.0893, test_loss: 1.1834, test_f1: 0.4603
 epoch: 3, train_loss: 1.0536, test_loss: 1.2071, test_f1: 0.4975
 epoch: 4, train_loss: 0.9951, test_loss: 1.1940, test_f1: 0.5376
 epoch: 5, train_loss: 0.9752, test_loss: 1.2627, test_f1: 0.5344
 epoch: 6, train_loss: 0.9624, test_loss: 1.2059, test_f1: 0.5311
 epoch: 7, train_loss: 0.9328, test_loss: 1.1620, test_f1: 0.5986
 epoch: 8, train_loss: 0.8915, test_loss: 1.1772, test_f1: 0.5737
 epoch: 9, train_loss: 0.8666, test_loss: 1.0746, test_f1: 0.6086
 epoch: 10, train_loss: 0.8848, test_loss: 1.1831, test_f1: 0.5393
 epoch: 11, train_loss: 0.8405, test_loss: 1.1501, test_f1: 0.5929
 epoch: 12, train_loss: 0.8119, test_loss: 1.1734, test_f1: 0.5465
 epoch: 13, train_loss: 0.8049, test_loss: 1.2184, test_f1: 0.5642
 epoch: 14, train_loss: 0.8063, test_loss: 1.2142, test_f1: 0.5641
 epoch: 15, train_loss: 0.7852, test_loss: 1.2384, test_f1: 0.5782
 epoch: 16, train_loss: 0.7824, test_loss: 1.0734, test_f1: 0.6370
 epoch: 17, train_loss: 0.7300, test_loss: 1.1911, test_f1: 0.5798
 epoch: 18, train_loss: 0.7515, test_loss: 1.0919, test_f1: 0.6301
 epoch: 19, train_loss: 0.7168, test_loss: 1.1970, test_f1: 0.5798
 epoch: 20, train_loss: 0.6949, test_loss: 1.1235, test_f1: 0.6272
 epoch: 21, train_loss: 0.7020, test_loss: 1.3690, test_f1: 0.5361
 epoch: 22, train_loss: 0.7121, test_loss: 1.2531, test_f1: 0.5848
 epoch: 23, train_loss: 0.6481, test_loss: 1.2659, test_f1: 0.5606
 epoch: 24, train_loss: 0.6556, test_loss: 1.2849, test_f1: 0.6106
 epoch: 25, train_loss: 0.6739, test_loss: 1.3696, test_f1: 0.5960
 epoch: 26, train_loss: 0.6590, test_loss: 1.3192, test_f1: 0.6184
 epoch: 27, train_loss: 0.6390, test_loss: 1.5487, test_f1: 0.6194
 epoch: 28, train_loss: 0.6300, test_loss: 1.3298, test_f1: 0.5945
 epoch: 29, train_loss: 0.6119, test_loss: 1.5837, test_f1: 0.5823
 epoch: 30, train_loss: 0.5943, test_loss: 1.5901, test_f1: 0.5988
 epoch: 31, train_loss: 0.6306, test_loss: 1.5518, test_f1: 0.5784
 epoch: 32, train_loss: 0.6398, test_loss: 1.7459, test_f1: 0.5668
 epoch: 33, train_loss: 0.6163, test_loss: 1.3955, test_f1: 0.6066
 epoch: 34, train_loss: 0.5768, test_loss: 1.5854, test_f1: 0.6032
 epoch: 35, train_loss: 0.5635, test_loss: 1.6120, test_f1: 0.5683
 epoch: 36, train_loss: 0.6051, test_loss: 1.3338, test_f1: 0.6156
 epoch: 37, train_loss: 0.6109, test_loss: 1.4589, test_f1: 0.6233
 epoch: 38, train_loss: 0.5711, test_loss: 1.5225, test_f1: 0.5266
 epoch: 39, train_loss: 0.5514, test_loss: 1.5053, test_f1: 0.5825
 epoch: 40, train_loss: 0.5352, test_loss: 1.7915, test_f1: 0.5940
 epoch: 41, train_loss: 0.5721, test_loss: 1.6332, test_f1: 0.5423
 epoch: 42, train_loss: 0.5494, test_loss: 1.6986, test_f1: 0.5858
 epoch: 43, train_loss: 0.5143, test_loss: 1.7282, test_f1: 0.5936
 epoch: 44, train_loss: 0.5144, test_loss: 1.8699, test_f1: 0.5663
 epoch: 45, train_loss: 0.5172, test_loss: 2.1464, test_f1: 0.5311
 epoch: 46, train_loss: 0.5239, test_loss: 1.7782, test_f1: 0.5703
 epoch: 47, train_loss: 0.4675, test_loss: 1.9290, test_f1: 0.5381
 epoch: 48, train_loss: 0.5134, test_loss: 2.0582, test_f1: 0.5776
 epoch: 49, train_loss: 0.5035, test_loss: 1.7397, test_f1: 0.6435
 epoch: 50, train_loss: 0.5203, test_loss: 2.0873, test_f1: 0.4958
 epoch: 51, train_loss: 0.4527, test_loss: 1.5896, test_f1: 0.6108
 epoch: 52, train_loss: 0.4223, test_loss: 1.6900, test_f1: 0.5796
 epoch: 53, train_loss: 0.4132, test_loss: 1.7994, test_f1: 0.5945
 epoch: 54, train_loss: 0.4000, test_loss: 1.9391, test_f1: 0.5722
 epoch: 55, train_loss: 0.4162, test_loss: 1.9816, test_f1: 0.5868
 epoch: 56, train_loss: 0.3988, test_loss: 1.9843, test_f1: 0.5571
 epoch: 57, train_loss: 0.3852, test_loss: 1.9393, test_f1: 0.5735
 epoch: 58, train_loss: 0.3858, test_loss: 1.9926, test_f1: 0.5964
 epoch: 59, train_loss: 0.3674, test_loss: 2.1692, test_f1: 0.5709
 epoch: 60, train_loss: 0.3813, test_loss: 2.2341, test_f1: 0.5534
 epoch: 61, train_loss: 0.3732, test_loss: 2.0771, test_f1: 0.5856
 epoch: 62, train_loss: 0.3665, test_loss: 2.1379, test_f1: 0.5902
 epoch: 63, train_loss: 0.3733, test_loss: 2.2500, test_f1: 0.5603
 epoch: 64, train_loss: 0.3609, test_loss: 2.3006, test_f1: 0.5557
 epoch: 65, train_loss: 0.3826, test_loss: 2.2269, test_f1: 0.5730
 epoch: 66, train_loss: 0.3576, test_loss: 2.1558, test_f1: 0.5781
 epoch: 67, train_loss: 0.3383, test_loss: 2.1669, test_f1: 0.5652
 epoch: 68, train_loss: 0.3428, test_loss: 2.1934, test_f1: 0.5921
 epoch: 69, train_loss: 0.3504, test_loss: 2.3804, test_f1: 0.5620
 epoch: 70, train_loss: 0.3681, test_loss: 2.3524, test_f1: 0.5719
 epoch: 71, train_loss: 0.3449, test_loss: 2.1639, test_f1: 0.5961
 epoch: 72, train_loss: 0.3512, test_loss: 2.1308, test_f1: 0.5946
 epoch: 73, train_loss: 0.3215, test_loss: 2.3433, test_f1: 0.5807
 epoch: 74, train_loss: 0.3385, test_loss: 2.2293, test_f1: 0.5905
 epoch: 75, train_loss: 0.3357, test_loss: 2.1723, test_f1: 0.6074
 epoch: 76, train_loss: 0.3426, test_loss: 2.2524, test_f1: 0.5813
 epoch: 77, train_loss: 0.3179, test_loss: 2.4406, test_f1: 0.5643
 epoch: 78, train_loss: 0.3088, test_loss: 2.4173, test_f1: 0.5779
 epoch: 79, train_loss: 0.3291, test_loss: 2.2699, test_f1: 0.6052
 epoch: 80, train_loss: 0.3328, test_loss: 2.3172, test_f1: 0.5890
 epoch: 81, train_loss: 0.3122, test_loss: 2.4395, test_f1: 0.5901
 epoch: 82, train_loss: 0.2960, test_loss: 2.6244, test_f1: 0.5597
 epoch: 83, train_loss: 0.3599, test_loss: 2.4432, test_f1: 0.6073
 epoch: 84, train_loss: 0.3124, test_loss: 2.9543, test_f1: 0.6061
 epoch: 85, train_loss: 0.3302, test_loss: 2.8187, test_f1: 0.5376
 epoch: 86, train_loss: 0.3041, test_loss: 2.7636, test_f1: 0.5637
 epoch: 87, train_loss: 0.3268, test_loss: 2.4380, test_f1: 0.6361
 epoch: 88, train_loss: 0.2938, test_loss: 2.5830, test_f1: 0.5563
 epoch: 89, train_loss: 0.2956, test_loss: 2.7351, test_f1: 0.5657
 epoch: 90, train_loss: 0.3090, test_loss: 2.6622, test_f1: 0.5574
 epoch: 91, train_loss: 0.2849, test_loss: 2.8338, test_f1: 0.5733
 epoch: 92, train_loss: 0.2972, test_loss: 2.7167, test_f1: 0.5696
 epoch: 93, train_loss: 0.3008, test_loss: 2.6635, test_f1: 0.5905
 epoch: 94, train_loss: 0.2765, test_loss: 2.6450, test_f1: 0.5730
 epoch: 95, train_loss: 0.2685, test_loss: 2.7243, test_f1: 0.5906
 epoch: 96, train_loss: 0.2866, test_loss: 2.7330, test_f1: 0.5462
 epoch: 97, train_loss: 0.3050, test_loss: 2.5942, test_f1: 0.5808
 epoch: 98, train_loss: 0.2907, test_loss: 2.9177, test_f1: 0.5819
 epoch: 99, train_loss: 0.2817, test_loss: 3.0096, test_f1: 0.5599
##################ITERATION #3 ****************************************
 epoch: 0, train_loss: 1.2652, test_loss: 1.2986, test_f1: 0.3613
 epoch: 1, train_loss: 1.1687, test_loss: 1.1752, test_f1: 0.5122
 epoch: 2, train_loss: 1.1204, test_loss: 1.2204, test_f1: 0.4787
 epoch: 3, train_loss: 1.0938, test_loss: 1.1704, test_f1: 0.5059
 epoch: 4, train_loss: 1.0529, test_loss: 1.1615, test_f1: 0.4955
 epoch: 5, train_loss: 1.0142, test_loss: 1.1583, test_f1: 0.5172
 epoch: 6, train_loss: 0.9729, test_loss: 1.2407, test_f1: 0.5271
 epoch: 7, train_loss: 0.9529, test_loss: 1.1882, test_f1: 0.5682
 epoch: 8, train_loss: 0.9334, test_loss: 1.2381, test_f1: 0.5037
 epoch: 9, train_loss: 0.9268, test_loss: 1.2841, test_f1: 0.5216
 epoch: 10, train_loss: 0.9146, test_loss: 1.1972, test_f1: 0.5453
 epoch: 11, train_loss: 0.8757, test_loss: 1.3168, test_f1: 0.5590
 epoch: 12, train_loss: 0.8523, test_loss: 1.3264, test_f1: 0.5313
 epoch: 13, train_loss: 0.8468, test_loss: 1.2979, test_f1: 0.5658
 epoch: 14, train_loss: 0.8317, test_loss: 1.3475, test_f1: 0.5142
 epoch: 15, train_loss: 0.8308, test_loss: 1.4711, test_f1: 0.5212
 epoch: 16, train_loss: 0.8243, test_loss: 1.3589, test_f1: 0.5711
 epoch: 17, train_loss: 0.8052, test_loss: 1.2429, test_f1: 0.5443
 epoch: 18, train_loss: 0.8007, test_loss: 1.3106, test_f1: 0.5548
 epoch: 19, train_loss: 0.7725, test_loss: 1.2714, test_f1: 0.5717
 epoch: 20, train_loss: 0.7731, test_loss: 1.3440, test_f1: 0.5334
 epoch: 21, train_loss: 0.7589, test_loss: 1.3512, test_f1: 0.5524
 epoch: 22, train_loss: 0.7681, test_loss: 1.3635, test_f1: 0.5700
 epoch: 23, train_loss: 0.7636, test_loss: 1.3370, test_f1: 0.5571
 epoch: 24, train_loss: 0.7266, test_loss: 1.3519, test_f1: 0.5747
 epoch: 25, train_loss: 0.7412, test_loss: 1.3138, test_f1: 0.5467
 epoch: 26, train_loss: 0.7029, test_loss: 1.4367, test_f1: 0.5653
 epoch: 27, train_loss: 0.6808, test_loss: 1.4521, test_f1: 0.5880
 epoch: 28, train_loss: 0.7027, test_loss: 1.4177, test_f1: 0.5728
 epoch: 29, train_loss: 0.6775, test_loss: 1.4501, test_f1: 0.5693
 epoch: 30, train_loss: 0.6720, test_loss: 1.5938, test_f1: 0.5399
 epoch: 31, train_loss: 0.6400, test_loss: 1.3235, test_f1: 0.5966
 epoch: 32, train_loss: 0.6537, test_loss: 1.4564, test_f1: 0.5808
 epoch: 33, train_loss: 0.6577, test_loss: 1.4686, test_f1: 0.5587
 epoch: 34, train_loss: 0.6535, test_loss: 1.6967, test_f1: 0.5833
 epoch: 35, train_loss: 0.6287, test_loss: 1.4740, test_f1: 0.5449
 epoch: 36, train_loss: 0.6444, test_loss: 1.5470, test_f1: 0.5360
 epoch: 37, train_loss: 0.6031, test_loss: 1.7682, test_f1: 0.5695
 epoch: 38, train_loss: 0.5894, test_loss: 1.8261, test_f1: 0.5601
 epoch: 39, train_loss: 0.5933, test_loss: 1.4902, test_f1: 0.5996
 epoch: 40, train_loss: 0.5684, test_loss: 1.5920, test_f1: 0.5567
 epoch: 41, train_loss: 0.6293, test_loss: 1.7269, test_f1: 0.5926
 epoch: 42, train_loss: 0.6263, test_loss: 1.9210, test_f1: 0.5470
 epoch: 43, train_loss: 0.5722, test_loss: 1.6843, test_f1: 0.5234
 epoch: 44, train_loss: 0.5643, test_loss: 1.6300, test_f1: 0.5680
 epoch: 45, train_loss: 0.5708, test_loss: 1.8473, test_f1: 0.5288
 epoch: 46, train_loss: 0.5426, test_loss: 1.7918, test_f1: 0.5404
 epoch: 47, train_loss: 0.5497, test_loss: 1.8065, test_f1: 0.5692
 epoch: 48, train_loss: 0.5459, test_loss: 1.6497, test_f1: 0.5589
 epoch: 49, train_loss: 0.5184, test_loss: 1.8167, test_f1: 0.5358
 epoch: 50, train_loss: 0.5637, test_loss: 1.8436, test_f1: 0.5332
 epoch: 51, train_loss: 0.4987, test_loss: 1.7704, test_f1: 0.5693
 epoch: 52, train_loss: 0.4751, test_loss: 1.7369, test_f1: 0.5704
 epoch: 53, train_loss: 0.4744, test_loss: 1.8514, test_f1: 0.5517
 epoch: 54, train_loss: 0.4584, test_loss: 1.9814, test_f1: 0.5803
 epoch: 55, train_loss: 0.4202, test_loss: 2.0096, test_f1: 0.5660
 epoch: 56, train_loss: 0.4293, test_loss: 2.0322, test_f1: 0.5537
 epoch: 57, train_loss: 0.4206, test_loss: 2.1267, test_f1: 0.5636
 epoch: 58, train_loss: 0.4212, test_loss: 2.3102, test_f1: 0.5484
 epoch: 59, train_loss: 0.4338, test_loss: 2.1178, test_f1: 0.5358
 epoch: 60, train_loss: 0.4361, test_loss: 2.1876, test_f1: 0.5611
 epoch: 61, train_loss: 0.4131, test_loss: 2.1297, test_f1: 0.5833
 epoch: 62, train_loss: 0.4158, test_loss: 2.2907, test_f1: 0.5420
 epoch: 63, train_loss: 0.4051, test_loss: 2.2564, test_f1: 0.5295
 epoch: 64, train_loss: 0.4023, test_loss: 2.3995, test_f1: 0.5312
 epoch: 65, train_loss: 0.4025, test_loss: 2.4208, test_f1: 0.5579
 epoch: 66, train_loss: 0.4072, test_loss: 2.4956, test_f1: 0.5525
 epoch: 67, train_loss: 0.3912, test_loss: 2.4880, test_f1: 0.5520
 epoch: 68, train_loss: 0.4170, test_loss: 2.5024, test_f1: 0.5676
 epoch: 69, train_loss: 0.3845, test_loss: 2.4076, test_f1: 0.5633
 epoch: 70, train_loss: 0.3726, test_loss: 2.4855, test_f1: 0.5543
 epoch: 71, train_loss: 0.3788, test_loss: 2.3421, test_f1: 0.5555
 epoch: 72, train_loss: 0.3791, test_loss: 2.4720, test_f1: 0.5351
 epoch: 73, train_loss: 0.3665, test_loss: 2.7038, test_f1: 0.5351
 epoch: 74, train_loss: 0.3637, test_loss: 2.3901, test_f1: 0.5415
 epoch: 75, train_loss: 0.3934, test_loss: 3.0839, test_f1: 0.5507
 epoch: 76, train_loss: 0.3954, test_loss: 2.6476, test_f1: 0.5360
 epoch: 77, train_loss: 0.3882, test_loss: 2.7450, test_f1: 0.5229
 epoch: 78, train_loss: 0.4066, test_loss: 2.7203, test_f1: 0.5672
 epoch: 79, train_loss: 0.3901, test_loss: 2.3656, test_f1: 0.5726
 epoch: 80, train_loss: 0.3797, test_loss: 2.3094, test_f1: 0.5530
 epoch: 81, train_loss: 0.3631, test_loss: 2.6107, test_f1: 0.5485
 epoch: 82, train_loss: 0.3475, test_loss: 2.5878, test_f1: 0.5574
 epoch: 83, train_loss: 0.3609, test_loss: 3.0232, test_f1: 0.5359
 epoch: 84, train_loss: 0.3430, test_loss: 2.8095, test_f1: 0.5690
 epoch: 85, train_loss: 0.3405, test_loss: 3.1366, test_f1: 0.5244
 epoch: 86, train_loss: 0.3345, test_loss: 2.6604, test_f1: 0.5626
 epoch: 87, train_loss: 0.3487, test_loss: 3.0870, test_f1: 0.5780
 epoch: 88, train_loss: 0.3170, test_loss: 2.6964, test_f1: 0.5678
 epoch: 89, train_loss: 0.3226, test_loss: 2.8025, test_f1: 0.5405
 epoch: 90, train_loss: 0.3457, test_loss: 2.7672, test_f1: 0.5366
 epoch: 91, train_loss: 0.3622, test_loss: 2.7154, test_f1: 0.5870
 epoch: 92, train_loss: 0.3389, test_loss: 2.8225, test_f1: 0.5664
 epoch: 93, train_loss: 0.3383, test_loss: 2.9161, test_f1: 0.5704
 epoch: 94, train_loss: 0.3159, test_loss: 2.5985, test_f1: 0.5459
 epoch: 95, train_loss: 0.2955, test_loss: 2.7266, test_f1: 0.5540
 epoch: 96, train_loss: 0.2946, test_loss: 2.7729, test_f1: 0.5773
 epoch: 97, train_loss: 0.3105, test_loss: 2.7486, test_f1: 0.5897
 epoch: 98, train_loss: 0.3162, test_loss: 2.9981, test_f1: 0.5359
 epoch: 99, train_loss: 0.3220, test_loss: 3.1254, test_f1: 0.5768
##################ITERATION #4 ****************************************
 epoch: 0, train_loss: 1.2812, test_loss: 1.3249, test_f1: 0.3303
 epoch: 1, train_loss: 1.1392, test_loss: 1.2824, test_f1: 0.4755
 epoch: 2, train_loss: 1.0914, test_loss: 1.1954, test_f1: 0.5516
 epoch: 3, train_loss: 1.0490, test_loss: 1.2012, test_f1: 0.4967
 epoch: 4, train_loss: 1.0316, test_loss: 1.1663, test_f1: 0.5252
 epoch: 5, train_loss: 0.9659, test_loss: 1.1232, test_f1: 0.5643
 epoch: 6, train_loss: 0.9271, test_loss: 1.1040, test_f1: 0.4978
 epoch: 7, train_loss: 0.9199, test_loss: 1.1628, test_f1: 0.5005
 epoch: 8, train_loss: 0.8912, test_loss: 1.2039, test_f1: 0.5403
 epoch: 9, train_loss: 0.9065, test_loss: 1.2397, test_f1: 0.4849
 epoch: 10, train_loss: 0.8409, test_loss: 1.2686, test_f1: 0.5077
 epoch: 11, train_loss: 0.8404, test_loss: 1.2377, test_f1: 0.5423
 epoch: 12, train_loss: 0.8371, test_loss: 1.3419, test_f1: 0.4985
 epoch: 13, train_loss: 0.8124, test_loss: 1.1679, test_f1: 0.5820
 epoch: 14, train_loss: 0.8187, test_loss: 1.2922, test_f1: 0.5428
 epoch: 15, train_loss: 0.8032, test_loss: 1.2227, test_f1: 0.5529
 epoch: 16, train_loss: 0.7840, test_loss: 1.3397, test_f1: 0.5665
 epoch: 17, train_loss: 0.7641, test_loss: 1.4350, test_f1: 0.5207
 epoch: 18, train_loss: 0.7540, test_loss: 1.1531, test_f1: 0.5710
 epoch: 19, train_loss: 0.7579, test_loss: 1.2854, test_f1: 0.5678
 epoch: 20, train_loss: 0.7443, test_loss: 1.3653, test_f1: 0.5572
 epoch: 21, train_loss: 0.7463, test_loss: 1.2876, test_f1: 0.5708
 epoch: 22, train_loss: 0.7120, test_loss: 1.2549, test_f1: 0.5727
 epoch: 23, train_loss: 0.7009, test_loss: 1.3905, test_f1: 0.5216
 epoch: 24, train_loss: 0.6759, test_loss: 1.2174, test_f1: 0.6024
 epoch: 25, train_loss: 0.6693, test_loss: 1.1639, test_f1: 0.5912
 epoch: 26, train_loss: 0.6599, test_loss: 1.4973, test_f1: 0.5457
 epoch: 27, train_loss: 0.6841, test_loss: 1.5029, test_f1: 0.5825
 epoch: 28, train_loss: 0.6764, test_loss: 1.5296, test_f1: 0.5091
 epoch: 29, train_loss: 0.6573, test_loss: 1.3864, test_f1: 0.5790
 epoch: 30, train_loss: 0.6464, test_loss: 1.4905, test_f1: 0.5459
 epoch: 31, train_loss: 0.6479, test_loss: 1.5436, test_f1: 0.5012
 epoch: 32, train_loss: 0.6118, test_loss: 1.6730, test_f1: 0.5382
 epoch: 33, train_loss: 0.6507, test_loss: 1.5162, test_f1: 0.5292
 epoch: 34, train_loss: 0.6401, test_loss: 1.4757, test_f1: 0.5445
 epoch: 35, train_loss: 0.6157, test_loss: 1.5526, test_f1: 0.5675
 epoch: 36, train_loss: 0.5934, test_loss: 1.5233, test_f1: 0.5631
 epoch: 37, train_loss: 0.6078, test_loss: 1.5599, test_f1: 0.5944
 epoch: 38, train_loss: 0.5912, test_loss: 1.5875, test_f1: 0.5501
 epoch: 39, train_loss: 0.5820, test_loss: 1.6407, test_f1: 0.5404
 epoch: 40, train_loss: 0.5843, test_loss: 1.9281, test_f1: 0.5367
 epoch: 41, train_loss: 0.5660, test_loss: 1.6633, test_f1: 0.5857
 epoch: 42, train_loss: 0.5826, test_loss: 1.6243, test_f1: 0.5812
 epoch: 43, train_loss: 0.5603, test_loss: 1.6329, test_f1: 0.5484
 epoch: 44, train_loss: 0.5446, test_loss: 1.7601, test_f1: 0.5744
 epoch: 45, train_loss: 0.5279, test_loss: 1.6881, test_f1: 0.5924
 epoch: 46, train_loss: 0.5092, test_loss: 1.9891, test_f1: 0.5837
 epoch: 47, train_loss: 0.5197, test_loss: 1.8294, test_f1: 0.5670
 epoch: 48, train_loss: 0.5002, test_loss: 1.8030, test_f1: 0.5820
 epoch: 49, train_loss: 0.5276, test_loss: 2.2162, test_f1: 0.4967
 epoch: 50, train_loss: 0.5580, test_loss: 1.6373, test_f1: 0.5879
 epoch: 51, train_loss: 0.4890, test_loss: 1.7725, test_f1: 0.5867
 epoch: 52, train_loss: 0.4471, test_loss: 1.6890, test_f1: 0.6118
 epoch: 53, train_loss: 0.4433, test_loss: 1.7721, test_f1: 0.5776
 epoch: 54, train_loss: 0.4385, test_loss: 1.8275, test_f1: 0.5938
 epoch: 55, train_loss: 0.4299, test_loss: 1.9261, test_f1: 0.5608
 epoch: 56, train_loss: 0.4240, test_loss: 1.8090, test_f1: 0.6074
 epoch: 57, train_loss: 0.4170, test_loss: 1.8687, test_f1: 0.5839
 epoch: 58, train_loss: 0.4149, test_loss: 2.1082, test_f1: 0.5733
 epoch: 59, train_loss: 0.3990, test_loss: 2.1451, test_f1: 0.5881
 epoch: 60, train_loss: 0.4305, test_loss: 1.9815, test_f1: 0.5890
 epoch: 61, train_loss: 0.3993, test_loss: 2.0055, test_f1: 0.5882
 epoch: 62, train_loss: 0.3936, test_loss: 2.0610, test_f1: 0.5684
 epoch: 63, train_loss: 0.4041, test_loss: 1.9150, test_f1: 0.5706
 epoch: 64, train_loss: 0.4187, test_loss: 1.9541, test_f1: 0.5666
 epoch: 65, train_loss: 0.3954, test_loss: 1.9421, test_f1: 0.5614
 epoch: 66, train_loss: 0.3813, test_loss: 1.9968, test_f1: 0.5863
 epoch: 67, train_loss: 0.4122, test_loss: 2.0192, test_f1: 0.5804
 epoch: 68, train_loss: 0.3977, test_loss: 1.9448, test_f1: 0.5858
 epoch: 69, train_loss: 0.3643, test_loss: 2.0371, test_f1: 0.5792
 epoch: 70, train_loss: 0.3812, test_loss: 2.3090, test_f1: 0.5926
 epoch: 71, train_loss: 0.3692, test_loss: 2.2219, test_f1: 0.5928
 epoch: 72, train_loss: 0.3387, test_loss: 2.2824, test_f1: 0.5567
 epoch: 73, train_loss: 0.3715, test_loss: 2.3050, test_f1: 0.5822
 epoch: 74, train_loss: 0.3840, test_loss: 2.1187, test_f1: 0.5897
 epoch: 75, train_loss: 0.3692, test_loss: 2.3177, test_f1: 0.5556
 epoch: 76, train_loss: 0.3364, test_loss: 2.2972, test_f1: 0.5576
 epoch: 77, train_loss: 0.3963, test_loss: 2.3356, test_f1: 0.5880
 epoch: 78, train_loss: 0.3618, test_loss: 2.3278, test_f1: 0.5804
 epoch: 79, train_loss: 0.3485, test_loss: 2.3372, test_f1: 0.5782
 epoch: 80, train_loss: 0.3619, test_loss: 2.2728, test_f1: 0.5451
 epoch: 81, train_loss: 0.3451, test_loss: 2.3240, test_f1: 0.5560
 epoch: 82, train_loss: 0.3468, test_loss: 1.9930, test_f1: 0.5619
 epoch: 83, train_loss: 0.3453, test_loss: 2.2475, test_f1: 0.5687
 epoch: 84, train_loss: 0.3233, test_loss: 2.1996, test_f1: 0.5810
 epoch: 85, train_loss: 0.3423, test_loss: 2.3219, test_f1: 0.5664
 epoch: 86, train_loss: 0.3311, test_loss: 2.3021, test_f1: 0.5884
 epoch: 87, train_loss: 0.3217, test_loss: 2.6726, test_f1: 0.5870
 epoch: 88, train_loss: 0.3174, test_loss: 2.3821, test_f1: 0.5790
 epoch: 89, train_loss: 0.3034, test_loss: 2.3934, test_f1: 0.5825
 epoch: 90, train_loss: 0.3154, test_loss: 2.6011, test_f1: 0.5616
 epoch: 91, train_loss: 0.3159, test_loss: 2.4433, test_f1: 0.5662
 epoch: 92, train_loss: 0.3327, test_loss: 2.6062, test_f1: 0.5639
 epoch: 93, train_loss: 0.3311, test_loss: 2.3400, test_f1: 0.5840
 epoch: 94, train_loss: 0.3059, test_loss: 2.5089, test_f1: 0.5835
 epoch: 95, train_loss: 0.3025, test_loss: 2.8313, test_f1: 0.5636
 epoch: 96, train_loss: 0.3047, test_loss: 2.8526, test_f1: 0.5430
 epoch: 97, train_loss: 0.3012, test_loss: 2.6654, test_f1: 0.5864
 epoch: 98, train_loss: 0.2811, test_loss: 2.6294, test_f1: 0.5722
 epoch: 99, train_loss: 0.3010, test_loss: 2.6100, test_f1: 0.5727
##################ITERATION #5 ****************************************
 epoch: 0, train_loss: 1.2783, test_loss: 1.2832, test_f1: 0.3117
 epoch: 1, train_loss: 1.1489, test_loss: 1.2602, test_f1: 0.4077
 epoch: 2, train_loss: 1.0852, test_loss: 1.2318, test_f1: 0.5104
 epoch: 3, train_loss: 1.0195, test_loss: 1.2115, test_f1: 0.5184
 epoch: 4, train_loss: 0.9979, test_loss: 1.1473, test_f1: 0.5678
 epoch: 5, train_loss: 0.9675, test_loss: 1.1970, test_f1: 0.5409
 epoch: 6, train_loss: 0.9680, test_loss: 1.4352, test_f1: 0.5307
 epoch: 7, train_loss: 0.9371, test_loss: 1.1313, test_f1: 0.5345
 epoch: 8, train_loss: 0.9145, test_loss: 1.2303, test_f1: 0.4489
 epoch: 9, train_loss: 0.8825, test_loss: 1.1307, test_f1: 0.5628
 epoch: 10, train_loss: 0.8759, test_loss: 1.1509, test_f1: 0.5665
 epoch: 11, train_loss: 0.8485, test_loss: 1.4457, test_f1: 0.5465
 epoch: 12, train_loss: 0.8470, test_loss: 1.2099, test_f1: 0.5041
 epoch: 13, train_loss: 0.8694, test_loss: 1.0650, test_f1: 0.5518
 epoch: 14, train_loss: 0.8101, test_loss: 1.1804, test_f1: 0.5562
 epoch: 15, train_loss: 0.8126, test_loss: 1.0705, test_f1: 0.5810
 epoch: 16, train_loss: 0.8157, test_loss: 1.1975, test_f1: 0.5763
 epoch: 17, train_loss: 0.7887, test_loss: 1.5263, test_f1: 0.5306
 epoch: 18, train_loss: 0.7986, test_loss: 1.3138, test_f1: 0.5482
 epoch: 19, train_loss: 0.7716, test_loss: 1.1954, test_f1: 0.6037
 epoch: 20, train_loss: 0.7398, test_loss: 1.1859, test_f1: 0.5779
 epoch: 21, train_loss: 0.7288, test_loss: 1.3016, test_f1: 0.5428
 epoch: 22, train_loss: 0.7269, test_loss: 1.4198, test_f1: 0.5567
 epoch: 23, train_loss: 0.7231, test_loss: 1.1318, test_f1: 0.5679
 epoch: 24, train_loss: 0.7322, test_loss: 1.3195, test_f1: 0.5387
 epoch: 25, train_loss: 0.7310, test_loss: 1.3195, test_f1: 0.5227
 epoch: 26, train_loss: 0.7194, test_loss: 1.4105, test_f1: 0.5417
 epoch: 27, train_loss: 0.7082, test_loss: 1.2590, test_f1: 0.5188
 epoch: 28, train_loss: 0.6951, test_loss: 1.2486, test_f1: 0.5742
 epoch: 29, train_loss: 0.6826, test_loss: 1.1894, test_f1: 0.6058
 epoch: 30, train_loss: 0.6773, test_loss: 1.3854, test_f1: 0.5246
 epoch: 31, train_loss: 0.6567, test_loss: 1.3245, test_f1: 0.5493
 epoch: 32, train_loss: 0.6427, test_loss: 1.5386, test_f1: 0.5740
 epoch: 33, train_loss: 0.6664, test_loss: 1.4280, test_f1: 0.5358
 epoch: 34, train_loss: 0.6974, test_loss: 1.3809, test_f1: 0.5902
 epoch: 35, train_loss: 0.6709, test_loss: 1.4264, test_f1: 0.5763
 epoch: 36, train_loss: 0.6218, test_loss: 1.3023, test_f1: 0.5580
 epoch: 37, train_loss: 0.6424, test_loss: 1.3181, test_f1: 0.5974
 epoch: 38, train_loss: 0.6189, test_loss: 1.3644, test_f1: 0.5976
 epoch: 39, train_loss: 0.6311, test_loss: 1.5092, test_f1: 0.6097
 epoch: 40, train_loss: 0.6400, test_loss: 1.7445, test_f1: 0.5880
 epoch: 41, train_loss: 0.6045, test_loss: 1.8262, test_f1: 0.5372
 epoch: 42, train_loss: 0.5872, test_loss: 1.6382, test_f1: 0.5942
 epoch: 43, train_loss: 0.5899, test_loss: 2.1186, test_f1: 0.5329
 epoch: 44, train_loss: 0.5673, test_loss: 1.6339, test_f1: 0.5712
 epoch: 45, train_loss: 0.5832, test_loss: 1.7145, test_f1: 0.5524
 epoch: 46, train_loss: 0.5860, test_loss: 1.5622, test_f1: 0.5650
 epoch: 47, train_loss: 0.5737, test_loss: 1.7308, test_f1: 0.5891
 epoch: 48, train_loss: 0.5531, test_loss: 1.6981, test_f1: 0.5460
 epoch: 49, train_loss: 0.5680, test_loss: 1.4124, test_f1: 0.5660
 epoch: 50, train_loss: 0.5607, test_loss: 1.5951, test_f1: 0.5882
 epoch: 51, train_loss: 0.5286, test_loss: 1.5901, test_f1: 0.6173
 epoch: 52, train_loss: 0.4877, test_loss: 1.5362, test_f1: 0.6154
 epoch: 53, train_loss: 0.4760, test_loss: 1.6839, test_f1: 0.6045
 epoch: 54, train_loss: 0.4819, test_loss: 1.5708, test_f1: 0.6251
 epoch: 55, train_loss: 0.4720, test_loss: 1.6400, test_f1: 0.6165
 epoch: 56, train_loss: 0.4720, test_loss: 1.6485, test_f1: 0.6120
 epoch: 57, train_loss: 0.4593, test_loss: 1.7706, test_f1: 0.5759
 epoch: 58, train_loss: 0.4527, test_loss: 1.5698, test_f1: 0.6125
 epoch: 59, train_loss: 0.4265, test_loss: 1.7691, test_f1: 0.5756
 epoch: 60, train_loss: 0.4726, test_loss: 1.6772, test_f1: 0.6389
 epoch: 61, train_loss: 0.4258, test_loss: 1.7806, test_f1: 0.6008
 epoch: 62, train_loss: 0.4238, test_loss: 1.5330, test_f1: 0.6254
 epoch: 63, train_loss: 0.4368, test_loss: 1.7930, test_f1: 0.6258
 epoch: 64, train_loss: 0.4381, test_loss: 1.8986, test_f1: 0.5890
 epoch: 65, train_loss: 0.4137, test_loss: 1.9081, test_f1: 0.6094
 epoch: 66, train_loss: 0.4212, test_loss: 1.8110, test_f1: 0.6273
 epoch: 67, train_loss: 0.3980, test_loss: 1.8967, test_f1: 0.6074
 epoch: 68, train_loss: 0.3977, test_loss: 1.8262, test_f1: 0.6214
 epoch: 69, train_loss: 0.4106, test_loss: 2.0087, test_f1: 0.5954
 epoch: 70, train_loss: 0.3831, test_loss: 2.0636, test_f1: 0.5806
 epoch: 71, train_loss: 0.3918, test_loss: 1.7419, test_f1: 0.6220
 epoch: 72, train_loss: 0.4436, test_loss: 1.9781, test_f1: 0.6082
 epoch: 73, train_loss: 0.3986, test_loss: 1.7206, test_f1: 0.6235
 epoch: 74, train_loss: 0.4091, test_loss: 2.1288, test_f1: 0.5783
 epoch: 75, train_loss: 0.4718, test_loss: 1.8948, test_f1: 0.6393
 epoch: 76, train_loss: 0.4292, test_loss: 1.7478, test_f1: 0.6163
 epoch: 77, train_loss: 0.3857, test_loss: 1.7518, test_f1: 0.6075
 epoch: 78, train_loss: 0.3705, test_loss: 1.7122, test_f1: 0.6426
 epoch: 79, train_loss: 0.3659, test_loss: 1.7776, test_f1: 0.6066
 epoch: 80, train_loss: 0.3691, test_loss: 1.7793, test_f1: 0.6259
 epoch: 81, train_loss: 0.3752, test_loss: 1.8031, test_f1: 0.6379
 epoch: 82, train_loss: 0.3680, test_loss: 1.8489, test_f1: 0.6355
 epoch: 83, train_loss: 0.3595, test_loss: 1.8768, test_f1: 0.6432
 epoch: 84, train_loss: 0.3821, test_loss: 1.6943, test_f1: 0.6368
 epoch: 85, train_loss: 0.3560, test_loss: 1.8341, test_f1: 0.6315
 epoch: 86, train_loss: 0.3625, test_loss: 1.9973, test_f1: 0.6044
 epoch: 87, train_loss: 0.3581, test_loss: 1.9382, test_f1: 0.6307
 epoch: 88, train_loss: 0.3427, test_loss: 2.1306, test_f1: 0.6178
 epoch: 89, train_loss: 0.3374, test_loss: 2.0632, test_f1: 0.6098
 epoch: 90, train_loss: 0.3318, test_loss: 2.0485, test_f1: 0.5887
 epoch: 91, train_loss: 0.3527, test_loss: 2.0986, test_f1: 0.5845
 epoch: 92, train_loss: 0.3418, test_loss: 1.9833, test_f1: 0.5973
 epoch: 93, train_loss: 0.3297, test_loss: 1.9164, test_f1: 0.6045
 epoch: 94, train_loss: 0.3143, test_loss: 1.8819, test_f1: 0.6293
 epoch: 95, train_loss: 0.3320, test_loss: 2.0507, test_f1: 0.6139
 epoch: 96, train_loss: 0.3335, test_loss: 2.1856, test_f1: 0.5878
 epoch: 97, train_loss: 0.3537, test_loss: 1.9492, test_f1: 0.6120
 epoch: 98, train_loss: 0.3532, test_loss: 2.1047, test_f1: 0.6141
 epoch: 99, train_loss: 0.2981, test_loss: 2.2610, test_f1: 0.6308
##################ITERATION #6 ****************************************
 epoch: 0, train_loss: 1.2785, test_loss: 1.2920, test_f1: 0.3834
 epoch: 1, train_loss: 1.1702, test_loss: 1.2577, test_f1: 0.4224
 epoch: 2, train_loss: 1.0999, test_loss: 1.2077, test_f1: 0.4972
 epoch: 3, train_loss: 1.0524, test_loss: 1.1801, test_f1: 0.5416
 epoch: 4, train_loss: 1.0118, test_loss: 1.1400, test_f1: 0.5258
 epoch: 5, train_loss: 0.9704, test_loss: 1.1485, test_f1: 0.5382
 epoch: 6, train_loss: 0.9422, test_loss: 1.2249, test_f1: 0.5292
 epoch: 7, train_loss: 0.9509, test_loss: 1.1774, test_f1: 0.5315
 epoch: 8, train_loss: 0.9237, test_loss: 1.0934, test_f1: 0.5803
 epoch: 9, train_loss: 0.8893, test_loss: 1.1989, test_f1: 0.5287
 epoch: 10, train_loss: 0.8712, test_loss: 1.2833, test_f1: 0.5091
 epoch: 11, train_loss: 0.8333, test_loss: 1.1920, test_f1: 0.5660
 epoch: 12, train_loss: 0.8243, test_loss: 1.2342, test_f1: 0.5697
 epoch: 13, train_loss: 0.8277, test_loss: 1.2397, test_f1: 0.4925
 epoch: 14, train_loss: 0.8049, test_loss: 1.1840, test_f1: 0.5534
 epoch: 15, train_loss: 0.8069, test_loss: 1.1535, test_f1: 0.5590
 epoch: 16, train_loss: 0.7962, test_loss: 1.2368, test_f1: 0.5717
 epoch: 17, train_loss: 0.7778, test_loss: 1.2036, test_f1: 0.5531
 epoch: 18, train_loss: 0.7651, test_loss: 1.2733, test_f1: 0.5441
 epoch: 19, train_loss: 0.7367, test_loss: 1.2520, test_f1: 0.5694
 epoch: 20, train_loss: 0.7420, test_loss: 1.3371, test_f1: 0.5225
 epoch: 21, train_loss: 0.7270, test_loss: 1.2647, test_f1: 0.5296
 epoch: 22, train_loss: 0.7040, test_loss: 1.2660, test_f1: 0.5475
 epoch: 23, train_loss: 0.7173, test_loss: 1.3129, test_f1: 0.5804
 epoch: 24, train_loss: 0.6552, test_loss: 1.3763, test_f1: 0.5635
 epoch: 25, train_loss: 0.6868, test_loss: 1.4490, test_f1: 0.5717
 epoch: 26, train_loss: 0.6732, test_loss: 1.6085, test_f1: 0.5209
 epoch: 27, train_loss: 0.6530, test_loss: 1.3861, test_f1: 0.5538
 epoch: 28, train_loss: 0.6901, test_loss: 1.4376, test_f1: 0.5454
 epoch: 29, train_loss: 0.6658, test_loss: 1.4228, test_f1: 0.5443
 epoch: 30, train_loss: 0.6551, test_loss: 1.6316, test_f1: 0.5782
 epoch: 31, train_loss: 0.6456, test_loss: 1.5494, test_f1: 0.5451
 epoch: 32, train_loss: 0.6142, test_loss: 1.5197, test_f1: 0.5497
 epoch: 33, train_loss: 0.6196, test_loss: 1.5304, test_f1: 0.5302
 epoch: 34, train_loss: 0.6180, test_loss: 1.8046, test_f1: 0.5291
 epoch: 35, train_loss: 0.6024, test_loss: 1.5213, test_f1: 0.6216
 epoch: 36, train_loss: 0.5851, test_loss: 1.8407, test_f1: 0.6045
 epoch: 37, train_loss: 0.5725, test_loss: 1.8130, test_f1: 0.5448
 epoch: 38, train_loss: 0.5725, test_loss: 1.7304, test_f1: 0.5534
 epoch: 39, train_loss: 0.5994, test_loss: 1.6880, test_f1: 0.5693
 epoch: 40, train_loss: 0.5893, test_loss: 1.7547, test_f1: 0.5583
 epoch: 41, train_loss: 0.5794, test_loss: 1.7382, test_f1: 0.5466
 epoch: 42, train_loss: 0.5589, test_loss: 1.8927, test_f1: 0.5083
 epoch: 43, train_loss: 0.5787, test_loss: 1.8412, test_f1: 0.5655
 epoch: 44, train_loss: 0.5423, test_loss: 1.7766, test_f1: 0.5662
 epoch: 45, train_loss: 0.5367, test_loss: 1.9178, test_f1: 0.5906
 epoch: 46, train_loss: 0.5897, test_loss: 1.6886, test_f1: 0.5576
 epoch: 47, train_loss: 0.5583, test_loss: 1.8412, test_f1: 0.5632
 epoch: 48, train_loss: 0.5456, test_loss: 1.9132, test_f1: 0.4856
 epoch: 49, train_loss: 0.5465, test_loss: 2.1178, test_f1: 0.5749
 epoch: 50, train_loss: 0.5155, test_loss: 1.9408, test_f1: 0.5126
 epoch: 51, train_loss: 0.4673, test_loss: 2.0697, test_f1: 0.5236
 epoch: 52, train_loss: 0.4513, test_loss: 1.8374, test_f1: 0.5800
 epoch: 53, train_loss: 0.4773, test_loss: 1.6716, test_f1: 0.5757
 epoch: 54, train_loss: 0.4360, test_loss: 2.0692, test_f1: 0.5322
 epoch: 55, train_loss: 0.4352, test_loss: 1.8000, test_f1: 0.5694
 epoch: 56, train_loss: 0.4140, test_loss: 1.9202, test_f1: 0.5657
 epoch: 57, train_loss: 0.4250, test_loss: 2.0218, test_f1: 0.5882
 epoch: 58, train_loss: 0.4270, test_loss: 1.8032, test_f1: 0.5876
 epoch: 59, train_loss: 0.4145, test_loss: 1.8410, test_f1: 0.5691
 epoch: 60, train_loss: 0.3893, test_loss: 1.9076, test_f1: 0.5584
 epoch: 61, train_loss: 0.3910, test_loss: 2.0486, test_f1: 0.5492
 epoch: 62, train_loss: 0.3736, test_loss: 1.9795, test_f1: 0.5694
 epoch: 63, train_loss: 0.4120, test_loss: 2.2399, test_f1: 0.5784
 epoch: 64, train_loss: 0.3796, test_loss: 2.1180, test_f1: 0.5677
 epoch: 65, train_loss: 0.3966, test_loss: 2.0741, test_f1: 0.5698
 epoch: 66, train_loss: 0.3727, test_loss: 2.1309, test_f1: 0.5615
 epoch: 67, train_loss: 0.3767, test_loss: 2.1509, test_f1: 0.5630
 epoch: 68, train_loss: 0.3692, test_loss: 2.0036, test_f1: 0.5646
 epoch: 69, train_loss: 0.3635, test_loss: 2.0981, test_f1: 0.5790
 epoch: 70, train_loss: 0.3714, test_loss: 2.1381, test_f1: 0.5660
 epoch: 71, train_loss: 0.3630, test_loss: 2.3281, test_f1: 0.5834
 epoch: 72, train_loss: 0.3620, test_loss: 2.1716, test_f1: 0.5724
 epoch: 73, train_loss: 0.3682, test_loss: 2.2492, test_f1: 0.5632
 epoch: 74, train_loss: 0.3754, test_loss: 2.2260, test_f1: 0.5567
 epoch: 75, train_loss: 0.3700, test_loss: 2.2380, test_f1: 0.5479
 epoch: 76, train_loss: 0.3597, test_loss: 2.4309, test_f1: 0.5621
 epoch: 77, train_loss: 0.3309, test_loss: 2.2510, test_f1: 0.6017
 epoch: 78, train_loss: 0.3468, test_loss: 2.3511, test_f1: 0.5863
 epoch: 79, train_loss: 0.3271, test_loss: 2.2916, test_f1: 0.5750
 epoch: 80, train_loss: 0.3446, test_loss: 2.4351, test_f1: 0.5472
 epoch: 81, train_loss: 0.3239, test_loss: 2.4241, test_f1: 0.5555
 epoch: 82, train_loss: 0.3696, test_loss: 2.4193, test_f1: 0.5711
 epoch: 83, train_loss: 0.3196, test_loss: 2.4849, test_f1: 0.5516
 epoch: 84, train_loss: 0.3181, test_loss: 2.4979, test_f1: 0.5723
 epoch: 85, train_loss: 0.3349, test_loss: 2.3434, test_f1: 0.5936
 epoch: 86, train_loss: 0.3286, test_loss: 2.5330, test_f1: 0.5769
 epoch: 87, train_loss: 0.3160, test_loss: 2.6518, test_f1: 0.5469
 epoch: 88, train_loss: 0.3249, test_loss: 2.4710, test_f1: 0.5854
 epoch: 89, train_loss: 0.3006, test_loss: 2.3698, test_f1: 0.5837
 epoch: 90, train_loss: 0.3023, test_loss: 2.4681, test_f1: 0.5819
 epoch: 91, train_loss: 0.2994, test_loss: 2.4311, test_f1: 0.5837
 epoch: 92, train_loss: 0.3100, test_loss: 3.0276, test_f1: 0.5765
 epoch: 93, train_loss: 0.3235, test_loss: 2.7244, test_f1: 0.5910
 epoch: 94, train_loss: 0.3044, test_loss: 2.7372, test_f1: 0.5749
 epoch: 95, train_loss: 0.2980, test_loss: 3.2275, test_f1: 0.5612
 epoch: 96, train_loss: 0.2922, test_loss: 2.8415, test_f1: 0.5707
 epoch: 97, train_loss: 0.2883, test_loss: 3.1661, test_f1: 0.5458
 epoch: 98, train_loss: 0.2718, test_loss: 3.0186, test_f1: 0.5510
 epoch: 99, train_loss: 0.3375, test_loss: 2.5123, test_f1: 0.6068
##################ITERATION #7 ****************************************
 epoch: 0, train_loss: 1.3697, test_loss: 1.3127, test_f1: 0.3609
 epoch: 1, train_loss: 1.2262, test_loss: 1.3811, test_f1: 0.3930
 epoch: 2, train_loss: 1.1681, test_loss: 1.2425, test_f1: 0.4888
 epoch: 3, train_loss: 1.1190, test_loss: 1.3229, test_f1: 0.5322
 epoch: 4, train_loss: 1.0704, test_loss: 1.2667, test_f1: 0.5210
 epoch: 5, train_loss: 1.0486, test_loss: 1.3174, test_f1: 0.5257
 epoch: 6, train_loss: 1.0139, test_loss: 1.3718, test_f1: 0.5382
 epoch: 7, train_loss: 0.9808, test_loss: 1.3397, test_f1: 0.5315
 epoch: 8, train_loss: 0.9425, test_loss: 1.1928, test_f1: 0.4873
 epoch: 9, train_loss: 0.9350, test_loss: 1.1827, test_f1: 0.5648
 epoch: 10, train_loss: 0.9208, test_loss: 1.2292, test_f1: 0.5923
 epoch: 11, train_loss: 0.9172, test_loss: 1.2164, test_f1: 0.5668
 epoch: 12, train_loss: 0.8741, test_loss: 1.2059, test_f1: 0.5247
 epoch: 13, train_loss: 0.8637, test_loss: 1.1513, test_f1: 0.6118
 epoch: 14, train_loss: 0.8556, test_loss: 1.3166, test_f1: 0.4836
 epoch: 15, train_loss: 0.8339, test_loss: 1.1776, test_f1: 0.5874
 epoch: 16, train_loss: 0.8179, test_loss: 1.2410, test_f1: 0.5421
 epoch: 17, train_loss: 0.8005, test_loss: 1.4442, test_f1: 0.5153
 epoch: 18, train_loss: 0.7665, test_loss: 1.3608, test_f1: 0.5713
 epoch: 19, train_loss: 0.7900, test_loss: 1.3746, test_f1: 0.5532
 epoch: 20, train_loss: 0.7927, test_loss: 1.3973, test_f1: 0.5589
 epoch: 21, train_loss: 0.7604, test_loss: 1.3523, test_f1: 0.5729
 epoch: 22, train_loss: 0.7312, test_loss: 1.3504, test_f1: 0.5626
 epoch: 23, train_loss: 0.7369, test_loss: 1.2889, test_f1: 0.5735
 epoch: 24, train_loss: 0.7165, test_loss: 1.3114, test_f1: 0.5224
 epoch: 25, train_loss: 0.7270, test_loss: 1.3458, test_f1: 0.5887
 epoch: 26, train_loss: 0.7218, test_loss: 1.4801, test_f1: 0.5293
 epoch: 27, train_loss: 0.7237, test_loss: 1.4420, test_f1: 0.5314
 epoch: 28, train_loss: 0.6925, test_loss: 1.4082, test_f1: 0.5875
 epoch: 29, train_loss: 0.6767, test_loss: 1.4464, test_f1: 0.5534
 epoch: 30, train_loss: 0.6851, test_loss: 1.3083, test_f1: 0.5811
 epoch: 31, train_loss: 0.6392, test_loss: 1.2818, test_f1: 0.6021
 epoch: 32, train_loss: 0.6810, test_loss: 1.6152, test_f1: 0.5857
 epoch: 33, train_loss: 0.6153, test_loss: 1.4172, test_f1: 0.5469
 epoch: 34, train_loss: 0.6174, test_loss: 1.6002, test_f1: 0.5412
 epoch: 35, train_loss: 0.6049, test_loss: 1.7859, test_f1: 0.5590
 epoch: 36, train_loss: 0.6510, test_loss: 1.7761, test_f1: 0.5520
 epoch: 37, train_loss: 0.6279, test_loss: 1.8445, test_f1: 0.5239
 epoch: 38, train_loss: 0.6154, test_loss: 1.8027, test_f1: 0.5966
 epoch: 39, train_loss: 0.6055, test_loss: 1.9812, test_f1: 0.5779
 epoch: 40, train_loss: 0.6025, test_loss: 1.4281, test_f1: 0.5687
 epoch: 41, train_loss: 0.6052, test_loss: 1.8719, test_f1: 0.5487
 epoch: 42, train_loss: 0.5963, test_loss: 1.6802, test_f1: 0.6106
 epoch: 43, train_loss: 0.5958, test_loss: 2.2128, test_f1: 0.5837
 epoch: 44, train_loss: 0.5630, test_loss: 2.0529, test_f1: 0.5563
 epoch: 45, train_loss: 0.5330, test_loss: 2.1311, test_f1: 0.5489
 epoch: 46, train_loss: 0.5839, test_loss: 2.2065, test_f1: 0.5877
 epoch: 47, train_loss: 0.5303, test_loss: 2.4555, test_f1: 0.5594
 epoch: 48, train_loss: 0.5511, test_loss: 3.0807, test_f1: 0.5649
 epoch: 49, train_loss: 0.5472, test_loss: 3.0371, test_f1: 0.5633
 epoch: 50, train_loss: 0.5512, test_loss: 2.0673, test_f1: 0.5782
 epoch: 51, train_loss: 0.5162, test_loss: 2.2588, test_f1: 0.5627
 epoch: 52, train_loss: 0.4946, test_loss: 2.6428, test_f1: 0.5599
 epoch: 53, train_loss: 0.4787, test_loss: 2.3657, test_f1: 0.5567
 epoch: 54, train_loss: 0.4795, test_loss: 2.7199, test_f1: 0.5587
 epoch: 55, train_loss: 0.4442, test_loss: 2.3309, test_f1: 0.5759
 epoch: 56, train_loss: 0.4523, test_loss: 2.1145, test_f1: 0.5860
 epoch: 57, train_loss: 0.4465, test_loss: 3.2005, test_f1: 0.5494
 epoch: 58, train_loss: 0.4432, test_loss: 3.1459, test_f1: 0.5572
 epoch: 59, train_loss: 0.4280, test_loss: 2.7080, test_f1: 0.5683
 epoch: 60, train_loss: 0.4297, test_loss: 2.3930, test_f1: 0.5547
 epoch: 61, train_loss: 0.4274, test_loss: 3.3475, test_f1: 0.5671
 epoch: 62, train_loss: 0.4267, test_loss: 3.3298, test_f1: 0.5334
 epoch: 63, train_loss: 0.4221, test_loss: 2.6317, test_f1: 0.5466
 epoch: 64, train_loss: 0.4355, test_loss: 3.4696, test_f1: 0.5379
 epoch: 65, train_loss: 0.4186, test_loss: 2.9294, test_f1: 0.5402
 epoch: 66, train_loss: 0.4251, test_loss: 3.9343, test_f1: 0.5447
 epoch: 67, train_loss: 0.4076, test_loss: 3.5634, test_f1: 0.5736
 epoch: 68, train_loss: 0.3931, test_loss: 3.4348, test_f1: 0.5519
 epoch: 69, train_loss: 0.4074, test_loss: 3.7553, test_f1: 0.5657
 epoch: 70, train_loss: 0.4056, test_loss: 3.1947, test_f1: 0.5563
 epoch: 71, train_loss: 0.4111, test_loss: 2.8942, test_f1: 0.5983
 epoch: 72, train_loss: 0.4250, test_loss: 4.1004, test_f1: 0.5430
 epoch: 73, train_loss: 0.4039, test_loss: 3.0143, test_f1: 0.5458
 epoch: 74, train_loss: 0.3834, test_loss: 3.1542, test_f1: 0.5559
 epoch: 75, train_loss: 0.4285, test_loss: 2.6807, test_f1: 0.5685
 epoch: 76, train_loss: 0.3880, test_loss: 3.2995, test_f1: 0.5653
 epoch: 77, train_loss: 0.3732, test_loss: 3.0985, test_f1: 0.5702
 epoch: 78, train_loss: 0.3665, test_loss: 3.1951, test_f1: 0.5344
 epoch: 79, train_loss: 0.3772, test_loss: 2.4546, test_f1: 0.5740
 epoch: 80, train_loss: 0.3507, test_loss: 3.8693, test_f1: 0.5566
 epoch: 81, train_loss: 0.3500, test_loss: 3.1332, test_f1: 0.5498
 epoch: 82, train_loss: 0.3671, test_loss: 3.5076, test_f1: 0.5550
 epoch: 83, train_loss: 0.3399, test_loss: 2.6199, test_f1: 0.5682
 epoch: 84, train_loss: 0.3442, test_loss: 2.8124, test_f1: 0.5511
 epoch: 85, train_loss: 0.3512, test_loss: 2.8279, test_f1: 0.5942
 epoch: 86, train_loss: 0.3264, test_loss: 3.4187, test_f1: 0.5274
 epoch: 87, train_loss: 0.3429, test_loss: 4.1711, test_f1: 0.5887
 epoch: 88, train_loss: 0.3475, test_loss: 2.9795, test_f1: 0.5348
 epoch: 89, train_loss: 0.3336, test_loss: 3.7942, test_f1: 0.5600
 epoch: 90, train_loss: 0.3555, test_loss: 3.4925, test_f1: 0.6091
 epoch: 91, train_loss: 0.3735, test_loss: 3.9046, test_f1: 0.5650
 epoch: 92, train_loss: 0.3271, test_loss: 3.7000, test_f1: 0.5593
 epoch: 93, train_loss: 0.3331, test_loss: 4.7762, test_f1: 0.5716
 epoch: 94, train_loss: 0.3345, test_loss: 3.5361, test_f1: 0.5638
 epoch: 95, train_loss: 0.3589, test_loss: 4.8696, test_f1: 0.5642
 epoch: 96, train_loss: 0.3342, test_loss: 4.2960, test_f1: 0.5771
 epoch: 97, train_loss: 0.3285, test_loss: 3.8193, test_f1: 0.5560
 epoch: 98, train_loss: 0.3058, test_loss: 3.6212, test_f1: 0.5793
 epoch: 99, train_loss: 0.3161, test_loss: 4.0466, test_f1: 0.5644
##################ITERATION #8 ****************************************
 epoch: 0, train_loss: 1.3767, test_loss: 1.4736, test_f1: 0.2936
 epoch: 1, train_loss: 1.2099, test_loss: 1.3856, test_f1: 0.4565
 epoch: 2, train_loss: 1.1316, test_loss: 1.3424, test_f1: 0.5153
 epoch: 3, train_loss: 1.1001, test_loss: 1.2617, test_f1: 0.5490
 epoch: 4, train_loss: 1.0634, test_loss: 1.2600, test_f1: 0.5306
 epoch: 5, train_loss: 1.0342, test_loss: 1.2009, test_f1: 0.5486
 epoch: 6, train_loss: 0.9944, test_loss: 1.2044, test_f1: 0.5099
 epoch: 7, train_loss: 0.9731, test_loss: 1.2872, test_f1: 0.5128
 epoch: 8, train_loss: 0.9557, test_loss: 1.2825, test_f1: 0.5270
 epoch: 9, train_loss: 0.9344, test_loss: 1.2435, test_f1: 0.5554
 epoch: 10, train_loss: 0.9128, test_loss: 1.1512, test_f1: 0.5177
 epoch: 11, train_loss: 0.8918, test_loss: 1.3066, test_f1: 0.4934
 epoch: 12, train_loss: 0.8864, test_loss: 1.1442, test_f1: 0.5275
 epoch: 13, train_loss: 0.8442, test_loss: 1.2511, test_f1: 0.5786
 epoch: 14, train_loss: 0.8440, test_loss: 1.2870, test_f1: 0.5466
 epoch: 15, train_loss: 0.8505, test_loss: 1.2756, test_f1: 0.5445
 epoch: 16, train_loss: 0.8309, test_loss: 1.3460, test_f1: 0.5645
 epoch: 17, train_loss: 0.8246, test_loss: 1.2282, test_f1: 0.5477
 epoch: 18, train_loss: 0.8068, test_loss: 1.3768, test_f1: 0.5901
 epoch: 19, train_loss: 0.7876, test_loss: 1.3322, test_f1: 0.5442
 epoch: 20, train_loss: 0.7804, test_loss: 1.3218, test_f1: 0.6006
 epoch: 21, train_loss: 0.7956, test_loss: 1.3390, test_f1: 0.5548
 epoch: 22, train_loss: 0.7665, test_loss: 1.3164, test_f1: 0.5680
 epoch: 23, train_loss: 0.7695, test_loss: 1.3035, test_f1: 0.5467
 epoch: 24, train_loss: 0.7542, test_loss: 1.4437, test_f1: 0.5948
 epoch: 25, train_loss: 0.7381, test_loss: 1.4448, test_f1: 0.5648
 epoch: 26, train_loss: 0.7120, test_loss: 1.5639, test_f1: 0.5683
 epoch: 27, train_loss: 0.7228, test_loss: 1.4898, test_f1: 0.5733
 epoch: 28, train_loss: 0.7306, test_loss: 1.3428, test_f1: 0.5871
 epoch: 29, train_loss: 0.7210, test_loss: 1.3995, test_f1: 0.5703
 epoch: 30, train_loss: 0.7019, test_loss: 1.4794, test_f1: 0.5744
 epoch: 31, train_loss: 0.6952, test_loss: 1.2533, test_f1: 0.6221
 epoch: 32, train_loss: 0.6862, test_loss: 1.2883, test_f1: 0.6131
 epoch: 33, train_loss: 0.7062, test_loss: 1.3284, test_f1: 0.5780
 epoch: 34, train_loss: 0.6769, test_loss: 1.4473, test_f1: 0.5949
 epoch: 35, train_loss: 0.6789, test_loss: 1.5431, test_f1: 0.5482
 epoch: 36, train_loss: 0.6988, test_loss: 1.5263, test_f1: 0.5344
 epoch: 37, train_loss: 0.6933, test_loss: 1.3997, test_f1: 0.5275
 epoch: 38, train_loss: 0.6655, test_loss: 1.6426, test_f1: 0.5564
 epoch: 39, train_loss: 0.6391, test_loss: 1.6885, test_f1: 0.5711
 epoch: 40, train_loss: 0.6628, test_loss: 1.4599, test_f1: 0.5514
 epoch: 41, train_loss: 0.6341, test_loss: 1.4933, test_f1: 0.5428
 epoch: 42, train_loss: 0.6235, test_loss: 1.4395, test_f1: 0.5634
 epoch: 43, train_loss: 0.6097, test_loss: 1.3767, test_f1: 0.5857
 epoch: 44, train_loss: 0.6323, test_loss: 1.4305, test_f1: 0.5923
 epoch: 45, train_loss: 0.6053, test_loss: 1.5764, test_f1: 0.5500
 epoch: 46, train_loss: 0.5959, test_loss: 1.5326, test_f1: 0.5507
 epoch: 47, train_loss: 0.6236, test_loss: 1.5269, test_f1: 0.5440
 epoch: 48, train_loss: 0.5990, test_loss: 1.4765, test_f1: 0.5975
 epoch: 49, train_loss: 0.5759, test_loss: 1.5412, test_f1: 0.5720
 epoch: 50, train_loss: 0.5792, test_loss: 1.5264, test_f1: 0.5882
 epoch: 51, train_loss: 0.5391, test_loss: 1.3779, test_f1: 0.6273
 epoch: 52, train_loss: 0.5277, test_loss: 1.4737, test_f1: 0.6005
 epoch: 53, train_loss: 0.5031, test_loss: 1.3914, test_f1: 0.6076
 epoch: 54, train_loss: 0.5084, test_loss: 1.5503, test_f1: 0.5906
 epoch: 55, train_loss: 0.4899, test_loss: 1.6613, test_f1: 0.5584
 epoch: 56, train_loss: 0.4821, test_loss: 1.6507, test_f1: 0.5732
 epoch: 57, train_loss: 0.5065, test_loss: 1.7667, test_f1: 0.5653
 epoch: 58, train_loss: 0.4842, test_loss: 1.7616, test_f1: 0.5736
 epoch: 59, train_loss: 0.4679, test_loss: 1.6972, test_f1: 0.5662
 epoch: 60, train_loss: 0.4637, test_loss: 1.6873, test_f1: 0.5770
 epoch: 61, train_loss: 0.4610, test_loss: 1.6674, test_f1: 0.5812
 epoch: 62, train_loss: 0.4676, test_loss: 1.5693, test_f1: 0.6104
 epoch: 63, train_loss: 0.4362, test_loss: 1.7040, test_f1: 0.5649
 epoch: 64, train_loss: 0.4502, test_loss: 1.7115, test_f1: 0.5738
 epoch: 65, train_loss: 0.4341, test_loss: 1.5396, test_f1: 0.5986
 epoch: 66, train_loss: 0.4399, test_loss: 1.8293, test_f1: 0.5539
 epoch: 67, train_loss: 0.4493, test_loss: 1.8675, test_f1: 0.5617
 epoch: 68, train_loss: 0.4618, test_loss: 1.8146, test_f1: 0.5798
 epoch: 69, train_loss: 0.4246, test_loss: 1.7939, test_f1: 0.5516
 epoch: 70, train_loss: 0.4286, test_loss: 1.7769, test_f1: 0.5991
 epoch: 71, train_loss: 0.4056, test_loss: 2.0799, test_f1: 0.5451
 epoch: 72, train_loss: 0.3937, test_loss: 2.0472, test_f1: 0.5956
 epoch: 73, train_loss: 0.4392, test_loss: 1.8826, test_f1: 0.5466
 epoch: 74, train_loss: 0.4469, test_loss: 1.7914, test_f1: 0.5953
 epoch: 75, train_loss: 0.4104, test_loss: 1.9372, test_f1: 0.5672
 epoch: 76, train_loss: 0.4061, test_loss: 2.0228, test_f1: 0.5526
 epoch: 77, train_loss: 0.4082, test_loss: 1.8522, test_f1: 0.6125
 epoch: 78, train_loss: 0.3985, test_loss: 2.1048, test_f1: 0.5549
 epoch: 79, train_loss: 0.4142, test_loss: 1.8402, test_f1: 0.5849
 epoch: 80, train_loss: 0.4231, test_loss: 2.1361, test_f1: 0.5360
 epoch: 81, train_loss: 0.4346, test_loss: 1.7487, test_f1: 0.5841
 epoch: 82, train_loss: 0.4283, test_loss: 2.1280, test_f1: 0.5493
 epoch: 83, train_loss: 0.4062, test_loss: 2.1382, test_f1: 0.5727
 epoch: 84, train_loss: 0.3916, test_loss: 2.0227, test_f1: 0.5665
 epoch: 85, train_loss: 0.3721, test_loss: 1.9624, test_f1: 0.5697
 epoch: 86, train_loss: 0.3603, test_loss: 2.1578, test_f1: 0.5111
 epoch: 87, train_loss: 0.3887, test_loss: 1.8168, test_f1: 0.5698
 epoch: 88, train_loss: 0.3595, test_loss: 2.2069, test_f1: 0.5788
 epoch: 89, train_loss: 0.3753, test_loss: 1.9917, test_f1: 0.5816
 epoch: 90, train_loss: 0.3816, test_loss: 1.9290, test_f1: 0.6367
 epoch: 91, train_loss: 0.3531, test_loss: 2.1581, test_f1: 0.5959
 epoch: 92, train_loss: 0.3515, test_loss: 2.2398, test_f1: 0.5830
 epoch: 93, train_loss: 0.3458, test_loss: 2.2988, test_f1: 0.5546
 epoch: 94, train_loss: 0.3731, test_loss: 2.2845, test_f1: 0.5409
 epoch: 95, train_loss: 0.3319, test_loss: 2.2563, test_f1: 0.5826
 epoch: 96, train_loss: 0.3585, test_loss: 2.2472, test_f1: 0.5545
 epoch: 97, train_loss: 0.3523, test_loss: 2.4773, test_f1: 0.5607
 epoch: 98, train_loss: 0.3279, test_loss: 2.3327, test_f1: 0.5308
 epoch: 99, train_loss: 0.3214, test_loss: 2.4376, test_f1: 0.5565
##################ITERATION #9 ****************************************
 epoch: 0, train_loss: 1.2928, test_loss: 1.3017, test_f1: 0.2482
 epoch: 1, train_loss: 1.1265, test_loss: 1.3510, test_f1: 0.3588
 epoch: 2, train_loss: 1.0821, test_loss: 1.3949, test_f1: 0.5276
 epoch: 3, train_loss: 1.0584, test_loss: 1.1751, test_f1: 0.5209
 epoch: 4, train_loss: 1.0207, test_loss: 1.1796, test_f1: 0.5268
 epoch: 5, train_loss: 0.9726, test_loss: 1.1713, test_f1: 0.4841
 epoch: 6, train_loss: 0.9468, test_loss: 1.1513, test_f1: 0.5285
 epoch: 7, train_loss: 0.9204, test_loss: 1.2092, test_f1: 0.5097
 epoch: 8, train_loss: 0.8925, test_loss: 1.2153, test_f1: 0.5027
 epoch: 9, train_loss: 0.8779, test_loss: 1.2100, test_f1: 0.5625
 epoch: 10, train_loss: 0.8421, test_loss: 1.2618, test_f1: 0.5152
 epoch: 11, train_loss: 0.8626, test_loss: 1.2194, test_f1: 0.5247
 epoch: 12, train_loss: 0.8385, test_loss: 1.2929, test_f1: 0.5606
 epoch: 13, train_loss: 0.8211, test_loss: 1.1974, test_f1: 0.5707
 epoch: 14, train_loss: 0.7934, test_loss: 1.1566, test_f1: 0.5572
 epoch: 15, train_loss: 0.7869, test_loss: 1.2827, test_f1: 0.5542
 epoch: 16, train_loss: 0.7702, test_loss: 1.4160, test_f1: 0.5292
 epoch: 17, train_loss: 0.7388, test_loss: 1.3621, test_f1: 0.5499
 epoch: 18, train_loss: 0.7258, test_loss: 1.3794, test_f1: 0.5049
 epoch: 19, train_loss: 0.7119, test_loss: 1.2955, test_f1: 0.5400
 epoch: 20, train_loss: 0.7126, test_loss: 1.5338, test_f1: 0.5543
 epoch: 21, train_loss: 0.7373, test_loss: 1.4709, test_f1: 0.5438
 epoch: 22, train_loss: 0.7145, test_loss: 1.6099, test_f1: 0.5437
 epoch: 23, train_loss: 0.6608, test_loss: 1.5948, test_f1: 0.5945
 epoch: 24, train_loss: 0.6630, test_loss: 1.7120, test_f1: 0.5522
 epoch: 25, train_loss: 0.6347, test_loss: 1.4022, test_f1: 0.5963
 epoch: 26, train_loss: 0.6222, test_loss: 1.7707, test_f1: 0.5630
 epoch: 27, train_loss: 0.6471, test_loss: 1.9074, test_f1: 0.5124
 epoch: 28, train_loss: 0.6374, test_loss: 1.8472, test_f1: 0.5801
 epoch: 29, train_loss: 0.6354, test_loss: 1.4724, test_f1: 0.5833
 epoch: 30, train_loss: 0.6286, test_loss: 1.5499, test_f1: 0.5714
 epoch: 31, train_loss: 0.6095, test_loss: 1.6417, test_f1: 0.5738
 epoch: 32, train_loss: 0.5903, test_loss: 1.9811, test_f1: 0.5702
 epoch: 33, train_loss: 0.5346, test_loss: 1.7378, test_f1: 0.5381
 epoch: 34, train_loss: 0.5643, test_loss: 1.6915, test_f1: 0.5148
 epoch: 35, train_loss: 0.5622, test_loss: 1.8869, test_f1: 0.5569
 epoch: 36, train_loss: 0.5599, test_loss: 1.8300, test_f1: 0.5666
 epoch: 37, train_loss: 0.5676, test_loss: 1.8198, test_f1: 0.5448
 epoch: 38, train_loss: 0.5531, test_loss: 1.7669, test_f1: 0.5703
 epoch: 39, train_loss: 0.5697, test_loss: 1.7545, test_f1: 0.5435
 epoch: 40, train_loss: 0.5173, test_loss: 1.6935, test_f1: 0.5404
 epoch: 41, train_loss: 0.5427, test_loss: 1.8945, test_f1: 0.5412
 epoch: 42, train_loss: 0.5403, test_loss: 1.8402, test_f1: 0.5900
 epoch: 43, train_loss: 0.5081, test_loss: 1.9398, test_f1: 0.5577
 epoch: 44, train_loss: 0.5098, test_loss: 2.0571, test_f1: 0.5639
 epoch: 45, train_loss: 0.5054, test_loss: 1.8124, test_f1: 0.5878
 epoch: 46, train_loss: 0.4969, test_loss: 2.0861, test_f1: 0.5901
 epoch: 47, train_loss: 0.4909, test_loss: 1.8524, test_f1: 0.5351
 epoch: 48, train_loss: 0.4799, test_loss: 2.4652, test_f1: 0.5056
 epoch: 49, train_loss: 0.4907, test_loss: 2.1922, test_f1: 0.5611
 epoch: 50, train_loss: 0.4423, test_loss: 1.9197, test_f1: 0.5838
 epoch: 51, train_loss: 0.4281, test_loss: 1.9820, test_f1: 0.5703
 epoch: 52, train_loss: 0.3892, test_loss: 2.0648, test_f1: 0.5357
 epoch: 53, train_loss: 0.3819, test_loss: 1.9249, test_f1: 0.5465
 epoch: 54, train_loss: 0.3715, test_loss: 2.0674, test_f1: 0.5567
 epoch: 55, train_loss: 0.3518, test_loss: 2.1796, test_f1: 0.5663
 epoch: 56, train_loss: 0.3552, test_loss: 2.0683, test_f1: 0.5495
 epoch: 57, train_loss: 0.3575, test_loss: 2.0475, test_f1: 0.5885
 epoch: 58, train_loss: 0.3281, test_loss: 2.1285, test_f1: 0.5575
 epoch: 59, train_loss: 0.3561, test_loss: 2.3374, test_f1: 0.5668
 epoch: 60, train_loss: 0.3656, test_loss: 2.6209, test_f1: 0.5333
 epoch: 61, train_loss: 0.3518, test_loss: 2.3360, test_f1: 0.5581
 epoch: 62, train_loss: 0.3222, test_loss: 2.5801, test_f1: 0.5702
 epoch: 63, train_loss: 0.3502, test_loss: 2.3255, test_f1: 0.5527
 epoch: 64, train_loss: 0.3687, test_loss: 2.5775, test_f1: 0.5570
 epoch: 65, train_loss: 0.3464, test_loss: 2.2514, test_f1: 0.5652
 epoch: 66, train_loss: 0.3287, test_loss: 2.4351, test_f1: 0.5815
 epoch: 67, train_loss: 0.3256, test_loss: 2.3682, test_f1: 0.5331
 epoch: 68, train_loss: 0.3243, test_loss: 2.3287, test_f1: 0.5683
 epoch: 69, train_loss: 0.3314, test_loss: 2.2165, test_f1: 0.5871
 epoch: 70, train_loss: 0.3238, test_loss: 2.4414, test_f1: 0.5548
 epoch: 71, train_loss: 0.3166, test_loss: 3.6738, test_f1: 0.5530
 epoch: 72, train_loss: 0.3183, test_loss: 2.3357, test_f1: 0.5840
 epoch: 73, train_loss: 0.2993, test_loss: 7.3772, test_f1: 0.5863
 epoch: 74, train_loss: 0.2834, test_loss: 2.6437, test_f1: 0.5729
 epoch: 75, train_loss: 0.3203, test_loss: 2.4401, test_f1: 0.5907
 epoch: 76, train_loss: 0.3242, test_loss: 2.5173, test_f1: 0.5795
 epoch: 77, train_loss: 0.2759, test_loss: 2.4672, test_f1: 0.5524
 epoch: 78, train_loss: 0.2803, test_loss: 2.5978, test_f1: 0.5944
 epoch: 79, train_loss: 0.2717, test_loss: 2.9386, test_f1: 0.5890
 epoch: 80, train_loss: 0.2635, test_loss: 2.7078, test_f1: 0.5426
 epoch: 81, train_loss: 0.2977, test_loss: 2.6481, test_f1: 0.5972
 epoch: 82, train_loss: 0.3114, test_loss: 2.6750, test_f1: 0.5637
 epoch: 83, train_loss: 0.3115, test_loss: 2.5768, test_f1: 0.6101
 epoch: 84, train_loss: 0.2609, test_loss: 2.8458, test_f1: 0.5595
 epoch: 85, train_loss: 0.2771, test_loss: 2.6606, test_f1: 0.5560
 epoch: 86, train_loss: 0.2526, test_loss: 2.6270, test_f1: 0.5901
 epoch: 87, train_loss: 0.2910, test_loss: 2.8026, test_f1: 0.5482
 epoch: 88, train_loss: 0.2793, test_loss: 2.8606, test_f1: 0.5406
 epoch: 89, train_loss: 0.2817, test_loss: 3.4837, test_f1: 0.5640
 epoch: 90, train_loss: 0.2913, test_loss: 3.3895, test_f1: 0.5683
 epoch: 91, train_loss: 0.2918, test_loss: 3.4502, test_f1: 0.5842
 epoch: 92, train_loss: 0.2964, test_loss: 2.9679, test_f1: 0.5752
 epoch: 93, train_loss: 0.2736, test_loss: 2.8956, test_f1: 0.5554
 epoch: 94, train_loss: 0.2554, test_loss: 2.8067, test_f1: 0.5812
 epoch: 95, train_loss: 0.2255, test_loss: 2.7325, test_f1: 0.5740
 epoch: 96, train_loss: 0.2603, test_loss: 2.9648, test_f1: 0.5654
 epoch: 97, train_loss: 0.3022, test_loss: 2.9551, test_f1: 0.6026
 epoch: 98, train_loss: 0.2869, test_loss: 2.8135, test_f1: 0.5928
 epoch: 99, train_loss: 0.2659, test_loss: 2.6868, test_f1: 0.5852

Training completed in 549.90 seconds
Best F1: 0.6435 at epoch 49
Mean F1 across iterations: 0.6163  0.0187
========================FINAL RESULTS================================
FEGIN weighted F1: 0.6435  0.0187
python main.py --data ltspice_demos --representation component_component --model FEGIN --layers 6 --hiddens 64 --batch_size 64 --lr 0.001 --emb_size 512 --epochs 100 --save_appendix component_component_L6_H64_BS64_LR0.001_E512 --no_val
-----



STDERR:
  File "main.py", line 370, in <module>
    main()
  File "main.py", line 254, in main
    dataset = dataset_class(
  File "/home/philip/projects/ltspice_examples_code_repo/Circuit-Completion-Using-GNNs/component_classification_with_link_prediction_head/evaluation/FEGIN/kernel/circuit_datasets.py", line 15, in __init__
    self.data, self.slices = torch.load(self.processed_paths[0])
  File "/home/philip/.local/lib/python3.8/site-packages/torch/serialization.py", line 1040, in load
    warnings.warn(
  File "/usr/lib/python3.8/warnings.py", line 109, in _showwarnmsg
    sw(msg.message, msg.category, msg.filename, msg.lineno,
  File "main.py", line 47, in warn_with_traceback
    traceback.print_stack(file=log)
/home/philip/projects/ltspice_examples_code_repo/Circuit-Completion-Using-GNNs/component_classification_with_link_prediction_head/evaluation/FEGIN/kernel/circuit_datasets.py:15: FutureWarning: You are using `torch.load` with `weights_only=False` (the current default value), which uses the default pickle module implicitly. It is possible to construct malicious pickle data which will execute arbitrary code during unpickling (See https://github.com/pytorch/pytorch/blob/main/SECURITY.md#untrusted-models for more details). In a future release, the default value for `weights_only` will be flipped to `True`. This limits the functions that could be executed during unpickling. Arbitrary objects will no longer be allowed to be loaded via this mode unless they are explicitly allowlisted by the user via `torch.serialization.add_safe_globals`. We recommend you start setting `weights_only=True` for any use case where you don't have full control of the loaded file. Please open an issue on GitHub for any issues related to this experimental feature.
  self.data, self.slices = torch.load(self.processed_paths[0])
