STDOUT:
Results will be saved in /home/philip/projects/ltspice_examples_code_repo/Circuit-Completion-Using-GNNs/component_classification_with_link_prediction_head/evaluation/FEGIN/results/model_FEGIN_dataset_ltspice_examples
Command line input: python main.py --data ltspice_examples --representation component_component --model FEGIN --layers 2 --hiddens 128 --batch_size 32 --lr 0.0001 --emb_size 250 --epochs 100 --save_appendix component_component_L2_H128_BS32_LR0.0001_E250 --no_val
 is saved.
-----
ltspice_examples - FEGIN
Using 2 layers, 128 hidden units, h = 2
Loading component_component representation dataset
ENTERED
Training FEGIN on component_component representation
Train: 3556, Test: 845
##################ITERATION #0 ****************************************
 epoch: 0, train_loss: 1.3325, test_loss: 1.2698, test_f1: 0.2274
 epoch: 1, train_loss: 1.2562, test_loss: 1.2236, test_f1: 0.2274
 epoch: 2, train_loss: 1.2235, test_loss: 1.1886, test_f1: 0.3301
 epoch: 3, train_loss: 1.1904, test_loss: 1.1600, test_f1: 0.3661
 epoch: 4, train_loss: 1.1618, test_loss: 1.1281, test_f1: 0.4640
 epoch: 5, train_loss: 1.1310, test_loss: 1.1013, test_f1: 0.4379
 epoch: 6, train_loss: 1.1054, test_loss: 1.0686, test_f1: 0.4720
 epoch: 7, train_loss: 1.0866, test_loss: 1.0515, test_f1: 0.4760
 epoch: 8, train_loss: 1.0610, test_loss: 1.0338, test_f1: 0.4798
 epoch: 9, train_loss: 1.0473, test_loss: 1.0028, test_f1: 0.4586
 epoch: 10, train_loss: 1.0258, test_loss: 0.9939, test_f1: 0.4678
 epoch: 11, train_loss: 1.0032, test_loss: 1.0015, test_f1: 0.4632
 epoch: 12, train_loss: 0.9904, test_loss: 0.9790, test_f1: 0.4876
 epoch: 13, train_loss: 0.9866, test_loss: 0.9647, test_f1: 0.5130
 epoch: 14, train_loss: 0.9650, test_loss: 0.9877, test_f1: 0.4915
 epoch: 15, train_loss: 0.9607, test_loss: 0.9856, test_f1: 0.4916
 epoch: 16, train_loss: 0.9508, test_loss: 0.9865, test_f1: 0.5037
 epoch: 17, train_loss: 0.9373, test_loss: 0.9648, test_f1: 0.5132
 epoch: 18, train_loss: 0.9339, test_loss: 0.9704, test_f1: 0.5118
 epoch: 19, train_loss: 0.9298, test_loss: 0.9457, test_f1: 0.5231
 epoch: 20, train_loss: 0.9239, test_loss: 0.9834, test_f1: 0.5069
 epoch: 21, train_loss: 0.9058, test_loss: 0.9784, test_f1: 0.5155
 epoch: 22, train_loss: 0.9004, test_loss: 0.9699, test_f1: 0.5112
 epoch: 23, train_loss: 0.8995, test_loss: 0.9863, test_f1: 0.5264
 epoch: 24, train_loss: 0.8894, test_loss: 0.9993, test_f1: 0.5239
 epoch: 25, train_loss: 0.8750, test_loss: 0.9975, test_f1: 0.5254
 epoch: 26, train_loss: 0.8759, test_loss: 1.0063, test_f1: 0.5283
 epoch: 27, train_loss: 0.8769, test_loss: 1.0035, test_f1: 0.5135
 epoch: 28, train_loss: 0.8721, test_loss: 0.9931, test_f1: 0.5298
 epoch: 29, train_loss: 0.8500, test_loss: 1.0008, test_f1: 0.5004
 epoch: 30, train_loss: 0.8467, test_loss: 0.9966, test_f1: 0.5283
 epoch: 31, train_loss: 0.8421, test_loss: 1.0214, test_f1: 0.5259
 epoch: 32, train_loss: 0.8350, test_loss: 1.0305, test_f1: 0.4894
 epoch: 33, train_loss: 0.8306, test_loss: 0.9884, test_f1: 0.5255
 epoch: 34, train_loss: 0.8213, test_loss: 1.0418, test_f1: 0.5129
 epoch: 35, train_loss: 0.8105, test_loss: 1.0719, test_f1: 0.5031
 epoch: 36, train_loss: 0.8206, test_loss: 1.0578, test_f1: 0.5148
 epoch: 37, train_loss: 0.8120, test_loss: 1.0102, test_f1: 0.5193
 epoch: 38, train_loss: 0.8012, test_loss: 1.0378, test_f1: 0.5170
 epoch: 39, train_loss: 0.7962, test_loss: 1.0784, test_f1: 0.5048
 epoch: 40, train_loss: 0.7859, test_loss: 1.1406, test_f1: 0.4727
 epoch: 41, train_loss: 0.7921, test_loss: 1.0538, test_f1: 0.5044
 epoch: 42, train_loss: 0.7864, test_loss: 1.0869, test_f1: 0.5069
 epoch: 43, train_loss: 0.7725, test_loss: 1.0694, test_f1: 0.4837
 epoch: 44, train_loss: 0.7688, test_loss: 1.0896, test_f1: 0.4959
 epoch: 45, train_loss: 0.7604, test_loss: 1.0524, test_f1: 0.5200
 epoch: 46, train_loss: 0.7536, test_loss: 1.1476, test_f1: 0.4802
 epoch: 47, train_loss: 0.7383, test_loss: 1.0812, test_f1: 0.5064
 epoch: 48, train_loss: 0.7537, test_loss: 1.0876, test_f1: 0.5223
 epoch: 49, train_loss: 0.7411, test_loss: 1.1034, test_f1: 0.5036
 epoch: 50, train_loss: 0.7369, test_loss: 1.1547, test_f1: 0.4790
 epoch: 51, train_loss: 0.7283, test_loss: 1.1538, test_f1: 0.5068
 epoch: 52, train_loss: 0.7181, test_loss: 1.1377, test_f1: 0.5103
 epoch: 53, train_loss: 0.7102, test_loss: 1.1821, test_f1: 0.5129
 epoch: 54, train_loss: 0.6965, test_loss: 1.1444, test_f1: 0.5089
 epoch: 55, train_loss: 0.7078, test_loss: 1.1458, test_f1: 0.5067
 epoch: 56, train_loss: 0.7103, test_loss: 1.1917, test_f1: 0.5125
 epoch: 57, train_loss: 0.7151, test_loss: 1.2235, test_f1: 0.5049
 epoch: 58, train_loss: 0.7036, test_loss: 1.2120, test_f1: 0.5090
 epoch: 59, train_loss: 0.6907, test_loss: 1.2541, test_f1: 0.4916
 epoch: 60, train_loss: 0.7009, test_loss: 1.1892, test_f1: 0.5131
 epoch: 61, train_loss: 0.6945, test_loss: 1.2181, test_f1: 0.5077
 epoch: 62, train_loss: 0.6963, test_loss: 1.2077, test_f1: 0.5218
 epoch: 63, train_loss: 0.6941, test_loss: 1.2107, test_f1: 0.5152
 epoch: 64, train_loss: 0.6768, test_loss: 1.2505, test_f1: 0.4941
 epoch: 65, train_loss: 0.6723, test_loss: 1.2235, test_f1: 0.5202
 epoch: 66, train_loss: 0.6817, test_loss: 1.2185, test_f1: 0.5143
 epoch: 67, train_loss: 0.6776, test_loss: 1.2448, test_f1: 0.5256
 epoch: 68, train_loss: 0.6697, test_loss: 1.2167, test_f1: 0.5258
 epoch: 69, train_loss: 0.6789, test_loss: 1.2422, test_f1: 0.5258
 epoch: 70, train_loss: 0.6639, test_loss: 1.2780, test_f1: 0.5075
 epoch: 71, train_loss: 0.6623, test_loss: 1.2384, test_f1: 0.5033
 epoch: 72, train_loss: 0.6807, test_loss: 1.2456, test_f1: 0.5130
 epoch: 73, train_loss: 0.6712, test_loss: 1.2734, test_f1: 0.4976
 epoch: 74, train_loss: 0.6738, test_loss: 1.2586, test_f1: 0.5030
 epoch: 75, train_loss: 0.6627, test_loss: 1.2547, test_f1: 0.4836
 epoch: 76, train_loss: 0.6593, test_loss: 1.3130, test_f1: 0.5169
 epoch: 77, train_loss: 0.6644, test_loss: 1.3006, test_f1: 0.5129
 epoch: 78, train_loss: 0.6621, test_loss: 1.2337, test_f1: 0.5217
 epoch: 79, train_loss: 0.6729, test_loss: 1.2872, test_f1: 0.5162
 epoch: 80, train_loss: 0.6666, test_loss: 1.3088, test_f1: 0.5023
 epoch: 81, train_loss: 0.6493, test_loss: 1.2246, test_f1: 0.5429
 epoch: 82, train_loss: 0.6528, test_loss: 1.2906, test_f1: 0.5217
 epoch: 83, train_loss: 0.6535, test_loss: 1.2989, test_f1: 0.4983
 epoch: 84, train_loss: 0.6417, test_loss: 1.3011, test_f1: 0.5149
 epoch: 85, train_loss: 0.6404, test_loss: 1.3186, test_f1: 0.5039
 epoch: 86, train_loss: 0.6376, test_loss: 1.2635, test_f1: 0.5045
 epoch: 87, train_loss: 0.6345, test_loss: 1.3081, test_f1: 0.5210
 epoch: 88, train_loss: 0.6499, test_loss: 1.3032, test_f1: 0.5206
 epoch: 89, train_loss: 0.6502, test_loss: 1.3186, test_f1: 0.5074
 epoch: 90, train_loss: 0.6287, test_loss: 1.2807, test_f1: 0.5038
 epoch: 91, train_loss: 0.6233, test_loss: 1.2864, test_f1: 0.4973
 epoch: 92, train_loss: 0.6364, test_loss: 1.3016, test_f1: 0.5231
 epoch: 93, train_loss: 0.6406, test_loss: 1.2975, test_f1: 0.5145
 epoch: 94, train_loss: 0.6304, test_loss: 1.2609, test_f1: 0.5247
 epoch: 95, train_loss: 0.6192, test_loss: 1.2428, test_f1: 0.5281
 epoch: 96, train_loss: 0.6315, test_loss: 1.2487, test_f1: 0.5205
 epoch: 97, train_loss: 0.6126, test_loss: 1.3009, test_f1: 0.5385
 epoch: 98, train_loss: 0.6214, test_loss: 1.2911, test_f1: 0.5120
 epoch: 99, train_loss: 0.6213, test_loss: 1.2878, test_f1: 0.5116
##################ITERATION #1 ****************************************
 epoch: 0, train_loss: 1.2654, test_loss: 1.1857, test_f1: 0.4437
 epoch: 1, train_loss: 1.1912, test_loss: 1.1405, test_f1: 0.4475
 epoch: 2, train_loss: 1.1531, test_loss: 1.1032, test_f1: 0.4718
 epoch: 3, train_loss: 1.1318, test_loss: 1.0762, test_f1: 0.4711
 epoch: 4, train_loss: 1.0979, test_loss: 1.0573, test_f1: 0.4519
 epoch: 5, train_loss: 1.0843, test_loss: 1.0352, test_f1: 0.4733
 epoch: 6, train_loss: 1.0586, test_loss: 1.0089, test_f1: 0.4789
 epoch: 7, train_loss: 1.0431, test_loss: 1.0251, test_f1: 0.4788
 epoch: 8, train_loss: 1.0336, test_loss: 1.0074, test_f1: 0.4943
 epoch: 9, train_loss: 1.0168, test_loss: 0.9924, test_f1: 0.4793
 epoch: 10, train_loss: 0.9969, test_loss: 0.9739, test_f1: 0.4934
 epoch: 11, train_loss: 0.9830, test_loss: 0.9569, test_f1: 0.5064
 epoch: 12, train_loss: 0.9668, test_loss: 0.9423, test_f1: 0.5015
 epoch: 13, train_loss: 0.9543, test_loss: 0.9601, test_f1: 0.4852
 epoch: 14, train_loss: 0.9572, test_loss: 0.9874, test_f1: 0.4770
 epoch: 15, train_loss: 0.9400, test_loss: 0.9460, test_f1: 0.4715
 epoch: 16, train_loss: 0.9348, test_loss: 0.9392, test_f1: 0.4774
 epoch: 17, train_loss: 0.9221, test_loss: 0.9262, test_f1: 0.4989
 epoch: 18, train_loss: 0.9177, test_loss: 0.9255, test_f1: 0.5086
 epoch: 19, train_loss: 0.8959, test_loss: 0.9431, test_f1: 0.5146
 epoch: 20, train_loss: 0.9045, test_loss: 0.9408, test_f1: 0.5053
 epoch: 21, train_loss: 0.8906, test_loss: 0.9536, test_f1: 0.4946
 epoch: 22, train_loss: 0.8877, test_loss: 0.9504, test_f1: 0.5109
 epoch: 23, train_loss: 0.8794, test_loss: 0.9575, test_f1: 0.4949
 epoch: 24, train_loss: 0.8577, test_loss: 0.9500, test_f1: 0.4965
 epoch: 25, train_loss: 0.8590, test_loss: 0.9311, test_f1: 0.5175
 epoch: 26, train_loss: 0.8555, test_loss: 0.9422, test_f1: 0.4934
 epoch: 27, train_loss: 0.8544, test_loss: 0.9682, test_f1: 0.5001
 epoch: 28, train_loss: 0.8457, test_loss: 0.9436, test_f1: 0.5217
 epoch: 29, train_loss: 0.8484, test_loss: 0.9702, test_f1: 0.4995
 epoch: 30, train_loss: 0.8407, test_loss: 0.9552, test_f1: 0.5000
 epoch: 31, train_loss: 0.8471, test_loss: 0.9193, test_f1: 0.5414
 epoch: 32, train_loss: 0.8216, test_loss: 0.9589, test_f1: 0.5163
 epoch: 33, train_loss: 0.8353, test_loss: 0.9483, test_f1: 0.5155
 epoch: 34, train_loss: 0.8020, test_loss: 0.9632, test_f1: 0.5195
 epoch: 35, train_loss: 0.8052, test_loss: 0.9520, test_f1: 0.5355
 epoch: 36, train_loss: 0.8120, test_loss: 0.9730, test_f1: 0.5242
 epoch: 37, train_loss: 0.7942, test_loss: 0.9629, test_f1: 0.5270
 epoch: 38, train_loss: 0.7898, test_loss: 0.9638, test_f1: 0.5308
 epoch: 39, train_loss: 0.7756, test_loss: 1.0433, test_f1: 0.5074
 epoch: 40, train_loss: 0.7822, test_loss: 0.9712, test_f1: 0.5252
 epoch: 41, train_loss: 0.7710, test_loss: 0.9711, test_f1: 0.5108
 epoch: 42, train_loss: 0.7696, test_loss: 0.9911, test_f1: 0.5235
 epoch: 43, train_loss: 0.7671, test_loss: 0.9655, test_f1: 0.5348
 epoch: 44, train_loss: 0.7549, test_loss: 0.9662, test_f1: 0.5625
 epoch: 45, train_loss: 0.7578, test_loss: 1.0072, test_f1: 0.5236
 epoch: 46, train_loss: 0.7408, test_loss: 0.9883, test_f1: 0.5199
 epoch: 47, train_loss: 0.7547, test_loss: 0.9867, test_f1: 0.5480
 epoch: 48, train_loss: 0.7391, test_loss: 0.9777, test_f1: 0.5493
 epoch: 49, train_loss: 0.7395, test_loss: 1.0055, test_f1: 0.5278
 epoch: 50, train_loss: 0.7395, test_loss: 1.0323, test_f1: 0.5023
 epoch: 51, train_loss: 0.7279, test_loss: 1.0182, test_f1: 0.5094
 epoch: 52, train_loss: 0.7125, test_loss: 1.0197, test_f1: 0.5441
 epoch: 53, train_loss: 0.7085, test_loss: 1.0164, test_f1: 0.5355
 epoch: 54, train_loss: 0.7011, test_loss: 0.9756, test_f1: 0.5372
 epoch: 55, train_loss: 0.7049, test_loss: 1.0161, test_f1: 0.5335
 epoch: 56, train_loss: 0.6980, test_loss: 0.9986, test_f1: 0.5287
 epoch: 57, train_loss: 0.7094, test_loss: 1.0229, test_f1: 0.5297
 epoch: 58, train_loss: 0.6919, test_loss: 1.0028, test_f1: 0.5332
 epoch: 59, train_loss: 0.6917, test_loss: 1.0379, test_f1: 0.5055
 epoch: 60, train_loss: 0.6899, test_loss: 1.0057, test_f1: 0.5239
 epoch: 61, train_loss: 0.6833, test_loss: 1.0284, test_f1: 0.5204
 epoch: 62, train_loss: 0.6882, test_loss: 1.0717, test_f1: 0.5208
 epoch: 63, train_loss: 0.6896, test_loss: 1.0466, test_f1: 0.5299
 epoch: 64, train_loss: 0.6834, test_loss: 1.0718, test_f1: 0.5069
 epoch: 65, train_loss: 0.6791, test_loss: 1.0331, test_f1: 0.5503
 epoch: 66, train_loss: 0.6799, test_loss: 1.0529, test_f1: 0.5096
 epoch: 67, train_loss: 0.6690, test_loss: 1.0723, test_f1: 0.5276
 epoch: 68, train_loss: 0.6724, test_loss: 1.0769, test_f1: 0.5293
 epoch: 69, train_loss: 0.6630, test_loss: 1.0491, test_f1: 0.5342
 epoch: 70, train_loss: 0.6699, test_loss: 1.0506, test_f1: 0.5296
 epoch: 71, train_loss: 0.6689, test_loss: 1.1038, test_f1: 0.5195
 epoch: 72, train_loss: 0.6617, test_loss: 1.0573, test_f1: 0.5324
 epoch: 73, train_loss: 0.6735, test_loss: 1.0947, test_f1: 0.5112
 epoch: 74, train_loss: 0.6453, test_loss: 1.0809, test_f1: 0.5379
 epoch: 75, train_loss: 0.6597, test_loss: 1.0559, test_f1: 0.5414
 epoch: 76, train_loss: 0.6736, test_loss: 1.0973, test_f1: 0.5318
 epoch: 77, train_loss: 0.6503, test_loss: 1.1162, test_f1: 0.5090
 epoch: 78, train_loss: 0.6503, test_loss: 1.1406, test_f1: 0.5014
 epoch: 79, train_loss: 0.6444, test_loss: 1.1224, test_f1: 0.5171
 epoch: 80, train_loss: 0.6500, test_loss: 1.0571, test_f1: 0.5341
 epoch: 81, train_loss: 0.6469, test_loss: 1.0688, test_f1: 0.5193
 epoch: 82, train_loss: 0.6391, test_loss: 1.1162, test_f1: 0.5196
 epoch: 83, train_loss: 0.6359, test_loss: 1.1246, test_f1: 0.5303
 epoch: 84, train_loss: 0.6259, test_loss: 1.1486, test_f1: 0.5253
 epoch: 85, train_loss: 0.6262, test_loss: 1.1241, test_f1: 0.5074
 epoch: 86, train_loss: 0.6384, test_loss: 1.1343, test_f1: 0.5227
 epoch: 87, train_loss: 0.6415, test_loss: 1.1313, test_f1: 0.5249
 epoch: 88, train_loss: 0.6271, test_loss: 1.0693, test_f1: 0.5317
 epoch: 89, train_loss: 0.6293, test_loss: 1.1677, test_f1: 0.5210
 epoch: 90, train_loss: 0.6266, test_loss: 1.1034, test_f1: 0.5245
 epoch: 91, train_loss: 0.6399, test_loss: 1.0945, test_f1: 0.5391
 epoch: 92, train_loss: 0.6141, test_loss: 1.1340, test_f1: 0.5174
 epoch: 93, train_loss: 0.6234, test_loss: 1.1305, test_f1: 0.5229
 epoch: 94, train_loss: 0.6143, test_loss: 1.1653, test_f1: 0.5340
 epoch: 95, train_loss: 0.6095, test_loss: 1.2047, test_f1: 0.5278
 epoch: 96, train_loss: 0.6060, test_loss: 1.1642, test_f1: 0.5091
 epoch: 97, train_loss: 0.6068, test_loss: 1.1178, test_f1: 0.5290
 epoch: 98, train_loss: 0.6107, test_loss: 1.1843, test_f1: 0.5210
 epoch: 99, train_loss: 0.6083, test_loss: 1.1926, test_f1: 0.5313
##################ITERATION #2 ****************************************
 epoch: 0, train_loss: 1.2520, test_loss: 1.1533, test_f1: 0.4195
 epoch: 1, train_loss: 1.1743, test_loss: 1.1193, test_f1: 0.4205
 epoch: 2, train_loss: 1.1435, test_loss: 1.0953, test_f1: 0.4430
 epoch: 3, train_loss: 1.1241, test_loss: 1.0853, test_f1: 0.4401
 epoch: 4, train_loss: 1.1002, test_loss: 1.0523, test_f1: 0.4532
 epoch: 5, train_loss: 1.0803, test_loss: 1.0268, test_f1: 0.4703
 epoch: 6, train_loss: 1.0649, test_loss: 1.0180, test_f1: 0.4347
 epoch: 7, train_loss: 1.0511, test_loss: 0.9997, test_f1: 0.4527
 epoch: 8, train_loss: 1.0288, test_loss: 0.9946, test_f1: 0.4861
 epoch: 9, train_loss: 1.0206, test_loss: 0.9796, test_f1: 0.4912
 epoch: 10, train_loss: 1.0081, test_loss: 0.9883, test_f1: 0.4814
 epoch: 11, train_loss: 1.0010, test_loss: 0.9739, test_f1: 0.4822
 epoch: 12, train_loss: 0.9831, test_loss: 0.9724, test_f1: 0.4892
 epoch: 13, train_loss: 0.9652, test_loss: 0.9604, test_f1: 0.4701
 epoch: 14, train_loss: 0.9673, test_loss: 0.9649, test_f1: 0.4733
 epoch: 15, train_loss: 0.9571, test_loss: 0.9616, test_f1: 0.4918
 epoch: 16, train_loss: 0.9498, test_loss: 0.9311, test_f1: 0.4985
 epoch: 17, train_loss: 0.9488, test_loss: 0.9456, test_f1: 0.4825
 epoch: 18, train_loss: 0.9236, test_loss: 0.9344, test_f1: 0.5087
 epoch: 19, train_loss: 0.9156, test_loss: 0.9738, test_f1: 0.4886
 epoch: 20, train_loss: 0.9249, test_loss: 0.9454, test_f1: 0.5084
 epoch: 21, train_loss: 0.9176, test_loss: 0.9396, test_f1: 0.5051
 epoch: 22, train_loss: 0.8947, test_loss: 0.9345, test_f1: 0.5065
 epoch: 23, train_loss: 0.8895, test_loss: 0.9772, test_f1: 0.5011
 epoch: 24, train_loss: 0.9030, test_loss: 0.9259, test_f1: 0.5120
 epoch: 25, train_loss: 0.8796, test_loss: 0.9414, test_f1: 0.5193
 epoch: 26, train_loss: 0.8763, test_loss: 0.9601, test_f1: 0.5057
 epoch: 27, train_loss: 0.8668, test_loss: 0.9693, test_f1: 0.4964
 epoch: 28, train_loss: 0.8667, test_loss: 0.9556, test_f1: 0.4803
 epoch: 29, train_loss: 0.8617, test_loss: 0.9686, test_f1: 0.4844
 epoch: 30, train_loss: 0.8469, test_loss: 0.9619, test_f1: 0.5172
 epoch: 31, train_loss: 0.8511, test_loss: 0.9766, test_f1: 0.5186
 epoch: 32, train_loss: 0.8529, test_loss: 0.9910, test_f1: 0.5175
 epoch: 33, train_loss: 0.8447, test_loss: 0.9599, test_f1: 0.5142
 epoch: 34, train_loss: 0.8314, test_loss: 0.9534, test_f1: 0.5155
 epoch: 35, train_loss: 0.8414, test_loss: 0.9567, test_f1: 0.5175
 epoch: 36, train_loss: 0.8193, test_loss: 0.9655, test_f1: 0.5195
 epoch: 37, train_loss: 0.8238, test_loss: 0.9791, test_f1: 0.5150
 epoch: 38, train_loss: 0.8197, test_loss: 0.9501, test_f1: 0.5342
 epoch: 39, train_loss: 0.8061, test_loss: 0.9811, test_f1: 0.5260
 epoch: 40, train_loss: 0.7926, test_loss: 0.9982, test_f1: 0.5258
 epoch: 41, train_loss: 0.7965, test_loss: 0.9785, test_f1: 0.5465
 epoch: 42, train_loss: 0.8140, test_loss: 0.9862, test_f1: 0.5390
 epoch: 43, train_loss: 0.7966, test_loss: 0.9829, test_f1: 0.5194
 epoch: 44, train_loss: 0.7773, test_loss: 1.0023, test_f1: 0.5154
 epoch: 45, train_loss: 0.7773, test_loss: 0.9895, test_f1: 0.5304
 epoch: 46, train_loss: 0.7820, test_loss: 0.9911, test_f1: 0.5280
 epoch: 47, train_loss: 0.7686, test_loss: 0.9887, test_f1: 0.5154
 epoch: 48, train_loss: 0.7799, test_loss: 0.9770, test_f1: 0.5493
 epoch: 49, train_loss: 0.7894, test_loss: 1.0023, test_f1: 0.5438
 epoch: 50, train_loss: 0.7619, test_loss: 0.9870, test_f1: 0.5418
 epoch: 51, train_loss: 0.7480, test_loss: 1.0366, test_f1: 0.5309
 epoch: 52, train_loss: 0.7447, test_loss: 1.0139, test_f1: 0.5265
 epoch: 53, train_loss: 0.7366, test_loss: 1.0053, test_f1: 0.5445
 epoch: 54, train_loss: 0.7356, test_loss: 1.0627, test_f1: 0.5257
 epoch: 55, train_loss: 0.7328, test_loss: 1.0450, test_f1: 0.5252
 epoch: 56, train_loss: 0.7316, test_loss: 1.0187, test_f1: 0.5180
 epoch: 57, train_loss: 0.7255, test_loss: 1.0490, test_f1: 0.5166
 epoch: 58, train_loss: 0.7254, test_loss: 1.0576, test_f1: 0.5090
 epoch: 59, train_loss: 0.7282, test_loss: 1.0576, test_f1: 0.5251
 epoch: 60, train_loss: 0.7183, test_loss: 1.0427, test_f1: 0.5317
 epoch: 61, train_loss: 0.7282, test_loss: 1.0602, test_f1: 0.5250
 epoch: 62, train_loss: 0.7179, test_loss: 1.0574, test_f1: 0.5328
 epoch: 63, train_loss: 0.7199, test_loss: 1.0494, test_f1: 0.5288
 epoch: 64, train_loss: 0.7135, test_loss: 1.0522, test_f1: 0.5271
 epoch: 65, train_loss: 0.7140, test_loss: 1.0864, test_f1: 0.5343
 epoch: 66, train_loss: 0.7089, test_loss: 1.0887, test_f1: 0.4903
 epoch: 67, train_loss: 0.7058, test_loss: 1.0703, test_f1: 0.5310
 epoch: 68, train_loss: 0.7062, test_loss: 1.0807, test_f1: 0.5226
 epoch: 69, train_loss: 0.7151, test_loss: 1.1244, test_f1: 0.4852
 epoch: 70, train_loss: 0.7035, test_loss: 1.1020, test_f1: 0.5110
 epoch: 71, train_loss: 0.6985, test_loss: 1.0818, test_f1: 0.5373
 epoch: 72, train_loss: 0.6909, test_loss: 1.0736, test_f1: 0.5408
 epoch: 73, train_loss: 0.6967, test_loss: 1.0725, test_f1: 0.5213
 epoch: 74, train_loss: 0.6934, test_loss: 1.0596, test_f1: 0.5155
 epoch: 75, train_loss: 0.6814, test_loss: 1.1490, test_f1: 0.5253
 epoch: 76, train_loss: 0.6886, test_loss: 1.0758, test_f1: 0.5416
 epoch: 77, train_loss: 0.6944, test_loss: 1.1440, test_f1: 0.4997
 epoch: 78, train_loss: 0.6819, test_loss: 1.1530, test_f1: 0.5116
 epoch: 79, train_loss: 0.6807, test_loss: 1.0814, test_f1: 0.5014
 epoch: 80, train_loss: 0.6737, test_loss: 1.1173, test_f1: 0.5174
 epoch: 81, train_loss: 0.6832, test_loss: 1.0657, test_f1: 0.5097
 epoch: 82, train_loss: 0.6692, test_loss: 1.1201, test_f1: 0.5182
 epoch: 83, train_loss: 0.6740, test_loss: 1.1215, test_f1: 0.5167
 epoch: 84, train_loss: 0.6858, test_loss: 1.1678, test_f1: 0.5242
 epoch: 85, train_loss: 0.6696, test_loss: 1.1110, test_f1: 0.5329
 epoch: 86, train_loss: 0.6714, test_loss: 1.1365, test_f1: 0.5147
 epoch: 87, train_loss: 0.6721, test_loss: 1.1361, test_f1: 0.5284
 epoch: 88, train_loss: 0.6627, test_loss: 1.1566, test_f1: 0.5081
 epoch: 89, train_loss: 0.6564, test_loss: 1.1637, test_f1: 0.5222
 epoch: 90, train_loss: 0.6648, test_loss: 1.0935, test_f1: 0.5179
 epoch: 91, train_loss: 0.6576, test_loss: 1.1466, test_f1: 0.5319
 epoch: 92, train_loss: 0.6647, test_loss: 1.1714, test_f1: 0.5367
 epoch: 93, train_loss: 0.6566, test_loss: 1.1991, test_f1: 0.4968
 epoch: 94, train_loss: 0.6535, test_loss: 1.1730, test_f1: 0.5114
 epoch: 95, train_loss: 0.6541, test_loss: 1.1806, test_f1: 0.5020
 epoch: 96, train_loss: 0.6379, test_loss: 1.2002, test_f1: 0.5145
 epoch: 97, train_loss: 0.6460, test_loss: 1.1972, test_f1: 0.5346
 epoch: 98, train_loss: 0.6424, test_loss: 1.2404, test_f1: 0.4976
 epoch: 99, train_loss: 0.6497, test_loss: 1.2169, test_f1: 0.5165
##################ITERATION #3 ****************************************
 epoch: 0, train_loss: 1.2651, test_loss: 1.1700, test_f1: 0.4219
 epoch: 1, train_loss: 1.1908, test_loss: 1.1215, test_f1: 0.4515
 epoch: 2, train_loss: 1.1521, test_loss: 1.0923, test_f1: 0.4578
 epoch: 3, train_loss: 1.1393, test_loss: 1.0827, test_f1: 0.4568
 epoch: 4, train_loss: 1.1166, test_loss: 1.0522, test_f1: 0.4533
 epoch: 5, train_loss: 1.0956, test_loss: 1.0401, test_f1: 0.4522
 epoch: 6, train_loss: 1.0827, test_loss: 1.0219, test_f1: 0.4844
 epoch: 7, train_loss: 1.0597, test_loss: 1.0038, test_f1: 0.4718
 epoch: 8, train_loss: 1.0442, test_loss: 0.9818, test_f1: 0.4818
 epoch: 9, train_loss: 1.0278, test_loss: 0.9719, test_f1: 0.4759
 epoch: 10, train_loss: 1.0224, test_loss: 0.9624, test_f1: 0.4929
 epoch: 11, train_loss: 1.0155, test_loss: 0.9454, test_f1: 0.5044
 epoch: 12, train_loss: 0.9924, test_loss: 0.9492, test_f1: 0.4914
 epoch: 13, train_loss: 0.9920, test_loss: 0.9287, test_f1: 0.5351
 epoch: 14, train_loss: 0.9793, test_loss: 0.9263, test_f1: 0.4996
 epoch: 15, train_loss: 0.9700, test_loss: 0.9212, test_f1: 0.5241
 epoch: 16, train_loss: 0.9644, test_loss: 0.9198, test_f1: 0.5445
 epoch: 17, train_loss: 0.9492, test_loss: 0.9149, test_f1: 0.5237
 epoch: 18, train_loss: 0.9582, test_loss: 0.9111, test_f1: 0.5095
 epoch: 19, train_loss: 0.9431, test_loss: 0.9036, test_f1: 0.5332
 epoch: 20, train_loss: 0.9194, test_loss: 0.9098, test_f1: 0.5016
 epoch: 21, train_loss: 0.9167, test_loss: 0.9169, test_f1: 0.4848
 epoch: 22, train_loss: 0.9044, test_loss: 0.9174, test_f1: 0.4962
 epoch: 23, train_loss: 0.9028, test_loss: 0.9361, test_f1: 0.5163
 epoch: 24, train_loss: 0.9076, test_loss: 0.9145, test_f1: 0.5073
 epoch: 25, train_loss: 0.8957, test_loss: 0.9157, test_f1: 0.4984
 epoch: 26, train_loss: 0.8842, test_loss: 0.9106, test_f1: 0.5055
 epoch: 27, train_loss: 0.8815, test_loss: 0.9411, test_f1: 0.4954
 epoch: 28, train_loss: 0.8805, test_loss: 0.9244, test_f1: 0.5128
 epoch: 29, train_loss: 0.8673, test_loss: 0.9192, test_f1: 0.5116
 epoch: 30, train_loss: 0.8870, test_loss: 0.9332, test_f1: 0.5248
 epoch: 31, train_loss: 0.8704, test_loss: 0.9382, test_f1: 0.5242
 epoch: 32, train_loss: 0.8666, test_loss: 0.9171, test_f1: 0.5213
 epoch: 33, train_loss: 0.8541, test_loss: 0.9091, test_f1: 0.5224
 epoch: 34, train_loss: 0.8624, test_loss: 0.9128, test_f1: 0.5212
 epoch: 35, train_loss: 0.8509, test_loss: 0.9344, test_f1: 0.5232
 epoch: 36, train_loss: 0.8397, test_loss: 0.9271, test_f1: 0.5245
 epoch: 37, train_loss: 0.8490, test_loss: 0.9155, test_f1: 0.5389
 epoch: 38, train_loss: 0.8350, test_loss: 0.9320, test_f1: 0.5229
 epoch: 39, train_loss: 0.8299, test_loss: 0.9258, test_f1: 0.5374
 epoch: 40, train_loss: 0.8225, test_loss: 0.9246, test_f1: 0.5354
 epoch: 41, train_loss: 0.8151, test_loss: 0.9396, test_f1: 0.5266
 epoch: 42, train_loss: 0.8155, test_loss: 0.9469, test_f1: 0.5358
 epoch: 43, train_loss: 0.8044, test_loss: 0.9654, test_f1: 0.5393
 epoch: 44, train_loss: 0.8082, test_loss: 0.9474, test_f1: 0.5306
 epoch: 45, train_loss: 0.8008, test_loss: 0.9720, test_f1: 0.5404
 epoch: 46, train_loss: 0.8067, test_loss: 0.9414, test_f1: 0.5274
 epoch: 47, train_loss: 0.8124, test_loss: 0.9731, test_f1: 0.5316
 epoch: 48, train_loss: 0.8015, test_loss: 0.9780, test_f1: 0.5339
 epoch: 49, train_loss: 0.7926, test_loss: 0.9244, test_f1: 0.5448
 epoch: 50, train_loss: 0.7778, test_loss: 1.0458, test_f1: 0.5224
 epoch: 51, train_loss: 0.7708, test_loss: 0.9534, test_f1: 0.5295
 epoch: 52, train_loss: 0.7552, test_loss: 0.9312, test_f1: 0.5315
 epoch: 53, train_loss: 0.7603, test_loss: 0.9918, test_f1: 0.5194
 epoch: 54, train_loss: 0.7496, test_loss: 0.9452, test_f1: 0.5258
 epoch: 55, train_loss: 0.7544, test_loss: 0.9492, test_f1: 0.5299
 epoch: 56, train_loss: 0.7498, test_loss: 0.9736, test_f1: 0.5358
 epoch: 57, train_loss: 0.7634, test_loss: 0.9539, test_f1: 0.5289
 epoch: 58, train_loss: 0.7458, test_loss: 0.9641, test_f1: 0.5203
 epoch: 59, train_loss: 0.7498, test_loss: 1.0540, test_f1: 0.5217
 epoch: 60, train_loss: 0.7423, test_loss: 0.9647, test_f1: 0.5439
 epoch: 61, train_loss: 0.7405, test_loss: 0.9791, test_f1: 0.5239
 epoch: 62, train_loss: 0.7394, test_loss: 0.9815, test_f1: 0.5282
 epoch: 63, train_loss: 0.7240, test_loss: 0.9733, test_f1: 0.5298
 epoch: 64, train_loss: 0.7279, test_loss: 0.9560, test_f1: 0.5325
 epoch: 65, train_loss: 0.7389, test_loss: 1.0112, test_f1: 0.5251
 epoch: 66, train_loss: 0.7315, test_loss: 0.9829, test_f1: 0.5278
 epoch: 67, train_loss: 0.7332, test_loss: 0.9675, test_f1: 0.5540
 epoch: 68, train_loss: 0.7175, test_loss: 0.9880, test_f1: 0.5379
 epoch: 69, train_loss: 0.7224, test_loss: 1.0028, test_f1: 0.5338
 epoch: 70, train_loss: 0.7248, test_loss: 0.9792, test_f1: 0.5379
 epoch: 71, train_loss: 0.7149, test_loss: 1.0168, test_f1: 0.5331
 epoch: 72, train_loss: 0.7171, test_loss: 1.0048, test_f1: 0.5418
 epoch: 73, train_loss: 0.7035, test_loss: 0.9836, test_f1: 0.5282
 epoch: 74, train_loss: 0.7173, test_loss: 0.9779, test_f1: 0.5381
 epoch: 75, train_loss: 0.7087, test_loss: 1.0629, test_f1: 0.5203
 epoch: 76, train_loss: 0.6953, test_loss: 0.9638, test_f1: 0.5488
 epoch: 77, train_loss: 0.6970, test_loss: 1.0469, test_f1: 0.5360
 epoch: 78, train_loss: 0.7080, test_loss: 1.0832, test_f1: 0.5259
 epoch: 79, train_loss: 0.7078, test_loss: 1.0038, test_f1: 0.5380
 epoch: 80, train_loss: 0.6980, test_loss: 1.0234, test_f1: 0.5452
 epoch: 81, train_loss: 0.6916, test_loss: 1.0369, test_f1: 0.5357
 epoch: 82, train_loss: 0.6832, test_loss: 1.0398, test_f1: 0.5307
 epoch: 83, train_loss: 0.6961, test_loss: 1.0344, test_f1: 0.5473
 epoch: 84, train_loss: 0.6888, test_loss: 1.0246, test_f1: 0.5453
 epoch: 85, train_loss: 0.6754, test_loss: 1.0501, test_f1: 0.5338
 epoch: 86, train_loss: 0.6978, test_loss: 1.0078, test_f1: 0.5605
 epoch: 87, train_loss: 0.6898, test_loss: 1.0609, test_f1: 0.5206
 epoch: 88, train_loss: 0.6852, test_loss: 0.9985, test_f1: 0.5357
 epoch: 89, train_loss: 0.6751, test_loss: 1.0579, test_f1: 0.5467
 epoch: 90, train_loss: 0.6855, test_loss: 1.0555, test_f1: 0.5389
 epoch: 91, train_loss: 0.6877, test_loss: 1.0492, test_f1: 0.5475
 epoch: 92, train_loss: 0.6747, test_loss: 1.0571, test_f1: 0.5353
 epoch: 93, train_loss: 0.6585, test_loss: 1.0361, test_f1: 0.5395
 epoch: 94, train_loss: 0.6645, test_loss: 1.0660, test_f1: 0.5395
 epoch: 95, train_loss: 0.6681, test_loss: 1.0442, test_f1: 0.5474
 epoch: 96, train_loss: 0.6635, test_loss: 1.1118, test_f1: 0.5530
 epoch: 97, train_loss: 0.6593, test_loss: 1.1172, test_f1: 0.5556
 epoch: 98, train_loss: 0.6681, test_loss: 1.0243, test_f1: 0.5580
 epoch: 99, train_loss: 0.6736, test_loss: 1.0666, test_f1: 0.5439
##################ITERATION #4 ****************************************
 epoch: 0, train_loss: 1.2538, test_loss: 1.1093, test_f1: 0.4566
 epoch: 1, train_loss: 1.1549, test_loss: 1.0800, test_f1: 0.4766
 epoch: 2, train_loss: 1.1267, test_loss: 1.0622, test_f1: 0.4774
 epoch: 3, train_loss: 1.1048, test_loss: 1.0517, test_f1: 0.4654
 epoch: 4, train_loss: 1.0884, test_loss: 1.0276, test_f1: 0.4504
 epoch: 5, train_loss: 1.0699, test_loss: 1.0135, test_f1: 0.4593
 epoch: 6, train_loss: 1.0537, test_loss: 1.0126, test_f1: 0.4532
 epoch: 7, train_loss: 1.0459, test_loss: 1.0056, test_f1: 0.4613
 epoch: 8, train_loss: 1.0270, test_loss: 1.0199, test_f1: 0.4504
 epoch: 9, train_loss: 1.0220, test_loss: 1.0177, test_f1: 0.4524
 epoch: 10, train_loss: 1.0068, test_loss: 0.9928, test_f1: 0.4668
 epoch: 11, train_loss: 0.9958, test_loss: 1.0151, test_f1: 0.4615
 epoch: 12, train_loss: 0.9862, test_loss: 1.0129, test_f1: 0.4604
 epoch: 13, train_loss: 0.9774, test_loss: 0.9802, test_f1: 0.4893
 epoch: 14, train_loss: 0.9710, test_loss: 0.9888, test_f1: 0.4833
 epoch: 15, train_loss: 0.9581, test_loss: 0.9907, test_f1: 0.5038
 epoch: 16, train_loss: 0.9594, test_loss: 0.9862, test_f1: 0.4949
 epoch: 17, train_loss: 0.9489, test_loss: 0.9844, test_f1: 0.4954
 epoch: 18, train_loss: 0.9422, test_loss: 0.9857, test_f1: 0.4941
 epoch: 19, train_loss: 0.9369, test_loss: 0.9718, test_f1: 0.4961
 epoch: 20, train_loss: 0.9215, test_loss: 0.9600, test_f1: 0.5003
 epoch: 21, train_loss: 0.9075, test_loss: 0.9999, test_f1: 0.4855
 epoch: 22, train_loss: 0.9160, test_loss: 0.9889, test_f1: 0.5155
 epoch: 23, train_loss: 0.9017, test_loss: 1.0042, test_f1: 0.5183
 epoch: 24, train_loss: 0.8897, test_loss: 0.9807, test_f1: 0.5289
 epoch: 25, train_loss: 0.8873, test_loss: 0.9908, test_f1: 0.4884
 epoch: 26, train_loss: 0.8846, test_loss: 1.0031, test_f1: 0.5071
 epoch: 27, train_loss: 0.8916, test_loss: 1.0255, test_f1: 0.4951
 epoch: 28, train_loss: 0.8964, test_loss: 1.0198, test_f1: 0.4966
 epoch: 29, train_loss: 0.8749, test_loss: 1.0447, test_f1: 0.5040
 epoch: 30, train_loss: 0.8722, test_loss: 1.0026, test_f1: 0.5055
 epoch: 31, train_loss: 0.8661, test_loss: 1.0130, test_f1: 0.5254
 epoch: 32, train_loss: 0.8549, test_loss: 1.0211, test_f1: 0.5136
 epoch: 33, train_loss: 0.8535, test_loss: 1.0009, test_f1: 0.5055
 epoch: 34, train_loss: 0.8381, test_loss: 1.0111, test_f1: 0.5144
 epoch: 35, train_loss: 0.8479, test_loss: 1.0214, test_f1: 0.5335
 epoch: 36, train_loss: 0.8382, test_loss: 1.0475, test_f1: 0.5074
 epoch: 37, train_loss: 0.8285, test_loss: 1.0325, test_f1: 0.5305
 epoch: 38, train_loss: 0.8356, test_loss: 1.0100, test_f1: 0.5274
 epoch: 39, train_loss: 0.8226, test_loss: 1.0626, test_f1: 0.5336
 epoch: 40, train_loss: 0.8218, test_loss: 1.0311, test_f1: 0.5362
 epoch: 41, train_loss: 0.8169, test_loss: 1.0374, test_f1: 0.5371
 epoch: 42, train_loss: 0.8292, test_loss: 1.0240, test_f1: 0.5273
 epoch: 43, train_loss: 0.8214, test_loss: 1.0304, test_f1: 0.5223
 epoch: 44, train_loss: 0.7988, test_loss: 1.0990, test_f1: 0.5023
 epoch: 45, train_loss: 0.7982, test_loss: 1.0730, test_f1: 0.5253
 epoch: 46, train_loss: 0.7876, test_loss: 1.0753, test_f1: 0.5117
 epoch: 47, train_loss: 0.7926, test_loss: 1.0424, test_f1: 0.5131
 epoch: 48, train_loss: 0.7864, test_loss: 1.0425, test_f1: 0.5306
 epoch: 49, train_loss: 0.7763, test_loss: 1.0694, test_f1: 0.5178
 epoch: 50, train_loss: 0.7653, test_loss: 1.0840, test_f1: 0.5293
 epoch: 51, train_loss: 0.7529, test_loss: 1.0619, test_f1: 0.5219
 epoch: 52, train_loss: 0.7565, test_loss: 1.0597, test_f1: 0.5435
 epoch: 53, train_loss: 0.7536, test_loss: 1.0831, test_f1: 0.5231
 epoch: 54, train_loss: 0.7451, test_loss: 1.0651, test_f1: 0.5498
 epoch: 55, train_loss: 0.7614, test_loss: 1.0386, test_f1: 0.5409
 epoch: 56, train_loss: 0.7398, test_loss: 1.0717, test_f1: 0.5307
 epoch: 57, train_loss: 0.7553, test_loss: 1.0635, test_f1: 0.5210
 epoch: 58, train_loss: 0.7402, test_loss: 1.0502, test_f1: 0.5437
 epoch: 59, train_loss: 0.7496, test_loss: 1.0840, test_f1: 0.5401
 epoch: 60, train_loss: 0.7394, test_loss: 1.1175, test_f1: 0.5297
 epoch: 61, train_loss: 0.7342, test_loss: 1.0753, test_f1: 0.5151
 epoch: 62, train_loss: 0.7426, test_loss: 1.1177, test_f1: 0.5143
 epoch: 63, train_loss: 0.7247, test_loss: 1.0892, test_f1: 0.5235
 epoch: 64, train_loss: 0.7309, test_loss: 1.0810, test_f1: 0.5432
 epoch: 65, train_loss: 0.7361, test_loss: 1.1046, test_f1: 0.5289
 epoch: 66, train_loss: 0.7232, test_loss: 1.0488, test_f1: 0.5400
 epoch: 67, train_loss: 0.7298, test_loss: 1.1158, test_f1: 0.5173
 epoch: 68, train_loss: 0.7184, test_loss: 1.0973, test_f1: 0.5353
 epoch: 69, train_loss: 0.7162, test_loss: 1.0763, test_f1: 0.5350
 epoch: 70, train_loss: 0.7178, test_loss: 1.1390, test_f1: 0.5297
 epoch: 71, train_loss: 0.7084, test_loss: 1.1199, test_f1: 0.5219
 epoch: 72, train_loss: 0.6999, test_loss: 1.1404, test_f1: 0.5079
 epoch: 73, train_loss: 0.7065, test_loss: 1.1328, test_f1: 0.5335
 epoch: 74, train_loss: 0.7122, test_loss: 1.1124, test_f1: 0.5422
 epoch: 75, train_loss: 0.6912, test_loss: 1.1022, test_f1: 0.5356
 epoch: 76, train_loss: 0.7107, test_loss: 1.1630, test_f1: 0.5082
 epoch: 77, train_loss: 0.7056, test_loss: 1.1364, test_f1: 0.5287
 epoch: 78, train_loss: 0.7003, test_loss: 1.1271, test_f1: 0.5048
 epoch: 79, train_loss: 0.6974, test_loss: 1.1285, test_f1: 0.5255
 epoch: 80, train_loss: 0.6818, test_loss: 1.1454, test_f1: 0.5406
 epoch: 81, train_loss: 0.6764, test_loss: 1.1776, test_f1: 0.5186
 epoch: 82, train_loss: 0.6787, test_loss: 1.1301, test_f1: 0.5108
 epoch: 83, train_loss: 0.6937, test_loss: 1.1654, test_f1: 0.5389
 epoch: 84, train_loss: 0.6844, test_loss: 1.2073, test_f1: 0.5188
 epoch: 85, train_loss: 0.6864, test_loss: 1.1495, test_f1: 0.5225
 epoch: 86, train_loss: 0.6766, test_loss: 1.1360, test_f1: 0.5316
 epoch: 87, train_loss: 0.6824, test_loss: 1.1723, test_f1: 0.5611
 epoch: 88, train_loss: 0.6764, test_loss: 1.1656, test_f1: 0.5358
 epoch: 89, train_loss: 0.6745, test_loss: 1.1388, test_f1: 0.5294
 epoch: 90, train_loss: 0.6739, test_loss: 1.1545, test_f1: 0.5504
 epoch: 91, train_loss: 0.6646, test_loss: 1.1432, test_f1: 0.5353
 epoch: 92, train_loss: 0.6663, test_loss: 1.2519, test_f1: 0.5388
 epoch: 93, train_loss: 0.6611, test_loss: 1.1881, test_f1: 0.5363
 epoch: 94, train_loss: 0.6622, test_loss: 1.1758, test_f1: 0.5496
 epoch: 95, train_loss: 0.6660, test_loss: 1.2497, test_f1: 0.5473
 epoch: 96, train_loss: 0.6562, test_loss: 1.2091, test_f1: 0.5493
 epoch: 97, train_loss: 0.6585, test_loss: 1.1895, test_f1: 0.5287
 epoch: 98, train_loss: 0.6660, test_loss: 1.1963, test_f1: 0.5475
 epoch: 99, train_loss: 0.6474, test_loss: 1.2166, test_f1: 0.5580
##################ITERATION #5 ****************************************
 epoch: 0, train_loss: 1.3061, test_loss: 1.1649, test_f1: 0.4230
 epoch: 1, train_loss: 1.1857, test_loss: 1.1245, test_f1: 0.4216
 epoch: 2, train_loss: 1.1628, test_loss: 1.0983, test_f1: 0.4259
 epoch: 3, train_loss: 1.1404, test_loss: 1.0923, test_f1: 0.4674
 epoch: 4, train_loss: 1.1244, test_loss: 1.0937, test_f1: 0.4168
 epoch: 5, train_loss: 1.1115, test_loss: 1.0699, test_f1: 0.4393
 epoch: 6, train_loss: 1.0831, test_loss: 1.0589, test_f1: 0.4299
 epoch: 7, train_loss: 1.0795, test_loss: 1.0499, test_f1: 0.4464
 epoch: 8, train_loss: 1.0664, test_loss: 1.0381, test_f1: 0.4592
 epoch: 9, train_loss: 1.0481, test_loss: 1.0066, test_f1: 0.4533
 epoch: 10, train_loss: 1.0318, test_loss: 1.0202, test_f1: 0.4568
 epoch: 11, train_loss: 1.0256, test_loss: 0.9953, test_f1: 0.4857
 epoch: 12, train_loss: 1.0102, test_loss: 1.0036, test_f1: 0.4496
 epoch: 13, train_loss: 1.0027, test_loss: 1.0175, test_f1: 0.4572
 epoch: 14, train_loss: 0.9970, test_loss: 1.0080, test_f1: 0.4789
 epoch: 15, train_loss: 0.9927, test_loss: 1.0058, test_f1: 0.4851
 epoch: 16, train_loss: 0.9805, test_loss: 0.9957, test_f1: 0.4691
 epoch: 17, train_loss: 0.9680, test_loss: 0.9782, test_f1: 0.4733
 epoch: 18, train_loss: 0.9617, test_loss: 0.9855, test_f1: 0.4750
 epoch: 19, train_loss: 0.9510, test_loss: 1.0007, test_f1: 0.4686
 epoch: 20, train_loss: 0.9448, test_loss: 0.9885, test_f1: 0.4661
 epoch: 21, train_loss: 0.9465, test_loss: 0.9571, test_f1: 0.5189
 epoch: 22, train_loss: 0.9404, test_loss: 1.0492, test_f1: 0.4682
 epoch: 23, train_loss: 0.9276, test_loss: 1.0074, test_f1: 0.4821
 epoch: 24, train_loss: 0.9266, test_loss: 0.9901, test_f1: 0.4790
 epoch: 25, train_loss: 0.9172, test_loss: 0.9719, test_f1: 0.5060
 epoch: 26, train_loss: 0.9141, test_loss: 0.9770, test_f1: 0.5012
 epoch: 27, train_loss: 0.8977, test_loss: 0.9692, test_f1: 0.4926
 epoch: 28, train_loss: 0.9048, test_loss: 0.9867, test_f1: 0.5082
 epoch: 29, train_loss: 0.8903, test_loss: 0.9995, test_f1: 0.5110
 epoch: 30, train_loss: 0.8944, test_loss: 0.9879, test_f1: 0.5121
 epoch: 31, train_loss: 0.8691, test_loss: 0.9760, test_f1: 0.5147
 epoch: 32, train_loss: 0.8710, test_loss: 0.9986, test_f1: 0.5124
 epoch: 33, train_loss: 0.8725, test_loss: 0.9823, test_f1: 0.5034
 epoch: 34, train_loss: 0.8591, test_loss: 1.0069, test_f1: 0.5011
 epoch: 35, train_loss: 0.8597, test_loss: 1.0469, test_f1: 0.4918
 epoch: 36, train_loss: 0.8633, test_loss: 0.9831, test_f1: 0.5240
 epoch: 37, train_loss: 0.8482, test_loss: 0.9893, test_f1: 0.5195
 epoch: 38, train_loss: 0.8381, test_loss: 1.0001, test_f1: 0.5022
 epoch: 39, train_loss: 0.8367, test_loss: 0.9970, test_f1: 0.5041
 epoch: 40, train_loss: 0.8360, test_loss: 1.0016, test_f1: 0.5173
 epoch: 41, train_loss: 0.8344, test_loss: 1.0103, test_f1: 0.5245
 epoch: 42, train_loss: 0.8281, test_loss: 0.9968, test_f1: 0.5330
 epoch: 43, train_loss: 0.8184, test_loss: 1.0299, test_f1: 0.5202
 epoch: 44, train_loss: 0.8145, test_loss: 1.0234, test_f1: 0.5307
 epoch: 45, train_loss: 0.8242, test_loss: 1.0162, test_f1: 0.5348
 epoch: 46, train_loss: 0.8092, test_loss: 1.0636, test_f1: 0.5139
 epoch: 47, train_loss: 0.8121, test_loss: 1.0100, test_f1: 0.5474
 epoch: 48, train_loss: 0.8022, test_loss: 1.0755, test_f1: 0.5342
 epoch: 49, train_loss: 0.7948, test_loss: 1.0378, test_f1: 0.5504
 epoch: 50, train_loss: 0.8076, test_loss: 1.0634, test_f1: 0.5179
 epoch: 51, train_loss: 0.7811, test_loss: 1.0212, test_f1: 0.5394
 epoch: 52, train_loss: 0.7807, test_loss: 1.0346, test_f1: 0.5425
 epoch: 53, train_loss: 0.7850, test_loss: 1.0335, test_f1: 0.5412
 epoch: 54, train_loss: 0.7683, test_loss: 1.0261, test_f1: 0.5291
 epoch: 55, train_loss: 0.7681, test_loss: 1.0618, test_f1: 0.5372
 epoch: 56, train_loss: 0.7612, test_loss: 1.0491, test_f1: 0.5399
 epoch: 57, train_loss: 0.7598, test_loss: 1.0369, test_f1: 0.5560
 epoch: 58, train_loss: 0.7687, test_loss: 1.0353, test_f1: 0.5350
 epoch: 59, train_loss: 0.7587, test_loss: 1.0331, test_f1: 0.5507
 epoch: 60, train_loss: 0.7716, test_loss: 1.0393, test_f1: 0.5255
 epoch: 61, train_loss: 0.7561, test_loss: 1.0584, test_f1: 0.5412
 epoch: 62, train_loss: 0.7459, test_loss: 1.0551, test_f1: 0.5488
 epoch: 63, train_loss: 0.7572, test_loss: 1.0483, test_f1: 0.5244
 epoch: 64, train_loss: 0.7605, test_loss: 1.0639, test_f1: 0.5400
 epoch: 65, train_loss: 0.7542, test_loss: 1.0612, test_f1: 0.5208
 epoch: 66, train_loss: 0.7479, test_loss: 1.0495, test_f1: 0.5378
 epoch: 67, train_loss: 0.7444, test_loss: 1.0517, test_f1: 0.5313
 epoch: 68, train_loss: 0.7438, test_loss: 1.0679, test_f1: 0.5408
 epoch: 69, train_loss: 0.7368, test_loss: 1.0785, test_f1: 0.5194
 epoch: 70, train_loss: 0.7330, test_loss: 1.0601, test_f1: 0.5524
 epoch: 71, train_loss: 0.7412, test_loss: 1.0644, test_f1: 0.5417
 epoch: 72, train_loss: 0.7327, test_loss: 1.0588, test_f1: 0.5527
 epoch: 73, train_loss: 0.7232, test_loss: 1.0657, test_f1: 0.5479
 epoch: 74, train_loss: 0.7315, test_loss: 1.0819, test_f1: 0.5339
 epoch: 75, train_loss: 0.7329, test_loss: 1.0719, test_f1: 0.5376
 epoch: 76, train_loss: 0.7370, test_loss: 1.1309, test_f1: 0.5168
 epoch: 77, train_loss: 0.7179, test_loss: 1.0979, test_f1: 0.5345
 epoch: 78, train_loss: 0.7204, test_loss: 1.1126, test_f1: 0.5309
 epoch: 79, train_loss: 0.7172, test_loss: 1.0680, test_f1: 0.5371
 epoch: 80, train_loss: 0.7377, test_loss: 1.1108, test_f1: 0.5495
 epoch: 81, train_loss: 0.7295, test_loss: 1.1049, test_f1: 0.5352
 epoch: 82, train_loss: 0.7150, test_loss: 1.1074, test_f1: 0.5423
 epoch: 83, train_loss: 0.7117, test_loss: 1.1199, test_f1: 0.5395
 epoch: 84, train_loss: 0.6973, test_loss: 1.0954, test_f1: 0.5381
 epoch: 85, train_loss: 0.7025, test_loss: 1.1003, test_f1: 0.5504
 epoch: 86, train_loss: 0.6990, test_loss: 1.1138, test_f1: 0.5562
 epoch: 87, train_loss: 0.7163, test_loss: 1.0770, test_f1: 0.5376
 epoch: 88, train_loss: 0.6947, test_loss: 1.1454, test_f1: 0.5307
 epoch: 89, train_loss: 0.6946, test_loss: 1.0993, test_f1: 0.5473
 epoch: 90, train_loss: 0.6876, test_loss: 1.0684, test_f1: 0.5624
 epoch: 91, train_loss: 0.7036, test_loss: 1.1312, test_f1: 0.5598
 epoch: 92, train_loss: 0.6998, test_loss: 1.0819, test_f1: 0.5440
 epoch: 93, train_loss: 0.7040, test_loss: 1.1514, test_f1: 0.5539
 epoch: 94, train_loss: 0.7048, test_loss: 1.1314, test_f1: 0.5184
 epoch: 95, train_loss: 0.6979, test_loss: 1.1114, test_f1: 0.5366
 epoch: 96, train_loss: 0.6863, test_loss: 1.1269, test_f1: 0.5428
 epoch: 97, train_loss: 0.6858, test_loss: 1.1445, test_f1: 0.5264
 epoch: 98, train_loss: 0.6861, test_loss: 1.1728, test_f1: 0.5564
 epoch: 99, train_loss: 0.6958, test_loss: 1.1273, test_f1: 0.5487
##################ITERATION #6 ****************************************
 epoch: 0, train_loss: 1.3320, test_loss: 1.1438, test_f1: 0.4306
 epoch: 1, train_loss: 1.1845, test_loss: 1.1151, test_f1: 0.4596
 epoch: 2, train_loss: 1.1597, test_loss: 1.0903, test_f1: 0.4515
 epoch: 3, train_loss: 1.1200, test_loss: 1.0602, test_f1: 0.4547
 epoch: 4, train_loss: 1.1142, test_loss: 1.0483, test_f1: 0.4245
 epoch: 5, train_loss: 1.0771, test_loss: 1.0507, test_f1: 0.4418
 epoch: 6, train_loss: 1.0653, test_loss: 1.0396, test_f1: 0.4406
 epoch: 7, train_loss: 1.0523, test_loss: 1.0070, test_f1: 0.4622
 epoch: 8, train_loss: 1.0441, test_loss: 0.9993, test_f1: 0.4797
 epoch: 9, train_loss: 1.0290, test_loss: 0.9890, test_f1: 0.4712
 epoch: 10, train_loss: 1.0184, test_loss: 0.9997, test_f1: 0.4590
 epoch: 11, train_loss: 1.0062, test_loss: 0.9775, test_f1: 0.4918
 epoch: 12, train_loss: 0.9780, test_loss: 0.9871, test_f1: 0.4879
 epoch: 13, train_loss: 0.9828, test_loss: 0.9651, test_f1: 0.4994
 epoch: 14, train_loss: 0.9794, test_loss: 0.9830, test_f1: 0.4898
 epoch: 15, train_loss: 0.9805, test_loss: 0.9537, test_f1: 0.4955
 epoch: 16, train_loss: 0.9588, test_loss: 0.9599, test_f1: 0.4960
 epoch: 17, train_loss: 0.9584, test_loss: 0.9837, test_f1: 0.5123
 epoch: 18, train_loss: 0.9406, test_loss: 1.0006, test_f1: 0.4979
 epoch: 19, train_loss: 0.9430, test_loss: 0.9684, test_f1: 0.4971
 epoch: 20, train_loss: 0.9305, test_loss: 0.9698, test_f1: 0.5124
 epoch: 21, train_loss: 0.9303, test_loss: 0.9871, test_f1: 0.4750
 epoch: 22, train_loss: 0.9204, test_loss: 0.9646, test_f1: 0.5248
 epoch: 23, train_loss: 0.9231, test_loss: 0.9601, test_f1: 0.5293
 epoch: 24, train_loss: 0.9056, test_loss: 0.9770, test_f1: 0.4890
 epoch: 25, train_loss: 0.8932, test_loss: 0.9756, test_f1: 0.4927
 epoch: 26, train_loss: 0.8973, test_loss: 0.9853, test_f1: 0.4884
 epoch: 27, train_loss: 0.8919, test_loss: 0.9927, test_f1: 0.5078
 epoch: 28, train_loss: 0.8673, test_loss: 0.9869, test_f1: 0.5115
 epoch: 29, train_loss: 0.8745, test_loss: 1.0158, test_f1: 0.5095
 epoch: 30, train_loss: 0.8722, test_loss: 0.9897, test_f1: 0.5167
 epoch: 31, train_loss: 0.8768, test_loss: 1.0163, test_f1: 0.5101
 epoch: 32, train_loss: 0.8535, test_loss: 1.0095, test_f1: 0.5082
 epoch: 33, train_loss: 0.8593, test_loss: 1.0190, test_f1: 0.5118
 epoch: 34, train_loss: 0.8495, test_loss: 1.0080, test_f1: 0.5274
 epoch: 35, train_loss: 0.8547, test_loss: 1.0859, test_f1: 0.4856
 epoch: 36, train_loss: 0.8439, test_loss: 1.0288, test_f1: 0.5057
 epoch: 37, train_loss: 0.8421, test_loss: 1.0194, test_f1: 0.5281
 epoch: 38, train_loss: 0.8295, test_loss: 1.0407, test_f1: 0.5061
 epoch: 39, train_loss: 0.8309, test_loss: 1.0245, test_f1: 0.5423
 epoch: 40, train_loss: 0.8296, test_loss: 0.9830, test_f1: 0.5402
 epoch: 41, train_loss: 0.8259, test_loss: 1.0080, test_f1: 0.5229
 epoch: 42, train_loss: 0.8108, test_loss: 1.0114, test_f1: 0.5421
 epoch: 43, train_loss: 0.8232, test_loss: 1.0340, test_f1: 0.5211
 epoch: 44, train_loss: 0.8093, test_loss: 1.0202, test_f1: 0.5066
 epoch: 45, train_loss: 0.8015, test_loss: 1.1458, test_f1: 0.4905
 epoch: 46, train_loss: 0.7834, test_loss: 1.0305, test_f1: 0.5316
 epoch: 47, train_loss: 0.7968, test_loss: 1.1066, test_f1: 0.5184
 epoch: 48, train_loss: 0.7907, test_loss: 1.0134, test_f1: 0.5177
 epoch: 49, train_loss: 0.7857, test_loss: 1.0679, test_f1: 0.5129
 epoch: 50, train_loss: 0.7818, test_loss: 1.0146, test_f1: 0.5310
 epoch: 51, train_loss: 0.7705, test_loss: 1.0630, test_f1: 0.5156
 epoch: 52, train_loss: 0.7666, test_loss: 1.0544, test_f1: 0.5011
 epoch: 53, train_loss: 0.7664, test_loss: 1.0624, test_f1: 0.5006
 epoch: 54, train_loss: 0.7521, test_loss: 1.0993, test_f1: 0.4901
 epoch: 55, train_loss: 0.7579, test_loss: 1.0968, test_f1: 0.4990
 epoch: 56, train_loss: 0.7639, test_loss: 1.0683, test_f1: 0.4924
 epoch: 57, train_loss: 0.7436, test_loss: 1.0897, test_f1: 0.5226
 epoch: 58, train_loss: 0.7447, test_loss: 1.1277, test_f1: 0.5037
 epoch: 59, train_loss: 0.7485, test_loss: 1.0878, test_f1: 0.5342
 epoch: 60, train_loss: 0.7460, test_loss: 1.1158, test_f1: 0.5250
 epoch: 61, train_loss: 0.7528, test_loss: 1.0957, test_f1: 0.5204
 epoch: 62, train_loss: 0.7455, test_loss: 1.1267, test_f1: 0.5138
 epoch: 63, train_loss: 0.7259, test_loss: 1.1253, test_f1: 0.5069
 epoch: 64, train_loss: 0.7330, test_loss: 1.1108, test_f1: 0.5073
 epoch: 65, train_loss: 0.7318, test_loss: 1.1435, test_f1: 0.5076
 epoch: 66, train_loss: 0.7275, test_loss: 1.1790, test_f1: 0.5023
 epoch: 67, train_loss: 0.7351, test_loss: 1.0963, test_f1: 0.5420
 epoch: 68, train_loss: 0.7294, test_loss: 1.0882, test_f1: 0.5386
 epoch: 69, train_loss: 0.7224, test_loss: 1.2221, test_f1: 0.5109
 epoch: 70, train_loss: 0.7169, test_loss: 1.1339, test_f1: 0.5126
 epoch: 71, train_loss: 0.7170, test_loss: 1.1715, test_f1: 0.5187
 epoch: 72, train_loss: 0.7146, test_loss: 1.1258, test_f1: 0.5099
 epoch: 73, train_loss: 0.7257, test_loss: 1.1288, test_f1: 0.5454
 epoch: 74, train_loss: 0.7125, test_loss: 1.2817, test_f1: 0.5050
 epoch: 75, train_loss: 0.7066, test_loss: 1.0759, test_f1: 0.5240
 epoch: 76, train_loss: 0.6983, test_loss: 1.1099, test_f1: 0.5349
 epoch: 77, train_loss: 0.7011, test_loss: 1.1465, test_f1: 0.5147
 epoch: 78, train_loss: 0.7205, test_loss: 1.2228, test_f1: 0.5250
 epoch: 79, train_loss: 0.7078, test_loss: 1.1455, test_f1: 0.5143
 epoch: 80, train_loss: 0.7040, test_loss: 1.2363, test_f1: 0.5096
 epoch: 81, train_loss: 0.7022, test_loss: 1.1897, test_f1: 0.5096
 epoch: 82, train_loss: 0.7000, test_loss: 1.1616, test_f1: 0.5160
 epoch: 83, train_loss: 0.6932, test_loss: 1.3052, test_f1: 0.5095
 epoch: 84, train_loss: 0.7033, test_loss: 1.2007, test_f1: 0.5179
 epoch: 85, train_loss: 0.6991, test_loss: 1.2531, test_f1: 0.5328
 epoch: 86, train_loss: 0.7039, test_loss: 1.2136, test_f1: 0.5319
 epoch: 87, train_loss: 0.6926, test_loss: 1.2413, test_f1: 0.5209
 epoch: 88, train_loss: 0.6983, test_loss: 1.1826, test_f1: 0.5328
 epoch: 89, train_loss: 0.6806, test_loss: 1.1393, test_f1: 0.5379
 epoch: 90, train_loss: 0.6955, test_loss: 1.2117, test_f1: 0.5147
 epoch: 91, train_loss: 0.7063, test_loss: 1.2166, test_f1: 0.5153
 epoch: 92, train_loss: 0.6834, test_loss: 1.2630, test_f1: 0.5167
 epoch: 93, train_loss: 0.6712, test_loss: 1.1367, test_f1: 0.5318
 epoch: 94, train_loss: 0.6703, test_loss: 1.2854, test_f1: 0.5338
 epoch: 95, train_loss: 0.6832, test_loss: 1.2056, test_f1: 0.5327
 epoch: 96, train_loss: 0.6796, test_loss: 1.1990, test_f1: 0.5348
 epoch: 97, train_loss: 0.6770, test_loss: 1.2665, test_f1: 0.5173
 epoch: 98, train_loss: 0.6886, test_loss: 1.2382, test_f1: 0.5200
 epoch: 99, train_loss: 0.6783, test_loss: 1.2481, test_f1: 0.5260
##################ITERATION #7 ****************************************
 epoch: 0, train_loss: 1.3161, test_loss: 1.1262, test_f1: 0.4582
 epoch: 1, train_loss: 1.1932, test_loss: 1.0946, test_f1: 0.4610
 epoch: 2, train_loss: 1.1575, test_loss: 1.0731, test_f1: 0.4656
 epoch: 3, train_loss: 1.1341, test_loss: 1.0573, test_f1: 0.4839
 epoch: 4, train_loss: 1.1208, test_loss: 1.0548, test_f1: 0.4679
 epoch: 5, train_loss: 1.1011, test_loss: 1.0165, test_f1: 0.4504
 epoch: 6, train_loss: 1.0896, test_loss: 1.0207, test_f1: 0.4416
 epoch: 7, train_loss: 1.0664, test_loss: 1.0033, test_f1: 0.4681
 epoch: 8, train_loss: 1.0510, test_loss: 0.9768, test_f1: 0.4836
 epoch: 9, train_loss: 1.0456, test_loss: 0.9932, test_f1: 0.4953
 epoch: 10, train_loss: 1.0375, test_loss: 0.9771, test_f1: 0.5073
 epoch: 11, train_loss: 1.0332, test_loss: 0.9918, test_f1: 0.5074
 epoch: 12, train_loss: 1.0098, test_loss: 0.9633, test_f1: 0.4748
 epoch: 13, train_loss: 0.9913, test_loss: 0.9622, test_f1: 0.4851
 epoch: 14, train_loss: 0.9947, test_loss: 0.9640, test_f1: 0.4938
 epoch: 15, train_loss: 0.9666, test_loss: 0.9611, test_f1: 0.5001
 epoch: 16, train_loss: 0.9697, test_loss: 0.9544, test_f1: 0.5058
 epoch: 17, train_loss: 0.9644, test_loss: 0.9640, test_f1: 0.5129
 epoch: 18, train_loss: 0.9675, test_loss: 0.9554, test_f1: 0.4892
 epoch: 19, train_loss: 0.9563, test_loss: 0.9675, test_f1: 0.5210
 epoch: 20, train_loss: 0.9539, test_loss: 0.9684, test_f1: 0.5047
 epoch: 21, train_loss: 0.9474, test_loss: 0.9503, test_f1: 0.5070
 epoch: 22, train_loss: 0.9364, test_loss: 0.9369, test_f1: 0.5102
 epoch: 23, train_loss: 0.9308, test_loss: 0.9529, test_f1: 0.5032
 epoch: 24, train_loss: 0.9142, test_loss: 0.9361, test_f1: 0.5247
 epoch: 25, train_loss: 0.9020, test_loss: 0.9281, test_f1: 0.5438
 epoch: 26, train_loss: 0.9033, test_loss: 0.9315, test_f1: 0.5312
 epoch: 27, train_loss: 0.9070, test_loss: 0.9219, test_f1: 0.5172
 epoch: 28, train_loss: 0.8966, test_loss: 0.9225, test_f1: 0.5028
 epoch: 29, train_loss: 0.8886, test_loss: 0.9382, test_f1: 0.5231
 epoch: 30, train_loss: 0.8850, test_loss: 0.9538, test_f1: 0.5175
 epoch: 31, train_loss: 0.8843, test_loss: 0.9403, test_f1: 0.5207
 epoch: 32, train_loss: 0.8848, test_loss: 0.9332, test_f1: 0.5244
 epoch: 33, train_loss: 0.8679, test_loss: 0.9347, test_f1: 0.5365
 epoch: 34, train_loss: 0.8674, test_loss: 0.9575, test_f1: 0.5379
 epoch: 35, train_loss: 0.8475, test_loss: 0.9607, test_f1: 0.5339
 epoch: 36, train_loss: 0.8404, test_loss: 0.9520, test_f1: 0.5275
 epoch: 37, train_loss: 0.8606, test_loss: 0.9575, test_f1: 0.5164
 epoch: 38, train_loss: 0.8411, test_loss: 0.9547, test_f1: 0.5465
 epoch: 39, train_loss: 0.8474, test_loss: 0.9902, test_f1: 0.5227
 epoch: 40, train_loss: 0.8327, test_loss: 0.9575, test_f1: 0.5270
 epoch: 41, train_loss: 0.8425, test_loss: 0.9418, test_f1: 0.5429
 epoch: 42, train_loss: 0.8257, test_loss: 1.0277, test_f1: 0.5174
 epoch: 43, train_loss: 0.8210, test_loss: 0.9314, test_f1: 0.5471
 epoch: 44, train_loss: 0.8124, test_loss: 0.9666, test_f1: 0.5272
 epoch: 45, train_loss: 0.8220, test_loss: 1.0108, test_f1: 0.5370
 epoch: 46, train_loss: 0.8053, test_loss: 0.9651, test_f1: 0.5370
 epoch: 47, train_loss: 0.8046, test_loss: 0.9971, test_f1: 0.5255
 epoch: 48, train_loss: 0.7945, test_loss: 0.9666, test_f1: 0.5269
 epoch: 49, train_loss: 0.8086, test_loss: 0.9824, test_f1: 0.5338
 epoch: 50, train_loss: 0.7946, test_loss: 0.9680, test_f1: 0.5517
 epoch: 51, train_loss: 0.7851, test_loss: 0.9880, test_f1: 0.5274
 epoch: 52, train_loss: 0.7779, test_loss: 0.9812, test_f1: 0.5418
 epoch: 53, train_loss: 0.7795, test_loss: 0.9693, test_f1: 0.5413
 epoch: 54, train_loss: 0.7675, test_loss: 0.9759, test_f1: 0.5475
 epoch: 55, train_loss: 0.7681, test_loss: 0.9805, test_f1: 0.5437
 epoch: 56, train_loss: 0.7744, test_loss: 0.9869, test_f1: 0.5353
 epoch: 57, train_loss: 0.7539, test_loss: 0.9739, test_f1: 0.5430
 epoch: 58, train_loss: 0.7622, test_loss: 0.9843, test_f1: 0.5382
 epoch: 59, train_loss: 0.7521, test_loss: 0.9795, test_f1: 0.5392
 epoch: 60, train_loss: 0.7489, test_loss: 0.9610, test_f1: 0.5454
 epoch: 61, train_loss: 0.7525, test_loss: 0.9702, test_f1: 0.5475
 epoch: 62, train_loss: 0.7446, test_loss: 0.9724, test_f1: 0.5517
 epoch: 63, train_loss: 0.7398, test_loss: 0.9711, test_f1: 0.5559
 epoch: 64, train_loss: 0.7575, test_loss: 0.9713, test_f1: 0.5471
 epoch: 65, train_loss: 0.7410, test_loss: 1.0083, test_f1: 0.5541
 epoch: 66, train_loss: 0.7467, test_loss: 0.9898, test_f1: 0.5564
 epoch: 67, train_loss: 0.7372, test_loss: 1.0118, test_f1: 0.5327
 epoch: 68, train_loss: 0.7374, test_loss: 1.0321, test_f1: 0.5413
 epoch: 69, train_loss: 0.7383, test_loss: 1.0102, test_f1: 0.5299
 epoch: 70, train_loss: 0.7344, test_loss: 1.0218, test_f1: 0.5382
 epoch: 71, train_loss: 0.7393, test_loss: 1.0027, test_f1: 0.5546
 epoch: 72, train_loss: 0.7231, test_loss: 0.9915, test_f1: 0.5348
 epoch: 73, train_loss: 0.7207, test_loss: 0.9820, test_f1: 0.5493
 epoch: 74, train_loss: 0.7294, test_loss: 0.9993, test_f1: 0.5611
 epoch: 75, train_loss: 0.7245, test_loss: 1.0013, test_f1: 0.5652
 epoch: 76, train_loss: 0.7257, test_loss: 1.0005, test_f1: 0.5412
 epoch: 77, train_loss: 0.7113, test_loss: 1.0098, test_f1: 0.5613
 epoch: 78, train_loss: 0.7139, test_loss: 0.9894, test_f1: 0.5633
 epoch: 79, train_loss: 0.7147, test_loss: 1.0121, test_f1: 0.5512
 epoch: 80, train_loss: 0.7099, test_loss: 1.0252, test_f1: 0.5440
 epoch: 81, train_loss: 0.7106, test_loss: 0.9905, test_f1: 0.5527
 epoch: 82, train_loss: 0.7063, test_loss: 1.0377, test_f1: 0.5614
 epoch: 83, train_loss: 0.7058, test_loss: 1.0113, test_f1: 0.5629
 epoch: 84, train_loss: 0.7086, test_loss: 1.0233, test_f1: 0.5623
 epoch: 85, train_loss: 0.6966, test_loss: 1.0417, test_f1: 0.5482
 epoch: 86, train_loss: 0.7001, test_loss: 1.0153, test_f1: 0.5650
 epoch: 87, train_loss: 0.6980, test_loss: 1.0366, test_f1: 0.5460
 epoch: 88, train_loss: 0.7037, test_loss: 1.0692, test_f1: 0.5514
 epoch: 89, train_loss: 0.6978, test_loss: 1.0512, test_f1: 0.5647
 epoch: 90, train_loss: 0.6994, test_loss: 1.0479, test_f1: 0.5553
 epoch: 91, train_loss: 0.6850, test_loss: 1.0512, test_f1: 0.5485
 epoch: 92, train_loss: 0.6820, test_loss: 1.0541, test_f1: 0.5428
 epoch: 93, train_loss: 0.6949, test_loss: 1.0539, test_f1: 0.5450
 epoch: 94, train_loss: 0.6873, test_loss: 1.0160, test_f1: 0.5548
 epoch: 95, train_loss: 0.6738, test_loss: 1.0376, test_f1: 0.5569
 epoch: 96, train_loss: 0.6643, test_loss: 1.0314, test_f1: 0.5551
 epoch: 97, train_loss: 0.6696, test_loss: 1.0346, test_f1: 0.5698
 epoch: 98, train_loss: 0.6720, test_loss: 1.0358, test_f1: 0.5504
 epoch: 99, train_loss: 0.6759, test_loss: 1.0521, test_f1: 0.5553
##################ITERATION #8 ****************************************
 epoch: 0, train_loss: 1.3821, test_loss: 1.1856, test_f1: 0.4302
 epoch: 1, train_loss: 1.2066, test_loss: 1.1000, test_f1: 0.4594
 epoch: 2, train_loss: 1.1806, test_loss: 1.0948, test_f1: 0.4465
 epoch: 3, train_loss: 1.1673, test_loss: 1.0697, test_f1: 0.4617
 epoch: 4, train_loss: 1.1215, test_loss: 1.0448, test_f1: 0.4877
 epoch: 5, train_loss: 1.1019, test_loss: 1.0217, test_f1: 0.4876
 epoch: 6, train_loss: 1.0953, test_loss: 1.0162, test_f1: 0.4836
 epoch: 7, train_loss: 1.0719, test_loss: 1.0133, test_f1: 0.4492
 epoch: 8, train_loss: 1.0654, test_loss: 0.9822, test_f1: 0.4825
 epoch: 9, train_loss: 1.0349, test_loss: 0.9925, test_f1: 0.4918
 epoch: 10, train_loss: 1.0353, test_loss: 0.9956, test_f1: 0.4738
 epoch: 11, train_loss: 1.0129, test_loss: 0.9811, test_f1: 0.4869
 epoch: 12, train_loss: 1.0012, test_loss: 0.9708, test_f1: 0.4957
 epoch: 13, train_loss: 1.0002, test_loss: 0.9723, test_f1: 0.4875
 epoch: 14, train_loss: 0.9897, test_loss: 0.9757, test_f1: 0.4984
 epoch: 15, train_loss: 0.9828, test_loss: 0.9706, test_f1: 0.4866
 epoch: 16, train_loss: 0.9756, test_loss: 0.9725, test_f1: 0.4807
 epoch: 17, train_loss: 0.9668, test_loss: 0.9676, test_f1: 0.4710
 epoch: 18, train_loss: 0.9466, test_loss: 0.9700, test_f1: 0.4781
 epoch: 19, train_loss: 0.9419, test_loss: 0.9640, test_f1: 0.4934
 epoch: 20, train_loss: 0.9405, test_loss: 1.0480, test_f1: 0.4798
 epoch: 21, train_loss: 0.9343, test_loss: 0.9479, test_f1: 0.4981
 epoch: 22, train_loss: 0.9310, test_loss: 0.9703, test_f1: 0.4953
 epoch: 23, train_loss: 0.9350, test_loss: 0.9576, test_f1: 0.4766
 epoch: 24, train_loss: 0.9154, test_loss: 0.9625, test_f1: 0.5040
 epoch: 25, train_loss: 0.9020, test_loss: 1.0220, test_f1: 0.4731
 epoch: 26, train_loss: 0.9037, test_loss: 0.9869, test_f1: 0.4916
 epoch: 27, train_loss: 0.8924, test_loss: 1.0129, test_f1: 0.4652
 epoch: 28, train_loss: 0.8988, test_loss: 1.0579, test_f1: 0.4935
 epoch: 29, train_loss: 0.8872, test_loss: 0.9986, test_f1: 0.4969
 epoch: 30, train_loss: 0.8735, test_loss: 1.0069, test_f1: 0.5048
 epoch: 31, train_loss: 0.8646, test_loss: 0.9660, test_f1: 0.5157
 epoch: 32, train_loss: 0.8795, test_loss: 0.9885, test_f1: 0.5028
 epoch: 33, train_loss: 0.8635, test_loss: 0.9792, test_f1: 0.4982
 epoch: 34, train_loss: 0.8652, test_loss: 0.9682, test_f1: 0.4971
 epoch: 35, train_loss: 0.8593, test_loss: 0.9825, test_f1: 0.4941
 epoch: 36, train_loss: 0.8468, test_loss: 0.9994, test_f1: 0.4783
 epoch: 37, train_loss: 0.8461, test_loss: 0.9690, test_f1: 0.4898
 epoch: 38, train_loss: 0.8604, test_loss: 0.9848, test_f1: 0.4554
 epoch: 39, train_loss: 0.8363, test_loss: 1.0041, test_f1: 0.4798
 epoch: 40, train_loss: 0.8311, test_loss: 1.1004, test_f1: 0.4634
 epoch: 41, train_loss: 0.8246, test_loss: 1.0190, test_f1: 0.4968
 epoch: 42, train_loss: 0.8203, test_loss: 0.9708, test_f1: 0.5058
 epoch: 43, train_loss: 0.8292, test_loss: 1.0163, test_f1: 0.4960
 epoch: 44, train_loss: 0.8053, test_loss: 1.0199, test_f1: 0.4910
 epoch: 45, train_loss: 0.8170, test_loss: 1.2609, test_f1: 0.4718
 epoch: 46, train_loss: 0.8120, test_loss: 0.9952, test_f1: 0.4945
 epoch: 47, train_loss: 0.7995, test_loss: 1.0628, test_f1: 0.4930
 epoch: 48, train_loss: 0.7878, test_loss: 1.0577, test_f1: 0.4953
 epoch: 49, train_loss: 0.7962, test_loss: 1.0291, test_f1: 0.5157
 epoch: 50, train_loss: 0.7947, test_loss: 1.1981, test_f1: 0.4779
 epoch: 51, train_loss: 0.7789, test_loss: 1.0139, test_f1: 0.5034
 epoch: 52, train_loss: 0.7596, test_loss: 1.0164, test_f1: 0.4995
 epoch: 53, train_loss: 0.7576, test_loss: 1.0146, test_f1: 0.5024
 epoch: 54, train_loss: 0.7493, test_loss: 1.0167, test_f1: 0.5082
 epoch: 55, train_loss: 0.7659, test_loss: 1.0684, test_f1: 0.4993
 epoch: 56, train_loss: 0.7481, test_loss: 1.0647, test_f1: 0.4738
 epoch: 57, train_loss: 0.7439, test_loss: 1.1649, test_f1: 0.4814
 epoch: 58, train_loss: 0.7502, test_loss: 1.0731, test_f1: 0.4803
 epoch: 59, train_loss: 0.7472, test_loss: 1.1010, test_f1: 0.4922
 epoch: 60, train_loss: 0.7386, test_loss: 1.0668, test_f1: 0.4978
 epoch: 61, train_loss: 0.7320, test_loss: 1.0556, test_f1: 0.4870
 epoch: 62, train_loss: 0.7383, test_loss: 1.1036, test_f1: 0.4938
 epoch: 63, train_loss: 0.7330, test_loss: 1.0357, test_f1: 0.5054
 epoch: 64, train_loss: 0.7449, test_loss: 1.0449, test_f1: 0.4848
 epoch: 65, train_loss: 0.7269, test_loss: 1.0668, test_f1: 0.5154
 epoch: 66, train_loss: 0.7152, test_loss: 1.0867, test_f1: 0.4892
 epoch: 67, train_loss: 0.7307, test_loss: 1.0714, test_f1: 0.4710
 epoch: 68, train_loss: 0.7288, test_loss: 1.1253, test_f1: 0.4726
 epoch: 69, train_loss: 0.7320, test_loss: 1.1266, test_f1: 0.4638
 epoch: 70, train_loss: 0.7140, test_loss: 1.0595, test_f1: 0.4854
 epoch: 71, train_loss: 0.7146, test_loss: 1.0981, test_f1: 0.4904
 epoch: 72, train_loss: 0.7396, test_loss: 1.0639, test_f1: 0.4981
 epoch: 73, train_loss: 0.7116, test_loss: 1.1117, test_f1: 0.4907
 epoch: 74, train_loss: 0.7185, test_loss: 1.0691, test_f1: 0.5070
 epoch: 75, train_loss: 0.7112, test_loss: 1.3224, test_f1: 0.4746
 epoch: 76, train_loss: 0.6971, test_loss: 1.0585, test_f1: 0.4853
 epoch: 77, train_loss: 0.7087, test_loss: 1.0564, test_f1: 0.4980
 epoch: 78, train_loss: 0.7031, test_loss: 1.0505, test_f1: 0.5148
 epoch: 79, train_loss: 0.7048, test_loss: 1.0702, test_f1: 0.4849
 epoch: 80, train_loss: 0.6935, test_loss: 1.0613, test_f1: 0.4930
 epoch: 81, train_loss: 0.6970, test_loss: 1.0851, test_f1: 0.5139
 epoch: 82, train_loss: 0.7123, test_loss: 1.1305, test_f1: 0.4982
 epoch: 83, train_loss: 0.6989, test_loss: 1.0476, test_f1: 0.5059
 epoch: 84, train_loss: 0.6993, test_loss: 1.1143, test_f1: 0.4928
 epoch: 85, train_loss: 0.6994, test_loss: 1.0977, test_f1: 0.5023
 epoch: 86, train_loss: 0.6851, test_loss: 1.1552, test_f1: 0.4886
 epoch: 87, train_loss: 0.6947, test_loss: 1.0891, test_f1: 0.5000
 epoch: 88, train_loss: 0.6759, test_loss: 1.0924, test_f1: 0.4925
 epoch: 89, train_loss: 0.6759, test_loss: 1.4093, test_f1: 0.4673
 epoch: 90, train_loss: 0.7007, test_loss: 1.1339, test_f1: 0.5031
 epoch: 91, train_loss: 0.6726, test_loss: 1.1164, test_f1: 0.4891
 epoch: 92, train_loss: 0.6958, test_loss: 1.0865, test_f1: 0.5067
 epoch: 93, train_loss: 0.6764, test_loss: 1.1363, test_f1: 0.5014
 epoch: 94, train_loss: 0.6740, test_loss: 1.1677, test_f1: 0.4916
 epoch: 95, train_loss: 0.6806, test_loss: 1.1613, test_f1: 0.4875
 epoch: 96, train_loss: 0.6680, test_loss: 1.1395, test_f1: 0.4971
 epoch: 97, train_loss: 0.6753, test_loss: 1.2284, test_f1: 0.4884
 epoch: 98, train_loss: 0.6656, test_loss: 1.2465, test_f1: 0.4987
 epoch: 99, train_loss: 0.6686, test_loss: 1.2360, test_f1: 0.4880
##################ITERATION #9 ****************************************
 epoch: 0, train_loss: 1.3466, test_loss: 1.1242, test_f1: 0.4587
 epoch: 1, train_loss: 1.2165, test_loss: 1.0900, test_f1: 0.4858
 epoch: 2, train_loss: 1.1772, test_loss: 1.0729, test_f1: 0.4923
 epoch: 3, train_loss: 1.1476, test_loss: 1.0521, test_f1: 0.4761
 epoch: 4, train_loss: 1.1218, test_loss: 1.0459, test_f1: 0.4860
 epoch: 5, train_loss: 1.0956, test_loss: 1.0355, test_f1: 0.4810
 epoch: 6, train_loss: 1.0885, test_loss: 1.0272, test_f1: 0.4678
 epoch: 7, train_loss: 1.0607, test_loss: 1.0110, test_f1: 0.4936
 epoch: 8, train_loss: 1.0490, test_loss: 0.9900, test_f1: 0.4728
 epoch: 9, train_loss: 1.0333, test_loss: 0.9933, test_f1: 0.4661
 epoch: 10, train_loss: 1.0272, test_loss: 0.9813, test_f1: 0.4968
 epoch: 11, train_loss: 1.0081, test_loss: 0.9800, test_f1: 0.4845
 epoch: 12, train_loss: 1.0024, test_loss: 0.9675, test_f1: 0.4963
 epoch: 13, train_loss: 0.9966, test_loss: 0.9607, test_f1: 0.4879
 epoch: 14, train_loss: 0.9800, test_loss: 0.9479, test_f1: 0.5060
 epoch: 15, train_loss: 0.9767, test_loss: 0.9591, test_f1: 0.5040
 epoch: 16, train_loss: 0.9612, test_loss: 0.9631, test_f1: 0.5115
 epoch: 17, train_loss: 0.9555, test_loss: 0.9809, test_f1: 0.4886
 epoch: 18, train_loss: 0.9548, test_loss: 0.9717, test_f1: 0.5143
 epoch: 19, train_loss: 0.9477, test_loss: 0.9583, test_f1: 0.5014
 epoch: 20, train_loss: 0.9398, test_loss: 0.9610, test_f1: 0.5046
 epoch: 21, train_loss: 0.9214, test_loss: 0.9837, test_f1: 0.5145
 epoch: 22, train_loss: 0.9200, test_loss: 0.9507, test_f1: 0.5058
 epoch: 23, train_loss: 0.9286, test_loss: 0.9338, test_f1: 0.5294
 epoch: 24, train_loss: 0.9195, test_loss: 0.9727, test_f1: 0.5044
 epoch: 25, train_loss: 0.9028, test_loss: 0.9646, test_f1: 0.5279
 epoch: 26, train_loss: 0.8926, test_loss: 0.9663, test_f1: 0.5142
 epoch: 27, train_loss: 0.8838, test_loss: 0.9707, test_f1: 0.5293
 epoch: 28, train_loss: 0.8783, test_loss: 0.9810, test_f1: 0.5217
 epoch: 29, train_loss: 0.8681, test_loss: 0.9700, test_f1: 0.5191
 epoch: 30, train_loss: 0.8723, test_loss: 0.9745, test_f1: 0.5206
 epoch: 31, train_loss: 0.8790, test_loss: 0.9900, test_f1: 0.5091
 epoch: 32, train_loss: 0.8621, test_loss: 0.9738, test_f1: 0.5346
 epoch: 33, train_loss: 0.8563, test_loss: 1.0107, test_f1: 0.5325
 epoch: 34, train_loss: 0.8472, test_loss: 1.0077, test_f1: 0.5391
 epoch: 35, train_loss: 0.8436, test_loss: 0.9597, test_f1: 0.5312
 epoch: 36, train_loss: 0.8447, test_loss: 1.0278, test_f1: 0.5258
 epoch: 37, train_loss: 0.8420, test_loss: 1.0127, test_f1: 0.5017
 epoch: 38, train_loss: 0.8304, test_loss: 1.0524, test_f1: 0.5093
 epoch: 39, train_loss: 0.8209, test_loss: 1.0261, test_f1: 0.5128
 epoch: 40, train_loss: 0.8286, test_loss: 1.0858, test_f1: 0.4944
 epoch: 41, train_loss: 0.8216, test_loss: 1.0340, test_f1: 0.5212
 epoch: 42, train_loss: 0.8287, test_loss: 1.0925, test_f1: 0.5250
 epoch: 43, train_loss: 0.8188, test_loss: 1.0014, test_f1: 0.5244
 epoch: 44, train_loss: 0.8158, test_loss: 1.0355, test_f1: 0.5284
 epoch: 45, train_loss: 0.7925, test_loss: 1.0791, test_f1: 0.4897
 epoch: 46, train_loss: 0.7979, test_loss: 1.0552, test_f1: 0.5121
 epoch: 47, train_loss: 0.8049, test_loss: 1.0323, test_f1: 0.5310
 epoch: 48, train_loss: 0.7902, test_loss: 1.0968, test_f1: 0.5162
 epoch: 49, train_loss: 0.7949, test_loss: 1.0337, test_f1: 0.5064
 epoch: 50, train_loss: 0.7904, test_loss: 1.1302, test_f1: 0.5002
 epoch: 51, train_loss: 0.7776, test_loss: 1.1034, test_f1: 0.5261
 epoch: 52, train_loss: 0.7585, test_loss: 1.1181, test_f1: 0.5056
 epoch: 53, train_loss: 0.7748, test_loss: 1.1263, test_f1: 0.5151
 epoch: 54, train_loss: 0.7561, test_loss: 1.0888, test_f1: 0.5161
 epoch: 55, train_loss: 0.7571, test_loss: 1.1020, test_f1: 0.5314
 epoch: 56, train_loss: 0.7422, test_loss: 1.0925, test_f1: 0.5190
 epoch: 57, train_loss: 0.7639, test_loss: 1.1323, test_f1: 0.5199
 epoch: 58, train_loss: 0.7503, test_loss: 1.1132, test_f1: 0.5136
 epoch: 59, train_loss: 0.7542, test_loss: 1.1090, test_f1: 0.5235
 epoch: 60, train_loss: 0.7398, test_loss: 1.1302, test_f1: 0.5281
 epoch: 61, train_loss: 0.7473, test_loss: 1.1203, test_f1: 0.5147
 epoch: 62, train_loss: 0.7413, test_loss: 1.1344, test_f1: 0.5096
 epoch: 63, train_loss: 0.7346, test_loss: 1.1591, test_f1: 0.5012
 epoch: 64, train_loss: 0.7371, test_loss: 1.1547, test_f1: 0.5082
 epoch: 65, train_loss: 0.7444, test_loss: 1.1609, test_f1: 0.5207
 epoch: 66, train_loss: 0.7330, test_loss: 1.1203, test_f1: 0.5247
 epoch: 67, train_loss: 0.7277, test_loss: 1.1494, test_f1: 0.5302
 epoch: 68, train_loss: 0.7125, test_loss: 1.1263, test_f1: 0.5297
 epoch: 69, train_loss: 0.7228, test_loss: 1.1201, test_f1: 0.5219
 epoch: 70, train_loss: 0.7247, test_loss: 1.1471, test_f1: 0.5242
 epoch: 71, train_loss: 0.7272, test_loss: 1.1419, test_f1: 0.5441
 epoch: 72, train_loss: 0.7168, test_loss: 1.1599, test_f1: 0.5146
 epoch: 73, train_loss: 0.7060, test_loss: 1.1803, test_f1: 0.5312
 epoch: 74, train_loss: 0.7108, test_loss: 1.1167, test_f1: 0.5233
 epoch: 75, train_loss: 0.7265, test_loss: 1.1949, test_f1: 0.5185
 epoch: 76, train_loss: 0.7171, test_loss: 1.2025, test_f1: 0.5067
 epoch: 77, train_loss: 0.7107, test_loss: 1.1662, test_f1: 0.5412
 epoch: 78, train_loss: 0.7107, test_loss: 1.1646, test_f1: 0.4996
 epoch: 79, train_loss: 0.7009, test_loss: 1.1529, test_f1: 0.5223
 epoch: 80, train_loss: 0.7076, test_loss: 1.1457, test_f1: 0.5342
 epoch: 81, train_loss: 0.6981, test_loss: 1.1686, test_f1: 0.5300
 epoch: 82, train_loss: 0.7011, test_loss: 1.1328, test_f1: 0.5275
 epoch: 83, train_loss: 0.6909, test_loss: 1.1974, test_f1: 0.5303
 epoch: 84, train_loss: 0.6981, test_loss: 1.2235, test_f1: 0.5229
 epoch: 85, train_loss: 0.7090, test_loss: 1.2195, test_f1: 0.5073
 epoch: 86, train_loss: 0.6729, test_loss: 1.1942, test_f1: 0.5281
 epoch: 87, train_loss: 0.6884, test_loss: 1.2064, test_f1: 0.5150
 epoch: 88, train_loss: 0.6954, test_loss: 1.1747, test_f1: 0.5317
 epoch: 89, train_loss: 0.6786, test_loss: 1.1957, test_f1: 0.5362
 epoch: 90, train_loss: 0.6809, test_loss: 1.1765, test_f1: 0.5423
 epoch: 91, train_loss: 0.6931, test_loss: 1.2176, test_f1: 0.5297
 epoch: 92, train_loss: 0.6876, test_loss: 1.1698, test_f1: 0.5429
 epoch: 93, train_loss: 0.6656, test_loss: 1.2105, test_f1: 0.5263
 epoch: 94, train_loss: 0.6656, test_loss: 1.1963, test_f1: 0.5298
 epoch: 95, train_loss: 0.6717, test_loss: 1.2204, test_f1: 0.5182
 epoch: 96, train_loss: 0.6775, test_loss: 1.2464, test_f1: 0.5257
 epoch: 97, train_loss: 0.6800, test_loss: 1.2415, test_f1: 0.5107
 epoch: 98, train_loss: 0.6669, test_loss: 1.2141, test_f1: 0.5229
 epoch: 99, train_loss: 0.6628, test_loss: 1.2012, test_f1: 0.5554

Training completed in 794.65 seconds
Best F1: 0.5698 at epoch 97
Mean F1 across iterations: 0.5525  0.0147
========================FINAL RESULTS================================
FEGIN weighted F1: 0.5698  0.0147
python main.py --data ltspice_examples --representation component_component --model FEGIN --layers 2 --hiddens 128 --batch_size 32 --lr 0.0001 --emb_size 250 --epochs 100 --save_appendix component_component_L2_H128_BS32_LR0.0001_E250 --no_val
-----



STDERR:
  File "main.py", line 370, in <module>
    main()
  File "main.py", line 254, in main
    dataset = dataset_class(
  File "/home/philip/projects/ltspice_examples_code_repo/Circuit-Completion-Using-GNNs/component_classification_with_link_prediction_head/evaluation/FEGIN/kernel/circuit_datasets.py", line 15, in __init__
    self.data, self.slices = torch.load(self.processed_paths[0])
  File "/home/philip/.local/lib/python3.8/site-packages/torch/serialization.py", line 1040, in load
    warnings.warn(
  File "/usr/lib/python3.8/warnings.py", line 109, in _showwarnmsg
    sw(msg.message, msg.category, msg.filename, msg.lineno,
  File "main.py", line 47, in warn_with_traceback
    traceback.print_stack(file=log)
/home/philip/projects/ltspice_examples_code_repo/Circuit-Completion-Using-GNNs/component_classification_with_link_prediction_head/evaluation/FEGIN/kernel/circuit_datasets.py:15: FutureWarning: You are using `torch.load` with `weights_only=False` (the current default value), which uses the default pickle module implicitly. It is possible to construct malicious pickle data which will execute arbitrary code during unpickling (See https://github.com/pytorch/pytorch/blob/main/SECURITY.md#untrusted-models for more details). In a future release, the default value for `weights_only` will be flipped to `True`. This limits the functions that could be executed during unpickling. Arbitrary objects will no longer be allowed to be loaded via this mode unless they are explicitly allowlisted by the user via `torch.serialization.add_safe_globals`. We recommend you start setting `weights_only=True` for any use case where you don't have full control of the loaded file. Please open an issue on GitHub for any issues related to this experimental feature.
  self.data, self.slices = torch.load(self.processed_paths[0])
