STDOUT:
Results will be saved in /home/philip/projects/ltspice_examples_code_repo/Circuit-Completion-Using-GNNs/component_classification_with_link_prediction_head/evaluation/FEGIN/results/model_FEGIN_dataset_ltspice_examples
Command line input: python main.py --data ltspice_examples --representation component_net --model FEGIN --layers 5 --hiddens 64 --batch_size 128 --lr 0.0001 --emb_size 512 --epochs 100 --save_appendix component_net_L5_H64_BS128_LR0.0001_E512 --no_val
 is saved.
-----
ltspice_examples - FEGIN
Using 5 layers, 64 hidden units, h = 2
Loading component_net representation dataset
ENTERED
Training FEGIN on component_net representation
Train: 3558, Test: 846
##################ITERATION #0 ****************************************
 epoch: 0, train_loss: 1.4016, test_loss: 1.3970, test_f1: 0.0793
 epoch: 1, train_loss: 1.3828, test_loss: 1.3819, test_f1: 0.2046
 epoch: 2, train_loss: 1.3663, test_loss: 1.3574, test_f1: 0.3959
 epoch: 3, train_loss: 1.3444, test_loss: 1.3298, test_f1: 0.3627
 epoch: 4, train_loss: 1.3195, test_loss: 1.3019, test_f1: 0.3303
 epoch: 5, train_loss: 1.2909, test_loss: 1.2723, test_f1: 0.3149
 epoch: 6, train_loss: 1.2631, test_loss: 1.2473, test_f1: 0.3139
 epoch: 7, train_loss: 1.2382, test_loss: 1.2247, test_f1: 0.3270
 epoch: 8, train_loss: 1.2165, test_loss: 1.2030, test_f1: 0.3379
 epoch: 9, train_loss: 1.1949, test_loss: 1.1828, test_f1: 0.3341
 epoch: 10, train_loss: 1.1817, test_loss: 1.1625, test_f1: 0.3490
 epoch: 11, train_loss: 1.1641, test_loss: 1.1431, test_f1: 0.3506
 epoch: 12, train_loss: 1.1425, test_loss: 1.1244, test_f1: 0.3523
 epoch: 13, train_loss: 1.1300, test_loss: 1.1074, test_f1: 0.3720
 epoch: 14, train_loss: 1.1145, test_loss: 1.0922, test_f1: 0.3988
 epoch: 15, train_loss: 1.0992, test_loss: 1.0765, test_f1: 0.4480
 epoch: 16, train_loss: 1.0843, test_loss: 1.0668, test_f1: 0.4774
 epoch: 17, train_loss: 1.0757, test_loss: 1.0549, test_f1: 0.4792
 epoch: 18, train_loss: 1.0549, test_loss: 1.0353, test_f1: 0.4978
 epoch: 19, train_loss: 1.0478, test_loss: 1.0259, test_f1: 0.5148
 epoch: 20, train_loss: 1.0274, test_loss: 1.0125, test_f1: 0.5259
 epoch: 21, train_loss: 1.0150, test_loss: 0.9922, test_f1: 0.5256
 epoch: 22, train_loss: 0.9977, test_loss: 0.9761, test_f1: 0.5279
 epoch: 23, train_loss: 0.9929, test_loss: 0.9611, test_f1: 0.5265
 epoch: 24, train_loss: 0.9721, test_loss: 0.9470, test_f1: 0.5308
 epoch: 25, train_loss: 0.9575, test_loss: 0.9668, test_f1: 0.5273
 epoch: 26, train_loss: 0.9431, test_loss: 0.9459, test_f1: 0.4964
 epoch: 27, train_loss: 0.9371, test_loss: 0.9507, test_f1: 0.4973
 epoch: 28, train_loss: 0.9190, test_loss: 0.9298, test_f1: 0.5194
 epoch: 29, train_loss: 0.9106, test_loss: 0.9258, test_f1: 0.5146
 epoch: 30, train_loss: 0.9078, test_loss: 0.9159, test_f1: 0.5175
 epoch: 31, train_loss: 0.8951, test_loss: 0.9318, test_f1: 0.5147
 epoch: 32, train_loss: 0.8961, test_loss: 0.9382, test_f1: 0.5133
 epoch: 33, train_loss: 0.8897, test_loss: 0.9459, test_f1: 0.5200
 epoch: 34, train_loss: 0.8849, test_loss: 0.9248, test_f1: 0.5200
 epoch: 35, train_loss: 0.8737, test_loss: 0.9444, test_f1: 0.5077
 epoch: 36, train_loss: 0.8702, test_loss: 0.9059, test_f1: 0.5217
 epoch: 37, train_loss: 0.8580, test_loss: 0.9446, test_f1: 0.5304
 epoch: 38, train_loss: 0.8602, test_loss: 0.9184, test_f1: 0.5285
 epoch: 39, train_loss: 0.8563, test_loss: 0.9369, test_f1: 0.5312
 epoch: 40, train_loss: 0.8498, test_loss: 0.9403, test_f1: 0.5250
 epoch: 41, train_loss: 0.8486, test_loss: 0.9103, test_f1: 0.5308
 epoch: 42, train_loss: 0.8477, test_loss: 0.9462, test_f1: 0.5144
 epoch: 43, train_loss: 0.8367, test_loss: 0.9335, test_f1: 0.5100
 epoch: 44, train_loss: 0.8299, test_loss: 0.9820, test_f1: 0.5219
 epoch: 45, train_loss: 0.8340, test_loss: 0.9334, test_f1: 0.5383
 epoch: 46, train_loss: 0.8202, test_loss: 0.9301, test_f1: 0.5209
 epoch: 47, train_loss: 0.8140, test_loss: 0.9392, test_f1: 0.5240
 epoch: 48, train_loss: 0.8148, test_loss: 0.9739, test_f1: 0.5191
 epoch: 49, train_loss: 0.8121, test_loss: 0.9391, test_f1: 0.5305
 epoch: 50, train_loss: 0.8133, test_loss: 0.9437, test_f1: 0.5208
 epoch: 51, train_loss: 0.8079, test_loss: 0.9484, test_f1: 0.5338
 epoch: 52, train_loss: 0.7875, test_loss: 0.9440, test_f1: 0.5305
 epoch: 53, train_loss: 0.7871, test_loss: 0.9444, test_f1: 0.5420
 epoch: 54, train_loss: 0.7900, test_loss: 0.9456, test_f1: 0.5603
 epoch: 55, train_loss: 0.7819, test_loss: 0.9341, test_f1: 0.5453
 epoch: 56, train_loss: 0.7922, test_loss: 0.9496, test_f1: 0.5475
 epoch: 57, train_loss: 0.7813, test_loss: 0.9474, test_f1: 0.5448
 epoch: 58, train_loss: 0.7849, test_loss: 0.9747, test_f1: 0.5441
 epoch: 59, train_loss: 0.7925, test_loss: 0.9402, test_f1: 0.5449
 epoch: 60, train_loss: 0.7866, test_loss: 0.9484, test_f1: 0.5493
 epoch: 61, train_loss: 0.7763, test_loss: 0.9527, test_f1: 0.5412
 epoch: 62, train_loss: 0.7740, test_loss: 0.9736, test_f1: 0.5380
 epoch: 63, train_loss: 0.7893, test_loss: 0.9630, test_f1: 0.5525
 epoch: 64, train_loss: 0.7788, test_loss: 0.9643, test_f1: 0.5381
 epoch: 65, train_loss: 0.7646, test_loss: 0.9765, test_f1: 0.5330
 epoch: 66, train_loss: 0.7770, test_loss: 0.9456, test_f1: 0.5464
 epoch: 67, train_loss: 0.7750, test_loss: 0.9725, test_f1: 0.5320
 epoch: 68, train_loss: 0.7748, test_loss: 0.9653, test_f1: 0.5296
 epoch: 69, train_loss: 0.7698, test_loss: 0.9660, test_f1: 0.5419
 epoch: 70, train_loss: 0.7746, test_loss: 0.9709, test_f1: 0.5558
 epoch: 71, train_loss: 0.7690, test_loss: 0.9720, test_f1: 0.5394
 epoch: 72, train_loss: 0.7607, test_loss: 0.9766, test_f1: 0.5413
 epoch: 73, train_loss: 0.7634, test_loss: 0.9703, test_f1: 0.5504
 epoch: 74, train_loss: 0.7578, test_loss: 0.9667, test_f1: 0.5468
 epoch: 75, train_loss: 0.7671, test_loss: 0.9549, test_f1: 0.5452
 epoch: 76, train_loss: 0.7585, test_loss: 0.9923, test_f1: 0.5487
 epoch: 77, train_loss: 0.7559, test_loss: 0.9766, test_f1: 0.5501
 epoch: 78, train_loss: 0.7477, test_loss: 0.9588, test_f1: 0.5756
 epoch: 79, train_loss: 0.7531, test_loss: 0.9751, test_f1: 0.5656
 epoch: 80, train_loss: 0.7542, test_loss: 0.9737, test_f1: 0.5566
 epoch: 81, train_loss: 0.7527, test_loss: 0.9679, test_f1: 0.5753
 epoch: 82, train_loss: 0.7550, test_loss: 0.9718, test_f1: 0.5866
 epoch: 83, train_loss: 0.7521, test_loss: 0.9795, test_f1: 0.5749
 epoch: 84, train_loss: 0.7469, test_loss: 0.9802, test_f1: 0.5772
 epoch: 85, train_loss: 0.7558, test_loss: 0.9938, test_f1: 0.5633
 epoch: 86, train_loss: 0.7365, test_loss: 0.9967, test_f1: 0.5615
 epoch: 87, train_loss: 0.7505, test_loss: 0.9868, test_f1: 0.5775
 epoch: 88, train_loss: 0.7416, test_loss: 0.9764, test_f1: 0.5934
 epoch: 89, train_loss: 0.7469, test_loss: 0.9679, test_f1: 0.5699
 epoch: 90, train_loss: 0.7514, test_loss: 0.9928, test_f1: 0.5746
 epoch: 91, train_loss: 0.7373, test_loss: 0.9868, test_f1: 0.5813
 epoch: 92, train_loss: 0.7345, test_loss: 0.9855, test_f1: 0.5741
 epoch: 93, train_loss: 0.7320, test_loss: 0.9788, test_f1: 0.5807
 epoch: 94, train_loss: 0.7381, test_loss: 0.9839, test_f1: 0.5818
 epoch: 95, train_loss: 0.7335, test_loss: 0.9721, test_f1: 0.5756
 epoch: 96, train_loss: 0.7286, test_loss: 0.9918, test_f1: 0.5715
 epoch: 97, train_loss: 0.7447, test_loss: 0.9916, test_f1: 0.5859
 epoch: 98, train_loss: 0.7304, test_loss: 0.9840, test_f1: 0.5746
 epoch: 99, train_loss: 0.7327, test_loss: 0.9798, test_f1: 0.5885
##################ITERATION #1 ****************************************
 epoch: 0, train_loss: 1.3276, test_loss: 1.3648, test_f1: 0.2270
 epoch: 1, train_loss: 1.2849, test_loss: 1.3188, test_f1: 0.2487
 epoch: 2, train_loss: 1.2604, test_loss: 1.2568, test_f1: 0.3421
 epoch: 3, train_loss: 1.2375, test_loss: 1.2115, test_f1: 0.3871
 epoch: 4, train_loss: 1.2145, test_loss: 1.1832, test_f1: 0.3977
 epoch: 5, train_loss: 1.1909, test_loss: 1.1642, test_f1: 0.4136
 epoch: 6, train_loss: 1.1709, test_loss: 1.1394, test_f1: 0.4334
 epoch: 7, train_loss: 1.1505, test_loss: 1.1123, test_f1: 0.4416
 epoch: 8, train_loss: 1.1256, test_loss: 1.0905, test_f1: 0.4490
 epoch: 9, train_loss: 1.1035, test_loss: 1.0690, test_f1: 0.4583
 epoch: 10, train_loss: 1.0846, test_loss: 1.0546, test_f1: 0.4626
 epoch: 11, train_loss: 1.0615, test_loss: 1.0212, test_f1: 0.4718
 epoch: 12, train_loss: 1.0439, test_loss: 1.0148, test_f1: 0.4821
 epoch: 13, train_loss: 1.0209, test_loss: 0.9943, test_f1: 0.4948
 epoch: 14, train_loss: 1.0080, test_loss: 0.9847, test_f1: 0.4870
 epoch: 15, train_loss: 0.9987, test_loss: 0.9889, test_f1: 0.4800
 epoch: 16, train_loss: 0.9811, test_loss: 0.9617, test_f1: 0.4832
 epoch: 17, train_loss: 0.9675, test_loss: 0.9580, test_f1: 0.4757
 epoch: 18, train_loss: 0.9539, test_loss: 0.9427, test_f1: 0.4835
 epoch: 19, train_loss: 0.9436, test_loss: 0.9330, test_f1: 0.4963
 epoch: 20, train_loss: 0.9306, test_loss: 0.9602, test_f1: 0.4942
 epoch: 21, train_loss: 0.9298, test_loss: 0.9251, test_f1: 0.4805
 epoch: 22, train_loss: 0.9183, test_loss: 0.9325, test_f1: 0.5056
 epoch: 23, train_loss: 0.9181, test_loss: 0.9439, test_f1: 0.5082
 epoch: 24, train_loss: 0.9102, test_loss: 0.9124, test_f1: 0.5117
 epoch: 25, train_loss: 0.8907, test_loss: 0.9305, test_f1: 0.4999
 epoch: 26, train_loss: 0.8938, test_loss: 0.9313, test_f1: 0.5056
 epoch: 27, train_loss: 0.8863, test_loss: 0.9135, test_f1: 0.5037
 epoch: 28, train_loss: 0.8690, test_loss: 0.9149, test_f1: 0.5152
 epoch: 29, train_loss: 0.8695, test_loss: 0.9297, test_f1: 0.5116
 epoch: 30, train_loss: 0.8629, test_loss: 0.9054, test_f1: 0.5308
 epoch: 31, train_loss: 0.8630, test_loss: 0.9194, test_f1: 0.5098
 epoch: 32, train_loss: 0.8616, test_loss: 0.9374, test_f1: 0.5084
 epoch: 33, train_loss: 0.8474, test_loss: 0.9447, test_f1: 0.5150
 epoch: 34, train_loss: 0.8394, test_loss: 0.9002, test_f1: 0.5200
 epoch: 35, train_loss: 0.8263, test_loss: 0.9245, test_f1: 0.5230
 epoch: 36, train_loss: 0.8376, test_loss: 0.9128, test_f1: 0.5309
 epoch: 37, train_loss: 0.8348, test_loss: 0.9574, test_f1: 0.5144
 epoch: 38, train_loss: 0.8300, test_loss: 0.9009, test_f1: 0.5271
 epoch: 39, train_loss: 0.8108, test_loss: 0.9378, test_f1: 0.5207
 epoch: 40, train_loss: 0.8203, test_loss: 0.9180, test_f1: 0.5252
 epoch: 41, train_loss: 0.8163, test_loss: 0.9235, test_f1: 0.5445
 epoch: 42, train_loss: 0.8054, test_loss: 0.9477, test_f1: 0.5286
 epoch: 43, train_loss: 0.8062, test_loss: 0.9224, test_f1: 0.5342
 epoch: 44, train_loss: 0.7961, test_loss: 0.9301, test_f1: 0.5399
 epoch: 45, train_loss: 0.8013, test_loss: 0.9355, test_f1: 0.5373
 epoch: 46, train_loss: 0.7937, test_loss: 0.9466, test_f1: 0.5368
 epoch: 47, train_loss: 0.7959, test_loss: 0.9369, test_f1: 0.5472
 epoch: 48, train_loss: 0.7965, test_loss: 0.9270, test_f1: 0.5407
 epoch: 49, train_loss: 0.7837, test_loss: 0.9578, test_f1: 0.5404
 epoch: 50, train_loss: 0.7842, test_loss: 0.9390, test_f1: 0.5685
 epoch: 51, train_loss: 0.7704, test_loss: 0.9128, test_f1: 0.5538
 epoch: 52, train_loss: 0.7720, test_loss: 0.9417, test_f1: 0.5537
 epoch: 53, train_loss: 0.7624, test_loss: 0.9355, test_f1: 0.5625
 epoch: 54, train_loss: 0.7626, test_loss: 0.9366, test_f1: 0.5677
 epoch: 55, train_loss: 0.7733, test_loss: 0.9441, test_f1: 0.5500
 epoch: 56, train_loss: 0.7782, test_loss: 0.9451, test_f1: 0.5719
 epoch: 57, train_loss: 0.7666, test_loss: 0.9486, test_f1: 0.5609
 epoch: 58, train_loss: 0.7560, test_loss: 0.9487, test_f1: 0.5536
 epoch: 59, train_loss: 0.7625, test_loss: 0.9457, test_f1: 0.5568
 epoch: 60, train_loss: 0.7494, test_loss: 0.9516, test_f1: 0.5602
 epoch: 61, train_loss: 0.7693, test_loss: 0.9485, test_f1: 0.5673
 epoch: 62, train_loss: 0.7571, test_loss: 0.9457, test_f1: 0.5651
 epoch: 63, train_loss: 0.7465, test_loss: 0.9588, test_f1: 0.5627
 epoch: 64, train_loss: 0.7503, test_loss: 0.9643, test_f1: 0.5701
 epoch: 65, train_loss: 0.7487, test_loss: 0.9565, test_f1: 0.5687
 epoch: 66, train_loss: 0.7488, test_loss: 0.9428, test_f1: 0.5640
 epoch: 67, train_loss: 0.7477, test_loss: 0.9629, test_f1: 0.5643
 epoch: 68, train_loss: 0.7447, test_loss: 0.9624, test_f1: 0.5729
 epoch: 69, train_loss: 0.7430, test_loss: 0.9518, test_f1: 0.5741
 epoch: 70, train_loss: 0.7470, test_loss: 0.9687, test_f1: 0.5678
 epoch: 71, train_loss: 0.7384, test_loss: 0.9583, test_f1: 0.5741
 epoch: 72, train_loss: 0.7292, test_loss: 0.9787, test_f1: 0.5739
 epoch: 73, train_loss: 0.7368, test_loss: 0.9677, test_f1: 0.5904
 epoch: 74, train_loss: 0.7371, test_loss: 0.9654, test_f1: 0.5789
 epoch: 75, train_loss: 0.7288, test_loss: 0.9778, test_f1: 0.5827
 epoch: 76, train_loss: 0.7377, test_loss: 0.9549, test_f1: 0.5685
 epoch: 77, train_loss: 0.7342, test_loss: 0.9603, test_f1: 0.5894
 epoch: 78, train_loss: 0.7305, test_loss: 0.9819, test_f1: 0.5668
 epoch: 79, train_loss: 0.7372, test_loss: 0.9721, test_f1: 0.5777
 epoch: 80, train_loss: 0.7342, test_loss: 0.9638, test_f1: 0.5817
 epoch: 81, train_loss: 0.7317, test_loss: 0.9679, test_f1: 0.5922
 epoch: 82, train_loss: 0.7317, test_loss: 0.9645, test_f1: 0.5914
 epoch: 83, train_loss: 0.7297, test_loss: 0.9571, test_f1: 0.5915
 epoch: 84, train_loss: 0.7203, test_loss: 0.9834, test_f1: 0.5740
 epoch: 85, train_loss: 0.7291, test_loss: 0.9665, test_f1: 0.5807
 epoch: 86, train_loss: 0.7181, test_loss: 0.9667, test_f1: 0.5912
 epoch: 87, train_loss: 0.7202, test_loss: 0.9758, test_f1: 0.5922
 epoch: 88, train_loss: 0.7141, test_loss: 0.9783, test_f1: 0.5957
 epoch: 89, train_loss: 0.7274, test_loss: 0.9777, test_f1: 0.5803
 epoch: 90, train_loss: 0.7074, test_loss: 0.9525, test_f1: 0.5847
 epoch: 91, train_loss: 0.7101, test_loss: 0.9705, test_f1: 0.5803
 epoch: 92, train_loss: 0.7011, test_loss: 0.9640, test_f1: 0.5954
 epoch: 93, train_loss: 0.7079, test_loss: 0.9699, test_f1: 0.6000
 epoch: 94, train_loss: 0.7084, test_loss: 0.9612, test_f1: 0.5855
 epoch: 95, train_loss: 0.7079, test_loss: 0.9737, test_f1: 0.5895
 epoch: 96, train_loss: 0.7060, test_loss: 0.9707, test_f1: 0.5947
 epoch: 97, train_loss: 0.7098, test_loss: 0.9647, test_f1: 0.5983
 epoch: 98, train_loss: 0.7084, test_loss: 0.9625, test_f1: 0.6039
 epoch: 99, train_loss: 0.7181, test_loss: 0.9745, test_f1: 0.5874
##################ITERATION #2 ****************************************
 epoch: 0, train_loss: 1.2958, test_loss: 1.3294, test_f1: 0.2270
 epoch: 1, train_loss: 1.2397, test_loss: 1.2529, test_f1: 0.2782
 epoch: 2, train_loss: 1.2122, test_loss: 1.1851, test_f1: 0.3414
 epoch: 3, train_loss: 1.1866, test_loss: 1.1446, test_f1: 0.4216
 epoch: 4, train_loss: 1.1644, test_loss: 1.1164, test_f1: 0.4343
 epoch: 5, train_loss: 1.1373, test_loss: 1.0909, test_f1: 0.4529
 epoch: 6, train_loss: 1.1162, test_loss: 1.0599, test_f1: 0.4605
 epoch: 7, train_loss: 1.0939, test_loss: 1.0438, test_f1: 0.4692
 epoch: 8, train_loss: 1.0802, test_loss: 1.0212, test_f1: 0.4721
 epoch: 9, train_loss: 1.0622, test_loss: 1.0211, test_f1: 0.4592
 epoch: 10, train_loss: 1.0418, test_loss: 0.9918, test_f1: 0.4822
 epoch: 11, train_loss: 1.0237, test_loss: 0.9721, test_f1: 0.5019
 epoch: 12, train_loss: 1.0249, test_loss: 0.9603, test_f1: 0.5023
 epoch: 13, train_loss: 0.9998, test_loss: 0.9532, test_f1: 0.5041
 epoch: 14, train_loss: 0.9889, test_loss: 0.9442, test_f1: 0.4953
 epoch: 15, train_loss: 0.9783, test_loss: 0.9453, test_f1: 0.5003
 epoch: 16, train_loss: 0.9694, test_loss: 0.9476, test_f1: 0.5016
 epoch: 17, train_loss: 0.9647, test_loss: 0.9249, test_f1: 0.5225
 epoch: 18, train_loss: 0.9540, test_loss: 0.9260, test_f1: 0.5181
 epoch: 19, train_loss: 0.9402, test_loss: 0.9229, test_f1: 0.5058
 epoch: 20, train_loss: 0.9431, test_loss: 0.9251, test_f1: 0.5356
 epoch: 21, train_loss: 0.9407, test_loss: 0.9124, test_f1: 0.5356
 epoch: 22, train_loss: 0.9282, test_loss: 0.9107, test_f1: 0.5365
 epoch: 23, train_loss: 0.9210, test_loss: 0.9154, test_f1: 0.5397
 epoch: 24, train_loss: 0.9099, test_loss: 0.9241, test_f1: 0.5411
 epoch: 25, train_loss: 0.9027, test_loss: 0.9098, test_f1: 0.5364
 epoch: 26, train_loss: 0.8943, test_loss: 0.9319, test_f1: 0.5352
 epoch: 27, train_loss: 0.8916, test_loss: 0.9123, test_f1: 0.5496
 epoch: 28, train_loss: 0.8860, test_loss: 0.9147, test_f1: 0.5428
 epoch: 29, train_loss: 0.8785, test_loss: 0.9080, test_f1: 0.5482
 epoch: 30, train_loss: 0.8700, test_loss: 0.9075, test_f1: 0.5622
 epoch: 31, train_loss: 0.8763, test_loss: 0.9410, test_f1: 0.5415
 epoch: 32, train_loss: 0.8710, test_loss: 0.9334, test_f1: 0.5553
 epoch: 33, train_loss: 0.8657, test_loss: 0.9022, test_f1: 0.5515
 epoch: 34, train_loss: 0.8675, test_loss: 0.9260, test_f1: 0.5470
 epoch: 35, train_loss: 0.8544, test_loss: 0.9060, test_f1: 0.5650
 epoch: 36, train_loss: 0.8534, test_loss: 0.9179, test_f1: 0.5475
 epoch: 37, train_loss: 0.8538, test_loss: 0.9114, test_f1: 0.5591
 epoch: 38, train_loss: 0.8608, test_loss: 0.9410, test_f1: 0.5455
 epoch: 39, train_loss: 0.8368, test_loss: 0.9210, test_f1: 0.5462
 epoch: 40, train_loss: 0.8452, test_loss: 0.9155, test_f1: 0.5698
 epoch: 41, train_loss: 0.8417, test_loss: 0.9527, test_f1: 0.5453
 epoch: 42, train_loss: 0.8395, test_loss: 0.9383, test_f1: 0.5503
 epoch: 43, train_loss: 0.8349, test_loss: 0.9188, test_f1: 0.5717
 epoch: 44, train_loss: 0.8280, test_loss: 0.9584, test_f1: 0.5576
 epoch: 45, train_loss: 0.8277, test_loss: 0.9248, test_f1: 0.5648
 epoch: 46, train_loss: 0.8145, test_loss: 0.9239, test_f1: 0.5664
 epoch: 47, train_loss: 0.8157, test_loss: 0.9412, test_f1: 0.5567
 epoch: 48, train_loss: 0.8127, test_loss: 0.9227, test_f1: 0.5667
 epoch: 49, train_loss: 0.8174, test_loss: 0.9424, test_f1: 0.5705
 epoch: 50, train_loss: 0.8031, test_loss: 0.9278, test_f1: 0.5764
 epoch: 51, train_loss: 0.8076, test_loss: 0.9522, test_f1: 0.5691
 epoch: 52, train_loss: 0.8022, test_loss: 0.9243, test_f1: 0.5742
 epoch: 53, train_loss: 0.7917, test_loss: 0.9369, test_f1: 0.5623
 epoch: 54, train_loss: 0.7930, test_loss: 0.9348, test_f1: 0.5656
 epoch: 55, train_loss: 0.7925, test_loss: 0.9439, test_f1: 0.5592
 epoch: 56, train_loss: 0.7953, test_loss: 0.9342, test_f1: 0.5671
 epoch: 57, train_loss: 0.7848, test_loss: 0.9400, test_f1: 0.5673
 epoch: 58, train_loss: 0.7855, test_loss: 0.9430, test_f1: 0.5772
 epoch: 59, train_loss: 0.7880, test_loss: 0.9424, test_f1: 0.5659
 epoch: 60, train_loss: 0.7842, test_loss: 0.9353, test_f1: 0.5651
 epoch: 61, train_loss: 0.7885, test_loss: 0.9521, test_f1: 0.5668
 epoch: 62, train_loss: 0.7868, test_loss: 0.9449, test_f1: 0.5648
 epoch: 63, train_loss: 0.7767, test_loss: 0.9378, test_f1: 0.5584
 epoch: 64, train_loss: 0.7761, test_loss: 0.9555, test_f1: 0.5648
 epoch: 65, train_loss: 0.7838, test_loss: 0.9568, test_f1: 0.5618
 epoch: 66, train_loss: 0.7716, test_loss: 0.9493, test_f1: 0.5596
 epoch: 67, train_loss: 0.7743, test_loss: 0.9444, test_f1: 0.5545
 epoch: 68, train_loss: 0.7699, test_loss: 0.9478, test_f1: 0.5651
 epoch: 69, train_loss: 0.7628, test_loss: 0.9413, test_f1: 0.5680
 epoch: 70, train_loss: 0.7668, test_loss: 0.9553, test_f1: 0.5713
 epoch: 71, train_loss: 0.7746, test_loss: 0.9567, test_f1: 0.5703
 epoch: 72, train_loss: 0.7638, test_loss: 0.9512, test_f1: 0.5661
 epoch: 73, train_loss: 0.7589, test_loss: 0.9690, test_f1: 0.5652
 epoch: 74, train_loss: 0.7675, test_loss: 0.9440, test_f1: 0.5787
 epoch: 75, train_loss: 0.7689, test_loss: 0.9692, test_f1: 0.5723
 epoch: 76, train_loss: 0.7544, test_loss: 0.9477, test_f1: 0.5762
 epoch: 77, train_loss: 0.7574, test_loss: 0.9591, test_f1: 0.5714
 epoch: 78, train_loss: 0.7515, test_loss: 0.9640, test_f1: 0.5630
 epoch: 79, train_loss: 0.7478, test_loss: 0.9661, test_f1: 0.5760
 epoch: 80, train_loss: 0.7465, test_loss: 0.9531, test_f1: 0.5670
 epoch: 81, train_loss: 0.7455, test_loss: 0.9673, test_f1: 0.5641
 epoch: 82, train_loss: 0.7554, test_loss: 0.9620, test_f1: 0.5596
 epoch: 83, train_loss: 0.7471, test_loss: 0.9807, test_f1: 0.5637
 epoch: 84, train_loss: 0.7417, test_loss: 0.9624, test_f1: 0.5658
 epoch: 85, train_loss: 0.7418, test_loss: 0.9478, test_f1: 0.5827
 epoch: 86, train_loss: 0.7478, test_loss: 0.9855, test_f1: 0.5648
 epoch: 87, train_loss: 0.7486, test_loss: 0.9737, test_f1: 0.5721
 epoch: 88, train_loss: 0.7444, test_loss: 0.9640, test_f1: 0.5613
 epoch: 89, train_loss: 0.7425, test_loss: 0.9586, test_f1: 0.5770
 epoch: 90, train_loss: 0.7450, test_loss: 0.9684, test_f1: 0.5650
 epoch: 91, train_loss: 0.7306, test_loss: 0.9628, test_f1: 0.5686
 epoch: 92, train_loss: 0.7459, test_loss: 0.9805, test_f1: 0.5603
 epoch: 93, train_loss: 0.7399, test_loss: 0.9736, test_f1: 0.5650
 epoch: 94, train_loss: 0.7476, test_loss: 0.9673, test_f1: 0.5674
 epoch: 95, train_loss: 0.7413, test_loss: 0.9813, test_f1: 0.5663
 epoch: 96, train_loss: 0.7345, test_loss: 0.9528, test_f1: 0.5738
 epoch: 97, train_loss: 0.7327, test_loss: 0.9725, test_f1: 0.5686
 epoch: 98, train_loss: 0.7390, test_loss: 0.9773, test_f1: 0.5683
 epoch: 99, train_loss: 0.7283, test_loss: 0.9698, test_f1: 0.5765
##################ITERATION #3 ****************************************
 epoch: 0, train_loss: 1.2718, test_loss: 1.3317, test_f1: 0.2320
 epoch: 1, train_loss: 1.2119, test_loss: 1.2236, test_f1: 0.3934
 epoch: 2, train_loss: 1.1842, test_loss: 1.1506, test_f1: 0.4066
 epoch: 3, train_loss: 1.1570, test_loss: 1.1093, test_f1: 0.4454
 epoch: 4, train_loss: 1.1380, test_loss: 1.0825, test_f1: 0.4491
 epoch: 5, train_loss: 1.1180, test_loss: 1.0524, test_f1: 0.4547
 epoch: 6, train_loss: 1.0944, test_loss: 1.0340, test_f1: 0.4694
 epoch: 7, train_loss: 1.0766, test_loss: 1.0159, test_f1: 0.4850
 epoch: 8, train_loss: 1.0588, test_loss: 1.0019, test_f1: 0.4862
 epoch: 9, train_loss: 1.0430, test_loss: 0.9752, test_f1: 0.5020
 epoch: 10, train_loss: 1.0254, test_loss: 0.9698, test_f1: 0.4925
 epoch: 11, train_loss: 1.0178, test_loss: 0.9558, test_f1: 0.4964
 epoch: 12, train_loss: 0.9955, test_loss: 0.9441, test_f1: 0.5122
 epoch: 13, train_loss: 0.9941, test_loss: 0.9372, test_f1: 0.4987
 epoch: 14, train_loss: 0.9859, test_loss: 0.9228, test_f1: 0.5077
 epoch: 15, train_loss: 0.9674, test_loss: 0.9270, test_f1: 0.4975
 epoch: 16, train_loss: 0.9592, test_loss: 0.9183, test_f1: 0.5133
 epoch: 17, train_loss: 0.9514, test_loss: 0.9040, test_f1: 0.5231
 epoch: 18, train_loss: 0.9456, test_loss: 0.8999, test_f1: 0.5211
 epoch: 19, train_loss: 0.9354, test_loss: 0.8899, test_f1: 0.5168
 epoch: 20, train_loss: 0.9358, test_loss: 0.9076, test_f1: 0.5187
 epoch: 21, train_loss: 0.9231, test_loss: 0.8877, test_f1: 0.5318
 epoch: 22, train_loss: 0.9103, test_loss: 0.8905, test_f1: 0.5357
 epoch: 23, train_loss: 0.9103, test_loss: 0.8782, test_f1: 0.5370
 epoch: 24, train_loss: 0.8982, test_loss: 0.8806, test_f1: 0.5445
 epoch: 25, train_loss: 0.8964, test_loss: 0.8916, test_f1: 0.5296
 epoch: 26, train_loss: 0.8893, test_loss: 0.8815, test_f1: 0.5401
 epoch: 27, train_loss: 0.8791, test_loss: 0.8917, test_f1: 0.5350
 epoch: 28, train_loss: 0.8881, test_loss: 0.8863, test_f1: 0.5440
 epoch: 29, train_loss: 0.8741, test_loss: 0.8898, test_f1: 0.5412
 epoch: 30, train_loss: 0.8685, test_loss: 0.8824, test_f1: 0.5608
 epoch: 31, train_loss: 0.8624, test_loss: 0.8854, test_f1: 0.5505
 epoch: 32, train_loss: 0.8613, test_loss: 0.8590, test_f1: 0.5725
 epoch: 33, train_loss: 0.8543, test_loss: 0.8734, test_f1: 0.5528
 epoch: 34, train_loss: 0.8484, test_loss: 0.8937, test_f1: 0.5340
 epoch: 35, train_loss: 0.8519, test_loss: 0.8990, test_f1: 0.5345
 epoch: 36, train_loss: 0.8480, test_loss: 0.8825, test_f1: 0.5777
 epoch: 37, train_loss: 0.8362, test_loss: 0.8787, test_f1: 0.5488
 epoch: 38, train_loss: 0.8382, test_loss: 0.8967, test_f1: 0.5488
 epoch: 39, train_loss: 0.8347, test_loss: 0.9017, test_f1: 0.5874
 epoch: 40, train_loss: 0.8230, test_loss: 0.9017, test_f1: 0.5714
 epoch: 41, train_loss: 0.8291, test_loss: 0.9020, test_f1: 0.5595
 epoch: 42, train_loss: 0.8132, test_loss: 0.8967, test_f1: 0.5937
 epoch: 43, train_loss: 0.8205, test_loss: 0.9048, test_f1: 0.5712
 epoch: 44, train_loss: 0.8236, test_loss: 0.8972, test_f1: 0.5572
 epoch: 45, train_loss: 0.8136, test_loss: 0.9239, test_f1: 0.5642
 epoch: 46, train_loss: 0.8085, test_loss: 0.9174, test_f1: 0.5707
 epoch: 47, train_loss: 0.8122, test_loss: 0.8868, test_f1: 0.5535
 epoch: 48, train_loss: 0.8137, test_loss: 0.9014, test_f1: 0.5792
 epoch: 49, train_loss: 0.7963, test_loss: 0.8912, test_f1: 0.5898
 epoch: 50, train_loss: 0.8037, test_loss: 0.9389, test_f1: 0.5611
 epoch: 51, train_loss: 0.8033, test_loss: 0.8908, test_f1: 0.5761
 epoch: 52, train_loss: 0.7766, test_loss: 0.8939, test_f1: 0.5778
 epoch: 53, train_loss: 0.7924, test_loss: 0.8922, test_f1: 0.5746
 epoch: 54, train_loss: 0.7813, test_loss: 0.9009, test_f1: 0.5724
 epoch: 55, train_loss: 0.7827, test_loss: 0.9070, test_f1: 0.5680
 epoch: 56, train_loss: 0.7802, test_loss: 0.9031, test_f1: 0.5726
 epoch: 57, train_loss: 0.7841, test_loss: 0.9110, test_f1: 0.5665
 epoch: 58, train_loss: 0.7802, test_loss: 0.9159, test_f1: 0.5792
 epoch: 59, train_loss: 0.7785, test_loss: 0.9088, test_f1: 0.5723
 epoch: 60, train_loss: 0.7790, test_loss: 0.9136, test_f1: 0.5566
 epoch: 61, train_loss: 0.7728, test_loss: 0.9151, test_f1: 0.5618
 epoch: 62, train_loss: 0.7633, test_loss: 0.9161, test_f1: 0.5664
 epoch: 63, train_loss: 0.7651, test_loss: 0.9019, test_f1: 0.5670
 epoch: 64, train_loss: 0.7684, test_loss: 0.9027, test_f1: 0.5723
 epoch: 65, train_loss: 0.7667, test_loss: 0.9042, test_f1: 0.5776
 epoch: 66, train_loss: 0.7763, test_loss: 0.9060, test_f1: 0.5648
 epoch: 67, train_loss: 0.7652, test_loss: 0.9014, test_f1: 0.5715
 epoch: 68, train_loss: 0.7615, test_loss: 0.9127, test_f1: 0.5643
 epoch: 69, train_loss: 0.7630, test_loss: 0.9064, test_f1: 0.5830
 epoch: 70, train_loss: 0.7597, test_loss: 0.9137, test_f1: 0.5745
 epoch: 71, train_loss: 0.7587, test_loss: 0.9150, test_f1: 0.5767
 epoch: 72, train_loss: 0.7625, test_loss: 0.8980, test_f1: 0.5740
 epoch: 73, train_loss: 0.7630, test_loss: 0.9023, test_f1: 0.5734
 epoch: 74, train_loss: 0.7524, test_loss: 0.9059, test_f1: 0.5770
 epoch: 75, train_loss: 0.7543, test_loss: 0.9160, test_f1: 0.5658
 epoch: 76, train_loss: 0.7485, test_loss: 0.9192, test_f1: 0.5637
 epoch: 77, train_loss: 0.7425, test_loss: 0.9190, test_f1: 0.5629
 epoch: 78, train_loss: 0.7484, test_loss: 0.9103, test_f1: 0.5721
 epoch: 79, train_loss: 0.7463, test_loss: 0.9170, test_f1: 0.5563
 epoch: 80, train_loss: 0.7442, test_loss: 0.9166, test_f1: 0.5686
 epoch: 81, train_loss: 0.7461, test_loss: 0.9068, test_f1: 0.5834
 epoch: 82, train_loss: 0.7444, test_loss: 0.9281, test_f1: 0.5703
 epoch: 83, train_loss: 0.7429, test_loss: 0.9250, test_f1: 0.5605
 epoch: 84, train_loss: 0.7370, test_loss: 0.9254, test_f1: 0.5657
 epoch: 85, train_loss: 0.7418, test_loss: 0.9261, test_f1: 0.5806
 epoch: 86, train_loss: 0.7395, test_loss: 0.9368, test_f1: 0.5692
 epoch: 87, train_loss: 0.7433, test_loss: 0.9178, test_f1: 0.5899
 epoch: 88, train_loss: 0.7333, test_loss: 0.9217, test_f1: 0.5715
 epoch: 89, train_loss: 0.7266, test_loss: 0.9242, test_f1: 0.5777
 epoch: 90, train_loss: 0.7352, test_loss: 0.9238, test_f1: 0.5706
 epoch: 91, train_loss: 0.7332, test_loss: 0.9128, test_f1: 0.5784
 epoch: 92, train_loss: 0.7281, test_loss: 0.9268, test_f1: 0.5809
 epoch: 93, train_loss: 0.7268, test_loss: 0.9309, test_f1: 0.5913
 epoch: 94, train_loss: 0.7342, test_loss: 0.9338, test_f1: 0.5772
 epoch: 95, train_loss: 0.7293, test_loss: 0.9384, test_f1: 0.5806
 epoch: 96, train_loss: 0.7341, test_loss: 0.9364, test_f1: 0.5873
 epoch: 97, train_loss: 0.7240, test_loss: 0.9467, test_f1: 0.5817
 epoch: 98, train_loss: 0.7235, test_loss: 0.9293, test_f1: 0.5888
 epoch: 99, train_loss: 0.7287, test_loss: 0.9457, test_f1: 0.5822
##################ITERATION #4 ****************************************
 epoch: 0, train_loss: 1.2770, test_loss: 1.3376, test_f1: 0.3202
 epoch: 1, train_loss: 1.1912, test_loss: 1.2073, test_f1: 0.3279
 epoch: 2, train_loss: 1.1566, test_loss: 1.1181, test_f1: 0.4171
 epoch: 3, train_loss: 1.1350, test_loss: 1.0688, test_f1: 0.4532
 epoch: 4, train_loss: 1.1040, test_loss: 1.0442, test_f1: 0.4633
 epoch: 5, train_loss: 1.0798, test_loss: 1.0183, test_f1: 0.4701
 epoch: 6, train_loss: 1.0533, test_loss: 0.9985, test_f1: 0.4613
 epoch: 7, train_loss: 1.0421, test_loss: 0.9831, test_f1: 0.4807
 epoch: 8, train_loss: 1.0265, test_loss: 0.9672, test_f1: 0.4898
 epoch: 9, train_loss: 1.0098, test_loss: 0.9568, test_f1: 0.4862
 epoch: 10, train_loss: 0.9928, test_loss: 0.9435, test_f1: 0.4923
 epoch: 11, train_loss: 0.9885, test_loss: 0.9384, test_f1: 0.5124
 epoch: 12, train_loss: 0.9813, test_loss: 0.9311, test_f1: 0.5047
 epoch: 13, train_loss: 0.9660, test_loss: 0.9253, test_f1: 0.5039
 epoch: 14, train_loss: 0.9514, test_loss: 0.9186, test_f1: 0.5129
 epoch: 15, train_loss: 0.9495, test_loss: 0.9139, test_f1: 0.5115
 epoch: 16, train_loss: 0.9372, test_loss: 0.9112, test_f1: 0.5160
 epoch: 17, train_loss: 0.9405, test_loss: 0.9059, test_f1: 0.5221
 epoch: 18, train_loss: 0.9258, test_loss: 0.9092, test_f1: 0.5171
 epoch: 19, train_loss: 0.9228, test_loss: 0.9111, test_f1: 0.5153
 epoch: 20, train_loss: 0.9132, test_loss: 0.9151, test_f1: 0.5190
 epoch: 21, train_loss: 0.8979, test_loss: 0.9081, test_f1: 0.5379
 epoch: 22, train_loss: 0.8956, test_loss: 0.9126, test_f1: 0.5287
 epoch: 23, train_loss: 0.8988, test_loss: 0.8937, test_f1: 0.5292
 epoch: 24, train_loss: 0.8857, test_loss: 0.9006, test_f1: 0.5300
 epoch: 25, train_loss: 0.8915, test_loss: 0.9200, test_f1: 0.5418
 epoch: 26, train_loss: 0.8785, test_loss: 0.9131, test_f1: 0.5297
 epoch: 27, train_loss: 0.8735, test_loss: 0.9008, test_f1: 0.5319
 epoch: 28, train_loss: 0.8766, test_loss: 0.9093, test_f1: 0.5268
 epoch: 29, train_loss: 0.8621, test_loss: 0.9182, test_f1: 0.5281
 epoch: 30, train_loss: 0.8539, test_loss: 0.9051, test_f1: 0.5422
 epoch: 31, train_loss: 0.8614, test_loss: 0.9015, test_f1: 0.5429
 epoch: 32, train_loss: 0.8495, test_loss: 0.9036, test_f1: 0.5318
 epoch: 33, train_loss: 0.8458, test_loss: 0.9020, test_f1: 0.5478
 epoch: 34, train_loss: 0.8453, test_loss: 0.9179, test_f1: 0.5395
 epoch: 35, train_loss: 0.8410, test_loss: 0.8992, test_f1: 0.5530
 epoch: 36, train_loss: 0.8370, test_loss: 0.9046, test_f1: 0.5540
 epoch: 37, train_loss: 0.8386, test_loss: 0.9185, test_f1: 0.5430
 epoch: 38, train_loss: 0.8350, test_loss: 0.9349, test_f1: 0.5393
 epoch: 39, train_loss: 0.8253, test_loss: 0.9062, test_f1: 0.5481
 epoch: 40, train_loss: 0.8279, test_loss: 0.9386, test_f1: 0.5354
 epoch: 41, train_loss: 0.8182, test_loss: 0.9267, test_f1: 0.5314
 epoch: 42, train_loss: 0.8156, test_loss: 0.9163, test_f1: 0.5402
 epoch: 43, train_loss: 0.8155, test_loss: 0.9210, test_f1: 0.5360
 epoch: 44, train_loss: 0.8139, test_loss: 0.9211, test_f1: 0.5502
 epoch: 45, train_loss: 0.8117, test_loss: 0.9191, test_f1: 0.5475
 epoch: 46, train_loss: 0.8105, test_loss: 0.9333, test_f1: 0.5531
 epoch: 47, train_loss: 0.7994, test_loss: 0.9192, test_f1: 0.5464
 epoch: 48, train_loss: 0.7987, test_loss: 0.9187, test_f1: 0.5644
 epoch: 49, train_loss: 0.7935, test_loss: 0.9397, test_f1: 0.5619
 epoch: 50, train_loss: 0.8022, test_loss: 0.9181, test_f1: 0.5407
 epoch: 51, train_loss: 0.7893, test_loss: 0.9358, test_f1: 0.5603
 epoch: 52, train_loss: 0.7789, test_loss: 0.9224, test_f1: 0.5614
 epoch: 53, train_loss: 0.7735, test_loss: 0.9380, test_f1: 0.5512
 epoch: 54, train_loss: 0.7822, test_loss: 0.9240, test_f1: 0.5658
 epoch: 55, train_loss: 0.7749, test_loss: 0.9361, test_f1: 0.5537
 epoch: 56, train_loss: 0.7775, test_loss: 0.9443, test_f1: 0.5646
 epoch: 57, train_loss: 0.7653, test_loss: 0.9431, test_f1: 0.5679
 epoch: 58, train_loss: 0.7714, test_loss: 0.9459, test_f1: 0.5670
 epoch: 59, train_loss: 0.7700, test_loss: 0.9445, test_f1: 0.5629
 epoch: 60, train_loss: 0.7689, test_loss: 0.9285, test_f1: 0.5660
 epoch: 61, train_loss: 0.7751, test_loss: 0.9408, test_f1: 0.5539
 epoch: 62, train_loss: 0.7652, test_loss: 0.9395, test_f1: 0.5657
 epoch: 63, train_loss: 0.7705, test_loss: 0.9335, test_f1: 0.5658
 epoch: 64, train_loss: 0.7585, test_loss: 0.9291, test_f1: 0.5667
 epoch: 65, train_loss: 0.7694, test_loss: 0.9434, test_f1: 0.5751
 epoch: 66, train_loss: 0.7602, test_loss: 0.9397, test_f1: 0.5716
 epoch: 67, train_loss: 0.7562, test_loss: 0.9298, test_f1: 0.5763
 epoch: 68, train_loss: 0.7505, test_loss: 0.9398, test_f1: 0.5781
 epoch: 69, train_loss: 0.7536, test_loss: 0.9466, test_f1: 0.5736
 epoch: 70, train_loss: 0.7595, test_loss: 0.9512, test_f1: 0.5781
 epoch: 71, train_loss: 0.7642, test_loss: 0.9416, test_f1: 0.5819
 epoch: 72, train_loss: 0.7595, test_loss: 0.9603, test_f1: 0.5858
 epoch: 73, train_loss: 0.7517, test_loss: 0.9498, test_f1: 0.5866
 epoch: 74, train_loss: 0.7568, test_loss: 0.9670, test_f1: 0.5740
 epoch: 75, train_loss: 0.7401, test_loss: 0.9585, test_f1: 0.5800
 epoch: 76, train_loss: 0.7444, test_loss: 0.9400, test_f1: 0.5703
 epoch: 77, train_loss: 0.7468, test_loss: 0.9461, test_f1: 0.5997
 epoch: 78, train_loss: 0.7426, test_loss: 0.9731, test_f1: 0.5820
 epoch: 79, train_loss: 0.7418, test_loss: 0.9552, test_f1: 0.5816
 epoch: 80, train_loss: 0.7484, test_loss: 0.9566, test_f1: 0.5865
 epoch: 81, train_loss: 0.7375, test_loss: 0.9583, test_f1: 0.5876
 epoch: 82, train_loss: 0.7360, test_loss: 0.9551, test_f1: 0.5808
 epoch: 83, train_loss: 0.7333, test_loss: 0.9543, test_f1: 0.5928
 epoch: 84, train_loss: 0.7383, test_loss: 0.9602, test_f1: 0.5710
 epoch: 85, train_loss: 0.7245, test_loss: 0.9425, test_f1: 0.5739
 epoch: 86, train_loss: 0.7408, test_loss: 0.9612, test_f1: 0.5933
 epoch: 87, train_loss: 0.7447, test_loss: 0.9451, test_f1: 0.5856
 epoch: 88, train_loss: 0.7381, test_loss: 0.9505, test_f1: 0.5885
 epoch: 89, train_loss: 0.7333, test_loss: 0.9567, test_f1: 0.5800
 epoch: 90, train_loss: 0.7397, test_loss: 0.9589, test_f1: 0.5894
 epoch: 91, train_loss: 0.7354, test_loss: 0.9604, test_f1: 0.5695
 epoch: 92, train_loss: 0.7303, test_loss: 0.9566, test_f1: 0.5906
 epoch: 93, train_loss: 0.7390, test_loss: 0.9547, test_f1: 0.5834
 epoch: 94, train_loss: 0.7313, test_loss: 0.9236, test_f1: 0.5851
 epoch: 95, train_loss: 0.7262, test_loss: 0.9555, test_f1: 0.5931
 epoch: 96, train_loss: 0.7304, test_loss: 0.9635, test_f1: 0.5853
 epoch: 97, train_loss: 0.7332, test_loss: 0.9616, test_f1: 0.5793
 epoch: 98, train_loss: 0.7253, test_loss: 0.9530, test_f1: 0.5899
 epoch: 99, train_loss: 0.7188, test_loss: 0.9538, test_f1: 0.5982
##################ITERATION #5 ****************************************
 epoch: 0, train_loss: 1.2638, test_loss: 1.3470, test_f1: 0.3366
 epoch: 1, train_loss: 1.1913, test_loss: 1.2288, test_f1: 0.3323
 epoch: 2, train_loss: 1.1620, test_loss: 1.1422, test_f1: 0.3711
 epoch: 3, train_loss: 1.1483, test_loss: 1.1136, test_f1: 0.3931
 epoch: 4, train_loss: 1.1205, test_loss: 1.0871, test_f1: 0.4209
 epoch: 5, train_loss: 1.1079, test_loss: 1.0600, test_f1: 0.4420
 epoch: 6, train_loss: 1.0821, test_loss: 1.0411, test_f1: 0.4526
 epoch: 7, train_loss: 1.0706, test_loss: 1.0149, test_f1: 0.4706
 epoch: 8, train_loss: 1.0460, test_loss: 1.0182, test_f1: 0.4743
 epoch: 9, train_loss: 1.0461, test_loss: 0.9981, test_f1: 0.4711
 epoch: 10, train_loss: 1.0274, test_loss: 0.9887, test_f1: 0.4751
 epoch: 11, train_loss: 1.0162, test_loss: 0.9863, test_f1: 0.4771
 epoch: 12, train_loss: 1.0138, test_loss: 0.9785, test_f1: 0.4650
 epoch: 13, train_loss: 1.0023, test_loss: 0.9791, test_f1: 0.4817
 epoch: 14, train_loss: 0.9840, test_loss: 0.9528, test_f1: 0.4886
 epoch: 15, train_loss: 0.9731, test_loss: 0.9548, test_f1: 0.4967
 epoch: 16, train_loss: 0.9653, test_loss: 0.9504, test_f1: 0.5053
 epoch: 17, train_loss: 0.9624, test_loss: 0.9435, test_f1: 0.5020
 epoch: 18, train_loss: 0.9479, test_loss: 0.9318, test_f1: 0.5026
 epoch: 19, train_loss: 0.9362, test_loss: 0.9307, test_f1: 0.5200
 epoch: 20, train_loss: 0.9365, test_loss: 0.9308, test_f1: 0.5129
 epoch: 21, train_loss: 0.9236, test_loss: 0.9298, test_f1: 0.5272
 epoch: 22, train_loss: 0.9218, test_loss: 0.9300, test_f1: 0.5166
 epoch: 23, train_loss: 0.9136, test_loss: 0.9345, test_f1: 0.5342
 epoch: 24, train_loss: 0.9080, test_loss: 0.9246, test_f1: 0.5364
 epoch: 25, train_loss: 0.9046, test_loss: 0.9331, test_f1: 0.5256
 epoch: 26, train_loss: 0.8972, test_loss: 0.9273, test_f1: 0.5457
 epoch: 27, train_loss: 0.8836, test_loss: 0.9214, test_f1: 0.5420
 epoch: 28, train_loss: 0.8807, test_loss: 0.9135, test_f1: 0.5348
 epoch: 29, train_loss: 0.8845, test_loss: 0.9278, test_f1: 0.5398
 epoch: 30, train_loss: 0.8787, test_loss: 0.9152, test_f1: 0.5330
 epoch: 31, train_loss: 0.8673, test_loss: 0.9302, test_f1: 0.5274
 epoch: 32, train_loss: 0.8573, test_loss: 0.9209, test_f1: 0.5437
 epoch: 33, train_loss: 0.8620, test_loss: 0.9336, test_f1: 0.5216
 epoch: 34, train_loss: 0.8647, test_loss: 0.9301, test_f1: 0.5426
 epoch: 35, train_loss: 0.8539, test_loss: 0.9277, test_f1: 0.5414
 epoch: 36, train_loss: 0.8393, test_loss: 0.9246, test_f1: 0.5476
 epoch: 37, train_loss: 0.8395, test_loss: 0.9116, test_f1: 0.5396
 epoch: 38, train_loss: 0.8374, test_loss: 0.9250, test_f1: 0.5414
 epoch: 39, train_loss: 0.8217, test_loss: 0.9222, test_f1: 0.5571
 epoch: 40, train_loss: 0.8283, test_loss: 0.9170, test_f1: 0.5741
 epoch: 41, train_loss: 0.8218, test_loss: 0.9288, test_f1: 0.5523
 epoch: 42, train_loss: 0.8146, test_loss: 0.9180, test_f1: 0.5512
 epoch: 43, train_loss: 0.8245, test_loss: 0.9311, test_f1: 0.5655
 epoch: 44, train_loss: 0.8039, test_loss: 0.9221, test_f1: 0.5456
 epoch: 45, train_loss: 0.8019, test_loss: 0.9221, test_f1: 0.5704
 epoch: 46, train_loss: 0.8045, test_loss: 0.9263, test_f1: 0.5550
 epoch: 47, train_loss: 0.8019, test_loss: 0.9330, test_f1: 0.5447
 epoch: 48, train_loss: 0.8055, test_loss: 0.9273, test_f1: 0.5629
 epoch: 49, train_loss: 0.7868, test_loss: 0.9322, test_f1: 0.5595
 epoch: 50, train_loss: 0.7972, test_loss: 0.9464, test_f1: 0.5567
 epoch: 51, train_loss: 0.7722, test_loss: 0.9334, test_f1: 0.5515
 epoch: 52, train_loss: 0.7790, test_loss: 0.9291, test_f1: 0.5541
 epoch: 53, train_loss: 0.7713, test_loss: 0.9362, test_f1: 0.5564
 epoch: 54, train_loss: 0.7599, test_loss: 0.9328, test_f1: 0.5542
 epoch: 55, train_loss: 0.7705, test_loss: 0.9345, test_f1: 0.5574
 epoch: 56, train_loss: 0.7782, test_loss: 0.9341, test_f1: 0.5528
 epoch: 57, train_loss: 0.7626, test_loss: 0.9342, test_f1: 0.5611
 epoch: 58, train_loss: 0.7694, test_loss: 0.9291, test_f1: 0.5617
 epoch: 59, train_loss: 0.7605, test_loss: 0.9344, test_f1: 0.5597
 epoch: 60, train_loss: 0.7647, test_loss: 0.9462, test_f1: 0.5674
 epoch: 61, train_loss: 0.7602, test_loss: 0.9382, test_f1: 0.5566
 epoch: 62, train_loss: 0.7634, test_loss: 0.9421, test_f1: 0.5664
 epoch: 63, train_loss: 0.7589, test_loss: 0.9401, test_f1: 0.5722
 epoch: 64, train_loss: 0.7462, test_loss: 0.9392, test_f1: 0.5631
 epoch: 65, train_loss: 0.7549, test_loss: 0.9522, test_f1: 0.5528
 epoch: 66, train_loss: 0.7567, test_loss: 0.9437, test_f1: 0.5668
 epoch: 67, train_loss: 0.7463, test_loss: 0.9595, test_f1: 0.5639
 epoch: 68, train_loss: 0.7389, test_loss: 0.9561, test_f1: 0.5546
 epoch: 69, train_loss: 0.7440, test_loss: 0.9509, test_f1: 0.5638
 epoch: 70, train_loss: 0.7565, test_loss: 0.9492, test_f1: 0.5548
 epoch: 71, train_loss: 0.7543, test_loss: 0.9505, test_f1: 0.5560
 epoch: 72, train_loss: 0.7323, test_loss: 0.9382, test_f1: 0.5762
 epoch: 73, train_loss: 0.7419, test_loss: 0.9611, test_f1: 0.5522
 epoch: 74, train_loss: 0.7258, test_loss: 0.9432, test_f1: 0.5738
 epoch: 75, train_loss: 0.7373, test_loss: 0.9560, test_f1: 0.5516
 epoch: 76, train_loss: 0.7414, test_loss: 0.9578, test_f1: 0.5560
 epoch: 77, train_loss: 0.7303, test_loss: 0.9377, test_f1: 0.5685
 epoch: 78, train_loss: 0.7415, test_loss: 0.9546, test_f1: 0.5481
 epoch: 79, train_loss: 0.7283, test_loss: 0.9574, test_f1: 0.5566
 epoch: 80, train_loss: 0.7391, test_loss: 0.9538, test_f1: 0.5614
 epoch: 81, train_loss: 0.7298, test_loss: 0.9522, test_f1: 0.5612
 epoch: 82, train_loss: 0.7237, test_loss: 0.9659, test_f1: 0.5628
 epoch: 83, train_loss: 0.7245, test_loss: 0.9677, test_f1: 0.5470
 epoch: 84, train_loss: 0.7248, test_loss: 0.9605, test_f1: 0.5664
 epoch: 85, train_loss: 0.7086, test_loss: 0.9669, test_f1: 0.5776
 epoch: 86, train_loss: 0.7135, test_loss: 0.9637, test_f1: 0.5686
 epoch: 87, train_loss: 0.7127, test_loss: 0.9581, test_f1: 0.5681
 epoch: 88, train_loss: 0.7223, test_loss: 0.9715, test_f1: 0.5604
 epoch: 89, train_loss: 0.7159, test_loss: 0.9675, test_f1: 0.5741
 epoch: 90, train_loss: 0.7125, test_loss: 0.9600, test_f1: 0.5776
 epoch: 91, train_loss: 0.7136, test_loss: 0.9522, test_f1: 0.5730
 epoch: 92, train_loss: 0.6996, test_loss: 0.9673, test_f1: 0.5589
 epoch: 93, train_loss: 0.7019, test_loss: 0.9701, test_f1: 0.5823
 epoch: 94, train_loss: 0.7098, test_loss: 0.9733, test_f1: 0.5660
 epoch: 95, train_loss: 0.7100, test_loss: 0.9686, test_f1: 0.5669
 epoch: 96, train_loss: 0.6999, test_loss: 0.9648, test_f1: 0.5632
 epoch: 97, train_loss: 0.7079, test_loss: 0.9659, test_f1: 0.5816
 epoch: 98, train_loss: 0.7081, test_loss: 0.9743, test_f1: 0.5834
 epoch: 99, train_loss: 0.6986, test_loss: 0.9716, test_f1: 0.5725
##################ITERATION #6 ****************************************
 epoch: 0, train_loss: 1.3145, test_loss: 1.3509, test_f1: 0.2690
 epoch: 1, train_loss: 1.2070, test_loss: 1.2207, test_f1: 0.2969
 epoch: 2, train_loss: 1.1675, test_loss: 1.1229, test_f1: 0.4127
 epoch: 3, train_loss: 1.1346, test_loss: 1.0769, test_f1: 0.4579
 epoch: 4, train_loss: 1.1065, test_loss: 1.0434, test_f1: 0.4696
 epoch: 5, train_loss: 1.0801, test_loss: 1.0336, test_f1: 0.4570
 epoch: 6, train_loss: 1.0574, test_loss: 0.9963, test_f1: 0.4775
 epoch: 7, train_loss: 1.0413, test_loss: 0.9781, test_f1: 0.5019
 epoch: 8, train_loss: 1.0392, test_loss: 0.9785, test_f1: 0.4943
 epoch: 9, train_loss: 1.0136, test_loss: 0.9545, test_f1: 0.5071
 epoch: 10, train_loss: 1.0032, test_loss: 0.9507, test_f1: 0.5167
 epoch: 11, train_loss: 0.9946, test_loss: 0.9406, test_f1: 0.5014
 epoch: 12, train_loss: 0.9792, test_loss: 0.9345, test_f1: 0.5116
 epoch: 13, train_loss: 0.9745, test_loss: 0.9250, test_f1: 0.5252
 epoch: 14, train_loss: 0.9612, test_loss: 0.9161, test_f1: 0.5231
 epoch: 15, train_loss: 0.9495, test_loss: 0.9249, test_f1: 0.5196
 epoch: 16, train_loss: 0.9513, test_loss: 0.9119, test_f1: 0.5227
 epoch: 17, train_loss: 0.9271, test_loss: 0.8968, test_f1: 0.5206
 epoch: 18, train_loss: 0.9218, test_loss: 0.9005, test_f1: 0.5273
 epoch: 19, train_loss: 0.9158, test_loss: 0.9056, test_f1: 0.5225
 epoch: 20, train_loss: 0.9095, test_loss: 0.8954, test_f1: 0.5350
 epoch: 21, train_loss: 0.9107, test_loss: 0.9018, test_f1: 0.5245
 epoch: 22, train_loss: 0.8962, test_loss: 0.9059, test_f1: 0.5301
 epoch: 23, train_loss: 0.9002, test_loss: 0.9119, test_f1: 0.5174
 epoch: 24, train_loss: 0.8929, test_loss: 0.9206, test_f1: 0.5330
 epoch: 25, train_loss: 0.8913, test_loss: 0.8954, test_f1: 0.5306
 epoch: 26, train_loss: 0.8792, test_loss: 0.8876, test_f1: 0.5408
 epoch: 27, train_loss: 0.8769, test_loss: 0.9093, test_f1: 0.5228
 epoch: 28, train_loss: 0.8774, test_loss: 0.8739, test_f1: 0.5303
 epoch: 29, train_loss: 0.8690, test_loss: 0.9122, test_f1: 0.5245
 epoch: 30, train_loss: 0.8636, test_loss: 0.9060, test_f1: 0.5274
 epoch: 31, train_loss: 0.8589, test_loss: 0.8968, test_f1: 0.5133
 epoch: 32, train_loss: 0.8631, test_loss: 0.8930, test_f1: 0.5362
 epoch: 33, train_loss: 0.8565, test_loss: 0.9168, test_f1: 0.5225
 epoch: 34, train_loss: 0.8562, test_loss: 0.9123, test_f1: 0.5083
 epoch: 35, train_loss: 0.8461, test_loss: 0.9011, test_f1: 0.5297
 epoch: 36, train_loss: 0.8554, test_loss: 0.9003, test_f1: 0.5138
 epoch: 37, train_loss: 0.8523, test_loss: 0.9088, test_f1: 0.5234
 epoch: 38, train_loss: 0.8355, test_loss: 0.8791, test_f1: 0.5195
 epoch: 39, train_loss: 0.8290, test_loss: 0.9070, test_f1: 0.5128
 epoch: 40, train_loss: 0.8277, test_loss: 0.9030, test_f1: 0.5251
 epoch: 41, train_loss: 0.8284, test_loss: 0.9021, test_f1: 0.5287
 epoch: 42, train_loss: 0.8276, test_loss: 0.9400, test_f1: 0.5261
 epoch: 43, train_loss: 0.8201, test_loss: 0.9389, test_f1: 0.5184
 epoch: 44, train_loss: 0.8154, test_loss: 0.9394, test_f1: 0.5182
 epoch: 45, train_loss: 0.8352, test_loss: 0.9218, test_f1: 0.5427
 epoch: 46, train_loss: 0.8123, test_loss: 0.9305, test_f1: 0.5329
 epoch: 47, train_loss: 0.8169, test_loss: 0.9312, test_f1: 0.5245
 epoch: 48, train_loss: 0.8081, test_loss: 0.9031, test_f1: 0.5383
 epoch: 49, train_loss: 0.8027, test_loss: 0.9191, test_f1: 0.5362
 epoch: 50, train_loss: 0.8048, test_loss: 0.9353, test_f1: 0.5269
 epoch: 51, train_loss: 0.7961, test_loss: 0.9298, test_f1: 0.5363
 epoch: 52, train_loss: 0.8034, test_loss: 0.9415, test_f1: 0.5319
 epoch: 53, train_loss: 0.7930, test_loss: 0.9375, test_f1: 0.5346
 epoch: 54, train_loss: 0.7954, test_loss: 0.9316, test_f1: 0.5401
 epoch: 55, train_loss: 0.7886, test_loss: 0.9432, test_f1: 0.5179
 epoch: 56, train_loss: 0.7828, test_loss: 0.9143, test_f1: 0.5375
 epoch: 57, train_loss: 0.7868, test_loss: 0.9429, test_f1: 0.5325
 epoch: 58, train_loss: 0.7897, test_loss: 0.9311, test_f1: 0.5359
 epoch: 59, train_loss: 0.7705, test_loss: 0.9546, test_f1: 0.5329
 epoch: 60, train_loss: 0.7934, test_loss: 0.9415, test_f1: 0.5456
 epoch: 61, train_loss: 0.7785, test_loss: 0.9247, test_f1: 0.5416
 epoch: 62, train_loss: 0.7866, test_loss: 0.9503, test_f1: 0.5316
 epoch: 63, train_loss: 0.7775, test_loss: 0.9207, test_f1: 0.5420
 epoch: 64, train_loss: 0.7791, test_loss: 0.9444, test_f1: 0.5355
 epoch: 65, train_loss: 0.7766, test_loss: 0.9179, test_f1: 0.5537
 epoch: 66, train_loss: 0.7726, test_loss: 0.9281, test_f1: 0.5387
 epoch: 67, train_loss: 0.7667, test_loss: 0.9243, test_f1: 0.5474
 epoch: 68, train_loss: 0.7777, test_loss: 0.9320, test_f1: 0.5346
 epoch: 69, train_loss: 0.7718, test_loss: 0.9426, test_f1: 0.5488
 epoch: 70, train_loss: 0.7674, test_loss: 0.9333, test_f1: 0.5416
 epoch: 71, train_loss: 0.7724, test_loss: 0.9519, test_f1: 0.5441
 epoch: 72, train_loss: 0.7563, test_loss: 0.9480, test_f1: 0.5456
 epoch: 73, train_loss: 0.7645, test_loss: 0.9629, test_f1: 0.5368
 epoch: 74, train_loss: 0.7585, test_loss: 0.9299, test_f1: 0.5512
 epoch: 75, train_loss: 0.7652, test_loss: 0.9455, test_f1: 0.5454
 epoch: 76, train_loss: 0.7594, test_loss: 0.9422, test_f1: 0.5490
 epoch: 77, train_loss: 0.7652, test_loss: 0.9456, test_f1: 0.5521
 epoch: 78, train_loss: 0.7619, test_loss: 0.9457, test_f1: 0.5589
 epoch: 79, train_loss: 0.7706, test_loss: 0.9314, test_f1: 0.5683
 epoch: 80, train_loss: 0.7590, test_loss: 0.9436, test_f1: 0.5558
 epoch: 81, train_loss: 0.7609, test_loss: 0.9668, test_f1: 0.5484
 epoch: 82, train_loss: 0.7627, test_loss: 0.9669, test_f1: 0.5554
 epoch: 83, train_loss: 0.7569, test_loss: 0.9735, test_f1: 0.5567
 epoch: 84, train_loss: 0.7559, test_loss: 0.9791, test_f1: 0.5456
 epoch: 85, train_loss: 0.7503, test_loss: 0.9602, test_f1: 0.5521
 epoch: 86, train_loss: 0.7523, test_loss: 0.9535, test_f1: 0.5590
 epoch: 87, train_loss: 0.7546, test_loss: 0.9650, test_f1: 0.5566
 epoch: 88, train_loss: 0.7408, test_loss: 0.9515, test_f1: 0.5588
 epoch: 89, train_loss: 0.7543, test_loss: 0.9799, test_f1: 0.5523
 epoch: 90, train_loss: 0.7425, test_loss: 0.9636, test_f1: 0.5532
 epoch: 91, train_loss: 0.7455, test_loss: 0.9505, test_f1: 0.5564
 epoch: 92, train_loss: 0.7418, test_loss: 0.9502, test_f1: 0.5616
 epoch: 93, train_loss: 0.7338, test_loss: 0.9807, test_f1: 0.5518
 epoch: 94, train_loss: 0.7465, test_loss: 0.9649, test_f1: 0.5616
 epoch: 95, train_loss: 0.7475, test_loss: 0.9890, test_f1: 0.5642
 epoch: 96, train_loss: 0.7355, test_loss: 0.9890, test_f1: 0.5577
 epoch: 97, train_loss: 0.7413, test_loss: 0.9936, test_f1: 0.5578
 epoch: 98, train_loss: 0.7361, test_loss: 0.9776, test_f1: 0.5604
 epoch: 99, train_loss: 0.7295, test_loss: 0.9629, test_f1: 0.5653
##################ITERATION #7 ****************************************
 epoch: 0, train_loss: 1.2843, test_loss: 1.2990, test_f1: 0.2570
 epoch: 1, train_loss: 1.1791, test_loss: 1.1938, test_f1: 0.3551
 epoch: 2, train_loss: 1.1447, test_loss: 1.1037, test_f1: 0.4171
 epoch: 3, train_loss: 1.1298, test_loss: 1.0581, test_f1: 0.4424
 epoch: 4, train_loss: 1.0887, test_loss: 1.0378, test_f1: 0.4635
 epoch: 5, train_loss: 1.0764, test_loss: 1.0225, test_f1: 0.4775
 epoch: 6, train_loss: 1.0548, test_loss: 1.0084, test_f1: 0.4954
 epoch: 7, train_loss: 1.0368, test_loss: 0.9825, test_f1: 0.4892
 epoch: 8, train_loss: 1.0201, test_loss: 0.9839, test_f1: 0.4818
 epoch: 9, train_loss: 1.0138, test_loss: 0.9696, test_f1: 0.4779
 epoch: 10, train_loss: 1.0048, test_loss: 0.9550, test_f1: 0.4939
 epoch: 11, train_loss: 0.9909, test_loss: 0.9405, test_f1: 0.5031
 epoch: 12, train_loss: 0.9831, test_loss: 0.9437, test_f1: 0.5045
 epoch: 13, train_loss: 0.9677, test_loss: 0.9367, test_f1: 0.5178
 epoch: 14, train_loss: 0.9630, test_loss: 0.9246, test_f1: 0.5195
 epoch: 15, train_loss: 0.9447, test_loss: 0.9365, test_f1: 0.5085
 epoch: 16, train_loss: 0.9363, test_loss: 0.9295, test_f1: 0.5251
 epoch: 17, train_loss: 0.9296, test_loss: 0.9153, test_f1: 0.5263
 epoch: 18, train_loss: 0.9329, test_loss: 0.9092, test_f1: 0.5320
 epoch: 19, train_loss: 0.9226, test_loss: 0.9109, test_f1: 0.5549
 epoch: 20, train_loss: 0.9064, test_loss: 0.9163, test_f1: 0.5360
 epoch: 21, train_loss: 0.9120, test_loss: 0.9025, test_f1: 0.5422
 epoch: 22, train_loss: 0.9056, test_loss: 0.9038, test_f1: 0.5323
 epoch: 23, train_loss: 0.8780, test_loss: 0.9106, test_f1: 0.5603
 epoch: 24, train_loss: 0.8893, test_loss: 0.8906, test_f1: 0.5600
 epoch: 25, train_loss: 0.8783, test_loss: 0.9045, test_f1: 0.5659
 epoch: 26, train_loss: 0.8795, test_loss: 0.8962, test_f1: 0.5483
 epoch: 27, train_loss: 0.8670, test_loss: 0.8943, test_f1: 0.5529
 epoch: 28, train_loss: 0.8630, test_loss: 0.9001, test_f1: 0.5479
 epoch: 29, train_loss: 0.8586, test_loss: 0.9087, test_f1: 0.5396
 epoch: 30, train_loss: 0.8633, test_loss: 0.8877, test_f1: 0.5453
 epoch: 31, train_loss: 0.8597, test_loss: 0.9021, test_f1: 0.5492
 epoch: 32, train_loss: 0.8529, test_loss: 0.8992, test_f1: 0.5501
 epoch: 33, train_loss: 0.8433, test_loss: 0.8987, test_f1: 0.5508
 epoch: 34, train_loss: 0.8370, test_loss: 0.8921, test_f1: 0.5520
 epoch: 35, train_loss: 0.8326, test_loss: 0.8872, test_f1: 0.5627
 epoch: 36, train_loss: 0.8256, test_loss: 0.8819, test_f1: 0.5670
 epoch: 37, train_loss: 0.8202, test_loss: 0.8864, test_f1: 0.5723
 epoch: 38, train_loss: 0.8226, test_loss: 0.8929, test_f1: 0.5714
 epoch: 39, train_loss: 0.8215, test_loss: 0.9118, test_f1: 0.5702
 epoch: 40, train_loss: 0.8184, test_loss: 0.8855, test_f1: 0.5814
 epoch: 41, train_loss: 0.8194, test_loss: 0.8967, test_f1: 0.5767
 epoch: 42, train_loss: 0.8064, test_loss: 0.8901, test_f1: 0.5775
 epoch: 43, train_loss: 0.7968, test_loss: 0.9044, test_f1: 0.5651
 epoch: 44, train_loss: 0.8058, test_loss: 0.8966, test_f1: 0.5775
 epoch: 45, train_loss: 0.7941, test_loss: 0.9198, test_f1: 0.5694
 epoch: 46, train_loss: 0.7963, test_loss: 0.9128, test_f1: 0.5747
 epoch: 47, train_loss: 0.7944, test_loss: 0.9088, test_f1: 0.5824
 epoch: 48, train_loss: 0.7849, test_loss: 0.9013, test_f1: 0.5825
 epoch: 49, train_loss: 0.7783, test_loss: 0.8956, test_f1: 0.5890
 epoch: 50, train_loss: 0.7707, test_loss: 0.9006, test_f1: 0.5777
 epoch: 51, train_loss: 0.7604, test_loss: 0.8849, test_f1: 0.5908
 epoch: 52, train_loss: 0.7663, test_loss: 0.8826, test_f1: 0.6043
 epoch: 53, train_loss: 0.7624, test_loss: 0.8915, test_f1: 0.5894
 epoch: 54, train_loss: 0.7647, test_loss: 0.8966, test_f1: 0.5921
 epoch: 55, train_loss: 0.7603, test_loss: 0.8928, test_f1: 0.5956
 epoch: 56, train_loss: 0.7557, test_loss: 0.9066, test_f1: 0.5863
 epoch: 57, train_loss: 0.7526, test_loss: 0.8925, test_f1: 0.5917
 epoch: 58, train_loss: 0.7512, test_loss: 0.8987, test_f1: 0.6022
 epoch: 59, train_loss: 0.7617, test_loss: 0.8974, test_f1: 0.6047
 epoch: 60, train_loss: 0.7451, test_loss: 0.8977, test_f1: 0.5904
 epoch: 61, train_loss: 0.7537, test_loss: 0.9080, test_f1: 0.5962
 epoch: 62, train_loss: 0.7467, test_loss: 0.8889, test_f1: 0.6033
 epoch: 63, train_loss: 0.7547, test_loss: 0.8871, test_f1: 0.6077
 epoch: 64, train_loss: 0.7458, test_loss: 0.9064, test_f1: 0.5843
 epoch: 65, train_loss: 0.7491, test_loss: 0.9005, test_f1: 0.5867
 epoch: 66, train_loss: 0.7368, test_loss: 0.8957, test_f1: 0.5941
 epoch: 67, train_loss: 0.7457, test_loss: 0.9059, test_f1: 0.6067
 epoch: 68, train_loss: 0.7436, test_loss: 0.8857, test_f1: 0.6035
 epoch: 69, train_loss: 0.7325, test_loss: 0.8989, test_f1: 0.5919
 epoch: 70, train_loss: 0.7343, test_loss: 0.8940, test_f1: 0.6079
 epoch: 71, train_loss: 0.7374, test_loss: 0.9082, test_f1: 0.5986
 epoch: 72, train_loss: 0.7270, test_loss: 0.9023, test_f1: 0.5999
 epoch: 73, train_loss: 0.7316, test_loss: 0.8998, test_f1: 0.6070
 epoch: 74, train_loss: 0.7352, test_loss: 0.9030, test_f1: 0.6055
 epoch: 75, train_loss: 0.7356, test_loss: 0.8982, test_f1: 0.5981
 epoch: 76, train_loss: 0.7287, test_loss: 0.8989, test_f1: 0.6045
 epoch: 77, train_loss: 0.7152, test_loss: 0.8942, test_f1: 0.5959
 epoch: 78, train_loss: 0.7251, test_loss: 0.8862, test_f1: 0.6045
 epoch: 79, train_loss: 0.7259, test_loss: 0.9144, test_f1: 0.5992
 epoch: 80, train_loss: 0.7122, test_loss: 0.9139, test_f1: 0.5942
 epoch: 81, train_loss: 0.7241, test_loss: 0.9188, test_f1: 0.5987
 epoch: 82, train_loss: 0.7207, test_loss: 0.8987, test_f1: 0.6107
 epoch: 83, train_loss: 0.7205, test_loss: 0.9112, test_f1: 0.5974
 epoch: 84, train_loss: 0.7220, test_loss: 0.8865, test_f1: 0.6037
 epoch: 85, train_loss: 0.7180, test_loss: 0.9156, test_f1: 0.5931
 epoch: 86, train_loss: 0.7128, test_loss: 0.9167, test_f1: 0.6001
 epoch: 87, train_loss: 0.7166, test_loss: 0.9208, test_f1: 0.5919
 epoch: 88, train_loss: 0.7063, test_loss: 0.9081, test_f1: 0.5989
 epoch: 89, train_loss: 0.7183, test_loss: 0.9154, test_f1: 0.5994
 epoch: 90, train_loss: 0.7100, test_loss: 0.9117, test_f1: 0.6069
 epoch: 91, train_loss: 0.7036, test_loss: 0.9159, test_f1: 0.6023
 epoch: 92, train_loss: 0.7088, test_loss: 0.8985, test_f1: 0.6050
 epoch: 93, train_loss: 0.7023, test_loss: 0.9146, test_f1: 0.6016
 epoch: 94, train_loss: 0.6967, test_loss: 0.9349, test_f1: 0.6004
 epoch: 95, train_loss: 0.7025, test_loss: 0.9157, test_f1: 0.6046
 epoch: 96, train_loss: 0.7037, test_loss: 0.9182, test_f1: 0.6032
 epoch: 97, train_loss: 0.7157, test_loss: 0.9134, test_f1: 0.6089
 epoch: 98, train_loss: 0.6986, test_loss: 0.9140, test_f1: 0.6036
 epoch: 99, train_loss: 0.7112, test_loss: 0.9174, test_f1: 0.6163
##################ITERATION #8 ****************************************
 epoch: 0, train_loss: 1.3097, test_loss: 1.3212, test_f1: 0.2270
 epoch: 1, train_loss: 1.1912, test_loss: 1.1721, test_f1: 0.3647
 epoch: 2, train_loss: 1.1466, test_loss: 1.0533, test_f1: 0.4912
 epoch: 3, train_loss: 1.1154, test_loss: 1.0174, test_f1: 0.5093
 epoch: 4, train_loss: 1.0942, test_loss: 1.0011, test_f1: 0.5228
 epoch: 5, train_loss: 1.0738, test_loss: 0.9873, test_f1: 0.5146
 epoch: 6, train_loss: 1.0634, test_loss: 0.9782, test_f1: 0.5220
 epoch: 7, train_loss: 1.0481, test_loss: 0.9780, test_f1: 0.5196
 epoch: 8, train_loss: 1.0317, test_loss: 0.9685, test_f1: 0.5162
 epoch: 9, train_loss: 1.0178, test_loss: 0.9538, test_f1: 0.5267
 epoch: 10, train_loss: 1.0051, test_loss: 0.9536, test_f1: 0.5179
 epoch: 11, train_loss: 1.0024, test_loss: 0.9508, test_f1: 0.5048
 epoch: 12, train_loss: 0.9937, test_loss: 0.9510, test_f1: 0.5157
 epoch: 13, train_loss: 0.9809, test_loss: 0.9536, test_f1: 0.5241
 epoch: 14, train_loss: 0.9766, test_loss: 0.9494, test_f1: 0.5286
 epoch: 15, train_loss: 0.9664, test_loss: 0.9411, test_f1: 0.5247
 epoch: 16, train_loss: 0.9530, test_loss: 0.9484, test_f1: 0.5181
 epoch: 17, train_loss: 0.9576, test_loss: 0.9458, test_f1: 0.5335
 epoch: 18, train_loss: 0.9420, test_loss: 0.9415, test_f1: 0.5272
 epoch: 19, train_loss: 0.9425, test_loss: 0.9534, test_f1: 0.5354
 epoch: 20, train_loss: 0.9292, test_loss: 0.9361, test_f1: 0.5374
 epoch: 21, train_loss: 0.9235, test_loss: 0.9382, test_f1: 0.5322
 epoch: 22, train_loss: 0.9192, test_loss: 0.9352, test_f1: 0.5281
 epoch: 23, train_loss: 0.9248, test_loss: 0.9355, test_f1: 0.5330
 epoch: 24, train_loss: 0.9194, test_loss: 0.9333, test_f1: 0.5333
 epoch: 25, train_loss: 0.8992, test_loss: 0.9314, test_f1: 0.5477
 epoch: 26, train_loss: 0.9122, test_loss: 0.9480, test_f1: 0.5463
 epoch: 27, train_loss: 0.8942, test_loss: 0.9326, test_f1: 0.5523
 epoch: 28, train_loss: 0.8948, test_loss: 0.9286, test_f1: 0.5335
 epoch: 29, train_loss: 0.8860, test_loss: 0.9298, test_f1: 0.5472
 epoch: 30, train_loss: 0.8906, test_loss: 0.9426, test_f1: 0.5415
 epoch: 31, train_loss: 0.8866, test_loss: 0.9390, test_f1: 0.5576
 epoch: 32, train_loss: 0.8730, test_loss: 0.9387, test_f1: 0.5523
 epoch: 33, train_loss: 0.8664, test_loss: 0.9459, test_f1: 0.5635
 epoch: 34, train_loss: 0.8706, test_loss: 0.9439, test_f1: 0.5798
 epoch: 35, train_loss: 0.8569, test_loss: 0.9276, test_f1: 0.5690
 epoch: 36, train_loss: 0.8554, test_loss: 0.9543, test_f1: 0.5735
 epoch: 37, train_loss: 0.8638, test_loss: 0.9456, test_f1: 0.5501
 epoch: 38, train_loss: 0.8618, test_loss: 0.9375, test_f1: 0.5559
 epoch: 39, train_loss: 0.8470, test_loss: 0.9395, test_f1: 0.5543
 epoch: 40, train_loss: 0.8696, test_loss: 0.9514, test_f1: 0.5469
 epoch: 41, train_loss: 0.8387, test_loss: 0.9465, test_f1: 0.5493
 epoch: 42, train_loss: 0.8396, test_loss: 0.9455, test_f1: 0.5591
 epoch: 43, train_loss: 0.8302, test_loss: 0.9518, test_f1: 0.5699
 epoch: 44, train_loss: 0.8221, test_loss: 0.9440, test_f1: 0.5539
 epoch: 45, train_loss: 0.8340, test_loss: 0.9558, test_f1: 0.5528
 epoch: 46, train_loss: 0.8206, test_loss: 0.9442, test_f1: 0.5679
 epoch: 47, train_loss: 0.8191, test_loss: 0.9377, test_f1: 0.5676
 epoch: 48, train_loss: 0.8321, test_loss: 0.9557, test_f1: 0.5667
 epoch: 49, train_loss: 0.8147, test_loss: 0.9512, test_f1: 0.5751
 epoch: 50, train_loss: 0.8177, test_loss: 0.9622, test_f1: 0.5550
 epoch: 51, train_loss: 0.8072, test_loss: 0.9449, test_f1: 0.5671
 epoch: 52, train_loss: 0.8114, test_loss: 0.9533, test_f1: 0.5749
 epoch: 53, train_loss: 0.8012, test_loss: 0.9534, test_f1: 0.5783
 epoch: 54, train_loss: 0.8000, test_loss: 0.9480, test_f1: 0.5643
 epoch: 55, train_loss: 0.7996, test_loss: 0.9566, test_f1: 0.5781
 epoch: 56, train_loss: 0.7941, test_loss: 0.9412, test_f1: 0.5690
 epoch: 57, train_loss: 0.7922, test_loss: 0.9473, test_f1: 0.5746
 epoch: 58, train_loss: 0.7906, test_loss: 0.9463, test_f1: 0.5724
 epoch: 59, train_loss: 0.8008, test_loss: 0.9521, test_f1: 0.5734
 epoch: 60, train_loss: 0.7999, test_loss: 0.9497, test_f1: 0.5732
 epoch: 61, train_loss: 0.7955, test_loss: 0.9534, test_f1: 0.5751
 epoch: 62, train_loss: 0.7763, test_loss: 0.9436, test_f1: 0.5764
 epoch: 63, train_loss: 0.7966, test_loss: 0.9480, test_f1: 0.5698
 epoch: 64, train_loss: 0.8005, test_loss: 0.9584, test_f1: 0.5690
 epoch: 65, train_loss: 0.7879, test_loss: 0.9489, test_f1: 0.5883
 epoch: 66, train_loss: 0.7934, test_loss: 0.9573, test_f1: 0.5775
 epoch: 67, train_loss: 0.7780, test_loss: 0.9559, test_f1: 0.5759
 epoch: 68, train_loss: 0.7945, test_loss: 0.9547, test_f1: 0.5748
 epoch: 69, train_loss: 0.7843, test_loss: 0.9558, test_f1: 0.5889
 epoch: 70, train_loss: 0.7847, test_loss: 0.9556, test_f1: 0.5827
 epoch: 71, train_loss: 0.7766, test_loss: 0.9501, test_f1: 0.5787
 epoch: 72, train_loss: 0.7795, test_loss: 0.9623, test_f1: 0.5908
 epoch: 73, train_loss: 0.7770, test_loss: 0.9531, test_f1: 0.5819
 epoch: 74, train_loss: 0.7759, test_loss: 0.9559, test_f1: 0.5831
 epoch: 75, train_loss: 0.7684, test_loss: 0.9562, test_f1: 0.5871
 epoch: 76, train_loss: 0.7747, test_loss: 0.9550, test_f1: 0.5957
 epoch: 77, train_loss: 0.7684, test_loss: 0.9586, test_f1: 0.5934
 epoch: 78, train_loss: 0.7643, test_loss: 0.9585, test_f1: 0.5773
 epoch: 79, train_loss: 0.7698, test_loss: 0.9571, test_f1: 0.5879
 epoch: 80, train_loss: 0.7720, test_loss: 0.9623, test_f1: 0.5871
 epoch: 81, train_loss: 0.7568, test_loss: 0.9602, test_f1: 0.5906
 epoch: 82, train_loss: 0.7756, test_loss: 0.9640, test_f1: 0.5833
 epoch: 83, train_loss: 0.7668, test_loss: 0.9608, test_f1: 0.5894
 epoch: 84, train_loss: 0.7675, test_loss: 0.9660, test_f1: 0.5888
 epoch: 85, train_loss: 0.7487, test_loss: 0.9656, test_f1: 0.5775
 epoch: 86, train_loss: 0.7583, test_loss: 0.9599, test_f1: 0.5694
 epoch: 87, train_loss: 0.7482, test_loss: 0.9687, test_f1: 0.5790
 epoch: 88, train_loss: 0.7622, test_loss: 0.9544, test_f1: 0.5888
 epoch: 89, train_loss: 0.7627, test_loss: 0.9699, test_f1: 0.5721
 epoch: 90, train_loss: 0.7560, test_loss: 0.9729, test_f1: 0.5816
 epoch: 91, train_loss: 0.7514, test_loss: 0.9631, test_f1: 0.5804
 epoch: 92, train_loss: 0.7556, test_loss: 0.9678, test_f1: 0.5719
 epoch: 93, train_loss: 0.7527, test_loss: 0.9730, test_f1: 0.5866
 epoch: 94, train_loss: 0.7576, test_loss: 0.9712, test_f1: 0.5988
 epoch: 95, train_loss: 0.7404, test_loss: 0.9750, test_f1: 0.5867
 epoch: 96, train_loss: 0.7453, test_loss: 0.9702, test_f1: 0.5998
 epoch: 97, train_loss: 0.7509, test_loss: 0.9628, test_f1: 0.5822
 epoch: 98, train_loss: 0.7455, test_loss: 0.9748, test_f1: 0.5813
 epoch: 99, train_loss: 0.7436, test_loss: 0.9720, test_f1: 0.5794
##################ITERATION #9 ****************************************
 epoch: 0, train_loss: 1.2921, test_loss: 1.3435, test_f1: 0.2822
 epoch: 1, train_loss: 1.1800, test_loss: 1.1624, test_f1: 0.4187
 epoch: 2, train_loss: 1.1405, test_loss: 1.0626, test_f1: 0.4633
 epoch: 3, train_loss: 1.1144, test_loss: 1.0321, test_f1: 0.4475
 epoch: 4, train_loss: 1.0859, test_loss: 1.0100, test_f1: 0.4537
 epoch: 5, train_loss: 1.0775, test_loss: 1.0036, test_f1: 0.4616
 epoch: 6, train_loss: 1.0584, test_loss: 0.9868, test_f1: 0.4867
 epoch: 7, train_loss: 1.0370, test_loss: 0.9790, test_f1: 0.4824
 epoch: 8, train_loss: 1.0131, test_loss: 0.9692, test_f1: 0.4846
 epoch: 9, train_loss: 1.0089, test_loss: 0.9649, test_f1: 0.4788
 epoch: 10, train_loss: 1.0042, test_loss: 0.9573, test_f1: 0.4873
 epoch: 11, train_loss: 0.9953, test_loss: 0.9538, test_f1: 0.4870
 epoch: 12, train_loss: 0.9761, test_loss: 0.9526, test_f1: 0.5011
 epoch: 13, train_loss: 0.9744, test_loss: 0.9573, test_f1: 0.5174
 epoch: 14, train_loss: 0.9645, test_loss: 0.9428, test_f1: 0.5169
 epoch: 15, train_loss: 0.9489, test_loss: 0.9450, test_f1: 0.5158
 epoch: 16, train_loss: 0.9429, test_loss: 0.9409, test_f1: 0.5415
 epoch: 17, train_loss: 0.9400, test_loss: 0.9363, test_f1: 0.5342
 epoch: 18, train_loss: 0.9304, test_loss: 0.9312, test_f1: 0.5436
 epoch: 19, train_loss: 0.9207, test_loss: 0.9329, test_f1: 0.5434
 epoch: 20, train_loss: 0.9203, test_loss: 0.9438, test_f1: 0.5478
 epoch: 21, train_loss: 0.9132, test_loss: 0.9358, test_f1: 0.5263
 epoch: 22, train_loss: 0.9107, test_loss: 0.9374, test_f1: 0.5360
 epoch: 23, train_loss: 0.8976, test_loss: 0.9383, test_f1: 0.5344
 epoch: 24, train_loss: 0.8996, test_loss: 0.9382, test_f1: 0.5411
 epoch: 25, train_loss: 0.8894, test_loss: 0.9364, test_f1: 0.5597
 epoch: 26, train_loss: 0.8938, test_loss: 0.9394, test_f1: 0.5601
 epoch: 27, train_loss: 0.8802, test_loss: 0.9445, test_f1: 0.5516
 epoch: 28, train_loss: 0.8782, test_loss: 0.9483, test_f1: 0.5447
 epoch: 29, train_loss: 0.8842, test_loss: 0.9330, test_f1: 0.5639
 epoch: 30, train_loss: 0.8701, test_loss: 0.9391, test_f1: 0.5718
 epoch: 31, train_loss: 0.8676, test_loss: 0.9319, test_f1: 0.5768
 epoch: 32, train_loss: 0.8677, test_loss: 0.9457, test_f1: 0.5598
 epoch: 33, train_loss: 0.8581, test_loss: 0.9403, test_f1: 0.5630
 epoch: 34, train_loss: 0.8494, test_loss: 0.9381, test_f1: 0.5682
 epoch: 35, train_loss: 0.8506, test_loss: 0.9303, test_f1: 0.5853
 epoch: 36, train_loss: 0.8421, test_loss: 0.9326, test_f1: 0.5785
 epoch: 37, train_loss: 0.8511, test_loss: 0.9373, test_f1: 0.5720
 epoch: 38, train_loss: 0.8330, test_loss: 0.9499, test_f1: 0.5730
 epoch: 39, train_loss: 0.8455, test_loss: 0.9498, test_f1: 0.5643
 epoch: 40, train_loss: 0.8352, test_loss: 0.9436, test_f1: 0.5572
 epoch: 41, train_loss: 0.8343, test_loss: 0.9439, test_f1: 0.5621
 epoch: 42, train_loss: 0.8281, test_loss: 0.9353, test_f1: 0.5851
 epoch: 43, train_loss: 0.8277, test_loss: 0.9333, test_f1: 0.5733
 epoch: 44, train_loss: 0.8229, test_loss: 0.9252, test_f1: 0.5867
 epoch: 45, train_loss: 0.8169, test_loss: 0.9333, test_f1: 0.5853
 epoch: 46, train_loss: 0.8174, test_loss: 0.9398, test_f1: 0.5749
 epoch: 47, train_loss: 0.8010, test_loss: 0.9334, test_f1: 0.5699
 epoch: 48, train_loss: 0.8189, test_loss: 0.9357, test_f1: 0.5879
 epoch: 49, train_loss: 0.8051, test_loss: 0.9469, test_f1: 0.5791
 epoch: 50, train_loss: 0.7987, test_loss: 0.9552, test_f1: 0.5769
 epoch: 51, train_loss: 0.7936, test_loss: 0.9383, test_f1: 0.5829
 epoch: 52, train_loss: 0.7909, test_loss: 0.9425, test_f1: 0.5800
 epoch: 53, train_loss: 0.7834, test_loss: 0.9408, test_f1: 0.5811
 epoch: 54, train_loss: 0.7913, test_loss: 0.9503, test_f1: 0.5900
 epoch: 55, train_loss: 0.7844, test_loss: 0.9499, test_f1: 0.5681
 epoch: 56, train_loss: 0.7811, test_loss: 0.9524, test_f1: 0.5694
 epoch: 57, train_loss: 0.7777, test_loss: 0.9500, test_f1: 0.5687
 epoch: 58, train_loss: 0.7698, test_loss: 0.9528, test_f1: 0.5629
 epoch: 59, train_loss: 0.7739, test_loss: 0.9517, test_f1: 0.5746
 epoch: 60, train_loss: 0.7749, test_loss: 0.9563, test_f1: 0.5761
 epoch: 61, train_loss: 0.7827, test_loss: 0.9482, test_f1: 0.5754
 epoch: 62, train_loss: 0.7731, test_loss: 0.9395, test_f1: 0.5822
 epoch: 63, train_loss: 0.7664, test_loss: 0.9436, test_f1: 0.5727
 epoch: 64, train_loss: 0.7640, test_loss: 0.9552, test_f1: 0.5807
 epoch: 65, train_loss: 0.7675, test_loss: 0.9513, test_f1: 0.5800
 epoch: 66, train_loss: 0.7769, test_loss: 0.9474, test_f1: 0.5674
 epoch: 67, train_loss: 0.7654, test_loss: 0.9516, test_f1: 0.5792
 epoch: 68, train_loss: 0.7660, test_loss: 0.9588, test_f1: 0.5748
 epoch: 69, train_loss: 0.7610, test_loss: 0.9508, test_f1: 0.5879
 epoch: 70, train_loss: 0.7656, test_loss: 0.9605, test_f1: 0.5653
 epoch: 71, train_loss: 0.7627, test_loss: 0.9621, test_f1: 0.5852
 epoch: 72, train_loss: 0.7612, test_loss: 0.9457, test_f1: 0.5761
 epoch: 73, train_loss: 0.7546, test_loss: 0.9558, test_f1: 0.5862
 epoch: 74, train_loss: 0.7486, test_loss: 0.9485, test_f1: 0.5851
 epoch: 75, train_loss: 0.7626, test_loss: 0.9544, test_f1: 0.5799
 epoch: 76, train_loss: 0.7503, test_loss: 0.9612, test_f1: 0.5770
 epoch: 77, train_loss: 0.7453, test_loss: 0.9562, test_f1: 0.5744
 epoch: 78, train_loss: 0.7401, test_loss: 0.9544, test_f1: 0.5811
 epoch: 79, train_loss: 0.7392, test_loss: 0.9570, test_f1: 0.5798
 epoch: 80, train_loss: 0.7490, test_loss: 0.9519, test_f1: 0.5821
 epoch: 81, train_loss: 0.7447, test_loss: 0.9621, test_f1: 0.5812
 epoch: 82, train_loss: 0.7533, test_loss: 0.9554, test_f1: 0.5834
 epoch: 83, train_loss: 0.7329, test_loss: 0.9671, test_f1: 0.5798
 epoch: 84, train_loss: 0.7457, test_loss: 0.9566, test_f1: 0.5849
 epoch: 85, train_loss: 0.7290, test_loss: 0.9586, test_f1: 0.5821
 epoch: 86, train_loss: 0.7440, test_loss: 0.9645, test_f1: 0.5814
 epoch: 87, train_loss: 0.7366, test_loss: 0.9741, test_f1: 0.5856
 epoch: 88, train_loss: 0.7487, test_loss: 0.9667, test_f1: 0.5852
 epoch: 89, train_loss: 0.7219, test_loss: 0.9703, test_f1: 0.5768
 epoch: 90, train_loss: 0.7266, test_loss: 0.9674, test_f1: 0.5861
 epoch: 91, train_loss: 0.7228, test_loss: 0.9648, test_f1: 0.5916
 epoch: 92, train_loss: 0.7241, test_loss: 0.9725, test_f1: 0.5890
 epoch: 93, train_loss: 0.7347, test_loss: 0.9634, test_f1: 0.5894
 epoch: 94, train_loss: 0.7253, test_loss: 0.9603, test_f1: 0.5946
 epoch: 95, train_loss: 0.7253, test_loss: 0.9737, test_f1: 0.5890
 epoch: 96, train_loss: 0.7143, test_loss: 0.9683, test_f1: 0.5959
 epoch: 97, train_loss: 0.7188, test_loss: 0.9618, test_f1: 0.5940
 epoch: 98, train_loss: 0.7143, test_loss: 0.9601, test_f1: 0.5931
 epoch: 99, train_loss: 0.7140, test_loss: 0.9581, test_f1: 0.5833

Training completed in 522.18 seconds
Best F1: 0.6163 at epoch 99
Mean F1 across iterations: 0.5937  0.0125
========================FINAL RESULTS================================
FEGIN weighted F1: 0.6163  0.0125
python main.py --data ltspice_examples --representation component_net --model FEGIN --layers 5 --hiddens 64 --batch_size 128 --lr 0.0001 --emb_size 512 --epochs 100 --save_appendix component_net_L5_H64_BS128_LR0.0001_E512 --no_val
-----



STDERR:
  File "main.py", line 370, in <module>
    main()
  File "main.py", line 254, in main
    dataset = dataset_class(
  File "/home/philip/projects/ltspice_examples_code_repo/Circuit-Completion-Using-GNNs/component_classification_with_link_prediction_head/evaluation/FEGIN/kernel/circuit_datasets.py", line 15, in __init__
    self.data, self.slices = torch.load(self.processed_paths[0])
  File "/home/philip/.local/lib/python3.8/site-packages/torch/serialization.py", line 1040, in load
    warnings.warn(
  File "/usr/lib/python3.8/warnings.py", line 109, in _showwarnmsg
    sw(msg.message, msg.category, msg.filename, msg.lineno,
  File "main.py", line 47, in warn_with_traceback
    traceback.print_stack(file=log)
/home/philip/projects/ltspice_examples_code_repo/Circuit-Completion-Using-GNNs/component_classification_with_link_prediction_head/evaluation/FEGIN/kernel/circuit_datasets.py:15: FutureWarning: You are using `torch.load` with `weights_only=False` (the current default value), which uses the default pickle module implicitly. It is possible to construct malicious pickle data which will execute arbitrary code during unpickling (See https://github.com/pytorch/pytorch/blob/main/SECURITY.md#untrusted-models for more details). In a future release, the default value for `weights_only` will be flipped to `True`. This limits the functions that could be executed during unpickling. Arbitrary objects will no longer be allowed to be loaded via this mode unless they are explicitly allowlisted by the user via `torch.serialization.add_safe_globals`. We recommend you start setting `weights_only=True` for any use case where you don't have full control of the loaded file. Please open an issue on GitHub for any issues related to this experimental feature.
  self.data, self.slices = torch.load(self.processed_paths[0])
