STDOUT:
Results will be saved in /home/philip/projects/ltspice_examples_code_repo/Circuit-Completion-Using-GNNs/component_classification_with_link_prediction_head/evaluation/FEGIN/results/model_FEGIN_dataset_ltspice_examples
Command line input: python main.py --data ltspice_examples --representation component_component --model FEGIN --layers 6 --hiddens 64 --batch_size 64 --lr 0.001 --emb_size 512 --epochs 100 --save_appendix component_component_L6_H64_BS64_LR0.001_E512 --no_val
 is saved.
-----
ltspice_examples - FEGIN
Using 6 layers, 64 hidden units, h = 2
Loading component_component representation dataset
ENTERED
Training FEGIN on component_component representation
Train: 3556, Test: 845
##################ITERATION #0 ****************************************
 epoch: 0, train_loss: 1.2800, test_loss: 1.2079, test_f1: 0.3242
 epoch: 1, train_loss: 1.1885, test_loss: 1.1217, test_f1: 0.3793
 epoch: 2, train_loss: 1.1235, test_loss: 1.0879, test_f1: 0.4236
 epoch: 3, train_loss: 1.0806, test_loss: 1.0604, test_f1: 0.4531
 epoch: 4, train_loss: 1.0692, test_loss: 1.0340, test_f1: 0.4441
 epoch: 5, train_loss: 1.0367, test_loss: 0.9933, test_f1: 0.4650
 epoch: 6, train_loss: 1.0148, test_loss: 1.0310, test_f1: 0.4357
 epoch: 7, train_loss: 0.9894, test_loss: 0.9794, test_f1: 0.4688
 epoch: 8, train_loss: 0.9757, test_loss: 0.9939, test_f1: 0.4969
 epoch: 9, train_loss: 0.9598, test_loss: 1.0321, test_f1: 0.4583
 epoch: 10, train_loss: 0.9443, test_loss: 1.0356, test_f1: 0.4512
 epoch: 11, train_loss: 0.9209, test_loss: 1.0271, test_f1: 0.5101
 epoch: 12, train_loss: 0.9057, test_loss: 1.0304, test_f1: 0.5226
 epoch: 13, train_loss: 0.8941, test_loss: 1.0161, test_f1: 0.5156
 epoch: 14, train_loss: 0.8838, test_loss: 1.0433, test_f1: 0.4686
 epoch: 15, train_loss: 0.8703, test_loss: 1.1146, test_f1: 0.4839
 epoch: 16, train_loss: 0.8492, test_loss: 1.0313, test_f1: 0.4887
 epoch: 17, train_loss: 0.8429, test_loss: 1.0642, test_f1: 0.5094
 epoch: 18, train_loss: 0.8393, test_loss: 1.0967, test_f1: 0.5457
 epoch: 19, train_loss: 0.8129, test_loss: 1.0767, test_f1: 0.5385
 epoch: 20, train_loss: 0.8102, test_loss: 1.0917, test_f1: 0.5520
 epoch: 21, train_loss: 0.8018, test_loss: 1.1017, test_f1: 0.5376
 epoch: 22, train_loss: 0.8062, test_loss: 1.1170, test_f1: 0.4927
 epoch: 23, train_loss: 0.7812, test_loss: 1.0818, test_f1: 0.5326
 epoch: 24, train_loss: 0.7791, test_loss: 1.1213, test_f1: 0.5461
 epoch: 25, train_loss: 0.7740, test_loss: 1.2060, test_f1: 0.5293
 epoch: 26, train_loss: 0.7593, test_loss: 1.1691, test_f1: 0.5340
 epoch: 27, train_loss: 0.7568, test_loss: 1.1599, test_f1: 0.5202
 epoch: 28, train_loss: 0.7534, test_loss: 1.1749, test_f1: 0.5313
 epoch: 29, train_loss: 0.7325, test_loss: 1.2109, test_f1: 0.5397
 epoch: 30, train_loss: 0.7468, test_loss: 1.1062, test_f1: 0.5447
 epoch: 31, train_loss: 0.7233, test_loss: 1.1319, test_f1: 0.5400
 epoch: 32, train_loss: 0.6959, test_loss: 1.2122, test_f1: 0.5519
 epoch: 33, train_loss: 0.7380, test_loss: 1.2421, test_f1: 0.5385
 epoch: 34, train_loss: 0.7090, test_loss: 1.2069, test_f1: 0.5377
 epoch: 35, train_loss: 0.7032, test_loss: 1.1857, test_f1: 0.5590
 epoch: 36, train_loss: 0.7139, test_loss: 1.3170, test_f1: 0.5471
 epoch: 37, train_loss: 0.6799, test_loss: 1.3119, test_f1: 0.5521
 epoch: 38, train_loss: 0.6742, test_loss: 1.2834, test_f1: 0.5257
 epoch: 39, train_loss: 0.6868, test_loss: 1.3237, test_f1: 0.5558
 epoch: 40, train_loss: 0.6718, test_loss: 1.2881, test_f1: 0.5423
 epoch: 41, train_loss: 0.6533, test_loss: 1.3087, test_f1: 0.5473
 epoch: 42, train_loss: 0.6491, test_loss: 1.4961, test_f1: 0.5171
 epoch: 43, train_loss: 0.6615, test_loss: 1.4193, test_f1: 0.5416
 epoch: 44, train_loss: 0.6506, test_loss: 1.2993, test_f1: 0.5404
 epoch: 45, train_loss: 0.6287, test_loss: 1.3117, test_f1: 0.5571
 epoch: 46, train_loss: 0.6344, test_loss: 1.4163, test_f1: 0.5384
 epoch: 47, train_loss: 0.6197, test_loss: 1.2756, test_f1: 0.5761
 epoch: 48, train_loss: 0.6299, test_loss: 1.4190, test_f1: 0.5442
 epoch: 49, train_loss: 0.6381, test_loss: 1.3756, test_f1: 0.5505
 epoch: 50, train_loss: 0.6159, test_loss: 1.3678, test_f1: 0.5610
 epoch: 51, train_loss: 0.5804, test_loss: 1.4026, test_f1: 0.5555
 epoch: 52, train_loss: 0.5678, test_loss: 1.4498, test_f1: 0.5798
 epoch: 53, train_loss: 0.5423, test_loss: 1.4492, test_f1: 0.5561
 epoch: 54, train_loss: 0.5360, test_loss: 1.5532, test_f1: 0.5526
 epoch: 55, train_loss: 0.5464, test_loss: 1.5043, test_f1: 0.5648
 epoch: 56, train_loss: 0.5243, test_loss: 1.5993, test_f1: 0.5514
 epoch: 57, train_loss: 0.5412, test_loss: 1.5629, test_f1: 0.5460
 epoch: 58, train_loss: 0.5221, test_loss: 1.5581, test_f1: 0.5636
 epoch: 59, train_loss: 0.5156, test_loss: 1.5698, test_f1: 0.5612
 epoch: 60, train_loss: 0.5050, test_loss: 1.7120, test_f1: 0.5402
 epoch: 61, train_loss: 0.5253, test_loss: 1.5765, test_f1: 0.5352
 epoch: 62, train_loss: 0.5075, test_loss: 1.5880, test_f1: 0.5531
 epoch: 63, train_loss: 0.4961, test_loss: 1.6892, test_f1: 0.5488
 epoch: 64, train_loss: 0.4899, test_loss: 1.8048, test_f1: 0.5277
 epoch: 65, train_loss: 0.4792, test_loss: 1.7802, test_f1: 0.5546
 epoch: 66, train_loss: 0.4958, test_loss: 1.7340, test_f1: 0.5558
 epoch: 67, train_loss: 0.4853, test_loss: 1.6681, test_f1: 0.5631
 epoch: 68, train_loss: 0.4724, test_loss: 1.7432, test_f1: 0.5417
 epoch: 69, train_loss: 0.4640, test_loss: 1.8294, test_f1: 0.5665
 epoch: 70, train_loss: 0.4602, test_loss: 1.7805, test_f1: 0.5533
 epoch: 71, train_loss: 0.4789, test_loss: 1.9088, test_f1: 0.5498
 epoch: 72, train_loss: 0.4631, test_loss: 1.8195, test_f1: 0.5697
 epoch: 73, train_loss: 0.4625, test_loss: 1.8635, test_f1: 0.5564
 epoch: 74, train_loss: 0.4418, test_loss: 1.8693, test_f1: 0.5326
 epoch: 75, train_loss: 0.4403, test_loss: 1.9193, test_f1: 0.5329
 epoch: 76, train_loss: 0.4568, test_loss: 1.9586, test_f1: 0.5268
 epoch: 77, train_loss: 0.4290, test_loss: 1.9310, test_f1: 0.5387
 epoch: 78, train_loss: 0.4484, test_loss: 2.0156, test_f1: 0.5278
 epoch: 79, train_loss: 0.4386, test_loss: 1.9667, test_f1: 0.5486
 epoch: 80, train_loss: 0.4342, test_loss: 2.0159, test_f1: 0.5254
 epoch: 81, train_loss: 0.4353, test_loss: 1.9416, test_f1: 0.5425
 epoch: 82, train_loss: 0.4405, test_loss: 2.0174, test_f1: 0.5388
 epoch: 83, train_loss: 0.4386, test_loss: 2.0135, test_f1: 0.5431
 epoch: 84, train_loss: 0.4288, test_loss: 2.0305, test_f1: 0.5339
 epoch: 85, train_loss: 0.4506, test_loss: 2.1676, test_f1: 0.5139
 epoch: 86, train_loss: 0.4267, test_loss: 2.0384, test_f1: 0.5659
 epoch: 87, train_loss: 0.4187, test_loss: 2.2630, test_f1: 0.5240
 epoch: 88, train_loss: 0.4215, test_loss: 2.1494, test_f1: 0.5450
 epoch: 89, train_loss: 0.4127, test_loss: 2.0184, test_f1: 0.5778
 epoch: 90, train_loss: 0.4117, test_loss: 2.0017, test_f1: 0.5567
 epoch: 91, train_loss: 0.3997, test_loss: 2.1821, test_f1: 0.5562
 epoch: 92, train_loss: 0.4155, test_loss: 2.1653, test_f1: 0.5625
 epoch: 93, train_loss: 0.4106, test_loss: 2.2179, test_f1: 0.5385
 epoch: 94, train_loss: 0.4126, test_loss: 2.1553, test_f1: 0.5478
 epoch: 95, train_loss: 0.3930, test_loss: 2.3101, test_f1: 0.5494
 epoch: 96, train_loss: 0.3685, test_loss: 2.2949, test_f1: 0.5422
 epoch: 97, train_loss: 0.3814, test_loss: 2.2876, test_f1: 0.5455
 epoch: 98, train_loss: 0.3844, test_loss: 2.1566, test_f1: 0.5603
 epoch: 99, train_loss: 0.3823, test_loss: 2.1915, test_f1: 0.5420
##################ITERATION #1 ****************************************
 epoch: 0, train_loss: 1.2383, test_loss: 1.1642, test_f1: 0.4207
 epoch: 1, train_loss: 1.1621, test_loss: 1.0936, test_f1: 0.4178
 epoch: 2, train_loss: 1.1106, test_loss: 1.0163, test_f1: 0.4598
 epoch: 3, train_loss: 1.0681, test_loss: 1.0414, test_f1: 0.4611
 epoch: 4, train_loss: 1.0534, test_loss: 0.9833, test_f1: 0.4832
 epoch: 5, train_loss: 1.0379, test_loss: 0.9996, test_f1: 0.4551
 epoch: 6, train_loss: 1.0106, test_loss: 0.9525, test_f1: 0.4894
 epoch: 7, train_loss: 0.9869, test_loss: 0.9657, test_f1: 0.5115
 epoch: 8, train_loss: 0.9759, test_loss: 0.9841, test_f1: 0.5018
 epoch: 9, train_loss: 0.9578, test_loss: 1.1252, test_f1: 0.4890
 epoch: 10, train_loss: 0.9519, test_loss: 0.9668, test_f1: 0.4772
 epoch: 11, train_loss: 0.9234, test_loss: 0.9856, test_f1: 0.4850
 epoch: 12, train_loss: 0.9182, test_loss: 0.9930, test_f1: 0.4941
 epoch: 13, train_loss: 0.9129, test_loss: 0.9697, test_f1: 0.5043
 epoch: 14, train_loss: 0.8992, test_loss: 1.0205, test_f1: 0.4688
 epoch: 15, train_loss: 0.8993, test_loss: 1.0447, test_f1: 0.4831
 epoch: 16, train_loss: 0.8576, test_loss: 1.0033, test_f1: 0.5032
 epoch: 17, train_loss: 0.8794, test_loss: 1.0223, test_f1: 0.4789
 epoch: 18, train_loss: 0.8791, test_loss: 1.0059, test_f1: 0.4943
 epoch: 19, train_loss: 0.8603, test_loss: 1.0210, test_f1: 0.4769
 epoch: 20, train_loss: 0.8449, test_loss: 1.0245, test_f1: 0.5143
 epoch: 21, train_loss: 0.8425, test_loss: 1.2251, test_f1: 0.4921
 epoch: 22, train_loss: 0.8205, test_loss: 1.1205, test_f1: 0.4985
 epoch: 23, train_loss: 0.8096, test_loss: 1.1392, test_f1: 0.4859
 epoch: 24, train_loss: 0.8201, test_loss: 1.1127, test_f1: 0.5172
 epoch: 25, train_loss: 0.8177, test_loss: 1.1777, test_f1: 0.4428
 epoch: 26, train_loss: 0.7934, test_loss: 1.1616, test_f1: 0.4912
 epoch: 27, train_loss: 0.7888, test_loss: 1.1067, test_f1: 0.5307
 epoch: 28, train_loss: 0.7753, test_loss: 1.1164, test_f1: 0.5342
 epoch: 29, train_loss: 0.7668, test_loss: 1.1237, test_f1: 0.5390
 epoch: 30, train_loss: 0.7702, test_loss: 1.1645, test_f1: 0.5088
 epoch: 31, train_loss: 0.7606, test_loss: 1.2015, test_f1: 0.5354
 epoch: 32, train_loss: 0.7603, test_loss: 1.2007, test_f1: 0.5291
 epoch: 33, train_loss: 0.7504, test_loss: 1.3642, test_f1: 0.4976
 epoch: 34, train_loss: 0.7567, test_loss: 1.2305, test_f1: 0.5129
 epoch: 35, train_loss: 0.7536, test_loss: 1.2945, test_f1: 0.4908
 epoch: 36, train_loss: 0.7448, test_loss: 1.2417, test_f1: 0.5099
 epoch: 37, train_loss: 0.7408, test_loss: 1.2470, test_f1: 0.5049
 epoch: 38, train_loss: 0.7131, test_loss: 1.1526, test_f1: 0.5271
 epoch: 39, train_loss: 0.7047, test_loss: 1.2415, test_f1: 0.5071
 epoch: 40, train_loss: 0.7293, test_loss: 1.1657, test_f1: 0.5039
 epoch: 41, train_loss: 0.7154, test_loss: 1.2439, test_f1: 0.5015
 epoch: 42, train_loss: 0.7063, test_loss: 1.1192, test_f1: 0.5278
 epoch: 43, train_loss: 0.6985, test_loss: 1.2841, test_f1: 0.5204
 epoch: 44, train_loss: 0.6839, test_loss: 1.1322, test_f1: 0.5441
 epoch: 45, train_loss: 0.6760, test_loss: 1.3240, test_f1: 0.5090
 epoch: 46, train_loss: 0.6748, test_loss: 1.3004, test_f1: 0.5235
 epoch: 47, train_loss: 0.6839, test_loss: 1.4596, test_f1: 0.5170
 epoch: 48, train_loss: 0.6783, test_loss: 1.2320, test_f1: 0.5240
 epoch: 49, train_loss: 0.6525, test_loss: 1.3717, test_f1: 0.5264
 epoch: 50, train_loss: 0.6641, test_loss: 1.1879, test_f1: 0.5418
 epoch: 51, train_loss: 0.6341, test_loss: 1.4233, test_f1: 0.5321
 epoch: 52, train_loss: 0.6086, test_loss: 1.3289, test_f1: 0.5473
 epoch: 53, train_loss: 0.5949, test_loss: 1.4027, test_f1: 0.5452
 epoch: 54, train_loss: 0.5886, test_loss: 1.3320, test_f1: 0.5509
 epoch: 55, train_loss: 0.5848, test_loss: 1.3576, test_f1: 0.5492
 epoch: 56, train_loss: 0.5609, test_loss: 1.4953, test_f1: 0.5069
 epoch: 57, train_loss: 0.5766, test_loss: 1.4878, test_f1: 0.5117
 epoch: 58, train_loss: 0.5848, test_loss: 1.4153, test_f1: 0.5432
 epoch: 59, train_loss: 0.5673, test_loss: 1.5157, test_f1: 0.5304
 epoch: 60, train_loss: 0.5661, test_loss: 1.5447, test_f1: 0.5298
 epoch: 61, train_loss: 0.5544, test_loss: 1.5018, test_f1: 0.5170
 epoch: 62, train_loss: 0.5468, test_loss: 1.5116, test_f1: 0.5314
 epoch: 63, train_loss: 0.5423, test_loss: 1.4663, test_f1: 0.5473
 epoch: 64, train_loss: 0.5374, test_loss: 1.6559, test_f1: 0.5098
 epoch: 65, train_loss: 0.5366, test_loss: 1.4624, test_f1: 0.5507
 epoch: 66, train_loss: 0.5392, test_loss: 1.6160, test_f1: 0.5347
 epoch: 67, train_loss: 0.5388, test_loss: 1.4513, test_f1: 0.5294
 epoch: 68, train_loss: 0.5217, test_loss: 1.6584, test_f1: 0.5531
 epoch: 69, train_loss: 0.5275, test_loss: 1.5543, test_f1: 0.5598
 epoch: 70, train_loss: 0.5261, test_loss: 1.5888, test_f1: 0.5314
 epoch: 71, train_loss: 0.5226, test_loss: 1.4834, test_f1: 0.5456
 epoch: 72, train_loss: 0.5099, test_loss: 1.4181, test_f1: 0.5370
 epoch: 73, train_loss: 0.5137, test_loss: 1.6432, test_f1: 0.5507
 epoch: 74, train_loss: 0.5101, test_loss: 1.5360, test_f1: 0.5433
 epoch: 75, train_loss: 0.5116, test_loss: 1.6650, test_f1: 0.5270
 epoch: 76, train_loss: 0.4847, test_loss: 1.4382, test_f1: 0.5476
 epoch: 77, train_loss: 0.4874, test_loss: 1.6108, test_f1: 0.5402
 epoch: 78, train_loss: 0.4942, test_loss: 1.5340, test_f1: 0.5459
 epoch: 79, train_loss: 0.4907, test_loss: 1.6720, test_f1: 0.5282
 epoch: 80, train_loss: 0.4746, test_loss: 1.6829, test_f1: 0.5638
 epoch: 81, train_loss: 0.4765, test_loss: 1.5962, test_f1: 0.5732
 epoch: 82, train_loss: 0.4728, test_loss: 1.5846, test_f1: 0.5537
 epoch: 83, train_loss: 0.4556, test_loss: 1.6068, test_f1: 0.5562
 epoch: 84, train_loss: 0.4580, test_loss: 1.6306, test_f1: 0.5531
 epoch: 85, train_loss: 0.4754, test_loss: 1.6127, test_f1: 0.5799
 epoch: 86, train_loss: 0.4647, test_loss: 1.7123, test_f1: 0.5028
 epoch: 87, train_loss: 0.4499, test_loss: 1.6186, test_f1: 0.5750
 epoch: 88, train_loss: 0.4621, test_loss: 1.7148, test_f1: 0.5588
 epoch: 89, train_loss: 0.4809, test_loss: 1.7514, test_f1: 0.5447
 epoch: 90, train_loss: 0.4497, test_loss: 1.6802, test_f1: 0.5319
 epoch: 91, train_loss: 0.4601, test_loss: 1.6205, test_f1: 0.5528
 epoch: 92, train_loss: 0.4499, test_loss: 1.6979, test_f1: 0.5398
 epoch: 93, train_loss: 0.4440, test_loss: 1.7508, test_f1: 0.5425
 epoch: 94, train_loss: 0.4324, test_loss: 1.8479, test_f1: 0.5254
 epoch: 95, train_loss: 0.4396, test_loss: 1.7979, test_f1: 0.5355
 epoch: 96, train_loss: 0.4270, test_loss: 1.7491, test_f1: 0.5335
 epoch: 97, train_loss: 0.4324, test_loss: 1.6974, test_f1: 0.5656
 epoch: 98, train_loss: 0.4325, test_loss: 1.7896, test_f1: 0.5250
 epoch: 99, train_loss: 0.4248, test_loss: 1.8231, test_f1: 0.5486
##################ITERATION #2 ****************************************
 epoch: 0, train_loss: 1.2835, test_loss: 1.2108, test_f1: 0.3991
 epoch: 1, train_loss: 1.1780, test_loss: 1.0924, test_f1: 0.4425
 epoch: 2, train_loss: 1.1325, test_loss: 1.0565, test_f1: 0.4946
 epoch: 3, train_loss: 1.1008, test_loss: 1.0699, test_f1: 0.4627
 epoch: 4, train_loss: 1.0633, test_loss: 1.0226, test_f1: 0.4688
 epoch: 5, train_loss: 1.0558, test_loss: 1.0045, test_f1: 0.4899
 epoch: 6, train_loss: 1.0267, test_loss: 0.9573, test_f1: 0.5038
 epoch: 7, train_loss: 1.0107, test_loss: 1.0199, test_f1: 0.4929
 epoch: 8, train_loss: 0.9896, test_loss: 0.9961, test_f1: 0.5309
 epoch: 9, train_loss: 0.9623, test_loss: 0.9660, test_f1: 0.5045
 epoch: 10, train_loss: 0.9539, test_loss: 0.9355, test_f1: 0.4964
 epoch: 11, train_loss: 0.9350, test_loss: 1.1173, test_f1: 0.4522
 epoch: 12, train_loss: 0.9316, test_loss: 0.9956, test_f1: 0.4940
 epoch: 13, train_loss: 0.9024, test_loss: 0.9843, test_f1: 0.4939
 epoch: 14, train_loss: 0.9159, test_loss: 0.9372, test_f1: 0.5167
 epoch: 15, train_loss: 0.9060, test_loss: 0.9470, test_f1: 0.5158
 epoch: 16, train_loss: 0.8886, test_loss: 0.9914, test_f1: 0.4705
 epoch: 17, train_loss: 0.8648, test_loss: 0.9724, test_f1: 0.4943
 epoch: 18, train_loss: 0.8673, test_loss: 0.9536, test_f1: 0.5100
 epoch: 19, train_loss: 0.8448, test_loss: 1.0169, test_f1: 0.5037
 epoch: 20, train_loss: 0.8297, test_loss: 1.0223, test_f1: 0.5255
 epoch: 21, train_loss: 0.8507, test_loss: 1.1225, test_f1: 0.5135
 epoch: 22, train_loss: 0.8373, test_loss: 0.9435, test_f1: 0.5150
 epoch: 23, train_loss: 0.8146, test_loss: 0.9737, test_f1: 0.5105
 epoch: 24, train_loss: 0.8114, test_loss: 0.9808, test_f1: 0.5096
 epoch: 25, train_loss: 0.7973, test_loss: 1.0856, test_f1: 0.5235
 epoch: 26, train_loss: 0.8092, test_loss: 1.0628, test_f1: 0.5241
 epoch: 27, train_loss: 0.7854, test_loss: 1.0747, test_f1: 0.4957
 epoch: 28, train_loss: 0.7795, test_loss: 1.1108, test_f1: 0.5090
 epoch: 29, train_loss: 0.7835, test_loss: 1.0733, test_f1: 0.5400
 epoch: 30, train_loss: 0.7612, test_loss: 1.1271, test_f1: 0.5124
 epoch: 31, train_loss: 0.7608, test_loss: 1.0932, test_f1: 0.5216
 epoch: 32, train_loss: 0.7616, test_loss: 1.2985, test_f1: 0.5075
 epoch: 33, train_loss: 0.7459, test_loss: 1.0814, test_f1: 0.5474
 epoch: 34, train_loss: 0.7440, test_loss: 1.1217, test_f1: 0.5465
 epoch: 35, train_loss: 0.7527, test_loss: 1.1543, test_f1: 0.5158
 epoch: 36, train_loss: 0.7422, test_loss: 1.0749, test_f1: 0.5349
 epoch: 37, train_loss: 0.7438, test_loss: 1.0614, test_f1: 0.5223
 epoch: 38, train_loss: 0.7139, test_loss: 1.3822, test_f1: 0.4949
 epoch: 39, train_loss: 0.6983, test_loss: 1.1756, test_f1: 0.5133
 epoch: 40, train_loss: 0.7119, test_loss: 1.2513, test_f1: 0.5070
 epoch: 41, train_loss: 0.7170, test_loss: 1.2284, test_f1: 0.5119
 epoch: 42, train_loss: 0.7044, test_loss: 1.1772, test_f1: 0.5056
 epoch: 43, train_loss: 0.6998, test_loss: 1.2767, test_f1: 0.5279
 epoch: 44, train_loss: 0.6963, test_loss: 1.1788, test_f1: 0.5223
 epoch: 45, train_loss: 0.6783, test_loss: 1.3624, test_f1: 0.5046
 epoch: 46, train_loss: 0.6862, test_loss: 1.2893, test_f1: 0.5345
 epoch: 47, train_loss: 0.6736, test_loss: 1.2427, test_f1: 0.5340
 epoch: 48, train_loss: 0.6771, test_loss: 1.2276, test_f1: 0.5348
 epoch: 49, train_loss: 0.6508, test_loss: 1.3650, test_f1: 0.5072
 epoch: 50, train_loss: 0.6605, test_loss: 1.2875, test_f1: 0.5030
 epoch: 51, train_loss: 0.6245, test_loss: 1.3341, test_f1: 0.5083
 epoch: 52, train_loss: 0.6184, test_loss: 1.3466, test_f1: 0.5116
 epoch: 53, train_loss: 0.6138, test_loss: 1.3375, test_f1: 0.5214
 epoch: 54, train_loss: 0.5928, test_loss: 1.3126, test_f1: 0.5253
 epoch: 55, train_loss: 0.5935, test_loss: 1.3097, test_f1: 0.5220
 epoch: 56, train_loss: 0.6024, test_loss: 1.3435, test_f1: 0.5216
 epoch: 57, train_loss: 0.5818, test_loss: 1.4640, test_f1: 0.5196
 epoch: 58, train_loss: 0.5772, test_loss: 1.3712, test_f1: 0.5233
 epoch: 59, train_loss: 0.5828, test_loss: 1.3300, test_f1: 0.5214
 epoch: 60, train_loss: 0.5557, test_loss: 1.3341, test_f1: 0.5421
 epoch: 61, train_loss: 0.5677, test_loss: 1.3334, test_f1: 0.5242
 epoch: 62, train_loss: 0.5506, test_loss: 1.3876, test_f1: 0.5352
 epoch: 63, train_loss: 0.5540, test_loss: 1.4202, test_f1: 0.5290
 epoch: 64, train_loss: 0.5473, test_loss: 1.3371, test_f1: 0.5333
 epoch: 65, train_loss: 0.5646, test_loss: 1.3824, test_f1: 0.5440
 epoch: 66, train_loss: 0.5385, test_loss: 1.3584, test_f1: 0.5410
 epoch: 67, train_loss: 0.5464, test_loss: 1.4377, test_f1: 0.5490
 epoch: 68, train_loss: 0.5405, test_loss: 1.5378, test_f1: 0.5129
 epoch: 69, train_loss: 0.5589, test_loss: 1.4496, test_f1: 0.5238
 epoch: 70, train_loss: 0.5351, test_loss: 1.3754, test_f1: 0.5478
 epoch: 71, train_loss: 0.5164, test_loss: 1.4279, test_f1: 0.5247
 epoch: 72, train_loss: 0.5167, test_loss: 1.4658, test_f1: 0.5293
 epoch: 73, train_loss: 0.5140, test_loss: 1.5529, test_f1: 0.5369
 epoch: 74, train_loss: 0.5143, test_loss: 1.5668, test_f1: 0.5428
 epoch: 75, train_loss: 0.5322, test_loss: 1.4388, test_f1: 0.5478
 epoch: 76, train_loss: 0.5199, test_loss: 1.5856, test_f1: 0.5433
 epoch: 77, train_loss: 0.5082, test_loss: 1.4682, test_f1: 0.5445
 epoch: 78, train_loss: 0.5064, test_loss: 1.4402, test_f1: 0.5634
 epoch: 79, train_loss: 0.5092, test_loss: 1.5537, test_f1: 0.5188
 epoch: 80, train_loss: 0.5199, test_loss: 1.6138, test_f1: 0.5450
 epoch: 81, train_loss: 0.5107, test_loss: 1.5405, test_f1: 0.5543
 epoch: 82, train_loss: 0.5142, test_loss: 1.5510, test_f1: 0.5472
 epoch: 83, train_loss: 0.4829, test_loss: 1.5855, test_f1: 0.5149
 epoch: 84, train_loss: 0.4943, test_loss: 1.6673, test_f1: 0.5100
 epoch: 85, train_loss: 0.4818, test_loss: 1.5920, test_f1: 0.5399
 epoch: 86, train_loss: 0.4712, test_loss: 1.5331, test_f1: 0.5270
 epoch: 87, train_loss: 0.4912, test_loss: 1.7109, test_f1: 0.5289
 epoch: 88, train_loss: 0.4711, test_loss: 1.5108, test_f1: 0.5257
 epoch: 89, train_loss: 0.4623, test_loss: 1.5387, test_f1: 0.5360
 epoch: 90, train_loss: 0.4845, test_loss: 1.5471, test_f1: 0.5330
 epoch: 91, train_loss: 0.4879, test_loss: 1.5100, test_f1: 0.5510
 epoch: 92, train_loss: 0.4782, test_loss: 1.5720, test_f1: 0.5384
 epoch: 93, train_loss: 0.4527, test_loss: 1.5584, test_f1: 0.5601
 epoch: 94, train_loss: 0.4650, test_loss: 1.6116, test_f1: 0.5415
 epoch: 95, train_loss: 0.4665, test_loss: 1.4923, test_f1: 0.5434
 epoch: 96, train_loss: 0.4562, test_loss: 1.5903, test_f1: 0.5474
 epoch: 97, train_loss: 0.4717, test_loss: 1.6394, test_f1: 0.5572
 epoch: 98, train_loss: 0.4494, test_loss: 1.5795, test_f1: 0.5477
 epoch: 99, train_loss: 0.4469, test_loss: 1.5494, test_f1: 0.5854
##################ITERATION #3 ****************************************
 epoch: 0, train_loss: 1.2759, test_loss: 1.1646, test_f1: 0.3801
 epoch: 1, train_loss: 1.1671, test_loss: 1.0927, test_f1: 0.4275
 epoch: 2, train_loss: 1.1259, test_loss: 1.0646, test_f1: 0.4475
 epoch: 3, train_loss: 1.0947, test_loss: 1.0430, test_f1: 0.4798
 epoch: 4, train_loss: 1.0674, test_loss: 1.0415, test_f1: 0.4156
 epoch: 5, train_loss: 1.0326, test_loss: 0.9993, test_f1: 0.4609
 epoch: 6, train_loss: 1.0065, test_loss: 0.9863, test_f1: 0.5156
 epoch: 7, train_loss: 0.9923, test_loss: 0.9679, test_f1: 0.4770
 epoch: 8, train_loss: 0.9798, test_loss: 0.9635, test_f1: 0.5003
 epoch: 9, train_loss: 0.9586, test_loss: 1.0076, test_f1: 0.4668
 epoch: 10, train_loss: 0.9341, test_loss: 0.9323, test_f1: 0.4612
 epoch: 11, train_loss: 0.9387, test_loss: 0.9574, test_f1: 0.5142
 epoch: 12, train_loss: 0.9076, test_loss: 1.0091, test_f1: 0.4876
 epoch: 13, train_loss: 0.9059, test_loss: 0.9746, test_f1: 0.5307
 epoch: 14, train_loss: 0.8906, test_loss: 1.0086, test_f1: 0.5040
 epoch: 15, train_loss: 0.8848, test_loss: 0.9933, test_f1: 0.4896
 epoch: 16, train_loss: 0.8666, test_loss: 0.9532, test_f1: 0.5079
 epoch: 17, train_loss: 0.8652, test_loss: 0.9387, test_f1: 0.4879
 epoch: 18, train_loss: 0.8595, test_loss: 1.0005, test_f1: 0.4805
 epoch: 19, train_loss: 0.8421, test_loss: 1.0194, test_f1: 0.5002
 epoch: 20, train_loss: 0.8213, test_loss: 1.0531, test_f1: 0.5082
 epoch: 21, train_loss: 0.8142, test_loss: 1.0014, test_f1: 0.5313
 epoch: 22, train_loss: 0.8225, test_loss: 1.1620, test_f1: 0.5063
 epoch: 23, train_loss: 0.8137, test_loss: 1.0156, test_f1: 0.5300
 epoch: 24, train_loss: 0.8272, test_loss: 1.0201, test_f1: 0.5144
 epoch: 25, train_loss: 0.8099, test_loss: 1.1351, test_f1: 0.5282
 epoch: 26, train_loss: 0.7891, test_loss: 1.1655, test_f1: 0.4938
 epoch: 27, train_loss: 0.7834, test_loss: 1.0838, test_f1: 0.5465
 epoch: 28, train_loss: 0.7799, test_loss: 1.2143, test_f1: 0.5064
 epoch: 29, train_loss: 0.7660, test_loss: 1.2248, test_f1: 0.5179
 epoch: 30, train_loss: 0.7740, test_loss: 1.1140, test_f1: 0.5132
 epoch: 31, train_loss: 0.7552, test_loss: 1.3979, test_f1: 0.5388
 epoch: 32, train_loss: 0.7427, test_loss: 1.1686, test_f1: 0.5506
 epoch: 33, train_loss: 0.7403, test_loss: 1.1806, test_f1: 0.5293
 epoch: 34, train_loss: 0.7388, test_loss: 1.1498, test_f1: 0.5319
 epoch: 35, train_loss: 0.7368, test_loss: 1.1332, test_f1: 0.5660
 epoch: 36, train_loss: 0.7299, test_loss: 1.1602, test_f1: 0.5205
 epoch: 37, train_loss: 0.7342, test_loss: 1.0242, test_f1: 0.5590
 epoch: 38, train_loss: 0.7152, test_loss: 1.2892, test_f1: 0.5213
 epoch: 39, train_loss: 0.7028, test_loss: 1.1574, test_f1: 0.5488
 epoch: 40, train_loss: 0.7079, test_loss: 1.3596, test_f1: 0.5181
 epoch: 41, train_loss: 0.6983, test_loss: 1.1329, test_f1: 0.5551
 epoch: 42, train_loss: 0.6968, test_loss: 1.1740, test_f1: 0.5190
 epoch: 43, train_loss: 0.6735, test_loss: 1.5423, test_f1: 0.5177
 epoch: 44, train_loss: 0.7155, test_loss: 1.1708, test_f1: 0.5441
 epoch: 45, train_loss: 0.7134, test_loss: 1.1490, test_f1: 0.5412
 epoch: 46, train_loss: 0.6775, test_loss: 1.1680, test_f1: 0.5480
 epoch: 47, train_loss: 0.6815, test_loss: 1.3025, test_f1: 0.5428
 epoch: 48, train_loss: 0.6663, test_loss: 1.1996, test_f1: 0.5368
 epoch: 49, train_loss: 0.6663, test_loss: 1.2797, test_f1: 0.5472
 epoch: 50, train_loss: 0.6668, test_loss: 1.2942, test_f1: 0.5407
 epoch: 51, train_loss: 0.6237, test_loss: 1.3008, test_f1: 0.5446
 epoch: 52, train_loss: 0.5966, test_loss: 1.3894, test_f1: 0.5452
 epoch: 53, train_loss: 0.5878, test_loss: 1.4453, test_f1: 0.5465
 epoch: 54, train_loss: 0.5848, test_loss: 1.2702, test_f1: 0.5654
 epoch: 55, train_loss: 0.5724, test_loss: 1.3491, test_f1: 0.5530
 epoch: 56, train_loss: 0.5751, test_loss: 1.2913, test_f1: 0.5521
 epoch: 57, train_loss: 0.5603, test_loss: 1.4197, test_f1: 0.5403
 epoch: 58, train_loss: 0.5575, test_loss: 1.3544, test_f1: 0.5406
 epoch: 59, train_loss: 0.5568, test_loss: 1.3443, test_f1: 0.5519
 epoch: 60, train_loss: 0.5664, test_loss: 1.3660, test_f1: 0.5496
 epoch: 61, train_loss: 0.5585, test_loss: 1.3543, test_f1: 0.5531
 epoch: 62, train_loss: 0.5407, test_loss: 1.3718, test_f1: 0.5565
 epoch: 63, train_loss: 0.5400, test_loss: 1.3642, test_f1: 0.5553
 epoch: 64, train_loss: 0.5405, test_loss: 1.3664, test_f1: 0.5508
 epoch: 65, train_loss: 0.5462, test_loss: 1.3805, test_f1: 0.5469
 epoch: 66, train_loss: 0.5212, test_loss: 1.5525, test_f1: 0.5504
 epoch: 67, train_loss: 0.5216, test_loss: 1.4700, test_f1: 0.5228
 epoch: 68, train_loss: 0.5125, test_loss: 1.6667, test_f1: 0.5417
 epoch: 69, train_loss: 0.5210, test_loss: 1.4375, test_f1: 0.5532
 epoch: 70, train_loss: 0.4986, test_loss: 1.4187, test_f1: 0.5479
 epoch: 71, train_loss: 0.5264, test_loss: 1.6490, test_f1: 0.5678
 epoch: 72, train_loss: 0.5104, test_loss: 1.4597, test_f1: 0.5508
 epoch: 73, train_loss: 0.5091, test_loss: 1.4660, test_f1: 0.5514
 epoch: 74, train_loss: 0.4945, test_loss: 1.5146, test_f1: 0.5592
 epoch: 75, train_loss: 0.5186, test_loss: 1.4808, test_f1: 0.5405
 epoch: 76, train_loss: 0.4942, test_loss: 1.5365, test_f1: 0.5542
 epoch: 77, train_loss: 0.4981, test_loss: 1.5175, test_f1: 0.5511
 epoch: 78, train_loss: 0.4898, test_loss: 1.4863, test_f1: 0.5594
 epoch: 79, train_loss: 0.4935, test_loss: 1.5348, test_f1: 0.5580
 epoch: 80, train_loss: 0.4716, test_loss: 1.6201, test_f1: 0.5280
 epoch: 81, train_loss: 0.4881, test_loss: 1.4575, test_f1: 0.5593
 epoch: 82, train_loss: 0.4772, test_loss: 1.4822, test_f1: 0.5673
 epoch: 83, train_loss: 0.4696, test_loss: 1.5376, test_f1: 0.5537
 epoch: 84, train_loss: 0.4628, test_loss: 1.6130, test_f1: 0.5613
 epoch: 85, train_loss: 0.4635, test_loss: 1.5212, test_f1: 0.5640
 epoch: 86, train_loss: 0.4485, test_loss: 1.5581, test_f1: 0.5507
 epoch: 87, train_loss: 0.4473, test_loss: 1.6406, test_f1: 0.5573
 epoch: 88, train_loss: 0.4717, test_loss: 1.5367, test_f1: 0.5477
 epoch: 89, train_loss: 0.4594, test_loss: 1.5521, test_f1: 0.5358
 epoch: 90, train_loss: 0.4540, test_loss: 1.6805, test_f1: 0.5356
 epoch: 91, train_loss: 0.4569, test_loss: 1.7512, test_f1: 0.5436
 epoch: 92, train_loss: 0.4228, test_loss: 1.7025, test_f1: 0.5718
 epoch: 93, train_loss: 0.4327, test_loss: 1.7479, test_f1: 0.5539
 epoch: 94, train_loss: 0.4459, test_loss: 1.7164, test_f1: 0.5440
 epoch: 95, train_loss: 0.4488, test_loss: 1.5818, test_f1: 0.5668
 epoch: 96, train_loss: 0.4318, test_loss: 1.7317, test_f1: 0.5544
 epoch: 97, train_loss: 0.4320, test_loss: 1.6669, test_f1: 0.5546
 epoch: 98, train_loss: 0.4156, test_loss: 1.6734, test_f1: 0.5637
 epoch: 99, train_loss: 0.4164, test_loss: 1.7569, test_f1: 0.5658
##################ITERATION #4 ****************************************
 epoch: 0, train_loss: 1.3314, test_loss: 1.1859, test_f1: 0.3720
 epoch: 1, train_loss: 1.2155, test_loss: 1.1407, test_f1: 0.4287
 epoch: 2, train_loss: 1.1663, test_loss: 1.1161, test_f1: 0.4022
 epoch: 3, train_loss: 1.1315, test_loss: 1.0757, test_f1: 0.4659
 epoch: 4, train_loss: 1.0946, test_loss: 1.0348, test_f1: 0.4713
 epoch: 5, train_loss: 1.0668, test_loss: 0.9998, test_f1: 0.4861
 epoch: 6, train_loss: 1.0665, test_loss: 1.0134, test_f1: 0.4778
 epoch: 7, train_loss: 1.0318, test_loss: 0.9993, test_f1: 0.4539
 epoch: 8, train_loss: 1.0292, test_loss: 0.9828, test_f1: 0.4662
 epoch: 9, train_loss: 1.0012, test_loss: 0.9446, test_f1: 0.4816
 epoch: 10, train_loss: 0.9832, test_loss: 0.9482, test_f1: 0.5078
 epoch: 11, train_loss: 0.9599, test_loss: 0.9712, test_f1: 0.4588
 epoch: 12, train_loss: 0.9658, test_loss: 0.9878, test_f1: 0.5281
 epoch: 13, train_loss: 0.9517, test_loss: 0.9952, test_f1: 0.4562
 epoch: 14, train_loss: 0.9333, test_loss: 0.9434, test_f1: 0.5036
 epoch: 15, train_loss: 0.9206, test_loss: 0.9692, test_f1: 0.4906
 epoch: 16, train_loss: 0.9261, test_loss: 0.9394, test_f1: 0.4928
 epoch: 17, train_loss: 0.8982, test_loss: 1.0796, test_f1: 0.4626
 epoch: 18, train_loss: 0.8903, test_loss: 1.0111, test_f1: 0.4852
 epoch: 19, train_loss: 0.8849, test_loss: 0.9583, test_f1: 0.5273
 epoch: 20, train_loss: 0.8682, test_loss: 1.0426, test_f1: 0.5215
 epoch: 21, train_loss: 0.8620, test_loss: 1.0025, test_f1: 0.5205
 epoch: 22, train_loss: 0.8646, test_loss: 0.9866, test_f1: 0.5523
 epoch: 23, train_loss: 0.8569, test_loss: 1.0677, test_f1: 0.5070
 epoch: 24, train_loss: 0.8479, test_loss: 1.0127, test_f1: 0.5052
 epoch: 25, train_loss: 0.8315, test_loss: 0.9888, test_f1: 0.5334
 epoch: 26, train_loss: 0.8298, test_loss: 0.9945, test_f1: 0.5239
 epoch: 27, train_loss: 0.8293, test_loss: 1.0126, test_f1: 0.5333
 epoch: 28, train_loss: 0.8143, test_loss: 0.9863, test_f1: 0.5263
 epoch: 29, train_loss: 0.7881, test_loss: 1.0426, test_f1: 0.5303
 epoch: 30, train_loss: 0.8050, test_loss: 1.0676, test_f1: 0.5033
 epoch: 31, train_loss: 0.7879, test_loss: 1.0474, test_f1: 0.5484
 epoch: 32, train_loss: 0.8032, test_loss: 1.0520, test_f1: 0.5181
 epoch: 33, train_loss: 0.7853, test_loss: 1.0389, test_f1: 0.5214
 epoch: 34, train_loss: 0.7672, test_loss: 1.0569, test_f1: 0.5284
 epoch: 35, train_loss: 0.7834, test_loss: 0.9708, test_f1: 0.5245
 epoch: 36, train_loss: 0.7662, test_loss: 1.1714, test_f1: 0.5380
 epoch: 37, train_loss: 0.7602, test_loss: 1.1154, test_f1: 0.5285
 epoch: 38, train_loss: 0.7429, test_loss: 1.1533, test_f1: 0.5459
 epoch: 39, train_loss: 0.7565, test_loss: 1.1633, test_f1: 0.5541
 epoch: 40, train_loss: 0.7343, test_loss: 1.1169, test_f1: 0.5225
 epoch: 41, train_loss: 0.7427, test_loss: 1.1477, test_f1: 0.5426
 epoch: 42, train_loss: 0.7391, test_loss: 1.0931, test_f1: 0.5348
 epoch: 43, train_loss: 0.7218, test_loss: 1.3029, test_f1: 0.5021
 epoch: 44, train_loss: 0.7132, test_loss: 1.1446, test_f1: 0.5256
 epoch: 45, train_loss: 0.7098, test_loss: 1.1496, test_f1: 0.5641
 epoch: 46, train_loss: 0.7033, test_loss: 1.1859, test_f1: 0.5056
 epoch: 47, train_loss: 0.7043, test_loss: 1.1336, test_f1: 0.5620
 epoch: 48, train_loss: 0.6868, test_loss: 1.1729, test_f1: 0.5540
 epoch: 49, train_loss: 0.6819, test_loss: 1.2238, test_f1: 0.5251
 epoch: 50, train_loss: 0.6818, test_loss: 1.1247, test_f1: 0.5698
 epoch: 51, train_loss: 0.6458, test_loss: 1.2250, test_f1: 0.5400
 epoch: 52, train_loss: 0.6315, test_loss: 1.2383, test_f1: 0.5592
 epoch: 53, train_loss: 0.6095, test_loss: 1.2304, test_f1: 0.5732
 epoch: 54, train_loss: 0.6205, test_loss: 1.2330, test_f1: 0.5555
 epoch: 55, train_loss: 0.6176, test_loss: 1.2973, test_f1: 0.5290
 epoch: 56, train_loss: 0.6146, test_loss: 1.2969, test_f1: 0.5519
 epoch: 57, train_loss: 0.5938, test_loss: 1.2957, test_f1: 0.5278
 epoch: 58, train_loss: 0.5949, test_loss: 1.4125, test_f1: 0.5420
 epoch: 59, train_loss: 0.5998, test_loss: 1.3381, test_f1: 0.5361
 epoch: 60, train_loss: 0.6070, test_loss: 1.3150, test_f1: 0.5456
 epoch: 61, train_loss: 0.6025, test_loss: 1.2922, test_f1: 0.5545
 epoch: 62, train_loss: 0.5764, test_loss: 1.3815, test_f1: 0.5380
 epoch: 63, train_loss: 0.5913, test_loss: 1.3623, test_f1: 0.5496
 epoch: 64, train_loss: 0.5821, test_loss: 1.3958, test_f1: 0.5248
 epoch: 65, train_loss: 0.5710, test_loss: 1.3761, test_f1: 0.5319
 epoch: 66, train_loss: 0.5670, test_loss: 1.3804, test_f1: 0.5434
 epoch: 67, train_loss: 0.5790, test_loss: 1.3079, test_f1: 0.5542
 epoch: 68, train_loss: 0.5651, test_loss: 1.3708, test_f1: 0.5241
 epoch: 69, train_loss: 0.5500, test_loss: 1.3095, test_f1: 0.5502
 epoch: 70, train_loss: 0.5491, test_loss: 1.3317, test_f1: 0.5686
 epoch: 71, train_loss: 0.5468, test_loss: 1.3609, test_f1: 0.5582
 epoch: 72, train_loss: 0.5395, test_loss: 1.4327, test_f1: 0.5323
 epoch: 73, train_loss: 0.5465, test_loss: 1.4923, test_f1: 0.5448
 epoch: 74, train_loss: 0.5548, test_loss: 1.5507, test_f1: 0.5429
 epoch: 75, train_loss: 0.5605, test_loss: 1.4085, test_f1: 0.5476
 epoch: 76, train_loss: 0.5557, test_loss: 1.3732, test_f1: 0.5713
 epoch: 77, train_loss: 0.5476, test_loss: 1.4764, test_f1: 0.5613
 epoch: 78, train_loss: 0.5235, test_loss: 1.4179, test_f1: 0.5595
 epoch: 79, train_loss: 0.5387, test_loss: 1.4417, test_f1: 0.5534
 epoch: 80, train_loss: 0.5256, test_loss: 1.3983, test_f1: 0.5460
 epoch: 81, train_loss: 0.5253, test_loss: 1.4589, test_f1: 0.5626
 epoch: 82, train_loss: 0.5162, test_loss: 1.4974, test_f1: 0.5563
 epoch: 83, train_loss: 0.5119, test_loss: 1.4528, test_f1: 0.5633
 epoch: 84, train_loss: 0.5151, test_loss: 1.5207, test_f1: 0.5574
 epoch: 85, train_loss: 0.5243, test_loss: 1.5325, test_f1: 0.5601
 epoch: 86, train_loss: 0.5109, test_loss: 1.4225, test_f1: 0.5519
 epoch: 87, train_loss: 0.5097, test_loss: 1.5820, test_f1: 0.5494
 epoch: 88, train_loss: 0.5148, test_loss: 1.5722, test_f1: 0.5487
 epoch: 89, train_loss: 0.4852, test_loss: 1.5301, test_f1: 0.5342
 epoch: 90, train_loss: 0.4781, test_loss: 1.5728, test_f1: 0.5316
 epoch: 91, train_loss: 0.5070, test_loss: 1.4217, test_f1: 0.5605
 epoch: 92, train_loss: 0.4860, test_loss: 1.4754, test_f1: 0.5581
 epoch: 93, train_loss: 0.4691, test_loss: 1.5461, test_f1: 0.5405
 epoch: 94, train_loss: 0.4882, test_loss: 1.5375, test_f1: 0.5688
 epoch: 95, train_loss: 0.4791, test_loss: 1.4820, test_f1: 0.5757
 epoch: 96, train_loss: 0.4772, test_loss: 1.4347, test_f1: 0.5848
 epoch: 97, train_loss: 0.4710, test_loss: 1.5324, test_f1: 0.5602
 epoch: 98, train_loss: 0.4761, test_loss: 1.5350, test_f1: 0.5376
 epoch: 99, train_loss: 0.4707, test_loss: 1.4984, test_f1: 0.5553
##################ITERATION #5 ****************************************
 epoch: 0, train_loss: 1.3145, test_loss: 1.1780, test_f1: 0.3841
 epoch: 1, train_loss: 1.1681, test_loss: 1.1090, test_f1: 0.4124
 epoch: 2, train_loss: 1.1351, test_loss: 1.0846, test_f1: 0.4201
 epoch: 3, train_loss: 1.1175, test_loss: 1.0515, test_f1: 0.4338
 epoch: 4, train_loss: 1.0889, test_loss: 1.0631, test_f1: 0.4439
 epoch: 5, train_loss: 1.0700, test_loss: 1.0416, test_f1: 0.4386
 epoch: 6, train_loss: 1.0507, test_loss: 1.0681, test_f1: 0.3985
 epoch: 7, train_loss: 1.0367, test_loss: 1.0081, test_f1: 0.4416
 epoch: 8, train_loss: 1.0146, test_loss: 1.0029, test_f1: 0.4393
 epoch: 9, train_loss: 1.0120, test_loss: 1.0168, test_f1: 0.4553
 epoch: 10, train_loss: 0.9909, test_loss: 1.0166, test_f1: 0.4438
 epoch: 11, train_loss: 0.9742, test_loss: 0.9920, test_f1: 0.4791
 epoch: 12, train_loss: 0.9708, test_loss: 0.9833, test_f1: 0.4658
 epoch: 13, train_loss: 0.9570, test_loss: 0.9854, test_f1: 0.4695
 epoch: 14, train_loss: 0.9425, test_loss: 0.9911, test_f1: 0.4702
 epoch: 15, train_loss: 0.9305, test_loss: 0.9606, test_f1: 0.4993
 epoch: 16, train_loss: 0.9360, test_loss: 0.9413, test_f1: 0.5101
 epoch: 17, train_loss: 0.9101, test_loss: 1.1380, test_f1: 0.4700
 epoch: 18, train_loss: 0.9146, test_loss: 0.9920, test_f1: 0.4878
 epoch: 19, train_loss: 0.9035, test_loss: 1.0278, test_f1: 0.4549
 epoch: 20, train_loss: 0.8924, test_loss: 0.9779, test_f1: 0.4956
 epoch: 21, train_loss: 0.8797, test_loss: 0.9810, test_f1: 0.4918
 epoch: 22, train_loss: 0.8783, test_loss: 1.0341, test_f1: 0.4958
 epoch: 23, train_loss: 0.8672, test_loss: 0.9567, test_f1: 0.5092
 epoch: 24, train_loss: 0.8436, test_loss: 1.0510, test_f1: 0.4908
 epoch: 25, train_loss: 0.8408, test_loss: 1.0892, test_f1: 0.5146
 epoch: 26, train_loss: 0.8403, test_loss: 1.2071, test_f1: 0.4345
 epoch: 27, train_loss: 0.8425, test_loss: 1.0230, test_f1: 0.4834
 epoch: 28, train_loss: 0.8364, test_loss: 0.9963, test_f1: 0.5128
 epoch: 29, train_loss: 0.8198, test_loss: 1.0333, test_f1: 0.5170
 epoch: 30, train_loss: 0.8218, test_loss: 1.0277, test_f1: 0.4739
 epoch: 31, train_loss: 0.7960, test_loss: 1.0576, test_f1: 0.5196
 epoch: 32, train_loss: 0.8047, test_loss: 0.9757, test_f1: 0.5422
 epoch: 33, train_loss: 0.7921, test_loss: 1.0418, test_f1: 0.5527
 epoch: 34, train_loss: 0.7896, test_loss: 1.0243, test_f1: 0.5263
 epoch: 35, train_loss: 0.7755, test_loss: 1.1428, test_f1: 0.5059
 epoch: 36, train_loss: 0.7525, test_loss: 1.1376, test_f1: 0.5176
 epoch: 37, train_loss: 0.7573, test_loss: 1.0781, test_f1: 0.5317
 epoch: 38, train_loss: 0.7543, test_loss: 0.9893, test_f1: 0.5457
 epoch: 39, train_loss: 0.7719, test_loss: 1.0590, test_f1: 0.5461
 epoch: 40, train_loss: 0.7425, test_loss: 1.2411, test_f1: 0.5105
 epoch: 41, train_loss: 0.7462, test_loss: 1.1217, test_f1: 0.5770
 epoch: 42, train_loss: 0.7249, test_loss: 1.1424, test_f1: 0.5524
 epoch: 43, train_loss: 0.7361, test_loss: 1.1193, test_f1: 0.4963
 epoch: 44, train_loss: 0.7134, test_loss: 1.1519, test_f1: 0.5096
 epoch: 45, train_loss: 0.7132, test_loss: 1.1239, test_f1: 0.5268
 epoch: 46, train_loss: 0.7298, test_loss: 1.0341, test_f1: 0.5730
 epoch: 47, train_loss: 0.7007, test_loss: 1.1264, test_f1: 0.5243
 epoch: 48, train_loss: 0.7086, test_loss: 1.1527, test_f1: 0.5437
 epoch: 49, train_loss: 0.7099, test_loss: 1.0419, test_f1: 0.5634
 epoch: 50, train_loss: 0.6821, test_loss: 1.1650, test_f1: 0.5396
 epoch: 51, train_loss: 0.6556, test_loss: 1.1490, test_f1: 0.5330
 epoch: 52, train_loss: 0.6369, test_loss: 1.1762, test_f1: 0.5426
 epoch: 53, train_loss: 0.6252, test_loss: 1.1972, test_f1: 0.5458
 epoch: 54, train_loss: 0.6051, test_loss: 1.2825, test_f1: 0.5328
 epoch: 55, train_loss: 0.6220, test_loss: 1.2106, test_f1: 0.5486
 epoch: 56, train_loss: 0.6136, test_loss: 1.3467, test_f1: 0.5255
 epoch: 57, train_loss: 0.6095, test_loss: 1.3099, test_f1: 0.5189
 epoch: 58, train_loss: 0.5901, test_loss: 1.2538, test_f1: 0.5504
 epoch: 59, train_loss: 0.6047, test_loss: 1.2543, test_f1: 0.5401
 epoch: 60, train_loss: 0.5987, test_loss: 1.3299, test_f1: 0.5286
 epoch: 61, train_loss: 0.5800, test_loss: 1.2780, test_f1: 0.5357
 epoch: 62, train_loss: 0.5817, test_loss: 1.4109, test_f1: 0.5256
 epoch: 63, train_loss: 0.5823, test_loss: 1.3480, test_f1: 0.5554
 epoch: 64, train_loss: 0.5894, test_loss: 1.3883, test_f1: 0.5274
 epoch: 65, train_loss: 0.5685, test_loss: 1.2534, test_f1: 0.5603
 epoch: 66, train_loss: 0.5910, test_loss: 1.3477, test_f1: 0.5377
 epoch: 67, train_loss: 0.5633, test_loss: 1.4208, test_f1: 0.5416
 epoch: 68, train_loss: 0.5862, test_loss: 1.3067, test_f1: 0.5327
 epoch: 69, train_loss: 0.5605, test_loss: 1.3199, test_f1: 0.5359
 epoch: 70, train_loss: 0.5683, test_loss: 1.4611, test_f1: 0.5125
 epoch: 71, train_loss: 0.5495, test_loss: 1.4805, test_f1: 0.5285
 epoch: 72, train_loss: 0.5480, test_loss: 1.3462, test_f1: 0.5568
 epoch: 73, train_loss: 0.5570, test_loss: 1.3751, test_f1: 0.5416
 epoch: 74, train_loss: 0.5552, test_loss: 1.3293, test_f1: 0.5478
 epoch: 75, train_loss: 0.5556, test_loss: 1.3351, test_f1: 0.5298
 epoch: 76, train_loss: 0.5446, test_loss: 1.3572, test_f1: 0.5382
 epoch: 77, train_loss: 0.5319, test_loss: 1.4517, test_f1: 0.5514
 epoch: 78, train_loss: 0.5298, test_loss: 1.4340, test_f1: 0.5220
 epoch: 79, train_loss: 0.5303, test_loss: 1.4418, test_f1: 0.5326
 epoch: 80, train_loss: 0.5271, test_loss: 1.5094, test_f1: 0.5248
 epoch: 81, train_loss: 0.5184, test_loss: 1.4700, test_f1: 0.5356
 epoch: 82, train_loss: 0.5252, test_loss: 1.4341, test_f1: 0.5139
 epoch: 83, train_loss: 0.5410, test_loss: 1.4494, test_f1: 0.5565
 epoch: 84, train_loss: 0.5325, test_loss: 1.4219, test_f1: 0.5436
 epoch: 85, train_loss: 0.5186, test_loss: 1.4288, test_f1: 0.5209
 epoch: 86, train_loss: 0.5091, test_loss: 1.5569, test_f1: 0.5106
 epoch: 87, train_loss: 0.5054, test_loss: 1.4103, test_f1: 0.5475
 epoch: 88, train_loss: 0.4884, test_loss: 1.4101, test_f1: 0.5611
 epoch: 89, train_loss: 0.4886, test_loss: 1.5123, test_f1: 0.5285
 epoch: 90, train_loss: 0.5047, test_loss: 1.4412, test_f1: 0.5170
 epoch: 91, train_loss: 0.4873, test_loss: 1.4319, test_f1: 0.5473
 epoch: 92, train_loss: 0.4905, test_loss: 1.6281, test_f1: 0.5223
 epoch: 93, train_loss: 0.4972, test_loss: 1.4743, test_f1: 0.5422
 epoch: 94, train_loss: 0.4856, test_loss: 1.5328, test_f1: 0.5415
 epoch: 95, train_loss: 0.4611, test_loss: 1.6525, test_f1: 0.5402
 epoch: 96, train_loss: 0.4926, test_loss: 1.5433, test_f1: 0.5404
 epoch: 97, train_loss: 0.4772, test_loss: 1.5586, test_f1: 0.5175
 epoch: 98, train_loss: 0.4933, test_loss: 1.5078, test_f1: 0.5322
 epoch: 99, train_loss: 0.4959, test_loss: 1.4983, test_f1: 0.5592
##################ITERATION #6 ****************************************
 epoch: 0, train_loss: 1.3397, test_loss: 1.1545, test_f1: 0.3732
 epoch: 1, train_loss: 1.1928, test_loss: 1.0802, test_f1: 0.4247
 epoch: 2, train_loss: 1.1310, test_loss: 1.0421, test_f1: 0.4477
 epoch: 3, train_loss: 1.1010, test_loss: 1.0080, test_f1: 0.4777
 epoch: 4, train_loss: 1.0689, test_loss: 1.0042, test_f1: 0.4714
 epoch: 5, train_loss: 1.0345, test_loss: 0.9684, test_f1: 0.5032
 epoch: 6, train_loss: 1.0127, test_loss: 1.0511, test_f1: 0.4678
 epoch: 7, train_loss: 1.0069, test_loss: 1.0292, test_f1: 0.4687
 epoch: 8, train_loss: 0.9911, test_loss: 0.9842, test_f1: 0.4640
 epoch: 9, train_loss: 0.9927, test_loss: 1.0193, test_f1: 0.4526
 epoch: 10, train_loss: 0.9498, test_loss: 0.9921, test_f1: 0.5130
 epoch: 11, train_loss: 0.9588, test_loss: 0.9813, test_f1: 0.4726
 epoch: 12, train_loss: 0.9394, test_loss: 0.9894, test_f1: 0.5071
 epoch: 13, train_loss: 0.9155, test_loss: 1.1757, test_f1: 0.4811
 epoch: 14, train_loss: 0.9040, test_loss: 0.9648, test_f1: 0.5489
 epoch: 15, train_loss: 0.9026, test_loss: 1.0109, test_f1: 0.5177
 epoch: 16, train_loss: 0.8992, test_loss: 1.0890, test_f1: 0.5143
 epoch: 17, train_loss: 0.8831, test_loss: 0.9714, test_f1: 0.5436
 epoch: 18, train_loss: 0.8763, test_loss: 1.0725, test_f1: 0.5055
 epoch: 19, train_loss: 0.8646, test_loss: 1.0272, test_f1: 0.5249
 epoch: 20, train_loss: 0.8596, test_loss: 1.0554, test_f1: 0.5400
 epoch: 21, train_loss: 0.8330, test_loss: 1.0699, test_f1: 0.5466
 epoch: 22, train_loss: 0.8271, test_loss: 1.0901, test_f1: 0.5128
 epoch: 23, train_loss: 0.8391, test_loss: 1.1128, test_f1: 0.5256
 epoch: 24, train_loss: 0.8283, test_loss: 1.0862, test_f1: 0.5095
 epoch: 25, train_loss: 0.8335, test_loss: 1.0723, test_f1: 0.5331
 epoch: 26, train_loss: 0.8137, test_loss: 1.1023, test_f1: 0.5304
 epoch: 27, train_loss: 0.7976, test_loss: 1.1458, test_f1: 0.5177
 epoch: 28, train_loss: 0.7925, test_loss: 1.1181, test_f1: 0.5381
 epoch: 29, train_loss: 0.7851, test_loss: 1.0904, test_f1: 0.5398
 epoch: 30, train_loss: 0.7737, test_loss: 1.1582, test_f1: 0.5498
 epoch: 31, train_loss: 0.7530, test_loss: 1.1203, test_f1: 0.5374
 epoch: 32, train_loss: 0.7685, test_loss: 1.0986, test_f1: 0.5341
 epoch: 33, train_loss: 0.7673, test_loss: 1.3451, test_f1: 0.5005
 epoch: 34, train_loss: 0.7803, test_loss: 1.0877, test_f1: 0.5675
 epoch: 35, train_loss: 0.7379, test_loss: 1.1484, test_f1: 0.5529
 epoch: 36, train_loss: 0.7447, test_loss: 1.2311, test_f1: 0.5445
 epoch: 37, train_loss: 0.7334, test_loss: 1.1655, test_f1: 0.5696
 epoch: 38, train_loss: 0.7316, test_loss: 1.0903, test_f1: 0.5880
 epoch: 39, train_loss: 0.7090, test_loss: 1.1650, test_f1: 0.5608
 epoch: 40, train_loss: 0.7479, test_loss: 1.1232, test_f1: 0.5726
 epoch: 41, train_loss: 0.7248, test_loss: 1.1617, test_f1: 0.5537
 epoch: 42, train_loss: 0.7075, test_loss: 1.1345, test_f1: 0.5404
 epoch: 43, train_loss: 0.6968, test_loss: 1.0901, test_f1: 0.5694
 epoch: 44, train_loss: 0.6904, test_loss: 1.2423, test_f1: 0.5640
 epoch: 45, train_loss: 0.6970, test_loss: 1.1311, test_f1: 0.5442
 epoch: 46, train_loss: 0.6771, test_loss: 1.1803, test_f1: 0.5630
 epoch: 47, train_loss: 0.6724, test_loss: 1.1033, test_f1: 0.5692
 epoch: 48, train_loss: 0.6726, test_loss: 1.1569, test_f1: 0.5666
 epoch: 49, train_loss: 0.6663, test_loss: 1.0970, test_f1: 0.5663
 epoch: 50, train_loss: 0.6656, test_loss: 1.1572, test_f1: 0.5393
 epoch: 51, train_loss: 0.6256, test_loss: 1.1384, test_f1: 0.5635
 epoch: 52, train_loss: 0.6054, test_loss: 1.1679, test_f1: 0.5580
 epoch: 53, train_loss: 0.5973, test_loss: 1.2093, test_f1: 0.5455
 epoch: 54, train_loss: 0.5928, test_loss: 1.2289, test_f1: 0.5516
 epoch: 55, train_loss: 0.5865, test_loss: 1.2093, test_f1: 0.5456
 epoch: 56, train_loss: 0.5740, test_loss: 1.2288, test_f1: 0.5666
 epoch: 57, train_loss: 0.5673, test_loss: 1.2332, test_f1: 0.5683
 epoch: 58, train_loss: 0.5675, test_loss: 1.2265, test_f1: 0.5662
 epoch: 59, train_loss: 0.5749, test_loss: 1.2736, test_f1: 0.5522
 epoch: 60, train_loss: 0.5539, test_loss: 1.2795, test_f1: 0.5624
 epoch: 61, train_loss: 0.5442, test_loss: 1.2937, test_f1: 0.5616
 epoch: 62, train_loss: 0.5492, test_loss: 1.2975, test_f1: 0.5483
 epoch: 63, train_loss: 0.5411, test_loss: 1.2724, test_f1: 0.5729
 epoch: 64, train_loss: 0.5383, test_loss: 1.3193, test_f1: 0.5768
 epoch: 65, train_loss: 0.5318, test_loss: 1.3735, test_f1: 0.5688
 epoch: 66, train_loss: 0.5279, test_loss: 1.2936, test_f1: 0.5683
 epoch: 67, train_loss: 0.5276, test_loss: 1.3275, test_f1: 0.5482
 epoch: 68, train_loss: 0.5247, test_loss: 1.3246, test_f1: 0.5497
 epoch: 69, train_loss: 0.5289, test_loss: 1.3575, test_f1: 0.5559
 epoch: 70, train_loss: 0.5177, test_loss: 1.3569, test_f1: 0.5514
 epoch: 71, train_loss: 0.5161, test_loss: 1.3631, test_f1: 0.5556
 epoch: 72, train_loss: 0.4989, test_loss: 1.3514, test_f1: 0.5719
 epoch: 73, train_loss: 0.4904, test_loss: 1.4381, test_f1: 0.5550
 epoch: 74, train_loss: 0.5128, test_loss: 1.4054, test_f1: 0.5492
 epoch: 75, train_loss: 0.5090, test_loss: 1.3577, test_f1: 0.5517
 epoch: 76, train_loss: 0.5137, test_loss: 1.4833, test_f1: 0.5745
 epoch: 77, train_loss: 0.4901, test_loss: 1.4845, test_f1: 0.5499
 epoch: 78, train_loss: 0.4900, test_loss: 1.4839, test_f1: 0.5523
 epoch: 79, train_loss: 0.5004, test_loss: 1.4528, test_f1: 0.5570
 epoch: 80, train_loss: 0.4803, test_loss: 1.4183, test_f1: 0.5756
 epoch: 81, train_loss: 0.4610, test_loss: 1.3826, test_f1: 0.5807
 epoch: 82, train_loss: 0.4789, test_loss: 1.3592, test_f1: 0.5658
 epoch: 83, train_loss: 0.4846, test_loss: 1.4041, test_f1: 0.5451
 epoch: 84, train_loss: 0.5013, test_loss: 1.4157, test_f1: 0.5531
 epoch: 85, train_loss: 0.4537, test_loss: 1.4614, test_f1: 0.5642
 epoch: 86, train_loss: 0.4608, test_loss: 1.5237, test_f1: 0.5351
 epoch: 87, train_loss: 0.4625, test_loss: 1.4375, test_f1: 0.5728
 epoch: 88, train_loss: 0.4542, test_loss: 1.4493, test_f1: 0.5583
 epoch: 89, train_loss: 0.4403, test_loss: 1.5961, test_f1: 0.5500
 epoch: 90, train_loss: 0.4382, test_loss: 1.5056, test_f1: 0.5705
 epoch: 91, train_loss: 0.4491, test_loss: 1.4690, test_f1: 0.5598
 epoch: 92, train_loss: 0.4419, test_loss: 1.5409, test_f1: 0.5578
 epoch: 93, train_loss: 0.4442, test_loss: 1.4734, test_f1: 0.5691
 epoch: 94, train_loss: 0.4481, test_loss: 1.4479, test_f1: 0.5601
 epoch: 95, train_loss: 0.4449, test_loss: 1.5180, test_f1: 0.5794
 epoch: 96, train_loss: 0.4447, test_loss: 1.4255, test_f1: 0.5335
 epoch: 97, train_loss: 0.4468, test_loss: 1.5965, test_f1: 0.5712
 epoch: 98, train_loss: 0.4554, test_loss: 1.4831, test_f1: 0.5784
 epoch: 99, train_loss: 0.4168, test_loss: 1.5089, test_f1: 0.5692
##################ITERATION #7 ****************************************
 epoch: 0, train_loss: 1.3756, test_loss: 1.1856, test_f1: 0.4033
 epoch: 1, train_loss: 1.2053, test_loss: 1.1230, test_f1: 0.3808
 epoch: 2, train_loss: 1.1786, test_loss: 1.1095, test_f1: 0.3838
 epoch: 3, train_loss: 1.1365, test_loss: 1.0637, test_f1: 0.4517
 epoch: 4, train_loss: 1.1226, test_loss: 1.0668, test_f1: 0.4383
 epoch: 5, train_loss: 1.1062, test_loss: 1.0496, test_f1: 0.4533
 epoch: 6, train_loss: 1.0768, test_loss: 1.0297, test_f1: 0.4419
 epoch: 7, train_loss: 1.0603, test_loss: 1.0248, test_f1: 0.4368
 epoch: 8, train_loss: 1.0391, test_loss: 1.0046, test_f1: 0.4808
 epoch: 9, train_loss: 1.0314, test_loss: 1.0347, test_f1: 0.4168
 epoch: 10, train_loss: 1.0061, test_loss: 0.9808, test_f1: 0.4822
 epoch: 11, train_loss: 0.9971, test_loss: 0.9946, test_f1: 0.4591
 epoch: 12, train_loss: 0.9876, test_loss: 0.9633, test_f1: 0.5084
 epoch: 13, train_loss: 0.9736, test_loss: 0.9773, test_f1: 0.4947
 epoch: 14, train_loss: 0.9616, test_loss: 0.9889, test_f1: 0.4584
 epoch: 15, train_loss: 0.9452, test_loss: 1.0116, test_f1: 0.4638
 epoch: 16, train_loss: 0.9172, test_loss: 1.1146, test_f1: 0.4829
 epoch: 17, train_loss: 0.9732, test_loss: 0.9412, test_f1: 0.5175
 epoch: 18, train_loss: 0.9217, test_loss: 0.9612, test_f1: 0.5213
 epoch: 19, train_loss: 0.9166, test_loss: 0.9973, test_f1: 0.5093
 epoch: 20, train_loss: 0.8906, test_loss: 0.9727, test_f1: 0.5048
 epoch: 21, train_loss: 0.9032, test_loss: 1.0034, test_f1: 0.4974
 epoch: 22, train_loss: 0.8938, test_loss: 0.9921, test_f1: 0.5163
 epoch: 23, train_loss: 0.8783, test_loss: 0.9700, test_f1: 0.4976
 epoch: 24, train_loss: 0.8615, test_loss: 1.0045, test_f1: 0.5303
 epoch: 25, train_loss: 0.8766, test_loss: 1.0689, test_f1: 0.4687
 epoch: 26, train_loss: 0.8542, test_loss: 1.0409, test_f1: 0.5264
 epoch: 27, train_loss: 0.8401, test_loss: 1.0970, test_f1: 0.4903
 epoch: 28, train_loss: 0.8479, test_loss: 1.0559, test_f1: 0.4797
 epoch: 29, train_loss: 0.8359, test_loss: 1.1629, test_f1: 0.4779
 epoch: 30, train_loss: 0.8372, test_loss: 1.0118, test_f1: 0.5417
 epoch: 31, train_loss: 0.8277, test_loss: 1.0279, test_f1: 0.5291
 epoch: 32, train_loss: 0.8245, test_loss: 1.0420, test_f1: 0.5146
 epoch: 33, train_loss: 0.8087, test_loss: 1.0264, test_f1: 0.5268
 epoch: 34, train_loss: 0.7882, test_loss: 0.9781, test_f1: 0.5499
 epoch: 35, train_loss: 0.7924, test_loss: 0.9993, test_f1: 0.5401
 epoch: 36, train_loss: 0.7906, test_loss: 0.9827, test_f1: 0.5094
 epoch: 37, train_loss: 0.7811, test_loss: 1.1036, test_f1: 0.5002
 epoch: 38, train_loss: 0.7670, test_loss: 1.1367, test_f1: 0.4774
 epoch: 39, train_loss: 0.7857, test_loss: 0.9698, test_f1: 0.5292
 epoch: 40, train_loss: 0.7641, test_loss: 0.9804, test_f1: 0.5426
 epoch: 41, train_loss: 0.7663, test_loss: 1.0173, test_f1: 0.5253
 epoch: 42, train_loss: 0.7647, test_loss: 1.1358, test_f1: 0.4894
 epoch: 43, train_loss: 0.7487, test_loss: 1.0936, test_f1: 0.5196
 epoch: 44, train_loss: 0.7498, test_loss: 1.0666, test_f1: 0.5419
 epoch: 45, train_loss: 0.7401, test_loss: 1.0345, test_f1: 0.5443
 epoch: 46, train_loss: 0.7554, test_loss: 1.0078, test_f1: 0.5494
 epoch: 47, train_loss: 0.7446, test_loss: 1.0327, test_f1: 0.5407
 epoch: 48, train_loss: 0.7281, test_loss: 1.0618, test_f1: 0.5398
 epoch: 49, train_loss: 0.7249, test_loss: 1.0678, test_f1: 0.5434
 epoch: 50, train_loss: 0.7482, test_loss: 1.0212, test_f1: 0.5404
 epoch: 51, train_loss: 0.6774, test_loss: 1.1242, test_f1: 0.5508
 epoch: 52, train_loss: 0.6632, test_loss: 1.1274, test_f1: 0.5413
 epoch: 53, train_loss: 0.6556, test_loss: 1.1767, test_f1: 0.5252
 epoch: 54, train_loss: 0.6483, test_loss: 1.1678, test_f1: 0.5223
 epoch: 55, train_loss: 0.6642, test_loss: 1.1676, test_f1: 0.5426
 epoch: 56, train_loss: 0.6543, test_loss: 1.0934, test_f1: 0.5600
 epoch: 57, train_loss: 0.6361, test_loss: 1.1745, test_f1: 0.5274
 epoch: 58, train_loss: 0.6197, test_loss: 1.1708, test_f1: 0.5213
 epoch: 59, train_loss: 0.6221, test_loss: 1.1949, test_f1: 0.5387
 epoch: 60, train_loss: 0.6283, test_loss: 1.1700, test_f1: 0.5414
 epoch: 61, train_loss: 0.6206, test_loss: 1.1644, test_f1: 0.5278
 epoch: 62, train_loss: 0.6301, test_loss: 1.1621, test_f1: 0.5346
 epoch: 63, train_loss: 0.6105, test_loss: 1.1813, test_f1: 0.5305
 epoch: 64, train_loss: 0.6161, test_loss: 1.1583, test_f1: 0.5311
 epoch: 65, train_loss: 0.5974, test_loss: 1.2350, test_f1: 0.5388
 epoch: 66, train_loss: 0.6200, test_loss: 1.2147, test_f1: 0.5467
 epoch: 67, train_loss: 0.5994, test_loss: 1.2805, test_f1: 0.5108
 epoch: 68, train_loss: 0.6114, test_loss: 1.1749, test_f1: 0.5199
 epoch: 69, train_loss: 0.6018, test_loss: 1.2103, test_f1: 0.5427
 epoch: 70, train_loss: 0.6173, test_loss: 1.1663, test_f1: 0.5297
 epoch: 71, train_loss: 0.5859, test_loss: 1.1853, test_f1: 0.5277
 epoch: 72, train_loss: 0.5888, test_loss: 1.2695, test_f1: 0.5193
 epoch: 73, train_loss: 0.5908, test_loss: 1.2051, test_f1: 0.5214
 epoch: 74, train_loss: 0.5870, test_loss: 1.2235, test_f1: 0.5394
 epoch: 75, train_loss: 0.5723, test_loss: 1.2264, test_f1: 0.5360
 epoch: 76, train_loss: 0.5754, test_loss: 1.2496, test_f1: 0.5304
 epoch: 77, train_loss: 0.5587, test_loss: 1.2701, test_f1: 0.5263
 epoch: 78, train_loss: 0.5764, test_loss: 1.2656, test_f1: 0.5255
 epoch: 79, train_loss: 0.5627, test_loss: 1.3329, test_f1: 0.5282
 epoch: 80, train_loss: 0.5714, test_loss: 1.3168, test_f1: 0.5267
 epoch: 81, train_loss: 0.5513, test_loss: 1.3521, test_f1: 0.5462
 epoch: 82, train_loss: 0.5662, test_loss: 1.3398, test_f1: 0.5417
 epoch: 83, train_loss: 0.5622, test_loss: 1.3979, test_f1: 0.5274
 epoch: 84, train_loss: 0.5504, test_loss: 1.3715, test_f1: 0.5164
 epoch: 85, train_loss: 0.5487, test_loss: 1.3494, test_f1: 0.5182
 epoch: 86, train_loss: 0.5435, test_loss: 1.4123, test_f1: 0.5315
 epoch: 87, train_loss: 0.5461, test_loss: 1.4563, test_f1: 0.5310
 epoch: 88, train_loss: 0.5637, test_loss: 1.3330, test_f1: 0.5149
 epoch: 89, train_loss: 0.5406, test_loss: 1.3043, test_f1: 0.5265
 epoch: 90, train_loss: 0.5210, test_loss: 1.3489, test_f1: 0.5408
 epoch: 91, train_loss: 0.5250, test_loss: 1.3747, test_f1: 0.5191
 epoch: 92, train_loss: 0.5329, test_loss: 1.4006, test_f1: 0.5322
 epoch: 93, train_loss: 0.5492, test_loss: 1.3130, test_f1: 0.5319
 epoch: 94, train_loss: 0.5377, test_loss: 1.3933, test_f1: 0.5380
 epoch: 95, train_loss: 0.5249, test_loss: 1.3882, test_f1: 0.5408
 epoch: 96, train_loss: 0.5308, test_loss: 1.3470, test_f1: 0.5259
 epoch: 97, train_loss: 0.5259, test_loss: 1.3159, test_f1: 0.5371
 epoch: 98, train_loss: 0.5135, test_loss: 1.3421, test_f1: 0.5478
 epoch: 99, train_loss: 0.5071, test_loss: 1.4600, test_f1: 0.5281
##################ITERATION #8 ****************************************
 epoch: 0, train_loss: 1.4055, test_loss: 1.2284, test_f1: 0.2992
 epoch: 1, train_loss: 1.2135, test_loss: 1.1160, test_f1: 0.4369
 epoch: 2, train_loss: 1.1522, test_loss: 1.1223, test_f1: 0.4298
 epoch: 3, train_loss: 1.1441, test_loss: 1.1235, test_f1: 0.4125
 epoch: 4, train_loss: 1.1141, test_loss: 1.0714, test_f1: 0.4130
 epoch: 5, train_loss: 1.0721, test_loss: 1.0933, test_f1: 0.4215
 epoch: 6, train_loss: 1.0745, test_loss: 1.0451, test_f1: 0.4421
 epoch: 7, train_loss: 1.0455, test_loss: 1.0268, test_f1: 0.4842
 epoch: 8, train_loss: 1.0146, test_loss: 0.9962, test_f1: 0.4732
 epoch: 9, train_loss: 1.0000, test_loss: 1.0033, test_f1: 0.4738
 epoch: 10, train_loss: 0.9831, test_loss: 0.9839, test_f1: 0.4793
 epoch: 11, train_loss: 0.9761, test_loss: 0.9872, test_f1: 0.5006
 epoch: 12, train_loss: 0.9590, test_loss: 0.9911, test_f1: 0.4834
 epoch: 13, train_loss: 0.9305, test_loss: 1.0210, test_f1: 0.4785
 epoch: 14, train_loss: 0.9350, test_loss: 0.9992, test_f1: 0.4560
 epoch: 15, train_loss: 0.9230, test_loss: 1.0864, test_f1: 0.4755
 epoch: 16, train_loss: 0.8977, test_loss: 1.0522, test_f1: 0.4928
 epoch: 17, train_loss: 0.9173, test_loss: 0.9604, test_f1: 0.4802
 epoch: 18, train_loss: 0.9045, test_loss: 1.0100, test_f1: 0.4892
 epoch: 19, train_loss: 0.8762, test_loss: 1.0435, test_f1: 0.4752
 epoch: 20, train_loss: 0.8713, test_loss: 1.0398, test_f1: 0.4969
 epoch: 21, train_loss: 0.8611, test_loss: 1.1054, test_f1: 0.4837
 epoch: 22, train_loss: 0.8669, test_loss: 1.1265, test_f1: 0.4858
 epoch: 23, train_loss: 0.8466, test_loss: 1.1459, test_f1: 0.4901
 epoch: 24, train_loss: 0.8462, test_loss: 1.0401, test_f1: 0.5162
 epoch: 25, train_loss: 0.8408, test_loss: 1.0949, test_f1: 0.5010
 epoch: 26, train_loss: 0.8380, test_loss: 1.1078, test_f1: 0.5004
 epoch: 27, train_loss: 0.8321, test_loss: 1.1081, test_f1: 0.5048
 epoch: 28, train_loss: 0.8039, test_loss: 1.1269, test_f1: 0.5191
 epoch: 29, train_loss: 0.8049, test_loss: 1.1177, test_f1: 0.5276
 epoch: 30, train_loss: 0.8042, test_loss: 1.1272, test_f1: 0.5217
 epoch: 31, train_loss: 0.7906, test_loss: 1.0982, test_f1: 0.5007
 epoch: 32, train_loss: 0.7974, test_loss: 1.0855, test_f1: 0.4996
 epoch: 33, train_loss: 0.7809, test_loss: 1.1199, test_f1: 0.5016
 epoch: 34, train_loss: 0.7873, test_loss: 1.1264, test_f1: 0.5217
 epoch: 35, train_loss: 0.7871, test_loss: 1.1418, test_f1: 0.5141
 epoch: 36, train_loss: 0.7810, test_loss: 1.1782, test_f1: 0.5129
 epoch: 37, train_loss: 0.7570, test_loss: 1.1608, test_f1: 0.5126
 epoch: 38, train_loss: 0.7695, test_loss: 1.1503, test_f1: 0.5300
 epoch: 39, train_loss: 0.7433, test_loss: 1.0863, test_f1: 0.5307
 epoch: 40, train_loss: 0.7295, test_loss: 1.2099, test_f1: 0.5267
 epoch: 41, train_loss: 0.7285, test_loss: 1.2103, test_f1: 0.5164
 epoch: 42, train_loss: 0.7284, test_loss: 1.1706, test_f1: 0.5333
 epoch: 43, train_loss: 0.7169, test_loss: 1.1665, test_f1: 0.5177
 epoch: 44, train_loss: 0.7168, test_loss: 1.1755, test_f1: 0.4934
 epoch: 45, train_loss: 0.7100, test_loss: 1.1538, test_f1: 0.5383
 epoch: 46, train_loss: 0.6987, test_loss: 1.1694, test_f1: 0.5304
 epoch: 47, train_loss: 0.7063, test_loss: 1.3231, test_f1: 0.5054
 epoch: 48, train_loss: 0.7000, test_loss: 1.2789, test_f1: 0.5238
 epoch: 49, train_loss: 0.6819, test_loss: 1.3149, test_f1: 0.5001
 epoch: 50, train_loss: 0.6892, test_loss: 1.2455, test_f1: 0.4856
 epoch: 51, train_loss: 0.6823, test_loss: 1.2028, test_f1: 0.5183
 epoch: 52, train_loss: 0.6470, test_loss: 1.2164, test_f1: 0.5211
 epoch: 53, train_loss: 0.6287, test_loss: 1.1962, test_f1: 0.5306
 epoch: 54, train_loss: 0.6189, test_loss: 1.2803, test_f1: 0.5206
 epoch: 55, train_loss: 0.6190, test_loss: 1.3190, test_f1: 0.5219
 epoch: 56, train_loss: 0.5964, test_loss: 1.2847, test_f1: 0.5199
 epoch: 57, train_loss: 0.6178, test_loss: 1.2601, test_f1: 0.5232
 epoch: 58, train_loss: 0.6116, test_loss: 1.3120, test_f1: 0.5174
 epoch: 59, train_loss: 0.6006, test_loss: 1.2987, test_f1: 0.5186
 epoch: 60, train_loss: 0.6014, test_loss: 1.3028, test_f1: 0.5260
 epoch: 61, train_loss: 0.5851, test_loss: 1.2969, test_f1: 0.5241
 epoch: 62, train_loss: 0.5877, test_loss: 1.3674, test_f1: 0.5007
 epoch: 63, train_loss: 0.5845, test_loss: 1.3541, test_f1: 0.5327
 epoch: 64, train_loss: 0.5977, test_loss: 1.3060, test_f1: 0.5183
 epoch: 65, train_loss: 0.5940, test_loss: 1.3036, test_f1: 0.5167
 epoch: 66, train_loss: 0.5709, test_loss: 1.3532, test_f1: 0.5266
 epoch: 67, train_loss: 0.5558, test_loss: 1.3649, test_f1: 0.5288
 epoch: 68, train_loss: 0.5398, test_loss: 1.3519, test_f1: 0.5183
 epoch: 69, train_loss: 0.5544, test_loss: 1.3901, test_f1: 0.5103
 epoch: 70, train_loss: 0.5434, test_loss: 1.4910, test_f1: 0.5100
 epoch: 71, train_loss: 0.5554, test_loss: 1.4038, test_f1: 0.5176
 epoch: 72, train_loss: 0.5431, test_loss: 1.4023, test_f1: 0.5304
 epoch: 73, train_loss: 0.5500, test_loss: 1.3766, test_f1: 0.5389
 epoch: 74, train_loss: 0.5194, test_loss: 1.3954, test_f1: 0.5583
 epoch: 75, train_loss: 0.5214, test_loss: 1.4334, test_f1: 0.5427
 epoch: 76, train_loss: 0.5372, test_loss: 1.3777, test_f1: 0.5441
 epoch: 77, train_loss: 0.5344, test_loss: 1.4337, test_f1: 0.5356
 epoch: 78, train_loss: 0.5240, test_loss: 1.3694, test_f1: 0.5364
 epoch: 79, train_loss: 0.5232, test_loss: 1.4114, test_f1: 0.5490
 epoch: 80, train_loss: 0.5368, test_loss: 1.3663, test_f1: 0.5467
 epoch: 81, train_loss: 0.5126, test_loss: 1.4727, test_f1: 0.5480
 epoch: 82, train_loss: 0.5233, test_loss: 1.4191, test_f1: 0.5579
 epoch: 83, train_loss: 0.5121, test_loss: 1.4004, test_f1: 0.5440
 epoch: 84, train_loss: 0.4997, test_loss: 1.4325, test_f1: 0.5445
 epoch: 85, train_loss: 0.5096, test_loss: 1.4476, test_f1: 0.5326
 epoch: 86, train_loss: 0.4930, test_loss: 1.4449, test_f1: 0.5393
 epoch: 87, train_loss: 0.5025, test_loss: 1.4455, test_f1: 0.5357
 epoch: 88, train_loss: 0.5075, test_loss: 1.4480, test_f1: 0.5352
 epoch: 89, train_loss: 0.4963, test_loss: 1.4323, test_f1: 0.5489
 epoch: 90, train_loss: 0.4933, test_loss: 1.4977, test_f1: 0.5578
 epoch: 91, train_loss: 0.4892, test_loss: 1.4641, test_f1: 0.5306
 epoch: 92, train_loss: 0.4639, test_loss: 1.4509, test_f1: 0.5589
 epoch: 93, train_loss: 0.4902, test_loss: 1.5184, test_f1: 0.5316
 epoch: 94, train_loss: 0.4701, test_loss: 1.5466, test_f1: 0.5261
 epoch: 95, train_loss: 0.4577, test_loss: 1.5980, test_f1: 0.5115
 epoch: 96, train_loss: 0.4726, test_loss: 1.5401, test_f1: 0.5247
 epoch: 97, train_loss: 0.4778, test_loss: 1.5018, test_f1: 0.5499
 epoch: 98, train_loss: 0.4744, test_loss: 1.5353, test_f1: 0.5214
 epoch: 99, train_loss: 0.4725, test_loss: 1.4775, test_f1: 0.5391
##################ITERATION #9 ****************************************
 epoch: 0, train_loss: 1.3709, test_loss: 1.1602, test_f1: 0.4064
 epoch: 1, train_loss: 1.1950, test_loss: 1.1077, test_f1: 0.4581
 epoch: 2, train_loss: 1.1470, test_loss: 1.0568, test_f1: 0.4927
 epoch: 3, train_loss: 1.1084, test_loss: 1.0622, test_f1: 0.4320
 epoch: 4, train_loss: 1.0995, test_loss: 1.0307, test_f1: 0.4684
 epoch: 5, train_loss: 1.0610, test_loss: 1.0320, test_f1: 0.4363
 epoch: 6, train_loss: 1.0610, test_loss: 0.9734, test_f1: 0.4965
 epoch: 7, train_loss: 1.0157, test_loss: 0.9634, test_f1: 0.4765
 epoch: 8, train_loss: 1.0018, test_loss: 0.9317, test_f1: 0.5031
 epoch: 9, train_loss: 0.9803, test_loss: 1.0947, test_f1: 0.4110
 epoch: 10, train_loss: 0.9733, test_loss: 1.0255, test_f1: 0.4663
 epoch: 11, train_loss: 0.9436, test_loss: 0.9760, test_f1: 0.5123
 epoch: 12, train_loss: 0.9428, test_loss: 1.0327, test_f1: 0.4859
 epoch: 13, train_loss: 0.9263, test_loss: 0.9468, test_f1: 0.5279
 epoch: 14, train_loss: 0.9153, test_loss: 1.0065, test_f1: 0.4848
 epoch: 15, train_loss: 0.9036, test_loss: 1.0616, test_f1: 0.4812
 epoch: 16, train_loss: 0.8811, test_loss: 0.9912, test_f1: 0.4881
 epoch: 17, train_loss: 0.8836, test_loss: 1.0307, test_f1: 0.4966
 epoch: 18, train_loss: 0.8587, test_loss: 0.9785, test_f1: 0.5481
 epoch: 19, train_loss: 0.8601, test_loss: 1.0181, test_f1: 0.5239
 epoch: 20, train_loss: 0.8531, test_loss: 0.9698, test_f1: 0.5236
 epoch: 21, train_loss: 0.8493, test_loss: 0.9777, test_f1: 0.5264
 epoch: 22, train_loss: 0.8249, test_loss: 1.0368, test_f1: 0.4893
 epoch: 23, train_loss: 0.8301, test_loss: 0.9713, test_f1: 0.5441
 epoch: 24, train_loss: 0.8088, test_loss: 1.0249, test_f1: 0.5045
 epoch: 25, train_loss: 0.8037, test_loss: 1.1173, test_f1: 0.5055
 epoch: 26, train_loss: 0.8037, test_loss: 1.0592, test_f1: 0.4990
 epoch: 27, train_loss: 0.7986, test_loss: 1.0300, test_f1: 0.5508
 epoch: 28, train_loss: 0.7808, test_loss: 1.0681, test_f1: 0.5120
 epoch: 29, train_loss: 0.7815, test_loss: 1.0288, test_f1: 0.5539
 epoch: 30, train_loss: 0.7737, test_loss: 1.0805, test_f1: 0.5213
 epoch: 31, train_loss: 0.7622, test_loss: 1.0521, test_f1: 0.4970
 epoch: 32, train_loss: 0.7468, test_loss: 1.1174, test_f1: 0.5183
 epoch: 33, train_loss: 0.7588, test_loss: 1.1031, test_f1: 0.5131
 epoch: 34, train_loss: 0.7543, test_loss: 1.0439, test_f1: 0.5588
 epoch: 35, train_loss: 0.7605, test_loss: 1.0794, test_f1: 0.5204
 epoch: 36, train_loss: 0.7341, test_loss: 1.0536, test_f1: 0.5774
 epoch: 37, train_loss: 0.7261, test_loss: 1.0353, test_f1: 0.5451
 epoch: 38, train_loss: 0.7321, test_loss: 1.1380, test_f1: 0.5275
 epoch: 39, train_loss: 0.7160, test_loss: 1.1839, test_f1: 0.4948
 epoch: 40, train_loss: 0.7162, test_loss: 1.1504, test_f1: 0.5283
 epoch: 41, train_loss: 0.6897, test_loss: 1.1035, test_f1: 0.5321
 epoch: 42, train_loss: 0.7301, test_loss: 1.0253, test_f1: 0.5359
 epoch: 43, train_loss: 0.6954, test_loss: 1.0951, test_f1: 0.5379
 epoch: 44, train_loss: 0.6959, test_loss: 1.1171, test_f1: 0.5416
 epoch: 45, train_loss: 0.6888, test_loss: 1.2019, test_f1: 0.5255
 epoch: 46, train_loss: 0.6703, test_loss: 1.1151, test_f1: 0.5342
 epoch: 47, train_loss: 0.6681, test_loss: 1.1913, test_f1: 0.5315
 epoch: 48, train_loss: 0.7028, test_loss: 1.0997, test_f1: 0.5211
 epoch: 49, train_loss: 0.6654, test_loss: 1.1425, test_f1: 0.5651
 epoch: 50, train_loss: 0.6568, test_loss: 1.1941, test_f1: 0.5337
 epoch: 51, train_loss: 0.6296, test_loss: 1.1935, test_f1: 0.5536
 epoch: 52, train_loss: 0.5899, test_loss: 1.1763, test_f1: 0.5567
 epoch: 53, train_loss: 0.6010, test_loss: 1.2441, test_f1: 0.5514
 epoch: 54, train_loss: 0.5743, test_loss: 1.2026, test_f1: 0.5549
 epoch: 55, train_loss: 0.5765, test_loss: 1.2013, test_f1: 0.5533
 epoch: 56, train_loss: 0.5703, test_loss: 1.2684, test_f1: 0.5506
 epoch: 57, train_loss: 0.5719, test_loss: 1.2487, test_f1: 0.5501
 epoch: 58, train_loss: 0.5461, test_loss: 1.2285, test_f1: 0.5812
 epoch: 59, train_loss: 0.5526, test_loss: 1.2780, test_f1: 0.5791
 epoch: 60, train_loss: 0.5630, test_loss: 1.2739, test_f1: 0.5770
 epoch: 61, train_loss: 0.5395, test_loss: 1.2788, test_f1: 0.5606
 epoch: 62, train_loss: 0.5620, test_loss: 1.3498, test_f1: 0.5708
 epoch: 63, train_loss: 0.5502, test_loss: 1.2715, test_f1: 0.5691
 epoch: 64, train_loss: 0.5606, test_loss: 1.2526, test_f1: 0.5594
 epoch: 65, train_loss: 0.5213, test_loss: 1.2758, test_f1: 0.5689
 epoch: 66, train_loss: 0.5371, test_loss: 1.3549, test_f1: 0.5740
 epoch: 67, train_loss: 0.5290, test_loss: 1.3883, test_f1: 0.5576
 epoch: 68, train_loss: 0.5225, test_loss: 1.3405, test_f1: 0.5746
 epoch: 69, train_loss: 0.5302, test_loss: 1.4628, test_f1: 0.5586
 epoch: 70, train_loss: 0.4902, test_loss: 1.3571, test_f1: 0.5699
 epoch: 71, train_loss: 0.5031, test_loss: 1.4412, test_f1: 0.5699
 epoch: 72, train_loss: 0.5148, test_loss: 1.2917, test_f1: 0.5774
 epoch: 73, train_loss: 0.5175, test_loss: 1.3900, test_f1: 0.5506
 epoch: 74, train_loss: 0.5104, test_loss: 1.3699, test_f1: 0.5486
 epoch: 75, train_loss: 0.4806, test_loss: 1.4355, test_f1: 0.5526
 epoch: 76, train_loss: 0.4861, test_loss: 1.4301, test_f1: 0.5740
 epoch: 77, train_loss: 0.4942, test_loss: 1.4486, test_f1: 0.5494
 epoch: 78, train_loss: 0.5053, test_loss: 1.3751, test_f1: 0.5558
 epoch: 79, train_loss: 0.5042, test_loss: 1.3636, test_f1: 0.5721
 epoch: 80, train_loss: 0.4838, test_loss: 1.3710, test_f1: 0.5811
 epoch: 81, train_loss: 0.4778, test_loss: 1.3751, test_f1: 0.5730
 epoch: 82, train_loss: 0.4788, test_loss: 1.4870, test_f1: 0.5518
 epoch: 83, train_loss: 0.4643, test_loss: 1.4134, test_f1: 0.5766
 epoch: 84, train_loss: 0.4780, test_loss: 1.4365, test_f1: 0.5737
 epoch: 85, train_loss: 0.4732, test_loss: 1.4636, test_f1: 0.5897
 epoch: 86, train_loss: 0.4720, test_loss: 1.4443, test_f1: 0.5653
 epoch: 87, train_loss: 0.4470, test_loss: 1.4780, test_f1: 0.5731
 epoch: 88, train_loss: 0.4529, test_loss: 1.4853, test_f1: 0.5841
 epoch: 89, train_loss: 0.4628, test_loss: 1.5194, test_f1: 0.5666
 epoch: 90, train_loss: 0.4444, test_loss: 1.4587, test_f1: 0.5897
 epoch: 91, train_loss: 0.4526, test_loss: 1.4131, test_f1: 0.5724
 epoch: 92, train_loss: 0.4616, test_loss: 1.5081, test_f1: 0.5550
 epoch: 93, train_loss: 0.4355, test_loss: 1.6011, test_f1: 0.5668
 epoch: 94, train_loss: 0.4304, test_loss: 1.4338, test_f1: 0.5880
 epoch: 95, train_loss: 0.4504, test_loss: 1.4826, test_f1: 0.5965
 epoch: 96, train_loss: 0.4294, test_loss: 1.4759, test_f1: 0.5911
 epoch: 97, train_loss: 0.4168, test_loss: 1.5152, test_f1: 0.5694
 epoch: 98, train_loss: 0.4272, test_loss: 1.4949, test_f1: 0.5560
 epoch: 99, train_loss: 0.4143, test_loss: 1.5140, test_f1: 0.5809

Training completed in 871.53 seconds
Best F1: 0.5965 at epoch 95
Mean F1 across iterations: 0.5782  0.0113
========================FINAL RESULTS================================
FEGIN weighted F1: 0.5965  0.0113
python main.py --data ltspice_examples --representation component_component --model FEGIN --layers 6 --hiddens 64 --batch_size 64 --lr 0.001 --emb_size 512 --epochs 100 --save_appendix component_component_L6_H64_BS64_LR0.001_E512 --no_val
-----



STDERR:
  File "main.py", line 370, in <module>
    main()
  File "main.py", line 254, in main
    dataset = dataset_class(
  File "/home/philip/projects/ltspice_examples_code_repo/Circuit-Completion-Using-GNNs/component_classification_with_link_prediction_head/evaluation/FEGIN/kernel/circuit_datasets.py", line 15, in __init__
    self.data, self.slices = torch.load(self.processed_paths[0])
  File "/home/philip/.local/lib/python3.8/site-packages/torch/serialization.py", line 1040, in load
    warnings.warn(
  File "/usr/lib/python3.8/warnings.py", line 109, in _showwarnmsg
    sw(msg.message, msg.category, msg.filename, msg.lineno,
  File "main.py", line 47, in warn_with_traceback
    traceback.print_stack(file=log)
/home/philip/projects/ltspice_examples_code_repo/Circuit-Completion-Using-GNNs/component_classification_with_link_prediction_head/evaluation/FEGIN/kernel/circuit_datasets.py:15: FutureWarning: You are using `torch.load` with `weights_only=False` (the current default value), which uses the default pickle module implicitly. It is possible to construct malicious pickle data which will execute arbitrary code during unpickling (See https://github.com/pytorch/pytorch/blob/main/SECURITY.md#untrusted-models for more details). In a future release, the default value for `weights_only` will be flipped to `True`. This limits the functions that could be executed during unpickling. Arbitrary objects will no longer be allowed to be loaded via this mode unless they are explicitly allowlisted by the user via `torch.serialization.add_safe_globals`. We recommend you start setting `weights_only=True` for any use case where you don't have full control of the loaded file. Please open an issue on GitHub for any issues related to this experimental feature.
  self.data, self.slices = torch.load(self.processed_paths[0])
