STDOUT:
Results will be saved in /home/philip/projects/ltspice_examples_code_repo/Circuit-Completion-Using-GNNs/component_classification_with_link_prediction_head/evaluation/FEGIN/results/model_FEGIN_dataset_ltspice_examples
Command line input: python main.py --data ltspice_examples --representation component_pin --model FEGIN --layers 3 --hiddens 64 --batch_size 64 --lr 0.001 --emb_size 250 --epochs 100 --save_appendix component_pin_L3_H64_BS64_LR0.001_E250 --no_val
 is saved.
-----
ltspice_examples - FEGIN
Using 3 layers, 64 hidden units, h = 2
Loading component_pin representation dataset
ENTERED
Training FEGIN on component_pin representation
Train: 3560, Test: 848
##################ITERATION #0 ****************************************
 epoch: 0, train_loss: 1.2405, test_loss: 1.1724, test_f1: 0.3572
 epoch: 1, train_loss: 1.0413, test_loss: 1.0529, test_f1: 0.3684
 epoch: 2, train_loss: 1.0223, test_loss: 1.0424, test_f1: 0.4842
 epoch: 3, train_loss: 0.9812, test_loss: 1.0286, test_f1: 0.4875
 epoch: 4, train_loss: 0.9514, test_loss: 1.0075, test_f1: 0.4924
 epoch: 5, train_loss: 0.9214, test_loss: 0.9578, test_f1: 0.5064
 epoch: 6, train_loss: 0.9031, test_loss: 1.0053, test_f1: 0.4804
 epoch: 7, train_loss: 0.8773, test_loss: 0.9410, test_f1: 0.5266
 epoch: 8, train_loss: 0.8512, test_loss: 0.9181, test_f1: 0.5270
 epoch: 9, train_loss: 0.8214, test_loss: 1.0107, test_f1: 0.4571
 epoch: 10, train_loss: 0.8061, test_loss: 0.8487, test_f1: 0.5570
 epoch: 11, train_loss: 0.7830, test_loss: 0.8908, test_f1: 0.5473
 epoch: 12, train_loss: 0.7771, test_loss: 0.9015, test_f1: 0.5836
 epoch: 13, train_loss: 0.7498, test_loss: 0.9001, test_f1: 0.5768
 epoch: 14, train_loss: 0.7461, test_loss: 0.9068, test_f1: 0.5864
 epoch: 15, train_loss: 0.7412, test_loss: 0.9338, test_f1: 0.5951
 epoch: 16, train_loss: 0.7272, test_loss: 0.9219, test_f1: 0.5247
 epoch: 17, train_loss: 0.7048, test_loss: 0.8510, test_f1: 0.5964
 epoch: 18, train_loss: 0.7247, test_loss: 0.9259, test_f1: 0.5726
 epoch: 19, train_loss: 0.6882, test_loss: 0.9825, test_f1: 0.5616
 epoch: 20, train_loss: 0.6738, test_loss: 1.0036, test_f1: 0.5854
 epoch: 21, train_loss: 0.6759, test_loss: 0.9049, test_f1: 0.5906
 epoch: 22, train_loss: 0.6614, test_loss: 0.8694, test_f1: 0.6271
 epoch: 23, train_loss: 0.6634, test_loss: 0.8739, test_f1: 0.6278
 epoch: 24, train_loss: 0.6456, test_loss: 0.9167, test_f1: 0.5983
 epoch: 25, train_loss: 0.6398, test_loss: 0.8863, test_f1: 0.6218
 epoch: 26, train_loss: 0.6393, test_loss: 0.8332, test_f1: 0.6311
 epoch: 27, train_loss: 0.6351, test_loss: 0.8195, test_f1: 0.5999
 epoch: 28, train_loss: 0.6145, test_loss: 0.9117, test_f1: 0.5887
 epoch: 29, train_loss: 0.6064, test_loss: 1.0069, test_f1: 0.6081
 epoch: 30, train_loss: 0.6038, test_loss: 1.0863, test_f1: 0.6019
 epoch: 31, train_loss: 0.5825, test_loss: 0.8884, test_f1: 0.6443
 epoch: 32, train_loss: 0.6120, test_loss: 0.9489, test_f1: 0.6355
 epoch: 33, train_loss: 0.5782, test_loss: 0.9566, test_f1: 0.6033
 epoch: 34, train_loss: 0.5830, test_loss: 1.0510, test_f1: 0.5988
 epoch: 35, train_loss: 0.5659, test_loss: 0.8898, test_f1: 0.6300
 epoch: 36, train_loss: 0.5528, test_loss: 1.0721, test_f1: 0.6171
 epoch: 37, train_loss: 0.5715, test_loss: 1.0037, test_f1: 0.6179
 epoch: 38, train_loss: 0.5607, test_loss: 1.0351, test_f1: 0.6189
 epoch: 39, train_loss: 0.5604, test_loss: 0.9263, test_f1: 0.6433
 epoch: 40, train_loss: 0.5405, test_loss: 0.8932, test_f1: 0.6209
 epoch: 41, train_loss: 0.5342, test_loss: 1.0579, test_f1: 0.6230
 epoch: 42, train_loss: 0.5192, test_loss: 1.0940, test_f1: 0.6136
 epoch: 43, train_loss: 0.5154, test_loss: 1.0155, test_f1: 0.6365
 epoch: 44, train_loss: 0.5218, test_loss: 0.9729, test_f1: 0.5949
 epoch: 45, train_loss: 0.4908, test_loss: 1.0493, test_f1: 0.6326
 epoch: 46, train_loss: 0.4990, test_loss: 1.1142, test_f1: 0.6267
 epoch: 47, train_loss: 0.4987, test_loss: 1.0203, test_f1: 0.6403
 epoch: 48, train_loss: 0.4844, test_loss: 1.0128, test_f1: 0.6012
 epoch: 49, train_loss: 0.4763, test_loss: 0.9449, test_f1: 0.6435
 epoch: 50, train_loss: 0.4864, test_loss: 1.0626, test_f1: 0.6509
 epoch: 51, train_loss: 0.4387, test_loss: 1.0324, test_f1: 0.6354
 epoch: 52, train_loss: 0.4221, test_loss: 0.9886, test_f1: 0.6685
 epoch: 53, train_loss: 0.3939, test_loss: 1.0131, test_f1: 0.6470
 epoch: 54, train_loss: 0.3995, test_loss: 1.1258, test_f1: 0.6593
 epoch: 55, train_loss: 0.3948, test_loss: 1.0165, test_f1: 0.6378
 epoch: 56, train_loss: 0.4080, test_loss: 1.1390, test_f1: 0.6617
 epoch: 57, train_loss: 0.3876, test_loss: 1.2882, test_f1: 0.6486
 epoch: 58, train_loss: 0.3903, test_loss: 1.1227, test_f1: 0.6285
 epoch: 59, train_loss: 0.3754, test_loss: 1.0501, test_f1: 0.6587
 epoch: 60, train_loss: 0.3756, test_loss: 1.0867, test_f1: 0.6442
 epoch: 61, train_loss: 0.3836, test_loss: 1.2951, test_f1: 0.6387
 epoch: 62, train_loss: 0.3744, test_loss: 1.1284, test_f1: 0.6778
 epoch: 63, train_loss: 0.3689, test_loss: 1.1391, test_f1: 0.6607
 epoch: 64, train_loss: 0.3487, test_loss: 1.1458, test_f1: 0.6629
 epoch: 65, train_loss: 0.3694, test_loss: 1.2332, test_f1: 0.6585
 epoch: 66, train_loss: 0.3737, test_loss: 1.2752, test_f1: 0.6646
 epoch: 67, train_loss: 0.3596, test_loss: 1.1239, test_f1: 0.6517
 epoch: 68, train_loss: 0.3391, test_loss: 1.2158, test_f1: 0.6574
 epoch: 69, train_loss: 0.3396, test_loss: 1.2331, test_f1: 0.6498
 epoch: 70, train_loss: 0.3613, test_loss: 1.2260, test_f1: 0.6599
 epoch: 71, train_loss: 0.3437, test_loss: 1.2786, test_f1: 0.6625
 epoch: 72, train_loss: 0.3393, test_loss: 1.4086, test_f1: 0.6607
 epoch: 73, train_loss: 0.3269, test_loss: 1.3386, test_f1: 0.6763
 epoch: 74, train_loss: 0.3434, test_loss: 1.2010, test_f1: 0.6695
 epoch: 75, train_loss: 0.3266, test_loss: 1.3695, test_f1: 0.6440
 epoch: 76, train_loss: 0.3261, test_loss: 1.2804, test_f1: 0.6568
 epoch: 77, train_loss: 0.3146, test_loss: 1.2648, test_f1: 0.6678
 epoch: 78, train_loss: 0.2976, test_loss: 1.2936, test_f1: 0.6737
 epoch: 79, train_loss: 0.2985, test_loss: 1.3669, test_f1: 0.6647
 epoch: 80, train_loss: 0.3052, test_loss: 1.4227, test_f1: 0.6595
 epoch: 81, train_loss: 0.3075, test_loss: 1.3650, test_f1: 0.6815
 epoch: 82, train_loss: 0.3052, test_loss: 1.3658, test_f1: 0.6602
 epoch: 83, train_loss: 0.3042, test_loss: 1.3544, test_f1: 0.6528
 epoch: 84, train_loss: 0.3088, test_loss: 1.4319, test_f1: 0.6537
 epoch: 85, train_loss: 0.3249, test_loss: 1.3975, test_f1: 0.6561
 epoch: 86, train_loss: 0.2988, test_loss: 1.3509, test_f1: 0.6965
 epoch: 87, train_loss: 0.2955, test_loss: 1.4962, test_f1: 0.6440
 epoch: 88, train_loss: 0.2973, test_loss: 1.4426, test_f1: 0.6679
 epoch: 89, train_loss: 0.2879, test_loss: 1.4080, test_f1: 0.6745
 epoch: 90, train_loss: 0.2836, test_loss: 1.4932, test_f1: 0.6761
 epoch: 91, train_loss: 0.2616, test_loss: 1.4871, test_f1: 0.6673
 epoch: 92, train_loss: 0.2677, test_loss: 1.4288, test_f1: 0.6760
 epoch: 93, train_loss: 0.2632, test_loss: 1.5414, test_f1: 0.6413
 epoch: 94, train_loss: 0.2782, test_loss: 1.5847, test_f1: 0.6740
 epoch: 95, train_loss: 0.2799, test_loss: 1.5523, test_f1: 0.6679
 epoch: 96, train_loss: 0.2666, test_loss: 1.5278, test_f1: 0.6664
 epoch: 97, train_loss: 0.2568, test_loss: 1.5728, test_f1: 0.6761
 epoch: 98, train_loss: 0.2657, test_loss: 1.5709, test_f1: 0.6847
 epoch: 99, train_loss: 0.2554, test_loss: 1.6958, test_f1: 0.6607
##################ITERATION #1 ****************************************
 epoch: 0, train_loss: 1.1450, test_loss: 1.0791, test_f1: 0.3738
 epoch: 1, train_loss: 0.9823, test_loss: 1.0120, test_f1: 0.4985
 epoch: 2, train_loss: 0.9525, test_loss: 0.9705, test_f1: 0.4971
 epoch: 3, train_loss: 0.9262, test_loss: 0.9216, test_f1: 0.5127
 epoch: 4, train_loss: 0.8987, test_loss: 0.9631, test_f1: 0.5215
 epoch: 5, train_loss: 0.8824, test_loss: 0.9380, test_f1: 0.5037
 epoch: 6, train_loss: 0.8502, test_loss: 0.9218, test_f1: 0.5267
 epoch: 7, train_loss: 0.8428, test_loss: 0.9803, test_f1: 0.5277
 epoch: 8, train_loss: 0.8212, test_loss: 0.9605, test_f1: 0.5305
 epoch: 9, train_loss: 0.7947, test_loss: 0.9471, test_f1: 0.5263
 epoch: 10, train_loss: 0.7856, test_loss: 0.8651, test_f1: 0.5595
 epoch: 11, train_loss: 0.7594, test_loss: 0.9834, test_f1: 0.5524
 epoch: 12, train_loss: 0.7705, test_loss: 0.8642, test_f1: 0.6092
 epoch: 13, train_loss: 0.7429, test_loss: 1.0633, test_f1: 0.5496
 epoch: 14, train_loss: 0.7191, test_loss: 0.8663, test_f1: 0.5618
 epoch: 15, train_loss: 0.7098, test_loss: 0.9259, test_f1: 0.5916
 epoch: 16, train_loss: 0.7110, test_loss: 0.8346, test_f1: 0.5934
 epoch: 17, train_loss: 0.6807, test_loss: 0.8376, test_f1: 0.6014
 epoch: 18, train_loss: 0.6690, test_loss: 0.8294, test_f1: 0.6013
 epoch: 19, train_loss: 0.6612, test_loss: 0.9251, test_f1: 0.5947
 epoch: 20, train_loss: 0.6548, test_loss: 0.9716, test_f1: 0.5613
 epoch: 21, train_loss: 0.6517, test_loss: 0.8575, test_f1: 0.6206
 epoch: 22, train_loss: 0.6206, test_loss: 0.8461, test_f1: 0.6333
 epoch: 23, train_loss: 0.6139, test_loss: 1.2318, test_f1: 0.5600
 epoch: 24, train_loss: 0.6171, test_loss: 0.8898, test_f1: 0.5794
 epoch: 25, train_loss: 0.6233, test_loss: 1.0547, test_f1: 0.5751
 epoch: 26, train_loss: 0.6040, test_loss: 0.9044, test_f1: 0.6148
 epoch: 27, train_loss: 0.5858, test_loss: 0.8428, test_f1: 0.6429
 epoch: 28, train_loss: 0.5971, test_loss: 0.9269, test_f1: 0.6276
 epoch: 29, train_loss: 0.5786, test_loss: 0.8461, test_f1: 0.6360
 epoch: 30, train_loss: 0.5823, test_loss: 1.0555, test_f1: 0.5888
 epoch: 31, train_loss: 0.5822, test_loss: 0.8359, test_f1: 0.6379
 epoch: 32, train_loss: 0.5533, test_loss: 0.8632, test_f1: 0.6306
 epoch: 33, train_loss: 0.5503, test_loss: 0.9507, test_f1: 0.5800
 epoch: 34, train_loss: 0.5471, test_loss: 0.9210, test_f1: 0.6262
 epoch: 35, train_loss: 0.5306, test_loss: 0.8939, test_f1: 0.6083
 epoch: 36, train_loss: 0.5177, test_loss: 0.9930, test_f1: 0.6043
 epoch: 37, train_loss: 0.5107, test_loss: 0.9524, test_f1: 0.6422
 epoch: 38, train_loss: 0.5254, test_loss: 0.8985, test_f1: 0.6386
 epoch: 39, train_loss: 0.5160, test_loss: 0.9327, test_f1: 0.6344
 epoch: 40, train_loss: 0.5075, test_loss: 0.8953, test_f1: 0.6381
 epoch: 41, train_loss: 0.4809, test_loss: 1.0520, test_f1: 0.6176
 epoch: 42, train_loss: 0.4884, test_loss: 0.9423, test_f1: 0.6578
 epoch: 43, train_loss: 0.4853, test_loss: 1.1495, test_f1: 0.6224
 epoch: 44, train_loss: 0.4546, test_loss: 0.9761, test_f1: 0.6447
 epoch: 45, train_loss: 0.5018, test_loss: 0.9604, test_f1: 0.6340
 epoch: 46, train_loss: 0.4579, test_loss: 1.0287, test_f1: 0.6587
 epoch: 47, train_loss: 0.4536, test_loss: 1.0540, test_f1: 0.6396
 epoch: 48, train_loss: 0.4561, test_loss: 1.1841, test_f1: 0.5907
 epoch: 49, train_loss: 0.4583, test_loss: 1.0277, test_f1: 0.6231
 epoch: 50, train_loss: 0.4446, test_loss: 0.9808, test_f1: 0.6403
 epoch: 51, train_loss: 0.4028, test_loss: 1.0285, test_f1: 0.6400
 epoch: 52, train_loss: 0.3834, test_loss: 1.1257, test_f1: 0.6217
 epoch: 53, train_loss: 0.3622, test_loss: 1.0884, test_f1: 0.6305
 epoch: 54, train_loss: 0.3740, test_loss: 1.0447, test_f1: 0.6319
 epoch: 55, train_loss: 0.3570, test_loss: 1.0985, test_f1: 0.6356
 epoch: 56, train_loss: 0.3611, test_loss: 1.1336, test_f1: 0.6275
 epoch: 57, train_loss: 0.3641, test_loss: 1.1230, test_f1: 0.6196
 epoch: 58, train_loss: 0.3691, test_loss: 1.0518, test_f1: 0.6299
 epoch: 59, train_loss: 0.3516, test_loss: 1.1397, test_f1: 0.6271
 epoch: 60, train_loss: 0.3404, test_loss: 1.1227, test_f1: 0.6468
 epoch: 61, train_loss: 0.3328, test_loss: 1.1701, test_f1: 0.6455
 epoch: 62, train_loss: 0.3402, test_loss: 1.1339, test_f1: 0.6661
 epoch: 63, train_loss: 0.3412, test_loss: 1.1444, test_f1: 0.6413
 epoch: 64, train_loss: 0.3484, test_loss: 1.1602, test_f1: 0.6553
 epoch: 65, train_loss: 0.3299, test_loss: 1.1896, test_f1: 0.6551
 epoch: 66, train_loss: 0.3215, test_loss: 1.1498, test_f1: 0.6710
 epoch: 67, train_loss: 0.3008, test_loss: 1.2279, test_f1: 0.6452
 epoch: 68, train_loss: 0.3344, test_loss: 1.2710, test_f1: 0.6346
 epoch: 69, train_loss: 0.3196, test_loss: 1.2920, test_f1: 0.6406
 epoch: 70, train_loss: 0.3282, test_loss: 1.1258, test_f1: 0.6569
 epoch: 71, train_loss: 0.3026, test_loss: 1.2462, test_f1: 0.6327
 epoch: 72, train_loss: 0.3113, test_loss: 1.2313, test_f1: 0.6628
 epoch: 73, train_loss: 0.2964, test_loss: 1.1954, test_f1: 0.6530
 epoch: 74, train_loss: 0.2862, test_loss: 1.2979, test_f1: 0.6243
 epoch: 75, train_loss: 0.3023, test_loss: 1.3002, test_f1: 0.6446
 epoch: 76, train_loss: 0.2820, test_loss: 1.3169, test_f1: 0.6559
 epoch: 77, train_loss: 0.2951, test_loss: 1.3356, test_f1: 0.6409
 epoch: 78, train_loss: 0.3003, test_loss: 1.2562, test_f1: 0.6366
 epoch: 79, train_loss: 0.2951, test_loss: 1.2465, test_f1: 0.6331
 epoch: 80, train_loss: 0.2795, test_loss: 1.2976, test_f1: 0.6467
 epoch: 81, train_loss: 0.2721, test_loss: 1.3074, test_f1: 0.6445
 epoch: 82, train_loss: 0.2636, test_loss: 1.3653, test_f1: 0.6523
 epoch: 83, train_loss: 0.2783, test_loss: 1.5079, test_f1: 0.6464
 epoch: 84, train_loss: 0.2697, test_loss: 1.4616, test_f1: 0.6353
 epoch: 85, train_loss: 0.2902, test_loss: 1.4081, test_f1: 0.6392
 epoch: 86, train_loss: 0.2642, test_loss: 1.5147, test_f1: 0.6329
 epoch: 87, train_loss: 0.2601, test_loss: 1.3511, test_f1: 0.6524
 epoch: 88, train_loss: 0.2630, test_loss: 1.3952, test_f1: 0.6435
 epoch: 89, train_loss: 0.2553, test_loss: 1.4176, test_f1: 0.6382
 epoch: 90, train_loss: 0.2548, test_loss: 1.5462, test_f1: 0.6473
 epoch: 91, train_loss: 0.2633, test_loss: 1.4670, test_f1: 0.6296
 epoch: 92, train_loss: 0.2565, test_loss: 1.4373, test_f1: 0.6500
 epoch: 93, train_loss: 0.2405, test_loss: 1.4198, test_f1: 0.6400
 epoch: 94, train_loss: 0.2532, test_loss: 1.5851, test_f1: 0.6455
 epoch: 95, train_loss: 0.2610, test_loss: 1.4485, test_f1: 0.6408
 epoch: 96, train_loss: 0.2537, test_loss: 1.5007, test_f1: 0.6194
 epoch: 97, train_loss: 0.2508, test_loss: 1.6818, test_f1: 0.6438
 epoch: 98, train_loss: 0.2448, test_loss: 1.4963, test_f1: 0.6477
 epoch: 99, train_loss: 0.2427, test_loss: 1.5178, test_f1: 0.6432
##################ITERATION #2 ****************************************
 epoch: 0, train_loss: 1.1097, test_loss: 1.2054, test_f1: 0.3513
 epoch: 1, train_loss: 0.9761, test_loss: 0.9456, test_f1: 0.4878
 epoch: 2, train_loss: 0.9264, test_loss: 0.9358, test_f1: 0.5217
 epoch: 3, train_loss: 0.9008, test_loss: 0.8758, test_f1: 0.5271
 epoch: 4, train_loss: 0.8865, test_loss: 0.9130, test_f1: 0.5458
 epoch: 5, train_loss: 0.8555, test_loss: 0.8664, test_f1: 0.5372
 epoch: 6, train_loss: 0.8440, test_loss: 0.8358, test_f1: 0.5688
 epoch: 7, train_loss: 0.8293, test_loss: 0.8661, test_f1: 0.5598
 epoch: 8, train_loss: 0.7970, test_loss: 0.8450, test_f1: 0.5539
 epoch: 9, train_loss: 0.7903, test_loss: 0.8437, test_f1: 0.5562
 epoch: 10, train_loss: 0.7803, test_loss: 0.8385, test_f1: 0.5696
 epoch: 11, train_loss: 0.7748, test_loss: 0.8270, test_f1: 0.5743
 epoch: 12, train_loss: 0.7597, test_loss: 0.8061, test_f1: 0.5774
 epoch: 13, train_loss: 0.7546, test_loss: 0.7940, test_f1: 0.5682
 epoch: 14, train_loss: 0.7444, test_loss: 0.7969, test_f1: 0.5660
 epoch: 15, train_loss: 0.7264, test_loss: 0.7805, test_f1: 0.5929
 epoch: 16, train_loss: 0.7177, test_loss: 0.7641, test_f1: 0.6130
 epoch: 17, train_loss: 0.7057, test_loss: 0.7667, test_f1: 0.6241
 epoch: 18, train_loss: 0.6859, test_loss: 0.8050, test_f1: 0.5631
 epoch: 19, train_loss: 0.6864, test_loss: 0.7889, test_f1: 0.6155
 epoch: 20, train_loss: 0.6836, test_loss: 0.7877, test_f1: 0.6095
 epoch: 21, train_loss: 0.6796, test_loss: 0.7775, test_f1: 0.5915
 epoch: 22, train_loss: 0.6692, test_loss: 0.8779, test_f1: 0.5815
 epoch: 23, train_loss: 0.6486, test_loss: 0.7840, test_f1: 0.5938
 epoch: 24, train_loss: 0.6455, test_loss: 0.8626, test_f1: 0.5769
 epoch: 25, train_loss: 0.6357, test_loss: 0.8145, test_f1: 0.5886
 epoch: 26, train_loss: 0.6343, test_loss: 0.7613, test_f1: 0.6282
 epoch: 27, train_loss: 0.6146, test_loss: 0.7296, test_f1: 0.6250
 epoch: 28, train_loss: 0.6065, test_loss: 0.7498, test_f1: 0.6339
 epoch: 29, train_loss: 0.6082, test_loss: 0.8607, test_f1: 0.5958
 epoch: 30, train_loss: 0.5999, test_loss: 0.7894, test_f1: 0.6134
 epoch: 31, train_loss: 0.6163, test_loss: 0.8603, test_f1: 0.5783
 epoch: 32, train_loss: 0.5909, test_loss: 0.8410, test_f1: 0.6066
 epoch: 33, train_loss: 0.5889, test_loss: 0.8712, test_f1: 0.5984
 epoch: 34, train_loss: 0.5817, test_loss: 0.8144, test_f1: 0.6305
 epoch: 35, train_loss: 0.5905, test_loss: 0.8278, test_f1: 0.5943
 epoch: 36, train_loss: 0.5482, test_loss: 0.8376, test_f1: 0.6163
 epoch: 37, train_loss: 0.5521, test_loss: 0.8901, test_f1: 0.6046
 epoch: 38, train_loss: 0.5749, test_loss: 0.8396, test_f1: 0.6254
 epoch: 39, train_loss: 0.5660, test_loss: 0.9383, test_f1: 0.5950
 epoch: 40, train_loss: 0.5519, test_loss: 0.8993, test_f1: 0.6033
 epoch: 41, train_loss: 0.5410, test_loss: 0.8649, test_f1: 0.6226
 epoch: 42, train_loss: 0.5386, test_loss: 0.8528, test_f1: 0.6178
 epoch: 43, train_loss: 0.5045, test_loss: 0.9367, test_f1: 0.6220
 epoch: 44, train_loss: 0.5330, test_loss: 0.8939, test_f1: 0.6306
 epoch: 45, train_loss: 0.5153, test_loss: 0.8751, test_f1: 0.6361
 epoch: 46, train_loss: 0.5027, test_loss: 0.9799, test_f1: 0.5988
 epoch: 47, train_loss: 0.4986, test_loss: 0.8641, test_f1: 0.6227
 epoch: 48, train_loss: 0.4742, test_loss: 0.8041, test_f1: 0.6578
 epoch: 49, train_loss: 0.4784, test_loss: 0.8101, test_f1: 0.6377
 epoch: 50, train_loss: 0.4736, test_loss: 1.0064, test_f1: 0.5996
 epoch: 51, train_loss: 0.4389, test_loss: 0.8983, test_f1: 0.6297
 epoch: 52, train_loss: 0.4217, test_loss: 0.9052, test_f1: 0.6186
 epoch: 53, train_loss: 0.4122, test_loss: 0.9202, test_f1: 0.6351
 epoch: 54, train_loss: 0.4127, test_loss: 0.9261, test_f1: 0.6254
 epoch: 55, train_loss: 0.4052, test_loss: 0.8987, test_f1: 0.6473
 epoch: 56, train_loss: 0.4044, test_loss: 0.9258, test_f1: 0.6453
 epoch: 57, train_loss: 0.4005, test_loss: 0.9100, test_f1: 0.6404
 epoch: 58, train_loss: 0.3952, test_loss: 1.0061, test_f1: 0.6462
 epoch: 59, train_loss: 0.3901, test_loss: 1.0181, test_f1: 0.6321
 epoch: 60, train_loss: 0.3938, test_loss: 0.9990, test_f1: 0.6253
 epoch: 61, train_loss: 0.3931, test_loss: 1.0237, test_f1: 0.6488
 epoch: 62, train_loss: 0.3803, test_loss: 1.0138, test_f1: 0.6458
 epoch: 63, train_loss: 0.3784, test_loss: 1.0981, test_f1: 0.6271
 epoch: 64, train_loss: 0.3678, test_loss: 1.0268, test_f1: 0.6355
 epoch: 65, train_loss: 0.3785, test_loss: 1.0287, test_f1: 0.6720
 epoch: 66, train_loss: 0.3579, test_loss: 1.0799, test_f1: 0.6401
 epoch: 67, train_loss: 0.3719, test_loss: 1.0829, test_f1: 0.6327
 epoch: 68, train_loss: 0.3647, test_loss: 1.1700, test_f1: 0.6259
 epoch: 69, train_loss: 0.3673, test_loss: 1.0991, test_f1: 0.6380
 epoch: 70, train_loss: 0.3700, test_loss: 1.1168, test_f1: 0.6236
 epoch: 71, train_loss: 0.3462, test_loss: 1.1848, test_f1: 0.6429
 epoch: 72, train_loss: 0.3537, test_loss: 1.1512, test_f1: 0.6497
 epoch: 73, train_loss: 0.3434, test_loss: 1.2668, test_f1: 0.6043
 epoch: 74, train_loss: 0.3427, test_loss: 1.1183, test_f1: 0.6676
 epoch: 75, train_loss: 0.3430, test_loss: 1.1989, test_f1: 0.6202
 epoch: 76, train_loss: 0.3256, test_loss: 1.0968, test_f1: 0.6569
 epoch: 77, train_loss: 0.3313, test_loss: 1.2691, test_f1: 0.6255
 epoch: 78, train_loss: 0.3420, test_loss: 1.0943, test_f1: 0.6431
 epoch: 79, train_loss: 0.3290, test_loss: 1.1325, test_f1: 0.6665
 epoch: 80, train_loss: 0.3402, test_loss: 1.1654, test_f1: 0.6862
 epoch: 81, train_loss: 0.3275, test_loss: 1.1725, test_f1: 0.6327
 epoch: 82, train_loss: 0.3275, test_loss: 1.1905, test_f1: 0.6201
 epoch: 83, train_loss: 0.3316, test_loss: 1.2047, test_f1: 0.6502
 epoch: 84, train_loss: 0.3172, test_loss: 1.1020, test_f1: 0.6678
 epoch: 85, train_loss: 0.3006, test_loss: 1.2197, test_f1: 0.6640
 epoch: 86, train_loss: 0.3003, test_loss: 1.2468, test_f1: 0.6544
 epoch: 87, train_loss: 0.3054, test_loss: 1.2613, test_f1: 0.6482
 epoch: 88, train_loss: 0.3160, test_loss: 1.2728, test_f1: 0.6352
 epoch: 89, train_loss: 0.3101, test_loss: 1.2914, test_f1: 0.6246
 epoch: 90, train_loss: 0.3092, test_loss: 1.2850, test_f1: 0.6428
 epoch: 91, train_loss: 0.3087, test_loss: 1.2867, test_f1: 0.6442
 epoch: 92, train_loss: 0.2897, test_loss: 1.4026, test_f1: 0.6234
 epoch: 93, train_loss: 0.2880, test_loss: 1.2646, test_f1: 0.6402
 epoch: 94, train_loss: 0.2896, test_loss: 1.3248, test_f1: 0.6610
 epoch: 95, train_loss: 0.2847, test_loss: 1.4418, test_f1: 0.6337
 epoch: 96, train_loss: 0.2993, test_loss: 1.3098, test_f1: 0.6511
 epoch: 97, train_loss: 0.2747, test_loss: 1.2914, test_f1: 0.6786
 epoch: 98, train_loss: 0.2933, test_loss: 1.3684, test_f1: 0.6444
 epoch: 99, train_loss: 0.2972, test_loss: 1.5013, test_f1: 0.6192
##################ITERATION #3 ****************************************
 epoch: 0, train_loss: 1.1882, test_loss: 1.0056, test_f1: 0.5184
 epoch: 1, train_loss: 0.9927, test_loss: 0.9369, test_f1: 0.5214
 epoch: 2, train_loss: 0.9336, test_loss: 0.9296, test_f1: 0.5045
 epoch: 3, train_loss: 0.8904, test_loss: 0.9076, test_f1: 0.5394
 epoch: 4, train_loss: 0.8747, test_loss: 0.8706, test_f1: 0.5886
 epoch: 5, train_loss: 0.8565, test_loss: 0.8940, test_f1: 0.5661
 epoch: 6, train_loss: 0.8318, test_loss: 0.8580, test_f1: 0.5982
 epoch: 7, train_loss: 0.8171, test_loss: 0.8763, test_f1: 0.5656
 epoch: 8, train_loss: 0.7989, test_loss: 0.8945, test_f1: 0.5276
 epoch: 9, train_loss: 0.7997, test_loss: 0.8345, test_f1: 0.5540
 epoch: 10, train_loss: 0.7799, test_loss: 0.8129, test_f1: 0.5752
 epoch: 11, train_loss: 0.7626, test_loss: 0.8149, test_f1: 0.5753
 epoch: 12, train_loss: 0.7563, test_loss: 0.8706, test_f1: 0.5897
 epoch: 13, train_loss: 0.7429, test_loss: 0.7793, test_f1: 0.5969
 epoch: 14, train_loss: 0.7224, test_loss: 0.8700, test_f1: 0.5867
 epoch: 15, train_loss: 0.7088, test_loss: 0.8616, test_f1: 0.5691
 epoch: 16, train_loss: 0.6999, test_loss: 0.8038, test_f1: 0.6195
 epoch: 17, train_loss: 0.7065, test_loss: 0.9163, test_f1: 0.5772
 epoch: 18, train_loss: 0.6767, test_loss: 0.8668, test_f1: 0.5718
 epoch: 19, train_loss: 0.6827, test_loss: 0.8800, test_f1: 0.6090
 epoch: 20, train_loss: 0.6751, test_loss: 0.8353, test_f1: 0.6030
 epoch: 21, train_loss: 0.6564, test_loss: 0.8424, test_f1: 0.5995
 epoch: 22, train_loss: 0.6544, test_loss: 0.9589, test_f1: 0.5917
 epoch: 23, train_loss: 0.6491, test_loss: 0.8111, test_f1: 0.6273
 epoch: 24, train_loss: 0.6386, test_loss: 0.8104, test_f1: 0.6304
 epoch: 25, train_loss: 0.6291, test_loss: 0.8809, test_f1: 0.5967
 epoch: 26, train_loss: 0.6307, test_loss: 0.8236, test_f1: 0.6221
 epoch: 27, train_loss: 0.6077, test_loss: 0.8935, test_f1: 0.6190
 epoch: 28, train_loss: 0.5994, test_loss: 0.9432, test_f1: 0.5991
 epoch: 29, train_loss: 0.6101, test_loss: 1.0319, test_f1: 0.5918
 epoch: 30, train_loss: 0.5951, test_loss: 0.9118, test_f1: 0.6016
 epoch: 31, train_loss: 0.5823, test_loss: 0.8333, test_f1: 0.6191
 epoch: 32, train_loss: 0.5618, test_loss: 1.0213, test_f1: 0.6141
 epoch: 33, train_loss: 0.5782, test_loss: 0.9884, test_f1: 0.6070
 epoch: 34, train_loss: 0.5669, test_loss: 0.8970, test_f1: 0.6235
 epoch: 35, train_loss: 0.5474, test_loss: 0.9115, test_f1: 0.6089
 epoch: 36, train_loss: 0.5555, test_loss: 0.8650, test_f1: 0.6393
 epoch: 37, train_loss: 0.5286, test_loss: 0.8871, test_f1: 0.6324
 epoch: 38, train_loss: 0.5457, test_loss: 0.8580, test_f1: 0.6371
 epoch: 39, train_loss: 0.5211, test_loss: 0.8799, test_f1: 0.6152
 epoch: 40, train_loss: 0.5296, test_loss: 0.9197, test_f1: 0.6283
 epoch: 41, train_loss: 0.5235, test_loss: 0.8787, test_f1: 0.6764
 epoch: 42, train_loss: 0.5070, test_loss: 0.9110, test_f1: 0.6441
 epoch: 43, train_loss: 0.5011, test_loss: 0.8722, test_f1: 0.6211
 epoch: 44, train_loss: 0.5099, test_loss: 0.9139, test_f1: 0.6335
 epoch: 45, train_loss: 0.5002, test_loss: 0.9480, test_f1: 0.6252
 epoch: 46, train_loss: 0.4914, test_loss: 0.9080, test_f1: 0.6403
 epoch: 47, train_loss: 0.4972, test_loss: 0.9516, test_f1: 0.6380
 epoch: 48, train_loss: 0.4924, test_loss: 0.9173, test_f1: 0.6078
 epoch: 49, train_loss: 0.4499, test_loss: 1.0511, test_f1: 0.6098
 epoch: 50, train_loss: 0.4628, test_loss: 0.9596, test_f1: 0.6395
 epoch: 51, train_loss: 0.4372, test_loss: 0.9529, test_f1: 0.6243
 epoch: 52, train_loss: 0.4082, test_loss: 1.0057, test_f1: 0.6580
 epoch: 53, train_loss: 0.3946, test_loss: 0.9831, test_f1: 0.6342
 epoch: 54, train_loss: 0.3853, test_loss: 1.0330, test_f1: 0.6356
 epoch: 55, train_loss: 0.3842, test_loss: 1.1455, test_f1: 0.6265
 epoch: 56, train_loss: 0.4015, test_loss: 0.9665, test_f1: 0.6373
 epoch: 57, train_loss: 0.3810, test_loss: 0.9433, test_f1: 0.6418
 epoch: 58, train_loss: 0.3860, test_loss: 1.1163, test_f1: 0.6366
 epoch: 59, train_loss: 0.3736, test_loss: 1.0619, test_f1: 0.6291
 epoch: 60, train_loss: 0.3689, test_loss: 1.0880, test_f1: 0.6317
 epoch: 61, train_loss: 0.3672, test_loss: 1.0688, test_f1: 0.6291
 epoch: 62, train_loss: 0.3671, test_loss: 1.0340, test_f1: 0.6430
 epoch: 63, train_loss: 0.3554, test_loss: 1.1389, test_f1: 0.6531
 epoch: 64, train_loss: 0.3609, test_loss: 1.0850, test_f1: 0.6774
 epoch: 65, train_loss: 0.3428, test_loss: 1.0467, test_f1: 0.6587
 epoch: 66, train_loss: 0.3495, test_loss: 1.0567, test_f1: 0.6354
 epoch: 67, train_loss: 0.3626, test_loss: 1.0513, test_f1: 0.6414
 epoch: 68, train_loss: 0.3519, test_loss: 1.2244, test_f1: 0.6384
 epoch: 69, train_loss: 0.3339, test_loss: 1.1027, test_f1: 0.6387
 epoch: 70, train_loss: 0.3241, test_loss: 1.2177, test_f1: 0.6503
 epoch: 71, train_loss: 0.3198, test_loss: 1.1465, test_f1: 0.6505
 epoch: 72, train_loss: 0.3300, test_loss: 1.1576, test_f1: 0.6350
 epoch: 73, train_loss: 0.3384, test_loss: 1.1814, test_f1: 0.6561
 epoch: 74, train_loss: 0.3207, test_loss: 1.1703, test_f1: 0.6478
 epoch: 75, train_loss: 0.3266, test_loss: 1.1697, test_f1: 0.6616
 epoch: 76, train_loss: 0.3155, test_loss: 1.1428, test_f1: 0.6592
 epoch: 77, train_loss: 0.3178, test_loss: 1.1791, test_f1: 0.6467
 epoch: 78, train_loss: 0.3192, test_loss: 1.2206, test_f1: 0.6473
 epoch: 79, train_loss: 0.3083, test_loss: 1.1222, test_f1: 0.6562
 epoch: 80, train_loss: 0.3180, test_loss: 1.2232, test_f1: 0.6691
 epoch: 81, train_loss: 0.3062, test_loss: 1.3443, test_f1: 0.6397
 epoch: 82, train_loss: 0.3129, test_loss: 1.1090, test_f1: 0.6489
 epoch: 83, train_loss: 0.3055, test_loss: 1.2306, test_f1: 0.6307
 epoch: 84, train_loss: 0.3079, test_loss: 1.2147, test_f1: 0.6629
 epoch: 85, train_loss: 0.2825, test_loss: 1.2087, test_f1: 0.6465
 epoch: 86, train_loss: 0.2905, test_loss: 1.2734, test_f1: 0.6452
 epoch: 87, train_loss: 0.2704, test_loss: 1.2976, test_f1: 0.6335
 epoch: 88, train_loss: 0.2689, test_loss: 1.2210, test_f1: 0.6567
 epoch: 89, train_loss: 0.2642, test_loss: 1.2725, test_f1: 0.6577
 epoch: 90, train_loss: 0.3010, test_loss: 1.2021, test_f1: 0.6652
 epoch: 91, train_loss: 0.2850, test_loss: 1.3363, test_f1: 0.6572
 epoch: 92, train_loss: 0.2695, test_loss: 1.3070, test_f1: 0.6428
 epoch: 93, train_loss: 0.2655, test_loss: 1.4068, test_f1: 0.6479
 epoch: 94, train_loss: 0.2521, test_loss: 1.2814, test_f1: 0.6542
 epoch: 95, train_loss: 0.2736, test_loss: 1.2665, test_f1: 0.6412
 epoch: 96, train_loss: 0.2725, test_loss: 1.3222, test_f1: 0.6514
 epoch: 97, train_loss: 0.2585, test_loss: 1.3273, test_f1: 0.6516
 epoch: 98, train_loss: 0.2846, test_loss: 1.3900, test_f1: 0.6427
 epoch: 99, train_loss: 0.2727, test_loss: 1.4215, test_f1: 0.6367
##################ITERATION #4 ****************************************
 epoch: 0, train_loss: 1.2114, test_loss: 1.0454, test_f1: 0.4633
 epoch: 1, train_loss: 0.9789, test_loss: 0.9538, test_f1: 0.5133
 epoch: 2, train_loss: 0.9281, test_loss: 0.9724, test_f1: 0.5072
 epoch: 3, train_loss: 0.8904, test_loss: 0.9025, test_f1: 0.5301
 epoch: 4, train_loss: 0.8760, test_loss: 0.8760, test_f1: 0.5648
 epoch: 5, train_loss: 0.8582, test_loss: 0.9198, test_f1: 0.5677
 epoch: 6, train_loss: 0.8366, test_loss: 0.8601, test_f1: 0.5559
 epoch: 7, train_loss: 0.8297, test_loss: 0.8787, test_f1: 0.5491
 epoch: 8, train_loss: 0.8095, test_loss: 0.8435, test_f1: 0.5787
 epoch: 9, train_loss: 0.7800, test_loss: 0.8712, test_f1: 0.5824
 epoch: 10, train_loss: 0.7856, test_loss: 0.8518, test_f1: 0.6098
 epoch: 11, train_loss: 0.7643, test_loss: 0.8684, test_f1: 0.5921
 epoch: 12, train_loss: 0.7468, test_loss: 0.8711, test_f1: 0.6036
 epoch: 13, train_loss: 0.7463, test_loss: 0.8560, test_f1: 0.6057
 epoch: 14, train_loss: 0.7154, test_loss: 0.8600, test_f1: 0.5820
 epoch: 15, train_loss: 0.7110, test_loss: 0.8598, test_f1: 0.6016
 epoch: 16, train_loss: 0.7112, test_loss: 0.7631, test_f1: 0.6434
 epoch: 17, train_loss: 0.6862, test_loss: 0.7906, test_f1: 0.6408
 epoch: 18, train_loss: 0.6936, test_loss: 0.7773, test_f1: 0.6314
 epoch: 19, train_loss: 0.6711, test_loss: 0.9034, test_f1: 0.6127
 epoch: 20, train_loss: 0.6632, test_loss: 0.8428, test_f1: 0.6168
 epoch: 21, train_loss: 0.6503, test_loss: 0.8300, test_f1: 0.6393
 epoch: 22, train_loss: 0.6532, test_loss: 0.8312, test_f1: 0.6367
 epoch: 23, train_loss: 0.6421, test_loss: 0.8050, test_f1: 0.6421
 epoch: 24, train_loss: 0.6350, test_loss: 0.7974, test_f1: 0.6551
 epoch: 25, train_loss: 0.6200, test_loss: 0.8191, test_f1: 0.6739
 epoch: 26, train_loss: 0.6180, test_loss: 0.8198, test_f1: 0.6367
 epoch: 27, train_loss: 0.6060, test_loss: 0.7973, test_f1: 0.6602
 epoch: 28, train_loss: 0.5896, test_loss: 0.8575, test_f1: 0.6345
 epoch: 29, train_loss: 0.5896, test_loss: 0.8509, test_f1: 0.6365
 epoch: 30, train_loss: 0.5694, test_loss: 0.8365, test_f1: 0.6413
 epoch: 31, train_loss: 0.5869, test_loss: 0.7825, test_f1: 0.6592
 epoch: 32, train_loss: 0.5565, test_loss: 0.8110, test_f1: 0.6747
 epoch: 33, train_loss: 0.5534, test_loss: 0.7917, test_f1: 0.6812
 epoch: 34, train_loss: 0.5652, test_loss: 0.9042, test_f1: 0.6361
 epoch: 35, train_loss: 0.5430, test_loss: 0.8332, test_f1: 0.6462
 epoch: 36, train_loss: 0.5314, test_loss: 0.9169, test_f1: 0.6334
 epoch: 37, train_loss: 0.5196, test_loss: 0.8710, test_f1: 0.6552
 epoch: 38, train_loss: 0.5325, test_loss: 0.8836, test_f1: 0.6452
 epoch: 39, train_loss: 0.5228, test_loss: 0.9943, test_f1: 0.6296
 epoch: 40, train_loss: 0.5202, test_loss: 1.0221, test_f1: 0.6144
 epoch: 41, train_loss: 0.5021, test_loss: 1.0163, test_f1: 0.6111
 epoch: 42, train_loss: 0.5009, test_loss: 0.9106, test_f1: 0.6493
 epoch: 43, train_loss: 0.4978, test_loss: 0.9193, test_f1: 0.6576
 epoch: 44, train_loss: 0.4850, test_loss: 0.9149, test_f1: 0.6665
 epoch: 45, train_loss: 0.4851, test_loss: 1.0095, test_f1: 0.6010
 epoch: 46, train_loss: 0.4927, test_loss: 1.0051, test_f1: 0.6442
 epoch: 47, train_loss: 0.4910, test_loss: 1.0633, test_f1: 0.6057
 epoch: 48, train_loss: 0.4584, test_loss: 0.9660, test_f1: 0.6428
 epoch: 49, train_loss: 0.4758, test_loss: 0.8896, test_f1: 0.6705
 epoch: 50, train_loss: 0.4482, test_loss: 1.0002, test_f1: 0.6410
 epoch: 51, train_loss: 0.4117, test_loss: 0.9420, test_f1: 0.6812
 epoch: 52, train_loss: 0.4069, test_loss: 1.0157, test_f1: 0.6692
 epoch: 53, train_loss: 0.3783, test_loss: 0.9890, test_f1: 0.6591
 epoch: 54, train_loss: 0.3776, test_loss: 0.9927, test_f1: 0.6497
 epoch: 55, train_loss: 0.3889, test_loss: 1.0160, test_f1: 0.6584
 epoch: 56, train_loss: 0.3564, test_loss: 1.0084, test_f1: 0.6512
 epoch: 57, train_loss: 0.3697, test_loss: 1.0589, test_f1: 0.6590
 epoch: 58, train_loss: 0.3455, test_loss: 1.0795, test_f1: 0.6668
 epoch: 59, train_loss: 0.3545, test_loss: 0.9678, test_f1: 0.6655
 epoch: 60, train_loss: 0.3612, test_loss: 1.0084, test_f1: 0.6561
 epoch: 61, train_loss: 0.3492, test_loss: 1.0364, test_f1: 0.6589
 epoch: 62, train_loss: 0.3302, test_loss: 1.2045, test_f1: 0.6690
 epoch: 63, train_loss: 0.3461, test_loss: 1.1009, test_f1: 0.6668
 epoch: 64, train_loss: 0.3362, test_loss: 1.0333, test_f1: 0.6569
 epoch: 65, train_loss: 0.3326, test_loss: 1.1598, test_f1: 0.6407
 epoch: 66, train_loss: 0.3236, test_loss: 1.1093, test_f1: 0.6576
 epoch: 67, train_loss: 0.3312, test_loss: 1.1494, test_f1: 0.6583
 epoch: 68, train_loss: 0.3319, test_loss: 1.1007, test_f1: 0.6698
 epoch: 69, train_loss: 0.3303, test_loss: 1.0569, test_f1: 0.6715
 epoch: 70, train_loss: 0.3131, test_loss: 1.1019, test_f1: 0.6515
 epoch: 71, train_loss: 0.3120, test_loss: 1.1844, test_f1: 0.6559
 epoch: 72, train_loss: 0.3132, test_loss: 1.1472, test_f1: 0.6616
 epoch: 73, train_loss: 0.3238, test_loss: 1.0531, test_f1: 0.6714
 epoch: 74, train_loss: 0.3034, test_loss: 1.1141, test_f1: 0.6671
 epoch: 75, train_loss: 0.2968, test_loss: 1.3570, test_f1: 0.6449
 epoch: 76, train_loss: 0.3073, test_loss: 1.2341, test_f1: 0.6699
 epoch: 77, train_loss: 0.3065, test_loss: 1.2472, test_f1: 0.6559
 epoch: 78, train_loss: 0.3026, test_loss: 1.2407, test_f1: 0.6751
 epoch: 79, train_loss: 0.2991, test_loss: 1.2369, test_f1: 0.6580
 epoch: 80, train_loss: 0.2995, test_loss: 1.1374, test_f1: 0.6670
 epoch: 81, train_loss: 0.2794, test_loss: 1.1673, test_f1: 0.6781
 epoch: 82, train_loss: 0.2996, test_loss: 1.1992, test_f1: 0.6673
 epoch: 83, train_loss: 0.2893, test_loss: 1.2602, test_f1: 0.6823
 epoch: 84, train_loss: 0.3033, test_loss: 1.1942, test_f1: 0.6700
 epoch: 85, train_loss: 0.2718, test_loss: 1.3557, test_f1: 0.6538
 epoch: 86, train_loss: 0.2817, test_loss: 1.3160, test_f1: 0.6658
 epoch: 87, train_loss: 0.2668, test_loss: 1.3714, test_f1: 0.6709
 epoch: 88, train_loss: 0.2693, test_loss: 1.3226, test_f1: 0.6733
 epoch: 89, train_loss: 0.2742, test_loss: 1.4554, test_f1: 0.6485
 epoch: 90, train_loss: 0.2797, test_loss: 1.2670, test_f1: 0.6612
 epoch: 91, train_loss: 0.2658, test_loss: 1.3335, test_f1: 0.6917
 epoch: 92, train_loss: 0.2700, test_loss: 1.3858, test_f1: 0.6626
 epoch: 93, train_loss: 0.2724, test_loss: 1.3191, test_f1: 0.6707
 epoch: 94, train_loss: 0.2489, test_loss: 1.4048, test_f1: 0.6744
 epoch: 95, train_loss: 0.2599, test_loss: 1.5557, test_f1: 0.6570
 epoch: 96, train_loss: 0.2406, test_loss: 1.3313, test_f1: 0.6910
 epoch: 97, train_loss: 0.2506, test_loss: 1.3371, test_f1: 0.6807
 epoch: 98, train_loss: 0.2486, test_loss: 1.4060, test_f1: 0.6842
 epoch: 99, train_loss: 0.2274, test_loss: 1.4469, test_f1: 0.6727
##################ITERATION #5 ****************************************
 epoch: 0, train_loss: 1.2383, test_loss: 1.0522, test_f1: 0.4181
 epoch: 1, train_loss: 0.9810, test_loss: 0.9400, test_f1: 0.5309
 epoch: 2, train_loss: 0.9273, test_loss: 0.9148, test_f1: 0.5749
 epoch: 3, train_loss: 0.9103, test_loss: 0.9453, test_f1: 0.5249
 epoch: 4, train_loss: 0.8857, test_loss: 0.8366, test_f1: 0.5696
 epoch: 5, train_loss: 0.8544, test_loss: 0.8881, test_f1: 0.5966
 epoch: 6, train_loss: 0.8375, test_loss: 0.9333, test_f1: 0.5514
 epoch: 7, train_loss: 0.8152, test_loss: 0.9045, test_f1: 0.5814
 epoch: 8, train_loss: 0.7870, test_loss: 0.9027, test_f1: 0.5841
 epoch: 9, train_loss: 0.7843, test_loss: 0.9660, test_f1: 0.5485
 epoch: 10, train_loss: 0.7657, test_loss: 0.9252, test_f1: 0.5623
 epoch: 11, train_loss: 0.7515, test_loss: 0.9178, test_f1: 0.5990
 epoch: 12, train_loss: 0.7496, test_loss: 0.9004, test_f1: 0.5903
 epoch: 13, train_loss: 0.7397, test_loss: 0.8449, test_f1: 0.6037
 epoch: 14, train_loss: 0.7186, test_loss: 0.8809, test_f1: 0.5679
 epoch: 15, train_loss: 0.7331, test_loss: 0.8911, test_f1: 0.5735
 epoch: 16, train_loss: 0.7100, test_loss: 0.8316, test_f1: 0.6171
 epoch: 17, train_loss: 0.6890, test_loss: 0.8388, test_f1: 0.6096
 epoch: 18, train_loss: 0.6962, test_loss: 0.9106, test_f1: 0.5752
 epoch: 19, train_loss: 0.6656, test_loss: 0.8467, test_f1: 0.6028
 epoch: 20, train_loss: 0.6711, test_loss: 1.0218, test_f1: 0.5788
 epoch: 21, train_loss: 0.6549, test_loss: 0.8584, test_f1: 0.6379
 epoch: 22, train_loss: 0.6466, test_loss: 0.8037, test_f1: 0.6338
 epoch: 23, train_loss: 0.6350, test_loss: 0.8218, test_f1: 0.6268
 epoch: 24, train_loss: 0.6461, test_loss: 0.8412, test_f1: 0.6265
 epoch: 25, train_loss: 0.6154, test_loss: 0.7956, test_f1: 0.6219
 epoch: 26, train_loss: 0.6124, test_loss: 0.8452, test_f1: 0.5909
 epoch: 27, train_loss: 0.5860, test_loss: 0.8390, test_f1: 0.6081
 epoch: 28, train_loss: 0.5966, test_loss: 0.8645, test_f1: 0.6355
 epoch: 29, train_loss: 0.5713, test_loss: 0.8839, test_f1: 0.6357
 epoch: 30, train_loss: 0.5611, test_loss: 0.8659, test_f1: 0.6426
 epoch: 31, train_loss: 0.5882, test_loss: 0.8897, test_f1: 0.6119
 epoch: 32, train_loss: 0.5768, test_loss: 0.8048, test_f1: 0.6456
 epoch: 33, train_loss: 0.5763, test_loss: 0.9671, test_f1: 0.5889
 epoch: 34, train_loss: 0.5466, test_loss: 0.8951, test_f1: 0.6057
 epoch: 35, train_loss: 0.5740, test_loss: 0.8203, test_f1: 0.6274
 epoch: 36, train_loss: 0.5377, test_loss: 0.8577, test_f1: 0.6302
 epoch: 37, train_loss: 0.5480, test_loss: 0.9724, test_f1: 0.6155
 epoch: 38, train_loss: 0.5276, test_loss: 0.8906, test_f1: 0.6207
 epoch: 39, train_loss: 0.5108, test_loss: 0.9595, test_f1: 0.6254
 epoch: 40, train_loss: 0.5116, test_loss: 0.8543, test_f1: 0.6453
 epoch: 41, train_loss: 0.5029, test_loss: 0.8602, test_f1: 0.6473
 epoch: 42, train_loss: 0.5179, test_loss: 0.8455, test_f1: 0.6402
 epoch: 43, train_loss: 0.4857, test_loss: 0.9430, test_f1: 0.6190
 epoch: 44, train_loss: 0.4925, test_loss: 0.9762, test_f1: 0.5964
 epoch: 45, train_loss: 0.5035, test_loss: 0.9347, test_f1: 0.6312
 epoch: 46, train_loss: 0.4939, test_loss: 0.8807, test_f1: 0.6216
 epoch: 47, train_loss: 0.4740, test_loss: 1.0331, test_f1: 0.6070
 epoch: 48, train_loss: 0.4884, test_loss: 0.9320, test_f1: 0.6280
 epoch: 49, train_loss: 0.4583, test_loss: 0.9936, test_f1: 0.6067
 epoch: 50, train_loss: 0.4686, test_loss: 0.9217, test_f1: 0.6344
 epoch: 51, train_loss: 0.4591, test_loss: 0.9456, test_f1: 0.6309
 epoch: 52, train_loss: 0.4166, test_loss: 0.8843, test_f1: 0.6527
 epoch: 53, train_loss: 0.4215, test_loss: 0.9291, test_f1: 0.6440
 epoch: 54, train_loss: 0.3874, test_loss: 1.0105, test_f1: 0.6307
 epoch: 55, train_loss: 0.3811, test_loss: 0.9523, test_f1: 0.6468
 epoch: 56, train_loss: 0.3886, test_loss: 0.9811, test_f1: 0.6197
 epoch: 57, train_loss: 0.3876, test_loss: 0.9307, test_f1: 0.6452
 epoch: 58, train_loss: 0.3825, test_loss: 1.0000, test_f1: 0.6468
 epoch: 59, train_loss: 0.3746, test_loss: 0.9667, test_f1: 0.6688
 epoch: 60, train_loss: 0.3597, test_loss: 1.0222, test_f1: 0.6396
 epoch: 61, train_loss: 0.3466, test_loss: 1.0130, test_f1: 0.6492
 epoch: 62, train_loss: 0.3636, test_loss: 1.0812, test_f1: 0.6460
 epoch: 63, train_loss: 0.3610, test_loss: 0.9958, test_f1: 0.6479
 epoch: 64, train_loss: 0.3566, test_loss: 1.0050, test_f1: 0.6543
 epoch: 65, train_loss: 0.3596, test_loss: 1.0995, test_f1: 0.6403
 epoch: 66, train_loss: 0.3425, test_loss: 1.0410, test_f1: 0.6753
 epoch: 67, train_loss: 0.3412, test_loss: 1.0973, test_f1: 0.6399
 epoch: 68, train_loss: 0.3213, test_loss: 1.0920, test_f1: 0.6580
 epoch: 69, train_loss: 0.3486, test_loss: 1.0820, test_f1: 0.6369
 epoch: 70, train_loss: 0.3312, test_loss: 1.1475, test_f1: 0.6179
 epoch: 71, train_loss: 0.3520, test_loss: 1.2862, test_f1: 0.6208
 epoch: 72, train_loss: 0.3393, test_loss: 1.0617, test_f1: 0.6514
 epoch: 73, train_loss: 0.3236, test_loss: 1.1536, test_f1: 0.6392
 epoch: 74, train_loss: 0.3251, test_loss: 1.1318, test_f1: 0.6411
 epoch: 75, train_loss: 0.3277, test_loss: 1.2152, test_f1: 0.6156
 epoch: 76, train_loss: 0.3114, test_loss: 1.1299, test_f1: 0.6394
 epoch: 77, train_loss: 0.3191, test_loss: 1.2781, test_f1: 0.6037
 epoch: 78, train_loss: 0.3100, test_loss: 1.1746, test_f1: 0.6381
 epoch: 79, train_loss: 0.3178, test_loss: 1.1248, test_f1: 0.6537
 epoch: 80, train_loss: 0.3054, test_loss: 1.1743, test_f1: 0.6407
 epoch: 81, train_loss: 0.3249, test_loss: 1.2459, test_f1: 0.6220
 epoch: 82, train_loss: 0.3217, test_loss: 1.1910, test_f1: 0.6239
 epoch: 83, train_loss: 0.3173, test_loss: 1.2199, test_f1: 0.6508
 epoch: 84, train_loss: 0.3047, test_loss: 1.1745, test_f1: 0.6589
 epoch: 85, train_loss: 0.2926, test_loss: 1.4781, test_f1: 0.6013
 epoch: 86, train_loss: 0.2983, test_loss: 1.1401, test_f1: 0.6334
 epoch: 87, train_loss: 0.3013, test_loss: 1.3718, test_f1: 0.6214
 epoch: 88, train_loss: 0.2821, test_loss: 1.2571, test_f1: 0.6668
 epoch: 89, train_loss: 0.3036, test_loss: 1.3039, test_f1: 0.6406
 epoch: 90, train_loss: 0.3021, test_loss: 1.4121, test_f1: 0.6227
 epoch: 91, train_loss: 0.2691, test_loss: 1.1453, test_f1: 0.6407
 epoch: 92, train_loss: 0.2877, test_loss: 1.1970, test_f1: 0.6636
 epoch: 93, train_loss: 0.2773, test_loss: 1.2705, test_f1: 0.6273
 epoch: 94, train_loss: 0.2696, test_loss: 1.2805, test_f1: 0.6396
 epoch: 95, train_loss: 0.2774, test_loss: 1.3171, test_f1: 0.6591
 epoch: 96, train_loss: 0.2640, test_loss: 1.2214, test_f1: 0.6396
 epoch: 97, train_loss: 0.2896, test_loss: 1.1295, test_f1: 0.6646
 epoch: 98, train_loss: 0.2654, test_loss: 1.4503, test_f1: 0.6156
 epoch: 99, train_loss: 0.2709, test_loss: 1.3366, test_f1: 0.6276
##################ITERATION #6 ****************************************
 epoch: 0, train_loss: 1.3254, test_loss: 1.0182, test_f1: 0.4215
 epoch: 1, train_loss: 0.9921, test_loss: 0.9632, test_f1: 0.5380
 epoch: 2, train_loss: 0.9581, test_loss: 0.9540, test_f1: 0.5327
 epoch: 3, train_loss: 0.9359, test_loss: 0.9411, test_f1: 0.4875
 epoch: 4, train_loss: 0.8896, test_loss: 0.9385, test_f1: 0.5243
 epoch: 5, train_loss: 0.8872, test_loss: 0.9474, test_f1: 0.5497
 epoch: 6, train_loss: 0.8604, test_loss: 0.9019, test_f1: 0.5874
 epoch: 7, train_loss: 0.8415, test_loss: 0.9171, test_f1: 0.6007
 epoch: 8, train_loss: 0.8276, test_loss: 0.8923, test_f1: 0.5887
 epoch: 9, train_loss: 0.8228, test_loss: 0.8624, test_f1: 0.6174
 epoch: 10, train_loss: 0.8116, test_loss: 0.8262, test_f1: 0.6050
 epoch: 11, train_loss: 0.7819, test_loss: 0.8534, test_f1: 0.6218
 epoch: 12, train_loss: 0.7659, test_loss: 0.8363, test_f1: 0.5834
 epoch: 13, train_loss: 0.7668, test_loss: 0.8283, test_f1: 0.6151
 epoch: 14, train_loss: 0.7463, test_loss: 0.8063, test_f1: 0.6362
 epoch: 15, train_loss: 0.7541, test_loss: 0.9030, test_f1: 0.6071
 epoch: 16, train_loss: 0.7441, test_loss: 0.8300, test_f1: 0.6133
 epoch: 17, train_loss: 0.7416, test_loss: 0.8751, test_f1: 0.6057
 epoch: 18, train_loss: 0.7105, test_loss: 0.7862, test_f1: 0.5981
 epoch: 19, train_loss: 0.7110, test_loss: 0.8103, test_f1: 0.6429
 epoch: 20, train_loss: 0.7018, test_loss: 0.8553, test_f1: 0.6252
 epoch: 21, train_loss: 0.6779, test_loss: 0.8624, test_f1: 0.6027
 epoch: 22, train_loss: 0.6780, test_loss: 0.8506, test_f1: 0.6122
 epoch: 23, train_loss: 0.6584, test_loss: 0.8302, test_f1: 0.6084
 epoch: 24, train_loss: 0.6590, test_loss: 0.8515, test_f1: 0.6118
 epoch: 25, train_loss: 0.6568, test_loss: 0.8321, test_f1: 0.6241
 epoch: 26, train_loss: 0.6324, test_loss: 0.8599, test_f1: 0.6334
 epoch: 27, train_loss: 0.6286, test_loss: 0.8906, test_f1: 0.6082
 epoch: 28, train_loss: 0.6370, test_loss: 0.8204, test_f1: 0.6371
 epoch: 29, train_loss: 0.6279, test_loss: 0.9563, test_f1: 0.6136
 epoch: 30, train_loss: 0.6128, test_loss: 0.8813, test_f1: 0.6255
 epoch: 31, train_loss: 0.6290, test_loss: 0.8824, test_f1: 0.6178
 epoch: 32, train_loss: 0.6105, test_loss: 0.8320, test_f1: 0.6514
 epoch: 33, train_loss: 0.5970, test_loss: 0.8941, test_f1: 0.6356
 epoch: 34, train_loss: 0.5749, test_loss: 0.8229, test_f1: 0.6334
 epoch: 35, train_loss: 0.5771, test_loss: 0.8657, test_f1: 0.6345
 epoch: 36, train_loss: 0.5623, test_loss: 0.9864, test_f1: 0.6351
 epoch: 37, train_loss: 0.5683, test_loss: 0.8620, test_f1: 0.6575
 epoch: 38, train_loss: 0.5581, test_loss: 0.8999, test_f1: 0.6067
 epoch: 39, train_loss: 0.5654, test_loss: 0.8812, test_f1: 0.6467
 epoch: 40, train_loss: 0.5342, test_loss: 0.8751, test_f1: 0.6575
 epoch: 41, train_loss: 0.5660, test_loss: 0.8257, test_f1: 0.6823
 epoch: 42, train_loss: 0.5612, test_loss: 0.8600, test_f1: 0.6498
 epoch: 43, train_loss: 0.5354, test_loss: 0.8388, test_f1: 0.6565
 epoch: 44, train_loss: 0.5163, test_loss: 0.8445, test_f1: 0.6543
 epoch: 45, train_loss: 0.5046, test_loss: 0.9206, test_f1: 0.6327
 epoch: 46, train_loss: 0.4964, test_loss: 0.8796, test_f1: 0.6317
 epoch: 47, train_loss: 0.5068, test_loss: 0.9247, test_f1: 0.6304
 epoch: 48, train_loss: 0.5012, test_loss: 0.9050, test_f1: 0.6336
 epoch: 49, train_loss: 0.4809, test_loss: 0.9576, test_f1: 0.6281
 epoch: 50, train_loss: 0.5164, test_loss: 0.9303, test_f1: 0.6343
 epoch: 51, train_loss: 0.4563, test_loss: 0.9146, test_f1: 0.6503
 epoch: 52, train_loss: 0.4500, test_loss: 0.9143, test_f1: 0.6463
 epoch: 53, train_loss: 0.4410, test_loss: 0.9419, test_f1: 0.6749
 epoch: 54, train_loss: 0.4411, test_loss: 0.9183, test_f1: 0.6504
 epoch: 55, train_loss: 0.4100, test_loss: 0.9748, test_f1: 0.6458
 epoch: 56, train_loss: 0.4042, test_loss: 0.9250, test_f1: 0.6603
 epoch: 57, train_loss: 0.4005, test_loss: 0.9366, test_f1: 0.6619
 epoch: 58, train_loss: 0.4015, test_loss: 1.0912, test_f1: 0.6412
 epoch: 59, train_loss: 0.4035, test_loss: 0.9995, test_f1: 0.6368
 epoch: 60, train_loss: 0.4018, test_loss: 0.9717, test_f1: 0.6375
 epoch: 61, train_loss: 0.3845, test_loss: 0.9725, test_f1: 0.6532
 epoch: 62, train_loss: 0.3868, test_loss: 1.0013, test_f1: 0.6493
 epoch: 63, train_loss: 0.3913, test_loss: 1.0834, test_f1: 0.6388
 epoch: 64, train_loss: 0.3931, test_loss: 1.0018, test_f1: 0.6484
 epoch: 65, train_loss: 0.3643, test_loss: 1.0225, test_f1: 0.6407
 epoch: 66, train_loss: 0.3726, test_loss: 1.1074, test_f1: 0.6587
 epoch: 67, train_loss: 0.3861, test_loss: 1.0434, test_f1: 0.6462
 epoch: 68, train_loss: 0.3677, test_loss: 0.9760, test_f1: 0.6546
 epoch: 69, train_loss: 0.3556, test_loss: 1.1607, test_f1: 0.6508
 epoch: 70, train_loss: 0.3633, test_loss: 1.0637, test_f1: 0.6525
 epoch: 71, train_loss: 0.3572, test_loss: 1.0623, test_f1: 0.6515
 epoch: 72, train_loss: 0.3682, test_loss: 1.1108, test_f1: 0.6441
 epoch: 73, train_loss: 0.3482, test_loss: 1.2865, test_f1: 0.6257
 epoch: 74, train_loss: 0.3560, test_loss: 1.0669, test_f1: 0.6239
 epoch: 75, train_loss: 0.3441, test_loss: 1.2021, test_f1: 0.6583
 epoch: 76, train_loss: 0.3450, test_loss: 1.1025, test_f1: 0.6580
 epoch: 77, train_loss: 0.3339, test_loss: 1.1513, test_f1: 0.6564
 epoch: 78, train_loss: 0.3386, test_loss: 1.1246, test_f1: 0.6440
 epoch: 79, train_loss: 0.3256, test_loss: 1.1605, test_f1: 0.6622
 epoch: 80, train_loss: 0.3342, test_loss: 1.0080, test_f1: 0.6528
 epoch: 81, train_loss: 0.3487, test_loss: 1.1069, test_f1: 0.6867
 epoch: 82, train_loss: 0.3321, test_loss: 1.0990, test_f1: 0.6605
 epoch: 83, train_loss: 0.3349, test_loss: 1.0496, test_f1: 0.6518
 epoch: 84, train_loss: 0.3349, test_loss: 1.0755, test_f1: 0.6671
 epoch: 85, train_loss: 0.3290, test_loss: 1.0748, test_f1: 0.6911
 epoch: 86, train_loss: 0.3330, test_loss: 1.2233, test_f1: 0.6793
 epoch: 87, train_loss: 0.3286, test_loss: 1.0802, test_f1: 0.6731
 epoch: 88, train_loss: 0.3222, test_loss: 1.2824, test_f1: 0.6676
 epoch: 89, train_loss: 0.3056, test_loss: 1.1451, test_f1: 0.6655
 epoch: 90, train_loss: 0.3198, test_loss: 1.3001, test_f1: 0.6549
 epoch: 91, train_loss: 0.3126, test_loss: 1.1672, test_f1: 0.6673
 epoch: 92, train_loss: 0.3196, test_loss: 1.2355, test_f1: 0.6552
 epoch: 93, train_loss: 0.3180, test_loss: 1.3725, test_f1: 0.6586
 epoch: 94, train_loss: 0.3114, test_loss: 1.1634, test_f1: 0.6606
 epoch: 95, train_loss: 0.2935, test_loss: 1.1553, test_f1: 0.6671
 epoch: 96, train_loss: 0.2955, test_loss: 1.2069, test_f1: 0.6838
 epoch: 97, train_loss: 0.2868, test_loss: 1.2552, test_f1: 0.6441
 epoch: 98, train_loss: 0.2981, test_loss: 1.2663, test_f1: 0.6739
 epoch: 99, train_loss: 0.3021, test_loss: 1.2564, test_f1: 0.6582
##################ITERATION #7 ****************************************
 epoch: 0, train_loss: 1.2512, test_loss: 1.0229, test_f1: 0.4094
 epoch: 1, train_loss: 1.0048, test_loss: 0.9648, test_f1: 0.5107
 epoch: 2, train_loss: 0.9679, test_loss: 0.9472, test_f1: 0.5233
 epoch: 3, train_loss: 0.9271, test_loss: 0.9378, test_f1: 0.4686
 epoch: 4, train_loss: 0.9046, test_loss: 0.9197, test_f1: 0.5484
 epoch: 5, train_loss: 0.8800, test_loss: 0.8999, test_f1: 0.5555
 epoch: 6, train_loss: 0.8520, test_loss: 0.8903, test_f1: 0.5353
 epoch: 7, train_loss: 0.8364, test_loss: 0.8824, test_f1: 0.5803
 epoch: 8, train_loss: 0.8201, test_loss: 0.9131, test_f1: 0.5704
 epoch: 9, train_loss: 0.7907, test_loss: 0.8806, test_f1: 0.5780
 epoch: 10, train_loss: 0.7747, test_loss: 0.8512, test_f1: 0.5861
 epoch: 11, train_loss: 0.7641, test_loss: 0.9320, test_f1: 0.5775
 epoch: 12, train_loss: 0.7477, test_loss: 0.8413, test_f1: 0.6117
 epoch: 13, train_loss: 0.7501, test_loss: 0.8082, test_f1: 0.5839
 epoch: 14, train_loss: 0.7325, test_loss: 0.8461, test_f1: 0.6161
 epoch: 15, train_loss: 0.7050, test_loss: 0.8638, test_f1: 0.6164
 epoch: 16, train_loss: 0.6993, test_loss: 0.8240, test_f1: 0.5976
 epoch: 17, train_loss: 0.6926, test_loss: 0.8413, test_f1: 0.5936
 epoch: 18, train_loss: 0.6858, test_loss: 0.8425, test_f1: 0.6030
 epoch: 19, train_loss: 0.6701, test_loss: 0.8086, test_f1: 0.6119
 epoch: 20, train_loss: 0.6692, test_loss: 0.8478, test_f1: 0.6164
 epoch: 21, train_loss: 0.6637, test_loss: 0.8536, test_f1: 0.6244
 epoch: 22, train_loss: 0.6373, test_loss: 0.7668, test_f1: 0.6441
 epoch: 23, train_loss: 0.6296, test_loss: 0.7566, test_f1: 0.6530
 epoch: 24, train_loss: 0.6129, test_loss: 0.8447, test_f1: 0.6135
 epoch: 25, train_loss: 0.6164, test_loss: 0.8137, test_f1: 0.6390
 epoch: 26, train_loss: 0.6030, test_loss: 0.9681, test_f1: 0.5747
 epoch: 27, train_loss: 0.6011, test_loss: 0.8032, test_f1: 0.6646
 epoch: 28, train_loss: 0.5875, test_loss: 0.8914, test_f1: 0.6526
 epoch: 29, train_loss: 0.5789, test_loss: 0.9072, test_f1: 0.6186
 epoch: 30, train_loss: 0.5694, test_loss: 0.8454, test_f1: 0.6490
 epoch: 31, train_loss: 0.5601, test_loss: 0.7933, test_f1: 0.6675
 epoch: 32, train_loss: 0.5672, test_loss: 0.8389, test_f1: 0.6522
 epoch: 33, train_loss: 0.5480, test_loss: 0.8640, test_f1: 0.6499
 epoch: 34, train_loss: 0.5542, test_loss: 0.8747, test_f1: 0.6253
 epoch: 35, train_loss: 0.5271, test_loss: 0.8860, test_f1: 0.6402
 epoch: 36, train_loss: 0.5445, test_loss: 0.8946, test_f1: 0.6358
 epoch: 37, train_loss: 0.5237, test_loss: 0.8830, test_f1: 0.6578
 epoch: 38, train_loss: 0.5214, test_loss: 0.9008, test_f1: 0.6472
 epoch: 39, train_loss: 0.5171, test_loss: 0.8519, test_f1: 0.6399
 epoch: 40, train_loss: 0.4981, test_loss: 0.8762, test_f1: 0.6764
 epoch: 41, train_loss: 0.5081, test_loss: 0.9596, test_f1: 0.6230
 epoch: 42, train_loss: 0.5123, test_loss: 0.9199, test_f1: 0.6400
 epoch: 43, train_loss: 0.5021, test_loss: 0.9444, test_f1: 0.6140
 epoch: 44, train_loss: 0.4986, test_loss: 0.8561, test_f1: 0.6745
 epoch: 45, train_loss: 0.4695, test_loss: 0.9170, test_f1: 0.6392
 epoch: 46, train_loss: 0.4753, test_loss: 1.0368, test_f1: 0.6391
 epoch: 47, train_loss: 0.4717, test_loss: 0.9674, test_f1: 0.6266
 epoch: 48, train_loss: 0.4504, test_loss: 0.8749, test_f1: 0.6776
 epoch: 49, train_loss: 0.4581, test_loss: 0.9310, test_f1: 0.6315
 epoch: 50, train_loss: 0.4317, test_loss: 0.9204, test_f1: 0.6362
 epoch: 51, train_loss: 0.3891, test_loss: 0.9388, test_f1: 0.6335
 epoch: 52, train_loss: 0.3794, test_loss: 0.9245, test_f1: 0.6543
 epoch: 53, train_loss: 0.3646, test_loss: 0.9652, test_f1: 0.6348
 epoch: 54, train_loss: 0.3774, test_loss: 0.9534, test_f1: 0.6530
 epoch: 55, train_loss: 0.3629, test_loss: 0.9036, test_f1: 0.6615
 epoch: 56, train_loss: 0.3521, test_loss: 1.0079, test_f1: 0.6395
 epoch: 57, train_loss: 0.3389, test_loss: 1.0845, test_f1: 0.6083
 epoch: 58, train_loss: 0.3456, test_loss: 1.0050, test_f1: 0.6368
 epoch: 59, train_loss: 0.3301, test_loss: 1.0380, test_f1: 0.6379
 epoch: 60, train_loss: 0.3453, test_loss: 1.0861, test_f1: 0.6358
 epoch: 61, train_loss: 0.3544, test_loss: 0.9998, test_f1: 0.6430
 epoch: 62, train_loss: 0.3359, test_loss: 1.0596, test_f1: 0.6467
 epoch: 63, train_loss: 0.3099, test_loss: 1.1089, test_f1: 0.6411
 epoch: 64, train_loss: 0.3344, test_loss: 0.9672, test_f1: 0.6675
 epoch: 65, train_loss: 0.3262, test_loss: 1.0466, test_f1: 0.6377
 epoch: 66, train_loss: 0.3251, test_loss: 1.2000, test_f1: 0.5912
 epoch: 67, train_loss: 0.3208, test_loss: 1.1611, test_f1: 0.6161
 epoch: 68, train_loss: 0.3087, test_loss: 1.2770, test_f1: 0.6061
 epoch: 69, train_loss: 0.3124, test_loss: 1.1926, test_f1: 0.6428
 epoch: 70, train_loss: 0.3145, test_loss: 1.0932, test_f1: 0.6351
 epoch: 71, train_loss: 0.3119, test_loss: 1.2689, test_f1: 0.5988
 epoch: 72, train_loss: 0.2988, test_loss: 1.1458, test_f1: 0.6411
 epoch: 73, train_loss: 0.3010, test_loss: 1.1522, test_f1: 0.6487
 epoch: 74, train_loss: 0.2904, test_loss: 1.2099, test_f1: 0.6534
 epoch: 75, train_loss: 0.2946, test_loss: 1.2017, test_f1: 0.6389
 epoch: 76, train_loss: 0.2977, test_loss: 1.1492, test_f1: 0.6496
 epoch: 77, train_loss: 0.3005, test_loss: 1.1865, test_f1: 0.6365
 epoch: 78, train_loss: 0.2997, test_loss: 1.2229, test_f1: 0.6400
 epoch: 79, train_loss: 0.2950, test_loss: 1.2051, test_f1: 0.6210
 epoch: 80, train_loss: 0.2831, test_loss: 1.2752, test_f1: 0.6180
 epoch: 81, train_loss: 0.2767, test_loss: 1.1068, test_f1: 0.6745
 epoch: 82, train_loss: 0.2896, test_loss: 1.1813, test_f1: 0.6412
 epoch: 83, train_loss: 0.2875, test_loss: 1.1055, test_f1: 0.6336
 epoch: 84, train_loss: 0.2745, test_loss: 1.3113, test_f1: 0.6031
 epoch: 85, train_loss: 0.2836, test_loss: 1.1880, test_f1: 0.6376
 epoch: 86, train_loss: 0.2685, test_loss: 1.2917, test_f1: 0.6525
 epoch: 87, train_loss: 0.2506, test_loss: 1.2959, test_f1: 0.6359
 epoch: 88, train_loss: 0.2810, test_loss: 1.1968, test_f1: 0.6452
 epoch: 89, train_loss: 0.2614, test_loss: 1.2917, test_f1: 0.6325
 epoch: 90, train_loss: 0.2582, test_loss: 1.2800, test_f1: 0.6425
 epoch: 91, train_loss: 0.2451, test_loss: 1.3106, test_f1: 0.6140
 epoch: 92, train_loss: 0.2453, test_loss: 1.2720, test_f1: 0.6297
 epoch: 93, train_loss: 0.2592, test_loss: 1.2749, test_f1: 0.6365
 epoch: 94, train_loss: 0.2632, test_loss: 1.2993, test_f1: 0.6200
 epoch: 95, train_loss: 0.2511, test_loss: 1.5434, test_f1: 0.6186
 epoch: 96, train_loss: 0.2389, test_loss: 1.3353, test_f1: 0.6235
 epoch: 97, train_loss: 0.2478, test_loss: 1.3035, test_f1: 0.6540
 epoch: 98, train_loss: 0.2416, test_loss: 1.3058, test_f1: 0.6571
 epoch: 99, train_loss: 0.2394, test_loss: 1.3884, test_f1: 0.6307
##################ITERATION #8 ****************************************
 epoch: 0, train_loss: 1.3216, test_loss: 1.1227, test_f1: 0.4254
 epoch: 1, train_loss: 1.0144, test_loss: 0.9860, test_f1: 0.4719
 epoch: 2, train_loss: 0.9630, test_loss: 0.9175, test_f1: 0.4850
 epoch: 3, train_loss: 0.9186, test_loss: 0.9279, test_f1: 0.5426
 epoch: 4, train_loss: 0.9083, test_loss: 0.9476, test_f1: 0.5589
 epoch: 5, train_loss: 0.8891, test_loss: 0.9799, test_f1: 0.4408
 epoch: 6, train_loss: 0.8925, test_loss: 0.9088, test_f1: 0.5371
 epoch: 7, train_loss: 0.8630, test_loss: 0.9138, test_f1: 0.5585
 epoch: 8, train_loss: 0.8100, test_loss: 0.9275, test_f1: 0.5417
 epoch: 9, train_loss: 0.8129, test_loss: 0.8652, test_f1: 0.5916
 epoch: 10, train_loss: 0.7917, test_loss: 0.9265, test_f1: 0.5567
 epoch: 11, train_loss: 0.7817, test_loss: 1.0044, test_f1: 0.5022
 epoch: 12, train_loss: 0.7816, test_loss: 0.8836, test_f1: 0.5707
 epoch: 13, train_loss: 0.7709, test_loss: 0.9079, test_f1: 0.5929
 epoch: 14, train_loss: 0.7585, test_loss: 0.8853, test_f1: 0.5626
 epoch: 15, train_loss: 0.7324, test_loss: 0.9312, test_f1: 0.5655
 epoch: 16, train_loss: 0.7401, test_loss: 0.8398, test_f1: 0.6195
 epoch: 17, train_loss: 0.7061, test_loss: 0.8498, test_f1: 0.5811
 epoch: 18, train_loss: 0.6891, test_loss: 0.8668, test_f1: 0.6220
 epoch: 19, train_loss: 0.7074, test_loss: 0.9119, test_f1: 0.5949
 epoch: 20, train_loss: 0.6862, test_loss: 0.9110, test_f1: 0.5759
 epoch: 21, train_loss: 0.6640, test_loss: 0.8046, test_f1: 0.6119
 epoch: 22, train_loss: 0.6575, test_loss: 0.8598, test_f1: 0.5880
 epoch: 23, train_loss: 0.6647, test_loss: 0.8194, test_f1: 0.6116
 epoch: 24, train_loss: 0.6409, test_loss: 0.8228, test_f1: 0.5880
 epoch: 25, train_loss: 0.6427, test_loss: 0.8284, test_f1: 0.6256
 epoch: 26, train_loss: 0.6183, test_loss: 0.9232, test_f1: 0.6092
 epoch: 27, train_loss: 0.6164, test_loss: 0.8705, test_f1: 0.5869
 epoch: 28, train_loss: 0.6071, test_loss: 0.8560, test_f1: 0.6422
 epoch: 29, train_loss: 0.5941, test_loss: 0.8962, test_f1: 0.6282
 epoch: 30, train_loss: 0.5928, test_loss: 0.8184, test_f1: 0.6337
 epoch: 31, train_loss: 0.5905, test_loss: 0.9424, test_f1: 0.6055
 epoch: 32, train_loss: 0.5798, test_loss: 0.8296, test_f1: 0.6299
 epoch: 33, train_loss: 0.5574, test_loss: 0.8285, test_f1: 0.6584
 epoch: 34, train_loss: 0.5389, test_loss: 0.9312, test_f1: 0.6122
 epoch: 35, train_loss: 0.5668, test_loss: 0.8327, test_f1: 0.6447
 epoch: 36, train_loss: 0.5606, test_loss: 0.8009, test_f1: 0.6546
 epoch: 37, train_loss: 0.5496, test_loss: 0.8120, test_f1: 0.6654
 epoch: 38, train_loss: 0.5399, test_loss: 0.8647, test_f1: 0.6351
 epoch: 39, train_loss: 0.5234, test_loss: 0.8494, test_f1: 0.6591
 epoch: 40, train_loss: 0.5221, test_loss: 0.8239, test_f1: 0.6739
 epoch: 41, train_loss: 0.5112, test_loss: 0.9481, test_f1: 0.6198
 epoch: 42, train_loss: 0.5117, test_loss: 0.8164, test_f1: 0.6497
 epoch: 43, train_loss: 0.5230, test_loss: 0.8669, test_f1: 0.6546
 epoch: 44, train_loss: 0.4992, test_loss: 0.8195, test_f1: 0.6490
 epoch: 45, train_loss: 0.5049, test_loss: 0.7419, test_f1: 0.6938
 epoch: 46, train_loss: 0.4737, test_loss: 0.8886, test_f1: 0.6358
 epoch: 47, train_loss: 0.5141, test_loss: 0.8282, test_f1: 0.6425
 epoch: 48, train_loss: 0.5051, test_loss: 0.8018, test_f1: 0.6714
 epoch: 49, train_loss: 0.4771, test_loss: 0.8937, test_f1: 0.6439
 epoch: 50, train_loss: 0.4712, test_loss: 0.9743, test_f1: 0.6162
 epoch: 51, train_loss: 0.4402, test_loss: 0.8368, test_f1: 0.7017
 epoch: 52, train_loss: 0.4012, test_loss: 0.8312, test_f1: 0.6700
 epoch: 53, train_loss: 0.3973, test_loss: 0.9139, test_f1: 0.6768
 epoch: 54, train_loss: 0.3976, test_loss: 0.8423, test_f1: 0.7038
 epoch: 55, train_loss: 0.3808, test_loss: 0.8811, test_f1: 0.6846
 epoch: 56, train_loss: 0.3831, test_loss: 0.9457, test_f1: 0.6825
 epoch: 57, train_loss: 0.3728, test_loss: 0.9324, test_f1: 0.6602
 epoch: 58, train_loss: 0.3750, test_loss: 0.9970, test_f1: 0.6684
 epoch: 59, train_loss: 0.3880, test_loss: 0.9237, test_f1: 0.6527
 epoch: 60, train_loss: 0.3823, test_loss: 1.0090, test_f1: 0.6431
 epoch: 61, train_loss: 0.3709, test_loss: 0.9768, test_f1: 0.6562
 epoch: 62, train_loss: 0.3622, test_loss: 0.9896, test_f1: 0.6589
 epoch: 63, train_loss: 0.3470, test_loss: 0.9674, test_f1: 0.6673
 epoch: 64, train_loss: 0.3508, test_loss: 0.9627, test_f1: 0.6743
 epoch: 65, train_loss: 0.3583, test_loss: 1.0012, test_f1: 0.6579
 epoch: 66, train_loss: 0.3452, test_loss: 0.9755, test_f1: 0.6362
 epoch: 67, train_loss: 0.3380, test_loss: 0.9986, test_f1: 0.6721
 epoch: 68, train_loss: 0.3410, test_loss: 1.0837, test_f1: 0.6723
 epoch: 69, train_loss: 0.3325, test_loss: 0.9706, test_f1: 0.6719
 epoch: 70, train_loss: 0.3423, test_loss: 1.0568, test_f1: 0.6938
 epoch: 71, train_loss: 0.3292, test_loss: 1.0545, test_f1: 0.6554
 epoch: 72, train_loss: 0.3349, test_loss: 1.0603, test_f1: 0.6800
 epoch: 73, train_loss: 0.3370, test_loss: 1.1015, test_f1: 0.6559
 epoch: 74, train_loss: 0.3069, test_loss: 0.9962, test_f1: 0.6797
 epoch: 75, train_loss: 0.3261, test_loss: 1.0844, test_f1: 0.6971
 epoch: 76, train_loss: 0.3380, test_loss: 1.0866, test_f1: 0.6684
 epoch: 77, train_loss: 0.3241, test_loss: 1.0768, test_f1: 0.6629
 epoch: 78, train_loss: 0.3200, test_loss: 1.0039, test_f1: 0.6982
 epoch: 79, train_loss: 0.3266, test_loss: 1.0957, test_f1: 0.6879
 epoch: 80, train_loss: 0.2922, test_loss: 1.1507, test_f1: 0.6690
 epoch: 81, train_loss: 0.2939, test_loss: 1.0731, test_f1: 0.6690
 epoch: 82, train_loss: 0.2897, test_loss: 1.1973, test_f1: 0.6440
 epoch: 83, train_loss: 0.3095, test_loss: 1.1491, test_f1: 0.6933
 epoch: 84, train_loss: 0.2982, test_loss: 1.1513, test_f1: 0.6663
 epoch: 85, train_loss: 0.2990, test_loss: 1.0780, test_f1: 0.6933
 epoch: 86, train_loss: 0.2881, test_loss: 1.0671, test_f1: 0.6834
 epoch: 87, train_loss: 0.2966, test_loss: 1.0864, test_f1: 0.6877
 epoch: 88, train_loss: 0.3042, test_loss: 1.1167, test_f1: 0.6733
 epoch: 89, train_loss: 0.2988, test_loss: 1.1085, test_f1: 0.6680
 epoch: 90, train_loss: 0.2895, test_loss: 1.1282, test_f1: 0.6540
 epoch: 91, train_loss: 0.2904, test_loss: 1.1732, test_f1: 0.6908
 epoch: 92, train_loss: 0.2744, test_loss: 1.2291, test_f1: 0.6496
 epoch: 93, train_loss: 0.2796, test_loss: 1.1693, test_f1: 0.6817
 epoch: 94, train_loss: 0.2651, test_loss: 1.2486, test_f1: 0.6414
 epoch: 95, train_loss: 0.2681, test_loss: 1.2933, test_f1: 0.6633
 epoch: 96, train_loss: 0.2831, test_loss: 1.2086, test_f1: 0.6579
 epoch: 97, train_loss: 0.2657, test_loss: 1.1623, test_f1: 0.6846
 epoch: 98, train_loss: 0.2664, test_loss: 1.1714, test_f1: 0.6656
 epoch: 99, train_loss: 0.2548, test_loss: 1.2357, test_f1: 0.6643
##################ITERATION #9 ****************************************
 epoch: 0, train_loss: 1.3279, test_loss: 1.1306, test_f1: 0.4299
 epoch: 1, train_loss: 1.0414, test_loss: 1.0185, test_f1: 0.5101
 epoch: 2, train_loss: 0.9861, test_loss: 1.0204, test_f1: 0.5365
 epoch: 3, train_loss: 0.9642, test_loss: 1.0215, test_f1: 0.5443
 epoch: 4, train_loss: 0.9099, test_loss: 1.0132, test_f1: 0.4730
 epoch: 5, train_loss: 0.8971, test_loss: 1.0312, test_f1: 0.5131
 epoch: 6, train_loss: 0.8724, test_loss: 1.0066, test_f1: 0.5257
 epoch: 7, train_loss: 0.8744, test_loss: 0.9620, test_f1: 0.5497
 epoch: 8, train_loss: 0.8498, test_loss: 0.9607, test_f1: 0.5488
 epoch: 9, train_loss: 0.8229, test_loss: 0.8994, test_f1: 0.5669
 epoch: 10, train_loss: 0.8268, test_loss: 1.0501, test_f1: 0.5294
 epoch: 11, train_loss: 0.7963, test_loss: 0.9026, test_f1: 0.5575
 epoch: 12, train_loss: 0.7904, test_loss: 0.9537, test_f1: 0.5425
 epoch: 13, train_loss: 0.7752, test_loss: 0.9124, test_f1: 0.5664
 epoch: 14, train_loss: 0.7634, test_loss: 0.9491, test_f1: 0.5812
 epoch: 15, train_loss: 0.7591, test_loss: 0.9348, test_f1: 0.5834
 epoch: 16, train_loss: 0.7473, test_loss: 0.8725, test_f1: 0.5601
 epoch: 17, train_loss: 0.7318, test_loss: 0.8268, test_f1: 0.6026
 epoch: 18, train_loss: 0.7170, test_loss: 0.9393, test_f1: 0.5923
 epoch: 19, train_loss: 0.7037, test_loss: 0.7832, test_f1: 0.6219
 epoch: 20, train_loss: 0.6966, test_loss: 0.8284, test_f1: 0.6297
 epoch: 21, train_loss: 0.6960, test_loss: 0.9350, test_f1: 0.5643
 epoch: 22, train_loss: 0.7011, test_loss: 0.7848, test_f1: 0.6297
 epoch: 23, train_loss: 0.6939, test_loss: 0.8968, test_f1: 0.5834
 epoch: 24, train_loss: 0.6797, test_loss: 0.8407, test_f1: 0.6304
 epoch: 25, train_loss: 0.6606, test_loss: 0.8534, test_f1: 0.6117
 epoch: 26, train_loss: 0.6589, test_loss: 0.7685, test_f1: 0.6405
 epoch: 27, train_loss: 0.6399, test_loss: 0.7931, test_f1: 0.6234
 epoch: 28, train_loss: 0.6394, test_loss: 0.7937, test_f1: 0.6001
 epoch: 29, train_loss: 0.6359, test_loss: 0.8225, test_f1: 0.6225
 epoch: 30, train_loss: 0.6236, test_loss: 0.8268, test_f1: 0.5801
 epoch: 31, train_loss: 0.6251, test_loss: 0.7595, test_f1: 0.6228
 epoch: 32, train_loss: 0.6163, test_loss: 0.9494, test_f1: 0.5815
 epoch: 33, train_loss: 0.6145, test_loss: 0.7746, test_f1: 0.6404
 epoch: 34, train_loss: 0.5954, test_loss: 0.8546, test_f1: 0.5913
 epoch: 35, train_loss: 0.6044, test_loss: 0.7550, test_f1: 0.6597
 epoch: 36, train_loss: 0.5912, test_loss: 0.7999, test_f1: 0.6302
 epoch: 37, train_loss: 0.5827, test_loss: 0.7953, test_f1: 0.6386
 epoch: 38, train_loss: 0.5792, test_loss: 0.7833, test_f1: 0.6342
 epoch: 39, train_loss: 0.5794, test_loss: 0.7534, test_f1: 0.6541
 epoch: 40, train_loss: 0.5700, test_loss: 0.7754, test_f1: 0.6577
 epoch: 41, train_loss: 0.5578, test_loss: 0.8513, test_f1: 0.6293
 epoch: 42, train_loss: 0.5528, test_loss: 0.9332, test_f1: 0.5978
 epoch: 43, train_loss: 0.5549, test_loss: 0.7640, test_f1: 0.6606
 epoch: 44, train_loss: 0.5328, test_loss: 0.7547, test_f1: 0.6591
 epoch: 45, train_loss: 0.5426, test_loss: 0.8857, test_f1: 0.6104
 epoch: 46, train_loss: 0.5582, test_loss: 0.9023, test_f1: 0.6467
 epoch: 47, train_loss: 0.5309, test_loss: 0.7716, test_f1: 0.6344
 epoch: 48, train_loss: 0.5245, test_loss: 0.8068, test_f1: 0.6622
 epoch: 49, train_loss: 0.5394, test_loss: 0.8027, test_f1: 0.6537
 epoch: 50, train_loss: 0.5122, test_loss: 0.8017, test_f1: 0.6852
 epoch: 51, train_loss: 0.4857, test_loss: 0.8827, test_f1: 0.6537
 epoch: 52, train_loss: 0.4587, test_loss: 0.7939, test_f1: 0.6727
 epoch: 53, train_loss: 0.4459, test_loss: 0.7506, test_f1: 0.6637
 epoch: 54, train_loss: 0.4572, test_loss: 0.8153, test_f1: 0.6679
 epoch: 55, train_loss: 0.4503, test_loss: 0.8755, test_f1: 0.6451
 epoch: 56, train_loss: 0.4674, test_loss: 0.7865, test_f1: 0.6589
 epoch: 57, train_loss: 0.4391, test_loss: 0.7820, test_f1: 0.6789
 epoch: 58, train_loss: 0.4434, test_loss: 0.8365, test_f1: 0.6451
 epoch: 59, train_loss: 0.4419, test_loss: 0.8026, test_f1: 0.6669
 epoch: 60, train_loss: 0.4291, test_loss: 0.8739, test_f1: 0.6656
 epoch: 61, train_loss: 0.4258, test_loss: 0.9093, test_f1: 0.6424
 epoch: 62, train_loss: 0.4233, test_loss: 0.8062, test_f1: 0.6915
 epoch: 63, train_loss: 0.4276, test_loss: 0.7899, test_f1: 0.6899
 epoch: 64, train_loss: 0.4073, test_loss: 0.8108, test_f1: 0.6693
 epoch: 65, train_loss: 0.4111, test_loss: 0.8359, test_f1: 0.6744
 epoch: 66, train_loss: 0.4018, test_loss: 0.8310, test_f1: 0.6752
 epoch: 67, train_loss: 0.3984, test_loss: 0.8211, test_f1: 0.6774
 epoch: 68, train_loss: 0.4017, test_loss: 0.9434, test_f1: 0.6764
 epoch: 69, train_loss: 0.4078, test_loss: 0.7621, test_f1: 0.6908
 epoch: 70, train_loss: 0.3995, test_loss: 0.8823, test_f1: 0.6622
 epoch: 71, train_loss: 0.4057, test_loss: 0.8877, test_f1: 0.6428
 epoch: 72, train_loss: 0.3931, test_loss: 0.8544, test_f1: 0.6569
 epoch: 73, train_loss: 0.4192, test_loss: 0.8509, test_f1: 0.6457
 epoch: 74, train_loss: 0.4115, test_loss: 0.8630, test_f1: 0.6797
 epoch: 75, train_loss: 0.4098, test_loss: 0.8044, test_f1: 0.6846
 epoch: 76, train_loss: 0.3673, test_loss: 0.8652, test_f1: 0.6967
 epoch: 77, train_loss: 0.3752, test_loss: 0.8756, test_f1: 0.6976
 epoch: 78, train_loss: 0.3965, test_loss: 0.8888, test_f1: 0.6546
 epoch: 79, train_loss: 0.3749, test_loss: 0.8698, test_f1: 0.6857
 epoch: 80, train_loss: 0.3685, test_loss: 0.9306, test_f1: 0.6764
 epoch: 81, train_loss: 0.3525, test_loss: 0.8569, test_f1: 0.6762
 epoch: 82, train_loss: 0.3708, test_loss: 0.9193, test_f1: 0.6632
 epoch: 83, train_loss: 0.3845, test_loss: 0.8857, test_f1: 0.6739
 epoch: 84, train_loss: 0.3565, test_loss: 0.9369, test_f1: 0.6879
 epoch: 85, train_loss: 0.3713, test_loss: 0.9501, test_f1: 0.6693
 epoch: 86, train_loss: 0.3610, test_loss: 0.9805, test_f1: 0.6598
 epoch: 87, train_loss: 0.3661, test_loss: 0.9185, test_f1: 0.6625
 epoch: 88, train_loss: 0.3526, test_loss: 1.0354, test_f1: 0.6539
 epoch: 89, train_loss: 0.3590, test_loss: 0.9979, test_f1: 0.6641
 epoch: 90, train_loss: 0.3570, test_loss: 0.9576, test_f1: 0.6803
 epoch: 91, train_loss: 0.3474, test_loss: 0.9289, test_f1: 0.6721
 epoch: 92, train_loss: 0.3541, test_loss: 1.0499, test_f1: 0.6534
 epoch: 93, train_loss: 0.3489, test_loss: 0.9443, test_f1: 0.6749
 epoch: 94, train_loss: 0.3416, test_loss: 0.9192, test_f1: 0.6745
 epoch: 95, train_loss: 0.3344, test_loss: 0.8833, test_f1: 0.6894
 epoch: 96, train_loss: 0.3279, test_loss: 0.9037, test_f1: 0.6921
 epoch: 97, train_loss: 0.3095, test_loss: 0.9400, test_f1: 0.6753
 epoch: 98, train_loss: 0.3169, test_loss: 1.0470, test_f1: 0.6815
 epoch: 99, train_loss: 0.3378, test_loss: 0.8907, test_f1: 0.6916

Training completed in 648.02 seconds
Best F1: 0.7038 at epoch 54
Mean F1 across iterations: 0.6868  0.0105
========================FINAL RESULTS================================
FEGIN weighted F1: 0.7038  0.0105
python main.py --data ltspice_examples --representation component_pin --model FEGIN --layers 3 --hiddens 64 --batch_size 64 --lr 0.001 --emb_size 250 --epochs 100 --save_appendix component_pin_L3_H64_BS64_LR0.001_E250 --no_val
-----



STDERR:
  File "main.py", line 370, in <module>
    main()
  File "main.py", line 254, in main
    dataset = dataset_class(
  File "/home/philip/projects/ltspice_examples_code_repo/Circuit-Completion-Using-GNNs/component_classification_with_link_prediction_head/evaluation/FEGIN/kernel/circuit_datasets.py", line 15, in __init__
    self.data, self.slices = torch.load(self.processed_paths[0])
  File "/home/philip/.local/lib/python3.8/site-packages/torch/serialization.py", line 1040, in load
    warnings.warn(
  File "/usr/lib/python3.8/warnings.py", line 109, in _showwarnmsg
    sw(msg.message, msg.category, msg.filename, msg.lineno,
  File "main.py", line 47, in warn_with_traceback
    traceback.print_stack(file=log)
/home/philip/projects/ltspice_examples_code_repo/Circuit-Completion-Using-GNNs/component_classification_with_link_prediction_head/evaluation/FEGIN/kernel/circuit_datasets.py:15: FutureWarning: You are using `torch.load` with `weights_only=False` (the current default value), which uses the default pickle module implicitly. It is possible to construct malicious pickle data which will execute arbitrary code during unpickling (See https://github.com/pytorch/pytorch/blob/main/SECURITY.md#untrusted-models for more details). In a future release, the default value for `weights_only` will be flipped to `True`. This limits the functions that could be executed during unpickling. Arbitrary objects will no longer be allowed to be loaded via this mode unless they are explicitly allowlisted by the user via `torch.serialization.add_safe_globals`. We recommend you start setting `weights_only=True` for any use case where you don't have full control of the loaded file. Please open an issue on GitHub for any issues related to this experimental feature.
  self.data, self.slices = torch.load(self.processed_paths[0])
