STDOUT:
Results will be saved in /home/philip/projects/ltspice_examples_code_repo/Circuit-Completion-Using-GNNs/component_classification_with_link_prediction_head/evaluation/FEGIN/results/model_FEGIN_dataset_ltspice_examples
Command line input: python main.py --data ltspice_examples --representation component_pin_net --model FEGIN --layers 2 --hiddens 64 --batch_size 256 --lr 0.0001 --emb_size 512 --epochs 100 --save_appendix component_pin_net_L2_H64_BS256_LR0.0001_E512 --no_val
 is saved.
-----
ltspice_examples - FEGIN
Using 2 layers, 64 hidden units, h = 2
Loading component_pin_net representation dataset
ENTERED
Training FEGIN on component_pin_net representation
Train: 3558, Test: 846
##################ITERATION #0 ****************************************
 epoch: 0, train_loss: 1.3938, test_loss: 1.3924, test_f1: 0.1004
 epoch: 1, train_loss: 1.3854, test_loss: 1.3878, test_f1: 0.1004
 epoch: 2, train_loss: 1.3799, test_loss: 1.3824, test_f1: 0.1004
 epoch: 3, train_loss: 1.3731, test_loss: 1.3739, test_f1: 0.1162
 epoch: 4, train_loss: 1.3657, test_loss: 1.3633, test_f1: 0.1264
 epoch: 5, train_loss: 1.3557, test_loss: 1.3520, test_f1: 0.1436
 epoch: 6, train_loss: 1.3466, test_loss: 1.3395, test_f1: 0.2655
 epoch: 7, train_loss: 1.3338, test_loss: 1.3259, test_f1: 0.2809
 epoch: 8, train_loss: 1.3191, test_loss: 1.3113, test_f1: 0.2586
 epoch: 9, train_loss: 1.3049, test_loss: 1.2959, test_f1: 0.2555
 epoch: 10, train_loss: 1.2914, test_loss: 1.2801, test_f1: 0.2304
 epoch: 11, train_loss: 1.2741, test_loss: 1.2645, test_f1: 0.2304
 epoch: 12, train_loss: 1.2608, test_loss: 1.2503, test_f1: 0.2295
 epoch: 13, train_loss: 1.2504, test_loss: 1.2367, test_f1: 0.2270
 epoch: 14, train_loss: 1.2345, test_loss: 1.2237, test_f1: 0.2270
 epoch: 15, train_loss: 1.2270, test_loss: 1.2115, test_f1: 0.2270
 epoch: 16, train_loss: 1.2158, test_loss: 1.1998, test_f1: 0.2270
 epoch: 17, train_loss: 1.2086, test_loss: 1.1894, test_f1: 0.2679
 epoch: 18, train_loss: 1.1966, test_loss: 1.1791, test_f1: 0.2979
 epoch: 19, train_loss: 1.1889, test_loss: 1.1688, test_f1: 0.3169
 epoch: 20, train_loss: 1.1786, test_loss: 1.1589, test_f1: 0.3462
 epoch: 21, train_loss: 1.1733, test_loss: 1.1488, test_f1: 0.3673
 epoch: 22, train_loss: 1.1623, test_loss: 1.1386, test_f1: 0.3912
 epoch: 23, train_loss: 1.1538, test_loss: 1.1293, test_f1: 0.3900
 epoch: 24, train_loss: 1.1431, test_loss: 1.1191, test_f1: 0.4155
 epoch: 25, train_loss: 1.1345, test_loss: 1.1079, test_f1: 0.4294
 epoch: 26, train_loss: 1.1258, test_loss: 1.0975, test_f1: 0.4537
 epoch: 27, train_loss: 1.1123, test_loss: 1.0851, test_f1: 0.4577
 epoch: 28, train_loss: 1.1037, test_loss: 1.0736, test_f1: 0.4610
 epoch: 29, train_loss: 1.0920, test_loss: 1.0633, test_f1: 0.4750
 epoch: 30, train_loss: 1.0802, test_loss: 1.0529, test_f1: 0.4816
 epoch: 31, train_loss: 1.0726, test_loss: 1.0443, test_f1: 0.4776
 epoch: 32, train_loss: 1.0592, test_loss: 1.0340, test_f1: 0.4835
 epoch: 33, train_loss: 1.0567, test_loss: 1.0264, test_f1: 0.4800
 epoch: 34, train_loss: 1.0397, test_loss: 1.0200, test_f1: 0.4813
 epoch: 35, train_loss: 1.0378, test_loss: 1.0143, test_f1: 0.4849
 epoch: 36, train_loss: 1.0269, test_loss: 1.0070, test_f1: 0.4920
 epoch: 37, train_loss: 1.0181, test_loss: 1.0006, test_f1: 0.4984
 epoch: 38, train_loss: 1.0170, test_loss: 0.9980, test_f1: 0.4974
 epoch: 39, train_loss: 1.0049, test_loss: 0.9923, test_f1: 0.4943
 epoch: 40, train_loss: 1.0048, test_loss: 0.9916, test_f1: 0.4956
 epoch: 41, train_loss: 0.9965, test_loss: 0.9857, test_f1: 0.5035
 epoch: 42, train_loss: 0.9933, test_loss: 0.9828, test_f1: 0.5019
 epoch: 43, train_loss: 0.9904, test_loss: 0.9792, test_f1: 0.4983
 epoch: 44, train_loss: 0.9890, test_loss: 0.9781, test_f1: 0.4866
 epoch: 45, train_loss: 0.9860, test_loss: 0.9763, test_f1: 0.5040
 epoch: 46, train_loss: 0.9766, test_loss: 0.9707, test_f1: 0.5152
 epoch: 47, train_loss: 0.9775, test_loss: 0.9680, test_f1: 0.4981
 epoch: 48, train_loss: 0.9732, test_loss: 0.9658, test_f1: 0.5066
 epoch: 49, train_loss: 0.9759, test_loss: 0.9641, test_f1: 0.4984
 epoch: 50, train_loss: 0.9659, test_loss: 0.9685, test_f1: 0.5036
 epoch: 51, train_loss: 0.9621, test_loss: 0.9606, test_f1: 0.5082
 epoch: 52, train_loss: 0.9671, test_loss: 0.9589, test_f1: 0.5066
 epoch: 53, train_loss: 0.9639, test_loss: 0.9579, test_f1: 0.5064
 epoch: 54, train_loss: 0.9585, test_loss: 0.9574, test_f1: 0.5108
 epoch: 55, train_loss: 0.9579, test_loss: 0.9560, test_f1: 0.5139
 epoch: 56, train_loss: 0.9607, test_loss: 0.9564, test_f1: 0.5169
 epoch: 57, train_loss: 0.9564, test_loss: 0.9556, test_f1: 0.5090
 epoch: 58, train_loss: 0.9540, test_loss: 0.9535, test_f1: 0.5102
 epoch: 59, train_loss: 0.9548, test_loss: 0.9556, test_f1: 0.5083
 epoch: 60, train_loss: 0.9567, test_loss: 0.9528, test_f1: 0.5068
 epoch: 61, train_loss: 0.9528, test_loss: 0.9508, test_f1: 0.5128
 epoch: 62, train_loss: 0.9571, test_loss: 0.9525, test_f1: 0.5163
 epoch: 63, train_loss: 0.9508, test_loss: 0.9482, test_f1: 0.5114
 epoch: 64, train_loss: 0.9496, test_loss: 0.9471, test_f1: 0.5114
 epoch: 65, train_loss: 0.9486, test_loss: 0.9472, test_f1: 0.5133
 epoch: 66, train_loss: 0.9482, test_loss: 0.9494, test_f1: 0.5170
 epoch: 67, train_loss: 0.9491, test_loss: 0.9441, test_f1: 0.5174
 epoch: 68, train_loss: 0.9428, test_loss: 0.9449, test_f1: 0.5062
 epoch: 69, train_loss: 0.9459, test_loss: 0.9429, test_f1: 0.5104
 epoch: 70, train_loss: 0.9475, test_loss: 0.9426, test_f1: 0.5186
 epoch: 71, train_loss: 0.9384, test_loss: 0.9441, test_f1: 0.5147
 epoch: 72, train_loss: 0.9403, test_loss: 0.9422, test_f1: 0.5200
 epoch: 73, train_loss: 0.9394, test_loss: 0.9386, test_f1: 0.5160
 epoch: 74, train_loss: 0.9462, test_loss: 0.9371, test_f1: 0.5205
 epoch: 75, train_loss: 0.9337, test_loss: 0.9374, test_f1: 0.5122
 epoch: 76, train_loss: 0.9385, test_loss: 0.9355, test_f1: 0.5184
 epoch: 77, train_loss: 0.9349, test_loss: 0.9358, test_f1: 0.5095
 epoch: 78, train_loss: 0.9393, test_loss: 0.9336, test_f1: 0.5173
 epoch: 79, train_loss: 0.9329, test_loss: 0.9364, test_f1: 0.5160
 epoch: 80, train_loss: 0.9340, test_loss: 0.9359, test_f1: 0.5192
 epoch: 81, train_loss: 0.9277, test_loss: 0.9332, test_f1: 0.5179
 epoch: 82, train_loss: 0.9269, test_loss: 0.9329, test_f1: 0.5210
 epoch: 83, train_loss: 0.9283, test_loss: 0.9297, test_f1: 0.5121
 epoch: 84, train_loss: 0.9335, test_loss: 0.9311, test_f1: 0.5146
 epoch: 85, train_loss: 0.9312, test_loss: 0.9350, test_f1: 0.5323
 epoch: 86, train_loss: 0.9286, test_loss: 0.9315, test_f1: 0.5172
 epoch: 87, train_loss: 0.9299, test_loss: 0.9314, test_f1: 0.5218
 epoch: 88, train_loss: 0.9268, test_loss: 0.9314, test_f1: 0.5162
 epoch: 89, train_loss: 0.9225, test_loss: 0.9287, test_f1: 0.5323
 epoch: 90, train_loss: 0.9214, test_loss: 0.9302, test_f1: 0.5185
 epoch: 91, train_loss: 0.9265, test_loss: 0.9270, test_f1: 0.5230
 epoch: 92, train_loss: 0.9210, test_loss: 0.9301, test_f1: 0.5132
 epoch: 93, train_loss: 0.9149, test_loss: 0.9267, test_f1: 0.5150
 epoch: 94, train_loss: 0.9178, test_loss: 0.9254, test_f1: 0.5251
 epoch: 95, train_loss: 0.9190, test_loss: 0.9264, test_f1: 0.5203
 epoch: 96, train_loss: 0.9226, test_loss: 0.9244, test_f1: 0.5339
 epoch: 97, train_loss: 0.9135, test_loss: 0.9261, test_f1: 0.5370
 epoch: 98, train_loss: 0.9076, test_loss: 0.9218, test_f1: 0.5299
 epoch: 99, train_loss: 0.9141, test_loss: 0.9232, test_f1: 0.5239
##################ITERATION #1 ****************************************
 epoch: 0, train_loss: 1.3556, test_loss: 1.3668, test_f1: 0.1004
 epoch: 1, train_loss: 1.3351, test_loss: 1.3582, test_f1: 0.1004
 epoch: 2, train_loss: 1.3219, test_loss: 1.3466, test_f1: 0.2096
 epoch: 3, train_loss: 1.3072, test_loss: 1.3254, test_f1: 0.2578
 epoch: 4, train_loss: 1.2900, test_loss: 1.2909, test_f1: 0.2404
 epoch: 5, train_loss: 1.2744, test_loss: 1.2613, test_f1: 0.3144
 epoch: 6, train_loss: 1.2556, test_loss: 1.2367, test_f1: 0.3488
 epoch: 7, train_loss: 1.2352, test_loss: 1.2147, test_f1: 0.3403
 epoch: 8, train_loss: 1.2176, test_loss: 1.1937, test_f1: 0.3422
 epoch: 9, train_loss: 1.1999, test_loss: 1.1734, test_f1: 0.3460
 epoch: 10, train_loss: 1.1818, test_loss: 1.1540, test_f1: 0.3460
 epoch: 11, train_loss: 1.1639, test_loss: 1.1362, test_f1: 0.3460
 epoch: 12, train_loss: 1.1472, test_loss: 1.1203, test_f1: 0.3448
 epoch: 13, train_loss: 1.1314, test_loss: 1.1045, test_f1: 0.3438
 epoch: 14, train_loss: 1.1154, test_loss: 1.0902, test_f1: 0.3429
 epoch: 15, train_loss: 1.1056, test_loss: 1.0789, test_f1: 0.3428
 epoch: 16, train_loss: 1.0892, test_loss: 1.0694, test_f1: 0.3451
 epoch: 17, train_loss: 1.0829, test_loss: 1.0603, test_f1: 0.3502
 epoch: 18, train_loss: 1.0764, test_loss: 1.0520, test_f1: 0.3596
 epoch: 19, train_loss: 1.0660, test_loss: 1.0455, test_f1: 0.3637
 epoch: 20, train_loss: 1.0600, test_loss: 1.0395, test_f1: 0.3808
 epoch: 21, train_loss: 1.0532, test_loss: 1.0340, test_f1: 0.3861
 epoch: 22, train_loss: 1.0479, test_loss: 1.0288, test_f1: 0.3899
 epoch: 23, train_loss: 1.0389, test_loss: 1.0245, test_f1: 0.4013
 epoch: 24, train_loss: 1.0325, test_loss: 1.0189, test_f1: 0.4065
 epoch: 25, train_loss: 1.0294, test_loss: 1.0136, test_f1: 0.4112
 epoch: 26, train_loss: 1.0224, test_loss: 1.0096, test_f1: 0.4108
 epoch: 27, train_loss: 1.0232, test_loss: 1.0049, test_f1: 0.4131
 epoch: 28, train_loss: 1.0127, test_loss: 1.0012, test_f1: 0.4270
 epoch: 29, train_loss: 1.0072, test_loss: 0.9943, test_f1: 0.4353
 epoch: 30, train_loss: 1.0047, test_loss: 0.9911, test_f1: 0.4475
 epoch: 31, train_loss: 1.0051, test_loss: 0.9882, test_f1: 0.4462
 epoch: 32, train_loss: 1.0030, test_loss: 0.9881, test_f1: 0.4651
 epoch: 33, train_loss: 0.9930, test_loss: 0.9820, test_f1: 0.4690
 epoch: 34, train_loss: 0.9932, test_loss: 0.9799, test_f1: 0.4715
 epoch: 35, train_loss: 0.9822, test_loss: 0.9730, test_f1: 0.4786
 epoch: 36, train_loss: 0.9838, test_loss: 0.9680, test_f1: 0.4842
 epoch: 37, train_loss: 0.9819, test_loss: 0.9645, test_f1: 0.4742
 epoch: 38, train_loss: 0.9719, test_loss: 0.9611, test_f1: 0.4819
 epoch: 39, train_loss: 0.9744, test_loss: 0.9598, test_f1: 0.4859
 epoch: 40, train_loss: 0.9684, test_loss: 0.9550, test_f1: 0.4863
 epoch: 41, train_loss: 0.9647, test_loss: 0.9535, test_f1: 0.4918
 epoch: 42, train_loss: 0.9641, test_loss: 0.9509, test_f1: 0.4922
 epoch: 43, train_loss: 0.9587, test_loss: 0.9481, test_f1: 0.4913
 epoch: 44, train_loss: 0.9623, test_loss: 0.9453, test_f1: 0.5036
 epoch: 45, train_loss: 0.9560, test_loss: 0.9407, test_f1: 0.5042
 epoch: 46, train_loss: 0.9522, test_loss: 0.9367, test_f1: 0.4998
 epoch: 47, train_loss: 0.9496, test_loss: 0.9340, test_f1: 0.4980
 epoch: 48, train_loss: 0.9510, test_loss: 0.9373, test_f1: 0.5034
 epoch: 49, train_loss: 0.9466, test_loss: 0.9308, test_f1: 0.5054
 epoch: 50, train_loss: 0.9432, test_loss: 0.9302, test_f1: 0.5064
 epoch: 51, train_loss: 0.9336, test_loss: 0.9286, test_f1: 0.5066
 epoch: 52, train_loss: 0.9387, test_loss: 0.9245, test_f1: 0.5096
 epoch: 53, train_loss: 0.9341, test_loss: 0.9244, test_f1: 0.5070
 epoch: 54, train_loss: 0.9321, test_loss: 0.9250, test_f1: 0.5113
 epoch: 55, train_loss: 0.9347, test_loss: 0.9230, test_f1: 0.5124
 epoch: 56, train_loss: 0.9342, test_loss: 0.9208, test_f1: 0.5098
 epoch: 57, train_loss: 0.9277, test_loss: 0.9220, test_f1: 0.5114
 epoch: 58, train_loss: 0.9254, test_loss: 0.9214, test_f1: 0.5114
 epoch: 59, train_loss: 0.9230, test_loss: 0.9194, test_f1: 0.5094
 epoch: 60, train_loss: 0.9319, test_loss: 0.9174, test_f1: 0.5107
 epoch: 61, train_loss: 0.9285, test_loss: 0.9160, test_f1: 0.5104
 epoch: 62, train_loss: 0.9286, test_loss: 0.9134, test_f1: 0.5193
 epoch: 63, train_loss: 0.9253, test_loss: 0.9139, test_f1: 0.5125
 epoch: 64, train_loss: 0.9259, test_loss: 0.9120, test_f1: 0.5177
 epoch: 65, train_loss: 0.9220, test_loss: 0.9111, test_f1: 0.5210
 epoch: 66, train_loss: 0.9210, test_loss: 0.9107, test_f1: 0.5178
 epoch: 67, train_loss: 0.9202, test_loss: 0.9111, test_f1: 0.5118
 epoch: 68, train_loss: 0.9184, test_loss: 0.9098, test_f1: 0.5118
 epoch: 69, train_loss: 0.9147, test_loss: 0.9050, test_f1: 0.5278
 epoch: 70, train_loss: 0.9139, test_loss: 0.9051, test_f1: 0.5244
 epoch: 71, train_loss: 0.9169, test_loss: 0.9047, test_f1: 0.5229
 epoch: 72, train_loss: 0.9153, test_loss: 0.9048, test_f1: 0.5264
 epoch: 73, train_loss: 0.9084, test_loss: 0.9002, test_f1: 0.5256
 epoch: 74, train_loss: 0.9065, test_loss: 0.9031, test_f1: 0.5245
 epoch: 75, train_loss: 0.9112, test_loss: 0.9041, test_f1: 0.5253
 epoch: 76, train_loss: 0.9036, test_loss: 0.9003, test_f1: 0.5278
 epoch: 77, train_loss: 0.9085, test_loss: 0.9004, test_f1: 0.5243
 epoch: 78, train_loss: 0.8981, test_loss: 0.8988, test_f1: 0.5248
 epoch: 79, train_loss: 0.9062, test_loss: 0.8975, test_f1: 0.5251
 epoch: 80, train_loss: 0.9027, test_loss: 0.8956, test_f1: 0.5331
 epoch: 81, train_loss: 0.9007, test_loss: 0.8940, test_f1: 0.5340
 epoch: 82, train_loss: 0.8967, test_loss: 0.8925, test_f1: 0.5368
 epoch: 83, train_loss: 0.8955, test_loss: 0.8922, test_f1: 0.5379
 epoch: 84, train_loss: 0.8900, test_loss: 0.8932, test_f1: 0.5344
 epoch: 85, train_loss: 0.8940, test_loss: 0.8927, test_f1: 0.5324
 epoch: 86, train_loss: 0.8913, test_loss: 0.8912, test_f1: 0.5310
 epoch: 87, train_loss: 0.8986, test_loss: 0.8902, test_f1: 0.5309
 epoch: 88, train_loss: 0.8941, test_loss: 0.8889, test_f1: 0.5358
 epoch: 89, train_loss: 0.8846, test_loss: 0.8873, test_f1: 0.5407
 epoch: 90, train_loss: 0.8885, test_loss: 0.8862, test_f1: 0.5388
 epoch: 91, train_loss: 0.8849, test_loss: 0.8875, test_f1: 0.5385
 epoch: 92, train_loss: 0.8875, test_loss: 0.8876, test_f1: 0.5398
 epoch: 93, train_loss: 0.8828, test_loss: 0.8902, test_f1: 0.5336
 epoch: 94, train_loss: 0.8792, test_loss: 0.8847, test_f1: 0.5394
 epoch: 95, train_loss: 0.8780, test_loss: 0.8787, test_f1: 0.5446
 epoch: 96, train_loss: 0.8806, test_loss: 0.8814, test_f1: 0.5426
 epoch: 97, train_loss: 0.8764, test_loss: 0.8823, test_f1: 0.5373
 epoch: 98, train_loss: 0.8831, test_loss: 0.8813, test_f1: 0.5395
 epoch: 99, train_loss: 0.8751, test_loss: 0.8795, test_f1: 0.5425
##################ITERATION #2 ****************************************
 epoch: 0, train_loss: 1.3504, test_loss: 1.3592, test_f1: 0.2270
 epoch: 1, train_loss: 1.3227, test_loss: 1.3509, test_f1: 0.2270
 epoch: 2, train_loss: 1.3024, test_loss: 1.3338, test_f1: 0.2270
 epoch: 3, train_loss: 1.2856, test_loss: 1.3045, test_f1: 0.2527
 epoch: 4, train_loss: 1.2665, test_loss: 1.2666, test_f1: 0.3299
 epoch: 5, train_loss: 1.2447, test_loss: 1.2303, test_f1: 0.3467
 epoch: 6, train_loss: 1.2254, test_loss: 1.1989, test_f1: 0.3536
 epoch: 7, train_loss: 1.2056, test_loss: 1.1724, test_f1: 0.3441
 epoch: 8, train_loss: 1.1826, test_loss: 1.1469, test_f1: 0.3441
 epoch: 9, train_loss: 1.1654, test_loss: 1.1262, test_f1: 0.3451
 epoch: 10, train_loss: 1.1442, test_loss: 1.1080, test_f1: 0.3460
 epoch: 11, train_loss: 1.1306, test_loss: 1.0916, test_f1: 0.3460
 epoch: 12, train_loss: 1.1151, test_loss: 1.0779, test_f1: 0.3429
 epoch: 13, train_loss: 1.0986, test_loss: 1.0664, test_f1: 0.3448
 epoch: 14, train_loss: 1.0877, test_loss: 1.0581, test_f1: 0.3464
 epoch: 15, train_loss: 1.0781, test_loss: 1.0478, test_f1: 0.3547
 epoch: 16, train_loss: 1.0703, test_loss: 1.0417, test_f1: 0.3591
 epoch: 17, train_loss: 1.0594, test_loss: 1.0337, test_f1: 0.3764
 epoch: 18, train_loss: 1.0503, test_loss: 1.0303, test_f1: 0.3954
 epoch: 19, train_loss: 1.0440, test_loss: 1.0247, test_f1: 0.4041
 epoch: 20, train_loss: 1.0377, test_loss: 1.0180, test_f1: 0.4105
 epoch: 21, train_loss: 1.0332, test_loss: 1.0125, test_f1: 0.4162
 epoch: 22, train_loss: 1.0253, test_loss: 1.0094, test_f1: 0.4235
 epoch: 23, train_loss: 1.0209, test_loss: 1.0051, test_f1: 0.4255
 epoch: 24, train_loss: 1.0167, test_loss: 1.0013, test_f1: 0.4253
 epoch: 25, train_loss: 1.0103, test_loss: 0.9948, test_f1: 0.4343
 epoch: 26, train_loss: 1.0100, test_loss: 0.9919, test_f1: 0.4409
 epoch: 27, train_loss: 1.0036, test_loss: 0.9883, test_f1: 0.4465
 epoch: 28, train_loss: 0.9929, test_loss: 0.9828, test_f1: 0.4630
 epoch: 29, train_loss: 0.9906, test_loss: 0.9752, test_f1: 0.4494
 epoch: 30, train_loss: 0.9889, test_loss: 0.9714, test_f1: 0.4791
 epoch: 31, train_loss: 0.9863, test_loss: 0.9722, test_f1: 0.4799
 epoch: 32, train_loss: 0.9841, test_loss: 0.9669, test_f1: 0.4825
 epoch: 33, train_loss: 0.9722, test_loss: 0.9621, test_f1: 0.4858
 epoch: 34, train_loss: 0.9752, test_loss: 0.9564, test_f1: 0.4878
 epoch: 35, train_loss: 0.9724, test_loss: 0.9542, test_f1: 0.4847
 epoch: 36, train_loss: 0.9698, test_loss: 0.9531, test_f1: 0.4902
 epoch: 37, train_loss: 0.9668, test_loss: 0.9515, test_f1: 0.4943
 epoch: 38, train_loss: 0.9630, test_loss: 0.9525, test_f1: 0.4961
 epoch: 39, train_loss: 0.9572, test_loss: 0.9437, test_f1: 0.4968
 epoch: 40, train_loss: 0.9526, test_loss: 0.9418, test_f1: 0.5054
 epoch: 41, train_loss: 0.9485, test_loss: 0.9374, test_f1: 0.4917
 epoch: 42, train_loss: 0.9512, test_loss: 0.9367, test_f1: 0.4987
 epoch: 43, train_loss: 0.9405, test_loss: 0.9269, test_f1: 0.4978
 epoch: 44, train_loss: 0.9430, test_loss: 0.9294, test_f1: 0.4960
 epoch: 45, train_loss: 0.9370, test_loss: 0.9312, test_f1: 0.4961
 epoch: 46, train_loss: 0.9331, test_loss: 0.9255, test_f1: 0.5047
 epoch: 47, train_loss: 0.9308, test_loss: 0.9196, test_f1: 0.5109
 epoch: 48, train_loss: 0.9282, test_loss: 0.9227, test_f1: 0.5071
 epoch: 49, train_loss: 0.9267, test_loss: 0.9157, test_f1: 0.5141
 epoch: 50, train_loss: 0.9220, test_loss: 0.9105, test_f1: 0.5171
 epoch: 51, train_loss: 0.9169, test_loss: 0.9113, test_f1: 0.5137
 epoch: 52, train_loss: 0.9163, test_loss: 0.9115, test_f1: 0.5165
 epoch: 53, train_loss: 0.9149, test_loss: 0.9110, test_f1: 0.5175
 epoch: 54, train_loss: 0.9183, test_loss: 0.9098, test_f1: 0.5136
 epoch: 55, train_loss: 0.9114, test_loss: 0.9099, test_f1: 0.5126
 epoch: 56, train_loss: 0.9129, test_loss: 0.9112, test_f1: 0.5196
 epoch: 57, train_loss: 0.9087, test_loss: 0.9094, test_f1: 0.5134
 epoch: 58, train_loss: 0.9095, test_loss: 0.9046, test_f1: 0.5197
 epoch: 59, train_loss: 0.9071, test_loss: 0.9055, test_f1: 0.5236
 epoch: 60, train_loss: 0.9104, test_loss: 0.9036, test_f1: 0.5229
 epoch: 61, train_loss: 0.9080, test_loss: 0.9016, test_f1: 0.5253
 epoch: 62, train_loss: 0.8966, test_loss: 0.9010, test_f1: 0.5228
 epoch: 63, train_loss: 0.9032, test_loss: 0.9010, test_f1: 0.5250
 epoch: 64, train_loss: 0.8986, test_loss: 0.9017, test_f1: 0.5213
 epoch: 65, train_loss: 0.9016, test_loss: 0.9027, test_f1: 0.5170
 epoch: 66, train_loss: 0.8945, test_loss: 0.8982, test_f1: 0.5203
 epoch: 67, train_loss: 0.8948, test_loss: 0.8980, test_f1: 0.5278
 epoch: 68, train_loss: 0.8889, test_loss: 0.8945, test_f1: 0.5282
 epoch: 69, train_loss: 0.8977, test_loss: 0.8970, test_f1: 0.5307
 epoch: 70, train_loss: 0.8911, test_loss: 0.8895, test_f1: 0.5208
 epoch: 71, train_loss: 0.8890, test_loss: 0.8944, test_f1: 0.5379
 epoch: 72, train_loss: 0.8859, test_loss: 0.8916, test_f1: 0.5302
 epoch: 73, train_loss: 0.8862, test_loss: 0.8943, test_f1: 0.5274
 epoch: 74, train_loss: 0.8896, test_loss: 0.8895, test_f1: 0.5300
 epoch: 75, train_loss: 0.8873, test_loss: 0.8945, test_f1: 0.5236
 epoch: 76, train_loss: 0.8863, test_loss: 0.8908, test_f1: 0.5245
 epoch: 77, train_loss: 0.8831, test_loss: 0.8900, test_f1: 0.5327
 epoch: 78, train_loss: 0.8757, test_loss: 0.8924, test_f1: 0.5277
 epoch: 79, train_loss: 0.8774, test_loss: 0.8882, test_f1: 0.5255
 epoch: 80, train_loss: 0.8755, test_loss: 0.8872, test_f1: 0.5351
 epoch: 81, train_loss: 0.8749, test_loss: 0.8890, test_f1: 0.5347
 epoch: 82, train_loss: 0.8759, test_loss: 0.8905, test_f1: 0.5254
 epoch: 83, train_loss: 0.8780, test_loss: 0.8780, test_f1: 0.5289
 epoch: 84, train_loss: 0.8777, test_loss: 0.8805, test_f1: 0.5421
 epoch: 85, train_loss: 0.8720, test_loss: 0.8796, test_f1: 0.5346
 epoch: 86, train_loss: 0.8710, test_loss: 0.8813, test_f1: 0.5343
 epoch: 87, train_loss: 0.8631, test_loss: 0.8764, test_f1: 0.5266
 epoch: 88, train_loss: 0.8744, test_loss: 0.8832, test_f1: 0.5370
 epoch: 89, train_loss: 0.8666, test_loss: 0.8817, test_f1: 0.5321
 epoch: 90, train_loss: 0.8655, test_loss: 0.8778, test_f1: 0.5447
 epoch: 91, train_loss: 0.8640, test_loss: 0.8749, test_f1: 0.5376
 epoch: 92, train_loss: 0.8664, test_loss: 0.8784, test_f1: 0.5309
 epoch: 93, train_loss: 0.8623, test_loss: 0.8871, test_f1: 0.5328
 epoch: 94, train_loss: 0.8573, test_loss: 0.8798, test_f1: 0.5364
 epoch: 95, train_loss: 0.8617, test_loss: 0.8719, test_f1: 0.5301
 epoch: 96, train_loss: 0.8592, test_loss: 0.8776, test_f1: 0.5345
 epoch: 97, train_loss: 0.8589, test_loss: 0.8705, test_f1: 0.5426
 epoch: 98, train_loss: 0.8519, test_loss: 0.8733, test_f1: 0.5298
 epoch: 99, train_loss: 0.8599, test_loss: 0.8736, test_f1: 0.5457
##################ITERATION #3 ****************************************
 epoch: 0, train_loss: 1.3078, test_loss: 1.3171, test_f1: 0.2270
 epoch: 1, train_loss: 1.2740, test_loss: 1.2996, test_f1: 0.2270
 epoch: 2, train_loss: 1.2539, test_loss: 1.2725, test_f1: 0.2270
 epoch: 3, train_loss: 1.2376, test_loss: 1.2344, test_f1: 0.2270
 epoch: 4, train_loss: 1.2186, test_loss: 1.1994, test_f1: 0.3300
 epoch: 5, train_loss: 1.1969, test_loss: 1.1678, test_f1: 0.3548
 epoch: 6, train_loss: 1.1774, test_loss: 1.1408, test_f1: 0.3474
 epoch: 7, train_loss: 1.1575, test_loss: 1.1169, test_f1: 0.3478
 epoch: 8, train_loss: 1.1372, test_loss: 1.0956, test_f1: 0.3633
 epoch: 9, train_loss: 1.1146, test_loss: 1.0793, test_f1: 0.3992
 epoch: 10, train_loss: 1.0992, test_loss: 1.0645, test_f1: 0.4000
 epoch: 11, train_loss: 1.0851, test_loss: 1.0505, test_f1: 0.4082
 epoch: 12, train_loss: 1.0724, test_loss: 1.0385, test_f1: 0.4184
 epoch: 13, train_loss: 1.0578, test_loss: 1.0303, test_f1: 0.4267
 epoch: 14, train_loss: 1.0510, test_loss: 1.0214, test_f1: 0.4326
 epoch: 15, train_loss: 1.0453, test_loss: 1.0149, test_f1: 0.4335
 epoch: 16, train_loss: 1.0399, test_loss: 1.0078, test_f1: 0.4419
 epoch: 17, train_loss: 1.0279, test_loss: 1.0018, test_f1: 0.4407
 epoch: 18, train_loss: 1.0220, test_loss: 0.9969, test_f1: 0.4586
 epoch: 19, train_loss: 1.0144, test_loss: 0.9898, test_f1: 0.4679
 epoch: 20, train_loss: 1.0077, test_loss: 0.9837, test_f1: 0.4660
 epoch: 21, train_loss: 1.0047, test_loss: 0.9808, test_f1: 0.4699
 epoch: 22, train_loss: 0.9997, test_loss: 0.9770, test_f1: 0.4704
 epoch: 23, train_loss: 0.9936, test_loss: 0.9751, test_f1: 0.4823
 epoch: 24, train_loss: 0.9864, test_loss: 0.9714, test_f1: 0.4875
 epoch: 25, train_loss: 0.9857, test_loss: 0.9641, test_f1: 0.4904
 epoch: 26, train_loss: 0.9797, test_loss: 0.9601, test_f1: 0.4936
 epoch: 27, train_loss: 0.9752, test_loss: 0.9580, test_f1: 0.4924
 epoch: 28, train_loss: 0.9689, test_loss: 0.9539, test_f1: 0.4892
 epoch: 29, train_loss: 0.9674, test_loss: 0.9489, test_f1: 0.4945
 epoch: 30, train_loss: 0.9626, test_loss: 0.9450, test_f1: 0.4962
 epoch: 31, train_loss: 0.9610, test_loss: 0.9430, test_f1: 0.4900
 epoch: 32, train_loss: 0.9612, test_loss: 0.9401, test_f1: 0.4976
 epoch: 33, train_loss: 0.9477, test_loss: 0.9396, test_f1: 0.4950
 epoch: 34, train_loss: 0.9461, test_loss: 0.9353, test_f1: 0.5059
 epoch: 35, train_loss: 0.9416, test_loss: 0.9332, test_f1: 0.5128
 epoch: 36, train_loss: 0.9404, test_loss: 0.9294, test_f1: 0.5051
 epoch: 37, train_loss: 0.9389, test_loss: 0.9260, test_f1: 0.5193
 epoch: 38, train_loss: 0.9343, test_loss: 0.9256, test_f1: 0.5194
 epoch: 39, train_loss: 0.9327, test_loss: 0.9250, test_f1: 0.5163
 epoch: 40, train_loss: 0.9208, test_loss: 0.9174, test_f1: 0.5112
 epoch: 41, train_loss: 0.9229, test_loss: 0.9180, test_f1: 0.5208
 epoch: 42, train_loss: 0.9170, test_loss: 0.9109, test_f1: 0.5252
 epoch: 43, train_loss: 0.9148, test_loss: 0.9109, test_f1: 0.5208
 epoch: 44, train_loss: 0.9126, test_loss: 0.9068, test_f1: 0.5223
 epoch: 45, train_loss: 0.9191, test_loss: 0.9039, test_f1: 0.5265
 epoch: 46, train_loss: 0.9068, test_loss: 0.8974, test_f1: 0.5279
 epoch: 47, train_loss: 0.9068, test_loss: 0.9018, test_f1: 0.5205
 epoch: 48, train_loss: 0.9012, test_loss: 0.8960, test_f1: 0.5308
 epoch: 49, train_loss: 0.9025, test_loss: 0.8895, test_f1: 0.5218
 epoch: 50, train_loss: 0.9016, test_loss: 0.8828, test_f1: 0.5335
 epoch: 51, train_loss: 0.8878, test_loss: 0.8839, test_f1: 0.5239
 epoch: 52, train_loss: 0.8937, test_loss: 0.8847, test_f1: 0.5211
 epoch: 53, train_loss: 0.8862, test_loss: 0.8805, test_f1: 0.5321
 epoch: 54, train_loss: 0.8851, test_loss: 0.8778, test_f1: 0.5274
 epoch: 55, train_loss: 0.8870, test_loss: 0.8765, test_f1: 0.5357
 epoch: 56, train_loss: 0.8832, test_loss: 0.8776, test_f1: 0.5311
 epoch: 57, train_loss: 0.8857, test_loss: 0.8767, test_f1: 0.5301
 epoch: 58, train_loss: 0.8775, test_loss: 0.8760, test_f1: 0.5281
 epoch: 59, train_loss: 0.8815, test_loss: 0.8760, test_f1: 0.5356
 epoch: 60, train_loss: 0.8796, test_loss: 0.8753, test_f1: 0.5283
 epoch: 61, train_loss: 0.8773, test_loss: 0.8741, test_f1: 0.5312
 epoch: 62, train_loss: 0.8721, test_loss: 0.8724, test_f1: 0.5298
 epoch: 63, train_loss: 0.8737, test_loss: 0.8699, test_f1: 0.5333
 epoch: 64, train_loss: 0.8719, test_loss: 0.8694, test_f1: 0.5377
 epoch: 65, train_loss: 0.8663, test_loss: 0.8676, test_f1: 0.5318
 epoch: 66, train_loss: 0.8683, test_loss: 0.8659, test_f1: 0.5274
 epoch: 67, train_loss: 0.8663, test_loss: 0.8661, test_f1: 0.5299
 epoch: 68, train_loss: 0.8660, test_loss: 0.8650, test_f1: 0.5279
 epoch: 69, train_loss: 0.8690, test_loss: 0.8669, test_f1: 0.5249
 epoch: 70, train_loss: 0.8622, test_loss: 0.8640, test_f1: 0.5406
 epoch: 71, train_loss: 0.8621, test_loss: 0.8621, test_f1: 0.5277
 epoch: 72, train_loss: 0.8633, test_loss: 0.8608, test_f1: 0.5291
 epoch: 73, train_loss: 0.8603, test_loss: 0.8583, test_f1: 0.5437
 epoch: 74, train_loss: 0.8602, test_loss: 0.8605, test_f1: 0.5394
 epoch: 75, train_loss: 0.8548, test_loss: 0.8586, test_f1: 0.5309
 epoch: 76, train_loss: 0.8577, test_loss: 0.8574, test_f1: 0.5440
 epoch: 77, train_loss: 0.8584, test_loss: 0.8588, test_f1: 0.5330
 epoch: 78, train_loss: 0.8593, test_loss: 0.8569, test_f1: 0.5328
 epoch: 79, train_loss: 0.8531, test_loss: 0.8537, test_f1: 0.5460
 epoch: 80, train_loss: 0.8516, test_loss: 0.8565, test_f1: 0.5299
 epoch: 81, train_loss: 0.8509, test_loss: 0.8531, test_f1: 0.5469
 epoch: 82, train_loss: 0.8406, test_loss: 0.8517, test_f1: 0.5356
 epoch: 83, train_loss: 0.8444, test_loss: 0.8536, test_f1: 0.5312
 epoch: 84, train_loss: 0.8509, test_loss: 0.8501, test_f1: 0.5344
 epoch: 85, train_loss: 0.8441, test_loss: 0.8492, test_f1: 0.5321
 epoch: 86, train_loss: 0.8479, test_loss: 0.8506, test_f1: 0.5489
 epoch: 87, train_loss: 0.8489, test_loss: 0.8510, test_f1: 0.5423
 epoch: 88, train_loss: 0.8429, test_loss: 0.8521, test_f1: 0.5293
 epoch: 89, train_loss: 0.8476, test_loss: 0.8503, test_f1: 0.5351
 epoch: 90, train_loss: 0.8421, test_loss: 0.8464, test_f1: 0.5401
 epoch: 91, train_loss: 0.8448, test_loss: 0.8492, test_f1: 0.5346
 epoch: 92, train_loss: 0.8380, test_loss: 0.8486, test_f1: 0.5307
 epoch: 93, train_loss: 0.8335, test_loss: 0.8464, test_f1: 0.5341
 epoch: 94, train_loss: 0.8322, test_loss: 0.8435, test_f1: 0.5407
 epoch: 95, train_loss: 0.8302, test_loss: 0.8432, test_f1: 0.5402
 epoch: 96, train_loss: 0.8352, test_loss: 0.8397, test_f1: 0.5425
 epoch: 97, train_loss: 0.8351, test_loss: 0.8429, test_f1: 0.5358
 epoch: 98, train_loss: 0.8315, test_loss: 0.8399, test_f1: 0.5361
 epoch: 99, train_loss: 0.8281, test_loss: 0.8387, test_f1: 0.5326
##################ITERATION #4 ****************************************
 epoch: 0, train_loss: 1.3167, test_loss: 1.3352, test_f1: 0.2270
 epoch: 1, train_loss: 1.2814, test_loss: 1.3238, test_f1: 0.2270
 epoch: 2, train_loss: 1.2558, test_loss: 1.3015, test_f1: 0.2270
 epoch: 3, train_loss: 1.2363, test_loss: 1.2631, test_f1: 0.2320
 epoch: 4, train_loss: 1.2153, test_loss: 1.2199, test_f1: 0.3273
 epoch: 5, train_loss: 1.1985, test_loss: 1.1784, test_f1: 0.4296
 epoch: 6, train_loss: 1.1698, test_loss: 1.1439, test_f1: 0.4256
 epoch: 7, train_loss: 1.1521, test_loss: 1.1184, test_f1: 0.4330
 epoch: 8, train_loss: 1.1373, test_loss: 1.0969, test_f1: 0.4343
 epoch: 9, train_loss: 1.1174, test_loss: 1.0793, test_f1: 0.4309
 epoch: 10, train_loss: 1.1003, test_loss: 1.0648, test_f1: 0.4297
 epoch: 11, train_loss: 1.0894, test_loss: 1.0520, test_f1: 0.4318
 epoch: 12, train_loss: 1.0745, test_loss: 1.0420, test_f1: 0.4311
 epoch: 13, train_loss: 1.0679, test_loss: 1.0336, test_f1: 0.4409
 epoch: 14, train_loss: 1.0615, test_loss: 1.0270, test_f1: 0.4461
 epoch: 15, train_loss: 1.0451, test_loss: 1.0207, test_f1: 0.4396
 epoch: 16, train_loss: 1.0421, test_loss: 1.0141, test_f1: 0.4376
 epoch: 17, train_loss: 1.0285, test_loss: 1.0080, test_f1: 0.4424
 epoch: 18, train_loss: 1.0265, test_loss: 1.0041, test_f1: 0.4513
 epoch: 19, train_loss: 1.0196, test_loss: 0.9987, test_f1: 0.4502
 epoch: 20, train_loss: 1.0158, test_loss: 0.9939, test_f1: 0.4639
 epoch: 21, train_loss: 1.0114, test_loss: 0.9887, test_f1: 0.4643
 epoch: 22, train_loss: 1.0025, test_loss: 0.9848, test_f1: 0.4678
 epoch: 23, train_loss: 1.0004, test_loss: 0.9819, test_f1: 0.4712
 epoch: 24, train_loss: 0.9995, test_loss: 0.9774, test_f1: 0.4688
 epoch: 25, train_loss: 0.9880, test_loss: 0.9753, test_f1: 0.4703
 epoch: 26, train_loss: 0.9834, test_loss: 0.9699, test_f1: 0.4732
 epoch: 27, train_loss: 0.9834, test_loss: 0.9667, test_f1: 0.4770
 epoch: 28, train_loss: 0.9818, test_loss: 0.9646, test_f1: 0.4756
 epoch: 29, train_loss: 0.9762, test_loss: 0.9615, test_f1: 0.4780
 epoch: 30, train_loss: 0.9689, test_loss: 0.9598, test_f1: 0.4801
 epoch: 31, train_loss: 0.9641, test_loss: 0.9563, test_f1: 0.4865
 epoch: 32, train_loss: 0.9573, test_loss: 0.9514, test_f1: 0.4873
 epoch: 33, train_loss: 0.9604, test_loss: 0.9508, test_f1: 0.4814
 epoch: 34, train_loss: 0.9561, test_loss: 0.9493, test_f1: 0.4901
 epoch: 35, train_loss: 0.9532, test_loss: 0.9449, test_f1: 0.4834
 epoch: 36, train_loss: 0.9492, test_loss: 0.9421, test_f1: 0.4912
 epoch: 37, train_loss: 0.9480, test_loss: 0.9384, test_f1: 0.5020
 epoch: 38, train_loss: 0.9411, test_loss: 0.9359, test_f1: 0.5057
 epoch: 39, train_loss: 0.9419, test_loss: 0.9350, test_f1: 0.4948
 epoch: 40, train_loss: 0.9349, test_loss: 0.9269, test_f1: 0.5058
 epoch: 41, train_loss: 0.9312, test_loss: 0.9286, test_f1: 0.4950
 epoch: 42, train_loss: 0.9347, test_loss: 0.9241, test_f1: 0.5040
 epoch: 43, train_loss: 0.9225, test_loss: 0.9185, test_f1: 0.5031
 epoch: 44, train_loss: 0.9268, test_loss: 0.9196, test_f1: 0.5045
 epoch: 45, train_loss: 0.9222, test_loss: 0.9140, test_f1: 0.5016
 epoch: 46, train_loss: 0.9217, test_loss: 0.9130, test_f1: 0.5081
 epoch: 47, train_loss: 0.9165, test_loss: 0.9083, test_f1: 0.5040
 epoch: 48, train_loss: 0.9092, test_loss: 0.9069, test_f1: 0.5158
 epoch: 49, train_loss: 0.9121, test_loss: 0.9031, test_f1: 0.5148
 epoch: 50, train_loss: 0.9091, test_loss: 0.9104, test_f1: 0.5106
 epoch: 51, train_loss: 0.9083, test_loss: 0.8982, test_f1: 0.5110
 epoch: 52, train_loss: 0.8989, test_loss: 0.8960, test_f1: 0.5091
 epoch: 53, train_loss: 0.8966, test_loss: 0.8956, test_f1: 0.5114
 epoch: 54, train_loss: 0.9031, test_loss: 0.8956, test_f1: 0.5186
 epoch: 55, train_loss: 0.8999, test_loss: 0.8942, test_f1: 0.5145
 epoch: 56, train_loss: 0.8963, test_loss: 0.8969, test_f1: 0.5170
 epoch: 57, train_loss: 0.8928, test_loss: 0.8928, test_f1: 0.5169
 epoch: 58, train_loss: 0.8912, test_loss: 0.8895, test_f1: 0.5260
 epoch: 59, train_loss: 0.8854, test_loss: 0.8866, test_f1: 0.5179
 epoch: 60, train_loss: 0.8914, test_loss: 0.8872, test_f1: 0.5198
 epoch: 61, train_loss: 0.8865, test_loss: 0.8892, test_f1: 0.5287
 epoch: 62, train_loss: 0.8837, test_loss: 0.8824, test_f1: 0.5262
 epoch: 63, train_loss: 0.8861, test_loss: 0.8821, test_f1: 0.5289
 epoch: 64, train_loss: 0.8821, test_loss: 0.8840, test_f1: 0.5335
 epoch: 65, train_loss: 0.8871, test_loss: 0.8847, test_f1: 0.5325
 epoch: 66, train_loss: 0.8779, test_loss: 0.8819, test_f1: 0.5334
 epoch: 67, train_loss: 0.8795, test_loss: 0.8805, test_f1: 0.5299
 epoch: 68, train_loss: 0.8747, test_loss: 0.8776, test_f1: 0.5330
 epoch: 69, train_loss: 0.8763, test_loss: 0.8795, test_f1: 0.5363
 epoch: 70, train_loss: 0.8753, test_loss: 0.8761, test_f1: 0.5366
 epoch: 71, train_loss: 0.8739, test_loss: 0.8791, test_f1: 0.5348
 epoch: 72, train_loss: 0.8731, test_loss: 0.8784, test_f1: 0.5361
 epoch: 73, train_loss: 0.8701, test_loss: 0.8748, test_f1: 0.5360
 epoch: 74, train_loss: 0.8665, test_loss: 0.8730, test_f1: 0.5356
 epoch: 75, train_loss: 0.8743, test_loss: 0.8715, test_f1: 0.5470
 epoch: 76, train_loss: 0.8661, test_loss: 0.8751, test_f1: 0.5381
 epoch: 77, train_loss: 0.8644, test_loss: 0.8740, test_f1: 0.5328
 epoch: 78, train_loss: 0.8607, test_loss: 0.8706, test_f1: 0.5365
 epoch: 79, train_loss: 0.8545, test_loss: 0.8680, test_f1: 0.5435
 epoch: 80, train_loss: 0.8581, test_loss: 0.8713, test_f1: 0.5363
 epoch: 81, train_loss: 0.8544, test_loss: 0.8679, test_f1: 0.5393
 epoch: 82, train_loss: 0.8607, test_loss: 0.8674, test_f1: 0.5436
 epoch: 83, train_loss: 0.8623, test_loss: 0.8691, test_f1: 0.5444
 epoch: 84, train_loss: 0.8553, test_loss: 0.8667, test_f1: 0.5390
 epoch: 85, train_loss: 0.8533, test_loss: 0.8656, test_f1: 0.5415
 epoch: 86, train_loss: 0.8505, test_loss: 0.8668, test_f1: 0.5423
 epoch: 87, train_loss: 0.8511, test_loss: 0.8683, test_f1: 0.5395
 epoch: 88, train_loss: 0.8521, test_loss: 0.8636, test_f1: 0.5482
 epoch: 89, train_loss: 0.8579, test_loss: 0.8687, test_f1: 0.5349
 epoch: 90, train_loss: 0.8433, test_loss: 0.8634, test_f1: 0.5475
 epoch: 91, train_loss: 0.8456, test_loss: 0.8637, test_f1: 0.5496
 epoch: 92, train_loss: 0.8500, test_loss: 0.8622, test_f1: 0.5473
 epoch: 93, train_loss: 0.8459, test_loss: 0.8619, test_f1: 0.5500
 epoch: 94, train_loss: 0.8455, test_loss: 0.8622, test_f1: 0.5446
 epoch: 95, train_loss: 0.8455, test_loss: 0.8608, test_f1: 0.5508
 epoch: 96, train_loss: 0.8378, test_loss: 0.8575, test_f1: 0.5578
 epoch: 97, train_loss: 0.8431, test_loss: 0.8578, test_f1: 0.5512
 epoch: 98, train_loss: 0.8457, test_loss: 0.8620, test_f1: 0.5470
 epoch: 99, train_loss: 0.8448, test_loss: 0.8557, test_f1: 0.5579
##################ITERATION #5 ****************************************
 epoch: 0, train_loss: 1.3111, test_loss: 1.3170, test_f1: 0.2270
 epoch: 1, train_loss: 1.2509, test_loss: 1.2991, test_f1: 0.2270
 epoch: 2, train_loss: 1.2189, test_loss: 1.2634, test_f1: 0.2270
 epoch: 3, train_loss: 1.1946, test_loss: 1.2077, test_f1: 0.3080
 epoch: 4, train_loss: 1.1667, test_loss: 1.1461, test_f1: 0.3497
 epoch: 5, train_loss: 1.1373, test_loss: 1.1043, test_f1: 0.3834
 epoch: 6, train_loss: 1.1179, test_loss: 1.0802, test_f1: 0.4131
 epoch: 7, train_loss: 1.1046, test_loss: 1.0617, test_f1: 0.4265
 epoch: 8, train_loss: 1.0870, test_loss: 1.0490, test_f1: 0.4385
 epoch: 9, train_loss: 1.0760, test_loss: 1.0389, test_f1: 0.4491
 epoch: 10, train_loss: 1.0574, test_loss: 1.0292, test_f1: 0.4502
 epoch: 11, train_loss: 1.0545, test_loss: 1.0208, test_f1: 0.4416
 epoch: 12, train_loss: 1.0427, test_loss: 1.0155, test_f1: 0.4408
 epoch: 13, train_loss: 1.0287, test_loss: 1.0069, test_f1: 0.4552
 epoch: 14, train_loss: 1.0280, test_loss: 0.9998, test_f1: 0.4653
 epoch: 15, train_loss: 1.0175, test_loss: 0.9916, test_f1: 0.4672
 epoch: 16, train_loss: 1.0116, test_loss: 0.9858, test_f1: 0.4777
 epoch: 17, train_loss: 0.9990, test_loss: 0.9840, test_f1: 0.4775
 epoch: 18, train_loss: 1.0038, test_loss: 0.9797, test_f1: 0.4817
 epoch: 19, train_loss: 0.9948, test_loss: 0.9796, test_f1: 0.4869
 epoch: 20, train_loss: 0.9932, test_loss: 0.9728, test_f1: 0.4852
 epoch: 21, train_loss: 0.9845, test_loss: 0.9673, test_f1: 0.4839
 epoch: 22, train_loss: 0.9789, test_loss: 0.9667, test_f1: 0.4784
 epoch: 23, train_loss: 0.9711, test_loss: 0.9604, test_f1: 0.4863
 epoch: 24, train_loss: 0.9665, test_loss: 0.9578, test_f1: 0.4850
 epoch: 25, train_loss: 0.9654, test_loss: 0.9538, test_f1: 0.4759
 epoch: 26, train_loss: 0.9714, test_loss: 0.9497, test_f1: 0.4888
 epoch: 27, train_loss: 0.9614, test_loss: 0.9474, test_f1: 0.4819
 epoch: 28, train_loss: 0.9567, test_loss: 0.9456, test_f1: 0.4869
 epoch: 29, train_loss: 0.9486, test_loss: 0.9470, test_f1: 0.4936
 epoch: 30, train_loss: 0.9524, test_loss: 0.9421, test_f1: 0.4989
 epoch: 31, train_loss: 0.9497, test_loss: 0.9387, test_f1: 0.5015
 epoch: 32, train_loss: 0.9450, test_loss: 0.9330, test_f1: 0.5132
 epoch: 33, train_loss: 0.9407, test_loss: 0.9363, test_f1: 0.4998
 epoch: 34, train_loss: 0.9304, test_loss: 0.9330, test_f1: 0.5146
 epoch: 35, train_loss: 0.9262, test_loss: 0.9272, test_f1: 0.5136
 epoch: 36, train_loss: 0.9313, test_loss: 0.9256, test_f1: 0.5068
 epoch: 37, train_loss: 0.9278, test_loss: 0.9193, test_f1: 0.5243
 epoch: 38, train_loss: 0.9229, test_loss: 0.9165, test_f1: 0.5191
 epoch: 39, train_loss: 0.9210, test_loss: 0.9150, test_f1: 0.5194
 epoch: 40, train_loss: 0.9224, test_loss: 0.9158, test_f1: 0.5242
 epoch: 41, train_loss: 0.9095, test_loss: 0.9128, test_f1: 0.5266
 epoch: 42, train_loss: 0.9115, test_loss: 0.9064, test_f1: 0.5356
 epoch: 43, train_loss: 0.9095, test_loss: 0.9080, test_f1: 0.5329
 epoch: 44, train_loss: 0.9104, test_loss: 0.9063, test_f1: 0.5343
 epoch: 45, train_loss: 0.9046, test_loss: 0.9040, test_f1: 0.5393
 epoch: 46, train_loss: 0.8968, test_loss: 0.9036, test_f1: 0.5346
 epoch: 47, train_loss: 0.8959, test_loss: 0.9011, test_f1: 0.5393
 epoch: 48, train_loss: 0.8943, test_loss: 0.8976, test_f1: 0.5378
 epoch: 49, train_loss: 0.8988, test_loss: 0.9001, test_f1: 0.5308
 epoch: 50, train_loss: 0.8959, test_loss: 0.8938, test_f1: 0.5293
 epoch: 51, train_loss: 0.8894, test_loss: 0.8958, test_f1: 0.5289
 epoch: 52, train_loss: 0.8827, test_loss: 0.8911, test_f1: 0.5276
 epoch: 53, train_loss: 0.8806, test_loss: 0.8890, test_f1: 0.5355
 epoch: 54, train_loss: 0.8827, test_loss: 0.8889, test_f1: 0.5371
 epoch: 55, train_loss: 0.8856, test_loss: 0.8921, test_f1: 0.5310
 epoch: 56, train_loss: 0.8847, test_loss: 0.8883, test_f1: 0.5307
 epoch: 57, train_loss: 0.8843, test_loss: 0.8913, test_f1: 0.5306
 epoch: 58, train_loss: 0.8724, test_loss: 0.8903, test_f1: 0.5333
 epoch: 59, train_loss: 0.8841, test_loss: 0.8917, test_f1: 0.5343
 epoch: 60, train_loss: 0.8836, test_loss: 0.8873, test_f1: 0.5343
 epoch: 61, train_loss: 0.8761, test_loss: 0.8876, test_f1: 0.5306
 epoch: 62, train_loss: 0.8769, test_loss: 0.8844, test_f1: 0.5317
 epoch: 63, train_loss: 0.8641, test_loss: 0.8801, test_f1: 0.5327
 epoch: 64, train_loss: 0.8711, test_loss: 0.8809, test_f1: 0.5333
 epoch: 65, train_loss: 0.8749, test_loss: 0.8797, test_f1: 0.5319
 epoch: 66, train_loss: 0.8731, test_loss: 0.8798, test_f1: 0.5356
 epoch: 67, train_loss: 0.8738, test_loss: 0.8810, test_f1: 0.5408
 epoch: 68, train_loss: 0.8681, test_loss: 0.8781, test_f1: 0.5336
 epoch: 69, train_loss: 0.8691, test_loss: 0.8765, test_f1: 0.5390
 epoch: 70, train_loss: 0.8687, test_loss: 0.8728, test_f1: 0.5401
 epoch: 71, train_loss: 0.8645, test_loss: 0.8769, test_f1: 0.5303
 epoch: 72, train_loss: 0.8660, test_loss: 0.8787, test_f1: 0.5327
 epoch: 73, train_loss: 0.8603, test_loss: 0.8743, test_f1: 0.5343
 epoch: 74, train_loss: 0.8588, test_loss: 0.8729, test_f1: 0.5301
 epoch: 75, train_loss: 0.8537, test_loss: 0.8737, test_f1: 0.5364
 epoch: 76, train_loss: 0.8548, test_loss: 0.8771, test_f1: 0.5327
 epoch: 77, train_loss: 0.8589, test_loss: 0.8698, test_f1: 0.5366
 epoch: 78, train_loss: 0.8553, test_loss: 0.8713, test_f1: 0.5405
 epoch: 79, train_loss: 0.8562, test_loss: 0.8721, test_f1: 0.5445
 epoch: 80, train_loss: 0.8556, test_loss: 0.8681, test_f1: 0.5394
 epoch: 81, train_loss: 0.8607, test_loss: 0.8663, test_f1: 0.5427
 epoch: 82, train_loss: 0.8529, test_loss: 0.8708, test_f1: 0.5407
 epoch: 83, train_loss: 0.8538, test_loss: 0.8695, test_f1: 0.5392
 epoch: 84, train_loss: 0.8489, test_loss: 0.8721, test_f1: 0.5411
 epoch: 85, train_loss: 0.8502, test_loss: 0.8672, test_f1: 0.5375
 epoch: 86, train_loss: 0.8496, test_loss: 0.8678, test_f1: 0.5446
 epoch: 87, train_loss: 0.8501, test_loss: 0.8641, test_f1: 0.5446
 epoch: 88, train_loss: 0.8517, test_loss: 0.8619, test_f1: 0.5414
 epoch: 89, train_loss: 0.8423, test_loss: 0.8605, test_f1: 0.5469
 epoch: 90, train_loss: 0.8549, test_loss: 0.8643, test_f1: 0.5438
 epoch: 91, train_loss: 0.8460, test_loss: 0.8593, test_f1: 0.5437
 epoch: 92, train_loss: 0.8414, test_loss: 0.8627, test_f1: 0.5421
 epoch: 93, train_loss: 0.8361, test_loss: 0.8618, test_f1: 0.5416
 epoch: 94, train_loss: 0.8343, test_loss: 0.8551, test_f1: 0.5422
 epoch: 95, train_loss: 0.8449, test_loss: 0.8546, test_f1: 0.5445
 epoch: 96, train_loss: 0.8393, test_loss: 0.8584, test_f1: 0.5469
 epoch: 97, train_loss: 0.8339, test_loss: 0.8606, test_f1: 0.5465
 epoch: 98, train_loss: 0.8291, test_loss: 0.8573, test_f1: 0.5441
 epoch: 99, train_loss: 0.8358, test_loss: 0.8541, test_f1: 0.5442
##################ITERATION #6 ****************************************
 epoch: 0, train_loss: 1.3047, test_loss: 1.3147, test_f1: 0.2270
 epoch: 1, train_loss: 1.2322, test_loss: 1.2935, test_f1: 0.2270
 epoch: 2, train_loss: 1.2056, test_loss: 1.2295, test_f1: 0.2251
 epoch: 3, train_loss: 1.1759, test_loss: 1.1585, test_f1: 0.3351
 epoch: 4, train_loss: 1.1534, test_loss: 1.1139, test_f1: 0.4033
 epoch: 5, train_loss: 1.1275, test_loss: 1.0856, test_f1: 0.4244
 epoch: 6, train_loss: 1.1119, test_loss: 1.0625, test_f1: 0.4287
 epoch: 7, train_loss: 1.0902, test_loss: 1.0448, test_f1: 0.4247
 epoch: 8, train_loss: 1.0808, test_loss: 1.0322, test_f1: 0.4513
 epoch: 9, train_loss: 1.0660, test_loss: 1.0235, test_f1: 0.4554
 epoch: 10, train_loss: 1.0540, test_loss: 1.0168, test_f1: 0.4517
 epoch: 11, train_loss: 1.0485, test_loss: 1.0105, test_f1: 0.4601
 epoch: 12, train_loss: 1.0377, test_loss: 1.0047, test_f1: 0.4648
 epoch: 13, train_loss: 1.0323, test_loss: 0.9990, test_f1: 0.4575
 epoch: 14, train_loss: 1.0228, test_loss: 0.9970, test_f1: 0.4627
 epoch: 15, train_loss: 1.0166, test_loss: 0.9940, test_f1: 0.4714
 epoch: 16, train_loss: 1.0105, test_loss: 0.9886, test_f1: 0.4691
 epoch: 17, train_loss: 1.0106, test_loss: 0.9831, test_f1: 0.4701
 epoch: 18, train_loss: 1.0030, test_loss: 0.9813, test_f1: 0.4703
 epoch: 19, train_loss: 0.9958, test_loss: 0.9779, test_f1: 0.4796
 epoch: 20, train_loss: 0.9986, test_loss: 0.9746, test_f1: 0.4756
 epoch: 21, train_loss: 0.9980, test_loss: 0.9717, test_f1: 0.4818
 epoch: 22, train_loss: 0.9850, test_loss: 0.9677, test_f1: 0.4830
 epoch: 23, train_loss: 0.9824, test_loss: 0.9669, test_f1: 0.4843
 epoch: 24, train_loss: 0.9785, test_loss: 0.9687, test_f1: 0.4881
 epoch: 25, train_loss: 0.9739, test_loss: 0.9651, test_f1: 0.4891
 epoch: 26, train_loss: 0.9685, test_loss: 0.9587, test_f1: 0.4884
 epoch: 27, train_loss: 0.9701, test_loss: 0.9583, test_f1: 0.4885
 epoch: 28, train_loss: 0.9688, test_loss: 0.9571, test_f1: 0.4942
 epoch: 29, train_loss: 0.9671, test_loss: 0.9582, test_f1: 0.4945
 epoch: 30, train_loss: 0.9638, test_loss: 0.9559, test_f1: 0.4898
 epoch: 31, train_loss: 0.9618, test_loss: 0.9543, test_f1: 0.4890
 epoch: 32, train_loss: 0.9485, test_loss: 0.9510, test_f1: 0.4874
 epoch: 33, train_loss: 0.9473, test_loss: 0.9510, test_f1: 0.4890
 epoch: 34, train_loss: 0.9467, test_loss: 0.9425, test_f1: 0.5058
 epoch: 35, train_loss: 0.9402, test_loss: 0.9465, test_f1: 0.5046
 epoch: 36, train_loss: 0.9432, test_loss: 0.9412, test_f1: 0.4959
 epoch: 37, train_loss: 0.9363, test_loss: 0.9434, test_f1: 0.5004
 epoch: 38, train_loss: 0.9368, test_loss: 0.9347, test_f1: 0.5173
 epoch: 39, train_loss: 0.9374, test_loss: 0.9414, test_f1: 0.5103
 epoch: 40, train_loss: 0.9321, test_loss: 0.9301, test_f1: 0.5148
 epoch: 41, train_loss: 0.9244, test_loss: 0.9347, test_f1: 0.5248
 epoch: 42, train_loss: 0.9275, test_loss: 0.9296, test_f1: 0.5179
 epoch: 43, train_loss: 0.9200, test_loss: 0.9234, test_f1: 0.5149
 epoch: 44, train_loss: 0.9160, test_loss: 0.9193, test_f1: 0.5131
 epoch: 45, train_loss: 0.9183, test_loss: 0.9225, test_f1: 0.5068
 epoch: 46, train_loss: 0.9137, test_loss: 0.9156, test_f1: 0.5117
 epoch: 47, train_loss: 0.9097, test_loss: 0.9236, test_f1: 0.5409
 epoch: 48, train_loss: 0.9074, test_loss: 0.9108, test_f1: 0.5100
 epoch: 49, train_loss: 0.9122, test_loss: 0.9169, test_f1: 0.5153
 epoch: 50, train_loss: 0.9045, test_loss: 0.9170, test_f1: 0.5277
 epoch: 51, train_loss: 0.8991, test_loss: 0.9148, test_f1: 0.5407
 epoch: 52, train_loss: 0.8949, test_loss: 0.9106, test_f1: 0.5242
 epoch: 53, train_loss: 0.8977, test_loss: 0.9039, test_f1: 0.5369
 epoch: 54, train_loss: 0.8929, test_loss: 0.9019, test_f1: 0.5432
 epoch: 55, train_loss: 0.8915, test_loss: 0.9071, test_f1: 0.5376
 epoch: 56, train_loss: 0.8924, test_loss: 0.8987, test_f1: 0.5425
 epoch: 57, train_loss: 0.8967, test_loss: 0.8959, test_f1: 0.5425
 epoch: 58, train_loss: 0.8887, test_loss: 0.8957, test_f1: 0.5411
 epoch: 59, train_loss: 0.8933, test_loss: 0.9036, test_f1: 0.5367
 epoch: 60, train_loss: 0.8875, test_loss: 0.9018, test_f1: 0.5467
 epoch: 61, train_loss: 0.8874, test_loss: 0.9025, test_f1: 0.5324
 epoch: 62, train_loss: 0.8885, test_loss: 0.8986, test_f1: 0.5422
 epoch: 63, train_loss: 0.8761, test_loss: 0.8948, test_f1: 0.5459
 epoch: 64, train_loss: 0.8805, test_loss: 0.8934, test_f1: 0.5489
 epoch: 65, train_loss: 0.8765, test_loss: 0.8943, test_f1: 0.5518
 epoch: 66, train_loss: 0.8779, test_loss: 0.8944, test_f1: 0.5392
 epoch: 67, train_loss: 0.8746, test_loss: 0.8961, test_f1: 0.5460
 epoch: 68, train_loss: 0.8782, test_loss: 0.8916, test_f1: 0.5467
 epoch: 69, train_loss: 0.8790, test_loss: 0.9012, test_f1: 0.5313
 epoch: 70, train_loss: 0.8704, test_loss: 0.8901, test_f1: 0.5373
 epoch: 71, train_loss: 0.8712, test_loss: 0.8974, test_f1: 0.5338
 epoch: 72, train_loss: 0.8769, test_loss: 0.8913, test_f1: 0.5486
 epoch: 73, train_loss: 0.8720, test_loss: 0.8849, test_f1: 0.5439
 epoch: 74, train_loss: 0.8757, test_loss: 0.8970, test_f1: 0.5524
 epoch: 75, train_loss: 0.8707, test_loss: 0.8835, test_f1: 0.5289
 epoch: 76, train_loss: 0.8656, test_loss: 0.8930, test_f1: 0.5388
 epoch: 77, train_loss: 0.8663, test_loss: 0.8797, test_f1: 0.5412
 epoch: 78, train_loss: 0.8628, test_loss: 0.8879, test_f1: 0.5339
 epoch: 79, train_loss: 0.8577, test_loss: 0.8837, test_f1: 0.5502
 epoch: 80, train_loss: 0.8544, test_loss: 0.8820, test_f1: 0.5441
 epoch: 81, train_loss: 0.8577, test_loss: 0.8799, test_f1: 0.5505
 epoch: 82, train_loss: 0.8585, test_loss: 0.8790, test_f1: 0.5422
 epoch: 83, train_loss: 0.8518, test_loss: 0.8827, test_f1: 0.5468
 epoch: 84, train_loss: 0.8423, test_loss: 0.8826, test_f1: 0.5423
 epoch: 85, train_loss: 0.8532, test_loss: 0.8752, test_f1: 0.5411
 epoch: 86, train_loss: 0.8540, test_loss: 0.8787, test_f1: 0.5510
 epoch: 87, train_loss: 0.8534, test_loss: 0.8796, test_f1: 0.5430
 epoch: 88, train_loss: 0.8501, test_loss: 0.8746, test_f1: 0.5456
 epoch: 89, train_loss: 0.8483, test_loss: 0.8758, test_f1: 0.5473
 epoch: 90, train_loss: 0.8470, test_loss: 0.8746, test_f1: 0.5561
 epoch: 91, train_loss: 0.8435, test_loss: 0.8775, test_f1: 0.5411
 epoch: 92, train_loss: 0.8468, test_loss: 0.8735, test_f1: 0.5459
 epoch: 93, train_loss: 0.8413, test_loss: 0.8662, test_f1: 0.5622
 epoch: 94, train_loss: 0.8433, test_loss: 0.8770, test_f1: 0.5616
 epoch: 95, train_loss: 0.8414, test_loss: 0.8798, test_f1: 0.5556
 epoch: 96, train_loss: 0.8393, test_loss: 0.8722, test_f1: 0.5522
 epoch: 97, train_loss: 0.8373, test_loss: 0.8749, test_f1: 0.5433
 epoch: 98, train_loss: 0.8435, test_loss: 0.8799, test_f1: 0.5483
 epoch: 99, train_loss: 0.8393, test_loss: 0.8727, test_f1: 0.5502
##################ITERATION #7 ****************************************
 epoch: 0, train_loss: 1.2884, test_loss: 1.3064, test_f1: 0.2270
 epoch: 1, train_loss: 1.2230, test_loss: 1.2805, test_f1: 0.2270
 epoch: 2, train_loss: 1.1846, test_loss: 1.2383, test_f1: 0.2270
 epoch: 3, train_loss: 1.1592, test_loss: 1.1740, test_f1: 0.2314
 epoch: 4, train_loss: 1.1235, test_loss: 1.1132, test_f1: 0.4235
 epoch: 5, train_loss: 1.1042, test_loss: 1.0769, test_f1: 0.4395
 epoch: 6, train_loss: 1.0884, test_loss: 1.0548, test_f1: 0.4603
 epoch: 7, train_loss: 1.0805, test_loss: 1.0401, test_f1: 0.4716
 epoch: 8, train_loss: 1.0653, test_loss: 1.0329, test_f1: 0.4694
 epoch: 9, train_loss: 1.0487, test_loss: 1.0219, test_f1: 0.4704
 epoch: 10, train_loss: 1.0362, test_loss: 1.0166, test_f1: 0.4728
 epoch: 11, train_loss: 1.0292, test_loss: 1.0084, test_f1: 0.4747
 epoch: 12, train_loss: 1.0225, test_loss: 1.0018, test_f1: 0.4783
 epoch: 13, train_loss: 1.0142, test_loss: 0.9974, test_f1: 0.4787
 epoch: 14, train_loss: 1.0141, test_loss: 0.9923, test_f1: 0.4790
 epoch: 15, train_loss: 1.0023, test_loss: 0.9814, test_f1: 0.4828
 epoch: 16, train_loss: 0.9955, test_loss: 0.9779, test_f1: 0.4879
 epoch: 17, train_loss: 0.9903, test_loss: 0.9741, test_f1: 0.4906
 epoch: 18, train_loss: 0.9808, test_loss: 0.9670, test_f1: 0.4968
 epoch: 19, train_loss: 0.9771, test_loss: 0.9629, test_f1: 0.4886
 epoch: 20, train_loss: 0.9673, test_loss: 0.9571, test_f1: 0.5208
 epoch: 21, train_loss: 0.9664, test_loss: 0.9527, test_f1: 0.5169
 epoch: 22, train_loss: 0.9614, test_loss: 0.9501, test_f1: 0.5108
 epoch: 23, train_loss: 0.9513, test_loss: 0.9475, test_f1: 0.5207
 epoch: 24, train_loss: 0.9458, test_loss: 0.9356, test_f1: 0.5221
 epoch: 25, train_loss: 0.9437, test_loss: 0.9370, test_f1: 0.5207
 epoch: 26, train_loss: 0.9345, test_loss: 0.9337, test_f1: 0.5110
 epoch: 27, train_loss: 0.9318, test_loss: 0.9276, test_f1: 0.5239
 epoch: 28, train_loss: 0.9307, test_loss: 0.9310, test_f1: 0.5323
 epoch: 29, train_loss: 0.9267, test_loss: 0.9284, test_f1: 0.5225
 epoch: 30, train_loss: 0.9246, test_loss: 0.9283, test_f1: 0.5117
 epoch: 31, train_loss: 0.9182, test_loss: 0.9233, test_f1: 0.5209
 epoch: 32, train_loss: 0.9141, test_loss: 0.9232, test_f1: 0.5213
 epoch: 33, train_loss: 0.9065, test_loss: 0.9181, test_f1: 0.5247
 epoch: 34, train_loss: 0.9029, test_loss: 0.9156, test_f1: 0.5169
 epoch: 35, train_loss: 0.9045, test_loss: 0.9133, test_f1: 0.5296
 epoch: 36, train_loss: 0.9012, test_loss: 0.9133, test_f1: 0.5229
 epoch: 37, train_loss: 0.8955, test_loss: 0.9140, test_f1: 0.5267
 epoch: 38, train_loss: 0.8950, test_loss: 0.9081, test_f1: 0.5279
 epoch: 39, train_loss: 0.8947, test_loss: 0.9048, test_f1: 0.5366
 epoch: 40, train_loss: 0.8818, test_loss: 0.9019, test_f1: 0.5308
 epoch: 41, train_loss: 0.8838, test_loss: 0.9053, test_f1: 0.5364
 epoch: 42, train_loss: 0.8813, test_loss: 0.9035, test_f1: 0.5337
 epoch: 43, train_loss: 0.8731, test_loss: 0.9049, test_f1: 0.5430
 epoch: 44, train_loss: 0.8748, test_loss: 0.9001, test_f1: 0.5414
 epoch: 45, train_loss: 0.8644, test_loss: 0.9048, test_f1: 0.5352
 epoch: 46, train_loss: 0.8676, test_loss: 0.8991, test_f1: 0.5535
 epoch: 47, train_loss: 0.8705, test_loss: 0.8955, test_f1: 0.5530
 epoch: 48, train_loss: 0.8548, test_loss: 0.8929, test_f1: 0.5444
 epoch: 49, train_loss: 0.8602, test_loss: 0.8954, test_f1: 0.5531
 epoch: 50, train_loss: 0.8519, test_loss: 0.8973, test_f1: 0.5533
 epoch: 51, train_loss: 0.8569, test_loss: 0.8894, test_f1: 0.5450
 epoch: 52, train_loss: 0.8509, test_loss: 0.8871, test_f1: 0.5595
 epoch: 53, train_loss: 0.8544, test_loss: 0.8872, test_f1: 0.5589
 epoch: 54, train_loss: 0.8452, test_loss: 0.8874, test_f1: 0.5551
 epoch: 55, train_loss: 0.8430, test_loss: 0.8841, test_f1: 0.5529
 epoch: 56, train_loss: 0.8436, test_loss: 0.8823, test_f1: 0.5552
 epoch: 57, train_loss: 0.8402, test_loss: 0.8806, test_f1: 0.5540
 epoch: 58, train_loss: 0.8397, test_loss: 0.8798, test_f1: 0.5567
 epoch: 59, train_loss: 0.8375, test_loss: 0.8782, test_f1: 0.5502
 epoch: 60, train_loss: 0.8427, test_loss: 0.8832, test_f1: 0.5529
 epoch: 61, train_loss: 0.8385, test_loss: 0.8771, test_f1: 0.5566
 epoch: 62, train_loss: 0.8341, test_loss: 0.8752, test_f1: 0.5577
 epoch: 63, train_loss: 0.8409, test_loss: 0.8755, test_f1: 0.5596
 epoch: 64, train_loss: 0.8347, test_loss: 0.8739, test_f1: 0.5571
 epoch: 65, train_loss: 0.8317, test_loss: 0.8740, test_f1: 0.5566
 epoch: 66, train_loss: 0.8324, test_loss: 0.8702, test_f1: 0.5578
 epoch: 67, train_loss: 0.8330, test_loss: 0.8752, test_f1: 0.5595
 epoch: 68, train_loss: 0.8327, test_loss: 0.8754, test_f1: 0.5591
 epoch: 69, train_loss: 0.8268, test_loss: 0.8746, test_f1: 0.5583
 epoch: 70, train_loss: 0.8160, test_loss: 0.8689, test_f1: 0.5541
 epoch: 71, train_loss: 0.8186, test_loss: 0.8723, test_f1: 0.5584
 epoch: 72, train_loss: 0.8250, test_loss: 0.8703, test_f1: 0.5568
 epoch: 73, train_loss: 0.8191, test_loss: 0.8699, test_f1: 0.5562
 epoch: 74, train_loss: 0.8202, test_loss: 0.8768, test_f1: 0.5587
 epoch: 75, train_loss: 0.8194, test_loss: 0.8706, test_f1: 0.5636
 epoch: 76, train_loss: 0.8174, test_loss: 0.8675, test_f1: 0.5582
 epoch: 77, train_loss: 0.8144, test_loss: 0.8675, test_f1: 0.5561
 epoch: 78, train_loss: 0.8099, test_loss: 0.8670, test_f1: 0.5634
 epoch: 79, train_loss: 0.8089, test_loss: 0.8666, test_f1: 0.5608
 epoch: 80, train_loss: 0.8081, test_loss: 0.8645, test_f1: 0.5610
 epoch: 81, train_loss: 0.8079, test_loss: 0.8648, test_f1: 0.5613
 epoch: 82, train_loss: 0.8106, test_loss: 0.8638, test_f1: 0.5586
 epoch: 83, train_loss: 0.8064, test_loss: 0.8613, test_f1: 0.5622
 epoch: 84, train_loss: 0.8006, test_loss: 0.8638, test_f1: 0.5577
 epoch: 85, train_loss: 0.8029, test_loss: 0.8582, test_f1: 0.5573
 epoch: 86, train_loss: 0.8102, test_loss: 0.8621, test_f1: 0.5651
 epoch: 87, train_loss: 0.8035, test_loss: 0.8612, test_f1: 0.5594
 epoch: 88, train_loss: 0.7948, test_loss: 0.8567, test_f1: 0.5616
 epoch: 89, train_loss: 0.7954, test_loss: 0.8580, test_f1: 0.5608
 epoch: 90, train_loss: 0.8022, test_loss: 0.8576, test_f1: 0.5568
 epoch: 91, train_loss: 0.7934, test_loss: 0.8554, test_f1: 0.5612
 epoch: 92, train_loss: 0.8024, test_loss: 0.8558, test_f1: 0.5632
 epoch: 93, train_loss: 0.7944, test_loss: 0.8558, test_f1: 0.5644
 epoch: 94, train_loss: 0.7939, test_loss: 0.8554, test_f1: 0.5651
 epoch: 95, train_loss: 0.7932, test_loss: 0.8613, test_f1: 0.5613
 epoch: 96, train_loss: 0.7938, test_loss: 0.8540, test_f1: 0.5640
 epoch: 97, train_loss: 0.7922, test_loss: 0.8549, test_f1: 0.5609
 epoch: 98, train_loss: 0.7842, test_loss: 0.8604, test_f1: 0.5668
 epoch: 99, train_loss: 0.7803, test_loss: 0.8583, test_f1: 0.5615
##################ITERATION #8 ****************************************
 epoch: 0, train_loss: 1.3151, test_loss: 1.3453, test_f1: 0.2270
 epoch: 1, train_loss: 1.1947, test_loss: 1.3163, test_f1: 0.2270
 epoch: 2, train_loss: 1.1520, test_loss: 1.2427, test_f1: 0.2270
 epoch: 3, train_loss: 1.1207, test_loss: 1.1429, test_f1: 0.3102
 epoch: 4, train_loss: 1.0957, test_loss: 1.0697, test_f1: 0.3772
 epoch: 5, train_loss: 1.0817, test_loss: 1.0406, test_f1: 0.4250
 epoch: 6, train_loss: 1.0609, test_loss: 1.0292, test_f1: 0.4395
 epoch: 7, train_loss: 1.0477, test_loss: 1.0235, test_f1: 0.4515
 epoch: 8, train_loss: 1.0422, test_loss: 1.0168, test_f1: 0.4581
 epoch: 9, train_loss: 1.0374, test_loss: 1.0138, test_f1: 0.4553
 epoch: 10, train_loss: 1.0334, test_loss: 1.0078, test_f1: 0.4667
 epoch: 11, train_loss: 1.0230, test_loss: 1.0043, test_f1: 0.4667
 epoch: 12, train_loss: 1.0110, test_loss: 0.9994, test_f1: 0.4710
 epoch: 13, train_loss: 1.0105, test_loss: 0.9913, test_f1: 0.4891
 epoch: 14, train_loss: 1.0019, test_loss: 0.9868, test_f1: 0.4977
 epoch: 15, train_loss: 0.9976, test_loss: 0.9845, test_f1: 0.4894
 epoch: 16, train_loss: 0.9922, test_loss: 0.9800, test_f1: 0.5124
 epoch: 17, train_loss: 0.9885, test_loss: 0.9722, test_f1: 0.5192
 epoch: 18, train_loss: 0.9841, test_loss: 0.9689, test_f1: 0.5130
 epoch: 19, train_loss: 0.9746, test_loss: 0.9703, test_f1: 0.5166
 epoch: 20, train_loss: 0.9740, test_loss: 0.9618, test_f1: 0.5151
 epoch: 21, train_loss: 0.9748, test_loss: 0.9559, test_f1: 0.5102
 epoch: 22, train_loss: 0.9696, test_loss: 0.9555, test_f1: 0.5144
 epoch: 23, train_loss: 0.9658, test_loss: 0.9509, test_f1: 0.5153
 epoch: 24, train_loss: 0.9599, test_loss: 0.9502, test_f1: 0.5132
 epoch: 25, train_loss: 0.9496, test_loss: 0.9456, test_f1: 0.5168
 epoch: 26, train_loss: 0.9548, test_loss: 0.9476, test_f1: 0.5227
 epoch: 27, train_loss: 0.9424, test_loss: 0.9444, test_f1: 0.5170
 epoch: 28, train_loss: 0.9491, test_loss: 0.9369, test_f1: 0.5221
 epoch: 29, train_loss: 0.9442, test_loss: 0.9384, test_f1: 0.5220
 epoch: 30, train_loss: 0.9438, test_loss: 0.9352, test_f1: 0.5243
 epoch: 31, train_loss: 0.9339, test_loss: 0.9324, test_f1: 0.5427
 epoch: 32, train_loss: 0.9354, test_loss: 0.9312, test_f1: 0.5255
 epoch: 33, train_loss: 0.9317, test_loss: 0.9280, test_f1: 0.5215
 epoch: 34, train_loss: 0.9295, test_loss: 0.9281, test_f1: 0.5276
 epoch: 35, train_loss: 0.9277, test_loss: 0.9263, test_f1: 0.5240
 epoch: 36, train_loss: 0.9243, test_loss: 0.9282, test_f1: 0.5241
 epoch: 37, train_loss: 0.9152, test_loss: 0.9174, test_f1: 0.5233
 epoch: 38, train_loss: 0.9179, test_loss: 0.9176, test_f1: 0.5302
 epoch: 39, train_loss: 0.9166, test_loss: 0.9114, test_f1: 0.5338
 epoch: 40, train_loss: 0.9126, test_loss: 0.9202, test_f1: 0.5343
 epoch: 41, train_loss: 0.9054, test_loss: 0.9068, test_f1: 0.5321
 epoch: 42, train_loss: 0.9020, test_loss: 0.9103, test_f1: 0.5434
 epoch: 43, train_loss: 0.8989, test_loss: 0.9060, test_f1: 0.5394
 epoch: 44, train_loss: 0.9015, test_loss: 0.9079, test_f1: 0.5432
 epoch: 45, train_loss: 0.8953, test_loss: 0.8977, test_f1: 0.5371
 epoch: 46, train_loss: 0.8928, test_loss: 0.9001, test_f1: 0.5417
 epoch: 47, train_loss: 0.8953, test_loss: 0.8927, test_f1: 0.5439
 epoch: 48, train_loss: 0.8844, test_loss: 0.8999, test_f1: 0.5329
 epoch: 49, train_loss: 0.8808, test_loss: 0.8979, test_f1: 0.5389
 epoch: 50, train_loss: 0.8868, test_loss: 0.8964, test_f1: 0.5441
 epoch: 51, train_loss: 0.8727, test_loss: 0.8955, test_f1: 0.5382
 epoch: 52, train_loss: 0.8706, test_loss: 0.8945, test_f1: 0.5457
 epoch: 53, train_loss: 0.8731, test_loss: 0.8873, test_f1: 0.5500
 epoch: 54, train_loss: 0.8754, test_loss: 0.8868, test_f1: 0.5475
 epoch: 55, train_loss: 0.8715, test_loss: 0.8878, test_f1: 0.5451
 epoch: 56, train_loss: 0.8726, test_loss: 0.8889, test_f1: 0.5451
 epoch: 57, train_loss: 0.8728, test_loss: 0.8808, test_f1: 0.5490
 epoch: 58, train_loss: 0.8703, test_loss: 0.8872, test_f1: 0.5442
 epoch: 59, train_loss: 0.8703, test_loss: 0.8880, test_f1: 0.5488
 epoch: 60, train_loss: 0.8727, test_loss: 0.8851, test_f1: 0.5475
 epoch: 61, train_loss: 0.8663, test_loss: 0.8828, test_f1: 0.5548
 epoch: 62, train_loss: 0.8597, test_loss: 0.8818, test_f1: 0.5545
 epoch: 63, train_loss: 0.8634, test_loss: 0.8825, test_f1: 0.5525
 epoch: 64, train_loss: 0.8567, test_loss: 0.8820, test_f1: 0.5584
 epoch: 65, train_loss: 0.8671, test_loss: 0.8774, test_f1: 0.5548
 epoch: 66, train_loss: 0.8636, test_loss: 0.8812, test_f1: 0.5612
 epoch: 67, train_loss: 0.8615, test_loss: 0.8781, test_f1: 0.5611
 epoch: 68, train_loss: 0.8584, test_loss: 0.8813, test_f1: 0.5635
 epoch: 69, train_loss: 0.8558, test_loss: 0.8762, test_f1: 0.5570
 epoch: 70, train_loss: 0.8607, test_loss: 0.8753, test_f1: 0.5635
 epoch: 71, train_loss: 0.8580, test_loss: 0.8725, test_f1: 0.5634
 epoch: 72, train_loss: 0.8520, test_loss: 0.8760, test_f1: 0.5567
 epoch: 73, train_loss: 0.8483, test_loss: 0.8706, test_f1: 0.5616
 epoch: 74, train_loss: 0.8541, test_loss: 0.8741, test_f1: 0.5629
 epoch: 75, train_loss: 0.8537, test_loss: 0.8714, test_f1: 0.5716
 epoch: 76, train_loss: 0.8494, test_loss: 0.8710, test_f1: 0.5722
 epoch: 77, train_loss: 0.8468, test_loss: 0.8685, test_f1: 0.5709
 epoch: 78, train_loss: 0.8477, test_loss: 0.8706, test_f1: 0.5651
 epoch: 79, train_loss: 0.8463, test_loss: 0.8712, test_f1: 0.5753
 epoch: 80, train_loss: 0.8422, test_loss: 0.8684, test_f1: 0.5632
 epoch: 81, train_loss: 0.8420, test_loss: 0.8696, test_f1: 0.5741
 epoch: 82, train_loss: 0.8426, test_loss: 0.8673, test_f1: 0.5721
 epoch: 83, train_loss: 0.8407, test_loss: 0.8729, test_f1: 0.5731
 epoch: 84, train_loss: 0.8373, test_loss: 0.8706, test_f1: 0.5740
 epoch: 85, train_loss: 0.8359, test_loss: 0.8686, test_f1: 0.5724
 epoch: 86, train_loss: 0.8394, test_loss: 0.8677, test_f1: 0.5696
 epoch: 87, train_loss: 0.8307, test_loss: 0.8683, test_f1: 0.5735
 epoch: 88, train_loss: 0.8350, test_loss: 0.8709, test_f1: 0.5742
 epoch: 89, train_loss: 0.8297, test_loss: 0.8719, test_f1: 0.5679
 epoch: 90, train_loss: 0.8337, test_loss: 0.8669, test_f1: 0.5712
 epoch: 91, train_loss: 0.8354, test_loss: 0.8681, test_f1: 0.5733
 epoch: 92, train_loss: 0.8368, test_loss: 0.8694, test_f1: 0.5731
 epoch: 93, train_loss: 0.8355, test_loss: 0.8659, test_f1: 0.5737
 epoch: 94, train_loss: 0.8342, test_loss: 0.8689, test_f1: 0.5739
 epoch: 95, train_loss: 0.8284, test_loss: 0.8603, test_f1: 0.5734
 epoch: 96, train_loss: 0.8241, test_loss: 0.8681, test_f1: 0.5748
 epoch: 97, train_loss: 0.8225, test_loss: 0.8633, test_f1: 0.5754
 epoch: 98, train_loss: 0.8256, test_loss: 0.8628, test_f1: 0.5730
 epoch: 99, train_loss: 0.8243, test_loss: 0.8641, test_f1: 0.5760
##################ITERATION #9 ****************************************
 epoch: 0, train_loss: 1.3333, test_loss: 1.3180, test_f1: 0.2270
 epoch: 1, train_loss: 1.2242, test_loss: 1.2847, test_f1: 0.2270
 epoch: 2, train_loss: 1.1844, test_loss: 1.2404, test_f1: 0.2271
 epoch: 3, train_loss: 1.1489, test_loss: 1.1714, test_f1: 0.2804
 epoch: 4, train_loss: 1.1233, test_loss: 1.0977, test_f1: 0.3849
 epoch: 5, train_loss: 1.1062, test_loss: 1.0570, test_f1: 0.4335
 epoch: 6, train_loss: 1.0830, test_loss: 1.0354, test_f1: 0.4332
 epoch: 7, train_loss: 1.0746, test_loss: 1.0210, test_f1: 0.4292
 epoch: 8, train_loss: 1.0596, test_loss: 1.0103, test_f1: 0.4397
 epoch: 9, train_loss: 1.0553, test_loss: 1.0022, test_f1: 0.4459
 epoch: 10, train_loss: 1.0449, test_loss: 0.9946, test_f1: 0.4533
 epoch: 11, train_loss: 1.0329, test_loss: 0.9868, test_f1: 0.4567
 epoch: 12, train_loss: 1.0274, test_loss: 0.9816, test_f1: 0.4590
 epoch: 13, train_loss: 1.0185, test_loss: 0.9765, test_f1: 0.4634
 epoch: 14, train_loss: 1.0128, test_loss: 0.9729, test_f1: 0.4574
 epoch: 15, train_loss: 0.9972, test_loss: 0.9654, test_f1: 0.4753
 epoch: 16, train_loss: 1.0017, test_loss: 0.9606, test_f1: 0.4783
 epoch: 17, train_loss: 0.9926, test_loss: 0.9584, test_f1: 0.4772
 epoch: 18, train_loss: 0.9847, test_loss: 0.9538, test_f1: 0.4784
 epoch: 19, train_loss: 0.9790, test_loss: 0.9497, test_f1: 0.4762
 epoch: 20, train_loss: 0.9744, test_loss: 0.9482, test_f1: 0.4804
 epoch: 21, train_loss: 0.9668, test_loss: 0.9440, test_f1: 0.4834
 epoch: 22, train_loss: 0.9638, test_loss: 0.9425, test_f1: 0.4871
 epoch: 23, train_loss: 0.9667, test_loss: 0.9382, test_f1: 0.4882
 epoch: 24, train_loss: 0.9606, test_loss: 0.9343, test_f1: 0.5043
 epoch: 25, train_loss: 0.9533, test_loss: 0.9341, test_f1: 0.4974
 epoch: 26, train_loss: 0.9496, test_loss: 0.9279, test_f1: 0.5027
 epoch: 27, train_loss: 0.9495, test_loss: 0.9271, test_f1: 0.5121
 epoch: 28, train_loss: 0.9434, test_loss: 0.9246, test_f1: 0.5137
 epoch: 29, train_loss: 0.9427, test_loss: 0.9230, test_f1: 0.5097
 epoch: 30, train_loss: 0.9364, test_loss: 0.9186, test_f1: 0.5172
 epoch: 31, train_loss: 0.9336, test_loss: 0.9172, test_f1: 0.5172
 epoch: 32, train_loss: 0.9375, test_loss: 0.9152, test_f1: 0.5180
 epoch: 33, train_loss: 0.9267, test_loss: 0.9129, test_f1: 0.5204
 epoch: 34, train_loss: 0.9202, test_loss: 0.9093, test_f1: 0.5230
 epoch: 35, train_loss: 0.9274, test_loss: 0.9057, test_f1: 0.5231
 epoch: 36, train_loss: 0.9213, test_loss: 0.9071, test_f1: 0.5269
 epoch: 37, train_loss: 0.9188, test_loss: 0.9029, test_f1: 0.5204
 epoch: 38, train_loss: 0.9128, test_loss: 0.9050, test_f1: 0.5324
 epoch: 39, train_loss: 0.9057, test_loss: 0.9023, test_f1: 0.5336
 epoch: 40, train_loss: 0.9087, test_loss: 0.8988, test_f1: 0.5303
 epoch: 41, train_loss: 0.9061, test_loss: 0.8961, test_f1: 0.5329
 epoch: 42, train_loss: 0.9067, test_loss: 0.8932, test_f1: 0.5353
 epoch: 43, train_loss: 0.8951, test_loss: 0.8923, test_f1: 0.5330
 epoch: 44, train_loss: 0.8981, test_loss: 0.8905, test_f1: 0.5378
 epoch: 45, train_loss: 0.8931, test_loss: 0.8901, test_f1: 0.5450
 epoch: 46, train_loss: 0.8871, test_loss: 0.8875, test_f1: 0.5408
 epoch: 47, train_loss: 0.8883, test_loss: 0.8843, test_f1: 0.5395
 epoch: 48, train_loss: 0.8904, test_loss: 0.8827, test_f1: 0.5404
 epoch: 49, train_loss: 0.8792, test_loss: 0.8808, test_f1: 0.5450
 epoch: 50, train_loss: 0.8789, test_loss: 0.8789, test_f1: 0.5437
 epoch: 51, train_loss: 0.8708, test_loss: 0.8779, test_f1: 0.5460
 epoch: 52, train_loss: 0.8763, test_loss: 0.8797, test_f1: 0.5426
 epoch: 53, train_loss: 0.8747, test_loss: 0.8784, test_f1: 0.5426
 epoch: 54, train_loss: 0.8669, test_loss: 0.8762, test_f1: 0.5439
 epoch: 55, train_loss: 0.8714, test_loss: 0.8761, test_f1: 0.5497
 epoch: 56, train_loss: 0.8697, test_loss: 0.8748, test_f1: 0.5497
 epoch: 57, train_loss: 0.8750, test_loss: 0.8728, test_f1: 0.5484
 epoch: 58, train_loss: 0.8673, test_loss: 0.8740, test_f1: 0.5473
 epoch: 59, train_loss: 0.8684, test_loss: 0.8726, test_f1: 0.5485
 epoch: 60, train_loss: 0.8660, test_loss: 0.8720, test_f1: 0.5516
 epoch: 61, train_loss: 0.8621, test_loss: 0.8718, test_f1: 0.5508
 epoch: 62, train_loss: 0.8536, test_loss: 0.8719, test_f1: 0.5517
 epoch: 63, train_loss: 0.8551, test_loss: 0.8707, test_f1: 0.5555
 epoch: 64, train_loss: 0.8662, test_loss: 0.8723, test_f1: 0.5532
 epoch: 65, train_loss: 0.8510, test_loss: 0.8711, test_f1: 0.5497
 epoch: 66, train_loss: 0.8574, test_loss: 0.8709, test_f1: 0.5495
 epoch: 67, train_loss: 0.8546, test_loss: 0.8674, test_f1: 0.5580
 epoch: 68, train_loss: 0.8608, test_loss: 0.8689, test_f1: 0.5627
 epoch: 69, train_loss: 0.8562, test_loss: 0.8665, test_f1: 0.5596
 epoch: 70, train_loss: 0.8511, test_loss: 0.8690, test_f1: 0.5568
 epoch: 71, train_loss: 0.8541, test_loss: 0.8709, test_f1: 0.5591
 epoch: 72, train_loss: 0.8473, test_loss: 0.8693, test_f1: 0.5587
 epoch: 73, train_loss: 0.8423, test_loss: 0.8674, test_f1: 0.5625
 epoch: 74, train_loss: 0.8460, test_loss: 0.8670, test_f1: 0.5597
 epoch: 75, train_loss: 0.8575, test_loss: 0.8638, test_f1: 0.5698
 epoch: 76, train_loss: 0.8490, test_loss: 0.8654, test_f1: 0.5599
 epoch: 77, train_loss: 0.8452, test_loss: 0.8652, test_f1: 0.5653
 epoch: 78, train_loss: 0.8445, test_loss: 0.8657, test_f1: 0.5640
 epoch: 79, train_loss: 0.8423, test_loss: 0.8659, test_f1: 0.5674
 epoch: 80, train_loss: 0.8457, test_loss: 0.8653, test_f1: 0.5703
 epoch: 81, train_loss: 0.8430, test_loss: 0.8636, test_f1: 0.5692
 epoch: 82, train_loss: 0.8391, test_loss: 0.8641, test_f1: 0.5672
 epoch: 83, train_loss: 0.8335, test_loss: 0.8645, test_f1: 0.5635
 epoch: 84, train_loss: 0.8377, test_loss: 0.8653, test_f1: 0.5704
 epoch: 85, train_loss: 0.8378, test_loss: 0.8633, test_f1: 0.5696
 epoch: 86, train_loss: 0.8357, test_loss: 0.8646, test_f1: 0.5625
 epoch: 87, train_loss: 0.8285, test_loss: 0.8655, test_f1: 0.5688
 epoch: 88, train_loss: 0.8324, test_loss: 0.8619, test_f1: 0.5672
 epoch: 89, train_loss: 0.8336, test_loss: 0.8577, test_f1: 0.5656
 epoch: 90, train_loss: 0.8314, test_loss: 0.8581, test_f1: 0.5688
 epoch: 91, train_loss: 0.8341, test_loss: 0.8610, test_f1: 0.5678
 epoch: 92, train_loss: 0.8321, test_loss: 0.8603, test_f1: 0.5647
 epoch: 93, train_loss: 0.8290, test_loss: 0.8606, test_f1: 0.5655
 epoch: 94, train_loss: 0.8228, test_loss: 0.8592, test_f1: 0.5685
 epoch: 95, train_loss: 0.8244, test_loss: 0.8606, test_f1: 0.5683
 epoch: 96, train_loss: 0.8271, test_loss: 0.8597, test_f1: 0.5671
 epoch: 97, train_loss: 0.8326, test_loss: 0.8588, test_f1: 0.5631
 epoch: 98, train_loss: 0.8234, test_loss: 0.8621, test_f1: 0.5632
 epoch: 99, train_loss: 0.8213, test_loss: 0.8620, test_f1: 0.5706

Training completed in 410.05 seconds
Best F1: 0.5760 at epoch 99
Mean F1 across iterations: 0.5557  0.0122
========================FINAL RESULTS================================
FEGIN weighted F1: 0.5760  0.0122
python main.py --data ltspice_examples --representation component_pin_net --model FEGIN --layers 2 --hiddens 64 --batch_size 256 --lr 0.0001 --emb_size 512 --epochs 100 --save_appendix component_pin_net_L2_H64_BS256_LR0.0001_E512 --no_val
-----



STDERR:
  File "main.py", line 370, in <module>
    main()
  File "main.py", line 254, in main
    dataset = dataset_class(
  File "/home/philip/projects/ltspice_examples_code_repo/Circuit-Completion-Using-GNNs/component_classification_with_link_prediction_head/evaluation/FEGIN/kernel/circuit_datasets.py", line 15, in __init__
    self.data, self.slices = torch.load(self.processed_paths[0])
  File "/home/philip/.local/lib/python3.8/site-packages/torch/serialization.py", line 1040, in load
    warnings.warn(
  File "/usr/lib/python3.8/warnings.py", line 109, in _showwarnmsg
    sw(msg.message, msg.category, msg.filename, msg.lineno,
  File "main.py", line 47, in warn_with_traceback
    traceback.print_stack(file=log)
/home/philip/projects/ltspice_examples_code_repo/Circuit-Completion-Using-GNNs/component_classification_with_link_prediction_head/evaluation/FEGIN/kernel/circuit_datasets.py:15: FutureWarning: You are using `torch.load` with `weights_only=False` (the current default value), which uses the default pickle module implicitly. It is possible to construct malicious pickle data which will execute arbitrary code during unpickling (See https://github.com/pytorch/pytorch/blob/main/SECURITY.md#untrusted-models for more details). In a future release, the default value for `weights_only` will be flipped to `True`. This limits the functions that could be executed during unpickling. Arbitrary objects will no longer be allowed to be loaded via this mode unless they are explicitly allowlisted by the user via `torch.serialization.add_safe_globals`. We recommend you start setting `weights_only=True` for any use case where you don't have full control of the loaded file. Please open an issue on GitHub for any issues related to this experimental feature.
  self.data, self.slices = torch.load(self.processed_paths[0])
