STDOUT:
Results will be saved in /home/philip/projects/ltspice_examples_code_repo/Circuit-Completion-Using-GNNs/component_classification_with_link_prediction_head/evaluation/FEGIN/results/model_FEGIN_dataset_ltspice_examples
Command line input: python main.py --data ltspice_examples --representation component_component --model FEGIN --layers 4 --hiddens 16 --batch_size 128 --lr 0.001 --emb_size 128 --epochs 100 --save_appendix component_component_L4_H16_BS128_LR0.001_E128 --no_val
 is saved.
-----
ltspice_examples - FEGIN
Using 4 layers, 16 hidden units, h = 2
Loading component_component representation dataset
ENTERED
Training FEGIN on component_component representation
Train: 3556, Test: 845
##################ITERATION #0 ****************************************
 epoch: 0, train_loss: 1.3475, test_loss: 1.3454, test_f1: 0.2274
 epoch: 1, train_loss: 1.3261, test_loss: 1.3278, test_f1: 0.2274
 epoch: 2, train_loss: 1.3081, test_loss: 1.3075, test_f1: 0.2274
 epoch: 3, train_loss: 1.2872, test_loss: 1.2834, test_f1: 0.2274
 epoch: 4, train_loss: 1.2678, test_loss: 1.2533, test_f1: 0.2274
 epoch: 5, train_loss: 1.2550, test_loss: 1.2301, test_f1: 0.2274
 epoch: 6, train_loss: 1.2434, test_loss: 1.2254, test_f1: 0.2274
 epoch: 7, train_loss: 1.2373, test_loss: 1.2142, test_f1: 0.2622
 epoch: 8, train_loss: 1.2248, test_loss: 1.2051, test_f1: 0.2972
 epoch: 9, train_loss: 1.2217, test_loss: 1.1939, test_f1: 0.3397
 epoch: 10, train_loss: 1.2142, test_loss: 1.1865, test_f1: 0.3600
 epoch: 11, train_loss: 1.2009, test_loss: 1.1795, test_f1: 0.3512
 epoch: 12, train_loss: 1.1957, test_loss: 1.1714, test_f1: 0.3511
 epoch: 13, train_loss: 1.1823, test_loss: 1.1515, test_f1: 0.3757
 epoch: 14, train_loss: 1.1802, test_loss: 1.1557, test_f1: 0.4019
 epoch: 15, train_loss: 1.1656, test_loss: 1.1350, test_f1: 0.4355
 epoch: 16, train_loss: 1.1581, test_loss: 1.1314, test_f1: 0.4608
 epoch: 17, train_loss: 1.1525, test_loss: 1.1256, test_f1: 0.4322
 epoch: 18, train_loss: 1.1401, test_loss: 1.1288, test_f1: 0.4294
 epoch: 19, train_loss: 1.1363, test_loss: 1.1296, test_f1: 0.4365
 epoch: 20, train_loss: 1.1248, test_loss: 1.1029, test_f1: 0.4713
 epoch: 21, train_loss: 1.1234, test_loss: 1.1015, test_f1: 0.4291
 epoch: 22, train_loss: 1.1180, test_loss: 1.1085, test_f1: 0.4348
 epoch: 23, train_loss: 1.1026, test_loss: 1.0953, test_f1: 0.4555
 epoch: 24, train_loss: 1.0979, test_loss: 1.1023, test_f1: 0.4452
 epoch: 25, train_loss: 1.0966, test_loss: 1.0939, test_f1: 0.4423
 epoch: 26, train_loss: 1.0827, test_loss: 1.0878, test_f1: 0.4513
 epoch: 27, train_loss: 1.0787, test_loss: 1.0681, test_f1: 0.4527
 epoch: 28, train_loss: 1.0680, test_loss: 1.0721, test_f1: 0.4819
 epoch: 29, train_loss: 1.0711, test_loss: 1.0479, test_f1: 0.4606
 epoch: 30, train_loss: 1.0615, test_loss: 1.0510, test_f1: 0.4433
 epoch: 31, train_loss: 1.0534, test_loss: 1.0680, test_f1: 0.4372
 epoch: 32, train_loss: 1.0539, test_loss: 1.0587, test_f1: 0.4348
 epoch: 33, train_loss: 1.0312, test_loss: 1.1070, test_f1: 0.4221
 epoch: 34, train_loss: 1.0447, test_loss: 1.0594, test_f1: 0.4559
 epoch: 35, train_loss: 1.0342, test_loss: 1.0468, test_f1: 0.4617
 epoch: 36, train_loss: 1.0210, test_loss: 1.0496, test_f1: 0.4509
 epoch: 37, train_loss: 1.0171, test_loss: 1.0571, test_f1: 0.4488
 epoch: 38, train_loss: 1.0084, test_loss: 1.0681, test_f1: 0.4439
 epoch: 39, train_loss: 1.0158, test_loss: 1.0967, test_f1: 0.4282
 epoch: 40, train_loss: 1.0000, test_loss: 1.0548, test_f1: 0.4526
 epoch: 41, train_loss: 1.0029, test_loss: 1.0407, test_f1: 0.4407
 epoch: 42, train_loss: 0.9956, test_loss: 1.0690, test_f1: 0.4388
 epoch: 43, train_loss: 0.9978, test_loss: 1.0536, test_f1: 0.4525
 epoch: 44, train_loss: 0.9906, test_loss: 1.0926, test_f1: 0.4369
 epoch: 45, train_loss: 0.9808, test_loss: 1.0308, test_f1: 0.4656
 epoch: 46, train_loss: 0.9804, test_loss: 1.0496, test_f1: 0.4652
 epoch: 47, train_loss: 0.9825, test_loss: 1.0461, test_f1: 0.4509
 epoch: 48, train_loss: 0.9742, test_loss: 1.0662, test_f1: 0.4570
 epoch: 49, train_loss: 0.9696, test_loss: 1.1027, test_f1: 0.4610
 epoch: 50, train_loss: 0.9626, test_loss: 1.0522, test_f1: 0.4567
 epoch: 51, train_loss: 0.9598, test_loss: 1.0678, test_f1: 0.4568
 epoch: 52, train_loss: 0.9476, test_loss: 1.0567, test_f1: 0.4496
 epoch: 53, train_loss: 0.9482, test_loss: 1.0590, test_f1: 0.4554
 epoch: 54, train_loss: 0.9443, test_loss: 1.0650, test_f1: 0.4478
 epoch: 55, train_loss: 0.9427, test_loss: 1.0864, test_f1: 0.4489
 epoch: 56, train_loss: 0.9471, test_loss: 1.0625, test_f1: 0.4368
 epoch: 57, train_loss: 0.9422, test_loss: 1.0734, test_f1: 0.4600
 epoch: 58, train_loss: 0.9509, test_loss: 1.0746, test_f1: 0.4521
 epoch: 59, train_loss: 0.9347, test_loss: 1.0777, test_f1: 0.4670
 epoch: 60, train_loss: 0.9364, test_loss: 1.0647, test_f1: 0.4624
 epoch: 61, train_loss: 0.9369, test_loss: 1.0504, test_f1: 0.4638
 epoch: 62, train_loss: 0.9302, test_loss: 1.0771, test_f1: 0.4575
 epoch: 63, train_loss: 0.9348, test_loss: 1.0658, test_f1: 0.4533
 epoch: 64, train_loss: 0.9405, test_loss: 1.0842, test_f1: 0.4535
 epoch: 65, train_loss: 0.9271, test_loss: 1.0728, test_f1: 0.4522
 epoch: 66, train_loss: 0.9237, test_loss: 1.0763, test_f1: 0.4605
 epoch: 67, train_loss: 0.9206, test_loss: 1.0945, test_f1: 0.4502
 epoch: 68, train_loss: 0.9172, test_loss: 1.0468, test_f1: 0.4742
 epoch: 69, train_loss: 0.9107, test_loss: 1.0781, test_f1: 0.4524
 epoch: 70, train_loss: 0.9219, test_loss: 1.0861, test_f1: 0.4695
 epoch: 71, train_loss: 0.9258, test_loss: 1.0914, test_f1: 0.4544
 epoch: 72, train_loss: 0.9192, test_loss: 1.0675, test_f1: 0.4711
 epoch: 73, train_loss: 0.9089, test_loss: 1.0409, test_f1: 0.4630
 epoch: 74, train_loss: 0.9199, test_loss: 1.0638, test_f1: 0.4654
 epoch: 75, train_loss: 0.9235, test_loss: 1.0759, test_f1: 0.4672
 epoch: 76, train_loss: 0.9152, test_loss: 1.0702, test_f1: 0.4500
 epoch: 77, train_loss: 0.9127, test_loss: 1.0571, test_f1: 0.4711
 epoch: 78, train_loss: 0.9026, test_loss: 1.0693, test_f1: 0.4639
 epoch: 79, train_loss: 0.9052, test_loss: 1.0599, test_f1: 0.4667
 epoch: 80, train_loss: 0.9102, test_loss: 1.0674, test_f1: 0.4601
 epoch: 81, train_loss: 0.8992, test_loss: 1.1076, test_f1: 0.4510
 epoch: 82, train_loss: 0.8978, test_loss: 1.0516, test_f1: 0.4659
 epoch: 83, train_loss: 0.9112, test_loss: 1.0645, test_f1: 0.4547
 epoch: 84, train_loss: 0.8958, test_loss: 1.0496, test_f1: 0.4735
 epoch: 85, train_loss: 0.8885, test_loss: 1.0787, test_f1: 0.4829
 epoch: 86, train_loss: 0.8892, test_loss: 1.0791, test_f1: 0.4772
 epoch: 87, train_loss: 0.8952, test_loss: 1.0863, test_f1: 0.4793
 epoch: 88, train_loss: 0.9039, test_loss: 1.0432, test_f1: 0.4878
 epoch: 89, train_loss: 0.8950, test_loss: 1.0926, test_f1: 0.4632
 epoch: 90, train_loss: 0.9030, test_loss: 1.0461, test_f1: 0.5003
 epoch: 91, train_loss: 0.8960, test_loss: 1.1277, test_f1: 0.4594
 epoch: 92, train_loss: 0.9002, test_loss: 1.0594, test_f1: 0.4835
 epoch: 93, train_loss: 0.8972, test_loss: 1.1077, test_f1: 0.4580
 epoch: 94, train_loss: 0.8894, test_loss: 1.0668, test_f1: 0.4682
 epoch: 95, train_loss: 0.8846, test_loss: 1.0831, test_f1: 0.4657
 epoch: 96, train_loss: 0.8807, test_loss: 1.0444, test_f1: 0.4951
 epoch: 97, train_loss: 0.8742, test_loss: 1.0648, test_f1: 0.4734
 epoch: 98, train_loss: 0.8925, test_loss: 1.0799, test_f1: 0.4882
 epoch: 99, train_loss: 0.8758, test_loss: 1.0819, test_f1: 0.4666
##################ITERATION #1 ****************************************
 epoch: 0, train_loss: 1.3495, test_loss: 1.3157, test_f1: 0.2274
 epoch: 1, train_loss: 1.2806, test_loss: 1.2734, test_f1: 0.2555
 epoch: 2, train_loss: 1.2663, test_loss: 1.2459, test_f1: 0.2555
 epoch: 3, train_loss: 1.2471, test_loss: 1.2208, test_f1: 0.2741
 epoch: 4, train_loss: 1.2273, test_loss: 1.1975, test_f1: 0.3332
 epoch: 5, train_loss: 1.2086, test_loss: 1.1709, test_f1: 0.3857
 epoch: 6, train_loss: 1.1802, test_loss: 1.1280, test_f1: 0.4245
 epoch: 7, train_loss: 1.1700, test_loss: 1.1029, test_f1: 0.4487
 epoch: 8, train_loss: 1.1441, test_loss: 1.0683, test_f1: 0.4643
 epoch: 9, train_loss: 1.1239, test_loss: 1.0585, test_f1: 0.4559
 epoch: 10, train_loss: 1.1106, test_loss: 1.0335, test_f1: 0.4815
 epoch: 11, train_loss: 1.1013, test_loss: 1.0544, test_f1: 0.4420
 epoch: 12, train_loss: 1.0887, test_loss: 1.0207, test_f1: 0.4554
 epoch: 13, train_loss: 1.0735, test_loss: 1.0108, test_f1: 0.4724
 epoch: 14, train_loss: 1.0777, test_loss: 0.9931, test_f1: 0.4810
 epoch: 15, train_loss: 1.0659, test_loss: 0.9949, test_f1: 0.4790
 epoch: 16, train_loss: 1.0527, test_loss: 0.9933, test_f1: 0.4716
 epoch: 17, train_loss: 1.0475, test_loss: 0.9624, test_f1: 0.4952
 epoch: 18, train_loss: 1.0351, test_loss: 0.9830, test_f1: 0.4766
 epoch: 19, train_loss: 1.0336, test_loss: 0.9765, test_f1: 0.4670
 epoch: 20, train_loss: 1.0128, test_loss: 0.9612, test_f1: 0.4712
 epoch: 21, train_loss: 1.0146, test_loss: 0.9650, test_f1: 0.4801
 epoch: 22, train_loss: 1.0105, test_loss: 0.9766, test_f1: 0.4819
 epoch: 23, train_loss: 0.9950, test_loss: 0.9989, test_f1: 0.4624
 epoch: 24, train_loss: 0.9879, test_loss: 0.9545, test_f1: 0.4812
 epoch: 25, train_loss: 0.9935, test_loss: 0.9436, test_f1: 0.4890
 epoch: 26, train_loss: 0.9953, test_loss: 0.9286, test_f1: 0.4992
 epoch: 27, train_loss: 0.9943, test_loss: 0.9606, test_f1: 0.4633
 epoch: 28, train_loss: 0.9796, test_loss: 0.9504, test_f1: 0.4864
 epoch: 29, train_loss: 0.9687, test_loss: 0.9625, test_f1: 0.4610
 epoch: 30, train_loss: 0.9651, test_loss: 0.9797, test_f1: 0.4663
 epoch: 31, train_loss: 0.9547, test_loss: 0.9642, test_f1: 0.4829
 epoch: 32, train_loss: 0.9590, test_loss: 0.9441, test_f1: 0.4764
 epoch: 33, train_loss: 0.9542, test_loss: 1.0202, test_f1: 0.4660
 epoch: 34, train_loss: 0.9491, test_loss: 0.9649, test_f1: 0.4765
 epoch: 35, train_loss: 0.9380, test_loss: 0.9606, test_f1: 0.4942
 epoch: 36, train_loss: 0.9452, test_loss: 0.9412, test_f1: 0.4775
 epoch: 37, train_loss: 0.9470, test_loss: 0.9580, test_f1: 0.4860
 epoch: 38, train_loss: 0.9401, test_loss: 1.0128, test_f1: 0.4744
 epoch: 39, train_loss: 0.9437, test_loss: 1.0158, test_f1: 0.4766
 epoch: 40, train_loss: 0.9357, test_loss: 0.9385, test_f1: 0.4961
 epoch: 41, train_loss: 0.9258, test_loss: 0.9641, test_f1: 0.4975
 epoch: 42, train_loss: 0.9209, test_loss: 1.0697, test_f1: 0.4692
 epoch: 43, train_loss: 0.9342, test_loss: 0.9803, test_f1: 0.5099
 epoch: 44, train_loss: 0.9189, test_loss: 1.0008, test_f1: 0.4856
 epoch: 45, train_loss: 0.9110, test_loss: 0.9988, test_f1: 0.5124
 epoch: 46, train_loss: 0.9050, test_loss: 1.0023, test_f1: 0.4979
 epoch: 47, train_loss: 0.8973, test_loss: 0.9493, test_f1: 0.5062
 epoch: 48, train_loss: 0.9124, test_loss: 0.9989, test_f1: 0.5245
 epoch: 49, train_loss: 0.9234, test_loss: 1.0176, test_f1: 0.5132
 epoch: 50, train_loss: 0.9077, test_loss: 0.9859, test_f1: 0.4953
 epoch: 51, train_loss: 0.8863, test_loss: 0.9904, test_f1: 0.4881
 epoch: 52, train_loss: 0.8885, test_loss: 0.9788, test_f1: 0.4909
 epoch: 53, train_loss: 0.8953, test_loss: 0.9934, test_f1: 0.4857
 epoch: 54, train_loss: 0.8960, test_loss: 1.0280, test_f1: 0.4884
 epoch: 55, train_loss: 0.8868, test_loss: 1.0158, test_f1: 0.4957
 epoch: 56, train_loss: 0.8810, test_loss: 1.0177, test_f1: 0.4869
 epoch: 57, train_loss: 0.8750, test_loss: 1.0086, test_f1: 0.4938
 epoch: 58, train_loss: 0.8793, test_loss: 0.9941, test_f1: 0.4851
 epoch: 59, train_loss: 0.8799, test_loss: 1.0284, test_f1: 0.4840
 epoch: 60, train_loss: 0.8702, test_loss: 1.0216, test_f1: 0.5180
 epoch: 61, train_loss: 0.8780, test_loss: 1.0374, test_f1: 0.5152
 epoch: 62, train_loss: 0.8759, test_loss: 1.0359, test_f1: 0.5103
 epoch: 63, train_loss: 0.8626, test_loss: 1.0359, test_f1: 0.5234
 epoch: 64, train_loss: 0.8769, test_loss: 1.0104, test_f1: 0.4819
 epoch: 65, train_loss: 0.8742, test_loss: 1.1281, test_f1: 0.4856
 epoch: 66, train_loss: 0.8768, test_loss: 1.0120, test_f1: 0.5099
 epoch: 67, train_loss: 0.8843, test_loss: 1.0345, test_f1: 0.5034
 epoch: 68, train_loss: 0.8702, test_loss: 1.0586, test_f1: 0.5052
 epoch: 69, train_loss: 0.8666, test_loss: 1.0638, test_f1: 0.5010
 epoch: 70, train_loss: 0.8699, test_loss: 1.0277, test_f1: 0.4886
 epoch: 71, train_loss: 0.8891, test_loss: 0.9955, test_f1: 0.5097
 epoch: 72, train_loss: 0.8704, test_loss: 1.0249, test_f1: 0.5061
 epoch: 73, train_loss: 0.8638, test_loss: 1.0215, test_f1: 0.5082
 epoch: 74, train_loss: 0.8663, test_loss: 1.0454, test_f1: 0.5120
 epoch: 75, train_loss: 0.8689, test_loss: 1.0388, test_f1: 0.5126
 epoch: 76, train_loss: 0.8476, test_loss: 1.0347, test_f1: 0.4990
 epoch: 77, train_loss: 0.8690, test_loss: 1.0751, test_f1: 0.5003
 epoch: 78, train_loss: 0.8581, test_loss: 1.0212, test_f1: 0.5150
 epoch: 79, train_loss: 0.8422, test_loss: 1.0695, test_f1: 0.4998
 epoch: 80, train_loss: 0.8528, test_loss: 1.0223, test_f1: 0.4981
 epoch: 81, train_loss: 0.8519, test_loss: 1.0270, test_f1: 0.5079
 epoch: 82, train_loss: 0.8521, test_loss: 1.0237, test_f1: 0.5076
 epoch: 83, train_loss: 0.8571, test_loss: 1.0483, test_f1: 0.5056
 epoch: 84, train_loss: 0.8438, test_loss: 1.0223, test_f1: 0.5077
 epoch: 85, train_loss: 0.8482, test_loss: 1.0212, test_f1: 0.5019
 epoch: 86, train_loss: 0.8471, test_loss: 1.0809, test_f1: 0.5009
 epoch: 87, train_loss: 0.8475, test_loss: 1.0693, test_f1: 0.5145
 epoch: 88, train_loss: 0.8484, test_loss: 1.0227, test_f1: 0.4959
 epoch: 89, train_loss: 0.8397, test_loss: 1.0221, test_f1: 0.5069
 epoch: 90, train_loss: 0.8535, test_loss: 1.0576, test_f1: 0.5147
 epoch: 91, train_loss: 0.8618, test_loss: 0.9969, test_f1: 0.5246
 epoch: 92, train_loss: 0.8420, test_loss: 1.0395, test_f1: 0.4803
 epoch: 93, train_loss: 0.8371, test_loss: 1.0594, test_f1: 0.4987
 epoch: 94, train_loss: 0.8333, test_loss: 1.0723, test_f1: 0.5039
 epoch: 95, train_loss: 0.8313, test_loss: 1.0658, test_f1: 0.4927
 epoch: 96, train_loss: 0.8559, test_loss: 1.0388, test_f1: 0.5088
 epoch: 97, train_loss: 0.8406, test_loss: 1.0376, test_f1: 0.5141
 epoch: 98, train_loss: 0.8360, test_loss: 1.0400, test_f1: 0.5193
 epoch: 99, train_loss: 0.8362, test_loss: 0.9951, test_f1: 0.5054
##################ITERATION #2 ****************************************
 epoch: 0, train_loss: 1.3701, test_loss: 1.3152, test_f1: 0.2274
 epoch: 1, train_loss: 1.2860, test_loss: 1.2698, test_f1: 0.2290
 epoch: 2, train_loss: 1.2623, test_loss: 1.2419, test_f1: 0.2869
 epoch: 3, train_loss: 1.2467, test_loss: 1.2303, test_f1: 0.2953
 epoch: 4, train_loss: 1.2350, test_loss: 1.2127, test_f1: 0.2988
 epoch: 5, train_loss: 1.2286, test_loss: 1.2024, test_f1: 0.3021
 epoch: 6, train_loss: 1.2201, test_loss: 1.1933, test_f1: 0.3049
 epoch: 7, train_loss: 1.2110, test_loss: 1.1836, test_f1: 0.3360
 epoch: 8, train_loss: 1.2023, test_loss: 1.1743, test_f1: 0.3636
 epoch: 9, train_loss: 1.1936, test_loss: 1.1664, test_f1: 0.3466
 epoch: 10, train_loss: 1.1880, test_loss: 1.1600, test_f1: 0.3649
 epoch: 11, train_loss: 1.1705, test_loss: 1.1458, test_f1: 0.4093
 epoch: 12, train_loss: 1.1710, test_loss: 1.1443, test_f1: 0.3870
 epoch: 13, train_loss: 1.1538, test_loss: 1.1355, test_f1: 0.4005
 epoch: 14, train_loss: 1.1486, test_loss: 1.1214, test_f1: 0.4185
 epoch: 15, train_loss: 1.1406, test_loss: 1.1205, test_f1: 0.3932
 epoch: 16, train_loss: 1.1372, test_loss: 1.1093, test_f1: 0.4079
 epoch: 17, train_loss: 1.1275, test_loss: 1.1052, test_f1: 0.4149
 epoch: 18, train_loss: 1.1283, test_loss: 1.0954, test_f1: 0.4224
 epoch: 19, train_loss: 1.1118, test_loss: 1.0948, test_f1: 0.4305
 epoch: 20, train_loss: 1.1144, test_loss: 1.0876, test_f1: 0.4218
 epoch: 21, train_loss: 1.1002, test_loss: 1.0805, test_f1: 0.4420
 epoch: 22, train_loss: 1.0918, test_loss: 1.0752, test_f1: 0.4300
 epoch: 23, train_loss: 1.0860, test_loss: 1.0613, test_f1: 0.4531
 epoch: 24, train_loss: 1.0913, test_loss: 1.0512, test_f1: 0.4413
 epoch: 25, train_loss: 1.0782, test_loss: 1.0699, test_f1: 0.4489
 epoch: 26, train_loss: 1.0854, test_loss: 1.0446, test_f1: 0.4541
 epoch: 27, train_loss: 1.0708, test_loss: 1.0692, test_f1: 0.4361
 epoch: 28, train_loss: 1.0593, test_loss: 1.0288, test_f1: 0.4461
 epoch: 29, train_loss: 1.0536, test_loss: 1.0527, test_f1: 0.4413
 epoch: 30, train_loss: 1.0521, test_loss: 1.0181, test_f1: 0.4598
 epoch: 31, train_loss: 1.0468, test_loss: 1.0288, test_f1: 0.4522
 epoch: 32, train_loss: 1.0363, test_loss: 1.0360, test_f1: 0.4516
 epoch: 33, train_loss: 1.0390, test_loss: 1.0386, test_f1: 0.4599
 epoch: 34, train_loss: 1.0335, test_loss: 1.0156, test_f1: 0.4629
 epoch: 35, train_loss: 1.0182, test_loss: 0.9936, test_f1: 0.4624
 epoch: 36, train_loss: 1.0151, test_loss: 1.0168, test_f1: 0.4591
 epoch: 37, train_loss: 1.0223, test_loss: 1.0054, test_f1: 0.4633
 epoch: 38, train_loss: 1.0126, test_loss: 1.0262, test_f1: 0.4321
 epoch: 39, train_loss: 1.0046, test_loss: 0.9907, test_f1: 0.4647
 epoch: 40, train_loss: 1.0047, test_loss: 1.0095, test_f1: 0.4511
 epoch: 41, train_loss: 1.0110, test_loss: 1.0043, test_f1: 0.4497
 epoch: 42, train_loss: 0.9869, test_loss: 1.0022, test_f1: 0.4392
 epoch: 43, train_loss: 0.9890, test_loss: 1.0403, test_f1: 0.4329
 epoch: 44, train_loss: 0.9974, test_loss: 0.9743, test_f1: 0.4716
 epoch: 45, train_loss: 0.9858, test_loss: 1.0232, test_f1: 0.4451
 epoch: 46, train_loss: 0.9823, test_loss: 1.0198, test_f1: 0.4450
 epoch: 47, train_loss: 0.9833, test_loss: 0.9854, test_f1: 0.4649
 epoch: 48, train_loss: 0.9850, test_loss: 0.9984, test_f1: 0.4570
 epoch: 49, train_loss: 0.9768, test_loss: 1.0073, test_f1: 0.4489
 epoch: 50, train_loss: 0.9767, test_loss: 0.9954, test_f1: 0.4672
 epoch: 51, train_loss: 0.9718, test_loss: 0.9848, test_f1: 0.4543
 epoch: 52, train_loss: 0.9650, test_loss: 0.9993, test_f1: 0.4531
 epoch: 53, train_loss: 0.9562, test_loss: 0.9978, test_f1: 0.4466
 epoch: 54, train_loss: 0.9428, test_loss: 0.9963, test_f1: 0.4568
 epoch: 55, train_loss: 0.9633, test_loss: 1.0008, test_f1: 0.4512
 epoch: 56, train_loss: 0.9559, test_loss: 1.0217, test_f1: 0.4415
 epoch: 57, train_loss: 0.9455, test_loss: 1.0097, test_f1: 0.4576
 epoch: 58, train_loss: 0.9449, test_loss: 1.0138, test_f1: 0.4587
 epoch: 59, train_loss: 0.9500, test_loss: 1.0358, test_f1: 0.4581
 epoch: 60, train_loss: 0.9475, test_loss: 1.0093, test_f1: 0.4636
 epoch: 61, train_loss: 0.9512, test_loss: 1.0374, test_f1: 0.4527
 epoch: 62, train_loss: 0.9325, test_loss: 1.0368, test_f1: 0.4686
 epoch: 63, train_loss: 0.9473, test_loss: 1.0105, test_f1: 0.4624
 epoch: 64, train_loss: 0.9394, test_loss: 1.0267, test_f1: 0.4713
 epoch: 65, train_loss: 0.9468, test_loss: 1.0003, test_f1: 0.4735
 epoch: 66, train_loss: 0.9523, test_loss: 1.0448, test_f1: 0.4615
 epoch: 67, train_loss: 0.9341, test_loss: 1.0384, test_f1: 0.4765
 epoch: 68, train_loss: 0.9328, test_loss: 0.9981, test_f1: 0.4786
 epoch: 69, train_loss: 0.9241, test_loss: 1.0193, test_f1: 0.4794
 epoch: 70, train_loss: 0.9332, test_loss: 0.9863, test_f1: 0.4823
 epoch: 71, train_loss: 0.9330, test_loss: 1.0167, test_f1: 0.4789
 epoch: 72, train_loss: 0.9277, test_loss: 1.0099, test_f1: 0.4662
 epoch: 73, train_loss: 0.9275, test_loss: 1.0213, test_f1: 0.4642
 epoch: 74, train_loss: 0.9225, test_loss: 1.0257, test_f1: 0.4735
 epoch: 75, train_loss: 0.9199, test_loss: 1.0109, test_f1: 0.4907
 epoch: 76, train_loss: 0.9303, test_loss: 1.0183, test_f1: 0.4686
 epoch: 77, train_loss: 0.9249, test_loss: 0.9893, test_f1: 0.5008
 epoch: 78, train_loss: 0.9269, test_loss: 1.0029, test_f1: 0.4820
 epoch: 79, train_loss: 0.9212, test_loss: 1.0075, test_f1: 0.4927
 epoch: 80, train_loss: 0.9204, test_loss: 1.0167, test_f1: 0.4816
 epoch: 81, train_loss: 0.9231, test_loss: 0.9986, test_f1: 0.4741
 epoch: 82, train_loss: 0.9237, test_loss: 0.9828, test_f1: 0.4780
 epoch: 83, train_loss: 0.9071, test_loss: 0.9901, test_f1: 0.4849
 epoch: 84, train_loss: 0.9280, test_loss: 1.0239, test_f1: 0.4739
 epoch: 85, train_loss: 0.9173, test_loss: 0.9954, test_f1: 0.4778
 epoch: 86, train_loss: 0.9134, test_loss: 1.0244, test_f1: 0.4971
 epoch: 87, train_loss: 0.9073, test_loss: 1.0205, test_f1: 0.4856
 epoch: 88, train_loss: 0.9174, test_loss: 1.0346, test_f1: 0.4840
 epoch: 89, train_loss: 0.9108, test_loss: 1.0189, test_f1: 0.4856
 epoch: 90, train_loss: 0.9129, test_loss: 1.0015, test_f1: 0.4887
 epoch: 91, train_loss: 0.9036, test_loss: 0.9957, test_f1: 0.4829
 epoch: 92, train_loss: 0.9126, test_loss: 1.0099, test_f1: 0.4878
 epoch: 93, train_loss: 0.9171, test_loss: 1.0232, test_f1: 0.4836
 epoch: 94, train_loss: 0.9002, test_loss: 1.0137, test_f1: 0.4841
 epoch: 95, train_loss: 0.8962, test_loss: 1.0087, test_f1: 0.4906
 epoch: 96, train_loss: 0.9255, test_loss: 1.0460, test_f1: 0.4796
 epoch: 97, train_loss: 0.8953, test_loss: 1.0077, test_f1: 0.5035
 epoch: 98, train_loss: 0.8992, test_loss: 1.0122, test_f1: 0.4966
 epoch: 99, train_loss: 0.9013, test_loss: 0.9989, test_f1: 0.4971
##################ITERATION #3 ****************************************
 epoch: 0, train_loss: 1.3309, test_loss: 1.2911, test_f1: 0.2274
 epoch: 1, train_loss: 1.2615, test_loss: 1.2368, test_f1: 0.2424
 epoch: 2, train_loss: 1.2408, test_loss: 1.2057, test_f1: 0.3353
 epoch: 3, train_loss: 1.2279, test_loss: 1.1841, test_f1: 0.3323
 epoch: 4, train_loss: 1.2092, test_loss: 1.1622, test_f1: 0.3641
 epoch: 5, train_loss: 1.1996, test_loss: 1.1439, test_f1: 0.3826
 epoch: 6, train_loss: 1.1884, test_loss: 1.1318, test_f1: 0.4116
 epoch: 7, train_loss: 1.1795, test_loss: 1.1297, test_f1: 0.4124
 epoch: 8, train_loss: 1.1705, test_loss: 1.1072, test_f1: 0.4205
 epoch: 9, train_loss: 1.1558, test_loss: 1.0840, test_f1: 0.4465
 epoch: 10, train_loss: 1.1460, test_loss: 1.0838, test_f1: 0.4382
 epoch: 11, train_loss: 1.1461, test_loss: 1.0700, test_f1: 0.4333
 epoch: 12, train_loss: 1.1310, test_loss: 1.0589, test_f1: 0.4590
 epoch: 13, train_loss: 1.1267, test_loss: 1.0484, test_f1: 0.4628
 epoch: 14, train_loss: 1.1199, test_loss: 1.0332, test_f1: 0.4591
 epoch: 15, train_loss: 1.1113, test_loss: 1.0227, test_f1: 0.4705
 epoch: 16, train_loss: 1.1007, test_loss: 1.0250, test_f1: 0.4669
 epoch: 17, train_loss: 1.0896, test_loss: 1.0159, test_f1: 0.4612
 epoch: 18, train_loss: 1.0904, test_loss: 1.0045, test_f1: 0.4467
 epoch: 19, train_loss: 1.0740, test_loss: 0.9963, test_f1: 0.4602
 epoch: 20, train_loss: 1.0770, test_loss: 0.9818, test_f1: 0.4737
 epoch: 21, train_loss: 1.0639, test_loss: 0.9926, test_f1: 0.4569
 epoch: 22, train_loss: 1.0614, test_loss: 0.9827, test_f1: 0.4579
 epoch: 23, train_loss: 1.0570, test_loss: 0.9889, test_f1: 0.4625
 epoch: 24, train_loss: 1.0571, test_loss: 0.9901, test_f1: 0.4465
 epoch: 25, train_loss: 1.0503, test_loss: 0.9807, test_f1: 0.4550
 epoch: 26, train_loss: 1.0420, test_loss: 0.9653, test_f1: 0.4689
 epoch: 27, train_loss: 1.0442, test_loss: 0.9793, test_f1: 0.4492
 epoch: 28, train_loss: 1.0468, test_loss: 0.9626, test_f1: 0.4648
 epoch: 29, train_loss: 1.0395, test_loss: 0.9843, test_f1: 0.4654
 epoch: 30, train_loss: 1.0195, test_loss: 0.9726, test_f1: 0.4601
 epoch: 31, train_loss: 1.0212, test_loss: 0.9474, test_f1: 0.4769
 epoch: 32, train_loss: 1.0274, test_loss: 0.9482, test_f1: 0.4737
 epoch: 33, train_loss: 1.0141, test_loss: 0.9355, test_f1: 0.4797
 epoch: 34, train_loss: 1.0188, test_loss: 0.9623, test_f1: 0.4601
 epoch: 35, train_loss: 1.0033, test_loss: 0.9339, test_f1: 0.4693
 epoch: 36, train_loss: 0.9940, test_loss: 0.9456, test_f1: 0.4700
 epoch: 37, train_loss: 0.9989, test_loss: 0.9407, test_f1: 0.4742
 epoch: 38, train_loss: 0.9947, test_loss: 0.9377, test_f1: 0.4807
 epoch: 39, train_loss: 0.9965, test_loss: 0.9199, test_f1: 0.4859
 epoch: 40, train_loss: 0.9905, test_loss: 0.9366, test_f1: 0.4779
 epoch: 41, train_loss: 0.9789, test_loss: 0.9308, test_f1: 0.4931
 epoch: 42, train_loss: 0.9797, test_loss: 0.9541, test_f1: 0.4623
 epoch: 43, train_loss: 0.9766, test_loss: 0.9305, test_f1: 0.4905
 epoch: 44, train_loss: 0.9677, test_loss: 0.9479, test_f1: 0.4648
 epoch: 45, train_loss: 0.9647, test_loss: 0.9119, test_f1: 0.4867
 epoch: 46, train_loss: 0.9605, test_loss: 0.9380, test_f1: 0.4667
 epoch: 47, train_loss: 0.9610, test_loss: 0.9351, test_f1: 0.4792
 epoch: 48, train_loss: 0.9469, test_loss: 0.9235, test_f1: 0.4951
 epoch: 49, train_loss: 0.9472, test_loss: 0.9325, test_f1: 0.4728
 epoch: 50, train_loss: 0.9722, test_loss: 0.9447, test_f1: 0.4660
 epoch: 51, train_loss: 0.9459, test_loss: 0.9250, test_f1: 0.4788
 epoch: 52, train_loss: 0.9452, test_loss: 0.9307, test_f1: 0.4762
 epoch: 53, train_loss: 0.9555, test_loss: 0.9354, test_f1: 0.4851
 epoch: 54, train_loss: 0.9408, test_loss: 0.9190, test_f1: 0.4814
 epoch: 55, train_loss: 0.9445, test_loss: 0.9397, test_f1: 0.4777
 epoch: 56, train_loss: 0.9356, test_loss: 0.9443, test_f1: 0.4687
 epoch: 57, train_loss: 0.9332, test_loss: 0.9297, test_f1: 0.4803
 epoch: 58, train_loss: 0.9391, test_loss: 0.9391, test_f1: 0.4786
 epoch: 59, train_loss: 0.9454, test_loss: 0.9258, test_f1: 0.4837
 epoch: 60, train_loss: 0.9375, test_loss: 0.9427, test_f1: 0.4819
 epoch: 61, train_loss: 0.9319, test_loss: 0.9548, test_f1: 0.4736
 epoch: 62, train_loss: 0.9359, test_loss: 0.9488, test_f1: 0.4814
 epoch: 63, train_loss: 0.9222, test_loss: 0.9392, test_f1: 0.4785
 epoch: 64, train_loss: 0.9237, test_loss: 0.9430, test_f1: 0.4698
 epoch: 65, train_loss: 0.9320, test_loss: 0.9434, test_f1: 0.4791
 epoch: 66, train_loss: 0.9306, test_loss: 0.9153, test_f1: 0.4803
 epoch: 67, train_loss: 0.9273, test_loss: 0.9467, test_f1: 0.4645
 epoch: 68, train_loss: 0.9075, test_loss: 0.9345, test_f1: 0.4789
 epoch: 69, train_loss: 0.9209, test_loss: 0.9641, test_f1: 0.4662
 epoch: 70, train_loss: 0.9150, test_loss: 0.9400, test_f1: 0.4884
 epoch: 71, train_loss: 0.9208, test_loss: 0.9548, test_f1: 0.4806
 epoch: 72, train_loss: 0.9238, test_loss: 0.9340, test_f1: 0.4822
 epoch: 73, train_loss: 0.9271, test_loss: 0.9401, test_f1: 0.4827
 epoch: 74, train_loss: 0.9255, test_loss: 0.9424, test_f1: 0.4742
 epoch: 75, train_loss: 0.9213, test_loss: 0.9408, test_f1: 0.4849
 epoch: 76, train_loss: 0.9192, test_loss: 0.9494, test_f1: 0.4733
 epoch: 77, train_loss: 0.9104, test_loss: 0.9466, test_f1: 0.4783
 epoch: 78, train_loss: 0.9142, test_loss: 0.9416, test_f1: 0.4828
 epoch: 79, train_loss: 0.9182, test_loss: 0.9482, test_f1: 0.4760
 epoch: 80, train_loss: 0.9110, test_loss: 0.9643, test_f1: 0.4731
 epoch: 81, train_loss: 0.9182, test_loss: 0.9513, test_f1: 0.4730
 epoch: 82, train_loss: 0.9069, test_loss: 0.9712, test_f1: 0.4715
 epoch: 83, train_loss: 0.8989, test_loss: 0.9444, test_f1: 0.4956
 epoch: 84, train_loss: 0.9037, test_loss: 0.9520, test_f1: 0.4809
 epoch: 85, train_loss: 0.9105, test_loss: 0.9567, test_f1: 0.4807
 epoch: 86, train_loss: 0.9089, test_loss: 0.9495, test_f1: 0.4817
 epoch: 87, train_loss: 0.9135, test_loss: 0.9660, test_f1: 0.4743
 epoch: 88, train_loss: 0.9202, test_loss: 0.9569, test_f1: 0.4798
 epoch: 89, train_loss: 0.9027, test_loss: 0.9491, test_f1: 0.4830
 epoch: 90, train_loss: 0.9093, test_loss: 0.9418, test_f1: 0.4775
 epoch: 91, train_loss: 0.9184, test_loss: 0.9358, test_f1: 0.4841
 epoch: 92, train_loss: 0.8982, test_loss: 0.9549, test_f1: 0.4804
 epoch: 93, train_loss: 0.9009, test_loss: 0.9513, test_f1: 0.4835
 epoch: 94, train_loss: 0.9010, test_loss: 0.9529, test_f1: 0.4801
 epoch: 95, train_loss: 0.8997, test_loss: 0.9610, test_f1: 0.4895
 epoch: 96, train_loss: 0.8992, test_loss: 0.9519, test_f1: 0.4819
 epoch: 97, train_loss: 0.8852, test_loss: 0.9653, test_f1: 0.4816
 epoch: 98, train_loss: 0.8857, test_loss: 0.9598, test_f1: 0.4889
 epoch: 99, train_loss: 0.8923, test_loss: 0.9460, test_f1: 0.4913
##################ITERATION #4 ****************************************
 epoch: 0, train_loss: 1.3571, test_loss: 1.2993, test_f1: 0.2274
 epoch: 1, train_loss: 1.2587, test_loss: 1.2483, test_f1: 0.2321
 epoch: 2, train_loss: 1.2377, test_loss: 1.2104, test_f1: 0.2472
 epoch: 3, train_loss: 1.2386, test_loss: 1.1988, test_f1: 0.2948
 epoch: 4, train_loss: 1.2179, test_loss: 1.1909, test_f1: 0.3196
 epoch: 5, train_loss: 1.2196, test_loss: 1.1816, test_f1: 0.3310
 epoch: 6, train_loss: 1.2041, test_loss: 1.1751, test_f1: 0.3358
 epoch: 7, train_loss: 1.1953, test_loss: 1.1700, test_f1: 0.3508
 epoch: 8, train_loss: 1.1928, test_loss: 1.1583, test_f1: 0.3804
 epoch: 9, train_loss: 1.1778, test_loss: 1.1678, test_f1: 0.3623
 epoch: 10, train_loss: 1.1763, test_loss: 1.1621, test_f1: 0.3873
 epoch: 11, train_loss: 1.1677, test_loss: 1.1459, test_f1: 0.3758
 epoch: 12, train_loss: 1.1608, test_loss: 1.1361, test_f1: 0.3764
 epoch: 13, train_loss: 1.1528, test_loss: 1.1294, test_f1: 0.3769
 epoch: 14, train_loss: 1.1554, test_loss: 1.1198, test_f1: 0.3831
 epoch: 15, train_loss: 1.1395, test_loss: 1.1283, test_f1: 0.3738
 epoch: 16, train_loss: 1.1366, test_loss: 1.1167, test_f1: 0.3857
 epoch: 17, train_loss: 1.1282, test_loss: 1.1090, test_f1: 0.3804
 epoch: 18, train_loss: 1.1232, test_loss: 1.1123, test_f1: 0.4209
 epoch: 19, train_loss: 1.1174, test_loss: 1.0917, test_f1: 0.4001
 epoch: 20, train_loss: 1.1008, test_loss: 1.0942, test_f1: 0.3960
 epoch: 21, train_loss: 1.1144, test_loss: 1.1082, test_f1: 0.3861
 epoch: 22, train_loss: 1.1061, test_loss: 1.0836, test_f1: 0.4086
 epoch: 23, train_loss: 1.1005, test_loss: 1.0795, test_f1: 0.4166
 epoch: 24, train_loss: 1.0896, test_loss: 1.0847, test_f1: 0.3987
 epoch: 25, train_loss: 1.0845, test_loss: 1.0829, test_f1: 0.4135
 epoch: 26, train_loss: 1.0881, test_loss: 1.0836, test_f1: 0.4162
 epoch: 27, train_loss: 1.0862, test_loss: 1.0761, test_f1: 0.4180
 epoch: 28, train_loss: 1.0831, test_loss: 1.0682, test_f1: 0.4173
 epoch: 29, train_loss: 1.0643, test_loss: 1.0714, test_f1: 0.4143
 epoch: 30, train_loss: 1.0578, test_loss: 1.0769, test_f1: 0.4099
 epoch: 31, train_loss: 1.0646, test_loss: 1.0726, test_f1: 0.4146
 epoch: 32, train_loss: 1.0498, test_loss: 1.0755, test_f1: 0.4060
 epoch: 33, train_loss: 1.0559, test_loss: 1.0691, test_f1: 0.4197
 epoch: 34, train_loss: 1.0444, test_loss: 1.0684, test_f1: 0.4238
 epoch: 35, train_loss: 1.0488, test_loss: 1.0854, test_f1: 0.4003
 epoch: 36, train_loss: 1.0377, test_loss: 1.0669, test_f1: 0.4235
 epoch: 37, train_loss: 1.0359, test_loss: 1.0644, test_f1: 0.4271
 epoch: 38, train_loss: 1.0385, test_loss: 1.0621, test_f1: 0.4269
 epoch: 39, train_loss: 1.0376, test_loss: 1.0682, test_f1: 0.4021
 epoch: 40, train_loss: 1.0297, test_loss: 1.0411, test_f1: 0.4336
 epoch: 41, train_loss: 1.0237, test_loss: 1.0376, test_f1: 0.4444
 epoch: 42, train_loss: 1.0240, test_loss: 1.0720, test_f1: 0.4375
 epoch: 43, train_loss: 1.0173, test_loss: 1.0471, test_f1: 0.4262
 epoch: 44, train_loss: 1.0226, test_loss: 1.0570, test_f1: 0.4420
 epoch: 45, train_loss: 1.0086, test_loss: 1.0416, test_f1: 0.4361
 epoch: 46, train_loss: 1.0031, test_loss: 1.0338, test_f1: 0.4363
 epoch: 47, train_loss: 1.0041, test_loss: 1.0386, test_f1: 0.4301
 epoch: 48, train_loss: 0.9974, test_loss: 1.0152, test_f1: 0.4420
 epoch: 49, train_loss: 0.9954, test_loss: 1.0521, test_f1: 0.4273
 epoch: 50, train_loss: 0.9852, test_loss: 1.0216, test_f1: 0.4418
 epoch: 51, train_loss: 0.9859, test_loss: 1.0213, test_f1: 0.4454
 epoch: 52, train_loss: 0.9729, test_loss: 1.0164, test_f1: 0.4384
 epoch: 53, train_loss: 0.9821, test_loss: 1.0016, test_f1: 0.4577
 epoch: 54, train_loss: 0.9691, test_loss: 1.0274, test_f1: 0.4441
 epoch: 55, train_loss: 0.9727, test_loss: 1.0204, test_f1: 0.4302
 epoch: 56, train_loss: 0.9555, test_loss: 1.0005, test_f1: 0.4463
 epoch: 57, train_loss: 0.9658, test_loss: 1.0229, test_f1: 0.4474
 epoch: 58, train_loss: 0.9640, test_loss: 1.0282, test_f1: 0.4443
 epoch: 59, train_loss: 0.9456, test_loss: 1.0286, test_f1: 0.4476
 epoch: 60, train_loss: 0.9593, test_loss: 1.0151, test_f1: 0.4369
 epoch: 61, train_loss: 0.9631, test_loss: 1.0589, test_f1: 0.4166
 epoch: 62, train_loss: 0.9690, test_loss: 1.0164, test_f1: 0.4536
 epoch: 63, train_loss: 0.9557, test_loss: 1.0377, test_f1: 0.4588
 epoch: 64, train_loss: 0.9601, test_loss: 1.0196, test_f1: 0.4527
 epoch: 65, train_loss: 0.9504, test_loss: 1.0199, test_f1: 0.4494
 epoch: 66, train_loss: 0.9464, test_loss: 1.0200, test_f1: 0.4449
 epoch: 67, train_loss: 0.9443, test_loss: 1.0237, test_f1: 0.4397
 epoch: 68, train_loss: 0.9505, test_loss: 1.0358, test_f1: 0.4531
 epoch: 69, train_loss: 0.9435, test_loss: 1.0551, test_f1: 0.4339
 epoch: 70, train_loss: 0.9380, test_loss: 1.0064, test_f1: 0.4566
 epoch: 71, train_loss: 0.9498, test_loss: 1.0252, test_f1: 0.4433
 epoch: 72, train_loss: 0.9418, test_loss: 1.0119, test_f1: 0.4681
 epoch: 73, train_loss: 0.9323, test_loss: 1.0200, test_f1: 0.4579
 epoch: 74, train_loss: 0.9434, test_loss: 1.0019, test_f1: 0.4576
 epoch: 75, train_loss: 0.9204, test_loss: 1.0317, test_f1: 0.4505
 epoch: 76, train_loss: 0.9293, test_loss: 1.0263, test_f1: 0.4588
 epoch: 77, train_loss: 0.9268, test_loss: 1.0199, test_f1: 0.4724
 epoch: 78, train_loss: 0.9155, test_loss: 1.0281, test_f1: 0.4490
 epoch: 79, train_loss: 0.9305, test_loss: 1.0430, test_f1: 0.4612
 epoch: 80, train_loss: 0.9199, test_loss: 1.0394, test_f1: 0.4622
 epoch: 81, train_loss: 0.9192, test_loss: 1.0451, test_f1: 0.4561
 epoch: 82, train_loss: 0.9262, test_loss: 1.0427, test_f1: 0.4594
 epoch: 83, train_loss: 0.9191, test_loss: 1.0431, test_f1: 0.4511
 epoch: 84, train_loss: 0.9215, test_loss: 1.0603, test_f1: 0.4660
 epoch: 85, train_loss: 0.9169, test_loss: 1.0433, test_f1: 0.4504
 epoch: 86, train_loss: 0.9152, test_loss: 1.0450, test_f1: 0.4800
 epoch: 87, train_loss: 0.9074, test_loss: 1.0554, test_f1: 0.4680
 epoch: 88, train_loss: 0.9089, test_loss: 1.0457, test_f1: 0.4679
 epoch: 89, train_loss: 0.8985, test_loss: 1.0721, test_f1: 0.4641
 epoch: 90, train_loss: 0.9061, test_loss: 1.0801, test_f1: 0.4699
 epoch: 91, train_loss: 0.9000, test_loss: 1.0599, test_f1: 0.4718
 epoch: 92, train_loss: 0.8996, test_loss: 1.0636, test_f1: 0.4446
 epoch: 93, train_loss: 0.8941, test_loss: 1.0641, test_f1: 0.4742
 epoch: 94, train_loss: 0.8963, test_loss: 1.1037, test_f1: 0.4442
 epoch: 95, train_loss: 0.9040, test_loss: 1.0681, test_f1: 0.4630
 epoch: 96, train_loss: 0.9052, test_loss: 1.0494, test_f1: 0.4682
 epoch: 97, train_loss: 0.8900, test_loss: 1.0929, test_f1: 0.4629
 epoch: 98, train_loss: 0.8902, test_loss: 1.0921, test_f1: 0.4675
 epoch: 99, train_loss: 0.8918, test_loss: 1.0815, test_f1: 0.4605
##################ITERATION #5 ****************************************
 epoch: 0, train_loss: 1.3511, test_loss: 1.3110, test_f1: 0.2274
 epoch: 1, train_loss: 1.2534, test_loss: 1.2534, test_f1: 0.2422
 epoch: 2, train_loss: 1.2399, test_loss: 1.2205, test_f1: 0.3002
 epoch: 3, train_loss: 1.2249, test_loss: 1.2051, test_f1: 0.3130
 epoch: 4, train_loss: 1.2057, test_loss: 1.1908, test_f1: 0.3580
 epoch: 5, train_loss: 1.2071, test_loss: 1.1843, test_f1: 0.3671
 epoch: 6, train_loss: 1.1978, test_loss: 1.1666, test_f1: 0.3696
 epoch: 7, train_loss: 1.1923, test_loss: 1.1608, test_f1: 0.3761
 epoch: 8, train_loss: 1.1846, test_loss: 1.1480, test_f1: 0.4080
 epoch: 9, train_loss: 1.1736, test_loss: 1.1299, test_f1: 0.4283
 epoch: 10, train_loss: 1.1594, test_loss: 1.1197, test_f1: 0.4256
 epoch: 11, train_loss: 1.1532, test_loss: 1.1192, test_f1: 0.4325
 epoch: 12, train_loss: 1.1447, test_loss: 1.1051, test_f1: 0.4497
 epoch: 13, train_loss: 1.1332, test_loss: 1.0978, test_f1: 0.4400
 epoch: 14, train_loss: 1.1256, test_loss: 1.0878, test_f1: 0.4506
 epoch: 15, train_loss: 1.1189, test_loss: 1.0798, test_f1: 0.4499
 epoch: 16, train_loss: 1.1084, test_loss: 1.0687, test_f1: 0.4621
 epoch: 17, train_loss: 1.1028, test_loss: 1.0634, test_f1: 0.4490
 epoch: 18, train_loss: 1.0888, test_loss: 1.0482, test_f1: 0.4592
 epoch: 19, train_loss: 1.0757, test_loss: 1.0304, test_f1: 0.4673
 epoch: 20, train_loss: 1.0734, test_loss: 1.0484, test_f1: 0.4557
 epoch: 21, train_loss: 1.0702, test_loss: 1.0291, test_f1: 0.4557
 epoch: 22, train_loss: 1.0601, test_loss: 1.0398, test_f1: 0.4598
 epoch: 23, train_loss: 1.0459, test_loss: 1.0443, test_f1: 0.4570
 epoch: 24, train_loss: 1.0542, test_loss: 1.0327, test_f1: 0.4633
 epoch: 25, train_loss: 1.0380, test_loss: 1.0150, test_f1: 0.4585
 epoch: 26, train_loss: 1.0309, test_loss: 1.0388, test_f1: 0.4717
 epoch: 27, train_loss: 1.0273, test_loss: 1.0030, test_f1: 0.4735
 epoch: 28, train_loss: 1.0241, test_loss: 1.0342, test_f1: 0.4753
 epoch: 29, train_loss: 1.0127, test_loss: 0.9839, test_f1: 0.4855
 epoch: 30, train_loss: 1.0078, test_loss: 0.9972, test_f1: 0.4795
 epoch: 31, train_loss: 1.0047, test_loss: 1.0441, test_f1: 0.4669
 epoch: 32, train_loss: 1.0038, test_loss: 1.0071, test_f1: 0.4618
 epoch: 33, train_loss: 0.9935, test_loss: 1.0396, test_f1: 0.4833
 epoch: 34, train_loss: 0.9884, test_loss: 1.0294, test_f1: 0.4566
 epoch: 35, train_loss: 0.9989, test_loss: 0.9755, test_f1: 0.4881
 epoch: 36, train_loss: 0.9789, test_loss: 0.9942, test_f1: 0.4915
 epoch: 37, train_loss: 0.9732, test_loss: 1.0165, test_f1: 0.4893
 epoch: 38, train_loss: 0.9860, test_loss: 0.9739, test_f1: 0.4802
 epoch: 39, train_loss: 0.9629, test_loss: 1.0237, test_f1: 0.4769
 epoch: 40, train_loss: 0.9601, test_loss: 0.9833, test_f1: 0.4830
 epoch: 41, train_loss: 0.9639, test_loss: 1.0363, test_f1: 0.4873
 epoch: 42, train_loss: 0.9643, test_loss: 0.9906, test_f1: 0.4926
 epoch: 43, train_loss: 0.9617, test_loss: 1.0079, test_f1: 0.4876
 epoch: 44, train_loss: 0.9585, test_loss: 1.0165, test_f1: 0.4859
 epoch: 45, train_loss: 0.9483, test_loss: 0.9881, test_f1: 0.4925
 epoch: 46, train_loss: 0.9493, test_loss: 1.0348, test_f1: 0.4874
 epoch: 47, train_loss: 0.9451, test_loss: 0.9969, test_f1: 0.4894
 epoch: 48, train_loss: 0.9385, test_loss: 0.9652, test_f1: 0.4968
 epoch: 49, train_loss: 0.9268, test_loss: 1.0150, test_f1: 0.5149
 epoch: 50, train_loss: 0.9251, test_loss: 1.0282, test_f1: 0.4970
 epoch: 51, train_loss: 0.9091, test_loss: 1.0281, test_f1: 0.5182
 epoch: 52, train_loss: 0.9170, test_loss: 1.0389, test_f1: 0.4951
 epoch: 53, train_loss: 0.9276, test_loss: 1.0184, test_f1: 0.4899
 epoch: 54, train_loss: 0.9146, test_loss: 1.0331, test_f1: 0.4836
 epoch: 55, train_loss: 0.9062, test_loss: 1.0245, test_f1: 0.5177
 epoch: 56, train_loss: 0.9193, test_loss: 1.0391, test_f1: 0.5044
 epoch: 57, train_loss: 0.9173, test_loss: 1.0370, test_f1: 0.4920
 epoch: 58, train_loss: 0.9125, test_loss: 1.0530, test_f1: 0.5093
 epoch: 59, train_loss: 0.9020, test_loss: 1.0330, test_f1: 0.5127
 epoch: 60, train_loss: 0.8985, test_loss: 1.0383, test_f1: 0.5033
 epoch: 61, train_loss: 0.9092, test_loss: 1.0308, test_f1: 0.4974
 epoch: 62, train_loss: 0.9037, test_loss: 1.0424, test_f1: 0.5052
 epoch: 63, train_loss: 0.8944, test_loss: 1.0281, test_f1: 0.5054
 epoch: 64, train_loss: 0.8972, test_loss: 1.0626, test_f1: 0.5013
 epoch: 65, train_loss: 0.9064, test_loss: 1.0416, test_f1: 0.4986
 epoch: 66, train_loss: 0.8913, test_loss: 1.0615, test_f1: 0.5218
 epoch: 67, train_loss: 0.8984, test_loss: 1.0244, test_f1: 0.5144
 epoch: 68, train_loss: 0.8969, test_loss: 1.0355, test_f1: 0.5101
 epoch: 69, train_loss: 0.8912, test_loss: 1.0501, test_f1: 0.5066
 epoch: 70, train_loss: 0.9000, test_loss: 1.0152, test_f1: 0.5092
 epoch: 71, train_loss: 0.8879, test_loss: 1.0462, test_f1: 0.5110
 epoch: 72, train_loss: 0.8852, test_loss: 1.0460, test_f1: 0.5060
 epoch: 73, train_loss: 0.8941, test_loss: 1.0754, test_f1: 0.5118
 epoch: 74, train_loss: 0.8797, test_loss: 1.0463, test_f1: 0.5085
 epoch: 75, train_loss: 0.8785, test_loss: 1.0440, test_f1: 0.5136
 epoch: 76, train_loss: 0.8747, test_loss: 1.0571, test_f1: 0.5117
 epoch: 77, train_loss: 0.8819, test_loss: 1.0582, test_f1: 0.5091
 epoch: 78, train_loss: 0.8793, test_loss: 1.0402, test_f1: 0.5108
 epoch: 79, train_loss: 0.8824, test_loss: 1.0590, test_f1: 0.4901
 epoch: 80, train_loss: 0.8735, test_loss: 1.0345, test_f1: 0.5072
 epoch: 81, train_loss: 0.8783, test_loss: 1.0548, test_f1: 0.5166
 epoch: 82, train_loss: 0.8694, test_loss: 1.0488, test_f1: 0.5015
 epoch: 83, train_loss: 0.8750, test_loss: 1.0682, test_f1: 0.5096
 epoch: 84, train_loss: 0.8652, test_loss: 1.0539, test_f1: 0.5097
 epoch: 85, train_loss: 0.8697, test_loss: 1.0535, test_f1: 0.5103
 epoch: 86, train_loss: 0.8744, test_loss: 1.0607, test_f1: 0.5034
 epoch: 87, train_loss: 0.8643, test_loss: 1.0427, test_f1: 0.4895
 epoch: 88, train_loss: 0.8728, test_loss: 1.0835, test_f1: 0.5013
 epoch: 89, train_loss: 0.8669, test_loss: 1.0839, test_f1: 0.5081
 epoch: 90, train_loss: 0.8683, test_loss: 1.0753, test_f1: 0.5156
 epoch: 91, train_loss: 0.8740, test_loss: 1.0612, test_f1: 0.5048
 epoch: 92, train_loss: 0.8717, test_loss: 1.0561, test_f1: 0.4941
 epoch: 93, train_loss: 0.8633, test_loss: 1.0483, test_f1: 0.5073
 epoch: 94, train_loss: 0.8568, test_loss: 1.0690, test_f1: 0.4886
 epoch: 95, train_loss: 0.8700, test_loss: 1.0691, test_f1: 0.4952
 epoch: 96, train_loss: 0.8668, test_loss: 1.0808, test_f1: 0.5059
 epoch: 97, train_loss: 0.8646, test_loss: 1.0914, test_f1: 0.5037
 epoch: 98, train_loss: 0.8683, test_loss: 1.0865, test_f1: 0.5095
 epoch: 99, train_loss: 0.8600, test_loss: 1.0941, test_f1: 0.5047
##################ITERATION #6 ****************************************
 epoch: 0, train_loss: 1.3920, test_loss: 1.3066, test_f1: 0.2300
 epoch: 1, train_loss: 1.2994, test_loss: 1.2740, test_f1: 0.2357
 epoch: 2, train_loss: 1.2762, test_loss: 1.2585, test_f1: 0.2637
 epoch: 3, train_loss: 1.2534, test_loss: 1.2390, test_f1: 0.3123
 epoch: 4, train_loss: 1.2486, test_loss: 1.2166, test_f1: 0.3413
 epoch: 5, train_loss: 1.2353, test_loss: 1.2039, test_f1: 0.3409
 epoch: 6, train_loss: 1.2174, test_loss: 1.1853, test_f1: 0.3785
 epoch: 7, train_loss: 1.2146, test_loss: 1.1723, test_f1: 0.4022
 epoch: 8, train_loss: 1.2019, test_loss: 1.1600, test_f1: 0.3875
 epoch: 9, train_loss: 1.1882, test_loss: 1.1594, test_f1: 0.3957
 epoch: 10, train_loss: 1.1880, test_loss: 1.1420, test_f1: 0.3946
 epoch: 11, train_loss: 1.1713, test_loss: 1.1252, test_f1: 0.4049
 epoch: 12, train_loss: 1.1660, test_loss: 1.1161, test_f1: 0.4091
 epoch: 13, train_loss: 1.1575, test_loss: 1.1060, test_f1: 0.3944
 epoch: 14, train_loss: 1.1485, test_loss: 1.1043, test_f1: 0.4060
 epoch: 15, train_loss: 1.1429, test_loss: 1.0961, test_f1: 0.4149
 epoch: 16, train_loss: 1.1360, test_loss: 1.0863, test_f1: 0.4284
 epoch: 17, train_loss: 1.1302, test_loss: 1.0784, test_f1: 0.4193
 epoch: 18, train_loss: 1.1179, test_loss: 1.0739, test_f1: 0.4450
 epoch: 19, train_loss: 1.1117, test_loss: 1.0736, test_f1: 0.4479
 epoch: 20, train_loss: 1.1160, test_loss: 1.0598, test_f1: 0.4487
 epoch: 21, train_loss: 1.1024, test_loss: 1.0580, test_f1: 0.4420
 epoch: 22, train_loss: 1.1095, test_loss: 1.0441, test_f1: 0.4599
 epoch: 23, train_loss: 1.1004, test_loss: 1.0351, test_f1: 0.4493
 epoch: 24, train_loss: 1.0864, test_loss: 1.0450, test_f1: 0.4467
 epoch: 25, train_loss: 1.0874, test_loss: 1.0269, test_f1: 0.4717
 epoch: 26, train_loss: 1.0823, test_loss: 1.0208, test_f1: 0.4787
 epoch: 27, train_loss: 1.0743, test_loss: 1.0277, test_f1: 0.4774
 epoch: 28, train_loss: 1.0609, test_loss: 1.0117, test_f1: 0.4616
 epoch: 29, train_loss: 1.0535, test_loss: 1.0130, test_f1: 0.4782
 epoch: 30, train_loss: 1.0464, test_loss: 0.9816, test_f1: 0.4762
 epoch: 31, train_loss: 1.0363, test_loss: 0.9816, test_f1: 0.4922
 epoch: 32, train_loss: 1.0396, test_loss: 1.0112, test_f1: 0.4726
 epoch: 33, train_loss: 1.0430, test_loss: 0.9785, test_f1: 0.4981
 epoch: 34, train_loss: 1.0354, test_loss: 0.9842, test_f1: 0.4782
 epoch: 35, train_loss: 1.0273, test_loss: 0.9752, test_f1: 0.5117
 epoch: 36, train_loss: 1.0175, test_loss: 0.9915, test_f1: 0.4784
 epoch: 37, train_loss: 1.0242, test_loss: 0.9824, test_f1: 0.4724
 epoch: 38, train_loss: 1.0192, test_loss: 0.9873, test_f1: 0.4819
 epoch: 39, train_loss: 1.0098, test_loss: 0.9722, test_f1: 0.5058
 epoch: 40, train_loss: 1.0114, test_loss: 0.9610, test_f1: 0.4874
 epoch: 41, train_loss: 1.0085, test_loss: 0.9592, test_f1: 0.5042
 epoch: 42, train_loss: 0.9887, test_loss: 0.9421, test_f1: 0.4869
 epoch: 43, train_loss: 0.9956, test_loss: 0.9888, test_f1: 0.4797
 epoch: 44, train_loss: 0.9883, test_loss: 0.9510, test_f1: 0.4849
 epoch: 45, train_loss: 0.9851, test_loss: 0.9554, test_f1: 0.4884
 epoch: 46, train_loss: 0.9879, test_loss: 0.9885, test_f1: 0.5002
 epoch: 47, train_loss: 0.9828, test_loss: 0.9567, test_f1: 0.4814
 epoch: 48, train_loss: 0.9740, test_loss: 0.9537, test_f1: 0.4893
 epoch: 49, train_loss: 0.9779, test_loss: 0.9390, test_f1: 0.5058
 epoch: 50, train_loss: 0.9801, test_loss: 0.9622, test_f1: 0.4753
 epoch: 51, train_loss: 0.9647, test_loss: 0.9487, test_f1: 0.4868
 epoch: 52, train_loss: 0.9688, test_loss: 0.9441, test_f1: 0.4767
 epoch: 53, train_loss: 0.9455, test_loss: 0.9439, test_f1: 0.4700
 epoch: 54, train_loss: 0.9510, test_loss: 0.9436, test_f1: 0.4762
 epoch: 55, train_loss: 0.9643, test_loss: 0.9531, test_f1: 0.4752
 epoch: 56, train_loss: 0.9580, test_loss: 0.9410, test_f1: 0.4782
 epoch: 57, train_loss: 0.9550, test_loss: 0.9409, test_f1: 0.4900
 epoch: 58, train_loss: 0.9473, test_loss: 0.9569, test_f1: 0.4672
 epoch: 59, train_loss: 0.9474, test_loss: 0.9427, test_f1: 0.4871
 epoch: 60, train_loss: 0.9438, test_loss: 0.9413, test_f1: 0.4834
 epoch: 61, train_loss: 0.9409, test_loss: 0.9511, test_f1: 0.4830
 epoch: 62, train_loss: 0.9520, test_loss: 0.9486, test_f1: 0.4803
 epoch: 63, train_loss: 0.9462, test_loss: 0.9329, test_f1: 0.4828
 epoch: 64, train_loss: 0.9394, test_loss: 0.9558, test_f1: 0.4849
 epoch: 65, train_loss: 0.9376, test_loss: 0.9442, test_f1: 0.4845
 epoch: 66, train_loss: 0.9339, test_loss: 0.9465, test_f1: 0.4863
 epoch: 67, train_loss: 0.9364, test_loss: 0.9386, test_f1: 0.4761
 epoch: 68, train_loss: 0.9367, test_loss: 0.9482, test_f1: 0.4855
 epoch: 69, train_loss: 0.9398, test_loss: 0.9548, test_f1: 0.4973
 epoch: 70, train_loss: 0.9296, test_loss: 0.9379, test_f1: 0.4845
 epoch: 71, train_loss: 0.9312, test_loss: 0.9396, test_f1: 0.4896
 epoch: 72, train_loss: 0.9296, test_loss: 0.9456, test_f1: 0.4952
 epoch: 73, train_loss: 0.9285, test_loss: 0.9538, test_f1: 0.5104
 epoch: 74, train_loss: 0.9278, test_loss: 0.9504, test_f1: 0.4854
 epoch: 75, train_loss: 0.9272, test_loss: 0.9465, test_f1: 0.4859
 epoch: 76, train_loss: 0.9304, test_loss: 0.9463, test_f1: 0.4861
 epoch: 77, train_loss: 0.9184, test_loss: 0.9397, test_f1: 0.4903
 epoch: 78, train_loss: 0.9178, test_loss: 0.9574, test_f1: 0.4920
 epoch: 79, train_loss: 0.9219, test_loss: 0.9493, test_f1: 0.4802
 epoch: 80, train_loss: 0.9271, test_loss: 0.9438, test_f1: 0.4862
 epoch: 81, train_loss: 0.9142, test_loss: 0.9498, test_f1: 0.4871
 epoch: 82, train_loss: 0.9224, test_loss: 0.9452, test_f1: 0.4876
 epoch: 83, train_loss: 0.9160, test_loss: 0.9401, test_f1: 0.4887
 epoch: 84, train_loss: 0.9236, test_loss: 0.9407, test_f1: 0.4980
 epoch: 85, train_loss: 0.9186, test_loss: 0.9467, test_f1: 0.5089
 epoch: 86, train_loss: 0.9189, test_loss: 0.9585, test_f1: 0.4843
 epoch: 87, train_loss: 0.9144, test_loss: 0.9505, test_f1: 0.4925
 epoch: 88, train_loss: 0.9061, test_loss: 0.9633, test_f1: 0.4977
 epoch: 89, train_loss: 0.9151, test_loss: 0.9624, test_f1: 0.4873
 epoch: 90, train_loss: 0.9079, test_loss: 0.9626, test_f1: 0.4957
 epoch: 91, train_loss: 0.9071, test_loss: 0.9571, test_f1: 0.4992
 epoch: 92, train_loss: 0.9153, test_loss: 0.9975, test_f1: 0.4904
 epoch: 93, train_loss: 0.9051, test_loss: 0.9622, test_f1: 0.4966
 epoch: 94, train_loss: 0.8919, test_loss: 0.9586, test_f1: 0.5027
 epoch: 95, train_loss: 0.9014, test_loss: 0.9877, test_f1: 0.4955
 epoch: 96, train_loss: 0.8951, test_loss: 0.9580, test_f1: 0.5003
 epoch: 97, train_loss: 0.9054, test_loss: 0.9546, test_f1: 0.4914
 epoch: 98, train_loss: 0.9032, test_loss: 0.9738, test_f1: 0.4938
 epoch: 99, train_loss: 0.8905, test_loss: 0.9519, test_f1: 0.5000
##################ITERATION #7 ****************************************
 epoch: 0, train_loss: 1.3968, test_loss: 1.3423, test_f1: 0.2620
 epoch: 1, train_loss: 1.2736, test_loss: 1.2776, test_f1: 0.2418
 epoch: 2, train_loss: 1.2619, test_loss: 1.2249, test_f1: 0.2931
 epoch: 3, train_loss: 1.2543, test_loss: 1.2079, test_f1: 0.3172
 epoch: 4, train_loss: 1.2354, test_loss: 1.1964, test_f1: 0.3310
 epoch: 5, train_loss: 1.2264, test_loss: 1.1868, test_f1: 0.3548
 epoch: 6, train_loss: 1.2198, test_loss: 1.1723, test_f1: 0.3920
 epoch: 7, train_loss: 1.2115, test_loss: 1.1712, test_f1: 0.3889
 epoch: 8, train_loss: 1.2187, test_loss: 1.1577, test_f1: 0.4033
 epoch: 9, train_loss: 1.1972, test_loss: 1.1519, test_f1: 0.3992
 epoch: 10, train_loss: 1.2047, test_loss: 1.1534, test_f1: 0.3973
 epoch: 11, train_loss: 1.1856, test_loss: 1.1412, test_f1: 0.4064
 epoch: 12, train_loss: 1.1764, test_loss: 1.1311, test_f1: 0.3999
 epoch: 13, train_loss: 1.1726, test_loss: 1.1203, test_f1: 0.4088
 epoch: 14, train_loss: 1.1712, test_loss: 1.1215, test_f1: 0.4141
 epoch: 15, train_loss: 1.1605, test_loss: 1.1102, test_f1: 0.4243
 epoch: 16, train_loss: 1.1573, test_loss: 1.1038, test_f1: 0.4250
 epoch: 17, train_loss: 1.1486, test_loss: 1.0975, test_f1: 0.4177
 epoch: 18, train_loss: 1.1345, test_loss: 1.0915, test_f1: 0.4428
 epoch: 19, train_loss: 1.1384, test_loss: 1.0889, test_f1: 0.4366
 epoch: 20, train_loss: 1.1347, test_loss: 1.0868, test_f1: 0.4465
 epoch: 21, train_loss: 1.1221, test_loss: 1.0747, test_f1: 0.4361
 epoch: 22, train_loss: 1.1230, test_loss: 1.0712, test_f1: 0.4367
 epoch: 23, train_loss: 1.1116, test_loss: 1.0819, test_f1: 0.4468
 epoch: 24, train_loss: 1.1165, test_loss: 1.0771, test_f1: 0.4282
 epoch: 25, train_loss: 1.1084, test_loss: 1.0640, test_f1: 0.4488
 epoch: 26, train_loss: 1.1008, test_loss: 1.0670, test_f1: 0.4365
 epoch: 27, train_loss: 1.0944, test_loss: 1.0624, test_f1: 0.4383
 epoch: 28, train_loss: 1.0990, test_loss: 1.0612, test_f1: 0.4491
 epoch: 29, train_loss: 1.0987, test_loss: 1.0529, test_f1: 0.4316
 epoch: 30, train_loss: 1.0863, test_loss: 1.0414, test_f1: 0.4597
 epoch: 31, train_loss: 1.0882, test_loss: 1.0488, test_f1: 0.4480
 epoch: 32, train_loss: 1.0765, test_loss: 1.0477, test_f1: 0.4430
 epoch: 33, train_loss: 1.0733, test_loss: 1.0551, test_f1: 0.4289
 epoch: 34, train_loss: 1.0757, test_loss: 1.0448, test_f1: 0.4397
 epoch: 35, train_loss: 1.0612, test_loss: 1.0216, test_f1: 0.4669
 epoch: 36, train_loss: 1.0686, test_loss: 1.0315, test_f1: 0.4636
 epoch: 37, train_loss: 1.0551, test_loss: 1.0547, test_f1: 0.4353
 epoch: 38, train_loss: 1.0617, test_loss: 1.0393, test_f1: 0.4377
 epoch: 39, train_loss: 1.0580, test_loss: 1.0517, test_f1: 0.4451
 epoch: 40, train_loss: 1.0414, test_loss: 1.0271, test_f1: 0.4442
 epoch: 41, train_loss: 1.0420, test_loss: 1.0634, test_f1: 0.4439
 epoch: 42, train_loss: 1.0336, test_loss: 1.0198, test_f1: 0.4381
 epoch: 43, train_loss: 1.0298, test_loss: 1.0536, test_f1: 0.4537
 epoch: 44, train_loss: 1.0271, test_loss: 1.0110, test_f1: 0.4424
 epoch: 45, train_loss: 1.0268, test_loss: 1.0141, test_f1: 0.4489
 epoch: 46, train_loss: 1.0316, test_loss: 1.0061, test_f1: 0.4418
 epoch: 47, train_loss: 1.0138, test_loss: 1.0157, test_f1: 0.4419
 epoch: 48, train_loss: 1.0052, test_loss: 1.0040, test_f1: 0.4376
 epoch: 49, train_loss: 1.0092, test_loss: 0.9998, test_f1: 0.4575
 epoch: 50, train_loss: 1.0085, test_loss: 0.9516, test_f1: 0.4750
 epoch: 51, train_loss: 1.0080, test_loss: 0.9596, test_f1: 0.4655
 epoch: 52, train_loss: 0.9878, test_loss: 0.9611, test_f1: 0.4581
 epoch: 53, train_loss: 0.9847, test_loss: 0.9797, test_f1: 0.4474
 epoch: 54, train_loss: 0.9903, test_loss: 0.9873, test_f1: 0.4465
 epoch: 55, train_loss: 0.9795, test_loss: 0.9970, test_f1: 0.4459
 epoch: 56, train_loss: 0.9956, test_loss: 0.9896, test_f1: 0.4752
 epoch: 57, train_loss: 0.9831, test_loss: 0.9952, test_f1: 0.4502
 epoch: 58, train_loss: 0.9776, test_loss: 0.9685, test_f1: 0.4580
 epoch: 59, train_loss: 0.9869, test_loss: 0.9717, test_f1: 0.4612
 epoch: 60, train_loss: 0.9749, test_loss: 0.9723, test_f1: 0.4583
 epoch: 61, train_loss: 0.9746, test_loss: 0.9492, test_f1: 0.4581
 epoch: 62, train_loss: 0.9623, test_loss: 0.9833, test_f1: 0.4623
 epoch: 63, train_loss: 0.9832, test_loss: 0.9672, test_f1: 0.4676
 epoch: 64, train_loss: 0.9840, test_loss: 0.9350, test_f1: 0.4710
 epoch: 65, train_loss: 0.9721, test_loss: 0.9709, test_f1: 0.4584
 epoch: 66, train_loss: 0.9737, test_loss: 0.9739, test_f1: 0.4537
 epoch: 67, train_loss: 0.9602, test_loss: 0.9902, test_f1: 0.4594
 epoch: 68, train_loss: 0.9638, test_loss: 0.9857, test_f1: 0.4570
 epoch: 69, train_loss: 0.9715, test_loss: 0.9642, test_f1: 0.4591
 epoch: 70, train_loss: 0.9663, test_loss: 0.9709, test_f1: 0.4611
 epoch: 71, train_loss: 0.9581, test_loss: 0.9345, test_f1: 0.4548
 epoch: 72, train_loss: 0.9589, test_loss: 0.9686, test_f1: 0.4571
 epoch: 73, train_loss: 0.9601, test_loss: 0.9354, test_f1: 0.4618
 epoch: 74, train_loss: 0.9627, test_loss: 0.9586, test_f1: 0.4737
 epoch: 75, train_loss: 0.9525, test_loss: 1.0020, test_f1: 0.4490
 epoch: 76, train_loss: 0.9527, test_loss: 0.9593, test_f1: 0.4585
 epoch: 77, train_loss: 0.9438, test_loss: 0.9452, test_f1: 0.4628
 epoch: 78, train_loss: 0.9469, test_loss: 0.9650, test_f1: 0.4488
 epoch: 79, train_loss: 0.9534, test_loss: 0.9531, test_f1: 0.4504
 epoch: 80, train_loss: 0.9440, test_loss: 0.9640, test_f1: 0.4670
 epoch: 81, train_loss: 0.9362, test_loss: 0.9499, test_f1: 0.4627
 epoch: 82, train_loss: 0.9363, test_loss: 0.9299, test_f1: 0.4596
 epoch: 83, train_loss: 0.9579, test_loss: 0.9788, test_f1: 0.4508
 epoch: 84, train_loss: 0.9327, test_loss: 0.9753, test_f1: 0.4652
 epoch: 85, train_loss: 0.9432, test_loss: 0.9712, test_f1: 0.4762
 epoch: 86, train_loss: 0.9320, test_loss: 0.9475, test_f1: 0.4811
 epoch: 87, train_loss: 0.9368, test_loss: 0.9640, test_f1: 0.4674
 epoch: 88, train_loss: 0.9369, test_loss: 0.9376, test_f1: 0.4619
 epoch: 89, train_loss: 0.9418, test_loss: 0.9573, test_f1: 0.4639
 epoch: 90, train_loss: 0.9329, test_loss: 0.9759, test_f1: 0.4648
 epoch: 91, train_loss: 0.9398, test_loss: 0.9331, test_f1: 0.4709
 epoch: 92, train_loss: 0.9370, test_loss: 0.9657, test_f1: 0.4840
 epoch: 93, train_loss: 0.9331, test_loss: 0.9320, test_f1: 0.4825
 epoch: 94, train_loss: 0.9373, test_loss: 0.9762, test_f1: 0.4775
 epoch: 95, train_loss: 0.9339, test_loss: 0.9677, test_f1: 0.4834
 epoch: 96, train_loss: 0.9259, test_loss: 0.9456, test_f1: 0.4840
 epoch: 97, train_loss: 0.9282, test_loss: 0.9419, test_f1: 0.4762
 epoch: 98, train_loss: 0.9356, test_loss: 0.9602, test_f1: 0.4735
 epoch: 99, train_loss: 0.9257, test_loss: 0.9342, test_f1: 0.4684
##################ITERATION #8 ****************************************
 epoch: 0, train_loss: 1.8398, test_loss: 1.3698, test_f1: 0.2274
 epoch: 1, train_loss: 1.4077, test_loss: 1.3157, test_f1: 0.2646
 epoch: 2, train_loss: 1.3533, test_loss: 1.2540, test_f1: 0.3161
 epoch: 3, train_loss: 1.3208, test_loss: 1.2534, test_f1: 0.3136
 epoch: 4, train_loss: 1.2949, test_loss: 1.2308, test_f1: 0.2958
 epoch: 5, train_loss: 1.2800, test_loss: 1.2327, test_f1: 0.3054
 epoch: 6, train_loss: 1.2757, test_loss: 1.2174, test_f1: 0.3125
 epoch: 7, train_loss: 1.2501, test_loss: 1.2095, test_f1: 0.3308
 epoch: 8, train_loss: 1.2346, test_loss: 1.1974, test_f1: 0.3270
 epoch: 9, train_loss: 1.2346, test_loss: 1.1907, test_f1: 0.3181
 epoch: 10, train_loss: 1.2179, test_loss: 1.1860, test_f1: 0.3534
 epoch: 11, train_loss: 1.2160, test_loss: 1.1739, test_f1: 0.3540
 epoch: 12, train_loss: 1.1954, test_loss: 1.1623, test_f1: 0.3565
 epoch: 13, train_loss: 1.1886, test_loss: 1.1501, test_f1: 0.3649
 epoch: 14, train_loss: 1.1801, test_loss: 1.1388, test_f1: 0.3896
 epoch: 15, train_loss: 1.1769, test_loss: 1.1251, test_f1: 0.4064
 epoch: 16, train_loss: 1.1659, test_loss: 1.1226, test_f1: 0.4111
 epoch: 17, train_loss: 1.1546, test_loss: 1.1183, test_f1: 0.4004
 epoch: 18, train_loss: 1.1511, test_loss: 1.0962, test_f1: 0.4134
 epoch: 19, train_loss: 1.1469, test_loss: 1.0914, test_f1: 0.4317
 epoch: 20, train_loss: 1.1359, test_loss: 1.0903, test_f1: 0.4269
 epoch: 21, train_loss: 1.1236, test_loss: 1.0733, test_f1: 0.4175
 epoch: 22, train_loss: 1.1270, test_loss: 1.0699, test_f1: 0.4383
 epoch: 23, train_loss: 1.1167, test_loss: 1.0668, test_f1: 0.4549
 epoch: 24, train_loss: 1.1073, test_loss: 1.0496, test_f1: 0.4670
 epoch: 25, train_loss: 1.0869, test_loss: 1.0407, test_f1: 0.4447
 epoch: 26, train_loss: 1.0908, test_loss: 1.0362, test_f1: 0.4662
 epoch: 27, train_loss: 1.0843, test_loss: 1.0528, test_f1: 0.4500
 epoch: 28, train_loss: 1.0825, test_loss: 1.0290, test_f1: 0.4362
 epoch: 29, train_loss: 1.0737, test_loss: 1.0186, test_f1: 0.4615
 epoch: 30, train_loss: 1.0559, test_loss: 0.9989, test_f1: 0.4616
 epoch: 31, train_loss: 1.0622, test_loss: 0.9973, test_f1: 0.4744
 epoch: 32, train_loss: 1.0468, test_loss: 1.0043, test_f1: 0.4585
 epoch: 33, train_loss: 1.0378, test_loss: 0.9888, test_f1: 0.4690
 epoch: 34, train_loss: 1.0462, test_loss: 0.9777, test_f1: 0.4619
 epoch: 35, train_loss: 1.0386, test_loss: 0.9848, test_f1: 0.4691
 epoch: 36, train_loss: 1.0176, test_loss: 0.9685, test_f1: 0.4635
 epoch: 37, train_loss: 1.0172, test_loss: 0.9687, test_f1: 0.4707
 epoch: 38, train_loss: 1.0100, test_loss: 0.9573, test_f1: 0.4675
 epoch: 39, train_loss: 1.0141, test_loss: 0.9761, test_f1: 0.4569
 epoch: 40, train_loss: 1.0005, test_loss: 0.9579, test_f1: 0.4669
 epoch: 41, train_loss: 0.9868, test_loss: 0.9684, test_f1: 0.4717
 epoch: 42, train_loss: 0.9802, test_loss: 0.9723, test_f1: 0.4774
 epoch: 43, train_loss: 0.9917, test_loss: 0.9704, test_f1: 0.4606
 epoch: 44, train_loss: 0.9846, test_loss: 0.9544, test_f1: 0.4556
 epoch: 45, train_loss: 0.9795, test_loss: 0.9326, test_f1: 0.4849
 epoch: 46, train_loss: 0.9708, test_loss: 0.9503, test_f1: 0.4728
 epoch: 47, train_loss: 0.9615, test_loss: 0.9604, test_f1: 0.4880
 epoch: 48, train_loss: 0.9627, test_loss: 0.9318, test_f1: 0.4667
 epoch: 49, train_loss: 0.9605, test_loss: 0.9614, test_f1: 0.4852
 epoch: 50, train_loss: 0.9536, test_loss: 0.9698, test_f1: 0.4546
 epoch: 51, train_loss: 0.9551, test_loss: 0.9622, test_f1: 0.4668
 epoch: 52, train_loss: 0.9480, test_loss: 0.9422, test_f1: 0.4785
 epoch: 53, train_loss: 0.9415, test_loss: 0.9481, test_f1: 0.4827
 epoch: 54, train_loss: 0.9445, test_loss: 0.9528, test_f1: 0.4827
 epoch: 55, train_loss: 0.9380, test_loss: 0.9566, test_f1: 0.4683
 epoch: 56, train_loss: 0.9296, test_loss: 0.9349, test_f1: 0.4861
 epoch: 57, train_loss: 0.9293, test_loss: 0.9659, test_f1: 0.4814
 epoch: 58, train_loss: 0.9201, test_loss: 0.9595, test_f1: 0.4736
 epoch: 59, train_loss: 0.9347, test_loss: 0.9613, test_f1: 0.4926
 epoch: 60, train_loss: 0.9243, test_loss: 0.9419, test_f1: 0.4832
 epoch: 61, train_loss: 0.9229, test_loss: 0.9525, test_f1: 0.4851
 epoch: 62, train_loss: 0.9225, test_loss: 0.9572, test_f1: 0.4897
 epoch: 63, train_loss: 0.9351, test_loss: 0.9465, test_f1: 0.4867
 epoch: 64, train_loss: 0.9216, test_loss: 0.9730, test_f1: 0.4867
 epoch: 65, train_loss: 0.9244, test_loss: 0.9539, test_f1: 0.4840
 epoch: 66, train_loss: 0.9112, test_loss: 0.9641, test_f1: 0.4827
 epoch: 67, train_loss: 0.9084, test_loss: 0.9652, test_f1: 0.4858
 epoch: 68, train_loss: 0.9204, test_loss: 0.9674, test_f1: 0.4966
 epoch: 69, train_loss: 0.9090, test_loss: 0.9633, test_f1: 0.4912
 epoch: 70, train_loss: 0.9017, test_loss: 0.9605, test_f1: 0.4910
 epoch: 71, train_loss: 0.8965, test_loss: 0.9614, test_f1: 0.4926
 epoch: 72, train_loss: 0.9155, test_loss: 0.9569, test_f1: 0.4791
 epoch: 73, train_loss: 0.8995, test_loss: 0.9683, test_f1: 0.4839
 epoch: 74, train_loss: 0.9033, test_loss: 0.9665, test_f1: 0.4789
 epoch: 75, train_loss: 0.9105, test_loss: 0.9623, test_f1: 0.4865
 epoch: 76, train_loss: 0.8980, test_loss: 0.9792, test_f1: 0.4926
 epoch: 77, train_loss: 0.9078, test_loss: 0.9521, test_f1: 0.4955
 epoch: 78, train_loss: 0.9088, test_loss: 0.9880, test_f1: 0.4939
 epoch: 79, train_loss: 0.9034, test_loss: 0.9721, test_f1: 0.4895
 epoch: 80, train_loss: 0.9062, test_loss: 0.9839, test_f1: 0.4941
 epoch: 81, train_loss: 0.9010, test_loss: 0.9528, test_f1: 0.4969
 epoch: 82, train_loss: 0.8912, test_loss: 0.9685, test_f1: 0.4974
 epoch: 83, train_loss: 0.8885, test_loss: 0.9670, test_f1: 0.4912
 epoch: 84, train_loss: 0.8858, test_loss: 0.9677, test_f1: 0.4931
 epoch: 85, train_loss: 0.8909, test_loss: 0.9585, test_f1: 0.4972
 epoch: 86, train_loss: 0.8870, test_loss: 0.9738, test_f1: 0.5014
 epoch: 87, train_loss: 0.8924, test_loss: 0.9760, test_f1: 0.4963
 epoch: 88, train_loss: 0.8960, test_loss: 0.9752, test_f1: 0.4942
 epoch: 89, train_loss: 0.8879, test_loss: 0.9703, test_f1: 0.4905
 epoch: 90, train_loss: 0.8839, test_loss: 0.9751, test_f1: 0.4898
 epoch: 91, train_loss: 0.8833, test_loss: 0.9728, test_f1: 0.5242
 epoch: 92, train_loss: 0.8937, test_loss: 0.9733, test_f1: 0.4948
 epoch: 93, train_loss: 0.8803, test_loss: 0.9732, test_f1: 0.4992
 epoch: 94, train_loss: 0.8908, test_loss: 0.9685, test_f1: 0.4921
 epoch: 95, train_loss: 0.8832, test_loss: 0.9850, test_f1: 0.4870
 epoch: 96, train_loss: 0.8751, test_loss: 0.9648, test_f1: 0.4997
 epoch: 97, train_loss: 0.8794, test_loss: 0.9900, test_f1: 0.5243
 epoch: 98, train_loss: 0.8867, test_loss: 0.9681, test_f1: 0.4848
 epoch: 99, train_loss: 0.8753, test_loss: 0.9802, test_f1: 0.5018
##################ITERATION #9 ****************************************
 epoch: 0, train_loss: 1.6767, test_loss: 1.3672, test_f1: 0.2290
 epoch: 1, train_loss: 1.3400, test_loss: 1.2732, test_f1: 0.2623
 epoch: 2, train_loss: 1.3007, test_loss: 1.2337, test_f1: 0.3078
 epoch: 3, train_loss: 1.2758, test_loss: 1.2046, test_f1: 0.3401
 epoch: 4, train_loss: 1.2476, test_loss: 1.1824, test_f1: 0.3629
 epoch: 5, train_loss: 1.2399, test_loss: 1.1690, test_f1: 0.3792
 epoch: 6, train_loss: 1.2209, test_loss: 1.1570, test_f1: 0.3766
 epoch: 7, train_loss: 1.2061, test_loss: 1.1428, test_f1: 0.4087
 epoch: 8, train_loss: 1.1958, test_loss: 1.1268, test_f1: 0.4085
 epoch: 9, train_loss: 1.1730, test_loss: 1.1133, test_f1: 0.4310
 epoch: 10, train_loss: 1.1696, test_loss: 1.1008, test_f1: 0.4244
 epoch: 11, train_loss: 1.1529, test_loss: 1.0810, test_f1: 0.4324
 epoch: 12, train_loss: 1.1483, test_loss: 1.0757, test_f1: 0.4299
 epoch: 13, train_loss: 1.1329, test_loss: 1.0732, test_f1: 0.4270
 epoch: 14, train_loss: 1.1314, test_loss: 1.0450, test_f1: 0.4409
 epoch: 15, train_loss: 1.1100, test_loss: 1.0292, test_f1: 0.4571
 epoch: 16, train_loss: 1.1061, test_loss: 1.0344, test_f1: 0.4487
 epoch: 17, train_loss: 1.0957, test_loss: 1.0232, test_f1: 0.4388
 epoch: 18, train_loss: 1.0915, test_loss: 1.0255, test_f1: 0.4421
 epoch: 19, train_loss: 1.0818, test_loss: 1.0147, test_f1: 0.4481
 epoch: 20, train_loss: 1.0725, test_loss: 1.0229, test_f1: 0.4522
 epoch: 21, train_loss: 1.0735, test_loss: 1.0053, test_f1: 0.4461
 epoch: 22, train_loss: 1.0717, test_loss: 1.0317, test_f1: 0.4278
 epoch: 23, train_loss: 1.0628, test_loss: 0.9854, test_f1: 0.4458
 epoch: 24, train_loss: 1.0575, test_loss: 0.9821, test_f1: 0.4583
 epoch: 25, train_loss: 1.0479, test_loss: 0.9697, test_f1: 0.4578
 epoch: 26, train_loss: 1.0492, test_loss: 0.9750, test_f1: 0.4539
 epoch: 27, train_loss: 1.0393, test_loss: 0.9902, test_f1: 0.4526
 epoch: 28, train_loss: 1.0360, test_loss: 0.9849, test_f1: 0.4420
 epoch: 29, train_loss: 1.0362, test_loss: 0.9822, test_f1: 0.4448
 epoch: 30, train_loss: 1.0360, test_loss: 0.9594, test_f1: 0.4583
 epoch: 31, train_loss: 1.0099, test_loss: 0.9424, test_f1: 0.4671
 epoch: 32, train_loss: 1.0111, test_loss: 0.9594, test_f1: 0.4728
 epoch: 33, train_loss: 1.0131, test_loss: 0.9436, test_f1: 0.4669
 epoch: 34, train_loss: 1.0124, test_loss: 0.9383, test_f1: 0.4734
 epoch: 35, train_loss: 0.9938, test_loss: 0.9463, test_f1: 0.4744
 epoch: 36, train_loss: 1.0051, test_loss: 0.9429, test_f1: 0.4763
 epoch: 37, train_loss: 0.9901, test_loss: 0.9211, test_f1: 0.4985
 epoch: 38, train_loss: 0.9863, test_loss: 0.9358, test_f1: 0.4765
 epoch: 39, train_loss: 0.9907, test_loss: 0.9491, test_f1: 0.4893
 epoch: 40, train_loss: 0.9825, test_loss: 0.9463, test_f1: 0.5041
 epoch: 41, train_loss: 0.9780, test_loss: 0.9192, test_f1: 0.4842
 epoch: 42, train_loss: 0.9842, test_loss: 0.9212, test_f1: 0.4968
 epoch: 43, train_loss: 0.9703, test_loss: 0.9151, test_f1: 0.5133
 epoch: 44, train_loss: 0.9650, test_loss: 0.9235, test_f1: 0.4933
 epoch: 45, train_loss: 0.9677, test_loss: 0.9921, test_f1: 0.4718
 epoch: 46, train_loss: 0.9780, test_loss: 0.9321, test_f1: 0.5023
 epoch: 47, train_loss: 0.9731, test_loss: 0.9268, test_f1: 0.4944
 epoch: 48, train_loss: 0.9603, test_loss: 0.9301, test_f1: 0.4833
 epoch: 49, train_loss: 0.9576, test_loss: 0.9128, test_f1: 0.4845
 epoch: 50, train_loss: 0.9635, test_loss: 0.9036, test_f1: 0.5038
 epoch: 51, train_loss: 0.9528, test_loss: 0.9187, test_f1: 0.5064
 epoch: 52, train_loss: 0.9627, test_loss: 0.9097, test_f1: 0.5012
 epoch: 53, train_loss: 0.9435, test_loss: 0.9087, test_f1: 0.5078
 epoch: 54, train_loss: 0.9503, test_loss: 0.9066, test_f1: 0.4996
 epoch: 55, train_loss: 0.9488, test_loss: 0.9256, test_f1: 0.4867
 epoch: 56, train_loss: 0.9564, test_loss: 0.9220, test_f1: 0.5150
 epoch: 57, train_loss: 0.9326, test_loss: 0.9063, test_f1: 0.5012
 epoch: 58, train_loss: 0.9384, test_loss: 0.9118, test_f1: 0.5057
 epoch: 59, train_loss: 0.9446, test_loss: 0.9102, test_f1: 0.5172
 epoch: 60, train_loss: 0.9362, test_loss: 0.9320, test_f1: 0.4892
 epoch: 61, train_loss: 0.9396, test_loss: 0.9091, test_f1: 0.5052
 epoch: 62, train_loss: 0.9334, test_loss: 0.9162, test_f1: 0.5058
 epoch: 63, train_loss: 0.9322, test_loss: 0.9184, test_f1: 0.5044
 epoch: 64, train_loss: 0.9425, test_loss: 0.9557, test_f1: 0.4892
 epoch: 65, train_loss: 0.9282, test_loss: 0.9214, test_f1: 0.5176
 epoch: 66, train_loss: 0.9282, test_loss: 0.9144, test_f1: 0.5009
 epoch: 67, train_loss: 0.9294, test_loss: 0.9151, test_f1: 0.5071
 epoch: 68, train_loss: 0.9298, test_loss: 0.9467, test_f1: 0.4998
 epoch: 69, train_loss: 0.9259, test_loss: 0.9144, test_f1: 0.5137
 epoch: 70, train_loss: 0.9318, test_loss: 0.9064, test_f1: 0.5012
 epoch: 71, train_loss: 0.9267, test_loss: 0.9196, test_f1: 0.5042
 epoch: 72, train_loss: 0.9330, test_loss: 0.9391, test_f1: 0.5080
 epoch: 73, train_loss: 0.9215, test_loss: 0.9167, test_f1: 0.5020
 epoch: 74, train_loss: 0.9215, test_loss: 0.9154, test_f1: 0.5005
 epoch: 75, train_loss: 0.9217, test_loss: 0.9164, test_f1: 0.5234
 epoch: 76, train_loss: 0.9127, test_loss: 0.9184, test_f1: 0.5004
 epoch: 77, train_loss: 0.9100, test_loss: 0.9632, test_f1: 0.5015
 epoch: 78, train_loss: 0.9141, test_loss: 0.9253, test_f1: 0.4927
 epoch: 79, train_loss: 0.9237, test_loss: 0.9061, test_f1: 0.5077
 epoch: 80, train_loss: 0.9176, test_loss: 0.9350, test_f1: 0.5013
 epoch: 81, train_loss: 0.9128, test_loss: 0.9132, test_f1: 0.5066
 epoch: 82, train_loss: 0.9027, test_loss: 0.9190, test_f1: 0.4977
 epoch: 83, train_loss: 0.9113, test_loss: 0.9215, test_f1: 0.5025
 epoch: 84, train_loss: 0.9080, test_loss: 0.9076, test_f1: 0.4991
 epoch: 85, train_loss: 0.9253, test_loss: 0.9083, test_f1: 0.5256
 epoch: 86, train_loss: 0.8936, test_loss: 0.9370, test_f1: 0.5267
 epoch: 87, train_loss: 0.9003, test_loss: 0.9185, test_f1: 0.5170
 epoch: 88, train_loss: 0.9099, test_loss: 0.8994, test_f1: 0.5411
 epoch: 89, train_loss: 0.8997, test_loss: 0.9153, test_f1: 0.5056
 epoch: 90, train_loss: 0.9072, test_loss: 0.9307, test_f1: 0.4975
 epoch: 91, train_loss: 0.9053, test_loss: 0.9085, test_f1: 0.5079
 epoch: 92, train_loss: 0.8961, test_loss: 0.9083, test_f1: 0.5177
 epoch: 93, train_loss: 0.8995, test_loss: 0.9125, test_f1: 0.5274
 epoch: 94, train_loss: 0.9013, test_loss: 0.9341, test_f1: 0.4970
 epoch: 95, train_loss: 0.8986, test_loss: 0.9110, test_f1: 0.5307
 epoch: 96, train_loss: 0.8825, test_loss: 0.9186, test_f1: 0.5176
 epoch: 97, train_loss: 0.9134, test_loss: 0.9034, test_f1: 0.5381
 epoch: 98, train_loss: 0.8939, test_loss: 0.9141, test_f1: 0.5207
 epoch: 99, train_loss: 0.8978, test_loss: 0.9120, test_f1: 0.5154

Training completed in 483.03 seconds
Best F1: 0.5411 at epoch 88
Mean F1 across iterations: 0.5087  0.0185
========================FINAL RESULTS================================
FEGIN weighted F1: 0.5411  0.0185
python main.py --data ltspice_examples --representation component_component --model FEGIN --layers 4 --hiddens 16 --batch_size 128 --lr 0.001 --emb_size 128 --epochs 100 --save_appendix component_component_L4_H16_BS128_LR0.001_E128 --no_val
-----



STDERR:
  File "main.py", line 370, in <module>
    main()
  File "main.py", line 254, in main
    dataset = dataset_class(
  File "/home/philip/projects/ltspice_examples_code_repo/Circuit-Completion-Using-GNNs/component_classification_with_link_prediction_head/evaluation/FEGIN/kernel/circuit_datasets.py", line 15, in __init__
    self.data, self.slices = torch.load(self.processed_paths[0])
  File "/home/philip/.local/lib/python3.8/site-packages/torch/serialization.py", line 1040, in load
    warnings.warn(
  File "/usr/lib/python3.8/warnings.py", line 109, in _showwarnmsg
    sw(msg.message, msg.category, msg.filename, msg.lineno,
  File "main.py", line 47, in warn_with_traceback
    traceback.print_stack(file=log)
/home/philip/projects/ltspice_examples_code_repo/Circuit-Completion-Using-GNNs/component_classification_with_link_prediction_head/evaluation/FEGIN/kernel/circuit_datasets.py:15: FutureWarning: You are using `torch.load` with `weights_only=False` (the current default value), which uses the default pickle module implicitly. It is possible to construct malicious pickle data which will execute arbitrary code during unpickling (See https://github.com/pytorch/pytorch/blob/main/SECURITY.md#untrusted-models for more details). In a future release, the default value for `weights_only` will be flipped to `True`. This limits the functions that could be executed during unpickling. Arbitrary objects will no longer be allowed to be loaded via this mode unless they are explicitly allowlisted by the user via `torch.serialization.add_safe_globals`. We recommend you start setting `weights_only=True` for any use case where you don't have full control of the loaded file. Please open an issue on GitHub for any issues related to this experimental feature.
  self.data, self.slices = torch.load(self.processed_paths[0])
