STDOUT:
Results will be saved in /home/philip/projects/ltspice_examples_code_repo/Circuit-Completion-Using-GNNs/component_classification_with_link_prediction_head/evaluation/FEGIN/results/model_FEGIN_dataset_ltspice_demos
Command line input: python main.py --data ltspice_demos --representation component_pin --model FEGIN --layers 3 --hiddens 128 --batch_size 128 --lr 0.001 --emb_size 250 --epochs 100 --save_appendix component_pin_L3_H128_BS128_LR0.001_E250 --no_val
 is saved.
-----
ltspice_demos - FEGIN
Using 3 layers, 128 hidden units, h = 2
Loading component_pin representation dataset
ENTERED
Training FEGIN on component_pin representation
Train: 1565, Test: 383
##################ITERATION #0 ****************************************
 epoch: 0, train_loss: 1.2933, test_loss: 1.2940, test_f1: 0.3480
 epoch: 1, train_loss: 1.1617, test_loss: 1.3123, test_f1: 0.3321
 epoch: 2, train_loss: 1.1136, test_loss: 1.3658, test_f1: 0.3515
 epoch: 3, train_loss: 1.0634, test_loss: 1.3683, test_f1: 0.3455
 epoch: 4, train_loss: 0.9757, test_loss: 1.1013, test_f1: 0.4331
 epoch: 5, train_loss: 0.9100, test_loss: 1.0912, test_f1: 0.5334
 epoch: 6, train_loss: 0.8457, test_loss: 1.0675, test_f1: 0.5705
 epoch: 7, train_loss: 0.8282, test_loss: 1.0715, test_f1: 0.5278
 epoch: 8, train_loss: 0.7806, test_loss: 1.0731, test_f1: 0.5523
 epoch: 9, train_loss: 0.7513, test_loss: 1.3330, test_f1: 0.4709
 epoch: 10, train_loss: 0.7049, test_loss: 1.0688, test_f1: 0.5111
 epoch: 11, train_loss: 0.6777, test_loss: 1.0945, test_f1: 0.5646
 epoch: 12, train_loss: 0.6827, test_loss: 1.1041, test_f1: 0.5655
 epoch: 13, train_loss: 0.6405, test_loss: 1.1123, test_f1: 0.5565
 epoch: 14, train_loss: 0.6153, test_loss: 1.1078, test_f1: 0.5450
 epoch: 15, train_loss: 0.6269, test_loss: 1.0592, test_f1: 0.6034
 epoch: 16, train_loss: 0.5918, test_loss: 1.1381, test_f1: 0.5422
 epoch: 17, train_loss: 0.6024, test_loss: 1.2985, test_f1: 0.5769
 epoch: 18, train_loss: 0.5829, test_loss: 1.0445, test_f1: 0.5953
 epoch: 19, train_loss: 0.5396, test_loss: 1.0854, test_f1: 0.6114
 epoch: 20, train_loss: 0.5136, test_loss: 1.1812, test_f1: 0.5999
 epoch: 21, train_loss: 0.5236, test_loss: 1.5054, test_f1: 0.4638
 epoch: 22, train_loss: 0.5435, test_loss: 1.1602, test_f1: 0.6004
 epoch: 23, train_loss: 0.4887, test_loss: 1.4010, test_f1: 0.6050
 epoch: 24, train_loss: 0.4800, test_loss: 1.4136, test_f1: 0.6155
 epoch: 25, train_loss: 0.4324, test_loss: 1.6125, test_f1: 0.5540
 epoch: 26, train_loss: 0.4580, test_loss: 1.3416, test_f1: 0.5459
 epoch: 27, train_loss: 0.4538, test_loss: 1.3613, test_f1: 0.5679
 epoch: 28, train_loss: 0.4044, test_loss: 1.3210, test_f1: 0.6497
 epoch: 29, train_loss: 0.3857, test_loss: 1.4773, test_f1: 0.6199
 epoch: 30, train_loss: 0.4017, test_loss: 1.5170, test_f1: 0.6070
 epoch: 31, train_loss: 0.3997, test_loss: 1.3920, test_f1: 0.5881
 epoch: 32, train_loss: 0.3672, test_loss: 1.4704, test_f1: 0.6385
 epoch: 33, train_loss: 0.3835, test_loss: 1.4881, test_f1: 0.6101
 epoch: 34, train_loss: 0.4105, test_loss: 1.5548, test_f1: 0.5565
 epoch: 35, train_loss: 0.3564, test_loss: 1.4720, test_f1: 0.6044
 epoch: 36, train_loss: 0.3200, test_loss: 1.4817, test_f1: 0.6558
 epoch: 37, train_loss: 0.3100, test_loss: 1.8148, test_f1: 0.5759
 epoch: 38, train_loss: 0.2888, test_loss: 1.7695, test_f1: 0.5927
 epoch: 39, train_loss: 0.2803, test_loss: 2.1537, test_f1: 0.5993
 epoch: 40, train_loss: 0.2880, test_loss: 1.8073, test_f1: 0.6232
 epoch: 41, train_loss: 0.3085, test_loss: 1.8220, test_f1: 0.6056
 epoch: 42, train_loss: 0.3169, test_loss: 1.7821, test_f1: 0.6150
 epoch: 43, train_loss: 0.3253, test_loss: 1.8144, test_f1: 0.6358
 epoch: 44, train_loss: 0.3124, test_loss: 1.9984, test_f1: 0.5457
 epoch: 45, train_loss: 0.3037, test_loss: 1.6540, test_f1: 0.6297
 epoch: 46, train_loss: 0.2713, test_loss: 1.6982, test_f1: 0.6240
 epoch: 47, train_loss: 0.2416, test_loss: 1.7429, test_f1: 0.6582
 epoch: 48, train_loss: 0.2487, test_loss: 1.6776, test_f1: 0.6432
 epoch: 49, train_loss: 0.2679, test_loss: 1.8201, test_f1: 0.6405
 epoch: 50, train_loss: 0.3160, test_loss: 2.1748, test_f1: 0.5428
 epoch: 51, train_loss: 0.2158, test_loss: 1.9476, test_f1: 0.6076
 epoch: 52, train_loss: 0.1920, test_loss: 1.7332, test_f1: 0.6339
 epoch: 53, train_loss: 0.1669, test_loss: 2.1124, test_f1: 0.6210
 epoch: 54, train_loss: 0.1476, test_loss: 1.9332, test_f1: 0.6285
 epoch: 55, train_loss: 0.1402, test_loss: 1.8953, test_f1: 0.6614
 epoch: 56, train_loss: 0.1301, test_loss: 1.9993, test_f1: 0.6310
 epoch: 57, train_loss: 0.1239, test_loss: 2.0851, test_f1: 0.6527
 epoch: 58, train_loss: 0.1095, test_loss: 2.2163, test_f1: 0.6612
 epoch: 59, train_loss: 0.1223, test_loss: 2.2182, test_f1: 0.6711
 epoch: 60, train_loss: 0.1074, test_loss: 2.2293, test_f1: 0.6692
 epoch: 61, train_loss: 0.1072, test_loss: 2.2692, test_f1: 0.6455
 epoch: 62, train_loss: 0.1041, test_loss: 2.3324, test_f1: 0.6689
 epoch: 63, train_loss: 0.1109, test_loss: 2.4258, test_f1: 0.6255
 epoch: 64, train_loss: 0.0990, test_loss: 2.4510, test_f1: 0.6550
 epoch: 65, train_loss: 0.1336, test_loss: 2.3951, test_f1: 0.6212
 epoch: 66, train_loss: 0.1361, test_loss: 2.3037, test_f1: 0.6673
 epoch: 67, train_loss: 0.1437, test_loss: 2.4545, test_f1: 0.6124
 epoch: 68, train_loss: 0.1408, test_loss: 2.3943, test_f1: 0.6581
 epoch: 69, train_loss: 0.1286, test_loss: 2.5029, test_f1: 0.5909
 epoch: 70, train_loss: 0.1090, test_loss: 2.4191, test_f1: 0.6380
 epoch: 71, train_loss: 0.0892, test_loss: 2.4266, test_f1: 0.6526
 epoch: 72, train_loss: 0.0918, test_loss: 2.5383, test_f1: 0.6623
 epoch: 73, train_loss: 0.1027, test_loss: 2.5268, test_f1: 0.6654
 epoch: 74, train_loss: 0.1108, test_loss: 2.4297, test_f1: 0.6044
 epoch: 75, train_loss: 0.0908, test_loss: 2.3996, test_f1: 0.6251
 epoch: 76, train_loss: 0.0967, test_loss: 2.6736, test_f1: 0.6226
 epoch: 77, train_loss: 0.0956, test_loss: 2.7022, test_f1: 0.6064
 epoch: 78, train_loss: 0.0743, test_loss: 2.7244, test_f1: 0.6138
 epoch: 79, train_loss: 0.0867, test_loss: 2.8751, test_f1: 0.6350
 epoch: 80, train_loss: 0.1031, test_loss: 2.7966, test_f1: 0.6537
 epoch: 81, train_loss: 0.0791, test_loss: 2.7796, test_f1: 0.6341
 epoch: 82, train_loss: 0.0623, test_loss: 2.8402, test_f1: 0.6458
 epoch: 83, train_loss: 0.0623, test_loss: 2.8753, test_f1: 0.6381
 epoch: 84, train_loss: 0.0946, test_loss: 2.8971, test_f1: 0.6412
 epoch: 85, train_loss: 0.0863, test_loss: 2.9643, test_f1: 0.6293
 epoch: 86, train_loss: 0.0941, test_loss: 3.0903, test_f1: 0.6233
 epoch: 87, train_loss: 0.0900, test_loss: 2.9579, test_f1: 0.6452
 epoch: 88, train_loss: 0.0687, test_loss: 2.8090, test_f1: 0.6317
 epoch: 89, train_loss: 0.0961, test_loss: 3.0365, test_f1: 0.6422
 epoch: 90, train_loss: 0.0913, test_loss: 2.8361, test_f1: 0.6595
 epoch: 91, train_loss: 0.0677, test_loss: 3.0702, test_f1: 0.6293
 epoch: 92, train_loss: 0.0625, test_loss: 3.0610, test_f1: 0.6393
 epoch: 93, train_loss: 0.0567, test_loss: 3.0430, test_f1: 0.6499
 epoch: 94, train_loss: 0.0596, test_loss: 3.0375, test_f1: 0.6319
 epoch: 95, train_loss: 0.0641, test_loss: 3.1185, test_f1: 0.6171
 epoch: 96, train_loss: 0.0894, test_loss: 2.8446, test_f1: 0.6803
 epoch: 97, train_loss: 0.1334, test_loss: 3.0232, test_f1: 0.6429
 epoch: 98, train_loss: 0.1471, test_loss: 3.2413, test_f1: 0.5937
 epoch: 99, train_loss: 0.0887, test_loss: 2.9418, test_f1: 0.6013
##################ITERATION #1 ****************************************
 epoch: 0, train_loss: 1.1295, test_loss: 1.3613, test_f1: 0.3414
 epoch: 1, train_loss: 0.9335, test_loss: 1.4490, test_f1: 0.3868
 epoch: 2, train_loss: 0.8600, test_loss: 1.5545, test_f1: 0.3675
 epoch: 3, train_loss: 0.8100, test_loss: 1.5151, test_f1: 0.3869
 epoch: 4, train_loss: 0.7892, test_loss: 1.2843, test_f1: 0.4580
 epoch: 5, train_loss: 0.7455, test_loss: 1.4268, test_f1: 0.4657
 epoch: 6, train_loss: 0.7295, test_loss: 1.0304, test_f1: 0.5705
 epoch: 7, train_loss: 0.6950, test_loss: 1.0491, test_f1: 0.6029
 epoch: 8, train_loss: 0.6596, test_loss: 2.4302, test_f1: 0.2997
 epoch: 9, train_loss: 0.6307, test_loss: 1.0358, test_f1: 0.5896
 epoch: 10, train_loss: 0.6200, test_loss: 1.2172, test_f1: 0.5647
 epoch: 11, train_loss: 0.6165, test_loss: 1.2708, test_f1: 0.5377
 epoch: 12, train_loss: 0.6100, test_loss: 1.0639, test_f1: 0.5540
 epoch: 13, train_loss: 0.5928, test_loss: 0.9653, test_f1: 0.6005
 epoch: 14, train_loss: 0.5906, test_loss: 1.0708, test_f1: 0.6082
 epoch: 15, train_loss: 0.5731, test_loss: 1.1242, test_f1: 0.5705
 epoch: 16, train_loss: 0.5329, test_loss: 1.2188, test_f1: 0.5768
 epoch: 17, train_loss: 0.5273, test_loss: 1.7577, test_f1: 0.4400
 epoch: 18, train_loss: 0.5184, test_loss: 2.4349, test_f1: 0.4727
 epoch: 19, train_loss: 0.4704, test_loss: 1.4964, test_f1: 0.5145
 epoch: 20, train_loss: 0.4630, test_loss: 1.3602, test_f1: 0.6113
 epoch: 21, train_loss: 0.4417, test_loss: 1.2978, test_f1: 0.6029
 epoch: 22, train_loss: 0.4350, test_loss: 1.4106, test_f1: 0.5287
 epoch: 23, train_loss: 0.4383, test_loss: 1.3322, test_f1: 0.6289
 epoch: 24, train_loss: 0.4081, test_loss: 1.3294, test_f1: 0.5941
 epoch: 25, train_loss: 0.3907, test_loss: 1.7249, test_f1: 0.5174
 epoch: 26, train_loss: 0.3872, test_loss: 1.6739, test_f1: 0.5934
 epoch: 27, train_loss: 0.3703, test_loss: 1.5886, test_f1: 0.5812
 epoch: 28, train_loss: 0.3700, test_loss: 1.5980, test_f1: 0.5271
 epoch: 29, train_loss: 0.3860, test_loss: 1.9313, test_f1: 0.5543
 epoch: 30, train_loss: 0.3702, test_loss: 1.5918, test_f1: 0.6784
 epoch: 31, train_loss: 0.3955, test_loss: 1.7143, test_f1: 0.5629
 epoch: 32, train_loss: 0.3350, test_loss: 1.5584, test_f1: 0.5709
 epoch: 33, train_loss: 0.3428, test_loss: 1.6470, test_f1: 0.5731
 epoch: 34, train_loss: 0.3253, test_loss: 1.6228, test_f1: 0.5543
 epoch: 35, train_loss: 0.3417, test_loss: 1.5680, test_f1: 0.6359
 epoch: 36, train_loss: 0.3298, test_loss: 1.9880, test_f1: 0.6058
 epoch: 37, train_loss: 0.2951, test_loss: 1.4254, test_f1: 0.6290
 epoch: 38, train_loss: 0.2896, test_loss: 1.8153, test_f1: 0.6236
 epoch: 39, train_loss: 0.3103, test_loss: 1.7547, test_f1: 0.5832
 epoch: 40, train_loss: 0.2828, test_loss: 1.7354, test_f1: 0.6356
 epoch: 41, train_loss: 0.2923, test_loss: 1.8424, test_f1: 0.6091
 epoch: 42, train_loss: 0.2676, test_loss: 1.8616, test_f1: 0.5913
 epoch: 43, train_loss: 0.2393, test_loss: 2.1953, test_f1: 0.6101
 epoch: 44, train_loss: 0.2454, test_loss: 2.1230, test_f1: 0.5873
 epoch: 45, train_loss: 0.2716, test_loss: 2.2192, test_f1: 0.5776
 epoch: 46, train_loss: 0.2909, test_loss: 1.7988, test_f1: 0.6267
 epoch: 47, train_loss: 0.2714, test_loss: 1.7673, test_f1: 0.6257
 epoch: 48, train_loss: 0.2423, test_loss: 2.0765, test_f1: 0.6046
 epoch: 49, train_loss: 0.2102, test_loss: 2.1646, test_f1: 0.5535
 epoch: 50, train_loss: 0.2168, test_loss: 2.1228, test_f1: 0.5789
 epoch: 51, train_loss: 0.2116, test_loss: 2.0784, test_f1: 0.6211
 epoch: 52, train_loss: 0.1887, test_loss: 1.9155, test_f1: 0.6045
 epoch: 53, train_loss: 0.1579, test_loss: 2.1780, test_f1: 0.6013
 epoch: 54, train_loss: 0.1330, test_loss: 2.2339, test_f1: 0.5814
 epoch: 55, train_loss: 0.1330, test_loss: 2.1509, test_f1: 0.6157
 epoch: 56, train_loss: 0.1234, test_loss: 2.1918, test_f1: 0.6051
 epoch: 57, train_loss: 0.1203, test_loss: 2.3326, test_f1: 0.6241
 epoch: 58, train_loss: 0.1170, test_loss: 2.3822, test_f1: 0.5822
 epoch: 59, train_loss: 0.1148, test_loss: 2.3642, test_f1: 0.6115
 epoch: 60, train_loss: 0.1027, test_loss: 2.5665, test_f1: 0.6108
 epoch: 61, train_loss: 0.1160, test_loss: 2.4259, test_f1: 0.6198
 epoch: 62, train_loss: 0.1170, test_loss: 2.4222, test_f1: 0.6424
 epoch: 63, train_loss: 0.0881, test_loss: 2.5939, test_f1: 0.6287
 epoch: 64, train_loss: 0.1184, test_loss: 2.4253, test_f1: 0.5951
 epoch: 65, train_loss: 0.1944, test_loss: 2.9201, test_f1: 0.5807
 epoch: 66, train_loss: 0.1569, test_loss: 2.5847, test_f1: 0.6162
 epoch: 67, train_loss: 0.1197, test_loss: 2.4439, test_f1: 0.6066
 epoch: 68, train_loss: 0.1016, test_loss: 2.7055, test_f1: 0.5849
 epoch: 69, train_loss: 0.1164, test_loss: 2.4205, test_f1: 0.6175
 epoch: 70, train_loss: 0.1431, test_loss: 2.3228, test_f1: 0.6332
 epoch: 71, train_loss: 0.1095, test_loss: 2.4265, test_f1: 0.6480
 epoch: 72, train_loss: 0.1123, test_loss: 2.6903, test_f1: 0.6029
 epoch: 73, train_loss: 0.1092, test_loss: 2.6661, test_f1: 0.5944
 epoch: 74, train_loss: 0.1463, test_loss: 2.6339, test_f1: 0.6127
 epoch: 75, train_loss: 0.1463, test_loss: 2.6445, test_f1: 0.5926
 epoch: 76, train_loss: 0.1301, test_loss: 2.7633, test_f1: 0.5965
 epoch: 77, train_loss: 0.1142, test_loss: 2.6183, test_f1: 0.5908
 epoch: 78, train_loss: 0.1239, test_loss: 2.5725, test_f1: 0.6055
 epoch: 79, train_loss: 0.1178, test_loss: 2.9232, test_f1: 0.5825
 epoch: 80, train_loss: 0.1477, test_loss: 2.9305, test_f1: 0.5710
 epoch: 81, train_loss: 0.1206, test_loss: 2.6048, test_f1: 0.6047
 epoch: 82, train_loss: 0.1036, test_loss: 2.5577, test_f1: 0.6296
 epoch: 83, train_loss: 0.1041, test_loss: 2.6889, test_f1: 0.6199
 epoch: 84, train_loss: 0.0893, test_loss: 2.6696, test_f1: 0.6352
 epoch: 85, train_loss: 0.0707, test_loss: 2.7822, test_f1: 0.6252
 epoch: 86, train_loss: 0.0621, test_loss: 2.8898, test_f1: 0.6132
 epoch: 87, train_loss: 0.0636, test_loss: 3.0101, test_f1: 0.5854
 epoch: 88, train_loss: 0.0946, test_loss: 3.0596, test_f1: 0.5950
 epoch: 89, train_loss: 0.0859, test_loss: 3.1035, test_f1: 0.6019
 epoch: 90, train_loss: 0.0863, test_loss: 3.0920, test_f1: 0.5959
 epoch: 91, train_loss: 0.0868, test_loss: 3.0234, test_f1: 0.5705
 epoch: 92, train_loss: 0.0679, test_loss: 2.7927, test_f1: 0.6162
 epoch: 93, train_loss: 0.0589, test_loss: 2.8648, test_f1: 0.6159
 epoch: 94, train_loss: 0.0740, test_loss: 3.1045, test_f1: 0.6077
 epoch: 95, train_loss: 0.0775, test_loss: 2.9154, test_f1: 0.6309
 epoch: 96, train_loss: 0.0674, test_loss: 2.9216, test_f1: 0.6062
 epoch: 97, train_loss: 0.0555, test_loss: 2.8943, test_f1: 0.6440
 epoch: 98, train_loss: 0.0531, test_loss: 3.2733, test_f1: 0.6006
 epoch: 99, train_loss: 0.0693, test_loss: 3.1289, test_f1: 0.5877
##################ITERATION #2 ****************************************
 epoch: 0, train_loss: 1.1954, test_loss: 1.4177, test_f1: 0.3048
 epoch: 1, train_loss: 0.9845, test_loss: 1.4339, test_f1: 0.3021
 epoch: 2, train_loss: 0.8921, test_loss: 1.6104, test_f1: 0.2208
 epoch: 3, train_loss: 0.8240, test_loss: 1.5385, test_f1: 0.3046
 epoch: 4, train_loss: 0.7781, test_loss: 1.2742, test_f1: 0.4071
 epoch: 5, train_loss: 0.7467, test_loss: 1.2205, test_f1: 0.4988
 epoch: 6, train_loss: 0.7407, test_loss: 1.0705, test_f1: 0.5551
 epoch: 7, train_loss: 0.6932, test_loss: 0.9899, test_f1: 0.6037
 epoch: 8, train_loss: 0.6510, test_loss: 0.9676, test_f1: 0.6374
 epoch: 9, train_loss: 0.6509, test_loss: 1.0882, test_f1: 0.5745
 epoch: 10, train_loss: 0.6141, test_loss: 1.1524, test_f1: 0.6478
 epoch: 11, train_loss: 0.5914, test_loss: 1.0537, test_f1: 0.6423
 epoch: 12, train_loss: 0.5614, test_loss: 1.1679, test_f1: 0.5809
 epoch: 13, train_loss: 0.5456, test_loss: 1.1476, test_f1: 0.5843
 epoch: 14, train_loss: 0.5580, test_loss: 1.3408, test_f1: 0.5357
 epoch: 15, train_loss: 0.5490, test_loss: 1.1150, test_f1: 0.5824
 epoch: 16, train_loss: 0.5248, test_loss: 1.3383, test_f1: 0.6162
 epoch: 17, train_loss: 0.5353, test_loss: 1.2390, test_f1: 0.6105
 epoch: 18, train_loss: 0.4921, test_loss: 1.2150, test_f1: 0.5904
 epoch: 19, train_loss: 0.4644, test_loss: 1.3278, test_f1: 0.6031
 epoch: 20, train_loss: 0.4411, test_loss: 1.3980, test_f1: 0.5845
 epoch: 21, train_loss: 0.4105, test_loss: 1.4026, test_f1: 0.6034
 epoch: 22, train_loss: 0.4175, test_loss: 1.5327, test_f1: 0.6559
 epoch: 23, train_loss: 0.4505, test_loss: 1.4166, test_f1: 0.6032
 epoch: 24, train_loss: 0.4097, test_loss: 1.4973, test_f1: 0.5859
 epoch: 25, train_loss: 0.3753, test_loss: 1.4292, test_f1: 0.6171
 epoch: 26, train_loss: 0.3937, test_loss: 1.3699, test_f1: 0.6115
 epoch: 27, train_loss: 0.3531, test_loss: 1.6154, test_f1: 0.6181
 epoch: 28, train_loss: 0.3113, test_loss: 1.5892, test_f1: 0.6157
 epoch: 29, train_loss: 0.3659, test_loss: 1.9110, test_f1: 0.6125
 epoch: 30, train_loss: 0.3414, test_loss: 1.6401, test_f1: 0.6426
 epoch: 31, train_loss: 0.3169, test_loss: 1.5467, test_f1: 0.6473
 epoch: 32, train_loss: 0.3098, test_loss: 1.6946, test_f1: 0.6165
 epoch: 33, train_loss: 0.3091, test_loss: 1.9632, test_f1: 0.5920
 epoch: 34, train_loss: 0.3567, test_loss: 1.6275, test_f1: 0.6117
 epoch: 35, train_loss: 0.3141, test_loss: 1.4497, test_f1: 0.6309
 epoch: 36, train_loss: 0.2978, test_loss: 1.5597, test_f1: 0.6507
 epoch: 37, train_loss: 0.2814, test_loss: 1.6748, test_f1: 0.6243
 epoch: 38, train_loss: 0.2582, test_loss: 1.7047, test_f1: 0.6604
 epoch: 39, train_loss: 0.2667, test_loss: 1.8445, test_f1: 0.6581
 epoch: 40, train_loss: 0.2583, test_loss: 1.9263, test_f1: 0.6167
 epoch: 41, train_loss: 0.2878, test_loss: 2.0676, test_f1: 0.5987
 epoch: 42, train_loss: 0.2710, test_loss: 1.8339, test_f1: 0.6192
 epoch: 43, train_loss: 0.2900, test_loss: 1.7353, test_f1: 0.6399
 epoch: 44, train_loss: 0.2603, test_loss: 1.9716, test_f1: 0.5961
 epoch: 45, train_loss: 0.2528, test_loss: 1.9268, test_f1: 0.6214
 epoch: 46, train_loss: 0.2206, test_loss: 1.9970, test_f1: 0.6485
 epoch: 47, train_loss: 0.2234, test_loss: 2.0805, test_f1: 0.6072
 epoch: 48, train_loss: 0.1741, test_loss: 2.0114, test_f1: 0.6359
 epoch: 49, train_loss: 0.1804, test_loss: 2.3905, test_f1: 0.5962
 epoch: 50, train_loss: 0.2906, test_loss: 2.3164, test_f1: 0.5848
 epoch: 51, train_loss: 0.1829, test_loss: 2.1866, test_f1: 0.5812
 epoch: 52, train_loss: 0.1581, test_loss: 2.2082, test_f1: 0.5778
 epoch: 53, train_loss: 0.1754, test_loss: 2.3184, test_f1: 0.6086
 epoch: 54, train_loss: 0.1588, test_loss: 2.3057, test_f1: 0.6045
 epoch: 55, train_loss: 0.1346, test_loss: 2.3658, test_f1: 0.5911
 epoch: 56, train_loss: 0.1122, test_loss: 2.2566, test_f1: 0.5958
 epoch: 57, train_loss: 0.1216, test_loss: 2.5446, test_f1: 0.6242
 epoch: 58, train_loss: 0.1153, test_loss: 2.6791, test_f1: 0.6191
 epoch: 59, train_loss: 0.1157, test_loss: 2.5402, test_f1: 0.5934
 epoch: 60, train_loss: 0.1117, test_loss: 2.5942, test_f1: 0.6243
 epoch: 61, train_loss: 0.1164, test_loss: 2.8415, test_f1: 0.5864
 epoch: 62, train_loss: 0.1016, test_loss: 2.6543, test_f1: 0.5918
 epoch: 63, train_loss: 0.0861, test_loss: 2.8397, test_f1: 0.5862
 epoch: 64, train_loss: 0.1096, test_loss: 2.9369, test_f1: 0.6129
 epoch: 65, train_loss: 0.1018, test_loss: 3.0323, test_f1: 0.5851
 epoch: 66, train_loss: 0.1001, test_loss: 2.7695, test_f1: 0.5883
 epoch: 67, train_loss: 0.1410, test_loss: 3.0755, test_f1: 0.5546
 epoch: 68, train_loss: 0.1283, test_loss: 2.9012, test_f1: 0.5673
 epoch: 69, train_loss: 0.1183, test_loss: 2.8529, test_f1: 0.5827
 epoch: 70, train_loss: 0.1216, test_loss: 2.8633, test_f1: 0.5980
 epoch: 71, train_loss: 0.1209, test_loss: 2.7240, test_f1: 0.6431
 epoch: 72, train_loss: 0.1039, test_loss: 2.9773, test_f1: 0.5798
 epoch: 73, train_loss: 0.0979, test_loss: 3.0334, test_f1: 0.5766
 epoch: 74, train_loss: 0.0795, test_loss: 2.9380, test_f1: 0.5965
 epoch: 75, train_loss: 0.0879, test_loss: 3.3492, test_f1: 0.5993
 epoch: 76, train_loss: 0.1209, test_loss: 2.7897, test_f1: 0.6132
 epoch: 77, train_loss: 0.0914, test_loss: 2.9937, test_f1: 0.5922
 epoch: 78, train_loss: 0.0806, test_loss: 2.8423, test_f1: 0.6222
 epoch: 79, train_loss: 0.0813, test_loss: 3.2304, test_f1: 0.5912
 epoch: 80, train_loss: 0.0636, test_loss: 3.1528, test_f1: 0.6155
 epoch: 81, train_loss: 0.0652, test_loss: 3.4268, test_f1: 0.5912
 epoch: 82, train_loss: 0.0628, test_loss: 3.3013, test_f1: 0.5980
 epoch: 83, train_loss: 0.0711, test_loss: 3.2441, test_f1: 0.6242
 epoch: 84, train_loss: 0.0810, test_loss: 3.3731, test_f1: 0.6102
 epoch: 85, train_loss: 0.0831, test_loss: 3.5128, test_f1: 0.5902
 epoch: 86, train_loss: 0.0778, test_loss: 3.0194, test_f1: 0.6154
 epoch: 87, train_loss: 0.0783, test_loss: 3.0801, test_f1: 0.6023
 epoch: 88, train_loss: 0.0628, test_loss: 3.1850, test_f1: 0.6049
 epoch: 89, train_loss: 0.0725, test_loss: 3.5055, test_f1: 0.5981
 epoch: 90, train_loss: 0.0792, test_loss: 3.3754, test_f1: 0.5716
 epoch: 91, train_loss: 0.0648, test_loss: 3.2149, test_f1: 0.5952
 epoch: 92, train_loss: 0.0592, test_loss: 3.4711, test_f1: 0.6115
 epoch: 93, train_loss: 0.0637, test_loss: 3.4984, test_f1: 0.5889
 epoch: 94, train_loss: 0.0591, test_loss: 3.4873, test_f1: 0.5926
 epoch: 95, train_loss: 0.0730, test_loss: 3.3759, test_f1: 0.5872
 epoch: 96, train_loss: 0.0540, test_loss: 3.1127, test_f1: 0.6347
 epoch: 97, train_loss: 0.0746, test_loss: 3.7278, test_f1: 0.5732
 epoch: 98, train_loss: 0.0661, test_loss: 3.3264, test_f1: 0.6209
 epoch: 99, train_loss: 0.0553, test_loss: 3.2032, test_f1: 0.6306
##################ITERATION #3 ****************************************
 epoch: 0, train_loss: 1.1550, test_loss: 1.3487, test_f1: 0.3017
 epoch: 1, train_loss: 0.9510, test_loss: 1.3961, test_f1: 0.2587
 epoch: 2, train_loss: 0.8803, test_loss: 1.3877, test_f1: 0.2707
 epoch: 3, train_loss: 0.8140, test_loss: 1.1354, test_f1: 0.4744
 epoch: 4, train_loss: 0.7975, test_loss: 1.0533, test_f1: 0.5188
 epoch: 5, train_loss: 0.7559, test_loss: 1.0406, test_f1: 0.5948
 epoch: 6, train_loss: 0.7109, test_loss: 1.0533, test_f1: 0.5587
 epoch: 7, train_loss: 0.7383, test_loss: 1.3992, test_f1: 0.5790
 epoch: 8, train_loss: 0.7099, test_loss: 1.1177, test_f1: 0.5976
 epoch: 9, train_loss: 0.6743, test_loss: 1.0981, test_f1: 0.5443
 epoch: 10, train_loss: 0.6441, test_loss: 1.1394, test_f1: 0.5747
 epoch: 11, train_loss: 0.6347, test_loss: 1.1892, test_f1: 0.6034
 epoch: 12, train_loss: 0.6055, test_loss: 1.2974, test_f1: 0.5237
 epoch: 13, train_loss: 0.5958, test_loss: 1.2673, test_f1: 0.4581
 epoch: 14, train_loss: 0.5719, test_loss: 1.2081, test_f1: 0.5798
 epoch: 15, train_loss: 0.5773, test_loss: 1.1452, test_f1: 0.5288
 epoch: 16, train_loss: 0.5677, test_loss: 1.2603, test_f1: 0.5923
 epoch: 17, train_loss: 0.5338, test_loss: 1.2550, test_f1: 0.5365
 epoch: 18, train_loss: 0.5027, test_loss: 1.2867, test_f1: 0.6218
 epoch: 19, train_loss: 0.5037, test_loss: 1.4720, test_f1: 0.5740
 epoch: 20, train_loss: 0.5158, test_loss: 1.6391, test_f1: 0.5370
 epoch: 21, train_loss: 0.4855, test_loss: 1.2952, test_f1: 0.5955
 epoch: 22, train_loss: 0.4654, test_loss: 1.3262, test_f1: 0.5535
 epoch: 23, train_loss: 0.4565, test_loss: 1.3516, test_f1: 0.6185
 epoch: 24, train_loss: 0.4240, test_loss: 1.5578, test_f1: 0.5663
 epoch: 25, train_loss: 0.4188, test_loss: 1.3360, test_f1: 0.6217
 epoch: 26, train_loss: 0.3762, test_loss: 1.5084, test_f1: 0.5885
 epoch: 27, train_loss: 0.4170, test_loss: 1.5617, test_f1: 0.6255
 epoch: 28, train_loss: 0.4176, test_loss: 1.5200, test_f1: 0.5259
 epoch: 29, train_loss: 0.3834, test_loss: 1.7044, test_f1: 0.5958
 epoch: 30, train_loss: 0.3757, test_loss: 1.6291, test_f1: 0.6053
 epoch: 31, train_loss: 0.4017, test_loss: 1.3353, test_f1: 0.5592
 epoch: 32, train_loss: 0.4241, test_loss: 1.2413, test_f1: 0.6253
 epoch: 33, train_loss: 0.3503, test_loss: 1.2458, test_f1: 0.6416
 epoch: 34, train_loss: 0.3438, test_loss: 1.4444, test_f1: 0.5815
 epoch: 35, train_loss: 0.3322, test_loss: 1.6021, test_f1: 0.5629
 epoch: 36, train_loss: 0.3106, test_loss: 1.6456, test_f1: 0.5783
 epoch: 37, train_loss: 0.3082, test_loss: 1.7101, test_f1: 0.5434
 epoch: 38, train_loss: 0.2858, test_loss: 1.6093, test_f1: 0.6002
 epoch: 39, train_loss: 0.2436, test_loss: 1.7633, test_f1: 0.6473
 epoch: 40, train_loss: 0.2774, test_loss: 1.8130, test_f1: 0.5779
 epoch: 41, train_loss: 0.3276, test_loss: 1.9173, test_f1: 0.5794
 epoch: 42, train_loss: 0.2978, test_loss: 1.6482, test_f1: 0.5968
 epoch: 43, train_loss: 0.2514, test_loss: 1.7922, test_f1: 0.5940
 epoch: 44, train_loss: 0.2398, test_loss: 1.8313, test_f1: 0.6322
 epoch: 45, train_loss: 0.2214, test_loss: 1.9132, test_f1: 0.6106
 epoch: 46, train_loss: 0.2499, test_loss: 2.0382, test_f1: 0.5789
 epoch: 47, train_loss: 0.2685, test_loss: 1.9814, test_f1: 0.5226
 epoch: 48, train_loss: 0.2665, test_loss: 1.9090, test_f1: 0.6083
 epoch: 49, train_loss: 0.2958, test_loss: 2.2291, test_f1: 0.5789
 epoch: 50, train_loss: 0.2660, test_loss: 1.9829, test_f1: 0.6504
 epoch: 51, train_loss: 0.1956, test_loss: 1.9269, test_f1: 0.6195
 epoch: 52, train_loss: 0.2151, test_loss: 1.8613, test_f1: 0.6032
 epoch: 53, train_loss: 0.1848, test_loss: 1.8652, test_f1: 0.5993
 epoch: 54, train_loss: 0.1827, test_loss: 1.8218, test_f1: 0.6240
 epoch: 55, train_loss: 0.1759, test_loss: 1.8255, test_f1: 0.6240
 epoch: 56, train_loss: 0.1499, test_loss: 1.9952, test_f1: 0.6104
 epoch: 57, train_loss: 0.1600, test_loss: 1.9935, test_f1: 0.6246
 epoch: 58, train_loss: 0.1447, test_loss: 2.0606, test_f1: 0.5882
 epoch: 59, train_loss: 0.1380, test_loss: 2.0464, test_f1: 0.5881
 epoch: 60, train_loss: 0.1335, test_loss: 2.0718, test_f1: 0.5975
 epoch: 61, train_loss: 0.1416, test_loss: 2.1631, test_f1: 0.6080
 epoch: 62, train_loss: 0.1110, test_loss: 2.0918, test_f1: 0.6359
 epoch: 63, train_loss: 0.1015, test_loss: 2.3031, test_f1: 0.6008
 epoch: 64, train_loss: 0.1063, test_loss: 2.2543, test_f1: 0.6076
 epoch: 65, train_loss: 0.1268, test_loss: 2.4280, test_f1: 0.5979
 epoch: 66, train_loss: 0.1132, test_loss: 2.2920, test_f1: 0.6186
 epoch: 67, train_loss: 0.1226, test_loss: 2.3589, test_f1: 0.5884
 epoch: 68, train_loss: 0.1201, test_loss: 2.3790, test_f1: 0.5969
 epoch: 69, train_loss: 0.1186, test_loss: 2.5265, test_f1: 0.5993
 epoch: 70, train_loss: 0.1055, test_loss: 2.6709, test_f1: 0.5903
 epoch: 71, train_loss: 0.1135, test_loss: 2.3800, test_f1: 0.6431
 epoch: 72, train_loss: 0.1036, test_loss: 2.3236, test_f1: 0.6248
 epoch: 73, train_loss: 0.1073, test_loss: 2.2294, test_f1: 0.6097
 epoch: 74, train_loss: 0.0968, test_loss: 2.4831, test_f1: 0.5923
 epoch: 75, train_loss: 0.0988, test_loss: 2.3786, test_f1: 0.6102
 epoch: 76, train_loss: 0.0865, test_loss: 2.4483, test_f1: 0.6425
 epoch: 77, train_loss: 0.0795, test_loss: 2.5071, test_f1: 0.5879
 epoch: 78, train_loss: 0.1057, test_loss: 2.7288, test_f1: 0.5887
 epoch: 79, train_loss: 0.0935, test_loss: 2.5590, test_f1: 0.6194
 epoch: 80, train_loss: 0.0927, test_loss: 2.7409, test_f1: 0.5807
 epoch: 81, train_loss: 0.1074, test_loss: 2.6812, test_f1: 0.6073
 epoch: 82, train_loss: 0.0952, test_loss: 2.5942, test_f1: 0.6291
 epoch: 83, train_loss: 0.0971, test_loss: 2.6880, test_f1: 0.6302
 epoch: 84, train_loss: 0.1137, test_loss: 2.7582, test_f1: 0.6116
 epoch: 85, train_loss: 0.1040, test_loss: 2.6476, test_f1: 0.5915
 epoch: 86, train_loss: 0.0695, test_loss: 2.5582, test_f1: 0.6254
 epoch: 87, train_loss: 0.0713, test_loss: 2.7396, test_f1: 0.6178
 epoch: 88, train_loss: 0.0957, test_loss: 2.6988, test_f1: 0.5873
 epoch: 89, train_loss: 0.0851, test_loss: 2.5137, test_f1: 0.6312
 epoch: 90, train_loss: 0.0733, test_loss: 2.8318, test_f1: 0.5877
 epoch: 91, train_loss: 0.0697, test_loss: 2.8292, test_f1: 0.6342
 epoch: 92, train_loss: 0.0685, test_loss: 2.9736, test_f1: 0.5947
 epoch: 93, train_loss: 0.1019, test_loss: 2.7730, test_f1: 0.6210
 epoch: 94, train_loss: 0.1035, test_loss: 2.8378, test_f1: 0.6398
 epoch: 95, train_loss: 0.1100, test_loss: 2.6588, test_f1: 0.6084
 epoch: 96, train_loss: 0.0994, test_loss: 2.8779, test_f1: 0.5983
 epoch: 97, train_loss: 0.0720, test_loss: 2.9379, test_f1: 0.6027
 epoch: 98, train_loss: 0.0996, test_loss: 2.7061, test_f1: 0.6122
 epoch: 99, train_loss: 0.0808, test_loss: 2.8547, test_f1: 0.6143
##################ITERATION #4 ****************************************
 epoch: 0, train_loss: 1.1832, test_loss: 1.3817, test_f1: 0.3604
 epoch: 1, train_loss: 0.9830, test_loss: 1.3665, test_f1: 0.4214
 epoch: 2, train_loss: 0.9175, test_loss: 1.4210, test_f1: 0.2897
 epoch: 3, train_loss: 0.8872, test_loss: 1.2835, test_f1: 0.3653
 epoch: 4, train_loss: 0.8288, test_loss: 1.1434, test_f1: 0.4711
 epoch: 5, train_loss: 0.7943, test_loss: 1.0911, test_f1: 0.5960
 epoch: 6, train_loss: 0.7564, test_loss: 1.0222, test_f1: 0.5730
 epoch: 7, train_loss: 0.7232, test_loss: 1.0686, test_f1: 0.5863
 epoch: 8, train_loss: 0.6801, test_loss: 1.0287, test_f1: 0.6018
 epoch: 9, train_loss: 0.6805, test_loss: 1.1633, test_f1: 0.5713
 epoch: 10, train_loss: 0.6666, test_loss: 1.1350, test_f1: 0.5764
 epoch: 11, train_loss: 0.6413, test_loss: 1.3847, test_f1: 0.4651
 epoch: 12, train_loss: 0.6382, test_loss: 1.2469, test_f1: 0.5750
 epoch: 13, train_loss: 0.5849, test_loss: 1.4840, test_f1: 0.5561
 epoch: 14, train_loss: 0.5796, test_loss: 1.0946, test_f1: 0.6048
 epoch: 15, train_loss: 0.5793, test_loss: 1.3179, test_f1: 0.6432
 epoch: 16, train_loss: 0.5358, test_loss: 1.2599, test_f1: 0.6469
 epoch: 17, train_loss: 0.5306, test_loss: 1.3558, test_f1: 0.5486
 epoch: 18, train_loss: 0.5588, test_loss: 1.4667, test_f1: 0.5945
 epoch: 19, train_loss: 0.5483, test_loss: 1.5139, test_f1: 0.5846
 epoch: 20, train_loss: 0.5025, test_loss: 1.2749, test_f1: 0.6431
 epoch: 21, train_loss: 0.4603, test_loss: 1.4648, test_f1: 0.6253
 epoch: 22, train_loss: 0.4504, test_loss: 1.5044, test_f1: 0.5700
 epoch: 23, train_loss: 0.4440, test_loss: 1.4475, test_f1: 0.6053
 epoch: 24, train_loss: 0.4193, test_loss: 1.4652, test_f1: 0.6034
 epoch: 25, train_loss: 0.4356, test_loss: 1.4832, test_f1: 0.6065
 epoch: 26, train_loss: 0.4288, test_loss: 1.7429, test_f1: 0.5540
 epoch: 27, train_loss: 0.4310, test_loss: 1.6739, test_f1: 0.5155
 epoch: 28, train_loss: 0.3998, test_loss: 1.6361, test_f1: 0.5990
 epoch: 29, train_loss: 0.3703, test_loss: 1.3743, test_f1: 0.6604
 epoch: 30, train_loss: 0.3471, test_loss: 1.8380, test_f1: 0.6127
 epoch: 31, train_loss: 0.3585, test_loss: 2.0787, test_f1: 0.5835
 epoch: 32, train_loss: 0.3458, test_loss: 1.7424, test_f1: 0.5786
 epoch: 33, train_loss: 0.3041, test_loss: 1.7063, test_f1: 0.6336
 epoch: 34, train_loss: 0.3398, test_loss: 1.6843, test_f1: 0.6265
 epoch: 35, train_loss: 0.2991, test_loss: 2.2561, test_f1: 0.5302
 epoch: 36, train_loss: 0.3163, test_loss: 1.8097, test_f1: 0.6192
 epoch: 37, train_loss: 0.2889, test_loss: 1.9931, test_f1: 0.5790
 epoch: 38, train_loss: 0.3066, test_loss: 1.9181, test_f1: 0.6049
 epoch: 39, train_loss: 0.3159, test_loss: 1.9123, test_f1: 0.5859
 epoch: 40, train_loss: 0.3212, test_loss: 2.3437, test_f1: 0.5512
 epoch: 41, train_loss: 0.3208, test_loss: 1.8934, test_f1: 0.5704
 epoch: 42, train_loss: 0.3400, test_loss: 1.6991, test_f1: 0.5705
 epoch: 43, train_loss: 0.3011, test_loss: 1.7181, test_f1: 0.6313
 epoch: 44, train_loss: 0.2961, test_loss: 2.0744, test_f1: 0.6220
 epoch: 45, train_loss: 0.3498, test_loss: 1.7432, test_f1: 0.6037
 epoch: 46, train_loss: 0.2549, test_loss: 1.7823, test_f1: 0.5981
 epoch: 47, train_loss: 0.2392, test_loss: 1.9164, test_f1: 0.5976
 epoch: 48, train_loss: 0.2141, test_loss: 1.9737, test_f1: 0.6263
 epoch: 49, train_loss: 0.1986, test_loss: 1.9951, test_f1: 0.6171
 epoch: 50, train_loss: 0.1840, test_loss: 2.1224, test_f1: 0.6113
 epoch: 51, train_loss: 0.2084, test_loss: 2.0490, test_f1: 0.6200
 epoch: 52, train_loss: 0.1810, test_loss: 1.9126, test_f1: 0.6445
 epoch: 53, train_loss: 0.1886, test_loss: 1.9431, test_f1: 0.6678
 epoch: 54, train_loss: 0.1618, test_loss: 1.9997, test_f1: 0.6514
 epoch: 55, train_loss: 0.1472, test_loss: 2.1274, test_f1: 0.6319
 epoch: 56, train_loss: 0.1363, test_loss: 1.9630, test_f1: 0.6227
 epoch: 57, train_loss: 0.1344, test_loss: 2.1849, test_f1: 0.6123
 epoch: 58, train_loss: 0.1617, test_loss: 2.0421, test_f1: 0.6667
 epoch: 59, train_loss: 0.1427, test_loss: 1.9802, test_f1: 0.6419
 epoch: 60, train_loss: 0.1344, test_loss: 2.0426, test_f1: 0.6277
 epoch: 61, train_loss: 0.1233, test_loss: 2.2837, test_f1: 0.6008
 epoch: 62, train_loss: 0.1335, test_loss: 2.6277, test_f1: 0.5957
 epoch: 63, train_loss: 0.1445, test_loss: 2.3793, test_f1: 0.6075
 epoch: 64, train_loss: 0.1358, test_loss: 2.3288, test_f1: 0.6177
 epoch: 65, train_loss: 0.1570, test_loss: 2.3223, test_f1: 0.6182
 epoch: 66, train_loss: 0.1304, test_loss: 2.4590, test_f1: 0.6061
 epoch: 67, train_loss: 0.1352, test_loss: 2.3368, test_f1: 0.6058
 epoch: 68, train_loss: 0.1456, test_loss: 2.3674, test_f1: 0.6313
 epoch: 69, train_loss: 0.1469, test_loss: 2.0882, test_f1: 0.6153
 epoch: 70, train_loss: 0.1365, test_loss: 2.4586, test_f1: 0.6151
 epoch: 71, train_loss: 0.1365, test_loss: 2.6336, test_f1: 0.5948
 epoch: 72, train_loss: 0.1117, test_loss: 2.3473, test_f1: 0.6374
 epoch: 73, train_loss: 0.1141, test_loss: 2.4522, test_f1: 0.6259
 epoch: 74, train_loss: 0.0988, test_loss: 2.5517, test_f1: 0.6643
 epoch: 75, train_loss: 0.1069, test_loss: 2.4171, test_f1: 0.6334
 epoch: 76, train_loss: 0.1256, test_loss: 2.8543, test_f1: 0.5871
 epoch: 77, train_loss: 0.1060, test_loss: 2.5997, test_f1: 0.6306
 epoch: 78, train_loss: 0.1105, test_loss: 2.5798, test_f1: 0.6744
 epoch: 79, train_loss: 0.0978, test_loss: 2.6446, test_f1: 0.5982
 epoch: 80, train_loss: 0.0877, test_loss: 2.8744, test_f1: 0.6045
 epoch: 81, train_loss: 0.1022, test_loss: 2.6563, test_f1: 0.6367
 epoch: 82, train_loss: 0.0823, test_loss: 2.8317, test_f1: 0.5996
 epoch: 83, train_loss: 0.0770, test_loss: 2.8492, test_f1: 0.6130
 epoch: 84, train_loss: 0.0621, test_loss: 2.8897, test_f1: 0.6181
 epoch: 85, train_loss: 0.0764, test_loss: 2.9711, test_f1: 0.6067
 epoch: 86, train_loss: 0.0776, test_loss: 2.9925, test_f1: 0.6058
 epoch: 87, train_loss: 0.0758, test_loss: 3.1035, test_f1: 0.6335
 epoch: 88, train_loss: 0.0613, test_loss: 3.3686, test_f1: 0.6058
 epoch: 89, train_loss: 0.0589, test_loss: 3.3401, test_f1: 0.6084
 epoch: 90, train_loss: 0.0531, test_loss: 3.1356, test_f1: 0.6198
 epoch: 91, train_loss: 0.0689, test_loss: 3.1800, test_f1: 0.6016
 epoch: 92, train_loss: 0.0682, test_loss: 3.0808, test_f1: 0.6082
 epoch: 93, train_loss: 0.0949, test_loss: 3.2489, test_f1: 0.5864
 epoch: 94, train_loss: 0.0828, test_loss: 2.8750, test_f1: 0.5980
 epoch: 95, train_loss: 0.0895, test_loss: 3.0021, test_f1: 0.6702
 epoch: 96, train_loss: 0.1100, test_loss: 3.4104, test_f1: 0.6090
 epoch: 97, train_loss: 0.0811, test_loss: 3.2231, test_f1: 0.5994
 epoch: 98, train_loss: 0.0787, test_loss: 3.0601, test_f1: 0.6073
 epoch: 99, train_loss: 0.0704, test_loss: 3.1199, test_f1: 0.6106
##################ITERATION #5 ****************************************
 epoch: 0, train_loss: 1.1998, test_loss: 1.3716, test_f1: 0.2893
 epoch: 1, train_loss: 0.9490, test_loss: 1.4145, test_f1: 0.2726
 epoch: 2, train_loss: 0.8592, test_loss: 1.2684, test_f1: 0.4175
 epoch: 3, train_loss: 0.8095, test_loss: 1.1197, test_f1: 0.5128
 epoch: 4, train_loss: 0.7794, test_loss: 1.0895, test_f1: 0.5836
 epoch: 5, train_loss: 0.7339, test_loss: 0.9753, test_f1: 0.6266
 epoch: 6, train_loss: 0.7313, test_loss: 0.9939, test_f1: 0.6094
 epoch: 7, train_loss: 0.7123, test_loss: 0.9668, test_f1: 0.5832
 epoch: 8, train_loss: 0.6460, test_loss: 0.9442, test_f1: 0.6296
 epoch: 9, train_loss: 0.6218, test_loss: 1.0577, test_f1: 0.5760
 epoch: 10, train_loss: 0.5978, test_loss: 1.1225, test_f1: 0.5634
 epoch: 11, train_loss: 0.6047, test_loss: 1.1510, test_f1: 0.5906
 epoch: 12, train_loss: 0.5591, test_loss: 1.2351, test_f1: 0.5648
 epoch: 13, train_loss: 0.5578, test_loss: 1.1112, test_f1: 0.5838
 epoch: 14, train_loss: 0.5082, test_loss: 1.0405, test_f1: 0.6323
 epoch: 15, train_loss: 0.5051, test_loss: 1.2733, test_f1: 0.6118
 epoch: 16, train_loss: 0.4902, test_loss: 1.3182, test_f1: 0.5923
 epoch: 17, train_loss: 0.4720, test_loss: 1.2761, test_f1: 0.6481
 epoch: 18, train_loss: 0.4780, test_loss: 1.3701, test_f1: 0.5909
 epoch: 19, train_loss: 0.4425, test_loss: 1.2945, test_f1: 0.6398
 epoch: 20, train_loss: 0.4507, test_loss: 1.3003, test_f1: 0.6224
 epoch: 21, train_loss: 0.4386, test_loss: 1.2740, test_f1: 0.5925
 epoch: 22, train_loss: 0.4258, test_loss: 1.4216, test_f1: 0.6024
 epoch: 23, train_loss: 0.4038, test_loss: 1.5673, test_f1: 0.5675
 epoch: 24, train_loss: 0.4037, test_loss: 1.4190, test_f1: 0.6426
 epoch: 25, train_loss: 0.4099, test_loss: 1.5293, test_f1: 0.6127
 epoch: 26, train_loss: 0.3591, test_loss: 1.4038, test_f1: 0.6525
 epoch: 27, train_loss: 0.3491, test_loss: 1.6772, test_f1: 0.6164
 epoch: 28, train_loss: 0.3433, test_loss: 1.5285, test_f1: 0.6636
 epoch: 29, train_loss: 0.3357, test_loss: 1.6493, test_f1: 0.6252
 epoch: 30, train_loss: 0.3224, test_loss: 1.7395, test_f1: 0.5912
 epoch: 31, train_loss: 0.3409, test_loss: 1.7919, test_f1: 0.6040
 epoch: 32, train_loss: 0.2690, test_loss: 1.8733, test_f1: 0.5904
 epoch: 33, train_loss: 0.2579, test_loss: 1.7798, test_f1: 0.6653
 epoch: 34, train_loss: 0.2712, test_loss: 1.9024, test_f1: 0.6288
 epoch: 35, train_loss: 0.3120, test_loss: 1.9136, test_f1: 0.6250
 epoch: 36, train_loss: 0.2899, test_loss: 1.9057, test_f1: 0.6297
 epoch: 37, train_loss: 0.2928, test_loss: 1.8424, test_f1: 0.6184
 epoch: 38, train_loss: 0.2675, test_loss: 2.2132, test_f1: 0.6018
 epoch: 39, train_loss: 0.2910, test_loss: 2.0368, test_f1: 0.5690
 epoch: 40, train_loss: 0.2930, test_loss: 1.7608, test_f1: 0.6269
 epoch: 41, train_loss: 0.2998, test_loss: 1.8881, test_f1: 0.6113
 epoch: 42, train_loss: 0.2582, test_loss: 1.8263, test_f1: 0.6324
 epoch: 43, train_loss: 0.2445, test_loss: 1.8199, test_f1: 0.6117
 epoch: 44, train_loss: 0.2535, test_loss: 1.7825, test_f1: 0.6662
 epoch: 45, train_loss: 0.2235, test_loss: 2.0928, test_f1: 0.5897
 epoch: 46, train_loss: 0.2243, test_loss: 1.9458, test_f1: 0.6340
 epoch: 47, train_loss: 0.1622, test_loss: 2.2695, test_f1: 0.6036
 epoch: 48, train_loss: 0.2273, test_loss: 2.0325, test_f1: 0.6178
 epoch: 49, train_loss: 0.2095, test_loss: 2.1046, test_f1: 0.6147
 epoch: 50, train_loss: 0.1954, test_loss: 2.1984, test_f1: 0.6187
 epoch: 51, train_loss: 0.1780, test_loss: 2.2855, test_f1: 0.6324
 epoch: 52, train_loss: 0.1657, test_loss: 2.1355, test_f1: 0.6288
 epoch: 53, train_loss: 0.1455, test_loss: 2.1672, test_f1: 0.6061
 epoch: 54, train_loss: 0.1268, test_loss: 2.2300, test_f1: 0.6297
 epoch: 55, train_loss: 0.1101, test_loss: 2.3814, test_f1: 0.6151
 epoch: 56, train_loss: 0.1268, test_loss: 2.3181, test_f1: 0.6060
 epoch: 57, train_loss: 0.1377, test_loss: 2.4285, test_f1: 0.6199
 epoch: 58, train_loss: 0.1300, test_loss: 2.2945, test_f1: 0.6192
 epoch: 59, train_loss: 0.1182, test_loss: 2.3973, test_f1: 0.6100
 epoch: 60, train_loss: 0.1069, test_loss: 2.5253, test_f1: 0.6449
 epoch: 61, train_loss: 0.1207, test_loss: 2.4110, test_f1: 0.6248
 epoch: 62, train_loss: 0.1262, test_loss: 2.5360, test_f1: 0.5766
 epoch: 63, train_loss: 0.1106, test_loss: 2.4822, test_f1: 0.6515
 epoch: 64, train_loss: 0.0968, test_loss: 2.5010, test_f1: 0.6069
 epoch: 65, train_loss: 0.0925, test_loss: 2.6522, test_f1: 0.6001
 epoch: 66, train_loss: 0.1072, test_loss: 2.7068, test_f1: 0.5960
 epoch: 67, train_loss: 0.0973, test_loss: 2.7395, test_f1: 0.6188
 epoch: 68, train_loss: 0.0653, test_loss: 2.7472, test_f1: 0.6158
 epoch: 69, train_loss: 0.1004, test_loss: 2.5898, test_f1: 0.5911
 epoch: 70, train_loss: 0.1096, test_loss: 2.5389, test_f1: 0.6340
 epoch: 71, train_loss: 0.1476, test_loss: 2.8403, test_f1: 0.5932
 epoch: 72, train_loss: 0.1206, test_loss: 2.6246, test_f1: 0.6080
 epoch: 73, train_loss: 0.1260, test_loss: 2.7931, test_f1: 0.5992
 epoch: 74, train_loss: 0.0905, test_loss: 2.7087, test_f1: 0.5875
 epoch: 75, train_loss: 0.0832, test_loss: 2.6869, test_f1: 0.5928
 epoch: 76, train_loss: 0.1090, test_loss: 2.6445, test_f1: 0.6379
 epoch: 77, train_loss: 0.0666, test_loss: 2.7737, test_f1: 0.6206
 epoch: 78, train_loss: 0.0746, test_loss: 2.9703, test_f1: 0.5983
 epoch: 79, train_loss: 0.0706, test_loss: 2.9803, test_f1: 0.5776
 epoch: 80, train_loss: 0.0734, test_loss: 3.0042, test_f1: 0.5971
 epoch: 81, train_loss: 0.0727, test_loss: 2.9194, test_f1: 0.6240
 epoch: 82, train_loss: 0.0675, test_loss: 3.1056, test_f1: 0.6085
 epoch: 83, train_loss: 0.0608, test_loss: 3.1052, test_f1: 0.6227
 epoch: 84, train_loss: 0.0599, test_loss: 3.0791, test_f1: 0.6060
 epoch: 85, train_loss: 0.0717, test_loss: 3.1977, test_f1: 0.6022
 epoch: 86, train_loss: 0.0752, test_loss: 3.1929, test_f1: 0.5982
 epoch: 87, train_loss: 0.0714, test_loss: 2.9288, test_f1: 0.6263
 epoch: 88, train_loss: 0.0762, test_loss: 2.9436, test_f1: 0.6233
 epoch: 89, train_loss: 0.0800, test_loss: 3.3319, test_f1: 0.5869
 epoch: 90, train_loss: 0.0817, test_loss: 3.2635, test_f1: 0.5839
 epoch: 91, train_loss: 0.0805, test_loss: 3.1502, test_f1: 0.5835
 epoch: 92, train_loss: 0.0788, test_loss: 3.1510, test_f1: 0.6060
 epoch: 93, train_loss: 0.1079, test_loss: 3.1259, test_f1: 0.6132
 epoch: 94, train_loss: 0.1074, test_loss: 3.1833, test_f1: 0.5839
 epoch: 95, train_loss: 0.1036, test_loss: 3.0849, test_f1: 0.5767
 epoch: 96, train_loss: 0.0923, test_loss: 3.2990, test_f1: 0.5969
 epoch: 97, train_loss: 0.0889, test_loss: 3.0967, test_f1: 0.5924
 epoch: 98, train_loss: 0.0750, test_loss: 3.1680, test_f1: 0.6068
 epoch: 99, train_loss: 0.0561, test_loss: 3.1360, test_f1: 0.6288
##################ITERATION #6 ****************************************
 epoch: 0, train_loss: 1.2270, test_loss: 1.4351, test_f1: 0.1365
 epoch: 1, train_loss: 0.9774, test_loss: 1.3030, test_f1: 0.3501
 epoch: 2, train_loss: 0.9055, test_loss: 1.2934, test_f1: 0.4203
 epoch: 3, train_loss: 0.8749, test_loss: 1.1239, test_f1: 0.5629
 epoch: 4, train_loss: 0.8109, test_loss: 1.0020, test_f1: 0.5720
 epoch: 5, train_loss: 0.7841, test_loss: 1.0271, test_f1: 0.5446
 epoch: 6, train_loss: 0.7297, test_loss: 0.9812, test_f1: 0.5668
 epoch: 7, train_loss: 0.7164, test_loss: 1.0228, test_f1: 0.5347
 epoch: 8, train_loss: 0.6895, test_loss: 1.0553, test_f1: 0.5926
 epoch: 9, train_loss: 0.6709, test_loss: 1.0696, test_f1: 0.6205
 epoch: 10, train_loss: 0.6580, test_loss: 1.1226, test_f1: 0.5630
 epoch: 11, train_loss: 0.6420, test_loss: 1.1645, test_f1: 0.5401
 epoch: 12, train_loss: 0.6013, test_loss: 1.0424, test_f1: 0.5722
 epoch: 13, train_loss: 0.6290, test_loss: 1.2578, test_f1: 0.5613
 epoch: 14, train_loss: 0.6332, test_loss: 1.3133, test_f1: 0.5682
 epoch: 15, train_loss: 0.5816, test_loss: 1.3671, test_f1: 0.4717
 epoch: 16, train_loss: 0.5676, test_loss: 1.1938, test_f1: 0.5368
 epoch: 17, train_loss: 0.5555, test_loss: 1.0563, test_f1: 0.6079
 epoch: 18, train_loss: 0.5447, test_loss: 1.3526, test_f1: 0.5285
 epoch: 19, train_loss: 0.5067, test_loss: 1.4683, test_f1: 0.4766
 epoch: 20, train_loss: 0.5103, test_loss: 1.1801, test_f1: 0.6146
 epoch: 21, train_loss: 0.4955, test_loss: 1.2479, test_f1: 0.5381
 epoch: 22, train_loss: 0.4983, test_loss: 1.3015, test_f1: 0.5249
 epoch: 23, train_loss: 0.4556, test_loss: 1.2059, test_f1: 0.6086
 epoch: 24, train_loss: 0.4460, test_loss: 1.4066, test_f1: 0.5653
 epoch: 25, train_loss: 0.4288, test_loss: 1.3812, test_f1: 0.5970
 epoch: 26, train_loss: 0.4551, test_loss: 1.4952, test_f1: 0.5375
 epoch: 27, train_loss: 0.4622, test_loss: 1.4041, test_f1: 0.5459
 epoch: 28, train_loss: 0.4247, test_loss: 1.2889, test_f1: 0.6223
 epoch: 29, train_loss: 0.4909, test_loss: 1.3184, test_f1: 0.5416
 epoch: 30, train_loss: 0.3925, test_loss: 1.1856, test_f1: 0.6617
 epoch: 31, train_loss: 0.3587, test_loss: 1.4170, test_f1: 0.5453
 epoch: 32, train_loss: 0.3634, test_loss: 1.5085, test_f1: 0.5476
 epoch: 33, train_loss: 0.3374, test_loss: 1.3478, test_f1: 0.6041
 epoch: 34, train_loss: 0.3580, test_loss: 1.4055, test_f1: 0.6182
 epoch: 35, train_loss: 0.3732, test_loss: 1.6314, test_f1: 0.5437
 epoch: 36, train_loss: 0.3343, test_loss: 1.5657, test_f1: 0.5791
 epoch: 37, train_loss: 0.3554, test_loss: 2.4964, test_f1: 0.4361
 epoch: 38, train_loss: 0.3000, test_loss: 1.4513, test_f1: 0.5676
 epoch: 39, train_loss: 0.2963, test_loss: 1.6120, test_f1: 0.5605
 epoch: 40, train_loss: 0.3289, test_loss: 1.8410, test_f1: 0.5980
 epoch: 41, train_loss: 0.2764, test_loss: 1.7687, test_f1: 0.5652
 epoch: 42, train_loss: 0.2639, test_loss: 1.4359, test_f1: 0.5938
 epoch: 43, train_loss: 0.3025, test_loss: 1.3768, test_f1: 0.6388
 epoch: 44, train_loss: 0.3124, test_loss: 1.6457, test_f1: 0.6460
 epoch: 45, train_loss: 0.3172, test_loss: 1.6457, test_f1: 0.5959
 epoch: 46, train_loss: 0.2795, test_loss: 1.6282, test_f1: 0.6238
 epoch: 47, train_loss: 0.2907, test_loss: 1.7574, test_f1: 0.5890
 epoch: 48, train_loss: 0.2475, test_loss: 1.7126, test_f1: 0.6191
 epoch: 49, train_loss: 0.2821, test_loss: 1.6758, test_f1: 0.6268
 epoch: 50, train_loss: 0.2941, test_loss: 1.7967, test_f1: 0.5581
 epoch: 51, train_loss: 0.2746, test_loss: 1.5277, test_f1: 0.5831
 epoch: 52, train_loss: 0.2195, test_loss: 1.4410, test_f1: 0.6110
 epoch: 53, train_loss: 0.2065, test_loss: 1.6353, test_f1: 0.6065
 epoch: 54, train_loss: 0.1888, test_loss: 1.6909, test_f1: 0.6250
 epoch: 55, train_loss: 0.1488, test_loss: 1.8103, test_f1: 0.6026
 epoch: 56, train_loss: 0.1589, test_loss: 1.9142, test_f1: 0.5925
 epoch: 57, train_loss: 0.2303, test_loss: 1.7094, test_f1: 0.6374
 epoch: 58, train_loss: 0.1938, test_loss: 1.8342, test_f1: 0.6253
 epoch: 59, train_loss: 0.1706, test_loss: 1.9820, test_f1: 0.6121
 epoch: 60, train_loss: 0.1312, test_loss: 2.0750, test_f1: 0.6023
 epoch: 61, train_loss: 0.1194, test_loss: 2.0871, test_f1: 0.6133
 epoch: 62, train_loss: 0.1269, test_loss: 2.1219, test_f1: 0.6180
 epoch: 63, train_loss: 0.0976, test_loss: 2.1958, test_f1: 0.6241
 epoch: 64, train_loss: 0.1260, test_loss: 2.1630, test_f1: 0.6014
 epoch: 65, train_loss: 0.1278, test_loss: 1.9404, test_f1: 0.6377
 epoch: 66, train_loss: 0.1238, test_loss: 2.0458, test_f1: 0.6351
 epoch: 67, train_loss: 0.1162, test_loss: 2.2525, test_f1: 0.6239
 epoch: 68, train_loss: 0.1258, test_loss: 2.2636, test_f1: 0.6079
 epoch: 69, train_loss: 0.1053, test_loss: 2.2629, test_f1: 0.6293
 epoch: 70, train_loss: 0.1158, test_loss: 2.3923, test_f1: 0.6231
 epoch: 71, train_loss: 0.1119, test_loss: 2.3960, test_f1: 0.5806
 epoch: 72, train_loss: 0.1269, test_loss: 2.4479, test_f1: 0.5705
 epoch: 73, train_loss: 0.1139, test_loss: 2.1332, test_f1: 0.5786
 epoch: 74, train_loss: 0.1052, test_loss: 2.2467, test_f1: 0.5864
 epoch: 75, train_loss: 0.1008, test_loss: 2.6087, test_f1: 0.5833
 epoch: 76, train_loss: 0.0870, test_loss: 2.5630, test_f1: 0.5950
 epoch: 77, train_loss: 0.0968, test_loss: 2.3786, test_f1: 0.6008
 epoch: 78, train_loss: 0.0919, test_loss: 2.3951, test_f1: 0.6175
 epoch: 79, train_loss: 0.1184, test_loss: 2.3385, test_f1: 0.6017
 epoch: 80, train_loss: 0.1079, test_loss: 2.1692, test_f1: 0.6087
 epoch: 81, train_loss: 0.1939, test_loss: 2.5879, test_f1: 0.6102
 epoch: 82, train_loss: 0.1548, test_loss: 2.5662, test_f1: 0.5844
 epoch: 83, train_loss: 0.1425, test_loss: 2.5878, test_f1: 0.5658
 epoch: 84, train_loss: 0.1172, test_loss: 2.3421, test_f1: 0.6143
 epoch: 85, train_loss: 0.1403, test_loss: 2.3743, test_f1: 0.5939
 epoch: 86, train_loss: 0.1157, test_loss: 2.3998, test_f1: 0.5947
 epoch: 87, train_loss: 0.0937, test_loss: 2.4316, test_f1: 0.6346
 epoch: 88, train_loss: 0.1062, test_loss: 2.4872, test_f1: 0.6145
 epoch: 89, train_loss: 0.0923, test_loss: 2.5491, test_f1: 0.5907
 epoch: 90, train_loss: 0.0973, test_loss: 2.4799, test_f1: 0.6178
 epoch: 91, train_loss: 0.0824, test_loss: 2.4470, test_f1: 0.5711
 epoch: 92, train_loss: 0.0875, test_loss: 2.6042, test_f1: 0.5751
 epoch: 93, train_loss: 0.0926, test_loss: 2.5127, test_f1: 0.5929
 epoch: 94, train_loss: 0.0949, test_loss: 2.5416, test_f1: 0.5954
 epoch: 95, train_loss: 0.1057, test_loss: 2.5637, test_f1: 0.6141
 epoch: 96, train_loss: 0.1062, test_loss: 2.4901, test_f1: 0.6124
 epoch: 97, train_loss: 0.1145, test_loss: 2.6595, test_f1: 0.5953
 epoch: 98, train_loss: 0.0885, test_loss: 2.7932, test_f1: 0.5804
 epoch: 99, train_loss: 0.0860, test_loss: 2.6118, test_f1: 0.6343
##################ITERATION #7 ****************************************
 epoch: 0, train_loss: 1.3252, test_loss: 1.4564, test_f1: 0.2583
 epoch: 1, train_loss: 0.9796, test_loss: 1.4916, test_f1: 0.2007
 epoch: 2, train_loss: 0.8808, test_loss: 1.3614, test_f1: 0.3587
 epoch: 3, train_loss: 0.8294, test_loss: 1.3463, test_f1: 0.4215
 epoch: 4, train_loss: 0.7756, test_loss: 1.1741, test_f1: 0.5024
 epoch: 5, train_loss: 0.7412, test_loss: 1.0662, test_f1: 0.5233
 epoch: 6, train_loss: 0.7220, test_loss: 0.9805, test_f1: 0.5985
 epoch: 7, train_loss: 0.6847, test_loss: 1.0090, test_f1: 0.5814
 epoch: 8, train_loss: 0.6580, test_loss: 1.1333, test_f1: 0.5939
 epoch: 9, train_loss: 0.6468, test_loss: 1.0555, test_f1: 0.5713
 epoch: 10, train_loss: 0.6386, test_loss: 1.3441, test_f1: 0.5792
 epoch: 11, train_loss: 0.6044, test_loss: 0.9791, test_f1: 0.6624
 epoch: 12, train_loss: 0.5739, test_loss: 1.0978, test_f1: 0.5860
 epoch: 13, train_loss: 0.5701, test_loss: 1.1172, test_f1: 0.6071
 epoch: 14, train_loss: 0.5704, test_loss: 1.0840, test_f1: 0.6154
 epoch: 15, train_loss: 0.5423, test_loss: 1.0070, test_f1: 0.6259
 epoch: 16, train_loss: 0.5317, test_loss: 1.2416, test_f1: 0.5443
 epoch: 17, train_loss: 0.4777, test_loss: 1.0641, test_f1: 0.6104
 epoch: 18, train_loss: 0.4701, test_loss: 1.2996, test_f1: 0.5730
 epoch: 19, train_loss: 0.5123, test_loss: 1.1665, test_f1: 0.6378
 epoch: 20, train_loss: 0.4892, test_loss: 1.3183, test_f1: 0.5947
 epoch: 21, train_loss: 0.4702, test_loss: 1.1558, test_f1: 0.6390
 epoch: 22, train_loss: 0.4579, test_loss: 1.2265, test_f1: 0.5421
 epoch: 23, train_loss: 0.4723, test_loss: 1.2729, test_f1: 0.6486
 epoch: 24, train_loss: 0.4460, test_loss: 1.2625, test_f1: 0.6072
 epoch: 25, train_loss: 0.4163, test_loss: 1.2179, test_f1: 0.6014
 epoch: 26, train_loss: 0.4398, test_loss: 1.2442, test_f1: 0.6070
 epoch: 27, train_loss: 0.4073, test_loss: 1.2331, test_f1: 0.6022
 epoch: 28, train_loss: 0.4248, test_loss: 1.2853, test_f1: 0.6298
 epoch: 29, train_loss: 0.3819, test_loss: 1.3413, test_f1: 0.6335
 epoch: 30, train_loss: 0.3312, test_loss: 1.3421, test_f1: 0.6749
 epoch: 31, train_loss: 0.3466, test_loss: 1.5249, test_f1: 0.6474
 epoch: 32, train_loss: 0.3103, test_loss: 1.5640, test_f1: 0.6483
 epoch: 33, train_loss: 0.3236, test_loss: 1.6227, test_f1: 0.5920
 epoch: 34, train_loss: 0.3249, test_loss: 1.6006, test_f1: 0.6070
 epoch: 35, train_loss: 0.3202, test_loss: 1.6110, test_f1: 0.6221
 epoch: 36, train_loss: 0.2738, test_loss: 1.5213, test_f1: 0.6201
 epoch: 37, train_loss: 0.3172, test_loss: 1.7023, test_f1: 0.5914
 epoch: 38, train_loss: 0.3036, test_loss: 1.5288, test_f1: 0.6097
 epoch: 39, train_loss: 0.3158, test_loss: 1.4840, test_f1: 0.6406
 epoch: 40, train_loss: 0.3065, test_loss: 1.7296, test_f1: 0.6630
 epoch: 41, train_loss: 0.2800, test_loss: 2.2742, test_f1: 0.5691
 epoch: 42, train_loss: 0.3020, test_loss: 1.8244, test_f1: 0.5765
 epoch: 43, train_loss: 0.2608, test_loss: 1.7661, test_f1: 0.6080
 epoch: 44, train_loss: 0.2653, test_loss: 1.6975, test_f1: 0.6426
 epoch: 45, train_loss: 0.2554, test_loss: 1.9063, test_f1: 0.6122
 epoch: 46, train_loss: 0.2464, test_loss: 2.0931, test_f1: 0.5714
 epoch: 47, train_loss: 0.2441, test_loss: 1.9009, test_f1: 0.6157
 epoch: 48, train_loss: 0.2644, test_loss: 2.6433, test_f1: 0.5515
 epoch: 49, train_loss: 0.2609, test_loss: 1.8845, test_f1: 0.5808
 epoch: 50, train_loss: 0.2370, test_loss: 1.7650, test_f1: 0.6083
 epoch: 51, train_loss: 0.1795, test_loss: 1.7134, test_f1: 0.6442
 epoch: 52, train_loss: 0.1676, test_loss: 1.8475, test_f1: 0.6230
 epoch: 53, train_loss: 0.1466, test_loss: 1.9155, test_f1: 0.6043
 epoch: 54, train_loss: 0.1674, test_loss: 2.0313, test_f1: 0.5903
 epoch: 55, train_loss: 0.1791, test_loss: 2.0566, test_f1: 0.5957
 epoch: 56, train_loss: 0.1616, test_loss: 2.1354, test_f1: 0.6139
 epoch: 57, train_loss: 0.1311, test_loss: 2.1554, test_f1: 0.6431
 epoch: 58, train_loss: 0.1358, test_loss: 2.2941, test_f1: 0.5890
 epoch: 59, train_loss: 0.1296, test_loss: 2.3120, test_f1: 0.6089
 epoch: 60, train_loss: 0.1179, test_loss: 2.1375, test_f1: 0.6334
 epoch: 61, train_loss: 0.1184, test_loss: 2.4121, test_f1: 0.5929
 epoch: 62, train_loss: 0.1226, test_loss: 2.3229, test_f1: 0.5904
 epoch: 63, train_loss: 0.1298, test_loss: 2.3406, test_f1: 0.5973
 epoch: 64, train_loss: 0.1545, test_loss: 2.2404, test_f1: 0.6211
 epoch: 65, train_loss: 0.1249, test_loss: 2.4295, test_f1: 0.6052
 epoch: 66, train_loss: 0.1263, test_loss: 2.3268, test_f1: 0.6309
 epoch: 67, train_loss: 0.1011, test_loss: 2.3924, test_f1: 0.6104
 epoch: 68, train_loss: 0.0941, test_loss: 2.3785, test_f1: 0.6251
 epoch: 69, train_loss: 0.1154, test_loss: 2.3964, test_f1: 0.6401
 epoch: 70, train_loss: 0.0984, test_loss: 2.7031, test_f1: 0.5829
 epoch: 71, train_loss: 0.0909, test_loss: 2.5589, test_f1: 0.6127
 epoch: 72, train_loss: 0.0882, test_loss: 2.4329, test_f1: 0.6179
 epoch: 73, train_loss: 0.1126, test_loss: 2.4441, test_f1: 0.6109
 epoch: 74, train_loss: 0.1279, test_loss: 2.4883, test_f1: 0.6236
 epoch: 75, train_loss: 0.1376, test_loss: 2.3954, test_f1: 0.6104
 epoch: 76, train_loss: 0.1346, test_loss: 2.5743, test_f1: 0.5919
 epoch: 77, train_loss: 0.1161, test_loss: 2.3202, test_f1: 0.6241
 epoch: 78, train_loss: 0.1112, test_loss: 2.1268, test_f1: 0.6230
 epoch: 79, train_loss: 0.1284, test_loss: 2.8074, test_f1: 0.5693
 epoch: 80, train_loss: 0.1116, test_loss: 2.6045, test_f1: 0.5760
 epoch: 81, train_loss: 0.1167, test_loss: 2.5652, test_f1: 0.6085
 epoch: 82, train_loss: 0.0969, test_loss: 2.2872, test_f1: 0.6141
 epoch: 83, train_loss: 0.1129, test_loss: 2.2917, test_f1: 0.6432
 epoch: 84, train_loss: 0.1340, test_loss: 2.3517, test_f1: 0.6168
 epoch: 85, train_loss: 0.1065, test_loss: 2.2041, test_f1: 0.6490
 epoch: 86, train_loss: 0.0966, test_loss: 2.3652, test_f1: 0.6130
 epoch: 87, train_loss: 0.0943, test_loss: 2.3867, test_f1: 0.6296
 epoch: 88, train_loss: 0.0987, test_loss: 2.4680, test_f1: 0.6402
 epoch: 89, train_loss: 0.1042, test_loss: 2.4725, test_f1: 0.6222
 epoch: 90, train_loss: 0.0862, test_loss: 2.5657, test_f1: 0.6031
 epoch: 91, train_loss: 0.1025, test_loss: 2.5176, test_f1: 0.5971
 epoch: 92, train_loss: 0.0791, test_loss: 2.5649, test_f1: 0.6113
 epoch: 93, train_loss: 0.0767, test_loss: 2.4445, test_f1: 0.6011
 epoch: 94, train_loss: 0.0993, test_loss: 2.4318, test_f1: 0.5882
 epoch: 95, train_loss: 0.1192, test_loss: 2.3944, test_f1: 0.6170
 epoch: 96, train_loss: 0.0874, test_loss: 2.3096, test_f1: 0.6036
 epoch: 97, train_loss: 0.1000, test_loss: 2.5617, test_f1: 0.6310
 epoch: 98, train_loss: 0.0702, test_loss: 2.5224, test_f1: 0.6014
 epoch: 99, train_loss: 0.0823, test_loss: 2.5096, test_f1: 0.5977
##################ITERATION #8 ****************************************
 epoch: 0, train_loss: 1.2229, test_loss: 1.5526, test_f1: 0.2779
 epoch: 1, train_loss: 1.0222, test_loss: 1.5676, test_f1: 0.2281
 epoch: 2, train_loss: 0.9299, test_loss: 1.5466, test_f1: 0.2416
 epoch: 3, train_loss: 0.8605, test_loss: 1.2483, test_f1: 0.3485
 epoch: 4, train_loss: 0.8285, test_loss: 1.1490, test_f1: 0.4627
 epoch: 5, train_loss: 0.7994, test_loss: 1.1572, test_f1: 0.4733
 epoch: 6, train_loss: 0.7658, test_loss: 1.1026, test_f1: 0.5753
 epoch: 7, train_loss: 0.7160, test_loss: 1.0634, test_f1: 0.6031
 epoch: 8, train_loss: 0.6900, test_loss: 1.0478, test_f1: 0.5393
 epoch: 9, train_loss: 0.6792, test_loss: 1.0978, test_f1: 0.5673
 epoch: 10, train_loss: 0.6913, test_loss: 1.1276, test_f1: 0.6081
 epoch: 11, train_loss: 0.6238, test_loss: 1.0256, test_f1: 0.6497
 epoch: 12, train_loss: 0.5900, test_loss: 1.1264, test_f1: 0.5380
 epoch: 13, train_loss: 0.5898, test_loss: 1.1250, test_f1: 0.6220
 epoch: 14, train_loss: 0.5771, test_loss: 1.2793, test_f1: 0.6268
 epoch: 15, train_loss: 0.5700, test_loss: 1.4338, test_f1: 0.5590
 epoch: 16, train_loss: 0.5379, test_loss: 1.1363, test_f1: 0.6059
 epoch: 17, train_loss: 0.5349, test_loss: 1.3190, test_f1: 0.5951
 epoch: 18, train_loss: 0.5065, test_loss: 1.1581, test_f1: 0.6402
 epoch: 19, train_loss: 0.4723, test_loss: 1.3280, test_f1: 0.5265
 epoch: 20, train_loss: 0.4899, test_loss: 1.0817, test_f1: 0.5991
 epoch: 21, train_loss: 0.5204, test_loss: 1.2678, test_f1: 0.5912
 epoch: 22, train_loss: 0.4682, test_loss: 1.3630, test_f1: 0.6373
 epoch: 23, train_loss: 0.4539, test_loss: 1.1715, test_f1: 0.6267
 epoch: 24, train_loss: 0.4258, test_loss: 1.5914, test_f1: 0.5614
 epoch: 25, train_loss: 0.4378, test_loss: 1.2144, test_f1: 0.6197
 epoch: 26, train_loss: 0.4109, test_loss: 1.3849, test_f1: 0.5925
 epoch: 27, train_loss: 0.4142, test_loss: 1.2101, test_f1: 0.6286
 epoch: 28, train_loss: 0.4303, test_loss: 1.2511, test_f1: 0.6753
 epoch: 29, train_loss: 0.3653, test_loss: 1.2461, test_f1: 0.6778
 epoch: 30, train_loss: 0.3497, test_loss: 1.3227, test_f1: 0.6541
 epoch: 31, train_loss: 0.3184, test_loss: 1.3439, test_f1: 0.6634
 epoch: 32, train_loss: 0.3099, test_loss: 1.4793, test_f1: 0.6528
 epoch: 33, train_loss: 0.2924, test_loss: 1.5598, test_f1: 0.6485
 epoch: 34, train_loss: 0.3628, test_loss: 1.5358, test_f1: 0.6572
 epoch: 35, train_loss: 0.3465, test_loss: 1.4530, test_f1: 0.6134
 epoch: 36, train_loss: 0.3492, test_loss: 1.3264, test_f1: 0.6957
 epoch: 37, train_loss: 0.3193, test_loss: 1.6534, test_f1: 0.6295
 epoch: 38, train_loss: 0.3070, test_loss: 1.2293, test_f1: 0.6479
 epoch: 39, train_loss: 0.3057, test_loss: 1.6697, test_f1: 0.6013
 epoch: 40, train_loss: 0.3193, test_loss: 1.4722, test_f1: 0.6034
 epoch: 41, train_loss: 0.2748, test_loss: 1.3503, test_f1: 0.6244
 epoch: 42, train_loss: 0.2730, test_loss: 1.9944, test_f1: 0.5743
 epoch: 43, train_loss: 0.2709, test_loss: 1.5157, test_f1: 0.6330
 epoch: 44, train_loss: 0.3095, test_loss: 1.6995, test_f1: 0.6679
 epoch: 45, train_loss: 0.3228, test_loss: 1.8613, test_f1: 0.6344
 epoch: 46, train_loss: 0.2905, test_loss: 1.5773, test_f1: 0.6231
 epoch: 47, train_loss: 0.2911, test_loss: 1.7159, test_f1: 0.6131
 epoch: 48, train_loss: 0.2593, test_loss: 1.9072, test_f1: 0.5882
 epoch: 49, train_loss: 0.2270, test_loss: 1.8212, test_f1: 0.6083
 epoch: 50, train_loss: 0.2555, test_loss: 1.6000, test_f1: 0.6559
 epoch: 51, train_loss: 0.2104, test_loss: 1.7903, test_f1: 0.6458
 epoch: 52, train_loss: 0.1747, test_loss: 1.8213, test_f1: 0.6357
 epoch: 53, train_loss: 0.1617, test_loss: 1.9103, test_f1: 0.6488
 epoch: 54, train_loss: 0.1336, test_loss: 1.8791, test_f1: 0.6330
 epoch: 55, train_loss: 0.1492, test_loss: 1.8666, test_f1: 0.6290
 epoch: 56, train_loss: 0.1516, test_loss: 1.6921, test_f1: 0.6296
 epoch: 57, train_loss: 0.1359, test_loss: 1.8711, test_f1: 0.6314
 epoch: 58, train_loss: 0.1470, test_loss: 1.8257, test_f1: 0.6436
 epoch: 59, train_loss: 0.1372, test_loss: 2.1255, test_f1: 0.6160
 epoch: 60, train_loss: 0.1313, test_loss: 2.1313, test_f1: 0.6240
 epoch: 61, train_loss: 0.1228, test_loss: 2.1676, test_f1: 0.6334
 epoch: 62, train_loss: 0.1070, test_loss: 2.1412, test_f1: 0.6277
 epoch: 63, train_loss: 0.1254, test_loss: 2.0761, test_f1: 0.6375
 epoch: 64, train_loss: 0.1177, test_loss: 2.1706, test_f1: 0.6059
 epoch: 65, train_loss: 0.1134, test_loss: 2.2159, test_f1: 0.6274
 epoch: 66, train_loss: 0.1308, test_loss: 2.2896, test_f1: 0.6322
 epoch: 67, train_loss: 0.1202, test_loss: 2.0290, test_f1: 0.6355
 epoch: 68, train_loss: 0.1078, test_loss: 2.3278, test_f1: 0.6183
 epoch: 69, train_loss: 0.1200, test_loss: 2.2329, test_f1: 0.6637
 epoch: 70, train_loss: 0.1162, test_loss: 2.3574, test_f1: 0.6173
 epoch: 71, train_loss: 0.1246, test_loss: 2.3316, test_f1: 0.6268
 epoch: 72, train_loss: 0.1024, test_loss: 2.2684, test_f1: 0.6342
 epoch: 73, train_loss: 0.0845, test_loss: 2.3957, test_f1: 0.6404
 epoch: 74, train_loss: 0.0915, test_loss: 2.3943, test_f1: 0.6163
 epoch: 75, train_loss: 0.0971, test_loss: 2.5770, test_f1: 0.6534
 epoch: 76, train_loss: 0.1029, test_loss: 2.7547, test_f1: 0.6223
 epoch: 77, train_loss: 0.0830, test_loss: 2.4624, test_f1: 0.6372
 epoch: 78, train_loss: 0.1187, test_loss: 2.6265, test_f1: 0.5985
 epoch: 79, train_loss: 0.1178, test_loss: 2.5880, test_f1: 0.6175
 epoch: 80, train_loss: 0.1189, test_loss: 2.4891, test_f1: 0.6211
 epoch: 81, train_loss: 0.1058, test_loss: 2.5900, test_f1: 0.6288
 epoch: 82, train_loss: 0.1352, test_loss: 2.4861, test_f1: 0.6381
 epoch: 83, train_loss: 0.0948, test_loss: 2.2577, test_f1: 0.6416
 epoch: 84, train_loss: 0.0774, test_loss: 2.4902, test_f1: 0.6513
 epoch: 85, train_loss: 0.0823, test_loss: 2.4665, test_f1: 0.6418
 epoch: 86, train_loss: 0.0760, test_loss: 2.4760, test_f1: 0.6479
 epoch: 87, train_loss: 0.0937, test_loss: 2.6717, test_f1: 0.6244
 epoch: 88, train_loss: 0.1243, test_loss: 2.5555, test_f1: 0.6336
 epoch: 89, train_loss: 0.1033, test_loss: 2.5138, test_f1: 0.6242
 epoch: 90, train_loss: 0.1081, test_loss: 2.4581, test_f1: 0.6654
 epoch: 91, train_loss: 0.1114, test_loss: 2.6896, test_f1: 0.6269
 epoch: 92, train_loss: 0.1171, test_loss: 2.7703, test_f1: 0.6338
 epoch: 93, train_loss: 0.0847, test_loss: 2.5095, test_f1: 0.6274
 epoch: 94, train_loss: 0.0778, test_loss: 2.5491, test_f1: 0.6339
 epoch: 95, train_loss: 0.0719, test_loss: 2.6867, test_f1: 0.6442
 epoch: 96, train_loss: 0.0622, test_loss: 2.7240, test_f1: 0.6248
 epoch: 97, train_loss: 0.0625, test_loss: 2.7605, test_f1: 0.6205
 epoch: 98, train_loss: 0.0766, test_loss: 2.8640, test_f1: 0.6007
 epoch: 99, train_loss: 0.0890, test_loss: 2.6880, test_f1: 0.6165
##################ITERATION #9 ****************************************
 epoch: 0, train_loss: 1.2839, test_loss: 1.4340, test_f1: 0.2281
 epoch: 1, train_loss: 1.0502, test_loss: 1.3423, test_f1: 0.2404
 epoch: 2, train_loss: 0.9418, test_loss: 1.1551, test_f1: 0.3851
 epoch: 3, train_loss: 0.8648, test_loss: 1.0461, test_f1: 0.5662
 epoch: 4, train_loss: 0.7983, test_loss: 0.9814, test_f1: 0.6210
 epoch: 5, train_loss: 0.7670, test_loss: 1.0244, test_f1: 0.6017
 epoch: 6, train_loss: 0.7311, test_loss: 1.0056, test_f1: 0.5689
 epoch: 7, train_loss: 0.7195, test_loss: 1.0158, test_f1: 0.5826
 epoch: 8, train_loss: 0.7071, test_loss: 1.0777, test_f1: 0.5952
 epoch: 9, train_loss: 0.6387, test_loss: 1.0664, test_f1: 0.5785
 epoch: 10, train_loss: 0.6483, test_loss: 0.9681, test_f1: 0.5727
 epoch: 11, train_loss: 0.6118, test_loss: 1.1116, test_f1: 0.5753
 epoch: 12, train_loss: 0.5675, test_loss: 1.3961, test_f1: 0.5660
 epoch: 13, train_loss: 0.5914, test_loss: 1.3439, test_f1: 0.6102
 epoch: 14, train_loss: 0.5685, test_loss: 0.9958, test_f1: 0.6361
 epoch: 15, train_loss: 0.5559, test_loss: 1.1975, test_f1: 0.6098
 epoch: 16, train_loss: 0.5176, test_loss: 1.1914, test_f1: 0.6005
 epoch: 17, train_loss: 0.5450, test_loss: 1.0773, test_f1: 0.6291
 epoch: 18, train_loss: 0.5265, test_loss: 1.0998, test_f1: 0.6227
 epoch: 19, train_loss: 0.4708, test_loss: 1.1212, test_f1: 0.6197
 epoch: 20, train_loss: 0.4783, test_loss: 1.0953, test_f1: 0.5852
 epoch: 21, train_loss: 0.4992, test_loss: 1.3605, test_f1: 0.6017
 epoch: 22, train_loss: 0.4923, test_loss: 1.2324, test_f1: 0.6127
 epoch: 23, train_loss: 0.4883, test_loss: 1.2652, test_f1: 0.5964
 epoch: 24, train_loss: 0.4572, test_loss: 1.2864, test_f1: 0.6559
 epoch: 25, train_loss: 0.4505, test_loss: 1.3303, test_f1: 0.5992
 epoch: 26, train_loss: 0.4096, test_loss: 1.3218, test_f1: 0.5822
 epoch: 27, train_loss: 0.3433, test_loss: 1.3995, test_f1: 0.5931
 epoch: 28, train_loss: 0.3813, test_loss: 1.3559, test_f1: 0.6215
 epoch: 29, train_loss: 0.4161, test_loss: 1.6640, test_f1: 0.5828
 epoch: 30, train_loss: 0.3639, test_loss: 1.2640, test_f1: 0.6341
 epoch: 31, train_loss: 0.3749, test_loss: 1.7563, test_f1: 0.5950
 epoch: 32, train_loss: 0.3709, test_loss: 1.6347, test_f1: 0.6140
 epoch: 33, train_loss: 0.3335, test_loss: 1.6151, test_f1: 0.6227
 epoch: 34, train_loss: 0.3340, test_loss: 1.7714, test_f1: 0.6123
 epoch: 35, train_loss: 0.3240, test_loss: 1.6927, test_f1: 0.6074
 epoch: 36, train_loss: 0.3180, test_loss: 1.6629, test_f1: 0.6336
 epoch: 37, train_loss: 0.3772, test_loss: 1.8458, test_f1: 0.5146
 epoch: 38, train_loss: 0.3292, test_loss: 1.4676, test_f1: 0.5933
 epoch: 39, train_loss: 0.3243, test_loss: 1.5523, test_f1: 0.6182
 epoch: 40, train_loss: 0.2968, test_loss: 1.5179, test_f1: 0.6073
 epoch: 41, train_loss: 0.2826, test_loss: 1.6770, test_f1: 0.6475
 epoch: 42, train_loss: 0.2795, test_loss: 2.0231, test_f1: 0.5582
 epoch: 43, train_loss: 0.2639, test_loss: 1.8439, test_f1: 0.6240
 epoch: 44, train_loss: 0.2603, test_loss: 1.5941, test_f1: 0.6203
 epoch: 45, train_loss: 0.2691, test_loss: 1.6682, test_f1: 0.6285
 epoch: 46, train_loss: 0.2455, test_loss: 1.7749, test_f1: 0.5843
 epoch: 47, train_loss: 0.2231, test_loss: 1.8938, test_f1: 0.5844
 epoch: 48, train_loss: 0.2302, test_loss: 1.7542, test_f1: 0.5819
 epoch: 49, train_loss: 0.2473, test_loss: 1.9783, test_f1: 0.6088
 epoch: 50, train_loss: 0.2486, test_loss: 1.9634, test_f1: 0.6146
 epoch: 51, train_loss: 0.2155, test_loss: 1.7551, test_f1: 0.6006
 epoch: 52, train_loss: 0.1608, test_loss: 1.7155, test_f1: 0.6091
 epoch: 53, train_loss: 0.1720, test_loss: 1.9326, test_f1: 0.5972
 epoch: 54, train_loss: 0.1792, test_loss: 2.1250, test_f1: 0.5989
 epoch: 55, train_loss: 0.1526, test_loss: 1.8811, test_f1: 0.6272
 epoch: 56, train_loss: 0.1383, test_loss: 1.9456, test_f1: 0.6062
 epoch: 57, train_loss: 0.1222, test_loss: 2.1226, test_f1: 0.6025
 epoch: 58, train_loss: 0.1517, test_loss: 2.0983, test_f1: 0.6074
 epoch: 59, train_loss: 0.1262, test_loss: 2.1923, test_f1: 0.6209
 epoch: 60, train_loss: 0.1298, test_loss: 2.0634, test_f1: 0.6094
 epoch: 61, train_loss: 0.1482, test_loss: 2.1744, test_f1: 0.6032
 epoch: 62, train_loss: 0.1825, test_loss: 2.4634, test_f1: 0.5938
 epoch: 63, train_loss: 0.1447, test_loss: 2.1279, test_f1: 0.6237
 epoch: 64, train_loss: 0.1372, test_loss: 1.8929, test_f1: 0.6281
 epoch: 65, train_loss: 0.1135, test_loss: 2.0126, test_f1: 0.6230
 epoch: 66, train_loss: 0.1118, test_loss: 2.2108, test_f1: 0.6234
 epoch: 67, train_loss: 0.1065, test_loss: 2.2935, test_f1: 0.5952
 epoch: 68, train_loss: 0.0957, test_loss: 2.3577, test_f1: 0.6173
 epoch: 69, train_loss: 0.0805, test_loss: 2.4493, test_f1: 0.6351
 epoch: 70, train_loss: 0.1070, test_loss: 2.4154, test_f1: 0.6259
 epoch: 71, train_loss: 0.0936, test_loss: 2.5279, test_f1: 0.6178
 epoch: 72, train_loss: 0.0898, test_loss: 2.4210, test_f1: 0.6335
 epoch: 73, train_loss: 0.1363, test_loss: 2.4027, test_f1: 0.6161
 epoch: 74, train_loss: 0.1197, test_loss: 2.3192, test_f1: 0.6145
 epoch: 75, train_loss: 0.1211, test_loss: 2.5659, test_f1: 0.6003
 epoch: 76, train_loss: 0.1056, test_loss: 2.7581, test_f1: 0.5800
 epoch: 77, train_loss: 0.1008, test_loss: 2.5511, test_f1: 0.5942
 epoch: 78, train_loss: 0.0930, test_loss: 2.6996, test_f1: 0.5864
 epoch: 79, train_loss: 0.0881, test_loss: 2.7130, test_f1: 0.5930
 epoch: 80, train_loss: 0.1041, test_loss: 2.6316, test_f1: 0.6309
 epoch: 81, train_loss: 0.0831, test_loss: 2.6580, test_f1: 0.5892
 epoch: 82, train_loss: 0.1062, test_loss: 2.4646, test_f1: 0.6153
 epoch: 83, train_loss: 0.1110, test_loss: 2.5478, test_f1: 0.5986
 epoch: 84, train_loss: 0.0893, test_loss: 2.6813, test_f1: 0.6357
 epoch: 85, train_loss: 0.0797, test_loss: 2.5518, test_f1: 0.6366
 epoch: 86, train_loss: 0.1029, test_loss: 2.5897, test_f1: 0.6133
 epoch: 87, train_loss: 0.1168, test_loss: 2.5648, test_f1: 0.6291
 epoch: 88, train_loss: 0.1399, test_loss: 2.3579, test_f1: 0.6095
 epoch: 89, train_loss: 0.1266, test_loss: 2.6747, test_f1: 0.6152
 epoch: 90, train_loss: 0.0988, test_loss: 2.6208, test_f1: 0.6364
 epoch: 91, train_loss: 0.0890, test_loss: 2.6683, test_f1: 0.6061
 epoch: 92, train_loss: 0.0801, test_loss: 2.7142, test_f1: 0.6098
 epoch: 93, train_loss: 0.0767, test_loss: 2.7329, test_f1: 0.5975
 epoch: 94, train_loss: 0.0878, test_loss: 2.7884, test_f1: 0.6025
 epoch: 95, train_loss: 0.0854, test_loss: 2.6337, test_f1: 0.6052
 epoch: 96, train_loss: 0.1064, test_loss: 2.8854, test_f1: 0.6009
 epoch: 97, train_loss: 0.0809, test_loss: 2.8691, test_f1: 0.6117
 epoch: 98, train_loss: 0.0971, test_loss: 2.7700, test_f1: 0.6315
 epoch: 99, train_loss: 0.0799, test_loss: 2.9199, test_f1: 0.5981

Training completed in 460.53 seconds
Best F1: 0.6957 at epoch 36
Mean F1 across iterations: 0.6698  0.0128
========================FINAL RESULTS================================
FEGIN weighted F1: 0.6957  0.0128
python main.py --data ltspice_demos --representation component_pin --model FEGIN --layers 3 --hiddens 128 --batch_size 128 --lr 0.001 --emb_size 250 --epochs 100 --save_appendix component_pin_L3_H128_BS128_LR0.001_E250 --no_val
-----



STDERR:
  File "main.py", line 370, in <module>
    main()
  File "main.py", line 254, in main
    dataset = dataset_class(
  File "/home/philip/projects/ltspice_examples_code_repo/Circuit-Completion-Using-GNNs/component_classification_with_link_prediction_head/evaluation/FEGIN/kernel/circuit_datasets.py", line 15, in __init__
    self.data, self.slices = torch.load(self.processed_paths[0])
  File "/home/philip/.local/lib/python3.8/site-packages/torch/serialization.py", line 1040, in load
    warnings.warn(
  File "/usr/lib/python3.8/warnings.py", line 109, in _showwarnmsg
    sw(msg.message, msg.category, msg.filename, msg.lineno,
  File "main.py", line 47, in warn_with_traceback
    traceback.print_stack(file=log)
/home/philip/projects/ltspice_examples_code_repo/Circuit-Completion-Using-GNNs/component_classification_with_link_prediction_head/evaluation/FEGIN/kernel/circuit_datasets.py:15: FutureWarning: You are using `torch.load` with `weights_only=False` (the current default value), which uses the default pickle module implicitly. It is possible to construct malicious pickle data which will execute arbitrary code during unpickling (See https://github.com/pytorch/pytorch/blob/main/SECURITY.md#untrusted-models for more details). In a future release, the default value for `weights_only` will be flipped to `True`. This limits the functions that could be executed during unpickling. Arbitrary objects will no longer be allowed to be loaded via this mode unless they are explicitly allowlisted by the user via `torch.serialization.add_safe_globals`. We recommend you start setting `weights_only=True` for any use case where you don't have full control of the loaded file. Please open an issue on GitHub for any issues related to this experimental feature.
  self.data, self.slices = torch.load(self.processed_paths[0])
