STDOUT:
Results will be saved in /home/philip/projects/ltspice_examples_code_repo/Circuit-Completion-Using-GNNs/component_classification_with_link_prediction_head/evaluation/FEGIN/results/model_FEGIN_dataset_ltspice_demos
Command line input: python main.py --data ltspice_demos --representation component_component --model FEGIN --layers 4 --hiddens 16 --batch_size 128 --lr 0.001 --emb_size 128 --epochs 100 --save_appendix component_component_L4_H16_BS128_LR0.001_E128 --no_val
 is saved.
-----
ltspice_demos - FEGIN
Using 4 layers, 16 hidden units, h = 2
Loading component_component representation dataset
ENTERED
Training FEGIN on component_component representation
Train: 1565, Test: 383
##################ITERATION #0 ****************************************
 epoch: 0, train_loss: 1.3654, test_loss: 1.3583, test_f1: 0.2281
 epoch: 1, train_loss: 1.3497, test_loss: 1.3519, test_f1: 0.2281
 epoch: 2, train_loss: 1.3403, test_loss: 1.3455, test_f1: 0.2281
 epoch: 3, train_loss: 1.3303, test_loss: 1.3367, test_f1: 0.2281
 epoch: 4, train_loss: 1.3160, test_loss: 1.3265, test_f1: 0.2281
 epoch: 5, train_loss: 1.2971, test_loss: 1.3135, test_f1: 0.2281
 epoch: 6, train_loss: 1.2790, test_loss: 1.2983, test_f1: 0.2281
 epoch: 7, train_loss: 1.2561, test_loss: 1.2810, test_f1: 0.2281
 epoch: 8, train_loss: 1.2282, test_loss: 1.2673, test_f1: 0.2281
 epoch: 9, train_loss: 1.2141, test_loss: 1.2558, test_f1: 0.2281
 epoch: 10, train_loss: 1.2033, test_loss: 1.2478, test_f1: 0.2636
 epoch: 11, train_loss: 1.1881, test_loss: 1.2415, test_f1: 0.3156
 epoch: 12, train_loss: 1.1806, test_loss: 1.2427, test_f1: 0.3179
 epoch: 13, train_loss: 1.1675, test_loss: 1.2367, test_f1: 0.3364
 epoch: 14, train_loss: 1.1539, test_loss: 1.2360, test_f1: 0.3711
 epoch: 15, train_loss: 1.1522, test_loss: 1.2396, test_f1: 0.3490
 epoch: 16, train_loss: 1.1337, test_loss: 1.2390, test_f1: 0.3326
 epoch: 17, train_loss: 1.1349, test_loss: 1.2558, test_f1: 0.3155
 epoch: 18, train_loss: 1.1310, test_loss: 1.2695, test_f1: 0.3420
 epoch: 19, train_loss: 1.1134, test_loss: 1.2639, test_f1: 0.3358
 epoch: 20, train_loss: 1.1164, test_loss: 1.3153, test_f1: 0.3323
 epoch: 21, train_loss: 1.1004, test_loss: 1.2591, test_f1: 0.3226
 epoch: 22, train_loss: 1.0936, test_loss: 1.2810, test_f1: 0.3259
 epoch: 23, train_loss: 1.0946, test_loss: 1.2667, test_f1: 0.3283
 epoch: 24, train_loss: 1.0740, test_loss: 1.2306, test_f1: 0.3341
 epoch: 25, train_loss: 1.0754, test_loss: 1.2464, test_f1: 0.3555
 epoch: 26, train_loss: 1.0729, test_loss: 1.3591, test_f1: 0.3850
 epoch: 27, train_loss: 1.0719, test_loss: 1.3721, test_f1: 0.3731
 epoch: 28, train_loss: 1.0587, test_loss: 1.3800, test_f1: 0.3804
 epoch: 29, train_loss: 1.0722, test_loss: 1.3247, test_f1: 0.3612
 epoch: 30, train_loss: 1.0463, test_loss: 1.2395, test_f1: 0.3674
 epoch: 31, train_loss: 1.0471, test_loss: 1.3103, test_f1: 0.3605
 epoch: 32, train_loss: 1.0434, test_loss: 1.3156, test_f1: 0.3697
 epoch: 33, train_loss: 1.0301, test_loss: 1.2479, test_f1: 0.3787
 epoch: 34, train_loss: 1.0352, test_loss: 1.2979, test_f1: 0.3681
 epoch: 35, train_loss: 1.0292, test_loss: 1.2658, test_f1: 0.3927
 epoch: 36, train_loss: 1.0159, test_loss: 1.3756, test_f1: 0.3881
 epoch: 37, train_loss: 1.0368, test_loss: 1.4839, test_f1: 0.4058
 epoch: 38, train_loss: 1.0227, test_loss: 1.3442, test_f1: 0.4410
 epoch: 39, train_loss: 1.0187, test_loss: 1.3193, test_f1: 0.4214
 epoch: 40, train_loss: 1.0012, test_loss: 1.4347, test_f1: 0.4166
 epoch: 41, train_loss: 1.0057, test_loss: 1.3827, test_f1: 0.4303
 epoch: 42, train_loss: 0.9984, test_loss: 1.4864, test_f1: 0.4307
 epoch: 43, train_loss: 1.0007, test_loss: 1.3819, test_f1: 0.4545
 epoch: 44, train_loss: 1.0024, test_loss: 1.3040, test_f1: 0.4745
 epoch: 45, train_loss: 0.9899, test_loss: 1.3406, test_f1: 0.4596
 epoch: 46, train_loss: 0.9778, test_loss: 1.4127, test_f1: 0.4708
 epoch: 47, train_loss: 0.9691, test_loss: 1.3639, test_f1: 0.4622
 epoch: 48, train_loss: 0.9662, test_loss: 1.2676, test_f1: 0.4741
 epoch: 49, train_loss: 0.9625, test_loss: 1.3669, test_f1: 0.4805
 epoch: 50, train_loss: 0.9777, test_loss: 1.4354, test_f1: 0.4721
 epoch: 51, train_loss: 0.9473, test_loss: 1.3848, test_f1: 0.4684
 epoch: 52, train_loss: 0.9447, test_loss: 1.4789, test_f1: 0.4714
 epoch: 53, train_loss: 0.9438, test_loss: 1.5022, test_f1: 0.5119
 epoch: 54, train_loss: 0.9554, test_loss: 1.3772, test_f1: 0.4937
 epoch: 55, train_loss: 0.9439, test_loss: 1.4586, test_f1: 0.5051
 epoch: 56, train_loss: 0.9393, test_loss: 1.4202, test_f1: 0.5119
 epoch: 57, train_loss: 0.9343, test_loss: 1.4848, test_f1: 0.5087
 epoch: 58, train_loss: 0.9310, test_loss: 1.4532, test_f1: 0.5142
 epoch: 59, train_loss: 0.9416, test_loss: 1.4441, test_f1: 0.5053
 epoch: 60, train_loss: 0.9341, test_loss: 1.4246, test_f1: 0.5020
 epoch: 61, train_loss: 0.9400, test_loss: 1.4280, test_f1: 0.5030
 epoch: 62, train_loss: 0.9256, test_loss: 1.3904, test_f1: 0.4987
 epoch: 63, train_loss: 0.9433, test_loss: 1.4292, test_f1: 0.4702
 epoch: 64, train_loss: 0.9265, test_loss: 1.4564, test_f1: 0.4915
 epoch: 65, train_loss: 0.9108, test_loss: 1.4735, test_f1: 0.4961
 epoch: 66, train_loss: 0.9269, test_loss: 1.4344, test_f1: 0.4948
 epoch: 67, train_loss: 0.9134, test_loss: 1.4344, test_f1: 0.4974
 epoch: 68, train_loss: 0.9141, test_loss: 1.4399, test_f1: 0.4915
 epoch: 69, train_loss: 0.9099, test_loss: 1.4143, test_f1: 0.5052
 epoch: 70, train_loss: 0.9148, test_loss: 1.4525, test_f1: 0.5125
 epoch: 71, train_loss: 0.9090, test_loss: 1.5467, test_f1: 0.4956
 epoch: 72, train_loss: 0.9038, test_loss: 1.4764, test_f1: 0.5089
 epoch: 73, train_loss: 0.9073, test_loss: 1.4705, test_f1: 0.5169
 epoch: 74, train_loss: 0.8973, test_loss: 1.4406, test_f1: 0.5193
 epoch: 75, train_loss: 0.8926, test_loss: 1.4945, test_f1: 0.5173
 epoch: 76, train_loss: 0.9095, test_loss: 1.5197, test_f1: 0.5095
 epoch: 77, train_loss: 0.9041, test_loss: 1.3827, test_f1: 0.5324
 epoch: 78, train_loss: 0.9004, test_loss: 1.3619, test_f1: 0.5174
 epoch: 79, train_loss: 0.9094, test_loss: 1.4592, test_f1: 0.5035
 epoch: 80, train_loss: 0.8914, test_loss: 1.4620, test_f1: 0.5163
 epoch: 81, train_loss: 0.8971, test_loss: 1.4803, test_f1: 0.5099
 epoch: 82, train_loss: 0.8861, test_loss: 1.5044, test_f1: 0.5118
 epoch: 83, train_loss: 0.8933, test_loss: 1.4785, test_f1: 0.5118
 epoch: 84, train_loss: 0.8893, test_loss: 1.5006, test_f1: 0.4990
 epoch: 85, train_loss: 0.8989, test_loss: 1.4635, test_f1: 0.4932
 epoch: 86, train_loss: 0.8851, test_loss: 1.5131, test_f1: 0.5038
 epoch: 87, train_loss: 0.8883, test_loss: 1.5213, test_f1: 0.4778
 epoch: 88, train_loss: 0.8791, test_loss: 1.5948, test_f1: 0.5143
 epoch: 89, train_loss: 0.8837, test_loss: 1.4906, test_f1: 0.5279
 epoch: 90, train_loss: 0.8734, test_loss: 1.4767, test_f1: 0.5019
 epoch: 91, train_loss: 0.8769, test_loss: 1.4837, test_f1: 0.5026
 epoch: 92, train_loss: 0.8856, test_loss: 1.5043, test_f1: 0.5264
 epoch: 93, train_loss: 0.8699, test_loss: 1.5737, test_f1: 0.5336
 epoch: 94, train_loss: 0.8781, test_loss: 1.5521, test_f1: 0.5293
 epoch: 95, train_loss: 0.8864, test_loss: 1.4675, test_f1: 0.5305
 epoch: 96, train_loss: 0.8667, test_loss: 1.4972, test_f1: 0.5118
 epoch: 97, train_loss: 0.8693, test_loss: 1.5283, test_f1: 0.5237
 epoch: 98, train_loss: 0.8711, test_loss: 1.5085, test_f1: 0.5326
 epoch: 99, train_loss: 0.8817, test_loss: 1.5288, test_f1: 0.5230
##################ITERATION #1 ****************************************
 epoch: 0, train_loss: 1.3195, test_loss: 1.3227, test_f1: 0.2281
 epoch: 1, train_loss: 1.2718, test_loss: 1.3129, test_f1: 0.2281
 epoch: 2, train_loss: 1.2515, test_loss: 1.3087, test_f1: 0.2281
 epoch: 3, train_loss: 1.2339, test_loss: 1.2989, test_f1: 0.2281
 epoch: 4, train_loss: 1.2232, test_loss: 1.2886, test_f1: 0.2375
 epoch: 5, train_loss: 1.2201, test_loss: 1.2891, test_f1: 0.3397
 epoch: 6, train_loss: 1.2112, test_loss: 1.2842, test_f1: 0.3388
 epoch: 7, train_loss: 1.2014, test_loss: 1.2779, test_f1: 0.3382
 epoch: 8, train_loss: 1.1991, test_loss: 1.2790, test_f1: 0.3527
 epoch: 9, train_loss: 1.1900, test_loss: 1.2800, test_f1: 0.3583
 epoch: 10, train_loss: 1.1840, test_loss: 1.2672, test_f1: 0.3559
 epoch: 11, train_loss: 1.1783, test_loss: 1.2708, test_f1: 0.3415
 epoch: 12, train_loss: 1.1636, test_loss: 1.2796, test_f1: 0.3603
 epoch: 13, train_loss: 1.1602, test_loss: 1.2862, test_f1: 0.3571
 epoch: 14, train_loss: 1.1472, test_loss: 1.2921, test_f1: 0.3507
 epoch: 15, train_loss: 1.1366, test_loss: 1.2981, test_f1: 0.3825
 epoch: 16, train_loss: 1.1324, test_loss: 1.2835, test_f1: 0.4109
 epoch: 17, train_loss: 1.1131, test_loss: 1.2887, test_f1: 0.4276
 epoch: 18, train_loss: 1.1104, test_loss: 1.2561, test_f1: 0.4383
 epoch: 19, train_loss: 1.0943, test_loss: 1.2660, test_f1: 0.4411
 epoch: 20, train_loss: 1.0861, test_loss: 1.2910, test_f1: 0.4356
 epoch: 21, train_loss: 1.0843, test_loss: 1.2750, test_f1: 0.4547
 epoch: 22, train_loss: 1.0716, test_loss: 1.2848, test_f1: 0.4428
 epoch: 23, train_loss: 1.0661, test_loss: 1.2770, test_f1: 0.4519
 epoch: 24, train_loss: 1.0631, test_loss: 1.2675, test_f1: 0.4386
 epoch: 25, train_loss: 1.0552, test_loss: 1.2528, test_f1: 0.4268
 epoch: 26, train_loss: 1.0462, test_loss: 1.2602, test_f1: 0.4462
 epoch: 27, train_loss: 1.0295, test_loss: 1.3732, test_f1: 0.4437
 epoch: 28, train_loss: 1.0309, test_loss: 1.2795, test_f1: 0.4896
 epoch: 29, train_loss: 1.0101, test_loss: 1.2820, test_f1: 0.5000
 epoch: 30, train_loss: 1.0138, test_loss: 1.3237, test_f1: 0.4904
 epoch: 31, train_loss: 1.0100, test_loss: 1.3214, test_f1: 0.5029
 epoch: 32, train_loss: 1.0035, test_loss: 1.3381, test_f1: 0.4922
 epoch: 33, train_loss: 0.9923, test_loss: 1.2307, test_f1: 0.5315
 epoch: 34, train_loss: 0.9867, test_loss: 1.2524, test_f1: 0.5411
 epoch: 35, train_loss: 0.9834, test_loss: 1.3366, test_f1: 0.5352
 epoch: 36, train_loss: 0.9765, test_loss: 1.3016, test_f1: 0.5230
 epoch: 37, train_loss: 0.9656, test_loss: 1.3338, test_f1: 0.5171
 epoch: 38, train_loss: 0.9757, test_loss: 1.3645, test_f1: 0.5154
 epoch: 39, train_loss: 0.9725, test_loss: 1.3119, test_f1: 0.5384
 epoch: 40, train_loss: 0.9760, test_loss: 1.2610, test_f1: 0.5523
 epoch: 41, train_loss: 0.9601, test_loss: 1.3189, test_f1: 0.5226
 epoch: 42, train_loss: 0.9462, test_loss: 1.3278, test_f1: 0.5104
 epoch: 43, train_loss: 0.9460, test_loss: 1.3339, test_f1: 0.5269
 epoch: 44, train_loss: 0.9261, test_loss: 1.3663, test_f1: 0.4965
 epoch: 45, train_loss: 0.9143, test_loss: 1.2750, test_f1: 0.5390
 epoch: 46, train_loss: 0.9246, test_loss: 1.2823, test_f1: 0.5029
 epoch: 47, train_loss: 0.9050, test_loss: 1.3544, test_f1: 0.5119
 epoch: 48, train_loss: 0.9219, test_loss: 1.3158, test_f1: 0.5368
 epoch: 49, train_loss: 0.9200, test_loss: 1.4348, test_f1: 0.5463
 epoch: 50, train_loss: 0.9267, test_loss: 1.3690, test_f1: 0.5677
 epoch: 51, train_loss: 0.9063, test_loss: 1.3373, test_f1: 0.5333
 epoch: 52, train_loss: 0.8932, test_loss: 1.3733, test_f1: 0.5280
 epoch: 53, train_loss: 0.8946, test_loss: 1.4534, test_f1: 0.5105
 epoch: 54, train_loss: 0.8816, test_loss: 1.4744, test_f1: 0.5108
 epoch: 55, train_loss: 0.9006, test_loss: 1.4779, test_f1: 0.5138
 epoch: 56, train_loss: 0.8754, test_loss: 1.4480, test_f1: 0.5111
 epoch: 57, train_loss: 0.8879, test_loss: 1.4671, test_f1: 0.4970
 epoch: 58, train_loss: 0.8916, test_loss: 1.5133, test_f1: 0.5085
 epoch: 59, train_loss: 0.8859, test_loss: 1.4532, test_f1: 0.5125
 epoch: 60, train_loss: 0.9032, test_loss: 1.4405, test_f1: 0.5180
 epoch: 61, train_loss: 0.8846, test_loss: 1.4199, test_f1: 0.5173
 epoch: 62, train_loss: 0.8862, test_loss: 1.3913, test_f1: 0.5210
 epoch: 63, train_loss: 0.8763, test_loss: 1.3655, test_f1: 0.5415
 epoch: 64, train_loss: 0.8820, test_loss: 1.3952, test_f1: 0.5458
 epoch: 65, train_loss: 0.8739, test_loss: 1.3997, test_f1: 0.5314
 epoch: 66, train_loss: 0.8635, test_loss: 1.4150, test_f1: 0.5337
 epoch: 67, train_loss: 0.8847, test_loss: 1.4514, test_f1: 0.5416
 epoch: 68, train_loss: 0.8680, test_loss: 1.4522, test_f1: 0.5467
 epoch: 69, train_loss: 0.8621, test_loss: 1.3926, test_f1: 0.5381
 epoch: 70, train_loss: 0.8631, test_loss: 1.4404, test_f1: 0.5017
 epoch: 71, train_loss: 0.8614, test_loss: 1.4544, test_f1: 0.5087
 epoch: 72, train_loss: 0.8533, test_loss: 1.4506, test_f1: 0.5417
 epoch: 73, train_loss: 0.8495, test_loss: 1.3993, test_f1: 0.5254
 epoch: 74, train_loss: 0.8490, test_loss: 1.3993, test_f1: 0.5250
 epoch: 75, train_loss: 0.8570, test_loss: 1.4731, test_f1: 0.4982
 epoch: 76, train_loss: 0.8641, test_loss: 1.4673, test_f1: 0.5267
 epoch: 77, train_loss: 0.8519, test_loss: 1.4287, test_f1: 0.5542
 epoch: 78, train_loss: 0.8603, test_loss: 1.4036, test_f1: 0.5283
 epoch: 79, train_loss: 0.8391, test_loss: 1.3771, test_f1: 0.5359
 epoch: 80, train_loss: 0.8311, test_loss: 1.3916, test_f1: 0.5618
 epoch: 81, train_loss: 0.8397, test_loss: 1.3947, test_f1: 0.5467
 epoch: 82, train_loss: 0.8391, test_loss: 1.4790, test_f1: 0.5401
 epoch: 83, train_loss: 0.8604, test_loss: 1.5108, test_f1: 0.5361
 epoch: 84, train_loss: 0.8413, test_loss: 1.5271, test_f1: 0.5180
 epoch: 85, train_loss: 0.8249, test_loss: 1.4574, test_f1: 0.5379
 epoch: 86, train_loss: 0.8338, test_loss: 1.4853, test_f1: 0.5344
 epoch: 87, train_loss: 0.8384, test_loss: 1.5538, test_f1: 0.5299
 epoch: 88, train_loss: 0.8275, test_loss: 1.5257, test_f1: 0.5175
 epoch: 89, train_loss: 0.8266, test_loss: 1.4193, test_f1: 0.5324
 epoch: 90, train_loss: 0.8334, test_loss: 1.5212, test_f1: 0.5329
 epoch: 91, train_loss: 0.8367, test_loss: 1.4999, test_f1: 0.5320
 epoch: 92, train_loss: 0.8471, test_loss: 1.5130, test_f1: 0.5327
 epoch: 93, train_loss: 0.8317, test_loss: 1.5181, test_f1: 0.5329
 epoch: 94, train_loss: 0.8225, test_loss: 1.4688, test_f1: 0.5128
 epoch: 95, train_loss: 0.8209, test_loss: 1.5349, test_f1: 0.5325
 epoch: 96, train_loss: 0.8356, test_loss: 1.5197, test_f1: 0.5402
 epoch: 97, train_loss: 0.8307, test_loss: 1.5461, test_f1: 0.5045
 epoch: 98, train_loss: 0.8324, test_loss: 1.5641, test_f1: 0.5227
 epoch: 99, train_loss: 0.8238, test_loss: 1.5250, test_f1: 0.5388
##################ITERATION #2 ****************************************
 epoch: 0, train_loss: 1.3784, test_loss: 1.3664, test_f1: 0.2286
 epoch: 1, train_loss: 1.2836, test_loss: 1.3192, test_f1: 0.2281
 epoch: 2, train_loss: 1.2656, test_loss: 1.2976, test_f1: 0.2281
 epoch: 3, train_loss: 1.2496, test_loss: 1.2886, test_f1: 0.2281
 epoch: 4, train_loss: 1.2310, test_loss: 1.2783, test_f1: 0.2281
 epoch: 5, train_loss: 1.2239, test_loss: 1.2704, test_f1: 0.2281
 epoch: 6, train_loss: 1.2163, test_loss: 1.2618, test_f1: 0.2259
 epoch: 7, train_loss: 1.2063, test_loss: 1.2529, test_f1: 0.3116
 epoch: 8, train_loss: 1.1981, test_loss: 1.2491, test_f1: 0.3144
 epoch: 9, train_loss: 1.1934, test_loss: 1.2486, test_f1: 0.3276
 epoch: 10, train_loss: 1.1822, test_loss: 1.2407, test_f1: 0.3346
 epoch: 11, train_loss: 1.1762, test_loss: 1.2352, test_f1: 0.3578
 epoch: 12, train_loss: 1.1648, test_loss: 1.2291, test_f1: 0.3880
 epoch: 13, train_loss: 1.1600, test_loss: 1.2341, test_f1: 0.3741
 epoch: 14, train_loss: 1.1464, test_loss: 1.2352, test_f1: 0.4183
 epoch: 15, train_loss: 1.1424, test_loss: 1.2281, test_f1: 0.4213
 epoch: 16, train_loss: 1.1424, test_loss: 1.2231, test_f1: 0.4382
 epoch: 17, train_loss: 1.1319, test_loss: 1.2217, test_f1: 0.4604
 epoch: 18, train_loss: 1.1193, test_loss: 1.2176, test_f1: 0.4611
 epoch: 19, train_loss: 1.1216, test_loss: 1.2125, test_f1: 0.4564
 epoch: 20, train_loss: 1.1084, test_loss: 1.2035, test_f1: 0.4341
 epoch: 21, train_loss: 1.0933, test_loss: 1.2136, test_f1: 0.4356
 epoch: 22, train_loss: 1.1017, test_loss: 1.2045, test_f1: 0.4314
 epoch: 23, train_loss: 1.0841, test_loss: 1.2046, test_f1: 0.4392
 epoch: 24, train_loss: 1.0827, test_loss: 1.2157, test_f1: 0.4576
 epoch: 25, train_loss: 1.0795, test_loss: 1.1963, test_f1: 0.4293
 epoch: 26, train_loss: 1.0600, test_loss: 1.1926, test_f1: 0.4479
 epoch: 27, train_loss: 1.0719, test_loss: 1.1854, test_f1: 0.4522
 epoch: 28, train_loss: 1.0518, test_loss: 1.1951, test_f1: 0.4700
 epoch: 29, train_loss: 1.0382, test_loss: 1.1981, test_f1: 0.4520
 epoch: 30, train_loss: 1.0396, test_loss: 1.1775, test_f1: 0.4728
 epoch: 31, train_loss: 1.0205, test_loss: 1.1929, test_f1: 0.4813
 epoch: 32, train_loss: 1.0127, test_loss: 1.1819, test_f1: 0.4844
 epoch: 33, train_loss: 1.0163, test_loss: 1.1832, test_f1: 0.5068
 epoch: 34, train_loss: 1.0101, test_loss: 1.2001, test_f1: 0.4845
 epoch: 35, train_loss: 1.0060, test_loss: 1.1762, test_f1: 0.4864
 epoch: 36, train_loss: 1.0052, test_loss: 1.2143, test_f1: 0.4683
 epoch: 37, train_loss: 0.9845, test_loss: 1.2088, test_f1: 0.4849
 epoch: 38, train_loss: 0.9904, test_loss: 1.1964, test_f1: 0.4942
 epoch: 39, train_loss: 0.9844, test_loss: 1.2258, test_f1: 0.4800
 epoch: 40, train_loss: 0.9859, test_loss: 1.2357, test_f1: 0.4560
 epoch: 41, train_loss: 0.9744, test_loss: 1.2352, test_f1: 0.4976
 epoch: 42, train_loss: 0.9660, test_loss: 1.2489, test_f1: 0.4419
 epoch: 43, train_loss: 0.9723, test_loss: 1.2311, test_f1: 0.4830
 epoch: 44, train_loss: 0.9673, test_loss: 1.2349, test_f1: 0.5097
 epoch: 45, train_loss: 0.9596, test_loss: 1.2946, test_f1: 0.4343
 epoch: 46, train_loss: 0.9523, test_loss: 1.2567, test_f1: 0.5244
 epoch: 47, train_loss: 0.9523, test_loss: 1.2564, test_f1: 0.4831
 epoch: 48, train_loss: 0.9522, test_loss: 1.2771, test_f1: 0.4617
 epoch: 49, train_loss: 0.9333, test_loss: 1.2393, test_f1: 0.5171
 epoch: 50, train_loss: 0.9351, test_loss: 1.2752, test_f1: 0.4532
 epoch: 51, train_loss: 0.9442, test_loss: 1.4114, test_f1: 0.4414
 epoch: 52, train_loss: 0.9319, test_loss: 1.6396, test_f1: 0.4496
 epoch: 53, train_loss: 0.9102, test_loss: 1.2940, test_f1: 0.4777
 epoch: 54, train_loss: 0.9266, test_loss: 1.3121, test_f1: 0.4394
 epoch: 55, train_loss: 0.9185, test_loss: 1.3208, test_f1: 0.4787
 epoch: 56, train_loss: 0.9191, test_loss: 1.3401, test_f1: 0.4811
 epoch: 57, train_loss: 0.9112, test_loss: 1.3020, test_f1: 0.4985
 epoch: 58, train_loss: 0.9027, test_loss: 1.2954, test_f1: 0.4783
 epoch: 59, train_loss: 0.9078, test_loss: 1.3434, test_f1: 0.4480
 epoch: 60, train_loss: 0.9096, test_loss: 1.3739, test_f1: 0.4633
 epoch: 61, train_loss: 0.9011, test_loss: 1.3299, test_f1: 0.4938
 epoch: 62, train_loss: 0.9077, test_loss: 1.3584, test_f1: 0.4696
 epoch: 63, train_loss: 0.8951, test_loss: 1.3624, test_f1: 0.4687
 epoch: 64, train_loss: 0.9010, test_loss: 1.3780, test_f1: 0.4931
 epoch: 65, train_loss: 0.8912, test_loss: 1.3603, test_f1: 0.4622
 epoch: 66, train_loss: 0.8833, test_loss: 1.3335, test_f1: 0.4892
 epoch: 67, train_loss: 0.8921, test_loss: 1.3378, test_f1: 0.4856
 epoch: 68, train_loss: 0.8876, test_loss: 1.3594, test_f1: 0.4743
 epoch: 69, train_loss: 0.8794, test_loss: 1.3869, test_f1: 0.4850
 epoch: 70, train_loss: 0.8771, test_loss: 1.4135, test_f1: 0.4581
 epoch: 71, train_loss: 0.8669, test_loss: 1.4422, test_f1: 0.4951
 epoch: 72, train_loss: 0.8738, test_loss: 1.3462, test_f1: 0.4785
 epoch: 73, train_loss: 0.8736, test_loss: 1.3486, test_f1: 0.4823
 epoch: 74, train_loss: 0.8644, test_loss: 1.3123, test_f1: 0.4651
 epoch: 75, train_loss: 0.8552, test_loss: 1.3890, test_f1: 0.4811
 epoch: 76, train_loss: 0.8801, test_loss: 1.3004, test_f1: 0.4841
 epoch: 77, train_loss: 0.8647, test_loss: 1.2952, test_f1: 0.4664
 epoch: 78, train_loss: 0.8670, test_loss: 1.3549, test_f1: 0.4561
 epoch: 79, train_loss: 0.8531, test_loss: 1.4832, test_f1: 0.4449
 epoch: 80, train_loss: 0.8601, test_loss: 1.3860, test_f1: 0.4860
 epoch: 81, train_loss: 0.8581, test_loss: 1.4439, test_f1: 0.4701
 epoch: 82, train_loss: 0.8394, test_loss: 1.4276, test_f1: 0.4572
 epoch: 83, train_loss: 0.8411, test_loss: 1.4941, test_f1: 0.4651
 epoch: 84, train_loss: 0.8467, test_loss: 1.4915, test_f1: 0.4686
 epoch: 85, train_loss: 0.8402, test_loss: 1.4402, test_f1: 0.4654
 epoch: 86, train_loss: 0.8511, test_loss: 1.4387, test_f1: 0.4556
 epoch: 87, train_loss: 0.8635, test_loss: 1.4594, test_f1: 0.4798
 epoch: 88, train_loss: 0.8568, test_loss: 1.3832, test_f1: 0.4736
 epoch: 89, train_loss: 0.8343, test_loss: 1.6445, test_f1: 0.4123
 epoch: 90, train_loss: 0.8315, test_loss: 1.4981, test_f1: 0.4571
 epoch: 91, train_loss: 0.8347, test_loss: 1.5852, test_f1: 0.4763
 epoch: 92, train_loss: 0.8706, test_loss: 1.4803, test_f1: 0.5219
 epoch: 93, train_loss: 0.8446, test_loss: 1.3569, test_f1: 0.4673
 epoch: 94, train_loss: 0.8553, test_loss: 1.5855, test_f1: 0.4629
 epoch: 95, train_loss: 0.8337, test_loss: 1.4786, test_f1: 0.4915
 epoch: 96, train_loss: 0.8410, test_loss: 1.4744, test_f1: 0.4763
 epoch: 97, train_loss: 0.8212, test_loss: 1.6008, test_f1: 0.4563
 epoch: 98, train_loss: 0.8436, test_loss: 1.5117, test_f1: 0.4613
 epoch: 99, train_loss: 0.8098, test_loss: 1.5601, test_f1: 0.4745
##################ITERATION #3 ****************************************
 epoch: 0, train_loss: 1.3501, test_loss: 1.3565, test_f1: 0.2281
 epoch: 1, train_loss: 1.2566, test_loss: 1.3040, test_f1: 0.2281
 epoch: 2, train_loss: 1.2106, test_loss: 1.2739, test_f1: 0.2591
 epoch: 3, train_loss: 1.2034, test_loss: 1.2505, test_f1: 0.2983
 epoch: 4, train_loss: 1.1713, test_loss: 1.2436, test_f1: 0.3895
 epoch: 5, train_loss: 1.1425, test_loss: 1.2309, test_f1: 0.3985
 epoch: 6, train_loss: 1.1240, test_loss: 1.2350, test_f1: 0.4186
 epoch: 7, train_loss: 1.1095, test_loss: 1.2280, test_f1: 0.4166
 epoch: 8, train_loss: 1.1037, test_loss: 1.2168, test_f1: 0.4170
 epoch: 9, train_loss: 1.0803, test_loss: 1.2136, test_f1: 0.4165
 epoch: 10, train_loss: 1.0880, test_loss: 1.2005, test_f1: 0.4444
 epoch: 11, train_loss: 1.0652, test_loss: 1.2006, test_f1: 0.4378
 epoch: 12, train_loss: 1.0531, test_loss: 1.2066, test_f1: 0.4467
 epoch: 13, train_loss: 1.0537, test_loss: 1.1884, test_f1: 0.4692
 epoch: 14, train_loss: 1.0453, test_loss: 1.2004, test_f1: 0.4728
 epoch: 15, train_loss: 1.0150, test_loss: 1.1953, test_f1: 0.4794
 epoch: 16, train_loss: 1.0322, test_loss: 1.1767, test_f1: 0.4876
 epoch: 17, train_loss: 1.0047, test_loss: 1.1704, test_f1: 0.5030
 epoch: 18, train_loss: 1.0078, test_loss: 1.1844, test_f1: 0.5102
 epoch: 19, train_loss: 0.9906, test_loss: 1.1959, test_f1: 0.5128
 epoch: 20, train_loss: 0.9953, test_loss: 1.1635, test_f1: 0.4954
 epoch: 21, train_loss: 0.9881, test_loss: 1.1597, test_f1: 0.5228
 epoch: 22, train_loss: 0.9866, test_loss: 1.1331, test_f1: 0.5416
 epoch: 23, train_loss: 0.9909, test_loss: 1.1719, test_f1: 0.5044
 epoch: 24, train_loss: 0.9706, test_loss: 1.1532, test_f1: 0.5298
 epoch: 25, train_loss: 0.9593, test_loss: 1.1473, test_f1: 0.5052
 epoch: 26, train_loss: 0.9590, test_loss: 1.1614, test_f1: 0.5293
 epoch: 27, train_loss: 0.9380, test_loss: 1.1577, test_f1: 0.5385
 epoch: 28, train_loss: 0.9624, test_loss: 1.1501, test_f1: 0.5373
 epoch: 29, train_loss: 0.9538, test_loss: 1.1628, test_f1: 0.5420
 epoch: 30, train_loss: 0.9389, test_loss: 1.1628, test_f1: 0.5376
 epoch: 31, train_loss: 0.9288, test_loss: 1.1933, test_f1: 0.5005
 epoch: 32, train_loss: 0.9330, test_loss: 1.1773, test_f1: 0.4957
 epoch: 33, train_loss: 0.9156, test_loss: 1.2048, test_f1: 0.5286
 epoch: 34, train_loss: 0.9189, test_loss: 1.2002, test_f1: 0.4991
 epoch: 35, train_loss: 0.8984, test_loss: 1.2448, test_f1: 0.4835
 epoch: 36, train_loss: 0.9040, test_loss: 1.2344, test_f1: 0.4721
 epoch: 37, train_loss: 0.9160, test_loss: 1.2629, test_f1: 0.4705
 epoch: 38, train_loss: 0.9059, test_loss: 1.2069, test_f1: 0.5174
 epoch: 39, train_loss: 0.8989, test_loss: 1.1944, test_f1: 0.5361
 epoch: 40, train_loss: 0.9019, test_loss: 1.2501, test_f1: 0.4785
 epoch: 41, train_loss: 0.8942, test_loss: 1.2364, test_f1: 0.4891
 epoch: 42, train_loss: 0.9047, test_loss: 1.2305, test_f1: 0.5252
 epoch: 43, train_loss: 0.8827, test_loss: 1.2756, test_f1: 0.4910
 epoch: 44, train_loss: 0.8894, test_loss: 1.3196, test_f1: 0.4963
 epoch: 45, train_loss: 0.8743, test_loss: 1.3528, test_f1: 0.5103
 epoch: 46, train_loss: 0.8821, test_loss: 1.3021, test_f1: 0.4947
 epoch: 47, train_loss: 0.8683, test_loss: 1.2932, test_f1: 0.5070
 epoch: 48, train_loss: 0.8507, test_loss: 1.3370, test_f1: 0.4913
 epoch: 49, train_loss: 0.8795, test_loss: 1.4071, test_f1: 0.4783
 epoch: 50, train_loss: 0.8561, test_loss: 1.3397, test_f1: 0.4917
 epoch: 51, train_loss: 0.8402, test_loss: 1.3042, test_f1: 0.4917
 epoch: 52, train_loss: 0.8411, test_loss: 1.2975, test_f1: 0.4725
 epoch: 53, train_loss: 0.8499, test_loss: 1.2840, test_f1: 0.5042
 epoch: 54, train_loss: 0.8415, test_loss: 1.2975, test_f1: 0.4997
 epoch: 55, train_loss: 0.8499, test_loss: 1.3503, test_f1: 0.5100
 epoch: 56, train_loss: 0.8439, test_loss: 1.3739, test_f1: 0.4732
 epoch: 57, train_loss: 0.8444, test_loss: 1.4094, test_f1: 0.5085
 epoch: 58, train_loss: 0.8434, test_loss: 1.3879, test_f1: 0.5137
 epoch: 59, train_loss: 0.8399, test_loss: 1.3388, test_f1: 0.5129
 epoch: 60, train_loss: 0.8330, test_loss: 1.4018, test_f1: 0.5027
 epoch: 61, train_loss: 0.8352, test_loss: 1.4293, test_f1: 0.4979
 epoch: 62, train_loss: 0.8304, test_loss: 1.4036, test_f1: 0.4999
 epoch: 63, train_loss: 0.8227, test_loss: 1.4254, test_f1: 0.5137
 epoch: 64, train_loss: 0.8285, test_loss: 1.4087, test_f1: 0.4751
 epoch: 65, train_loss: 0.8307, test_loss: 1.4603, test_f1: 0.4727
 epoch: 66, train_loss: 0.8344, test_loss: 1.4592, test_f1: 0.4558
 epoch: 67, train_loss: 0.8251, test_loss: 1.4457, test_f1: 0.4933
 epoch: 68, train_loss: 0.8326, test_loss: 1.5069, test_f1: 0.5230
 epoch: 69, train_loss: 0.8187, test_loss: 1.4900, test_f1: 0.4940
 epoch: 70, train_loss: 0.8226, test_loss: 1.6263, test_f1: 0.5102
 epoch: 71, train_loss: 0.8372, test_loss: 1.5464, test_f1: 0.4769
 epoch: 72, train_loss: 0.8287, test_loss: 1.5814, test_f1: 0.5150
 epoch: 73, train_loss: 0.8290, test_loss: 1.4731, test_f1: 0.4841
 epoch: 74, train_loss: 0.8395, test_loss: 1.4170, test_f1: 0.5028
 epoch: 75, train_loss: 0.8121, test_loss: 1.4647, test_f1: 0.4761
 epoch: 76, train_loss: 0.8179, test_loss: 1.4902, test_f1: 0.4945
 epoch: 77, train_loss: 0.8070, test_loss: 1.4859, test_f1: 0.5026
 epoch: 78, train_loss: 0.8038, test_loss: 1.5346, test_f1: 0.5039
 epoch: 79, train_loss: 0.8035, test_loss: 1.5206, test_f1: 0.5044
 epoch: 80, train_loss: 0.7911, test_loss: 1.4942, test_f1: 0.5048
 epoch: 81, train_loss: 0.8355, test_loss: 1.6079, test_f1: 0.4675
 epoch: 82, train_loss: 0.7909, test_loss: 1.5397, test_f1: 0.5082
 epoch: 83, train_loss: 0.8061, test_loss: 1.4969, test_f1: 0.4882
 epoch: 84, train_loss: 0.8080, test_loss: 1.5109, test_f1: 0.4744
 epoch: 85, train_loss: 0.7868, test_loss: 1.5021, test_f1: 0.5150
 epoch: 86, train_loss: 0.8040, test_loss: 1.5792, test_f1: 0.4759
 epoch: 87, train_loss: 0.8030, test_loss: 1.5404, test_f1: 0.4943
 epoch: 88, train_loss: 0.7979, test_loss: 1.5056, test_f1: 0.4936
 epoch: 89, train_loss: 0.7873, test_loss: 1.5482, test_f1: 0.4916
 epoch: 90, train_loss: 0.7846, test_loss: 1.5991, test_f1: 0.5109
 epoch: 91, train_loss: 0.7940, test_loss: 1.6419, test_f1: 0.4923
 epoch: 92, train_loss: 0.7971, test_loss: 1.5317, test_f1: 0.4840
 epoch: 93, train_loss: 0.7917, test_loss: 1.5895, test_f1: 0.4849
 epoch: 94, train_loss: 0.7976, test_loss: 1.5567, test_f1: 0.4895
 epoch: 95, train_loss: 0.7873, test_loss: 1.6385, test_f1: 0.4963
 epoch: 96, train_loss: 0.7968, test_loss: 1.5959, test_f1: 0.4939
 epoch: 97, train_loss: 0.7875, test_loss: 1.5685, test_f1: 0.4981
 epoch: 98, train_loss: 0.7956, test_loss: 1.5246, test_f1: 0.4978
 epoch: 99, train_loss: 0.7845, test_loss: 1.6528, test_f1: 0.4991
##################ITERATION #4 ****************************************
 epoch: 0, train_loss: 1.3423, test_loss: 1.3596, test_f1: 0.2404
 epoch: 1, train_loss: 1.2448, test_loss: 1.3958, test_f1: 0.2404
 epoch: 2, train_loss: 1.2304, test_loss: 1.4207, test_f1: 0.2404
 epoch: 3, train_loss: 1.2189, test_loss: 1.4556, test_f1: 0.2613
 epoch: 4, train_loss: 1.1871, test_loss: 1.3982, test_f1: 0.2837
 epoch: 5, train_loss: 1.1894, test_loss: 1.3528, test_f1: 0.3141
 epoch: 6, train_loss: 1.1832, test_loss: 1.3167, test_f1: 0.3042
 epoch: 7, train_loss: 1.1664, test_loss: 1.3110, test_f1: 0.3336
 epoch: 8, train_loss: 1.1533, test_loss: 1.3074, test_f1: 0.3358
 epoch: 9, train_loss: 1.1478, test_loss: 1.3186, test_f1: 0.3329
 epoch: 10, train_loss: 1.1436, test_loss: 1.3141, test_f1: 0.3433
 epoch: 11, train_loss: 1.1278, test_loss: 1.2947, test_f1: 0.3294
 epoch: 12, train_loss: 1.1322, test_loss: 1.2597, test_f1: 0.3471
 epoch: 13, train_loss: 1.1150, test_loss: 1.2423, test_f1: 0.3892
 epoch: 14, train_loss: 1.1051, test_loss: 1.2462, test_f1: 0.4255
 epoch: 15, train_loss: 1.1014, test_loss: 1.2288, test_f1: 0.4007
 epoch: 16, train_loss: 1.0923, test_loss: 1.2256, test_f1: 0.4093
 epoch: 17, train_loss: 1.0893, test_loss: 1.2203, test_f1: 0.3929
 epoch: 18, train_loss: 1.0894, test_loss: 1.2105, test_f1: 0.4185
 epoch: 19, train_loss: 1.0678, test_loss: 1.2115, test_f1: 0.4163
 epoch: 20, train_loss: 1.0691, test_loss: 1.2014, test_f1: 0.3878
 epoch: 21, train_loss: 1.0519, test_loss: 1.1987, test_f1: 0.4088
 epoch: 22, train_loss: 1.0455, test_loss: 1.2057, test_f1: 0.4306
 epoch: 23, train_loss: 1.0509, test_loss: 1.2030, test_f1: 0.4180
 epoch: 24, train_loss: 1.0432, test_loss: 1.1995, test_f1: 0.4646
 epoch: 25, train_loss: 1.0259, test_loss: 1.1809, test_f1: 0.4742
 epoch: 26, train_loss: 1.0305, test_loss: 1.1808, test_f1: 0.4745
 epoch: 27, train_loss: 1.0278, test_loss: 1.1750, test_f1: 0.4827
 epoch: 28, train_loss: 1.0040, test_loss: 1.1752, test_f1: 0.5041
 epoch: 29, train_loss: 1.0180, test_loss: 1.1762, test_f1: 0.4969
 epoch: 30, train_loss: 1.0095, test_loss: 1.1648, test_f1: 0.5134
 epoch: 31, train_loss: 0.9897, test_loss: 1.2036, test_f1: 0.4922
 epoch: 32, train_loss: 1.0016, test_loss: 1.2189, test_f1: 0.4833
 epoch: 33, train_loss: 0.9969, test_loss: 1.2215, test_f1: 0.4983
 epoch: 34, train_loss: 0.9889, test_loss: 1.2072, test_f1: 0.4934
 epoch: 35, train_loss: 0.9745, test_loss: 1.1618, test_f1: 0.5276
 epoch: 36, train_loss: 0.9834, test_loss: 1.2604, test_f1: 0.5421
 epoch: 37, train_loss: 0.9659, test_loss: 1.1710, test_f1: 0.5171
 epoch: 38, train_loss: 0.9459, test_loss: 1.1453, test_f1: 0.5376
 epoch: 39, train_loss: 0.9487, test_loss: 1.1484, test_f1: 0.5426
 epoch: 40, train_loss: 0.9670, test_loss: 1.1676, test_f1: 0.5503
 epoch: 41, train_loss: 0.9485, test_loss: 1.1503, test_f1: 0.5417
 epoch: 42, train_loss: 0.9447, test_loss: 1.1756, test_f1: 0.5306
 epoch: 43, train_loss: 0.9647, test_loss: 1.1560, test_f1: 0.5236
 epoch: 44, train_loss: 0.9495, test_loss: 1.1264, test_f1: 0.5294
 epoch: 45, train_loss: 0.9445, test_loss: 1.1404, test_f1: 0.5243
 epoch: 46, train_loss: 0.9341, test_loss: 1.1876, test_f1: 0.5416
 epoch: 47, train_loss: 0.9411, test_loss: 1.1742, test_f1: 0.5393
 epoch: 48, train_loss: 0.9188, test_loss: 1.1783, test_f1: 0.5428
 epoch: 49, train_loss: 0.9197, test_loss: 1.1704, test_f1: 0.5573
 epoch: 50, train_loss: 0.9053, test_loss: 1.1390, test_f1: 0.5433
 epoch: 51, train_loss: 0.8983, test_loss: 1.1691, test_f1: 0.5617
 epoch: 52, train_loss: 0.8996, test_loss: 1.1863, test_f1: 0.5516
 epoch: 53, train_loss: 0.8981, test_loss: 1.1751, test_f1: 0.5573
 epoch: 54, train_loss: 0.8899, test_loss: 1.1862, test_f1: 0.5618
 epoch: 55, train_loss: 0.9000, test_loss: 1.1797, test_f1: 0.5419
 epoch: 56, train_loss: 0.8919, test_loss: 1.1671, test_f1: 0.5471
 epoch: 57, train_loss: 0.8807, test_loss: 1.1481, test_f1: 0.5601
 epoch: 58, train_loss: 0.8753, test_loss: 1.1415, test_f1: 0.5525
 epoch: 59, train_loss: 0.8794, test_loss: 1.1485, test_f1: 0.5604
 epoch: 60, train_loss: 0.8727, test_loss: 1.1623, test_f1: 0.5640
 epoch: 61, train_loss: 0.8847, test_loss: 1.1799, test_f1: 0.5418
 epoch: 62, train_loss: 0.8768, test_loss: 1.1588, test_f1: 0.5540
 epoch: 63, train_loss: 0.8881, test_loss: 1.1851, test_f1: 0.5413
 epoch: 64, train_loss: 0.8807, test_loss: 1.1987, test_f1: 0.5354
 epoch: 65, train_loss: 0.8753, test_loss: 1.1711, test_f1: 0.5456
 epoch: 66, train_loss: 0.8635, test_loss: 1.1867, test_f1: 0.5484
 epoch: 67, train_loss: 0.8749, test_loss: 1.2009, test_f1: 0.5255
 epoch: 68, train_loss: 0.8681, test_loss: 1.2045, test_f1: 0.5356
 epoch: 69, train_loss: 0.8683, test_loss: 1.2074, test_f1: 0.5282
 epoch: 70, train_loss: 0.8623, test_loss: 1.1833, test_f1: 0.5279
 epoch: 71, train_loss: 0.8672, test_loss: 1.1862, test_f1: 0.5509
 epoch: 72, train_loss: 0.8664, test_loss: 1.2113, test_f1: 0.5280
 epoch: 73, train_loss: 0.8664, test_loss: 1.1938, test_f1: 0.5260
 epoch: 74, train_loss: 0.8535, test_loss: 1.1899, test_f1: 0.5463
 epoch: 75, train_loss: 0.8645, test_loss: 1.2156, test_f1: 0.5461
 epoch: 76, train_loss: 0.8575, test_loss: 1.1616, test_f1: 0.5448
 epoch: 77, train_loss: 0.8616, test_loss: 1.2047, test_f1: 0.5329
 epoch: 78, train_loss: 0.8468, test_loss: 1.1994, test_f1: 0.5492
 epoch: 79, train_loss: 0.8385, test_loss: 1.1892, test_f1: 0.5512
 epoch: 80, train_loss: 0.8313, test_loss: 1.1640, test_f1: 0.5397
 epoch: 81, train_loss: 0.8484, test_loss: 1.2027, test_f1: 0.5397
 epoch: 82, train_loss: 0.8407, test_loss: 1.2217, test_f1: 0.5378
 epoch: 83, train_loss: 0.8256, test_loss: 1.1902, test_f1: 0.5263
 epoch: 84, train_loss: 0.8179, test_loss: 1.1946, test_f1: 0.5367
 epoch: 85, train_loss: 0.8232, test_loss: 1.2216, test_f1: 0.5442
 epoch: 86, train_loss: 0.8270, test_loss: 1.2346, test_f1: 0.5445
 epoch: 87, train_loss: 0.8503, test_loss: 1.2840, test_f1: 0.5443
 epoch: 88, train_loss: 0.8472, test_loss: 1.2888, test_f1: 0.5486
 epoch: 89, train_loss: 0.8295, test_loss: 1.2600, test_f1: 0.5473
 epoch: 90, train_loss: 0.8204, test_loss: 1.2720, test_f1: 0.5419
 epoch: 91, train_loss: 0.8298, test_loss: 1.2703, test_f1: 0.5356
 epoch: 92, train_loss: 0.8188, test_loss: 1.2447, test_f1: 0.5495
 epoch: 93, train_loss: 0.8310, test_loss: 1.2968, test_f1: 0.5375
 epoch: 94, train_loss: 0.8275, test_loss: 1.2542, test_f1: 0.5530
 epoch: 95, train_loss: 0.8391, test_loss: 1.2546, test_f1: 0.5340
 epoch: 96, train_loss: 0.8221, test_loss: 1.2451, test_f1: 0.5204
 epoch: 97, train_loss: 0.8140, test_loss: 1.2094, test_f1: 0.5515
 epoch: 98, train_loss: 0.8251, test_loss: 1.2605, test_f1: 0.5412
 epoch: 99, train_loss: 0.8317, test_loss: 1.2483, test_f1: 0.5446
##################ITERATION #5 ****************************************
 epoch: 0, train_loss: 1.3006, test_loss: 1.3478, test_f1: 0.2281
 epoch: 1, train_loss: 1.2630, test_loss: 1.3289, test_f1: 0.2281
 epoch: 2, train_loss: 1.2464, test_loss: 1.3140, test_f1: 0.2281
 epoch: 3, train_loss: 1.2264, test_loss: 1.2970, test_f1: 0.2327
 epoch: 4, train_loss: 1.2184, test_loss: 1.2880, test_f1: 0.2401
 epoch: 5, train_loss: 1.2112, test_loss: 1.2834, test_f1: 0.2517
 epoch: 6, train_loss: 1.2073, test_loss: 1.2876, test_f1: 0.2510
 epoch: 7, train_loss: 1.1942, test_loss: 1.2660, test_f1: 0.2497
 epoch: 8, train_loss: 1.1973, test_loss: 1.2574, test_f1: 0.2532
 epoch: 9, train_loss: 1.1882, test_loss: 1.2661, test_f1: 0.2747
 epoch: 10, train_loss: 1.1788, test_loss: 1.2509, test_f1: 0.3035
 epoch: 11, train_loss: 1.1863, test_loss: 1.2562, test_f1: 0.2822
 epoch: 12, train_loss: 1.1722, test_loss: 1.2396, test_f1: 0.3002
 epoch: 13, train_loss: 1.1686, test_loss: 1.2391, test_f1: 0.3212
 epoch: 14, train_loss: 1.1641, test_loss: 1.2385, test_f1: 0.3270
 epoch: 15, train_loss: 1.1675, test_loss: 1.2334, test_f1: 0.3168
 epoch: 16, train_loss: 1.1570, test_loss: 1.2238, test_f1: 0.3100
 epoch: 17, train_loss: 1.1562, test_loss: 1.2095, test_f1: 0.3201
 epoch: 18, train_loss: 1.1526, test_loss: 1.2216, test_f1: 0.2761
 epoch: 19, train_loss: 1.1589, test_loss: 1.2065, test_f1: 0.3234
 epoch: 20, train_loss: 1.1489, test_loss: 1.2183, test_f1: 0.3371
 epoch: 21, train_loss: 1.1315, test_loss: 1.2439, test_f1: 0.3217
 epoch: 22, train_loss: 1.1419, test_loss: 1.2288, test_f1: 0.3353
 epoch: 23, train_loss: 1.1271, test_loss: 1.2261, test_f1: 0.3402
 epoch: 24, train_loss: 1.1370, test_loss: 1.2112, test_f1: 0.3352
 epoch: 25, train_loss: 1.1323, test_loss: 1.1988, test_f1: 0.3743
 epoch: 26, train_loss: 1.1151, test_loss: 1.1933, test_f1: 0.3454
 epoch: 27, train_loss: 1.1269, test_loss: 1.3543, test_f1: 0.3662
 epoch: 28, train_loss: 1.1156, test_loss: 1.2186, test_f1: 0.3641
 epoch: 29, train_loss: 1.1278, test_loss: 1.1906, test_f1: 0.3613
 epoch: 30, train_loss: 1.1154, test_loss: 1.1978, test_f1: 0.3449
 epoch: 31, train_loss: 1.1214, test_loss: 1.1830, test_f1: 0.3106
 epoch: 32, train_loss: 1.1100, test_loss: 1.2013, test_f1: 0.3745
 epoch: 33, train_loss: 1.1107, test_loss: 1.2003, test_f1: 0.3738
 epoch: 34, train_loss: 1.1036, test_loss: 1.2201, test_f1: 0.3652
 epoch: 35, train_loss: 1.1071, test_loss: 1.1796, test_f1: 0.3530
 epoch: 36, train_loss: 1.1116, test_loss: 1.1798, test_f1: 0.3582
 epoch: 37, train_loss: 1.1137, test_loss: 1.1942, test_f1: 0.3580
 epoch: 38, train_loss: 1.0968, test_loss: 1.3814, test_f1: 0.3666
 epoch: 39, train_loss: 1.0962, test_loss: 1.3102, test_f1: 0.3841
 epoch: 40, train_loss: 1.0934, test_loss: 1.2750, test_f1: 0.4118
 epoch: 41, train_loss: 1.0832, test_loss: 1.2370, test_f1: 0.4301
 epoch: 42, train_loss: 1.0802, test_loss: 1.2391, test_f1: 0.4480
 epoch: 43, train_loss: 1.0680, test_loss: 1.2262, test_f1: 0.4012
 epoch: 44, train_loss: 1.0710, test_loss: 1.2732, test_f1: 0.4266
 epoch: 45, train_loss: 1.0799, test_loss: 1.3554, test_f1: 0.4140
 epoch: 46, train_loss: 1.0668, test_loss: 1.2501, test_f1: 0.3921
 epoch: 47, train_loss: 1.0693, test_loss: 1.2822, test_f1: 0.3913
 epoch: 48, train_loss: 1.0555, test_loss: 1.3109, test_f1: 0.4291
 epoch: 49, train_loss: 1.0445, test_loss: 1.4436, test_f1: 0.3898
 epoch: 50, train_loss: 1.0562, test_loss: 1.4155, test_f1: 0.4172
 epoch: 51, train_loss: 1.0412, test_loss: 1.3641, test_f1: 0.4221
 epoch: 52, train_loss: 1.0225, test_loss: 1.4295, test_f1: 0.4219
 epoch: 53, train_loss: 1.0393, test_loss: 1.2897, test_f1: 0.4418
 epoch: 54, train_loss: 1.0379, test_loss: 1.2261, test_f1: 0.4614
 epoch: 55, train_loss: 1.0181, test_loss: 1.2324, test_f1: 0.4575
 epoch: 56, train_loss: 1.0239, test_loss: 1.2783, test_f1: 0.4526
 epoch: 57, train_loss: 1.0418, test_loss: 1.3177, test_f1: 0.4583
 epoch: 58, train_loss: 1.0249, test_loss: 1.2839, test_f1: 0.4493
 epoch: 59, train_loss: 1.0164, test_loss: 1.3040, test_f1: 0.4356
 epoch: 60, train_loss: 1.0272, test_loss: 1.2684, test_f1: 0.4562
 epoch: 61, train_loss: 1.0164, test_loss: 1.4333, test_f1: 0.4542
 epoch: 62, train_loss: 1.0158, test_loss: 1.5311, test_f1: 0.4370
 epoch: 63, train_loss: 1.0252, test_loss: 1.4071, test_f1: 0.4360
 epoch: 64, train_loss: 1.0117, test_loss: 1.3409, test_f1: 0.4588
 epoch: 65, train_loss: 1.0182, test_loss: 1.3094, test_f1: 0.4636
 epoch: 66, train_loss: 1.0259, test_loss: 1.2812, test_f1: 0.4476
 epoch: 67, train_loss: 1.0029, test_loss: 1.2547, test_f1: 0.4648
 epoch: 68, train_loss: 0.9929, test_loss: 1.3224, test_f1: 0.4629
 epoch: 69, train_loss: 0.9976, test_loss: 1.2830, test_f1: 0.4730
 epoch: 70, train_loss: 1.0083, test_loss: 1.2697, test_f1: 0.4554
 epoch: 71, train_loss: 0.9929, test_loss: 1.2906, test_f1: 0.4612
 epoch: 72, train_loss: 1.0045, test_loss: 1.3535, test_f1: 0.4554
 epoch: 73, train_loss: 0.9992, test_loss: 1.2596, test_f1: 0.4701
 epoch: 74, train_loss: 0.9976, test_loss: 1.3073, test_f1: 0.4566
 epoch: 75, train_loss: 0.9877, test_loss: 1.2701, test_f1: 0.4892
 epoch: 76, train_loss: 0.9681, test_loss: 1.3519, test_f1: 0.5006
 epoch: 77, train_loss: 0.9884, test_loss: 1.2862, test_f1: 0.4931
 epoch: 78, train_loss: 0.9874, test_loss: 1.5129, test_f1: 0.4940
 epoch: 79, train_loss: 0.9808, test_loss: 1.6919, test_f1: 0.4740
 epoch: 80, train_loss: 0.9866, test_loss: 1.5573, test_f1: 0.4842
 epoch: 81, train_loss: 0.9791, test_loss: 1.4446, test_f1: 0.4923
 epoch: 82, train_loss: 0.9791, test_loss: 1.4132, test_f1: 0.4856
 epoch: 83, train_loss: 0.9757, test_loss: 1.3955, test_f1: 0.4862
 epoch: 84, train_loss: 0.9652, test_loss: 1.5270, test_f1: 0.4718
 epoch: 85, train_loss: 0.9868, test_loss: 1.4022, test_f1: 0.4745
 epoch: 86, train_loss: 0.9674, test_loss: 1.6461, test_f1: 0.5093
 epoch: 87, train_loss: 0.9675, test_loss: 1.7323, test_f1: 0.4895
 epoch: 88, train_loss: 0.9508, test_loss: 1.6474, test_f1: 0.4769
 epoch: 89, train_loss: 0.9507, test_loss: 1.5959, test_f1: 0.4858
 epoch: 90, train_loss: 0.9637, test_loss: 1.4583, test_f1: 0.4979
 epoch: 91, train_loss: 0.9577, test_loss: 1.5274, test_f1: 0.4977
 epoch: 92, train_loss: 0.9397, test_loss: 1.5445, test_f1: 0.4791
 epoch: 93, train_loss: 0.9752, test_loss: 1.8157, test_f1: 0.4835
 epoch: 94, train_loss: 0.9678, test_loss: 1.8473, test_f1: 0.4902
 epoch: 95, train_loss: 0.9731, test_loss: 1.7798, test_f1: 0.4968
 epoch: 96, train_loss: 0.9518, test_loss: 1.8490, test_f1: 0.4824
 epoch: 97, train_loss: 0.9497, test_loss: 1.9061, test_f1: 0.4865
 epoch: 98, train_loss: 0.9391, test_loss: 1.9948, test_f1: 0.5022
 epoch: 99, train_loss: 0.9419, test_loss: 2.0638, test_f1: 0.4819
##################ITERATION #6 ****************************************
 epoch: 0, train_loss: 1.2954, test_loss: 1.3726, test_f1: 0.2281
 epoch: 1, train_loss: 1.2477, test_loss: 1.3583, test_f1: 0.2202
 epoch: 2, train_loss: 1.2409, test_loss: 1.3238, test_f1: 0.2246
 epoch: 3, train_loss: 1.2280, test_loss: 1.3518, test_f1: 0.2391
 epoch: 4, train_loss: 1.2140, test_loss: 1.3336, test_f1: 0.2994
 epoch: 5, train_loss: 1.2111, test_loss: 1.3139, test_f1: 0.3162
 epoch: 6, train_loss: 1.1987, test_loss: 1.3069, test_f1: 0.3307
 epoch: 7, train_loss: 1.1965, test_loss: 1.3101, test_f1: 0.3267
 epoch: 8, train_loss: 1.1866, test_loss: 1.3085, test_f1: 0.3282
 epoch: 9, train_loss: 1.1856, test_loss: 1.2938, test_f1: 0.3755
 epoch: 10, train_loss: 1.1704, test_loss: 1.3004, test_f1: 0.3681
 epoch: 11, train_loss: 1.1725, test_loss: 1.3213, test_f1: 0.3556
 epoch: 12, train_loss: 1.1675, test_loss: 1.3093, test_f1: 0.3633
 epoch: 13, train_loss: 1.1581, test_loss: 1.2897, test_f1: 0.3722
 epoch: 14, train_loss: 1.1480, test_loss: 1.2639, test_f1: 0.3847
 epoch: 15, train_loss: 1.1317, test_loss: 1.2643, test_f1: 0.3927
 epoch: 16, train_loss: 1.1198, test_loss: 1.2905, test_f1: 0.3896
 epoch: 17, train_loss: 1.1331, test_loss: 1.2807, test_f1: 0.3685
 epoch: 18, train_loss: 1.1219, test_loss: 1.2819, test_f1: 0.3961
 epoch: 19, train_loss: 1.1214, test_loss: 1.2537, test_f1: 0.4036
 epoch: 20, train_loss: 1.1240, test_loss: 1.2417, test_f1: 0.3883
 epoch: 21, train_loss: 1.1294, test_loss: 1.2619, test_f1: 0.4067
 epoch: 22, train_loss: 1.1150, test_loss: 1.2581, test_f1: 0.3884
 epoch: 23, train_loss: 1.1059, test_loss: 1.2631, test_f1: 0.3976
 epoch: 24, train_loss: 1.0919, test_loss: 1.2892, test_f1: 0.3619
 epoch: 25, train_loss: 1.1048, test_loss: 1.2832, test_f1: 0.3480
 epoch: 26, train_loss: 1.0952, test_loss: 1.2879, test_f1: 0.3731
 epoch: 27, train_loss: 1.1003, test_loss: 1.2960, test_f1: 0.3712
 epoch: 28, train_loss: 1.0865, test_loss: 1.2697, test_f1: 0.4164
 epoch: 29, train_loss: 1.0872, test_loss: 1.2918, test_f1: 0.3857
 epoch: 30, train_loss: 1.0776, test_loss: 1.2644, test_f1: 0.4000
 epoch: 31, train_loss: 1.0631, test_loss: 1.2763, test_f1: 0.3631
 epoch: 32, train_loss: 1.0767, test_loss: 1.2605, test_f1: 0.4020
 epoch: 33, train_loss: 1.0785, test_loss: 1.2583, test_f1: 0.4308
 epoch: 34, train_loss: 1.0740, test_loss: 1.2692, test_f1: 0.4079
 epoch: 35, train_loss: 1.0712, test_loss: 1.2608, test_f1: 0.4199
 epoch: 36, train_loss: 1.0667, test_loss: 1.2322, test_f1: 0.4257
 epoch: 37, train_loss: 1.0501, test_loss: 1.2614, test_f1: 0.3811
 epoch: 38, train_loss: 1.0458, test_loss: 1.2475, test_f1: 0.4219
 epoch: 39, train_loss: 1.0354, test_loss: 1.2653, test_f1: 0.4005
 epoch: 40, train_loss: 1.0419, test_loss: 1.2605, test_f1: 0.4386
 epoch: 41, train_loss: 1.0466, test_loss: 1.2621, test_f1: 0.3799
 epoch: 42, train_loss: 1.0415, test_loss: 1.2562, test_f1: 0.3949
 epoch: 43, train_loss: 1.0331, test_loss: 1.2586, test_f1: 0.4151
 epoch: 44, train_loss: 1.0347, test_loss: 1.2486, test_f1: 0.4218
 epoch: 45, train_loss: 1.0147, test_loss: 1.2632, test_f1: 0.4020
 epoch: 46, train_loss: 1.0122, test_loss: 1.2526, test_f1: 0.4122
 epoch: 47, train_loss: 1.0216, test_loss: 1.2865, test_f1: 0.4094
 epoch: 48, train_loss: 1.0131, test_loss: 1.3059, test_f1: 0.4174
 epoch: 49, train_loss: 1.0197, test_loss: 1.3028, test_f1: 0.4381
 epoch: 50, train_loss: 1.0205, test_loss: 1.3035, test_f1: 0.4263
 epoch: 51, train_loss: 0.9848, test_loss: 1.2768, test_f1: 0.4494
 epoch: 52, train_loss: 1.0003, test_loss: 1.3002, test_f1: 0.4300
 epoch: 53, train_loss: 1.0081, test_loss: 1.2963, test_f1: 0.4184
 epoch: 54, train_loss: 0.9983, test_loss: 1.2937, test_f1: 0.4246
 epoch: 55, train_loss: 1.0090, test_loss: 1.2846, test_f1: 0.4033
 epoch: 56, train_loss: 0.9997, test_loss: 1.2672, test_f1: 0.3942
 epoch: 57, train_loss: 0.9860, test_loss: 1.2712, test_f1: 0.4170
 epoch: 58, train_loss: 0.9831, test_loss: 1.2912, test_f1: 0.4129
 epoch: 59, train_loss: 0.9781, test_loss: 1.3007, test_f1: 0.4232
 epoch: 60, train_loss: 0.9868, test_loss: 1.3000, test_f1: 0.4288
 epoch: 61, train_loss: 0.9798, test_loss: 1.3030, test_f1: 0.3879
 epoch: 62, train_loss: 0.9772, test_loss: 1.3066, test_f1: 0.4152
 epoch: 63, train_loss: 0.9801, test_loss: 1.2800, test_f1: 0.4205
 epoch: 64, train_loss: 0.9739, test_loss: 1.2979, test_f1: 0.4188
 epoch: 65, train_loss: 0.9637, test_loss: 1.2954, test_f1: 0.4194
 epoch: 66, train_loss: 0.9492, test_loss: 1.2862, test_f1: 0.4188
 epoch: 67, train_loss: 0.9640, test_loss: 1.3007, test_f1: 0.4159
 epoch: 68, train_loss: 0.9686, test_loss: 1.3019, test_f1: 0.4151
 epoch: 69, train_loss: 0.9553, test_loss: 1.2932, test_f1: 0.4082
 epoch: 70, train_loss: 0.9684, test_loss: 1.2853, test_f1: 0.4144
 epoch: 71, train_loss: 0.9662, test_loss: 1.2869, test_f1: 0.4166
 epoch: 72, train_loss: 0.9491, test_loss: 1.3011, test_f1: 0.4229
 epoch: 73, train_loss: 0.9789, test_loss: 1.2946, test_f1: 0.4184
 epoch: 74, train_loss: 0.9498, test_loss: 1.2799, test_f1: 0.4254
 epoch: 75, train_loss: 0.9678, test_loss: 1.2975, test_f1: 0.4151
 epoch: 76, train_loss: 0.9546, test_loss: 1.2985, test_f1: 0.4073
 epoch: 77, train_loss: 0.9537, test_loss: 1.3085, test_f1: 0.4257
 epoch: 78, train_loss: 0.9505, test_loss: 1.2876, test_f1: 0.4145
 epoch: 79, train_loss: 0.9545, test_loss: 1.3096, test_f1: 0.4215
 epoch: 80, train_loss: 0.9496, test_loss: 1.3211, test_f1: 0.4216
 epoch: 81, train_loss: 0.9512, test_loss: 1.3202, test_f1: 0.4285
 epoch: 82, train_loss: 0.9262, test_loss: 1.3294, test_f1: 0.3985
 epoch: 83, train_loss: 0.9427, test_loss: 1.3120, test_f1: 0.4174
 epoch: 84, train_loss: 0.9444, test_loss: 1.3184, test_f1: 0.4209
 epoch: 85, train_loss: 0.9409, test_loss: 1.3315, test_f1: 0.4231
 epoch: 86, train_loss: 0.9322, test_loss: 1.3091, test_f1: 0.4335
 epoch: 87, train_loss: 0.9433, test_loss: 1.3094, test_f1: 0.3919
 epoch: 88, train_loss: 0.9370, test_loss: 1.3189, test_f1: 0.4114
 epoch: 89, train_loss: 0.9239, test_loss: 1.3140, test_f1: 0.4131
 epoch: 90, train_loss: 0.9375, test_loss: 1.3136, test_f1: 0.4146
 epoch: 91, train_loss: 0.9294, test_loss: 1.3082, test_f1: 0.4274
 epoch: 92, train_loss: 0.9293, test_loss: 1.3197, test_f1: 0.4205
 epoch: 93, train_loss: 0.9337, test_loss: 1.3124, test_f1: 0.4099
 epoch: 94, train_loss: 0.9362, test_loss: 1.3165, test_f1: 0.4126
 epoch: 95, train_loss: 0.9220, test_loss: 1.3267, test_f1: 0.4470
 epoch: 96, train_loss: 0.9182, test_loss: 1.3238, test_f1: 0.4119
 epoch: 97, train_loss: 0.9240, test_loss: 1.3042, test_f1: 0.4270
 epoch: 98, train_loss: 0.9278, test_loss: 1.3353, test_f1: 0.4323
 epoch: 99, train_loss: 0.9095, test_loss: 1.3360, test_f1: 0.4225
##################ITERATION #7 ****************************************
 epoch: 0, train_loss: 1.2981, test_loss: 1.3154, test_f1: 0.2281
 epoch: 1, train_loss: 1.2250, test_loss: 1.2949, test_f1: 0.2281
 epoch: 2, train_loss: 1.2085, test_loss: 1.2534, test_f1: 0.2614
 epoch: 3, train_loss: 1.2006, test_loss: 1.2522, test_f1: 0.3310
 epoch: 4, train_loss: 1.1791, test_loss: 1.2582, test_f1: 0.2759
 epoch: 5, train_loss: 1.1521, test_loss: 1.2456, test_f1: 0.3018
 epoch: 6, train_loss: 1.1697, test_loss: 1.2386, test_f1: 0.3244
 epoch: 7, train_loss: 1.1596, test_loss: 1.2508, test_f1: 0.3773
 epoch: 8, train_loss: 1.1553, test_loss: 1.2294, test_f1: 0.3374
 epoch: 9, train_loss: 1.1453, test_loss: 1.2496, test_f1: 0.3464
 epoch: 10, train_loss: 1.1378, test_loss: 1.2345, test_f1: 0.3462
 epoch: 11, train_loss: 1.1278, test_loss: 1.2292, test_f1: 0.3346
 epoch: 12, train_loss: 1.1279, test_loss: 1.2194, test_f1: 0.3318
 epoch: 13, train_loss: 1.1172, test_loss: 1.2243, test_f1: 0.3405
 epoch: 14, train_loss: 1.1000, test_loss: 1.2223, test_f1: 0.3560
 epoch: 15, train_loss: 1.1153, test_loss: 1.2160, test_f1: 0.3746
 epoch: 16, train_loss: 1.1056, test_loss: 1.2122, test_f1: 0.3764
 epoch: 17, train_loss: 1.0876, test_loss: 1.1979, test_f1: 0.3732
 epoch: 18, train_loss: 1.0974, test_loss: 1.1909, test_f1: 0.3751
 epoch: 19, train_loss: 1.0856, test_loss: 1.1873, test_f1: 0.3903
 epoch: 20, train_loss: 1.0878, test_loss: 1.1943, test_f1: 0.3583
 epoch: 21, train_loss: 1.0700, test_loss: 1.2076, test_f1: 0.3844
 epoch: 22, train_loss: 1.0834, test_loss: 1.2108, test_f1: 0.4238
 epoch: 23, train_loss: 1.0683, test_loss: 1.2071, test_f1: 0.4511
 epoch: 24, train_loss: 1.0520, test_loss: 1.2060, test_f1: 0.4115
 epoch: 25, train_loss: 1.0470, test_loss: 1.2109, test_f1: 0.4412
 epoch: 26, train_loss: 1.0544, test_loss: 1.2097, test_f1: 0.3666
 epoch: 27, train_loss: 1.0615, test_loss: 1.1843, test_f1: 0.3916
 epoch: 28, train_loss: 1.0420, test_loss: 1.2016, test_f1: 0.4258
 epoch: 29, train_loss: 1.0243, test_loss: 1.2112, test_f1: 0.4516
 epoch: 30, train_loss: 1.0263, test_loss: 1.1732, test_f1: 0.4502
 epoch: 31, train_loss: 1.0146, test_loss: 1.1859, test_f1: 0.4738
 epoch: 32, train_loss: 1.0163, test_loss: 1.1860, test_f1: 0.4767
 epoch: 33, train_loss: 1.0121, test_loss: 1.1903, test_f1: 0.4047
 epoch: 34, train_loss: 0.9987, test_loss: 1.1739, test_f1: 0.4028
 epoch: 35, train_loss: 1.0114, test_loss: 1.1930, test_f1: 0.4054
 epoch: 36, train_loss: 0.9956, test_loss: 1.1744, test_f1: 0.4127
 epoch: 37, train_loss: 1.0128, test_loss: 1.1931, test_f1: 0.4087
 epoch: 38, train_loss: 0.9950, test_loss: 1.1911, test_f1: 0.4293
 epoch: 39, train_loss: 0.9827, test_loss: 1.2077, test_f1: 0.4273
 epoch: 40, train_loss: 0.9927, test_loss: 1.2015, test_f1: 0.4797
 epoch: 41, train_loss: 0.9896, test_loss: 1.1943, test_f1: 0.4388
 epoch: 42, train_loss: 0.9840, test_loss: 1.1924, test_f1: 0.4195
 epoch: 43, train_loss: 0.9574, test_loss: 1.2120, test_f1: 0.4438
 epoch: 44, train_loss: 0.9827, test_loss: 1.1958, test_f1: 0.4193
 epoch: 45, train_loss: 0.9539, test_loss: 1.1650, test_f1: 0.4264
 epoch: 46, train_loss: 0.9587, test_loss: 1.1914, test_f1: 0.4560
 epoch: 47, train_loss: 0.9543, test_loss: 1.1754, test_f1: 0.5003
 epoch: 48, train_loss: 0.9586, test_loss: 1.1822, test_f1: 0.5076
 epoch: 49, train_loss: 0.9489, test_loss: 1.2224, test_f1: 0.4396
 epoch: 50, train_loss: 0.9566, test_loss: 1.2186, test_f1: 0.4552
 epoch: 51, train_loss: 0.9571, test_loss: 1.2256, test_f1: 0.4814
 epoch: 52, train_loss: 0.9491, test_loss: 1.1907, test_f1: 0.4909
 epoch: 53, train_loss: 0.9621, test_loss: 1.1888, test_f1: 0.5033
 epoch: 54, train_loss: 0.9346, test_loss: 1.1852, test_f1: 0.5080
 epoch: 55, train_loss: 0.9497, test_loss: 1.1863, test_f1: 0.5026
 epoch: 56, train_loss: 0.9294, test_loss: 1.1823, test_f1: 0.4997
 epoch: 57, train_loss: 0.9243, test_loss: 1.1685, test_f1: 0.5056
 epoch: 58, train_loss: 0.9319, test_loss: 1.1925, test_f1: 0.4621
 epoch: 59, train_loss: 0.9598, test_loss: 1.2127, test_f1: 0.4920
 epoch: 60, train_loss: 0.9252, test_loss: 1.1891, test_f1: 0.4943
 epoch: 61, train_loss: 0.9349, test_loss: 1.1661, test_f1: 0.4855
 epoch: 62, train_loss: 0.9329, test_loss: 1.1761, test_f1: 0.4856
 epoch: 63, train_loss: 0.9028, test_loss: 1.1775, test_f1: 0.4887
 epoch: 64, train_loss: 0.9140, test_loss: 1.1693, test_f1: 0.4910
 epoch: 65, train_loss: 0.9225, test_loss: 1.1840, test_f1: 0.4699
 epoch: 66, train_loss: 0.9201, test_loss: 1.1797, test_f1: 0.4863
 epoch: 67, train_loss: 0.9036, test_loss: 1.1828, test_f1: 0.4944
 epoch: 68, train_loss: 0.9322, test_loss: 1.1700, test_f1: 0.4899
 epoch: 69, train_loss: 0.9125, test_loss: 1.1719, test_f1: 0.4895
 epoch: 70, train_loss: 0.9144, test_loss: 1.1684, test_f1: 0.4997
 epoch: 71, train_loss: 0.9123, test_loss: 1.1665, test_f1: 0.5252
 epoch: 72, train_loss: 0.8974, test_loss: 1.1875, test_f1: 0.5231
 epoch: 73, train_loss: 0.9170, test_loss: 1.1928, test_f1: 0.4885
 epoch: 74, train_loss: 0.8965, test_loss: 1.1932, test_f1: 0.4814
 epoch: 75, train_loss: 0.9080, test_loss: 1.1957, test_f1: 0.5076
 epoch: 76, train_loss: 0.8898, test_loss: 1.1681, test_f1: 0.5176
 epoch: 77, train_loss: 0.8922, test_loss: 1.1684, test_f1: 0.5125
 epoch: 78, train_loss: 0.9015, test_loss: 1.1724, test_f1: 0.5034
 epoch: 79, train_loss: 0.9057, test_loss: 1.1782, test_f1: 0.5109
 epoch: 80, train_loss: 0.8989, test_loss: 1.1838, test_f1: 0.4910
 epoch: 81, train_loss: 0.8970, test_loss: 1.1769, test_f1: 0.4987
 epoch: 82, train_loss: 0.8811, test_loss: 1.1714, test_f1: 0.5048
 epoch: 83, train_loss: 0.8930, test_loss: 1.1558, test_f1: 0.5124
 epoch: 84, train_loss: 0.8898, test_loss: 1.1690, test_f1: 0.5104
 epoch: 85, train_loss: 0.8716, test_loss: 1.1628, test_f1: 0.5123
 epoch: 86, train_loss: 0.8806, test_loss: 1.1843, test_f1: 0.5077
 epoch: 87, train_loss: 0.8826, test_loss: 1.1798, test_f1: 0.5126
 epoch: 88, train_loss: 0.8801, test_loss: 1.1773, test_f1: 0.4995
 epoch: 89, train_loss: 0.8679, test_loss: 1.1604, test_f1: 0.5227
 epoch: 90, train_loss: 0.9023, test_loss: 1.1692, test_f1: 0.5277
 epoch: 91, train_loss: 0.8570, test_loss: 1.1706, test_f1: 0.5182
 epoch: 92, train_loss: 0.8886, test_loss: 1.1724, test_f1: 0.5252
 epoch: 93, train_loss: 0.8761, test_loss: 1.1726, test_f1: 0.5170
 epoch: 94, train_loss: 0.8799, test_loss: 1.1639, test_f1: 0.5188
 epoch: 95, train_loss: 0.8763, test_loss: 1.1514, test_f1: 0.5306
 epoch: 96, train_loss: 0.8802, test_loss: 1.1739, test_f1: 0.5079
 epoch: 97, train_loss: 0.8794, test_loss: 1.1898, test_f1: 0.4989
 epoch: 98, train_loss: 0.8844, test_loss: 1.1600, test_f1: 0.5413
 epoch: 99, train_loss: 0.8677, test_loss: 1.1840, test_f1: 0.5142
##################ITERATION #8 ****************************************
 epoch: 0, train_loss: 1.2964, test_loss: 1.3788, test_f1: 0.2379
 epoch: 1, train_loss: 1.2427, test_loss: 1.3641, test_f1: 0.2354
 epoch: 2, train_loss: 1.2197, test_loss: 1.3469, test_f1: 0.2354
 epoch: 3, train_loss: 1.2125, test_loss: 1.3453, test_f1: 0.2736
 epoch: 4, train_loss: 1.2006, test_loss: 1.3517, test_f1: 0.2691
 epoch: 5, train_loss: 1.1888, test_loss: 1.3218, test_f1: 0.2951
 epoch: 6, train_loss: 1.1833, test_loss: 1.3001, test_f1: 0.3210
 epoch: 7, train_loss: 1.1685, test_loss: 1.2715, test_f1: 0.3026
 epoch: 8, train_loss: 1.1494, test_loss: 1.2683, test_f1: 0.3313
 epoch: 9, train_loss: 1.1406, test_loss: 1.2530, test_f1: 0.3275
 epoch: 10, train_loss: 1.1252, test_loss: 1.2439, test_f1: 0.3643
 epoch: 11, train_loss: 1.1104, test_loss: 1.2619, test_f1: 0.3972
 epoch: 12, train_loss: 1.1167, test_loss: 1.2904, test_f1: 0.4167
 epoch: 13, train_loss: 1.1014, test_loss: 1.2511, test_f1: 0.4960
 epoch: 14, train_loss: 1.0867, test_loss: 1.2621, test_f1: 0.4628
 epoch: 15, train_loss: 1.0769, test_loss: 1.2355, test_f1: 0.4436
 epoch: 16, train_loss: 1.0729, test_loss: 1.1932, test_f1: 0.4884
 epoch: 17, train_loss: 1.0561, test_loss: 1.2019, test_f1: 0.4884
 epoch: 18, train_loss: 1.0500, test_loss: 1.2190, test_f1: 0.4759
 epoch: 19, train_loss: 1.0290, test_loss: 1.1992, test_f1: 0.4747
 epoch: 20, train_loss: 1.0273, test_loss: 1.1778, test_f1: 0.4728
 epoch: 21, train_loss: 1.0313, test_loss: 1.1731, test_f1: 0.4868
 epoch: 22, train_loss: 1.0072, test_loss: 1.1777, test_f1: 0.4770
 epoch: 23, train_loss: 1.0096, test_loss: 1.2164, test_f1: 0.4873
 epoch: 24, train_loss: 0.9934, test_loss: 1.1833, test_f1: 0.5114
 epoch: 25, train_loss: 0.9785, test_loss: 1.2111, test_f1: 0.4713
 epoch: 26, train_loss: 0.9725, test_loss: 1.1804, test_f1: 0.5075
 epoch: 27, train_loss: 0.9891, test_loss: 1.1396, test_f1: 0.5206
 epoch: 28, train_loss: 0.9778, test_loss: 1.1719, test_f1: 0.5432
 epoch: 29, train_loss: 0.9615, test_loss: 1.1488, test_f1: 0.5363
 epoch: 30, train_loss: 0.9597, test_loss: 1.2147, test_f1: 0.4710
 epoch: 31, train_loss: 0.9598, test_loss: 1.1488, test_f1: 0.5372
 epoch: 32, train_loss: 0.9553, test_loss: 1.1908, test_f1: 0.4713
 epoch: 33, train_loss: 0.9521, test_loss: 1.1056, test_f1: 0.5483
 epoch: 34, train_loss: 0.9400, test_loss: 1.1697, test_f1: 0.4788
 epoch: 35, train_loss: 0.9342, test_loss: 1.1254, test_f1: 0.5554
 epoch: 36, train_loss: 0.9438, test_loss: 1.1627, test_f1: 0.4951
 epoch: 37, train_loss: 0.9313, test_loss: 1.1060, test_f1: 0.5363
 epoch: 38, train_loss: 0.9440, test_loss: 1.1255, test_f1: 0.5435
 epoch: 39, train_loss: 0.9154, test_loss: 1.1300, test_f1: 0.5336
 epoch: 40, train_loss: 0.9096, test_loss: 1.1786, test_f1: 0.5463
 epoch: 41, train_loss: 0.9035, test_loss: 1.1428, test_f1: 0.5499
 epoch: 42, train_loss: 0.9045, test_loss: 1.1394, test_f1: 0.5434
 epoch: 43, train_loss: 0.9014, test_loss: 1.1665, test_f1: 0.4977
 epoch: 44, train_loss: 0.8821, test_loss: 1.1135, test_f1: 0.5369
 epoch: 45, train_loss: 0.9090, test_loss: 1.1036, test_f1: 0.5514
 epoch: 46, train_loss: 0.8831, test_loss: 1.1460, test_f1: 0.5589
 epoch: 47, train_loss: 0.8867, test_loss: 1.1422, test_f1: 0.5442
 epoch: 48, train_loss: 0.8743, test_loss: 1.1359, test_f1: 0.5424
 epoch: 49, train_loss: 0.8695, test_loss: 1.1445, test_f1: 0.5105
 epoch: 50, train_loss: 0.8760, test_loss: 1.1504, test_f1: 0.5468
 epoch: 51, train_loss: 0.8615, test_loss: 1.1570, test_f1: 0.5519
 epoch: 52, train_loss: 0.8557, test_loss: 1.1660, test_f1: 0.5241
 epoch: 53, train_loss: 0.8648, test_loss: 1.1609, test_f1: 0.5134
 epoch: 54, train_loss: 0.8586, test_loss: 1.1706, test_f1: 0.5221
 epoch: 55, train_loss: 0.8566, test_loss: 1.1731, test_f1: 0.5564
 epoch: 56, train_loss: 0.8603, test_loss: 1.1627, test_f1: 0.5523
 epoch: 57, train_loss: 0.8460, test_loss: 1.1709, test_f1: 0.5338
 epoch: 58, train_loss: 0.8346, test_loss: 1.1759, test_f1: 0.5341
 epoch: 59, train_loss: 0.8461, test_loss: 1.1568, test_f1: 0.5515
 epoch: 60, train_loss: 0.8503, test_loss: 1.1344, test_f1: 0.5340
 epoch: 61, train_loss: 0.8549, test_loss: 1.1407, test_f1: 0.5337
 epoch: 62, train_loss: 0.8640, test_loss: 1.1314, test_f1: 0.5602
 epoch: 63, train_loss: 0.8621, test_loss: 1.1488, test_f1: 0.5441
 epoch: 64, train_loss: 0.8442, test_loss: 1.1340, test_f1: 0.5655
 epoch: 65, train_loss: 0.8410, test_loss: 1.1685, test_f1: 0.5157
 epoch: 66, train_loss: 0.8395, test_loss: 1.1742, test_f1: 0.5500
 epoch: 67, train_loss: 0.8299, test_loss: 1.1385, test_f1: 0.5650
 epoch: 68, train_loss: 0.8352, test_loss: 1.1559, test_f1: 0.5510
 epoch: 69, train_loss: 0.8412, test_loss: 1.1283, test_f1: 0.5642
 epoch: 70, train_loss: 0.8158, test_loss: 1.1436, test_f1: 0.5660
 epoch: 71, train_loss: 0.8364, test_loss: 1.1364, test_f1: 0.5495
 epoch: 72, train_loss: 0.8360, test_loss: 1.1295, test_f1: 0.5781
 epoch: 73, train_loss: 0.8467, test_loss: 1.1748, test_f1: 0.5422
 epoch: 74, train_loss: 0.8036, test_loss: 1.1730, test_f1: 0.5303
 epoch: 75, train_loss: 0.8283, test_loss: 1.1562, test_f1: 0.5318
 epoch: 76, train_loss: 0.8530, test_loss: 1.1181, test_f1: 0.5673
 epoch: 77, train_loss: 0.8261, test_loss: 1.1198, test_f1: 0.5698
 epoch: 78, train_loss: 0.8142, test_loss: 1.1240, test_f1: 0.5712
 epoch: 79, train_loss: 0.8155, test_loss: 1.1482, test_f1: 0.5368
 epoch: 80, train_loss: 0.8307, test_loss: 1.1561, test_f1: 0.5584
 epoch: 81, train_loss: 0.8266, test_loss: 1.1684, test_f1: 0.5532
 epoch: 82, train_loss: 0.8154, test_loss: 1.1464, test_f1: 0.5608
 epoch: 83, train_loss: 0.8104, test_loss: 1.1816, test_f1: 0.5414
 epoch: 84, train_loss: 0.8272, test_loss: 1.1441, test_f1: 0.5601
 epoch: 85, train_loss: 0.8342, test_loss: 1.1320, test_f1: 0.5860
 epoch: 86, train_loss: 0.8184, test_loss: 1.1575, test_f1: 0.5418
 epoch: 87, train_loss: 0.8273, test_loss: 1.1561, test_f1: 0.5528
 epoch: 88, train_loss: 0.8142, test_loss: 1.1328, test_f1: 0.5703
 epoch: 89, train_loss: 0.8123, test_loss: 1.1635, test_f1: 0.5522
 epoch: 90, train_loss: 0.8081, test_loss: 1.1734, test_f1: 0.5232
 epoch: 91, train_loss: 0.7891, test_loss: 1.1615, test_f1: 0.5192
 epoch: 92, train_loss: 0.8183, test_loss: 1.1424, test_f1: 0.5611
 epoch: 93, train_loss: 0.8126, test_loss: 1.1780, test_f1: 0.5477
 epoch: 94, train_loss: 0.7977, test_loss: 1.1559, test_f1: 0.5761
 epoch: 95, train_loss: 0.8116, test_loss: 1.1262, test_f1: 0.5848
 epoch: 96, train_loss: 0.7848, test_loss: 1.1493, test_f1: 0.5739
 epoch: 97, train_loss: 0.7937, test_loss: 1.1178, test_f1: 0.5878
 epoch: 98, train_loss: 0.7946, test_loss: 1.1475, test_f1: 0.5694
 epoch: 99, train_loss: 0.8031, test_loss: 1.1368, test_f1: 0.5643
##################ITERATION #9 ****************************************
 epoch: 0, train_loss: 2.0148, test_loss: 1.5957, test_f1: 0.0520
 epoch: 1, train_loss: 1.4233, test_loss: 1.4205, test_f1: 0.2319
 epoch: 2, train_loss: 1.3303, test_loss: 1.4024, test_f1: 0.2666
 epoch: 3, train_loss: 1.2984, test_loss: 1.4043, test_f1: 0.2630
 epoch: 4, train_loss: 1.2549, test_loss: 1.3756, test_f1: 0.2855
 epoch: 5, train_loss: 1.2426, test_loss: 1.4120, test_f1: 0.2926
 epoch: 6, train_loss: 1.2371, test_loss: 1.3641, test_f1: 0.3089
 epoch: 7, train_loss: 1.2247, test_loss: 1.3163, test_f1: 0.2945
 epoch: 8, train_loss: 1.2178, test_loss: 1.2905, test_f1: 0.2953
 epoch: 9, train_loss: 1.1867, test_loss: 1.2831, test_f1: 0.3217
 epoch: 10, train_loss: 1.1630, test_loss: 1.2825, test_f1: 0.3225
 epoch: 11, train_loss: 1.1802, test_loss: 1.2891, test_f1: 0.3025
 epoch: 12, train_loss: 1.1597, test_loss: 1.2587, test_f1: 0.3039
 epoch: 13, train_loss: 1.1634, test_loss: 1.2710, test_f1: 0.3021
 epoch: 14, train_loss: 1.1343, test_loss: 1.2510, test_f1: 0.3088
 epoch: 15, train_loss: 1.1322, test_loss: 1.2714, test_f1: 0.3281
 epoch: 16, train_loss: 1.1173, test_loss: 1.2617, test_f1: 0.3598
 epoch: 17, train_loss: 1.1243, test_loss: 1.2562, test_f1: 0.3378
 epoch: 18, train_loss: 1.0965, test_loss: 1.2624, test_f1: 0.3772
 epoch: 19, train_loss: 1.1037, test_loss: 1.2610, test_f1: 0.3798
 epoch: 20, train_loss: 1.0815, test_loss: 1.2500, test_f1: 0.3545
 epoch: 21, train_loss: 1.0774, test_loss: 1.2148, test_f1: 0.3959
 epoch: 22, train_loss: 1.0694, test_loss: 1.2550, test_f1: 0.4176
 epoch: 23, train_loss: 1.0762, test_loss: 1.2056, test_f1: 0.3655
 epoch: 24, train_loss: 1.0588, test_loss: 1.2548, test_f1: 0.3969
 epoch: 25, train_loss: 1.0481, test_loss: 1.2490, test_f1: 0.4300
 epoch: 26, train_loss: 1.0500, test_loss: 1.2256, test_f1: 0.4466
 epoch: 27, train_loss: 1.0453, test_loss: 1.2331, test_f1: 0.4514
 epoch: 28, train_loss: 1.0330, test_loss: 1.2104, test_f1: 0.4416
 epoch: 29, train_loss: 1.0246, test_loss: 1.2171, test_f1: 0.4624
 epoch: 30, train_loss: 1.0262, test_loss: 1.2497, test_f1: 0.4777
 epoch: 31, train_loss: 1.0228, test_loss: 1.2504, test_f1: 0.4752
 epoch: 32, train_loss: 1.0403, test_loss: 1.2301, test_f1: 0.4637
 epoch: 33, train_loss: 1.0122, test_loss: 1.3100, test_f1: 0.4798
 epoch: 34, train_loss: 1.0076, test_loss: 1.2803, test_f1: 0.4804
 epoch: 35, train_loss: 0.9995, test_loss: 1.3032, test_f1: 0.4855
 epoch: 36, train_loss: 0.9887, test_loss: 1.3013, test_f1: 0.4695
 epoch: 37, train_loss: 0.9955, test_loss: 1.2519, test_f1: 0.4798
 epoch: 38, train_loss: 0.9967, test_loss: 1.4493, test_f1: 0.4484
 epoch: 39, train_loss: 0.9632, test_loss: 1.3472, test_f1: 0.4672
 epoch: 40, train_loss: 0.9803, test_loss: 1.2639, test_f1: 0.4763
 epoch: 41, train_loss: 0.9536, test_loss: 1.4048, test_f1: 0.4918
 epoch: 42, train_loss: 0.9646, test_loss: 1.4338, test_f1: 0.5000
 epoch: 43, train_loss: 0.9692, test_loss: 1.3541, test_f1: 0.4954
 epoch: 44, train_loss: 0.9697, test_loss: 1.5298, test_f1: 0.5072
 epoch: 45, train_loss: 0.9703, test_loss: 1.5288, test_f1: 0.4868
 epoch: 46, train_loss: 0.9656, test_loss: 1.4784, test_f1: 0.4980
 epoch: 47, train_loss: 0.9454, test_loss: 1.6021, test_f1: 0.4415
 epoch: 48, train_loss: 0.9438, test_loss: 1.4799, test_f1: 0.4814
 epoch: 49, train_loss: 0.9555, test_loss: 1.4033, test_f1: 0.4776
 epoch: 50, train_loss: 0.9311, test_loss: 1.3929, test_f1: 0.5018
 epoch: 51, train_loss: 0.9377, test_loss: 1.4053, test_f1: 0.4942
 epoch: 52, train_loss: 0.9301, test_loss: 1.3741, test_f1: 0.5029
 epoch: 53, train_loss: 0.9195, test_loss: 1.3313, test_f1: 0.4981
 epoch: 54, train_loss: 0.9394, test_loss: 1.3657, test_f1: 0.4610
 epoch: 55, train_loss: 0.9196, test_loss: 1.3897, test_f1: 0.4958
 epoch: 56, train_loss: 0.9352, test_loss: 1.4429, test_f1: 0.4656
 epoch: 57, train_loss: 0.9181, test_loss: 1.4185, test_f1: 0.5082
 epoch: 58, train_loss: 0.9149, test_loss: 1.4161, test_f1: 0.4886
 epoch: 59, train_loss: 0.9167, test_loss: 1.4105, test_f1: 0.5085
 epoch: 60, train_loss: 0.9091, test_loss: 1.4042, test_f1: 0.5019
 epoch: 61, train_loss: 0.9043, test_loss: 1.3415, test_f1: 0.5130
 epoch: 62, train_loss: 0.9143, test_loss: 1.3379, test_f1: 0.4953
 epoch: 63, train_loss: 0.9142, test_loss: 1.4807, test_f1: 0.4952
 epoch: 64, train_loss: 0.9054, test_loss: 1.4289, test_f1: 0.5115
 epoch: 65, train_loss: 0.8940, test_loss: 1.4980, test_f1: 0.4932
 epoch: 66, train_loss: 0.9282, test_loss: 1.4284, test_f1: 0.5067
 epoch: 67, train_loss: 0.9144, test_loss: 1.4400, test_f1: 0.5058
 epoch: 68, train_loss: 0.9025, test_loss: 1.5474, test_f1: 0.4739
 epoch: 69, train_loss: 0.9098, test_loss: 1.4998, test_f1: 0.4941
 epoch: 70, train_loss: 0.8929, test_loss: 1.4686, test_f1: 0.5215
 epoch: 71, train_loss: 0.8945, test_loss: 1.4258, test_f1: 0.5135
 epoch: 72, train_loss: 0.8872, test_loss: 1.4729, test_f1: 0.4779
 epoch: 73, train_loss: 0.8960, test_loss: 1.3947, test_f1: 0.4933
 epoch: 74, train_loss: 0.9020, test_loss: 1.5032, test_f1: 0.4828
 epoch: 75, train_loss: 0.8940, test_loss: 1.6100, test_f1: 0.4778
 epoch: 76, train_loss: 0.8853, test_loss: 1.4831, test_f1: 0.5035
 epoch: 77, train_loss: 0.8719, test_loss: 1.4438, test_f1: 0.4839
 epoch: 78, train_loss: 0.8710, test_loss: 1.5402, test_f1: 0.4918
 epoch: 79, train_loss: 0.8895, test_loss: 1.5562, test_f1: 0.4855
 epoch: 80, train_loss: 0.8786, test_loss: 1.4857, test_f1: 0.5178
 epoch: 81, train_loss: 0.8685, test_loss: 1.4199, test_f1: 0.5310
 epoch: 82, train_loss: 0.8812, test_loss: 1.4261, test_f1: 0.5095
 epoch: 83, train_loss: 0.8685, test_loss: 1.4221, test_f1: 0.5010
 epoch: 84, train_loss: 0.8620, test_loss: 1.5572, test_f1: 0.5198
 epoch: 85, train_loss: 0.8688, test_loss: 1.6265, test_f1: 0.4960
 epoch: 86, train_loss: 0.8795, test_loss: 1.5666, test_f1: 0.5080
 epoch: 87, train_loss: 0.8795, test_loss: 1.4863, test_f1: 0.5166
 epoch: 88, train_loss: 0.8746, test_loss: 1.5711, test_f1: 0.4970
 epoch: 89, train_loss: 0.8565, test_loss: 1.5634, test_f1: 0.4894
 epoch: 90, train_loss: 0.8800, test_loss: 1.5353, test_f1: 0.4928
 epoch: 91, train_loss: 0.8613, test_loss: 1.5305, test_f1: 0.5164
 epoch: 92, train_loss: 0.8727, test_loss: 1.5506, test_f1: 0.5233
 epoch: 93, train_loss: 0.8678, test_loss: 1.6561, test_f1: 0.5200
 epoch: 94, train_loss: 0.8606, test_loss: 1.5638, test_f1: 0.5169
 epoch: 95, train_loss: 0.8703, test_loss: 1.5696, test_f1: 0.5244
 epoch: 96, train_loss: 0.8529, test_loss: 1.5234, test_f1: 0.5329
 epoch: 97, train_loss: 0.8576, test_loss: 1.5425, test_f1: 0.5194
 epoch: 98, train_loss: 0.8441, test_loss: 1.5687, test_f1: 0.5270
 epoch: 99, train_loss: 0.8680, test_loss: 1.5425, test_f1: 0.5044

Training completed in 341.67 seconds
Best F1: 0.5878 at epoch 97
Mean F1 across iterations: 0.5352  0.0359
========================FINAL RESULTS================================
FEGIN weighted F1: 0.5878  0.0359
python main.py --data ltspice_demos --representation component_component --model FEGIN --layers 4 --hiddens 16 --batch_size 128 --lr 0.001 --emb_size 128 --epochs 100 --save_appendix component_component_L4_H16_BS128_LR0.001_E128 --no_val
-----



STDERR:
  File "main.py", line 370, in <module>
    main()
  File "main.py", line 254, in main
    dataset = dataset_class(
  File "/home/philip/projects/ltspice_examples_code_repo/Circuit-Completion-Using-GNNs/component_classification_with_link_prediction_head/evaluation/FEGIN/kernel/circuit_datasets.py", line 15, in __init__
    self.data, self.slices = torch.load(self.processed_paths[0])
  File "/home/philip/.local/lib/python3.8/site-packages/torch/serialization.py", line 1040, in load
    warnings.warn(
  File "/usr/lib/python3.8/warnings.py", line 109, in _showwarnmsg
    sw(msg.message, msg.category, msg.filename, msg.lineno,
  File "main.py", line 47, in warn_with_traceback
    traceback.print_stack(file=log)
/home/philip/projects/ltspice_examples_code_repo/Circuit-Completion-Using-GNNs/component_classification_with_link_prediction_head/evaluation/FEGIN/kernel/circuit_datasets.py:15: FutureWarning: You are using `torch.load` with `weights_only=False` (the current default value), which uses the default pickle module implicitly. It is possible to construct malicious pickle data which will execute arbitrary code during unpickling (See https://github.com/pytorch/pytorch/blob/main/SECURITY.md#untrusted-models for more details). In a future release, the default value for `weights_only` will be flipped to `True`. This limits the functions that could be executed during unpickling. Arbitrary objects will no longer be allowed to be loaded via this mode unless they are explicitly allowlisted by the user via `torch.serialization.add_safe_globals`. We recommend you start setting `weights_only=True` for any use case where you don't have full control of the loaded file. Please open an issue on GitHub for any issues related to this experimental feature.
  self.data, self.slices = torch.load(self.processed_paths[0])
