STDOUT:
Results will be saved in /home/philip/projects/ltspice_examples_code_repo/Circuit-Completion-Using-GNNs/component_classification_with_link_prediction_head/evaluation/FEGIN/results/model_FEGIN_dataset_ltspice_examples
Command line input: python main.py --data ltspice_examples --representation component_component --model FEGIN --layers 3 --hiddens 16 --batch_size 64 --lr 0.0001 --emb_size 512 --epochs 100 --save_appendix component_component_L3_H16_BS64_LR0.0001_E512 --no_val
 is saved.
-----
ltspice_examples - FEGIN
Using 3 layers, 16 hidden units, h = 2
Loading component_component representation dataset
ENTERED
Training FEGIN on component_component representation
Train: 3556, Test: 845
##################ITERATION #0 ****************************************
 epoch: 0, train_loss: 1.3631, test_loss: 1.3546, test_f1: 0.2629
 epoch: 1, train_loss: 1.3561, test_loss: 1.3489, test_f1: 0.2356
 epoch: 2, train_loss: 1.3506, test_loss: 1.3433, test_f1: 0.2276
 epoch: 3, train_loss: 1.3459, test_loss: 1.3382, test_f1: 0.2274
 epoch: 4, train_loss: 1.3403, test_loss: 1.3331, test_f1: 0.2274
 epoch: 5, train_loss: 1.3341, test_loss: 1.3292, test_f1: 0.2274
 epoch: 6, train_loss: 1.3291, test_loss: 1.3228, test_f1: 0.2274
 epoch: 7, train_loss: 1.3247, test_loss: 1.3169, test_f1: 0.2274
 epoch: 8, train_loss: 1.3190, test_loss: 1.3135, test_f1: 0.2274
 epoch: 9, train_loss: 1.3145, test_loss: 1.3084, test_f1: 0.2274
 epoch: 10, train_loss: 1.3071, test_loss: 1.3034, test_f1: 0.2274
 epoch: 11, train_loss: 1.3053, test_loss: 1.2995, test_f1: 0.2274
 epoch: 12, train_loss: 1.2980, test_loss: 1.2960, test_f1: 0.2274
 epoch: 13, train_loss: 1.2967, test_loss: 1.2924, test_f1: 0.2274
 epoch: 14, train_loss: 1.2918, test_loss: 1.2902, test_f1: 0.2274
 epoch: 15, train_loss: 1.2919, test_loss: 1.2862, test_f1: 0.2274
 epoch: 16, train_loss: 1.2880, test_loss: 1.2845, test_f1: 0.2274
 epoch: 17, train_loss: 1.2853, test_loss: 1.2816, test_f1: 0.2274
 epoch: 18, train_loss: 1.2825, test_loss: 1.2806, test_f1: 0.2274
 epoch: 19, train_loss: 1.2773, test_loss: 1.2784, test_f1: 0.2274
 epoch: 20, train_loss: 1.2777, test_loss: 1.2768, test_f1: 0.2274
 epoch: 21, train_loss: 1.2691, test_loss: 1.2745, test_f1: 0.2274
 epoch: 22, train_loss: 1.2781, test_loss: 1.2717, test_f1: 0.2274
 epoch: 23, train_loss: 1.2731, test_loss: 1.2705, test_f1: 0.2274
 epoch: 24, train_loss: 1.2696, test_loss: 1.2693, test_f1: 0.2274
 epoch: 25, train_loss: 1.2661, test_loss: 1.2658, test_f1: 0.2274
 epoch: 26, train_loss: 1.2654, test_loss: 1.2642, test_f1: 0.2274
 epoch: 27, train_loss: 1.2594, test_loss: 1.2624, test_f1: 0.2274
 epoch: 28, train_loss: 1.2600, test_loss: 1.2601, test_f1: 0.2274
 epoch: 29, train_loss: 1.2571, test_loss: 1.2560, test_f1: 0.2274
 epoch: 30, train_loss: 1.2522, test_loss: 1.2541, test_f1: 0.2274
 epoch: 31, train_loss: 1.2478, test_loss: 1.2520, test_f1: 0.2274
 epoch: 32, train_loss: 1.2501, test_loss: 1.2502, test_f1: 0.2274
 epoch: 33, train_loss: 1.2463, test_loss: 1.2462, test_f1: 0.2426
 epoch: 34, train_loss: 1.2463, test_loss: 1.2463, test_f1: 0.2684
 epoch: 35, train_loss: 1.2440, test_loss: 1.2412, test_f1: 0.3046
 epoch: 36, train_loss: 1.2406, test_loss: 1.2393, test_f1: 0.3267
 epoch: 37, train_loss: 1.2380, test_loss: 1.2365, test_f1: 0.3401
 epoch: 38, train_loss: 1.2382, test_loss: 1.2333, test_f1: 0.3327
 epoch: 39, train_loss: 1.2329, test_loss: 1.2304, test_f1: 0.3417
 epoch: 40, train_loss: 1.2320, test_loss: 1.2275, test_f1: 0.3477
 epoch: 41, train_loss: 1.2295, test_loss: 1.2276, test_f1: 0.3621
 epoch: 42, train_loss: 1.2320, test_loss: 1.2239, test_f1: 0.3566
 epoch: 43, train_loss: 1.2206, test_loss: 1.2224, test_f1: 0.3537
 epoch: 44, train_loss: 1.2263, test_loss: 1.2202, test_f1: 0.3500
 epoch: 45, train_loss: 1.2185, test_loss: 1.2171, test_f1: 0.3485
 epoch: 46, train_loss: 1.2196, test_loss: 1.2149, test_f1: 0.3489
 epoch: 47, train_loss: 1.2254, test_loss: 1.2108, test_f1: 0.3482
 epoch: 48, train_loss: 1.2182, test_loss: 1.2111, test_f1: 0.3459
 epoch: 49, train_loss: 1.2161, test_loss: 1.2098, test_f1: 0.3533
 epoch: 50, train_loss: 1.2128, test_loss: 1.2071, test_f1: 0.3450
 epoch: 51, train_loss: 1.2089, test_loss: 1.2050, test_f1: 0.3458
 epoch: 52, train_loss: 1.2096, test_loss: 1.2062, test_f1: 0.3473
 epoch: 53, train_loss: 1.2122, test_loss: 1.2054, test_f1: 0.3419
 epoch: 54, train_loss: 1.2187, test_loss: 1.2028, test_f1: 0.3441
 epoch: 55, train_loss: 1.2101, test_loss: 1.2023, test_f1: 0.3424
 epoch: 56, train_loss: 1.2062, test_loss: 1.2024, test_f1: 0.3496
 epoch: 57, train_loss: 1.2095, test_loss: 1.2018, test_f1: 0.3431
 epoch: 58, train_loss: 1.2114, test_loss: 1.2002, test_f1: 0.3460
 epoch: 59, train_loss: 1.2091, test_loss: 1.2008, test_f1: 0.3447
 epoch: 60, train_loss: 1.2075, test_loss: 1.2001, test_f1: 0.3468
 epoch: 61, train_loss: 1.2076, test_loss: 1.1983, test_f1: 0.3450
 epoch: 62, train_loss: 1.2059, test_loss: 1.1978, test_f1: 0.3438
 epoch: 63, train_loss: 1.2033, test_loss: 1.1983, test_f1: 0.3407
 epoch: 64, train_loss: 1.2075, test_loss: 1.1964, test_f1: 0.3438
 epoch: 65, train_loss: 1.2046, test_loss: 1.1969, test_f1: 0.3455
 epoch: 66, train_loss: 1.2036, test_loss: 1.1944, test_f1: 0.3455
 epoch: 67, train_loss: 1.1986, test_loss: 1.1931, test_f1: 0.3459
 epoch: 68, train_loss: 1.1986, test_loss: 1.1932, test_f1: 0.3420
 epoch: 69, train_loss: 1.2035, test_loss: 1.1928, test_f1: 0.3456
 epoch: 70, train_loss: 1.2047, test_loss: 1.1918, test_f1: 0.3494
 epoch: 71, train_loss: 1.2006, test_loss: 1.1925, test_f1: 0.3469
 epoch: 72, train_loss: 1.1967, test_loss: 1.1913, test_f1: 0.3475
 epoch: 73, train_loss: 1.1983, test_loss: 1.1917, test_f1: 0.3516
 epoch: 74, train_loss: 1.1955, test_loss: 1.1913, test_f1: 0.3465
 epoch: 75, train_loss: 1.1956, test_loss: 1.1899, test_f1: 0.3457
 epoch: 76, train_loss: 1.2004, test_loss: 1.1900, test_f1: 0.3495
 epoch: 77, train_loss: 1.1911, test_loss: 1.1900, test_f1: 0.3489
 epoch: 78, train_loss: 1.1952, test_loss: 1.1878, test_f1: 0.3461
 epoch: 79, train_loss: 1.1967, test_loss: 1.1893, test_f1: 0.3474
 epoch: 80, train_loss: 1.1969, test_loss: 1.1891, test_f1: 0.3465
 epoch: 81, train_loss: 1.1926, test_loss: 1.1866, test_f1: 0.3486
 epoch: 82, train_loss: 1.1912, test_loss: 1.1876, test_f1: 0.3460
 epoch: 83, train_loss: 1.1876, test_loss: 1.1865, test_f1: 0.3500
 epoch: 84, train_loss: 1.1922, test_loss: 1.1860, test_f1: 0.3449
 epoch: 85, train_loss: 1.1871, test_loss: 1.1856, test_f1: 0.3476
 epoch: 86, train_loss: 1.1949, test_loss: 1.1850, test_f1: 0.3463
 epoch: 87, train_loss: 1.1888, test_loss: 1.1852, test_f1: 0.3469
 epoch: 88, train_loss: 1.1860, test_loss: 1.1859, test_f1: 0.3463
 epoch: 89, train_loss: 1.1874, test_loss: 1.1847, test_f1: 0.3442
 epoch: 90, train_loss: 1.1875, test_loss: 1.1844, test_f1: 0.3452
 epoch: 91, train_loss: 1.1845, test_loss: 1.1813, test_f1: 0.3480
 epoch: 92, train_loss: 1.1790, test_loss: 1.1834, test_f1: 0.3468
 epoch: 93, train_loss: 1.1874, test_loss: 1.1819, test_f1: 0.3476
 epoch: 94, train_loss: 1.1857, test_loss: 1.1821, test_f1: 0.3453
 epoch: 95, train_loss: 1.1847, test_loss: 1.1805, test_f1: 0.3471
 epoch: 96, train_loss: 1.1842, test_loss: 1.1789, test_f1: 0.3477
 epoch: 97, train_loss: 1.1839, test_loss: 1.1793, test_f1: 0.3449
 epoch: 98, train_loss: 1.1790, test_loss: 1.1799, test_f1: 0.3424
 epoch: 99, train_loss: 1.1799, test_loss: 1.1793, test_f1: 0.3487
##################ITERATION #1 ****************************************
 epoch: 0, train_loss: 1.3206, test_loss: 1.3225, test_f1: 0.2274
 epoch: 1, train_loss: 1.3144, test_loss: 1.3167, test_f1: 0.2274
 epoch: 2, train_loss: 1.3087, test_loss: 1.3122, test_f1: 0.2274
 epoch: 3, train_loss: 1.3050, test_loss: 1.3071, test_f1: 0.2274
 epoch: 4, train_loss: 1.3017, test_loss: 1.3032, test_f1: 0.2274
 epoch: 5, train_loss: 1.2991, test_loss: 1.3003, test_f1: 0.2274
 epoch: 6, train_loss: 1.2970, test_loss: 1.2967, test_f1: 0.2274
 epoch: 7, train_loss: 1.2929, test_loss: 1.2939, test_f1: 0.2274
 epoch: 8, train_loss: 1.2920, test_loss: 1.2904, test_f1: 0.2274
 epoch: 9, train_loss: 1.2870, test_loss: 1.2864, test_f1: 0.2274
 epoch: 10, train_loss: 1.2866, test_loss: 1.2831, test_f1: 0.2274
 epoch: 11, train_loss: 1.2827, test_loss: 1.2808, test_f1: 0.2274
 epoch: 12, train_loss: 1.2806, test_loss: 1.2785, test_f1: 0.2274
 epoch: 13, train_loss: 1.2789, test_loss: 1.2764, test_f1: 0.2274
 epoch: 14, train_loss: 1.2775, test_loss: 1.2729, test_f1: 0.2274
 epoch: 15, train_loss: 1.2753, test_loss: 1.2683, test_f1: 0.2274
 epoch: 16, train_loss: 1.2731, test_loss: 1.2668, test_f1: 0.2274
 epoch: 17, train_loss: 1.2727, test_loss: 1.2642, test_f1: 0.2266
 epoch: 18, train_loss: 1.2709, test_loss: 1.2625, test_f1: 0.2274
 epoch: 19, train_loss: 1.2677, test_loss: 1.2589, test_f1: 0.2555
 epoch: 20, train_loss: 1.2682, test_loss: 1.2558, test_f1: 0.2390
 epoch: 21, train_loss: 1.2660, test_loss: 1.2525, test_f1: 0.2555
 epoch: 22, train_loss: 1.2606, test_loss: 1.2491, test_f1: 0.2555
 epoch: 23, train_loss: 1.2627, test_loss: 1.2458, test_f1: 0.2555
 epoch: 24, train_loss: 1.2597, test_loss: 1.2432, test_f1: 0.2555
 epoch: 25, train_loss: 1.2572, test_loss: 1.2417, test_f1: 0.2555
 epoch: 26, train_loss: 1.2501, test_loss: 1.2365, test_f1: 0.2690
 epoch: 27, train_loss: 1.2518, test_loss: 1.2342, test_f1: 0.2602
 epoch: 28, train_loss: 1.2472, test_loss: 1.2328, test_f1: 0.2601
 epoch: 29, train_loss: 1.2488, test_loss: 1.2284, test_f1: 0.2712
 epoch: 30, train_loss: 1.2484, test_loss: 1.2267, test_f1: 0.2603
 epoch: 31, train_loss: 1.2418, test_loss: 1.2248, test_f1: 0.2630
 epoch: 32, train_loss: 1.2435, test_loss: 1.2218, test_f1: 0.2749
 epoch: 33, train_loss: 1.2427, test_loss: 1.2212, test_f1: 0.2651
 epoch: 34, train_loss: 1.2397, test_loss: 1.2169, test_f1: 0.2651
 epoch: 35, train_loss: 1.2378, test_loss: 1.2160, test_f1: 0.2938
 epoch: 36, train_loss: 1.2378, test_loss: 1.2138, test_f1: 0.3000
 epoch: 37, train_loss: 1.2341, test_loss: 1.2119, test_f1: 0.3023
 epoch: 38, train_loss: 1.2359, test_loss: 1.2092, test_f1: 0.3076
 epoch: 39, train_loss: 1.2341, test_loss: 1.2056, test_f1: 0.3182
 epoch: 40, train_loss: 1.2313, test_loss: 1.2056, test_f1: 0.3183
 epoch: 41, train_loss: 1.2319, test_loss: 1.2044, test_f1: 0.3183
 epoch: 42, train_loss: 1.2343, test_loss: 1.2024, test_f1: 0.3191
 epoch: 43, train_loss: 1.2282, test_loss: 1.2012, test_f1: 0.3223
 epoch: 44, train_loss: 1.2272, test_loss: 1.2021, test_f1: 0.3150
 epoch: 45, train_loss: 1.2275, test_loss: 1.1984, test_f1: 0.3251
 epoch: 46, train_loss: 1.2247, test_loss: 1.1993, test_f1: 0.3316
 epoch: 47, train_loss: 1.2234, test_loss: 1.1957, test_f1: 0.3319
 epoch: 48, train_loss: 1.2198, test_loss: 1.1958, test_f1: 0.3297
 epoch: 49, train_loss: 1.2211, test_loss: 1.1939, test_f1: 0.3360
 epoch: 50, train_loss: 1.2187, test_loss: 1.1926, test_f1: 0.3330
 epoch: 51, train_loss: 1.2233, test_loss: 1.1922, test_f1: 0.3353
 epoch: 52, train_loss: 1.2178, test_loss: 1.1913, test_f1: 0.3416
 epoch: 53, train_loss: 1.2199, test_loss: 1.1901, test_f1: 0.3308
 epoch: 54, train_loss: 1.2127, test_loss: 1.1896, test_f1: 0.3337
 epoch: 55, train_loss: 1.2161, test_loss: 1.1907, test_f1: 0.3217
 epoch: 56, train_loss: 1.2158, test_loss: 1.1889, test_f1: 0.3430
 epoch: 57, train_loss: 1.2132, test_loss: 1.1889, test_f1: 0.3382
 epoch: 58, train_loss: 1.2169, test_loss: 1.1890, test_f1: 0.3343
 epoch: 59, train_loss: 1.2158, test_loss: 1.1879, test_f1: 0.3396
 epoch: 60, train_loss: 1.2135, test_loss: 1.1880, test_f1: 0.3473
 epoch: 61, train_loss: 1.2105, test_loss: 1.1854, test_f1: 0.3449
 epoch: 62, train_loss: 1.2135, test_loss: 1.1853, test_f1: 0.3449
 epoch: 63, train_loss: 1.2108, test_loss: 1.1842, test_f1: 0.3458
 epoch: 64, train_loss: 1.2092, test_loss: 1.1846, test_f1: 0.3352
 epoch: 65, train_loss: 1.2100, test_loss: 1.1854, test_f1: 0.3444
 epoch: 66, train_loss: 1.2092, test_loss: 1.1832, test_f1: 0.3409
 epoch: 67, train_loss: 1.2062, test_loss: 1.1827, test_f1: 0.3393
 epoch: 68, train_loss: 1.2116, test_loss: 1.1832, test_f1: 0.3479
 epoch: 69, train_loss: 1.2107, test_loss: 1.1840, test_f1: 0.3385
 epoch: 70, train_loss: 1.2078, test_loss: 1.1815, test_f1: 0.3478
 epoch: 71, train_loss: 1.2082, test_loss: 1.1810, test_f1: 0.3480
 epoch: 72, train_loss: 1.2052, test_loss: 1.1805, test_f1: 0.3347
 epoch: 73, train_loss: 1.2106, test_loss: 1.1794, test_f1: 0.3488
 epoch: 74, train_loss: 1.2067, test_loss: 1.1791, test_f1: 0.3488
 epoch: 75, train_loss: 1.2084, test_loss: 1.1793, test_f1: 0.3492
 epoch: 76, train_loss: 1.2084, test_loss: 1.1780, test_f1: 0.3502
 epoch: 77, train_loss: 1.2003, test_loss: 1.1791, test_f1: 0.3490
 epoch: 78, train_loss: 1.2041, test_loss: 1.1778, test_f1: 0.3491
 epoch: 79, train_loss: 1.2025, test_loss: 1.1770, test_f1: 0.3484
 epoch: 80, train_loss: 1.1979, test_loss: 1.1758, test_f1: 0.3504
 epoch: 81, train_loss: 1.1975, test_loss: 1.1756, test_f1: 0.3434
 epoch: 82, train_loss: 1.2034, test_loss: 1.1748, test_f1: 0.3479
 epoch: 83, train_loss: 1.1978, test_loss: 1.1741, test_f1: 0.3422
 epoch: 84, train_loss: 1.2003, test_loss: 1.1736, test_f1: 0.3492
 epoch: 85, train_loss: 1.1956, test_loss: 1.1740, test_f1: 0.3435
 epoch: 86, train_loss: 1.1984, test_loss: 1.1746, test_f1: 0.3443
 epoch: 87, train_loss: 1.1979, test_loss: 1.1729, test_f1: 0.3474
 epoch: 88, train_loss: 1.1964, test_loss: 1.1718, test_f1: 0.3496
 epoch: 89, train_loss: 1.1979, test_loss: 1.1728, test_f1: 0.3539
 epoch: 90, train_loss: 1.1980, test_loss: 1.1718, test_f1: 0.3469
 epoch: 91, train_loss: 1.1924, test_loss: 1.1694, test_f1: 0.3471
 epoch: 92, train_loss: 1.1915, test_loss: 1.1704, test_f1: 0.3486
 epoch: 93, train_loss: 1.1977, test_loss: 1.1683, test_f1: 0.3448
 epoch: 94, train_loss: 1.1888, test_loss: 1.1682, test_f1: 0.3500
 epoch: 95, train_loss: 1.1881, test_loss: 1.1672, test_f1: 0.3459
 epoch: 96, train_loss: 1.1877, test_loss: 1.1666, test_f1: 0.3458
 epoch: 97, train_loss: 1.1877, test_loss: 1.1670, test_f1: 0.3523
 epoch: 98, train_loss: 1.1883, test_loss: 1.1653, test_f1: 0.3542
 epoch: 99, train_loss: 1.1911, test_loss: 1.1655, test_f1: 0.3554
##################ITERATION #2 ****************************************
 epoch: 0, train_loss: 1.3085, test_loss: 1.3141, test_f1: 0.2274
 epoch: 1, train_loss: 1.3022, test_loss: 1.3071, test_f1: 0.2274
 epoch: 2, train_loss: 1.2990, test_loss: 1.3019, test_f1: 0.2274
 epoch: 3, train_loss: 1.2917, test_loss: 1.2981, test_f1: 0.2274
 epoch: 4, train_loss: 1.2889, test_loss: 1.2925, test_f1: 0.2274
 epoch: 5, train_loss: 1.2852, test_loss: 1.2876, test_f1: 0.2274
 epoch: 6, train_loss: 1.2803, test_loss: 1.2828, test_f1: 0.2274
 epoch: 7, train_loss: 1.2740, test_loss: 1.2779, test_f1: 0.2274
 epoch: 8, train_loss: 1.2750, test_loss: 1.2721, test_f1: 0.2274
 epoch: 9, train_loss: 1.2685, test_loss: 1.2677, test_f1: 0.2274
 epoch: 10, train_loss: 1.2638, test_loss: 1.2627, test_f1: 0.2300
 epoch: 11, train_loss: 1.2638, test_loss: 1.2590, test_f1: 0.2449
 epoch: 12, train_loss: 1.2574, test_loss: 1.2553, test_f1: 0.2513
 epoch: 13, train_loss: 1.2567, test_loss: 1.2508, test_f1: 0.2513
 epoch: 14, train_loss: 1.2530, test_loss: 1.2460, test_f1: 0.2688
 epoch: 15, train_loss: 1.2498, test_loss: 1.2412, test_f1: 0.2822
 epoch: 16, train_loss: 1.2491, test_loss: 1.2391, test_f1: 0.3036
 epoch: 17, train_loss: 1.2478, test_loss: 1.2345, test_f1: 0.3105
 epoch: 18, train_loss: 1.2438, test_loss: 1.2323, test_f1: 0.3087
 epoch: 19, train_loss: 1.2440, test_loss: 1.2293, test_f1: 0.3175
 epoch: 20, train_loss: 1.2335, test_loss: 1.2266, test_f1: 0.3167
 epoch: 21, train_loss: 1.2382, test_loss: 1.2233, test_f1: 0.3256
 epoch: 22, train_loss: 1.2345, test_loss: 1.2222, test_f1: 0.3256
 epoch: 23, train_loss: 1.2343, test_loss: 1.2188, test_f1: 0.3298
 epoch: 24, train_loss: 1.2334, test_loss: 1.2187, test_f1: 0.3292
 epoch: 25, train_loss: 1.2280, test_loss: 1.2151, test_f1: 0.3298
 epoch: 26, train_loss: 1.2248, test_loss: 1.2136, test_f1: 0.3280
 epoch: 27, train_loss: 1.2260, test_loss: 1.2107, test_f1: 0.3256
 epoch: 28, train_loss: 1.2243, test_loss: 1.2095, test_f1: 0.3281
 epoch: 29, train_loss: 1.2228, test_loss: 1.2086, test_f1: 0.3273
 epoch: 30, train_loss: 1.2208, test_loss: 1.2087, test_f1: 0.3290
 epoch: 31, train_loss: 1.2234, test_loss: 1.2069, test_f1: 0.3329
 epoch: 32, train_loss: 1.2174, test_loss: 1.2043, test_f1: 0.3290
 epoch: 33, train_loss: 1.2205, test_loss: 1.2019, test_f1: 0.3347
 epoch: 34, train_loss: 1.2219, test_loss: 1.2018, test_f1: 0.3304
 epoch: 35, train_loss: 1.2252, test_loss: 1.2016, test_f1: 0.3361
 epoch: 36, train_loss: 1.2162, test_loss: 1.1985, test_f1: 0.3381
 epoch: 37, train_loss: 1.2130, test_loss: 1.1990, test_f1: 0.3354
 epoch: 38, train_loss: 1.2120, test_loss: 1.1985, test_f1: 0.3375
 epoch: 39, train_loss: 1.2121, test_loss: 1.1975, test_f1: 0.3377
 epoch: 40, train_loss: 1.2110, test_loss: 1.1964, test_f1: 0.3395
 epoch: 41, train_loss: 1.2128, test_loss: 1.1955, test_f1: 0.3389
 epoch: 42, train_loss: 1.2070, test_loss: 1.1954, test_f1: 0.3381
 epoch: 43, train_loss: 1.2120, test_loss: 1.1965, test_f1: 0.3395
 epoch: 44, train_loss: 1.2082, test_loss: 1.1956, test_f1: 0.3395
 epoch: 45, train_loss: 1.2075, test_loss: 1.1942, test_f1: 0.3395
 epoch: 46, train_loss: 1.2082, test_loss: 1.1916, test_f1: 0.3407
 epoch: 47, train_loss: 1.2055, test_loss: 1.1944, test_f1: 0.3387
 epoch: 48, train_loss: 1.2049, test_loss: 1.1932, test_f1: 0.3389
 epoch: 49, train_loss: 1.2016, test_loss: 1.1944, test_f1: 0.3385
 epoch: 50, train_loss: 1.2018, test_loss: 1.1915, test_f1: 0.3413
 epoch: 51, train_loss: 1.2002, test_loss: 1.1912, test_f1: 0.3399
 epoch: 52, train_loss: 1.2036, test_loss: 1.1913, test_f1: 0.3413
 epoch: 53, train_loss: 1.1989, test_loss: 1.1921, test_f1: 0.3438
 epoch: 54, train_loss: 1.2030, test_loss: 1.1920, test_f1: 0.3420
 epoch: 55, train_loss: 1.1987, test_loss: 1.1911, test_f1: 0.3412
 epoch: 56, train_loss: 1.1966, test_loss: 1.1912, test_f1: 0.3415
 epoch: 57, train_loss: 1.1940, test_loss: 1.1908, test_f1: 0.3412
 epoch: 58, train_loss: 1.2013, test_loss: 1.1902, test_f1: 0.3399
 epoch: 59, train_loss: 1.1990, test_loss: 1.1906, test_f1: 0.3402
 epoch: 60, train_loss: 1.1903, test_loss: 1.1896, test_f1: 0.3414
 epoch: 61, train_loss: 1.1948, test_loss: 1.1896, test_f1: 0.3396
 epoch: 62, train_loss: 1.1968, test_loss: 1.1890, test_f1: 0.3421
 epoch: 63, train_loss: 1.1994, test_loss: 1.1890, test_f1: 0.3419
 epoch: 64, train_loss: 1.1945, test_loss: 1.1893, test_f1: 0.3411
 epoch: 65, train_loss: 1.1951, test_loss: 1.1887, test_f1: 0.3337
 epoch: 66, train_loss: 1.1911, test_loss: 1.1890, test_f1: 0.3395
 epoch: 67, train_loss: 1.1939, test_loss: 1.1888, test_f1: 0.3407
 epoch: 68, train_loss: 1.1948, test_loss: 1.1887, test_f1: 0.3367
 epoch: 69, train_loss: 1.1871, test_loss: 1.1871, test_f1: 0.3456
 epoch: 70, train_loss: 1.1934, test_loss: 1.1872, test_f1: 0.3381
 epoch: 71, train_loss: 1.1892, test_loss: 1.1881, test_f1: 0.3336
 epoch: 72, train_loss: 1.1854, test_loss: 1.1869, test_f1: 0.3365
 epoch: 73, train_loss: 1.1837, test_loss: 1.1876, test_f1: 0.3404
 epoch: 74, train_loss: 1.1921, test_loss: 1.1870, test_f1: 0.3435
 epoch: 75, train_loss: 1.1877, test_loss: 1.1871, test_f1: 0.3391
 epoch: 76, train_loss: 1.1919, test_loss: 1.1860, test_f1: 0.3357
 epoch: 77, train_loss: 1.1883, test_loss: 1.1863, test_f1: 0.3356
 epoch: 78, train_loss: 1.1875, test_loss: 1.1852, test_f1: 0.3347
 epoch: 79, train_loss: 1.1910, test_loss: 1.1839, test_f1: 0.3353
 epoch: 80, train_loss: 1.1859, test_loss: 1.1879, test_f1: 0.3356
 epoch: 81, train_loss: 1.1884, test_loss: 1.1876, test_f1: 0.3389
 epoch: 82, train_loss: 1.1855, test_loss: 1.1846, test_f1: 0.3405
 epoch: 83, train_loss: 1.1912, test_loss: 1.1856, test_f1: 0.3389
 epoch: 84, train_loss: 1.1856, test_loss: 1.1853, test_f1: 0.3373
 epoch: 85, train_loss: 1.1874, test_loss: 1.1849, test_f1: 0.3424
 epoch: 86, train_loss: 1.1813, test_loss: 1.1842, test_f1: 0.3403
 epoch: 87, train_loss: 1.1881, test_loss: 1.1835, test_f1: 0.3415
 epoch: 88, train_loss: 1.1849, test_loss: 1.1826, test_f1: 0.3415
 epoch: 89, train_loss: 1.1883, test_loss: 1.1852, test_f1: 0.3399
 epoch: 90, train_loss: 1.1794, test_loss: 1.1874, test_f1: 0.3399
 epoch: 91, train_loss: 1.1802, test_loss: 1.1867, test_f1: 0.3424
 epoch: 92, train_loss: 1.1829, test_loss: 1.1860, test_f1: 0.3440
 epoch: 93, train_loss: 1.1798, test_loss: 1.1870, test_f1: 0.3428
 epoch: 94, train_loss: 1.1762, test_loss: 1.1856, test_f1: 0.3424
 epoch: 95, train_loss: 1.1823, test_loss: 1.1842, test_f1: 0.3435
 epoch: 96, train_loss: 1.1779, test_loss: 1.1830, test_f1: 0.3442
 epoch: 97, train_loss: 1.1864, test_loss: 1.1845, test_f1: 0.3486
 epoch: 98, train_loss: 1.1779, test_loss: 1.1847, test_f1: 0.3420
 epoch: 99, train_loss: 1.1765, test_loss: 1.1822, test_f1: 0.3405
##################ITERATION #3 ****************************************
 epoch: 0, train_loss: 1.3110, test_loss: 1.3193, test_f1: 0.2274
 epoch: 1, train_loss: 1.3035, test_loss: 1.3117, test_f1: 0.2274
 epoch: 2, train_loss: 1.3008, test_loss: 1.3076, test_f1: 0.2274
 epoch: 3, train_loss: 1.2954, test_loss: 1.3031, test_f1: 0.2274
 epoch: 4, train_loss: 1.2945, test_loss: 1.3005, test_f1: 0.2274
 epoch: 5, train_loss: 1.2890, test_loss: 1.2961, test_f1: 0.2274
 epoch: 6, train_loss: 1.2879, test_loss: 1.2947, test_f1: 0.2274
 epoch: 7, train_loss: 1.2836, test_loss: 1.2903, test_f1: 0.2274
 epoch: 8, train_loss: 1.2790, test_loss: 1.2867, test_f1: 0.2274
 epoch: 9, train_loss: 1.2772, test_loss: 1.2830, test_f1: 0.2274
 epoch: 10, train_loss: 1.2721, test_loss: 1.2807, test_f1: 0.2274
 epoch: 11, train_loss: 1.2711, test_loss: 1.2751, test_f1: 0.2274
 epoch: 12, train_loss: 1.2626, test_loss: 1.2687, test_f1: 0.2274
 epoch: 13, train_loss: 1.2637, test_loss: 1.2674, test_f1: 0.2274
 epoch: 14, train_loss: 1.2649, test_loss: 1.2619, test_f1: 0.2274
 epoch: 15, train_loss: 1.2656, test_loss: 1.2602, test_f1: 0.2274
 epoch: 16, train_loss: 1.2557, test_loss: 1.2567, test_f1: 0.2327
 epoch: 17, train_loss: 1.2547, test_loss: 1.2538, test_f1: 0.2327
 epoch: 18, train_loss: 1.2532, test_loss: 1.2523, test_f1: 0.2327
 epoch: 19, train_loss: 1.2523, test_loss: 1.2468, test_f1: 0.2327
 epoch: 20, train_loss: 1.2500, test_loss: 1.2454, test_f1: 0.2353
 epoch: 21, train_loss: 1.2446, test_loss: 1.2394, test_f1: 0.2328
 epoch: 22, train_loss: 1.2453, test_loss: 1.2377, test_f1: 0.2355
 epoch: 23, train_loss: 1.2447, test_loss: 1.2336, test_f1: 0.2353
 epoch: 24, train_loss: 1.2419, test_loss: 1.2324, test_f1: 0.2355
 epoch: 25, train_loss: 1.2383, test_loss: 1.2332, test_f1: 0.2336
 epoch: 26, train_loss: 1.2297, test_loss: 1.2252, test_f1: 0.2364
 epoch: 27, train_loss: 1.2351, test_loss: 1.2227, test_f1: 0.2395
 epoch: 28, train_loss: 1.2300, test_loss: 1.2210, test_f1: 0.2450
 epoch: 29, train_loss: 1.2291, test_loss: 1.2160, test_f1: 0.2651
 epoch: 30, train_loss: 1.2264, test_loss: 1.2158, test_f1: 0.2532
 epoch: 31, train_loss: 1.2228, test_loss: 1.2115, test_f1: 0.2659
 epoch: 32, train_loss: 1.2175, test_loss: 1.2113, test_f1: 0.2660
 epoch: 33, train_loss: 1.2184, test_loss: 1.2085, test_f1: 0.2600
 epoch: 34, train_loss: 1.2165, test_loss: 1.2020, test_f1: 0.2776
 epoch: 35, train_loss: 1.2197, test_loss: 1.2021, test_f1: 0.2799
 epoch: 36, train_loss: 1.2116, test_loss: 1.1957, test_f1: 0.2929
 epoch: 37, train_loss: 1.2146, test_loss: 1.1968, test_f1: 0.2944
 epoch: 38, train_loss: 1.2075, test_loss: 1.1953, test_f1: 0.3107
 epoch: 39, train_loss: 1.2090, test_loss: 1.1912, test_f1: 0.3184
 epoch: 40, train_loss: 1.2064, test_loss: 1.1894, test_f1: 0.3325
 epoch: 41, train_loss: 1.2100, test_loss: 1.1854, test_f1: 0.3256
 epoch: 42, train_loss: 1.2051, test_loss: 1.1852, test_f1: 0.3296
 epoch: 43, train_loss: 1.1975, test_loss: 1.1795, test_f1: 0.3432
 epoch: 44, train_loss: 1.2011, test_loss: 1.1746, test_f1: 0.3428
 epoch: 45, train_loss: 1.1985, test_loss: 1.1797, test_f1: 0.3411
 epoch: 46, train_loss: 1.1947, test_loss: 1.1770, test_f1: 0.3522
 epoch: 47, train_loss: 1.1956, test_loss: 1.1756, test_f1: 0.3520
 epoch: 48, train_loss: 1.1868, test_loss: 1.1680, test_f1: 0.3801
 epoch: 49, train_loss: 1.1921, test_loss: 1.1713, test_f1: 0.3832
 epoch: 50, train_loss: 1.1841, test_loss: 1.1680, test_f1: 0.3833
 epoch: 51, train_loss: 1.1879, test_loss: 1.1665, test_f1: 0.3811
 epoch: 52, train_loss: 1.1829, test_loss: 1.1677, test_f1: 0.3742
 epoch: 53, train_loss: 1.1867, test_loss: 1.1628, test_f1: 0.3846
 epoch: 54, train_loss: 1.1887, test_loss: 1.1651, test_f1: 0.3799
 epoch: 55, train_loss: 1.1807, test_loss: 1.1632, test_f1: 0.3833
 epoch: 56, train_loss: 1.1818, test_loss: 1.1616, test_f1: 0.3908
 epoch: 57, train_loss: 1.1799, test_loss: 1.1618, test_f1: 0.3826
 epoch: 58, train_loss: 1.1793, test_loss: 1.1631, test_f1: 0.3848
 epoch: 59, train_loss: 1.1832, test_loss: 1.1597, test_f1: 0.3941
 epoch: 60, train_loss: 1.1790, test_loss: 1.1613, test_f1: 0.3809
 epoch: 61, train_loss: 1.1827, test_loss: 1.1603, test_f1: 0.3923
 epoch: 62, train_loss: 1.1819, test_loss: 1.1605, test_f1: 0.4059
 epoch: 63, train_loss: 1.1795, test_loss: 1.1606, test_f1: 0.3877
 epoch: 64, train_loss: 1.1745, test_loss: 1.1581, test_f1: 0.3904
 epoch: 65, train_loss: 1.1831, test_loss: 1.1581, test_f1: 0.3925
 epoch: 66, train_loss: 1.1740, test_loss: 1.1585, test_f1: 0.3993
 epoch: 67, train_loss: 1.1771, test_loss: 1.1566, test_f1: 0.4099
 epoch: 68, train_loss: 1.1663, test_loss: 1.1557, test_f1: 0.4128
 epoch: 69, train_loss: 1.1718, test_loss: 1.1572, test_f1: 0.3999
 epoch: 70, train_loss: 1.1719, test_loss: 1.1552, test_f1: 0.4026
 epoch: 71, train_loss: 1.1661, test_loss: 1.1551, test_f1: 0.3976
 epoch: 72, train_loss: 1.1708, test_loss: 1.1547, test_f1: 0.4055
 epoch: 73, train_loss: 1.1593, test_loss: 1.1484, test_f1: 0.4079
 epoch: 74, train_loss: 1.1724, test_loss: 1.1478, test_f1: 0.4177
 epoch: 75, train_loss: 1.1680, test_loss: 1.1516, test_f1: 0.4100
 epoch: 76, train_loss: 1.1729, test_loss: 1.1549, test_f1: 0.4141
 epoch: 77, train_loss: 1.1645, test_loss: 1.1477, test_f1: 0.4188
 epoch: 78, train_loss: 1.1737, test_loss: 1.1466, test_f1: 0.4240
 epoch: 79, train_loss: 1.1648, test_loss: 1.1483, test_f1: 0.4208
 epoch: 80, train_loss: 1.1636, test_loss: 1.1458, test_f1: 0.4240
 epoch: 81, train_loss: 1.1675, test_loss: 1.1451, test_f1: 0.4227
 epoch: 82, train_loss: 1.1709, test_loss: 1.1454, test_f1: 0.4206
 epoch: 83, train_loss: 1.1554, test_loss: 1.1452, test_f1: 0.4275
 epoch: 84, train_loss: 1.1660, test_loss: 1.1451, test_f1: 0.4216
 epoch: 85, train_loss: 1.1638, test_loss: 1.1467, test_f1: 0.4138
 epoch: 86, train_loss: 1.1648, test_loss: 1.1426, test_f1: 0.4171
 epoch: 87, train_loss: 1.1628, test_loss: 1.1467, test_f1: 0.4127
 epoch: 88, train_loss: 1.1611, test_loss: 1.1449, test_f1: 0.4263
 epoch: 89, train_loss: 1.1618, test_loss: 1.1404, test_f1: 0.4218
 epoch: 90, train_loss: 1.1646, test_loss: 1.1421, test_f1: 0.4073
 epoch: 91, train_loss: 1.1596, test_loss: 1.1374, test_f1: 0.4183
 epoch: 92, train_loss: 1.1583, test_loss: 1.1437, test_f1: 0.4240
 epoch: 93, train_loss: 1.1575, test_loss: 1.1389, test_f1: 0.4211
 epoch: 94, train_loss: 1.1626, test_loss: 1.1376, test_f1: 0.4212
 epoch: 95, train_loss: 1.1562, test_loss: 1.1357, test_f1: 0.4301
 epoch: 96, train_loss: 1.1527, test_loss: 1.1375, test_f1: 0.4115
 epoch: 97, train_loss: 1.1495, test_loss: 1.1381, test_f1: 0.4174
 epoch: 98, train_loss: 1.1555, test_loss: 1.1371, test_f1: 0.4133
 epoch: 99, train_loss: 1.1615, test_loss: 1.1372, test_f1: 0.4294
##################ITERATION #4 ****************************************
 epoch: 0, train_loss: 1.3066, test_loss: 1.3073, test_f1: 0.2274
 epoch: 1, train_loss: 1.3004, test_loss: 1.2978, test_f1: 0.2274
 epoch: 2, train_loss: 1.2886, test_loss: 1.2920, test_f1: 0.2274
 epoch: 3, train_loss: 1.2857, test_loss: 1.2861, test_f1: 0.2274
 epoch: 4, train_loss: 1.2849, test_loss: 1.2826, test_f1: 0.2274
 epoch: 5, train_loss: 1.2771, test_loss: 1.2798, test_f1: 0.2274
 epoch: 6, train_loss: 1.2764, test_loss: 1.2737, test_f1: 0.2274
 epoch: 7, train_loss: 1.2708, test_loss: 1.2677, test_f1: 0.2325
 epoch: 8, train_loss: 1.2694, test_loss: 1.2654, test_f1: 0.2325
 epoch: 9, train_loss: 1.2614, test_loss: 1.2616, test_f1: 0.2411
 epoch: 10, train_loss: 1.2601, test_loss: 1.2551, test_f1: 0.2583
 epoch: 11, train_loss: 1.2589, test_loss: 1.2533, test_f1: 0.2643
 epoch: 12, train_loss: 1.2505, test_loss: 1.2494, test_f1: 0.2815
 epoch: 13, train_loss: 1.2511, test_loss: 1.2451, test_f1: 0.2768
 epoch: 14, train_loss: 1.2459, test_loss: 1.2425, test_f1: 0.2988
 epoch: 15, train_loss: 1.2440, test_loss: 1.2389, test_f1: 0.3005
 epoch: 16, train_loss: 1.2437, test_loss: 1.2361, test_f1: 0.2951
 epoch: 17, train_loss: 1.2419, test_loss: 1.2338, test_f1: 0.3015
 epoch: 18, train_loss: 1.2307, test_loss: 1.2292, test_f1: 0.3110
 epoch: 19, train_loss: 1.2321, test_loss: 1.2259, test_f1: 0.3269
 epoch: 20, train_loss: 1.2328, test_loss: 1.2245, test_f1: 0.3342
 epoch: 21, train_loss: 1.2299, test_loss: 1.2172, test_f1: 0.3317
 epoch: 22, train_loss: 1.2226, test_loss: 1.2136, test_f1: 0.3371
 epoch: 23, train_loss: 1.2244, test_loss: 1.2119, test_f1: 0.3299
 epoch: 24, train_loss: 1.2181, test_loss: 1.2078, test_f1: 0.3288
 epoch: 25, train_loss: 1.2173, test_loss: 1.2059, test_f1: 0.3384
 epoch: 26, train_loss: 1.2150, test_loss: 1.2017, test_f1: 0.3393
 epoch: 27, train_loss: 1.2110, test_loss: 1.1968, test_f1: 0.3407
 epoch: 28, train_loss: 1.2087, test_loss: 1.1921, test_f1: 0.3386
 epoch: 29, train_loss: 1.2054, test_loss: 1.1907, test_f1: 0.3440
 epoch: 30, train_loss: 1.2087, test_loss: 1.1887, test_f1: 0.3413
 epoch: 31, train_loss: 1.1986, test_loss: 1.1832, test_f1: 0.3423
 epoch: 32, train_loss: 1.1969, test_loss: 1.1813, test_f1: 0.3480
 epoch: 33, train_loss: 1.1964, test_loss: 1.1757, test_f1: 0.3490
 epoch: 34, train_loss: 1.1937, test_loss: 1.1749, test_f1: 0.3528
 epoch: 35, train_loss: 1.1921, test_loss: 1.1703, test_f1: 0.3579
 epoch: 36, train_loss: 1.1936, test_loss: 1.1688, test_f1: 0.3622
 epoch: 37, train_loss: 1.1904, test_loss: 1.1651, test_f1: 0.3698
 epoch: 38, train_loss: 1.1836, test_loss: 1.1599, test_f1: 0.3790
 epoch: 39, train_loss: 1.1876, test_loss: 1.1584, test_f1: 0.3758
 epoch: 40, train_loss: 1.1794, test_loss: 1.1541, test_f1: 0.3809
 epoch: 41, train_loss: 1.1791, test_loss: 1.1503, test_f1: 0.3915
 epoch: 42, train_loss: 1.1852, test_loss: 1.1485, test_f1: 0.4007
 epoch: 43, train_loss: 1.1767, test_loss: 1.1445, test_f1: 0.3967
 epoch: 44, train_loss: 1.1748, test_loss: 1.1422, test_f1: 0.3892
 epoch: 45, train_loss: 1.1682, test_loss: 1.1394, test_f1: 0.3945
 epoch: 46, train_loss: 1.1786, test_loss: 1.1347, test_f1: 0.4158
 epoch: 47, train_loss: 1.1761, test_loss: 1.1357, test_f1: 0.4150
 epoch: 48, train_loss: 1.1697, test_loss: 1.1316, test_f1: 0.4122
 epoch: 49, train_loss: 1.1681, test_loss: 1.1322, test_f1: 0.4130
 epoch: 50, train_loss: 1.1677, test_loss: 1.1237, test_f1: 0.4114
 epoch: 51, train_loss: 1.1578, test_loss: 1.1223, test_f1: 0.4183
 epoch: 52, train_loss: 1.1582, test_loss: 1.1251, test_f1: 0.4144
 epoch: 53, train_loss: 1.1582, test_loss: 1.1244, test_f1: 0.4126
 epoch: 54, train_loss: 1.1561, test_loss: 1.1188, test_f1: 0.4187
 epoch: 55, train_loss: 1.1589, test_loss: 1.1197, test_f1: 0.4140
 epoch: 56, train_loss: 1.1614, test_loss: 1.1198, test_f1: 0.4192
 epoch: 57, train_loss: 1.1594, test_loss: 1.1173, test_f1: 0.4309
 epoch: 58, train_loss: 1.1627, test_loss: 1.1184, test_f1: 0.4166
 epoch: 59, train_loss: 1.1530, test_loss: 1.1195, test_f1: 0.4282
 epoch: 60, train_loss: 1.1546, test_loss: 1.1143, test_f1: 0.4242
 epoch: 61, train_loss: 1.1544, test_loss: 1.1120, test_f1: 0.4330
 epoch: 62, train_loss: 1.1564, test_loss: 1.1115, test_f1: 0.4331
 epoch: 63, train_loss: 1.1544, test_loss: 1.1110, test_f1: 0.4327
 epoch: 64, train_loss: 1.1529, test_loss: 1.1110, test_f1: 0.4293
 epoch: 65, train_loss: 1.1444, test_loss: 1.1092, test_f1: 0.4247
 epoch: 66, train_loss: 1.1477, test_loss: 1.1058, test_f1: 0.4311
 epoch: 67, train_loss: 1.1475, test_loss: 1.1068, test_f1: 0.4329
 epoch: 68, train_loss: 1.1516, test_loss: 1.1063, test_f1: 0.4306
 epoch: 69, train_loss: 1.1493, test_loss: 1.1063, test_f1: 0.4310
 epoch: 70, train_loss: 1.1531, test_loss: 1.1053, test_f1: 0.4344
 epoch: 71, train_loss: 1.1444, test_loss: 1.1024, test_f1: 0.4311
 epoch: 72, train_loss: 1.1491, test_loss: 1.1012, test_f1: 0.4283
 epoch: 73, train_loss: 1.1460, test_loss: 1.1050, test_f1: 0.4294
 epoch: 74, train_loss: 1.1416, test_loss: 1.1036, test_f1: 0.4317
 epoch: 75, train_loss: 1.1444, test_loss: 1.1012, test_f1: 0.4327
 epoch: 76, train_loss: 1.1381, test_loss: 1.1007, test_f1: 0.4342
 epoch: 77, train_loss: 1.1394, test_loss: 1.1021, test_f1: 0.4322
 epoch: 78, train_loss: 1.1411, test_loss: 1.0979, test_f1: 0.4288
 epoch: 79, train_loss: 1.1384, test_loss: 1.1002, test_f1: 0.4315
 epoch: 80, train_loss: 1.1450, test_loss: 1.0979, test_f1: 0.4326
 epoch: 81, train_loss: 1.1385, test_loss: 1.0962, test_f1: 0.4307
 epoch: 82, train_loss: 1.1401, test_loss: 1.0973, test_f1: 0.4355
 epoch: 83, train_loss: 1.1366, test_loss: 1.0937, test_f1: 0.4345
 epoch: 84, train_loss: 1.1370, test_loss: 1.0938, test_f1: 0.4336
 epoch: 85, train_loss: 1.1364, test_loss: 1.0928, test_f1: 0.4323
 epoch: 86, train_loss: 1.1348, test_loss: 1.0929, test_f1: 0.4330
 epoch: 87, train_loss: 1.1400, test_loss: 1.0912, test_f1: 0.4359
 epoch: 88, train_loss: 1.1341, test_loss: 1.0924, test_f1: 0.4387
 epoch: 89, train_loss: 1.1458, test_loss: 1.0898, test_f1: 0.4328
 epoch: 90, train_loss: 1.1305, test_loss: 1.0902, test_f1: 0.4328
 epoch: 91, train_loss: 1.1384, test_loss: 1.0925, test_f1: 0.4411
 epoch: 92, train_loss: 1.1305, test_loss: 1.0913, test_f1: 0.4330
 epoch: 93, train_loss: 1.1276, test_loss: 1.0865, test_f1: 0.4361
 epoch: 94, train_loss: 1.1296, test_loss: 1.0880, test_f1: 0.4389
 epoch: 95, train_loss: 1.1311, test_loss: 1.0828, test_f1: 0.4325
 epoch: 96, train_loss: 1.1344, test_loss: 1.0816, test_f1: 0.4362
 epoch: 97, train_loss: 1.1265, test_loss: 1.0844, test_f1: 0.4349
 epoch: 98, train_loss: 1.1303, test_loss: 1.0830, test_f1: 0.4390
 epoch: 99, train_loss: 1.1328, test_loss: 1.0852, test_f1: 0.4418
##################ITERATION #5 ****************************************
 epoch: 0, train_loss: 1.3035, test_loss: 1.2998, test_f1: 0.2274
 epoch: 1, train_loss: 1.2887, test_loss: 1.2869, test_f1: 0.2274
 epoch: 2, train_loss: 1.2852, test_loss: 1.2795, test_f1: 0.2274
 epoch: 3, train_loss: 1.2771, test_loss: 1.2712, test_f1: 0.2266
 epoch: 4, train_loss: 1.2695, test_loss: 1.2647, test_f1: 0.2262
 epoch: 5, train_loss: 1.2644, test_loss: 1.2588, test_f1: 0.2385
 epoch: 6, train_loss: 1.2641, test_loss: 1.2518, test_f1: 0.2552
 epoch: 7, train_loss: 1.2614, test_loss: 1.2456, test_f1: 0.2618
 epoch: 8, train_loss: 1.2549, test_loss: 1.2406, test_f1: 0.2740
 epoch: 9, train_loss: 1.2524, test_loss: 1.2393, test_f1: 0.2914
 epoch: 10, train_loss: 1.2444, test_loss: 1.2330, test_f1: 0.2973
 epoch: 11, train_loss: 1.2436, test_loss: 1.2301, test_f1: 0.3066
 epoch: 12, train_loss: 1.2437, test_loss: 1.2243, test_f1: 0.3085
 epoch: 13, train_loss: 1.2380, test_loss: 1.2224, test_f1: 0.3117
 epoch: 14, train_loss: 1.2379, test_loss: 1.2198, test_f1: 0.3150
 epoch: 15, train_loss: 1.2381, test_loss: 1.2185, test_f1: 0.3218
 epoch: 16, train_loss: 1.2327, test_loss: 1.2136, test_f1: 0.3223
 epoch: 17, train_loss: 1.2357, test_loss: 1.2124, test_f1: 0.3299
 epoch: 18, train_loss: 1.2333, test_loss: 1.2107, test_f1: 0.3347
 epoch: 19, train_loss: 1.2338, test_loss: 1.2085, test_f1: 0.3380
 epoch: 20, train_loss: 1.2275, test_loss: 1.2052, test_f1: 0.3544
 epoch: 21, train_loss: 1.2290, test_loss: 1.2056, test_f1: 0.3522
 epoch: 22, train_loss: 1.2211, test_loss: 1.2033, test_f1: 0.3574
 epoch: 23, train_loss: 1.2184, test_loss: 1.2020, test_f1: 0.3502
 epoch: 24, train_loss: 1.2229, test_loss: 1.2012, test_f1: 0.3650
 epoch: 25, train_loss: 1.2257, test_loss: 1.1982, test_f1: 0.3653
 epoch: 26, train_loss: 1.2185, test_loss: 1.1994, test_f1: 0.3591
 epoch: 27, train_loss: 1.2200, test_loss: 1.1992, test_f1: 0.3747
 epoch: 28, train_loss: 1.2114, test_loss: 1.1990, test_f1: 0.3724
 epoch: 29, train_loss: 1.2173, test_loss: 1.1972, test_f1: 0.3706
 epoch: 30, train_loss: 1.2146, test_loss: 1.1942, test_f1: 0.3698
 epoch: 31, train_loss: 1.2088, test_loss: 1.1941, test_f1: 0.3809
 epoch: 32, train_loss: 1.2102, test_loss: 1.1949, test_f1: 0.3846
 epoch: 33, train_loss: 1.2032, test_loss: 1.1927, test_f1: 0.3902
 epoch: 34, train_loss: 1.2025, test_loss: 1.1941, test_f1: 0.3827
 epoch: 35, train_loss: 1.2073, test_loss: 1.1935, test_f1: 0.3719
 epoch: 36, train_loss: 1.2058, test_loss: 1.1894, test_f1: 0.3733
 epoch: 37, train_loss: 1.2014, test_loss: 1.1914, test_f1: 0.3861
 epoch: 38, train_loss: 1.2008, test_loss: 1.1890, test_f1: 0.3829
 epoch: 39, train_loss: 1.2019, test_loss: 1.1893, test_f1: 0.3892
 epoch: 40, train_loss: 1.2043, test_loss: 1.1878, test_f1: 0.3824
 epoch: 41, train_loss: 1.2005, test_loss: 1.1868, test_f1: 0.3914
 epoch: 42, train_loss: 1.1986, test_loss: 1.1856, test_f1: 0.3901
 epoch: 43, train_loss: 1.1987, test_loss: 1.1868, test_f1: 0.3864
 epoch: 44, train_loss: 1.1985, test_loss: 1.1852, test_f1: 0.3835
 epoch: 45, train_loss: 1.1976, test_loss: 1.1835, test_f1: 0.3859
 epoch: 46, train_loss: 1.1969, test_loss: 1.1849, test_f1: 0.3858
 epoch: 47, train_loss: 1.1936, test_loss: 1.1808, test_f1: 0.3836
 epoch: 48, train_loss: 1.1934, test_loss: 1.1845, test_f1: 0.3875
 epoch: 49, train_loss: 1.1915, test_loss: 1.1817, test_f1: 0.3890
 epoch: 50, train_loss: 1.1953, test_loss: 1.1821, test_f1: 0.3866
 epoch: 51, train_loss: 1.1896, test_loss: 1.1804, test_f1: 0.3918
 epoch: 52, train_loss: 1.1970, test_loss: 1.1804, test_f1: 0.3912
 epoch: 53, train_loss: 1.1914, test_loss: 1.1786, test_f1: 0.3892
 epoch: 54, train_loss: 1.1914, test_loss: 1.1809, test_f1: 0.3918
 epoch: 55, train_loss: 1.1927, test_loss: 1.1793, test_f1: 0.3919
 epoch: 56, train_loss: 1.1866, test_loss: 1.1785, test_f1: 0.3921
 epoch: 57, train_loss: 1.1878, test_loss: 1.1785, test_f1: 0.3939
 epoch: 58, train_loss: 1.1843, test_loss: 1.1791, test_f1: 0.3950
 epoch: 59, train_loss: 1.1800, test_loss: 1.1801, test_f1: 0.3914
 epoch: 60, train_loss: 1.1815, test_loss: 1.1765, test_f1: 0.3928
 epoch: 61, train_loss: 1.1843, test_loss: 1.1753, test_f1: 0.3933
 epoch: 62, train_loss: 1.1814, test_loss: 1.1743, test_f1: 0.3949
 epoch: 63, train_loss: 1.1816, test_loss: 1.1759, test_f1: 0.3947
 epoch: 64, train_loss: 1.1847, test_loss: 1.1789, test_f1: 0.3916
 epoch: 65, train_loss: 1.1877, test_loss: 1.1749, test_f1: 0.3963
 epoch: 66, train_loss: 1.1806, test_loss: 1.1734, test_f1: 0.3945
 epoch: 67, train_loss: 1.1805, test_loss: 1.1716, test_f1: 0.3842
 epoch: 68, train_loss: 1.1783, test_loss: 1.1735, test_f1: 0.3952
 epoch: 69, train_loss: 1.1811, test_loss: 1.1713, test_f1: 0.3932
 epoch: 70, train_loss: 1.1820, test_loss: 1.1728, test_f1: 0.3962
 epoch: 71, train_loss: 1.1786, test_loss: 1.1717, test_f1: 0.3914
 epoch: 72, train_loss: 1.1795, test_loss: 1.1717, test_f1: 0.3907
 epoch: 73, train_loss: 1.1770, test_loss: 1.1719, test_f1: 0.3928
 epoch: 74, train_loss: 1.1769, test_loss: 1.1700, test_f1: 0.3933
 epoch: 75, train_loss: 1.1758, test_loss: 1.1701, test_f1: 0.3906
 epoch: 76, train_loss: 1.1747, test_loss: 1.1705, test_f1: 0.3850
 epoch: 77, train_loss: 1.1788, test_loss: 1.1714, test_f1: 0.3919
 epoch: 78, train_loss: 1.1722, test_loss: 1.1692, test_f1: 0.3933
 epoch: 79, train_loss: 1.1719, test_loss: 1.1677, test_f1: 0.3960
 epoch: 80, train_loss: 1.1747, test_loss: 1.1675, test_f1: 0.3942
 epoch: 81, train_loss: 1.1799, test_loss: 1.1663, test_f1: 0.3921
 epoch: 82, train_loss: 1.1763, test_loss: 1.1630, test_f1: 0.3890
 epoch: 83, train_loss: 1.1760, test_loss: 1.1678, test_f1: 0.3950
 epoch: 84, train_loss: 1.1770, test_loss: 1.1639, test_f1: 0.3973
 epoch: 85, train_loss: 1.1668, test_loss: 1.1634, test_f1: 0.3967
 epoch: 86, train_loss: 1.1725, test_loss: 1.1620, test_f1: 0.3962
 epoch: 87, train_loss: 1.1767, test_loss: 1.1632, test_f1: 0.3981
 epoch: 88, train_loss: 1.1716, test_loss: 1.1602, test_f1: 0.3921
 epoch: 89, train_loss: 1.1698, test_loss: 1.1624, test_f1: 0.3982
 epoch: 90, train_loss: 1.1663, test_loss: 1.1581, test_f1: 0.3978
 epoch: 91, train_loss: 1.1729, test_loss: 1.1556, test_f1: 0.4007
 epoch: 92, train_loss: 1.1644, test_loss: 1.1619, test_f1: 0.4008
 epoch: 93, train_loss: 1.1751, test_loss: 1.1577, test_f1: 0.3988
 epoch: 94, train_loss: 1.1719, test_loss: 1.1564, test_f1: 0.4035
 epoch: 95, train_loss: 1.1609, test_loss: 1.1586, test_f1: 0.3998
 epoch: 96, train_loss: 1.1635, test_loss: 1.1546, test_f1: 0.3971
 epoch: 97, train_loss: 1.1588, test_loss: 1.1558, test_f1: 0.4052
 epoch: 98, train_loss: 1.1686, test_loss: 1.1551, test_f1: 0.3999
 epoch: 99, train_loss: 1.1702, test_loss: 1.1585, test_f1: 0.4053
##################ITERATION #6 ****************************************
 epoch: 0, train_loss: 1.3054, test_loss: 1.2958, test_f1: 0.2555
 epoch: 1, train_loss: 1.2950, test_loss: 1.2870, test_f1: 0.2667
 epoch: 2, train_loss: 1.2830, test_loss: 1.2800, test_f1: 0.2726
 epoch: 3, train_loss: 1.2836, test_loss: 1.2739, test_f1: 0.2711
 epoch: 4, train_loss: 1.2772, test_loss: 1.2685, test_f1: 0.2719
 epoch: 5, train_loss: 1.2712, test_loss: 1.2652, test_f1: 0.2713
 epoch: 6, train_loss: 1.2671, test_loss: 1.2601, test_f1: 0.2713
 epoch: 7, train_loss: 1.2658, test_loss: 1.2563, test_f1: 0.2735
 epoch: 8, train_loss: 1.2644, test_loss: 1.2535, test_f1: 0.2735
 epoch: 9, train_loss: 1.2597, test_loss: 1.2486, test_f1: 0.2714
 epoch: 10, train_loss: 1.2605, test_loss: 1.2448, test_f1: 0.2756
 epoch: 11, train_loss: 1.2569, test_loss: 1.2421, test_f1: 0.2810
 epoch: 12, train_loss: 1.2540, test_loss: 1.2383, test_f1: 0.2810
 epoch: 13, train_loss: 1.2510, test_loss: 1.2364, test_f1: 0.2830
 epoch: 14, train_loss: 1.2509, test_loss: 1.2360, test_f1: 0.2830
 epoch: 15, train_loss: 1.2473, test_loss: 1.2330, test_f1: 0.2918
 epoch: 16, train_loss: 1.2475, test_loss: 1.2324, test_f1: 0.2872
 epoch: 17, train_loss: 1.2453, test_loss: 1.2316, test_f1: 0.2912
 epoch: 18, train_loss: 1.2453, test_loss: 1.2300, test_f1: 0.2945
 epoch: 19, train_loss: 1.2355, test_loss: 1.2264, test_f1: 0.2983
 epoch: 20, train_loss: 1.2435, test_loss: 1.2252, test_f1: 0.3051
 epoch: 21, train_loss: 1.2386, test_loss: 1.2210, test_f1: 0.3059
 epoch: 22, train_loss: 1.2385, test_loss: 1.2203, test_f1: 0.3076
 epoch: 23, train_loss: 1.2361, test_loss: 1.2194, test_f1: 0.3101
 epoch: 24, train_loss: 1.2337, test_loss: 1.2147, test_f1: 0.3265
 epoch: 25, train_loss: 1.2383, test_loss: 1.2148, test_f1: 0.3295
 epoch: 26, train_loss: 1.2314, test_loss: 1.2143, test_f1: 0.3300
 epoch: 27, train_loss: 1.2319, test_loss: 1.2123, test_f1: 0.3353
 epoch: 28, train_loss: 1.2265, test_loss: 1.2097, test_f1: 0.3336
 epoch: 29, train_loss: 1.2239, test_loss: 1.2100, test_f1: 0.3446
 epoch: 30, train_loss: 1.2266, test_loss: 1.2091, test_f1: 0.3491
 epoch: 31, train_loss: 1.2250, test_loss: 1.2071, test_f1: 0.3345
 epoch: 32, train_loss: 1.2241, test_loss: 1.2057, test_f1: 0.3404
 epoch: 33, train_loss: 1.2184, test_loss: 1.2026, test_f1: 0.3434
 epoch: 34, train_loss: 1.2137, test_loss: 1.2006, test_f1: 0.3525
 epoch: 35, train_loss: 1.2166, test_loss: 1.1970, test_f1: 0.3572
 epoch: 36, train_loss: 1.2191, test_loss: 1.1964, test_f1: 0.3513
 epoch: 37, train_loss: 1.2160, test_loss: 1.1957, test_f1: 0.3582
 epoch: 38, train_loss: 1.2138, test_loss: 1.1924, test_f1: 0.3480
 epoch: 39, train_loss: 1.2154, test_loss: 1.1919, test_f1: 0.3361
 epoch: 40, train_loss: 1.2089, test_loss: 1.1927, test_f1: 0.3509
 epoch: 41, train_loss: 1.2028, test_loss: 1.1879, test_f1: 0.3609
 epoch: 42, train_loss: 1.2057, test_loss: 1.1842, test_f1: 0.3560
 epoch: 43, train_loss: 1.2029, test_loss: 1.1866, test_f1: 0.3623
 epoch: 44, train_loss: 1.2025, test_loss: 1.1858, test_f1: 0.3648
 epoch: 45, train_loss: 1.1992, test_loss: 1.1824, test_f1: 0.3694
 epoch: 46, train_loss: 1.1999, test_loss: 1.1839, test_f1: 0.3651
 epoch: 47, train_loss: 1.2014, test_loss: 1.1790, test_f1: 0.3689
 epoch: 48, train_loss: 1.1912, test_loss: 1.1805, test_f1: 0.3802
 epoch: 49, train_loss: 1.1966, test_loss: 1.1790, test_f1: 0.3717
 epoch: 50, train_loss: 1.1965, test_loss: 1.1807, test_f1: 0.3721
 epoch: 51, train_loss: 1.1935, test_loss: 1.1759, test_f1: 0.3805
 epoch: 52, train_loss: 1.1926, test_loss: 1.1737, test_f1: 0.3899
 epoch: 53, train_loss: 1.1896, test_loss: 1.1754, test_f1: 0.3782
 epoch: 54, train_loss: 1.1890, test_loss: 1.1761, test_f1: 0.3816
 epoch: 55, train_loss: 1.1863, test_loss: 1.1727, test_f1: 0.3905
 epoch: 56, train_loss: 1.1917, test_loss: 1.1733, test_f1: 0.3772
 epoch: 57, train_loss: 1.1909, test_loss: 1.1752, test_f1: 0.3771
 epoch: 58, train_loss: 1.1900, test_loss: 1.1757, test_f1: 0.3770
 epoch: 59, train_loss: 1.1947, test_loss: 1.1732, test_f1: 0.3863
 epoch: 60, train_loss: 1.1845, test_loss: 1.1726, test_f1: 0.3832
 epoch: 61, train_loss: 1.1823, test_loss: 1.1722, test_f1: 0.3828
 epoch: 62, train_loss: 1.1927, test_loss: 1.1709, test_f1: 0.3817
 epoch: 63, train_loss: 1.1860, test_loss: 1.1740, test_f1: 0.3773
 epoch: 64, train_loss: 1.1854, test_loss: 1.1709, test_f1: 0.3830
 epoch: 65, train_loss: 1.1795, test_loss: 1.1700, test_f1: 0.3826
 epoch: 66, train_loss: 1.1849, test_loss: 1.1684, test_f1: 0.3956
 epoch: 67, train_loss: 1.1881, test_loss: 1.1680, test_f1: 0.3903
 epoch: 68, train_loss: 1.1821, test_loss: 1.1687, test_f1: 0.3941
 epoch: 69, train_loss: 1.1802, test_loss: 1.1688, test_f1: 0.3844
 epoch: 70, train_loss: 1.1820, test_loss: 1.1668, test_f1: 0.3840
 epoch: 71, train_loss: 1.1783, test_loss: 1.1670, test_f1: 0.3813
 epoch: 72, train_loss: 1.1801, test_loss: 1.1651, test_f1: 0.3856
 epoch: 73, train_loss: 1.1814, test_loss: 1.1638, test_f1: 0.3876
 epoch: 74, train_loss: 1.1760, test_loss: 1.1675, test_f1: 0.3855
 epoch: 75, train_loss: 1.1756, test_loss: 1.1651, test_f1: 0.3971
 epoch: 76, train_loss: 1.1790, test_loss: 1.1636, test_f1: 0.4001
 epoch: 77, train_loss: 1.1767, test_loss: 1.1641, test_f1: 0.4028
 epoch: 78, train_loss: 1.1732, test_loss: 1.1642, test_f1: 0.3998
 epoch: 79, train_loss: 1.1793, test_loss: 1.1648, test_f1: 0.3968
 epoch: 80, train_loss: 1.1851, test_loss: 1.1631, test_f1: 0.3993
 epoch: 81, train_loss: 1.1724, test_loss: 1.1642, test_f1: 0.3975
 epoch: 82, train_loss: 1.1685, test_loss: 1.1619, test_f1: 0.3941
 epoch: 83, train_loss: 1.1725, test_loss: 1.1623, test_f1: 0.3995
 epoch: 84, train_loss: 1.1780, test_loss: 1.1602, test_f1: 0.4048
 epoch: 85, train_loss: 1.1728, test_loss: 1.1610, test_f1: 0.4023
 epoch: 86, train_loss: 1.1711, test_loss: 1.1607, test_f1: 0.3978
 epoch: 87, train_loss: 1.1821, test_loss: 1.1609, test_f1: 0.4012
 epoch: 88, train_loss: 1.1724, test_loss: 1.1586, test_f1: 0.3975
 epoch: 89, train_loss: 1.1713, test_loss: 1.1565, test_f1: 0.3999
 epoch: 90, train_loss: 1.1667, test_loss: 1.1587, test_f1: 0.3959
 epoch: 91, train_loss: 1.1644, test_loss: 1.1595, test_f1: 0.3964
 epoch: 92, train_loss: 1.1668, test_loss: 1.1588, test_f1: 0.3976
 epoch: 93, train_loss: 1.1657, test_loss: 1.1568, test_f1: 0.4109
 epoch: 94, train_loss: 1.1646, test_loss: 1.1573, test_f1: 0.4041
 epoch: 95, train_loss: 1.1675, test_loss: 1.1580, test_f1: 0.3959
 epoch: 96, train_loss: 1.1653, test_loss: 1.1587, test_f1: 0.3996
 epoch: 97, train_loss: 1.1676, test_loss: 1.1551, test_f1: 0.4145
 epoch: 98, train_loss: 1.1692, test_loss: 1.1558, test_f1: 0.4030
 epoch: 99, train_loss: 1.1605, test_loss: 1.1547, test_f1: 0.4038
##################ITERATION #7 ****************************************
 epoch: 0, train_loss: 1.3210, test_loss: 1.3132, test_f1: 0.2274
 epoch: 1, train_loss: 1.3030, test_loss: 1.2968, test_f1: 0.2389
 epoch: 2, train_loss: 1.2822, test_loss: 1.2887, test_f1: 0.2322
 epoch: 3, train_loss: 1.2832, test_loss: 1.2821, test_f1: 0.2442
 epoch: 4, train_loss: 1.2813, test_loss: 1.2746, test_f1: 0.2547
 epoch: 5, train_loss: 1.2803, test_loss: 1.2680, test_f1: 0.2603
 epoch: 6, train_loss: 1.2718, test_loss: 1.2623, test_f1: 0.2810
 epoch: 7, train_loss: 1.2606, test_loss: 1.2570, test_f1: 0.2812
 epoch: 8, train_loss: 1.2705, test_loss: 1.2527, test_f1: 0.2941
 epoch: 9, train_loss: 1.2623, test_loss: 1.2519, test_f1: 0.2863
 epoch: 10, train_loss: 1.2591, test_loss: 1.2473, test_f1: 0.2910
 epoch: 11, train_loss: 1.2522, test_loss: 1.2421, test_f1: 0.2982
 epoch: 12, train_loss: 1.2520, test_loss: 1.2407, test_f1: 0.3060
 epoch: 13, train_loss: 1.2492, test_loss: 1.2354, test_f1: 0.3183
 epoch: 14, train_loss: 1.2386, test_loss: 1.2312, test_f1: 0.3197
 epoch: 15, train_loss: 1.2400, test_loss: 1.2265, test_f1: 0.3378
 epoch: 16, train_loss: 1.2381, test_loss: 1.2216, test_f1: 0.3405
 epoch: 17, train_loss: 1.2347, test_loss: 1.2220, test_f1: 0.3255
 epoch: 18, train_loss: 1.2334, test_loss: 1.2194, test_f1: 0.3204
 epoch: 19, train_loss: 1.2341, test_loss: 1.2127, test_f1: 0.3481
 epoch: 20, train_loss: 1.2254, test_loss: 1.2132, test_f1: 0.3403
 epoch: 21, train_loss: 1.2203, test_loss: 1.2096, test_f1: 0.3446
 epoch: 22, train_loss: 1.2294, test_loss: 1.2043, test_f1: 0.3485
 epoch: 23, train_loss: 1.2203, test_loss: 1.2040, test_f1: 0.3477
 epoch: 24, train_loss: 1.2166, test_loss: 1.1995, test_f1: 0.3472
 epoch: 25, train_loss: 1.2231, test_loss: 1.1971, test_f1: 0.3486
 epoch: 26, train_loss: 1.2150, test_loss: 1.1939, test_f1: 0.3513
 epoch: 27, train_loss: 1.2100, test_loss: 1.1915, test_f1: 0.3459
 epoch: 28, train_loss: 1.2081, test_loss: 1.1890, test_f1: 0.3591
 epoch: 29, train_loss: 1.2068, test_loss: 1.1858, test_f1: 0.3577
 epoch: 30, train_loss: 1.2022, test_loss: 1.1827, test_f1: 0.3499
 epoch: 31, train_loss: 1.2016, test_loss: 1.1800, test_f1: 0.3464
 epoch: 32, train_loss: 1.1992, test_loss: 1.1767, test_f1: 0.3705
 epoch: 33, train_loss: 1.2006, test_loss: 1.1742, test_f1: 0.3409
 epoch: 34, train_loss: 1.1921, test_loss: 1.1760, test_f1: 0.3448
 epoch: 35, train_loss: 1.1972, test_loss: 1.1684, test_f1: 0.3512
 epoch: 36, train_loss: 1.1845, test_loss: 1.1666, test_f1: 0.3732
 epoch: 37, train_loss: 1.1897, test_loss: 1.1625, test_f1: 0.3594
 epoch: 38, train_loss: 1.1861, test_loss: 1.1585, test_f1: 0.3523
 epoch: 39, train_loss: 1.1834, test_loss: 1.1586, test_f1: 0.3517
 epoch: 40, train_loss: 1.1770, test_loss: 1.1527, test_f1: 0.3662
 epoch: 41, train_loss: 1.1767, test_loss: 1.1504, test_f1: 0.3656
 epoch: 42, train_loss: 1.1727, test_loss: 1.1494, test_f1: 0.4099
 epoch: 43, train_loss: 1.1794, test_loss: 1.1458, test_f1: 0.3866
 epoch: 44, train_loss: 1.1678, test_loss: 1.1463, test_f1: 0.3957
 epoch: 45, train_loss: 1.1704, test_loss: 1.1419, test_f1: 0.4224
 epoch: 46, train_loss: 1.1737, test_loss: 1.1404, test_f1: 0.4273
 epoch: 47, train_loss: 1.1648, test_loss: 1.1377, test_f1: 0.4314
 epoch: 48, train_loss: 1.1614, test_loss: 1.1345, test_f1: 0.4138
 epoch: 49, train_loss: 1.1615, test_loss: 1.1345, test_f1: 0.4255
 epoch: 50, train_loss: 1.1597, test_loss: 1.1305, test_f1: 0.4183
 epoch: 51, train_loss: 1.1575, test_loss: 1.1309, test_f1: 0.4187
 epoch: 52, train_loss: 1.1677, test_loss: 1.1291, test_f1: 0.4575
 epoch: 53, train_loss: 1.1602, test_loss: 1.1267, test_f1: 0.4331
 epoch: 54, train_loss: 1.1593, test_loss: 1.1255, test_f1: 0.4248
 epoch: 55, train_loss: 1.1549, test_loss: 1.1261, test_f1: 0.4383
 epoch: 56, train_loss: 1.1584, test_loss: 1.1243, test_f1: 0.4566
 epoch: 57, train_loss: 1.1571, test_loss: 1.1256, test_f1: 0.4260
 epoch: 58, train_loss: 1.1541, test_loss: 1.1255, test_f1: 0.4307
 epoch: 59, train_loss: 1.1502, test_loss: 1.1251, test_f1: 0.4283
 epoch: 60, train_loss: 1.1529, test_loss: 1.1212, test_f1: 0.4510
 epoch: 61, train_loss: 1.1503, test_loss: 1.1191, test_f1: 0.4396
 epoch: 62, train_loss: 1.1457, test_loss: 1.1166, test_f1: 0.4493
 epoch: 63, train_loss: 1.1438, test_loss: 1.1161, test_f1: 0.4331
 epoch: 64, train_loss: 1.1507, test_loss: 1.1163, test_f1: 0.4363
 epoch: 65, train_loss: 1.1487, test_loss: 1.1175, test_f1: 0.4380
 epoch: 66, train_loss: 1.1443, test_loss: 1.1146, test_f1: 0.4566
 epoch: 67, train_loss: 1.1558, test_loss: 1.1114, test_f1: 0.4548
 epoch: 68, train_loss: 1.1449, test_loss: 1.1129, test_f1: 0.4384
 epoch: 69, train_loss: 1.1471, test_loss: 1.1078, test_f1: 0.4515
 epoch: 70, train_loss: 1.1456, test_loss: 1.1119, test_f1: 0.4383
 epoch: 71, train_loss: 1.1374, test_loss: 1.1082, test_f1: 0.4448
 epoch: 72, train_loss: 1.1457, test_loss: 1.1073, test_f1: 0.4595
 epoch: 73, train_loss: 1.1432, test_loss: 1.1071, test_f1: 0.4338
 epoch: 74, train_loss: 1.1375, test_loss: 1.1053, test_f1: 0.4371
 epoch: 75, train_loss: 1.1369, test_loss: 1.1064, test_f1: 0.4636
 epoch: 76, train_loss: 1.1435, test_loss: 1.1051, test_f1: 0.4366
 epoch: 77, train_loss: 1.1407, test_loss: 1.1044, test_f1: 0.4701
 epoch: 78, train_loss: 1.1424, test_loss: 1.1044, test_f1: 0.4734
 epoch: 79, train_loss: 1.1393, test_loss: 1.1029, test_f1: 0.4660
 epoch: 80, train_loss: 1.1429, test_loss: 1.1021, test_f1: 0.4647
 epoch: 81, train_loss: 1.1365, test_loss: 1.1003, test_f1: 0.4633
 epoch: 82, train_loss: 1.1359, test_loss: 1.0995, test_f1: 0.4564
 epoch: 83, train_loss: 1.1408, test_loss: 1.0998, test_f1: 0.4307
 epoch: 84, train_loss: 1.1373, test_loss: 1.0977, test_f1: 0.4709
 epoch: 85, train_loss: 1.1262, test_loss: 1.0976, test_f1: 0.4658
 epoch: 86, train_loss: 1.1315, test_loss: 1.0959, test_f1: 0.4554
 epoch: 87, train_loss: 1.1318, test_loss: 1.0947, test_f1: 0.4574
 epoch: 88, train_loss: 1.1362, test_loss: 1.0963, test_f1: 0.4518
 epoch: 89, train_loss: 1.1317, test_loss: 1.0944, test_f1: 0.4635
 epoch: 90, train_loss: 1.1349, test_loss: 1.0938, test_f1: 0.4823
 epoch: 91, train_loss: 1.1318, test_loss: 1.0937, test_f1: 0.4555
 epoch: 92, train_loss: 1.1289, test_loss: 1.0915, test_f1: 0.4678
 epoch: 93, train_loss: 1.1344, test_loss: 1.0950, test_f1: 0.4713
 epoch: 94, train_loss: 1.1392, test_loss: 1.0891, test_f1: 0.4718
 epoch: 95, train_loss: 1.1235, test_loss: 1.0884, test_f1: 0.4777
 epoch: 96, train_loss: 1.1400, test_loss: 1.0887, test_f1: 0.4793
 epoch: 97, train_loss: 1.1226, test_loss: 1.0921, test_f1: 0.4807
 epoch: 98, train_loss: 1.1333, test_loss: 1.0896, test_f1: 0.4628
 epoch: 99, train_loss: 1.1290, test_loss: 1.0875, test_f1: 0.4843
##################ITERATION #8 ****************************************
 epoch: 0, train_loss: 1.3425, test_loss: 1.3188, test_f1: 0.2582
 epoch: 1, train_loss: 1.3131, test_loss: 1.3007, test_f1: 0.2574
 epoch: 2, train_loss: 1.2982, test_loss: 1.2883, test_f1: 0.2580
 epoch: 3, train_loss: 1.2854, test_loss: 1.2768, test_f1: 0.2569
 epoch: 4, train_loss: 1.2814, test_loss: 1.2643, test_f1: 0.2569
 epoch: 5, train_loss: 1.2703, test_loss: 1.2562, test_f1: 0.2747
 epoch: 6, train_loss: 1.2691, test_loss: 1.2470, test_f1: 0.2778
 epoch: 7, train_loss: 1.2602, test_loss: 1.2398, test_f1: 0.2802
 epoch: 8, train_loss: 1.2583, test_loss: 1.2314, test_f1: 0.2937
 epoch: 9, train_loss: 1.2534, test_loss: 1.2268, test_f1: 0.3054
 epoch: 10, train_loss: 1.2449, test_loss: 1.2148, test_f1: 0.3151
 epoch: 11, train_loss: 1.2388, test_loss: 1.2108, test_f1: 0.3157
 epoch: 12, train_loss: 1.2337, test_loss: 1.2041, test_f1: 0.3224
 epoch: 13, train_loss: 1.2286, test_loss: 1.1999, test_f1: 0.3325
 epoch: 14, train_loss: 1.2270, test_loss: 1.1958, test_f1: 0.3283
 epoch: 15, train_loss: 1.2244, test_loss: 1.1851, test_f1: 0.3223
 epoch: 16, train_loss: 1.2183, test_loss: 1.1785, test_f1: 0.3250
 epoch: 17, train_loss: 1.2168, test_loss: 1.1742, test_f1: 0.3237
 epoch: 18, train_loss: 1.2123, test_loss: 1.1710, test_f1: 0.3238
 epoch: 19, train_loss: 1.2077, test_loss: 1.1658, test_f1: 0.3304
 epoch: 20, train_loss: 1.2061, test_loss: 1.1611, test_f1: 0.3431
 epoch: 21, train_loss: 1.2008, test_loss: 1.1575, test_f1: 0.3530
 epoch: 22, train_loss: 1.1976, test_loss: 1.1509, test_f1: 0.3603
 epoch: 23, train_loss: 1.1907, test_loss: 1.1442, test_f1: 0.3722
 epoch: 24, train_loss: 1.1934, test_loss: 1.1401, test_f1: 0.3759
 epoch: 25, train_loss: 1.1911, test_loss: 1.1362, test_f1: 0.3858
 epoch: 26, train_loss: 1.1841, test_loss: 1.1313, test_f1: 0.3854
 epoch: 27, train_loss: 1.1837, test_loss: 1.1272, test_f1: 0.3914
 epoch: 28, train_loss: 1.1824, test_loss: 1.1237, test_f1: 0.3983
 epoch: 29, train_loss: 1.1772, test_loss: 1.1228, test_f1: 0.4046
 epoch: 30, train_loss: 1.1737, test_loss: 1.1177, test_f1: 0.3918
 epoch: 31, train_loss: 1.1629, test_loss: 1.1137, test_f1: 0.4091
 epoch: 32, train_loss: 1.1590, test_loss: 1.1111, test_f1: 0.4048
 epoch: 33, train_loss: 1.1677, test_loss: 1.1062, test_f1: 0.4224
 epoch: 34, train_loss: 1.1634, test_loss: 1.1014, test_f1: 0.4365
 epoch: 35, train_loss: 1.1598, test_loss: 1.0993, test_f1: 0.4445
 epoch: 36, train_loss: 1.1612, test_loss: 1.0940, test_f1: 0.4368
 epoch: 37, train_loss: 1.1539, test_loss: 1.0920, test_f1: 0.4530
 epoch: 38, train_loss: 1.1519, test_loss: 1.0863, test_f1: 0.4473
 epoch: 39, train_loss: 1.1528, test_loss: 1.0847, test_f1: 0.4465
 epoch: 40, train_loss: 1.1474, test_loss: 1.0820, test_f1: 0.4551
 epoch: 41, train_loss: 1.1501, test_loss: 1.0815, test_f1: 0.4537
 epoch: 42, train_loss: 1.1542, test_loss: 1.0770, test_f1: 0.4595
 epoch: 43, train_loss: 1.1422, test_loss: 1.0711, test_f1: 0.4637
 epoch: 44, train_loss: 1.1456, test_loss: 1.0677, test_f1: 0.4619
 epoch: 45, train_loss: 1.1398, test_loss: 1.0656, test_f1: 0.4689
 epoch: 46, train_loss: 1.1355, test_loss: 1.0624, test_f1: 0.4729
 epoch: 47, train_loss: 1.1307, test_loss: 1.0588, test_f1: 0.4859
 epoch: 48, train_loss: 1.1328, test_loss: 1.0582, test_f1: 0.4671
 epoch: 49, train_loss: 1.1417, test_loss: 1.0567, test_f1: 0.4805
 epoch: 50, train_loss: 1.1429, test_loss: 1.0561, test_f1: 0.4628
 epoch: 51, train_loss: 1.1324, test_loss: 1.0536, test_f1: 0.4606
 epoch: 52, train_loss: 1.1342, test_loss: 1.0513, test_f1: 0.4773
 epoch: 53, train_loss: 1.1271, test_loss: 1.0540, test_f1: 0.4676
 epoch: 54, train_loss: 1.1299, test_loss: 1.0489, test_f1: 0.4660
 epoch: 55, train_loss: 1.1301, test_loss: 1.0500, test_f1: 0.4834
 epoch: 56, train_loss: 1.1236, test_loss: 1.0471, test_f1: 0.4741
 epoch: 57, train_loss: 1.1197, test_loss: 1.0428, test_f1: 0.4763
 epoch: 58, train_loss: 1.1191, test_loss: 1.0443, test_f1: 0.4778
 epoch: 59, train_loss: 1.1143, test_loss: 1.0422, test_f1: 0.4828
 epoch: 60, train_loss: 1.1196, test_loss: 1.0409, test_f1: 0.4864
 epoch: 61, train_loss: 1.1190, test_loss: 1.0397, test_f1: 0.4939
 epoch: 62, train_loss: 1.1100, test_loss: 1.0402, test_f1: 0.4806
 epoch: 63, train_loss: 1.1160, test_loss: 1.0373, test_f1: 0.4739
 epoch: 64, train_loss: 1.1192, test_loss: 1.0375, test_f1: 0.4903
 epoch: 65, train_loss: 1.1192, test_loss: 1.0357, test_f1: 0.4862
 epoch: 66, train_loss: 1.1181, test_loss: 1.0366, test_f1: 0.4701
 epoch: 67, train_loss: 1.1130, test_loss: 1.0323, test_f1: 0.4839
 epoch: 68, train_loss: 1.1076, test_loss: 1.0287, test_f1: 0.4856
 epoch: 69, train_loss: 1.1146, test_loss: 1.0326, test_f1: 0.4879
 epoch: 70, train_loss: 1.1057, test_loss: 1.0300, test_f1: 0.4979
 epoch: 71, train_loss: 1.1063, test_loss: 1.0333, test_f1: 0.4938
 epoch: 72, train_loss: 1.1045, test_loss: 1.0288, test_f1: 0.4806
 epoch: 73, train_loss: 1.1067, test_loss: 1.0261, test_f1: 0.4877
 epoch: 74, train_loss: 1.1126, test_loss: 1.0257, test_f1: 0.4806
 epoch: 75, train_loss: 1.1164, test_loss: 1.0245, test_f1: 0.4944
 epoch: 76, train_loss: 1.1024, test_loss: 1.0247, test_f1: 0.4788
 epoch: 77, train_loss: 1.1074, test_loss: 1.0262, test_f1: 0.4928
 epoch: 78, train_loss: 1.1037, test_loss: 1.0235, test_f1: 0.4964
 epoch: 79, train_loss: 1.1034, test_loss: 1.0184, test_f1: 0.4881
 epoch: 80, train_loss: 1.1074, test_loss: 1.0212, test_f1: 0.4930
 epoch: 81, train_loss: 1.1044, test_loss: 1.0146, test_f1: 0.4884
 epoch: 82, train_loss: 1.1017, test_loss: 1.0185, test_f1: 0.4995
 epoch: 83, train_loss: 1.0994, test_loss: 1.0151, test_f1: 0.4900
 epoch: 84, train_loss: 1.1064, test_loss: 1.0158, test_f1: 0.4935
 epoch: 85, train_loss: 1.1020, test_loss: 1.0159, test_f1: 0.4993
 epoch: 86, train_loss: 1.0926, test_loss: 1.0120, test_f1: 0.4971
 epoch: 87, train_loss: 1.0999, test_loss: 1.0153, test_f1: 0.5005
 epoch: 88, train_loss: 1.0970, test_loss: 1.0159, test_f1: 0.4918
 epoch: 89, train_loss: 1.1021, test_loss: 1.0154, test_f1: 0.4968
 epoch: 90, train_loss: 1.0922, test_loss: 1.0117, test_f1: 0.4936
 epoch: 91, train_loss: 1.0918, test_loss: 1.0084, test_f1: 0.4974
 epoch: 92, train_loss: 1.0948, test_loss: 1.0106, test_f1: 0.4973
 epoch: 93, train_loss: 1.0919, test_loss: 1.0108, test_f1: 0.4944
 epoch: 94, train_loss: 1.0950, test_loss: 1.0107, test_f1: 0.4943
 epoch: 95, train_loss: 1.1016, test_loss: 1.0069, test_f1: 0.4834
 epoch: 96, train_loss: 1.0966, test_loss: 1.0001, test_f1: 0.4910
 epoch: 97, train_loss: 1.0909, test_loss: 1.0073, test_f1: 0.4990
 epoch: 98, train_loss: 1.0982, test_loss: 1.0071, test_f1: 0.4881
 epoch: 99, train_loss: 1.0907, test_loss: 1.0033, test_f1: 0.4936
##################ITERATION #9 ****************************************
 epoch: 0, train_loss: 1.3388, test_loss: 1.3315, test_f1: 0.2589
 epoch: 1, train_loss: 1.3162, test_loss: 1.3232, test_f1: 0.2589
 epoch: 2, train_loss: 1.3074, test_loss: 1.3127, test_f1: 0.2589
 epoch: 3, train_loss: 1.2994, test_loss: 1.3040, test_f1: 0.2589
 epoch: 4, train_loss: 1.2889, test_loss: 1.2975, test_f1: 0.2589
 epoch: 5, train_loss: 1.2806, test_loss: 1.2899, test_f1: 0.2589
 epoch: 6, train_loss: 1.2766, test_loss: 1.2850, test_f1: 0.2589
 epoch: 7, train_loss: 1.2725, test_loss: 1.2806, test_f1: 0.2589
 epoch: 8, train_loss: 1.2678, test_loss: 1.2760, test_f1: 0.2589
 epoch: 9, train_loss: 1.2689, test_loss: 1.2691, test_f1: 0.2543
 epoch: 10, train_loss: 1.2624, test_loss: 1.2652, test_f1: 0.2689
 epoch: 11, train_loss: 1.2624, test_loss: 1.2640, test_f1: 0.2577
 epoch: 12, train_loss: 1.2596, test_loss: 1.2593, test_f1: 0.2675
 epoch: 13, train_loss: 1.2554, test_loss: 1.2570, test_f1: 0.2681
 epoch: 14, train_loss: 1.2531, test_loss: 1.2551, test_f1: 0.2820
 epoch: 15, train_loss: 1.2539, test_loss: 1.2550, test_f1: 0.2831
 epoch: 16, train_loss: 1.2534, test_loss: 1.2507, test_f1: 0.2906
 epoch: 17, train_loss: 1.2493, test_loss: 1.2482, test_f1: 0.2930
 epoch: 18, train_loss: 1.2507, test_loss: 1.2446, test_f1: 0.2773
 epoch: 19, train_loss: 1.2471, test_loss: 1.2410, test_f1: 0.2947
 epoch: 20, train_loss: 1.2458, test_loss: 1.2378, test_f1: 0.3035
 epoch: 21, train_loss: 1.2462, test_loss: 1.2364, test_f1: 0.2889
 epoch: 22, train_loss: 1.2429, test_loss: 1.2388, test_f1: 0.2903
 epoch: 23, train_loss: 1.2435, test_loss: 1.2323, test_f1: 0.2961
 epoch: 24, train_loss: 1.2402, test_loss: 1.2288, test_f1: 0.2998
 epoch: 25, train_loss: 1.2401, test_loss: 1.2276, test_f1: 0.2958
 epoch: 26, train_loss: 1.2401, test_loss: 1.2253, test_f1: 0.3108
 epoch: 27, train_loss: 1.2394, test_loss: 1.2246, test_f1: 0.2932
 epoch: 28, train_loss: 1.2326, test_loss: 1.2233, test_f1: 0.2979
 epoch: 29, train_loss: 1.2289, test_loss: 1.2214, test_f1: 0.3063
 epoch: 30, train_loss: 1.2347, test_loss: 1.2192, test_f1: 0.2979
 epoch: 31, train_loss: 1.2264, test_loss: 1.2151, test_f1: 0.3075
 epoch: 32, train_loss: 1.2311, test_loss: 1.2143, test_f1: 0.3017
 epoch: 33, train_loss: 1.2286, test_loss: 1.2120, test_f1: 0.3015
 epoch: 34, train_loss: 1.2236, test_loss: 1.2089, test_f1: 0.3044
 epoch: 35, train_loss: 1.2294, test_loss: 1.2072, test_f1: 0.3086
 epoch: 36, train_loss: 1.2247, test_loss: 1.2035, test_f1: 0.3105
 epoch: 37, train_loss: 1.2254, test_loss: 1.2058, test_f1: 0.3130
 epoch: 38, train_loss: 1.2234, test_loss: 1.2006, test_f1: 0.3186
 epoch: 39, train_loss: 1.2216, test_loss: 1.1975, test_f1: 0.3287
 epoch: 40, train_loss: 1.2201, test_loss: 1.1967, test_f1: 0.3301
 epoch: 41, train_loss: 1.2185, test_loss: 1.1949, test_f1: 0.3281
 epoch: 42, train_loss: 1.2151, test_loss: 1.1920, test_f1: 0.3258
 epoch: 43, train_loss: 1.2115, test_loss: 1.1898, test_f1: 0.3282
 epoch: 44, train_loss: 1.2138, test_loss: 1.1883, test_f1: 0.3282
 epoch: 45, train_loss: 1.2117, test_loss: 1.1844, test_f1: 0.3282
 epoch: 46, train_loss: 1.2107, test_loss: 1.1835, test_f1: 0.3281
 epoch: 47, train_loss: 1.2008, test_loss: 1.1817, test_f1: 0.3282
 epoch: 48, train_loss: 1.2055, test_loss: 1.1782, test_f1: 0.3319
 epoch: 49, train_loss: 1.2088, test_loss: 1.1814, test_f1: 0.3313
 epoch: 50, train_loss: 1.2080, test_loss: 1.1761, test_f1: 0.3352
 epoch: 51, train_loss: 1.2048, test_loss: 1.1727, test_f1: 0.3333
 epoch: 52, train_loss: 1.2081, test_loss: 1.1736, test_f1: 0.3275
 epoch: 53, train_loss: 1.1994, test_loss: 1.1705, test_f1: 0.3325
 epoch: 54, train_loss: 1.1950, test_loss: 1.1708, test_f1: 0.3313
 epoch: 55, train_loss: 1.2050, test_loss: 1.1680, test_f1: 0.3319
 epoch: 56, train_loss: 1.1996, test_loss: 1.1696, test_f1: 0.3272
 epoch: 57, train_loss: 1.1987, test_loss: 1.1689, test_f1: 0.3310
 epoch: 58, train_loss: 1.2027, test_loss: 1.1701, test_f1: 0.3316
 epoch: 59, train_loss: 1.1971, test_loss: 1.1680, test_f1: 0.3332
 epoch: 60, train_loss: 1.2053, test_loss: 1.1686, test_f1: 0.3332
 epoch: 61, train_loss: 1.1990, test_loss: 1.1666, test_f1: 0.3332
 epoch: 62, train_loss: 1.1968, test_loss: 1.1654, test_f1: 0.3340
 epoch: 63, train_loss: 1.1969, test_loss: 1.1664, test_f1: 0.3345
 epoch: 64, train_loss: 1.1919, test_loss: 1.1647, test_f1: 0.3340
 epoch: 65, train_loss: 1.1939, test_loss: 1.1651, test_f1: 0.3317
 epoch: 66, train_loss: 1.1901, test_loss: 1.1635, test_f1: 0.3351
 epoch: 67, train_loss: 1.1947, test_loss: 1.1643, test_f1: 0.3393
 epoch: 68, train_loss: 1.1967, test_loss: 1.1656, test_f1: 0.3371
 epoch: 69, train_loss: 1.1925, test_loss: 1.1612, test_f1: 0.3394
 epoch: 70, train_loss: 1.1937, test_loss: 1.1610, test_f1: 0.3393
 epoch: 71, train_loss: 1.1944, test_loss: 1.1599, test_f1: 0.3278
 epoch: 72, train_loss: 1.1962, test_loss: 1.1619, test_f1: 0.3246
 epoch: 73, train_loss: 1.1904, test_loss: 1.1626, test_f1: 0.3292
 epoch: 74, train_loss: 1.1841, test_loss: 1.1594, test_f1: 0.3284
 epoch: 75, train_loss: 1.1849, test_loss: 1.1589, test_f1: 0.3326
 epoch: 76, train_loss: 1.1854, test_loss: 1.1575, test_f1: 0.3343
 epoch: 77, train_loss: 1.1852, test_loss: 1.1540, test_f1: 0.3401
 epoch: 78, train_loss: 1.1866, test_loss: 1.1544, test_f1: 0.3367
 epoch: 79, train_loss: 1.1894, test_loss: 1.1515, test_f1: 0.3423
 epoch: 80, train_loss: 1.1828, test_loss: 1.1514, test_f1: 0.3368
 epoch: 81, train_loss: 1.1869, test_loss: 1.1535, test_f1: 0.3433
 epoch: 82, train_loss: 1.1799, test_loss: 1.1536, test_f1: 0.3337
 epoch: 83, train_loss: 1.1856, test_loss: 1.1516, test_f1: 0.3357
 epoch: 84, train_loss: 1.1836, test_loss: 1.1500, test_f1: 0.3323
 epoch: 85, train_loss: 1.1913, test_loss: 1.1489, test_f1: 0.3427
 epoch: 86, train_loss: 1.1804, test_loss: 1.1519, test_f1: 0.3367
 epoch: 87, train_loss: 1.1825, test_loss: 1.1511, test_f1: 0.3404
 epoch: 88, train_loss: 1.1887, test_loss: 1.1476, test_f1: 0.3472
 epoch: 89, train_loss: 1.1839, test_loss: 1.1463, test_f1: 0.3412
 epoch: 90, train_loss: 1.1831, test_loss: 1.1462, test_f1: 0.3522
 epoch: 91, train_loss: 1.1815, test_loss: 1.1472, test_f1: 0.3577
 epoch: 92, train_loss: 1.1838, test_loss: 1.1490, test_f1: 0.3597
 epoch: 93, train_loss: 1.1761, test_loss: 1.1442, test_f1: 0.3521
 epoch: 94, train_loss: 1.1798, test_loss: 1.1431, test_f1: 0.3592
 epoch: 95, train_loss: 1.1773, test_loss: 1.1432, test_f1: 0.3562
 epoch: 96, train_loss: 1.1784, test_loss: 1.1405, test_f1: 0.3528
 epoch: 97, train_loss: 1.1761, test_loss: 1.1444, test_f1: 0.3663
 epoch: 98, train_loss: 1.1771, test_loss: 1.1403, test_f1: 0.3620
 epoch: 99, train_loss: 1.1783, test_loss: 1.1398, test_f1: 0.3636

Training completed in 610.88 seconds
Best F1: 0.5005 at epoch 87
Mean F1 across iterations: 0.4109  0.0511
========================FINAL RESULTS================================
FEGIN weighted F1: 0.5005  0.0511
python main.py --data ltspice_examples --representation component_component --model FEGIN --layers 3 --hiddens 16 --batch_size 64 --lr 0.0001 --emb_size 512 --epochs 100 --save_appendix component_component_L3_H16_BS64_LR0.0001_E512 --no_val
-----



STDERR:
  File "main.py", line 370, in <module>
    main()
  File "main.py", line 254, in main
    dataset = dataset_class(
  File "/home/philip/projects/ltspice_examples_code_repo/Circuit-Completion-Using-GNNs/component_classification_with_link_prediction_head/evaluation/FEGIN/kernel/circuit_datasets.py", line 15, in __init__
    self.data, self.slices = torch.load(self.processed_paths[0])
  File "/home/philip/.local/lib/python3.8/site-packages/torch/serialization.py", line 1040, in load
    warnings.warn(
  File "/usr/lib/python3.8/warnings.py", line 109, in _showwarnmsg
    sw(msg.message, msg.category, msg.filename, msg.lineno,
  File "main.py", line 47, in warn_with_traceback
    traceback.print_stack(file=log)
/home/philip/projects/ltspice_examples_code_repo/Circuit-Completion-Using-GNNs/component_classification_with_link_prediction_head/evaluation/FEGIN/kernel/circuit_datasets.py:15: FutureWarning: You are using `torch.load` with `weights_only=False` (the current default value), which uses the default pickle module implicitly. It is possible to construct malicious pickle data which will execute arbitrary code during unpickling (See https://github.com/pytorch/pytorch/blob/main/SECURITY.md#untrusted-models for more details). In a future release, the default value for `weights_only` will be flipped to `True`. This limits the functions that could be executed during unpickling. Arbitrary objects will no longer be allowed to be loaded via this mode unless they are explicitly allowlisted by the user via `torch.serialization.add_safe_globals`. We recommend you start setting `weights_only=True` for any use case where you don't have full control of the loaded file. Please open an issue on GitHub for any issues related to this experimental feature.
  self.data, self.slices = torch.load(self.processed_paths[0])
