STDOUT:
Results will be saved in /home/philip/projects/ltspice_examples_code_repo/Circuit-Completion-Using-GNNs/component_classification_with_link_prediction_head/evaluation/FEGIN/results/model_FEGIN_dataset_ltspice_demos
Command line input: python main.py --data ltspice_demos --representation component_component --model FEGIN --layers 5 --hiddens 128 --batch_size 256 --lr 0.0001 --emb_size 250 --epochs 100 --save_appendix component_component_L5_H128_BS256_LR0.0001_E250 --no_val
 is saved.
-----
ltspice_demos - FEGIN
Using 5 layers, 128 hidden units, h = 2
Loading component_component representation dataset
ENTERED
Training FEGIN on component_component representation
Train: 1565, Test: 383
##################ITERATION #0 ****************************************
 epoch: 0, train_loss: 1.3924, test_loss: 1.3877, test_f1: 0.1365
 epoch: 1, train_loss: 1.3794, test_loss: 1.3829, test_f1: 0.1365
 epoch: 2, train_loss: 1.3718, test_loss: 1.3786, test_f1: 0.1365
 epoch: 3, train_loss: 1.3643, test_loss: 1.3738, test_f1: 0.1365
 epoch: 4, train_loss: 1.3567, test_loss: 1.3675, test_f1: 0.1365
 epoch: 5, train_loss: 1.3475, test_loss: 1.3605, test_f1: 0.1420
 epoch: 6, train_loss: 1.3382, test_loss: 1.3518, test_f1: 0.1640
 epoch: 7, train_loss: 1.3277, test_loss: 1.3424, test_f1: 0.2590
 epoch: 8, train_loss: 1.3155, test_loss: 1.3333, test_f1: 0.3223
 epoch: 9, train_loss: 1.3031, test_loss: 1.3241, test_f1: 0.3310
 epoch: 10, train_loss: 1.2886, test_loss: 1.3151, test_f1: 0.3361
 epoch: 11, train_loss: 1.2762, test_loss: 1.3060, test_f1: 0.3301
 epoch: 12, train_loss: 1.2588, test_loss: 1.2973, test_f1: 0.3368
 epoch: 13, train_loss: 1.2428, test_loss: 1.2873, test_f1: 0.3489
 epoch: 14, train_loss: 1.2266, test_loss: 1.2775, test_f1: 0.3702
 epoch: 15, train_loss: 1.2113, test_loss: 1.2687, test_f1: 0.3708
 epoch: 16, train_loss: 1.1987, test_loss: 1.2591, test_f1: 0.3741
 epoch: 17, train_loss: 1.1864, test_loss: 1.2504, test_f1: 0.3793
 epoch: 18, train_loss: 1.1706, test_loss: 1.2464, test_f1: 0.3829
 epoch: 19, train_loss: 1.1601, test_loss: 1.2427, test_f1: 0.4063
 epoch: 20, train_loss: 1.1513, test_loss: 1.2302, test_f1: 0.4267
 epoch: 21, train_loss: 1.1368, test_loss: 1.2248, test_f1: 0.4326
 epoch: 22, train_loss: 1.1252, test_loss: 1.2184, test_f1: 0.4318
 epoch: 23, train_loss: 1.1203, test_loss: 1.2119, test_f1: 0.4444
 epoch: 24, train_loss: 1.1085, test_loss: 1.2052, test_f1: 0.4494
 epoch: 25, train_loss: 1.0998, test_loss: 1.1987, test_f1: 0.4379
 epoch: 26, train_loss: 1.0876, test_loss: 1.1927, test_f1: 0.4496
 epoch: 27, train_loss: 1.0805, test_loss: 1.1947, test_f1: 0.4458
 epoch: 28, train_loss: 1.0696, test_loss: 1.1926, test_f1: 0.4382
 epoch: 29, train_loss: 1.0581, test_loss: 1.1908, test_f1: 0.4501
 epoch: 30, train_loss: 1.0514, test_loss: 1.1863, test_f1: 0.4423
 epoch: 31, train_loss: 1.0375, test_loss: 1.2000, test_f1: 0.4279
 epoch: 32, train_loss: 1.0307, test_loss: 1.1975, test_f1: 0.4415
 epoch: 33, train_loss: 1.0178, test_loss: 1.1966, test_f1: 0.4302
 epoch: 34, train_loss: 1.0167, test_loss: 1.1972, test_f1: 0.4399
 epoch: 35, train_loss: 1.0014, test_loss: 1.2021, test_f1: 0.4420
 epoch: 36, train_loss: 0.9897, test_loss: 1.2169, test_f1: 0.4356
 epoch: 37, train_loss: 0.9865, test_loss: 1.2267, test_f1: 0.4294
 epoch: 38, train_loss: 0.9794, test_loss: 1.2141, test_f1: 0.4335
 epoch: 39, train_loss: 0.9668, test_loss: 1.2194, test_f1: 0.4385
 epoch: 40, train_loss: 0.9570, test_loss: 1.2044, test_f1: 0.4367
 epoch: 41, train_loss: 0.9489, test_loss: 1.1933, test_f1: 0.4475
 epoch: 42, train_loss: 0.9468, test_loss: 1.1987, test_f1: 0.4443
 epoch: 43, train_loss: 0.9406, test_loss: 1.1991, test_f1: 0.4408
 epoch: 44, train_loss: 0.9277, test_loss: 1.2136, test_f1: 0.4341
 epoch: 45, train_loss: 0.9256, test_loss: 1.2111, test_f1: 0.4402
 epoch: 46, train_loss: 0.9149, test_loss: 1.2109, test_f1: 0.4467
 epoch: 47, train_loss: 0.9170, test_loss: 1.1915, test_f1: 0.4611
 epoch: 48, train_loss: 0.9008, test_loss: 1.2302, test_f1: 0.4534
 epoch: 49, train_loss: 0.9021, test_loss: 1.2431, test_f1: 0.4437
 epoch: 50, train_loss: 0.8892, test_loss: 1.2170, test_f1: 0.4594
 epoch: 51, train_loss: 0.8846, test_loss: 1.2067, test_f1: 0.4532
 epoch: 52, train_loss: 0.8769, test_loss: 1.2272, test_f1: 0.4512
 epoch: 53, train_loss: 0.8695, test_loss: 1.2045, test_f1: 0.4690
 epoch: 54, train_loss: 0.8793, test_loss: 1.2197, test_f1: 0.4514
 epoch: 55, train_loss: 0.8664, test_loss: 1.2310, test_f1: 0.4571
 epoch: 56, train_loss: 0.8551, test_loss: 1.2231, test_f1: 0.4508
 epoch: 57, train_loss: 0.8560, test_loss: 1.2180, test_f1: 0.4647
 epoch: 58, train_loss: 0.8555, test_loss: 1.2291, test_f1: 0.4610
 epoch: 59, train_loss: 0.8538, test_loss: 1.2110, test_f1: 0.4718
 epoch: 60, train_loss: 0.8456, test_loss: 1.2240, test_f1: 0.4764
 epoch: 61, train_loss: 0.8472, test_loss: 1.2339, test_f1: 0.5036
 epoch: 62, train_loss: 0.8461, test_loss: 1.2393, test_f1: 0.4957
 epoch: 63, train_loss: 0.8352, test_loss: 1.2353, test_f1: 0.5032
 epoch: 64, train_loss: 0.8448, test_loss: 1.2348, test_f1: 0.4911
 epoch: 65, train_loss: 0.8426, test_loss: 1.2426, test_f1: 0.4949
 epoch: 66, train_loss: 0.8347, test_loss: 1.2506, test_f1: 0.4816
 epoch: 67, train_loss: 0.8271, test_loss: 1.2303, test_f1: 0.5014
 epoch: 68, train_loss: 0.8226, test_loss: 1.2129, test_f1: 0.5115
 epoch: 69, train_loss: 0.8243, test_loss: 1.2160, test_f1: 0.5105
 epoch: 70, train_loss: 0.8286, test_loss: 1.2344, test_f1: 0.4977
 epoch: 71, train_loss: 0.8173, test_loss: 1.2296, test_f1: 0.5037
 epoch: 72, train_loss: 0.8081, test_loss: 1.2286, test_f1: 0.5156
 epoch: 73, train_loss: 0.8137, test_loss: 1.2189, test_f1: 0.5159
 epoch: 74, train_loss: 0.8063, test_loss: 1.2196, test_f1: 0.5151
 epoch: 75, train_loss: 0.8062, test_loss: 1.2425, test_f1: 0.5102
 epoch: 76, train_loss: 0.7985, test_loss: 1.1985, test_f1: 0.5258
 epoch: 77, train_loss: 0.8052, test_loss: 1.1864, test_f1: 0.5268
 epoch: 78, train_loss: 0.8020, test_loss: 1.2043, test_f1: 0.5150
 epoch: 79, train_loss: 0.8034, test_loss: 1.2219, test_f1: 0.5179
 epoch: 80, train_loss: 0.7933, test_loss: 1.1999, test_f1: 0.5354
 epoch: 81, train_loss: 0.8029, test_loss: 1.2056, test_f1: 0.5449
 epoch: 82, train_loss: 0.7901, test_loss: 1.2491, test_f1: 0.5266
 epoch: 83, train_loss: 0.7888, test_loss: 1.3032, test_f1: 0.5332
 epoch: 84, train_loss: 0.7842, test_loss: 1.3078, test_f1: 0.5255
 epoch: 85, train_loss: 0.7780, test_loss: 1.2828, test_f1: 0.5271
 epoch: 86, train_loss: 0.7827, test_loss: 1.2580, test_f1: 0.5234
 epoch: 87, train_loss: 0.7772, test_loss: 1.2447, test_f1: 0.5153
 epoch: 88, train_loss: 0.7717, test_loss: 1.2524, test_f1: 0.5155
 epoch: 89, train_loss: 0.7626, test_loss: 1.2765, test_f1: 0.5095
 epoch: 90, train_loss: 0.7667, test_loss: 1.2757, test_f1: 0.5135
 epoch: 91, train_loss: 0.7627, test_loss: 1.3004, test_f1: 0.5042
 epoch: 92, train_loss: 0.7664, test_loss: 1.2949, test_f1: 0.5143
 epoch: 93, train_loss: 0.7626, test_loss: 1.2825, test_f1: 0.5326
 epoch: 94, train_loss: 0.7509, test_loss: 1.2792, test_f1: 0.5364
 epoch: 95, train_loss: 0.7433, test_loss: 1.2894, test_f1: 0.5323
 epoch: 96, train_loss: 0.7546, test_loss: 1.2835, test_f1: 0.5218
 epoch: 97, train_loss: 0.7468, test_loss: 1.2761, test_f1: 0.5503
 epoch: 98, train_loss: 0.7605, test_loss: 1.2526, test_f1: 0.5561
 epoch: 99, train_loss: 0.7437, test_loss: 1.2591, test_f1: 0.5542
##################ITERATION #1 ****************************************
 epoch: 0, train_loss: 1.3440, test_loss: 1.3695, test_f1: 0.1836
 epoch: 1, train_loss: 1.3082, test_loss: 1.3592, test_f1: 0.1888
 epoch: 2, train_loss: 1.2908, test_loss: 1.3464, test_f1: 0.3392
 epoch: 3, train_loss: 1.2699, test_loss: 1.3303, test_f1: 0.2610
 epoch: 4, train_loss: 1.2548, test_loss: 1.3158, test_f1: 0.2371
 epoch: 5, train_loss: 1.2383, test_loss: 1.3019, test_f1: 0.2617
 epoch: 6, train_loss: 1.2230, test_loss: 1.2865, test_f1: 0.2779
 epoch: 7, train_loss: 1.2081, test_loss: 1.2770, test_f1: 0.2806
 epoch: 8, train_loss: 1.1980, test_loss: 1.2762, test_f1: 0.2840
 epoch: 9, train_loss: 1.1830, test_loss: 1.2865, test_f1: 0.3165
 epoch: 10, train_loss: 1.1687, test_loss: 1.3252, test_f1: 0.3536
 epoch: 11, train_loss: 1.1625, test_loss: 1.3924, test_f1: 0.4226
 epoch: 12, train_loss: 1.1490, test_loss: 1.4120, test_f1: 0.4202
 epoch: 13, train_loss: 1.1366, test_loss: 1.4325, test_f1: 0.4329
 epoch: 14, train_loss: 1.1283, test_loss: 1.4875, test_f1: 0.4382
 epoch: 15, train_loss: 1.1175, test_loss: 1.6000, test_f1: 0.4448
 epoch: 16, train_loss: 1.1059, test_loss: 1.5530, test_f1: 0.4437
 epoch: 17, train_loss: 1.0926, test_loss: 1.5597, test_f1: 0.4343
 epoch: 18, train_loss: 1.0884, test_loss: 1.6309, test_f1: 0.4419
 epoch: 19, train_loss: 1.0708, test_loss: 1.5354, test_f1: 0.4334
 epoch: 20, train_loss: 1.0625, test_loss: 1.6010, test_f1: 0.4475
 epoch: 21, train_loss: 1.0558, test_loss: 1.7040, test_f1: 0.4500
 epoch: 22, train_loss: 1.0468, test_loss: 1.6702, test_f1: 0.4525
 epoch: 23, train_loss: 1.0348, test_loss: 1.7614, test_f1: 0.4557
 epoch: 24, train_loss: 1.0241, test_loss: 1.7724, test_f1: 0.4567
 epoch: 25, train_loss: 1.0102, test_loss: 1.7419, test_f1: 0.4555
 epoch: 26, train_loss: 1.0023, test_loss: 1.6030, test_f1: 0.4561
 epoch: 27, train_loss: 0.9912, test_loss: 1.6331, test_f1: 0.4589
 epoch: 28, train_loss: 0.9838, test_loss: 1.6209, test_f1: 0.4661
 epoch: 29, train_loss: 0.9791, test_loss: 1.7223, test_f1: 0.4833
 epoch: 30, train_loss: 0.9758, test_loss: 1.7301, test_f1: 0.4761
 epoch: 31, train_loss: 0.9611, test_loss: 1.5856, test_f1: 0.4899
 epoch: 32, train_loss: 0.9540, test_loss: 1.5356, test_f1: 0.5110
 epoch: 33, train_loss: 0.9493, test_loss: 1.6481, test_f1: 0.5030
 epoch: 34, train_loss: 0.9385, test_loss: 1.6976, test_f1: 0.5066
 epoch: 35, train_loss: 0.9272, test_loss: 1.5999, test_f1: 0.5167
 epoch: 36, train_loss: 0.9191, test_loss: 1.6832, test_f1: 0.5222
 epoch: 37, train_loss: 0.9076, test_loss: 1.8491, test_f1: 0.5432
 epoch: 38, train_loss: 0.9108, test_loss: 1.9417, test_f1: 0.5487
 epoch: 39, train_loss: 0.9025, test_loss: 1.8778, test_f1: 0.5473
 epoch: 40, train_loss: 0.8870, test_loss: 1.6816, test_f1: 0.5217
 epoch: 41, train_loss: 0.8852, test_loss: 1.8544, test_f1: 0.5362
 epoch: 42, train_loss: 0.8767, test_loss: 1.9487, test_f1: 0.5145
 epoch: 43, train_loss: 0.8696, test_loss: 2.0009, test_f1: 0.5244
 epoch: 44, train_loss: 0.8661, test_loss: 1.8512, test_f1: 0.5681
 epoch: 45, train_loss: 0.8582, test_loss: 1.8899, test_f1: 0.5218
 epoch: 46, train_loss: 0.8504, test_loss: 1.8928, test_f1: 0.5364
 epoch: 47, train_loss: 0.8437, test_loss: 1.9037, test_f1: 0.5243
 epoch: 48, train_loss: 0.8282, test_loss: 1.8821, test_f1: 0.5257
 epoch: 49, train_loss: 0.8243, test_loss: 1.9680, test_f1: 0.5331
 epoch: 50, train_loss: 0.8255, test_loss: 1.8441, test_f1: 0.5356
 epoch: 51, train_loss: 0.8132, test_loss: 1.9517, test_f1: 0.5542
 epoch: 52, train_loss: 0.8036, test_loss: 2.0259, test_f1: 0.5720
 epoch: 53, train_loss: 0.8016, test_loss: 1.9318, test_f1: 0.5704
 epoch: 54, train_loss: 0.8027, test_loss: 1.9623, test_f1: 0.5542
 epoch: 55, train_loss: 0.7936, test_loss: 1.9691, test_f1: 0.5513
 epoch: 56, train_loss: 0.7878, test_loss: 2.0177, test_f1: 0.5564
 epoch: 57, train_loss: 0.7751, test_loss: 2.0250, test_f1: 0.5592
 epoch: 58, train_loss: 0.7817, test_loss: 2.0634, test_f1: 0.5542
 epoch: 59, train_loss: 0.7781, test_loss: 2.2662, test_f1: 0.5610
 epoch: 60, train_loss: 0.7668, test_loss: 2.3158, test_f1: 0.5519
 epoch: 61, train_loss: 0.7707, test_loss: 2.4476, test_f1: 0.5536
 epoch: 62, train_loss: 0.7651, test_loss: 2.3103, test_f1: 0.5538
 epoch: 63, train_loss: 0.7532, test_loss: 2.3317, test_f1: 0.5646
 epoch: 64, train_loss: 0.7457, test_loss: 2.1758, test_f1: 0.5219
 epoch: 65, train_loss: 0.7613, test_loss: 2.1613, test_f1: 0.5398
 epoch: 66, train_loss: 0.7501, test_loss: 2.0708, test_f1: 0.5653
 epoch: 67, train_loss: 0.7347, test_loss: 2.0630, test_f1: 0.5580
 epoch: 68, train_loss: 0.7457, test_loss: 1.9853, test_f1: 0.5445
 epoch: 69, train_loss: 0.7311, test_loss: 2.0595, test_f1: 0.5371
 epoch: 70, train_loss: 0.7300, test_loss: 2.0905, test_f1: 0.5466
 epoch: 71, train_loss: 0.7369, test_loss: 2.1117, test_f1: 0.5374
 epoch: 72, train_loss: 0.7260, test_loss: 2.3308, test_f1: 0.5283
 epoch: 73, train_loss: 0.7240, test_loss: 2.3595, test_f1: 0.5620
 epoch: 74, train_loss: 0.7144, test_loss: 2.3868, test_f1: 0.5701
 epoch: 75, train_loss: 0.7173, test_loss: 2.1816, test_f1: 0.5602
 epoch: 76, train_loss: 0.7092, test_loss: 2.2308, test_f1: 0.5584
 epoch: 77, train_loss: 0.7060, test_loss: 2.1469, test_f1: 0.5707
 epoch: 78, train_loss: 0.7094, test_loss: 2.1673, test_f1: 0.5695
 epoch: 79, train_loss: 0.7047, test_loss: 2.1302, test_f1: 0.5544
 epoch: 80, train_loss: 0.7064, test_loss: 2.3937, test_f1: 0.5673
 epoch: 81, train_loss: 0.6954, test_loss: 2.2069, test_f1: 0.5618
 epoch: 82, train_loss: 0.6908, test_loss: 2.2853, test_f1: 0.5688
 epoch: 83, train_loss: 0.6891, test_loss: 2.2658, test_f1: 0.5668
 epoch: 84, train_loss: 0.6827, test_loss: 2.4035, test_f1: 0.5479
 epoch: 85, train_loss: 0.6893, test_loss: 2.5111, test_f1: 0.5519
 epoch: 86, train_loss: 0.6802, test_loss: 2.5271, test_f1: 0.5766
 epoch: 87, train_loss: 0.6811, test_loss: 2.6307, test_f1: 0.5609
 epoch: 88, train_loss: 0.6764, test_loss: 2.6158, test_f1: 0.5393
 epoch: 89, train_loss: 0.6778, test_loss: 2.6356, test_f1: 0.5510
 epoch: 90, train_loss: 0.6719, test_loss: 2.3024, test_f1: 0.5598
 epoch: 91, train_loss: 0.6708, test_loss: 2.2844, test_f1: 0.5551
 epoch: 92, train_loss: 0.6616, test_loss: 2.2468, test_f1: 0.5659
 epoch: 93, train_loss: 0.6542, test_loss: 2.1918, test_f1: 0.5557
 epoch: 94, train_loss: 0.6594, test_loss: 2.1389, test_f1: 0.5633
 epoch: 95, train_loss: 0.6460, test_loss: 2.2496, test_f1: 0.5637
 epoch: 96, train_loss: 0.6440, test_loss: 2.3824, test_f1: 0.5725
 epoch: 97, train_loss: 0.6430, test_loss: 2.5841, test_f1: 0.5645
 epoch: 98, train_loss: 0.6435, test_loss: 2.7136, test_f1: 0.5594
 epoch: 99, train_loss: 0.6304, test_loss: 2.5950, test_f1: 0.5626
##################ITERATION #2 ****************************************
 epoch: 0, train_loss: 1.3218, test_loss: 1.3625, test_f1: 0.2014
 epoch: 1, train_loss: 1.2766, test_loss: 1.3529, test_f1: 0.2058
 epoch: 2, train_loss: 1.2507, test_loss: 1.3358, test_f1: 0.3396
 epoch: 3, train_loss: 1.2317, test_loss: 1.3169, test_f1: 0.3037
 epoch: 4, train_loss: 1.2168, test_loss: 1.2992, test_f1: 0.3291
 epoch: 5, train_loss: 1.1949, test_loss: 1.2846, test_f1: 0.3302
 epoch: 6, train_loss: 1.1770, test_loss: 1.2680, test_f1: 0.3510
 epoch: 7, train_loss: 1.1630, test_loss: 1.2488, test_f1: 0.3748
 epoch: 8, train_loss: 1.1456, test_loss: 1.2303, test_f1: 0.4427
 epoch: 9, train_loss: 1.1334, test_loss: 1.2164, test_f1: 0.4818
 epoch: 10, train_loss: 1.1166, test_loss: 1.2091, test_f1: 0.4651
 epoch: 11, train_loss: 1.1070, test_loss: 1.2026, test_f1: 0.4484
 epoch: 12, train_loss: 1.0916, test_loss: 1.1906, test_f1: 0.4547
 epoch: 13, train_loss: 1.0822, test_loss: 1.1868, test_f1: 0.4492
 epoch: 14, train_loss: 1.0707, test_loss: 1.1813, test_f1: 0.4566
 epoch: 15, train_loss: 1.0603, test_loss: 1.1743, test_f1: 0.4584
 epoch: 16, train_loss: 1.0453, test_loss: 1.1737, test_f1: 0.4457
 epoch: 17, train_loss: 1.0335, test_loss: 1.1780, test_f1: 0.4426
 epoch: 18, train_loss: 1.0322, test_loss: 1.1755, test_f1: 0.4501
 epoch: 19, train_loss: 1.0220, test_loss: 1.1757, test_f1: 0.4437
 epoch: 20, train_loss: 1.0102, test_loss: 1.1730, test_f1: 0.4512
 epoch: 21, train_loss: 1.0021, test_loss: 1.1757, test_f1: 0.4636
 epoch: 22, train_loss: 0.9858, test_loss: 1.1799, test_f1: 0.4587
 epoch: 23, train_loss: 0.9832, test_loss: 1.1868, test_f1: 0.4617
 epoch: 24, train_loss: 0.9673, test_loss: 1.1716, test_f1: 0.4812
 epoch: 25, train_loss: 0.9553, test_loss: 1.1561, test_f1: 0.4879
 epoch: 26, train_loss: 0.9530, test_loss: 1.1622, test_f1: 0.4719
 epoch: 27, train_loss: 0.9479, test_loss: 1.1559, test_f1: 0.4665
 epoch: 28, train_loss: 0.9244, test_loss: 1.1770, test_f1: 0.4583
 epoch: 29, train_loss: 0.9243, test_loss: 1.2019, test_f1: 0.4725
 epoch: 30, train_loss: 0.9150, test_loss: 1.1751, test_f1: 0.4839
 epoch: 31, train_loss: 0.9098, test_loss: 1.1720, test_f1: 0.4830
 epoch: 32, train_loss: 0.9110, test_loss: 1.1978, test_f1: 0.4506
 epoch: 33, train_loss: 0.8935, test_loss: 1.1986, test_f1: 0.4763
 epoch: 34, train_loss: 0.8879, test_loss: 1.2075, test_f1: 0.5162
 epoch: 35, train_loss: 0.8813, test_loss: 1.2122, test_f1: 0.4989
 epoch: 36, train_loss: 0.8696, test_loss: 1.2035, test_f1: 0.4895
 epoch: 37, train_loss: 0.8721, test_loss: 1.2053, test_f1: 0.4834
 epoch: 38, train_loss: 0.8575, test_loss: 1.2219, test_f1: 0.5008
 epoch: 39, train_loss: 0.8529, test_loss: 1.2545, test_f1: 0.4996
 epoch: 40, train_loss: 0.8553, test_loss: 1.2687, test_f1: 0.5161
 epoch: 41, train_loss: 0.8451, test_loss: 1.2495, test_f1: 0.5066
 epoch: 42, train_loss: 0.8501, test_loss: 1.2120, test_f1: 0.5205
 epoch: 43, train_loss: 0.8300, test_loss: 1.2385, test_f1: 0.5045
 epoch: 44, train_loss: 0.8365, test_loss: 1.2795, test_f1: 0.5439
 epoch: 45, train_loss: 0.8209, test_loss: 1.2926, test_f1: 0.5180
 epoch: 46, train_loss: 0.8149, test_loss: 1.2742, test_f1: 0.5148
 epoch: 47, train_loss: 0.8157, test_loss: 1.2544, test_f1: 0.5384
 epoch: 48, train_loss: 0.8018, test_loss: 1.2388, test_f1: 0.5154
 epoch: 49, train_loss: 0.7964, test_loss: 1.2621, test_f1: 0.5224
 epoch: 50, train_loss: 0.7868, test_loss: 1.2930, test_f1: 0.5240
 epoch: 51, train_loss: 0.7751, test_loss: 1.2822, test_f1: 0.5472
 epoch: 52, train_loss: 0.7708, test_loss: 1.2819, test_f1: 0.5439
 epoch: 53, train_loss: 0.7718, test_loss: 1.2997, test_f1: 0.5498
 epoch: 54, train_loss: 0.7567, test_loss: 1.2815, test_f1: 0.5482
 epoch: 55, train_loss: 0.7620, test_loss: 1.2769, test_f1: 0.5408
 epoch: 56, train_loss: 0.7638, test_loss: 1.2969, test_f1: 0.5510
 epoch: 57, train_loss: 0.7512, test_loss: 1.2883, test_f1: 0.5613
 epoch: 58, train_loss: 0.7481, test_loss: 1.2584, test_f1: 0.5517
 epoch: 59, train_loss: 0.7490, test_loss: 1.2524, test_f1: 0.5687
 epoch: 60, train_loss: 0.7498, test_loss: 1.2978, test_f1: 0.5540
 epoch: 61, train_loss: 0.7411, test_loss: 1.2692, test_f1: 0.5457
 epoch: 62, train_loss: 0.7345, test_loss: 1.2798, test_f1: 0.5295
 epoch: 63, train_loss: 0.7332, test_loss: 1.2822, test_f1: 0.5319
 epoch: 64, train_loss: 0.7283, test_loss: 1.2718, test_f1: 0.5347
 epoch: 65, train_loss: 0.7287, test_loss: 1.2813, test_f1: 0.5432
 epoch: 66, train_loss: 0.7349, test_loss: 1.2709, test_f1: 0.5519
 epoch: 67, train_loss: 0.7165, test_loss: 1.2906, test_f1: 0.5449
 epoch: 68, train_loss: 0.7208, test_loss: 1.2995, test_f1: 0.5476
 epoch: 69, train_loss: 0.7237, test_loss: 1.3156, test_f1: 0.5521
 epoch: 70, train_loss: 0.7069, test_loss: 1.2988, test_f1: 0.5576
 epoch: 71, train_loss: 0.7027, test_loss: 1.2793, test_f1: 0.5507
 epoch: 72, train_loss: 0.7066, test_loss: 1.2944, test_f1: 0.5677
 epoch: 73, train_loss: 0.6988, test_loss: 1.3193, test_f1: 0.5624
 epoch: 74, train_loss: 0.6920, test_loss: 1.3366, test_f1: 0.5500
 epoch: 75, train_loss: 0.6956, test_loss: 1.2979, test_f1: 0.5425
 epoch: 76, train_loss: 0.6994, test_loss: 1.2970, test_f1: 0.5599
 epoch: 77, train_loss: 0.6841, test_loss: 1.3165, test_f1: 0.5600
 epoch: 78, train_loss: 0.6873, test_loss: 1.3514, test_f1: 0.5432
 epoch: 79, train_loss: 0.6780, test_loss: 1.3653, test_f1: 0.5593
 epoch: 80, train_loss: 0.6812, test_loss: 1.3678, test_f1: 0.5497
 epoch: 81, train_loss: 0.6702, test_loss: 1.3653, test_f1: 0.5390
 epoch: 82, train_loss: 0.6872, test_loss: 1.3719, test_f1: 0.5507
 epoch: 83, train_loss: 0.6738, test_loss: 1.3595, test_f1: 0.5397
 epoch: 84, train_loss: 0.6686, test_loss: 1.3583, test_f1: 0.5501
 epoch: 85, train_loss: 0.6599, test_loss: 1.3750, test_f1: 0.5589
 epoch: 86, train_loss: 0.6635, test_loss: 1.3819, test_f1: 0.5364
 epoch: 87, train_loss: 0.6611, test_loss: 1.3998, test_f1: 0.5450
 epoch: 88, train_loss: 0.6721, test_loss: 1.4263, test_f1: 0.5629
 epoch: 89, train_loss: 0.6589, test_loss: 1.4308, test_f1: 0.5429
 epoch: 90, train_loss: 0.6653, test_loss: 1.4263, test_f1: 0.5266
 epoch: 91, train_loss: 0.6568, test_loss: 1.3915, test_f1: 0.5219
 epoch: 92, train_loss: 0.6529, test_loss: 1.3627, test_f1: 0.5086
 epoch: 93, train_loss: 0.6727, test_loss: 1.3968, test_f1: 0.5140
 epoch: 94, train_loss: 0.6522, test_loss: 1.3907, test_f1: 0.5237
 epoch: 95, train_loss: 0.6464, test_loss: 1.3810, test_f1: 0.5387
 epoch: 96, train_loss: 0.6400, test_loss: 1.3665, test_f1: 0.5621
 epoch: 97, train_loss: 0.6396, test_loss: 1.3651, test_f1: 0.5533
 epoch: 98, train_loss: 0.6342, test_loss: 1.3568, test_f1: 0.5606
 epoch: 99, train_loss: 0.6309, test_loss: 1.3936, test_f1: 0.5683
##################ITERATION #3 ****************************************
 epoch: 0, train_loss: 1.2790, test_loss: 1.3489, test_f1: 0.1377
 epoch: 1, train_loss: 1.2351, test_loss: 1.3331, test_f1: 0.3283
 epoch: 2, train_loss: 1.2164, test_loss: 1.3152, test_f1: 0.3118
 epoch: 3, train_loss: 1.1999, test_loss: 1.3047, test_f1: 0.3257
 epoch: 4, train_loss: 1.1847, test_loss: 1.2921, test_f1: 0.3513
 epoch: 5, train_loss: 1.1641, test_loss: 1.2800, test_f1: 0.3675
 epoch: 6, train_loss: 1.1549, test_loss: 1.2605, test_f1: 0.3674
 epoch: 7, train_loss: 1.1358, test_loss: 1.2500, test_f1: 0.3907
 epoch: 8, train_loss: 1.1307, test_loss: 1.2483, test_f1: 0.4270
 epoch: 9, train_loss: 1.1172, test_loss: 1.2447, test_f1: 0.4258
 epoch: 10, train_loss: 1.1020, test_loss: 1.2453, test_f1: 0.4519
 epoch: 11, train_loss: 1.0995, test_loss: 1.2387, test_f1: 0.4451
 epoch: 12, train_loss: 1.0847, test_loss: 1.2449, test_f1: 0.4547
 epoch: 13, train_loss: 1.0753, test_loss: 1.2513, test_f1: 0.4508
 epoch: 14, train_loss: 1.0679, test_loss: 1.2523, test_f1: 0.4599
 epoch: 15, train_loss: 1.0663, test_loss: 1.2400, test_f1: 0.4493
 epoch: 16, train_loss: 1.0473, test_loss: 1.2301, test_f1: 0.4593
 epoch: 17, train_loss: 1.0377, test_loss: 1.2413, test_f1: 0.4568
 epoch: 18, train_loss: 1.0250, test_loss: 1.2440, test_f1: 0.4709
 epoch: 19, train_loss: 1.0207, test_loss: 1.2514, test_f1: 0.4809
 epoch: 20, train_loss: 1.0140, test_loss: 1.2446, test_f1: 0.4885
 epoch: 21, train_loss: 1.0013, test_loss: 1.2580, test_f1: 0.4988
 epoch: 22, train_loss: 0.9832, test_loss: 1.2800, test_f1: 0.4666
 epoch: 23, train_loss: 0.9815, test_loss: 1.2860, test_f1: 0.4795
 epoch: 24, train_loss: 0.9738, test_loss: 1.3053, test_f1: 0.4797
 epoch: 25, train_loss: 0.9672, test_loss: 1.2787, test_f1: 0.4710
 epoch: 26, train_loss: 0.9578, test_loss: 1.2522, test_f1: 0.4701
 epoch: 27, train_loss: 0.9411, test_loss: 1.2386, test_f1: 0.4720
 epoch: 28, train_loss: 0.9423, test_loss: 1.2539, test_f1: 0.4639
 epoch: 29, train_loss: 0.9409, test_loss: 1.2972, test_f1: 0.4639
 epoch: 30, train_loss: 0.9198, test_loss: 1.3092, test_f1: 0.5102
 epoch: 31, train_loss: 0.9147, test_loss: 1.3365, test_f1: 0.5206
 epoch: 32, train_loss: 0.9120, test_loss: 1.3072, test_f1: 0.5055
 epoch: 33, train_loss: 0.8957, test_loss: 1.3208, test_f1: 0.5000
 epoch: 34, train_loss: 0.8839, test_loss: 1.2920, test_f1: 0.5220
 epoch: 35, train_loss: 0.8826, test_loss: 1.2708, test_f1: 0.5312
 epoch: 36, train_loss: 0.8691, test_loss: 1.3084, test_f1: 0.5431
 epoch: 37, train_loss: 0.8652, test_loss: 1.3345, test_f1: 0.5568
 epoch: 38, train_loss: 0.8536, test_loss: 1.3105, test_f1: 0.5534
 epoch: 39, train_loss: 0.8348, test_loss: 1.2832, test_f1: 0.5450
 epoch: 40, train_loss: 0.8357, test_loss: 1.3190, test_f1: 0.5531
 epoch: 41, train_loss: 0.8293, test_loss: 1.2886, test_f1: 0.5577
 epoch: 42, train_loss: 0.8295, test_loss: 1.2846, test_f1: 0.5520
 epoch: 43, train_loss: 0.8114, test_loss: 1.2767, test_f1: 0.5752
 epoch: 44, train_loss: 0.8014, test_loss: 1.2881, test_f1: 0.5553
 epoch: 45, train_loss: 0.7764, test_loss: 1.3018, test_f1: 0.5588
 epoch: 46, train_loss: 0.7854, test_loss: 1.3144, test_f1: 0.5547
 epoch: 47, train_loss: 0.7758, test_loss: 1.2962, test_f1: 0.5613
 epoch: 48, train_loss: 0.7712, test_loss: 1.3038, test_f1: 0.5606
 epoch: 49, train_loss: 0.7496, test_loss: 1.2946, test_f1: 0.5469
 epoch: 50, train_loss: 0.7601, test_loss: 1.3612, test_f1: 0.5459
 epoch: 51, train_loss: 0.7482, test_loss: 1.3849, test_f1: 0.5575
 epoch: 52, train_loss: 0.7330, test_loss: 1.3886, test_f1: 0.5471
 epoch: 53, train_loss: 0.7397, test_loss: 1.4298, test_f1: 0.5601
 epoch: 54, train_loss: 0.7287, test_loss: 1.4215, test_f1: 0.5425
 epoch: 55, train_loss: 0.7172, test_loss: 1.4193, test_f1: 0.5474
 epoch: 56, train_loss: 0.7202, test_loss: 1.4275, test_f1: 0.5528
 epoch: 57, train_loss: 0.7103, test_loss: 1.4025, test_f1: 0.5504
 epoch: 58, train_loss: 0.6974, test_loss: 1.3769, test_f1: 0.5480
 epoch: 59, train_loss: 0.7115, test_loss: 1.3688, test_f1: 0.5645
 epoch: 60, train_loss: 0.6961, test_loss: 1.3944, test_f1: 0.5645
 epoch: 61, train_loss: 0.6871, test_loss: 1.4272, test_f1: 0.5664
 epoch: 62, train_loss: 0.6878, test_loss: 1.3687, test_f1: 0.5534
 epoch: 63, train_loss: 0.6985, test_loss: 1.3272, test_f1: 0.5758
 epoch: 64, train_loss: 0.6837, test_loss: 1.3270, test_f1: 0.5603
 epoch: 65, train_loss: 0.6790, test_loss: 1.3300, test_f1: 0.5668
 epoch: 66, train_loss: 0.6781, test_loss: 1.3639, test_f1: 0.5597
 epoch: 67, train_loss: 0.6809, test_loss: 1.4209, test_f1: 0.5439
 epoch: 68, train_loss: 0.6699, test_loss: 1.4057, test_f1: 0.5410
 epoch: 69, train_loss: 0.6593, test_loss: 1.4503, test_f1: 0.5480
 epoch: 70, train_loss: 0.6600, test_loss: 1.4555, test_f1: 0.5459
 epoch: 71, train_loss: 0.6527, test_loss: 1.3974, test_f1: 0.5620
 epoch: 72, train_loss: 0.6636, test_loss: 1.3937, test_f1: 0.5540
 epoch: 73, train_loss: 0.6587, test_loss: 1.4397, test_f1: 0.5612
 epoch: 74, train_loss: 0.6351, test_loss: 1.4249, test_f1: 0.5647
 epoch: 75, train_loss: 0.6490, test_loss: 1.4348, test_f1: 0.5582
 epoch: 76, train_loss: 0.6389, test_loss: 1.5081, test_f1: 0.5620
 epoch: 77, train_loss: 0.6503, test_loss: 1.5064, test_f1: 0.5599
 epoch: 78, train_loss: 0.6370, test_loss: 1.5337, test_f1: 0.5414
 epoch: 79, train_loss: 0.6453, test_loss: 1.5437, test_f1: 0.5414
 epoch: 80, train_loss: 0.6303, test_loss: 1.5188, test_f1: 0.5411
 epoch: 81, train_loss: 0.6270, test_loss: 1.5086, test_f1: 0.5397
 epoch: 82, train_loss: 0.6114, test_loss: 1.5215, test_f1: 0.5406
 epoch: 83, train_loss: 0.6167, test_loss: 1.5084, test_f1: 0.5498
 epoch: 84, train_loss: 0.6238, test_loss: 1.5318, test_f1: 0.5488
 epoch: 85, train_loss: 0.6053, test_loss: 1.4731, test_f1: 0.5631
 epoch: 86, train_loss: 0.6032, test_loss: 1.4180, test_f1: 0.5840
 epoch: 87, train_loss: 0.5994, test_loss: 1.4142, test_f1: 0.5864
 epoch: 88, train_loss: 0.5979, test_loss: 1.4060, test_f1: 0.5703
 epoch: 89, train_loss: 0.6030, test_loss: 1.4272, test_f1: 0.5777
 epoch: 90, train_loss: 0.5875, test_loss: 1.4722, test_f1: 0.5701
 epoch: 91, train_loss: 0.5868, test_loss: 1.5199, test_f1: 0.5496
 epoch: 92, train_loss: 0.5941, test_loss: 1.5017, test_f1: 0.5923
 epoch: 93, train_loss: 0.5952, test_loss: 1.4929, test_f1: 0.5809
 epoch: 94, train_loss: 0.5708, test_loss: 1.5129, test_f1: 0.5505
 epoch: 95, train_loss: 0.5831, test_loss: 1.5147, test_f1: 0.5500
 epoch: 96, train_loss: 0.5797, test_loss: 1.5181, test_f1: 0.5511
 epoch: 97, train_loss: 0.5931, test_loss: 1.5546, test_f1: 0.5480
 epoch: 98, train_loss: 0.5872, test_loss: 1.5480, test_f1: 0.5575
 epoch: 99, train_loss: 0.5861, test_loss: 1.4870, test_f1: 0.5675
##################ITERATION #4 ****************************************
 epoch: 0, train_loss: 1.3060, test_loss: 1.3539, test_f1: 0.1365
 epoch: 1, train_loss: 1.2395, test_loss: 1.3410, test_f1: 0.2514
 epoch: 2, train_loss: 1.2184, test_loss: 1.3282, test_f1: 0.3443
 epoch: 3, train_loss: 1.1974, test_loss: 1.3228, test_f1: 0.3109
 epoch: 4, train_loss: 1.1808, test_loss: 1.3128, test_f1: 0.2807
 epoch: 5, train_loss: 1.1718, test_loss: 1.3073, test_f1: 0.3097
 epoch: 6, train_loss: 1.1556, test_loss: 1.2922, test_f1: 0.3152
 epoch: 7, train_loss: 1.1464, test_loss: 1.2948, test_f1: 0.3440
 epoch: 8, train_loss: 1.1359, test_loss: 1.3390, test_f1: 0.3548
 epoch: 9, train_loss: 1.1221, test_loss: 1.3144, test_f1: 0.3722
 epoch: 10, train_loss: 1.1138, test_loss: 1.3120, test_f1: 0.3762
 epoch: 11, train_loss: 1.1105, test_loss: 1.2945, test_f1: 0.3985
 epoch: 12, train_loss: 1.0929, test_loss: 1.2768, test_f1: 0.4285
 epoch: 13, train_loss: 1.0906, test_loss: 1.2951, test_f1: 0.4163
 epoch: 14, train_loss: 1.0837, test_loss: 1.3103, test_f1: 0.4225
 epoch: 15, train_loss: 1.0692, test_loss: 1.2613, test_f1: 0.4331
 epoch: 16, train_loss: 1.0537, test_loss: 1.2346, test_f1: 0.4249
 epoch: 17, train_loss: 1.0484, test_loss: 1.2346, test_f1: 0.4340
 epoch: 18, train_loss: 1.0409, test_loss: 1.2641, test_f1: 0.4212
 epoch: 19, train_loss: 1.0371, test_loss: 1.2346, test_f1: 0.4330
 epoch: 20, train_loss: 1.0304, test_loss: 1.2434, test_f1: 0.4189
 epoch: 21, train_loss: 1.0053, test_loss: 1.3022, test_f1: 0.4275
 epoch: 22, train_loss: 1.0097, test_loss: 1.3315, test_f1: 0.4353
 epoch: 23, train_loss: 0.9959, test_loss: 1.3179, test_f1: 0.4448
 epoch: 24, train_loss: 0.9818, test_loss: 1.3526, test_f1: 0.4656
 epoch: 25, train_loss: 0.9655, test_loss: 1.2975, test_f1: 0.4892
 epoch: 26, train_loss: 0.9680, test_loss: 1.2713, test_f1: 0.4922
 epoch: 27, train_loss: 0.9572, test_loss: 1.2618, test_f1: 0.4842
 epoch: 28, train_loss: 0.9487, test_loss: 1.2228, test_f1: 0.4816
 epoch: 29, train_loss: 0.9353, test_loss: 1.2255, test_f1: 0.4913
 epoch: 30, train_loss: 0.9363, test_loss: 1.2443, test_f1: 0.4905
 epoch: 31, train_loss: 0.9371, test_loss: 1.2726, test_f1: 0.4852
 epoch: 32, train_loss: 0.9179, test_loss: 1.2414, test_f1: 0.5052
 epoch: 33, train_loss: 0.9155, test_loss: 1.2281, test_f1: 0.5095
 epoch: 34, train_loss: 0.9160, test_loss: 1.2683, test_f1: 0.5055
 epoch: 35, train_loss: 0.9037, test_loss: 1.2211, test_f1: 0.5048
 epoch: 36, train_loss: 0.9153, test_loss: 1.2427, test_f1: 0.4997
 epoch: 37, train_loss: 0.8861, test_loss: 1.2609, test_f1: 0.4875
 epoch: 38, train_loss: 0.8926, test_loss: 1.2125, test_f1: 0.5248
 epoch: 39, train_loss: 0.8790, test_loss: 1.2471, test_f1: 0.5205
 epoch: 40, train_loss: 0.8808, test_loss: 1.3122, test_f1: 0.5263
 epoch: 41, train_loss: 0.8628, test_loss: 1.3318, test_f1: 0.5417
 epoch: 42, train_loss: 0.8659, test_loss: 1.3143, test_f1: 0.5462
 epoch: 43, train_loss: 0.8444, test_loss: 1.2808, test_f1: 0.5456
 epoch: 44, train_loss: 0.8394, test_loss: 1.2956, test_f1: 0.5439
 epoch: 45, train_loss: 0.8273, test_loss: 1.3477, test_f1: 0.5342
 epoch: 46, train_loss: 0.8205, test_loss: 1.4002, test_f1: 0.5203
 epoch: 47, train_loss: 0.8135, test_loss: 1.3511, test_f1: 0.5393
 epoch: 48, train_loss: 0.7996, test_loss: 1.3211, test_f1: 0.5310
 epoch: 49, train_loss: 0.7938, test_loss: 1.3916, test_f1: 0.5238
 epoch: 50, train_loss: 0.7954, test_loss: 1.4156, test_f1: 0.5322
 epoch: 51, train_loss: 0.7839, test_loss: 1.4498, test_f1: 0.5398
 epoch: 52, train_loss: 0.7811, test_loss: 1.4889, test_f1: 0.5537
 epoch: 53, train_loss: 0.7758, test_loss: 1.5022, test_f1: 0.5564
 epoch: 54, train_loss: 0.7658, test_loss: 1.4170, test_f1: 0.5635
 epoch: 55, train_loss: 0.7592, test_loss: 1.4591, test_f1: 0.5640
 epoch: 56, train_loss: 0.7553, test_loss: 1.5144, test_f1: 0.5614
 epoch: 57, train_loss: 0.7531, test_loss: 1.5022, test_f1: 0.5638
 epoch: 58, train_loss: 0.7718, test_loss: 1.5964, test_f1: 0.5426
 epoch: 59, train_loss: 0.7622, test_loss: 1.6409, test_f1: 0.5528
 epoch: 60, train_loss: 0.7385, test_loss: 1.6814, test_f1: 0.5508
 epoch: 61, train_loss: 0.7432, test_loss: 1.6771, test_f1: 0.5381
 epoch: 62, train_loss: 0.7380, test_loss: 1.7198, test_f1: 0.5406
 epoch: 63, train_loss: 0.7389, test_loss: 1.6901, test_f1: 0.5562
 epoch: 64, train_loss: 0.7346, test_loss: 1.5977, test_f1: 0.5613
 epoch: 65, train_loss: 0.7383, test_loss: 1.6199, test_f1: 0.5508
 epoch: 66, train_loss: 0.7379, test_loss: 1.5585, test_f1: 0.5534
 epoch: 67, train_loss: 0.7249, test_loss: 1.4971, test_f1: 0.5563
 epoch: 68, train_loss: 0.7315, test_loss: 1.4892, test_f1: 0.5356
 epoch: 69, train_loss: 0.7138, test_loss: 1.5087, test_f1: 0.5189
 epoch: 70, train_loss: 0.7124, test_loss: 1.5907, test_f1: 0.5187
 epoch: 71, train_loss: 0.7198, test_loss: 1.6341, test_f1: 0.5400
 epoch: 72, train_loss: 0.7033, test_loss: 1.6517, test_f1: 0.5458
 epoch: 73, train_loss: 0.7013, test_loss: 1.6774, test_f1: 0.5564
 epoch: 74, train_loss: 0.7071, test_loss: 1.6579, test_f1: 0.5484
 epoch: 75, train_loss: 0.7061, test_loss: 1.7719, test_f1: 0.5513
 epoch: 76, train_loss: 0.7035, test_loss: 1.8308, test_f1: 0.5482
 epoch: 77, train_loss: 0.7127, test_loss: 1.8376, test_f1: 0.5616
 epoch: 78, train_loss: 0.6891, test_loss: 1.8477, test_f1: 0.5772
 epoch: 79, train_loss: 0.6762, test_loss: 1.8290, test_f1: 0.5848
 epoch: 80, train_loss: 0.6924, test_loss: 1.6776, test_f1: 0.5826
 epoch: 81, train_loss: 0.6723, test_loss: 1.7613, test_f1: 0.5643
 epoch: 82, train_loss: 0.6778, test_loss: 1.8731, test_f1: 0.5480
 epoch: 83, train_loss: 0.6891, test_loss: 1.8918, test_f1: 0.5641
 epoch: 84, train_loss: 0.6758, test_loss: 1.8483, test_f1: 0.5588
 epoch: 85, train_loss: 0.6650, test_loss: 1.9222, test_f1: 0.5693
 epoch: 86, train_loss: 0.6595, test_loss: 1.9121, test_f1: 0.5852
 epoch: 87, train_loss: 0.6487, test_loss: 1.9211, test_f1: 0.5596
 epoch: 88, train_loss: 0.6487, test_loss: 1.8731, test_f1: 0.5542
 epoch: 89, train_loss: 0.6455, test_loss: 1.7199, test_f1: 0.5468
 epoch: 90, train_loss: 0.6630, test_loss: 1.8619, test_f1: 0.5545
 epoch: 91, train_loss: 0.6584, test_loss: 1.9160, test_f1: 0.5517
 epoch: 92, train_loss: 0.6586, test_loss: 1.8457, test_f1: 0.5593
 epoch: 93, train_loss: 0.6460, test_loss: 1.8698, test_f1: 0.5593
 epoch: 94, train_loss: 0.6343, test_loss: 1.9227, test_f1: 0.5617
 epoch: 95, train_loss: 0.6351, test_loss: 2.0237, test_f1: 0.5649
 epoch: 96, train_loss: 0.6241, test_loss: 2.0745, test_f1: 0.5777
 epoch: 97, train_loss: 0.6321, test_loss: 2.0767, test_f1: 0.5617
 epoch: 98, train_loss: 0.6175, test_loss: 2.1198, test_f1: 0.5566
 epoch: 99, train_loss: 0.6271, test_loss: 2.1494, test_f1: 0.5620
##################ITERATION #5 ****************************************
 epoch: 0, train_loss: 1.2889, test_loss: 1.3348, test_f1: 0.2310
 epoch: 1, train_loss: 1.2153, test_loss: 1.3240, test_f1: 0.3042
 epoch: 2, train_loss: 1.1857, test_loss: 1.3175, test_f1: 0.2821
 epoch: 3, train_loss: 1.1672, test_loss: 1.3067, test_f1: 0.2836
 epoch: 4, train_loss: 1.1543, test_loss: 1.2931, test_f1: 0.2965
 epoch: 5, train_loss: 1.1410, test_loss: 1.2933, test_f1: 0.3482
 epoch: 6, train_loss: 1.1198, test_loss: 1.2940, test_f1: 0.3867
 epoch: 7, train_loss: 1.1208, test_loss: 1.2861, test_f1: 0.4036
 epoch: 8, train_loss: 1.0981, test_loss: 1.2716, test_f1: 0.4292
 epoch: 9, train_loss: 1.0904, test_loss: 1.2675, test_f1: 0.4512
 epoch: 10, train_loss: 1.0696, test_loss: 1.2411, test_f1: 0.4617
 epoch: 11, train_loss: 1.0719, test_loss: 1.2282, test_f1: 0.4855
 epoch: 12, train_loss: 1.0615, test_loss: 1.2130, test_f1: 0.4759
 epoch: 13, train_loss: 1.0488, test_loss: 1.2145, test_f1: 0.4716
 epoch: 14, train_loss: 1.0365, test_loss: 1.2186, test_f1: 0.4718
 epoch: 15, train_loss: 1.0318, test_loss: 1.2188, test_f1: 0.4927
 epoch: 16, train_loss: 1.0247, test_loss: 1.2145, test_f1: 0.4983
 epoch: 17, train_loss: 1.0132, test_loss: 1.2106, test_f1: 0.4953
 epoch: 18, train_loss: 1.0019, test_loss: 1.2068, test_f1: 0.5007
 epoch: 19, train_loss: 1.0028, test_loss: 1.2191, test_f1: 0.4921
 epoch: 20, train_loss: 0.9895, test_loss: 1.2220, test_f1: 0.4988
 epoch: 21, train_loss: 0.9731, test_loss: 1.2291, test_f1: 0.4898
 epoch: 22, train_loss: 0.9620, test_loss: 1.2333, test_f1: 0.5001
 epoch: 23, train_loss: 0.9642, test_loss: 1.2218, test_f1: 0.5090
 epoch: 24, train_loss: 0.9586, test_loss: 1.2288, test_f1: 0.5157
 epoch: 25, train_loss: 0.9463, test_loss: 1.2391, test_f1: 0.5313
 epoch: 26, train_loss: 0.9466, test_loss: 1.2402, test_f1: 0.5190
 epoch: 27, train_loss: 0.9360, test_loss: 1.2305, test_f1: 0.5470
 epoch: 28, train_loss: 0.9257, test_loss: 1.2224, test_f1: 0.5563
 epoch: 29, train_loss: 0.9237, test_loss: 1.2486, test_f1: 0.5118
 epoch: 30, train_loss: 0.9083, test_loss: 1.2471, test_f1: 0.5085
 epoch: 31, train_loss: 0.9194, test_loss: 1.2600, test_f1: 0.5007
 epoch: 32, train_loss: 0.9018, test_loss: 1.2399, test_f1: 0.5192
 epoch: 33, train_loss: 0.8904, test_loss: 1.2249, test_f1: 0.5239
 epoch: 34, train_loss: 0.8908, test_loss: 1.2252, test_f1: 0.5269
 epoch: 35, train_loss: 0.8843, test_loss: 1.2227, test_f1: 0.5423
 epoch: 36, train_loss: 0.8732, test_loss: 1.2248, test_f1: 0.5286
 epoch: 37, train_loss: 0.8665, test_loss: 1.2203, test_f1: 0.5209
 epoch: 38, train_loss: 0.8641, test_loss: 1.2082, test_f1: 0.5307
 epoch: 39, train_loss: 0.8396, test_loss: 1.2324, test_f1: 0.5259
 epoch: 40, train_loss: 0.8548, test_loss: 1.2417, test_f1: 0.5489
 epoch: 41, train_loss: 0.8372, test_loss: 1.2461, test_f1: 0.5389
 epoch: 42, train_loss: 0.8331, test_loss: 1.2457, test_f1: 0.5454
 epoch: 43, train_loss: 0.8327, test_loss: 1.2702, test_f1: 0.5418
 epoch: 44, train_loss: 0.8124, test_loss: 1.2841, test_f1: 0.5519
 epoch: 45, train_loss: 0.8076, test_loss: 1.2955, test_f1: 0.5357
 epoch: 46, train_loss: 0.8144, test_loss: 1.3057, test_f1: 0.5251
 epoch: 47, train_loss: 0.8067, test_loss: 1.2722, test_f1: 0.5267
 epoch: 48, train_loss: 0.8024, test_loss: 1.2850, test_f1: 0.5433
 epoch: 49, train_loss: 0.7983, test_loss: 1.3039, test_f1: 0.5492
 epoch: 50, train_loss: 0.7857, test_loss: 1.3013, test_f1: 0.5271
 epoch: 51, train_loss: 0.7815, test_loss: 1.2925, test_f1: 0.5432
 epoch: 52, train_loss: 0.7705, test_loss: 1.2802, test_f1: 0.5414
 epoch: 53, train_loss: 0.7737, test_loss: 1.2596, test_f1: 0.5435
 epoch: 54, train_loss: 0.7811, test_loss: 1.2540, test_f1: 0.5436
 epoch: 55, train_loss: 0.7556, test_loss: 1.2589, test_f1: 0.5528
 epoch: 56, train_loss: 0.7751, test_loss: 1.2747, test_f1: 0.5490
 epoch: 57, train_loss: 0.7421, test_loss: 1.3006, test_f1: 0.5663
 epoch: 58, train_loss: 0.7542, test_loss: 1.2967, test_f1: 0.5522
 epoch: 59, train_loss: 0.7516, test_loss: 1.3384, test_f1: 0.5546
 epoch: 60, train_loss: 0.7418, test_loss: 1.3339, test_f1: 0.5346
 epoch: 61, train_loss: 0.7375, test_loss: 1.3206, test_f1: 0.5529
 epoch: 62, train_loss: 0.7437, test_loss: 1.3317, test_f1: 0.5590
 epoch: 63, train_loss: 0.7341, test_loss: 1.3671, test_f1: 0.5585
 epoch: 64, train_loss: 0.7294, test_loss: 1.3717, test_f1: 0.5550
 epoch: 65, train_loss: 0.7308, test_loss: 1.3815, test_f1: 0.5495
 epoch: 66, train_loss: 0.7204, test_loss: 1.3877, test_f1: 0.5630
 epoch: 67, train_loss: 0.7276, test_loss: 1.3636, test_f1: 0.5679
 epoch: 68, train_loss: 0.7271, test_loss: 1.3405, test_f1: 0.5680
 epoch: 69, train_loss: 0.7062, test_loss: 1.3621, test_f1: 0.5597
 epoch: 70, train_loss: 0.7142, test_loss: 1.3871, test_f1: 0.5371
 epoch: 71, train_loss: 0.7071, test_loss: 1.3909, test_f1: 0.5245
 epoch: 72, train_loss: 0.6926, test_loss: 1.3875, test_f1: 0.5461
 epoch: 73, train_loss: 0.6941, test_loss: 1.4135, test_f1: 0.5295
 epoch: 74, train_loss: 0.6874, test_loss: 1.4005, test_f1: 0.5571
 epoch: 75, train_loss: 0.6907, test_loss: 1.4064, test_f1: 0.5506
 epoch: 76, train_loss: 0.6825, test_loss: 1.3779, test_f1: 0.5430
 epoch: 77, train_loss: 0.6879, test_loss: 1.3459, test_f1: 0.5800
 epoch: 78, train_loss: 0.6884, test_loss: 1.3648, test_f1: 0.5507
 epoch: 79, train_loss: 0.6931, test_loss: 1.3882, test_f1: 0.5588
 epoch: 80, train_loss: 0.6753, test_loss: 1.3931, test_f1: 0.5423
 epoch: 81, train_loss: 0.6857, test_loss: 1.3899, test_f1: 0.5319
 epoch: 82, train_loss: 0.6763, test_loss: 1.3629, test_f1: 0.5418
 epoch: 83, train_loss: 0.6726, test_loss: 1.3870, test_f1: 0.5418
 epoch: 84, train_loss: 0.6726, test_loss: 1.4104, test_f1: 0.5158
 epoch: 85, train_loss: 0.6600, test_loss: 1.4401, test_f1: 0.5222
 epoch: 86, train_loss: 0.6684, test_loss: 1.4632, test_f1: 0.5215
 epoch: 87, train_loss: 0.6553, test_loss: 1.4357, test_f1: 0.5224
 epoch: 88, train_loss: 0.6616, test_loss: 1.4366, test_f1: 0.5181
 epoch: 89, train_loss: 0.6602, test_loss: 1.4296, test_f1: 0.5164
 epoch: 90, train_loss: 0.6518, test_loss: 1.4372, test_f1: 0.5224
 epoch: 91, train_loss: 0.6301, test_loss: 1.4495, test_f1: 0.5376
 epoch: 92, train_loss: 0.6594, test_loss: 1.4811, test_f1: 0.5395
 epoch: 93, train_loss: 0.6379, test_loss: 1.4775, test_f1: 0.5427
 epoch: 94, train_loss: 0.6382, test_loss: 1.4122, test_f1: 0.5637
 epoch: 95, train_loss: 0.6507, test_loss: 1.3838, test_f1: 0.5404
 epoch: 96, train_loss: 0.6465, test_loss: 1.4019, test_f1: 0.5464
 epoch: 97, train_loss: 0.6368, test_loss: 1.4418, test_f1: 0.5280
 epoch: 98, train_loss: 0.6439, test_loss: 1.5017, test_f1: 0.5162
 epoch: 99, train_loss: 0.6236, test_loss: 1.5129, test_f1: 0.5209
##################ITERATION #6 ****************************************
 epoch: 0, train_loss: 1.2829, test_loss: 1.3704, test_f1: 0.1365
 epoch: 1, train_loss: 1.2149, test_loss: 1.3446, test_f1: 0.3323
 epoch: 2, train_loss: 1.1852, test_loss: 1.3221, test_f1: 0.3347
 epoch: 3, train_loss: 1.1665, test_loss: 1.3047, test_f1: 0.3401
 epoch: 4, train_loss: 1.1425, test_loss: 1.2978, test_f1: 0.3431
 epoch: 5, train_loss: 1.1295, test_loss: 1.3028, test_f1: 0.3636
 epoch: 6, train_loss: 1.1087, test_loss: 1.3030, test_f1: 0.4162
 epoch: 7, train_loss: 1.1008, test_loss: 1.3082, test_f1: 0.4445
 epoch: 8, train_loss: 1.0842, test_loss: 1.3220, test_f1: 0.4566
 epoch: 9, train_loss: 1.0832, test_loss: 1.2994, test_f1: 0.4577
 epoch: 10, train_loss: 1.0743, test_loss: 1.2888, test_f1: 0.4551
 epoch: 11, train_loss: 1.0638, test_loss: 1.2903, test_f1: 0.4650
 epoch: 12, train_loss: 1.0490, test_loss: 1.2918, test_f1: 0.4683
 epoch: 13, train_loss: 1.0413, test_loss: 1.2852, test_f1: 0.4710
 epoch: 14, train_loss: 1.0351, test_loss: 1.2772, test_f1: 0.4630
 epoch: 15, train_loss: 1.0204, test_loss: 1.2762, test_f1: 0.4695
 epoch: 16, train_loss: 1.0090, test_loss: 1.2886, test_f1: 0.4822
 epoch: 17, train_loss: 1.0029, test_loss: 1.2731, test_f1: 0.4896
 epoch: 18, train_loss: 0.9964, test_loss: 1.2576, test_f1: 0.5054
 epoch: 19, train_loss: 0.9878, test_loss: 1.2619, test_f1: 0.5200
 epoch: 20, train_loss: 0.9694, test_loss: 1.2687, test_f1: 0.5200
 epoch: 21, train_loss: 0.9671, test_loss: 1.2666, test_f1: 0.5162
 epoch: 22, train_loss: 0.9723, test_loss: 1.2796, test_f1: 0.5130
 epoch: 23, train_loss: 0.9535, test_loss: 1.2906, test_f1: 0.5149
 epoch: 24, train_loss: 0.9398, test_loss: 1.3113, test_f1: 0.5087
 epoch: 25, train_loss: 0.9447, test_loss: 1.3010, test_f1: 0.5272
 epoch: 26, train_loss: 0.9197, test_loss: 1.3123, test_f1: 0.5355
 epoch: 27, train_loss: 0.9222, test_loss: 1.3172, test_f1: 0.5348
 epoch: 28, train_loss: 0.9034, test_loss: 1.2914, test_f1: 0.5304
 epoch: 29, train_loss: 0.9094, test_loss: 1.3047, test_f1: 0.5296
 epoch: 30, train_loss: 0.8951, test_loss: 1.3264, test_f1: 0.5369
 epoch: 31, train_loss: 0.8867, test_loss: 1.3664, test_f1: 0.5523
 epoch: 32, train_loss: 0.8731, test_loss: 1.3627, test_f1: 0.5603
 epoch: 33, train_loss: 0.8765, test_loss: 1.3286, test_f1: 0.5491
 epoch: 34, train_loss: 0.8570, test_loss: 1.3249, test_f1: 0.5549
 epoch: 35, train_loss: 0.8622, test_loss: 1.2991, test_f1: 0.5512
 epoch: 36, train_loss: 0.8496, test_loss: 1.3968, test_f1: 0.5683
 epoch: 37, train_loss: 0.8580, test_loss: 1.5231, test_f1: 0.5816
 epoch: 38, train_loss: 0.8531, test_loss: 1.5074, test_f1: 0.5623
 epoch: 39, train_loss: 0.8436, test_loss: 1.3994, test_f1: 0.5717
 epoch: 40, train_loss: 0.8379, test_loss: 1.3997, test_f1: 0.5641
 epoch: 41, train_loss: 0.8106, test_loss: 1.4288, test_f1: 0.5628
 epoch: 42, train_loss: 0.8142, test_loss: 1.4392, test_f1: 0.5625
 epoch: 43, train_loss: 0.8170, test_loss: 1.4426, test_f1: 0.5701
 epoch: 44, train_loss: 0.8000, test_loss: 1.4309, test_f1: 0.5449
 epoch: 45, train_loss: 0.7943, test_loss: 1.4430, test_f1: 0.5278
 epoch: 46, train_loss: 0.8048, test_loss: 1.4332, test_f1: 0.5564
 epoch: 47, train_loss: 0.7820, test_loss: 1.4040, test_f1: 0.5488
 epoch: 48, train_loss: 0.7700, test_loss: 1.3638, test_f1: 0.5543
 epoch: 49, train_loss: 0.7819, test_loss: 1.3513, test_f1: 0.5594
 epoch: 50, train_loss: 0.7758, test_loss: 1.3406, test_f1: 0.5571
 epoch: 51, train_loss: 0.7553, test_loss: 1.3543, test_f1: 0.5638
 epoch: 52, train_loss: 0.7476, test_loss: 1.3902, test_f1: 0.5634
 epoch: 53, train_loss: 0.7440, test_loss: 1.4131, test_f1: 0.5466
 epoch: 54, train_loss: 0.7358, test_loss: 1.4474, test_f1: 0.5464
 epoch: 55, train_loss: 0.7359, test_loss: 1.4513, test_f1: 0.5442
 epoch: 56, train_loss: 0.7221, test_loss: 1.4299, test_f1: 0.5465
 epoch: 57, train_loss: 0.7215, test_loss: 1.4030, test_f1: 0.5565
 epoch: 58, train_loss: 0.7322, test_loss: 1.3945, test_f1: 0.5514
 epoch: 59, train_loss: 0.7312, test_loss: 1.3672, test_f1: 0.5457
 epoch: 60, train_loss: 0.7080, test_loss: 1.4081, test_f1: 0.5525
 epoch: 61, train_loss: 0.7145, test_loss: 1.4259, test_f1: 0.5459
 epoch: 62, train_loss: 0.7093, test_loss: 1.4547, test_f1: 0.5480
 epoch: 63, train_loss: 0.7090, test_loss: 1.4698, test_f1: 0.5564
 epoch: 64, train_loss: 0.7139, test_loss: 1.4672, test_f1: 0.5536
 epoch: 65, train_loss: 0.6951, test_loss: 1.5024, test_f1: 0.5484
 epoch: 66, train_loss: 0.6965, test_loss: 1.5088, test_f1: 0.5461
 epoch: 67, train_loss: 0.6890, test_loss: 1.5248, test_f1: 0.5516
 epoch: 68, train_loss: 0.7060, test_loss: 1.5122, test_f1: 0.5503
 epoch: 69, train_loss: 0.6943, test_loss: 1.4894, test_f1: 0.5344
 epoch: 70, train_loss: 0.6852, test_loss: 1.4780, test_f1: 0.5342
 epoch: 71, train_loss: 0.6764, test_loss: 1.5053, test_f1: 0.5331
 epoch: 72, train_loss: 0.6871, test_loss: 1.5303, test_f1: 0.5535
 epoch: 73, train_loss: 0.6820, test_loss: 1.5342, test_f1: 0.5319
 epoch: 74, train_loss: 0.6730, test_loss: 1.5001, test_f1: 0.5342
 epoch: 75, train_loss: 0.6749, test_loss: 1.5337, test_f1: 0.5310
 epoch: 76, train_loss: 0.7001, test_loss: 1.5417, test_f1: 0.5311
 epoch: 77, train_loss: 0.6841, test_loss: 1.6291, test_f1: 0.5500
 epoch: 78, train_loss: 0.6598, test_loss: 1.5924, test_f1: 0.5416
 epoch: 79, train_loss: 0.6698, test_loss: 1.5677, test_f1: 0.5485
 epoch: 80, train_loss: 0.6644, test_loss: 1.5576, test_f1: 0.5588
 epoch: 81, train_loss: 0.6781, test_loss: 1.5185, test_f1: 0.5625
 epoch: 82, train_loss: 0.6545, test_loss: 1.5887, test_f1: 0.5477
 epoch: 83, train_loss: 0.6593, test_loss: 1.5653, test_f1: 0.5537
 epoch: 84, train_loss: 0.6615, test_loss: 1.5894, test_f1: 0.5387
 epoch: 85, train_loss: 0.6476, test_loss: 1.5663, test_f1: 0.5381
 epoch: 86, train_loss: 0.6410, test_loss: 1.5390, test_f1: 0.5435
 epoch: 87, train_loss: 0.6482, test_loss: 1.4979, test_f1: 0.5495
 epoch: 88, train_loss: 0.6450, test_loss: 1.4897, test_f1: 0.5601
 epoch: 89, train_loss: 0.6426, test_loss: 1.5032, test_f1: 0.5674
 epoch: 90, train_loss: 0.6304, test_loss: 1.5236, test_f1: 0.5521
 epoch: 91, train_loss: 0.6300, test_loss: 1.5402, test_f1: 0.5462
 epoch: 92, train_loss: 0.6308, test_loss: 1.5798, test_f1: 0.5343
 epoch: 93, train_loss: 0.6218, test_loss: 1.6771, test_f1: 0.5425
 epoch: 94, train_loss: 0.6216, test_loss: 1.6700, test_f1: 0.5460
 epoch: 95, train_loss: 0.6063, test_loss: 1.6786, test_f1: 0.5314
 epoch: 96, train_loss: 0.6215, test_loss: 1.6536, test_f1: 0.5327
 epoch: 97, train_loss: 0.6157, test_loss: 1.6152, test_f1: 0.5392
 epoch: 98, train_loss: 0.6190, test_loss: 1.6095, test_f1: 0.5341
 epoch: 99, train_loss: 0.6061, test_loss: 1.6342, test_f1: 0.5260
##################ITERATION #7 ****************************************
 epoch: 0, train_loss: 1.2946, test_loss: 1.3341, test_f1: 0.1687
 epoch: 1, train_loss: 1.2124, test_loss: 1.3206, test_f1: 0.2998
 epoch: 2, train_loss: 1.2032, test_loss: 1.3123, test_f1: 0.3285
 epoch: 3, train_loss: 1.1832, test_loss: 1.3049, test_f1: 0.3321
 epoch: 4, train_loss: 1.1612, test_loss: 1.2854, test_f1: 0.3323
 epoch: 5, train_loss: 1.1475, test_loss: 1.2642, test_f1: 0.3408
 epoch: 6, train_loss: 1.1355, test_loss: 1.2544, test_f1: 0.3774
 epoch: 7, train_loss: 1.1283, test_loss: 1.2471, test_f1: 0.3859
 epoch: 8, train_loss: 1.1118, test_loss: 1.2377, test_f1: 0.4021
 epoch: 9, train_loss: 1.0993, test_loss: 1.2118, test_f1: 0.4168
 epoch: 10, train_loss: 1.0919, test_loss: 1.1973, test_f1: 0.4475
 epoch: 11, train_loss: 1.0844, test_loss: 1.1900, test_f1: 0.4637
 epoch: 12, train_loss: 1.0728, test_loss: 1.1803, test_f1: 0.4536
 epoch: 13, train_loss: 1.0653, test_loss: 1.1791, test_f1: 0.4742
 epoch: 14, train_loss: 1.0472, test_loss: 1.1792, test_f1: 0.4969
 epoch: 15, train_loss: 1.0382, test_loss: 1.1759, test_f1: 0.4939
 epoch: 16, train_loss: 1.0191, test_loss: 1.1738, test_f1: 0.4967
 epoch: 17, train_loss: 1.0171, test_loss: 1.1784, test_f1: 0.4755
 epoch: 18, train_loss: 1.0074, test_loss: 1.1781, test_f1: 0.4895
 epoch: 19, train_loss: 1.0053, test_loss: 1.1630, test_f1: 0.4866
 epoch: 20, train_loss: 0.9987, test_loss: 1.1720, test_f1: 0.4998
 epoch: 21, train_loss: 0.9916, test_loss: 1.1810, test_f1: 0.5191
 epoch: 22, train_loss: 0.9633, test_loss: 1.1863, test_f1: 0.5329
 epoch: 23, train_loss: 0.9771, test_loss: 1.1863, test_f1: 0.5063
 epoch: 24, train_loss: 0.9602, test_loss: 1.1742, test_f1: 0.5139
 epoch: 25, train_loss: 0.9451, test_loss: 1.1582, test_f1: 0.5456
 epoch: 26, train_loss: 0.9453, test_loss: 1.1540, test_f1: 0.5300
 epoch: 27, train_loss: 0.9295, test_loss: 1.1289, test_f1: 0.5414
 epoch: 28, train_loss: 0.9220, test_loss: 1.1328, test_f1: 0.5247
 epoch: 29, train_loss: 0.9141, test_loss: 1.1401, test_f1: 0.5178
 epoch: 30, train_loss: 0.9080, test_loss: 1.1516, test_f1: 0.5152
 epoch: 31, train_loss: 0.9004, test_loss: 1.1416, test_f1: 0.5204
 epoch: 32, train_loss: 0.8883, test_loss: 1.1388, test_f1: 0.5045
 epoch: 33, train_loss: 0.8687, test_loss: 1.1256, test_f1: 0.5117
 epoch: 34, train_loss: 0.8647, test_loss: 1.1376, test_f1: 0.5225
 epoch: 35, train_loss: 0.8586, test_loss: 1.1496, test_f1: 0.5299
 epoch: 36, train_loss: 0.8585, test_loss: 1.1525, test_f1: 0.5232
 epoch: 37, train_loss: 0.8551, test_loss: 1.1335, test_f1: 0.5167
 epoch: 38, train_loss: 0.8471, test_loss: 1.1220, test_f1: 0.5382
 epoch: 39, train_loss: 0.8306, test_loss: 1.1371, test_f1: 0.5459
 epoch: 40, train_loss: 0.8347, test_loss: 1.1472, test_f1: 0.5439
 epoch: 41, train_loss: 0.8183, test_loss: 1.1504, test_f1: 0.5400
 epoch: 42, train_loss: 0.8165, test_loss: 1.1528, test_f1: 0.5202
 epoch: 43, train_loss: 0.7965, test_loss: 1.1483, test_f1: 0.5215
 epoch: 44, train_loss: 0.8037, test_loss: 1.1471, test_f1: 0.5229
 epoch: 45, train_loss: 0.7951, test_loss: 1.1774, test_f1: 0.5235
 epoch: 46, train_loss: 0.7991, test_loss: 1.1996, test_f1: 0.5270
 epoch: 47, train_loss: 0.7849, test_loss: 1.2181, test_f1: 0.5375
 epoch: 48, train_loss: 0.7763, test_loss: 1.1974, test_f1: 0.5443
 epoch: 49, train_loss: 0.7635, test_loss: 1.1841, test_f1: 0.5482
 epoch: 50, train_loss: 0.7681, test_loss: 1.1819, test_f1: 0.5504
 epoch: 51, train_loss: 0.7515, test_loss: 1.1783, test_f1: 0.5555
 epoch: 52, train_loss: 0.7557, test_loss: 1.2086, test_f1: 0.5404
 epoch: 53, train_loss: 0.7360, test_loss: 1.2438, test_f1: 0.5405
 epoch: 54, train_loss: 0.7415, test_loss: 1.2446, test_f1: 0.5302
 epoch: 55, train_loss: 0.7297, test_loss: 1.2269, test_f1: 0.5197
 epoch: 56, train_loss: 0.7262, test_loss: 1.2002, test_f1: 0.5436
 epoch: 57, train_loss: 0.7248, test_loss: 1.2030, test_f1: 0.5451
 epoch: 58, train_loss: 0.7298, test_loss: 1.2178, test_f1: 0.5459
 epoch: 59, train_loss: 0.7441, test_loss: 1.1849, test_f1: 0.5504
 epoch: 60, train_loss: 0.7134, test_loss: 1.2029, test_f1: 0.5327
 epoch: 61, train_loss: 0.7317, test_loss: 1.2190, test_f1: 0.5457
 epoch: 62, train_loss: 0.7083, test_loss: 1.1990, test_f1: 0.5323
 epoch: 63, train_loss: 0.7197, test_loss: 1.2025, test_f1: 0.5360
 epoch: 64, train_loss: 0.7033, test_loss: 1.2226, test_f1: 0.5286
 epoch: 65, train_loss: 0.6942, test_loss: 1.2416, test_f1: 0.5262
 epoch: 66, train_loss: 0.7137, test_loss: 1.2660, test_f1: 0.5375
 epoch: 67, train_loss: 0.6910, test_loss: 1.2538, test_f1: 0.5389
 epoch: 68, train_loss: 0.7000, test_loss: 1.2407, test_f1: 0.5346
 epoch: 69, train_loss: 0.6814, test_loss: 1.2652, test_f1: 0.5455
 epoch: 70, train_loss: 0.6856, test_loss: 1.2575, test_f1: 0.5316
 epoch: 71, train_loss: 0.6810, test_loss: 1.2883, test_f1: 0.5288
 epoch: 72, train_loss: 0.6903, test_loss: 1.3086, test_f1: 0.5240
 epoch: 73, train_loss: 0.6851, test_loss: 1.2561, test_f1: 0.5260
 epoch: 74, train_loss: 0.6907, test_loss: 1.2561, test_f1: 0.5478
 epoch: 75, train_loss: 0.6689, test_loss: 1.2671, test_f1: 0.5312
 epoch: 76, train_loss: 0.6759, test_loss: 1.2341, test_f1: 0.5349
 epoch: 77, train_loss: 0.6787, test_loss: 1.2610, test_f1: 0.5335
 epoch: 78, train_loss: 0.6681, test_loss: 1.2632, test_f1: 0.5395
 epoch: 79, train_loss: 0.6610, test_loss: 1.2790, test_f1: 0.5154
 epoch: 80, train_loss: 0.6512, test_loss: 1.3008, test_f1: 0.4991
 epoch: 81, train_loss: 0.6555, test_loss: 1.2887, test_f1: 0.5135
 epoch: 82, train_loss: 0.6486, test_loss: 1.2883, test_f1: 0.5330
 epoch: 83, train_loss: 0.6565, test_loss: 1.2632, test_f1: 0.5314
 epoch: 84, train_loss: 0.6439, test_loss: 1.2827, test_f1: 0.5302
 epoch: 85, train_loss: 0.6612, test_loss: 1.2726, test_f1: 0.5344
 epoch: 86, train_loss: 0.6418, test_loss: 1.2654, test_f1: 0.5235
 epoch: 87, train_loss: 0.6498, test_loss: 1.2366, test_f1: 0.5423
 epoch: 88, train_loss: 0.6405, test_loss: 1.2589, test_f1: 0.5442
 epoch: 89, train_loss: 0.6315, test_loss: 1.2946, test_f1: 0.5247
 epoch: 90, train_loss: 0.6413, test_loss: 1.3180, test_f1: 0.5343
 epoch: 91, train_loss: 0.6345, test_loss: 1.3174, test_f1: 0.5249
 epoch: 92, train_loss: 0.6283, test_loss: 1.3181, test_f1: 0.5126
 epoch: 93, train_loss: 0.6352, test_loss: 1.3224, test_f1: 0.5039
 epoch: 94, train_loss: 0.6401, test_loss: 1.2872, test_f1: 0.5149
 epoch: 95, train_loss: 0.6092, test_loss: 1.3122, test_f1: 0.5196
 epoch: 96, train_loss: 0.6227, test_loss: 1.3272, test_f1: 0.5248
 epoch: 97, train_loss: 0.6051, test_loss: 1.3272, test_f1: 0.5398
 epoch: 98, train_loss: 0.6088, test_loss: 1.3088, test_f1: 0.5234
 epoch: 99, train_loss: 0.6127, test_loss: 1.3184, test_f1: 0.5242
##################ITERATION #8 ****************************************
 epoch: 0, train_loss: 1.2756, test_loss: 1.3477, test_f1: 0.1365
 epoch: 1, train_loss: 1.1850, test_loss: 1.3265, test_f1: 0.1365
 epoch: 2, train_loss: 1.1645, test_loss: 1.3076, test_f1: 0.3020
 epoch: 3, train_loss: 1.1463, test_loss: 1.2839, test_f1: 0.3411
 epoch: 4, train_loss: 1.1378, test_loss: 1.2685, test_f1: 0.3639
 epoch: 5, train_loss: 1.1133, test_loss: 1.2624, test_f1: 0.3900
 epoch: 6, train_loss: 1.1191, test_loss: 1.2487, test_f1: 0.4178
 epoch: 7, train_loss: 1.1135, test_loss: 1.2470, test_f1: 0.4366
 epoch: 8, train_loss: 1.0952, test_loss: 1.2384, test_f1: 0.4656
 epoch: 9, train_loss: 1.0856, test_loss: 1.2449, test_f1: 0.4817
 epoch: 10, train_loss: 1.0670, test_loss: 1.2505, test_f1: 0.4921
 epoch: 11, train_loss: 1.0669, test_loss: 1.2500, test_f1: 0.4862
 epoch: 12, train_loss: 1.0569, test_loss: 1.2192, test_f1: 0.4757
 epoch: 13, train_loss: 1.0503, test_loss: 1.2083, test_f1: 0.4847
 epoch: 14, train_loss: 1.0441, test_loss: 1.2116, test_f1: 0.4897
 epoch: 15, train_loss: 1.0341, test_loss: 1.2333, test_f1: 0.4976
 epoch: 16, train_loss: 1.0330, test_loss: 1.2392, test_f1: 0.4927
 epoch: 17, train_loss: 1.0169, test_loss: 1.2219, test_f1: 0.5128
 epoch: 18, train_loss: 0.9994, test_loss: 1.2099, test_f1: 0.5259
 epoch: 19, train_loss: 1.0127, test_loss: 1.2111, test_f1: 0.5112
 epoch: 20, train_loss: 0.9905, test_loss: 1.2144, test_f1: 0.5315
 epoch: 21, train_loss: 0.9813, test_loss: 1.2243, test_f1: 0.5403
 epoch: 22, train_loss: 0.9764, test_loss: 1.2355, test_f1: 0.5227
 epoch: 23, train_loss: 0.9691, test_loss: 1.2403, test_f1: 0.5301
 epoch: 24, train_loss: 0.9627, test_loss: 1.2469, test_f1: 0.5197
 epoch: 25, train_loss: 0.9556, test_loss: 1.2157, test_f1: 0.5289
 epoch: 26, train_loss: 0.9476, test_loss: 1.2170, test_f1: 0.5371
 epoch: 27, train_loss: 0.9461, test_loss: 1.2010, test_f1: 0.5337
 epoch: 28, train_loss: 0.9252, test_loss: 1.1960, test_f1: 0.5306
 epoch: 29, train_loss: 0.9267, test_loss: 1.2073, test_f1: 0.5376
 epoch: 30, train_loss: 0.9210, test_loss: 1.2175, test_f1: 0.5395
 epoch: 31, train_loss: 0.9245, test_loss: 1.2170, test_f1: 0.5397
 epoch: 32, train_loss: 0.9103, test_loss: 1.2147, test_f1: 0.5404
 epoch: 33, train_loss: 0.9157, test_loss: 1.2300, test_f1: 0.5540
 epoch: 34, train_loss: 0.8927, test_loss: 1.2477, test_f1: 0.5540
 epoch: 35, train_loss: 0.8869, test_loss: 1.2440, test_f1: 0.5441
 epoch: 36, train_loss: 0.8846, test_loss: 1.2169, test_f1: 0.5323
 epoch: 37, train_loss: 0.8771, test_loss: 1.2098, test_f1: 0.5336
 epoch: 38, train_loss: 0.8668, test_loss: 1.2171, test_f1: 0.5381
 epoch: 39, train_loss: 0.8587, test_loss: 1.2150, test_f1: 0.5419
 epoch: 40, train_loss: 0.8551, test_loss: 1.2335, test_f1: 0.5514
 epoch: 41, train_loss: 0.8522, test_loss: 1.2489, test_f1: 0.5534
 epoch: 42, train_loss: 0.8481, test_loss: 1.2715, test_f1: 0.5704
 epoch: 43, train_loss: 0.8409, test_loss: 1.2979, test_f1: 0.5695
 epoch: 44, train_loss: 0.8224, test_loss: 1.2860, test_f1: 0.5708
 epoch: 45, train_loss: 0.8286, test_loss: 1.2929, test_f1: 0.5621
 epoch: 46, train_loss: 0.8317, test_loss: 1.3107, test_f1: 0.5584
 epoch: 47, train_loss: 0.8023, test_loss: 1.3147, test_f1: 0.5633
 epoch: 48, train_loss: 0.8076, test_loss: 1.3185, test_f1: 0.5457
 epoch: 49, train_loss: 0.7885, test_loss: 1.3148, test_f1: 0.5612
 epoch: 50, train_loss: 0.7950, test_loss: 1.3169, test_f1: 0.5608
 epoch: 51, train_loss: 0.7717, test_loss: 1.3180, test_f1: 0.5615
 epoch: 52, train_loss: 0.7696, test_loss: 1.3143, test_f1: 0.5646
 epoch: 53, train_loss: 0.7681, test_loss: 1.3182, test_f1: 0.5749
 epoch: 54, train_loss: 0.7604, test_loss: 1.3246, test_f1: 0.5673
 epoch: 55, train_loss: 0.7700, test_loss: 1.3462, test_f1: 0.5781
 epoch: 56, train_loss: 0.7601, test_loss: 1.3712, test_f1: 0.5790
 epoch: 57, train_loss: 0.7533, test_loss: 1.3988, test_f1: 0.5805
 epoch: 58, train_loss: 0.7507, test_loss: 1.4156, test_f1: 0.5567
 epoch: 59, train_loss: 0.7436, test_loss: 1.4010, test_f1: 0.5628
 epoch: 60, train_loss: 0.7594, test_loss: 1.3802, test_f1: 0.5601
 epoch: 61, train_loss: 0.7445, test_loss: 1.3757, test_f1: 0.5769
 epoch: 62, train_loss: 0.7425, test_loss: 1.3700, test_f1: 0.5694
 epoch: 63, train_loss: 0.7462, test_loss: 1.3635, test_f1: 0.5786
 epoch: 64, train_loss: 0.7338, test_loss: 1.3241, test_f1: 0.5778
 epoch: 65, train_loss: 0.7242, test_loss: 1.3297, test_f1: 0.5769
 epoch: 66, train_loss: 0.7293, test_loss: 1.3500, test_f1: 0.5737
 epoch: 67, train_loss: 0.7295, test_loss: 1.3596, test_f1: 0.5762
 epoch: 68, train_loss: 0.7355, test_loss: 1.4015, test_f1: 0.5681
 epoch: 69, train_loss: 0.7286, test_loss: 1.3762, test_f1: 0.5735
 epoch: 70, train_loss: 0.7216, test_loss: 1.3954, test_f1: 0.5637
 epoch: 71, train_loss: 0.7152, test_loss: 1.3663, test_f1: 0.5721
 epoch: 72, train_loss: 0.7090, test_loss: 1.3578, test_f1: 0.5797
 epoch: 73, train_loss: 0.7020, test_loss: 1.3537, test_f1: 0.5772
 epoch: 74, train_loss: 0.6996, test_loss: 1.3862, test_f1: 0.5798
 epoch: 75, train_loss: 0.7011, test_loss: 1.4305, test_f1: 0.5893
 epoch: 76, train_loss: 0.6771, test_loss: 1.4167, test_f1: 0.5830
 epoch: 77, train_loss: 0.6972, test_loss: 1.4042, test_f1: 0.5746
 epoch: 78, train_loss: 0.6882, test_loss: 1.3901, test_f1: 0.5794
 epoch: 79, train_loss: 0.6929, test_loss: 1.4126, test_f1: 0.5894
 epoch: 80, train_loss: 0.6873, test_loss: 1.4105, test_f1: 0.5957
 epoch: 81, train_loss: 0.6950, test_loss: 1.4168, test_f1: 0.5820
 epoch: 82, train_loss: 0.6697, test_loss: 1.4472, test_f1: 0.5789
 epoch: 83, train_loss: 0.6777, test_loss: 1.4389, test_f1: 0.5809
 epoch: 84, train_loss: 0.6890, test_loss: 1.4673, test_f1: 0.5887
 epoch: 85, train_loss: 0.6899, test_loss: 1.4567, test_f1: 0.5912
 epoch: 86, train_loss: 0.6556, test_loss: 1.4639, test_f1: 0.5918
 epoch: 87, train_loss: 0.6826, test_loss: 1.4877, test_f1: 0.5837
 epoch: 88, train_loss: 0.6583, test_loss: 1.4584, test_f1: 0.5769
 epoch: 89, train_loss: 0.6687, test_loss: 1.4571, test_f1: 0.5637
 epoch: 90, train_loss: 0.6556, test_loss: 1.4967, test_f1: 0.5977
 epoch: 91, train_loss: 0.6486, test_loss: 1.4956, test_f1: 0.5782
 epoch: 92, train_loss: 0.6506, test_loss: 1.4709, test_f1: 0.5733
 epoch: 93, train_loss: 0.6564, test_loss: 1.4704, test_f1: 0.5735
 epoch: 94, train_loss: 0.6571, test_loss: 1.4712, test_f1: 0.5734
 epoch: 95, train_loss: 0.6584, test_loss: 1.4768, test_f1: 0.5859
 epoch: 96, train_loss: 0.6464, test_loss: 1.4900, test_f1: 0.5884
 epoch: 97, train_loss: 0.6341, test_loss: 1.4390, test_f1: 0.5889
 epoch: 98, train_loss: 0.6452, test_loss: 1.4493, test_f1: 0.5859
 epoch: 99, train_loss: 0.6243, test_loss: 1.4755, test_f1: 0.5902
##################ITERATION #9 ****************************************
 epoch: 0, train_loss: 1.2660, test_loss: 1.3423, test_f1: 0.2242
 epoch: 1, train_loss: 1.1881, test_loss: 1.3284, test_f1: 0.2850
 epoch: 2, train_loss: 1.1717, test_loss: 1.3310, test_f1: 0.3057
 epoch: 3, train_loss: 1.1377, test_loss: 1.3297, test_f1: 0.3080
 epoch: 4, train_loss: 1.1273, test_loss: 1.3135, test_f1: 0.3272
 epoch: 5, train_loss: 1.1072, test_loss: 1.3009, test_f1: 0.3908
 epoch: 6, train_loss: 1.0870, test_loss: 1.2839, test_f1: 0.4023
 epoch: 7, train_loss: 1.0627, test_loss: 1.2553, test_f1: 0.4095
 epoch: 8, train_loss: 1.0556, test_loss: 1.2248, test_f1: 0.4341
 epoch: 9, train_loss: 1.0588, test_loss: 1.2239, test_f1: 0.4339
 epoch: 10, train_loss: 1.0338, test_loss: 1.2292, test_f1: 0.4376
 epoch: 11, train_loss: 1.0289, test_loss: 1.2249, test_f1: 0.4522
 epoch: 12, train_loss: 1.0197, test_loss: 1.2694, test_f1: 0.4583
 epoch: 13, train_loss: 0.9991, test_loss: 1.2875, test_f1: 0.4475
 epoch: 14, train_loss: 0.9847, test_loss: 1.3134, test_f1: 0.4632
 epoch: 15, train_loss: 0.9914, test_loss: 1.3169, test_f1: 0.4834
 epoch: 16, train_loss: 0.9770, test_loss: 1.2986, test_f1: 0.4837
 epoch: 17, train_loss: 0.9690, test_loss: 1.3164, test_f1: 0.4711
 epoch: 18, train_loss: 0.9668, test_loss: 1.3807, test_f1: 0.4560
 epoch: 19, train_loss: 0.9490, test_loss: 1.3889, test_f1: 0.4864
 epoch: 20, train_loss: 0.9486, test_loss: 1.3770, test_f1: 0.5173
 epoch: 21, train_loss: 0.9473, test_loss: 1.4229, test_f1: 0.4980
 epoch: 22, train_loss: 0.9289, test_loss: 1.3973, test_f1: 0.5012
 epoch: 23, train_loss: 0.9420, test_loss: 1.4110, test_f1: 0.5291
 epoch: 24, train_loss: 0.9202, test_loss: 1.4397, test_f1: 0.5295
 epoch: 25, train_loss: 0.9184, test_loss: 1.3874, test_f1: 0.5116
 epoch: 26, train_loss: 0.9080, test_loss: 1.4011, test_f1: 0.5195
 epoch: 27, train_loss: 0.8937, test_loss: 1.3939, test_f1: 0.5179
 epoch: 28, train_loss: 0.8886, test_loss: 1.4258, test_f1: 0.5314
 epoch: 29, train_loss: 0.8730, test_loss: 1.4084, test_f1: 0.5353
 epoch: 30, train_loss: 0.8808, test_loss: 1.3765, test_f1: 0.5353
 epoch: 31, train_loss: 0.8669, test_loss: 1.3697, test_f1: 0.5291
 epoch: 32, train_loss: 0.8647, test_loss: 1.3833, test_f1: 0.5104
 epoch: 33, train_loss: 0.8574, test_loss: 1.4063, test_f1: 0.5149
 epoch: 34, train_loss: 0.8384, test_loss: 1.4158, test_f1: 0.5072
 epoch: 35, train_loss: 0.8411, test_loss: 1.4709, test_f1: 0.5319
 epoch: 36, train_loss: 0.8310, test_loss: 1.4566, test_f1: 0.5320
 epoch: 37, train_loss: 0.8173, test_loss: 1.4904, test_f1: 0.5254
 epoch: 38, train_loss: 0.8091, test_loss: 1.4875, test_f1: 0.5057
 epoch: 39, train_loss: 0.8093, test_loss: 1.4907, test_f1: 0.4983
 epoch: 40, train_loss: 0.8245, test_loss: 1.5256, test_f1: 0.4907
 epoch: 41, train_loss: 0.7700, test_loss: 1.5088, test_f1: 0.5073
 epoch: 42, train_loss: 0.7921, test_loss: 1.5274, test_f1: 0.5046
 epoch: 43, train_loss: 0.7827, test_loss: 1.5018, test_f1: 0.5178
 epoch: 44, train_loss: 0.7727, test_loss: 1.5271, test_f1: 0.5133
 epoch: 45, train_loss: 0.7608, test_loss: 1.5283, test_f1: 0.5030
 epoch: 46, train_loss: 0.7501, test_loss: 1.5995, test_f1: 0.5093
 epoch: 47, train_loss: 0.7471, test_loss: 1.5417, test_f1: 0.5381
 epoch: 48, train_loss: 0.7594, test_loss: 1.5339, test_f1: 0.5590
 epoch: 49, train_loss: 0.7504, test_loss: 1.4707, test_f1: 0.5288
 epoch: 50, train_loss: 0.7418, test_loss: 1.5156, test_f1: 0.5323
 epoch: 51, train_loss: 0.7439, test_loss: 1.4930, test_f1: 0.5236
 epoch: 52, train_loss: 0.7306, test_loss: 1.5684, test_f1: 0.5049
 epoch: 53, train_loss: 0.7174, test_loss: 1.5817, test_f1: 0.5069
 epoch: 54, train_loss: 0.7261, test_loss: 1.6056, test_f1: 0.5174
 epoch: 55, train_loss: 0.7144, test_loss: 1.5590, test_f1: 0.5093
 epoch: 56, train_loss: 0.7130, test_loss: 1.5867, test_f1: 0.5124
 epoch: 57, train_loss: 0.7050, test_loss: 1.5440, test_f1: 0.5061
 epoch: 58, train_loss: 0.6943, test_loss: 1.5981, test_f1: 0.4925
 epoch: 59, train_loss: 0.7002, test_loss: 1.5847, test_f1: 0.4846
 epoch: 60, train_loss: 0.6967, test_loss: 1.5617, test_f1: 0.4894
 epoch: 61, train_loss: 0.6920, test_loss: 1.6168, test_f1: 0.5177
 epoch: 62, train_loss: 0.6796, test_loss: 1.5881, test_f1: 0.5175
 epoch: 63, train_loss: 0.6750, test_loss: 1.6279, test_f1: 0.5100
 epoch: 64, train_loss: 0.6819, test_loss: 1.6236, test_f1: 0.5051
 epoch: 65, train_loss: 0.6768, test_loss: 1.6548, test_f1: 0.4920
 epoch: 66, train_loss: 0.6635, test_loss: 1.6851, test_f1: 0.5003
 epoch: 67, train_loss: 0.6668, test_loss: 1.6619, test_f1: 0.5048
 epoch: 68, train_loss: 0.6660, test_loss: 1.6884, test_f1: 0.4947
 epoch: 69, train_loss: 0.6494, test_loss: 1.7026, test_f1: 0.4886
 epoch: 70, train_loss: 0.6614, test_loss: 1.7528, test_f1: 0.4863
 epoch: 71, train_loss: 0.6695, test_loss: 1.7460, test_f1: 0.5150
 epoch: 72, train_loss: 0.6640, test_loss: 1.7224, test_f1: 0.5149
 epoch: 73, train_loss: 0.6608, test_loss: 1.7008, test_f1: 0.5125
 epoch: 74, train_loss: 0.6482, test_loss: 1.7543, test_f1: 0.4966
 epoch: 75, train_loss: 0.6440, test_loss: 1.7609, test_f1: 0.4980
 epoch: 76, train_loss: 0.6307, test_loss: 1.7185, test_f1: 0.4980
 epoch: 77, train_loss: 0.6310, test_loss: 1.8228, test_f1: 0.4627
 epoch: 78, train_loss: 0.6337, test_loss: 1.8799, test_f1: 0.4634
 epoch: 79, train_loss: 0.6347, test_loss: 1.8606, test_f1: 0.4851
 epoch: 80, train_loss: 0.6304, test_loss: 1.8378, test_f1: 0.4694
 epoch: 81, train_loss: 0.6275, test_loss: 1.8712, test_f1: 0.4754
 epoch: 82, train_loss: 0.6218, test_loss: 1.8301, test_f1: 0.5013
 epoch: 83, train_loss: 0.6359, test_loss: 1.8008, test_f1: 0.5019
 epoch: 84, train_loss: 0.6191, test_loss: 1.8703, test_f1: 0.4821
 epoch: 85, train_loss: 0.6182, test_loss: 1.8913, test_f1: 0.4605
 epoch: 86, train_loss: 0.6198, test_loss: 1.8824, test_f1: 0.4996
 epoch: 87, train_loss: 0.6278, test_loss: 1.8662, test_f1: 0.4948
 epoch: 88, train_loss: 0.6153, test_loss: 1.8904, test_f1: 0.5092
 epoch: 89, train_loss: 0.6051, test_loss: 1.8330, test_f1: 0.5036
 epoch: 90, train_loss: 0.6066, test_loss: 1.8626, test_f1: 0.5037
 epoch: 91, train_loss: 0.6041, test_loss: 1.8536, test_f1: 0.5138
 epoch: 92, train_loss: 0.6014, test_loss: 1.7653, test_f1: 0.5068
 epoch: 93, train_loss: 0.6039, test_loss: 1.8143, test_f1: 0.4953
 epoch: 94, train_loss: 0.5881, test_loss: 1.7537, test_f1: 0.4822
 epoch: 95, train_loss: 0.6026, test_loss: 1.7998, test_f1: 0.4838
 epoch: 96, train_loss: 0.5927, test_loss: 1.8757, test_f1: 0.4920
 epoch: 97, train_loss: 0.5768, test_loss: 1.9338, test_f1: 0.4860
 epoch: 98, train_loss: 0.5970, test_loss: 1.9884, test_f1: 0.4944
 epoch: 99, train_loss: 0.5830, test_loss: 2.0043, test_f1: 0.4811

Training completed in 309.91 seconds
Best F1: 0.5977 at epoch 90
Mean F1 across iterations: 0.5753  0.0142
========================FINAL RESULTS================================
FEGIN weighted F1: 0.5977  0.0142
python main.py --data ltspice_demos --representation component_component --model FEGIN --layers 5 --hiddens 128 --batch_size 256 --lr 0.0001 --emb_size 250 --epochs 100 --save_appendix component_component_L5_H128_BS256_LR0.0001_E250 --no_val
-----



STDERR:
  File "main.py", line 370, in <module>
    main()
  File "main.py", line 254, in main
    dataset = dataset_class(
  File "/home/philip/projects/ltspice_examples_code_repo/Circuit-Completion-Using-GNNs/component_classification_with_link_prediction_head/evaluation/FEGIN/kernel/circuit_datasets.py", line 15, in __init__
    self.data, self.slices = torch.load(self.processed_paths[0])
  File "/home/philip/.local/lib/python3.8/site-packages/torch/serialization.py", line 1040, in load
    warnings.warn(
  File "/usr/lib/python3.8/warnings.py", line 109, in _showwarnmsg
    sw(msg.message, msg.category, msg.filename, msg.lineno,
  File "main.py", line 47, in warn_with_traceback
    traceback.print_stack(file=log)
/home/philip/projects/ltspice_examples_code_repo/Circuit-Completion-Using-GNNs/component_classification_with_link_prediction_head/evaluation/FEGIN/kernel/circuit_datasets.py:15: FutureWarning: You are using `torch.load` with `weights_only=False` (the current default value), which uses the default pickle module implicitly. It is possible to construct malicious pickle data which will execute arbitrary code during unpickling (See https://github.com/pytorch/pytorch/blob/main/SECURITY.md#untrusted-models for more details). In a future release, the default value for `weights_only` will be flipped to `True`. This limits the functions that could be executed during unpickling. Arbitrary objects will no longer be allowed to be loaded via this mode unless they are explicitly allowlisted by the user via `torch.serialization.add_safe_globals`. We recommend you start setting `weights_only=True` for any use case where you don't have full control of the loaded file. Please open an issue on GitHub for any issues related to this experimental feature.
  self.data, self.slices = torch.load(self.processed_paths[0])
