STDOUT:
Results will be saved in /home/philip/projects/ltspice_examples_code_repo/Circuit-Completion-Using-GNNs/component_classification_with_link_prediction_head/evaluation/FEGIN/results/model_FEGIN_dataset_ltspice_examples
Command line input: python main.py --data ltspice_examples --representation component_component --model FEGIN --layers 2 --hiddens 64 --batch_size 128 --lr 0.001 --emb_size 250 --epochs 100 --save_appendix component_component_L2_H64_BS128_LR0.001_E250 --no_val
 is saved.
-----
ltspice_examples - FEGIN
Using 2 layers, 64 hidden units, h = 2
Loading component_component representation dataset
ENTERED
Training FEGIN on component_component representation
Train: 3556, Test: 845
##################ITERATION #0 ****************************************
 epoch: 0, train_loss: 1.3136, test_loss: 1.2542, test_f1: 0.2274
 epoch: 1, train_loss: 1.1971, test_loss: 1.1577, test_f1: 0.3373
 epoch: 2, train_loss: 1.1537, test_loss: 1.1057, test_f1: 0.3602
 epoch: 3, train_loss: 1.1161, test_loss: 1.0659, test_f1: 0.4614
 epoch: 4, train_loss: 1.0843, test_loss: 1.0200, test_f1: 0.4556
 epoch: 5, train_loss: 1.0615, test_loss: 0.9934, test_f1: 0.4941
 epoch: 6, train_loss: 1.0309, test_loss: 1.0089, test_f1: 0.4457
 epoch: 7, train_loss: 0.9982, test_loss: 0.9457, test_f1: 0.5210
 epoch: 8, train_loss: 0.9745, test_loss: 0.9779, test_f1: 0.4553
 epoch: 9, train_loss: 0.9653, test_loss: 0.9520, test_f1: 0.5121
 epoch: 10, train_loss: 0.9433, test_loss: 0.9230, test_f1: 0.5268
 epoch: 11, train_loss: 0.9210, test_loss: 0.9172, test_f1: 0.4997
 epoch: 12, train_loss: 0.9100, test_loss: 0.9176, test_f1: 0.5123
 epoch: 13, train_loss: 0.8846, test_loss: 0.9558, test_f1: 0.4856
 epoch: 14, train_loss: 0.8952, test_loss: 0.9778, test_f1: 0.4824
 epoch: 15, train_loss: 0.8727, test_loss: 0.9176, test_f1: 0.5130
 epoch: 16, train_loss: 0.8649, test_loss: 0.9524, test_f1: 0.5041
 epoch: 17, train_loss: 0.8611, test_loss: 0.9374, test_f1: 0.5369
 epoch: 18, train_loss: 0.8534, test_loss: 1.0370, test_f1: 0.4612
 epoch: 19, train_loss: 0.8405, test_loss: 0.9369, test_f1: 0.5195
 epoch: 20, train_loss: 0.8314, test_loss: 0.9483, test_f1: 0.5453
 epoch: 21, train_loss: 0.8070, test_loss: 0.9771, test_f1: 0.5134
 epoch: 22, train_loss: 0.8147, test_loss: 0.9381, test_f1: 0.5376
 epoch: 23, train_loss: 0.7985, test_loss: 0.9313, test_f1: 0.5294
 epoch: 24, train_loss: 0.7879, test_loss: 0.9853, test_f1: 0.5393
 epoch: 25, train_loss: 0.7801, test_loss: 0.9182, test_f1: 0.5610
 epoch: 26, train_loss: 0.7688, test_loss: 1.0014, test_f1: 0.5274
 epoch: 27, train_loss: 0.7693, test_loss: 0.9946, test_f1: 0.5146
 epoch: 28, train_loss: 0.7506, test_loss: 1.0439, test_f1: 0.5222
 epoch: 29, train_loss: 0.7527, test_loss: 0.9917, test_f1: 0.5324
 epoch: 30, train_loss: 0.7483, test_loss: 1.1085, test_f1: 0.5051
 epoch: 31, train_loss: 0.7407, test_loss: 1.0197, test_f1: 0.5404
 epoch: 32, train_loss: 0.7182, test_loss: 1.0503, test_f1: 0.5173
 epoch: 33, train_loss: 0.7093, test_loss: 1.0926, test_f1: 0.5306
 epoch: 34, train_loss: 0.7083, test_loss: 1.0889, test_f1: 0.5087
 epoch: 35, train_loss: 0.7067, test_loss: 1.1099, test_f1: 0.5262
 epoch: 36, train_loss: 0.7022, test_loss: 1.0784, test_f1: 0.5328
 epoch: 37, train_loss: 0.6886, test_loss: 1.0666, test_f1: 0.5547
 epoch: 38, train_loss: 0.6793, test_loss: 1.0407, test_f1: 0.5400
 epoch: 39, train_loss: 0.6613, test_loss: 1.0392, test_f1: 0.5374
 epoch: 40, train_loss: 0.6538, test_loss: 1.1637, test_f1: 0.5466
 epoch: 41, train_loss: 0.6594, test_loss: 1.0946, test_f1: 0.5272
 epoch: 42, train_loss: 0.6555, test_loss: 1.1386, test_f1: 0.5466
 epoch: 43, train_loss: 0.6494, test_loss: 1.1613, test_f1: 0.5465
 epoch: 44, train_loss: 0.6274, test_loss: 1.0716, test_f1: 0.5781
 epoch: 45, train_loss: 0.6392, test_loss: 1.1341, test_f1: 0.5491
 epoch: 46, train_loss: 0.6212, test_loss: 1.1548, test_f1: 0.5436
 epoch: 47, train_loss: 0.6205, test_loss: 1.1210, test_f1: 0.5679
 epoch: 48, train_loss: 0.6183, test_loss: 1.1862, test_f1: 0.5318
 epoch: 49, train_loss: 0.6171, test_loss: 1.2159, test_f1: 0.5342
 epoch: 50, train_loss: 0.6011, test_loss: 1.1886, test_f1: 0.5583
 epoch: 51, train_loss: 0.5852, test_loss: 1.1750, test_f1: 0.5529
 epoch: 52, train_loss: 0.5603, test_loss: 1.2099, test_f1: 0.5372
 epoch: 53, train_loss: 0.5512, test_loss: 1.1134, test_f1: 0.5707
 epoch: 54, train_loss: 0.5387, test_loss: 1.2304, test_f1: 0.5285
 epoch: 55, train_loss: 0.5508, test_loss: 1.1242, test_f1: 0.5826
 epoch: 56, train_loss: 0.5424, test_loss: 1.1989, test_f1: 0.5674
 epoch: 57, train_loss: 0.5301, test_loss: 1.2094, test_f1: 0.5612
 epoch: 58, train_loss: 0.5283, test_loss: 1.2133, test_f1: 0.5513
 epoch: 59, train_loss: 0.5146, test_loss: 1.2479, test_f1: 0.5323
 epoch: 60, train_loss: 0.5236, test_loss: 1.3013, test_f1: 0.5066
 epoch: 61, train_loss: 0.5148, test_loss: 1.2721, test_f1: 0.5571
 epoch: 62, train_loss: 0.5373, test_loss: 1.2601, test_f1: 0.5510
 epoch: 63, train_loss: 0.5043, test_loss: 1.2807, test_f1: 0.5602
 epoch: 64, train_loss: 0.5152, test_loss: 1.2599, test_f1: 0.5360
 epoch: 65, train_loss: 0.5122, test_loss: 1.2920, test_f1: 0.5779
 epoch: 66, train_loss: 0.5096, test_loss: 1.3010, test_f1: 0.5652
 epoch: 67, train_loss: 0.5057, test_loss: 1.2703, test_f1: 0.5492
 epoch: 68, train_loss: 0.4999, test_loss: 1.3414, test_f1: 0.5289
 epoch: 69, train_loss: 0.4903, test_loss: 1.2561, test_f1: 0.5592
 epoch: 70, train_loss: 0.4948, test_loss: 1.3205, test_f1: 0.5584
 epoch: 71, train_loss: 0.4815, test_loss: 1.2845, test_f1: 0.5385
 epoch: 72, train_loss: 0.4881, test_loss: 1.2998, test_f1: 0.5691
 epoch: 73, train_loss: 0.4910, test_loss: 1.3244, test_f1: 0.5554
 epoch: 74, train_loss: 0.4849, test_loss: 1.3497, test_f1: 0.5595
 epoch: 75, train_loss: 0.4701, test_loss: 1.2907, test_f1: 0.5692
 epoch: 76, train_loss: 0.4743, test_loss: 1.3646, test_f1: 0.5444
 epoch: 77, train_loss: 0.4634, test_loss: 1.3005, test_f1: 0.5432
 epoch: 78, train_loss: 0.4797, test_loss: 1.3289, test_f1: 0.5703
 epoch: 79, train_loss: 0.4534, test_loss: 1.4499, test_f1: 0.5584
 epoch: 80, train_loss: 0.4502, test_loss: 1.3144, test_f1: 0.5785
 epoch: 81, train_loss: 0.4515, test_loss: 1.2904, test_f1: 0.5577
 epoch: 82, train_loss: 0.4509, test_loss: 1.4010, test_f1: 0.5673
 epoch: 83, train_loss: 0.4526, test_loss: 1.3856, test_f1: 0.5565
 epoch: 84, train_loss: 0.4685, test_loss: 1.3549, test_f1: 0.5785
 epoch: 85, train_loss: 0.4609, test_loss: 1.4354, test_f1: 0.5651
 epoch: 86, train_loss: 0.4384, test_loss: 1.4427, test_f1: 0.5497
 epoch: 87, train_loss: 0.4409, test_loss: 1.4454, test_f1: 0.5523
 epoch: 88, train_loss: 0.4339, test_loss: 1.5026, test_f1: 0.5642
 epoch: 89, train_loss: 0.4178, test_loss: 1.4869, test_f1: 0.5389
 epoch: 90, train_loss: 0.4313, test_loss: 1.4647, test_f1: 0.5599
 epoch: 91, train_loss: 0.4461, test_loss: 1.4895, test_f1: 0.5391
 epoch: 92, train_loss: 0.4466, test_loss: 1.4352, test_f1: 0.5482
 epoch: 93, train_loss: 0.4346, test_loss: 1.4405, test_f1: 0.5567
 epoch: 94, train_loss: 0.4442, test_loss: 1.4156, test_f1: 0.5542
 epoch: 95, train_loss: 0.4384, test_loss: 1.4460, test_f1: 0.5700
 epoch: 96, train_loss: 0.4392, test_loss: 1.5008, test_f1: 0.5552
 epoch: 97, train_loss: 0.4235, test_loss: 1.5134, test_f1: 0.5565
 epoch: 98, train_loss: 0.4268, test_loss: 1.5209, test_f1: 0.5602
 epoch: 99, train_loss: 0.4131, test_loss: 1.5181, test_f1: 0.5696
##################ITERATION #1 ****************************************
 epoch: 0, train_loss: 1.2469, test_loss: 1.2438, test_f1: 0.3475
 epoch: 1, train_loss: 1.1329, test_loss: 1.1028, test_f1: 0.4096
 epoch: 2, train_loss: 1.0758, test_loss: 1.0055, test_f1: 0.4426
 epoch: 3, train_loss: 1.0283, test_loss: 1.0150, test_f1: 0.4539
 epoch: 4, train_loss: 1.0050, test_loss: 0.9224, test_f1: 0.5162
 epoch: 5, train_loss: 0.9820, test_loss: 0.9301, test_f1: 0.4760
 epoch: 6, train_loss: 0.9592, test_loss: 1.0002, test_f1: 0.4591
 epoch: 7, train_loss: 0.9358, test_loss: 0.9500, test_f1: 0.4859
 epoch: 8, train_loss: 0.9186, test_loss: 0.9058, test_f1: 0.5031
 epoch: 9, train_loss: 0.9095, test_loss: 0.9876, test_f1: 0.4582
 epoch: 10, train_loss: 0.8787, test_loss: 0.9282, test_f1: 0.4994
 epoch: 11, train_loss: 0.8666, test_loss: 0.9531, test_f1: 0.5113
 epoch: 12, train_loss: 0.8504, test_loss: 0.9601, test_f1: 0.5089
 epoch: 13, train_loss: 0.8426, test_loss: 0.9624, test_f1: 0.5301
 epoch: 14, train_loss: 0.8398, test_loss: 0.9495, test_f1: 0.5373
 epoch: 15, train_loss: 0.8327, test_loss: 0.9737, test_f1: 0.5031
 epoch: 16, train_loss: 0.8137, test_loss: 0.9605, test_f1: 0.5192
 epoch: 17, train_loss: 0.7947, test_loss: 1.0526, test_f1: 0.5165
 epoch: 18, train_loss: 0.7871, test_loss: 0.9817, test_f1: 0.5212
 epoch: 19, train_loss: 0.7653, test_loss: 1.0345, test_f1: 0.4995
 epoch: 20, train_loss: 0.7564, test_loss: 1.0449, test_f1: 0.5065
 epoch: 21, train_loss: 0.7596, test_loss: 1.0484, test_f1: 0.5216
 epoch: 22, train_loss: 0.7416, test_loss: 1.0859, test_f1: 0.4894
 epoch: 23, train_loss: 0.7350, test_loss: 1.0371, test_f1: 0.5282
 epoch: 24, train_loss: 0.7330, test_loss: 1.0812, test_f1: 0.5086
 epoch: 25, train_loss: 0.7236, test_loss: 1.1182, test_f1: 0.5129
 epoch: 26, train_loss: 0.7049, test_loss: 1.1253, test_f1: 0.5283
 epoch: 27, train_loss: 0.7014, test_loss: 1.2194, test_f1: 0.4672
 epoch: 28, train_loss: 0.6988, test_loss: 1.1893, test_f1: 0.5226
 epoch: 29, train_loss: 0.6898, test_loss: 1.2043, test_f1: 0.5060
 epoch: 30, train_loss: 0.6799, test_loss: 1.1779, test_f1: 0.4934
 epoch: 31, train_loss: 0.6696, test_loss: 1.2037, test_f1: 0.5168
 epoch: 32, train_loss: 0.6688, test_loss: 1.1511, test_f1: 0.5396
 epoch: 33, train_loss: 0.6589, test_loss: 1.1704, test_f1: 0.5596
 epoch: 34, train_loss: 0.6541, test_loss: 1.1302, test_f1: 0.5243
 epoch: 35, train_loss: 0.6390, test_loss: 1.2766, test_f1: 0.5613
 epoch: 36, train_loss: 0.6367, test_loss: 1.1897, test_f1: 0.5385
 epoch: 37, train_loss: 0.6308, test_loss: 1.2436, test_f1: 0.5230
 epoch: 38, train_loss: 0.6098, test_loss: 1.2450, test_f1: 0.5403
 epoch: 39, train_loss: 0.5922, test_loss: 1.2413, test_f1: 0.5424
 epoch: 40, train_loss: 0.6195, test_loss: 1.2902, test_f1: 0.5208
 epoch: 41, train_loss: 0.5994, test_loss: 1.2853, test_f1: 0.5276
 epoch: 42, train_loss: 0.5957, test_loss: 1.2497, test_f1: 0.5536
 epoch: 43, train_loss: 0.5725, test_loss: 1.3266, test_f1: 0.5406
 epoch: 44, train_loss: 0.5800, test_loss: 1.3303, test_f1: 0.5295
 epoch: 45, train_loss: 0.5569, test_loss: 1.3340, test_f1: 0.5289
 epoch: 46, train_loss: 0.5503, test_loss: 1.4785, test_f1: 0.5253
 epoch: 47, train_loss: 0.5557, test_loss: 1.5426, test_f1: 0.5003
 epoch: 48, train_loss: 0.5416, test_loss: 1.3517, test_f1: 0.5584
 epoch: 49, train_loss: 0.5535, test_loss: 1.4942, test_f1: 0.5138
 epoch: 50, train_loss: 0.5594, test_loss: 1.5602, test_f1: 0.5220
 epoch: 51, train_loss: 0.5140, test_loss: 1.4012, test_f1: 0.5543
 epoch: 52, train_loss: 0.4835, test_loss: 1.5416, test_f1: 0.5254
 epoch: 53, train_loss: 0.4757, test_loss: 1.4583, test_f1: 0.5218
 epoch: 54, train_loss: 0.4715, test_loss: 1.6095, test_f1: 0.5395
 epoch: 55, train_loss: 0.4657, test_loss: 1.4866, test_f1: 0.5230
 epoch: 56, train_loss: 0.4530, test_loss: 1.6496, test_f1: 0.5298
 epoch: 57, train_loss: 0.4440, test_loss: 1.6260, test_f1: 0.5111
 epoch: 58, train_loss: 0.4512, test_loss: 1.6838, test_f1: 0.5359
 epoch: 59, train_loss: 0.4429, test_loss: 1.7142, test_f1: 0.5196
 epoch: 60, train_loss: 0.4195, test_loss: 1.7111, test_f1: 0.5266
 epoch: 61, train_loss: 0.4384, test_loss: 1.7707, test_f1: 0.5265
 epoch: 62, train_loss: 0.4444, test_loss: 1.6512, test_f1: 0.5121
 epoch: 63, train_loss: 0.4423, test_loss: 1.8314, test_f1: 0.5601
 epoch: 64, train_loss: 0.4317, test_loss: 1.8949, test_f1: 0.5292
 epoch: 65, train_loss: 0.4430, test_loss: 1.9163, test_f1: 0.5340
 epoch: 66, train_loss: 0.4238, test_loss: 1.8452, test_f1: 0.5117
 epoch: 67, train_loss: 0.4250, test_loss: 1.8011, test_f1: 0.5254
 epoch: 68, train_loss: 0.4227, test_loss: 1.8433, test_f1: 0.5476
 epoch: 69, train_loss: 0.4273, test_loss: 1.9042, test_f1: 0.5473
 epoch: 70, train_loss: 0.4170, test_loss: 1.9368, test_f1: 0.4934
 epoch: 71, train_loss: 0.4136, test_loss: 1.9038, test_f1: 0.5279
 epoch: 72, train_loss: 0.4029, test_loss: 2.1526, test_f1: 0.5433
 epoch: 73, train_loss: 0.4209, test_loss: 1.7931, test_f1: 0.5216
 epoch: 74, train_loss: 0.4248, test_loss: 2.0504, test_f1: 0.5122
 epoch: 75, train_loss: 0.4010, test_loss: 1.8591, test_f1: 0.5347
 epoch: 76, train_loss: 0.3805, test_loss: 2.0096, test_f1: 0.5231
 epoch: 77, train_loss: 0.3858, test_loss: 2.0014, test_f1: 0.5370
 epoch: 78, train_loss: 0.4058, test_loss: 1.8878, test_f1: 0.5423
 epoch: 79, train_loss: 0.3937, test_loss: 2.0636, test_f1: 0.5116
 epoch: 80, train_loss: 0.3862, test_loss: 1.9826, test_f1: 0.5034
 epoch: 81, train_loss: 0.3936, test_loss: 2.0307, test_f1: 0.5134
 epoch: 82, train_loss: 0.4052, test_loss: 1.9518, test_f1: 0.5179
 epoch: 83, train_loss: 0.3816, test_loss: 2.1042, test_f1: 0.5028
 epoch: 84, train_loss: 0.3723, test_loss: 1.8668, test_f1: 0.5181
 epoch: 85, train_loss: 0.3748, test_loss: 2.1992, test_f1: 0.4930
 epoch: 86, train_loss: 0.3740, test_loss: 2.0170, test_f1: 0.5279
 epoch: 87, train_loss: 0.3522, test_loss: 2.1266, test_f1: 0.5157
 epoch: 88, train_loss: 0.3663, test_loss: 2.2625, test_f1: 0.5082
 epoch: 89, train_loss: 0.3702, test_loss: 2.1966, test_f1: 0.4996
 epoch: 90, train_loss: 0.3507, test_loss: 2.1877, test_f1: 0.5302
 epoch: 91, train_loss: 0.3614, test_loss: 2.3233, test_f1: 0.5231
 epoch: 92, train_loss: 0.3382, test_loss: 2.3234, test_f1: 0.5394
 epoch: 93, train_loss: 0.3458, test_loss: 2.1041, test_f1: 0.5426
 epoch: 94, train_loss: 0.3525, test_loss: 2.1260, test_f1: 0.5342
 epoch: 95, train_loss: 0.3378, test_loss: 2.1021, test_f1: 0.5329
 epoch: 96, train_loss: 0.3466, test_loss: 2.1494, test_f1: 0.5303
 epoch: 97, train_loss: 0.3474, test_loss: 2.3703, test_f1: 0.5464
 epoch: 98, train_loss: 0.3429, test_loss: 2.2492, test_f1: 0.5117
 epoch: 99, train_loss: 0.3410, test_loss: 2.2621, test_f1: 0.5018
##################ITERATION #2 ****************************************
 epoch: 0, train_loss: 1.3162, test_loss: 1.2193, test_f1: 0.3453
 epoch: 1, train_loss: 1.1599, test_loss: 1.1167, test_f1: 0.4225
 epoch: 2, train_loss: 1.1266, test_loss: 1.0756, test_f1: 0.4471
 epoch: 3, train_loss: 1.0922, test_loss: 1.0408, test_f1: 0.4788
 epoch: 4, train_loss: 1.0753, test_loss: 1.0184, test_f1: 0.4623
 epoch: 5, train_loss: 1.0469, test_loss: 1.0041, test_f1: 0.4729
 epoch: 6, train_loss: 1.0327, test_loss: 0.9654, test_f1: 0.4944
 epoch: 7, train_loss: 0.9959, test_loss: 0.9472, test_f1: 0.5015
 epoch: 8, train_loss: 0.9769, test_loss: 0.9527, test_f1: 0.4639
 epoch: 9, train_loss: 0.9714, test_loss: 0.9378, test_f1: 0.5044
 epoch: 10, train_loss: 0.9519, test_loss: 0.9528, test_f1: 0.4902
 epoch: 11, train_loss: 0.9367, test_loss: 0.9672, test_f1: 0.4953
 epoch: 12, train_loss: 0.9307, test_loss: 0.9977, test_f1: 0.4849
 epoch: 13, train_loss: 0.9315, test_loss: 0.9567, test_f1: 0.4886
 epoch: 14, train_loss: 0.9095, test_loss: 0.9959, test_f1: 0.4962
 epoch: 15, train_loss: 0.8964, test_loss: 0.9769, test_f1: 0.5060
 epoch: 16, train_loss: 0.8853, test_loss: 0.9925, test_f1: 0.4917
 epoch: 17, train_loss: 0.8762, test_loss: 1.0077, test_f1: 0.5183
 epoch: 18, train_loss: 0.8767, test_loss: 0.9841, test_f1: 0.5057
 epoch: 19, train_loss: 0.8656, test_loss: 1.0054, test_f1: 0.5062
 epoch: 20, train_loss: 0.8656, test_loss: 0.9901, test_f1: 0.4996
 epoch: 21, train_loss: 0.8580, test_loss: 1.0018, test_f1: 0.5098
 epoch: 22, train_loss: 0.8416, test_loss: 0.9616, test_f1: 0.5280
 epoch: 23, train_loss: 0.8354, test_loss: 0.9839, test_f1: 0.5016
 epoch: 24, train_loss: 0.8228, test_loss: 0.9912, test_f1: 0.5270
 epoch: 25, train_loss: 0.8110, test_loss: 0.9836, test_f1: 0.5247
 epoch: 26, train_loss: 0.8091, test_loss: 0.9906, test_f1: 0.5453
 epoch: 27, train_loss: 0.8021, test_loss: 0.9748, test_f1: 0.5365
 epoch: 28, train_loss: 0.8048, test_loss: 1.0519, test_f1: 0.5469
 epoch: 29, train_loss: 0.7900, test_loss: 1.0195, test_f1: 0.5429
 epoch: 30, train_loss: 0.7725, test_loss: 1.0362, test_f1: 0.5373
 epoch: 31, train_loss: 0.7681, test_loss: 1.0464, test_f1: 0.5234
 epoch: 32, train_loss: 0.7461, test_loss: 1.0581, test_f1: 0.4992
 epoch: 33, train_loss: 0.7568, test_loss: 1.0374, test_f1: 0.5218
 epoch: 34, train_loss: 0.7543, test_loss: 1.0588, test_f1: 0.5289
 epoch: 35, train_loss: 0.7310, test_loss: 1.0568, test_f1: 0.5561
 epoch: 36, train_loss: 0.7397, test_loss: 1.0606, test_f1: 0.5372
 epoch: 37, train_loss: 0.7212, test_loss: 1.1226, test_f1: 0.5263
 epoch: 38, train_loss: 0.7300, test_loss: 1.1362, test_f1: 0.5276
 epoch: 39, train_loss: 0.7074, test_loss: 1.0976, test_f1: 0.5459
 epoch: 40, train_loss: 0.7167, test_loss: 1.1315, test_f1: 0.5228
 epoch: 41, train_loss: 0.7014, test_loss: 1.1224, test_f1: 0.5144
 epoch: 42, train_loss: 0.6961, test_loss: 1.1060, test_f1: 0.5656
 epoch: 43, train_loss: 0.6759, test_loss: 1.1845, test_f1: 0.5022
 epoch: 44, train_loss: 0.6906, test_loss: 1.1533, test_f1: 0.5464
 epoch: 45, train_loss: 0.6961, test_loss: 1.1821, test_f1: 0.5447
 epoch: 46, train_loss: 0.6703, test_loss: 1.2126, test_f1: 0.5437
 epoch: 47, train_loss: 0.6874, test_loss: 1.1683, test_f1: 0.5491
 epoch: 48, train_loss: 0.6730, test_loss: 1.1758, test_f1: 0.5633
 epoch: 49, train_loss: 0.6614, test_loss: 1.1442, test_f1: 0.5419
 epoch: 50, train_loss: 0.6490, test_loss: 1.1335, test_f1: 0.5512
 epoch: 51, train_loss: 0.6251, test_loss: 1.1949, test_f1: 0.5159
 epoch: 52, train_loss: 0.6249, test_loss: 1.1948, test_f1: 0.5619
 epoch: 53, train_loss: 0.5985, test_loss: 1.2239, test_f1: 0.5322
 epoch: 54, train_loss: 0.6039, test_loss: 1.1812, test_f1: 0.5613
 epoch: 55, train_loss: 0.5931, test_loss: 1.2533, test_f1: 0.5320
 epoch: 56, train_loss: 0.5922, test_loss: 1.1857, test_f1: 0.5610
 epoch: 57, train_loss: 0.5922, test_loss: 1.2237, test_f1: 0.5570
 epoch: 58, train_loss: 0.5890, test_loss: 1.1847, test_f1: 0.5597
 epoch: 59, train_loss: 0.5949, test_loss: 1.2667, test_f1: 0.5491
 epoch: 60, train_loss: 0.5694, test_loss: 1.2317, test_f1: 0.5417
 epoch: 61, train_loss: 0.5669, test_loss: 1.2591, test_f1: 0.5532
 epoch: 62, train_loss: 0.5737, test_loss: 1.2532, test_f1: 0.5437
 epoch: 63, train_loss: 0.5609, test_loss: 1.3424, test_f1: 0.5173
 epoch: 64, train_loss: 0.5533, test_loss: 1.2975, test_f1: 0.5306
 epoch: 65, train_loss: 0.5614, test_loss: 1.3291, test_f1: 0.5166
 epoch: 66, train_loss: 0.5315, test_loss: 1.2788, test_f1: 0.5491
 epoch: 67, train_loss: 0.5371, test_loss: 1.3131, test_f1: 0.5508
 epoch: 68, train_loss: 0.5360, test_loss: 1.3554, test_f1: 0.5385
 epoch: 69, train_loss: 0.5336, test_loss: 1.3242, test_f1: 0.5743
 epoch: 70, train_loss: 0.5298, test_loss: 1.3237, test_f1: 0.5721
 epoch: 71, train_loss: 0.5394, test_loss: 1.3830, test_f1: 0.5537
 epoch: 72, train_loss: 0.5419, test_loss: 1.2950, test_f1: 0.5773
 epoch: 73, train_loss: 0.5312, test_loss: 1.3931, test_f1: 0.5334
 epoch: 74, train_loss: 0.5177, test_loss: 1.3996, test_f1: 0.5451
 epoch: 75, train_loss: 0.5400, test_loss: 1.3693, test_f1: 0.5444
 epoch: 76, train_loss: 0.5295, test_loss: 1.3219, test_f1: 0.5226
 epoch: 77, train_loss: 0.5307, test_loss: 1.3265, test_f1: 0.5692
 epoch: 78, train_loss: 0.5193, test_loss: 1.2897, test_f1: 0.5815
 epoch: 79, train_loss: 0.5067, test_loss: 1.3525, test_f1: 0.5586
 epoch: 80, train_loss: 0.5134, test_loss: 1.4205, test_f1: 0.5332
 epoch: 81, train_loss: 0.4901, test_loss: 1.3837, test_f1: 0.5388
 epoch: 82, train_loss: 0.4907, test_loss: 1.3836, test_f1: 0.5512
 epoch: 83, train_loss: 0.4872, test_loss: 1.4249, test_f1: 0.5719
 epoch: 84, train_loss: 0.4994, test_loss: 1.4196, test_f1: 0.5201
 epoch: 85, train_loss: 0.5074, test_loss: 1.4094, test_f1: 0.5430
 epoch: 86, train_loss: 0.4907, test_loss: 1.5120, test_f1: 0.5539
 epoch: 87, train_loss: 0.4851, test_loss: 1.3421, test_f1: 0.5400
 epoch: 88, train_loss: 0.4759, test_loss: 1.4748, test_f1: 0.5030
 epoch: 89, train_loss: 0.4783, test_loss: 1.4973, test_f1: 0.5280
 epoch: 90, train_loss: 0.4767, test_loss: 1.4632, test_f1: 0.5360
 epoch: 91, train_loss: 0.4879, test_loss: 1.4981, test_f1: 0.5399
 epoch: 92, train_loss: 0.4595, test_loss: 1.5595, test_f1: 0.5388
 epoch: 93, train_loss: 0.4649, test_loss: 1.4965, test_f1: 0.5445
 epoch: 94, train_loss: 0.4791, test_loss: 1.4442, test_f1: 0.5566
 epoch: 95, train_loss: 0.4724, test_loss: 1.4709, test_f1: 0.5419
 epoch: 96, train_loss: 0.4639, test_loss: 1.5045, test_f1: 0.5515
 epoch: 97, train_loss: 0.4552, test_loss: 1.5159, test_f1: 0.5529
 epoch: 98, train_loss: 0.4377, test_loss: 1.5055, test_f1: 0.5540
 epoch: 99, train_loss: 0.4605, test_loss: 1.6640, test_f1: 0.5462
##################ITERATION #3 ****************************************
 epoch: 0, train_loss: 1.3536, test_loss: 1.2405, test_f1: 0.3050
 epoch: 1, train_loss: 1.1795, test_loss: 1.1236, test_f1: 0.4333
 epoch: 2, train_loss: 1.1294, test_loss: 1.0675, test_f1: 0.4311
 epoch: 3, train_loss: 1.0935, test_loss: 1.0033, test_f1: 0.4833
 epoch: 4, train_loss: 1.0628, test_loss: 0.9861, test_f1: 0.4922
 epoch: 5, train_loss: 1.0364, test_loss: 0.9706, test_f1: 0.4814
 epoch: 6, train_loss: 1.0101, test_loss: 0.9858, test_f1: 0.4812
 epoch: 7, train_loss: 0.9951, test_loss: 0.9616, test_f1: 0.4995
 epoch: 8, train_loss: 0.9722, test_loss: 1.0050, test_f1: 0.4668
 epoch: 9, train_loss: 0.9698, test_loss: 1.0136, test_f1: 0.4721
 epoch: 10, train_loss: 0.9530, test_loss: 0.9422, test_f1: 0.4988
 epoch: 11, train_loss: 0.9285, test_loss: 0.9427, test_f1: 0.4858
 epoch: 12, train_loss: 0.9138, test_loss: 0.9956, test_f1: 0.4893
 epoch: 13, train_loss: 0.9083, test_loss: 1.0013, test_f1: 0.5062
 epoch: 14, train_loss: 0.8915, test_loss: 0.9853, test_f1: 0.4991
 epoch: 15, train_loss: 0.8817, test_loss: 0.9918, test_f1: 0.5108
 epoch: 16, train_loss: 0.8757, test_loss: 0.9714, test_f1: 0.4962
 epoch: 17, train_loss: 0.8793, test_loss: 0.9945, test_f1: 0.4852
 epoch: 18, train_loss: 0.8520, test_loss: 1.0106, test_f1: 0.5365
 epoch: 19, train_loss: 0.8520, test_loss: 1.0144, test_f1: 0.5183
 epoch: 20, train_loss: 0.8411, test_loss: 1.0394, test_f1: 0.5195
 epoch: 21, train_loss: 0.8236, test_loss: 1.0177, test_f1: 0.5159
 epoch: 22, train_loss: 0.8213, test_loss: 1.0968, test_f1: 0.5190
 epoch: 23, train_loss: 0.8161, test_loss: 0.9657, test_f1: 0.5152
 epoch: 24, train_loss: 0.8135, test_loss: 1.0456, test_f1: 0.4793
 epoch: 25, train_loss: 0.8058, test_loss: 1.0263, test_f1: 0.5377
 epoch: 26, train_loss: 0.7864, test_loss: 1.0744, test_f1: 0.5139
 epoch: 27, train_loss: 0.7857, test_loss: 1.0180, test_f1: 0.5213
 epoch: 28, train_loss: 0.7772, test_loss: 1.0523, test_f1: 0.5432
 epoch: 29, train_loss: 0.7686, test_loss: 1.0829, test_f1: 0.5407
 epoch: 30, train_loss: 0.7761, test_loss: 1.0577, test_f1: 0.5273
 epoch: 31, train_loss: 0.7680, test_loss: 1.2375, test_f1: 0.4927
 epoch: 32, train_loss: 0.7567, test_loss: 1.0692, test_f1: 0.5378
 epoch: 33, train_loss: 0.7479, test_loss: 1.0706, test_f1: 0.5450
 epoch: 34, train_loss: 0.7444, test_loss: 1.1160, test_f1: 0.5106
 epoch: 35, train_loss: 0.7348, test_loss: 1.0342, test_f1: 0.5230
 epoch: 36, train_loss: 0.7405, test_loss: 1.1093, test_f1: 0.5442
 epoch: 37, train_loss: 0.7329, test_loss: 1.1577, test_f1: 0.5332
 epoch: 38, train_loss: 0.7278, test_loss: 1.1344, test_f1: 0.5533
 epoch: 39, train_loss: 0.7127, test_loss: 1.1290, test_f1: 0.5596
 epoch: 40, train_loss: 0.7074, test_loss: 1.0934, test_f1: 0.5628
 epoch: 41, train_loss: 0.7040, test_loss: 1.1709, test_f1: 0.5517
 epoch: 42, train_loss: 0.7021, test_loss: 1.0939, test_f1: 0.5436
 epoch: 43, train_loss: 0.7021, test_loss: 1.1803, test_f1: 0.5359
 epoch: 44, train_loss: 0.6892, test_loss: 1.0736, test_f1: 0.5244
 epoch: 45, train_loss: 0.6834, test_loss: 1.1080, test_f1: 0.5450
 epoch: 46, train_loss: 0.6621, test_loss: 1.0824, test_f1: 0.5828
 epoch: 47, train_loss: 0.7062, test_loss: 1.1286, test_f1: 0.5461
 epoch: 48, train_loss: 0.6830, test_loss: 1.0237, test_f1: 0.5731
 epoch: 49, train_loss: 0.6651, test_loss: 1.3629, test_f1: 0.5125
 epoch: 50, train_loss: 0.6468, test_loss: 1.2744, test_f1: 0.5541
 epoch: 51, train_loss: 0.6489, test_loss: 1.1033, test_f1: 0.5512
 epoch: 52, train_loss: 0.6077, test_loss: 1.1046, test_f1: 0.5566
 epoch: 53, train_loss: 0.6129, test_loss: 1.1489, test_f1: 0.5737
 epoch: 54, train_loss: 0.6050, test_loss: 1.0748, test_f1: 0.5758
 epoch: 55, train_loss: 0.5978, test_loss: 1.1449, test_f1: 0.5591
 epoch: 56, train_loss: 0.6070, test_loss: 1.1597, test_f1: 0.5630
 epoch: 57, train_loss: 0.5948, test_loss: 1.1678, test_f1: 0.5804
 epoch: 58, train_loss: 0.5920, test_loss: 1.2503, test_f1: 0.5673
 epoch: 59, train_loss: 0.5878, test_loss: 1.2453, test_f1: 0.5553
 epoch: 60, train_loss: 0.5862, test_loss: 1.2679, test_f1: 0.5377
 epoch: 61, train_loss: 0.5838, test_loss: 1.1505, test_f1: 0.5789
 epoch: 62, train_loss: 0.5879, test_loss: 1.2964, test_f1: 0.5521
 epoch: 63, train_loss: 0.5811, test_loss: 1.1576, test_f1: 0.5660
 epoch: 64, train_loss: 0.5745, test_loss: 1.3052, test_f1: 0.5522
 epoch: 65, train_loss: 0.5751, test_loss: 1.1679, test_f1: 0.5629
 epoch: 66, train_loss: 0.5669, test_loss: 1.2320, test_f1: 0.5717
 epoch: 67, train_loss: 0.5516, test_loss: 1.1734, test_f1: 0.6009
 epoch: 68, train_loss: 0.5535, test_loss: 1.2216, test_f1: 0.5697
 epoch: 69, train_loss: 0.5484, test_loss: 1.2829, test_f1: 0.5700
 epoch: 70, train_loss: 0.5599, test_loss: 1.2345, test_f1: 0.5827
 epoch: 71, train_loss: 0.5534, test_loss: 1.2488, test_f1: 0.5456
 epoch: 72, train_loss: 0.5347, test_loss: 1.3249, test_f1: 0.5414
 epoch: 73, train_loss: 0.5526, test_loss: 1.1717, test_f1: 0.5737
 epoch: 74, train_loss: 0.5383, test_loss: 1.2646, test_f1: 0.5607
 epoch: 75, train_loss: 0.5432, test_loss: 1.1825, test_f1: 0.5770
 epoch: 76, train_loss: 0.5299, test_loss: 1.2038, test_f1: 0.5848
 epoch: 77, train_loss: 0.5211, test_loss: 1.2684, test_f1: 0.5479
 epoch: 78, train_loss: 0.5366, test_loss: 1.4150, test_f1: 0.5416
 epoch: 79, train_loss: 0.5246, test_loss: 1.2596, test_f1: 0.5524
 epoch: 80, train_loss: 0.5282, test_loss: 1.3336, test_f1: 0.5400
 epoch: 81, train_loss: 0.5029, test_loss: 1.2705, test_f1: 0.5630
 epoch: 82, train_loss: 0.5106, test_loss: 1.2847, test_f1: 0.5559
 epoch: 83, train_loss: 0.5216, test_loss: 1.3395, test_f1: 0.5712
 epoch: 84, train_loss: 0.5088, test_loss: 1.4038, test_f1: 0.5772
 epoch: 85, train_loss: 0.5005, test_loss: 1.4796, test_f1: 0.5706
 epoch: 86, train_loss: 0.5042, test_loss: 1.4363, test_f1: 0.5580
 epoch: 87, train_loss: 0.5035, test_loss: 1.3388, test_f1: 0.5534
 epoch: 88, train_loss: 0.5129, test_loss: 1.2787, test_f1: 0.5495
 epoch: 89, train_loss: 0.5174, test_loss: 1.2565, test_f1: 0.5600
 epoch: 90, train_loss: 0.5111, test_loss: 1.4034, test_f1: 0.5430
 epoch: 91, train_loss: 0.4875, test_loss: 1.3502, test_f1: 0.5793
 epoch: 92, train_loss: 0.4957, test_loss: 1.4293, test_f1: 0.5726
 epoch: 93, train_loss: 0.4893, test_loss: 1.3994, test_f1: 0.5322
 epoch: 94, train_loss: 0.4765, test_loss: 1.3734, test_f1: 0.5679
 epoch: 95, train_loss: 0.4740, test_loss: 1.4778, test_f1: 0.5774
 epoch: 96, train_loss: 0.4750, test_loss: 1.5962, test_f1: 0.5157
 epoch: 97, train_loss: 0.4754, test_loss: 1.4468, test_f1: 0.5585
 epoch: 98, train_loss: 0.4796, test_loss: 1.3787, test_f1: 0.5873
 epoch: 99, train_loss: 0.4822, test_loss: 1.4629, test_f1: 0.5411
##################ITERATION #4 ****************************************
 epoch: 0, train_loss: 1.3972, test_loss: 1.2021, test_f1: 0.3491
 epoch: 1, train_loss: 1.1755, test_loss: 1.0934, test_f1: 0.4386
 epoch: 2, train_loss: 1.1126, test_loss: 1.0516, test_f1: 0.4241
 epoch: 3, train_loss: 1.0670, test_loss: 1.0348, test_f1: 0.4315
 epoch: 4, train_loss: 1.0436, test_loss: 1.0247, test_f1: 0.4688
 epoch: 5, train_loss: 1.0197, test_loss: 1.0261, test_f1: 0.4617
 epoch: 6, train_loss: 0.9932, test_loss: 0.9883, test_f1: 0.5004
 epoch: 7, train_loss: 0.9901, test_loss: 0.9870, test_f1: 0.4928
 epoch: 8, train_loss: 0.9681, test_loss: 0.9901, test_f1: 0.4871
 epoch: 9, train_loss: 0.9355, test_loss: 0.9939, test_f1: 0.4658
 epoch: 10, train_loss: 0.9479, test_loss: 1.0002, test_f1: 0.5054
 epoch: 11, train_loss: 0.9290, test_loss: 1.0042, test_f1: 0.4687
 epoch: 12, train_loss: 0.9282, test_loss: 1.0151, test_f1: 0.5107
 epoch: 13, train_loss: 0.9108, test_loss: 0.9939, test_f1: 0.5018
 epoch: 14, train_loss: 0.9072, test_loss: 0.9941, test_f1: 0.5256
 epoch: 15, train_loss: 0.8910, test_loss: 1.0313, test_f1: 0.5273
 epoch: 16, train_loss: 0.8774, test_loss: 1.0127, test_f1: 0.5167
 epoch: 17, train_loss: 0.8778, test_loss: 1.1697, test_f1: 0.4702
 epoch: 18, train_loss: 0.8556, test_loss: 1.0657, test_f1: 0.5149
 epoch: 19, train_loss: 0.8420, test_loss: 1.0629, test_f1: 0.5285
 epoch: 20, train_loss: 0.8503, test_loss: 1.0490, test_f1: 0.5383
 epoch: 21, train_loss: 0.8271, test_loss: 1.0981, test_f1: 0.4882
 epoch: 22, train_loss: 0.8251, test_loss: 1.0603, test_f1: 0.5253
 epoch: 23, train_loss: 0.8085, test_loss: 1.1007, test_f1: 0.5157
 epoch: 24, train_loss: 0.7966, test_loss: 1.1098, test_f1: 0.5286
 epoch: 25, train_loss: 0.8042, test_loss: 1.0583, test_f1: 0.5176
 epoch: 26, train_loss: 0.7984, test_loss: 1.0502, test_f1: 0.5268
 epoch: 27, train_loss: 0.8024, test_loss: 1.0990, test_f1: 0.5647
 epoch: 28, train_loss: 0.7873, test_loss: 1.1021, test_f1: 0.5182
 epoch: 29, train_loss: 0.7668, test_loss: 1.1181, test_f1: 0.5485
 epoch: 30, train_loss: 0.7627, test_loss: 1.1274, test_f1: 0.5242
 epoch: 31, train_loss: 0.7601, test_loss: 1.0935, test_f1: 0.5513
 epoch: 32, train_loss: 0.7449, test_loss: 1.1023, test_f1: 0.5331
 epoch: 33, train_loss: 0.7493, test_loss: 1.1920, test_f1: 0.5327
 epoch: 34, train_loss: 0.7380, test_loss: 1.1479, test_f1: 0.5472
 epoch: 35, train_loss: 0.7423, test_loss: 1.1105, test_f1: 0.5649
 epoch: 36, train_loss: 0.7263, test_loss: 1.1621, test_f1: 0.5529
 epoch: 37, train_loss: 0.7417, test_loss: 1.1063, test_f1: 0.5341
 epoch: 38, train_loss: 0.7332, test_loss: 1.1671, test_f1: 0.5557
 epoch: 39, train_loss: 0.7205, test_loss: 1.1494, test_f1: 0.5505
 epoch: 40, train_loss: 0.7266, test_loss: 1.1499, test_f1: 0.5637
 epoch: 41, train_loss: 0.7114, test_loss: 1.1712, test_f1: 0.5151
 epoch: 42, train_loss: 0.7004, test_loss: 1.0980, test_f1: 0.5567
 epoch: 43, train_loss: 0.7010, test_loss: 1.1912, test_f1: 0.5538
 epoch: 44, train_loss: 0.6956, test_loss: 1.1900, test_f1: 0.5385
 epoch: 45, train_loss: 0.6894, test_loss: 1.2131, test_f1: 0.5361
 epoch: 46, train_loss: 0.6842, test_loss: 1.2063, test_f1: 0.5680
 epoch: 47, train_loss: 0.6825, test_loss: 1.2139, test_f1: 0.5440
 epoch: 48, train_loss: 0.6738, test_loss: 1.2230, test_f1: 0.5598
 epoch: 49, train_loss: 0.6698, test_loss: 1.1717, test_f1: 0.5605
 epoch: 50, train_loss: 0.6705, test_loss: 1.1945, test_f1: 0.5570
 epoch: 51, train_loss: 0.6342, test_loss: 1.2251, test_f1: 0.5393
 epoch: 52, train_loss: 0.6253, test_loss: 1.2079, test_f1: 0.5726
 epoch: 53, train_loss: 0.6148, test_loss: 1.2005, test_f1: 0.5620
 epoch: 54, train_loss: 0.6138, test_loss: 1.2242, test_f1: 0.5599
 epoch: 55, train_loss: 0.6016, test_loss: 1.2517, test_f1: 0.5611
 epoch: 56, train_loss: 0.6043, test_loss: 1.2714, test_f1: 0.5653
 epoch: 57, train_loss: 0.6031, test_loss: 1.2158, test_f1: 0.5613
 epoch: 58, train_loss: 0.5910, test_loss: 1.2574, test_f1: 0.5688
 epoch: 59, train_loss: 0.5938, test_loss: 1.2834, test_f1: 0.5446
 epoch: 60, train_loss: 0.5910, test_loss: 1.3056, test_f1: 0.5608
 epoch: 61, train_loss: 0.5828, test_loss: 1.2795, test_f1: 0.5587
 epoch: 62, train_loss: 0.5757, test_loss: 1.2769, test_f1: 0.5502
 epoch: 63, train_loss: 0.6037, test_loss: 1.2917, test_f1: 0.5636
 epoch: 64, train_loss: 0.5912, test_loss: 1.2632, test_f1: 0.5813
 epoch: 65, train_loss: 0.5863, test_loss: 1.2906, test_f1: 0.5480
 epoch: 66, train_loss: 0.5745, test_loss: 1.3242, test_f1: 0.5566
 epoch: 67, train_loss: 0.5680, test_loss: 1.2820, test_f1: 0.5705
 epoch: 68, train_loss: 0.5721, test_loss: 1.3177, test_f1: 0.5695
 epoch: 69, train_loss: 0.5508, test_loss: 1.3198, test_f1: 0.5572
 epoch: 70, train_loss: 0.5490, test_loss: 1.4391, test_f1: 0.5533
 epoch: 71, train_loss: 0.5626, test_loss: 1.2892, test_f1: 0.5646
 epoch: 72, train_loss: 0.5611, test_loss: 1.3216, test_f1: 0.5547
 epoch: 73, train_loss: 0.5438, test_loss: 1.3452, test_f1: 0.5702
 epoch: 74, train_loss: 0.5393, test_loss: 1.3551, test_f1: 0.5439
 epoch: 75, train_loss: 0.5480, test_loss: 1.3530, test_f1: 0.5585
 epoch: 76, train_loss: 0.5452, test_loss: 1.3803, test_f1: 0.5863
 epoch: 77, train_loss: 0.5412, test_loss: 1.4184, test_f1: 0.5429
 epoch: 78, train_loss: 0.5387, test_loss: 1.3837, test_f1: 0.5681
 epoch: 79, train_loss: 0.5342, test_loss: 1.4249, test_f1: 0.5550
 epoch: 80, train_loss: 0.5312, test_loss: 1.3477, test_f1: 0.5620
 epoch: 81, train_loss: 0.5168, test_loss: 1.2953, test_f1: 0.5824
 epoch: 82, train_loss: 0.5323, test_loss: 1.3182, test_f1: 0.5763
 epoch: 83, train_loss: 0.5163, test_loss: 1.4043, test_f1: 0.5617
 epoch: 84, train_loss: 0.5214, test_loss: 1.4274, test_f1: 0.5493
 epoch: 85, train_loss: 0.5178, test_loss: 1.5082, test_f1: 0.5509
 epoch: 86, train_loss: 0.5136, test_loss: 1.4687, test_f1: 0.5631
 epoch: 87, train_loss: 0.5233, test_loss: 1.4556, test_f1: 0.5514
 epoch: 88, train_loss: 0.5079, test_loss: 1.4413, test_f1: 0.5760
 epoch: 89, train_loss: 0.5305, test_loss: 1.4003, test_f1: 0.5614
 epoch: 90, train_loss: 0.5165, test_loss: 1.4708, test_f1: 0.5585
 epoch: 91, train_loss: 0.5045, test_loss: 1.4224, test_f1: 0.5727
 epoch: 92, train_loss: 0.5082, test_loss: 1.3926, test_f1: 0.5624
 epoch: 93, train_loss: 0.5055, test_loss: 1.4245, test_f1: 0.5663
 epoch: 94, train_loss: 0.5084, test_loss: 1.4179, test_f1: 0.5739
 epoch: 95, train_loss: 0.4952, test_loss: 1.4706, test_f1: 0.5603
 epoch: 96, train_loss: 0.5161, test_loss: 1.4492, test_f1: 0.5656
 epoch: 97, train_loss: 0.4941, test_loss: 1.4833, test_f1: 0.5315
 epoch: 98, train_loss: 0.4989, test_loss: 1.4848, test_f1: 0.5699
 epoch: 99, train_loss: 0.4967, test_loss: 1.6211, test_f1: 0.5454
##################ITERATION #5 ****************************************
 epoch: 0, train_loss: 1.4040, test_loss: 1.2367, test_f1: 0.4133
 epoch: 1, train_loss: 1.1964, test_loss: 1.0885, test_f1: 0.4570
 epoch: 2, train_loss: 1.1302, test_loss: 1.0306, test_f1: 0.4701
 epoch: 3, train_loss: 1.0799, test_loss: 1.0394, test_f1: 0.4827
 epoch: 4, train_loss: 1.0490, test_loss: 0.9961, test_f1: 0.4534
 epoch: 5, train_loss: 1.0346, test_loss: 0.9643, test_f1: 0.4817
 epoch: 6, train_loss: 1.0019, test_loss: 0.9492, test_f1: 0.4772
 epoch: 7, train_loss: 0.9800, test_loss: 0.9640, test_f1: 0.4997
 epoch: 8, train_loss: 0.9575, test_loss: 0.9529, test_f1: 0.4709
 epoch: 9, train_loss: 0.9490, test_loss: 1.0016, test_f1: 0.4728
 epoch: 10, train_loss: 0.9447, test_loss: 0.9492, test_f1: 0.4826
 epoch: 11, train_loss: 0.9419, test_loss: 0.9305, test_f1: 0.5001
 epoch: 12, train_loss: 0.9182, test_loss: 0.9287, test_f1: 0.4817
 epoch: 13, train_loss: 0.9195, test_loss: 0.9453, test_f1: 0.5181
 epoch: 14, train_loss: 0.9033, test_loss: 0.9487, test_f1: 0.5086
 epoch: 15, train_loss: 0.8799, test_loss: 0.9990, test_f1: 0.4995
 epoch: 16, train_loss: 0.8723, test_loss: 1.0155, test_f1: 0.5052
 epoch: 17, train_loss: 0.8804, test_loss: 1.0246, test_f1: 0.4752
 epoch: 18, train_loss: 0.8666, test_loss: 1.0062, test_f1: 0.5068
 epoch: 19, train_loss: 0.8538, test_loss: 1.0817, test_f1: 0.4849
 epoch: 20, train_loss: 0.8514, test_loss: 0.9678, test_f1: 0.5137
 epoch: 21, train_loss: 0.8323, test_loss: 1.0117, test_f1: 0.5294
 epoch: 22, train_loss: 0.8276, test_loss: 0.9820, test_f1: 0.5168
 epoch: 23, train_loss: 0.8238, test_loss: 0.9298, test_f1: 0.5324
 epoch: 24, train_loss: 0.8141, test_loss: 0.9973, test_f1: 0.4954
 epoch: 25, train_loss: 0.8107, test_loss: 0.9997, test_f1: 0.4967
 epoch: 26, train_loss: 0.8096, test_loss: 0.9923, test_f1: 0.5294
 epoch: 27, train_loss: 0.7932, test_loss: 0.9977, test_f1: 0.5367
 epoch: 28, train_loss: 0.7862, test_loss: 1.2369, test_f1: 0.4867
 epoch: 29, train_loss: 0.7766, test_loss: 1.0313, test_f1: 0.5224
 epoch: 30, train_loss: 0.7742, test_loss: 1.0213, test_f1: 0.5369
 epoch: 31, train_loss: 0.7576, test_loss: 1.0878, test_f1: 0.5346
 epoch: 32, train_loss: 0.7560, test_loss: 1.1316, test_f1: 0.5040
 epoch: 33, train_loss: 0.7498, test_loss: 1.2534, test_f1: 0.5112
 epoch: 34, train_loss: 0.7544, test_loss: 1.0955, test_f1: 0.5494
 epoch: 35, train_loss: 0.7430, test_loss: 1.1337, test_f1: 0.4941
 epoch: 36, train_loss: 0.7566, test_loss: 1.0157, test_f1: 0.5237
 epoch: 37, train_loss: 0.7437, test_loss: 1.0940, test_f1: 0.5069
 epoch: 38, train_loss: 0.7420, test_loss: 1.0957, test_f1: 0.5048
 epoch: 39, train_loss: 0.7102, test_loss: 1.1297, test_f1: 0.5409
 epoch: 40, train_loss: 0.7196, test_loss: 1.1033, test_f1: 0.4979
 epoch: 41, train_loss: 0.7063, test_loss: 1.1998, test_f1: 0.4921
 epoch: 42, train_loss: 0.7084, test_loss: 1.0806, test_f1: 0.5718
 epoch: 43, train_loss: 0.7025, test_loss: 1.0980, test_f1: 0.5325
 epoch: 44, train_loss: 0.6847, test_loss: 1.1854, test_f1: 0.5275
 epoch: 45, train_loss: 0.6865, test_loss: 1.1640, test_f1: 0.5029
 epoch: 46, train_loss: 0.7009, test_loss: 1.1111, test_f1: 0.5542
 epoch: 47, train_loss: 0.6818, test_loss: 1.2053, test_f1: 0.4824
 epoch: 48, train_loss: 0.6771, test_loss: 1.1270, test_f1: 0.4813
 epoch: 49, train_loss: 0.6836, test_loss: 1.1098, test_f1: 0.5443
 epoch: 50, train_loss: 0.6514, test_loss: 1.1845, test_f1: 0.5300
 epoch: 51, train_loss: 0.6352, test_loss: 1.1438, test_f1: 0.5399
 epoch: 52, train_loss: 0.6058, test_loss: 1.1922, test_f1: 0.5408
 epoch: 53, train_loss: 0.6184, test_loss: 1.1536, test_f1: 0.5513
 epoch: 54, train_loss: 0.6020, test_loss: 1.1576, test_f1: 0.5617
 epoch: 55, train_loss: 0.6088, test_loss: 1.1491, test_f1: 0.5565
 epoch: 56, train_loss: 0.6148, test_loss: 1.2130, test_f1: 0.5686
 epoch: 57, train_loss: 0.5968, test_loss: 1.2562, test_f1: 0.5360
 epoch: 58, train_loss: 0.6113, test_loss: 1.2028, test_f1: 0.5301
 epoch: 59, train_loss: 0.5987, test_loss: 1.2237, test_f1: 0.5358
 epoch: 60, train_loss: 0.5933, test_loss: 1.1726, test_f1: 0.5746
 epoch: 61, train_loss: 0.5953, test_loss: 1.1880, test_f1: 0.5556
 epoch: 62, train_loss: 0.5787, test_loss: 1.2261, test_f1: 0.5487
 epoch: 63, train_loss: 0.5847, test_loss: 1.2092, test_f1: 0.5473
 epoch: 64, train_loss: 0.5759, test_loss: 1.3546, test_f1: 0.4976
 epoch: 65, train_loss: 0.5772, test_loss: 1.1972, test_f1: 0.5456
 epoch: 66, train_loss: 0.5643, test_loss: 1.2249, test_f1: 0.5496
 epoch: 67, train_loss: 0.5857, test_loss: 1.2644, test_f1: 0.5356
 epoch: 68, train_loss: 0.5639, test_loss: 1.2749, test_f1: 0.5321
 epoch: 69, train_loss: 0.5675, test_loss: 1.3286, test_f1: 0.5459
 epoch: 70, train_loss: 0.5641, test_loss: 1.2691, test_f1: 0.5319
 epoch: 71, train_loss: 0.5728, test_loss: 1.2786, test_f1: 0.5401
 epoch: 72, train_loss: 0.5547, test_loss: 1.3004, test_f1: 0.5372
 epoch: 73, train_loss: 0.5361, test_loss: 1.3684, test_f1: 0.5105
 epoch: 74, train_loss: 0.5416, test_loss: 1.2686, test_f1: 0.5536
 epoch: 75, train_loss: 0.5477, test_loss: 1.3017, test_f1: 0.5275
 epoch: 76, train_loss: 0.5400, test_loss: 1.3253, test_f1: 0.5369
 epoch: 77, train_loss: 0.5472, test_loss: 1.3424, test_f1: 0.5255
 epoch: 78, train_loss: 0.5183, test_loss: 1.3422, test_f1: 0.5559
 epoch: 79, train_loss: 0.5423, test_loss: 1.3159, test_f1: 0.5587
 epoch: 80, train_loss: 0.5249, test_loss: 1.2998, test_f1: 0.5655
 epoch: 81, train_loss: 0.5215, test_loss: 1.3029, test_f1: 0.5542
 epoch: 82, train_loss: 0.5230, test_loss: 1.3168, test_f1: 0.5257
 epoch: 83, train_loss: 0.5178, test_loss: 1.2839, test_f1: 0.5460
 epoch: 84, train_loss: 0.5206, test_loss: 1.3019, test_f1: 0.5332
 epoch: 85, train_loss: 0.5182, test_loss: 1.2998, test_f1: 0.5830
 epoch: 86, train_loss: 0.5307, test_loss: 1.3927, test_f1: 0.5233
 epoch: 87, train_loss: 0.5321, test_loss: 1.3112, test_f1: 0.5413
 epoch: 88, train_loss: 0.4983, test_loss: 1.3560, test_f1: 0.5309
 epoch: 89, train_loss: 0.5030, test_loss: 1.3239, test_f1: 0.5783
 epoch: 90, train_loss: 0.5004, test_loss: 1.3002, test_f1: 0.5676
 epoch: 91, train_loss: 0.4871, test_loss: 1.3343, test_f1: 0.5641
 epoch: 92, train_loss: 0.4950, test_loss: 1.3951, test_f1: 0.5403
 epoch: 93, train_loss: 0.4974, test_loss: 1.3492, test_f1: 0.5648
 epoch: 94, train_loss: 0.5001, test_loss: 1.3894, test_f1: 0.5341
 epoch: 95, train_loss: 0.5066, test_loss: 1.4434, test_f1: 0.5418
 epoch: 96, train_loss: 0.5042, test_loss: 1.3078, test_f1: 0.5289
 epoch: 97, train_loss: 0.4958, test_loss: 1.4053, test_f1: 0.5289
 epoch: 98, train_loss: 0.4864, test_loss: 1.3876, test_f1: 0.5375
 epoch: 99, train_loss: 0.4953, test_loss: 1.3096, test_f1: 0.5462
##################ITERATION #6 ****************************************
 epoch: 0, train_loss: 1.5520, test_loss: 1.2638, test_f1: 0.3192
 epoch: 1, train_loss: 1.2143, test_loss: 1.1060, test_f1: 0.4737
 epoch: 2, train_loss: 1.1688, test_loss: 1.0642, test_f1: 0.4544
 epoch: 3, train_loss: 1.1470, test_loss: 1.0855, test_f1: 0.4476
 epoch: 4, train_loss: 1.1011, test_loss: 1.0126, test_f1: 0.4873
 epoch: 5, train_loss: 1.0844, test_loss: 1.0457, test_f1: 0.4372
 epoch: 6, train_loss: 1.0497, test_loss: 1.0076, test_f1: 0.4755
 epoch: 7, train_loss: 1.0280, test_loss: 1.0116, test_f1: 0.4635
 epoch: 8, train_loss: 0.9990, test_loss: 1.0000, test_f1: 0.4831
 epoch: 9, train_loss: 1.0108, test_loss: 0.9864, test_f1: 0.5191
 epoch: 10, train_loss: 0.9872, test_loss: 1.0115, test_f1: 0.4821
 epoch: 11, train_loss: 0.9862, test_loss: 0.9777, test_f1: 0.4919
 epoch: 12, train_loss: 0.9500, test_loss: 0.9710, test_f1: 0.4922
 epoch: 13, train_loss: 0.9542, test_loss: 1.0177, test_f1: 0.4952
 epoch: 14, train_loss: 0.9350, test_loss: 0.9654, test_f1: 0.5066
 epoch: 15, train_loss: 0.9265, test_loss: 1.0106, test_f1: 0.4828
 epoch: 16, train_loss: 0.9079, test_loss: 0.9746, test_f1: 0.5064
 epoch: 17, train_loss: 0.8833, test_loss: 0.9923, test_f1: 0.5027
 epoch: 18, train_loss: 0.8827, test_loss: 0.9937, test_f1: 0.5156
 epoch: 19, train_loss: 0.8849, test_loss: 0.9967, test_f1: 0.5053
 epoch: 20, train_loss: 0.8724, test_loss: 1.0497, test_f1: 0.4843
 epoch: 21, train_loss: 0.8730, test_loss: 0.9801, test_f1: 0.5072
 epoch: 22, train_loss: 0.8537, test_loss: 1.0355, test_f1: 0.5138
 epoch: 23, train_loss: 0.8376, test_loss: 1.0363, test_f1: 0.5191
 epoch: 24, train_loss: 0.8510, test_loss: 1.0451, test_f1: 0.4966
 epoch: 25, train_loss: 0.8326, test_loss: 1.0534, test_f1: 0.5163
 epoch: 26, train_loss: 0.8482, test_loss: 1.0213, test_f1: 0.5068
 epoch: 27, train_loss: 0.8224, test_loss: 1.0690, test_f1: 0.5208
 epoch: 28, train_loss: 0.8125, test_loss: 1.0215, test_f1: 0.5388
 epoch: 29, train_loss: 0.8009, test_loss: 0.9839, test_f1: 0.5405
 epoch: 30, train_loss: 0.7837, test_loss: 0.9997, test_f1: 0.5466
 epoch: 31, train_loss: 0.7794, test_loss: 1.0962, test_f1: 0.5160
 epoch: 32, train_loss: 0.7762, test_loss: 1.0984, test_f1: 0.4897
 epoch: 33, train_loss: 0.7860, test_loss: 1.0551, test_f1: 0.5241
 epoch: 34, train_loss: 0.7824, test_loss: 1.0395, test_f1: 0.5173
 epoch: 35, train_loss: 0.7703, test_loss: 1.1131, test_f1: 0.4894
 epoch: 36, train_loss: 0.7566, test_loss: 1.0534, test_f1: 0.5071
 epoch: 37, train_loss: 0.7560, test_loss: 1.1094, test_f1: 0.5280
 epoch: 38, train_loss: 0.7405, test_loss: 1.0350, test_f1: 0.5371
 epoch: 39, train_loss: 0.7409, test_loss: 1.0692, test_f1: 0.5377
 epoch: 40, train_loss: 0.7187, test_loss: 1.1134, test_f1: 0.5317
 epoch: 41, train_loss: 0.7262, test_loss: 1.0679, test_f1: 0.5365
 epoch: 42, train_loss: 0.7224, test_loss: 1.1395, test_f1: 0.5102
 epoch: 43, train_loss: 0.7220, test_loss: 1.0823, test_f1: 0.5397
 epoch: 44, train_loss: 0.7097, test_loss: 1.1191, test_f1: 0.5124
 epoch: 45, train_loss: 0.7142, test_loss: 1.0881, test_f1: 0.5450
 epoch: 46, train_loss: 0.6999, test_loss: 1.1621, test_f1: 0.5198
 epoch: 47, train_loss: 0.6921, test_loss: 1.1400, test_f1: 0.5193
 epoch: 48, train_loss: 0.6827, test_loss: 1.1498, test_f1: 0.5617
 epoch: 49, train_loss: 0.6788, test_loss: 1.2137, test_f1: 0.5388
 epoch: 50, train_loss: 0.6925, test_loss: 1.1258, test_f1: 0.5322
 epoch: 51, train_loss: 0.6537, test_loss: 1.1806, test_f1: 0.5467
 epoch: 52, train_loss: 0.6165, test_loss: 1.1752, test_f1: 0.5503
 epoch: 53, train_loss: 0.6373, test_loss: 1.1661, test_f1: 0.5547
 epoch: 54, train_loss: 0.6244, test_loss: 1.1906, test_f1: 0.5392
 epoch: 55, train_loss: 0.6250, test_loss: 1.1636, test_f1: 0.5847
 epoch: 56, train_loss: 0.6073, test_loss: 1.2037, test_f1: 0.5150
 epoch: 57, train_loss: 0.6028, test_loss: 1.1856, test_f1: 0.5377
 epoch: 58, train_loss: 0.6112, test_loss: 1.2152, test_f1: 0.5495
 epoch: 59, train_loss: 0.5988, test_loss: 1.2102, test_f1: 0.5448
 epoch: 60, train_loss: 0.5899, test_loss: 1.2334, test_f1: 0.5382
 epoch: 61, train_loss: 0.6046, test_loss: 1.2059, test_f1: 0.5435
 epoch: 62, train_loss: 0.5846, test_loss: 1.2466, test_f1: 0.5475
 epoch: 63, train_loss: 0.5984, test_loss: 1.3080, test_f1: 0.5063
 epoch: 64, train_loss: 0.5964, test_loss: 1.3061, test_f1: 0.5270
 epoch: 65, train_loss: 0.5905, test_loss: 1.2546, test_f1: 0.5532
 epoch: 66, train_loss: 0.5881, test_loss: 1.2559, test_f1: 0.5563
 epoch: 67, train_loss: 0.5744, test_loss: 1.2400, test_f1: 0.5120
 epoch: 68, train_loss: 0.5918, test_loss: 1.3217, test_f1: 0.5270
 epoch: 69, train_loss: 0.5826, test_loss: 1.2500, test_f1: 0.5516
 epoch: 70, train_loss: 0.5668, test_loss: 1.2831, test_f1: 0.5129
 epoch: 71, train_loss: 0.5596, test_loss: 1.2751, test_f1: 0.5226
 epoch: 72, train_loss: 0.5615, test_loss: 1.3009, test_f1: 0.5238
 epoch: 73, train_loss: 0.5438, test_loss: 1.2828, test_f1: 0.5283
 epoch: 74, train_loss: 0.5726, test_loss: 1.3486, test_f1: 0.5470
 epoch: 75, train_loss: 0.5629, test_loss: 1.3620, test_f1: 0.5192
 epoch: 76, train_loss: 0.5549, test_loss: 1.4429, test_f1: 0.5032
 epoch: 77, train_loss: 0.5409, test_loss: 1.3593, test_f1: 0.4943
 epoch: 78, train_loss: 0.5420, test_loss: 1.3427, test_f1: 0.5460
 epoch: 79, train_loss: 0.5261, test_loss: 1.3866, test_f1: 0.5400
 epoch: 80, train_loss: 0.5421, test_loss: 1.3260, test_f1: 0.5361
 epoch: 81, train_loss: 0.5329, test_loss: 1.3434, test_f1: 0.5270
 epoch: 82, train_loss: 0.5281, test_loss: 1.3484, test_f1: 0.5138
 epoch: 83, train_loss: 0.5234, test_loss: 1.3876, test_f1: 0.5470
 epoch: 84, train_loss: 0.5327, test_loss: 1.3317, test_f1: 0.5564
 epoch: 85, train_loss: 0.5546, test_loss: 1.3801, test_f1: 0.5152
 epoch: 86, train_loss: 0.5191, test_loss: 1.4498, test_f1: 0.5215
 epoch: 87, train_loss: 0.5173, test_loss: 1.3992, test_f1: 0.4879
 epoch: 88, train_loss: 0.5066, test_loss: 1.3825, test_f1: 0.5165
 epoch: 89, train_loss: 0.5056, test_loss: 1.4738, test_f1: 0.5119
 epoch: 90, train_loss: 0.4961, test_loss: 1.6011, test_f1: 0.5075
 epoch: 91, train_loss: 0.4859, test_loss: 1.5395, test_f1: 0.5168
 epoch: 92, train_loss: 0.4971, test_loss: 1.5093, test_f1: 0.5158
 epoch: 93, train_loss: 0.5085, test_loss: 1.4521, test_f1: 0.5366
 epoch: 94, train_loss: 0.4955, test_loss: 1.4498, test_f1: 0.5571
 epoch: 95, train_loss: 0.4765, test_loss: 1.5647, test_f1: 0.5315
 epoch: 96, train_loss: 0.4949, test_loss: 1.5271, test_f1: 0.5164
 epoch: 97, train_loss: 0.4819, test_loss: 1.4450, test_f1: 0.5089
 epoch: 98, train_loss: 0.4939, test_loss: 1.4920, test_f1: 0.5339
 epoch: 99, train_loss: 0.4714, test_loss: 1.4669, test_f1: 0.5109
##################ITERATION #7 ****************************************
 epoch: 0, train_loss: 1.5349, test_loss: 1.2366, test_f1: 0.3854
 epoch: 1, train_loss: 1.2410, test_loss: 1.1444, test_f1: 0.4109
 epoch: 2, train_loss: 1.1769, test_loss: 1.0903, test_f1: 0.4306
 epoch: 3, train_loss: 1.1431, test_loss: 1.0526, test_f1: 0.4670
 epoch: 4, train_loss: 1.1109, test_loss: 1.0299, test_f1: 0.4747
 epoch: 5, train_loss: 1.0751, test_loss: 1.0013, test_f1: 0.4744
 epoch: 6, train_loss: 1.0718, test_loss: 0.9934, test_f1: 0.4730
 epoch: 7, train_loss: 1.0466, test_loss: 1.0055, test_f1: 0.4555
 epoch: 8, train_loss: 1.0275, test_loss: 0.9726, test_f1: 0.4877
 epoch: 9, train_loss: 1.0005, test_loss: 0.9820, test_f1: 0.4892
 epoch: 10, train_loss: 0.9879, test_loss: 0.9893, test_f1: 0.4568
 epoch: 11, train_loss: 0.9831, test_loss: 0.9898, test_f1: 0.4957
 epoch: 12, train_loss: 0.9622, test_loss: 1.0009, test_f1: 0.4651
 epoch: 13, train_loss: 0.9492, test_loss: 0.9672, test_f1: 0.4846
 epoch: 14, train_loss: 0.9252, test_loss: 1.0282, test_f1: 0.5143
 epoch: 15, train_loss: 0.9384, test_loss: 0.9954, test_f1: 0.4945
 epoch: 16, train_loss: 0.9227, test_loss: 1.0144, test_f1: 0.5153
 epoch: 17, train_loss: 0.8999, test_loss: 0.9810, test_f1: 0.5369
 epoch: 18, train_loss: 0.8906, test_loss: 0.9878, test_f1: 0.5222
 epoch: 19, train_loss: 0.8878, test_loss: 0.9924, test_f1: 0.5071
 epoch: 20, train_loss: 0.8740, test_loss: 0.9958, test_f1: 0.5080
 epoch: 21, train_loss: 0.8689, test_loss: 0.9795, test_f1: 0.5386
 epoch: 22, train_loss: 0.8592, test_loss: 0.9775, test_f1: 0.5409
 epoch: 23, train_loss: 0.8433, test_loss: 0.9745, test_f1: 0.5250
 epoch: 24, train_loss: 0.8431, test_loss: 1.0604, test_f1: 0.5256
 epoch: 25, train_loss: 0.8297, test_loss: 1.0294, test_f1: 0.5244
 epoch: 26, train_loss: 0.8374, test_loss: 1.0066, test_f1: 0.5462
 epoch: 27, train_loss: 0.8092, test_loss: 1.0098, test_f1: 0.5063
 epoch: 28, train_loss: 0.8145, test_loss: 1.0297, test_f1: 0.5238
 epoch: 29, train_loss: 0.8158, test_loss: 1.0399, test_f1: 0.5272
 epoch: 30, train_loss: 0.7980, test_loss: 1.0295, test_f1: 0.5058
 epoch: 31, train_loss: 0.7836, test_loss: 1.0078, test_f1: 0.5306
 epoch: 32, train_loss: 0.7871, test_loss: 1.0883, test_f1: 0.5027
 epoch: 33, train_loss: 0.7706, test_loss: 1.0368, test_f1: 0.5095
 epoch: 34, train_loss: 0.7708, test_loss: 1.0890, test_f1: 0.5202
 epoch: 35, train_loss: 0.7566, test_loss: 1.0710, test_f1: 0.5284
 epoch: 36, train_loss: 0.7641, test_loss: 1.0875, test_f1: 0.5262
 epoch: 37, train_loss: 0.7522, test_loss: 1.0323, test_f1: 0.5503
 epoch: 38, train_loss: 0.7425, test_loss: 1.0985, test_f1: 0.5421
 epoch: 39, train_loss: 0.7430, test_loss: 1.0413, test_f1: 0.5309
 epoch: 40, train_loss: 0.7471, test_loss: 1.0950, test_f1: 0.5277
 epoch: 41, train_loss: 0.7391, test_loss: 1.1455, test_f1: 0.5245
 epoch: 42, train_loss: 0.7450, test_loss: 1.0511, test_f1: 0.5539
 epoch: 43, train_loss: 0.7279, test_loss: 1.0903, test_f1: 0.5451
 epoch: 44, train_loss: 0.7153, test_loss: 1.0797, test_f1: 0.5285
 epoch: 45, train_loss: 0.7162, test_loss: 1.1282, test_f1: 0.5387
 epoch: 46, train_loss: 0.7165, test_loss: 1.1737, test_f1: 0.5543
 epoch: 47, train_loss: 0.7032, test_loss: 1.1977, test_f1: 0.5171
 epoch: 48, train_loss: 0.6767, test_loss: 1.1553, test_f1: 0.5172
 epoch: 49, train_loss: 0.7009, test_loss: 1.0378, test_f1: 0.5405
 epoch: 50, train_loss: 0.6972, test_loss: 1.0865, test_f1: 0.5448
 epoch: 51, train_loss: 0.6597, test_loss: 1.1152, test_f1: 0.5589
 epoch: 52, train_loss: 0.6551, test_loss: 1.1161, test_f1: 0.5827
 epoch: 53, train_loss: 0.6414, test_loss: 1.1531, test_f1: 0.5638
 epoch: 54, train_loss: 0.6425, test_loss: 1.1397, test_f1: 0.5503
 epoch: 55, train_loss: 0.6349, test_loss: 1.1348, test_f1: 0.5650
 epoch: 56, train_loss: 0.6175, test_loss: 1.1359, test_f1: 0.5526
 epoch: 57, train_loss: 0.6234, test_loss: 1.1398, test_f1: 0.5631
 epoch: 58, train_loss: 0.6136, test_loss: 1.1702, test_f1: 0.5720
 epoch: 59, train_loss: 0.6114, test_loss: 1.1682, test_f1: 0.5345
 epoch: 60, train_loss: 0.6092, test_loss: 1.2122, test_f1: 0.5284
 epoch: 61, train_loss: 0.6104, test_loss: 1.1258, test_f1: 0.5578
 epoch: 62, train_loss: 0.6234, test_loss: 1.1877, test_f1: 0.5601
 epoch: 63, train_loss: 0.6207, test_loss: 1.1498, test_f1: 0.5784
 epoch: 64, train_loss: 0.5994, test_loss: 1.1981, test_f1: 0.5465
 epoch: 65, train_loss: 0.5857, test_loss: 1.2110, test_f1: 0.5601
 epoch: 66, train_loss: 0.5808, test_loss: 1.1829, test_f1: 0.5314
 epoch: 67, train_loss: 0.6000, test_loss: 1.1598, test_f1: 0.5578
 epoch: 68, train_loss: 0.5875, test_loss: 1.1783, test_f1: 0.5504
 epoch: 69, train_loss: 0.5875, test_loss: 1.2078, test_f1: 0.5589
 epoch: 70, train_loss: 0.5749, test_loss: 1.2435, test_f1: 0.5504
 epoch: 71, train_loss: 0.5880, test_loss: 1.2049, test_f1: 0.5631
 epoch: 72, train_loss: 0.5687, test_loss: 1.2067, test_f1: 0.5662
 epoch: 73, train_loss: 0.5788, test_loss: 1.2528, test_f1: 0.5350
 epoch: 74, train_loss: 0.5670, test_loss: 1.2749, test_f1: 0.5399
 epoch: 75, train_loss: 0.5801, test_loss: 1.2883, test_f1: 0.5610
 epoch: 76, train_loss: 0.5597, test_loss: 1.1838, test_f1: 0.5573
 epoch: 77, train_loss: 0.5574, test_loss: 1.2670, test_f1: 0.5535
 epoch: 78, train_loss: 0.5590, test_loss: 1.2608, test_f1: 0.5635
 epoch: 79, train_loss: 0.5479, test_loss: 1.2967, test_f1: 0.5633
 epoch: 80, train_loss: 0.5657, test_loss: 1.2492, test_f1: 0.5228
 epoch: 81, train_loss: 0.5447, test_loss: 1.2696, test_f1: 0.5425
 epoch: 82, train_loss: 0.5558, test_loss: 1.2925, test_f1: 0.5631
 epoch: 83, train_loss: 0.5502, test_loss: 1.1932, test_f1: 0.5715
 epoch: 84, train_loss: 0.5248, test_loss: 1.1988, test_f1: 0.5537
 epoch: 85, train_loss: 0.5476, test_loss: 1.2361, test_f1: 0.5734
 epoch: 86, train_loss: 0.5442, test_loss: 1.2609, test_f1: 0.5368
 epoch: 87, train_loss: 0.5288, test_loss: 1.2960, test_f1: 0.5503
 epoch: 88, train_loss: 0.5370, test_loss: 1.2770, test_f1: 0.5323
 epoch: 89, train_loss: 0.5430, test_loss: 1.2194, test_f1: 0.5317
 epoch: 90, train_loss: 0.5244, test_loss: 1.3240, test_f1: 0.5553
 epoch: 91, train_loss: 0.5133, test_loss: 1.2683, test_f1: 0.5590
 epoch: 92, train_loss: 0.5287, test_loss: 1.2837, test_f1: 0.5409
 epoch: 93, train_loss: 0.5370, test_loss: 1.3180, test_f1: 0.5276
 epoch: 94, train_loss: 0.5106, test_loss: 1.2897, test_f1: 0.5407
 epoch: 95, train_loss: 0.5201, test_loss: 1.2537, test_f1: 0.5312
 epoch: 96, train_loss: 0.5067, test_loss: 1.2964, test_f1: 0.5372
 epoch: 97, train_loss: 0.5214, test_loss: 1.3036, test_f1: 0.5192
 epoch: 98, train_loss: 0.5186, test_loss: 1.2430, test_f1: 0.5534
 epoch: 99, train_loss: 0.5149, test_loss: 1.3407, test_f1: 0.5261
##################ITERATION #8 ****************************************
 epoch: 0, train_loss: 1.4865, test_loss: 1.3669, test_f1: 0.2859
 epoch: 1, train_loss: 1.1999, test_loss: 1.1109, test_f1: 0.4176
 epoch: 2, train_loss: 1.1359, test_loss: 1.0366, test_f1: 0.4375
 epoch: 3, train_loss: 1.1124, test_loss: 1.0221, test_f1: 0.4716
 epoch: 4, train_loss: 1.0797, test_loss: 0.9680, test_f1: 0.4768
 epoch: 5, train_loss: 1.0479, test_loss: 0.9769, test_f1: 0.4457
 epoch: 6, train_loss: 1.0328, test_loss: 0.9407, test_f1: 0.4902
 epoch: 7, train_loss: 1.0225, test_loss: 0.9484, test_f1: 0.4656
 epoch: 8, train_loss: 1.0114, test_loss: 0.9709, test_f1: 0.4504
 epoch: 9, train_loss: 0.9823, test_loss: 0.9461, test_f1: 0.4913
 epoch: 10, train_loss: 0.9693, test_loss: 0.9205, test_f1: 0.4895
 epoch: 11, train_loss: 0.9543, test_loss: 0.9761, test_f1: 0.4597
 epoch: 12, train_loss: 0.9472, test_loss: 0.9842, test_f1: 0.4596
 epoch: 13, train_loss: 0.9292, test_loss: 0.9784, test_f1: 0.4985
 epoch: 14, train_loss: 0.9356, test_loss: 0.9519, test_f1: 0.5099
 epoch: 15, train_loss: 0.9174, test_loss: 0.9349, test_f1: 0.5244
 epoch: 16, train_loss: 0.8975, test_loss: 0.9808, test_f1: 0.5014
 epoch: 17, train_loss: 0.8947, test_loss: 1.0238, test_f1: 0.4869
 epoch: 18, train_loss: 0.8815, test_loss: 1.0028, test_f1: 0.5219
 epoch: 19, train_loss: 0.8915, test_loss: 1.0070, test_f1: 0.5225
 epoch: 20, train_loss: 0.8653, test_loss: 0.9953, test_f1: 0.5212
 epoch: 21, train_loss: 0.8549, test_loss: 1.0269, test_f1: 0.4985
 epoch: 22, train_loss: 0.8582, test_loss: 0.9923, test_f1: 0.5311
 epoch: 23, train_loss: 0.8433, test_loss: 0.9808, test_f1: 0.5471
 epoch: 24, train_loss: 0.8407, test_loss: 1.0246, test_f1: 0.5359
 epoch: 25, train_loss: 0.8207, test_loss: 1.0538, test_f1: 0.5176
 epoch: 26, train_loss: 0.8249, test_loss: 1.0259, test_f1: 0.5281
 epoch: 27, train_loss: 0.8158, test_loss: 1.0532, test_f1: 0.5223
 epoch: 28, train_loss: 0.8089, test_loss: 1.0560, test_f1: 0.5254
 epoch: 29, train_loss: 0.8057, test_loss: 1.0853, test_f1: 0.4968
 epoch: 30, train_loss: 0.8025, test_loss: 1.1558, test_f1: 0.4840
 epoch: 31, train_loss: 0.7990, test_loss: 1.0946, test_f1: 0.5227
 epoch: 32, train_loss: 0.8076, test_loss: 1.0534, test_f1: 0.5182
 epoch: 33, train_loss: 0.7824, test_loss: 1.0663, test_f1: 0.5281
 epoch: 34, train_loss: 0.7897, test_loss: 1.0803, test_f1: 0.5378
 epoch: 35, train_loss: 0.7672, test_loss: 1.0699, test_f1: 0.5049
 epoch: 36, train_loss: 0.7642, test_loss: 1.0955, test_f1: 0.5272
 epoch: 37, train_loss: 0.7511, test_loss: 1.0838, test_f1: 0.5271
 epoch: 38, train_loss: 0.7612, test_loss: 1.1994, test_f1: 0.4949
 epoch: 39, train_loss: 0.7357, test_loss: 1.1123, test_f1: 0.5299
 epoch: 40, train_loss: 0.7417, test_loss: 1.0997, test_f1: 0.5235
 epoch: 41, train_loss: 0.7453, test_loss: 1.1086, test_f1: 0.5351
 epoch: 42, train_loss: 0.7398, test_loss: 1.1536, test_f1: 0.5128
 epoch: 43, train_loss: 0.7308, test_loss: 1.1354, test_f1: 0.5347
 epoch: 44, train_loss: 0.7214, test_loss: 1.1326, test_f1: 0.5384
 epoch: 45, train_loss: 0.7142, test_loss: 1.1492, test_f1: 0.5146
 epoch: 46, train_loss: 0.7093, test_loss: 1.2511, test_f1: 0.5263
 epoch: 47, train_loss: 0.7015, test_loss: 1.2158, test_f1: 0.5409
 epoch: 48, train_loss: 0.7159, test_loss: 1.1264, test_f1: 0.5323
 epoch: 49, train_loss: 0.7054, test_loss: 1.2068, test_f1: 0.5324
 epoch: 50, train_loss: 0.7028, test_loss: 1.1766, test_f1: 0.5305
 epoch: 51, train_loss: 0.6693, test_loss: 1.1876, test_f1: 0.5310
 epoch: 52, train_loss: 0.6593, test_loss: 1.1755, test_f1: 0.5351
 epoch: 53, train_loss: 0.6454, test_loss: 1.1929, test_f1: 0.5415
 epoch: 54, train_loss: 0.6510, test_loss: 1.2150, test_f1: 0.5389
 epoch: 55, train_loss: 0.6443, test_loss: 1.1952, test_f1: 0.5382
 epoch: 56, train_loss: 0.6296, test_loss: 1.2546, test_f1: 0.5249
 epoch: 57, train_loss: 0.6281, test_loss: 1.2297, test_f1: 0.5270
 epoch: 58, train_loss: 0.6343, test_loss: 1.2231, test_f1: 0.5462
 epoch: 59, train_loss: 0.6341, test_loss: 1.2999, test_f1: 0.5118
 epoch: 60, train_loss: 0.6197, test_loss: 1.2307, test_f1: 0.5281
 epoch: 61, train_loss: 0.6271, test_loss: 1.2397, test_f1: 0.5225
 epoch: 62, train_loss: 0.6237, test_loss: 1.2137, test_f1: 0.5397
 epoch: 63, train_loss: 0.6102, test_loss: 1.2084, test_f1: 0.5282
 epoch: 64, train_loss: 0.6215, test_loss: 1.2618, test_f1: 0.5310
 epoch: 65, train_loss: 0.6039, test_loss: 1.2636, test_f1: 0.5257
 epoch: 66, train_loss: 0.6143, test_loss: 1.2059, test_f1: 0.5240
 epoch: 67, train_loss: 0.6005, test_loss: 1.2680, test_f1: 0.5282
 epoch: 68, train_loss: 0.5999, test_loss: 1.2352, test_f1: 0.5578
 epoch: 69, train_loss: 0.5832, test_loss: 1.3539, test_f1: 0.5343
 epoch: 70, train_loss: 0.5919, test_loss: 1.3254, test_f1: 0.5253
 epoch: 71, train_loss: 0.5721, test_loss: 1.2499, test_f1: 0.5251
 epoch: 72, train_loss: 0.5822, test_loss: 1.3312, test_f1: 0.5293
 epoch: 73, train_loss: 0.5836, test_loss: 1.2847, test_f1: 0.5271
 epoch: 74, train_loss: 0.5813, test_loss: 1.3483, test_f1: 0.5210
 epoch: 75, train_loss: 0.5673, test_loss: 1.3702, test_f1: 0.5303
 epoch: 76, train_loss: 0.5721, test_loss: 1.4070, test_f1: 0.5276
 epoch: 77, train_loss: 0.5767, test_loss: 1.2982, test_f1: 0.5348
 epoch: 78, train_loss: 0.5770, test_loss: 1.3366, test_f1: 0.5353
 epoch: 79, train_loss: 0.5591, test_loss: 1.3165, test_f1: 0.5192
 epoch: 80, train_loss: 0.5606, test_loss: 1.3036, test_f1: 0.5302
 epoch: 81, train_loss: 0.5604, test_loss: 1.3345, test_f1: 0.5208
 epoch: 82, train_loss: 0.5599, test_loss: 1.4445, test_f1: 0.5268
 epoch: 83, train_loss: 0.5629, test_loss: 1.3924, test_f1: 0.5284
 epoch: 84, train_loss: 0.5314, test_loss: 1.3984, test_f1: 0.5394
 epoch: 85, train_loss: 0.5622, test_loss: 1.4869, test_f1: 0.5045
 epoch: 86, train_loss: 0.5370, test_loss: 1.3666, test_f1: 0.5418
 epoch: 87, train_loss: 0.5472, test_loss: 1.3782, test_f1: 0.5268
 epoch: 88, train_loss: 0.5375, test_loss: 1.4532, test_f1: 0.5114
 epoch: 89, train_loss: 0.5438, test_loss: 1.4304, test_f1: 0.5217
 epoch: 90, train_loss: 0.5211, test_loss: 1.4648, test_f1: 0.5205
 epoch: 91, train_loss: 0.5303, test_loss: 1.4741, test_f1: 0.5279
 epoch: 92, train_loss: 0.5143, test_loss: 1.4106, test_f1: 0.5214
 epoch: 93, train_loss: 0.5527, test_loss: 1.4093, test_f1: 0.5333
 epoch: 94, train_loss: 0.5178, test_loss: 1.4210, test_f1: 0.5121
 epoch: 95, train_loss: 0.5146, test_loss: 1.4686, test_f1: 0.5088
 epoch: 96, train_loss: 0.5240, test_loss: 1.5398, test_f1: 0.5084
 epoch: 97, train_loss: 0.5276, test_loss: 1.4611, test_f1: 0.5013
 epoch: 98, train_loss: 0.5092, test_loss: 1.4205, test_f1: 0.5277
 epoch: 99, train_loss: 0.5176, test_loss: 1.4220, test_f1: 0.5217
##################ITERATION #9 ****************************************
 epoch: 0, train_loss: 1.6175, test_loss: 1.2211, test_f1: 0.3562
 epoch: 1, train_loss: 1.1911, test_loss: 1.1331, test_f1: 0.4072
 epoch: 2, train_loss: 1.1498, test_loss: 1.0630, test_f1: 0.4137
 epoch: 3, train_loss: 1.0961, test_loss: 1.0198, test_f1: 0.4507
 epoch: 4, train_loss: 1.0731, test_loss: 0.9838, test_f1: 0.4584
 epoch: 5, train_loss: 1.0303, test_loss: 0.9553, test_f1: 0.4725
 epoch: 6, train_loss: 1.0055, test_loss: 0.9911, test_f1: 0.4730
 epoch: 7, train_loss: 1.0016, test_loss: 0.9949, test_f1: 0.4701
 epoch: 8, train_loss: 0.9742, test_loss: 0.9308, test_f1: 0.5005
 epoch: 9, train_loss: 0.9482, test_loss: 0.9364, test_f1: 0.5215
 epoch: 10, train_loss: 0.9386, test_loss: 0.9571, test_f1: 0.4993
 epoch: 11, train_loss: 0.9195, test_loss: 0.9936, test_f1: 0.5187
 epoch: 12, train_loss: 0.9209, test_loss: 0.9902, test_f1: 0.5001
 epoch: 13, train_loss: 0.8984, test_loss: 0.9914, test_f1: 0.4927
 epoch: 14, train_loss: 0.8787, test_loss: 0.9594, test_f1: 0.4868
 epoch: 15, train_loss: 0.8933, test_loss: 0.9977, test_f1: 0.5437
 epoch: 16, train_loss: 0.8743, test_loss: 1.0265, test_f1: 0.4892
 epoch: 17, train_loss: 0.8580, test_loss: 0.9888, test_f1: 0.5089
 epoch: 18, train_loss: 0.8429, test_loss: 1.0600, test_f1: 0.5327
 epoch: 19, train_loss: 0.8466, test_loss: 1.1419, test_f1: 0.5063
 epoch: 20, train_loss: 0.8307, test_loss: 1.0051, test_f1: 0.5263
 epoch: 21, train_loss: 0.8287, test_loss: 1.0558, test_f1: 0.5311
 epoch: 22, train_loss: 0.8257, test_loss: 1.0404, test_f1: 0.5175
 epoch: 23, train_loss: 0.8153, test_loss: 1.0580, test_f1: 0.5260
 epoch: 24, train_loss: 0.8211, test_loss: 1.0730, test_f1: 0.5222
 epoch: 25, train_loss: 0.7964, test_loss: 1.0856, test_f1: 0.5425
 epoch: 26, train_loss: 0.7926, test_loss: 1.0604, test_f1: 0.5092
 epoch: 27, train_loss: 0.7935, test_loss: 1.0804, test_f1: 0.5373
 epoch: 28, train_loss: 0.7720, test_loss: 1.1017, test_f1: 0.5286
 epoch: 29, train_loss: 0.7668, test_loss: 1.0791, test_f1: 0.5197
 epoch: 30, train_loss: 0.7527, test_loss: 1.1158, test_f1: 0.5287
 epoch: 31, train_loss: 0.7718, test_loss: 1.0613, test_f1: 0.5311
 epoch: 32, train_loss: 0.7588, test_loss: 1.1920, test_f1: 0.4866
 epoch: 33, train_loss: 0.7517, test_loss: 1.2279, test_f1: 0.5270
 epoch: 34, train_loss: 0.7394, test_loss: 1.2387, test_f1: 0.5079
 epoch: 35, train_loss: 0.7424, test_loss: 1.1761, test_f1: 0.5293
 epoch: 36, train_loss: 0.7329, test_loss: 1.1474, test_f1: 0.5140
 epoch: 37, train_loss: 0.7391, test_loss: 1.1553, test_f1: 0.5236
 epoch: 38, train_loss: 0.7214, test_loss: 1.1642, test_f1: 0.5475
 epoch: 39, train_loss: 0.7002, test_loss: 1.1802, test_f1: 0.5113
 epoch: 40, train_loss: 0.7150, test_loss: 1.2214, test_f1: 0.5420
 epoch: 41, train_loss: 0.6888, test_loss: 1.2553, test_f1: 0.5315
 epoch: 42, train_loss: 0.6986, test_loss: 1.2031, test_f1: 0.5172
 epoch: 43, train_loss: 0.6861, test_loss: 1.1450, test_f1: 0.5309
 epoch: 44, train_loss: 0.7041, test_loss: 1.3162, test_f1: 0.5077
 epoch: 45, train_loss: 0.6755, test_loss: 1.3103, test_f1: 0.5220
 epoch: 46, train_loss: 0.6542, test_loss: 1.3033, test_f1: 0.5256
 epoch: 47, train_loss: 0.6626, test_loss: 1.3919, test_f1: 0.5081
 epoch: 48, train_loss: 0.6742, test_loss: 1.2098, test_f1: 0.5187
 epoch: 49, train_loss: 0.6673, test_loss: 1.3071, test_f1: 0.5198
 epoch: 50, train_loss: 0.6757, test_loss: 1.2439, test_f1: 0.5372
 epoch: 51, train_loss: 0.6571, test_loss: 1.3204, test_f1: 0.5416
 epoch: 52, train_loss: 0.6145, test_loss: 1.3165, test_f1: 0.5255
 epoch: 53, train_loss: 0.6162, test_loss: 1.3490, test_f1: 0.5178
 epoch: 54, train_loss: 0.6158, test_loss: 1.3010, test_f1: 0.5307
 epoch: 55, train_loss: 0.6040, test_loss: 1.3161, test_f1: 0.5344
 epoch: 56, train_loss: 0.6040, test_loss: 1.3279, test_f1: 0.5524
 epoch: 57, train_loss: 0.5875, test_loss: 1.3020, test_f1: 0.5467
 epoch: 58, train_loss: 0.5796, test_loss: 1.3543, test_f1: 0.5342
 epoch: 59, train_loss: 0.6013, test_loss: 1.3491, test_f1: 0.5329
 epoch: 60, train_loss: 0.5794, test_loss: 1.4054, test_f1: 0.5325
 epoch: 61, train_loss: 0.5677, test_loss: 1.3532, test_f1: 0.5427
 epoch: 62, train_loss: 0.5852, test_loss: 1.3300, test_f1: 0.5317
 epoch: 63, train_loss: 0.5760, test_loss: 1.4290, test_f1: 0.5356
 epoch: 64, train_loss: 0.5533, test_loss: 1.3385, test_f1: 0.5471
 epoch: 65, train_loss: 0.5595, test_loss: 1.3675, test_f1: 0.5511
 epoch: 66, train_loss: 0.5750, test_loss: 1.2768, test_f1: 0.5446
 epoch: 67, train_loss: 0.5628, test_loss: 1.4319, test_f1: 0.5324
 epoch: 68, train_loss: 0.5554, test_loss: 1.3779, test_f1: 0.5409
 epoch: 69, train_loss: 0.5516, test_loss: 1.4217, test_f1: 0.5386
 epoch: 70, train_loss: 0.5386, test_loss: 1.4387, test_f1: 0.5528
 epoch: 71, train_loss: 0.5414, test_loss: 1.4205, test_f1: 0.5424
 epoch: 72, train_loss: 0.5470, test_loss: 1.4292, test_f1: 0.5528
 epoch: 73, train_loss: 0.5279, test_loss: 1.4071, test_f1: 0.5333
 epoch: 74, train_loss: 0.5470, test_loss: 1.3433, test_f1: 0.5531
 epoch: 75, train_loss: 0.5252, test_loss: 1.4813, test_f1: 0.5408
 epoch: 76, train_loss: 0.5307, test_loss: 1.6288, test_f1: 0.5274
 epoch: 77, train_loss: 0.5316, test_loss: 1.4094, test_f1: 0.5683
 epoch: 78, train_loss: 0.5341, test_loss: 1.4128, test_f1: 0.5455
 epoch: 79, train_loss: 0.5356, test_loss: 1.4870, test_f1: 0.5371
 epoch: 80, train_loss: 0.5245, test_loss: 1.3999, test_f1: 0.5472
 epoch: 81, train_loss: 0.5139, test_loss: 1.5630, test_f1: 0.5391
 epoch: 82, train_loss: 0.5118, test_loss: 1.5003, test_f1: 0.5460
 epoch: 83, train_loss: 0.5046, test_loss: 1.5059, test_f1: 0.5452
 epoch: 84, train_loss: 0.5218, test_loss: 1.4807, test_f1: 0.5521
 epoch: 85, train_loss: 0.5328, test_loss: 1.3808, test_f1: 0.5364
 epoch: 86, train_loss: 0.5090, test_loss: 1.5141, test_f1: 0.5414
 epoch: 87, train_loss: 0.5161, test_loss: 1.5411, test_f1: 0.5334
 epoch: 88, train_loss: 0.5111, test_loss: 1.4724, test_f1: 0.5554
 epoch: 89, train_loss: 0.5284, test_loss: 1.3851, test_f1: 0.5432
 epoch: 90, train_loss: 0.4933, test_loss: 1.5049, test_f1: 0.5376
 epoch: 91, train_loss: 0.4946, test_loss: 1.4006, test_f1: 0.5313
 epoch: 92, train_loss: 0.4961, test_loss: 1.5602, test_f1: 0.5341
 epoch: 93, train_loss: 0.4915, test_loss: 1.5895, test_f1: 0.5290
 epoch: 94, train_loss: 0.4733, test_loss: 1.5382, test_f1: 0.5269
 epoch: 95, train_loss: 0.4817, test_loss: 1.5905, test_f1: 0.5648
 epoch: 96, train_loss: 0.4940, test_loss: 1.4984, test_f1: 0.5322
 epoch: 97, train_loss: 0.4814, test_loss: 1.5553, test_f1: 0.5450
 epoch: 98, train_loss: 0.4879, test_loss: 1.5929, test_f1: 0.5185
 epoch: 99, train_loss: 0.4833, test_loss: 1.4898, test_f1: 0.5375

Training completed in 422.31 seconds
Best F1: 0.6009 at epoch 67
Mean F1 across iterations: 0.5789  0.0122
========================FINAL RESULTS================================
FEGIN weighted F1: 0.6009  0.0122
python main.py --data ltspice_examples --representation component_component --model FEGIN --layers 2 --hiddens 64 --batch_size 128 --lr 0.001 --emb_size 250 --epochs 100 --save_appendix component_component_L2_H64_BS128_LR0.001_E250 --no_val
-----



STDERR:
  File "main.py", line 370, in <module>
    main()
  File "main.py", line 254, in main
    dataset = dataset_class(
  File "/home/philip/projects/ltspice_examples_code_repo/Circuit-Completion-Using-GNNs/component_classification_with_link_prediction_head/evaluation/FEGIN/kernel/circuit_datasets.py", line 15, in __init__
    self.data, self.slices = torch.load(self.processed_paths[0])
  File "/home/philip/.local/lib/python3.8/site-packages/torch/serialization.py", line 1040, in load
    warnings.warn(
  File "/usr/lib/python3.8/warnings.py", line 109, in _showwarnmsg
    sw(msg.message, msg.category, msg.filename, msg.lineno,
  File "main.py", line 47, in warn_with_traceback
    traceback.print_stack(file=log)
/home/philip/projects/ltspice_examples_code_repo/Circuit-Completion-Using-GNNs/component_classification_with_link_prediction_head/evaluation/FEGIN/kernel/circuit_datasets.py:15: FutureWarning: You are using `torch.load` with `weights_only=False` (the current default value), which uses the default pickle module implicitly. It is possible to construct malicious pickle data which will execute arbitrary code during unpickling (See https://github.com/pytorch/pytorch/blob/main/SECURITY.md#untrusted-models for more details). In a future release, the default value for `weights_only` will be flipped to `True`. This limits the functions that could be executed during unpickling. Arbitrary objects will no longer be allowed to be loaded via this mode unless they are explicitly allowlisted by the user via `torch.serialization.add_safe_globals`. We recommend you start setting `weights_only=True` for any use case where you don't have full control of the loaded file. Please open an issue on GitHub for any issues related to this experimental feature.
  self.data, self.slices = torch.load(self.processed_paths[0])
