STDOUT:
Results will be saved in /home/philip/projects/ltspice_examples_code_repo/Circuit-Completion-Using-GNNs/component_classification_with_link_prediction_head/evaluation/FEGIN/results/model_FEGIN_dataset_ltspice_examples
Command line input: python main.py --data ltspice_examples --representation component_pin --model FEGIN --layers 5 --hiddens 16 --batch_size 256 --lr 0.001 --emb_size 128 --epochs 100 --save_appendix component_pin_L5_H16_BS256_LR0.001_E128 --no_val
 is saved.
-----
ltspice_examples - FEGIN
Using 5 layers, 16 hidden units, h = 2
Loading component_pin representation dataset
ENTERED
Training FEGIN on component_pin representation
Train: 3560, Test: 848
##################ITERATION #0 ****************************************
 epoch: 0, train_loss: 1.4368, test_loss: 1.4214, test_f1: 0.1017
 epoch: 1, train_loss: 1.4145, test_loss: 1.4059, test_f1: 0.1017
 epoch: 2, train_loss: 1.3940, test_loss: 1.3844, test_f1: 0.1017
 epoch: 3, train_loss: 1.3660, test_loss: 1.3541, test_f1: 0.2074
 epoch: 4, train_loss: 1.3373, test_loss: 1.3242, test_f1: 0.2416
 epoch: 5, train_loss: 1.3121, test_loss: 1.2998, test_f1: 0.2477
 epoch: 6, train_loss: 1.2932, test_loss: 1.2735, test_f1: 0.2539
 epoch: 7, train_loss: 1.2631, test_loss: 1.2459, test_f1: 0.2273
 epoch: 8, train_loss: 1.2359, test_loss: 1.2105, test_f1: 0.2323
 epoch: 9, train_loss: 1.2012, test_loss: 1.1742, test_f1: 0.3811
 epoch: 10, train_loss: 1.1793, test_loss: 1.1307, test_f1: 0.3913
 epoch: 11, train_loss: 1.1475, test_loss: 1.0978, test_f1: 0.3851
 epoch: 12, train_loss: 1.1210, test_loss: 1.0834, test_f1: 0.3914
 epoch: 13, train_loss: 1.0974, test_loss: 1.0692, test_f1: 0.3934
 epoch: 14, train_loss: 1.0878, test_loss: 1.1061, test_f1: 0.3731
 epoch: 15, train_loss: 1.0869, test_loss: 1.0505, test_f1: 0.3935
 epoch: 16, train_loss: 1.0754, test_loss: 1.1063, test_f1: 0.3736
 epoch: 17, train_loss: 1.0640, test_loss: 1.0598, test_f1: 0.3824
 epoch: 18, train_loss: 1.0464, test_loss: 1.0451, test_f1: 0.3834
 epoch: 19, train_loss: 1.0413, test_loss: 1.0545, test_f1: 0.3643
 epoch: 20, train_loss: 1.0291, test_loss: 1.0367, test_f1: 0.4021
 epoch: 21, train_loss: 1.0237, test_loss: 1.0416, test_f1: 0.3908
 epoch: 22, train_loss: 1.0175, test_loss: 1.0443, test_f1: 0.4081
 epoch: 23, train_loss: 1.0184, test_loss: 1.0315, test_f1: 0.4526
 epoch: 24, train_loss: 1.0125, test_loss: 1.0589, test_f1: 0.4237
 epoch: 25, train_loss: 1.0162, test_loss: 1.0761, test_f1: 0.4048
 epoch: 26, train_loss: 0.9924, test_loss: 1.0484, test_f1: 0.4583
 epoch: 27, train_loss: 0.9901, test_loss: 1.0225, test_f1: 0.4959
 epoch: 28, train_loss: 0.9819, test_loss: 1.0136, test_f1: 0.4942
 epoch: 29, train_loss: 0.9803, test_loss: 1.0703, test_f1: 0.4566
 epoch: 30, train_loss: 0.9770, test_loss: 1.2064, test_f1: 0.4115
 epoch: 31, train_loss: 0.9613, test_loss: 1.0541, test_f1: 0.4624
 epoch: 32, train_loss: 0.9656, test_loss: 1.0129, test_f1: 0.4865
 epoch: 33, train_loss: 0.9577, test_loss: 1.0085, test_f1: 0.5039
 epoch: 34, train_loss: 0.9562, test_loss: 1.0406, test_f1: 0.5012
 epoch: 35, train_loss: 0.9550, test_loss: 1.2061, test_f1: 0.4520
 epoch: 36, train_loss: 0.9467, test_loss: 1.0070, test_f1: 0.4865
 epoch: 37, train_loss: 0.9414, test_loss: 1.0348, test_f1: 0.4968
 epoch: 38, train_loss: 0.9466, test_loss: 0.9761, test_f1: 0.5020
 epoch: 39, train_loss: 0.9373, test_loss: 1.1692, test_f1: 0.4533
 epoch: 40, train_loss: 0.9381, test_loss: 1.0233, test_f1: 0.4745
 epoch: 41, train_loss: 0.9264, test_loss: 1.0217, test_f1: 0.4851
 epoch: 42, train_loss: 0.9263, test_loss: 0.9930, test_f1: 0.4919
 epoch: 43, train_loss: 0.9162, test_loss: 1.0822, test_f1: 0.4758
 epoch: 44, train_loss: 0.9150, test_loss: 1.0520, test_f1: 0.4932
 epoch: 45, train_loss: 0.9162, test_loss: 0.9635, test_f1: 0.5074
 epoch: 46, train_loss: 0.9153, test_loss: 1.0597, test_f1: 0.5098
 epoch: 47, train_loss: 0.9024, test_loss: 0.9910, test_f1: 0.4852
 epoch: 48, train_loss: 0.9002, test_loss: 1.0296, test_f1: 0.4889
 epoch: 49, train_loss: 0.8936, test_loss: 1.0444, test_f1: 0.4902
 epoch: 50, train_loss: 0.8950, test_loss: 0.9815, test_f1: 0.4871
 epoch: 51, train_loss: 0.8868, test_loss: 1.0080, test_f1: 0.4911
 epoch: 52, train_loss: 0.8738, test_loss: 1.0942, test_f1: 0.4899
 epoch: 53, train_loss: 0.8853, test_loss: 1.0530, test_f1: 0.4798
 epoch: 54, train_loss: 0.8866, test_loss: 1.0241, test_f1: 0.5202
 epoch: 55, train_loss: 0.8742, test_loss: 1.0495, test_f1: 0.5095
 epoch: 56, train_loss: 0.8765, test_loss: 1.0457, test_f1: 0.4920
 epoch: 57, train_loss: 0.8754, test_loss: 1.0019, test_f1: 0.5020
 epoch: 58, train_loss: 0.8697, test_loss: 1.0072, test_f1: 0.5118
 epoch: 59, train_loss: 0.8682, test_loss: 1.0527, test_f1: 0.5053
 epoch: 60, train_loss: 0.8693, test_loss: 1.0021, test_f1: 0.5026
 epoch: 61, train_loss: 0.8651, test_loss: 1.0389, test_f1: 0.4982
 epoch: 62, train_loss: 0.8622, test_loss: 1.0266, test_f1: 0.4935
 epoch: 63, train_loss: 0.8601, test_loss: 1.0615, test_f1: 0.4939
 epoch: 64, train_loss: 0.8634, test_loss: 1.0995, test_f1: 0.4845
 epoch: 65, train_loss: 0.8685, test_loss: 1.1239, test_f1: 0.4995
 epoch: 66, train_loss: 0.8545, test_loss: 1.0398, test_f1: 0.5054
 epoch: 67, train_loss: 0.8504, test_loss: 1.0135, test_f1: 0.4907
 epoch: 68, train_loss: 0.8560, test_loss: 1.0241, test_f1: 0.5128
 epoch: 69, train_loss: 0.8477, test_loss: 1.0529, test_f1: 0.4901
 epoch: 70, train_loss: 0.8481, test_loss: 1.1528, test_f1: 0.4886
 epoch: 71, train_loss: 0.8426, test_loss: 1.0813, test_f1: 0.5044
 epoch: 72, train_loss: 0.8481, test_loss: 1.0541, test_f1: 0.4998
 epoch: 73, train_loss: 0.8432, test_loss: 1.0979, test_f1: 0.4987
 epoch: 74, train_loss: 0.8374, test_loss: 1.0115, test_f1: 0.5010
 epoch: 75, train_loss: 0.8369, test_loss: 1.0858, test_f1: 0.5179
 epoch: 76, train_loss: 0.8393, test_loss: 1.0801, test_f1: 0.5125
 epoch: 77, train_loss: 0.8383, test_loss: 1.0883, test_f1: 0.5130
 epoch: 78, train_loss: 0.8344, test_loss: 1.0455, test_f1: 0.5052
 epoch: 79, train_loss: 0.8246, test_loss: 1.0449, test_f1: 0.5086
 epoch: 80, train_loss: 0.8217, test_loss: 1.0919, test_f1: 0.5032
 epoch: 81, train_loss: 0.8204, test_loss: 1.0955, test_f1: 0.5011
 epoch: 82, train_loss: 0.8256, test_loss: 1.0561, test_f1: 0.5240
 epoch: 83, train_loss: 0.8252, test_loss: 0.9947, test_f1: 0.5108
 epoch: 84, train_loss: 0.8112, test_loss: 1.1108, test_f1: 0.5206
 epoch: 85, train_loss: 0.8176, test_loss: 1.0338, test_f1: 0.5162
 epoch: 86, train_loss: 0.8156, test_loss: 1.0640, test_f1: 0.5255
 epoch: 87, train_loss: 0.8137, test_loss: 1.0262, test_f1: 0.5290
 epoch: 88, train_loss: 0.8151, test_loss: 1.1165, test_f1: 0.5237
 epoch: 89, train_loss: 0.8101, test_loss: 1.1495, test_f1: 0.5129
 epoch: 90, train_loss: 0.8035, test_loss: 1.0138, test_f1: 0.5223
 epoch: 91, train_loss: 0.7986, test_loss: 1.0142, test_f1: 0.5555
 epoch: 92, train_loss: 0.8016, test_loss: 1.0766, test_f1: 0.5240
 epoch: 93, train_loss: 0.7930, test_loss: 1.0746, test_f1: 0.5151
 epoch: 94, train_loss: 0.8198, test_loss: 1.0815, test_f1: 0.5264
 epoch: 95, train_loss: 0.7865, test_loss: 1.1026, test_f1: 0.5116
 epoch: 96, train_loss: 0.7857, test_loss: 1.0353, test_f1: 0.5168
 epoch: 97, train_loss: 0.7826, test_loss: 1.0734, test_f1: 0.5218
 epoch: 98, train_loss: 0.7856, test_loss: 1.0851, test_f1: 0.5205
 epoch: 99, train_loss: 0.7768, test_loss: 1.1722, test_f1: 0.5064
##################ITERATION #1 ****************************************
 epoch: 0, train_loss: 1.3452, test_loss: 1.3470, test_f1: 0.1017
 epoch: 1, train_loss: 1.2778, test_loss: 1.3224, test_f1: 0.2453
 epoch: 2, train_loss: 1.2330, test_loss: 1.2681, test_f1: 0.2260
 epoch: 3, train_loss: 1.1936, test_loss: 1.1802, test_f1: 0.3311
 epoch: 4, train_loss: 1.1576, test_loss: 1.1290, test_f1: 0.3257
 epoch: 5, train_loss: 1.1267, test_loss: 1.1138, test_f1: 0.3236
 epoch: 6, train_loss: 1.0997, test_loss: 1.0882, test_f1: 0.3381
 epoch: 7, train_loss: 1.0822, test_loss: 1.0910, test_f1: 0.3366
 epoch: 8, train_loss: 1.0599, test_loss: 1.0842, test_f1: 0.3299
 epoch: 9, train_loss: 1.0437, test_loss: 1.0814, test_f1: 0.3360
 epoch: 10, train_loss: 1.0329, test_loss: 1.0768, test_f1: 0.4406
 epoch: 11, train_loss: 1.0372, test_loss: 1.0667, test_f1: 0.3984
 epoch: 12, train_loss: 1.0232, test_loss: 1.0702, test_f1: 0.4515
 epoch: 13, train_loss: 1.0223, test_loss: 1.0683, test_f1: 0.4732
 epoch: 14, train_loss: 1.0112, test_loss: 1.0542, test_f1: 0.4548
 epoch: 15, train_loss: 0.9962, test_loss: 1.0550, test_f1: 0.4669
 epoch: 16, train_loss: 0.9896, test_loss: 1.0456, test_f1: 0.4637
 epoch: 17, train_loss: 0.9901, test_loss: 1.0789, test_f1: 0.4766
 epoch: 18, train_loss: 0.9773, test_loss: 1.1698, test_f1: 0.4564
 epoch: 19, train_loss: 0.9744, test_loss: 1.0430, test_f1: 0.4861
 epoch: 20, train_loss: 0.9688, test_loss: 1.0535, test_f1: 0.4802
 epoch: 21, train_loss: 0.9702, test_loss: 1.0787, test_f1: 0.4569
 epoch: 22, train_loss: 0.9623, test_loss: 1.0701, test_f1: 0.4604
 epoch: 23, train_loss: 0.9631, test_loss: 1.1231, test_f1: 0.4586
 epoch: 24, train_loss: 0.9505, test_loss: 1.0442, test_f1: 0.4760
 epoch: 25, train_loss: 0.9529, test_loss: 1.0289, test_f1: 0.4808
 epoch: 26, train_loss: 0.9433, test_loss: 1.0888, test_f1: 0.4650
 epoch: 27, train_loss: 0.9450, test_loss: 1.0490, test_f1: 0.4740
 epoch: 28, train_loss: 0.9382, test_loss: 1.0341, test_f1: 0.4887
 epoch: 29, train_loss: 0.9309, test_loss: 1.1247, test_f1: 0.4508
 epoch: 30, train_loss: 0.9350, test_loss: 1.0526, test_f1: 0.4838
 epoch: 31, train_loss: 0.9308, test_loss: 0.9879, test_f1: 0.4808
 epoch: 32, train_loss: 0.9349, test_loss: 1.0699, test_f1: 0.4630
 epoch: 33, train_loss: 0.9171, test_loss: 1.1724, test_f1: 0.4695
 epoch: 34, train_loss: 0.9259, test_loss: 1.0448, test_f1: 0.4590
 epoch: 35, train_loss: 0.9226, test_loss: 1.1136, test_f1: 0.4700
 epoch: 36, train_loss: 0.9124, test_loss: 1.0997, test_f1: 0.4702
 epoch: 37, train_loss: 0.9060, test_loss: 1.1090, test_f1: 0.4683
 epoch: 38, train_loss: 0.8975, test_loss: 1.0203, test_f1: 0.4798
 epoch: 39, train_loss: 0.9026, test_loss: 1.0296, test_f1: 0.4675
 epoch: 40, train_loss: 0.9107, test_loss: 1.0224, test_f1: 0.4867
 epoch: 41, train_loss: 0.9013, test_loss: 1.0237, test_f1: 0.4986
 epoch: 42, train_loss: 0.8976, test_loss: 1.0792, test_f1: 0.4858
 epoch: 43, train_loss: 0.8920, test_loss: 1.1098, test_f1: 0.4660
 epoch: 44, train_loss: 0.8895, test_loss: 1.1459, test_f1: 0.4639
 epoch: 45, train_loss: 0.8869, test_loss: 1.0223, test_f1: 0.4885
 epoch: 46, train_loss: 0.8915, test_loss: 1.0707, test_f1: 0.4594
 epoch: 47, train_loss: 0.8802, test_loss: 1.0062, test_f1: 0.5071
 epoch: 48, train_loss: 0.8834, test_loss: 1.0656, test_f1: 0.4856
 epoch: 49, train_loss: 0.8721, test_loss: 1.0380, test_f1: 0.5047
 epoch: 50, train_loss: 0.8738, test_loss: 1.1622, test_f1: 0.4699
 epoch: 51, train_loss: 0.8654, test_loss: 1.0199, test_f1: 0.5180
 epoch: 52, train_loss: 0.8623, test_loss: 1.0601, test_f1: 0.4615
 epoch: 53, train_loss: 0.8643, test_loss: 1.0799, test_f1: 0.4781
 epoch: 54, train_loss: 0.8511, test_loss: 1.0449, test_f1: 0.4983
 epoch: 55, train_loss: 0.8572, test_loss: 1.0330, test_f1: 0.4828
 epoch: 56, train_loss: 0.8589, test_loss: 1.0986, test_f1: 0.4782
 epoch: 57, train_loss: 0.8489, test_loss: 1.0180, test_f1: 0.4998
 epoch: 58, train_loss: 0.8372, test_loss: 1.0307, test_f1: 0.5026
 epoch: 59, train_loss: 0.8437, test_loss: 1.0957, test_f1: 0.4745
 epoch: 60, train_loss: 0.8436, test_loss: 1.0529, test_f1: 0.4833
 epoch: 61, train_loss: 0.8402, test_loss: 1.0277, test_f1: 0.5070
 epoch: 62, train_loss: 0.8485, test_loss: 1.1094, test_f1: 0.4809
 epoch: 63, train_loss: 0.8389, test_loss: 1.0130, test_f1: 0.5036
 epoch: 64, train_loss: 0.8433, test_loss: 1.1057, test_f1: 0.4820
 epoch: 65, train_loss: 0.8449, test_loss: 1.0529, test_f1: 0.4937
 epoch: 66, train_loss: 0.8370, test_loss: 1.0472, test_f1: 0.5094
 epoch: 67, train_loss: 0.8396, test_loss: 1.0472, test_f1: 0.4992
 epoch: 68, train_loss: 0.8326, test_loss: 1.0737, test_f1: 0.4748
 epoch: 69, train_loss: 0.8346, test_loss: 1.0688, test_f1: 0.4870
 epoch: 70, train_loss: 0.8216, test_loss: 1.0524, test_f1: 0.4939
 epoch: 71, train_loss: 0.8168, test_loss: 1.0367, test_f1: 0.5272
 epoch: 72, train_loss: 0.8242, test_loss: 1.0395, test_f1: 0.4949
 epoch: 73, train_loss: 0.8269, test_loss: 1.0418, test_f1: 0.5180
 epoch: 74, train_loss: 0.8300, test_loss: 1.1310, test_f1: 0.4934
 epoch: 75, train_loss: 0.8259, test_loss: 1.0567, test_f1: 0.4928
 epoch: 76, train_loss: 0.8291, test_loss: 1.0258, test_f1: 0.5003
 epoch: 77, train_loss: 0.8259, test_loss: 1.0604, test_f1: 0.5026
 epoch: 78, train_loss: 0.8330, test_loss: 1.1572, test_f1: 0.4824
 epoch: 79, train_loss: 0.8284, test_loss: 1.0555, test_f1: 0.5043
 epoch: 80, train_loss: 0.8220, test_loss: 1.0322, test_f1: 0.4973
 epoch: 81, train_loss: 0.8236, test_loss: 1.0763, test_f1: 0.4891
 epoch: 82, train_loss: 0.8185, test_loss: 1.0588, test_f1: 0.4994
 epoch: 83, train_loss: 0.8156, test_loss: 1.0567, test_f1: 0.5045
 epoch: 84, train_loss: 0.8080, test_loss: 1.0499, test_f1: 0.5114
 epoch: 85, train_loss: 0.8105, test_loss: 1.1125, test_f1: 0.4836
 epoch: 86, train_loss: 0.8166, test_loss: 1.0567, test_f1: 0.4827
 epoch: 87, train_loss: 0.8072, test_loss: 1.0342, test_f1: 0.5150
 epoch: 88, train_loss: 0.7926, test_loss: 1.0264, test_f1: 0.5215
 epoch: 89, train_loss: 0.7996, test_loss: 1.0930, test_f1: 0.4913
 epoch: 90, train_loss: 0.8036, test_loss: 1.0561, test_f1: 0.4961
 epoch: 91, train_loss: 0.8027, test_loss: 1.0498, test_f1: 0.5158
 epoch: 92, train_loss: 0.8065, test_loss: 1.0690, test_f1: 0.5048
 epoch: 93, train_loss: 0.8045, test_loss: 1.0361, test_f1: 0.5180
 epoch: 94, train_loss: 0.8020, test_loss: 1.0680, test_f1: 0.4971
 epoch: 95, train_loss: 0.7940, test_loss: 1.1111, test_f1: 0.4813
 epoch: 96, train_loss: 0.8056, test_loss: 1.0656, test_f1: 0.4917
 epoch: 97, train_loss: 0.7998, test_loss: 1.1019, test_f1: 0.4892
 epoch: 98, train_loss: 0.8159, test_loss: 1.0653, test_f1: 0.5082
 epoch: 99, train_loss: 0.8024, test_loss: 1.0659, test_f1: 0.4931
##################ITERATION #2 ****************************************
 epoch: 0, train_loss: 1.3281, test_loss: 1.3356, test_f1: 0.2260
 epoch: 1, train_loss: 1.2539, test_loss: 1.3126, test_f1: 0.2260
 epoch: 2, train_loss: 1.2017, test_loss: 1.2509, test_f1: 0.2286
 epoch: 3, train_loss: 1.1432, test_loss: 1.1224, test_f1: 0.3697
 epoch: 4, train_loss: 1.1044, test_loss: 1.0670, test_f1: 0.4203
 epoch: 5, train_loss: 1.0771, test_loss: 1.0451, test_f1: 0.4541
 epoch: 6, train_loss: 1.0581, test_loss: 1.0238, test_f1: 0.4607
 epoch: 7, train_loss: 1.0452, test_loss: 1.0191, test_f1: 0.4502
 epoch: 8, train_loss: 1.0262, test_loss: 1.0008, test_f1: 0.4582
 epoch: 9, train_loss: 1.0169, test_loss: 0.9975, test_f1: 0.4707
 epoch: 10, train_loss: 1.0110, test_loss: 1.0011, test_f1: 0.4552
 epoch: 11, train_loss: 1.0104, test_loss: 0.9971, test_f1: 0.4821
 epoch: 12, train_loss: 0.9912, test_loss: 0.9790, test_f1: 0.4593
 epoch: 13, train_loss: 0.9827, test_loss: 0.9615, test_f1: 0.4784
 epoch: 14, train_loss: 0.9731, test_loss: 0.9630, test_f1: 0.4858
 epoch: 15, train_loss: 0.9672, test_loss: 0.9626, test_f1: 0.4820
 epoch: 16, train_loss: 0.9585, test_loss: 0.9360, test_f1: 0.5087
 epoch: 17, train_loss: 0.9530, test_loss: 0.9484, test_f1: 0.4976
 epoch: 18, train_loss: 0.9509, test_loss: 0.9483, test_f1: 0.5171
 epoch: 19, train_loss: 0.9474, test_loss: 0.9650, test_f1: 0.5080
 epoch: 20, train_loss: 0.9315, test_loss: 0.9413, test_f1: 0.5184
 epoch: 21, train_loss: 0.9305, test_loss: 0.9679, test_f1: 0.5108
 epoch: 22, train_loss: 0.9181, test_loss: 0.9566, test_f1: 0.4959
 epoch: 23, train_loss: 0.9112, test_loss: 0.9542, test_f1: 0.5182
 epoch: 24, train_loss: 0.9115, test_loss: 0.9629, test_f1: 0.5067
 epoch: 25, train_loss: 0.9127, test_loss: 1.0010, test_f1: 0.4979
 epoch: 26, train_loss: 0.9024, test_loss: 0.9600, test_f1: 0.4935
 epoch: 27, train_loss: 0.8983, test_loss: 0.9761, test_f1: 0.4986
 epoch: 28, train_loss: 0.8917, test_loss: 0.9838, test_f1: 0.4850
 epoch: 29, train_loss: 0.8812, test_loss: 0.9679, test_f1: 0.5132
 epoch: 30, train_loss: 0.8788, test_loss: 0.9518, test_f1: 0.5127
 epoch: 31, train_loss: 0.8704, test_loss: 0.9363, test_f1: 0.5138
 epoch: 32, train_loss: 0.8621, test_loss: 0.9465, test_f1: 0.5114
 epoch: 33, train_loss: 0.8592, test_loss: 0.9245, test_f1: 0.5141
 epoch: 34, train_loss: 0.8618, test_loss: 0.9820, test_f1: 0.4961
 epoch: 35, train_loss: 0.8470, test_loss: 0.9620, test_f1: 0.5172
 epoch: 36, train_loss: 0.8471, test_loss: 0.9457, test_f1: 0.5249
 epoch: 37, train_loss: 0.8442, test_loss: 0.9626, test_f1: 0.5100
 epoch: 38, train_loss: 0.8539, test_loss: 0.9558, test_f1: 0.5145
 epoch: 39, train_loss: 0.8569, test_loss: 0.9578, test_f1: 0.5175
 epoch: 40, train_loss: 0.8435, test_loss: 0.9363, test_f1: 0.5147
 epoch: 41, train_loss: 0.8348, test_loss: 0.9582, test_f1: 0.5120
 epoch: 42, train_loss: 0.8352, test_loss: 0.9487, test_f1: 0.5130
 epoch: 43, train_loss: 0.8406, test_loss: 0.9500, test_f1: 0.5150
 epoch: 44, train_loss: 0.8265, test_loss: 1.0094, test_f1: 0.4930
 epoch: 45, train_loss: 0.8330, test_loss: 0.9341, test_f1: 0.5245
 epoch: 46, train_loss: 0.8261, test_loss: 0.9452, test_f1: 0.5126
 epoch: 47, train_loss: 0.8164, test_loss: 0.9368, test_f1: 0.5102
 epoch: 48, train_loss: 0.8074, test_loss: 0.9559, test_f1: 0.5159
 epoch: 49, train_loss: 0.8254, test_loss: 0.9512, test_f1: 0.5122
 epoch: 50, train_loss: 0.8114, test_loss: 0.9235, test_f1: 0.5307
 epoch: 51, train_loss: 0.7969, test_loss: 0.9181, test_f1: 0.5370
 epoch: 52, train_loss: 0.7960, test_loss: 0.9198, test_f1: 0.5325
 epoch: 53, train_loss: 0.7922, test_loss: 0.9229, test_f1: 0.5416
 epoch: 54, train_loss: 0.7984, test_loss: 0.9305, test_f1: 0.5287
 epoch: 55, train_loss: 0.7971, test_loss: 0.9093, test_f1: 0.5415
 epoch: 56, train_loss: 0.7914, test_loss: 0.9251, test_f1: 0.5381
 epoch: 57, train_loss: 0.7845, test_loss: 0.9156, test_f1: 0.5369
 epoch: 58, train_loss: 0.7767, test_loss: 0.9262, test_f1: 0.5309
 epoch: 59, train_loss: 0.7759, test_loss: 0.9241, test_f1: 0.5395
 epoch: 60, train_loss: 0.7732, test_loss: 0.9245, test_f1: 0.5253
 epoch: 61, train_loss: 0.7819, test_loss: 0.9060, test_f1: 0.5345
 epoch: 62, train_loss: 0.7653, test_loss: 0.9189, test_f1: 0.5354
 epoch: 63, train_loss: 0.7715, test_loss: 0.9183, test_f1: 0.5381
 epoch: 64, train_loss: 0.7772, test_loss: 0.9414, test_f1: 0.5316
 epoch: 65, train_loss: 0.7793, test_loss: 0.9095, test_f1: 0.5360
 epoch: 66, train_loss: 0.7623, test_loss: 0.9215, test_f1: 0.5335
 epoch: 67, train_loss: 0.7819, test_loss: 0.9176, test_f1: 0.5366
 epoch: 68, train_loss: 0.7645, test_loss: 0.9435, test_f1: 0.5402
 epoch: 69, train_loss: 0.7681, test_loss: 0.9165, test_f1: 0.5401
 epoch: 70, train_loss: 0.7737, test_loss: 0.8923, test_f1: 0.5412
 epoch: 71, train_loss: 0.7639, test_loss: 0.9152, test_f1: 0.5389
 epoch: 72, train_loss: 0.7568, test_loss: 0.9128, test_f1: 0.5429
 epoch: 73, train_loss: 0.7527, test_loss: 0.9032, test_f1: 0.5342
 epoch: 74, train_loss: 0.7509, test_loss: 0.9097, test_f1: 0.5324
 epoch: 75, train_loss: 0.7688, test_loss: 0.9278, test_f1: 0.5350
 epoch: 76, train_loss: 0.7435, test_loss: 0.9112, test_f1: 0.5409
 epoch: 77, train_loss: 0.7466, test_loss: 0.9134, test_f1: 0.5470
 epoch: 78, train_loss: 0.7472, test_loss: 0.9098, test_f1: 0.5428
 epoch: 79, train_loss: 0.7553, test_loss: 0.8999, test_f1: 0.5309
 epoch: 80, train_loss: 0.7463, test_loss: 0.9233, test_f1: 0.5347
 epoch: 81, train_loss: 0.7613, test_loss: 0.9136, test_f1: 0.5402
 epoch: 82, train_loss: 0.7538, test_loss: 0.9394, test_f1: 0.5377
 epoch: 83, train_loss: 0.7479, test_loss: 0.9309, test_f1: 0.5342
 epoch: 84, train_loss: 0.7374, test_loss: 0.9112, test_f1: 0.5319
 epoch: 85, train_loss: 0.7638, test_loss: 0.8962, test_f1: 0.5388
 epoch: 86, train_loss: 0.7387, test_loss: 0.9049, test_f1: 0.5330
 epoch: 87, train_loss: 0.7483, test_loss: 0.9241, test_f1: 0.5362
 epoch: 88, train_loss: 0.7432, test_loss: 0.9086, test_f1: 0.5357
 epoch: 89, train_loss: 0.7443, test_loss: 0.9573, test_f1: 0.5198
 epoch: 90, train_loss: 0.7327, test_loss: 0.9089, test_f1: 0.5262
 epoch: 91, train_loss: 0.7445, test_loss: 0.9053, test_f1: 0.5335
 epoch: 92, train_loss: 0.7398, test_loss: 0.9281, test_f1: 0.5239
 epoch: 93, train_loss: 0.7412, test_loss: 0.8849, test_f1: 0.5488
 epoch: 94, train_loss: 0.7493, test_loss: 0.8982, test_f1: 0.5273
 epoch: 95, train_loss: 0.7332, test_loss: 0.9277, test_f1: 0.5298
 epoch: 96, train_loss: 0.7362, test_loss: 0.9082, test_f1: 0.5326
 epoch: 97, train_loss: 0.7382, test_loss: 0.9154, test_f1: 0.5310
 epoch: 98, train_loss: 0.7170, test_loss: 0.8878, test_f1: 0.5214
 epoch: 99, train_loss: 0.7454, test_loss: 0.9112, test_f1: 0.5346
##################ITERATION #3 ****************************************
 epoch: 0, train_loss: 1.2850, test_loss: 1.3070, test_f1: 0.2260
 epoch: 1, train_loss: 1.2161, test_loss: 1.2945, test_f1: 0.2260
 epoch: 2, train_loss: 1.1887, test_loss: 1.2826, test_f1: 0.2260
 epoch: 3, train_loss: 1.1563, test_loss: 1.1953, test_f1: 0.2539
 epoch: 4, train_loss: 1.1290, test_loss: 1.0999, test_f1: 0.3510
 epoch: 5, train_loss: 1.1002, test_loss: 1.0698, test_f1: 0.3594
 epoch: 6, train_loss: 1.0797, test_loss: 1.0581, test_f1: 0.3438
 epoch: 7, train_loss: 1.0604, test_loss: 1.0452, test_f1: 0.3551
 epoch: 8, train_loss: 1.0520, test_loss: 1.0701, test_f1: 0.3353
 epoch: 9, train_loss: 1.0350, test_loss: 1.0619, test_f1: 0.3332
 epoch: 10, train_loss: 1.0209, test_loss: 1.0453, test_f1: 0.3576
 epoch: 11, train_loss: 1.0097, test_loss: 1.0252, test_f1: 0.4023
 epoch: 12, train_loss: 1.0068, test_loss: 1.0691, test_f1: 0.3699
 epoch: 13, train_loss: 0.9951, test_loss: 1.0429, test_f1: 0.4181
 epoch: 14, train_loss: 0.9898, test_loss: 1.0263, test_f1: 0.4376
 epoch: 15, train_loss: 0.9750, test_loss: 1.0099, test_f1: 0.4414
 epoch: 16, train_loss: 0.9694, test_loss: 1.0272, test_f1: 0.4398
 epoch: 17, train_loss: 0.9661, test_loss: 1.0785, test_f1: 0.4107
 epoch: 18, train_loss: 0.9608, test_loss: 1.0443, test_f1: 0.4341
 epoch: 19, train_loss: 0.9578, test_loss: 1.0796, test_f1: 0.4518
 epoch: 20, train_loss: 0.9616, test_loss: 1.0385, test_f1: 0.4264
 epoch: 21, train_loss: 0.9530, test_loss: 1.1252, test_f1: 0.4195
 epoch: 22, train_loss: 0.9412, test_loss: 1.0468, test_f1: 0.4459
 epoch: 23, train_loss: 0.9368, test_loss: 1.0784, test_f1: 0.4319
 epoch: 24, train_loss: 0.9435, test_loss: 1.0482, test_f1: 0.4411
 epoch: 25, train_loss: 0.9391, test_loss: 1.0742, test_f1: 0.4362
 epoch: 26, train_loss: 0.9382, test_loss: 1.0678, test_f1: 0.4395
 epoch: 27, train_loss: 0.9291, test_loss: 1.0792, test_f1: 0.4371
 epoch: 28, train_loss: 0.9254, test_loss: 1.1549, test_f1: 0.4157
 epoch: 29, train_loss: 0.9292, test_loss: 1.0431, test_f1: 0.4656
 epoch: 30, train_loss: 0.9071, test_loss: 1.0512, test_f1: 0.4775
 epoch: 31, train_loss: 0.9171, test_loss: 1.0751, test_f1: 0.4516
 epoch: 32, train_loss: 0.9092, test_loss: 1.0854, test_f1: 0.4479
 epoch: 33, train_loss: 0.9231, test_loss: 1.0684, test_f1: 0.4513
 epoch: 34, train_loss: 0.8977, test_loss: 1.1024, test_f1: 0.4485
 epoch: 35, train_loss: 0.9047, test_loss: 1.1067, test_f1: 0.4448
 epoch: 36, train_loss: 0.8998, test_loss: 1.0997, test_f1: 0.4441
 epoch: 37, train_loss: 0.8950, test_loss: 1.0813, test_f1: 0.4652
 epoch: 38, train_loss: 0.8892, test_loss: 1.0482, test_f1: 0.4806
 epoch: 39, train_loss: 0.8909, test_loss: 1.0676, test_f1: 0.4624
 epoch: 40, train_loss: 0.8903, test_loss: 1.0346, test_f1: 0.4830
 epoch: 41, train_loss: 0.8826, test_loss: 1.0471, test_f1: 0.4843
 epoch: 42, train_loss: 0.8744, test_loss: 1.0604, test_f1: 0.4817
 epoch: 43, train_loss: 0.8764, test_loss: 1.0883, test_f1: 0.4615
 epoch: 44, train_loss: 0.8755, test_loss: 1.0348, test_f1: 0.4888
 epoch: 45, train_loss: 0.8713, test_loss: 1.0249, test_f1: 0.4926
 epoch: 46, train_loss: 0.8596, test_loss: 1.0563, test_f1: 0.4751
 epoch: 47, train_loss: 0.8712, test_loss: 1.1199, test_f1: 0.4485
 epoch: 48, train_loss: 0.8718, test_loss: 1.0550, test_f1: 0.4793
 epoch: 49, train_loss: 0.8607, test_loss: 1.0536, test_f1: 0.4850
 epoch: 50, train_loss: 0.8592, test_loss: 1.0624, test_f1: 0.4839
 epoch: 51, train_loss: 0.8460, test_loss: 1.0439, test_f1: 0.4864
 epoch: 52, train_loss: 0.8414, test_loss: 1.0186, test_f1: 0.4942
 epoch: 53, train_loss: 0.8425, test_loss: 1.0354, test_f1: 0.5011
 epoch: 54, train_loss: 0.8352, test_loss: 1.0432, test_f1: 0.4928
 epoch: 55, train_loss: 0.8377, test_loss: 1.0428, test_f1: 0.5046
 epoch: 56, train_loss: 0.8488, test_loss: 1.0441, test_f1: 0.4913
 epoch: 57, train_loss: 0.8354, test_loss: 1.0489, test_f1: 0.4873
 epoch: 58, train_loss: 0.8303, test_loss: 1.0465, test_f1: 0.4829
 epoch: 59, train_loss: 0.8356, test_loss: 1.0451, test_f1: 0.4903
 epoch: 60, train_loss: 0.8413, test_loss: 1.0362, test_f1: 0.4882
 epoch: 61, train_loss: 0.8244, test_loss: 1.0403, test_f1: 0.4932
 epoch: 62, train_loss: 0.8282, test_loss: 1.0445, test_f1: 0.4848
 epoch: 63, train_loss: 0.8227, test_loss: 1.0149, test_f1: 0.4981
 epoch: 64, train_loss: 0.8221, test_loss: 1.0186, test_f1: 0.4983
 epoch: 65, train_loss: 0.8253, test_loss: 1.0171, test_f1: 0.4930
 epoch: 66, train_loss: 0.8186, test_loss: 1.0246, test_f1: 0.5007
 epoch: 67, train_loss: 0.8246, test_loss: 1.0493, test_f1: 0.4970
 epoch: 68, train_loss: 0.8240, test_loss: 1.0292, test_f1: 0.4952
 epoch: 69, train_loss: 0.8154, test_loss: 1.0277, test_f1: 0.5034
 epoch: 70, train_loss: 0.8281, test_loss: 1.0417, test_f1: 0.5086
 epoch: 71, train_loss: 0.8076, test_loss: 1.0434, test_f1: 0.4849
 epoch: 72, train_loss: 0.8201, test_loss: 1.0665, test_f1: 0.4819
 epoch: 73, train_loss: 0.8113, test_loss: 1.0631, test_f1: 0.4870
 epoch: 74, train_loss: 0.8236, test_loss: 1.0138, test_f1: 0.5057
 epoch: 75, train_loss: 0.8100, test_loss: 1.0229, test_f1: 0.4991
 epoch: 76, train_loss: 0.8112, test_loss: 1.0412, test_f1: 0.4988
 epoch: 77, train_loss: 0.8044, test_loss: 1.0288, test_f1: 0.4981
 epoch: 78, train_loss: 0.8131, test_loss: 1.0299, test_f1: 0.5016
 epoch: 79, train_loss: 0.8027, test_loss: 1.0263, test_f1: 0.5012
 epoch: 80, train_loss: 0.7895, test_loss: 1.0490, test_f1: 0.5010
 epoch: 81, train_loss: 0.8065, test_loss: 1.0174, test_f1: 0.5058
 epoch: 82, train_loss: 0.7970, test_loss: 1.0430, test_f1: 0.5009
 epoch: 83, train_loss: 0.8011, test_loss: 1.0290, test_f1: 0.4995
 epoch: 84, train_loss: 0.8104, test_loss: 1.0212, test_f1: 0.5171
 epoch: 85, train_loss: 0.8049, test_loss: 1.0371, test_f1: 0.5144
 epoch: 86, train_loss: 0.7936, test_loss: 1.0187, test_f1: 0.5055
 epoch: 87, train_loss: 0.7877, test_loss: 0.9954, test_f1: 0.5074
 epoch: 88, train_loss: 0.7879, test_loss: 1.0282, test_f1: 0.4999
 epoch: 89, train_loss: 0.8076, test_loss: 1.0229, test_f1: 0.5068
 epoch: 90, train_loss: 0.7806, test_loss: 1.0599, test_f1: 0.5000
 epoch: 91, train_loss: 0.7922, test_loss: 1.0235, test_f1: 0.5094
 epoch: 92, train_loss: 0.7917, test_loss: 1.0213, test_f1: 0.5120
 epoch: 93, train_loss: 0.7961, test_loss: 1.0459, test_f1: 0.5055
 epoch: 94, train_loss: 0.7740, test_loss: 1.0392, test_f1: 0.4964
 epoch: 95, train_loss: 0.7859, test_loss: 1.0195, test_f1: 0.5208
 epoch: 96, train_loss: 0.7911, test_loss: 1.0429, test_f1: 0.5051
 epoch: 97, train_loss: 0.7858, test_loss: 1.0238, test_f1: 0.5094
 epoch: 98, train_loss: 0.7830, test_loss: 1.0238, test_f1: 0.5212
 epoch: 99, train_loss: 0.7841, test_loss: 1.0235, test_f1: 0.5162
##################ITERATION #4 ****************************************
 epoch: 0, train_loss: 1.2939, test_loss: 1.3389, test_f1: 0.2260
 epoch: 1, train_loss: 1.2241, test_loss: 1.3269, test_f1: 0.2260
 epoch: 2, train_loss: 1.1915, test_loss: 1.3041, test_f1: 0.2260
 epoch: 3, train_loss: 1.1578, test_loss: 1.2374, test_f1: 0.2286
 epoch: 4, train_loss: 1.1256, test_loss: 1.1233, test_f1: 0.3457
 epoch: 5, train_loss: 1.1141, test_loss: 1.0749, test_f1: 0.3667
 epoch: 6, train_loss: 1.0923, test_loss: 1.0773, test_f1: 0.3854
 epoch: 7, train_loss: 1.0727, test_loss: 1.0464, test_f1: 0.3811
 epoch: 8, train_loss: 1.0509, test_loss: 1.0393, test_f1: 0.4254
 epoch: 9, train_loss: 1.0453, test_loss: 1.0365, test_f1: 0.4277
 epoch: 10, train_loss: 1.0395, test_loss: 1.0396, test_f1: 0.4193
 epoch: 11, train_loss: 1.0203, test_loss: 1.0849, test_f1: 0.3990
 epoch: 12, train_loss: 1.0145, test_loss: 1.0425, test_f1: 0.4549
 epoch: 13, train_loss: 1.0053, test_loss: 1.0078, test_f1: 0.4428
 epoch: 14, train_loss: 1.0027, test_loss: 1.0839, test_f1: 0.4459
 epoch: 15, train_loss: 1.0000, test_loss: 1.0452, test_f1: 0.4664
 epoch: 16, train_loss: 0.9859, test_loss: 1.0412, test_f1: 0.4652
 epoch: 17, train_loss: 0.9831, test_loss: 1.0123, test_f1: 0.4748
 epoch: 18, train_loss: 0.9756, test_loss: 1.0227, test_f1: 0.4597
 epoch: 19, train_loss: 0.9737, test_loss: 1.0267, test_f1: 0.4685
 epoch: 20, train_loss: 0.9594, test_loss: 1.0590, test_f1: 0.4746
 epoch: 21, train_loss: 0.9569, test_loss: 1.0098, test_f1: 0.4805
 epoch: 22, train_loss: 0.9501, test_loss: 0.9885, test_f1: 0.4964
 epoch: 23, train_loss: 0.9438, test_loss: 0.9715, test_f1: 0.4718
 epoch: 24, train_loss: 0.9383, test_loss: 1.0297, test_f1: 0.4677
 epoch: 25, train_loss: 0.9176, test_loss: 1.0038, test_f1: 0.4972
 epoch: 26, train_loss: 0.9227, test_loss: 0.9803, test_f1: 0.5017
 epoch: 27, train_loss: 0.9169, test_loss: 1.0701, test_f1: 0.4628
 epoch: 28, train_loss: 0.9101, test_loss: 1.0058, test_f1: 0.4854
 epoch: 29, train_loss: 0.9135, test_loss: 1.0463, test_f1: 0.4776
 epoch: 30, train_loss: 0.9045, test_loss: 1.0139, test_f1: 0.4766
 epoch: 31, train_loss: 0.8958, test_loss: 0.9652, test_f1: 0.4941
 epoch: 32, train_loss: 0.8914, test_loss: 0.9826, test_f1: 0.4810
 epoch: 33, train_loss: 0.8939, test_loss: 0.9435, test_f1: 0.4904
 epoch: 34, train_loss: 0.8784, test_loss: 0.9826, test_f1: 0.5021
 epoch: 35, train_loss: 0.8727, test_loss: 0.9724, test_f1: 0.4980
 epoch: 36, train_loss: 0.8749, test_loss: 0.9635, test_f1: 0.4994
 epoch: 37, train_loss: 0.8697, test_loss: 0.9678, test_f1: 0.5049
 epoch: 38, train_loss: 0.8715, test_loss: 0.9781, test_f1: 0.5025
 epoch: 39, train_loss: 0.8689, test_loss: 0.9721, test_f1: 0.4938
 epoch: 40, train_loss: 0.8620, test_loss: 0.9792, test_f1: 0.5087
 epoch: 41, train_loss: 0.8587, test_loss: 0.9672, test_f1: 0.4949
 epoch: 42, train_loss: 0.8620, test_loss: 0.9935, test_f1: 0.4879
 epoch: 43, train_loss: 0.8632, test_loss: 0.9834, test_f1: 0.5037
 epoch: 44, train_loss: 0.8550, test_loss: 0.9553, test_f1: 0.5148
 epoch: 45, train_loss: 0.8555, test_loss: 0.9535, test_f1: 0.5058
 epoch: 46, train_loss: 0.8625, test_loss: 0.9406, test_f1: 0.5113
 epoch: 47, train_loss: 0.8551, test_loss: 0.9724, test_f1: 0.5193
 epoch: 48, train_loss: 0.8448, test_loss: 0.9730, test_f1: 0.5000
 epoch: 49, train_loss: 0.8302, test_loss: 0.9339, test_f1: 0.4992
 epoch: 50, train_loss: 0.8419, test_loss: 0.9597, test_f1: 0.4998
 epoch: 51, train_loss: 0.8472, test_loss: 0.9408, test_f1: 0.5022
 epoch: 52, train_loss: 0.8247, test_loss: 0.9576, test_f1: 0.5128
 epoch: 53, train_loss: 0.8166, test_loss: 0.9788, test_f1: 0.5062
 epoch: 54, train_loss: 0.8251, test_loss: 0.9813, test_f1: 0.5048
 epoch: 55, train_loss: 0.8208, test_loss: 0.9798, test_f1: 0.4998
 epoch: 56, train_loss: 0.8150, test_loss: 0.9618, test_f1: 0.5019
 epoch: 57, train_loss: 0.8111, test_loss: 0.9557, test_f1: 0.5038
 epoch: 58, train_loss: 0.7993, test_loss: 0.9612, test_f1: 0.4981
 epoch: 59, train_loss: 0.8082, test_loss: 0.9536, test_f1: 0.5094
 epoch: 60, train_loss: 0.8059, test_loss: 0.9799, test_f1: 0.5061
 epoch: 61, train_loss: 0.8025, test_loss: 0.9820, test_f1: 0.5053
 epoch: 62, train_loss: 0.8146, test_loss: 0.9649, test_f1: 0.5152
 epoch: 63, train_loss: 0.8141, test_loss: 0.9643, test_f1: 0.4946
 epoch: 64, train_loss: 0.7962, test_loss: 0.9549, test_f1: 0.5207
 epoch: 65, train_loss: 0.7972, test_loss: 0.9786, test_f1: 0.5141
 epoch: 66, train_loss: 0.8015, test_loss: 0.9865, test_f1: 0.5116
 epoch: 67, train_loss: 0.7980, test_loss: 1.0183, test_f1: 0.4842
 epoch: 68, train_loss: 0.7928, test_loss: 1.0010, test_f1: 0.4981
 epoch: 69, train_loss: 0.7924, test_loss: 0.9544, test_f1: 0.5274
 epoch: 70, train_loss: 0.7991, test_loss: 1.0027, test_f1: 0.5064
 epoch: 71, train_loss: 0.7884, test_loss: 0.9752, test_f1: 0.5132
 epoch: 72, train_loss: 0.8005, test_loss: 0.9793, test_f1: 0.5052
 epoch: 73, train_loss: 0.7949, test_loss: 0.9855, test_f1: 0.5182
 epoch: 74, train_loss: 0.7919, test_loss: 0.9963, test_f1: 0.4922
 epoch: 75, train_loss: 0.7959, test_loss: 0.9534, test_f1: 0.5153
 epoch: 76, train_loss: 0.7922, test_loss: 0.9697, test_f1: 0.5023
 epoch: 77, train_loss: 0.7873, test_loss: 0.9727, test_f1: 0.5103
 epoch: 78, train_loss: 0.7835, test_loss: 0.9653, test_f1: 0.5173
 epoch: 79, train_loss: 0.7945, test_loss: 0.9713, test_f1: 0.5226
 epoch: 80, train_loss: 0.7859, test_loss: 0.9697, test_f1: 0.5070
 epoch: 81, train_loss: 0.7947, test_loss: 0.9818, test_f1: 0.5078
 epoch: 82, train_loss: 0.7852, test_loss: 1.0062, test_f1: 0.4936
 epoch: 83, train_loss: 0.7726, test_loss: 0.9697, test_f1: 0.5015
 epoch: 84, train_loss: 0.7896, test_loss: 0.9806, test_f1: 0.5166
 epoch: 85, train_loss: 0.7629, test_loss: 0.9743, test_f1: 0.5106
 epoch: 86, train_loss: 0.7723, test_loss: 1.0035, test_f1: 0.5234
 epoch: 87, train_loss: 0.7672, test_loss: 0.9696, test_f1: 0.5253
 epoch: 88, train_loss: 0.7664, test_loss: 0.9901, test_f1: 0.5157
 epoch: 89, train_loss: 0.7872, test_loss: 1.0012, test_f1: 0.5126
 epoch: 90, train_loss: 0.7684, test_loss: 1.0044, test_f1: 0.5016
 epoch: 91, train_loss: 0.7929, test_loss: 1.0269, test_f1: 0.5033
 epoch: 92, train_loss: 0.7680, test_loss: 1.0020, test_f1: 0.5219
 epoch: 93, train_loss: 0.7699, test_loss: 0.9845, test_f1: 0.5301
 epoch: 94, train_loss: 0.7745, test_loss: 1.0111, test_f1: 0.5248
 epoch: 95, train_loss: 0.7632, test_loss: 1.0060, test_f1: 0.5072
 epoch: 96, train_loss: 0.7671, test_loss: 0.9984, test_f1: 0.5180
 epoch: 97, train_loss: 0.7711, test_loss: 0.9875, test_f1: 0.5236
 epoch: 98, train_loss: 0.7646, test_loss: 0.9855, test_f1: 0.5257
 epoch: 99, train_loss: 0.7607, test_loss: 1.0243, test_f1: 0.5126
##################ITERATION #5 ****************************************
 epoch: 0, train_loss: 1.2887, test_loss: 1.2984, test_f1: 0.2260
 epoch: 1, train_loss: 1.2206, test_loss: 1.2702, test_f1: 0.2260
 epoch: 2, train_loss: 1.1717, test_loss: 1.2493, test_f1: 0.2806
 epoch: 3, train_loss: 1.1306, test_loss: 1.1787, test_f1: 0.3332
 epoch: 4, train_loss: 1.1021, test_loss: 1.0919, test_f1: 0.3671
 epoch: 5, train_loss: 1.0744, test_loss: 1.0594, test_f1: 0.4133
 epoch: 6, train_loss: 1.0704, test_loss: 1.0084, test_f1: 0.4274
 epoch: 7, train_loss: 1.0393, test_loss: 1.0085, test_f1: 0.4426
 epoch: 8, train_loss: 1.0291, test_loss: 0.9926, test_f1: 0.4132
 epoch: 9, train_loss: 1.0134, test_loss: 1.0047, test_f1: 0.4237
 epoch: 10, train_loss: 1.0096, test_loss: 1.0211, test_f1: 0.4653
 epoch: 11, train_loss: 0.9892, test_loss: 0.9947, test_f1: 0.4661
 epoch: 12, train_loss: 0.9801, test_loss: 0.9815, test_f1: 0.4699
 epoch: 13, train_loss: 0.9693, test_loss: 1.0027, test_f1: 0.4779
 epoch: 14, train_loss: 0.9676, test_loss: 1.0095, test_f1: 0.4820
 epoch: 15, train_loss: 0.9589, test_loss: 0.9769, test_f1: 0.4837
 epoch: 16, train_loss: 0.9551, test_loss: 1.0384, test_f1: 0.4669
 epoch: 17, train_loss: 0.9460, test_loss: 0.9681, test_f1: 0.4789
 epoch: 18, train_loss: 0.9447, test_loss: 0.9989, test_f1: 0.4906
 epoch: 19, train_loss: 0.9257, test_loss: 0.9811, test_f1: 0.4864
 epoch: 20, train_loss: 0.9247, test_loss: 0.9674, test_f1: 0.4949
 epoch: 21, train_loss: 0.9258, test_loss: 0.9604, test_f1: 0.5048
 epoch: 22, train_loss: 0.9102, test_loss: 0.9312, test_f1: 0.5047
 epoch: 23, train_loss: 0.9055, test_loss: 0.9915, test_f1: 0.4781
 epoch: 24, train_loss: 0.9029, test_loss: 0.9148, test_f1: 0.5027
 epoch: 25, train_loss: 0.8927, test_loss: 0.9359, test_f1: 0.5100
 epoch: 26, train_loss: 0.8980, test_loss: 0.9202, test_f1: 0.5113
 epoch: 27, train_loss: 0.9028, test_loss: 0.9376, test_f1: 0.5141
 epoch: 28, train_loss: 0.8932, test_loss: 0.9634, test_f1: 0.5034
 epoch: 29, train_loss: 0.8738, test_loss: 0.9340, test_f1: 0.5142
 epoch: 30, train_loss: 0.8748, test_loss: 0.9569, test_f1: 0.5059
 epoch: 31, train_loss: 0.8767, test_loss: 0.9616, test_f1: 0.4899
 epoch: 32, train_loss: 0.8662, test_loss: 0.9541, test_f1: 0.4761
 epoch: 33, train_loss: 0.8728, test_loss: 0.9513, test_f1: 0.5091
 epoch: 34, train_loss: 0.8663, test_loss: 0.9282, test_f1: 0.5080
 epoch: 35, train_loss: 0.8696, test_loss: 0.9396, test_f1: 0.5230
 epoch: 36, train_loss: 0.8628, test_loss: 0.9367, test_f1: 0.5107
 epoch: 37, train_loss: 0.8583, test_loss: 0.9333, test_f1: 0.5227
 epoch: 38, train_loss: 0.8471, test_loss: 0.9017, test_f1: 0.5380
 epoch: 39, train_loss: 0.8344, test_loss: 0.8795, test_f1: 0.5347
 epoch: 40, train_loss: 0.8444, test_loss: 0.9328, test_f1: 0.5333
 epoch: 41, train_loss: 0.8506, test_loss: 0.8789, test_f1: 0.5375
 epoch: 42, train_loss: 0.8486, test_loss: 0.8971, test_f1: 0.5373
 epoch: 43, train_loss: 0.8464, test_loss: 0.9606, test_f1: 0.4985
 epoch: 44, train_loss: 0.8359, test_loss: 0.9507, test_f1: 0.5206
 epoch: 45, train_loss: 0.8342, test_loss: 0.9047, test_f1: 0.5180
 epoch: 46, train_loss: 0.8301, test_loss: 0.9165, test_f1: 0.5249
 epoch: 47, train_loss: 0.8228, test_loss: 0.9078, test_f1: 0.5315
 epoch: 48, train_loss: 0.8149, test_loss: 0.9676, test_f1: 0.5204
 epoch: 49, train_loss: 0.8191, test_loss: 0.8520, test_f1: 0.5313
 epoch: 50, train_loss: 0.8113, test_loss: 0.9006, test_f1: 0.5483
 epoch: 51, train_loss: 0.8169, test_loss: 0.8801, test_f1: 0.5481
 epoch: 52, train_loss: 0.8021, test_loss: 0.9070, test_f1: 0.5459
 epoch: 53, train_loss: 0.7959, test_loss: 0.9028, test_f1: 0.5344
 epoch: 54, train_loss: 0.8006, test_loss: 0.8674, test_f1: 0.5507
 epoch: 55, train_loss: 0.8037, test_loss: 0.9061, test_f1: 0.5403
 epoch: 56, train_loss: 0.7931, test_loss: 0.9344, test_f1: 0.5277
 epoch: 57, train_loss: 0.7958, test_loss: 0.8839, test_f1: 0.5396
 epoch: 58, train_loss: 0.7948, test_loss: 0.9077, test_f1: 0.5378
 epoch: 59, train_loss: 0.8012, test_loss: 0.8943, test_f1: 0.5418
 epoch: 60, train_loss: 0.7945, test_loss: 0.9364, test_f1: 0.5376
 epoch: 61, train_loss: 0.7828, test_loss: 0.8507, test_f1: 0.5441
 epoch: 62, train_loss: 0.7924, test_loss: 0.9025, test_f1: 0.5443
 epoch: 63, train_loss: 0.7938, test_loss: 0.8644, test_f1: 0.5442
 epoch: 64, train_loss: 0.7770, test_loss: 0.8769, test_f1: 0.5392
 epoch: 65, train_loss: 0.7751, test_loss: 0.8727, test_f1: 0.5452
 epoch: 66, train_loss: 0.7803, test_loss: 0.9015, test_f1: 0.5580
 epoch: 67, train_loss: 0.7858, test_loss: 0.8965, test_f1: 0.5427
 epoch: 68, train_loss: 0.7768, test_loss: 0.9148, test_f1: 0.5349
 epoch: 69, train_loss: 0.7760, test_loss: 0.8952, test_f1: 0.5458
 epoch: 70, train_loss: 0.7735, test_loss: 0.8994, test_f1: 0.5418
 epoch: 71, train_loss: 0.7712, test_loss: 0.9052, test_f1: 0.5262
 epoch: 72, train_loss: 0.7773, test_loss: 0.8712, test_f1: 0.5633
 epoch: 73, train_loss: 0.7767, test_loss: 0.9005, test_f1: 0.5473
 epoch: 74, train_loss: 0.7780, test_loss: 0.8828, test_f1: 0.5511
 epoch: 75, train_loss: 0.7749, test_loss: 0.8645, test_f1: 0.5563
 epoch: 76, train_loss: 0.7696, test_loss: 0.8830, test_f1: 0.5514
 epoch: 77, train_loss: 0.7541, test_loss: 0.8577, test_f1: 0.5615
 epoch: 78, train_loss: 0.7680, test_loss: 0.8648, test_f1: 0.5509
 epoch: 79, train_loss: 0.7672, test_loss: 0.8570, test_f1: 0.5574
 epoch: 80, train_loss: 0.7671, test_loss: 0.8727, test_f1: 0.5509
 epoch: 81, train_loss: 0.7627, test_loss: 0.9276, test_f1: 0.5400
 epoch: 82, train_loss: 0.7571, test_loss: 0.9090, test_f1: 0.5366
 epoch: 83, train_loss: 0.7695, test_loss: 0.8695, test_f1: 0.5537
 epoch: 84, train_loss: 0.7579, test_loss: 0.8481, test_f1: 0.5513
 epoch: 85, train_loss: 0.7533, test_loss: 0.8975, test_f1: 0.5395
 epoch: 86, train_loss: 0.7498, test_loss: 0.8747, test_f1: 0.5292
 epoch: 87, train_loss: 0.7477, test_loss: 0.9322, test_f1: 0.5272
 epoch: 88, train_loss: 0.7514, test_loss: 0.9084, test_f1: 0.5462
 epoch: 89, train_loss: 0.7614, test_loss: 0.8674, test_f1: 0.5489
 epoch: 90, train_loss: 0.7508, test_loss: 0.8940, test_f1: 0.5454
 epoch: 91, train_loss: 0.7508, test_loss: 1.0348, test_f1: 0.5006
 epoch: 92, train_loss: 0.7600, test_loss: 0.8918, test_f1: 0.5462
 epoch: 93, train_loss: 0.7586, test_loss: 0.8754, test_f1: 0.5520
 epoch: 94, train_loss: 0.7501, test_loss: 0.8860, test_f1: 0.5612
 epoch: 95, train_loss: 0.7460, test_loss: 0.9308, test_f1: 0.5292
 epoch: 96, train_loss: 0.7512, test_loss: 0.8651, test_f1: 0.5540
 epoch: 97, train_loss: 0.7431, test_loss: 0.8562, test_f1: 0.5527
 epoch: 98, train_loss: 0.7551, test_loss: 0.9545, test_f1: 0.5207
 epoch: 99, train_loss: 0.7474, test_loss: 0.9012, test_f1: 0.5416
##################ITERATION #6 ****************************************
 epoch: 0, train_loss: 1.5440, test_loss: 1.4186, test_f1: 0.2476
 epoch: 1, train_loss: 1.3436, test_loss: 1.3693, test_f1: 0.2540
 epoch: 2, train_loss: 1.2716, test_loss: 1.3031, test_f1: 0.2540
 epoch: 3, train_loss: 1.2380, test_loss: 1.2209, test_f1: 0.2810
 epoch: 4, train_loss: 1.1881, test_loss: 1.1550, test_f1: 0.3346
 epoch: 5, train_loss: 1.1516, test_loss: 1.1010, test_f1: 0.4106
 epoch: 6, train_loss: 1.1236, test_loss: 1.0561, test_f1: 0.4595
 epoch: 7, train_loss: 1.0900, test_loss: 1.0464, test_f1: 0.4515
 epoch: 8, train_loss: 1.0591, test_loss: 1.0183, test_f1: 0.4190
 epoch: 9, train_loss: 1.0409, test_loss: 1.0080, test_f1: 0.4592
 epoch: 10, train_loss: 1.0291, test_loss: 1.0068, test_f1: 0.4723
 epoch: 11, train_loss: 1.0220, test_loss: 1.0082, test_f1: 0.4878
 epoch: 12, train_loss: 1.0093, test_loss: 1.0099, test_f1: 0.4822
 epoch: 13, train_loss: 1.0123, test_loss: 1.0583, test_f1: 0.4412
 epoch: 14, train_loss: 0.9995, test_loss: 1.0005, test_f1: 0.4790
 epoch: 15, train_loss: 0.9896, test_loss: 1.0204, test_f1: 0.4751
 epoch: 16, train_loss: 0.9859, test_loss: 0.9999, test_f1: 0.4850
 epoch: 17, train_loss: 0.9869, test_loss: 1.0182, test_f1: 0.4803
 epoch: 18, train_loss: 0.9835, test_loss: 0.9848, test_f1: 0.4879
 epoch: 19, train_loss: 0.9659, test_loss: 1.0193, test_f1: 0.4610
 epoch: 20, train_loss: 0.9597, test_loss: 0.9923, test_f1: 0.4731
 epoch: 21, train_loss: 0.9584, test_loss: 0.9786, test_f1: 0.4908
 epoch: 22, train_loss: 0.9473, test_loss: 0.9534, test_f1: 0.4846
 epoch: 23, train_loss: 0.9475, test_loss: 0.9623, test_f1: 0.4898
 epoch: 24, train_loss: 0.9418, test_loss: 1.1336, test_f1: 0.4355
 epoch: 25, train_loss: 0.9376, test_loss: 0.9471, test_f1: 0.5093
 epoch: 26, train_loss: 0.9319, test_loss: 0.9316, test_f1: 0.5004
 epoch: 27, train_loss: 0.9274, test_loss: 1.0282, test_f1: 0.4913
 epoch: 28, train_loss: 0.9270, test_loss: 0.9424, test_f1: 0.5021
 epoch: 29, train_loss: 0.9206, test_loss: 0.9635, test_f1: 0.4824
 epoch: 30, train_loss: 0.9160, test_loss: 0.9868, test_f1: 0.5057
 epoch: 31, train_loss: 0.8995, test_loss: 0.9378, test_f1: 0.5065
 epoch: 32, train_loss: 0.8991, test_loss: 0.9361, test_f1: 0.5063
 epoch: 33, train_loss: 0.9026, test_loss: 0.9574, test_f1: 0.4757
 epoch: 34, train_loss: 0.8901, test_loss: 0.9790, test_f1: 0.5090
 epoch: 35, train_loss: 0.8831, test_loss: 0.9651, test_f1: 0.5118
 epoch: 36, train_loss: 0.8891, test_loss: 0.9802, test_f1: 0.5012
 epoch: 37, train_loss: 0.8939, test_loss: 0.9830, test_f1: 0.4956
 epoch: 38, train_loss: 0.8723, test_loss: 0.9437, test_f1: 0.5106
 epoch: 39, train_loss: 0.8686, test_loss: 0.9554, test_f1: 0.5338
 epoch: 40, train_loss: 0.8812, test_loss: 0.9822, test_f1: 0.5030
 epoch: 41, train_loss: 0.8751, test_loss: 1.0070, test_f1: 0.5036
 epoch: 42, train_loss: 0.8630, test_loss: 0.9795, test_f1: 0.5075
 epoch: 43, train_loss: 0.8655, test_loss: 1.0245, test_f1: 0.5011
 epoch: 44, train_loss: 0.8595, test_loss: 0.9925, test_f1: 0.5207
 epoch: 45, train_loss: 0.8610, test_loss: 0.9277, test_f1: 0.4940
 epoch: 46, train_loss: 0.8600, test_loss: 1.0489, test_f1: 0.5021
 epoch: 47, train_loss: 0.8544, test_loss: 1.0742, test_f1: 0.4933
 epoch: 48, train_loss: 0.8479, test_loss: 0.9671, test_f1: 0.5353
 epoch: 49, train_loss: 0.8397, test_loss: 0.9463, test_f1: 0.5123
 epoch: 50, train_loss: 0.8508, test_loss: 0.9829, test_f1: 0.5265
 epoch: 51, train_loss: 0.8341, test_loss: 0.9906, test_f1: 0.5087
 epoch: 52, train_loss: 0.8318, test_loss: 0.9695, test_f1: 0.5202
 epoch: 53, train_loss: 0.8220, test_loss: 0.9610, test_f1: 0.5390
 epoch: 54, train_loss: 0.8334, test_loss: 0.9936, test_f1: 0.5232
 epoch: 55, train_loss: 0.8211, test_loss: 0.9887, test_f1: 0.5130
 epoch: 56, train_loss: 0.8370, test_loss: 0.9685, test_f1: 0.5202
 epoch: 57, train_loss: 0.8234, test_loss: 1.0081, test_f1: 0.5029
 epoch: 58, train_loss: 0.8273, test_loss: 1.0112, test_f1: 0.5115
 epoch: 59, train_loss: 0.8185, test_loss: 0.9618, test_f1: 0.4914
 epoch: 60, train_loss: 0.8319, test_loss: 0.9702, test_f1: 0.5169
 epoch: 61, train_loss: 0.8142, test_loss: 0.9850, test_f1: 0.5033
 epoch: 62, train_loss: 0.8136, test_loss: 1.0139, test_f1: 0.5237
 epoch: 63, train_loss: 0.8173, test_loss: 0.9853, test_f1: 0.5148
 epoch: 64, train_loss: 0.8156, test_loss: 0.9550, test_f1: 0.5313
 epoch: 65, train_loss: 0.8097, test_loss: 0.9745, test_f1: 0.5095
 epoch: 66, train_loss: 0.8196, test_loss: 1.0147, test_f1: 0.5214
 epoch: 67, train_loss: 0.8045, test_loss: 1.0155, test_f1: 0.5094
 epoch: 68, train_loss: 0.8157, test_loss: 1.0049, test_f1: 0.5146
 epoch: 69, train_loss: 0.8064, test_loss: 0.9965, test_f1: 0.5105
 epoch: 70, train_loss: 0.8177, test_loss: 0.9748, test_f1: 0.5074
 epoch: 71, train_loss: 0.8093, test_loss: 1.0047, test_f1: 0.5187
 epoch: 72, train_loss: 0.8053, test_loss: 0.9833, test_f1: 0.5196
 epoch: 73, train_loss: 0.7986, test_loss: 0.9734, test_f1: 0.5128
 epoch: 74, train_loss: 0.7965, test_loss: 0.9808, test_f1: 0.5212
 epoch: 75, train_loss: 0.7995, test_loss: 0.9862, test_f1: 0.5309
 epoch: 76, train_loss: 0.8050, test_loss: 0.9636, test_f1: 0.5509
 epoch: 77, train_loss: 0.8040, test_loss: 0.9630, test_f1: 0.5190
 epoch: 78, train_loss: 0.8083, test_loss: 1.0172, test_f1: 0.5135
 epoch: 79, train_loss: 0.8028, test_loss: 1.1137, test_f1: 0.4715
 epoch: 80, train_loss: 0.8018, test_loss: 0.9831, test_f1: 0.5161
 epoch: 81, train_loss: 0.7888, test_loss: 0.9821, test_f1: 0.5177
 epoch: 82, train_loss: 0.8021, test_loss: 0.9990, test_f1: 0.5258
 epoch: 83, train_loss: 0.7930, test_loss: 0.9909, test_f1: 0.5211
 epoch: 84, train_loss: 0.7897, test_loss: 0.9858, test_f1: 0.5241
 epoch: 85, train_loss: 0.7849, test_loss: 0.9819, test_f1: 0.5200
 epoch: 86, train_loss: 0.7932, test_loss: 0.9794, test_f1: 0.5248
 epoch: 87, train_loss: 0.7907, test_loss: 0.9756, test_f1: 0.5317
 epoch: 88, train_loss: 0.7946, test_loss: 1.0040, test_f1: 0.5403
 epoch: 89, train_loss: 0.7837, test_loss: 0.9726, test_f1: 0.5253
 epoch: 90, train_loss: 0.7732, test_loss: 0.9777, test_f1: 0.5358
 epoch: 91, train_loss: 0.7816, test_loss: 0.9962, test_f1: 0.5333
 epoch: 92, train_loss: 0.7818, test_loss: 0.9985, test_f1: 0.5258
 epoch: 93, train_loss: 0.7768, test_loss: 0.9845, test_f1: 0.5282
 epoch: 94, train_loss: 0.7810, test_loss: 0.9963, test_f1: 0.5112
 epoch: 95, train_loss: 0.7733, test_loss: 1.0038, test_f1: 0.5219
 epoch: 96, train_loss: 0.7708, test_loss: 1.0127, test_f1: 0.5213
 epoch: 97, train_loss: 0.7855, test_loss: 0.9903, test_f1: 0.5188
 epoch: 98, train_loss: 0.7839, test_loss: 0.9842, test_f1: 0.5368
 epoch: 99, train_loss: 0.7785, test_loss: 0.9540, test_f1: 0.5283
##################ITERATION #7 ****************************************
 epoch: 0, train_loss: 1.3991, test_loss: 1.3361, test_f1: 0.2260
 epoch: 1, train_loss: 1.3028, test_loss: 1.3087, test_f1: 0.2260
 epoch: 2, train_loss: 1.2601, test_loss: 1.2657, test_f1: 0.2257
 epoch: 3, train_loss: 1.2360, test_loss: 1.2122, test_f1: 0.2939
 epoch: 4, train_loss: 1.2129, test_loss: 1.1719, test_f1: 0.3737
 epoch: 5, train_loss: 1.1799, test_loss: 1.1406, test_f1: 0.4089
 epoch: 6, train_loss: 1.1469, test_loss: 1.1075, test_f1: 0.4538
 epoch: 7, train_loss: 1.1230, test_loss: 1.0829, test_f1: 0.4396
 epoch: 8, train_loss: 1.1105, test_loss: 1.0616, test_f1: 0.4069
 epoch: 9, train_loss: 1.0723, test_loss: 1.0507, test_f1: 0.4029
 epoch: 10, train_loss: 1.0497, test_loss: 1.1183, test_f1: 0.3786
 epoch: 11, train_loss: 1.0476, test_loss: 1.0678, test_f1: 0.4304
 epoch: 12, train_loss: 1.0343, test_loss: 1.0285, test_f1: 0.4451
 epoch: 13, train_loss: 1.0119, test_loss: 0.9845, test_f1: 0.4899
 epoch: 14, train_loss: 1.0078, test_loss: 1.0250, test_f1: 0.4575
 epoch: 15, train_loss: 1.0000, test_loss: 1.0107, test_f1: 0.4671
 epoch: 16, train_loss: 0.9993, test_loss: 1.0139, test_f1: 0.4525
 epoch: 17, train_loss: 0.9899, test_loss: 0.9838, test_f1: 0.4873
 epoch: 18, train_loss: 0.9679, test_loss: 1.0174, test_f1: 0.4820
 epoch: 19, train_loss: 0.9643, test_loss: 1.0106, test_f1: 0.4771
 epoch: 20, train_loss: 0.9630, test_loss: 0.9751, test_f1: 0.4754
 epoch: 21, train_loss: 0.9497, test_loss: 0.9924, test_f1: 0.4738
 epoch: 22, train_loss: 0.9499, test_loss: 0.9637, test_f1: 0.4907
 epoch: 23, train_loss: 0.9459, test_loss: 0.9842, test_f1: 0.4888
 epoch: 24, train_loss: 0.9301, test_loss: 0.9887, test_f1: 0.4867
 epoch: 25, train_loss: 0.9337, test_loss: 0.9877, test_f1: 0.4921
 epoch: 26, train_loss: 0.9202, test_loss: 1.0612, test_f1: 0.4496
 epoch: 27, train_loss: 0.9207, test_loss: 0.9894, test_f1: 0.4977
 epoch: 28, train_loss: 0.9051, test_loss: 1.0113, test_f1: 0.4618
 epoch: 29, train_loss: 0.9163, test_loss: 0.9802, test_f1: 0.4628
 epoch: 30, train_loss: 0.8923, test_loss: 0.9486, test_f1: 0.5143
 epoch: 31, train_loss: 0.8901, test_loss: 1.0357, test_f1: 0.4730
 epoch: 32, train_loss: 0.8968, test_loss: 0.9434, test_f1: 0.5138
 epoch: 33, train_loss: 0.8944, test_loss: 0.9541, test_f1: 0.5143
 epoch: 34, train_loss: 0.8724, test_loss: 0.9366, test_f1: 0.5092
 epoch: 35, train_loss: 0.8762, test_loss: 0.9345, test_f1: 0.5191
 epoch: 36, train_loss: 0.8641, test_loss: 0.9296, test_f1: 0.5218
 epoch: 37, train_loss: 0.8594, test_loss: 0.9370, test_f1: 0.5108
 epoch: 38, train_loss: 0.8653, test_loss: 0.9610, test_f1: 0.5132
 epoch: 39, train_loss: 0.8659, test_loss: 0.9183, test_f1: 0.5211
 epoch: 40, train_loss: 0.8550, test_loss: 0.9477, test_f1: 0.4867
 epoch: 41, train_loss: 0.8494, test_loss: 0.9117, test_f1: 0.5194
 epoch: 42, train_loss: 0.8534, test_loss: 0.9124, test_f1: 0.5221
 epoch: 43, train_loss: 0.8393, test_loss: 0.9440, test_f1: 0.5322
 epoch: 44, train_loss: 0.8493, test_loss: 0.9400, test_f1: 0.5153
 epoch: 45, train_loss: 0.8434, test_loss: 0.9261, test_f1: 0.5349
 epoch: 46, train_loss: 0.8391, test_loss: 0.9814, test_f1: 0.4926
 epoch: 47, train_loss: 0.8382, test_loss: 0.9057, test_f1: 0.5178
 epoch: 48, train_loss: 0.8378, test_loss: 0.9347, test_f1: 0.5104
 epoch: 49, train_loss: 0.8297, test_loss: 0.9276, test_f1: 0.5068
 epoch: 50, train_loss: 0.8326, test_loss: 0.9125, test_f1: 0.5249
 epoch: 51, train_loss: 0.8212, test_loss: 0.9562, test_f1: 0.5158
 epoch: 52, train_loss: 0.8239, test_loss: 0.9446, test_f1: 0.5385
 epoch: 53, train_loss: 0.8099, test_loss: 0.9374, test_f1: 0.5275
 epoch: 54, train_loss: 0.8154, test_loss: 0.9374, test_f1: 0.5293
 epoch: 55, train_loss: 0.8031, test_loss: 0.9071, test_f1: 0.5372
 epoch: 56, train_loss: 0.8131, test_loss: 0.9350, test_f1: 0.5157
 epoch: 57, train_loss: 0.8159, test_loss: 0.9330, test_f1: 0.5165
 epoch: 58, train_loss: 0.8013, test_loss: 0.9768, test_f1: 0.5215
 epoch: 59, train_loss: 0.8071, test_loss: 0.8999, test_f1: 0.5304
 epoch: 60, train_loss: 0.7960, test_loss: 0.9114, test_f1: 0.5285
 epoch: 61, train_loss: 0.8001, test_loss: 0.9311, test_f1: 0.5450
 epoch: 62, train_loss: 0.7884, test_loss: 0.9177, test_f1: 0.5348
 epoch: 63, train_loss: 0.8004, test_loss: 0.9066, test_f1: 0.5303
 epoch: 64, train_loss: 0.7987, test_loss: 0.9446, test_f1: 0.5198
 epoch: 65, train_loss: 0.7874, test_loss: 0.9186, test_f1: 0.5263
 epoch: 66, train_loss: 0.7835, test_loss: 0.9357, test_f1: 0.5282
 epoch: 67, train_loss: 0.7906, test_loss: 0.9075, test_f1: 0.5358
 epoch: 68, train_loss: 0.7896, test_loss: 0.8954, test_f1: 0.5329
 epoch: 69, train_loss: 0.7830, test_loss: 0.9799, test_f1: 0.5231
 epoch: 70, train_loss: 0.7870, test_loss: 0.8970, test_f1: 0.5319
 epoch: 71, train_loss: 0.7849, test_loss: 0.9030, test_f1: 0.5410
 epoch: 72, train_loss: 0.7804, test_loss: 0.9173, test_f1: 0.5394
 epoch: 73, train_loss: 0.7816, test_loss: 0.9234, test_f1: 0.5189
 epoch: 74, train_loss: 0.7897, test_loss: 0.9834, test_f1: 0.5145
 epoch: 75, train_loss: 0.7708, test_loss: 0.9412, test_f1: 0.5183
 epoch: 76, train_loss: 0.7751, test_loss: 0.9217, test_f1: 0.5328
 epoch: 77, train_loss: 0.7789, test_loss: 0.9945, test_f1: 0.5209
 epoch: 78, train_loss: 0.7763, test_loss: 0.9241, test_f1: 0.5302
 epoch: 79, train_loss: 0.7689, test_loss: 0.9890, test_f1: 0.5196
 epoch: 80, train_loss: 0.7704, test_loss: 0.9063, test_f1: 0.5361
 epoch: 81, train_loss: 0.7771, test_loss: 0.9385, test_f1: 0.5410
 epoch: 82, train_loss: 0.7806, test_loss: 1.0484, test_f1: 0.4970
 epoch: 83, train_loss: 0.7701, test_loss: 0.9418, test_f1: 0.5280
 epoch: 84, train_loss: 0.7762, test_loss: 0.9563, test_f1: 0.5405
 epoch: 85, train_loss: 0.7628, test_loss: 0.8978, test_f1: 0.5466
 epoch: 86, train_loss: 0.7640, test_loss: 0.9015, test_f1: 0.5364
 epoch: 87, train_loss: 0.7632, test_loss: 0.9143, test_f1: 0.5369
 epoch: 88, train_loss: 0.7677, test_loss: 0.9725, test_f1: 0.5287
 epoch: 89, train_loss: 0.7799, test_loss: 0.8837, test_f1: 0.5342
 epoch: 90, train_loss: 0.7587, test_loss: 0.8973, test_f1: 0.5329
 epoch: 91, train_loss: 0.7617, test_loss: 0.9250, test_f1: 0.5369
 epoch: 92, train_loss: 0.7664, test_loss: 0.9694, test_f1: 0.5294
 epoch: 93, train_loss: 0.7643, test_loss: 0.9779, test_f1: 0.5096
 epoch: 94, train_loss: 0.7553, test_loss: 0.9355, test_f1: 0.5421
 epoch: 95, train_loss: 0.7505, test_loss: 0.9125, test_f1: 0.5349
 epoch: 96, train_loss: 0.7593, test_loss: 0.9801, test_f1: 0.5292
 epoch: 97, train_loss: 0.7536, test_loss: 1.0509, test_f1: 0.5058
 epoch: 98, train_loss: 0.7641, test_loss: 0.9484, test_f1: 0.5240
 epoch: 99, train_loss: 0.7555, test_loss: 0.9303, test_f1: 0.5366
##################ITERATION #8 ****************************************
 epoch: 0, train_loss: 1.3868, test_loss: 1.3670, test_f1: 0.2260
 epoch: 1, train_loss: 1.2100, test_loss: 1.3136, test_f1: 0.2410
 epoch: 2, train_loss: 1.1621, test_loss: 1.2312, test_f1: 0.2577
 epoch: 3, train_loss: 1.1265, test_loss: 1.1119, test_f1: 0.4259
 epoch: 4, train_loss: 1.1068, test_loss: 1.0900, test_f1: 0.4134
 epoch: 5, train_loss: 1.0837, test_loss: 1.0766, test_f1: 0.4240
 epoch: 6, train_loss: 1.0677, test_loss: 1.0715, test_f1: 0.4226
 epoch: 7, train_loss: 1.0541, test_loss: 1.0674, test_f1: 0.4338
 epoch: 8, train_loss: 1.0379, test_loss: 1.0657, test_f1: 0.4399
 epoch: 9, train_loss: 1.0379, test_loss: 1.0690, test_f1: 0.4489
 epoch: 10, train_loss: 1.0338, test_loss: 1.0579, test_f1: 0.4466
 epoch: 11, train_loss: 1.0357, test_loss: 1.0782, test_f1: 0.4509
 epoch: 12, train_loss: 1.0280, test_loss: 1.0637, test_f1: 0.4373
 epoch: 13, train_loss: 1.0149, test_loss: 1.0840, test_f1: 0.4387
 epoch: 14, train_loss: 1.0137, test_loss: 1.0913, test_f1: 0.4249
 epoch: 15, train_loss: 1.0085, test_loss: 1.0838, test_f1: 0.4305
 epoch: 16, train_loss: 1.0005, test_loss: 1.0710, test_f1: 0.4402
 epoch: 17, train_loss: 0.9866, test_loss: 1.0916, test_f1: 0.4329
 epoch: 18, train_loss: 0.9954, test_loss: 1.0965, test_f1: 0.4356
 epoch: 19, train_loss: 0.9854, test_loss: 1.0733, test_f1: 0.4634
 epoch: 20, train_loss: 0.9795, test_loss: 1.0935, test_f1: 0.4637
 epoch: 21, train_loss: 0.9796, test_loss: 1.1627, test_f1: 0.4370
 epoch: 22, train_loss: 0.9774, test_loss: 1.1116, test_f1: 0.4710
 epoch: 23, train_loss: 0.9721, test_loss: 1.0902, test_f1: 0.4433
 epoch: 24, train_loss: 0.9689, test_loss: 1.0726, test_f1: 0.4750
 epoch: 25, train_loss: 0.9638, test_loss: 1.1298, test_f1: 0.4269
 epoch: 26, train_loss: 0.9613, test_loss: 1.1254, test_f1: 0.4531
 epoch: 27, train_loss: 0.9502, test_loss: 1.1242, test_f1: 0.4669
 epoch: 28, train_loss: 0.9429, test_loss: 1.0863, test_f1: 0.4840
 epoch: 29, train_loss: 0.9423, test_loss: 1.1606, test_f1: 0.4523
 epoch: 30, train_loss: 0.9379, test_loss: 1.1021, test_f1: 0.4558
 epoch: 31, train_loss: 0.9336, test_loss: 1.1078, test_f1: 0.4740
 epoch: 32, train_loss: 0.9359, test_loss: 1.1463, test_f1: 0.4485
 epoch: 33, train_loss: 0.9345, test_loss: 1.0932, test_f1: 0.4690
 epoch: 34, train_loss: 0.9378, test_loss: 1.0995, test_f1: 0.4690
 epoch: 35, train_loss: 0.9332, test_loss: 1.0920, test_f1: 0.4736
 epoch: 36, train_loss: 0.9367, test_loss: 1.1151, test_f1: 0.4713
 epoch: 37, train_loss: 0.9245, test_loss: 1.1422, test_f1: 0.4463
 epoch: 38, train_loss: 0.9206, test_loss: 1.0982, test_f1: 0.5067
 epoch: 39, train_loss: 0.9220, test_loss: 1.1552, test_f1: 0.4599
 epoch: 40, train_loss: 0.9131, test_loss: 1.1240, test_f1: 0.4699
 epoch: 41, train_loss: 0.9161, test_loss: 1.0730, test_f1: 0.4959
 epoch: 42, train_loss: 0.9005, test_loss: 1.1036, test_f1: 0.4819
 epoch: 43, train_loss: 0.9013, test_loss: 1.0775, test_f1: 0.5011
 epoch: 44, train_loss: 0.9094, test_loss: 1.0755, test_f1: 0.4826
 epoch: 45, train_loss: 0.8945, test_loss: 1.0552, test_f1: 0.4737
 epoch: 46, train_loss: 0.8901, test_loss: 1.0591, test_f1: 0.4674
 epoch: 47, train_loss: 0.8946, test_loss: 1.1428, test_f1: 0.4641
 epoch: 48, train_loss: 0.9019, test_loss: 1.0695, test_f1: 0.4829
 epoch: 49, train_loss: 0.8881, test_loss: 1.0810, test_f1: 0.4864
 epoch: 50, train_loss: 0.8884, test_loss: 1.0944, test_f1: 0.4964
 epoch: 51, train_loss: 0.8830, test_loss: 1.0596, test_f1: 0.4736
 epoch: 52, train_loss: 0.8724, test_loss: 1.0419, test_f1: 0.5034
 epoch: 53, train_loss: 0.8664, test_loss: 1.0529, test_f1: 0.4976
 epoch: 54, train_loss: 0.8579, test_loss: 1.0438, test_f1: 0.4994
 epoch: 55, train_loss: 0.8663, test_loss: 1.0493, test_f1: 0.5035
 epoch: 56, train_loss: 0.8619, test_loss: 1.0417, test_f1: 0.5102
 epoch: 57, train_loss: 0.8625, test_loss: 1.0421, test_f1: 0.4903
 epoch: 58, train_loss: 0.8618, test_loss: 1.0611, test_f1: 0.4950
 epoch: 59, train_loss: 0.8541, test_loss: 1.0589, test_f1: 0.5028
 epoch: 60, train_loss: 0.8556, test_loss: 1.0331, test_f1: 0.4915
 epoch: 61, train_loss: 0.8513, test_loss: 1.0490, test_f1: 0.5158
 epoch: 62, train_loss: 0.8567, test_loss: 1.0576, test_f1: 0.4983
 epoch: 63, train_loss: 0.8572, test_loss: 1.0676, test_f1: 0.4928
 epoch: 64, train_loss: 0.8524, test_loss: 1.0635, test_f1: 0.5029
 epoch: 65, train_loss: 0.8360, test_loss: 1.0287, test_f1: 0.4970
 epoch: 66, train_loss: 0.8461, test_loss: 1.0429, test_f1: 0.5006
 epoch: 67, train_loss: 0.8405, test_loss: 1.0473, test_f1: 0.5010
 epoch: 68, train_loss: 0.8399, test_loss: 1.0353, test_f1: 0.5037
 epoch: 69, train_loss: 0.8430, test_loss: 1.0317, test_f1: 0.4912
 epoch: 70, train_loss: 0.8453, test_loss: 1.0230, test_f1: 0.5318
 epoch: 71, train_loss: 0.8392, test_loss: 1.0417, test_f1: 0.4910
 epoch: 72, train_loss: 0.8333, test_loss: 1.0462, test_f1: 0.4990
 epoch: 73, train_loss: 0.8243, test_loss: 1.0022, test_f1: 0.5231
 epoch: 74, train_loss: 0.8314, test_loss: 1.0430, test_f1: 0.5051
 epoch: 75, train_loss: 0.8414, test_loss: 1.0622, test_f1: 0.4975
 epoch: 76, train_loss: 0.8317, test_loss: 1.0339, test_f1: 0.5228
 epoch: 77, train_loss: 0.8303, test_loss: 1.0157, test_f1: 0.4999
 epoch: 78, train_loss: 0.8200, test_loss: 1.0829, test_f1: 0.4871
 epoch: 79, train_loss: 0.8201, test_loss: 1.0431, test_f1: 0.5148
 epoch: 80, train_loss: 0.8247, test_loss: 1.0217, test_f1: 0.5205
 epoch: 81, train_loss: 0.8167, test_loss: 1.0337, test_f1: 0.5080
 epoch: 82, train_loss: 0.8310, test_loss: 1.0747, test_f1: 0.5062
 epoch: 83, train_loss: 0.8298, test_loss: 1.0339, test_f1: 0.5191
 epoch: 84, train_loss: 0.8243, test_loss: 1.0585, test_f1: 0.4928
 epoch: 85, train_loss: 0.8231, test_loss: 1.0255, test_f1: 0.5188
 epoch: 86, train_loss: 0.8101, test_loss: 1.0508, test_f1: 0.5167
 epoch: 87, train_loss: 0.8262, test_loss: 1.0298, test_f1: 0.5200
 epoch: 88, train_loss: 0.8168, test_loss: 1.0323, test_f1: 0.5253
 epoch: 89, train_loss: 0.8212, test_loss: 1.0134, test_f1: 0.5092
 epoch: 90, train_loss: 0.8054, test_loss: 1.0416, test_f1: 0.5172
 epoch: 91, train_loss: 0.8120, test_loss: 1.0380, test_f1: 0.5125
 epoch: 92, train_loss: 0.8071, test_loss: 1.0421, test_f1: 0.5106
 epoch: 93, train_loss: 0.8138, test_loss: 1.0297, test_f1: 0.5269
 epoch: 94, train_loss: 0.8136, test_loss: 1.0460, test_f1: 0.5111
 epoch: 95, train_loss: 0.8024, test_loss: 1.0646, test_f1: 0.5027
 epoch: 96, train_loss: 0.8060, test_loss: 1.0538, test_f1: 0.5162
 epoch: 97, train_loss: 0.8016, test_loss: 1.1150, test_f1: 0.4928
 epoch: 98, train_loss: 0.7981, test_loss: 1.0224, test_f1: 0.5350
 epoch: 99, train_loss: 0.7959, test_loss: 1.0361, test_f1: 0.5252
##################ITERATION #9 ****************************************
 epoch: 0, train_loss: 1.3753, test_loss: 1.3202, test_f1: 0.2260
 epoch: 1, train_loss: 1.1888, test_loss: 1.2451, test_f1: 0.2286
 epoch: 2, train_loss: 1.1295, test_loss: 1.1692, test_f1: 0.3412
 epoch: 3, train_loss: 1.0932, test_loss: 1.1317, test_f1: 0.3482
 epoch: 4, train_loss: 1.0726, test_loss: 1.1116, test_f1: 0.3666
 epoch: 5, train_loss: 1.0587, test_loss: 1.0840, test_f1: 0.4252
 epoch: 6, train_loss: 1.0389, test_loss: 1.0622, test_f1: 0.4283
 epoch: 7, train_loss: 1.0331, test_loss: 1.0488, test_f1: 0.4297
 epoch: 8, train_loss: 1.0187, test_loss: 1.0234, test_f1: 0.4899
 epoch: 9, train_loss: 1.0161, test_loss: 1.0196, test_f1: 0.4737
 epoch: 10, train_loss: 1.0054, test_loss: 1.0217, test_f1: 0.4776
 epoch: 11, train_loss: 0.9948, test_loss: 0.9974, test_f1: 0.4943
 epoch: 12, train_loss: 0.9865, test_loss: 1.0172, test_f1: 0.4680
 epoch: 13, train_loss: 0.9815, test_loss: 1.0013, test_f1: 0.4807
 epoch: 14, train_loss: 0.9654, test_loss: 0.9975, test_f1: 0.4994
 epoch: 15, train_loss: 0.9658, test_loss: 0.9929, test_f1: 0.4980
 epoch: 16, train_loss: 0.9578, test_loss: 0.9997, test_f1: 0.4999
 epoch: 17, train_loss: 0.9513, test_loss: 0.9825, test_f1: 0.5021
 epoch: 18, train_loss: 0.9489, test_loss: 1.0106, test_f1: 0.4890
 epoch: 19, train_loss: 0.9404, test_loss: 0.9855, test_f1: 0.5019
 epoch: 20, train_loss: 0.9495, test_loss: 0.9768, test_f1: 0.5127
 epoch: 21, train_loss: 0.9309, test_loss: 0.9853, test_f1: 0.4857
 epoch: 22, train_loss: 0.9250, test_loss: 1.0240, test_f1: 0.5095
 epoch: 23, train_loss: 0.9384, test_loss: 0.9588, test_f1: 0.4969
 epoch: 24, train_loss: 0.9150, test_loss: 0.9874, test_f1: 0.5125
 epoch: 25, train_loss: 0.9142, test_loss: 1.0019, test_f1: 0.4971
 epoch: 26, train_loss: 0.9070, test_loss: 0.9546, test_f1: 0.5000
 epoch: 27, train_loss: 0.9196, test_loss: 0.9738, test_f1: 0.5121
 epoch: 28, train_loss: 0.9030, test_loss: 0.9513, test_f1: 0.5271
 epoch: 29, train_loss: 0.8963, test_loss: 1.0287, test_f1: 0.5125
 epoch: 30, train_loss: 0.9012, test_loss: 0.9807, test_f1: 0.5065
 epoch: 31, train_loss: 0.9074, test_loss: 0.9702, test_f1: 0.5180
 epoch: 32, train_loss: 0.8847, test_loss: 1.0202, test_f1: 0.5079
 epoch: 33, train_loss: 0.8919, test_loss: 0.9574, test_f1: 0.5255
 epoch: 34, train_loss: 0.8882, test_loss: 0.9920, test_f1: 0.5186
 epoch: 35, train_loss: 0.8936, test_loss: 0.9990, test_f1: 0.5033
 epoch: 36, train_loss: 0.8783, test_loss: 0.9421, test_f1: 0.5242
 epoch: 37, train_loss: 0.8667, test_loss: 1.0133, test_f1: 0.5084
 epoch: 38, train_loss: 0.8644, test_loss: 0.9611, test_f1: 0.5448
 epoch: 39, train_loss: 0.8708, test_loss: 0.9949, test_f1: 0.5303
 epoch: 40, train_loss: 0.8567, test_loss: 0.9523, test_f1: 0.5472
 epoch: 41, train_loss: 0.8586, test_loss: 0.9546, test_f1: 0.5443
 epoch: 42, train_loss: 0.8591, test_loss: 0.9479, test_f1: 0.5473
 epoch: 43, train_loss: 0.8536, test_loss: 0.9814, test_f1: 0.5285
 epoch: 44, train_loss: 0.8601, test_loss: 0.9773, test_f1: 0.5345
 epoch: 45, train_loss: 0.8597, test_loss: 0.9743, test_f1: 0.5332
 epoch: 46, train_loss: 0.8566, test_loss: 0.9289, test_f1: 0.5284
 epoch: 47, train_loss: 0.8472, test_loss: 0.9608, test_f1: 0.5418
 epoch: 48, train_loss: 0.8401, test_loss: 0.9478, test_f1: 0.5270
 epoch: 49, train_loss: 0.8375, test_loss: 0.9542, test_f1: 0.5388
 epoch: 50, train_loss: 0.8514, test_loss: 1.0294, test_f1: 0.5204
 epoch: 51, train_loss: 0.8335, test_loss: 0.9661, test_f1: 0.5400
 epoch: 52, train_loss: 0.8188, test_loss: 0.9775, test_f1: 0.5276
 epoch: 53, train_loss: 0.8196, test_loss: 0.9521, test_f1: 0.5524
 epoch: 54, train_loss: 0.8229, test_loss: 0.9503, test_f1: 0.5454
 epoch: 55, train_loss: 0.8176, test_loss: 0.9391, test_f1: 0.5547
 epoch: 56, train_loss: 0.8186, test_loss: 0.9667, test_f1: 0.5542
 epoch: 57, train_loss: 0.8227, test_loss: 0.9628, test_f1: 0.5358
 epoch: 58, train_loss: 0.8138, test_loss: 0.9248, test_f1: 0.5561
 epoch: 59, train_loss: 0.8059, test_loss: 0.9562, test_f1: 0.5480
 epoch: 60, train_loss: 0.8161, test_loss: 0.9491, test_f1: 0.5531
 epoch: 61, train_loss: 0.8082, test_loss: 0.9679, test_f1: 0.5371
 epoch: 62, train_loss: 0.8071, test_loss: 0.9474, test_f1: 0.5493
 epoch: 63, train_loss: 0.8195, test_loss: 0.9592, test_f1: 0.5337
 epoch: 64, train_loss: 0.8051, test_loss: 0.9408, test_f1: 0.5416
 epoch: 65, train_loss: 0.8047, test_loss: 0.9541, test_f1: 0.5423
 epoch: 66, train_loss: 0.8088, test_loss: 0.9373, test_f1: 0.5546
 epoch: 67, train_loss: 0.8063, test_loss: 0.9516, test_f1: 0.5408
 epoch: 68, train_loss: 0.8004, test_loss: 0.9403, test_f1: 0.5436
 epoch: 69, train_loss: 0.8091, test_loss: 1.0022, test_f1: 0.5305
 epoch: 70, train_loss: 0.8068, test_loss: 0.9617, test_f1: 0.5548
 epoch: 71, train_loss: 0.7919, test_loss: 0.9573, test_f1: 0.5551
 epoch: 72, train_loss: 0.7937, test_loss: 0.9378, test_f1: 0.5455
 epoch: 73, train_loss: 0.7839, test_loss: 0.9609, test_f1: 0.5350
 epoch: 74, train_loss: 0.7946, test_loss: 0.9422, test_f1: 0.5495
 epoch: 75, train_loss: 0.7862, test_loss: 0.9781, test_f1: 0.5312
 epoch: 76, train_loss: 0.7881, test_loss: 0.9605, test_f1: 0.5411
 epoch: 77, train_loss: 0.7769, test_loss: 0.9921, test_f1: 0.5331
 epoch: 78, train_loss: 0.7772, test_loss: 0.9703, test_f1: 0.5251
 epoch: 79, train_loss: 0.7797, test_loss: 0.9428, test_f1: 0.5455
 epoch: 80, train_loss: 0.7691, test_loss: 0.9486, test_f1: 0.5410
 epoch: 81, train_loss: 0.7789, test_loss: 0.9483, test_f1: 0.5440
 epoch: 82, train_loss: 0.7732, test_loss: 0.9797, test_f1: 0.5408
 epoch: 83, train_loss: 0.7760, test_loss: 0.9532, test_f1: 0.5515
 epoch: 84, train_loss: 0.7778, test_loss: 0.9588, test_f1: 0.5473
 epoch: 85, train_loss: 0.7694, test_loss: 0.9797, test_f1: 0.5241
 epoch: 86, train_loss: 0.7764, test_loss: 0.9770, test_f1: 0.5444
 epoch: 87, train_loss: 0.7721, test_loss: 0.9906, test_f1: 0.5291
 epoch: 88, train_loss: 0.7634, test_loss: 0.9534, test_f1: 0.5394
 epoch: 89, train_loss: 0.7514, test_loss: 0.9426, test_f1: 0.5431
 epoch: 90, train_loss: 0.7542, test_loss: 0.9278, test_f1: 0.5488
 epoch: 91, train_loss: 0.7688, test_loss: 0.9465, test_f1: 0.5469
 epoch: 92, train_loss: 0.7682, test_loss: 0.9822, test_f1: 0.5187
 epoch: 93, train_loss: 0.7589, test_loss: 0.9525, test_f1: 0.5419
 epoch: 94, train_loss: 0.7565, test_loss: 0.9854, test_f1: 0.5318
 epoch: 95, train_loss: 0.7461, test_loss: 0.9648, test_f1: 0.5416
 epoch: 96, train_loss: 0.7563, test_loss: 0.9739, test_f1: 0.5285
 epoch: 97, train_loss: 0.7590, test_loss: 1.0097, test_f1: 0.5243
 epoch: 98, train_loss: 0.7549, test_loss: 0.9912, test_f1: 0.5228
 epoch: 99, train_loss: 0.7611, test_loss: 0.9936, test_f1: 0.5295

Training completed in 430.83 seconds
Best F1: 0.5633 at epoch 72
Mean F1 across iterations: 0.5435  0.0134
========================FINAL RESULTS================================
FEGIN weighted F1: 0.5633  0.0134
python main.py --data ltspice_examples --representation component_pin --model FEGIN --layers 5 --hiddens 16 --batch_size 256 --lr 0.001 --emb_size 128 --epochs 100 --save_appendix component_pin_L5_H16_BS256_LR0.001_E128 --no_val
-----



STDERR:
  File "main.py", line 370, in <module>
    main()
  File "main.py", line 254, in main
    dataset = dataset_class(
  File "/home/philip/projects/ltspice_examples_code_repo/Circuit-Completion-Using-GNNs/component_classification_with_link_prediction_head/evaluation/FEGIN/kernel/circuit_datasets.py", line 15, in __init__
    self.data, self.slices = torch.load(self.processed_paths[0])
  File "/home/philip/.local/lib/python3.8/site-packages/torch/serialization.py", line 1040, in load
    warnings.warn(
  File "/usr/lib/python3.8/warnings.py", line 109, in _showwarnmsg
    sw(msg.message, msg.category, msg.filename, msg.lineno,
  File "main.py", line 47, in warn_with_traceback
    traceback.print_stack(file=log)
/home/philip/projects/ltspice_examples_code_repo/Circuit-Completion-Using-GNNs/component_classification_with_link_prediction_head/evaluation/FEGIN/kernel/circuit_datasets.py:15: FutureWarning: You are using `torch.load` with `weights_only=False` (the current default value), which uses the default pickle module implicitly. It is possible to construct malicious pickle data which will execute arbitrary code during unpickling (See https://github.com/pytorch/pytorch/blob/main/SECURITY.md#untrusted-models for more details). In a future release, the default value for `weights_only` will be flipped to `True`. This limits the functions that could be executed during unpickling. Arbitrary objects will no longer be allowed to be loaded via this mode unless they are explicitly allowlisted by the user via `torch.serialization.add_safe_globals`. We recommend you start setting `weights_only=True` for any use case where you don't have full control of the loaded file. Please open an issue on GitHub for any issues related to this experimental feature.
  self.data, self.slices = torch.load(self.processed_paths[0])
