STDOUT:
Results will be saved in /home/philip/projects/ltspice_examples_code_repo/Circuit-Completion-Using-GNNs/component_classification_with_link_prediction_head/evaluation/FEGIN/results/model_FEGIN_dataset_ltspice_demos
Command line input: python main.py --data ltspice_demos --representation component_net --model FEGIN --layers 6 --hiddens 64 --batch_size 256 --lr 0.0001 --emb_size 512 --epochs 100 --save_appendix component_net_L6_H64_BS256_LR0.0001_E512 --no_val
 is saved.
-----
ltspice_demos - FEGIN
Using 6 layers, 64 hidden units, h = 2
Loading component_net representation dataset
ENTERED
Training FEGIN on component_net representation
Train: 1565, Test: 383
##################ITERATION #0 ****************************************
 epoch: 0, train_loss: 1.3844, test_loss: 1.3928, test_f1: 0.1365
 epoch: 1, train_loss: 1.3757, test_loss: 1.3922, test_f1: 0.1365
 epoch: 2, train_loss: 1.3717, test_loss: 1.3907, test_f1: 0.1365
 epoch: 3, train_loss: 1.3660, test_loss: 1.3874, test_f1: 0.1365
 epoch: 4, train_loss: 1.3604, test_loss: 1.3834, test_f1: 0.1365
 epoch: 5, train_loss: 1.3559, test_loss: 1.3806, test_f1: 0.1365
 epoch: 6, train_loss: 1.3482, test_loss: 1.3789, test_f1: 0.1365
 epoch: 7, train_loss: 1.3425, test_loss: 1.3758, test_f1: 0.1365
 epoch: 8, train_loss: 1.3371, test_loss: 1.3710, test_f1: 0.1365
 epoch: 9, train_loss: 1.3286, test_loss: 1.3658, test_f1: 0.1365
 epoch: 10, train_loss: 1.3204, test_loss: 1.3596, test_f1: 0.1365
 epoch: 11, train_loss: 1.3110, test_loss: 1.3514, test_f1: 0.1365
 epoch: 12, train_loss: 1.3025, test_loss: 1.3421, test_f1: 0.1365
 epoch: 13, train_loss: 1.2929, test_loss: 1.3322, test_f1: 0.1365
 epoch: 14, train_loss: 1.2824, test_loss: 1.3205, test_f1: 0.1365
 epoch: 15, train_loss: 1.2721, test_loss: 1.3104, test_f1: 0.1365
 epoch: 16, train_loss: 1.2596, test_loss: 1.3020, test_f1: 0.1365
 epoch: 17, train_loss: 1.2482, test_loss: 1.2934, test_f1: 0.1365
 epoch: 18, train_loss: 1.2378, test_loss: 1.2843, test_f1: 0.1420
 epoch: 19, train_loss: 1.2260, test_loss: 1.2717, test_f1: 0.1550
 epoch: 20, train_loss: 1.2163, test_loss: 1.2637, test_f1: 0.1869
 epoch: 21, train_loss: 1.2051, test_loss: 1.2564, test_f1: 0.1961
 epoch: 22, train_loss: 1.1982, test_loss: 1.2497, test_f1: 0.2346
 epoch: 23, train_loss: 1.1896, test_loss: 1.2406, test_f1: 0.2581
 epoch: 24, train_loss: 1.1812, test_loss: 1.2345, test_f1: 0.2637
 epoch: 25, train_loss: 1.1757, test_loss: 1.2281, test_f1: 0.2809
 epoch: 26, train_loss: 1.1654, test_loss: 1.2216, test_f1: 0.3173
 epoch: 27, train_loss: 1.1590, test_loss: 1.2150, test_f1: 0.3421
 epoch: 28, train_loss: 1.1570, test_loss: 1.2122, test_f1: 0.3583
 epoch: 29, train_loss: 1.1489, test_loss: 1.2097, test_f1: 0.3420
 epoch: 30, train_loss: 1.1459, test_loss: 1.2067, test_f1: 0.3305
 epoch: 31, train_loss: 1.1401, test_loss: 1.2006, test_f1: 0.3292
 epoch: 32, train_loss: 1.1387, test_loss: 1.1942, test_f1: 0.2996
 epoch: 33, train_loss: 1.1277, test_loss: 1.1920, test_f1: 0.2905
 epoch: 34, train_loss: 1.1302, test_loss: 1.1869, test_f1: 0.3260
 epoch: 35, train_loss: 1.1246, test_loss: 1.1843, test_f1: 0.3151
 epoch: 36, train_loss: 1.1252, test_loss: 1.1801, test_f1: 0.3028
 epoch: 37, train_loss: 1.1208, test_loss: 1.1775, test_f1: 0.2742
 epoch: 38, train_loss: 1.1195, test_loss: 1.1768, test_f1: 0.2686
 epoch: 39, train_loss: 1.1110, test_loss: 1.1727, test_f1: 0.2713
 epoch: 40, train_loss: 1.1064, test_loss: 1.1721, test_f1: 0.2650
 epoch: 41, train_loss: 1.1026, test_loss: 1.1689, test_f1: 0.2991
 epoch: 42, train_loss: 1.1042, test_loss: 1.1654, test_f1: 0.3228
 epoch: 43, train_loss: 1.1015, test_loss: 1.1623, test_f1: 0.3273
 epoch: 44, train_loss: 1.0989, test_loss: 1.1653, test_f1: 0.3338
 epoch: 45, train_loss: 1.0920, test_loss: 1.1602, test_f1: 0.3274
 epoch: 46, train_loss: 1.0891, test_loss: 1.1532, test_f1: 0.3310
 epoch: 47, train_loss: 1.0866, test_loss: 1.1521, test_f1: 0.3395
 epoch: 48, train_loss: 1.0868, test_loss: 1.1485, test_f1: 0.3477
 epoch: 49, train_loss: 1.0829, test_loss: 1.1459, test_f1: 0.3522
 epoch: 50, train_loss: 1.0851, test_loss: 1.1470, test_f1: 0.3747
 epoch: 51, train_loss: 1.0772, test_loss: 1.1432, test_f1: 0.3743
 epoch: 52, train_loss: 1.0796, test_loss: 1.1416, test_f1: 0.3653
 epoch: 53, train_loss: 1.0749, test_loss: 1.1403, test_f1: 0.3689
 epoch: 54, train_loss: 1.0726, test_loss: 1.1381, test_f1: 0.3732
 epoch: 55, train_loss: 1.0714, test_loss: 1.1354, test_f1: 0.3799
 epoch: 56, train_loss: 1.0695, test_loss: 1.1368, test_f1: 0.3834
 epoch: 57, train_loss: 1.0671, test_loss: 1.1359, test_f1: 0.3774
 epoch: 58, train_loss: 1.0673, test_loss: 1.1351, test_f1: 0.3856
 epoch: 59, train_loss: 1.0713, test_loss: 1.1331, test_f1: 0.4123
 epoch: 60, train_loss: 1.0623, test_loss: 1.1298, test_f1: 0.4179
 epoch: 61, train_loss: 1.0650, test_loss: 1.1300, test_f1: 0.4181
 epoch: 62, train_loss: 1.0634, test_loss: 1.1297, test_f1: 0.3842
 epoch: 63, train_loss: 1.0632, test_loss: 1.1274, test_f1: 0.4143
 epoch: 64, train_loss: 1.0599, test_loss: 1.1297, test_f1: 0.4214
 epoch: 65, train_loss: 1.0601, test_loss: 1.1303, test_f1: 0.4271
 epoch: 66, train_loss: 1.0532, test_loss: 1.1274, test_f1: 0.4299
 epoch: 67, train_loss: 1.0594, test_loss: 1.1249, test_f1: 0.4256
 epoch: 68, train_loss: 1.0535, test_loss: 1.1226, test_f1: 0.4342
 epoch: 69, train_loss: 1.0515, test_loss: 1.1224, test_f1: 0.4117
 epoch: 70, train_loss: 1.0485, test_loss: 1.1224, test_f1: 0.4294
 epoch: 71, train_loss: 1.0526, test_loss: 1.1200, test_f1: 0.4183
 epoch: 72, train_loss: 1.0535, test_loss: 1.1176, test_f1: 0.4420
 epoch: 73, train_loss: 1.0509, test_loss: 1.1175, test_f1: 0.4515
 epoch: 74, train_loss: 1.0435, test_loss: 1.1158, test_f1: 0.4521
 epoch: 75, train_loss: 1.0433, test_loss: 1.1138, test_f1: 0.4569
 epoch: 76, train_loss: 1.0428, test_loss: 1.1120, test_f1: 0.4608
 epoch: 77, train_loss: 1.0383, test_loss: 1.1103, test_f1: 0.4632
 epoch: 78, train_loss: 1.0394, test_loss: 1.1112, test_f1: 0.4663
 epoch: 79, train_loss: 1.0398, test_loss: 1.1109, test_f1: 0.4818
 epoch: 80, train_loss: 1.0382, test_loss: 1.1098, test_f1: 0.4790
 epoch: 81, train_loss: 1.0312, test_loss: 1.1043, test_f1: 0.4822
 epoch: 82, train_loss: 1.0350, test_loss: 1.1024, test_f1: 0.4868
 epoch: 83, train_loss: 1.0291, test_loss: 1.1003, test_f1: 0.4873
 epoch: 84, train_loss: 1.0302, test_loss: 1.1005, test_f1: 0.4897
 epoch: 85, train_loss: 1.0303, test_loss: 1.0982, test_f1: 0.4944
 epoch: 86, train_loss: 1.0261, test_loss: 1.0986, test_f1: 0.4829
 epoch: 87, train_loss: 1.0239, test_loss: 1.0996, test_f1: 0.4893
 epoch: 88, train_loss: 1.0234, test_loss: 1.0999, test_f1: 0.4944
 epoch: 89, train_loss: 1.0265, test_loss: 1.0969, test_f1: 0.4941
 epoch: 90, train_loss: 1.0270, test_loss: 1.0946, test_f1: 0.4899
 epoch: 91, train_loss: 1.0255, test_loss: 1.0910, test_f1: 0.4879
 epoch: 92, train_loss: 1.0185, test_loss: 1.0883, test_f1: 0.4861
 epoch: 93, train_loss: 1.0127, test_loss: 1.0874, test_f1: 0.4811
 epoch: 94, train_loss: 1.0177, test_loss: 1.0867, test_f1: 0.4958
 epoch: 95, train_loss: 1.0230, test_loss: 1.0866, test_f1: 0.5065
 epoch: 96, train_loss: 1.0108, test_loss: 1.0866, test_f1: 0.5110
 epoch: 97, train_loss: 1.0164, test_loss: 1.0890, test_f1: 0.5103
 epoch: 98, train_loss: 1.0171, test_loss: 1.0894, test_f1: 0.4902
 epoch: 99, train_loss: 1.0051, test_loss: 1.0870, test_f1: 0.4909
##################ITERATION #1 ****************************************
 epoch: 0, train_loss: 1.3439, test_loss: 1.3762, test_f1: 0.1365
 epoch: 1, train_loss: 1.3268, test_loss: 1.3761, test_f1: 0.1365
 epoch: 2, train_loss: 1.3155, test_loss: 1.3741, test_f1: 0.1365
 epoch: 3, train_loss: 1.3052, test_loss: 1.3714, test_f1: 0.1365
 epoch: 4, train_loss: 1.2944, test_loss: 1.3636, test_f1: 0.1365
 epoch: 5, train_loss: 1.2842, test_loss: 1.3490, test_f1: 0.1365
 epoch: 6, train_loss: 1.2724, test_loss: 1.3347, test_f1: 0.1365
 epoch: 7, train_loss: 1.2609, test_loss: 1.3253, test_f1: 0.1365
 epoch: 8, train_loss: 1.2499, test_loss: 1.3075, test_f1: 0.1655
 epoch: 9, train_loss: 1.2366, test_loss: 1.2891, test_f1: 0.2329
 epoch: 10, train_loss: 1.2240, test_loss: 1.2748, test_f1: 0.3095
 epoch: 11, train_loss: 1.2155, test_loss: 1.2625, test_f1: 0.3105
 epoch: 12, train_loss: 1.2039, test_loss: 1.2487, test_f1: 0.3212
 epoch: 13, train_loss: 1.1924, test_loss: 1.2341, test_f1: 0.3451
 epoch: 14, train_loss: 1.1872, test_loss: 1.2260, test_f1: 0.3621
 epoch: 15, train_loss: 1.1780, test_loss: 1.2188, test_f1: 0.3773
 epoch: 16, train_loss: 1.1699, test_loss: 1.2118, test_f1: 0.3556
 epoch: 17, train_loss: 1.1611, test_loss: 1.2075, test_f1: 0.3478
 epoch: 18, train_loss: 1.1548, test_loss: 1.2033, test_f1: 0.3229
 epoch: 19, train_loss: 1.1485, test_loss: 1.2012, test_f1: 0.3295
 epoch: 20, train_loss: 1.1443, test_loss: 1.1965, test_f1: 0.3320
 epoch: 21, train_loss: 1.1346, test_loss: 1.1931, test_f1: 0.3338
 epoch: 22, train_loss: 1.1397, test_loss: 1.1880, test_f1: 0.3292
 epoch: 23, train_loss: 1.1284, test_loss: 1.1839, test_f1: 0.3365
 epoch: 24, train_loss: 1.1242, test_loss: 1.1824, test_f1: 0.3365
 epoch: 25, train_loss: 1.1214, test_loss: 1.1801, test_f1: 0.3334
 epoch: 26, train_loss: 1.1158, test_loss: 1.1808, test_f1: 0.3400
 epoch: 27, train_loss: 1.1111, test_loss: 1.1825, test_f1: 0.3453
 epoch: 28, train_loss: 1.1133, test_loss: 1.1835, test_f1: 0.3555
 epoch: 29, train_loss: 1.1092, test_loss: 1.1837, test_f1: 0.3718
 epoch: 30, train_loss: 1.1076, test_loss: 1.1755, test_f1: 0.3613
 epoch: 31, train_loss: 1.1022, test_loss: 1.1762, test_f1: 0.3563
 epoch: 32, train_loss: 1.0996, test_loss: 1.1755, test_f1: 0.3503
 epoch: 33, train_loss: 1.0952, test_loss: 1.1719, test_f1: 0.3546
 epoch: 34, train_loss: 1.0905, test_loss: 1.1685, test_f1: 0.3741
 epoch: 35, train_loss: 1.0880, test_loss: 1.1649, test_f1: 0.3742
 epoch: 36, train_loss: 1.0889, test_loss: 1.1643, test_f1: 0.3666
 epoch: 37, train_loss: 1.0786, test_loss: 1.1648, test_f1: 0.3740
 epoch: 38, train_loss: 1.0790, test_loss: 1.1690, test_f1: 0.3702
 epoch: 39, train_loss: 1.0720, test_loss: 1.1614, test_f1: 0.3807
 epoch: 40, train_loss: 1.0736, test_loss: 1.1555, test_f1: 0.3840
 epoch: 41, train_loss: 1.0694, test_loss: 1.1506, test_f1: 0.3714
 epoch: 42, train_loss: 1.0710, test_loss: 1.1541, test_f1: 0.3877
 epoch: 43, train_loss: 1.0629, test_loss: 1.1497, test_f1: 0.3914
 epoch: 44, train_loss: 1.0570, test_loss: 1.1451, test_f1: 0.3906
 epoch: 45, train_loss: 1.0564, test_loss: 1.1518, test_f1: 0.4123
 epoch: 46, train_loss: 1.0495, test_loss: 1.1429, test_f1: 0.4290
 epoch: 47, train_loss: 1.0451, test_loss: 1.1383, test_f1: 0.4538
 epoch: 48, train_loss: 1.0486, test_loss: 1.1443, test_f1: 0.4493
 epoch: 49, train_loss: 1.0432, test_loss: 1.1335, test_f1: 0.4573
 epoch: 50, train_loss: 1.0450, test_loss: 1.1371, test_f1: 0.4704
 epoch: 51, train_loss: 1.0372, test_loss: 1.1366, test_f1: 0.4666
 epoch: 52, train_loss: 1.0336, test_loss: 1.1396, test_f1: 0.4501
 epoch: 53, train_loss: 1.0388, test_loss: 1.1360, test_f1: 0.4621
 epoch: 54, train_loss: 1.0335, test_loss: 1.1330, test_f1: 0.4726
 epoch: 55, train_loss: 1.0249, test_loss: 1.1352, test_f1: 0.4726
 epoch: 56, train_loss: 1.0289, test_loss: 1.1352, test_f1: 0.4736
 epoch: 57, train_loss: 1.0295, test_loss: 1.1453, test_f1: 0.4751
 epoch: 58, train_loss: 1.0301, test_loss: 1.1526, test_f1: 0.4681
 epoch: 59, train_loss: 1.0268, test_loss: 1.1338, test_f1: 0.4693
 epoch: 60, train_loss: 1.0242, test_loss: 1.1433, test_f1: 0.4759
 epoch: 61, train_loss: 1.0246, test_loss: 1.1413, test_f1: 0.4839
 epoch: 62, train_loss: 1.0190, test_loss: 1.1525, test_f1: 0.4884
 epoch: 63, train_loss: 1.0199, test_loss: 1.1432, test_f1: 0.4837
 epoch: 64, train_loss: 1.0242, test_loss: 1.1351, test_f1: 0.4860
 epoch: 65, train_loss: 1.0170, test_loss: 1.1356, test_f1: 0.4978
 epoch: 66, train_loss: 1.0191, test_loss: 1.1274, test_f1: 0.4974
 epoch: 67, train_loss: 1.0087, test_loss: 1.1293, test_f1: 0.4930
 epoch: 68, train_loss: 1.0112, test_loss: 1.1358, test_f1: 0.4927
 epoch: 69, train_loss: 1.0087, test_loss: 1.1391, test_f1: 0.4861
 epoch: 70, train_loss: 1.0069, test_loss: 1.1358, test_f1: 0.4994
 epoch: 71, train_loss: 1.0024, test_loss: 1.1279, test_f1: 0.4949
 epoch: 72, train_loss: 1.0023, test_loss: 1.1293, test_f1: 0.4919
 epoch: 73, train_loss: 1.0062, test_loss: 1.1346, test_f1: 0.4800
 epoch: 74, train_loss: 1.0053, test_loss: 1.1166, test_f1: 0.4951
 epoch: 75, train_loss: 0.9995, test_loss: 1.1245, test_f1: 0.5001
 epoch: 76, train_loss: 0.9994, test_loss: 1.1307, test_f1: 0.4933
 epoch: 77, train_loss: 0.9963, test_loss: 1.1391, test_f1: 0.5027
 epoch: 78, train_loss: 0.9950, test_loss: 1.1255, test_f1: 0.5001
 epoch: 79, train_loss: 0.9873, test_loss: 1.1320, test_f1: 0.4952
 epoch: 80, train_loss: 0.9866, test_loss: 1.1299, test_f1: 0.5017
 epoch: 81, train_loss: 0.9879, test_loss: 1.1231, test_f1: 0.5087
 epoch: 82, train_loss: 0.9918, test_loss: 1.1218, test_f1: 0.5022
 epoch: 83, train_loss: 0.9904, test_loss: 1.1198, test_f1: 0.5036
 epoch: 84, train_loss: 0.9807, test_loss: 1.1193, test_f1: 0.5127
 epoch: 85, train_loss: 0.9880, test_loss: 1.1016, test_f1: 0.5163
 epoch: 86, train_loss: 0.9812, test_loss: 1.1060, test_f1: 0.5082
 epoch: 87, train_loss: 0.9797, test_loss: 1.1149, test_f1: 0.5116
 epoch: 88, train_loss: 0.9805, test_loss: 1.1242, test_f1: 0.5203
 epoch: 89, train_loss: 0.9834, test_loss: 1.1165, test_f1: 0.5174
 epoch: 90, train_loss: 0.9789, test_loss: 1.1196, test_f1: 0.5174
 epoch: 91, train_loss: 0.9736, test_loss: 1.1202, test_f1: 0.5143
 epoch: 92, train_loss: 0.9701, test_loss: 1.1179, test_f1: 0.5202
 epoch: 93, train_loss: 0.9698, test_loss: 1.1099, test_f1: 0.5246
 epoch: 94, train_loss: 0.9721, test_loss: 1.1319, test_f1: 0.5200
 epoch: 95, train_loss: 0.9675, test_loss: 1.1146, test_f1: 0.5200
 epoch: 96, train_loss: 0.9634, test_loss: 1.1112, test_f1: 0.5182
 epoch: 97, train_loss: 0.9633, test_loss: 1.0996, test_f1: 0.5206
 epoch: 98, train_loss: 0.9718, test_loss: 1.0977, test_f1: 0.5184
 epoch: 99, train_loss: 0.9638, test_loss: 1.0976, test_f1: 0.5157
##################ITERATION #2 ****************************************
 epoch: 0, train_loss: 1.3110, test_loss: 1.3618, test_f1: 0.1365
 epoch: 1, train_loss: 1.2848, test_loss: 1.3577, test_f1: 0.1365
 epoch: 2, train_loss: 1.2705, test_loss: 1.3565, test_f1: 0.1365
 epoch: 3, train_loss: 1.2577, test_loss: 1.3563, test_f1: 0.1365
 epoch: 4, train_loss: 1.2448, test_loss: 1.3502, test_f1: 0.1365
 epoch: 5, train_loss: 1.2296, test_loss: 1.3419, test_f1: 0.1494
 epoch: 6, train_loss: 1.2210, test_loss: 1.3346, test_f1: 0.2402
 epoch: 7, train_loss: 1.2073, test_loss: 1.3263, test_f1: 0.2604
 epoch: 8, train_loss: 1.2011, test_loss: 1.3162, test_f1: 0.2966
 epoch: 9, train_loss: 1.1965, test_loss: 1.3028, test_f1: 0.3196
 epoch: 10, train_loss: 1.1842, test_loss: 1.2878, test_f1: 0.3330
 epoch: 11, train_loss: 1.1791, test_loss: 1.2719, test_f1: 0.3518
 epoch: 12, train_loss: 1.1661, test_loss: 1.2563, test_f1: 0.3352
 epoch: 13, train_loss: 1.1599, test_loss: 1.2428, test_f1: 0.3250
 epoch: 14, train_loss: 1.1556, test_loss: 1.2269, test_f1: 0.2945
 epoch: 15, train_loss: 1.1486, test_loss: 1.2151, test_f1: 0.2879
 epoch: 16, train_loss: 1.1420, test_loss: 1.2076, test_f1: 0.2774
 epoch: 17, train_loss: 1.1377, test_loss: 1.2007, test_f1: 0.2722
 epoch: 18, train_loss: 1.1325, test_loss: 1.1957, test_f1: 0.2802
 epoch: 19, train_loss: 1.1233, test_loss: 1.1910, test_f1: 0.2885
 epoch: 20, train_loss: 1.1214, test_loss: 1.1867, test_f1: 0.2802
 epoch: 21, train_loss: 1.1151, test_loss: 1.1840, test_f1: 0.3002
 epoch: 22, train_loss: 1.1177, test_loss: 1.1801, test_f1: 0.2939
 epoch: 23, train_loss: 1.1050, test_loss: 1.1734, test_f1: 0.2628
 epoch: 24, train_loss: 1.1016, test_loss: 1.1708, test_f1: 0.2694
 epoch: 25, train_loss: 1.0970, test_loss: 1.1662, test_f1: 0.3083
 epoch: 26, train_loss: 1.0917, test_loss: 1.1647, test_f1: 0.3220
 epoch: 27, train_loss: 1.0851, test_loss: 1.1642, test_f1: 0.3113
 epoch: 28, train_loss: 1.0838, test_loss: 1.1618, test_f1: 0.3234
 epoch: 29, train_loss: 1.0801, test_loss: 1.1538, test_f1: 0.3356
 epoch: 30, train_loss: 1.0792, test_loss: 1.1492, test_f1: 0.3656
 epoch: 31, train_loss: 1.0774, test_loss: 1.1473, test_f1: 0.3628
 epoch: 32, train_loss: 1.0726, test_loss: 1.1494, test_f1: 0.3910
 epoch: 33, train_loss: 1.0639, test_loss: 1.1434, test_f1: 0.3987
 epoch: 34, train_loss: 1.0687, test_loss: 1.1464, test_f1: 0.4131
 epoch: 35, train_loss: 1.0577, test_loss: 1.1401, test_f1: 0.4174
 epoch: 36, train_loss: 1.0533, test_loss: 1.1432, test_f1: 0.4162
 epoch: 37, train_loss: 1.0492, test_loss: 1.1458, test_f1: 0.4222
 epoch: 38, train_loss: 1.0510, test_loss: 1.1424, test_f1: 0.4246
 epoch: 39, train_loss: 1.0429, test_loss: 1.1360, test_f1: 0.4270
 epoch: 40, train_loss: 1.0420, test_loss: 1.1234, test_f1: 0.4257
 epoch: 41, train_loss: 1.0335, test_loss: 1.1261, test_f1: 0.4388
 epoch: 42, train_loss: 1.0327, test_loss: 1.1223, test_f1: 0.4520
 epoch: 43, train_loss: 1.0260, test_loss: 1.1188, test_f1: 0.4552
 epoch: 44, train_loss: 1.0194, test_loss: 1.1182, test_f1: 0.4543
 epoch: 45, train_loss: 1.0227, test_loss: 1.1188, test_f1: 0.4488
 epoch: 46, train_loss: 1.0151, test_loss: 1.1203, test_f1: 0.4463
 epoch: 47, train_loss: 1.0129, test_loss: 1.1140, test_f1: 0.4666
 epoch: 48, train_loss: 1.0095, test_loss: 1.1127, test_f1: 0.4667
 epoch: 49, train_loss: 0.9957, test_loss: 1.1172, test_f1: 0.4835
 epoch: 50, train_loss: 1.0038, test_loss: 1.1075, test_f1: 0.4850
 epoch: 51, train_loss: 0.9974, test_loss: 1.1018, test_f1: 0.5003
 epoch: 52, train_loss: 0.9940, test_loss: 1.1017, test_f1: 0.4925
 epoch: 53, train_loss: 0.9903, test_loss: 1.0992, test_f1: 0.4906
 epoch: 54, train_loss: 0.9908, test_loss: 1.1033, test_f1: 0.5056
 epoch: 55, train_loss: 0.9879, test_loss: 1.0979, test_f1: 0.5061
 epoch: 56, train_loss: 0.9892, test_loss: 1.1017, test_f1: 0.5022
 epoch: 57, train_loss: 0.9776, test_loss: 1.1119, test_f1: 0.5017
 epoch: 58, train_loss: 0.9772, test_loss: 1.1093, test_f1: 0.4999
 epoch: 59, train_loss: 0.9747, test_loss: 1.1018, test_f1: 0.4990
 epoch: 60, train_loss: 0.9791, test_loss: 1.0897, test_f1: 0.5092
 epoch: 61, train_loss: 0.9712, test_loss: 1.0946, test_f1: 0.5051
 epoch: 62, train_loss: 0.9714, test_loss: 1.0951, test_f1: 0.5065
 epoch: 63, train_loss: 0.9644, test_loss: 1.0977, test_f1: 0.5186
 epoch: 64, train_loss: 0.9716, test_loss: 1.1007, test_f1: 0.5064
 epoch: 65, train_loss: 0.9664, test_loss: 1.0955, test_f1: 0.5050
 epoch: 66, train_loss: 0.9646, test_loss: 1.0866, test_f1: 0.5041
 epoch: 67, train_loss: 0.9684, test_loss: 1.0860, test_f1: 0.5156
 epoch: 68, train_loss: 0.9656, test_loss: 1.0920, test_f1: 0.5185
 epoch: 69, train_loss: 0.9599, test_loss: 1.0859, test_f1: 0.5254
 epoch: 70, train_loss: 0.9566, test_loss: 1.0852, test_f1: 0.5180
 epoch: 71, train_loss: 0.9535, test_loss: 1.0860, test_f1: 0.5142
 epoch: 72, train_loss: 0.9511, test_loss: 1.0890, test_f1: 0.5122
 epoch: 73, train_loss: 0.9509, test_loss: 1.0960, test_f1: 0.5249
 epoch: 74, train_loss: 0.9509, test_loss: 1.0957, test_f1: 0.5155
 epoch: 75, train_loss: 0.9442, test_loss: 1.1041, test_f1: 0.5215
 epoch: 76, train_loss: 0.9530, test_loss: 1.0957, test_f1: 0.5238
 epoch: 77, train_loss: 0.9431, test_loss: 1.0805, test_f1: 0.5172
 epoch: 78, train_loss: 0.9457, test_loss: 1.0817, test_f1: 0.5094
 epoch: 79, train_loss: 0.9388, test_loss: 1.0817, test_f1: 0.5168
 epoch: 80, train_loss: 0.9373, test_loss: 1.0787, test_f1: 0.5228
 epoch: 81, train_loss: 0.9307, test_loss: 1.0912, test_f1: 0.5304
 epoch: 82, train_loss: 0.9337, test_loss: 1.0913, test_f1: 0.5188
 epoch: 83, train_loss: 0.9374, test_loss: 1.0986, test_f1: 0.5172
 epoch: 84, train_loss: 0.9334, test_loss: 1.0962, test_f1: 0.5235
 epoch: 85, train_loss: 0.9314, test_loss: 1.0951, test_f1: 0.5274
 epoch: 86, train_loss: 0.9302, test_loss: 1.0942, test_f1: 0.5280
 epoch: 87, train_loss: 0.9284, test_loss: 1.1032, test_f1: 0.5236
 epoch: 88, train_loss: 0.9240, test_loss: 1.1037, test_f1: 0.5206
 epoch: 89, train_loss: 0.9267, test_loss: 1.1040, test_f1: 0.5173
 epoch: 90, train_loss: 0.9254, test_loss: 1.0984, test_f1: 0.5150
 epoch: 91, train_loss: 0.9143, test_loss: 1.0974, test_f1: 0.5200
 epoch: 92, train_loss: 0.9231, test_loss: 1.0985, test_f1: 0.5256
 epoch: 93, train_loss: 0.9110, test_loss: 1.0991, test_f1: 0.5244
 epoch: 94, train_loss: 0.9190, test_loss: 1.1034, test_f1: 0.5319
 epoch: 95, train_loss: 0.9124, test_loss: 1.1079, test_f1: 0.5368
 epoch: 96, train_loss: 0.9076, test_loss: 1.1060, test_f1: 0.5337
 epoch: 97, train_loss: 0.9089, test_loss: 1.1030, test_f1: 0.5433
 epoch: 98, train_loss: 0.9077, test_loss: 1.1043, test_f1: 0.5350
 epoch: 99, train_loss: 0.9049, test_loss: 1.1020, test_f1: 0.5312
##################ITERATION #3 ****************************************
 epoch: 0, train_loss: 1.2772, test_loss: 1.3578, test_f1: 0.2281
 epoch: 1, train_loss: 1.2364, test_loss: 1.3525, test_f1: 0.2281
 epoch: 2, train_loss: 1.2237, test_loss: 1.3497, test_f1: 0.2281
 epoch: 3, train_loss: 1.2058, test_loss: 1.3476, test_f1: 0.2281
 epoch: 4, train_loss: 1.1942, test_loss: 1.3442, test_f1: 0.2281
 epoch: 5, train_loss: 1.1880, test_loss: 1.3352, test_f1: 0.2281
 epoch: 6, train_loss: 1.1798, test_loss: 1.3197, test_f1: 0.2281
 epoch: 7, train_loss: 1.1726, test_loss: 1.2925, test_f1: 0.2281
 epoch: 8, train_loss: 1.1627, test_loss: 1.2580, test_f1: 0.2253
 epoch: 9, train_loss: 1.1501, test_loss: 1.2328, test_f1: 0.2253
 epoch: 10, train_loss: 1.1459, test_loss: 1.2171, test_f1: 0.2315
 epoch: 11, train_loss: 1.1435, test_loss: 1.2045, test_f1: 0.2319
 epoch: 12, train_loss: 1.1344, test_loss: 1.1976, test_f1: 0.2332
 epoch: 13, train_loss: 1.1333, test_loss: 1.1915, test_f1: 0.2376
 epoch: 14, train_loss: 1.1225, test_loss: 1.1876, test_f1: 0.2427
 epoch: 15, train_loss: 1.1242, test_loss: 1.1822, test_f1: 0.2521
 epoch: 16, train_loss: 1.1187, test_loss: 1.1784, test_f1: 0.2501
 epoch: 17, train_loss: 1.1116, test_loss: 1.1737, test_f1: 0.2529
 epoch: 18, train_loss: 1.1084, test_loss: 1.1702, test_f1: 0.2997
 epoch: 19, train_loss: 1.1050, test_loss: 1.1671, test_f1: 0.3005
 epoch: 20, train_loss: 1.1053, test_loss: 1.1658, test_f1: 0.3363
 epoch: 21, train_loss: 1.0942, test_loss: 1.1607, test_f1: 0.3404
 epoch: 22, train_loss: 1.0989, test_loss: 1.1557, test_f1: 0.3651
 epoch: 23, train_loss: 1.0851, test_loss: 1.1515, test_f1: 0.3658
 epoch: 24, train_loss: 1.0801, test_loss: 1.1484, test_f1: 0.3733
 epoch: 25, train_loss: 1.0828, test_loss: 1.1469, test_f1: 0.3793
 epoch: 26, train_loss: 1.0711, test_loss: 1.1460, test_f1: 0.3941
 epoch: 27, train_loss: 1.0650, test_loss: 1.1418, test_f1: 0.4038
 epoch: 28, train_loss: 1.0698, test_loss: 1.1481, test_f1: 0.3974
 epoch: 29, train_loss: 1.0648, test_loss: 1.1416, test_f1: 0.4283
 epoch: 30, train_loss: 1.0603, test_loss: 1.1353, test_f1: 0.4272
 epoch: 31, train_loss: 1.0518, test_loss: 1.1370, test_f1: 0.4484
 epoch: 32, train_loss: 1.0500, test_loss: 1.1375, test_f1: 0.4447
 epoch: 33, train_loss: 1.0484, test_loss: 1.1369, test_f1: 0.4394
 epoch: 34, train_loss: 1.0436, test_loss: 1.1223, test_f1: 0.4523
 epoch: 35, train_loss: 1.0409, test_loss: 1.1191, test_f1: 0.4480
 epoch: 36, train_loss: 1.0265, test_loss: 1.1198, test_f1: 0.4525
 epoch: 37, train_loss: 1.0370, test_loss: 1.1200, test_f1: 0.4525
 epoch: 38, train_loss: 1.0295, test_loss: 1.1190, test_f1: 0.4546
 epoch: 39, train_loss: 1.0238, test_loss: 1.1203, test_f1: 0.4511
 epoch: 40, train_loss: 1.0191, test_loss: 1.1272, test_f1: 0.4574
 epoch: 41, train_loss: 1.0251, test_loss: 1.1205, test_f1: 0.4624
 epoch: 42, train_loss: 1.0179, test_loss: 1.1080, test_f1: 0.4629
 epoch: 43, train_loss: 1.0119, test_loss: 1.1061, test_f1: 0.4720
 epoch: 44, train_loss: 1.0091, test_loss: 1.1046, test_f1: 0.4672
 epoch: 45, train_loss: 1.0057, test_loss: 1.1099, test_f1: 0.4767
 epoch: 46, train_loss: 0.9986, test_loss: 1.1056, test_f1: 0.4883
 epoch: 47, train_loss: 0.9916, test_loss: 1.1037, test_f1: 0.4837
 epoch: 48, train_loss: 0.9894, test_loss: 1.0945, test_f1: 0.4912
 epoch: 49, train_loss: 0.9893, test_loss: 1.0863, test_f1: 0.4914
 epoch: 50, train_loss: 0.9856, test_loss: 1.0808, test_f1: 0.4981
 epoch: 51, train_loss: 0.9792, test_loss: 1.0859, test_f1: 0.4979
 epoch: 52, train_loss: 0.9781, test_loss: 1.0924, test_f1: 0.5001
 epoch: 53, train_loss: 0.9711, test_loss: 1.0830, test_f1: 0.4982
 epoch: 54, train_loss: 0.9754, test_loss: 1.0806, test_f1: 0.5038
 epoch: 55, train_loss: 0.9669, test_loss: 1.0829, test_f1: 0.5088
 epoch: 56, train_loss: 0.9650, test_loss: 1.0774, test_f1: 0.5154
 epoch: 57, train_loss: 0.9690, test_loss: 1.0758, test_f1: 0.5111
 epoch: 58, train_loss: 0.9672, test_loss: 1.0793, test_f1: 0.5188
 epoch: 59, train_loss: 0.9611, test_loss: 1.0798, test_f1: 0.5047
 epoch: 60, train_loss: 0.9621, test_loss: 1.0836, test_f1: 0.5217
 epoch: 61, train_loss: 0.9602, test_loss: 1.0907, test_f1: 0.5246
 epoch: 62, train_loss: 0.9550, test_loss: 1.0847, test_f1: 0.5323
 epoch: 63, train_loss: 0.9510, test_loss: 1.0803, test_f1: 0.5344
 epoch: 64, train_loss: 0.9616, test_loss: 1.0723, test_f1: 0.5369
 epoch: 65, train_loss: 0.9502, test_loss: 1.0667, test_f1: 0.5329
 epoch: 66, train_loss: 0.9524, test_loss: 1.0713, test_f1: 0.5219
 epoch: 67, train_loss: 0.9508, test_loss: 1.0761, test_f1: 0.5285
 epoch: 68, train_loss: 0.9432, test_loss: 1.0707, test_f1: 0.5442
 epoch: 69, train_loss: 0.9427, test_loss: 1.0615, test_f1: 0.5455
 epoch: 70, train_loss: 0.9531, test_loss: 1.0524, test_f1: 0.5287
 epoch: 71, train_loss: 0.9451, test_loss: 1.0554, test_f1: 0.5279
 epoch: 72, train_loss: 0.9433, test_loss: 1.0622, test_f1: 0.5269
 epoch: 73, train_loss: 0.9381, test_loss: 1.0715, test_f1: 0.5296
 epoch: 74, train_loss: 0.9367, test_loss: 1.0648, test_f1: 0.5272
 epoch: 75, train_loss: 0.9253, test_loss: 1.0680, test_f1: 0.5227
 epoch: 76, train_loss: 0.9321, test_loss: 1.0691, test_f1: 0.5202
 epoch: 77, train_loss: 0.9299, test_loss: 1.0604, test_f1: 0.5160
 epoch: 78, train_loss: 0.9230, test_loss: 1.0628, test_f1: 0.5159
 epoch: 79, train_loss: 0.9205, test_loss: 1.0658, test_f1: 0.5154
 epoch: 80, train_loss: 0.9187, test_loss: 1.0884, test_f1: 0.5193
 epoch: 81, train_loss: 0.9199, test_loss: 1.0795, test_f1: 0.5272
 epoch: 82, train_loss: 0.9213, test_loss: 1.0637, test_f1: 0.5265
 epoch: 83, train_loss: 0.9309, test_loss: 1.0620, test_f1: 0.5246
 epoch: 84, train_loss: 0.9264, test_loss: 1.0586, test_f1: 0.5307
 epoch: 85, train_loss: 0.9136, test_loss: 1.0713, test_f1: 0.5254
 epoch: 86, train_loss: 0.9058, test_loss: 1.0653, test_f1: 0.5339
 epoch: 87, train_loss: 0.9182, test_loss: 1.0594, test_f1: 0.5414
 epoch: 88, train_loss: 0.9261, test_loss: 1.0407, test_f1: 0.5512
 epoch: 89, train_loss: 0.9188, test_loss: 1.0530, test_f1: 0.5465
 epoch: 90, train_loss: 0.9114, test_loss: 1.0457, test_f1: 0.5278
 epoch: 91, train_loss: 0.9102, test_loss: 1.0479, test_f1: 0.5284
 epoch: 92, train_loss: 0.8974, test_loss: 1.0519, test_f1: 0.5295
 epoch: 93, train_loss: 0.9038, test_loss: 1.0597, test_f1: 0.5297
 epoch: 94, train_loss: 0.9055, test_loss: 1.0625, test_f1: 0.5229
 epoch: 95, train_loss: 0.8959, test_loss: 1.0504, test_f1: 0.5335
 epoch: 96, train_loss: 0.9008, test_loss: 1.0474, test_f1: 0.5295
 epoch: 97, train_loss: 0.8936, test_loss: 1.0435, test_f1: 0.5273
 epoch: 98, train_loss: 0.8966, test_loss: 1.0398, test_f1: 0.5320
 epoch: 99, train_loss: 0.9005, test_loss: 1.0460, test_f1: 0.5363
##################ITERATION #4 ****************************************
 epoch: 0, train_loss: 1.2824, test_loss: 1.3486, test_f1: 0.2281
 epoch: 1, train_loss: 1.2414, test_loss: 1.3433, test_f1: 0.2686
 epoch: 2, train_loss: 1.2267, test_loss: 1.3356, test_f1: 0.2064
 epoch: 3, train_loss: 1.2134, test_loss: 1.3230, test_f1: 0.2816
 epoch: 4, train_loss: 1.1962, test_loss: 1.3177, test_f1: 0.3045
 epoch: 5, train_loss: 1.1846, test_loss: 1.3126, test_f1: 0.2602
 epoch: 6, train_loss: 1.1751, test_loss: 1.3077, test_f1: 0.2754
 epoch: 7, train_loss: 1.1656, test_loss: 1.2960, test_f1: 0.2721
 epoch: 8, train_loss: 1.1523, test_loss: 1.2677, test_f1: 0.2706
 epoch: 9, train_loss: 1.1461, test_loss: 1.2405, test_f1: 0.2825
 epoch: 10, train_loss: 1.1478, test_loss: 1.2220, test_f1: 0.3144
 epoch: 11, train_loss: 1.1348, test_loss: 1.2072, test_f1: 0.3413
 epoch: 12, train_loss: 1.1268, test_loss: 1.1931, test_f1: 0.3556
 epoch: 13, train_loss: 1.1169, test_loss: 1.1794, test_f1: 0.3689
 epoch: 14, train_loss: 1.1168, test_loss: 1.1726, test_f1: 0.3927
 epoch: 15, train_loss: 1.1109, test_loss: 1.1650, test_f1: 0.3989
 epoch: 16, train_loss: 1.1087, test_loss: 1.1623, test_f1: 0.4025
 epoch: 17, train_loss: 1.0960, test_loss: 1.1527, test_f1: 0.4183
 epoch: 18, train_loss: 1.0954, test_loss: 1.1477, test_f1: 0.4229
 epoch: 19, train_loss: 1.0906, test_loss: 1.1402, test_f1: 0.4345
 epoch: 20, train_loss: 1.0845, test_loss: 1.1345, test_f1: 0.4314
 epoch: 21, train_loss: 1.0787, test_loss: 1.1284, test_f1: 0.4524
 epoch: 22, train_loss: 1.0688, test_loss: 1.1264, test_f1: 0.4513
 epoch: 23, train_loss: 1.0652, test_loss: 1.1206, test_f1: 0.4609
 epoch: 24, train_loss: 1.0597, test_loss: 1.1213, test_f1: 0.4833
 epoch: 25, train_loss: 1.0617, test_loss: 1.1339, test_f1: 0.4650
 epoch: 26, train_loss: 1.0517, test_loss: 1.1217, test_f1: 0.4762
 epoch: 27, train_loss: 1.0450, test_loss: 1.1238, test_f1: 0.4674
 epoch: 28, train_loss: 1.0465, test_loss: 1.1201, test_f1: 0.4825
 epoch: 29, train_loss: 1.0391, test_loss: 1.1108, test_f1: 0.4785
 epoch: 30, train_loss: 1.0331, test_loss: 1.1027, test_f1: 0.4978
 epoch: 31, train_loss: 1.0318, test_loss: 1.0953, test_f1: 0.5060
 epoch: 32, train_loss: 1.0258, test_loss: 1.0942, test_f1: 0.5246
 epoch: 33, train_loss: 1.0185, test_loss: 1.0986, test_f1: 0.5179
 epoch: 34, train_loss: 1.0172, test_loss: 1.0959, test_f1: 0.5161
 epoch: 35, train_loss: 1.0224, test_loss: 1.0921, test_f1: 0.5132
 epoch: 36, train_loss: 1.0132, test_loss: 1.0935, test_f1: 0.5069
 epoch: 37, train_loss: 1.0131, test_loss: 1.0860, test_f1: 0.5089
 epoch: 38, train_loss: 1.0052, test_loss: 1.0853, test_f1: 0.5046
 epoch: 39, train_loss: 1.0069, test_loss: 1.0771, test_f1: 0.4981
 epoch: 40, train_loss: 0.9891, test_loss: 1.0774, test_f1: 0.5057
 epoch: 41, train_loss: 1.0001, test_loss: 1.0817, test_f1: 0.4882
 epoch: 42, train_loss: 0.9917, test_loss: 1.0811, test_f1: 0.4961
 epoch: 43, train_loss: 0.9908, test_loss: 1.0848, test_f1: 0.5052
 epoch: 44, train_loss: 0.9846, test_loss: 1.0916, test_f1: 0.5113
 epoch: 45, train_loss: 0.9905, test_loss: 1.0737, test_f1: 0.4816
 epoch: 46, train_loss: 0.9847, test_loss: 1.0635, test_f1: 0.5091
 epoch: 47, train_loss: 0.9812, test_loss: 1.0621, test_f1: 0.5073
 epoch: 48, train_loss: 0.9782, test_loss: 1.0894, test_f1: 0.5240
 epoch: 49, train_loss: 0.9687, test_loss: 1.0905, test_f1: 0.5235
 epoch: 50, train_loss: 0.9593, test_loss: 1.0731, test_f1: 0.5184
 epoch: 51, train_loss: 0.9629, test_loss: 1.0650, test_f1: 0.5185
 epoch: 52, train_loss: 0.9570, test_loss: 1.0632, test_f1: 0.5127
 epoch: 53, train_loss: 0.9539, test_loss: 1.0725, test_f1: 0.5053
 epoch: 54, train_loss: 0.9635, test_loss: 1.0672, test_f1: 0.5179
 epoch: 55, train_loss: 0.9483, test_loss: 1.0691, test_f1: 0.5140
 epoch: 56, train_loss: 0.9541, test_loss: 1.0669, test_f1: 0.5201
 epoch: 57, train_loss: 0.9488, test_loss: 1.0626, test_f1: 0.5207
 epoch: 58, train_loss: 0.9541, test_loss: 1.0617, test_f1: 0.5231
 epoch: 59, train_loss: 0.9578, test_loss: 1.0615, test_f1: 0.5164
 epoch: 60, train_loss: 0.9482, test_loss: 1.0608, test_f1: 0.5139
 epoch: 61, train_loss: 0.9476, test_loss: 1.0591, test_f1: 0.5083
 epoch: 62, train_loss: 0.9535, test_loss: 1.0537, test_f1: 0.5111
 epoch: 63, train_loss: 0.9431, test_loss: 1.0538, test_f1: 0.5077
 epoch: 64, train_loss: 0.9453, test_loss: 1.0638, test_f1: 0.4989
 epoch: 65, train_loss: 0.9425, test_loss: 1.0721, test_f1: 0.5074
 epoch: 66, train_loss: 0.9454, test_loss: 1.0763, test_f1: 0.5016
 epoch: 67, train_loss: 0.9419, test_loss: 1.0806, test_f1: 0.5078
 epoch: 68, train_loss: 0.9354, test_loss: 1.0737, test_f1: 0.5072
 epoch: 69, train_loss: 0.9358, test_loss: 1.0761, test_f1: 0.5130
 epoch: 70, train_loss: 0.9397, test_loss: 1.0759, test_f1: 0.5045
 epoch: 71, train_loss: 0.9388, test_loss: 1.0748, test_f1: 0.5038
 epoch: 72, train_loss: 0.9340, test_loss: 1.0770, test_f1: 0.5071
 epoch: 73, train_loss: 0.9262, test_loss: 1.0737, test_f1: 0.5111
 epoch: 74, train_loss: 0.9202, test_loss: 1.0633, test_f1: 0.5225
 epoch: 75, train_loss: 0.9277, test_loss: 1.0601, test_f1: 0.5174
 epoch: 76, train_loss: 0.9297, test_loss: 1.0568, test_f1: 0.5127
 epoch: 77, train_loss: 0.9240, test_loss: 1.0583, test_f1: 0.5121
 epoch: 78, train_loss: 0.9189, test_loss: 1.0742, test_f1: 0.5134
 epoch: 79, train_loss: 0.9230, test_loss: 1.0641, test_f1: 0.5063
 epoch: 80, train_loss: 0.9166, test_loss: 1.0677, test_f1: 0.5083
 epoch: 81, train_loss: 0.9249, test_loss: 1.0635, test_f1: 0.5159
 epoch: 82, train_loss: 0.9197, test_loss: 1.0630, test_f1: 0.5162
 epoch: 83, train_loss: 0.9202, test_loss: 1.0543, test_f1: 0.5144
 epoch: 84, train_loss: 0.9170, test_loss: 1.0694, test_f1: 0.5194
 epoch: 85, train_loss: 0.9110, test_loss: 1.0516, test_f1: 0.5168
 epoch: 86, train_loss: 0.9101, test_loss: 1.0567, test_f1: 0.5227
 epoch: 87, train_loss: 0.9003, test_loss: 1.0612, test_f1: 0.5244
 epoch: 88, train_loss: 0.9129, test_loss: 1.0589, test_f1: 0.5163
 epoch: 89, train_loss: 0.9120, test_loss: 1.0536, test_f1: 0.5231
 epoch: 90, train_loss: 0.9138, test_loss: 1.0533, test_f1: 0.5258
 epoch: 91, train_loss: 0.9095, test_loss: 1.0546, test_f1: 0.5276
 epoch: 92, train_loss: 0.9011, test_loss: 1.0533, test_f1: 0.5230
 epoch: 93, train_loss: 0.9024, test_loss: 1.0567, test_f1: 0.5235
 epoch: 94, train_loss: 0.8941, test_loss: 1.0649, test_f1: 0.5275
 epoch: 95, train_loss: 0.8983, test_loss: 1.0690, test_f1: 0.5203
 epoch: 96, train_loss: 0.8971, test_loss: 1.0585, test_f1: 0.5237
 epoch: 97, train_loss: 0.8993, test_loss: 1.0464, test_f1: 0.5205
 epoch: 98, train_loss: 0.8904, test_loss: 1.0535, test_f1: 0.5248
 epoch: 99, train_loss: 0.8992, test_loss: 1.0638, test_f1: 0.5172
##################ITERATION #5 ****************************************
 epoch: 0, train_loss: 1.2847, test_loss: 1.3517, test_f1: 0.2281
 epoch: 1, train_loss: 1.2408, test_loss: 1.3499, test_f1: 0.2281
 epoch: 2, train_loss: 1.2247, test_loss: 1.3465, test_f1: 0.2281
 epoch: 3, train_loss: 1.2130, test_loss: 1.3440, test_f1: 0.2281
 epoch: 4, train_loss: 1.1989, test_loss: 1.3388, test_f1: 0.2281
 epoch: 5, train_loss: 1.1910, test_loss: 1.3291, test_f1: 0.2281
 epoch: 6, train_loss: 1.1787, test_loss: 1.3180, test_f1: 0.2336
 epoch: 7, train_loss: 1.1701, test_loss: 1.2984, test_f1: 0.2441
 epoch: 8, train_loss: 1.1556, test_loss: 1.2734, test_f1: 0.2540
 epoch: 9, train_loss: 1.1519, test_loss: 1.2557, test_f1: 0.2585
 epoch: 10, train_loss: 1.1467, test_loss: 1.2354, test_f1: 0.2556
 epoch: 11, train_loss: 1.1342, test_loss: 1.2130, test_f1: 0.2890
 epoch: 12, train_loss: 1.1250, test_loss: 1.1999, test_f1: 0.3209
 epoch: 13, train_loss: 1.1231, test_loss: 1.1928, test_f1: 0.3420
 epoch: 14, train_loss: 1.1145, test_loss: 1.1863, test_f1: 0.3611
 epoch: 15, train_loss: 1.1069, test_loss: 1.1820, test_f1: 0.3842
 epoch: 16, train_loss: 1.1026, test_loss: 1.1723, test_f1: 0.3853
 epoch: 17, train_loss: 1.0948, test_loss: 1.1673, test_f1: 0.3915
 epoch: 18, train_loss: 1.0862, test_loss: 1.1637, test_f1: 0.4073
 epoch: 19, train_loss: 1.0863, test_loss: 1.1590, test_f1: 0.4145
 epoch: 20, train_loss: 1.0816, test_loss: 1.1551, test_f1: 0.4161
 epoch: 21, train_loss: 1.0737, test_loss: 1.1506, test_f1: 0.4195
 epoch: 22, train_loss: 1.0678, test_loss: 1.1448, test_f1: 0.4317
 epoch: 23, train_loss: 1.0613, test_loss: 1.1395, test_f1: 0.4314
 epoch: 24, train_loss: 1.0501, test_loss: 1.1368, test_f1: 0.4372
 epoch: 25, train_loss: 1.0477, test_loss: 1.1325, test_f1: 0.4406
 epoch: 26, train_loss: 1.0480, test_loss: 1.1281, test_f1: 0.4445
 epoch: 27, train_loss: 1.0407, test_loss: 1.1252, test_f1: 0.4365
 epoch: 28, train_loss: 1.0396, test_loss: 1.1209, test_f1: 0.4535
 epoch: 29, train_loss: 1.0326, test_loss: 1.1165, test_f1: 0.4584
 epoch: 30, train_loss: 1.0352, test_loss: 1.1121, test_f1: 0.4592
 epoch: 31, train_loss: 1.0246, test_loss: 1.1119, test_f1: 0.4515
 epoch: 32, train_loss: 1.0218, test_loss: 1.1076, test_f1: 0.4632
 epoch: 33, train_loss: 1.0174, test_loss: 1.1051, test_f1: 0.4651
 epoch: 34, train_loss: 1.0066, test_loss: 1.1037, test_f1: 0.4670
 epoch: 35, train_loss: 1.0124, test_loss: 1.1019, test_f1: 0.4806
 epoch: 36, train_loss: 0.9993, test_loss: 1.0997, test_f1: 0.4813
 epoch: 37, train_loss: 0.9916, test_loss: 1.0981, test_f1: 0.4851
 epoch: 38, train_loss: 0.9907, test_loss: 1.0961, test_f1: 0.4874
 epoch: 39, train_loss: 0.9905, test_loss: 1.0936, test_f1: 0.4955
 epoch: 40, train_loss: 0.9834, test_loss: 1.0957, test_f1: 0.4869
 epoch: 41, train_loss: 0.9780, test_loss: 1.0923, test_f1: 0.4954
 epoch: 42, train_loss: 0.9805, test_loss: 1.0894, test_f1: 0.4923
 epoch: 43, train_loss: 0.9882, test_loss: 1.0842, test_f1: 0.4947
 epoch: 44, train_loss: 0.9788, test_loss: 1.0818, test_f1: 0.4944
 epoch: 45, train_loss: 0.9667, test_loss: 1.0733, test_f1: 0.4943
 epoch: 46, train_loss: 0.9669, test_loss: 1.0706, test_f1: 0.5027
 epoch: 47, train_loss: 0.9671, test_loss: 1.0732, test_f1: 0.5058
 epoch: 48, train_loss: 0.9632, test_loss: 1.0721, test_f1: 0.5029
 epoch: 49, train_loss: 0.9522, test_loss: 1.0831, test_f1: 0.4883
 epoch: 50, train_loss: 0.9582, test_loss: 1.0733, test_f1: 0.4964
 epoch: 51, train_loss: 0.9524, test_loss: 1.0825, test_f1: 0.4962
 epoch: 52, train_loss: 0.9432, test_loss: 1.0816, test_f1: 0.5037
 epoch: 53, train_loss: 0.9480, test_loss: 1.0788, test_f1: 0.5075
 epoch: 54, train_loss: 0.9472, test_loss: 1.0729, test_f1: 0.5058
 epoch: 55, train_loss: 0.9436, test_loss: 1.0718, test_f1: 0.5206
 epoch: 56, train_loss: 0.9378, test_loss: 1.0729, test_f1: 0.5094
 epoch: 57, train_loss: 0.9341, test_loss: 1.0642, test_f1: 0.5180
 epoch: 58, train_loss: 0.9409, test_loss: 1.0710, test_f1: 0.5146
 epoch: 59, train_loss: 0.9294, test_loss: 1.0652, test_f1: 0.5091
 epoch: 60, train_loss: 0.9334, test_loss: 1.0656, test_f1: 0.5009
 epoch: 61, train_loss: 0.9334, test_loss: 1.0693, test_f1: 0.5233
 epoch: 62, train_loss: 0.9301, test_loss: 1.0659, test_f1: 0.5217
 epoch: 63, train_loss: 0.9313, test_loss: 1.0683, test_f1: 0.5228
 epoch: 64, train_loss: 0.9258, test_loss: 1.0654, test_f1: 0.5163
 epoch: 65, train_loss: 0.9286, test_loss: 1.0672, test_f1: 0.5158
 epoch: 66, train_loss: 0.9175, test_loss: 1.0662, test_f1: 0.5337
 epoch: 67, train_loss: 0.9245, test_loss: 1.0689, test_f1: 0.5261
 epoch: 68, train_loss: 0.9185, test_loss: 1.0703, test_f1: 0.5281
 epoch: 69, train_loss: 0.9176, test_loss: 1.0702, test_f1: 0.5290
 epoch: 70, train_loss: 0.9150, test_loss: 1.0653, test_f1: 0.5325
 epoch: 71, train_loss: 0.9147, test_loss: 1.0601, test_f1: 0.5341
 epoch: 72, train_loss: 0.9140, test_loss: 1.0668, test_f1: 0.5373
 epoch: 73, train_loss: 0.9210, test_loss: 1.0658, test_f1: 0.5024
 epoch: 74, train_loss: 0.9088, test_loss: 1.0730, test_f1: 0.5088
 epoch: 75, train_loss: 0.9050, test_loss: 1.0760, test_f1: 0.5295
 epoch: 76, train_loss: 0.9095, test_loss: 1.0774, test_f1: 0.5249
 epoch: 77, train_loss: 0.9104, test_loss: 1.0719, test_f1: 0.5253
 epoch: 78, train_loss: 0.8990, test_loss: 1.0667, test_f1: 0.5223
 epoch: 79, train_loss: 0.8971, test_loss: 1.0653, test_f1: 0.5144
 epoch: 80, train_loss: 0.9086, test_loss: 1.0680, test_f1: 0.5230
 epoch: 81, train_loss: 0.8955, test_loss: 1.0677, test_f1: 0.5207
 epoch: 82, train_loss: 0.9126, test_loss: 1.0724, test_f1: 0.5237
 epoch: 83, train_loss: 0.9008, test_loss: 1.0755, test_f1: 0.5379
 epoch: 84, train_loss: 0.8964, test_loss: 1.0793, test_f1: 0.5313
 epoch: 85, train_loss: 0.9005, test_loss: 1.0739, test_f1: 0.5319
 epoch: 86, train_loss: 0.8881, test_loss: 1.0668, test_f1: 0.5117
 epoch: 87, train_loss: 0.8955, test_loss: 1.0598, test_f1: 0.5330
 epoch: 88, train_loss: 0.8937, test_loss: 1.0651, test_f1: 0.5342
 epoch: 89, train_loss: 0.8924, test_loss: 1.0652, test_f1: 0.5293
 epoch: 90, train_loss: 0.8884, test_loss: 1.0739, test_f1: 0.5227
 epoch: 91, train_loss: 0.8830, test_loss: 1.0699, test_f1: 0.5197
 epoch: 92, train_loss: 0.8835, test_loss: 1.0699, test_f1: 0.5196
 epoch: 93, train_loss: 0.8881, test_loss: 1.0729, test_f1: 0.5144
 epoch: 94, train_loss: 0.8905, test_loss: 1.0730, test_f1: 0.5146
 epoch: 95, train_loss: 0.8889, test_loss: 1.0601, test_f1: 0.5158
 epoch: 96, train_loss: 0.8896, test_loss: 1.0724, test_f1: 0.5141
 epoch: 97, train_loss: 0.8750, test_loss: 1.0893, test_f1: 0.5194
 epoch: 98, train_loss: 0.8831, test_loss: 1.0952, test_f1: 0.5188
 epoch: 99, train_loss: 0.8695, test_loss: 1.0849, test_f1: 0.5170
##################ITERATION #6 ****************************************
 epoch: 0, train_loss: 1.2689, test_loss: 1.3737, test_f1: 0.2281
 epoch: 1, train_loss: 1.2098, test_loss: 1.3608, test_f1: 0.2281
 epoch: 2, train_loss: 1.1923, test_loss: 1.3562, test_f1: 0.2281
 epoch: 3, train_loss: 1.1791, test_loss: 1.3482, test_f1: 0.2281
 epoch: 4, train_loss: 1.1584, test_loss: 1.3393, test_f1: 0.2929
 epoch: 5, train_loss: 1.1495, test_loss: 1.3206, test_f1: 0.2956
 epoch: 6, train_loss: 1.1369, test_loss: 1.2919, test_f1: 0.2984
 epoch: 7, train_loss: 1.1311, test_loss: 1.2753, test_f1: 0.3027
 epoch: 8, train_loss: 1.1247, test_loss: 1.2567, test_f1: 0.2985
 epoch: 9, train_loss: 1.1181, test_loss: 1.2298, test_f1: 0.3450
 epoch: 10, train_loss: 1.1053, test_loss: 1.2052, test_f1: 0.3938
 epoch: 11, train_loss: 1.1054, test_loss: 1.1924, test_f1: 0.4040
 epoch: 12, train_loss: 1.0940, test_loss: 1.1803, test_f1: 0.3970
 epoch: 13, train_loss: 1.0896, test_loss: 1.1696, test_f1: 0.4100
 epoch: 14, train_loss: 1.0802, test_loss: 1.1652, test_f1: 0.4068
 epoch: 15, train_loss: 1.0813, test_loss: 1.1592, test_f1: 0.4134
 epoch: 16, train_loss: 1.0682, test_loss: 1.1536, test_f1: 0.4116
 epoch: 17, train_loss: 1.0615, test_loss: 1.1487, test_f1: 0.4421
 epoch: 18, train_loss: 1.0552, test_loss: 1.1457, test_f1: 0.4287
 epoch: 19, train_loss: 1.0529, test_loss: 1.1442, test_f1: 0.4539
 epoch: 20, train_loss: 1.0574, test_loss: 1.1373, test_f1: 0.4596
 epoch: 21, train_loss: 1.0393, test_loss: 1.1302, test_f1: 0.4791
 epoch: 22, train_loss: 1.0422, test_loss: 1.1267, test_f1: 0.4766
 epoch: 23, train_loss: 1.0319, test_loss: 1.1276, test_f1: 0.4569
 epoch: 24, train_loss: 1.0228, test_loss: 1.1266, test_f1: 0.4675
 epoch: 25, train_loss: 1.0233, test_loss: 1.1286, test_f1: 0.4592
 epoch: 26, train_loss: 1.0126, test_loss: 1.1280, test_f1: 0.4715
 epoch: 27, train_loss: 1.0097, test_loss: 1.1217, test_f1: 0.4783
 epoch: 28, train_loss: 1.0034, test_loss: 1.1149, test_f1: 0.4999
 epoch: 29, train_loss: 1.0032, test_loss: 1.1137, test_f1: 0.4994
 epoch: 30, train_loss: 1.0068, test_loss: 1.1156, test_f1: 0.4706
 epoch: 31, train_loss: 1.0020, test_loss: 1.1199, test_f1: 0.4677
 epoch: 32, train_loss: 0.9992, test_loss: 1.1178, test_f1: 0.4718
 epoch: 33, train_loss: 0.9913, test_loss: 1.1104, test_f1: 0.4738
 epoch: 34, train_loss: 0.9839, test_loss: 1.1066, test_f1: 0.4719
 epoch: 35, train_loss: 0.9768, test_loss: 1.1046, test_f1: 0.5041
 epoch: 36, train_loss: 0.9834, test_loss: 1.1032, test_f1: 0.4984
 epoch: 37, train_loss: 0.9725, test_loss: 1.0961, test_f1: 0.5088
 epoch: 38, train_loss: 0.9718, test_loss: 1.0879, test_f1: 0.5175
 epoch: 39, train_loss: 0.9609, test_loss: 1.0906, test_f1: 0.5157
 epoch: 40, train_loss: 0.9562, test_loss: 1.0949, test_f1: 0.5166
 epoch: 41, train_loss: 0.9570, test_loss: 1.0981, test_f1: 0.5183
 epoch: 42, train_loss: 0.9506, test_loss: 1.0926, test_f1: 0.5222
 epoch: 43, train_loss: 0.9462, test_loss: 1.0970, test_f1: 0.5287
 epoch: 44, train_loss: 0.9414, test_loss: 1.0865, test_f1: 0.5200
 epoch: 45, train_loss: 0.9426, test_loss: 1.0854, test_f1: 0.5182
 epoch: 46, train_loss: 0.9493, test_loss: 1.1023, test_f1: 0.5228
 epoch: 47, train_loss: 0.9409, test_loss: 1.0933, test_f1: 0.5134
 epoch: 48, train_loss: 0.9470, test_loss: 1.0989, test_f1: 0.5102
 epoch: 49, train_loss: 0.9349, test_loss: 1.1020, test_f1: 0.5291
 epoch: 50, train_loss: 0.9376, test_loss: 1.0866, test_f1: 0.5228
 epoch: 51, train_loss: 0.9227, test_loss: 1.0849, test_f1: 0.5228
 epoch: 52, train_loss: 0.9269, test_loss: 1.0880, test_f1: 0.5241
 epoch: 53, train_loss: 0.9243, test_loss: 1.0838, test_f1: 0.5264
 epoch: 54, train_loss: 0.9346, test_loss: 1.0790, test_f1: 0.5144
 epoch: 55, train_loss: 0.9215, test_loss: 1.0870, test_f1: 0.5207
 epoch: 56, train_loss: 0.9161, test_loss: 1.0882, test_f1: 0.5180
 epoch: 57, train_loss: 0.9108, test_loss: 1.0787, test_f1: 0.5249
 epoch: 58, train_loss: 0.9053, test_loss: 1.0812, test_f1: 0.5225
 epoch: 59, train_loss: 0.9237, test_loss: 1.0693, test_f1: 0.5226
 epoch: 60, train_loss: 0.9087, test_loss: 1.0723, test_f1: 0.5258
 epoch: 61, train_loss: 0.9211, test_loss: 1.0716, test_f1: 0.5304
 epoch: 62, train_loss: 0.9097, test_loss: 1.0723, test_f1: 0.5229
 epoch: 63, train_loss: 0.9082, test_loss: 1.0674, test_f1: 0.5212
 epoch: 64, train_loss: 0.8936, test_loss: 1.0731, test_f1: 0.5251
 epoch: 65, train_loss: 0.8957, test_loss: 1.0746, test_f1: 0.5234
 epoch: 66, train_loss: 0.9038, test_loss: 1.0709, test_f1: 0.5256
 epoch: 67, train_loss: 0.9101, test_loss: 1.0761, test_f1: 0.5306
 epoch: 68, train_loss: 0.9018, test_loss: 1.0813, test_f1: 0.5226
 epoch: 69, train_loss: 0.9025, test_loss: 1.0790, test_f1: 0.5265
 epoch: 70, train_loss: 0.9038, test_loss: 1.0699, test_f1: 0.5308
 epoch: 71, train_loss: 0.8983, test_loss: 1.0668, test_f1: 0.5265
 epoch: 72, train_loss: 0.8981, test_loss: 1.0679, test_f1: 0.5348
 epoch: 73, train_loss: 0.8952, test_loss: 1.0646, test_f1: 0.5275
 epoch: 74, train_loss: 0.8921, test_loss: 1.0663, test_f1: 0.5306
 epoch: 75, train_loss: 0.8956, test_loss: 1.0682, test_f1: 0.5297
 epoch: 76, train_loss: 0.8883, test_loss: 1.0619, test_f1: 0.5291
 epoch: 77, train_loss: 0.8836, test_loss: 1.0639, test_f1: 0.5351
 epoch: 78, train_loss: 0.8898, test_loss: 1.0663, test_f1: 0.5373
 epoch: 79, train_loss: 0.8867, test_loss: 1.0671, test_f1: 0.5383
 epoch: 80, train_loss: 0.8900, test_loss: 1.0686, test_f1: 0.5407
 epoch: 81, train_loss: 0.8874, test_loss: 1.0709, test_f1: 0.5376
 epoch: 82, train_loss: 0.8780, test_loss: 1.0653, test_f1: 0.5462
 epoch: 83, train_loss: 0.8893, test_loss: 1.0653, test_f1: 0.5414
 epoch: 84, train_loss: 0.8859, test_loss: 1.0647, test_f1: 0.5445
 epoch: 85, train_loss: 0.8867, test_loss: 1.0818, test_f1: 0.5427
 epoch: 86, train_loss: 0.8811, test_loss: 1.0839, test_f1: 0.5458
 epoch: 87, train_loss: 0.8828, test_loss: 1.0808, test_f1: 0.5498
 epoch: 88, train_loss: 0.8706, test_loss: 1.0698, test_f1: 0.5438
 epoch: 89, train_loss: 0.8717, test_loss: 1.0628, test_f1: 0.5533
 epoch: 90, train_loss: 0.8787, test_loss: 1.0583, test_f1: 0.5545
 epoch: 91, train_loss: 0.8705, test_loss: 1.0595, test_f1: 0.5538
 epoch: 92, train_loss: 0.8759, test_loss: 1.0549, test_f1: 0.5467
 epoch: 93, train_loss: 0.8796, test_loss: 1.0546, test_f1: 0.5444
 epoch: 94, train_loss: 0.8718, test_loss: 1.0724, test_f1: 0.5502
 epoch: 95, train_loss: 0.8646, test_loss: 1.0731, test_f1: 0.5520
 epoch: 96, train_loss: 0.8592, test_loss: 1.0760, test_f1: 0.5642
 epoch: 97, train_loss: 0.8712, test_loss: 1.0771, test_f1: 0.5523
 epoch: 98, train_loss: 0.8648, test_loss: 1.0779, test_f1: 0.5501
 epoch: 99, train_loss: 0.8684, test_loss: 1.0945, test_f1: 0.5472
##################ITERATION #7 ****************************************
 epoch: 0, train_loss: 1.2533, test_loss: 1.3572, test_f1: 0.2281
 epoch: 1, train_loss: 1.2130, test_loss: 1.3302, test_f1: 0.2281
 epoch: 2, train_loss: 1.1950, test_loss: 1.3061, test_f1: 0.2281
 epoch: 3, train_loss: 1.1748, test_loss: 1.2871, test_f1: 0.2281
 epoch: 4, train_loss: 1.1676, test_loss: 1.2828, test_f1: 0.2441
 epoch: 5, train_loss: 1.1577, test_loss: 1.3023, test_f1: 0.2803
 epoch: 6, train_loss: 1.1455, test_loss: 1.2964, test_f1: 0.2812
 epoch: 7, train_loss: 1.1246, test_loss: 1.2822, test_f1: 0.3242
 epoch: 8, train_loss: 1.1227, test_loss: 1.2638, test_f1: 0.3155
 epoch: 9, train_loss: 1.1134, test_loss: 1.2561, test_f1: 0.3343
 epoch: 10, train_loss: 1.1151, test_loss: 1.2352, test_f1: 0.3448
 epoch: 11, train_loss: 1.1012, test_loss: 1.2105, test_f1: 0.3920
 epoch: 12, train_loss: 1.0951, test_loss: 1.1986, test_f1: 0.4107
 epoch: 13, train_loss: 1.0912, test_loss: 1.1855, test_f1: 0.4273
 epoch: 14, train_loss: 1.0858, test_loss: 1.1740, test_f1: 0.4408
 epoch: 15, train_loss: 1.0863, test_loss: 1.1683, test_f1: 0.4388
 epoch: 16, train_loss: 1.0804, test_loss: 1.1645, test_f1: 0.4346
 epoch: 17, train_loss: 1.0733, test_loss: 1.1589, test_f1: 0.4323
 epoch: 18, train_loss: 1.0625, test_loss: 1.1570, test_f1: 0.4467
 epoch: 19, train_loss: 1.0595, test_loss: 1.1587, test_f1: 0.4446
 epoch: 20, train_loss: 1.0572, test_loss: 1.1515, test_f1: 0.4510
 epoch: 21, train_loss: 1.0485, test_loss: 1.1518, test_f1: 0.4485
 epoch: 22, train_loss: 1.0380, test_loss: 1.1481, test_f1: 0.4403
 epoch: 23, train_loss: 1.0334, test_loss: 1.1395, test_f1: 0.4434
 epoch: 24, train_loss: 1.0353, test_loss: 1.1332, test_f1: 0.4473
 epoch: 25, train_loss: 1.0266, test_loss: 1.1270, test_f1: 0.4514
 epoch: 26, train_loss: 1.0278, test_loss: 1.1279, test_f1: 0.4629
 epoch: 27, train_loss: 1.0275, test_loss: 1.1286, test_f1: 0.4812
 epoch: 28, train_loss: 1.0214, test_loss: 1.1252, test_f1: 0.4779
 epoch: 29, train_loss: 1.0089, test_loss: 1.1199, test_f1: 0.4530
 epoch: 30, train_loss: 1.0078, test_loss: 1.1169, test_f1: 0.4444
 epoch: 31, train_loss: 1.0009, test_loss: 1.1132, test_f1: 0.4638
 epoch: 32, train_loss: 1.0025, test_loss: 1.1070, test_f1: 0.4704
 epoch: 33, train_loss: 0.9997, test_loss: 1.1039, test_f1: 0.4611
 epoch: 34, train_loss: 0.9891, test_loss: 1.1023, test_f1: 0.4668
 epoch: 35, train_loss: 0.9798, test_loss: 1.1000, test_f1: 0.4511
 epoch: 36, train_loss: 0.9904, test_loss: 1.0943, test_f1: 0.4798
 epoch: 37, train_loss: 0.9806, test_loss: 1.0919, test_f1: 0.4832
 epoch: 38, train_loss: 0.9746, test_loss: 1.0885, test_f1: 0.4770
 epoch: 39, train_loss: 0.9690, test_loss: 1.0892, test_f1: 0.4859
 epoch: 40, train_loss: 0.9651, test_loss: 1.0818, test_f1: 0.4890
 epoch: 41, train_loss: 0.9617, test_loss: 1.0801, test_f1: 0.4875
 epoch: 42, train_loss: 0.9651, test_loss: 1.0830, test_f1: 0.4895
 epoch: 43, train_loss: 0.9632, test_loss: 1.0816, test_f1: 0.4935
 epoch: 44, train_loss: 0.9553, test_loss: 1.0780, test_f1: 0.4996
 epoch: 45, train_loss: 0.9582, test_loss: 1.0720, test_f1: 0.5005
 epoch: 46, train_loss: 0.9528, test_loss: 1.0686, test_f1: 0.4976
 epoch: 47, train_loss: 0.9546, test_loss: 1.0719, test_f1: 0.4996
 epoch: 48, train_loss: 0.9472, test_loss: 1.0712, test_f1: 0.5071
 epoch: 49, train_loss: 0.9443, test_loss: 1.0683, test_f1: 0.5158
 epoch: 50, train_loss: 0.9417, test_loss: 1.0641, test_f1: 0.5129
 epoch: 51, train_loss: 0.9389, test_loss: 1.0693, test_f1: 0.5198
 epoch: 52, train_loss: 0.9394, test_loss: 1.0666, test_f1: 0.5126
 epoch: 53, train_loss: 0.9345, test_loss: 1.0725, test_f1: 0.5125
 epoch: 54, train_loss: 0.9343, test_loss: 1.0736, test_f1: 0.5027
 epoch: 55, train_loss: 0.9417, test_loss: 1.0721, test_f1: 0.5015
 epoch: 56, train_loss: 0.9358, test_loss: 1.0716, test_f1: 0.5069
 epoch: 57, train_loss: 0.9196, test_loss: 1.0690, test_f1: 0.5249
 epoch: 58, train_loss: 0.9313, test_loss: 1.0721, test_f1: 0.5120
 epoch: 59, train_loss: 0.9355, test_loss: 1.0766, test_f1: 0.5143
 epoch: 60, train_loss: 0.9199, test_loss: 1.0783, test_f1: 0.5120
 epoch: 61, train_loss: 0.9199, test_loss: 1.0817, test_f1: 0.5043
 epoch: 62, train_loss: 0.9267, test_loss: 1.0851, test_f1: 0.4965
 epoch: 63, train_loss: 0.9147, test_loss: 1.0941, test_f1: 0.5059
 epoch: 64, train_loss: 0.9194, test_loss: 1.0958, test_f1: 0.5085
 epoch: 65, train_loss: 0.9213, test_loss: 1.0828, test_f1: 0.5061
 epoch: 66, train_loss: 0.9169, test_loss: 1.0764, test_f1: 0.5041
 epoch: 67, train_loss: 0.9062, test_loss: 1.0715, test_f1: 0.4958
 epoch: 68, train_loss: 0.9188, test_loss: 1.0765, test_f1: 0.4999
 epoch: 69, train_loss: 0.9115, test_loss: 1.0663, test_f1: 0.5104
 epoch: 70, train_loss: 0.9135, test_loss: 1.0672, test_f1: 0.5230
 epoch: 71, train_loss: 0.9068, test_loss: 1.0701, test_f1: 0.5141
 epoch: 72, train_loss: 0.9132, test_loss: 1.0742, test_f1: 0.5153
 epoch: 73, train_loss: 0.9126, test_loss: 1.0714, test_f1: 0.5128
 epoch: 74, train_loss: 0.9060, test_loss: 1.0629, test_f1: 0.5199
 epoch: 75, train_loss: 0.9011, test_loss: 1.0603, test_f1: 0.5173
 epoch: 76, train_loss: 0.9004, test_loss: 1.0636, test_f1: 0.5161
 epoch: 77, train_loss: 0.9032, test_loss: 1.0653, test_f1: 0.5203
 epoch: 78, train_loss: 0.9033, test_loss: 1.0714, test_f1: 0.5109
 epoch: 79, train_loss: 0.8896, test_loss: 1.0734, test_f1: 0.5265
 epoch: 80, train_loss: 0.8890, test_loss: 1.0763, test_f1: 0.5224
 epoch: 81, train_loss: 0.8921, test_loss: 1.0749, test_f1: 0.5183
 epoch: 82, train_loss: 0.8964, test_loss: 1.0842, test_f1: 0.5274
 epoch: 83, train_loss: 0.8897, test_loss: 1.0684, test_f1: 0.5115
 epoch: 84, train_loss: 0.8841, test_loss: 1.0680, test_f1: 0.5114
 epoch: 85, train_loss: 0.8871, test_loss: 1.0755, test_f1: 0.5160
 epoch: 86, train_loss: 0.8896, test_loss: 1.0775, test_f1: 0.5300
 epoch: 87, train_loss: 0.8893, test_loss: 1.0576, test_f1: 0.5335
 epoch: 88, train_loss: 0.8893, test_loss: 1.0573, test_f1: 0.5372
 epoch: 89, train_loss: 0.8861, test_loss: 1.0606, test_f1: 0.5419
 epoch: 90, train_loss: 0.8895, test_loss: 1.0669, test_f1: 0.5375
 epoch: 91, train_loss: 0.8883, test_loss: 1.0678, test_f1: 0.5321
 epoch: 92, train_loss: 0.8800, test_loss: 1.0596, test_f1: 0.5411
 epoch: 93, train_loss: 0.8754, test_loss: 1.0569, test_f1: 0.5456
 epoch: 94, train_loss: 0.8835, test_loss: 1.0638, test_f1: 0.5314
 epoch: 95, train_loss: 0.8798, test_loss: 1.0653, test_f1: 0.5341
 epoch: 96, train_loss: 0.8723, test_loss: 1.0594, test_f1: 0.5291
 epoch: 97, train_loss: 0.8834, test_loss: 1.0670, test_f1: 0.5275
 epoch: 98, train_loss: 0.8754, test_loss: 1.0611, test_f1: 0.5235
 epoch: 99, train_loss: 0.8760, test_loss: 1.0646, test_f1: 0.5205
##################ITERATION #8 ****************************************
 epoch: 0, train_loss: 1.2642, test_loss: 1.3417, test_f1: 0.2281
 epoch: 1, train_loss: 1.2010, test_loss: 1.3355, test_f1: 0.2281
 epoch: 2, train_loss: 1.1869, test_loss: 1.3306, test_f1: 0.2281
 epoch: 3, train_loss: 1.1680, test_loss: 1.3237, test_f1: 0.2281
 epoch: 4, train_loss: 1.1513, test_loss: 1.3133, test_f1: 0.2281
 epoch: 5, train_loss: 1.1438, test_loss: 1.3099, test_f1: 0.2551
 epoch: 6, train_loss: 1.1309, test_loss: 1.2951, test_f1: 0.2458
 epoch: 7, train_loss: 1.1145, test_loss: 1.2618, test_f1: 0.2725
 epoch: 8, train_loss: 1.1100, test_loss: 1.2335, test_f1: 0.2845
 epoch: 9, train_loss: 1.1077, test_loss: 1.2117, test_f1: 0.2958
 epoch: 10, train_loss: 1.0931, test_loss: 1.2034, test_f1: 0.3408
 epoch: 11, train_loss: 1.0891, test_loss: 1.2031, test_f1: 0.3106
 epoch: 12, train_loss: 1.0851, test_loss: 1.1913, test_f1: 0.3913
 epoch: 13, train_loss: 1.0783, test_loss: 1.1758, test_f1: 0.4577
 epoch: 14, train_loss: 1.0800, test_loss: 1.1727, test_f1: 0.4488
 epoch: 15, train_loss: 1.0692, test_loss: 1.1692, test_f1: 0.4471
 epoch: 16, train_loss: 1.0590, test_loss: 1.1674, test_f1: 0.4409
 epoch: 17, train_loss: 1.0488, test_loss: 1.1667, test_f1: 0.4606
 epoch: 18, train_loss: 1.0416, test_loss: 1.1647, test_f1: 0.4661
 epoch: 19, train_loss: 1.0501, test_loss: 1.1616, test_f1: 0.4538
 epoch: 20, train_loss: 1.0382, test_loss: 1.1562, test_f1: 0.4654
 epoch: 21, train_loss: 1.0338, test_loss: 1.1507, test_f1: 0.4590
 epoch: 22, train_loss: 1.0331, test_loss: 1.1477, test_f1: 0.4609
 epoch: 23, train_loss: 1.0259, test_loss: 1.1435, test_f1: 0.4793
 epoch: 24, train_loss: 1.0160, test_loss: 1.1436, test_f1: 0.4918
 epoch: 25, train_loss: 1.0198, test_loss: 1.1439, test_f1: 0.4950
 epoch: 26, train_loss: 1.0193, test_loss: 1.1376, test_f1: 0.4917
 epoch: 27, train_loss: 1.0069, test_loss: 1.1283, test_f1: 0.4954
 epoch: 28, train_loss: 1.0070, test_loss: 1.1251, test_f1: 0.4930
 epoch: 29, train_loss: 0.9974, test_loss: 1.1210, test_f1: 0.4890
 epoch: 30, train_loss: 0.9928, test_loss: 1.1222, test_f1: 0.4997
 epoch: 31, train_loss: 0.9863, test_loss: 1.1270, test_f1: 0.4940
 epoch: 32, train_loss: 1.0010, test_loss: 1.1239, test_f1: 0.4929
 epoch: 33, train_loss: 0.9852, test_loss: 1.1195, test_f1: 0.4980
 epoch: 34, train_loss: 0.9743, test_loss: 1.1158, test_f1: 0.5149
 epoch: 35, train_loss: 0.9748, test_loss: 1.1036, test_f1: 0.5107
 epoch: 36, train_loss: 0.9779, test_loss: 1.1031, test_f1: 0.5119
 epoch: 37, train_loss: 0.9733, test_loss: 1.1104, test_f1: 0.5073
 epoch: 38, train_loss: 0.9564, test_loss: 1.1131, test_f1: 0.5084
 epoch: 39, train_loss: 0.9662, test_loss: 1.0954, test_f1: 0.5069
 epoch: 40, train_loss: 0.9623, test_loss: 1.0896, test_f1: 0.5067
 epoch: 41, train_loss: 0.9540, test_loss: 1.0908, test_f1: 0.4993
 epoch: 42, train_loss: 0.9531, test_loss: 1.0876, test_f1: 0.5081
 epoch: 43, train_loss: 0.9440, test_loss: 1.0880, test_f1: 0.5077
 epoch: 44, train_loss: 0.9485, test_loss: 1.0875, test_f1: 0.5113
 epoch: 45, train_loss: 0.9461, test_loss: 1.0917, test_f1: 0.5135
 epoch: 46, train_loss: 0.9430, test_loss: 1.0912, test_f1: 0.5251
 epoch: 47, train_loss: 0.9334, test_loss: 1.0860, test_f1: 0.5183
 epoch: 48, train_loss: 0.9312, test_loss: 1.0896, test_f1: 0.5249
 epoch: 49, train_loss: 0.9282, test_loss: 1.0832, test_f1: 0.5119
 epoch: 50, train_loss: 0.9274, test_loss: 1.0797, test_f1: 0.5004
 epoch: 51, train_loss: 0.9295, test_loss: 1.0842, test_f1: 0.5198
 epoch: 52, train_loss: 0.9265, test_loss: 1.0893, test_f1: 0.5205
 epoch: 53, train_loss: 0.9282, test_loss: 1.0840, test_f1: 0.5222
 epoch: 54, train_loss: 0.9238, test_loss: 1.0804, test_f1: 0.5334
 epoch: 55, train_loss: 0.9321, test_loss: 1.0807, test_f1: 0.5384
 epoch: 56, train_loss: 0.9145, test_loss: 1.0824, test_f1: 0.5212
 epoch: 57, train_loss: 0.9168, test_loss: 1.0839, test_f1: 0.5433
 epoch: 58, train_loss: 0.9096, test_loss: 1.0770, test_f1: 0.5274
 epoch: 59, train_loss: 0.9197, test_loss: 1.0702, test_f1: 0.5282
 epoch: 60, train_loss: 0.9121, test_loss: 1.0689, test_f1: 0.5324
 epoch: 61, train_loss: 0.9110, test_loss: 1.0695, test_f1: 0.5399
 epoch: 62, train_loss: 0.9102, test_loss: 1.0713, test_f1: 0.5455
 epoch: 63, train_loss: 0.9095, test_loss: 1.0762, test_f1: 0.5453
 epoch: 64, train_loss: 0.9061, test_loss: 1.0806, test_f1: 0.5451
 epoch: 65, train_loss: 0.9078, test_loss: 1.0736, test_f1: 0.5461
 epoch: 66, train_loss: 0.9042, test_loss: 1.0733, test_f1: 0.5584
 epoch: 67, train_loss: 0.8994, test_loss: 1.0708, test_f1: 0.5442
 epoch: 68, train_loss: 0.9025, test_loss: 1.0738, test_f1: 0.5345
 epoch: 69, train_loss: 0.8986, test_loss: 1.0666, test_f1: 0.5447
 epoch: 70, train_loss: 0.8984, test_loss: 1.0728, test_f1: 0.5400
 epoch: 71, train_loss: 0.8818, test_loss: 1.0751, test_f1: 0.5422
 epoch: 72, train_loss: 0.8930, test_loss: 1.0698, test_f1: 0.5398
 epoch: 73, train_loss: 0.8949, test_loss: 1.0670, test_f1: 0.5422
 epoch: 74, train_loss: 0.8899, test_loss: 1.0759, test_f1: 0.5330
 epoch: 75, train_loss: 0.8859, test_loss: 1.0742, test_f1: 0.5339
 epoch: 76, train_loss: 0.8855, test_loss: 1.0741, test_f1: 0.5439
 epoch: 77, train_loss: 0.8867, test_loss: 1.0717, test_f1: 0.5463
 epoch: 78, train_loss: 0.8983, test_loss: 1.0722, test_f1: 0.5417
 epoch: 79, train_loss: 0.8824, test_loss: 1.0753, test_f1: 0.5413
 epoch: 80, train_loss: 0.8848, test_loss: 1.0718, test_f1: 0.5446
 epoch: 81, train_loss: 0.8743, test_loss: 1.0597, test_f1: 0.5477
 epoch: 82, train_loss: 0.8807, test_loss: 1.0746, test_f1: 0.5449
 epoch: 83, train_loss: 0.8862, test_loss: 1.0795, test_f1: 0.5396
 epoch: 84, train_loss: 0.8741, test_loss: 1.0832, test_f1: 0.5446
 epoch: 85, train_loss: 0.8829, test_loss: 1.0782, test_f1: 0.5471
 epoch: 86, train_loss: 0.8765, test_loss: 1.0728, test_f1: 0.5557
 epoch: 87, train_loss: 0.8779, test_loss: 1.0742, test_f1: 0.5536
 epoch: 88, train_loss: 0.8769, test_loss: 1.0665, test_f1: 0.5510
 epoch: 89, train_loss: 0.8876, test_loss: 1.0697, test_f1: 0.5479
 epoch: 90, train_loss: 0.8693, test_loss: 1.0703, test_f1: 0.5428
 epoch: 91, train_loss: 0.8611, test_loss: 1.0733, test_f1: 0.5471
 epoch: 92, train_loss: 0.8713, test_loss: 1.0716, test_f1: 0.5527
 epoch: 93, train_loss: 0.8625, test_loss: 1.0728, test_f1: 0.5552
 epoch: 94, train_loss: 0.8649, test_loss: 1.0710, test_f1: 0.5472
 epoch: 95, train_loss: 0.8584, test_loss: 1.0692, test_f1: 0.5479
 epoch: 96, train_loss: 0.8705, test_loss: 1.0753, test_f1: 0.5535
 epoch: 97, train_loss: 0.8691, test_loss: 1.0846, test_f1: 0.5465
 epoch: 98, train_loss: 0.8659, test_loss: 1.0867, test_f1: 0.5521
 epoch: 99, train_loss: 0.8757, test_loss: 1.0751, test_f1: 0.5483
##################ITERATION #9 ****************************************
 epoch: 0, train_loss: 1.3119, test_loss: 1.3840, test_f1: 0.2281
 epoch: 1, train_loss: 1.2429, test_loss: 1.3645, test_f1: 0.2281
 epoch: 2, train_loss: 1.2216, test_loss: 1.3458, test_f1: 0.2281
 epoch: 3, train_loss: 1.2009, test_loss: 1.3272, test_f1: 0.2281
 epoch: 4, train_loss: 1.1873, test_loss: 1.3045, test_f1: 0.2281
 epoch: 5, train_loss: 1.1748, test_loss: 1.2842, test_f1: 0.2281
 epoch: 6, train_loss: 1.1604, test_loss: 1.2614, test_f1: 0.2524
 epoch: 7, train_loss: 1.1523, test_loss: 1.2613, test_f1: 0.2936
 epoch: 8, train_loss: 1.1262, test_loss: 1.2678, test_f1: 0.2833
 epoch: 9, train_loss: 1.1314, test_loss: 1.2454, test_f1: 0.2848
 epoch: 10, train_loss: 1.1150, test_loss: 1.2177, test_f1: 0.3211
 epoch: 11, train_loss: 1.1025, test_loss: 1.2034, test_f1: 0.3190
 epoch: 12, train_loss: 1.0957, test_loss: 1.1923, test_f1: 0.3036
 epoch: 13, train_loss: 1.0999, test_loss: 1.1810, test_f1: 0.2941
 epoch: 14, train_loss: 1.0841, test_loss: 1.1823, test_f1: 0.3169
 epoch: 15, train_loss: 1.0738, test_loss: 1.1785, test_f1: 0.3269
 epoch: 16, train_loss: 1.0657, test_loss: 1.1654, test_f1: 0.3212
 epoch: 17, train_loss: 1.0696, test_loss: 1.1587, test_f1: 0.3219
 epoch: 18, train_loss: 1.0681, test_loss: 1.1546, test_f1: 0.3331
 epoch: 19, train_loss: 1.0557, test_loss: 1.1517, test_f1: 0.3259
 epoch: 20, train_loss: 1.0509, test_loss: 1.1450, test_f1: 0.3227
 epoch: 21, train_loss: 1.0434, test_loss: 1.1400, test_f1: 0.3532
 epoch: 22, train_loss: 1.0442, test_loss: 1.1409, test_f1: 0.3506
 epoch: 23, train_loss: 1.0358, test_loss: 1.1334, test_f1: 0.3669
 epoch: 24, train_loss: 1.0294, test_loss: 1.1295, test_f1: 0.3963
 epoch: 25, train_loss: 1.0171, test_loss: 1.1168, test_f1: 0.3978
 epoch: 26, train_loss: 1.0141, test_loss: 1.1235, test_f1: 0.3998
 epoch: 27, train_loss: 1.0054, test_loss: 1.1230, test_f1: 0.4307
 epoch: 28, train_loss: 1.0049, test_loss: 1.1159, test_f1: 0.4369
 epoch: 29, train_loss: 0.9977, test_loss: 1.1031, test_f1: 0.4477
 epoch: 30, train_loss: 1.0001, test_loss: 1.1002, test_f1: 0.4753
 epoch: 31, train_loss: 0.9916, test_loss: 1.1110, test_f1: 0.4756
 epoch: 32, train_loss: 0.9910, test_loss: 1.1162, test_f1: 0.4728
 epoch: 33, train_loss: 0.9928, test_loss: 1.1115, test_f1: 0.4881
 epoch: 34, train_loss: 0.9783, test_loss: 1.0973, test_f1: 0.5069
 epoch: 35, train_loss: 0.9845, test_loss: 1.0919, test_f1: 0.5085
 epoch: 36, train_loss: 0.9766, test_loss: 1.0821, test_f1: 0.5027
 epoch: 37, train_loss: 0.9717, test_loss: 1.0794, test_f1: 0.4713
 epoch: 38, train_loss: 0.9686, test_loss: 1.0828, test_f1: 0.4795
 epoch: 39, train_loss: 0.9593, test_loss: 1.0870, test_f1: 0.4912
 epoch: 40, train_loss: 0.9562, test_loss: 1.0761, test_f1: 0.5077
 epoch: 41, train_loss: 0.9546, test_loss: 1.0606, test_f1: 0.4846
 epoch: 42, train_loss: 0.9469, test_loss: 1.0548, test_f1: 0.4956
 epoch: 43, train_loss: 0.9500, test_loss: 1.0630, test_f1: 0.5114
 epoch: 44, train_loss: 0.9473, test_loss: 1.0566, test_f1: 0.4919
 epoch: 45, train_loss: 0.9371, test_loss: 1.0525, test_f1: 0.4954
 epoch: 46, train_loss: 0.9404, test_loss: 1.0530, test_f1: 0.5110
 epoch: 47, train_loss: 0.9422, test_loss: 1.0468, test_f1: 0.5244
 epoch: 48, train_loss: 0.9354, test_loss: 1.0601, test_f1: 0.5088
 epoch: 49, train_loss: 0.9279, test_loss: 1.0683, test_f1: 0.5066
 epoch: 50, train_loss: 0.9327, test_loss: 1.0543, test_f1: 0.5177
 epoch: 51, train_loss: 0.9270, test_loss: 1.0422, test_f1: 0.5218
 epoch: 52, train_loss: 0.9177, test_loss: 1.0410, test_f1: 0.5333
 epoch: 53, train_loss: 0.9147, test_loss: 1.0458, test_f1: 0.5312
 epoch: 54, train_loss: 0.9208, test_loss: 1.0445, test_f1: 0.5481
 epoch: 55, train_loss: 0.9133, test_loss: 1.0402, test_f1: 0.5300
 epoch: 56, train_loss: 0.9068, test_loss: 1.0456, test_f1: 0.5420
 epoch: 57, train_loss: 0.9207, test_loss: 1.0446, test_f1: 0.5362
 epoch: 58, train_loss: 0.9067, test_loss: 1.0432, test_f1: 0.5496
 epoch: 59, train_loss: 0.9076, test_loss: 1.0453, test_f1: 0.5425
 epoch: 60, train_loss: 0.9093, test_loss: 1.0450, test_f1: 0.5423
 epoch: 61, train_loss: 0.9124, test_loss: 1.0425, test_f1: 0.5345
 epoch: 62, train_loss: 0.9153, test_loss: 1.0370, test_f1: 0.5405
 epoch: 63, train_loss: 0.9106, test_loss: 1.0368, test_f1: 0.5441
 epoch: 64, train_loss: 0.9148, test_loss: 1.0336, test_f1: 0.5428
 epoch: 65, train_loss: 0.8976, test_loss: 1.0456, test_f1: 0.5386
 epoch: 66, train_loss: 0.9087, test_loss: 1.0488, test_f1: 0.5336
 epoch: 67, train_loss: 0.9008, test_loss: 1.0468, test_f1: 0.5375
 epoch: 68, train_loss: 0.9028, test_loss: 1.0514, test_f1: 0.5395
 epoch: 69, train_loss: 0.8930, test_loss: 1.0508, test_f1: 0.5320
 epoch: 70, train_loss: 0.9004, test_loss: 1.0396, test_f1: 0.5268
 epoch: 71, train_loss: 0.9016, test_loss: 1.0385, test_f1: 0.5329
 epoch: 72, train_loss: 0.8892, test_loss: 1.0399, test_f1: 0.5356
 epoch: 73, train_loss: 0.8899, test_loss: 1.0375, test_f1: 0.5251
 epoch: 74, train_loss: 0.8916, test_loss: 1.0398, test_f1: 0.5388
 epoch: 75, train_loss: 0.8794, test_loss: 1.0408, test_f1: 0.5386
 epoch: 76, train_loss: 0.8868, test_loss: 1.0341, test_f1: 0.5338
 epoch: 77, train_loss: 0.8891, test_loss: 1.0322, test_f1: 0.5390
 epoch: 78, train_loss: 0.8887, test_loss: 1.0336, test_f1: 0.5383
 epoch: 79, train_loss: 0.8849, test_loss: 1.0360, test_f1: 0.5264
 epoch: 80, train_loss: 0.8909, test_loss: 1.0297, test_f1: 0.5321
 epoch: 81, train_loss: 0.8845, test_loss: 1.0408, test_f1: 0.5203
 epoch: 82, train_loss: 0.8842, test_loss: 1.0449, test_f1: 0.5205
 epoch: 83, train_loss: 0.8813, test_loss: 1.0481, test_f1: 0.5222
 epoch: 84, train_loss: 0.8823, test_loss: 1.0322, test_f1: 0.5298
 epoch: 85, train_loss: 0.8844, test_loss: 1.0367, test_f1: 0.5274
 epoch: 86, train_loss: 0.8703, test_loss: 1.0343, test_f1: 0.5290
 epoch: 87, train_loss: 0.8770, test_loss: 1.0405, test_f1: 0.5293
 epoch: 88, train_loss: 0.8710, test_loss: 1.0384, test_f1: 0.5313
 epoch: 89, train_loss: 0.8672, test_loss: 1.0414, test_f1: 0.5377
 epoch: 90, train_loss: 0.8850, test_loss: 1.0389, test_f1: 0.5261
 epoch: 91, train_loss: 0.8632, test_loss: 1.0384, test_f1: 0.5362
 epoch: 92, train_loss: 0.8673, test_loss: 1.0366, test_f1: 0.5281
 epoch: 93, train_loss: 0.8761, test_loss: 1.0370, test_f1: 0.5355
 epoch: 94, train_loss: 0.8749, test_loss: 1.0294, test_f1: 0.5285
 epoch: 95, train_loss: 0.8750, test_loss: 1.0213, test_f1: 0.5281
 epoch: 96, train_loss: 0.8711, test_loss: 1.0169, test_f1: 0.5268
 epoch: 97, train_loss: 0.8729, test_loss: 1.0283, test_f1: 0.5295
 epoch: 98, train_loss: 0.8739, test_loss: 1.0403, test_f1: 0.5329
 epoch: 99, train_loss: 0.8744, test_loss: 1.0360, test_f1: 0.5291

Training completed in 318.88 seconds
Best F1: 0.5642 at epoch 96
Mean F1 across iterations: 0.5413  0.0155
========================FINAL RESULTS================================
FEGIN weighted F1: 0.5642  0.0155
python main.py --data ltspice_demos --representation component_net --model FEGIN --layers 6 --hiddens 64 --batch_size 256 --lr 0.0001 --emb_size 512 --epochs 100 --save_appendix component_net_L6_H64_BS256_LR0.0001_E512 --no_val
-----



STDERR:
  File "main.py", line 370, in <module>
    main()
  File "main.py", line 254, in main
    dataset = dataset_class(
  File "/home/philip/projects/ltspice_examples_code_repo/Circuit-Completion-Using-GNNs/component_classification_with_link_prediction_head/evaluation/FEGIN/kernel/circuit_datasets.py", line 15, in __init__
    self.data, self.slices = torch.load(self.processed_paths[0])
  File "/home/philip/.local/lib/python3.8/site-packages/torch/serialization.py", line 1040, in load
    warnings.warn(
  File "/usr/lib/python3.8/warnings.py", line 109, in _showwarnmsg
    sw(msg.message, msg.category, msg.filename, msg.lineno,
  File "main.py", line 47, in warn_with_traceback
    traceback.print_stack(file=log)
/home/philip/projects/ltspice_examples_code_repo/Circuit-Completion-Using-GNNs/component_classification_with_link_prediction_head/evaluation/FEGIN/kernel/circuit_datasets.py:15: FutureWarning: You are using `torch.load` with `weights_only=False` (the current default value), which uses the default pickle module implicitly. It is possible to construct malicious pickle data which will execute arbitrary code during unpickling (See https://github.com/pytorch/pytorch/blob/main/SECURITY.md#untrusted-models for more details). In a future release, the default value for `weights_only` will be flipped to `True`. This limits the functions that could be executed during unpickling. Arbitrary objects will no longer be allowed to be loaded via this mode unless they are explicitly allowlisted by the user via `torch.serialization.add_safe_globals`. We recommend you start setting `weights_only=True` for any use case where you don't have full control of the loaded file. Please open an issue on GitHub for any issues related to this experimental feature.
  self.data, self.slices = torch.load(self.processed_paths[0])
