STDOUT:
Results will be saved in /home/philip/projects/ltspice_examples_code_repo/Circuit-Completion-Using-GNNs/component_classification_with_link_prediction_head/evaluation/FEGIN/results/model_FEGIN_dataset_ltspice_examples
Command line input: python main.py --data ltspice_examples --representation component_pin --model FEGIN --layers 3 --hiddens 128 --batch_size 64 --lr 0.01 --emb_size 512 --epochs 100 --save_appendix component_pin_L3_H128_BS64_LR0.01_E512 --no_val
 is saved.
-----
ltspice_examples - FEGIN
Using 3 layers, 128 hidden units, h = 2
Loading component_pin representation dataset
ENTERED
Training FEGIN on component_pin representation
Train: 3560, Test: 848
##################ITERATION #0 ****************************************
 epoch: 0, train_loss: 1.1188, test_loss: 1.1397, test_f1: 0.3994
 epoch: 1, train_loss: 0.9926, test_loss: 1.0403, test_f1: 0.4294
 epoch: 2, train_loss: 0.9503, test_loss: 1.1165, test_f1: 0.4055
 epoch: 3, train_loss: 0.9268, test_loss: 1.2342, test_f1: 0.4179
 epoch: 4, train_loss: 0.8993, test_loss: 0.9132, test_f1: 0.4885
 epoch: 5, train_loss: 0.8813, test_loss: 0.8618, test_f1: 0.5352
 epoch: 6, train_loss: 0.8673, test_loss: 0.9078, test_f1: 0.4948
 epoch: 7, train_loss: 0.8723, test_loss: 0.9840, test_f1: 0.5480
 epoch: 8, train_loss: 0.8309, test_loss: 0.8783, test_f1: 0.5284
 epoch: 9, train_loss: 0.8424, test_loss: 0.9677, test_f1: 0.5382
 epoch: 10, train_loss: 0.8278, test_loss: 0.9627, test_f1: 0.4801
 epoch: 11, train_loss: 0.8136, test_loss: 0.8714, test_f1: 0.6016
 epoch: 12, train_loss: 0.7973, test_loss: 0.8546, test_f1: 0.5366
 epoch: 13, train_loss: 0.7824, test_loss: 0.9972, test_f1: 0.5207
 epoch: 14, train_loss: 0.7890, test_loss: 0.9242, test_f1: 0.4842
 epoch: 15, train_loss: 0.7515, test_loss: 0.8816, test_f1: 0.5427
 epoch: 16, train_loss: 0.7448, test_loss: 0.8511, test_f1: 0.5683
 epoch: 17, train_loss: 0.7358, test_loss: 0.8140, test_f1: 0.5983
 epoch: 18, train_loss: 0.7315, test_loss: 0.8577, test_f1: 0.6140
 epoch: 19, train_loss: 0.7120, test_loss: 0.8952, test_f1: 0.5665
 epoch: 20, train_loss: 0.7533, test_loss: 0.8476, test_f1: 0.5601
 epoch: 21, train_loss: 0.7206, test_loss: 0.8382, test_f1: 0.5643
 epoch: 22, train_loss: 0.7151, test_loss: 0.9852, test_f1: 0.5678
 epoch: 23, train_loss: 0.7009, test_loss: 1.1359, test_f1: 0.5957
 epoch: 24, train_loss: 0.6966, test_loss: 1.0329, test_f1: 0.5772
 epoch: 25, train_loss: 0.6785, test_loss: 1.1580, test_f1: 0.4983
 epoch: 26, train_loss: 0.6827, test_loss: 0.9849, test_f1: 0.5533
 epoch: 27, train_loss: 0.6704, test_loss: 0.9509, test_f1: 0.5962
 epoch: 28, train_loss: 0.6682, test_loss: 0.9630, test_f1: 0.5913
 epoch: 29, train_loss: 0.6729, test_loss: 0.8911, test_f1: 0.6019
 epoch: 30, train_loss: 0.6345, test_loss: 0.9145, test_f1: 0.5780
 epoch: 31, train_loss: 0.6463, test_loss: 1.0091, test_f1: 0.5687
 epoch: 32, train_loss: 0.6459, test_loss: 1.3429, test_f1: 0.5088
 epoch: 33, train_loss: 0.6480, test_loss: 0.8957, test_f1: 0.5764
 epoch: 34, train_loss: 0.6728, test_loss: 0.8608, test_f1: 0.5971
 epoch: 35, train_loss: 0.6312, test_loss: 1.0459, test_f1: 0.5837
 epoch: 36, train_loss: 0.6143, test_loss: 1.0006, test_f1: 0.6217
 epoch: 37, train_loss: 0.6271, test_loss: 1.0721, test_f1: 0.6226
 epoch: 38, train_loss: 0.6047, test_loss: 0.8972, test_f1: 0.6136
 epoch: 39, train_loss: 0.5922, test_loss: 1.0136, test_f1: 0.6361
 epoch: 40, train_loss: 0.6105, test_loss: 1.1007, test_f1: 0.5487
 epoch: 41, train_loss: 0.6141, test_loss: 0.8394, test_f1: 0.6426
 epoch: 42, train_loss: 0.5918, test_loss: 0.9947, test_f1: 0.6096
 epoch: 43, train_loss: 0.5870, test_loss: 0.8733, test_f1: 0.6005
 epoch: 44, train_loss: 0.6008, test_loss: 0.9916, test_f1: 0.6169
 epoch: 45, train_loss: 0.5860, test_loss: 1.3837, test_f1: 0.6094
 epoch: 46, train_loss: 0.5566, test_loss: 1.1145, test_f1: 0.6141
 epoch: 47, train_loss: 0.5491, test_loss: 0.9920, test_f1: 0.6228
 epoch: 48, train_loss: 0.5725, test_loss: 1.0026, test_f1: 0.6118
 epoch: 49, train_loss: 0.5498, test_loss: 1.1588, test_f1: 0.5941
 epoch: 50, train_loss: 0.5572, test_loss: 0.9557, test_f1: 0.6164
 epoch: 51, train_loss: 0.5135, test_loss: 1.0835, test_f1: 0.6503
 epoch: 52, train_loss: 0.4762, test_loss: 1.0084, test_f1: 0.6468
 epoch: 53, train_loss: 0.4663, test_loss: 1.0970, test_f1: 0.6180
 epoch: 54, train_loss: 0.4478, test_loss: 1.2365, test_f1: 0.6295
 epoch: 55, train_loss: 0.4472, test_loss: 1.2036, test_f1: 0.6247
 epoch: 56, train_loss: 0.4649, test_loss: 1.2987, test_f1: 0.6442
 epoch: 57, train_loss: 0.4496, test_loss: 1.1796, test_f1: 0.6321
 epoch: 58, train_loss: 0.4266, test_loss: 1.1875, test_f1: 0.6467
 epoch: 59, train_loss: 0.4513, test_loss: 1.1594, test_f1: 0.6485
 epoch: 60, train_loss: 0.4171, test_loss: 1.2547, test_f1: 0.6375
 epoch: 61, train_loss: 0.4208, test_loss: 1.2150, test_f1: 0.6218
 epoch: 62, train_loss: 0.4316, test_loss: 1.3034, test_f1: 0.6347
 epoch: 63, train_loss: 0.4297, test_loss: 1.2557, test_f1: 0.6511
 epoch: 64, train_loss: 0.4045, test_loss: 1.4214, test_f1: 0.6510
 epoch: 65, train_loss: 0.4123, test_loss: 1.4955, test_f1: 0.6265
 epoch: 66, train_loss: 0.4027, test_loss: 1.3710, test_f1: 0.6268
 epoch: 67, train_loss: 0.3977, test_loss: 1.4724, test_f1: 0.6292
 epoch: 68, train_loss: 0.3994, test_loss: 1.2862, test_f1: 0.6196
 epoch: 69, train_loss: 0.4087, test_loss: 1.3217, test_f1: 0.6462
 epoch: 70, train_loss: 0.3869, test_loss: 1.4518, test_f1: 0.6530
 epoch: 71, train_loss: 0.3779, test_loss: 1.3839, test_f1: 0.6190
 epoch: 72, train_loss: 0.4027, test_loss: 1.2893, test_f1: 0.6271
 epoch: 73, train_loss: 0.3926, test_loss: 1.2401, test_f1: 0.6809
 epoch: 74, train_loss: 0.3811, test_loss: 1.2457, test_f1: 0.6344
 epoch: 75, train_loss: 0.3824, test_loss: 1.5417, test_f1: 0.6428
 epoch: 76, train_loss: 0.3611, test_loss: 1.4432, test_f1: 0.6575
 epoch: 77, train_loss: 0.3799, test_loss: 1.1848, test_f1: 0.6545
 epoch: 78, train_loss: 0.3918, test_loss: 1.2093, test_f1: 0.6480
 epoch: 79, train_loss: 0.3814, test_loss: 1.2677, test_f1: 0.6304
 epoch: 80, train_loss: 0.3712, test_loss: 1.3462, test_f1: 0.6320
 epoch: 81, train_loss: 0.3359, test_loss: 1.5221, test_f1: 0.6236
 epoch: 82, train_loss: 0.3411, test_loss: 1.4477, test_f1: 0.6285
 epoch: 83, train_loss: 0.3447, test_loss: 1.3748, test_f1: 0.6465
 epoch: 84, train_loss: 0.3305, test_loss: 1.7526, test_f1: 0.5985
 epoch: 85, train_loss: 0.3290, test_loss: 1.5256, test_f1: 0.6160
 epoch: 86, train_loss: 0.3456, test_loss: 1.5177, test_f1: 0.6462
 epoch: 87, train_loss: 0.3346, test_loss: 1.5518, test_f1: 0.6389
 epoch: 88, train_loss: 0.3621, test_loss: 1.6229, test_f1: 0.6632
 epoch: 89, train_loss: 0.3426, test_loss: 1.3089, test_f1: 0.6577
 epoch: 90, train_loss: 0.3328, test_loss: 1.1942, test_f1: 0.6727
 epoch: 91, train_loss: 0.3450, test_loss: 1.5563, test_f1: 0.6598
 epoch: 92, train_loss: 0.3208, test_loss: 1.3325, test_f1: 0.6658
 epoch: 93, train_loss: 0.3206, test_loss: 1.4119, test_f1: 0.6605
 epoch: 94, train_loss: 0.3279, test_loss: 1.4526, test_f1: 0.6467
 epoch: 95, train_loss: 0.3107, test_loss: 1.6351, test_f1: 0.6699
 epoch: 96, train_loss: 0.3141, test_loss: 1.6340, test_f1: 0.6583
 epoch: 97, train_loss: 0.2911, test_loss: 1.8042, test_f1: 0.6709
 epoch: 98, train_loss: 0.3201, test_loss: 1.5933, test_f1: 0.6576
 epoch: 99, train_loss: 0.2987, test_loss: 1.7587, test_f1: 0.6674
##################ITERATION #1 ****************************************
 epoch: 0, train_loss: 1.1545, test_loss: 1.7598, test_f1: 0.3014
 epoch: 1, train_loss: 1.0245, test_loss: 1.0196, test_f1: 0.4296
 epoch: 2, train_loss: 0.9812, test_loss: 1.0841, test_f1: 0.4361
 epoch: 3, train_loss: 0.9586, test_loss: 0.9756, test_f1: 0.5707
 epoch: 4, train_loss: 0.9201, test_loss: 0.9875, test_f1: 0.5000
 epoch: 5, train_loss: 0.9059, test_loss: 0.8502, test_f1: 0.5862
 epoch: 6, train_loss: 0.9049, test_loss: 1.0944, test_f1: 0.4588
 epoch: 7, train_loss: 0.8666, test_loss: 0.8791, test_f1: 0.5890
 epoch: 8, train_loss: 0.8405, test_loss: 0.9313, test_f1: 0.5866
 epoch: 9, train_loss: 0.8610, test_loss: 0.8602, test_f1: 0.5288
 epoch: 10, train_loss: 0.8251, test_loss: 0.8970, test_f1: 0.5438
 epoch: 11, train_loss: 0.8086, test_loss: 0.9374, test_f1: 0.5683
 epoch: 12, train_loss: 0.8052, test_loss: 0.8739, test_f1: 0.5719
 epoch: 13, train_loss: 0.7918, test_loss: 0.9451, test_f1: 0.5067
 epoch: 14, train_loss: 0.7708, test_loss: 0.8584, test_f1: 0.5890
 epoch: 15, train_loss: 0.7536, test_loss: 0.8278, test_f1: 0.5375
 epoch: 16, train_loss: 0.7433, test_loss: 0.9999, test_f1: 0.5498
 epoch: 17, train_loss: 0.7151, test_loss: 1.0775, test_f1: 0.5878
 epoch: 18, train_loss: 0.7414, test_loss: 0.9693, test_f1: 0.5359
 epoch: 19, train_loss: 0.7323, test_loss: 0.9566, test_f1: 0.5933
 epoch: 20, train_loss: 0.7081, test_loss: 0.8258, test_f1: 0.5972
 epoch: 21, train_loss: 0.6929, test_loss: 0.9379, test_f1: 0.5818
 epoch: 22, train_loss: 0.7050, test_loss: 0.8773, test_f1: 0.6222
 epoch: 23, train_loss: 0.6876, test_loss: 1.4420, test_f1: 0.4587
 epoch: 24, train_loss: 0.6902, test_loss: 0.8451, test_f1: 0.5551
 epoch: 25, train_loss: 0.6763, test_loss: 0.9913, test_f1: 0.5417
 epoch: 26, train_loss: 0.6594, test_loss: 0.9083, test_f1: 0.6024
 epoch: 27, train_loss: 0.6611, test_loss: 0.9204, test_f1: 0.5905
 epoch: 28, train_loss: 0.6717, test_loss: 0.8918, test_f1: 0.6216
 epoch: 29, train_loss: 0.6522, test_loss: 0.8269, test_f1: 0.6062
 epoch: 30, train_loss: 0.6330, test_loss: 1.1709, test_f1: 0.6303
 epoch: 31, train_loss: 0.6492, test_loss: 0.9194, test_f1: 0.6151
 epoch: 32, train_loss: 0.6305, test_loss: 1.0850, test_f1: 0.6068
 epoch: 33, train_loss: 0.6501, test_loss: 1.0940, test_f1: 0.6067
 epoch: 34, train_loss: 0.6338, test_loss: 1.0903, test_f1: 0.6143
 epoch: 35, train_loss: 0.6150, test_loss: 0.9675, test_f1: 0.6346
 epoch: 36, train_loss: 0.6069, test_loss: 1.1058, test_f1: 0.5588
 epoch: 37, train_loss: 0.6181, test_loss: 0.8379, test_f1: 0.6315
 epoch: 38, train_loss: 0.5945, test_loss: 1.2868, test_f1: 0.5933
 epoch: 39, train_loss: 0.6060, test_loss: 0.8811, test_f1: 0.6140
 epoch: 40, train_loss: 0.5894, test_loss: 0.8811, test_f1: 0.6226
 epoch: 41, train_loss: 0.5840, test_loss: 0.8616, test_f1: 0.6549
 epoch: 42, train_loss: 0.5675, test_loss: 1.0747, test_f1: 0.6160
 epoch: 43, train_loss: 0.5547, test_loss: 0.9294, test_f1: 0.6743
 epoch: 44, train_loss: 0.5393, test_loss: 1.1435, test_f1: 0.6632
 epoch: 45, train_loss: 0.5321, test_loss: 0.9963, test_f1: 0.6497
 epoch: 46, train_loss: 0.5330, test_loss: 1.2499, test_f1: 0.6425
 epoch: 47, train_loss: 0.5396, test_loss: 1.0802, test_f1: 0.6287
 epoch: 48, train_loss: 0.5411, test_loss: 0.9787, test_f1: 0.6372
 epoch: 49, train_loss: 0.5278, test_loss: 1.0995, test_f1: 0.6796
 epoch: 50, train_loss: 0.5270, test_loss: 1.1022, test_f1: 0.6533
 epoch: 51, train_loss: 0.4877, test_loss: 1.0477, test_f1: 0.6441
 epoch: 52, train_loss: 0.4732, test_loss: 1.0001, test_f1: 0.6940
 epoch: 53, train_loss: 0.4353, test_loss: 1.0869, test_f1: 0.6678
 epoch: 54, train_loss: 0.4087, test_loss: 0.9982, test_f1: 0.6887
 epoch: 55, train_loss: 0.4182, test_loss: 1.1468, test_f1: 0.6864
 epoch: 56, train_loss: 0.4266, test_loss: 1.1617, test_f1: 0.6542
 epoch: 57, train_loss: 0.4002, test_loss: 1.1369, test_f1: 0.6607
 epoch: 58, train_loss: 0.4005, test_loss: 1.0476, test_f1: 0.6640
 epoch: 59, train_loss: 0.3959, test_loss: 1.2297, test_f1: 0.6829
 epoch: 60, train_loss: 0.4097, test_loss: 1.1320, test_f1: 0.6842
 epoch: 61, train_loss: 0.4032, test_loss: 1.0702, test_f1: 0.6736
 epoch: 62, train_loss: 0.3786, test_loss: 1.0468, test_f1: 0.6744
 epoch: 63, train_loss: 0.3789, test_loss: 1.0877, test_f1: 0.6773
 epoch: 64, train_loss: 0.3902, test_loss: 1.1809, test_f1: 0.6877
 epoch: 65, train_loss: 0.3594, test_loss: 1.2982, test_f1: 0.7175
 epoch: 66, train_loss: 0.3648, test_loss: 1.4078, test_f1: 0.6450
 epoch: 67, train_loss: 0.3876, test_loss: 1.2602, test_f1: 0.6637
 epoch: 68, train_loss: 0.3728, test_loss: 1.2640, test_f1: 0.6979
 epoch: 69, train_loss: 0.3603, test_loss: 1.3152, test_f1: 0.6659
 epoch: 70, train_loss: 0.3515, test_loss: 1.1398, test_f1: 0.6812
 epoch: 71, train_loss: 0.3673, test_loss: 1.3060, test_f1: 0.6551
 epoch: 72, train_loss: 0.3611, test_loss: 1.2073, test_f1: 0.6835
 epoch: 73, train_loss: 0.3393, test_loss: 1.3487, test_f1: 0.6927
 epoch: 74, train_loss: 0.3614, test_loss: 1.0154, test_f1: 0.7106
 epoch: 75, train_loss: 0.3425, test_loss: 1.2418, test_f1: 0.7077
 epoch: 76, train_loss: 0.3405, test_loss: 1.2104, test_f1: 0.6672
 epoch: 77, train_loss: 0.3401, test_loss: 1.1464, test_f1: 0.6759
 epoch: 78, train_loss: 0.3175, test_loss: 1.0899, test_f1: 0.6855
 epoch: 79, train_loss: 0.3287, test_loss: 1.3161, test_f1: 0.6858
 epoch: 80, train_loss: 0.3055, test_loss: 1.1359, test_f1: 0.6731
 epoch: 81, train_loss: 0.3174, test_loss: 0.9751, test_f1: 0.6925
 epoch: 82, train_loss: 0.3215, test_loss: 1.3315, test_f1: 0.6528
 epoch: 83, train_loss: 0.3057, test_loss: 1.3617, test_f1: 0.6796
 epoch: 84, train_loss: 0.3343, test_loss: 1.1596, test_f1: 0.6703
 epoch: 85, train_loss: 0.3191, test_loss: 1.1531, test_f1: 0.6815
 epoch: 86, train_loss: 0.3256, test_loss: 1.4302, test_f1: 0.6597
 epoch: 87, train_loss: 0.2796, test_loss: 1.5833, test_f1: 0.6968
 epoch: 88, train_loss: 0.3060, test_loss: 1.4194, test_f1: 0.6880
 epoch: 89, train_loss: 0.2743, test_loss: 1.2371, test_f1: 0.6717
 epoch: 90, train_loss: 0.2835, test_loss: 1.1461, test_f1: 0.6713
 epoch: 91, train_loss: 0.2667, test_loss: 1.3733, test_f1: 0.6544
 epoch: 92, train_loss: 0.2972, test_loss: 1.1245, test_f1: 0.6855
 epoch: 93, train_loss: 0.2836, test_loss: 1.1343, test_f1: 0.6900
 epoch: 94, train_loss: 0.2893, test_loss: 1.2730, test_f1: 0.6960
 epoch: 95, train_loss: 0.2928, test_loss: 1.4757, test_f1: 0.6707
 epoch: 96, train_loss: 0.2703, test_loss: 1.3470, test_f1: 0.6734
 epoch: 97, train_loss: 0.2996, test_loss: 1.2059, test_f1: 0.6674
 epoch: 98, train_loss: 0.2835, test_loss: 1.0573, test_f1: 0.7059
 epoch: 99, train_loss: 0.2601, test_loss: 1.1762, test_f1: 0.6813
##################ITERATION #2 ****************************************
 epoch: 0, train_loss: 1.2274, test_loss: 1.1235, test_f1: 0.4148
 epoch: 1, train_loss: 0.9721, test_loss: 1.0019, test_f1: 0.4399
 epoch: 2, train_loss: 0.9407, test_loss: 0.9528, test_f1: 0.4759
 epoch: 3, train_loss: 0.9067, test_loss: 1.0777, test_f1: 0.5071
 epoch: 4, train_loss: 0.8861, test_loss: 0.9027, test_f1: 0.5165
 epoch: 5, train_loss: 0.8840, test_loss: 0.9945, test_f1: 0.5194
 epoch: 6, train_loss: 0.8608, test_loss: 0.8536, test_f1: 0.5134
 epoch: 7, train_loss: 0.8462, test_loss: 6.8168, test_f1: 0.4777
 epoch: 8, train_loss: 0.8313, test_loss: 0.8441, test_f1: 0.5180
 epoch: 9, train_loss: 0.8059, test_loss: 0.9371, test_f1: 0.5180
 epoch: 10, train_loss: 0.8017, test_loss: 0.8949, test_f1: 0.5375
 epoch: 11, train_loss: 0.7889, test_loss: 0.8266, test_f1: 0.5982
 epoch: 12, train_loss: 0.7767, test_loss: 0.8604, test_f1: 0.5509
 epoch: 13, train_loss: 0.7973, test_loss: 0.8658, test_f1: 0.5575
 epoch: 14, train_loss: 0.7508, test_loss: 0.9834, test_f1: 0.5206
 epoch: 15, train_loss: 0.7755, test_loss: 0.7925, test_f1: 0.5646
 epoch: 16, train_loss: 0.7388, test_loss: 0.8585, test_f1: 0.5401
 epoch: 17, train_loss: 0.7317, test_loss: 1.0494, test_f1: 0.5057
 epoch: 18, train_loss: 0.7152, test_loss: 1.0624, test_f1: 0.5460
 epoch: 19, train_loss: 0.7130, test_loss: 0.7659, test_f1: 0.5839
 epoch: 20, train_loss: 0.7275, test_loss: 0.7877, test_f1: 0.5982
 epoch: 21, train_loss: 0.7246, test_loss: 0.8449, test_f1: 0.5416
 epoch: 22, train_loss: 0.7264, test_loss: 0.8900, test_f1: 0.5335
 epoch: 23, train_loss: 0.7090, test_loss: 0.7444, test_f1: 0.6075
 epoch: 24, train_loss: 0.7038, test_loss: 0.7826, test_f1: 0.6101
 epoch: 25, train_loss: 0.6600, test_loss: 0.8436, test_f1: 0.6075
 epoch: 26, train_loss: 0.6616, test_loss: 0.8230, test_f1: 0.5851
 epoch: 27, train_loss: 0.7436, test_loss: 0.7988, test_f1: 0.5529
 epoch: 28, train_loss: 0.6796, test_loss: 0.8434, test_f1: 0.5826
 epoch: 29, train_loss: 0.6763, test_loss: 0.8094, test_f1: 0.6375
 epoch: 30, train_loss: 0.6462, test_loss: 0.7383, test_f1: 0.6055
 epoch: 31, train_loss: 0.6385, test_loss: 0.8340, test_f1: 0.6284
 epoch: 32, train_loss: 0.6438, test_loss: 0.8152, test_f1: 0.6632
 epoch: 33, train_loss: 0.6249, test_loss: 0.8462, test_f1: 0.5870
 epoch: 34, train_loss: 0.6268, test_loss: 0.8896, test_f1: 0.5656
 epoch: 35, train_loss: 0.6167, test_loss: 0.8466, test_f1: 0.6431
 epoch: 36, train_loss: 0.6072, test_loss: 0.9124, test_f1: 0.6403
 epoch: 37, train_loss: 0.6157, test_loss: 0.9580, test_f1: 0.5942
 epoch: 38, train_loss: 0.5908, test_loss: 0.6992, test_f1: 0.6339
 epoch: 39, train_loss: 0.5774, test_loss: 0.7954, test_f1: 0.6590
 epoch: 40, train_loss: 0.5898, test_loss: 0.8526, test_f1: 0.6339
 epoch: 41, train_loss: 0.5702, test_loss: 0.9674, test_f1: 0.6135
 epoch: 42, train_loss: 0.5620, test_loss: 0.9790, test_f1: 0.6043
 epoch: 43, train_loss: 0.5723, test_loss: 1.3154, test_f1: 0.6034
 epoch: 44, train_loss: 0.5652, test_loss: 0.8185, test_f1: 0.6236
 epoch: 45, train_loss: 0.5343, test_loss: 0.7638, test_f1: 0.6723
 epoch: 46, train_loss: 0.5501, test_loss: 1.0793, test_f1: 0.6127
 epoch: 47, train_loss: 0.5561, test_loss: 0.8100, test_f1: 0.6245
 epoch: 48, train_loss: 0.5321, test_loss: 0.8709, test_f1: 0.6330
 epoch: 49, train_loss: 0.5159, test_loss: 0.7882, test_f1: 0.6542
 epoch: 50, train_loss: 0.5279, test_loss: 0.9448, test_f1: 0.6059
 epoch: 51, train_loss: 0.4898, test_loss: 0.9550, test_f1: 0.6202
 epoch: 52, train_loss: 0.4508, test_loss: 0.9468, test_f1: 0.6892
 epoch: 53, train_loss: 0.4481, test_loss: 0.8649, test_f1: 0.6505
 epoch: 54, train_loss: 0.4255, test_loss: 1.3668, test_f1: 0.6354
 epoch: 55, train_loss: 0.4373, test_loss: 1.0289, test_f1: 0.6400
 epoch: 56, train_loss: 0.4211, test_loss: 0.9498, test_f1: 0.6611
 epoch: 57, train_loss: 0.4087, test_loss: 1.1410, test_f1: 0.6363
 epoch: 58, train_loss: 0.4298, test_loss: 1.2541, test_f1: 0.6488
 epoch: 59, train_loss: 0.4144, test_loss: 0.8985, test_f1: 0.6544
 epoch: 60, train_loss: 0.4112, test_loss: 0.9479, test_f1: 0.6640
 epoch: 61, train_loss: 0.3829, test_loss: 1.1335, test_f1: 0.6467
 epoch: 62, train_loss: 0.4055, test_loss: 0.8801, test_f1: 0.6296
 epoch: 63, train_loss: 0.3943, test_loss: 0.9945, test_f1: 0.6501
 epoch: 64, train_loss: 0.3979, test_loss: 1.0200, test_f1: 0.6435
 epoch: 65, train_loss: 0.3958, test_loss: 0.9699, test_f1: 0.6570
 epoch: 66, train_loss: 0.3849, test_loss: 1.0676, test_f1: 0.6439
 epoch: 67, train_loss: 0.3665, test_loss: 1.0466, test_f1: 0.6523
 epoch: 68, train_loss: 0.4020, test_loss: 1.2648, test_f1: 0.6411
 epoch: 69, train_loss: 0.3682, test_loss: 1.2662, test_f1: 0.6608
 epoch: 70, train_loss: 0.3727, test_loss: 1.3424, test_f1: 0.6386
 epoch: 71, train_loss: 0.3532, test_loss: 1.1557, test_f1: 0.6583
 epoch: 72, train_loss: 0.3809, test_loss: 0.9491, test_f1: 0.6617
 epoch: 73, train_loss: 0.3724, test_loss: 1.0842, test_f1: 0.6706
 epoch: 74, train_loss: 0.3526, test_loss: 1.0118, test_f1: 0.6781
 epoch: 75, train_loss: 0.3433, test_loss: 0.9211, test_f1: 0.6873
 epoch: 76, train_loss: 0.3479, test_loss: 1.1562, test_f1: 0.6741
 epoch: 77, train_loss: 0.3544, test_loss: 0.9518, test_f1: 0.6517
 epoch: 78, train_loss: 0.3401, test_loss: 1.1757, test_f1: 0.6482
 epoch: 79, train_loss: 0.3404, test_loss: 1.5762, test_f1: 0.6547
 epoch: 80, train_loss: 0.3526, test_loss: 1.0851, test_f1: 0.6667
 epoch: 81, train_loss: 0.3330, test_loss: 1.3127, test_f1: 0.6453
 epoch: 82, train_loss: 0.3464, test_loss: 0.9906, test_f1: 0.6673
 epoch: 83, train_loss: 0.3353, test_loss: 1.0591, test_f1: 0.6494
 epoch: 84, train_loss: 0.3199, test_loss: 1.1830, test_f1: 0.6789
 epoch: 85, train_loss: 0.3372, test_loss: 1.0663, test_f1: 0.6606
 epoch: 86, train_loss: 0.3198, test_loss: 1.1006, test_f1: 0.6650
 epoch: 87, train_loss: 0.3157, test_loss: 1.0548, test_f1: 0.6711
 epoch: 88, train_loss: 0.3198, test_loss: 1.1847, test_f1: 0.6780
 epoch: 89, train_loss: 0.3215, test_loss: 1.1687, test_f1: 0.6742
 epoch: 90, train_loss: 0.2964, test_loss: 1.1850, test_f1: 0.6733
 epoch: 91, train_loss: 0.3065, test_loss: 1.2341, test_f1: 0.6677
 epoch: 92, train_loss: 0.2990, test_loss: 1.0759, test_f1: 0.6709
 epoch: 93, train_loss: 0.2941, test_loss: 1.5786, test_f1: 0.6485
 epoch: 94, train_loss: 0.2974, test_loss: 1.0665, test_f1: 0.6540
 epoch: 95, train_loss: 0.2979, test_loss: 1.0916, test_f1: 0.6708
 epoch: 96, train_loss: 0.3068, test_loss: 1.0339, test_f1: 0.6646
 epoch: 97, train_loss: 0.2972, test_loss: 1.3542, test_f1: 0.6601
 epoch: 98, train_loss: 0.2792, test_loss: 1.2089, test_f1: 0.6636
 epoch: 99, train_loss: 0.2967, test_loss: 1.1435, test_f1: 0.6569
##################ITERATION #3 ****************************************
 epoch: 0, train_loss: 1.1760, test_loss: 1.0453, test_f1: 0.4768
 epoch: 1, train_loss: 0.9948, test_loss: 1.0839, test_f1: 0.5018
 epoch: 2, train_loss: 0.9508, test_loss: 1.1602, test_f1: 0.4669
 epoch: 3, train_loss: 0.9411, test_loss: 0.9326, test_f1: 0.5273
 epoch: 4, train_loss: 0.9220, test_loss: 0.8803, test_f1: 0.5160
 epoch: 5, train_loss: 0.8836, test_loss: 0.9840, test_f1: 0.4921
 epoch: 6, train_loss: 0.8917, test_loss: 0.9880, test_f1: 0.4955
 epoch: 7, train_loss: 0.8835, test_loss: 1.5031, test_f1: 0.4354
 epoch: 8, train_loss: 0.8706, test_loss: 1.0358, test_f1: 0.5423
 epoch: 9, train_loss: 0.8698, test_loss: 0.9724, test_f1: 0.5235
 epoch: 10, train_loss: 0.8477, test_loss: 0.8463, test_f1: 0.5287
 epoch: 11, train_loss: 0.8451, test_loss: 1.0297, test_f1: 0.5320
 epoch: 12, train_loss: 0.8304, test_loss: 0.8438, test_f1: 0.5294
 epoch: 13, train_loss: 0.8212, test_loss: 1.0109, test_f1: 0.5550
 epoch: 14, train_loss: 0.7989, test_loss: 0.7994, test_f1: 0.5490
 epoch: 15, train_loss: 0.7978, test_loss: 0.8696, test_f1: 0.5579
 epoch: 16, train_loss: 0.7994, test_loss: 0.9654, test_f1: 0.4840
 epoch: 17, train_loss: 0.7822, test_loss: 0.9681, test_f1: 0.5674
 epoch: 18, train_loss: 0.7659, test_loss: 0.8237, test_f1: 0.5944
 epoch: 19, train_loss: 0.7606, test_loss: 0.9905, test_f1: 0.5060
 epoch: 20, train_loss: 0.7654, test_loss: 1.0039, test_f1: 0.5436
 epoch: 21, train_loss: 0.7264, test_loss: 2.4634, test_f1: 0.3914
 epoch: 22, train_loss: 0.7452, test_loss: 1.2785, test_f1: 0.5225
 epoch: 23, train_loss: 0.7409, test_loss: 0.8173, test_f1: 0.5576
 epoch: 24, train_loss: 0.7389, test_loss: 1.0668, test_f1: 0.5936
 epoch: 25, train_loss: 0.7287, test_loss: 0.9608, test_f1: 0.5626
 epoch: 26, train_loss: 0.6964, test_loss: 1.0936, test_f1: 0.5458
 epoch: 27, train_loss: 0.7069, test_loss: 0.9599, test_f1: 0.5471
 epoch: 28, train_loss: 0.7018, test_loss: 0.9769, test_f1: 0.5483
 epoch: 29, train_loss: 0.6935, test_loss: 0.9029, test_f1: 0.5404
 epoch: 30, train_loss: 0.6735, test_loss: 1.0297, test_f1: 0.6216
 epoch: 31, train_loss: 0.6782, test_loss: 1.0455, test_f1: 0.5705
 epoch: 32, train_loss: 0.7046, test_loss: 0.8868, test_f1: 0.6207
 epoch: 33, train_loss: 0.6900, test_loss: 0.9797, test_f1: 0.5966
 epoch: 34, train_loss: 0.6527, test_loss: 1.1901, test_f1: 0.6376
 epoch: 35, train_loss: 0.6494, test_loss: 0.8915, test_f1: 0.6439
 epoch: 36, train_loss: 0.6269, test_loss: 0.9305, test_f1: 0.6090
 epoch: 37, train_loss: 0.6246, test_loss: 0.9218, test_f1: 0.6014
 epoch: 38, train_loss: 0.6391, test_loss: 1.1852, test_f1: 0.6046
 epoch: 39, train_loss: 0.6066, test_loss: 1.1918, test_f1: 0.5847
 epoch: 40, train_loss: 0.6128, test_loss: 0.8735, test_f1: 0.6563
 epoch: 41, train_loss: 0.5959, test_loss: 1.2262, test_f1: 0.6474
 epoch: 42, train_loss: 0.6264, test_loss: 1.1900, test_f1: 0.6566
 epoch: 43, train_loss: 0.5919, test_loss: 1.1646, test_f1: 0.6301
 epoch: 44, train_loss: 0.6024, test_loss: 1.2305, test_f1: 0.6054
 epoch: 45, train_loss: 0.5902, test_loss: 1.4083, test_f1: 0.5114
 epoch: 46, train_loss: 0.5791, test_loss: 1.2050, test_f1: 0.6487
 epoch: 47, train_loss: 0.5823, test_loss: 1.2349, test_f1: 0.6274
 epoch: 48, train_loss: 0.6007, test_loss: 1.3753, test_f1: 0.6298
 epoch: 49, train_loss: 0.5677, test_loss: 1.1378, test_f1: 0.6634
 epoch: 50, train_loss: 0.5524, test_loss: 1.1944, test_f1: 0.6534
 epoch: 51, train_loss: 0.5235, test_loss: 1.3748, test_f1: 0.6488
 epoch: 52, train_loss: 0.4966, test_loss: 1.3617, test_f1: 0.6406
 epoch: 53, train_loss: 0.4711, test_loss: 1.5054, test_f1: 0.6722
 epoch: 54, train_loss: 0.4684, test_loss: 1.2256, test_f1: 0.6268
 epoch: 55, train_loss: 0.4595, test_loss: 1.2842, test_f1: 0.6670
 epoch: 56, train_loss: 0.4513, test_loss: 1.0614, test_f1: 0.6799
 epoch: 57, train_loss: 0.4632, test_loss: 1.0610, test_f1: 0.6683
 epoch: 58, train_loss: 0.4463, test_loss: 1.2510, test_f1: 0.6787
 epoch: 59, train_loss: 0.4329, test_loss: 1.0977, test_f1: 0.6707
 epoch: 60, train_loss: 0.4475, test_loss: 1.4601, test_f1: 0.6401
 epoch: 61, train_loss: 0.4286, test_loss: 1.3487, test_f1: 0.6628
 epoch: 62, train_loss: 0.4348, test_loss: 1.3542, test_f1: 0.6360
 epoch: 63, train_loss: 0.4324, test_loss: 1.2620, test_f1: 0.6478
 epoch: 64, train_loss: 0.4289, test_loss: 1.3182, test_f1: 0.6503
 epoch: 65, train_loss: 0.3918, test_loss: 1.3312, test_f1: 0.6819
 epoch: 66, train_loss: 0.4070, test_loss: 1.2191, test_f1: 0.6829
 epoch: 67, train_loss: 0.4088, test_loss: 1.4357, test_f1: 0.6573
 epoch: 68, train_loss: 0.4030, test_loss: 1.3437, test_f1: 0.6739
 epoch: 69, train_loss: 0.4064, test_loss: 1.3201, test_f1: 0.6667
 epoch: 70, train_loss: 0.3915, test_loss: 1.2196, test_f1: 0.6507
 epoch: 71, train_loss: 0.3807, test_loss: 1.4274, test_f1: 0.6693
 epoch: 72, train_loss: 0.3743, test_loss: 1.3009, test_f1: 0.6815
 epoch: 73, train_loss: 0.3764, test_loss: 1.3087, test_f1: 0.6589
 epoch: 74, train_loss: 0.3837, test_loss: 1.1100, test_f1: 0.6690
 epoch: 75, train_loss: 0.3902, test_loss: 1.4074, test_f1: 0.6709
 epoch: 76, train_loss: 0.3767, test_loss: 1.4162, test_f1: 0.6542
 epoch: 77, train_loss: 0.3661, test_loss: 1.5930, test_f1: 0.6395
 epoch: 78, train_loss: 0.3824, test_loss: 1.7158, test_f1: 0.6429
 epoch: 79, train_loss: 0.3675, test_loss: 1.3573, test_f1: 0.6711
 epoch: 80, train_loss: 0.3679, test_loss: 1.3944, test_f1: 0.6822
 epoch: 81, train_loss: 0.3767, test_loss: 1.5616, test_f1: 0.6598
 epoch: 82, train_loss: 0.3567, test_loss: 1.4514, test_f1: 0.6845
 epoch: 83, train_loss: 0.3462, test_loss: 1.3842, test_f1: 0.6654
 epoch: 84, train_loss: 0.3567, test_loss: 1.5384, test_f1: 0.6574
 epoch: 85, train_loss: 0.3534, test_loss: 1.5112, test_f1: 0.6582
 epoch: 86, train_loss: 0.3663, test_loss: 1.7755, test_f1: 0.6594
 epoch: 87, train_loss: 0.3390, test_loss: 1.5254, test_f1: 0.6543
 epoch: 88, train_loss: 0.3497, test_loss: 1.3133, test_f1: 0.6793
 epoch: 89, train_loss: 0.3373, test_loss: 1.4654, test_f1: 0.6725
 epoch: 90, train_loss: 0.3384, test_loss: 1.5053, test_f1: 0.6617
 epoch: 91, train_loss: 0.3206, test_loss: 1.5413, test_f1: 0.6610
 epoch: 92, train_loss: 0.3138, test_loss: 1.6159, test_f1: 0.6504
 epoch: 93, train_loss: 0.3272, test_loss: 1.7469, test_f1: 0.6380
 epoch: 94, train_loss: 0.3359, test_loss: 1.6975, test_f1: 0.6661
 epoch: 95, train_loss: 0.3119, test_loss: 1.4720, test_f1: 0.6713
 epoch: 96, train_loss: 0.3214, test_loss: 1.4100, test_f1: 0.6287
 epoch: 97, train_loss: 0.3539, test_loss: 1.5174, test_f1: 0.6547
 epoch: 98, train_loss: 0.3083, test_loss: 1.6237, test_f1: 0.6662
 epoch: 99, train_loss: 0.2893, test_loss: 1.5375, test_f1: 0.6851
##################ITERATION #4 ****************************************
 epoch: 0, train_loss: 1.2327, test_loss: 1.0955, test_f1: 0.4440
 epoch: 1, train_loss: 0.9933, test_loss: 1.0105, test_f1: 0.4041
 epoch: 2, train_loss: 0.9382, test_loss: 1.0238, test_f1: 0.4830
 epoch: 3, train_loss: 0.9407, test_loss: 0.9381, test_f1: 0.5282
 epoch: 4, train_loss: 0.9214, test_loss: 0.9312, test_f1: 0.5158
 epoch: 5, train_loss: 0.8768, test_loss: 1.0761, test_f1: 0.5113
 epoch: 6, train_loss: 0.8721, test_loss: 0.8648, test_f1: 0.5668
 epoch: 7, train_loss: 0.8486, test_loss: 0.9075, test_f1: 0.5501
 epoch: 8, train_loss: 0.8488, test_loss: 0.8817, test_f1: 0.5600
 epoch: 9, train_loss: 0.8281, test_loss: 0.8607, test_f1: 0.5545
 epoch: 10, train_loss: 0.8048, test_loss: 0.9265, test_f1: 0.5528
 epoch: 11, train_loss: 0.8072, test_loss: 0.8863, test_f1: 0.5640
 epoch: 12, train_loss: 0.7938, test_loss: 0.9440, test_f1: 0.5467
 epoch: 13, train_loss: 0.7831, test_loss: 0.9957, test_f1: 0.5504
 epoch: 14, train_loss: 0.7861, test_loss: 0.9802, test_f1: 0.6146
 epoch: 15, train_loss: 0.7652, test_loss: 0.8715, test_f1: 0.5768
 epoch: 16, train_loss: 0.7427, test_loss: 1.0104, test_f1: 0.5145
 epoch: 17, train_loss: 0.7518, test_loss: 1.1449, test_f1: 0.5776
 epoch: 18, train_loss: 0.7390, test_loss: 0.9249, test_f1: 0.6238
 epoch: 19, train_loss: 0.7437, test_loss: 1.2907, test_f1: 0.5871
 epoch: 20, train_loss: 0.7160, test_loss: 0.8395, test_f1: 0.6191
 epoch: 21, train_loss: 0.7612, test_loss: 0.8959, test_f1: 0.5980
 epoch: 22, train_loss: 0.7226, test_loss: 1.0715, test_f1: 0.6095
 epoch: 23, train_loss: 0.6964, test_loss: 1.1480, test_f1: 0.6080
 epoch: 24, train_loss: 0.6857, test_loss: 0.8578, test_f1: 0.6206
 epoch: 25, train_loss: 0.6892, test_loss: 1.0174, test_f1: 0.5974
 epoch: 26, train_loss: 0.7022, test_loss: 0.7777, test_f1: 0.6577
 epoch: 27, train_loss: 0.6987, test_loss: 1.0814, test_f1: 0.6292
 epoch: 28, train_loss: 0.6673, test_loss: 1.0446, test_f1: 0.6018
 epoch: 29, train_loss: 0.6751, test_loss: 1.4297, test_f1: 0.4890
 epoch: 30, train_loss: 0.6504, test_loss: 1.0387, test_f1: 0.6656
 epoch: 31, train_loss: 0.6698, test_loss: 1.0476, test_f1: 0.6509
 epoch: 32, train_loss: 0.6267, test_loss: 0.9054, test_f1: 0.6487
 epoch: 33, train_loss: 0.6384, test_loss: 0.9794, test_f1: 0.6507
 epoch: 34, train_loss: 0.6217, test_loss: 0.9491, test_f1: 0.6637
 epoch: 35, train_loss: 0.6150, test_loss: 1.0663, test_f1: 0.6488
 epoch: 36, train_loss: 0.6074, test_loss: 1.0013, test_f1: 0.6594
 epoch: 37, train_loss: 0.6255, test_loss: 0.9077, test_f1: 0.6422
 epoch: 38, train_loss: 0.6344, test_loss: 1.1070, test_f1: 0.6464
 epoch: 39, train_loss: 0.6315, test_loss: 0.8563, test_f1: 0.6196
 epoch: 40, train_loss: 0.6221, test_loss: 1.0767, test_f1: 0.6071
 epoch: 41, train_loss: 0.6222, test_loss: 0.8531, test_f1: 0.6210
 epoch: 42, train_loss: 0.5888, test_loss: 0.9528, test_f1: 0.6830
 epoch: 43, train_loss: 0.5973, test_loss: 0.7715, test_f1: 0.6554
 epoch: 44, train_loss: 0.5795, test_loss: 1.0228, test_f1: 0.6309
 epoch: 45, train_loss: 0.5711, test_loss: 1.1248, test_f1: 0.6569
 epoch: 46, train_loss: 0.5685, test_loss: 1.1211, test_f1: 0.6597
 epoch: 47, train_loss: 0.5804, test_loss: 0.8833, test_f1: 0.6443
 epoch: 48, train_loss: 0.5903, test_loss: 1.0604, test_f1: 0.6383
 epoch: 49, train_loss: 0.5828, test_loss: 1.0038, test_f1: 0.6790
 epoch: 50, train_loss: 0.5439, test_loss: 1.0369, test_f1: 0.6475
 epoch: 51, train_loss: 0.4901, test_loss: 1.0243, test_f1: 0.6976
 epoch: 52, train_loss: 0.4666, test_loss: 1.0264, test_f1: 0.6850
 epoch: 53, train_loss: 0.4639, test_loss: 0.9729, test_f1: 0.6846
 epoch: 54, train_loss: 0.4530, test_loss: 1.0424, test_f1: 0.6994
 epoch: 55, train_loss: 0.4412, test_loss: 1.1709, test_f1: 0.6894
 epoch: 56, train_loss: 0.4240, test_loss: 0.9602, test_f1: 0.6924
 epoch: 57, train_loss: 0.4211, test_loss: 1.0508, test_f1: 0.7062
 epoch: 58, train_loss: 0.4333, test_loss: 1.0986, test_f1: 0.7173
 epoch: 59, train_loss: 0.4183, test_loss: 1.1570, test_f1: 0.6945
 epoch: 60, train_loss: 0.4100, test_loss: 1.2398, test_f1: 0.7008
 epoch: 61, train_loss: 0.4596, test_loss: 1.1277, test_f1: 0.6906
 epoch: 62, train_loss: 0.4121, test_loss: 1.1273, test_f1: 0.7136
 epoch: 63, train_loss: 0.4113, test_loss: 1.2096, test_f1: 0.6622
 epoch: 64, train_loss: 0.4060, test_loss: 1.2512, test_f1: 0.6939
 epoch: 65, train_loss: 0.4137, test_loss: 1.1469, test_f1: 0.7034
 epoch: 66, train_loss: 0.3990, test_loss: 1.3348, test_f1: 0.6832
 epoch: 67, train_loss: 0.3954, test_loss: 1.2048, test_f1: 0.7008
 epoch: 68, train_loss: 0.3964, test_loss: 1.1538, test_f1: 0.7045
 epoch: 69, train_loss: 0.3868, test_loss: 1.2589, test_f1: 0.7121
 epoch: 70, train_loss: 0.3989, test_loss: 1.1824, test_f1: 0.7130
 epoch: 71, train_loss: 0.3934, test_loss: 1.4555, test_f1: 0.6739
 epoch: 72, train_loss: 0.3757, test_loss: 1.2152, test_f1: 0.7104
 epoch: 73, train_loss: 0.3750, test_loss: 1.1195, test_f1: 0.6921
 epoch: 74, train_loss: 0.3679, test_loss: 1.1708, test_f1: 0.7147
 epoch: 75, train_loss: 0.3633, test_loss: 1.4556, test_f1: 0.7015
 epoch: 76, train_loss: 0.3645, test_loss: 1.1658, test_f1: 0.6856
 epoch: 77, train_loss: 0.3532, test_loss: 1.1739, test_f1: 0.7188
 epoch: 78, train_loss: 0.3606, test_loss: 1.1049, test_f1: 0.7087
 epoch: 79, train_loss: 0.3706, test_loss: 1.0533, test_f1: 0.7099
 epoch: 80, train_loss: 0.3425, test_loss: 1.3891, test_f1: 0.6912
 epoch: 81, train_loss: 0.3590, test_loss: 1.1144, test_f1: 0.7255
 epoch: 82, train_loss: 0.3479, test_loss: 1.0627, test_f1: 0.7259
 epoch: 83, train_loss: 0.3422, test_loss: 1.2680, test_f1: 0.6759
 epoch: 84, train_loss: 0.3395, test_loss: 1.0171, test_f1: 0.7042
 epoch: 85, train_loss: 0.3136, test_loss: 1.4120, test_f1: 0.6729
 epoch: 86, train_loss: 0.3240, test_loss: 1.4862, test_f1: 0.6639
 epoch: 87, train_loss: 0.3238, test_loss: 1.1502, test_f1: 0.6983
 epoch: 88, train_loss: 0.3201, test_loss: 1.2201, test_f1: 0.6771
 epoch: 89, train_loss: 0.3262, test_loss: 0.9314, test_f1: 0.7184
 epoch: 90, train_loss: 0.3107, test_loss: 1.0769, test_f1: 0.7095
 epoch: 91, train_loss: 0.3648, test_loss: 0.8038, test_f1: 0.6862
 epoch: 92, train_loss: 0.3161, test_loss: 1.2701, test_f1: 0.6796
 epoch: 93, train_loss: 0.2973, test_loss: 1.2200, test_f1: 0.6951
 epoch: 94, train_loss: 0.3236, test_loss: 1.2559, test_f1: 0.7080
 epoch: 95, train_loss: 0.3288, test_loss: 1.1943, test_f1: 0.6955
 epoch: 96, train_loss: 0.2977, test_loss: 1.2179, test_f1: 0.6967
 epoch: 97, train_loss: 0.2930, test_loss: 1.2420, test_f1: 0.7102
 epoch: 98, train_loss: 0.2874, test_loss: 1.1252, test_f1: 0.7108
 epoch: 99, train_loss: 0.2831, test_loss: 1.2654, test_f1: 0.6779
##################ITERATION #5 ****************************************
 epoch: 0, train_loss: 1.2507, test_loss: 1.0722, test_f1: 0.4669
 epoch: 1, train_loss: 1.0072, test_loss: 0.9740, test_f1: 0.4778
 epoch: 2, train_loss: 0.9647, test_loss: 1.1133, test_f1: 0.4270
 epoch: 3, train_loss: 0.9551, test_loss: 1.0225, test_f1: 0.5033
 epoch: 4, train_loss: 0.9381, test_loss: 0.9256, test_f1: 0.5040
 epoch: 5, train_loss: 0.9120, test_loss: 1.0678, test_f1: 0.4996
 epoch: 6, train_loss: 0.9001, test_loss: 0.8725, test_f1: 0.5274
 epoch: 7, train_loss: 0.8803, test_loss: 0.9321, test_f1: 0.5225
 epoch: 8, train_loss: 0.8543, test_loss: 0.9231, test_f1: 0.5845
 epoch: 9, train_loss: 0.8582, test_loss: 0.9076, test_f1: 0.5436
 epoch: 10, train_loss: 0.8137, test_loss: 0.9687, test_f1: 0.5229
 epoch: 11, train_loss: 0.8158, test_loss: 0.9009, test_f1: 0.5413
 epoch: 12, train_loss: 0.8124, test_loss: 0.9749, test_f1: 0.5302
 epoch: 13, train_loss: 0.7941, test_loss: 0.9101, test_f1: 0.5038
 epoch: 14, train_loss: 0.7768, test_loss: 0.9212, test_f1: 0.6545
 epoch: 15, train_loss: 0.7580, test_loss: 0.9552, test_f1: 0.5943
 epoch: 16, train_loss: 0.7577, test_loss: 0.8840, test_f1: 0.6196
 epoch: 17, train_loss: 0.7354, test_loss: 0.9068, test_f1: 0.5963
 epoch: 18, train_loss: 0.7555, test_loss: 0.8961, test_f1: 0.6091
 epoch: 19, train_loss: 0.7368, test_loss: 0.9075, test_f1: 0.6056
 epoch: 20, train_loss: 0.7324, test_loss: 0.9940, test_f1: 0.5791
 epoch: 21, train_loss: 0.7234, test_loss: 1.0412, test_f1: 0.5217
 epoch: 22, train_loss: 0.7016, test_loss: 0.7703, test_f1: 0.6288
 epoch: 23, train_loss: 0.7090, test_loss: 0.8234, test_f1: 0.6244
 epoch: 24, train_loss: 0.7171, test_loss: 0.8118, test_f1: 0.6345
 epoch: 25, train_loss: 0.6931, test_loss: 0.9209, test_f1: 0.6305
 epoch: 26, train_loss: 0.6536, test_loss: 0.9647, test_f1: 0.5916
 epoch: 27, train_loss: 0.6741, test_loss: 0.8514, test_f1: 0.6179
 epoch: 28, train_loss: 0.6585, test_loss: 1.0485, test_f1: 0.5798
 epoch: 29, train_loss: 0.6731, test_loss: 0.9465, test_f1: 0.6394
 epoch: 30, train_loss: 0.6607, test_loss: 0.9482, test_f1: 0.5869
 epoch: 31, train_loss: 0.6648, test_loss: 0.9089, test_f1: 0.5948
 epoch: 32, train_loss: 0.6468, test_loss: 1.0149, test_f1: 0.6179
 epoch: 33, train_loss: 0.6297, test_loss: 0.9877, test_f1: 0.6010
 epoch: 34, train_loss: 0.6305, test_loss: 0.8880, test_f1: 0.5985
 epoch: 35, train_loss: 0.5920, test_loss: 1.0001, test_f1: 0.6175
 epoch: 36, train_loss: 0.6110, test_loss: 0.7843, test_f1: 0.6397
 epoch: 37, train_loss: 0.6138, test_loss: 1.1643, test_f1: 0.5746
 epoch: 38, train_loss: 0.6017, test_loss: 0.9213, test_f1: 0.6323
 epoch: 39, train_loss: 0.6089, test_loss: 0.8172, test_f1: 0.6161
 epoch: 40, train_loss: 0.6086, test_loss: 0.8740, test_f1: 0.6226
 epoch: 41, train_loss: 0.6026, test_loss: 0.8640, test_f1: 0.6532
 epoch: 42, train_loss: 0.5717, test_loss: 0.8877, test_f1: 0.5528
 epoch: 43, train_loss: 0.5884, test_loss: 0.8005, test_f1: 0.6786
 epoch: 44, train_loss: 0.5672, test_loss: 0.7965, test_f1: 0.6535
 epoch: 45, train_loss: 0.5639, test_loss: 0.8858, test_f1: 0.6541
 epoch: 46, train_loss: 0.5671, test_loss: 1.2303, test_f1: 0.5704
 epoch: 47, train_loss: 0.5877, test_loss: 0.7636, test_f1: 0.6516
 epoch: 48, train_loss: 0.5676, test_loss: 0.9376, test_f1: 0.6367
 epoch: 49, train_loss: 0.5556, test_loss: 0.8290, test_f1: 0.6482
 epoch: 50, train_loss: 0.5141, test_loss: 0.9006, test_f1: 0.6479
 epoch: 51, train_loss: 0.4932, test_loss: 0.8724, test_f1: 0.6278
 epoch: 52, train_loss: 0.4634, test_loss: 0.8278, test_f1: 0.6708
 epoch: 53, train_loss: 0.4488, test_loss: 0.9199, test_f1: 0.6358
 epoch: 54, train_loss: 0.4375, test_loss: 0.8873, test_f1: 0.6736
 epoch: 55, train_loss: 0.4371, test_loss: 0.8600, test_f1: 0.6729
 epoch: 56, train_loss: 0.4353, test_loss: 0.8440, test_f1: 0.6596
 epoch: 57, train_loss: 0.4368, test_loss: 0.9411, test_f1: 0.6596
 epoch: 58, train_loss: 0.4250, test_loss: 0.8675, test_f1: 0.6337
 epoch: 59, train_loss: 0.4227, test_loss: 0.8954, test_f1: 0.6956
 epoch: 60, train_loss: 0.4138, test_loss: 0.8670, test_f1: 0.6571
 epoch: 61, train_loss: 0.4179, test_loss: 0.8545, test_f1: 0.6657
 epoch: 62, train_loss: 0.3969, test_loss: 0.9078, test_f1: 0.6760
 epoch: 63, train_loss: 0.3942, test_loss: 0.9111, test_f1: 0.6650
 epoch: 64, train_loss: 0.3835, test_loss: 0.9196, test_f1: 0.6901
 epoch: 65, train_loss: 0.3776, test_loss: 0.8932, test_f1: 0.6864
 epoch: 66, train_loss: 0.3911, test_loss: 0.8189, test_f1: 0.6754
 epoch: 67, train_loss: 0.3947, test_loss: 0.9584, test_f1: 0.6593
 epoch: 68, train_loss: 0.3777, test_loss: 0.8886, test_f1: 0.6774
 epoch: 69, train_loss: 0.3790, test_loss: 0.9103, test_f1: 0.6598
 epoch: 70, train_loss: 0.3774, test_loss: 0.9090, test_f1: 0.6785
 epoch: 71, train_loss: 0.3976, test_loss: 0.8788, test_f1: 0.6545
 epoch: 72, train_loss: 0.3732, test_loss: 0.9630, test_f1: 0.6751
 epoch: 73, train_loss: 0.3511, test_loss: 1.0575, test_f1: 0.6670
 epoch: 74, train_loss: 0.3735, test_loss: 1.0666, test_f1: 0.6674
 epoch: 75, train_loss: 0.3901, test_loss: 0.8998, test_f1: 0.6684
 epoch: 76, train_loss: 0.3762, test_loss: 0.9706, test_f1: 0.6709
 epoch: 77, train_loss: 0.3483, test_loss: 0.9647, test_f1: 0.6714
 epoch: 78, train_loss: 0.3751, test_loss: 0.9385, test_f1: 0.6548
 epoch: 79, train_loss: 0.3419, test_loss: 1.0318, test_f1: 0.6689
 epoch: 80, train_loss: 0.3780, test_loss: 0.9630, test_f1: 0.6662
 epoch: 81, train_loss: 0.3520, test_loss: 1.0293, test_f1: 0.6647
 epoch: 82, train_loss: 0.3333, test_loss: 0.9326, test_f1: 0.6908
 epoch: 83, train_loss: 0.3525, test_loss: 0.9886, test_f1: 0.6626
 epoch: 84, train_loss: 0.3503, test_loss: 1.0115, test_f1: 0.6862
 epoch: 85, train_loss: 0.3492, test_loss: 1.0633, test_f1: 0.6594
 epoch: 86, train_loss: 0.3371, test_loss: 0.9871, test_f1: 0.6876
 epoch: 87, train_loss: 0.3240, test_loss: 1.0399, test_f1: 0.6717
 epoch: 88, train_loss: 0.3247, test_loss: 1.2167, test_f1: 0.6610
 epoch: 89, train_loss: 0.3456, test_loss: 1.1998, test_f1: 0.6770
 epoch: 90, train_loss: 0.3186, test_loss: 0.9750, test_f1: 0.6748
 epoch: 91, train_loss: 0.3125, test_loss: 0.9538, test_f1: 0.6766
 epoch: 92, train_loss: 0.2930, test_loss: 1.0430, test_f1: 0.6603
 epoch: 93, train_loss: 0.3070, test_loss: 1.0552, test_f1: 0.6672
 epoch: 94, train_loss: 0.3216, test_loss: 1.1470, test_f1: 0.6727
 epoch: 95, train_loss: 0.3069, test_loss: 1.0987, test_f1: 0.6622
 epoch: 96, train_loss: 0.3365, test_loss: 1.0565, test_f1: 0.6914
 epoch: 97, train_loss: 0.3331, test_loss: 0.9676, test_f1: 0.6788
 epoch: 98, train_loss: 0.3163, test_loss: 1.0782, test_f1: 0.6720
 epoch: 99, train_loss: 0.3171, test_loss: 1.0629, test_f1: 0.6748
##################ITERATION #6 ****************************************
 epoch: 0, train_loss: 1.1848, test_loss: 1.3501, test_f1: 0.3131
 epoch: 1, train_loss: 1.0152, test_loss: 1.0719, test_f1: 0.4437
 epoch: 2, train_loss: 0.9832, test_loss: 0.9970, test_f1: 0.4637
 epoch: 3, train_loss: 0.9632, test_loss: 1.1364, test_f1: 0.4935
 epoch: 4, train_loss: 0.9483, test_loss: 0.9712, test_f1: 0.5067
 epoch: 5, train_loss: 0.9247, test_loss: 0.9900, test_f1: 0.5379
 epoch: 6, train_loss: 0.8911, test_loss: 0.9949, test_f1: 0.4767
 epoch: 7, train_loss: 0.8905, test_loss: 1.0072, test_f1: 0.4972
 epoch: 8, train_loss: 0.8844, test_loss: 0.9288, test_f1: 0.5705
 epoch: 9, train_loss: 0.8563, test_loss: 0.9154, test_f1: 0.5251
 epoch: 10, train_loss: 0.8394, test_loss: 0.9340, test_f1: 0.5284
 epoch: 11, train_loss: 0.8197, test_loss: 0.9284, test_f1: 0.5498
 epoch: 12, train_loss: 0.8154, test_loss: 0.9603, test_f1: 0.5361
 epoch: 13, train_loss: 0.8088, test_loss: 0.9256, test_f1: 0.5618
 epoch: 14, train_loss: 0.8030, test_loss: 0.8487, test_f1: 0.5586
 epoch: 15, train_loss: 0.7739, test_loss: 0.8528, test_f1: 0.5762
 epoch: 16, train_loss: 0.7850, test_loss: 0.8806, test_f1: 0.5982
 epoch: 17, train_loss: 0.7558, test_loss: 0.7529, test_f1: 0.5962
 epoch: 18, train_loss: 0.7632, test_loss: 0.8376, test_f1: 0.6015
 epoch: 19, train_loss: 0.7387, test_loss: 0.8756, test_f1: 0.5838
 epoch: 20, train_loss: 0.7472, test_loss: 0.9609, test_f1: 0.5858
 epoch: 21, train_loss: 0.7574, test_loss: 1.0339, test_f1: 0.5774
 epoch: 22, train_loss: 0.7241, test_loss: 0.9167, test_f1: 0.6192
 epoch: 23, train_loss: 0.7089, test_loss: 0.9106, test_f1: 0.5802
 epoch: 24, train_loss: 0.7022, test_loss: 0.9457, test_f1: 0.6048
 epoch: 25, train_loss: 0.6952, test_loss: 0.8896, test_f1: 0.6485
 epoch: 26, train_loss: 0.6921, test_loss: 1.0709, test_f1: 0.5864
 epoch: 27, train_loss: 0.7022, test_loss: 0.9641, test_f1: 0.6206
 epoch: 28, train_loss: 0.6810, test_loss: 0.8673, test_f1: 0.6380
 epoch: 29, train_loss: 0.6630, test_loss: 0.8821, test_f1: 0.6613
 epoch: 30, train_loss: 0.6811, test_loss: 1.2354, test_f1: 0.5397
 epoch: 31, train_loss: 0.6525, test_loss: 0.8044, test_f1: 0.6188
 epoch: 32, train_loss: 0.6676, test_loss: 0.9316, test_f1: 0.6232
 epoch: 33, train_loss: 0.6895, test_loss: 0.8655, test_f1: 0.6272
 epoch: 34, train_loss: 0.6421, test_loss: 0.9638, test_f1: 0.5821
 epoch: 35, train_loss: 0.6411, test_loss: 0.8954, test_f1: 0.6427
 epoch: 36, train_loss: 0.6333, test_loss: 0.9616, test_f1: 0.6421
 epoch: 37, train_loss: 0.6184, test_loss: 0.9019, test_f1: 0.6394
 epoch: 38, train_loss: 0.6072, test_loss: 0.9740, test_f1: 0.6496
 epoch: 39, train_loss: 0.6195, test_loss: 1.2990, test_f1: 0.5530
 epoch: 40, train_loss: 0.6086, test_loss: 1.1465, test_f1: 0.6153
 epoch: 41, train_loss: 0.6260, test_loss: 0.9820, test_f1: 0.6027
 epoch: 42, train_loss: 0.5815, test_loss: 0.9958, test_f1: 0.6565
 epoch: 43, train_loss: 0.5716, test_loss: 0.8753, test_f1: 0.6491
 epoch: 44, train_loss: 0.5986, test_loss: 0.8085, test_f1: 0.6567
 epoch: 45, train_loss: 0.5878, test_loss: 1.0090, test_f1: 0.6633
 epoch: 46, train_loss: 0.5511, test_loss: 0.8611, test_f1: 0.6781
 epoch: 47, train_loss: 0.5516, test_loss: 1.1682, test_f1: 0.6206
 epoch: 48, train_loss: 0.5429, test_loss: 1.0272, test_f1: 0.6215
 epoch: 49, train_loss: 0.5747, test_loss: 1.1314, test_f1: 0.5668
 epoch: 50, train_loss: 0.5410, test_loss: 1.0703, test_f1: 0.6420
 epoch: 51, train_loss: 0.4956, test_loss: 0.9943, test_f1: 0.6217
 epoch: 52, train_loss: 0.4714, test_loss: 1.0389, test_f1: 0.6704
 epoch: 53, train_loss: 0.4579, test_loss: 0.9744, test_f1: 0.6718
 epoch: 54, train_loss: 0.4691, test_loss: 1.1626, test_f1: 0.6451
 epoch: 55, train_loss: 0.4843, test_loss: 0.9446, test_f1: 0.6849
 epoch: 56, train_loss: 0.4452, test_loss: 0.9720, test_f1: 0.6831
 epoch: 57, train_loss: 0.4411, test_loss: 1.0328, test_f1: 0.6784
 epoch: 58, train_loss: 0.4292, test_loss: 1.1250, test_f1: 0.6906
 epoch: 59, train_loss: 0.4432, test_loss: 1.0307, test_f1: 0.6679
 epoch: 60, train_loss: 0.4371, test_loss: 1.0050, test_f1: 0.6917
 epoch: 61, train_loss: 0.4327, test_loss: 1.1652, test_f1: 0.6888
 epoch: 62, train_loss: 0.4299, test_loss: 1.2689, test_f1: 0.6603
 epoch: 63, train_loss: 0.4059, test_loss: 1.0516, test_f1: 0.6766
 epoch: 64, train_loss: 0.3949, test_loss: 0.8992, test_f1: 0.6892
 epoch: 65, train_loss: 0.3944, test_loss: 1.0712, test_f1: 0.6864
 epoch: 66, train_loss: 0.3747, test_loss: 1.0682, test_f1: 0.6967
 epoch: 67, train_loss: 0.4064, test_loss: 1.0899, test_f1: 0.6993
 epoch: 68, train_loss: 0.3960, test_loss: 1.4413, test_f1: 0.6558
 epoch: 69, train_loss: 0.3974, test_loss: 1.1679, test_f1: 0.6914
 epoch: 70, train_loss: 0.4052, test_loss: 1.2582, test_f1: 0.6865
 epoch: 71, train_loss: 0.3881, test_loss: 1.1206, test_f1: 0.6722
 epoch: 72, train_loss: 0.3696, test_loss: 1.3811, test_f1: 0.6630
 epoch: 73, train_loss: 0.3777, test_loss: 1.0180, test_f1: 0.6966
 epoch: 74, train_loss: 0.3703, test_loss: 1.2776, test_f1: 0.6765
 epoch: 75, train_loss: 0.3820, test_loss: 1.2933, test_f1: 0.6807
 epoch: 76, train_loss: 0.3745, test_loss: 1.1659, test_f1: 0.6605
 epoch: 77, train_loss: 0.3677, test_loss: 1.1855, test_f1: 0.6538
 epoch: 78, train_loss: 0.3592, test_loss: 1.2045, test_f1: 0.7104
 epoch: 79, train_loss: 0.3537, test_loss: 1.2260, test_f1: 0.7062
 epoch: 80, train_loss: 0.3650, test_loss: 1.1265, test_f1: 0.7097
 epoch: 81, train_loss: 0.3384, test_loss: 1.1870, test_f1: 0.7014
 epoch: 82, train_loss: 0.3560, test_loss: 1.3470, test_f1: 0.6510
 epoch: 83, train_loss: 0.3620, test_loss: 1.3506, test_f1: 0.6705
 epoch: 84, train_loss: 0.3414, test_loss: 1.1478, test_f1: 0.6895
 epoch: 85, train_loss: 0.3547, test_loss: 1.2671, test_f1: 0.6924
 epoch: 86, train_loss: 0.3377, test_loss: 1.0999, test_f1: 0.6740
 epoch: 87, train_loss: 0.3278, test_loss: 1.1729, test_f1: 0.7049
 epoch: 88, train_loss: 0.3196, test_loss: 1.3939, test_f1: 0.6551
 epoch: 89, train_loss: 0.3254, test_loss: 1.3366, test_f1: 0.6854
 epoch: 90, train_loss: 0.3323, test_loss: 1.1833, test_f1: 0.6754
 epoch: 91, train_loss: 0.3275, test_loss: 1.2451, test_f1: 0.6833
 epoch: 92, train_loss: 0.3317, test_loss: 1.1010, test_f1: 0.6568
 epoch: 93, train_loss: 0.3331, test_loss: 1.2473, test_f1: 0.6641
 epoch: 94, train_loss: 0.3189, test_loss: 1.0829, test_f1: 0.7014
 epoch: 95, train_loss: 0.3089, test_loss: 1.2269, test_f1: 0.6940
 epoch: 96, train_loss: 0.3489, test_loss: 1.0773, test_f1: 0.7079
 epoch: 97, train_loss: 0.3132, test_loss: 1.1131, test_f1: 0.6720
 epoch: 98, train_loss: 0.2915, test_loss: 1.4260, test_f1: 0.6866
 epoch: 99, train_loss: 0.3136, test_loss: 1.4191, test_f1: 0.7027
##################ITERATION #7 ****************************************
 epoch: 0, train_loss: 1.3619, test_loss: 1.0167, test_f1: 0.4756
 epoch: 1, train_loss: 0.9614, test_loss: 0.9863, test_f1: 0.4770
 epoch: 2, train_loss: 0.9249, test_loss: 0.9841, test_f1: 0.5008
 epoch: 3, train_loss: 0.9351, test_loss: 1.0231, test_f1: 0.4566
 epoch: 4, train_loss: 0.9282, test_loss: 1.0047, test_f1: 0.5024
 epoch: 5, train_loss: 0.8851, test_loss: 1.5704, test_f1: 0.2950
 epoch: 6, train_loss: 0.8892, test_loss: 0.9390, test_f1: 0.5304
 epoch: 7, train_loss: 0.8538, test_loss: 0.8977, test_f1: 0.5473
 epoch: 8, train_loss: 0.8463, test_loss: 1.0111, test_f1: 0.4934
 epoch: 9, train_loss: 0.8609, test_loss: 0.9933, test_f1: 0.5334
 epoch: 10, train_loss: 0.8171, test_loss: 0.8376, test_f1: 0.5567
 epoch: 11, train_loss: 0.8090, test_loss: 0.8357, test_f1: 0.5800
 epoch: 12, train_loss: 0.8099, test_loss: 0.9158, test_f1: 0.5380
 epoch: 13, train_loss: 0.7923, test_loss: 0.9235, test_f1: 0.5075
 epoch: 14, train_loss: 0.7633, test_loss: 0.7932, test_f1: 0.6477
 epoch: 15, train_loss: 0.7652, test_loss: 0.9770, test_f1: 0.5599
 epoch: 16, train_loss: 0.7734, test_loss: 0.8906, test_f1: 0.5525
 epoch: 17, train_loss: 0.7568, test_loss: 0.7250, test_f1: 0.6427
 epoch: 18, train_loss: 0.7300, test_loss: 0.7630, test_f1: 0.6102
 epoch: 19, train_loss: 0.7230, test_loss: 0.8239, test_f1: 0.5837
 epoch: 20, train_loss: 0.7238, test_loss: 0.8284, test_f1: 0.5703
 epoch: 21, train_loss: 0.7388, test_loss: 1.0520, test_f1: 0.5510
 epoch: 22, train_loss: 0.7011, test_loss: 1.0211, test_f1: 0.5370
 epoch: 23, train_loss: 0.6855, test_loss: 0.7854, test_f1: 0.6583
 epoch: 24, train_loss: 0.6778, test_loss: 0.8826, test_f1: 0.6077
 epoch: 25, train_loss: 0.6802, test_loss: 0.8940, test_f1: 0.5971
 epoch: 26, train_loss: 0.6912, test_loss: 0.8164, test_f1: 0.6023
 epoch: 27, train_loss: 0.6520, test_loss: 0.7946, test_f1: 0.6396
 epoch: 28, train_loss: 0.6702, test_loss: 0.9225, test_f1: 0.6050
 epoch: 29, train_loss: 0.6492, test_loss: 0.9769, test_f1: 0.6060
 epoch: 30, train_loss: 0.6460, test_loss: 0.7958, test_f1: 0.6001
 epoch: 31, train_loss: 0.6219, test_loss: 0.8702, test_f1: 0.6886
 epoch: 32, train_loss: 0.6175, test_loss: 0.9795, test_f1: 0.6301
 epoch: 33, train_loss: 0.6342, test_loss: 0.9683, test_f1: 0.6172
 epoch: 34, train_loss: 0.6080, test_loss: 0.9328, test_f1: 0.6150
 epoch: 35, train_loss: 0.5894, test_loss: 1.0348, test_f1: 0.6098
 epoch: 36, train_loss: 0.5710, test_loss: 0.8221, test_f1: 0.7037
 epoch: 37, train_loss: 0.5703, test_loss: 0.8550, test_f1: 0.6923
 epoch: 38, train_loss: 0.6020, test_loss: 1.1074, test_f1: 0.6349
 epoch: 39, train_loss: 0.5788, test_loss: 0.9305, test_f1: 0.6134
 epoch: 40, train_loss: 0.5642, test_loss: 1.0533, test_f1: 0.6487
 epoch: 41, train_loss: 0.5430, test_loss: 0.8608, test_f1: 0.5979
 epoch: 42, train_loss: 0.5391, test_loss: 0.7304, test_f1: 0.6741
 epoch: 43, train_loss: 0.5575, test_loss: 0.9954, test_f1: 0.6073
 epoch: 44, train_loss: 0.5820, test_loss: 0.8164, test_f1: 0.6527
 epoch: 45, train_loss: 0.5658, test_loss: 0.8213, test_f1: 0.6746
 epoch: 46, train_loss: 0.5353, test_loss: 0.7653, test_f1: 0.6695
 epoch: 47, train_loss: 0.5421, test_loss: 1.1379, test_f1: 0.6182
 epoch: 48, train_loss: 0.5466, test_loss: 0.8076, test_f1: 0.6565
 epoch: 49, train_loss: 0.5252, test_loss: 0.7968, test_f1: 0.6882
 epoch: 50, train_loss: 0.5299, test_loss: 0.8509, test_f1: 0.6159
 epoch: 51, train_loss: 0.4871, test_loss: 0.8839, test_f1: 0.6948
 epoch: 52, train_loss: 0.4441, test_loss: 0.9629, test_f1: 0.6617
 epoch: 53, train_loss: 0.4267, test_loss: 0.9480, test_f1: 0.6605
 epoch: 54, train_loss: 0.4073, test_loss: 0.8893, test_f1: 0.6587
 epoch: 55, train_loss: 0.4229, test_loss: 0.8790, test_f1: 0.6748
 epoch: 56, train_loss: 0.3967, test_loss: 0.9657, test_f1: 0.6560
 epoch: 57, train_loss: 0.3927, test_loss: 0.8737, test_f1: 0.7005
 epoch: 58, train_loss: 0.4068, test_loss: 0.8384, test_f1: 0.6730
 epoch: 59, train_loss: 0.4066, test_loss: 0.7809, test_f1: 0.6744
 epoch: 60, train_loss: 0.4045, test_loss: 0.8689, test_f1: 0.6914
 epoch: 61, train_loss: 0.3948, test_loss: 1.2038, test_f1: 0.6983
 epoch: 62, train_loss: 0.3768, test_loss: 0.8928, test_f1: 0.6680
 epoch: 63, train_loss: 0.3994, test_loss: 0.7794, test_f1: 0.7017
 epoch: 64, train_loss: 0.3666, test_loss: 1.0116, test_f1: 0.6522
 epoch: 65, train_loss: 0.4105, test_loss: 0.7815, test_f1: 0.6808
 epoch: 66, train_loss: 0.3886, test_loss: 0.9818, test_f1: 0.6798
 epoch: 67, train_loss: 0.3849, test_loss: 0.9277, test_f1: 0.6912
 epoch: 68, train_loss: 0.3582, test_loss: 0.9091, test_f1: 0.6930
 epoch: 69, train_loss: 0.3801, test_loss: 1.0799, test_f1: 0.6756
 epoch: 70, train_loss: 0.3574, test_loss: 1.0264, test_f1: 0.6608
 epoch: 71, train_loss: 0.3649, test_loss: 1.1495, test_f1: 0.7031
 epoch: 72, train_loss: 0.3439, test_loss: 1.3488, test_f1: 0.6481
 epoch: 73, train_loss: 0.3619, test_loss: 1.3731, test_f1: 0.6545
 epoch: 74, train_loss: 0.3437, test_loss: 1.1051, test_f1: 0.6676
 epoch: 75, train_loss: 0.3253, test_loss: 1.1169, test_f1: 0.6913
 epoch: 76, train_loss: 0.3248, test_loss: 1.2959, test_f1: 0.6409
 epoch: 77, train_loss: 0.3295, test_loss: 1.3301, test_f1: 0.6625
 epoch: 78, train_loss: 0.3400, test_loss: 1.3564, test_f1: 0.6429
 epoch: 79, train_loss: 0.3622, test_loss: 1.0113, test_f1: 0.6631
 epoch: 80, train_loss: 0.3431, test_loss: 0.9934, test_f1: 0.6594
 epoch: 81, train_loss: 0.3369, test_loss: 1.0860, test_f1: 0.6802
 epoch: 82, train_loss: 0.3261, test_loss: 1.5039, test_f1: 0.6590
 epoch: 83, train_loss: 0.3326, test_loss: 1.2828, test_f1: 0.6678
 epoch: 84, train_loss: 0.3369, test_loss: 1.1322, test_f1: 0.6789
 epoch: 85, train_loss: 0.3006, test_loss: 1.0589, test_f1: 0.6967
 epoch: 86, train_loss: 0.3098, test_loss: 1.2117, test_f1: 0.6481
 epoch: 87, train_loss: 0.2826, test_loss: 1.3882, test_f1: 0.6539
 epoch: 88, train_loss: 0.3115, test_loss: 1.2634, test_f1: 0.6469
 epoch: 89, train_loss: 0.2902, test_loss: 1.4830, test_f1: 0.6481
 epoch: 90, train_loss: 0.3051, test_loss: 1.2678, test_f1: 0.6687
 epoch: 91, train_loss: 0.2987, test_loss: 1.4745, test_f1: 0.6352
 epoch: 92, train_loss: 0.2960, test_loss: 1.2037, test_f1: 0.7190
 epoch: 93, train_loss: 0.3101, test_loss: 1.3679, test_f1: 0.6488
 epoch: 94, train_loss: 0.3029, test_loss: 1.3346, test_f1: 0.6526
 epoch: 95, train_loss: 0.3158, test_loss: 1.2525, test_f1: 0.6576
 epoch: 96, train_loss: 0.2991, test_loss: 1.1534, test_f1: 0.6488
 epoch: 97, train_loss: 0.2690, test_loss: 1.2787, test_f1: 0.6357
 epoch: 98, train_loss: 0.2865, test_loss: 1.1144, test_f1: 0.6636
 epoch: 99, train_loss: 0.2773, test_loss: 1.1884, test_f1: 0.6355
##################ITERATION #8 ****************************************
 epoch: 0, train_loss: 1.2123, test_loss: 1.0130, test_f1: 0.4692
 epoch: 1, train_loss: 0.9931, test_loss: 0.9907, test_f1: 0.4829
 epoch: 2, train_loss: 0.9443, test_loss: 1.0002, test_f1: 0.5068
 epoch: 3, train_loss: 0.9225, test_loss: 0.9828, test_f1: 0.5120
 epoch: 4, train_loss: 0.9077, test_loss: 0.8998, test_f1: 0.5377
 epoch: 5, train_loss: 0.8996, test_loss: 1.2418, test_f1: 0.4454
 epoch: 6, train_loss: 0.8845, test_loss: 0.9095, test_f1: 0.5201
 epoch: 7, train_loss: 0.8798, test_loss: 0.9752, test_f1: 0.5366
 epoch: 8, train_loss: 0.8557, test_loss: 0.9634, test_f1: 0.5585
 epoch: 9, train_loss: 0.8359, test_loss: 0.9536, test_f1: 0.5079
 epoch: 10, train_loss: 0.8496, test_loss: 0.9610, test_f1: 0.5486
 epoch: 11, train_loss: 0.8071, test_loss: 0.9073, test_f1: 0.5858
 epoch: 12, train_loss: 0.8218, test_loss: 1.1314, test_f1: 0.5074
 epoch: 13, train_loss: 0.7948, test_loss: 0.9098, test_f1: 0.5334
 epoch: 14, train_loss: 0.8099, test_loss: 1.0773, test_f1: 0.4680
 epoch: 15, train_loss: 0.8069, test_loss: 1.0777, test_f1: 0.4448
 epoch: 16, train_loss: 0.8144, test_loss: 0.9125, test_f1: 0.5452
 epoch: 17, train_loss: 0.7782, test_loss: 0.9533, test_f1: 0.5279
 epoch: 18, train_loss: 0.7850, test_loss: 0.8271, test_f1: 0.5466
 epoch: 19, train_loss: 0.7783, test_loss: 0.9588, test_f1: 0.5968
 epoch: 20, train_loss: 0.7535, test_loss: 1.0068, test_f1: 0.5685
 epoch: 21, train_loss: 0.7313, test_loss: 1.0502, test_f1: 0.5727
 epoch: 22, train_loss: 0.7476, test_loss: 0.9551, test_f1: 0.5563
 epoch: 23, train_loss: 0.7367, test_loss: 0.8828, test_f1: 0.6189
 epoch: 24, train_loss: 0.7227, test_loss: 1.1786, test_f1: 0.5388
 epoch: 25, train_loss: 0.7142, test_loss: 0.9414, test_f1: 0.5866
 epoch: 26, train_loss: 0.7244, test_loss: 0.8183, test_f1: 0.6558
 epoch: 27, train_loss: 0.7025, test_loss: 1.0268, test_f1: 0.5873
 epoch: 28, train_loss: 0.6967, test_loss: 0.7883, test_f1: 0.6174
 epoch: 29, train_loss: 0.6812, test_loss: 0.9442, test_f1: 0.6347
 epoch: 30, train_loss: 0.6772, test_loss: 0.9071, test_f1: 0.6159
 epoch: 31, train_loss: 0.6708, test_loss: 0.8918, test_f1: 0.5773
 epoch: 32, train_loss: 0.6561, test_loss: 0.8586, test_f1: 0.5994
 epoch: 33, train_loss: 0.6460, test_loss: 0.8995, test_f1: 0.6077
 epoch: 34, train_loss: 0.6216, test_loss: 1.0641, test_f1: 0.5721
 epoch: 35, train_loss: 0.6068, test_loss: 0.9786, test_f1: 0.6202
 epoch: 36, train_loss: 0.6301, test_loss: 1.0610, test_f1: 0.6023
 epoch: 37, train_loss: 0.6345, test_loss: 1.1374, test_f1: 0.6254
 epoch: 38, train_loss: 0.6114, test_loss: 0.8783, test_f1: 0.6190
 epoch: 39, train_loss: 0.6212, test_loss: 1.1450, test_f1: 0.5547
 epoch: 40, train_loss: 0.6043, test_loss: 0.9286, test_f1: 0.5875
 epoch: 41, train_loss: 0.5924, test_loss: 1.0917, test_f1: 0.5827
 epoch: 42, train_loss: 0.6127, test_loss: 0.8389, test_f1: 0.6500
 epoch: 43, train_loss: 0.5927, test_loss: 0.8458, test_f1: 0.6459
 epoch: 44, train_loss: 0.5810, test_loss: 0.8622, test_f1: 0.5994
 epoch: 45, train_loss: 0.5816, test_loss: 0.9816, test_f1: 0.6200
 epoch: 46, train_loss: 0.5786, test_loss: 1.1277, test_f1: 0.6266
 epoch: 47, train_loss: 0.5744, test_loss: 0.9672, test_f1: 0.6328
 epoch: 48, train_loss: 0.5621, test_loss: 0.8757, test_f1: 0.6009
 epoch: 49, train_loss: 0.5364, test_loss: 0.8019, test_f1: 0.6264
 epoch: 50, train_loss: 0.5501, test_loss: 0.9289, test_f1: 0.6222
 epoch: 51, train_loss: 0.4894, test_loss: 1.0976, test_f1: 0.6253
 epoch: 52, train_loss: 0.4751, test_loss: 0.9633, test_f1: 0.6257
 epoch: 53, train_loss: 0.4668, test_loss: 1.0247, test_f1: 0.6442
 epoch: 54, train_loss: 0.4495, test_loss: 1.0627, test_f1: 0.6279
 epoch: 55, train_loss: 0.4436, test_loss: 0.8940, test_f1: 0.6282
 epoch: 56, train_loss: 0.4468, test_loss: 0.9921, test_f1: 0.6279
 epoch: 57, train_loss: 0.4248, test_loss: 1.0455, test_f1: 0.6172
 epoch: 58, train_loss: 0.4401, test_loss: 0.9196, test_f1: 0.6590
 epoch: 59, train_loss: 0.4287, test_loss: 0.9715, test_f1: 0.6382
 epoch: 60, train_loss: 0.4246, test_loss: 0.9751, test_f1: 0.6621
 epoch: 61, train_loss: 0.4233, test_loss: 1.1006, test_f1: 0.6326
 epoch: 62, train_loss: 0.4101, test_loss: 1.0334, test_f1: 0.6479
 epoch: 63, train_loss: 0.4201, test_loss: 1.1014, test_f1: 0.6492
 epoch: 64, train_loss: 0.3956, test_loss: 1.0725, test_f1: 0.6663
 epoch: 65, train_loss: 0.3994, test_loss: 1.2279, test_f1: 0.6225
 epoch: 66, train_loss: 0.4195, test_loss: 1.1193, test_f1: 0.6271
 epoch: 67, train_loss: 0.3936, test_loss: 1.1023, test_f1: 0.6334
 epoch: 68, train_loss: 0.4011, test_loss: 1.1852, test_f1: 0.6381
 epoch: 69, train_loss: 0.4088, test_loss: 1.3114, test_f1: 0.6441
 epoch: 70, train_loss: 0.4049, test_loss: 1.0804, test_f1: 0.6522
 epoch: 71, train_loss: 0.3830, test_loss: 1.2201, test_f1: 0.6398
 epoch: 72, train_loss: 0.4028, test_loss: 1.2015, test_f1: 0.6429
 epoch: 73, train_loss: 0.3896, test_loss: 1.2385, test_f1: 0.6239
 epoch: 74, train_loss: 0.3869, test_loss: 1.1863, test_f1: 0.6395
 epoch: 75, train_loss: 0.3649, test_loss: 1.1240, test_f1: 0.6763
 epoch: 76, train_loss: 0.3988, test_loss: 1.0757, test_f1: 0.6640
 epoch: 77, train_loss: 0.3622, test_loss: 1.3844, test_f1: 0.6173
 epoch: 78, train_loss: 0.3631, test_loss: 1.3111, test_f1: 0.6534
 epoch: 79, train_loss: 0.3518, test_loss: 1.2988, test_f1: 0.6788
 epoch: 80, train_loss: 0.3364, test_loss: 1.3145, test_f1: 0.6512
 epoch: 81, train_loss: 0.3580, test_loss: 1.2192, test_f1: 0.6323
 epoch: 82, train_loss: 0.3676, test_loss: 1.2467, test_f1: 0.6573
 epoch: 83, train_loss: 0.3643, test_loss: 1.0234, test_f1: 0.6532
 epoch: 84, train_loss: 0.3397, test_loss: 1.1489, test_f1: 0.6467
 epoch: 85, train_loss: 0.3473, test_loss: 1.2427, test_f1: 0.6507
 epoch: 86, train_loss: 0.3281, test_loss: 1.1054, test_f1: 0.6401
 epoch: 87, train_loss: 0.3279, test_loss: 1.3008, test_f1: 0.6576
 epoch: 88, train_loss: 0.3678, test_loss: 1.1852, test_f1: 0.6614
 epoch: 89, train_loss: 0.3305, test_loss: 1.1665, test_f1: 0.6639
 epoch: 90, train_loss: 0.3124, test_loss: 1.3710, test_f1: 0.6344
 epoch: 91, train_loss: 0.3515, test_loss: 1.3719, test_f1: 0.6485
 epoch: 92, train_loss: 0.3381, test_loss: 1.6397, test_f1: 0.6570
 epoch: 93, train_loss: 0.3258, test_loss: 1.3321, test_f1: 0.6912
 epoch: 94, train_loss: 0.3284, test_loss: 1.2851, test_f1: 0.6421
 epoch: 95, train_loss: 0.3047, test_loss: 1.5356, test_f1: 0.6318
 epoch: 96, train_loss: 0.3230, test_loss: 1.2563, test_f1: 0.6697
 epoch: 97, train_loss: 0.3093, test_loss: 1.0663, test_f1: 0.6860
 epoch: 98, train_loss: 0.3497, test_loss: 1.2425, test_f1: 0.6607
 epoch: 99, train_loss: 0.3004, test_loss: 1.2984, test_f1: 0.6599
##################ITERATION #9 ****************************************
 epoch: 0, train_loss: 1.2414, test_loss: 1.2776, test_f1: 0.3683
 epoch: 1, train_loss: 1.0110, test_loss: 1.5526, test_f1: 0.4100
 epoch: 2, train_loss: 0.9631, test_loss: 0.9166, test_f1: 0.5153
 epoch: 3, train_loss: 0.9364, test_loss: 2.2878, test_f1: 0.3985
 epoch: 4, train_loss: 0.9329, test_loss: 0.9619, test_f1: 0.5280
 epoch: 5, train_loss: 0.9081, test_loss: 1.1597, test_f1: 0.4881
 epoch: 6, train_loss: 0.9002, test_loss: 1.3197, test_f1: 0.4644
 epoch: 7, train_loss: 0.8925, test_loss: 0.8899, test_f1: 0.5293
 epoch: 8, train_loss: 0.8694, test_loss: 0.9171, test_f1: 0.5208
 epoch: 9, train_loss: 0.8620, test_loss: 0.9753, test_f1: 0.5050
 epoch: 10, train_loss: 0.8303, test_loss: 0.9120, test_f1: 0.5293
 epoch: 11, train_loss: 0.8204, test_loss: 0.8729, test_f1: 0.5923
 epoch: 12, train_loss: 0.8088, test_loss: 0.8843, test_f1: 0.5547
 epoch: 13, train_loss: 0.8085, test_loss: 0.8666, test_f1: 0.5751
 epoch: 14, train_loss: 0.7709, test_loss: 0.9515, test_f1: 0.6110
 epoch: 15, train_loss: 0.7516, test_loss: 0.8728, test_f1: 0.5899
 epoch: 16, train_loss: 0.7709, test_loss: 1.4155, test_f1: 0.5249
 epoch: 17, train_loss: 0.7618, test_loss: 1.0268, test_f1: 0.6101
 epoch: 18, train_loss: 0.7471, test_loss: 0.8285, test_f1: 0.5827
 epoch: 19, train_loss: 0.7268, test_loss: 0.8429, test_f1: 0.6086
 epoch: 20, train_loss: 0.7353, test_loss: 0.8287, test_f1: 0.6145
 epoch: 21, train_loss: 0.7702, test_loss: 0.8955, test_f1: 0.5949
 epoch: 22, train_loss: 0.7328, test_loss: 0.9091, test_f1: 0.5811
 epoch: 23, train_loss: 0.7118, test_loss: 0.9716, test_f1: 0.6420
 epoch: 24, train_loss: 0.7064, test_loss: 1.0155, test_f1: 0.5923
 epoch: 25, train_loss: 0.7372, test_loss: 0.8133, test_f1: 0.6434
 epoch: 26, train_loss: 0.6950, test_loss: 0.9306, test_f1: 0.5676
 epoch: 27, train_loss: 0.6719, test_loss: 0.8306, test_f1: 0.6504
 epoch: 28, train_loss: 0.6947, test_loss: 0.9121, test_f1: 0.6206
 epoch: 29, train_loss: 0.6584, test_loss: 0.8713, test_f1: 0.6205
 epoch: 30, train_loss: 0.6595, test_loss: 0.9490, test_f1: 0.6122
 epoch: 31, train_loss: 0.6465, test_loss: 1.0658, test_f1: 0.6602
 epoch: 32, train_loss: 0.6380, test_loss: 1.0262, test_f1: 0.6178
 epoch: 33, train_loss: 0.6440, test_loss: 0.9674, test_f1: 0.6368
 epoch: 34, train_loss: 0.6308, test_loss: 0.9634, test_f1: 0.6338
 epoch: 35, train_loss: 0.6399, test_loss: 0.9427, test_f1: 0.6466
 epoch: 36, train_loss: 0.6344, test_loss: 0.9119, test_f1: 0.6530
 epoch: 37, train_loss: 0.6080, test_loss: 1.1113, test_f1: 0.6310
 epoch: 38, train_loss: 0.6237, test_loss: 1.0911, test_f1: 0.6570
 epoch: 39, train_loss: 0.6141, test_loss: 0.9712, test_f1: 0.6229
 epoch: 40, train_loss: 0.6134, test_loss: 1.1030, test_f1: 0.6340
 epoch: 41, train_loss: 0.5885, test_loss: 0.9281, test_f1: 0.6636
 epoch: 42, train_loss: 0.5734, test_loss: 1.1695, test_f1: 0.6421
 epoch: 43, train_loss: 0.5778, test_loss: 0.9028, test_f1: 0.6757
 epoch: 44, train_loss: 0.5618, test_loss: 1.4068, test_f1: 0.6165
 epoch: 45, train_loss: 0.5679, test_loss: 0.9930, test_f1: 0.6768
 epoch: 46, train_loss: 0.5842, test_loss: 1.0617, test_f1: 0.6342
 epoch: 47, train_loss: 0.5527, test_loss: 1.4389, test_f1: 0.6137
 epoch: 48, train_loss: 0.5707, test_loss: 1.7613, test_f1: 0.6234
 epoch: 49, train_loss: 0.5677, test_loss: 1.4384, test_f1: 0.5880
 epoch: 50, train_loss: 0.6060, test_loss: 1.1190, test_f1: 0.6576
 epoch: 51, train_loss: 0.5208, test_loss: 1.2392, test_f1: 0.6507
 epoch: 52, train_loss: 0.4890, test_loss: 1.3291, test_f1: 0.6792
 epoch: 53, train_loss: 0.4850, test_loss: 1.2968, test_f1: 0.6766
 epoch: 54, train_loss: 0.4729, test_loss: 1.4295, test_f1: 0.6686
 epoch: 55, train_loss: 0.4615, test_loss: 1.3282, test_f1: 0.6961
 epoch: 56, train_loss: 0.4477, test_loss: 1.3008, test_f1: 0.6937
 epoch: 57, train_loss: 0.4552, test_loss: 1.2502, test_f1: 0.6802
 epoch: 58, train_loss: 0.4355, test_loss: 1.2474, test_f1: 0.6512
 epoch: 59, train_loss: 0.4300, test_loss: 1.3059, test_f1: 0.6749
 epoch: 60, train_loss: 0.4205, test_loss: 1.3298, test_f1: 0.6957
 epoch: 61, train_loss: 0.4322, test_loss: 1.3683, test_f1: 0.6703
 epoch: 62, train_loss: 0.4311, test_loss: 1.3817, test_f1: 0.6776
 epoch: 63, train_loss: 0.4229, test_loss: 1.2679, test_f1: 0.6842
 epoch: 64, train_loss: 0.4091, test_loss: 1.4346, test_f1: 0.6828
 epoch: 65, train_loss: 0.3943, test_loss: 1.4976, test_f1: 0.6420
 epoch: 66, train_loss: 0.3963, test_loss: 1.5760, test_f1: 0.6983
 epoch: 67, train_loss: 0.3960, test_loss: 1.4610, test_f1: 0.6816
 epoch: 68, train_loss: 0.3827, test_loss: 1.4285, test_f1: 0.6852
 epoch: 69, train_loss: 0.3864, test_loss: 1.4600, test_f1: 0.6867
 epoch: 70, train_loss: 0.3890, test_loss: 1.4491, test_f1: 0.6758
 epoch: 71, train_loss: 0.3883, test_loss: 1.5059, test_f1: 0.6867
 epoch: 72, train_loss: 0.3664, test_loss: 1.7309, test_f1: 0.6389
 epoch: 73, train_loss: 0.3820, test_loss: 1.3797, test_f1: 0.6767
 epoch: 74, train_loss: 0.3729, test_loss: 1.5975, test_f1: 0.6661
 epoch: 75, train_loss: 0.3825, test_loss: 1.8818, test_f1: 0.6816
 epoch: 76, train_loss: 0.3842, test_loss: 1.7290, test_f1: 0.6688
 epoch: 77, train_loss: 0.3663, test_loss: 1.6635, test_f1: 0.6752
 epoch: 78, train_loss: 0.3620, test_loss: 1.7373, test_f1: 0.6497
 epoch: 79, train_loss: 0.3544, test_loss: 1.7562, test_f1: 0.6666
 epoch: 80, train_loss: 0.3641, test_loss: 1.7288, test_f1: 0.6280
 epoch: 81, train_loss: 0.3596, test_loss: 1.4322, test_f1: 0.6932
 epoch: 82, train_loss: 0.3596, test_loss: 1.5132, test_f1: 0.6781
 epoch: 83, train_loss: 0.3843, test_loss: 1.6331, test_f1: 0.6712
 epoch: 84, train_loss: 0.3564, test_loss: 1.4497, test_f1: 0.6804
 epoch: 85, train_loss: 0.3207, test_loss: 1.7871, test_f1: 0.6389
 epoch: 86, train_loss: 0.3411, test_loss: 1.6114, test_f1: 0.6870
 epoch: 87, train_loss: 0.3076, test_loss: 1.6400, test_f1: 0.6846
 epoch: 88, train_loss: 0.3251, test_loss: 1.7963, test_f1: 0.6763
 epoch: 89, train_loss: 0.3254, test_loss: 1.7042, test_f1: 0.6668
 epoch: 90, train_loss: 0.3155, test_loss: 1.6409, test_f1: 0.6729
 epoch: 91, train_loss: 0.3134, test_loss: 1.5960, test_f1: 0.6886
 epoch: 92, train_loss: 0.3042, test_loss: 1.8485, test_f1: 0.6702
 epoch: 93, train_loss: 0.3410, test_loss: 1.6772, test_f1: 0.6769
 epoch: 94, train_loss: 0.3089, test_loss: 1.6512, test_f1: 0.6878
 epoch: 95, train_loss: 0.2974, test_loss: 1.7358, test_f1: 0.6975
 epoch: 96, train_loss: 0.2790, test_loss: 2.2127, test_f1: 0.6462
 epoch: 97, train_loss: 0.3054, test_loss: 1.7184, test_f1: 0.6931
 epoch: 98, train_loss: 0.2782, test_loss: 1.8476, test_f1: 0.6591
 epoch: 99, train_loss: 0.2981, test_loss: 1.5232, test_f1: 0.6729

Training completed in 654.13 seconds
Best F1: 0.7259 at epoch 82
Mean F1 across iterations: 0.7013  0.0149
========================FINAL RESULTS================================
FEGIN weighted F1: 0.7259  0.0149
python main.py --data ltspice_examples --representation component_pin --model FEGIN --layers 3 --hiddens 128 --batch_size 64 --lr 0.01 --emb_size 512 --epochs 100 --save_appendix component_pin_L3_H128_BS64_LR0.01_E512 --no_val
-----



STDERR:
  File "main.py", line 370, in <module>
    main()
  File "main.py", line 254, in main
    dataset = dataset_class(
  File "/home/philip/projects/ltspice_examples_code_repo/Circuit-Completion-Using-GNNs/component_classification_with_link_prediction_head/evaluation/FEGIN/kernel/circuit_datasets.py", line 15, in __init__
    self.data, self.slices = torch.load(self.processed_paths[0])
  File "/home/philip/.local/lib/python3.8/site-packages/torch/serialization.py", line 1040, in load
    warnings.warn(
  File "/usr/lib/python3.8/warnings.py", line 109, in _showwarnmsg
    sw(msg.message, msg.category, msg.filename, msg.lineno,
  File "main.py", line 47, in warn_with_traceback
    traceback.print_stack(file=log)
/home/philip/projects/ltspice_examples_code_repo/Circuit-Completion-Using-GNNs/component_classification_with_link_prediction_head/evaluation/FEGIN/kernel/circuit_datasets.py:15: FutureWarning: You are using `torch.load` with `weights_only=False` (the current default value), which uses the default pickle module implicitly. It is possible to construct malicious pickle data which will execute arbitrary code during unpickling (See https://github.com/pytorch/pytorch/blob/main/SECURITY.md#untrusted-models for more details). In a future release, the default value for `weights_only` will be flipped to `True`. This limits the functions that could be executed during unpickling. Arbitrary objects will no longer be allowed to be loaded via this mode unless they are explicitly allowlisted by the user via `torch.serialization.add_safe_globals`. We recommend you start setting `weights_only=True` for any use case where you don't have full control of the loaded file. Please open an issue on GitHub for any issues related to this experimental feature.
  self.data, self.slices = torch.load(self.processed_paths[0])
