STDOUT:
Results will be saved in /home/philip/projects/ltspice_examples_code_repo/Circuit-Completion-Using-GNNs/component_classification_with_link_prediction_head/evaluation/FEGIN/results/model_FEGIN_dataset_ltspice_examples
Command line input: python main.py --data ltspice_examples --representation component_net --model FEGIN --layers 3 --hiddens 64 --batch_size 128 --lr 0.01 --emb_size 250 --epochs 100 --save_appendix component_net_L3_H64_BS128_LR0.01_E250 --no_val
 is saved.
-----
ltspice_examples - FEGIN
Using 3 layers, 64 hidden units, h = 2
Loading component_net representation dataset
ENTERED
Training FEGIN on component_net representation
Train: 3558, Test: 846
##################ITERATION #0 ****************************************
 epoch: 0, train_loss: 1.2610, test_loss: 1.2406, test_f1: 0.2344
 epoch: 1, train_loss: 1.0856, test_loss: 1.1244, test_f1: 0.3865
 epoch: 2, train_loss: 1.0320, test_loss: 1.0227, test_f1: 0.4414
 epoch: 3, train_loss: 0.9688, test_loss: 1.0593, test_f1: 0.4690
 epoch: 4, train_loss: 0.9591, test_loss: 0.9488, test_f1: 0.4662
 epoch: 5, train_loss: 0.9388, test_loss: 0.9771, test_f1: 0.5179
 epoch: 6, train_loss: 0.9281, test_loss: 0.9967, test_f1: 0.4693
 epoch: 7, train_loss: 0.9150, test_loss: 0.9735, test_f1: 0.4817
 epoch: 8, train_loss: 0.9106, test_loss: 0.9209, test_f1: 0.5030
 epoch: 9, train_loss: 0.8964, test_loss: 0.9983, test_f1: 0.5217
 epoch: 10, train_loss: 0.8844, test_loss: 0.8970, test_f1: 0.5000
 epoch: 11, train_loss: 0.8536, test_loss: 0.9727, test_f1: 0.5313
 epoch: 12, train_loss: 0.8563, test_loss: 1.0497, test_f1: 0.4630
 epoch: 13, train_loss: 0.8778, test_loss: 0.9731, test_f1: 0.5005
 epoch: 14, train_loss: 0.8455, test_loss: 0.9701, test_f1: 0.5336
 epoch: 15, train_loss: 0.8265, test_loss: 0.9143, test_f1: 0.5324
 epoch: 16, train_loss: 0.8441, test_loss: 1.0561, test_f1: 0.5412
 epoch: 17, train_loss: 0.7999, test_loss: 1.0642, test_f1: 0.5270
 epoch: 18, train_loss: 0.7997, test_loss: 0.9754, test_f1: 0.5478
 epoch: 19, train_loss: 0.7968, test_loss: 1.0608, test_f1: 0.5192
 epoch: 20, train_loss: 0.7934, test_loss: 0.9606, test_f1: 0.5825
 epoch: 21, train_loss: 0.7864, test_loss: 1.0984, test_f1: 0.5511
 epoch: 22, train_loss: 0.7755, test_loss: 1.0872, test_f1: 0.5390
 epoch: 23, train_loss: 0.7788, test_loss: 1.0352, test_f1: 0.5567
 epoch: 24, train_loss: 0.7595, test_loss: 1.0352, test_f1: 0.6023
 epoch: 25, train_loss: 0.7513, test_loss: 1.0956, test_f1: 0.5609
 epoch: 26, train_loss: 0.7648, test_loss: 1.1757, test_f1: 0.5189
 epoch: 27, train_loss: 0.7382, test_loss: 1.0396, test_f1: 0.5669
 epoch: 28, train_loss: 0.7312, test_loss: 1.2527, test_f1: 0.5668
 epoch: 29, train_loss: 0.7394, test_loss: 1.2422, test_f1: 0.5738
 epoch: 30, train_loss: 0.7399, test_loss: 1.2148, test_f1: 0.5731
 epoch: 31, train_loss: 0.7211, test_loss: 1.1798, test_f1: 0.5239
 epoch: 32, train_loss: 0.7255, test_loss: 1.0201, test_f1: 0.5744
 epoch: 33, train_loss: 0.7237, test_loss: 1.0618, test_f1: 0.5787
 epoch: 34, train_loss: 0.7027, test_loss: 1.1073, test_f1: 0.5814
 epoch: 35, train_loss: 0.7110, test_loss: 1.1159, test_f1: 0.5995
 epoch: 36, train_loss: 0.7188, test_loss: 1.1945, test_f1: 0.5345
 epoch: 37, train_loss: 0.6931, test_loss: 1.1370, test_f1: 0.5699
 epoch: 38, train_loss: 0.7022, test_loss: 1.1610, test_f1: 0.5480
 epoch: 39, train_loss: 0.7272, test_loss: 1.1028, test_f1: 0.5744
 epoch: 40, train_loss: 0.6853, test_loss: 1.1857, test_f1: 0.5819
 epoch: 41, train_loss: 0.6774, test_loss: 1.3038, test_f1: 0.5446
 epoch: 42, train_loss: 0.6777, test_loss: 1.4802, test_f1: 0.4537
 epoch: 43, train_loss: 0.6726, test_loss: 1.1201, test_f1: 0.6009
 epoch: 44, train_loss: 0.6712, test_loss: 1.0563, test_f1: 0.6124
 epoch: 45, train_loss: 0.6374, test_loss: 1.0812, test_f1: 0.6280
 epoch: 46, train_loss: 0.6532, test_loss: 1.1811, test_f1: 0.6204
 epoch: 47, train_loss: 0.6356, test_loss: 1.1642, test_f1: 0.6205
 epoch: 48, train_loss: 0.6304, test_loss: 1.3027, test_f1: 0.6262
 epoch: 49, train_loss: 0.6433, test_loss: 1.1627, test_f1: 0.5763
 epoch: 50, train_loss: 0.6148, test_loss: 1.4141, test_f1: 0.5854
 epoch: 51, train_loss: 0.6050, test_loss: 1.1977, test_f1: 0.6428
 epoch: 52, train_loss: 0.5651, test_loss: 1.4035, test_f1: 0.6322
 epoch: 53, train_loss: 0.5613, test_loss: 1.4260, test_f1: 0.6292
 epoch: 54, train_loss: 0.5654, test_loss: 1.2030, test_f1: 0.6328
 epoch: 55, train_loss: 0.5669, test_loss: 1.3601, test_f1: 0.5921
 epoch: 56, train_loss: 0.5434, test_loss: 1.3391, test_f1: 0.6311
 epoch: 57, train_loss: 0.5592, test_loss: 1.3855, test_f1: 0.6281
 epoch: 58, train_loss: 0.5480, test_loss: 1.3980, test_f1: 0.6451
 epoch: 59, train_loss: 0.5463, test_loss: 1.4827, test_f1: 0.6352
 epoch: 60, train_loss: 0.5285, test_loss: 1.4609, test_f1: 0.5799
 epoch: 61, train_loss: 0.5155, test_loss: 1.4682, test_f1: 0.6186
 epoch: 62, train_loss: 0.5382, test_loss: 1.4455, test_f1: 0.6301
 epoch: 63, train_loss: 0.5305, test_loss: 1.4360, test_f1: 0.6094
 epoch: 64, train_loss: 0.5122, test_loss: 1.5426, test_f1: 0.6227
 epoch: 65, train_loss: 0.5300, test_loss: 1.3876, test_f1: 0.6255
 epoch: 66, train_loss: 0.5243, test_loss: 1.4829, test_f1: 0.6245
 epoch: 67, train_loss: 0.4952, test_loss: 1.4585, test_f1: 0.6261
 epoch: 68, train_loss: 0.4983, test_loss: 1.5315, test_f1: 0.6498
 epoch: 69, train_loss: 0.4844, test_loss: 1.4864, test_f1: 0.6406
 epoch: 70, train_loss: 0.4934, test_loss: 1.4319, test_f1: 0.6177
 epoch: 71, train_loss: 0.4778, test_loss: 1.4979, test_f1: 0.6472
 epoch: 72, train_loss: 0.4947, test_loss: 1.4492, test_f1: 0.6129
 epoch: 73, train_loss: 0.4759, test_loss: 1.4874, test_f1: 0.6348
 epoch: 74, train_loss: 0.4697, test_loss: 1.5036, test_f1: 0.6517
 epoch: 75, train_loss: 0.4965, test_loss: 1.4366, test_f1: 0.6517
 epoch: 76, train_loss: 0.4693, test_loss: 1.3454, test_f1: 0.6618
 epoch: 77, train_loss: 0.4708, test_loss: 1.6037, test_f1: 0.6509
 epoch: 78, train_loss: 0.4800, test_loss: 1.3535, test_f1: 0.6550
 epoch: 79, train_loss: 0.4378, test_loss: 1.5328, test_f1: 0.6421
 epoch: 80, train_loss: 0.4574, test_loss: 1.4566, test_f1: 0.6441
 epoch: 81, train_loss: 0.4539, test_loss: 1.4623, test_f1: 0.6461
 epoch: 82, train_loss: 0.4396, test_loss: 1.5068, test_f1: 0.6534
 epoch: 83, train_loss: 0.4298, test_loss: 1.4602, test_f1: 0.6487
 epoch: 84, train_loss: 0.4213, test_loss: 1.3472, test_f1: 0.6522
 epoch: 85, train_loss: 0.4298, test_loss: 1.3762, test_f1: 0.6441
 epoch: 86, train_loss: 0.4315, test_loss: 1.5911, test_f1: 0.6492
 epoch: 87, train_loss: 0.4681, test_loss: 1.8813, test_f1: 0.6219
 epoch: 88, train_loss: 0.4712, test_loss: 1.4687, test_f1: 0.6379
 epoch: 89, train_loss: 0.4242, test_loss: 1.4952, test_f1: 0.6460
 epoch: 90, train_loss: 0.4247, test_loss: 1.5335, test_f1: 0.6457
 epoch: 91, train_loss: 0.4157, test_loss: 1.3705, test_f1: 0.6417
 epoch: 92, train_loss: 0.4165, test_loss: 1.6159, test_f1: 0.6585
 epoch: 93, train_loss: 0.4236, test_loss: 1.5443, test_f1: 0.6445
 epoch: 94, train_loss: 0.4189, test_loss: 1.5728, test_f1: 0.6245
 epoch: 95, train_loss: 0.4246, test_loss: 1.3554, test_f1: 0.6388
 epoch: 96, train_loss: 0.4195, test_loss: 1.5523, test_f1: 0.6272
 epoch: 97, train_loss: 0.3997, test_loss: 1.5137, test_f1: 0.6620
 epoch: 98, train_loss: 0.3868, test_loss: 1.7557, test_f1: 0.6427
 epoch: 99, train_loss: 0.4026, test_loss: 1.5176, test_f1: 0.6507
##################ITERATION #1 ****************************************
 epoch: 0, train_loss: 1.1866, test_loss: 1.1485, test_f1: 0.3208
 epoch: 1, train_loss: 1.0108, test_loss: 1.0700, test_f1: 0.4326
 epoch: 2, train_loss: 0.9721, test_loss: 1.0135, test_f1: 0.4818
 epoch: 3, train_loss: 0.9432, test_loss: 0.9736, test_f1: 0.4807
 epoch: 4, train_loss: 0.9159, test_loss: 0.8881, test_f1: 0.5300
 epoch: 5, train_loss: 0.9002, test_loss: 0.9573, test_f1: 0.5021
 epoch: 6, train_loss: 0.9008, test_loss: 1.0649, test_f1: 0.5226
 epoch: 7, train_loss: 0.8827, test_loss: 1.0642, test_f1: 0.4736
 epoch: 8, train_loss: 0.8894, test_loss: 0.9736, test_f1: 0.5278
 epoch: 9, train_loss: 0.8851, test_loss: 1.0074, test_f1: 0.4755
 epoch: 10, train_loss: 0.8483, test_loss: 0.9212, test_f1: 0.5767
 epoch: 11, train_loss: 0.8280, test_loss: 0.9825, test_f1: 0.5091
 epoch: 12, train_loss: 0.8181, test_loss: 1.0190, test_f1: 0.5727
 epoch: 13, train_loss: 0.8132, test_loss: 1.0808, test_f1: 0.5359
 epoch: 14, train_loss: 0.8117, test_loss: 0.9397, test_f1: 0.5783
 epoch: 15, train_loss: 0.8182, test_loss: 0.9803, test_f1: 0.5864
 epoch: 16, train_loss: 0.7733, test_loss: 1.0665, test_f1: 0.5404
 epoch: 17, train_loss: 0.7876, test_loss: 1.0036, test_f1: 0.5780
 epoch: 18, train_loss: 0.7756, test_loss: 1.0356, test_f1: 0.5332
 epoch: 19, train_loss: 0.7766, test_loss: 1.1306, test_f1: 0.5294
 epoch: 20, train_loss: 0.7719, test_loss: 1.1336, test_f1: 0.5693
 epoch: 21, train_loss: 0.7395, test_loss: 1.0718, test_f1: 0.5071
 epoch: 22, train_loss: 0.7528, test_loss: 1.0068, test_f1: 0.6118
 epoch: 23, train_loss: 0.7377, test_loss: 1.1675, test_f1: 0.5637
 epoch: 24, train_loss: 0.7339, test_loss: 1.0747, test_f1: 0.6008
 epoch: 25, train_loss: 0.7381, test_loss: 1.0574, test_f1: 0.5780
 epoch: 26, train_loss: 0.7180, test_loss: 1.1712, test_f1: 0.5878
 epoch: 27, train_loss: 0.7162, test_loss: 1.1296, test_f1: 0.6005
 epoch: 28, train_loss: 0.7136, test_loss: 1.1371, test_f1: 0.5831
 epoch: 29, train_loss: 0.7015, test_loss: 1.0864, test_f1: 0.6081
 epoch: 30, train_loss: 0.6802, test_loss: 1.0723, test_f1: 0.5975
 epoch: 31, train_loss: 0.6890, test_loss: 1.1027, test_f1: 0.6327
 epoch: 32, train_loss: 0.7092, test_loss: 1.0711, test_f1: 0.6108
 epoch: 33, train_loss: 0.7087, test_loss: 1.1069, test_f1: 0.6130
 epoch: 34, train_loss: 0.6941, test_loss: 1.0911, test_f1: 0.6395
 epoch: 35, train_loss: 0.6548, test_loss: 1.0341, test_f1: 0.6139
 epoch: 36, train_loss: 0.6842, test_loss: 1.1276, test_f1: 0.6078
 epoch: 37, train_loss: 0.6679, test_loss: 0.9865, test_f1: 0.6192
 epoch: 38, train_loss: 0.6632, test_loss: 1.0695, test_f1: 0.6292
 epoch: 39, train_loss: 0.6762, test_loss: 1.2793, test_f1: 0.5882
 epoch: 40, train_loss: 0.6656, test_loss: 1.0533, test_f1: 0.5990
 epoch: 41, train_loss: 0.6492, test_loss: 1.0759, test_f1: 0.6142
 epoch: 42, train_loss: 0.6516, test_loss: 0.9978, test_f1: 0.6391
 epoch: 43, train_loss: 0.6306, test_loss: 0.9967, test_f1: 0.6179
 epoch: 44, train_loss: 0.6285, test_loss: 1.1561, test_f1: 0.6327
 epoch: 45, train_loss: 0.6308, test_loss: 1.1939, test_f1: 0.6217
 epoch: 46, train_loss: 0.6294, test_loss: 0.8898, test_f1: 0.6386
 epoch: 47, train_loss: 0.6141, test_loss: 0.9579, test_f1: 0.6257
 epoch: 48, train_loss: 0.6222, test_loss: 1.1654, test_f1: 0.6131
 epoch: 49, train_loss: 0.6054, test_loss: 1.0802, test_f1: 0.6482
 epoch: 50, train_loss: 0.6103, test_loss: 1.0434, test_f1: 0.6371
 epoch: 51, train_loss: 0.5791, test_loss: 1.1020, test_f1: 0.6291
 epoch: 52, train_loss: 0.5611, test_loss: 1.1080, test_f1: 0.6432
 epoch: 53, train_loss: 0.5435, test_loss: 1.1687, test_f1: 0.6682
 epoch: 54, train_loss: 0.5317, test_loss: 1.1231, test_f1: 0.6527
 epoch: 55, train_loss: 0.5289, test_loss: 1.2580, test_f1: 0.6351
 epoch: 56, train_loss: 0.5234, test_loss: 1.1856, test_f1: 0.6412
 epoch: 57, train_loss: 0.5287, test_loss: 1.0881, test_f1: 0.6461
 epoch: 58, train_loss: 0.5162, test_loss: 1.1128, test_f1: 0.6505
 epoch: 59, train_loss: 0.5148, test_loss: 1.0880, test_f1: 0.6443
 epoch: 60, train_loss: 0.5018, test_loss: 1.3060, test_f1: 0.6475
 epoch: 61, train_loss: 0.5120, test_loss: 1.2649, test_f1: 0.6604
 epoch: 62, train_loss: 0.4820, test_loss: 1.2681, test_f1: 0.6437
 epoch: 63, train_loss: 0.4976, test_loss: 1.1564, test_f1: 0.6559
 epoch: 64, train_loss: 0.4888, test_loss: 1.2193, test_f1: 0.6739
 epoch: 65, train_loss: 0.4880, test_loss: 1.1714, test_f1: 0.6568
 epoch: 66, train_loss: 0.4752, test_loss: 1.3368, test_f1: 0.6582
 epoch: 67, train_loss: 0.4756, test_loss: 1.1497, test_f1: 0.6369
 epoch: 68, train_loss: 0.4613, test_loss: 1.2738, test_f1: 0.6416
 epoch: 69, train_loss: 0.4745, test_loss: 1.3627, test_f1: 0.6287
 epoch: 70, train_loss: 0.4760, test_loss: 1.3741, test_f1: 0.6242
 epoch: 71, train_loss: 0.4586, test_loss: 1.3027, test_f1: 0.6690
 epoch: 72, train_loss: 0.4799, test_loss: 1.2586, test_f1: 0.6546
 epoch: 73, train_loss: 0.4475, test_loss: 1.2707, test_f1: 0.6574
 epoch: 74, train_loss: 0.4467, test_loss: 1.2343, test_f1: 0.6648
 epoch: 75, train_loss: 0.4387, test_loss: 1.2538, test_f1: 0.6680
 epoch: 76, train_loss: 0.4375, test_loss: 1.3043, test_f1: 0.6600
 epoch: 77, train_loss: 0.4417, test_loss: 1.2850, test_f1: 0.6243
 epoch: 78, train_loss: 0.4513, test_loss: 1.2567, test_f1: 0.6466
 epoch: 79, train_loss: 0.4294, test_loss: 1.2057, test_f1: 0.6404
 epoch: 80, train_loss: 0.4347, test_loss: 1.3607, test_f1: 0.6516
 epoch: 81, train_loss: 0.4498, test_loss: 1.2730, test_f1: 0.6517
 epoch: 82, train_loss: 0.4481, test_loss: 1.2579, test_f1: 0.6666
 epoch: 83, train_loss: 0.4647, test_loss: 1.2851, test_f1: 0.6660
 epoch: 84, train_loss: 0.4398, test_loss: 1.3619, test_f1: 0.6412
 epoch: 85, train_loss: 0.4478, test_loss: 1.2747, test_f1: 0.6516
 epoch: 86, train_loss: 0.4332, test_loss: 1.4065, test_f1: 0.6783
 epoch: 87, train_loss: 0.4392, test_loss: 1.3927, test_f1: 0.6513
 epoch: 88, train_loss: 0.4380, test_loss: 1.1713, test_f1: 0.6707
 epoch: 89, train_loss: 0.4225, test_loss: 1.4290, test_f1: 0.6711
 epoch: 90, train_loss: 0.4135, test_loss: 1.4603, test_f1: 0.6356
 epoch: 91, train_loss: 0.4283, test_loss: 1.2822, test_f1: 0.6409
 epoch: 92, train_loss: 0.4317, test_loss: 1.2425, test_f1: 0.6742
 epoch: 93, train_loss: 0.4142, test_loss: 1.3223, test_f1: 0.6631
 epoch: 94, train_loss: 0.4038, test_loss: 1.2617, test_f1: 0.6508
 epoch: 95, train_loss: 0.3970, test_loss: 1.3480, test_f1: 0.6630
 epoch: 96, train_loss: 0.4072, test_loss: 1.3330, test_f1: 0.6671
 epoch: 97, train_loss: 0.4152, test_loss: 1.3311, test_f1: 0.6531
 epoch: 98, train_loss: 0.3906, test_loss: 1.3928, test_f1: 0.6803
 epoch: 99, train_loss: 0.3940, test_loss: 1.4634, test_f1: 0.6430
##################ITERATION #2 ****************************************
 epoch: 0, train_loss: 1.2360, test_loss: 1.2666, test_f1: 0.3117
 epoch: 1, train_loss: 1.0389, test_loss: 1.0289, test_f1: 0.4695
 epoch: 2, train_loss: 0.9837, test_loss: 0.9788, test_f1: 0.5164
 epoch: 3, train_loss: 0.9710, test_loss: 1.0117, test_f1: 0.4752
 epoch: 4, train_loss: 0.9502, test_loss: 0.9744, test_f1: 0.5166
 epoch: 5, train_loss: 0.9400, test_loss: 0.9811, test_f1: 0.4912
 epoch: 6, train_loss: 0.9235, test_loss: 1.0025, test_f1: 0.4838
 epoch: 7, train_loss: 0.9123, test_loss: 1.0564, test_f1: 0.4519
 epoch: 8, train_loss: 0.9038, test_loss: 0.9783, test_f1: 0.5254
 epoch: 9, train_loss: 0.9013, test_loss: 0.9020, test_f1: 0.5418
 epoch: 10, train_loss: 0.8954, test_loss: 0.9187, test_f1: 0.5302
 epoch: 11, train_loss: 0.8744, test_loss: 0.9247, test_f1: 0.5843
 epoch: 12, train_loss: 0.8593, test_loss: 0.9136, test_f1: 0.5872
 epoch: 13, train_loss: 0.8518, test_loss: 0.9580, test_f1: 0.5265
 epoch: 14, train_loss: 0.8463, test_loss: 0.9335, test_f1: 0.5931
 epoch: 15, train_loss: 0.8359, test_loss: 1.0683, test_f1: 0.5324
 epoch: 16, train_loss: 0.8450, test_loss: 0.8804, test_f1: 0.5541
 epoch: 17, train_loss: 0.8168, test_loss: 0.9634, test_f1: 0.5151
 epoch: 18, train_loss: 0.8004, test_loss: 0.8884, test_f1: 0.5379
 epoch: 19, train_loss: 0.8125, test_loss: 0.9189, test_f1: 0.5705
 epoch: 20, train_loss: 0.7959, test_loss: 0.9339, test_f1: 0.5918
 epoch: 21, train_loss: 0.7878, test_loss: 1.0505, test_f1: 0.5554
 epoch: 22, train_loss: 0.7794, test_loss: 0.9385, test_f1: 0.5570
 epoch: 23, train_loss: 0.7639, test_loss: 0.9266, test_f1: 0.5706
 epoch: 24, train_loss: 0.7742, test_loss: 0.8953, test_f1: 0.5806
 epoch: 25, train_loss: 0.7621, test_loss: 0.9206, test_f1: 0.6228
 epoch: 26, train_loss: 0.7677, test_loss: 1.0149, test_f1: 0.5783
 epoch: 27, train_loss: 0.7537, test_loss: 0.9037, test_f1: 0.5907
 epoch: 28, train_loss: 0.7479, test_loss: 1.0447, test_f1: 0.5962
 epoch: 29, train_loss: 0.7632, test_loss: 0.9766, test_f1: 0.6292
 epoch: 30, train_loss: 0.7503, test_loss: 0.9669, test_f1: 0.6128
 epoch: 31, train_loss: 0.7416, test_loss: 0.9942, test_f1: 0.6522
 epoch: 32, train_loss: 0.7030, test_loss: 0.9952, test_f1: 0.6214
 epoch: 33, train_loss: 0.7312, test_loss: 0.9669, test_f1: 0.6232
 epoch: 34, train_loss: 0.7174, test_loss: 1.0220, test_f1: 0.6100
 epoch: 35, train_loss: 0.6900, test_loss: 1.1276, test_f1: 0.5707
 epoch: 36, train_loss: 0.6955, test_loss: 1.0681, test_f1: 0.5664
 epoch: 37, train_loss: 0.7178, test_loss: 0.7856, test_f1: 0.6527
 epoch: 38, train_loss: 0.7081, test_loss: 1.0669, test_f1: 0.5752
 epoch: 39, train_loss: 0.6837, test_loss: 1.0537, test_f1: 0.6092
 epoch: 40, train_loss: 0.6921, test_loss: 1.0059, test_f1: 0.6361
 epoch: 41, train_loss: 0.7128, test_loss: 0.9479, test_f1: 0.6816
 epoch: 42, train_loss: 0.6853, test_loss: 0.9464, test_f1: 0.6177
 epoch: 43, train_loss: 0.6676, test_loss: 0.9923, test_f1: 0.6560
 epoch: 44, train_loss: 0.6717, test_loss: 0.9515, test_f1: 0.6490
 epoch: 45, train_loss: 0.6643, test_loss: 1.0392, test_f1: 0.6168
 epoch: 46, train_loss: 0.6571, test_loss: 0.9828, test_f1: 0.6118
 epoch: 47, train_loss: 0.6472, test_loss: 1.0921, test_f1: 0.6480
 epoch: 48, train_loss: 0.6474, test_loss: 1.0857, test_f1: 0.6650
 epoch: 49, train_loss: 0.6436, test_loss: 0.9801, test_f1: 0.6638
 epoch: 50, train_loss: 0.6506, test_loss: 1.2062, test_f1: 0.5586
 epoch: 51, train_loss: 0.6058, test_loss: 1.0009, test_f1: 0.6866
 epoch: 52, train_loss: 0.5837, test_loss: 1.1464, test_f1: 0.6388
 epoch: 53, train_loss: 0.5819, test_loss: 1.0910, test_f1: 0.6727
 epoch: 54, train_loss: 0.5772, test_loss: 1.2177, test_f1: 0.6411
 epoch: 55, train_loss: 0.5679, test_loss: 1.1472, test_f1: 0.6519
 epoch: 56, train_loss: 0.5653, test_loss: 1.1117, test_f1: 0.6711
 epoch: 57, train_loss: 0.5484, test_loss: 1.2972, test_f1: 0.6528
 epoch: 58, train_loss: 0.5601, test_loss: 1.1322, test_f1: 0.7052
 epoch: 59, train_loss: 0.5459, test_loss: 1.1207, test_f1: 0.6900
 epoch: 60, train_loss: 0.5388, test_loss: 1.1317, test_f1: 0.6723
 epoch: 61, train_loss: 0.5461, test_loss: 1.1856, test_f1: 0.6735
 epoch: 62, train_loss: 0.5384, test_loss: 1.1748, test_f1: 0.6876
 epoch: 63, train_loss: 0.5373, test_loss: 1.1758, test_f1: 0.6752
 epoch: 64, train_loss: 0.5526, test_loss: 1.2193, test_f1: 0.6564
 epoch: 65, train_loss: 0.5329, test_loss: 1.2743, test_f1: 0.6454
 epoch: 66, train_loss: 0.5193, test_loss: 1.2142, test_f1: 0.6498
 epoch: 67, train_loss: 0.5426, test_loss: 1.1892, test_f1: 0.6688
 epoch: 68, train_loss: 0.5223, test_loss: 1.1872, test_f1: 0.6696
 epoch: 69, train_loss: 0.5175, test_loss: 1.1899, test_f1: 0.6821
 epoch: 70, train_loss: 0.5224, test_loss: 1.3035, test_f1: 0.6942
 epoch: 71, train_loss: 0.5416, test_loss: 1.1371, test_f1: 0.6360
 epoch: 72, train_loss: 0.5262, test_loss: 1.2152, test_f1: 0.7090
 epoch: 73, train_loss: 0.5004, test_loss: 1.2238, test_f1: 0.6520
 epoch: 74, train_loss: 0.5121, test_loss: 1.2428, test_f1: 0.6491
 epoch: 75, train_loss: 0.5165, test_loss: 1.2737, test_f1: 0.6463
 epoch: 76, train_loss: 0.5103, test_loss: 1.2745, test_f1: 0.6672
 epoch: 77, train_loss: 0.4998, test_loss: 1.1441, test_f1: 0.6654
 epoch: 78, train_loss: 0.4910, test_loss: 1.3402, test_f1: 0.6247
 epoch: 79, train_loss: 0.5035, test_loss: 1.2509, test_f1: 0.6764
 epoch: 80, train_loss: 0.5032, test_loss: 1.2736, test_f1: 0.6661
 epoch: 81, train_loss: 0.4754, test_loss: 1.3321, test_f1: 0.6793
 epoch: 82, train_loss: 0.4843, test_loss: 1.3066, test_f1: 0.6670
 epoch: 83, train_loss: 0.4989, test_loss: 1.4061, test_f1: 0.6637
 epoch: 84, train_loss: 0.5005, test_loss: 1.4491, test_f1: 0.6745
 epoch: 85, train_loss: 0.4795, test_loss: 1.3332, test_f1: 0.6707
 epoch: 86, train_loss: 0.4939, test_loss: 1.1930, test_f1: 0.6764
 epoch: 87, train_loss: 0.4781, test_loss: 1.3762, test_f1: 0.7038
 epoch: 88, train_loss: 0.4692, test_loss: 1.2536, test_f1: 0.6534
 epoch: 89, train_loss: 0.4959, test_loss: 1.2342, test_f1: 0.6774
 epoch: 90, train_loss: 0.4817, test_loss: 1.3237, test_f1: 0.6718
 epoch: 91, train_loss: 0.4795, test_loss: 1.5368, test_f1: 0.6505
 epoch: 92, train_loss: 0.4885, test_loss: 1.3276, test_f1: 0.6703
 epoch: 93, train_loss: 0.4688, test_loss: 1.3425, test_f1: 0.6708
 epoch: 94, train_loss: 0.4580, test_loss: 1.2291, test_f1: 0.6894
 epoch: 95, train_loss: 0.4557, test_loss: 1.2777, test_f1: 0.6870
 epoch: 96, train_loss: 0.4574, test_loss: 1.2879, test_f1: 0.6610
 epoch: 97, train_loss: 0.4943, test_loss: 1.3205, test_f1: 0.6771
 epoch: 98, train_loss: 0.4775, test_loss: 1.4273, test_f1: 0.6797
 epoch: 99, train_loss: 0.4927, test_loss: 1.4208, test_f1: 0.6623
##################ITERATION #3 ****************************************
 epoch: 0, train_loss: 1.2431, test_loss: 1.4180, test_f1: 0.2848
 epoch: 1, train_loss: 1.0193, test_loss: 0.9961, test_f1: 0.4620
 epoch: 2, train_loss: 0.9717, test_loss: 0.9671, test_f1: 0.4689
 epoch: 3, train_loss: 0.9605, test_loss: 1.0975, test_f1: 0.4807
 epoch: 4, train_loss: 0.9405, test_loss: 0.9985, test_f1: 0.5007
 epoch: 5, train_loss: 0.9202, test_loss: 1.0546, test_f1: 0.4304
 epoch: 6, train_loss: 0.8917, test_loss: 0.9271, test_f1: 0.5405
 epoch: 7, train_loss: 0.8861, test_loss: 0.9976, test_f1: 0.4804
 epoch: 8, train_loss: 0.8618, test_loss: 0.8613, test_f1: 0.5730
 epoch: 9, train_loss: 0.8638, test_loss: 1.0683, test_f1: 0.5066
 epoch: 10, train_loss: 0.8586, test_loss: 2.0700, test_f1: 0.3249
 epoch: 11, train_loss: 0.8475, test_loss: 0.8553, test_f1: 0.5338
 epoch: 12, train_loss: 0.8402, test_loss: 1.2574, test_f1: 0.4589
 epoch: 13, train_loss: 0.8412, test_loss: 1.0116, test_f1: 0.4940
 epoch: 14, train_loss: 0.8289, test_loss: 1.0431, test_f1: 0.5567
 epoch: 15, train_loss: 0.8295, test_loss: 1.0388, test_f1: 0.5274
 epoch: 16, train_loss: 0.8280, test_loss: 0.8474, test_f1: 0.5366
 epoch: 17, train_loss: 0.8215, test_loss: 1.0554, test_f1: 0.5348
 epoch: 18, train_loss: 0.8172, test_loss: 0.9732, test_f1: 0.5196
 epoch: 19, train_loss: 0.7921, test_loss: 1.0575, test_f1: 0.5285
 epoch: 20, train_loss: 0.8067, test_loss: 1.0161, test_f1: 0.5301
 epoch: 21, train_loss: 0.7675, test_loss: 1.1045, test_f1: 0.5724
 epoch: 22, train_loss: 0.7745, test_loss: 1.0261, test_f1: 0.5438
 epoch: 23, train_loss: 0.7633, test_loss: 0.8813, test_f1: 0.6028
 epoch: 24, train_loss: 0.7659, test_loss: 1.0105, test_f1: 0.5522
 epoch: 25, train_loss: 0.7585, test_loss: 1.0884, test_f1: 0.6176
 epoch: 26, train_loss: 0.7456, test_loss: 0.9655, test_f1: 0.5812
 epoch: 27, train_loss: 0.7391, test_loss: 1.0204, test_f1: 0.6092
 epoch: 28, train_loss: 0.7411, test_loss: 1.0359, test_f1: 0.5911
 epoch: 29, train_loss: 0.7648, test_loss: 0.9689, test_f1: 0.5460
 epoch: 30, train_loss: 0.7271, test_loss: 1.1462, test_f1: 0.5666
 epoch: 31, train_loss: 0.7299, test_loss: 1.0121, test_f1: 0.6237
 epoch: 32, train_loss: 0.7243, test_loss: 1.0829, test_f1: 0.5598
 epoch: 33, train_loss: 0.7309, test_loss: 1.0645, test_f1: 0.5916
 epoch: 34, train_loss: 0.7070, test_loss: 1.0140, test_f1: 0.6306
 epoch: 35, train_loss: 0.6914, test_loss: 1.3545, test_f1: 0.5136
 epoch: 36, train_loss: 0.6868, test_loss: 1.3333, test_f1: 0.4800
 epoch: 37, train_loss: 0.6959, test_loss: 1.0432, test_f1: 0.5758
 epoch: 38, train_loss: 0.6889, test_loss: 0.9662, test_f1: 0.6385
 epoch: 39, train_loss: 0.6474, test_loss: 1.1669, test_f1: 0.5803
 epoch: 40, train_loss: 0.6700, test_loss: 1.0083, test_f1: 0.6224
 epoch: 41, train_loss: 0.7056, test_loss: 1.0320, test_f1: 0.5658
 epoch: 42, train_loss: 0.6801, test_loss: 1.0329, test_f1: 0.6003
 epoch: 43, train_loss: 0.6758, test_loss: 0.9823, test_f1: 0.6331
 epoch: 44, train_loss: 0.6490, test_loss: 1.0402, test_f1: 0.6120
 epoch: 45, train_loss: 0.6564, test_loss: 1.0573, test_f1: 0.6288
 epoch: 46, train_loss: 0.6652, test_loss: 1.0356, test_f1: 0.6260
 epoch: 47, train_loss: 0.6586, test_loss: 1.0669, test_f1: 0.5974
 epoch: 48, train_loss: 0.6474, test_loss: 1.1295, test_f1: 0.6369
 epoch: 49, train_loss: 0.6448, test_loss: 1.1636, test_f1: 0.6097
 epoch: 50, train_loss: 0.6264, test_loss: 1.0455, test_f1: 0.6061
 epoch: 51, train_loss: 0.6075, test_loss: 1.0912, test_f1: 0.6137
 epoch: 52, train_loss: 0.5824, test_loss: 1.0712, test_f1: 0.6231
 epoch: 53, train_loss: 0.5772, test_loss: 1.1290, test_f1: 0.6554
 epoch: 54, train_loss: 0.5538, test_loss: 1.1240, test_f1: 0.6502
 epoch: 55, train_loss: 0.5689, test_loss: 1.0869, test_f1: 0.6397
 epoch: 56, train_loss: 0.5572, test_loss: 1.3719, test_f1: 0.6238
 epoch: 57, train_loss: 0.5546, test_loss: 1.2309, test_f1: 0.6582
 epoch: 58, train_loss: 0.5633, test_loss: 1.4017, test_f1: 0.6103
 epoch: 59, train_loss: 0.5545, test_loss: 1.2393, test_f1: 0.6661
 epoch: 60, train_loss: 0.5548, test_loss: 1.2236, test_f1: 0.6120
 epoch: 61, train_loss: 0.5283, test_loss: 1.2043, test_f1: 0.6271
 epoch: 62, train_loss: 0.5459, test_loss: 1.3512, test_f1: 0.6280
 epoch: 63, train_loss: 0.5307, test_loss: 1.1712, test_f1: 0.6400
 epoch: 64, train_loss: 0.5263, test_loss: 1.1712, test_f1: 0.6436
 epoch: 65, train_loss: 0.5157, test_loss: 1.1629, test_f1: 0.6363
 epoch: 66, train_loss: 0.4975, test_loss: 1.3321, test_f1: 0.6040
 epoch: 67, train_loss: 0.5269, test_loss: 1.2573, test_f1: 0.6088
 epoch: 68, train_loss: 0.5176, test_loss: 1.3856, test_f1: 0.6254
 epoch: 69, train_loss: 0.5173, test_loss: 1.1581, test_f1: 0.6471
 epoch: 70, train_loss: 0.5149, test_loss: 1.4026, test_f1: 0.6040
 epoch: 71, train_loss: 0.5013, test_loss: 1.1685, test_f1: 0.6190
 epoch: 72, train_loss: 0.4988, test_loss: 1.2176, test_f1: 0.6386
 epoch: 73, train_loss: 0.4860, test_loss: 1.4706, test_f1: 0.6082
 epoch: 74, train_loss: 0.5047, test_loss: 1.3993, test_f1: 0.6358
 epoch: 75, train_loss: 0.5039, test_loss: 1.2228, test_f1: 0.6326
 epoch: 76, train_loss: 0.5013, test_loss: 1.3559, test_f1: 0.6250
 epoch: 77, train_loss: 0.4923, test_loss: 1.3826, test_f1: 0.6139
 epoch: 78, train_loss: 0.4824, test_loss: 1.2435, test_f1: 0.6397
 epoch: 79, train_loss: 0.4984, test_loss: 1.2851, test_f1: 0.6454
 epoch: 80, train_loss: 0.4902, test_loss: 1.2759, test_f1: 0.6337
 epoch: 81, train_loss: 0.4685, test_loss: 1.4861, test_f1: 0.6510
 epoch: 82, train_loss: 0.4722, test_loss: 1.3535, test_f1: 0.6598
 epoch: 83, train_loss: 0.4478, test_loss: 1.4708, test_f1: 0.6376
 epoch: 84, train_loss: 0.4807, test_loss: 1.1992, test_f1: 0.6391
 epoch: 85, train_loss: 0.4719, test_loss: 1.5363, test_f1: 0.6378
 epoch: 86, train_loss: 0.4609, test_loss: 1.4788, test_f1: 0.6423
 epoch: 87, train_loss: 0.4727, test_loss: 1.3085, test_f1: 0.6350
 epoch: 88, train_loss: 0.4555, test_loss: 1.3891, test_f1: 0.6473
 epoch: 89, train_loss: 0.4434, test_loss: 1.2146, test_f1: 0.6386
 epoch: 90, train_loss: 0.4576, test_loss: 1.2184, test_f1: 0.6483
 epoch: 91, train_loss: 0.4672, test_loss: 1.4557, test_f1: 0.6355
 epoch: 92, train_loss: 0.4579, test_loss: 1.3659, test_f1: 0.6310
 epoch: 93, train_loss: 0.4400, test_loss: 1.4390, test_f1: 0.6379
 epoch: 94, train_loss: 0.4190, test_loss: 1.5148, test_f1: 0.6268
 epoch: 95, train_loss: 0.4360, test_loss: 1.4288, test_f1: 0.6508
 epoch: 96, train_loss: 0.4190, test_loss: 1.4445, test_f1: 0.6419
 epoch: 97, train_loss: 0.4431, test_loss: 1.5246, test_f1: 0.6584
 epoch: 98, train_loss: 0.4214, test_loss: 1.6648, test_f1: 0.6350
 epoch: 99, train_loss: 0.4244, test_loss: 1.4031, test_f1: 0.6280
##################ITERATION #4 ****************************************
 epoch: 0, train_loss: 1.1833, test_loss: 1.2088, test_f1: 0.3552
 epoch: 1, train_loss: 0.9986, test_loss: 0.9723, test_f1: 0.4887
 epoch: 2, train_loss: 0.9621, test_loss: 0.9556, test_f1: 0.5102
 epoch: 3, train_loss: 0.9345, test_loss: 0.9583, test_f1: 0.4656
 epoch: 4, train_loss: 0.9224, test_loss: 0.9320, test_f1: 0.5363
 epoch: 5, train_loss: 0.9119, test_loss: 0.8981, test_f1: 0.5067
 epoch: 6, train_loss: 0.8951, test_loss: 0.9471, test_f1: 0.5367
 epoch: 7, train_loss: 0.8843, test_loss: 0.8880, test_f1: 0.5577
 epoch: 8, train_loss: 0.8711, test_loss: 0.9039, test_f1: 0.5186
 epoch: 9, train_loss: 0.8440, test_loss: 0.9851, test_f1: 0.5024
 epoch: 10, train_loss: 0.8408, test_loss: 0.9436, test_f1: 0.5505
 epoch: 11, train_loss: 0.8608, test_loss: 0.9195, test_f1: 0.5856
 epoch: 12, train_loss: 0.8478, test_loss: 0.9088, test_f1: 0.5317
 epoch: 13, train_loss: 0.8367, test_loss: 0.9579, test_f1: 0.5239
 epoch: 14, train_loss: 0.8083, test_loss: 0.9049, test_f1: 0.5506
 epoch: 15, train_loss: 0.8344, test_loss: 0.9064, test_f1: 0.5776
 epoch: 16, train_loss: 0.8053, test_loss: 0.9027, test_f1: 0.5435
 epoch: 17, train_loss: 0.7822, test_loss: 0.8951, test_f1: 0.5812
 epoch: 18, train_loss: 0.7831, test_loss: 1.0657, test_f1: 0.4830
 epoch: 19, train_loss: 0.7832, test_loss: 0.9246, test_f1: 0.5329
 epoch: 20, train_loss: 0.7620, test_loss: 0.9343, test_f1: 0.5627
 epoch: 21, train_loss: 0.7870, test_loss: 1.0052, test_f1: 0.5130
 epoch: 22, train_loss: 0.7622, test_loss: 0.8457, test_f1: 0.5786
 epoch: 23, train_loss: 0.7470, test_loss: 0.8046, test_f1: 0.6283
 epoch: 24, train_loss: 0.7560, test_loss: 0.9280, test_f1: 0.5643
 epoch: 25, train_loss: 0.7147, test_loss: 0.8991, test_f1: 0.5565
 epoch: 26, train_loss: 0.7264, test_loss: 0.9501, test_f1: 0.5743
 epoch: 27, train_loss: 0.7149, test_loss: 0.9174, test_f1: 0.6259
 epoch: 28, train_loss: 0.7117, test_loss: 0.9321, test_f1: 0.5699
 epoch: 29, train_loss: 0.7067, test_loss: 0.9637, test_f1: 0.5830
 epoch: 30, train_loss: 0.7067, test_loss: 0.9086, test_f1: 0.6231
 epoch: 31, train_loss: 0.7318, test_loss: 1.0095, test_f1: 0.5727
 epoch: 32, train_loss: 0.7054, test_loss: 0.9020, test_f1: 0.5785
 epoch: 33, train_loss: 0.6993, test_loss: 0.9205, test_f1: 0.5748
 epoch: 34, train_loss: 0.6869, test_loss: 0.8777, test_f1: 0.5759
 epoch: 35, train_loss: 0.6719, test_loss: 1.0121, test_f1: 0.5601
 epoch: 36, train_loss: 0.6539, test_loss: 0.9589, test_f1: 0.5982
 epoch: 37, train_loss: 0.6598, test_loss: 0.9921, test_f1: 0.5771
 epoch: 38, train_loss: 0.6586, test_loss: 0.9042, test_f1: 0.6106
 epoch: 39, train_loss: 0.6445, test_loss: 1.0849, test_f1: 0.5928
 epoch: 40, train_loss: 0.6419, test_loss: 0.9357, test_f1: 0.6109
 epoch: 41, train_loss: 0.6675, test_loss: 0.9867, test_f1: 0.5642
 epoch: 42, train_loss: 0.6487, test_loss: 0.9071, test_f1: 0.5818
 epoch: 43, train_loss: 0.6594, test_loss: 0.9853, test_f1: 0.5946
 epoch: 44, train_loss: 0.6362, test_loss: 1.0605, test_f1: 0.5998
 epoch: 45, train_loss: 0.6148, test_loss: 0.9970, test_f1: 0.5994
 epoch: 46, train_loss: 0.6178, test_loss: 1.0441, test_f1: 0.6365
 epoch: 47, train_loss: 0.6397, test_loss: 1.0250, test_f1: 0.6241
 epoch: 48, train_loss: 0.6078, test_loss: 1.0333, test_f1: 0.6167
 epoch: 49, train_loss: 0.6099, test_loss: 1.0862, test_f1: 0.5728
 epoch: 50, train_loss: 0.5927, test_loss: 0.9623, test_f1: 0.6700
 epoch: 51, train_loss: 0.5566, test_loss: 0.9642, test_f1: 0.6424
 epoch: 52, train_loss: 0.5590, test_loss: 0.9680, test_f1: 0.6292
 epoch: 53, train_loss: 0.5373, test_loss: 0.9542, test_f1: 0.6330
 epoch: 54, train_loss: 0.5241, test_loss: 0.9720, test_f1: 0.6500
 epoch: 55, train_loss: 0.5236, test_loss: 0.9632, test_f1: 0.6613
 epoch: 56, train_loss: 0.5336, test_loss: 0.9724, test_f1: 0.6345
 epoch: 57, train_loss: 0.5122, test_loss: 1.1307, test_f1: 0.6270
 epoch: 58, train_loss: 0.5134, test_loss: 1.1266, test_f1: 0.5956
 epoch: 59, train_loss: 0.5053, test_loss: 1.1183, test_f1: 0.6514
 epoch: 60, train_loss: 0.5042, test_loss: 1.1204, test_f1: 0.6524
 epoch: 61, train_loss: 0.5046, test_loss: 1.1302, test_f1: 0.6390
 epoch: 62, train_loss: 0.4942, test_loss: 1.1688, test_f1: 0.6185
 epoch: 63, train_loss: 0.4934, test_loss: 1.1064, test_f1: 0.6194
 epoch: 64, train_loss: 0.4865, test_loss: 1.1803, test_f1: 0.6346
 epoch: 65, train_loss: 0.5064, test_loss: 1.3140, test_f1: 0.6493
 epoch: 66, train_loss: 0.5001, test_loss: 1.2399, test_f1: 0.6427
 epoch: 67, train_loss: 0.5130, test_loss: 1.1775, test_f1: 0.6444
 epoch: 68, train_loss: 0.5096, test_loss: 1.1978, test_f1: 0.6254
 epoch: 69, train_loss: 0.4803, test_loss: 1.2610, test_f1: 0.6707
 epoch: 70, train_loss: 0.4740, test_loss: 1.2393, test_f1: 0.6234
 epoch: 71, train_loss: 0.4883, test_loss: 1.3481, test_f1: 0.6249
 epoch: 72, train_loss: 0.4474, test_loss: 1.1768, test_f1: 0.6820
 epoch: 73, train_loss: 0.4675, test_loss: 1.2489, test_f1: 0.6461
 epoch: 74, train_loss: 0.4587, test_loss: 1.2085, test_f1: 0.6517
 epoch: 75, train_loss: 0.4498, test_loss: 1.1733, test_f1: 0.6712
 epoch: 76, train_loss: 0.4558, test_loss: 1.2701, test_f1: 0.6773
 epoch: 77, train_loss: 0.4459, test_loss: 1.2345, test_f1: 0.6428
 epoch: 78, train_loss: 0.4423, test_loss: 1.2158, test_f1: 0.6350
 epoch: 79, train_loss: 0.4457, test_loss: 1.2786, test_f1: 0.6430
 epoch: 80, train_loss: 0.4686, test_loss: 1.2220, test_f1: 0.6360
 epoch: 81, train_loss: 0.4422, test_loss: 1.1926, test_f1: 0.6523
 epoch: 82, train_loss: 0.4377, test_loss: 1.3824, test_f1: 0.6396
 epoch: 83, train_loss: 0.4625, test_loss: 1.2754, test_f1: 0.6554
 epoch: 84, train_loss: 0.4555, test_loss: 1.2610, test_f1: 0.6620
 epoch: 85, train_loss: 0.4465, test_loss: 1.3038, test_f1: 0.6792
 epoch: 86, train_loss: 0.4464, test_loss: 1.1551, test_f1: 0.6612
 epoch: 87, train_loss: 0.4225, test_loss: 1.2154, test_f1: 0.6629
 epoch: 88, train_loss: 0.4325, test_loss: 1.1487, test_f1: 0.6487
 epoch: 89, train_loss: 0.4441, test_loss: 1.2565, test_f1: 0.6346
 epoch: 90, train_loss: 0.4255, test_loss: 1.2583, test_f1: 0.6619
 epoch: 91, train_loss: 0.4303, test_loss: 1.3901, test_f1: 0.6614
 epoch: 92, train_loss: 0.4225, test_loss: 1.3213, test_f1: 0.6423
 epoch: 93, train_loss: 0.4058, test_loss: 1.3138, test_f1: 0.6405
 epoch: 94, train_loss: 0.4193, test_loss: 1.3661, test_f1: 0.6401
 epoch: 95, train_loss: 0.3994, test_loss: 1.4718, test_f1: 0.6262
 epoch: 96, train_loss: 0.4062, test_loss: 1.3558, test_f1: 0.6482
 epoch: 97, train_loss: 0.4079, test_loss: 1.4778, test_f1: 0.6820
 epoch: 98, train_loss: 0.4078, test_loss: 1.2653, test_f1: 0.6595
 epoch: 99, train_loss: 0.4112, test_loss: 1.4218, test_f1: 0.6592
##################ITERATION #5 ****************************************
 epoch: 0, train_loss: 1.2264, test_loss: 1.2273, test_f1: 0.3327
 epoch: 1, train_loss: 0.9926, test_loss: 1.0024, test_f1: 0.4556
 epoch: 2, train_loss: 0.9717, test_loss: 1.0100, test_f1: 0.4818
 epoch: 3, train_loss: 0.9475, test_loss: 0.9940, test_f1: 0.4906
 epoch: 4, train_loss: 0.9572, test_loss: 1.0346, test_f1: 0.4439
 epoch: 5, train_loss: 0.9311, test_loss: 1.0856, test_f1: 0.4325
 epoch: 6, train_loss: 0.9065, test_loss: 0.9196, test_f1: 0.5226
 epoch: 7, train_loss: 0.8877, test_loss: 0.9692, test_f1: 0.5469
 epoch: 8, train_loss: 0.8902, test_loss: 0.9778, test_f1: 0.5298
 epoch: 9, train_loss: 0.8824, test_loss: 1.0073, test_f1: 0.4580
 epoch: 10, train_loss: 0.8693, test_loss: 1.0356, test_f1: 0.4899
 epoch: 11, train_loss: 0.8554, test_loss: 0.9355, test_f1: 0.5638
 epoch: 12, train_loss: 0.8520, test_loss: 0.8452, test_f1: 0.5790
 epoch: 13, train_loss: 0.8293, test_loss: 0.9822, test_f1: 0.5415
 epoch: 14, train_loss: 0.8260, test_loss: 0.8950, test_f1: 0.5577
 epoch: 15, train_loss: 0.8390, test_loss: 0.9754, test_f1: 0.5289
 epoch: 16, train_loss: 0.8275, test_loss: 0.9411, test_f1: 0.5245
 epoch: 17, train_loss: 0.8176, test_loss: 0.9485, test_f1: 0.5293
 epoch: 18, train_loss: 0.7938, test_loss: 1.0093, test_f1: 0.5674
 epoch: 19, train_loss: 0.7832, test_loss: 1.2144, test_f1: 0.5113
 epoch: 20, train_loss: 0.7659, test_loss: 0.9283, test_f1: 0.5493
 epoch: 21, train_loss: 0.7760, test_loss: 1.0150, test_f1: 0.5614
 epoch: 22, train_loss: 0.7479, test_loss: 1.0178, test_f1: 0.5837
 epoch: 23, train_loss: 0.7684, test_loss: 0.8790, test_f1: 0.5426
 epoch: 24, train_loss: 0.7640, test_loss: 1.0072, test_f1: 0.5976
 epoch: 25, train_loss: 0.7555, test_loss: 0.8860, test_f1: 0.6217
 epoch: 26, train_loss: 0.7187, test_loss: 0.9902, test_f1: 0.5755
 epoch: 27, train_loss: 0.7086, test_loss: 0.9277, test_f1: 0.6286
 epoch: 28, train_loss: 0.7117, test_loss: 0.9714, test_f1: 0.5784
 epoch: 29, train_loss: 0.7023, test_loss: 1.0707, test_f1: 0.6214
 epoch: 30, train_loss: 0.7132, test_loss: 0.9368, test_f1: 0.6129
 epoch: 31, train_loss: 0.6931, test_loss: 1.0032, test_f1: 0.5998
 epoch: 32, train_loss: 0.6900, test_loss: 1.0470, test_f1: 0.6072
 epoch: 33, train_loss: 0.7058, test_loss: 1.0970, test_f1: 0.5702
 epoch: 34, train_loss: 0.7038, test_loss: 0.9423, test_f1: 0.6277
 epoch: 35, train_loss: 0.6650, test_loss: 0.9839, test_f1: 0.6041
 epoch: 36, train_loss: 0.6709, test_loss: 0.9365, test_f1: 0.6088
 epoch: 37, train_loss: 0.6730, test_loss: 1.0164, test_f1: 0.6383
 epoch: 38, train_loss: 0.6559, test_loss: 1.0265, test_f1: 0.6227
 epoch: 39, train_loss: 0.6424, test_loss: 0.9424, test_f1: 0.6178
 epoch: 40, train_loss: 0.6432, test_loss: 1.0470, test_f1: 0.6088
 epoch: 41, train_loss: 0.6266, test_loss: 0.9583, test_f1: 0.6266
 epoch: 42, train_loss: 0.6128, test_loss: 1.0246, test_f1: 0.5968
 epoch: 43, train_loss: 0.6352, test_loss: 1.0222, test_f1: 0.6170
 epoch: 44, train_loss: 0.5962, test_loss: 1.1389, test_f1: 0.5702
 epoch: 45, train_loss: 0.6096, test_loss: 1.1504, test_f1: 0.5680
 epoch: 46, train_loss: 0.5944, test_loss: 0.9651, test_f1: 0.5908
 epoch: 47, train_loss: 0.5902, test_loss: 1.0758, test_f1: 0.6380
 epoch: 48, train_loss: 0.5967, test_loss: 1.0463, test_f1: 0.6237
 epoch: 49, train_loss: 0.6102, test_loss: 1.2069, test_f1: 0.5543
 epoch: 50, train_loss: 0.6190, test_loss: 1.0374, test_f1: 0.6328
 epoch: 51, train_loss: 0.5670, test_loss: 1.0935, test_f1: 0.6985
 epoch: 52, train_loss: 0.5529, test_loss: 1.0364, test_f1: 0.6574
 epoch: 53, train_loss: 0.5238, test_loss: 1.0097, test_f1: 0.6354
 epoch: 54, train_loss: 0.5081, test_loss: 1.1737, test_f1: 0.6403
 epoch: 55, train_loss: 0.5234, test_loss: 1.0420, test_f1: 0.6846
 epoch: 56, train_loss: 0.5034, test_loss: 1.2160, test_f1: 0.6199
 epoch: 57, train_loss: 0.5143, test_loss: 1.1024, test_f1: 0.6671
 epoch: 58, train_loss: 0.4891, test_loss: 0.9597, test_f1: 0.6313
 epoch: 59, train_loss: 0.4959, test_loss: 1.1319, test_f1: 0.6770
 epoch: 60, train_loss: 0.4700, test_loss: 1.2591, test_f1: 0.6365
 epoch: 61, train_loss: 0.4829, test_loss: 1.3339, test_f1: 0.6254
 epoch: 62, train_loss: 0.4771, test_loss: 1.3051, test_f1: 0.6447
 epoch: 63, train_loss: 0.4662, test_loss: 1.2096, test_f1: 0.6485
 epoch: 64, train_loss: 0.4634, test_loss: 1.2426, test_f1: 0.6689
 epoch: 65, train_loss: 0.4744, test_loss: 1.0819, test_f1: 0.6659
 epoch: 66, train_loss: 0.4621, test_loss: 1.2332, test_f1: 0.6280
 epoch: 67, train_loss: 0.4593, test_loss: 1.0601, test_f1: 0.6541
 epoch: 68, train_loss: 0.4822, test_loss: 1.4262, test_f1: 0.6181
 epoch: 69, train_loss: 0.4433, test_loss: 1.1897, test_f1: 0.6507
 epoch: 70, train_loss: 0.4684, test_loss: 1.2002, test_f1: 0.6404
 epoch: 71, train_loss: 0.4441, test_loss: 1.3104, test_f1: 0.6371
 epoch: 72, train_loss: 0.4568, test_loss: 1.3630, test_f1: 0.6599
 epoch: 73, train_loss: 0.4622, test_loss: 1.2249, test_f1: 0.6681
 epoch: 74, train_loss: 0.4337, test_loss: 1.2951, test_f1: 0.6431
 epoch: 75, train_loss: 0.4440, test_loss: 1.2088, test_f1: 0.6391
 epoch: 76, train_loss: 0.4308, test_loss: 1.3022, test_f1: 0.6549
 epoch: 77, train_loss: 0.4469, test_loss: 1.2813, test_f1: 0.6815
 epoch: 78, train_loss: 0.4481, test_loss: 1.4539, test_f1: 0.6268
 epoch: 79, train_loss: 0.4094, test_loss: 1.2268, test_f1: 0.6435
 epoch: 80, train_loss: 0.4397, test_loss: 1.3195, test_f1: 0.6237
 epoch: 81, train_loss: 0.4015, test_loss: 1.3264, test_f1: 0.6225
 epoch: 82, train_loss: 0.4341, test_loss: 1.3815, test_f1: 0.6733
 epoch: 83, train_loss: 0.4199, test_loss: 1.6223, test_f1: 0.6465
 epoch: 84, train_loss: 0.3918, test_loss: 1.5039, test_f1: 0.6854
 epoch: 85, train_loss: 0.4088, test_loss: 1.5955, test_f1: 0.6751
 epoch: 86, train_loss: 0.4110, test_loss: 1.4167, test_f1: 0.6479
 epoch: 87, train_loss: 0.3822, test_loss: 1.4937, test_f1: 0.6576
 epoch: 88, train_loss: 0.4154, test_loss: 1.4356, test_f1: 0.6360
 epoch: 89, train_loss: 0.4049, test_loss: 1.6068, test_f1: 0.6492
 epoch: 90, train_loss: 0.3949, test_loss: 1.2781, test_f1: 0.6596
 epoch: 91, train_loss: 0.4233, test_loss: 1.5736, test_f1: 0.6532
 epoch: 92, train_loss: 0.4360, test_loss: 1.1301, test_f1: 0.6536
 epoch: 93, train_loss: 0.4082, test_loss: 1.3640, test_f1: 0.6329
 epoch: 94, train_loss: 0.3948, test_loss: 1.4476, test_f1: 0.6413
 epoch: 95, train_loss: 0.3799, test_loss: 1.6104, test_f1: 0.6301
 epoch: 96, train_loss: 0.3895, test_loss: 1.6593, test_f1: 0.6473
 epoch: 97, train_loss: 0.4038, test_loss: 1.5060, test_f1: 0.6301
 epoch: 98, train_loss: 0.4022, test_loss: 1.4083, test_f1: 0.6457
 epoch: 99, train_loss: 0.3924, test_loss: 1.5074, test_f1: 0.6477
##################ITERATION #6 ****************************************
 epoch: 0, train_loss: 1.2807, test_loss: 1.1788, test_f1: 0.3314
 epoch: 1, train_loss: 1.0072, test_loss: 1.0163, test_f1: 0.4821
 epoch: 2, train_loss: 0.9662, test_loss: 1.0113, test_f1: 0.4892
 epoch: 3, train_loss: 0.9540, test_loss: 1.0642, test_f1: 0.4515
 epoch: 4, train_loss: 0.9317, test_loss: 1.0018, test_f1: 0.5444
 epoch: 5, train_loss: 0.9202, test_loss: 0.9626, test_f1: 0.5181
 epoch: 6, train_loss: 0.9106, test_loss: 0.9113, test_f1: 0.5453
 epoch: 7, train_loss: 0.9034, test_loss: 1.0071, test_f1: 0.5129
 epoch: 8, train_loss: 0.8966, test_loss: 0.9269, test_f1: 0.5215
 epoch: 9, train_loss: 0.8932, test_loss: 0.9855, test_f1: 0.5138
 epoch: 10, train_loss: 0.8791, test_loss: 0.9652, test_f1: 0.5276
 epoch: 11, train_loss: 0.8615, test_loss: 0.9951, test_f1: 0.5451
 epoch: 12, train_loss: 0.8510, test_loss: 0.8719, test_f1: 0.5409
 epoch: 13, train_loss: 0.8275, test_loss: 0.8732, test_f1: 0.5386
 epoch: 14, train_loss: 0.8015, test_loss: 0.9542, test_f1: 0.5462
 epoch: 15, train_loss: 0.8094, test_loss: 0.9381, test_f1: 0.5669
 epoch: 16, train_loss: 0.8014, test_loss: 0.9398, test_f1: 0.5814
 epoch: 17, train_loss: 0.8022, test_loss: 0.9565, test_f1: 0.5907
 epoch: 18, train_loss: 0.7847, test_loss: 0.9850, test_f1: 0.5751
 epoch: 19, train_loss: 0.8070, test_loss: 0.9086, test_f1: 0.5337
 epoch: 20, train_loss: 0.7778, test_loss: 0.9442, test_f1: 0.5265
 epoch: 21, train_loss: 0.7807, test_loss: 0.9613, test_f1: 0.5611
 epoch: 22, train_loss: 0.7624, test_loss: 1.0860, test_f1: 0.5439
 epoch: 23, train_loss: 0.7605, test_loss: 0.9155, test_f1: 0.5737
 epoch: 24, train_loss: 0.7501, test_loss: 0.9713, test_f1: 0.5662
 epoch: 25, train_loss: 0.7393, test_loss: 0.9439, test_f1: 0.5640
 epoch: 26, train_loss: 0.7380, test_loss: 0.9411, test_f1: 0.5856
 epoch: 27, train_loss: 0.7388, test_loss: 1.1379, test_f1: 0.5365
 epoch: 28, train_loss: 0.7233, test_loss: 0.8890, test_f1: 0.6389
 epoch: 29, train_loss: 0.7036, test_loss: 0.9450, test_f1: 0.5774
 epoch: 30, train_loss: 0.7165, test_loss: 0.9261, test_f1: 0.5561
 epoch: 31, train_loss: 0.7026, test_loss: 0.9013, test_f1: 0.5672
 epoch: 32, train_loss: 0.7100, test_loss: 0.9527, test_f1: 0.5718
 epoch: 33, train_loss: 0.6970, test_loss: 0.9578, test_f1: 0.6020
 epoch: 34, train_loss: 0.6871, test_loss: 1.0039, test_f1: 0.5818
 epoch: 35, train_loss: 0.6940, test_loss: 0.8937, test_f1: 0.5608
 epoch: 36, train_loss: 0.6802, test_loss: 0.8860, test_f1: 0.6562
 epoch: 37, train_loss: 0.6700, test_loss: 0.9940, test_f1: 0.6328
 epoch: 38, train_loss: 0.6741, test_loss: 1.1138, test_f1: 0.5920
 epoch: 39, train_loss: 0.6644, test_loss: 0.9748, test_f1: 0.6551
 epoch: 40, train_loss: 0.6798, test_loss: 1.0210, test_f1: 0.6229
 epoch: 41, train_loss: 0.6836, test_loss: 1.0710, test_f1: 0.5767
 epoch: 42, train_loss: 0.6625, test_loss: 1.0239, test_f1: 0.6173
 epoch: 43, train_loss: 0.6468, test_loss: 0.9114, test_f1: 0.6342
 epoch: 44, train_loss: 0.6678, test_loss: 0.9845, test_f1: 0.6524
 epoch: 45, train_loss: 0.6370, test_loss: 0.9591, test_f1: 0.6247
 epoch: 46, train_loss: 0.6318, test_loss: 1.0907, test_f1: 0.6091
 epoch: 47, train_loss: 0.6548, test_loss: 1.0929, test_f1: 0.6008
 epoch: 48, train_loss: 0.6295, test_loss: 0.9991, test_f1: 0.5998
 epoch: 49, train_loss: 0.6187, test_loss: 0.9386, test_f1: 0.6585
 epoch: 50, train_loss: 0.6113, test_loss: 0.9935, test_f1: 0.6590
 epoch: 51, train_loss: 0.5849, test_loss: 0.9753, test_f1: 0.6432
 epoch: 52, train_loss: 0.5544, test_loss: 0.9360, test_f1: 0.6910
 epoch: 53, train_loss: 0.5522, test_loss: 1.0063, test_f1: 0.6769
 epoch: 54, train_loss: 0.5322, test_loss: 1.0507, test_f1: 0.6809
 epoch: 55, train_loss: 0.5350, test_loss: 0.9536, test_f1: 0.6867
 epoch: 56, train_loss: 0.5310, test_loss: 0.9329, test_f1: 0.6864
 epoch: 57, train_loss: 0.5271, test_loss: 0.9866, test_f1: 0.6666
 epoch: 58, train_loss: 0.5329, test_loss: 0.9947, test_f1: 0.6749
 epoch: 59, train_loss: 0.5063, test_loss: 1.0931, test_f1: 0.6629
 epoch: 60, train_loss: 0.5381, test_loss: 1.1154, test_f1: 0.6443
 epoch: 61, train_loss: 0.5123, test_loss: 0.9544, test_f1: 0.6677
 epoch: 62, train_loss: 0.5240, test_loss: 1.0250, test_f1: 0.6797
 epoch: 63, train_loss: 0.5058, test_loss: 0.9846, test_f1: 0.6637
 epoch: 64, train_loss: 0.4999, test_loss: 1.1375, test_f1: 0.6769
 epoch: 65, train_loss: 0.5022, test_loss: 1.0743, test_f1: 0.6890
 epoch: 66, train_loss: 0.5019, test_loss: 1.0394, test_f1: 0.6209
 epoch: 67, train_loss: 0.4832, test_loss: 1.0828, test_f1: 0.6738
 epoch: 68, train_loss: 0.4914, test_loss: 1.0472, test_f1: 0.6427
 epoch: 69, train_loss: 0.4844, test_loss: 1.0816, test_f1: 0.6738
 epoch: 70, train_loss: 0.4901, test_loss: 1.1698, test_f1: 0.6721
 epoch: 71, train_loss: 0.4964, test_loss: 1.1567, test_f1: 0.6877
 epoch: 72, train_loss: 0.4777, test_loss: 1.0037, test_f1: 0.7072
 epoch: 73, train_loss: 0.4915, test_loss: 1.1658, test_f1: 0.6541
 epoch: 74, train_loss: 0.4814, test_loss: 1.0208, test_f1: 0.6541
 epoch: 75, train_loss: 0.4713, test_loss: 1.2516, test_f1: 0.6481
 epoch: 76, train_loss: 0.4790, test_loss: 1.0801, test_f1: 0.6746
 epoch: 77, train_loss: 0.4631, test_loss: 1.1000, test_f1: 0.6817
 epoch: 78, train_loss: 0.4605, test_loss: 1.1146, test_f1: 0.6734
 epoch: 79, train_loss: 0.4442, test_loss: 1.0878, test_f1: 0.6806
 epoch: 80, train_loss: 0.4492, test_loss: 1.2230, test_f1: 0.6688
 epoch: 81, train_loss: 0.4649, test_loss: 1.0259, test_f1: 0.7105
 epoch: 82, train_loss: 0.4575, test_loss: 1.1746, test_f1: 0.6768
 epoch: 83, train_loss: 0.4698, test_loss: 1.2456, test_f1: 0.6548
 epoch: 84, train_loss: 0.4706, test_loss: 1.1426, test_f1: 0.6598
 epoch: 85, train_loss: 0.4273, test_loss: 1.2245, test_f1: 0.6582
 epoch: 86, train_loss: 0.4308, test_loss: 1.1096, test_f1: 0.6837
 epoch: 87, train_loss: 0.4247, test_loss: 1.1769, test_f1: 0.6511
 epoch: 88, train_loss: 0.4306, test_loss: 1.2771, test_f1: 0.6478
 epoch: 89, train_loss: 0.4218, test_loss: 1.1288, test_f1: 0.6731
 epoch: 90, train_loss: 0.4314, test_loss: 1.1860, test_f1: 0.6712
 epoch: 91, train_loss: 0.4409, test_loss: 1.1265, test_f1: 0.6713
 epoch: 92, train_loss: 0.4113, test_loss: 1.1450, test_f1: 0.6924
 epoch: 93, train_loss: 0.4201, test_loss: 1.2009, test_f1: 0.6688
 epoch: 94, train_loss: 0.4260, test_loss: 1.1122, test_f1: 0.6644
 epoch: 95, train_loss: 0.4179, test_loss: 1.0719, test_f1: 0.6771
 epoch: 96, train_loss: 0.4215, test_loss: 1.1647, test_f1: 0.6674
 epoch: 97, train_loss: 0.3959, test_loss: 1.2405, test_f1: 0.6646
 epoch: 98, train_loss: 0.3990, test_loss: 1.1471, test_f1: 0.7038
 epoch: 99, train_loss: 0.4307, test_loss: 1.2634, test_f1: 0.6687
##################ITERATION #7 ****************************************
 epoch: 0, train_loss: 1.3261, test_loss: 1.2136, test_f1: 0.3200
 epoch: 1, train_loss: 1.0529, test_loss: 1.0632, test_f1: 0.4188
 epoch: 2, train_loss: 1.0114, test_loss: 1.0125, test_f1: 0.4418
 epoch: 3, train_loss: 0.9856, test_loss: 0.9894, test_f1: 0.4453
 epoch: 4, train_loss: 0.9679, test_loss: 0.9996, test_f1: 0.4406
 epoch: 5, train_loss: 0.9474, test_loss: 0.9853, test_f1: 0.4722
 epoch: 6, train_loss: 0.9593, test_loss: 0.9996, test_f1: 0.4552
 epoch: 7, train_loss: 0.9432, test_loss: 0.9747, test_f1: 0.4953
 epoch: 8, train_loss: 0.9196, test_loss: 0.9851, test_f1: 0.4707
 epoch: 9, train_loss: 0.9105, test_loss: 0.9324, test_f1: 0.4867
 epoch: 10, train_loss: 0.8975, test_loss: 0.9623, test_f1: 0.5068
 epoch: 11, train_loss: 0.8804, test_loss: 0.9779, test_f1: 0.5199
 epoch: 12, train_loss: 0.8700, test_loss: 0.9057, test_f1: 0.4957
 epoch: 13, train_loss: 0.8595, test_loss: 1.1231, test_f1: 0.4768
 epoch: 14, train_loss: 0.8732, test_loss: 0.9462, test_f1: 0.4921
 epoch: 15, train_loss: 0.8717, test_loss: 0.8880, test_f1: 0.5255
 epoch: 16, train_loss: 0.8740, test_loss: 0.9122, test_f1: 0.5018
 epoch: 17, train_loss: 0.8592, test_loss: 0.9595, test_f1: 0.5282
 epoch: 18, train_loss: 0.8410, test_loss: 1.0674, test_f1: 0.4622
 epoch: 19, train_loss: 0.8483, test_loss: 0.9806, test_f1: 0.5174
 epoch: 20, train_loss: 0.8332, test_loss: 0.8888, test_f1: 0.5719
 epoch: 21, train_loss: 0.8187, test_loss: 0.8869, test_f1: 0.5661
 epoch: 22, train_loss: 0.8179, test_loss: 0.9152, test_f1: 0.5165
 epoch: 23, train_loss: 0.8094, test_loss: 0.8695, test_f1: 0.5709
 epoch: 24, train_loss: 0.7961, test_loss: 0.9732, test_f1: 0.5490
 epoch: 25, train_loss: 0.7911, test_loss: 0.8941, test_f1: 0.5845
 epoch: 26, train_loss: 0.7806, test_loss: 0.9430, test_f1: 0.5282
 epoch: 27, train_loss: 0.7828, test_loss: 0.9851, test_f1: 0.5793
 epoch: 28, train_loss: 0.7839, test_loss: 1.0740, test_f1: 0.5588
 epoch: 29, train_loss: 0.7834, test_loss: 0.9519, test_f1: 0.5554
 epoch: 30, train_loss: 0.7830, test_loss: 0.8810, test_f1: 0.5143
 epoch: 31, train_loss: 0.7841, test_loss: 1.0946, test_f1: 0.5444
 epoch: 32, train_loss: 0.7777, test_loss: 0.9148, test_f1: 0.5726
 epoch: 33, train_loss: 0.7573, test_loss: 0.8875, test_f1: 0.5407
 epoch: 34, train_loss: 0.7610, test_loss: 0.8962, test_f1: 0.5870
 epoch: 35, train_loss: 0.7481, test_loss: 0.9367, test_f1: 0.5425
 epoch: 36, train_loss: 0.7545, test_loss: 0.9123, test_f1: 0.5866
 epoch: 37, train_loss: 0.7444, test_loss: 0.9877, test_f1: 0.5260
 epoch: 38, train_loss: 0.7092, test_loss: 0.9783, test_f1: 0.6030
 epoch: 39, train_loss: 0.7199, test_loss: 0.8782, test_f1: 0.5887
 epoch: 40, train_loss: 0.7240, test_loss: 0.8714, test_f1: 0.5629
 epoch: 41, train_loss: 0.7133, test_loss: 0.8854, test_f1: 0.5909
 epoch: 42, train_loss: 0.7038, test_loss: 0.9201, test_f1: 0.5742
 epoch: 43, train_loss: 0.7475, test_loss: 0.9415, test_f1: 0.5811
 epoch: 44, train_loss: 0.7173, test_loss: 0.9051, test_f1: 0.5627
 epoch: 45, train_loss: 0.7238, test_loss: 1.0018, test_f1: 0.5192
 epoch: 46, train_loss: 0.7178, test_loss: 0.8961, test_f1: 0.5729
 epoch: 47, train_loss: 0.6948, test_loss: 0.9208, test_f1: 0.5494
 epoch: 48, train_loss: 0.7094, test_loss: 0.8900, test_f1: 0.5664
 epoch: 49, train_loss: 0.6952, test_loss: 0.8728, test_f1: 0.5561
 epoch: 50, train_loss: 0.6818, test_loss: 0.9578, test_f1: 0.5693
 epoch: 51, train_loss: 0.6854, test_loss: 0.9273, test_f1: 0.5894
 epoch: 52, train_loss: 0.6518, test_loss: 0.8800, test_f1: 0.6268
 epoch: 53, train_loss: 0.6352, test_loss: 0.9101, test_f1: 0.5802
 epoch: 54, train_loss: 0.6246, test_loss: 0.8868, test_f1: 0.6009
 epoch: 55, train_loss: 0.6277, test_loss: 0.8760, test_f1: 0.6378
 epoch: 56, train_loss: 0.6224, test_loss: 0.9142, test_f1: 0.6064
 epoch: 57, train_loss: 0.6082, test_loss: 0.9225, test_f1: 0.5992
 epoch: 58, train_loss: 0.6119, test_loss: 0.9393, test_f1: 0.6002
 epoch: 59, train_loss: 0.6117, test_loss: 0.9675, test_f1: 0.6016
 epoch: 60, train_loss: 0.5920, test_loss: 0.9766, test_f1: 0.6129
 epoch: 61, train_loss: 0.5936, test_loss: 0.9865, test_f1: 0.5980
 epoch: 62, train_loss: 0.6088, test_loss: 0.9182, test_f1: 0.6166
 epoch: 63, train_loss: 0.6110, test_loss: 0.9390, test_f1: 0.6166
 epoch: 64, train_loss: 0.5854, test_loss: 0.9913, test_f1: 0.5839
 epoch: 65, train_loss: 0.5841, test_loss: 0.9446, test_f1: 0.6007
 epoch: 66, train_loss: 0.5906, test_loss: 0.9429, test_f1: 0.5985
 epoch: 67, train_loss: 0.5740, test_loss: 0.9752, test_f1: 0.6073
 epoch: 68, train_loss: 0.5839, test_loss: 0.9244, test_f1: 0.6233
 epoch: 69, train_loss: 0.5563, test_loss: 1.0347, test_f1: 0.6012
 epoch: 70, train_loss: 0.5730, test_loss: 0.9762, test_f1: 0.5945
 epoch: 71, train_loss: 0.5993, test_loss: 0.9819, test_f1: 0.6114
 epoch: 72, train_loss: 0.5630, test_loss: 0.9343, test_f1: 0.6285
 epoch: 73, train_loss: 0.5746, test_loss: 0.9942, test_f1: 0.6107
 epoch: 74, train_loss: 0.5376, test_loss: 0.9466, test_f1: 0.6156
 epoch: 75, train_loss: 0.5595, test_loss: 1.0101, test_f1: 0.6239
 epoch: 76, train_loss: 0.5481, test_loss: 0.9836, test_f1: 0.6105
 epoch: 77, train_loss: 0.5472, test_loss: 0.9038, test_f1: 0.6186
 epoch: 78, train_loss: 0.5399, test_loss: 0.9727, test_f1: 0.6086
 epoch: 79, train_loss: 0.5462, test_loss: 1.3155, test_f1: 0.5930
 epoch: 80, train_loss: 0.5671, test_loss: 1.0753, test_f1: 0.5892
 epoch: 81, train_loss: 0.5484, test_loss: 0.9952, test_f1: 0.6339
 epoch: 82, train_loss: 0.5282, test_loss: 0.9690, test_f1: 0.6003
 epoch: 83, train_loss: 0.5370, test_loss: 1.0625, test_f1: 0.6143
 epoch: 84, train_loss: 0.5181, test_loss: 1.0210, test_f1: 0.6217
 epoch: 85, train_loss: 0.5227, test_loss: 0.9947, test_f1: 0.6186
 epoch: 86, train_loss: 0.5179, test_loss: 0.9962, test_f1: 0.6491
 epoch: 87, train_loss: 0.5404, test_loss: 0.9871, test_f1: 0.6315
 epoch: 88, train_loss: 0.5174, test_loss: 1.0228, test_f1: 0.6058
 epoch: 89, train_loss: 0.5245, test_loss: 1.0160, test_f1: 0.6256
 epoch: 90, train_loss: 0.5211, test_loss: 1.4318, test_f1: 0.6192
 epoch: 91, train_loss: 0.5072, test_loss: 1.0433, test_f1: 0.6369
 epoch: 92, train_loss: 0.5107, test_loss: 1.0543, test_f1: 0.6355
 epoch: 93, train_loss: 0.4934, test_loss: 1.0926, test_f1: 0.6421
 epoch: 94, train_loss: 0.4865, test_loss: 1.1057, test_f1: 0.6339
 epoch: 95, train_loss: 0.4880, test_loss: 1.0414, test_f1: 0.6476
 epoch: 96, train_loss: 0.4944, test_loss: 1.1816, test_f1: 0.6426
 epoch: 97, train_loss: 0.4816, test_loss: 1.0696, test_f1: 0.6239
 epoch: 98, train_loss: 0.4935, test_loss: 1.0779, test_f1: 0.6479
 epoch: 99, train_loss: 0.4884, test_loss: 1.0620, test_f1: 0.6327
##################ITERATION #8 ****************************************
 epoch: 0, train_loss: 1.2435, test_loss: 1.1586, test_f1: 0.3502
 epoch: 1, train_loss: 1.0232, test_loss: 1.0138, test_f1: 0.4546
 epoch: 2, train_loss: 0.9704, test_loss: 1.0032, test_f1: 0.4857
 epoch: 3, train_loss: 0.9553, test_loss: 0.9754, test_f1: 0.4832
 epoch: 4, train_loss: 0.9292, test_loss: 0.9756, test_f1: 0.5548
 epoch: 5, train_loss: 0.9364, test_loss: 1.0001, test_f1: 0.5028
 epoch: 6, train_loss: 0.9111, test_loss: 0.9190, test_f1: 0.5124
 epoch: 7, train_loss: 0.9070, test_loss: 1.0110, test_f1: 0.5008
 epoch: 8, train_loss: 0.8927, test_loss: 0.9362, test_f1: 0.4977
 epoch: 9, train_loss: 0.8763, test_loss: 0.9791, test_f1: 0.5121
 epoch: 10, train_loss: 0.8668, test_loss: 0.9480, test_f1: 0.5230
 epoch: 11, train_loss: 0.8607, test_loss: 0.9878, test_f1: 0.5232
 epoch: 12, train_loss: 0.8601, test_loss: 0.9120, test_f1: 0.5560
 epoch: 13, train_loss: 0.8414, test_loss: 0.9467, test_f1: 0.5330
 epoch: 14, train_loss: 0.8390, test_loss: 1.5562, test_f1: 0.3748
 epoch: 15, train_loss: 0.8093, test_loss: 0.9074, test_f1: 0.5762
 epoch: 16, train_loss: 0.8143, test_loss: 0.9841, test_f1: 0.5484
 epoch: 17, train_loss: 0.8102, test_loss: 1.1009, test_f1: 0.5385
 epoch: 18, train_loss: 0.7933, test_loss: 0.9389, test_f1: 0.5753
 epoch: 19, train_loss: 0.7754, test_loss: 0.9310, test_f1: 0.5662
 epoch: 20, train_loss: 0.7762, test_loss: 0.9770, test_f1: 0.5728
 epoch: 21, train_loss: 0.7760, test_loss: 0.9498, test_f1: 0.5857
 epoch: 22, train_loss: 0.7590, test_loss: 1.0736, test_f1: 0.4962
 epoch: 23, train_loss: 0.7619, test_loss: 0.9315, test_f1: 0.5504
 epoch: 24, train_loss: 0.7718, test_loss: 1.1040, test_f1: 0.5346
 epoch: 25, train_loss: 0.7284, test_loss: 1.0417, test_f1: 0.5639
 epoch: 26, train_loss: 0.7309, test_loss: 1.0311, test_f1: 0.5750
 epoch: 27, train_loss: 0.7287, test_loss: 1.0402, test_f1: 0.5469
 epoch: 28, train_loss: 0.7467, test_loss: 0.9273, test_f1: 0.5808
 epoch: 29, train_loss: 0.7225, test_loss: 1.0432, test_f1: 0.6027
 epoch: 30, train_loss: 0.7019, test_loss: 1.0430, test_f1: 0.5704
 epoch: 31, train_loss: 0.7006, test_loss: 0.9963, test_f1: 0.6095
 epoch: 32, train_loss: 0.6933, test_loss: 1.0026, test_f1: 0.6042
 epoch: 33, train_loss: 0.7051, test_loss: 0.9726, test_f1: 0.6239
 epoch: 34, train_loss: 0.6883, test_loss: 1.1423, test_f1: 0.5977
 epoch: 35, train_loss: 0.6913, test_loss: 1.0452, test_f1: 0.5663
 epoch: 36, train_loss: 0.6816, test_loss: 0.9966, test_f1: 0.6089
 epoch: 37, train_loss: 0.6906, test_loss: 1.0623, test_f1: 0.5657
 epoch: 38, train_loss: 0.6689, test_loss: 1.0569, test_f1: 0.6491
 epoch: 39, train_loss: 0.6821, test_loss: 1.0348, test_f1: 0.5787
 epoch: 40, train_loss: 0.6707, test_loss: 1.2097, test_f1: 0.5254
 epoch: 41, train_loss: 0.6639, test_loss: 1.1096, test_f1: 0.6268
 epoch: 42, train_loss: 0.6513, test_loss: 1.1175, test_f1: 0.6216
 epoch: 43, train_loss: 0.6523, test_loss: 1.1483, test_f1: 0.5502
 epoch: 44, train_loss: 0.6564, test_loss: 1.0417, test_f1: 0.6135
 epoch: 45, train_loss: 0.6598, test_loss: 1.1935, test_f1: 0.5827
 epoch: 46, train_loss: 0.6519, test_loss: 1.0839, test_f1: 0.6243
 epoch: 47, train_loss: 0.6649, test_loss: 1.0120, test_f1: 0.6569
 epoch: 48, train_loss: 0.6460, test_loss: 0.9468, test_f1: 0.6221
 epoch: 49, train_loss: 0.6261, test_loss: 1.0519, test_f1: 0.6417
 epoch: 50, train_loss: 0.6204, test_loss: 1.0936, test_f1: 0.6181
 epoch: 51, train_loss: 0.5863, test_loss: 1.0642, test_f1: 0.6002
 epoch: 52, train_loss: 0.5796, test_loss: 1.1060, test_f1: 0.5856
 epoch: 53, train_loss: 0.5755, test_loss: 1.0540, test_f1: 0.6227
 epoch: 54, train_loss: 0.5531, test_loss: 1.0832, test_f1: 0.6326
 epoch: 55, train_loss: 0.5428, test_loss: 1.1371, test_f1: 0.6538
 epoch: 56, train_loss: 0.5609, test_loss: 1.0731, test_f1: 0.6273
 epoch: 57, train_loss: 0.5455, test_loss: 1.1528, test_f1: 0.6275
 epoch: 58, train_loss: 0.5428, test_loss: 1.0294, test_f1: 0.6318
 epoch: 59, train_loss: 0.5340, test_loss: 1.0991, test_f1: 0.6319
 epoch: 60, train_loss: 0.5323, test_loss: 1.1188, test_f1: 0.6426
 epoch: 61, train_loss: 0.5372, test_loss: 1.1186, test_f1: 0.6634
 epoch: 62, train_loss: 0.5393, test_loss: 1.2333, test_f1: 0.6291
 epoch: 63, train_loss: 0.5276, test_loss: 1.0688, test_f1: 0.6557
 epoch: 64, train_loss: 0.5352, test_loss: 1.1079, test_f1: 0.6468
 epoch: 65, train_loss: 0.5309, test_loss: 1.0331, test_f1: 0.6446
 epoch: 66, train_loss: 0.5033, test_loss: 1.1138, test_f1: 0.6101
 epoch: 67, train_loss: 0.5089, test_loss: 1.2687, test_f1: 0.6393
 epoch: 68, train_loss: 0.4969, test_loss: 1.2299, test_f1: 0.6250
 epoch: 69, train_loss: 0.5043, test_loss: 1.2565, test_f1: 0.6241
 epoch: 70, train_loss: 0.5222, test_loss: 1.2200, test_f1: 0.6369
 epoch: 71, train_loss: 0.4991, test_loss: 1.1593, test_f1: 0.6533
 epoch: 72, train_loss: 0.5023, test_loss: 1.1655, test_f1: 0.6228
 epoch: 73, train_loss: 0.5086, test_loss: 1.1955, test_f1: 0.6234
 epoch: 74, train_loss: 0.4847, test_loss: 1.1534, test_f1: 0.6162
 epoch: 75, train_loss: 0.5009, test_loss: 1.2370, test_f1: 0.6279
 epoch: 76, train_loss: 0.4937, test_loss: 1.3023, test_f1: 0.6501
 epoch: 77, train_loss: 0.4893, test_loss: 1.1923, test_f1: 0.6249
 epoch: 78, train_loss: 0.4942, test_loss: 1.2514, test_f1: 0.6576
 epoch: 79, train_loss: 0.4793, test_loss: 1.2725, test_f1: 0.6146
 epoch: 80, train_loss: 0.4953, test_loss: 1.2086, test_f1: 0.6214
 epoch: 81, train_loss: 0.4880, test_loss: 1.2356, test_f1: 0.6460
 epoch: 82, train_loss: 0.4834, test_loss: 1.3393, test_f1: 0.6534
 epoch: 83, train_loss: 0.4931, test_loss: 1.2455, test_f1: 0.6315
 epoch: 84, train_loss: 0.4785, test_loss: 1.3439, test_f1: 0.6557
 epoch: 85, train_loss: 0.4640, test_loss: 1.3248, test_f1: 0.6407
 epoch: 86, train_loss: 0.4763, test_loss: 1.3591, test_f1: 0.6283
 epoch: 87, train_loss: 0.4548, test_loss: 1.3939, test_f1: 0.6556
 epoch: 88, train_loss: 0.4587, test_loss: 1.3413, test_f1: 0.6581
 epoch: 89, train_loss: 0.4693, test_loss: 1.2420, test_f1: 0.6420
 epoch: 90, train_loss: 0.4581, test_loss: 1.4410, test_f1: 0.6279
 epoch: 91, train_loss: 0.4546, test_loss: 1.3107, test_f1: 0.6552
 epoch: 92, train_loss: 0.4537, test_loss: 1.4646, test_f1: 0.6254
 epoch: 93, train_loss: 0.4408, test_loss: 1.2818, test_f1: 0.6565
 epoch: 94, train_loss: 0.4443, test_loss: 1.4717, test_f1: 0.6286
 epoch: 95, train_loss: 0.4588, test_loss: 1.2393, test_f1: 0.6584
 epoch: 96, train_loss: 0.4785, test_loss: 1.4613, test_f1: 0.6326
 epoch: 97, train_loss: 0.4529, test_loss: 1.4274, test_f1: 0.5996
 epoch: 98, train_loss: 0.4509, test_loss: 1.4116, test_f1: 0.6316
 epoch: 99, train_loss: 0.4552, test_loss: 1.4382, test_f1: 0.6330
##################ITERATION #9 ****************************************
 epoch: 0, train_loss: 1.2687, test_loss: 1.5425, test_f1: 0.2456
 epoch: 1, train_loss: 1.0354, test_loss: 0.9679, test_f1: 0.4279
 epoch: 2, train_loss: 0.9838, test_loss: 0.9289, test_f1: 0.4757
 epoch: 3, train_loss: 0.9712, test_loss: 0.9319, test_f1: 0.4983
 epoch: 4, train_loss: 0.9417, test_loss: 0.9468, test_f1: 0.4953
 epoch: 5, train_loss: 0.9161, test_loss: 1.0425, test_f1: 0.4537
 epoch: 6, train_loss: 0.9166, test_loss: 0.9635, test_f1: 0.5231
 epoch: 7, train_loss: 0.8870, test_loss: 1.0097, test_f1: 0.5006
 epoch: 8, train_loss: 0.8692, test_loss: 0.9022, test_f1: 0.5565
 epoch: 9, train_loss: 0.8765, test_loss: 0.9426, test_f1: 0.5536
 epoch: 10, train_loss: 0.8504, test_loss: 0.8492, test_f1: 0.5636
 epoch: 11, train_loss: 0.8291, test_loss: 0.8567, test_f1: 0.5474
 epoch: 12, train_loss: 0.8538, test_loss: 0.8687, test_f1: 0.5851
 epoch: 13, train_loss: 0.8262, test_loss: 0.9096, test_f1: 0.5040
 epoch: 14, train_loss: 0.8334, test_loss: 0.9623, test_f1: 0.5494
 epoch: 15, train_loss: 0.8106, test_loss: 0.8702, test_f1: 0.6069
 epoch: 16, train_loss: 0.7937, test_loss: 0.8443, test_f1: 0.6141
 epoch: 17, train_loss: 0.8049, test_loss: 0.8516, test_f1: 0.6216
 epoch: 18, train_loss: 0.7860, test_loss: 0.8714, test_f1: 0.5860
 epoch: 19, train_loss: 0.7755, test_loss: 0.8495, test_f1: 0.5782
 epoch: 20, train_loss: 0.7690, test_loss: 0.8762, test_f1: 0.5535
 epoch: 21, train_loss: 0.7523, test_loss: 0.9105, test_f1: 0.5696
 epoch: 22, train_loss: 0.7521, test_loss: 0.8063, test_f1: 0.6274
 epoch: 23, train_loss: 0.7452, test_loss: 0.8094, test_f1: 0.5966
 epoch: 24, train_loss: 0.7675, test_loss: 0.9746, test_f1: 0.5122
 epoch: 25, train_loss: 0.7528, test_loss: 1.1194, test_f1: 0.5366
 epoch: 26, train_loss: 0.7421, test_loss: 0.8680, test_f1: 0.6091
 epoch: 27, train_loss: 0.7266, test_loss: 0.8423, test_f1: 0.6223
 epoch: 28, train_loss: 0.7126, test_loss: 0.8519, test_f1: 0.6335
 epoch: 29, train_loss: 0.6929, test_loss: 0.8638, test_f1: 0.6047
 epoch: 30, train_loss: 0.7041, test_loss: 0.9129, test_f1: 0.6175
 epoch: 31, train_loss: 0.6800, test_loss: 0.9900, test_f1: 0.5406
 epoch: 32, train_loss: 0.6886, test_loss: 0.8735, test_f1: 0.6525
 epoch: 33, train_loss: 0.6951, test_loss: 1.0942, test_f1: 0.5815
 epoch: 34, train_loss: 0.6816, test_loss: 0.9431, test_f1: 0.6166
 epoch: 35, train_loss: 0.7105, test_loss: 1.0202, test_f1: 0.5830
 epoch: 36, train_loss: 0.6882, test_loss: 1.0959, test_f1: 0.5528
 epoch: 37, train_loss: 0.6858, test_loss: 0.9686, test_f1: 0.5978
 epoch: 38, train_loss: 0.6773, test_loss: 0.8302, test_f1: 0.6246
 epoch: 39, train_loss: 0.6608, test_loss: 0.8364, test_f1: 0.6512
 epoch: 40, train_loss: 0.6616, test_loss: 0.9803, test_f1: 0.5984
 epoch: 41, train_loss: 0.6796, test_loss: 0.8526, test_f1: 0.6147
 epoch: 42, train_loss: 0.6579, test_loss: 0.8727, test_f1: 0.6422
 epoch: 43, train_loss: 0.6517, test_loss: 0.9123, test_f1: 0.6516
 epoch: 44, train_loss: 0.6435, test_loss: 0.8918, test_f1: 0.6288
 epoch: 45, train_loss: 0.6313, test_loss: 0.8273, test_f1: 0.6161
 epoch: 46, train_loss: 0.6448, test_loss: 0.8849, test_f1: 0.6208
 epoch: 47, train_loss: 0.6589, test_loss: 1.5950, test_f1: 0.5035
 epoch: 48, train_loss: 0.6449, test_loss: 0.9236, test_f1: 0.6233
 epoch: 49, train_loss: 0.6494, test_loss: 0.9520, test_f1: 0.6057
 epoch: 50, train_loss: 0.6432, test_loss: 0.9225, test_f1: 0.6133
 epoch: 51, train_loss: 0.5844, test_loss: 0.9344, test_f1: 0.6397
 epoch: 52, train_loss: 0.5792, test_loss: 0.8539, test_f1: 0.6703
 epoch: 53, train_loss: 0.5545, test_loss: 0.8840, test_f1: 0.6559
 epoch: 54, train_loss: 0.5514, test_loss: 0.9444, test_f1: 0.6480
 epoch: 55, train_loss: 0.5427, test_loss: 0.8555, test_f1: 0.6769
 epoch: 56, train_loss: 0.5479, test_loss: 0.8880, test_f1: 0.6508
 epoch: 57, train_loss: 0.5452, test_loss: 0.8826, test_f1: 0.6670
 epoch: 58, train_loss: 0.5666, test_loss: 1.1398, test_f1: 0.6339
 epoch: 59, train_loss: 0.5421, test_loss: 1.0228, test_f1: 0.6742
 epoch: 60, train_loss: 0.5511, test_loss: 0.9660, test_f1: 0.6394
 epoch: 61, train_loss: 0.5152, test_loss: 0.9172, test_f1: 0.6565
 epoch: 62, train_loss: 0.5238, test_loss: 1.0272, test_f1: 0.6693
 epoch: 63, train_loss: 0.5045, test_loss: 0.9874, test_f1: 0.6404
 epoch: 64, train_loss: 0.5045, test_loss: 1.1449, test_f1: 0.6835
 epoch: 65, train_loss: 0.5176, test_loss: 1.0197, test_f1: 0.6334
 epoch: 66, train_loss: 0.4989, test_loss: 0.9429, test_f1: 0.6712
 epoch: 67, train_loss: 0.5216, test_loss: 1.0145, test_f1: 0.6613
 epoch: 68, train_loss: 0.5006, test_loss: 0.9026, test_f1: 0.6773
 epoch: 69, train_loss: 0.5036, test_loss: 1.0545, test_f1: 0.6475
 epoch: 70, train_loss: 0.5102, test_loss: 1.0916, test_f1: 0.6187
 epoch: 71, train_loss: 0.5229, test_loss: 1.0650, test_f1: 0.6769
 epoch: 72, train_loss: 0.4939, test_loss: 0.9806, test_f1: 0.6401
 epoch: 73, train_loss: 0.4926, test_loss: 0.9531, test_f1: 0.6575
 epoch: 74, train_loss: 0.4706, test_loss: 1.0509, test_f1: 0.6507
 epoch: 75, train_loss: 0.4770, test_loss: 0.9878, test_f1: 0.6599
 epoch: 76, train_loss: 0.4765, test_loss: 0.9824, test_f1: 0.6384
 epoch: 77, train_loss: 0.4665, test_loss: 1.0152, test_f1: 0.6371
 epoch: 78, train_loss: 0.4714, test_loss: 0.9770, test_f1: 0.6631
 epoch: 79, train_loss: 0.4501, test_loss: 0.9857, test_f1: 0.6702
 epoch: 80, train_loss: 0.4405, test_loss: 0.9221, test_f1: 0.6529
 epoch: 81, train_loss: 0.4603, test_loss: 0.9398, test_f1: 0.6736
 epoch: 82, train_loss: 0.4561, test_loss: 1.0503, test_f1: 0.6546
 epoch: 83, train_loss: 0.4611, test_loss: 1.0993, test_f1: 0.6545
 epoch: 84, train_loss: 0.4504, test_loss: 0.9063, test_f1: 0.6942
 epoch: 85, train_loss: 0.4540, test_loss: 1.0699, test_f1: 0.6482
 epoch: 86, train_loss: 0.4475, test_loss: 1.1439, test_f1: 0.6525
 epoch: 87, train_loss: 0.4535, test_loss: 1.0230, test_f1: 0.6484
 epoch: 88, train_loss: 0.4312, test_loss: 0.9868, test_f1: 0.6793
 epoch: 89, train_loss: 0.4320, test_loss: 1.0738, test_f1: 0.6449
 epoch: 90, train_loss: 0.4351, test_loss: 1.0464, test_f1: 0.6657
 epoch: 91, train_loss: 0.4323, test_loss: 0.9867, test_f1: 0.6769
 epoch: 92, train_loss: 0.4371, test_loss: 1.0409, test_f1: 0.6624
 epoch: 93, train_loss: 0.4492, test_loss: 1.0062, test_f1: 0.6602
 epoch: 94, train_loss: 0.4376, test_loss: 1.1386, test_f1: 0.6396
 epoch: 95, train_loss: 0.4111, test_loss: 1.1707, test_f1: 0.6651
 epoch: 96, train_loss: 0.4367, test_loss: 1.0387, test_f1: 0.6534
 epoch: 97, train_loss: 0.4366, test_loss: 1.0503, test_f1: 0.6767
 epoch: 98, train_loss: 0.4161, test_loss: 1.0123, test_f1: 0.6664
 epoch: 99, train_loss: 0.4055, test_loss: 1.1128, test_f1: 0.6494

Training completed in 457.12 seconds
Best F1: 0.7105 at epoch 81
Mean F1 across iterations: 0.6815  0.0201
========================FINAL RESULTS================================
FEGIN weighted F1: 0.7105  0.0201
python main.py --data ltspice_examples --representation component_net --model FEGIN --layers 3 --hiddens 64 --batch_size 128 --lr 0.01 --emb_size 250 --epochs 100 --save_appendix component_net_L3_H64_BS128_LR0.01_E250 --no_val
-----



STDERR:
  File "main.py", line 370, in <module>
    main()
  File "main.py", line 254, in main
    dataset = dataset_class(
  File "/home/philip/projects/ltspice_examples_code_repo/Circuit-Completion-Using-GNNs/component_classification_with_link_prediction_head/evaluation/FEGIN/kernel/circuit_datasets.py", line 15, in __init__
    self.data, self.slices = torch.load(self.processed_paths[0])
  File "/home/philip/.local/lib/python3.8/site-packages/torch/serialization.py", line 1040, in load
    warnings.warn(
  File "/usr/lib/python3.8/warnings.py", line 109, in _showwarnmsg
    sw(msg.message, msg.category, msg.filename, msg.lineno,
  File "main.py", line 47, in warn_with_traceback
    traceback.print_stack(file=log)
/home/philip/projects/ltspice_examples_code_repo/Circuit-Completion-Using-GNNs/component_classification_with_link_prediction_head/evaluation/FEGIN/kernel/circuit_datasets.py:15: FutureWarning: You are using `torch.load` with `weights_only=False` (the current default value), which uses the default pickle module implicitly. It is possible to construct malicious pickle data which will execute arbitrary code during unpickling (See https://github.com/pytorch/pytorch/blob/main/SECURITY.md#untrusted-models for more details). In a future release, the default value for `weights_only` will be flipped to `True`. This limits the functions that could be executed during unpickling. Arbitrary objects will no longer be allowed to be loaded via this mode unless they are explicitly allowlisted by the user via `torch.serialization.add_safe_globals`. We recommend you start setting `weights_only=True` for any use case where you don't have full control of the loaded file. Please open an issue on GitHub for any issues related to this experimental feature.
  self.data, self.slices = torch.load(self.processed_paths[0])
