STDOUT:
Results will be saved in /home/philip/projects/llm_inference_code_repo/Circuit-Completion-Using-GNNs/component_classification_with_link_prediction_head/evaluation/FEGIN/results/model_FEGIN_dataset_ltspice_examples
Command line input: python main.py --data ltspice_examples --representation component_component --model FEGIN --layers 4 --hiddens 32 --batch_size 32 --lr 0.0001 --emb_size 250 --epochs 100 --save_appendix component_component_L4_H32_BS32_LR0.0001_E250 --no_val
 is saved.
-----
ltspice_examples - FEGIN
Using 4 layers, 32 hidden units, h = 2
Loading component_component representation dataset
ENTERED
Training FEGIN on component_component representation
Train: 3556, Test: 845
##################ITERATION #0 ****************************************
 epoch: 0, train_loss: 1.3837, test_loss: 1.3751, test_f1: 0.1603
 epoch: 1, train_loss: 1.3699, test_loss: 1.3642, test_f1: 0.1699
 epoch: 2, train_loss: 1.3576, test_loss: 1.3530, test_f1: 0.2520
 epoch: 3, train_loss: 1.3455, test_loss: 1.3364, test_f1: 0.2665
 epoch: 4, train_loss: 1.3296, test_loss: 1.3228, test_f1: 0.2274
 epoch: 5, train_loss: 1.3127, test_loss: 1.3019, test_f1: 0.2274
 epoch: 6, train_loss: 1.2928, test_loss: 1.2820, test_f1: 0.2274
 epoch: 7, train_loss: 1.2822, test_loss: 1.2685, test_f1: 0.2274
 epoch: 8, train_loss: 1.2668, test_loss: 1.2585, test_f1: 0.2274
 epoch: 9, train_loss: 1.2577, test_loss: 1.2485, test_f1: 0.2274
 epoch: 10, train_loss: 1.2469, test_loss: 1.2332, test_f1: 0.2371
 epoch: 11, train_loss: 1.2417, test_loss: 1.2261, test_f1: 0.2535
 epoch: 12, train_loss: 1.2309, test_loss: 1.2145, test_f1: 0.2793
 epoch: 13, train_loss: 1.2255, test_loss: 1.2049, test_f1: 0.3199
 epoch: 14, train_loss: 1.2191, test_loss: 1.2006, test_f1: 0.3632
 epoch: 15, train_loss: 1.2106, test_loss: 1.1891, test_f1: 0.3663
 epoch: 16, train_loss: 1.2065, test_loss: 1.1815, test_f1: 0.3656
 epoch: 17, train_loss: 1.2013, test_loss: 1.1708, test_f1: 0.4167
 epoch: 18, train_loss: 1.1958, test_loss: 1.1675, test_f1: 0.4149
 epoch: 19, train_loss: 1.1826, test_loss: 1.1597, test_f1: 0.4112
 epoch: 20, train_loss: 1.1791, test_loss: 1.1510, test_f1: 0.4075
 epoch: 21, train_loss: 1.1754, test_loss: 1.1527, test_f1: 0.4298
 epoch: 22, train_loss: 1.1630, test_loss: 1.1377, test_f1: 0.4255
 epoch: 23, train_loss: 1.1618, test_loss: 1.1399, test_f1: 0.4352
 epoch: 24, train_loss: 1.1620, test_loss: 1.1341, test_f1: 0.4275
 epoch: 25, train_loss: 1.1502, test_loss: 1.1295, test_f1: 0.4334
 epoch: 26, train_loss: 1.1512, test_loss: 1.1248, test_f1: 0.4326
 epoch: 27, train_loss: 1.1456, test_loss: 1.1143, test_f1: 0.4539
 epoch: 28, train_loss: 1.1539, test_loss: 1.1093, test_f1: 0.4601
 epoch: 29, train_loss: 1.1307, test_loss: 1.1084, test_f1: 0.4324
 epoch: 30, train_loss: 1.1367, test_loss: 1.1003, test_f1: 0.4440
 epoch: 31, train_loss: 1.1307, test_loss: 1.1001, test_f1: 0.4574
 epoch: 32, train_loss: 1.1226, test_loss: 1.0874, test_f1: 0.4557
 epoch: 33, train_loss: 1.1175, test_loss: 1.0813, test_f1: 0.4694
 epoch: 34, train_loss: 1.1138, test_loss: 1.0833, test_f1: 0.4704
 epoch: 35, train_loss: 1.1113, test_loss: 1.0680, test_f1: 0.4677
 epoch: 36, train_loss: 1.1062, test_loss: 1.0709, test_f1: 0.4795
 epoch: 37, train_loss: 1.1125, test_loss: 1.0651, test_f1: 0.4851
 epoch: 38, train_loss: 1.0978, test_loss: 1.0607, test_f1: 0.4886
 epoch: 39, train_loss: 1.0894, test_loss: 1.0638, test_f1: 0.4887
 epoch: 40, train_loss: 1.0936, test_loss: 1.0566, test_f1: 0.4844
 epoch: 41, train_loss: 1.0888, test_loss: 1.0455, test_f1: 0.4902
 epoch: 42, train_loss: 1.0834, test_loss: 1.0510, test_f1: 0.4950
 epoch: 43, train_loss: 1.0830, test_loss: 1.0376, test_f1: 0.5020
 epoch: 44, train_loss: 1.0773, test_loss: 1.0372, test_f1: 0.4891
 epoch: 45, train_loss: 1.0768, test_loss: 1.0427, test_f1: 0.5013
 epoch: 46, train_loss: 1.0781, test_loss: 1.0334, test_f1: 0.4888
 epoch: 47, train_loss: 1.0687, test_loss: 1.0267, test_f1: 0.4942
 epoch: 48, train_loss: 1.0695, test_loss: 1.0332, test_f1: 0.4745
 epoch: 49, train_loss: 1.0654, test_loss: 1.0181, test_f1: 0.5042
 epoch: 50, train_loss: 1.0624, test_loss: 1.0176, test_f1: 0.4815
 epoch: 51, train_loss: 1.0498, test_loss: 1.0209, test_f1: 0.4775
 epoch: 52, train_loss: 1.0538, test_loss: 1.0145, test_f1: 0.5046
 epoch: 53, train_loss: 1.0586, test_loss: 1.0182, test_f1: 0.4973
 epoch: 54, train_loss: 1.0478, test_loss: 1.0159, test_f1: 0.5048
 epoch: 55, train_loss: 1.0472, test_loss: 1.0202, test_f1: 0.4804
 epoch: 56, train_loss: 1.0513, test_loss: 1.0105, test_f1: 0.4920
 epoch: 57, train_loss: 1.0437, test_loss: 1.0278, test_f1: 0.4843
 epoch: 58, train_loss: 1.0448, test_loss: 1.0119, test_f1: 0.4970
 epoch: 59, train_loss: 1.0480, test_loss: 1.0061, test_f1: 0.5037
 epoch: 60, train_loss: 1.0399, test_loss: 1.0094, test_f1: 0.5074
 epoch: 61, train_loss: 1.0432, test_loss: 1.0079, test_f1: 0.4887
 epoch: 62, train_loss: 1.0400, test_loss: 0.9986, test_f1: 0.5160
 epoch: 63, train_loss: 1.0511, test_loss: 0.9911, test_f1: 0.5034
 epoch: 64, train_loss: 1.0462, test_loss: 0.9969, test_f1: 0.4946
 epoch: 65, train_loss: 1.0430, test_loss: 1.0026, test_f1: 0.4902
 epoch: 66, train_loss: 1.0312, test_loss: 1.0038, test_f1: 0.4875
 epoch: 67, train_loss: 1.0346, test_loss: 1.0045, test_f1: 0.5118
 epoch: 68, train_loss: 1.0277, test_loss: 0.9975, test_f1: 0.4972
 epoch: 69, train_loss: 1.0377, test_loss: 1.0019, test_f1: 0.4922
 epoch: 70, train_loss: 1.0511, test_loss: 0.9952, test_f1: 0.4786
 epoch: 71, train_loss: 1.0321, test_loss: 0.9966, test_f1: 0.5160
 epoch: 72, train_loss: 1.0387, test_loss: 0.9996, test_f1: 0.5047
 epoch: 73, train_loss: 1.0287, test_loss: 0.9935, test_f1: 0.5133
 epoch: 74, train_loss: 1.0324, test_loss: 0.9939, test_f1: 0.5152
 epoch: 75, train_loss: 1.0303, test_loss: 0.9943, test_f1: 0.5013
 epoch: 76, train_loss: 1.0277, test_loss: 0.9946, test_f1: 0.5140
 epoch: 77, train_loss: 1.0137, test_loss: 1.0024, test_f1: 0.4877
 epoch: 78, train_loss: 1.0274, test_loss: 0.9966, test_f1: 0.4966
 epoch: 79, train_loss: 1.0273, test_loss: 1.0033, test_f1: 0.4821
 epoch: 80, train_loss: 1.0237, test_loss: 0.9950, test_f1: 0.4948
 epoch: 81, train_loss: 1.0288, test_loss: 0.9847, test_f1: 0.5048
 epoch: 82, train_loss: 1.0232, test_loss: 0.9969, test_f1: 0.5038
 epoch: 83, train_loss: 1.0107, test_loss: 0.9934, test_f1: 0.5075
 epoch: 84, train_loss: 1.0201, test_loss: 0.9926, test_f1: 0.4938
 epoch: 85, train_loss: 1.0228, test_loss: 0.9924, test_f1: 0.5203
 epoch: 86, train_loss: 1.0144, test_loss: 0.9955, test_f1: 0.4904
 epoch: 87, train_loss: 1.0251, test_loss: 0.9830, test_f1: 0.5051
 epoch: 88, train_loss: 1.0084, test_loss: 0.9826, test_f1: 0.5095
 epoch: 89, train_loss: 1.0156, test_loss: 0.9928, test_f1: 0.4857
 epoch: 90, train_loss: 1.0027, test_loss: 0.9798, test_f1: 0.5175
 epoch: 91, train_loss: 1.0103, test_loss: 0.9856, test_f1: 0.4912
 epoch: 92, train_loss: 1.0173, test_loss: 1.0037, test_f1: 0.4796
 epoch: 93, train_loss: 1.0112, test_loss: 0.9846, test_f1: 0.5124
 epoch: 94, train_loss: 1.0073, test_loss: 0.9958, test_f1: 0.5025
 epoch: 95, train_loss: 1.0082, test_loss: 0.9926, test_f1: 0.4926
 epoch: 96, train_loss: 1.0019, test_loss: 0.9833, test_f1: 0.4968
 epoch: 97, train_loss: 1.0112, test_loss: 0.9867, test_f1: 0.4946
 epoch: 98, train_loss: 1.0125, test_loss: 0.9868, test_f1: 0.5065
 epoch: 99, train_loss: 1.0000, test_loss: 0.9855, test_f1: 0.5041
##################ITERATION #1 ****************************************
 epoch: 0, train_loss: 1.3244, test_loss: 1.3005, test_f1: 0.2622
 epoch: 1, train_loss: 1.2962, test_loss: 1.2855, test_f1: 0.2529
 epoch: 2, train_loss: 1.2863, test_loss: 1.2622, test_f1: 0.2300
 epoch: 3, train_loss: 1.2715, test_loss: 1.2547, test_f1: 0.2437
 epoch: 4, train_loss: 1.2647, test_loss: 1.2454, test_f1: 0.2544
 epoch: 5, train_loss: 1.2523, test_loss: 1.2428, test_f1: 0.2827
 epoch: 6, train_loss: 1.2452, test_loss: 1.2234, test_f1: 0.2881
 epoch: 7, train_loss: 1.2432, test_loss: 1.2165, test_f1: 0.2967
 epoch: 8, train_loss: 1.2298, test_loss: 1.2127, test_f1: 0.3168
 epoch: 9, train_loss: 1.2210, test_loss: 1.2037, test_f1: 0.3374
 epoch: 10, train_loss: 1.2124, test_loss: 1.1872, test_f1: 0.3761
 epoch: 11, train_loss: 1.2080, test_loss: 1.1846, test_f1: 0.3872
 epoch: 12, train_loss: 1.2034, test_loss: 1.1764, test_f1: 0.4208
 epoch: 13, train_loss: 1.1914, test_loss: 1.1656, test_f1: 0.4208
 epoch: 14, train_loss: 1.1866, test_loss: 1.1662, test_f1: 0.4291
 epoch: 15, train_loss: 1.1863, test_loss: 1.1531, test_f1: 0.4502
 epoch: 16, train_loss: 1.1807, test_loss: 1.1540, test_f1: 0.4425
 epoch: 17, train_loss: 1.1680, test_loss: 1.1354, test_f1: 0.4484
 epoch: 18, train_loss: 1.1578, test_loss: 1.1365, test_f1: 0.4487
 epoch: 19, train_loss: 1.1664, test_loss: 1.1372, test_f1: 0.4462
 epoch: 20, train_loss: 1.1555, test_loss: 1.1314, test_f1: 0.4317
 epoch: 21, train_loss: 1.1531, test_loss: 1.1418, test_f1: 0.4126
 epoch: 22, train_loss: 1.1482, test_loss: 1.1337, test_f1: 0.4470
 epoch: 23, train_loss: 1.1395, test_loss: 1.1266, test_f1: 0.4366
 epoch: 24, train_loss: 1.1406, test_loss: 1.1111, test_f1: 0.4601
 epoch: 25, train_loss: 1.1319, test_loss: 1.1027, test_f1: 0.4589
 epoch: 26, train_loss: 1.1243, test_loss: 1.1007, test_f1: 0.4680
 epoch: 27, train_loss: 1.1282, test_loss: 1.1075, test_f1: 0.4429
 epoch: 28, train_loss: 1.1219, test_loss: 1.1054, test_f1: 0.4432
 epoch: 29, train_loss: 1.1178, test_loss: 1.0997, test_f1: 0.4500
 epoch: 30, train_loss: 1.1207, test_loss: 1.0868, test_f1: 0.4542
 epoch: 31, train_loss: 1.1081, test_loss: 1.0894, test_f1: 0.4625
 epoch: 32, train_loss: 1.1008, test_loss: 1.0880, test_f1: 0.4518
 epoch: 33, train_loss: 1.1089, test_loss: 1.0883, test_f1: 0.4651
 epoch: 34, train_loss: 1.1039, test_loss: 1.0799, test_f1: 0.4616
 epoch: 35, train_loss: 1.0936, test_loss: 1.0888, test_f1: 0.4334
 epoch: 36, train_loss: 1.0950, test_loss: 1.0741, test_f1: 0.4686
 epoch: 37, train_loss: 1.0960, test_loss: 1.0701, test_f1: 0.4737
 epoch: 38, train_loss: 1.0989, test_loss: 1.0751, test_f1: 0.4372
 epoch: 39, train_loss: 1.0835, test_loss: 1.0735, test_f1: 0.4439
 epoch: 40, train_loss: 1.0903, test_loss: 1.0755, test_f1: 0.4603
 epoch: 41, train_loss: 1.0945, test_loss: 1.0517, test_f1: 0.4718
 epoch: 42, train_loss: 1.0823, test_loss: 1.0507, test_f1: 0.4429
 epoch: 43, train_loss: 1.0813, test_loss: 1.0924, test_f1: 0.4405
 epoch: 44, train_loss: 1.0756, test_loss: 1.0539, test_f1: 0.4498
 epoch: 45, train_loss: 1.0792, test_loss: 1.0606, test_f1: 0.4466
 epoch: 46, train_loss: 1.0699, test_loss: 1.0625, test_f1: 0.4460
 epoch: 47, train_loss: 1.0765, test_loss: 1.0428, test_f1: 0.4606
 epoch: 48, train_loss: 1.0731, test_loss: 1.0632, test_f1: 0.4569
 epoch: 49, train_loss: 1.0579, test_loss: 1.0482, test_f1: 0.4536
 epoch: 50, train_loss: 1.0688, test_loss: 1.0602, test_f1: 0.4510
 epoch: 51, train_loss: 1.0572, test_loss: 1.0323, test_f1: 0.4920
 epoch: 52, train_loss: 1.0539, test_loss: 1.0321, test_f1: 0.4652
 epoch: 53, train_loss: 1.0503, test_loss: 1.0368, test_f1: 0.4671
 epoch: 54, train_loss: 1.0562, test_loss: 1.0453, test_f1: 0.4603
 epoch: 55, train_loss: 1.0497, test_loss: 1.0339, test_f1: 0.4708
 epoch: 56, train_loss: 1.0563, test_loss: 1.0742, test_f1: 0.4538
 epoch: 57, train_loss: 1.0486, test_loss: 1.0326, test_f1: 0.4861
 epoch: 58, train_loss: 1.0573, test_loss: 1.0418, test_f1: 0.4486
 epoch: 59, train_loss: 1.0531, test_loss: 1.0477, test_f1: 0.4534
 epoch: 60, train_loss: 1.0541, test_loss: 1.0332, test_f1: 0.4583
 epoch: 61, train_loss: 1.0505, test_loss: 1.0264, test_f1: 0.4744
 epoch: 62, train_loss: 1.0304, test_loss: 1.0439, test_f1: 0.4699
 epoch: 63, train_loss: 1.0389, test_loss: 1.0326, test_f1: 0.4895
 epoch: 64, train_loss: 1.0501, test_loss: 1.0490, test_f1: 0.4632
 epoch: 65, train_loss: 1.0451, test_loss: 1.0450, test_f1: 0.4709
 epoch: 66, train_loss: 1.0506, test_loss: 1.0353, test_f1: 0.4777
 epoch: 67, train_loss: 1.0384, test_loss: 1.0500, test_f1: 0.4775
 epoch: 68, train_loss: 1.0390, test_loss: 1.0497, test_f1: 0.4683
 epoch: 69, train_loss: 1.0360, test_loss: 1.0395, test_f1: 0.4809
 epoch: 70, train_loss: 1.0352, test_loss: 1.0309, test_f1: 0.4746
 epoch: 71, train_loss: 1.0386, test_loss: 1.0261, test_f1: 0.4977
 epoch: 72, train_loss: 1.0442, test_loss: 1.0214, test_f1: 0.4899
 epoch: 73, train_loss: 1.0436, test_loss: 1.0404, test_f1: 0.4778
 epoch: 74, train_loss: 1.0383, test_loss: 1.0317, test_f1: 0.4780
 epoch: 75, train_loss: 1.0375, test_loss: 1.0463, test_f1: 0.4819
 epoch: 76, train_loss: 1.0362, test_loss: 1.0384, test_f1: 0.4647
 epoch: 77, train_loss: 1.0402, test_loss: 1.0267, test_f1: 0.4903
 epoch: 78, train_loss: 1.0396, test_loss: 1.0340, test_f1: 0.4916
 epoch: 79, train_loss: 1.0362, test_loss: 1.0478, test_f1: 0.4779
 epoch: 80, train_loss: 1.0338, test_loss: 1.0485, test_f1: 0.4757
 epoch: 81, train_loss: 1.0370, test_loss: 1.0245, test_f1: 0.4916
 epoch: 82, train_loss: 1.0251, test_loss: 1.0326, test_f1: 0.4690
 epoch: 83, train_loss: 1.0362, test_loss: 1.0320, test_f1: 0.4958
 epoch: 84, train_loss: 1.0268, test_loss: 1.0366, test_f1: 0.4702
 epoch: 85, train_loss: 1.0317, test_loss: 1.0351, test_f1: 0.4799
 epoch: 86, train_loss: 1.0250, test_loss: 1.0367, test_f1: 0.4805
 epoch: 87, train_loss: 1.0298, test_loss: 1.0433, test_f1: 0.4799
 epoch: 88, train_loss: 1.0187, test_loss: 1.0260, test_f1: 0.4856
 epoch: 89, train_loss: 1.0266, test_loss: 1.0269, test_f1: 0.4865
 epoch: 90, train_loss: 1.0164, test_loss: 1.0347, test_f1: 0.4705
 epoch: 91, train_loss: 1.0093, test_loss: 1.0334, test_f1: 0.4737
 epoch: 92, train_loss: 1.0183, test_loss: 1.0498, test_f1: 0.4694
 epoch: 93, train_loss: 1.0165, test_loss: 1.0455, test_f1: 0.4606
 epoch: 94, train_loss: 1.0206, test_loss: 1.0378, test_f1: 0.4817
 epoch: 95, train_loss: 1.0131, test_loss: 1.0491, test_f1: 0.4774
 epoch: 96, train_loss: 1.0240, test_loss: 1.0235, test_f1: 0.4888
 epoch: 97, train_loss: 1.0138, test_loss: 1.0197, test_f1: 0.4962
 epoch: 98, train_loss: 1.0135, test_loss: 1.0193, test_f1: 0.5097
 epoch: 99, train_loss: 1.0141, test_loss: 1.0239, test_f1: 0.4968
##################ITERATION #2 ****************************************
 epoch: 0, train_loss: 1.3285, test_loss: 1.3119, test_f1: 0.2653
 epoch: 1, train_loss: 1.2878, test_loss: 1.2964, test_f1: 0.2522
 epoch: 2, train_loss: 1.2744, test_loss: 1.2927, test_f1: 0.2417
 epoch: 3, train_loss: 1.2615, test_loss: 1.2812, test_f1: 0.2523
 epoch: 4, train_loss: 1.2548, test_loss: 1.2637, test_f1: 0.2632
 epoch: 5, train_loss: 1.2490, test_loss: 1.2614, test_f1: 0.2603
 epoch: 6, train_loss: 1.2411, test_loss: 1.2691, test_f1: 0.2772
 epoch: 7, train_loss: 1.2384, test_loss: 1.2569, test_f1: 0.2787
 epoch: 8, train_loss: 1.2358, test_loss: 1.2632, test_f1: 0.2888
 epoch: 9, train_loss: 1.2274, test_loss: 1.2532, test_f1: 0.2893
 epoch: 10, train_loss: 1.2302, test_loss: 1.2624, test_f1: 0.3119
 epoch: 11, train_loss: 1.2146, test_loss: 1.2505, test_f1: 0.3255
 epoch: 12, train_loss: 1.2140, test_loss: 1.2564, test_f1: 0.3682
 epoch: 13, train_loss: 1.2115, test_loss: 1.2641, test_f1: 0.3790
 epoch: 14, train_loss: 1.2121, test_loss: 1.2234, test_f1: 0.3826
 epoch: 15, train_loss: 1.2015, test_loss: 1.2322, test_f1: 0.3986
 epoch: 16, train_loss: 1.2036, test_loss: 1.2224, test_f1: 0.4128
 epoch: 17, train_loss: 1.1964, test_loss: 1.2326, test_f1: 0.4111
 epoch: 18, train_loss: 1.1936, test_loss: 1.2317, test_f1: 0.4073
 epoch: 19, train_loss: 1.1928, test_loss: 1.2067, test_f1: 0.4197
 epoch: 20, train_loss: 1.1938, test_loss: 1.1830, test_f1: 0.4182
 epoch: 21, train_loss: 1.1770, test_loss: 1.1926, test_f1: 0.4218
 epoch: 22, train_loss: 1.1783, test_loss: 1.1921, test_f1: 0.4043
 epoch: 23, train_loss: 1.1693, test_loss: 1.1872, test_f1: 0.4142
 epoch: 24, train_loss: 1.1698, test_loss: 1.1962, test_f1: 0.4321
 epoch: 25, train_loss: 1.1584, test_loss: 1.2255, test_f1: 0.4144
 epoch: 26, train_loss: 1.1579, test_loss: 1.1780, test_f1: 0.4180
 epoch: 27, train_loss: 1.1564, test_loss: 1.1534, test_f1: 0.4159
 epoch: 28, train_loss: 1.1482, test_loss: 1.1665, test_f1: 0.4088
 epoch: 29, train_loss: 1.1577, test_loss: 1.1490, test_f1: 0.4227
 epoch: 30, train_loss: 1.1445, test_loss: 1.1396, test_f1: 0.4139
 epoch: 31, train_loss: 1.1378, test_loss: 1.1694, test_f1: 0.3971
 epoch: 32, train_loss: 1.1402, test_loss: 1.1601, test_f1: 0.4174
 epoch: 33, train_loss: 1.1204, test_loss: 1.1360, test_f1: 0.4168
 epoch: 34, train_loss: 1.1267, test_loss: 1.1360, test_f1: 0.4095
 epoch: 35, train_loss: 1.1223, test_loss: 1.1680, test_f1: 0.4349
 epoch: 36, train_loss: 1.1211, test_loss: 1.1102, test_f1: 0.4408
 epoch: 37, train_loss: 1.1227, test_loss: 1.1058, test_f1: 0.4246
 epoch: 38, train_loss: 1.1133, test_loss: 1.1179, test_f1: 0.4211
 epoch: 39, train_loss: 1.1120, test_loss: 1.0954, test_f1: 0.4136
 epoch: 40, train_loss: 1.1176, test_loss: 1.0979, test_f1: 0.4275
 epoch: 41, train_loss: 1.1107, test_loss: 1.0992, test_f1: 0.4026
 epoch: 42, train_loss: 1.1056, test_loss: 1.0901, test_f1: 0.4331
 epoch: 43, train_loss: 1.0965, test_loss: 1.0953, test_f1: 0.4136
 epoch: 44, train_loss: 1.1019, test_loss: 1.0885, test_f1: 0.4263
 epoch: 45, train_loss: 1.0986, test_loss: 1.0883, test_f1: 0.4266
 epoch: 46, train_loss: 1.0888, test_loss: 1.0841, test_f1: 0.4207
 epoch: 47, train_loss: 1.0858, test_loss: 1.0884, test_f1: 0.4283
 epoch: 48, train_loss: 1.0836, test_loss: 1.0772, test_f1: 0.4372
 epoch: 49, train_loss: 1.0841, test_loss: 1.0762, test_f1: 0.4414
 epoch: 50, train_loss: 1.0775, test_loss: 1.0753, test_f1: 0.4528
 epoch: 51, train_loss: 1.0727, test_loss: 1.0724, test_f1: 0.4417
 epoch: 52, train_loss: 1.0785, test_loss: 1.0664, test_f1: 0.4461
 epoch: 53, train_loss: 1.0680, test_loss: 1.0704, test_f1: 0.4366
 epoch: 54, train_loss: 1.0693, test_loss: 1.0688, test_f1: 0.4385
 epoch: 55, train_loss: 1.0648, test_loss: 1.0649, test_f1: 0.4537
 epoch: 56, train_loss: 1.0619, test_loss: 1.0619, test_f1: 0.4584
 epoch: 57, train_loss: 1.0710, test_loss: 1.0672, test_f1: 0.4403
 epoch: 58, train_loss: 1.0672, test_loss: 1.0761, test_f1: 0.4330
 epoch: 59, train_loss: 1.0557, test_loss: 1.0596, test_f1: 0.4406
 epoch: 60, train_loss: 1.0559, test_loss: 1.0761, test_f1: 0.4481
 epoch: 61, train_loss: 1.0553, test_loss: 1.0598, test_f1: 0.4470
 epoch: 62, train_loss: 1.0571, test_loss: 1.0599, test_f1: 0.4401
 epoch: 63, train_loss: 1.0543, test_loss: 1.0456, test_f1: 0.4553
 epoch: 64, train_loss: 1.0610, test_loss: 1.0557, test_f1: 0.4555
 epoch: 65, train_loss: 1.0660, test_loss: 1.0503, test_f1: 0.4645
 epoch: 66, train_loss: 1.0501, test_loss: 1.0577, test_f1: 0.4449
 epoch: 67, train_loss: 1.0513, test_loss: 1.0510, test_f1: 0.4647
 epoch: 68, train_loss: 1.0520, test_loss: 1.0610, test_f1: 0.4351
 epoch: 69, train_loss: 1.0527, test_loss: 1.0510, test_f1: 0.4313
 epoch: 70, train_loss: 1.0486, test_loss: 1.0485, test_f1: 0.4486
 epoch: 71, train_loss: 1.0398, test_loss: 1.0346, test_f1: 0.4489
 epoch: 72, train_loss: 1.0427, test_loss: 1.0580, test_f1: 0.4401
 epoch: 73, train_loss: 1.0407, test_loss: 1.0618, test_f1: 0.4491
 epoch: 74, train_loss: 1.0375, test_loss: 1.0587, test_f1: 0.4472
 epoch: 75, train_loss: 1.0380, test_loss: 1.0639, test_f1: 0.4288
 epoch: 76, train_loss: 1.0398, test_loss: 1.0529, test_f1: 0.4473
 epoch: 77, train_loss: 1.0381, test_loss: 1.0369, test_f1: 0.4546
 epoch: 78, train_loss: 1.0391, test_loss: 1.0506, test_f1: 0.4531
 epoch: 79, train_loss: 1.0350, test_loss: 1.0570, test_f1: 0.4422
 epoch: 80, train_loss: 1.0446, test_loss: 1.0347, test_f1: 0.4514
 epoch: 81, train_loss: 1.0419, test_loss: 1.0579, test_f1: 0.4428
 epoch: 82, train_loss: 1.0297, test_loss: 1.0594, test_f1: 0.4457
 epoch: 83, train_loss: 1.0366, test_loss: 1.0415, test_f1: 0.4606
 epoch: 84, train_loss: 1.0356, test_loss: 1.0459, test_f1: 0.4678
 epoch: 85, train_loss: 1.0356, test_loss: 1.0292, test_f1: 0.4580
 epoch: 86, train_loss: 1.0302, test_loss: 1.0301, test_f1: 0.4556
 epoch: 87, train_loss: 1.0271, test_loss: 1.0226, test_f1: 0.4585
 epoch: 88, train_loss: 1.0169, test_loss: 1.0216, test_f1: 0.4695
 epoch: 89, train_loss: 1.0227, test_loss: 1.0275, test_f1: 0.4636
 epoch: 90, train_loss: 1.0252, test_loss: 1.0386, test_f1: 0.4616
 epoch: 91, train_loss: 1.0230, test_loss: 1.0328, test_f1: 0.4630
 epoch: 92, train_loss: 1.0316, test_loss: 1.0508, test_f1: 0.4713
 epoch: 93, train_loss: 1.0196, test_loss: 1.0298, test_f1: 0.4607
 epoch: 94, train_loss: 1.0215, test_loss: 1.0234, test_f1: 0.4673
 epoch: 95, train_loss: 1.0254, test_loss: 1.0361, test_f1: 0.4661
 epoch: 96, train_loss: 1.0150, test_loss: 1.0240, test_f1: 0.4564
 epoch: 97, train_loss: 1.0257, test_loss: 1.0178, test_f1: 0.4565
 epoch: 98, train_loss: 1.0138, test_loss: 1.0305, test_f1: 0.4636
 epoch: 99, train_loss: 1.0196, test_loss: 1.0336, test_f1: 0.4687
##################ITERATION #3 ****************************************
 epoch: 0, train_loss: 1.3294, test_loss: 1.2809, test_f1: 0.2274
 epoch: 1, train_loss: 1.2821, test_loss: 1.2570, test_f1: 0.2381
 epoch: 2, train_loss: 1.2668, test_loss: 1.2363, test_f1: 0.2777
 epoch: 3, train_loss: 1.2508, test_loss: 1.2232, test_f1: 0.2863
 epoch: 4, train_loss: 1.2411, test_loss: 1.2116, test_f1: 0.3237
 epoch: 5, train_loss: 1.2318, test_loss: 1.1993, test_f1: 0.3675
 epoch: 6, train_loss: 1.2209, test_loss: 1.1808, test_f1: 0.4021
 epoch: 7, train_loss: 1.2113, test_loss: 1.1721, test_f1: 0.4175
 epoch: 8, train_loss: 1.2057, test_loss: 1.1574, test_f1: 0.4228
 epoch: 9, train_loss: 1.1951, test_loss: 1.1446, test_f1: 0.4262
 epoch: 10, train_loss: 1.1950, test_loss: 1.1322, test_f1: 0.4336
 epoch: 11, train_loss: 1.1833, test_loss: 1.1325, test_f1: 0.4231
 epoch: 12, train_loss: 1.1673, test_loss: 1.1095, test_f1: 0.4398
 epoch: 13, train_loss: 1.1642, test_loss: 1.1052, test_f1: 0.4390
 epoch: 14, train_loss: 1.1645, test_loss: 1.0989, test_f1: 0.4371
 epoch: 15, train_loss: 1.1609, test_loss: 1.0957, test_f1: 0.4531
 epoch: 16, train_loss: 1.1548, test_loss: 1.0772, test_f1: 0.4578
 epoch: 17, train_loss: 1.1470, test_loss: 1.0790, test_f1: 0.4754
 epoch: 18, train_loss: 1.1441, test_loss: 1.0671, test_f1: 0.4452
 epoch: 19, train_loss: 1.1435, test_loss: 1.0594, test_f1: 0.4530
 epoch: 20, train_loss: 1.1404, test_loss: 1.0568, test_f1: 0.4592
 epoch: 21, train_loss: 1.1292, test_loss: 1.0496, test_f1: 0.4718
 epoch: 22, train_loss: 1.1209, test_loss: 1.0484, test_f1: 0.4591
 epoch: 23, train_loss: 1.1298, test_loss: 1.0377, test_f1: 0.4642
 epoch: 24, train_loss: 1.1269, test_loss: 1.0435, test_f1: 0.4466
 epoch: 25, train_loss: 1.1119, test_loss: 1.0443, test_f1: 0.4484
 epoch: 26, train_loss: 1.1117, test_loss: 1.0295, test_f1: 0.4569
 epoch: 27, train_loss: 1.1057, test_loss: 1.0225, test_f1: 0.4692
 epoch: 28, train_loss: 1.0974, test_loss: 1.0198, test_f1: 0.4637
 epoch: 29, train_loss: 1.0955, test_loss: 1.0261, test_f1: 0.4481
 epoch: 30, train_loss: 1.1032, test_loss: 1.0364, test_f1: 0.4571
 epoch: 31, train_loss: 1.0863, test_loss: 1.0165, test_f1: 0.4699
 epoch: 32, train_loss: 1.0870, test_loss: 1.0076, test_f1: 0.4644
 epoch: 33, train_loss: 1.0873, test_loss: 1.0011, test_f1: 0.4705
 epoch: 34, train_loss: 1.0729, test_loss: 0.9949, test_f1: 0.5037
 epoch: 35, train_loss: 1.0709, test_loss: 0.9906, test_f1: 0.4825
 epoch: 36, train_loss: 1.0749, test_loss: 1.0081, test_f1: 0.4810
 epoch: 37, train_loss: 1.0700, test_loss: 0.9897, test_f1: 0.4839
 epoch: 38, train_loss: 1.0688, test_loss: 0.9944, test_f1: 0.4934
 epoch: 39, train_loss: 1.0788, test_loss: 0.9823, test_f1: 0.4816
 epoch: 40, train_loss: 1.0585, test_loss: 0.9839, test_f1: 0.5056
 epoch: 41, train_loss: 1.0545, test_loss: 0.9770, test_f1: 0.4996
 epoch: 42, train_loss: 1.0495, test_loss: 0.9733, test_f1: 0.4883
 epoch: 43, train_loss: 1.0558, test_loss: 0.9767, test_f1: 0.5132
 epoch: 44, train_loss: 1.0480, test_loss: 0.9715, test_f1: 0.5145
 epoch: 45, train_loss: 1.0479, test_loss: 0.9590, test_f1: 0.4951
 epoch: 46, train_loss: 1.0437, test_loss: 0.9634, test_f1: 0.4930
 epoch: 47, train_loss: 1.0440, test_loss: 0.9660, test_f1: 0.4885
 epoch: 48, train_loss: 1.0520, test_loss: 0.9606, test_f1: 0.4752
 epoch: 49, train_loss: 1.0446, test_loss: 0.9572, test_f1: 0.5162
 epoch: 50, train_loss: 1.0445, test_loss: 0.9531, test_f1: 0.4922
 epoch: 51, train_loss: 1.0398, test_loss: 0.9489, test_f1: 0.5131
 epoch: 52, train_loss: 1.0385, test_loss: 0.9475, test_f1: 0.4955
 epoch: 53, train_loss: 1.0461, test_loss: 0.9593, test_f1: 0.5036
 epoch: 54, train_loss: 1.0368, test_loss: 0.9518, test_f1: 0.4877
 epoch: 55, train_loss: 1.0435, test_loss: 0.9450, test_f1: 0.5053
 epoch: 56, train_loss: 1.0267, test_loss: 0.9642, test_f1: 0.4998
 epoch: 57, train_loss: 1.0265, test_loss: 0.9377, test_f1: 0.4993
 epoch: 58, train_loss: 1.0300, test_loss: 0.9610, test_f1: 0.5076
 epoch: 59, train_loss: 1.0285, test_loss: 0.9537, test_f1: 0.5038
 epoch: 60, train_loss: 1.0321, test_loss: 0.9578, test_f1: 0.5062
 epoch: 61, train_loss: 1.0253, test_loss: 0.9535, test_f1: 0.5079
 epoch: 62, train_loss: 1.0309, test_loss: 0.9600, test_f1: 0.4828
 epoch: 63, train_loss: 1.0230, test_loss: 0.9335, test_f1: 0.5044
 epoch: 64, train_loss: 1.0340, test_loss: 0.9383, test_f1: 0.4993
 epoch: 65, train_loss: 1.0233, test_loss: 0.9436, test_f1: 0.5096
 epoch: 66, train_loss: 1.0192, test_loss: 0.9512, test_f1: 0.4746
 epoch: 67, train_loss: 1.0260, test_loss: 0.9519, test_f1: 0.4811
 epoch: 68, train_loss: 1.0230, test_loss: 0.9512, test_f1: 0.4794
 epoch: 69, train_loss: 1.0159, test_loss: 0.9478, test_f1: 0.4973
 epoch: 70, train_loss: 1.0177, test_loss: 0.9539, test_f1: 0.4875
 epoch: 71, train_loss: 1.0154, test_loss: 0.9479, test_f1: 0.4774
 epoch: 72, train_loss: 1.0159, test_loss: 0.9331, test_f1: 0.4980
 epoch: 73, train_loss: 1.0175, test_loss: 0.9378, test_f1: 0.4874
 epoch: 74, train_loss: 1.0057, test_loss: 0.9428, test_f1: 0.4911
 epoch: 75, train_loss: 1.0119, test_loss: 0.9511, test_f1: 0.4799
 epoch: 76, train_loss: 1.0117, test_loss: 0.9542, test_f1: 0.4868
 epoch: 77, train_loss: 1.0170, test_loss: 0.9451, test_f1: 0.4896
 epoch: 78, train_loss: 1.0188, test_loss: 0.9434, test_f1: 0.4949
 epoch: 79, train_loss: 1.0156, test_loss: 0.9386, test_f1: 0.5223
 epoch: 80, train_loss: 1.0131, test_loss: 0.9382, test_f1: 0.5082
 epoch: 81, train_loss: 1.0219, test_loss: 0.9253, test_f1: 0.5214
 epoch: 82, train_loss: 1.0128, test_loss: 0.9380, test_f1: 0.5085
 epoch: 83, train_loss: 1.0230, test_loss: 0.9285, test_f1: 0.5244
 epoch: 84, train_loss: 1.0013, test_loss: 0.9226, test_f1: 0.4984
 epoch: 85, train_loss: 1.0055, test_loss: 0.9250, test_f1: 0.4962
 epoch: 86, train_loss: 1.0098, test_loss: 0.9333, test_f1: 0.5158
 epoch: 87, train_loss: 1.0057, test_loss: 0.9353, test_f1: 0.5177
 epoch: 88, train_loss: 1.0062, test_loss: 0.9287, test_f1: 0.4957
 epoch: 89, train_loss: 1.0041, test_loss: 0.9373, test_f1: 0.5173
 epoch: 90, train_loss: 1.0025, test_loss: 0.9343, test_f1: 0.5240
 epoch: 91, train_loss: 0.9985, test_loss: 0.9319, test_f1: 0.4970
 epoch: 92, train_loss: 1.0012, test_loss: 0.9339, test_f1: 0.4968
 epoch: 93, train_loss: 1.0029, test_loss: 0.9372, test_f1: 0.4959
 epoch: 94, train_loss: 1.0094, test_loss: 0.9300, test_f1: 0.5152
 epoch: 95, train_loss: 1.0092, test_loss: 0.9255, test_f1: 0.5125
 epoch: 96, train_loss: 0.9964, test_loss: 0.9355, test_f1: 0.4909
 epoch: 97, train_loss: 0.9966, test_loss: 0.9283, test_f1: 0.4992
 epoch: 98, train_loss: 0.9938, test_loss: 0.9350, test_f1: 0.4988
 epoch: 99, train_loss: 1.0002, test_loss: 0.9353, test_f1: 0.5090
##################ITERATION #4 ****************************************
 epoch: 0, train_loss: 1.2970, test_loss: 1.2685, test_f1: 0.2327
 epoch: 1, train_loss: 1.2685, test_loss: 1.2574, test_f1: 0.2549
 epoch: 2, train_loss: 1.2611, test_loss: 1.2473, test_f1: 0.2489
 epoch: 3, train_loss: 1.2502, test_loss: 1.2362, test_f1: 0.2781
 epoch: 4, train_loss: 1.2457, test_loss: 1.2265, test_f1: 0.2972
 epoch: 5, train_loss: 1.2315, test_loss: 1.2165, test_f1: 0.3842
 epoch: 6, train_loss: 1.2284, test_loss: 1.2138, test_f1: 0.3672
 epoch: 7, train_loss: 1.2218, test_loss: 1.2019, test_f1: 0.3996
 epoch: 8, train_loss: 1.2175, test_loss: 1.1953, test_f1: 0.3799
 epoch: 9, train_loss: 1.2165, test_loss: 1.1937, test_f1: 0.3817
 epoch: 10, train_loss: 1.2081, test_loss: 1.1798, test_f1: 0.4117
 epoch: 11, train_loss: 1.2000, test_loss: 1.1761, test_f1: 0.3921
 epoch: 12, train_loss: 1.1985, test_loss: 1.1685, test_f1: 0.4389
 epoch: 13, train_loss: 1.1897, test_loss: 1.1668, test_f1: 0.4124
 epoch: 14, train_loss: 1.1863, test_loss: 1.1544, test_f1: 0.4494
 epoch: 15, train_loss: 1.1906, test_loss: 1.1494, test_f1: 0.4391
 epoch: 16, train_loss: 1.1824, test_loss: 1.1451, test_f1: 0.4584
 epoch: 17, train_loss: 1.1789, test_loss: 1.1360, test_f1: 0.4554
 epoch: 18, train_loss: 1.1725, test_loss: 1.1320, test_f1: 0.4534
 epoch: 19, train_loss: 1.1651, test_loss: 1.1333, test_f1: 0.4457
 epoch: 20, train_loss: 1.1648, test_loss: 1.1222, test_f1: 0.4424
 epoch: 21, train_loss: 1.1592, test_loss: 1.1141, test_f1: 0.4558
 epoch: 22, train_loss: 1.1616, test_loss: 1.1201, test_f1: 0.4504
 epoch: 23, train_loss: 1.1545, test_loss: 1.1122, test_f1: 0.4594
 epoch: 24, train_loss: 1.1592, test_loss: 1.1046, test_f1: 0.4782
 epoch: 25, train_loss: 1.1517, test_loss: 1.1055, test_f1: 0.4379
 epoch: 26, train_loss: 1.1448, test_loss: 1.0979, test_f1: 0.4322
 epoch: 27, train_loss: 1.1385, test_loss: 1.0983, test_f1: 0.4634
 epoch: 28, train_loss: 1.1428, test_loss: 1.0987, test_f1: 0.4645
 epoch: 29, train_loss: 1.1421, test_loss: 1.0902, test_f1: 0.4533
 epoch: 30, train_loss: 1.1319, test_loss: 1.0989, test_f1: 0.4558
 epoch: 31, train_loss: 1.1305, test_loss: 1.0932, test_f1: 0.4700
 epoch: 32, train_loss: 1.1256, test_loss: 1.0935, test_f1: 0.4380
 epoch: 33, train_loss: 1.1203, test_loss: 1.0744, test_f1: 0.4264
 epoch: 34, train_loss: 1.1188, test_loss: 1.0951, test_f1: 0.4469
 epoch: 35, train_loss: 1.1221, test_loss: 1.0711, test_f1: 0.4737
 epoch: 36, train_loss: 1.1069, test_loss: 1.0785, test_f1: 0.4675
 epoch: 37, train_loss: 1.1159, test_loss: 1.0736, test_f1: 0.4624
 epoch: 38, train_loss: 1.1042, test_loss: 1.0682, test_f1: 0.4497
 epoch: 39, train_loss: 1.1117, test_loss: 1.0614, test_f1: 0.4279
 epoch: 40, train_loss: 1.1130, test_loss: 1.0586, test_f1: 0.4699
 epoch: 41, train_loss: 1.1026, test_loss: 1.0530, test_f1: 0.4746
 epoch: 42, train_loss: 1.0987, test_loss: 1.0578, test_f1: 0.4274
 epoch: 43, train_loss: 1.0969, test_loss: 1.0391, test_f1: 0.4481
 epoch: 44, train_loss: 1.0964, test_loss: 1.0572, test_f1: 0.4725
 epoch: 45, train_loss: 1.0840, test_loss: 1.0359, test_f1: 0.4415
 epoch: 46, train_loss: 1.0889, test_loss: 1.0422, test_f1: 0.4379
 epoch: 47, train_loss: 1.0865, test_loss: 1.0375, test_f1: 0.4564
 epoch: 48, train_loss: 1.0839, test_loss: 1.0475, test_f1: 0.4451
 epoch: 49, train_loss: 1.0897, test_loss: 1.0411, test_f1: 0.4568
 epoch: 50, train_loss: 1.0799, test_loss: 1.0269, test_f1: 0.4684
 epoch: 51, train_loss: 1.0776, test_loss: 1.0478, test_f1: 0.4392
 epoch: 52, train_loss: 1.0756, test_loss: 1.0367, test_f1: 0.4600
 epoch: 53, train_loss: 1.0688, test_loss: 1.0346, test_f1: 0.4648
 epoch: 54, train_loss: 1.0771, test_loss: 1.0309, test_f1: 0.4528
 epoch: 55, train_loss: 1.0695, test_loss: 1.0591, test_f1: 0.4307
 epoch: 56, train_loss: 1.0659, test_loss: 1.0210, test_f1: 0.4618
 epoch: 57, train_loss: 1.0737, test_loss: 1.0195, test_f1: 0.4698
 epoch: 58, train_loss: 1.0696, test_loss: 1.0299, test_f1: 0.4588
 epoch: 59, train_loss: 1.0699, test_loss: 1.0189, test_f1: 0.4614
 epoch: 60, train_loss: 1.0559, test_loss: 1.0270, test_f1: 0.4557
 epoch: 61, train_loss: 1.0595, test_loss: 1.0245, test_f1: 0.4648
 epoch: 62, train_loss: 1.0620, test_loss: 1.0297, test_f1: 0.4580
 epoch: 63, train_loss: 1.0660, test_loss: 1.0179, test_f1: 0.4589
 epoch: 64, train_loss: 1.0580, test_loss: 1.0053, test_f1: 0.4432
 epoch: 65, train_loss: 1.0620, test_loss: 1.0163, test_f1: 0.4684
 epoch: 66, train_loss: 1.0555, test_loss: 1.0172, test_f1: 0.4362
 epoch: 67, train_loss: 1.0560, test_loss: 1.0316, test_f1: 0.4343
 epoch: 68, train_loss: 1.0377, test_loss: 1.0268, test_f1: 0.4609
 epoch: 69, train_loss: 1.0568, test_loss: 1.0295, test_f1: 0.4602
 epoch: 70, train_loss: 1.0625, test_loss: 1.0012, test_f1: 0.4804
 epoch: 71, train_loss: 1.0549, test_loss: 1.0339, test_f1: 0.4552
 epoch: 72, train_loss: 1.0607, test_loss: 1.0298, test_f1: 0.4524
 epoch: 73, train_loss: 1.0629, test_loss: 1.0289, test_f1: 0.4495
 epoch: 74, train_loss: 1.0511, test_loss: 1.0143, test_f1: 0.4309
 epoch: 75, train_loss: 1.0547, test_loss: 1.0180, test_f1: 0.4551
 epoch: 76, train_loss: 1.0491, test_loss: 1.0217, test_f1: 0.4514
 epoch: 77, train_loss: 1.0380, test_loss: 1.0376, test_f1: 0.4382
 epoch: 78, train_loss: 1.0464, test_loss: 1.0276, test_f1: 0.4579
 epoch: 79, train_loss: 1.0610, test_loss: 0.9985, test_f1: 0.4709
 epoch: 80, train_loss: 1.0477, test_loss: 1.0212, test_f1: 0.4665
 epoch: 81, train_loss: 1.0491, test_loss: 0.9983, test_f1: 0.4627
 epoch: 82, train_loss: 1.0345, test_loss: 1.0206, test_f1: 0.4607
 epoch: 83, train_loss: 1.0415, test_loss: 0.9925, test_f1: 0.4597
 epoch: 84, train_loss: 1.0424, test_loss: 1.0109, test_f1: 0.4657
 epoch: 85, train_loss: 1.0339, test_loss: 1.0215, test_f1: 0.4432
 epoch: 86, train_loss: 1.0432, test_loss: 1.0238, test_f1: 0.4480
 epoch: 87, train_loss: 1.0350, test_loss: 1.0265, test_f1: 0.4372
 epoch: 88, train_loss: 1.0412, test_loss: 1.0082, test_f1: 0.4659
 epoch: 89, train_loss: 1.0327, test_loss: 1.0068, test_f1: 0.4492
 epoch: 90, train_loss: 1.0373, test_loss: 0.9961, test_f1: 0.4581
 epoch: 91, train_loss: 1.0399, test_loss: 1.0074, test_f1: 0.4492
 epoch: 92, train_loss: 1.0246, test_loss: 1.0277, test_f1: 0.4458
 epoch: 93, train_loss: 1.0259, test_loss: 0.9936, test_f1: 0.4350
 epoch: 94, train_loss: 1.0261, test_loss: 1.0089, test_f1: 0.4665
 epoch: 95, train_loss: 1.0201, test_loss: 1.0116, test_f1: 0.4452
 epoch: 96, train_loss: 1.0257, test_loss: 1.0374, test_f1: 0.4267
 epoch: 97, train_loss: 1.0312, test_loss: 1.0065, test_f1: 0.4711
 epoch: 98, train_loss: 1.0260, test_loss: 1.0163, test_f1: 0.4523
 epoch: 99, train_loss: 1.0271, test_loss: 0.9939, test_f1: 0.4797
##################ITERATION #5 ****************************************
 epoch: 0, train_loss: 1.3222, test_loss: 1.2705, test_f1: 0.2956
 epoch: 1, train_loss: 1.2834, test_loss: 1.2527, test_f1: 0.3014
 epoch: 2, train_loss: 1.2602, test_loss: 1.2466, test_f1: 0.3095
 epoch: 3, train_loss: 1.2585, test_loss: 1.2317, test_f1: 0.3196
 epoch: 4, train_loss: 1.2479, test_loss: 1.2255, test_f1: 0.3218
 epoch: 5, train_loss: 1.2416, test_loss: 1.2201, test_f1: 0.3447
 epoch: 6, train_loss: 1.2425, test_loss: 1.2114, test_f1: 0.3853
 epoch: 7, train_loss: 1.2292, test_loss: 1.1936, test_f1: 0.3978
 epoch: 8, train_loss: 1.2210, test_loss: 1.1880, test_f1: 0.3990
 epoch: 9, train_loss: 1.2107, test_loss: 1.1744, test_f1: 0.4381
 epoch: 10, train_loss: 1.2068, test_loss: 1.1689, test_f1: 0.4168
 epoch: 11, train_loss: 1.2114, test_loss: 1.1623, test_f1: 0.4204
 epoch: 12, train_loss: 1.2073, test_loss: 1.1616, test_f1: 0.4191
 epoch: 13, train_loss: 1.2000, test_loss: 1.1528, test_f1: 0.4270
 epoch: 14, train_loss: 1.1928, test_loss: 1.1526, test_f1: 0.4167
 epoch: 15, train_loss: 1.1961, test_loss: 1.1406, test_f1: 0.4226
 epoch: 16, train_loss: 1.1832, test_loss: 1.1375, test_f1: 0.4224
 epoch: 17, train_loss: 1.1794, test_loss: 1.1305, test_f1: 0.4242
 epoch: 18, train_loss: 1.1882, test_loss: 1.1353, test_f1: 0.4244
 epoch: 19, train_loss: 1.1852, test_loss: 1.1262, test_f1: 0.4272
 epoch: 20, train_loss: 1.1757, test_loss: 1.1260, test_f1: 0.4277
 epoch: 21, train_loss: 1.1719, test_loss: 1.1181, test_f1: 0.4223
 epoch: 22, train_loss: 1.1653, test_loss: 1.1134, test_f1: 0.4432
 epoch: 23, train_loss: 1.1633, test_loss: 1.1148, test_f1: 0.4387
 epoch: 24, train_loss: 1.1665, test_loss: 1.1085, test_f1: 0.4516
 epoch: 25, train_loss: 1.1580, test_loss: 1.0966, test_f1: 0.4433
 epoch: 26, train_loss: 1.1671, test_loss: 1.0983, test_f1: 0.4440
 epoch: 27, train_loss: 1.1515, test_loss: 1.1013, test_f1: 0.4397
 epoch: 28, train_loss: 1.1461, test_loss: 1.0936, test_f1: 0.4389
 epoch: 29, train_loss: 1.1453, test_loss: 1.1044, test_f1: 0.4298
 epoch: 30, train_loss: 1.1432, test_loss: 1.0874, test_f1: 0.4431
 epoch: 31, train_loss: 1.1465, test_loss: 1.0961, test_f1: 0.4554
 epoch: 32, train_loss: 1.1327, test_loss: 1.0795, test_f1: 0.4384
 epoch: 33, train_loss: 1.1268, test_loss: 1.1090, test_f1: 0.4198
 epoch: 34, train_loss: 1.1257, test_loss: 1.1390, test_f1: 0.4281
 epoch: 35, train_loss: 1.1260, test_loss: 1.1314, test_f1: 0.4397
 epoch: 36, train_loss: 1.1274, test_loss: 1.1537, test_f1: 0.4263
 epoch: 37, train_loss: 1.1253, test_loss: 1.3526, test_f1: 0.4194
 epoch: 38, train_loss: 1.1120, test_loss: 1.1682, test_f1: 0.4178
 epoch: 39, train_loss: 1.1167, test_loss: 1.1015, test_f1: 0.4211
 epoch: 40, train_loss: 1.1084, test_loss: 1.0884, test_f1: 0.4190
 epoch: 41, train_loss: 1.1140, test_loss: 1.0621, test_f1: 0.4322
 epoch: 42, train_loss: 1.1028, test_loss: 1.0705, test_f1: 0.4381
 epoch: 43, train_loss: 1.1059, test_loss: 1.0520, test_f1: 0.4413
 epoch: 44, train_loss: 1.1066, test_loss: 1.0979, test_f1: 0.4300
 epoch: 45, train_loss: 1.1052, test_loss: 1.0812, test_f1: 0.4217
 epoch: 46, train_loss: 1.0905, test_loss: 1.0830, test_f1: 0.4224
 epoch: 47, train_loss: 1.0958, test_loss: 1.0695, test_f1: 0.4278
 epoch: 48, train_loss: 1.0867, test_loss: 1.2027, test_f1: 0.4178
 epoch: 49, train_loss: 1.0834, test_loss: 1.1081, test_f1: 0.4170
 epoch: 50, train_loss: 1.0837, test_loss: 1.0473, test_f1: 0.4372
 epoch: 51, train_loss: 1.0758, test_loss: 1.0339, test_f1: 0.4437
 epoch: 52, train_loss: 1.0907, test_loss: 1.0411, test_f1: 0.4413
 epoch: 53, train_loss: 1.0700, test_loss: 1.0366, test_f1: 0.4472
 epoch: 54, train_loss: 1.0786, test_loss: 1.0544, test_f1: 0.4304
 epoch: 55, train_loss: 1.0768, test_loss: 1.0390, test_f1: 0.4353
 epoch: 56, train_loss: 1.0791, test_loss: 1.0465, test_f1: 0.4352
 epoch: 57, train_loss: 1.0772, test_loss: 1.0407, test_f1: 0.4334
 epoch: 58, train_loss: 1.0713, test_loss: 1.0353, test_f1: 0.4353
 epoch: 59, train_loss: 1.0720, test_loss: 1.0302, test_f1: 0.4326
 epoch: 60, train_loss: 1.0689, test_loss: 1.0405, test_f1: 0.4325
 epoch: 61, train_loss: 1.0767, test_loss: 1.0640, test_f1: 0.4463
 epoch: 62, train_loss: 1.0654, test_loss: 1.0244, test_f1: 0.4420
 epoch: 63, train_loss: 1.0677, test_loss: 1.0221, test_f1: 0.4420
 epoch: 64, train_loss: 1.0712, test_loss: 1.0464, test_f1: 0.4134
 epoch: 65, train_loss: 1.0665, test_loss: 1.0300, test_f1: 0.4259
 epoch: 66, train_loss: 1.0602, test_loss: 1.0120, test_f1: 0.4674
 epoch: 67, train_loss: 1.0602, test_loss: 1.0269, test_f1: 0.4342
 epoch: 68, train_loss: 1.0590, test_loss: 1.0372, test_f1: 0.4460
 epoch: 69, train_loss: 1.0532, test_loss: 1.0314, test_f1: 0.4328
 epoch: 70, train_loss: 1.0582, test_loss: 1.0321, test_f1: 0.4543
 epoch: 71, train_loss: 1.0567, test_loss: 1.0878, test_f1: 0.4192
 epoch: 72, train_loss: 1.0544, test_loss: 1.0215, test_f1: 0.4395
 epoch: 73, train_loss: 1.0524, test_loss: 1.0289, test_f1: 0.4356
 epoch: 74, train_loss: 1.0481, test_loss: 1.0954, test_f1: 0.4162
 epoch: 75, train_loss: 1.0536, test_loss: 1.0489, test_f1: 0.4253
 epoch: 76, train_loss: 1.0519, test_loss: 1.0299, test_f1: 0.4282
 epoch: 77, train_loss: 1.0411, test_loss: 1.0288, test_f1: 0.4366
 epoch: 78, train_loss: 1.0539, test_loss: 1.0314, test_f1: 0.4333
 epoch: 79, train_loss: 1.0602, test_loss: 1.0341, test_f1: 0.4337
 epoch: 80, train_loss: 1.0514, test_loss: 1.0222, test_f1: 0.4458
 epoch: 81, train_loss: 1.0468, test_loss: 1.0376, test_f1: 0.4293
 epoch: 82, train_loss: 1.0416, test_loss: 1.0299, test_f1: 0.4193
 epoch: 83, train_loss: 1.0410, test_loss: 1.0231, test_f1: 0.4464
 epoch: 84, train_loss: 1.0404, test_loss: 1.0199, test_f1: 0.4448
 epoch: 85, train_loss: 1.0526, test_loss: 1.0467, test_f1: 0.4212
 epoch: 86, train_loss: 1.0330, test_loss: 1.0378, test_f1: 0.4178
 epoch: 87, train_loss: 1.0445, test_loss: 1.1007, test_f1: 0.4143
 epoch: 88, train_loss: 1.0374, test_loss: 1.0291, test_f1: 0.4330
 epoch: 89, train_loss: 1.0316, test_loss: 1.0134, test_f1: 0.4416
 epoch: 90, train_loss: 1.0329, test_loss: 1.0109, test_f1: 0.4364
 epoch: 91, train_loss: 1.0346, test_loss: 1.0079, test_f1: 0.4408
 epoch: 92, train_loss: 1.0378, test_loss: 1.0271, test_f1: 0.4235
 epoch: 93, train_loss: 1.0362, test_loss: 1.0333, test_f1: 0.4275
 epoch: 94, train_loss: 1.0393, test_loss: 1.0194, test_f1: 0.4252
 epoch: 95, train_loss: 1.0332, test_loss: 1.0101, test_f1: 0.4468
 epoch: 96, train_loss: 1.0300, test_loss: 1.0142, test_f1: 0.4412
 epoch: 97, train_loss: 1.0298, test_loss: 1.0165, test_f1: 0.4462
 epoch: 98, train_loss: 1.0289, test_loss: 1.0007, test_f1: 0.4543
 epoch: 99, train_loss: 1.0251, test_loss: 0.9981, test_f1: 0.4489
##################ITERATION #6 ****************************************
 epoch: 0, train_loss: 1.2888, test_loss: 1.2768, test_f1: 0.2450
 epoch: 1, train_loss: 1.2629, test_loss: 1.2593, test_f1: 0.2741
 epoch: 2, train_loss: 1.2567, test_loss: 1.2535, test_f1: 0.3089
 epoch: 3, train_loss: 1.2506, test_loss: 1.2315, test_f1: 0.3022
 epoch: 4, train_loss: 1.2424, test_loss: 1.2236, test_f1: 0.3033
 epoch: 5, train_loss: 1.2331, test_loss: 1.2119, test_f1: 0.3523
 epoch: 6, train_loss: 1.2195, test_loss: 1.2046, test_f1: 0.3590
 epoch: 7, train_loss: 1.2177, test_loss: 1.1994, test_f1: 0.4102
 epoch: 8, train_loss: 1.2087, test_loss: 1.1936, test_f1: 0.3846
 epoch: 9, train_loss: 1.2065, test_loss: 1.1805, test_f1: 0.4054
 epoch: 10, train_loss: 1.2038, test_loss: 1.1820, test_f1: 0.3970
 epoch: 11, train_loss: 1.2002, test_loss: 1.1689, test_f1: 0.4028
 epoch: 12, train_loss: 1.1939, test_loss: 1.1558, test_f1: 0.4072
 epoch: 13, train_loss: 1.1879, test_loss: 1.1523, test_f1: 0.4111
 epoch: 14, train_loss: 1.1802, test_loss: 1.1492, test_f1: 0.4155
 epoch: 15, train_loss: 1.1848, test_loss: 1.1506, test_f1: 0.4272
 epoch: 16, train_loss: 1.1731, test_loss: 1.1328, test_f1: 0.4207
 epoch: 17, train_loss: 1.1658, test_loss: 1.1269, test_f1: 0.4592
 epoch: 18, train_loss: 1.1618, test_loss: 1.1194, test_f1: 0.4479
 epoch: 19, train_loss: 1.1583, test_loss: 1.1214, test_f1: 0.4287
 epoch: 20, train_loss: 1.1547, test_loss: 1.1147, test_f1: 0.4462
 epoch: 21, train_loss: 1.1447, test_loss: 1.1092, test_f1: 0.4508
 epoch: 22, train_loss: 1.1360, test_loss: 1.0959, test_f1: 0.4312
 epoch: 23, train_loss: 1.1344, test_loss: 1.0892, test_f1: 0.4380
 epoch: 24, train_loss: 1.1304, test_loss: 1.0939, test_f1: 0.4465
 epoch: 25, train_loss: 1.1336, test_loss: 1.0886, test_f1: 0.4395
 epoch: 26, train_loss: 1.1224, test_loss: 1.0872, test_f1: 0.4321
 epoch: 27, train_loss: 1.1206, test_loss: 1.0750, test_f1: 0.4309
 epoch: 28, train_loss: 1.1180, test_loss: 1.0755, test_f1: 0.4381
 epoch: 29, train_loss: 1.1095, test_loss: 1.0718, test_f1: 0.4440
 epoch: 30, train_loss: 1.1019, test_loss: 1.0676, test_f1: 0.4355
 epoch: 31, train_loss: 1.1054, test_loss: 1.0656, test_f1: 0.4386
 epoch: 32, train_loss: 1.1055, test_loss: 1.0561, test_f1: 0.4436
 epoch: 33, train_loss: 1.0984, test_loss: 1.0571, test_f1: 0.4417
 epoch: 34, train_loss: 1.0936, test_loss: 1.0596, test_f1: 0.4412
 epoch: 35, train_loss: 1.0837, test_loss: 1.0490, test_f1: 0.4492
 epoch: 36, train_loss: 1.0811, test_loss: 1.0474, test_f1: 0.4503
 epoch: 37, train_loss: 1.0766, test_loss: 1.0602, test_f1: 0.4474
 epoch: 38, train_loss: 1.0740, test_loss: 1.0512, test_f1: 0.4311
 epoch: 39, train_loss: 1.0622, test_loss: 1.0463, test_f1: 0.4376
 epoch: 40, train_loss: 1.0687, test_loss: 1.0482, test_f1: 0.4504
 epoch: 41, train_loss: 1.0663, test_loss: 1.0312, test_f1: 0.4468
 epoch: 42, train_loss: 1.0625, test_loss: 1.0326, test_f1: 0.4546
 epoch: 43, train_loss: 1.0477, test_loss: 1.0415, test_f1: 0.4714
 epoch: 44, train_loss: 1.0527, test_loss: 1.0262, test_f1: 0.4625
 epoch: 45, train_loss: 1.0546, test_loss: 1.0332, test_f1: 0.4481
 epoch: 46, train_loss: 1.0485, test_loss: 1.0195, test_f1: 0.4741
 epoch: 47, train_loss: 1.0464, test_loss: 1.0274, test_f1: 0.4595
 epoch: 48, train_loss: 1.0381, test_loss: 1.0226, test_f1: 0.4470
 epoch: 49, train_loss: 1.0415, test_loss: 1.0209, test_f1: 0.4478
 epoch: 50, train_loss: 1.0307, test_loss: 1.0125, test_f1: 0.4598
 epoch: 51, train_loss: 1.0350, test_loss: 1.0071, test_f1: 0.4511
 epoch: 52, train_loss: 1.0285, test_loss: 1.0290, test_f1: 0.4528
 epoch: 53, train_loss: 1.0374, test_loss: 1.0114, test_f1: 0.4644
 epoch: 54, train_loss: 1.0223, test_loss: 1.0294, test_f1: 0.4783
 epoch: 55, train_loss: 1.0302, test_loss: 1.0242, test_f1: 0.4490
 epoch: 56, train_loss: 1.0312, test_loss: 1.0283, test_f1: 0.4535
 epoch: 57, train_loss: 1.0195, test_loss: 1.0184, test_f1: 0.4591
 epoch: 58, train_loss: 1.0253, test_loss: 1.0128, test_f1: 0.4601
 epoch: 59, train_loss: 1.0124, test_loss: 1.0113, test_f1: 0.4571
 epoch: 60, train_loss: 1.0158, test_loss: 1.0095, test_f1: 0.4603
 epoch: 61, train_loss: 1.0165, test_loss: 1.0091, test_f1: 0.4610
 epoch: 62, train_loss: 1.0217, test_loss: 1.0033, test_f1: 0.4495
 epoch: 63, train_loss: 1.0204, test_loss: 1.0023, test_f1: 0.4702
 epoch: 64, train_loss: 1.0120, test_loss: 1.0510, test_f1: 0.4340
 epoch: 65, train_loss: 1.0179, test_loss: 1.0194, test_f1: 0.4517
 epoch: 66, train_loss: 1.0159, test_loss: 1.0031, test_f1: 0.4589
 epoch: 67, train_loss: 1.0059, test_loss: 1.0015, test_f1: 0.4843
 epoch: 68, train_loss: 1.0066, test_loss: 1.0007, test_f1: 0.4657
 epoch: 69, train_loss: 1.0093, test_loss: 1.0033, test_f1: 0.4689
 epoch: 70, train_loss: 1.0017, test_loss: 0.9975, test_f1: 0.4664
 epoch: 71, train_loss: 1.0001, test_loss: 1.0109, test_f1: 0.4812
 epoch: 72, train_loss: 1.0025, test_loss: 1.0066, test_f1: 0.4784
 epoch: 73, train_loss: 1.0064, test_loss: 1.0039, test_f1: 0.4586
 epoch: 74, train_loss: 1.0008, test_loss: 1.0071, test_f1: 0.4781
 epoch: 75, train_loss: 0.9903, test_loss: 1.0222, test_f1: 0.4721
 epoch: 76, train_loss: 0.9946, test_loss: 1.0103, test_f1: 0.4720
 epoch: 77, train_loss: 0.9941, test_loss: 1.0023, test_f1: 0.4781
 epoch: 78, train_loss: 1.0065, test_loss: 1.0221, test_f1: 0.4591
 epoch: 79, train_loss: 0.9996, test_loss: 1.0148, test_f1: 0.4600
 epoch: 80, train_loss: 1.0006, test_loss: 1.0083, test_f1: 0.4632
 epoch: 81, train_loss: 1.0031, test_loss: 1.0053, test_f1: 0.4652
 epoch: 82, train_loss: 0.9917, test_loss: 1.0060, test_f1: 0.4607
 epoch: 83, train_loss: 0.9969, test_loss: 1.0102, test_f1: 0.4672
 epoch: 84, train_loss: 1.0003, test_loss: 1.0025, test_f1: 0.4897
 epoch: 85, train_loss: 1.0009, test_loss: 0.9929, test_f1: 0.4765
 epoch: 86, train_loss: 0.9892, test_loss: 1.0004, test_f1: 0.4779
 epoch: 87, train_loss: 0.9895, test_loss: 0.9943, test_f1: 0.4823
 epoch: 88, train_loss: 0.9894, test_loss: 1.0092, test_f1: 0.4687
 epoch: 89, train_loss: 0.9887, test_loss: 1.0103, test_f1: 0.4763
 epoch: 90, train_loss: 0.9943, test_loss: 1.0106, test_f1: 0.4690
 epoch: 91, train_loss: 0.9869, test_loss: 1.0099, test_f1: 0.4792
 epoch: 92, train_loss: 0.9807, test_loss: 1.0107, test_f1: 0.4632
 epoch: 93, train_loss: 0.9812, test_loss: 0.9989, test_f1: 0.4710
 epoch: 94, train_loss: 0.9816, test_loss: 1.0033, test_f1: 0.4738
 epoch: 95, train_loss: 0.9768, test_loss: 1.0015, test_f1: 0.4609
 epoch: 96, train_loss: 0.9760, test_loss: 1.0085, test_f1: 0.4687
 epoch: 97, train_loss: 0.9725, test_loss: 1.0093, test_f1: 0.4670
 epoch: 98, train_loss: 0.9865, test_loss: 1.0096, test_f1: 0.4769
 epoch: 99, train_loss: 0.9715, test_loss: 1.0013, test_f1: 0.4778
##################ITERATION #7 ****************************************
 epoch: 0, train_loss: 1.3132, test_loss: 1.3070, test_f1: 0.2370
 epoch: 1, train_loss: 1.2866, test_loss: 1.2873, test_f1: 0.2420
 epoch: 2, train_loss: 1.2688, test_loss: 1.2658, test_f1: 0.2346
 epoch: 3, train_loss: 1.2528, test_loss: 1.2542, test_f1: 0.2511
 epoch: 4, train_loss: 1.2488, test_loss: 1.2426, test_f1: 0.2613
 epoch: 5, train_loss: 1.2425, test_loss: 1.2197, test_f1: 0.3046
 epoch: 6, train_loss: 1.2371, test_loss: 1.2151, test_f1: 0.3075
 epoch: 7, train_loss: 1.2324, test_loss: 1.2093, test_f1: 0.3043
 epoch: 8, train_loss: 1.2192, test_loss: 1.2017, test_f1: 0.3227
 epoch: 9, train_loss: 1.2188, test_loss: 1.1922, test_f1: 0.3194
 epoch: 10, train_loss: 1.2104, test_loss: 1.1810, test_f1: 0.3620
 epoch: 11, train_loss: 1.2108, test_loss: 1.1784, test_f1: 0.3470
 epoch: 12, train_loss: 1.2136, test_loss: 1.1680, test_f1: 0.3666
 epoch: 13, train_loss: 1.2010, test_loss: 1.1577, test_f1: 0.4008
 epoch: 14, train_loss: 1.1922, test_loss: 1.1538, test_f1: 0.3704
 epoch: 15, train_loss: 1.1835, test_loss: 1.1486, test_f1: 0.3861
 epoch: 16, train_loss: 1.1853, test_loss: 1.1456, test_f1: 0.4112
 epoch: 17, train_loss: 1.1797, test_loss: 1.1335, test_f1: 0.4038
 epoch: 18, train_loss: 1.1787, test_loss: 1.1296, test_f1: 0.4057
 epoch: 19, train_loss: 1.1746, test_loss: 1.1284, test_f1: 0.4120
 epoch: 20, train_loss: 1.1686, test_loss: 1.1233, test_f1: 0.4024
 epoch: 21, train_loss: 1.1699, test_loss: 1.1192, test_f1: 0.4151
 epoch: 22, train_loss: 1.1651, test_loss: 1.1146, test_f1: 0.4159
 epoch: 23, train_loss: 1.1694, test_loss: 1.1155, test_f1: 0.4222
 epoch: 24, train_loss: 1.1550, test_loss: 1.1081, test_f1: 0.4118
 epoch: 25, train_loss: 1.1526, test_loss: 1.0993, test_f1: 0.4273
 epoch: 26, train_loss: 1.1478, test_loss: 1.1050, test_f1: 0.4026
 epoch: 27, train_loss: 1.1431, test_loss: 1.0908, test_f1: 0.4299
 epoch: 28, train_loss: 1.1441, test_loss: 1.0778, test_f1: 0.4331
 epoch: 29, train_loss: 1.1461, test_loss: 1.0862, test_f1: 0.4374
 epoch: 30, train_loss: 1.1491, test_loss: 1.0806, test_f1: 0.4268
 epoch: 31, train_loss: 1.1390, test_loss: 1.0719, test_f1: 0.4356
 epoch: 32, train_loss: 1.1345, test_loss: 1.0762, test_f1: 0.4513
 epoch: 33, train_loss: 1.1368, test_loss: 1.0677, test_f1: 0.4250
 epoch: 34, train_loss: 1.1297, test_loss: 1.0639, test_f1: 0.4333
 epoch: 35, train_loss: 1.1250, test_loss: 1.0610, test_f1: 0.4308
 epoch: 36, train_loss: 1.1213, test_loss: 1.0579, test_f1: 0.4360
 epoch: 37, train_loss: 1.1268, test_loss: 1.0598, test_f1: 0.4728
 epoch: 38, train_loss: 1.1228, test_loss: 1.0563, test_f1: 0.4303
 epoch: 39, train_loss: 1.1211, test_loss: 1.0547, test_f1: 0.4383
 epoch: 40, train_loss: 1.1111, test_loss: 1.0615, test_f1: 0.4451
 epoch: 41, train_loss: 1.1185, test_loss: 1.0506, test_f1: 0.4420
 epoch: 42, train_loss: 1.0989, test_loss: 1.0496, test_f1: 0.4706
 epoch: 43, train_loss: 1.1190, test_loss: 1.0489, test_f1: 0.4567
 epoch: 44, train_loss: 1.0971, test_loss: 1.0361, test_f1: 0.4694
 epoch: 45, train_loss: 1.1049, test_loss: 1.0381, test_f1: 0.4492
 epoch: 46, train_loss: 1.1023, test_loss: 1.0430, test_f1: 0.4771
 epoch: 47, train_loss: 1.0974, test_loss: 1.0302, test_f1: 0.4457
 epoch: 48, train_loss: 1.0941, test_loss: 1.0374, test_f1: 0.4690
 epoch: 49, train_loss: 1.0833, test_loss: 1.0297, test_f1: 0.4610
 epoch: 50, train_loss: 1.0960, test_loss: 1.0183, test_f1: 0.4615
 epoch: 51, train_loss: 1.0694, test_loss: 1.0227, test_f1: 0.4666
 epoch: 52, train_loss: 1.0833, test_loss: 1.0282, test_f1: 0.4673
 epoch: 53, train_loss: 1.0791, test_loss: 1.0249, test_f1: 0.4668
 epoch: 54, train_loss: 1.0865, test_loss: 1.0176, test_f1: 0.4564
 epoch: 55, train_loss: 1.0874, test_loss: 1.0131, test_f1: 0.4782
 epoch: 56, train_loss: 1.0842, test_loss: 1.0208, test_f1: 0.4747
 epoch: 57, train_loss: 1.0797, test_loss: 1.0160, test_f1: 0.4749
 epoch: 58, train_loss: 1.0755, test_loss: 1.0135, test_f1: 0.4941
 epoch: 59, train_loss: 1.0802, test_loss: 1.0110, test_f1: 0.4823
 epoch: 60, train_loss: 1.0743, test_loss: 1.0103, test_f1: 0.4670
 epoch: 61, train_loss: 1.0739, test_loss: 1.0002, test_f1: 0.4755
 epoch: 62, train_loss: 1.0789, test_loss: 1.0080, test_f1: 0.5071
 epoch: 63, train_loss: 1.0805, test_loss: 1.0215, test_f1: 0.4730
 epoch: 64, train_loss: 1.0734, test_loss: 1.0075, test_f1: 0.4809
 epoch: 65, train_loss: 1.0695, test_loss: 0.9994, test_f1: 0.4663
 epoch: 66, train_loss: 1.0759, test_loss: 1.0081, test_f1: 0.4915
 epoch: 67, train_loss: 1.0694, test_loss: 1.0067, test_f1: 0.4808
 epoch: 68, train_loss: 1.0790, test_loss: 1.0179, test_f1: 0.4800
 epoch: 69, train_loss: 1.0581, test_loss: 1.0035, test_f1: 0.4835
 epoch: 70, train_loss: 1.0688, test_loss: 0.9954, test_f1: 0.4640
 epoch: 71, train_loss: 1.0611, test_loss: 1.0171, test_f1: 0.4892
 epoch: 72, train_loss: 1.0739, test_loss: 0.9983, test_f1: 0.4904
 epoch: 73, train_loss: 1.0663, test_loss: 1.0049, test_f1: 0.4803
 epoch: 74, train_loss: 1.0676, test_loss: 1.0047, test_f1: 0.4670
 epoch: 75, train_loss: 1.0686, test_loss: 0.9966, test_f1: 0.4846
 epoch: 76, train_loss: 1.0610, test_loss: 1.0020, test_f1: 0.4812
 epoch: 77, train_loss: 1.0602, test_loss: 0.9929, test_f1: 0.4565
 epoch: 78, train_loss: 1.0609, test_loss: 0.9960, test_f1: 0.4841
 epoch: 79, train_loss: 1.0567, test_loss: 0.9995, test_f1: 0.4827
 epoch: 80, train_loss: 1.0525, test_loss: 1.0143, test_f1: 0.4769
 epoch: 81, train_loss: 1.0592, test_loss: 1.0007, test_f1: 0.4743
 epoch: 82, train_loss: 1.0607, test_loss: 1.0119, test_f1: 0.4599
 epoch: 83, train_loss: 1.0644, test_loss: 0.9899, test_f1: 0.4840
 epoch: 84, train_loss: 1.0541, test_loss: 1.0032, test_f1: 0.4796
 epoch: 85, train_loss: 1.0484, test_loss: 0.9999, test_f1: 0.4848
 epoch: 86, train_loss: 1.0576, test_loss: 1.0078, test_f1: 0.4889
 epoch: 87, train_loss: 1.0498, test_loss: 0.9986, test_f1: 0.4820
 epoch: 88, train_loss: 1.0492, test_loss: 0.9850, test_f1: 0.4709
 epoch: 89, train_loss: 1.0522, test_loss: 0.9912, test_f1: 0.4981
 epoch: 90, train_loss: 1.0484, test_loss: 0.9767, test_f1: 0.4839
 epoch: 91, train_loss: 1.0397, test_loss: 0.9791, test_f1: 0.4821
 epoch: 92, train_loss: 1.0423, test_loss: 0.9852, test_f1: 0.4915
 epoch: 93, train_loss: 1.0493, test_loss: 0.9831, test_f1: 0.4800
 epoch: 94, train_loss: 1.0446, test_loss: 0.9927, test_f1: 0.4745
 epoch: 95, train_loss: 1.0442, test_loss: 1.0019, test_f1: 0.4798
 epoch: 96, train_loss: 1.0413, test_loss: 1.0136, test_f1: 0.4740
 epoch: 97, train_loss: 1.0387, test_loss: 0.9937, test_f1: 0.4584
 epoch: 98, train_loss: 1.0418, test_loss: 0.9825, test_f1: 0.4738
 epoch: 99, train_loss: 1.0433, test_loss: 0.9791, test_f1: 0.4814
##################ITERATION #8 ****************************************
 epoch: 0, train_loss: 1.3367, test_loss: 1.2863, test_f1: 0.2351
 epoch: 1, train_loss: 1.2688, test_loss: 1.3305, test_f1: 0.2579
 epoch: 2, train_loss: 1.2478, test_loss: 1.3304, test_f1: 0.2902
 epoch: 3, train_loss: 1.2372, test_loss: 1.2285, test_f1: 0.3347
 epoch: 4, train_loss: 1.2280, test_loss: 1.2465, test_f1: 0.3168
 epoch: 5, train_loss: 1.2164, test_loss: 1.2162, test_f1: 0.3511
 epoch: 6, train_loss: 1.2118, test_loss: 1.2197, test_f1: 0.3737
 epoch: 7, train_loss: 1.2018, test_loss: 1.2026, test_f1: 0.3674
 epoch: 8, train_loss: 1.1975, test_loss: 1.2052, test_f1: 0.3775
 epoch: 9, train_loss: 1.1914, test_loss: 1.1728, test_f1: 0.3809
 epoch: 10, train_loss: 1.1796, test_loss: 1.1469, test_f1: 0.4082
 epoch: 11, train_loss: 1.1768, test_loss: 1.1589, test_f1: 0.4104
 epoch: 12, train_loss: 1.1734, test_loss: 1.1380, test_f1: 0.4172
 epoch: 13, train_loss: 1.1633, test_loss: 1.1914, test_f1: 0.4094
 epoch: 14, train_loss: 1.1614, test_loss: 1.1271, test_f1: 0.4434
 epoch: 15, train_loss: 1.1534, test_loss: 1.1458, test_f1: 0.4396
 epoch: 16, train_loss: 1.1522, test_loss: 1.1097, test_f1: 0.4486
 epoch: 17, train_loss: 1.1534, test_loss: 1.1028, test_f1: 0.4443
 epoch: 18, train_loss: 1.1391, test_loss: 1.0827, test_f1: 0.4303
 epoch: 19, train_loss: 1.1299, test_loss: 1.0733, test_f1: 0.4606
 epoch: 20, train_loss: 1.1307, test_loss: 1.0852, test_f1: 0.4562
 epoch: 21, train_loss: 1.1240, test_loss: 1.0734, test_f1: 0.4558
 epoch: 22, train_loss: 1.1298, test_loss: 1.0604, test_f1: 0.4652
 epoch: 23, train_loss: 1.1190, test_loss: 1.0631, test_f1: 0.4688
 epoch: 24, train_loss: 1.1111, test_loss: 1.0836, test_f1: 0.4585
 epoch: 25, train_loss: 1.1061, test_loss: 1.0695, test_f1: 0.4655
 epoch: 26, train_loss: 1.0928, test_loss: 1.0596, test_f1: 0.4627
 epoch: 27, train_loss: 1.1037, test_loss: 1.0477, test_f1: 0.4679
 epoch: 28, train_loss: 1.0971, test_loss: 1.0537, test_f1: 0.4591
 epoch: 29, train_loss: 1.0860, test_loss: 1.0534, test_f1: 0.4560
 epoch: 30, train_loss: 1.0904, test_loss: 1.0348, test_f1: 0.4703
 epoch: 31, train_loss: 1.0853, test_loss: 1.0282, test_f1: 0.4708
 epoch: 32, train_loss: 1.0753, test_loss: 1.0250, test_f1: 0.4723
 epoch: 33, train_loss: 1.0745, test_loss: 1.0038, test_f1: 0.4806
 epoch: 34, train_loss: 1.0733, test_loss: 1.0209, test_f1: 0.4922
 epoch: 35, train_loss: 1.0684, test_loss: 1.0147, test_f1: 0.4682
 epoch: 36, train_loss: 1.0716, test_loss: 1.0208, test_f1: 0.4732
 epoch: 37, train_loss: 1.0524, test_loss: 1.0158, test_f1: 0.4743
 epoch: 38, train_loss: 1.0517, test_loss: 1.0105, test_f1: 0.4631
 epoch: 39, train_loss: 1.0483, test_loss: 0.9946, test_f1: 0.4769
 epoch: 40, train_loss: 1.0514, test_loss: 0.9984, test_f1: 0.4752
 epoch: 41, train_loss: 1.0441, test_loss: 0.9959, test_f1: 0.4751
 epoch: 42, train_loss: 1.0409, test_loss: 1.0056, test_f1: 0.4608
 epoch: 43, train_loss: 1.0431, test_loss: 0.9972, test_f1: 0.4692
 epoch: 44, train_loss: 1.0424, test_loss: 0.9925, test_f1: 0.4718
 epoch: 45, train_loss: 1.0400, test_loss: 0.9826, test_f1: 0.4755
 epoch: 46, train_loss: 1.0307, test_loss: 0.9936, test_f1: 0.4544
 epoch: 47, train_loss: 1.0299, test_loss: 1.0076, test_f1: 0.4662
 epoch: 48, train_loss: 1.0225, test_loss: 0.9824, test_f1: 0.4678
 epoch: 49, train_loss: 1.0299, test_loss: 0.9806, test_f1: 0.4735
 epoch: 50, train_loss: 1.0147, test_loss: 0.9779, test_f1: 0.4647
 epoch: 51, train_loss: 1.0232, test_loss: 0.9758, test_f1: 0.4459
 epoch: 52, train_loss: 1.0192, test_loss: 0.9681, test_f1: 0.4507
 epoch: 53, train_loss: 1.0141, test_loss: 0.9988, test_f1: 0.4572
 epoch: 54, train_loss: 1.0183, test_loss: 0.9739, test_f1: 0.4608
 epoch: 55, train_loss: 1.0181, test_loss: 0.9756, test_f1: 0.4663
 epoch: 56, train_loss: 1.0075, test_loss: 0.9556, test_f1: 0.4734
 epoch: 57, train_loss: 1.0240, test_loss: 0.9652, test_f1: 0.4666
 epoch: 58, train_loss: 1.0049, test_loss: 0.9774, test_f1: 0.4441
 epoch: 59, train_loss: 1.0083, test_loss: 0.9586, test_f1: 0.4660
 epoch: 60, train_loss: 1.0198, test_loss: 0.9591, test_f1: 0.4784
 epoch: 61, train_loss: 1.0096, test_loss: 0.9666, test_f1: 0.4639
 epoch: 62, train_loss: 0.9957, test_loss: 0.9647, test_f1: 0.4750
 epoch: 63, train_loss: 0.9984, test_loss: 0.9605, test_f1: 0.4750
 epoch: 64, train_loss: 1.0054, test_loss: 0.9755, test_f1: 0.4859
 epoch: 65, train_loss: 1.0027, test_loss: 0.9564, test_f1: 0.4793
 epoch: 66, train_loss: 0.9943, test_loss: 0.9753, test_f1: 0.4728
 epoch: 67, train_loss: 0.9952, test_loss: 0.9645, test_f1: 0.4796
 epoch: 68, train_loss: 1.0001, test_loss: 0.9645, test_f1: 0.4817
 epoch: 69, train_loss: 0.9980, test_loss: 0.9480, test_f1: 0.4808
 epoch: 70, train_loss: 1.0001, test_loss: 0.9608, test_f1: 0.4752
 epoch: 71, train_loss: 0.9890, test_loss: 0.9481, test_f1: 0.4835
 epoch: 72, train_loss: 1.0022, test_loss: 0.9539, test_f1: 0.4813
 epoch: 73, train_loss: 0.9962, test_loss: 0.9596, test_f1: 0.4742
 epoch: 74, train_loss: 0.9947, test_loss: 0.9579, test_f1: 0.4876
 epoch: 75, train_loss: 0.9905, test_loss: 0.9712, test_f1: 0.4781
 epoch: 76, train_loss: 0.9808, test_loss: 0.9628, test_f1: 0.4725
 epoch: 77, train_loss: 0.9962, test_loss: 0.9686, test_f1: 0.4908
 epoch: 78, train_loss: 0.9884, test_loss: 0.9593, test_f1: 0.4890
 epoch: 79, train_loss: 0.9995, test_loss: 0.9677, test_f1: 0.4852
 epoch: 80, train_loss: 0.9953, test_loss: 0.9636, test_f1: 0.4607
 epoch: 81, train_loss: 0.9789, test_loss: 0.9510, test_f1: 0.4993
 epoch: 82, train_loss: 0.9782, test_loss: 0.9524, test_f1: 0.4788
 epoch: 83, train_loss: 0.9881, test_loss: 0.9652, test_f1: 0.4860
 epoch: 84, train_loss: 0.9912, test_loss: 0.9415, test_f1: 0.5060
 epoch: 85, train_loss: 0.9868, test_loss: 0.9472, test_f1: 0.4750
 epoch: 86, train_loss: 0.9824, test_loss: 0.9691, test_f1: 0.4926
 epoch: 87, train_loss: 0.9840, test_loss: 0.9469, test_f1: 0.4932
 epoch: 88, train_loss: 0.9848, test_loss: 0.9551, test_f1: 0.4875
 epoch: 89, train_loss: 0.9751, test_loss: 0.9591, test_f1: 0.4662
 epoch: 90, train_loss: 0.9704, test_loss: 0.9559, test_f1: 0.4936
 epoch: 91, train_loss: 0.9839, test_loss: 0.9365, test_f1: 0.4820
 epoch: 92, train_loss: 0.9638, test_loss: 0.9428, test_f1: 0.4802
 epoch: 93, train_loss: 0.9756, test_loss: 0.9469, test_f1: 0.4721
 epoch: 94, train_loss: 0.9734, test_loss: 0.9397, test_f1: 0.4835
 epoch: 95, train_loss: 0.9775, test_loss: 0.9456, test_f1: 0.4751
 epoch: 96, train_loss: 0.9690, test_loss: 0.9501, test_f1: 0.4745
 epoch: 97, train_loss: 0.9789, test_loss: 0.9395, test_f1: 0.4950
 epoch: 98, train_loss: 0.9683, test_loss: 0.9537, test_f1: 0.4940
 epoch: 99, train_loss: 0.9676, test_loss: 0.9466, test_f1: 0.4597
##################ITERATION #9 ****************************************
 epoch: 0, train_loss: 1.2963, test_loss: 1.2713, test_f1: 0.2503
 epoch: 1, train_loss: 1.2672, test_loss: 1.2575, test_f1: 0.2969
 epoch: 2, train_loss: 1.2564, test_loss: 1.2793, test_f1: 0.2771
 epoch: 3, train_loss: 1.2324, test_loss: 1.2314, test_f1: 0.3409
 epoch: 4, train_loss: 1.2302, test_loss: 1.2196, test_f1: 0.3675
 epoch: 5, train_loss: 1.2200, test_loss: 1.1902, test_f1: 0.3946
 epoch: 6, train_loss: 1.2129, test_loss: 1.1734, test_f1: 0.4046
 epoch: 7, train_loss: 1.2035, test_loss: 1.1698, test_f1: 0.4092
 epoch: 8, train_loss: 1.1967, test_loss: 1.1777, test_f1: 0.4091
 epoch: 9, train_loss: 1.1853, test_loss: 1.1674, test_f1: 0.4236
 epoch: 10, train_loss: 1.1820, test_loss: 1.1524, test_f1: 0.4278
 epoch: 11, train_loss: 1.1770, test_loss: 1.1495, test_f1: 0.4311
 epoch: 12, train_loss: 1.1740, test_loss: 1.1364, test_f1: 0.4294
 epoch: 13, train_loss: 1.1785, test_loss: 1.1285, test_f1: 0.4334
 epoch: 14, train_loss: 1.1661, test_loss: 1.1284, test_f1: 0.4408
 epoch: 15, train_loss: 1.1596, test_loss: 1.1239, test_f1: 0.4478
 epoch: 16, train_loss: 1.1576, test_loss: 1.1253, test_f1: 0.4448
 epoch: 17, train_loss: 1.1501, test_loss: 1.1143, test_f1: 0.4390
 epoch: 18, train_loss: 1.1437, test_loss: 1.1093, test_f1: 0.4506
 epoch: 19, train_loss: 1.1340, test_loss: 1.1122, test_f1: 0.4525
 epoch: 20, train_loss: 1.1290, test_loss: 1.0933, test_f1: 0.4502
 epoch: 21, train_loss: 1.1255, test_loss: 1.0847, test_f1: 0.4599
 epoch: 22, train_loss: 1.1248, test_loss: 1.0974, test_f1: 0.4511
 epoch: 23, train_loss: 1.1271, test_loss: 1.0983, test_f1: 0.4594
 epoch: 24, train_loss: 1.1184, test_loss: 1.0824, test_f1: 0.4478
 epoch: 25, train_loss: 1.1177, test_loss: 1.0710, test_f1: 0.4435
 epoch: 26, train_loss: 1.1059, test_loss: 1.1016, test_f1: 0.4431
 epoch: 27, train_loss: 1.1159, test_loss: 1.0694, test_f1: 0.4495
 epoch: 28, train_loss: 1.1049, test_loss: 1.0833, test_f1: 0.4436
 epoch: 29, train_loss: 1.1068, test_loss: 1.0955, test_f1: 0.4473
 epoch: 30, train_loss: 1.1024, test_loss: 1.0757, test_f1: 0.4409
 epoch: 31, train_loss: 1.0971, test_loss: 1.0655, test_f1: 0.4617
 epoch: 32, train_loss: 1.1041, test_loss: 1.0692, test_f1: 0.4464
 epoch: 33, train_loss: 1.0818, test_loss: 1.0524, test_f1: 0.4592
 epoch: 34, train_loss: 1.0907, test_loss: 1.0528, test_f1: 0.4558
 epoch: 35, train_loss: 1.0852, test_loss: 1.0565, test_f1: 0.4620
 epoch: 36, train_loss: 1.0781, test_loss: 1.0790, test_f1: 0.4527
 epoch: 37, train_loss: 1.0772, test_loss: 1.0584, test_f1: 0.4496
 epoch: 38, train_loss: 1.0773, test_loss: 1.0806, test_f1: 0.4585
 epoch: 39, train_loss: 1.0754, test_loss: 1.0552, test_f1: 0.4456
 epoch: 40, train_loss: 1.0716, test_loss: 1.0613, test_f1: 0.4494
 epoch: 41, train_loss: 1.0669, test_loss: 1.0493, test_f1: 0.4562
 epoch: 42, train_loss: 1.0772, test_loss: 1.0373, test_f1: 0.4442
 epoch: 43, train_loss: 1.0716, test_loss: 1.0527, test_f1: 0.4475
 epoch: 44, train_loss: 1.0583, test_loss: 1.0449, test_f1: 0.4585
 epoch: 45, train_loss: 1.0522, test_loss: 1.0440, test_f1: 0.4578
 epoch: 46, train_loss: 1.0540, test_loss: 1.0455, test_f1: 0.4603
 epoch: 47, train_loss: 1.0642, test_loss: 1.0500, test_f1: 0.4650
 epoch: 48, train_loss: 1.0514, test_loss: 1.0397, test_f1: 0.4663
 epoch: 49, train_loss: 1.0502, test_loss: 1.0154, test_f1: 0.4615
 epoch: 50, train_loss: 1.0411, test_loss: 1.0232, test_f1: 0.4735
 epoch: 51, train_loss: 1.0451, test_loss: 1.0225, test_f1: 0.4587
 epoch: 52, train_loss: 1.0525, test_loss: 1.0364, test_f1: 0.4588
 epoch: 53, train_loss: 1.0415, test_loss: 1.0345, test_f1: 0.4602
 epoch: 54, train_loss: 1.0462, test_loss: 1.0133, test_f1: 0.4719
 epoch: 55, train_loss: 1.0394, test_loss: 1.0117, test_f1: 0.4741
 epoch: 56, train_loss: 1.0389, test_loss: 1.0102, test_f1: 0.4711
 epoch: 57, train_loss: 1.0323, test_loss: 1.0108, test_f1: 0.4818
 epoch: 58, train_loss: 1.0468, test_loss: 1.0238, test_f1: 0.4827
 epoch: 59, train_loss: 1.0285, test_loss: 1.0129, test_f1: 0.4709
 epoch: 60, train_loss: 1.0397, test_loss: 1.0260, test_f1: 0.4629
 epoch: 61, train_loss: 1.0374, test_loss: 1.0358, test_f1: 0.4619
 epoch: 62, train_loss: 1.0437, test_loss: 1.0421, test_f1: 0.4762
 epoch: 63, train_loss: 1.0311, test_loss: 1.0123, test_f1: 0.4761
 epoch: 64, train_loss: 1.0410, test_loss: 1.0255, test_f1: 0.4696
 epoch: 65, train_loss: 1.0262, test_loss: 1.0231, test_f1: 0.4616
 epoch: 66, train_loss: 1.0325, test_loss: 1.0139, test_f1: 0.4728
 epoch: 67, train_loss: 1.0308, test_loss: 1.0122, test_f1: 0.4783
 epoch: 68, train_loss: 1.0268, test_loss: 1.0276, test_f1: 0.4803
 epoch: 69, train_loss: 1.0300, test_loss: 1.0125, test_f1: 0.4783
 epoch: 70, train_loss: 1.0317, test_loss: 1.0182, test_f1: 0.4615
 epoch: 71, train_loss: 1.0348, test_loss: 1.0089, test_f1: 0.4795
 epoch: 72, train_loss: 1.0297, test_loss: 1.0188, test_f1: 0.4795
 epoch: 73, train_loss: 1.0242, test_loss: 1.0391, test_f1: 0.4774
 epoch: 74, train_loss: 1.0280, test_loss: 1.0169, test_f1: 0.4848
 epoch: 75, train_loss: 1.0235, test_loss: 1.0094, test_f1: 0.4647
 epoch: 76, train_loss: 1.0196, test_loss: 1.0026, test_f1: 0.4743
 epoch: 77, train_loss: 1.0255, test_loss: 1.0245, test_f1: 0.4699
 epoch: 78, train_loss: 1.0218, test_loss: 1.0082, test_f1: 0.4805
 epoch: 79, train_loss: 1.0194, test_loss: 0.9926, test_f1: 0.4710
 epoch: 80, train_loss: 1.0198, test_loss: 1.0069, test_f1: 0.4782
 epoch: 81, train_loss: 1.0086, test_loss: 0.9995, test_f1: 0.4836
 epoch: 82, train_loss: 1.0229, test_loss: 1.0218, test_f1: 0.4730
 epoch: 83, train_loss: 1.0173, test_loss: 0.9909, test_f1: 0.4700
 epoch: 84, train_loss: 1.0061, test_loss: 0.9909, test_f1: 0.4697
 epoch: 85, train_loss: 1.0201, test_loss: 0.9972, test_f1: 0.4607
 epoch: 86, train_loss: 1.0162, test_loss: 1.0142, test_f1: 0.4770
 epoch: 87, train_loss: 1.0172, test_loss: 0.9882, test_f1: 0.4657
 epoch: 88, train_loss: 1.0098, test_loss: 0.9879, test_f1: 0.4914
 epoch: 89, train_loss: 1.0016, test_loss: 0.9895, test_f1: 0.4901
 epoch: 90, train_loss: 1.0027, test_loss: 0.9851, test_f1: 0.4793
 epoch: 91, train_loss: 1.0037, test_loss: 0.9794, test_f1: 0.4803
 epoch: 92, train_loss: 1.0101, test_loss: 1.0185, test_f1: 0.4695
 epoch: 93, train_loss: 1.0242, test_loss: 0.9777, test_f1: 0.4779
 epoch: 94, train_loss: 1.0097, test_loss: 0.9839, test_f1: 0.4860
 epoch: 95, train_loss: 1.0034, test_loss: 0.9850, test_f1: 0.4929
 epoch: 96, train_loss: 1.0123, test_loss: 0.9915, test_f1: 0.4887
 epoch: 97, train_loss: 0.9981, test_loss: 0.9853, test_f1: 0.4708
 epoch: 98, train_loss: 1.0022, test_loss: 0.9910, test_f1: 0.4916
 epoch: 99, train_loss: 1.0024, test_loss: 0.9943, test_f1: 0.4800

Training completed in 1056.65 seconds
Best F1: 0.5244 at epoch 83
Mean F1 across iterations: 0.4969  0.0188
========================FINAL RESULTS================================
FEGIN weighted F1: 0.5244  0.0188
python main.py --data ltspice_examples --representation component_component --model FEGIN --layers 4 --hiddens 32 --batch_size 32 --lr 0.0001 --emb_size 250 --epochs 100 --save_appendix component_component_L4_H32_BS32_LR0.0001_E250 --no_val
-----



STDERR:
  File "main.py", line 370, in <module>
    main()
  File "main.py", line 254, in main
    dataset = dataset_class(
  File "/home/philip/projects/llm_inference_code_repo/Circuit-Completion-Using-GNNs/component_classification_with_link_prediction_head/evaluation/FEGIN/kernel/circuit_datasets.py", line 15, in __init__
    self.data, self.slices = torch.load(self.processed_paths[0])
  File "/home/philip/.local/lib/python3.8/site-packages/torch/serialization.py", line 1040, in load
    warnings.warn(
  File "/usr/lib/python3.8/warnings.py", line 109, in _showwarnmsg
    sw(msg.message, msg.category, msg.filename, msg.lineno,
  File "main.py", line 47, in warn_with_traceback
    traceback.print_stack(file=log)
/home/philip/projects/llm_inference_code_repo/Circuit-Completion-Using-GNNs/component_classification_with_link_prediction_head/evaluation/FEGIN/kernel/circuit_datasets.py:15: FutureWarning: You are using `torch.load` with `weights_only=False` (the current default value), which uses the default pickle module implicitly. It is possible to construct malicious pickle data which will execute arbitrary code during unpickling (See https://github.com/pytorch/pytorch/blob/main/SECURITY.md#untrusted-models for more details). In a future release, the default value for `weights_only` will be flipped to `True`. This limits the functions that could be executed during unpickling. Arbitrary objects will no longer be allowed to be loaded via this mode unless they are explicitly allowlisted by the user via `torch.serialization.add_safe_globals`. We recommend you start setting `weights_only=True` for any use case where you don't have full control of the loaded file. Please open an issue on GitHub for any issues related to this experimental feature.
  self.data, self.slices = torch.load(self.processed_paths[0])
