STDOUT:
Results will be saved in /home/philip/projects/ltspice_examples_code_repo/Circuit-Completion-Using-GNNs/component_classification_with_link_prediction_head/evaluation/FEGIN/results/model_FEGIN_dataset_ltspice_demos
Command line input: python main.py --data ltspice_demos --representation component_pin_net --model FEGIN --layers 2 --hiddens 64 --batch_size 32 --lr 0.01 --emb_size 128 --epochs 100 --save_appendix component_pin_net_L2_H64_BS32_LR0.01_E128 --no_val
 is saved.
-----
ltspice_demos - FEGIN
Using 2 layers, 64 hidden units, h = 2
Loading component_pin_net representation dataset
ENTERED
Training FEGIN on component_pin_net representation
Train: 1565, Test: 383
##################ITERATION #0 ****************************************
 epoch: 0, train_loss: 1.1256, test_loss: 1.1245, test_f1: 0.3310
 epoch: 1, train_loss: 0.9946, test_loss: 1.0783, test_f1: 0.4760
 epoch: 2, train_loss: 0.9861, test_loss: 1.0803, test_f1: 0.4271
 epoch: 3, train_loss: 0.9608, test_loss: 1.1060, test_f1: 0.4862
 epoch: 4, train_loss: 0.9461, test_loss: 1.0688, test_f1: 0.5519
 epoch: 5, train_loss: 0.9238, test_loss: 1.0379, test_f1: 0.4666
 epoch: 6, train_loss: 0.9042, test_loss: 0.9764, test_f1: 0.5806
 epoch: 7, train_loss: 0.8915, test_loss: 1.3030, test_f1: 0.3934
 epoch: 8, train_loss: 0.8734, test_loss: 1.7094, test_f1: 0.3975
 epoch: 9, train_loss: 0.8559, test_loss: 0.9824, test_f1: 0.5305
 epoch: 10, train_loss: 0.8468, test_loss: 0.9594, test_f1: 0.5666
 epoch: 11, train_loss: 0.8062, test_loss: 1.1302, test_f1: 0.5057
 epoch: 12, train_loss: 0.8222, test_loss: 0.9529, test_f1: 0.5384
 epoch: 13, train_loss: 0.8189, test_loss: 1.2023, test_f1: 0.4482
 epoch: 14, train_loss: 0.7810, test_loss: 0.9524, test_f1: 0.6261
 epoch: 15, train_loss: 0.7994, test_loss: 1.0506, test_f1: 0.5130
 epoch: 16, train_loss: 0.7730, test_loss: 1.2016, test_f1: 0.5441
 epoch: 17, train_loss: 0.7880, test_loss: 1.0219, test_f1: 0.5168
 epoch: 18, train_loss: 0.7699, test_loss: 1.1490, test_f1: 0.4384
 epoch: 19, train_loss: 0.7525, test_loss: 1.1403, test_f1: 0.4400
 epoch: 20, train_loss: 0.7672, test_loss: 1.1564, test_f1: 0.5055
 epoch: 21, train_loss: 0.7516, test_loss: 1.0249, test_f1: 0.4588
 epoch: 22, train_loss: 0.7229, test_loss: 1.2240, test_f1: 0.4941
 epoch: 23, train_loss: 0.7301, test_loss: 0.9859, test_f1: 0.5518
 epoch: 24, train_loss: 0.7218, test_loss: 1.0171, test_f1: 0.5468
 epoch: 25, train_loss: 0.6936, test_loss: 1.1551, test_f1: 0.5118
 epoch: 26, train_loss: 0.7353, test_loss: 1.2040, test_f1: 0.4548
 epoch: 27, train_loss: 0.6938, test_loss: 1.1931, test_f1: 0.5366
 epoch: 28, train_loss: 0.6964, test_loss: 1.1575, test_f1: 0.5594
 epoch: 29, train_loss: 0.6954, test_loss: 1.0180, test_f1: 0.6351
 epoch: 30, train_loss: 0.7321, test_loss: 1.0220, test_f1: 0.5271
 epoch: 31, train_loss: 0.6758, test_loss: 1.0766, test_f1: 0.6001
 epoch: 32, train_loss: 0.6648, test_loss: 0.9965, test_f1: 0.6363
 epoch: 33, train_loss: 0.6846, test_loss: 1.0493, test_f1: 0.6222
 epoch: 34, train_loss: 0.6768, test_loss: 1.1828, test_f1: 0.5504
 epoch: 35, train_loss: 0.6915, test_loss: 1.9149, test_f1: 0.5036
 epoch: 36, train_loss: 0.6946, test_loss: 1.1215, test_f1: 0.5949
 epoch: 37, train_loss: 0.6881, test_loss: 1.0942, test_f1: 0.6179
 epoch: 38, train_loss: 0.6797, test_loss: 1.0869, test_f1: 0.4944
 epoch: 39, train_loss: 0.6813, test_loss: 1.6056, test_f1: 0.5460
 epoch: 40, train_loss: 0.6302, test_loss: 1.0817, test_f1: 0.5415
 epoch: 41, train_loss: 0.6583, test_loss: 1.0243, test_f1: 0.6001
 epoch: 42, train_loss: 0.6690, test_loss: 1.0171, test_f1: 0.5970
 epoch: 43, train_loss: 0.6437, test_loss: 47.3083, test_f1: 0.3889
 epoch: 44, train_loss: 0.6447, test_loss: 0.9870, test_f1: 0.6612
 epoch: 45, train_loss: 0.6479, test_loss: 1.0337, test_f1: 0.6326
 epoch: 46, train_loss: 0.6037, test_loss: 1.4681, test_f1: 0.5889
 epoch: 47, train_loss: 0.5929, test_loss: 1.1504, test_f1: 0.6064
 epoch: 48, train_loss: 0.5937, test_loss: 1.1284, test_f1: 0.6263
 epoch: 49, train_loss: 0.5745, test_loss: 1.1614, test_f1: 0.6136
 epoch: 50, train_loss: 0.5745, test_loss: 1.0988, test_f1: 0.6079
 epoch: 51, train_loss: 0.5448, test_loss: 1.3153, test_f1: 0.6126
 epoch: 52, train_loss: 0.5284, test_loss: 1.1804, test_f1: 0.6293
 epoch: 53, train_loss: 0.5482, test_loss: 1.1493, test_f1: 0.6572
 epoch: 54, train_loss: 0.5266, test_loss: 1.1367, test_f1: 0.6399
 epoch: 55, train_loss: 0.5208, test_loss: 1.1221, test_f1: 0.6339
 epoch: 56, train_loss: 0.4932, test_loss: 1.1949, test_f1: 0.6352
 epoch: 57, train_loss: 0.4838, test_loss: 1.3382, test_f1: 0.6252
 epoch: 58, train_loss: 0.4983, test_loss: 1.1548, test_f1: 0.6210
 epoch: 59, train_loss: 0.4874, test_loss: 1.1206, test_f1: 0.6605
 epoch: 60, train_loss: 0.4898, test_loss: 1.1878, test_f1: 0.6504
 epoch: 61, train_loss: 0.4681, test_loss: 1.2017, test_f1: 0.6351
 epoch: 62, train_loss: 0.4712, test_loss: 1.2485, test_f1: 0.6279
 epoch: 63, train_loss: 0.4901, test_loss: 1.3395, test_f1: 0.6044
 epoch: 64, train_loss: 0.4745, test_loss: 1.1813, test_f1: 0.6315
 epoch: 65, train_loss: 0.4633, test_loss: 1.1608, test_f1: 0.6785
 epoch: 66, train_loss: 0.4325, test_loss: 1.3031, test_f1: 0.6498
 epoch: 67, train_loss: 0.4470, test_loss: 1.2259, test_f1: 0.6310
 epoch: 68, train_loss: 0.4429, test_loss: 1.1697, test_f1: 0.6338
 epoch: 69, train_loss: 0.4599, test_loss: 1.1515, test_f1: 0.6497
 epoch: 70, train_loss: 0.4549, test_loss: 1.2445, test_f1: 0.6477
 epoch: 71, train_loss: 0.4507, test_loss: 1.2166, test_f1: 0.6619
 epoch: 72, train_loss: 0.4383, test_loss: 1.2260, test_f1: 0.6661
 epoch: 73, train_loss: 0.4755, test_loss: 1.2561, test_f1: 0.6481
 epoch: 74, train_loss: 0.4455, test_loss: 1.2006, test_f1: 0.6331
 epoch: 75, train_loss: 0.4367, test_loss: 1.2884, test_f1: 0.6264
 epoch: 76, train_loss: 0.4257, test_loss: 1.2933, test_f1: 0.6483
 epoch: 77, train_loss: 0.4332, test_loss: 1.2035, test_f1: 0.6440
 epoch: 78, train_loss: 0.4373, test_loss: 1.2590, test_f1: 0.6466
 epoch: 79, train_loss: 0.4526, test_loss: 1.1397, test_f1: 0.6554
 epoch: 80, train_loss: 0.4091, test_loss: 1.2589, test_f1: 0.6692
 epoch: 81, train_loss: 0.3854, test_loss: 1.3034, test_f1: 0.6655
 epoch: 82, train_loss: 0.4038, test_loss: 1.2608, test_f1: 0.6838
 epoch: 83, train_loss: 0.4034, test_loss: 1.2865, test_f1: 0.6656
 epoch: 84, train_loss: 0.3990, test_loss: 1.2756, test_f1: 0.6452
 epoch: 85, train_loss: 0.4368, test_loss: 1.2107, test_f1: 0.6410
 epoch: 86, train_loss: 0.3870, test_loss: 1.2313, test_f1: 0.6641
 epoch: 87, train_loss: 0.4027, test_loss: 1.4337, test_f1: 0.6073
 epoch: 88, train_loss: 0.3832, test_loss: 1.3998, test_f1: 0.6530
 epoch: 89, train_loss: 0.4079, test_loss: 1.4331, test_f1: 0.5852
 epoch: 90, train_loss: 0.3758, test_loss: 1.4008, test_f1: 0.6385
 epoch: 91, train_loss: 0.3884, test_loss: 1.3337, test_f1: 0.6612
 epoch: 92, train_loss: 0.3816, test_loss: 1.3220, test_f1: 0.6248
 epoch: 93, train_loss: 0.3858, test_loss: 1.1871, test_f1: 0.6658
 epoch: 94, train_loss: 0.3995, test_loss: 1.3521, test_f1: 0.6319
 epoch: 95, train_loss: 0.3846, test_loss: 1.3128, test_f1: 0.6346
 epoch: 96, train_loss: 0.4067, test_loss: 1.3373, test_f1: 0.6639
 epoch: 97, train_loss: 0.3755, test_loss: 1.4225, test_f1: 0.6401
 epoch: 98, train_loss: 0.3961, test_loss: 1.2131, test_f1: 0.6343
 epoch: 99, train_loss: 0.3597, test_loss: 1.3143, test_f1: 0.6526
##################ITERATION #1 ****************************************
 epoch: 0, train_loss: 1.0897, test_loss: 1.1183, test_f1: 0.4658
 epoch: 1, train_loss: 0.9797, test_loss: 1.0505, test_f1: 0.5094
 epoch: 2, train_loss: 0.9454, test_loss: 1.0498, test_f1: 0.5340
 epoch: 3, train_loss: 0.9237, test_loss: 1.0836, test_f1: 0.5022
 epoch: 4, train_loss: 0.9036, test_loss: 1.0008, test_f1: 0.5293
 epoch: 5, train_loss: 0.8732, test_loss: 0.9881, test_f1: 0.5475
 epoch: 6, train_loss: 0.8652, test_loss: 1.0971, test_f1: 0.4917
 epoch: 7, train_loss: 0.8422, test_loss: 1.1008, test_f1: 0.5186
 epoch: 8, train_loss: 0.8375, test_loss: 1.0836, test_f1: 0.5106
 epoch: 9, train_loss: 0.8232, test_loss: 1.1201, test_f1: 0.5762
 epoch: 10, train_loss: 0.8044, test_loss: 1.1889, test_f1: 0.4835
 epoch: 11, train_loss: 0.8107, test_loss: 1.1872, test_f1: 0.4312
 epoch: 12, train_loss: 0.7972, test_loss: 1.0912, test_f1: 0.5241
 epoch: 13, train_loss: 0.8051, test_loss: 1.0024, test_f1: 0.5325
 epoch: 14, train_loss: 0.7805, test_loss: 1.0752, test_f1: 0.5168
 epoch: 15, train_loss: 0.7436, test_loss: 1.0449, test_f1: 0.5547
 epoch: 16, train_loss: 0.7513, test_loss: 1.2046, test_f1: 0.4652
 epoch: 17, train_loss: 0.7601, test_loss: 1.0415, test_f1: 0.5486
 epoch: 18, train_loss: 0.7601, test_loss: 1.4825, test_f1: 0.5495
 epoch: 19, train_loss: 0.7544, test_loss: 1.7963, test_f1: 0.4841
 epoch: 20, train_loss: 0.7284, test_loss: 1.1963, test_f1: 0.5744
 epoch: 21, train_loss: 0.7113, test_loss: 1.1084, test_f1: 0.5979
 epoch: 22, train_loss: 0.7186, test_loss: 1.0545, test_f1: 0.5572
 epoch: 23, train_loss: 0.7237, test_loss: 1.2025, test_f1: 0.5539
 epoch: 24, train_loss: 0.7178, test_loss: 1.5498, test_f1: 0.4080
 epoch: 25, train_loss: 0.7270, test_loss: 1.3375, test_f1: 0.6284
 epoch: 26, train_loss: 0.6984, test_loss: 1.3853, test_f1: 0.5033
 epoch: 27, train_loss: 0.6937, test_loss: 1.6642, test_f1: 0.6131
 epoch: 28, train_loss: 0.6525, test_loss: 1.8373, test_f1: 0.4830
 epoch: 29, train_loss: 0.6684, test_loss: 1.1734, test_f1: 0.5875
 epoch: 30, train_loss: 0.6626, test_loss: 1.5252, test_f1: 0.5452
 epoch: 31, train_loss: 0.6856, test_loss: 1.1894, test_f1: 0.5931
 epoch: 32, train_loss: 0.6686, test_loss: 1.2879, test_f1: 0.5448
 epoch: 33, train_loss: 0.6930, test_loss: 1.4885, test_f1: 0.6069
 epoch: 34, train_loss: 0.6218, test_loss: 1.5465, test_f1: 0.5733
 epoch: 35, train_loss: 0.6462, test_loss: 1.2704, test_f1: 0.5242
 epoch: 36, train_loss: 0.6237, test_loss: 1.4301, test_f1: 0.5860
 epoch: 37, train_loss: 0.6415, test_loss: 1.2072, test_f1: 0.5545
 epoch: 38, train_loss: 0.6566, test_loss: 1.1962, test_f1: 0.5876
 epoch: 39, train_loss: 0.6059, test_loss: 1.7933, test_f1: 0.6020
 epoch: 40, train_loss: 0.6024, test_loss: 1.5363, test_f1: 0.5959
 epoch: 41, train_loss: 0.6356, test_loss: 1.6085, test_f1: 0.4449
 epoch: 42, train_loss: 0.6208, test_loss: 1.2933, test_f1: 0.6255
 epoch: 43, train_loss: 0.6104, test_loss: 1.3027, test_f1: 0.5112
 epoch: 44, train_loss: 0.6213, test_loss: 1.8373, test_f1: 0.6076
 epoch: 45, train_loss: 0.5833, test_loss: 1.3331, test_f1: 0.5876
 epoch: 46, train_loss: 0.5658, test_loss: 1.4148, test_f1: 0.5494
 epoch: 47, train_loss: 0.6059, test_loss: 1.8357, test_f1: 0.5778
 epoch: 48, train_loss: 0.6132, test_loss: 1.6431, test_f1: 0.5900
 epoch: 49, train_loss: 0.5868, test_loss: 1.4704, test_f1: 0.5543
 epoch: 50, train_loss: 0.6082, test_loss: 1.7082, test_f1: 0.4841
 epoch: 51, train_loss: 0.5442, test_loss: 1.6083, test_f1: 0.6097
 epoch: 52, train_loss: 0.5287, test_loss: 1.5509, test_f1: 0.5234
 epoch: 53, train_loss: 0.5159, test_loss: 1.5353, test_f1: 0.6085
 epoch: 54, train_loss: 0.4998, test_loss: 1.3422, test_f1: 0.6328
 epoch: 55, train_loss: 0.4930, test_loss: 1.4709, test_f1: 0.6032
 epoch: 56, train_loss: 0.4770, test_loss: 1.6448, test_f1: 0.6460
 epoch: 57, train_loss: 0.4641, test_loss: 1.5405, test_f1: 0.6148
 epoch: 58, train_loss: 0.5023, test_loss: 1.4221, test_f1: 0.6307
 epoch: 59, train_loss: 0.4680, test_loss: 1.6266, test_f1: 0.6057
 epoch: 60, train_loss: 0.4550, test_loss: 1.8944, test_f1: 0.6343
 epoch: 61, train_loss: 0.4407, test_loss: 1.5825, test_f1: 0.6040
 epoch: 62, train_loss: 0.4510, test_loss: 1.5816, test_f1: 0.6059
 epoch: 63, train_loss: 0.4641, test_loss: 2.2078, test_f1: 0.6069
 epoch: 64, train_loss: 0.4596, test_loss: 1.6231, test_f1: 0.6410
 epoch: 65, train_loss: 0.4516, test_loss: 1.3857, test_f1: 0.5931
 epoch: 66, train_loss: 0.4852, test_loss: 2.0583, test_f1: 0.6374
 epoch: 67, train_loss: 0.4108, test_loss: 1.8431, test_f1: 0.6349
 epoch: 68, train_loss: 0.4470, test_loss: 2.2795, test_f1: 0.5852
 epoch: 69, train_loss: 0.4277, test_loss: 1.8068, test_f1: 0.5995
 epoch: 70, train_loss: 0.4225, test_loss: 2.0718, test_f1: 0.6134
 epoch: 71, train_loss: 0.4286, test_loss: 1.3098, test_f1: 0.6220
 epoch: 72, train_loss: 0.4262, test_loss: 1.7729, test_f1: 0.6216
 epoch: 73, train_loss: 0.4099, test_loss: 1.6902, test_f1: 0.5895
 epoch: 74, train_loss: 0.4126, test_loss: 1.9221, test_f1: 0.6318
 epoch: 75, train_loss: 0.4370, test_loss: 1.8100, test_f1: 0.6086
 epoch: 76, train_loss: 0.4273, test_loss: 1.7782, test_f1: 0.5698
 epoch: 77, train_loss: 0.3761, test_loss: 1.7158, test_f1: 0.5950
 epoch: 78, train_loss: 0.3978, test_loss: 1.7330, test_f1: 0.6082
 epoch: 79, train_loss: 0.4184, test_loss: 1.9054, test_f1: 0.6250
 epoch: 80, train_loss: 0.3998, test_loss: 1.8921, test_f1: 0.5549
 epoch: 81, train_loss: 0.3953, test_loss: 2.0725, test_f1: 0.6208
 epoch: 82, train_loss: 0.4076, test_loss: 1.6658, test_f1: 0.6044
 epoch: 83, train_loss: 0.3914, test_loss: 2.0829, test_f1: 0.6310
 epoch: 84, train_loss: 0.3962, test_loss: 1.8969, test_f1: 0.5892
 epoch: 85, train_loss: 0.3853, test_loss: 1.9722, test_f1: 0.5923
 epoch: 86, train_loss: 0.3752, test_loss: 2.2717, test_f1: 0.5873
 epoch: 87, train_loss: 0.4000, test_loss: 1.9256, test_f1: 0.6048
 epoch: 88, train_loss: 0.3958, test_loss: 1.9315, test_f1: 0.6288
 epoch: 89, train_loss: 0.3860, test_loss: 1.8740, test_f1: 0.6377
 epoch: 90, train_loss: 0.3810, test_loss: 1.9827, test_f1: 0.6375
 epoch: 91, train_loss: 0.4160, test_loss: 1.5190, test_f1: 0.6209
 epoch: 92, train_loss: 0.3847, test_loss: 1.7060, test_f1: 0.5383
 epoch: 93, train_loss: 0.3854, test_loss: 1.5635, test_f1: 0.5973
 epoch: 94, train_loss: 0.3969, test_loss: 2.0349, test_f1: 0.5843
 epoch: 95, train_loss: 0.3729, test_loss: 1.4733, test_f1: 0.6404
 epoch: 96, train_loss: 0.3453, test_loss: 1.6696, test_f1: 0.5997
 epoch: 97, train_loss: 0.3992, test_loss: 1.8204, test_f1: 0.6584
 epoch: 98, train_loss: 0.3743, test_loss: 1.6902, test_f1: 0.5730
 epoch: 99, train_loss: 0.3893, test_loss: 1.6051, test_f1: 0.6195
##################ITERATION #2 ****************************************
 epoch: 0, train_loss: 1.1092, test_loss: 1.1071, test_f1: 0.5079
 epoch: 1, train_loss: 0.9275, test_loss: 1.0130, test_f1: 0.5493
 epoch: 2, train_loss: 0.8800, test_loss: 1.0717, test_f1: 0.4651
 epoch: 3, train_loss: 0.8689, test_loss: 0.9994, test_f1: 0.5581
 epoch: 4, train_loss: 0.8665, test_loss: 1.0562, test_f1: 0.4887
 epoch: 5, train_loss: 0.8964, test_loss: 0.9589, test_f1: 0.5879
 epoch: 6, train_loss: 0.8465, test_loss: 0.9838, test_f1: 0.5372
 epoch: 7, train_loss: 0.8115, test_loss: 0.9994, test_f1: 0.5035
 epoch: 8, train_loss: 0.8251, test_loss: 0.9810, test_f1: 0.5687
 epoch: 9, train_loss: 0.8008, test_loss: 1.1563, test_f1: 0.4990
 epoch: 10, train_loss: 0.8074, test_loss: 1.0393, test_f1: 0.5200
 epoch: 11, train_loss: 0.8034, test_loss: 1.2089, test_f1: 0.5342
 epoch: 12, train_loss: 0.7970, test_loss: 1.1370, test_f1: 0.4939
 epoch: 13, train_loss: 0.7747, test_loss: 1.2975, test_f1: 0.4755
 epoch: 14, train_loss: 0.7701, test_loss: 1.2201, test_f1: 0.4974
 epoch: 15, train_loss: 0.7542, test_loss: 1.1113, test_f1: 0.5290
 epoch: 16, train_loss: 0.7695, test_loss: 1.2860, test_f1: 0.4772
 epoch: 17, train_loss: 0.7325, test_loss: 1.2575, test_f1: 0.5196
 epoch: 18, train_loss: 0.7578, test_loss: 1.0512, test_f1: 0.5239
 epoch: 19, train_loss: 0.7625, test_loss: 1.2494, test_f1: 0.4832
 epoch: 20, train_loss: 0.7251, test_loss: 1.1400, test_f1: 0.5366
 epoch: 21, train_loss: 0.7314, test_loss: 1.3811, test_f1: 0.5539
 epoch: 22, train_loss: 0.7446, test_loss: 1.4052, test_f1: 0.4871
 epoch: 23, train_loss: 0.7484, test_loss: 1.0350, test_f1: 0.5540
 epoch: 24, train_loss: 0.7020, test_loss: 1.1178, test_f1: 0.5346
 epoch: 25, train_loss: 0.7014, test_loss: 1.1466, test_f1: 0.5320
 epoch: 26, train_loss: 0.7250, test_loss: 1.0832, test_f1: 0.5740
 epoch: 27, train_loss: 0.6839, test_loss: 1.1944, test_f1: 0.5751
 epoch: 28, train_loss: 0.7017, test_loss: 1.3582, test_f1: 0.5430
 epoch: 29, train_loss: 0.6963, test_loss: 1.0218, test_f1: 0.5990
 epoch: 30, train_loss: 0.6742, test_loss: 1.3096, test_f1: 0.5299
 epoch: 31, train_loss: 0.6939, test_loss: 1.1163, test_f1: 0.5397
 epoch: 32, train_loss: 0.6722, test_loss: 1.1282, test_f1: 0.5624
 epoch: 33, train_loss: 0.6787, test_loss: 1.1086, test_f1: 0.5560
 epoch: 34, train_loss: 0.6425, test_loss: 1.3461, test_f1: 0.5711
 epoch: 35, train_loss: 0.6363, test_loss: 1.3308, test_f1: 0.5882
 epoch: 36, train_loss: 0.6237, test_loss: 1.3621, test_f1: 0.5439
 epoch: 37, train_loss: 0.6522, test_loss: 1.1811, test_f1: 0.6131
 epoch: 38, train_loss: 0.6642, test_loss: 0.9489, test_f1: 0.6247
 epoch: 39, train_loss: 0.6098, test_loss: 1.6326, test_f1: 0.4971
 epoch: 40, train_loss: 0.6227, test_loss: 1.1784, test_f1: 0.6112
 epoch: 41, train_loss: 0.6341, test_loss: 1.1127, test_f1: 0.5804
 epoch: 42, train_loss: 0.5967, test_loss: 1.4251, test_f1: 0.5614
 epoch: 43, train_loss: 0.5995, test_loss: 1.2568, test_f1: 0.6195
 epoch: 44, train_loss: 0.6343, test_loss: 1.2300, test_f1: 0.5966
 epoch: 45, train_loss: 0.6155, test_loss: 1.2881, test_f1: 0.5781
 epoch: 46, train_loss: 0.6322, test_loss: 1.1425, test_f1: 0.5871
 epoch: 47, train_loss: 0.5912, test_loss: 1.2107, test_f1: 0.5373
 epoch: 48, train_loss: 0.6187, test_loss: 1.0498, test_f1: 0.6495
 epoch: 49, train_loss: 0.6030, test_loss: 1.0636, test_f1: 0.6498
 epoch: 50, train_loss: 0.6025, test_loss: 1.1719, test_f1: 0.5630
 epoch: 51, train_loss: 0.5788, test_loss: 1.1015, test_f1: 0.6077
 epoch: 52, train_loss: 0.5382, test_loss: 1.2629, test_f1: 0.6029
 epoch: 53, train_loss: 0.5210, test_loss: 1.3669, test_f1: 0.6312
 epoch: 54, train_loss: 0.4996, test_loss: 1.2554, test_f1: 0.6018
 epoch: 55, train_loss: 0.5255, test_loss: 1.2342, test_f1: 0.6156
 epoch: 56, train_loss: 0.4791, test_loss: 1.3133, test_f1: 0.6260
 epoch: 57, train_loss: 0.5306, test_loss: 1.1667, test_f1: 0.6357
 epoch: 58, train_loss: 0.4922, test_loss: 1.2494, test_f1: 0.6245
 epoch: 59, train_loss: 0.4817, test_loss: 1.2280, test_f1: 0.6364
 epoch: 60, train_loss: 0.4741, test_loss: 1.2444, test_f1: 0.6151
 epoch: 61, train_loss: 0.4693, test_loss: 1.5336, test_f1: 0.5987
 epoch: 62, train_loss: 0.4660, test_loss: 1.3966, test_f1: 0.5977
 epoch: 63, train_loss: 0.4718, test_loss: 1.5096, test_f1: 0.6014
 epoch: 64, train_loss: 0.4631, test_loss: 1.4878, test_f1: 0.6171
 epoch: 65, train_loss: 0.5083, test_loss: 1.9082, test_f1: 0.5677
 epoch: 66, train_loss: 0.4782, test_loss: 1.3595, test_f1: 0.6181
 epoch: 67, train_loss: 0.4682, test_loss: 1.5952, test_f1: 0.6066
 epoch: 68, train_loss: 0.4767, test_loss: 1.3120, test_f1: 0.6055
 epoch: 69, train_loss: 0.4793, test_loss: 1.6594, test_f1: 0.6042
 epoch: 70, train_loss: 0.4718, test_loss: 1.4173, test_f1: 0.6215
 epoch: 71, train_loss: 0.4424, test_loss: 1.5695, test_f1: 0.6320
 epoch: 72, train_loss: 0.4488, test_loss: 1.7054, test_f1: 0.5605
 epoch: 73, train_loss: 0.4597, test_loss: 1.6510, test_f1: 0.5745
 epoch: 74, train_loss: 0.4620, test_loss: 1.4669, test_f1: 0.6021
 epoch: 75, train_loss: 0.4445, test_loss: 1.4491, test_f1: 0.6358
 epoch: 76, train_loss: 0.4083, test_loss: 1.5292, test_f1: 0.6103
 epoch: 77, train_loss: 0.4350, test_loss: 2.0085, test_f1: 0.5727
 epoch: 78, train_loss: 0.4069, test_loss: 1.7114, test_f1: 0.5838
 epoch: 79, train_loss: 0.4683, test_loss: 1.5564, test_f1: 0.5944
 epoch: 80, train_loss: 0.4387, test_loss: 1.8944, test_f1: 0.6014
 epoch: 81, train_loss: 0.4123, test_loss: 1.7864, test_f1: 0.5697
 epoch: 82, train_loss: 0.4185, test_loss: 1.9209, test_f1: 0.6163
 epoch: 83, train_loss: 0.4141, test_loss: 1.4665, test_f1: 0.6182
 epoch: 84, train_loss: 0.4393, test_loss: 1.5227, test_f1: 0.5968
 epoch: 85, train_loss: 0.4316, test_loss: 1.5006, test_f1: 0.6345
 epoch: 86, train_loss: 0.4099, test_loss: 1.6327, test_f1: 0.5996
 epoch: 87, train_loss: 0.4280, test_loss: 1.5305, test_f1: 0.6484
 epoch: 88, train_loss: 0.3953, test_loss: 1.5484, test_f1: 0.6402
 epoch: 89, train_loss: 0.3958, test_loss: 1.5452, test_f1: 0.5993
 epoch: 90, train_loss: 0.4054, test_loss: 2.0409, test_f1: 0.5583
 epoch: 91, train_loss: 0.4011, test_loss: 1.5696, test_f1: 0.6395
 epoch: 92, train_loss: 0.3816, test_loss: 1.6378, test_f1: 0.6461
 epoch: 93, train_loss: 0.4158, test_loss: 1.5986, test_f1: 0.6380
 epoch: 94, train_loss: 0.3879, test_loss: 1.5446, test_f1: 0.6480
 epoch: 95, train_loss: 0.3803, test_loss: 1.7610, test_f1: 0.6416
 epoch: 96, train_loss: 0.3578, test_loss: 1.8850, test_f1: 0.6177
 epoch: 97, train_loss: 0.3896, test_loss: 1.7341, test_f1: 0.6060
 epoch: 98, train_loss: 0.3840, test_loss: 1.8291, test_f1: 0.5472
 epoch: 99, train_loss: 0.3969, test_loss: 1.5787, test_f1: 0.6318
##################ITERATION #3 ****************************************
 epoch: 0, train_loss: 1.0940, test_loss: 1.0871, test_f1: 0.4643
 epoch: 1, train_loss: 0.9520, test_loss: 1.0421, test_f1: 0.4493
 epoch: 2, train_loss: 0.9258, test_loss: 0.9988, test_f1: 0.5106
 epoch: 3, train_loss: 0.9099, test_loss: 1.0565, test_f1: 0.4800
 epoch: 4, train_loss: 0.8598, test_loss: 1.0284, test_f1: 0.5468
 epoch: 5, train_loss: 0.8813, test_loss: 1.0210, test_f1: 0.5629
 epoch: 6, train_loss: 0.8611, test_loss: 0.9944, test_f1: 0.5265
 epoch: 7, train_loss: 0.8583, test_loss: 1.0452, test_f1: 0.4679
 epoch: 8, train_loss: 0.8283, test_loss: 1.5111, test_f1: 0.3497
 epoch: 9, train_loss: 0.8465, test_loss: 1.4077, test_f1: 0.4699
 epoch: 10, train_loss: 0.8258, test_loss: 1.1172, test_f1: 0.4818
 epoch: 11, train_loss: 0.8162, test_loss: 5.0099, test_f1: 0.1056
 epoch: 12, train_loss: 0.8192, test_loss: 1.0103, test_f1: 0.6168
 epoch: 13, train_loss: 0.7974, test_loss: 1.2334, test_f1: 0.5142
 epoch: 14, train_loss: 0.7910, test_loss: 1.0707, test_f1: 0.5122
 epoch: 15, train_loss: 0.7849, test_loss: 1.0631, test_f1: 0.5789
 epoch: 16, train_loss: 0.7569, test_loss: 1.1533, test_f1: 0.5588
 epoch: 17, train_loss: 0.7633, test_loss: 1.0499, test_f1: 0.5687
 epoch: 18, train_loss: 0.7389, test_loss: 1.0814, test_f1: 0.5864
 epoch: 19, train_loss: 0.7457, test_loss: 1.1144, test_f1: 0.5611
 epoch: 20, train_loss: 0.7439, test_loss: 1.1080, test_f1: 0.5225
 epoch: 21, train_loss: 0.7217, test_loss: 1.1466, test_f1: 0.5303
 epoch: 22, train_loss: 0.7078, test_loss: 1.2090, test_f1: 0.5232
 epoch: 23, train_loss: 0.7258, test_loss: 1.1589, test_f1: 0.5950
 epoch: 24, train_loss: 0.7121, test_loss: 1.3128, test_f1: 0.5064
 epoch: 25, train_loss: 0.7261, test_loss: 1.3298, test_f1: 0.5369
 epoch: 26, train_loss: 0.7006, test_loss: 1.1366, test_f1: 0.5916
 epoch: 27, train_loss: 0.7199, test_loss: 1.0439, test_f1: 0.6105
 epoch: 28, train_loss: 0.6955, test_loss: 1.0770, test_f1: 0.5878
 epoch: 29, train_loss: 0.6904, test_loss: 1.2155, test_f1: 0.5554
 epoch: 30, train_loss: 0.6724, test_loss: 1.3716, test_f1: 0.5676
 epoch: 31, train_loss: 0.6524, test_loss: 1.2518, test_f1: 0.6108
 epoch: 32, train_loss: 0.6673, test_loss: 1.4103, test_f1: 0.5674
 epoch: 33, train_loss: 0.6734, test_loss: 1.5993, test_f1: 0.5636
 epoch: 34, train_loss: 0.6550, test_loss: 1.2987, test_f1: 0.5852
 epoch: 35, train_loss: 0.6271, test_loss: 1.1143, test_f1: 0.6475
 epoch: 36, train_loss: 0.6396, test_loss: 1.3184, test_f1: 0.5608
 epoch: 37, train_loss: 0.6303, test_loss: 1.3225, test_f1: 0.5741
 epoch: 38, train_loss: 0.6368, test_loss: 1.2172, test_f1: 0.6073
 epoch: 39, train_loss: 0.6223, test_loss: 1.1591, test_f1: 0.5713
 epoch: 40, train_loss: 0.6119, test_loss: 1.2516, test_f1: 0.6072
 epoch: 41, train_loss: 0.5745, test_loss: 1.2204, test_f1: 0.5784
 epoch: 42, train_loss: 0.6512, test_loss: 1.2768, test_f1: 0.5864
 epoch: 43, train_loss: 0.6413, test_loss: 1.3163, test_f1: 0.6051
 epoch: 44, train_loss: 0.5935, test_loss: 1.3409, test_f1: 0.6396
 epoch: 45, train_loss: 0.5872, test_loss: 1.2041, test_f1: 0.6030
 epoch: 46, train_loss: 0.5607, test_loss: 1.6203, test_f1: 0.5785
 epoch: 47, train_loss: 0.5525, test_loss: 1.3099, test_f1: 0.5840
 epoch: 48, train_loss: 0.5663, test_loss: 1.5339, test_f1: 0.5898
 epoch: 49, train_loss: 0.5956, test_loss: 1.6174, test_f1: 0.5491
 epoch: 50, train_loss: 0.5619, test_loss: 1.7777, test_f1: 0.5809
 epoch: 51, train_loss: 0.5540, test_loss: 1.4116, test_f1: 0.6262
 epoch: 52, train_loss: 0.5427, test_loss: 1.5368, test_f1: 0.6318
 epoch: 53, train_loss: 0.4654, test_loss: 1.5329, test_f1: 0.5979
 epoch: 54, train_loss: 0.4841, test_loss: 1.4141, test_f1: 0.6182
 epoch: 55, train_loss: 0.4664, test_loss: 1.4119, test_f1: 0.6534
 epoch: 56, train_loss: 0.4771, test_loss: 1.6474, test_f1: 0.5890
 epoch: 57, train_loss: 0.4832, test_loss: 1.4752, test_f1: 0.5940
 epoch: 58, train_loss: 0.4538, test_loss: 1.6581, test_f1: 0.5690
 epoch: 59, train_loss: 0.4751, test_loss: 1.6021, test_f1: 0.6414
 epoch: 60, train_loss: 0.4547, test_loss: 1.5817, test_f1: 0.6102
 epoch: 61, train_loss: 0.4575, test_loss: 1.6268, test_f1: 0.5918
 epoch: 62, train_loss: 0.4712, test_loss: 1.4289, test_f1: 0.5941
 epoch: 63, train_loss: 0.4625, test_loss: 1.4676, test_f1: 0.5968
 epoch: 64, train_loss: 0.4470, test_loss: 1.6376, test_f1: 0.6059
 epoch: 65, train_loss: 0.4791, test_loss: 1.5322, test_f1: 0.5965
 epoch: 66, train_loss: 0.4459, test_loss: 1.4477, test_f1: 0.5969
 epoch: 67, train_loss: 0.4593, test_loss: 1.5193, test_f1: 0.6329
 epoch: 68, train_loss: 0.4283, test_loss: 1.8193, test_f1: 0.6459
 epoch: 69, train_loss: 0.4230, test_loss: 1.7841, test_f1: 0.6188
 epoch: 70, train_loss: 0.4667, test_loss: 1.6260, test_f1: 0.6092
 epoch: 71, train_loss: 0.4290, test_loss: 1.4886, test_f1: 0.6074
 epoch: 72, train_loss: 0.4244, test_loss: 1.5296, test_f1: 0.6294
 epoch: 73, train_loss: 0.4040, test_loss: 1.5477, test_f1: 0.6409
 epoch: 74, train_loss: 0.4272, test_loss: 1.6074, test_f1: 0.5753
 epoch: 75, train_loss: 0.4341, test_loss: 1.7678, test_f1: 0.6064
 epoch: 76, train_loss: 0.4363, test_loss: 1.5909, test_f1: 0.6180
 epoch: 77, train_loss: 0.4045, test_loss: 1.6537, test_f1: 0.5996
 epoch: 78, train_loss: 0.4046, test_loss: 1.5076, test_f1: 0.6214
 epoch: 79, train_loss: 0.4410, test_loss: 1.5705, test_f1: 0.6220
 epoch: 80, train_loss: 0.3800, test_loss: 1.7057, test_f1: 0.6454
 epoch: 81, train_loss: 0.4066, test_loss: 1.7855, test_f1: 0.6164
 epoch: 82, train_loss: 0.4008, test_loss: 1.7185, test_f1: 0.6383
 epoch: 83, train_loss: 0.3922, test_loss: 1.6059, test_f1: 0.6424
 epoch: 84, train_loss: 0.4294, test_loss: 1.6772, test_f1: 0.6252
 epoch: 85, train_loss: 0.3966, test_loss: 1.7394, test_f1: 0.5868
 epoch: 86, train_loss: 0.4116, test_loss: 1.7163, test_f1: 0.6257
 epoch: 87, train_loss: 0.4091, test_loss: 1.8524, test_f1: 0.6397
 epoch: 88, train_loss: 0.3801, test_loss: 1.9117, test_f1: 0.6299
 epoch: 89, train_loss: 0.3814, test_loss: 1.7641, test_f1: 0.6266
 epoch: 90, train_loss: 0.3636, test_loss: 1.6634, test_f1: 0.6210
 epoch: 91, train_loss: 0.3810, test_loss: 1.7091, test_f1: 0.6187
 epoch: 92, train_loss: 0.4003, test_loss: 1.8178, test_f1: 0.5962
 epoch: 93, train_loss: 0.3829, test_loss: 1.9327, test_f1: 0.6217
 epoch: 94, train_loss: 0.3483, test_loss: 1.7469, test_f1: 0.6320
 epoch: 95, train_loss: 0.3789, test_loss: 1.7832, test_f1: 0.6315
 epoch: 96, train_loss: 0.3683, test_loss: 1.8233, test_f1: 0.6133
 epoch: 97, train_loss: 0.3563, test_loss: 2.0555, test_f1: 0.5677
 epoch: 98, train_loss: 0.4002, test_loss: 1.6641, test_f1: 0.6416
 epoch: 99, train_loss: 0.3759, test_loss: 1.7139, test_f1: 0.6207
##################ITERATION #4 ****************************************
 epoch: 0, train_loss: 1.1052, test_loss: 1.4751, test_f1: 0.3561
 epoch: 1, train_loss: 0.9689, test_loss: 1.0684, test_f1: 0.5221
 epoch: 2, train_loss: 0.9250, test_loss: 0.9938, test_f1: 0.5140
 epoch: 3, train_loss: 0.9164, test_loss: 1.0089, test_f1: 0.5550
 epoch: 4, train_loss: 0.8900, test_loss: 0.9904, test_f1: 0.5589
 epoch: 5, train_loss: 0.8542, test_loss: 1.2512, test_f1: 0.4876
 epoch: 6, train_loss: 0.8588, test_loss: 0.9996, test_f1: 0.5405
 epoch: 7, train_loss: 0.8383, test_loss: 0.9876, test_f1: 0.5477
 epoch: 8, train_loss: 0.8202, test_loss: 1.1814, test_f1: 0.5002
 epoch: 9, train_loss: 0.8420, test_loss: 1.0597, test_f1: 0.4132
 epoch: 10, train_loss: 0.8267, test_loss: 1.1357, test_f1: 0.4788
 epoch: 11, train_loss: 0.7963, test_loss: 1.0791, test_f1: 0.4893
 epoch: 12, train_loss: 0.7971, test_loss: 1.1103, test_f1: 0.5014
 epoch: 13, train_loss: 0.7679, test_loss: 1.0479, test_f1: 0.5282
 epoch: 14, train_loss: 0.7783, test_loss: 1.0667, test_f1: 0.5845
 epoch: 15, train_loss: 0.7762, test_loss: 3.1575, test_f1: 0.2696
 epoch: 16, train_loss: 0.7880, test_loss: 0.9714, test_f1: 0.4463
 epoch: 17, train_loss: 0.7662, test_loss: 1.2352, test_f1: 0.5668
 epoch: 18, train_loss: 0.7335, test_loss: 1.0678, test_f1: 0.5607
 epoch: 19, train_loss: 0.7604, test_loss: 0.9771, test_f1: 0.5186
 epoch: 20, train_loss: 0.7393, test_loss: 0.9699, test_f1: 0.6160
 epoch: 21, train_loss: 0.7179, test_loss: 0.9622, test_f1: 0.6176
 epoch: 22, train_loss: 0.6782, test_loss: 1.1982, test_f1: 0.5886
 epoch: 23, train_loss: 0.6817, test_loss: 1.0319, test_f1: 0.5792
 epoch: 24, train_loss: 0.6978, test_loss: 1.0964, test_f1: 0.5695
 epoch: 25, train_loss: 0.6832, test_loss: 1.0685, test_f1: 0.5041
 epoch: 26, train_loss: 0.6765, test_loss: 1.4589, test_f1: 0.4459
 epoch: 27, train_loss: 0.6609, test_loss: 1.1057, test_f1: 0.5568
 epoch: 28, train_loss: 0.6613, test_loss: 1.0690, test_f1: 0.5830
 epoch: 29, train_loss: 0.6658, test_loss: 1.0604, test_f1: 0.6226
 epoch: 30, train_loss: 0.6632, test_loss: 1.2694, test_f1: 0.6067
 epoch: 31, train_loss: 0.6546, test_loss: 1.1281, test_f1: 0.6032
 epoch: 32, train_loss: 0.6756, test_loss: 1.1256, test_f1: 0.5794
 epoch: 33, train_loss: 0.6574, test_loss: 1.2343, test_f1: 0.6102
 epoch: 34, train_loss: 0.6661, test_loss: 1.4269, test_f1: 0.5593
 epoch: 35, train_loss: 0.6207, test_loss: 1.3321, test_f1: 0.5592
 epoch: 36, train_loss: 0.6107, test_loss: 1.3123, test_f1: 0.5877
 epoch: 37, train_loss: 0.6264, test_loss: 1.2928, test_f1: 0.6068
 epoch: 38, train_loss: 0.6128, test_loss: 1.3893, test_f1: 0.6414
 epoch: 39, train_loss: 0.5968, test_loss: 1.6723, test_f1: 0.5248
 epoch: 40, train_loss: 0.6017, test_loss: 1.0696, test_f1: 0.5830
 epoch: 41, train_loss: 0.5888, test_loss: 1.2048, test_f1: 0.5933
 epoch: 42, train_loss: 0.5814, test_loss: 1.0531, test_f1: 0.6598
 epoch: 43, train_loss: 0.5625, test_loss: 1.1706, test_f1: 0.6029
 epoch: 44, train_loss: 0.5725, test_loss: 1.1558, test_f1: 0.6340
 epoch: 45, train_loss: 0.5707, test_loss: 1.2578, test_f1: 0.5689
 epoch: 46, train_loss: 0.5668, test_loss: 1.2584, test_f1: 0.6489
 epoch: 47, train_loss: 0.5630, test_loss: 1.3150, test_f1: 0.6020
 epoch: 48, train_loss: 0.6076, test_loss: 1.4195, test_f1: 0.5273
 epoch: 49, train_loss: 0.5880, test_loss: 1.2400, test_f1: 0.5682
 epoch: 50, train_loss: 0.5963, test_loss: 1.3337, test_f1: 0.5589
 epoch: 51, train_loss: 0.5607, test_loss: 1.1485, test_f1: 0.6070
 epoch: 52, train_loss: 0.5191, test_loss: 1.1638, test_f1: 0.5885
 epoch: 53, train_loss: 0.5058, test_loss: 1.4727, test_f1: 0.5756
 epoch: 54, train_loss: 0.4853, test_loss: 1.4014, test_f1: 0.5759
 epoch: 55, train_loss: 0.4957, test_loss: 1.3776, test_f1: 0.6191
 epoch: 56, train_loss: 0.4934, test_loss: 1.2737, test_f1: 0.5952
 epoch: 57, train_loss: 0.4675, test_loss: 1.2162, test_f1: 0.6118
 epoch: 58, train_loss: 0.4796, test_loss: 1.2692, test_f1: 0.6247
 epoch: 59, train_loss: 0.4668, test_loss: 1.5063, test_f1: 0.6583
 epoch: 60, train_loss: 0.5028, test_loss: 1.3665, test_f1: 0.6084
 epoch: 61, train_loss: 0.4565, test_loss: 1.5769, test_f1: 0.6346
 epoch: 62, train_loss: 0.4652, test_loss: 1.3186, test_f1: 0.6501
 epoch: 63, train_loss: 0.4779, test_loss: 1.3859, test_f1: 0.6191
 epoch: 64, train_loss: 0.4561, test_loss: 1.5618, test_f1: 0.6228
 epoch: 65, train_loss: 0.4774, test_loss: 1.3571, test_f1: 0.6417
 epoch: 66, train_loss: 0.4337, test_loss: 1.4065, test_f1: 0.6171
 epoch: 67, train_loss: 0.4377, test_loss: 1.8942, test_f1: 0.5914
 epoch: 68, train_loss: 0.4417, test_loss: 1.3820, test_f1: 0.6205
 epoch: 69, train_loss: 0.4982, test_loss: 1.4456, test_f1: 0.5755
 epoch: 70, train_loss: 0.4422, test_loss: 1.4557, test_f1: 0.5823
 epoch: 71, train_loss: 0.4369, test_loss: 1.4171, test_f1: 0.6327
 epoch: 72, train_loss: 0.4236, test_loss: 1.5333, test_f1: 0.6510
 epoch: 73, train_loss: 0.4311, test_loss: 1.8278, test_f1: 0.5909
 epoch: 74, train_loss: 0.4565, test_loss: 1.4230, test_f1: 0.5920
 epoch: 75, train_loss: 0.4203, test_loss: 1.5431, test_f1: 0.6044
 epoch: 76, train_loss: 0.4218, test_loss: 1.5001, test_f1: 0.6266
 epoch: 77, train_loss: 0.4257, test_loss: 1.3761, test_f1: 0.6553
 epoch: 78, train_loss: 0.4394, test_loss: 1.6493, test_f1: 0.6345
 epoch: 79, train_loss: 0.4199, test_loss: 1.5955, test_f1: 0.6592
 epoch: 80, train_loss: 0.4326, test_loss: 1.6573, test_f1: 0.6315
 epoch: 81, train_loss: 0.3914, test_loss: 1.6799, test_f1: 0.6144
 epoch: 82, train_loss: 0.3878, test_loss: 1.6566, test_f1: 0.6147
 epoch: 83, train_loss: 0.3949, test_loss: 1.5361, test_f1: 0.5963
 epoch: 84, train_loss: 0.4123, test_loss: 1.6425, test_f1: 0.6228
 epoch: 85, train_loss: 0.4207, test_loss: 1.6082, test_f1: 0.5788
 epoch: 86, train_loss: 0.3976, test_loss: 1.8185, test_f1: 0.6101
 epoch: 87, train_loss: 0.4069, test_loss: 1.5176, test_f1: 0.6193
 epoch: 88, train_loss: 0.4227, test_loss: 1.5689, test_f1: 0.5788
 epoch: 89, train_loss: 0.3960, test_loss: 1.7341, test_f1: 0.6114
 epoch: 90, train_loss: 0.3903, test_loss: 1.4411, test_f1: 0.6049
 epoch: 91, train_loss: 0.3997, test_loss: 1.4978, test_f1: 0.6265
 epoch: 92, train_loss: 0.3872, test_loss: 1.7116, test_f1: 0.5880
 epoch: 93, train_loss: 0.3969, test_loss: 1.4837, test_f1: 0.6267
 epoch: 94, train_loss: 0.3777, test_loss: 1.6541, test_f1: 0.5975
 epoch: 95, train_loss: 0.4171, test_loss: 1.4017, test_f1: 0.6350
 epoch: 96, train_loss: 0.4032, test_loss: 2.0185, test_f1: 0.5819
 epoch: 97, train_loss: 0.3562, test_loss: 1.4529, test_f1: 0.6230
 epoch: 98, train_loss: 0.3629, test_loss: 1.9221, test_f1: 0.5984
 epoch: 99, train_loss: 0.3729, test_loss: 1.6680, test_f1: 0.5841
##################ITERATION #5 ****************************************
 epoch: 0, train_loss: 1.1105, test_loss: 1.2450, test_f1: 0.3986
 epoch: 1, train_loss: 0.9597, test_loss: 1.0505, test_f1: 0.5120
 epoch: 2, train_loss: 0.9313, test_loss: 1.0121, test_f1: 0.5344
 epoch: 3, train_loss: 0.8615, test_loss: 0.9931, test_f1: 0.5310
 epoch: 4, train_loss: 0.8604, test_loss: 1.6604, test_f1: 0.2915
 epoch: 5, train_loss: 0.8704, test_loss: 0.9942, test_f1: 0.5493
 epoch: 6, train_loss: 0.8656, test_loss: 0.9947, test_f1: 0.5761
 epoch: 7, train_loss: 0.8446, test_loss: 1.0842, test_f1: 0.4938
 epoch: 8, train_loss: 0.8094, test_loss: 0.9950, test_f1: 0.5417
 epoch: 9, train_loss: 0.8454, test_loss: 1.2377, test_f1: 0.3937
 epoch: 10, train_loss: 0.7958, test_loss: 1.1006, test_f1: 0.5176
 epoch: 11, train_loss: 0.7812, test_loss: 1.0885, test_f1: 0.5611
 epoch: 12, train_loss: 0.8259, test_loss: 1.1546, test_f1: 0.5257
 epoch: 13, train_loss: 0.7890, test_loss: 1.1479, test_f1: 0.4506
 epoch: 14, train_loss: 0.7578, test_loss: 1.3691, test_f1: 0.4837
 epoch: 15, train_loss: 0.7910, test_loss: 0.9933, test_f1: 0.6230
 epoch: 16, train_loss: 0.7437, test_loss: 1.0603, test_f1: 0.5264
 epoch: 17, train_loss: 0.7491, test_loss: 1.0632, test_f1: 0.5733
 epoch: 18, train_loss: 0.7288, test_loss: 1.1122, test_f1: 0.5907
 epoch: 19, train_loss: 0.7342, test_loss: 1.1464, test_f1: 0.5918
 epoch: 20, train_loss: 0.7081, test_loss: 1.3667, test_f1: 0.5352
 epoch: 21, train_loss: 0.7360, test_loss: 1.0354, test_f1: 0.5338
 epoch: 22, train_loss: 0.7190, test_loss: 1.1809, test_f1: 0.5541
 epoch: 23, train_loss: 0.6932, test_loss: 0.9995, test_f1: 0.6344
 epoch: 24, train_loss: 0.7045, test_loss: 1.3479, test_f1: 0.5498
 epoch: 25, train_loss: 0.7036, test_loss: 1.1070, test_f1: 0.5525
 epoch: 26, train_loss: 0.6987, test_loss: 1.1180, test_f1: 0.5428
 epoch: 27, train_loss: 0.6772, test_loss: 1.7051, test_f1: 0.4535
 epoch: 28, train_loss: 0.6797, test_loss: 1.0499, test_f1: 0.6563
 epoch: 29, train_loss: 0.6601, test_loss: 1.1883, test_f1: 0.6006
 epoch: 30, train_loss: 0.6395, test_loss: 1.4585, test_f1: 0.6012
 epoch: 31, train_loss: 0.6501, test_loss: 1.4530, test_f1: 0.5698
 epoch: 32, train_loss: 0.6500, test_loss: 1.2333, test_f1: 0.6395
 epoch: 33, train_loss: 0.6520, test_loss: 1.5903, test_f1: 0.6237
 epoch: 34, train_loss: 0.6400, test_loss: 1.1136, test_f1: 0.6344
 epoch: 35, train_loss: 0.6382, test_loss: 1.2727, test_f1: 0.6375
 epoch: 36, train_loss: 0.6375, test_loss: 1.2039, test_f1: 0.5648
 epoch: 37, train_loss: 0.6353, test_loss: 1.0627, test_f1: 0.6402
 epoch: 38, train_loss: 0.6100, test_loss: 1.1742, test_f1: 0.6212
 epoch: 39, train_loss: 0.6179, test_loss: 1.1722, test_f1: 0.6094
 epoch: 40, train_loss: 0.5959, test_loss: 1.2117, test_f1: 0.5897
 epoch: 41, train_loss: 0.5946, test_loss: 1.7050, test_f1: 0.5851
 epoch: 42, train_loss: 0.6082, test_loss: 1.2180, test_f1: 0.6152
 epoch: 43, train_loss: 0.6299, test_loss: 1.1666, test_f1: 0.5991
 epoch: 44, train_loss: 0.5717, test_loss: 1.1449, test_f1: 0.6350
 epoch: 45, train_loss: 0.5806, test_loss: 1.7031, test_f1: 0.5680
 epoch: 46, train_loss: 0.5850, test_loss: 1.4649, test_f1: 0.6303
 epoch: 47, train_loss: 0.5902, test_loss: 1.6116, test_f1: 0.4268
 epoch: 48, train_loss: 0.6160, test_loss: 1.1684, test_f1: 0.6380
 epoch: 49, train_loss: 0.5500, test_loss: 1.2622, test_f1: 0.6202
 epoch: 50, train_loss: 0.5485, test_loss: 1.6292, test_f1: 0.5502
 epoch: 51, train_loss: 0.5333, test_loss: 1.3940, test_f1: 0.5982
 epoch: 52, train_loss: 0.5130, test_loss: 1.4920, test_f1: 0.6144
 epoch: 53, train_loss: 0.5049, test_loss: 1.6341, test_f1: 0.6114
 epoch: 54, train_loss: 0.4751, test_loss: 1.8929, test_f1: 0.6023
 epoch: 55, train_loss: 0.4937, test_loss: 1.1979, test_f1: 0.6385
 epoch: 56, train_loss: 0.4931, test_loss: 2.3095, test_f1: 0.5416
 epoch: 57, train_loss: 0.4870, test_loss: 1.3691, test_f1: 0.6342
 epoch: 58, train_loss: 0.4636, test_loss: 1.5782, test_f1: 0.5976
 epoch: 59, train_loss: 0.4642, test_loss: 1.4980, test_f1: 0.6122
 epoch: 60, train_loss: 0.4884, test_loss: 1.6817, test_f1: 0.5961
 epoch: 61, train_loss: 0.4536, test_loss: 1.4835, test_f1: 0.6494
 epoch: 62, train_loss: 0.4745, test_loss: 1.7147, test_f1: 0.6066
 epoch: 63, train_loss: 0.4681, test_loss: 1.5954, test_f1: 0.5769
 epoch: 64, train_loss: 0.4348, test_loss: 1.6990, test_f1: 0.6248
 epoch: 65, train_loss: 0.4477, test_loss: 1.4302, test_f1: 0.6080
 epoch: 66, train_loss: 0.4290, test_loss: 1.5587, test_f1: 0.6533
 epoch: 67, train_loss: 0.4507, test_loss: 1.6036, test_f1: 0.6192
 epoch: 68, train_loss: 0.4031, test_loss: 2.0745, test_f1: 0.6291
 epoch: 69, train_loss: 0.4277, test_loss: 1.7906, test_f1: 0.5890
 epoch: 70, train_loss: 0.4466, test_loss: 1.7307, test_f1: 0.6041
 epoch: 71, train_loss: 0.4477, test_loss: 1.9110, test_f1: 0.5774
 epoch: 72, train_loss: 0.4417, test_loss: 2.3703, test_f1: 0.5619
 epoch: 73, train_loss: 0.4233, test_loss: 1.5568, test_f1: 0.6007
 epoch: 74, train_loss: 0.4054, test_loss: 1.9486, test_f1: 0.6086
 epoch: 75, train_loss: 0.3948, test_loss: 1.6129, test_f1: 0.5888
 epoch: 76, train_loss: 0.4069, test_loss: 1.7172, test_f1: 0.6199
 epoch: 77, train_loss: 0.4230, test_loss: 1.9155, test_f1: 0.5924
 epoch: 78, train_loss: 0.4106, test_loss: 1.8560, test_f1: 0.5717
 epoch: 79, train_loss: 0.3599, test_loss: 2.2138, test_f1: 0.6016
 epoch: 80, train_loss: 0.3901, test_loss: 1.4968, test_f1: 0.6108
 epoch: 81, train_loss: 0.4045, test_loss: 2.1289, test_f1: 0.5943
 epoch: 82, train_loss: 0.3937, test_loss: 1.5034, test_f1: 0.6155
 epoch: 83, train_loss: 0.3877, test_loss: 2.0516, test_f1: 0.6285
 epoch: 84, train_loss: 0.3872, test_loss: 1.8818, test_f1: 0.5987
 epoch: 85, train_loss: 0.4135, test_loss: 1.8874, test_f1: 0.5754
 epoch: 86, train_loss: 0.3520, test_loss: 2.0224, test_f1: 0.5744
 epoch: 87, train_loss: 0.3765, test_loss: 1.9875, test_f1: 0.6233
 epoch: 88, train_loss: 0.3906, test_loss: 1.5847, test_f1: 0.6377
 epoch: 89, train_loss: 0.4169, test_loss: 1.9170, test_f1: 0.6371
 epoch: 90, train_loss: 0.4022, test_loss: 1.6498, test_f1: 0.6213
 epoch: 91, train_loss: 0.3752, test_loss: 2.0148, test_f1: 0.5792
 epoch: 92, train_loss: 0.4041, test_loss: 1.3924, test_f1: 0.6394
 epoch: 93, train_loss: 0.3719, test_loss: 1.8139, test_f1: 0.6078
 epoch: 94, train_loss: 0.3823, test_loss: 1.6288, test_f1: 0.6009
 epoch: 95, train_loss: 0.3976, test_loss: 1.4781, test_f1: 0.6376
 epoch: 96, train_loss: 0.3648, test_loss: 1.7263, test_f1: 0.6085
 epoch: 97, train_loss: 0.4073, test_loss: 1.5591, test_f1: 0.5952
 epoch: 98, train_loss: 0.3911, test_loss: 1.7231, test_f1: 0.5821
 epoch: 99, train_loss: 0.3775, test_loss: 1.9729, test_f1: 0.5907
##################ITERATION #6 ****************************************
 epoch: 0, train_loss: 1.1212, test_loss: 1.1688, test_f1: 0.4626
 epoch: 1, train_loss: 0.9229, test_loss: 1.2879, test_f1: 0.4305
 epoch: 2, train_loss: 0.8855, test_loss: 1.1116, test_f1: 0.4548
 epoch: 3, train_loss: 0.8659, test_loss: 1.0646, test_f1: 0.4941
 epoch: 4, train_loss: 0.8727, test_loss: 1.0947, test_f1: 0.5448
 epoch: 5, train_loss: 0.8403, test_loss: 1.1104, test_f1: 0.4641
 epoch: 6, train_loss: 0.8350, test_loss: 1.1442, test_f1: 0.5188
 epoch: 7, train_loss: 0.8124, test_loss: 1.0637, test_f1: 0.5399
 epoch: 8, train_loss: 0.8066, test_loss: 1.0928, test_f1: 0.5694
 epoch: 9, train_loss: 0.8171, test_loss: 1.0839, test_f1: 0.5480
 epoch: 10, train_loss: 0.7978, test_loss: 1.1407, test_f1: 0.5288
 epoch: 11, train_loss: 0.8103, test_loss: 1.0081, test_f1: 0.5755
 epoch: 12, train_loss: 0.7767, test_loss: 1.0756, test_f1: 0.5401
 epoch: 13, train_loss: 0.7882, test_loss: 0.9550, test_f1: 0.5273
 epoch: 14, train_loss: 0.7711, test_loss: 0.9674, test_f1: 0.5509
 epoch: 15, train_loss: 0.7676, test_loss: 1.1411, test_f1: 0.4808
 epoch: 16, train_loss: 0.8081, test_loss: 0.9964, test_f1: 0.5585
 epoch: 17, train_loss: 0.7644, test_loss: 1.0719, test_f1: 0.5760
 epoch: 18, train_loss: 0.7301, test_loss: 1.1155, test_f1: 0.5584
 epoch: 19, train_loss: 0.7538, test_loss: 1.0271, test_f1: 0.5335
 epoch: 20, train_loss: 0.7308, test_loss: 1.1365, test_f1: 0.5916
 epoch: 21, train_loss: 0.7424, test_loss: 1.0669, test_f1: 0.5506
 epoch: 22, train_loss: 0.7242, test_loss: 0.9893, test_f1: 0.6308
 epoch: 23, train_loss: 0.7351, test_loss: 1.0433, test_f1: 0.5599
 epoch: 24, train_loss: 0.7030, test_loss: 1.1548, test_f1: 0.5234
 epoch: 25, train_loss: 0.6976, test_loss: 0.9686, test_f1: 0.6112
 epoch: 26, train_loss: 0.6950, test_loss: 1.1165, test_f1: 0.5478
 epoch: 27, train_loss: 0.6906, test_loss: 0.9446, test_f1: 0.6780
 epoch: 28, train_loss: 0.6749, test_loss: 1.0648, test_f1: 0.6176
 epoch: 29, train_loss: 0.6742, test_loss: 1.2244, test_f1: 0.5349
 epoch: 30, train_loss: 0.6840, test_loss: 1.0973, test_f1: 0.5731
 epoch: 31, train_loss: 0.7219, test_loss: 0.9594, test_f1: 0.6268
 epoch: 32, train_loss: 0.7114, test_loss: 1.2361, test_f1: 0.4598
 epoch: 33, train_loss: 0.6838, test_loss: 1.2993, test_f1: 0.5142
 epoch: 34, train_loss: 0.6704, test_loss: 1.0741, test_f1: 0.5796
 epoch: 35, train_loss: 0.6415, test_loss: 1.0935, test_f1: 0.5563
 epoch: 36, train_loss: 0.6421, test_loss: 1.0649, test_f1: 0.5879
 epoch: 37, train_loss: 0.6464, test_loss: 1.1717, test_f1: 0.5928
 epoch: 38, train_loss: 0.6130, test_loss: 1.3682, test_f1: 0.5155
 epoch: 39, train_loss: 0.6736, test_loss: 1.2579, test_f1: 0.5911
 epoch: 40, train_loss: 0.6320, test_loss: 1.1547, test_f1: 0.5820
 epoch: 41, train_loss: 0.6514, test_loss: 1.2867, test_f1: 0.5852
 epoch: 42, train_loss: 0.6662, test_loss: 1.2068, test_f1: 0.5654
 epoch: 43, train_loss: 0.6182, test_loss: 1.0296, test_f1: 0.5972
 epoch: 44, train_loss: 0.6216, test_loss: 1.1312, test_f1: 0.6416
 epoch: 45, train_loss: 0.6153, test_loss: 1.1976, test_f1: 0.5855
 epoch: 46, train_loss: 0.6134, test_loss: 1.0067, test_f1: 0.6660
 epoch: 47, train_loss: 0.5992, test_loss: 1.6766, test_f1: 0.5047
 epoch: 48, train_loss: 0.6147, test_loss: 1.1080, test_f1: 0.6284
 epoch: 49, train_loss: 0.6213, test_loss: 1.1427, test_f1: 0.5646
 epoch: 50, train_loss: 0.6108, test_loss: 1.0510, test_f1: 0.6273
 epoch: 51, train_loss: 0.5528, test_loss: 1.0720, test_f1: 0.6773
 epoch: 52, train_loss: 0.5514, test_loss: 1.2017, test_f1: 0.5915
 epoch: 53, train_loss: 0.5319, test_loss: 1.1519, test_f1: 0.6468
 epoch: 54, train_loss: 0.5022, test_loss: 1.1628, test_f1: 0.6406
 epoch: 55, train_loss: 0.5066, test_loss: 1.0800, test_f1: 0.6680
 epoch: 56, train_loss: 0.4999, test_loss: 1.2601, test_f1: 0.6021
 epoch: 57, train_loss: 0.5008, test_loss: 1.1493, test_f1: 0.6167
 epoch: 58, train_loss: 0.4915, test_loss: 1.2099, test_f1: 0.6457
 epoch: 59, train_loss: 0.5062, test_loss: 1.3479, test_f1: 0.6039
 epoch: 60, train_loss: 0.5000, test_loss: 1.6584, test_f1: 0.5833
 epoch: 61, train_loss: 0.4952, test_loss: 1.2818, test_f1: 0.6149
 epoch: 62, train_loss: 0.4780, test_loss: 1.2880, test_f1: 0.6305
 epoch: 63, train_loss: 0.4955, test_loss: 1.2369, test_f1: 0.6460
 epoch: 64, train_loss: 0.5040, test_loss: 1.3435, test_f1: 0.6441
 epoch: 65, train_loss: 0.5139, test_loss: 1.2268, test_f1: 0.6295
 epoch: 66, train_loss: 0.4564, test_loss: 1.3678, test_f1: 0.5864
 epoch: 67, train_loss: 0.4790, test_loss: 1.2342, test_f1: 0.6478
 epoch: 68, train_loss: 0.4673, test_loss: 1.3118, test_f1: 0.6532
 epoch: 69, train_loss: 0.4777, test_loss: 1.4356, test_f1: 0.6393
 epoch: 70, train_loss: 0.4671, test_loss: 1.2208, test_f1: 0.6449
 epoch: 71, train_loss: 0.4449, test_loss: 1.5007, test_f1: 0.6052
 epoch: 72, train_loss: 0.4730, test_loss: 1.1972, test_f1: 0.6292
 epoch: 73, train_loss: 0.4735, test_loss: 1.2501, test_f1: 0.6802
 epoch: 74, train_loss: 0.4635, test_loss: 1.3457, test_f1: 0.6403
 epoch: 75, train_loss: 0.4467, test_loss: 1.4887, test_f1: 0.6334
 epoch: 76, train_loss: 0.4169, test_loss: 1.5903, test_f1: 0.6005
 epoch: 77, train_loss: 0.4291, test_loss: 1.4303, test_f1: 0.6001
 epoch: 78, train_loss: 0.4452, test_loss: 1.3271, test_f1: 0.6711
 epoch: 79, train_loss: 0.4356, test_loss: 1.2631, test_f1: 0.6258
 epoch: 80, train_loss: 0.4669, test_loss: 1.3968, test_f1: 0.6601
 epoch: 81, train_loss: 0.4420, test_loss: 1.6204, test_f1: 0.6432
 epoch: 82, train_loss: 0.4714, test_loss: 1.3651, test_f1: 0.6404
 epoch: 83, train_loss: 0.4209, test_loss: 1.3301, test_f1: 0.6385
 epoch: 84, train_loss: 0.4198, test_loss: 1.7117, test_f1: 0.5895
 epoch: 85, train_loss: 0.4333, test_loss: 1.4579, test_f1: 0.6357
 epoch: 86, train_loss: 0.4176, test_loss: 1.3745, test_f1: 0.6836
 epoch: 87, train_loss: 0.4133, test_loss: 1.4783, test_f1: 0.6389
 epoch: 88, train_loss: 0.4232, test_loss: 1.4910, test_f1: 0.6255
 epoch: 89, train_loss: 0.4254, test_loss: 1.5523, test_f1: 0.5917
 epoch: 90, train_loss: 0.4006, test_loss: 1.5272, test_f1: 0.6287
 epoch: 91, train_loss: 0.3875, test_loss: 1.5311, test_f1: 0.5989
 epoch: 92, train_loss: 0.3630, test_loss: 1.6651, test_f1: 0.6140
 epoch: 93, train_loss: 0.4047, test_loss: 1.6656, test_f1: 0.6147
 epoch: 94, train_loss: 0.4014, test_loss: 1.7074, test_f1: 0.5775
 epoch: 95, train_loss: 0.3815, test_loss: 1.7300, test_f1: 0.6212
 epoch: 96, train_loss: 0.3943, test_loss: 1.3396, test_f1: 0.6432
 epoch: 97, train_loss: 0.4013, test_loss: 1.5221, test_f1: 0.6267
 epoch: 98, train_loss: 0.3837, test_loss: 1.6715, test_f1: 0.6311
 epoch: 99, train_loss: 0.4302, test_loss: 1.5425, test_f1: 0.6423
##################ITERATION #7 ****************************************
 epoch: 0, train_loss: 1.1456, test_loss: 1.1054, test_f1: 0.4785
 epoch: 1, train_loss: 0.9501, test_loss: 1.0623, test_f1: 0.4647
 epoch: 2, train_loss: 0.9142, test_loss: 1.0398, test_f1: 0.4850
 epoch: 3, train_loss: 0.8883, test_loss: 1.0793, test_f1: 0.4741
 epoch: 4, train_loss: 0.8935, test_loss: 0.9980, test_f1: 0.5251
 epoch: 5, train_loss: 0.8785, test_loss: 1.0076, test_f1: 0.5488
 epoch: 6, train_loss: 0.8572, test_loss: 1.0520, test_f1: 0.4693
 epoch: 7, train_loss: 0.8466, test_loss: 1.0633, test_f1: 0.5010
 epoch: 8, train_loss: 0.8445, test_loss: 1.2951, test_f1: 0.4966
 epoch: 9, train_loss: 0.8165, test_loss: 1.0054, test_f1: 0.4881
 epoch: 10, train_loss: 0.8154, test_loss: 1.0841, test_f1: 0.4889
 epoch: 11, train_loss: 0.7974, test_loss: 1.1609, test_f1: 0.4324
 epoch: 12, train_loss: 0.8026, test_loss: 1.2891, test_f1: 0.5056
 epoch: 13, train_loss: 0.8097, test_loss: 1.0266, test_f1: 0.4659
 epoch: 14, train_loss: 0.7694, test_loss: 1.0140, test_f1: 0.5304
 epoch: 15, train_loss: 0.7932, test_loss: 1.4026, test_f1: 0.4318
 epoch: 16, train_loss: 0.7855, test_loss: 1.4335, test_f1: 0.4951
 epoch: 17, train_loss: 0.7581, test_loss: 1.0815, test_f1: 0.5659
 epoch: 18, train_loss: 0.7525, test_loss: 1.3705, test_f1: 0.4713
 epoch: 19, train_loss: 0.7696, test_loss: 1.1031, test_f1: 0.5484
 epoch: 20, train_loss: 0.7522, test_loss: 1.3938, test_f1: 0.4902
 epoch: 21, train_loss: 0.7160, test_loss: 1.0711, test_f1: 0.4883
 epoch: 22, train_loss: 0.7312, test_loss: 1.0617, test_f1: 0.5270
 epoch: 23, train_loss: 0.7080, test_loss: 1.6286, test_f1: 0.4985
 epoch: 24, train_loss: 0.7102, test_loss: 1.2985, test_f1: 0.5264
 epoch: 25, train_loss: 0.7036, test_loss: 1.1707, test_f1: 0.5263
 epoch: 26, train_loss: 0.7308, test_loss: 1.0251, test_f1: 0.6248
 epoch: 27, train_loss: 0.6900, test_loss: 1.0821, test_f1: 0.5788
 epoch: 28, train_loss: 0.6971, test_loss: 1.2701, test_f1: 0.5451
 epoch: 29, train_loss: 0.6859, test_loss: 1.3980, test_f1: 0.5487
 epoch: 30, train_loss: 0.6993, test_loss: 1.4030, test_f1: 0.4671
 epoch: 31, train_loss: 0.6820, test_loss: 1.2522, test_f1: 0.4510
 epoch: 32, train_loss: 0.6747, test_loss: 1.1900, test_f1: 0.5398
 epoch: 33, train_loss: 0.6610, test_loss: 1.1502, test_f1: 0.5513
 epoch: 34, train_loss: 0.6705, test_loss: 1.5711, test_f1: 0.6041
 epoch: 35, train_loss: 0.6690, test_loss: 1.1490, test_f1: 0.5524
 epoch: 36, train_loss: 0.6758, test_loss: 1.3209, test_f1: 0.5182
 epoch: 37, train_loss: 0.6783, test_loss: 1.2511, test_f1: 0.5448
 epoch: 38, train_loss: 0.6550, test_loss: 1.2162, test_f1: 0.5395
 epoch: 39, train_loss: 0.6383, test_loss: 1.1420, test_f1: 0.5651
 epoch: 40, train_loss: 0.6365, test_loss: 2.3683, test_f1: 0.5148
 epoch: 41, train_loss: 0.6817, test_loss: 4.3933, test_f1: 0.2788
 epoch: 42, train_loss: 0.6336, test_loss: 1.2633, test_f1: 0.5724
 epoch: 43, train_loss: 0.6371, test_loss: 2.1253, test_f1: 0.4430
 epoch: 44, train_loss: 0.6251, test_loss: 1.1658, test_f1: 0.5757
 epoch: 45, train_loss: 0.6280, test_loss: 1.1209, test_f1: 0.5545
 epoch: 46, train_loss: 0.6462, test_loss: 1.0586, test_f1: 0.6156
 epoch: 47, train_loss: 0.6097, test_loss: 1.2895, test_f1: 0.6296
 epoch: 48, train_loss: 0.6197, test_loss: 1.3562, test_f1: 0.5353
 epoch: 49, train_loss: 0.5954, test_loss: 1.2287, test_f1: 0.5328
 epoch: 50, train_loss: 0.5659, test_loss: 1.4192, test_f1: 0.5486
 epoch: 51, train_loss: 0.5581, test_loss: 1.3439, test_f1: 0.5416
 epoch: 52, train_loss: 0.5086, test_loss: 1.2276, test_f1: 0.6104
 epoch: 53, train_loss: 0.5097, test_loss: 1.5490, test_f1: 0.6376
 epoch: 54, train_loss: 0.5492, test_loss: 1.1527, test_f1: 0.5878
 epoch: 55, train_loss: 0.5162, test_loss: 1.5555, test_f1: 0.6173
 epoch: 56, train_loss: 0.5029, test_loss: 1.4227, test_f1: 0.5999
 epoch: 57, train_loss: 0.5157, test_loss: 1.9308, test_f1: 0.5751
 epoch: 58, train_loss: 0.5117, test_loss: 1.1797, test_f1: 0.6367
 epoch: 59, train_loss: 0.4723, test_loss: 1.3412, test_f1: 0.6219
 epoch: 60, train_loss: 0.4856, test_loss: 1.2996, test_f1: 0.6135
 epoch: 61, train_loss: 0.5156, test_loss: 1.2454, test_f1: 0.6080
 epoch: 62, train_loss: 0.4660, test_loss: 1.2194, test_f1: 0.5930
 epoch: 63, train_loss: 0.4760, test_loss: 1.5103, test_f1: 0.6050
 epoch: 64, train_loss: 0.4444, test_loss: 1.3348, test_f1: 0.6111
 epoch: 65, train_loss: 0.4900, test_loss: 1.7767, test_f1: 0.5710
 epoch: 66, train_loss: 0.4587, test_loss: 1.2999, test_f1: 0.6353
 epoch: 67, train_loss: 0.4628, test_loss: 1.2346, test_f1: 0.5959
 epoch: 68, train_loss: 0.4577, test_loss: 1.3132, test_f1: 0.6009
 epoch: 69, train_loss: 0.4193, test_loss: 1.4359, test_f1: 0.6070
 epoch: 70, train_loss: 0.4450, test_loss: 1.5373, test_f1: 0.5990
 epoch: 71, train_loss: 0.4791, test_loss: 1.4377, test_f1: 0.6532
 epoch: 72, train_loss: 0.4425, test_loss: 1.4279, test_f1: 0.6626
 epoch: 73, train_loss: 0.4344, test_loss: 1.5958, test_f1: 0.5537
 epoch: 74, train_loss: 0.4189, test_loss: 1.7920, test_f1: 0.6177
 epoch: 75, train_loss: 0.4481, test_loss: 1.2585, test_f1: 0.6112
 epoch: 76, train_loss: 0.4152, test_loss: 1.5317, test_f1: 0.6198
 epoch: 77, train_loss: 0.4494, test_loss: 1.2375, test_f1: 0.6245
 epoch: 78, train_loss: 0.4511, test_loss: 1.4012, test_f1: 0.6593
 epoch: 79, train_loss: 0.3934, test_loss: 1.4712, test_f1: 0.6620
 epoch: 80, train_loss: 0.4183, test_loss: 1.5663, test_f1: 0.5753
 epoch: 81, train_loss: 0.4213, test_loss: 1.5344, test_f1: 0.6188
 epoch: 82, train_loss: 0.4244, test_loss: 1.3768, test_f1: 0.6236
 epoch: 83, train_loss: 0.4188, test_loss: 1.5973, test_f1: 0.6406
 epoch: 84, train_loss: 0.3888, test_loss: 1.7496, test_f1: 0.5690
 epoch: 85, train_loss: 0.3756, test_loss: 1.5804, test_f1: 0.6109
 epoch: 86, train_loss: 0.4182, test_loss: 1.3187, test_f1: 0.6491
 epoch: 87, train_loss: 0.4004, test_loss: 1.5927, test_f1: 0.5702
 epoch: 88, train_loss: 0.4149, test_loss: 1.5452, test_f1: 0.6402
 epoch: 89, train_loss: 0.4042, test_loss: 1.3792, test_f1: 0.6153
 epoch: 90, train_loss: 0.3991, test_loss: 1.5309, test_f1: 0.6374
 epoch: 91, train_loss: 0.3860, test_loss: 1.4693, test_f1: 0.5937
 epoch: 92, train_loss: 0.3672, test_loss: 1.5704, test_f1: 0.6578
 epoch: 93, train_loss: 0.4023, test_loss: 1.8424, test_f1: 0.5684
 epoch: 94, train_loss: 0.4246, test_loss: 1.7365, test_f1: 0.6021
 epoch: 95, train_loss: 0.3967, test_loss: 1.4755, test_f1: 0.6336
 epoch: 96, train_loss: 0.3979, test_loss: 1.4794, test_f1: 0.6157
 epoch: 97, train_loss: 0.3633, test_loss: 2.3370, test_f1: 0.5456
 epoch: 98, train_loss: 0.3974, test_loss: 1.4600, test_f1: 0.6028
 epoch: 99, train_loss: 0.3691, test_loss: 1.6747, test_f1: 0.6139
##################ITERATION #8 ****************************************
 epoch: 0, train_loss: 1.1550, test_loss: 1.2459, test_f1: 0.3173
 epoch: 1, train_loss: 0.9723, test_loss: 1.1082, test_f1: 0.4214
 epoch: 2, train_loss: 0.9523, test_loss: 1.1840, test_f1: 0.3988
 epoch: 3, train_loss: 0.9118, test_loss: 1.0119, test_f1: 0.4821
 epoch: 4, train_loss: 0.8867, test_loss: 0.9905, test_f1: 0.5601
 epoch: 5, train_loss: 0.9010, test_loss: 1.0128, test_f1: 0.5702
 epoch: 6, train_loss: 0.8399, test_loss: 1.0099, test_f1: 0.5634
 epoch: 7, train_loss: 0.8160, test_loss: 1.0371, test_f1: 0.5445
 epoch: 8, train_loss: 0.8340, test_loss: 1.0176, test_f1: 0.5345
 epoch: 9, train_loss: 0.8175, test_loss: 1.0565, test_f1: 0.5791
 epoch: 10, train_loss: 0.7875, test_loss: 0.9769, test_f1: 0.5878
 epoch: 11, train_loss: 0.7849, test_loss: 0.9811, test_f1: 0.5461
 epoch: 12, train_loss: 0.7738, test_loss: 0.9962, test_f1: 0.5662
 epoch: 13, train_loss: 0.7473, test_loss: 1.0285, test_f1: 0.5616
 epoch: 14, train_loss: 0.7435, test_loss: 0.9483, test_f1: 0.5827
 epoch: 15, train_loss: 0.7340, test_loss: 1.1878, test_f1: 0.4249
 epoch: 16, train_loss: 0.7538, test_loss: 0.9548, test_f1: 0.5853
 epoch: 17, train_loss: 0.7406, test_loss: 1.1227, test_f1: 0.4883
 epoch: 18, train_loss: 0.7461, test_loss: 1.0923, test_f1: 0.5316
 epoch: 19, train_loss: 0.7207, test_loss: 1.0244, test_f1: 0.5428
 epoch: 20, train_loss: 0.7163, test_loss: 1.0193, test_f1: 0.5189
 epoch: 21, train_loss: 0.7109, test_loss: 1.5672, test_f1: 0.5483
 epoch: 22, train_loss: 0.6904, test_loss: 1.0646, test_f1: 0.4851
 epoch: 23, train_loss: 0.6836, test_loss: 1.1567, test_f1: 0.5514
 epoch: 24, train_loss: 0.6783, test_loss: 0.9459, test_f1: 0.5968
 epoch: 25, train_loss: 0.6354, test_loss: 1.1371, test_f1: 0.5536
 epoch: 26, train_loss: 0.6591, test_loss: 1.0901, test_f1: 0.5953
 epoch: 27, train_loss: 0.6533, test_loss: 1.0869, test_f1: 0.5594
 epoch: 28, train_loss: 0.6710, test_loss: 1.2006, test_f1: 0.5379
 epoch: 29, train_loss: 0.6758, test_loss: 1.0006, test_f1: 0.6415
 epoch: 30, train_loss: 0.6675, test_loss: 1.1478, test_f1: 0.5638
 epoch: 31, train_loss: 0.6613, test_loss: 1.1212, test_f1: 0.5451
 epoch: 32, train_loss: 0.6621, test_loss: 1.3084, test_f1: 0.5414
 epoch: 33, train_loss: 0.6522, test_loss: 1.3302, test_f1: 0.5321
 epoch: 34, train_loss: 0.6354, test_loss: 1.1490, test_f1: 0.5405
 epoch: 35, train_loss: 0.6562, test_loss: 1.0697, test_f1: 0.5657
 epoch: 36, train_loss: 0.6130, test_loss: 1.2910, test_f1: 0.5950
 epoch: 37, train_loss: 0.5718, test_loss: 1.1607, test_f1: 0.5495
 epoch: 38, train_loss: 0.6293, test_loss: 1.0233, test_f1: 0.6313
 epoch: 39, train_loss: 0.6318, test_loss: 1.0966, test_f1: 0.5625
 epoch: 40, train_loss: 0.6095, test_loss: 1.2894, test_f1: 0.5279
 epoch: 41, train_loss: 0.6042, test_loss: 1.3299, test_f1: 0.5506
 epoch: 42, train_loss: 0.6072, test_loss: 1.1629, test_f1: 0.6141
 epoch: 43, train_loss: 0.5822, test_loss: 1.2180, test_f1: 0.5609
 epoch: 44, train_loss: 0.5685, test_loss: 1.0828, test_f1: 0.6011
 epoch: 45, train_loss: 0.5663, test_loss: 1.3142, test_f1: 0.5737
 epoch: 46, train_loss: 0.5469, test_loss: 1.3143, test_f1: 0.5828
 epoch: 47, train_loss: 0.5639, test_loss: 1.1914, test_f1: 0.5776
 epoch: 48, train_loss: 0.5668, test_loss: 1.4002, test_f1: 0.6243
 epoch: 49, train_loss: 0.5902, test_loss: 1.2232, test_f1: 0.6109
 epoch: 50, train_loss: 0.5517, test_loss: 1.2815, test_f1: 0.5692
 epoch: 51, train_loss: 0.5232, test_loss: 1.1499, test_f1: 0.6269
 epoch: 52, train_loss: 0.4800, test_loss: 1.2389, test_f1: 0.5868
 epoch: 53, train_loss: 0.5188, test_loss: 1.3107, test_f1: 0.5825
 epoch: 54, train_loss: 0.4570, test_loss: 1.2821, test_f1: 0.6049
 epoch: 55, train_loss: 0.4515, test_loss: 1.2549, test_f1: 0.5909
 epoch: 56, train_loss: 0.4218, test_loss: 1.2901, test_f1: 0.6451
 epoch: 57, train_loss: 0.4959, test_loss: 1.2738, test_f1: 0.5824
 epoch: 58, train_loss: 0.4705, test_loss: 1.3187, test_f1: 0.5878
 epoch: 59, train_loss: 0.4425, test_loss: 1.3582, test_f1: 0.5971
 epoch: 60, train_loss: 0.4417, test_loss: 1.3256, test_f1: 0.6358
 epoch: 61, train_loss: 0.4477, test_loss: 1.2565, test_f1: 0.6266
 epoch: 62, train_loss: 0.4559, test_loss: 1.3027, test_f1: 0.6213
 epoch: 63, train_loss: 0.4351, test_loss: 1.2785, test_f1: 0.6406
 epoch: 64, train_loss: 0.4374, test_loss: 1.5668, test_f1: 0.5691
 epoch: 65, train_loss: 0.4205, test_loss: 1.2498, test_f1: 0.6251
 epoch: 66, train_loss: 0.4109, test_loss: 1.7054, test_f1: 0.5895
 epoch: 67, train_loss: 0.3977, test_loss: 1.5184, test_f1: 0.5963
 epoch: 68, train_loss: 0.4233, test_loss: 1.3884, test_f1: 0.6366
 epoch: 69, train_loss: 0.4022, test_loss: 1.3953, test_f1: 0.6047
 epoch: 70, train_loss: 0.4383, test_loss: 1.2831, test_f1: 0.6473
 epoch: 71, train_loss: 0.3959, test_loss: 1.4094, test_f1: 0.6456
 epoch: 72, train_loss: 0.3985, test_loss: 1.3331, test_f1: 0.6276
 epoch: 73, train_loss: 0.4018, test_loss: 1.3691, test_f1: 0.6453
 epoch: 74, train_loss: 0.4164, test_loss: 1.3853, test_f1: 0.6049
 epoch: 75, train_loss: 0.3871, test_loss: 1.4988, test_f1: 0.5941
 epoch: 76, train_loss: 0.3866, test_loss: 1.6819, test_f1: 0.5882
 epoch: 77, train_loss: 0.3795, test_loss: 1.3958, test_f1: 0.6430
 epoch: 78, train_loss: 0.3839, test_loss: 1.4901, test_f1: 0.6297
 epoch: 79, train_loss: 0.4030, test_loss: 1.7931, test_f1: 0.6164
 epoch: 80, train_loss: 0.3887, test_loss: 1.5465, test_f1: 0.6238
 epoch: 81, train_loss: 0.3887, test_loss: 1.5456, test_f1: 0.6187
 epoch: 82, train_loss: 0.4150, test_loss: 1.5734, test_f1: 0.5288
 epoch: 83, train_loss: 0.3944, test_loss: 1.4178, test_f1: 0.6044
 epoch: 84, train_loss: 0.4023, test_loss: 1.4002, test_f1: 0.6309
 epoch: 85, train_loss: 0.3655, test_loss: 1.6425, test_f1: 0.5736
 epoch: 86, train_loss: 0.3419, test_loss: 1.6774, test_f1: 0.6197
 epoch: 87, train_loss: 0.3737, test_loss: 1.8315, test_f1: 0.5837
 epoch: 88, train_loss: 0.3690, test_loss: 1.6994, test_f1: 0.6010
 epoch: 89, train_loss: 0.3559, test_loss: 1.5343, test_f1: 0.6325
 epoch: 90, train_loss: 0.3619, test_loss: 1.4115, test_f1: 0.6358
 epoch: 91, train_loss: 0.3629, test_loss: 1.9033, test_f1: 0.5562
 epoch: 92, train_loss: 0.4060, test_loss: 1.5057, test_f1: 0.6141
 epoch: 93, train_loss: 0.3120, test_loss: 1.5663, test_f1: 0.6340
 epoch: 94, train_loss: 0.3616, test_loss: 1.5444, test_f1: 0.5508
 epoch: 95, train_loss: 0.3873, test_loss: 1.7363, test_f1: 0.5935
 epoch: 96, train_loss: 0.3841, test_loss: 1.5694, test_f1: 0.6026
 epoch: 97, train_loss: 0.3972, test_loss: 1.5834, test_f1: 0.6220
 epoch: 98, train_loss: 0.3983, test_loss: 1.6987, test_f1: 0.5748
 epoch: 99, train_loss: 0.3723, test_loss: 1.8849, test_f1: 0.5854
##################ITERATION #9 ****************************************
 epoch: 0, train_loss: 1.1212, test_loss: 1.1254, test_f1: 0.3370
 epoch: 1, train_loss: 1.0238, test_loss: 1.0565, test_f1: 0.4110
 epoch: 2, train_loss: 0.9645, test_loss: 1.1391, test_f1: 0.3915
 epoch: 3, train_loss: 0.9142, test_loss: 0.9919, test_f1: 0.5273
 epoch: 4, train_loss: 0.8975, test_loss: 1.0257, test_f1: 0.4633
 epoch: 5, train_loss: 0.9015, test_loss: 1.0399, test_f1: 0.4083
 epoch: 6, train_loss: 0.8723, test_loss: 1.0207, test_f1: 0.5226
 epoch: 7, train_loss: 0.8624, test_loss: 1.0065, test_f1: 0.5465
 epoch: 8, train_loss: 0.8478, test_loss: 0.9942, test_f1: 0.4674
 epoch: 9, train_loss: 0.8579, test_loss: 1.5458, test_f1: 0.3639
 epoch: 10, train_loss: 0.8703, test_loss: 1.3638, test_f1: 0.3796
 epoch: 11, train_loss: 0.8422, test_loss: 1.0187, test_f1: 0.5480
 epoch: 12, train_loss: 0.8279, test_loss: 1.0066, test_f1: 0.5393
 epoch: 13, train_loss: 0.8256, test_loss: 1.0398, test_f1: 0.4978
 epoch: 14, train_loss: 0.7989, test_loss: 0.9417, test_f1: 0.6136
 epoch: 15, train_loss: 0.7963, test_loss: 1.0616, test_f1: 0.5211
 epoch: 16, train_loss: 0.8034, test_loss: 1.0208, test_f1: 0.5381
 epoch: 17, train_loss: 0.8059, test_loss: 0.9867, test_f1: 0.5867
 epoch: 18, train_loss: 0.7874, test_loss: 1.0223, test_f1: 0.5120
 epoch: 19, train_loss: 0.7676, test_loss: 1.0216, test_f1: 0.5920
 epoch: 20, train_loss: 0.7684, test_loss: 1.5023, test_f1: 0.5513
 epoch: 21, train_loss: 0.7732, test_loss: 0.9814, test_f1: 0.5951
 epoch: 22, train_loss: 0.7587, test_loss: 1.2396, test_f1: 0.5501
 epoch: 23, train_loss: 0.7745, test_loss: 1.1858, test_f1: 0.4785
 epoch: 24, train_loss: 0.7877, test_loss: 0.9501, test_f1: 0.6002
 epoch: 25, train_loss: 0.7379, test_loss: 1.0696, test_f1: 0.5502
 epoch: 26, train_loss: 0.7281, test_loss: 1.1756, test_f1: 0.4557
 epoch: 27, train_loss: 0.7299, test_loss: 1.0189, test_f1: 0.5516
 epoch: 28, train_loss: 0.7094, test_loss: 1.0052, test_f1: 0.5795
 epoch: 29, train_loss: 0.7141, test_loss: 0.9963, test_f1: 0.6295
 epoch: 30, train_loss: 0.6947, test_loss: 1.5655, test_f1: 0.5567
 epoch: 31, train_loss: 0.6879, test_loss: 1.0239, test_f1: 0.5757
 epoch: 32, train_loss: 0.6906, test_loss: 1.3282, test_f1: 0.6055
 epoch: 33, train_loss: 0.7136, test_loss: 0.9981, test_f1: 0.5752
 epoch: 34, train_loss: 0.7084, test_loss: 1.0191, test_f1: 0.5490
 epoch: 35, train_loss: 0.7218, test_loss: 1.1960, test_f1: 0.5710
 epoch: 36, train_loss: 0.6801, test_loss: 1.2183, test_f1: 0.4656
 epoch: 37, train_loss: 0.6730, test_loss: 0.9937, test_f1: 0.5704
 epoch: 38, train_loss: 0.6818, test_loss: 0.9350, test_f1: 0.6291
 epoch: 39, train_loss: 0.6576, test_loss: 0.9698, test_f1: 0.5944
 epoch: 40, train_loss: 0.6355, test_loss: 1.0985, test_f1: 0.5591
 epoch: 41, train_loss: 0.6572, test_loss: 1.5502, test_f1: 0.6197
 epoch: 42, train_loss: 0.6625, test_loss: 1.1803, test_f1: 0.5622
 epoch: 43, train_loss: 0.6480, test_loss: 1.4662, test_f1: 0.5787
 epoch: 44, train_loss: 0.6447, test_loss: 1.0366, test_f1: 0.6290
 epoch: 45, train_loss: 0.6352, test_loss: 1.2174, test_f1: 0.5641
 epoch: 46, train_loss: 0.6310, test_loss: 1.0298, test_f1: 0.5988
 epoch: 47, train_loss: 0.6436, test_loss: 1.4211, test_f1: 0.5320
 epoch: 48, train_loss: 0.6525, test_loss: 1.0636, test_f1: 0.5730
 epoch: 49, train_loss: 0.5987, test_loss: 1.1655, test_f1: 0.5997
 epoch: 50, train_loss: 0.6150, test_loss: 1.2637, test_f1: 0.5980
 epoch: 51, train_loss: 0.5792, test_loss: 1.1206, test_f1: 0.6104
 epoch: 52, train_loss: 0.5525, test_loss: 1.3574, test_f1: 0.6405
 epoch: 53, train_loss: 0.5654, test_loss: 1.2392, test_f1: 0.6161
 epoch: 54, train_loss: 0.5356, test_loss: 1.3002, test_f1: 0.6247
 epoch: 55, train_loss: 0.5291, test_loss: 1.7309, test_f1: 0.6220
 epoch: 56, train_loss: 0.5576, test_loss: 1.4636, test_f1: 0.6180
 epoch: 57, train_loss: 0.5546, test_loss: 1.3649, test_f1: 0.6167
 epoch: 58, train_loss: 0.5217, test_loss: 1.3787, test_f1: 0.6220
 epoch: 59, train_loss: 0.5265, test_loss: 1.3534, test_f1: 0.6061
 epoch: 60, train_loss: 0.4953, test_loss: 1.5031, test_f1: 0.5987
 epoch: 61, train_loss: 0.4955, test_loss: 1.2329, test_f1: 0.6309
 epoch: 62, train_loss: 0.5176, test_loss: 1.4262, test_f1: 0.6318
 epoch: 63, train_loss: 0.5148, test_loss: 1.5867, test_f1: 0.6319
 epoch: 64, train_loss: 0.5282, test_loss: 1.3196, test_f1: 0.6187
 epoch: 65, train_loss: 0.5007, test_loss: 1.2869, test_f1: 0.5966
 epoch: 66, train_loss: 0.5181, test_loss: 1.2836, test_f1: 0.6167
 epoch: 67, train_loss: 0.4840, test_loss: 1.3994, test_f1: 0.6123
 epoch: 68, train_loss: 0.4855, test_loss: 1.5888, test_f1: 0.6057
 epoch: 69, train_loss: 0.4728, test_loss: 1.3431, test_f1: 0.6020
 epoch: 70, train_loss: 0.4730, test_loss: 1.0951, test_f1: 0.6507
 epoch: 71, train_loss: 0.5010, test_loss: 2.0784, test_f1: 0.6209
 epoch: 72, train_loss: 0.4439, test_loss: 1.5431, test_f1: 0.5901
 epoch: 73, train_loss: 0.4500, test_loss: 1.2641, test_f1: 0.6124
 epoch: 74, train_loss: 0.4894, test_loss: 1.4607, test_f1: 0.5701
 epoch: 75, train_loss: 0.4918, test_loss: 1.6966, test_f1: 0.6087
 epoch: 76, train_loss: 0.4763, test_loss: 1.6026, test_f1: 0.5639
 epoch: 77, train_loss: 0.4657, test_loss: 1.7143, test_f1: 0.6091
 epoch: 78, train_loss: 0.4489, test_loss: 1.3112, test_f1: 0.6111
 epoch: 79, train_loss: 0.4593, test_loss: 1.5319, test_f1: 0.5994
 epoch: 80, train_loss: 0.4386, test_loss: 1.7899, test_f1: 0.5783
 epoch: 81, train_loss: 0.4129, test_loss: 1.4805, test_f1: 0.5847
 epoch: 82, train_loss: 0.4439, test_loss: 1.6251, test_f1: 0.5800
 epoch: 83, train_loss: 0.4496, test_loss: 1.5293, test_f1: 0.6408
 epoch: 84, train_loss: 0.4606, test_loss: 1.6403, test_f1: 0.6146
 epoch: 85, train_loss: 0.3978, test_loss: 2.0010, test_f1: 0.6219
 epoch: 86, train_loss: 0.4043, test_loss: 1.6999, test_f1: 0.6003
 epoch: 87, train_loss: 0.4429, test_loss: 1.3670, test_f1: 0.6369
 epoch: 88, train_loss: 0.4223, test_loss: 1.7044, test_f1: 0.6142
 epoch: 89, train_loss: 0.4506, test_loss: 1.9471, test_f1: 0.6076
 epoch: 90, train_loss: 0.4041, test_loss: 1.8391, test_f1: 0.5969
 epoch: 91, train_loss: 0.3941, test_loss: 1.6362, test_f1: 0.6010
 epoch: 92, train_loss: 0.4238, test_loss: 1.6194, test_f1: 0.6091
 epoch: 93, train_loss: 0.4200, test_loss: 1.6922, test_f1: 0.5983
 epoch: 94, train_loss: 0.4272, test_loss: 2.0006, test_f1: 0.6221
 epoch: 95, train_loss: 0.4072, test_loss: 2.1751, test_f1: 0.5440
 epoch: 96, train_loss: 0.4210, test_loss: 1.5458, test_f1: 0.6343
 epoch: 97, train_loss: 0.3763, test_loss: 1.7953, test_f1: 0.6055
 epoch: 98, train_loss: 0.4018, test_loss: 1.6676, test_f1: 0.5984
 epoch: 99, train_loss: 0.3995, test_loss: 2.1005, test_f1: 0.5816

Training completed in 504.94 seconds
Best F1: 0.6838 at epoch 82
Mean F1 across iterations: 0.6606  0.0124
========================FINAL RESULTS================================
FEGIN weighted F1: 0.6838  0.0124
python main.py --data ltspice_demos --representation component_pin_net --model FEGIN --layers 2 --hiddens 64 --batch_size 32 --lr 0.01 --emb_size 128 --epochs 100 --save_appendix component_pin_net_L2_H64_BS32_LR0.01_E128 --no_val
-----



STDERR:
  File "main.py", line 370, in <module>
    main()
  File "main.py", line 254, in main
    dataset = dataset_class(
  File "/home/philip/projects/ltspice_examples_code_repo/Circuit-Completion-Using-GNNs/component_classification_with_link_prediction_head/evaluation/FEGIN/kernel/circuit_datasets.py", line 15, in __init__
    self.data, self.slices = torch.load(self.processed_paths[0])
  File "/home/philip/.local/lib/python3.8/site-packages/torch/serialization.py", line 1040, in load
    warnings.warn(
  File "/usr/lib/python3.8/warnings.py", line 109, in _showwarnmsg
    sw(msg.message, msg.category, msg.filename, msg.lineno,
  File "main.py", line 47, in warn_with_traceback
    traceback.print_stack(file=log)
/home/philip/projects/ltspice_examples_code_repo/Circuit-Completion-Using-GNNs/component_classification_with_link_prediction_head/evaluation/FEGIN/kernel/circuit_datasets.py:15: FutureWarning: You are using `torch.load` with `weights_only=False` (the current default value), which uses the default pickle module implicitly. It is possible to construct malicious pickle data which will execute arbitrary code during unpickling (See https://github.com/pytorch/pytorch/blob/main/SECURITY.md#untrusted-models for more details). In a future release, the default value for `weights_only` will be flipped to `True`. This limits the functions that could be executed during unpickling. Arbitrary objects will no longer be allowed to be loaded via this mode unless they are explicitly allowlisted by the user via `torch.serialization.add_safe_globals`. We recommend you start setting `weights_only=True` for any use case where you don't have full control of the loaded file. Please open an issue on GitHub for any issues related to this experimental feature.
  self.data, self.slices = torch.load(self.processed_paths[0])
