STDOUT:
Results will be saved in /home/philip/projects/ltspice_examples_code_repo/Circuit-Completion-Using-GNNs/component_classification_with_link_prediction_head/evaluation/FEGIN/results/model_FEGIN_dataset_ltspice_demos
Command line input: python main.py --data ltspice_demos --representation component_component --model FEGIN --layers 4 --hiddens 16 --batch_size 128 --lr 0.001 --emb_size 128 --epochs 100 --save_appendix component_component_L4_H16_BS128_LR0.001_E128 --no_val
 is saved.
-----
ltspice_demos - FEGIN
Using 4 layers, 16 hidden units, h = 2
Loading component_component representation dataset
ENTERED
Training FEGIN on component_component representation
Train: 1565, Test: 383
##################ITERATION #0 ****************************************
 epoch: 0, train_loss: 1.3654, test_loss: 1.3583, test_f1: 0.2281
 epoch: 1, train_loss: 1.3497, test_loss: 1.3519, test_f1: 0.2281
 epoch: 2, train_loss: 1.3403, test_loss: 1.3455, test_f1: 0.2281
 epoch: 3, train_loss: 1.3303, test_loss: 1.3367, test_f1: 0.2281
 epoch: 4, train_loss: 1.3160, test_loss: 1.3265, test_f1: 0.2281
 epoch: 5, train_loss: 1.2971, test_loss: 1.3135, test_f1: 0.2281
 epoch: 6, train_loss: 1.2790, test_loss: 1.2983, test_f1: 0.2281
 epoch: 7, train_loss: 1.2561, test_loss: 1.2810, test_f1: 0.2281
 epoch: 8, train_loss: 1.2280, test_loss: 1.2672, test_f1: 0.2281
 epoch: 9, train_loss: 1.2137, test_loss: 1.2549, test_f1: 0.2281
 epoch: 10, train_loss: 1.2028, test_loss: 1.2466, test_f1: 0.2636
 epoch: 11, train_loss: 1.1892, test_loss: 1.2385, test_f1: 0.3249
 epoch: 12, train_loss: 1.1815, test_loss: 1.2396, test_f1: 0.3269
 epoch: 13, train_loss: 1.1678, test_loss: 1.2362, test_f1: 0.3341
 epoch: 14, train_loss: 1.1548, test_loss: 1.2367, test_f1: 0.3812
 epoch: 15, train_loss: 1.1539, test_loss: 1.2392, test_f1: 0.3480
 epoch: 16, train_loss: 1.1360, test_loss: 1.2377, test_f1: 0.3500
 epoch: 17, train_loss: 1.1368, test_loss: 1.2468, test_f1: 0.3178
 epoch: 18, train_loss: 1.1332, test_loss: 1.2538, test_f1: 0.3517
 epoch: 19, train_loss: 1.1144, test_loss: 1.2614, test_f1: 0.3417
 epoch: 20, train_loss: 1.1171, test_loss: 1.3032, test_f1: 0.3437
 epoch: 21, train_loss: 1.1031, test_loss: 1.2808, test_f1: 0.3156
 epoch: 22, train_loss: 1.0961, test_loss: 1.3070, test_f1: 0.3488
 epoch: 23, train_loss: 1.0943, test_loss: 1.2977, test_f1: 0.3426
 epoch: 24, train_loss: 1.0741, test_loss: 1.2804, test_f1: 0.3351
 epoch: 25, train_loss: 1.0753, test_loss: 1.2658, test_f1: 0.3737
 epoch: 26, train_loss: 1.0726, test_loss: 1.2693, test_f1: 0.3845
 epoch: 27, train_loss: 1.0753, test_loss: 1.2956, test_f1: 0.3795
 epoch: 28, train_loss: 1.0557, test_loss: 1.3304, test_f1: 0.3830
 epoch: 29, train_loss: 1.0693, test_loss: 1.3642, test_f1: 0.3892
 epoch: 30, train_loss: 1.0469, test_loss: 1.3275, test_f1: 0.3809
 epoch: 31, train_loss: 1.0428, test_loss: 1.3295, test_f1: 0.3636
 epoch: 32, train_loss: 1.0366, test_loss: 1.3584, test_f1: 0.4036
 epoch: 33, train_loss: 1.0290, test_loss: 1.3745, test_f1: 0.4048
 epoch: 34, train_loss: 1.0258, test_loss: 1.3685, test_f1: 0.4101
 epoch: 35, train_loss: 1.0260, test_loss: 1.3622, test_f1: 0.4142
 epoch: 36, train_loss: 1.0111, test_loss: 1.3946, test_f1: 0.4157
 epoch: 37, train_loss: 1.0175, test_loss: 1.4256, test_f1: 0.4059
 epoch: 38, train_loss: 1.0055, test_loss: 1.4030, test_f1: 0.4375
 epoch: 39, train_loss: 1.0046, test_loss: 1.4073, test_f1: 0.4116
 epoch: 40, train_loss: 0.9932, test_loss: 1.4200, test_f1: 0.4060
 epoch: 41, train_loss: 0.9977, test_loss: 1.4515, test_f1: 0.4369
 epoch: 42, train_loss: 0.9842, test_loss: 1.4388, test_f1: 0.4224
 epoch: 43, train_loss: 0.9921, test_loss: 1.4113, test_f1: 0.4473
 epoch: 44, train_loss: 0.9860, test_loss: 1.4690, test_f1: 0.4423
 epoch: 45, train_loss: 0.9724, test_loss: 1.4038, test_f1: 0.4738
 epoch: 46, train_loss: 0.9756, test_loss: 1.4618, test_f1: 0.4838
 epoch: 47, train_loss: 0.9625, test_loss: 1.4758, test_f1: 0.4792
 epoch: 48, train_loss: 0.9547, test_loss: 1.4240, test_f1: 0.4683
 epoch: 49, train_loss: 0.9666, test_loss: 1.4453, test_f1: 0.4852
 epoch: 50, train_loss: 0.9776, test_loss: 1.4355, test_f1: 0.4836
 epoch: 51, train_loss: 0.9499, test_loss: 1.4054, test_f1: 0.4817
 epoch: 52, train_loss: 0.9362, test_loss: 1.4898, test_f1: 0.4753
 epoch: 53, train_loss: 0.9393, test_loss: 1.5183, test_f1: 0.4896
 epoch: 54, train_loss: 0.9477, test_loss: 1.4959, test_f1: 0.5007
 epoch: 55, train_loss: 0.9361, test_loss: 1.4761, test_f1: 0.4904
 epoch: 56, train_loss: 0.9302, test_loss: 1.4820, test_f1: 0.4881
 epoch: 57, train_loss: 0.9183, test_loss: 1.5093, test_f1: 0.4824
 epoch: 58, train_loss: 0.9188, test_loss: 1.5175, test_f1: 0.4764
 epoch: 59, train_loss: 0.9265, test_loss: 1.5133, test_f1: 0.4793
 epoch: 60, train_loss: 0.9322, test_loss: 1.4806, test_f1: 0.4656
 epoch: 61, train_loss: 0.9264, test_loss: 1.4901, test_f1: 0.4840
 epoch: 62, train_loss: 0.9135, test_loss: 1.4530, test_f1: 0.4813
 epoch: 63, train_loss: 0.9318, test_loss: 1.5268, test_f1: 0.4582
 epoch: 64, train_loss: 0.9117, test_loss: 1.5702, test_f1: 0.4960
 epoch: 65, train_loss: 0.9050, test_loss: 1.5756, test_f1: 0.5038
 epoch: 66, train_loss: 0.9093, test_loss: 1.5427, test_f1: 0.4962
 epoch: 67, train_loss: 0.9039, test_loss: 1.5307, test_f1: 0.4834
 epoch: 68, train_loss: 0.8990, test_loss: 1.5451, test_f1: 0.4777
 epoch: 69, train_loss: 0.8975, test_loss: 1.5547, test_f1: 0.4863
 epoch: 70, train_loss: 0.8968, test_loss: 1.5555, test_f1: 0.4915
 epoch: 71, train_loss: 0.8951, test_loss: 1.5860, test_f1: 0.4698
 epoch: 72, train_loss: 0.9002, test_loss: 1.5477, test_f1: 0.4868
 epoch: 73, train_loss: 0.8999, test_loss: 1.5680, test_f1: 0.4781
 epoch: 74, train_loss: 0.8904, test_loss: 1.5943, test_f1: 0.4752
 epoch: 75, train_loss: 0.8818, test_loss: 1.6376, test_f1: 0.4616
 epoch: 76, train_loss: 0.9014, test_loss: 1.6240, test_f1: 0.4857
 epoch: 77, train_loss: 0.8924, test_loss: 1.5721, test_f1: 0.4817
 epoch: 78, train_loss: 0.8768, test_loss: 1.5140, test_f1: 0.5020
 epoch: 79, train_loss: 0.8916, test_loss: 1.5972, test_f1: 0.4677
 epoch: 80, train_loss: 0.8661, test_loss: 1.5910, test_f1: 0.4774
 epoch: 81, train_loss: 0.8744, test_loss: 1.6109, test_f1: 0.4619
 epoch: 82, train_loss: 0.8698, test_loss: 1.6295, test_f1: 0.4722
 epoch: 83, train_loss: 0.8733, test_loss: 1.6198, test_f1: 0.4799
 epoch: 84, train_loss: 0.8791, test_loss: 1.5988, test_f1: 0.4686
 epoch: 85, train_loss: 0.8751, test_loss: 1.5671, test_f1: 0.4941
 epoch: 86, train_loss: 0.8811, test_loss: 1.6325, test_f1: 0.4599
 epoch: 87, train_loss: 0.8777, test_loss: 1.6156, test_f1: 0.4527
 epoch: 88, train_loss: 0.8692, test_loss: 1.6173, test_f1: 0.4978
 epoch: 89, train_loss: 0.8702, test_loss: 1.6382, test_f1: 0.4948
 epoch: 90, train_loss: 0.8690, test_loss: 1.6643, test_f1: 0.4915
 epoch: 91, train_loss: 0.8619, test_loss: 1.6205, test_f1: 0.5053
 epoch: 92, train_loss: 0.8691, test_loss: 1.6330, test_f1: 0.4936
 epoch: 93, train_loss: 0.8464, test_loss: 1.6558, test_f1: 0.5028
 epoch: 94, train_loss: 0.8621, test_loss: 1.6560, test_f1: 0.5005
 epoch: 95, train_loss: 0.8656, test_loss: 1.6566, test_f1: 0.4782
 epoch: 96, train_loss: 0.8451, test_loss: 1.6872, test_f1: 0.4566
 epoch: 97, train_loss: 0.8529, test_loss: 1.7025, test_f1: 0.4753
 epoch: 98, train_loss: 0.8610, test_loss: 1.6448, test_f1: 0.4841
 epoch: 99, train_loss: 0.8581, test_loss: 1.6083, test_f1: 0.4734
##################ITERATION #1 ****************************************
 epoch: 0, train_loss: 1.3162, test_loss: 1.3211, test_f1: 0.2281
 epoch: 1, train_loss: 1.2680, test_loss: 1.3127, test_f1: 0.2281
 epoch: 2, train_loss: 1.2519, test_loss: 1.3095, test_f1: 0.2281
 epoch: 3, train_loss: 1.2336, test_loss: 1.3053, test_f1: 0.2281
 epoch: 4, train_loss: 1.2197, test_loss: 1.2980, test_f1: 0.2337
 epoch: 5, train_loss: 1.2186, test_loss: 1.2892, test_f1: 0.3065
 epoch: 6, train_loss: 1.2095, test_loss: 1.2798, test_f1: 0.3407
 epoch: 7, train_loss: 1.2005, test_loss: 1.2705, test_f1: 0.3312
 epoch: 8, train_loss: 1.1994, test_loss: 1.2604, test_f1: 0.3333
 epoch: 9, train_loss: 1.1913, test_loss: 1.2589, test_f1: 0.3373
 epoch: 10, train_loss: 1.1828, test_loss: 1.2474, test_f1: 0.3536
 epoch: 11, train_loss: 1.1754, test_loss: 1.2418, test_f1: 0.3534
 epoch: 12, train_loss: 1.1663, test_loss: 1.2468, test_f1: 0.3602
 epoch: 13, train_loss: 1.1599, test_loss: 1.2485, test_f1: 0.3547
 epoch: 14, train_loss: 1.1490, test_loss: 1.2493, test_f1: 0.3753
 epoch: 15, train_loss: 1.1331, test_loss: 1.2414, test_f1: 0.3974
 epoch: 16, train_loss: 1.1316, test_loss: 1.2440, test_f1: 0.4049
 epoch: 17, train_loss: 1.1092, test_loss: 1.2429, test_f1: 0.4166
 epoch: 18, train_loss: 1.1100, test_loss: 1.2379, test_f1: 0.4249
 epoch: 19, train_loss: 1.0891, test_loss: 1.2333, test_f1: 0.4266
 epoch: 20, train_loss: 1.0867, test_loss: 1.2528, test_f1: 0.4440
 epoch: 21, train_loss: 1.0809, test_loss: 1.2558, test_f1: 0.4256
 epoch: 22, train_loss: 1.0753, test_loss: 1.2594, test_f1: 0.4537
 epoch: 23, train_loss: 1.0659, test_loss: 1.2761, test_f1: 0.4403
 epoch: 24, train_loss: 1.0637, test_loss: 1.2822, test_f1: 0.4476
 epoch: 25, train_loss: 1.0518, test_loss: 1.2328, test_f1: 0.4931
 epoch: 26, train_loss: 1.0554, test_loss: 1.2303, test_f1: 0.4723
 epoch: 27, train_loss: 1.0345, test_loss: 1.2740, test_f1: 0.4823
 epoch: 28, train_loss: 1.0431, test_loss: 1.2643, test_f1: 0.4919
 epoch: 29, train_loss: 1.0151, test_loss: 1.2299, test_f1: 0.5028
 epoch: 30, train_loss: 1.0191, test_loss: 1.2184, test_f1: 0.5091
 epoch: 31, train_loss: 1.0040, test_loss: 1.2282, test_f1: 0.4857
 epoch: 32, train_loss: 1.0145, test_loss: 1.3037, test_f1: 0.4678
 epoch: 33, train_loss: 0.9905, test_loss: 1.2821, test_f1: 0.4735
 epoch: 34, train_loss: 0.9905, test_loss: 1.3177, test_f1: 0.4985
 epoch: 35, train_loss: 0.9902, test_loss: 1.2697, test_f1: 0.4939
 epoch: 36, train_loss: 0.9859, test_loss: 1.2800, test_f1: 0.5037
 epoch: 37, train_loss: 0.9810, test_loss: 1.2612, test_f1: 0.4701
 epoch: 38, train_loss: 0.9847, test_loss: 1.2432, test_f1: 0.4879
 epoch: 39, train_loss: 0.9763, test_loss: 1.2754, test_f1: 0.4854
 epoch: 40, train_loss: 0.9736, test_loss: 1.2848, test_f1: 0.5034
 epoch: 41, train_loss: 0.9673, test_loss: 1.3170, test_f1: 0.4836
 epoch: 42, train_loss: 0.9471, test_loss: 1.3210, test_f1: 0.4807
 epoch: 43, train_loss: 0.9557, test_loss: 1.2792, test_f1: 0.4990
 epoch: 44, train_loss: 0.9378, test_loss: 1.3073, test_f1: 0.4995
 epoch: 45, train_loss: 0.9365, test_loss: 1.2575, test_f1: 0.5055
 epoch: 46, train_loss: 0.9462, test_loss: 1.3767, test_f1: 0.5066
 epoch: 47, train_loss: 0.9333, test_loss: 1.3562, test_f1: 0.5022
 epoch: 48, train_loss: 0.9472, test_loss: 1.3384, test_f1: 0.4583
 epoch: 49, train_loss: 0.9300, test_loss: 1.4163, test_f1: 0.4998
 epoch: 50, train_loss: 0.9356, test_loss: 1.3012, test_f1: 0.5038
 epoch: 51, train_loss: 0.9101, test_loss: 1.2622, test_f1: 0.5119
 epoch: 52, train_loss: 0.9050, test_loss: 1.2961, test_f1: 0.4893
 epoch: 53, train_loss: 0.9048, test_loss: 1.3208, test_f1: 0.4932
 epoch: 54, train_loss: 0.8916, test_loss: 1.3243, test_f1: 0.5133
 epoch: 55, train_loss: 0.9091, test_loss: 1.3279, test_f1: 0.5171
 epoch: 56, train_loss: 0.9068, test_loss: 1.3399, test_f1: 0.5040
 epoch: 57, train_loss: 0.9095, test_loss: 1.3287, test_f1: 0.5203
 epoch: 58, train_loss: 0.8943, test_loss: 1.3377, test_f1: 0.5324
 epoch: 59, train_loss: 0.8931, test_loss: 1.3081, test_f1: 0.5245
 epoch: 60, train_loss: 0.9024, test_loss: 1.2916, test_f1: 0.5290
 epoch: 61, train_loss: 0.9005, test_loss: 1.3237, test_f1: 0.5239
 epoch: 62, train_loss: 0.8904, test_loss: 1.3405, test_f1: 0.5169
 epoch: 63, train_loss: 0.8841, test_loss: 1.3204, test_f1: 0.5272
 epoch: 64, train_loss: 0.8975, test_loss: 1.3597, test_f1: 0.5316
 epoch: 65, train_loss: 0.8819, test_loss: 1.3491, test_f1: 0.5332
 epoch: 66, train_loss: 0.8844, test_loss: 1.3137, test_f1: 0.5367
 epoch: 67, train_loss: 0.8966, test_loss: 1.3398, test_f1: 0.5204
 epoch: 68, train_loss: 0.8909, test_loss: 1.3218, test_f1: 0.5206
 epoch: 69, train_loss: 0.8765, test_loss: 1.3723, test_f1: 0.5175
 epoch: 70, train_loss: 0.8706, test_loss: 1.3326, test_f1: 0.5398
 epoch: 71, train_loss: 0.8826, test_loss: 1.3212, test_f1: 0.5213
 epoch: 72, train_loss: 0.8797, test_loss: 1.3146, test_f1: 0.5315
 epoch: 73, train_loss: 0.8748, test_loss: 1.3424, test_f1: 0.5151
 epoch: 74, train_loss: 0.8756, test_loss: 1.3452, test_f1: 0.5235
 epoch: 75, train_loss: 0.8759, test_loss: 1.3771, test_f1: 0.5288
 epoch: 76, train_loss: 0.8760, test_loss: 1.3275, test_f1: 0.5179
 epoch: 77, train_loss: 0.8665, test_loss: 1.3450, test_f1: 0.5155
 epoch: 78, train_loss: 0.8836, test_loss: 1.3589, test_f1: 0.5405
 epoch: 79, train_loss: 0.8688, test_loss: 1.3169, test_f1: 0.5209
 epoch: 80, train_loss: 0.8616, test_loss: 1.3278, test_f1: 0.4820
 epoch: 81, train_loss: 0.8630, test_loss: 1.3131, test_f1: 0.5314
 epoch: 82, train_loss: 0.8527, test_loss: 1.3199, test_f1: 0.4797
 epoch: 83, train_loss: 0.8774, test_loss: 1.2917, test_f1: 0.5089
 epoch: 84, train_loss: 0.8579, test_loss: 1.2915, test_f1: 0.5191
 epoch: 85, train_loss: 0.8442, test_loss: 1.2711, test_f1: 0.5265
 epoch: 86, train_loss: 0.8570, test_loss: 1.3292, test_f1: 0.5241
 epoch: 87, train_loss: 0.8565, test_loss: 1.3426, test_f1: 0.5174
 epoch: 88, train_loss: 0.8507, test_loss: 1.3258, test_f1: 0.5211
 epoch: 89, train_loss: 0.8560, test_loss: 1.3444, test_f1: 0.5328
 epoch: 90, train_loss: 0.8527, test_loss: 1.3998, test_f1: 0.5116
 epoch: 91, train_loss: 0.8538, test_loss: 1.3618, test_f1: 0.5067
 epoch: 92, train_loss: 0.8590, test_loss: 1.2785, test_f1: 0.5242
 epoch: 93, train_loss: 0.8563, test_loss: 1.3653, test_f1: 0.5057
 epoch: 94, train_loss: 0.8637, test_loss: 1.4393, test_f1: 0.4711
 epoch: 95, train_loss: 0.8476, test_loss: 1.3672, test_f1: 0.5195
 epoch: 96, train_loss: 0.8640, test_loss: 1.3667, test_f1: 0.5332
 epoch: 97, train_loss: 0.8516, test_loss: 1.3960, test_f1: 0.5191
 epoch: 98, train_loss: 0.8345, test_loss: 1.4571, test_f1: 0.5151
 epoch: 99, train_loss: 0.8407, test_loss: 1.4077, test_f1: 0.5053
##################ITERATION #2 ****************************************
 epoch: 0, train_loss: 1.3746, test_loss: 1.3632, test_f1: 0.2281
 epoch: 1, train_loss: 1.2831, test_loss: 1.3223, test_f1: 0.2281
 epoch: 2, train_loss: 1.2621, test_loss: 1.3003, test_f1: 0.2281
 epoch: 3, train_loss: 1.2447, test_loss: 1.2869, test_f1: 0.2281
 epoch: 4, train_loss: 1.2292, test_loss: 1.2777, test_f1: 0.2281
 epoch: 5, train_loss: 1.2163, test_loss: 1.2681, test_f1: 0.2281
 epoch: 6, train_loss: 1.2087, test_loss: 1.2613, test_f1: 0.2281
 epoch: 7, train_loss: 1.1996, test_loss: 1.2513, test_f1: 0.2293
 epoch: 8, train_loss: 1.1853, test_loss: 1.2415, test_f1: 0.2293
 epoch: 9, train_loss: 1.1831, test_loss: 1.2320, test_f1: 0.2388
 epoch: 10, train_loss: 1.1662, test_loss: 1.2231, test_f1: 0.2497
 epoch: 11, train_loss: 1.1491, test_loss: 1.2180, test_f1: 0.3311
 epoch: 12, train_loss: 1.1389, test_loss: 1.2060, test_f1: 0.3401
 epoch: 13, train_loss: 1.1375, test_loss: 1.2097, test_f1: 0.4007
 epoch: 14, train_loss: 1.1210, test_loss: 1.2009, test_f1: 0.3867
 epoch: 15, train_loss: 1.1283, test_loss: 1.1978, test_f1: 0.3890
 epoch: 16, train_loss: 1.1129, test_loss: 1.1946, test_f1: 0.3322
 epoch: 17, train_loss: 1.1102, test_loss: 1.1867, test_f1: 0.3721
 epoch: 18, train_loss: 1.0933, test_loss: 1.1969, test_f1: 0.4013
 epoch: 19, train_loss: 1.0885, test_loss: 1.1761, test_f1: 0.3601
 epoch: 20, train_loss: 1.0743, test_loss: 1.1691, test_f1: 0.3630
 epoch: 21, train_loss: 1.0761, test_loss: 1.1839, test_f1: 0.3893
 epoch: 22, train_loss: 1.0764, test_loss: 1.1866, test_f1: 0.3539
 epoch: 23, train_loss: 1.0627, test_loss: 1.1751, test_f1: 0.3649
 epoch: 24, train_loss: 1.0464, test_loss: 1.2001, test_f1: 0.3832
 epoch: 25, train_loss: 1.0405, test_loss: 1.1787, test_f1: 0.3772
 epoch: 26, train_loss: 1.0309, test_loss: 1.1880, test_f1: 0.4340
 epoch: 27, train_loss: 1.0328, test_loss: 1.1929, test_f1: 0.4605
 epoch: 28, train_loss: 1.0280, test_loss: 1.2021, test_f1: 0.4488
 epoch: 29, train_loss: 1.0138, test_loss: 1.1926, test_f1: 0.4416
 epoch: 30, train_loss: 1.0139, test_loss: 1.1529, test_f1: 0.4265
 epoch: 31, train_loss: 1.0084, test_loss: 1.1821, test_f1: 0.4099
 epoch: 32, train_loss: 0.9915, test_loss: 1.1858, test_f1: 0.4015
 epoch: 33, train_loss: 0.9963, test_loss: 1.1974, test_f1: 0.4368
 epoch: 34, train_loss: 0.9832, test_loss: 1.1882, test_f1: 0.4158
 epoch: 35, train_loss: 0.9877, test_loss: 1.2293, test_f1: 0.4464
 epoch: 36, train_loss: 0.9862, test_loss: 1.2360, test_f1: 0.4374
 epoch: 37, train_loss: 0.9760, test_loss: 1.1917, test_f1: 0.4324
 epoch: 38, train_loss: 0.9707, test_loss: 1.1661, test_f1: 0.4474
 epoch: 39, train_loss: 0.9686, test_loss: 1.1939, test_f1: 0.4405
 epoch: 40, train_loss: 0.9626, test_loss: 1.2404, test_f1: 0.4255
 epoch: 41, train_loss: 0.9615, test_loss: 1.1860, test_f1: 0.4641
 epoch: 42, train_loss: 0.9581, test_loss: 1.1908, test_f1: 0.4572
 epoch: 43, train_loss: 0.9694, test_loss: 1.1843, test_f1: 0.4249
 epoch: 44, train_loss: 0.9640, test_loss: 1.2859, test_f1: 0.4310
 epoch: 45, train_loss: 0.9446, test_loss: 1.5116, test_f1: 0.4071
 epoch: 46, train_loss: 0.9437, test_loss: 1.2083, test_f1: 0.4835
 epoch: 47, train_loss: 0.9557, test_loss: 1.2791, test_f1: 0.4582
 epoch: 48, train_loss: 0.9347, test_loss: 1.2452, test_f1: 0.4674
 epoch: 49, train_loss: 0.9430, test_loss: 1.3676, test_f1: 0.4413
 epoch: 50, train_loss: 0.9316, test_loss: 1.4520, test_f1: 0.4357
 epoch: 51, train_loss: 0.9391, test_loss: 1.2968, test_f1: 0.4490
 epoch: 52, train_loss: 0.9239, test_loss: 1.3184, test_f1: 0.4616
 epoch: 53, train_loss: 0.9033, test_loss: 1.2822, test_f1: 0.4387
 epoch: 54, train_loss: 0.9190, test_loss: 1.2633, test_f1: 0.4289
 epoch: 55, train_loss: 0.9035, test_loss: 1.2783, test_f1: 0.4455
 epoch: 56, train_loss: 0.9085, test_loss: 1.2376, test_f1: 0.4338
 epoch: 57, train_loss: 0.9168, test_loss: 1.2617, test_f1: 0.4463
 epoch: 58, train_loss: 0.9017, test_loss: 1.2374, test_f1: 0.4488
 epoch: 59, train_loss: 0.9133, test_loss: 1.2111, test_f1: 0.4441
 epoch: 60, train_loss: 0.9105, test_loss: 1.2075, test_f1: 0.4721
 epoch: 61, train_loss: 0.9001, test_loss: 1.2463, test_f1: 0.4541
 epoch: 62, train_loss: 0.8999, test_loss: 1.2764, test_f1: 0.4201
 epoch: 63, train_loss: 0.8894, test_loss: 1.2536, test_f1: 0.4478
 epoch: 64, train_loss: 0.9025, test_loss: 1.2110, test_f1: 0.4766
 epoch: 65, train_loss: 0.8763, test_loss: 1.2175, test_f1: 0.4450
 epoch: 66, train_loss: 0.8882, test_loss: 1.2469, test_f1: 0.4521
 epoch: 67, train_loss: 0.8859, test_loss: 1.2065, test_f1: 0.4717
 epoch: 68, train_loss: 0.8945, test_loss: 1.2586, test_f1: 0.4629
 epoch: 69, train_loss: 0.8928, test_loss: 1.2774, test_f1: 0.4566
 epoch: 70, train_loss: 0.8825, test_loss: 1.2441, test_f1: 0.4769
 epoch: 71, train_loss: 0.8754, test_loss: 1.2492, test_f1: 0.4637
 epoch: 72, train_loss: 0.8771, test_loss: 1.2280, test_f1: 0.4781
 epoch: 73, train_loss: 0.8817, test_loss: 1.2419, test_f1: 0.4663
 epoch: 74, train_loss: 0.8819, test_loss: 1.2342, test_f1: 0.4641
 epoch: 75, train_loss: 0.8559, test_loss: 1.2189, test_f1: 0.4694
 epoch: 76, train_loss: 0.8884, test_loss: 1.2412, test_f1: 0.4478
 epoch: 77, train_loss: 0.8771, test_loss: 1.1917, test_f1: 0.4826
 epoch: 78, train_loss: 0.8858, test_loss: 1.1947, test_f1: 0.4744
 epoch: 79, train_loss: 0.8746, test_loss: 1.2109, test_f1: 0.4941
 epoch: 80, train_loss: 0.8675, test_loss: 1.2084, test_f1: 0.4998
 epoch: 81, train_loss: 0.8640, test_loss: 1.2501, test_f1: 0.4938
 epoch: 82, train_loss: 0.8464, test_loss: 1.2860, test_f1: 0.4599
 epoch: 83, train_loss: 0.8590, test_loss: 1.2348, test_f1: 0.4800
 epoch: 84, train_loss: 0.8534, test_loss: 1.2866, test_f1: 0.4682
 epoch: 85, train_loss: 0.8580, test_loss: 1.3106, test_f1: 0.4762
 epoch: 86, train_loss: 0.8517, test_loss: 1.3658, test_f1: 0.4738
 epoch: 87, train_loss: 0.8760, test_loss: 1.3490, test_f1: 0.4717
 epoch: 88, train_loss: 0.8620, test_loss: 1.3222, test_f1: 0.4907
 epoch: 89, train_loss: 0.8481, test_loss: 1.3046, test_f1: 0.4710
 epoch: 90, train_loss: 0.8545, test_loss: 1.3235, test_f1: 0.4629
 epoch: 91, train_loss: 0.8628, test_loss: 1.3045, test_f1: 0.5017
 epoch: 92, train_loss: 0.8799, test_loss: 1.1992, test_f1: 0.5063
 epoch: 93, train_loss: 0.8471, test_loss: 1.2260, test_f1: 0.4795
 epoch: 94, train_loss: 0.8543, test_loss: 1.3136, test_f1: 0.4856
 epoch: 95, train_loss: 0.8486, test_loss: 1.3110, test_f1: 0.5105
 epoch: 96, train_loss: 0.8555, test_loss: 1.3175, test_f1: 0.4800
 epoch: 97, train_loss: 0.8365, test_loss: 1.3314, test_f1: 0.4819
 epoch: 98, train_loss: 0.8566, test_loss: 1.3114, test_f1: 0.5183
 epoch: 99, train_loss: 0.8332, test_loss: 1.3208, test_f1: 0.5023
##################ITERATION #3 ****************************************
 epoch: 0, train_loss: 1.3296, test_loss: 1.3451, test_f1: 0.2281
 epoch: 1, train_loss: 1.2343, test_loss: 1.3026, test_f1: 0.2281
 epoch: 2, train_loss: 1.1883, test_loss: 1.2817, test_f1: 0.2270
 epoch: 3, train_loss: 1.1801, test_loss: 1.2616, test_f1: 0.2966
 epoch: 4, train_loss: 1.1623, test_loss: 1.2560, test_f1: 0.3331
 epoch: 5, train_loss: 1.1369, test_loss: 1.2352, test_f1: 0.3577
 epoch: 6, train_loss: 1.1170, test_loss: 1.2379, test_f1: 0.3903
 epoch: 7, train_loss: 1.1049, test_loss: 1.2326, test_f1: 0.3884
 epoch: 8, train_loss: 1.0967, test_loss: 1.2224, test_f1: 0.4002
 epoch: 9, train_loss: 1.0828, test_loss: 1.2187, test_f1: 0.4094
 epoch: 10, train_loss: 1.0840, test_loss: 1.2059, test_f1: 0.4161
 epoch: 11, train_loss: 1.0627, test_loss: 1.2023, test_f1: 0.4378
 epoch: 12, train_loss: 1.0512, test_loss: 1.2188, test_f1: 0.4386
 epoch: 13, train_loss: 1.0445, test_loss: 1.1695, test_f1: 0.4538
 epoch: 14, train_loss: 1.0422, test_loss: 1.1762, test_f1: 0.4630
 epoch: 15, train_loss: 1.0115, test_loss: 1.1860, test_f1: 0.4867
 epoch: 16, train_loss: 1.0244, test_loss: 1.1665, test_f1: 0.4824
 epoch: 17, train_loss: 1.0000, test_loss: 1.2015, test_f1: 0.4864
 epoch: 18, train_loss: 0.9987, test_loss: 1.2076, test_f1: 0.4631
 epoch: 19, train_loss: 0.9941, test_loss: 1.2182, test_f1: 0.5105
 epoch: 20, train_loss: 0.9899, test_loss: 1.1954, test_f1: 0.5181
 epoch: 21, train_loss: 0.9874, test_loss: 1.1790, test_f1: 0.5311
 epoch: 22, train_loss: 0.9774, test_loss: 1.1955, test_f1: 0.5191
 epoch: 23, train_loss: 0.9855, test_loss: 1.1810, test_f1: 0.5074
 epoch: 24, train_loss: 0.9641, test_loss: 1.1946, test_f1: 0.5075
 epoch: 25, train_loss: 0.9526, test_loss: 1.2715, test_f1: 0.5344
 epoch: 26, train_loss: 0.9505, test_loss: 1.2117, test_f1: 0.5315
 epoch: 27, train_loss: 0.9343, test_loss: 1.1631, test_f1: 0.5272
 epoch: 28, train_loss: 0.9562, test_loss: 1.2107, test_f1: 0.4865
 epoch: 29, train_loss: 0.9413, test_loss: 1.1842, test_f1: 0.5089
 epoch: 30, train_loss: 0.9437, test_loss: 1.1665, test_f1: 0.5046
 epoch: 31, train_loss: 0.9214, test_loss: 1.2119, test_f1: 0.4775
 epoch: 32, train_loss: 0.9282, test_loss: 1.1939, test_f1: 0.5115
 epoch: 33, train_loss: 0.9128, test_loss: 1.2406, test_f1: 0.4864
 epoch: 34, train_loss: 0.9172, test_loss: 1.2371, test_f1: 0.5110
 epoch: 35, train_loss: 0.9085, test_loss: 1.2519, test_f1: 0.5085
 epoch: 36, train_loss: 0.9047, test_loss: 1.3137, test_f1: 0.5066
 epoch: 37, train_loss: 0.9147, test_loss: 1.2490, test_f1: 0.5016
 epoch: 38, train_loss: 0.9063, test_loss: 1.2838, test_f1: 0.5197
 epoch: 39, train_loss: 0.8855, test_loss: 1.2541, test_f1: 0.4680
 epoch: 40, train_loss: 0.9102, test_loss: 1.1995, test_f1: 0.4730
 epoch: 41, train_loss: 0.9051, test_loss: 1.2052, test_f1: 0.4986
 epoch: 42, train_loss: 0.9110, test_loss: 1.1674, test_f1: 0.5064
 epoch: 43, train_loss: 0.8881, test_loss: 1.2349, test_f1: 0.5158
 epoch: 44, train_loss: 0.8886, test_loss: 1.2155, test_f1: 0.5260
 epoch: 45, train_loss: 0.8821, test_loss: 1.2308, test_f1: 0.5002
 epoch: 46, train_loss: 0.8887, test_loss: 1.2293, test_f1: 0.4920
 epoch: 47, train_loss: 0.8731, test_loss: 1.2443, test_f1: 0.4841
 epoch: 48, train_loss: 0.8626, test_loss: 1.2813, test_f1: 0.4916
 epoch: 49, train_loss: 0.8771, test_loss: 1.2549, test_f1: 0.5147
 epoch: 50, train_loss: 0.8483, test_loss: 1.2163, test_f1: 0.5086
 epoch: 51, train_loss: 0.8522, test_loss: 1.2639, test_f1: 0.4952
 epoch: 52, train_loss: 0.8485, test_loss: 1.3159, test_f1: 0.4766
 epoch: 53, train_loss: 0.8550, test_loss: 1.3139, test_f1: 0.4956
 epoch: 54, train_loss: 0.8351, test_loss: 1.3076, test_f1: 0.4759
 epoch: 55, train_loss: 0.8530, test_loss: 1.2964, test_f1: 0.4984
 epoch: 56, train_loss: 0.8434, test_loss: 1.2946, test_f1: 0.4837
 epoch: 57, train_loss: 0.8508, test_loss: 1.2832, test_f1: 0.4748
 epoch: 58, train_loss: 0.8472, test_loss: 1.3263, test_f1: 0.4627
 epoch: 59, train_loss: 0.8458, test_loss: 1.3767, test_f1: 0.4730
 epoch: 60, train_loss: 0.8420, test_loss: 1.3680, test_f1: 0.4620
 epoch: 61, train_loss: 0.8497, test_loss: 1.3372, test_f1: 0.4980
 epoch: 62, train_loss: 0.8409, test_loss: 1.3697, test_f1: 0.5017
 epoch: 63, train_loss: 0.8218, test_loss: 1.3705, test_f1: 0.5018
 epoch: 64, train_loss: 0.8427, test_loss: 1.4491, test_f1: 0.4788
 epoch: 65, train_loss: 0.8453, test_loss: 1.4883, test_f1: 0.4513
 epoch: 66, train_loss: 0.8458, test_loss: 1.4137, test_f1: 0.4545
 epoch: 67, train_loss: 0.8381, test_loss: 1.4157, test_f1: 0.4803
 epoch: 68, train_loss: 0.8306, test_loss: 1.3570, test_f1: 0.4806
 epoch: 69, train_loss: 0.8196, test_loss: 1.3405, test_f1: 0.4551
 epoch: 70, train_loss: 0.8261, test_loss: 1.3761, test_f1: 0.4485
 epoch: 71, train_loss: 0.8567, test_loss: 1.3894, test_f1: 0.4708
 epoch: 72, train_loss: 0.8190, test_loss: 1.4299, test_f1: 0.4623
 epoch: 73, train_loss: 0.8308, test_loss: 1.3242, test_f1: 0.4719
 epoch: 74, train_loss: 0.8381, test_loss: 1.3962, test_f1: 0.4726
 epoch: 75, train_loss: 0.8163, test_loss: 1.4429, test_f1: 0.4537
 epoch: 76, train_loss: 0.8227, test_loss: 1.4476, test_f1: 0.4763
 epoch: 77, train_loss: 0.8179, test_loss: 1.5121, test_f1: 0.4575
 epoch: 78, train_loss: 0.8097, test_loss: 1.5126, test_f1: 0.4770
 epoch: 79, train_loss: 0.8145, test_loss: 1.4319, test_f1: 0.4751
 epoch: 80, train_loss: 0.8105, test_loss: 1.4663, test_f1: 0.4632
 epoch: 81, train_loss: 0.8309, test_loss: 1.4455, test_f1: 0.4601
 epoch: 82, train_loss: 0.8032, test_loss: 1.4165, test_f1: 0.4806
 epoch: 83, train_loss: 0.8224, test_loss: 1.3898, test_f1: 0.4835
 epoch: 84, train_loss: 0.8065, test_loss: 1.4145, test_f1: 0.4696
 epoch: 85, train_loss: 0.7929, test_loss: 1.3939, test_f1: 0.4794
 epoch: 86, train_loss: 0.8044, test_loss: 1.4567, test_f1: 0.4483
 epoch: 87, train_loss: 0.8087, test_loss: 1.4936, test_f1: 0.4551
 epoch: 88, train_loss: 0.8124, test_loss: 1.4892, test_f1: 0.4711
 epoch: 89, train_loss: 0.7865, test_loss: 1.4760, test_f1: 0.4551
 epoch: 90, train_loss: 0.7966, test_loss: 1.4981, test_f1: 0.4473
 epoch: 91, train_loss: 0.8131, test_loss: 1.4907, test_f1: 0.4543
 epoch: 92, train_loss: 0.8123, test_loss: 1.5289, test_f1: 0.4522
 epoch: 93, train_loss: 0.7928, test_loss: 1.4622, test_f1: 0.4702
 epoch: 94, train_loss: 0.8005, test_loss: 1.5312, test_f1: 0.4401
 epoch: 95, train_loss: 0.8102, test_loss: 1.4108, test_f1: 0.4586
 epoch: 96, train_loss: 0.8138, test_loss: 1.4071, test_f1: 0.4559
 epoch: 97, train_loss: 0.7975, test_loss: 1.4019, test_f1: 0.4506
 epoch: 98, train_loss: 0.8066, test_loss: 1.4315, test_f1: 0.4657
 epoch: 99, train_loss: 0.7946, test_loss: 1.4109, test_f1: 0.4695
##################ITERATION #4 ****************************************
 epoch: 0, train_loss: 1.3351, test_loss: 1.3551, test_f1: 0.2404
 epoch: 1, train_loss: 1.2363, test_loss: 1.3848, test_f1: 0.2404
 epoch: 2, train_loss: 1.2253, test_loss: 1.4193, test_f1: 0.2404
 epoch: 3, train_loss: 1.2174, test_loss: 1.4492, test_f1: 0.2459
 epoch: 4, train_loss: 1.1825, test_loss: 1.3870, test_f1: 0.2983
 epoch: 5, train_loss: 1.1835, test_loss: 1.3323, test_f1: 0.3219
 epoch: 6, train_loss: 1.1724, test_loss: 1.3100, test_f1: 0.3166
 epoch: 7, train_loss: 1.1650, test_loss: 1.3105, test_f1: 0.3387
 epoch: 8, train_loss: 1.1449, test_loss: 1.2982, test_f1: 0.3396
 epoch: 9, train_loss: 1.1468, test_loss: 1.2857, test_f1: 0.3311
 epoch: 10, train_loss: 1.1436, test_loss: 1.2823, test_f1: 0.3330
 epoch: 11, train_loss: 1.1202, test_loss: 1.2595, test_f1: 0.3715
 epoch: 12, train_loss: 1.1328, test_loss: 1.2376, test_f1: 0.3643
 epoch: 13, train_loss: 1.1149, test_loss: 1.2163, test_f1: 0.3939
 epoch: 14, train_loss: 1.1058, test_loss: 1.2036, test_f1: 0.3965
 epoch: 15, train_loss: 1.1054, test_loss: 1.2121, test_f1: 0.4118
 epoch: 16, train_loss: 1.1026, test_loss: 1.2053, test_f1: 0.4144
 epoch: 17, train_loss: 1.0911, test_loss: 1.1861, test_f1: 0.4243
 epoch: 18, train_loss: 1.0861, test_loss: 1.1780, test_f1: 0.4100
 epoch: 19, train_loss: 1.0710, test_loss: 1.1748, test_f1: 0.4153
 epoch: 20, train_loss: 1.0594, test_loss: 1.1740, test_f1: 0.4197
 epoch: 21, train_loss: 1.0558, test_loss: 1.2017, test_f1: 0.4211
 epoch: 22, train_loss: 1.0446, test_loss: 1.1895, test_f1: 0.4298
 epoch: 23, train_loss: 1.0401, test_loss: 1.1754, test_f1: 0.4670
 epoch: 24, train_loss: 1.0356, test_loss: 1.1665, test_f1: 0.4685
 epoch: 25, train_loss: 1.0200, test_loss: 1.1923, test_f1: 0.4646
 epoch: 26, train_loss: 1.0232, test_loss: 1.2123, test_f1: 0.4642
 epoch: 27, train_loss: 1.0124, test_loss: 1.1648, test_f1: 0.4824
 epoch: 28, train_loss: 1.0093, test_loss: 1.1658, test_f1: 0.4834
 epoch: 29, train_loss: 1.0108, test_loss: 1.1528, test_f1: 0.5059
 epoch: 30, train_loss: 0.9993, test_loss: 1.1343, test_f1: 0.5088
 epoch: 31, train_loss: 0.9926, test_loss: 1.1384, test_f1: 0.4858
 epoch: 32, train_loss: 0.9985, test_loss: 1.1305, test_f1: 0.4888
 epoch: 33, train_loss: 0.9787, test_loss: 1.1168, test_f1: 0.5141
 epoch: 34, train_loss: 0.9876, test_loss: 1.1232, test_f1: 0.5364
 epoch: 35, train_loss: 0.9700, test_loss: 1.1144, test_f1: 0.5259
 epoch: 36, train_loss: 0.9808, test_loss: 1.1358, test_f1: 0.5319
 epoch: 37, train_loss: 0.9697, test_loss: 1.1440, test_f1: 0.5092
 epoch: 38, train_loss: 0.9411, test_loss: 1.1202, test_f1: 0.5526
 epoch: 39, train_loss: 0.9452, test_loss: 1.1156, test_f1: 0.5362
 epoch: 40, train_loss: 0.9539, test_loss: 1.1288, test_f1: 0.5156
 epoch: 41, train_loss: 0.9367, test_loss: 1.1254, test_f1: 0.5257
 epoch: 42, train_loss: 0.9306, test_loss: 1.1560, test_f1: 0.5338
 epoch: 43, train_loss: 0.9409, test_loss: 1.1171, test_f1: 0.5419
 epoch: 44, train_loss: 0.9142, test_loss: 1.1066, test_f1: 0.5568
 epoch: 45, train_loss: 0.9217, test_loss: 1.0978, test_f1: 0.5712
 epoch: 46, train_loss: 0.9198, test_loss: 1.1219, test_f1: 0.5604
 epoch: 47, train_loss: 0.9205, test_loss: 1.1157, test_f1: 0.5700
 epoch: 48, train_loss: 0.9196, test_loss: 1.1212, test_f1: 0.5320
 epoch: 49, train_loss: 0.9165, test_loss: 1.1202, test_f1: 0.5421
 epoch: 50, train_loss: 0.9109, test_loss: 1.1003, test_f1: 0.5503
 epoch: 51, train_loss: 0.8824, test_loss: 1.1027, test_f1: 0.5648
 epoch: 52, train_loss: 0.8877, test_loss: 1.0948, test_f1: 0.5720
 epoch: 53, train_loss: 0.8868, test_loss: 1.0828, test_f1: 0.5718
 epoch: 54, train_loss: 0.8824, test_loss: 1.0886, test_f1: 0.5538
 epoch: 55, train_loss: 0.8900, test_loss: 1.0948, test_f1: 0.5601
 epoch: 56, train_loss: 0.8789, test_loss: 1.1070, test_f1: 0.5626
 epoch: 57, train_loss: 0.8855, test_loss: 1.1107, test_f1: 0.5428
 epoch: 58, train_loss: 0.8734, test_loss: 1.1019, test_f1: 0.5550
 epoch: 59, train_loss: 0.8783, test_loss: 1.1022, test_f1: 0.5432
 epoch: 60, train_loss: 0.8591, test_loss: 1.1042, test_f1: 0.5442
 epoch: 61, train_loss: 0.8695, test_loss: 1.1224, test_f1: 0.5423
 epoch: 62, train_loss: 0.8771, test_loss: 1.1064, test_f1: 0.5551
 epoch: 63, train_loss: 0.8630, test_loss: 1.1093, test_f1: 0.5387
 epoch: 64, train_loss: 0.8643, test_loss: 1.1185, test_f1: 0.5439
 epoch: 65, train_loss: 0.8637, test_loss: 1.1308, test_f1: 0.5550
 epoch: 66, train_loss: 0.8491, test_loss: 1.1231, test_f1: 0.5380
 epoch: 67, train_loss: 0.8621, test_loss: 1.1178, test_f1: 0.5471
 epoch: 68, train_loss: 0.8569, test_loss: 1.1131, test_f1: 0.5396
 epoch: 69, train_loss: 0.8539, test_loss: 1.1044, test_f1: 0.5436
 epoch: 70, train_loss: 0.8488, test_loss: 1.1101, test_f1: 0.5640
 epoch: 71, train_loss: 0.8710, test_loss: 1.1286, test_f1: 0.5477
 epoch: 72, train_loss: 0.8415, test_loss: 1.1173, test_f1: 0.5512
 epoch: 73, train_loss: 0.8414, test_loss: 1.0999, test_f1: 0.5639
 epoch: 74, train_loss: 0.8441, test_loss: 1.1110, test_f1: 0.5577
 epoch: 75, train_loss: 0.8560, test_loss: 1.1167, test_f1: 0.5414
 epoch: 76, train_loss: 0.8430, test_loss: 1.1173, test_f1: 0.5516
 epoch: 77, train_loss: 0.8429, test_loss: 1.1179, test_f1: 0.5445
 epoch: 78, train_loss: 0.8375, test_loss: 1.1202, test_f1: 0.5422
 epoch: 79, train_loss: 0.8227, test_loss: 1.1244, test_f1: 0.5285
 epoch: 80, train_loss: 0.8167, test_loss: 1.1164, test_f1: 0.5421
 epoch: 81, train_loss: 0.8303, test_loss: 1.1495, test_f1: 0.5333
 epoch: 82, train_loss: 0.8392, test_loss: 1.1289, test_f1: 0.5257
 epoch: 83, train_loss: 0.8096, test_loss: 1.1365, test_f1: 0.5323
 epoch: 84, train_loss: 0.8153, test_loss: 1.1286, test_f1: 0.5299
 epoch: 85, train_loss: 0.8231, test_loss: 1.1386, test_f1: 0.5474
 epoch: 86, train_loss: 0.8147, test_loss: 1.1349, test_f1: 0.5453
 epoch: 87, train_loss: 0.8330, test_loss: 1.1157, test_f1: 0.5127
 epoch: 88, train_loss: 0.8365, test_loss: 1.1510, test_f1: 0.5297
 epoch: 89, train_loss: 0.8235, test_loss: 1.1313, test_f1: 0.5354
 epoch: 90, train_loss: 0.8117, test_loss: 1.1446, test_f1: 0.5340
 epoch: 91, train_loss: 0.8109, test_loss: 1.1625, test_f1: 0.5481
 epoch: 92, train_loss: 0.8126, test_loss: 1.1442, test_f1: 0.5246
 epoch: 93, train_loss: 0.8079, test_loss: 1.1374, test_f1: 0.5421
 epoch: 94, train_loss: 0.8194, test_loss: 1.1473, test_f1: 0.5204
 epoch: 95, train_loss: 0.8294, test_loss: 1.1627, test_f1: 0.5454
 epoch: 96, train_loss: 0.8109, test_loss: 1.2010, test_f1: 0.5174
 epoch: 97, train_loss: 0.7975, test_loss: 1.1865, test_f1: 0.5082
 epoch: 98, train_loss: 0.8167, test_loss: 1.1900, test_f1: 0.5188
 epoch: 99, train_loss: 0.8160, test_loss: 1.1629, test_f1: 0.5320
##################ITERATION #5 ****************************************
 epoch: 0, train_loss: 1.2901, test_loss: 1.3462, test_f1: 0.2281
 epoch: 1, train_loss: 1.2562, test_loss: 1.3286, test_f1: 0.2281
 epoch: 2, train_loss: 1.2408, test_loss: 1.3085, test_f1: 0.2259
 epoch: 3, train_loss: 1.2322, test_loss: 1.2989, test_f1: 0.2404
 epoch: 4, train_loss: 1.2218, test_loss: 1.2848, test_f1: 0.2404
 epoch: 5, train_loss: 1.2032, test_loss: 1.2918, test_f1: 0.2595
 epoch: 6, train_loss: 1.2121, test_loss: 1.2918, test_f1: 0.2534
 epoch: 7, train_loss: 1.1956, test_loss: 1.2862, test_f1: 0.2878
 epoch: 8, train_loss: 1.1965, test_loss: 1.2649, test_f1: 0.2826
 epoch: 9, train_loss: 1.1850, test_loss: 1.2516, test_f1: 0.2767
 epoch: 10, train_loss: 1.1728, test_loss: 1.2642, test_f1: 0.2743
 epoch: 11, train_loss: 1.1801, test_loss: 1.2381, test_f1: 0.2435
 epoch: 12, train_loss: 1.1702, test_loss: 1.2417, test_f1: 0.2502
 epoch: 13, train_loss: 1.1691, test_loss: 1.2316, test_f1: 0.2688
 epoch: 14, train_loss: 1.1634, test_loss: 1.2184, test_f1: 0.3073
 epoch: 15, train_loss: 1.1563, test_loss: 1.2228, test_f1: 0.3008
 epoch: 16, train_loss: 1.1515, test_loss: 1.2182, test_f1: 0.3279
 epoch: 17, train_loss: 1.1481, test_loss: 1.2107, test_f1: 0.3295
 epoch: 18, train_loss: 1.1370, test_loss: 1.1983, test_f1: 0.3417
 epoch: 19, train_loss: 1.1432, test_loss: 1.1966, test_f1: 0.3339
 epoch: 20, train_loss: 1.1345, test_loss: 1.1906, test_f1: 0.3423
 epoch: 21, train_loss: 1.1106, test_loss: 1.1911, test_f1: 0.3447
 epoch: 22, train_loss: 1.1266, test_loss: 1.1880, test_f1: 0.3529
 epoch: 23, train_loss: 1.1078, test_loss: 1.1729, test_f1: 0.3622
 epoch: 24, train_loss: 1.1151, test_loss: 1.1954, test_f1: 0.3578
 epoch: 25, train_loss: 1.1143, test_loss: 1.1765, test_f1: 0.3645
 epoch: 26, train_loss: 1.0925, test_loss: 1.1686, test_f1: 0.3758
 epoch: 27, train_loss: 1.1008, test_loss: 1.1740, test_f1: 0.3800
 epoch: 28, train_loss: 1.0850, test_loss: 1.1904, test_f1: 0.4088
 epoch: 29, train_loss: 1.0989, test_loss: 1.1563, test_f1: 0.4191
 epoch: 30, train_loss: 1.0809, test_loss: 1.1605, test_f1: 0.4245
 epoch: 31, train_loss: 1.0988, test_loss: 1.1568, test_f1: 0.4104
 epoch: 32, train_loss: 1.0639, test_loss: 1.1559, test_f1: 0.4024
 epoch: 33, train_loss: 1.0671, test_loss: 1.1516, test_f1: 0.4337
 epoch: 34, train_loss: 1.0606, test_loss: 1.1627, test_f1: 0.4301
 epoch: 35, train_loss: 1.0772, test_loss: 1.1380, test_f1: 0.4534
 epoch: 36, train_loss: 1.0711, test_loss: 1.1907, test_f1: 0.4340
 epoch: 37, train_loss: 1.0694, test_loss: 1.1786, test_f1: 0.4407
 epoch: 38, train_loss: 1.0490, test_loss: 1.1482, test_f1: 0.4561
 epoch: 39, train_loss: 1.0281, test_loss: 1.1684, test_f1: 0.4629
 epoch: 40, train_loss: 1.0273, test_loss: 1.1392, test_f1: 0.4509
 epoch: 41, train_loss: 1.0330, test_loss: 1.2084, test_f1: 0.4423
 epoch: 42, train_loss: 1.0164, test_loss: 1.1660, test_f1: 0.4654
 epoch: 43, train_loss: 1.0114, test_loss: 1.1644, test_f1: 0.4791
 epoch: 44, train_loss: 1.0036, test_loss: 1.3174, test_f1: 0.4396
 epoch: 45, train_loss: 1.0018, test_loss: 1.1933, test_f1: 0.4538
 epoch: 46, train_loss: 0.9922, test_loss: 1.1936, test_f1: 0.4639
 epoch: 47, train_loss: 1.0145, test_loss: 1.1204, test_f1: 0.4950
 epoch: 48, train_loss: 0.9994, test_loss: 1.1545, test_f1: 0.4662
 epoch: 49, train_loss: 0.9883, test_loss: 1.1726, test_f1: 0.4764
 epoch: 50, train_loss: 0.9926, test_loss: 1.1414, test_f1: 0.4778
 epoch: 51, train_loss: 0.9778, test_loss: 1.1186, test_f1: 0.4734
 epoch: 52, train_loss: 0.9585, test_loss: 1.1363, test_f1: 0.4966
 epoch: 53, train_loss: 0.9557, test_loss: 1.1343, test_f1: 0.4984
 epoch: 54, train_loss: 0.9616, test_loss: 1.1453, test_f1: 0.4808
 epoch: 55, train_loss: 0.9506, test_loss: 1.1621, test_f1: 0.4745
 epoch: 56, train_loss: 0.9445, test_loss: 1.2025, test_f1: 0.4727
 epoch: 57, train_loss: 0.9686, test_loss: 1.1862, test_f1: 0.4928
 epoch: 58, train_loss: 0.9525, test_loss: 1.1428, test_f1: 0.4920
 epoch: 59, train_loss: 0.9413, test_loss: 1.1543, test_f1: 0.4843
 epoch: 60, train_loss: 0.9464, test_loss: 1.1422, test_f1: 0.4878
 epoch: 61, train_loss: 0.9582, test_loss: 1.1674, test_f1: 0.4854
 epoch: 62, train_loss: 0.9443, test_loss: 1.1369, test_f1: 0.5018
 epoch: 63, train_loss: 0.9419, test_loss: 1.1602, test_f1: 0.4879
 epoch: 64, train_loss: 0.9300, test_loss: 1.1505, test_f1: 0.4860
 epoch: 65, train_loss: 0.9392, test_loss: 1.1419, test_f1: 0.4929
 epoch: 66, train_loss: 0.9468, test_loss: 1.1652, test_f1: 0.4888
 epoch: 67, train_loss: 0.9203, test_loss: 1.1611, test_f1: 0.4919
 epoch: 68, train_loss: 0.9326, test_loss: 1.1562, test_f1: 0.5012
 epoch: 69, train_loss: 0.9154, test_loss: 1.2163, test_f1: 0.5032
 epoch: 70, train_loss: 0.9311, test_loss: 1.1854, test_f1: 0.4829
 epoch: 71, train_loss: 0.9103, test_loss: 1.1672, test_f1: 0.5038
 epoch: 72, train_loss: 0.9202, test_loss: 1.1930, test_f1: 0.4764
 epoch: 73, train_loss: 0.9248, test_loss: 1.1459, test_f1: 0.4831
 epoch: 74, train_loss: 0.9174, test_loss: 1.1836, test_f1: 0.4927
 epoch: 75, train_loss: 0.9235, test_loss: 1.1699, test_f1: 0.4997
 epoch: 76, train_loss: 0.9103, test_loss: 1.2127, test_f1: 0.4994
 epoch: 77, train_loss: 0.9098, test_loss: 1.2116, test_f1: 0.4878
 epoch: 78, train_loss: 0.9069, test_loss: 1.2101, test_f1: 0.4851
 epoch: 79, train_loss: 0.9175, test_loss: 1.2005, test_f1: 0.5082
 epoch: 80, train_loss: 0.9245, test_loss: 1.3018, test_f1: 0.4935
 epoch: 81, train_loss: 0.9263, test_loss: 1.2854, test_f1: 0.5044
 epoch: 82, train_loss: 0.9286, test_loss: 1.2319, test_f1: 0.4927
 epoch: 83, train_loss: 0.9215, test_loss: 1.1633, test_f1: 0.4981
 epoch: 84, train_loss: 0.9067, test_loss: 1.2060, test_f1: 0.5041
 epoch: 85, train_loss: 0.9188, test_loss: 1.2060, test_f1: 0.5017
 epoch: 86, train_loss: 0.9218, test_loss: 1.2887, test_f1: 0.4869
 epoch: 87, train_loss: 0.8977, test_loss: 1.2826, test_f1: 0.5099
 epoch: 88, train_loss: 0.8779, test_loss: 1.2856, test_f1: 0.4894
 epoch: 89, train_loss: 0.8682, test_loss: 1.3043, test_f1: 0.5105
 epoch: 90, train_loss: 0.8972, test_loss: 1.2847, test_f1: 0.5052
 epoch: 91, train_loss: 0.9047, test_loss: 1.2574, test_f1: 0.4967
 epoch: 92, train_loss: 0.8759, test_loss: 1.2424, test_f1: 0.5027
 epoch: 93, train_loss: 0.9005, test_loss: 1.2322, test_f1: 0.5043
 epoch: 94, train_loss: 0.8979, test_loss: 1.2105, test_f1: 0.4887
 epoch: 95, train_loss: 0.9038, test_loss: 1.2006, test_f1: 0.5023
 epoch: 96, train_loss: 0.8865, test_loss: 1.2073, test_f1: 0.5023
 epoch: 97, train_loss: 0.8800, test_loss: 1.2174, test_f1: 0.5130
 epoch: 98, train_loss: 0.8809, test_loss: 1.2479, test_f1: 0.5176
 epoch: 99, train_loss: 0.8750, test_loss: 1.2844, test_f1: 0.4992
##################ITERATION #6 ****************************************
 epoch: 0, train_loss: 1.3099, test_loss: 1.3744, test_f1: 0.2404
 epoch: 1, train_loss: 1.2547, test_loss: 1.3550, test_f1: 0.2401
 epoch: 2, train_loss: 1.2534, test_loss: 1.3317, test_f1: 0.2404
 epoch: 3, train_loss: 1.2281, test_loss: 1.3588, test_f1: 0.2379
 epoch: 4, train_loss: 1.2195, test_loss: 1.3425, test_f1: 0.3001
 epoch: 5, train_loss: 1.2212, test_loss: 1.3272, test_f1: 0.2803
 epoch: 6, train_loss: 1.2028, test_loss: 1.3092, test_f1: 0.2831
 epoch: 7, train_loss: 1.1983, test_loss: 1.2918, test_f1: 0.3049
 epoch: 8, train_loss: 1.1950, test_loss: 1.2966, test_f1: 0.3453
 epoch: 9, train_loss: 1.1909, test_loss: 1.2917, test_f1: 0.3204
 epoch: 10, train_loss: 1.1895, test_loss: 1.2948, test_f1: 0.3367
 epoch: 11, train_loss: 1.1759, test_loss: 1.2881, test_f1: 0.3467
 epoch: 12, train_loss: 1.1702, test_loss: 1.2822, test_f1: 0.3531
 epoch: 13, train_loss: 1.1757, test_loss: 1.2755, test_f1: 0.3618
 epoch: 14, train_loss: 1.1631, test_loss: 1.2695, test_f1: 0.3611
 epoch: 15, train_loss: 1.1613, test_loss: 1.2760, test_f1: 0.3764
 epoch: 16, train_loss: 1.1442, test_loss: 1.2515, test_f1: 0.3789
 epoch: 17, train_loss: 1.1507, test_loss: 1.2579, test_f1: 0.3924
 epoch: 18, train_loss: 1.1331, test_loss: 1.2488, test_f1: 0.4133
 epoch: 19, train_loss: 1.1319, test_loss: 1.2463, test_f1: 0.3972
 epoch: 20, train_loss: 1.1349, test_loss: 1.2316, test_f1: 0.3923
 epoch: 21, train_loss: 1.1370, test_loss: 1.2276, test_f1: 0.3984
 epoch: 22, train_loss: 1.1202, test_loss: 1.2331, test_f1: 0.3870
 epoch: 23, train_loss: 1.1184, test_loss: 1.2452, test_f1: 0.4005
 epoch: 24, train_loss: 1.1058, test_loss: 1.2477, test_f1: 0.4158
 epoch: 25, train_loss: 1.1162, test_loss: 1.2518, test_f1: 0.4150
 epoch: 26, train_loss: 1.1036, test_loss: 1.2618, test_f1: 0.3643
 epoch: 27, train_loss: 1.0981, test_loss: 1.2744, test_f1: 0.4114
 epoch: 28, train_loss: 1.0942, test_loss: 1.3056, test_f1: 0.4028
 epoch: 29, train_loss: 1.0977, test_loss: 1.2773, test_f1: 0.3877
 epoch: 30, train_loss: 1.0821, test_loss: 1.2555, test_f1: 0.4077
 epoch: 31, train_loss: 1.0823, test_loss: 1.2439, test_f1: 0.4142
 epoch: 32, train_loss: 1.0892, test_loss: 1.2635, test_f1: 0.3666
 epoch: 33, train_loss: 1.0930, test_loss: 1.2750, test_f1: 0.4255
 epoch: 34, train_loss: 1.0832, test_loss: 1.2883, test_f1: 0.4043
 epoch: 35, train_loss: 1.0740, test_loss: 1.2388, test_f1: 0.4418
 epoch: 36, train_loss: 1.0739, test_loss: 1.3022, test_f1: 0.4095
 epoch: 37, train_loss: 1.0660, test_loss: 1.3018, test_f1: 0.3917
 epoch: 38, train_loss: 1.0621, test_loss: 1.3116, test_f1: 0.4011
 epoch: 39, train_loss: 1.0541, test_loss: 1.2886, test_f1: 0.4310
 epoch: 40, train_loss: 1.0596, test_loss: 1.2838, test_f1: 0.3988
 epoch: 41, train_loss: 1.0581, test_loss: 1.2783, test_f1: 0.4181
 epoch: 42, train_loss: 1.0378, test_loss: 1.2632, test_f1: 0.4006
 epoch: 43, train_loss: 1.0370, test_loss: 1.2829, test_f1: 0.3560
 epoch: 44, train_loss: 1.0535, test_loss: 1.2837, test_f1: 0.3709
 epoch: 45, train_loss: 1.0382, test_loss: 1.2938, test_f1: 0.3940
 epoch: 46, train_loss: 1.0257, test_loss: 1.2949, test_f1: 0.4084
 epoch: 47, train_loss: 1.0279, test_loss: 1.3182, test_f1: 0.3853
 epoch: 48, train_loss: 1.0223, test_loss: 1.3114, test_f1: 0.4041
 epoch: 49, train_loss: 1.0177, test_loss: 1.3010, test_f1: 0.4451
 epoch: 50, train_loss: 1.0139, test_loss: 1.3178, test_f1: 0.4422
 epoch: 51, train_loss: 0.9877, test_loss: 1.2918, test_f1: 0.4277
 epoch: 52, train_loss: 0.9842, test_loss: 1.3036, test_f1: 0.4335
 epoch: 53, train_loss: 1.0136, test_loss: 1.3090, test_f1: 0.4420
 epoch: 54, train_loss: 0.9961, test_loss: 1.3042, test_f1: 0.4472
 epoch: 55, train_loss: 1.0030, test_loss: 1.2870, test_f1: 0.4197
 epoch: 56, train_loss: 0.9910, test_loss: 1.2999, test_f1: 0.4200
 epoch: 57, train_loss: 0.9931, test_loss: 1.2867, test_f1: 0.4177
 epoch: 58, train_loss: 0.9851, test_loss: 1.2910, test_f1: 0.4106
 epoch: 59, train_loss: 0.9798, test_loss: 1.2816, test_f1: 0.4354
 epoch: 60, train_loss: 0.9844, test_loss: 1.2906, test_f1: 0.4195
 epoch: 61, train_loss: 0.9814, test_loss: 1.2964, test_f1: 0.4278
 epoch: 62, train_loss: 0.9709, test_loss: 1.2746, test_f1: 0.4250
 epoch: 63, train_loss: 0.9685, test_loss: 1.3009, test_f1: 0.4456
 epoch: 64, train_loss: 0.9722, test_loss: 1.3031, test_f1: 0.4475
 epoch: 65, train_loss: 0.9674, test_loss: 1.3088, test_f1: 0.4394
 epoch: 66, train_loss: 0.9505, test_loss: 1.2920, test_f1: 0.4490
 epoch: 67, train_loss: 0.9539, test_loss: 1.3113, test_f1: 0.4404
 epoch: 68, train_loss: 0.9679, test_loss: 1.3201, test_f1: 0.4333
 epoch: 69, train_loss: 0.9528, test_loss: 1.3098, test_f1: 0.4367
 epoch: 70, train_loss: 0.9586, test_loss: 1.3034, test_f1: 0.4284
 epoch: 71, train_loss: 0.9639, test_loss: 1.3069, test_f1: 0.4648
 epoch: 72, train_loss: 0.9487, test_loss: 1.2929, test_f1: 0.4323
 epoch: 73, train_loss: 0.9601, test_loss: 1.3016, test_f1: 0.4329
 epoch: 74, train_loss: 0.9526, test_loss: 1.2895, test_f1: 0.4316
 epoch: 75, train_loss: 0.9564, test_loss: 1.3043, test_f1: 0.4449
 epoch: 76, train_loss: 0.9402, test_loss: 1.3316, test_f1: 0.4356
 epoch: 77, train_loss: 0.9352, test_loss: 1.3106, test_f1: 0.4449
 epoch: 78, train_loss: 0.9446, test_loss: 1.2933, test_f1: 0.4447
 epoch: 79, train_loss: 0.9579, test_loss: 1.3039, test_f1: 0.4440
 epoch: 80, train_loss: 0.9387, test_loss: 1.3085, test_f1: 0.4551
 epoch: 81, train_loss: 0.9423, test_loss: 1.3152, test_f1: 0.4172
 epoch: 82, train_loss: 0.9333, test_loss: 1.3348, test_f1: 0.4310
 epoch: 83, train_loss: 0.9305, test_loss: 1.3090, test_f1: 0.4446
 epoch: 84, train_loss: 0.9339, test_loss: 1.3040, test_f1: 0.4464
 epoch: 85, train_loss: 0.9315, test_loss: 1.3331, test_f1: 0.4289
 epoch: 86, train_loss: 0.9239, test_loss: 1.3639, test_f1: 0.4362
 epoch: 87, train_loss: 0.9590, test_loss: 1.3388, test_f1: 0.4302
 epoch: 88, train_loss: 0.9220, test_loss: 1.3797, test_f1: 0.4518
 epoch: 89, train_loss: 0.9302, test_loss: 1.4144, test_f1: 0.4698
 epoch: 90, train_loss: 0.9358, test_loss: 1.4847, test_f1: 0.4463
 epoch: 91, train_loss: 0.9198, test_loss: 1.4428, test_f1: 0.4446
 epoch: 92, train_loss: 0.9237, test_loss: 1.3860, test_f1: 0.4570
 epoch: 93, train_loss: 0.9284, test_loss: 1.3390, test_f1: 0.4597
 epoch: 94, train_loss: 0.9357, test_loss: 1.3264, test_f1: 0.4575
 epoch: 95, train_loss: 0.9219, test_loss: 1.3296, test_f1: 0.4622
 epoch: 96, train_loss: 0.9122, test_loss: 1.3669, test_f1: 0.4526
 epoch: 97, train_loss: 0.9226, test_loss: 1.3470, test_f1: 0.4623
 epoch: 98, train_loss: 0.9132, test_loss: 1.3258, test_f1: 0.4499
 epoch: 99, train_loss: 0.9076, test_loss: 1.3484, test_f1: 0.4375
##################ITERATION #7 ****************************************
 epoch: 0, train_loss: 1.2965, test_loss: 1.3133, test_f1: 0.2281
 epoch: 1, train_loss: 1.2325, test_loss: 1.3004, test_f1: 0.2281
 epoch: 2, train_loss: 1.2125, test_loss: 1.2691, test_f1: 0.2270
 epoch: 3, train_loss: 1.2007, test_loss: 1.2588, test_f1: 0.2686
 epoch: 4, train_loss: 1.1839, test_loss: 1.2522, test_f1: 0.2938
 epoch: 5, train_loss: 1.1573, test_loss: 1.2427, test_f1: 0.3101
 epoch: 6, train_loss: 1.1587, test_loss: 1.2496, test_f1: 0.3345
 epoch: 7, train_loss: 1.1518, test_loss: 1.2335, test_f1: 0.3440
 epoch: 8, train_loss: 1.1536, test_loss: 1.2358, test_f1: 0.3026
 epoch: 9, train_loss: 1.1318, test_loss: 1.2289, test_f1: 0.3399
 epoch: 10, train_loss: 1.1302, test_loss: 1.2319, test_f1: 0.3510
 epoch: 11, train_loss: 1.1165, test_loss: 1.2196, test_f1: 0.3446
 epoch: 12, train_loss: 1.1199, test_loss: 1.2338, test_f1: 0.3597
 epoch: 13, train_loss: 1.0994, test_loss: 1.2328, test_f1: 0.3885
 epoch: 14, train_loss: 1.0864, test_loss: 1.2285, test_f1: 0.3794
 epoch: 15, train_loss: 1.1026, test_loss: 1.2365, test_f1: 0.3974
 epoch: 16, train_loss: 1.0928, test_loss: 1.2175, test_f1: 0.3963
 epoch: 17, train_loss: 1.0790, test_loss: 1.2402, test_f1: 0.3791
 epoch: 18, train_loss: 1.0846, test_loss: 1.2194, test_f1: 0.3946
 epoch: 19, train_loss: 1.0782, test_loss: 1.1984, test_f1: 0.4221
 epoch: 20, train_loss: 1.0767, test_loss: 1.2153, test_f1: 0.4043
 epoch: 21, train_loss: 1.0674, test_loss: 1.2443, test_f1: 0.3978
 epoch: 22, train_loss: 1.0706, test_loss: 1.2125, test_f1: 0.4449
 epoch: 23, train_loss: 1.0599, test_loss: 1.1852, test_f1: 0.4507
 epoch: 24, train_loss: 1.0368, test_loss: 1.2247, test_f1: 0.4297
 epoch: 25, train_loss: 1.0316, test_loss: 1.2011, test_f1: 0.4853
 epoch: 26, train_loss: 1.0440, test_loss: 1.1841, test_f1: 0.4610
 epoch: 27, train_loss: 1.0517, test_loss: 1.1769, test_f1: 0.4632
 epoch: 28, train_loss: 1.0303, test_loss: 1.1805, test_f1: 0.4586
 epoch: 29, train_loss: 1.0171, test_loss: 1.2031, test_f1: 0.4272
 epoch: 30, train_loss: 1.0078, test_loss: 1.1667, test_f1: 0.4840
 epoch: 31, train_loss: 1.0143, test_loss: 1.1631, test_f1: 0.4837
 epoch: 32, train_loss: 0.9903, test_loss: 1.1477, test_f1: 0.4865
 epoch: 33, train_loss: 0.9951, test_loss: 1.1499, test_f1: 0.4526
 epoch: 34, train_loss: 0.9818, test_loss: 1.1358, test_f1: 0.4912
 epoch: 35, train_loss: 1.0060, test_loss: 1.1624, test_f1: 0.4994
 epoch: 36, train_loss: 0.9666, test_loss: 1.1653, test_f1: 0.4776
 epoch: 37, train_loss: 0.9922, test_loss: 1.1380, test_f1: 0.4892
 epoch: 38, train_loss: 0.9923, test_loss: 1.1535, test_f1: 0.4286
 epoch: 39, train_loss: 0.9616, test_loss: 1.1358, test_f1: 0.4985
 epoch: 40, train_loss: 0.9730, test_loss: 1.1311, test_f1: 0.5014
 epoch: 41, train_loss: 0.9655, test_loss: 1.1483, test_f1: 0.4388
 epoch: 42, train_loss: 0.9624, test_loss: 1.1342, test_f1: 0.5059
 epoch: 43, train_loss: 0.9501, test_loss: 1.1724, test_f1: 0.4776
 epoch: 44, train_loss: 0.9609, test_loss: 1.1294, test_f1: 0.5010
 epoch: 45, train_loss: 0.9465, test_loss: 1.1406, test_f1: 0.4634
 epoch: 46, train_loss: 0.9441, test_loss: 1.1514, test_f1: 0.4662
 epoch: 47, train_loss: 0.9408, test_loss: 1.1476, test_f1: 0.4777
 epoch: 48, train_loss: 0.9514, test_loss: 1.1399, test_f1: 0.5174
 epoch: 49, train_loss: 0.9526, test_loss: 1.1382, test_f1: 0.4798
 epoch: 50, train_loss: 0.9446, test_loss: 1.1579, test_f1: 0.4853
 epoch: 51, train_loss: 0.9380, test_loss: 1.1495, test_f1: 0.4867
 epoch: 52, train_loss: 0.9230, test_loss: 1.1525, test_f1: 0.4880
 epoch: 53, train_loss: 0.9357, test_loss: 1.1220, test_f1: 0.5046
 epoch: 54, train_loss: 0.9310, test_loss: 1.1279, test_f1: 0.4976
 epoch: 55, train_loss: 0.9267, test_loss: 1.1555, test_f1: 0.4782
 epoch: 56, train_loss: 0.9080, test_loss: 1.1603, test_f1: 0.4622
 epoch: 57, train_loss: 0.9153, test_loss: 1.1482, test_f1: 0.4816
 epoch: 58, train_loss: 0.9097, test_loss: 1.1332, test_f1: 0.4740
 epoch: 59, train_loss: 0.9311, test_loss: 1.1221, test_f1: 0.5032
 epoch: 60, train_loss: 0.9151, test_loss: 1.1380, test_f1: 0.4759
 epoch: 61, train_loss: 0.9175, test_loss: 1.1314, test_f1: 0.4835
 epoch: 62, train_loss: 0.9194, test_loss: 1.1155, test_f1: 0.5014
 epoch: 63, train_loss: 0.8979, test_loss: 1.1227, test_f1: 0.4833
 epoch: 64, train_loss: 0.8974, test_loss: 1.1148, test_f1: 0.4967
 epoch: 65, train_loss: 0.9055, test_loss: 1.1347, test_f1: 0.4705
 epoch: 66, train_loss: 0.8903, test_loss: 1.1067, test_f1: 0.5064
 epoch: 67, train_loss: 0.8889, test_loss: 1.1265, test_f1: 0.4993
 epoch: 68, train_loss: 0.9062, test_loss: 1.1216, test_f1: 0.4821
 epoch: 69, train_loss: 0.8932, test_loss: 1.1289, test_f1: 0.5141
 epoch: 70, train_loss: 0.8909, test_loss: 1.1130, test_f1: 0.5050
 epoch: 71, train_loss: 0.8928, test_loss: 1.1212, test_f1: 0.5086
 epoch: 72, train_loss: 0.8921, test_loss: 1.1412, test_f1: 0.4719
 epoch: 73, train_loss: 0.8880, test_loss: 1.1352, test_f1: 0.4882
 epoch: 74, train_loss: 0.8620, test_loss: 1.1343, test_f1: 0.5125
 epoch: 75, train_loss: 0.8745, test_loss: 1.1158, test_f1: 0.5134
 epoch: 76, train_loss: 0.8623, test_loss: 1.1315, test_f1: 0.5065
 epoch: 77, train_loss: 0.8698, test_loss: 1.1305, test_f1: 0.4893
 epoch: 78, train_loss: 0.8846, test_loss: 1.1470, test_f1: 0.4898
 epoch: 79, train_loss: 0.8829, test_loss: 1.1010, test_f1: 0.5170
 epoch: 80, train_loss: 0.8550, test_loss: 1.0785, test_f1: 0.4986
 epoch: 81, train_loss: 0.8810, test_loss: 1.1133, test_f1: 0.5323
 epoch: 82, train_loss: 0.8642, test_loss: 1.0937, test_f1: 0.5189
 epoch: 83, train_loss: 0.8689, test_loss: 1.0868, test_f1: 0.5297
 epoch: 84, train_loss: 0.8640, test_loss: 1.1226, test_f1: 0.5001
 epoch: 85, train_loss: 0.8553, test_loss: 1.1321, test_f1: 0.4765
 epoch: 86, train_loss: 0.9045, test_loss: 1.1382, test_f1: 0.4847
 epoch: 87, train_loss: 0.8992, test_loss: 1.1342, test_f1: 0.5148
 epoch: 88, train_loss: 0.8897, test_loss: 1.1296, test_f1: 0.5178
 epoch: 89, train_loss: 0.8769, test_loss: 1.0988, test_f1: 0.4693
 epoch: 90, train_loss: 0.8929, test_loss: 1.1078, test_f1: 0.4902
 epoch: 91, train_loss: 0.8465, test_loss: 1.1048, test_f1: 0.5146
 epoch: 92, train_loss: 0.8607, test_loss: 1.1237, test_f1: 0.5245
 epoch: 93, train_loss: 0.8403, test_loss: 1.1249, test_f1: 0.5019
 epoch: 94, train_loss: 0.8578, test_loss: 1.1387, test_f1: 0.4992
 epoch: 95, train_loss: 0.8459, test_loss: 1.1180, test_f1: 0.5143
 epoch: 96, train_loss: 0.8484, test_loss: 1.1041, test_f1: 0.4869
 epoch: 97, train_loss: 0.8399, test_loss: 1.1055, test_f1: 0.5089
 epoch: 98, train_loss: 0.8472, test_loss: 1.1147, test_f1: 0.4977
 epoch: 99, train_loss: 0.8381, test_loss: 1.1414, test_f1: 0.5129
##################ITERATION #8 ****************************************
 epoch: 0, train_loss: 1.3242, test_loss: 1.3945, test_f1: 0.2357
 epoch: 1, train_loss: 1.2582, test_loss: 1.3775, test_f1: 0.2354
 epoch: 2, train_loss: 1.2313, test_loss: 1.3631, test_f1: 0.2379
 epoch: 3, train_loss: 1.2254, test_loss: 1.3718, test_f1: 0.2625
 epoch: 4, train_loss: 1.2048, test_loss: 1.3731, test_f1: 0.2678
 epoch: 5, train_loss: 1.1960, test_loss: 1.3480, test_f1: 0.3006
 epoch: 6, train_loss: 1.1883, test_loss: 1.3330, test_f1: 0.2948
 epoch: 7, train_loss: 1.1698, test_loss: 1.3128, test_f1: 0.3268
 epoch: 8, train_loss: 1.1449, test_loss: 1.3125, test_f1: 0.3284
 epoch: 9, train_loss: 1.1463, test_loss: 1.3122, test_f1: 0.3326
 epoch: 10, train_loss: 1.1316, test_loss: 1.3036, test_f1: 0.3490
 epoch: 11, train_loss: 1.1162, test_loss: 1.2907, test_f1: 0.4056
 epoch: 12, train_loss: 1.1167, test_loss: 1.2717, test_f1: 0.4177
 epoch: 13, train_loss: 1.1108, test_loss: 1.2393, test_f1: 0.4679
 epoch: 14, train_loss: 1.0998, test_loss: 1.2439, test_f1: 0.4670
 epoch: 15, train_loss: 1.0824, test_loss: 1.2516, test_f1: 0.4661
 epoch: 16, train_loss: 1.0727, test_loss: 1.2159, test_f1: 0.5002
 epoch: 17, train_loss: 1.0571, test_loss: 1.1987, test_f1: 0.5068
 epoch: 18, train_loss: 1.0585, test_loss: 1.2201, test_f1: 0.4968
 epoch: 19, train_loss: 1.0438, test_loss: 1.2218, test_f1: 0.4995
 epoch: 20, train_loss: 1.0354, test_loss: 1.2160, test_f1: 0.4975
 epoch: 21, train_loss: 1.0475, test_loss: 1.2172, test_f1: 0.5105
 epoch: 22, train_loss: 1.0173, test_loss: 1.1995, test_f1: 0.5124
 epoch: 23, train_loss: 1.0206, test_loss: 1.2066, test_f1: 0.5134
 epoch: 24, train_loss: 0.9927, test_loss: 1.1884, test_f1: 0.4893
 epoch: 25, train_loss: 0.9808, test_loss: 1.1813, test_f1: 0.4929
 epoch: 26, train_loss: 0.9892, test_loss: 1.1994, test_f1: 0.5054
 epoch: 27, train_loss: 0.9914, test_loss: 1.2216, test_f1: 0.4938
 epoch: 28, train_loss: 0.9788, test_loss: 1.2247, test_f1: 0.5208
 epoch: 29, train_loss: 0.9626, test_loss: 1.2061, test_f1: 0.4838
 epoch: 30, train_loss: 0.9545, test_loss: 1.2204, test_f1: 0.5016
 epoch: 31, train_loss: 0.9631, test_loss: 1.1887, test_f1: 0.5019
 epoch: 32, train_loss: 0.9561, test_loss: 1.2093, test_f1: 0.4855
 epoch: 33, train_loss: 0.9577, test_loss: 1.1996, test_f1: 0.4975
 epoch: 34, train_loss: 0.9543, test_loss: 1.1787, test_f1: 0.5091
 epoch: 35, train_loss: 0.9377, test_loss: 1.2066, test_f1: 0.4749
 epoch: 36, train_loss: 0.9305, test_loss: 1.1965, test_f1: 0.4991
 epoch: 37, train_loss: 0.9196, test_loss: 1.1949, test_f1: 0.4998
 epoch: 38, train_loss: 0.9251, test_loss: 1.2268, test_f1: 0.4932
 epoch: 39, train_loss: 0.9263, test_loss: 1.2262, test_f1: 0.5043
 epoch: 40, train_loss: 0.9155, test_loss: 1.1737, test_f1: 0.4931
 epoch: 41, train_loss: 0.8968, test_loss: 1.1803, test_f1: 0.5009
 epoch: 42, train_loss: 0.8945, test_loss: 1.2044, test_f1: 0.5136
 epoch: 43, train_loss: 0.9023, test_loss: 1.1828, test_f1: 0.4983
 epoch: 44, train_loss: 0.8939, test_loss: 1.1651, test_f1: 0.5160
 epoch: 45, train_loss: 0.9131, test_loss: 1.2098, test_f1: 0.5079
 epoch: 46, train_loss: 0.8838, test_loss: 1.2070, test_f1: 0.4925
 epoch: 47, train_loss: 0.8838, test_loss: 1.1862, test_f1: 0.4932
 epoch: 48, train_loss: 0.8793, test_loss: 1.2096, test_f1: 0.4981
 epoch: 49, train_loss: 0.8650, test_loss: 1.1933, test_f1: 0.5334
 epoch: 50, train_loss: 0.8772, test_loss: 1.1963, test_f1: 0.5080
 epoch: 51, train_loss: 0.8490, test_loss: 1.1847, test_f1: 0.5125
 epoch: 52, train_loss: 0.8448, test_loss: 1.1934, test_f1: 0.5144
 epoch: 53, train_loss: 0.8462, test_loss: 1.1736, test_f1: 0.5133
 epoch: 54, train_loss: 0.8544, test_loss: 1.1933, test_f1: 0.5248
 epoch: 55, train_loss: 0.8433, test_loss: 1.1969, test_f1: 0.5109
 epoch: 56, train_loss: 0.8392, test_loss: 1.2033, test_f1: 0.5162
 epoch: 57, train_loss: 0.8430, test_loss: 1.1879, test_f1: 0.5073
 epoch: 58, train_loss: 0.8303, test_loss: 1.1629, test_f1: 0.5123
 epoch: 59, train_loss: 0.8265, test_loss: 1.1787, test_f1: 0.5178
 epoch: 60, train_loss: 0.8428, test_loss: 1.1688, test_f1: 0.5403
 epoch: 61, train_loss: 0.8482, test_loss: 1.1806, test_f1: 0.5263
 epoch: 62, train_loss: 0.8447, test_loss: 1.1894, test_f1: 0.5074
 epoch: 63, train_loss: 0.8323, test_loss: 1.2037, test_f1: 0.5039
 epoch: 64, train_loss: 0.8329, test_loss: 1.1814, test_f1: 0.5379
 epoch: 65, train_loss: 0.8200, test_loss: 1.1696, test_f1: 0.5278
 epoch: 66, train_loss: 0.8176, test_loss: 1.1958, test_f1: 0.5143
 epoch: 67, train_loss: 0.8149, test_loss: 1.2065, test_f1: 0.5198
 epoch: 68, train_loss: 0.8340, test_loss: 1.2457, test_f1: 0.5270
 epoch: 69, train_loss: 0.8233, test_loss: 1.2515, test_f1: 0.5275
 epoch: 70, train_loss: 0.8147, test_loss: 1.2105, test_f1: 0.5199
 epoch: 71, train_loss: 0.8243, test_loss: 1.1645, test_f1: 0.4970
 epoch: 72, train_loss: 0.8170, test_loss: 1.1660, test_f1: 0.5239
 epoch: 73, train_loss: 0.8162, test_loss: 1.1820, test_f1: 0.5276
 epoch: 74, train_loss: 0.7987, test_loss: 1.1984, test_f1: 0.5239
 epoch: 75, train_loss: 0.8215, test_loss: 1.1932, test_f1: 0.5379
 epoch: 76, train_loss: 0.8267, test_loss: 1.2019, test_f1: 0.5176
 epoch: 77, train_loss: 0.8160, test_loss: 1.2062, test_f1: 0.5155
 epoch: 78, train_loss: 0.7893, test_loss: 1.2164, test_f1: 0.5240
 epoch: 79, train_loss: 0.8080, test_loss: 1.2238, test_f1: 0.5354
 epoch: 80, train_loss: 0.8089, test_loss: 1.2036, test_f1: 0.5565
 epoch: 81, train_loss: 0.8282, test_loss: 1.2203, test_f1: 0.5395
 epoch: 82, train_loss: 0.7877, test_loss: 1.2154, test_f1: 0.5068
 epoch: 83, train_loss: 0.7995, test_loss: 1.2074, test_f1: 0.5251
 epoch: 84, train_loss: 0.7986, test_loss: 1.1909, test_f1: 0.5340
 epoch: 85, train_loss: 0.8090, test_loss: 1.1657, test_f1: 0.5233
 epoch: 86, train_loss: 0.7892, test_loss: 1.2040, test_f1: 0.5419
 epoch: 87, train_loss: 0.8004, test_loss: 1.1923, test_f1: 0.5319
 epoch: 88, train_loss: 0.7952, test_loss: 1.1841, test_f1: 0.5368
 epoch: 89, train_loss: 0.7949, test_loss: 1.1881, test_f1: 0.5555
 epoch: 90, train_loss: 0.7848, test_loss: 1.2003, test_f1: 0.5522
 epoch: 91, train_loss: 0.7784, test_loss: 1.1783, test_f1: 0.5570
 epoch: 92, train_loss: 0.7882, test_loss: 1.1881, test_f1: 0.5262
 epoch: 93, train_loss: 0.8048, test_loss: 1.2466, test_f1: 0.5294
 epoch: 94, train_loss: 0.7774, test_loss: 1.1834, test_f1: 0.5413
 epoch: 95, train_loss: 0.7912, test_loss: 1.1870, test_f1: 0.5493
 epoch: 96, train_loss: 0.7713, test_loss: 1.1865, test_f1: 0.5464
 epoch: 97, train_loss: 0.7797, test_loss: 1.2116, test_f1: 0.5477
 epoch: 98, train_loss: 0.7725, test_loss: 1.3453, test_f1: 0.5338
 epoch: 99, train_loss: 0.7860, test_loss: 1.2494, test_f1: 0.5348
##################ITERATION #9 ****************************************
 epoch: 0, train_loss: 2.2463, test_loss: 1.7586, test_f1: 0.0532
 epoch: 1, train_loss: 1.4831, test_loss: 1.4438, test_f1: 0.2362
 epoch: 2, train_loss: 1.3659, test_loss: 1.3953, test_f1: 0.2386
 epoch: 3, train_loss: 1.3114, test_loss: 1.3916, test_f1: 0.2696
 epoch: 4, train_loss: 1.2692, test_loss: 1.3655, test_f1: 0.2632
 epoch: 5, train_loss: 1.2421, test_loss: 1.3435, test_f1: 0.2750
 epoch: 6, train_loss: 1.2404, test_loss: 1.3578, test_f1: 0.3025
 epoch: 7, train_loss: 1.2360, test_loss: 1.3287, test_f1: 0.3061
 epoch: 8, train_loss: 1.2192, test_loss: 1.3066, test_f1: 0.3144
 epoch: 9, train_loss: 1.1941, test_loss: 1.2674, test_f1: 0.3333
 epoch: 10, train_loss: 1.1682, test_loss: 1.3200, test_f1: 0.3170
 epoch: 11, train_loss: 1.1775, test_loss: 1.2843, test_f1: 0.3381
 epoch: 12, train_loss: 1.1486, test_loss: 1.2856, test_f1: 0.3361
 epoch: 13, train_loss: 1.1566, test_loss: 1.2794, test_f1: 0.3262
 epoch: 14, train_loss: 1.1297, test_loss: 1.2632, test_f1: 0.3400
 epoch: 15, train_loss: 1.1148, test_loss: 1.2787, test_f1: 0.3758
 epoch: 16, train_loss: 1.1008, test_loss: 1.2804, test_f1: 0.3752
 epoch: 17, train_loss: 1.1172, test_loss: 1.2611, test_f1: 0.3785
 epoch: 18, train_loss: 1.0861, test_loss: 1.2638, test_f1: 0.3872
 epoch: 19, train_loss: 1.1024, test_loss: 1.2495, test_f1: 0.4153
 epoch: 20, train_loss: 1.0891, test_loss: 1.2327, test_f1: 0.3993
 epoch: 21, train_loss: 1.0625, test_loss: 1.1973, test_f1: 0.4393
 epoch: 22, train_loss: 1.0582, test_loss: 1.2172, test_f1: 0.4126
 epoch: 23, train_loss: 1.0697, test_loss: 1.2048, test_f1: 0.4546
 epoch: 24, train_loss: 1.0575, test_loss: 1.2161, test_f1: 0.4504
 epoch: 25, train_loss: 1.0435, test_loss: 1.2114, test_f1: 0.4392
 epoch: 26, train_loss: 1.0466, test_loss: 1.2271, test_f1: 0.4546
 epoch: 27, train_loss: 1.0427, test_loss: 1.2139, test_f1: 0.4286
 epoch: 28, train_loss: 1.0349, test_loss: 1.2096, test_f1: 0.4325
 epoch: 29, train_loss: 1.0297, test_loss: 1.1981, test_f1: 0.4358
 epoch: 30, train_loss: 1.0301, test_loss: 1.2376, test_f1: 0.4108
 epoch: 31, train_loss: 1.0184, test_loss: 1.2053, test_f1: 0.4631
 epoch: 32, train_loss: 1.0337, test_loss: 1.2271, test_f1: 0.4117
 epoch: 33, train_loss: 1.0140, test_loss: 1.2284, test_f1: 0.4292
 epoch: 34, train_loss: 1.0070, test_loss: 1.2281, test_f1: 0.4668
 epoch: 35, train_loss: 1.0064, test_loss: 1.2154, test_f1: 0.4595
 epoch: 36, train_loss: 0.9993, test_loss: 1.1945, test_f1: 0.4659
 epoch: 37, train_loss: 0.9858, test_loss: 1.2539, test_f1: 0.4454
 epoch: 38, train_loss: 1.0030, test_loss: 1.2953, test_f1: 0.4353
 epoch: 39, train_loss: 0.9797, test_loss: 1.3057, test_f1: 0.4044
 epoch: 40, train_loss: 0.9871, test_loss: 1.2583, test_f1: 0.4426
 epoch: 41, train_loss: 0.9611, test_loss: 1.2546, test_f1: 0.4223
 epoch: 42, train_loss: 0.9692, test_loss: 1.2848, test_f1: 0.4543
 epoch: 43, train_loss: 0.9754, test_loss: 1.2435, test_f1: 0.4386
 epoch: 44, train_loss: 0.9791, test_loss: 1.2569, test_f1: 0.4547
 epoch: 45, train_loss: 0.9756, test_loss: 1.3226, test_f1: 0.4405
 epoch: 46, train_loss: 0.9682, test_loss: 1.3027, test_f1: 0.4718
 epoch: 47, train_loss: 0.9497, test_loss: 1.3163, test_f1: 0.4545
 epoch: 48, train_loss: 0.9559, test_loss: 1.3501, test_f1: 0.4155
 epoch: 49, train_loss: 0.9584, test_loss: 1.1902, test_f1: 0.4745
 epoch: 50, train_loss: 0.9515, test_loss: 1.2031, test_f1: 0.4535
 epoch: 51, train_loss: 0.9467, test_loss: 1.2743, test_f1: 0.4412
 epoch: 52, train_loss: 0.9494, test_loss: 1.3207, test_f1: 0.4344
 epoch: 53, train_loss: 0.9236, test_loss: 1.3061, test_f1: 0.4474
 epoch: 54, train_loss: 0.9417, test_loss: 1.2925, test_f1: 0.4876
 epoch: 55, train_loss: 0.9261, test_loss: 1.2544, test_f1: 0.4900
 epoch: 56, train_loss: 0.9439, test_loss: 1.3161, test_f1: 0.4833
 epoch: 57, train_loss: 0.9222, test_loss: 1.3375, test_f1: 0.4662
 epoch: 58, train_loss: 0.9382, test_loss: 1.3061, test_f1: 0.4572
 epoch: 59, train_loss: 0.9334, test_loss: 1.3024, test_f1: 0.4783
 epoch: 60, train_loss: 0.9129, test_loss: 1.3328, test_f1: 0.4728
 epoch: 61, train_loss: 0.9218, test_loss: 1.2912, test_f1: 0.4986
 epoch: 62, train_loss: 0.9191, test_loss: 1.2796, test_f1: 0.5036
 epoch: 63, train_loss: 0.9280, test_loss: 1.2953, test_f1: 0.4780
 epoch: 64, train_loss: 0.9163, test_loss: 1.3052, test_f1: 0.4950
 epoch: 65, train_loss: 0.9055, test_loss: 1.3396, test_f1: 0.4729
 epoch: 66, train_loss: 0.9374, test_loss: 1.3073, test_f1: 0.4910
 epoch: 67, train_loss: 0.9134, test_loss: 1.2934, test_f1: 0.4955
 epoch: 68, train_loss: 0.9054, test_loss: 1.3408, test_f1: 0.4752
 epoch: 69, train_loss: 0.9106, test_loss: 1.3498, test_f1: 0.4716
 epoch: 70, train_loss: 0.9134, test_loss: 1.3374, test_f1: 0.4823
 epoch: 71, train_loss: 0.9034, test_loss: 1.3167, test_f1: 0.4792
 epoch: 72, train_loss: 0.9025, test_loss: 1.3278, test_f1: 0.4665
 epoch: 73, train_loss: 0.8995, test_loss: 1.3030, test_f1: 0.4590
 epoch: 74, train_loss: 0.9046, test_loss: 1.3335, test_f1: 0.4467
 epoch: 75, train_loss: 0.8984, test_loss: 1.3160, test_f1: 0.4816
 epoch: 76, train_loss: 0.8820, test_loss: 1.3410, test_f1: 0.4795
 epoch: 77, train_loss: 0.8864, test_loss: 1.2983, test_f1: 0.4864
 epoch: 78, train_loss: 0.8901, test_loss: 1.3056, test_f1: 0.4780
 epoch: 79, train_loss: 0.8994, test_loss: 1.3569, test_f1: 0.4798
 epoch: 80, train_loss: 0.9021, test_loss: 1.3435, test_f1: 0.5022
 epoch: 81, train_loss: 0.8814, test_loss: 1.2913, test_f1: 0.4777
 epoch: 82, train_loss: 0.8939, test_loss: 1.3307, test_f1: 0.4656
 epoch: 83, train_loss: 0.8831, test_loss: 1.2934, test_f1: 0.4764
 epoch: 84, train_loss: 0.8759, test_loss: 1.2792, test_f1: 0.4359
 epoch: 85, train_loss: 0.8980, test_loss: 1.3417, test_f1: 0.4526
 epoch: 86, train_loss: 0.9102, test_loss: 1.2491, test_f1: 0.5121
 epoch: 87, train_loss: 0.8920, test_loss: 1.2617, test_f1: 0.4776
 epoch: 88, train_loss: 0.8852, test_loss: 1.3239, test_f1: 0.4572
 epoch: 89, train_loss: 0.8683, test_loss: 1.3331, test_f1: 0.4614
 epoch: 90, train_loss: 0.8932, test_loss: 1.3010, test_f1: 0.4868
 epoch: 91, train_loss: 0.8894, test_loss: 1.3469, test_f1: 0.4718
 epoch: 92, train_loss: 0.9008, test_loss: 1.3490, test_f1: 0.4789
 epoch: 93, train_loss: 0.8763, test_loss: 1.3460, test_f1: 0.4618
 epoch: 94, train_loss: 0.8734, test_loss: 1.3098, test_f1: 0.4797
 epoch: 95, train_loss: 0.8796, test_loss: 1.3187, test_f1: 0.4768
 epoch: 96, train_loss: 0.8681, test_loss: 1.3508, test_f1: 0.4748
 epoch: 97, train_loss: 0.8726, test_loss: 1.3141, test_f1: 0.4772
 epoch: 98, train_loss: 0.8642, test_loss: 1.3257, test_f1: 0.4861
 epoch: 99, train_loss: 0.8769, test_loss: 1.3201, test_f1: 0.4774

Training completed in 345.03 seconds
Best F1: 0.5720 at epoch 52
Mean F1 across iterations: 0.5259  0.0270
========================FINAL RESULTS================================
FEGIN weighted F1: 0.5720  0.0270
python main.py --data ltspice_demos --representation component_component --model FEGIN --layers 4 --hiddens 16 --batch_size 128 --lr 0.001 --emb_size 128 --epochs 100 --save_appendix component_component_L4_H16_BS128_LR0.001_E128 --no_val
-----



STDERR:
  File "main.py", line 370, in <module>
    main()
  File "main.py", line 254, in main
    dataset = dataset_class(
  File "/home/philip/projects/ltspice_examples_code_repo/Circuit-Completion-Using-GNNs/component_classification_with_link_prediction_head/evaluation/FEGIN/kernel/circuit_datasets.py", line 15, in __init__
    self.data, self.slices = torch.load(self.processed_paths[0])
  File "/home/philip/.local/lib/python3.8/site-packages/torch/serialization.py", line 1040, in load
    warnings.warn(
  File "/usr/lib/python3.8/warnings.py", line 109, in _showwarnmsg
    sw(msg.message, msg.category, msg.filename, msg.lineno,
  File "main.py", line 47, in warn_with_traceback
    traceback.print_stack(file=log)
/home/philip/projects/ltspice_examples_code_repo/Circuit-Completion-Using-GNNs/component_classification_with_link_prediction_head/evaluation/FEGIN/kernel/circuit_datasets.py:15: FutureWarning: You are using `torch.load` with `weights_only=False` (the current default value), which uses the default pickle module implicitly. It is possible to construct malicious pickle data which will execute arbitrary code during unpickling (See https://github.com/pytorch/pytorch/blob/main/SECURITY.md#untrusted-models for more details). In a future release, the default value for `weights_only` will be flipped to `True`. This limits the functions that could be executed during unpickling. Arbitrary objects will no longer be allowed to be loaded via this mode unless they are explicitly allowlisted by the user via `torch.serialization.add_safe_globals`. We recommend you start setting `weights_only=True` for any use case where you don't have full control of the loaded file. Please open an issue on GitHub for any issues related to this experimental feature.
  self.data, self.slices = torch.load(self.processed_paths[0])
