STDOUT:
Results will be saved in /home/philip/projects/llm_inference_code_repo/Circuit-Completion-Using-GNNs/component_classification_with_link_prediction_head/evaluation/FEGIN/results/model_FEGIN_dataset_ltspice_examples
Command line input: python main.py --data ltspice_examples --representation component_net --model FEGIN --layers 2 --hiddens 64 --batch_size 128 --lr 0.0001 --emb_size 512 --epochs 100 --save_appendix component_net_L2_H64_BS128_LR0.0001_E512 --no_val
 is saved.
-----
ltspice_examples - FEGIN
Using 2 layers, 64 hidden units, h = 2
Loading component_net representation dataset
ENTERED
Training FEGIN on component_net representation
Train: 3558, Test: 846
##################ITERATION #0 ****************************************
 epoch: 0, train_loss: 1.3582, test_loss: 1.3590, test_f1: 0.2270
 epoch: 1, train_loss: 1.3476, test_loss: 1.3484, test_f1: 0.2270
 epoch: 2, train_loss: 1.3408, test_loss: 1.3392, test_f1: 0.2270
 epoch: 3, train_loss: 1.3327, test_loss: 1.3292, test_f1: 0.2270
 epoch: 4, train_loss: 1.3228, test_loss: 1.3194, test_f1: 0.2270
 epoch: 5, train_loss: 1.3122, test_loss: 1.3069, test_f1: 0.2270
 epoch: 6, train_loss: 1.2986, test_loss: 1.2923, test_f1: 0.2270
 epoch: 7, train_loss: 1.2859, test_loss: 1.2763, test_f1: 0.2270
 epoch: 8, train_loss: 1.2707, test_loss: 1.2602, test_f1: 0.2392
 epoch: 9, train_loss: 1.2566, test_loss: 1.2425, test_f1: 0.2267
 epoch: 10, train_loss: 1.2413, test_loss: 1.2272, test_f1: 0.2405
 epoch: 11, train_loss: 1.2269, test_loss: 1.2093, test_f1: 0.2406
 epoch: 12, train_loss: 1.2157, test_loss: 1.1970, test_f1: 0.2554
 epoch: 13, train_loss: 1.2036, test_loss: 1.1790, test_f1: 0.2766
 epoch: 14, train_loss: 1.1866, test_loss: 1.1639, test_f1: 0.3346
 epoch: 15, train_loss: 1.1716, test_loss: 1.1394, test_f1: 0.3670
 epoch: 16, train_loss: 1.1530, test_loss: 1.1115, test_f1: 0.3801
 epoch: 17, train_loss: 1.1320, test_loss: 1.0959, test_f1: 0.3921
 epoch: 18, train_loss: 1.1133, test_loss: 1.0669, test_f1: 0.4071
 epoch: 19, train_loss: 1.0935, test_loss: 1.0448, test_f1: 0.4176
 epoch: 20, train_loss: 1.0730, test_loss: 1.0347, test_f1: 0.4428
 epoch: 21, train_loss: 1.0615, test_loss: 1.0140, test_f1: 0.4502
 epoch: 22, train_loss: 1.0488, test_loss: 1.0063, test_f1: 0.4346
 epoch: 23, train_loss: 1.0331, test_loss: 0.9921, test_f1: 0.4731
 epoch: 24, train_loss: 1.0234, test_loss: 0.9785, test_f1: 0.4920
 epoch: 25, train_loss: 1.0143, test_loss: 0.9882, test_f1: 0.4794
 epoch: 26, train_loss: 0.9985, test_loss: 0.9694, test_f1: 0.4727
 epoch: 27, train_loss: 0.9895, test_loss: 0.9675, test_f1: 0.4845
 epoch: 28, train_loss: 0.9841, test_loss: 0.9489, test_f1: 0.4793
 epoch: 29, train_loss: 0.9737, test_loss: 0.9487, test_f1: 0.4816
 epoch: 30, train_loss: 0.9627, test_loss: 0.9435, test_f1: 0.4986
 epoch: 31, train_loss: 0.9554, test_loss: 0.9406, test_f1: 0.4991
 epoch: 32, train_loss: 0.9442, test_loss: 0.9282, test_f1: 0.5041
 epoch: 33, train_loss: 0.9429, test_loss: 0.9290, test_f1: 0.4973
 epoch: 34, train_loss: 0.9365, test_loss: 0.9255, test_f1: 0.5333
 epoch: 35, train_loss: 0.9332, test_loss: 0.9214, test_f1: 0.5090
 epoch: 36, train_loss: 0.9209, test_loss: 0.9209, test_f1: 0.5076
 epoch: 37, train_loss: 0.9172, test_loss: 0.9087, test_f1: 0.5197
 epoch: 38, train_loss: 0.9133, test_loss: 0.9195, test_f1: 0.5042
 epoch: 39, train_loss: 0.9071, test_loss: 0.9044, test_f1: 0.5284
 epoch: 40, train_loss: 0.9026, test_loss: 0.9155, test_f1: 0.5170
 epoch: 41, train_loss: 0.9046, test_loss: 0.8883, test_f1: 0.5300
 epoch: 42, train_loss: 0.8931, test_loss: 0.9110, test_f1: 0.5242
 epoch: 43, train_loss: 0.8928, test_loss: 0.8968, test_f1: 0.5370
 epoch: 44, train_loss: 0.8901, test_loss: 0.9080, test_f1: 0.5072
 epoch: 45, train_loss: 0.8823, test_loss: 0.8972, test_f1: 0.5296
 epoch: 46, train_loss: 0.8854, test_loss: 0.9022, test_f1: 0.5351
 epoch: 47, train_loss: 0.8794, test_loss: 0.9064, test_f1: 0.5299
 epoch: 48, train_loss: 0.8774, test_loss: 0.9023, test_f1: 0.5267
 epoch: 49, train_loss: 0.8740, test_loss: 0.8941, test_f1: 0.5273
 epoch: 50, train_loss: 0.8759, test_loss: 0.9037, test_f1: 0.5359
 epoch: 51, train_loss: 0.8588, test_loss: 0.9143, test_f1: 0.5319
 epoch: 52, train_loss: 0.8645, test_loss: 0.8951, test_f1: 0.5295
 epoch: 53, train_loss: 0.8613, test_loss: 0.8996, test_f1: 0.5236
 epoch: 54, train_loss: 0.8621, test_loss: 0.8977, test_f1: 0.5321
 epoch: 55, train_loss: 0.8582, test_loss: 0.9013, test_f1: 0.5290
 epoch: 56, train_loss: 0.8568, test_loss: 0.9021, test_f1: 0.5300
 epoch: 57, train_loss: 0.8570, test_loss: 0.9049, test_f1: 0.5163
 epoch: 58, train_loss: 0.8599, test_loss: 0.9104, test_f1: 0.5175
 epoch: 59, train_loss: 0.8583, test_loss: 0.8972, test_f1: 0.5388
 epoch: 60, train_loss: 0.8555, test_loss: 0.9073, test_f1: 0.5210
 epoch: 61, train_loss: 0.8479, test_loss: 0.9081, test_f1: 0.5268
 epoch: 62, train_loss: 0.8542, test_loss: 0.8936, test_f1: 0.5419
 epoch: 63, train_loss: 0.8499, test_loss: 0.9053, test_f1: 0.5300
 epoch: 64, train_loss: 0.8454, test_loss: 0.9045, test_f1: 0.5210
 epoch: 65, train_loss: 0.8519, test_loss: 0.9083, test_f1: 0.5276
 epoch: 66, train_loss: 0.8457, test_loss: 0.9159, test_f1: 0.5217
 epoch: 67, train_loss: 0.8454, test_loss: 0.9108, test_f1: 0.5210
 epoch: 68, train_loss: 0.8515, test_loss: 0.9095, test_f1: 0.5197
 epoch: 69, train_loss: 0.8434, test_loss: 0.9051, test_f1: 0.5247
 epoch: 70, train_loss: 0.8447, test_loss: 0.9155, test_f1: 0.5207
 epoch: 71, train_loss: 0.8415, test_loss: 0.9018, test_f1: 0.5248
 epoch: 72, train_loss: 0.8445, test_loss: 0.9104, test_f1: 0.5183
 epoch: 73, train_loss: 0.8419, test_loss: 0.8905, test_f1: 0.5344
 epoch: 74, train_loss: 0.8428, test_loss: 0.9100, test_f1: 0.5219
 epoch: 75, train_loss: 0.8441, test_loss: 0.9191, test_f1: 0.5196
 epoch: 76, train_loss: 0.8462, test_loss: 0.9166, test_f1: 0.5222
 epoch: 77, train_loss: 0.8431, test_loss: 0.9280, test_f1: 0.5136
 epoch: 78, train_loss: 0.8337, test_loss: 0.9134, test_f1: 0.5209
 epoch: 79, train_loss: 0.8404, test_loss: 0.9077, test_f1: 0.5193
 epoch: 80, train_loss: 0.8432, test_loss: 0.9085, test_f1: 0.5369
 epoch: 81, train_loss: 0.8296, test_loss: 0.9202, test_f1: 0.5232
 epoch: 82, train_loss: 0.8370, test_loss: 0.9110, test_f1: 0.5223
 epoch: 83, train_loss: 0.8322, test_loss: 0.9200, test_f1: 0.5200
 epoch: 84, train_loss: 0.8274, test_loss: 0.9167, test_f1: 0.5343
 epoch: 85, train_loss: 0.8315, test_loss: 0.9046, test_f1: 0.5302
 epoch: 86, train_loss: 0.8304, test_loss: 0.9167, test_f1: 0.5247
 epoch: 87, train_loss: 0.8238, test_loss: 0.9258, test_f1: 0.5362
 epoch: 88, train_loss: 0.8241, test_loss: 0.9270, test_f1: 0.5130
 epoch: 89, train_loss: 0.8245, test_loss: 0.9192, test_f1: 0.5138
 epoch: 90, train_loss: 0.8267, test_loss: 0.9047, test_f1: 0.5215
 epoch: 91, train_loss: 0.8253, test_loss: 0.9066, test_f1: 0.5296
 epoch: 92, train_loss: 0.8203, test_loss: 0.9203, test_f1: 0.5329
 epoch: 93, train_loss: 0.8208, test_loss: 0.9136, test_f1: 0.5275
 epoch: 94, train_loss: 0.8214, test_loss: 0.9102, test_f1: 0.5353
 epoch: 95, train_loss: 0.8203, test_loss: 0.9031, test_f1: 0.5352
 epoch: 96, train_loss: 0.8189, test_loss: 0.9114, test_f1: 0.5303
 epoch: 97, train_loss: 0.8170, test_loss: 0.9315, test_f1: 0.5146
 epoch: 98, train_loss: 0.8159, test_loss: 0.9110, test_f1: 0.5281
 epoch: 99, train_loss: 0.8180, test_loss: 0.9194, test_f1: 0.5250
##################ITERATION #1 ****************************************
 epoch: 0, train_loss: 1.3170, test_loss: 1.3267, test_f1: 0.2270
 epoch: 1, train_loss: 1.2845, test_loss: 1.2928, test_f1: 0.2270
 epoch: 2, train_loss: 1.2639, test_loss: 1.2549, test_f1: 0.2671
 epoch: 3, train_loss: 1.2442, test_loss: 1.2274, test_f1: 0.2853
 epoch: 4, train_loss: 1.2266, test_loss: 1.2087, test_f1: 0.2903
 epoch: 5, train_loss: 1.2111, test_loss: 1.1881, test_f1: 0.2933
 epoch: 6, train_loss: 1.1930, test_loss: 1.1675, test_f1: 0.3023
 epoch: 7, train_loss: 1.1788, test_loss: 1.1490, test_f1: 0.3478
 epoch: 8, train_loss: 1.1599, test_loss: 1.1301, test_f1: 0.3690
 epoch: 9, train_loss: 1.1459, test_loss: 1.1106, test_f1: 0.4083
 epoch: 10, train_loss: 1.1286, test_loss: 1.0920, test_f1: 0.4260
 epoch: 11, train_loss: 1.1074, test_loss: 1.0710, test_f1: 0.4487
 epoch: 12, train_loss: 1.0846, test_loss: 1.0472, test_f1: 0.4493
 epoch: 13, train_loss: 1.0734, test_loss: 1.0345, test_f1: 0.4505
 epoch: 14, train_loss: 1.0519, test_loss: 1.0179, test_f1: 0.4463
 epoch: 15, train_loss: 1.0411, test_loss: 1.0032, test_f1: 0.4546
 epoch: 16, train_loss: 1.0224, test_loss: 0.9924, test_f1: 0.4690
 epoch: 17, train_loss: 1.0115, test_loss: 0.9868, test_f1: 0.4601
 epoch: 18, train_loss: 1.0016, test_loss: 0.9811, test_f1: 0.4669
 epoch: 19, train_loss: 0.9918, test_loss: 0.9786, test_f1: 0.4703
 epoch: 20, train_loss: 0.9885, test_loss: 0.9682, test_f1: 0.4695
 epoch: 21, train_loss: 0.9782, test_loss: 0.9648, test_f1: 0.4880
 epoch: 22, train_loss: 0.9717, test_loss: 0.9603, test_f1: 0.4832
 epoch: 23, train_loss: 0.9724, test_loss: 0.9573, test_f1: 0.4959
 epoch: 24, train_loss: 0.9642, test_loss: 0.9533, test_f1: 0.4952
 epoch: 25, train_loss: 0.9529, test_loss: 0.9474, test_f1: 0.4892
 epoch: 26, train_loss: 0.9512, test_loss: 0.9484, test_f1: 0.4871
 epoch: 27, train_loss: 0.9473, test_loss: 0.9466, test_f1: 0.5019
 epoch: 28, train_loss: 0.9421, test_loss: 0.9401, test_f1: 0.4991
 epoch: 29, train_loss: 0.9380, test_loss: 0.9413, test_f1: 0.4927
 epoch: 30, train_loss: 0.9319, test_loss: 0.9398, test_f1: 0.5059
 epoch: 31, train_loss: 0.9341, test_loss: 0.9316, test_f1: 0.5013
 epoch: 32, train_loss: 0.9220, test_loss: 0.9450, test_f1: 0.5053
 epoch: 33, train_loss: 0.9173, test_loss: 0.9360, test_f1: 0.5063
 epoch: 34, train_loss: 0.9204, test_loss: 0.9393, test_f1: 0.5084
 epoch: 35, train_loss: 0.9089, test_loss: 0.9330, test_f1: 0.5214
 epoch: 36, train_loss: 0.9159, test_loss: 0.9311, test_f1: 0.5095
 epoch: 37, train_loss: 0.9100, test_loss: 0.9253, test_f1: 0.5208
 epoch: 38, train_loss: 0.8992, test_loss: 0.9270, test_f1: 0.5279
 epoch: 39, train_loss: 0.8972, test_loss: 0.9280, test_f1: 0.5144
 epoch: 40, train_loss: 0.8974, test_loss: 0.9222, test_f1: 0.5346
 epoch: 41, train_loss: 0.8906, test_loss: 0.9190, test_f1: 0.5363
 epoch: 42, train_loss: 0.8868, test_loss: 0.9330, test_f1: 0.5305
 epoch: 43, train_loss: 0.8876, test_loss: 0.9269, test_f1: 0.5407
 epoch: 44, train_loss: 0.8874, test_loss: 0.9270, test_f1: 0.5353
 epoch: 45, train_loss: 0.8871, test_loss: 0.9500, test_f1: 0.5306
 epoch: 46, train_loss: 0.8785, test_loss: 0.9234, test_f1: 0.5460
 epoch: 47, train_loss: 0.8748, test_loss: 0.9342, test_f1: 0.5308
 epoch: 48, train_loss: 0.8686, test_loss: 0.9271, test_f1: 0.5356
 epoch: 49, train_loss: 0.8695, test_loss: 0.9250, test_f1: 0.5316
 epoch: 50, train_loss: 0.8560, test_loss: 0.9146, test_f1: 0.5399
 epoch: 51, train_loss: 0.8587, test_loss: 0.9246, test_f1: 0.5318
 epoch: 52, train_loss: 0.8599, test_loss: 0.9257, test_f1: 0.5341
 epoch: 53, train_loss: 0.8598, test_loss: 0.9241, test_f1: 0.5342
 epoch: 54, train_loss: 0.8595, test_loss: 0.9221, test_f1: 0.5314
 epoch: 55, train_loss: 0.8516, test_loss: 0.9195, test_f1: 0.5282
 epoch: 56, train_loss: 0.8543, test_loss: 0.9269, test_f1: 0.5334
 epoch: 57, train_loss: 0.8413, test_loss: 0.9192, test_f1: 0.5362
 epoch: 58, train_loss: 0.8466, test_loss: 0.9332, test_f1: 0.5391
 epoch: 59, train_loss: 0.8457, test_loss: 0.9199, test_f1: 0.5400
 epoch: 60, train_loss: 0.8503, test_loss: 0.9368, test_f1: 0.5384
 epoch: 61, train_loss: 0.8463, test_loss: 0.9221, test_f1: 0.5406
 epoch: 62, train_loss: 0.8412, test_loss: 0.9178, test_f1: 0.5356
 epoch: 63, train_loss: 0.8432, test_loss: 0.9372, test_f1: 0.5382
 epoch: 64, train_loss: 0.8438, test_loss: 0.9159, test_f1: 0.5422
 epoch: 65, train_loss: 0.8446, test_loss: 0.9300, test_f1: 0.5359
 epoch: 66, train_loss: 0.8469, test_loss: 0.9318, test_f1: 0.5370
 epoch: 67, train_loss: 0.8379, test_loss: 0.9129, test_f1: 0.5453
 epoch: 68, train_loss: 0.8339, test_loss: 0.9357, test_f1: 0.5396
 epoch: 69, train_loss: 0.8352, test_loss: 0.9280, test_f1: 0.5396
 epoch: 70, train_loss: 0.8406, test_loss: 0.9192, test_f1: 0.5397
 epoch: 71, train_loss: 0.8294, test_loss: 0.9270, test_f1: 0.5520
 epoch: 72, train_loss: 0.8304, test_loss: 0.9240, test_f1: 0.5375
 epoch: 73, train_loss: 0.8298, test_loss: 0.9197, test_f1: 0.5474
 epoch: 74, train_loss: 0.8248, test_loss: 0.9168, test_f1: 0.5384
 epoch: 75, train_loss: 0.8356, test_loss: 0.9352, test_f1: 0.5393
 epoch: 76, train_loss: 0.8234, test_loss: 0.9309, test_f1: 0.5425
 epoch: 77, train_loss: 0.8219, test_loss: 0.9267, test_f1: 0.5471
 epoch: 78, train_loss: 0.8205, test_loss: 0.9399, test_f1: 0.5384
 epoch: 79, train_loss: 0.8247, test_loss: 0.9206, test_f1: 0.5511
 epoch: 80, train_loss: 0.8161, test_loss: 0.9255, test_f1: 0.5379
 epoch: 81, train_loss: 0.8227, test_loss: 0.9314, test_f1: 0.5504
 epoch: 82, train_loss: 0.8162, test_loss: 0.9247, test_f1: 0.5576
 epoch: 83, train_loss: 0.8205, test_loss: 0.9299, test_f1: 0.5523
 epoch: 84, train_loss: 0.8212, test_loss: 0.9317, test_f1: 0.5532
 epoch: 85, train_loss: 0.8224, test_loss: 0.9344, test_f1: 0.5530
 epoch: 86, train_loss: 0.8173, test_loss: 0.9309, test_f1: 0.5542
 epoch: 87, train_loss: 0.8109, test_loss: 0.9227, test_f1: 0.5545
 epoch: 88, train_loss: 0.8158, test_loss: 0.9239, test_f1: 0.5487
 epoch: 89, train_loss: 0.8125, test_loss: 0.9365, test_f1: 0.5529
 epoch: 90, train_loss: 0.8101, test_loss: 0.9296, test_f1: 0.5610
 epoch: 91, train_loss: 0.8118, test_loss: 0.9257, test_f1: 0.5612
 epoch: 92, train_loss: 0.8121, test_loss: 0.9358, test_f1: 0.5620
 epoch: 93, train_loss: 0.8114, test_loss: 0.9424, test_f1: 0.5516
 epoch: 94, train_loss: 0.8163, test_loss: 0.9425, test_f1: 0.5600
 epoch: 95, train_loss: 0.8147, test_loss: 0.9358, test_f1: 0.5582
 epoch: 96, train_loss: 0.8092, test_loss: 0.9373, test_f1: 0.5607
 epoch: 97, train_loss: 0.8031, test_loss: 0.9250, test_f1: 0.5664
 epoch: 98, train_loss: 0.8053, test_loss: 0.9381, test_f1: 0.5594
 epoch: 99, train_loss: 0.8009, test_loss: 0.9402, test_f1: 0.5467
##################ITERATION #2 ****************************************
 epoch: 0, train_loss: 1.2810, test_loss: 1.3060, test_f1: 0.2270
 epoch: 1, train_loss: 1.2433, test_loss: 1.2551, test_f1: 0.2270
 epoch: 2, train_loss: 1.2205, test_loss: 1.2023, test_f1: 0.2796
 epoch: 3, train_loss: 1.1994, test_loss: 1.1659, test_f1: 0.3592
 epoch: 4, train_loss: 1.1782, test_loss: 1.1443, test_f1: 0.3864
 epoch: 5, train_loss: 1.1601, test_loss: 1.1254, test_f1: 0.4023
 epoch: 6, train_loss: 1.1383, test_loss: 1.1032, test_f1: 0.4274
 epoch: 7, train_loss: 1.1309, test_loss: 1.0875, test_f1: 0.4572
 epoch: 8, train_loss: 1.1070, test_loss: 1.0700, test_f1: 0.4639
 epoch: 9, train_loss: 1.0869, test_loss: 1.0512, test_f1: 0.4648
 epoch: 10, train_loss: 1.0727, test_loss: 1.0468, test_f1: 0.4719
 epoch: 11, train_loss: 1.0575, test_loss: 1.0319, test_f1: 0.4792
 epoch: 12, train_loss: 1.0462, test_loss: 1.0149, test_f1: 0.4813
 epoch: 13, train_loss: 1.0325, test_loss: 1.0038, test_f1: 0.4815
 epoch: 14, train_loss: 1.0181, test_loss: 1.0013, test_f1: 0.4847
 epoch: 15, train_loss: 1.0052, test_loss: 0.9913, test_f1: 0.4888
 epoch: 16, train_loss: 0.9991, test_loss: 1.0022, test_f1: 0.4775
 epoch: 17, train_loss: 0.9913, test_loss: 0.9715, test_f1: 0.4932
 epoch: 18, train_loss: 0.9896, test_loss: 0.9584, test_f1: 0.5047
 epoch: 19, train_loss: 0.9758, test_loss: 0.9744, test_f1: 0.4973
 epoch: 20, train_loss: 0.9745, test_loss: 0.9657, test_f1: 0.4954
 epoch: 21, train_loss: 0.9618, test_loss: 0.9902, test_f1: 0.4858
 epoch: 22, train_loss: 0.9612, test_loss: 0.9621, test_f1: 0.5066
 epoch: 23, train_loss: 0.9513, test_loss: 0.9450, test_f1: 0.5157
 epoch: 24, train_loss: 0.9538, test_loss: 0.9567, test_f1: 0.5144
 epoch: 25, train_loss: 0.9452, test_loss: 0.9428, test_f1: 0.5150
 epoch: 26, train_loss: 0.9503, test_loss: 0.9550, test_f1: 0.5137
 epoch: 27, train_loss: 0.9378, test_loss: 0.9535, test_f1: 0.5176
 epoch: 28, train_loss: 0.9313, test_loss: 0.9457, test_f1: 0.5105
 epoch: 29, train_loss: 0.9315, test_loss: 0.9294, test_f1: 0.5043
 epoch: 30, train_loss: 0.9293, test_loss: 0.9421, test_f1: 0.5037
 epoch: 31, train_loss: 0.9278, test_loss: 0.9330, test_f1: 0.5145
 epoch: 32, train_loss: 0.9279, test_loss: 0.9314, test_f1: 0.5110
 epoch: 33, train_loss: 0.9223, test_loss: 0.9447, test_f1: 0.5067
 epoch: 34, train_loss: 0.9148, test_loss: 0.9774, test_f1: 0.5000
 epoch: 35, train_loss: 0.9180, test_loss: 0.9295, test_f1: 0.5192
 epoch: 36, train_loss: 0.9080, test_loss: 0.9289, test_f1: 0.5098
 epoch: 37, train_loss: 0.9063, test_loss: 0.9285, test_f1: 0.5127
 epoch: 38, train_loss: 0.9081, test_loss: 0.9609, test_f1: 0.5037
 epoch: 39, train_loss: 0.8999, test_loss: 0.9482, test_f1: 0.5005
 epoch: 40, train_loss: 0.8984, test_loss: 0.9369, test_f1: 0.5061
 epoch: 41, train_loss: 0.8963, test_loss: 0.9422, test_f1: 0.5264
 epoch: 42, train_loss: 0.8995, test_loss: 0.9318, test_f1: 0.5197
 epoch: 43, train_loss: 0.8890, test_loss: 0.9355, test_f1: 0.5259
 epoch: 44, train_loss: 0.8928, test_loss: 0.9324, test_f1: 0.5093
 epoch: 45, train_loss: 0.8809, test_loss: 0.9447, test_f1: 0.5178
 epoch: 46, train_loss: 0.8866, test_loss: 0.9443, test_f1: 0.5075
 epoch: 47, train_loss: 0.8766, test_loss: 0.9200, test_f1: 0.5112
 epoch: 48, train_loss: 0.8790, test_loss: 0.9455, test_f1: 0.5174
 epoch: 49, train_loss: 0.8758, test_loss: 0.9401, test_f1: 0.5149
 epoch: 50, train_loss: 0.8725, test_loss: 0.9318, test_f1: 0.5116
 epoch: 51, train_loss: 0.8772, test_loss: 0.9349, test_f1: 0.5335
 epoch: 52, train_loss: 0.8714, test_loss: 0.9344, test_f1: 0.5253
 epoch: 53, train_loss: 0.8662, test_loss: 0.9393, test_f1: 0.5296
 epoch: 54, train_loss: 0.8636, test_loss: 0.9358, test_f1: 0.5328
 epoch: 55, train_loss: 0.8668, test_loss: 0.9440, test_f1: 0.5117
 epoch: 56, train_loss: 0.8630, test_loss: 0.9326, test_f1: 0.5261
 epoch: 57, train_loss: 0.8634, test_loss: 0.9310, test_f1: 0.5328
 epoch: 58, train_loss: 0.8643, test_loss: 0.9375, test_f1: 0.5388
 epoch: 59, train_loss: 0.8641, test_loss: 0.9325, test_f1: 0.5285
 epoch: 60, train_loss: 0.8658, test_loss: 0.9442, test_f1: 0.5282
 epoch: 61, train_loss: 0.8600, test_loss: 0.9309, test_f1: 0.5394
 epoch: 62, train_loss: 0.8563, test_loss: 0.9369, test_f1: 0.5298
 epoch: 63, train_loss: 0.8539, test_loss: 0.9462, test_f1: 0.5230
 epoch: 64, train_loss: 0.8573, test_loss: 0.9332, test_f1: 0.5246
 epoch: 65, train_loss: 0.8471, test_loss: 0.9416, test_f1: 0.5110
 epoch: 66, train_loss: 0.8500, test_loss: 0.9328, test_f1: 0.5131
 epoch: 67, train_loss: 0.8550, test_loss: 0.9496, test_f1: 0.5196
 epoch: 68, train_loss: 0.8505, test_loss: 0.9311, test_f1: 0.5223
 epoch: 69, train_loss: 0.8498, test_loss: 0.9285, test_f1: 0.5224
 epoch: 70, train_loss: 0.8485, test_loss: 0.9476, test_f1: 0.5153
 epoch: 71, train_loss: 0.8471, test_loss: 0.9394, test_f1: 0.5267
 epoch: 72, train_loss: 0.8428, test_loss: 0.9422, test_f1: 0.5106
 epoch: 73, train_loss: 0.8480, test_loss: 0.9307, test_f1: 0.5153
 epoch: 74, train_loss: 0.8446, test_loss: 0.9523, test_f1: 0.5235
 epoch: 75, train_loss: 0.8420, test_loss: 0.9339, test_f1: 0.5241
 epoch: 76, train_loss: 0.8435, test_loss: 0.9446, test_f1: 0.5105
 epoch: 77, train_loss: 0.8447, test_loss: 0.9505, test_f1: 0.5115
 epoch: 78, train_loss: 0.8427, test_loss: 0.9443, test_f1: 0.5150
 epoch: 79, train_loss: 0.8454, test_loss: 0.9654, test_f1: 0.5081
 epoch: 80, train_loss: 0.8383, test_loss: 0.9402, test_f1: 0.5197
 epoch: 81, train_loss: 0.8442, test_loss: 0.9570, test_f1: 0.5212
 epoch: 82, train_loss: 0.8419, test_loss: 0.9494, test_f1: 0.5079
 epoch: 83, train_loss: 0.8399, test_loss: 0.9442, test_f1: 0.5112
 epoch: 84, train_loss: 0.8362, test_loss: 0.9638, test_f1: 0.5201
 epoch: 85, train_loss: 0.8316, test_loss: 0.9354, test_f1: 0.5101
 epoch: 86, train_loss: 0.8306, test_loss: 0.9439, test_f1: 0.5335
 epoch: 87, train_loss: 0.8381, test_loss: 0.9408, test_f1: 0.5269
 epoch: 88, train_loss: 0.8406, test_loss: 0.9412, test_f1: 0.5385
 epoch: 89, train_loss: 0.8309, test_loss: 0.9403, test_f1: 0.5201
 epoch: 90, train_loss: 0.8285, test_loss: 0.9461, test_f1: 0.5263
 epoch: 91, train_loss: 0.8312, test_loss: 0.9728, test_f1: 0.5196
 epoch: 92, train_loss: 0.8332, test_loss: 0.9392, test_f1: 0.5194
 epoch: 93, train_loss: 0.8224, test_loss: 0.9442, test_f1: 0.5312
 epoch: 94, train_loss: 0.8333, test_loss: 0.9409, test_f1: 0.5467
 epoch: 95, train_loss: 0.8293, test_loss: 0.9469, test_f1: 0.5333
 epoch: 96, train_loss: 0.8246, test_loss: 0.9445, test_f1: 0.5191
 epoch: 97, train_loss: 0.8185, test_loss: 0.9466, test_f1: 0.5213
 epoch: 98, train_loss: 0.8278, test_loss: 0.9449, test_f1: 0.5231
 epoch: 99, train_loss: 0.8219, test_loss: 0.9548, test_f1: 0.5125
##################ITERATION #3 ****************************************
 epoch: 0, train_loss: 1.2731, test_loss: 1.2950, test_f1: 0.2270
 epoch: 1, train_loss: 1.2192, test_loss: 1.2081, test_f1: 0.2531
 epoch: 2, train_loss: 1.1871, test_loss: 1.1432, test_f1: 0.3603
 epoch: 3, train_loss: 1.1671, test_loss: 1.1110, test_f1: 0.3839
 epoch: 4, train_loss: 1.1402, test_loss: 1.0876, test_f1: 0.3914
 epoch: 5, train_loss: 1.1166, test_loss: 1.0728, test_f1: 0.4057
 epoch: 6, train_loss: 1.1016, test_loss: 1.0507, test_f1: 0.4256
 epoch: 7, train_loss: 1.0788, test_loss: 1.0370, test_f1: 0.4375
 epoch: 8, train_loss: 1.0634, test_loss: 1.0235, test_f1: 0.4475
 epoch: 9, train_loss: 1.0511, test_loss: 1.0176, test_f1: 0.4450
 epoch: 10, train_loss: 1.0354, test_loss: 1.0052, test_f1: 0.4587
 epoch: 11, train_loss: 1.0266, test_loss: 0.9947, test_f1: 0.4500
 epoch: 12, train_loss: 1.0102, test_loss: 0.9875, test_f1: 0.4572
 epoch: 13, train_loss: 1.0051, test_loss: 0.9821, test_f1: 0.4637
 epoch: 14, train_loss: 0.9961, test_loss: 0.9827, test_f1: 0.4633
 epoch: 15, train_loss: 0.9927, test_loss: 0.9686, test_f1: 0.4633
 epoch: 16, train_loss: 0.9791, test_loss: 0.9630, test_f1: 0.4645
 epoch: 17, train_loss: 0.9729, test_loss: 0.9690, test_f1: 0.4613
 epoch: 18, train_loss: 0.9680, test_loss: 0.9612, test_f1: 0.4724
 epoch: 19, train_loss: 0.9626, test_loss: 0.9667, test_f1: 0.4848
 epoch: 20, train_loss: 0.9513, test_loss: 0.9636, test_f1: 0.4803
 epoch: 21, train_loss: 0.9477, test_loss: 0.9560, test_f1: 0.4846
 epoch: 22, train_loss: 0.9426, test_loss: 0.9618, test_f1: 0.4795
 epoch: 23, train_loss: 0.9437, test_loss: 0.9556, test_f1: 0.4866
 epoch: 24, train_loss: 0.9375, test_loss: 0.9567, test_f1: 0.4840
 epoch: 25, train_loss: 0.9354, test_loss: 0.9432, test_f1: 0.5023
 epoch: 26, train_loss: 0.9263, test_loss: 0.9563, test_f1: 0.5067
 epoch: 27, train_loss: 0.9193, test_loss: 0.9407, test_f1: 0.5215
 epoch: 28, train_loss: 0.9151, test_loss: 0.9357, test_f1: 0.5168
 epoch: 29, train_loss: 0.9112, test_loss: 0.9512, test_f1: 0.5236
 epoch: 30, train_loss: 0.9046, test_loss: 0.9433, test_f1: 0.5310
 epoch: 31, train_loss: 0.9106, test_loss: 0.9322, test_f1: 0.5333
 epoch: 32, train_loss: 0.8965, test_loss: 0.9396, test_f1: 0.5343
 epoch: 33, train_loss: 0.8987, test_loss: 0.9304, test_f1: 0.5396
 epoch: 34, train_loss: 0.8980, test_loss: 0.9373, test_f1: 0.5418
 epoch: 35, train_loss: 0.8978, test_loss: 0.9221, test_f1: 0.5435
 epoch: 36, train_loss: 0.8955, test_loss: 0.9324, test_f1: 0.5391
 epoch: 37, train_loss: 0.8881, test_loss: 0.9206, test_f1: 0.5436
 epoch: 38, train_loss: 0.8807, test_loss: 0.9393, test_f1: 0.5383
 epoch: 39, train_loss: 0.8770, test_loss: 0.9271, test_f1: 0.5373
 epoch: 40, train_loss: 0.8800, test_loss: 0.9501, test_f1: 0.5284
 epoch: 41, train_loss: 0.8718, test_loss: 0.9249, test_f1: 0.5420
 epoch: 42, train_loss: 0.8647, test_loss: 0.9238, test_f1: 0.5311
 epoch: 43, train_loss: 0.8685, test_loss: 0.9249, test_f1: 0.5362
 epoch: 44, train_loss: 0.8584, test_loss: 0.9267, test_f1: 0.5257
 epoch: 45, train_loss: 0.8551, test_loss: 0.9140, test_f1: 0.5379
 epoch: 46, train_loss: 0.8638, test_loss: 0.9090, test_f1: 0.5338
 epoch: 47, train_loss: 0.8631, test_loss: 0.9257, test_f1: 0.5211
 epoch: 48, train_loss: 0.8498, test_loss: 0.9482, test_f1: 0.5259
 epoch: 49, train_loss: 0.8503, test_loss: 0.9540, test_f1: 0.5234
 epoch: 50, train_loss: 0.8512, test_loss: 0.9329, test_f1: 0.5272
 epoch: 51, train_loss: 0.8434, test_loss: 0.9276, test_f1: 0.5289
 epoch: 52, train_loss: 0.8394, test_loss: 0.9298, test_f1: 0.5240
 epoch: 53, train_loss: 0.8376, test_loss: 0.9119, test_f1: 0.5343
 epoch: 54, train_loss: 0.8362, test_loss: 0.9416, test_f1: 0.5283
 epoch: 55, train_loss: 0.8345, test_loss: 0.9228, test_f1: 0.5258
 epoch: 56, train_loss: 0.8326, test_loss: 0.9140, test_f1: 0.5315
 epoch: 57, train_loss: 0.8338, test_loss: 0.9188, test_f1: 0.5259
 epoch: 58, train_loss: 0.8352, test_loss: 0.9535, test_f1: 0.5224
 epoch: 59, train_loss: 0.8325, test_loss: 0.9307, test_f1: 0.5240
 epoch: 60, train_loss: 0.8314, test_loss: 0.9316, test_f1: 0.5282
 epoch: 61, train_loss: 0.8294, test_loss: 0.9213, test_f1: 0.5295
 epoch: 62, train_loss: 0.8326, test_loss: 0.9434, test_f1: 0.5316
 epoch: 63, train_loss: 0.8220, test_loss: 0.9332, test_f1: 0.5271
 epoch: 64, train_loss: 0.8237, test_loss: 0.9246, test_f1: 0.5304
 epoch: 65, train_loss: 0.8192, test_loss: 0.9344, test_f1: 0.5277
 epoch: 66, train_loss: 0.8216, test_loss: 0.9245, test_f1: 0.5311
 epoch: 67, train_loss: 0.8239, test_loss: 0.9251, test_f1: 0.5319
 epoch: 68, train_loss: 0.8240, test_loss: 0.9358, test_f1: 0.5274
 epoch: 69, train_loss: 0.8162, test_loss: 0.9436, test_f1: 0.5302
 epoch: 70, train_loss: 0.8159, test_loss: 0.9272, test_f1: 0.5323
 epoch: 71, train_loss: 0.8219, test_loss: 0.9285, test_f1: 0.5299
 epoch: 72, train_loss: 0.8179, test_loss: 0.9252, test_f1: 0.5342
 epoch: 73, train_loss: 0.8131, test_loss: 0.9352, test_f1: 0.5339
 epoch: 74, train_loss: 0.8142, test_loss: 0.9266, test_f1: 0.5318
 epoch: 75, train_loss: 0.8093, test_loss: 0.9262, test_f1: 0.5289
 epoch: 76, train_loss: 0.8107, test_loss: 0.9363, test_f1: 0.5347
 epoch: 77, train_loss: 0.8079, test_loss: 0.9301, test_f1: 0.5322
 epoch: 78, train_loss: 0.8123, test_loss: 0.9298, test_f1: 0.5293
 epoch: 79, train_loss: 0.8053, test_loss: 0.9375, test_f1: 0.5299
 epoch: 80, train_loss: 0.8049, test_loss: 0.9352, test_f1: 0.5313
 epoch: 81, train_loss: 0.8064, test_loss: 0.9478, test_f1: 0.5325
 epoch: 82, train_loss: 0.8006, test_loss: 0.9453, test_f1: 0.5327
 epoch: 83, train_loss: 0.8045, test_loss: 0.9374, test_f1: 0.5390
 epoch: 84, train_loss: 0.8019, test_loss: 0.9261, test_f1: 0.5331
 epoch: 85, train_loss: 0.8154, test_loss: 0.9225, test_f1: 0.5322
 epoch: 86, train_loss: 0.7989, test_loss: 0.9294, test_f1: 0.5319
 epoch: 87, train_loss: 0.7960, test_loss: 0.9460, test_f1: 0.5347
 epoch: 88, train_loss: 0.7940, test_loss: 0.9555, test_f1: 0.5358
 epoch: 89, train_loss: 0.8067, test_loss: 0.9447, test_f1: 0.5415
 epoch: 90, train_loss: 0.8021, test_loss: 0.9600, test_f1: 0.5355
 epoch: 91, train_loss: 0.7985, test_loss: 0.9383, test_f1: 0.5386
 epoch: 92, train_loss: 0.7970, test_loss: 0.9338, test_f1: 0.5413
 epoch: 93, train_loss: 0.7925, test_loss: 0.9624, test_f1: 0.5329
 epoch: 94, train_loss: 0.7941, test_loss: 0.9405, test_f1: 0.5405
 epoch: 95, train_loss: 0.7960, test_loss: 0.9343, test_f1: 0.5395
 epoch: 96, train_loss: 0.7919, test_loss: 0.9314, test_f1: 0.5399
 epoch: 97, train_loss: 0.7950, test_loss: 0.9361, test_f1: 0.5426
 epoch: 98, train_loss: 0.7897, test_loss: 0.9447, test_f1: 0.5414
 epoch: 99, train_loss: 0.7881, test_loss: 0.9469, test_f1: 0.5350
##################ITERATION #4 ****************************************
 epoch: 0, train_loss: 1.2977, test_loss: 1.3124, test_f1: 0.2270
 epoch: 1, train_loss: 1.2252, test_loss: 1.2179, test_f1: 0.2783
 epoch: 2, train_loss: 1.1913, test_loss: 1.1538, test_f1: 0.3386
 epoch: 3, train_loss: 1.1706, test_loss: 1.1236, test_f1: 0.3467
 epoch: 4, train_loss: 1.1535, test_loss: 1.1038, test_f1: 0.3550
 epoch: 5, train_loss: 1.1374, test_loss: 1.0860, test_f1: 0.3836
 epoch: 6, train_loss: 1.1186, test_loss: 1.0731, test_f1: 0.4018
 epoch: 7, train_loss: 1.1004, test_loss: 1.0559, test_f1: 0.4131
 epoch: 8, train_loss: 1.0872, test_loss: 1.0431, test_f1: 0.4172
 epoch: 9, train_loss: 1.0730, test_loss: 1.0297, test_f1: 0.4365
 epoch: 10, train_loss: 1.0582, test_loss: 1.0249, test_f1: 0.4429
 epoch: 11, train_loss: 1.0457, test_loss: 1.0141, test_f1: 0.4635
 epoch: 12, train_loss: 1.0261, test_loss: 1.0079, test_f1: 0.4662
 epoch: 13, train_loss: 1.0209, test_loss: 0.9979, test_f1: 0.4662
 epoch: 14, train_loss: 1.0110, test_loss: 0.9908, test_f1: 0.4653
 epoch: 15, train_loss: 1.0034, test_loss: 0.9845, test_f1: 0.4671
 epoch: 16, train_loss: 0.9941, test_loss: 0.9796, test_f1: 0.4832
 epoch: 17, train_loss: 0.9837, test_loss: 0.9811, test_f1: 0.4736
 epoch: 18, train_loss: 0.9848, test_loss: 0.9779, test_f1: 0.4920
 epoch: 19, train_loss: 0.9781, test_loss: 0.9657, test_f1: 0.4888
 epoch: 20, train_loss: 0.9694, test_loss: 0.9609, test_f1: 0.4933
 epoch: 21, train_loss: 0.9683, test_loss: 0.9643, test_f1: 0.4884
 epoch: 22, train_loss: 0.9606, test_loss: 0.9690, test_f1: 0.4972
 epoch: 23, train_loss: 0.9559, test_loss: 0.9647, test_f1: 0.4904
 epoch: 24, train_loss: 0.9484, test_loss: 0.9535, test_f1: 0.4956
 epoch: 25, train_loss: 0.9435, test_loss: 0.9617, test_f1: 0.5072
 epoch: 26, train_loss: 0.9382, test_loss: 0.9520, test_f1: 0.5051
 epoch: 27, train_loss: 0.9438, test_loss: 0.9617, test_f1: 0.4919
 epoch: 28, train_loss: 0.9393, test_loss: 0.9545, test_f1: 0.4988
 epoch: 29, train_loss: 0.9298, test_loss: 0.9611, test_f1: 0.4890
 epoch: 30, train_loss: 0.9269, test_loss: 0.9468, test_f1: 0.5055
 epoch: 31, train_loss: 0.9180, test_loss: 0.9516, test_f1: 0.5069
 epoch: 32, train_loss: 0.9197, test_loss: 0.9494, test_f1: 0.5016
 epoch: 33, train_loss: 0.9178, test_loss: 0.9455, test_f1: 0.5004
 epoch: 34, train_loss: 0.9183, test_loss: 0.9345, test_f1: 0.5061
 epoch: 35, train_loss: 0.9125, test_loss: 0.9429, test_f1: 0.5246
 epoch: 36, train_loss: 0.9113, test_loss: 0.9461, test_f1: 0.5118
 epoch: 37, train_loss: 0.9026, test_loss: 0.9442, test_f1: 0.5059
 epoch: 38, train_loss: 0.8969, test_loss: 0.9602, test_f1: 0.5048
 epoch: 39, train_loss: 0.8992, test_loss: 0.9469, test_f1: 0.5017
 epoch: 40, train_loss: 0.8944, test_loss: 0.9455, test_f1: 0.5111
 epoch: 41, train_loss: 0.8871, test_loss: 0.9513, test_f1: 0.4997
 epoch: 42, train_loss: 0.8785, test_loss: 0.9567, test_f1: 0.4917
 epoch: 43, train_loss: 0.8907, test_loss: 0.9462, test_f1: 0.5061
 epoch: 44, train_loss: 0.8787, test_loss: 0.9537, test_f1: 0.4987
 epoch: 45, train_loss: 0.8907, test_loss: 0.9345, test_f1: 0.5183
 epoch: 46, train_loss: 0.8772, test_loss: 0.9423, test_f1: 0.5097
 epoch: 47, train_loss: 0.8768, test_loss: 0.9379, test_f1: 0.5182
 epoch: 48, train_loss: 0.8765, test_loss: 0.9531, test_f1: 0.5019
 epoch: 49, train_loss: 0.8686, test_loss: 0.9328, test_f1: 0.5302
 epoch: 50, train_loss: 0.8676, test_loss: 0.9420, test_f1: 0.5061
 epoch: 51, train_loss: 0.8599, test_loss: 0.9387, test_f1: 0.5218
 epoch: 52, train_loss: 0.8652, test_loss: 0.9388, test_f1: 0.5267
 epoch: 53, train_loss: 0.8565, test_loss: 0.9349, test_f1: 0.5215
 epoch: 54, train_loss: 0.8555, test_loss: 0.9393, test_f1: 0.5104
 epoch: 55, train_loss: 0.8577, test_loss: 0.9309, test_f1: 0.5183
 epoch: 56, train_loss: 0.8519, test_loss: 0.9261, test_f1: 0.5262
 epoch: 57, train_loss: 0.8524, test_loss: 0.9299, test_f1: 0.5211
 epoch: 58, train_loss: 0.8520, test_loss: 0.9342, test_f1: 0.5221
 epoch: 59, train_loss: 0.8486, test_loss: 0.9398, test_f1: 0.5141
 epoch: 60, train_loss: 0.8527, test_loss: 0.9397, test_f1: 0.5099
 epoch: 61, train_loss: 0.8429, test_loss: 0.9351, test_f1: 0.5157
 epoch: 62, train_loss: 0.8364, test_loss: 0.9382, test_f1: 0.5191
 epoch: 63, train_loss: 0.8487, test_loss: 0.9315, test_f1: 0.5232
 epoch: 64, train_loss: 0.8411, test_loss: 0.9408, test_f1: 0.5157
 epoch: 65, train_loss: 0.8377, test_loss: 0.9286, test_f1: 0.5296
 epoch: 66, train_loss: 0.8342, test_loss: 0.9367, test_f1: 0.5195
 epoch: 67, train_loss: 0.8412, test_loss: 0.9325, test_f1: 0.5230
 epoch: 68, train_loss: 0.8471, test_loss: 0.9395, test_f1: 0.5228
 epoch: 69, train_loss: 0.8439, test_loss: 0.9303, test_f1: 0.5225
 epoch: 70, train_loss: 0.8379, test_loss: 0.9319, test_f1: 0.5265
 epoch: 71, train_loss: 0.8312, test_loss: 0.9392, test_f1: 0.5305
 epoch: 72, train_loss: 0.8342, test_loss: 0.9421, test_f1: 0.5158
 epoch: 73, train_loss: 0.8305, test_loss: 0.9429, test_f1: 0.5212
 epoch: 74, train_loss: 0.8398, test_loss: 0.9302, test_f1: 0.5240
 epoch: 75, train_loss: 0.8355, test_loss: 0.9319, test_f1: 0.5283
 epoch: 76, train_loss: 0.8181, test_loss: 0.9397, test_f1: 0.5246
 epoch: 77, train_loss: 0.8139, test_loss: 0.9365, test_f1: 0.5252
 epoch: 78, train_loss: 0.8279, test_loss: 0.9379, test_f1: 0.5400
 epoch: 79, train_loss: 0.8240, test_loss: 0.9394, test_f1: 0.5200
 epoch: 80, train_loss: 0.8240, test_loss: 0.9290, test_f1: 0.5302
 epoch: 81, train_loss: 0.8235, test_loss: 0.9334, test_f1: 0.5332
 epoch: 82, train_loss: 0.8217, test_loss: 0.9352, test_f1: 0.5298
 epoch: 83, train_loss: 0.8192, test_loss: 0.9366, test_f1: 0.5227
 epoch: 84, train_loss: 0.8172, test_loss: 0.9362, test_f1: 0.5256
 epoch: 85, train_loss: 0.8185, test_loss: 0.9361, test_f1: 0.5262
 epoch: 86, train_loss: 0.8168, test_loss: 0.9413, test_f1: 0.5200
 epoch: 87, train_loss: 0.8130, test_loss: 0.9352, test_f1: 0.5299
 epoch: 88, train_loss: 0.8102, test_loss: 0.9377, test_f1: 0.5305
 epoch: 89, train_loss: 0.8124, test_loss: 0.9369, test_f1: 0.5339
 epoch: 90, train_loss: 0.8177, test_loss: 0.9385, test_f1: 0.5280
 epoch: 91, train_loss: 0.8168, test_loss: 0.9390, test_f1: 0.5326
 epoch: 92, train_loss: 0.8078, test_loss: 0.9367, test_f1: 0.5304
 epoch: 93, train_loss: 0.8092, test_loss: 0.9427, test_f1: 0.5293
 epoch: 94, train_loss: 0.8052, test_loss: 0.9374, test_f1: 0.5326
 epoch: 95, train_loss: 0.8004, test_loss: 0.9405, test_f1: 0.5238
 epoch: 96, train_loss: 0.8176, test_loss: 0.9460, test_f1: 0.5249
 epoch: 97, train_loss: 0.8076, test_loss: 0.9432, test_f1: 0.5339
 epoch: 98, train_loss: 0.8019, test_loss: 0.9410, test_f1: 0.5290
 epoch: 99, train_loss: 0.8071, test_loss: 0.9355, test_f1: 0.5234
##################ITERATION #5 ****************************************
 epoch: 0, train_loss: 1.2861, test_loss: 1.2578, test_f1: 0.2270
 epoch: 1, train_loss: 1.2093, test_loss: 1.1803, test_f1: 0.3370
 epoch: 2, train_loss: 1.1704, test_loss: 1.1277, test_f1: 0.4000
 epoch: 3, train_loss: 1.1513, test_loss: 1.0940, test_f1: 0.4330
 epoch: 4, train_loss: 1.1264, test_loss: 1.0723, test_f1: 0.4419
 epoch: 5, train_loss: 1.0987, test_loss: 1.0500, test_f1: 0.4495
 epoch: 6, train_loss: 1.0904, test_loss: 1.0346, test_f1: 0.4572
 epoch: 7, train_loss: 1.0709, test_loss: 1.0209, test_f1: 0.4587
 epoch: 8, train_loss: 1.0555, test_loss: 1.0062, test_f1: 0.4559
 epoch: 9, train_loss: 1.0449, test_loss: 0.9939, test_f1: 0.4672
 epoch: 10, train_loss: 1.0294, test_loss: 0.9863, test_f1: 0.4666
 epoch: 11, train_loss: 1.0165, test_loss: 0.9773, test_f1: 0.4748
 epoch: 12, train_loss: 1.0099, test_loss: 0.9723, test_f1: 0.4725
 epoch: 13, train_loss: 0.9936, test_loss: 0.9589, test_f1: 0.4801
 epoch: 14, train_loss: 0.9868, test_loss: 0.9559, test_f1: 0.4773
 epoch: 15, train_loss: 0.9822, test_loss: 0.9545, test_f1: 0.4835
 epoch: 16, train_loss: 0.9788, test_loss: 0.9493, test_f1: 0.4826
 epoch: 17, train_loss: 0.9658, test_loss: 0.9476, test_f1: 0.4755
 epoch: 18, train_loss: 0.9649, test_loss: 0.9465, test_f1: 0.4986
 epoch: 19, train_loss: 0.9608, test_loss: 0.9453, test_f1: 0.5012
 epoch: 20, train_loss: 0.9466, test_loss: 0.9387, test_f1: 0.4895
 epoch: 21, train_loss: 0.9475, test_loss: 0.9428, test_f1: 0.4989
 epoch: 22, train_loss: 0.9347, test_loss: 0.9293, test_f1: 0.5079
 epoch: 23, train_loss: 0.9414, test_loss: 0.9241, test_f1: 0.5028
 epoch: 24, train_loss: 0.9327, test_loss: 0.9201, test_f1: 0.5112
 epoch: 25, train_loss: 0.9294, test_loss: 0.9213, test_f1: 0.5034
 epoch: 26, train_loss: 0.9302, test_loss: 0.9147, test_f1: 0.5134
 epoch: 27, train_loss: 0.9163, test_loss: 0.9124, test_f1: 0.5090
 epoch: 28, train_loss: 0.9135, test_loss: 0.9139, test_f1: 0.5147
 epoch: 29, train_loss: 0.9159, test_loss: 0.9088, test_f1: 0.5132
 epoch: 30, train_loss: 0.9000, test_loss: 0.9071, test_f1: 0.5133
 epoch: 31, train_loss: 0.9016, test_loss: 0.9030, test_f1: 0.5195
 epoch: 32, train_loss: 0.8967, test_loss: 0.8986, test_f1: 0.5132
 epoch: 33, train_loss: 0.9010, test_loss: 0.8941, test_f1: 0.5121
 epoch: 34, train_loss: 0.8987, test_loss: 0.9101, test_f1: 0.5034
 epoch: 35, train_loss: 0.8932, test_loss: 0.8962, test_f1: 0.5095
 epoch: 36, train_loss: 0.8922, test_loss: 0.8956, test_f1: 0.5157
 epoch: 37, train_loss: 0.8842, test_loss: 0.9006, test_f1: 0.5116
 epoch: 38, train_loss: 0.8816, test_loss: 0.8976, test_f1: 0.5202
 epoch: 39, train_loss: 0.8811, test_loss: 0.8914, test_f1: 0.5159
 epoch: 40, train_loss: 0.8778, test_loss: 0.8883, test_f1: 0.5217
 epoch: 41, train_loss: 0.8743, test_loss: 0.9030, test_f1: 0.5145
 epoch: 42, train_loss: 0.8726, test_loss: 0.8857, test_f1: 0.5253
 epoch: 43, train_loss: 0.8618, test_loss: 0.8834, test_f1: 0.5262
 epoch: 44, train_loss: 0.8627, test_loss: 0.8926, test_f1: 0.5171
 epoch: 45, train_loss: 0.8642, test_loss: 0.8997, test_f1: 0.5217
 epoch: 46, train_loss: 0.8640, test_loss: 0.9056, test_f1: 0.5198
 epoch: 47, train_loss: 0.8582, test_loss: 0.8840, test_f1: 0.5351
 epoch: 48, train_loss: 0.8519, test_loss: 0.8882, test_f1: 0.5185
 epoch: 49, train_loss: 0.8513, test_loss: 0.8924, test_f1: 0.5236
 epoch: 50, train_loss: 0.8572, test_loss: 0.9064, test_f1: 0.5241
 epoch: 51, train_loss: 0.8462, test_loss: 0.8775, test_f1: 0.5284
 epoch: 52, train_loss: 0.8526, test_loss: 0.8802, test_f1: 0.5324
 epoch: 53, train_loss: 0.8456, test_loss: 0.8872, test_f1: 0.5322
 epoch: 54, train_loss: 0.8311, test_loss: 0.8906, test_f1: 0.5243
 epoch: 55, train_loss: 0.8393, test_loss: 0.8756, test_f1: 0.5335
 epoch: 56, train_loss: 0.8366, test_loss: 0.8866, test_f1: 0.5376
 epoch: 57, train_loss: 0.8486, test_loss: 0.8910, test_f1: 0.5380
 epoch: 58, train_loss: 0.8412, test_loss: 0.8837, test_f1: 0.5485
 epoch: 59, train_loss: 0.8379, test_loss: 0.8889, test_f1: 0.5381
 epoch: 60, train_loss: 0.8264, test_loss: 0.8902, test_f1: 0.5343
 epoch: 61, train_loss: 0.8355, test_loss: 0.8959, test_f1: 0.5473
 epoch: 62, train_loss: 0.8322, test_loss: 0.8789, test_f1: 0.5401
 epoch: 63, train_loss: 0.8451, test_loss: 0.8848, test_f1: 0.5447
 epoch: 64, train_loss: 0.8247, test_loss: 0.8897, test_f1: 0.5394
 epoch: 65, train_loss: 0.8273, test_loss: 0.8914, test_f1: 0.5366
 epoch: 66, train_loss: 0.8256, test_loss: 0.8815, test_f1: 0.5372
 epoch: 67, train_loss: 0.8310, test_loss: 0.8818, test_f1: 0.5435
 epoch: 68, train_loss: 0.8225, test_loss: 0.8899, test_f1: 0.5537
 epoch: 69, train_loss: 0.8235, test_loss: 0.8917, test_f1: 0.5375
 epoch: 70, train_loss: 0.8252, test_loss: 0.8891, test_f1: 0.5435
 epoch: 71, train_loss: 0.8235, test_loss: 0.8885, test_f1: 0.5420
 epoch: 72, train_loss: 0.8158, test_loss: 0.8844, test_f1: 0.5596
 epoch: 73, train_loss: 0.8275, test_loss: 0.8833, test_f1: 0.5586
 epoch: 74, train_loss: 0.8172, test_loss: 0.8805, test_f1: 0.5570
 epoch: 75, train_loss: 0.8067, test_loss: 0.8937, test_f1: 0.5465
 epoch: 76, train_loss: 0.8265, test_loss: 0.8876, test_f1: 0.5585
 epoch: 77, train_loss: 0.8195, test_loss: 0.8897, test_f1: 0.5574
 epoch: 78, train_loss: 0.8117, test_loss: 0.8888, test_f1: 0.5547
 epoch: 79, train_loss: 0.8108, test_loss: 0.8879, test_f1: 0.5652
 epoch: 80, train_loss: 0.8133, test_loss: 0.8982, test_f1: 0.5532
 epoch: 81, train_loss: 0.8141, test_loss: 0.8918, test_f1: 0.5661
 epoch: 82, train_loss: 0.8148, test_loss: 0.8895, test_f1: 0.5660
 epoch: 83, train_loss: 0.8179, test_loss: 0.8867, test_f1: 0.5570
 epoch: 84, train_loss: 0.8135, test_loss: 0.8938, test_f1: 0.5470
 epoch: 85, train_loss: 0.8116, test_loss: 0.8910, test_f1: 0.5667
 epoch: 86, train_loss: 0.8139, test_loss: 0.8977, test_f1: 0.5433
 epoch: 87, train_loss: 0.8055, test_loss: 0.9022, test_f1: 0.5631
 epoch: 88, train_loss: 0.8078, test_loss: 0.8926, test_f1: 0.5591
 epoch: 89, train_loss: 0.8075, test_loss: 0.8992, test_f1: 0.5623
 epoch: 90, train_loss: 0.8133, test_loss: 0.8968, test_f1: 0.5663
 epoch: 91, train_loss: 0.7971, test_loss: 0.8933, test_f1: 0.5701
 epoch: 92, train_loss: 0.8081, test_loss: 0.8909, test_f1: 0.5642
 epoch: 93, train_loss: 0.8040, test_loss: 0.8915, test_f1: 0.5692
 epoch: 94, train_loss: 0.8033, test_loss: 0.8893, test_f1: 0.5721
 epoch: 95, train_loss: 0.8064, test_loss: 0.8898, test_f1: 0.5623
 epoch: 96, train_loss: 0.7988, test_loss: 0.8815, test_f1: 0.5684
 epoch: 97, train_loss: 0.8024, test_loss: 0.8932, test_f1: 0.5591
 epoch: 98, train_loss: 0.8009, test_loss: 0.8963, test_f1: 0.5611
 epoch: 99, train_loss: 0.7944, test_loss: 0.9002, test_f1: 0.5688
##################ITERATION #6 ****************************************
 epoch: 0, train_loss: 1.2807, test_loss: 1.2927, test_f1: 0.2270
 epoch: 1, train_loss: 1.2225, test_loss: 1.2247, test_f1: 0.3035
 epoch: 2, train_loss: 1.2074, test_loss: 1.1712, test_f1: 0.3402
 epoch: 3, train_loss: 1.1852, test_loss: 1.1428, test_f1: 0.3724
 epoch: 4, train_loss: 1.1719, test_loss: 1.1247, test_f1: 0.3875
 epoch: 5, train_loss: 1.1549, test_loss: 1.1086, test_f1: 0.4124
 epoch: 6, train_loss: 1.1380, test_loss: 1.0903, test_f1: 0.4349
 epoch: 7, train_loss: 1.1220, test_loss: 1.0754, test_f1: 0.4263
 epoch: 8, train_loss: 1.1054, test_loss: 1.0567, test_f1: 0.4507
 epoch: 9, train_loss: 1.0922, test_loss: 1.0433, test_f1: 0.4433
 epoch: 10, train_loss: 1.0872, test_loss: 1.0304, test_f1: 0.4545
 epoch: 11, train_loss: 1.0711, test_loss: 1.0200, test_f1: 0.4521
 epoch: 12, train_loss: 1.0603, test_loss: 1.0093, test_f1: 0.4627
 epoch: 13, train_loss: 1.0511, test_loss: 1.0009, test_f1: 0.4683
 epoch: 14, train_loss: 1.0367, test_loss: 0.9944, test_f1: 0.4748
 epoch: 15, train_loss: 1.0235, test_loss: 0.9841, test_f1: 0.4741
 epoch: 16, train_loss: 1.0177, test_loss: 0.9809, test_f1: 0.4718
 epoch: 17, train_loss: 1.0201, test_loss: 0.9817, test_f1: 0.4766
 epoch: 18, train_loss: 1.0061, test_loss: 0.9698, test_f1: 0.4834
 epoch: 19, train_loss: 0.9986, test_loss: 0.9739, test_f1: 0.4737
 epoch: 20, train_loss: 0.9945, test_loss: 0.9669, test_f1: 0.4676
 epoch: 21, train_loss: 0.9890, test_loss: 0.9607, test_f1: 0.4795
 epoch: 22, train_loss: 0.9800, test_loss: 0.9588, test_f1: 0.4910
 epoch: 23, train_loss: 0.9768, test_loss: 0.9589, test_f1: 0.4872
 epoch: 24, train_loss: 0.9804, test_loss: 0.9556, test_f1: 0.4919
 epoch: 25, train_loss: 0.9711, test_loss: 0.9538, test_f1: 0.4878
 epoch: 26, train_loss: 0.9637, test_loss: 0.9568, test_f1: 0.4828
 epoch: 27, train_loss: 0.9632, test_loss: 0.9571, test_f1: 0.4968
 epoch: 28, train_loss: 0.9631, test_loss: 0.9450, test_f1: 0.4937
 epoch: 29, train_loss: 0.9504, test_loss: 0.9389, test_f1: 0.5030
 epoch: 30, train_loss: 0.9514, test_loss: 0.9491, test_f1: 0.5000
 epoch: 31, train_loss: 0.9468, test_loss: 0.9412, test_f1: 0.4986
 epoch: 32, train_loss: 0.9445, test_loss: 0.9312, test_f1: 0.5044
 epoch: 33, train_loss: 0.9435, test_loss: 0.9307, test_f1: 0.5051
 epoch: 34, train_loss: 0.9436, test_loss: 0.9317, test_f1: 0.5065
 epoch: 35, train_loss: 0.9371, test_loss: 0.9381, test_f1: 0.5025
 epoch: 36, train_loss: 0.9302, test_loss: 0.9238, test_f1: 0.5075
 epoch: 37, train_loss: 0.9275, test_loss: 0.9373, test_f1: 0.5135
 epoch: 38, train_loss: 0.9158, test_loss: 0.9231, test_f1: 0.5146
 epoch: 39, train_loss: 0.9230, test_loss: 0.9179, test_f1: 0.5112
 epoch: 40, train_loss: 0.9228, test_loss: 0.9129, test_f1: 0.5105
 epoch: 41, train_loss: 0.9170, test_loss: 0.9139, test_f1: 0.5143
 epoch: 42, train_loss: 0.9181, test_loss: 0.9121, test_f1: 0.5160
 epoch: 43, train_loss: 0.9126, test_loss: 0.9115, test_f1: 0.5180
 epoch: 44, train_loss: 0.9157, test_loss: 0.9115, test_f1: 0.5219
 epoch: 45, train_loss: 0.9005, test_loss: 0.8980, test_f1: 0.5191
 epoch: 46, train_loss: 0.8999, test_loss: 0.9029, test_f1: 0.5114
 epoch: 47, train_loss: 0.9000, test_loss: 0.9054, test_f1: 0.5244
 epoch: 48, train_loss: 0.9010, test_loss: 0.8981, test_f1: 0.5251
 epoch: 49, train_loss: 0.8930, test_loss: 0.9087, test_f1: 0.5169
 epoch: 50, train_loss: 0.8882, test_loss: 0.9142, test_f1: 0.5261
 epoch: 51, train_loss: 0.8882, test_loss: 0.9029, test_f1: 0.5200
 epoch: 52, train_loss: 0.8897, test_loss: 0.9042, test_f1: 0.5203
 epoch: 53, train_loss: 0.8869, test_loss: 0.8936, test_f1: 0.5210
 epoch: 54, train_loss: 0.8870, test_loss: 0.8942, test_f1: 0.5251
 epoch: 55, train_loss: 0.8811, test_loss: 0.8995, test_f1: 0.5299
 epoch: 56, train_loss: 0.8873, test_loss: 0.8873, test_f1: 0.5293
 epoch: 57, train_loss: 0.8788, test_loss: 0.8914, test_f1: 0.5282
 epoch: 58, train_loss: 0.8836, test_loss: 0.9013, test_f1: 0.5391
 epoch: 59, train_loss: 0.8773, test_loss: 0.8881, test_f1: 0.5277
 epoch: 60, train_loss: 0.8749, test_loss: 0.8927, test_f1: 0.5373
 epoch: 61, train_loss: 0.8730, test_loss: 0.8901, test_f1: 0.5318
 epoch: 62, train_loss: 0.8743, test_loss: 0.8868, test_f1: 0.5297
 epoch: 63, train_loss: 0.8695, test_loss: 0.8913, test_f1: 0.5395
 epoch: 64, train_loss: 0.8653, test_loss: 0.8846, test_f1: 0.5337
 epoch: 65, train_loss: 0.8656, test_loss: 0.8814, test_f1: 0.5381
 epoch: 66, train_loss: 0.8590, test_loss: 0.8861, test_f1: 0.5374
 epoch: 67, train_loss: 0.8671, test_loss: 0.8841, test_f1: 0.5396
 epoch: 68, train_loss: 0.8717, test_loss: 0.8857, test_f1: 0.5402
 epoch: 69, train_loss: 0.8644, test_loss: 0.8877, test_f1: 0.5406
 epoch: 70, train_loss: 0.8601, test_loss: 0.8872, test_f1: 0.5366
 epoch: 71, train_loss: 0.8662, test_loss: 0.8912, test_f1: 0.5433
 epoch: 72, train_loss: 0.8611, test_loss: 0.8765, test_f1: 0.5411
 epoch: 73, train_loss: 0.8588, test_loss: 0.8751, test_f1: 0.5384
 epoch: 74, train_loss: 0.8588, test_loss: 0.8817, test_f1: 0.5449
 epoch: 75, train_loss: 0.8640, test_loss: 0.8848, test_f1: 0.5370
 epoch: 76, train_loss: 0.8624, test_loss: 0.8770, test_f1: 0.5425
 epoch: 77, train_loss: 0.8543, test_loss: 0.8770, test_f1: 0.5412
 epoch: 78, train_loss: 0.8619, test_loss: 0.8782, test_f1: 0.5421
 epoch: 79, train_loss: 0.8581, test_loss: 0.8714, test_f1: 0.5402
 epoch: 80, train_loss: 0.8555, test_loss: 0.8811, test_f1: 0.5360
 epoch: 81, train_loss: 0.8498, test_loss: 0.8771, test_f1: 0.5422
 epoch: 82, train_loss: 0.8431, test_loss: 0.8772, test_f1: 0.5395
 epoch: 83, train_loss: 0.8428, test_loss: 0.8768, test_f1: 0.5423
 epoch: 84, train_loss: 0.8492, test_loss: 0.8716, test_f1: 0.5446
 epoch: 85, train_loss: 0.8480, test_loss: 0.8764, test_f1: 0.5411
 epoch: 86, train_loss: 0.8415, test_loss: 0.8761, test_f1: 0.5449
 epoch: 87, train_loss: 0.8484, test_loss: 0.8728, test_f1: 0.5516
 epoch: 88, train_loss: 0.8456, test_loss: 0.8788, test_f1: 0.5497
 epoch: 89, train_loss: 0.8482, test_loss: 0.8752, test_f1: 0.5443
 epoch: 90, train_loss: 0.8342, test_loss: 0.8712, test_f1: 0.5469
 epoch: 91, train_loss: 0.8389, test_loss: 0.8746, test_f1: 0.5548
 epoch: 92, train_loss: 0.8416, test_loss: 0.8614, test_f1: 0.5512
 epoch: 93, train_loss: 0.8379, test_loss: 0.8798, test_f1: 0.5504
 epoch: 94, train_loss: 0.8322, test_loss: 0.8856, test_f1: 0.5446
 epoch: 95, train_loss: 0.8421, test_loss: 0.8645, test_f1: 0.5517
 epoch: 96, train_loss: 0.8303, test_loss: 0.8777, test_f1: 0.5513
 epoch: 97, train_loss: 0.8324, test_loss: 0.8847, test_f1: 0.5547
 epoch: 98, train_loss: 0.8311, test_loss: 0.8701, test_f1: 0.5590
 epoch: 99, train_loss: 0.8260, test_loss: 0.8761, test_f1: 0.5495
##################ITERATION #7 ****************************************
 epoch: 0, train_loss: 1.3033, test_loss: 1.3211, test_f1: 0.2350
 epoch: 1, train_loss: 1.2245, test_loss: 1.2095, test_f1: 0.3397
 epoch: 2, train_loss: 1.1823, test_loss: 1.1326, test_f1: 0.3933
 epoch: 3, train_loss: 1.1655, test_loss: 1.1034, test_f1: 0.4071
 epoch: 4, train_loss: 1.1553, test_loss: 1.0830, test_f1: 0.4355
 epoch: 5, train_loss: 1.1285, test_loss: 1.0658, test_f1: 0.4327
 epoch: 6, train_loss: 1.0979, test_loss: 1.0481, test_f1: 0.4376
 epoch: 7, train_loss: 1.0957, test_loss: 1.0392, test_f1: 0.4484
 epoch: 8, train_loss: 1.0713, test_loss: 1.0289, test_f1: 0.4623
 epoch: 9, train_loss: 1.0622, test_loss: 1.0214, test_f1: 0.4530
 epoch: 10, train_loss: 1.0501, test_loss: 1.0110, test_f1: 0.4742
 epoch: 11, train_loss: 1.0476, test_loss: 1.0040, test_f1: 0.4676
 epoch: 12, train_loss: 1.0371, test_loss: 1.0054, test_f1: 0.4812
 epoch: 13, train_loss: 1.0198, test_loss: 1.0050, test_f1: 0.4765
 epoch: 14, train_loss: 1.0172, test_loss: 0.9945, test_f1: 0.4797
 epoch: 15, train_loss: 0.9956, test_loss: 0.9865, test_f1: 0.4787
 epoch: 16, train_loss: 0.9978, test_loss: 0.9850, test_f1: 0.4842
 epoch: 17, train_loss: 0.9872, test_loss: 0.9853, test_f1: 0.4792
 epoch: 18, train_loss: 0.9845, test_loss: 0.9853, test_f1: 0.4830
 epoch: 19, train_loss: 0.9691, test_loss: 0.9840, test_f1: 0.4911
 epoch: 20, train_loss: 0.9703, test_loss: 0.9698, test_f1: 0.4891
 epoch: 21, train_loss: 0.9699, test_loss: 0.9758, test_f1: 0.4917
 epoch: 22, train_loss: 0.9713, test_loss: 0.9672, test_f1: 0.4958
 epoch: 23, train_loss: 0.9670, test_loss: 0.9724, test_f1: 0.4947
 epoch: 24, train_loss: 0.9547, test_loss: 0.9708, test_f1: 0.4923
 epoch: 25, train_loss: 0.9495, test_loss: 0.9726, test_f1: 0.5034
 epoch: 26, train_loss: 0.9452, test_loss: 0.9575, test_f1: 0.4991
 epoch: 27, train_loss: 0.9481, test_loss: 0.9675, test_f1: 0.5091
 epoch: 28, train_loss: 0.9501, test_loss: 0.9578, test_f1: 0.5026
 epoch: 29, train_loss: 0.9264, test_loss: 0.9514, test_f1: 0.5077
 epoch: 30, train_loss: 0.9335, test_loss: 0.9463, test_f1: 0.5168
 epoch: 31, train_loss: 0.9196, test_loss: 0.9445, test_f1: 0.5044
 epoch: 32, train_loss: 0.9297, test_loss: 0.9480, test_f1: 0.5106
 epoch: 33, train_loss: 0.9191, test_loss: 0.9479, test_f1: 0.5127
 epoch: 34, train_loss: 0.9142, test_loss: 0.9445, test_f1: 0.5106
 epoch: 35, train_loss: 0.9156, test_loss: 0.9470, test_f1: 0.5168
 epoch: 36, train_loss: 0.9047, test_loss: 0.9471, test_f1: 0.5187
 epoch: 37, train_loss: 0.9052, test_loss: 0.9392, test_f1: 0.5160
 epoch: 38, train_loss: 0.8957, test_loss: 0.9506, test_f1: 0.5218
 epoch: 39, train_loss: 0.8955, test_loss: 0.9356, test_f1: 0.5361
 epoch: 40, train_loss: 0.8959, test_loss: 0.9331, test_f1: 0.5290
 epoch: 41, train_loss: 0.8964, test_loss: 0.9419, test_f1: 0.5308
 epoch: 42, train_loss: 0.8906, test_loss: 0.9386, test_f1: 0.5420
 epoch: 43, train_loss: 0.8869, test_loss: 0.9282, test_f1: 0.5369
 epoch: 44, train_loss: 0.8835, test_loss: 0.9278, test_f1: 0.5363
 epoch: 45, train_loss: 0.8805, test_loss: 0.9368, test_f1: 0.5223
 epoch: 46, train_loss: 0.8781, test_loss: 0.9227, test_f1: 0.5358
 epoch: 47, train_loss: 0.8692, test_loss: 0.9404, test_f1: 0.5356
 epoch: 48, train_loss: 0.8734, test_loss: 0.9269, test_f1: 0.5421
 epoch: 49, train_loss: 0.8580, test_loss: 0.9231, test_f1: 0.5418
 epoch: 50, train_loss: 0.8638, test_loss: 0.9198, test_f1: 0.5486
 epoch: 51, train_loss: 0.8616, test_loss: 0.9253, test_f1: 0.5424
 epoch: 52, train_loss: 0.8626, test_loss: 0.9304, test_f1: 0.5441
 epoch: 53, train_loss: 0.8584, test_loss: 0.9226, test_f1: 0.5439
 epoch: 54, train_loss: 0.8509, test_loss: 0.9216, test_f1: 0.5418
 epoch: 55, train_loss: 0.8609, test_loss: 0.9239, test_f1: 0.5410
 epoch: 56, train_loss: 0.8539, test_loss: 0.9279, test_f1: 0.5421
 epoch: 57, train_loss: 0.8525, test_loss: 0.9267, test_f1: 0.5477
 epoch: 58, train_loss: 0.8541, test_loss: 0.9252, test_f1: 0.5437
 epoch: 59, train_loss: 0.8483, test_loss: 0.9224, test_f1: 0.5477
 epoch: 60, train_loss: 0.8441, test_loss: 0.9205, test_f1: 0.5433
 epoch: 61, train_loss: 0.8443, test_loss: 0.9200, test_f1: 0.5464
 epoch: 62, train_loss: 0.8501, test_loss: 0.9206, test_f1: 0.5454
 epoch: 63, train_loss: 0.8466, test_loss: 0.9220, test_f1: 0.5464
 epoch: 64, train_loss: 0.8416, test_loss: 0.9221, test_f1: 0.5439
 epoch: 65, train_loss: 0.8349, test_loss: 0.9272, test_f1: 0.5433
 epoch: 66, train_loss: 0.8393, test_loss: 0.9265, test_f1: 0.5425
 epoch: 67, train_loss: 0.8416, test_loss: 0.9228, test_f1: 0.5421
 epoch: 68, train_loss: 0.8345, test_loss: 0.9262, test_f1: 0.5466
 epoch: 69, train_loss: 0.8344, test_loss: 0.9359, test_f1: 0.5300
 epoch: 70, train_loss: 0.8371, test_loss: 0.9243, test_f1: 0.5340
 epoch: 71, train_loss: 0.8319, test_loss: 0.9195, test_f1: 0.5508
 epoch: 72, train_loss: 0.8293, test_loss: 0.9227, test_f1: 0.5465
 epoch: 73, train_loss: 0.8286, test_loss: 0.9290, test_f1: 0.5342
 epoch: 74, train_loss: 0.8344, test_loss: 0.9364, test_f1: 0.5413
 epoch: 75, train_loss: 0.8245, test_loss: 0.9291, test_f1: 0.5311
 epoch: 76, train_loss: 0.8258, test_loss: 0.9330, test_f1: 0.5468
 epoch: 77, train_loss: 0.8270, test_loss: 0.9284, test_f1: 0.5409
 epoch: 78, train_loss: 0.8263, test_loss: 0.9265, test_f1: 0.5481
 epoch: 79, train_loss: 0.8241, test_loss: 0.9197, test_f1: 0.5487
 epoch: 80, train_loss: 0.8269, test_loss: 0.9286, test_f1: 0.5408
 epoch: 81, train_loss: 0.8225, test_loss: 0.9284, test_f1: 0.5315
 epoch: 82, train_loss: 0.8217, test_loss: 0.9316, test_f1: 0.5367
 epoch: 83, train_loss: 0.8145, test_loss: 0.9254, test_f1: 0.5384
 epoch: 84, train_loss: 0.8190, test_loss: 0.9257, test_f1: 0.5388
 epoch: 85, train_loss: 0.8183, test_loss: 0.9344, test_f1: 0.5356
 epoch: 86, train_loss: 0.8150, test_loss: 0.9324, test_f1: 0.5454
 epoch: 87, train_loss: 0.8197, test_loss: 0.9419, test_f1: 0.5392
 epoch: 88, train_loss: 0.8064, test_loss: 0.9308, test_f1: 0.5400
 epoch: 89, train_loss: 0.8082, test_loss: 0.9238, test_f1: 0.5390
 epoch: 90, train_loss: 0.8221, test_loss: 0.9250, test_f1: 0.5388
 epoch: 91, train_loss: 0.8174, test_loss: 0.9347, test_f1: 0.5421
 epoch: 92, train_loss: 0.8143, test_loss: 0.9363, test_f1: 0.5346
 epoch: 93, train_loss: 0.8090, test_loss: 0.9239, test_f1: 0.5430
 epoch: 94, train_loss: 0.8006, test_loss: 0.9268, test_f1: 0.5458
 epoch: 95, train_loss: 0.8078, test_loss: 0.9370, test_f1: 0.5486
 epoch: 96, train_loss: 0.8009, test_loss: 0.9252, test_f1: 0.5464
 epoch: 97, train_loss: 0.8060, test_loss: 0.9249, test_f1: 0.5513
 epoch: 98, train_loss: 0.8055, test_loss: 0.9224, test_f1: 0.5415
 epoch: 99, train_loss: 0.8102, test_loss: 0.9359, test_f1: 0.5369
##################ITERATION #8 ****************************************
 epoch: 0, train_loss: 1.3233, test_loss: 1.2674, test_f1: 0.2270
 epoch: 1, train_loss: 1.2034, test_loss: 1.1540, test_f1: 0.3375
 epoch: 2, train_loss: 1.1732, test_loss: 1.1018, test_f1: 0.4042
 epoch: 3, train_loss: 1.1516, test_loss: 1.0689, test_f1: 0.4173
 epoch: 4, train_loss: 1.1255, test_loss: 1.0530, test_f1: 0.4188
 epoch: 5, train_loss: 1.0983, test_loss: 1.0379, test_f1: 0.4459
 epoch: 6, train_loss: 1.0880, test_loss: 1.0271, test_f1: 0.4638
 epoch: 7, train_loss: 1.0844, test_loss: 1.0136, test_f1: 0.4577
 epoch: 8, train_loss: 1.0606, test_loss: 1.0115, test_f1: 0.4610
 epoch: 9, train_loss: 1.0500, test_loss: 1.0007, test_f1: 0.4666
 epoch: 10, train_loss: 1.0367, test_loss: 0.9904, test_f1: 0.4809
 epoch: 11, train_loss: 1.0293, test_loss: 0.9881, test_f1: 0.4743
 epoch: 12, train_loss: 1.0213, test_loss: 0.9875, test_f1: 0.4751
 epoch: 13, train_loss: 1.0142, test_loss: 0.9818, test_f1: 0.4816
 epoch: 14, train_loss: 1.0091, test_loss: 0.9759, test_f1: 0.4726
 epoch: 15, train_loss: 0.9985, test_loss: 0.9899, test_f1: 0.4729
 epoch: 16, train_loss: 0.9884, test_loss: 0.9766, test_f1: 0.4780
 epoch: 17, train_loss: 0.9902, test_loss: 0.9711, test_f1: 0.4937
 epoch: 18, train_loss: 0.9764, test_loss: 0.9709, test_f1: 0.4892
 epoch: 19, train_loss: 0.9801, test_loss: 0.9654, test_f1: 0.4832
 epoch: 20, train_loss: 0.9710, test_loss: 0.9669, test_f1: 0.4905
 epoch: 21, train_loss: 0.9674, test_loss: 0.9651, test_f1: 0.4919
 epoch: 22, train_loss: 0.9598, test_loss: 0.9656, test_f1: 0.5000
 epoch: 23, train_loss: 0.9714, test_loss: 0.9655, test_f1: 0.4929
 epoch: 24, train_loss: 0.9485, test_loss: 0.9642, test_f1: 0.5033
 epoch: 25, train_loss: 0.9517, test_loss: 0.9547, test_f1: 0.5058
 epoch: 26, train_loss: 0.9544, test_loss: 0.9580, test_f1: 0.4949
 epoch: 27, train_loss: 0.9469, test_loss: 0.9558, test_f1: 0.4963
 epoch: 28, train_loss: 0.9404, test_loss: 0.9566, test_f1: 0.5070
 epoch: 29, train_loss: 0.9301, test_loss: 0.9644, test_f1: 0.4982
 epoch: 30, train_loss: 0.9402, test_loss: 0.9493, test_f1: 0.4955
 epoch: 31, train_loss: 0.9347, test_loss: 0.9478, test_f1: 0.5092
 epoch: 32, train_loss: 0.9256, test_loss: 0.9429, test_f1: 0.5036
 epoch: 33, train_loss: 0.9353, test_loss: 0.9453, test_f1: 0.5011
 epoch: 34, train_loss: 0.9224, test_loss: 0.9461, test_f1: 0.5043
 epoch: 35, train_loss: 0.9134, test_loss: 0.9544, test_f1: 0.5006
 epoch: 36, train_loss: 0.9155, test_loss: 0.9457, test_f1: 0.5081
 epoch: 37, train_loss: 0.9144, test_loss: 0.9443, test_f1: 0.5172
 epoch: 38, train_loss: 0.9000, test_loss: 0.9341, test_f1: 0.5173
 epoch: 39, train_loss: 0.9093, test_loss: 0.9507, test_f1: 0.5246
 epoch: 40, train_loss: 0.9027, test_loss: 0.9474, test_f1: 0.5266
 epoch: 41, train_loss: 0.9037, test_loss: 0.9370, test_f1: 0.5271
 epoch: 42, train_loss: 0.8965, test_loss: 0.9492, test_f1: 0.5075
 epoch: 43, train_loss: 0.8915, test_loss: 0.9470, test_f1: 0.5144
 epoch: 44, train_loss: 0.8898, test_loss: 0.9400, test_f1: 0.5190
 epoch: 45, train_loss: 0.8951, test_loss: 0.9313, test_f1: 0.5150
 epoch: 46, train_loss: 0.8873, test_loss: 0.9350, test_f1: 0.5206
 epoch: 47, train_loss: 0.8853, test_loss: 0.9301, test_f1: 0.5361
 epoch: 48, train_loss: 0.8868, test_loss: 0.9272, test_f1: 0.5206
 epoch: 49, train_loss: 0.8779, test_loss: 0.9457, test_f1: 0.5305
 epoch: 50, train_loss: 0.8838, test_loss: 0.9249, test_f1: 0.5433
 epoch: 51, train_loss: 0.8752, test_loss: 0.9256, test_f1: 0.5247
 epoch: 52, train_loss: 0.8769, test_loss: 0.9324, test_f1: 0.5351
 epoch: 53, train_loss: 0.8658, test_loss: 0.9358, test_f1: 0.5382
 epoch: 54, train_loss: 0.8651, test_loss: 0.9382, test_f1: 0.5313
 epoch: 55, train_loss: 0.8622, test_loss: 0.9354, test_f1: 0.5371
 epoch: 56, train_loss: 0.8745, test_loss: 0.9352, test_f1: 0.5397
 epoch: 57, train_loss: 0.8687, test_loss: 0.9441, test_f1: 0.5372
 epoch: 58, train_loss: 0.8616, test_loss: 0.9399, test_f1: 0.5369
 epoch: 59, train_loss: 0.8616, test_loss: 0.9301, test_f1: 0.5343
 epoch: 60, train_loss: 0.8735, test_loss: 0.9343, test_f1: 0.5295
 epoch: 61, train_loss: 0.8633, test_loss: 0.9352, test_f1: 0.5314
 epoch: 62, train_loss: 0.8574, test_loss: 0.9349, test_f1: 0.5313
 epoch: 63, train_loss: 0.8669, test_loss: 0.9260, test_f1: 0.5339
 epoch: 64, train_loss: 0.8587, test_loss: 0.9408, test_f1: 0.5441
 epoch: 65, train_loss: 0.8621, test_loss: 0.9371, test_f1: 0.5410
 epoch: 66, train_loss: 0.8570, test_loss: 0.9373, test_f1: 0.5372
 epoch: 67, train_loss: 0.8554, test_loss: 0.9395, test_f1: 0.5333
 epoch: 68, train_loss: 0.8526, test_loss: 0.9280, test_f1: 0.5467
 epoch: 69, train_loss: 0.8662, test_loss: 0.9271, test_f1: 0.5382
 epoch: 70, train_loss: 0.8547, test_loss: 0.9467, test_f1: 0.5399
 epoch: 71, train_loss: 0.8551, test_loss: 0.9291, test_f1: 0.5374
 epoch: 72, train_loss: 0.8502, test_loss: 0.9305, test_f1: 0.5469
 epoch: 73, train_loss: 0.8515, test_loss: 0.9434, test_f1: 0.5338
 epoch: 74, train_loss: 0.8481, test_loss: 0.9336, test_f1: 0.5444
 epoch: 75, train_loss: 0.8441, test_loss: 0.9219, test_f1: 0.5375
 epoch: 76, train_loss: 0.8461, test_loss: 0.9254, test_f1: 0.5482
 epoch: 77, train_loss: 0.8459, test_loss: 0.9366, test_f1: 0.5466
 epoch: 78, train_loss: 0.8399, test_loss: 0.9477, test_f1: 0.5332
 epoch: 79, train_loss: 0.8399, test_loss: 0.9379, test_f1: 0.5433
 epoch: 80, train_loss: 0.8419, test_loss: 0.9375, test_f1: 0.5416
 epoch: 81, train_loss: 0.8396, test_loss: 0.9443, test_f1: 0.5332
 epoch: 82, train_loss: 0.8442, test_loss: 0.9330, test_f1: 0.5397
 epoch: 83, train_loss: 0.8425, test_loss: 0.9397, test_f1: 0.5376
 epoch: 84, train_loss: 0.8402, test_loss: 0.9377, test_f1: 0.5392
 epoch: 85, train_loss: 0.8463, test_loss: 0.9315, test_f1: 0.5457
 epoch: 86, train_loss: 0.8429, test_loss: 0.9231, test_f1: 0.5539
 epoch: 87, train_loss: 0.8325, test_loss: 0.9322, test_f1: 0.5493
 epoch: 88, train_loss: 0.8348, test_loss: 0.9243, test_f1: 0.5452
 epoch: 89, train_loss: 0.8345, test_loss: 0.9446, test_f1: 0.5516
 epoch: 90, train_loss: 0.8286, test_loss: 0.9289, test_f1: 0.5356
 epoch: 91, train_loss: 0.8336, test_loss: 0.9323, test_f1: 0.5354
 epoch: 92, train_loss: 0.8347, test_loss: 0.9303, test_f1: 0.5548
 epoch: 93, train_loss: 0.8257, test_loss: 0.9403, test_f1: 0.5431
 epoch: 94, train_loss: 0.8315, test_loss: 0.9320, test_f1: 0.5402
 epoch: 95, train_loss: 0.8320, test_loss: 0.9458, test_f1: 0.5393
 epoch: 96, train_loss: 0.8234, test_loss: 0.9372, test_f1: 0.5455
 epoch: 97, train_loss: 0.8346, test_loss: 0.9404, test_f1: 0.5401
 epoch: 98, train_loss: 0.8274, test_loss: 0.9384, test_f1: 0.5350
 epoch: 99, train_loss: 0.8277, test_loss: 0.9265, test_f1: 0.5478
##################ITERATION #9 ****************************************
 epoch: 0, train_loss: 1.2774, test_loss: 1.2549, test_f1: 0.2270
 epoch: 1, train_loss: 1.1880, test_loss: 1.1680, test_f1: 0.3485
 epoch: 2, train_loss: 1.1638, test_loss: 1.1113, test_f1: 0.3999
 epoch: 3, train_loss: 1.1384, test_loss: 1.0811, test_f1: 0.4186
 epoch: 4, train_loss: 1.1196, test_loss: 1.0586, test_f1: 0.4222
 epoch: 5, train_loss: 1.0954, test_loss: 1.0470, test_f1: 0.4302
 epoch: 6, train_loss: 1.0806, test_loss: 1.0392, test_f1: 0.4285
 epoch: 7, train_loss: 1.0626, test_loss: 1.0253, test_f1: 0.4401
 epoch: 8, train_loss: 1.0571, test_loss: 1.0144, test_f1: 0.4378
 epoch: 9, train_loss: 1.0445, test_loss: 1.0084, test_f1: 0.4435
 epoch: 10, train_loss: 1.0331, test_loss: 1.0021, test_f1: 0.4606
 epoch: 11, train_loss: 1.0228, test_loss: 0.9954, test_f1: 0.4475
 epoch: 12, train_loss: 1.0152, test_loss: 0.9967, test_f1: 0.4659
 epoch: 13, train_loss: 1.0000, test_loss: 0.9890, test_f1: 0.4582
 epoch: 14, train_loss: 0.9957, test_loss: 0.9811, test_f1: 0.4615
 epoch: 15, train_loss: 0.9802, test_loss: 0.9803, test_f1: 0.4609
 epoch: 16, train_loss: 0.9858, test_loss: 0.9752, test_f1: 0.4723
 epoch: 17, train_loss: 0.9836, test_loss: 0.9665, test_f1: 0.4742
 epoch: 18, train_loss: 0.9689, test_loss: 0.9685, test_f1: 0.4699
 epoch: 19, train_loss: 0.9598, test_loss: 0.9622, test_f1: 0.4619
 epoch: 20, train_loss: 0.9616, test_loss: 0.9578, test_f1: 0.4874
 epoch: 21, train_loss: 0.9505, test_loss: 0.9549, test_f1: 0.4766
 epoch: 22, train_loss: 0.9546, test_loss: 0.9514, test_f1: 0.4866
 epoch: 23, train_loss: 0.9535, test_loss: 0.9495, test_f1: 0.4885
 epoch: 24, train_loss: 0.9416, test_loss: 0.9521, test_f1: 0.4846
 epoch: 25, train_loss: 0.9358, test_loss: 0.9419, test_f1: 0.4945
 epoch: 26, train_loss: 0.9445, test_loss: 0.9363, test_f1: 0.4971
 epoch: 27, train_loss: 0.9329, test_loss: 0.9448, test_f1: 0.4993
 epoch: 28, train_loss: 0.9301, test_loss: 0.9399, test_f1: 0.5020
 epoch: 29, train_loss: 0.9256, test_loss: 0.9340, test_f1: 0.5068
 epoch: 30, train_loss: 0.9249, test_loss: 0.9333, test_f1: 0.5009
 epoch: 31, train_loss: 0.9177, test_loss: 0.9257, test_f1: 0.5090
 epoch: 32, train_loss: 0.9177, test_loss: 0.9329, test_f1: 0.5045
 epoch: 33, train_loss: 0.9101, test_loss: 0.9225, test_f1: 0.5092
 epoch: 34, train_loss: 0.9128, test_loss: 0.9260, test_f1: 0.5112
 epoch: 35, train_loss: 0.9142, test_loss: 0.9188, test_f1: 0.5101
 epoch: 36, train_loss: 0.9074, test_loss: 0.9252, test_f1: 0.5035
 epoch: 37, train_loss: 0.9021, test_loss: 0.9230, test_f1: 0.5125
 epoch: 38, train_loss: 0.9066, test_loss: 0.9171, test_f1: 0.5129
 epoch: 39, train_loss: 0.8938, test_loss: 0.9173, test_f1: 0.5132
 epoch: 40, train_loss: 0.8960, test_loss: 0.9137, test_f1: 0.5140
 epoch: 41, train_loss: 0.8981, test_loss: 0.9129, test_f1: 0.5168
 epoch: 42, train_loss: 0.8883, test_loss: 0.9090, test_f1: 0.5202
 epoch: 43, train_loss: 0.8825, test_loss: 0.9112, test_f1: 0.5064
 epoch: 44, train_loss: 0.8857, test_loss: 0.9203, test_f1: 0.5141
 epoch: 45, train_loss: 0.8853, test_loss: 0.9071, test_f1: 0.5212
 epoch: 46, train_loss: 0.8743, test_loss: 0.9062, test_f1: 0.5201
 epoch: 47, train_loss: 0.8742, test_loss: 0.9078, test_f1: 0.5243
 epoch: 48, train_loss: 0.8694, test_loss: 0.9073, test_f1: 0.5276
 epoch: 49, train_loss: 0.8743, test_loss: 0.8958, test_f1: 0.5313
 epoch: 50, train_loss: 0.8652, test_loss: 0.9073, test_f1: 0.5235
 epoch: 51, train_loss: 0.8583, test_loss: 0.9059, test_f1: 0.5306
 epoch: 52, train_loss: 0.8693, test_loss: 0.9033, test_f1: 0.5258
 epoch: 53, train_loss: 0.8640, test_loss: 0.9061, test_f1: 0.5270
 epoch: 54, train_loss: 0.8661, test_loss: 0.9068, test_f1: 0.5260
 epoch: 55, train_loss: 0.8636, test_loss: 0.9001, test_f1: 0.5279
 epoch: 56, train_loss: 0.8623, test_loss: 0.9018, test_f1: 0.5330
 epoch: 57, train_loss: 0.8607, test_loss: 0.9043, test_f1: 0.5295
 epoch: 58, train_loss: 0.8560, test_loss: 0.9030, test_f1: 0.5308
 epoch: 59, train_loss: 0.8525, test_loss: 0.8970, test_f1: 0.5296
 epoch: 60, train_loss: 0.8502, test_loss: 0.8936, test_f1: 0.5342
 epoch: 61, train_loss: 0.8526, test_loss: 0.8953, test_f1: 0.5347
 epoch: 62, train_loss: 0.8580, test_loss: 0.8993, test_f1: 0.5343
 epoch: 63, train_loss: 0.8486, test_loss: 0.8950, test_f1: 0.5412
 epoch: 64, train_loss: 0.8438, test_loss: 0.8974, test_f1: 0.5332
 epoch: 65, train_loss: 0.8438, test_loss: 0.8995, test_f1: 0.5333
 epoch: 66, train_loss: 0.8453, test_loss: 0.9001, test_f1: 0.5354
 epoch: 67, train_loss: 0.8477, test_loss: 0.8972, test_f1: 0.5331
 epoch: 68, train_loss: 0.8493, test_loss: 0.8970, test_f1: 0.5374
 epoch: 69, train_loss: 0.8465, test_loss: 0.8939, test_f1: 0.5340
 epoch: 70, train_loss: 0.8352, test_loss: 0.8981, test_f1: 0.5338
 epoch: 71, train_loss: 0.8378, test_loss: 0.9004, test_f1: 0.5347
 epoch: 72, train_loss: 0.8432, test_loss: 0.8995, test_f1: 0.5335
 epoch: 73, train_loss: 0.8378, test_loss: 0.8996, test_f1: 0.5333
 epoch: 74, train_loss: 0.8404, test_loss: 0.8991, test_f1: 0.5389
 epoch: 75, train_loss: 0.8404, test_loss: 0.8971, test_f1: 0.5348
 epoch: 76, train_loss: 0.8423, test_loss: 0.9010, test_f1: 0.5406
 epoch: 77, train_loss: 0.8428, test_loss: 0.8973, test_f1: 0.5320
 epoch: 78, train_loss: 0.8324, test_loss: 0.8933, test_f1: 0.5356
 epoch: 79, train_loss: 0.8269, test_loss: 0.8907, test_f1: 0.5336
 epoch: 80, train_loss: 0.8348, test_loss: 0.8973, test_f1: 0.5397
 epoch: 81, train_loss: 0.8318, test_loss: 0.8942, test_f1: 0.5330
 epoch: 82, train_loss: 0.8295, test_loss: 0.9004, test_f1: 0.5400
 epoch: 83, train_loss: 0.8300, test_loss: 0.8948, test_f1: 0.5396
 epoch: 84, train_loss: 0.8270, test_loss: 0.9007, test_f1: 0.5342
 epoch: 85, train_loss: 0.8273, test_loss: 0.8975, test_f1: 0.5362
 epoch: 86, train_loss: 0.8247, test_loss: 0.8907, test_f1: 0.5418
 epoch: 87, train_loss: 0.8237, test_loss: 0.8970, test_f1: 0.5363
 epoch: 88, train_loss: 0.8164, test_loss: 0.8899, test_f1: 0.5380
 epoch: 89, train_loss: 0.8287, test_loss: 0.9055, test_f1: 0.5344
 epoch: 90, train_loss: 0.8213, test_loss: 0.8980, test_f1: 0.5221
 epoch: 91, train_loss: 0.8203, test_loss: 0.8972, test_f1: 0.5386
 epoch: 92, train_loss: 0.8142, test_loss: 0.8999, test_f1: 0.5211
 epoch: 93, train_loss: 0.8168, test_loss: 0.8993, test_f1: 0.5204
 epoch: 94, train_loss: 0.8151, test_loss: 0.8930, test_f1: 0.5222
 epoch: 95, train_loss: 0.8151, test_loss: 0.8981, test_f1: 0.5313
 epoch: 96, train_loss: 0.8134, test_loss: 0.9013, test_f1: 0.5207
 epoch: 97, train_loss: 0.8131, test_loss: 0.8952, test_f1: 0.5381
 epoch: 98, train_loss: 0.8106, test_loss: 0.9057, test_f1: 0.5513
 epoch: 99, train_loss: 0.8068, test_loss: 0.9051, test_f1: 0.5431

Training completed in 591.05 seconds
Best F1: 0.5721 at epoch 94
Mean F1 across iterations: 0.5527  0.0100
========================FINAL RESULTS================================
FEGIN weighted F1: 0.5721  0.0100
python main.py --data ltspice_examples --representation component_net --model FEGIN --layers 2 --hiddens 64 --batch_size 128 --lr 0.0001 --emb_size 512 --epochs 100 --save_appendix component_net_L2_H64_BS128_LR0.0001_E512 --no_val
-----



STDERR:
  File "main.py", line 370, in <module>
    main()
  File "main.py", line 254, in main
    dataset = dataset_class(
  File "/home/philip/projects/llm_inference_code_repo/Circuit-Completion-Using-GNNs/component_classification_with_link_prediction_head/evaluation/FEGIN/kernel/circuit_datasets.py", line 15, in __init__
    self.data, self.slices = torch.load(self.processed_paths[0])
  File "/home/philip/.local/lib/python3.8/site-packages/torch/serialization.py", line 1040, in load
    warnings.warn(
  File "/usr/lib/python3.8/warnings.py", line 109, in _showwarnmsg
    sw(msg.message, msg.category, msg.filename, msg.lineno,
  File "main.py", line 47, in warn_with_traceback
    traceback.print_stack(file=log)
/home/philip/projects/llm_inference_code_repo/Circuit-Completion-Using-GNNs/component_classification_with_link_prediction_head/evaluation/FEGIN/kernel/circuit_datasets.py:15: FutureWarning: You are using `torch.load` with `weights_only=False` (the current default value), which uses the default pickle module implicitly. It is possible to construct malicious pickle data which will execute arbitrary code during unpickling (See https://github.com/pytorch/pytorch/blob/main/SECURITY.md#untrusted-models for more details). In a future release, the default value for `weights_only` will be flipped to `True`. This limits the functions that could be executed during unpickling. Arbitrary objects will no longer be allowed to be loaded via this mode unless they are explicitly allowlisted by the user via `torch.serialization.add_safe_globals`. We recommend you start setting `weights_only=True` for any use case where you don't have full control of the loaded file. Please open an issue on GitHub for any issues related to this experimental feature.
  self.data, self.slices = torch.load(self.processed_paths[0])
