STDOUT:
Results will be saved in /home/philip/projects/ltspice_examples_code_repo/Circuit-Completion-Using-GNNs/component_classification_with_link_prediction_head/evaluation/FEGIN/results/model_FEGIN_dataset_ltspice_demos
Command line input: python main.py --data ltspice_demos --representation component_net --model FEGIN --layers 5 --hiddens 128 --batch_size 64 --lr 0.0001 --emb_size 128 --epochs 100 --save_appendix component_net_L5_H128_BS64_LR0.0001_E128 --no_val
 is saved.
-----
ltspice_demos - FEGIN
Using 5 layers, 128 hidden units, h = 2
Loading component_net representation dataset
ENTERED
Training FEGIN on component_net representation
Train: 1565, Test: 383
##################ITERATION #0 ****************************************
 epoch: 0, train_loss: 1.3518, test_loss: 1.3654, test_f1: 0.2281
 epoch: 1, train_loss: 1.3019, test_loss: 1.3428, test_f1: 0.2281
 epoch: 2, train_loss: 1.2524, test_loss: 1.2747, test_f1: 0.2835
 epoch: 3, train_loss: 1.2006, test_loss: 1.2234, test_f1: 0.2734
 epoch: 4, train_loss: 1.1628, test_loss: 1.1980, test_f1: 0.2928
 epoch: 5, train_loss: 1.1357, test_loss: 1.1878, test_f1: 0.3164
 epoch: 6, train_loss: 1.1230, test_loss: 1.1816, test_f1: 0.3237
 epoch: 7, train_loss: 1.1059, test_loss: 1.1604, test_f1: 0.3304
 epoch: 8, train_loss: 1.1000, test_loss: 1.1484, test_f1: 0.3312
 epoch: 9, train_loss: 1.0810, test_loss: 1.1396, test_f1: 0.3747
 epoch: 10, train_loss: 1.0676, test_loss: 1.1254, test_f1: 0.4103
 epoch: 11, train_loss: 1.0568, test_loss: 1.1083, test_f1: 0.4874
 epoch: 12, train_loss: 1.0372, test_loss: 1.0883, test_f1: 0.4972
 epoch: 13, train_loss: 1.0227, test_loss: 1.0569, test_f1: 0.5226
 epoch: 14, train_loss: 1.0058, test_loss: 1.0836, test_f1: 0.5305
 epoch: 15, train_loss: 0.9810, test_loss: 1.0403, test_f1: 0.5170
 epoch: 16, train_loss: 0.9675, test_loss: 1.0183, test_f1: 0.5435
 epoch: 17, train_loss: 0.9521, test_loss: 1.0271, test_f1: 0.5384
 epoch: 18, train_loss: 0.9252, test_loss: 1.0603, test_f1: 0.5584
 epoch: 19, train_loss: 0.9163, test_loss: 1.0226, test_f1: 0.5475
 epoch: 20, train_loss: 0.8992, test_loss: 1.0047, test_f1: 0.5781
 epoch: 21, train_loss: 0.8865, test_loss: 0.9915, test_f1: 0.5632
 epoch: 22, train_loss: 0.8690, test_loss: 1.0323, test_f1: 0.5586
 epoch: 23, train_loss: 0.8573, test_loss: 1.0182, test_f1: 0.5502
 epoch: 24, train_loss: 0.8379, test_loss: 1.0599, test_f1: 0.5776
 epoch: 25, train_loss: 0.8301, test_loss: 1.0335, test_f1: 0.5378
 epoch: 26, train_loss: 0.8170, test_loss: 1.0401, test_f1: 0.5469
 epoch: 27, train_loss: 0.8138, test_loss: 1.0280, test_f1: 0.5445
 epoch: 28, train_loss: 0.8084, test_loss: 1.0175, test_f1: 0.5573
 epoch: 29, train_loss: 0.7874, test_loss: 1.0548, test_f1: 0.5432
 epoch: 30, train_loss: 0.7844, test_loss: 1.1086, test_f1: 0.5524
 epoch: 31, train_loss: 0.7682, test_loss: 1.0470, test_f1: 0.5579
 epoch: 32, train_loss: 0.7567, test_loss: 1.0713, test_f1: 0.5624
 epoch: 33, train_loss: 0.7636, test_loss: 1.0772, test_f1: 0.5635
 epoch: 34, train_loss: 0.7524, test_loss: 1.0670, test_f1: 0.5551
 epoch: 35, train_loss: 0.7360, test_loss: 1.0933, test_f1: 0.5596
 epoch: 36, train_loss: 0.7384, test_loss: 1.1737, test_f1: 0.5380
 epoch: 37, train_loss: 0.7280, test_loss: 1.1424, test_f1: 0.5520
 epoch: 38, train_loss: 0.7300, test_loss: 1.1505, test_f1: 0.5730
 epoch: 39, train_loss: 0.7228, test_loss: 1.1682, test_f1: 0.5239
 epoch: 40, train_loss: 0.7332, test_loss: 1.1972, test_f1: 0.5532
 epoch: 41, train_loss: 0.7116, test_loss: 1.1364, test_f1: 0.5634
 epoch: 42, train_loss: 0.6838, test_loss: 1.2035, test_f1: 0.5575
 epoch: 43, train_loss: 0.6962, test_loss: 1.1329, test_f1: 0.5478
 epoch: 44, train_loss: 0.6847, test_loss: 1.1863, test_f1: 0.5458
 epoch: 45, train_loss: 0.6938, test_loss: 1.2566, test_f1: 0.5447
 epoch: 46, train_loss: 0.6846, test_loss: 1.2245, test_f1: 0.5516
 epoch: 47, train_loss: 0.6874, test_loss: 1.2661, test_f1: 0.5474
 epoch: 48, train_loss: 0.6800, test_loss: 1.2236, test_f1: 0.5569
 epoch: 49, train_loss: 0.6521, test_loss: 1.2810, test_f1: 0.5641
 epoch: 50, train_loss: 0.6577, test_loss: 1.2837, test_f1: 0.5535
 epoch: 51, train_loss: 0.6419, test_loss: 1.2769, test_f1: 0.5531
 epoch: 52, train_loss: 0.6271, test_loss: 1.2592, test_f1: 0.5597
 epoch: 53, train_loss: 0.6263, test_loss: 1.2592, test_f1: 0.5712
 epoch: 54, train_loss: 0.6247, test_loss: 1.2780, test_f1: 0.5797
 epoch: 55, train_loss: 0.6176, test_loss: 1.2895, test_f1: 0.5660
 epoch: 56, train_loss: 0.6035, test_loss: 1.3132, test_f1: 0.5755
 epoch: 57, train_loss: 0.6203, test_loss: 1.3216, test_f1: 0.5690
 epoch: 58, train_loss: 0.6072, test_loss: 1.3212, test_f1: 0.5705
 epoch: 59, train_loss: 0.6083, test_loss: 1.3410, test_f1: 0.5721
 epoch: 60, train_loss: 0.5968, test_loss: 1.3511, test_f1: 0.5601
 epoch: 61, train_loss: 0.6100, test_loss: 1.3789, test_f1: 0.5649
 epoch: 62, train_loss: 0.6079, test_loss: 1.3958, test_f1: 0.5544
 epoch: 63, train_loss: 0.6018, test_loss: 1.3578, test_f1: 0.5795
 epoch: 64, train_loss: 0.5909, test_loss: 1.3640, test_f1: 0.5921
 epoch: 65, train_loss: 0.5982, test_loss: 1.3349, test_f1: 0.5993
 epoch: 66, train_loss: 0.5971, test_loss: 1.3992, test_f1: 0.5787
 epoch: 67, train_loss: 0.5696, test_loss: 1.4277, test_f1: 0.5599
 epoch: 68, train_loss: 0.5706, test_loss: 1.4127, test_f1: 0.5678
 epoch: 69, train_loss: 0.5701, test_loss: 1.4232, test_f1: 0.5730
 epoch: 70, train_loss: 0.5761, test_loss: 1.3505, test_f1: 0.5805
 epoch: 71, train_loss: 0.5795, test_loss: 1.4693, test_f1: 0.5737
 epoch: 72, train_loss: 0.5825, test_loss: 1.4216, test_f1: 0.5949
 epoch: 73, train_loss: 0.5508, test_loss: 1.4426, test_f1: 0.5807
 epoch: 74, train_loss: 0.5616, test_loss: 1.4590, test_f1: 0.5885
 epoch: 75, train_loss: 0.5619, test_loss: 1.4162, test_f1: 0.5944
 epoch: 76, train_loss: 0.5696, test_loss: 1.4768, test_f1: 0.5765
 epoch: 77, train_loss: 0.5622, test_loss: 1.4627, test_f1: 0.5879
 epoch: 78, train_loss: 0.5602, test_loss: 1.4979, test_f1: 0.5870
 epoch: 79, train_loss: 0.5500, test_loss: 1.5012, test_f1: 0.5787
 epoch: 80, train_loss: 0.5540, test_loss: 1.5177, test_f1: 0.5869
 epoch: 81, train_loss: 0.5383, test_loss: 1.4653, test_f1: 0.5891
 epoch: 82, train_loss: 0.5440, test_loss: 1.5510, test_f1: 0.5801
 epoch: 83, train_loss: 0.5318, test_loss: 1.5735, test_f1: 0.5842
 epoch: 84, train_loss: 0.5421, test_loss: 1.5217, test_f1: 0.5962
 epoch: 85, train_loss: 0.5260, test_loss: 1.5545, test_f1: 0.6033
 epoch: 86, train_loss: 0.5274, test_loss: 1.6159, test_f1: 0.6058
 epoch: 87, train_loss: 0.5218, test_loss: 1.5468, test_f1: 0.5716
 epoch: 88, train_loss: 0.5285, test_loss: 1.5405, test_f1: 0.5991
 epoch: 89, train_loss: 0.5284, test_loss: 1.5973, test_f1: 0.5684
 epoch: 90, train_loss: 0.5143, test_loss: 1.5306, test_f1: 0.6000
 epoch: 91, train_loss: 0.5329, test_loss: 1.5904, test_f1: 0.5914
 epoch: 92, train_loss: 0.5295, test_loss: 1.5853, test_f1: 0.5840
 epoch: 93, train_loss: 0.5093, test_loss: 1.6000, test_f1: 0.6095
 epoch: 94, train_loss: 0.5309, test_loss: 1.6011, test_f1: 0.5694
 epoch: 95, train_loss: 0.5105, test_loss: 1.6301, test_f1: 0.5845
 epoch: 96, train_loss: 0.5195, test_loss: 1.5886, test_f1: 0.5899
 epoch: 97, train_loss: 0.5077, test_loss: 1.6012, test_f1: 0.5913
 epoch: 98, train_loss: 0.5004, test_loss: 1.5822, test_f1: 0.5966
 epoch: 99, train_loss: 0.5018, test_loss: 1.5693, test_f1: 0.6059
##################ITERATION #1 ****************************************
 epoch: 0, train_loss: 1.2611, test_loss: 1.3361, test_f1: 0.2585
 epoch: 1, train_loss: 1.1610, test_loss: 1.2938, test_f1: 0.2821
 epoch: 2, train_loss: 1.1216, test_loss: 1.2117, test_f1: 0.3967
 epoch: 3, train_loss: 1.0888, test_loss: 1.1507, test_f1: 0.4614
 epoch: 4, train_loss: 1.0623, test_loss: 1.1137, test_f1: 0.4722
 epoch: 5, train_loss: 1.0319, test_loss: 1.0942, test_f1: 0.4878
 epoch: 6, train_loss: 1.0141, test_loss: 1.0821, test_f1: 0.5210
 epoch: 7, train_loss: 0.9969, test_loss: 1.0651, test_f1: 0.5456
 epoch: 8, train_loss: 0.9693, test_loss: 1.0551, test_f1: 0.5536
 epoch: 9, train_loss: 0.9514, test_loss: 1.0318, test_f1: 0.5560
 epoch: 10, train_loss: 0.9417, test_loss: 1.0161, test_f1: 0.5637
 epoch: 11, train_loss: 0.9198, test_loss: 1.0215, test_f1: 0.5554
 epoch: 12, train_loss: 0.8967, test_loss: 0.9939, test_f1: 0.5737
 epoch: 13, train_loss: 0.8954, test_loss: 0.9970, test_f1: 0.5701
 epoch: 14, train_loss: 0.8808, test_loss: 0.9905, test_f1: 0.5727
 epoch: 15, train_loss: 0.8633, test_loss: 1.0257, test_f1: 0.5523
 epoch: 16, train_loss: 0.8442, test_loss: 0.9843, test_f1: 0.5612
 epoch: 17, train_loss: 0.8400, test_loss: 1.0127, test_f1: 0.5540
 epoch: 18, train_loss: 0.8305, test_loss: 0.9516, test_f1: 0.5657
 epoch: 19, train_loss: 0.8128, test_loss: 1.0675, test_f1: 0.5647
 epoch: 20, train_loss: 0.8058, test_loss: 0.9929, test_f1: 0.5684
 epoch: 21, train_loss: 0.7847, test_loss: 1.0026, test_f1: 0.5803
 epoch: 22, train_loss: 0.7872, test_loss: 1.0162, test_f1: 0.5803
 epoch: 23, train_loss: 0.7849, test_loss: 1.0462, test_f1: 0.5703
 epoch: 24, train_loss: 0.7755, test_loss: 1.0847, test_f1: 0.5823
 epoch: 25, train_loss: 0.7674, test_loss: 1.0522, test_f1: 0.5821
 epoch: 26, train_loss: 0.7556, test_loss: 1.1188, test_f1: 0.5731
 epoch: 27, train_loss: 0.7463, test_loss: 1.0631, test_f1: 0.5962
 epoch: 28, train_loss: 0.7393, test_loss: 1.1579, test_f1: 0.5707
 epoch: 29, train_loss: 0.7352, test_loss: 1.1262, test_f1: 0.5721
 epoch: 30, train_loss: 0.7129, test_loss: 1.1052, test_f1: 0.5856
 epoch: 31, train_loss: 0.7137, test_loss: 1.0752, test_f1: 0.5934
 epoch: 32, train_loss: 0.7250, test_loss: 1.0964, test_f1: 0.5770
 epoch: 33, train_loss: 0.7067, test_loss: 1.0858, test_f1: 0.5754
 epoch: 34, train_loss: 0.7157, test_loss: 1.1979, test_f1: 0.5702
 epoch: 35, train_loss: 0.6962, test_loss: 1.1944, test_f1: 0.5829
 epoch: 36, train_loss: 0.6865, test_loss: 1.1849, test_f1: 0.5836
 epoch: 37, train_loss: 0.6832, test_loss: 1.2852, test_f1: 0.5584
 epoch: 38, train_loss: 0.6657, test_loss: 1.1960, test_f1: 0.5822
 epoch: 39, train_loss: 0.6509, test_loss: 1.2436, test_f1: 0.5805
 epoch: 40, train_loss: 0.6612, test_loss: 1.2500, test_f1: 0.5697
 epoch: 41, train_loss: 0.6554, test_loss: 1.2895, test_f1: 0.5918
 epoch: 42, train_loss: 0.6578, test_loss: 1.1904, test_f1: 0.5787
 epoch: 43, train_loss: 0.6469, test_loss: 1.2343, test_f1: 0.5800
 epoch: 44, train_loss: 0.6496, test_loss: 1.2953, test_f1: 0.5581
 epoch: 45, train_loss: 0.6129, test_loss: 1.2543, test_f1: 0.5864
 epoch: 46, train_loss: 0.6254, test_loss: 1.3433, test_f1: 0.5834
 epoch: 47, train_loss: 0.6264, test_loss: 1.2402, test_f1: 0.5897
 epoch: 48, train_loss: 0.6189, test_loss: 1.3071, test_f1: 0.5802
 epoch: 49, train_loss: 0.6052, test_loss: 1.3372, test_f1: 0.5855
 epoch: 50, train_loss: 0.5968, test_loss: 1.3291, test_f1: 0.6043
 epoch: 51, train_loss: 0.5961, test_loss: 1.3769, test_f1: 0.5827
 epoch: 52, train_loss: 0.5793, test_loss: 1.3418, test_f1: 0.5933
 epoch: 53, train_loss: 0.5682, test_loss: 1.4172, test_f1: 0.5774
 epoch: 54, train_loss: 0.5655, test_loss: 1.3414, test_f1: 0.5968
 epoch: 55, train_loss: 0.5748, test_loss: 1.4037, test_f1: 0.5843
 epoch: 56, train_loss: 0.5720, test_loss: 1.4183, test_f1: 0.5886
 epoch: 57, train_loss: 0.5678, test_loss: 1.4106, test_f1: 0.5841
 epoch: 58, train_loss: 0.5618, test_loss: 1.4577, test_f1: 0.5877
 epoch: 59, train_loss: 0.5562, test_loss: 1.4145, test_f1: 0.5856
 epoch: 60, train_loss: 0.5546, test_loss: 1.4605, test_f1: 0.5872
 epoch: 61, train_loss: 0.5465, test_loss: 1.4306, test_f1: 0.6123
 epoch: 62, train_loss: 0.5409, test_loss: 1.4992, test_f1: 0.6050
 epoch: 63, train_loss: 0.5428, test_loss: 1.4695, test_f1: 0.6046
 epoch: 64, train_loss: 0.5394, test_loss: 1.4967, test_f1: 0.6266
 epoch: 65, train_loss: 0.5191, test_loss: 1.5302, test_f1: 0.5844
 epoch: 66, train_loss: 0.5139, test_loss: 1.4919, test_f1: 0.6148
 epoch: 67, train_loss: 0.5200, test_loss: 1.4626, test_f1: 0.5976
 epoch: 68, train_loss: 0.5265, test_loss: 1.5434, test_f1: 0.5914
 epoch: 69, train_loss: 0.5218, test_loss: 1.5575, test_f1: 0.5885
 epoch: 70, train_loss: 0.5200, test_loss: 1.6045, test_f1: 0.5864
 epoch: 71, train_loss: 0.5132, test_loss: 1.4773, test_f1: 0.6072
 epoch: 72, train_loss: 0.5101, test_loss: 1.5439, test_f1: 0.5883
 epoch: 73, train_loss: 0.5038, test_loss: 1.5798, test_f1: 0.5917
 epoch: 74, train_loss: 0.5216, test_loss: 1.6179, test_f1: 0.5834
 epoch: 75, train_loss: 0.5028, test_loss: 1.6165, test_f1: 0.5662
 epoch: 76, train_loss: 0.5083, test_loss: 1.5829, test_f1: 0.5651
 epoch: 77, train_loss: 0.5009, test_loss: 1.6037, test_f1: 0.6012
 epoch: 78, train_loss: 0.4929, test_loss: 1.6285, test_f1: 0.5790
 epoch: 79, train_loss: 0.4909, test_loss: 1.5766, test_f1: 0.5865
 epoch: 80, train_loss: 0.4966, test_loss: 1.5845, test_f1: 0.5989
 epoch: 81, train_loss: 0.4917, test_loss: 1.6111, test_f1: 0.6019
 epoch: 82, train_loss: 0.4847, test_loss: 1.6601, test_f1: 0.5836
 epoch: 83, train_loss: 0.4828, test_loss: 1.6023, test_f1: 0.6061
 epoch: 84, train_loss: 0.4651, test_loss: 1.6257, test_f1: 0.5994
 epoch: 85, train_loss: 0.4748, test_loss: 1.6581, test_f1: 0.6018
 epoch: 86, train_loss: 0.4787, test_loss: 1.6681, test_f1: 0.5953
 epoch: 87, train_loss: 0.4786, test_loss: 1.7104, test_f1: 0.5857
 epoch: 88, train_loss: 0.4744, test_loss: 1.7128, test_f1: 0.6057
 epoch: 89, train_loss: 0.4660, test_loss: 1.6141, test_f1: 0.6219
 epoch: 90, train_loss: 0.4567, test_loss: 1.6824, test_f1: 0.5881
 epoch: 91, train_loss: 0.4464, test_loss: 1.7539, test_f1: 0.5837
 epoch: 92, train_loss: 0.4543, test_loss: 1.7210, test_f1: 0.5785
 epoch: 93, train_loss: 0.4388, test_loss: 1.7773, test_f1: 0.5772
 epoch: 94, train_loss: 0.4519, test_loss: 1.8049, test_f1: 0.5764
 epoch: 95, train_loss: 0.4509, test_loss: 1.7261, test_f1: 0.6047
 epoch: 96, train_loss: 0.4513, test_loss: 1.7274, test_f1: 0.6068
 epoch: 97, train_loss: 0.4290, test_loss: 1.7491, test_f1: 0.5903
 epoch: 98, train_loss: 0.4427, test_loss: 1.7361, test_f1: 0.6053
 epoch: 99, train_loss: 0.4465, test_loss: 1.8612, test_f1: 0.5800
##################ITERATION #2 ****************************************
 epoch: 0, train_loss: 1.2165, test_loss: 1.3026, test_f1: 0.2281
 epoch: 1, train_loss: 1.1153, test_loss: 1.2323, test_f1: 0.2777
 epoch: 2, train_loss: 1.0815, test_loss: 1.1731, test_f1: 0.3455
 epoch: 3, train_loss: 1.0567, test_loss: 1.1053, test_f1: 0.5017
 epoch: 4, train_loss: 1.0198, test_loss: 1.0995, test_f1: 0.5273
 epoch: 5, train_loss: 0.9981, test_loss: 1.0945, test_f1: 0.5406
 epoch: 6, train_loss: 0.9775, test_loss: 1.0790, test_f1: 0.5393
 epoch: 7, train_loss: 0.9658, test_loss: 1.0889, test_f1: 0.5308
 epoch: 8, train_loss: 0.9424, test_loss: 1.0597, test_f1: 0.5351
 epoch: 9, train_loss: 0.9280, test_loss: 1.0862, test_f1: 0.5480
 epoch: 10, train_loss: 0.9125, test_loss: 1.0741, test_f1: 0.5506
 epoch: 11, train_loss: 0.8899, test_loss: 1.0805, test_f1: 0.5316
 epoch: 12, train_loss: 0.8737, test_loss: 1.0916, test_f1: 0.5480
 epoch: 13, train_loss: 0.8791, test_loss: 1.0697, test_f1: 0.5406
 epoch: 14, train_loss: 0.8642, test_loss: 1.1500, test_f1: 0.5451
 epoch: 15, train_loss: 0.8425, test_loss: 1.1326, test_f1: 0.5279
 epoch: 16, train_loss: 0.8461, test_loss: 1.0923, test_f1: 0.5552
 epoch: 17, train_loss: 0.8372, test_loss: 1.1341, test_f1: 0.5465
 epoch: 18, train_loss: 0.8259, test_loss: 1.1695, test_f1: 0.5534
 epoch: 19, train_loss: 0.8203, test_loss: 1.1139, test_f1: 0.5838
 epoch: 20, train_loss: 0.8215, test_loss: 1.1749, test_f1: 0.5419
 epoch: 21, train_loss: 0.8198, test_loss: 1.1205, test_f1: 0.5715
 epoch: 22, train_loss: 0.7817, test_loss: 1.1790, test_f1: 0.5826
 epoch: 23, train_loss: 0.7795, test_loss: 1.1577, test_f1: 0.5652
 epoch: 24, train_loss: 0.7777, test_loss: 1.1274, test_f1: 0.5684
 epoch: 25, train_loss: 0.7745, test_loss: 1.1395, test_f1: 0.5728
 epoch: 26, train_loss: 0.7647, test_loss: 1.1621, test_f1: 0.5557
 epoch: 27, train_loss: 0.7496, test_loss: 1.1639, test_f1: 0.5644
 epoch: 28, train_loss: 0.7521, test_loss: 1.1748, test_f1: 0.5793
 epoch: 29, train_loss: 0.7522, test_loss: 1.2155, test_f1: 0.5397
 epoch: 30, train_loss: 0.7415, test_loss: 1.2256, test_f1: 0.5597
 epoch: 31, train_loss: 0.7327, test_loss: 1.1711, test_f1: 0.5862
 epoch: 32, train_loss: 0.7109, test_loss: 1.2075, test_f1: 0.5645
 epoch: 33, train_loss: 0.7158, test_loss: 1.1610, test_f1: 0.5688
 epoch: 34, train_loss: 0.7045, test_loss: 1.2260, test_f1: 0.5616
 epoch: 35, train_loss: 0.7127, test_loss: 1.2148, test_f1: 0.5800
 epoch: 36, train_loss: 0.7084, test_loss: 1.2679, test_f1: 0.5753
 epoch: 37, train_loss: 0.6967, test_loss: 1.3182, test_f1: 0.5737
 epoch: 38, train_loss: 0.6803, test_loss: 1.2771, test_f1: 0.5431
 epoch: 39, train_loss: 0.6826, test_loss: 1.2417, test_f1: 0.5907
 epoch: 40, train_loss: 0.6712, test_loss: 1.2632, test_f1: 0.5522
 epoch: 41, train_loss: 0.6667, test_loss: 1.2937, test_f1: 0.5694
 epoch: 42, train_loss: 0.6571, test_loss: 1.2641, test_f1: 0.5551
 epoch: 43, train_loss: 0.6598, test_loss: 1.2856, test_f1: 0.5716
 epoch: 44, train_loss: 0.6423, test_loss: 1.2580, test_f1: 0.5748
 epoch: 45, train_loss: 0.6400, test_loss: 1.3213, test_f1: 0.5722
 epoch: 46, train_loss: 0.6461, test_loss: 1.3152, test_f1: 0.5837
 epoch: 47, train_loss: 0.6515, test_loss: 1.3327, test_f1: 0.5648
 epoch: 48, train_loss: 0.6451, test_loss: 1.3140, test_f1: 0.5414
 epoch: 49, train_loss: 0.6232, test_loss: 1.3946, test_f1: 0.5884
 epoch: 50, train_loss: 0.6251, test_loss: 1.4121, test_f1: 0.5771
 epoch: 51, train_loss: 0.6005, test_loss: 1.3626, test_f1: 0.6087
 epoch: 52, train_loss: 0.5947, test_loss: 1.4233, test_f1: 0.5858
 epoch: 53, train_loss: 0.5842, test_loss: 1.4534, test_f1: 0.5997
 epoch: 54, train_loss: 0.5848, test_loss: 1.4867, test_f1: 0.5726
 epoch: 55, train_loss: 0.5688, test_loss: 1.4070, test_f1: 0.5833
 epoch: 56, train_loss: 0.5665, test_loss: 1.4452, test_f1: 0.5768
 epoch: 57, train_loss: 0.5627, test_loss: 1.4720, test_f1: 0.5824
 epoch: 58, train_loss: 0.5648, test_loss: 1.4882, test_f1: 0.5778
 epoch: 59, train_loss: 0.5562, test_loss: 1.4594, test_f1: 0.5687
 epoch: 60, train_loss: 0.5553, test_loss: 1.4425, test_f1: 0.5811
 epoch: 61, train_loss: 0.5538, test_loss: 1.4725, test_f1: 0.5796
 epoch: 62, train_loss: 0.5594, test_loss: 1.4510, test_f1: 0.5800
 epoch: 63, train_loss: 0.5522, test_loss: 1.4832, test_f1: 0.5807
 epoch: 64, train_loss: 0.5463, test_loss: 1.4809, test_f1: 0.5774
 epoch: 65, train_loss: 0.5377, test_loss: 1.5528, test_f1: 0.5690
 epoch: 66, train_loss: 0.5238, test_loss: 1.5747, test_f1: 0.5645
 epoch: 67, train_loss: 0.5366, test_loss: 1.6218, test_f1: 0.5714
 epoch: 68, train_loss: 0.5262, test_loss: 1.5104, test_f1: 0.5679
 epoch: 69, train_loss: 0.5238, test_loss: 1.5416, test_f1: 0.5833
 epoch: 70, train_loss: 0.5334, test_loss: 1.5243, test_f1: 0.5953
 epoch: 71, train_loss: 0.5010, test_loss: 1.5928, test_f1: 0.5697
 epoch: 72, train_loss: 0.5079, test_loss: 1.6053, test_f1: 0.5632
 epoch: 73, train_loss: 0.5285, test_loss: 1.6188, test_f1: 0.5756
 epoch: 74, train_loss: 0.5312, test_loss: 1.5852, test_f1: 0.5766
 epoch: 75, train_loss: 0.5162, test_loss: 1.5607, test_f1: 0.5873
 epoch: 76, train_loss: 0.5092, test_loss: 1.5884, test_f1: 0.5980
 epoch: 77, train_loss: 0.5033, test_loss: 1.5700, test_f1: 0.5782
 epoch: 78, train_loss: 0.5002, test_loss: 1.5932, test_f1: 0.5736
 epoch: 79, train_loss: 0.4993, test_loss: 1.5561, test_f1: 0.5911
 epoch: 80, train_loss: 0.4945, test_loss: 1.6720, test_f1: 0.5790
 epoch: 81, train_loss: 0.5142, test_loss: 1.5940, test_f1: 0.5812
 epoch: 82, train_loss: 0.4950, test_loss: 1.6545, test_f1: 0.5688
 epoch: 83, train_loss: 0.4947, test_loss: 1.6507, test_f1: 0.5895
 epoch: 84, train_loss: 0.4718, test_loss: 1.6749, test_f1: 0.5743
 epoch: 85, train_loss: 0.4901, test_loss: 1.6792, test_f1: 0.5682
 epoch: 86, train_loss: 0.4631, test_loss: 1.6486, test_f1: 0.5886
 epoch: 87, train_loss: 0.4838, test_loss: 1.6950, test_f1: 0.5901
 epoch: 88, train_loss: 0.4832, test_loss: 1.7136, test_f1: 0.5546
 epoch: 89, train_loss: 0.4713, test_loss: 1.7549, test_f1: 0.5801
 epoch: 90, train_loss: 0.4789, test_loss: 1.7302, test_f1: 0.5815
 epoch: 91, train_loss: 0.4555, test_loss: 1.8359, test_f1: 0.5850
 epoch: 92, train_loss: 0.4606, test_loss: 1.7198, test_f1: 0.5702
 epoch: 93, train_loss: 0.4700, test_loss: 1.7247, test_f1: 0.5798
 epoch: 94, train_loss: 0.4550, test_loss: 1.7594, test_f1: 0.5561
 epoch: 95, train_loss: 0.4480, test_loss: 1.7085, test_f1: 0.5669
 epoch: 96, train_loss: 0.4693, test_loss: 1.6966, test_f1: 0.5783
 epoch: 97, train_loss: 0.4566, test_loss: 1.7405, test_f1: 0.5744
 epoch: 98, train_loss: 0.4653, test_loss: 1.7479, test_f1: 0.5629
 epoch: 99, train_loss: 0.4416, test_loss: 1.8168, test_f1: 0.5731
##################ITERATION #3 ****************************************
 epoch: 0, train_loss: 1.2037, test_loss: 1.3014, test_f1: 0.2952
 epoch: 1, train_loss: 1.1023, test_loss: 1.2492, test_f1: 0.4392
 epoch: 2, train_loss: 1.0605, test_loss: 1.1592, test_f1: 0.4443
 epoch: 3, train_loss: 1.0305, test_loss: 1.1022, test_f1: 0.4833
 epoch: 4, train_loss: 1.0101, test_loss: 1.0898, test_f1: 0.5114
 epoch: 5, train_loss: 0.9827, test_loss: 1.0727, test_f1: 0.5242
 epoch: 6, train_loss: 0.9571, test_loss: 1.0534, test_f1: 0.5399
 epoch: 7, train_loss: 0.9288, test_loss: 1.0471, test_f1: 0.5370
 epoch: 8, train_loss: 0.9304, test_loss: 1.0389, test_f1: 0.5434
 epoch: 9, train_loss: 0.9127, test_loss: 1.0142, test_f1: 0.5620
 epoch: 10, train_loss: 0.9042, test_loss: 1.0020, test_f1: 0.5620
 epoch: 11, train_loss: 0.8883, test_loss: 0.9992, test_f1: 0.5592
 epoch: 12, train_loss: 0.8835, test_loss: 0.9807, test_f1: 0.5694
 epoch: 13, train_loss: 0.8669, test_loss: 0.9856, test_f1: 0.5700
 epoch: 14, train_loss: 0.8505, test_loss: 0.9828, test_f1: 0.5833
 epoch: 15, train_loss: 0.8400, test_loss: 1.0091, test_f1: 0.5679
 epoch: 16, train_loss: 0.8324, test_loss: 1.0318, test_f1: 0.5699
 epoch: 17, train_loss: 0.8156, test_loss: 1.0301, test_f1: 0.5653
 epoch: 18, train_loss: 0.8117, test_loss: 0.9971, test_f1: 0.5883
 epoch: 19, train_loss: 0.8073, test_loss: 0.9599, test_f1: 0.5827
 epoch: 20, train_loss: 0.8050, test_loss: 1.0053, test_f1: 0.5802
 epoch: 21, train_loss: 0.7960, test_loss: 1.0283, test_f1: 0.5852
 epoch: 22, train_loss: 0.7785, test_loss: 1.0039, test_f1: 0.5858
 epoch: 23, train_loss: 0.7690, test_loss: 1.0690, test_f1: 0.5933
 epoch: 24, train_loss: 0.7539, test_loss: 1.0375, test_f1: 0.5845
 epoch: 25, train_loss: 0.7551, test_loss: 1.0720, test_f1: 0.5903
 epoch: 26, train_loss: 0.7456, test_loss: 1.0196, test_f1: 0.6114
 epoch: 27, train_loss: 0.7373, test_loss: 1.0531, test_f1: 0.6141
 epoch: 28, train_loss: 0.7185, test_loss: 1.0610, test_f1: 0.5948
 epoch: 29, train_loss: 0.7322, test_loss: 1.0724, test_f1: 0.6069
 epoch: 30, train_loss: 0.7088, test_loss: 1.1277, test_f1: 0.5727
 epoch: 31, train_loss: 0.7202, test_loss: 1.0817, test_f1: 0.6119
 epoch: 32, train_loss: 0.7185, test_loss: 1.0905, test_f1: 0.6048
 epoch: 33, train_loss: 0.7105, test_loss: 1.1083, test_f1: 0.5769
 epoch: 34, train_loss: 0.6815, test_loss: 1.1652, test_f1: 0.5806
 epoch: 35, train_loss: 0.6793, test_loss: 1.0580, test_f1: 0.6119
 epoch: 36, train_loss: 0.6925, test_loss: 1.1216, test_f1: 0.6188
 epoch: 37, train_loss: 0.6728, test_loss: 1.1512, test_f1: 0.6085
 epoch: 38, train_loss: 0.6537, test_loss: 1.1345, test_f1: 0.6183
 epoch: 39, train_loss: 0.6611, test_loss: 1.1795, test_f1: 0.5964
 epoch: 40, train_loss: 0.6353, test_loss: 1.1847, test_f1: 0.5695
 epoch: 41, train_loss: 0.6390, test_loss: 1.1609, test_f1: 0.5779
 epoch: 42, train_loss: 0.6267, test_loss: 1.2875, test_f1: 0.5966
 epoch: 43, train_loss: 0.6333, test_loss: 1.2303, test_f1: 0.6068
 epoch: 44, train_loss: 0.6209, test_loss: 1.2453, test_f1: 0.5914
 epoch: 45, train_loss: 0.6267, test_loss: 1.1602, test_f1: 0.5913
 epoch: 46, train_loss: 0.6138, test_loss: 1.1978, test_f1: 0.5913
 epoch: 47, train_loss: 0.6042, test_loss: 1.2897, test_f1: 0.6008
 epoch: 48, train_loss: 0.6070, test_loss: 1.1998, test_f1: 0.6067
 epoch: 49, train_loss: 0.5983, test_loss: 1.2040, test_f1: 0.6253
 epoch: 50, train_loss: 0.5996, test_loss: 1.2057, test_f1: 0.5777
 epoch: 51, train_loss: 0.5724, test_loss: 1.3387, test_f1: 0.6043
 epoch: 52, train_loss: 0.5548, test_loss: 1.2884, test_f1: 0.5954
 epoch: 53, train_loss: 0.5520, test_loss: 1.2861, test_f1: 0.6032
 epoch: 54, train_loss: 0.5320, test_loss: 1.3064, test_f1: 0.6100
 epoch: 55, train_loss: 0.5228, test_loss: 1.2880, test_f1: 0.5852
 epoch: 56, train_loss: 0.5270, test_loss: 1.3332, test_f1: 0.5966
 epoch: 57, train_loss: 0.5318, test_loss: 1.3371, test_f1: 0.5808
 epoch: 58, train_loss: 0.5146, test_loss: 1.3808, test_f1: 0.5748
 epoch: 59, train_loss: 0.5150, test_loss: 1.3769, test_f1: 0.5945
 epoch: 60, train_loss: 0.5314, test_loss: 1.4237, test_f1: 0.5871
 epoch: 61, train_loss: 0.5241, test_loss: 1.4298, test_f1: 0.5918
 epoch: 62, train_loss: 0.5194, test_loss: 1.4533, test_f1: 0.5704
 epoch: 63, train_loss: 0.5104, test_loss: 1.5637, test_f1: 0.6006
 epoch: 64, train_loss: 0.5211, test_loss: 1.4304, test_f1: 0.5915
 epoch: 65, train_loss: 0.5116, test_loss: 1.4664, test_f1: 0.5849
 epoch: 66, train_loss: 0.4908, test_loss: 1.4085, test_f1: 0.5884
 epoch: 67, train_loss: 0.5057, test_loss: 1.5022, test_f1: 0.5924
 epoch: 68, train_loss: 0.4863, test_loss: 1.4466, test_f1: 0.5796
 epoch: 69, train_loss: 0.4836, test_loss: 1.5751, test_f1: 0.5787
 epoch: 70, train_loss: 0.4914, test_loss: 1.4375, test_f1: 0.5995
 epoch: 71, train_loss: 0.4802, test_loss: 1.4402, test_f1: 0.5734
 epoch: 72, train_loss: 0.4881, test_loss: 1.4432, test_f1: 0.5760
 epoch: 73, train_loss: 0.4667, test_loss: 1.4714, test_f1: 0.5790
 epoch: 74, train_loss: 0.4557, test_loss: 1.5265, test_f1: 0.5891
 epoch: 75, train_loss: 0.4592, test_loss: 1.5148, test_f1: 0.5812
 epoch: 76, train_loss: 0.4603, test_loss: 1.5590, test_f1: 0.5819
 epoch: 77, train_loss: 0.4667, test_loss: 1.5406, test_f1: 0.5898
 epoch: 78, train_loss: 0.4514, test_loss: 1.6064, test_f1: 0.5857
 epoch: 79, train_loss: 0.4654, test_loss: 1.6450, test_f1: 0.5924
 epoch: 80, train_loss: 0.4476, test_loss: 1.5905, test_f1: 0.5784
 epoch: 81, train_loss: 0.4386, test_loss: 1.6207, test_f1: 0.5729
 epoch: 82, train_loss: 0.4499, test_loss: 1.5786, test_f1: 0.5572
 epoch: 83, train_loss: 0.4625, test_loss: 1.6756, test_f1: 0.5673
 epoch: 84, train_loss: 0.4278, test_loss: 1.6597, test_f1: 0.5684
 epoch: 85, train_loss: 0.4331, test_loss: 1.6792, test_f1: 0.5691
 epoch: 86, train_loss: 0.4417, test_loss: 1.6730, test_f1: 0.5739
 epoch: 87, train_loss: 0.4271, test_loss: 1.7153, test_f1: 0.5701
 epoch: 88, train_loss: 0.4380, test_loss: 1.6729, test_f1: 0.5711
 epoch: 89, train_loss: 0.4272, test_loss: 1.6615, test_f1: 0.5663
 epoch: 90, train_loss: 0.4279, test_loss: 1.7034, test_f1: 0.5683
 epoch: 91, train_loss: 0.4200, test_loss: 1.7300, test_f1: 0.5691
 epoch: 92, train_loss: 0.4112, test_loss: 1.5916, test_f1: 0.5618
 epoch: 93, train_loss: 0.4043, test_loss: 1.6619, test_f1: 0.5796
 epoch: 94, train_loss: 0.4062, test_loss: 1.7043, test_f1: 0.5715
 epoch: 95, train_loss: 0.4335, test_loss: 1.7897, test_f1: 0.5632
 epoch: 96, train_loss: 0.4232, test_loss: 1.7271, test_f1: 0.5709
 epoch: 97, train_loss: 0.4094, test_loss: 1.7277, test_f1: 0.5684
 epoch: 98, train_loss: 0.4055, test_loss: 1.8345, test_f1: 0.5774
 epoch: 99, train_loss: 0.4024, test_loss: 1.7651, test_f1: 0.5672
##################ITERATION #4 ****************************************
 epoch: 0, train_loss: 1.1979, test_loss: 1.2871, test_f1: 0.2781
 epoch: 1, train_loss: 1.0738, test_loss: 1.2119, test_f1: 0.3842
 epoch: 2, train_loss: 1.0380, test_loss: 1.1283, test_f1: 0.4750
 epoch: 3, train_loss: 1.0216, test_loss: 1.0897, test_f1: 0.4953
 epoch: 4, train_loss: 1.0068, test_loss: 1.0668, test_f1: 0.5047
 epoch: 5, train_loss: 0.9880, test_loss: 1.0461, test_f1: 0.5333
 epoch: 6, train_loss: 0.9742, test_loss: 1.0377, test_f1: 0.5317
 epoch: 7, train_loss: 0.9528, test_loss: 1.0141, test_f1: 0.5572
 epoch: 8, train_loss: 0.9490, test_loss: 1.0090, test_f1: 0.5515
 epoch: 9, train_loss: 0.9275, test_loss: 1.0068, test_f1: 0.5274
 epoch: 10, train_loss: 0.9037, test_loss: 1.0428, test_f1: 0.5058
 epoch: 11, train_loss: 0.9038, test_loss: 1.0166, test_f1: 0.5421
 epoch: 12, train_loss: 0.9061, test_loss: 1.0252, test_f1: 0.5431
 epoch: 13, train_loss: 0.8749, test_loss: 1.0166, test_f1: 0.5568
 epoch: 14, train_loss: 0.8626, test_loss: 1.0412, test_f1: 0.5524
 epoch: 15, train_loss: 0.8547, test_loss: 0.9992, test_f1: 0.5465
 epoch: 16, train_loss: 0.8486, test_loss: 1.0421, test_f1: 0.5379
 epoch: 17, train_loss: 0.8364, test_loss: 1.0191, test_f1: 0.5553
 epoch: 18, train_loss: 0.8399, test_loss: 0.9950, test_f1: 0.5441
 epoch: 19, train_loss: 0.8218, test_loss: 1.0506, test_f1: 0.5548
 epoch: 20, train_loss: 0.8187, test_loss: 1.0300, test_f1: 0.5739
 epoch: 21, train_loss: 0.8050, test_loss: 1.0139, test_f1: 0.5805
 epoch: 22, train_loss: 0.7928, test_loss: 1.0188, test_f1: 0.5748
 epoch: 23, train_loss: 0.8115, test_loss: 1.0085, test_f1: 0.6024
 epoch: 24, train_loss: 0.7660, test_loss: 1.0438, test_f1: 0.5697
 epoch: 25, train_loss: 0.7764, test_loss: 1.0838, test_f1: 0.5667
 epoch: 26, train_loss: 0.7685, test_loss: 1.0642, test_f1: 0.5779
 epoch: 27, train_loss: 0.7625, test_loss: 1.0941, test_f1: 0.5751
 epoch: 28, train_loss: 0.7683, test_loss: 1.0931, test_f1: 0.5351
 epoch: 29, train_loss: 0.7409, test_loss: 1.0751, test_f1: 0.5549
 epoch: 30, train_loss: 0.7368, test_loss: 1.1252, test_f1: 0.5717
 epoch: 31, train_loss: 0.7308, test_loss: 1.1888, test_f1: 0.5566
 epoch: 32, train_loss: 0.7268, test_loss: 1.0597, test_f1: 0.5755
 epoch: 33, train_loss: 0.7391, test_loss: 1.1006, test_f1: 0.5758
 epoch: 34, train_loss: 0.7023, test_loss: 1.1238, test_f1: 0.5682
 epoch: 35, train_loss: 0.7043, test_loss: 1.1479, test_f1: 0.5929
 epoch: 36, train_loss: 0.7053, test_loss: 1.0725, test_f1: 0.5796
 epoch: 37, train_loss: 0.6851, test_loss: 1.1640, test_f1: 0.5696
 epoch: 38, train_loss: 0.6921, test_loss: 1.1490, test_f1: 0.5909
 epoch: 39, train_loss: 0.7000, test_loss: 1.1926, test_f1: 0.5795
 epoch: 40, train_loss: 0.6790, test_loss: 1.1413, test_f1: 0.5709
 epoch: 41, train_loss: 0.7001, test_loss: 1.1420, test_f1: 0.5610
 epoch: 42, train_loss: 0.6674, test_loss: 1.1933, test_f1: 0.5893
 epoch: 43, train_loss: 0.6807, test_loss: 1.2303, test_f1: 0.5911
 epoch: 44, train_loss: 0.6599, test_loss: 1.1963, test_f1: 0.6150
 epoch: 45, train_loss: 0.6457, test_loss: 1.2419, test_f1: 0.5801
 epoch: 46, train_loss: 0.6493, test_loss: 1.2608, test_f1: 0.5753
 epoch: 47, train_loss: 0.6635, test_loss: 1.2536, test_f1: 0.5874
 epoch: 48, train_loss: 0.6241, test_loss: 1.2320, test_f1: 0.6030
 epoch: 49, train_loss: 0.6575, test_loss: 1.2509, test_f1: 0.6004
 epoch: 50, train_loss: 0.6251, test_loss: 1.3602, test_f1: 0.5889
 epoch: 51, train_loss: 0.6002, test_loss: 1.2789, test_f1: 0.6023
 epoch: 52, train_loss: 0.6051, test_loss: 1.2813, test_f1: 0.5992
 epoch: 53, train_loss: 0.5838, test_loss: 1.3108, test_f1: 0.5797
 epoch: 54, train_loss: 0.5994, test_loss: 1.2931, test_f1: 0.6001
 epoch: 55, train_loss: 0.5740, test_loss: 1.3091, test_f1: 0.5894
 epoch: 56, train_loss: 0.5766, test_loss: 1.2979, test_f1: 0.5854
 epoch: 57, train_loss: 0.5776, test_loss: 1.3508, test_f1: 0.5953
 epoch: 58, train_loss: 0.5595, test_loss: 1.3366, test_f1: 0.5953
 epoch: 59, train_loss: 0.5548, test_loss: 1.3732, test_f1: 0.6114
 epoch: 60, train_loss: 0.5704, test_loss: 1.3650, test_f1: 0.5800
 epoch: 61, train_loss: 0.5725, test_loss: 1.3808, test_f1: 0.6103
 epoch: 62, train_loss: 0.5858, test_loss: 1.3894, test_f1: 0.5874
 epoch: 63, train_loss: 0.5610, test_loss: 1.4451, test_f1: 0.5751
 epoch: 64, train_loss: 0.5441, test_loss: 1.4281, test_f1: 0.5830
 epoch: 65, train_loss: 0.5631, test_loss: 1.4257, test_f1: 0.5992
 epoch: 66, train_loss: 0.5606, test_loss: 1.4304, test_f1: 0.5977
 epoch: 67, train_loss: 0.5416, test_loss: 1.4310, test_f1: 0.6099
 epoch: 68, train_loss: 0.5413, test_loss: 1.4210, test_f1: 0.6076
 epoch: 69, train_loss: 0.5458, test_loss: 1.4085, test_f1: 0.6083
 epoch: 70, train_loss: 0.5342, test_loss: 1.4849, test_f1: 0.6031
 epoch: 71, train_loss: 0.5350, test_loss: 1.4577, test_f1: 0.6028
 epoch: 72, train_loss: 0.5410, test_loss: 1.4503, test_f1: 0.6137
 epoch: 73, train_loss: 0.5214, test_loss: 1.4719, test_f1: 0.6163
 epoch: 74, train_loss: 0.5363, test_loss: 1.4745, test_f1: 0.5999
 epoch: 75, train_loss: 0.5227, test_loss: 1.4811, test_f1: 0.6121
 epoch: 76, train_loss: 0.5191, test_loss: 1.5112, test_f1: 0.6070
 epoch: 77, train_loss: 0.5326, test_loss: 1.5037, test_f1: 0.5919
 epoch: 78, train_loss: 0.5101, test_loss: 1.4876, test_f1: 0.6037
 epoch: 79, train_loss: 0.5266, test_loss: 1.5337, test_f1: 0.6059
 epoch: 80, train_loss: 0.5141, test_loss: 1.6164, test_f1: 0.5907
 epoch: 81, train_loss: 0.4978, test_loss: 1.6067, test_f1: 0.6013
 epoch: 82, train_loss: 0.5169, test_loss: 1.5207, test_f1: 0.6114
 epoch: 83, train_loss: 0.4966, test_loss: 1.5662, test_f1: 0.6072
 epoch: 84, train_loss: 0.5117, test_loss: 1.5456, test_f1: 0.5990
 epoch: 85, train_loss: 0.4975, test_loss: 1.5327, test_f1: 0.6070
 epoch: 86, train_loss: 0.4864, test_loss: 1.5471, test_f1: 0.5906
 epoch: 87, train_loss: 0.4764, test_loss: 1.5500, test_f1: 0.6046
 epoch: 88, train_loss: 0.4714, test_loss: 1.6276, test_f1: 0.5936
 epoch: 89, train_loss: 0.4852, test_loss: 1.6488, test_f1: 0.5835
 epoch: 90, train_loss: 0.4937, test_loss: 1.6054, test_f1: 0.6037
 epoch: 91, train_loss: 0.4824, test_loss: 1.5822, test_f1: 0.6079
 epoch: 92, train_loss: 0.4798, test_loss: 1.5693, test_f1: 0.5864
 epoch: 93, train_loss: 0.4575, test_loss: 1.6387, test_f1: 0.5914
 epoch: 94, train_loss: 0.4534, test_loss: 1.6447, test_f1: 0.5995
 epoch: 95, train_loss: 0.4705, test_loss: 1.6957, test_f1: 0.6021
 epoch: 96, train_loss: 0.4794, test_loss: 1.6691, test_f1: 0.6089
 epoch: 97, train_loss: 0.4652, test_loss: 1.6437, test_f1: 0.6197
 epoch: 98, train_loss: 0.4513, test_loss: 1.6980, test_f1: 0.6165
 epoch: 99, train_loss: 0.4519, test_loss: 1.6869, test_f1: 0.6195
##################ITERATION #5 ****************************************
 epoch: 0, train_loss: 1.2042, test_loss: 1.3154, test_f1: 0.3508
 epoch: 1, train_loss: 1.0867, test_loss: 1.1693, test_f1: 0.3989
 epoch: 2, train_loss: 1.0386, test_loss: 1.1324, test_f1: 0.4464
 epoch: 3, train_loss: 1.0105, test_loss: 1.0789, test_f1: 0.5166
 epoch: 4, train_loss: 0.9943, test_loss: 1.0725, test_f1: 0.5283
 epoch: 5, train_loss: 0.9749, test_loss: 1.0517, test_f1: 0.5181
 epoch: 6, train_loss: 0.9672, test_loss: 1.0452, test_f1: 0.5345
 epoch: 7, train_loss: 0.9517, test_loss: 1.0310, test_f1: 0.5240
 epoch: 8, train_loss: 0.9401, test_loss: 1.0255, test_f1: 0.5320
 epoch: 9, train_loss: 0.9175, test_loss: 1.0147, test_f1: 0.5459
 epoch: 10, train_loss: 0.9225, test_loss: 1.0126, test_f1: 0.5313
 epoch: 11, train_loss: 0.8949, test_loss: 0.9720, test_f1: 0.5656
 epoch: 12, train_loss: 0.8772, test_loss: 0.9708, test_f1: 0.5721
 epoch: 13, train_loss: 0.8899, test_loss: 0.9811, test_f1: 0.5571
 epoch: 14, train_loss: 0.8676, test_loss: 1.0091, test_f1: 0.5565
 epoch: 15, train_loss: 0.8631, test_loss: 0.9802, test_f1: 0.5538
 epoch: 16, train_loss: 0.8675, test_loss: 0.9620, test_f1: 0.5734
 epoch: 17, train_loss: 0.8362, test_loss: 1.0010, test_f1: 0.5849
 epoch: 18, train_loss: 0.8368, test_loss: 1.0193, test_f1: 0.5821
 epoch: 19, train_loss: 0.8334, test_loss: 0.9771, test_f1: 0.5932
 epoch: 20, train_loss: 0.8190, test_loss: 1.0071, test_f1: 0.5868
 epoch: 21, train_loss: 0.8246, test_loss: 1.0440, test_f1: 0.5675
 epoch: 22, train_loss: 0.8357, test_loss: 1.0263, test_f1: 0.5563
 epoch: 23, train_loss: 0.7940, test_loss: 1.0161, test_f1: 0.5729
 epoch: 24, train_loss: 0.7914, test_loss: 1.0018, test_f1: 0.5801
 epoch: 25, train_loss: 0.7834, test_loss: 1.0179, test_f1: 0.5647
 epoch: 26, train_loss: 0.7981, test_loss: 1.0029, test_f1: 0.5924
 epoch: 27, train_loss: 0.7711, test_loss: 0.9838, test_f1: 0.5778
 epoch: 28, train_loss: 0.7847, test_loss: 0.9883, test_f1: 0.5802
 epoch: 29, train_loss: 0.7729, test_loss: 1.0093, test_f1: 0.6022
 epoch: 30, train_loss: 0.7580, test_loss: 1.0215, test_f1: 0.5964
 epoch: 31, train_loss: 0.7463, test_loss: 1.0121, test_f1: 0.5759
 epoch: 32, train_loss: 0.7398, test_loss: 0.9825, test_f1: 0.5680
 epoch: 33, train_loss: 0.7365, test_loss: 1.0224, test_f1: 0.5975
 epoch: 34, train_loss: 0.7179, test_loss: 1.0596, test_f1: 0.5776
 epoch: 35, train_loss: 0.7245, test_loss: 1.0176, test_f1: 0.5850
 epoch: 36, train_loss: 0.7281, test_loss: 1.0845, test_f1: 0.5906
 epoch: 37, train_loss: 0.7250, test_loss: 1.0408, test_f1: 0.5788
 epoch: 38, train_loss: 0.7079, test_loss: 1.1026, test_f1: 0.5666
 epoch: 39, train_loss: 0.6954, test_loss: 1.0509, test_f1: 0.5852
 epoch: 40, train_loss: 0.6941, test_loss: 1.0116, test_f1: 0.5812
 epoch: 41, train_loss: 0.7014, test_loss: 1.0729, test_f1: 0.5912
 epoch: 42, train_loss: 0.6905, test_loss: 1.0686, test_f1: 0.5945
 epoch: 43, train_loss: 0.6767, test_loss: 1.0746, test_f1: 0.5772
 epoch: 44, train_loss: 0.6873, test_loss: 1.1787, test_f1: 0.5717
 epoch: 45, train_loss: 0.6791, test_loss: 1.0663, test_f1: 0.5971
 epoch: 46, train_loss: 0.6857, test_loss: 1.1808, test_f1: 0.5676
 epoch: 47, train_loss: 0.6628, test_loss: 1.1171, test_f1: 0.5888
 epoch: 48, train_loss: 0.6563, test_loss: 1.1704, test_f1: 0.5942
 epoch: 49, train_loss: 0.6429, test_loss: 1.1481, test_f1: 0.5885
 epoch: 50, train_loss: 0.6361, test_loss: 1.1483, test_f1: 0.5905
 epoch: 51, train_loss: 0.6196, test_loss: 1.1277, test_f1: 0.5905
 epoch: 52, train_loss: 0.6290, test_loss: 1.1294, test_f1: 0.5992
 epoch: 53, train_loss: 0.6221, test_loss: 1.1663, test_f1: 0.5778
 epoch: 54, train_loss: 0.6171, test_loss: 1.1417, test_f1: 0.5901
 epoch: 55, train_loss: 0.5972, test_loss: 1.1842, test_f1: 0.5808
 epoch: 56, train_loss: 0.6092, test_loss: 1.1387, test_f1: 0.6108
 epoch: 57, train_loss: 0.5953, test_loss: 1.1624, test_f1: 0.5940
 epoch: 58, train_loss: 0.5827, test_loss: 1.1311, test_f1: 0.5988
 epoch: 59, train_loss: 0.5837, test_loss: 1.1236, test_f1: 0.6126
 epoch: 60, train_loss: 0.5795, test_loss: 1.1985, test_f1: 0.5993
 epoch: 61, train_loss: 0.5957, test_loss: 1.1879, test_f1: 0.6017
 epoch: 62, train_loss: 0.5753, test_loss: 1.2253, test_f1: 0.5948
 epoch: 63, train_loss: 0.5870, test_loss: 1.2027, test_f1: 0.5994
 epoch: 64, train_loss: 0.5697, test_loss: 1.1762, test_f1: 0.6044
 epoch: 65, train_loss: 0.5717, test_loss: 1.2193, test_f1: 0.5879
 epoch: 66, train_loss: 0.5573, test_loss: 1.1982, test_f1: 0.6082
 epoch: 67, train_loss: 0.5634, test_loss: 1.1770, test_f1: 0.6183
 epoch: 68, train_loss: 0.5689, test_loss: 1.2809, test_f1: 0.5818
 epoch: 69, train_loss: 0.5732, test_loss: 1.1966, test_f1: 0.6122
 epoch: 70, train_loss: 0.5730, test_loss: 1.2500, test_f1: 0.6084
 epoch: 71, train_loss: 0.5461, test_loss: 1.2695, test_f1: 0.5914
 epoch: 72, train_loss: 0.5518, test_loss: 1.2673, test_f1: 0.5927
 epoch: 73, train_loss: 0.5743, test_loss: 1.2163, test_f1: 0.6078
 epoch: 74, train_loss: 0.5357, test_loss: 1.2375, test_f1: 0.6172
 epoch: 75, train_loss: 0.5393, test_loss: 1.2604, test_f1: 0.5973
 epoch: 76, train_loss: 0.5609, test_loss: 1.2209, test_f1: 0.6131
 epoch: 77, train_loss: 0.5419, test_loss: 1.3079, test_f1: 0.5742
 epoch: 78, train_loss: 0.5300, test_loss: 1.2239, test_f1: 0.5969
 epoch: 79, train_loss: 0.5395, test_loss: 1.2633, test_f1: 0.6128
 epoch: 80, train_loss: 0.5371, test_loss: 1.3229, test_f1: 0.5977
 epoch: 81, train_loss: 0.5497, test_loss: 1.2842, test_f1: 0.5845
 epoch: 82, train_loss: 0.5234, test_loss: 1.3090, test_f1: 0.5998
 epoch: 83, train_loss: 0.5236, test_loss: 1.2970, test_f1: 0.5957
 epoch: 84, train_loss: 0.5088, test_loss: 1.3455, test_f1: 0.5901
 epoch: 85, train_loss: 0.5165, test_loss: 1.3387, test_f1: 0.6003
 epoch: 86, train_loss: 0.5426, test_loss: 1.3527, test_f1: 0.5791
 epoch: 87, train_loss: 0.5188, test_loss: 1.3784, test_f1: 0.6052
 epoch: 88, train_loss: 0.5259, test_loss: 1.3972, test_f1: 0.5784
 epoch: 89, train_loss: 0.5051, test_loss: 1.3933, test_f1: 0.5807
 epoch: 90, train_loss: 0.5116, test_loss: 1.3495, test_f1: 0.5905
 epoch: 91, train_loss: 0.5171, test_loss: 1.4466, test_f1: 0.5656
 epoch: 92, train_loss: 0.5027, test_loss: 1.4736, test_f1: 0.5812
 epoch: 93, train_loss: 0.5067, test_loss: 1.4053, test_f1: 0.5896
 epoch: 94, train_loss: 0.4965, test_loss: 1.4238, test_f1: 0.5795
 epoch: 95, train_loss: 0.5009, test_loss: 1.4000, test_f1: 0.5997
 epoch: 96, train_loss: 0.4829, test_loss: 1.4118, test_f1: 0.5883
 epoch: 97, train_loss: 0.4696, test_loss: 1.4259, test_f1: 0.5896
 epoch: 98, train_loss: 0.4895, test_loss: 1.3603, test_f1: 0.5955
 epoch: 99, train_loss: 0.4946, test_loss: 1.3990, test_f1: 0.5877
##################ITERATION #6 ****************************************
 epoch: 0, train_loss: 1.2030, test_loss: 1.2997, test_f1: 0.3284
 epoch: 1, train_loss: 1.0771, test_loss: 1.2657, test_f1: 0.4333
 epoch: 2, train_loss: 1.0540, test_loss: 1.1228, test_f1: 0.5156
 epoch: 3, train_loss: 1.0154, test_loss: 1.0820, test_f1: 0.5353
 epoch: 4, train_loss: 0.9916, test_loss: 1.0828, test_f1: 0.5300
 epoch: 5, train_loss: 0.9802, test_loss: 1.0522, test_f1: 0.5322
 epoch: 6, train_loss: 0.9602, test_loss: 1.0400, test_f1: 0.5379
 epoch: 7, train_loss: 0.9462, test_loss: 1.0595, test_f1: 0.5487
 epoch: 8, train_loss: 0.9368, test_loss: 1.0431, test_f1: 0.5373
 epoch: 9, train_loss: 0.9203, test_loss: 1.0563, test_f1: 0.5384
 epoch: 10, train_loss: 0.8949, test_loss: 1.0767, test_f1: 0.5412
 epoch: 11, train_loss: 0.8772, test_loss: 1.0538, test_f1: 0.5472
 epoch: 12, train_loss: 0.8852, test_loss: 1.0147, test_f1: 0.5660
 epoch: 13, train_loss: 0.8564, test_loss: 1.0284, test_f1: 0.5669
 epoch: 14, train_loss: 0.8650, test_loss: 1.0298, test_f1: 0.5765
 epoch: 15, train_loss: 0.8466, test_loss: 1.0598, test_f1: 0.5610
 epoch: 16, train_loss: 0.8401, test_loss: 1.0170, test_f1: 0.5911
 epoch: 17, train_loss: 0.8157, test_loss: 1.0325, test_f1: 0.5645
 epoch: 18, train_loss: 0.8206, test_loss: 1.0082, test_f1: 0.5797
 epoch: 19, train_loss: 0.7932, test_loss: 1.0589, test_f1: 0.5759
 epoch: 20, train_loss: 0.8026, test_loss: 1.0063, test_f1: 0.5833
 epoch: 21, train_loss: 0.7925, test_loss: 1.0928, test_f1: 0.5703
 epoch: 22, train_loss: 0.7998, test_loss: 1.0600, test_f1: 0.5817
 epoch: 23, train_loss: 0.7896, test_loss: 1.0260, test_f1: 0.5979
 epoch: 24, train_loss: 0.7882, test_loss: 1.0692, test_f1: 0.5980
 epoch: 25, train_loss: 0.7703, test_loss: 1.0428, test_f1: 0.5876
 epoch: 26, train_loss: 0.7583, test_loss: 1.0367, test_f1: 0.5886
 epoch: 27, train_loss: 0.7597, test_loss: 1.0644, test_f1: 0.5888
 epoch: 28, train_loss: 0.7430, test_loss: 1.0873, test_f1: 0.5974
 epoch: 29, train_loss: 0.7339, test_loss: 1.0900, test_f1: 0.6001
 epoch: 30, train_loss: 0.7434, test_loss: 1.0320, test_f1: 0.5951
 epoch: 31, train_loss: 0.7232, test_loss: 1.0976, test_f1: 0.5869
 epoch: 32, train_loss: 0.7267, test_loss: 1.1144, test_f1: 0.5972
 epoch: 33, train_loss: 0.7360, test_loss: 1.1365, test_f1: 0.5852
 epoch: 34, train_loss: 0.7083, test_loss: 1.0687, test_f1: 0.6146
 epoch: 35, train_loss: 0.7116, test_loss: 1.0163, test_f1: 0.6094
 epoch: 36, train_loss: 0.6917, test_loss: 1.0768, test_f1: 0.6196
 epoch: 37, train_loss: 0.7046, test_loss: 1.0655, test_f1: 0.6019
 epoch: 38, train_loss: 0.6960, test_loss: 1.1199, test_f1: 0.5848
 epoch: 39, train_loss: 0.6884, test_loss: 1.0632, test_f1: 0.6094
 epoch: 40, train_loss: 0.6731, test_loss: 1.1750, test_f1: 0.5870
 epoch: 41, train_loss: 0.6601, test_loss: 1.1604, test_f1: 0.5912
 epoch: 42, train_loss: 0.6748, test_loss: 1.0990, test_f1: 0.6065
 epoch: 43, train_loss: 0.6710, test_loss: 1.1380, test_f1: 0.5837
 epoch: 44, train_loss: 0.6562, test_loss: 1.1956, test_f1: 0.6018
 epoch: 45, train_loss: 0.6505, test_loss: 1.1135, test_f1: 0.6020
 epoch: 46, train_loss: 0.6407, test_loss: 1.1174, test_f1: 0.5903
 epoch: 47, train_loss: 0.6541, test_loss: 1.1736, test_f1: 0.6031
 epoch: 48, train_loss: 0.6425, test_loss: 1.1732, test_f1: 0.6115
 epoch: 49, train_loss: 0.6271, test_loss: 1.1544, test_f1: 0.6210
 epoch: 50, train_loss: 0.6342, test_loss: 1.1554, test_f1: 0.6040
 epoch: 51, train_loss: 0.6200, test_loss: 1.1673, test_f1: 0.6254
 epoch: 52, train_loss: 0.6189, test_loss: 1.1810, test_f1: 0.6063
 epoch: 53, train_loss: 0.5911, test_loss: 1.1857, test_f1: 0.6248
 epoch: 54, train_loss: 0.5874, test_loss: 1.1520, test_f1: 0.6226
 epoch: 55, train_loss: 0.5923, test_loss: 1.1764, test_f1: 0.6194
 epoch: 56, train_loss: 0.5986, test_loss: 1.2100, test_f1: 0.6198
 epoch: 57, train_loss: 0.5787, test_loss: 1.1702, test_f1: 0.6327
 epoch: 58, train_loss: 0.5860, test_loss: 1.2254, test_f1: 0.6072
 epoch: 59, train_loss: 0.5741, test_loss: 1.2133, test_f1: 0.6276
 epoch: 60, train_loss: 0.5695, test_loss: 1.2258, test_f1: 0.6482
 epoch: 61, train_loss: 0.5819, test_loss: 1.2066, test_f1: 0.6328
 epoch: 62, train_loss: 0.5758, test_loss: 1.2849, test_f1: 0.6065
 epoch: 63, train_loss: 0.5507, test_loss: 1.2654, test_f1: 0.6123
 epoch: 64, train_loss: 0.5532, test_loss: 1.2634, test_f1: 0.6149
 epoch: 65, train_loss: 0.5491, test_loss: 1.2849, test_f1: 0.6059
 epoch: 66, train_loss: 0.5525, test_loss: 1.2858, test_f1: 0.6102
 epoch: 67, train_loss: 0.5414, test_loss: 1.2890, test_f1: 0.6145
 epoch: 68, train_loss: 0.5441, test_loss: 1.2943, test_f1: 0.6048
 epoch: 69, train_loss: 0.5417, test_loss: 1.2974, test_f1: 0.6118
 epoch: 70, train_loss: 0.5314, test_loss: 1.3273, test_f1: 0.6070
 epoch: 71, train_loss: 0.5364, test_loss: 1.3380, test_f1: 0.6021
 epoch: 72, train_loss: 0.5486, test_loss: 1.3346, test_f1: 0.6110
 epoch: 73, train_loss: 0.5283, test_loss: 1.3408, test_f1: 0.6271
 epoch: 74, train_loss: 0.5198, test_loss: 1.3166, test_f1: 0.6270
 epoch: 75, train_loss: 0.5021, test_loss: 1.3347, test_f1: 0.6274
 epoch: 76, train_loss: 0.5290, test_loss: 1.3209, test_f1: 0.6115
 epoch: 77, train_loss: 0.5084, test_loss: 1.3639, test_f1: 0.6245
 epoch: 78, train_loss: 0.4935, test_loss: 1.4012, test_f1: 0.6276
 epoch: 79, train_loss: 0.5011, test_loss: 1.4180, test_f1: 0.6126
 epoch: 80, train_loss: 0.5072, test_loss: 1.3855, test_f1: 0.6421
 epoch: 81, train_loss: 0.5041, test_loss: 1.3183, test_f1: 0.6458
 epoch: 82, train_loss: 0.5013, test_loss: 1.3983, test_f1: 0.6326
 epoch: 83, train_loss: 0.4910, test_loss: 1.4169, test_f1: 0.6375
 epoch: 84, train_loss: 0.5018, test_loss: 1.4728, test_f1: 0.6197
 epoch: 85, train_loss: 0.4704, test_loss: 1.3960, test_f1: 0.6111
 epoch: 86, train_loss: 0.4790, test_loss: 1.4367, test_f1: 0.6296
 epoch: 87, train_loss: 0.4862, test_loss: 1.5408, test_f1: 0.6058
 epoch: 88, train_loss: 0.4650, test_loss: 1.4579, test_f1: 0.6176
 epoch: 89, train_loss: 0.4550, test_loss: 1.4150, test_f1: 0.6402
 epoch: 90, train_loss: 0.4677, test_loss: 1.4709, test_f1: 0.6063
 epoch: 91, train_loss: 0.4678, test_loss: 1.4659, test_f1: 0.6187
 epoch: 92, train_loss: 0.4619, test_loss: 1.4388, test_f1: 0.6269
 epoch: 93, train_loss: 0.4661, test_loss: 1.4643, test_f1: 0.6158
 epoch: 94, train_loss: 0.4704, test_loss: 1.4006, test_f1: 0.6219
 epoch: 95, train_loss: 0.4722, test_loss: 1.4853, test_f1: 0.6203
 epoch: 96, train_loss: 0.4737, test_loss: 1.5463, test_f1: 0.6208
 epoch: 97, train_loss: 0.4695, test_loss: 1.4012, test_f1: 0.6212
 epoch: 98, train_loss: 0.4691, test_loss: 1.4772, test_f1: 0.6188
 epoch: 99, train_loss: 0.4649, test_loss: 1.4870, test_f1: 0.6300
##################ITERATION #7 ****************************************
 epoch: 0, train_loss: 1.2042, test_loss: 1.2903, test_f1: 0.2803
 epoch: 1, train_loss: 1.0824, test_loss: 1.2044, test_f1: 0.4074
 epoch: 2, train_loss: 1.0476, test_loss: 1.1406, test_f1: 0.4437
 epoch: 3, train_loss: 1.0253, test_loss: 1.0683, test_f1: 0.5370
 epoch: 4, train_loss: 1.0005, test_loss: 1.0459, test_f1: 0.5342
 epoch: 5, train_loss: 0.9934, test_loss: 1.0552, test_f1: 0.5383
 epoch: 6, train_loss: 0.9651, test_loss: 1.0150, test_f1: 0.5557
 epoch: 7, train_loss: 0.9484, test_loss: 1.0115, test_f1: 0.5527
 epoch: 8, train_loss: 0.9337, test_loss: 1.0219, test_f1: 0.5463
 epoch: 9, train_loss: 0.9167, test_loss: 1.0132, test_f1: 0.5431
 epoch: 10, train_loss: 0.8953, test_loss: 1.0164, test_f1: 0.5457
 epoch: 11, train_loss: 0.9116, test_loss: 1.0154, test_f1: 0.5500
 epoch: 12, train_loss: 0.8788, test_loss: 1.0466, test_f1: 0.5731
 epoch: 13, train_loss: 0.8702, test_loss: 1.0253, test_f1: 0.5818
 epoch: 14, train_loss: 0.8501, test_loss: 0.9957, test_f1: 0.5662
 epoch: 15, train_loss: 0.8445, test_loss: 1.0361, test_f1: 0.5748
 epoch: 16, train_loss: 0.8351, test_loss: 1.0042, test_f1: 0.5805
 epoch: 17, train_loss: 0.8400, test_loss: 0.9960, test_f1: 0.5808
 epoch: 18, train_loss: 0.8258, test_loss: 1.0214, test_f1: 0.5737
 epoch: 19, train_loss: 0.7989, test_loss: 1.0137, test_f1: 0.5966
 epoch: 20, train_loss: 0.8080, test_loss: 0.9860, test_f1: 0.6122
 epoch: 21, train_loss: 0.8093, test_loss: 1.0334, test_f1: 0.6105
 epoch: 22, train_loss: 0.7961, test_loss: 1.0230, test_f1: 0.6095
 epoch: 23, train_loss: 0.7842, test_loss: 1.0248, test_f1: 0.6179
 epoch: 24, train_loss: 0.7712, test_loss: 1.0336, test_f1: 0.6205
 epoch: 25, train_loss: 0.7732, test_loss: 1.0455, test_f1: 0.6144
 epoch: 26, train_loss: 0.7713, test_loss: 1.0266, test_f1: 0.6124
 epoch: 27, train_loss: 0.7693, test_loss: 0.9827, test_f1: 0.6221
 epoch: 28, train_loss: 0.7405, test_loss: 1.0223, test_f1: 0.5894
 epoch: 29, train_loss: 0.7454, test_loss: 1.0812, test_f1: 0.6153
 epoch: 30, train_loss: 0.7519, test_loss: 1.0529, test_f1: 0.6255
 epoch: 31, train_loss: 0.7369, test_loss: 1.0786, test_f1: 0.6162
 epoch: 32, train_loss: 0.7304, test_loss: 1.0535, test_f1: 0.5935
 epoch: 33, train_loss: 0.7102, test_loss: 1.0872, test_f1: 0.5900
 epoch: 34, train_loss: 0.7278, test_loss: 1.0187, test_f1: 0.6221
 epoch: 35, train_loss: 0.7124, test_loss: 1.0483, test_f1: 0.6253
 epoch: 36, train_loss: 0.7152, test_loss: 1.0863, test_f1: 0.5951
 epoch: 37, train_loss: 0.6786, test_loss: 1.0992, test_f1: 0.6284
 epoch: 38, train_loss: 0.7277, test_loss: 1.0451, test_f1: 0.6412
 epoch: 39, train_loss: 0.6943, test_loss: 1.0796, test_f1: 0.6087
 epoch: 40, train_loss: 0.6895, test_loss: 1.1302, test_f1: 0.6148
 epoch: 41, train_loss: 0.6749, test_loss: 1.1570, test_f1: 0.6247
 epoch: 42, train_loss: 0.6780, test_loss: 1.1123, test_f1: 0.6057
 epoch: 43, train_loss: 0.6766, test_loss: 1.1169, test_f1: 0.6218
 epoch: 44, train_loss: 0.6428, test_loss: 1.1151, test_f1: 0.6045
 epoch: 45, train_loss: 0.6576, test_loss: 1.1015, test_f1: 0.6143
 epoch: 46, train_loss: 0.6627, test_loss: 1.0930, test_f1: 0.6210
 epoch: 47, train_loss: 0.6474, test_loss: 1.1086, test_f1: 0.6219
 epoch: 48, train_loss: 0.6531, test_loss: 1.1090, test_f1: 0.6016
 epoch: 49, train_loss: 0.6456, test_loss: 1.1349, test_f1: 0.6184
 epoch: 50, train_loss: 0.6171, test_loss: 1.1800, test_f1: 0.5881
 epoch: 51, train_loss: 0.6192, test_loss: 1.1490, test_f1: 0.5817
 epoch: 52, train_loss: 0.5929, test_loss: 1.1482, test_f1: 0.5939
 epoch: 53, train_loss: 0.6008, test_loss: 1.1475, test_f1: 0.5972
 epoch: 54, train_loss: 0.5996, test_loss: 1.1505, test_f1: 0.6391
 epoch: 55, train_loss: 0.5779, test_loss: 1.1775, test_f1: 0.5981
 epoch: 56, train_loss: 0.6001, test_loss: 1.1687, test_f1: 0.6115
 epoch: 57, train_loss: 0.5853, test_loss: 1.1633, test_f1: 0.6225
 epoch: 58, train_loss: 0.5606, test_loss: 1.1575, test_f1: 0.6175
 epoch: 59, train_loss: 0.5633, test_loss: 1.1896, test_f1: 0.6288
 epoch: 60, train_loss: 0.5773, test_loss: 1.2090, test_f1: 0.6185
 epoch: 61, train_loss: 0.5626, test_loss: 1.2026, test_f1: 0.6272
 epoch: 62, train_loss: 0.5597, test_loss: 1.1903, test_f1: 0.6170
 epoch: 63, train_loss: 0.5588, test_loss: 1.1768, test_f1: 0.6378
 epoch: 64, train_loss: 0.5708, test_loss: 1.2248, test_f1: 0.6048
 epoch: 65, train_loss: 0.5630, test_loss: 1.2107, test_f1: 0.6002
 epoch: 66, train_loss: 0.5641, test_loss: 1.2109, test_f1: 0.6539
 epoch: 67, train_loss: 0.5499, test_loss: 1.2118, test_f1: 0.6217
 epoch: 68, train_loss: 0.5433, test_loss: 1.2401, test_f1: 0.6355
 epoch: 69, train_loss: 0.5357, test_loss: 1.2145, test_f1: 0.6256
 epoch: 70, train_loss: 0.5323, test_loss: 1.2423, test_f1: 0.6326
 epoch: 71, train_loss: 0.5154, test_loss: 1.2540, test_f1: 0.6087
 epoch: 72, train_loss: 0.5333, test_loss: 1.2500, test_f1: 0.6261
 epoch: 73, train_loss: 0.5339, test_loss: 1.2530, test_f1: 0.6246
 epoch: 74, train_loss: 0.5357, test_loss: 1.2304, test_f1: 0.6407
 epoch: 75, train_loss: 0.5177, test_loss: 1.2559, test_f1: 0.6248
 epoch: 76, train_loss: 0.5193, test_loss: 1.2792, test_f1: 0.6219
 epoch: 77, train_loss: 0.5161, test_loss: 1.2645, test_f1: 0.6288
 epoch: 78, train_loss: 0.4924, test_loss: 1.2721, test_f1: 0.6151
 epoch: 79, train_loss: 0.5063, test_loss: 1.2915, test_f1: 0.5969
 epoch: 80, train_loss: 0.5180, test_loss: 1.3024, test_f1: 0.6179
 epoch: 81, train_loss: 0.4986, test_loss: 1.3148, test_f1: 0.6085
 epoch: 82, train_loss: 0.5107, test_loss: 1.3218, test_f1: 0.6204
 epoch: 83, train_loss: 0.5053, test_loss: 1.3515, test_f1: 0.6122
 epoch: 84, train_loss: 0.4982, test_loss: 1.3304, test_f1: 0.6203
 epoch: 85, train_loss: 0.5124, test_loss: 1.3012, test_f1: 0.6210
 epoch: 86, train_loss: 0.4873, test_loss: 1.3140, test_f1: 0.6081
 epoch: 87, train_loss: 0.4858, test_loss: 1.3295, test_f1: 0.5983
 epoch: 88, train_loss: 0.4915, test_loss: 1.3509, test_f1: 0.6066
 epoch: 89, train_loss: 0.4744, test_loss: 1.3458, test_f1: 0.6176
 epoch: 90, train_loss: 0.4704, test_loss: 1.3413, test_f1: 0.6079
 epoch: 91, train_loss: 0.5132, test_loss: 1.3505, test_f1: 0.6010
 epoch: 92, train_loss: 0.4693, test_loss: 1.3718, test_f1: 0.6280
 epoch: 93, train_loss: 0.4944, test_loss: 1.3733, test_f1: 0.6204
 epoch: 94, train_loss: 0.4696, test_loss: 1.3267, test_f1: 0.6255
 epoch: 95, train_loss: 0.4813, test_loss: 1.3523, test_f1: 0.6131
 epoch: 96, train_loss: 0.4641, test_loss: 1.4070, test_f1: 0.6209
 epoch: 97, train_loss: 0.4733, test_loss: 1.3307, test_f1: 0.6161
 epoch: 98, train_loss: 0.4634, test_loss: 1.3855, test_f1: 0.6205
 epoch: 99, train_loss: 0.4501, test_loss: 1.3749, test_f1: 0.6220
##################ITERATION #8 ****************************************
 epoch: 0, train_loss: 1.2514, test_loss: 1.2951, test_f1: 0.3321
 epoch: 1, train_loss: 1.1080, test_loss: 1.2510, test_f1: 0.2455
 epoch: 2, train_loss: 1.0801, test_loss: 1.2123, test_f1: 0.4321
 epoch: 3, train_loss: 1.0824, test_loss: 1.1399, test_f1: 0.5064
 epoch: 4, train_loss: 1.0433, test_loss: 1.1014, test_f1: 0.5054
 epoch: 5, train_loss: 1.0119, test_loss: 1.0918, test_f1: 0.5128
 epoch: 6, train_loss: 0.9959, test_loss: 1.0683, test_f1: 0.5093
 epoch: 7, train_loss: 0.9765, test_loss: 1.0704, test_f1: 0.5206
 epoch: 8, train_loss: 0.9622, test_loss: 1.0640, test_f1: 0.5261
 epoch: 9, train_loss: 0.9553, test_loss: 1.0673, test_f1: 0.5492
 epoch: 10, train_loss: 0.9321, test_loss: 1.0615, test_f1: 0.5543
 epoch: 11, train_loss: 0.9080, test_loss: 1.0472, test_f1: 0.5556
 epoch: 12, train_loss: 0.9065, test_loss: 1.0401, test_f1: 0.5758
 epoch: 13, train_loss: 0.8957, test_loss: 1.0451, test_f1: 0.5575
 epoch: 14, train_loss: 0.8908, test_loss: 1.0353, test_f1: 0.5845
 epoch: 15, train_loss: 0.8739, test_loss: 1.0400, test_f1: 0.5639
 epoch: 16, train_loss: 0.8816, test_loss: 1.0232, test_f1: 0.5778
 epoch: 17, train_loss: 0.8696, test_loss: 1.0053, test_f1: 0.5862
 epoch: 18, train_loss: 0.8552, test_loss: 1.0128, test_f1: 0.5875
 epoch: 19, train_loss: 0.8526, test_loss: 1.0287, test_f1: 0.5879
 epoch: 20, train_loss: 0.8549, test_loss: 1.0058, test_f1: 0.5609
 epoch: 21, train_loss: 0.8449, test_loss: 1.0090, test_f1: 0.5698
 epoch: 22, train_loss: 0.8115, test_loss: 1.0337, test_f1: 0.5677
 epoch: 23, train_loss: 0.8093, test_loss: 1.0125, test_f1: 0.5648
 epoch: 24, train_loss: 0.8165, test_loss: 1.0202, test_f1: 0.5770
 epoch: 25, train_loss: 0.8206, test_loss: 0.9929, test_f1: 0.6079
 epoch: 26, train_loss: 0.7784, test_loss: 0.9736, test_f1: 0.6138
 epoch: 27, train_loss: 0.7845, test_loss: 1.0138, test_f1: 0.5703
 epoch: 28, train_loss: 0.7646, test_loss: 0.9832, test_f1: 0.5953
 epoch: 29, train_loss: 0.7897, test_loss: 1.0649, test_f1: 0.5723
 epoch: 30, train_loss: 0.7666, test_loss: 0.9796, test_f1: 0.5920
 epoch: 31, train_loss: 0.7591, test_loss: 1.0194, test_f1: 0.6120
 epoch: 32, train_loss: 0.7766, test_loss: 1.0481, test_f1: 0.5761
 epoch: 33, train_loss: 0.7291, test_loss: 1.0587, test_f1: 0.5828
 epoch: 34, train_loss: 0.7528, test_loss: 1.0376, test_f1: 0.5779
 epoch: 35, train_loss: 0.7439, test_loss: 1.0597, test_f1: 0.5746
 epoch: 36, train_loss: 0.7372, test_loss: 1.0538, test_f1: 0.5877
 epoch: 37, train_loss: 0.7323, test_loss: 1.0570, test_f1: 0.5781
 epoch: 38, train_loss: 0.6990, test_loss: 1.0228, test_f1: 0.5970
 epoch: 39, train_loss: 0.7146, test_loss: 1.0780, test_f1: 0.5823
 epoch: 40, train_loss: 0.7111, test_loss: 1.0684, test_f1: 0.5928
 epoch: 41, train_loss: 0.7011, test_loss: 1.0103, test_f1: 0.6168
 epoch: 42, train_loss: 0.6796, test_loss: 1.1127, test_f1: 0.5655
 epoch: 43, train_loss: 0.6839, test_loss: 1.0860, test_f1: 0.5894
 epoch: 44, train_loss: 0.6938, test_loss: 1.0414, test_f1: 0.6045
 epoch: 45, train_loss: 0.6861, test_loss: 1.1367, test_f1: 0.5767
 epoch: 46, train_loss: 0.6719, test_loss: 1.0764, test_f1: 0.6079
 epoch: 47, train_loss: 0.6648, test_loss: 1.1533, test_f1: 0.5920
 epoch: 48, train_loss: 0.6348, test_loss: 1.1296, test_f1: 0.5938
 epoch: 49, train_loss: 0.6579, test_loss: 1.1204, test_f1: 0.6054
 epoch: 50, train_loss: 0.6425, test_loss: 1.1427, test_f1: 0.5978
 epoch: 51, train_loss: 0.6277, test_loss: 1.1334, test_f1: 0.6084
 epoch: 52, train_loss: 0.6060, test_loss: 1.1113, test_f1: 0.6153
 epoch: 53, train_loss: 0.6199, test_loss: 1.1483, test_f1: 0.6007
 epoch: 54, train_loss: 0.6057, test_loss: 1.1371, test_f1: 0.6090
 epoch: 55, train_loss: 0.6146, test_loss: 1.1318, test_f1: 0.5942
 epoch: 56, train_loss: 0.6061, test_loss: 1.1114, test_f1: 0.5957
 epoch: 57, train_loss: 0.6066, test_loss: 1.1403, test_f1: 0.6145
 epoch: 58, train_loss: 0.5925, test_loss: 1.1898, test_f1: 0.5995
 epoch: 59, train_loss: 0.5956, test_loss: 1.1532, test_f1: 0.6011
 epoch: 60, train_loss: 0.5850, test_loss: 1.1249, test_f1: 0.6018
 epoch: 61, train_loss: 0.5968, test_loss: 1.1820, test_f1: 0.6237
 epoch: 62, train_loss: 0.5848, test_loss: 1.2164, test_f1: 0.6018
 epoch: 63, train_loss: 0.5898, test_loss: 1.1947, test_f1: 0.6099
 epoch: 64, train_loss: 0.5797, test_loss: 1.1995, test_f1: 0.6140
 epoch: 65, train_loss: 0.5709, test_loss: 1.1985, test_f1: 0.6125
 epoch: 66, train_loss: 0.5609, test_loss: 1.2046, test_f1: 0.6230
 epoch: 67, train_loss: 0.5545, test_loss: 1.2092, test_f1: 0.5969
 epoch: 68, train_loss: 0.5546, test_loss: 1.2182, test_f1: 0.6226
 epoch: 69, train_loss: 0.5689, test_loss: 1.2286, test_f1: 0.6065
 epoch: 70, train_loss: 0.5481, test_loss: 1.2138, test_f1: 0.6166
 epoch: 71, train_loss: 0.5649, test_loss: 1.1974, test_f1: 0.6301
 epoch: 72, train_loss: 0.5597, test_loss: 1.2220, test_f1: 0.6105
 epoch: 73, train_loss: 0.5456, test_loss: 1.2756, test_f1: 0.6137
 epoch: 74, train_loss: 0.5323, test_loss: 1.2531, test_f1: 0.6310
 epoch: 75, train_loss: 0.5460, test_loss: 1.2869, test_f1: 0.6215
 epoch: 76, train_loss: 0.5245, test_loss: 1.2753, test_f1: 0.6081
 epoch: 77, train_loss: 0.5589, test_loss: 1.3001, test_f1: 0.6100
 epoch: 78, train_loss: 0.5319, test_loss: 1.2936, test_f1: 0.6356
 epoch: 79, train_loss: 0.5357, test_loss: 1.3161, test_f1: 0.6123
 epoch: 80, train_loss: 0.5312, test_loss: 1.3023, test_f1: 0.6191
 epoch: 81, train_loss: 0.5351, test_loss: 1.3654, test_f1: 0.6112
 epoch: 82, train_loss: 0.5512, test_loss: 1.2698, test_f1: 0.6062
 epoch: 83, train_loss: 0.5256, test_loss: 1.3144, test_f1: 0.6128
 epoch: 84, train_loss: 0.5134, test_loss: 1.3319, test_f1: 0.6300
 epoch: 85, train_loss: 0.5136, test_loss: 1.3406, test_f1: 0.5957
 epoch: 86, train_loss: 0.5001, test_loss: 1.3229, test_f1: 0.5879
 epoch: 87, train_loss: 0.5036, test_loss: 1.3984, test_f1: 0.6215
 epoch: 88, train_loss: 0.5069, test_loss: 1.3489, test_f1: 0.6144
 epoch: 89, train_loss: 0.4938, test_loss: 1.4047, test_f1: 0.6128
 epoch: 90, train_loss: 0.5000, test_loss: 1.3462, test_f1: 0.6170
 epoch: 91, train_loss: 0.5019, test_loss: 1.3863, test_f1: 0.6288
 epoch: 92, train_loss: 0.4969, test_loss: 1.3575, test_f1: 0.6335
 epoch: 93, train_loss: 0.5114, test_loss: 1.3851, test_f1: 0.6442
 epoch: 94, train_loss: 0.5199, test_loss: 1.3871, test_f1: 0.6296
 epoch: 95, train_loss: 0.4969, test_loss: 1.3651, test_f1: 0.6299
 epoch: 96, train_loss: 0.4842, test_loss: 1.4075, test_f1: 0.6275
 epoch: 97, train_loss: 0.4741, test_loss: 1.3670, test_f1: 0.6480
 epoch: 98, train_loss: 0.4757, test_loss: 1.3849, test_f1: 0.6353
 epoch: 99, train_loss: 0.5034, test_loss: 1.4609, test_f1: 0.6382
##################ITERATION #9 ****************************************
 epoch: 0, train_loss: 1.2565, test_loss: 1.3326, test_f1: 0.2629
 epoch: 1, train_loss: 1.0895, test_loss: 1.3027, test_f1: 0.2366
 epoch: 2, train_loss: 1.0624, test_loss: 1.1901, test_f1: 0.4499
 epoch: 3, train_loss: 1.0443, test_loss: 1.0975, test_f1: 0.5274
 epoch: 4, train_loss: 0.9999, test_loss: 1.0733, test_f1: 0.5019
 epoch: 5, train_loss: 0.9802, test_loss: 1.0687, test_f1: 0.5249
 epoch: 6, train_loss: 0.9617, test_loss: 1.0470, test_f1: 0.5449
 epoch: 7, train_loss: 0.9563, test_loss: 1.0653, test_f1: 0.5299
 epoch: 8, train_loss: 0.9213, test_loss: 1.0579, test_f1: 0.5390
 epoch: 9, train_loss: 0.9450, test_loss: 1.0535, test_f1: 0.5403
 epoch: 10, train_loss: 0.9348, test_loss: 1.0393, test_f1: 0.5445
 epoch: 11, train_loss: 0.9155, test_loss: 1.0416, test_f1: 0.5735
 epoch: 12, train_loss: 0.9078, test_loss: 1.0041, test_f1: 0.5677
 epoch: 13, train_loss: 0.8727, test_loss: 1.0059, test_f1: 0.5701
 epoch: 14, train_loss: 0.8628, test_loss: 1.0360, test_f1: 0.5728
 epoch: 15, train_loss: 0.8487, test_loss: 1.0301, test_f1: 0.5891
 epoch: 16, train_loss: 0.8464, test_loss: 1.0240, test_f1: 0.5807
 epoch: 17, train_loss: 0.8347, test_loss: 1.0074, test_f1: 0.6081
 epoch: 18, train_loss: 0.8199, test_loss: 1.0020, test_f1: 0.5911
 epoch: 19, train_loss: 0.8236, test_loss: 1.0084, test_f1: 0.6029
 epoch: 20, train_loss: 0.8168, test_loss: 1.0318, test_f1: 0.6011
 epoch: 21, train_loss: 0.8202, test_loss: 1.0239, test_f1: 0.6012
 epoch: 22, train_loss: 0.8079, test_loss: 1.0205, test_f1: 0.5720
 epoch: 23, train_loss: 0.7985, test_loss: 1.0296, test_f1: 0.5894
 epoch: 24, train_loss: 0.7994, test_loss: 1.0204, test_f1: 0.6245
 epoch: 25, train_loss: 0.7837, test_loss: 1.0277, test_f1: 0.6090
 epoch: 26, train_loss: 0.7723, test_loss: 1.0391, test_f1: 0.5924
 epoch: 27, train_loss: 0.7813, test_loss: 0.9984, test_f1: 0.5998
 epoch: 28, train_loss: 0.7676, test_loss: 1.0007, test_f1: 0.6302
 epoch: 29, train_loss: 0.7608, test_loss: 1.0080, test_f1: 0.5952
 epoch: 30, train_loss: 0.7509, test_loss: 1.0187, test_f1: 0.6229
 epoch: 31, train_loss: 0.7497, test_loss: 1.0109, test_f1: 0.6207
 epoch: 32, train_loss: 0.7363, test_loss: 1.0538, test_f1: 0.6153
 epoch: 33, train_loss: 0.7417, test_loss: 1.1160, test_f1: 0.5835
 epoch: 34, train_loss: 0.7368, test_loss: 1.0219, test_f1: 0.5983
 epoch: 35, train_loss: 0.7237, test_loss: 1.0666, test_f1: 0.6002
 epoch: 36, train_loss: 0.7493, test_loss: 1.0832, test_f1: 0.6133
 epoch: 37, train_loss: 0.7179, test_loss: 1.1146, test_f1: 0.6026
 epoch: 38, train_loss: 0.7319, test_loss: 1.1386, test_f1: 0.5895
 epoch: 39, train_loss: 0.7018, test_loss: 1.1053, test_f1: 0.6004
 epoch: 40, train_loss: 0.6890, test_loss: 1.2075, test_f1: 0.5984
 epoch: 41, train_loss: 0.6985, test_loss: 1.1346, test_f1: 0.6121
 epoch: 42, train_loss: 0.6990, test_loss: 1.1742, test_f1: 0.5901
 epoch: 43, train_loss: 0.6691, test_loss: 1.1799, test_f1: 0.6066
 epoch: 44, train_loss: 0.6676, test_loss: 1.0856, test_f1: 0.6085
 epoch: 45, train_loss: 0.6643, test_loss: 1.1547, test_f1: 0.6087
 epoch: 46, train_loss: 0.6526, test_loss: 1.1473, test_f1: 0.5970
 epoch: 47, train_loss: 0.6468, test_loss: 1.2399, test_f1: 0.5873
 epoch: 48, train_loss: 0.6467, test_loss: 1.1528, test_f1: 0.5990
 epoch: 49, train_loss: 0.6396, test_loss: 1.2585, test_f1: 0.5943
 epoch: 50, train_loss: 0.6469, test_loss: 1.2480, test_f1: 0.5889
 epoch: 51, train_loss: 0.6267, test_loss: 1.1725, test_f1: 0.5991
 epoch: 52, train_loss: 0.5992, test_loss: 1.2485, test_f1: 0.5987
 epoch: 53, train_loss: 0.6230, test_loss: 1.2434, test_f1: 0.6067
 epoch: 54, train_loss: 0.6077, test_loss: 1.2513, test_f1: 0.5870
 epoch: 55, train_loss: 0.5995, test_loss: 1.2448, test_f1: 0.5938
 epoch: 56, train_loss: 0.5904, test_loss: 1.2308, test_f1: 0.5966
 epoch: 57, train_loss: 0.5889, test_loss: 1.2751, test_f1: 0.5896
 epoch: 58, train_loss: 0.6044, test_loss: 1.2693, test_f1: 0.5991
 epoch: 59, train_loss: 0.5961, test_loss: 1.3183, test_f1: 0.5942
 epoch: 60, train_loss: 0.5911, test_loss: 1.3620, test_f1: 0.5877
 epoch: 61, train_loss: 0.5884, test_loss: 1.3322, test_f1: 0.5958
 epoch: 62, train_loss: 0.5902, test_loss: 1.3149, test_f1: 0.5808
 epoch: 63, train_loss: 0.5759, test_loss: 1.3101, test_f1: 0.6060
 epoch: 64, train_loss: 0.5882, test_loss: 1.3561, test_f1: 0.5810
 epoch: 65, train_loss: 0.5708, test_loss: 1.2892, test_f1: 0.5891
 epoch: 66, train_loss: 0.5590, test_loss: 1.3274, test_f1: 0.5960
 epoch: 67, train_loss: 0.5701, test_loss: 1.3757, test_f1: 0.5782
 epoch: 68, train_loss: 0.5843, test_loss: 1.3384, test_f1: 0.5916
 epoch: 69, train_loss: 0.5607, test_loss: 1.3530, test_f1: 0.5964
 epoch: 70, train_loss: 0.5542, test_loss: 1.3806, test_f1: 0.5814
 epoch: 71, train_loss: 0.5711, test_loss: 1.3659, test_f1: 0.5948
 epoch: 72, train_loss: 0.5379, test_loss: 1.3252, test_f1: 0.6122
 epoch: 73, train_loss: 0.5469, test_loss: 1.3754, test_f1: 0.5830
 epoch: 74, train_loss: 0.5494, test_loss: 1.3337, test_f1: 0.5938
 epoch: 75, train_loss: 0.5352, test_loss: 1.3679, test_f1: 0.5923
 epoch: 76, train_loss: 0.5260, test_loss: 1.4046, test_f1: 0.6131
 epoch: 77, train_loss: 0.5212, test_loss: 1.4141, test_f1: 0.5916
 epoch: 78, train_loss: 0.5192, test_loss: 1.4849, test_f1: 0.5783
 epoch: 79, train_loss: 0.5346, test_loss: 1.4370, test_f1: 0.5980
 epoch: 80, train_loss: 0.5206, test_loss: 1.4076, test_f1: 0.6034
 epoch: 81, train_loss: 0.5414, test_loss: 1.4551, test_f1: 0.5981
 epoch: 82, train_loss: 0.5106, test_loss: 1.5218, test_f1: 0.5874
 epoch: 83, train_loss: 0.5036, test_loss: 1.4520, test_f1: 0.5811
 epoch: 84, train_loss: 0.5052, test_loss: 1.4741, test_f1: 0.5954
 epoch: 85, train_loss: 0.4969, test_loss: 1.5105, test_f1: 0.5812
 epoch: 86, train_loss: 0.4998, test_loss: 1.4769, test_f1: 0.5913
 epoch: 87, train_loss: 0.5015, test_loss: 1.4555, test_f1: 0.5957
 epoch: 88, train_loss: 0.5124, test_loss: 1.4922, test_f1: 0.5910
 epoch: 89, train_loss: 0.4902, test_loss: 1.5115, test_f1: 0.5833
 epoch: 90, train_loss: 0.5203, test_loss: 1.4813, test_f1: 0.5960
 epoch: 91, train_loss: 0.4858, test_loss: 1.5110, test_f1: 0.5833
 epoch: 92, train_loss: 0.4798, test_loss: 1.5010, test_f1: 0.5797
 epoch: 93, train_loss: 0.4836, test_loss: 1.5542, test_f1: 0.5714
 epoch: 94, train_loss: 0.4766, test_loss: 1.4869, test_f1: 0.5889
 epoch: 95, train_loss: 0.4880, test_loss: 1.5135, test_f1: 0.5927
 epoch: 96, train_loss: 0.4818, test_loss: 1.4926, test_f1: 0.6084
 epoch: 97, train_loss: 0.4778, test_loss: 1.5908, test_f1: 0.5858
 epoch: 98, train_loss: 0.4638, test_loss: 1.5972, test_f1: 0.5850
 epoch: 99, train_loss: 0.4625, test_loss: 1.6465, test_f1: 0.5912

Training completed in 507.72 seconds
Best F1: 0.6539 at epoch 66
Mean F1 across iterations: 0.6288  0.0154
========================FINAL RESULTS================================
FEGIN weighted F1: 0.6539  0.0154
python main.py --data ltspice_demos --representation component_net --model FEGIN --layers 5 --hiddens 128 --batch_size 64 --lr 0.0001 --emb_size 128 --epochs 100 --save_appendix component_net_L5_H128_BS64_LR0.0001_E128 --no_val
-----



STDERR:
  File "main.py", line 370, in <module>
    main()
  File "main.py", line 254, in main
    dataset = dataset_class(
  File "/home/philip/projects/ltspice_examples_code_repo/Circuit-Completion-Using-GNNs/component_classification_with_link_prediction_head/evaluation/FEGIN/kernel/circuit_datasets.py", line 15, in __init__
    self.data, self.slices = torch.load(self.processed_paths[0])
  File "/home/philip/.local/lib/python3.8/site-packages/torch/serialization.py", line 1040, in load
    warnings.warn(
  File "/usr/lib/python3.8/warnings.py", line 109, in _showwarnmsg
    sw(msg.message, msg.category, msg.filename, msg.lineno,
  File "main.py", line 47, in warn_with_traceback
    traceback.print_stack(file=log)
/home/philip/projects/ltspice_examples_code_repo/Circuit-Completion-Using-GNNs/component_classification_with_link_prediction_head/evaluation/FEGIN/kernel/circuit_datasets.py:15: FutureWarning: You are using `torch.load` with `weights_only=False` (the current default value), which uses the default pickle module implicitly. It is possible to construct malicious pickle data which will execute arbitrary code during unpickling (See https://github.com/pytorch/pytorch/blob/main/SECURITY.md#untrusted-models for more details). In a future release, the default value for `weights_only` will be flipped to `True`. This limits the functions that could be executed during unpickling. Arbitrary objects will no longer be allowed to be loaded via this mode unless they are explicitly allowlisted by the user via `torch.serialization.add_safe_globals`. We recommend you start setting `weights_only=True` for any use case where you don't have full control of the loaded file. Please open an issue on GitHub for any issues related to this experimental feature.
  self.data, self.slices = torch.load(self.processed_paths[0])
