STDOUT:
Results will be saved in /home/philip/projects/ltspice_examples_code_repo/Circuit-Completion-Using-GNNs/component_classification_with_link_prediction_head/evaluation/FEGIN/results/model_FEGIN_dataset_ltspice_examples
Command line input: python main.py --data ltspice_examples --representation component_pin --model FEGIN --layers 2 --hiddens 128 --batch_size 32 --lr 0.0001 --emb_size 128 --epochs 100 --save_appendix component_pin_L2_H128_BS32_LR0.0001_E128 --no_val
 is saved.
-----
ltspice_examples - FEGIN
Using 2 layers, 128 hidden units, h = 2
Loading component_pin representation dataset
ENTERED
Training FEGIN on component_pin representation
Train: 3560, Test: 848
##################ITERATION #0 ****************************************
 epoch: 0, train_loss: 1.3325, test_loss: 1.2092, test_f1: 0.3361
 epoch: 1, train_loss: 1.1549, test_loss: 1.0860, test_f1: 0.3445
 epoch: 2, train_loss: 1.0702, test_loss: 1.0555, test_f1: 0.3432
 epoch: 3, train_loss: 1.0382, test_loss: 1.0430, test_f1: 0.3701
 epoch: 4, train_loss: 1.0173, test_loss: 1.0260, test_f1: 0.4246
 epoch: 5, train_loss: 0.9932, test_loss: 1.0130, test_f1: 0.4346
 epoch: 6, train_loss: 0.9772, test_loss: 1.0105, test_f1: 0.4890
 epoch: 7, train_loss: 0.9627, test_loss: 1.0056, test_f1: 0.5029
 epoch: 8, train_loss: 0.9569, test_loss: 1.0074, test_f1: 0.4707
 epoch: 9, train_loss: 0.9343, test_loss: 0.9978, test_f1: 0.4784
 epoch: 10, train_loss: 0.9242, test_loss: 0.9918, test_f1: 0.4969
 epoch: 11, train_loss: 0.9026, test_loss: 0.9869, test_f1: 0.5035
 epoch: 12, train_loss: 0.8939, test_loss: 0.9367, test_f1: 0.5192
 epoch: 13, train_loss: 0.8811, test_loss: 0.9444, test_f1: 0.5149
 epoch: 14, train_loss: 0.8615, test_loss: 0.9224, test_f1: 0.5254
 epoch: 15, train_loss: 0.8488, test_loss: 0.9216, test_f1: 0.5273
 epoch: 16, train_loss: 0.8420, test_loss: 0.9093, test_f1: 0.5396
 epoch: 17, train_loss: 0.8292, test_loss: 0.9020, test_f1: 0.5467
 epoch: 18, train_loss: 0.8245, test_loss: 0.8890, test_f1: 0.5387
 epoch: 19, train_loss: 0.8019, test_loss: 0.8935, test_f1: 0.5466
 epoch: 20, train_loss: 0.7939, test_loss: 0.8933, test_f1: 0.5519
 epoch: 21, train_loss: 0.7903, test_loss: 0.9093, test_f1: 0.5443
 epoch: 22, train_loss: 0.7871, test_loss: 0.8899, test_f1: 0.5551
 epoch: 23, train_loss: 0.7691, test_loss: 0.8900, test_f1: 0.5475
 epoch: 24, train_loss: 0.7545, test_loss: 0.9084, test_f1: 0.5542
 epoch: 25, train_loss: 0.7577, test_loss: 0.8800, test_f1: 0.5602
 epoch: 26, train_loss: 0.7460, test_loss: 0.8928, test_f1: 0.5702
 epoch: 27, train_loss: 0.7366, test_loss: 0.8991, test_f1: 0.5480
 epoch: 28, train_loss: 0.7339, test_loss: 0.8965, test_f1: 0.5652
 epoch: 29, train_loss: 0.7215, test_loss: 0.9087, test_f1: 0.5825
 epoch: 30, train_loss: 0.7203, test_loss: 0.8981, test_f1: 0.5629
 epoch: 31, train_loss: 0.7110, test_loss: 0.9190, test_f1: 0.5789
 epoch: 32, train_loss: 0.7078, test_loss: 0.9205, test_f1: 0.5747
 epoch: 33, train_loss: 0.6922, test_loss: 0.9049, test_f1: 0.5731
 epoch: 34, train_loss: 0.6943, test_loss: 0.9611, test_f1: 0.5609
 epoch: 35, train_loss: 0.6891, test_loss: 0.9162, test_f1: 0.5725
 epoch: 36, train_loss: 0.6793, test_loss: 0.9341, test_f1: 0.5831
 epoch: 37, train_loss: 0.6821, test_loss: 0.9534, test_f1: 0.5917
 epoch: 38, train_loss: 0.6601, test_loss: 0.9625, test_f1: 0.5791
 epoch: 39, train_loss: 0.6704, test_loss: 0.9519, test_f1: 0.5747
 epoch: 40, train_loss: 0.6508, test_loss: 0.9183, test_f1: 0.5737
 epoch: 41, train_loss: 0.6465, test_loss: 0.9445, test_f1: 0.5867
 epoch: 42, train_loss: 0.6486, test_loss: 0.9280, test_f1: 0.5738
 epoch: 43, train_loss: 0.6599, test_loss: 0.9396, test_f1: 0.5975
 epoch: 44, train_loss: 0.6367, test_loss: 0.9591, test_f1: 0.6106
 epoch: 45, train_loss: 0.6296, test_loss: 0.9622, test_f1: 0.6152
 epoch: 46, train_loss: 0.6401, test_loss: 1.0371, test_f1: 0.5649
 epoch: 47, train_loss: 0.6281, test_loss: 0.9620, test_f1: 0.6093
 epoch: 48, train_loss: 0.6163, test_loss: 0.9645, test_f1: 0.6316
 epoch: 49, train_loss: 0.6169, test_loss: 0.9437, test_f1: 0.6270
 epoch: 50, train_loss: 0.6103, test_loss: 0.9700, test_f1: 0.6201
 epoch: 51, train_loss: 0.6106, test_loss: 0.9827, test_f1: 0.6091
 epoch: 52, train_loss: 0.6049, test_loss: 0.9889, test_f1: 0.6038
 epoch: 53, train_loss: 0.5995, test_loss: 0.9808, test_f1: 0.5940
 epoch: 54, train_loss: 0.5874, test_loss: 1.0030, test_f1: 0.6073
 epoch: 55, train_loss: 0.5922, test_loss: 0.9901, test_f1: 0.5978
 epoch: 56, train_loss: 0.5874, test_loss: 0.9986, test_f1: 0.6205
 epoch: 57, train_loss: 0.5774, test_loss: 1.0063, test_f1: 0.6165
 epoch: 58, train_loss: 0.5856, test_loss: 0.9636, test_f1: 0.6118
 epoch: 59, train_loss: 0.5913, test_loss: 1.0256, test_f1: 0.6194
 epoch: 60, train_loss: 0.5844, test_loss: 0.9993, test_f1: 0.6155
 epoch: 61, train_loss: 0.5745, test_loss: 1.0425, test_f1: 0.6195
 epoch: 62, train_loss: 0.5838, test_loss: 0.9706, test_f1: 0.6175
 epoch: 63, train_loss: 0.5727, test_loss: 1.0100, test_f1: 0.6192
 epoch: 64, train_loss: 0.5701, test_loss: 1.0194, test_f1: 0.6185
 epoch: 65, train_loss: 0.5640, test_loss: 1.0364, test_f1: 0.6250
 epoch: 66, train_loss: 0.5579, test_loss: 1.0357, test_f1: 0.6282
 epoch: 67, train_loss: 0.5654, test_loss: 1.0001, test_f1: 0.6129
 epoch: 68, train_loss: 0.5581, test_loss: 1.0734, test_f1: 0.6140
 epoch: 69, train_loss: 0.5442, test_loss: 1.0356, test_f1: 0.6082
 epoch: 70, train_loss: 0.5595, test_loss: 1.0297, test_f1: 0.6211
 epoch: 71, train_loss: 0.5392, test_loss: 1.0657, test_f1: 0.5952
 epoch: 72, train_loss: 0.5518, test_loss: 1.0311, test_f1: 0.6321
 epoch: 73, train_loss: 0.5528, test_loss: 1.0734, test_f1: 0.6055
 epoch: 74, train_loss: 0.5360, test_loss: 1.0438, test_f1: 0.6289
 epoch: 75, train_loss: 0.5513, test_loss: 1.0607, test_f1: 0.6354
 epoch: 76, train_loss: 0.5435, test_loss: 1.1388, test_f1: 0.6144
 epoch: 77, train_loss: 0.5344, test_loss: 1.0821, test_f1: 0.6257
 epoch: 78, train_loss: 0.5439, test_loss: 1.0769, test_f1: 0.6257
 epoch: 79, train_loss: 0.5205, test_loss: 1.1483, test_f1: 0.6110
 epoch: 80, train_loss: 0.5247, test_loss: 1.0631, test_f1: 0.6395
 epoch: 81, train_loss: 0.5236, test_loss: 1.1164, test_f1: 0.5971
 epoch: 82, train_loss: 0.5278, test_loss: 1.1227, test_f1: 0.6048
 epoch: 83, train_loss: 0.5288, test_loss: 1.0922, test_f1: 0.6313
 epoch: 84, train_loss: 0.5267, test_loss: 1.1053, test_f1: 0.6175
 epoch: 85, train_loss: 0.5232, test_loss: 1.1513, test_f1: 0.6133
 epoch: 86, train_loss: 0.5303, test_loss: 1.1227, test_f1: 0.6309
 epoch: 87, train_loss: 0.5244, test_loss: 1.1332, test_f1: 0.6211
 epoch: 88, train_loss: 0.5158, test_loss: 1.1299, test_f1: 0.6373
 epoch: 89, train_loss: 0.5136, test_loss: 1.1335, test_f1: 0.6416
 epoch: 90, train_loss: 0.5241, test_loss: 1.1346, test_f1: 0.6210
 epoch: 91, train_loss: 0.5073, test_loss: 1.0967, test_f1: 0.6325
 epoch: 92, train_loss: 0.5124, test_loss: 1.1407, test_f1: 0.6176
 epoch: 93, train_loss: 0.5205, test_loss: 1.1433, test_f1: 0.6242
 epoch: 94, train_loss: 0.5015, test_loss: 1.1689, test_f1: 0.6465
 epoch: 95, train_loss: 0.5185, test_loss: 1.1704, test_f1: 0.5881
 epoch: 96, train_loss: 0.5139, test_loss: 1.1678, test_f1: 0.6368
 epoch: 97, train_loss: 0.5095, test_loss: 1.1335, test_f1: 0.6359
 epoch: 98, train_loss: 0.4921, test_loss: 1.1946, test_f1: 0.6203
 epoch: 99, train_loss: 0.5063, test_loss: 1.1311, test_f1: 0.6329
##################ITERATION #1 ****************************************
 epoch: 0, train_loss: 1.2180, test_loss: 1.0760, test_f1: 0.3874
 epoch: 1, train_loss: 1.0531, test_loss: 0.9970, test_f1: 0.4733
 epoch: 2, train_loss: 1.0018, test_loss: 0.9768, test_f1: 0.5245
 epoch: 3, train_loss: 0.9647, test_loss: 0.9555, test_f1: 0.5084
 epoch: 4, train_loss: 0.9395, test_loss: 0.9135, test_f1: 0.5134
 epoch: 5, train_loss: 0.9064, test_loss: 0.8996, test_f1: 0.5347
 epoch: 6, train_loss: 0.8885, test_loss: 0.9138, test_f1: 0.5377
 epoch: 7, train_loss: 0.8651, test_loss: 0.8648, test_f1: 0.5409
 epoch: 8, train_loss: 0.8487, test_loss: 0.8685, test_f1: 0.5459
 epoch: 9, train_loss: 0.8337, test_loss: 0.8633, test_f1: 0.5347
 epoch: 10, train_loss: 0.8265, test_loss: 0.8811, test_f1: 0.5561
 epoch: 11, train_loss: 0.8100, test_loss: 0.8707, test_f1: 0.5620
 epoch: 12, train_loss: 0.7829, test_loss: 0.8918, test_f1: 0.5562
 epoch: 13, train_loss: 0.7861, test_loss: 0.7990, test_f1: 0.5642
 epoch: 14, train_loss: 0.7746, test_loss: 0.8349, test_f1: 0.5583
 epoch: 15, train_loss: 0.7548, test_loss: 0.8688, test_f1: 0.5620
 epoch: 16, train_loss: 0.7618, test_loss: 0.8387, test_f1: 0.5678
 epoch: 17, train_loss: 0.7563, test_loss: 0.8374, test_f1: 0.5680
 epoch: 18, train_loss: 0.7441, test_loss: 0.8795, test_f1: 0.5791
 epoch: 19, train_loss: 0.7292, test_loss: 0.8463, test_f1: 0.5634
 epoch: 20, train_loss: 0.7259, test_loss: 0.8548, test_f1: 0.5808
 epoch: 21, train_loss: 0.7194, test_loss: 0.8657, test_f1: 0.5838
 epoch: 22, train_loss: 0.7162, test_loss: 0.8161, test_f1: 0.5875
 epoch: 23, train_loss: 0.7124, test_loss: 0.8296, test_f1: 0.5729
 epoch: 24, train_loss: 0.7017, test_loss: 0.8399, test_f1: 0.6161
 epoch: 25, train_loss: 0.6983, test_loss: 0.8237, test_f1: 0.5859
 epoch: 26, train_loss: 0.6867, test_loss: 0.8563, test_f1: 0.5485
 epoch: 27, train_loss: 0.6844, test_loss: 0.8236, test_f1: 0.5919
 epoch: 28, train_loss: 0.6798, test_loss: 0.8377, test_f1: 0.5891
 epoch: 29, train_loss: 0.6874, test_loss: 0.8637, test_f1: 0.5970
 epoch: 30, train_loss: 0.6731, test_loss: 0.8433, test_f1: 0.5925
 epoch: 31, train_loss: 0.6651, test_loss: 0.8344, test_f1: 0.5850
 epoch: 32, train_loss: 0.6530, test_loss: 0.8516, test_f1: 0.5974
 epoch: 33, train_loss: 0.6600, test_loss: 0.8797, test_f1: 0.6024
 epoch: 34, train_loss: 0.6581, test_loss: 0.8445, test_f1: 0.6155
 epoch: 35, train_loss: 0.6537, test_loss: 0.8503, test_f1: 0.6300
 epoch: 36, train_loss: 0.6360, test_loss: 0.8535, test_f1: 0.6034
 epoch: 37, train_loss: 0.6321, test_loss: 0.7986, test_f1: 0.6457
 epoch: 38, train_loss: 0.6320, test_loss: 0.8252, test_f1: 0.6179
 epoch: 39, train_loss: 0.6291, test_loss: 0.8442, test_f1: 0.6345
 epoch: 40, train_loss: 0.6410, test_loss: 0.8705, test_f1: 0.6068
 epoch: 41, train_loss: 0.6128, test_loss: 0.8440, test_f1: 0.6427
 epoch: 42, train_loss: 0.6083, test_loss: 0.8417, test_f1: 0.6326
 epoch: 43, train_loss: 0.6122, test_loss: 0.8418, test_f1: 0.6312
 epoch: 44, train_loss: 0.6014, test_loss: 0.9068, test_f1: 0.6044
 epoch: 45, train_loss: 0.6086, test_loss: 0.8482, test_f1: 0.6252
 epoch: 46, train_loss: 0.6079, test_loss: 0.9021, test_f1: 0.6307
 epoch: 47, train_loss: 0.5941, test_loss: 0.8531, test_f1: 0.6298
 epoch: 48, train_loss: 0.5912, test_loss: 0.9149, test_f1: 0.6067
 epoch: 49, train_loss: 0.5936, test_loss: 0.8553, test_f1: 0.6245
 epoch: 50, train_loss: 0.5743, test_loss: 0.8684, test_f1: 0.6259
 epoch: 51, train_loss: 0.5752, test_loss: 0.8777, test_f1: 0.6295
 epoch: 52, train_loss: 0.5631, test_loss: 0.8786, test_f1: 0.6358
 epoch: 53, train_loss: 0.5574, test_loss: 0.8523, test_f1: 0.6267
 epoch: 54, train_loss: 0.5607, test_loss: 0.8881, test_f1: 0.6208
 epoch: 55, train_loss: 0.5462, test_loss: 0.8594, test_f1: 0.6201
 epoch: 56, train_loss: 0.5512, test_loss: 0.8592, test_f1: 0.6237
 epoch: 57, train_loss: 0.5391, test_loss: 0.8718, test_f1: 0.6304
 epoch: 58, train_loss: 0.5542, test_loss: 0.8617, test_f1: 0.6242
 epoch: 59, train_loss: 0.5356, test_loss: 0.8990, test_f1: 0.6366
 epoch: 60, train_loss: 0.5499, test_loss: 0.9104, test_f1: 0.6037
 epoch: 61, train_loss: 0.5462, test_loss: 0.8686, test_f1: 0.6304
 epoch: 62, train_loss: 0.5438, test_loss: 0.8980, test_f1: 0.6448
 epoch: 63, train_loss: 0.5259, test_loss: 0.9080, test_f1: 0.6385
 epoch: 64, train_loss: 0.5222, test_loss: 0.8864, test_f1: 0.6436
 epoch: 65, train_loss: 0.5252, test_loss: 0.9079, test_f1: 0.6291
 epoch: 66, train_loss: 0.5272, test_loss: 0.9258, test_f1: 0.6265
 epoch: 67, train_loss: 0.5321, test_loss: 0.9864, test_f1: 0.6264
 epoch: 68, train_loss: 0.5365, test_loss: 0.8592, test_f1: 0.6475
 epoch: 69, train_loss: 0.5311, test_loss: 0.8796, test_f1: 0.6310
 epoch: 70, train_loss: 0.5250, test_loss: 0.9335, test_f1: 0.6233
 epoch: 71, train_loss: 0.5146, test_loss: 0.9599, test_f1: 0.6297
 epoch: 72, train_loss: 0.5221, test_loss: 0.9236, test_f1: 0.6138
 epoch: 73, train_loss: 0.5265, test_loss: 0.9039, test_f1: 0.6330
 epoch: 74, train_loss: 0.5155, test_loss: 0.9344, test_f1: 0.6402
 epoch: 75, train_loss: 0.5195, test_loss: 0.8445, test_f1: 0.6174
 epoch: 76, train_loss: 0.5007, test_loss: 0.8641, test_f1: 0.6378
 epoch: 77, train_loss: 0.5063, test_loss: 0.9009, test_f1: 0.6472
 epoch: 78, train_loss: 0.4944, test_loss: 0.9252, test_f1: 0.6420
 epoch: 79, train_loss: 0.5005, test_loss: 0.8919, test_f1: 0.6265
 epoch: 80, train_loss: 0.5072, test_loss: 0.9386, test_f1: 0.6354
 epoch: 81, train_loss: 0.4911, test_loss: 0.9308, test_f1: 0.6233
 epoch: 82, train_loss: 0.5046, test_loss: 0.9722, test_f1: 0.6437
 epoch: 83, train_loss: 0.4899, test_loss: 0.9382, test_f1: 0.6305
 epoch: 84, train_loss: 0.5006, test_loss: 0.9494, test_f1: 0.6363
 epoch: 85, train_loss: 0.4837, test_loss: 0.9675, test_f1: 0.6397
 epoch: 86, train_loss: 0.5023, test_loss: 0.9497, test_f1: 0.6186
 epoch: 87, train_loss: 0.4854, test_loss: 0.8959, test_f1: 0.6343
 epoch: 88, train_loss: 0.4910, test_loss: 0.9383, test_f1: 0.6423
 epoch: 89, train_loss: 0.4855, test_loss: 0.9230, test_f1: 0.6422
 epoch: 90, train_loss: 0.4853, test_loss: 1.0145, test_f1: 0.6271
 epoch: 91, train_loss: 0.4697, test_loss: 1.0038, test_f1: 0.6468
 epoch: 92, train_loss: 0.4766, test_loss: 0.9501, test_f1: 0.6354
 epoch: 93, train_loss: 0.4870, test_loss: 0.9230, test_f1: 0.6363
 epoch: 94, train_loss: 0.4694, test_loss: 0.9275, test_f1: 0.6512
 epoch: 95, train_loss: 0.4747, test_loss: 0.8862, test_f1: 0.6424
 epoch: 96, train_loss: 0.4916, test_loss: 0.9720, test_f1: 0.6448
 epoch: 97, train_loss: 0.4787, test_loss: 0.9321, test_f1: 0.6381
 epoch: 98, train_loss: 0.4721, test_loss: 1.0239, test_f1: 0.6335
 epoch: 99, train_loss: 0.4714, test_loss: 0.9670, test_f1: 0.6422
##################ITERATION #2 ****************************************
 epoch: 0, train_loss: 1.1683, test_loss: 1.0170, test_f1: 0.4169
 epoch: 1, train_loss: 1.0268, test_loss: 0.9752, test_f1: 0.4866
 epoch: 2, train_loss: 0.9911, test_loss: 0.9766, test_f1: 0.4908
 epoch: 3, train_loss: 0.9586, test_loss: 0.9593, test_f1: 0.5386
 epoch: 4, train_loss: 0.9332, test_loss: 0.9305, test_f1: 0.5226
 epoch: 5, train_loss: 0.9162, test_loss: 0.9220, test_f1: 0.5396
 epoch: 6, train_loss: 0.9003, test_loss: 0.9257, test_f1: 0.5568
 epoch: 7, train_loss: 0.8759, test_loss: 0.9220, test_f1: 0.5456
 epoch: 8, train_loss: 0.8647, test_loss: 0.9252, test_f1: 0.5693
 epoch: 9, train_loss: 0.8457, test_loss: 0.8926, test_f1: 0.5760
 epoch: 10, train_loss: 0.8359, test_loss: 0.8806, test_f1: 0.5541
 epoch: 11, train_loss: 0.8251, test_loss: 0.8697, test_f1: 0.5635
 epoch: 12, train_loss: 0.8078, test_loss: 0.8518, test_f1: 0.5445
 epoch: 13, train_loss: 0.8013, test_loss: 0.8706, test_f1: 0.5513
 epoch: 14, train_loss: 0.7906, test_loss: 0.8325, test_f1: 0.5805
 epoch: 15, train_loss: 0.7662, test_loss: 0.8555, test_f1: 0.5642
 epoch: 16, train_loss: 0.7742, test_loss: 0.8297, test_f1: 0.5686
 epoch: 17, train_loss: 0.7683, test_loss: 0.8313, test_f1: 0.5507
 epoch: 18, train_loss: 0.7561, test_loss: 0.8412, test_f1: 0.5693
 epoch: 19, train_loss: 0.7415, test_loss: 0.8255, test_f1: 0.5698
 epoch: 20, train_loss: 0.7247, test_loss: 0.8248, test_f1: 0.6005
 epoch: 21, train_loss: 0.7297, test_loss: 0.8454, test_f1: 0.5767
 epoch: 22, train_loss: 0.7177, test_loss: 0.8412, test_f1: 0.5802
 epoch: 23, train_loss: 0.7113, test_loss: 0.8285, test_f1: 0.5774
 epoch: 24, train_loss: 0.7094, test_loss: 0.7860, test_f1: 0.6030
 epoch: 25, train_loss: 0.7060, test_loss: 0.8196, test_f1: 0.5878
 epoch: 26, train_loss: 0.6960, test_loss: 0.8287, test_f1: 0.5960
 epoch: 27, train_loss: 0.6872, test_loss: 0.7565, test_f1: 0.6298
 epoch: 28, train_loss: 0.6841, test_loss: 0.7837, test_f1: 0.5984
 epoch: 29, train_loss: 0.6730, test_loss: 0.7750, test_f1: 0.6144
 epoch: 30, train_loss: 0.6644, test_loss: 0.7512, test_f1: 0.6237
 epoch: 31, train_loss: 0.6595, test_loss: 0.8029, test_f1: 0.5955
 epoch: 32, train_loss: 0.6551, test_loss: 0.7205, test_f1: 0.6428
 epoch: 33, train_loss: 0.6522, test_loss: 0.8130, test_f1: 0.5971
 epoch: 34, train_loss: 0.6332, test_loss: 0.7886, test_f1: 0.6177
 epoch: 35, train_loss: 0.6296, test_loss: 0.7589, test_f1: 0.6010
 epoch: 36, train_loss: 0.6381, test_loss: 0.7684, test_f1: 0.6328
 epoch: 37, train_loss: 0.6182, test_loss: 0.7538, test_f1: 0.6340
 epoch: 38, train_loss: 0.6223, test_loss: 0.8059, test_f1: 0.6130
 epoch: 39, train_loss: 0.6209, test_loss: 0.7499, test_f1: 0.6291
 epoch: 40, train_loss: 0.6232, test_loss: 0.7350, test_f1: 0.6584
 epoch: 41, train_loss: 0.6105, test_loss: 0.7799, test_f1: 0.6067
 epoch: 42, train_loss: 0.6092, test_loss: 0.7603, test_f1: 0.6367
 epoch: 43, train_loss: 0.6011, test_loss: 0.7812, test_f1: 0.6321
 epoch: 44, train_loss: 0.6051, test_loss: 0.7866, test_f1: 0.6303
 epoch: 45, train_loss: 0.6054, test_loss: 0.8212, test_f1: 0.6247
 epoch: 46, train_loss: 0.5950, test_loss: 0.7541, test_f1: 0.6231
 epoch: 47, train_loss: 0.5751, test_loss: 0.8075, test_f1: 0.6184
 epoch: 48, train_loss: 0.5757, test_loss: 0.8070, test_f1: 0.6428
 epoch: 49, train_loss: 0.5741, test_loss: 0.7818, test_f1: 0.6226
 epoch: 50, train_loss: 0.5717, test_loss: 0.8239, test_f1: 0.6052
 epoch: 51, train_loss: 0.5511, test_loss: 0.8804, test_f1: 0.6125
 epoch: 52, train_loss: 0.5528, test_loss: 0.8141, test_f1: 0.6389
 epoch: 53, train_loss: 0.5399, test_loss: 0.8343, test_f1: 0.6226
 epoch: 54, train_loss: 0.5361, test_loss: 0.7811, test_f1: 0.6279
 epoch: 55, train_loss: 0.5453, test_loss: 0.7914, test_f1: 0.6463
 epoch: 56, train_loss: 0.5285, test_loss: 0.8218, test_f1: 0.6252
 epoch: 57, train_loss: 0.5351, test_loss: 0.8222, test_f1: 0.6242
 epoch: 58, train_loss: 0.5220, test_loss: 0.8550, test_f1: 0.6238
 epoch: 59, train_loss: 0.5298, test_loss: 0.8258, test_f1: 0.6350
 epoch: 60, train_loss: 0.5204, test_loss: 0.8672, test_f1: 0.6178
 epoch: 61, train_loss: 0.5329, test_loss: 0.8241, test_f1: 0.6391
 epoch: 62, train_loss: 0.5201, test_loss: 0.8776, test_f1: 0.6210
 epoch: 63, train_loss: 0.5200, test_loss: 0.8905, test_f1: 0.6524
 epoch: 64, train_loss: 0.5214, test_loss: 0.8673, test_f1: 0.6454
 epoch: 65, train_loss: 0.5167, test_loss: 0.8140, test_f1: 0.6491
 epoch: 66, train_loss: 0.5251, test_loss: 0.8586, test_f1: 0.6412
 epoch: 67, train_loss: 0.5115, test_loss: 0.8485, test_f1: 0.6474
 epoch: 68, train_loss: 0.5141, test_loss: 0.8499, test_f1: 0.6674
 epoch: 69, train_loss: 0.5031, test_loss: 0.8349, test_f1: 0.6613
 epoch: 70, train_loss: 0.5090, test_loss: 0.8107, test_f1: 0.6376
 epoch: 71, train_loss: 0.5094, test_loss: 0.8394, test_f1: 0.6480
 epoch: 72, train_loss: 0.5121, test_loss: 0.8036, test_f1: 0.6422
 epoch: 73, train_loss: 0.5021, test_loss: 0.8034, test_f1: 0.6487
 epoch: 74, train_loss: 0.4991, test_loss: 0.7887, test_f1: 0.6718
 epoch: 75, train_loss: 0.4884, test_loss: 0.8114, test_f1: 0.6624
 epoch: 76, train_loss: 0.4911, test_loss: 0.8076, test_f1: 0.6819
 epoch: 77, train_loss: 0.4936, test_loss: 0.8539, test_f1: 0.6590
 epoch: 78, train_loss: 0.4924, test_loss: 0.8512, test_f1: 0.6655
 epoch: 79, train_loss: 0.4852, test_loss: 0.8952, test_f1: 0.6582
 epoch: 80, train_loss: 0.4836, test_loss: 0.8830, test_f1: 0.6525
 epoch: 81, train_loss: 0.4833, test_loss: 0.8273, test_f1: 0.6264
 epoch: 82, train_loss: 0.4826, test_loss: 0.8259, test_f1: 0.6647
 epoch: 83, train_loss: 0.4748, test_loss: 0.8097, test_f1: 0.6714
 epoch: 84, train_loss: 0.4823, test_loss: 0.8833, test_f1: 0.6444
 epoch: 85, train_loss: 0.4616, test_loss: 0.8051, test_f1: 0.6535
 epoch: 86, train_loss: 0.4635, test_loss: 0.8432, test_f1: 0.6444
 epoch: 87, train_loss: 0.4794, test_loss: 0.8342, test_f1: 0.6450
 epoch: 88, train_loss: 0.4702, test_loss: 0.9075, test_f1: 0.6487
 epoch: 89, train_loss: 0.4555, test_loss: 0.8530, test_f1: 0.6690
 epoch: 90, train_loss: 0.4702, test_loss: 0.8484, test_f1: 0.6676
 epoch: 91, train_loss: 0.4541, test_loss: 0.9704, test_f1: 0.6458
 epoch: 92, train_loss: 0.4606, test_loss: 0.8310, test_f1: 0.6414
 epoch: 93, train_loss: 0.4493, test_loss: 0.9329, test_f1: 0.6395
 epoch: 94, train_loss: 0.4610, test_loss: 0.9489, test_f1: 0.6172
 epoch: 95, train_loss: 0.4636, test_loss: 0.8576, test_f1: 0.6475
 epoch: 96, train_loss: 0.4638, test_loss: 0.8973, test_f1: 0.6471
 epoch: 97, train_loss: 0.4632, test_loss: 0.8820, test_f1: 0.6708
 epoch: 98, train_loss: 0.4502, test_loss: 0.9544, test_f1: 0.6312
 epoch: 99, train_loss: 0.4596, test_loss: 0.9121, test_f1: 0.6629
##################ITERATION #3 ****************************************
 epoch: 0, train_loss: 1.1387, test_loss: 0.9745, test_f1: 0.4940
 epoch: 1, train_loss: 1.0227, test_loss: 0.9478, test_f1: 0.5004
 epoch: 2, train_loss: 0.9888, test_loss: 0.9293, test_f1: 0.5055
 epoch: 3, train_loss: 0.9626, test_loss: 0.9150, test_f1: 0.5596
 epoch: 4, train_loss: 0.9340, test_loss: 0.9043, test_f1: 0.5393
 epoch: 5, train_loss: 0.9238, test_loss: 0.8960, test_f1: 0.5542
 epoch: 6, train_loss: 0.9054, test_loss: 0.8806, test_f1: 0.5817
 epoch: 7, train_loss: 0.8865, test_loss: 0.8669, test_f1: 0.5747
 epoch: 8, train_loss: 0.8838, test_loss: 0.8475, test_f1: 0.5746
 epoch: 9, train_loss: 0.8712, test_loss: 0.8382, test_f1: 0.5807
 epoch: 10, train_loss: 0.8570, test_loss: 0.8565, test_f1: 0.6032
 epoch: 11, train_loss: 0.8417, test_loss: 0.8434, test_f1: 0.5954
 epoch: 12, train_loss: 0.8323, test_loss: 0.8287, test_f1: 0.5948
 epoch: 13, train_loss: 0.8104, test_loss: 0.8373, test_f1: 0.6206
 epoch: 14, train_loss: 0.8102, test_loss: 0.8343, test_f1: 0.6032
 epoch: 15, train_loss: 0.7948, test_loss: 0.8142, test_f1: 0.6114
 epoch: 16, train_loss: 0.7895, test_loss: 0.8128, test_f1: 0.6223
 epoch: 17, train_loss: 0.7728, test_loss: 0.8106, test_f1: 0.6426
 epoch: 18, train_loss: 0.7700, test_loss: 0.8166, test_f1: 0.6162
 epoch: 19, train_loss: 0.7593, test_loss: 0.8088, test_f1: 0.6038
 epoch: 20, train_loss: 0.7505, test_loss: 0.8026, test_f1: 0.6215
 epoch: 21, train_loss: 0.7398, test_loss: 0.8280, test_f1: 0.6335
 epoch: 22, train_loss: 0.7309, test_loss: 0.8311, test_f1: 0.6162
 epoch: 23, train_loss: 0.7322, test_loss: 0.8372, test_f1: 0.6269
 epoch: 24, train_loss: 0.7150, test_loss: 0.8441, test_f1: 0.6137
 epoch: 25, train_loss: 0.7160, test_loss: 0.8245, test_f1: 0.6172
 epoch: 26, train_loss: 0.6983, test_loss: 0.8181, test_f1: 0.6199
 epoch: 27, train_loss: 0.6934, test_loss: 0.8005, test_f1: 0.6324
 epoch: 28, train_loss: 0.6959, test_loss: 0.8303, test_f1: 0.6270
 epoch: 29, train_loss: 0.6886, test_loss: 0.7803, test_f1: 0.6384
 epoch: 30, train_loss: 0.6854, test_loss: 0.8180, test_f1: 0.6440
 epoch: 31, train_loss: 0.6790, test_loss: 0.8732, test_f1: 0.6088
 epoch: 32, train_loss: 0.6677, test_loss: 0.8475, test_f1: 0.6480
 epoch: 33, train_loss: 0.6571, test_loss: 0.8022, test_f1: 0.6459
 epoch: 34, train_loss: 0.6600, test_loss: 0.8434, test_f1: 0.6188
 epoch: 35, train_loss: 0.6623, test_loss: 0.8407, test_f1: 0.6112
 epoch: 36, train_loss: 0.6521, test_loss: 0.8409, test_f1: 0.6408
 epoch: 37, train_loss: 0.6473, test_loss: 0.8430, test_f1: 0.6447
 epoch: 38, train_loss: 0.6296, test_loss: 0.8457, test_f1: 0.6467
 epoch: 39, train_loss: 0.6364, test_loss: 0.8690, test_f1: 0.6190
 epoch: 40, train_loss: 0.6388, test_loss: 0.7956, test_f1: 0.6311
 epoch: 41, train_loss: 0.6309, test_loss: 0.8289, test_f1: 0.5998
 epoch: 42, train_loss: 0.6230, test_loss: 0.7829, test_f1: 0.6364
 epoch: 43, train_loss: 0.6171, test_loss: 0.8716, test_f1: 0.6149
 epoch: 44, train_loss: 0.6107, test_loss: 0.8409, test_f1: 0.6058
 epoch: 45, train_loss: 0.6218, test_loss: 0.9092, test_f1: 0.6246
 epoch: 46, train_loss: 0.5893, test_loss: 0.8786, test_f1: 0.6319
 epoch: 47, train_loss: 0.6087, test_loss: 0.8650, test_f1: 0.6255
 epoch: 48, train_loss: 0.6131, test_loss: 0.8389, test_f1: 0.6411
 epoch: 49, train_loss: 0.5912, test_loss: 0.8607, test_f1: 0.6631
 epoch: 50, train_loss: 0.6005, test_loss: 0.8702, test_f1: 0.6298
 epoch: 51, train_loss: 0.5743, test_loss: 0.8511, test_f1: 0.6305
 epoch: 52, train_loss: 0.5650, test_loss: 0.8435, test_f1: 0.6479
 epoch: 53, train_loss: 0.5527, test_loss: 0.7790, test_f1: 0.6527
 epoch: 54, train_loss: 0.5527, test_loss: 0.8277, test_f1: 0.6627
 epoch: 55, train_loss: 0.5671, test_loss: 0.8615, test_f1: 0.6488
 epoch: 56, train_loss: 0.5505, test_loss: 0.8755, test_f1: 0.6410
 epoch: 57, train_loss: 0.5651, test_loss: 0.8971, test_f1: 0.6419
 epoch: 58, train_loss: 0.5635, test_loss: 0.8631, test_f1: 0.6560
 epoch: 59, train_loss: 0.5470, test_loss: 0.9533, test_f1: 0.6294
 epoch: 60, train_loss: 0.5474, test_loss: 0.9523, test_f1: 0.6243
 epoch: 61, train_loss: 0.5504, test_loss: 0.9052, test_f1: 0.6356
 epoch: 62, train_loss: 0.5358, test_loss: 0.8528, test_f1: 0.6469
 epoch: 63, train_loss: 0.5398, test_loss: 0.8726, test_f1: 0.6383
 epoch: 64, train_loss: 0.5308, test_loss: 1.0611, test_f1: 0.6242
 epoch: 65, train_loss: 0.5337, test_loss: 0.9257, test_f1: 0.6294
 epoch: 66, train_loss: 0.5333, test_loss: 0.8724, test_f1: 0.6579
 epoch: 67, train_loss: 0.5339, test_loss: 0.8058, test_f1: 0.6600
 epoch: 68, train_loss: 0.5235, test_loss: 0.8997, test_f1: 0.6366
 epoch: 69, train_loss: 0.5261, test_loss: 0.8589, test_f1: 0.6426
 epoch: 70, train_loss: 0.5182, test_loss: 0.8727, test_f1: 0.6456
 epoch: 71, train_loss: 0.5208, test_loss: 0.8768, test_f1: 0.6528
 epoch: 72, train_loss: 0.5167, test_loss: 0.8898, test_f1: 0.6445
 epoch: 73, train_loss: 0.5081, test_loss: 0.9323, test_f1: 0.6344
 epoch: 74, train_loss: 0.5134, test_loss: 0.8944, test_f1: 0.6359
 epoch: 75, train_loss: 0.5195, test_loss: 0.8946, test_f1: 0.6179
 epoch: 76, train_loss: 0.5161, test_loss: 0.9222, test_f1: 0.6229
 epoch: 77, train_loss: 0.5186, test_loss: 0.9004, test_f1: 0.6373
 epoch: 78, train_loss: 0.4989, test_loss: 0.8618, test_f1: 0.6467
 epoch: 79, train_loss: 0.4932, test_loss: 0.9361, test_f1: 0.6332
 epoch: 80, train_loss: 0.4939, test_loss: 0.9201, test_f1: 0.6452
 epoch: 81, train_loss: 0.4892, test_loss: 0.9487, test_f1: 0.6458
 epoch: 82, train_loss: 0.4981, test_loss: 0.9285, test_f1: 0.6352
 epoch: 83, train_loss: 0.4849, test_loss: 0.9308, test_f1: 0.6371
 epoch: 84, train_loss: 0.4898, test_loss: 0.9520, test_f1: 0.6370
 epoch: 85, train_loss: 0.4888, test_loss: 0.9899, test_f1: 0.6396
 epoch: 86, train_loss: 0.4801, test_loss: 0.9106, test_f1: 0.6302
 epoch: 87, train_loss: 0.4940, test_loss: 0.8748, test_f1: 0.6440
 epoch: 88, train_loss: 0.4893, test_loss: 0.9194, test_f1: 0.6527
 epoch: 89, train_loss: 0.4892, test_loss: 0.9154, test_f1: 0.6389
 epoch: 90, train_loss: 0.4843, test_loss: 0.8939, test_f1: 0.6410
 epoch: 91, train_loss: 0.4872, test_loss: 0.9723, test_f1: 0.6381
 epoch: 92, train_loss: 0.4643, test_loss: 0.9844, test_f1: 0.6300
 epoch: 93, train_loss: 0.4746, test_loss: 0.8916, test_f1: 0.6501
 epoch: 94, train_loss: 0.4811, test_loss: 0.9672, test_f1: 0.6013
 epoch: 95, train_loss: 0.4637, test_loss: 1.0034, test_f1: 0.6216
 epoch: 96, train_loss: 0.4678, test_loss: 0.9253, test_f1: 0.6644
 epoch: 97, train_loss: 0.4637, test_loss: 0.9505, test_f1: 0.6474
 epoch: 98, train_loss: 0.4582, test_loss: 0.9247, test_f1: 0.6614
 epoch: 99, train_loss: 0.4622, test_loss: 0.9187, test_f1: 0.6374
##################ITERATION #4 ****************************************
 epoch: 0, train_loss: 1.1775, test_loss: 0.9973, test_f1: 0.4912
 epoch: 1, train_loss: 1.0395, test_loss: 0.9692, test_f1: 0.5266
 epoch: 2, train_loss: 0.9923, test_loss: 0.9605, test_f1: 0.5195
 epoch: 3, train_loss: 0.9705, test_loss: 0.9399, test_f1: 0.5300
 epoch: 4, train_loss: 0.9363, test_loss: 0.9165, test_f1: 0.5394
 epoch: 5, train_loss: 0.9277, test_loss: 0.9259, test_f1: 0.5715
 epoch: 6, train_loss: 0.8950, test_loss: 0.9251, test_f1: 0.5578
 epoch: 7, train_loss: 0.8797, test_loss: 0.9053, test_f1: 0.5628
 epoch: 8, train_loss: 0.8669, test_loss: 0.8729, test_f1: 0.5616
 epoch: 9, train_loss: 0.8544, test_loss: 0.9000, test_f1: 0.5863
 epoch: 10, train_loss: 0.8331, test_loss: 0.8893, test_f1: 0.5864
 epoch: 11, train_loss: 0.8305, test_loss: 0.8839, test_f1: 0.5715
 epoch: 12, train_loss: 0.8031, test_loss: 0.8798, test_f1: 0.6047
 epoch: 13, train_loss: 0.7972, test_loss: 0.8705, test_f1: 0.5994
 epoch: 14, train_loss: 0.7904, test_loss: 0.8396, test_f1: 0.6219
 epoch: 15, train_loss: 0.7814, test_loss: 0.8477, test_f1: 0.6148
 epoch: 16, train_loss: 0.7604, test_loss: 0.8282, test_f1: 0.6314
 epoch: 17, train_loss: 0.7596, test_loss: 0.8210, test_f1: 0.6027
 epoch: 18, train_loss: 0.7490, test_loss: 0.8185, test_f1: 0.6386
 epoch: 19, train_loss: 0.7424, test_loss: 0.8078, test_f1: 0.6235
 epoch: 20, train_loss: 0.7387, test_loss: 0.8128, test_f1: 0.6168
 epoch: 21, train_loss: 0.7282, test_loss: 0.7844, test_f1: 0.6182
 epoch: 22, train_loss: 0.7209, test_loss: 0.8070, test_f1: 0.6396
 epoch: 23, train_loss: 0.7056, test_loss: 0.7811, test_f1: 0.6504
 epoch: 24, train_loss: 0.7067, test_loss: 0.7995, test_f1: 0.6303
 epoch: 25, train_loss: 0.6887, test_loss: 0.8176, test_f1: 0.6207
 epoch: 26, train_loss: 0.6867, test_loss: 0.7866, test_f1: 0.6382
 epoch: 27, train_loss: 0.6811, test_loss: 0.8061, test_f1: 0.6343
 epoch: 28, train_loss: 0.6779, test_loss: 0.7865, test_f1: 0.6360
 epoch: 29, train_loss: 0.6619, test_loss: 0.8198, test_f1: 0.6132
 epoch: 30, train_loss: 0.6671, test_loss: 0.8257, test_f1: 0.6404
 epoch: 31, train_loss: 0.6520, test_loss: 0.7765, test_f1: 0.6315
 epoch: 32, train_loss: 0.6638, test_loss: 0.7547, test_f1: 0.6446
 epoch: 33, train_loss: 0.6426, test_loss: 0.7506, test_f1: 0.6544
 epoch: 34, train_loss: 0.6367, test_loss: 0.7194, test_f1: 0.6566
 epoch: 35, train_loss: 0.6361, test_loss: 0.8128, test_f1: 0.6557
 epoch: 36, train_loss: 0.6272, test_loss: 0.7807, test_f1: 0.6217
 epoch: 37, train_loss: 0.6246, test_loss: 0.7279, test_f1: 0.6334
 epoch: 38, train_loss: 0.6329, test_loss: 0.7777, test_f1: 0.6370
 epoch: 39, train_loss: 0.6161, test_loss: 0.7290, test_f1: 0.6617
 epoch: 40, train_loss: 0.5999, test_loss: 0.7975, test_f1: 0.6501
 epoch: 41, train_loss: 0.6068, test_loss: 0.7361, test_f1: 0.6406
 epoch: 42, train_loss: 0.6031, test_loss: 0.7299, test_f1: 0.6477
 epoch: 43, train_loss: 0.6024, test_loss: 0.8141, test_f1: 0.6448
 epoch: 44, train_loss: 0.5861, test_loss: 0.7567, test_f1: 0.6604
 epoch: 45, train_loss: 0.5752, test_loss: 0.7721, test_f1: 0.6450
 epoch: 46, train_loss: 0.5813, test_loss: 0.8161, test_f1: 0.6391
 epoch: 47, train_loss: 0.5757, test_loss: 0.7789, test_f1: 0.6633
 epoch: 48, train_loss: 0.5680, test_loss: 0.7936, test_f1: 0.6461
 epoch: 49, train_loss: 0.5661, test_loss: 0.7744, test_f1: 0.6647
 epoch: 50, train_loss: 0.5547, test_loss: 0.7741, test_f1: 0.6532
 epoch: 51, train_loss: 0.5456, test_loss: 0.7818, test_f1: 0.6674
 epoch: 52, train_loss: 0.5371, test_loss: 0.8104, test_f1: 0.6758
 epoch: 53, train_loss: 0.5238, test_loss: 0.7826, test_f1: 0.6582
 epoch: 54, train_loss: 0.5370, test_loss: 0.7316, test_f1: 0.6852
 epoch: 55, train_loss: 0.5349, test_loss: 0.7752, test_f1: 0.6777
 epoch: 56, train_loss: 0.5260, test_loss: 0.8018, test_f1: 0.6562
 epoch: 57, train_loss: 0.5162, test_loss: 0.7704, test_f1: 0.6616
 epoch: 58, train_loss: 0.5288, test_loss: 0.8090, test_f1: 0.6866
 epoch: 59, train_loss: 0.5154, test_loss: 0.7713, test_f1: 0.6600
 epoch: 60, train_loss: 0.5113, test_loss: 0.8244, test_f1: 0.6666
 epoch: 61, train_loss: 0.5259, test_loss: 0.8236, test_f1: 0.6683
 epoch: 62, train_loss: 0.5165, test_loss: 0.7801, test_f1: 0.6452
 epoch: 63, train_loss: 0.5168, test_loss: 0.7997, test_f1: 0.6764
 epoch: 64, train_loss: 0.4981, test_loss: 0.7980, test_f1: 0.6403
 epoch: 65, train_loss: 0.5173, test_loss: 0.8018, test_f1: 0.6611
 epoch: 66, train_loss: 0.5104, test_loss: 0.7477, test_f1: 0.6653
 epoch: 67, train_loss: 0.4979, test_loss: 0.7445, test_f1: 0.6796
 epoch: 68, train_loss: 0.4997, test_loss: 0.7476, test_f1: 0.6687
 epoch: 69, train_loss: 0.4795, test_loss: 0.7905, test_f1: 0.6775
 epoch: 70, train_loss: 0.5029, test_loss: 0.6759, test_f1: 0.6876
 epoch: 71, train_loss: 0.5012, test_loss: 0.7492, test_f1: 0.6630
 epoch: 72, train_loss: 0.4840, test_loss: 0.7907, test_f1: 0.6909
 epoch: 73, train_loss: 0.5001, test_loss: 0.7543, test_f1: 0.6731
 epoch: 74, train_loss: 0.5013, test_loss: 0.7931, test_f1: 0.6894
 epoch: 75, train_loss: 0.4806, test_loss: 0.7956, test_f1: 0.6541
 epoch: 76, train_loss: 0.4711, test_loss: 0.7858, test_f1: 0.6602
 epoch: 77, train_loss: 0.4723, test_loss: 0.7990, test_f1: 0.6667
 epoch: 78, train_loss: 0.4733, test_loss: 0.8340, test_f1: 0.6599
 epoch: 79, train_loss: 0.4701, test_loss: 0.8803, test_f1: 0.6683
 epoch: 80, train_loss: 0.4774, test_loss: 0.8104, test_f1: 0.6704
 epoch: 81, train_loss: 0.4711, test_loss: 0.8263, test_f1: 0.6692
 epoch: 82, train_loss: 0.4598, test_loss: 0.8241, test_f1: 0.6504
 epoch: 83, train_loss: 0.4582, test_loss: 0.8123, test_f1: 0.6673
 epoch: 84, train_loss: 0.4580, test_loss: 0.8152, test_f1: 0.6741
 epoch: 85, train_loss: 0.4541, test_loss: 0.7852, test_f1: 0.6635
 epoch: 86, train_loss: 0.4675, test_loss: 0.8219, test_f1: 0.6624
 epoch: 87, train_loss: 0.4649, test_loss: 0.8129, test_f1: 0.6675
 epoch: 88, train_loss: 0.4619, test_loss: 0.7691, test_f1: 0.6820
 epoch: 89, train_loss: 0.4386, test_loss: 0.7448, test_f1: 0.6921
 epoch: 90, train_loss: 0.4453, test_loss: 0.7585, test_f1: 0.6697
 epoch: 91, train_loss: 0.4510, test_loss: 0.8470, test_f1: 0.6696
 epoch: 92, train_loss: 0.4551, test_loss: 0.7659, test_f1: 0.6703
 epoch: 93, train_loss: 0.4376, test_loss: 0.7582, test_f1: 0.6821
 epoch: 94, train_loss: 0.4509, test_loss: 0.7841, test_f1: 0.6673
 epoch: 95, train_loss: 0.4431, test_loss: 0.8018, test_f1: 0.6603
 epoch: 96, train_loss: 0.4335, test_loss: 0.7850, test_f1: 0.6708
 epoch: 97, train_loss: 0.4479, test_loss: 0.8255, test_f1: 0.6716
 epoch: 98, train_loss: 0.4364, test_loss: 0.7935, test_f1: 0.6850
 epoch: 99, train_loss: 0.4361, test_loss: 0.7654, test_f1: 0.6798
##################ITERATION #5 ****************************************
 epoch: 0, train_loss: 1.1629, test_loss: 0.9575, test_f1: 0.4966
 epoch: 1, train_loss: 1.0229, test_loss: 0.9501, test_f1: 0.4862
 epoch: 2, train_loss: 0.9905, test_loss: 0.9292, test_f1: 0.5158
 epoch: 3, train_loss: 0.9679, test_loss: 0.9448, test_f1: 0.5029
 epoch: 4, train_loss: 0.9325, test_loss: 0.9014, test_f1: 0.5307
 epoch: 5, train_loss: 0.9217, test_loss: 0.8799, test_f1: 0.5699
 epoch: 6, train_loss: 0.8878, test_loss: 0.8769, test_f1: 0.5540
 epoch: 7, train_loss: 0.8783, test_loss: 0.8668, test_f1: 0.5749
 epoch: 8, train_loss: 0.8651, test_loss: 0.8785, test_f1: 0.5460
 epoch: 9, train_loss: 0.8473, test_loss: 0.8870, test_f1: 0.5624
 epoch: 10, train_loss: 0.8322, test_loss: 0.8448, test_f1: 0.5929
 epoch: 11, train_loss: 0.8349, test_loss: 0.8501, test_f1: 0.5954
 epoch: 12, train_loss: 0.7999, test_loss: 0.8551, test_f1: 0.6005
 epoch: 13, train_loss: 0.7945, test_loss: 0.8499, test_f1: 0.6326
 epoch: 14, train_loss: 0.7852, test_loss: 0.8538, test_f1: 0.6142
 epoch: 15, train_loss: 0.7899, test_loss: 0.8485, test_f1: 0.6229
 epoch: 16, train_loss: 0.7746, test_loss: 0.8486, test_f1: 0.6131
 epoch: 17, train_loss: 0.7654, test_loss: 0.8497, test_f1: 0.6212
 epoch: 18, train_loss: 0.7560, test_loss: 0.8559, test_f1: 0.5993
 epoch: 19, train_loss: 0.7501, test_loss: 0.8427, test_f1: 0.6259
 epoch: 20, train_loss: 0.7285, test_loss: 0.8379, test_f1: 0.6362
 epoch: 21, train_loss: 0.7391, test_loss: 0.8291, test_f1: 0.6170
 epoch: 22, train_loss: 0.7261, test_loss: 0.8164, test_f1: 0.6392
 epoch: 23, train_loss: 0.7130, test_loss: 0.8207, test_f1: 0.6380
 epoch: 24, train_loss: 0.6924, test_loss: 0.8148, test_f1: 0.6435
 epoch: 25, train_loss: 0.7063, test_loss: 0.8266, test_f1: 0.6295
 epoch: 26, train_loss: 0.6962, test_loss: 0.8223, test_f1: 0.6537
 epoch: 27, train_loss: 0.6983, test_loss: 0.8204, test_f1: 0.6374
 epoch: 28, train_loss: 0.6723, test_loss: 0.8526, test_f1: 0.6281
 epoch: 29, train_loss: 0.6732, test_loss: 0.8532, test_f1: 0.6517
 epoch: 30, train_loss: 0.6707, test_loss: 0.8668, test_f1: 0.6226
 epoch: 31, train_loss: 0.6648, test_loss: 0.8413, test_f1: 0.6499
 epoch: 32, train_loss: 0.6468, test_loss: 0.8254, test_f1: 0.6525
 epoch: 33, train_loss: 0.6550, test_loss: 0.8650, test_f1: 0.6189
 epoch: 34, train_loss: 0.6471, test_loss: 0.8874, test_f1: 0.6289
 epoch: 35, train_loss: 0.6478, test_loss: 0.8808, test_f1: 0.6348
 epoch: 36, train_loss: 0.6440, test_loss: 0.8123, test_f1: 0.6676
 epoch: 37, train_loss: 0.6433, test_loss: 0.8279, test_f1: 0.6752
 epoch: 38, train_loss: 0.6290, test_loss: 0.8498, test_f1: 0.6501
 epoch: 39, train_loss: 0.6320, test_loss: 0.8444, test_f1: 0.6478
 epoch: 40, train_loss: 0.6233, test_loss: 0.8445, test_f1: 0.6544
 epoch: 41, train_loss: 0.6120, test_loss: 0.8601, test_f1: 0.6548
 epoch: 42, train_loss: 0.6129, test_loss: 0.8109, test_f1: 0.6467
 epoch: 43, train_loss: 0.6029, test_loss: 0.8908, test_f1: 0.6457
 epoch: 44, train_loss: 0.6005, test_loss: 0.8647, test_f1: 0.6686
 epoch: 45, train_loss: 0.6007, test_loss: 0.8572, test_f1: 0.6596
 epoch: 46, train_loss: 0.5841, test_loss: 0.8608, test_f1: 0.6593
 epoch: 47, train_loss: 0.5836, test_loss: 0.8818, test_f1: 0.6481
 epoch: 48, train_loss: 0.5813, test_loss: 0.8857, test_f1: 0.6476
 epoch: 49, train_loss: 0.5775, test_loss: 0.8892, test_f1: 0.6461
 epoch: 50, train_loss: 0.5670, test_loss: 0.8718, test_f1: 0.6385
 epoch: 51, train_loss: 0.5632, test_loss: 0.8851, test_f1: 0.6592
 epoch: 52, train_loss: 0.5599, test_loss: 0.8702, test_f1: 0.6612
 epoch: 53, train_loss: 0.5468, test_loss: 0.8883, test_f1: 0.6503
 epoch: 54, train_loss: 0.5570, test_loss: 0.8675, test_f1: 0.6617
 epoch: 55, train_loss: 0.5441, test_loss: 0.8778, test_f1: 0.6424
 epoch: 56, train_loss: 0.5426, test_loss: 0.9185, test_f1: 0.6414
 epoch: 57, train_loss: 0.5318, test_loss: 0.9161, test_f1: 0.6258
 epoch: 58, train_loss: 0.5329, test_loss: 0.9065, test_f1: 0.6340
 epoch: 59, train_loss: 0.5387, test_loss: 0.8990, test_f1: 0.6492
 epoch: 60, train_loss: 0.5283, test_loss: 0.8886, test_f1: 0.6523
 epoch: 61, train_loss: 0.5216, test_loss: 0.9118, test_f1: 0.6450
 epoch: 62, train_loss: 0.5290, test_loss: 0.8992, test_f1: 0.6548
 epoch: 63, train_loss: 0.5260, test_loss: 0.8855, test_f1: 0.6498
 epoch: 64, train_loss: 0.5341, test_loss: 0.9250, test_f1: 0.6701
 epoch: 65, train_loss: 0.5285, test_loss: 0.9146, test_f1: 0.6555
 epoch: 66, train_loss: 0.5166, test_loss: 0.9197, test_f1: 0.6601
 epoch: 67, train_loss: 0.5278, test_loss: 0.9415, test_f1: 0.6469
 epoch: 68, train_loss: 0.5084, test_loss: 0.9221, test_f1: 0.6419
 epoch: 69, train_loss: 0.5046, test_loss: 0.9349, test_f1: 0.6390
 epoch: 70, train_loss: 0.5067, test_loss: 0.9527, test_f1: 0.6343
 epoch: 71, train_loss: 0.5018, test_loss: 0.9071, test_f1: 0.6407
 epoch: 72, train_loss: 0.5135, test_loss: 0.9411, test_f1: 0.6498
 epoch: 73, train_loss: 0.5100, test_loss: 0.9623, test_f1: 0.6312
 epoch: 74, train_loss: 0.4993, test_loss: 0.9429, test_f1: 0.6439
 epoch: 75, train_loss: 0.5056, test_loss: 0.9986, test_f1: 0.6362
 epoch: 76, train_loss: 0.5011, test_loss: 0.9535, test_f1: 0.6237
 epoch: 77, train_loss: 0.4970, test_loss: 0.9133, test_f1: 0.6422
 epoch: 78, train_loss: 0.4990, test_loss: 0.9297, test_f1: 0.6347
 epoch: 79, train_loss: 0.4795, test_loss: 0.9455, test_f1: 0.6359
 epoch: 80, train_loss: 0.4919, test_loss: 0.9334, test_f1: 0.6512
 epoch: 81, train_loss: 0.4794, test_loss: 0.9436, test_f1: 0.6522
 epoch: 82, train_loss: 0.4879, test_loss: 0.9152, test_f1: 0.6317
 epoch: 83, train_loss: 0.4860, test_loss: 0.9061, test_f1: 0.6514
 epoch: 84, train_loss: 0.4821, test_loss: 0.9513, test_f1: 0.6377
 epoch: 85, train_loss: 0.4720, test_loss: 0.9098, test_f1: 0.6504
 epoch: 86, train_loss: 0.4795, test_loss: 0.9971, test_f1: 0.6337
 epoch: 87, train_loss: 0.4813, test_loss: 0.9798, test_f1: 0.6329
 epoch: 88, train_loss: 0.4629, test_loss: 1.0532, test_f1: 0.6406
 epoch: 89, train_loss: 0.4683, test_loss: 1.0147, test_f1: 0.6328
 epoch: 90, train_loss: 0.4733, test_loss: 0.9744, test_f1: 0.6359
 epoch: 91, train_loss: 0.4795, test_loss: 0.9898, test_f1: 0.6474
 epoch: 92, train_loss: 0.4787, test_loss: 0.9755, test_f1: 0.6391
 epoch: 93, train_loss: 0.4725, test_loss: 1.0048, test_f1: 0.6303
 epoch: 94, train_loss: 0.4676, test_loss: 1.0538, test_f1: 0.6464
 epoch: 95, train_loss: 0.4564, test_loss: 1.0078, test_f1: 0.6404
 epoch: 96, train_loss: 0.4692, test_loss: 1.0141, test_f1: 0.6596
 epoch: 97, train_loss: 0.4630, test_loss: 1.0318, test_f1: 0.6567
 epoch: 98, train_loss: 0.4516, test_loss: 1.0135, test_f1: 0.6664
 epoch: 99, train_loss: 0.4437, test_loss: 0.9750, test_f1: 0.6530
##################ITERATION #6 ****************************************
 epoch: 0, train_loss: 1.2087, test_loss: 1.0161, test_f1: 0.5051
 epoch: 1, train_loss: 1.0734, test_loss: 0.9870, test_f1: 0.5388
 epoch: 2, train_loss: 1.0226, test_loss: 0.9724, test_f1: 0.5378
 epoch: 3, train_loss: 0.9815, test_loss: 0.9611, test_f1: 0.5132
 epoch: 4, train_loss: 0.9584, test_loss: 0.9434, test_f1: 0.5490
 epoch: 5, train_loss: 0.9434, test_loss: 0.9306, test_f1: 0.5407
 epoch: 6, train_loss: 0.9204, test_loss: 0.8967, test_f1: 0.5509
 epoch: 7, train_loss: 0.9072, test_loss: 0.9027, test_f1: 0.5478
 epoch: 8, train_loss: 0.8827, test_loss: 0.8849, test_f1: 0.5519
 epoch: 9, train_loss: 0.8752, test_loss: 0.8541, test_f1: 0.5779
 epoch: 10, train_loss: 0.8529, test_loss: 0.8699, test_f1: 0.5918
 epoch: 11, train_loss: 0.8407, test_loss: 0.8501, test_f1: 0.5914
 epoch: 12, train_loss: 0.8250, test_loss: 0.8497, test_f1: 0.5962
 epoch: 13, train_loss: 0.8185, test_loss: 0.8556, test_f1: 0.5716
 epoch: 14, train_loss: 0.8149, test_loss: 0.8401, test_f1: 0.5934
 epoch: 15, train_loss: 0.8018, test_loss: 0.8573, test_f1: 0.6148
 epoch: 16, train_loss: 0.7759, test_loss: 0.8328, test_f1: 0.6142
 epoch: 17, train_loss: 0.7809, test_loss: 0.8279, test_f1: 0.5955
 epoch: 18, train_loss: 0.7662, test_loss: 0.8391, test_f1: 0.6122
 epoch: 19, train_loss: 0.7578, test_loss: 0.8365, test_f1: 0.6380
 epoch: 20, train_loss: 0.7523, test_loss: 0.8247, test_f1: 0.6256
 epoch: 21, train_loss: 0.7425, test_loss: 0.8820, test_f1: 0.6001
 epoch: 22, train_loss: 0.7289, test_loss: 0.8440, test_f1: 0.6047
 epoch: 23, train_loss: 0.7217, test_loss: 0.8256, test_f1: 0.6217
 epoch: 24, train_loss: 0.7184, test_loss: 0.8097, test_f1: 0.6293
 epoch: 25, train_loss: 0.7107, test_loss: 0.8140, test_f1: 0.6220
 epoch: 26, train_loss: 0.7160, test_loss: 0.8112, test_f1: 0.6317
 epoch: 27, train_loss: 0.6796, test_loss: 0.8697, test_f1: 0.6180
 epoch: 28, train_loss: 0.6894, test_loss: 0.8794, test_f1: 0.6278
 epoch: 29, train_loss: 0.6672, test_loss: 0.7780, test_f1: 0.6603
 epoch: 30, train_loss: 0.6914, test_loss: 0.8288, test_f1: 0.6241
 epoch: 31, train_loss: 0.6768, test_loss: 0.8245, test_f1: 0.6253
 epoch: 32, train_loss: 0.6576, test_loss: 0.7962, test_f1: 0.6291
 epoch: 33, train_loss: 0.6589, test_loss: 0.8121, test_f1: 0.6305
 epoch: 34, train_loss: 0.6509, test_loss: 0.8225, test_f1: 0.6441
 epoch: 35, train_loss: 0.6509, test_loss: 0.8529, test_f1: 0.6352
 epoch: 36, train_loss: 0.6497, test_loss: 0.8731, test_f1: 0.6309
 epoch: 37, train_loss: 0.6333, test_loss: 0.8042, test_f1: 0.6079
 epoch: 38, train_loss: 0.6261, test_loss: 0.8431, test_f1: 0.6046
 epoch: 39, train_loss: 0.6203, test_loss: 0.8768, test_f1: 0.5902
 epoch: 40, train_loss: 0.6275, test_loss: 0.8640, test_f1: 0.6299
 epoch: 41, train_loss: 0.6193, test_loss: 0.8221, test_f1: 0.6274
 epoch: 42, train_loss: 0.6078, test_loss: 0.8944, test_f1: 0.6347
 epoch: 43, train_loss: 0.5983, test_loss: 0.8420, test_f1: 0.6450
 epoch: 44, train_loss: 0.6054, test_loss: 0.9456, test_f1: 0.5928
 epoch: 45, train_loss: 0.5941, test_loss: 0.8705, test_f1: 0.6198
 epoch: 46, train_loss: 0.5929, test_loss: 0.8676, test_f1: 0.6317
 epoch: 47, train_loss: 0.5879, test_loss: 0.9023, test_f1: 0.6090
 epoch: 48, train_loss: 0.5814, test_loss: 0.8562, test_f1: 0.6464
 epoch: 49, train_loss: 0.5778, test_loss: 0.8892, test_f1: 0.6276
 epoch: 50, train_loss: 0.5706, test_loss: 0.8396, test_f1: 0.6513
 epoch: 51, train_loss: 0.5546, test_loss: 0.8670, test_f1: 0.6189
 epoch: 52, train_loss: 0.5385, test_loss: 0.8645, test_f1: 0.6431
 epoch: 53, train_loss: 0.5579, test_loss: 0.8522, test_f1: 0.6297
 epoch: 54, train_loss: 0.5453, test_loss: 0.9139, test_f1: 0.6376
 epoch: 55, train_loss: 0.5378, test_loss: 0.8870, test_f1: 0.6203
 epoch: 56, train_loss: 0.5350, test_loss: 0.8382, test_f1: 0.6542
 epoch: 57, train_loss: 0.5519, test_loss: 0.8613, test_f1: 0.6459
 epoch: 58, train_loss: 0.5350, test_loss: 0.8561, test_f1: 0.6331
 epoch: 59, train_loss: 0.5257, test_loss: 0.8705, test_f1: 0.6279
 epoch: 60, train_loss: 0.5250, test_loss: 0.9129, test_f1: 0.6282
 epoch: 61, train_loss: 0.5212, test_loss: 0.8846, test_f1: 0.6343
 epoch: 62, train_loss: 0.5064, test_loss: 0.8611, test_f1: 0.6502
 epoch: 63, train_loss: 0.5244, test_loss: 0.9356, test_f1: 0.6425
 epoch: 64, train_loss: 0.5201, test_loss: 0.8957, test_f1: 0.6351
 epoch: 65, train_loss: 0.5184, test_loss: 0.8969, test_f1: 0.6501
 epoch: 66, train_loss: 0.5123, test_loss: 0.9068, test_f1: 0.6233
 epoch: 67, train_loss: 0.5184, test_loss: 0.9039, test_f1: 0.6309
 epoch: 68, train_loss: 0.5121, test_loss: 0.9630, test_f1: 0.6275
 epoch: 69, train_loss: 0.5012, test_loss: 0.8919, test_f1: 0.6351
 epoch: 70, train_loss: 0.5058, test_loss: 0.8993, test_f1: 0.6631
 epoch: 71, train_loss: 0.5100, test_loss: 0.9272, test_f1: 0.6331
 epoch: 72, train_loss: 0.5016, test_loss: 0.9120, test_f1: 0.6448
 epoch: 73, train_loss: 0.5005, test_loss: 0.8741, test_f1: 0.6565
 epoch: 74, train_loss: 0.4920, test_loss: 0.9824, test_f1: 0.6308
 epoch: 75, train_loss: 0.5006, test_loss: 0.9969, test_f1: 0.6301
 epoch: 76, train_loss: 0.4968, test_loss: 0.9212, test_f1: 0.6583
 epoch: 77, train_loss: 0.4752, test_loss: 0.9700, test_f1: 0.6329
 epoch: 78, train_loss: 0.4934, test_loss: 1.0110, test_f1: 0.6367
 epoch: 79, train_loss: 0.5067, test_loss: 0.9602, test_f1: 0.6445
 epoch: 80, train_loss: 0.4699, test_loss: 0.9698, test_f1: 0.6361
 epoch: 81, train_loss: 0.4677, test_loss: 0.9795, test_f1: 0.6322
 epoch: 82, train_loss: 0.4606, test_loss: 0.9605, test_f1: 0.6461
 epoch: 83, train_loss: 0.4716, test_loss: 1.0098, test_f1: 0.6374
 epoch: 84, train_loss: 0.4738, test_loss: 0.9366, test_f1: 0.6227
 epoch: 85, train_loss: 0.4704, test_loss: 0.9663, test_f1: 0.6315
 epoch: 86, train_loss: 0.4559, test_loss: 1.0063, test_f1: 0.6339
 epoch: 87, train_loss: 0.4717, test_loss: 0.9709, test_f1: 0.6438
 epoch: 88, train_loss: 0.4739, test_loss: 1.0334, test_f1: 0.6419
 epoch: 89, train_loss: 0.4560, test_loss: 0.9566, test_f1: 0.6406
 epoch: 90, train_loss: 0.4606, test_loss: 0.9494, test_f1: 0.6421
 epoch: 91, train_loss: 0.4610, test_loss: 1.0663, test_f1: 0.6218
 epoch: 92, train_loss: 0.4658, test_loss: 1.0794, test_f1: 0.6341
 epoch: 93, train_loss: 0.4701, test_loss: 1.0447, test_f1: 0.6443
 epoch: 94, train_loss: 0.4488, test_loss: 1.0423, test_f1: 0.6300
 epoch: 95, train_loss: 0.4543, test_loss: 1.0627, test_f1: 0.6319
 epoch: 96, train_loss: 0.4401, test_loss: 1.0558, test_f1: 0.6446
 epoch: 97, train_loss: 0.4492, test_loss: 1.0652, test_f1: 0.6406
 epoch: 98, train_loss: 0.4372, test_loss: 1.0328, test_f1: 0.6438
 epoch: 99, train_loss: 0.4561, test_loss: 1.0568, test_f1: 0.6477
##################ITERATION #7 ****************************************
 epoch: 0, train_loss: 1.1597, test_loss: 0.9786, test_f1: 0.4733
 epoch: 1, train_loss: 1.0373, test_loss: 0.9507, test_f1: 0.4941
 epoch: 2, train_loss: 0.9769, test_loss: 0.9496, test_f1: 0.5018
 epoch: 3, train_loss: 0.9625, test_loss: 0.9097, test_f1: 0.5433
 epoch: 4, train_loss: 0.9304, test_loss: 0.9107, test_f1: 0.5331
 epoch: 5, train_loss: 0.9077, test_loss: 0.9125, test_f1: 0.5507
 epoch: 6, train_loss: 0.8940, test_loss: 0.8983, test_f1: 0.5466
 epoch: 7, train_loss: 0.8789, test_loss: 0.9005, test_f1: 0.5482
 epoch: 8, train_loss: 0.8682, test_loss: 0.9088, test_f1: 0.5456
 epoch: 9, train_loss: 0.8575, test_loss: 0.8945, test_f1: 0.5417
 epoch: 10, train_loss: 0.8388, test_loss: 0.9135, test_f1: 0.5625
 epoch: 11, train_loss: 0.8178, test_loss: 0.8969, test_f1: 0.5540
 epoch: 12, train_loss: 0.8234, test_loss: 0.8876, test_f1: 0.5833
 epoch: 13, train_loss: 0.8117, test_loss: 0.8692, test_f1: 0.5614
 epoch: 14, train_loss: 0.7974, test_loss: 0.8884, test_f1: 0.5675
 epoch: 15, train_loss: 0.7981, test_loss: 0.8846, test_f1: 0.5606
 epoch: 16, train_loss: 0.7728, test_loss: 0.8966, test_f1: 0.5849
 epoch: 17, train_loss: 0.7624, test_loss: 0.8668, test_f1: 0.5956
 epoch: 18, train_loss: 0.7648, test_loss: 0.8461, test_f1: 0.5999
 epoch: 19, train_loss: 0.7486, test_loss: 0.8969, test_f1: 0.5664
 epoch: 20, train_loss: 0.7530, test_loss: 0.8811, test_f1: 0.6058
 epoch: 21, train_loss: 0.7396, test_loss: 0.8671, test_f1: 0.5946
 epoch: 22, train_loss: 0.7191, test_loss: 0.8843, test_f1: 0.6171
 epoch: 23, train_loss: 0.7276, test_loss: 0.8478, test_f1: 0.6235
 epoch: 24, train_loss: 0.7188, test_loss: 0.8929, test_f1: 0.6222
 epoch: 25, train_loss: 0.6964, test_loss: 0.8570, test_f1: 0.6246
 epoch: 26, train_loss: 0.7014, test_loss: 0.8952, test_f1: 0.6099
 epoch: 27, train_loss: 0.6839, test_loss: 0.8482, test_f1: 0.6227
 epoch: 28, train_loss: 0.6735, test_loss: 0.8510, test_f1: 0.6285
 epoch: 29, train_loss: 0.6728, test_loss: 0.8452, test_f1: 0.6086
 epoch: 30, train_loss: 0.6788, test_loss: 0.8725, test_f1: 0.6436
 epoch: 31, train_loss: 0.6656, test_loss: 0.8648, test_f1: 0.6425
 epoch: 32, train_loss: 0.6656, test_loss: 0.8797, test_f1: 0.6407
 epoch: 33, train_loss: 0.6473, test_loss: 0.8945, test_f1: 0.6338
 epoch: 34, train_loss: 0.6520, test_loss: 0.8590, test_f1: 0.6346
 epoch: 35, train_loss: 0.6282, test_loss: 0.8927, test_f1: 0.6430
 epoch: 36, train_loss: 0.6187, test_loss: 0.8959, test_f1: 0.6476
 epoch: 37, train_loss: 0.6253, test_loss: 0.9545, test_f1: 0.6008
 epoch: 38, train_loss: 0.6273, test_loss: 0.8855, test_f1: 0.6351
 epoch: 39, train_loss: 0.6086, test_loss: 0.8557, test_f1: 0.6623
 epoch: 40, train_loss: 0.6118, test_loss: 0.8646, test_f1: 0.6593
 epoch: 41, train_loss: 0.6125, test_loss: 0.8902, test_f1: 0.6654
 epoch: 42, train_loss: 0.6154, test_loss: 0.8723, test_f1: 0.6610
 epoch: 43, train_loss: 0.6074, test_loss: 0.8868, test_f1: 0.6501
 epoch: 44, train_loss: 0.5850, test_loss: 0.8919, test_f1: 0.6422
 epoch: 45, train_loss: 0.5863, test_loss: 0.8843, test_f1: 0.6496
 epoch: 46, train_loss: 0.5736, test_loss: 0.8832, test_f1: 0.6661
 epoch: 47, train_loss: 0.5800, test_loss: 0.9317, test_f1: 0.6626
 epoch: 48, train_loss: 0.5712, test_loss: 0.8891, test_f1: 0.6637
 epoch: 49, train_loss: 0.5766, test_loss: 0.9094, test_f1: 0.6563
 epoch: 50, train_loss: 0.5572, test_loss: 0.9275, test_f1: 0.6413
 epoch: 51, train_loss: 0.5513, test_loss: 0.9143, test_f1: 0.6295
 epoch: 52, train_loss: 0.5535, test_loss: 0.9027, test_f1: 0.6614
 epoch: 53, train_loss: 0.5411, test_loss: 0.9321, test_f1: 0.6460
 epoch: 54, train_loss: 0.5348, test_loss: 0.9173, test_f1: 0.6564
 epoch: 55, train_loss: 0.5231, test_loss: 0.9002, test_f1: 0.6511
 epoch: 56, train_loss: 0.5214, test_loss: 0.9072, test_f1: 0.6497
 epoch: 57, train_loss: 0.5337, test_loss: 0.9028, test_f1: 0.6641
 epoch: 58, train_loss: 0.5317, test_loss: 0.9437, test_f1: 0.6373
 epoch: 59, train_loss: 0.5267, test_loss: 0.8974, test_f1: 0.6747
 epoch: 60, train_loss: 0.5304, test_loss: 0.9192, test_f1: 0.6393
 epoch: 61, train_loss: 0.5113, test_loss: 0.9861, test_f1: 0.6296
 epoch: 62, train_loss: 0.5152, test_loss: 0.9586, test_f1: 0.6415
 epoch: 63, train_loss: 0.5167, test_loss: 0.9409, test_f1: 0.6543
 epoch: 64, train_loss: 0.5044, test_loss: 0.9049, test_f1: 0.6610
 epoch: 65, train_loss: 0.5077, test_loss: 0.9302, test_f1: 0.6616
 epoch: 66, train_loss: 0.5030, test_loss: 0.9502, test_f1: 0.6524
 epoch: 67, train_loss: 0.5095, test_loss: 0.9378, test_f1: 0.6611
 epoch: 68, train_loss: 0.5101, test_loss: 0.9581, test_f1: 0.6341
 epoch: 69, train_loss: 0.4959, test_loss: 0.9407, test_f1: 0.6612
 epoch: 70, train_loss: 0.5059, test_loss: 0.9828, test_f1: 0.6452
 epoch: 71, train_loss: 0.4970, test_loss: 0.9584, test_f1: 0.6450
 epoch: 72, train_loss: 0.4833, test_loss: 0.9883, test_f1: 0.6411
 epoch: 73, train_loss: 0.4885, test_loss: 0.9435, test_f1: 0.6534
 epoch: 74, train_loss: 0.4870, test_loss: 0.9447, test_f1: 0.6441
 epoch: 75, train_loss: 0.4851, test_loss: 0.9619, test_f1: 0.6505
 epoch: 76, train_loss: 0.4867, test_loss: 0.9533, test_f1: 0.6455
 epoch: 77, train_loss: 0.4799, test_loss: 0.9897, test_f1: 0.6468
 epoch: 78, train_loss: 0.4797, test_loss: 1.0213, test_f1: 0.6312
 epoch: 79, train_loss: 0.4859, test_loss: 0.9709, test_f1: 0.6528
 epoch: 80, train_loss: 0.4669, test_loss: 0.9819, test_f1: 0.6591
 epoch: 81, train_loss: 0.4910, test_loss: 0.9757, test_f1: 0.6257
 epoch: 82, train_loss: 0.4613, test_loss: 0.9745, test_f1: 0.6478
 epoch: 83, train_loss: 0.4753, test_loss: 0.9874, test_f1: 0.6663
 epoch: 84, train_loss: 0.4710, test_loss: 0.9232, test_f1: 0.6567
 epoch: 85, train_loss: 0.4635, test_loss: 0.9404, test_f1: 0.6782
 epoch: 86, train_loss: 0.4556, test_loss: 0.9979, test_f1: 0.6439
 epoch: 87, train_loss: 0.4548, test_loss: 0.9361, test_f1: 0.6478
 epoch: 88, train_loss: 0.4597, test_loss: 1.0122, test_f1: 0.6626
 epoch: 89, train_loss: 0.4519, test_loss: 1.0059, test_f1: 0.6863
 epoch: 90, train_loss: 0.4661, test_loss: 0.9577, test_f1: 0.6460
 epoch: 91, train_loss: 0.4519, test_loss: 0.9455, test_f1: 0.6491
 epoch: 92, train_loss: 0.4511, test_loss: 0.9805, test_f1: 0.6585
 epoch: 93, train_loss: 0.4505, test_loss: 0.9654, test_f1: 0.6682
 epoch: 94, train_loss: 0.4403, test_loss: 0.9302, test_f1: 0.6511
 epoch: 95, train_loss: 0.4449, test_loss: 0.9871, test_f1: 0.6426
 epoch: 96, train_loss: 0.4458, test_loss: 0.9931, test_f1: 0.6422
 epoch: 97, train_loss: 0.4421, test_loss: 1.0174, test_f1: 0.6518
 epoch: 98, train_loss: 0.4408, test_loss: 0.9862, test_f1: 0.6545
 epoch: 99, train_loss: 0.4333, test_loss: 0.9924, test_f1: 0.6496
##################ITERATION #8 ****************************************
 epoch: 0, train_loss: 1.1967, test_loss: 1.0278, test_f1: 0.4317
 epoch: 1, train_loss: 1.0610, test_loss: 0.9841, test_f1: 0.4579
 epoch: 2, train_loss: 1.0158, test_loss: 0.9794, test_f1: 0.4784
 epoch: 3, train_loss: 0.9958, test_loss: 0.9322, test_f1: 0.5145
 epoch: 4, train_loss: 0.9463, test_loss: 0.9583, test_f1: 0.4987
 epoch: 5, train_loss: 0.9470, test_loss: 0.9250, test_f1: 0.5355
 epoch: 6, train_loss: 0.9241, test_loss: 0.9319, test_f1: 0.5426
 epoch: 7, train_loss: 0.9018, test_loss: 0.9110, test_f1: 0.5564
 epoch: 8, train_loss: 0.8994, test_loss: 0.9112, test_f1: 0.5455
 epoch: 9, train_loss: 0.8730, test_loss: 0.9072, test_f1: 0.5588
 epoch: 10, train_loss: 0.8582, test_loss: 0.9117, test_f1: 0.5516
 epoch: 11, train_loss: 0.8482, test_loss: 0.9211, test_f1: 0.5673
 epoch: 12, train_loss: 0.8462, test_loss: 0.9162, test_f1: 0.5424
 epoch: 13, train_loss: 0.8233, test_loss: 0.8614, test_f1: 0.5799
 epoch: 14, train_loss: 0.8136, test_loss: 0.8914, test_f1: 0.5816
 epoch: 15, train_loss: 0.8005, test_loss: 0.8959, test_f1: 0.5780
 epoch: 16, train_loss: 0.7936, test_loss: 0.9064, test_f1: 0.5922
 epoch: 17, train_loss: 0.7915, test_loss: 0.9088, test_f1: 0.5636
 epoch: 18, train_loss: 0.7773, test_loss: 0.8656, test_f1: 0.5763
 epoch: 19, train_loss: 0.7735, test_loss: 0.9107, test_f1: 0.5792
 epoch: 20, train_loss: 0.7749, test_loss: 0.8717, test_f1: 0.5889
 epoch: 21, train_loss: 0.7614, test_loss: 0.9227, test_f1: 0.5693
 epoch: 22, train_loss: 0.7611, test_loss: 0.8146, test_f1: 0.6145
 epoch: 23, train_loss: 0.7504, test_loss: 0.8685, test_f1: 0.6052
 epoch: 24, train_loss: 0.7480, test_loss: 0.8643, test_f1: 0.5984
 epoch: 25, train_loss: 0.7344, test_loss: 0.8859, test_f1: 0.6107
 epoch: 26, train_loss: 0.7354, test_loss: 0.8511, test_f1: 0.6140
 epoch: 27, train_loss: 0.7214, test_loss: 0.8972, test_f1: 0.5835
 epoch: 28, train_loss: 0.7153, test_loss: 0.8812, test_f1: 0.6123
 epoch: 29, train_loss: 0.7065, test_loss: 0.8693, test_f1: 0.6108
 epoch: 30, train_loss: 0.7139, test_loss: 0.8376, test_f1: 0.6311
 epoch: 31, train_loss: 0.6994, test_loss: 0.8597, test_f1: 0.6208
 epoch: 32, train_loss: 0.6973, test_loss: 0.8566, test_f1: 0.6163
 epoch: 33, train_loss: 0.6831, test_loss: 0.8484, test_f1: 0.6533
 epoch: 34, train_loss: 0.6873, test_loss: 0.8783, test_f1: 0.6188
 epoch: 35, train_loss: 0.6731, test_loss: 0.8656, test_f1: 0.6162
 epoch: 36, train_loss: 0.6774, test_loss: 0.8233, test_f1: 0.6251
 epoch: 37, train_loss: 0.6703, test_loss: 0.8996, test_f1: 0.6127
 epoch: 38, train_loss: 0.6673, test_loss: 0.8868, test_f1: 0.5744
 epoch: 39, train_loss: 0.6607, test_loss: 0.8547, test_f1: 0.6138
 epoch: 40, train_loss: 0.6438, test_loss: 0.8958, test_f1: 0.6017
 epoch: 41, train_loss: 0.6415, test_loss: 0.8497, test_f1: 0.6251
 epoch: 42, train_loss: 0.6412, test_loss: 0.8405, test_f1: 0.6340
 epoch: 43, train_loss: 0.6302, test_loss: 0.8937, test_f1: 0.6069
 epoch: 44, train_loss: 0.6467, test_loss: 0.8278, test_f1: 0.6233
 epoch: 45, train_loss: 0.6179, test_loss: 0.8318, test_f1: 0.6328
 epoch: 46, train_loss: 0.6098, test_loss: 0.8473, test_f1: 0.6110
 epoch: 47, train_loss: 0.6172, test_loss: 0.9042, test_f1: 0.6102
 epoch: 48, train_loss: 0.6264, test_loss: 0.8572, test_f1: 0.6070
 epoch: 49, train_loss: 0.6149, test_loss: 0.8211, test_f1: 0.6066
 epoch: 50, train_loss: 0.6092, test_loss: 0.9824, test_f1: 0.5707
 epoch: 51, train_loss: 0.5848, test_loss: 0.8205, test_f1: 0.5993
 epoch: 52, train_loss: 0.5814, test_loss: 0.8259, test_f1: 0.6101
 epoch: 53, train_loss: 0.5826, test_loss: 0.8641, test_f1: 0.6027
 epoch: 54, train_loss: 0.5881, test_loss: 0.8561, test_f1: 0.5971
 epoch: 55, train_loss: 0.5795, test_loss: 0.8801, test_f1: 0.6033
 epoch: 56, train_loss: 0.5804, test_loss: 0.8291, test_f1: 0.6216
 epoch: 57, train_loss: 0.5661, test_loss: 0.9206, test_f1: 0.6003
 epoch: 58, train_loss: 0.5671, test_loss: 0.8944, test_f1: 0.5906
 epoch: 59, train_loss: 0.5780, test_loss: 0.8878, test_f1: 0.6074
 epoch: 60, train_loss: 0.5636, test_loss: 0.8754, test_f1: 0.6115
 epoch: 61, train_loss: 0.5692, test_loss: 0.8613, test_f1: 0.5995
 epoch: 62, train_loss: 0.5571, test_loss: 0.8483, test_f1: 0.6436
 epoch: 63, train_loss: 0.5491, test_loss: 0.8691, test_f1: 0.6074
 epoch: 64, train_loss: 0.5554, test_loss: 0.8513, test_f1: 0.6347
 epoch: 65, train_loss: 0.5591, test_loss: 0.8749, test_f1: 0.6217
 epoch: 66, train_loss: 0.5603, test_loss: 0.9182, test_f1: 0.6289
 epoch: 67, train_loss: 0.5367, test_loss: 0.9156, test_f1: 0.6179
 epoch: 68, train_loss: 0.5489, test_loss: 0.9061, test_f1: 0.6378
 epoch: 69, train_loss: 0.5394, test_loss: 0.8755, test_f1: 0.6467
 epoch: 70, train_loss: 0.5362, test_loss: 0.8225, test_f1: 0.6553
 epoch: 71, train_loss: 0.5448, test_loss: 0.8469, test_f1: 0.6333
 epoch: 72, train_loss: 0.5408, test_loss: 0.8919, test_f1: 0.6265
 epoch: 73, train_loss: 0.5297, test_loss: 0.8681, test_f1: 0.6333
 epoch: 74, train_loss: 0.5302, test_loss: 0.8717, test_f1: 0.6368
 epoch: 75, train_loss: 0.5443, test_loss: 0.9041, test_f1: 0.6332
 epoch: 76, train_loss: 0.5321, test_loss: 0.9226, test_f1: 0.6415
 epoch: 77, train_loss: 0.5266, test_loss: 0.8752, test_f1: 0.6331
 epoch: 78, train_loss: 0.5248, test_loss: 0.9415, test_f1: 0.6275
 epoch: 79, train_loss: 0.5292, test_loss: 0.9343, test_f1: 0.6268
 epoch: 80, train_loss: 0.5036, test_loss: 0.9315, test_f1: 0.6546
 epoch: 81, train_loss: 0.5195, test_loss: 0.8998, test_f1: 0.6337
 epoch: 82, train_loss: 0.5227, test_loss: 0.9515, test_f1: 0.6104
 epoch: 83, train_loss: 0.5160, test_loss: 0.8911, test_f1: 0.6338
 epoch: 84, train_loss: 0.5272, test_loss: 0.9387, test_f1: 0.6385
 epoch: 85, train_loss: 0.5074, test_loss: 0.8792, test_f1: 0.6470
 epoch: 86, train_loss: 0.5199, test_loss: 0.8586, test_f1: 0.6556
 epoch: 87, train_loss: 0.5205, test_loss: 0.9279, test_f1: 0.6353
 epoch: 88, train_loss: 0.4974, test_loss: 0.9508, test_f1: 0.6433
 epoch: 89, train_loss: 0.5020, test_loss: 0.9261, test_f1: 0.6211
 epoch: 90, train_loss: 0.5081, test_loss: 0.9005, test_f1: 0.6392
 epoch: 91, train_loss: 0.5092, test_loss: 0.9256, test_f1: 0.6607
 epoch: 92, train_loss: 0.4928, test_loss: 0.9268, test_f1: 0.6505
 epoch: 93, train_loss: 0.5056, test_loss: 0.9367, test_f1: 0.6427
 epoch: 94, train_loss: 0.4942, test_loss: 0.9186, test_f1: 0.6442
 epoch: 95, train_loss: 0.4902, test_loss: 0.9190, test_f1: 0.6538
 epoch: 96, train_loss: 0.4895, test_loss: 0.9598, test_f1: 0.6149
 epoch: 97, train_loss: 0.5033, test_loss: 0.9504, test_f1: 0.6478
 epoch: 98, train_loss: 0.4954, test_loss: 0.9004, test_f1: 0.6469
 epoch: 99, train_loss: 0.4934, test_loss: 0.9389, test_f1: 0.6410
##################ITERATION #9 ****************************************
 epoch: 0, train_loss: 1.2471, test_loss: 0.9946, test_f1: 0.4919
 epoch: 1, train_loss: 1.0719, test_loss: 0.9872, test_f1: 0.4945
 epoch: 2, train_loss: 1.0045, test_loss: 0.9477, test_f1: 0.5302
 epoch: 3, train_loss: 0.9771, test_loss: 0.9384, test_f1: 0.5397
 epoch: 4, train_loss: 0.9587, test_loss: 0.9279, test_f1: 0.5600
 epoch: 5, train_loss: 0.9462, test_loss: 0.9169, test_f1: 0.5317
 epoch: 6, train_loss: 0.9219, test_loss: 0.9050, test_f1: 0.5385
 epoch: 7, train_loss: 0.9049, test_loss: 0.9042, test_f1: 0.5218
 epoch: 8, train_loss: 0.8732, test_loss: 0.9179, test_f1: 0.5444
 epoch: 9, train_loss: 0.8707, test_loss: 0.8648, test_f1: 0.5740
 epoch: 10, train_loss: 0.8533, test_loss: 0.8633, test_f1: 0.5644
 epoch: 11, train_loss: 0.8407, test_loss: 0.8751, test_f1: 0.5754
 epoch: 12, train_loss: 0.8216, test_loss: 0.8528, test_f1: 0.5970
 epoch: 13, train_loss: 0.8139, test_loss: 0.8724, test_f1: 0.6182
 epoch: 14, train_loss: 0.8063, test_loss: 0.8628, test_f1: 0.6167
 epoch: 15, train_loss: 0.7871, test_loss: 0.8448, test_f1: 0.6022
 epoch: 16, train_loss: 0.7904, test_loss: 0.8622, test_f1: 0.5963
 epoch: 17, train_loss: 0.7858, test_loss: 0.8613, test_f1: 0.5938
 epoch: 18, train_loss: 0.7799, test_loss: 0.8217, test_f1: 0.6068
 epoch: 19, train_loss: 0.7601, test_loss: 0.8337, test_f1: 0.6066
 epoch: 20, train_loss: 0.7637, test_loss: 0.8331, test_f1: 0.6389
 epoch: 21, train_loss: 0.7487, test_loss: 0.8195, test_f1: 0.6257
 epoch: 22, train_loss: 0.7362, test_loss: 0.8710, test_f1: 0.6202
 epoch: 23, train_loss: 0.7389, test_loss: 0.8121, test_f1: 0.6495
 epoch: 24, train_loss: 0.7271, test_loss: 0.8376, test_f1: 0.6323
 epoch: 25, train_loss: 0.7260, test_loss: 0.8333, test_f1: 0.6091
 epoch: 26, train_loss: 0.7239, test_loss: 0.8225, test_f1: 0.6338
 epoch: 27, train_loss: 0.7146, test_loss: 0.7908, test_f1: 0.6303
 epoch: 28, train_loss: 0.7148, test_loss: 0.8338, test_f1: 0.6156
 epoch: 29, train_loss: 0.7107, test_loss: 0.8505, test_f1: 0.6317
 epoch: 30, train_loss: 0.7017, test_loss: 0.8136, test_f1: 0.6101
 epoch: 31, train_loss: 0.6840, test_loss: 0.8096, test_f1: 0.6378
 epoch: 32, train_loss: 0.6824, test_loss: 0.8446, test_f1: 0.6408
 epoch: 33, train_loss: 0.6854, test_loss: 0.8508, test_f1: 0.6503
 epoch: 34, train_loss: 0.6674, test_loss: 0.8781, test_f1: 0.6325
 epoch: 35, train_loss: 0.6509, test_loss: 0.8302, test_f1: 0.6355
 epoch: 36, train_loss: 0.6734, test_loss: 0.7962, test_f1: 0.6420
 epoch: 37, train_loss: 0.6632, test_loss: 0.8409, test_f1: 0.6448
 epoch: 38, train_loss: 0.6491, test_loss: 0.8296, test_f1: 0.6368
 epoch: 39, train_loss: 0.6377, test_loss: 0.8112, test_f1: 0.6432
 epoch: 40, train_loss: 0.6437, test_loss: 0.8707, test_f1: 0.6551
 epoch: 41, train_loss: 0.6430, test_loss: 0.8336, test_f1: 0.6351
 epoch: 42, train_loss: 0.6253, test_loss: 0.8065, test_f1: 0.6532
 epoch: 43, train_loss: 0.6381, test_loss: 0.8369, test_f1: 0.6438
 epoch: 44, train_loss: 0.6185, test_loss: 0.8195, test_f1: 0.6625
 epoch: 45, train_loss: 0.6012, test_loss: 0.7928, test_f1: 0.6890
 epoch: 46, train_loss: 0.6127, test_loss: 0.8727, test_f1: 0.6198
 epoch: 47, train_loss: 0.6059, test_loss: 0.8257, test_f1: 0.6386
 epoch: 48, train_loss: 0.6062, test_loss: 0.8339, test_f1: 0.6383
 epoch: 49, train_loss: 0.6072, test_loss: 0.8511, test_f1: 0.6524
 epoch: 50, train_loss: 0.5957, test_loss: 0.8301, test_f1: 0.6532
 epoch: 51, train_loss: 0.5730, test_loss: 0.8036, test_f1: 0.6645
 epoch: 52, train_loss: 0.5700, test_loss: 0.8007, test_f1: 0.6569
 epoch: 53, train_loss: 0.5536, test_loss: 0.8077, test_f1: 0.6603
 epoch: 54, train_loss: 0.5676, test_loss: 0.8413, test_f1: 0.6491
 epoch: 55, train_loss: 0.5657, test_loss: 0.8655, test_f1: 0.6427
 epoch: 56, train_loss: 0.5597, test_loss: 0.8363, test_f1: 0.6577
 epoch: 57, train_loss: 0.5556, test_loss: 0.8223, test_f1: 0.6455
 epoch: 58, train_loss: 0.5646, test_loss: 0.8089, test_f1: 0.6623
 epoch: 59, train_loss: 0.5649, test_loss: 0.8146, test_f1: 0.6644
 epoch: 60, train_loss: 0.5688, test_loss: 0.8227, test_f1: 0.6524
 epoch: 61, train_loss: 0.5412, test_loss: 0.8505, test_f1: 0.6546
 epoch: 62, train_loss: 0.5455, test_loss: 0.8127, test_f1: 0.6566
 epoch: 63, train_loss: 0.5364, test_loss: 0.7911, test_f1: 0.6644
 epoch: 64, train_loss: 0.5545, test_loss: 0.7769, test_f1: 0.6728
 epoch: 65, train_loss: 0.5439, test_loss: 0.8113, test_f1: 0.6611
 epoch: 66, train_loss: 0.5440, test_loss: 0.8119, test_f1: 0.6643
 epoch: 67, train_loss: 0.5344, test_loss: 0.8020, test_f1: 0.6559
 epoch: 68, train_loss: 0.5483, test_loss: 0.8340, test_f1: 0.6541
 epoch: 69, train_loss: 0.5328, test_loss: 0.8131, test_f1: 0.6544
 epoch: 70, train_loss: 0.5304, test_loss: 0.7996, test_f1: 0.6587
 epoch: 71, train_loss: 0.5305, test_loss: 0.8290, test_f1: 0.6619
 epoch: 72, train_loss: 0.5219, test_loss: 0.8358, test_f1: 0.6542
 epoch: 73, train_loss: 0.5351, test_loss: 0.7923, test_f1: 0.6389
 epoch: 74, train_loss: 0.5293, test_loss: 0.7985, test_f1: 0.6687
 epoch: 75, train_loss: 0.5202, test_loss: 0.7641, test_f1: 0.6834
 epoch: 76, train_loss: 0.5289, test_loss: 0.8298, test_f1: 0.6535
 epoch: 77, train_loss: 0.5166, test_loss: 0.8559, test_f1: 0.6346
 epoch: 78, train_loss: 0.5177, test_loss: 0.8117, test_f1: 0.6533
 epoch: 79, train_loss: 0.5141, test_loss: 0.8252, test_f1: 0.6520
 epoch: 80, train_loss: 0.5158, test_loss: 0.7796, test_f1: 0.6668
 epoch: 81, train_loss: 0.5040, test_loss: 0.7877, test_f1: 0.6665
 epoch: 82, train_loss: 0.5033, test_loss: 0.8202, test_f1: 0.6530
 epoch: 83, train_loss: 0.5016, test_loss: 0.8203, test_f1: 0.6399
 epoch: 84, train_loss: 0.5038, test_loss: 0.8724, test_f1: 0.6484
 epoch: 85, train_loss: 0.4948, test_loss: 0.8812, test_f1: 0.6432
 epoch: 86, train_loss: 0.5094, test_loss: 0.8503, test_f1: 0.6681
 epoch: 87, train_loss: 0.5129, test_loss: 0.8598, test_f1: 0.6503
 epoch: 88, train_loss: 0.5004, test_loss: 0.9012, test_f1: 0.6230
 epoch: 89, train_loss: 0.5062, test_loss: 0.8387, test_f1: 0.6586
 epoch: 90, train_loss: 0.4837, test_loss: 0.8500, test_f1: 0.6512
 epoch: 91, train_loss: 0.4930, test_loss: 0.7971, test_f1: 0.6797
 epoch: 92, train_loss: 0.4880, test_loss: 0.8200, test_f1: 0.6626
 epoch: 93, train_loss: 0.4915, test_loss: 0.8393, test_f1: 0.6681
 epoch: 94, train_loss: 0.4928, test_loss: 0.8893, test_f1: 0.6515
 epoch: 95, train_loss: 0.4788, test_loss: 0.8496, test_f1: 0.6524
 epoch: 96, train_loss: 0.4631, test_loss: 0.8499, test_f1: 0.6482
 epoch: 97, train_loss: 0.4664, test_loss: 0.8571, test_f1: 0.6530
 epoch: 98, train_loss: 0.4767, test_loss: 0.8621, test_f1: 0.6596
 epoch: 99, train_loss: 0.4604, test_loss: 0.8968, test_f1: 0.6381

Training completed in 822.42 seconds
Best F1: 0.6921 at epoch 89
Mean F1 across iterations: 0.6710  0.0153
========================FINAL RESULTS================================
FEGIN weighted F1: 0.6921  0.0153
python main.py --data ltspice_examples --representation component_pin --model FEGIN --layers 2 --hiddens 128 --batch_size 32 --lr 0.0001 --emb_size 128 --epochs 100 --save_appendix component_pin_L2_H128_BS32_LR0.0001_E128 --no_val
-----



STDERR:
  File "main.py", line 370, in <module>
    main()
  File "main.py", line 254, in main
    dataset = dataset_class(
  File "/home/philip/projects/ltspice_examples_code_repo/Circuit-Completion-Using-GNNs/component_classification_with_link_prediction_head/evaluation/FEGIN/kernel/circuit_datasets.py", line 15, in __init__
    self.data, self.slices = torch.load(self.processed_paths[0])
  File "/home/philip/.local/lib/python3.8/site-packages/torch/serialization.py", line 1040, in load
    warnings.warn(
  File "/usr/lib/python3.8/warnings.py", line 109, in _showwarnmsg
    sw(msg.message, msg.category, msg.filename, msg.lineno,
  File "main.py", line 47, in warn_with_traceback
    traceback.print_stack(file=log)
/home/philip/projects/ltspice_examples_code_repo/Circuit-Completion-Using-GNNs/component_classification_with_link_prediction_head/evaluation/FEGIN/kernel/circuit_datasets.py:15: FutureWarning: You are using `torch.load` with `weights_only=False` (the current default value), which uses the default pickle module implicitly. It is possible to construct malicious pickle data which will execute arbitrary code during unpickling (See https://github.com/pytorch/pytorch/blob/main/SECURITY.md#untrusted-models for more details). In a future release, the default value for `weights_only` will be flipped to `True`. This limits the functions that could be executed during unpickling. Arbitrary objects will no longer be allowed to be loaded via this mode unless they are explicitly allowlisted by the user via `torch.serialization.add_safe_globals`. We recommend you start setting `weights_only=True` for any use case where you don't have full control of the loaded file. Please open an issue on GitHub for any issues related to this experimental feature.
  self.data, self.slices = torch.load(self.processed_paths[0])
