STDOUT:
Results will be saved in /home/philip/projects/llm_inference_code_repo/Circuit-Completion-Using-GNNs/component_classification_with_link_prediction_head/evaluation/FEGIN/results/model_FEGIN_dataset_ltspice_examples
Command line input: python main.py --data ltspice_examples --representation component_net --model FEGIN --layers 5 --hiddens 128 --batch_size 64 --lr 0.0001 --emb_size 128 --epochs 100 --save_appendix component_net_L5_H128_BS64_LR0.0001_E128 --no_val
 is saved.
-----
ltspice_examples - FEGIN
Using 5 layers, 128 hidden units, h = 2
Loading component_net representation dataset
ENTERED
Training FEGIN on component_net representation
Train: 3558, Test: 846
##################ITERATION #0 ****************************************
 epoch: 0, train_loss: 1.3441, test_loss: 1.3176, test_f1: 0.2800
 epoch: 1, train_loss: 1.2608, test_loss: 1.2296, test_f1: 0.3180
 epoch: 2, train_loss: 1.2121, test_loss: 1.1759, test_f1: 0.3381
 epoch: 3, train_loss: 1.1683, test_loss: 1.1305, test_f1: 0.3597
 epoch: 4, train_loss: 1.1271, test_loss: 1.0913, test_f1: 0.4578
 epoch: 5, train_loss: 1.0979, test_loss: 1.0527, test_f1: 0.5319
 epoch: 6, train_loss: 1.0658, test_loss: 1.0397, test_f1: 0.5195
 epoch: 7, train_loss: 1.0316, test_loss: 0.9935, test_f1: 0.5328
 epoch: 8, train_loss: 0.9991, test_loss: 0.9546, test_f1: 0.5416
 epoch: 9, train_loss: 0.9646, test_loss: 0.9444, test_f1: 0.5427
 epoch: 10, train_loss: 0.9428, test_loss: 0.9305, test_f1: 0.5489
 epoch: 11, train_loss: 0.9241, test_loss: 0.9297, test_f1: 0.5361
 epoch: 12, train_loss: 0.9102, test_loss: 0.9109, test_f1: 0.5510
 epoch: 13, train_loss: 0.8918, test_loss: 0.9047, test_f1: 0.5510
 epoch: 14, train_loss: 0.8706, test_loss: 0.8916, test_f1: 0.5781
 epoch: 15, train_loss: 0.8740, test_loss: 0.9131, test_f1: 0.5548
 epoch: 16, train_loss: 0.8512, test_loss: 0.9150, test_f1: 0.5631
 epoch: 17, train_loss: 0.8503, test_loss: 0.9105, test_f1: 0.5708
 epoch: 18, train_loss: 0.8425, test_loss: 0.9150, test_f1: 0.5662
 epoch: 19, train_loss: 0.8309, test_loss: 0.9121, test_f1: 0.5540
 epoch: 20, train_loss: 0.8158, test_loss: 0.9064, test_f1: 0.6006
 epoch: 21, train_loss: 0.8216, test_loss: 0.8948, test_f1: 0.5976
 epoch: 22, train_loss: 0.8001, test_loss: 0.9036, test_f1: 0.5998
 epoch: 23, train_loss: 0.8028, test_loss: 0.9136, test_f1: 0.5999
 epoch: 24, train_loss: 0.7978, test_loss: 0.8942, test_f1: 0.6007
 epoch: 25, train_loss: 0.8015, test_loss: 0.8903, test_f1: 0.5972
 epoch: 26, train_loss: 0.7808, test_loss: 0.9240, test_f1: 0.5522
 epoch: 27, train_loss: 0.7684, test_loss: 0.9093, test_f1: 0.5804
 epoch: 28, train_loss: 0.7635, test_loss: 0.9085, test_f1: 0.5598
 epoch: 29, train_loss: 0.7591, test_loss: 0.9032, test_f1: 0.5914
 epoch: 30, train_loss: 0.7423, test_loss: 0.8924, test_f1: 0.6051
 epoch: 31, train_loss: 0.7525, test_loss: 0.9083, test_f1: 0.5617
 epoch: 32, train_loss: 0.7432, test_loss: 0.9013, test_f1: 0.6285
 epoch: 33, train_loss: 0.7452, test_loss: 0.8973, test_f1: 0.5916
 epoch: 34, train_loss: 0.7372, test_loss: 0.8836, test_f1: 0.6201
 epoch: 35, train_loss: 0.7299, test_loss: 0.9080, test_f1: 0.5958
 epoch: 36, train_loss: 0.7153, test_loss: 0.9139, test_f1: 0.6189
 epoch: 37, train_loss: 0.7094, test_loss: 0.9172, test_f1: 0.6012
 epoch: 38, train_loss: 0.7166, test_loss: 0.8935, test_f1: 0.6205
 epoch: 39, train_loss: 0.6966, test_loss: 0.8876, test_f1: 0.6020
 epoch: 40, train_loss: 0.6899, test_loss: 0.9050, test_f1: 0.6039
 epoch: 41, train_loss: 0.6904, test_loss: 0.9146, test_f1: 0.5969
 epoch: 42, train_loss: 0.6951, test_loss: 0.9014, test_f1: 0.6119
 epoch: 43, train_loss: 0.6824, test_loss: 0.9215, test_f1: 0.5986
 epoch: 44, train_loss: 0.6755, test_loss: 0.9080, test_f1: 0.6320
 epoch: 45, train_loss: 0.6712, test_loss: 0.9005, test_f1: 0.6150
 epoch: 46, train_loss: 0.6732, test_loss: 0.9056, test_f1: 0.6168
 epoch: 47, train_loss: 0.6617, test_loss: 0.9041, test_f1: 0.6355
 epoch: 48, train_loss: 0.6504, test_loss: 0.9237, test_f1: 0.6164
 epoch: 49, train_loss: 0.6472, test_loss: 0.9162, test_f1: 0.6227
 epoch: 50, train_loss: 0.6396, test_loss: 0.9246, test_f1: 0.6268
 epoch: 51, train_loss: 0.6249, test_loss: 0.9001, test_f1: 0.6361
 epoch: 52, train_loss: 0.6095, test_loss: 0.8957, test_f1: 0.6363
 epoch: 53, train_loss: 0.6069, test_loss: 0.9071, test_f1: 0.6400
 epoch: 54, train_loss: 0.6097, test_loss: 0.9065, test_f1: 0.6290
 epoch: 55, train_loss: 0.6204, test_loss: 0.9225, test_f1: 0.6429
 epoch: 56, train_loss: 0.6098, test_loss: 0.9297, test_f1: 0.6183
 epoch: 57, train_loss: 0.5980, test_loss: 0.9207, test_f1: 0.6306
 epoch: 58, train_loss: 0.5940, test_loss: 0.9192, test_f1: 0.6431
 epoch: 59, train_loss: 0.5895, test_loss: 0.9245, test_f1: 0.6204
 epoch: 60, train_loss: 0.5846, test_loss: 0.9202, test_f1: 0.6397
 epoch: 61, train_loss: 0.5801, test_loss: 0.9138, test_f1: 0.6533
 epoch: 62, train_loss: 0.5842, test_loss: 0.9142, test_f1: 0.6434
 epoch: 63, train_loss: 0.5760, test_loss: 0.9137, test_f1: 0.6219
 epoch: 64, train_loss: 0.5692, test_loss: 0.9194, test_f1: 0.6320
 epoch: 65, train_loss: 0.5663, test_loss: 0.9386, test_f1: 0.6273
 epoch: 66, train_loss: 0.5785, test_loss: 0.9322, test_f1: 0.6465
 epoch: 67, train_loss: 0.5597, test_loss: 0.9761, test_f1: 0.6192
 epoch: 68, train_loss: 0.5591, test_loss: 0.9314, test_f1: 0.6494
 epoch: 69, train_loss: 0.5667, test_loss: 0.9561, test_f1: 0.6337
 epoch: 70, train_loss: 0.5614, test_loss: 0.9489, test_f1: 0.6375
 epoch: 71, train_loss: 0.5636, test_loss: 0.9600, test_f1: 0.6276
 epoch: 72, train_loss: 0.5506, test_loss: 0.9717, test_f1: 0.6471
 epoch: 73, train_loss: 0.5477, test_loss: 0.9652, test_f1: 0.6359
 epoch: 74, train_loss: 0.5475, test_loss: 0.9472, test_f1: 0.6479
 epoch: 75, train_loss: 0.5453, test_loss: 0.9612, test_f1: 0.6349
 epoch: 76, train_loss: 0.5578, test_loss: 0.9886, test_f1: 0.6201
 epoch: 77, train_loss: 0.5348, test_loss: 0.9845, test_f1: 0.6187
 epoch: 78, train_loss: 0.5327, test_loss: 0.9820, test_f1: 0.6263
 epoch: 79, train_loss: 0.5320, test_loss: 0.9671, test_f1: 0.6407
 epoch: 80, train_loss: 0.5121, test_loss: 0.9848, test_f1: 0.6284
 epoch: 81, train_loss: 0.5140, test_loss: 0.9841, test_f1: 0.6329
 epoch: 82, train_loss: 0.5257, test_loss: 0.9828, test_f1: 0.6236
 epoch: 83, train_loss: 0.5259, test_loss: 0.9706, test_f1: 0.6437
 epoch: 84, train_loss: 0.5193, test_loss: 1.0156, test_f1: 0.6355
 epoch: 85, train_loss: 0.5211, test_loss: 1.0132, test_f1: 0.6363
 epoch: 86, train_loss: 0.5148, test_loss: 0.9782, test_f1: 0.6432
 epoch: 87, train_loss: 0.5132, test_loss: 0.9979, test_f1: 0.6594
 epoch: 88, train_loss: 0.5143, test_loss: 0.9764, test_f1: 0.6466
 epoch: 89, train_loss: 0.4985, test_loss: 0.9928, test_f1: 0.6499
 epoch: 90, train_loss: 0.5010, test_loss: 1.0611, test_f1: 0.6292
 epoch: 91, train_loss: 0.5222, test_loss: 1.0025, test_f1: 0.6593
 epoch: 92, train_loss: 0.4880, test_loss: 1.0404, test_f1: 0.6465
 epoch: 93, train_loss: 0.5028, test_loss: 1.0047, test_f1: 0.6387
 epoch: 94, train_loss: 0.4850, test_loss: 0.9795, test_f1: 0.6625
 epoch: 95, train_loss: 0.4983, test_loss: 1.0083, test_f1: 0.6564
 epoch: 96, train_loss: 0.4855, test_loss: 1.0028, test_f1: 0.6564
 epoch: 97, train_loss: 0.4798, test_loss: 0.9986, test_f1: 0.6567
 epoch: 98, train_loss: 0.4883, test_loss: 1.0615, test_f1: 0.6392
 epoch: 99, train_loss: 0.4818, test_loss: 1.0436, test_f1: 0.6355
##################ITERATION #1 ****************************************
 epoch: 0, train_loss: 1.2341, test_loss: 1.2382, test_f1: 0.3573
 epoch: 1, train_loss: 1.1292, test_loss: 1.0643, test_f1: 0.4764
 epoch: 2, train_loss: 1.0791, test_loss: 1.0174, test_f1: 0.4811
 epoch: 3, train_loss: 1.0315, test_loss: 0.9700, test_f1: 0.5184
 epoch: 4, train_loss: 0.9929, test_loss: 0.9299, test_f1: 0.5452
 epoch: 5, train_loss: 0.9645, test_loss: 0.9093, test_f1: 0.5604
 epoch: 6, train_loss: 0.9419, test_loss: 0.9136, test_f1: 0.5616
 epoch: 7, train_loss: 0.9104, test_loss: 0.8976, test_f1: 0.5443
 epoch: 8, train_loss: 0.8977, test_loss: 0.8865, test_f1: 0.5500
 epoch: 9, train_loss: 0.8823, test_loss: 0.8883, test_f1: 0.5552
 epoch: 10, train_loss: 0.8719, test_loss: 0.8838, test_f1: 0.5594
 epoch: 11, train_loss: 0.8547, test_loss: 0.9016, test_f1: 0.5677
 epoch: 12, train_loss: 0.8419, test_loss: 0.9065, test_f1: 0.5657
 epoch: 13, train_loss: 0.8480, test_loss: 0.8740, test_f1: 0.5615
 epoch: 14, train_loss: 0.8238, test_loss: 0.8761, test_f1: 0.5836
 epoch: 15, train_loss: 0.8121, test_loss: 0.9112, test_f1: 0.5644
 epoch: 16, train_loss: 0.8098, test_loss: 0.9372, test_f1: 0.5632
 epoch: 17, train_loss: 0.7917, test_loss: 0.9054, test_f1: 0.5808
 epoch: 18, train_loss: 0.7833, test_loss: 0.9603, test_f1: 0.5608
 epoch: 19, train_loss: 0.7819, test_loss: 0.8950, test_f1: 0.5689
 epoch: 20, train_loss: 0.7613, test_loss: 0.9440, test_f1: 0.5725
 epoch: 21, train_loss: 0.7646, test_loss: 0.9246, test_f1: 0.5679
 epoch: 22, train_loss: 0.7427, test_loss: 0.9006, test_f1: 0.5963
 epoch: 23, train_loss: 0.7450, test_loss: 0.9203, test_f1: 0.5935
 epoch: 24, train_loss: 0.7422, test_loss: 0.9296, test_f1: 0.5813
 epoch: 25, train_loss: 0.7313, test_loss: 0.9227, test_f1: 0.6056
 epoch: 26, train_loss: 0.7294, test_loss: 0.9424, test_f1: 0.5944
 epoch: 27, train_loss: 0.7233, test_loss: 0.9587, test_f1: 0.6048
 epoch: 28, train_loss: 0.7137, test_loss: 0.9177, test_f1: 0.6048
 epoch: 29, train_loss: 0.6928, test_loss: 0.9201, test_f1: 0.5988
 epoch: 30, train_loss: 0.6957, test_loss: 0.9540, test_f1: 0.6106
 epoch: 31, train_loss: 0.6878, test_loss: 0.9458, test_f1: 0.6080
 epoch: 32, train_loss: 0.6756, test_loss: 0.9383, test_f1: 0.5992
 epoch: 33, train_loss: 0.6748, test_loss: 0.9253, test_f1: 0.6057
 epoch: 34, train_loss: 0.6651, test_loss: 0.9709, test_f1: 0.5933
 epoch: 35, train_loss: 0.6506, test_loss: 0.9668, test_f1: 0.6117
 epoch: 36, train_loss: 0.6479, test_loss: 0.9447, test_f1: 0.6060
 epoch: 37, train_loss: 0.6636, test_loss: 0.9514, test_f1: 0.6064
 epoch: 38, train_loss: 0.6533, test_loss: 0.9172, test_f1: 0.6393
 epoch: 39, train_loss: 0.6376, test_loss: 0.9338, test_f1: 0.6211
 epoch: 40, train_loss: 0.6304, test_loss: 0.9420, test_f1: 0.6124
 epoch: 41, train_loss: 0.6287, test_loss: 0.9916, test_f1: 0.6232
 epoch: 42, train_loss: 0.6024, test_loss: 0.9647, test_f1: 0.6121
 epoch: 43, train_loss: 0.6178, test_loss: 0.9525, test_f1: 0.6166
 epoch: 44, train_loss: 0.6161, test_loss: 0.9801, test_f1: 0.6150
 epoch: 45, train_loss: 0.6068, test_loss: 0.9960, test_f1: 0.6146
 epoch: 46, train_loss: 0.6032, test_loss: 0.9470, test_f1: 0.6195
 epoch: 47, train_loss: 0.5952, test_loss: 0.9475, test_f1: 0.6374
 epoch: 48, train_loss: 0.5816, test_loss: 1.0302, test_f1: 0.6051
 epoch: 49, train_loss: 0.5842, test_loss: 0.9604, test_f1: 0.6362
 epoch: 50, train_loss: 0.5871, test_loss: 1.0156, test_f1: 0.6182
 epoch: 51, train_loss: 0.5616, test_loss: 0.9958, test_f1: 0.6230
 epoch: 52, train_loss: 0.5497, test_loss: 0.9656, test_f1: 0.6213
 epoch: 53, train_loss: 0.5515, test_loss: 0.9987, test_f1: 0.6264
 epoch: 54, train_loss: 0.5507, test_loss: 1.0130, test_f1: 0.6285
 epoch: 55, train_loss: 0.5431, test_loss: 0.9907, test_f1: 0.6279
 epoch: 56, train_loss: 0.5382, test_loss: 0.9858, test_f1: 0.6295
 epoch: 57, train_loss: 0.5415, test_loss: 0.9925, test_f1: 0.6399
 epoch: 58, train_loss: 0.5221, test_loss: 1.0010, test_f1: 0.6371
 epoch: 59, train_loss: 0.5185, test_loss: 1.0484, test_f1: 0.6213
 epoch: 60, train_loss: 0.5159, test_loss: 0.9945, test_f1: 0.6331
 epoch: 61, train_loss: 0.5171, test_loss: 0.9932, test_f1: 0.6353
 epoch: 62, train_loss: 0.5190, test_loss: 1.0081, test_f1: 0.6111
 epoch: 63, train_loss: 0.5053, test_loss: 1.0158, test_f1: 0.6297
 epoch: 64, train_loss: 0.4947, test_loss: 1.0584, test_f1: 0.6297
 epoch: 65, train_loss: 0.5113, test_loss: 1.0671, test_f1: 0.6401
 epoch: 66, train_loss: 0.5110, test_loss: 1.0240, test_f1: 0.6400
 epoch: 67, train_loss: 0.4911, test_loss: 1.0661, test_f1: 0.6346
 epoch: 68, train_loss: 0.4958, test_loss: 1.0317, test_f1: 0.6359
 epoch: 69, train_loss: 0.4828, test_loss: 1.0537, test_f1: 0.6365
 epoch: 70, train_loss: 0.4819, test_loss: 1.0655, test_f1: 0.6200
 epoch: 71, train_loss: 0.4969, test_loss: 1.0377, test_f1: 0.6478
 epoch: 72, train_loss: 0.4829, test_loss: 1.0437, test_f1: 0.6241
 epoch: 73, train_loss: 0.4885, test_loss: 1.0399, test_f1: 0.6345
 epoch: 74, train_loss: 0.4793, test_loss: 1.0735, test_f1: 0.6340
 epoch: 75, train_loss: 0.4751, test_loss: 1.0790, test_f1: 0.6412
 epoch: 76, train_loss: 0.4782, test_loss: 1.0293, test_f1: 0.6381
 epoch: 77, train_loss: 0.4562, test_loss: 1.0346, test_f1: 0.6413
 epoch: 78, train_loss: 0.4652, test_loss: 1.0602, test_f1: 0.6538
 epoch: 79, train_loss: 0.4619, test_loss: 1.0480, test_f1: 0.6417
 epoch: 80, train_loss: 0.4683, test_loss: 1.0541, test_f1: 0.6411
 epoch: 81, train_loss: 0.4669, test_loss: 1.0354, test_f1: 0.6523
 epoch: 82, train_loss: 0.4621, test_loss: 1.0921, test_f1: 0.6445
 epoch: 83, train_loss: 0.4566, test_loss: 1.1113, test_f1: 0.6364
 epoch: 84, train_loss: 0.4499, test_loss: 1.0644, test_f1: 0.6513
 epoch: 85, train_loss: 0.4548, test_loss: 1.1008, test_f1: 0.6351
 epoch: 86, train_loss: 0.4378, test_loss: 1.1595, test_f1: 0.6212
 epoch: 87, train_loss: 0.4386, test_loss: 1.1395, test_f1: 0.6418
 epoch: 88, train_loss: 0.4403, test_loss: 1.1950, test_f1: 0.6380
 epoch: 89, train_loss: 0.4330, test_loss: 1.1331, test_f1: 0.6465
 epoch: 90, train_loss: 0.4333, test_loss: 1.1625, test_f1: 0.6446
 epoch: 91, train_loss: 0.4382, test_loss: 1.1261, test_f1: 0.6577
 epoch: 92, train_loss: 0.4322, test_loss: 1.1295, test_f1: 0.6588
 epoch: 93, train_loss: 0.4270, test_loss: 1.1330, test_f1: 0.6375
 epoch: 94, train_loss: 0.4242, test_loss: 1.1985, test_f1: 0.6452
 epoch: 95, train_loss: 0.4182, test_loss: 1.2165, test_f1: 0.6241
 epoch: 96, train_loss: 0.4165, test_loss: 1.2458, test_f1: 0.6146
 epoch: 97, train_loss: 0.4307, test_loss: 1.1828, test_f1: 0.6425
 epoch: 98, train_loss: 0.4153, test_loss: 1.1841, test_f1: 0.6493
 epoch: 99, train_loss: 0.4010, test_loss: 1.2084, test_f1: 0.6303
##################ITERATION #2 ****************************************
 epoch: 0, train_loss: 1.2292, test_loss: 1.1933, test_f1: 0.4207
 epoch: 1, train_loss: 1.1132, test_loss: 1.0575, test_f1: 0.4663
 epoch: 2, train_loss: 1.0599, test_loss: 1.0072, test_f1: 0.4968
 epoch: 3, train_loss: 1.0200, test_loss: 0.9822, test_f1: 0.4873
 epoch: 4, train_loss: 0.9865, test_loss: 0.9447, test_f1: 0.5188
 epoch: 5, train_loss: 0.9606, test_loss: 0.9362, test_f1: 0.4951
 epoch: 6, train_loss: 0.9385, test_loss: 0.9097, test_f1: 0.5188
 epoch: 7, train_loss: 0.9212, test_loss: 0.9009, test_f1: 0.5323
 epoch: 8, train_loss: 0.9101, test_loss: 0.9146, test_f1: 0.5196
 epoch: 9, train_loss: 0.8906, test_loss: 0.9000, test_f1: 0.5237
 epoch: 10, train_loss: 0.8940, test_loss: 0.9257, test_f1: 0.5515
 epoch: 11, train_loss: 0.8680, test_loss: 0.9210, test_f1: 0.5516
 epoch: 12, train_loss: 0.8631, test_loss: 0.9017, test_f1: 0.5529
 epoch: 13, train_loss: 0.8525, test_loss: 0.8960, test_f1: 0.5574
 epoch: 14, train_loss: 0.8451, test_loss: 0.8871, test_f1: 0.5544
 epoch: 15, train_loss: 0.8301, test_loss: 0.9148, test_f1: 0.5671
 epoch: 16, train_loss: 0.8236, test_loss: 0.9104, test_f1: 0.5687
 epoch: 17, train_loss: 0.8162, test_loss: 0.9102, test_f1: 0.5676
 epoch: 18, train_loss: 0.8114, test_loss: 0.9027, test_f1: 0.5803
 epoch: 19, train_loss: 0.8129, test_loss: 0.8902, test_f1: 0.5753
 epoch: 20, train_loss: 0.7983, test_loss: 0.8589, test_f1: 0.5955
 epoch: 21, train_loss: 0.7820, test_loss: 0.9051, test_f1: 0.6014
 epoch: 22, train_loss: 0.7797, test_loss: 0.9107, test_f1: 0.5955
 epoch: 23, train_loss: 0.7793, test_loss: 0.8942, test_f1: 0.5976
 epoch: 24, train_loss: 0.7706, test_loss: 0.8816, test_f1: 0.6270
 epoch: 25, train_loss: 0.7604, test_loss: 0.9262, test_f1: 0.5823
 epoch: 26, train_loss: 0.7494, test_loss: 0.8718, test_f1: 0.5937
 epoch: 27, train_loss: 0.7400, test_loss: 0.9271, test_f1: 0.5993
 epoch: 28, train_loss: 0.7385, test_loss: 0.8871, test_f1: 0.6133
 epoch: 29, train_loss: 0.7278, test_loss: 0.9117, test_f1: 0.6214
 epoch: 30, train_loss: 0.7231, test_loss: 0.9161, test_f1: 0.6012
 epoch: 31, train_loss: 0.7178, test_loss: 0.8966, test_f1: 0.6240
 epoch: 32, train_loss: 0.7167, test_loss: 0.8951, test_f1: 0.6244
 epoch: 33, train_loss: 0.7013, test_loss: 0.9127, test_f1: 0.6135
 epoch: 34, train_loss: 0.6878, test_loss: 0.8844, test_f1: 0.6206
 epoch: 35, train_loss: 0.6888, test_loss: 0.9222, test_f1: 0.5979
 epoch: 36, train_loss: 0.7021, test_loss: 0.9089, test_f1: 0.6335
 epoch: 37, train_loss: 0.6888, test_loss: 0.8933, test_f1: 0.5996
 epoch: 38, train_loss: 0.6800, test_loss: 0.8982, test_f1: 0.6074
 epoch: 39, train_loss: 0.6741, test_loss: 0.8973, test_f1: 0.6342
 epoch: 40, train_loss: 0.6632, test_loss: 0.9177, test_f1: 0.6238
 epoch: 41, train_loss: 0.6631, test_loss: 0.8847, test_f1: 0.6150
 epoch: 42, train_loss: 0.6640, test_loss: 0.9201, test_f1: 0.6133
 epoch: 43, train_loss: 0.6472, test_loss: 0.9255, test_f1: 0.6441
 epoch: 44, train_loss: 0.6469, test_loss: 0.9089, test_f1: 0.6331
 epoch: 45, train_loss: 0.6422, test_loss: 0.9390, test_f1: 0.6345
 epoch: 46, train_loss: 0.6317, test_loss: 0.9554, test_f1: 0.6237
 epoch: 47, train_loss: 0.6314, test_loss: 0.9677, test_f1: 0.6166
 epoch: 48, train_loss: 0.6172, test_loss: 0.9465, test_f1: 0.6437
 epoch: 49, train_loss: 0.6135, test_loss: 0.9545, test_f1: 0.6135
 epoch: 50, train_loss: 0.6108, test_loss: 0.9436, test_f1: 0.6221
 epoch: 51, train_loss: 0.5913, test_loss: 0.9423, test_f1: 0.6367
 epoch: 52, train_loss: 0.5830, test_loss: 0.9217, test_f1: 0.6240
 epoch: 53, train_loss: 0.5756, test_loss: 0.9428, test_f1: 0.6381
 epoch: 54, train_loss: 0.5780, test_loss: 0.9584, test_f1: 0.6331
 epoch: 55, train_loss: 0.5694, test_loss: 0.9319, test_f1: 0.6354
 epoch: 56, train_loss: 0.5588, test_loss: 0.9749, test_f1: 0.6375
 epoch: 57, train_loss: 0.5726, test_loss: 0.9438, test_f1: 0.6485
 epoch: 58, train_loss: 0.5647, test_loss: 0.9294, test_f1: 0.6530
 epoch: 59, train_loss: 0.5528, test_loss: 0.9157, test_f1: 0.6592
 epoch: 60, train_loss: 0.5556, test_loss: 0.9508, test_f1: 0.6536
 epoch: 61, train_loss: 0.5492, test_loss: 0.9537, test_f1: 0.6411
 epoch: 62, train_loss: 0.5542, test_loss: 0.9468, test_f1: 0.6565
 epoch: 63, train_loss: 0.5389, test_loss: 0.9372, test_f1: 0.6522
 epoch: 64, train_loss: 0.5301, test_loss: 0.9752, test_f1: 0.6367
 epoch: 65, train_loss: 0.5276, test_loss: 0.9649, test_f1: 0.6550
 epoch: 66, train_loss: 0.5361, test_loss: 0.9486, test_f1: 0.6464
 epoch: 67, train_loss: 0.5221, test_loss: 0.9515, test_f1: 0.6412
 epoch: 68, train_loss: 0.5273, test_loss: 1.0125, test_f1: 0.6213
 epoch: 69, train_loss: 0.5172, test_loss: 1.0091, test_f1: 0.6321
 epoch: 70, train_loss: 0.5290, test_loss: 1.0271, test_f1: 0.6333
 epoch: 71, train_loss: 0.5233, test_loss: 1.0191, test_f1: 0.6450
 epoch: 72, train_loss: 0.5215, test_loss: 0.9874, test_f1: 0.6488
 epoch: 73, train_loss: 0.5010, test_loss: 1.0045, test_f1: 0.6279
 epoch: 74, train_loss: 0.5003, test_loss: 1.0320, test_f1: 0.6203
 epoch: 75, train_loss: 0.5013, test_loss: 0.9878, test_f1: 0.6299
 epoch: 76, train_loss: 0.5035, test_loss: 1.0113, test_f1: 0.6346
 epoch: 77, train_loss: 0.4948, test_loss: 1.0270, test_f1: 0.6313
 epoch: 78, train_loss: 0.4954, test_loss: 0.9761, test_f1: 0.6482
 epoch: 79, train_loss: 0.4993, test_loss: 1.0271, test_f1: 0.6417
 epoch: 80, train_loss: 0.4870, test_loss: 0.9885, test_f1: 0.6256
 epoch: 81, train_loss: 0.4925, test_loss: 0.9971, test_f1: 0.6362
 epoch: 82, train_loss: 0.4777, test_loss: 0.9813, test_f1: 0.6472
 epoch: 83, train_loss: 0.4818, test_loss: 1.0247, test_f1: 0.6583
 epoch: 84, train_loss: 0.4725, test_loss: 1.0375, test_f1: 0.6576
 epoch: 85, train_loss: 0.4695, test_loss: 0.9955, test_f1: 0.6579
 epoch: 86, train_loss: 0.4716, test_loss: 1.0050, test_f1: 0.6204
 epoch: 87, train_loss: 0.4723, test_loss: 1.0413, test_f1: 0.6358
 epoch: 88, train_loss: 0.4603, test_loss: 1.0426, test_f1: 0.6373
 epoch: 89, train_loss: 0.4722, test_loss: 1.0579, test_f1: 0.6553
 epoch: 90, train_loss: 0.4543, test_loss: 1.0437, test_f1: 0.6288
 epoch: 91, train_loss: 0.4661, test_loss: 1.0094, test_f1: 0.6477
 epoch: 92, train_loss: 0.4540, test_loss: 1.0400, test_f1: 0.6514
 epoch: 93, train_loss: 0.4521, test_loss: 1.1004, test_f1: 0.6381
 epoch: 94, train_loss: 0.4534, test_loss: 1.0571, test_f1: 0.6417
 epoch: 95, train_loss: 0.4449, test_loss: 1.0774, test_f1: 0.6459
 epoch: 96, train_loss: 0.4547, test_loss: 1.0505, test_f1: 0.6539
 epoch: 97, train_loss: 0.4439, test_loss: 1.1093, test_f1: 0.6457
 epoch: 98, train_loss: 0.4412, test_loss: 1.0789, test_f1: 0.6296
 epoch: 99, train_loss: 0.4315, test_loss: 1.1020, test_f1: 0.6589
##################ITERATION #3 ****************************************
 epoch: 0, train_loss: 1.2184, test_loss: 1.1624, test_f1: 0.4012
 epoch: 1, train_loss: 1.0931, test_loss: 1.0140, test_f1: 0.5104
 epoch: 2, train_loss: 1.0477, test_loss: 0.9674, test_f1: 0.5119
 epoch: 3, train_loss: 1.0169, test_loss: 0.9487, test_f1: 0.5142
 epoch: 4, train_loss: 0.9908, test_loss: 0.9160, test_f1: 0.5246
 epoch: 5, train_loss: 0.9747, test_loss: 0.9381, test_f1: 0.5350
 epoch: 6, train_loss: 0.9400, test_loss: 0.9018, test_f1: 0.5195
 epoch: 7, train_loss: 0.9349, test_loss: 0.8866, test_f1: 0.5473
 epoch: 8, train_loss: 0.9113, test_loss: 0.8883, test_f1: 0.5407
 epoch: 9, train_loss: 0.8952, test_loss: 0.8805, test_f1: 0.5411
 epoch: 10, train_loss: 0.8812, test_loss: 0.8758, test_f1: 0.5402
 epoch: 11, train_loss: 0.8745, test_loss: 0.8929, test_f1: 0.5538
 epoch: 12, train_loss: 0.8630, test_loss: 0.8764, test_f1: 0.5771
 epoch: 13, train_loss: 0.8542, test_loss: 0.9043, test_f1: 0.5545
 epoch: 14, train_loss: 0.8485, test_loss: 0.8995, test_f1: 0.5584
 epoch: 15, train_loss: 0.8309, test_loss: 0.8990, test_f1: 0.5416
 epoch: 16, train_loss: 0.8185, test_loss: 0.9031, test_f1: 0.5605
 epoch: 17, train_loss: 0.8075, test_loss: 0.8927, test_f1: 0.5837
 epoch: 18, train_loss: 0.7944, test_loss: 0.9090, test_f1: 0.5776
 epoch: 19, train_loss: 0.7900, test_loss: 0.8950, test_f1: 0.5763
 epoch: 20, train_loss: 0.7884, test_loss: 0.8736, test_f1: 0.6216
 epoch: 21, train_loss: 0.7754, test_loss: 0.8726, test_f1: 0.6015
 epoch: 22, train_loss: 0.7714, test_loss: 0.9094, test_f1: 0.6155
 epoch: 23, train_loss: 0.7686, test_loss: 0.8950, test_f1: 0.5783
 epoch: 24, train_loss: 0.7585, test_loss: 0.9084, test_f1: 0.6143
 epoch: 25, train_loss: 0.7526, test_loss: 0.8996, test_f1: 0.6192
 epoch: 26, train_loss: 0.7458, test_loss: 0.9303, test_f1: 0.6027
 epoch: 27, train_loss: 0.7294, test_loss: 0.9387, test_f1: 0.6029
 epoch: 28, train_loss: 0.7394, test_loss: 0.8920, test_f1: 0.6232
 epoch: 29, train_loss: 0.7163, test_loss: 0.9186, test_f1: 0.5835
 epoch: 30, train_loss: 0.7196, test_loss: 0.9080, test_f1: 0.6334
 epoch: 31, train_loss: 0.7128, test_loss: 0.8830, test_f1: 0.6454
 epoch: 32, train_loss: 0.7068, test_loss: 0.9106, test_f1: 0.6181
 epoch: 33, train_loss: 0.6952, test_loss: 0.9198, test_f1: 0.6165
 epoch: 34, train_loss: 0.6899, test_loss: 0.9239, test_f1: 0.6383
 epoch: 35, train_loss: 0.6766, test_loss: 0.9356, test_f1: 0.6582
 epoch: 36, train_loss: 0.6801, test_loss: 0.8865, test_f1: 0.6620
 epoch: 37, train_loss: 0.6784, test_loss: 0.9158, test_f1: 0.6380
 epoch: 38, train_loss: 0.6758, test_loss: 0.9206, test_f1: 0.6347
 epoch: 39, train_loss: 0.6751, test_loss: 0.9319, test_f1: 0.6301
 epoch: 40, train_loss: 0.6633, test_loss: 0.9592, test_f1: 0.6084
 epoch: 41, train_loss: 0.6429, test_loss: 0.9238, test_f1: 0.6339
 epoch: 42, train_loss: 0.6478, test_loss: 0.9341, test_f1: 0.6142
 epoch: 43, train_loss: 0.6394, test_loss: 0.9484, test_f1: 0.6428
 epoch: 44, train_loss: 0.6417, test_loss: 0.9736, test_f1: 0.6286
 epoch: 45, train_loss: 0.6262, test_loss: 0.9329, test_f1: 0.6272
 epoch: 46, train_loss: 0.6157, test_loss: 0.9202, test_f1: 0.6433
 epoch: 47, train_loss: 0.6167, test_loss: 0.9591, test_f1: 0.6561
 epoch: 48, train_loss: 0.6067, test_loss: 0.9496, test_f1: 0.6427
 epoch: 49, train_loss: 0.6100, test_loss: 0.9706, test_f1: 0.6514
 epoch: 50, train_loss: 0.6079, test_loss: 0.9923, test_f1: 0.6272
 epoch: 51, train_loss: 0.5857, test_loss: 1.0012, test_f1: 0.6249
 epoch: 52, train_loss: 0.5796, test_loss: 0.9567, test_f1: 0.6606
 epoch: 53, train_loss: 0.5716, test_loss: 0.9866, test_f1: 0.6235
 epoch: 54, train_loss: 0.5677, test_loss: 0.9690, test_f1: 0.6422
 epoch: 55, train_loss: 0.5655, test_loss: 0.9852, test_f1: 0.6274
 epoch: 56, train_loss: 0.5516, test_loss: 0.9729, test_f1: 0.6417
 epoch: 57, train_loss: 0.5505, test_loss: 1.0045, test_f1: 0.6305
 epoch: 58, train_loss: 0.5665, test_loss: 1.0189, test_f1: 0.6374
 epoch: 59, train_loss: 0.5446, test_loss: 0.9830, test_f1: 0.6385
 epoch: 60, train_loss: 0.5488, test_loss: 0.9924, test_f1: 0.6612
 epoch: 61, train_loss: 0.5258, test_loss: 1.0083, test_f1: 0.6374
 epoch: 62, train_loss: 0.5295, test_loss: 0.9964, test_f1: 0.6321
 epoch: 63, train_loss: 0.5385, test_loss: 1.0073, test_f1: 0.6462
 epoch: 64, train_loss: 0.5447, test_loss: 1.0066, test_f1: 0.6540
 epoch: 65, train_loss: 0.5273, test_loss: 1.0302, test_f1: 0.6454
 epoch: 66, train_loss: 0.5196, test_loss: 1.0557, test_f1: 0.6202
 epoch: 67, train_loss: 0.5307, test_loss: 1.0457, test_f1: 0.6552
 epoch: 68, train_loss: 0.5246, test_loss: 1.0568, test_f1: 0.6415
 epoch: 69, train_loss: 0.5248, test_loss: 1.0351, test_f1: 0.6478
 epoch: 70, train_loss: 0.5161, test_loss: 1.0561, test_f1: 0.6309
 epoch: 71, train_loss: 0.5176, test_loss: 1.0591, test_f1: 0.6387
 epoch: 72, train_loss: 0.5118, test_loss: 1.0330, test_f1: 0.6293
 epoch: 73, train_loss: 0.5083, test_loss: 1.0520, test_f1: 0.6335
 epoch: 74, train_loss: 0.4991, test_loss: 1.0630, test_f1: 0.6343
 epoch: 75, train_loss: 0.5029, test_loss: 1.0679, test_f1: 0.6369
 epoch: 76, train_loss: 0.4951, test_loss: 1.0834, test_f1: 0.6496
 epoch: 77, train_loss: 0.4981, test_loss: 1.1003, test_f1: 0.6403
 epoch: 78, train_loss: 0.4927, test_loss: 1.1043, test_f1: 0.6499
 epoch: 79, train_loss: 0.5019, test_loss: 1.0927, test_f1: 0.6368
 epoch: 80, train_loss: 0.4747, test_loss: 1.1087, test_f1: 0.6277
 epoch: 81, train_loss: 0.4821, test_loss: 1.1189, test_f1: 0.6502
 epoch: 82, train_loss: 0.4913, test_loss: 1.1157, test_f1: 0.6267
 epoch: 83, train_loss: 0.4778, test_loss: 1.1317, test_f1: 0.6436
 epoch: 84, train_loss: 0.4822, test_loss: 1.0656, test_f1: 0.6447
 epoch: 85, train_loss: 0.4939, test_loss: 1.0941, test_f1: 0.6331
 epoch: 86, train_loss: 0.4787, test_loss: 1.1300, test_f1: 0.6369
 epoch: 87, train_loss: 0.4706, test_loss: 1.1301, test_f1: 0.6323
 epoch: 88, train_loss: 0.4712, test_loss: 1.1197, test_f1: 0.6195
 epoch: 89, train_loss: 0.4748, test_loss: 1.1508, test_f1: 0.6336
 epoch: 90, train_loss: 0.4688, test_loss: 1.1511, test_f1: 0.6391
 epoch: 91, train_loss: 0.4589, test_loss: 1.1479, test_f1: 0.6288
 epoch: 92, train_loss: 0.4617, test_loss: 1.1681, test_f1: 0.6385
 epoch: 93, train_loss: 0.4642, test_loss: 1.1802, test_f1: 0.6529
 epoch: 94, train_loss: 0.4559, test_loss: 1.1546, test_f1: 0.6503
 epoch: 95, train_loss: 0.4495, test_loss: 1.1994, test_f1: 0.6355
 epoch: 96, train_loss: 0.4481, test_loss: 1.1307, test_f1: 0.6612
 epoch: 97, train_loss: 0.4285, test_loss: 1.1595, test_f1: 0.6390
 epoch: 98, train_loss: 0.4355, test_loss: 1.1596, test_f1: 0.6523
 epoch: 99, train_loss: 0.4399, test_loss: 1.1775, test_f1: 0.6578
##################ITERATION #4 ****************************************
 epoch: 0, train_loss: 1.2164, test_loss: 1.1549, test_f1: 0.4097
 epoch: 1, train_loss: 1.0908, test_loss: 1.0031, test_f1: 0.4989
 epoch: 2, train_loss: 1.0423, test_loss: 0.9682, test_f1: 0.5196
 epoch: 3, train_loss: 1.0130, test_loss: 0.9487, test_f1: 0.5160
 epoch: 4, train_loss: 0.9707, test_loss: 0.9218, test_f1: 0.5493
 epoch: 5, train_loss: 0.9595, test_loss: 0.9111, test_f1: 0.5399
 epoch: 6, train_loss: 0.9384, test_loss: 0.8936, test_f1: 0.5397
 epoch: 7, train_loss: 0.9249, test_loss: 0.9065, test_f1: 0.5384
 epoch: 8, train_loss: 0.9077, test_loss: 0.9062, test_f1: 0.5701
 epoch: 9, train_loss: 0.9044, test_loss: 0.8908, test_f1: 0.5638
 epoch: 10, train_loss: 0.8838, test_loss: 0.9099, test_f1: 0.5567
 epoch: 11, train_loss: 0.8709, test_loss: 0.8922, test_f1: 0.5921
 epoch: 12, train_loss: 0.8556, test_loss: 0.8903, test_f1: 0.5851
 epoch: 13, train_loss: 0.8522, test_loss: 0.8920, test_f1: 0.5679
 epoch: 14, train_loss: 0.8336, test_loss: 0.9144, test_f1: 0.5729
 epoch: 15, train_loss: 0.8250, test_loss: 0.8850, test_f1: 0.5868
 epoch: 16, train_loss: 0.8143, test_loss: 0.9032, test_f1: 0.5945
 epoch: 17, train_loss: 0.8213, test_loss: 0.9162, test_f1: 0.5725
 epoch: 18, train_loss: 0.7998, test_loss: 0.8886, test_f1: 0.5960
 epoch: 19, train_loss: 0.8113, test_loss: 0.8840, test_f1: 0.5996
 epoch: 20, train_loss: 0.7876, test_loss: 0.8901, test_f1: 0.6057
 epoch: 21, train_loss: 0.7742, test_loss: 0.8753, test_f1: 0.5970
 epoch: 22, train_loss: 0.7783, test_loss: 0.9075, test_f1: 0.5925
 epoch: 23, train_loss: 0.7610, test_loss: 0.9159, test_f1: 0.5849
 epoch: 24, train_loss: 0.7590, test_loss: 0.8947, test_f1: 0.6037
 epoch: 25, train_loss: 0.7505, test_loss: 0.8646, test_f1: 0.6315
 epoch: 26, train_loss: 0.7523, test_loss: 0.9198, test_f1: 0.6066
 epoch: 27, train_loss: 0.7410, test_loss: 0.9173, test_f1: 0.5991
 epoch: 28, train_loss: 0.7281, test_loss: 0.8576, test_f1: 0.6193
 epoch: 29, train_loss: 0.7320, test_loss: 0.9067, test_f1: 0.6140
 epoch: 30, train_loss: 0.7125, test_loss: 0.9333, test_f1: 0.6184
 epoch: 31, train_loss: 0.7196, test_loss: 0.9117, test_f1: 0.6151
 epoch: 32, train_loss: 0.7153, test_loss: 0.9234, test_f1: 0.6042
 epoch: 33, train_loss: 0.7031, test_loss: 0.8890, test_f1: 0.6250
 epoch: 34, train_loss: 0.6819, test_loss: 0.9218, test_f1: 0.6062
 epoch: 35, train_loss: 0.6785, test_loss: 0.9157, test_f1: 0.6271
 epoch: 36, train_loss: 0.6805, test_loss: 0.8742, test_f1: 0.6277
 epoch: 37, train_loss: 0.6709, test_loss: 0.9330, test_f1: 0.6209
 epoch: 38, train_loss: 0.6615, test_loss: 0.8844, test_f1: 0.6338
 epoch: 39, train_loss: 0.6906, test_loss: 0.9198, test_f1: 0.6093
 epoch: 40, train_loss: 0.6496, test_loss: 0.9213, test_f1: 0.6202
 epoch: 41, train_loss: 0.6560, test_loss: 0.9033, test_f1: 0.6214
 epoch: 42, train_loss: 0.6407, test_loss: 0.9311, test_f1: 0.6318
 epoch: 43, train_loss: 0.6493, test_loss: 0.9081, test_f1: 0.6336
 epoch: 44, train_loss: 0.6333, test_loss: 0.9384, test_f1: 0.6207
 epoch: 45, train_loss: 0.6370, test_loss: 0.9036, test_f1: 0.6215
 epoch: 46, train_loss: 0.6444, test_loss: 0.9118, test_f1: 0.6313
 epoch: 47, train_loss: 0.6198, test_loss: 0.9319, test_f1: 0.6104
 epoch: 48, train_loss: 0.6216, test_loss: 0.9627, test_f1: 0.6081
 epoch: 49, train_loss: 0.6221, test_loss: 0.9488, test_f1: 0.6204
 epoch: 50, train_loss: 0.6126, test_loss: 0.9083, test_f1: 0.6246
 epoch: 51, train_loss: 0.5960, test_loss: 0.9407, test_f1: 0.6179
 epoch: 52, train_loss: 0.5829, test_loss: 0.9069, test_f1: 0.6197
 epoch: 53, train_loss: 0.5832, test_loss: 0.9322, test_f1: 0.6141
 epoch: 54, train_loss: 0.5653, test_loss: 0.9237, test_f1: 0.6249
 epoch: 55, train_loss: 0.5711, test_loss: 0.9390, test_f1: 0.6302
 epoch: 56, train_loss: 0.5771, test_loss: 0.9427, test_f1: 0.6182
 epoch: 57, train_loss: 0.5724, test_loss: 0.9226, test_f1: 0.6356
 epoch: 58, train_loss: 0.5625, test_loss: 0.9102, test_f1: 0.6333
 epoch: 59, train_loss: 0.5605, test_loss: 0.9280, test_f1: 0.6432
 epoch: 60, train_loss: 0.5638, test_loss: 0.9507, test_f1: 0.6424
 epoch: 61, train_loss: 0.5703, test_loss: 0.9744, test_f1: 0.6082
 epoch: 62, train_loss: 0.5389, test_loss: 0.9542, test_f1: 0.6297
 epoch: 63, train_loss: 0.5415, test_loss: 0.9593, test_f1: 0.6285
 epoch: 64, train_loss: 0.5360, test_loss: 0.9811, test_f1: 0.6187
 epoch: 65, train_loss: 0.5453, test_loss: 0.9567, test_f1: 0.6224
 epoch: 66, train_loss: 0.5318, test_loss: 0.9767, test_f1: 0.6191
 epoch: 67, train_loss: 0.5247, test_loss: 0.9775, test_f1: 0.6101
 epoch: 68, train_loss: 0.5445, test_loss: 0.9810, test_f1: 0.6324
 epoch: 69, train_loss: 0.5283, test_loss: 0.9522, test_f1: 0.6396
 epoch: 70, train_loss: 0.5262, test_loss: 0.9579, test_f1: 0.6274
 epoch: 71, train_loss: 0.5206, test_loss: 0.9738, test_f1: 0.6402
 epoch: 72, train_loss: 0.5068, test_loss: 0.9895, test_f1: 0.6236
 epoch: 73, train_loss: 0.5257, test_loss: 0.9998, test_f1: 0.6202
 epoch: 74, train_loss: 0.5155, test_loss: 0.9937, test_f1: 0.6267
 epoch: 75, train_loss: 0.5172, test_loss: 0.9711, test_f1: 0.6400
 epoch: 76, train_loss: 0.5150, test_loss: 0.9832, test_f1: 0.6419
 epoch: 77, train_loss: 0.5073, test_loss: 0.9873, test_f1: 0.6395
 epoch: 78, train_loss: 0.5083, test_loss: 1.0002, test_f1: 0.6259
 epoch: 79, train_loss: 0.4968, test_loss: 1.0252, test_f1: 0.6182
 epoch: 80, train_loss: 0.4972, test_loss: 1.0010, test_f1: 0.6339
 epoch: 81, train_loss: 0.4907, test_loss: 1.0294, test_f1: 0.6477
 epoch: 82, train_loss: 0.4887, test_loss: 1.0235, test_f1: 0.6356
 epoch: 83, train_loss: 0.4976, test_loss: 1.0393, test_f1: 0.6201
 epoch: 84, train_loss: 0.5020, test_loss: 1.0338, test_f1: 0.6236
 epoch: 85, train_loss: 0.4819, test_loss: 1.0351, test_f1: 0.6276
 epoch: 86, train_loss: 0.4749, test_loss: 1.0369, test_f1: 0.6336
 epoch: 87, train_loss: 0.4640, test_loss: 1.0819, test_f1: 0.6211
 epoch: 88, train_loss: 0.4643, test_loss: 1.0478, test_f1: 0.6185
 epoch: 89, train_loss: 0.4666, test_loss: 1.0595, test_f1: 0.6344
 epoch: 90, train_loss: 0.4646, test_loss: 1.0761, test_f1: 0.6244
 epoch: 91, train_loss: 0.4727, test_loss: 1.0829, test_f1: 0.6293
 epoch: 92, train_loss: 0.4574, test_loss: 1.0902, test_f1: 0.6220
 epoch: 93, train_loss: 0.4614, test_loss: 1.0892, test_f1: 0.6182
 epoch: 94, train_loss: 0.4740, test_loss: 1.0917, test_f1: 0.6280
 epoch: 95, train_loss: 0.4520, test_loss: 1.0789, test_f1: 0.6381
 epoch: 96, train_loss: 0.4665, test_loss: 1.0838, test_f1: 0.6504
 epoch: 97, train_loss: 0.4513, test_loss: 1.0913, test_f1: 0.6261
 epoch: 98, train_loss: 0.4406, test_loss: 1.0823, test_f1: 0.6398
 epoch: 99, train_loss: 0.4541, test_loss: 1.0830, test_f1: 0.6416
##################ITERATION #5 ****************************************
 epoch: 0, train_loss: 1.2411, test_loss: 1.1519, test_f1: 0.4185
 epoch: 1, train_loss: 1.0947, test_loss: 0.9969, test_f1: 0.4901
 epoch: 2, train_loss: 1.0591, test_loss: 0.9755, test_f1: 0.5084
 epoch: 3, train_loss: 1.0187, test_loss: 0.9450, test_f1: 0.5349
 epoch: 4, train_loss: 1.0077, test_loss: 0.9503, test_f1: 0.5144
 epoch: 5, train_loss: 0.9835, test_loss: 0.9289, test_f1: 0.5516
 epoch: 6, train_loss: 0.9542, test_loss: 0.9280, test_f1: 0.5423
 epoch: 7, train_loss: 0.9347, test_loss: 0.9097, test_f1: 0.5540
 epoch: 8, train_loss: 0.9158, test_loss: 0.9106, test_f1: 0.5287
 epoch: 9, train_loss: 0.8937, test_loss: 0.9032, test_f1: 0.5264
 epoch: 10, train_loss: 0.8931, test_loss: 0.8824, test_f1: 0.5674
 epoch: 11, train_loss: 0.8773, test_loss: 0.9074, test_f1: 0.5497
 epoch: 12, train_loss: 0.8634, test_loss: 0.8951, test_f1: 0.5589
 epoch: 13, train_loss: 0.8524, test_loss: 0.8980, test_f1: 0.5798
 epoch: 14, train_loss: 0.8462, test_loss: 0.8947, test_f1: 0.5685
 epoch: 15, train_loss: 0.8419, test_loss: 0.8941, test_f1: 0.5836
 epoch: 16, train_loss: 0.8285, test_loss: 0.8908, test_f1: 0.5866
 epoch: 17, train_loss: 0.8183, test_loss: 0.8989, test_f1: 0.5803
 epoch: 18, train_loss: 0.8048, test_loss: 0.8904, test_f1: 0.6136
 epoch: 19, train_loss: 0.7850, test_loss: 0.8877, test_f1: 0.5860
 epoch: 20, train_loss: 0.7904, test_loss: 0.8851, test_f1: 0.6039
 epoch: 21, train_loss: 0.7820, test_loss: 0.9161, test_f1: 0.6092
 epoch: 22, train_loss: 0.7793, test_loss: 0.8711, test_f1: 0.6108
 epoch: 23, train_loss: 0.7603, test_loss: 0.8714, test_f1: 0.6143
 epoch: 24, train_loss: 0.7542, test_loss: 0.8888, test_f1: 0.6149
 epoch: 25, train_loss: 0.7466, test_loss: 0.8959, test_f1: 0.6117
 epoch: 26, train_loss: 0.7308, test_loss: 0.8784, test_f1: 0.6019
 epoch: 27, train_loss: 0.7369, test_loss: 0.8907, test_f1: 0.6239
 epoch: 28, train_loss: 0.7309, test_loss: 0.9010, test_f1: 0.6375
 epoch: 29, train_loss: 0.7144, test_loss: 0.9300, test_f1: 0.6135
 epoch: 30, train_loss: 0.7163, test_loss: 0.9096, test_f1: 0.6352
 epoch: 31, train_loss: 0.7038, test_loss: 0.9253, test_f1: 0.6075
 epoch: 32, train_loss: 0.7057, test_loss: 0.9071, test_f1: 0.6265
 epoch: 33, train_loss: 0.7035, test_loss: 0.9196, test_f1: 0.6024
 epoch: 34, train_loss: 0.6909, test_loss: 0.8811, test_f1: 0.6409
 epoch: 35, train_loss: 0.6980, test_loss: 0.8934, test_f1: 0.6305
 epoch: 36, train_loss: 0.6835, test_loss: 0.9320, test_f1: 0.6213
 epoch: 37, train_loss: 0.6910, test_loss: 0.9086, test_f1: 0.6301
 epoch: 38, train_loss: 0.6757, test_loss: 0.9128, test_f1: 0.6187
 epoch: 39, train_loss: 0.6697, test_loss: 0.9334, test_f1: 0.6221
 epoch: 40, train_loss: 0.6584, test_loss: 0.8982, test_f1: 0.6359
 epoch: 41, train_loss: 0.6531, test_loss: 0.9169, test_f1: 0.6302
 epoch: 42, train_loss: 0.6424, test_loss: 0.8986, test_f1: 0.6343
 epoch: 43, train_loss: 0.6436, test_loss: 0.9125, test_f1: 0.6297
 epoch: 44, train_loss: 0.6397, test_loss: 0.9011, test_f1: 0.6298
 epoch: 45, train_loss: 0.6362, test_loss: 0.9230, test_f1: 0.6407
 epoch: 46, train_loss: 0.6174, test_loss: 0.9166, test_f1: 0.6428
 epoch: 47, train_loss: 0.6371, test_loss: 0.9082, test_f1: 0.6528
 epoch: 48, train_loss: 0.6102, test_loss: 0.9201, test_f1: 0.6569
 epoch: 49, train_loss: 0.6088, test_loss: 0.9266, test_f1: 0.6297
 epoch: 50, train_loss: 0.6031, test_loss: 0.9390, test_f1: 0.6428
 epoch: 51, train_loss: 0.5837, test_loss: 0.9288, test_f1: 0.6563
 epoch: 52, train_loss: 0.5737, test_loss: 0.9272, test_f1: 0.6407
 epoch: 53, train_loss: 0.5761, test_loss: 0.9312, test_f1: 0.6695
 epoch: 54, train_loss: 0.5623, test_loss: 0.9295, test_f1: 0.6565
 epoch: 55, train_loss: 0.5447, test_loss: 0.9311, test_f1: 0.6540
 epoch: 56, train_loss: 0.5556, test_loss: 0.9383, test_f1: 0.6458
 epoch: 57, train_loss: 0.5580, test_loss: 0.9368, test_f1: 0.6832
 epoch: 58, train_loss: 0.5651, test_loss: 0.9179, test_f1: 0.6584
 epoch: 59, train_loss: 0.5447, test_loss: 0.9131, test_f1: 0.6613
 epoch: 60, train_loss: 0.5543, test_loss: 0.9412, test_f1: 0.6660
 epoch: 61, train_loss: 0.5395, test_loss: 0.9372, test_f1: 0.6525
 epoch: 62, train_loss: 0.5260, test_loss: 0.9517, test_f1: 0.6581
 epoch: 63, train_loss: 0.5473, test_loss: 0.9485, test_f1: 0.6653
 epoch: 64, train_loss: 0.5232, test_loss: 0.9654, test_f1: 0.6574
 epoch: 65, train_loss: 0.5263, test_loss: 0.9555, test_f1: 0.6756
 epoch: 66, train_loss: 0.5305, test_loss: 0.9543, test_f1: 0.6541
 epoch: 67, train_loss: 0.5355, test_loss: 0.9723, test_f1: 0.6617
 epoch: 68, train_loss: 0.5365, test_loss: 0.9495, test_f1: 0.6892
 epoch: 69, train_loss: 0.5138, test_loss: 0.9414, test_f1: 0.6799
 epoch: 70, train_loss: 0.5281, test_loss: 0.9725, test_f1: 0.6866
 epoch: 71, train_loss: 0.5245, test_loss: 0.9820, test_f1: 0.6650
 epoch: 72, train_loss: 0.5093, test_loss: 0.9785, test_f1: 0.6562
 epoch: 73, train_loss: 0.5191, test_loss: 0.9747, test_f1: 0.6502
 epoch: 74, train_loss: 0.5013, test_loss: 1.0045, test_f1: 0.6694
 epoch: 75, train_loss: 0.5028, test_loss: 0.9962, test_f1: 0.6737
 epoch: 76, train_loss: 0.5005, test_loss: 0.9672, test_f1: 0.6792
 epoch: 77, train_loss: 0.5039, test_loss: 0.9920, test_f1: 0.6615
 epoch: 78, train_loss: 0.4868, test_loss: 0.9701, test_f1: 0.6728
 epoch: 79, train_loss: 0.4893, test_loss: 0.9705, test_f1: 0.6868
 epoch: 80, train_loss: 0.4872, test_loss: 0.9834, test_f1: 0.6916
 epoch: 81, train_loss: 0.4858, test_loss: 0.9849, test_f1: 0.6759
 epoch: 82, train_loss: 0.4872, test_loss: 0.9841, test_f1: 0.6580
 epoch: 83, train_loss: 0.4973, test_loss: 1.0092, test_f1: 0.6716
 epoch: 84, train_loss: 0.4854, test_loss: 0.9980, test_f1: 0.6840
 epoch: 85, train_loss: 0.4766, test_loss: 0.9807, test_f1: 0.6833
 epoch: 86, train_loss: 0.4768, test_loss: 1.0328, test_f1: 0.6482
 epoch: 87, train_loss: 0.4691, test_loss: 1.0122, test_f1: 0.6891
 epoch: 88, train_loss: 0.4628, test_loss: 1.0302, test_f1: 0.6711
 epoch: 89, train_loss: 0.4735, test_loss: 1.0081, test_f1: 0.6679
 epoch: 90, train_loss: 0.4662, test_loss: 1.0214, test_f1: 0.6788
 epoch: 91, train_loss: 0.4672, test_loss: 1.0420, test_f1: 0.6443
 epoch: 92, train_loss: 0.4455, test_loss: 1.0359, test_f1: 0.6914
 epoch: 93, train_loss: 0.4538, test_loss: 1.0191, test_f1: 0.6622
 epoch: 94, train_loss: 0.4521, test_loss: 1.0731, test_f1: 0.6590
 epoch: 95, train_loss: 0.4498, test_loss: 1.0225, test_f1: 0.6849
 epoch: 96, train_loss: 0.4441, test_loss: 1.0591, test_f1: 0.6758
 epoch: 97, train_loss: 0.4400, test_loss: 1.0395, test_f1: 0.6963
 epoch: 98, train_loss: 0.4423, test_loss: 1.0463, test_f1: 0.6963
 epoch: 99, train_loss: 0.4400, test_loss: 1.0800, test_f1: 0.6800
##################ITERATION #6 ****************************************
 epoch: 0, train_loss: 1.2308, test_loss: 1.2516, test_f1: 0.2766
 epoch: 1, train_loss: 1.0985, test_loss: 0.9788, test_f1: 0.4951
 epoch: 2, train_loss: 1.0486, test_loss: 0.9424, test_f1: 0.5236
 epoch: 3, train_loss: 1.0014, test_loss: 0.9409, test_f1: 0.5252
 epoch: 4, train_loss: 0.9878, test_loss: 0.9367, test_f1: 0.5288
 epoch: 5, train_loss: 0.9615, test_loss: 0.9264, test_f1: 0.5242
 epoch: 6, train_loss: 0.9333, test_loss: 0.9099, test_f1: 0.5639
 epoch: 7, train_loss: 0.9236, test_loss: 0.9138, test_f1: 0.5210
 epoch: 8, train_loss: 0.9022, test_loss: 0.8918, test_f1: 0.5625
 epoch: 9, train_loss: 0.9038, test_loss: 0.9105, test_f1: 0.5527
 epoch: 10, train_loss: 0.8892, test_loss: 0.8875, test_f1: 0.5612
 epoch: 11, train_loss: 0.8624, test_loss: 0.9071, test_f1: 0.5354
 epoch: 12, train_loss: 0.8709, test_loss: 0.8935, test_f1: 0.5450
 epoch: 13, train_loss: 0.8632, test_loss: 0.9005, test_f1: 0.5787
 epoch: 14, train_loss: 0.8555, test_loss: 0.9058, test_f1: 0.5496
 epoch: 15, train_loss: 0.8489, test_loss: 0.8865, test_f1: 0.5684
 epoch: 16, train_loss: 0.8359, test_loss: 0.8988, test_f1: 0.5846
 epoch: 17, train_loss: 0.8268, test_loss: 0.9197, test_f1: 0.5472
 epoch: 18, train_loss: 0.8226, test_loss: 0.8967, test_f1: 0.5925
 epoch: 19, train_loss: 0.7956, test_loss: 0.8880, test_f1: 0.6005
 epoch: 20, train_loss: 0.8018, test_loss: 0.8946, test_f1: 0.6006
 epoch: 21, train_loss: 0.7936, test_loss: 0.9027, test_f1: 0.6174
 epoch: 22, train_loss: 0.7948, test_loss: 0.9112, test_f1: 0.6205
 epoch: 23, train_loss: 0.7895, test_loss: 0.9012, test_f1: 0.6134
 epoch: 24, train_loss: 0.7685, test_loss: 0.9122, test_f1: 0.6068
 epoch: 25, train_loss: 0.7712, test_loss: 0.8872, test_f1: 0.5942
 epoch: 26, train_loss: 0.7565, test_loss: 0.9308, test_f1: 0.5697
 epoch: 27, train_loss: 0.7509, test_loss: 0.9029, test_f1: 0.6093
 epoch: 28, train_loss: 0.7394, test_loss: 0.9231, test_f1: 0.5742
 epoch: 29, train_loss: 0.7407, test_loss: 0.9098, test_f1: 0.5891
 epoch: 30, train_loss: 0.7351, test_loss: 0.9231, test_f1: 0.5874
 epoch: 31, train_loss: 0.7329, test_loss: 0.8995, test_f1: 0.6156
 epoch: 32, train_loss: 0.7343, test_loss: 0.9178, test_f1: 0.5924
 epoch: 33, train_loss: 0.7127, test_loss: 0.9430, test_f1: 0.5775
 epoch: 34, train_loss: 0.7153, test_loss: 0.9025, test_f1: 0.5889
 epoch: 35, train_loss: 0.7070, test_loss: 0.9094, test_f1: 0.5974
 epoch: 36, train_loss: 0.7104, test_loss: 0.9131, test_f1: 0.6166
 epoch: 37, train_loss: 0.6926, test_loss: 0.9017, test_f1: 0.5994
 epoch: 38, train_loss: 0.6886, test_loss: 0.9089, test_f1: 0.6024
 epoch: 39, train_loss: 0.6837, test_loss: 0.9191, test_f1: 0.5962
 epoch: 40, train_loss: 0.6860, test_loss: 0.9047, test_f1: 0.6219
 epoch: 41, train_loss: 0.6708, test_loss: 0.9226, test_f1: 0.5871
 epoch: 42, train_loss: 0.6635, test_loss: 0.9408, test_f1: 0.5769
 epoch: 43, train_loss: 0.6485, test_loss: 0.9376, test_f1: 0.6187
 epoch: 44, train_loss: 0.6537, test_loss: 0.9341, test_f1: 0.6309
 epoch: 45, train_loss: 0.6482, test_loss: 0.9728, test_f1: 0.5906
 epoch: 46, train_loss: 0.6364, test_loss: 0.9242, test_f1: 0.6221
 epoch: 47, train_loss: 0.6535, test_loss: 0.9897, test_f1: 0.5872
 epoch: 48, train_loss: 0.6444, test_loss: 0.9447, test_f1: 0.6304
 epoch: 49, train_loss: 0.6282, test_loss: 1.0018, test_f1: 0.6070
 epoch: 50, train_loss: 0.6317, test_loss: 0.9709, test_f1: 0.6158
 epoch: 51, train_loss: 0.6061, test_loss: 0.9829, test_f1: 0.6009
 epoch: 52, train_loss: 0.5879, test_loss: 0.9594, test_f1: 0.6150
 epoch: 53, train_loss: 0.5935, test_loss: 0.9710, test_f1: 0.6095
 epoch: 54, train_loss: 0.5864, test_loss: 0.9793, test_f1: 0.6222
 epoch: 55, train_loss: 0.5835, test_loss: 0.9704, test_f1: 0.6126
 epoch: 56, train_loss: 0.5759, test_loss: 0.9711, test_f1: 0.6032
 epoch: 57, train_loss: 0.5788, test_loss: 0.9806, test_f1: 0.6110
 epoch: 58, train_loss: 0.5729, test_loss: 1.0009, test_f1: 0.6087
 epoch: 59, train_loss: 0.5730, test_loss: 0.9690, test_f1: 0.6112
 epoch: 60, train_loss: 0.5645, test_loss: 1.0060, test_f1: 0.6133
 epoch: 61, train_loss: 0.5561, test_loss: 1.0210, test_f1: 0.6086
 epoch: 62, train_loss: 0.5578, test_loss: 1.0466, test_f1: 0.5992
 epoch: 63, train_loss: 0.5618, test_loss: 1.0446, test_f1: 0.5982
 epoch: 64, train_loss: 0.5695, test_loss: 1.0444, test_f1: 0.6128
 epoch: 65, train_loss: 0.5440, test_loss: 1.0275, test_f1: 0.6312
 epoch: 66, train_loss: 0.5478, test_loss: 1.0272, test_f1: 0.6117
 epoch: 67, train_loss: 0.5582, test_loss: 1.0462, test_f1: 0.6027
 epoch: 68, train_loss: 0.5436, test_loss: 1.0431, test_f1: 0.6235
 epoch: 69, train_loss: 0.5358, test_loss: 1.0266, test_f1: 0.6112
 epoch: 70, train_loss: 0.5345, test_loss: 1.0562, test_f1: 0.6230
 epoch: 71, train_loss: 0.5220, test_loss: 1.0333, test_f1: 0.6308
 epoch: 72, train_loss: 0.5294, test_loss: 1.0841, test_f1: 0.6169
 epoch: 73, train_loss: 0.5265, test_loss: 1.0434, test_f1: 0.6220
 epoch: 74, train_loss: 0.5249, test_loss: 1.0545, test_f1: 0.6218
 epoch: 75, train_loss: 0.5098, test_loss: 1.0606, test_f1: 0.6146
 epoch: 76, train_loss: 0.5233, test_loss: 1.0760, test_f1: 0.6205
 epoch: 77, train_loss: 0.5105, test_loss: 1.0892, test_f1: 0.6118
 epoch: 78, train_loss: 0.5104, test_loss: 1.0776, test_f1: 0.6270
 epoch: 79, train_loss: 0.5122, test_loss: 1.0698, test_f1: 0.6293
 epoch: 80, train_loss: 0.5056, test_loss: 1.1146, test_f1: 0.6221
 epoch: 81, train_loss: 0.5084, test_loss: 1.0745, test_f1: 0.6188
 epoch: 82, train_loss: 0.4965, test_loss: 1.1211, test_f1: 0.6312
 epoch: 83, train_loss: 0.5088, test_loss: 1.1245, test_f1: 0.6167
 epoch: 84, train_loss: 0.4948, test_loss: 1.0892, test_f1: 0.6495
 epoch: 85, train_loss: 0.4981, test_loss: 1.0779, test_f1: 0.6413
 epoch: 86, train_loss: 0.4763, test_loss: 1.0800, test_f1: 0.6417
 epoch: 87, train_loss: 0.4916, test_loss: 1.1032, test_f1: 0.6334
 epoch: 88, train_loss: 0.4808, test_loss: 1.1393, test_f1: 0.6238
 epoch: 89, train_loss: 0.4952, test_loss: 1.1109, test_f1: 0.6259
 epoch: 90, train_loss: 0.4799, test_loss: 1.1742, test_f1: 0.6370
 epoch: 91, train_loss: 0.4842, test_loss: 1.1687, test_f1: 0.6269
 epoch: 92, train_loss: 0.4859, test_loss: 1.1554, test_f1: 0.6340
 epoch: 93, train_loss: 0.4638, test_loss: 1.1691, test_f1: 0.6366
 epoch: 94, train_loss: 0.4777, test_loss: 1.1644, test_f1: 0.6232
 epoch: 95, train_loss: 0.4738, test_loss: 1.1614, test_f1: 0.6423
 epoch: 96, train_loss: 0.4589, test_loss: 1.1737, test_f1: 0.6442
 epoch: 97, train_loss: 0.4639, test_loss: 1.1424, test_f1: 0.6299
 epoch: 98, train_loss: 0.4711, test_loss: 1.1688, test_f1: 0.6332
 epoch: 99, train_loss: 0.4656, test_loss: 1.1606, test_f1: 0.6346
##################ITERATION #7 ****************************************
 epoch: 0, train_loss: 1.2317, test_loss: 1.1832, test_f1: 0.3013
 epoch: 1, train_loss: 1.1043, test_loss: 1.0001, test_f1: 0.4773
 epoch: 2, train_loss: 1.0489, test_loss: 0.9491, test_f1: 0.4976
 epoch: 3, train_loss: 1.0152, test_loss: 0.9312, test_f1: 0.5155
 epoch: 4, train_loss: 0.9942, test_loss: 0.9334, test_f1: 0.5085
 epoch: 5, train_loss: 0.9698, test_loss: 0.9270, test_f1: 0.4990
 epoch: 6, train_loss: 0.9536, test_loss: 0.9441, test_f1: 0.5048
 epoch: 7, train_loss: 0.9398, test_loss: 0.9180, test_f1: 0.5539
 epoch: 8, train_loss: 0.9129, test_loss: 0.9302, test_f1: 0.5075
 epoch: 9, train_loss: 0.8993, test_loss: 0.9510, test_f1: 0.5557
 epoch: 10, train_loss: 0.8889, test_loss: 0.9245, test_f1: 0.5467
 epoch: 11, train_loss: 0.8827, test_loss: 0.9068, test_f1: 0.5537
 epoch: 12, train_loss: 0.8624, test_loss: 0.8969, test_f1: 0.5492
 epoch: 13, train_loss: 0.8689, test_loss: 0.9308, test_f1: 0.5587
 epoch: 14, train_loss: 0.8494, test_loss: 0.9293, test_f1: 0.5519
 epoch: 15, train_loss: 0.8448, test_loss: 0.9159, test_f1: 0.5923
 epoch: 16, train_loss: 0.8236, test_loss: 0.9220, test_f1: 0.5902
 epoch: 17, train_loss: 0.8263, test_loss: 0.9300, test_f1: 0.5670
 epoch: 18, train_loss: 0.8034, test_loss: 0.9311, test_f1: 0.5837
 epoch: 19, train_loss: 0.8191, test_loss: 0.9223, test_f1: 0.5782
 epoch: 20, train_loss: 0.8076, test_loss: 0.8971, test_f1: 0.5923
 epoch: 21, train_loss: 0.7952, test_loss: 0.9083, test_f1: 0.5879
 epoch: 22, train_loss: 0.7997, test_loss: 0.9347, test_f1: 0.5888
 epoch: 23, train_loss: 0.7874, test_loss: 0.9295, test_f1: 0.5773
 epoch: 24, train_loss: 0.7800, test_loss: 0.9205, test_f1: 0.5964
 epoch: 25, train_loss: 0.7732, test_loss: 0.9042, test_f1: 0.5931
 epoch: 26, train_loss: 0.7601, test_loss: 0.9074, test_f1: 0.6164
 epoch: 27, train_loss: 0.7504, test_loss: 0.9195, test_f1: 0.5978
 epoch: 28, train_loss: 0.7462, test_loss: 0.9199, test_f1: 0.5909
 epoch: 29, train_loss: 0.7406, test_loss: 0.9112, test_f1: 0.6009
 epoch: 30, train_loss: 0.7378, test_loss: 0.8915, test_f1: 0.5992
 epoch: 31, train_loss: 0.7128, test_loss: 0.9032, test_f1: 0.6344
 epoch: 32, train_loss: 0.7335, test_loss: 0.9032, test_f1: 0.6148
 epoch: 33, train_loss: 0.7152, test_loss: 0.8957, test_f1: 0.6235
 epoch: 34, train_loss: 0.7113, test_loss: 0.9009, test_f1: 0.6113
 epoch: 35, train_loss: 0.7061, test_loss: 0.9268, test_f1: 0.6148
 epoch: 36, train_loss: 0.6960, test_loss: 0.9032, test_f1: 0.6153
 epoch: 37, train_loss: 0.6831, test_loss: 0.8863, test_f1: 0.6336
 epoch: 38, train_loss: 0.6882, test_loss: 0.8912, test_f1: 0.6124
 epoch: 39, train_loss: 0.6681, test_loss: 0.9249, test_f1: 0.6163
 epoch: 40, train_loss: 0.6739, test_loss: 0.8958, test_f1: 0.6305
 epoch: 41, train_loss: 0.6695, test_loss: 0.9093, test_f1: 0.6140
 epoch: 42, train_loss: 0.6610, test_loss: 0.8952, test_f1: 0.6378
 epoch: 43, train_loss: 0.6547, test_loss: 0.8984, test_f1: 0.6204
 epoch: 44, train_loss: 0.6558, test_loss: 0.9332, test_f1: 0.6186
 epoch: 45, train_loss: 0.6404, test_loss: 0.9281, test_f1: 0.6170
 epoch: 46, train_loss: 0.6378, test_loss: 0.9533, test_f1: 0.6295
 epoch: 47, train_loss: 0.6445, test_loss: 0.9458, test_f1: 0.6373
 epoch: 48, train_loss: 0.6235, test_loss: 0.9032, test_f1: 0.6212
 epoch: 49, train_loss: 0.6274, test_loss: 0.9203, test_f1: 0.6356
 epoch: 50, train_loss: 0.6144, test_loss: 0.9138, test_f1: 0.6572
 epoch: 51, train_loss: 0.6056, test_loss: 0.9227, test_f1: 0.6539
 epoch: 52, train_loss: 0.5963, test_loss: 0.9493, test_f1: 0.6351
 epoch: 53, train_loss: 0.5965, test_loss: 0.9509, test_f1: 0.6213
 epoch: 54, train_loss: 0.5761, test_loss: 0.9418, test_f1: 0.6397
 epoch: 55, train_loss: 0.5730, test_loss: 0.9258, test_f1: 0.6480
 epoch: 56, train_loss: 0.5622, test_loss: 0.9506, test_f1: 0.6428
 epoch: 57, train_loss: 0.5712, test_loss: 0.9474, test_f1: 0.6475
 epoch: 58, train_loss: 0.5598, test_loss: 0.9346, test_f1: 0.6606
 epoch: 59, train_loss: 0.5633, test_loss: 0.9629, test_f1: 0.6608
 epoch: 60, train_loss: 0.5589, test_loss: 0.9677, test_f1: 0.6400
 epoch: 61, train_loss: 0.5506, test_loss: 0.9504, test_f1: 0.6323
 epoch: 62, train_loss: 0.5532, test_loss: 0.9529, test_f1: 0.6818
 epoch: 63, train_loss: 0.5585, test_loss: 0.9606, test_f1: 0.6492
 epoch: 64, train_loss: 0.5544, test_loss: 0.9703, test_f1: 0.6469
 epoch: 65, train_loss: 0.5378, test_loss: 0.9554, test_f1: 0.6646
 epoch: 66, train_loss: 0.5339, test_loss: 0.9683, test_f1: 0.6454
 epoch: 67, train_loss: 0.5343, test_loss: 0.9918, test_f1: 0.6535
 epoch: 68, train_loss: 0.5323, test_loss: 0.9610, test_f1: 0.6756
 epoch: 69, train_loss: 0.5120, test_loss: 0.9728, test_f1: 0.6428
 epoch: 70, train_loss: 0.5193, test_loss: 0.9909, test_f1: 0.6676
 epoch: 71, train_loss: 0.5165, test_loss: 0.9906, test_f1: 0.6397
 epoch: 72, train_loss: 0.5340, test_loss: 1.0087, test_f1: 0.6567
 epoch: 73, train_loss: 0.5122, test_loss: 1.0045, test_f1: 0.6637
 epoch: 74, train_loss: 0.4983, test_loss: 0.9942, test_f1: 0.6509
 epoch: 75, train_loss: 0.5134, test_loss: 1.0236, test_f1: 0.6658
 epoch: 76, train_loss: 0.5108, test_loss: 1.0242, test_f1: 0.6702
 epoch: 77, train_loss: 0.5047, test_loss: 1.0015, test_f1: 0.6503
 epoch: 78, train_loss: 0.4880, test_loss: 1.0095, test_f1: 0.6670
 epoch: 79, train_loss: 0.5015, test_loss: 1.0273, test_f1: 0.6546
 epoch: 80, train_loss: 0.5064, test_loss: 1.0401, test_f1: 0.6569
 epoch: 81, train_loss: 0.4894, test_loss: 1.0280, test_f1: 0.6663
 epoch: 82, train_loss: 0.4831, test_loss: 1.0284, test_f1: 0.6540
 epoch: 83, train_loss: 0.4900, test_loss: 1.0518, test_f1: 0.6574
 epoch: 84, train_loss: 0.4849, test_loss: 0.9990, test_f1: 0.6702
 epoch: 85, train_loss: 0.4684, test_loss: 1.0298, test_f1: 0.6820
 epoch: 86, train_loss: 0.4795, test_loss: 1.0565, test_f1: 0.6785
 epoch: 87, train_loss: 0.4693, test_loss: 1.0690, test_f1: 0.6704
 epoch: 88, train_loss: 0.4592, test_loss: 1.0428, test_f1: 0.6638
 epoch: 89, train_loss: 0.4821, test_loss: 1.0408, test_f1: 0.6772
 epoch: 90, train_loss: 0.4666, test_loss: 1.0441, test_f1: 0.6699
 epoch: 91, train_loss: 0.4771, test_loss: 1.0421, test_f1: 0.6688
 epoch: 92, train_loss: 0.4767, test_loss: 1.0954, test_f1: 0.6604
 epoch: 93, train_loss: 0.4391, test_loss: 1.0695, test_f1: 0.6613
 epoch: 94, train_loss: 0.4543, test_loss: 1.0352, test_f1: 0.6836
 epoch: 95, train_loss: 0.4522, test_loss: 1.0826, test_f1: 0.6466
 epoch: 96, train_loss: 0.4391, test_loss: 1.1079, test_f1: 0.6582
 epoch: 97, train_loss: 0.4517, test_loss: 1.0781, test_f1: 0.6622
 epoch: 98, train_loss: 0.4474, test_loss: 1.0887, test_f1: 0.6701
 epoch: 99, train_loss: 0.4445, test_loss: 1.0851, test_f1: 0.6688
##################ITERATION #8 ****************************************
 epoch: 0, train_loss: 1.3097, test_loss: 1.1324, test_f1: 0.4313
 epoch: 1, train_loss: 1.1242, test_loss: 1.0071, test_f1: 0.4805
 epoch: 2, train_loss: 1.0536, test_loss: 0.9759, test_f1: 0.5258
 epoch: 3, train_loss: 1.0226, test_loss: 0.9563, test_f1: 0.4769
 epoch: 4, train_loss: 1.0014, test_loss: 0.9370, test_f1: 0.4959
 epoch: 5, train_loss: 0.9707, test_loss: 0.9339, test_f1: 0.5214
 epoch: 6, train_loss: 0.9627, test_loss: 0.9293, test_f1: 0.5256
 epoch: 7, train_loss: 0.9301, test_loss: 0.9419, test_f1: 0.5142
 epoch: 8, train_loss: 0.9252, test_loss: 0.9323, test_f1: 0.5486
 epoch: 9, train_loss: 0.9174, test_loss: 0.9192, test_f1: 0.5568
 epoch: 10, train_loss: 0.8906, test_loss: 0.8846, test_f1: 0.5593
 epoch: 11, train_loss: 0.8817, test_loss: 0.9463, test_f1: 0.5448
 epoch: 12, train_loss: 0.8837, test_loss: 0.9056, test_f1: 0.5589
 epoch: 13, train_loss: 0.8772, test_loss: 0.9020, test_f1: 0.5621
 epoch: 14, train_loss: 0.8610, test_loss: 0.8956, test_f1: 0.5840
 epoch: 15, train_loss: 0.8391, test_loss: 0.9305, test_f1: 0.5540
 epoch: 16, train_loss: 0.8330, test_loss: 0.9115, test_f1: 0.5875
 epoch: 17, train_loss: 0.8255, test_loss: 0.8957, test_f1: 0.6073
 epoch: 18, train_loss: 0.8208, test_loss: 0.9071, test_f1: 0.5683
 epoch: 19, train_loss: 0.8100, test_loss: 0.9187, test_f1: 0.6041
 epoch: 20, train_loss: 0.7987, test_loss: 0.9189, test_f1: 0.5986
 epoch: 21, train_loss: 0.8110, test_loss: 0.8853, test_f1: 0.6157
 epoch: 22, train_loss: 0.7936, test_loss: 0.9038, test_f1: 0.5923
 epoch: 23, train_loss: 0.7922, test_loss: 0.9143, test_f1: 0.5738
 epoch: 24, train_loss: 0.7962, test_loss: 0.9793, test_f1: 0.5871
 epoch: 25, train_loss: 0.7775, test_loss: 0.9265, test_f1: 0.5971
 epoch: 26, train_loss: 0.7788, test_loss: 0.9046, test_f1: 0.5968
 epoch: 27, train_loss: 0.7573, test_loss: 0.9369, test_f1: 0.5979
 epoch: 28, train_loss: 0.7594, test_loss: 0.9688, test_f1: 0.5815
 epoch: 29, train_loss: 0.7480, test_loss: 0.9224, test_f1: 0.6057
 epoch: 30, train_loss: 0.7491, test_loss: 0.9320, test_f1: 0.6018
 epoch: 31, train_loss: 0.7373, test_loss: 0.9621, test_f1: 0.5892
 epoch: 32, train_loss: 0.7403, test_loss: 0.9199, test_f1: 0.5976
 epoch: 33, train_loss: 0.7280, test_loss: 0.9404, test_f1: 0.5939
 epoch: 34, train_loss: 0.7394, test_loss: 0.9502, test_f1: 0.6078
 epoch: 35, train_loss: 0.7250, test_loss: 0.9456, test_f1: 0.6100
 epoch: 36, train_loss: 0.7218, test_loss: 0.9401, test_f1: 0.5921
 epoch: 37, train_loss: 0.6973, test_loss: 0.9696, test_f1: 0.5855
 epoch: 38, train_loss: 0.7145, test_loss: 0.9203, test_f1: 0.6151
 epoch: 39, train_loss: 0.7072, test_loss: 0.9600, test_f1: 0.6138
 epoch: 40, train_loss: 0.7015, test_loss: 0.9342, test_f1: 0.6302
 epoch: 41, train_loss: 0.6986, test_loss: 0.9621, test_f1: 0.6039
 epoch: 42, train_loss: 0.6879, test_loss: 0.9714, test_f1: 0.5990
 epoch: 43, train_loss: 0.7028, test_loss: 0.9796, test_f1: 0.5992
 epoch: 44, train_loss: 0.6783, test_loss: 0.9416, test_f1: 0.6247
 epoch: 45, train_loss: 0.6824, test_loss: 0.9659, test_f1: 0.6215
 epoch: 46, train_loss: 0.6687, test_loss: 0.9713, test_f1: 0.6273
 epoch: 47, train_loss: 0.6671, test_loss: 0.9310, test_f1: 0.6320
 epoch: 48, train_loss: 0.6675, test_loss: 0.9362, test_f1: 0.6076
 epoch: 49, train_loss: 0.6561, test_loss: 0.9707, test_f1: 0.6160
 epoch: 50, train_loss: 0.6345, test_loss: 0.9639, test_f1: 0.6143
 epoch: 51, train_loss: 0.6374, test_loss: 0.9683, test_f1: 0.6122
 epoch: 52, train_loss: 0.6341, test_loss: 0.9889, test_f1: 0.6021
 epoch: 53, train_loss: 0.6150, test_loss: 0.9684, test_f1: 0.6070
 epoch: 54, train_loss: 0.6173, test_loss: 0.9716, test_f1: 0.6188
 epoch: 55, train_loss: 0.6108, test_loss: 0.9869, test_f1: 0.6197
 epoch: 56, train_loss: 0.6131, test_loss: 0.9383, test_f1: 0.6198
 epoch: 57, train_loss: 0.6085, test_loss: 0.9927, test_f1: 0.6032
 epoch: 58, train_loss: 0.6099, test_loss: 0.9666, test_f1: 0.6174
 epoch: 59, train_loss: 0.5935, test_loss: 1.0043, test_f1: 0.6062
 epoch: 60, train_loss: 0.5934, test_loss: 0.9681, test_f1: 0.6111
 epoch: 61, train_loss: 0.6047, test_loss: 1.0185, test_f1: 0.6238
 epoch: 62, train_loss: 0.5852, test_loss: 0.9632, test_f1: 0.6185
 epoch: 63, train_loss: 0.5910, test_loss: 0.9571, test_f1: 0.6277
 epoch: 64, train_loss: 0.6010, test_loss: 1.0340, test_f1: 0.6092
 epoch: 65, train_loss: 0.5899, test_loss: 0.9956, test_f1: 0.6303
 epoch: 66, train_loss: 0.5759, test_loss: 1.0066, test_f1: 0.6320
 epoch: 67, train_loss: 0.5900, test_loss: 0.9529, test_f1: 0.6319
 epoch: 68, train_loss: 0.5882, test_loss: 0.9955, test_f1: 0.6262
 epoch: 69, train_loss: 0.5818, test_loss: 0.9827, test_f1: 0.6294
 epoch: 70, train_loss: 0.5686, test_loss: 1.0083, test_f1: 0.6190
 epoch: 71, train_loss: 0.5680, test_loss: 1.0045, test_f1: 0.6220
 epoch: 72, train_loss: 0.5657, test_loss: 0.9882, test_f1: 0.6245
 epoch: 73, train_loss: 0.5634, test_loss: 1.0094, test_f1: 0.6314
 epoch: 74, train_loss: 0.5540, test_loss: 1.0477, test_f1: 0.6227
 epoch: 75, train_loss: 0.5450, test_loss: 0.9689, test_f1: 0.6349
 epoch: 76, train_loss: 0.5515, test_loss: 1.0216, test_f1: 0.6020
 epoch: 77, train_loss: 0.5575, test_loss: 1.0371, test_f1: 0.6141
 epoch: 78, train_loss: 0.5480, test_loss: 1.0075, test_f1: 0.6125
 epoch: 79, train_loss: 0.5459, test_loss: 1.0188, test_f1: 0.6117
 epoch: 80, train_loss: 0.5357, test_loss: 1.0137, test_f1: 0.6344
 epoch: 81, train_loss: 0.5366, test_loss: 1.0197, test_f1: 0.6208
 epoch: 82, train_loss: 0.5360, test_loss: 1.0206, test_f1: 0.6067
 epoch: 83, train_loss: 0.5357, test_loss: 1.0193, test_f1: 0.6229
 epoch: 84, train_loss: 0.5366, test_loss: 1.0336, test_f1: 0.6101
 epoch: 85, train_loss: 0.5248, test_loss: 1.0331, test_f1: 0.6305
 epoch: 86, train_loss: 0.5189, test_loss: 1.0271, test_f1: 0.6250
 epoch: 87, train_loss: 0.5305, test_loss: 1.0250, test_f1: 0.6312
 epoch: 88, train_loss: 0.5172, test_loss: 1.0464, test_f1: 0.6383
 epoch: 89, train_loss: 0.5208, test_loss: 1.0392, test_f1: 0.6207
 epoch: 90, train_loss: 0.5063, test_loss: 1.0127, test_f1: 0.6343
 epoch: 91, train_loss: 0.5126, test_loss: 1.0353, test_f1: 0.6257
 epoch: 92, train_loss: 0.5284, test_loss: 1.0611, test_f1: 0.6145
 epoch: 93, train_loss: 0.5021, test_loss: 1.0443, test_f1: 0.6061
 epoch: 94, train_loss: 0.5124, test_loss: 1.0725, test_f1: 0.6327
 epoch: 95, train_loss: 0.5009, test_loss: 1.0459, test_f1: 0.5965
 epoch: 96, train_loss: 0.5031, test_loss: 1.0542, test_f1: 0.6242
 epoch: 97, train_loss: 0.4916, test_loss: 1.0758, test_f1: 0.6083
 epoch: 98, train_loss: 0.4969, test_loss: 1.1075, test_f1: 0.6106
 epoch: 99, train_loss: 0.5015, test_loss: 1.1060, test_f1: 0.6108
##################ITERATION #9 ****************************************
 epoch: 0, train_loss: 1.2871, test_loss: 1.1948, test_f1: 0.4012
 epoch: 1, train_loss: 1.1197, test_loss: 0.9825, test_f1: 0.5422
 epoch: 2, train_loss: 1.0621, test_loss: 0.9533, test_f1: 0.5166
 epoch: 3, train_loss: 1.0108, test_loss: 0.9349, test_f1: 0.5227
 epoch: 4, train_loss: 0.9921, test_loss: 0.9228, test_f1: 0.5708
 epoch: 5, train_loss: 0.9719, test_loss: 0.9064, test_f1: 0.5676
 epoch: 6, train_loss: 0.9446, test_loss: 0.8809, test_f1: 0.5600
 epoch: 7, train_loss: 0.9234, test_loss: 0.8734, test_f1: 0.5645
 epoch: 8, train_loss: 0.9181, test_loss: 0.9072, test_f1: 0.5457
 epoch: 9, train_loss: 0.9133, test_loss: 0.8986, test_f1: 0.5334
 epoch: 10, train_loss: 0.9085, test_loss: 0.8665, test_f1: 0.5978
 epoch: 11, train_loss: 0.8861, test_loss: 0.8469, test_f1: 0.5579
 epoch: 12, train_loss: 0.8779, test_loss: 0.8628, test_f1: 0.5477
 epoch: 13, train_loss: 0.8590, test_loss: 0.8498, test_f1: 0.5684
 epoch: 14, train_loss: 0.8666, test_loss: 0.8765, test_f1: 0.5615
 epoch: 15, train_loss: 0.8398, test_loss: 0.8566, test_f1: 0.5820
 epoch: 16, train_loss: 0.8428, test_loss: 0.9031, test_f1: 0.5633
 epoch: 17, train_loss: 0.8227, test_loss: 0.8916, test_f1: 0.5798
 epoch: 18, train_loss: 0.8189, test_loss: 0.8798, test_f1: 0.5940
 epoch: 19, train_loss: 0.8203, test_loss: 0.8594, test_f1: 0.6085
 epoch: 20, train_loss: 0.8057, test_loss: 0.8524, test_f1: 0.6106
 epoch: 21, train_loss: 0.8080, test_loss: 0.8861, test_f1: 0.6050
 epoch: 22, train_loss: 0.7967, test_loss: 0.8659, test_f1: 0.5945
 epoch: 23, train_loss: 0.7858, test_loss: 0.8945, test_f1: 0.5875
 epoch: 24, train_loss: 0.7755, test_loss: 0.8698, test_f1: 0.6126
 epoch: 25, train_loss: 0.7751, test_loss: 0.8758, test_f1: 0.6071
 epoch: 26, train_loss: 0.7704, test_loss: 0.8813, test_f1: 0.5972
 epoch: 27, train_loss: 0.7571, test_loss: 0.9073, test_f1: 0.5894
 epoch: 28, train_loss: 0.7517, test_loss: 0.8658, test_f1: 0.6272
 epoch: 29, train_loss: 0.7593, test_loss: 0.8926, test_f1: 0.6001
 epoch: 30, train_loss: 0.7297, test_loss: 0.8926, test_f1: 0.6036
 epoch: 31, train_loss: 0.7427, test_loss: 0.8880, test_f1: 0.5941
 epoch: 32, train_loss: 0.7265, test_loss: 0.9129, test_f1: 0.5993
 epoch: 33, train_loss: 0.7329, test_loss: 0.8989, test_f1: 0.5791
 epoch: 34, train_loss: 0.7157, test_loss: 0.9098, test_f1: 0.6380
 epoch: 35, train_loss: 0.7119, test_loss: 0.8890, test_f1: 0.6154
 epoch: 36, train_loss: 0.7015, test_loss: 0.9017, test_f1: 0.6316
 epoch: 37, train_loss: 0.7024, test_loss: 0.8623, test_f1: 0.6327
 epoch: 38, train_loss: 0.7048, test_loss: 0.8897, test_f1: 0.6104
 epoch: 39, train_loss: 0.6985, test_loss: 0.9109, test_f1: 0.6263
 epoch: 40, train_loss: 0.6809, test_loss: 0.8901, test_f1: 0.6351
 epoch: 41, train_loss: 0.6785, test_loss: 0.8869, test_f1: 0.6216
 epoch: 42, train_loss: 0.6685, test_loss: 0.9419, test_f1: 0.6132
 epoch: 43, train_loss: 0.6727, test_loss: 0.9206, test_f1: 0.6235
 epoch: 44, train_loss: 0.6713, test_loss: 0.9022, test_f1: 0.6320
 epoch: 45, train_loss: 0.6669, test_loss: 0.9004, test_f1: 0.6505
 epoch: 46, train_loss: 0.6498, test_loss: 0.8988, test_f1: 0.6299
 epoch: 47, train_loss: 0.6559, test_loss: 0.9148, test_f1: 0.6247
 epoch: 48, train_loss: 0.6362, test_loss: 0.8859, test_f1: 0.6350
 epoch: 49, train_loss: 0.6512, test_loss: 0.9426, test_f1: 0.6114
 epoch: 50, train_loss: 0.6236, test_loss: 0.9086, test_f1: 0.6300
 epoch: 51, train_loss: 0.6100, test_loss: 0.9330, test_f1: 0.6290
 epoch: 52, train_loss: 0.6056, test_loss: 0.9016, test_f1: 0.6465
 epoch: 53, train_loss: 0.5976, test_loss: 0.9457, test_f1: 0.6206
 epoch: 54, train_loss: 0.6039, test_loss: 0.9331, test_f1: 0.6184
 epoch: 55, train_loss: 0.5896, test_loss: 0.9495, test_f1: 0.6223
 epoch: 56, train_loss: 0.5762, test_loss: 0.9122, test_f1: 0.6549
 epoch: 57, train_loss: 0.5951, test_loss: 0.9173, test_f1: 0.6483
 epoch: 58, train_loss: 0.5702, test_loss: 0.9427, test_f1: 0.6295
 epoch: 59, train_loss: 0.5724, test_loss: 0.9237, test_f1: 0.6433
 epoch: 60, train_loss: 0.5756, test_loss: 0.9500, test_f1: 0.6457
 epoch: 61, train_loss: 0.5610, test_loss: 0.9355, test_f1: 0.6428
 epoch: 62, train_loss: 0.5733, test_loss: 0.9513, test_f1: 0.6362
 epoch: 63, train_loss: 0.5577, test_loss: 0.9246, test_f1: 0.6420
 epoch: 64, train_loss: 0.5663, test_loss: 0.9719, test_f1: 0.6419
 epoch: 65, train_loss: 0.5588, test_loss: 0.9747, test_f1: 0.6329
 epoch: 66, train_loss: 0.5487, test_loss: 0.9833, test_f1: 0.6536
 epoch: 67, train_loss: 0.5633, test_loss: 0.9705, test_f1: 0.6589
 epoch: 68, train_loss: 0.5417, test_loss: 0.9676, test_f1: 0.6396
 epoch: 69, train_loss: 0.5535, test_loss: 1.0007, test_f1: 0.6303
 epoch: 70, train_loss: 0.5473, test_loss: 0.9772, test_f1: 0.6458
 epoch: 71, train_loss: 0.5353, test_loss: 0.9815, test_f1: 0.6514
 epoch: 72, train_loss: 0.5396, test_loss: 0.9801, test_f1: 0.6571
 epoch: 73, train_loss: 0.5395, test_loss: 1.0605, test_f1: 0.6327
 epoch: 74, train_loss: 0.5436, test_loss: 1.0107, test_f1: 0.6310
 epoch: 75, train_loss: 0.5378, test_loss: 1.0138, test_f1: 0.6407
 epoch: 76, train_loss: 0.5381, test_loss: 1.0856, test_f1: 0.6396
 epoch: 77, train_loss: 0.5194, test_loss: 1.0073, test_f1: 0.6409
 epoch: 78, train_loss: 0.5213, test_loss: 1.0165, test_f1: 0.6369
 epoch: 79, train_loss: 0.5344, test_loss: 1.0183, test_f1: 0.6541
 epoch: 80, train_loss: 0.5121, test_loss: 1.0229, test_f1: 0.6576
 epoch: 81, train_loss: 0.5134, test_loss: 1.0502, test_f1: 0.6589
 epoch: 82, train_loss: 0.5093, test_loss: 1.0732, test_f1: 0.6265
 epoch: 83, train_loss: 0.5038, test_loss: 1.0934, test_f1: 0.6390
 epoch: 84, train_loss: 0.4982, test_loss: 1.0642, test_f1: 0.6497
 epoch: 85, train_loss: 0.4839, test_loss: 1.1107, test_f1: 0.6517
 epoch: 86, train_loss: 0.5143, test_loss: 1.1154, test_f1: 0.6444
 epoch: 87, train_loss: 0.4987, test_loss: 1.0541, test_f1: 0.6588
 epoch: 88, train_loss: 0.4939, test_loss: 1.0479, test_f1: 0.6679
 epoch: 89, train_loss: 0.4916, test_loss: 1.1130, test_f1: 0.6365
 epoch: 90, train_loss: 0.4853, test_loss: 1.0580, test_f1: 0.6619
 epoch: 91, train_loss: 0.4815, test_loss: 1.0840, test_f1: 0.6589
 epoch: 92, train_loss: 0.4899, test_loss: 1.1305, test_f1: 0.6435
 epoch: 93, train_loss: 0.4888, test_loss: 1.1386, test_f1: 0.6391
 epoch: 94, train_loss: 0.4849, test_loss: 1.1279, test_f1: 0.6484
 epoch: 95, train_loss: 0.4678, test_loss: 1.0963, test_f1: 0.6314
 epoch: 96, train_loss: 0.4842, test_loss: 1.0859, test_f1: 0.6413
 epoch: 97, train_loss: 0.4720, test_loss: 1.0725, test_f1: 0.6449
 epoch: 98, train_loss: 0.4638, test_loss: 1.0737, test_f1: 0.6475
 epoch: 99, train_loss: 0.4636, test_loss: 1.0752, test_f1: 0.6458

Training completed in 1287.80 seconds
Best F1: 0.6963 at epoch 98
Mean F1 across iterations: 0.6628  0.0159
========================FINAL RESULTS================================
FEGIN weighted F1: 0.6963  0.0159
python main.py --data ltspice_examples --representation component_net --model FEGIN --layers 5 --hiddens 128 --batch_size 64 --lr 0.0001 --emb_size 128 --epochs 100 --save_appendix component_net_L5_H128_BS64_LR0.0001_E128 --no_val
-----



STDERR:
  File "main.py", line 370, in <module>
    main()
  File "main.py", line 254, in main
    dataset = dataset_class(
  File "/home/philip/projects/llm_inference_code_repo/Circuit-Completion-Using-GNNs/component_classification_with_link_prediction_head/evaluation/FEGIN/kernel/circuit_datasets.py", line 15, in __init__
    self.data, self.slices = torch.load(self.processed_paths[0])
  File "/home/philip/.local/lib/python3.8/site-packages/torch/serialization.py", line 1040, in load
    warnings.warn(
  File "/usr/lib/python3.8/warnings.py", line 109, in _showwarnmsg
    sw(msg.message, msg.category, msg.filename, msg.lineno,
  File "main.py", line 47, in warn_with_traceback
    traceback.print_stack(file=log)
/home/philip/projects/llm_inference_code_repo/Circuit-Completion-Using-GNNs/component_classification_with_link_prediction_head/evaluation/FEGIN/kernel/circuit_datasets.py:15: FutureWarning: You are using `torch.load` with `weights_only=False` (the current default value), which uses the default pickle module implicitly. It is possible to construct malicious pickle data which will execute arbitrary code during unpickling (See https://github.com/pytorch/pytorch/blob/main/SECURITY.md#untrusted-models for more details). In a future release, the default value for `weights_only` will be flipped to `True`. This limits the functions that could be executed during unpickling. Arbitrary objects will no longer be allowed to be loaded via this mode unless they are explicitly allowlisted by the user via `torch.serialization.add_safe_globals`. We recommend you start setting `weights_only=True` for any use case where you don't have full control of the loaded file. Please open an issue on GitHub for any issues related to this experimental feature.
  self.data, self.slices = torch.load(self.processed_paths[0])
