STDOUT:
Results will be saved in /home/philip/projects/ltspice_examples_code_repo/Circuit-Completion-Using-GNNs/component_classification_with_link_prediction_head/evaluation/FEGIN/results/model_FEGIN_dataset_ltspice_demos
Command line input: python main.py --data ltspice_demos --representation component_component --model FEGIN --layers 4 --hiddens 16 --batch_size 128 --lr 0.001 --emb_size 250 --epochs 100 --save_appendix component_component_L4_H16_BS128_LR0.001_E250 --no_val
 is saved.
-----
ltspice_demos - FEGIN
Using 4 layers, 16 hidden units, h = 2
Loading component_component representation dataset
ENTERED
Training FEGIN on component_component representation
Train: 1565, Test: 383
##################ITERATION #0 ****************************************
 epoch: 0, train_loss: 1.3654, test_loss: 1.3583, test_f1: 0.2281
 epoch: 1, train_loss: 1.3497, test_loss: 1.3519, test_f1: 0.2281
 epoch: 2, train_loss: 1.3403, test_loss: 1.3455, test_f1: 0.2281
 epoch: 3, train_loss: 1.3303, test_loss: 1.3367, test_f1: 0.2281
 epoch: 4, train_loss: 1.3160, test_loss: 1.3265, test_f1: 0.2281
 epoch: 5, train_loss: 1.2971, test_loss: 1.3135, test_f1: 0.2281
 epoch: 6, train_loss: 1.2790, test_loss: 1.2983, test_f1: 0.2281
 epoch: 7, train_loss: 1.2561, test_loss: 1.2810, test_f1: 0.2281
 epoch: 8, train_loss: 1.2280, test_loss: 1.2671, test_f1: 0.2281
 epoch: 9, train_loss: 1.2135, test_loss: 1.2546, test_f1: 0.2281
 epoch: 10, train_loss: 1.2031, test_loss: 1.2453, test_f1: 0.2636
 epoch: 11, train_loss: 1.1898, test_loss: 1.2403, test_f1: 0.3151
 epoch: 12, train_loss: 1.1816, test_loss: 1.2407, test_f1: 0.3179
 epoch: 13, train_loss: 1.1695, test_loss: 1.2356, test_f1: 0.3343
 epoch: 14, train_loss: 1.1556, test_loss: 1.2336, test_f1: 0.3625
 epoch: 15, train_loss: 1.1551, test_loss: 1.2342, test_f1: 0.3447
 epoch: 16, train_loss: 1.1360, test_loss: 1.2340, test_f1: 0.3340
 epoch: 17, train_loss: 1.1369, test_loss: 1.2547, test_f1: 0.3074
 epoch: 18, train_loss: 1.1332, test_loss: 1.2765, test_f1: 0.3457
 epoch: 19, train_loss: 1.1139, test_loss: 1.2668, test_f1: 0.3488
 epoch: 20, train_loss: 1.1174, test_loss: 1.3181, test_f1: 0.3333
 epoch: 21, train_loss: 1.1011, test_loss: 1.3015, test_f1: 0.3251
 epoch: 22, train_loss: 1.0938, test_loss: 1.2876, test_f1: 0.3388
 epoch: 23, train_loss: 1.0897, test_loss: 1.2998, test_f1: 0.3447
 epoch: 24, train_loss: 1.0741, test_loss: 1.3113, test_f1: 0.3701
 epoch: 25, train_loss: 1.0713, test_loss: 1.2857, test_f1: 0.3738
 epoch: 26, train_loss: 1.0685, test_loss: 1.3092, test_f1: 0.3788
 epoch: 27, train_loss: 1.0717, test_loss: 1.3496, test_f1: 0.3696
 epoch: 28, train_loss: 1.0543, test_loss: 1.3298, test_f1: 0.3703
 epoch: 29, train_loss: 1.0672, test_loss: 1.3589, test_f1: 0.3803
 epoch: 30, train_loss: 1.0425, test_loss: 1.3561, test_f1: 0.3773
 epoch: 31, train_loss: 1.0435, test_loss: 1.3549, test_f1: 0.3770
 epoch: 32, train_loss: 1.0375, test_loss: 1.3623, test_f1: 0.3875
 epoch: 33, train_loss: 1.0319, test_loss: 1.3117, test_f1: 0.4244
 epoch: 34, train_loss: 1.0241, test_loss: 1.3253, test_f1: 0.4189
 epoch: 35, train_loss: 1.0241, test_loss: 1.3028, test_f1: 0.4251
 epoch: 36, train_loss: 1.0153, test_loss: 1.3475, test_f1: 0.4094
 epoch: 37, train_loss: 1.0076, test_loss: 1.3868, test_f1: 0.4358
 epoch: 38, train_loss: 1.0072, test_loss: 1.3898, test_f1: 0.4307
 epoch: 39, train_loss: 1.0088, test_loss: 1.3579, test_f1: 0.4249
 epoch: 40, train_loss: 0.9903, test_loss: 1.3446, test_f1: 0.4558
 epoch: 41, train_loss: 0.9884, test_loss: 1.3707, test_f1: 0.4380
 epoch: 42, train_loss: 0.9969, test_loss: 1.3542, test_f1: 0.4458
 epoch: 43, train_loss: 0.9980, test_loss: 1.3661, test_f1: 0.4585
 epoch: 44, train_loss: 0.9942, test_loss: 1.4242, test_f1: 0.4483
 epoch: 45, train_loss: 0.9738, test_loss: 1.3194, test_f1: 0.4744
 epoch: 46, train_loss: 0.9731, test_loss: 1.3917, test_f1: 0.4639
 epoch: 47, train_loss: 0.9555, test_loss: 1.3973, test_f1: 0.4522
 epoch: 48, train_loss: 0.9486, test_loss: 1.3854, test_f1: 0.4884
 epoch: 49, train_loss: 0.9434, test_loss: 1.3650, test_f1: 0.4778
 epoch: 50, train_loss: 0.9647, test_loss: 1.3592, test_f1: 0.4737
 epoch: 51, train_loss: 0.9388, test_loss: 1.3656, test_f1: 0.4904
 epoch: 52, train_loss: 0.9314, test_loss: 1.3911, test_f1: 0.4877
 epoch: 53, train_loss: 0.9293, test_loss: 1.4243, test_f1: 0.4825
 epoch: 54, train_loss: 0.9436, test_loss: 1.4185, test_f1: 0.4866
 epoch: 55, train_loss: 0.9438, test_loss: 1.3933, test_f1: 0.4895
 epoch: 56, train_loss: 0.9223, test_loss: 1.3991, test_f1: 0.4932
 epoch: 57, train_loss: 0.9100, test_loss: 1.4533, test_f1: 0.4861
 epoch: 58, train_loss: 0.9142, test_loss: 1.4396, test_f1: 0.4873
 epoch: 59, train_loss: 0.9205, test_loss: 1.4276, test_f1: 0.4845
 epoch: 60, train_loss: 0.9198, test_loss: 1.4010, test_f1: 0.4972
 epoch: 61, train_loss: 0.9169, test_loss: 1.4257, test_f1: 0.4899
 epoch: 62, train_loss: 0.9055, test_loss: 1.3839, test_f1: 0.5011
 epoch: 63, train_loss: 0.9361, test_loss: 1.4572, test_f1: 0.4746
 epoch: 64, train_loss: 0.9116, test_loss: 1.4988, test_f1: 0.4927
 epoch: 65, train_loss: 0.9082, test_loss: 1.4849, test_f1: 0.4881
 epoch: 66, train_loss: 0.9098, test_loss: 1.4559, test_f1: 0.4896
 epoch: 67, train_loss: 0.9047, test_loss: 1.4264, test_f1: 0.5044
 epoch: 68, train_loss: 0.9035, test_loss: 1.4374, test_f1: 0.4981
 epoch: 69, train_loss: 0.8931, test_loss: 1.4397, test_f1: 0.4816
 epoch: 70, train_loss: 0.8953, test_loss: 1.4335, test_f1: 0.5003
 epoch: 71, train_loss: 0.8975, test_loss: 1.4898, test_f1: 0.5104
 epoch: 72, train_loss: 0.8999, test_loss: 1.4463, test_f1: 0.5162
 epoch: 73, train_loss: 0.8944, test_loss: 1.4293, test_f1: 0.5045
 epoch: 74, train_loss: 0.8892, test_loss: 1.4692, test_f1: 0.5134
 epoch: 75, train_loss: 0.8793, test_loss: 1.4414, test_f1: 0.5096
 epoch: 76, train_loss: 0.8951, test_loss: 1.4954, test_f1: 0.5037
 epoch: 77, train_loss: 0.8869, test_loss: 1.5110, test_f1: 0.4989
 epoch: 78, train_loss: 0.8811, test_loss: 1.4722, test_f1: 0.4930
 epoch: 79, train_loss: 0.8890, test_loss: 1.4168, test_f1: 0.4814
 epoch: 80, train_loss: 0.8719, test_loss: 1.4745, test_f1: 0.5069
 epoch: 81, train_loss: 0.8744, test_loss: 1.5033, test_f1: 0.4964
 epoch: 82, train_loss: 0.8678, test_loss: 1.5100, test_f1: 0.4936
 epoch: 83, train_loss: 0.8725, test_loss: 1.4991, test_f1: 0.4900
 epoch: 84, train_loss: 0.8752, test_loss: 1.5265, test_f1: 0.4924
 epoch: 85, train_loss: 0.8703, test_loss: 1.5158, test_f1: 0.4900
 epoch: 86, train_loss: 0.8730, test_loss: 1.5188, test_f1: 0.5002
 epoch: 87, train_loss: 0.8711, test_loss: 1.5004, test_f1: 0.4723
 epoch: 88, train_loss: 0.8624, test_loss: 1.5300, test_f1: 0.4927
 epoch: 89, train_loss: 0.8666, test_loss: 1.4925, test_f1: 0.5085
 epoch: 90, train_loss: 0.8660, test_loss: 1.5466, test_f1: 0.4919
 epoch: 91, train_loss: 0.8563, test_loss: 1.5152, test_f1: 0.5163
 epoch: 92, train_loss: 0.8672, test_loss: 1.5141, test_f1: 0.5040
 epoch: 93, train_loss: 0.8521, test_loss: 1.5536, test_f1: 0.5045
 epoch: 94, train_loss: 0.8631, test_loss: 1.5799, test_f1: 0.4922
 epoch: 95, train_loss: 0.8678, test_loss: 1.5451, test_f1: 0.5189
 epoch: 96, train_loss: 0.8457, test_loss: 1.4923, test_f1: 0.4950
 epoch: 97, train_loss: 0.8502, test_loss: 1.5516, test_f1: 0.4934
 epoch: 98, train_loss: 0.8561, test_loss: 1.5296, test_f1: 0.5069
 epoch: 99, train_loss: 0.8501, test_loss: 1.5160, test_f1: 0.5021
##################ITERATION #1 ****************************************
 epoch: 0, train_loss: 1.3211, test_loss: 1.3244, test_f1: 0.2281
 epoch: 1, train_loss: 1.2712, test_loss: 1.3147, test_f1: 0.2281
 epoch: 2, train_loss: 1.2503, test_loss: 1.3130, test_f1: 0.2281
 epoch: 3, train_loss: 1.2329, test_loss: 1.3043, test_f1: 0.2281
 epoch: 4, train_loss: 1.2174, test_loss: 1.2917, test_f1: 0.2650
 epoch: 5, train_loss: 1.2179, test_loss: 1.2767, test_f1: 0.3392
 epoch: 6, train_loss: 1.2086, test_loss: 1.2744, test_f1: 0.3234
 epoch: 7, train_loss: 1.1973, test_loss: 1.2673, test_f1: 0.3188
 epoch: 8, train_loss: 1.2003, test_loss: 1.2604, test_f1: 0.3249
 epoch: 9, train_loss: 1.1899, test_loss: 1.2593, test_f1: 0.3237
 epoch: 10, train_loss: 1.1821, test_loss: 1.2506, test_f1: 0.3279
 epoch: 11, train_loss: 1.1757, test_loss: 1.2410, test_f1: 0.3360
 epoch: 12, train_loss: 1.1669, test_loss: 1.2379, test_f1: 0.3217
 epoch: 13, train_loss: 1.1630, test_loss: 1.2268, test_f1: 0.3430
 epoch: 14, train_loss: 1.1551, test_loss: 1.2211, test_f1: 0.3359
 epoch: 15, train_loss: 1.1422, test_loss: 1.2156, test_f1: 0.3605
 epoch: 16, train_loss: 1.1440, test_loss: 1.2080, test_f1: 0.3789
 epoch: 17, train_loss: 1.1219, test_loss: 1.2006, test_f1: 0.3813
 epoch: 18, train_loss: 1.1229, test_loss: 1.1918, test_f1: 0.3917
 epoch: 19, train_loss: 1.1100, test_loss: 1.1826, test_f1: 0.4242
 epoch: 20, train_loss: 1.0935, test_loss: 1.1800, test_f1: 0.4523
 epoch: 21, train_loss: 1.0899, test_loss: 1.1838, test_f1: 0.4147
 epoch: 22, train_loss: 1.0808, test_loss: 1.1614, test_f1: 0.4543
 epoch: 23, train_loss: 1.0809, test_loss: 1.1623, test_f1: 0.4474
 epoch: 24, train_loss: 1.0677, test_loss: 1.1427, test_f1: 0.4638
 epoch: 25, train_loss: 1.0559, test_loss: 1.1482, test_f1: 0.4743
 epoch: 26, train_loss: 1.0530, test_loss: 1.1453, test_f1: 0.4903
 epoch: 27, train_loss: 1.0361, test_loss: 1.1624, test_f1: 0.4614
 epoch: 28, train_loss: 1.0498, test_loss: 1.1418, test_f1: 0.4891
 epoch: 29, train_loss: 1.0135, test_loss: 1.1379, test_f1: 0.4768
 epoch: 30, train_loss: 1.0167, test_loss: 1.1503, test_f1: 0.4816
 epoch: 31, train_loss: 1.0051, test_loss: 1.1182, test_f1: 0.5060
 epoch: 32, train_loss: 1.0131, test_loss: 1.1541, test_f1: 0.4758
 epoch: 33, train_loss: 0.9983, test_loss: 1.1553, test_f1: 0.4884
 epoch: 34, train_loss: 0.9904, test_loss: 1.1188, test_f1: 0.4957
 epoch: 35, train_loss: 0.9898, test_loss: 1.1185, test_f1: 0.5228
 epoch: 36, train_loss: 0.9943, test_loss: 1.1212, test_f1: 0.5001
 epoch: 37, train_loss: 0.9835, test_loss: 1.1693, test_f1: 0.4928
 epoch: 38, train_loss: 0.9903, test_loss: 1.1209, test_f1: 0.4972
 epoch: 39, train_loss: 0.9869, test_loss: 1.1605, test_f1: 0.4626
 epoch: 40, train_loss: 0.9821, test_loss: 1.1350, test_f1: 0.5011
 epoch: 41, train_loss: 0.9747, test_loss: 1.1209, test_f1: 0.4984
 epoch: 42, train_loss: 0.9518, test_loss: 1.1192, test_f1: 0.5136
 epoch: 43, train_loss: 0.9633, test_loss: 1.1334, test_f1: 0.5106
 epoch: 44, train_loss: 0.9341, test_loss: 1.1608, test_f1: 0.4942
 epoch: 45, train_loss: 0.9231, test_loss: 1.1452, test_f1: 0.4762
 epoch: 46, train_loss: 0.9232, test_loss: 1.1826, test_f1: 0.5372
 epoch: 47, train_loss: 0.9115, test_loss: 1.1434, test_f1: 0.5208
 epoch: 48, train_loss: 0.9253, test_loss: 1.2114, test_f1: 0.4704
 epoch: 49, train_loss: 0.9144, test_loss: 1.1938, test_f1: 0.4995
 epoch: 50, train_loss: 0.9129, test_loss: 1.1437, test_f1: 0.5153
 epoch: 51, train_loss: 0.8865, test_loss: 1.1709, test_f1: 0.5058
 epoch: 52, train_loss: 0.9007, test_loss: 1.1676, test_f1: 0.4849
 epoch: 53, train_loss: 0.9015, test_loss: 1.1651, test_f1: 0.5089
 epoch: 54, train_loss: 0.8881, test_loss: 1.1532, test_f1: 0.4859
 epoch: 55, train_loss: 0.8923, test_loss: 1.1400, test_f1: 0.5075
 epoch: 56, train_loss: 0.8901, test_loss: 1.1421, test_f1: 0.5242
 epoch: 57, train_loss: 0.8874, test_loss: 1.1505, test_f1: 0.5080
 epoch: 58, train_loss: 0.8925, test_loss: 1.1523, test_f1: 0.5045
 epoch: 59, train_loss: 0.8718, test_loss: 1.1595, test_f1: 0.5119
 epoch: 60, train_loss: 0.8894, test_loss: 1.1200, test_f1: 0.5286
 epoch: 61, train_loss: 0.8727, test_loss: 1.1651, test_f1: 0.4977
 epoch: 62, train_loss: 0.8710, test_loss: 1.1826, test_f1: 0.5141
 epoch: 63, train_loss: 0.8699, test_loss: 1.1591, test_f1: 0.5101
 epoch: 64, train_loss: 0.8739, test_loss: 1.1515, test_f1: 0.5115
 epoch: 65, train_loss: 0.8635, test_loss: 1.1421, test_f1: 0.5090
 epoch: 66, train_loss: 0.8725, test_loss: 1.1795, test_f1: 0.5055
 epoch: 67, train_loss: 0.8751, test_loss: 1.1997, test_f1: 0.4781
 epoch: 68, train_loss: 0.8617, test_loss: 1.1870, test_f1: 0.5115
 epoch: 69, train_loss: 0.8548, test_loss: 1.1817, test_f1: 0.5070
 epoch: 70, train_loss: 0.8519, test_loss: 1.1732, test_f1: 0.5082
 epoch: 71, train_loss: 0.8567, test_loss: 1.2207, test_f1: 0.4820
 epoch: 72, train_loss: 0.8581, test_loss: 1.2109, test_f1: 0.4604
 epoch: 73, train_loss: 0.8576, test_loss: 1.2055, test_f1: 0.5013
 epoch: 74, train_loss: 0.8567, test_loss: 1.1944, test_f1: 0.5087
 epoch: 75, train_loss: 0.8664, test_loss: 1.2124, test_f1: 0.5181
 epoch: 76, train_loss: 0.8642, test_loss: 1.2238, test_f1: 0.4803
 epoch: 77, train_loss: 0.8554, test_loss: 1.2112, test_f1: 0.4883
 epoch: 78, train_loss: 0.8501, test_loss: 1.2312, test_f1: 0.5064
 epoch: 79, train_loss: 0.8345, test_loss: 1.3074, test_f1: 0.4852
 epoch: 80, train_loss: 0.8459, test_loss: 1.2678, test_f1: 0.4938
 epoch: 81, train_loss: 0.8355, test_loss: 1.3242, test_f1: 0.4906
 epoch: 82, train_loss: 0.8467, test_loss: 1.3200, test_f1: 0.4946
 epoch: 83, train_loss: 0.8663, test_loss: 1.1972, test_f1: 0.5094
 epoch: 84, train_loss: 0.8463, test_loss: 1.2160, test_f1: 0.5257
 epoch: 85, train_loss: 0.8284, test_loss: 1.2729, test_f1: 0.5095
 epoch: 86, train_loss: 0.8366, test_loss: 1.2862, test_f1: 0.5048
 epoch: 87, train_loss: 0.8329, test_loss: 1.3329, test_f1: 0.4854
 epoch: 88, train_loss: 0.8427, test_loss: 1.2435, test_f1: 0.4976
 epoch: 89, train_loss: 0.8234, test_loss: 1.2451, test_f1: 0.4898
 epoch: 90, train_loss: 0.8404, test_loss: 1.2643, test_f1: 0.4909
 epoch: 91, train_loss: 0.8350, test_loss: 1.2060, test_f1: 0.5248
 epoch: 92, train_loss: 0.8311, test_loss: 1.2326, test_f1: 0.4872
 epoch: 93, train_loss: 0.8338, test_loss: 1.3300, test_f1: 0.4755
 epoch: 94, train_loss: 0.8302, test_loss: 1.2802, test_f1: 0.5019
 epoch: 95, train_loss: 0.8270, test_loss: 1.3106, test_f1: 0.5021
 epoch: 96, train_loss: 0.8412, test_loss: 1.3104, test_f1: 0.5165
 epoch: 97, train_loss: 0.8463, test_loss: 1.2780, test_f1: 0.5197
 epoch: 98, train_loss: 0.8274, test_loss: 1.2611, test_f1: 0.5115
 epoch: 99, train_loss: 0.8292, test_loss: 1.2296, test_f1: 0.4991
##################ITERATION #2 ****************************************
 epoch: 0, train_loss: 1.3901, test_loss: 1.3762, test_f1: 0.2307
 epoch: 1, train_loss: 1.2863, test_loss: 1.3244, test_f1: 0.2281
 epoch: 2, train_loss: 1.2652, test_loss: 1.3005, test_f1: 0.2281
 epoch: 3, train_loss: 1.2480, test_loss: 1.2885, test_f1: 0.2281
 epoch: 4, train_loss: 1.2320, test_loss: 1.2801, test_f1: 0.2281
 epoch: 5, train_loss: 1.2215, test_loss: 1.2731, test_f1: 0.2281
 epoch: 6, train_loss: 1.2174, test_loss: 1.2717, test_f1: 0.2281
 epoch: 7, train_loss: 1.2106, test_loss: 1.2714, test_f1: 0.2285
 epoch: 8, train_loss: 1.1982, test_loss: 1.2602, test_f1: 0.2529
 epoch: 9, train_loss: 1.1963, test_loss: 1.2587, test_f1: 0.2862
 epoch: 10, train_loss: 1.1823, test_loss: 1.2549, test_f1: 0.3027
 epoch: 11, train_loss: 1.1719, test_loss: 1.2452, test_f1: 0.2993
 epoch: 12, train_loss: 1.1597, test_loss: 1.2399, test_f1: 0.3457
 epoch: 13, train_loss: 1.1513, test_loss: 1.2327, test_f1: 0.3392
 epoch: 14, train_loss: 1.1351, test_loss: 1.2299, test_f1: 0.4021
 epoch: 15, train_loss: 1.1373, test_loss: 1.2260, test_f1: 0.3784
 epoch: 16, train_loss: 1.1342, test_loss: 1.2191, test_f1: 0.3891
 epoch: 17, train_loss: 1.1227, test_loss: 1.2331, test_f1: 0.3634
 epoch: 18, train_loss: 1.1094, test_loss: 1.2460, test_f1: 0.3962
 epoch: 19, train_loss: 1.1085, test_loss: 1.2089, test_f1: 0.3793
 epoch: 20, train_loss: 1.0994, test_loss: 1.1936, test_f1: 0.4181
 epoch: 21, train_loss: 1.0811, test_loss: 1.2126, test_f1: 0.4104
 epoch: 22, train_loss: 1.0887, test_loss: 1.1924, test_f1: 0.4273
 epoch: 23, train_loss: 1.0666, test_loss: 1.2265, test_f1: 0.4059
 epoch: 24, train_loss: 1.0589, test_loss: 1.2242, test_f1: 0.4142
 epoch: 25, train_loss: 1.0472, test_loss: 1.1999, test_f1: 0.3982
 epoch: 26, train_loss: 1.0324, test_loss: 1.2348, test_f1: 0.4390
 epoch: 27, train_loss: 1.0424, test_loss: 1.2268, test_f1: 0.4537
 epoch: 28, train_loss: 1.0274, test_loss: 1.2180, test_f1: 0.4706
 epoch: 29, train_loss: 1.0245, test_loss: 1.2121, test_f1: 0.4626
 epoch: 30, train_loss: 1.0107, test_loss: 1.2345, test_f1: 0.4790
 epoch: 31, train_loss: 1.0075, test_loss: 1.2433, test_f1: 0.4686
 epoch: 32, train_loss: 0.9877, test_loss: 1.2471, test_f1: 0.4739
 epoch: 33, train_loss: 0.9971, test_loss: 1.2248, test_f1: 0.4926
 epoch: 34, train_loss: 0.9924, test_loss: 1.2196, test_f1: 0.4701
 epoch: 35, train_loss: 0.9877, test_loss: 1.2374, test_f1: 0.4707
 epoch: 36, train_loss: 0.9876, test_loss: 1.2385, test_f1: 0.4315
 epoch: 37, train_loss: 0.9693, test_loss: 1.2358, test_f1: 0.4592
 epoch: 38, train_loss: 0.9732, test_loss: 1.2172, test_f1: 0.4972
 epoch: 39, train_loss: 0.9735, test_loss: 1.2303, test_f1: 0.4832
 epoch: 40, train_loss: 0.9628, test_loss: 1.2227, test_f1: 0.4779
 epoch: 41, train_loss: 0.9630, test_loss: 1.2540, test_f1: 0.4861
 epoch: 42, train_loss: 0.9559, test_loss: 1.3063, test_f1: 0.4631
 epoch: 43, train_loss: 0.9731, test_loss: 1.2276, test_f1: 0.4857
 epoch: 44, train_loss: 0.9541, test_loss: 1.2332, test_f1: 0.4840
 epoch: 45, train_loss: 0.9485, test_loss: 1.2219, test_f1: 0.4804
 epoch: 46, train_loss: 0.9312, test_loss: 1.2431, test_f1: 0.4850
 epoch: 47, train_loss: 0.9453, test_loss: 1.2293, test_f1: 0.4978
 epoch: 48, train_loss: 0.9316, test_loss: 1.2113, test_f1: 0.4819
 epoch: 49, train_loss: 0.9222, test_loss: 1.2279, test_f1: 0.4978
 epoch: 50, train_loss: 0.9246, test_loss: 1.2352, test_f1: 0.4862
 epoch: 51, train_loss: 0.9368, test_loss: 1.2551, test_f1: 0.4924
 epoch: 52, train_loss: 0.9231, test_loss: 1.2192, test_f1: 0.4620
 epoch: 53, train_loss: 0.8962, test_loss: 1.2328, test_f1: 0.4731
 epoch: 54, train_loss: 0.9108, test_loss: 1.2483, test_f1: 0.4924
 epoch: 55, train_loss: 0.9056, test_loss: 1.2627, test_f1: 0.4833
 epoch: 56, train_loss: 0.9052, test_loss: 1.2497, test_f1: 0.4677
 epoch: 57, train_loss: 0.9003, test_loss: 1.2348, test_f1: 0.4660
 epoch: 58, train_loss: 0.8943, test_loss: 1.2736, test_f1: 0.4915
 epoch: 59, train_loss: 0.8975, test_loss: 1.2764, test_f1: 0.4818
 epoch: 60, train_loss: 0.9041, test_loss: 1.2618, test_f1: 0.5206
 epoch: 61, train_loss: 0.8932, test_loss: 1.2545, test_f1: 0.4938
 epoch: 62, train_loss: 0.8896, test_loss: 1.2771, test_f1: 0.4875
 epoch: 63, train_loss: 0.8857, test_loss: 1.2668, test_f1: 0.4974
 epoch: 64, train_loss: 0.8962, test_loss: 1.3083, test_f1: 0.5020
 epoch: 65, train_loss: 0.8957, test_loss: 1.2065, test_f1: 0.5136
 epoch: 66, train_loss: 0.8971, test_loss: 1.2034, test_f1: 0.4763
 epoch: 67, train_loss: 0.8890, test_loss: 1.2029, test_f1: 0.5292
 epoch: 68, train_loss: 0.8795, test_loss: 1.2597, test_f1: 0.4873
 epoch: 69, train_loss: 0.8831, test_loss: 1.2753, test_f1: 0.4978
 epoch: 70, train_loss: 0.8802, test_loss: 1.2650, test_f1: 0.5162
 epoch: 71, train_loss: 0.8649, test_loss: 1.2918, test_f1: 0.5102
 epoch: 72, train_loss: 0.8784, test_loss: 1.2539, test_f1: 0.5087
 epoch: 73, train_loss: 0.8703, test_loss: 1.2507, test_f1: 0.4731
 epoch: 74, train_loss: 0.8661, test_loss: 1.2508, test_f1: 0.4850
 epoch: 75, train_loss: 0.8469, test_loss: 1.2480, test_f1: 0.5203
 epoch: 76, train_loss: 0.8737, test_loss: 1.2933, test_f1: 0.4843
 epoch: 77, train_loss: 0.8687, test_loss: 1.2954, test_f1: 0.5088
 epoch: 78, train_loss: 0.8654, test_loss: 1.2797, test_f1: 0.5111
 epoch: 79, train_loss: 0.8540, test_loss: 1.2789, test_f1: 0.4745
 epoch: 80, train_loss: 0.8492, test_loss: 1.2927, test_f1: 0.4824
 epoch: 81, train_loss: 0.8552, test_loss: 1.2920, test_f1: 0.4903
 epoch: 82, train_loss: 0.8457, test_loss: 1.2942, test_f1: 0.4955
 epoch: 83, train_loss: 0.8450, test_loss: 1.3627, test_f1: 0.5110
 epoch: 84, train_loss: 0.8430, test_loss: 1.3511, test_f1: 0.4879
 epoch: 85, train_loss: 0.8468, test_loss: 1.3388, test_f1: 0.4901
 epoch: 86, train_loss: 0.8436, test_loss: 1.3519, test_f1: 0.4653
 epoch: 87, train_loss: 0.8548, test_loss: 1.2833, test_f1: 0.4929
 epoch: 88, train_loss: 0.8528, test_loss: 1.2912, test_f1: 0.4915
 epoch: 89, train_loss: 0.8333, test_loss: 1.3774, test_f1: 0.4757
 epoch: 90, train_loss: 0.8291, test_loss: 1.3065, test_f1: 0.4989
 epoch: 91, train_loss: 0.8275, test_loss: 1.3712, test_f1: 0.4920
 epoch: 92, train_loss: 0.8548, test_loss: 1.3541, test_f1: 0.4934
 epoch: 93, train_loss: 0.8347, test_loss: 1.3694, test_f1: 0.4695
 epoch: 94, train_loss: 0.8338, test_loss: 1.4035, test_f1: 0.4864
 epoch: 95, train_loss: 0.8311, test_loss: 1.3996, test_f1: 0.4809
 epoch: 96, train_loss: 0.8252, test_loss: 1.4223, test_f1: 0.4648
 epoch: 97, train_loss: 0.8216, test_loss: 1.3452, test_f1: 0.4987
 epoch: 98, train_loss: 0.8282, test_loss: 1.3921, test_f1: 0.4720
 epoch: 99, train_loss: 0.8158, test_loss: 1.4058, test_f1: 0.4932
##################ITERATION #3 ****************************************
 epoch: 0, train_loss: 1.3597, test_loss: 1.3721, test_f1: 0.2285
 epoch: 1, train_loss: 1.2524, test_loss: 1.3149, test_f1: 0.2281
 epoch: 2, train_loss: 1.2057, test_loss: 1.2871, test_f1: 0.2281
 epoch: 3, train_loss: 1.2025, test_loss: 1.2574, test_f1: 0.2866
 epoch: 4, train_loss: 1.1698, test_loss: 1.2389, test_f1: 0.3300
 epoch: 5, train_loss: 1.1453, test_loss: 1.2326, test_f1: 0.3358
 epoch: 6, train_loss: 1.1247, test_loss: 1.2230, test_f1: 0.3388
 epoch: 7, train_loss: 1.1157, test_loss: 1.2185, test_f1: 0.3886
 epoch: 8, train_loss: 1.1020, test_loss: 1.2143, test_f1: 0.3948
 epoch: 9, train_loss: 1.0887, test_loss: 1.2212, test_f1: 0.4081
 epoch: 10, train_loss: 1.0876, test_loss: 1.1937, test_f1: 0.4094
 epoch: 11, train_loss: 1.0708, test_loss: 1.2026, test_f1: 0.4230
 epoch: 12, train_loss: 1.0644, test_loss: 1.2061, test_f1: 0.4229
 epoch: 13, train_loss: 1.0595, test_loss: 1.1837, test_f1: 0.4527
 epoch: 14, train_loss: 1.0484, test_loss: 1.1772, test_f1: 0.4451
 epoch: 15, train_loss: 1.0297, test_loss: 1.1981, test_f1: 0.4458
 epoch: 16, train_loss: 1.0373, test_loss: 1.1677, test_f1: 0.4781
 epoch: 17, train_loss: 1.0181, test_loss: 1.1815, test_f1: 0.4996
 epoch: 18, train_loss: 1.0202, test_loss: 1.1686, test_f1: 0.4878
 epoch: 19, train_loss: 1.0092, test_loss: 1.1662, test_f1: 0.5233
 epoch: 20, train_loss: 1.0074, test_loss: 1.1660, test_f1: 0.5202
 epoch: 21, train_loss: 1.0018, test_loss: 1.1482, test_f1: 0.5219
 epoch: 22, train_loss: 0.9944, test_loss: 1.1130, test_f1: 0.5251
 epoch: 23, train_loss: 1.0001, test_loss: 1.1311, test_f1: 0.5282
 epoch: 24, train_loss: 0.9774, test_loss: 1.1327, test_f1: 0.5134
 epoch: 25, train_loss: 0.9752, test_loss: 1.1253, test_f1: 0.5127
 epoch: 26, train_loss: 0.9616, test_loss: 1.1430, test_f1: 0.5260
 epoch: 27, train_loss: 0.9457, test_loss: 1.1122, test_f1: 0.5298
 epoch: 28, train_loss: 0.9693, test_loss: 1.1121, test_f1: 0.5418
 epoch: 29, train_loss: 0.9558, test_loss: 1.1269, test_f1: 0.5425
 epoch: 30, train_loss: 0.9443, test_loss: 1.1262, test_f1: 0.5225
 epoch: 31, train_loss: 0.9371, test_loss: 1.1281, test_f1: 0.5167
 epoch: 32, train_loss: 0.9445, test_loss: 1.1306, test_f1: 0.5216
 epoch: 33, train_loss: 0.9273, test_loss: 1.1510, test_f1: 0.5100
 epoch: 34, train_loss: 0.9174, test_loss: 1.1259, test_f1: 0.5031
 epoch: 35, train_loss: 0.9062, test_loss: 1.1539, test_f1: 0.5079
 epoch: 36, train_loss: 0.9159, test_loss: 1.2659, test_f1: 0.4707
 epoch: 37, train_loss: 0.9264, test_loss: 1.2899, test_f1: 0.4614
 epoch: 38, train_loss: 0.9120, test_loss: 1.3002, test_f1: 0.5276
 epoch: 39, train_loss: 0.8982, test_loss: 1.2403, test_f1: 0.4781
 epoch: 40, train_loss: 0.9014, test_loss: 1.1783, test_f1: 0.5097
 epoch: 41, train_loss: 0.9008, test_loss: 1.2263, test_f1: 0.5359
 epoch: 42, train_loss: 0.9135, test_loss: 1.1768, test_f1: 0.5222
 epoch: 43, train_loss: 0.8789, test_loss: 1.2286, test_f1: 0.5289
 epoch: 44, train_loss: 0.8889, test_loss: 1.1889, test_f1: 0.5284
 epoch: 45, train_loss: 0.8878, test_loss: 1.2389, test_f1: 0.5282
 epoch: 46, train_loss: 0.9023, test_loss: 1.1720, test_f1: 0.4988
 epoch: 47, train_loss: 0.8787, test_loss: 1.2018, test_f1: 0.5117
 epoch: 48, train_loss: 0.8575, test_loss: 1.2818, test_f1: 0.5173
 epoch: 49, train_loss: 0.8830, test_loss: 1.2674, test_f1: 0.5108
 epoch: 50, train_loss: 0.8502, test_loss: 1.2810, test_f1: 0.4924
 epoch: 51, train_loss: 0.8451, test_loss: 1.3003, test_f1: 0.5333
 epoch: 52, train_loss: 0.8388, test_loss: 1.3085, test_f1: 0.5463
 epoch: 53, train_loss: 0.8449, test_loss: 1.3384, test_f1: 0.5360
 epoch: 54, train_loss: 0.8400, test_loss: 1.3324, test_f1: 0.5418
 epoch: 55, train_loss: 0.8455, test_loss: 1.2785, test_f1: 0.5392
 epoch: 56, train_loss: 0.8436, test_loss: 1.3543, test_f1: 0.5408
 epoch: 57, train_loss: 0.8484, test_loss: 1.3547, test_f1: 0.5324
 epoch: 58, train_loss: 0.8371, test_loss: 1.3024, test_f1: 0.5327
 epoch: 59, train_loss: 0.8350, test_loss: 1.3455, test_f1: 0.5167
 epoch: 60, train_loss: 0.8326, test_loss: 1.3377, test_f1: 0.5120
 epoch: 61, train_loss: 0.8274, test_loss: 1.2894, test_f1: 0.5169
 epoch: 62, train_loss: 0.8371, test_loss: 1.3693, test_f1: 0.5222
 epoch: 63, train_loss: 0.8117, test_loss: 1.3432, test_f1: 0.5192
 epoch: 64, train_loss: 0.8287, test_loss: 1.3224, test_f1: 0.5329
 epoch: 65, train_loss: 0.8335, test_loss: 1.4196, test_f1: 0.5250
 epoch: 66, train_loss: 0.8321, test_loss: 1.4101, test_f1: 0.5161
 epoch: 67, train_loss: 0.8195, test_loss: 1.5352, test_f1: 0.5232
 epoch: 68, train_loss: 0.8182, test_loss: 1.5043, test_f1: 0.5213
 epoch: 69, train_loss: 0.8143, test_loss: 1.4230, test_f1: 0.5029
 epoch: 70, train_loss: 0.8102, test_loss: 1.3558, test_f1: 0.5142
 epoch: 71, train_loss: 0.8336, test_loss: 1.3473, test_f1: 0.5053
 epoch: 72, train_loss: 0.8055, test_loss: 1.3413, test_f1: 0.5105
 epoch: 73, train_loss: 0.8199, test_loss: 1.2461, test_f1: 0.5250
 epoch: 74, train_loss: 0.8207, test_loss: 1.2351, test_f1: 0.5166
 epoch: 75, train_loss: 0.8074, test_loss: 1.3653, test_f1: 0.5113
 epoch: 76, train_loss: 0.8108, test_loss: 1.3671, test_f1: 0.5190
 epoch: 77, train_loss: 0.7984, test_loss: 1.3956, test_f1: 0.5433
 epoch: 78, train_loss: 0.7977, test_loss: 1.4318, test_f1: 0.5166
 epoch: 79, train_loss: 0.7991, test_loss: 1.3759, test_f1: 0.5169
 epoch: 80, train_loss: 0.7840, test_loss: 1.3973, test_f1: 0.5085
 epoch: 81, train_loss: 0.8251, test_loss: 1.4377, test_f1: 0.5047
 epoch: 82, train_loss: 0.7864, test_loss: 1.3404, test_f1: 0.5218
 epoch: 83, train_loss: 0.8063, test_loss: 1.3418, test_f1: 0.5021
 epoch: 84, train_loss: 0.7947, test_loss: 1.3689, test_f1: 0.5272
 epoch: 85, train_loss: 0.7885, test_loss: 1.3524, test_f1: 0.5168
 epoch: 86, train_loss: 0.7841, test_loss: 1.4044, test_f1: 0.5277
 epoch: 87, train_loss: 0.7957, test_loss: 1.3953, test_f1: 0.5170
 epoch: 88, train_loss: 0.7971, test_loss: 1.4324, test_f1: 0.5305
 epoch: 89, train_loss: 0.7715, test_loss: 1.4422, test_f1: 0.5301
 epoch: 90, train_loss: 0.7772, test_loss: 1.4162, test_f1: 0.5360
 epoch: 91, train_loss: 0.8004, test_loss: 1.4804, test_f1: 0.5287
 epoch: 92, train_loss: 0.7942, test_loss: 1.5095, test_f1: 0.5339
 epoch: 93, train_loss: 0.7784, test_loss: 1.4851, test_f1: 0.5200
 epoch: 94, train_loss: 0.7839, test_loss: 1.4128, test_f1: 0.5277
 epoch: 95, train_loss: 0.7896, test_loss: 1.4332, test_f1: 0.5094
 epoch: 96, train_loss: 0.7908, test_loss: 1.4489, test_f1: 0.5146
 epoch: 97, train_loss: 0.7837, test_loss: 1.4372, test_f1: 0.5198
 epoch: 98, train_loss: 0.7900, test_loss: 1.4010, test_f1: 0.5272
 epoch: 99, train_loss: 0.7654, test_loss: 1.3913, test_f1: 0.5173
##################ITERATION #4 ****************************************
 epoch: 0, train_loss: 1.3406, test_loss: 1.3615, test_f1: 0.2404
 epoch: 1, train_loss: 1.2457, test_loss: 1.4010, test_f1: 0.2404
 epoch: 2, train_loss: 1.2321, test_loss: 1.4222, test_f1: 0.2404
 epoch: 3, train_loss: 1.2164, test_loss: 1.4518, test_f1: 0.2659
 epoch: 4, train_loss: 1.1863, test_loss: 1.4105, test_f1: 0.2662
 epoch: 5, train_loss: 1.1904, test_loss: 1.3409, test_f1: 0.3134
 epoch: 6, train_loss: 1.1813, test_loss: 1.3216, test_f1: 0.3232
 epoch: 7, train_loss: 1.1759, test_loss: 1.3257, test_f1: 0.3001
 epoch: 8, train_loss: 1.1575, test_loss: 1.3187, test_f1: 0.2894
 epoch: 9, train_loss: 1.1570, test_loss: 1.3102, test_f1: 0.3193
 epoch: 10, train_loss: 1.1533, test_loss: 1.3190, test_f1: 0.3212
 epoch: 11, train_loss: 1.1302, test_loss: 1.3004, test_f1: 0.3637
 epoch: 12, train_loss: 1.1433, test_loss: 1.2692, test_f1: 0.3296
 epoch: 13, train_loss: 1.1362, test_loss: 1.2490, test_f1: 0.3832
 epoch: 14, train_loss: 1.1256, test_loss: 1.2486, test_f1: 0.3885
 epoch: 15, train_loss: 1.1186, test_loss: 1.2560, test_f1: 0.3940
 epoch: 16, train_loss: 1.1059, test_loss: 1.2535, test_f1: 0.3981
 epoch: 17, train_loss: 1.1025, test_loss: 1.2381, test_f1: 0.4100
 epoch: 18, train_loss: 1.0949, test_loss: 1.2453, test_f1: 0.4057
 epoch: 19, train_loss: 1.0809, test_loss: 1.2405, test_f1: 0.4062
 epoch: 20, train_loss: 1.0702, test_loss: 1.2536, test_f1: 0.4185
 epoch: 21, train_loss: 1.0709, test_loss: 1.2582, test_f1: 0.4268
 epoch: 22, train_loss: 1.0604, test_loss: 1.2324, test_f1: 0.4181
 epoch: 23, train_loss: 1.0580, test_loss: 1.2122, test_f1: 0.4373
 epoch: 24, train_loss: 1.0412, test_loss: 1.2212, test_f1: 0.4718
 epoch: 25, train_loss: 1.0257, test_loss: 1.2308, test_f1: 0.4813
 epoch: 26, train_loss: 1.0289, test_loss: 1.2682, test_f1: 0.4764
 epoch: 27, train_loss: 1.0293, test_loss: 1.2372, test_f1: 0.4671
 epoch: 28, train_loss: 1.0183, test_loss: 1.2459, test_f1: 0.4921
 epoch: 29, train_loss: 1.0306, test_loss: 1.2159, test_f1: 0.5006
 epoch: 30, train_loss: 1.0160, test_loss: 1.2035, test_f1: 0.5063
 epoch: 31, train_loss: 0.9952, test_loss: 1.2498, test_f1: 0.4842
 epoch: 32, train_loss: 1.0058, test_loss: 1.2483, test_f1: 0.4894
 epoch: 33, train_loss: 0.9909, test_loss: 1.2823, test_f1: 0.5003
 epoch: 34, train_loss: 0.9966, test_loss: 1.3019, test_f1: 0.4818
 epoch: 35, train_loss: 0.9805, test_loss: 1.2395, test_f1: 0.4907
 epoch: 36, train_loss: 0.9976, test_loss: 1.2670, test_f1: 0.4911
 epoch: 37, train_loss: 0.9714, test_loss: 1.2421, test_f1: 0.5107
 epoch: 38, train_loss: 0.9613, test_loss: 1.2039, test_f1: 0.5149
 epoch: 39, train_loss: 0.9621, test_loss: 1.1459, test_f1: 0.5429
 epoch: 40, train_loss: 0.9761, test_loss: 1.1610, test_f1: 0.5000
 epoch: 41, train_loss: 0.9550, test_loss: 1.1813, test_f1: 0.5013
 epoch: 42, train_loss: 0.9420, test_loss: 1.1751, test_f1: 0.5120
 epoch: 43, train_loss: 0.9501, test_loss: 1.1393, test_f1: 0.5430
 epoch: 44, train_loss: 0.9325, test_loss: 1.1083, test_f1: 0.5348
 epoch: 45, train_loss: 0.9316, test_loss: 1.1512, test_f1: 0.5295
 epoch: 46, train_loss: 0.9260, test_loss: 1.1754, test_f1: 0.5267
 epoch: 47, train_loss: 0.9318, test_loss: 1.1748, test_f1: 0.5173
 epoch: 48, train_loss: 0.9244, test_loss: 1.1448, test_f1: 0.5454
 epoch: 49, train_loss: 0.9286, test_loss: 1.1463, test_f1: 0.5543
 epoch: 50, train_loss: 0.9057, test_loss: 1.1182, test_f1: 0.5190
 epoch: 51, train_loss: 0.8995, test_loss: 1.1361, test_f1: 0.5461
 epoch: 52, train_loss: 0.8963, test_loss: 1.1439, test_f1: 0.5254
 epoch: 53, train_loss: 0.8964, test_loss: 1.1336, test_f1: 0.5470
 epoch: 54, train_loss: 0.8787, test_loss: 1.1776, test_f1: 0.5353
 epoch: 55, train_loss: 0.8894, test_loss: 1.1754, test_f1: 0.5494
 epoch: 56, train_loss: 0.8791, test_loss: 1.1596, test_f1: 0.5590
 epoch: 57, train_loss: 0.8803, test_loss: 1.1455, test_f1: 0.5591
 epoch: 58, train_loss: 0.8668, test_loss: 1.1122, test_f1: 0.5541
 epoch: 59, train_loss: 0.8714, test_loss: 1.1337, test_f1: 0.5574
 epoch: 60, train_loss: 0.8644, test_loss: 1.1696, test_f1: 0.5359
 epoch: 61, train_loss: 0.8709, test_loss: 1.1398, test_f1: 0.5327
 epoch: 62, train_loss: 0.8694, test_loss: 1.1553, test_f1: 0.5321
 epoch: 63, train_loss: 0.8759, test_loss: 1.1638, test_f1: 0.5407
 epoch: 64, train_loss: 0.8806, test_loss: 1.1617, test_f1: 0.5347
 epoch: 65, train_loss: 0.8664, test_loss: 1.1571, test_f1: 0.5381
 epoch: 66, train_loss: 0.8632, test_loss: 1.1999, test_f1: 0.5165
 epoch: 67, train_loss: 0.8624, test_loss: 1.1621, test_f1: 0.5453
 epoch: 68, train_loss: 0.8711, test_loss: 1.1784, test_f1: 0.5122
 epoch: 69, train_loss: 0.8621, test_loss: 1.1946, test_f1: 0.5028
 epoch: 70, train_loss: 0.8530, test_loss: 1.1496, test_f1: 0.5151
 epoch: 71, train_loss: 0.8695, test_loss: 1.2017, test_f1: 0.5083
 epoch: 72, train_loss: 0.8652, test_loss: 1.2028, test_f1: 0.5205
 epoch: 73, train_loss: 0.8635, test_loss: 1.1435, test_f1: 0.5533
 epoch: 74, train_loss: 0.8570, test_loss: 1.1479, test_f1: 0.5457
 epoch: 75, train_loss: 0.8582, test_loss: 1.1831, test_f1: 0.5240
 epoch: 76, train_loss: 0.8621, test_loss: 1.1389, test_f1: 0.5507
 epoch: 77, train_loss: 0.8550, test_loss: 1.1612, test_f1: 0.5354
 epoch: 78, train_loss: 0.8558, test_loss: 1.1747, test_f1: 0.5079
 epoch: 79, train_loss: 0.8388, test_loss: 1.1542, test_f1: 0.5208
 epoch: 80, train_loss: 0.8320, test_loss: 1.1384, test_f1: 0.5221
 epoch: 81, train_loss: 0.8461, test_loss: 1.1765, test_f1: 0.5260
 epoch: 82, train_loss: 0.8411, test_loss: 1.1770, test_f1: 0.5227
 epoch: 83, train_loss: 0.8209, test_loss: 1.1512, test_f1: 0.5187
 epoch: 84, train_loss: 0.8247, test_loss: 1.1619, test_f1: 0.5483
 epoch: 85, train_loss: 0.8229, test_loss: 1.1598, test_f1: 0.5561
 epoch: 86, train_loss: 0.8233, test_loss: 1.1647, test_f1: 0.5631
 epoch: 87, train_loss: 0.8447, test_loss: 1.1769, test_f1: 0.5566
 epoch: 88, train_loss: 0.8382, test_loss: 1.1794, test_f1: 0.5555
 epoch: 89, train_loss: 0.8258, test_loss: 1.1538, test_f1: 0.5524
 epoch: 90, train_loss: 0.8257, test_loss: 1.1841, test_f1: 0.5196
 epoch: 91, train_loss: 0.8205, test_loss: 1.2480, test_f1: 0.5310
 epoch: 92, train_loss: 0.8134, test_loss: 1.2620, test_f1: 0.5257
 epoch: 93, train_loss: 0.8202, test_loss: 1.2586, test_f1: 0.5569
 epoch: 94, train_loss: 0.8227, test_loss: 1.2099, test_f1: 0.5621
 epoch: 95, train_loss: 0.8371, test_loss: 1.2115, test_f1: 0.5428
 epoch: 96, train_loss: 0.8118, test_loss: 1.1907, test_f1: 0.5257
 epoch: 97, train_loss: 0.8032, test_loss: 1.1942, test_f1: 0.5424
 epoch: 98, train_loss: 0.8138, test_loss: 1.2055, test_f1: 0.5329
 epoch: 99, train_loss: 0.8254, test_loss: 1.1923, test_f1: 0.5700
##################ITERATION #5 ****************************************
 epoch: 0, train_loss: 1.3042, test_loss: 1.3506, test_f1: 0.2281
 epoch: 1, train_loss: 1.2670, test_loss: 1.3343, test_f1: 0.2281
 epoch: 2, train_loss: 1.2497, test_loss: 1.3124, test_f1: 0.2248
 epoch: 3, train_loss: 1.2239, test_loss: 1.2955, test_f1: 0.2251
 epoch: 4, train_loss: 1.2221, test_loss: 1.2886, test_f1: 0.2247
 epoch: 5, train_loss: 1.2108, test_loss: 1.2679, test_f1: 0.2238
 epoch: 6, train_loss: 1.2047, test_loss: 1.2742, test_f1: 0.2401
 epoch: 7, train_loss: 1.2000, test_loss: 1.2768, test_f1: 0.2517
 epoch: 8, train_loss: 1.1966, test_loss: 1.2629, test_f1: 0.2485
 epoch: 9, train_loss: 1.1872, test_loss: 1.2605, test_f1: 0.2501
 epoch: 10, train_loss: 1.1773, test_loss: 1.2546, test_f1: 0.2899
 epoch: 11, train_loss: 1.1893, test_loss: 1.2394, test_f1: 0.2739
 epoch: 12, train_loss: 1.1759, test_loss: 1.2424, test_f1: 0.2817
 epoch: 13, train_loss: 1.1782, test_loss: 1.2388, test_f1: 0.2941
 epoch: 14, train_loss: 1.1635, test_loss: 1.2300, test_f1: 0.3074
 epoch: 15, train_loss: 1.1685, test_loss: 1.2375, test_f1: 0.3009
 epoch: 16, train_loss: 1.1632, test_loss: 1.2176, test_f1: 0.3070
 epoch: 17, train_loss: 1.1606, test_loss: 1.2066, test_f1: 0.3195
 epoch: 18, train_loss: 1.1494, test_loss: 1.2047, test_f1: 0.3334
 epoch: 19, train_loss: 1.1559, test_loss: 1.1980, test_f1: 0.3382
 epoch: 20, train_loss: 1.1468, test_loss: 1.1919, test_f1: 0.3027
 epoch: 21, train_loss: 1.1267, test_loss: 1.1930, test_f1: 0.3179
 epoch: 22, train_loss: 1.1394, test_loss: 1.1989, test_f1: 0.3345
 epoch: 23, train_loss: 1.1303, test_loss: 1.1989, test_f1: 0.3375
 epoch: 24, train_loss: 1.1352, test_loss: 1.1946, test_f1: 0.3399
 epoch: 25, train_loss: 1.1322, test_loss: 1.1900, test_f1: 0.3457
 epoch: 26, train_loss: 1.1120, test_loss: 1.1912, test_f1: 0.3601
 epoch: 27, train_loss: 1.1290, test_loss: 1.1887, test_f1: 0.3038
 epoch: 28, train_loss: 1.1026, test_loss: 1.1709, test_f1: 0.3503
 epoch: 29, train_loss: 1.1158, test_loss: 1.1727, test_f1: 0.3851
 epoch: 30, train_loss: 1.1063, test_loss: 1.1679, test_f1: 0.3470
 epoch: 31, train_loss: 1.1183, test_loss: 1.1776, test_f1: 0.3392
 epoch: 32, train_loss: 1.0948, test_loss: 1.1809, test_f1: 0.3722
 epoch: 33, train_loss: 1.0964, test_loss: 1.1771, test_f1: 0.3517
 epoch: 34, train_loss: 1.0898, test_loss: 1.1758, test_f1: 0.3830
 epoch: 35, train_loss: 1.1069, test_loss: 1.1803, test_f1: 0.3922
 epoch: 36, train_loss: 1.1090, test_loss: 1.1901, test_f1: 0.3805
 epoch: 37, train_loss: 1.1070, test_loss: 1.1674, test_f1: 0.3570
 epoch: 38, train_loss: 1.0792, test_loss: 1.1579, test_f1: 0.3645
 epoch: 39, train_loss: 1.0756, test_loss: 1.1591, test_f1: 0.3832
 epoch: 40, train_loss: 1.0700, test_loss: 1.1710, test_f1: 0.3718
 epoch: 41, train_loss: 1.0635, test_loss: 1.1931, test_f1: 0.3732
 epoch: 42, train_loss: 1.0585, test_loss: 1.1628, test_f1: 0.3738
 epoch: 43, train_loss: 1.0588, test_loss: 1.1355, test_f1: 0.4219
 epoch: 44, train_loss: 1.0560, test_loss: 1.1550, test_f1: 0.4170
 epoch: 45, train_loss: 1.0516, test_loss: 1.1377, test_f1: 0.4295
 epoch: 46, train_loss: 1.0542, test_loss: 1.1521, test_f1: 0.4012
 epoch: 47, train_loss: 1.0530, test_loss: 1.1544, test_f1: 0.4177
 epoch: 48, train_loss: 1.0388, test_loss: 1.1641, test_f1: 0.4631
 epoch: 49, train_loss: 1.0303, test_loss: 1.1193, test_f1: 0.4721
 epoch: 50, train_loss: 1.0423, test_loss: 1.1456, test_f1: 0.4729
 epoch: 51, train_loss: 1.0324, test_loss: 1.1635, test_f1: 0.4394
 epoch: 52, train_loss: 1.0129, test_loss: 1.1807, test_f1: 0.4497
 epoch: 53, train_loss: 1.0243, test_loss: 1.1819, test_f1: 0.4582
 epoch: 54, train_loss: 1.0141, test_loss: 1.1538, test_f1: 0.4550
 epoch: 55, train_loss: 1.0080, test_loss: 1.1279, test_f1: 0.4873
 epoch: 56, train_loss: 1.0094, test_loss: 1.1460, test_f1: 0.4713
 epoch: 57, train_loss: 1.0347, test_loss: 1.1399, test_f1: 0.4751
 epoch: 58, train_loss: 1.0188, test_loss: 1.1755, test_f1: 0.4554
 epoch: 59, train_loss: 1.0060, test_loss: 1.1854, test_f1: 0.4546
 epoch: 60, train_loss: 1.0092, test_loss: 1.1571, test_f1: 0.4822
 epoch: 61, train_loss: 1.0046, test_loss: 1.2004, test_f1: 0.4762
 epoch: 62, train_loss: 1.0039, test_loss: 1.2038, test_f1: 0.4698
 epoch: 63, train_loss: 1.0026, test_loss: 1.2017, test_f1: 0.5008
 epoch: 64, train_loss: 0.9933, test_loss: 1.1651, test_f1: 0.4589
 epoch: 65, train_loss: 1.0027, test_loss: 1.1494, test_f1: 0.4780
 epoch: 66, train_loss: 1.0155, test_loss: 1.1603, test_f1: 0.4726
 epoch: 67, train_loss: 0.9947, test_loss: 1.1837, test_f1: 0.4898
 epoch: 68, train_loss: 0.9831, test_loss: 1.2201, test_f1: 0.4866
 epoch: 69, train_loss: 0.9752, test_loss: 1.2112, test_f1: 0.4614
 epoch: 70, train_loss: 1.0094, test_loss: 1.2132, test_f1: 0.4573
 epoch: 71, train_loss: 0.9717, test_loss: 1.2185, test_f1: 0.4633
 epoch: 72, train_loss: 0.9795, test_loss: 1.2430, test_f1: 0.4788
 epoch: 73, train_loss: 0.9903, test_loss: 1.2298, test_f1: 0.4535
 epoch: 74, train_loss: 0.9872, test_loss: 1.2363, test_f1: 0.4712
 epoch: 75, train_loss: 0.9764, test_loss: 1.2278, test_f1: 0.4645
 epoch: 76, train_loss: 0.9579, test_loss: 1.2393, test_f1: 0.4719
 epoch: 77, train_loss: 0.9778, test_loss: 1.2296, test_f1: 0.4551
 epoch: 78, train_loss: 0.9726, test_loss: 1.2441, test_f1: 0.4699
 epoch: 79, train_loss: 0.9857, test_loss: 1.2363, test_f1: 0.4710
 epoch: 80, train_loss: 0.9837, test_loss: 1.2316, test_f1: 0.4806
 epoch: 81, train_loss: 0.9825, test_loss: 1.1912, test_f1: 0.4811
 epoch: 82, train_loss: 0.9735, test_loss: 1.1910, test_f1: 0.4818
 epoch: 83, train_loss: 0.9708, test_loss: 1.2259, test_f1: 0.4731
 epoch: 84, train_loss: 0.9764, test_loss: 1.2097, test_f1: 0.4621
 epoch: 85, train_loss: 0.9742, test_loss: 1.2470, test_f1: 0.4615
 epoch: 86, train_loss: 0.9680, test_loss: 1.2520, test_f1: 0.4521
 epoch: 87, train_loss: 0.9705, test_loss: 1.2419, test_f1: 0.4713
 epoch: 88, train_loss: 0.9444, test_loss: 1.2838, test_f1: 0.4693
 epoch: 89, train_loss: 0.9539, test_loss: 1.2695, test_f1: 0.4792
 epoch: 90, train_loss: 0.9606, test_loss: 1.2756, test_f1: 0.4751
 epoch: 91, train_loss: 0.9683, test_loss: 1.2608, test_f1: 0.4764
 epoch: 92, train_loss: 0.9624, test_loss: 1.2973, test_f1: 0.4723
 epoch: 93, train_loss: 0.9587, test_loss: 1.3294, test_f1: 0.4850
 epoch: 94, train_loss: 0.9705, test_loss: 1.3198, test_f1: 0.4888
 epoch: 95, train_loss: 0.9670, test_loss: 1.3104, test_f1: 0.4755
 epoch: 96, train_loss: 0.9617, test_loss: 1.2989, test_f1: 0.4752
 epoch: 97, train_loss: 0.9615, test_loss: 1.3157, test_f1: 0.4944
 epoch: 98, train_loss: 0.9497, test_loss: 1.3029, test_f1: 0.4768
 epoch: 99, train_loss: 0.9526, test_loss: 1.2890, test_f1: 0.4756
##################ITERATION #6 ****************************************
 epoch: 0, train_loss: 1.2949, test_loss: 1.3708, test_f1: 0.2404
 epoch: 1, train_loss: 1.2489, test_loss: 1.3549, test_f1: 0.2404
 epoch: 2, train_loss: 1.2442, test_loss: 1.3421, test_f1: 0.2404
 epoch: 3, train_loss: 1.2260, test_loss: 1.3617, test_f1: 0.2600
 epoch: 4, train_loss: 1.2163, test_loss: 1.3514, test_f1: 0.2652
 epoch: 5, train_loss: 1.2158, test_loss: 1.3415, test_f1: 0.2751
 epoch: 6, train_loss: 1.2011, test_loss: 1.3281, test_f1: 0.2809
 epoch: 7, train_loss: 1.1999, test_loss: 1.3291, test_f1: 0.2621
 epoch: 8, train_loss: 1.1864, test_loss: 1.3197, test_f1: 0.3142
 epoch: 9, train_loss: 1.1891, test_loss: 1.3052, test_f1: 0.3285
 epoch: 10, train_loss: 1.1797, test_loss: 1.3048, test_f1: 0.3342
 epoch: 11, train_loss: 1.1818, test_loss: 1.3048, test_f1: 0.3285
 epoch: 12, train_loss: 1.1758, test_loss: 1.3319, test_f1: 0.3355
 epoch: 13, train_loss: 1.1673, test_loss: 1.2941, test_f1: 0.3773
 epoch: 14, train_loss: 1.1553, test_loss: 1.2834, test_f1: 0.3755
 epoch: 15, train_loss: 1.1402, test_loss: 1.2752, test_f1: 0.3826
 epoch: 16, train_loss: 1.1302, test_loss: 1.2542, test_f1: 0.3885
 epoch: 17, train_loss: 1.1359, test_loss: 1.2625, test_f1: 0.3762
 epoch: 18, train_loss: 1.1270, test_loss: 1.2646, test_f1: 0.3981
 epoch: 19, train_loss: 1.1180, test_loss: 1.2617, test_f1: 0.3717
 epoch: 20, train_loss: 1.1273, test_loss: 1.2503, test_f1: 0.3956
 epoch: 21, train_loss: 1.1293, test_loss: 1.2761, test_f1: 0.4031
 epoch: 22, train_loss: 1.1082, test_loss: 1.3189, test_f1: 0.3879
 epoch: 23, train_loss: 1.1106, test_loss: 1.2782, test_f1: 0.4039
 epoch: 24, train_loss: 1.0994, test_loss: 1.3121, test_f1: 0.3915
 epoch: 25, train_loss: 1.1063, test_loss: 1.2765, test_f1: 0.4038
 epoch: 26, train_loss: 1.0854, test_loss: 1.2983, test_f1: 0.3740
 epoch: 27, train_loss: 1.0946, test_loss: 1.2859, test_f1: 0.4039
 epoch: 28, train_loss: 1.0903, test_loss: 1.2931, test_f1: 0.4160
 epoch: 29, train_loss: 1.0765, test_loss: 1.2865, test_f1: 0.3938
 epoch: 30, train_loss: 1.0729, test_loss: 1.2937, test_f1: 0.3816
 epoch: 31, train_loss: 1.0681, test_loss: 1.2935, test_f1: 0.4274
 epoch: 32, train_loss: 1.0637, test_loss: 1.2788, test_f1: 0.4174
 epoch: 33, train_loss: 1.0742, test_loss: 1.3015, test_f1: 0.4126
 epoch: 34, train_loss: 1.0637, test_loss: 1.3167, test_f1: 0.4096
 epoch: 35, train_loss: 1.0601, test_loss: 1.2770, test_f1: 0.4358
 epoch: 36, train_loss: 1.0559, test_loss: 1.2835, test_f1: 0.4269
 epoch: 37, train_loss: 1.0473, test_loss: 1.3215, test_f1: 0.4089
 epoch: 38, train_loss: 1.0377, test_loss: 1.3124, test_f1: 0.4045
 epoch: 39, train_loss: 1.0406, test_loss: 1.2860, test_f1: 0.4211
 epoch: 40, train_loss: 1.0357, test_loss: 1.2700, test_f1: 0.4200
 epoch: 41, train_loss: 1.0388, test_loss: 1.2866, test_f1: 0.4339
 epoch: 42, train_loss: 1.0161, test_loss: 1.2833, test_f1: 0.3677
 epoch: 43, train_loss: 1.0193, test_loss: 1.2897, test_f1: 0.4468
 epoch: 44, train_loss: 1.0225, test_loss: 1.2758, test_f1: 0.4444
 epoch: 45, train_loss: 1.0162, test_loss: 1.2709, test_f1: 0.3970
 epoch: 46, train_loss: 1.0185, test_loss: 1.2589, test_f1: 0.4230
 epoch: 47, train_loss: 1.0143, test_loss: 1.2771, test_f1: 0.4439
 epoch: 48, train_loss: 1.0070, test_loss: 1.2888, test_f1: 0.4400
 epoch: 49, train_loss: 1.0055, test_loss: 1.2980, test_f1: 0.4764
 epoch: 50, train_loss: 0.9984, test_loss: 1.2681, test_f1: 0.4878
 epoch: 51, train_loss: 0.9733, test_loss: 1.2635, test_f1: 0.4916
 epoch: 52, train_loss: 0.9822, test_loss: 1.3035, test_f1: 0.4831
 epoch: 53, train_loss: 0.9929, test_loss: 1.2958, test_f1: 0.4804
 epoch: 54, train_loss: 0.9959, test_loss: 1.2815, test_f1: 0.4815
 epoch: 55, train_loss: 0.9912, test_loss: 1.2807, test_f1: 0.4731
 epoch: 56, train_loss: 0.9818, test_loss: 1.2862, test_f1: 0.4810
 epoch: 57, train_loss: 0.9938, test_loss: 1.3082, test_f1: 0.4422
 epoch: 58, train_loss: 0.9670, test_loss: 1.3040, test_f1: 0.4622
 epoch: 59, train_loss: 0.9654, test_loss: 1.2843, test_f1: 0.4845
 epoch: 60, train_loss: 0.9703, test_loss: 1.2835, test_f1: 0.4759
 epoch: 61, train_loss: 0.9681, test_loss: 1.2908, test_f1: 0.4880
 epoch: 62, train_loss: 0.9645, test_loss: 1.2842, test_f1: 0.4786
 epoch: 63, train_loss: 0.9569, test_loss: 1.3093, test_f1: 0.4624
 epoch: 64, train_loss: 0.9536, test_loss: 1.2969, test_f1: 0.4778
 epoch: 65, train_loss: 0.9573, test_loss: 1.3275, test_f1: 0.4595
 epoch: 66, train_loss: 0.9424, test_loss: 1.2951, test_f1: 0.4823
 epoch: 67, train_loss: 0.9457, test_loss: 1.3208, test_f1: 0.4909
 epoch: 68, train_loss: 0.9518, test_loss: 1.3083, test_f1: 0.4963
 epoch: 69, train_loss: 0.9473, test_loss: 1.2971, test_f1: 0.4851
 epoch: 70, train_loss: 0.9377, test_loss: 1.2700, test_f1: 0.4992
 epoch: 71, train_loss: 0.9449, test_loss: 1.2878, test_f1: 0.4887
 epoch: 72, train_loss: 0.9466, test_loss: 1.2831, test_f1: 0.5000
 epoch: 73, train_loss: 0.9476, test_loss: 1.2842, test_f1: 0.4803
 epoch: 74, train_loss: 0.9455, test_loss: 1.2904, test_f1: 0.4856
 epoch: 75, train_loss: 0.9461, test_loss: 1.2998, test_f1: 0.4739
 epoch: 76, train_loss: 0.9416, test_loss: 1.2994, test_f1: 0.4539
 epoch: 77, train_loss: 0.9331, test_loss: 1.2879, test_f1: 0.4490
 epoch: 78, train_loss: 0.9328, test_loss: 1.2873, test_f1: 0.4730
 epoch: 79, train_loss: 0.9544, test_loss: 1.3007, test_f1: 0.4630
 epoch: 80, train_loss: 0.9367, test_loss: 1.2800, test_f1: 0.5076
 epoch: 81, train_loss: 0.9294, test_loss: 1.2731, test_f1: 0.5063
 epoch: 82, train_loss: 0.9202, test_loss: 1.2728, test_f1: 0.4918
 epoch: 83, train_loss: 0.9205, test_loss: 1.2718, test_f1: 0.4716
 epoch: 84, train_loss: 0.9181, test_loss: 1.2824, test_f1: 0.4834
 epoch: 85, train_loss: 0.9098, test_loss: 1.2912, test_f1: 0.4974
 epoch: 86, train_loss: 0.9094, test_loss: 1.2870, test_f1: 0.5067
 epoch: 87, train_loss: 0.9283, test_loss: 1.2750, test_f1: 0.4923
 epoch: 88, train_loss: 0.9194, test_loss: 1.2845, test_f1: 0.4937
 epoch: 89, train_loss: 0.9183, test_loss: 1.3204, test_f1: 0.4951
 epoch: 90, train_loss: 0.9251, test_loss: 1.2765, test_f1: 0.4926
 epoch: 91, train_loss: 0.9126, test_loss: 1.2758, test_f1: 0.4952
 epoch: 92, train_loss: 0.9157, test_loss: 1.2885, test_f1: 0.4719
 epoch: 93, train_loss: 0.9165, test_loss: 1.2654, test_f1: 0.5175
 epoch: 94, train_loss: 0.9061, test_loss: 1.2805, test_f1: 0.5029
 epoch: 95, train_loss: 0.8995, test_loss: 1.3061, test_f1: 0.4830
 epoch: 96, train_loss: 0.9046, test_loss: 1.3006, test_f1: 0.4894
 epoch: 97, train_loss: 0.9124, test_loss: 1.3215, test_f1: 0.5022
 epoch: 98, train_loss: 0.9063, test_loss: 1.2843, test_f1: 0.4861
 epoch: 99, train_loss: 0.8897, test_loss: 1.2627, test_f1: 0.4985
##################ITERATION #7 ****************************************
 epoch: 0, train_loss: 1.3018, test_loss: 1.3162, test_f1: 0.2281
 epoch: 1, train_loss: 1.2361, test_loss: 1.3000, test_f1: 0.2281
 epoch: 2, train_loss: 1.2180, test_loss: 1.2683, test_f1: 0.2281
 epoch: 3, train_loss: 1.2086, test_loss: 1.2642, test_f1: 0.2544
 epoch: 4, train_loss: 1.1964, test_loss: 1.2717, test_f1: 0.2875
 epoch: 5, train_loss: 1.1721, test_loss: 1.2259, test_f1: 0.3147
 epoch: 6, train_loss: 1.1682, test_loss: 1.2420, test_f1: 0.3168
 epoch: 7, train_loss: 1.1602, test_loss: 1.2291, test_f1: 0.3074
 epoch: 8, train_loss: 1.1611, test_loss: 1.2224, test_f1: 0.3332
 epoch: 9, train_loss: 1.1400, test_loss: 1.2197, test_f1: 0.3513
 epoch: 10, train_loss: 1.1363, test_loss: 1.2208, test_f1: 0.3572
 epoch: 11, train_loss: 1.1247, test_loss: 1.2204, test_f1: 0.3666
 epoch: 12, train_loss: 1.1105, test_loss: 1.2218, test_f1: 0.3576
 epoch: 13, train_loss: 1.1005, test_loss: 1.2399, test_f1: 0.3563
 epoch: 14, train_loss: 1.0987, test_loss: 1.2141, test_f1: 0.3582
 epoch: 15, train_loss: 1.1130, test_loss: 1.2135, test_f1: 0.3809
 epoch: 16, train_loss: 1.0886, test_loss: 1.2122, test_f1: 0.4140
 epoch: 17, train_loss: 1.0802, test_loss: 1.2092, test_f1: 0.4151
 epoch: 18, train_loss: 1.0812, test_loss: 1.2014, test_f1: 0.3856
 epoch: 19, train_loss: 1.0780, test_loss: 1.2068, test_f1: 0.4174
 epoch: 20, train_loss: 1.0849, test_loss: 1.2201, test_f1: 0.4101
 epoch: 21, train_loss: 1.0674, test_loss: 1.1968, test_f1: 0.4276
 epoch: 22, train_loss: 1.0708, test_loss: 1.2112, test_f1: 0.4463
 epoch: 23, train_loss: 1.0590, test_loss: 1.2113, test_f1: 0.4484
 epoch: 24, train_loss: 1.0405, test_loss: 1.2382, test_f1: 0.4480
 epoch: 25, train_loss: 1.0275, test_loss: 1.2534, test_f1: 0.4383
 epoch: 26, train_loss: 1.0380, test_loss: 1.2200, test_f1: 0.4680
 epoch: 27, train_loss: 1.0445, test_loss: 1.2160, test_f1: 0.4628
 epoch: 28, train_loss: 1.0308, test_loss: 1.2078, test_f1: 0.4880
 epoch: 29, train_loss: 1.0172, test_loss: 1.2528, test_f1: 0.4463
 epoch: 30, train_loss: 1.0026, test_loss: 1.2024, test_f1: 0.5079
 epoch: 31, train_loss: 1.0097, test_loss: 1.2358, test_f1: 0.4639
 epoch: 32, train_loss: 0.9868, test_loss: 1.2143, test_f1: 0.4852
 epoch: 33, train_loss: 0.9978, test_loss: 1.1973, test_f1: 0.5117
 epoch: 34, train_loss: 0.9806, test_loss: 1.2323, test_f1: 0.4794
 epoch: 35, train_loss: 0.9897, test_loss: 1.2254, test_f1: 0.4935
 epoch: 36, train_loss: 0.9753, test_loss: 1.2447, test_f1: 0.5033
 epoch: 37, train_loss: 0.9939, test_loss: 1.2255, test_f1: 0.4718
 epoch: 38, train_loss: 0.9791, test_loss: 1.1696, test_f1: 0.5094
 epoch: 39, train_loss: 0.9614, test_loss: 1.2682, test_f1: 0.4385
 epoch: 40, train_loss: 0.9663, test_loss: 1.1996, test_f1: 0.4769
 epoch: 41, train_loss: 0.9510, test_loss: 1.2228, test_f1: 0.4616
 epoch: 42, train_loss: 0.9660, test_loss: 1.2055, test_f1: 0.4705
 epoch: 43, train_loss: 0.9437, test_loss: 1.2523, test_f1: 0.4817
 epoch: 44, train_loss: 0.9601, test_loss: 1.2463, test_f1: 0.4419
 epoch: 45, train_loss: 0.9427, test_loss: 1.2581, test_f1: 0.4461
 epoch: 46, train_loss: 0.9446, test_loss: 1.2448, test_f1: 0.4424
 epoch: 47, train_loss: 0.9382, test_loss: 1.2422, test_f1: 0.4765
 epoch: 48, train_loss: 0.9409, test_loss: 1.2384, test_f1: 0.5013
 epoch: 49, train_loss: 0.9451, test_loss: 1.2337, test_f1: 0.4796
 epoch: 50, train_loss: 0.9272, test_loss: 1.2136, test_f1: 0.4814
 epoch: 51, train_loss: 0.9148, test_loss: 1.2009, test_f1: 0.4667
 epoch: 52, train_loss: 0.9203, test_loss: 1.2151, test_f1: 0.4696
 epoch: 53, train_loss: 0.9293, test_loss: 1.1982, test_f1: 0.4857
 epoch: 54, train_loss: 0.9144, test_loss: 1.1898, test_f1: 0.4776
 epoch: 55, train_loss: 0.9158, test_loss: 1.2545, test_f1: 0.4678
 epoch: 56, train_loss: 0.9118, test_loss: 1.2540, test_f1: 0.4748
 epoch: 57, train_loss: 0.9002, test_loss: 1.2222, test_f1: 0.4836
 epoch: 58, train_loss: 0.9152, test_loss: 1.2360, test_f1: 0.4846
 epoch: 59, train_loss: 0.9263, test_loss: 1.2562, test_f1: 0.5025
 epoch: 60, train_loss: 0.9073, test_loss: 1.2099, test_f1: 0.5009
 epoch: 61, train_loss: 0.9043, test_loss: 1.2321, test_f1: 0.4887
 epoch: 62, train_loss: 0.9230, test_loss: 1.2276, test_f1: 0.5161
 epoch: 63, train_loss: 0.8915, test_loss: 1.2062, test_f1: 0.5285
 epoch: 64, train_loss: 0.8912, test_loss: 1.2433, test_f1: 0.4635
 epoch: 65, train_loss: 0.9006, test_loss: 1.2189, test_f1: 0.5283
 epoch: 66, train_loss: 0.8847, test_loss: 1.2088, test_f1: 0.5371
 epoch: 67, train_loss: 0.8756, test_loss: 1.2334, test_f1: 0.5191
 epoch: 68, train_loss: 0.9020, test_loss: 1.2829, test_f1: 0.5022
 epoch: 69, train_loss: 0.8836, test_loss: 1.2112, test_f1: 0.5130
 epoch: 70, train_loss: 0.9058, test_loss: 1.2682, test_f1: 0.4746
 epoch: 71, train_loss: 0.9019, test_loss: 1.2305, test_f1: 0.5346
 epoch: 72, train_loss: 0.8847, test_loss: 1.2810, test_f1: 0.5307
 epoch: 73, train_loss: 0.8890, test_loss: 1.2280, test_f1: 0.5152
 epoch: 74, train_loss: 0.8725, test_loss: 1.2607, test_f1: 0.5219
 epoch: 75, train_loss: 0.8696, test_loss: 1.2185, test_f1: 0.5241
 epoch: 76, train_loss: 0.8813, test_loss: 1.2195, test_f1: 0.5234
 epoch: 77, train_loss: 0.8869, test_loss: 1.2369, test_f1: 0.5367
 epoch: 78, train_loss: 0.8832, test_loss: 1.2652, test_f1: 0.5186
 epoch: 79, train_loss: 0.8853, test_loss: 1.2105, test_f1: 0.5388
 epoch: 80, train_loss: 0.8650, test_loss: 1.2187, test_f1: 0.4901
 epoch: 81, train_loss: 0.8686, test_loss: 1.2168, test_f1: 0.4952
 epoch: 82, train_loss: 0.8631, test_loss: 1.2408, test_f1: 0.4787
 epoch: 83, train_loss: 0.8838, test_loss: 1.2369, test_f1: 0.5040
 epoch: 84, train_loss: 0.8684, test_loss: 1.2472, test_f1: 0.5089
 epoch: 85, train_loss: 0.8589, test_loss: 1.2707, test_f1: 0.5006
 epoch: 86, train_loss: 0.8616, test_loss: 1.2188, test_f1: 0.5081
 epoch: 87, train_loss: 0.8649, test_loss: 1.2294, test_f1: 0.4969
 epoch: 88, train_loss: 0.8696, test_loss: 1.2925, test_f1: 0.5275
 epoch: 89, train_loss: 0.8539, test_loss: 1.2547, test_f1: 0.5175
 epoch: 90, train_loss: 0.8828, test_loss: 1.2908, test_f1: 0.5266
 epoch: 91, train_loss: 0.8412, test_loss: 1.2639, test_f1: 0.5261
 epoch: 92, train_loss: 0.8683, test_loss: 1.2361, test_f1: 0.4933
 epoch: 93, train_loss: 0.8482, test_loss: 1.2828, test_f1: 0.4922
 epoch: 94, train_loss: 0.8698, test_loss: 1.2745, test_f1: 0.4863
 epoch: 95, train_loss: 0.8544, test_loss: 1.2421, test_f1: 0.5183
 epoch: 96, train_loss: 0.8471, test_loss: 1.2442, test_f1: 0.5162
 epoch: 97, train_loss: 0.8378, test_loss: 1.2638, test_f1: 0.5084
 epoch: 98, train_loss: 0.8462, test_loss: 1.2637, test_f1: 0.4941
 epoch: 99, train_loss: 0.8324, test_loss: 1.3102, test_f1: 0.5042
##################ITERATION #8 ****************************************
 epoch: 0, train_loss: 1.3017, test_loss: 1.3910, test_f1: 0.2354
 epoch: 1, train_loss: 1.2512, test_loss: 1.3709, test_f1: 0.2354
 epoch: 2, train_loss: 1.2235, test_loss: 1.3479, test_f1: 0.2354
 epoch: 3, train_loss: 1.2189, test_loss: 1.3363, test_f1: 0.2366
 epoch: 4, train_loss: 1.2014, test_loss: 1.3524, test_f1: 0.2584
 epoch: 5, train_loss: 1.1924, test_loss: 1.3318, test_f1: 0.2801
 epoch: 6, train_loss: 1.1895, test_loss: 1.2987, test_f1: 0.2858
 epoch: 7, train_loss: 1.1712, test_loss: 1.2594, test_f1: 0.3091
 epoch: 8, train_loss: 1.1417, test_loss: 1.2642, test_f1: 0.3393
 epoch: 9, train_loss: 1.1411, test_loss: 1.2673, test_f1: 0.3338
 epoch: 10, train_loss: 1.1264, test_loss: 1.2669, test_f1: 0.3921
 epoch: 11, train_loss: 1.1150, test_loss: 1.2540, test_f1: 0.4292
 epoch: 12, train_loss: 1.1196, test_loss: 1.2557, test_f1: 0.4168
 epoch: 13, train_loss: 1.1113, test_loss: 1.2381, test_f1: 0.4764
 epoch: 14, train_loss: 1.0944, test_loss: 1.2591, test_f1: 0.4272
 epoch: 15, train_loss: 1.0881, test_loss: 1.2529, test_f1: 0.4760
 epoch: 16, train_loss: 1.0804, test_loss: 1.1876, test_f1: 0.5022
 epoch: 17, train_loss: 1.0584, test_loss: 1.1971, test_f1: 0.4611
 epoch: 18, train_loss: 1.0629, test_loss: 1.1643, test_f1: 0.4612
 epoch: 19, train_loss: 1.0426, test_loss: 1.1765, test_f1: 0.4738
 epoch: 20, train_loss: 1.0453, test_loss: 1.1643, test_f1: 0.4818
 epoch: 21, train_loss: 1.0439, test_loss: 1.1751, test_f1: 0.4748
 epoch: 22, train_loss: 1.0237, test_loss: 1.2173, test_f1: 0.4509
 epoch: 23, train_loss: 1.0216, test_loss: 1.1762, test_f1: 0.4867
 epoch: 24, train_loss: 1.0123, test_loss: 1.1462, test_f1: 0.5054
 epoch: 25, train_loss: 0.9983, test_loss: 1.1611, test_f1: 0.5044
 epoch: 26, train_loss: 0.9970, test_loss: 1.1584, test_f1: 0.4925
 epoch: 27, train_loss: 0.9929, test_loss: 1.1325, test_f1: 0.5167
 epoch: 28, train_loss: 0.9939, test_loss: 1.1486, test_f1: 0.4993
 epoch: 29, train_loss: 0.9726, test_loss: 1.1272, test_f1: 0.4859
 epoch: 30, train_loss: 0.9789, test_loss: 1.1619, test_f1: 0.4762
 epoch: 31, train_loss: 0.9816, test_loss: 1.1843, test_f1: 0.4947
 epoch: 32, train_loss: 0.9700, test_loss: 1.1663, test_f1: 0.4474
 epoch: 33, train_loss: 0.9780, test_loss: 1.1221, test_f1: 0.4979
 epoch: 34, train_loss: 0.9530, test_loss: 1.2118, test_f1: 0.4530
 epoch: 35, train_loss: 0.9548, test_loss: 1.1713, test_f1: 0.4986
 epoch: 36, train_loss: 0.9530, test_loss: 1.1509, test_f1: 0.4802
 epoch: 37, train_loss: 0.9467, test_loss: 1.0857, test_f1: 0.4947
 epoch: 38, train_loss: 0.9519, test_loss: 1.0899, test_f1: 0.5062
 epoch: 39, train_loss: 0.9488, test_loss: 1.1190, test_f1: 0.4725
 epoch: 40, train_loss: 0.9267, test_loss: 1.1600, test_f1: 0.4767
 epoch: 41, train_loss: 0.9165, test_loss: 1.0742, test_f1: 0.4755
 epoch: 42, train_loss: 0.9174, test_loss: 1.1530, test_f1: 0.5035
 epoch: 43, train_loss: 0.9312, test_loss: 1.0729, test_f1: 0.5491
 epoch: 44, train_loss: 0.9131, test_loss: 1.1040, test_f1: 0.5002
 epoch: 45, train_loss: 0.9311, test_loss: 1.0924, test_f1: 0.5087
 epoch: 46, train_loss: 0.9129, test_loss: 1.0947, test_f1: 0.5036
 epoch: 47, train_loss: 0.9049, test_loss: 1.1266, test_f1: 0.4774
 epoch: 48, train_loss: 0.9012, test_loss: 1.1026, test_f1: 0.4823
 epoch: 49, train_loss: 0.8909, test_loss: 1.0839, test_f1: 0.5161
 epoch: 50, train_loss: 0.8968, test_loss: 1.1599, test_f1: 0.4824
 epoch: 51, train_loss: 0.8909, test_loss: 1.1051, test_f1: 0.5023
 epoch: 52, train_loss: 0.8812, test_loss: 1.0895, test_f1: 0.5129
 epoch: 53, train_loss: 0.8772, test_loss: 1.1245, test_f1: 0.5040
 epoch: 54, train_loss: 0.8784, test_loss: 1.1099, test_f1: 0.5059
 epoch: 55, train_loss: 0.8814, test_loss: 1.1056, test_f1: 0.5074
 epoch: 56, train_loss: 0.8707, test_loss: 1.1120, test_f1: 0.4967
 epoch: 57, train_loss: 0.8637, test_loss: 1.1061, test_f1: 0.4964
 epoch: 58, train_loss: 0.8666, test_loss: 1.1184, test_f1: 0.4973
 epoch: 59, train_loss: 0.8614, test_loss: 1.1035, test_f1: 0.5031
 epoch: 60, train_loss: 0.8745, test_loss: 1.0876, test_f1: 0.5292
 epoch: 61, train_loss: 0.8635, test_loss: 1.0912, test_f1: 0.5131
 epoch: 62, train_loss: 0.8707, test_loss: 1.1047, test_f1: 0.5253
 epoch: 63, train_loss: 0.8748, test_loss: 1.0931, test_f1: 0.5339
 epoch: 64, train_loss: 0.8677, test_loss: 1.1121, test_f1: 0.5301
 epoch: 65, train_loss: 0.8523, test_loss: 1.1228, test_f1: 0.5147
 epoch: 66, train_loss: 0.8548, test_loss: 1.1108, test_f1: 0.5024
 epoch: 67, train_loss: 0.8680, test_loss: 1.0997, test_f1: 0.5189
 epoch: 68, train_loss: 0.8629, test_loss: 1.1217, test_f1: 0.5272
 epoch: 69, train_loss: 0.8641, test_loss: 1.1379, test_f1: 0.5099
 epoch: 70, train_loss: 0.8588, test_loss: 1.1363, test_f1: 0.5065
 epoch: 71, train_loss: 0.8600, test_loss: 1.1616, test_f1: 0.5014
 epoch: 72, train_loss: 0.8498, test_loss: 1.1250, test_f1: 0.5153
 epoch: 73, train_loss: 0.8635, test_loss: 1.1037, test_f1: 0.5127
 epoch: 74, train_loss: 0.8390, test_loss: 1.1001, test_f1: 0.5318
 epoch: 75, train_loss: 0.8434, test_loss: 1.1236, test_f1: 0.5332
 epoch: 76, train_loss: 0.8632, test_loss: 1.1185, test_f1: 0.5325
 epoch: 77, train_loss: 0.8390, test_loss: 1.1229, test_f1: 0.5346
 epoch: 78, train_loss: 0.8249, test_loss: 1.1299, test_f1: 0.5101
 epoch: 79, train_loss: 0.8401, test_loss: 1.1144, test_f1: 0.5174
 epoch: 80, train_loss: 0.8413, test_loss: 1.0845, test_f1: 0.5265
 epoch: 81, train_loss: 0.8472, test_loss: 1.1331, test_f1: 0.5271
 epoch: 82, train_loss: 0.8328, test_loss: 1.1174, test_f1: 0.5266
 epoch: 83, train_loss: 0.8287, test_loss: 1.1304, test_f1: 0.5198
 epoch: 84, train_loss: 0.8430, test_loss: 1.1061, test_f1: 0.5293
 epoch: 85, train_loss: 0.8489, test_loss: 1.0986, test_f1: 0.5696
 epoch: 86, train_loss: 0.8279, test_loss: 1.1247, test_f1: 0.5009
 epoch: 87, train_loss: 0.8339, test_loss: 1.1261, test_f1: 0.5312
 epoch: 88, train_loss: 0.8255, test_loss: 1.1382, test_f1: 0.5101
 epoch: 89, train_loss: 0.8297, test_loss: 1.1424, test_f1: 0.5356
 epoch: 90, train_loss: 0.8181, test_loss: 1.1284, test_f1: 0.5132
 epoch: 91, train_loss: 0.8117, test_loss: 1.1054, test_f1: 0.5529
 epoch: 92, train_loss: 0.8219, test_loss: 1.1203, test_f1: 0.5478
 epoch: 93, train_loss: 0.8267, test_loss: 1.1329, test_f1: 0.5488
 epoch: 94, train_loss: 0.8177, test_loss: 1.0918, test_f1: 0.5639
 epoch: 95, train_loss: 0.8317, test_loss: 1.1275, test_f1: 0.5191
 epoch: 96, train_loss: 0.8192, test_loss: 1.1231, test_f1: 0.4988
 epoch: 97, train_loss: 0.8206, test_loss: 1.1214, test_f1: 0.5230
 epoch: 98, train_loss: 0.8020, test_loss: 1.1431, test_f1: 0.5364
 epoch: 99, train_loss: 0.8109, test_loss: 1.1437, test_f1: 0.5227
##################ITERATION #9 ****************************************
 epoch: 0, train_loss: 2.1510, test_loss: 1.7150, test_f1: 0.0523
 epoch: 1, train_loss: 1.4728, test_loss: 1.4476, test_f1: 0.2132
 epoch: 2, train_loss: 1.3773, test_loss: 1.3952, test_f1: 0.2470
 epoch: 3, train_loss: 1.3123, test_loss: 1.3986, test_f1: 0.2348
 epoch: 4, train_loss: 1.2740, test_loss: 1.3833, test_f1: 0.2954
 epoch: 5, train_loss: 1.2491, test_loss: 1.3629, test_f1: 0.2898
 epoch: 6, train_loss: 1.2381, test_loss: 1.3582, test_f1: 0.3023
 epoch: 7, train_loss: 1.2347, test_loss: 1.3244, test_f1: 0.2824
 epoch: 8, train_loss: 1.2196, test_loss: 1.3021, test_f1: 0.2859
 epoch: 9, train_loss: 1.1950, test_loss: 1.2795, test_f1: 0.2849
 epoch: 10, train_loss: 1.1754, test_loss: 1.2878, test_f1: 0.3002
 epoch: 11, train_loss: 1.1851, test_loss: 1.3653, test_f1: 0.2970
 epoch: 12, train_loss: 1.1614, test_loss: 1.3121, test_f1: 0.3026
 epoch: 13, train_loss: 1.1582, test_loss: 1.2845, test_f1: 0.3050
 epoch: 14, train_loss: 1.1372, test_loss: 1.2768, test_f1: 0.2959
 epoch: 15, train_loss: 1.1324, test_loss: 1.2390, test_f1: 0.3079
 epoch: 16, train_loss: 1.1058, test_loss: 1.2474, test_f1: 0.3277
 epoch: 17, train_loss: 1.1107, test_loss: 1.2354, test_f1: 0.3376
 epoch: 18, train_loss: 1.0924, test_loss: 1.2480, test_f1: 0.3502
 epoch: 19, train_loss: 1.1106, test_loss: 1.2421, test_f1: 0.3561
 epoch: 20, train_loss: 1.1016, test_loss: 1.2422, test_f1: 0.3649
 epoch: 21, train_loss: 1.0764, test_loss: 1.2105, test_f1: 0.3584
 epoch: 22, train_loss: 1.0708, test_loss: 1.2182, test_f1: 0.3850
 epoch: 23, train_loss: 1.0796, test_loss: 1.2443, test_f1: 0.3818
 epoch: 24, train_loss: 1.0647, test_loss: 1.2207, test_f1: 0.3919
 epoch: 25, train_loss: 1.0593, test_loss: 1.2371, test_f1: 0.4230
 epoch: 26, train_loss: 1.0641, test_loss: 1.2100, test_f1: 0.4456
 epoch: 27, train_loss: 1.0436, test_loss: 1.1957, test_f1: 0.4472
 epoch: 28, train_loss: 1.0435, test_loss: 1.2016, test_f1: 0.4460
 epoch: 29, train_loss: 1.0392, test_loss: 1.1997, test_f1: 0.4366
 epoch: 30, train_loss: 1.0372, test_loss: 1.2322, test_f1: 0.4827
 epoch: 31, train_loss: 1.0251, test_loss: 1.2535, test_f1: 0.4481
 epoch: 32, train_loss: 1.0375, test_loss: 1.2153, test_f1: 0.4672
 epoch: 33, train_loss: 1.0257, test_loss: 1.2056, test_f1: 0.4821
 epoch: 34, train_loss: 1.0071, test_loss: 1.1884, test_f1: 0.4732
 epoch: 35, train_loss: 1.0155, test_loss: 1.1796, test_f1: 0.4491
 epoch: 36, train_loss: 1.0105, test_loss: 1.1644, test_f1: 0.4499
 epoch: 37, train_loss: 1.0075, test_loss: 1.2290, test_f1: 0.4532
 epoch: 38, train_loss: 1.0018, test_loss: 1.2006, test_f1: 0.4812
 epoch: 39, train_loss: 0.9844, test_loss: 1.1621, test_f1: 0.4572
 epoch: 40, train_loss: 1.0042, test_loss: 1.1841, test_f1: 0.4520
 epoch: 41, train_loss: 0.9744, test_loss: 1.1858, test_f1: 0.4590
 epoch: 42, train_loss: 0.9823, test_loss: 1.2176, test_f1: 0.4440
 epoch: 43, train_loss: 0.9717, test_loss: 1.2071, test_f1: 0.4672
 epoch: 44, train_loss: 0.9726, test_loss: 1.2121, test_f1: 0.4640
 epoch: 45, train_loss: 0.9721, test_loss: 1.1614, test_f1: 0.4532
 epoch: 46, train_loss: 0.9700, test_loss: 1.1592, test_f1: 0.4986
 epoch: 47, train_loss: 0.9522, test_loss: 1.1674, test_f1: 0.4489
 epoch: 48, train_loss: 0.9495, test_loss: 1.2173, test_f1: 0.4643
 epoch: 49, train_loss: 0.9584, test_loss: 1.1866, test_f1: 0.4741
 epoch: 50, train_loss: 0.9268, test_loss: 1.2021, test_f1: 0.4578
 epoch: 51, train_loss: 0.9506, test_loss: 1.2298, test_f1: 0.4759
 epoch: 52, train_loss: 0.9457, test_loss: 1.2566, test_f1: 0.4883
 epoch: 53, train_loss: 0.9353, test_loss: 1.2078, test_f1: 0.5008
 epoch: 54, train_loss: 0.9519, test_loss: 1.2400, test_f1: 0.4766
 epoch: 55, train_loss: 0.9285, test_loss: 1.2768, test_f1: 0.4680
 epoch: 56, train_loss: 0.9357, test_loss: 1.2821, test_f1: 0.4416
 epoch: 57, train_loss: 0.9352, test_loss: 1.2220, test_f1: 0.4981
 epoch: 58, train_loss: 0.9278, test_loss: 1.2334, test_f1: 0.5033
 epoch: 59, train_loss: 0.9311, test_loss: 1.2142, test_f1: 0.5163
 epoch: 60, train_loss: 0.9209, test_loss: 1.2257, test_f1: 0.4673
 epoch: 61, train_loss: 0.9237, test_loss: 1.2635, test_f1: 0.4858
 epoch: 62, train_loss: 0.9289, test_loss: 1.2431, test_f1: 0.5042
 epoch: 63, train_loss: 0.9273, test_loss: 1.2740, test_f1: 0.4994
 epoch: 64, train_loss: 0.9061, test_loss: 1.2598, test_f1: 0.5133
 epoch: 65, train_loss: 0.9086, test_loss: 1.2464, test_f1: 0.5072
 epoch: 66, train_loss: 0.9397, test_loss: 1.2202, test_f1: 0.5146
 epoch: 67, train_loss: 0.9216, test_loss: 1.2462, test_f1: 0.5291
 epoch: 68, train_loss: 0.9210, test_loss: 1.3034, test_f1: 0.4680
 epoch: 69, train_loss: 0.9218, test_loss: 1.2184, test_f1: 0.5031
 epoch: 70, train_loss: 0.9185, test_loss: 1.2101, test_f1: 0.5130
 epoch: 71, train_loss: 0.9155, test_loss: 1.2297, test_f1: 0.5163
 epoch: 72, train_loss: 0.9013, test_loss: 1.2605, test_f1: 0.5078
 epoch: 73, train_loss: 0.9081, test_loss: 1.1822, test_f1: 0.4950
 epoch: 74, train_loss: 0.9078, test_loss: 1.1997, test_f1: 0.4715
 epoch: 75, train_loss: 0.9066, test_loss: 1.1896, test_f1: 0.4869
 epoch: 76, train_loss: 0.8888, test_loss: 1.2705, test_f1: 0.5024
 epoch: 77, train_loss: 0.8876, test_loss: 1.2694, test_f1: 0.4882
 epoch: 78, train_loss: 0.8860, test_loss: 1.2188, test_f1: 0.5151
 epoch: 79, train_loss: 0.9053, test_loss: 1.2530, test_f1: 0.4738
 epoch: 80, train_loss: 0.8977, test_loss: 1.2488, test_f1: 0.4638
 epoch: 81, train_loss: 0.8835, test_loss: 1.2093, test_f1: 0.5290
 epoch: 82, train_loss: 0.8954, test_loss: 1.2576, test_f1: 0.4747
 epoch: 83, train_loss: 0.8974, test_loss: 1.2350, test_f1: 0.5122
 epoch: 84, train_loss: 0.8841, test_loss: 1.2788, test_f1: 0.5128
 epoch: 85, train_loss: 0.8865, test_loss: 1.2416, test_f1: 0.5036
 epoch: 86, train_loss: 0.8892, test_loss: 1.2061, test_f1: 0.5380
 epoch: 87, train_loss: 0.8905, test_loss: 1.1998, test_f1: 0.5469
 epoch: 88, train_loss: 0.8811, test_loss: 1.2655, test_f1: 0.5164
 epoch: 89, train_loss: 0.8639, test_loss: 1.2968, test_f1: 0.4797
 epoch: 90, train_loss: 0.8900, test_loss: 1.2205, test_f1: 0.5119
 epoch: 91, train_loss: 0.8784, test_loss: 1.2488, test_f1: 0.4940
 epoch: 92, train_loss: 0.8799, test_loss: 1.3326, test_f1: 0.5111
 epoch: 93, train_loss: 0.8725, test_loss: 1.2309, test_f1: 0.4837
 epoch: 94, train_loss: 0.8708, test_loss: 1.1748, test_f1: 0.5285
 epoch: 95, train_loss: 0.8632, test_loss: 1.2128, test_f1: 0.5107
 epoch: 96, train_loss: 0.8566, test_loss: 1.1945, test_f1: 0.5265
 epoch: 97, train_loss: 0.8704, test_loss: 1.2314, test_f1: 0.5140
 epoch: 98, train_loss: 0.8634, test_loss: 1.2739, test_f1: 0.5119
 epoch: 99, train_loss: 0.8665, test_loss: 1.2191, test_f1: 0.5221

Training completed in 446.08 seconds
Best F1: 0.5700 at epoch 99
Mean F1 across iterations: 0.5375  0.0210
========================FINAL RESULTS================================
FEGIN weighted F1: 0.5700  0.0210
python main.py --data ltspice_demos --representation component_component --model FEGIN --layers 4 --hiddens 16 --batch_size 128 --lr 0.001 --emb_size 250 --epochs 100 --save_appendix component_component_L4_H16_BS128_LR0.001_E250 --no_val
-----



STDERR:
  File "main.py", line 370, in <module>
    main()
  File "main.py", line 254, in main
    dataset = dataset_class(
  File "/home/philip/projects/ltspice_examples_code_repo/Circuit-Completion-Using-GNNs/component_classification_with_link_prediction_head/evaluation/FEGIN/kernel/circuit_datasets.py", line 15, in __init__
    self.data, self.slices = torch.load(self.processed_paths[0])
  File "/home/philip/.local/lib/python3.8/site-packages/torch/serialization.py", line 1040, in load
    warnings.warn(
  File "/usr/lib/python3.8/warnings.py", line 109, in _showwarnmsg
    sw(msg.message, msg.category, msg.filename, msg.lineno,
  File "main.py", line 47, in warn_with_traceback
    traceback.print_stack(file=log)
/home/philip/projects/ltspice_examples_code_repo/Circuit-Completion-Using-GNNs/component_classification_with_link_prediction_head/evaluation/FEGIN/kernel/circuit_datasets.py:15: FutureWarning: You are using `torch.load` with `weights_only=False` (the current default value), which uses the default pickle module implicitly. It is possible to construct malicious pickle data which will execute arbitrary code during unpickling (See https://github.com/pytorch/pytorch/blob/main/SECURITY.md#untrusted-models for more details). In a future release, the default value for `weights_only` will be flipped to `True`. This limits the functions that could be executed during unpickling. Arbitrary objects will no longer be allowed to be loaded via this mode unless they are explicitly allowlisted by the user via `torch.serialization.add_safe_globals`. We recommend you start setting `weights_only=True` for any use case where you don't have full control of the loaded file. Please open an issue on GitHub for any issues related to this experimental feature.
  self.data, self.slices = torch.load(self.processed_paths[0])
