STDOUT:
Results will be saved in /home/philip/projects/ltspice_examples_code_repo/Circuit-Completion-Using-GNNs/component_classification_with_link_prediction_head/evaluation/FEGIN/results/model_FEGIN_dataset_ltspice_examples
Command line input: python main.py --data ltspice_examples --representation component_net --model FEGIN --layers 4 --hiddens 32 --batch_size 256 --lr 0.0001 --emb_size 512 --epochs 100 --save_appendix component_net_L4_H32_BS256_LR0.0001_E512 --no_val
 is saved.
-----
ltspice_examples - FEGIN
Using 4 layers, 32 hidden units, h = 2
Loading component_net representation dataset
ENTERED
Training FEGIN on component_net representation
Train: 3558, Test: 846
##################ITERATION #0 ****************************************
 epoch: 0, train_loss: 1.3614, test_loss: 1.3607, test_f1: 0.2270
 epoch: 1, train_loss: 1.3572, test_loss: 1.3602, test_f1: 0.2270
 epoch: 2, train_loss: 1.3550, test_loss: 1.3598, test_f1: 0.2270
 epoch: 3, train_loss: 1.3517, test_loss: 1.3572, test_f1: 0.2270
 epoch: 4, train_loss: 1.3491, test_loss: 1.3531, test_f1: 0.2270
 epoch: 5, train_loss: 1.3461, test_loss: 1.3482, test_f1: 0.2270
 epoch: 6, train_loss: 1.3440, test_loss: 1.3440, test_f1: 0.2270
 epoch: 7, train_loss: 1.3394, test_loss: 1.3401, test_f1: 0.2270
 epoch: 8, train_loss: 1.3359, test_loss: 1.3361, test_f1: 0.2270
 epoch: 9, train_loss: 1.3330, test_loss: 1.3315, test_f1: 0.2270
 epoch: 10, train_loss: 1.3287, test_loss: 1.3278, test_f1: 0.2270
 epoch: 11, train_loss: 1.3254, test_loss: 1.3247, test_f1: 0.2270
 epoch: 12, train_loss: 1.3213, test_loss: 1.3199, test_f1: 0.2270
 epoch: 13, train_loss: 1.3177, test_loss: 1.3154, test_f1: 0.2270
 epoch: 14, train_loss: 1.3138, test_loss: 1.3113, test_f1: 0.2320
 epoch: 15, train_loss: 1.3091, test_loss: 1.3078, test_f1: 0.2320
 epoch: 16, train_loss: 1.3059, test_loss: 1.3044, test_f1: 0.2392
 epoch: 17, train_loss: 1.3004, test_loss: 1.3008, test_f1: 0.2439
 epoch: 18, train_loss: 1.2973, test_loss: 1.2957, test_f1: 0.2461
 epoch: 19, train_loss: 1.2939, test_loss: 1.2916, test_f1: 0.2527
 epoch: 20, train_loss: 1.2894, test_loss: 1.2881, test_f1: 0.2611
 epoch: 21, train_loss: 1.2831, test_loss: 1.2836, test_f1: 0.2651
 epoch: 22, train_loss: 1.2815, test_loss: 1.2803, test_f1: 0.2651
 epoch: 23, train_loss: 1.2763, test_loss: 1.2755, test_f1: 0.2737
 epoch: 24, train_loss: 1.2712, test_loss: 1.2709, test_f1: 0.2843
 epoch: 25, train_loss: 1.2670, test_loss: 1.2671, test_f1: 0.2867
 epoch: 26, train_loss: 1.2607, test_loss: 1.2624, test_f1: 0.2867
 epoch: 27, train_loss: 1.2588, test_loss: 1.2572, test_f1: 0.2977
 epoch: 28, train_loss: 1.2543, test_loss: 1.2526, test_f1: 0.3134
 epoch: 29, train_loss: 1.2467, test_loss: 1.2476, test_f1: 0.3137
 epoch: 30, train_loss: 1.2432, test_loss: 1.2422, test_f1: 0.3227
 epoch: 31, train_loss: 1.2375, test_loss: 1.2356, test_f1: 0.3295
 epoch: 32, train_loss: 1.2319, test_loss: 1.2303, test_f1: 0.3402
 epoch: 33, train_loss: 1.2282, test_loss: 1.2244, test_f1: 0.3462
 epoch: 34, train_loss: 1.2226, test_loss: 1.2176, test_f1: 0.3557
 epoch: 35, train_loss: 1.2174, test_loss: 1.2110, test_f1: 0.3634
 epoch: 36, train_loss: 1.2149, test_loss: 1.2038, test_f1: 0.3684
 epoch: 37, train_loss: 1.2051, test_loss: 1.1962, test_f1: 0.3706
 epoch: 38, train_loss: 1.1990, test_loss: 1.1899, test_f1: 0.3779
 epoch: 39, train_loss: 1.1939, test_loss: 1.1823, test_f1: 0.3831
 epoch: 40, train_loss: 1.1877, test_loss: 1.1743, test_f1: 0.3911
 epoch: 41, train_loss: 1.1787, test_loss: 1.1664, test_f1: 0.3939
 epoch: 42, train_loss: 1.1724, test_loss: 1.1583, test_f1: 0.3949
 epoch: 43, train_loss: 1.1617, test_loss: 1.1507, test_f1: 0.3980
 epoch: 44, train_loss: 1.1554, test_loss: 1.1441, test_f1: 0.4041
 epoch: 45, train_loss: 1.1480, test_loss: 1.1350, test_f1: 0.4071
 epoch: 46, train_loss: 1.1465, test_loss: 1.1284, test_f1: 0.4100
 epoch: 47, train_loss: 1.1345, test_loss: 1.1185, test_f1: 0.4189
 epoch: 48, train_loss: 1.1266, test_loss: 1.1120, test_f1: 0.4275
 epoch: 49, train_loss: 1.1232, test_loss: 1.1040, test_f1: 0.4272
 epoch: 50, train_loss: 1.1162, test_loss: 1.0952, test_f1: 0.4317
 epoch: 51, train_loss: 1.1149, test_loss: 1.0920, test_f1: 0.4414
 epoch: 52, train_loss: 1.1090, test_loss: 1.0888, test_f1: 0.4349
 epoch: 53, train_loss: 1.1035, test_loss: 1.0839, test_f1: 0.4400
 epoch: 54, train_loss: 1.0990, test_loss: 1.0802, test_f1: 0.4497
 epoch: 55, train_loss: 1.1009, test_loss: 1.0766, test_f1: 0.4635
 epoch: 56, train_loss: 1.0949, test_loss: 1.0735, test_f1: 0.4636
 epoch: 57, train_loss: 1.0899, test_loss: 1.0697, test_f1: 0.4753
 epoch: 58, train_loss: 1.0841, test_loss: 1.0665, test_f1: 0.4748
 epoch: 59, train_loss: 1.0829, test_loss: 1.0617, test_f1: 0.4757
 epoch: 60, train_loss: 1.0779, test_loss: 1.0591, test_f1: 0.4741
 epoch: 61, train_loss: 1.0784, test_loss: 1.0551, test_f1: 0.4868
 epoch: 62, train_loss: 1.0721, test_loss: 1.0515, test_f1: 0.4855
 epoch: 63, train_loss: 1.0722, test_loss: 1.0480, test_f1: 0.4890
 epoch: 64, train_loss: 1.0706, test_loss: 1.0442, test_f1: 0.4926
 epoch: 65, train_loss: 1.0595, test_loss: 1.0423, test_f1: 0.4982
 epoch: 66, train_loss: 1.0555, test_loss: 1.0375, test_f1: 0.4945
 epoch: 67, train_loss: 1.0600, test_loss: 1.0350, test_f1: 0.4982
 epoch: 68, train_loss: 1.0593, test_loss: 1.0340, test_f1: 0.4979
 epoch: 69, train_loss: 1.0537, test_loss: 1.0288, test_f1: 0.4983
 epoch: 70, train_loss: 1.0534, test_loss: 1.0275, test_f1: 0.5002
 epoch: 71, train_loss: 1.0504, test_loss: 1.0240, test_f1: 0.5012
 epoch: 72, train_loss: 1.0497, test_loss: 1.0200, test_f1: 0.4973
 epoch: 73, train_loss: 1.0391, test_loss: 1.0169, test_f1: 0.4998
 epoch: 74, train_loss: 1.0372, test_loss: 1.0144, test_f1: 0.5037
 epoch: 75, train_loss: 1.0367, test_loss: 1.0130, test_f1: 0.5067
 epoch: 76, train_loss: 1.0353, test_loss: 1.0088, test_f1: 0.5063
 epoch: 77, train_loss: 1.0308, test_loss: 1.0039, test_f1: 0.5028
 epoch: 78, train_loss: 1.0266, test_loss: 1.0020, test_f1: 0.5029
 epoch: 79, train_loss: 1.0206, test_loss: 0.9991, test_f1: 0.5035
 epoch: 80, train_loss: 1.0218, test_loss: 1.0001, test_f1: 0.4989
 epoch: 81, train_loss: 1.0257, test_loss: 0.9975, test_f1: 0.5102
 epoch: 82, train_loss: 1.0196, test_loss: 0.9940, test_f1: 0.5056
 epoch: 83, train_loss: 1.0156, test_loss: 0.9895, test_f1: 0.5062
 epoch: 84, train_loss: 1.0098, test_loss: 0.9853, test_f1: 0.5061
 epoch: 85, train_loss: 1.0126, test_loss: 0.9827, test_f1: 0.5024
 epoch: 86, train_loss: 1.0014, test_loss: 0.9800, test_f1: 0.5056
 epoch: 87, train_loss: 1.0081, test_loss: 0.9782, test_f1: 0.5048
 epoch: 88, train_loss: 1.0023, test_loss: 0.9763, test_f1: 0.5008
 epoch: 89, train_loss: 1.0044, test_loss: 0.9759, test_f1: 0.5075
 epoch: 90, train_loss: 0.9938, test_loss: 0.9743, test_f1: 0.5078
 epoch: 91, train_loss: 0.9949, test_loss: 0.9731, test_f1: 0.5076
 epoch: 92, train_loss: 0.9945, test_loss: 0.9720, test_f1: 0.5063
 epoch: 93, train_loss: 0.9914, test_loss: 0.9683, test_f1: 0.5108
 epoch: 94, train_loss: 0.9915, test_loss: 0.9664, test_f1: 0.5134
 epoch: 95, train_loss: 0.9820, test_loss: 0.9662, test_f1: 0.5084
 epoch: 96, train_loss: 0.9837, test_loss: 0.9615, test_f1: 0.5099
 epoch: 97, train_loss: 0.9739, test_loss: 0.9601, test_f1: 0.5159
 epoch: 98, train_loss: 0.9804, test_loss: 0.9581, test_f1: 0.5122
 epoch: 99, train_loss: 0.9755, test_loss: 0.9560, test_f1: 0.5158
##################ITERATION #1 ****************************************
 epoch: 0, train_loss: 1.3273, test_loss: 1.3360, test_f1: 0.2270
 epoch: 1, train_loss: 1.3199, test_loss: 1.3310, test_f1: 0.2270
 epoch: 2, train_loss: 1.3163, test_loss: 1.3251, test_f1: 0.2270
 epoch: 3, train_loss: 1.3114, test_loss: 1.3184, test_f1: 0.2270
 epoch: 4, train_loss: 1.3067, test_loss: 1.3135, test_f1: 0.2270
 epoch: 5, train_loss: 1.3007, test_loss: 1.3071, test_f1: 0.2270
 epoch: 6, train_loss: 1.2970, test_loss: 1.3013, test_f1: 0.2270
 epoch: 7, train_loss: 1.2912, test_loss: 1.2952, test_f1: 0.2270
 epoch: 8, train_loss: 1.2840, test_loss: 1.2892, test_f1: 0.2270
 epoch: 9, train_loss: 1.2804, test_loss: 1.2832, test_f1: 0.2270
 epoch: 10, train_loss: 1.2758, test_loss: 1.2774, test_f1: 0.2270
 epoch: 11, train_loss: 1.2677, test_loss: 1.2713, test_f1: 0.2270
 epoch: 12, train_loss: 1.2653, test_loss: 1.2653, test_f1: 0.2270
 epoch: 13, train_loss: 1.2598, test_loss: 1.2591, test_f1: 0.2270
 epoch: 14, train_loss: 1.2536, test_loss: 1.2533, test_f1: 0.2270
 epoch: 15, train_loss: 1.2494, test_loss: 1.2473, test_f1: 0.2270
 epoch: 16, train_loss: 1.2419, test_loss: 1.2413, test_f1: 0.2270
 epoch: 17, train_loss: 1.2371, test_loss: 1.2353, test_f1: 0.2461
 epoch: 18, train_loss: 1.2348, test_loss: 1.2287, test_f1: 0.2549
 epoch: 19, train_loss: 1.2270, test_loss: 1.2232, test_f1: 0.2728
 epoch: 20, train_loss: 1.2263, test_loss: 1.2184, test_f1: 0.2747
 epoch: 21, train_loss: 1.2209, test_loss: 1.2126, test_f1: 0.2783
 epoch: 22, train_loss: 1.2164, test_loss: 1.2065, test_f1: 0.2819
 epoch: 23, train_loss: 1.2120, test_loss: 1.2021, test_f1: 0.2921
 epoch: 24, train_loss: 1.2023, test_loss: 1.1954, test_f1: 0.3203
 epoch: 25, train_loss: 1.1981, test_loss: 1.1896, test_f1: 0.3363
 epoch: 26, train_loss: 1.1955, test_loss: 1.1842, test_f1: 0.3492
 epoch: 27, train_loss: 1.1928, test_loss: 1.1790, test_f1: 0.3682
 epoch: 28, train_loss: 1.1861, test_loss: 1.1727, test_f1: 0.3837
 epoch: 29, train_loss: 1.1831, test_loss: 1.1673, test_f1: 0.3957
 epoch: 30, train_loss: 1.1732, test_loss: 1.1607, test_f1: 0.4064
 epoch: 31, train_loss: 1.1673, test_loss: 1.1545, test_f1: 0.4139
 epoch: 32, train_loss: 1.1642, test_loss: 1.1480, test_f1: 0.4149
 epoch: 33, train_loss: 1.1626, test_loss: 1.1412, test_f1: 0.4251
 epoch: 34, train_loss: 1.1578, test_loss: 1.1343, test_f1: 0.4321
 epoch: 35, train_loss: 1.1427, test_loss: 1.1280, test_f1: 0.4504
 epoch: 36, train_loss: 1.1400, test_loss: 1.1204, test_f1: 0.4533
 epoch: 37, train_loss: 1.1382, test_loss: 1.1125, test_f1: 0.4586
 epoch: 38, train_loss: 1.1274, test_loss: 1.1058, test_f1: 0.4574
 epoch: 39, train_loss: 1.1213, test_loss: 1.0991, test_f1: 0.4654
 epoch: 40, train_loss: 1.1140, test_loss: 1.0921, test_f1: 0.4623
 epoch: 41, train_loss: 1.1179, test_loss: 1.0912, test_f1: 0.4649
 epoch: 42, train_loss: 1.1059, test_loss: 1.0787, test_f1: 0.4694
 epoch: 43, train_loss: 1.0983, test_loss: 1.0722, test_f1: 0.4754
 epoch: 44, train_loss: 1.0930, test_loss: 1.0684, test_f1: 0.4739
 epoch: 45, train_loss: 1.0859, test_loss: 1.0628, test_f1: 0.4720
 epoch: 46, train_loss: 1.0815, test_loss: 1.0542, test_f1: 0.4728
 epoch: 47, train_loss: 1.0727, test_loss: 1.0511, test_f1: 0.4766
 epoch: 48, train_loss: 1.0706, test_loss: 1.0422, test_f1: 0.4794
 epoch: 49, train_loss: 1.0623, test_loss: 1.0406, test_f1: 0.4759
 epoch: 50, train_loss: 1.0572, test_loss: 1.0325, test_f1: 0.4788
 epoch: 51, train_loss: 1.0506, test_loss: 1.0286, test_f1: 0.4857
 epoch: 52, train_loss: 1.0465, test_loss: 1.0276, test_f1: 0.4803
 epoch: 53, train_loss: 1.0429, test_loss: 1.0259, test_f1: 0.4774
 epoch: 54, train_loss: 1.0433, test_loss: 1.0200, test_f1: 0.4834
 epoch: 55, train_loss: 1.0352, test_loss: 1.0197, test_f1: 0.4755
 epoch: 56, train_loss: 1.0375, test_loss: 1.0185, test_f1: 0.4792
 epoch: 57, train_loss: 1.0357, test_loss: 1.0169, test_f1: 0.4792
 epoch: 58, train_loss: 1.0285, test_loss: 1.0140, test_f1: 0.4791
 epoch: 59, train_loss: 1.0284, test_loss: 1.0117, test_f1: 0.4756
 epoch: 60, train_loss: 1.0179, test_loss: 1.0096, test_f1: 0.4797
 epoch: 61, train_loss: 1.0199, test_loss: 1.0061, test_f1: 0.4827
 epoch: 62, train_loss: 1.0223, test_loss: 1.0032, test_f1: 0.4798
 epoch: 63, train_loss: 1.0088, test_loss: 1.0024, test_f1: 0.4794
 epoch: 64, train_loss: 1.0137, test_loss: 0.9992, test_f1: 0.4828
 epoch: 65, train_loss: 1.0052, test_loss: 0.9973, test_f1: 0.4804
 epoch: 66, train_loss: 1.0049, test_loss: 0.9946, test_f1: 0.4793
 epoch: 67, train_loss: 1.0066, test_loss: 0.9910, test_f1: 0.4814
 epoch: 68, train_loss: 1.0062, test_loss: 0.9920, test_f1: 0.4818
 epoch: 69, train_loss: 1.0036, test_loss: 0.9917, test_f1: 0.4768
 epoch: 70, train_loss: 1.0002, test_loss: 0.9885, test_f1: 0.4791
 epoch: 71, train_loss: 0.9957, test_loss: 0.9862, test_f1: 0.4824
 epoch: 72, train_loss: 0.9930, test_loss: 0.9907, test_f1: 0.4826
 epoch: 73, train_loss: 0.9859, test_loss: 0.9852, test_f1: 0.4832
 epoch: 74, train_loss: 0.9839, test_loss: 0.9830, test_f1: 0.4782
 epoch: 75, train_loss: 0.9922, test_loss: 0.9842, test_f1: 0.4826
 epoch: 76, train_loss: 0.9821, test_loss: 0.9840, test_f1: 0.4759
 epoch: 77, train_loss: 0.9846, test_loss: 0.9806, test_f1: 0.4777
 epoch: 78, train_loss: 0.9870, test_loss: 0.9801, test_f1: 0.4805
 epoch: 79, train_loss: 0.9779, test_loss: 0.9733, test_f1: 0.4851
 epoch: 80, train_loss: 0.9808, test_loss: 0.9721, test_f1: 0.4824
 epoch: 81, train_loss: 0.9742, test_loss: 0.9759, test_f1: 0.4839
 epoch: 82, train_loss: 0.9739, test_loss: 0.9750, test_f1: 0.4831
 epoch: 83, train_loss: 0.9630, test_loss: 0.9747, test_f1: 0.4820
 epoch: 84, train_loss: 0.9714, test_loss: 0.9739, test_f1: 0.4836
 epoch: 85, train_loss: 0.9709, test_loss: 0.9746, test_f1: 0.4784
 epoch: 86, train_loss: 0.9650, test_loss: 0.9702, test_f1: 0.4866
 epoch: 87, train_loss: 0.9682, test_loss: 0.9715, test_f1: 0.4837
 epoch: 88, train_loss: 0.9619, test_loss: 0.9633, test_f1: 0.4969
 epoch: 89, train_loss: 0.9608, test_loss: 0.9695, test_f1: 0.4894
 epoch: 90, train_loss: 0.9550, test_loss: 0.9717, test_f1: 0.4769
 epoch: 91, train_loss: 0.9577, test_loss: 0.9670, test_f1: 0.4828
 epoch: 92, train_loss: 0.9472, test_loss: 0.9780, test_f1: 0.4811
 epoch: 93, train_loss: 0.9594, test_loss: 0.9682, test_f1: 0.4884
 epoch: 94, train_loss: 0.9503, test_loss: 0.9670, test_f1: 0.4848
 epoch: 95, train_loss: 0.9448, test_loss: 0.9620, test_f1: 0.4870
 epoch: 96, train_loss: 0.9486, test_loss: 0.9628, test_f1: 0.4831
 epoch: 97, train_loss: 0.9496, test_loss: 0.9602, test_f1: 0.4820
 epoch: 98, train_loss: 0.9443, test_loss: 0.9589, test_f1: 0.4846
 epoch: 99, train_loss: 0.9431, test_loss: 0.9597, test_f1: 0.4957
##################ITERATION #2 ****************************************
 epoch: 0, train_loss: 1.3191, test_loss: 1.3269, test_f1: 0.2270
 epoch: 1, train_loss: 1.3084, test_loss: 1.3249, test_f1: 0.2270
 epoch: 2, train_loss: 1.2993, test_loss: 1.3159, test_f1: 0.2270
 epoch: 3, train_loss: 1.2878, test_loss: 1.3041, test_f1: 0.2270
 epoch: 4, train_loss: 1.2844, test_loss: 1.2929, test_f1: 0.2270
 epoch: 5, train_loss: 1.2774, test_loss: 1.2822, test_f1: 0.2787
 epoch: 6, train_loss: 1.2709, test_loss: 1.2618, test_f1: 0.3149
 epoch: 7, train_loss: 1.2609, test_loss: 1.2458, test_f1: 0.3258
 epoch: 8, train_loss: 1.2564, test_loss: 1.2358, test_f1: 0.3281
 epoch: 9, train_loss: 1.2474, test_loss: 1.2289, test_f1: 0.3320
 epoch: 10, train_loss: 1.2398, test_loss: 1.2202, test_f1: 0.3341
 epoch: 11, train_loss: 1.2369, test_loss: 1.2133, test_f1: 0.3376
 epoch: 12, train_loss: 1.2310, test_loss: 1.2071, test_f1: 0.3459
 epoch: 13, train_loss: 1.2246, test_loss: 1.2007, test_f1: 0.3601
 epoch: 14, train_loss: 1.2182, test_loss: 1.1936, test_f1: 0.3602
 epoch: 15, train_loss: 1.2184, test_loss: 1.1882, test_f1: 0.3643
 epoch: 16, train_loss: 1.2093, test_loss: 1.1834, test_f1: 0.3642
 epoch: 17, train_loss: 1.2045, test_loss: 1.1781, test_f1: 0.3627
 epoch: 18, train_loss: 1.1961, test_loss: 1.1728, test_f1: 0.3644
 epoch: 19, train_loss: 1.1976, test_loss: 1.1688, test_f1: 0.3677
 epoch: 20, train_loss: 1.1875, test_loss: 1.1631, test_f1: 0.3807
 epoch: 21, train_loss: 1.1824, test_loss: 1.1561, test_f1: 0.3816
 epoch: 22, train_loss: 1.1840, test_loss: 1.1520, test_f1: 0.3741
 epoch: 23, train_loss: 1.1737, test_loss: 1.1481, test_f1: 0.3833
 epoch: 24, train_loss: 1.1728, test_loss: 1.1445, test_f1: 0.3859
 epoch: 25, train_loss: 1.1636, test_loss: 1.1394, test_f1: 0.3996
 epoch: 26, train_loss: 1.1620, test_loss: 1.1345, test_f1: 0.4054
 epoch: 27, train_loss: 1.1571, test_loss: 1.1300, test_f1: 0.4036
 epoch: 28, train_loss: 1.1531, test_loss: 1.1254, test_f1: 0.4054
 epoch: 29, train_loss: 1.1538, test_loss: 1.1203, test_f1: 0.4146
 epoch: 30, train_loss: 1.1422, test_loss: 1.1156, test_f1: 0.4182
 epoch: 31, train_loss: 1.1408, test_loss: 1.1105, test_f1: 0.4301
 epoch: 32, train_loss: 1.1321, test_loss: 1.1064, test_f1: 0.4292
 epoch: 33, train_loss: 1.1253, test_loss: 1.1045, test_f1: 0.4339
 epoch: 34, train_loss: 1.1236, test_loss: 1.0986, test_f1: 0.4431
 epoch: 35, train_loss: 1.1229, test_loss: 1.0928, test_f1: 0.4461
 epoch: 36, train_loss: 1.1225, test_loss: 1.0891, test_f1: 0.4497
 epoch: 37, train_loss: 1.1178, test_loss: 1.0819, test_f1: 0.4566
 epoch: 38, train_loss: 1.1126, test_loss: 1.0793, test_f1: 0.4581
 epoch: 39, train_loss: 1.1087, test_loss: 1.0786, test_f1: 0.4576
 epoch: 40, train_loss: 1.1013, test_loss: 1.0711, test_f1: 0.4666
 epoch: 41, train_loss: 1.0950, test_loss: 1.0670, test_f1: 0.4678
 epoch: 42, train_loss: 1.0884, test_loss: 1.0608, test_f1: 0.4697
 epoch: 43, train_loss: 1.0829, test_loss: 1.0580, test_f1: 0.4725
 epoch: 44, train_loss: 1.0827, test_loss: 1.0539, test_f1: 0.4713
 epoch: 45, train_loss: 1.0790, test_loss: 1.0504, test_f1: 0.4728
 epoch: 46, train_loss: 1.0710, test_loss: 1.0446, test_f1: 0.4710
 epoch: 47, train_loss: 1.0715, test_loss: 1.0442, test_f1: 0.4689
 epoch: 48, train_loss: 1.0613, test_loss: 1.0413, test_f1: 0.4714
 epoch: 49, train_loss: 1.0582, test_loss: 1.0371, test_f1: 0.4702
 epoch: 50, train_loss: 1.0581, test_loss: 1.0343, test_f1: 0.4679
 epoch: 51, train_loss: 1.0489, test_loss: 1.0319, test_f1: 0.4663
 epoch: 52, train_loss: 1.0524, test_loss: 1.0299, test_f1: 0.4672
 epoch: 53, train_loss: 1.0484, test_loss: 1.0283, test_f1: 0.4672
 epoch: 54, train_loss: 1.0447, test_loss: 1.0267, test_f1: 0.4744
 epoch: 55, train_loss: 1.0472, test_loss: 1.0246, test_f1: 0.4704
 epoch: 56, train_loss: 1.0401, test_loss: 1.0237, test_f1: 0.4718
 epoch: 57, train_loss: 1.0367, test_loss: 1.0211, test_f1: 0.4771
 epoch: 58, train_loss: 1.0387, test_loss: 1.0212, test_f1: 0.4730
 epoch: 59, train_loss: 1.0369, test_loss: 1.0221, test_f1: 0.4778
 epoch: 60, train_loss: 1.0322, test_loss: 1.0192, test_f1: 0.4787
 epoch: 61, train_loss: 1.0304, test_loss: 1.0179, test_f1: 0.4739
 epoch: 62, train_loss: 1.0294, test_loss: 1.0163, test_f1: 0.4782
 epoch: 63, train_loss: 1.0314, test_loss: 1.0149, test_f1: 0.4853
 epoch: 64, train_loss: 1.0249, test_loss: 1.0143, test_f1: 0.4803
 epoch: 65, train_loss: 1.0206, test_loss: 1.0123, test_f1: 0.4771
 epoch: 66, train_loss: 1.0210, test_loss: 1.0114, test_f1: 0.4805
 epoch: 67, train_loss: 1.0180, test_loss: 1.0103, test_f1: 0.4790
 epoch: 68, train_loss: 1.0180, test_loss: 1.0085, test_f1: 0.4806
 epoch: 69, train_loss: 1.0202, test_loss: 1.0081, test_f1: 0.4881
 epoch: 70, train_loss: 1.0140, test_loss: 1.0067, test_f1: 0.4806
 epoch: 71, train_loss: 1.0080, test_loss: 1.0046, test_f1: 0.4808
 epoch: 72, train_loss: 1.0118, test_loss: 1.0037, test_f1: 0.4815
 epoch: 73, train_loss: 1.0070, test_loss: 1.0018, test_f1: 0.4811
 epoch: 74, train_loss: 1.0078, test_loss: 1.0013, test_f1: 0.4839
 epoch: 75, train_loss: 1.0069, test_loss: 1.0012, test_f1: 0.4855
 epoch: 76, train_loss: 1.0044, test_loss: 1.0009, test_f1: 0.4886
 epoch: 77, train_loss: 1.0051, test_loss: 1.0004, test_f1: 0.4810
 epoch: 78, train_loss: 0.9989, test_loss: 0.9991, test_f1: 0.4887
 epoch: 79, train_loss: 1.0093, test_loss: 0.9975, test_f1: 0.4898
 epoch: 80, train_loss: 0.9951, test_loss: 0.9973, test_f1: 0.4897
 epoch: 81, train_loss: 0.9971, test_loss: 0.9962, test_f1: 0.4897
 epoch: 82, train_loss: 0.9973, test_loss: 0.9957, test_f1: 0.4852
 epoch: 83, train_loss: 0.9903, test_loss: 0.9967, test_f1: 0.4863
 epoch: 84, train_loss: 0.9953, test_loss: 0.9957, test_f1: 0.4895
 epoch: 85, train_loss: 0.9833, test_loss: 0.9937, test_f1: 0.4854
 epoch: 86, train_loss: 0.9951, test_loss: 0.9934, test_f1: 0.4907
 epoch: 87, train_loss: 0.9886, test_loss: 0.9932, test_f1: 0.4887
 epoch: 88, train_loss: 0.9892, test_loss: 0.9910, test_f1: 0.4911
 epoch: 89, train_loss: 0.9857, test_loss: 0.9902, test_f1: 0.4899
 epoch: 90, train_loss: 0.9824, test_loss: 0.9909, test_f1: 0.4864
 epoch: 91, train_loss: 0.9847, test_loss: 0.9906, test_f1: 0.4820
 epoch: 92, train_loss: 0.9831, test_loss: 0.9889, test_f1: 0.4867
 epoch: 93, train_loss: 0.9856, test_loss: 0.9883, test_f1: 0.4878
 epoch: 94, train_loss: 0.9810, test_loss: 0.9871, test_f1: 0.4882
 epoch: 95, train_loss: 0.9804, test_loss: 0.9876, test_f1: 0.4871
 epoch: 96, train_loss: 0.9850, test_loss: 0.9866, test_f1: 0.4863
 epoch: 97, train_loss: 0.9759, test_loss: 0.9857, test_f1: 0.4862
 epoch: 98, train_loss: 0.9742, test_loss: 0.9854, test_f1: 0.4884
 epoch: 99, train_loss: 0.9747, test_loss: 0.9838, test_f1: 0.4940
##################ITERATION #3 ****************************************
 epoch: 0, train_loss: 1.3124, test_loss: 1.3198, test_f1: 0.2270
 epoch: 1, train_loss: 1.2942, test_loss: 1.3191, test_f1: 0.2270
 epoch: 2, train_loss: 1.2858, test_loss: 1.3096, test_f1: 0.2270
 epoch: 3, train_loss: 1.2772, test_loss: 1.2910, test_f1: 0.2270
 epoch: 4, train_loss: 1.2670, test_loss: 1.2720, test_f1: 0.2270
 epoch: 5, train_loss: 1.2605, test_loss: 1.2547, test_f1: 0.2295
 epoch: 6, train_loss: 1.2517, test_loss: 1.2400, test_f1: 0.2347
 epoch: 7, train_loss: 1.2433, test_loss: 1.2294, test_f1: 0.2659
 epoch: 8, train_loss: 1.2373, test_loss: 1.2226, test_f1: 0.2788
 epoch: 9, train_loss: 1.2299, test_loss: 1.2150, test_f1: 0.2826
 epoch: 10, train_loss: 1.2230, test_loss: 1.2074, test_f1: 0.3161
 epoch: 11, train_loss: 1.2149, test_loss: 1.1992, test_f1: 0.3330
 epoch: 12, train_loss: 1.2084, test_loss: 1.1917, test_f1: 0.3503
 epoch: 13, train_loss: 1.2037, test_loss: 1.1831, test_f1: 0.3724
 epoch: 14, train_loss: 1.1931, test_loss: 1.1750, test_f1: 0.3898
 epoch: 15, train_loss: 1.1866, test_loss: 1.1675, test_f1: 0.4020
 epoch: 16, train_loss: 1.1784, test_loss: 1.1592, test_f1: 0.4051
 epoch: 17, train_loss: 1.1700, test_loss: 1.1523, test_f1: 0.4170
 epoch: 18, train_loss: 1.1659, test_loss: 1.1420, test_f1: 0.4227
 epoch: 19, train_loss: 1.1630, test_loss: 1.1341, test_f1: 0.4220
 epoch: 20, train_loss: 1.1544, test_loss: 1.1274, test_f1: 0.4263
 epoch: 21, train_loss: 1.1465, test_loss: 1.1223, test_f1: 0.4353
 epoch: 22, train_loss: 1.1348, test_loss: 1.1145, test_f1: 0.4409
 epoch: 23, train_loss: 1.1304, test_loss: 1.1068, test_f1: 0.4409
 epoch: 24, train_loss: 1.1215, test_loss: 1.0984, test_f1: 0.4460
 epoch: 25, train_loss: 1.1165, test_loss: 1.0888, test_f1: 0.4548
 epoch: 26, train_loss: 1.1109, test_loss: 1.0815, test_f1: 0.4546
 epoch: 27, train_loss: 1.1033, test_loss: 1.0750, test_f1: 0.4573
 epoch: 28, train_loss: 1.0993, test_loss: 1.0686, test_f1: 0.4516
 epoch: 29, train_loss: 1.0889, test_loss: 1.0609, test_f1: 0.4453
 epoch: 30, train_loss: 1.0840, test_loss: 1.0547, test_f1: 0.4484
 epoch: 31, train_loss: 1.0750, test_loss: 1.0478, test_f1: 0.4489
 epoch: 32, train_loss: 1.0703, test_loss: 1.0423, test_f1: 0.4519
 epoch: 33, train_loss: 1.0679, test_loss: 1.0368, test_f1: 0.4479
 epoch: 34, train_loss: 1.0573, test_loss: 1.0322, test_f1: 0.4504
 epoch: 35, train_loss: 1.0547, test_loss: 1.0235, test_f1: 0.4515
 epoch: 36, train_loss: 1.0444, test_loss: 1.0209, test_f1: 0.4562
 epoch: 37, train_loss: 1.0424, test_loss: 1.0159, test_f1: 0.4585
 epoch: 38, train_loss: 1.0260, test_loss: 1.0091, test_f1: 0.4548
 epoch: 39, train_loss: 1.0268, test_loss: 1.0041, test_f1: 0.4577
 epoch: 40, train_loss: 1.0219, test_loss: 1.0053, test_f1: 0.4677
 epoch: 41, train_loss: 1.0137, test_loss: 0.9998, test_f1: 0.4626
 epoch: 42, train_loss: 1.0140, test_loss: 0.9931, test_f1: 0.4628
 epoch: 43, train_loss: 1.0125, test_loss: 0.9930, test_f1: 0.4720
 epoch: 44, train_loss: 0.9956, test_loss: 0.9897, test_f1: 0.4716
 epoch: 45, train_loss: 0.9996, test_loss: 0.9853, test_f1: 0.4708
 epoch: 46, train_loss: 0.9926, test_loss: 0.9854, test_f1: 0.4684
 epoch: 47, train_loss: 0.9923, test_loss: 0.9808, test_f1: 0.4716
 epoch: 48, train_loss: 0.9937, test_loss: 0.9778, test_f1: 0.4798
 epoch: 49, train_loss: 0.9806, test_loss: 0.9776, test_f1: 0.4779
 epoch: 50, train_loss: 0.9795, test_loss: 0.9776, test_f1: 0.4739
 epoch: 51, train_loss: 0.9788, test_loss: 0.9755, test_f1: 0.4748
 epoch: 52, train_loss: 0.9755, test_loss: 0.9754, test_f1: 0.4749
 epoch: 53, train_loss: 0.9750, test_loss: 0.9737, test_f1: 0.4786
 epoch: 54, train_loss: 0.9662, test_loss: 0.9741, test_f1: 0.4787
 epoch: 55, train_loss: 0.9619, test_loss: 0.9714, test_f1: 0.4831
 epoch: 56, train_loss: 0.9754, test_loss: 0.9688, test_f1: 0.4813
 epoch: 57, train_loss: 0.9646, test_loss: 0.9680, test_f1: 0.4801
 epoch: 58, train_loss: 0.9679, test_loss: 0.9699, test_f1: 0.4824
 epoch: 59, train_loss: 0.9625, test_loss: 0.9663, test_f1: 0.4801
 epoch: 60, train_loss: 0.9643, test_loss: 0.9649, test_f1: 0.4831
 epoch: 61, train_loss: 0.9616, test_loss: 0.9661, test_f1: 0.4834
 epoch: 62, train_loss: 0.9649, test_loss: 0.9651, test_f1: 0.4794
 epoch: 63, train_loss: 0.9558, test_loss: 0.9663, test_f1: 0.4843
 epoch: 64, train_loss: 0.9547, test_loss: 0.9672, test_f1: 0.4816
 epoch: 65, train_loss: 0.9508, test_loss: 0.9645, test_f1: 0.4785
 epoch: 66, train_loss: 0.9554, test_loss: 0.9642, test_f1: 0.4826
 epoch: 67, train_loss: 0.9486, test_loss: 0.9608, test_f1: 0.4818
 epoch: 68, train_loss: 0.9546, test_loss: 0.9645, test_f1: 0.4818
 epoch: 69, train_loss: 0.9446, test_loss: 0.9666, test_f1: 0.4838
 epoch: 70, train_loss: 0.9473, test_loss: 0.9642, test_f1: 0.4875
 epoch: 71, train_loss: 0.9391, test_loss: 0.9618, test_f1: 0.4851
 epoch: 72, train_loss: 0.9433, test_loss: 0.9661, test_f1: 0.4814
 epoch: 73, train_loss: 0.9445, test_loss: 0.9635, test_f1: 0.4830
 epoch: 74, train_loss: 0.9455, test_loss: 0.9659, test_f1: 0.4817
 epoch: 75, train_loss: 0.9457, test_loss: 0.9623, test_f1: 0.4860
 epoch: 76, train_loss: 0.9427, test_loss: 0.9623, test_f1: 0.4830
 epoch: 77, train_loss: 0.9349, test_loss: 0.9633, test_f1: 0.4800
 epoch: 78, train_loss: 0.9408, test_loss: 0.9635, test_f1: 0.4831
 epoch: 79, train_loss: 0.9347, test_loss: 0.9640, test_f1: 0.4851
 epoch: 80, train_loss: 0.9325, test_loss: 0.9628, test_f1: 0.4858
 epoch: 81, train_loss: 0.9338, test_loss: 0.9644, test_f1: 0.4895
 epoch: 82, train_loss: 0.9278, test_loss: 0.9607, test_f1: 0.4879
 epoch: 83, train_loss: 0.9332, test_loss: 0.9625, test_f1: 0.4837
 epoch: 84, train_loss: 0.9266, test_loss: 0.9627, test_f1: 0.4862
 epoch: 85, train_loss: 0.9212, test_loss: 0.9640, test_f1: 0.4854
 epoch: 86, train_loss: 0.9186, test_loss: 0.9605, test_f1: 0.4845
 epoch: 87, train_loss: 0.9174, test_loss: 0.9600, test_f1: 0.4890
 epoch: 88, train_loss: 0.9253, test_loss: 0.9605, test_f1: 0.4960
 epoch: 89, train_loss: 0.9178, test_loss: 0.9590, test_f1: 0.4867
 epoch: 90, train_loss: 0.9194, test_loss: 0.9581, test_f1: 0.4857
 epoch: 91, train_loss: 0.9283, test_loss: 0.9596, test_f1: 0.4882
 epoch: 92, train_loss: 0.9189, test_loss: 0.9613, test_f1: 0.4893
 epoch: 93, train_loss: 0.9191, test_loss: 0.9580, test_f1: 0.4882
 epoch: 94, train_loss: 0.9134, test_loss: 0.9573, test_f1: 0.4965
 epoch: 95, train_loss: 0.9182, test_loss: 0.9589, test_f1: 0.4906
 epoch: 96, train_loss: 0.9090, test_loss: 0.9557, test_f1: 0.4841
 epoch: 97, train_loss: 0.9096, test_loss: 0.9560, test_f1: 0.4918
 epoch: 98, train_loss: 0.9079, test_loss: 0.9613, test_f1: 0.5014
 epoch: 99, train_loss: 0.9117, test_loss: 0.9577, test_f1: 0.4903
##################ITERATION #4 ****************************************
 epoch: 0, train_loss: 1.3043, test_loss: 1.3170, test_f1: 0.2270
 epoch: 1, train_loss: 1.2788, test_loss: 1.3079, test_f1: 0.2270
 epoch: 2, train_loss: 1.2657, test_loss: 1.2905, test_f1: 0.2270
 epoch: 3, train_loss: 1.2579, test_loss: 1.2660, test_f1: 0.2270
 epoch: 4, train_loss: 1.2475, test_loss: 1.2441, test_f1: 0.2350
 epoch: 5, train_loss: 1.2411, test_loss: 1.2215, test_f1: 0.2668
 epoch: 6, train_loss: 1.2369, test_loss: 1.2061, test_f1: 0.2963
 epoch: 7, train_loss: 1.2267, test_loss: 1.1961, test_f1: 0.3044
 epoch: 8, train_loss: 1.2214, test_loss: 1.1879, test_f1: 0.3109
 epoch: 9, train_loss: 1.2157, test_loss: 1.1792, test_f1: 0.3149
 epoch: 10, train_loss: 1.2099, test_loss: 1.1716, test_f1: 0.3296
 epoch: 11, train_loss: 1.2061, test_loss: 1.1634, test_f1: 0.3344
 epoch: 12, train_loss: 1.1940, test_loss: 1.1579, test_f1: 0.3494
 epoch: 13, train_loss: 1.1919, test_loss: 1.1505, test_f1: 0.3705
 epoch: 14, train_loss: 1.1861, test_loss: 1.1422, test_f1: 0.3906
 epoch: 15, train_loss: 1.1715, test_loss: 1.1348, test_f1: 0.3815
 epoch: 16, train_loss: 1.1607, test_loss: 1.1304, test_f1: 0.4027
 epoch: 17, train_loss: 1.1602, test_loss: 1.1230, test_f1: 0.4104
 epoch: 18, train_loss: 1.1576, test_loss: 1.1143, test_f1: 0.4064
 epoch: 19, train_loss: 1.1436, test_loss: 1.1076, test_f1: 0.4116
 epoch: 20, train_loss: 1.1430, test_loss: 1.1009, test_f1: 0.4161
 epoch: 21, train_loss: 1.1364, test_loss: 1.0934, test_f1: 0.4200
 epoch: 22, train_loss: 1.1270, test_loss: 1.0880, test_f1: 0.4358
 epoch: 23, train_loss: 1.1208, test_loss: 1.0801, test_f1: 0.4402
 epoch: 24, train_loss: 1.1162, test_loss: 1.0724, test_f1: 0.4491
 epoch: 25, train_loss: 1.1120, test_loss: 1.0666, test_f1: 0.4573
 epoch: 26, train_loss: 1.0971, test_loss: 1.0597, test_f1: 0.4488
 epoch: 27, train_loss: 1.0914, test_loss: 1.0563, test_f1: 0.4538
 epoch: 28, train_loss: 1.0917, test_loss: 1.0481, test_f1: 0.4562
 epoch: 29, train_loss: 1.0818, test_loss: 1.0421, test_f1: 0.4592
 epoch: 30, train_loss: 1.0783, test_loss: 1.0345, test_f1: 0.4571
 epoch: 31, train_loss: 1.0616, test_loss: 1.0306, test_f1: 0.4553
 epoch: 32, train_loss: 1.0585, test_loss: 1.0202, test_f1: 0.4690
 epoch: 33, train_loss: 1.0545, test_loss: 1.0166, test_f1: 0.4666
 epoch: 34, train_loss: 1.0454, test_loss: 1.0138, test_f1: 0.4657
 epoch: 35, train_loss: 1.0391, test_loss: 1.0049, test_f1: 0.4657
 epoch: 36, train_loss: 1.0383, test_loss: 0.9992, test_f1: 0.4726
 epoch: 37, train_loss: 1.0305, test_loss: 0.9960, test_f1: 0.4703
 epoch: 38, train_loss: 1.0287, test_loss: 0.9899, test_f1: 0.4724
 epoch: 39, train_loss: 1.0220, test_loss: 0.9861, test_f1: 0.4718
 epoch: 40, train_loss: 1.0218, test_loss: 0.9861, test_f1: 0.4760
 epoch: 41, train_loss: 1.0204, test_loss: 0.9767, test_f1: 0.4801
 epoch: 42, train_loss: 1.0124, test_loss: 0.9715, test_f1: 0.4823
 epoch: 43, train_loss: 0.9984, test_loss: 0.9701, test_f1: 0.4837
 epoch: 44, train_loss: 1.0042, test_loss: 0.9647, test_f1: 0.4798
 epoch: 45, train_loss: 1.0005, test_loss: 0.9636, test_f1: 0.4798
 epoch: 46, train_loss: 0.9937, test_loss: 0.9583, test_f1: 0.4889
 epoch: 47, train_loss: 0.9807, test_loss: 0.9597, test_f1: 0.4892
 epoch: 48, train_loss: 0.9880, test_loss: 0.9568, test_f1: 0.4858
 epoch: 49, train_loss: 0.9782, test_loss: 0.9542, test_f1: 0.4818
 epoch: 50, train_loss: 0.9773, test_loss: 0.9587, test_f1: 0.4803
 epoch: 51, train_loss: 0.9735, test_loss: 0.9484, test_f1: 0.4960
 epoch: 52, train_loss: 0.9781, test_loss: 0.9502, test_f1: 0.4888
 epoch: 53, train_loss: 0.9678, test_loss: 0.9489, test_f1: 0.4875
 epoch: 54, train_loss: 0.9551, test_loss: 0.9468, test_f1: 0.4929
 epoch: 55, train_loss: 0.9720, test_loss: 0.9441, test_f1: 0.4973
 epoch: 56, train_loss: 0.9694, test_loss: 0.9432, test_f1: 0.4919
 epoch: 57, train_loss: 0.9631, test_loss: 0.9411, test_f1: 0.4973
 epoch: 58, train_loss: 0.9605, test_loss: 0.9453, test_f1: 0.4922
 epoch: 59, train_loss: 0.9563, test_loss: 0.9449, test_f1: 0.4961
 epoch: 60, train_loss: 0.9535, test_loss: 0.9441, test_f1: 0.4977
 epoch: 61, train_loss: 0.9564, test_loss: 0.9473, test_f1: 0.4927
 epoch: 62, train_loss: 0.9568, test_loss: 0.9450, test_f1: 0.4938
 epoch: 63, train_loss: 0.9617, test_loss: 0.9449, test_f1: 0.4949
 epoch: 64, train_loss: 0.9496, test_loss: 0.9400, test_f1: 0.5009
 epoch: 65, train_loss: 0.9481, test_loss: 0.9448, test_f1: 0.4934
 epoch: 66, train_loss: 0.9493, test_loss: 0.9397, test_f1: 0.5000
 epoch: 67, train_loss: 0.9455, test_loss: 0.9396, test_f1: 0.4999
 epoch: 68, train_loss: 0.9529, test_loss: 0.9424, test_f1: 0.4932
 epoch: 69, train_loss: 0.9489, test_loss: 0.9427, test_f1: 0.4950
 epoch: 70, train_loss: 0.9355, test_loss: 0.9390, test_f1: 0.5010
 epoch: 71, train_loss: 0.9434, test_loss: 0.9385, test_f1: 0.4969
 epoch: 72, train_loss: 0.9413, test_loss: 0.9407, test_f1: 0.4997
 epoch: 73, train_loss: 0.9391, test_loss: 0.9376, test_f1: 0.5039
 epoch: 74, train_loss: 0.9438, test_loss: 0.9410, test_f1: 0.4930
 epoch: 75, train_loss: 0.9319, test_loss: 0.9390, test_f1: 0.4990
 epoch: 76, train_loss: 0.9452, test_loss: 0.9339, test_f1: 0.5044
 epoch: 77, train_loss: 0.9277, test_loss: 0.9359, test_f1: 0.5027
 epoch: 78, train_loss: 0.9340, test_loss: 0.9385, test_f1: 0.4960
 epoch: 79, train_loss: 0.9268, test_loss: 0.9364, test_f1: 0.4958
 epoch: 80, train_loss: 0.9320, test_loss: 0.9382, test_f1: 0.4986
 epoch: 81, train_loss: 0.9323, test_loss: 0.9383, test_f1: 0.5020
 epoch: 82, train_loss: 0.9265, test_loss: 0.9373, test_f1: 0.5005
 epoch: 83, train_loss: 0.9254, test_loss: 0.9385, test_f1: 0.5028
 epoch: 84, train_loss: 0.9310, test_loss: 0.9352, test_f1: 0.5017
 epoch: 85, train_loss: 0.9223, test_loss: 0.9400, test_f1: 0.5018
 epoch: 86, train_loss: 0.9244, test_loss: 0.9441, test_f1: 0.4974
 epoch: 87, train_loss: 0.9181, test_loss: 0.9438, test_f1: 0.4941
 epoch: 88, train_loss: 0.9142, test_loss: 0.9413, test_f1: 0.4954
 epoch: 89, train_loss: 0.9234, test_loss: 0.9404, test_f1: 0.4981
 epoch: 90, train_loss: 0.9227, test_loss: 0.9480, test_f1: 0.4905
 epoch: 91, train_loss: 0.9134, test_loss: 0.9459, test_f1: 0.4935
 epoch: 92, train_loss: 0.9197, test_loss: 0.9396, test_f1: 0.5071
 epoch: 93, train_loss: 0.9181, test_loss: 0.9380, test_f1: 0.5121
 epoch: 94, train_loss: 0.9109, test_loss: 0.9390, test_f1: 0.5133
 epoch: 95, train_loss: 0.9063, test_loss: 0.9399, test_f1: 0.5167
 epoch: 96, train_loss: 0.9196, test_loss: 0.9399, test_f1: 0.5207
 epoch: 97, train_loss: 0.9148, test_loss: 0.9471, test_f1: 0.5131
 epoch: 98, train_loss: 0.9055, test_loss: 0.9473, test_f1: 0.5085
 epoch: 99, train_loss: 0.9075, test_loss: 0.9466, test_f1: 0.5124
##################ITERATION #5 ****************************************
 epoch: 0, train_loss: 1.3082, test_loss: 1.3313, test_f1: 0.2270
 epoch: 1, train_loss: 1.2769, test_loss: 1.3321, test_f1: 0.2270
 epoch: 2, train_loss: 1.2672, test_loss: 1.3291, test_f1: 0.2270
 epoch: 3, train_loss: 1.2513, test_loss: 1.3292, test_f1: 0.2270
 epoch: 4, train_loss: 1.2369, test_loss: 1.3081, test_f1: 0.2532
 epoch: 5, train_loss: 1.2281, test_loss: 1.2431, test_f1: 0.2440
 epoch: 6, train_loss: 1.2199, test_loss: 1.1973, test_f1: 0.2956
 epoch: 7, train_loss: 1.2159, test_loss: 1.1794, test_f1: 0.3015
 epoch: 8, train_loss: 1.2031, test_loss: 1.1691, test_f1: 0.3071
 epoch: 9, train_loss: 1.1946, test_loss: 1.1602, test_f1: 0.3307
 epoch: 10, train_loss: 1.1873, test_loss: 1.1528, test_f1: 0.3507
 epoch: 11, train_loss: 1.1863, test_loss: 1.1438, test_f1: 0.3628
 epoch: 12, train_loss: 1.1715, test_loss: 1.1350, test_f1: 0.3829
 epoch: 13, train_loss: 1.1732, test_loss: 1.1294, test_f1: 0.3851
 epoch: 14, train_loss: 1.1589, test_loss: 1.1225, test_f1: 0.4053
 epoch: 15, train_loss: 1.1548, test_loss: 1.1121, test_f1: 0.4134
 epoch: 16, train_loss: 1.1481, test_loss: 1.1087, test_f1: 0.4229
 epoch: 17, train_loss: 1.1429, test_loss: 1.1013, test_f1: 0.4253
 epoch: 18, train_loss: 1.1385, test_loss: 1.0949, test_f1: 0.4419
 epoch: 19, train_loss: 1.1315, test_loss: 1.0889, test_f1: 0.4501
 epoch: 20, train_loss: 1.1268, test_loss: 1.0842, test_f1: 0.4586
 epoch: 21, train_loss: 1.1172, test_loss: 1.0754, test_f1: 0.4527
 epoch: 22, train_loss: 1.1104, test_loss: 1.0680, test_f1: 0.4656
 epoch: 23, train_loss: 1.1109, test_loss: 1.0621, test_f1: 0.4714
 epoch: 24, train_loss: 1.1020, test_loss: 1.0585, test_f1: 0.4648
 epoch: 25, train_loss: 1.1018, test_loss: 1.0562, test_f1: 0.4588
 epoch: 26, train_loss: 1.0964, test_loss: 1.0494, test_f1: 0.4614
 epoch: 27, train_loss: 1.0831, test_loss: 1.0433, test_f1: 0.4553
 epoch: 28, train_loss: 1.0810, test_loss: 1.0333, test_f1: 0.4741
 epoch: 29, train_loss: 1.0771, test_loss: 1.0309, test_f1: 0.4619
 epoch: 30, train_loss: 1.0711, test_loss: 1.0254, test_f1: 0.4638
 epoch: 31, train_loss: 1.0662, test_loss: 1.0194, test_f1: 0.4711
 epoch: 32, train_loss: 1.0627, test_loss: 1.0164, test_f1: 0.4701
 epoch: 33, train_loss: 1.0534, test_loss: 1.0160, test_f1: 0.4664
 epoch: 34, train_loss: 1.0496, test_loss: 1.0091, test_f1: 0.4738
 epoch: 35, train_loss: 1.0427, test_loss: 1.0057, test_f1: 0.4694
 epoch: 36, train_loss: 1.0360, test_loss: 0.9987, test_f1: 0.4736
 epoch: 37, train_loss: 1.0340, test_loss: 0.9947, test_f1: 0.4782
 epoch: 38, train_loss: 1.0315, test_loss: 0.9919, test_f1: 0.4781
 epoch: 39, train_loss: 1.0321, test_loss: 0.9914, test_f1: 0.4726
 epoch: 40, train_loss: 1.0268, test_loss: 0.9891, test_f1: 0.4766
 epoch: 41, train_loss: 1.0169, test_loss: 0.9835, test_f1: 0.4867
 epoch: 42, train_loss: 1.0192, test_loss: 0.9840, test_f1: 0.4842
 epoch: 43, train_loss: 1.0181, test_loss: 0.9839, test_f1: 0.4822
 epoch: 44, train_loss: 1.0043, test_loss: 0.9809, test_f1: 0.4778
 epoch: 45, train_loss: 0.9971, test_loss: 0.9756, test_f1: 0.4877
 epoch: 46, train_loss: 0.9958, test_loss: 0.9731, test_f1: 0.4887
 epoch: 47, train_loss: 0.9916, test_loss: 0.9750, test_f1: 0.4835
 epoch: 48, train_loss: 0.9960, test_loss: 0.9728, test_f1: 0.4888
 epoch: 49, train_loss: 0.9950, test_loss: 0.9726, test_f1: 0.4974
 epoch: 50, train_loss: 0.9833, test_loss: 0.9706, test_f1: 0.5015
 epoch: 51, train_loss: 0.9824, test_loss: 0.9746, test_f1: 0.4919
 epoch: 52, train_loss: 0.9829, test_loss: 0.9743, test_f1: 0.4916
 epoch: 53, train_loss: 0.9780, test_loss: 0.9696, test_f1: 0.4954
 epoch: 54, train_loss: 0.9780, test_loss: 0.9742, test_f1: 0.4907
 epoch: 55, train_loss: 0.9867, test_loss: 0.9681, test_f1: 0.5010
 epoch: 56, train_loss: 0.9609, test_loss: 0.9713, test_f1: 0.4972
 epoch: 57, train_loss: 0.9771, test_loss: 0.9703, test_f1: 0.4977
 epoch: 58, train_loss: 0.9740, test_loss: 0.9701, test_f1: 0.4956
 epoch: 59, train_loss: 0.9611, test_loss: 0.9671, test_f1: 0.4977
 epoch: 60, train_loss: 0.9732, test_loss: 0.9668, test_f1: 0.4955
 epoch: 61, train_loss: 0.9671, test_loss: 0.9686, test_f1: 0.4893
 epoch: 62, train_loss: 0.9634, test_loss: 0.9672, test_f1: 0.4893
 epoch: 63, train_loss: 0.9585, test_loss: 0.9647, test_f1: 0.4930
 epoch: 64, train_loss: 0.9567, test_loss: 0.9625, test_f1: 0.4920
 epoch: 65, train_loss: 0.9618, test_loss: 0.9665, test_f1: 0.4952
 epoch: 66, train_loss: 0.9615, test_loss: 0.9665, test_f1: 0.4948
 epoch: 67, train_loss: 0.9608, test_loss: 0.9605, test_f1: 0.4977
 epoch: 68, train_loss: 0.9536, test_loss: 0.9624, test_f1: 0.4942
 epoch: 69, train_loss: 0.9604, test_loss: 0.9687, test_f1: 0.4932
 epoch: 70, train_loss: 0.9544, test_loss: 0.9621, test_f1: 0.4958
 epoch: 71, train_loss: 0.9637, test_loss: 0.9652, test_f1: 0.4951
 epoch: 72, train_loss: 0.9511, test_loss: 0.9685, test_f1: 0.4896
 epoch: 73, train_loss: 0.9481, test_loss: 0.9631, test_f1: 0.4969
 epoch: 74, train_loss: 0.9509, test_loss: 0.9614, test_f1: 0.4981
 epoch: 75, train_loss: 0.9458, test_loss: 0.9639, test_f1: 0.4994
 epoch: 76, train_loss: 0.9401, test_loss: 0.9601, test_f1: 0.4955
 epoch: 77, train_loss: 0.9362, test_loss: 0.9599, test_f1: 0.5023
 epoch: 78, train_loss: 0.9472, test_loss: 0.9662, test_f1: 0.4981
 epoch: 79, train_loss: 0.9424, test_loss: 0.9655, test_f1: 0.4970
 epoch: 80, train_loss: 0.9421, test_loss: 0.9633, test_f1: 0.4994
 epoch: 81, train_loss: 0.9436, test_loss: 0.9587, test_f1: 0.4952
 epoch: 82, train_loss: 0.9429, test_loss: 0.9672, test_f1: 0.4977
 epoch: 83, train_loss: 0.9399, test_loss: 0.9604, test_f1: 0.5016
 epoch: 84, train_loss: 0.9327, test_loss: 0.9603, test_f1: 0.4985
 epoch: 85, train_loss: 0.9367, test_loss: 0.9593, test_f1: 0.4967
 epoch: 86, train_loss: 0.9376, test_loss: 0.9558, test_f1: 0.5016
 epoch: 87, train_loss: 0.9356, test_loss: 0.9670, test_f1: 0.5030
 epoch: 88, train_loss: 0.9332, test_loss: 0.9664, test_f1: 0.4966
 epoch: 89, train_loss: 0.9315, test_loss: 0.9620, test_f1: 0.5018
 epoch: 90, train_loss: 0.9337, test_loss: 0.9645, test_f1: 0.4995
 epoch: 91, train_loss: 0.9298, test_loss: 0.9671, test_f1: 0.4987
 epoch: 92, train_loss: 0.9291, test_loss: 0.9615, test_f1: 0.5005
 epoch: 93, train_loss: 0.9231, test_loss: 0.9597, test_f1: 0.4991
 epoch: 94, train_loss: 0.9334, test_loss: 0.9594, test_f1: 0.5015
 epoch: 95, train_loss: 0.9242, test_loss: 0.9598, test_f1: 0.5027
 epoch: 96, train_loss: 0.9333, test_loss: 0.9639, test_f1: 0.5053
 epoch: 97, train_loss: 0.9254, test_loss: 0.9621, test_f1: 0.5022
 epoch: 98, train_loss: 0.9258, test_loss: 0.9586, test_f1: 0.5055
 epoch: 99, train_loss: 0.9199, test_loss: 0.9654, test_f1: 0.5010
##################ITERATION #6 ****************************************
 epoch: 0, train_loss: 1.3232, test_loss: 1.3127, test_f1: 0.2270
 epoch: 1, train_loss: 1.2802, test_loss: 1.3129, test_f1: 0.2270
 epoch: 2, train_loss: 1.2660, test_loss: 1.2956, test_f1: 0.2270
 epoch: 3, train_loss: 1.2432, test_loss: 1.2655, test_f1: 0.2270
 epoch: 4, train_loss: 1.2332, test_loss: 1.2237, test_f1: 0.2671
 epoch: 5, train_loss: 1.2283, test_loss: 1.1935, test_f1: 0.2765
 epoch: 6, train_loss: 1.2154, test_loss: 1.1753, test_f1: 0.2929
 epoch: 7, train_loss: 1.2059, test_loss: 1.1654, test_f1: 0.3054
 epoch: 8, train_loss: 1.1948, test_loss: 1.1547, test_f1: 0.3173
 epoch: 9, train_loss: 1.1897, test_loss: 1.1475, test_f1: 0.3325
 epoch: 10, train_loss: 1.1831, test_loss: 1.1385, test_f1: 0.3482
 epoch: 11, train_loss: 1.1774, test_loss: 1.1319, test_f1: 0.3590
 epoch: 12, train_loss: 1.1677, test_loss: 1.1248, test_f1: 0.3622
 epoch: 13, train_loss: 1.1615, test_loss: 1.1167, test_f1: 0.3754
 epoch: 14, train_loss: 1.1508, test_loss: 1.1071, test_f1: 0.3817
 epoch: 15, train_loss: 1.1456, test_loss: 1.0992, test_f1: 0.3874
 epoch: 16, train_loss: 1.1434, test_loss: 1.0905, test_f1: 0.4041
 epoch: 17, train_loss: 1.1388, test_loss: 1.0841, test_f1: 0.4227
 epoch: 18, train_loss: 1.1272, test_loss: 1.0770, test_f1: 0.4298
 epoch: 19, train_loss: 1.1230, test_loss: 1.0718, test_f1: 0.4288
 epoch: 20, train_loss: 1.1275, test_loss: 1.0639, test_f1: 0.4372
 epoch: 21, train_loss: 1.1075, test_loss: 1.0578, test_f1: 0.4389
 epoch: 22, train_loss: 1.1087, test_loss: 1.0525, test_f1: 0.4459
 epoch: 23, train_loss: 1.1051, test_loss: 1.0467, test_f1: 0.4437
 epoch: 24, train_loss: 1.0926, test_loss: 1.0414, test_f1: 0.4473
 epoch: 25, train_loss: 1.0912, test_loss: 1.0371, test_f1: 0.4626
 epoch: 26, train_loss: 1.0798, test_loss: 1.0327, test_f1: 0.4531
 epoch: 27, train_loss: 1.0859, test_loss: 1.0258, test_f1: 0.4580
 epoch: 28, train_loss: 1.0812, test_loss: 1.0220, test_f1: 0.4597
 epoch: 29, train_loss: 1.0668, test_loss: 1.0195, test_f1: 0.4610
 epoch: 30, train_loss: 1.0613, test_loss: 1.0140, test_f1: 0.4720
 epoch: 31, train_loss: 1.0596, test_loss: 1.0106, test_f1: 0.4589
 epoch: 32, train_loss: 1.0512, test_loss: 1.0089, test_f1: 0.4596
 epoch: 33, train_loss: 1.0539, test_loss: 1.0038, test_f1: 0.4697
 epoch: 34, train_loss: 1.0491, test_loss: 0.9986, test_f1: 0.4634
 epoch: 35, train_loss: 1.0538, test_loss: 0.9964, test_f1: 0.4644
 epoch: 36, train_loss: 1.0393, test_loss: 0.9914, test_f1: 0.4623
 epoch: 37, train_loss: 1.0342, test_loss: 0.9886, test_f1: 0.4625
 epoch: 38, train_loss: 1.0362, test_loss: 0.9871, test_f1: 0.4595
 epoch: 39, train_loss: 1.0269, test_loss: 0.9857, test_f1: 0.4723
 epoch: 40, train_loss: 1.0249, test_loss: 0.9790, test_f1: 0.4785
 epoch: 41, train_loss: 1.0182, test_loss: 0.9772, test_f1: 0.4818
 epoch: 42, train_loss: 1.0135, test_loss: 0.9756, test_f1: 0.4782
 epoch: 43, train_loss: 1.0162, test_loss: 0.9717, test_f1: 0.4778
 epoch: 44, train_loss: 1.0049, test_loss: 0.9673, test_f1: 0.4820
 epoch: 45, train_loss: 1.0055, test_loss: 0.9641, test_f1: 0.4915
 epoch: 46, train_loss: 0.9942, test_loss: 0.9632, test_f1: 0.4748
 epoch: 47, train_loss: 0.9932, test_loss: 0.9606, test_f1: 0.4857
 epoch: 48, train_loss: 0.9910, test_loss: 0.9522, test_f1: 0.5051
 epoch: 49, train_loss: 0.9975, test_loss: 0.9506, test_f1: 0.5075
 epoch: 50, train_loss: 0.9866, test_loss: 0.9459, test_f1: 0.5098
 epoch: 51, train_loss: 0.9910, test_loss: 0.9445, test_f1: 0.5084
 epoch: 52, train_loss: 0.9769, test_loss: 0.9438, test_f1: 0.5111
 epoch: 53, train_loss: 0.9780, test_loss: 0.9449, test_f1: 0.5047
 epoch: 54, train_loss: 0.9811, test_loss: 0.9429, test_f1: 0.5074
 epoch: 55, train_loss: 0.9834, test_loss: 0.9425, test_f1: 0.5070
 epoch: 56, train_loss: 0.9749, test_loss: 0.9390, test_f1: 0.5067
 epoch: 57, train_loss: 0.9796, test_loss: 0.9389, test_f1: 0.5092
 epoch: 58, train_loss: 0.9774, test_loss: 0.9376, test_f1: 0.5108
 epoch: 59, train_loss: 0.9774, test_loss: 0.9375, test_f1: 0.5098
 epoch: 60, train_loss: 0.9779, test_loss: 0.9362, test_f1: 0.5118
 epoch: 61, train_loss: 0.9806, test_loss: 0.9367, test_f1: 0.5098
 epoch: 62, train_loss: 0.9718, test_loss: 0.9346, test_f1: 0.5079
 epoch: 63, train_loss: 0.9645, test_loss: 0.9329, test_f1: 0.5060
 epoch: 64, train_loss: 0.9648, test_loss: 0.9318, test_f1: 0.5090
 epoch: 65, train_loss: 0.9639, test_loss: 0.9295, test_f1: 0.5128
 epoch: 66, train_loss: 0.9621, test_loss: 0.9292, test_f1: 0.5121
 epoch: 67, train_loss: 0.9592, test_loss: 0.9267, test_f1: 0.5143
 epoch: 68, train_loss: 0.9602, test_loss: 0.9263, test_f1: 0.5140
 epoch: 69, train_loss: 0.9573, test_loss: 0.9259, test_f1: 0.5116
 epoch: 70, train_loss: 0.9668, test_loss: 0.9252, test_f1: 0.5139
 epoch: 71, train_loss: 0.9641, test_loss: 0.9250, test_f1: 0.5150
 epoch: 72, train_loss: 0.9574, test_loss: 0.9207, test_f1: 0.5181
 epoch: 73, train_loss: 0.9603, test_loss: 0.9187, test_f1: 0.5176
 epoch: 74, train_loss: 0.9595, test_loss: 0.9193, test_f1: 0.5201
 epoch: 75, train_loss: 0.9499, test_loss: 0.9199, test_f1: 0.5210
 epoch: 76, train_loss: 0.9602, test_loss: 0.9176, test_f1: 0.5192
 epoch: 77, train_loss: 0.9480, test_loss: 0.9168, test_f1: 0.5197
 epoch: 78, train_loss: 0.9512, test_loss: 0.9163, test_f1: 0.5212
 epoch: 79, train_loss: 0.9490, test_loss: 0.9144, test_f1: 0.5184
 epoch: 80, train_loss: 0.9394, test_loss: 0.9154, test_f1: 0.5245
 epoch: 81, train_loss: 0.9428, test_loss: 0.9139, test_f1: 0.5217
 epoch: 82, train_loss: 0.9411, test_loss: 0.9128, test_f1: 0.5193
 epoch: 83, train_loss: 0.9440, test_loss: 0.9121, test_f1: 0.5238
 epoch: 84, train_loss: 0.9484, test_loss: 0.9096, test_f1: 0.5194
 epoch: 85, train_loss: 0.9420, test_loss: 0.9105, test_f1: 0.5204
 epoch: 86, train_loss: 0.9405, test_loss: 0.9103, test_f1: 0.5248
 epoch: 87, train_loss: 0.9437, test_loss: 0.9114, test_f1: 0.5218
 epoch: 88, train_loss: 0.9362, test_loss: 0.9081, test_f1: 0.5195
 epoch: 89, train_loss: 0.9335, test_loss: 0.9083, test_f1: 0.5241
 epoch: 90, train_loss: 0.9457, test_loss: 0.9094, test_f1: 0.5236
 epoch: 91, train_loss: 0.9335, test_loss: 0.9072, test_f1: 0.5246
 epoch: 92, train_loss: 0.9370, test_loss: 0.9065, test_f1: 0.5248
 epoch: 93, train_loss: 0.9332, test_loss: 0.9077, test_f1: 0.5237
 epoch: 94, train_loss: 0.9376, test_loss: 0.9084, test_f1: 0.5192
 epoch: 95, train_loss: 0.9299, test_loss: 0.9069, test_f1: 0.5212
 epoch: 96, train_loss: 0.9250, test_loss: 0.9082, test_f1: 0.5244
 epoch: 97, train_loss: 0.9305, test_loss: 0.9057, test_f1: 0.5218
 epoch: 98, train_loss: 0.9283, test_loss: 0.9041, test_f1: 0.5297
 epoch: 99, train_loss: 0.9217, test_loss: 0.9045, test_f1: 0.5261
##################ITERATION #7 ****************************************
 epoch: 0, train_loss: 1.3630, test_loss: 1.3362, test_f1: 0.2270
 epoch: 1, train_loss: 1.3125, test_loss: 1.3205, test_f1: 0.2270
 epoch: 2, train_loss: 1.2807, test_loss: 1.3124, test_f1: 0.2270
 epoch: 3, train_loss: 1.2733, test_loss: 1.2847, test_f1: 0.2270
 epoch: 4, train_loss: 1.2523, test_loss: 1.2433, test_f1: 0.2270
 epoch: 5, train_loss: 1.2362, test_loss: 1.2193, test_f1: 0.2439
 epoch: 6, train_loss: 1.2283, test_loss: 1.2066, test_f1: 0.2595
 epoch: 7, train_loss: 1.2213, test_loss: 1.1955, test_f1: 0.2789
 epoch: 8, train_loss: 1.2114, test_loss: 1.1848, test_f1: 0.3149
 epoch: 9, train_loss: 1.1971, test_loss: 1.1762, test_f1: 0.3363
 epoch: 10, train_loss: 1.1913, test_loss: 1.1668, test_f1: 0.3494
 epoch: 11, train_loss: 1.1838, test_loss: 1.1556, test_f1: 0.3691
 epoch: 12, train_loss: 1.1801, test_loss: 1.1471, test_f1: 0.3789
 epoch: 13, train_loss: 1.1785, test_loss: 1.1380, test_f1: 0.4033
 epoch: 14, train_loss: 1.1603, test_loss: 1.1306, test_f1: 0.4134
 epoch: 15, train_loss: 1.1551, test_loss: 1.1225, test_f1: 0.4313
 epoch: 16, train_loss: 1.1473, test_loss: 1.1138, test_f1: 0.4336
 epoch: 17, train_loss: 1.1332, test_loss: 1.1046, test_f1: 0.4323
 epoch: 18, train_loss: 1.1264, test_loss: 1.0939, test_f1: 0.4349
 epoch: 19, train_loss: 1.1173, test_loss: 1.0853, test_f1: 0.4378
 epoch: 20, train_loss: 1.1148, test_loss: 1.0778, test_f1: 0.4420
 epoch: 21, train_loss: 1.1044, test_loss: 1.0712, test_f1: 0.4438
 epoch: 22, train_loss: 1.0964, test_loss: 1.0633, test_f1: 0.4482
 epoch: 23, train_loss: 1.0840, test_loss: 1.0556, test_f1: 0.4580
 epoch: 24, train_loss: 1.0866, test_loss: 1.0467, test_f1: 0.4588
 epoch: 25, train_loss: 1.0828, test_loss: 1.0398, test_f1: 0.4637
 epoch: 26, train_loss: 1.0720, test_loss: 1.0316, test_f1: 0.4671
 epoch: 27, train_loss: 1.0696, test_loss: 1.0258, test_f1: 0.4691
 epoch: 28, train_loss: 1.0585, test_loss: 1.0197, test_f1: 0.4710
 epoch: 29, train_loss: 1.0568, test_loss: 1.0154, test_f1: 0.4719
 epoch: 30, train_loss: 1.0477, test_loss: 1.0116, test_f1: 0.4693
 epoch: 31, train_loss: 1.0496, test_loss: 1.0069, test_f1: 0.4754
 epoch: 32, train_loss: 1.0389, test_loss: 1.0032, test_f1: 0.4737
 epoch: 33, train_loss: 1.0309, test_loss: 0.9984, test_f1: 0.4760
 epoch: 34, train_loss: 1.0246, test_loss: 0.9949, test_f1: 0.4775
 epoch: 35, train_loss: 1.0258, test_loss: 0.9918, test_f1: 0.4787
 epoch: 36, train_loss: 1.0124, test_loss: 0.9893, test_f1: 0.4787
 epoch: 37, train_loss: 1.0135, test_loss: 0.9885, test_f1: 0.4837
 epoch: 38, train_loss: 1.0077, test_loss: 0.9816, test_f1: 0.4807
 epoch: 39, train_loss: 1.0008, test_loss: 0.9795, test_f1: 0.4815
 epoch: 40, train_loss: 1.0061, test_loss: 0.9815, test_f1: 0.4810
 epoch: 41, train_loss: 0.9905, test_loss: 0.9784, test_f1: 0.4809
 epoch: 42, train_loss: 1.0005, test_loss: 0.9766, test_f1: 0.4816
 epoch: 43, train_loss: 0.9878, test_loss: 0.9776, test_f1: 0.4865
 epoch: 44, train_loss: 0.9841, test_loss: 0.9789, test_f1: 0.4815
 epoch: 45, train_loss: 0.9803, test_loss: 0.9749, test_f1: 0.4925
 epoch: 46, train_loss: 0.9811, test_loss: 0.9711, test_f1: 0.4862
 epoch: 47, train_loss: 0.9768, test_loss: 0.9692, test_f1: 0.4901
 epoch: 48, train_loss: 0.9729, test_loss: 0.9646, test_f1: 0.4905
 epoch: 49, train_loss: 0.9719, test_loss: 0.9613, test_f1: 0.4958
 epoch: 50, train_loss: 0.9647, test_loss: 0.9664, test_f1: 0.4985
 epoch: 51, train_loss: 0.9591, test_loss: 0.9610, test_f1: 0.4951
 epoch: 52, train_loss: 0.9698, test_loss: 0.9619, test_f1: 0.4940
 epoch: 53, train_loss: 0.9705, test_loss: 0.9639, test_f1: 0.4888
 epoch: 54, train_loss: 0.9615, test_loss: 0.9652, test_f1: 0.4921
 epoch: 55, train_loss: 0.9596, test_loss: 0.9643, test_f1: 0.4887
 epoch: 56, train_loss: 0.9549, test_loss: 0.9603, test_f1: 0.4919
 epoch: 57, train_loss: 0.9577, test_loss: 0.9586, test_f1: 0.4909
 epoch: 58, train_loss: 0.9489, test_loss: 0.9590, test_f1: 0.4894
 epoch: 59, train_loss: 0.9555, test_loss: 0.9611, test_f1: 0.4903
 epoch: 60, train_loss: 0.9573, test_loss: 0.9647, test_f1: 0.4921
 epoch: 61, train_loss: 0.9524, test_loss: 0.9603, test_f1: 0.4936
 epoch: 62, train_loss: 0.9545, test_loss: 0.9627, test_f1: 0.4956
 epoch: 63, train_loss: 0.9609, test_loss: 0.9591, test_f1: 0.5058
 epoch: 64, train_loss: 0.9582, test_loss: 0.9630, test_f1: 0.5064
 epoch: 65, train_loss: 0.9560, test_loss: 0.9667, test_f1: 0.4982
 epoch: 66, train_loss: 0.9508, test_loss: 0.9683, test_f1: 0.4950
 epoch: 67, train_loss: 0.9519, test_loss: 0.9599, test_f1: 0.4950
 epoch: 68, train_loss: 0.9463, test_loss: 0.9596, test_f1: 0.4937
 epoch: 69, train_loss: 0.9473, test_loss: 0.9586, test_f1: 0.5004
 epoch: 70, train_loss: 0.9418, test_loss: 0.9676, test_f1: 0.4990
 epoch: 71, train_loss: 0.9490, test_loss: 0.9617, test_f1: 0.5011
 epoch: 72, train_loss: 0.9412, test_loss: 0.9620, test_f1: 0.4980
 epoch: 73, train_loss: 0.9443, test_loss: 0.9633, test_f1: 0.4983
 epoch: 74, train_loss: 0.9437, test_loss: 0.9630, test_f1: 0.5044
 epoch: 75, train_loss: 0.9427, test_loss: 0.9608, test_f1: 0.5032
 epoch: 76, train_loss: 0.9341, test_loss: 0.9665, test_f1: 0.4995
 epoch: 77, train_loss: 0.9368, test_loss: 0.9655, test_f1: 0.5011
 epoch: 78, train_loss: 0.9340, test_loss: 0.9641, test_f1: 0.4974
 epoch: 79, train_loss: 0.9368, test_loss: 0.9610, test_f1: 0.4993
 epoch: 80, train_loss: 0.9316, test_loss: 0.9663, test_f1: 0.4984
 epoch: 81, train_loss: 0.9396, test_loss: 0.9649, test_f1: 0.5020
 epoch: 82, train_loss: 0.9360, test_loss: 0.9621, test_f1: 0.4991
 epoch: 83, train_loss: 0.9333, test_loss: 0.9619, test_f1: 0.4966
 epoch: 84, train_loss: 0.9331, test_loss: 0.9641, test_f1: 0.4980
 epoch: 85, train_loss: 0.9337, test_loss: 0.9645, test_f1: 0.5009
 epoch: 86, train_loss: 0.9320, test_loss: 0.9664, test_f1: 0.4963
 epoch: 87, train_loss: 0.9230, test_loss: 0.9669, test_f1: 0.5003
 epoch: 88, train_loss: 0.9204, test_loss: 0.9704, test_f1: 0.5003
 epoch: 89, train_loss: 0.9383, test_loss: 0.9655, test_f1: 0.5006
 epoch: 90, train_loss: 0.9312, test_loss: 0.9689, test_f1: 0.4994
 epoch: 91, train_loss: 0.9204, test_loss: 0.9684, test_f1: 0.5097
 epoch: 92, train_loss: 0.9307, test_loss: 0.9647, test_f1: 0.5040
 epoch: 93, train_loss: 0.9323, test_loss: 0.9738, test_f1: 0.5078
 epoch: 94, train_loss: 0.9248, test_loss: 0.9680, test_f1: 0.5011
 epoch: 95, train_loss: 0.9224, test_loss: 0.9726, test_f1: 0.5017
 epoch: 96, train_loss: 0.9190, test_loss: 0.9740, test_f1: 0.4965
 epoch: 97, train_loss: 0.9167, test_loss: 0.9704, test_f1: 0.5076
 epoch: 98, train_loss: 0.9142, test_loss: 0.9721, test_f1: 0.5040
 epoch: 99, train_loss: 0.9183, test_loss: 0.9748, test_f1: 0.4957
##################ITERATION #8 ****************************************
 epoch: 0, train_loss: 1.3434, test_loss: 1.3133, test_f1: 0.2270
 epoch: 1, train_loss: 1.2751, test_loss: 1.2965, test_f1: 0.2270
 epoch: 2, train_loss: 1.2500, test_loss: 1.2829, test_f1: 0.2270
 epoch: 3, train_loss: 1.2289, test_loss: 1.2540, test_f1: 0.2521
 epoch: 4, train_loss: 1.2200, test_loss: 1.2120, test_f1: 0.2587
 epoch: 5, train_loss: 1.2084, test_loss: 1.1711, test_f1: 0.3347
 epoch: 6, train_loss: 1.2022, test_loss: 1.1529, test_f1: 0.3553
 epoch: 7, train_loss: 1.1882, test_loss: 1.1382, test_f1: 0.3694
 epoch: 8, train_loss: 1.1768, test_loss: 1.1291, test_f1: 0.3895
 epoch: 9, train_loss: 1.1754, test_loss: 1.1203, test_f1: 0.3993
 epoch: 10, train_loss: 1.1620, test_loss: 1.1120, test_f1: 0.4172
 epoch: 11, train_loss: 1.1569, test_loss: 1.1045, test_f1: 0.4229
 epoch: 12, train_loss: 1.1493, test_loss: 1.0970, test_f1: 0.4346
 epoch: 13, train_loss: 1.1388, test_loss: 1.0911, test_f1: 0.4367
 epoch: 14, train_loss: 1.1326, test_loss: 1.0842, test_f1: 0.4390
 epoch: 15, train_loss: 1.1381, test_loss: 1.0779, test_f1: 0.4572
 epoch: 16, train_loss: 1.1263, test_loss: 1.0701, test_f1: 0.4619
 epoch: 17, train_loss: 1.1146, test_loss: 1.0644, test_f1: 0.4613
 epoch: 18, train_loss: 1.1079, test_loss: 1.0573, test_f1: 0.4561
 epoch: 19, train_loss: 1.0976, test_loss: 1.0513, test_f1: 0.4654
 epoch: 20, train_loss: 1.1003, test_loss: 1.0449, test_f1: 0.4669
 epoch: 21, train_loss: 1.0825, test_loss: 1.0387, test_f1: 0.4714
 epoch: 22, train_loss: 1.0870, test_loss: 1.0322, test_f1: 0.4746
 epoch: 23, train_loss: 1.0893, test_loss: 1.0278, test_f1: 0.4743
 epoch: 24, train_loss: 1.0745, test_loss: 1.0211, test_f1: 0.4789
 epoch: 25, train_loss: 1.0593, test_loss: 1.0151, test_f1: 0.4773
 epoch: 26, train_loss: 1.0649, test_loss: 1.0114, test_f1: 0.4762
 epoch: 27, train_loss: 1.0582, test_loss: 1.0052, test_f1: 0.4752
 epoch: 28, train_loss: 1.0527, test_loss: 1.0013, test_f1: 0.4816
 epoch: 29, train_loss: 1.0463, test_loss: 0.9962, test_f1: 0.4807
 epoch: 30, train_loss: 1.0411, test_loss: 0.9920, test_f1: 0.4850
 epoch: 31, train_loss: 1.0315, test_loss: 0.9877, test_f1: 0.4830
 epoch: 32, train_loss: 1.0352, test_loss: 0.9838, test_f1: 0.4858
 epoch: 33, train_loss: 1.0253, test_loss: 0.9788, test_f1: 0.4912
 epoch: 34, train_loss: 1.0216, test_loss: 0.9771, test_f1: 0.4901
 epoch: 35, train_loss: 1.0181, test_loss: 0.9711, test_f1: 0.4871
 epoch: 36, train_loss: 1.0101, test_loss: 0.9688, test_f1: 0.4901
 epoch: 37, train_loss: 1.0019, test_loss: 0.9676, test_f1: 0.4830
 epoch: 38, train_loss: 1.0027, test_loss: 0.9644, test_f1: 0.4847
 epoch: 39, train_loss: 1.0002, test_loss: 0.9606, test_f1: 0.4835
 epoch: 40, train_loss: 1.0011, test_loss: 0.9573, test_f1: 0.4899
 epoch: 41, train_loss: 0.9871, test_loss: 0.9562, test_f1: 0.4828
 epoch: 42, train_loss: 0.9888, test_loss: 0.9548, test_f1: 0.4879
 epoch: 43, train_loss: 0.9869, test_loss: 0.9559, test_f1: 0.4872
 epoch: 44, train_loss: 0.9885, test_loss: 0.9519, test_f1: 0.4868
 epoch: 45, train_loss: 0.9789, test_loss: 0.9528, test_f1: 0.4835
 epoch: 46, train_loss: 0.9887, test_loss: 0.9527, test_f1: 0.4863
 epoch: 47, train_loss: 0.9740, test_loss: 0.9512, test_f1: 0.4886
 epoch: 48, train_loss: 0.9684, test_loss: 0.9493, test_f1: 0.5021
 epoch: 49, train_loss: 0.9740, test_loss: 0.9573, test_f1: 0.4960
 epoch: 50, train_loss: 0.9621, test_loss: 0.9544, test_f1: 0.5026
 epoch: 51, train_loss: 0.9661, test_loss: 0.9542, test_f1: 0.4959
 epoch: 52, train_loss: 0.9619, test_loss: 0.9519, test_f1: 0.4953
 epoch: 53, train_loss: 0.9493, test_loss: 0.9523, test_f1: 0.4991
 epoch: 54, train_loss: 0.9605, test_loss: 0.9519, test_f1: 0.5036
 epoch: 55, train_loss: 0.9545, test_loss: 0.9478, test_f1: 0.5065
 epoch: 56, train_loss: 0.9564, test_loss: 0.9501, test_f1: 0.5031
 epoch: 57, train_loss: 0.9601, test_loss: 0.9536, test_f1: 0.5025
 epoch: 58, train_loss: 0.9520, test_loss: 0.9521, test_f1: 0.5025
 epoch: 59, train_loss: 0.9441, test_loss: 0.9519, test_f1: 0.5010
 epoch: 60, train_loss: 0.9492, test_loss: 0.9478, test_f1: 0.5042
 epoch: 61, train_loss: 0.9505, test_loss: 0.9450, test_f1: 0.5000
 epoch: 62, train_loss: 0.9420, test_loss: 0.9478, test_f1: 0.4991
 epoch: 63, train_loss: 0.9522, test_loss: 0.9476, test_f1: 0.5062
 epoch: 64, train_loss: 0.9439, test_loss: 0.9500, test_f1: 0.5050
 epoch: 65, train_loss: 0.9448, test_loss: 0.9491, test_f1: 0.5101
 epoch: 66, train_loss: 0.9434, test_loss: 0.9430, test_f1: 0.5076
 epoch: 67, train_loss: 0.9469, test_loss: 0.9389, test_f1: 0.5031
 epoch: 68, train_loss: 0.9408, test_loss: 0.9407, test_f1: 0.5035
 epoch: 69, train_loss: 0.9508, test_loss: 0.9397, test_f1: 0.5098
 epoch: 70, train_loss: 0.9360, test_loss: 0.9428, test_f1: 0.5075
 epoch: 71, train_loss: 0.9377, test_loss: 0.9425, test_f1: 0.5066
 epoch: 72, train_loss: 0.9412, test_loss: 0.9420, test_f1: 0.5098
 epoch: 73, train_loss: 0.9314, test_loss: 0.9483, test_f1: 0.5090
 epoch: 74, train_loss: 0.9287, test_loss: 0.9396, test_f1: 0.5067
 epoch: 75, train_loss: 0.9322, test_loss: 0.9385, test_f1: 0.5074
 epoch: 76, train_loss: 0.9254, test_loss: 0.9378, test_f1: 0.5053
 epoch: 77, train_loss: 0.9288, test_loss: 0.9417, test_f1: 0.5115
 epoch: 78, train_loss: 0.9301, test_loss: 0.9433, test_f1: 0.5098
 epoch: 79, train_loss: 0.9325, test_loss: 0.9501, test_f1: 0.5099
 epoch: 80, train_loss: 0.9305, test_loss: 0.9446, test_f1: 0.5134
 epoch: 81, train_loss: 0.9261, test_loss: 0.9405, test_f1: 0.5147
 epoch: 82, train_loss: 0.9314, test_loss: 0.9416, test_f1: 0.5095
 epoch: 83, train_loss: 0.9193, test_loss: 0.9417, test_f1: 0.5076
 epoch: 84, train_loss: 0.9235, test_loss: 0.9400, test_f1: 0.5099
 epoch: 85, train_loss: 0.9245, test_loss: 0.9393, test_f1: 0.5151
 epoch: 86, train_loss: 0.9182, test_loss: 0.9374, test_f1: 0.5082
 epoch: 87, train_loss: 0.9266, test_loss: 0.9379, test_f1: 0.5079
 epoch: 88, train_loss: 0.9186, test_loss: 0.9359, test_f1: 0.5085
 epoch: 89, train_loss: 0.9205, test_loss: 0.9396, test_f1: 0.5146
 epoch: 90, train_loss: 0.9157, test_loss: 0.9351, test_f1: 0.5153
 epoch: 91, train_loss: 0.9149, test_loss: 0.9346, test_f1: 0.5166
 epoch: 92, train_loss: 0.9180, test_loss: 0.9358, test_f1: 0.5153
 epoch: 93, train_loss: 0.9126, test_loss: 0.9387, test_f1: 0.5132
 epoch: 94, train_loss: 0.9229, test_loss: 0.9371, test_f1: 0.5113
 epoch: 95, train_loss: 0.9153, test_loss: 0.9399, test_f1: 0.5100
 epoch: 96, train_loss: 0.9146, test_loss: 0.9435, test_f1: 0.5116
 epoch: 97, train_loss: 0.9079, test_loss: 0.9414, test_f1: 0.5137
 epoch: 98, train_loss: 0.9106, test_loss: 0.9391, test_f1: 0.5152
 epoch: 99, train_loss: 0.9111, test_loss: 0.9415, test_f1: 0.5156
##################ITERATION #9 ****************************************
 epoch: 0, train_loss: 1.4101, test_loss: 1.3759, test_f1: 0.2270
 epoch: 1, train_loss: 1.3318, test_loss: 1.3619, test_f1: 0.2270
 epoch: 2, train_loss: 1.2873, test_loss: 1.3332, test_f1: 0.2270
 epoch: 3, train_loss: 1.2641, test_loss: 1.2725, test_f1: 0.2554
 epoch: 4, train_loss: 1.2496, test_loss: 1.2193, test_f1: 0.3259
 epoch: 5, train_loss: 1.2316, test_loss: 1.1909, test_f1: 0.3447
 epoch: 6, train_loss: 1.2181, test_loss: 1.1746, test_f1: 0.3496
 epoch: 7, train_loss: 1.2063, test_loss: 1.1643, test_f1: 0.3608
 epoch: 8, train_loss: 1.1923, test_loss: 1.1534, test_f1: 0.3640
 epoch: 9, train_loss: 1.1860, test_loss: 1.1443, test_f1: 0.3638
 epoch: 10, train_loss: 1.1752, test_loss: 1.1351, test_f1: 0.3824
 epoch: 11, train_loss: 1.1642, test_loss: 1.1252, test_f1: 0.3904
 epoch: 12, train_loss: 1.1546, test_loss: 1.1135, test_f1: 0.4044
 epoch: 13, train_loss: 1.1536, test_loss: 1.1028, test_f1: 0.4253
 epoch: 14, train_loss: 1.1440, test_loss: 1.0946, test_f1: 0.4259
 epoch: 15, train_loss: 1.1316, test_loss: 1.0853, test_f1: 0.4282
 epoch: 16, train_loss: 1.1240, test_loss: 1.0782, test_f1: 0.4352
 epoch: 17, train_loss: 1.1126, test_loss: 1.0695, test_f1: 0.4381
 epoch: 18, train_loss: 1.1100, test_loss: 1.0629, test_f1: 0.4454
 epoch: 19, train_loss: 1.1042, test_loss: 1.0545, test_f1: 0.4457
 epoch: 20, train_loss: 1.0951, test_loss: 1.0485, test_f1: 0.4497
 epoch: 21, train_loss: 1.0919, test_loss: 1.0411, test_f1: 0.4459
 epoch: 22, train_loss: 1.0773, test_loss: 1.0349, test_f1: 0.4482
 epoch: 23, train_loss: 1.0741, test_loss: 1.0315, test_f1: 0.4501
 epoch: 24, train_loss: 1.0622, test_loss: 1.0262, test_f1: 0.4510
 epoch: 25, train_loss: 1.0625, test_loss: 1.0201, test_f1: 0.4660
 epoch: 26, train_loss: 1.0579, test_loss: 1.0189, test_f1: 0.4572
 epoch: 27, train_loss: 1.0544, test_loss: 1.0128, test_f1: 0.4648
 epoch: 28, train_loss: 1.0520, test_loss: 1.0086, test_f1: 0.4583
 epoch: 29, train_loss: 1.0362, test_loss: 1.0043, test_f1: 0.4664
 epoch: 30, train_loss: 1.0283, test_loss: 1.0012, test_f1: 0.4711
 epoch: 31, train_loss: 1.0273, test_loss: 0.9966, test_f1: 0.4764
 epoch: 32, train_loss: 1.0242, test_loss: 0.9942, test_f1: 0.4672
 epoch: 33, train_loss: 1.0286, test_loss: 0.9907, test_f1: 0.4899
 epoch: 34, train_loss: 1.0132, test_loss: 0.9905, test_f1: 0.4960
 epoch: 35, train_loss: 1.0107, test_loss: 0.9848, test_f1: 0.4926
 epoch: 36, train_loss: 1.0065, test_loss: 0.9856, test_f1: 0.4942
 epoch: 37, train_loss: 1.0054, test_loss: 0.9841, test_f1: 0.4836
 epoch: 38, train_loss: 1.0055, test_loss: 0.9800, test_f1: 0.4874
 epoch: 39, train_loss: 1.0009, test_loss: 0.9808, test_f1: 0.4934
 epoch: 40, train_loss: 0.9970, test_loss: 0.9771, test_f1: 0.4821
 epoch: 41, train_loss: 0.9916, test_loss: 0.9750, test_f1: 0.4890
 epoch: 42, train_loss: 0.9853, test_loss: 0.9723, test_f1: 0.4914
 epoch: 43, train_loss: 0.9910, test_loss: 0.9716, test_f1: 0.4852
 epoch: 44, train_loss: 0.9856, test_loss: 0.9730, test_f1: 0.4921
 epoch: 45, train_loss: 0.9733, test_loss: 0.9703, test_f1: 0.5033
 epoch: 46, train_loss: 0.9864, test_loss: 0.9725, test_f1: 0.4994
 epoch: 47, train_loss: 0.9692, test_loss: 0.9720, test_f1: 0.5019
 epoch: 48, train_loss: 0.9707, test_loss: 0.9677, test_f1: 0.4957
 epoch: 49, train_loss: 0.9705, test_loss: 0.9678, test_f1: 0.4962
 epoch: 50, train_loss: 0.9581, test_loss: 0.9660, test_f1: 0.4975
 epoch: 51, train_loss: 0.9628, test_loss: 0.9658, test_f1: 0.5026
 epoch: 52, train_loss: 0.9629, test_loss: 0.9641, test_f1: 0.4922
 epoch: 53, train_loss: 0.9581, test_loss: 0.9625, test_f1: 0.4919
 epoch: 54, train_loss: 0.9577, test_loss: 0.9614, test_f1: 0.4911
 epoch: 55, train_loss: 0.9558, test_loss: 0.9608, test_f1: 0.4979
 epoch: 56, train_loss: 0.9547, test_loss: 0.9600, test_f1: 0.5013
 epoch: 57, train_loss: 0.9480, test_loss: 0.9579, test_f1: 0.5052
 epoch: 58, train_loss: 0.9478, test_loss: 0.9570, test_f1: 0.5022
 epoch: 59, train_loss: 0.9441, test_loss: 0.9597, test_f1: 0.5002
 epoch: 60, train_loss: 0.9429, test_loss: 0.9551, test_f1: 0.4998
 epoch: 61, train_loss: 0.9433, test_loss: 0.9537, test_f1: 0.5032
 epoch: 62, train_loss: 0.9522, test_loss: 0.9541, test_f1: 0.5032
 epoch: 63, train_loss: 0.9478, test_loss: 0.9530, test_f1: 0.5068
 epoch: 64, train_loss: 0.9425, test_loss: 0.9545, test_f1: 0.4998
 epoch: 65, train_loss: 0.9418, test_loss: 0.9554, test_f1: 0.5034
 epoch: 66, train_loss: 0.9339, test_loss: 0.9555, test_f1: 0.4949
 epoch: 67, train_loss: 0.9391, test_loss: 0.9525, test_f1: 0.4989
 epoch: 68, train_loss: 0.9330, test_loss: 0.9532, test_f1: 0.5002
 epoch: 69, train_loss: 0.9355, test_loss: 0.9532, test_f1: 0.4980
 epoch: 70, train_loss: 0.9372, test_loss: 0.9527, test_f1: 0.4933
 epoch: 71, train_loss: 0.9324, test_loss: 0.9528, test_f1: 0.4964
 epoch: 72, train_loss: 0.9281, test_loss: 0.9506, test_f1: 0.4967
 epoch: 73, train_loss: 0.9343, test_loss: 0.9503, test_f1: 0.4967
 epoch: 74, train_loss: 0.9279, test_loss: 0.9499, test_f1: 0.4925
 epoch: 75, train_loss: 0.9294, test_loss: 0.9512, test_f1: 0.4960
 epoch: 76, train_loss: 0.9318, test_loss: 0.9509, test_f1: 0.4968
 epoch: 77, train_loss: 0.9199, test_loss: 0.9496, test_f1: 0.4948
 epoch: 78, train_loss: 0.9305, test_loss: 0.9466, test_f1: 0.5013
 epoch: 79, train_loss: 0.9193, test_loss: 0.9483, test_f1: 0.4989
 epoch: 80, train_loss: 0.9211, test_loss: 0.9467, test_f1: 0.4954
 epoch: 81, train_loss: 0.9135, test_loss: 0.9446, test_f1: 0.5032
 epoch: 82, train_loss: 0.9188, test_loss: 0.9448, test_f1: 0.4986
 epoch: 83, train_loss: 0.9183, test_loss: 0.9474, test_f1: 0.5033
 epoch: 84, train_loss: 0.9175, test_loss: 0.9438, test_f1: 0.4994
 epoch: 85, train_loss: 0.9196, test_loss: 0.9479, test_f1: 0.5009
 epoch: 86, train_loss: 0.9169, test_loss: 0.9449, test_f1: 0.4984
 epoch: 87, train_loss: 0.9187, test_loss: 0.9429, test_f1: 0.4958
 epoch: 88, train_loss: 0.9159, test_loss: 0.9457, test_f1: 0.4947
 epoch: 89, train_loss: 0.9078, test_loss: 0.9433, test_f1: 0.4919
 epoch: 90, train_loss: 0.9117, test_loss: 0.9425, test_f1: 0.4890
 epoch: 91, train_loss: 0.9089, test_loss: 0.9396, test_f1: 0.5054
 epoch: 92, train_loss: 0.9027, test_loss: 0.9376, test_f1: 0.5035
 epoch: 93, train_loss: 0.9097, test_loss: 0.9408, test_f1: 0.5072
 epoch: 94, train_loss: 0.9031, test_loss: 0.9423, test_f1: 0.4932
 epoch: 95, train_loss: 0.9023, test_loss: 0.9437, test_f1: 0.4949
 epoch: 96, train_loss: 0.9175, test_loss: 0.9426, test_f1: 0.4957
 epoch: 97, train_loss: 0.9044, test_loss: 0.9436, test_f1: 0.4957
 epoch: 98, train_loss: 0.9057, test_loss: 0.9451, test_f1: 0.4983
 epoch: 99, train_loss: 0.9024, test_loss: 0.9420, test_f1: 0.4991

Training completed in 397.58 seconds
Best F1: 0.5297 at epoch 98
Mean F1 across iterations: 0.5098  0.0105
========================FINAL RESULTS================================
FEGIN weighted F1: 0.5297  0.0105
python main.py --data ltspice_examples --representation component_net --model FEGIN --layers 4 --hiddens 32 --batch_size 256 --lr 0.0001 --emb_size 512 --epochs 100 --save_appendix component_net_L4_H32_BS256_LR0.0001_E512 --no_val
-----



STDERR:
  File "main.py", line 370, in <module>
    main()
  File "main.py", line 254, in main
    dataset = dataset_class(
  File "/home/philip/projects/ltspice_examples_code_repo/Circuit-Completion-Using-GNNs/component_classification_with_link_prediction_head/evaluation/FEGIN/kernel/circuit_datasets.py", line 15, in __init__
    self.data, self.slices = torch.load(self.processed_paths[0])
  File "/home/philip/.local/lib/python3.8/site-packages/torch/serialization.py", line 1040, in load
    warnings.warn(
  File "/usr/lib/python3.8/warnings.py", line 109, in _showwarnmsg
    sw(msg.message, msg.category, msg.filename, msg.lineno,
  File "main.py", line 47, in warn_with_traceback
    traceback.print_stack(file=log)
/home/philip/projects/ltspice_examples_code_repo/Circuit-Completion-Using-GNNs/component_classification_with_link_prediction_head/evaluation/FEGIN/kernel/circuit_datasets.py:15: FutureWarning: You are using `torch.load` with `weights_only=False` (the current default value), which uses the default pickle module implicitly. It is possible to construct malicious pickle data which will execute arbitrary code during unpickling (See https://github.com/pytorch/pytorch/blob/main/SECURITY.md#untrusted-models for more details). In a future release, the default value for `weights_only` will be flipped to `True`. This limits the functions that could be executed during unpickling. Arbitrary objects will no longer be allowed to be loaded via this mode unless they are explicitly allowlisted by the user via `torch.serialization.add_safe_globals`. We recommend you start setting `weights_only=True` for any use case where you don't have full control of the loaded file. Please open an issue on GitHub for any issues related to this experimental feature.
  self.data, self.slices = torch.load(self.processed_paths[0])
