STDOUT:
Results will be saved in /home/philip/projects/ltspice_examples_code_repo/Circuit-Completion-Using-GNNs/component_classification_with_link_prediction_head/evaluation/FEGIN/results/model_FEGIN_dataset_ltspice_examples
Command line input: python main.py --data ltspice_examples --representation component_pin --model FEGIN --layers 3 --hiddens 64 --batch_size 128 --lr 0.01 --emb_size 250 --epochs 100 --save_appendix component_pin_L3_H64_BS128_LR0.01_E250 --no_val
 is saved.
-----
ltspice_examples - FEGIN
Using 3 layers, 64 hidden units, h = 2
Loading component_pin representation dataset
ENTERED
Training FEGIN on component_pin representation
Train: 3560, Test: 848
##################ITERATION #0 ****************************************
 epoch: 0, train_loss: 1.1775, test_loss: 1.1448, test_f1: 0.3960
 epoch: 1, train_loss: 1.0196, test_loss: 1.0211, test_f1: 0.4256
 epoch: 2, train_loss: 0.9770, test_loss: 0.9806, test_f1: 0.5380
 epoch: 3, train_loss: 0.9398, test_loss: 0.9241, test_f1: 0.5579
 epoch: 4, train_loss: 0.9015, test_loss: 0.9850, test_f1: 0.5134
 epoch: 5, train_loss: 0.8744, test_loss: 1.0520, test_f1: 0.4854
 epoch: 6, train_loss: 0.8649, test_loss: 1.0769, test_f1: 0.4669
 epoch: 7, train_loss: 0.8487, test_loss: 0.9669, test_f1: 0.5398
 epoch: 8, train_loss: 0.8266, test_loss: 0.7941, test_f1: 0.5370
 epoch: 9, train_loss: 0.8180, test_loss: 0.8707, test_f1: 0.5382
 epoch: 10, train_loss: 0.8029, test_loss: 0.8611, test_f1: 0.5415
 epoch: 11, train_loss: 0.7928, test_loss: 0.9891, test_f1: 0.4885
 epoch: 12, train_loss: 0.7603, test_loss: 0.8624, test_f1: 0.5638
 epoch: 13, train_loss: 0.7664, test_loss: 0.8881, test_f1: 0.5851
 epoch: 14, train_loss: 0.7515, test_loss: 0.8578, test_f1: 0.5408
 epoch: 15, train_loss: 0.7530, test_loss: 0.8278, test_f1: 0.5626
 epoch: 16, train_loss: 0.7411, test_loss: 0.8702, test_f1: 0.5762
 epoch: 17, train_loss: 0.7431, test_loss: 0.9425, test_f1: 0.5077
 epoch: 18, train_loss: 0.7172, test_loss: 0.8933, test_f1: 0.5946
 epoch: 19, train_loss: 0.7028, test_loss: 0.8622, test_f1: 0.6060
 epoch: 20, train_loss: 0.6829, test_loss: 1.0495, test_f1: 0.5528
 epoch: 21, train_loss: 0.7062, test_loss: 0.9122, test_f1: 0.5631
 epoch: 22, train_loss: 0.6847, test_loss: 0.8887, test_f1: 0.5755
 epoch: 23, train_loss: 0.6817, test_loss: 0.8360, test_f1: 0.6045
 epoch: 24, train_loss: 0.6628, test_loss: 1.0561, test_f1: 0.5454
 epoch: 25, train_loss: 0.6563, test_loss: 0.8672, test_f1: 0.6421
 epoch: 26, train_loss: 0.6656, test_loss: 0.9339, test_f1: 0.6040
 epoch: 27, train_loss: 0.6559, test_loss: 0.9493, test_f1: 0.5794
 epoch: 28, train_loss: 0.6505, test_loss: 0.9363, test_f1: 0.5436
 epoch: 29, train_loss: 0.6612, test_loss: 1.0828, test_f1: 0.5070
 epoch: 30, train_loss: 0.6449, test_loss: 1.0859, test_f1: 0.5579
 epoch: 31, train_loss: 0.6291, test_loss: 1.0512, test_f1: 0.6100
 epoch: 32, train_loss: 0.6202, test_loss: 0.9470, test_f1: 0.5946
 epoch: 33, train_loss: 0.6084, test_loss: 1.0996, test_f1: 0.5617
 epoch: 34, train_loss: 0.5939, test_loss: 0.8597, test_f1: 0.6149
 epoch: 35, train_loss: 0.5666, test_loss: 0.9939, test_f1: 0.6752
 epoch: 36, train_loss: 0.5812, test_loss: 0.7953, test_f1: 0.6283
 epoch: 37, train_loss: 0.6066, test_loss: 0.9918, test_f1: 0.5740
 epoch: 38, train_loss: 0.6012, test_loss: 0.8317, test_f1: 0.6786
 epoch: 39, train_loss: 0.5924, test_loss: 0.9627, test_f1: 0.6400
 epoch: 40, train_loss: 0.5652, test_loss: 0.8180, test_f1: 0.6348
 epoch: 41, train_loss: 0.5569, test_loss: 0.8742, test_f1: 0.6157
 epoch: 42, train_loss: 0.5434, test_loss: 0.9211, test_f1: 0.6402
 epoch: 43, train_loss: 0.5463, test_loss: 0.7094, test_f1: 0.6633
 epoch: 44, train_loss: 0.5320, test_loss: 0.7765, test_f1: 0.6330
 epoch: 45, train_loss: 0.5334, test_loss: 0.9827, test_f1: 0.6503
 epoch: 46, train_loss: 0.5326, test_loss: 0.8381, test_f1: 0.6646
 epoch: 47, train_loss: 0.5130, test_loss: 1.1871, test_f1: 0.5528
 epoch: 48, train_loss: 0.5285, test_loss: 0.9563, test_f1: 0.6052
 epoch: 49, train_loss: 0.5116, test_loss: 1.0566, test_f1: 0.6153
 epoch: 50, train_loss: 0.5334, test_loss: 1.0113, test_f1: 0.6317
 epoch: 51, train_loss: 0.4914, test_loss: 0.9619, test_f1: 0.6441
 epoch: 52, train_loss: 0.4523, test_loss: 0.9194, test_f1: 0.6899
 epoch: 53, train_loss: 0.4395, test_loss: 1.0718, test_f1: 0.6733
 epoch: 54, train_loss: 0.4371, test_loss: 0.8312, test_f1: 0.6870
 epoch: 55, train_loss: 0.4390, test_loss: 0.8796, test_f1: 0.6651
 epoch: 56, train_loss: 0.4326, test_loss: 0.9445, test_f1: 0.6960
 epoch: 57, train_loss: 0.3988, test_loss: 1.0722, test_f1: 0.6643
 epoch: 58, train_loss: 0.4017, test_loss: 1.0416, test_f1: 0.6691
 epoch: 59, train_loss: 0.4028, test_loss: 1.0351, test_f1: 0.6614
 epoch: 60, train_loss: 0.3999, test_loss: 0.9637, test_f1: 0.6697
 epoch: 61, train_loss: 0.4049, test_loss: 0.9401, test_f1: 0.6426
 epoch: 62, train_loss: 0.4232, test_loss: 1.0224, test_f1: 0.6538
 epoch: 63, train_loss: 0.3945, test_loss: 0.7391, test_f1: 0.7032
 epoch: 64, train_loss: 0.3863, test_loss: 1.1647, test_f1: 0.6791
 epoch: 65, train_loss: 0.4097, test_loss: 0.9533, test_f1: 0.6658
 epoch: 66, train_loss: 0.3891, test_loss: 0.9888, test_f1: 0.6873
 epoch: 67, train_loss: 0.4000, test_loss: 1.0027, test_f1: 0.6863
 epoch: 68, train_loss: 0.3898, test_loss: 0.9485, test_f1: 0.6627
 epoch: 69, train_loss: 0.3476, test_loss: 0.9538, test_f1: 0.7044
 epoch: 70, train_loss: 0.3768, test_loss: 1.0548, test_f1: 0.6796
 epoch: 71, train_loss: 0.3532, test_loss: 0.8721, test_f1: 0.6745
 epoch: 72, train_loss: 0.3621, test_loss: 1.1402, test_f1: 0.6630
 epoch: 73, train_loss: 0.3521, test_loss: 0.9091, test_f1: 0.6727
 epoch: 74, train_loss: 0.3646, test_loss: 1.0552, test_f1: 0.6836
 epoch: 75, train_loss: 0.3474, test_loss: 1.0944, test_f1: 0.6656
 epoch: 76, train_loss: 0.3576, test_loss: 1.1015, test_f1: 0.6881
 epoch: 77, train_loss: 0.3583, test_loss: 1.0572, test_f1: 0.6743
 epoch: 78, train_loss: 0.3377, test_loss: 1.1390, test_f1: 0.6617
 epoch: 79, train_loss: 0.3247, test_loss: 1.1132, test_f1: 0.6773
 epoch: 80, train_loss: 0.3402, test_loss: 1.2768, test_f1: 0.6622
 epoch: 81, train_loss: 0.3259, test_loss: 1.0709, test_f1: 0.6627
 epoch: 82, train_loss: 0.3353, test_loss: 1.1113, test_f1: 0.6469
 epoch: 83, train_loss: 0.3886, test_loss: 1.3584, test_f1: 0.6006
 epoch: 84, train_loss: 0.3976, test_loss: 0.9102, test_f1: 0.6844
 epoch: 85, train_loss: 0.3763, test_loss: 1.1076, test_f1: 0.6564
 epoch: 86, train_loss: 0.3470, test_loss: 1.0179, test_f1: 0.7099
 epoch: 87, train_loss: 0.3418, test_loss: 1.1317, test_f1: 0.6793
 epoch: 88, train_loss: 0.3199, test_loss: 1.0213, test_f1: 0.6737
 epoch: 89, train_loss: 0.3340, test_loss: 0.9680, test_f1: 0.6509
 epoch: 90, train_loss: 0.3253, test_loss: 1.0474, test_f1: 0.6906
 epoch: 91, train_loss: 0.3218, test_loss: 1.1297, test_f1: 0.6820
 epoch: 92, train_loss: 0.3068, test_loss: 1.1707, test_f1: 0.6719
 epoch: 93, train_loss: 0.3354, test_loss: 1.0778, test_f1: 0.6804
 epoch: 94, train_loss: 0.3074, test_loss: 1.2209, test_f1: 0.6755
 epoch: 95, train_loss: 0.3010, test_loss: 1.1185, test_f1: 0.7007
 epoch: 96, train_loss: 0.2842, test_loss: 0.9972, test_f1: 0.6707
 epoch: 97, train_loss: 0.2896, test_loss: 1.1102, test_f1: 0.6894
 epoch: 98, train_loss: 0.2913, test_loss: 1.0888, test_f1: 0.6888
 epoch: 99, train_loss: 0.2816, test_loss: 1.0174, test_f1: 0.6829
##################ITERATION #1 ****************************************
 epoch: 0, train_loss: 1.1200, test_loss: 1.1037, test_f1: 0.4553
 epoch: 1, train_loss: 0.9860, test_loss: 1.0411, test_f1: 0.4616
 epoch: 2, train_loss: 0.9487, test_loss: 1.0699, test_f1: 0.4795
 epoch: 3, train_loss: 0.9273, test_loss: 0.9672, test_f1: 0.5030
 epoch: 4, train_loss: 0.8909, test_loss: 1.0482, test_f1: 0.4426
 epoch: 5, train_loss: 0.8922, test_loss: 0.9188, test_f1: 0.5532
 epoch: 6, train_loss: 0.8577, test_loss: 1.0110, test_f1: 0.5474
 epoch: 7, train_loss: 0.8450, test_loss: 0.9537, test_f1: 0.5302
 epoch: 8, train_loss: 0.8460, test_loss: 0.9014, test_f1: 0.5393
 epoch: 9, train_loss: 0.8221, test_loss: 1.2242, test_f1: 0.4909
 epoch: 10, train_loss: 0.8124, test_loss: 0.9264, test_f1: 0.5215
 epoch: 11, train_loss: 0.7908, test_loss: 0.8861, test_f1: 0.5953
 epoch: 12, train_loss: 0.7873, test_loss: 0.8470, test_f1: 0.5477
 epoch: 13, train_loss: 0.7606, test_loss: 0.9462, test_f1: 0.5772
 epoch: 14, train_loss: 0.7548, test_loss: 0.9235, test_f1: 0.5983
 epoch: 15, train_loss: 0.7429, test_loss: 0.8743, test_f1: 0.6468
 epoch: 16, train_loss: 0.7217, test_loss: 1.3689, test_f1: 0.5076
 epoch: 17, train_loss: 0.7245, test_loss: 0.9384, test_f1: 0.5578
 epoch: 18, train_loss: 0.7069, test_loss: 1.0317, test_f1: 0.6009
 epoch: 19, train_loss: 0.7121, test_loss: 0.8082, test_f1: 0.5893
 epoch: 20, train_loss: 0.6861, test_loss: 0.9294, test_f1: 0.5722
 epoch: 21, train_loss: 0.6873, test_loss: 0.9729, test_f1: 0.6133
 epoch: 22, train_loss: 0.6559, test_loss: 0.8552, test_f1: 0.6241
 epoch: 23, train_loss: 0.6694, test_loss: 1.0761, test_f1: 0.5956
 epoch: 24, train_loss: 0.6565, test_loss: 0.9587, test_f1: 0.6132
 epoch: 25, train_loss: 0.6713, test_loss: 0.9946, test_f1: 0.6067
 epoch: 26, train_loss: 0.6739, test_loss: 0.7685, test_f1: 0.6250
 epoch: 27, train_loss: 0.6778, test_loss: 0.9238, test_f1: 0.5517
 epoch: 28, train_loss: 0.6656, test_loss: 1.0421, test_f1: 0.5762
 epoch: 29, train_loss: 0.6443, test_loss: 0.9787, test_f1: 0.6298
 epoch: 30, train_loss: 0.6264, test_loss: 0.9194, test_f1: 0.6048
 epoch: 31, train_loss: 0.6302, test_loss: 1.1580, test_f1: 0.6238
 epoch: 32, train_loss: 0.6522, test_loss: 0.8003, test_f1: 0.6254
 epoch: 33, train_loss: 0.6335, test_loss: 1.0081, test_f1: 0.5947
 epoch: 34, train_loss: 0.6310, test_loss: 0.9713, test_f1: 0.6227
 epoch: 35, train_loss: 0.6083, test_loss: 0.9200, test_f1: 0.5791
 epoch: 36, train_loss: 0.5964, test_loss: 0.9636, test_f1: 0.6373
 epoch: 37, train_loss: 0.5833, test_loss: 0.8551, test_f1: 0.6524
 epoch: 38, train_loss: 0.5896, test_loss: 0.9193, test_f1: 0.6573
 epoch: 39, train_loss: 0.6126, test_loss: 1.1176, test_f1: 0.5843
 epoch: 40, train_loss: 0.5967, test_loss: 1.0728, test_f1: 0.6233
 epoch: 41, train_loss: 0.5647, test_loss: 0.9067, test_f1: 0.6288
 epoch: 42, train_loss: 0.5648, test_loss: 0.9601, test_f1: 0.6199
 epoch: 43, train_loss: 0.5743, test_loss: 0.8708, test_f1: 0.6515
 epoch: 44, train_loss: 0.5904, test_loss: 0.7707, test_f1: 0.6528
 epoch: 45, train_loss: 0.5485, test_loss: 0.8898, test_f1: 0.6308
 epoch: 46, train_loss: 0.5496, test_loss: 1.0548, test_f1: 0.6196
 epoch: 47, train_loss: 0.5456, test_loss: 0.8595, test_f1: 0.5822
 epoch: 48, train_loss: 0.5547, test_loss: 1.0113, test_f1: 0.6260
 epoch: 49, train_loss: 0.5530, test_loss: 1.0409, test_f1: 0.6594
 epoch: 50, train_loss: 0.5294, test_loss: 1.0819, test_f1: 0.6313
 epoch: 51, train_loss: 0.4957, test_loss: 1.0435, test_f1: 0.6404
 epoch: 52, train_loss: 0.4630, test_loss: 1.0012, test_f1: 0.6353
 epoch: 53, train_loss: 0.4610, test_loss: 1.2069, test_f1: 0.6303
 epoch: 54, train_loss: 0.4661, test_loss: 1.0580, test_f1: 0.6393
 epoch: 55, train_loss: 0.4477, test_loss: 0.9653, test_f1: 0.6668
 epoch: 56, train_loss: 0.4474, test_loss: 1.2604, test_f1: 0.6387
 epoch: 57, train_loss: 0.4437, test_loss: 1.0340, test_f1: 0.6174
 epoch: 58, train_loss: 0.4289, test_loss: 1.2111, test_f1: 0.6470
 epoch: 59, train_loss: 0.4304, test_loss: 1.0650, test_f1: 0.6577
 epoch: 60, train_loss: 0.4419, test_loss: 0.9969, test_f1: 0.6378
 epoch: 61, train_loss: 0.4202, test_loss: 1.0245, test_f1: 0.6684
 epoch: 62, train_loss: 0.4091, test_loss: 1.1432, test_f1: 0.6446
 epoch: 63, train_loss: 0.4270, test_loss: 1.1213, test_f1: 0.6545
 epoch: 64, train_loss: 0.4143, test_loss: 1.0611, test_f1: 0.6669
 epoch: 65, train_loss: 0.4152, test_loss: 1.0895, test_f1: 0.6269
 epoch: 66, train_loss: 0.4242, test_loss: 1.1674, test_f1: 0.6762
 epoch: 67, train_loss: 0.4070, test_loss: 1.1949, test_f1: 0.6701
 epoch: 68, train_loss: 0.4049, test_loss: 1.0896, test_f1: 0.6392
 epoch: 69, train_loss: 0.3903, test_loss: 1.3026, test_f1: 0.6389
 epoch: 70, train_loss: 0.3779, test_loss: 1.3484, test_f1: 0.6393
 epoch: 71, train_loss: 0.4004, test_loss: 1.1659, test_f1: 0.6625
 epoch: 72, train_loss: 0.3958, test_loss: 1.1130, test_f1: 0.6595
 epoch: 73, train_loss: 0.4015, test_loss: 1.1032, test_f1: 0.6289
 epoch: 74, train_loss: 0.3994, test_loss: 1.1013, test_f1: 0.6549
 epoch: 75, train_loss: 0.3909, test_loss: 1.3648, test_f1: 0.6192
 epoch: 76, train_loss: 0.3833, test_loss: 1.0230, test_f1: 0.6506
 epoch: 77, train_loss: 0.3688, test_loss: 1.2821, test_f1: 0.6551
 epoch: 78, train_loss: 0.3636, test_loss: 1.1422, test_f1: 0.6743
 epoch: 79, train_loss: 0.3757, test_loss: 1.5182, test_f1: 0.6332
 epoch: 80, train_loss: 0.3867, test_loss: 1.2907, test_f1: 0.6547
 epoch: 81, train_loss: 0.3671, test_loss: 1.4948, test_f1: 0.6287
 epoch: 82, train_loss: 0.3699, test_loss: 1.0826, test_f1: 0.6761
 epoch: 83, train_loss: 0.3636, test_loss: 1.1822, test_f1: 0.6444
 epoch: 84, train_loss: 0.3645, test_loss: 1.4456, test_f1: 0.6511
 epoch: 85, train_loss: 0.3710, test_loss: 1.2892, test_f1: 0.6812
 epoch: 86, train_loss: 0.3621, test_loss: 1.2780, test_f1: 0.6509
 epoch: 87, train_loss: 0.3489, test_loss: 1.2748, test_f1: 0.6365
 epoch: 88, train_loss: 0.3562, test_loss: 1.3466, test_f1: 0.6279
 epoch: 89, train_loss: 0.3530, test_loss: 1.3539, test_f1: 0.6555
 epoch: 90, train_loss: 0.3471, test_loss: 1.2952, test_f1: 0.6415
 epoch: 91, train_loss: 0.3526, test_loss: 1.3594, test_f1: 0.6457
 epoch: 92, train_loss: 0.3413, test_loss: 1.2867, test_f1: 0.6418
 epoch: 93, train_loss: 0.3495, test_loss: 1.1432, test_f1: 0.6588
 epoch: 94, train_loss: 0.3475, test_loss: 1.5732, test_f1: 0.6246
 epoch: 95, train_loss: 0.3493, test_loss: 1.4787, test_f1: 0.6342
 epoch: 96, train_loss: 0.3373, test_loss: 1.2819, test_f1: 0.6469
 epoch: 97, train_loss: 0.3419, test_loss: 1.3543, test_f1: 0.6510
 epoch: 98, train_loss: 0.3528, test_loss: 1.3641, test_f1: 0.6544
 epoch: 99, train_loss: 0.3330, test_loss: 1.3729, test_f1: 0.6322
##################ITERATION #2 ****************************************
 epoch: 0, train_loss: 1.1936, test_loss: 1.1260, test_f1: 0.3722
 epoch: 1, train_loss: 1.0047, test_loss: 1.0236, test_f1: 0.4829
 epoch: 2, train_loss: 0.9475, test_loss: 1.3295, test_f1: 0.3703
 epoch: 3, train_loss: 0.9182, test_loss: 0.9993, test_f1: 0.5089
 epoch: 4, train_loss: 0.9108, test_loss: 1.4155, test_f1: 0.4007
 epoch: 5, train_loss: 0.8904, test_loss: 1.0442, test_f1: 0.4637
 epoch: 6, train_loss: 0.8799, test_loss: 0.9958, test_f1: 0.4661
 epoch: 7, train_loss: 0.8600, test_loss: 0.9577, test_f1: 0.5252
 epoch: 8, train_loss: 0.8405, test_loss: 0.8723, test_f1: 0.5370
 epoch: 9, train_loss: 0.7977, test_loss: 0.8995, test_f1: 0.5456
 epoch: 10, train_loss: 0.8159, test_loss: 0.8906, test_f1: 0.5840
 epoch: 11, train_loss: 0.7866, test_loss: 0.8928, test_f1: 0.5670
 epoch: 12, train_loss: 0.7669, test_loss: 0.8186, test_f1: 0.5863
 epoch: 13, train_loss: 0.7788, test_loss: 0.9785, test_f1: 0.5014
 epoch: 14, train_loss: 0.7624, test_loss: 0.8625, test_f1: 0.5817
 epoch: 15, train_loss: 0.7328, test_loss: 1.1335, test_f1: 0.4789
 epoch: 16, train_loss: 0.7139, test_loss: 0.8905, test_f1: 0.5871
 epoch: 17, train_loss: 0.6980, test_loss: 0.8550, test_f1: 0.6054
 epoch: 18, train_loss: 0.7205, test_loss: 0.9136, test_f1: 0.5380
 epoch: 19, train_loss: 0.7079, test_loss: 0.8737, test_f1: 0.5755
 epoch: 20, train_loss: 0.7066, test_loss: 1.0233, test_f1: 0.5706
 epoch: 21, train_loss: 0.6668, test_loss: 0.8621, test_f1: 0.6050
 epoch: 22, train_loss: 0.6955, test_loss: 0.7894, test_f1: 0.6392
 epoch: 23, train_loss: 0.6678, test_loss: 1.0591, test_f1: 0.5143
 epoch: 24, train_loss: 0.6541, test_loss: 0.9134, test_f1: 0.5538
 epoch: 25, train_loss: 0.6464, test_loss: 1.0155, test_f1: 0.6391
 epoch: 26, train_loss: 0.6348, test_loss: 0.9787, test_f1: 0.5747
 epoch: 27, train_loss: 0.6393, test_loss: 0.8811, test_f1: 0.5869
 epoch: 28, train_loss: 0.6170, test_loss: 0.9548, test_f1: 0.5957
 epoch: 29, train_loss: 0.6179, test_loss: 0.8775, test_f1: 0.6062
 epoch: 30, train_loss: 0.6342, test_loss: 0.8745, test_f1: 0.6333
 epoch: 31, train_loss: 0.6174, test_loss: 0.8738, test_f1: 0.6315
 epoch: 32, train_loss: 0.6210, test_loss: 0.9241, test_f1: 0.6070
 epoch: 33, train_loss: 0.5976, test_loss: 0.9431, test_f1: 0.6055
 epoch: 34, train_loss: 0.5955, test_loss: 0.8002, test_f1: 0.6312
 epoch: 35, train_loss: 0.6092, test_loss: 0.8522, test_f1: 0.6271
 epoch: 36, train_loss: 0.5690, test_loss: 0.9443, test_f1: 0.5727
 epoch: 37, train_loss: 0.5768, test_loss: 0.8256, test_f1: 0.6378
 epoch: 38, train_loss: 0.5658, test_loss: 0.9253, test_f1: 0.6204
 epoch: 39, train_loss: 0.5451, test_loss: 0.9649, test_f1: 0.6102
 epoch: 40, train_loss: 0.5683, test_loss: 0.8871, test_f1: 0.6631
 epoch: 41, train_loss: 0.5741, test_loss: 0.8998, test_f1: 0.5879
 epoch: 42, train_loss: 0.5443, test_loss: 0.9110, test_f1: 0.6417
 epoch: 43, train_loss: 0.5222, test_loss: 0.9462, test_f1: 0.6256
 epoch: 44, train_loss: 0.5418, test_loss: 1.0090, test_f1: 0.5951
 epoch: 45, train_loss: 0.5276, test_loss: 1.2171, test_f1: 0.5983
 epoch: 46, train_loss: 0.5117, test_loss: 0.9351, test_f1: 0.6519
 epoch: 47, train_loss: 0.5461, test_loss: 1.0249, test_f1: 0.5419
 epoch: 48, train_loss: 0.5018, test_loss: 0.9060, test_f1: 0.6387
 epoch: 49, train_loss: 0.5086, test_loss: 0.9932, test_f1: 0.6255
 epoch: 50, train_loss: 0.5155, test_loss: 0.9344, test_f1: 0.6385
 epoch: 51, train_loss: 0.4511, test_loss: 0.9295, test_f1: 0.6365
 epoch: 52, train_loss: 0.4265, test_loss: 1.0208, test_f1: 0.6234
 epoch: 53, train_loss: 0.4452, test_loss: 0.9008, test_f1: 0.6497
 epoch: 54, train_loss: 0.4187, test_loss: 1.0329, test_f1: 0.6322
 epoch: 55, train_loss: 0.4242, test_loss: 0.9525, test_f1: 0.6467
 epoch: 56, train_loss: 0.4303, test_loss: 0.9054, test_f1: 0.6592
 epoch: 57, train_loss: 0.4198, test_loss: 1.0142, test_f1: 0.6404
 epoch: 58, train_loss: 0.4211, test_loss: 0.9816, test_f1: 0.6561
 epoch: 59, train_loss: 0.4155, test_loss: 1.0031, test_f1: 0.6425
 epoch: 60, train_loss: 0.4123, test_loss: 0.9272, test_f1: 0.6592
 epoch: 61, train_loss: 0.4053, test_loss: 1.0447, test_f1: 0.6460
 epoch: 62, train_loss: 0.3889, test_loss: 1.0563, test_f1: 0.6448
 epoch: 63, train_loss: 0.3880, test_loss: 1.0855, test_f1: 0.6368
 epoch: 64, train_loss: 0.3954, test_loss: 1.0651, test_f1: 0.6509
 epoch: 65, train_loss: 0.3590, test_loss: 1.0320, test_f1: 0.6346
 epoch: 66, train_loss: 0.3828, test_loss: 1.0992, test_f1: 0.6516
 epoch: 67, train_loss: 0.3670, test_loss: 1.0560, test_f1: 0.6571
 epoch: 68, train_loss: 0.3614, test_loss: 1.0879, test_f1: 0.6454
 epoch: 69, train_loss: 0.3747, test_loss: 1.1767, test_f1: 0.6282
 epoch: 70, train_loss: 0.3640, test_loss: 1.2275, test_f1: 0.6503
 epoch: 71, train_loss: 0.3622, test_loss: 1.1102, test_f1: 0.6389
 epoch: 72, train_loss: 0.3586, test_loss: 1.1495, test_f1: 0.6445
 epoch: 73, train_loss: 0.3577, test_loss: 1.1190, test_f1: 0.6369
 epoch: 74, train_loss: 0.3689, test_loss: 1.0732, test_f1: 0.6496
 epoch: 75, train_loss: 0.3623, test_loss: 1.2912, test_f1: 0.6548
 epoch: 76, train_loss: 0.3537, test_loss: 1.2392, test_f1: 0.6438
 epoch: 77, train_loss: 0.3559, test_loss: 1.2111, test_f1: 0.6256
 epoch: 78, train_loss: 0.3582, test_loss: 1.1682, test_f1: 0.6456
 epoch: 79, train_loss: 0.3513, test_loss: 1.1168, test_f1: 0.6785
 epoch: 80, train_loss: 0.3249, test_loss: 1.2662, test_f1: 0.6561
 epoch: 81, train_loss: 0.3421, test_loss: 1.3006, test_f1: 0.6453
 epoch: 82, train_loss: 0.3335, test_loss: 1.2222, test_f1: 0.6716
 epoch: 83, train_loss: 0.3489, test_loss: 1.1740, test_f1: 0.6584
 epoch: 84, train_loss: 0.3226, test_loss: 1.3329, test_f1: 0.6380
 epoch: 85, train_loss: 0.3034, test_loss: 1.3762, test_f1: 0.6270
 epoch: 86, train_loss: 0.3354, test_loss: 1.1280, test_f1: 0.6497
 epoch: 87, train_loss: 0.3434, test_loss: 1.2173, test_f1: 0.6626
 epoch: 88, train_loss: 0.3252, test_loss: 1.4862, test_f1: 0.6265
 epoch: 89, train_loss: 0.2909, test_loss: 1.2893, test_f1: 0.6414
 epoch: 90, train_loss: 0.3258, test_loss: 1.3397, test_f1: 0.6682
 epoch: 91, train_loss: 0.3016, test_loss: 1.4105, test_f1: 0.6408
 epoch: 92, train_loss: 0.3081, test_loss: 1.2417, test_f1: 0.6708
 epoch: 93, train_loss: 0.2813, test_loss: 1.3495, test_f1: 0.6465
 epoch: 94, train_loss: 0.2821, test_loss: 1.2797, test_f1: 0.6755
 epoch: 95, train_loss: 0.2943, test_loss: 1.2901, test_f1: 0.6557
 epoch: 96, train_loss: 0.3321, test_loss: 1.3267, test_f1: 0.6184
 epoch: 97, train_loss: 0.2887, test_loss: 1.2666, test_f1: 0.6604
 epoch: 98, train_loss: 0.2718, test_loss: 1.2617, test_f1: 0.6554
 epoch: 99, train_loss: 0.3085, test_loss: 1.2959, test_f1: 0.6390
##################ITERATION #3 ****************************************
 epoch: 0, train_loss: 1.2553, test_loss: 1.5238, test_f1: 0.3605
 epoch: 1, train_loss: 0.9952, test_loss: 0.9853, test_f1: 0.4621
 epoch: 2, train_loss: 0.9656, test_loss: 1.1081, test_f1: 0.4498
 epoch: 3, train_loss: 0.9285, test_loss: 1.0075, test_f1: 0.4919
 epoch: 4, train_loss: 0.8920, test_loss: 0.9070, test_f1: 0.5617
 epoch: 5, train_loss: 0.8904, test_loss: 1.5105, test_f1: 0.4139
 epoch: 6, train_loss: 0.8766, test_loss: 1.0384, test_f1: 0.4956
 epoch: 7, train_loss: 0.8512, test_loss: 1.2168, test_f1: 0.4567
 epoch: 8, train_loss: 0.8436, test_loss: 0.9563, test_f1: 0.5190
 epoch: 9, train_loss: 0.8252, test_loss: 1.0349, test_f1: 0.5226
 epoch: 10, train_loss: 0.7993, test_loss: 0.9451, test_f1: 0.5900
 epoch: 11, train_loss: 0.8040, test_loss: 0.8886, test_f1: 0.5902
 epoch: 12, train_loss: 0.7965, test_loss: 0.8719, test_f1: 0.5737
 epoch: 13, train_loss: 0.7670, test_loss: 1.1086, test_f1: 0.5075
 epoch: 14, train_loss: 0.7780, test_loss: 0.9821, test_f1: 0.5210
 epoch: 15, train_loss: 0.7609, test_loss: 1.0646, test_f1: 0.5057
 epoch: 16, train_loss: 0.7545, test_loss: 0.9057, test_f1: 0.5563
 epoch: 17, train_loss: 0.7490, test_loss: 0.9115, test_f1: 0.5602
 epoch: 18, train_loss: 0.7388, test_loss: 1.0237, test_f1: 0.5675
 epoch: 19, train_loss: 0.7285, test_loss: 0.8765, test_f1: 0.5926
 epoch: 20, train_loss: 0.7561, test_loss: 1.3298, test_f1: 0.3747
 epoch: 21, train_loss: 0.7283, test_loss: 0.8628, test_f1: 0.6029
 epoch: 22, train_loss: 0.6954, test_loss: 0.8337, test_f1: 0.6232
 epoch: 23, train_loss: 0.6966, test_loss: 1.2053, test_f1: 0.4813
 epoch: 24, train_loss: 0.6977, test_loss: 0.8440, test_f1: 0.6359
 epoch: 25, train_loss: 0.6820, test_loss: 0.8354, test_f1: 0.6731
 epoch: 26, train_loss: 0.6680, test_loss: 0.7907, test_f1: 0.6682
 epoch: 27, train_loss: 0.6491, test_loss: 0.8827, test_f1: 0.6153
 epoch: 28, train_loss: 0.6634, test_loss: 0.8561, test_f1: 0.6035
 epoch: 29, train_loss: 0.6573, test_loss: 1.1599, test_f1: 0.4905
 epoch: 30, train_loss: 0.6476, test_loss: 0.8259, test_f1: 0.6165
 epoch: 31, train_loss: 0.6371, test_loss: 0.9837, test_f1: 0.6045
 epoch: 32, train_loss: 0.6488, test_loss: 0.8601, test_f1: 0.6383
 epoch: 33, train_loss: 0.6249, test_loss: 0.8982, test_f1: 0.6106
 epoch: 34, train_loss: 0.6156, test_loss: 1.1924, test_f1: 0.6180
 epoch: 35, train_loss: 0.6030, test_loss: 1.2387, test_f1: 0.4695
 epoch: 36, train_loss: 0.6360, test_loss: 0.9523, test_f1: 0.5987
 epoch: 37, train_loss: 0.6150, test_loss: 0.8390, test_f1: 0.6215
 epoch: 38, train_loss: 0.5969, test_loss: 1.0547, test_f1: 0.5471
 epoch: 39, train_loss: 0.5919, test_loss: 0.8474, test_f1: 0.6384
 epoch: 40, train_loss: 0.5874, test_loss: 0.8138, test_f1: 0.6797
 epoch: 41, train_loss: 0.5691, test_loss: 0.8230, test_f1: 0.6563
 epoch: 42, train_loss: 0.5646, test_loss: 0.8675, test_f1: 0.6566
 epoch: 43, train_loss: 0.5764, test_loss: 0.9020, test_f1: 0.6240
 epoch: 44, train_loss: 0.5500, test_loss: 0.8138, test_f1: 0.6671
 epoch: 45, train_loss: 0.5594, test_loss: 0.9495, test_f1: 0.6352
 epoch: 46, train_loss: 0.5842, test_loss: 1.0803, test_f1: 0.6339
 epoch: 47, train_loss: 0.5494, test_loss: 0.9123, test_f1: 0.6307
 epoch: 48, train_loss: 0.5598, test_loss: 0.9264, test_f1: 0.6180
 epoch: 49, train_loss: 0.5401, test_loss: 1.0017, test_f1: 0.5856
 epoch: 50, train_loss: 0.5708, test_loss: 1.0198, test_f1: 0.5837
 epoch: 51, train_loss: 0.5071, test_loss: 0.9109, test_f1: 0.6610
 epoch: 52, train_loss: 0.4665, test_loss: 0.9959, test_f1: 0.6432
 epoch: 53, train_loss: 0.4752, test_loss: 0.8534, test_f1: 0.6759
 epoch: 54, train_loss: 0.4598, test_loss: 0.9578, test_f1: 0.6464
 epoch: 55, train_loss: 0.4630, test_loss: 0.9490, test_f1: 0.6349
 epoch: 56, train_loss: 0.4496, test_loss: 0.9150, test_f1: 0.6659
 epoch: 57, train_loss: 0.4352, test_loss: 0.8920, test_f1: 0.6644
 epoch: 58, train_loss: 0.4493, test_loss: 0.9177, test_f1: 0.6746
 epoch: 59, train_loss: 0.4529, test_loss: 1.0275, test_f1: 0.6425
 epoch: 60, train_loss: 0.4276, test_loss: 1.0439, test_f1: 0.6282
 epoch: 61, train_loss: 0.4194, test_loss: 1.0426, test_f1: 0.6520
 epoch: 62, train_loss: 0.4095, test_loss: 1.0815, test_f1: 0.6445
 epoch: 63, train_loss: 0.4011, test_loss: 1.1082, test_f1: 0.6530
 epoch: 64, train_loss: 0.4390, test_loss: 0.9838, test_f1: 0.6633
 epoch: 65, train_loss: 0.4027, test_loss: 0.9962, test_f1: 0.6542
 epoch: 66, train_loss: 0.3974, test_loss: 1.0564, test_f1: 0.6270
 epoch: 67, train_loss: 0.3970, test_loss: 1.2235, test_f1: 0.6205
 epoch: 68, train_loss: 0.3971, test_loss: 1.1161, test_f1: 0.6538
 epoch: 69, train_loss: 0.4084, test_loss: 1.0926, test_f1: 0.6540
 epoch: 70, train_loss: 0.4235, test_loss: 1.1102, test_f1: 0.6808
 epoch: 71, train_loss: 0.3671, test_loss: 1.2280, test_f1: 0.6429
 epoch: 72, train_loss: 0.3758, test_loss: 1.2136, test_f1: 0.6409
 epoch: 73, train_loss: 0.3824, test_loss: 1.1226, test_f1: 0.6466
 epoch: 74, train_loss: 0.3815, test_loss: 1.1524, test_f1: 0.6229
 epoch: 75, train_loss: 0.3776, test_loss: 1.0385, test_f1: 0.6524
 epoch: 76, train_loss: 0.3711, test_loss: 1.3141, test_f1: 0.6356
 epoch: 77, train_loss: 0.3632, test_loss: 1.3366, test_f1: 0.6180
 epoch: 78, train_loss: 0.3640, test_loss: 1.3130, test_f1: 0.6333
 epoch: 79, train_loss: 0.3726, test_loss: 1.2342, test_f1: 0.6285
 epoch: 80, train_loss: 0.3920, test_loss: 1.1496, test_f1: 0.6601
 epoch: 81, train_loss: 0.3478, test_loss: 1.1172, test_f1: 0.6452
 epoch: 82, train_loss: 0.3769, test_loss: 1.2440, test_f1: 0.6074
 epoch: 83, train_loss: 0.3707, test_loss: 1.2508, test_f1: 0.6258
 epoch: 84, train_loss: 0.3492, test_loss: 1.2740, test_f1: 0.6557
 epoch: 85, train_loss: 0.3530, test_loss: 1.2091, test_f1: 0.6470
 epoch: 86, train_loss: 0.3457, test_loss: 1.1354, test_f1: 0.6338
 epoch: 87, train_loss: 0.3754, test_loss: 1.1159, test_f1: 0.6559
 epoch: 88, train_loss: 0.3419, test_loss: 1.1423, test_f1: 0.6586
 epoch: 89, train_loss: 0.3349, test_loss: 1.1852, test_f1: 0.6402
 epoch: 90, train_loss: 0.3311, test_loss: 1.1589, test_f1: 0.6538
 epoch: 91, train_loss: 0.3343, test_loss: 1.2035, test_f1: 0.6479
 epoch: 92, train_loss: 0.3344, test_loss: 1.1438, test_f1: 0.6510
 epoch: 93, train_loss: 0.3523, test_loss: 1.3163, test_f1: 0.6467
 epoch: 94, train_loss: 0.3611, test_loss: 1.0561, test_f1: 0.6353
 epoch: 95, train_loss: 0.3533, test_loss: 1.0900, test_f1: 0.6801
 epoch: 96, train_loss: 0.3428, test_loss: 1.1666, test_f1: 0.6522
 epoch: 97, train_loss: 0.3210, test_loss: 1.1223, test_f1: 0.7065
 epoch: 98, train_loss: 0.3357, test_loss: 1.1724, test_f1: 0.6695
 epoch: 99, train_loss: 0.3152, test_loss: 1.2256, test_f1: 0.6560
##################ITERATION #4 ****************************************
 epoch: 0, train_loss: 1.2934, test_loss: 1.1186, test_f1: 0.4004
 epoch: 1, train_loss: 1.0237, test_loss: 1.1808, test_f1: 0.3776
 epoch: 2, train_loss: 0.9695, test_loss: 0.9861, test_f1: 0.4903
 epoch: 3, train_loss: 0.9354, test_loss: 1.1736, test_f1: 0.4158
 epoch: 4, train_loss: 0.9159, test_loss: 1.0193, test_f1: 0.5123
 epoch: 5, train_loss: 0.8949, test_loss: 0.9616, test_f1: 0.5495
 epoch: 6, train_loss: 0.8647, test_loss: 0.9684, test_f1: 0.5057
 epoch: 7, train_loss: 0.8582, test_loss: 0.9840, test_f1: 0.5484
 epoch: 8, train_loss: 0.8392, test_loss: 1.0347, test_f1: 0.5217
 epoch: 9, train_loss: 0.8255, test_loss: 0.8769, test_f1: 0.5369
 epoch: 10, train_loss: 0.8315, test_loss: 1.1326, test_f1: 0.5374
 epoch: 11, train_loss: 0.8126, test_loss: 0.9754, test_f1: 0.5169
 epoch: 12, train_loss: 0.7892, test_loss: 0.8987, test_f1: 0.5447
 epoch: 13, train_loss: 0.7858, test_loss: 0.8629, test_f1: 0.5819
 epoch: 14, train_loss: 0.7693, test_loss: 0.8913, test_f1: 0.6175
 epoch: 15, train_loss: 0.7565, test_loss: 1.0223, test_f1: 0.5412
 epoch: 16, train_loss: 0.7620, test_loss: 0.9432, test_f1: 0.5811
 epoch: 17, train_loss: 0.7511, test_loss: 0.9548, test_f1: 0.5294
 epoch: 18, train_loss: 0.7435, test_loss: 0.8251, test_f1: 0.6098
 epoch: 19, train_loss: 0.7166, test_loss: 0.9534, test_f1: 0.5664
 epoch: 20, train_loss: 0.7382, test_loss: 1.0699, test_f1: 0.5549
 epoch: 21, train_loss: 0.7116, test_loss: 0.9893, test_f1: 0.6026
 epoch: 22, train_loss: 0.7057, test_loss: 0.9915, test_f1: 0.5707
 epoch: 23, train_loss: 0.7043, test_loss: 0.9480, test_f1: 0.6146
 epoch: 24, train_loss: 0.7017, test_loss: 1.0371, test_f1: 0.5525
 epoch: 25, train_loss: 0.7139, test_loss: 1.0634, test_f1: 0.5640
 epoch: 26, train_loss: 0.6896, test_loss: 0.9580, test_f1: 0.6053
 epoch: 27, train_loss: 0.6634, test_loss: 0.8881, test_f1: 0.6075
 epoch: 28, train_loss: 0.6836, test_loss: 0.9638, test_f1: 0.6193
 epoch: 29, train_loss: 0.6833, test_loss: 0.9062, test_f1: 0.6013
 epoch: 30, train_loss: 0.6685, test_loss: 1.3246, test_f1: 0.5232
 epoch: 31, train_loss: 0.6596, test_loss: 1.0455, test_f1: 0.5842
 epoch: 32, train_loss: 0.6384, test_loss: 0.9532, test_f1: 0.5512
 epoch: 33, train_loss: 0.6763, test_loss: 1.0217, test_f1: 0.5079
 epoch: 34, train_loss: 0.6407, test_loss: 0.9367, test_f1: 0.6126
 epoch: 35, train_loss: 0.6607, test_loss: 1.0717, test_f1: 0.6078
 epoch: 36, train_loss: 0.6496, test_loss: 1.0697, test_f1: 0.5586
 epoch: 37, train_loss: 0.6096, test_loss: 1.0631, test_f1: 0.5877
 epoch: 38, train_loss: 0.6301, test_loss: 0.8821, test_f1: 0.6254
 epoch: 39, train_loss: 0.6092, test_loss: 0.9949, test_f1: 0.5991
 epoch: 40, train_loss: 0.6226, test_loss: 0.9510, test_f1: 0.5897
 epoch: 41, train_loss: 0.6277, test_loss: 1.0538, test_f1: 0.5689
 epoch: 42, train_loss: 0.5915, test_loss: 1.3239, test_f1: 0.5629
 epoch: 43, train_loss: 0.5944, test_loss: 0.8947, test_f1: 0.6203
 epoch: 44, train_loss: 0.5881, test_loss: 1.1710, test_f1: 0.5609
 epoch: 45, train_loss: 0.5892, test_loss: 1.1586, test_f1: 0.5510
 epoch: 46, train_loss: 0.5664, test_loss: 1.1832, test_f1: 0.5780
 epoch: 47, train_loss: 0.5996, test_loss: 1.0408, test_f1: 0.5584
 epoch: 48, train_loss: 0.5920, test_loss: 0.9086, test_f1: 0.6424
 epoch: 49, train_loss: 0.5778, test_loss: 1.2150, test_f1: 0.5551
 epoch: 50, train_loss: 0.5498, test_loss: 0.9975, test_f1: 0.6141
 epoch: 51, train_loss: 0.5170, test_loss: 1.0652, test_f1: 0.6070
 epoch: 52, train_loss: 0.5141, test_loss: 0.8430, test_f1: 0.6459
 epoch: 53, train_loss: 0.4807, test_loss: 1.0624, test_f1: 0.5993
 epoch: 54, train_loss: 0.4667, test_loss: 0.9525, test_f1: 0.6307
 epoch: 55, train_loss: 0.4602, test_loss: 1.0122, test_f1: 0.6254
 epoch: 56, train_loss: 0.4696, test_loss: 0.9701, test_f1: 0.6302
 epoch: 57, train_loss: 0.4708, test_loss: 0.9555, test_f1: 0.6176
 epoch: 58, train_loss: 0.4502, test_loss: 1.3057, test_f1: 0.5882
 epoch: 59, train_loss: 0.4762, test_loss: 0.9501, test_f1: 0.6641
 epoch: 60, train_loss: 0.4691, test_loss: 1.0464, test_f1: 0.6147
 epoch: 61, train_loss: 0.4634, test_loss: 1.1120, test_f1: 0.6147
 epoch: 62, train_loss: 0.4352, test_loss: 0.9415, test_f1: 0.6712
 epoch: 63, train_loss: 0.4392, test_loss: 1.1061, test_f1: 0.6193
 epoch: 64, train_loss: 0.4438, test_loss: 0.9178, test_f1: 0.6475
 epoch: 65, train_loss: 0.4216, test_loss: 1.0902, test_f1: 0.6303
 epoch: 66, train_loss: 0.4264, test_loss: 1.1801, test_f1: 0.6258
 epoch: 67, train_loss: 0.4125, test_loss: 1.2379, test_f1: 0.6054
 epoch: 68, train_loss: 0.4287, test_loss: 1.0666, test_f1: 0.6097
 epoch: 69, train_loss: 0.4408, test_loss: 0.9272, test_f1: 0.6432
 epoch: 70, train_loss: 0.4279, test_loss: 1.0255, test_f1: 0.6320
 epoch: 71, train_loss: 0.4400, test_loss: 1.0650, test_f1: 0.6448
 epoch: 72, train_loss: 0.4096, test_loss: 0.9676, test_f1: 0.6256
 epoch: 73, train_loss: 0.4057, test_loss: 1.0223, test_f1: 0.6224
 epoch: 74, train_loss: 0.3883, test_loss: 1.2031, test_f1: 0.6173
 epoch: 75, train_loss: 0.4104, test_loss: 1.1577, test_f1: 0.6253
 epoch: 76, train_loss: 0.4092, test_loss: 1.1202, test_f1: 0.6042
 epoch: 77, train_loss: 0.4155, test_loss: 1.0478, test_f1: 0.6530
 epoch: 78, train_loss: 0.4334, test_loss: 1.3573, test_f1: 0.6115
 epoch: 79, train_loss: 0.4027, test_loss: 1.1603, test_f1: 0.6228
 epoch: 80, train_loss: 0.4048, test_loss: 1.2681, test_f1: 0.6493
 epoch: 81, train_loss: 0.3958, test_loss: 1.2552, test_f1: 0.6220
 epoch: 82, train_loss: 0.4123, test_loss: 1.1167, test_f1: 0.6197
 epoch: 83, train_loss: 0.4010, test_loss: 1.0630, test_f1: 0.6300
 epoch: 84, train_loss: 0.4028, test_loss: 1.0436, test_f1: 0.6577
 epoch: 85, train_loss: 0.3688, test_loss: 1.1423, test_f1: 0.6378
 epoch: 86, train_loss: 0.3847, test_loss: 1.2684, test_f1: 0.6027
 epoch: 87, train_loss: 0.3664, test_loss: 1.3302, test_f1: 0.6187
 epoch: 88, train_loss: 0.3978, test_loss: 1.2113, test_f1: 0.6373
 epoch: 89, train_loss: 0.3644, test_loss: 1.3393, test_f1: 0.6080
 epoch: 90, train_loss: 0.3558, test_loss: 1.2700, test_f1: 0.6381
 epoch: 91, train_loss: 0.3665, test_loss: 1.2053, test_f1: 0.6328
 epoch: 92, train_loss: 0.3556, test_loss: 1.2510, test_f1: 0.5999
 epoch: 93, train_loss: 0.3647, test_loss: 1.4108, test_f1: 0.6291
 epoch: 94, train_loss: 0.3446, test_loss: 1.3169, test_f1: 0.5886
 epoch: 95, train_loss: 0.4086, test_loss: 1.0732, test_f1: 0.6394
 epoch: 96, train_loss: 0.3756, test_loss: 1.1984, test_f1: 0.6517
 epoch: 97, train_loss: 0.3683, test_loss: 1.0469, test_f1: 0.6929
 epoch: 98, train_loss: 0.3806, test_loss: 1.1398, test_f1: 0.6463
 epoch: 99, train_loss: 0.3625, test_loss: 1.0886, test_f1: 0.6821
##################ITERATION #5 ****************************************
 epoch: 0, train_loss: 1.2160, test_loss: 1.5202, test_f1: 0.2787
 epoch: 1, train_loss: 1.0217, test_loss: 1.0908, test_f1: 0.4343
 epoch: 2, train_loss: 0.9755, test_loss: 1.1538, test_f1: 0.4584
 epoch: 3, train_loss: 0.9339, test_loss: 1.2416, test_f1: 0.4532
 epoch: 4, train_loss: 0.9350, test_loss: 1.1099, test_f1: 0.4217
 epoch: 5, train_loss: 0.9119, test_loss: 0.9364, test_f1: 0.5060
 epoch: 6, train_loss: 0.8666, test_loss: 0.9288, test_f1: 0.5225
 epoch: 7, train_loss: 0.8554, test_loss: 0.8889, test_f1: 0.5279
 epoch: 8, train_loss: 0.8331, test_loss: 0.9390, test_f1: 0.5241
 epoch: 9, train_loss: 0.8323, test_loss: 0.9451, test_f1: 0.5183
 epoch: 10, train_loss: 0.8176, test_loss: 0.8907, test_f1: 0.5431
 epoch: 11, train_loss: 0.8078, test_loss: 0.9507, test_f1: 0.5491
 epoch: 12, train_loss: 0.7814, test_loss: 0.8935, test_f1: 0.5305
 epoch: 13, train_loss: 0.7808, test_loss: 0.8838, test_f1: 0.5878
 epoch: 14, train_loss: 0.7685, test_loss: 0.9202, test_f1: 0.5017
 epoch: 15, train_loss: 0.7805, test_loss: 1.0248, test_f1: 0.4934
 epoch: 16, train_loss: 0.7627, test_loss: 1.0663, test_f1: 0.5899
 epoch: 17, train_loss: 0.7663, test_loss: 1.1499, test_f1: 0.4667
 epoch: 18, train_loss: 0.7495, test_loss: 0.9418, test_f1: 0.5280
 epoch: 19, train_loss: 0.7314, test_loss: 1.0454, test_f1: 0.5222
 epoch: 20, train_loss: 0.7310, test_loss: 0.9195, test_f1: 0.5402
 epoch: 21, train_loss: 0.7295, test_loss: 0.8648, test_f1: 0.5593
 epoch: 22, train_loss: 0.7141, test_loss: 0.9090, test_f1: 0.6014
 epoch: 23, train_loss: 0.7115, test_loss: 0.8159, test_f1: 0.5740
 epoch: 24, train_loss: 0.7100, test_loss: 0.9581, test_f1: 0.5616
 epoch: 25, train_loss: 0.6984, test_loss: 1.1488, test_f1: 0.5522
 epoch: 26, train_loss: 0.6935, test_loss: 0.9232, test_f1: 0.5658
 epoch: 27, train_loss: 0.6852, test_loss: 0.8998, test_f1: 0.5350
 epoch: 28, train_loss: 0.6787, test_loss: 0.8704, test_f1: 0.5250
 epoch: 29, train_loss: 0.6791, test_loss: 0.9514, test_f1: 0.6284
 epoch: 30, train_loss: 0.6525, test_loss: 0.9985, test_f1: 0.6008
 epoch: 31, train_loss: 0.6518, test_loss: 0.9523, test_f1: 0.5908
 epoch: 32, train_loss: 0.6552, test_loss: 0.9377, test_f1: 0.6165
 epoch: 33, train_loss: 0.6476, test_loss: 0.9804, test_f1: 0.6113
 epoch: 34, train_loss: 0.6704, test_loss: 1.0046, test_f1: 0.5985
 epoch: 35, train_loss: 0.6379, test_loss: 0.8755, test_f1: 0.5815
 epoch: 36, train_loss: 0.6423, test_loss: 0.9746, test_f1: 0.5822
 epoch: 37, train_loss: 0.6464, test_loss: 1.1946, test_f1: 0.5692
 epoch: 38, train_loss: 0.6309, test_loss: 1.1091, test_f1: 0.5995
 epoch: 39, train_loss: 0.6088, test_loss: 0.8892, test_f1: 0.6046
 epoch: 40, train_loss: 0.5963, test_loss: 0.9163, test_f1: 0.5875
 epoch: 41, train_loss: 0.5929, test_loss: 0.9348, test_f1: 0.6342
 epoch: 42, train_loss: 0.6073, test_loss: 0.7823, test_f1: 0.6530
 epoch: 43, train_loss: 0.5793, test_loss: 1.0745, test_f1: 0.5451
 epoch: 44, train_loss: 0.5713, test_loss: 0.8970, test_f1: 0.6506
 epoch: 45, train_loss: 0.5838, test_loss: 1.0389, test_f1: 0.6256
 epoch: 46, train_loss: 0.5907, test_loss: 1.1018, test_f1: 0.5878
 epoch: 47, train_loss: 0.5855, test_loss: 1.0252, test_f1: 0.6152
 epoch: 48, train_loss: 0.5723, test_loss: 1.2601, test_f1: 0.6055
 epoch: 49, train_loss: 0.5642, test_loss: 1.0377, test_f1: 0.5697
 epoch: 50, train_loss: 0.5366, test_loss: 1.0282, test_f1: 0.5648
 epoch: 51, train_loss: 0.5346, test_loss: 0.8775, test_f1: 0.6561
 epoch: 52, train_loss: 0.4801, test_loss: 0.9634, test_f1: 0.6710
 epoch: 53, train_loss: 0.4827, test_loss: 1.0286, test_f1: 0.6283
 epoch: 54, train_loss: 0.4917, test_loss: 1.0634, test_f1: 0.6248
 epoch: 55, train_loss: 0.4765, test_loss: 0.9968, test_f1: 0.6396
 epoch: 56, train_loss: 0.4893, test_loss: 1.3292, test_f1: 0.6364
 epoch: 57, train_loss: 0.4847, test_loss: 1.0568, test_f1: 0.6570
 epoch: 58, train_loss: 0.4781, test_loss: 0.9952, test_f1: 0.6298
 epoch: 59, train_loss: 0.4889, test_loss: 1.0102, test_f1: 0.6484
 epoch: 60, train_loss: 0.4701, test_loss: 1.0749, test_f1: 0.6478
 epoch: 61, train_loss: 0.4525, test_loss: 1.0591, test_f1: 0.6236
 epoch: 62, train_loss: 0.4539, test_loss: 1.2211, test_f1: 0.6376
 epoch: 63, train_loss: 0.4412, test_loss: 1.0602, test_f1: 0.6547
 epoch: 64, train_loss: 0.4439, test_loss: 1.1066, test_f1: 0.6393
 epoch: 65, train_loss: 0.4503, test_loss: 1.1138, test_f1: 0.6258
 epoch: 66, train_loss: 0.4222, test_loss: 1.1266, test_f1: 0.6299
 epoch: 67, train_loss: 0.4321, test_loss: 1.1466, test_f1: 0.6416
 epoch: 68, train_loss: 0.4419, test_loss: 1.2183, test_f1: 0.6207
 epoch: 69, train_loss: 0.4320, test_loss: 1.1584, test_f1: 0.6620
 epoch: 70, train_loss: 0.4254, test_loss: 1.1527, test_f1: 0.6516
 epoch: 71, train_loss: 0.4296, test_loss: 1.1132, test_f1: 0.6623
 epoch: 72, train_loss: 0.4229, test_loss: 1.0502, test_f1: 0.6737
 epoch: 73, train_loss: 0.4289, test_loss: 1.1874, test_f1: 0.6299
 epoch: 74, train_loss: 0.4123, test_loss: 1.2986, test_f1: 0.6398
 epoch: 75, train_loss: 0.4169, test_loss: 1.2282, test_f1: 0.6616
 epoch: 76, train_loss: 0.4040, test_loss: 1.0602, test_f1: 0.6852
 epoch: 77, train_loss: 0.4059, test_loss: 1.1807, test_f1: 0.6416
 epoch: 78, train_loss: 0.4196, test_loss: 1.2102, test_f1: 0.6424
 epoch: 79, train_loss: 0.4141, test_loss: 1.2497, test_f1: 0.6703
 epoch: 80, train_loss: 0.3955, test_loss: 1.2864, test_f1: 0.6696
 epoch: 81, train_loss: 0.4101, test_loss: 1.3517, test_f1: 0.6539
 epoch: 82, train_loss: 0.3899, test_loss: 1.3951, test_f1: 0.6384
 epoch: 83, train_loss: 0.3977, test_loss: 1.3998, test_f1: 0.6238
 epoch: 84, train_loss: 0.3987, test_loss: 1.3457, test_f1: 0.6744
 epoch: 85, train_loss: 0.3956, test_loss: 1.1855, test_f1: 0.6477
 epoch: 86, train_loss: 0.3924, test_loss: 1.3418, test_f1: 0.6378
 epoch: 87, train_loss: 0.3852, test_loss: 1.2357, test_f1: 0.6631
 epoch: 88, train_loss: 0.3961, test_loss: 1.2910, test_f1: 0.6412
 epoch: 89, train_loss: 0.3692, test_loss: 1.4745, test_f1: 0.6315
 epoch: 90, train_loss: 0.3769, test_loss: 1.2812, test_f1: 0.6328
 epoch: 91, train_loss: 0.3716, test_loss: 1.2470, test_f1: 0.6750
 epoch: 92, train_loss: 0.3573, test_loss: 1.1847, test_f1: 0.6412
 epoch: 93, train_loss: 0.3565, test_loss: 1.4251, test_f1: 0.6320
 epoch: 94, train_loss: 0.3587, test_loss: 1.3686, test_f1: 0.6333
 epoch: 95, train_loss: 0.3846, test_loss: 1.2546, test_f1: 0.6607
 epoch: 96, train_loss: 0.3664, test_loss: 1.2191, test_f1: 0.6822
 epoch: 97, train_loss: 0.3587, test_loss: 1.3554, test_f1: 0.6473
 epoch: 98, train_loss: 0.3455, test_loss: 1.4368, test_f1: 0.6560
 epoch: 99, train_loss: 0.3724, test_loss: 1.3842, test_f1: 0.6428
##################ITERATION #6 ****************************************
 epoch: 0, train_loss: 1.2506, test_loss: 1.1270, test_f1: 0.4299
 epoch: 1, train_loss: 1.0307, test_loss: 1.1703, test_f1: 0.3307
 epoch: 2, train_loss: 0.9639, test_loss: 0.9921, test_f1: 0.5342
 epoch: 3, train_loss: 0.9224, test_loss: 1.1658, test_f1: 0.4391
 epoch: 4, train_loss: 0.9003, test_loss: 1.0834, test_f1: 0.4870
 epoch: 5, train_loss: 0.8912, test_loss: 1.0031, test_f1: 0.5293
 epoch: 6, train_loss: 0.8765, test_loss: 1.0869, test_f1: 0.4841
 epoch: 7, train_loss: 0.8479, test_loss: 0.9655, test_f1: 0.5112
 epoch: 8, train_loss: 0.8363, test_loss: 0.8882, test_f1: 0.5701
 epoch: 9, train_loss: 0.8094, test_loss: 0.9308, test_f1: 0.5763
 epoch: 10, train_loss: 0.7939, test_loss: 0.9298, test_f1: 0.5589
 epoch: 11, train_loss: 0.7884, test_loss: 0.8906, test_f1: 0.5342
 epoch: 12, train_loss: 0.7723, test_loss: 0.9799, test_f1: 0.5224
 epoch: 13, train_loss: 0.7702, test_loss: 0.9334, test_f1: 0.5346
 epoch: 14, train_loss: 0.7432, test_loss: 0.9551, test_f1: 0.5966
 epoch: 15, train_loss: 0.7349, test_loss: 0.9135, test_f1: 0.6134
 epoch: 16, train_loss: 0.7424, test_loss: 1.1065, test_f1: 0.5884
 epoch: 17, train_loss: 0.7117, test_loss: 0.8727, test_f1: 0.6020
 epoch: 18, train_loss: 0.7057, test_loss: 1.0792, test_f1: 0.5339
 epoch: 19, train_loss: 0.7259, test_loss: 0.9729, test_f1: 0.5918
 epoch: 20, train_loss: 0.7253, test_loss: 1.1638, test_f1: 0.5420
 epoch: 21, train_loss: 0.7041, test_loss: 0.9892, test_f1: 0.5566
 epoch: 22, train_loss: 0.6929, test_loss: 1.1093, test_f1: 0.5813
 epoch: 23, train_loss: 0.6682, test_loss: 1.0820, test_f1: 0.5296
 epoch: 24, train_loss: 0.6851, test_loss: 1.1161, test_f1: 0.5210
 epoch: 25, train_loss: 0.6679, test_loss: 0.9155, test_f1: 0.6024
 epoch: 26, train_loss: 0.6608, test_loss: 0.9452, test_f1: 0.6197
 epoch: 27, train_loss: 0.6450, test_loss: 0.9831, test_f1: 0.5543
 epoch: 28, train_loss: 0.6451, test_loss: 1.0787, test_f1: 0.6162
 epoch: 29, train_loss: 0.6484, test_loss: 0.9532, test_f1: 0.6105
 epoch: 30, train_loss: 0.6602, test_loss: 1.1680, test_f1: 0.5620
 epoch: 31, train_loss: 0.6406, test_loss: 1.3174, test_f1: 0.5950
 epoch: 32, train_loss: 0.6381, test_loss: 0.9739, test_f1: 0.5998
 epoch: 33, train_loss: 0.6349, test_loss: 1.0109, test_f1: 0.6220
 epoch: 34, train_loss: 0.6446, test_loss: 2.1668, test_f1: 0.3126
 epoch: 35, train_loss: 0.6201, test_loss: 0.9845, test_f1: 0.6396
 epoch: 36, train_loss: 0.6126, test_loss: 1.0911, test_f1: 0.6222
 epoch: 37, train_loss: 0.6191, test_loss: 1.0607, test_f1: 0.6185
 epoch: 38, train_loss: 0.6012, test_loss: 1.0422, test_f1: 0.6454
 epoch: 39, train_loss: 0.6015, test_loss: 1.0362, test_f1: 0.6282
 epoch: 40, train_loss: 0.6065, test_loss: 1.0134, test_f1: 0.6089
 epoch: 41, train_loss: 0.6051, test_loss: 0.9813, test_f1: 0.6173
 epoch: 42, train_loss: 0.5810, test_loss: 1.2224, test_f1: 0.5839
 epoch: 43, train_loss: 0.5999, test_loss: 1.0300, test_f1: 0.6139
 epoch: 44, train_loss: 0.5841, test_loss: 0.9997, test_f1: 0.6406
 epoch: 45, train_loss: 0.5660, test_loss: 1.0849, test_f1: 0.6445
 epoch: 46, train_loss: 0.5693, test_loss: 1.0080, test_f1: 0.6518
 epoch: 47, train_loss: 0.5687, test_loss: 1.2453, test_f1: 0.5796
 epoch: 48, train_loss: 0.5664, test_loss: 1.1461, test_f1: 0.6180
 epoch: 49, train_loss: 0.5626, test_loss: 1.0033, test_f1: 0.6571
 epoch: 50, train_loss: 0.5512, test_loss: 1.0583, test_f1: 0.6216
 epoch: 51, train_loss: 0.5222, test_loss: 1.1044, test_f1: 0.6294
 epoch: 52, train_loss: 0.4926, test_loss: 1.0734, test_f1: 0.6461
 epoch: 53, train_loss: 0.4766, test_loss: 1.0420, test_f1: 0.6572
 epoch: 54, train_loss: 0.4797, test_loss: 1.1490, test_f1: 0.6426
 epoch: 55, train_loss: 0.4636, test_loss: 1.1267, test_f1: 0.6609
 epoch: 56, train_loss: 0.4565, test_loss: 1.0962, test_f1: 0.6513
 epoch: 57, train_loss: 0.4533, test_loss: 1.1165, test_f1: 0.6492
 epoch: 58, train_loss: 0.4570, test_loss: 1.1926, test_f1: 0.6435
 epoch: 59, train_loss: 0.4586, test_loss: 1.0986, test_f1: 0.6437
 epoch: 60, train_loss: 0.4615, test_loss: 1.1649, test_f1: 0.6473
 epoch: 61, train_loss: 0.4343, test_loss: 1.2313, test_f1: 0.6469
 epoch: 62, train_loss: 0.4594, test_loss: 1.1963, test_f1: 0.6416
 epoch: 63, train_loss: 0.4313, test_loss: 1.1646, test_f1: 0.6502
 epoch: 64, train_loss: 0.4475, test_loss: 1.1000, test_f1: 0.6801
 epoch: 65, train_loss: 0.4230, test_loss: 1.2803, test_f1: 0.6508
 epoch: 66, train_loss: 0.4369, test_loss: 1.1943, test_f1: 0.6575
 epoch: 67, train_loss: 0.4228, test_loss: 1.1433, test_f1: 0.6660
 epoch: 68, train_loss: 0.4274, test_loss: 1.3305, test_f1: 0.6132
 epoch: 69, train_loss: 0.4048, test_loss: 1.3002, test_f1: 0.6300
 epoch: 70, train_loss: 0.4058, test_loss: 1.3950, test_f1: 0.6232
 epoch: 71, train_loss: 0.4295, test_loss: 1.1406, test_f1: 0.6453
 epoch: 72, train_loss: 0.3949, test_loss: 1.1361, test_f1: 0.6710
 epoch: 73, train_loss: 0.3845, test_loss: 1.1883, test_f1: 0.6717
 epoch: 74, train_loss: 0.4041, test_loss: 1.2776, test_f1: 0.6592
 epoch: 75, train_loss: 0.4017, test_loss: 1.0827, test_f1: 0.6800
 epoch: 76, train_loss: 0.3882, test_loss: 1.2556, test_f1: 0.6100
 epoch: 77, train_loss: 0.3960, test_loss: 1.2857, test_f1: 0.6304
 epoch: 78, train_loss: 0.3913, test_loss: 1.2821, test_f1: 0.6461
 epoch: 79, train_loss: 0.3957, test_loss: 1.2975, test_f1: 0.6443
 epoch: 80, train_loss: 0.3855, test_loss: 1.2663, test_f1: 0.6723
 epoch: 81, train_loss: 0.3741, test_loss: 1.1867, test_f1: 0.6692
 epoch: 82, train_loss: 0.3625, test_loss: 1.1703, test_f1: 0.6853
 epoch: 83, train_loss: 0.3743, test_loss: 1.2079, test_f1: 0.6673
 epoch: 84, train_loss: 0.3972, test_loss: 1.2251, test_f1: 0.6408
 epoch: 85, train_loss: 0.3548, test_loss: 1.2258, test_f1: 0.6917
 epoch: 86, train_loss: 0.3644, test_loss: 1.4651, test_f1: 0.6251
 epoch: 87, train_loss: 0.3659, test_loss: 1.3605, test_f1: 0.6617
 epoch: 88, train_loss: 0.3516, test_loss: 1.1971, test_f1: 0.6553
 epoch: 89, train_loss: 0.3576, test_loss: 1.2289, test_f1: 0.6891
 epoch: 90, train_loss: 0.3562, test_loss: 1.3484, test_f1: 0.6421
 epoch: 91, train_loss: 0.3864, test_loss: 1.2335, test_f1: 0.6619
 epoch: 92, train_loss: 0.3638, test_loss: 1.2154, test_f1: 0.6532
 epoch: 93, train_loss: 0.3463, test_loss: 1.2946, test_f1: 0.6396
 epoch: 94, train_loss: 0.3563, test_loss: 1.1698, test_f1: 0.6775
 epoch: 95, train_loss: 0.3460, test_loss: 1.2771, test_f1: 0.6474
 epoch: 96, train_loss: 0.3508, test_loss: 1.3900, test_f1: 0.6174
 epoch: 97, train_loss: 0.3585, test_loss: 1.3256, test_f1: 0.6545
 epoch: 98, train_loss: 0.3509, test_loss: 1.2546, test_f1: 0.6443
 epoch: 99, train_loss: 0.3347, test_loss: 1.2864, test_f1: 0.6484
##################ITERATION #7 ****************************************
 epoch: 0, train_loss: 1.2808, test_loss: 1.1378, test_f1: 0.3771
 epoch: 1, train_loss: 1.0012, test_loss: 1.0293, test_f1: 0.5149
 epoch: 2, train_loss: 0.9618, test_loss: 1.0323, test_f1: 0.5119
 epoch: 3, train_loss: 0.9361, test_loss: 1.0427, test_f1: 0.5428
 epoch: 4, train_loss: 0.9097, test_loss: 1.0958, test_f1: 0.4682
 epoch: 5, train_loss: 0.9094, test_loss: 1.0301, test_f1: 0.5039
 epoch: 6, train_loss: 0.8891, test_loss: 1.4061, test_f1: 0.4471
 epoch: 7, train_loss: 0.8500, test_loss: 1.1005, test_f1: 0.5248
 epoch: 8, train_loss: 0.8700, test_loss: 1.0746, test_f1: 0.4789
 epoch: 9, train_loss: 0.8390, test_loss: 0.9925, test_f1: 0.5341
 epoch: 10, train_loss: 0.8198, test_loss: 0.8703, test_f1: 0.5643
 epoch: 11, train_loss: 0.8090, test_loss: 1.0189, test_f1: 0.5845
 epoch: 12, train_loss: 0.7915, test_loss: 1.1444, test_f1: 0.4882
 epoch: 13, train_loss: 0.7828, test_loss: 0.9388, test_f1: 0.5614
 epoch: 14, train_loss: 0.7822, test_loss: 0.9135, test_f1: 0.6015
 epoch: 15, train_loss: 0.7610, test_loss: 1.0665, test_f1: 0.5197
 epoch: 16, train_loss: 0.7594, test_loss: 0.8853, test_f1: 0.6101
 epoch: 17, train_loss: 0.7594, test_loss: 0.9046, test_f1: 0.5851
 epoch: 18, train_loss: 0.7518, test_loss: 0.8850, test_f1: 0.5907
 epoch: 19, train_loss: 0.7395, test_loss: 1.1608, test_f1: 0.5325
 epoch: 20, train_loss: 0.7347, test_loss: 0.9861, test_f1: 0.5641
 epoch: 21, train_loss: 0.7426, test_loss: 0.9176, test_f1: 0.6236
 epoch: 22, train_loss: 0.7113, test_loss: 0.8778, test_f1: 0.6362
 epoch: 23, train_loss: 0.7218, test_loss: 0.9426, test_f1: 0.5710
 epoch: 24, train_loss: 0.7037, test_loss: 1.1164, test_f1: 0.5712
 epoch: 25, train_loss: 0.6882, test_loss: 0.8208, test_f1: 0.6213
 epoch: 26, train_loss: 0.6894, test_loss: 1.0187, test_f1: 0.6057
 epoch: 27, train_loss: 0.6595, test_loss: 0.9487, test_f1: 0.5861
 epoch: 28, train_loss: 0.6612, test_loss: 1.1773, test_f1: 0.5658
 epoch: 29, train_loss: 0.6653, test_loss: 1.2216, test_f1: 0.5459
 epoch: 30, train_loss: 0.6668, test_loss: 0.9484, test_f1: 0.6487
 epoch: 31, train_loss: 0.6706, test_loss: 0.9775, test_f1: 0.6464
 epoch: 32, train_loss: 0.6609, test_loss: 0.9694, test_f1: 0.6144
 epoch: 33, train_loss: 0.6406, test_loss: 0.9442, test_f1: 0.6267
 epoch: 34, train_loss: 0.6356, test_loss: 1.0117, test_f1: 0.5590
 epoch: 35, train_loss: 0.6419, test_loss: 0.9578, test_f1: 0.6260
 epoch: 36, train_loss: 0.6253, test_loss: 1.0304, test_f1: 0.6047
 epoch: 37, train_loss: 0.6407, test_loss: 1.2568, test_f1: 0.5614
 epoch: 38, train_loss: 0.6322, test_loss: 1.0022, test_f1: 0.6192
 epoch: 39, train_loss: 0.6258, test_loss: 1.0423, test_f1: 0.6187
 epoch: 40, train_loss: 0.5923, test_loss: 1.0867, test_f1: 0.5575
 epoch: 41, train_loss: 0.6156, test_loss: 1.0965, test_f1: 0.5902
 epoch: 42, train_loss: 0.6194, test_loss: 1.0720, test_f1: 0.6178
 epoch: 43, train_loss: 0.6041, test_loss: 1.6833, test_f1: 0.4242
 epoch: 44, train_loss: 0.6113, test_loss: 1.0276, test_f1: 0.5772
 epoch: 45, train_loss: 0.5796, test_loss: 1.0799, test_f1: 0.6107
 epoch: 46, train_loss: 0.5765, test_loss: 1.2436, test_f1: 0.6049
 epoch: 47, train_loss: 0.5847, test_loss: 1.0699, test_f1: 0.6508
 epoch: 48, train_loss: 0.5765, test_loss: 1.1302, test_f1: 0.5975
 epoch: 49, train_loss: 0.6027, test_loss: 0.8750, test_f1: 0.6209
 epoch: 50, train_loss: 0.5462, test_loss: 1.2465, test_f1: 0.5880
 epoch: 51, train_loss: 0.5350, test_loss: 1.0314, test_f1: 0.6291
 epoch: 52, train_loss: 0.5024, test_loss: 0.9733, test_f1: 0.6454
 epoch: 53, train_loss: 0.4686, test_loss: 1.0960, test_f1: 0.6696
 epoch: 54, train_loss: 0.4724, test_loss: 1.1359, test_f1: 0.6193
 epoch: 55, train_loss: 0.4694, test_loss: 1.1165, test_f1: 0.6443
 epoch: 56, train_loss: 0.4557, test_loss: 1.1501, test_f1: 0.6376
 epoch: 57, train_loss: 0.4551, test_loss: 1.1369, test_f1: 0.6549
 epoch: 58, train_loss: 0.4796, test_loss: 1.3277, test_f1: 0.6163
 epoch: 59, train_loss: 0.4518, test_loss: 1.4074, test_f1: 0.6411
 epoch: 60, train_loss: 0.4565, test_loss: 1.2819, test_f1: 0.6288
 epoch: 61, train_loss: 0.4623, test_loss: 1.1898, test_f1: 0.6407
 epoch: 62, train_loss: 0.4712, test_loss: 1.4711, test_f1: 0.5969
 epoch: 63, train_loss: 0.4389, test_loss: 1.4419, test_f1: 0.6157
 epoch: 64, train_loss: 0.4418, test_loss: 0.9882, test_f1: 0.6588
 epoch: 65, train_loss: 0.4214, test_loss: 1.3802, test_f1: 0.6542
 epoch: 66, train_loss: 0.4331, test_loss: 1.2720, test_f1: 0.6503
 epoch: 67, train_loss: 0.4315, test_loss: 1.2308, test_f1: 0.6339
 epoch: 68, train_loss: 0.4224, test_loss: 1.1425, test_f1: 0.6914
 epoch: 69, train_loss: 0.4243, test_loss: 1.0557, test_f1: 0.6805
 epoch: 70, train_loss: 0.4454, test_loss: 1.2447, test_f1: 0.6529
 epoch: 71, train_loss: 0.4355, test_loss: 1.5281, test_f1: 0.6099
 epoch: 72, train_loss: 0.4290, test_loss: 1.1065, test_f1: 0.6543
 epoch: 73, train_loss: 0.4001, test_loss: 1.3541, test_f1: 0.6311
 epoch: 74, train_loss: 0.4200, test_loss: 1.1742, test_f1: 0.6600
 epoch: 75, train_loss: 0.4288, test_loss: 1.1019, test_f1: 0.6823
 epoch: 76, train_loss: 0.4168, test_loss: 1.0280, test_f1: 0.6573
 epoch: 77, train_loss: 0.4090, test_loss: 1.2498, test_f1: 0.6282
 epoch: 78, train_loss: 0.4151, test_loss: 1.6147, test_f1: 0.6444
 epoch: 79, train_loss: 0.4231, test_loss: 1.2760, test_f1: 0.6715
 epoch: 80, train_loss: 0.4278, test_loss: 1.4720, test_f1: 0.6264
 epoch: 81, train_loss: 0.4104, test_loss: 1.3477, test_f1: 0.6693
 epoch: 82, train_loss: 0.4060, test_loss: 1.2904, test_f1: 0.6344
 epoch: 83, train_loss: 0.3888, test_loss: 1.3364, test_f1: 0.6342
 epoch: 84, train_loss: 0.3884, test_loss: 1.2311, test_f1: 0.6603
 epoch: 85, train_loss: 0.3744, test_loss: 1.2580, test_f1: 0.6576
 epoch: 86, train_loss: 0.3819, test_loss: 1.3543, test_f1: 0.6602
 epoch: 87, train_loss: 0.3741, test_loss: 1.4250, test_f1: 0.6541
 epoch: 88, train_loss: 0.3881, test_loss: 1.5418, test_f1: 0.6613
 epoch: 89, train_loss: 0.4005, test_loss: 1.4898, test_f1: 0.6462
 epoch: 90, train_loss: 0.3974, test_loss: 1.1754, test_f1: 0.6608
 epoch: 91, train_loss: 0.3948, test_loss: 1.7424, test_f1: 0.6109
 epoch: 92, train_loss: 0.3815, test_loss: 1.2501, test_f1: 0.6591
 epoch: 93, train_loss: 0.3682, test_loss: 1.3929, test_f1: 0.6199
 epoch: 94, train_loss: 0.3703, test_loss: 1.1707, test_f1: 0.6695
 epoch: 95, train_loss: 0.3650, test_loss: 1.2151, test_f1: 0.6561
 epoch: 96, train_loss: 0.3870, test_loss: 1.2305, test_f1: 0.6602
 epoch: 97, train_loss: 0.3820, test_loss: 1.2192, test_f1: 0.6749
 epoch: 98, train_loss: 0.3703, test_loss: 1.6141, test_f1: 0.6420
 epoch: 99, train_loss: 0.3811, test_loss: 1.4524, test_f1: 0.6521
##################ITERATION #8 ****************************************
 epoch: 0, train_loss: 1.2335, test_loss: 1.0707, test_f1: 0.4940
 epoch: 1, train_loss: 1.0123, test_loss: 1.1405, test_f1: 0.3584
 epoch: 2, train_loss: 0.9709, test_loss: 1.0345, test_f1: 0.4668
 epoch: 3, train_loss: 0.9463, test_loss: 1.1216, test_f1: 0.4145
 epoch: 4, train_loss: 0.9285, test_loss: 1.0547, test_f1: 0.5052
 epoch: 5, train_loss: 0.9032, test_loss: 0.9423, test_f1: 0.5426
 epoch: 6, train_loss: 0.8802, test_loss: 0.8994, test_f1: 0.5457
 epoch: 7, train_loss: 0.8512, test_loss: 0.9777, test_f1: 0.5173
 epoch: 8, train_loss: 0.8456, test_loss: 1.1109, test_f1: 0.4225
 epoch: 9, train_loss: 0.8350, test_loss: 0.9977, test_f1: 0.5707
 epoch: 10, train_loss: 0.8102, test_loss: 1.0207, test_f1: 0.5567
 epoch: 11, train_loss: 0.7994, test_loss: 0.8802, test_f1: 0.6158
 epoch: 12, train_loss: 0.8131, test_loss: 1.1202, test_f1: 0.4919
 epoch: 13, train_loss: 0.7913, test_loss: 0.8804, test_f1: 0.5869
 epoch: 14, train_loss: 0.7856, test_loss: 0.9644, test_f1: 0.5254
 epoch: 15, train_loss: 0.7508, test_loss: 0.8773, test_f1: 0.5845
 epoch: 16, train_loss: 0.7545, test_loss: 0.8687, test_f1: 0.6075
 epoch: 17, train_loss: 0.7428, test_loss: 0.8841, test_f1: 0.5580
 epoch: 18, train_loss: 0.7354, test_loss: 0.9401, test_f1: 0.5841
 epoch: 19, train_loss: 0.7198, test_loss: 0.8277, test_f1: 0.6161
 epoch: 20, train_loss: 0.7149, test_loss: 0.9076, test_f1: 0.6142
 epoch: 21, train_loss: 0.7095, test_loss: 0.9084, test_f1: 0.6142
 epoch: 22, train_loss: 0.6986, test_loss: 0.9024, test_f1: 0.6215
 epoch: 23, train_loss: 0.6991, test_loss: 0.9413, test_f1: 0.5977
 epoch: 24, train_loss: 0.6835, test_loss: 0.8872, test_f1: 0.6306
 epoch: 25, train_loss: 0.6643, test_loss: 0.9527, test_f1: 0.6194
 epoch: 26, train_loss: 0.6548, test_loss: 0.9378, test_f1: 0.6464
 epoch: 27, train_loss: 0.6692, test_loss: 0.9162, test_f1: 0.5918
 epoch: 28, train_loss: 0.6559, test_loss: 1.1758, test_f1: 0.5314
 epoch: 29, train_loss: 0.6598, test_loss: 0.9317, test_f1: 0.5889
 epoch: 30, train_loss: 0.6753, test_loss: 0.8863, test_f1: 0.5964
 epoch: 31, train_loss: 0.6478, test_loss: 0.8948, test_f1: 0.6317
 epoch: 32, train_loss: 0.6212, test_loss: 0.9485, test_f1: 0.6029
 epoch: 33, train_loss: 0.6096, test_loss: 0.9035, test_f1: 0.5989
 epoch: 34, train_loss: 0.5984, test_loss: 1.0086, test_f1: 0.6170
 epoch: 35, train_loss: 0.6166, test_loss: 0.9491, test_f1: 0.6047
 epoch: 36, train_loss: 0.6119, test_loss: 0.9312, test_f1: 0.6357
 epoch: 37, train_loss: 0.6028, test_loss: 0.9653, test_f1: 0.6307
 epoch: 38, train_loss: 0.5794, test_loss: 0.9961, test_f1: 0.6438
 epoch: 39, train_loss: 0.5768, test_loss: 1.2422, test_f1: 0.5295
 epoch: 40, train_loss: 0.5826, test_loss: 0.9614, test_f1: 0.6326
 epoch: 41, train_loss: 0.5918, test_loss: 1.2491, test_f1: 0.5497
 epoch: 42, train_loss: 0.5837, test_loss: 0.9376, test_f1: 0.6746
 epoch: 43, train_loss: 0.5663, test_loss: 0.9632, test_f1: 0.6552
 epoch: 44, train_loss: 0.5640, test_loss: 0.9551, test_f1: 0.6438
 epoch: 45, train_loss: 0.5592, test_loss: 0.9334, test_f1: 0.6809
 epoch: 46, train_loss: 0.5526, test_loss: 1.0217, test_f1: 0.6478
 epoch: 47, train_loss: 0.5619, test_loss: 1.6985, test_f1: 0.4599
 epoch: 48, train_loss: 0.5383, test_loss: 0.9630, test_f1: 0.6352
 epoch: 49, train_loss: 0.5118, test_loss: 1.0051, test_f1: 0.6654
 epoch: 50, train_loss: 0.5444, test_loss: 0.9756, test_f1: 0.6387
 epoch: 51, train_loss: 0.5079, test_loss: 1.0221, test_f1: 0.6560
 epoch: 52, train_loss: 0.4544, test_loss: 1.0520, test_f1: 0.6869
 epoch: 53, train_loss: 0.4566, test_loss: 1.1321, test_f1: 0.6462
 epoch: 54, train_loss: 0.4467, test_loss: 1.0758, test_f1: 0.6692
 epoch: 55, train_loss: 0.4433, test_loss: 1.0852, test_f1: 0.6528
 epoch: 56, train_loss: 0.4370, test_loss: 1.2708, test_f1: 0.6416
 epoch: 57, train_loss: 0.4308, test_loss: 1.0947, test_f1: 0.6613
 epoch: 58, train_loss: 0.4299, test_loss: 1.1094, test_f1: 0.6600
 epoch: 59, train_loss: 0.4289, test_loss: 1.1444, test_f1: 0.6408
 epoch: 60, train_loss: 0.4270, test_loss: 1.2504, test_f1: 0.6436
 epoch: 61, train_loss: 0.4076, test_loss: 1.1261, test_f1: 0.6764
 epoch: 62, train_loss: 0.3914, test_loss: 1.2504, test_f1: 0.6288
 epoch: 63, train_loss: 0.4147, test_loss: 1.1858, test_f1: 0.6373
 epoch: 64, train_loss: 0.4218, test_loss: 1.1622, test_f1: 0.6555
 epoch: 65, train_loss: 0.3979, test_loss: 1.2327, test_f1: 0.6557
 epoch: 66, train_loss: 0.4133, test_loss: 1.2404, test_f1: 0.6367
 epoch: 67, train_loss: 0.3912, test_loss: 1.1422, test_f1: 0.6613
 epoch: 68, train_loss: 0.3952, test_loss: 1.1449, test_f1: 0.6427
 epoch: 69, train_loss: 0.3993, test_loss: 1.1979, test_f1: 0.6606
 epoch: 70, train_loss: 0.3789, test_loss: 1.1927, test_f1: 0.6855
 epoch: 71, train_loss: 0.3933, test_loss: 1.2014, test_f1: 0.6777
 epoch: 72, train_loss: 0.3982, test_loss: 1.1570, test_f1: 0.6548
 epoch: 73, train_loss: 0.3895, test_loss: 1.2467, test_f1: 0.6516
 epoch: 74, train_loss: 0.3720, test_loss: 1.1581, test_f1: 0.6346
 epoch: 75, train_loss: 0.3752, test_loss: 1.3738, test_f1: 0.6116
 epoch: 76, train_loss: 0.3830, test_loss: 1.1444, test_f1: 0.6484
 epoch: 77, train_loss: 0.3814, test_loss: 1.2531, test_f1: 0.6366
 epoch: 78, train_loss: 0.3827, test_loss: 1.2559, test_f1: 0.6688
 epoch: 79, train_loss: 0.3636, test_loss: 1.3325, test_f1: 0.6820
 epoch: 80, train_loss: 0.3482, test_loss: 1.2239, test_f1: 0.6567
 epoch: 81, train_loss: 0.3408, test_loss: 1.2803, test_f1: 0.6380
 epoch: 82, train_loss: 0.3603, test_loss: 1.2788, test_f1: 0.6600
 epoch: 83, train_loss: 0.3811, test_loss: 1.2091, test_f1: 0.6557
 epoch: 84, train_loss: 0.3678, test_loss: 1.4580, test_f1: 0.6295
 epoch: 85, train_loss: 0.3554, test_loss: 1.3550, test_f1: 0.6251
 epoch: 86, train_loss: 0.3271, test_loss: 1.1928, test_f1: 0.6874
 epoch: 87, train_loss: 0.3450, test_loss: 1.4479, test_f1: 0.6404
 epoch: 88, train_loss: 0.3602, test_loss: 1.2506, test_f1: 0.6390
 epoch: 89, train_loss: 0.3190, test_loss: 1.2584, test_f1: 0.6578
 epoch: 90, train_loss: 0.3311, test_loss: 1.3404, test_f1: 0.6363
 epoch: 91, train_loss: 0.3304, test_loss: 1.2104, test_f1: 0.6427
 epoch: 92, train_loss: 0.3583, test_loss: 1.1805, test_f1: 0.6646
 epoch: 93, train_loss: 0.3184, test_loss: 1.4610, test_f1: 0.6190
 epoch: 94, train_loss: 0.3401, test_loss: 1.3092, test_f1: 0.6547
 epoch: 95, train_loss: 0.3333, test_loss: 1.1866, test_f1: 0.6514
 epoch: 96, train_loss: 0.3197, test_loss: 1.3903, test_f1: 0.6396
 epoch: 97, train_loss: 0.3406, test_loss: 1.4809, test_f1: 0.6165
 epoch: 98, train_loss: 0.3016, test_loss: 1.3590, test_f1: 0.6540
 epoch: 99, train_loss: 0.3256, test_loss: 1.2764, test_f1: 0.6398
##################ITERATION #9 ****************************************
 epoch: 0, train_loss: 1.2669, test_loss: 1.2209, test_f1: 0.4201
 epoch: 1, train_loss: 1.0295, test_loss: 1.0329, test_f1: 0.5346
 epoch: 2, train_loss: 0.9689, test_loss: 1.0227, test_f1: 0.5622
 epoch: 3, train_loss: 0.9463, test_loss: 1.0302, test_f1: 0.4946
 epoch: 4, train_loss: 0.9189, test_loss: 1.1020, test_f1: 0.4631
 epoch: 5, train_loss: 0.8794, test_loss: 0.9512, test_f1: 0.5257
 epoch: 6, train_loss: 0.8539, test_loss: 0.9529, test_f1: 0.5540
 epoch: 7, train_loss: 0.8397, test_loss: 0.8610, test_f1: 0.6038
 epoch: 8, train_loss: 0.8229, test_loss: 0.9560, test_f1: 0.5606
 epoch: 9, train_loss: 0.8115, test_loss: 0.9268, test_f1: 0.5919
 epoch: 10, train_loss: 0.7915, test_loss: 1.0565, test_f1: 0.5091
 epoch: 11, train_loss: 0.7841, test_loss: 0.8756, test_f1: 0.6097
 epoch: 12, train_loss: 0.7818, test_loss: 0.9705, test_f1: 0.5471
 epoch: 13, train_loss: 0.7654, test_loss: 1.0280, test_f1: 0.5728
 epoch: 14, train_loss: 0.7628, test_loss: 0.8855, test_f1: 0.5654
 epoch: 15, train_loss: 0.7636, test_loss: 0.9192, test_f1: 0.5561
 epoch: 16, train_loss: 0.7353, test_loss: 1.0951, test_f1: 0.5139
 epoch: 17, train_loss: 0.7234, test_loss: 0.8356, test_f1: 0.6385
 epoch: 18, train_loss: 0.7299, test_loss: 0.9611, test_f1: 0.5857
 epoch: 19, train_loss: 0.7406, test_loss: 0.9185, test_f1: 0.5606
 epoch: 20, train_loss: 0.7046, test_loss: 1.3261, test_f1: 0.5288
 epoch: 21, train_loss: 0.7079, test_loss: 0.9477, test_f1: 0.5702
 epoch: 22, train_loss: 0.6883, test_loss: 1.1174, test_f1: 0.5706
 epoch: 23, train_loss: 0.7155, test_loss: 0.9182, test_f1: 0.6183
 epoch: 24, train_loss: 0.6815, test_loss: 0.8907, test_f1: 0.6016
 epoch: 25, train_loss: 0.6736, test_loss: 1.0439, test_f1: 0.5606
 epoch: 26, train_loss: 0.6757, test_loss: 0.8412, test_f1: 0.6241
 epoch: 27, train_loss: 0.6594, test_loss: 1.2778, test_f1: 0.5657
 epoch: 28, train_loss: 0.6531, test_loss: 0.8421, test_f1: 0.6189
 epoch: 29, train_loss: 0.6452, test_loss: 0.9771, test_f1: 0.6051
 epoch: 30, train_loss: 0.6378, test_loss: 1.0146, test_f1: 0.5893
 epoch: 31, train_loss: 0.6186, test_loss: 0.9754, test_f1: 0.6259
 epoch: 32, train_loss: 0.6272, test_loss: 0.9830, test_f1: 0.6002
 epoch: 33, train_loss: 0.6410, test_loss: 0.9631, test_f1: 0.5964
 epoch: 34, train_loss: 0.6376, test_loss: 0.8788, test_f1: 0.6104
 epoch: 35, train_loss: 0.6213, test_loss: 1.8348, test_f1: 0.4031
 epoch: 36, train_loss: 0.5991, test_loss: 0.8264, test_f1: 0.6410
 epoch: 37, train_loss: 0.5916, test_loss: 0.7345, test_f1: 0.6583
 epoch: 38, train_loss: 0.5913, test_loss: 0.9580, test_f1: 0.6151
 epoch: 39, train_loss: 0.5864, test_loss: 0.9644, test_f1: 0.6141
 epoch: 40, train_loss: 0.5934, test_loss: 1.1472, test_f1: 0.5672
 epoch: 41, train_loss: 0.5822, test_loss: 1.1895, test_f1: 0.5637
 epoch: 42, train_loss: 0.6058, test_loss: 0.9141, test_f1: 0.6278
 epoch: 43, train_loss: 0.5880, test_loss: 1.1968, test_f1: 0.5509
 epoch: 44, train_loss: 0.5845, test_loss: 1.2745, test_f1: 0.5538
 epoch: 45, train_loss: 0.5863, test_loss: 0.8882, test_f1: 0.6139
 epoch: 46, train_loss: 0.5921, test_loss: 2.1211, test_f1: 0.4033
 epoch: 47, train_loss: 0.5890, test_loss: 0.8368, test_f1: 0.6593
 epoch: 48, train_loss: 0.5746, test_loss: 1.0035, test_f1: 0.6060
 epoch: 49, train_loss: 0.5582, test_loss: 1.0075, test_f1: 0.6385
 epoch: 50, train_loss: 0.5674, test_loss: 0.9299, test_f1: 0.6460
 epoch: 51, train_loss: 0.5462, test_loss: 0.9242, test_f1: 0.6548
 epoch: 52, train_loss: 0.4888, test_loss: 0.8649, test_f1: 0.6829
 epoch: 53, train_loss: 0.4781, test_loss: 0.8357, test_f1: 0.6741
 epoch: 54, train_loss: 0.4825, test_loss: 0.8726, test_f1: 0.6747
 epoch: 55, train_loss: 0.4688, test_loss: 0.9712, test_f1: 0.6601
 epoch: 56, train_loss: 0.4560, test_loss: 0.9470, test_f1: 0.6818
 epoch: 57, train_loss: 0.4498, test_loss: 1.0033, test_f1: 0.6460
 epoch: 58, train_loss: 0.4814, test_loss: 0.8246, test_f1: 0.6735
 epoch: 59, train_loss: 0.4458, test_loss: 0.9118, test_f1: 0.6498
 epoch: 60, train_loss: 0.4526, test_loss: 0.8871, test_f1: 0.6560
 epoch: 61, train_loss: 0.4272, test_loss: 0.9691, test_f1: 0.6518
 epoch: 62, train_loss: 0.4301, test_loss: 1.0337, test_f1: 0.6676
 epoch: 63, train_loss: 0.4442, test_loss: 1.0137, test_f1: 0.6485
 epoch: 64, train_loss: 0.4193, test_loss: 0.9573, test_f1: 0.6424
 epoch: 65, train_loss: 0.4219, test_loss: 1.0118, test_f1: 0.6335
 epoch: 66, train_loss: 0.4329, test_loss: 0.9347, test_f1: 0.6691
 epoch: 67, train_loss: 0.4190, test_loss: 0.9325, test_f1: 0.6408
 epoch: 68, train_loss: 0.4115, test_loss: 0.9758, test_f1: 0.6434
 epoch: 69, train_loss: 0.4297, test_loss: 0.9202, test_f1: 0.6490
 epoch: 70, train_loss: 0.4109, test_loss: 1.0607, test_f1: 0.6612
 epoch: 71, train_loss: 0.3954, test_loss: 1.0063, test_f1: 0.6482
 epoch: 72, train_loss: 0.4081, test_loss: 1.0354, test_f1: 0.6620
 epoch: 73, train_loss: 0.4054, test_loss: 1.0315, test_f1: 0.6325
 epoch: 74, train_loss: 0.4272, test_loss: 0.9544, test_f1: 0.6788
 epoch: 75, train_loss: 0.4184, test_loss: 0.8980, test_f1: 0.6636
 epoch: 76, train_loss: 0.4154, test_loss: 0.9632, test_f1: 0.6646
 epoch: 77, train_loss: 0.3989, test_loss: 0.9155, test_f1: 0.6411
 epoch: 78, train_loss: 0.4185, test_loss: 1.0524, test_f1: 0.6732
 epoch: 79, train_loss: 0.3785, test_loss: 1.0312, test_f1: 0.6624
 epoch: 80, train_loss: 0.3727, test_loss: 1.1134, test_f1: 0.6557
 epoch: 81, train_loss: 0.3706, test_loss: 1.1003, test_f1: 0.6355
 epoch: 82, train_loss: 0.3645, test_loss: 1.0652, test_f1: 0.6204
 epoch: 83, train_loss: 0.3920, test_loss: 1.4317, test_f1: 0.6286
 epoch: 84, train_loss: 0.3912, test_loss: 1.0102, test_f1: 0.6884
 epoch: 85, train_loss: 0.3868, test_loss: 1.1597, test_f1: 0.6528
 epoch: 86, train_loss: 0.3923, test_loss: 1.0700, test_f1: 0.6528
 epoch: 87, train_loss: 0.3794, test_loss: 1.1221, test_f1: 0.6492
 epoch: 88, train_loss: 0.3786, test_loss: 1.1131, test_f1: 0.6642
 epoch: 89, train_loss: 0.3548, test_loss: 1.1731, test_f1: 0.6440
 epoch: 90, train_loss: 0.3653, test_loss: 1.1352, test_f1: 0.6616
 epoch: 91, train_loss: 0.3523, test_loss: 1.0372, test_f1: 0.6505
 epoch: 92, train_loss: 0.3686, test_loss: 1.2186, test_f1: 0.6299
 epoch: 93, train_loss: 0.3544, test_loss: 1.0207, test_f1: 0.6561
 epoch: 94, train_loss: 0.3615, test_loss: 0.9698, test_f1: 0.6655
 epoch: 95, train_loss: 0.3379, test_loss: 1.1042, test_f1: 0.6530
 epoch: 96, train_loss: 0.3456, test_loss: 1.1928, test_f1: 0.6240
 epoch: 97, train_loss: 0.3328, test_loss: 1.1209, test_f1: 0.6637
 epoch: 98, train_loss: 0.3347, test_loss: 1.1033, test_f1: 0.6547
 epoch: 99, train_loss: 0.3476, test_loss: 1.0774, test_f1: 0.6572

Training completed in 482.20 seconds
Best F1: 0.7099 at epoch 86
Mean F1 across iterations: 0.6913  0.0095
========================FINAL RESULTS================================
FEGIN weighted F1: 0.7099  0.0095
python main.py --data ltspice_examples --representation component_pin --model FEGIN --layers 3 --hiddens 64 --batch_size 128 --lr 0.01 --emb_size 250 --epochs 100 --save_appendix component_pin_L3_H64_BS128_LR0.01_E250 --no_val
-----



STDERR:
  File "main.py", line 370, in <module>
    main()
  File "main.py", line 254, in main
    dataset = dataset_class(
  File "/home/philip/projects/ltspice_examples_code_repo/Circuit-Completion-Using-GNNs/component_classification_with_link_prediction_head/evaluation/FEGIN/kernel/circuit_datasets.py", line 15, in __init__
    self.data, self.slices = torch.load(self.processed_paths[0])
  File "/home/philip/.local/lib/python3.8/site-packages/torch/serialization.py", line 1040, in load
    warnings.warn(
  File "/usr/lib/python3.8/warnings.py", line 109, in _showwarnmsg
    sw(msg.message, msg.category, msg.filename, msg.lineno,
  File "main.py", line 47, in warn_with_traceback
    traceback.print_stack(file=log)
/home/philip/projects/ltspice_examples_code_repo/Circuit-Completion-Using-GNNs/component_classification_with_link_prediction_head/evaluation/FEGIN/kernel/circuit_datasets.py:15: FutureWarning: You are using `torch.load` with `weights_only=False` (the current default value), which uses the default pickle module implicitly. It is possible to construct malicious pickle data which will execute arbitrary code during unpickling (See https://github.com/pytorch/pytorch/blob/main/SECURITY.md#untrusted-models for more details). In a future release, the default value for `weights_only` will be flipped to `True`. This limits the functions that could be executed during unpickling. Arbitrary objects will no longer be allowed to be loaded via this mode unless they are explicitly allowlisted by the user via `torch.serialization.add_safe_globals`. We recommend you start setting `weights_only=True` for any use case where you don't have full control of the loaded file. Please open an issue on GitHub for any issues related to this experimental feature.
  self.data, self.slices = torch.load(self.processed_paths[0])
