STDOUT:
Results will be saved in /home/philip/projects/ltspice_examples_code_repo/Circuit-Completion-Using-GNNs/component_classification_with_link_prediction_head/evaluation/FEGIN/results/model_FEGIN_dataset_ltspice_demos
Command line input: python main.py --data ltspice_demos --representation component_pin --model FEGIN --layers 5 --hiddens 16 --batch_size 256 --lr 0.001 --emb_size 128 --epochs 100 --save_appendix component_pin_L5_H16_BS256_LR0.001_E128 --no_val
 is saved.
-----
ltspice_demos - FEGIN
Using 5 layers, 16 hidden units, h = 2
Loading component_pin representation dataset
ENTERED
Training FEGIN on component_pin representation
Train: 1565, Test: 383
##################ITERATION #0 ****************************************
 epoch: 0, train_loss: 1.4767, test_loss: 1.4581, test_f1: 0.0507
 epoch: 1, train_loss: 1.4640, test_loss: 1.4522, test_f1: 0.0507
 epoch: 2, train_loss: 1.4564, test_loss: 1.4456, test_f1: 0.0507
 epoch: 3, train_loss: 1.4486, test_loss: 1.4393, test_f1: 0.0507
 epoch: 4, train_loss: 1.4397, test_loss: 1.4321, test_f1: 0.0507
 epoch: 5, train_loss: 1.4297, test_loss: 1.4214, test_f1: 0.0507
 epoch: 6, train_loss: 1.4164, test_loss: 1.4068, test_f1: 0.0507
 epoch: 7, train_loss: 1.4020, test_loss: 1.3891, test_f1: 0.0507
 epoch: 8, train_loss: 1.3848, test_loss: 1.3666, test_f1: 0.2055
 epoch: 9, train_loss: 1.3588, test_loss: 1.3454, test_f1: 0.2632
 epoch: 10, train_loss: 1.3391, test_loss: 1.3269, test_f1: 0.3254
 epoch: 11, train_loss: 1.3113, test_loss: 1.3118, test_f1: 0.3469
 epoch: 12, train_loss: 1.2925, test_loss: 1.2973, test_f1: 0.3684
 epoch: 13, train_loss: 1.2753, test_loss: 1.2870, test_f1: 0.3324
 epoch: 14, train_loss: 1.2463, test_loss: 1.2779, test_f1: 0.3124
 epoch: 15, train_loss: 1.2426, test_loss: 1.2701, test_f1: 0.3088
 epoch: 16, train_loss: 1.2237, test_loss: 1.2625, test_f1: 0.3298
 epoch: 17, train_loss: 1.2209, test_loss: 1.2581, test_f1: 0.3361
 epoch: 18, train_loss: 1.2119, test_loss: 1.2464, test_f1: 0.3331
 epoch: 19, train_loss: 1.1979, test_loss: 1.2381, test_f1: 0.3310
 epoch: 20, train_loss: 1.1847, test_loss: 1.2266, test_f1: 0.3322
 epoch: 21, train_loss: 1.1707, test_loss: 1.2193, test_f1: 0.3349
 epoch: 22, train_loss: 1.1567, test_loss: 1.2093, test_f1: 0.3393
 epoch: 23, train_loss: 1.1453, test_loss: 1.1951, test_f1: 0.4156
 epoch: 24, train_loss: 1.1323, test_loss: 1.1831, test_f1: 0.4416
 epoch: 25, train_loss: 1.1175, test_loss: 1.1713, test_f1: 0.4066
 epoch: 26, train_loss: 1.1098, test_loss: 1.1587, test_f1: 0.4196
 epoch: 27, train_loss: 1.0903, test_loss: 1.1274, test_f1: 0.4512
 epoch: 28, train_loss: 1.0704, test_loss: 1.1172, test_f1: 0.4396
 epoch: 29, train_loss: 1.0536, test_loss: 1.1028, test_f1: 0.4511
 epoch: 30, train_loss: 1.0361, test_loss: 1.1020, test_f1: 0.4371
 epoch: 31, train_loss: 1.0323, test_loss: 1.1210, test_f1: 0.3975
 epoch: 32, train_loss: 1.0205, test_loss: 1.2582, test_f1: 0.3096
 epoch: 33, train_loss: 1.0070, test_loss: 1.0657, test_f1: 0.4488
 epoch: 34, train_loss: 0.9903, test_loss: 1.0818, test_f1: 0.4401
 epoch: 35, train_loss: 0.9855, test_loss: 1.1866, test_f1: 0.4279
 epoch: 36, train_loss: 0.9884, test_loss: 1.1333, test_f1: 0.4278
 epoch: 37, train_loss: 0.9762, test_loss: 1.1833, test_f1: 0.4346
 epoch: 38, train_loss: 0.9638, test_loss: 1.0772, test_f1: 0.4264
 epoch: 39, train_loss: 0.9674, test_loss: 1.1493, test_f1: 0.3992
 epoch: 40, train_loss: 0.9496, test_loss: 1.1421, test_f1: 0.4394
 epoch: 41, train_loss: 0.9594, test_loss: 1.2034, test_f1: 0.4358
 epoch: 42, train_loss: 0.9429, test_loss: 1.1140, test_f1: 0.4308
 epoch: 43, train_loss: 0.9324, test_loss: 1.1874, test_f1: 0.4622
 epoch: 44, train_loss: 0.9273, test_loss: 1.1825, test_f1: 0.5083
 epoch: 45, train_loss: 0.9315, test_loss: 1.2615, test_f1: 0.4938
 epoch: 46, train_loss: 0.9248, test_loss: 1.2597, test_f1: 0.5049
 epoch: 47, train_loss: 0.9207, test_loss: 1.2156, test_f1: 0.5012
 epoch: 48, train_loss: 0.9247, test_loss: 1.1329, test_f1: 0.5422
 epoch: 49, train_loss: 0.9159, test_loss: 1.2515, test_f1: 0.4851
 epoch: 50, train_loss: 0.9346, test_loss: 1.3205, test_f1: 0.4627
 epoch: 51, train_loss: 0.9143, test_loss: 1.0875, test_f1: 0.5183
 epoch: 52, train_loss: 0.9070, test_loss: 1.0585, test_f1: 0.5454
 epoch: 53, train_loss: 0.9029, test_loss: 1.0578, test_f1: 0.5663
 epoch: 54, train_loss: 0.8981, test_loss: 1.0647, test_f1: 0.5449
 epoch: 55, train_loss: 0.9001, test_loss: 1.0470, test_f1: 0.5620
 epoch: 56, train_loss: 0.8910, test_loss: 1.0321, test_f1: 0.5672
 epoch: 57, train_loss: 0.8842, test_loss: 1.0397, test_f1: 0.5495
 epoch: 58, train_loss: 0.8812, test_loss: 1.0310, test_f1: 0.5728
 epoch: 59, train_loss: 0.8864, test_loss: 1.0336, test_f1: 0.5778
 epoch: 60, train_loss: 0.8841, test_loss: 1.0336, test_f1: 0.5664
 epoch: 61, train_loss: 0.8755, test_loss: 1.0404, test_f1: 0.5698
 epoch: 62, train_loss: 0.8735, test_loss: 1.0800, test_f1: 0.5408
 epoch: 63, train_loss: 0.8818, test_loss: 1.1275, test_f1: 0.5478
 epoch: 64, train_loss: 0.8705, test_loss: 1.0990, test_f1: 0.5589
 epoch: 65, train_loss: 0.8705, test_loss: 2.4907, test_f1: 0.3212
 epoch: 66, train_loss: 0.8916, test_loss: 1.1242, test_f1: 0.5535
 epoch: 67, train_loss: 0.8711, test_loss: 1.0881, test_f1: 0.5348
 epoch: 68, train_loss: 0.8654, test_loss: 1.1095, test_f1: 0.5435
 epoch: 69, train_loss: 0.8571, test_loss: 1.0989, test_f1: 0.5326
 epoch: 70, train_loss: 0.8704, test_loss: 1.0547, test_f1: 0.5660
 epoch: 71, train_loss: 0.8684, test_loss: 1.0526, test_f1: 0.5627
 epoch: 72, train_loss: 0.8652, test_loss: 1.0519, test_f1: 0.5779
 epoch: 73, train_loss: 0.8628, test_loss: 1.0815, test_f1: 0.5714
 epoch: 74, train_loss: 0.8516, test_loss: 1.1772, test_f1: 0.5366
 epoch: 75, train_loss: 0.8499, test_loss: 1.1101, test_f1: 0.5275
 epoch: 76, train_loss: 0.8651, test_loss: 1.0783, test_f1: 0.5489
 epoch: 77, train_loss: 0.8534, test_loss: 1.0925, test_f1: 0.5508
 epoch: 78, train_loss: 0.8439, test_loss: 1.0888, test_f1: 0.5451
 epoch: 79, train_loss: 0.8426, test_loss: 1.0877, test_f1: 0.5210
 epoch: 80, train_loss: 0.8552, test_loss: 1.0988, test_f1: 0.5105
 epoch: 81, train_loss: 0.8370, test_loss: 1.1197, test_f1: 0.5442
 epoch: 82, train_loss: 0.8431, test_loss: 1.1307, test_f1: 0.5271
 epoch: 83, train_loss: 0.8472, test_loss: 1.2180, test_f1: 0.5450
 epoch: 84, train_loss: 0.8427, test_loss: 1.2244, test_f1: 0.5440
 epoch: 85, train_loss: 0.8449, test_loss: 1.2099, test_f1: 0.5472
 epoch: 86, train_loss: 0.8386, test_loss: 1.1126, test_f1: 0.5393
 epoch: 87, train_loss: 0.8241, test_loss: 1.0975, test_f1: 0.5333
 epoch: 88, train_loss: 0.8358, test_loss: 1.1809, test_f1: 0.5256
 epoch: 89, train_loss: 0.8254, test_loss: 1.2328, test_f1: 0.5371
 epoch: 90, train_loss: 0.8368, test_loss: 1.2500, test_f1: 0.5391
 epoch: 91, train_loss: 0.8309, test_loss: 1.2594, test_f1: 0.5517
 epoch: 92, train_loss: 0.8328, test_loss: 1.1741, test_f1: 0.5299
 epoch: 93, train_loss: 0.8388, test_loss: 1.0750, test_f1: 0.5402
 epoch: 94, train_loss: 0.8368, test_loss: 1.0471, test_f1: 0.5617
 epoch: 95, train_loss: 0.8269, test_loss: 1.0396, test_f1: 0.5600
 epoch: 96, train_loss: 0.8265, test_loss: 1.0422, test_f1: 0.5655
 epoch: 97, train_loss: 0.8185, test_loss: 1.0662, test_f1: 0.5428
 epoch: 98, train_loss: 0.8266, test_loss: 1.1188, test_f1: 0.5397
 epoch: 99, train_loss: 0.8268, test_loss: 1.0706, test_f1: 0.5353
##################ITERATION #1 ****************************************
 epoch: 0, train_loss: 1.3792, test_loss: 1.3780, test_f1: 0.0659
 epoch: 1, train_loss: 1.3546, test_loss: 1.3659, test_f1: 0.1365
 epoch: 2, train_loss: 1.3372, test_loss: 1.3529, test_f1: 0.1365
 epoch: 3, train_loss: 1.3190, test_loss: 1.3403, test_f1: 0.1365
 epoch: 4, train_loss: 1.3003, test_loss: 1.3294, test_f1: 0.1365
 epoch: 5, train_loss: 1.2807, test_loss: 1.3173, test_f1: 0.1458
 epoch: 6, train_loss: 1.2578, test_loss: 1.3040, test_f1: 0.3213
 epoch: 7, train_loss: 1.2448, test_loss: 1.2897, test_f1: 0.3431
 epoch: 8, train_loss: 1.2316, test_loss: 1.2784, test_f1: 0.3319
 epoch: 9, train_loss: 1.2213, test_loss: 1.2677, test_f1: 0.3248
 epoch: 10, train_loss: 1.2150, test_loss: 1.2556, test_f1: 0.3214
 epoch: 11, train_loss: 1.2049, test_loss: 1.2459, test_f1: 0.3322
 epoch: 12, train_loss: 1.1976, test_loss: 1.2388, test_f1: 0.3442
 epoch: 13, train_loss: 1.1833, test_loss: 1.2333, test_f1: 0.3448
 epoch: 14, train_loss: 1.1672, test_loss: 1.2295, test_f1: 0.3366
 epoch: 15, train_loss: 1.1684, test_loss: 1.2132, test_f1: 0.3900
 epoch: 16, train_loss: 1.1573, test_loss: 1.2052, test_f1: 0.4216
 epoch: 17, train_loss: 1.1482, test_loss: 1.1872, test_f1: 0.4435
 epoch: 18, train_loss: 1.1323, test_loss: 1.1708, test_f1: 0.4375
 epoch: 19, train_loss: 1.1119, test_loss: 1.1617, test_f1: 0.4277
 epoch: 20, train_loss: 1.1074, test_loss: 1.1541, test_f1: 0.4294
 epoch: 21, train_loss: 1.1023, test_loss: 1.1415, test_f1: 0.4389
 epoch: 22, train_loss: 1.0814, test_loss: 1.1314, test_f1: 0.4504
 epoch: 23, train_loss: 1.0674, test_loss: 1.1299, test_f1: 0.4336
 epoch: 24, train_loss: 1.0622, test_loss: 1.1201, test_f1: 0.4431
 epoch: 25, train_loss: 1.0566, test_loss: 1.1089, test_f1: 0.4514
 epoch: 26, train_loss: 1.0397, test_loss: 1.1176, test_f1: 0.4299
 epoch: 27, train_loss: 1.0413, test_loss: 1.1059, test_f1: 0.4429
 epoch: 28, train_loss: 1.0280, test_loss: 1.1007, test_f1: 0.4352
 epoch: 29, train_loss: 1.0211, test_loss: 1.1209, test_f1: 0.4218
 epoch: 30, train_loss: 1.0013, test_loss: 1.1078, test_f1: 0.3885
 epoch: 31, train_loss: 0.9948, test_loss: 1.0878, test_f1: 0.4200
 epoch: 32, train_loss: 0.9940, test_loss: 1.0766, test_f1: 0.4276
 epoch: 33, train_loss: 0.9793, test_loss: 1.0814, test_f1: 0.4192
 epoch: 34, train_loss: 0.9758, test_loss: 1.1156, test_f1: 0.4168
 epoch: 35, train_loss: 0.9670, test_loss: 1.0710, test_f1: 0.4295
 epoch: 36, train_loss: 0.9695, test_loss: 1.0871, test_f1: 0.4095
 epoch: 37, train_loss: 0.9631, test_loss: 1.0952, test_f1: 0.4179
 epoch: 38, train_loss: 0.9547, test_loss: 1.0856, test_f1: 0.4166
 epoch: 39, train_loss: 0.9493, test_loss: 1.1000, test_f1: 0.4106
 epoch: 40, train_loss: 0.9549, test_loss: 1.1107, test_f1: 0.4224
 epoch: 41, train_loss: 0.9366, test_loss: 1.1665, test_f1: 0.3882
 epoch: 42, train_loss: 0.9474, test_loss: 1.0868, test_f1: 0.4236
 epoch: 43, train_loss: 0.9463, test_loss: 1.0999, test_f1: 0.4287
 epoch: 44, train_loss: 0.9366, test_loss: 1.0508, test_f1: 0.4377
 epoch: 45, train_loss: 0.9271, test_loss: 1.0516, test_f1: 0.4551
 epoch: 46, train_loss: 0.9231, test_loss: 1.0717, test_f1: 0.4549
 epoch: 47, train_loss: 0.9148, test_loss: 1.0735, test_f1: 0.4741
 epoch: 48, train_loss: 0.9134, test_loss: 1.0935, test_f1: 0.4651
 epoch: 49, train_loss: 0.9165, test_loss: 1.0551, test_f1: 0.4855
 epoch: 50, train_loss: 0.9044, test_loss: 1.0721, test_f1: 0.4901
 epoch: 51, train_loss: 0.9098, test_loss: 1.0552, test_f1: 0.5056
 epoch: 52, train_loss: 0.8972, test_loss: 1.0558, test_f1: 0.4975
 epoch: 53, train_loss: 0.8910, test_loss: 1.0631, test_f1: 0.4905
 epoch: 54, train_loss: 0.8893, test_loss: 1.0465, test_f1: 0.5063
 epoch: 55, train_loss: 0.8775, test_loss: 1.0462, test_f1: 0.5034
 epoch: 56, train_loss: 0.8960, test_loss: 1.0478, test_f1: 0.4906
 epoch: 57, train_loss: 0.8830, test_loss: 1.0388, test_f1: 0.5144
 epoch: 58, train_loss: 0.8876, test_loss: 1.0611, test_f1: 0.4989
 epoch: 59, train_loss: 0.8845, test_loss: 1.0632, test_f1: 0.5110
 epoch: 60, train_loss: 0.8745, test_loss: 1.0700, test_f1: 0.5047
 epoch: 61, train_loss: 0.8833, test_loss: 1.0647, test_f1: 0.5035
 epoch: 62, train_loss: 0.8799, test_loss: 1.0485, test_f1: 0.5116
 epoch: 63, train_loss: 0.8725, test_loss: 1.0489, test_f1: 0.5070
 epoch: 64, train_loss: 0.8791, test_loss: 1.0637, test_f1: 0.4958
 epoch: 65, train_loss: 0.8633, test_loss: 1.0531, test_f1: 0.5304
 epoch: 66, train_loss: 0.8604, test_loss: 1.0612, test_f1: 0.5192
 epoch: 67, train_loss: 0.8651, test_loss: 1.0745, test_f1: 0.5057
 epoch: 68, train_loss: 0.8639, test_loss: 1.0444, test_f1: 0.5258
 epoch: 69, train_loss: 0.8717, test_loss: 1.0412, test_f1: 0.5145
 epoch: 70, train_loss: 0.8739, test_loss: 1.0307, test_f1: 0.5135
 epoch: 71, train_loss: 0.8533, test_loss: 1.0217, test_f1: 0.5318
 epoch: 72, train_loss: 0.8472, test_loss: 1.0459, test_f1: 0.5146
 epoch: 73, train_loss: 0.8487, test_loss: 1.0301, test_f1: 0.5426
 epoch: 74, train_loss: 0.8589, test_loss: 1.0539, test_f1: 0.5274
 epoch: 75, train_loss: 0.8532, test_loss: 1.0830, test_f1: 0.5081
 epoch: 76, train_loss: 0.8558, test_loss: 1.0440, test_f1: 0.5314
 epoch: 77, train_loss: 0.8617, test_loss: 1.0439, test_f1: 0.5226
 epoch: 78, train_loss: 0.8439, test_loss: 1.0462, test_f1: 0.5208
 epoch: 79, train_loss: 0.8598, test_loss: 1.0610, test_f1: 0.5098
 epoch: 80, train_loss: 0.8508, test_loss: 1.0417, test_f1: 0.5261
 epoch: 81, train_loss: 0.8579, test_loss: 1.0375, test_f1: 0.5667
 epoch: 82, train_loss: 0.8795, test_loss: 1.0491, test_f1: 0.5498
 epoch: 83, train_loss: 0.8576, test_loss: 1.0624, test_f1: 0.5014
 epoch: 84, train_loss: 0.8509, test_loss: 1.0837, test_f1: 0.4868
 epoch: 85, train_loss: 0.8478, test_loss: 1.0790, test_f1: 0.5023
 epoch: 86, train_loss: 0.8602, test_loss: 1.0812, test_f1: 0.5039
 epoch: 87, train_loss: 0.8498, test_loss: 1.0801, test_f1: 0.5414
 epoch: 88, train_loss: 0.8459, test_loss: 1.0891, test_f1: 0.5375
 epoch: 89, train_loss: 0.8439, test_loss: 1.0929, test_f1: 0.5241
 epoch: 90, train_loss: 0.8430, test_loss: 1.0828, test_f1: 0.5220
 epoch: 91, train_loss: 0.8331, test_loss: 1.0612, test_f1: 0.5128
 epoch: 92, train_loss: 0.8252, test_loss: 1.0614, test_f1: 0.5106
 epoch: 93, train_loss: 0.8316, test_loss: 1.0900, test_f1: 0.5079
 epoch: 94, train_loss: 0.8343, test_loss: 1.0611, test_f1: 0.5338
 epoch: 95, train_loss: 0.8121, test_loss: 1.0559, test_f1: 0.5611
 epoch: 96, train_loss: 0.8226, test_loss: 1.0678, test_f1: 0.5320
 epoch: 97, train_loss: 0.8258, test_loss: 1.0585, test_f1: 0.5322
 epoch: 98, train_loss: 0.8256, test_loss: 1.0512, test_f1: 0.5472
 epoch: 99, train_loss: 0.8234, test_loss: 1.0600, test_f1: 0.5424
##################ITERATION #2 ****************************************
 epoch: 0, train_loss: 1.3405, test_loss: 1.3439, test_f1: 0.2639
 epoch: 1, train_loss: 1.2890, test_loss: 1.3386, test_f1: 0.2404
 epoch: 2, train_loss: 1.2631, test_loss: 1.3299, test_f1: 0.2737
 epoch: 3, train_loss: 1.2353, test_loss: 1.3229, test_f1: 0.2826
 epoch: 4, train_loss: 1.2108, test_loss: 1.3123, test_f1: 0.1909
 epoch: 5, train_loss: 1.1950, test_loss: 1.2865, test_f1: 0.2661
 epoch: 6, train_loss: 1.1797, test_loss: 1.2398, test_f1: 0.3552
 epoch: 7, train_loss: 1.1570, test_loss: 1.2104, test_f1: 0.3187
 epoch: 8, train_loss: 1.1363, test_loss: 1.1856, test_f1: 0.3449
 epoch: 9, train_loss: 1.1197, test_loss: 1.1623, test_f1: 0.3682
 epoch: 10, train_loss: 1.0972, test_loss: 1.1382, test_f1: 0.4046
 epoch: 11, train_loss: 1.0812, test_loss: 1.1156, test_f1: 0.3891
 epoch: 12, train_loss: 1.0709, test_loss: 1.1068, test_f1: 0.3930
 epoch: 13, train_loss: 1.0608, test_loss: 1.1084, test_f1: 0.4135
 epoch: 14, train_loss: 1.0503, test_loss: 1.0866, test_f1: 0.3996
 epoch: 15, train_loss: 1.0368, test_loss: 1.0723, test_f1: 0.3955
 epoch: 16, train_loss: 1.0242, test_loss: 1.0769, test_f1: 0.4252
 epoch: 17, train_loss: 1.0169, test_loss: 1.0783, test_f1: 0.3923
 epoch: 18, train_loss: 1.0099, test_loss: 1.0503, test_f1: 0.4221
 epoch: 19, train_loss: 0.9957, test_loss: 1.0998, test_f1: 0.4114
 epoch: 20, train_loss: 0.9889, test_loss: 1.0436, test_f1: 0.4642
 epoch: 21, train_loss: 0.9888, test_loss: 1.0288, test_f1: 0.4950
 epoch: 22, train_loss: 0.9769, test_loss: 1.0280, test_f1: 0.4725
 epoch: 23, train_loss: 0.9587, test_loss: 1.0210, test_f1: 0.4809
 epoch: 24, train_loss: 0.9503, test_loss: 1.0198, test_f1: 0.4891
 epoch: 25, train_loss: 0.9573, test_loss: 1.0379, test_f1: 0.4950
 epoch: 26, train_loss: 0.9513, test_loss: 1.0481, test_f1: 0.4653
 epoch: 27, train_loss: 0.9485, test_loss: 1.0300, test_f1: 0.4781
 epoch: 28, train_loss: 0.9327, test_loss: 1.0430, test_f1: 0.4726
 epoch: 29, train_loss: 0.9376, test_loss: 1.0327, test_f1: 0.4890
 epoch: 30, train_loss: 0.9319, test_loss: 1.0227, test_f1: 0.5175
 epoch: 31, train_loss: 0.9218, test_loss: 1.0085, test_f1: 0.5107
 epoch: 32, train_loss: 0.9156, test_loss: 1.1313, test_f1: 0.4122
 epoch: 33, train_loss: 0.9191, test_loss: 1.0204, test_f1: 0.5365
 epoch: 34, train_loss: 0.9143, test_loss: 1.1063, test_f1: 0.4503
 epoch: 35, train_loss: 0.9246, test_loss: 1.0346, test_f1: 0.5264
 epoch: 36, train_loss: 0.9231, test_loss: 1.0088, test_f1: 0.4911
 epoch: 37, train_loss: 0.9189, test_loss: 1.2829, test_f1: 0.3488
 epoch: 38, train_loss: 0.9362, test_loss: 1.1224, test_f1: 0.3849
 epoch: 39, train_loss: 0.9235, test_loss: 1.0557, test_f1: 0.4716
 epoch: 40, train_loss: 0.8863, test_loss: 1.0085, test_f1: 0.5093
 epoch: 41, train_loss: 0.9030, test_loss: 1.0079, test_f1: 0.5305
 epoch: 42, train_loss: 0.8809, test_loss: 1.0159, test_f1: 0.5112
 epoch: 43, train_loss: 0.8796, test_loss: 1.0244, test_f1: 0.4869
 epoch: 44, train_loss: 0.8780, test_loss: 1.0263, test_f1: 0.5137
 epoch: 45, train_loss: 0.8726, test_loss: 0.9836, test_f1: 0.5574
 epoch: 46, train_loss: 0.8598, test_loss: 1.0012, test_f1: 0.5287
 epoch: 47, train_loss: 0.8639, test_loss: 0.9968, test_f1: 0.5353
 epoch: 48, train_loss: 0.8596, test_loss: 0.9917, test_f1: 0.5148
 epoch: 49, train_loss: 0.8525, test_loss: 0.9640, test_f1: 0.5437
 epoch: 50, train_loss: 0.8693, test_loss: 0.9722, test_f1: 0.5287
 epoch: 51, train_loss: 0.8516, test_loss: 0.9833, test_f1: 0.5528
 epoch: 52, train_loss: 0.8324, test_loss: 0.9872, test_f1: 0.5285
 epoch: 53, train_loss: 0.8459, test_loss: 0.9892, test_f1: 0.5260
 epoch: 54, train_loss: 0.8314, test_loss: 0.9833, test_f1: 0.5373
 epoch: 55, train_loss: 0.8213, test_loss: 0.9720, test_f1: 0.5588
 epoch: 56, train_loss: 0.8266, test_loss: 0.9784, test_f1: 0.5483
 epoch: 57, train_loss: 0.8318, test_loss: 0.9628, test_f1: 0.5676
 epoch: 58, train_loss: 0.8326, test_loss: 0.9677, test_f1: 0.5638
 epoch: 59, train_loss: 0.8135, test_loss: 0.9554, test_f1: 0.5759
 epoch: 60, train_loss: 0.8139, test_loss: 0.9733, test_f1: 0.5623
 epoch: 61, train_loss: 0.8172, test_loss: 0.9953, test_f1: 0.5550
 epoch: 62, train_loss: 0.8181, test_loss: 0.9834, test_f1: 0.5599
 epoch: 63, train_loss: 0.8025, test_loss: 0.9847, test_f1: 0.5368
 epoch: 64, train_loss: 0.8173, test_loss: 0.9797, test_f1: 0.5927
 epoch: 65, train_loss: 0.8152, test_loss: 0.9915, test_f1: 0.5797
 epoch: 66, train_loss: 0.8084, test_loss: 1.0229, test_f1: 0.5016
 epoch: 67, train_loss: 0.7996, test_loss: 0.9966, test_f1: 0.5399
 epoch: 68, train_loss: 0.7926, test_loss: 0.9889, test_f1: 0.5742
 epoch: 69, train_loss: 0.8002, test_loss: 1.0003, test_f1: 0.5387
 epoch: 70, train_loss: 0.7995, test_loss: 1.0355, test_f1: 0.5188
 epoch: 71, train_loss: 0.7873, test_loss: 0.9833, test_f1: 0.5683
 epoch: 72, train_loss: 0.7835, test_loss: 0.9932, test_f1: 0.5857
 epoch: 73, train_loss: 0.7858, test_loss: 0.9892, test_f1: 0.5537
 epoch: 74, train_loss: 0.7834, test_loss: 0.9720, test_f1: 0.5778
 epoch: 75, train_loss: 0.7934, test_loss: 0.9849, test_f1: 0.5812
 epoch: 76, train_loss: 0.7765, test_loss: 1.0310, test_f1: 0.5578
 epoch: 77, train_loss: 0.7709, test_loss: 0.9957, test_f1: 0.5704
 epoch: 78, train_loss: 0.7694, test_loss: 0.9884, test_f1: 0.5708
 epoch: 79, train_loss: 0.7697, test_loss: 0.9881, test_f1: 0.5633
 epoch: 80, train_loss: 0.7746, test_loss: 1.0189, test_f1: 0.5613
 epoch: 81, train_loss: 0.7729, test_loss: 1.0121, test_f1: 0.5731
 epoch: 82, train_loss: 0.7789, test_loss: 1.0135, test_f1: 0.5681
 epoch: 83, train_loss: 0.8032, test_loss: 1.0276, test_f1: 0.5500
 epoch: 84, train_loss: 0.7713, test_loss: 0.9901, test_f1: 0.5609
 epoch: 85, train_loss: 0.7793, test_loss: 0.9807, test_f1: 0.5556
 epoch: 86, train_loss: 0.7783, test_loss: 1.0018, test_f1: 0.5571
 epoch: 87, train_loss: 0.7694, test_loss: 0.9923, test_f1: 0.5541
 epoch: 88, train_loss: 0.7485, test_loss: 0.9883, test_f1: 0.5562
 epoch: 89, train_loss: 0.7607, test_loss: 0.9780, test_f1: 0.5725
 epoch: 90, train_loss: 0.7394, test_loss: 1.0561, test_f1: 0.4765
 epoch: 91, train_loss: 0.7448, test_loss: 1.0261, test_f1: 0.5265
 epoch: 92, train_loss: 0.7587, test_loss: 1.0242, test_f1: 0.5138
 epoch: 93, train_loss: 0.7451, test_loss: 1.0688, test_f1: 0.5121
 epoch: 94, train_loss: 0.7413, test_loss: 1.0088, test_f1: 0.5482
 epoch: 95, train_loss: 0.7483, test_loss: 1.0113, test_f1: 0.5506
 epoch: 96, train_loss: 0.7565, test_loss: 1.0056, test_f1: 0.5652
 epoch: 97, train_loss: 0.7605, test_loss: 1.0064, test_f1: 0.5849
 epoch: 98, train_loss: 0.7503, test_loss: 1.0053, test_f1: 0.5710
 epoch: 99, train_loss: 0.7473, test_loss: 1.0196, test_f1: 0.5429
##################ITERATION #3 ****************************************
 epoch: 0, train_loss: 1.2894, test_loss: 1.3107, test_f1: 0.2281
 epoch: 1, train_loss: 1.2455, test_loss: 1.3034, test_f1: 0.2281
 epoch: 2, train_loss: 1.2261, test_loss: 1.3010, test_f1: 0.2281
 epoch: 3, train_loss: 1.2056, test_loss: 1.3045, test_f1: 0.2281
 epoch: 4, train_loss: 1.1958, test_loss: 1.3124, test_f1: 0.2281
 epoch: 5, train_loss: 1.1813, test_loss: 1.3173, test_f1: 0.2281
 epoch: 6, train_loss: 1.1806, test_loss: 1.3141, test_f1: 0.2281
 epoch: 7, train_loss: 1.1654, test_loss: 1.3099, test_f1: 0.2238
 epoch: 8, train_loss: 1.1602, test_loss: 1.2997, test_f1: 0.2238
 epoch: 9, train_loss: 1.1434, test_loss: 1.2938, test_f1: 0.2619
 epoch: 10, train_loss: 1.1352, test_loss: 1.2692, test_f1: 0.3402
 epoch: 11, train_loss: 1.1297, test_loss: 1.2350, test_f1: 0.3675
 epoch: 12, train_loss: 1.1178, test_loss: 1.2200, test_f1: 0.3833
 epoch: 13, train_loss: 1.0971, test_loss: 1.1822, test_f1: 0.4109
 epoch: 14, train_loss: 1.0904, test_loss: 1.1543, test_f1: 0.4153
 epoch: 15, train_loss: 1.0789, test_loss: 1.1399, test_f1: 0.4400
 epoch: 16, train_loss: 1.0761, test_loss: 1.1254, test_f1: 0.4801
 epoch: 17, train_loss: 1.0496, test_loss: 1.1274, test_f1: 0.4595
 epoch: 18, train_loss: 1.0470, test_loss: 1.1185, test_f1: 0.4608
 epoch: 19, train_loss: 1.0343, test_loss: 1.1073, test_f1: 0.4820
 epoch: 20, train_loss: 1.0257, test_loss: 1.1025, test_f1: 0.4913
 epoch: 21, train_loss: 1.0135, test_loss: 1.0933, test_f1: 0.5058
 epoch: 22, train_loss: 1.0086, test_loss: 1.0694, test_f1: 0.5067
 epoch: 23, train_loss: 1.0088, test_loss: 1.0558, test_f1: 0.5204
 epoch: 24, train_loss: 0.9896, test_loss: 1.0606, test_f1: 0.5279
 epoch: 25, train_loss: 0.9762, test_loss: 1.0384, test_f1: 0.5260
 epoch: 26, train_loss: 0.9726, test_loss: 1.0509, test_f1: 0.5158
 epoch: 27, train_loss: 0.9633, test_loss: 1.0504, test_f1: 0.4997
 epoch: 28, train_loss: 0.9542, test_loss: 1.0418, test_f1: 0.5111
 epoch: 29, train_loss: 0.9456, test_loss: 1.0454, test_f1: 0.5047
 epoch: 30, train_loss: 0.9377, test_loss: 1.0358, test_f1: 0.5326
 epoch: 31, train_loss: 0.9400, test_loss: 1.0346, test_f1: 0.5354
 epoch: 32, train_loss: 0.9205, test_loss: 1.0185, test_f1: 0.5594
 epoch: 33, train_loss: 0.9413, test_loss: 1.0360, test_f1: 0.5535
 epoch: 34, train_loss: 0.9320, test_loss: 1.0272, test_f1: 0.5281
 epoch: 35, train_loss: 0.9419, test_loss: 1.0273, test_f1: 0.5455
 epoch: 36, train_loss: 0.9123, test_loss: 1.0442, test_f1: 0.5463
 epoch: 37, train_loss: 0.8971, test_loss: 1.0241, test_f1: 0.5556
 epoch: 38, train_loss: 0.9079, test_loss: 1.0267, test_f1: 0.5539
 epoch: 39, train_loss: 0.8897, test_loss: 0.9994, test_f1: 0.5955
 epoch: 40, train_loss: 0.8883, test_loss: 1.0125, test_f1: 0.5650
 epoch: 41, train_loss: 0.8935, test_loss: 0.9888, test_f1: 0.5665
 epoch: 42, train_loss: 0.8841, test_loss: 1.0116, test_f1: 0.5510
 epoch: 43, train_loss: 0.8883, test_loss: 1.0421, test_f1: 0.5383
 epoch: 44, train_loss: 0.8671, test_loss: 1.0251, test_f1: 0.5213
 epoch: 45, train_loss: 0.8811, test_loss: 0.9994, test_f1: 0.5655
 epoch: 46, train_loss: 0.8552, test_loss: 1.0131, test_f1: 0.5416
 epoch: 47, train_loss: 0.8645, test_loss: 1.0192, test_f1: 0.5592
 epoch: 48, train_loss: 0.8466, test_loss: 1.0202, test_f1: 0.5602
 epoch: 49, train_loss: 0.8549, test_loss: 1.0240, test_f1: 0.5581
 epoch: 50, train_loss: 0.8701, test_loss: 1.0173, test_f1: 0.5520
 epoch: 51, train_loss: 0.8410, test_loss: 1.0045, test_f1: 0.5432
 epoch: 52, train_loss: 0.8462, test_loss: 1.0252, test_f1: 0.5356
 epoch: 53, train_loss: 0.8480, test_loss: 1.0138, test_f1: 0.5616
 epoch: 54, train_loss: 0.8285, test_loss: 1.0200, test_f1: 0.5429
 epoch: 55, train_loss: 0.8418, test_loss: 1.0057, test_f1: 0.5657
 epoch: 56, train_loss: 0.8291, test_loss: 0.9945, test_f1: 0.5667
 epoch: 57, train_loss: 0.8341, test_loss: 0.9906, test_f1: 0.5779
 epoch: 58, train_loss: 0.8391, test_loss: 0.9710, test_f1: 0.5837
 epoch: 59, train_loss: 0.8241, test_loss: 0.9913, test_f1: 0.5784
 epoch: 60, train_loss: 0.8192, test_loss: 1.0205, test_f1: 0.5534
 epoch: 61, train_loss: 0.8276, test_loss: 1.0296, test_f1: 0.5615
 epoch: 62, train_loss: 0.8147, test_loss: 1.0119, test_f1: 0.5579
 epoch: 63, train_loss: 0.8142, test_loss: 1.0539, test_f1: 0.5612
 epoch: 64, train_loss: 0.8068, test_loss: 1.0169, test_f1: 0.5755
 epoch: 65, train_loss: 0.8083, test_loss: 0.9936, test_f1: 0.5792
 epoch: 66, train_loss: 0.8182, test_loss: 1.0001, test_f1: 0.5853
 epoch: 67, train_loss: 0.8121, test_loss: 0.9995, test_f1: 0.5843
 epoch: 68, train_loss: 0.7957, test_loss: 1.0126, test_f1: 0.5810
 epoch: 69, train_loss: 0.7977, test_loss: 1.0419, test_f1: 0.5453
 epoch: 70, train_loss: 0.8069, test_loss: 1.0383, test_f1: 0.5736
 epoch: 71, train_loss: 0.8100, test_loss: 0.9949, test_f1: 0.5733
 epoch: 72, train_loss: 0.8035, test_loss: 0.9869, test_f1: 0.5990
 epoch: 73, train_loss: 0.7955, test_loss: 1.0160, test_f1: 0.5679
 epoch: 74, train_loss: 0.8045, test_loss: 1.0137, test_f1: 0.5743
 epoch: 75, train_loss: 0.7829, test_loss: 1.0037, test_f1: 0.5731
 epoch: 76, train_loss: 0.7890, test_loss: 1.0264, test_f1: 0.5540
 epoch: 77, train_loss: 0.7763, test_loss: 1.0299, test_f1: 0.5742
 epoch: 78, train_loss: 0.7723, test_loss: 1.0030, test_f1: 0.5760
 epoch: 79, train_loss: 0.7683, test_loss: 0.9974, test_f1: 0.5693
 epoch: 80, train_loss: 0.7804, test_loss: 0.9946, test_f1: 0.5824
 epoch: 81, train_loss: 0.7836, test_loss: 0.9952, test_f1: 0.6092
 epoch: 82, train_loss: 0.7746, test_loss: 1.0135, test_f1: 0.5910
 epoch: 83, train_loss: 0.7801, test_loss: 1.0180, test_f1: 0.5943
 epoch: 84, train_loss: 0.7713, test_loss: 1.0497, test_f1: 0.5795
 epoch: 85, train_loss: 0.7522, test_loss: 1.0450, test_f1: 0.5656
 epoch: 86, train_loss: 0.7735, test_loss: 1.0499, test_f1: 0.5469
 epoch: 87, train_loss: 0.7797, test_loss: 1.0554, test_f1: 0.5546
 epoch: 88, train_loss: 0.7650, test_loss: 1.0410, test_f1: 0.5363
 epoch: 89, train_loss: 0.7699, test_loss: 1.0811, test_f1: 0.5381
 epoch: 90, train_loss: 0.7651, test_loss: 1.0489, test_f1: 0.5555
 epoch: 91, train_loss: 0.7614, test_loss: 1.0472, test_f1: 0.5799
 epoch: 92, train_loss: 0.7589, test_loss: 1.0071, test_f1: 0.5993
 epoch: 93, train_loss: 0.7518, test_loss: 0.9790, test_f1: 0.6165
 epoch: 94, train_loss: 0.7552, test_loss: 0.9852, test_f1: 0.6068
 epoch: 95, train_loss: 0.7684, test_loss: 1.0000, test_f1: 0.5894
 epoch: 96, train_loss: 0.7694, test_loss: 1.0456, test_f1: 0.5675
 epoch: 97, train_loss: 0.7667, test_loss: 1.0431, test_f1: 0.5861
 epoch: 98, train_loss: 0.7554, test_loss: 1.0297, test_f1: 0.6019
 epoch: 99, train_loss: 0.7476, test_loss: 1.0005, test_f1: 0.5942
##################ITERATION #4 ****************************************
 epoch: 0, train_loss: 1.2789, test_loss: 1.3047, test_f1: 0.2281
 epoch: 1, train_loss: 1.2214, test_loss: 1.3039, test_f1: 0.2281
 epoch: 2, train_loss: 1.2235, test_loss: 1.3022, test_f1: 0.2248
 epoch: 3, train_loss: 1.1990, test_loss: 1.3019, test_f1: 0.2429
 epoch: 4, train_loss: 1.1868, test_loss: 1.2978, test_f1: 0.2429
 epoch: 5, train_loss: 1.1728, test_loss: 1.2859, test_f1: 0.2429
 epoch: 6, train_loss: 1.1582, test_loss: 1.2649, test_f1: 0.2274
 epoch: 7, train_loss: 1.1524, test_loss: 1.2440, test_f1: 0.2340
 epoch: 8, train_loss: 1.1516, test_loss: 1.2211, test_f1: 0.2448
 epoch: 9, train_loss: 1.1235, test_loss: 1.2045, test_f1: 0.3417
 epoch: 10, train_loss: 1.1105, test_loss: 1.1878, test_f1: 0.3650
 epoch: 11, train_loss: 1.0988, test_loss: 1.1670, test_f1: 0.3832
 epoch: 12, train_loss: 1.0875, test_loss: 1.1564, test_f1: 0.4005
 epoch: 13, train_loss: 1.0732, test_loss: 1.1285, test_f1: 0.4380
 epoch: 14, train_loss: 1.0607, test_loss: 1.1104, test_f1: 0.4661
 epoch: 15, train_loss: 1.0465, test_loss: 1.1039, test_f1: 0.4471
 epoch: 16, train_loss: 1.0374, test_loss: 1.0989, test_f1: 0.4855
 epoch: 17, train_loss: 1.0304, test_loss: 1.0821, test_f1: 0.5165
 epoch: 18, train_loss: 1.0177, test_loss: 1.0706, test_f1: 0.5207
 epoch: 19, train_loss: 1.0240, test_loss: 1.0547, test_f1: 0.5368
 epoch: 20, train_loss: 1.0049, test_loss: 1.0575, test_f1: 0.5259
 epoch: 21, train_loss: 1.0006, test_loss: 1.0599, test_f1: 0.5042
 epoch: 22, train_loss: 1.0014, test_loss: 1.0502, test_f1: 0.5284
 epoch: 23, train_loss: 0.9874, test_loss: 1.0785, test_f1: 0.5349
 epoch: 24, train_loss: 0.9817, test_loss: 1.0383, test_f1: 0.5420
 epoch: 25, train_loss: 0.9755, test_loss: 1.0500, test_f1: 0.5023
 epoch: 26, train_loss: 0.9780, test_loss: 1.0501, test_f1: 0.4963
 epoch: 27, train_loss: 0.9834, test_loss: 1.0455, test_f1: 0.5132
 epoch: 28, train_loss: 0.9646, test_loss: 1.0345, test_f1: 0.5427
 epoch: 29, train_loss: 0.9470, test_loss: 1.0302, test_f1: 0.5603
 epoch: 30, train_loss: 0.9596, test_loss: 1.0337, test_f1: 0.5465
 epoch: 31, train_loss: 0.9621, test_loss: 1.0223, test_f1: 0.5449
 epoch: 32, train_loss: 0.9509, test_loss: 1.0441, test_f1: 0.5592
 epoch: 33, train_loss: 0.9318, test_loss: 1.0400, test_f1: 0.5623
 epoch: 34, train_loss: 0.9289, test_loss: 1.0449, test_f1: 0.5490
 epoch: 35, train_loss: 0.9317, test_loss: 1.0279, test_f1: 0.5664
 epoch: 36, train_loss: 0.9144, test_loss: 1.0177, test_f1: 0.5700
 epoch: 37, train_loss: 0.9228, test_loss: 1.0203, test_f1: 0.5516
 epoch: 38, train_loss: 0.9055, test_loss: 1.0169, test_f1: 0.5618
 epoch: 39, train_loss: 0.9143, test_loss: 1.0258, test_f1: 0.5527
 epoch: 40, train_loss: 0.9053, test_loss: 1.0350, test_f1: 0.5506
 epoch: 41, train_loss: 0.9218, test_loss: 1.0578, test_f1: 0.5433
 epoch: 42, train_loss: 0.9159, test_loss: 1.0536, test_f1: 0.5624
 epoch: 43, train_loss: 0.8997, test_loss: 1.0671, test_f1: 0.5591
 epoch: 44, train_loss: 0.8994, test_loss: 1.0464, test_f1: 0.5557
 epoch: 45, train_loss: 0.8934, test_loss: 1.0562, test_f1: 0.5295
 epoch: 46, train_loss: 0.8949, test_loss: 1.0386, test_f1: 0.5477
 epoch: 47, train_loss: 0.8795, test_loss: 1.0361, test_f1: 0.5455
 epoch: 48, train_loss: 0.8848, test_loss: 1.0737, test_f1: 0.5402
 epoch: 49, train_loss: 0.8736, test_loss: 1.0750, test_f1: 0.5448
 epoch: 50, train_loss: 0.8732, test_loss: 1.0738, test_f1: 0.5487
 epoch: 51, train_loss: 0.8593, test_loss: 1.0671, test_f1: 0.5591
 epoch: 52, train_loss: 0.8543, test_loss: 1.0679, test_f1: 0.5755
 epoch: 53, train_loss: 0.8566, test_loss: 1.0770, test_f1: 0.5266
 epoch: 54, train_loss: 0.8533, test_loss: 1.0664, test_f1: 0.5338
 epoch: 55, train_loss: 0.8576, test_loss: 1.0711, test_f1: 0.5288
 epoch: 56, train_loss: 0.8499, test_loss: 1.0834, test_f1: 0.5474
 epoch: 57, train_loss: 0.8447, test_loss: 1.0983, test_f1: 0.5473
 epoch: 58, train_loss: 0.8562, test_loss: 1.0838, test_f1: 0.5379
 epoch: 59, train_loss: 0.8501, test_loss: 1.0670, test_f1: 0.5424
 epoch: 60, train_loss: 0.8506, test_loss: 1.0589, test_f1: 0.5486
 epoch: 61, train_loss: 0.8340, test_loss: 1.0531, test_f1: 0.5579
 epoch: 62, train_loss: 0.8385, test_loss: 1.0394, test_f1: 0.5719
 epoch: 63, train_loss: 0.8445, test_loss: 1.0411, test_f1: 0.5740
 epoch: 64, train_loss: 0.8259, test_loss: 1.0554, test_f1: 0.5535
 epoch: 65, train_loss: 0.8250, test_loss: 1.0759, test_f1: 0.5297
 epoch: 66, train_loss: 0.8250, test_loss: 1.0751, test_f1: 0.5191
 epoch: 67, train_loss: 0.8285, test_loss: 1.0751, test_f1: 0.5341
 epoch: 68, train_loss: 0.8313, test_loss: 1.0682, test_f1: 0.5360
 epoch: 69, train_loss: 0.8193, test_loss: 1.0730, test_f1: 0.5577
 epoch: 70, train_loss: 0.8218, test_loss: 1.0869, test_f1: 0.5592
 epoch: 71, train_loss: 0.8142, test_loss: 1.0806, test_f1: 0.5643
 epoch: 72, train_loss: 0.8303, test_loss: 1.0777, test_f1: 0.5609
 epoch: 73, train_loss: 0.8168, test_loss: 1.0890, test_f1: 0.5525
 epoch: 74, train_loss: 0.8166, test_loss: 1.0952, test_f1: 0.5849
 epoch: 75, train_loss: 0.8252, test_loss: 1.0820, test_f1: 0.5731
 epoch: 76, train_loss: 0.8146, test_loss: 1.0634, test_f1: 0.5736
 epoch: 77, train_loss: 0.8172, test_loss: 1.0728, test_f1: 0.5646
 epoch: 78, train_loss: 0.8236, test_loss: 1.0677, test_f1: 0.5886
 epoch: 79, train_loss: 0.8232, test_loss: 1.0810, test_f1: 0.5567
 epoch: 80, train_loss: 0.8256, test_loss: 1.0950, test_f1: 0.5558
 epoch: 81, train_loss: 0.8325, test_loss: 1.0832, test_f1: 0.5785
 epoch: 82, train_loss: 0.8260, test_loss: 1.0485, test_f1: 0.5726
 epoch: 83, train_loss: 0.8156, test_loss: 1.0439, test_f1: 0.5506
 epoch: 84, train_loss: 0.8038, test_loss: 1.0498, test_f1: 0.5415
 epoch: 85, train_loss: 0.8017, test_loss: 1.0595, test_f1: 0.5592
 epoch: 86, train_loss: 0.7953, test_loss: 1.0737, test_f1: 0.5540
 epoch: 87, train_loss: 0.8081, test_loss: 1.0849, test_f1: 0.5447
 epoch: 88, train_loss: 0.8180, test_loss: 1.0829, test_f1: 0.5433
 epoch: 89, train_loss: 0.8113, test_loss: 1.0928, test_f1: 0.5591
 epoch: 90, train_loss: 0.8180, test_loss: 1.0892, test_f1: 0.5520
 epoch: 91, train_loss: 0.7996, test_loss: 1.0792, test_f1: 0.5569
 epoch: 92, train_loss: 0.7883, test_loss: 1.0957, test_f1: 0.5354
 epoch: 93, train_loss: 0.8073, test_loss: 1.1022, test_f1: 0.5440
 epoch: 94, train_loss: 0.8029, test_loss: 1.1161, test_f1: 0.5419
 epoch: 95, train_loss: 0.8116, test_loss: 1.1178, test_f1: 0.5384
 epoch: 96, train_loss: 0.7992, test_loss: 1.0801, test_f1: 0.5499
 epoch: 97, train_loss: 0.8034, test_loss: 1.0746, test_f1: 0.5621
 epoch: 98, train_loss: 0.8147, test_loss: 1.0904, test_f1: 0.5618
 epoch: 99, train_loss: 0.8137, test_loss: 1.1001, test_f1: 0.5589
##################ITERATION #5 ****************************************
 epoch: 0, train_loss: 1.2586, test_loss: 1.3028, test_f1: 0.2281
 epoch: 1, train_loss: 1.2297, test_loss: 1.3057, test_f1: 0.2281
 epoch: 2, train_loss: 1.2088, test_loss: 1.3046, test_f1: 0.2281
 epoch: 3, train_loss: 1.2001, test_loss: 1.3042, test_f1: 0.2281
 epoch: 4, train_loss: 1.1722, test_loss: 1.3027, test_f1: 0.2281
 epoch: 5, train_loss: 1.1651, test_loss: 1.3004, test_f1: 0.2281
 epoch: 6, train_loss: 1.1528, test_loss: 1.3004, test_f1: 0.2281
 epoch: 7, train_loss: 1.1364, test_loss: 1.2978, test_f1: 0.2413
 epoch: 8, train_loss: 1.1288, test_loss: 1.2808, test_f1: 0.2918
 epoch: 9, train_loss: 1.1101, test_loss: 1.2380, test_f1: 0.2774
 epoch: 10, train_loss: 1.0920, test_loss: 1.1960, test_f1: 0.3307
 epoch: 11, train_loss: 1.0767, test_loss: 1.1662, test_f1: 0.3691
 epoch: 12, train_loss: 1.0675, test_loss: 1.1364, test_f1: 0.3882
 epoch: 13, train_loss: 1.0640, test_loss: 1.1284, test_f1: 0.3980
 epoch: 14, train_loss: 1.0590, test_loss: 1.1051, test_f1: 0.4557
 epoch: 15, train_loss: 1.0380, test_loss: 1.0902, test_f1: 0.4428
 epoch: 16, train_loss: 1.0128, test_loss: 1.0753, test_f1: 0.4639
 epoch: 17, train_loss: 1.0102, test_loss: 1.0775, test_f1: 0.4442
 epoch: 18, train_loss: 1.0083, test_loss: 1.1472, test_f1: 0.4067
 epoch: 19, train_loss: 1.0180, test_loss: 1.1291, test_f1: 0.4229
 epoch: 20, train_loss: 0.9871, test_loss: 1.0480, test_f1: 0.4634
 epoch: 21, train_loss: 0.9809, test_loss: 1.0444, test_f1: 0.4787
 epoch: 22, train_loss: 0.9823, test_loss: 1.1182, test_f1: 0.4328
 epoch: 23, train_loss: 0.9841, test_loss: 1.0476, test_f1: 0.4967
 epoch: 24, train_loss: 0.9640, test_loss: 1.0363, test_f1: 0.5044
 epoch: 25, train_loss: 0.9614, test_loss: 1.0807, test_f1: 0.4341
 epoch: 26, train_loss: 0.9562, test_loss: 1.0502, test_f1: 0.4992
 epoch: 27, train_loss: 0.9541, test_loss: 1.0491, test_f1: 0.5036
 epoch: 28, train_loss: 0.9462, test_loss: 1.0540, test_f1: 0.4949
 epoch: 29, train_loss: 0.9279, test_loss: 1.0531, test_f1: 0.5180
 epoch: 30, train_loss: 0.9434, test_loss: 1.0686, test_f1: 0.4992
 epoch: 31, train_loss: 0.9243, test_loss: 1.0415, test_f1: 0.5250
 epoch: 32, train_loss: 0.9185, test_loss: 1.0601, test_f1: 0.5241
 epoch: 33, train_loss: 0.9108, test_loss: 1.0647, test_f1: 0.5355
 epoch: 34, train_loss: 0.9103, test_loss: 1.1782, test_f1: 0.4933
 epoch: 35, train_loss: 0.9110, test_loss: 1.0929, test_f1: 0.4978
 epoch: 36, train_loss: 0.9092, test_loss: 1.0204, test_f1: 0.5272
 epoch: 37, train_loss: 0.9100, test_loss: 1.0837, test_f1: 0.5139
 epoch: 38, train_loss: 0.9042, test_loss: 1.0219, test_f1: 0.5410
 epoch: 39, train_loss: 0.8822, test_loss: 1.0279, test_f1: 0.5360
 epoch: 40, train_loss: 0.8886, test_loss: 1.0292, test_f1: 0.5106
 epoch: 41, train_loss: 0.8893, test_loss: 1.1133, test_f1: 0.4959
 epoch: 42, train_loss: 0.8733, test_loss: 1.0696, test_f1: 0.4973
 epoch: 43, train_loss: 0.8868, test_loss: 1.0470, test_f1: 0.5060
 epoch: 44, train_loss: 0.8859, test_loss: 1.0616, test_f1: 0.5333
 epoch: 45, train_loss: 0.8810, test_loss: 1.0088, test_f1: 0.5798
 epoch: 46, train_loss: 0.8841, test_loss: 1.0654, test_f1: 0.5445
 epoch: 47, train_loss: 0.8632, test_loss: 1.0934, test_f1: 0.5407
 epoch: 48, train_loss: 0.8615, test_loss: 1.0586, test_f1: 0.5280
 epoch: 49, train_loss: 0.8555, test_loss: 1.0297, test_f1: 0.5247
 epoch: 50, train_loss: 0.8507, test_loss: 1.0285, test_f1: 0.5305
 epoch: 51, train_loss: 0.8528, test_loss: 1.0199, test_f1: 0.5426
 epoch: 52, train_loss: 0.8560, test_loss: 1.0500, test_f1: 0.5305
 epoch: 53, train_loss: 0.8409, test_loss: 1.0610, test_f1: 0.5225
 epoch: 54, train_loss: 0.8347, test_loss: 1.0243, test_f1: 0.5400
 epoch: 55, train_loss: 0.8265, test_loss: 1.0217, test_f1: 0.5558
 epoch: 56, train_loss: 0.8233, test_loss: 1.0234, test_f1: 0.5514
 epoch: 57, train_loss: 0.8286, test_loss: 1.0216, test_f1: 0.5530
 epoch: 58, train_loss: 0.8196, test_loss: 1.0551, test_f1: 0.5374
 epoch: 59, train_loss: 0.8293, test_loss: 1.0696, test_f1: 0.5276
 epoch: 60, train_loss: 0.8233, test_loss: 1.0306, test_f1: 0.5484
 epoch: 61, train_loss: 0.8236, test_loss: 1.0446, test_f1: 0.5496
 epoch: 62, train_loss: 0.8275, test_loss: 1.0303, test_f1: 0.5424
 epoch: 63, train_loss: 0.8214, test_loss: 1.0041, test_f1: 0.5605
 epoch: 64, train_loss: 0.8117, test_loss: 1.0048, test_f1: 0.5543
 epoch: 65, train_loss: 0.8036, test_loss: 1.0092, test_f1: 0.5595
 epoch: 66, train_loss: 0.7927, test_loss: 1.0368, test_f1: 0.5462
 epoch: 67, train_loss: 0.8095, test_loss: 1.0310, test_f1: 0.5590
 epoch: 68, train_loss: 0.8113, test_loss: 1.0129, test_f1: 0.5671
 epoch: 69, train_loss: 0.8077, test_loss: 1.0233, test_f1: 0.5486
 epoch: 70, train_loss: 0.7924, test_loss: 1.0171, test_f1: 0.5202
 epoch: 71, train_loss: 0.7927, test_loss: 1.0214, test_f1: 0.5565
 epoch: 72, train_loss: 0.7897, test_loss: 1.0702, test_f1: 0.5388
 epoch: 73, train_loss: 0.7898, test_loss: 1.1344, test_f1: 0.5352
 epoch: 74, train_loss: 0.7902, test_loss: 1.1330, test_f1: 0.5227
 epoch: 75, train_loss: 0.7894, test_loss: 1.0646, test_f1: 0.5532
 epoch: 76, train_loss: 0.7850, test_loss: 1.0689, test_f1: 0.5511
 epoch: 77, train_loss: 0.7805, test_loss: 1.0392, test_f1: 0.5731
 epoch: 78, train_loss: 0.7919, test_loss: 1.0427, test_f1: 0.5649
 epoch: 79, train_loss: 0.7874, test_loss: 1.0650, test_f1: 0.5575
 epoch: 80, train_loss: 0.7802, test_loss: 1.0602, test_f1: 0.5625
 epoch: 81, train_loss: 0.7742, test_loss: 1.0438, test_f1: 0.5588
 epoch: 82, train_loss: 0.7757, test_loss: 1.0601, test_f1: 0.5714
 epoch: 83, train_loss: 0.7785, test_loss: 1.0770, test_f1: 0.5652
 epoch: 84, train_loss: 0.7760, test_loss: 1.0980, test_f1: 0.5527
 epoch: 85, train_loss: 0.7813, test_loss: 1.0833, test_f1: 0.5543
 epoch: 86, train_loss: 0.7823, test_loss: 1.0295, test_f1: 0.5692
 epoch: 87, train_loss: 0.7544, test_loss: 1.0459, test_f1: 0.5602
 epoch: 88, train_loss: 0.7722, test_loss: 1.1313, test_f1: 0.5435
 epoch: 89, train_loss: 0.7645, test_loss: 1.0795, test_f1: 0.5546
 epoch: 90, train_loss: 0.7701, test_loss: 1.1103, test_f1: 0.5653
 epoch: 91, train_loss: 0.7592, test_loss: 1.1449, test_f1: 0.5552
 epoch: 92, train_loss: 0.7706, test_loss: 1.0520, test_f1: 0.5567
 epoch: 93, train_loss: 0.7668, test_loss: 1.0255, test_f1: 0.5681
 epoch: 94, train_loss: 0.7689, test_loss: 1.0365, test_f1: 0.5642
 epoch: 95, train_loss: 0.7778, test_loss: 1.0555, test_f1: 0.5728
 epoch: 96, train_loss: 0.7631, test_loss: 1.0376, test_f1: 0.5829
 epoch: 97, train_loss: 0.7490, test_loss: 1.0299, test_f1: 0.5832
 epoch: 98, train_loss: 0.7462, test_loss: 1.0356, test_f1: 0.5811
 epoch: 99, train_loss: 0.7470, test_loss: 1.0324, test_f1: 0.5827
##################ITERATION #6 ****************************************
 epoch: 0, train_loss: 1.2790, test_loss: 1.3027, test_f1: 0.2281
 epoch: 1, train_loss: 1.2290, test_loss: 1.3041, test_f1: 0.2281
 epoch: 2, train_loss: 1.2166, test_loss: 1.3023, test_f1: 0.2281
 epoch: 3, train_loss: 1.1966, test_loss: 1.3010, test_f1: 0.2281
 epoch: 4, train_loss: 1.1981, test_loss: 1.2932, test_f1: 0.2281
 epoch: 5, train_loss: 1.1823, test_loss: 1.2797, test_f1: 0.2257
 epoch: 6, train_loss: 1.1772, test_loss: 1.2604, test_f1: 0.2551
 epoch: 7, train_loss: 1.1815, test_loss: 1.2405, test_f1: 0.2659
 epoch: 8, train_loss: 1.1640, test_loss: 1.2277, test_f1: 0.2551
 epoch: 9, train_loss: 1.1708, test_loss: 1.2646, test_f1: 0.2842
 epoch: 10, train_loss: 1.1602, test_loss: 1.2874, test_f1: 0.3042
 epoch: 11, train_loss: 1.1455, test_loss: 1.2445, test_f1: 0.3014
 epoch: 12, train_loss: 1.1387, test_loss: 1.2123, test_f1: 0.3085
 epoch: 13, train_loss: 1.1198, test_loss: 1.2109, test_f1: 0.3150
 epoch: 14, train_loss: 1.1089, test_loss: 1.2261, test_f1: 0.3154
 epoch: 15, train_loss: 1.0993, test_loss: 1.2469, test_f1: 0.3649
 epoch: 16, train_loss: 1.0856, test_loss: 1.2617, test_f1: 0.4239
 epoch: 17, train_loss: 1.0671, test_loss: 1.2548, test_f1: 0.4569
 epoch: 18, train_loss: 1.0601, test_loss: 1.2981, test_f1: 0.4669
 epoch: 19, train_loss: 1.0456, test_loss: 1.2524, test_f1: 0.4810
 epoch: 20, train_loss: 1.0405, test_loss: 1.2487, test_f1: 0.5060
 epoch: 21, train_loss: 1.0239, test_loss: 1.2851, test_f1: 0.5052
 epoch: 22, train_loss: 1.0135, test_loss: 1.2321, test_f1: 0.4685
 epoch: 23, train_loss: 1.0126, test_loss: 1.2508, test_f1: 0.4460
 epoch: 24, train_loss: 0.9927, test_loss: 1.2447, test_f1: 0.5108
 epoch: 25, train_loss: 1.0002, test_loss: 1.2072, test_f1: 0.5268
 epoch: 26, train_loss: 0.9920, test_loss: 1.1698, test_f1: 0.5349
 epoch: 27, train_loss: 0.9648, test_loss: 1.2323, test_f1: 0.4673
 epoch: 28, train_loss: 0.9628, test_loss: 1.2312, test_f1: 0.4592
 epoch: 29, train_loss: 0.9631, test_loss: 1.1898, test_f1: 0.5130
 epoch: 30, train_loss: 0.9529, test_loss: 1.1766, test_f1: 0.4943
 epoch: 31, train_loss: 0.9638, test_loss: 1.1412, test_f1: 0.5146
 epoch: 32, train_loss: 0.9154, test_loss: 1.1348, test_f1: 0.5411
 epoch: 33, train_loss: 0.9377, test_loss: 1.1861, test_f1: 0.5078
 epoch: 34, train_loss: 0.9270, test_loss: 1.2218, test_f1: 0.4927
 epoch: 35, train_loss: 0.9041, test_loss: 1.2435, test_f1: 0.4836
 epoch: 36, train_loss: 0.8986, test_loss: 1.2134, test_f1: 0.5090
 epoch: 37, train_loss: 0.9045, test_loss: 1.1992, test_f1: 0.5264
 epoch: 38, train_loss: 0.8915, test_loss: 1.2045, test_f1: 0.5284
 epoch: 39, train_loss: 0.8863, test_loss: 1.1248, test_f1: 0.5470
 epoch: 40, train_loss: 0.8653, test_loss: 1.2055, test_f1: 0.5601
 epoch: 41, train_loss: 0.8914, test_loss: 1.2647, test_f1: 0.5210
 epoch: 42, train_loss: 0.8877, test_loss: 1.2219, test_f1: 0.5124
 epoch: 43, train_loss: 0.8730, test_loss: 1.2822, test_f1: 0.5766
 epoch: 44, train_loss: 0.8663, test_loss: 1.1875, test_f1: 0.5452
 epoch: 45, train_loss: 0.8573, test_loss: 1.1370, test_f1: 0.5789
 epoch: 46, train_loss: 0.8635, test_loss: 1.1650, test_f1: 0.5375
 epoch: 47, train_loss: 0.8512, test_loss: 1.1861, test_f1: 0.4782
 epoch: 48, train_loss: 0.8467, test_loss: 1.1779, test_f1: 0.4853
 epoch: 49, train_loss: 0.8303, test_loss: 1.1880, test_f1: 0.4765
 epoch: 50, train_loss: 0.8191, test_loss: 1.1746, test_f1: 0.5079
 epoch: 51, train_loss: 0.8173, test_loss: 1.1275, test_f1: 0.5143
 epoch: 52, train_loss: 0.8221, test_loss: 1.0948, test_f1: 0.5256
 epoch: 53, train_loss: 0.8060, test_loss: 1.1352, test_f1: 0.5210
 epoch: 54, train_loss: 0.8076, test_loss: 1.1830, test_f1: 0.5372
 epoch: 55, train_loss: 0.8163, test_loss: 1.1347, test_f1: 0.5167
 epoch: 56, train_loss: 0.8032, test_loss: 1.1396, test_f1: 0.5275
 epoch: 57, train_loss: 0.8049, test_loss: 1.1790, test_f1: 0.5310
 epoch: 58, train_loss: 0.8144, test_loss: 1.1903, test_f1: 0.4877
 epoch: 59, train_loss: 0.8212, test_loss: 1.1757, test_f1: 0.4995
 epoch: 60, train_loss: 0.8116, test_loss: 1.1430, test_f1: 0.5170
 epoch: 61, train_loss: 0.8000, test_loss: 1.1178, test_f1: 0.5535
 epoch: 62, train_loss: 0.7994, test_loss: 1.1162, test_f1: 0.5331
 epoch: 63, train_loss: 0.7988, test_loss: 1.1471, test_f1: 0.5235
 epoch: 64, train_loss: 0.8110, test_loss: 1.1393, test_f1: 0.5325
 epoch: 65, train_loss: 0.7879, test_loss: 1.1751, test_f1: 0.5092
 epoch: 66, train_loss: 0.7821, test_loss: 1.1350, test_f1: 0.5117
 epoch: 67, train_loss: 0.8032, test_loss: 1.1263, test_f1: 0.5194
 epoch: 68, train_loss: 0.7960, test_loss: 1.1297, test_f1: 0.5211
 epoch: 69, train_loss: 0.7758, test_loss: 1.1442, test_f1: 0.5351
 epoch: 70, train_loss: 0.7837, test_loss: 1.1618, test_f1: 0.5423
 epoch: 71, train_loss: 0.7910, test_loss: 1.1896, test_f1: 0.5200
 epoch: 72, train_loss: 0.7776, test_loss: 1.2004, test_f1: 0.4947
 epoch: 73, train_loss: 0.7818, test_loss: 1.1871, test_f1: 0.5303
 epoch: 74, train_loss: 0.7780, test_loss: 1.2137, test_f1: 0.5467
 epoch: 75, train_loss: 0.7758, test_loss: 1.1910, test_f1: 0.5401
 epoch: 76, train_loss: 0.7690, test_loss: 1.1759, test_f1: 0.5406
 epoch: 77, train_loss: 0.7662, test_loss: 1.1478, test_f1: 0.5725
 epoch: 78, train_loss: 0.7581, test_loss: 1.1296, test_f1: 0.5734
 epoch: 79, train_loss: 0.7576, test_loss: 1.1505, test_f1: 0.5782
 epoch: 80, train_loss: 0.7643, test_loss: 1.1322, test_f1: 0.5796
 epoch: 81, train_loss: 0.7633, test_loss: 1.1338, test_f1: 0.5671
 epoch: 82, train_loss: 0.7764, test_loss: 1.1083, test_f1: 0.5522
 epoch: 83, train_loss: 0.7748, test_loss: 1.1538, test_f1: 0.5484
 epoch: 84, train_loss: 0.7596, test_loss: 1.1409, test_f1: 0.5432
 epoch: 85, train_loss: 0.7918, test_loss: 1.1011, test_f1: 0.5669
 epoch: 86, train_loss: 0.7652, test_loss: 1.1172, test_f1: 0.5655
 epoch: 87, train_loss: 0.7827, test_loss: 1.1362, test_f1: 0.5698
 epoch: 88, train_loss: 0.7570, test_loss: 1.1690, test_f1: 0.5585
 epoch: 89, train_loss: 0.7504, test_loss: 1.1524, test_f1: 0.5491
 epoch: 90, train_loss: 0.7478, test_loss: 1.1614, test_f1: 0.5292
 epoch: 91, train_loss: 0.7616, test_loss: 1.1886, test_f1: 0.5465
 epoch: 92, train_loss: 0.7484, test_loss: 1.1917, test_f1: 0.5651
 epoch: 93, train_loss: 0.7497, test_loss: 1.1310, test_f1: 0.5696
 epoch: 94, train_loss: 0.7504, test_loss: 1.1669, test_f1: 0.5607
 epoch: 95, train_loss: 0.7424, test_loss: 1.1942, test_f1: 0.5444
 epoch: 96, train_loss: 0.7328, test_loss: 1.1574, test_f1: 0.5232
 epoch: 97, train_loss: 0.7386, test_loss: 1.1614, test_f1: 0.5408
 epoch: 98, train_loss: 0.7281, test_loss: 1.1179, test_f1: 0.5422
 epoch: 99, train_loss: 0.7373, test_loss: 1.1302, test_f1: 0.5616
##################ITERATION #7 ****************************************
 epoch: 0, train_loss: 1.2420, test_loss: 1.3542, test_f1: 0.2404
 epoch: 1, train_loss: 1.1609, test_loss: 1.3170, test_f1: 0.2227
 epoch: 2, train_loss: 1.1370, test_loss: 1.3093, test_f1: 0.2336
 epoch: 3, train_loss: 1.1084, test_loss: 1.2887, test_f1: 0.2296
 epoch: 4, train_loss: 1.0905, test_loss: 1.2529, test_f1: 0.2765
 epoch: 5, train_loss: 1.0810, test_loss: 1.2262, test_f1: 0.3456
 epoch: 6, train_loss: 1.0581, test_loss: 1.1979, test_f1: 0.4001
 epoch: 7, train_loss: 1.0504, test_loss: 1.1664, test_f1: 0.4325
 epoch: 8, train_loss: 1.0516, test_loss: 1.1307, test_f1: 0.4617
 epoch: 9, train_loss: 1.0258, test_loss: 1.0960, test_f1: 0.5125
 epoch: 10, train_loss: 1.0088, test_loss: 1.1007, test_f1: 0.5039
 epoch: 11, train_loss: 1.0015, test_loss: 1.1076, test_f1: 0.4836
 epoch: 12, train_loss: 0.9763, test_loss: 1.1102, test_f1: 0.4704
 epoch: 13, train_loss: 0.9841, test_loss: 1.1017, test_f1: 0.5141
 epoch: 14, train_loss: 0.9677, test_loss: 1.0863, test_f1: 0.5315
 epoch: 15, train_loss: 0.9708, test_loss: 1.0758, test_f1: 0.4969
 epoch: 16, train_loss: 0.9476, test_loss: 1.0781, test_f1: 0.4949
 epoch: 17, train_loss: 0.9385, test_loss: 1.0813, test_f1: 0.4994
 epoch: 18, train_loss: 0.9374, test_loss: 1.0708, test_f1: 0.4967
 epoch: 19, train_loss: 0.9380, test_loss: 1.0780, test_f1: 0.4878
 epoch: 20, train_loss: 0.9348, test_loss: 1.0986, test_f1: 0.4888
 epoch: 21, train_loss: 0.9278, test_loss: 1.0884, test_f1: 0.4960
 epoch: 22, train_loss: 0.9212, test_loss: 1.0983, test_f1: 0.5126
 epoch: 23, train_loss: 0.8989, test_loss: 1.1308, test_f1: 0.5121
 epoch: 24, train_loss: 0.9190, test_loss: 1.1216, test_f1: 0.5071
 epoch: 25, train_loss: 0.8900, test_loss: 1.1269, test_f1: 0.4930
 epoch: 26, train_loss: 0.8905, test_loss: 1.0303, test_f1: 0.5410
 epoch: 27, train_loss: 0.8938, test_loss: 1.0251, test_f1: 0.5439
 epoch: 28, train_loss: 0.8916, test_loss: 1.0459, test_f1: 0.5348
 epoch: 29, train_loss: 0.8748, test_loss: 1.0536, test_f1: 0.5442
 epoch: 30, train_loss: 0.8782, test_loss: 1.0431, test_f1: 0.5225
 epoch: 31, train_loss: 0.8688, test_loss: 1.0460, test_f1: 0.5193
 epoch: 32, train_loss: 0.8684, test_loss: 1.0641, test_f1: 0.5088
 epoch: 33, train_loss: 0.8664, test_loss: 1.0463, test_f1: 0.5675
 epoch: 34, train_loss: 0.8440, test_loss: 1.0635, test_f1: 0.5397
 epoch: 35, train_loss: 0.8531, test_loss: 1.0788, test_f1: 0.5519
 epoch: 36, train_loss: 0.8358, test_loss: 1.0646, test_f1: 0.5703
 epoch: 37, train_loss: 0.8261, test_loss: 1.0613, test_f1: 0.5551
 epoch: 38, train_loss: 0.8315, test_loss: 1.0735, test_f1: 0.5124
 epoch: 39, train_loss: 0.8251, test_loss: 1.0415, test_f1: 0.5287
 epoch: 40, train_loss: 0.8269, test_loss: 1.0439, test_f1: 0.5171
 epoch: 41, train_loss: 0.8300, test_loss: 1.0817, test_f1: 0.4960
 epoch: 42, train_loss: 0.8278, test_loss: 1.1391, test_f1: 0.5137
 epoch: 43, train_loss: 0.8284, test_loss: 1.1160, test_f1: 0.5246
 epoch: 44, train_loss: 0.8442, test_loss: 1.0527, test_f1: 0.5618
 epoch: 45, train_loss: 0.8270, test_loss: 1.0749, test_f1: 0.5669
 epoch: 46, train_loss: 0.8278, test_loss: 1.0963, test_f1: 0.5233
 epoch: 47, train_loss: 0.8103, test_loss: 1.0822, test_f1: 0.5064
 epoch: 48, train_loss: 0.8161, test_loss: 1.0703, test_f1: 0.5199
 epoch: 49, train_loss: 0.8078, test_loss: 1.0723, test_f1: 0.5641
 epoch: 50, train_loss: 0.8005, test_loss: 1.0940, test_f1: 0.5231
 epoch: 51, train_loss: 0.7838, test_loss: 1.0707, test_f1: 0.5355
 epoch: 52, train_loss: 0.7918, test_loss: 1.0759, test_f1: 0.5223
 epoch: 53, train_loss: 0.7860, test_loss: 1.1110, test_f1: 0.5383
 epoch: 54, train_loss: 0.7741, test_loss: 1.0785, test_f1: 0.5389
 epoch: 55, train_loss: 0.7772, test_loss: 1.0529, test_f1: 0.5599
 epoch: 56, train_loss: 0.7709, test_loss: 1.0652, test_f1: 0.5514
 epoch: 57, train_loss: 0.7692, test_loss: 1.0708, test_f1: 0.5262
 epoch: 58, train_loss: 0.7738, test_loss: 1.0688, test_f1: 0.5501
 epoch: 59, train_loss: 0.7704, test_loss: 1.0759, test_f1: 0.5648
 epoch: 60, train_loss: 0.7635, test_loss: 1.0602, test_f1: 0.5663
 epoch: 61, train_loss: 0.7679, test_loss: 1.1047, test_f1: 0.5494
 epoch: 62, train_loss: 0.7781, test_loss: 1.1080, test_f1: 0.5583
 epoch: 63, train_loss: 0.7763, test_loss: 1.1089, test_f1: 0.5600
 epoch: 64, train_loss: 0.7721, test_loss: 1.1029, test_f1: 0.5406
 epoch: 65, train_loss: 0.7815, test_loss: 1.0832, test_f1: 0.5647
 epoch: 66, train_loss: 0.7575, test_loss: 1.1057, test_f1: 0.5574
 epoch: 67, train_loss: 0.7597, test_loss: 1.1320, test_f1: 0.5606
 epoch: 68, train_loss: 0.7495, test_loss: 1.1082, test_f1: 0.5560
 epoch: 69, train_loss: 0.7569, test_loss: 1.1044, test_f1: 0.5341
 epoch: 70, train_loss: 0.7529, test_loss: 1.1399, test_f1: 0.5215
 epoch: 71, train_loss: 0.7498, test_loss: 1.1280, test_f1: 0.5306
 epoch: 72, train_loss: 0.7544, test_loss: 1.1273, test_f1: 0.5383
 epoch: 73, train_loss: 0.7448, test_loss: 1.1368, test_f1: 0.5458
 epoch: 74, train_loss: 0.7540, test_loss: 1.1829, test_f1: 0.5210
 epoch: 75, train_loss: 0.7356, test_loss: 1.1839, test_f1: 0.5301
 epoch: 76, train_loss: 0.7313, test_loss: 1.1708, test_f1: 0.5440
 epoch: 77, train_loss: 0.7426, test_loss: 1.1993, test_f1: 0.5622
 epoch: 78, train_loss: 0.7503, test_loss: 1.1677, test_f1: 0.5547
 epoch: 79, train_loss: 0.7290, test_loss: 1.1528, test_f1: 0.5615
 epoch: 80, train_loss: 0.7367, test_loss: 1.1354, test_f1: 0.5542
 epoch: 81, train_loss: 0.7306, test_loss: 1.1156, test_f1: 0.5298
 epoch: 82, train_loss: 0.7307, test_loss: 1.1116, test_f1: 0.5442
 epoch: 83, train_loss: 0.7363, test_loss: 1.1463, test_f1: 0.5444
 epoch: 84, train_loss: 0.7401, test_loss: 1.1148, test_f1: 0.5457
 epoch: 85, train_loss: 0.7382, test_loss: 1.1087, test_f1: 0.5791
 epoch: 86, train_loss: 0.7309, test_loss: 1.1097, test_f1: 0.5954
 epoch: 87, train_loss: 0.7399, test_loss: 1.1473, test_f1: 0.5564
 epoch: 88, train_loss: 0.7330, test_loss: 1.1687, test_f1: 0.5641
 epoch: 89, train_loss: 0.7167, test_loss: 1.1226, test_f1: 0.5702
 epoch: 90, train_loss: 0.7261, test_loss: 1.1549, test_f1: 0.5748
 epoch: 91, train_loss: 0.7195, test_loss: 1.1587, test_f1: 0.5732
 epoch: 92, train_loss: 0.7105, test_loss: 1.1509, test_f1: 0.5700
 epoch: 93, train_loss: 0.7021, test_loss: 1.1505, test_f1: 0.5733
 epoch: 94, train_loss: 0.7116, test_loss: 1.1941, test_f1: 0.5707
 epoch: 95, train_loss: 0.7062, test_loss: 1.2051, test_f1: 0.5683
 epoch: 96, train_loss: 0.7149, test_loss: 1.1812, test_f1: 0.5435
 epoch: 97, train_loss: 0.7280, test_loss: 1.1395, test_f1: 0.5721
 epoch: 98, train_loss: 0.7256, test_loss: 1.1656, test_f1: 0.5706
 epoch: 99, train_loss: 0.7259, test_loss: 1.1902, test_f1: 0.5725
##################ITERATION #8 ****************************************
 epoch: 0, train_loss: 1.3760, test_loss: 1.3069, test_f1: 0.2281
 epoch: 1, train_loss: 1.2725, test_loss: 1.2994, test_f1: 0.2281
 epoch: 2, train_loss: 1.2414, test_loss: 1.2861, test_f1: 0.2281
 epoch: 3, train_loss: 1.2168, test_loss: 1.2753, test_f1: 0.2281
 epoch: 4, train_loss: 1.2027, test_loss: 1.2595, test_f1: 0.2281
 epoch: 5, train_loss: 1.1938, test_loss: 1.2438, test_f1: 0.2281
 epoch: 6, train_loss: 1.1689, test_loss: 1.2289, test_f1: 0.2594
 epoch: 7, train_loss: 1.1531, test_loss: 1.2117, test_f1: 0.2585
 epoch: 8, train_loss: 1.1333, test_loss: 1.1956, test_f1: 0.2948
 epoch: 9, train_loss: 1.1588, test_loss: 1.1776, test_f1: 0.3403
 epoch: 10, train_loss: 1.1231, test_loss: 1.1614, test_f1: 0.3911
 epoch: 11, train_loss: 1.1130, test_loss: 1.1484, test_f1: 0.4009
 epoch: 12, train_loss: 1.1095, test_loss: 1.1333, test_f1: 0.4059
 epoch: 13, train_loss: 1.0848, test_loss: 1.1136, test_f1: 0.4446
 epoch: 14, train_loss: 1.0723, test_loss: 1.1054, test_f1: 0.4877
 epoch: 15, train_loss: 1.0559, test_loss: 1.0936, test_f1: 0.4981
 epoch: 16, train_loss: 1.0496, test_loss: 1.0800, test_f1: 0.4983
 epoch: 17, train_loss: 1.0276, test_loss: 1.0705, test_f1: 0.5022
 epoch: 18, train_loss: 1.0333, test_loss: 1.0642, test_f1: 0.5332
 epoch: 19, train_loss: 1.0168, test_loss: 1.0575, test_f1: 0.5219
 epoch: 20, train_loss: 1.0061, test_loss: 1.0586, test_f1: 0.5237
 epoch: 21, train_loss: 0.9978, test_loss: 1.0529, test_f1: 0.5152
 epoch: 22, train_loss: 0.9951, test_loss: 1.0402, test_f1: 0.5453
 epoch: 23, train_loss: 0.9882, test_loss: 1.0242, test_f1: 0.5687
 epoch: 24, train_loss: 0.9745, test_loss: 1.0245, test_f1: 0.5513
 epoch: 25, train_loss: 0.9530, test_loss: 1.0361, test_f1: 0.5135
 epoch: 26, train_loss: 0.9602, test_loss: 1.0238, test_f1: 0.5473
 epoch: 27, train_loss: 0.9535, test_loss: 1.0178, test_f1: 0.5535
 epoch: 28, train_loss: 0.9476, test_loss: 1.0072, test_f1: 0.5560
 epoch: 29, train_loss: 0.9322, test_loss: 1.0000, test_f1: 0.5491
 epoch: 30, train_loss: 0.9431, test_loss: 0.9906, test_f1: 0.5511
 epoch: 31, train_loss: 0.9173, test_loss: 0.9926, test_f1: 0.5525
 epoch: 32, train_loss: 0.9155, test_loss: 0.9892, test_f1: 0.5780
 epoch: 33, train_loss: 0.9034, test_loss: 0.9772, test_f1: 0.5875
 epoch: 34, train_loss: 0.9025, test_loss: 0.9691, test_f1: 0.5732
 epoch: 35, train_loss: 0.8988, test_loss: 0.9860, test_f1: 0.5648
 epoch: 36, train_loss: 0.9052, test_loss: 0.9863, test_f1: 0.5872
 epoch: 37, train_loss: 0.8894, test_loss: 0.9762, test_f1: 0.5740
 epoch: 38, train_loss: 0.8811, test_loss: 1.0204, test_f1: 0.5367
 epoch: 39, train_loss: 0.8721, test_loss: 0.9844, test_f1: 0.5602
 epoch: 40, train_loss: 0.8681, test_loss: 0.9723, test_f1: 0.5833
 epoch: 41, train_loss: 0.8655, test_loss: 0.9769, test_f1: 0.5913
 epoch: 42, train_loss: 0.8570, test_loss: 0.9894, test_f1: 0.6286
 epoch: 43, train_loss: 0.8501, test_loss: 0.9802, test_f1: 0.5928
 epoch: 44, train_loss: 0.8502, test_loss: 0.9660, test_f1: 0.6183
 epoch: 45, train_loss: 0.8334, test_loss: 0.9698, test_f1: 0.5752
 epoch: 46, train_loss: 0.8274, test_loss: 0.9679, test_f1: 0.5882
 epoch: 47, train_loss: 0.8481, test_loss: 1.0179, test_f1: 0.5297
 epoch: 48, train_loss: 0.8391, test_loss: 1.0760, test_f1: 0.5138
 epoch: 49, train_loss: 0.8187, test_loss: 0.9842, test_f1: 0.5857
 epoch: 50, train_loss: 0.8204, test_loss: 0.9765, test_f1: 0.5928
 epoch: 51, train_loss: 0.8045, test_loss: 0.9531, test_f1: 0.6413
 epoch: 52, train_loss: 0.7978, test_loss: 0.9595, test_f1: 0.6294
 epoch: 53, train_loss: 0.8128, test_loss: 0.9524, test_f1: 0.6053
 epoch: 54, train_loss: 0.8023, test_loss: 0.9479, test_f1: 0.5915
 epoch: 55, train_loss: 0.7973, test_loss: 0.9428, test_f1: 0.5736
 epoch: 56, train_loss: 0.7981, test_loss: 0.9475, test_f1: 0.5701
 epoch: 57, train_loss: 0.7835, test_loss: 0.9507, test_f1: 0.5832
 epoch: 58, train_loss: 0.7901, test_loss: 0.9493, test_f1: 0.6067
 epoch: 59, train_loss: 0.7962, test_loss: 0.9571, test_f1: 0.5915
 epoch: 60, train_loss: 0.7950, test_loss: 0.9564, test_f1: 0.5968
 epoch: 61, train_loss: 0.7814, test_loss: 0.9434, test_f1: 0.6542
 epoch: 62, train_loss: 0.7802, test_loss: 0.9472, test_f1: 0.6387
 epoch: 63, train_loss: 0.7807, test_loss: 0.9471, test_f1: 0.6212
 epoch: 64, train_loss: 0.7802, test_loss: 0.9326, test_f1: 0.6427
 epoch: 65, train_loss: 0.7682, test_loss: 0.9461, test_f1: 0.6263
 epoch: 66, train_loss: 0.7739, test_loss: 0.9846, test_f1: 0.6036
 epoch: 67, train_loss: 0.7695, test_loss: 0.9997, test_f1: 0.5971
 epoch: 68, train_loss: 0.7862, test_loss: 0.9856, test_f1: 0.6173
 epoch: 69, train_loss: 0.7890, test_loss: 0.9656, test_f1: 0.6212
 epoch: 70, train_loss: 0.7863, test_loss: 0.9593, test_f1: 0.6362
 epoch: 71, train_loss: 0.7860, test_loss: 0.9617, test_f1: 0.6093
 epoch: 72, train_loss: 0.7795, test_loss: 0.9636, test_f1: 0.6073
 epoch: 73, train_loss: 0.7748, test_loss: 0.9595, test_f1: 0.6163
 epoch: 74, train_loss: 0.7651, test_loss: 0.9799, test_f1: 0.6001
 epoch: 75, train_loss: 0.7713, test_loss: 0.9670, test_f1: 0.5885
 epoch: 76, train_loss: 0.7866, test_loss: 0.9626, test_f1: 0.5886
 epoch: 77, train_loss: 0.7710, test_loss: 0.9525, test_f1: 0.6161
 epoch: 78, train_loss: 0.7548, test_loss: 0.9482, test_f1: 0.5990
 epoch: 79, train_loss: 0.7700, test_loss: 0.9700, test_f1: 0.6076
 epoch: 80, train_loss: 0.7538, test_loss: 0.9545, test_f1: 0.6328
 epoch: 81, train_loss: 0.7614, test_loss: 0.9815, test_f1: 0.6213
 epoch: 82, train_loss: 0.7476, test_loss: 0.9876, test_f1: 0.6116
 epoch: 83, train_loss: 0.7624, test_loss: 1.0114, test_f1: 0.6105
 epoch: 84, train_loss: 0.7572, test_loss: 0.9458, test_f1: 0.6230
 epoch: 85, train_loss: 0.7417, test_loss: 0.9451, test_f1: 0.6101
 epoch: 86, train_loss: 0.7328, test_loss: 1.0378, test_f1: 0.6019
 epoch: 87, train_loss: 0.7470, test_loss: 0.9714, test_f1: 0.6188
 epoch: 88, train_loss: 0.7370, test_loss: 0.9647, test_f1: 0.6158
 epoch: 89, train_loss: 0.7319, test_loss: 0.9754, test_f1: 0.6237
 epoch: 90, train_loss: 0.7477, test_loss: 0.9465, test_f1: 0.6422
 epoch: 91, train_loss: 0.7286, test_loss: 0.9149, test_f1: 0.6464
 epoch: 92, train_loss: 0.7433, test_loss: 0.9334, test_f1: 0.6370
 epoch: 93, train_loss: 0.7483, test_loss: 0.9617, test_f1: 0.6125
 epoch: 94, train_loss: 0.7343, test_loss: 0.9957, test_f1: 0.5975
 epoch: 95, train_loss: 0.7300, test_loss: 0.9857, test_f1: 0.6006
 epoch: 96, train_loss: 0.7410, test_loss: 1.1171, test_f1: 0.5677
 epoch: 97, train_loss: 0.7521, test_loss: 0.9997, test_f1: 0.5921
 epoch: 98, train_loss: 0.7290, test_loss: 0.9665, test_f1: 0.6244
 epoch: 99, train_loss: 0.7292, test_loss: 1.0034, test_f1: 0.6191
##################ITERATION #9 ****************************************
 epoch: 0, train_loss: 1.5770, test_loss: 1.3701, test_f1: 0.2312
 epoch: 1, train_loss: 1.3511, test_loss: 1.3206, test_f1: 0.2281
 epoch: 2, train_loss: 1.2772, test_loss: 1.3198, test_f1: 0.2281
 epoch: 3, train_loss: 1.2396, test_loss: 1.3194, test_f1: 0.2281
 epoch: 4, train_loss: 1.2342, test_loss: 1.3103, test_f1: 0.2281
 epoch: 5, train_loss: 1.1849, test_loss: 1.2963, test_f1: 0.2281
 epoch: 6, train_loss: 1.1761, test_loss: 1.2948, test_f1: 0.2285
 epoch: 7, train_loss: 1.1432, test_loss: 1.2702, test_f1: 0.2293
 epoch: 8, train_loss: 1.1259, test_loss: 1.2654, test_f1: 0.2577
 epoch: 9, train_loss: 1.1161, test_loss: 1.2539, test_f1: 0.3378
 epoch: 10, train_loss: 1.1030, test_loss: 1.2186, test_f1: 0.3379
 epoch: 11, train_loss: 1.0855, test_loss: 1.1939, test_f1: 0.3709
 epoch: 12, train_loss: 1.0768, test_loss: 1.1810, test_f1: 0.3717
 epoch: 13, train_loss: 1.0678, test_loss: 1.1786, test_f1: 0.3912
 epoch: 14, train_loss: 1.0657, test_loss: 1.1683, test_f1: 0.3912
 epoch: 15, train_loss: 1.0368, test_loss: 1.1638, test_f1: 0.4196
 epoch: 16, train_loss: 1.0470, test_loss: 1.1524, test_f1: 0.4159
 epoch: 17, train_loss: 1.0318, test_loss: 1.1487, test_f1: 0.3935
 epoch: 18, train_loss: 1.0326, test_loss: 1.1451, test_f1: 0.4037
 epoch: 19, train_loss: 1.0277, test_loss: 1.1566, test_f1: 0.4377
 epoch: 20, train_loss: 1.0157, test_loss: 1.1588, test_f1: 0.4347
 epoch: 21, train_loss: 1.0155, test_loss: 1.1392, test_f1: 0.4440
 epoch: 22, train_loss: 1.0017, test_loss: 1.1384, test_f1: 0.4622
 epoch: 23, train_loss: 1.0214, test_loss: 1.1492, test_f1: 0.4540
 epoch: 24, train_loss: 1.0022, test_loss: 1.1446, test_f1: 0.4577
 epoch: 25, train_loss: 1.0064, test_loss: 1.1290, test_f1: 0.4754
 epoch: 26, train_loss: 0.9861, test_loss: 1.1125, test_f1: 0.4575
 epoch: 27, train_loss: 0.9757, test_loss: 1.1256, test_f1: 0.4569
 epoch: 28, train_loss: 0.9808, test_loss: 1.1503, test_f1: 0.4674
 epoch: 29, train_loss: 0.9765, test_loss: 1.1794, test_f1: 0.4446
 epoch: 30, train_loss: 0.9781, test_loss: 1.1718, test_f1: 0.4666
 epoch: 31, train_loss: 0.9770, test_loss: 1.1489, test_f1: 0.4505
 epoch: 32, train_loss: 0.9702, test_loss: 1.1237, test_f1: 0.4889
 epoch: 33, train_loss: 0.9943, test_loss: 1.1668, test_f1: 0.4697
 epoch: 34, train_loss: 0.9688, test_loss: 1.2077, test_f1: 0.4719
 epoch: 35, train_loss: 0.9748, test_loss: 1.2244, test_f1: 0.4714
 epoch: 36, train_loss: 0.9444, test_loss: 1.1930, test_f1: 0.4935
 epoch: 37, train_loss: 0.9554, test_loss: 1.2364, test_f1: 0.4592
 epoch: 38, train_loss: 0.9432, test_loss: 1.2220, test_f1: 0.4541
 epoch: 39, train_loss: 0.9402, test_loss: 1.1019, test_f1: 0.4916
 epoch: 40, train_loss: 0.9367, test_loss: 1.1714, test_f1: 0.4902
 epoch: 41, train_loss: 0.9342, test_loss: 1.1921, test_f1: 0.5191
 epoch: 42, train_loss: 0.9416, test_loss: 1.1299, test_f1: 0.4771
 epoch: 43, train_loss: 0.9362, test_loss: 1.2580, test_f1: 0.4391
 epoch: 44, train_loss: 0.9312, test_loss: 1.2985, test_f1: 0.4468
 epoch: 45, train_loss: 0.9161, test_loss: 1.1892, test_f1: 0.4654
 epoch: 46, train_loss: 0.9245, test_loss: 1.1544, test_f1: 0.4991
 epoch: 47, train_loss: 0.9131, test_loss: 1.2278, test_f1: 0.4884
 epoch: 48, train_loss: 0.9121, test_loss: 1.2766, test_f1: 0.4787
 epoch: 49, train_loss: 0.9051, test_loss: 1.1540, test_f1: 0.4955
 epoch: 50, train_loss: 0.9000, test_loss: 1.1112, test_f1: 0.5289
 epoch: 51, train_loss: 0.8837, test_loss: 1.1191, test_f1: 0.4996
 epoch: 52, train_loss: 0.8775, test_loss: 1.1392, test_f1: 0.5009
 epoch: 53, train_loss: 0.8714, test_loss: 1.1137, test_f1: 0.5073
 epoch: 54, train_loss: 0.8773, test_loss: 1.1192, test_f1: 0.5125
 epoch: 55, train_loss: 0.8699, test_loss: 1.1062, test_f1: 0.5146
 epoch: 56, train_loss: 0.8876, test_loss: 1.1008, test_f1: 0.5025
 epoch: 57, train_loss: 0.8729, test_loss: 1.1201, test_f1: 0.4865
 epoch: 58, train_loss: 0.8813, test_loss: 1.1294, test_f1: 0.5171
 epoch: 59, train_loss: 0.8610, test_loss: 1.1423, test_f1: 0.4868
 epoch: 60, train_loss: 0.8939, test_loss: 1.1383, test_f1: 0.4978
 epoch: 61, train_loss: 0.8931, test_loss: 1.1327, test_f1: 0.4870
 epoch: 62, train_loss: 0.8817, test_loss: 1.1809, test_f1: 0.4789
 epoch: 63, train_loss: 0.8678, test_loss: 1.1512, test_f1: 0.5096
 epoch: 64, train_loss: 0.8741, test_loss: 1.1586, test_f1: 0.5161
 epoch: 65, train_loss: 0.8554, test_loss: 1.1474, test_f1: 0.5073
 epoch: 66, train_loss: 0.8561, test_loss: 1.1378, test_f1: 0.4887
 epoch: 67, train_loss: 0.8549, test_loss: 1.1376, test_f1: 0.4856
 epoch: 68, train_loss: 0.8727, test_loss: 1.1298, test_f1: 0.4862
 epoch: 69, train_loss: 0.8664, test_loss: 1.1305, test_f1: 0.4782
 epoch: 70, train_loss: 0.8600, test_loss: 1.1273, test_f1: 0.4857
 epoch: 71, train_loss: 0.8714, test_loss: 1.1349, test_f1: 0.4869
 epoch: 72, train_loss: 0.8522, test_loss: 1.1571, test_f1: 0.4965
 epoch: 73, train_loss: 0.8494, test_loss: 1.1402, test_f1: 0.5091
 epoch: 74, train_loss: 0.8396, test_loss: 1.1227, test_f1: 0.5118
 epoch: 75, train_loss: 0.8350, test_loss: 1.1193, test_f1: 0.5048
 epoch: 76, train_loss: 0.8549, test_loss: 1.1075, test_f1: 0.5274
 epoch: 77, train_loss: 0.8532, test_loss: 1.1427, test_f1: 0.4772
 epoch: 78, train_loss: 0.8442, test_loss: 1.1656, test_f1: 0.4762
 epoch: 79, train_loss: 0.8554, test_loss: 1.2037, test_f1: 0.4486
 epoch: 80, train_loss: 0.8386, test_loss: 1.2100, test_f1: 0.4613
 epoch: 81, train_loss: 0.8413, test_loss: 1.1728, test_f1: 0.4632
 epoch: 82, train_loss: 0.8410, test_loss: 1.1466, test_f1: 0.4689
 epoch: 83, train_loss: 0.8296, test_loss: 1.1552, test_f1: 0.4692
 epoch: 84, train_loss: 0.8281, test_loss: 1.1685, test_f1: 0.4416
 epoch: 85, train_loss: 0.8336, test_loss: 1.1635, test_f1: 0.4629
 epoch: 86, train_loss: 0.8350, test_loss: 1.1806, test_f1: 0.4793
 epoch: 87, train_loss: 0.8213, test_loss: 1.2412, test_f1: 0.4945
 epoch: 88, train_loss: 0.8150, test_loss: 1.1954, test_f1: 0.4804
 epoch: 89, train_loss: 0.8366, test_loss: 1.1700, test_f1: 0.4852
 epoch: 90, train_loss: 0.8410, test_loss: 1.1623, test_f1: 0.4646
 epoch: 91, train_loss: 0.8224, test_loss: 1.1495, test_f1: 0.4576
 epoch: 92, train_loss: 0.8143, test_loss: 1.1857, test_f1: 0.4863
 epoch: 93, train_loss: 0.8250, test_loss: 1.1949, test_f1: 0.4612
 epoch: 94, train_loss: 0.8368, test_loss: 1.2182, test_f1: 0.4592
 epoch: 95, train_loss: 0.8221, test_loss: 1.1733, test_f1: 0.4792
 epoch: 96, train_loss: 0.8357, test_loss: 1.1483, test_f1: 0.4554
 epoch: 97, train_loss: 0.8197, test_loss: 1.1614, test_f1: 0.4606
 epoch: 98, train_loss: 0.8095, test_loss: 1.2497, test_f1: 0.5029
 epoch: 99, train_loss: 0.8220, test_loss: 1.1479, test_f1: 0.4982

Training completed in 317.01 seconds
Best F1: 0.6542 at epoch 61
Mean F1 across iterations: 0.5884  0.0307
========================FINAL RESULTS================================
FEGIN weighted F1: 0.6542  0.0307
python main.py --data ltspice_demos --representation component_pin --model FEGIN --layers 5 --hiddens 16 --batch_size 256 --lr 0.001 --emb_size 128 --epochs 100 --save_appendix component_pin_L5_H16_BS256_LR0.001_E128 --no_val
-----



STDERR:
  File "main.py", line 370, in <module>
    main()
  File "main.py", line 254, in main
    dataset = dataset_class(
  File "/home/philip/projects/ltspice_examples_code_repo/Circuit-Completion-Using-GNNs/component_classification_with_link_prediction_head/evaluation/FEGIN/kernel/circuit_datasets.py", line 15, in __init__
    self.data, self.slices = torch.load(self.processed_paths[0])
  File "/home/philip/.local/lib/python3.8/site-packages/torch/serialization.py", line 1040, in load
    warnings.warn(
  File "/usr/lib/python3.8/warnings.py", line 109, in _showwarnmsg
    sw(msg.message, msg.category, msg.filename, msg.lineno,
  File "main.py", line 47, in warn_with_traceback
    traceback.print_stack(file=log)
/home/philip/projects/ltspice_examples_code_repo/Circuit-Completion-Using-GNNs/component_classification_with_link_prediction_head/evaluation/FEGIN/kernel/circuit_datasets.py:15: FutureWarning: You are using `torch.load` with `weights_only=False` (the current default value), which uses the default pickle module implicitly. It is possible to construct malicious pickle data which will execute arbitrary code during unpickling (See https://github.com/pytorch/pytorch/blob/main/SECURITY.md#untrusted-models for more details). In a future release, the default value for `weights_only` will be flipped to `True`. This limits the functions that could be executed during unpickling. Arbitrary objects will no longer be allowed to be loaded via this mode unless they are explicitly allowlisted by the user via `torch.serialization.add_safe_globals`. We recommend you start setting `weights_only=True` for any use case where you don't have full control of the loaded file. Please open an issue on GitHub for any issues related to this experimental feature.
  self.data, self.slices = torch.load(self.processed_paths[0])
