STDOUT:
Results will be saved in /home/philip/projects/ltspice_examples_code_repo/Circuit-Completion-Using-GNNs/component_classification_with_link_prediction_head/evaluation/FEGIN/results/model_FEGIN_dataset_ltspice_examples
Command line input: python main.py --data ltspice_examples --representation component_pin --model FEGIN --layers 4 --hiddens 16 --batch_size 64 --lr 0.001 --emb_size 250 --epochs 100 --save_appendix component_pin_L4_H16_BS64_LR0.001_E250 --no_val
 is saved.
-----
ltspice_examples - FEGIN
Using 4 layers, 16 hidden units, h = 2
Loading component_pin representation dataset
ENTERED
Training FEGIN on component_pin representation
Train: 3560, Test: 848
##################ITERATION #0 ****************************************
 epoch: 0, train_loss: 1.3831, test_loss: 1.3155, test_f1: 0.3638
 epoch: 1, train_loss: 1.2673, test_loss: 1.2077, test_f1: 0.2383
 epoch: 2, train_loss: 1.2090, test_loss: 1.1687, test_f1: 0.2526
 epoch: 3, train_loss: 1.1760, test_loss: 1.1250, test_f1: 0.3548
 epoch: 4, train_loss: 1.1267, test_loss: 1.0708, test_f1: 0.3393
 epoch: 5, train_loss: 1.0585, test_loss: 1.0164, test_f1: 0.3550
 epoch: 6, train_loss: 1.0186, test_loss: 0.9944, test_f1: 0.4115
 epoch: 7, train_loss: 0.9943, test_loss: 1.0157, test_f1: 0.3975
 epoch: 8, train_loss: 0.9850, test_loss: 1.0156, test_f1: 0.4504
 epoch: 9, train_loss: 0.9683, test_loss: 1.0177, test_f1: 0.4539
 epoch: 10, train_loss: 0.9607, test_loss: 0.9774, test_f1: 0.4556
 epoch: 11, train_loss: 0.9578, test_loss: 0.9978, test_f1: 0.4618
 epoch: 12, train_loss: 0.9415, test_loss: 0.9826, test_f1: 0.4858
 epoch: 13, train_loss: 0.9396, test_loss: 0.9780, test_f1: 0.4697
 epoch: 14, train_loss: 0.9271, test_loss: 0.9843, test_f1: 0.4652
 epoch: 15, train_loss: 0.9242, test_loss: 0.9889, test_f1: 0.4489
 epoch: 16, train_loss: 0.9192, test_loss: 0.9468, test_f1: 0.4741
 epoch: 17, train_loss: 0.9183, test_loss: 0.9599, test_f1: 0.4865
 epoch: 18, train_loss: 0.9160, test_loss: 0.9786, test_f1: 0.4845
 epoch: 19, train_loss: 0.9003, test_loss: 0.8807, test_f1: 0.5116
 epoch: 20, train_loss: 0.8965, test_loss: 0.9424, test_f1: 0.4913
 epoch: 21, train_loss: 0.8898, test_loss: 0.9378, test_f1: 0.5049
 epoch: 22, train_loss: 0.8839, test_loss: 0.8950, test_f1: 0.5169
 epoch: 23, train_loss: 0.8822, test_loss: 0.9377, test_f1: 0.4911
 epoch: 24, train_loss: 0.8730, test_loss: 0.9489, test_f1: 0.5030
 epoch: 25, train_loss: 0.8601, test_loss: 0.9530, test_f1: 0.5321
 epoch: 26, train_loss: 0.8550, test_loss: 0.8925, test_f1: 0.4976
 epoch: 27, train_loss: 0.8542, test_loss: 0.9428, test_f1: 0.4972
 epoch: 28, train_loss: 0.8558, test_loss: 0.9131, test_f1: 0.5407
 epoch: 29, train_loss: 0.8611, test_loss: 0.9197, test_f1: 0.5155
 epoch: 30, train_loss: 0.8428, test_loss: 0.9357, test_f1: 0.4916
 epoch: 31, train_loss: 0.8483, test_loss: 0.9392, test_f1: 0.5047
 epoch: 32, train_loss: 0.8470, test_loss: 0.8619, test_f1: 0.5095
 epoch: 33, train_loss: 0.8381, test_loss: 0.9126, test_f1: 0.5089
 epoch: 34, train_loss: 0.8499, test_loss: 0.8848, test_f1: 0.5120
 epoch: 35, train_loss: 0.8279, test_loss: 0.8806, test_f1: 0.5002
 epoch: 36, train_loss: 0.8250, test_loss: 0.9168, test_f1: 0.5006
 epoch: 37, train_loss: 0.8200, test_loss: 0.9033, test_f1: 0.5234
 epoch: 38, train_loss: 0.8334, test_loss: 0.8647, test_f1: 0.5379
 epoch: 39, train_loss: 0.8146, test_loss: 0.9209, test_f1: 0.5093
 epoch: 40, train_loss: 0.8161, test_loss: 0.9112, test_f1: 0.5328
 epoch: 41, train_loss: 0.8260, test_loss: 0.8605, test_f1: 0.5263
 epoch: 42, train_loss: 0.8105, test_loss: 0.8938, test_f1: 0.5219
 epoch: 43, train_loss: 0.8075, test_loss: 0.8618, test_f1: 0.5286
 epoch: 44, train_loss: 0.8012, test_loss: 0.8468, test_f1: 0.5215
 epoch: 45, train_loss: 0.8059, test_loss: 0.8305, test_f1: 0.5358
 epoch: 46, train_loss: 0.7887, test_loss: 0.9107, test_f1: 0.5232
 epoch: 47, train_loss: 0.7978, test_loss: 0.8789, test_f1: 0.5353
 epoch: 48, train_loss: 0.7947, test_loss: 0.8956, test_f1: 0.5328
 epoch: 49, train_loss: 0.7712, test_loss: 0.8749, test_f1: 0.5209
 epoch: 50, train_loss: 0.7842, test_loss: 0.9160, test_f1: 0.5333
 epoch: 51, train_loss: 0.7778, test_loss: 0.8901, test_f1: 0.5335
 epoch: 52, train_loss: 0.7602, test_loss: 0.8803, test_f1: 0.5233
 epoch: 53, train_loss: 0.7717, test_loss: 0.8775, test_f1: 0.5611
 epoch: 54, train_loss: 0.7611, test_loss: 0.8713, test_f1: 0.5486
 epoch: 55, train_loss: 0.7573, test_loss: 0.8784, test_f1: 0.5594
 epoch: 56, train_loss: 0.7747, test_loss: 0.8735, test_f1: 0.5321
 epoch: 57, train_loss: 0.7653, test_loss: 0.8661, test_f1: 0.5571
 epoch: 58, train_loss: 0.7674, test_loss: 0.8550, test_f1: 0.5630
 epoch: 59, train_loss: 0.7798, test_loss: 0.8859, test_f1: 0.5607
 epoch: 60, train_loss: 0.7575, test_loss: 0.8847, test_f1: 0.5362
 epoch: 61, train_loss: 0.7547, test_loss: 0.8660, test_f1: 0.5571
 epoch: 62, train_loss: 0.7590, test_loss: 0.8978, test_f1: 0.5541
 epoch: 63, train_loss: 0.7654, test_loss: 0.8513, test_f1: 0.5513
 epoch: 64, train_loss: 0.7495, test_loss: 0.8883, test_f1: 0.5412
 epoch: 65, train_loss: 0.7461, test_loss: 0.8705, test_f1: 0.5613
 epoch: 66, train_loss: 0.7497, test_loss: 0.8725, test_f1: 0.5573
 epoch: 67, train_loss: 0.7531, test_loss: 0.8846, test_f1: 0.5457
 epoch: 68, train_loss: 0.7577, test_loss: 0.8745, test_f1: 0.5471
 epoch: 69, train_loss: 0.7389, test_loss: 0.9008, test_f1: 0.5157
 epoch: 70, train_loss: 0.7577, test_loss: 0.8787, test_f1: 0.5393
 epoch: 71, train_loss: 0.7499, test_loss: 0.8993, test_f1: 0.5441
 epoch: 72, train_loss: 0.7370, test_loss: 0.8909, test_f1: 0.5347
 epoch: 73, train_loss: 0.7480, test_loss: 0.9186, test_f1: 0.5277
 epoch: 74, train_loss: 0.7313, test_loss: 0.8665, test_f1: 0.5511
 epoch: 75, train_loss: 0.7348, test_loss: 0.8691, test_f1: 0.5450
 epoch: 76, train_loss: 0.7406, test_loss: 0.8940, test_f1: 0.5710
 epoch: 77, train_loss: 0.7413, test_loss: 0.9013, test_f1: 0.5376
 epoch: 78, train_loss: 0.7454, test_loss: 0.8789, test_f1: 0.5529
 epoch: 79, train_loss: 0.7430, test_loss: 0.8850, test_f1: 0.5475
 epoch: 80, train_loss: 0.7407, test_loss: 0.8976, test_f1: 0.5388
 epoch: 81, train_loss: 0.7341, test_loss: 0.8800, test_f1: 0.5528
 epoch: 82, train_loss: 0.7488, test_loss: 0.8623, test_f1: 0.5625
 epoch: 83, train_loss: 0.7322, test_loss: 0.9072, test_f1: 0.5508
 epoch: 84, train_loss: 0.7345, test_loss: 0.8871, test_f1: 0.5510
 epoch: 85, train_loss: 0.7221, test_loss: 0.8965, test_f1: 0.5459
 epoch: 86, train_loss: 0.7235, test_loss: 0.8946, test_f1: 0.5392
 epoch: 87, train_loss: 0.7305, test_loss: 0.8979, test_f1: 0.5542
 epoch: 88, train_loss: 0.7297, test_loss: 0.8853, test_f1: 0.5463
 epoch: 89, train_loss: 0.7345, test_loss: 0.8775, test_f1: 0.5437
 epoch: 90, train_loss: 0.7312, test_loss: 0.8894, test_f1: 0.5424
 epoch: 91, train_loss: 0.7408, test_loss: 0.8939, test_f1: 0.5615
 epoch: 92, train_loss: 0.7245, test_loss: 0.8977, test_f1: 0.5383
 epoch: 93, train_loss: 0.7272, test_loss: 0.8859, test_f1: 0.5553
 epoch: 94, train_loss: 0.7172, test_loss: 0.8781, test_f1: 0.5377
 epoch: 95, train_loss: 0.7251, test_loss: 0.9275, test_f1: 0.5487
 epoch: 96, train_loss: 0.7272, test_loss: 0.8808, test_f1: 0.5557
 epoch: 97, train_loss: 0.7173, test_loss: 0.8840, test_f1: 0.5518
 epoch: 98, train_loss: 0.7190, test_loss: 0.8736, test_f1: 0.5557
 epoch: 99, train_loss: 0.7136, test_loss: 0.9065, test_f1: 0.5413
##################ITERATION #1 ****************************************
 epoch: 0, train_loss: 1.2962, test_loss: 1.2382, test_f1: 0.2260
 epoch: 1, train_loss: 1.2043, test_loss: 1.1460, test_f1: 0.3305
 epoch: 2, train_loss: 1.1549, test_loss: 1.0962, test_f1: 0.3265
 epoch: 3, train_loss: 1.1045, test_loss: 1.0866, test_f1: 0.3509
 epoch: 4, train_loss: 1.0673, test_loss: 1.0547, test_f1: 0.3556
 epoch: 5, train_loss: 1.0306, test_loss: 1.0261, test_f1: 0.4649
 epoch: 6, train_loss: 1.0220, test_loss: 1.0384, test_f1: 0.4588
 epoch: 7, train_loss: 0.9926, test_loss: 0.9806, test_f1: 0.4657
 epoch: 8, train_loss: 0.9888, test_loss: 1.0313, test_f1: 0.4643
 epoch: 9, train_loss: 0.9681, test_loss: 1.0165, test_f1: 0.4753
 epoch: 10, train_loss: 0.9558, test_loss: 1.0253, test_f1: 0.4759
 epoch: 11, train_loss: 0.9555, test_loss: 1.0559, test_f1: 0.4695
 epoch: 12, train_loss: 0.9483, test_loss: 1.0111, test_f1: 0.5148
 epoch: 13, train_loss: 0.9468, test_loss: 1.0009, test_f1: 0.5186
 epoch: 14, train_loss: 0.9299, test_loss: 0.9990, test_f1: 0.5211
 epoch: 15, train_loss: 0.9281, test_loss: 1.0417, test_f1: 0.4705
 epoch: 16, train_loss: 0.9202, test_loss: 1.0643, test_f1: 0.4860
 epoch: 17, train_loss: 0.9137, test_loss: 1.0015, test_f1: 0.5268
 epoch: 18, train_loss: 0.9150, test_loss: 1.0108, test_f1: 0.5063
 epoch: 19, train_loss: 0.9027, test_loss: 0.9935, test_f1: 0.5081
 epoch: 20, train_loss: 0.9079, test_loss: 0.9824, test_f1: 0.5275
 epoch: 21, train_loss: 0.8986, test_loss: 1.0317, test_f1: 0.4638
 epoch: 22, train_loss: 0.8874, test_loss: 1.0299, test_f1: 0.4444
 epoch: 23, train_loss: 0.9000, test_loss: 1.0331, test_f1: 0.4543
 epoch: 24, train_loss: 0.9009, test_loss: 1.0128, test_f1: 0.4951
 epoch: 25, train_loss: 0.8858, test_loss: 1.0038, test_f1: 0.4923
 epoch: 26, train_loss: 0.8789, test_loss: 0.9951, test_f1: 0.5311
 epoch: 27, train_loss: 0.8707, test_loss: 0.9733, test_f1: 0.5216
 epoch: 28, train_loss: 0.8722, test_loss: 0.9621, test_f1: 0.5089
 epoch: 29, train_loss: 0.8671, test_loss: 1.0083, test_f1: 0.5278
 epoch: 30, train_loss: 0.8786, test_loss: 0.9688, test_f1: 0.5025
 epoch: 31, train_loss: 0.8543, test_loss: 0.9911, test_f1: 0.5484
 epoch: 32, train_loss: 0.8644, test_loss: 0.9848, test_f1: 0.5396
 epoch: 33, train_loss: 0.8616, test_loss: 0.9996, test_f1: 0.5143
 epoch: 34, train_loss: 0.8569, test_loss: 0.9644, test_f1: 0.5237
 epoch: 35, train_loss: 0.8642, test_loss: 0.9909, test_f1: 0.4927
 epoch: 36, train_loss: 0.8418, test_loss: 1.0196, test_f1: 0.4976
 epoch: 37, train_loss: 0.8434, test_loss: 1.0222, test_f1: 0.5099
 epoch: 38, train_loss: 0.8440, test_loss: 1.0391, test_f1: 0.5177
 epoch: 39, train_loss: 0.8229, test_loss: 1.0222, test_f1: 0.5192
 epoch: 40, train_loss: 0.8378, test_loss: 1.0441, test_f1: 0.4893
 epoch: 41, train_loss: 0.8424, test_loss: 0.9853, test_f1: 0.5229
 epoch: 42, train_loss: 0.8309, test_loss: 0.9943, test_f1: 0.5561
 epoch: 43, train_loss: 0.8505, test_loss: 0.9728, test_f1: 0.5597
 epoch: 44, train_loss: 0.8363, test_loss: 0.9944, test_f1: 0.5036
 epoch: 45, train_loss: 0.8227, test_loss: 0.9625, test_f1: 0.5406
 epoch: 46, train_loss: 0.8124, test_loss: 1.0172, test_f1: 0.5176
 epoch: 47, train_loss: 0.8015, test_loss: 0.9397, test_f1: 0.5314
 epoch: 48, train_loss: 0.8253, test_loss: 0.9682, test_f1: 0.5156
 epoch: 49, train_loss: 0.8128, test_loss: 1.0219, test_f1: 0.5119
 epoch: 50, train_loss: 0.7988, test_loss: 1.0206, test_f1: 0.5189
 epoch: 51, train_loss: 0.7990, test_loss: 0.9914, test_f1: 0.5339
 epoch: 52, train_loss: 0.7887, test_loss: 0.9689, test_f1: 0.5402
 epoch: 53, train_loss: 0.7915, test_loss: 0.9848, test_f1: 0.5274
 epoch: 54, train_loss: 0.7810, test_loss: 1.0084, test_f1: 0.5373
 epoch: 55, train_loss: 0.7875, test_loss: 0.9529, test_f1: 0.5429
 epoch: 56, train_loss: 0.7842, test_loss: 0.9746, test_f1: 0.5291
 epoch: 57, train_loss: 0.7905, test_loss: 0.9694, test_f1: 0.5302
 epoch: 58, train_loss: 0.7842, test_loss: 0.9689, test_f1: 0.5266
 epoch: 59, train_loss: 0.7846, test_loss: 1.0156, test_f1: 0.5163
 epoch: 60, train_loss: 0.7792, test_loss: 0.9997, test_f1: 0.5138
 epoch: 61, train_loss: 0.7799, test_loss: 0.9881, test_f1: 0.5322
 epoch: 62, train_loss: 0.7713, test_loss: 0.9958, test_f1: 0.5163
 epoch: 63, train_loss: 0.7732, test_loss: 0.9777, test_f1: 0.5216
 epoch: 64, train_loss: 0.7716, test_loss: 1.0078, test_f1: 0.5246
 epoch: 65, train_loss: 0.7740, test_loss: 0.9739, test_f1: 0.5138
 epoch: 66, train_loss: 0.7746, test_loss: 0.9686, test_f1: 0.5340
 epoch: 67, train_loss: 0.7640, test_loss: 1.0057, test_f1: 0.5123
 epoch: 68, train_loss: 0.7663, test_loss: 0.9679, test_f1: 0.5273
 epoch: 69, train_loss: 0.7721, test_loss: 0.9555, test_f1: 0.5243
 epoch: 70, train_loss: 0.7671, test_loss: 0.9584, test_f1: 0.5239
 epoch: 71, train_loss: 0.7648, test_loss: 0.9689, test_f1: 0.5145
 epoch: 72, train_loss: 0.7591, test_loss: 0.9750, test_f1: 0.5236
 epoch: 73, train_loss: 0.7611, test_loss: 1.0014, test_f1: 0.5116
 epoch: 74, train_loss: 0.7573, test_loss: 0.9833, test_f1: 0.5284
 epoch: 75, train_loss: 0.7686, test_loss: 0.9865, test_f1: 0.5134
 epoch: 76, train_loss: 0.7552, test_loss: 0.9894, test_f1: 0.5208
 epoch: 77, train_loss: 0.7554, test_loss: 1.0000, test_f1: 0.5242
 epoch: 78, train_loss: 0.7614, test_loss: 0.9924, test_f1: 0.5213
 epoch: 79, train_loss: 0.7513, test_loss: 1.0000, test_f1: 0.5084
 epoch: 80, train_loss: 0.7576, test_loss: 0.9692, test_f1: 0.5169
 epoch: 81, train_loss: 0.7543, test_loss: 0.9991, test_f1: 0.5282
 epoch: 82, train_loss: 0.7498, test_loss: 0.9707, test_f1: 0.5293
 epoch: 83, train_loss: 0.7542, test_loss: 0.9750, test_f1: 0.5151
 epoch: 84, train_loss: 0.7526, test_loss: 0.9899, test_f1: 0.4995
 epoch: 85, train_loss: 0.7592, test_loss: 0.9979, test_f1: 0.5060
 epoch: 86, train_loss: 0.7536, test_loss: 1.0597, test_f1: 0.5190
 epoch: 87, train_loss: 0.7518, test_loss: 0.9606, test_f1: 0.5370
 epoch: 88, train_loss: 0.7506, test_loss: 1.0036, test_f1: 0.5256
 epoch: 89, train_loss: 0.7505, test_loss: 0.9802, test_f1: 0.5173
 epoch: 90, train_loss: 0.7494, test_loss: 0.9817, test_f1: 0.5278
 epoch: 91, train_loss: 0.7421, test_loss: 1.0032, test_f1: 0.5201
 epoch: 92, train_loss: 0.7449, test_loss: 1.0151, test_f1: 0.5084
 epoch: 93, train_loss: 0.7482, test_loss: 1.0002, test_f1: 0.5281
 epoch: 94, train_loss: 0.7486, test_loss: 0.9708, test_f1: 0.5197
 epoch: 95, train_loss: 0.7379, test_loss: 0.9627, test_f1: 0.5328
 epoch: 96, train_loss: 0.7477, test_loss: 0.9889, test_f1: 0.5087
 epoch: 97, train_loss: 0.7368, test_loss: 0.9448, test_f1: 0.5411
 epoch: 98, train_loss: 0.7424, test_loss: 0.9811, test_f1: 0.5285
 epoch: 99, train_loss: 0.7452, test_loss: 1.0293, test_f1: 0.5247
##################ITERATION #2 ****************************************
 epoch: 0, train_loss: 1.2910, test_loss: 1.1849, test_f1: 0.2429
 epoch: 1, train_loss: 1.1812, test_loss: 1.1131, test_f1: 0.4217
 epoch: 2, train_loss: 1.1279, test_loss: 1.0687, test_f1: 0.4291
 epoch: 3, train_loss: 1.0923, test_loss: 1.0452, test_f1: 0.4190
 epoch: 4, train_loss: 1.0706, test_loss: 1.0669, test_f1: 0.4036
 epoch: 5, train_loss: 1.0514, test_loss: 1.0472, test_f1: 0.4574
 epoch: 6, train_loss: 1.0286, test_loss: 1.0323, test_f1: 0.4695
 epoch: 7, train_loss: 1.0069, test_loss: 1.0090, test_f1: 0.4281
 epoch: 8, train_loss: 1.0003, test_loss: 0.9859, test_f1: 0.4770
 epoch: 9, train_loss: 0.9711, test_loss: 0.9948, test_f1: 0.4860
 epoch: 10, train_loss: 0.9644, test_loss: 1.0109, test_f1: 0.4539
 epoch: 11, train_loss: 0.9488, test_loss: 0.9924, test_f1: 0.4599
 epoch: 12, train_loss: 0.9447, test_loss: 0.9683, test_f1: 0.4949
 epoch: 13, train_loss: 0.9611, test_loss: 0.9601, test_f1: 0.4988
 epoch: 14, train_loss: 0.9342, test_loss: 0.9641, test_f1: 0.5053
 epoch: 15, train_loss: 0.9173, test_loss: 0.9625, test_f1: 0.5053
 epoch: 16, train_loss: 0.9248, test_loss: 0.9426, test_f1: 0.5122
 epoch: 17, train_loss: 0.9169, test_loss: 0.9610, test_f1: 0.5088
 epoch: 18, train_loss: 0.9119, test_loss: 0.9557, test_f1: 0.4891
 epoch: 19, train_loss: 0.9036, test_loss: 0.9327, test_f1: 0.5191
 epoch: 20, train_loss: 0.8899, test_loss: 0.9258, test_f1: 0.5053
 epoch: 21, train_loss: 0.8941, test_loss: 0.9290, test_f1: 0.5141
 epoch: 22, train_loss: 0.8764, test_loss: 0.9275, test_f1: 0.5177
 epoch: 23, train_loss: 0.8927, test_loss: 0.9421, test_f1: 0.4807
 epoch: 24, train_loss: 0.8790, test_loss: 0.9266, test_f1: 0.4922
 epoch: 25, train_loss: 0.8833, test_loss: 0.9142, test_f1: 0.5123
 epoch: 26, train_loss: 0.8785, test_loss: 0.9470, test_f1: 0.4788
 epoch: 27, train_loss: 0.8766, test_loss: 0.9780, test_f1: 0.5063
 epoch: 28, train_loss: 0.8740, test_loss: 0.9009, test_f1: 0.5102
 epoch: 29, train_loss: 0.8646, test_loss: 0.9035, test_f1: 0.5285
 epoch: 30, train_loss: 0.8535, test_loss: 0.9664, test_f1: 0.4614
 epoch: 31, train_loss: 0.8642, test_loss: 0.9214, test_f1: 0.5088
 epoch: 32, train_loss: 0.8574, test_loss: 0.9024, test_f1: 0.5172
 epoch: 33, train_loss: 0.8543, test_loss: 0.9126, test_f1: 0.5174
 epoch: 34, train_loss: 0.8540, test_loss: 0.8827, test_f1: 0.5248
 epoch: 35, train_loss: 0.8325, test_loss: 0.8951, test_f1: 0.5243
 epoch: 36, train_loss: 0.8378, test_loss: 0.8817, test_f1: 0.5243
 epoch: 37, train_loss: 0.8338, test_loss: 0.8966, test_f1: 0.5119
 epoch: 38, train_loss: 0.8478, test_loss: 0.8838, test_f1: 0.5163
 epoch: 39, train_loss: 0.8305, test_loss: 0.9129, test_f1: 0.5255
 epoch: 40, train_loss: 0.8250, test_loss: 0.8961, test_f1: 0.5200
 epoch: 41, train_loss: 0.8285, test_loss: 0.9359, test_f1: 0.4827
 epoch: 42, train_loss: 0.8322, test_loss: 0.9056, test_f1: 0.5263
 epoch: 43, train_loss: 0.8272, test_loss: 0.9358, test_f1: 0.4887
 epoch: 44, train_loss: 0.8326, test_loss: 0.8895, test_f1: 0.5414
 epoch: 45, train_loss: 0.8091, test_loss: 0.9093, test_f1: 0.5343
 epoch: 46, train_loss: 0.8171, test_loss: 0.9362, test_f1: 0.4992
 epoch: 47, train_loss: 0.8153, test_loss: 0.9065, test_f1: 0.5308
 epoch: 48, train_loss: 0.8097, test_loss: 0.9282, test_f1: 0.4997
 epoch: 49, train_loss: 0.8054, test_loss: 0.9126, test_f1: 0.5119
 epoch: 50, train_loss: 0.8114, test_loss: 0.9083, test_f1: 0.5146
 epoch: 51, train_loss: 0.7848, test_loss: 0.8777, test_f1: 0.5301
 epoch: 52, train_loss: 0.7847, test_loss: 0.8817, test_f1: 0.5306
 epoch: 53, train_loss: 0.7766, test_loss: 0.8851, test_f1: 0.5217
 epoch: 54, train_loss: 0.7925, test_loss: 0.8729, test_f1: 0.5417
 epoch: 55, train_loss: 0.7820, test_loss: 0.8896, test_f1: 0.5228
 epoch: 56, train_loss: 0.7880, test_loss: 0.9094, test_f1: 0.5199
 epoch: 57, train_loss: 0.7748, test_loss: 0.8786, test_f1: 0.5249
 epoch: 58, train_loss: 0.7735, test_loss: 0.8720, test_f1: 0.5355
 epoch: 59, train_loss: 0.7855, test_loss: 0.8826, test_f1: 0.5253
 epoch: 60, train_loss: 0.7780, test_loss: 0.8969, test_f1: 0.5095
 epoch: 61, train_loss: 0.7771, test_loss: 0.8786, test_f1: 0.5344
 epoch: 62, train_loss: 0.7655, test_loss: 0.8830, test_f1: 0.5371
 epoch: 63, train_loss: 0.7657, test_loss: 0.8620, test_f1: 0.5368
 epoch: 64, train_loss: 0.7645, test_loss: 0.8784, test_f1: 0.5397
 epoch: 65, train_loss: 0.7750, test_loss: 0.8821, test_f1: 0.5243
 epoch: 66, train_loss: 0.7627, test_loss: 0.9076, test_f1: 0.5296
 epoch: 67, train_loss: 0.7692, test_loss: 0.9033, test_f1: 0.5310
 epoch: 68, train_loss: 0.7541, test_loss: 0.8639, test_f1: 0.5313
 epoch: 69, train_loss: 0.7604, test_loss: 0.9240, test_f1: 0.5208
 epoch: 70, train_loss: 0.7724, test_loss: 0.8971, test_f1: 0.5265
 epoch: 71, train_loss: 0.7660, test_loss: 0.8936, test_f1: 0.5351
 epoch: 72, train_loss: 0.7573, test_loss: 0.8863, test_f1: 0.5326
 epoch: 73, train_loss: 0.7638, test_loss: 0.9056, test_f1: 0.5214
 epoch: 74, train_loss: 0.7659, test_loss: 0.8772, test_f1: 0.5366
 epoch: 75, train_loss: 0.7536, test_loss: 0.9131, test_f1: 0.5296
 epoch: 76, train_loss: 0.7527, test_loss: 0.8776, test_f1: 0.5406
 epoch: 77, train_loss: 0.7642, test_loss: 0.8838, test_f1: 0.5518
 epoch: 78, train_loss: 0.7502, test_loss: 0.8869, test_f1: 0.5244
 epoch: 79, train_loss: 0.7492, test_loss: 0.8805, test_f1: 0.5397
 epoch: 80, train_loss: 0.7539, test_loss: 0.8888, test_f1: 0.5262
 epoch: 81, train_loss: 0.7575, test_loss: 0.8929, test_f1: 0.5320
 epoch: 82, train_loss: 0.7649, test_loss: 0.8904, test_f1: 0.5418
 epoch: 83, train_loss: 0.7415, test_loss: 0.9022, test_f1: 0.5191
 epoch: 84, train_loss: 0.7509, test_loss: 0.9131, test_f1: 0.5215
 epoch: 85, train_loss: 0.7409, test_loss: 0.8827, test_f1: 0.5228
 epoch: 86, train_loss: 0.7484, test_loss: 0.9142, test_f1: 0.5156
 epoch: 87, train_loss: 0.7497, test_loss: 0.8613, test_f1: 0.5470
 epoch: 88, train_loss: 0.7472, test_loss: 0.9220, test_f1: 0.5196
 epoch: 89, train_loss: 0.7460, test_loss: 0.8937, test_f1: 0.5315
 epoch: 90, train_loss: 0.7468, test_loss: 0.8816, test_f1: 0.5500
 epoch: 91, train_loss: 0.7428, test_loss: 0.9011, test_f1: 0.5321
 epoch: 92, train_loss: 0.7459, test_loss: 0.9087, test_f1: 0.5241
 epoch: 93, train_loss: 0.7522, test_loss: 0.8711, test_f1: 0.5474
 epoch: 94, train_loss: 0.7356, test_loss: 0.8697, test_f1: 0.5631
 epoch: 95, train_loss: 0.7569, test_loss: 0.8651, test_f1: 0.5374
 epoch: 96, train_loss: 0.7295, test_loss: 0.9109, test_f1: 0.5332
 epoch: 97, train_loss: 0.7259, test_loss: 0.9054, test_f1: 0.5446
 epoch: 98, train_loss: 0.7264, test_loss: 0.8897, test_f1: 0.5465
 epoch: 99, train_loss: 0.7361, test_loss: 0.9059, test_f1: 0.5561
##################ITERATION #3 ****************************************
 epoch: 0, train_loss: 1.2728, test_loss: 1.1997, test_f1: 0.3331
 epoch: 1, train_loss: 1.1493, test_loss: 1.0720, test_f1: 0.4357
 epoch: 2, train_loss: 1.1083, test_loss: 1.0457, test_f1: 0.4313
 epoch: 3, train_loss: 1.0544, test_loss: 1.0069, test_f1: 0.4706
 epoch: 4, train_loss: 1.0273, test_loss: 0.9646, test_f1: 0.4598
 epoch: 5, train_loss: 1.0098, test_loss: 0.9443, test_f1: 0.4769
 epoch: 6, train_loss: 0.9851, test_loss: 0.9316, test_f1: 0.4994
 epoch: 7, train_loss: 0.9690, test_loss: 0.9490, test_f1: 0.4951
 epoch: 8, train_loss: 0.9501, test_loss: 1.0065, test_f1: 0.5006
 epoch: 9, train_loss: 0.9374, test_loss: 0.9053, test_f1: 0.4979
 epoch: 10, train_loss: 0.9338, test_loss: 0.8796, test_f1: 0.5020
 epoch: 11, train_loss: 0.9227, test_loss: 0.9433, test_f1: 0.5000
 epoch: 12, train_loss: 0.9083, test_loss: 0.8862, test_f1: 0.4828
 epoch: 13, train_loss: 0.9032, test_loss: 0.8537, test_f1: 0.5031
 epoch: 14, train_loss: 0.8903, test_loss: 0.8678, test_f1: 0.5270
 epoch: 15, train_loss: 0.8810, test_loss: 0.8360, test_f1: 0.5239
 epoch: 16, train_loss: 0.8704, test_loss: 0.8397, test_f1: 0.5264
 epoch: 17, train_loss: 0.8706, test_loss: 0.9120, test_f1: 0.5467
 epoch: 18, train_loss: 0.8829, test_loss: 0.8346, test_f1: 0.5225
 epoch: 19, train_loss: 0.8592, test_loss: 0.8392, test_f1: 0.5161
 epoch: 20, train_loss: 0.8619, test_loss: 1.0158, test_f1: 0.4683
 epoch: 21, train_loss: 0.8592, test_loss: 0.8599, test_f1: 0.5531
 epoch: 22, train_loss: 0.8415, test_loss: 0.8640, test_f1: 0.5322
 epoch: 23, train_loss: 0.8452, test_loss: 0.9074, test_f1: 0.5219
 epoch: 24, train_loss: 0.8373, test_loss: 0.8874, test_f1: 0.4919
 epoch: 25, train_loss: 0.8383, test_loss: 0.9148, test_f1: 0.5300
 epoch: 26, train_loss: 0.8313, test_loss: 0.9234, test_f1: 0.5124
 epoch: 27, train_loss: 0.8230, test_loss: 0.8346, test_f1: 0.5307
 epoch: 28, train_loss: 0.8181, test_loss: 0.8431, test_f1: 0.5209
 epoch: 29, train_loss: 0.8216, test_loss: 0.8576, test_f1: 0.5276
 epoch: 30, train_loss: 0.8121, test_loss: 0.8533, test_f1: 0.5297
 epoch: 31, train_loss: 0.7979, test_loss: 0.9154, test_f1: 0.5183
 epoch: 32, train_loss: 0.7965, test_loss: 0.9688, test_f1: 0.5159
 epoch: 33, train_loss: 0.8167, test_loss: 0.8826, test_f1: 0.5094
 epoch: 34, train_loss: 0.8015, test_loss: 0.9053, test_f1: 0.5299
 epoch: 35, train_loss: 0.7971, test_loss: 0.8993, test_f1: 0.5337
 epoch: 36, train_loss: 0.7927, test_loss: 0.8957, test_f1: 0.5305
 epoch: 37, train_loss: 0.8121, test_loss: 0.8030, test_f1: 0.5461
 epoch: 38, train_loss: 0.8026, test_loss: 0.7811, test_f1: 0.5602
 epoch: 39, train_loss: 0.7900, test_loss: 0.8337, test_f1: 0.5144
 epoch: 40, train_loss: 0.7926, test_loss: 0.8692, test_f1: 0.5381
 epoch: 41, train_loss: 0.7892, test_loss: 0.8958, test_f1: 0.5391
 epoch: 42, train_loss: 0.7985, test_loss: 0.9840, test_f1: 0.5102
 epoch: 43, train_loss: 0.7781, test_loss: 0.8827, test_f1: 0.5210
 epoch: 44, train_loss: 0.7678, test_loss: 0.9128, test_f1: 0.5178
 epoch: 45, train_loss: 0.7757, test_loss: 0.9178, test_f1: 0.5152
 epoch: 46, train_loss: 0.7921, test_loss: 0.8399, test_f1: 0.5143
 epoch: 47, train_loss: 0.7700, test_loss: 0.8693, test_f1: 0.5404
 epoch: 48, train_loss: 0.7745, test_loss: 0.8694, test_f1: 0.5212
 epoch: 49, train_loss: 0.7778, test_loss: 0.8525, test_f1: 0.5280
 epoch: 50, train_loss: 0.7852, test_loss: 0.9456, test_f1: 0.5059
 epoch: 51, train_loss: 0.7637, test_loss: 0.9195, test_f1: 0.5416
 epoch: 52, train_loss: 0.7646, test_loss: 0.9206, test_f1: 0.5222
 epoch: 53, train_loss: 0.7541, test_loss: 0.9224, test_f1: 0.5211
 epoch: 54, train_loss: 0.7401, test_loss: 0.8847, test_f1: 0.5281
 epoch: 55, train_loss: 0.7398, test_loss: 0.9051, test_f1: 0.5380
 epoch: 56, train_loss: 0.7577, test_loss: 0.8101, test_f1: 0.5356
 epoch: 57, train_loss: 0.7521, test_loss: 0.8665, test_f1: 0.5107
 epoch: 58, train_loss: 0.7347, test_loss: 0.8682, test_f1: 0.5296
 epoch: 59, train_loss: 0.7397, test_loss: 0.8680, test_f1: 0.5349
 epoch: 60, train_loss: 0.7519, test_loss: 0.8656, test_f1: 0.5301
 epoch: 61, train_loss: 0.7468, test_loss: 0.7966, test_f1: 0.5372
 epoch: 62, train_loss: 0.7319, test_loss: 0.8401, test_f1: 0.5409
 epoch: 63, train_loss: 0.7378, test_loss: 0.8765, test_f1: 0.5308
 epoch: 64, train_loss: 0.7534, test_loss: 0.8577, test_f1: 0.5414
 epoch: 65, train_loss: 0.7429, test_loss: 0.8498, test_f1: 0.5339
 epoch: 66, train_loss: 0.7437, test_loss: 0.7895, test_f1: 0.5518
 epoch: 67, train_loss: 0.7465, test_loss: 0.8023, test_f1: 0.5386
 epoch: 68, train_loss: 0.7356, test_loss: 0.8417, test_f1: 0.5448
 epoch: 69, train_loss: 0.7305, test_loss: 0.8863, test_f1: 0.5261
 epoch: 70, train_loss: 0.7274, test_loss: 0.8118, test_f1: 0.5405
 epoch: 71, train_loss: 0.7332, test_loss: 0.8742, test_f1: 0.5354
 epoch: 72, train_loss: 0.7292, test_loss: 0.8426, test_f1: 0.5342
 epoch: 73, train_loss: 0.7288, test_loss: 0.7775, test_f1: 0.5455
 epoch: 74, train_loss: 0.7442, test_loss: 0.7965, test_f1: 0.5627
 epoch: 75, train_loss: 0.7259, test_loss: 0.8212, test_f1: 0.5515
 epoch: 76, train_loss: 0.7305, test_loss: 0.8166, test_f1: 0.5430
 epoch: 77, train_loss: 0.7238, test_loss: 0.8770, test_f1: 0.5341
 epoch: 78, train_loss: 0.7198, test_loss: 0.8703, test_f1: 0.5455
 epoch: 79, train_loss: 0.7284, test_loss: 0.7690, test_f1: 0.5545
 epoch: 80, train_loss: 0.7231, test_loss: 0.9190, test_f1: 0.5283
 epoch: 81, train_loss: 0.7351, test_loss: 0.8891, test_f1: 0.5342
 epoch: 82, train_loss: 0.7342, test_loss: 0.8241, test_f1: 0.5357
 epoch: 83, train_loss: 0.7199, test_loss: 0.8143, test_f1: 0.5586
 epoch: 84, train_loss: 0.7334, test_loss: 0.8365, test_f1: 0.5388
 epoch: 85, train_loss: 0.7147, test_loss: 0.8491, test_f1: 0.5295
 epoch: 86, train_loss: 0.7228, test_loss: 0.8724, test_f1: 0.5365
 epoch: 87, train_loss: 0.7218, test_loss: 0.8352, test_f1: 0.5371
 epoch: 88, train_loss: 0.7058, test_loss: 0.8082, test_f1: 0.5498
 epoch: 89, train_loss: 0.7229, test_loss: 0.8328, test_f1: 0.5489
 epoch: 90, train_loss: 0.7133, test_loss: 0.8682, test_f1: 0.5389
 epoch: 91, train_loss: 0.7054, test_loss: 0.8672, test_f1: 0.5509
 epoch: 92, train_loss: 0.7226, test_loss: 0.9017, test_f1: 0.5196
 epoch: 93, train_loss: 0.7166, test_loss: 0.8583, test_f1: 0.5461
 epoch: 94, train_loss: 0.7227, test_loss: 0.7930, test_f1: 0.5580
 epoch: 95, train_loss: 0.7205, test_loss: 0.8676, test_f1: 0.5526
 epoch: 96, train_loss: 0.7063, test_loss: 0.8692, test_f1: 0.5265
 epoch: 97, train_loss: 0.6980, test_loss: 0.8231, test_f1: 0.5480
 epoch: 98, train_loss: 0.7013, test_loss: 0.8349, test_f1: 0.5609
 epoch: 99, train_loss: 0.7020, test_loss: 0.8309, test_f1: 0.5448
##################ITERATION #4 ****************************************
 epoch: 0, train_loss: 1.3079, test_loss: 1.0978, test_f1: 0.3510
 epoch: 1, train_loss: 1.1019, test_loss: 1.0428, test_f1: 0.3664
 epoch: 2, train_loss: 1.0675, test_loss: 1.0274, test_f1: 0.4101
 epoch: 3, train_loss: 1.0622, test_loss: 1.0290, test_f1: 0.4204
 epoch: 4, train_loss: 1.0398, test_loss: 1.0480, test_f1: 0.4289
 epoch: 5, train_loss: 1.0314, test_loss: 1.0308, test_f1: 0.4179
 epoch: 6, train_loss: 1.0121, test_loss: 1.0739, test_f1: 0.3877
 epoch: 7, train_loss: 1.0020, test_loss: 1.0048, test_f1: 0.4576
 epoch: 8, train_loss: 1.0074, test_loss: 1.0304, test_f1: 0.4984
 epoch: 9, train_loss: 0.9830, test_loss: 1.0636, test_f1: 0.4674
 epoch: 10, train_loss: 0.9773, test_loss: 1.0091, test_f1: 0.5097
 epoch: 11, train_loss: 0.9646, test_loss: 1.0599, test_f1: 0.4624
 epoch: 12, train_loss: 0.9609, test_loss: 1.0332, test_f1: 0.4954
 epoch: 13, train_loss: 0.9633, test_loss: 1.0212, test_f1: 0.4830
 epoch: 14, train_loss: 0.9386, test_loss: 0.9929, test_f1: 0.5384
 epoch: 15, train_loss: 0.9348, test_loss: 1.0202, test_f1: 0.5061
 epoch: 16, train_loss: 0.9395, test_loss: 0.9789, test_f1: 0.5168
 epoch: 17, train_loss: 0.9313, test_loss: 0.9967, test_f1: 0.5065
 epoch: 18, train_loss: 0.9136, test_loss: 0.9870, test_f1: 0.5347
 epoch: 19, train_loss: 0.9091, test_loss: 1.0092, test_f1: 0.5083
 epoch: 20, train_loss: 0.9073, test_loss: 0.9872, test_f1: 0.5114
 epoch: 21, train_loss: 0.8941, test_loss: 0.9656, test_f1: 0.5314
 epoch: 22, train_loss: 0.8964, test_loss: 1.0018, test_f1: 0.4883
 epoch: 23, train_loss: 0.8791, test_loss: 0.9793, test_f1: 0.5235
 epoch: 24, train_loss: 0.8908, test_loss: 0.9694, test_f1: 0.5354
 epoch: 25, train_loss: 0.8840, test_loss: 0.9792, test_f1: 0.5150
 epoch: 26, train_loss: 0.8877, test_loss: 0.9692, test_f1: 0.5216
 epoch: 27, train_loss: 0.8789, test_loss: 1.0104, test_f1: 0.5234
 epoch: 28, train_loss: 0.8810, test_loss: 0.9572, test_f1: 0.5253
 epoch: 29, train_loss: 0.8635, test_loss: 0.9511, test_f1: 0.5499
 epoch: 30, train_loss: 0.8553, test_loss: 0.9730, test_f1: 0.5262
 epoch: 31, train_loss: 0.8617, test_loss: 1.0340, test_f1: 0.4899
 epoch: 32, train_loss: 0.8594, test_loss: 0.9878, test_f1: 0.5385
 epoch: 33, train_loss: 0.8548, test_loss: 0.9707, test_f1: 0.5381
 epoch: 34, train_loss: 0.8562, test_loss: 0.9387, test_f1: 0.5302
 epoch: 35, train_loss: 0.8564, test_loss: 0.9463, test_f1: 0.5245
 epoch: 36, train_loss: 0.8485, test_loss: 0.9237, test_f1: 0.5466
 epoch: 37, train_loss: 0.8327, test_loss: 0.9308, test_f1: 0.5420
 epoch: 38, train_loss: 0.8457, test_loss: 1.0415, test_f1: 0.5084
 epoch: 39, train_loss: 0.8350, test_loss: 0.9346, test_f1: 0.5621
 epoch: 40, train_loss: 0.8452, test_loss: 0.9884, test_f1: 0.5197
 epoch: 41, train_loss: 0.8303, test_loss: 0.9466, test_f1: 0.5379
 epoch: 42, train_loss: 0.8275, test_loss: 0.9978, test_f1: 0.5161
 epoch: 43, train_loss: 0.8321, test_loss: 0.9574, test_f1: 0.5398
 epoch: 44, train_loss: 0.8362, test_loss: 0.9152, test_f1: 0.5565
 epoch: 45, train_loss: 0.8154, test_loss: 0.9309, test_f1: 0.5382
 epoch: 46, train_loss: 0.8241, test_loss: 0.9537, test_f1: 0.5540
 epoch: 47, train_loss: 0.8256, test_loss: 0.9345, test_f1: 0.5606
 epoch: 48, train_loss: 0.8104, test_loss: 0.9716, test_f1: 0.5304
 epoch: 49, train_loss: 0.8130, test_loss: 0.9503, test_f1: 0.5312
 epoch: 50, train_loss: 0.8069, test_loss: 0.9473, test_f1: 0.5496
 epoch: 51, train_loss: 0.7986, test_loss: 0.9255, test_f1: 0.5534
 epoch: 52, train_loss: 0.7829, test_loss: 0.9324, test_f1: 0.5463
 epoch: 53, train_loss: 0.7915, test_loss: 0.9184, test_f1: 0.5467
 epoch: 54, train_loss: 0.7903, test_loss: 0.9315, test_f1: 0.5626
 epoch: 55, train_loss: 0.7895, test_loss: 0.9031, test_f1: 0.5542
 epoch: 56, train_loss: 0.7873, test_loss: 0.9214, test_f1: 0.5602
 epoch: 57, train_loss: 0.7913, test_loss: 0.9258, test_f1: 0.5487
 epoch: 58, train_loss: 0.7734, test_loss: 0.9334, test_f1: 0.5544
 epoch: 59, train_loss: 0.7846, test_loss: 0.9473, test_f1: 0.5414
 epoch: 60, train_loss: 0.7734, test_loss: 0.9639, test_f1: 0.5356
 epoch: 61, train_loss: 0.7745, test_loss: 0.9170, test_f1: 0.5512
 epoch: 62, train_loss: 0.7661, test_loss: 0.9201, test_f1: 0.5623
 epoch: 63, train_loss: 0.7776, test_loss: 0.9451, test_f1: 0.5473
 epoch: 64, train_loss: 0.7697, test_loss: 0.9539, test_f1: 0.5464
 epoch: 65, train_loss: 0.7718, test_loss: 0.9397, test_f1: 0.5583
 epoch: 66, train_loss: 0.7669, test_loss: 0.9266, test_f1: 0.5683
 epoch: 67, train_loss: 0.7672, test_loss: 0.9121, test_f1: 0.5659
 epoch: 68, train_loss: 0.7668, test_loss: 0.9566, test_f1: 0.5657
 epoch: 69, train_loss: 0.7670, test_loss: 0.9133, test_f1: 0.5688
 epoch: 70, train_loss: 0.7756, test_loss: 0.9593, test_f1: 0.5476
 epoch: 71, train_loss: 0.7689, test_loss: 0.9266, test_f1: 0.5717
 epoch: 72, train_loss: 0.7663, test_loss: 0.9317, test_f1: 0.5576
 epoch: 73, train_loss: 0.7555, test_loss: 0.9467, test_f1: 0.5453
 epoch: 74, train_loss: 0.7485, test_loss: 0.9543, test_f1: 0.5672
 epoch: 75, train_loss: 0.7547, test_loss: 0.9706, test_f1: 0.5559
 epoch: 76, train_loss: 0.7576, test_loss: 0.9378, test_f1: 0.5611
 epoch: 77, train_loss: 0.7601, test_loss: 0.9836, test_f1: 0.5227
 epoch: 78, train_loss: 0.7586, test_loss: 0.9771, test_f1: 0.5494
 epoch: 79, train_loss: 0.7432, test_loss: 0.9591, test_f1: 0.5586
 epoch: 80, train_loss: 0.7519, test_loss: 0.9544, test_f1: 0.5628
 epoch: 81, train_loss: 0.7411, test_loss: 0.9491, test_f1: 0.5625
 epoch: 82, train_loss: 0.7432, test_loss: 0.9413, test_f1: 0.5666
 epoch: 83, train_loss: 0.7467, test_loss: 0.9621, test_f1: 0.5534
 epoch: 84, train_loss: 0.7377, test_loss: 0.9481, test_f1: 0.5708
 epoch: 85, train_loss: 0.7450, test_loss: 0.9629, test_f1: 0.5468
 epoch: 86, train_loss: 0.7488, test_loss: 0.9863, test_f1: 0.5513
 epoch: 87, train_loss: 0.7370, test_loss: 0.9911, test_f1: 0.5437
 epoch: 88, train_loss: 0.7387, test_loss: 0.9656, test_f1: 0.5543
 epoch: 89, train_loss: 0.7343, test_loss: 0.9548, test_f1: 0.5605
 epoch: 90, train_loss: 0.7446, test_loss: 0.9799, test_f1: 0.5390
 epoch: 91, train_loss: 0.7455, test_loss: 0.9908, test_f1: 0.5429
 epoch: 92, train_loss: 0.7478, test_loss: 0.9755, test_f1: 0.5541
 epoch: 93, train_loss: 0.7411, test_loss: 0.9496, test_f1: 0.5432
 epoch: 94, train_loss: 0.7378, test_loss: 1.0403, test_f1: 0.5241
 epoch: 95, train_loss: 0.7401, test_loss: 0.9697, test_f1: 0.5571
 epoch: 96, train_loss: 0.7399, test_loss: 0.9861, test_f1: 0.5577
 epoch: 97, train_loss: 0.7449, test_loss: 0.9796, test_f1: 0.5528
 epoch: 98, train_loss: 0.7371, test_loss: 0.9755, test_f1: 0.5497
 epoch: 99, train_loss: 0.7301, test_loss: 0.9562, test_f1: 0.5570
##################ITERATION #5 ****************************************
 epoch: 0, train_loss: 1.2546, test_loss: 1.1221, test_f1: 0.3616
 epoch: 1, train_loss: 1.1284, test_loss: 1.0514, test_f1: 0.3975
 epoch: 2, train_loss: 1.0822, test_loss: 1.0378, test_f1: 0.4391
 epoch: 3, train_loss: 1.0471, test_loss: 1.0092, test_f1: 0.4787
 epoch: 4, train_loss: 1.0314, test_loss: 0.9959, test_f1: 0.4900
 epoch: 5, train_loss: 1.0169, test_loss: 1.0007, test_f1: 0.4628
 epoch: 6, train_loss: 0.9865, test_loss: 0.9831, test_f1: 0.4891
 epoch: 7, train_loss: 0.9844, test_loss: 0.9621, test_f1: 0.4917
 epoch: 8, train_loss: 0.9711, test_loss: 0.9800, test_f1: 0.4754
 epoch: 9, train_loss: 0.9618, test_loss: 0.9631, test_f1: 0.4694
 epoch: 10, train_loss: 0.9661, test_loss: 0.9471, test_f1: 0.5309
 epoch: 11, train_loss: 0.9504, test_loss: 0.9226, test_f1: 0.5018
 epoch: 12, train_loss: 0.9357, test_loss: 0.9417, test_f1: 0.4777
 epoch: 13, train_loss: 0.9288, test_loss: 0.9487, test_f1: 0.4942
 epoch: 14, train_loss: 0.9218, test_loss: 0.9160, test_f1: 0.5018
 epoch: 15, train_loss: 0.9324, test_loss: 0.9791, test_f1: 0.4918
 epoch: 16, train_loss: 0.9200, test_loss: 0.9367, test_f1: 0.4878
 epoch: 17, train_loss: 0.9157, test_loss: 0.9086, test_f1: 0.5105
 epoch: 18, train_loss: 0.8931, test_loss: 0.9239, test_f1: 0.5019
 epoch: 19, train_loss: 0.9028, test_loss: 0.9324, test_f1: 0.5113
 epoch: 20, train_loss: 0.8898, test_loss: 0.9390, test_f1: 0.5210
 epoch: 21, train_loss: 0.8873, test_loss: 0.9250, test_f1: 0.5038
 epoch: 22, train_loss: 0.8693, test_loss: 0.9640, test_f1: 0.4989
 epoch: 23, train_loss: 0.8747, test_loss: 0.9440, test_f1: 0.5118
 epoch: 24, train_loss: 0.8781, test_loss: 0.9914, test_f1: 0.4809
 epoch: 25, train_loss: 0.8796, test_loss: 0.9353, test_f1: 0.5101
 epoch: 26, train_loss: 0.8741, test_loss: 0.9163, test_f1: 0.5287
 epoch: 27, train_loss: 0.8633, test_loss: 0.9684, test_f1: 0.5021
 epoch: 28, train_loss: 0.8574, test_loss: 0.9533, test_f1: 0.5176
 epoch: 29, train_loss: 0.8439, test_loss: 0.9347, test_f1: 0.5081
 epoch: 30, train_loss: 0.8437, test_loss: 0.9294, test_f1: 0.5015
 epoch: 31, train_loss: 0.8419, test_loss: 0.9609, test_f1: 0.4994
 epoch: 32, train_loss: 0.8388, test_loss: 0.9628, test_f1: 0.5152
 epoch: 33, train_loss: 0.8327, test_loss: 0.9334, test_f1: 0.5190
 epoch: 34, train_loss: 0.8267, test_loss: 0.9056, test_f1: 0.5257
 epoch: 35, train_loss: 0.8352, test_loss: 0.9170, test_f1: 0.5408
 epoch: 36, train_loss: 0.8278, test_loss: 0.9315, test_f1: 0.5095
 epoch: 37, train_loss: 0.8427, test_loss: 0.9207, test_f1: 0.5166
 epoch: 38, train_loss: 0.8355, test_loss: 0.9431, test_f1: 0.4976
 epoch: 39, train_loss: 0.8168, test_loss: 0.9002, test_f1: 0.5313
 epoch: 40, train_loss: 0.8138, test_loss: 0.9265, test_f1: 0.5229
 epoch: 41, train_loss: 0.8197, test_loss: 0.9324, test_f1: 0.5160
 epoch: 42, train_loss: 0.8134, test_loss: 0.8752, test_f1: 0.5369
 epoch: 43, train_loss: 0.8092, test_loss: 0.8979, test_f1: 0.5348
 epoch: 44, train_loss: 0.8149, test_loss: 0.9171, test_f1: 0.5227
 epoch: 45, train_loss: 0.8117, test_loss: 0.8925, test_f1: 0.5308
 epoch: 46, train_loss: 0.8069, test_loss: 0.9386, test_f1: 0.4961
 epoch: 47, train_loss: 0.8005, test_loss: 0.9965, test_f1: 0.4801
 epoch: 48, train_loss: 0.7984, test_loss: 0.8959, test_f1: 0.5247
 epoch: 49, train_loss: 0.8044, test_loss: 0.8866, test_f1: 0.5083
 epoch: 50, train_loss: 0.7933, test_loss: 0.8274, test_f1: 0.5318
 epoch: 51, train_loss: 0.7851, test_loss: 0.9142, test_f1: 0.5128
 epoch: 52, train_loss: 0.7726, test_loss: 0.8931, test_f1: 0.5306
 epoch: 53, train_loss: 0.7790, test_loss: 0.9173, test_f1: 0.5128
 epoch: 54, train_loss: 0.7625, test_loss: 0.8770, test_f1: 0.5150
 epoch: 55, train_loss: 0.7770, test_loss: 0.8664, test_f1: 0.5367
 epoch: 56, train_loss: 0.7738, test_loss: 0.8698, test_f1: 0.5294
 epoch: 57, train_loss: 0.7630, test_loss: 0.8590, test_f1: 0.5155
 epoch: 58, train_loss: 0.7555, test_loss: 0.8541, test_f1: 0.5409
 epoch: 59, train_loss: 0.7631, test_loss: 0.8261, test_f1: 0.5242
 epoch: 60, train_loss: 0.7667, test_loss: 0.8744, test_f1: 0.5344
 epoch: 61, train_loss: 0.7669, test_loss: 0.8721, test_f1: 0.5428
 epoch: 62, train_loss: 0.7643, test_loss: 0.8854, test_f1: 0.5277
 epoch: 63, train_loss: 0.7527, test_loss: 0.8656, test_f1: 0.5353
 epoch: 64, train_loss: 0.7512, test_loss: 0.8711, test_f1: 0.5268
 epoch: 65, train_loss: 0.7506, test_loss: 0.8451, test_f1: 0.5282
 epoch: 66, train_loss: 0.7530, test_loss: 0.8839, test_f1: 0.5203
 epoch: 67, train_loss: 0.7565, test_loss: 0.8774, test_f1: 0.5463
 epoch: 68, train_loss: 0.7583, test_loss: 0.8123, test_f1: 0.5512
 epoch: 69, train_loss: 0.7525, test_loss: 0.8394, test_f1: 0.5346
 epoch: 70, train_loss: 0.7551, test_loss: 0.8489, test_f1: 0.5380
 epoch: 71, train_loss: 0.7606, test_loss: 0.8562, test_f1: 0.5304
 epoch: 72, train_loss: 0.7455, test_loss: 0.8786, test_f1: 0.5356
 epoch: 73, train_loss: 0.7498, test_loss: 0.8632, test_f1: 0.5452
 epoch: 74, train_loss: 0.7371, test_loss: 0.8580, test_f1: 0.5374
 epoch: 75, train_loss: 0.7368, test_loss: 0.8992, test_f1: 0.5374
 epoch: 76, train_loss: 0.7408, test_loss: 0.9150, test_f1: 0.5280
 epoch: 77, train_loss: 0.7433, test_loss: 0.8332, test_f1: 0.5422
 epoch: 78, train_loss: 0.7443, test_loss: 0.9180, test_f1: 0.5363
 epoch: 79, train_loss: 0.7419, test_loss: 0.9470, test_f1: 0.5143
 epoch: 80, train_loss: 0.7419, test_loss: 0.9093, test_f1: 0.5366
 epoch: 81, train_loss: 0.7419, test_loss: 0.8654, test_f1: 0.5322
 epoch: 82, train_loss: 0.7419, test_loss: 0.8928, test_f1: 0.5499
 epoch: 83, train_loss: 0.7454, test_loss: 0.9159, test_f1: 0.5329
 epoch: 84, train_loss: 0.7338, test_loss: 0.9122, test_f1: 0.5384
 epoch: 85, train_loss: 0.7336, test_loss: 0.9086, test_f1: 0.5450
 epoch: 86, train_loss: 0.7385, test_loss: 0.8292, test_f1: 0.5555
 epoch: 87, train_loss: 0.7398, test_loss: 0.8603, test_f1: 0.5394
 epoch: 88, train_loss: 0.7361, test_loss: 0.8604, test_f1: 0.5399
 epoch: 89, train_loss: 0.7302, test_loss: 0.9019, test_f1: 0.5487
 epoch: 90, train_loss: 0.7395, test_loss: 0.8461, test_f1: 0.5518
 epoch: 91, train_loss: 0.7207, test_loss: 0.8307, test_f1: 0.5456
 epoch: 92, train_loss: 0.7234, test_loss: 0.8384, test_f1: 0.5489
 epoch: 93, train_loss: 0.7258, test_loss: 0.8373, test_f1: 0.5441
 epoch: 94, train_loss: 0.7290, test_loss: 0.8732, test_f1: 0.5450
 epoch: 95, train_loss: 0.7134, test_loss: 0.9276, test_f1: 0.5347
 epoch: 96, train_loss: 0.7201, test_loss: 0.9158, test_f1: 0.5388
 epoch: 97, train_loss: 0.7124, test_loss: 0.8527, test_f1: 0.5464
 epoch: 98, train_loss: 0.7119, test_loss: 0.8450, test_f1: 0.5544
 epoch: 99, train_loss: 0.7235, test_loss: 0.8617, test_f1: 0.5544
##################ITERATION #6 ****************************************
 epoch: 0, train_loss: 1.3439, test_loss: 1.1498, test_f1: 0.3601
 epoch: 1, train_loss: 1.1304, test_loss: 1.0541, test_f1: 0.4019
 epoch: 2, train_loss: 1.0789, test_loss: 1.0564, test_f1: 0.4025
 epoch: 3, train_loss: 1.0639, test_loss: 1.0348, test_f1: 0.4387
 epoch: 4, train_loss: 1.0497, test_loss: 1.0269, test_f1: 0.4745
 epoch: 5, train_loss: 1.0360, test_loss: 1.0163, test_f1: 0.4526
 epoch: 6, train_loss: 1.0197, test_loss: 1.0063, test_f1: 0.4624
 epoch: 7, train_loss: 1.0117, test_loss: 0.9859, test_f1: 0.4620
 epoch: 8, train_loss: 1.0139, test_loss: 1.0133, test_f1: 0.4768
 epoch: 9, train_loss: 0.9958, test_loss: 1.0211, test_f1: 0.4771
 epoch: 10, train_loss: 0.9894, test_loss: 1.0063, test_f1: 0.4818
 epoch: 11, train_loss: 0.9774, test_loss: 1.0024, test_f1: 0.4918
 epoch: 12, train_loss: 0.9737, test_loss: 1.0117, test_f1: 0.4801
 epoch: 13, train_loss: 0.9729, test_loss: 0.9828, test_f1: 0.4858
 epoch: 14, train_loss: 0.9612, test_loss: 0.9955, test_f1: 0.4919
 epoch: 15, train_loss: 0.9512, test_loss: 1.0055, test_f1: 0.4765
 epoch: 16, train_loss: 0.9490, test_loss: 0.9706, test_f1: 0.5105
 epoch: 17, train_loss: 0.9493, test_loss: 0.9786, test_f1: 0.5084
 epoch: 18, train_loss: 0.9464, test_loss: 0.9764, test_f1: 0.4975
 epoch: 19, train_loss: 0.9325, test_loss: 0.9647, test_f1: 0.5186
 epoch: 20, train_loss: 0.9277, test_loss: 0.9573, test_f1: 0.5163
 epoch: 21, train_loss: 0.9242, test_loss: 0.9710, test_f1: 0.5158
 epoch: 22, train_loss: 0.9156, test_loss: 0.9487, test_f1: 0.5365
 epoch: 23, train_loss: 0.9092, test_loss: 0.9469, test_f1: 0.5434
 epoch: 24, train_loss: 0.9017, test_loss: 0.9407, test_f1: 0.5346
 epoch: 25, train_loss: 0.9152, test_loss: 0.9644, test_f1: 0.4959
 epoch: 26, train_loss: 0.8917, test_loss: 0.9138, test_f1: 0.5365
 epoch: 27, train_loss: 0.8920, test_loss: 0.9048, test_f1: 0.5363
 epoch: 28, train_loss: 0.8889, test_loss: 0.9192, test_f1: 0.5310
 epoch: 29, train_loss: 0.8805, test_loss: 0.9486, test_f1: 0.5044
 epoch: 30, train_loss: 0.8779, test_loss: 0.8875, test_f1: 0.5416
 epoch: 31, train_loss: 0.8805, test_loss: 0.9398, test_f1: 0.4943
 epoch: 32, train_loss: 0.8721, test_loss: 0.8950, test_f1: 0.5469
 epoch: 33, train_loss: 0.8697, test_loss: 0.9486, test_f1: 0.5097
 epoch: 34, train_loss: 0.8629, test_loss: 0.8984, test_f1: 0.5336
 epoch: 35, train_loss: 0.8662, test_loss: 0.8766, test_f1: 0.5526
 epoch: 36, train_loss: 0.8572, test_loss: 0.8546, test_f1: 0.5246
 epoch: 37, train_loss: 0.8660, test_loss: 0.9368, test_f1: 0.5244
 epoch: 38, train_loss: 0.8578, test_loss: 0.9178, test_f1: 0.5162
 epoch: 39, train_loss: 0.8527, test_loss: 0.9210, test_f1: 0.5157
 epoch: 40, train_loss: 0.8506, test_loss: 0.8980, test_f1: 0.5363
 epoch: 41, train_loss: 0.8573, test_loss: 0.8911, test_f1: 0.5450
 epoch: 42, train_loss: 0.8463, test_loss: 0.9208, test_f1: 0.5247
 epoch: 43, train_loss: 0.8485, test_loss: 0.8981, test_f1: 0.5419
 epoch: 44, train_loss: 0.8254, test_loss: 0.9291, test_f1: 0.5387
 epoch: 45, train_loss: 0.8276, test_loss: 0.9268, test_f1: 0.5324
 epoch: 46, train_loss: 0.8190, test_loss: 0.9466, test_f1: 0.5310
 epoch: 47, train_loss: 0.8258, test_loss: 0.9018, test_f1: 0.5431
 epoch: 48, train_loss: 0.8285, test_loss: 0.8899, test_f1: 0.5464
 epoch: 49, train_loss: 0.8192, test_loss: 0.9859, test_f1: 0.4981
 epoch: 50, train_loss: 0.8249, test_loss: 0.9271, test_f1: 0.5379
 epoch: 51, train_loss: 0.8031, test_loss: 0.8831, test_f1: 0.5451
 epoch: 52, train_loss: 0.8056, test_loss: 0.9182, test_f1: 0.5488
 epoch: 53, train_loss: 0.8014, test_loss: 0.9074, test_f1: 0.5486
 epoch: 54, train_loss: 0.8023, test_loss: 0.9056, test_f1: 0.5458
 epoch: 55, train_loss: 0.7940, test_loss: 0.8963, test_f1: 0.5358
 epoch: 56, train_loss: 0.7904, test_loss: 0.9749, test_f1: 0.5243
 epoch: 57, train_loss: 0.7934, test_loss: 0.8897, test_f1: 0.5478
 epoch: 58, train_loss: 0.7998, test_loss: 0.9006, test_f1: 0.5417
 epoch: 59, train_loss: 0.7826, test_loss: 0.9020, test_f1: 0.5301
 epoch: 60, train_loss: 0.7904, test_loss: 0.9194, test_f1: 0.5383
 epoch: 61, train_loss: 0.7834, test_loss: 0.8922, test_f1: 0.5596
 epoch: 62, train_loss: 0.7867, test_loss: 0.9103, test_f1: 0.5333
 epoch: 63, train_loss: 0.7779, test_loss: 0.8889, test_f1: 0.5627
 epoch: 64, train_loss: 0.7875, test_loss: 0.8985, test_f1: 0.5594
 epoch: 65, train_loss: 0.7873, test_loss: 0.9232, test_f1: 0.5509
 epoch: 66, train_loss: 0.7878, test_loss: 0.9085, test_f1: 0.5501
 epoch: 67, train_loss: 0.7944, test_loss: 0.9104, test_f1: 0.5566
 epoch: 68, train_loss: 0.7818, test_loss: 0.8833, test_f1: 0.5664
 epoch: 69, train_loss: 0.7758, test_loss: 0.9196, test_f1: 0.5486
 epoch: 70, train_loss: 0.7808, test_loss: 0.8949, test_f1: 0.5589
 epoch: 71, train_loss: 0.7698, test_loss: 0.8977, test_f1: 0.5499
 epoch: 72, train_loss: 0.7683, test_loss: 0.9201, test_f1: 0.5547
 epoch: 73, train_loss: 0.7628, test_loss: 0.9143, test_f1: 0.5389
 epoch: 74, train_loss: 0.7626, test_loss: 0.9216, test_f1: 0.5452
 epoch: 75, train_loss: 0.7705, test_loss: 0.9353, test_f1: 0.5280
 epoch: 76, train_loss: 0.7651, test_loss: 0.9013, test_f1: 0.5547
 epoch: 77, train_loss: 0.7678, test_loss: 0.9157, test_f1: 0.5511
 epoch: 78, train_loss: 0.7650, test_loss: 0.9437, test_f1: 0.5374
 epoch: 79, train_loss: 0.7680, test_loss: 0.8958, test_f1: 0.5575
 epoch: 80, train_loss: 0.7647, test_loss: 0.9268, test_f1: 0.5316
 epoch: 81, train_loss: 0.7643, test_loss: 0.9087, test_f1: 0.5454
 epoch: 82, train_loss: 0.7619, test_loss: 0.9090, test_f1: 0.5525
 epoch: 83, train_loss: 0.7610, test_loss: 0.9194, test_f1: 0.5467
 epoch: 84, train_loss: 0.7582, test_loss: 0.9083, test_f1: 0.5387
 epoch: 85, train_loss: 0.7540, test_loss: 0.8917, test_f1: 0.5662
 epoch: 86, train_loss: 0.7513, test_loss: 0.8874, test_f1: 0.5680
 epoch: 87, train_loss: 0.7606, test_loss: 0.8684, test_f1: 0.5576
 epoch: 88, train_loss: 0.7663, test_loss: 0.9509, test_f1: 0.5341
 epoch: 89, train_loss: 0.7489, test_loss: 0.9251, test_f1: 0.5545
 epoch: 90, train_loss: 0.7608, test_loss: 0.9116, test_f1: 0.5534
 epoch: 91, train_loss: 0.7495, test_loss: 0.8984, test_f1: 0.5386
 epoch: 92, train_loss: 0.7504, test_loss: 0.9131, test_f1: 0.5540
 epoch: 93, train_loss: 0.7474, test_loss: 0.9095, test_f1: 0.5533
 epoch: 94, train_loss: 0.7486, test_loss: 0.9046, test_f1: 0.5522
 epoch: 95, train_loss: 0.7583, test_loss: 0.9218, test_f1: 0.5504
 epoch: 96, train_loss: 0.7524, test_loss: 0.9359, test_f1: 0.5514
 epoch: 97, train_loss: 0.7387, test_loss: 0.8949, test_f1: 0.5529
 epoch: 98, train_loss: 0.7387, test_loss: 0.8853, test_f1: 0.5630
 epoch: 99, train_loss: 0.7408, test_loss: 0.8954, test_f1: 0.5432
##################ITERATION #7 ****************************************
 epoch: 0, train_loss: 1.2944, test_loss: 1.1910, test_f1: 0.4156
 epoch: 1, train_loss: 1.1576, test_loss: 1.0595, test_f1: 0.4219
 epoch: 2, train_loss: 1.1050, test_loss: 1.0420, test_f1: 0.4267
 epoch: 3, train_loss: 1.0890, test_loss: 1.0140, test_f1: 0.4511
 epoch: 4, train_loss: 1.0510, test_loss: 1.0154, test_f1: 0.4371
 epoch: 5, train_loss: 1.0284, test_loss: 0.9865, test_f1: 0.4950
 epoch: 6, train_loss: 1.0122, test_loss: 0.9800, test_f1: 0.4704
 epoch: 7, train_loss: 0.9989, test_loss: 0.9776, test_f1: 0.4688
 epoch: 8, train_loss: 0.9864, test_loss: 0.9644, test_f1: 0.4775
 epoch: 9, train_loss: 0.9730, test_loss: 0.9678, test_f1: 0.4686
 epoch: 10, train_loss: 0.9743, test_loss: 0.9642, test_f1: 0.4865
 epoch: 11, train_loss: 0.9637, test_loss: 0.9678, test_f1: 0.5064
 epoch: 12, train_loss: 0.9459, test_loss: 0.9633, test_f1: 0.5111
 epoch: 13, train_loss: 0.9376, test_loss: 0.9675, test_f1: 0.4898
 epoch: 14, train_loss: 0.9346, test_loss: 0.9150, test_f1: 0.5134
 epoch: 15, train_loss: 0.9385, test_loss: 0.9756, test_f1: 0.4778
 epoch: 16, train_loss: 0.9090, test_loss: 1.0078, test_f1: 0.4731
 epoch: 17, train_loss: 0.9166, test_loss: 0.9555, test_f1: 0.4824
 epoch: 18, train_loss: 0.9032, test_loss: 0.9252, test_f1: 0.5097
 epoch: 19, train_loss: 0.9099, test_loss: 0.9466, test_f1: 0.5156
 epoch: 20, train_loss: 0.9002, test_loss: 0.9245, test_f1: 0.5364
 epoch: 21, train_loss: 0.8909, test_loss: 0.9497, test_f1: 0.5326
 epoch: 22, train_loss: 0.8929, test_loss: 0.9173, test_f1: 0.5303
 epoch: 23, train_loss: 0.8707, test_loss: 0.8826, test_f1: 0.5387
 epoch: 24, train_loss: 0.8776, test_loss: 0.9249, test_f1: 0.5258
 epoch: 25, train_loss: 0.8746, test_loss: 0.9180, test_f1: 0.5023
 epoch: 26, train_loss: 0.8595, test_loss: 0.9359, test_f1: 0.5188
 epoch: 27, train_loss: 0.8615, test_loss: 0.9364, test_f1: 0.5326
 epoch: 28, train_loss: 0.8477, test_loss: 0.9534, test_f1: 0.4948
 epoch: 29, train_loss: 0.8457, test_loss: 0.8934, test_f1: 0.5420
 epoch: 30, train_loss: 0.8442, test_loss: 0.8974, test_f1: 0.5440
 epoch: 31, train_loss: 0.8410, test_loss: 0.9001, test_f1: 0.5346
 epoch: 32, train_loss: 0.8300, test_loss: 0.9105, test_f1: 0.5212
 epoch: 33, train_loss: 0.8347, test_loss: 0.9051, test_f1: 0.5122
 epoch: 34, train_loss: 0.8201, test_loss: 0.9008, test_f1: 0.5215
 epoch: 35, train_loss: 0.8277, test_loss: 0.9028, test_f1: 0.5380
 epoch: 36, train_loss: 0.8166, test_loss: 0.9071, test_f1: 0.5282
 epoch: 37, train_loss: 0.8099, test_loss: 0.9448, test_f1: 0.5329
 epoch: 38, train_loss: 0.8117, test_loss: 0.8827, test_f1: 0.5468
 epoch: 39, train_loss: 0.8132, test_loss: 0.8988, test_f1: 0.5411
 epoch: 40, train_loss: 0.8100, test_loss: 0.9148, test_f1: 0.5301
 epoch: 41, train_loss: 0.8007, test_loss: 0.9455, test_f1: 0.5240
 epoch: 42, train_loss: 0.8069, test_loss: 0.8752, test_f1: 0.5448
 epoch: 43, train_loss: 0.7962, test_loss: 0.8974, test_f1: 0.5403
 epoch: 44, train_loss: 0.8005, test_loss: 0.8840, test_f1: 0.5496
 epoch: 45, train_loss: 0.8037, test_loss: 0.9089, test_f1: 0.5365
 epoch: 46, train_loss: 0.7991, test_loss: 0.8769, test_f1: 0.5519
 epoch: 47, train_loss: 0.8013, test_loss: 0.9583, test_f1: 0.5193
 epoch: 48, train_loss: 0.7852, test_loss: 0.9025, test_f1: 0.5335
 epoch: 49, train_loss: 0.7912, test_loss: 0.8959, test_f1: 0.5520
 epoch: 50, train_loss: 0.7796, test_loss: 0.9787, test_f1: 0.5213
 epoch: 51, train_loss: 0.7686, test_loss: 0.8757, test_f1: 0.5441
 epoch: 52, train_loss: 0.7691, test_loss: 0.9285, test_f1: 0.5257
 epoch: 53, train_loss: 0.7620, test_loss: 0.8827, test_f1: 0.5391
 epoch: 54, train_loss: 0.7562, test_loss: 0.8936, test_f1: 0.5391
 epoch: 55, train_loss: 0.7671, test_loss: 0.8866, test_f1: 0.5446
 epoch: 56, train_loss: 0.7659, test_loss: 0.9307, test_f1: 0.5366
 epoch: 57, train_loss: 0.7516, test_loss: 0.9163, test_f1: 0.5307
 epoch: 58, train_loss: 0.7690, test_loss: 0.9278, test_f1: 0.5349
 epoch: 59, train_loss: 0.7532, test_loss: 0.9057, test_f1: 0.5389
 epoch: 60, train_loss: 0.7434, test_loss: 0.8908, test_f1: 0.5424
 epoch: 61, train_loss: 0.7587, test_loss: 0.8903, test_f1: 0.5433
 epoch: 62, train_loss: 0.7550, test_loss: 0.9347, test_f1: 0.5209
 epoch: 63, train_loss: 0.7502, test_loss: 0.8948, test_f1: 0.5413
 epoch: 64, train_loss: 0.7494, test_loss: 0.9151, test_f1: 0.5271
 epoch: 65, train_loss: 0.7376, test_loss: 0.9331, test_f1: 0.5276
 epoch: 66, train_loss: 0.7464, test_loss: 0.9172, test_f1: 0.5458
 epoch: 67, train_loss: 0.7472, test_loss: 0.9232, test_f1: 0.5165
 epoch: 68, train_loss: 0.7480, test_loss: 0.9081, test_f1: 0.5424
 epoch: 69, train_loss: 0.7501, test_loss: 0.9288, test_f1: 0.5404
 epoch: 70, train_loss: 0.7505, test_loss: 0.8997, test_f1: 0.5518
 epoch: 71, train_loss: 0.7435, test_loss: 0.9308, test_f1: 0.5437
 epoch: 72, train_loss: 0.7358, test_loss: 0.8918, test_f1: 0.5551
 epoch: 73, train_loss: 0.7351, test_loss: 0.8830, test_f1: 0.5627
 epoch: 74, train_loss: 0.7471, test_loss: 0.8926, test_f1: 0.5375
 epoch: 75, train_loss: 0.7362, test_loss: 0.8817, test_f1: 0.5444
 epoch: 76, train_loss: 0.7409, test_loss: 0.9031, test_f1: 0.5499
 epoch: 77, train_loss: 0.7315, test_loss: 0.8827, test_f1: 0.5639
 epoch: 78, train_loss: 0.7317, test_loss: 0.9275, test_f1: 0.5331
 epoch: 79, train_loss: 0.7406, test_loss: 0.8888, test_f1: 0.5469
 epoch: 80, train_loss: 0.7342, test_loss: 0.8971, test_f1: 0.5590
 epoch: 81, train_loss: 0.7305, test_loss: 0.9063, test_f1: 0.5351
 epoch: 82, train_loss: 0.7216, test_loss: 0.8860, test_f1: 0.5645
 epoch: 83, train_loss: 0.7394, test_loss: 0.9163, test_f1: 0.5468
 epoch: 84, train_loss: 0.7245, test_loss: 0.8825, test_f1: 0.5616
 epoch: 85, train_loss: 0.7340, test_loss: 0.8825, test_f1: 0.5543
 epoch: 86, train_loss: 0.7230, test_loss: 0.8989, test_f1: 0.5542
 epoch: 87, train_loss: 0.7229, test_loss: 0.9101, test_f1: 0.5429
 epoch: 88, train_loss: 0.7282, test_loss: 0.9195, test_f1: 0.5440
 epoch: 89, train_loss: 0.7250, test_loss: 0.8592, test_f1: 0.5572
 epoch: 90, train_loss: 0.7188, test_loss: 0.9018, test_f1: 0.5431
 epoch: 91, train_loss: 0.7142, test_loss: 0.8750, test_f1: 0.5558
 epoch: 92, train_loss: 0.7228, test_loss: 0.8945, test_f1: 0.5552
 epoch: 93, train_loss: 0.7224, test_loss: 0.8869, test_f1: 0.5652
 epoch: 94, train_loss: 0.7214, test_loss: 0.8849, test_f1: 0.5615
 epoch: 95, train_loss: 0.7240, test_loss: 0.8837, test_f1: 0.5595
 epoch: 96, train_loss: 0.7090, test_loss: 0.9005, test_f1: 0.5637
 epoch: 97, train_loss: 0.7227, test_loss: 0.8899, test_f1: 0.5558
 epoch: 98, train_loss: 0.7149, test_loss: 0.8822, test_f1: 0.5724
 epoch: 99, train_loss: 0.7176, test_loss: 0.8902, test_f1: 0.5589
##################ITERATION #8 ****************************************
 epoch: 0, train_loss: 1.3600, test_loss: 1.2048, test_f1: 0.3167
 epoch: 1, train_loss: 1.1920, test_loss: 1.1095, test_f1: 0.3956
 epoch: 2, train_loss: 1.1561, test_loss: 1.0671, test_f1: 0.3875
 epoch: 3, train_loss: 1.1160, test_loss: 1.0418, test_f1: 0.4411
 epoch: 4, train_loss: 1.0884, test_loss: 1.0354, test_f1: 0.4077
 epoch: 5, train_loss: 1.0666, test_loss: 1.0206, test_f1: 0.4661
 epoch: 6, train_loss: 1.0410, test_loss: 1.0090, test_f1: 0.4826
 epoch: 7, train_loss: 1.0339, test_loss: 1.0089, test_f1: 0.4518
 epoch: 8, train_loss: 1.0319, test_loss: 1.0032, test_f1: 0.4513
 epoch: 9, train_loss: 1.0065, test_loss: 0.9963, test_f1: 0.4331
 epoch: 10, train_loss: 1.0001, test_loss: 0.9518, test_f1: 0.4710
 epoch: 11, train_loss: 0.9978, test_loss: 0.9527, test_f1: 0.4500
 epoch: 12, train_loss: 0.9936, test_loss: 0.9552, test_f1: 0.4875
 epoch: 13, train_loss: 0.9753, test_loss: 0.9495, test_f1: 0.4628
 epoch: 14, train_loss: 0.9765, test_loss: 0.9522, test_f1: 0.4926
 epoch: 15, train_loss: 0.9689, test_loss: 0.9540, test_f1: 0.5058
 epoch: 16, train_loss: 0.9662, test_loss: 0.9548, test_f1: 0.5215
 epoch: 17, train_loss: 0.9477, test_loss: 0.8965, test_f1: 0.5418
 epoch: 18, train_loss: 0.9469, test_loss: 0.9713, test_f1: 0.4930
 epoch: 19, train_loss: 0.9328, test_loss: 0.9664, test_f1: 0.5125
 epoch: 20, train_loss: 0.9427, test_loss: 0.9122, test_f1: 0.5351
 epoch: 21, train_loss: 0.9294, test_loss: 0.9532, test_f1: 0.5153
 epoch: 22, train_loss: 0.9182, test_loss: 0.9562, test_f1: 0.5075
 epoch: 23, train_loss: 0.9237, test_loss: 0.9748, test_f1: 0.4852
 epoch: 24, train_loss: 0.9274, test_loss: 0.9521, test_f1: 0.5131
 epoch: 25, train_loss: 0.9031, test_loss: 0.9250, test_f1: 0.5126
 epoch: 26, train_loss: 0.9026, test_loss: 0.9386, test_f1: 0.5143
 epoch: 27, train_loss: 0.9027, test_loss: 0.9646, test_f1: 0.5148
 epoch: 28, train_loss: 0.8929, test_loss: 0.9550, test_f1: 0.5145
 epoch: 29, train_loss: 0.8971, test_loss: 0.9309, test_f1: 0.5325
 epoch: 30, train_loss: 0.8818, test_loss: 0.9242, test_f1: 0.5345
 epoch: 31, train_loss: 0.8828, test_loss: 0.9087, test_f1: 0.5400
 epoch: 32, train_loss: 0.8726, test_loss: 0.8887, test_f1: 0.5446
 epoch: 33, train_loss: 0.8627, test_loss: 0.9365, test_f1: 0.5395
 epoch: 34, train_loss: 0.8648, test_loss: 0.8928, test_f1: 0.5461
 epoch: 35, train_loss: 0.8707, test_loss: 0.9288, test_f1: 0.5415
 epoch: 36, train_loss: 0.8769, test_loss: 0.8953, test_f1: 0.5522
 epoch: 37, train_loss: 0.8684, test_loss: 1.0376, test_f1: 0.4928
 epoch: 38, train_loss: 0.8612, test_loss: 0.9274, test_f1: 0.5337
 epoch: 39, train_loss: 0.8480, test_loss: 0.9222, test_f1: 0.5400
 epoch: 40, train_loss: 0.8512, test_loss: 0.9100, test_f1: 0.5473
 epoch: 41, train_loss: 0.8556, test_loss: 0.9408, test_f1: 0.5237
 epoch: 42, train_loss: 0.8493, test_loss: 0.9038, test_f1: 0.5320
 epoch: 43, train_loss: 0.8454, test_loss: 0.8985, test_f1: 0.5513
 epoch: 44, train_loss: 0.8356, test_loss: 0.8994, test_f1: 0.5405
 epoch: 45, train_loss: 0.8302, test_loss: 0.8982, test_f1: 0.5492
 epoch: 46, train_loss: 0.8296, test_loss: 0.9067, test_f1: 0.5539
 epoch: 47, train_loss: 0.8452, test_loss: 0.9661, test_f1: 0.5174
 epoch: 48, train_loss: 0.8225, test_loss: 0.8677, test_f1: 0.5600
 epoch: 49, train_loss: 0.8214, test_loss: 0.8872, test_f1: 0.5461
 epoch: 50, train_loss: 0.8290, test_loss: 0.9000, test_f1: 0.5282
 epoch: 51, train_loss: 0.8229, test_loss: 0.9069, test_f1: 0.5387
 epoch: 52, train_loss: 0.8082, test_loss: 0.8945, test_f1: 0.5441
 epoch: 53, train_loss: 0.8102, test_loss: 0.8904, test_f1: 0.5465
 epoch: 54, train_loss: 0.7929, test_loss: 0.9007, test_f1: 0.5440
 epoch: 55, train_loss: 0.8027, test_loss: 0.8957, test_f1: 0.5544
 epoch: 56, train_loss: 0.7954, test_loss: 0.8849, test_f1: 0.5469
 epoch: 57, train_loss: 0.8172, test_loss: 0.8605, test_f1: 0.5641
 epoch: 58, train_loss: 0.7982, test_loss: 0.8648, test_f1: 0.5618
 epoch: 59, train_loss: 0.7815, test_loss: 0.9051, test_f1: 0.5409
 epoch: 60, train_loss: 0.7912, test_loss: 0.8827, test_f1: 0.5640
 epoch: 61, train_loss: 0.7756, test_loss: 0.8761, test_f1: 0.5513
 epoch: 62, train_loss: 0.7907, test_loss: 0.9083, test_f1: 0.5575
 epoch: 63, train_loss: 0.7946, test_loss: 0.8812, test_f1: 0.5540
 epoch: 64, train_loss: 0.7844, test_loss: 0.8855, test_f1: 0.5597
 epoch: 65, train_loss: 0.7890, test_loss: 0.8676, test_f1: 0.5654
 epoch: 66, train_loss: 0.7843, test_loss: 0.8660, test_f1: 0.5617
 epoch: 67, train_loss: 0.7885, test_loss: 0.8752, test_f1: 0.5515
 epoch: 68, train_loss: 0.7860, test_loss: 0.9567, test_f1: 0.5282
 epoch: 69, train_loss: 0.7797, test_loss: 0.8740, test_f1: 0.5426
 epoch: 70, train_loss: 0.7799, test_loss: 0.8877, test_f1: 0.5553
 epoch: 71, train_loss: 0.7796, test_loss: 0.8620, test_f1: 0.5738
 epoch: 72, train_loss: 0.7694, test_loss: 0.8975, test_f1: 0.5515
 epoch: 73, train_loss: 0.7709, test_loss: 0.8813, test_f1: 0.5456
 epoch: 74, train_loss: 0.7672, test_loss: 0.8829, test_f1: 0.5605
 epoch: 75, train_loss: 0.7670, test_loss: 0.8858, test_f1: 0.5699
 epoch: 76, train_loss: 0.7635, test_loss: 0.8894, test_f1: 0.5555
 epoch: 77, train_loss: 0.7574, test_loss: 0.8856, test_f1: 0.5608
 epoch: 78, train_loss: 0.7650, test_loss: 0.8872, test_f1: 0.5704
 epoch: 79, train_loss: 0.7698, test_loss: 0.9234, test_f1: 0.5424
 epoch: 80, train_loss: 0.7652, test_loss: 0.8623, test_f1: 0.5784
 epoch: 81, train_loss: 0.7622, test_loss: 0.9010, test_f1: 0.5561
 epoch: 82, train_loss: 0.7633, test_loss: 0.8729, test_f1: 0.5621
 epoch: 83, train_loss: 0.7593, test_loss: 0.9077, test_f1: 0.5473
 epoch: 84, train_loss: 0.7612, test_loss: 0.8682, test_f1: 0.5682
 epoch: 85, train_loss: 0.7594, test_loss: 0.9179, test_f1: 0.5426
 epoch: 86, train_loss: 0.7439, test_loss: 0.9052, test_f1: 0.5370
 epoch: 87, train_loss: 0.7541, test_loss: 0.8818, test_f1: 0.5552
 epoch: 88, train_loss: 0.7610, test_loss: 0.9043, test_f1: 0.5597
 epoch: 89, train_loss: 0.7539, test_loss: 0.9379, test_f1: 0.5387
 epoch: 90, train_loss: 0.7467, test_loss: 0.9361, test_f1: 0.5131
 epoch: 91, train_loss: 0.7517, test_loss: 0.8904, test_f1: 0.5585
 epoch: 92, train_loss: 0.7453, test_loss: 0.8763, test_f1: 0.5698
 epoch: 93, train_loss: 0.7447, test_loss: 0.8794, test_f1: 0.5569
 epoch: 94, train_loss: 0.7559, test_loss: 0.8988, test_f1: 0.5656
 epoch: 95, train_loss: 0.7466, test_loss: 0.8810, test_f1: 0.5571
 epoch: 96, train_loss: 0.7418, test_loss: 0.9479, test_f1: 0.5460
 epoch: 97, train_loss: 0.7405, test_loss: 0.8794, test_f1: 0.5622
 epoch: 98, train_loss: 0.7467, test_loss: 0.9444, test_f1: 0.5314
 epoch: 99, train_loss: 0.7469, test_loss: 0.9146, test_f1: 0.5185
##################ITERATION #9 ****************************************
 epoch: 0, train_loss: 1.3360, test_loss: 1.1941, test_f1: 0.3187
 epoch: 1, train_loss: 1.1738, test_loss: 1.0723, test_f1: 0.4802
 epoch: 2, train_loss: 1.1236, test_loss: 1.0391, test_f1: 0.4772
 epoch: 3, train_loss: 1.0891, test_loss: 1.0306, test_f1: 0.4493
 epoch: 4, train_loss: 1.0555, test_loss: 1.0204, test_f1: 0.4560
 epoch: 5, train_loss: 1.0370, test_loss: 0.9988, test_f1: 0.4631
 epoch: 6, train_loss: 1.0187, test_loss: 0.9990, test_f1: 0.4720
 epoch: 7, train_loss: 1.0055, test_loss: 1.0040, test_f1: 0.4629
 epoch: 8, train_loss: 0.9916, test_loss: 0.9822, test_f1: 0.5049
 epoch: 9, train_loss: 0.9879, test_loss: 1.0058, test_f1: 0.4611
 epoch: 10, train_loss: 0.9706, test_loss: 0.9803, test_f1: 0.4991
 epoch: 11, train_loss: 0.9626, test_loss: 0.9914, test_f1: 0.4821
 epoch: 12, train_loss: 0.9636, test_loss: 0.9721, test_f1: 0.4870
 epoch: 13, train_loss: 0.9467, test_loss: 0.9589, test_f1: 0.4935
 epoch: 14, train_loss: 0.9385, test_loss: 0.9592, test_f1: 0.4761
 epoch: 15, train_loss: 0.9288, test_loss: 0.9801, test_f1: 0.4583
 epoch: 16, train_loss: 0.9302, test_loss: 0.9527, test_f1: 0.4741
 epoch: 17, train_loss: 0.9219, test_loss: 0.9445, test_f1: 0.5160
 epoch: 18, train_loss: 0.9122, test_loss: 0.9461, test_f1: 0.5293
 epoch: 19, train_loss: 0.9153, test_loss: 0.9334, test_f1: 0.5103
 epoch: 20, train_loss: 0.8935, test_loss: 0.9381, test_f1: 0.5168
 epoch: 21, train_loss: 0.9058, test_loss: 0.9714, test_f1: 0.5262
 epoch: 22, train_loss: 0.8931, test_loss: 0.9359, test_f1: 0.5233
 epoch: 23, train_loss: 0.8730, test_loss: 0.9358, test_f1: 0.5273
 epoch: 24, train_loss: 0.8707, test_loss: 0.9457, test_f1: 0.5220
 epoch: 25, train_loss: 0.8725, test_loss: 0.9089, test_f1: 0.5292
 epoch: 26, train_loss: 0.8764, test_loss: 0.9291, test_f1: 0.5328
 epoch: 27, train_loss: 0.8721, test_loss: 0.8960, test_f1: 0.5463
 epoch: 28, train_loss: 0.8693, test_loss: 0.9241, test_f1: 0.5402
 epoch: 29, train_loss: 0.8627, test_loss: 0.9137, test_f1: 0.5437
 epoch: 30, train_loss: 0.8461, test_loss: 0.8914, test_f1: 0.5447
 epoch: 31, train_loss: 0.8308, test_loss: 0.9376, test_f1: 0.5326
 epoch: 32, train_loss: 0.8462, test_loss: 0.9016, test_f1: 0.5469
 epoch: 33, train_loss: 0.8258, test_loss: 0.8929, test_f1: 0.5398
 epoch: 34, train_loss: 0.8384, test_loss: 0.9237, test_f1: 0.5438
 epoch: 35, train_loss: 0.8579, test_loss: 0.9680, test_f1: 0.5026
 epoch: 36, train_loss: 0.8355, test_loss: 0.8960, test_f1: 0.5527
 epoch: 37, train_loss: 0.8411, test_loss: 0.9523, test_f1: 0.5290
 epoch: 38, train_loss: 0.8213, test_loss: 0.9054, test_f1: 0.5457
 epoch: 39, train_loss: 0.8235, test_loss: 0.9158, test_f1: 0.5417
 epoch: 40, train_loss: 0.8238, test_loss: 0.8996, test_f1: 0.5423
 epoch: 41, train_loss: 0.8189, test_loss: 0.9403, test_f1: 0.5463
 epoch: 42, train_loss: 0.8123, test_loss: 0.9091, test_f1: 0.5480
 epoch: 43, train_loss: 0.8025, test_loss: 0.9010, test_f1: 0.5335
 epoch: 44, train_loss: 0.8108, test_loss: 0.9035, test_f1: 0.5131
 epoch: 45, train_loss: 0.8070, test_loss: 0.9180, test_f1: 0.5330
 epoch: 46, train_loss: 0.7938, test_loss: 0.8925, test_f1: 0.5234
 epoch: 47, train_loss: 0.8008, test_loss: 0.9074, test_f1: 0.5323
 epoch: 48, train_loss: 0.7927, test_loss: 0.9333, test_f1: 0.5058
 epoch: 49, train_loss: 0.7931, test_loss: 0.9370, test_f1: 0.5129
 epoch: 50, train_loss: 0.7990, test_loss: 0.8921, test_f1: 0.5292
 epoch: 51, train_loss: 0.7844, test_loss: 0.8763, test_f1: 0.5368
 epoch: 52, train_loss: 0.7835, test_loss: 0.8812, test_f1: 0.5325
 epoch: 53, train_loss: 0.7796, test_loss: 0.8906, test_f1: 0.5130
 epoch: 54, train_loss: 0.7792, test_loss: 0.8958, test_f1: 0.5353
 epoch: 55, train_loss: 0.7725, test_loss: 0.8892, test_f1: 0.5367
 epoch: 56, train_loss: 0.7628, test_loss: 0.8910, test_f1: 0.5343
 epoch: 57, train_loss: 0.7598, test_loss: 0.8876, test_f1: 0.5586
 epoch: 58, train_loss: 0.7730, test_loss: 0.9276, test_f1: 0.5174
 epoch: 59, train_loss: 0.7745, test_loss: 0.9027, test_f1: 0.5547
 epoch: 60, train_loss: 0.7714, test_loss: 0.9033, test_f1: 0.5623
 epoch: 61, train_loss: 0.7724, test_loss: 0.9021, test_f1: 0.5372
 epoch: 62, train_loss: 0.7712, test_loss: 0.8782, test_f1: 0.5430
 epoch: 63, train_loss: 0.7712, test_loss: 0.8882, test_f1: 0.5428
 epoch: 64, train_loss: 0.7599, test_loss: 0.8957, test_f1: 0.5549
 epoch: 65, train_loss: 0.7593, test_loss: 0.9044, test_f1: 0.5292
 epoch: 66, train_loss: 0.7636, test_loss: 0.8806, test_f1: 0.5470
 epoch: 67, train_loss: 0.7507, test_loss: 0.8956, test_f1: 0.5475
 epoch: 68, train_loss: 0.7565, test_loss: 0.8843, test_f1: 0.5454
 epoch: 69, train_loss: 0.7569, test_loss: 0.8905, test_f1: 0.5396
 epoch: 70, train_loss: 0.7376, test_loss: 0.8819, test_f1: 0.5391
 epoch: 71, train_loss: 0.7547, test_loss: 0.8937, test_f1: 0.5387
 epoch: 72, train_loss: 0.7507, test_loss: 0.8907, test_f1: 0.5390
 epoch: 73, train_loss: 0.7469, test_loss: 0.9008, test_f1: 0.5445
 epoch: 74, train_loss: 0.7512, test_loss: 0.9045, test_f1: 0.5329
 epoch: 75, train_loss: 0.7495, test_loss: 0.9000, test_f1: 0.5399
 epoch: 76, train_loss: 0.7501, test_loss: 0.8978, test_f1: 0.5582
 epoch: 77, train_loss: 0.7500, test_loss: 0.9021, test_f1: 0.5537
 epoch: 78, train_loss: 0.7498, test_loss: 0.8926, test_f1: 0.5438
 epoch: 79, train_loss: 0.7427, test_loss: 0.8738, test_f1: 0.5429
 epoch: 80, train_loss: 0.7623, test_loss: 0.9039, test_f1: 0.5527
 epoch: 81, train_loss: 0.7415, test_loss: 0.8990, test_f1: 0.5425
 epoch: 82, train_loss: 0.7462, test_loss: 0.8926, test_f1: 0.5336
 epoch: 83, train_loss: 0.7582, test_loss: 0.8742, test_f1: 0.5636
 epoch: 84, train_loss: 0.7364, test_loss: 0.9414, test_f1: 0.5509
 epoch: 85, train_loss: 0.7380, test_loss: 0.8961, test_f1: 0.5496
 epoch: 86, train_loss: 0.7345, test_loss: 0.8845, test_f1: 0.5467
 epoch: 87, train_loss: 0.7338, test_loss: 0.9125, test_f1: 0.5359
 epoch: 88, train_loss: 0.7347, test_loss: 0.9061, test_f1: 0.5595
 epoch: 89, train_loss: 0.7296, test_loss: 0.8962, test_f1: 0.5632
 epoch: 90, train_loss: 0.7394, test_loss: 0.9090, test_f1: 0.5726
 epoch: 91, train_loss: 0.7283, test_loss: 0.9128, test_f1: 0.5633
 epoch: 92, train_loss: 0.7332, test_loss: 0.9058, test_f1: 0.5316
 epoch: 93, train_loss: 0.7215, test_loss: 0.9279, test_f1: 0.5324
 epoch: 94, train_loss: 0.7362, test_loss: 0.8945, test_f1: 0.5473
 epoch: 95, train_loss: 0.7313, test_loss: 0.9182, test_f1: 0.5212
 epoch: 96, train_loss: 0.7261, test_loss: 0.9078, test_f1: 0.5505
 epoch: 97, train_loss: 0.7320, test_loss: 0.8906, test_f1: 0.5551
 epoch: 98, train_loss: 0.7277, test_loss: 0.8840, test_f1: 0.5607
 epoch: 99, train_loss: 0.7425, test_loss: 0.8965, test_f1: 0.5575

Training completed in 683.86 seconds
Best F1: 0.5784 at epoch 80
Mean F1 across iterations: 0.5675  0.0067
========================FINAL RESULTS================================
FEGIN weighted F1: 0.5784  0.0067
python main.py --data ltspice_examples --representation component_pin --model FEGIN --layers 4 --hiddens 16 --batch_size 64 --lr 0.001 --emb_size 250 --epochs 100 --save_appendix component_pin_L4_H16_BS64_LR0.001_E250 --no_val
-----



STDERR:
  File "main.py", line 370, in <module>
    main()
  File "main.py", line 254, in main
    dataset = dataset_class(
  File "/home/philip/projects/ltspice_examples_code_repo/Circuit-Completion-Using-GNNs/component_classification_with_link_prediction_head/evaluation/FEGIN/kernel/circuit_datasets.py", line 15, in __init__
    self.data, self.slices = torch.load(self.processed_paths[0])
  File "/home/philip/.local/lib/python3.8/site-packages/torch/serialization.py", line 1040, in load
    warnings.warn(
  File "/usr/lib/python3.8/warnings.py", line 109, in _showwarnmsg
    sw(msg.message, msg.category, msg.filename, msg.lineno,
  File "main.py", line 47, in warn_with_traceback
    traceback.print_stack(file=log)
/home/philip/projects/ltspice_examples_code_repo/Circuit-Completion-Using-GNNs/component_classification_with_link_prediction_head/evaluation/FEGIN/kernel/circuit_datasets.py:15: FutureWarning: You are using `torch.load` with `weights_only=False` (the current default value), which uses the default pickle module implicitly. It is possible to construct malicious pickle data which will execute arbitrary code during unpickling (See https://github.com/pytorch/pytorch/blob/main/SECURITY.md#untrusted-models for more details). In a future release, the default value for `weights_only` will be flipped to `True`. This limits the functions that could be executed during unpickling. Arbitrary objects will no longer be allowed to be loaded via this mode unless they are explicitly allowlisted by the user via `torch.serialization.add_safe_globals`. We recommend you start setting `weights_only=True` for any use case where you don't have full control of the loaded file. Please open an issue on GitHub for any issues related to this experimental feature.
  self.data, self.slices = torch.load(self.processed_paths[0])
