STDOUT:
Results will be saved in /home/philip/projects/llm_inference_code_repo/Circuit-Completion-Using-GNNs/component_classification_with_link_prediction_head/evaluation/FEGIN/results/model_FEGIN_dataset_ltspice_examples
Command line input: python main.py --data ltspice_examples --representation component_component --model FEGIN --layers 2 --hiddens 64 --batch_size 64 --lr 0.0001 --emb_size 128 --epochs 100 --save_appendix component_component_L2_H64_BS64_LR0.0001_E128 --no_val
 is saved.
-----
ltspice_examples - FEGIN
Using 2 layers, 64 hidden units, h = 2
Loading component_component representation dataset
ENTERED
Training FEGIN on component_component representation
Train: 3556, Test: 845
##################ITERATION #0 ****************************************
 epoch: 0, train_loss: 1.3902, test_loss: 1.3800, test_f1: 0.1566
 epoch: 1, train_loss: 1.3709, test_loss: 1.3618, test_f1: 0.2653
 epoch: 2, train_loss: 1.3528, test_loss: 1.3388, test_f1: 0.2390
 epoch: 3, train_loss: 1.3292, test_loss: 1.3086, test_f1: 0.2274
 epoch: 4, train_loss: 1.3036, test_loss: 1.2778, test_f1: 0.2274
 epoch: 5, train_loss: 1.2778, test_loss: 1.2491, test_f1: 0.2274
 epoch: 6, train_loss: 1.2564, test_loss: 1.2272, test_f1: 0.2276
 epoch: 7, train_loss: 1.2413, test_loss: 1.2078, test_f1: 0.2555
 epoch: 8, train_loss: 1.2256, test_loss: 1.1882, test_f1: 0.2555
 epoch: 9, train_loss: 1.2120, test_loss: 1.1729, test_f1: 0.2600
 epoch: 10, train_loss: 1.1950, test_loss: 1.1529, test_f1: 0.2876
 epoch: 11, train_loss: 1.1835, test_loss: 1.1339, test_f1: 0.3410
 epoch: 12, train_loss: 1.1671, test_loss: 1.1164, test_f1: 0.4268
 epoch: 13, train_loss: 1.1551, test_loss: 1.1036, test_f1: 0.4540
 epoch: 14, train_loss: 1.1453, test_loss: 1.0846, test_f1: 0.4648
 epoch: 15, train_loss: 1.1289, test_loss: 1.0701, test_f1: 0.4509
 epoch: 16, train_loss: 1.1190, test_loss: 1.0585, test_f1: 0.4568
 epoch: 17, train_loss: 1.1065, test_loss: 1.0454, test_f1: 0.4680
 epoch: 18, train_loss: 1.0914, test_loss: 1.0312, test_f1: 0.4783
 epoch: 19, train_loss: 1.0870, test_loss: 1.0171, test_f1: 0.4994
 epoch: 20, train_loss: 1.0750, test_loss: 1.0113, test_f1: 0.4711
 epoch: 21, train_loss: 1.0614, test_loss: 0.9983, test_f1: 0.4818
 epoch: 22, train_loss: 1.0475, test_loss: 0.9857, test_f1: 0.4844
 epoch: 23, train_loss: 1.0381, test_loss: 0.9748, test_f1: 0.5031
 epoch: 24, train_loss: 1.0384, test_loss: 0.9586, test_f1: 0.4997
 epoch: 25, train_loss: 1.0167, test_loss: 0.9545, test_f1: 0.5026
 epoch: 26, train_loss: 1.0113, test_loss: 0.9551, test_f1: 0.5064
 epoch: 27, train_loss: 0.9993, test_loss: 0.9505, test_f1: 0.5117
 epoch: 28, train_loss: 0.9972, test_loss: 0.9407, test_f1: 0.4864
 epoch: 29, train_loss: 0.9874, test_loss: 0.9395, test_f1: 0.5206
 epoch: 30, train_loss: 0.9780, test_loss: 0.9273, test_f1: 0.5241
 epoch: 31, train_loss: 0.9708, test_loss: 0.9230, test_f1: 0.5278
 epoch: 32, train_loss: 0.9634, test_loss: 0.9190, test_f1: 0.5128
 epoch: 33, train_loss: 0.9619, test_loss: 0.9311, test_f1: 0.5174
 epoch: 34, train_loss: 0.9600, test_loss: 0.9166, test_f1: 0.5248
 epoch: 35, train_loss: 0.9453, test_loss: 0.9183, test_f1: 0.5222
 epoch: 36, train_loss: 0.9426, test_loss: 0.9114, test_f1: 0.5321
 epoch: 37, train_loss: 0.9385, test_loss: 0.9041, test_f1: 0.5291
 epoch: 38, train_loss: 0.9393, test_loss: 0.9078, test_f1: 0.5155
 epoch: 39, train_loss: 0.9221, test_loss: 0.9146, test_f1: 0.5222
 epoch: 40, train_loss: 0.9285, test_loss: 0.9133, test_f1: 0.5135
 epoch: 41, train_loss: 0.9199, test_loss: 0.8983, test_f1: 0.5300
 epoch: 42, train_loss: 0.9145, test_loss: 0.9039, test_f1: 0.5276
 epoch: 43, train_loss: 0.9160, test_loss: 0.9110, test_f1: 0.4925
 epoch: 44, train_loss: 0.9141, test_loss: 0.9005, test_f1: 0.5234
 epoch: 45, train_loss: 0.9214, test_loss: 0.9037, test_f1: 0.5346
 epoch: 46, train_loss: 0.9121, test_loss: 0.8969, test_f1: 0.5325
 epoch: 47, train_loss: 0.9023, test_loss: 0.9009, test_f1: 0.5185
 epoch: 48, train_loss: 0.8923, test_loss: 0.9102, test_f1: 0.5104
 epoch: 49, train_loss: 0.9041, test_loss: 0.9002, test_f1: 0.5282
 epoch: 50, train_loss: 0.8985, test_loss: 0.9059, test_f1: 0.5208
 epoch: 51, train_loss: 0.8937, test_loss: 0.8925, test_f1: 0.5197
 epoch: 52, train_loss: 0.8840, test_loss: 0.8997, test_f1: 0.5228
 epoch: 53, train_loss: 0.8844, test_loss: 0.8916, test_f1: 0.5336
 epoch: 54, train_loss: 0.8884, test_loss: 0.8969, test_f1: 0.5224
 epoch: 55, train_loss: 0.8848, test_loss: 0.8892, test_f1: 0.5277
 epoch: 56, train_loss: 0.8800, test_loss: 0.8871, test_f1: 0.5329
 epoch: 57, train_loss: 0.8759, test_loss: 0.8959, test_f1: 0.5216
 epoch: 58, train_loss: 0.8755, test_loss: 0.8913, test_f1: 0.5349
 epoch: 59, train_loss: 0.8793, test_loss: 0.8967, test_f1: 0.5187
 epoch: 60, train_loss: 0.8748, test_loss: 0.9004, test_f1: 0.5220
 epoch: 61, train_loss: 0.8710, test_loss: 0.8982, test_f1: 0.5140
 epoch: 62, train_loss: 0.8678, test_loss: 0.9031, test_f1: 0.5122
 epoch: 63, train_loss: 0.8743, test_loss: 0.9119, test_f1: 0.5306
 epoch: 64, train_loss: 0.8707, test_loss: 0.9068, test_f1: 0.5094
 epoch: 65, train_loss: 0.8791, test_loss: 0.9121, test_f1: 0.5132
 epoch: 66, train_loss: 0.8666, test_loss: 0.8990, test_f1: 0.5089
 epoch: 67, train_loss: 0.8678, test_loss: 0.9144, test_f1: 0.5105
 epoch: 68, train_loss: 0.8638, test_loss: 0.9095, test_f1: 0.5222
 epoch: 69, train_loss: 0.8619, test_loss: 0.9094, test_f1: 0.5137
 epoch: 70, train_loss: 0.8661, test_loss: 0.9144, test_f1: 0.5102
 epoch: 71, train_loss: 0.8582, test_loss: 0.9152, test_f1: 0.5178
 epoch: 72, train_loss: 0.8696, test_loss: 0.8955, test_f1: 0.5191
 epoch: 73, train_loss: 0.8589, test_loss: 0.9263, test_f1: 0.5149
 epoch: 74, train_loss: 0.8613, test_loss: 0.9200, test_f1: 0.5091
 epoch: 75, train_loss: 0.8608, test_loss: 0.9306, test_f1: 0.5193
 epoch: 76, train_loss: 0.8579, test_loss: 0.9024, test_f1: 0.5149
 epoch: 77, train_loss: 0.8640, test_loss: 0.9277, test_f1: 0.5172
 epoch: 78, train_loss: 0.8555, test_loss: 0.9234, test_f1: 0.5192
 epoch: 79, train_loss: 0.8582, test_loss: 0.9351, test_f1: 0.5100
 epoch: 80, train_loss: 0.8557, test_loss: 0.9158, test_f1: 0.5008
 epoch: 81, train_loss: 0.8576, test_loss: 0.9299, test_f1: 0.5091
 epoch: 82, train_loss: 0.8512, test_loss: 0.9063, test_f1: 0.5286
 epoch: 83, train_loss: 0.8489, test_loss: 0.9370, test_f1: 0.5227
 epoch: 84, train_loss: 0.8471, test_loss: 0.9143, test_f1: 0.5229
 epoch: 85, train_loss: 0.8533, test_loss: 0.9084, test_f1: 0.5217
 epoch: 86, train_loss: 0.8441, test_loss: 0.9196, test_f1: 0.5176
 epoch: 87, train_loss: 0.8505, test_loss: 0.9327, test_f1: 0.5153
 epoch: 88, train_loss: 0.8360, test_loss: 0.9379, test_f1: 0.5223
 epoch: 89, train_loss: 0.8443, test_loss: 0.9336, test_f1: 0.5174
 epoch: 90, train_loss: 0.8451, test_loss: 0.9192, test_f1: 0.5200
 epoch: 91, train_loss: 0.8408, test_loss: 0.9305, test_f1: 0.5223
 epoch: 92, train_loss: 0.8324, test_loss: 0.9369, test_f1: 0.5154
 epoch: 93, train_loss: 0.8499, test_loss: 0.9650, test_f1: 0.5193
 epoch: 94, train_loss: 0.8344, test_loss: 0.9299, test_f1: 0.5267
 epoch: 95, train_loss: 0.8405, test_loss: 0.9196, test_f1: 0.5255
 epoch: 96, train_loss: 0.8341, test_loss: 0.9246, test_f1: 0.5262
 epoch: 97, train_loss: 0.8320, test_loss: 0.9392, test_f1: 0.5316
 epoch: 98, train_loss: 0.8413, test_loss: 0.9153, test_f1: 0.5307
 epoch: 99, train_loss: 0.8307, test_loss: 0.9239, test_f1: 0.5282
##################ITERATION #1 ****************************************
 epoch: 0, train_loss: 1.3300, test_loss: 1.3017, test_f1: 0.2402
 epoch: 1, train_loss: 1.2814, test_loss: 1.2549, test_f1: 0.2464
 epoch: 2, train_loss: 1.2578, test_loss: 1.2280, test_f1: 0.2737
 epoch: 3, train_loss: 1.2371, test_loss: 1.2049, test_f1: 0.3301
 epoch: 4, train_loss: 1.2221, test_loss: 1.1842, test_f1: 0.3666
 epoch: 5, train_loss: 1.2037, test_loss: 1.1649, test_f1: 0.3725
 epoch: 6, train_loss: 1.1902, test_loss: 1.1480, test_f1: 0.3883
 epoch: 7, train_loss: 1.1820, test_loss: 1.1325, test_f1: 0.4051
 epoch: 8, train_loss: 1.1627, test_loss: 1.1161, test_f1: 0.4051
 epoch: 9, train_loss: 1.1502, test_loss: 1.1007, test_f1: 0.4528
 epoch: 10, train_loss: 1.1349, test_loss: 1.0888, test_f1: 0.4308
 epoch: 11, train_loss: 1.1245, test_loss: 1.0713, test_f1: 0.4617
 epoch: 12, train_loss: 1.1106, test_loss: 1.0661, test_f1: 0.4559
 epoch: 13, train_loss: 1.0942, test_loss: 1.0504, test_f1: 0.4620
 epoch: 14, train_loss: 1.0903, test_loss: 1.0380, test_f1: 0.4612
 epoch: 15, train_loss: 1.0753, test_loss: 1.0365, test_f1: 0.4652
 epoch: 16, train_loss: 1.0717, test_loss: 1.0192, test_f1: 0.4384
 epoch: 17, train_loss: 1.0517, test_loss: 1.0148, test_f1: 0.4288
 epoch: 18, train_loss: 1.0458, test_loss: 0.9997, test_f1: 0.4669
 epoch: 19, train_loss: 1.0315, test_loss: 1.0040, test_f1: 0.4730
 epoch: 20, train_loss: 1.0296, test_loss: 0.9951, test_f1: 0.4803
 epoch: 21, train_loss: 1.0333, test_loss: 0.9811, test_f1: 0.4770
 epoch: 22, train_loss: 1.0124, test_loss: 0.9798, test_f1: 0.4744
 epoch: 23, train_loss: 1.0108, test_loss: 0.9679, test_f1: 0.4658
 epoch: 24, train_loss: 1.0018, test_loss: 0.9674, test_f1: 0.4840
 epoch: 25, train_loss: 0.9936, test_loss: 0.9655, test_f1: 0.4585
 epoch: 26, train_loss: 0.9936, test_loss: 0.9579, test_f1: 0.4892
 epoch: 27, train_loss: 0.9929, test_loss: 0.9522, test_f1: 0.4778
 epoch: 28, train_loss: 0.9809, test_loss: 0.9618, test_f1: 0.4807
 epoch: 29, train_loss: 0.9772, test_loss: 0.9405, test_f1: 0.4972
 epoch: 30, train_loss: 0.9733, test_loss: 0.9453, test_f1: 0.4947
 epoch: 31, train_loss: 0.9705, test_loss: 0.9393, test_f1: 0.4873
 epoch: 32, train_loss: 0.9669, test_loss: 0.9455, test_f1: 0.4858
 epoch: 33, train_loss: 0.9634, test_loss: 0.9347, test_f1: 0.4910
 epoch: 34, train_loss: 0.9588, test_loss: 0.9390, test_f1: 0.4913
 epoch: 35, train_loss: 0.9476, test_loss: 0.9385, test_f1: 0.5010
 epoch: 36, train_loss: 0.9462, test_loss: 0.9289, test_f1: 0.4936
 epoch: 37, train_loss: 0.9576, test_loss: 0.9279, test_f1: 0.4850
 epoch: 38, train_loss: 0.9483, test_loss: 0.9283, test_f1: 0.4734
 epoch: 39, train_loss: 0.9444, test_loss: 0.9239, test_f1: 0.4941
 epoch: 40, train_loss: 0.9402, test_loss: 0.9167, test_f1: 0.5025
 epoch: 41, train_loss: 0.9311, test_loss: 0.9388, test_f1: 0.4950
 epoch: 42, train_loss: 0.9310, test_loss: 0.9403, test_f1: 0.4940
 epoch: 43, train_loss: 0.9202, test_loss: 0.9104, test_f1: 0.5042
 epoch: 44, train_loss: 0.9278, test_loss: 0.9261, test_f1: 0.4983
 epoch: 45, train_loss: 0.9217, test_loss: 0.9271, test_f1: 0.4921
 epoch: 46, train_loss: 0.9271, test_loss: 0.9195, test_f1: 0.4806
 epoch: 47, train_loss: 0.9208, test_loss: 0.9162, test_f1: 0.4978
 epoch: 48, train_loss: 0.9132, test_loss: 0.9280, test_f1: 0.4974
 epoch: 49, train_loss: 0.9169, test_loss: 0.9178, test_f1: 0.4982
 epoch: 50, train_loss: 0.9002, test_loss: 0.9364, test_f1: 0.4732
 epoch: 51, train_loss: 0.9018, test_loss: 0.9281, test_f1: 0.4851
 epoch: 52, train_loss: 0.9020, test_loss: 0.9349, test_f1: 0.4808
 epoch: 53, train_loss: 0.8986, test_loss: 0.9302, test_f1: 0.4880
 epoch: 54, train_loss: 0.8922, test_loss: 0.9292, test_f1: 0.4908
 epoch: 55, train_loss: 0.8894, test_loss: 0.9382, test_f1: 0.4915
 epoch: 56, train_loss: 0.8953, test_loss: 0.9405, test_f1: 0.4867
 epoch: 57, train_loss: 0.8879, test_loss: 0.9250, test_f1: 0.4985
 epoch: 58, train_loss: 0.8740, test_loss: 0.9293, test_f1: 0.4990
 epoch: 59, train_loss: 0.8893, test_loss: 0.9425, test_f1: 0.4878
 epoch: 60, train_loss: 0.8842, test_loss: 0.9476, test_f1: 0.4949
 epoch: 61, train_loss: 0.8840, test_loss: 0.9330, test_f1: 0.4846
 epoch: 62, train_loss: 0.8889, test_loss: 0.9529, test_f1: 0.4935
 epoch: 63, train_loss: 0.8806, test_loss: 0.9321, test_f1: 0.4914
 epoch: 64, train_loss: 0.8799, test_loss: 0.9508, test_f1: 0.4803
 epoch: 65, train_loss: 0.8792, test_loss: 0.9341, test_f1: 0.4917
 epoch: 66, train_loss: 0.8755, test_loss: 0.9242, test_f1: 0.4985
 epoch: 67, train_loss: 0.8775, test_loss: 0.9571, test_f1: 0.4852
 epoch: 68, train_loss: 0.8679, test_loss: 0.9360, test_f1: 0.4828
 epoch: 69, train_loss: 0.8673, test_loss: 0.9458, test_f1: 0.4817
 epoch: 70, train_loss: 0.8713, test_loss: 0.9456, test_f1: 0.4854
 epoch: 71, train_loss: 0.8649, test_loss: 0.9405, test_f1: 0.4926
 epoch: 72, train_loss: 0.8632, test_loss: 0.9292, test_f1: 0.4839
 epoch: 73, train_loss: 0.8588, test_loss: 0.9574, test_f1: 0.4752
 epoch: 74, train_loss: 0.8701, test_loss: 0.9783, test_f1: 0.4782
 epoch: 75, train_loss: 0.8732, test_loss: 0.9682, test_f1: 0.4742
 epoch: 76, train_loss: 0.8558, test_loss: 0.9509, test_f1: 0.4771
 epoch: 77, train_loss: 0.8679, test_loss: 0.9516, test_f1: 0.4819
 epoch: 78, train_loss: 0.8752, test_loss: 0.9544, test_f1: 0.4872
 epoch: 79, train_loss: 0.8623, test_loss: 0.9634, test_f1: 0.4886
 epoch: 80, train_loss: 0.8595, test_loss: 0.9441, test_f1: 0.4744
 epoch: 81, train_loss: 0.8559, test_loss: 0.9552, test_f1: 0.4775
 epoch: 82, train_loss: 0.8555, test_loss: 0.9542, test_f1: 0.4865
 epoch: 83, train_loss: 0.8654, test_loss: 0.9533, test_f1: 0.4964
 epoch: 84, train_loss: 0.8542, test_loss: 0.9411, test_f1: 0.4922
 epoch: 85, train_loss: 0.8573, test_loss: 0.9520, test_f1: 0.4892
 epoch: 86, train_loss: 0.8446, test_loss: 0.9513, test_f1: 0.4812
 epoch: 87, train_loss: 0.8423, test_loss: 0.9492, test_f1: 0.4876
 epoch: 88, train_loss: 0.8499, test_loss: 0.9420, test_f1: 0.4946
 epoch: 89, train_loss: 0.8559, test_loss: 0.9605, test_f1: 0.4933
 epoch: 90, train_loss: 0.8460, test_loss: 0.9448, test_f1: 0.5011
 epoch: 91, train_loss: 0.8535, test_loss: 0.9723, test_f1: 0.4943
 epoch: 92, train_loss: 0.8411, test_loss: 0.9736, test_f1: 0.4893
 epoch: 93, train_loss: 0.8426, test_loss: 0.9370, test_f1: 0.4835
 epoch: 94, train_loss: 0.8316, test_loss: 0.9557, test_f1: 0.4918
 epoch: 95, train_loss: 0.8446, test_loss: 0.9672, test_f1: 0.4985
 epoch: 96, train_loss: 0.8425, test_loss: 0.9620, test_f1: 0.5105
 epoch: 97, train_loss: 0.8430, test_loss: 0.9616, test_f1: 0.5119
 epoch: 98, train_loss: 0.8480, test_loss: 0.9675, test_f1: 0.4940
 epoch: 99, train_loss: 0.8307, test_loss: 0.9706, test_f1: 0.4918
##################ITERATION #2 ****************************************
 epoch: 0, train_loss: 1.3161, test_loss: 1.2778, test_f1: 0.2274
 epoch: 1, train_loss: 1.2631, test_loss: 1.2408, test_f1: 0.2276
 epoch: 2, train_loss: 1.2440, test_loss: 1.2205, test_f1: 0.2904
 epoch: 3, train_loss: 1.2276, test_loss: 1.2038, test_f1: 0.3408
 epoch: 4, train_loss: 1.2155, test_loss: 1.1846, test_f1: 0.3572
 epoch: 5, train_loss: 1.1967, test_loss: 1.1720, test_f1: 0.3754
 epoch: 6, train_loss: 1.1888, test_loss: 1.1578, test_f1: 0.3902
 epoch: 7, train_loss: 1.1763, test_loss: 1.1459, test_f1: 0.4155
 epoch: 8, train_loss: 1.1563, test_loss: 1.1356, test_f1: 0.4283
 epoch: 9, train_loss: 1.1508, test_loss: 1.1225, test_f1: 0.4176
 epoch: 10, train_loss: 1.1411, test_loss: 1.1113, test_f1: 0.4302
 epoch: 11, train_loss: 1.1257, test_loss: 1.1016, test_f1: 0.4317
 epoch: 12, train_loss: 1.1149, test_loss: 1.0914, test_f1: 0.4218
 epoch: 13, train_loss: 1.1026, test_loss: 1.0934, test_f1: 0.4124
 epoch: 14, train_loss: 1.0948, test_loss: 1.0828, test_f1: 0.4247
 epoch: 15, train_loss: 1.0883, test_loss: 1.0688, test_f1: 0.4230
 epoch: 16, train_loss: 1.0763, test_loss: 1.0738, test_f1: 0.4211
 epoch: 17, train_loss: 1.0750, test_loss: 1.0641, test_f1: 0.4278
 epoch: 18, train_loss: 1.0532, test_loss: 1.0582, test_f1: 0.4251
 epoch: 19, train_loss: 1.0459, test_loss: 1.0547, test_f1: 0.4066
 epoch: 20, train_loss: 1.0440, test_loss: 1.0459, test_f1: 0.4327
 epoch: 21, train_loss: 1.0328, test_loss: 1.0423, test_f1: 0.4232
 epoch: 22, train_loss: 1.0282, test_loss: 1.0376, test_f1: 0.4340
 epoch: 23, train_loss: 1.0182, test_loss: 1.0373, test_f1: 0.4344
 epoch: 24, train_loss: 1.0154, test_loss: 1.0381, test_f1: 0.4413
 epoch: 25, train_loss: 1.0050, test_loss: 1.0595, test_f1: 0.4311
 epoch: 26, train_loss: 0.9971, test_loss: 1.0151, test_f1: 0.4604
 epoch: 27, train_loss: 0.9973, test_loss: 1.0185, test_f1: 0.4435
 epoch: 28, train_loss: 0.9957, test_loss: 1.0380, test_f1: 0.4418
 epoch: 29, train_loss: 0.9838, test_loss: 1.0250, test_f1: 0.4457
 epoch: 30, train_loss: 0.9841, test_loss: 1.0049, test_f1: 0.4464
 epoch: 31, train_loss: 0.9774, test_loss: 1.0312, test_f1: 0.4573
 epoch: 32, train_loss: 0.9684, test_loss: 1.0164, test_f1: 0.4512
 epoch: 33, train_loss: 0.9567, test_loss: 1.0088, test_f1: 0.4639
 epoch: 34, train_loss: 0.9611, test_loss: 1.0219, test_f1: 0.4551
 epoch: 35, train_loss: 0.9515, test_loss: 1.0076, test_f1: 0.4661
 epoch: 36, train_loss: 0.9520, test_loss: 1.0450, test_f1: 0.4381
 epoch: 37, train_loss: 0.9446, test_loss: 0.9955, test_f1: 0.4555
 epoch: 38, train_loss: 0.9419, test_loss: 1.0013, test_f1: 0.4617
 epoch: 39, train_loss: 0.9421, test_loss: 1.0086, test_f1: 0.4597
 epoch: 40, train_loss: 0.9404, test_loss: 1.0044, test_f1: 0.4681
 epoch: 41, train_loss: 0.9288, test_loss: 1.0313, test_f1: 0.4302
 epoch: 42, train_loss: 0.9258, test_loss: 1.0167, test_f1: 0.4506
 epoch: 43, train_loss: 0.9315, test_loss: 1.0007, test_f1: 0.4602
 epoch: 44, train_loss: 0.9248, test_loss: 1.0187, test_f1: 0.4490
 epoch: 45, train_loss: 0.9179, test_loss: 1.0228, test_f1: 0.4505
 epoch: 46, train_loss: 0.9103, test_loss: 1.0154, test_f1: 0.4660
 epoch: 47, train_loss: 0.9149, test_loss: 1.0186, test_f1: 0.4524
 epoch: 48, train_loss: 0.9084, test_loss: 1.0188, test_f1: 0.4553
 epoch: 49, train_loss: 0.9027, test_loss: 1.0346, test_f1: 0.4503
 epoch: 50, train_loss: 0.9055, test_loss: 0.9997, test_f1: 0.4751
 epoch: 51, train_loss: 0.9019, test_loss: 1.0470, test_f1: 0.4595
 epoch: 52, train_loss: 0.9001, test_loss: 1.0377, test_f1: 0.4527
 epoch: 53, train_loss: 0.8847, test_loss: 1.0079, test_f1: 0.4576
 epoch: 54, train_loss: 0.8982, test_loss: 1.0304, test_f1: 0.4534
 epoch: 55, train_loss: 0.8933, test_loss: 1.0411, test_f1: 0.4504
 epoch: 56, train_loss: 0.8980, test_loss: 1.0426, test_f1: 0.4549
 epoch: 57, train_loss: 0.8905, test_loss: 1.0092, test_f1: 0.4679
 epoch: 58, train_loss: 0.8846, test_loss: 1.0465, test_f1: 0.4518
 epoch: 59, train_loss: 0.8899, test_loss: 1.0112, test_f1: 0.4595
 epoch: 60, train_loss: 0.8903, test_loss: 1.0757, test_f1: 0.4592
 epoch: 61, train_loss: 0.8806, test_loss: 1.0496, test_f1: 0.4657
 epoch: 62, train_loss: 0.8857, test_loss: 1.0357, test_f1: 0.4561
 epoch: 63, train_loss: 0.8818, test_loss: 1.0449, test_f1: 0.4615
 epoch: 64, train_loss: 0.8740, test_loss: 1.0261, test_f1: 0.4607
 epoch: 65, train_loss: 0.8862, test_loss: 1.0412, test_f1: 0.4583
 epoch: 66, train_loss: 0.8842, test_loss: 1.0181, test_f1: 0.4636
 epoch: 67, train_loss: 0.8676, test_loss: 1.0449, test_f1: 0.4590
 epoch: 68, train_loss: 0.8733, test_loss: 1.0388, test_f1: 0.4619
 epoch: 69, train_loss: 0.8701, test_loss: 1.0648, test_f1: 0.4614
 epoch: 70, train_loss: 0.8733, test_loss: 1.0215, test_f1: 0.4662
 epoch: 71, train_loss: 0.8700, test_loss: 1.0342, test_f1: 0.4567
 epoch: 72, train_loss: 0.8723, test_loss: 1.0759, test_f1: 0.4614
 epoch: 73, train_loss: 0.8730, test_loss: 1.0667, test_f1: 0.4661
 epoch: 74, train_loss: 0.8808, test_loss: 1.0209, test_f1: 0.4645
 epoch: 75, train_loss: 0.8804, test_loss: 1.0325, test_f1: 0.4635
 epoch: 76, train_loss: 0.8706, test_loss: 1.0466, test_f1: 0.4658
 epoch: 77, train_loss: 0.8580, test_loss: 1.0732, test_f1: 0.4591
 epoch: 78, train_loss: 0.8691, test_loss: 1.0393, test_f1: 0.4676
 epoch: 79, train_loss: 0.8642, test_loss: 1.0879, test_f1: 0.4649
 epoch: 80, train_loss: 0.8678, test_loss: 1.0498, test_f1: 0.4646
 epoch: 81, train_loss: 0.8495, test_loss: 1.0524, test_f1: 0.4660
 epoch: 82, train_loss: 0.8555, test_loss: 1.0329, test_f1: 0.4551
 epoch: 83, train_loss: 0.8505, test_loss: 1.0318, test_f1: 0.4633
 epoch: 84, train_loss: 0.8555, test_loss: 1.0872, test_f1: 0.4612
 epoch: 85, train_loss: 0.8527, test_loss: 1.0520, test_f1: 0.4640
 epoch: 86, train_loss: 0.8504, test_loss: 1.0447, test_f1: 0.4543
 epoch: 87, train_loss: 0.8515, test_loss: 1.0401, test_f1: 0.4664
 epoch: 88, train_loss: 0.8582, test_loss: 1.0382, test_f1: 0.4554
 epoch: 89, train_loss: 0.8538, test_loss: 1.0705, test_f1: 0.4629
 epoch: 90, train_loss: 0.8456, test_loss: 1.0829, test_f1: 0.4580
 epoch: 91, train_loss: 0.8581, test_loss: 1.0627, test_f1: 0.4721
 epoch: 92, train_loss: 0.8523, test_loss: 1.0882, test_f1: 0.4599
 epoch: 93, train_loss: 0.8608, test_loss: 1.0944, test_f1: 0.4614
 epoch: 94, train_loss: 0.8430, test_loss: 1.0352, test_f1: 0.4647
 epoch: 95, train_loss: 0.8449, test_loss: 1.0544, test_f1: 0.4727
 epoch: 96, train_loss: 0.8485, test_loss: 1.0611, test_f1: 0.4696
 epoch: 97, train_loss: 0.8418, test_loss: 1.0649, test_f1: 0.4671
 epoch: 98, train_loss: 0.8480, test_loss: 1.0646, test_f1: 0.4683
 epoch: 99, train_loss: 0.8498, test_loss: 1.0208, test_f1: 0.4750
##################ITERATION #3 ****************************************
 epoch: 0, train_loss: 1.3305, test_loss: 1.2669, test_f1: 0.3071
 epoch: 1, train_loss: 1.2515, test_loss: 1.2266, test_f1: 0.3399
 epoch: 2, train_loss: 1.2326, test_loss: 1.2023, test_f1: 0.3878
 epoch: 3, train_loss: 1.2159, test_loss: 1.1826, test_f1: 0.4060
 epoch: 4, train_loss: 1.2058, test_loss: 1.1642, test_f1: 0.4234
 epoch: 5, train_loss: 1.1900, test_loss: 1.1498, test_f1: 0.4285
 epoch: 6, train_loss: 1.1719, test_loss: 1.1326, test_f1: 0.4493
 epoch: 7, train_loss: 1.1600, test_loss: 1.1198, test_f1: 0.4538
 epoch: 8, train_loss: 1.1514, test_loss: 1.1101, test_f1: 0.4508
 epoch: 9, train_loss: 1.1442, test_loss: 1.0957, test_f1: 0.4565
 epoch: 10, train_loss: 1.1269, test_loss: 1.0822, test_f1: 0.4672
 epoch: 11, train_loss: 1.1163, test_loss: 1.0761, test_f1: 0.4660
 epoch: 12, train_loss: 1.1079, test_loss: 1.0632, test_f1: 0.4665
 epoch: 13, train_loss: 1.0991, test_loss: 1.0568, test_f1: 0.4673
 epoch: 14, train_loss: 1.0975, test_loss: 1.0487, test_f1: 0.4754
 epoch: 15, train_loss: 1.0846, test_loss: 1.0402, test_f1: 0.4727
 epoch: 16, train_loss: 1.0761, test_loss: 1.0305, test_f1: 0.4827
 epoch: 17, train_loss: 1.0775, test_loss: 1.0236, test_f1: 0.4745
 epoch: 18, train_loss: 1.0681, test_loss: 1.0159, test_f1: 0.4805
 epoch: 19, train_loss: 1.0652, test_loss: 1.0100, test_f1: 0.4750
 epoch: 20, train_loss: 1.0565, test_loss: 1.0037, test_f1: 0.4811
 epoch: 21, train_loss: 1.0509, test_loss: 0.9989, test_f1: 0.4862
 epoch: 22, train_loss: 1.0418, test_loss: 0.9937, test_f1: 0.4856
 epoch: 23, train_loss: 1.0369, test_loss: 0.9871, test_f1: 0.4876
 epoch: 24, train_loss: 1.0331, test_loss: 0.9839, test_f1: 0.4878
 epoch: 25, train_loss: 1.0276, test_loss: 0.9810, test_f1: 0.4943
 epoch: 26, train_loss: 1.0244, test_loss: 0.9733, test_f1: 0.5010
 epoch: 27, train_loss: 1.0202, test_loss: 0.9675, test_f1: 0.5030
 epoch: 28, train_loss: 1.0147, test_loss: 0.9595, test_f1: 0.5039
 epoch: 29, train_loss: 1.0036, test_loss: 0.9530, test_f1: 0.5113
 epoch: 30, train_loss: 1.0030, test_loss: 0.9576, test_f1: 0.5090
 epoch: 31, train_loss: 0.9994, test_loss: 0.9512, test_f1: 0.4987
 epoch: 32, train_loss: 0.9927, test_loss: 0.9496, test_f1: 0.4964
 epoch: 33, train_loss: 0.9890, test_loss: 0.9491, test_f1: 0.5170
 epoch: 34, train_loss: 0.9794, test_loss: 0.9385, test_f1: 0.5109
 epoch: 35, train_loss: 0.9747, test_loss: 0.9367, test_f1: 0.5092
 epoch: 36, train_loss: 0.9679, test_loss: 0.9440, test_f1: 0.5097
 epoch: 37, train_loss: 0.9723, test_loss: 0.9428, test_f1: 0.5013
 epoch: 38, train_loss: 0.9697, test_loss: 0.9361, test_f1: 0.5060
 epoch: 39, train_loss: 0.9628, test_loss: 0.9339, test_f1: 0.5090
 epoch: 40, train_loss: 0.9560, test_loss: 0.9341, test_f1: 0.5079
 epoch: 41, train_loss: 0.9525, test_loss: 0.9278, test_f1: 0.5152
 epoch: 42, train_loss: 0.9601, test_loss: 0.9277, test_f1: 0.5217
 epoch: 43, train_loss: 0.9420, test_loss: 0.9288, test_f1: 0.5167
 epoch: 44, train_loss: 0.9509, test_loss: 0.9357, test_f1: 0.5239
 epoch: 45, train_loss: 0.9468, test_loss: 0.9330, test_f1: 0.5156
 epoch: 46, train_loss: 0.9398, test_loss: 0.9244, test_f1: 0.5183
 epoch: 47, train_loss: 0.9344, test_loss: 0.9207, test_f1: 0.5224
 epoch: 48, train_loss: 0.9352, test_loss: 0.9273, test_f1: 0.5196
 epoch: 49, train_loss: 0.9321, test_loss: 0.9331, test_f1: 0.5168
 epoch: 50, train_loss: 0.9283, test_loss: 0.9237, test_f1: 0.5154
 epoch: 51, train_loss: 0.9233, test_loss: 0.9281, test_f1: 0.5236
 epoch: 52, train_loss: 0.9205, test_loss: 0.9252, test_f1: 0.5237
 epoch: 53, train_loss: 0.9252, test_loss: 0.9269, test_f1: 0.5157
 epoch: 54, train_loss: 0.9181, test_loss: 0.9248, test_f1: 0.5308
 epoch: 55, train_loss: 0.9065, test_loss: 0.9324, test_f1: 0.5210
 epoch: 56, train_loss: 0.9066, test_loss: 0.9315, test_f1: 0.5361
 epoch: 57, train_loss: 0.9081, test_loss: 0.9301, test_f1: 0.5262
 epoch: 58, train_loss: 0.9080, test_loss: 0.9299, test_f1: 0.5281
 epoch: 59, train_loss: 0.9059, test_loss: 0.9322, test_f1: 0.5365
 epoch: 60, train_loss: 0.9104, test_loss: 0.9316, test_f1: 0.5322
 epoch: 61, train_loss: 0.9045, test_loss: 0.9313, test_f1: 0.5340
 epoch: 62, train_loss: 0.9003, test_loss: 0.9345, test_f1: 0.5343
 epoch: 63, train_loss: 0.9031, test_loss: 0.9364, test_f1: 0.5350
 epoch: 64, train_loss: 0.9057, test_loss: 0.9320, test_f1: 0.5369
 epoch: 65, train_loss: 0.9076, test_loss: 0.9430, test_f1: 0.5310
 epoch: 66, train_loss: 0.8979, test_loss: 0.9373, test_f1: 0.5266
 epoch: 67, train_loss: 0.8918, test_loss: 0.9336, test_f1: 0.5321
 epoch: 68, train_loss: 0.9010, test_loss: 0.9350, test_f1: 0.5363
 epoch: 69, train_loss: 0.8900, test_loss: 0.9369, test_f1: 0.5445
 epoch: 70, train_loss: 0.8916, test_loss: 0.9473, test_f1: 0.5368
 epoch: 71, train_loss: 0.8883, test_loss: 0.9465, test_f1: 0.5378
 epoch: 72, train_loss: 0.8823, test_loss: 0.9377, test_f1: 0.5396
 epoch: 73, train_loss: 0.8840, test_loss: 0.9415, test_f1: 0.5337
 epoch: 74, train_loss: 0.8977, test_loss: 0.9421, test_f1: 0.5301
 epoch: 75, train_loss: 0.8941, test_loss: 0.9429, test_f1: 0.5366
 epoch: 76, train_loss: 0.8697, test_loss: 0.9489, test_f1: 0.5381
 epoch: 77, train_loss: 0.8902, test_loss: 0.9544, test_f1: 0.5300
 epoch: 78, train_loss: 0.8904, test_loss: 0.9485, test_f1: 0.5270
 epoch: 79, train_loss: 0.8814, test_loss: 0.9404, test_f1: 0.5460
 epoch: 80, train_loss: 0.8723, test_loss: 0.9403, test_f1: 0.5455
 epoch: 81, train_loss: 0.8818, test_loss: 0.9462, test_f1: 0.5365
 epoch: 82, train_loss: 0.8743, test_loss: 0.9505, test_f1: 0.5410
 epoch: 83, train_loss: 0.8778, test_loss: 0.9519, test_f1: 0.5418
 epoch: 84, train_loss: 0.8649, test_loss: 0.9464, test_f1: 0.5425
 epoch: 85, train_loss: 0.8755, test_loss: 0.9466, test_f1: 0.5409
 epoch: 86, train_loss: 0.8694, test_loss: 0.9584, test_f1: 0.5364
 epoch: 87, train_loss: 0.8676, test_loss: 0.9501, test_f1: 0.5352
 epoch: 88, train_loss: 0.8733, test_loss: 0.9538, test_f1: 0.5347
 epoch: 89, train_loss: 0.8721, test_loss: 0.9614, test_f1: 0.5354
 epoch: 90, train_loss: 0.8683, test_loss: 0.9462, test_f1: 0.5353
 epoch: 91, train_loss: 0.8501, test_loss: 0.9524, test_f1: 0.5307
 epoch: 92, train_loss: 0.8653, test_loss: 0.9635, test_f1: 0.5378
 epoch: 93, train_loss: 0.8607, test_loss: 0.9483, test_f1: 0.5266
 epoch: 94, train_loss: 0.8633, test_loss: 0.9494, test_f1: 0.5309
 epoch: 95, train_loss: 0.8540, test_loss: 0.9519, test_f1: 0.5365
 epoch: 96, train_loss: 0.8542, test_loss: 0.9630, test_f1: 0.5271
 epoch: 97, train_loss: 0.8646, test_loss: 0.9655, test_f1: 0.5311
 epoch: 98, train_loss: 0.8625, test_loss: 0.9516, test_f1: 0.5400
 epoch: 99, train_loss: 0.8657, test_loss: 0.9637, test_f1: 0.5257
##################ITERATION #4 ****************************************
 epoch: 0, train_loss: 1.3061, test_loss: 1.2635, test_f1: 0.2592
 epoch: 1, train_loss: 1.2555, test_loss: 1.2315, test_f1: 0.3674
 epoch: 2, train_loss: 1.2349, test_loss: 1.2107, test_f1: 0.3862
 epoch: 3, train_loss: 1.2268, test_loss: 1.1977, test_f1: 0.3871
 epoch: 4, train_loss: 1.2182, test_loss: 1.1856, test_f1: 0.4058
 epoch: 5, train_loss: 1.1991, test_loss: 1.1739, test_f1: 0.4184
 epoch: 6, train_loss: 1.1973, test_loss: 1.1607, test_f1: 0.4276
 epoch: 7, train_loss: 1.1828, test_loss: 1.1473, test_f1: 0.4532
 epoch: 8, train_loss: 1.1589, test_loss: 1.1290, test_f1: 0.4465
 epoch: 9, train_loss: 1.1537, test_loss: 1.1212, test_f1: 0.4619
 epoch: 10, train_loss: 1.1444, test_loss: 1.1091, test_f1: 0.4466
 epoch: 11, train_loss: 1.1369, test_loss: 1.0978, test_f1: 0.4571
 epoch: 12, train_loss: 1.1343, test_loss: 1.0927, test_f1: 0.4476
 epoch: 13, train_loss: 1.1157, test_loss: 1.0837, test_f1: 0.4453
 epoch: 14, train_loss: 1.1002, test_loss: 1.0733, test_f1: 0.4515
 epoch: 15, train_loss: 1.0964, test_loss: 1.0703, test_f1: 0.4394
 epoch: 16, train_loss: 1.0897, test_loss: 1.0624, test_f1: 0.4498
 epoch: 17, train_loss: 1.0819, test_loss: 1.0560, test_f1: 0.4554
 epoch: 18, train_loss: 1.0772, test_loss: 1.0424, test_f1: 0.4589
 epoch: 19, train_loss: 1.0793, test_loss: 1.0408, test_f1: 0.4579
 epoch: 20, train_loss: 1.0693, test_loss: 1.0449, test_f1: 0.4548
 epoch: 21, train_loss: 1.0586, test_loss: 1.0356, test_f1: 0.4631
 epoch: 22, train_loss: 1.0556, test_loss: 1.0324, test_f1: 0.4545
 epoch: 23, train_loss: 1.0530, test_loss: 1.0394, test_f1: 0.4621
 epoch: 24, train_loss: 1.0437, test_loss: 1.0343, test_f1: 0.4622
 epoch: 25, train_loss: 1.0424, test_loss: 1.0245, test_f1: 0.4676
 epoch: 26, train_loss: 1.0371, test_loss: 1.0208, test_f1: 0.4664
 epoch: 27, train_loss: 1.0267, test_loss: 1.0202, test_f1: 0.4716
 epoch: 28, train_loss: 1.0256, test_loss: 1.0076, test_f1: 0.4652
 epoch: 29, train_loss: 1.0261, test_loss: 1.0043, test_f1: 0.4697
 epoch: 30, train_loss: 1.0106, test_loss: 1.0041, test_f1: 0.4678
 epoch: 31, train_loss: 1.0086, test_loss: 1.0072, test_f1: 0.4664
 epoch: 32, train_loss: 1.0038, test_loss: 1.0193, test_f1: 0.4714
 epoch: 33, train_loss: 1.0090, test_loss: 1.0053, test_f1: 0.4674
 epoch: 34, train_loss: 1.0009, test_loss: 1.0057, test_f1: 0.4762
 epoch: 35, train_loss: 0.9946, test_loss: 1.0065, test_f1: 0.4621
 epoch: 36, train_loss: 1.0002, test_loss: 0.9938, test_f1: 0.4705
 epoch: 37, train_loss: 0.9902, test_loss: 0.9978, test_f1: 0.4701
 epoch: 38, train_loss: 0.9895, test_loss: 0.9898, test_f1: 0.4769
 epoch: 39, train_loss: 0.9803, test_loss: 1.0041, test_f1: 0.4599
 epoch: 40, train_loss: 0.9700, test_loss: 1.0038, test_f1: 0.4645
 epoch: 41, train_loss: 0.9736, test_loss: 1.0040, test_f1: 0.4697
 epoch: 42, train_loss: 0.9772, test_loss: 0.9950, test_f1: 0.4762
 epoch: 43, train_loss: 0.9680, test_loss: 0.9986, test_f1: 0.4611
 epoch: 44, train_loss: 0.9659, test_loss: 1.0001, test_f1: 0.4718
 epoch: 45, train_loss: 0.9556, test_loss: 0.9914, test_f1: 0.4757
 epoch: 46, train_loss: 0.9598, test_loss: 1.0072, test_f1: 0.4777
 epoch: 47, train_loss: 0.9675, test_loss: 1.0137, test_f1: 0.4754
 epoch: 48, train_loss: 0.9437, test_loss: 0.9868, test_f1: 0.4770
 epoch: 49, train_loss: 0.9532, test_loss: 1.0004, test_f1: 0.4822
 epoch: 50, train_loss: 0.9439, test_loss: 0.9956, test_f1: 0.4709
 epoch: 51, train_loss: 0.9354, test_loss: 0.9987, test_f1: 0.4776
 epoch: 52, train_loss: 0.9428, test_loss: 0.9912, test_f1: 0.4797
 epoch: 53, train_loss: 0.9396, test_loss: 1.0105, test_f1: 0.4754
 epoch: 54, train_loss: 0.9364, test_loss: 0.9948, test_f1: 0.4787
 epoch: 55, train_loss: 0.9392, test_loss: 1.0005, test_f1: 0.4765
 epoch: 56, train_loss: 0.9400, test_loss: 0.9940, test_f1: 0.4754
 epoch: 57, train_loss: 0.9312, test_loss: 0.9881, test_f1: 0.4774
 epoch: 58, train_loss: 0.9268, test_loss: 0.9904, test_f1: 0.4824
 epoch: 59, train_loss: 0.9270, test_loss: 0.9899, test_f1: 0.4913
 epoch: 60, train_loss: 0.9390, test_loss: 0.9933, test_f1: 0.4867
 epoch: 61, train_loss: 0.9249, test_loss: 0.9801, test_f1: 0.4872
 epoch: 62, train_loss: 0.9263, test_loss: 0.9910, test_f1: 0.4854
 epoch: 63, train_loss: 0.9268, test_loss: 0.9897, test_f1: 0.4864
 epoch: 64, train_loss: 0.9214, test_loss: 0.9845, test_f1: 0.4886
 epoch: 65, train_loss: 0.9229, test_loss: 0.9850, test_f1: 0.4869
 epoch: 66, train_loss: 0.9126, test_loss: 0.9839, test_f1: 0.4964
 epoch: 67, train_loss: 0.9177, test_loss: 0.9998, test_f1: 0.4825
 epoch: 68, train_loss: 0.9107, test_loss: 0.9892, test_f1: 0.4906
 epoch: 69, train_loss: 0.9165, test_loss: 0.9921, test_f1: 0.4910
 epoch: 70, train_loss: 0.9028, test_loss: 0.9869, test_f1: 0.4917
 epoch: 71, train_loss: 0.9028, test_loss: 0.9935, test_f1: 0.4911
 epoch: 72, train_loss: 0.9113, test_loss: 0.9836, test_f1: 0.4906
 epoch: 73, train_loss: 0.9082, test_loss: 0.9903, test_f1: 0.4967
 epoch: 74, train_loss: 0.9044, test_loss: 0.9978, test_f1: 0.4965
 epoch: 75, train_loss: 0.9031, test_loss: 0.9869, test_f1: 0.4944
 epoch: 76, train_loss: 0.9114, test_loss: 0.9837, test_f1: 0.4948
 epoch: 77, train_loss: 0.9047, test_loss: 0.9871, test_f1: 0.4963
 epoch: 78, train_loss: 0.9036, test_loss: 0.9774, test_f1: 0.4991
 epoch: 79, train_loss: 0.9059, test_loss: 0.9890, test_f1: 0.4915
 epoch: 80, train_loss: 0.9026, test_loss: 0.9770, test_f1: 0.5042
 epoch: 81, train_loss: 0.8973, test_loss: 0.9871, test_f1: 0.5009
 epoch: 82, train_loss: 0.8952, test_loss: 0.9834, test_f1: 0.4892
 epoch: 83, train_loss: 0.9047, test_loss: 0.9820, test_f1: 0.5026
 epoch: 84, train_loss: 0.9011, test_loss: 0.9912, test_f1: 0.5038
 epoch: 85, train_loss: 0.8905, test_loss: 0.9860, test_f1: 0.4999
 epoch: 86, train_loss: 0.8990, test_loss: 0.9872, test_f1: 0.4981
 epoch: 87, train_loss: 0.9002, test_loss: 0.9925, test_f1: 0.5011
 epoch: 88, train_loss: 0.8973, test_loss: 0.9895, test_f1: 0.5061
 epoch: 89, train_loss: 0.8957, test_loss: 0.9852, test_f1: 0.5113
 epoch: 90, train_loss: 0.8847, test_loss: 0.9869, test_f1: 0.5188
 epoch: 91, train_loss: 0.8980, test_loss: 0.9953, test_f1: 0.4929
 epoch: 92, train_loss: 0.8839, test_loss: 0.9908, test_f1: 0.5056
 epoch: 93, train_loss: 0.8934, test_loss: 0.9883, test_f1: 0.5061
 epoch: 94, train_loss: 0.8877, test_loss: 0.9887, test_f1: 0.5188
 epoch: 95, train_loss: 0.8765, test_loss: 0.9968, test_f1: 0.4980
 epoch: 96, train_loss: 0.8902, test_loss: 0.9956, test_f1: 0.5121
 epoch: 97, train_loss: 0.8819, test_loss: 1.0016, test_f1: 0.5059
 epoch: 98, train_loss: 0.8727, test_loss: 0.9938, test_f1: 0.5031
 epoch: 99, train_loss: 0.8834, test_loss: 0.9967, test_f1: 0.5062
##################ITERATION #5 ****************************************
 epoch: 0, train_loss: 1.3099, test_loss: 1.2365, test_f1: 0.2815
 epoch: 1, train_loss: 1.2499, test_loss: 1.1917, test_f1: 0.3774
 epoch: 2, train_loss: 1.2385, test_loss: 1.1729, test_f1: 0.3804
 epoch: 3, train_loss: 1.2209, test_loss: 1.1617, test_f1: 0.4011
 epoch: 4, train_loss: 1.2085, test_loss: 1.1539, test_f1: 0.4050
 epoch: 5, train_loss: 1.1885, test_loss: 1.1391, test_f1: 0.4210
 epoch: 6, train_loss: 1.1828, test_loss: 1.1323, test_f1: 0.4347
 epoch: 7, train_loss: 1.1707, test_loss: 1.1239, test_f1: 0.4376
 epoch: 8, train_loss: 1.1655, test_loss: 1.1130, test_f1: 0.4697
 epoch: 9, train_loss: 1.1435, test_loss: 1.1033, test_f1: 0.4680
 epoch: 10, train_loss: 1.1464, test_loss: 1.0916, test_f1: 0.4648
 epoch: 11, train_loss: 1.1297, test_loss: 1.0821, test_f1: 0.4773
 epoch: 12, train_loss: 1.1239, test_loss: 1.0790, test_f1: 0.4677
 epoch: 13, train_loss: 1.1220, test_loss: 1.0721, test_f1: 0.4733
 epoch: 14, train_loss: 1.1061, test_loss: 1.0721, test_f1: 0.4663
 epoch: 15, train_loss: 1.1061, test_loss: 1.0689, test_f1: 0.4620
 epoch: 16, train_loss: 1.0911, test_loss: 1.0675, test_f1: 0.4692
 epoch: 17, train_loss: 1.0946, test_loss: 1.0580, test_f1: 0.4751
 epoch: 18, train_loss: 1.0884, test_loss: 1.0543, test_f1: 0.4630
 epoch: 19, train_loss: 1.0711, test_loss: 1.0518, test_f1: 0.4681
 epoch: 20, train_loss: 1.0726, test_loss: 1.0495, test_f1: 0.4708
 epoch: 21, train_loss: 1.0618, test_loss: 1.0365, test_f1: 0.4776
 epoch: 22, train_loss: 1.0556, test_loss: 1.0299, test_f1: 0.4697
 epoch: 23, train_loss: 1.0536, test_loss: 1.0419, test_f1: 0.4752
 epoch: 24, train_loss: 1.0484, test_loss: 1.0321, test_f1: 0.4680
 epoch: 25, train_loss: 1.0466, test_loss: 1.0306, test_f1: 0.4744
 epoch: 26, train_loss: 1.0429, test_loss: 1.0302, test_f1: 0.4790
 epoch: 27, train_loss: 1.0382, test_loss: 1.0183, test_f1: 0.4758
 epoch: 28, train_loss: 1.0288, test_loss: 1.0192, test_f1: 0.4716
 epoch: 29, train_loss: 1.0270, test_loss: 1.0102, test_f1: 0.4827
 epoch: 30, train_loss: 1.0218, test_loss: 1.0138, test_f1: 0.4811
 epoch: 31, train_loss: 1.0214, test_loss: 1.0118, test_f1: 0.4747
 epoch: 32, train_loss: 1.0196, test_loss: 1.0212, test_f1: 0.4805
 epoch: 33, train_loss: 1.0026, test_loss: 1.0050, test_f1: 0.4702
 epoch: 34, train_loss: 1.0125, test_loss: 1.0054, test_f1: 0.4693
 epoch: 35, train_loss: 1.0093, test_loss: 1.0057, test_f1: 0.4821
 epoch: 36, train_loss: 0.9978, test_loss: 0.9988, test_f1: 0.4823
 epoch: 37, train_loss: 0.9907, test_loss: 1.0088, test_f1: 0.4860
 epoch: 38, train_loss: 0.9872, test_loss: 1.0082, test_f1: 0.4768
 epoch: 39, train_loss: 0.9923, test_loss: 1.0032, test_f1: 0.4845
 epoch: 40, train_loss: 0.9843, test_loss: 0.9907, test_f1: 0.4880
 epoch: 41, train_loss: 0.9842, test_loss: 1.0105, test_f1: 0.4815
 epoch: 42, train_loss: 0.9769, test_loss: 0.9894, test_f1: 0.4824
 epoch: 43, train_loss: 0.9763, test_loss: 0.9987, test_f1: 0.4780
 epoch: 44, train_loss: 0.9810, test_loss: 0.9859, test_f1: 0.4907
 epoch: 45, train_loss: 0.9726, test_loss: 0.9863, test_f1: 0.4869
 epoch: 46, train_loss: 0.9680, test_loss: 0.9830, test_f1: 0.4840
 epoch: 47, train_loss: 0.9622, test_loss: 0.9808, test_f1: 0.4887
 epoch: 48, train_loss: 0.9638, test_loss: 0.9790, test_f1: 0.4981
 epoch: 49, train_loss: 0.9595, test_loss: 0.9731, test_f1: 0.4955
 epoch: 50, train_loss: 0.9533, test_loss: 0.9919, test_f1: 0.4865
 epoch: 51, train_loss: 0.9522, test_loss: 0.9858, test_f1: 0.4904
 epoch: 52, train_loss: 0.9531, test_loss: 0.9883, test_f1: 0.4928
 epoch: 53, train_loss: 0.9535, test_loss: 0.9897, test_f1: 0.4928
 epoch: 54, train_loss: 0.9591, test_loss: 0.9963, test_f1: 0.4939
 epoch: 55, train_loss: 0.9531, test_loss: 0.9761, test_f1: 0.4997
 epoch: 56, train_loss: 0.9427, test_loss: 0.9750, test_f1: 0.4907
 epoch: 57, train_loss: 0.9456, test_loss: 0.9897, test_f1: 0.4963
 epoch: 58, train_loss: 0.9462, test_loss: 0.9797, test_f1: 0.4940
 epoch: 59, train_loss: 0.9331, test_loss: 0.9799, test_f1: 0.4925
 epoch: 60, train_loss: 0.9471, test_loss: 0.9843, test_f1: 0.4888
 epoch: 61, train_loss: 0.9386, test_loss: 0.9820, test_f1: 0.4981
 epoch: 62, train_loss: 0.9456, test_loss: 1.0040, test_f1: 0.4955
 epoch: 63, train_loss: 0.9317, test_loss: 0.9808, test_f1: 0.4927
 epoch: 64, train_loss: 0.9359, test_loss: 0.9908, test_f1: 0.4944
 epoch: 65, train_loss: 0.9343, test_loss: 0.9768, test_f1: 0.4916
 epoch: 66, train_loss: 0.9321, test_loss: 0.9877, test_f1: 0.4956
 epoch: 67, train_loss: 0.9343, test_loss: 0.9946, test_f1: 0.4855
 epoch: 68, train_loss: 0.9317, test_loss: 0.9804, test_f1: 0.4985
 epoch: 69, train_loss: 0.9271, test_loss: 0.9783, test_f1: 0.4936
 epoch: 70, train_loss: 0.9278, test_loss: 0.9871, test_f1: 0.4958
 epoch: 71, train_loss: 0.9321, test_loss: 0.9940, test_f1: 0.4930
 epoch: 72, train_loss: 0.9316, test_loss: 1.0057, test_f1: 0.5002
 epoch: 73, train_loss: 0.9246, test_loss: 0.9714, test_f1: 0.4934
 epoch: 74, train_loss: 0.9263, test_loss: 0.9939, test_f1: 0.4879
 epoch: 75, train_loss: 0.9288, test_loss: 0.9906, test_f1: 0.4897
 epoch: 76, train_loss: 0.9207, test_loss: 0.9957, test_f1: 0.4968
 epoch: 77, train_loss: 0.9220, test_loss: 0.9884, test_f1: 0.4866
 epoch: 78, train_loss: 0.9184, test_loss: 0.9794, test_f1: 0.4964
 epoch: 79, train_loss: 0.9163, test_loss: 0.9936, test_f1: 0.5000
 epoch: 80, train_loss: 0.9064, test_loss: 0.9814, test_f1: 0.4994
 epoch: 81, train_loss: 0.9198, test_loss: 0.9822, test_f1: 0.4966
 epoch: 82, train_loss: 0.9113, test_loss: 0.9878, test_f1: 0.5038
 epoch: 83, train_loss: 0.9219, test_loss: 0.9905, test_f1: 0.4996
 epoch: 84, train_loss: 0.9142, test_loss: 0.9845, test_f1: 0.5085
 epoch: 85, train_loss: 0.9111, test_loss: 0.9896, test_f1: 0.4976
 epoch: 86, train_loss: 0.9046, test_loss: 0.9896, test_f1: 0.4944
 epoch: 87, train_loss: 0.9080, test_loss: 0.9838, test_f1: 0.5042
 epoch: 88, train_loss: 0.8997, test_loss: 0.9882, test_f1: 0.5003
 epoch: 89, train_loss: 0.8945, test_loss: 0.9906, test_f1: 0.4857
 epoch: 90, train_loss: 0.9039, test_loss: 0.9924, test_f1: 0.4948
 epoch: 91, train_loss: 0.9024, test_loss: 0.9893, test_f1: 0.5099
 epoch: 92, train_loss: 0.8982, test_loss: 1.0105, test_f1: 0.5075
 epoch: 93, train_loss: 0.9015, test_loss: 0.9928, test_f1: 0.5067
 epoch: 94, train_loss: 0.9012, test_loss: 0.9879, test_f1: 0.5044
 epoch: 95, train_loss: 0.8961, test_loss: 0.9796, test_f1: 0.5052
 epoch: 96, train_loss: 0.8972, test_loss: 0.9916, test_f1: 0.5024
 epoch: 97, train_loss: 0.9064, test_loss: 0.9880, test_f1: 0.5030
 epoch: 98, train_loss: 0.9008, test_loss: 0.9868, test_f1: 0.5004
 epoch: 99, train_loss: 0.9005, test_loss: 1.0001, test_f1: 0.5078
##################ITERATION #6 ****************************************
 epoch: 0, train_loss: 1.3187, test_loss: 1.2430, test_f1: 0.2889
 epoch: 1, train_loss: 1.2568, test_loss: 1.2011, test_f1: 0.3899
 epoch: 2, train_loss: 1.2279, test_loss: 1.1799, test_f1: 0.4091
 epoch: 3, train_loss: 1.2199, test_loss: 1.1574, test_f1: 0.4388
 epoch: 4, train_loss: 1.1980, test_loss: 1.1434, test_f1: 0.4064
 epoch: 5, train_loss: 1.1814, test_loss: 1.1276, test_f1: 0.4437
 epoch: 6, train_loss: 1.1691, test_loss: 1.1205, test_f1: 0.4547
 epoch: 7, train_loss: 1.1656, test_loss: 1.1150, test_f1: 0.4419
 epoch: 8, train_loss: 1.1499, test_loss: 1.0986, test_f1: 0.4487
 epoch: 9, train_loss: 1.1344, test_loss: 1.0907, test_f1: 0.4323
 epoch: 10, train_loss: 1.1408, test_loss: 1.0847, test_f1: 0.4382
 epoch: 11, train_loss: 1.1273, test_loss: 1.0755, test_f1: 0.4470
 epoch: 12, train_loss: 1.1213, test_loss: 1.0669, test_f1: 0.4425
 epoch: 13, train_loss: 1.1242, test_loss: 1.0621, test_f1: 0.4488
 epoch: 14, train_loss: 1.1071, test_loss: 1.0559, test_f1: 0.4577
 epoch: 15, train_loss: 1.1000, test_loss: 1.0507, test_f1: 0.4520
 epoch: 16, train_loss: 1.0921, test_loss: 1.0474, test_f1: 0.4550
 epoch: 17, train_loss: 1.0826, test_loss: 1.0398, test_f1: 0.4640
 epoch: 18, train_loss: 1.0840, test_loss: 1.0323, test_f1: 0.4664
 epoch: 19, train_loss: 1.0717, test_loss: 1.0270, test_f1: 0.4797
 epoch: 20, train_loss: 1.0783, test_loss: 1.0214, test_f1: 0.4818
 epoch: 21, train_loss: 1.0581, test_loss: 1.0205, test_f1: 0.4714
 epoch: 22, train_loss: 1.0576, test_loss: 1.0144, test_f1: 0.4868
 epoch: 23, train_loss: 1.0583, test_loss: 1.0072, test_f1: 0.4782
 epoch: 24, train_loss: 1.0398, test_loss: 1.0046, test_f1: 0.4789
 epoch: 25, train_loss: 1.0464, test_loss: 1.0004, test_f1: 0.4873
 epoch: 26, train_loss: 1.0493, test_loss: 0.9941, test_f1: 0.4957
 epoch: 27, train_loss: 1.0286, test_loss: 0.9944, test_f1: 0.4833
 epoch: 28, train_loss: 1.0360, test_loss: 0.9858, test_f1: 0.5037
 epoch: 29, train_loss: 1.0247, test_loss: 0.9900, test_f1: 0.4892
 epoch: 30, train_loss: 1.0130, test_loss: 0.9899, test_f1: 0.4715
 epoch: 31, train_loss: 1.0182, test_loss: 0.9857, test_f1: 0.4720
 epoch: 32, train_loss: 1.0019, test_loss: 0.9823, test_f1: 0.4961
 epoch: 33, train_loss: 1.0067, test_loss: 0.9810, test_f1: 0.4844
 epoch: 34, train_loss: 1.0044, test_loss: 0.9788, test_f1: 0.4844
 epoch: 35, train_loss: 1.0052, test_loss: 0.9707, test_f1: 0.4942
 epoch: 36, train_loss: 0.9921, test_loss: 0.9682, test_f1: 0.4884
 epoch: 37, train_loss: 0.9883, test_loss: 0.9667, test_f1: 0.4887
 epoch: 38, train_loss: 0.9869, test_loss: 0.9670, test_f1: 0.4922
 epoch: 39, train_loss: 0.9743, test_loss: 0.9672, test_f1: 0.4892
 epoch: 40, train_loss: 0.9723, test_loss: 0.9618, test_f1: 0.4985
 epoch: 41, train_loss: 0.9661, test_loss: 0.9580, test_f1: 0.5049
 epoch: 42, train_loss: 0.9705, test_loss: 0.9522, test_f1: 0.5035
 epoch: 43, train_loss: 0.9578, test_loss: 0.9458, test_f1: 0.5078
 epoch: 44, train_loss: 0.9588, test_loss: 0.9605, test_f1: 0.5070
 epoch: 45, train_loss: 0.9624, test_loss: 0.9509, test_f1: 0.4939
 epoch: 46, train_loss: 0.9460, test_loss: 0.9499, test_f1: 0.5083
 epoch: 47, train_loss: 0.9516, test_loss: 0.9475, test_f1: 0.5062
 epoch: 48, train_loss: 0.9467, test_loss: 0.9496, test_f1: 0.5048
 epoch: 49, train_loss: 0.9515, test_loss: 0.9518, test_f1: 0.5097
 epoch: 50, train_loss: 0.9325, test_loss: 0.9434, test_f1: 0.5131
 epoch: 51, train_loss: 0.9383, test_loss: 0.9511, test_f1: 0.5174
 epoch: 52, train_loss: 0.9359, test_loss: 0.9474, test_f1: 0.5129
 epoch: 53, train_loss: 0.9267, test_loss: 0.9401, test_f1: 0.5177
 epoch: 54, train_loss: 0.9397, test_loss: 0.9437, test_f1: 0.5131
 epoch: 55, train_loss: 0.9211, test_loss: 0.9385, test_f1: 0.5060
 epoch: 56, train_loss: 0.9315, test_loss: 0.9410, test_f1: 0.5213
 epoch: 57, train_loss: 0.9093, test_loss: 0.9399, test_f1: 0.5178
 epoch: 58, train_loss: 0.9253, test_loss: 0.9438, test_f1: 0.5119
 epoch: 59, train_loss: 0.9262, test_loss: 0.9366, test_f1: 0.5199
 epoch: 60, train_loss: 0.9174, test_loss: 0.9442, test_f1: 0.5230
 epoch: 61, train_loss: 0.9163, test_loss: 0.9376, test_f1: 0.5154
 epoch: 62, train_loss: 0.9073, test_loss: 0.9357, test_f1: 0.5228
 epoch: 63, train_loss: 0.9149, test_loss: 0.9466, test_f1: 0.5167
 epoch: 64, train_loss: 0.9192, test_loss: 0.9430, test_f1: 0.5228
 epoch: 65, train_loss: 0.9065, test_loss: 0.9499, test_f1: 0.5149
 epoch: 66, train_loss: 0.9026, test_loss: 0.9455, test_f1: 0.5216
 epoch: 67, train_loss: 0.9078, test_loss: 0.9502, test_f1: 0.5191
 epoch: 68, train_loss: 0.9134, test_loss: 0.9504, test_f1: 0.5238
 epoch: 69, train_loss: 0.9031, test_loss: 0.9426, test_f1: 0.5216
 epoch: 70, train_loss: 0.9145, test_loss: 0.9499, test_f1: 0.5175
 epoch: 71, train_loss: 0.9058, test_loss: 0.9474, test_f1: 0.5124
 epoch: 72, train_loss: 0.8945, test_loss: 0.9423, test_f1: 0.5293
 epoch: 73, train_loss: 0.9120, test_loss: 0.9575, test_f1: 0.5227
 epoch: 74, train_loss: 0.8942, test_loss: 0.9505, test_f1: 0.5162
 epoch: 75, train_loss: 0.8964, test_loss: 0.9470, test_f1: 0.5211
 epoch: 76, train_loss: 0.8905, test_loss: 0.9588, test_f1: 0.5147
 epoch: 77, train_loss: 0.8958, test_loss: 0.9545, test_f1: 0.5248
 epoch: 78, train_loss: 0.8976, test_loss: 0.9443, test_f1: 0.5214
 epoch: 79, train_loss: 0.8944, test_loss: 0.9449, test_f1: 0.5222
 epoch: 80, train_loss: 0.8941, test_loss: 0.9550, test_f1: 0.5138
 epoch: 81, train_loss: 0.8785, test_loss: 0.9538, test_f1: 0.5200
 epoch: 82, train_loss: 0.8774, test_loss: 0.9521, test_f1: 0.5158
 epoch: 83, train_loss: 0.8883, test_loss: 0.9668, test_f1: 0.5203
 epoch: 84, train_loss: 0.8838, test_loss: 0.9523, test_f1: 0.5225
 epoch: 85, train_loss: 0.8773, test_loss: 0.9484, test_f1: 0.5283
 epoch: 86, train_loss: 0.8699, test_loss: 0.9590, test_f1: 0.5136
 epoch: 87, train_loss: 0.8740, test_loss: 0.9452, test_f1: 0.5138
 epoch: 88, train_loss: 0.8826, test_loss: 0.9553, test_f1: 0.5129
 epoch: 89, train_loss: 0.8739, test_loss: 0.9557, test_f1: 0.5208
 epoch: 90, train_loss: 0.8643, test_loss: 0.9553, test_f1: 0.5116
 epoch: 91, train_loss: 0.8625, test_loss: 0.9652, test_f1: 0.5133
 epoch: 92, train_loss: 0.8642, test_loss: 0.9567, test_f1: 0.5139
 epoch: 93, train_loss: 0.8764, test_loss: 0.9607, test_f1: 0.5191
 epoch: 94, train_loss: 0.8708, test_loss: 0.9469, test_f1: 0.5220
 epoch: 95, train_loss: 0.8646, test_loss: 0.9690, test_f1: 0.5106
 epoch: 96, train_loss: 0.8653, test_loss: 0.9537, test_f1: 0.5179
 epoch: 97, train_loss: 0.8774, test_loss: 0.9717, test_f1: 0.5122
 epoch: 98, train_loss: 0.8772, test_loss: 0.9626, test_f1: 0.5088
 epoch: 99, train_loss: 0.8680, test_loss: 0.9673, test_f1: 0.5138
##################ITERATION #7 ****************************************
 epoch: 0, train_loss: 1.3109, test_loss: 1.2044, test_f1: 0.3971
 epoch: 1, train_loss: 1.2441, test_loss: 1.1848, test_f1: 0.4180
 epoch: 2, train_loss: 1.2267, test_loss: 1.1655, test_f1: 0.4144
 epoch: 3, train_loss: 1.2020, test_loss: 1.1507, test_f1: 0.4281
 epoch: 4, train_loss: 1.1894, test_loss: 1.1396, test_f1: 0.4266
 epoch: 5, train_loss: 1.1831, test_loss: 1.1262, test_f1: 0.4342
 epoch: 6, train_loss: 1.1769, test_loss: 1.1195, test_f1: 0.4419
 epoch: 7, train_loss: 1.1564, test_loss: 1.1085, test_f1: 0.4493
 epoch: 8, train_loss: 1.1433, test_loss: 1.0944, test_f1: 0.4493
 epoch: 9, train_loss: 1.1429, test_loss: 1.0867, test_f1: 0.4422
 epoch: 10, train_loss: 1.1324, test_loss: 1.0806, test_f1: 0.4423
 epoch: 11, train_loss: 1.1215, test_loss: 1.0687, test_f1: 0.4420
 epoch: 12, train_loss: 1.1151, test_loss: 1.0577, test_f1: 0.4670
 epoch: 13, train_loss: 1.1201, test_loss: 1.0563, test_f1: 0.4597
 epoch: 14, train_loss: 1.1043, test_loss: 1.0455, test_f1: 0.4523
 epoch: 15, train_loss: 1.0963, test_loss: 1.0428, test_f1: 0.4601
 epoch: 16, train_loss: 1.0917, test_loss: 1.0340, test_f1: 0.4585
 epoch: 17, train_loss: 1.0853, test_loss: 1.0236, test_f1: 0.4723
 epoch: 18, train_loss: 1.0823, test_loss: 1.0186, test_f1: 0.4625
 epoch: 19, train_loss: 1.0713, test_loss: 1.0169, test_f1: 0.4486
 epoch: 20, train_loss: 1.0579, test_loss: 1.0080, test_f1: 0.4587
 epoch: 21, train_loss: 1.0588, test_loss: 1.0056, test_f1: 0.4721
 epoch: 22, train_loss: 1.0516, test_loss: 1.0049, test_f1: 0.4457
 epoch: 23, train_loss: 1.0411, test_loss: 1.0049, test_f1: 0.4356
 epoch: 24, train_loss: 1.0314, test_loss: 0.9985, test_f1: 0.4683
 epoch: 25, train_loss: 1.0349, test_loss: 0.9965, test_f1: 0.4673
 epoch: 26, train_loss: 1.0236, test_loss: 0.9858, test_f1: 0.4715
 epoch: 27, train_loss: 1.0252, test_loss: 0.9889, test_f1: 0.4592
 epoch: 28, train_loss: 1.0061, test_loss: 0.9801, test_f1: 0.4761
 epoch: 29, train_loss: 1.0189, test_loss: 0.9766, test_f1: 0.4794
 epoch: 30, train_loss: 1.0058, test_loss: 0.9857, test_f1: 0.4618
 epoch: 31, train_loss: 1.0147, test_loss: 0.9747, test_f1: 0.4821
 epoch: 32, train_loss: 0.9950, test_loss: 0.9748, test_f1: 0.4819
 epoch: 33, train_loss: 0.9819, test_loss: 0.9706, test_f1: 0.4750
 epoch: 34, train_loss: 0.9933, test_loss: 0.9744, test_f1: 0.4601
 epoch: 35, train_loss: 0.9802, test_loss: 0.9664, test_f1: 0.4649
 epoch: 36, train_loss: 0.9798, test_loss: 0.9635, test_f1: 0.4801
 epoch: 37, train_loss: 0.9799, test_loss: 0.9588, test_f1: 0.4750
 epoch: 38, train_loss: 0.9793, test_loss: 0.9708, test_f1: 0.4770
 epoch: 39, train_loss: 0.9748, test_loss: 0.9645, test_f1: 0.4821
 epoch: 40, train_loss: 0.9747, test_loss: 0.9673, test_f1: 0.4835
 epoch: 41, train_loss: 0.9677, test_loss: 0.9760, test_f1: 0.4731
 epoch: 42, train_loss: 0.9695, test_loss: 0.9656, test_f1: 0.4940
 epoch: 43, train_loss: 0.9550, test_loss: 0.9669, test_f1: 0.4939
 epoch: 44, train_loss: 0.9538, test_loss: 0.9706, test_f1: 0.4992
 epoch: 45, train_loss: 0.9475, test_loss: 0.9767, test_f1: 0.4898
 epoch: 46, train_loss: 0.9561, test_loss: 0.9685, test_f1: 0.4997
 epoch: 47, train_loss: 0.9429, test_loss: 0.9797, test_f1: 0.5033
 epoch: 48, train_loss: 0.9365, test_loss: 0.9796, test_f1: 0.4848
 epoch: 49, train_loss: 0.9460, test_loss: 0.9818, test_f1: 0.4818
 epoch: 50, train_loss: 0.9457, test_loss: 0.9721, test_f1: 0.5031
 epoch: 51, train_loss: 0.9312, test_loss: 0.9658, test_f1: 0.4997
 epoch: 52, train_loss: 0.9405, test_loss: 0.9805, test_f1: 0.5008
 epoch: 53, train_loss: 0.9443, test_loss: 0.9762, test_f1: 0.5026
 epoch: 54, train_loss: 0.9322, test_loss: 0.9700, test_f1: 0.5026
 epoch: 55, train_loss: 0.9220, test_loss: 0.9788, test_f1: 0.5068
 epoch: 56, train_loss: 0.9284, test_loss: 0.9698, test_f1: 0.5052
 epoch: 57, train_loss: 0.9224, test_loss: 0.9743, test_f1: 0.5093
 epoch: 58, train_loss: 0.9281, test_loss: 0.9866, test_f1: 0.5120
 epoch: 59, train_loss: 0.9276, test_loss: 0.9942, test_f1: 0.5036
 epoch: 60, train_loss: 0.9249, test_loss: 0.9973, test_f1: 0.5037
 epoch: 61, train_loss: 0.9185, test_loss: 0.9879, test_f1: 0.5022
 epoch: 62, train_loss: 0.9204, test_loss: 0.9864, test_f1: 0.5106
 epoch: 63, train_loss: 0.9200, test_loss: 0.9891, test_f1: 0.5152
 epoch: 64, train_loss: 0.9176, test_loss: 0.9776, test_f1: 0.5138
 epoch: 65, train_loss: 0.9251, test_loss: 0.9831, test_f1: 0.5080
 epoch: 66, train_loss: 0.9107, test_loss: 0.9851, test_f1: 0.5044
 epoch: 67, train_loss: 0.9168, test_loss: 0.9928, test_f1: 0.5150
 epoch: 68, train_loss: 0.9251, test_loss: 0.9910, test_f1: 0.5098
 epoch: 69, train_loss: 0.9090, test_loss: 0.9992, test_f1: 0.5013
 epoch: 70, train_loss: 0.9039, test_loss: 1.0034, test_f1: 0.5021
 epoch: 71, train_loss: 0.9076, test_loss: 0.9915, test_f1: 0.5136
 epoch: 72, train_loss: 0.9050, test_loss: 0.9958, test_f1: 0.5139
 epoch: 73, train_loss: 0.9098, test_loss: 0.9953, test_f1: 0.5189
 epoch: 74, train_loss: 0.8951, test_loss: 1.0048, test_f1: 0.5042
 epoch: 75, train_loss: 0.9080, test_loss: 1.0042, test_f1: 0.5044
 epoch: 76, train_loss: 0.9063, test_loss: 1.0236, test_f1: 0.5004
 epoch: 77, train_loss: 0.9022, test_loss: 1.0140, test_f1: 0.5178
 epoch: 78, train_loss: 0.9006, test_loss: 1.0083, test_f1: 0.5024
 epoch: 79, train_loss: 0.8996, test_loss: 1.0075, test_f1: 0.5128
 epoch: 80, train_loss: 0.9022, test_loss: 0.9990, test_f1: 0.5099
 epoch: 81, train_loss: 0.8918, test_loss: 0.9986, test_f1: 0.5069
 epoch: 82, train_loss: 0.8906, test_loss: 1.0036, test_f1: 0.5020
 epoch: 83, train_loss: 0.8794, test_loss: 1.0112, test_f1: 0.5058
 epoch: 84, train_loss: 0.8984, test_loss: 1.0136, test_f1: 0.5012
 epoch: 85, train_loss: 0.8931, test_loss: 1.0051, test_f1: 0.5024
 epoch: 86, train_loss: 0.8849, test_loss: 1.0153, test_f1: 0.5042
 epoch: 87, train_loss: 0.8859, test_loss: 0.9986, test_f1: 0.5091
 epoch: 88, train_loss: 0.8860, test_loss: 1.0098, test_f1: 0.5078
 epoch: 89, train_loss: 0.8838, test_loss: 1.0088, test_f1: 0.5199
 epoch: 90, train_loss: 0.8778, test_loss: 1.0018, test_f1: 0.5163
 epoch: 91, train_loss: 0.8844, test_loss: 1.0106, test_f1: 0.5136
 epoch: 92, train_loss: 0.8828, test_loss: 1.0187, test_f1: 0.5143
 epoch: 93, train_loss: 0.8862, test_loss: 1.0035, test_f1: 0.5151
 epoch: 94, train_loss: 0.8692, test_loss: 1.0053, test_f1: 0.5173
 epoch: 95, train_loss: 0.8739, test_loss: 1.0211, test_f1: 0.5286
 epoch: 96, train_loss: 0.8730, test_loss: 1.0166, test_f1: 0.5167
 epoch: 97, train_loss: 0.8706, test_loss: 1.0101, test_f1: 0.5210
 epoch: 98, train_loss: 0.8745, test_loss: 1.0110, test_f1: 0.5162
 epoch: 99, train_loss: 0.8768, test_loss: 1.0095, test_f1: 0.5115
##################ITERATION #8 ****************************************
 epoch: 0, train_loss: 1.3299, test_loss: 1.2193, test_f1: 0.2954
 epoch: 1, train_loss: 1.2581, test_loss: 1.1877, test_f1: 0.3676
 epoch: 2, train_loss: 1.2281, test_loss: 1.1680, test_f1: 0.4185
 epoch: 3, train_loss: 1.2211, test_loss: 1.1480, test_f1: 0.4279
 epoch: 4, train_loss: 1.1915, test_loss: 1.1307, test_f1: 0.4318
 epoch: 5, train_loss: 1.1732, test_loss: 1.1148, test_f1: 0.4365
 epoch: 6, train_loss: 1.1695, test_loss: 1.1009, test_f1: 0.4360
 epoch: 7, train_loss: 1.1456, test_loss: 1.0933, test_f1: 0.4561
 epoch: 8, train_loss: 1.1448, test_loss: 1.0808, test_f1: 0.4587
 epoch: 9, train_loss: 1.1214, test_loss: 1.0695, test_f1: 0.4578
 epoch: 10, train_loss: 1.1223, test_loss: 1.0611, test_f1: 0.4730
 epoch: 11, train_loss: 1.1089, test_loss: 1.0545, test_f1: 0.4597
 epoch: 12, train_loss: 1.1090, test_loss: 1.0443, test_f1: 0.4723
 epoch: 13, train_loss: 1.0962, test_loss: 1.0456, test_f1: 0.4692
 epoch: 14, train_loss: 1.0852, test_loss: 1.0318, test_f1: 0.4764
 epoch: 15, train_loss: 1.0873, test_loss: 1.0319, test_f1: 0.4643
 epoch: 16, train_loss: 1.0625, test_loss: 1.0200, test_f1: 0.4713
 epoch: 17, train_loss: 1.0746, test_loss: 1.0172, test_f1: 0.4620
 epoch: 18, train_loss: 1.0584, test_loss: 1.0197, test_f1: 0.4680
 epoch: 19, train_loss: 1.0574, test_loss: 1.0118, test_f1: 0.4607
 epoch: 20, train_loss: 1.0496, test_loss: 1.0073, test_f1: 0.4624
 epoch: 21, train_loss: 1.0422, test_loss: 1.0045, test_f1: 0.4692
 epoch: 22, train_loss: 1.0426, test_loss: 1.0030, test_f1: 0.4737
 epoch: 23, train_loss: 1.0373, test_loss: 0.9974, test_f1: 0.4654
 epoch: 24, train_loss: 1.0304, test_loss: 0.9921, test_f1: 0.4664
 epoch: 25, train_loss: 1.0104, test_loss: 0.9957, test_f1: 0.4712
 epoch: 26, train_loss: 1.0193, test_loss: 0.9905, test_f1: 0.4788
 epoch: 27, train_loss: 1.0205, test_loss: 0.9938, test_f1: 0.4530
 epoch: 28, train_loss: 1.0145, test_loss: 0.9879, test_f1: 0.4752
 epoch: 29, train_loss: 0.9929, test_loss: 0.9869, test_f1: 0.4751
 epoch: 30, train_loss: 1.0093, test_loss: 0.9873, test_f1: 0.4672
 epoch: 31, train_loss: 0.9958, test_loss: 0.9923, test_f1: 0.4854
 epoch: 32, train_loss: 0.9938, test_loss: 0.9836, test_f1: 0.4848
 epoch: 33, train_loss: 0.9871, test_loss: 0.9833, test_f1: 0.4887
 epoch: 34, train_loss: 0.9878, test_loss: 0.9822, test_f1: 0.4909
 epoch: 35, train_loss: 0.9875, test_loss: 0.9836, test_f1: 0.4889
 epoch: 36, train_loss: 0.9784, test_loss: 0.9850, test_f1: 0.4863
 epoch: 37, train_loss: 0.9627, test_loss: 0.9820, test_f1: 0.4920
 epoch: 38, train_loss: 0.9735, test_loss: 0.9823, test_f1: 0.4978
 epoch: 39, train_loss: 0.9760, test_loss: 0.9997, test_f1: 0.4834
 epoch: 40, train_loss: 0.9614, test_loss: 0.9848, test_f1: 0.4886
 epoch: 41, train_loss: 0.9578, test_loss: 0.9884, test_f1: 0.4896
 epoch: 42, train_loss: 0.9632, test_loss: 0.9872, test_f1: 0.4887
 epoch: 43, train_loss: 0.9457, test_loss: 0.9846, test_f1: 0.4944
 epoch: 44, train_loss: 0.9460, test_loss: 0.9960, test_f1: 0.4904
 epoch: 45, train_loss: 0.9450, test_loss: 0.9873, test_f1: 0.4847
 epoch: 46, train_loss: 0.9289, test_loss: 0.9858, test_f1: 0.4851
 epoch: 47, train_loss: 0.9370, test_loss: 0.9958, test_f1: 0.4916
 epoch: 48, train_loss: 0.9330, test_loss: 0.9867, test_f1: 0.5031
 epoch: 49, train_loss: 0.9389, test_loss: 0.9909, test_f1: 0.4889
 epoch: 50, train_loss: 0.9285, test_loss: 0.9922, test_f1: 0.4919
 epoch: 51, train_loss: 0.9364, test_loss: 0.9926, test_f1: 0.4943
 epoch: 52, train_loss: 0.9257, test_loss: 0.9928, test_f1: 0.4995
 epoch: 53, train_loss: 0.9332, test_loss: 1.0008, test_f1: 0.4792
 epoch: 54, train_loss: 0.9183, test_loss: 0.9961, test_f1: 0.4798
 epoch: 55, train_loss: 0.9096, test_loss: 0.9896, test_f1: 0.4753
 epoch: 56, train_loss: 0.9194, test_loss: 0.9898, test_f1: 0.5025
 epoch: 57, train_loss: 0.9255, test_loss: 0.9935, test_f1: 0.4947
 epoch: 58, train_loss: 0.9096, test_loss: 1.0042, test_f1: 0.4977
 epoch: 59, train_loss: 0.9137, test_loss: 0.9970, test_f1: 0.4915
 epoch: 60, train_loss: 0.9044, test_loss: 0.9929, test_f1: 0.4938
 epoch: 61, train_loss: 0.9212, test_loss: 0.9937, test_f1: 0.5014
 epoch: 62, train_loss: 0.9064, test_loss: 0.9961, test_f1: 0.4875
 epoch: 63, train_loss: 0.9175, test_loss: 0.9921, test_f1: 0.4919
 epoch: 64, train_loss: 0.9055, test_loss: 0.9964, test_f1: 0.4970
 epoch: 65, train_loss: 0.9091, test_loss: 1.0018, test_f1: 0.4904
 epoch: 66, train_loss: 0.9089, test_loss: 0.9983, test_f1: 0.4988
 epoch: 67, train_loss: 0.8996, test_loss: 0.9975, test_f1: 0.5070
 epoch: 68, train_loss: 0.9063, test_loss: 0.9975, test_f1: 0.5094
 epoch: 69, train_loss: 0.9023, test_loss: 0.9960, test_f1: 0.5017
 epoch: 70, train_loss: 0.9057, test_loss: 1.0002, test_f1: 0.4821
 epoch: 71, train_loss: 0.9009, test_loss: 0.9986, test_f1: 0.4963
 epoch: 72, train_loss: 0.8917, test_loss: 0.9954, test_f1: 0.5130
 epoch: 73, train_loss: 0.9038, test_loss: 0.9956, test_f1: 0.5081
 epoch: 74, train_loss: 0.8973, test_loss: 1.0063, test_f1: 0.4866
 epoch: 75, train_loss: 0.8957, test_loss: 1.0004, test_f1: 0.4869
 epoch: 76, train_loss: 0.8918, test_loss: 1.0002, test_f1: 0.5080
 epoch: 77, train_loss: 0.8865, test_loss: 1.0079, test_f1: 0.4879
 epoch: 78, train_loss: 0.8876, test_loss: 1.0132, test_f1: 0.4934
 epoch: 79, train_loss: 0.8752, test_loss: 1.0061, test_f1: 0.5133
 epoch: 80, train_loss: 0.8906, test_loss: 1.0097, test_f1: 0.4884
 epoch: 81, train_loss: 0.8744, test_loss: 1.0079, test_f1: 0.4873
 epoch: 82, train_loss: 0.8875, test_loss: 1.0123, test_f1: 0.4941
 epoch: 83, train_loss: 0.8731, test_loss: 1.0192, test_f1: 0.4963
 epoch: 84, train_loss: 0.8827, test_loss: 1.0096, test_f1: 0.4973
 epoch: 85, train_loss: 0.8872, test_loss: 1.0072, test_f1: 0.5014
 epoch: 86, train_loss: 0.8804, test_loss: 1.0052, test_f1: 0.4833
 epoch: 87, train_loss: 0.8803, test_loss: 1.0150, test_f1: 0.4920
 epoch: 88, train_loss: 0.8788, test_loss: 1.0122, test_f1: 0.5000
 epoch: 89, train_loss: 0.8822, test_loss: 1.0076, test_f1: 0.5030
 epoch: 90, train_loss: 0.8716, test_loss: 1.0080, test_f1: 0.4880
 epoch: 91, train_loss: 0.8731, test_loss: 1.0099, test_f1: 0.4923
 epoch: 92, train_loss: 0.8740, test_loss: 1.0149, test_f1: 0.4894
 epoch: 93, train_loss: 0.8720, test_loss: 1.0118, test_f1: 0.5114
 epoch: 94, train_loss: 0.8689, test_loss: 1.0127, test_f1: 0.4912
 epoch: 95, train_loss: 0.8611, test_loss: 1.0176, test_f1: 0.4978
 epoch: 96, train_loss: 0.8761, test_loss: 1.0111, test_f1: 0.4960
 epoch: 97, train_loss: 0.8708, test_loss: 1.0252, test_f1: 0.4918
 epoch: 98, train_loss: 0.8644, test_loss: 1.0172, test_f1: 0.5013
 epoch: 99, train_loss: 0.8685, test_loss: 1.0177, test_f1: 0.5075
##################ITERATION #9 ****************************************
 epoch: 0, train_loss: 1.3315, test_loss: 1.2343, test_f1: 0.3024
 epoch: 1, train_loss: 1.2436, test_loss: 1.1765, test_f1: 0.3908
 epoch: 2, train_loss: 1.2290, test_loss: 1.1444, test_f1: 0.4101
 epoch: 3, train_loss: 1.1948, test_loss: 1.1281, test_f1: 0.4165
 epoch: 4, train_loss: 1.1773, test_loss: 1.1123, test_f1: 0.4208
 epoch: 5, train_loss: 1.1612, test_loss: 1.1061, test_f1: 0.4284
 epoch: 6, train_loss: 1.1457, test_loss: 1.0865, test_f1: 0.4430
 epoch: 7, train_loss: 1.1378, test_loss: 1.0764, test_f1: 0.4498
 epoch: 8, train_loss: 1.1305, test_loss: 1.0729, test_f1: 0.4535
 epoch: 9, train_loss: 1.1135, test_loss: 1.0590, test_f1: 0.4607
 epoch: 10, train_loss: 1.1172, test_loss: 1.0501, test_f1: 0.4718
 epoch: 11, train_loss: 1.1138, test_loss: 1.0467, test_f1: 0.4660
 epoch: 12, train_loss: 1.0958, test_loss: 1.0356, test_f1: 0.4774
 epoch: 13, train_loss: 1.0905, test_loss: 1.0275, test_f1: 0.4605
 epoch: 14, train_loss: 1.0771, test_loss: 1.0180, test_f1: 0.4611
 epoch: 15, train_loss: 1.0728, test_loss: 1.0126, test_f1: 0.4756
 epoch: 16, train_loss: 1.0638, test_loss: 1.0033, test_f1: 0.4801
 epoch: 17, train_loss: 1.0715, test_loss: 1.0018, test_f1: 0.4741
 epoch: 18, train_loss: 1.0520, test_loss: 0.9929, test_f1: 0.4668
 epoch: 19, train_loss: 1.0481, test_loss: 0.9968, test_f1: 0.4705
 epoch: 20, train_loss: 1.0402, test_loss: 0.9895, test_f1: 0.4764
 epoch: 21, train_loss: 1.0388, test_loss: 0.9733, test_f1: 0.4745
 epoch: 22, train_loss: 1.0332, test_loss: 0.9722, test_f1: 0.4719
 epoch: 23, train_loss: 1.0300, test_loss: 0.9722, test_f1: 0.4872
 epoch: 24, train_loss: 1.0177, test_loss: 0.9732, test_f1: 0.4712
 epoch: 25, train_loss: 1.0215, test_loss: 0.9766, test_f1: 0.4743
 epoch: 26, train_loss: 1.0118, test_loss: 0.9758, test_f1: 0.4699
 epoch: 27, train_loss: 1.0022, test_loss: 0.9613, test_f1: 0.4752
 epoch: 28, train_loss: 0.9983, test_loss: 0.9746, test_f1: 0.4757
 epoch: 29, train_loss: 0.9974, test_loss: 0.9759, test_f1: 0.4792
 epoch: 30, train_loss: 0.9932, test_loss: 0.9665, test_f1: 0.4775
 epoch: 31, train_loss: 0.9872, test_loss: 0.9694, test_f1: 0.4864
 epoch: 32, train_loss: 0.9869, test_loss: 0.9617, test_f1: 0.4834
 epoch: 33, train_loss: 0.9869, test_loss: 0.9576, test_f1: 0.4915
 epoch: 34, train_loss: 0.9814, test_loss: 0.9578, test_f1: 0.4832
 epoch: 35, train_loss: 0.9760, test_loss: 0.9523, test_f1: 0.4940
 epoch: 36, train_loss: 0.9748, test_loss: 0.9440, test_f1: 0.5016
 epoch: 37, train_loss: 0.9600, test_loss: 0.9620, test_f1: 0.4945
 epoch: 38, train_loss: 0.9661, test_loss: 0.9574, test_f1: 0.4938
 epoch: 39, train_loss: 0.9560, test_loss: 0.9602, test_f1: 0.5058
 epoch: 40, train_loss: 0.9565, test_loss: 0.9593, test_f1: 0.4972
 epoch: 41, train_loss: 0.9484, test_loss: 0.9611, test_f1: 0.5071
 epoch: 42, train_loss: 0.9429, test_loss: 0.9520, test_f1: 0.5127
 epoch: 43, train_loss: 0.9457, test_loss: 0.9537, test_f1: 0.5010
 epoch: 44, train_loss: 0.9362, test_loss: 0.9707, test_f1: 0.4980
 epoch: 45, train_loss: 0.9450, test_loss: 0.9669, test_f1: 0.4970
 epoch: 46, train_loss: 0.9415, test_loss: 0.9651, test_f1: 0.4916
 epoch: 47, train_loss: 0.9397, test_loss: 0.9644, test_f1: 0.5016
 epoch: 48, train_loss: 0.9367, test_loss: 0.9561, test_f1: 0.5001
 epoch: 49, train_loss: 0.9129, test_loss: 0.9615, test_f1: 0.4957
 epoch: 50, train_loss: 0.9308, test_loss: 0.9813, test_f1: 0.4899
 epoch: 51, train_loss: 0.9213, test_loss: 0.9622, test_f1: 0.5008
 epoch: 52, train_loss: 0.9234, test_loss: 0.9646, test_f1: 0.5014
 epoch: 53, train_loss: 0.9161, test_loss: 0.9684, test_f1: 0.5120
 epoch: 54, train_loss: 0.9149, test_loss: 0.9599, test_f1: 0.5129
 epoch: 55, train_loss: 0.9080, test_loss: 0.9707, test_f1: 0.5064
 epoch: 56, train_loss: 0.9134, test_loss: 0.9563, test_f1: 0.5106
 epoch: 57, train_loss: 0.9163, test_loss: 0.9751, test_f1: 0.4997
 epoch: 58, train_loss: 0.9099, test_loss: 0.9622, test_f1: 0.5037
 epoch: 59, train_loss: 0.9072, test_loss: 0.9719, test_f1: 0.5051
 epoch: 60, train_loss: 0.9032, test_loss: 0.9586, test_f1: 0.5061
 epoch: 61, train_loss: 0.9035, test_loss: 0.9571, test_f1: 0.5166
 epoch: 62, train_loss: 0.9195, test_loss: 0.9627, test_f1: 0.5195
 epoch: 63, train_loss: 0.8939, test_loss: 0.9666, test_f1: 0.5151
 epoch: 64, train_loss: 0.9005, test_loss: 0.9599, test_f1: 0.5137
 epoch: 65, train_loss: 0.9033, test_loss: 0.9704, test_f1: 0.5144
 epoch: 66, train_loss: 0.8989, test_loss: 0.9698, test_f1: 0.5182
 epoch: 67, train_loss: 0.8962, test_loss: 0.9651, test_f1: 0.5315
 epoch: 68, train_loss: 0.8953, test_loss: 0.9732, test_f1: 0.5174
 epoch: 69, train_loss: 0.8990, test_loss: 0.9640, test_f1: 0.5114
 epoch: 70, train_loss: 0.8926, test_loss: 0.9684, test_f1: 0.5202
 epoch: 71, train_loss: 0.8966, test_loss: 0.9719, test_f1: 0.5212
 epoch: 72, train_loss: 0.8934, test_loss: 0.9764, test_f1: 0.5209
 epoch: 73, train_loss: 0.8868, test_loss: 0.9826, test_f1: 0.5222
 epoch: 74, train_loss: 0.8892, test_loss: 0.9684, test_f1: 0.5266
 epoch: 75, train_loss: 0.8979, test_loss: 0.9748, test_f1: 0.5245
 epoch: 76, train_loss: 0.8913, test_loss: 0.9826, test_f1: 0.5201
 epoch: 77, train_loss: 0.8881, test_loss: 0.9807, test_f1: 0.5256
 epoch: 78, train_loss: 0.8799, test_loss: 0.9702, test_f1: 0.5173
 epoch: 79, train_loss: 0.8832, test_loss: 0.9763, test_f1: 0.5292
 epoch: 80, train_loss: 0.8835, test_loss: 0.9816, test_f1: 0.5160
 epoch: 81, train_loss: 0.8703, test_loss: 0.9756, test_f1: 0.5322
 epoch: 82, train_loss: 0.8874, test_loss: 0.9824, test_f1: 0.5284
 epoch: 83, train_loss: 0.8829, test_loss: 0.9800, test_f1: 0.5228
 epoch: 84, train_loss: 0.8669, test_loss: 0.9776, test_f1: 0.5205
 epoch: 85, train_loss: 0.8675, test_loss: 0.9780, test_f1: 0.5222
 epoch: 86, train_loss: 0.8767, test_loss: 0.9688, test_f1: 0.5282
 epoch: 87, train_loss: 0.8627, test_loss: 0.9673, test_f1: 0.5289
 epoch: 88, train_loss: 0.8804, test_loss: 0.9853, test_f1: 0.5175
 epoch: 89, train_loss: 0.8697, test_loss: 0.9824, test_f1: 0.5321
 epoch: 90, train_loss: 0.8681, test_loss: 0.9762, test_f1: 0.5306
 epoch: 91, train_loss: 0.8672, test_loss: 0.9785, test_f1: 0.5204
 epoch: 92, train_loss: 0.8778, test_loss: 0.9953, test_f1: 0.5136
 epoch: 93, train_loss: 0.8698, test_loss: 0.9947, test_f1: 0.5327
 epoch: 94, train_loss: 0.8665, test_loss: 0.9950, test_f1: 0.5297
 epoch: 95, train_loss: 0.8664, test_loss: 0.9784, test_f1: 0.5277
 epoch: 96, train_loss: 0.8590, test_loss: 0.9938, test_f1: 0.5256
 epoch: 97, train_loss: 0.8543, test_loss: 1.0019, test_f1: 0.5317
 epoch: 98, train_loss: 0.8572, test_loss: 1.0002, test_f1: 0.5176
 epoch: 99, train_loss: 0.8645, test_loss: 0.9991, test_f1: 0.5384

Training completed in 660.70 seconds
Best F1: 0.5460 at epoch 79
Mean F1 across iterations: 0.5206  0.0191
========================FINAL RESULTS================================
FEGIN weighted F1: 0.5460  0.0191
python main.py --data ltspice_examples --representation component_component --model FEGIN --layers 2 --hiddens 64 --batch_size 64 --lr 0.0001 --emb_size 128 --epochs 100 --save_appendix component_component_L2_H64_BS64_LR0.0001_E128 --no_val
-----



STDERR:
  File "main.py", line 370, in <module>
    main()
  File "main.py", line 254, in main
    dataset = dataset_class(
  File "/home/philip/projects/llm_inference_code_repo/Circuit-Completion-Using-GNNs/component_classification_with_link_prediction_head/evaluation/FEGIN/kernel/circuit_datasets.py", line 15, in __init__
    self.data, self.slices = torch.load(self.processed_paths[0])
  File "/home/philip/.local/lib/python3.8/site-packages/torch/serialization.py", line 1040, in load
    warnings.warn(
  File "/usr/lib/python3.8/warnings.py", line 109, in _showwarnmsg
    sw(msg.message, msg.category, msg.filename, msg.lineno,
  File "main.py", line 47, in warn_with_traceback
    traceback.print_stack(file=log)
/home/philip/projects/llm_inference_code_repo/Circuit-Completion-Using-GNNs/component_classification_with_link_prediction_head/evaluation/FEGIN/kernel/circuit_datasets.py:15: FutureWarning: You are using `torch.load` with `weights_only=False` (the current default value), which uses the default pickle module implicitly. It is possible to construct malicious pickle data which will execute arbitrary code during unpickling (See https://github.com/pytorch/pytorch/blob/main/SECURITY.md#untrusted-models for more details). In a future release, the default value for `weights_only` will be flipped to `True`. This limits the functions that could be executed during unpickling. Arbitrary objects will no longer be allowed to be loaded via this mode unless they are explicitly allowlisted by the user via `torch.serialization.add_safe_globals`. We recommend you start setting `weights_only=True` for any use case where you don't have full control of the loaded file. Please open an issue on GitHub for any issues related to this experimental feature.
  self.data, self.slices = torch.load(self.processed_paths[0])
