STDOUT:
Results will be saved in /home/philip/projects/ltspice_examples_code_repo/Circuit-Completion-Using-GNNs/component_classification_with_link_prediction_head/evaluation/FEGIN/results/model_FEGIN_dataset_ltspice_examples
Command line input: python main.py --data ltspice_examples --representation component_pin_net --model FEGIN --layers 4 --hiddens 128 --batch_size 32 --lr 0.0001 --emb_size 512 --epochs 100 --save_appendix component_pin_net_L4_H128_BS32_LR0.0001_E512 --no_val
 is saved.
-----
ltspice_examples - FEGIN
Using 4 layers, 128 hidden units, h = 2
Loading component_pin_net representation dataset
ENTERED
Training FEGIN on component_pin_net representation
Train: 3558, Test: 846
##################ITERATION #0 ****************************************
 epoch: 0, train_loss: 1.3060, test_loss: 1.1745, test_f1: 0.2968
 epoch: 1, train_loss: 1.1453, test_loss: 1.0656, test_f1: 0.3421
 epoch: 2, train_loss: 1.0643, test_loss: 1.0447, test_f1: 0.3509
 epoch: 3, train_loss: 1.0301, test_loss: 1.0130, test_f1: 0.4423
 epoch: 4, train_loss: 1.0025, test_loss: 1.0026, test_f1: 0.4610
 epoch: 5, train_loss: 0.9839, test_loss: 0.9716, test_f1: 0.5038
 epoch: 6, train_loss: 0.9676, test_loss: 0.9686, test_f1: 0.4937
 epoch: 7, train_loss: 0.9440, test_loss: 0.9246, test_f1: 0.5184
 epoch: 8, train_loss: 0.9120, test_loss: 0.9193, test_f1: 0.5168
 epoch: 9, train_loss: 0.9102, test_loss: 0.9380, test_f1: 0.5112
 epoch: 10, train_loss: 0.9011, test_loss: 0.9373, test_f1: 0.5006
 epoch: 11, train_loss: 0.8987, test_loss: 0.9300, test_f1: 0.5134
 epoch: 12, train_loss: 0.8747, test_loss: 0.8817, test_f1: 0.5237
 epoch: 13, train_loss: 0.8742, test_loss: 0.8670, test_f1: 0.5390
 epoch: 14, train_loss: 0.8596, test_loss: 0.8883, test_f1: 0.5220
 epoch: 15, train_loss: 0.8419, test_loss: 0.9063, test_f1: 0.5011
 epoch: 16, train_loss: 0.8426, test_loss: 0.8811, test_f1: 0.5303
 epoch: 17, train_loss: 0.8337, test_loss: 0.8527, test_f1: 0.5466
 epoch: 18, train_loss: 0.8162, test_loss: 0.8557, test_f1: 0.5463
 epoch: 19, train_loss: 0.8115, test_loss: 0.8368, test_f1: 0.5380
 epoch: 20, train_loss: 0.8213, test_loss: 0.9095, test_f1: 0.5255
 epoch: 21, train_loss: 0.8049, test_loss: 0.8897, test_f1: 0.5552
 epoch: 22, train_loss: 0.7905, test_loss: 0.8358, test_f1: 0.5509
 epoch: 23, train_loss: 0.7840, test_loss: 0.8389, test_f1: 0.5808
 epoch: 24, train_loss: 0.7745, test_loss: 0.8412, test_f1: 0.5538
 epoch: 25, train_loss: 0.7618, test_loss: 0.8153, test_f1: 0.5605
 epoch: 26, train_loss: 0.7525, test_loss: 0.8264, test_f1: 0.5631
 epoch: 27, train_loss: 0.7594, test_loss: 0.8590, test_f1: 0.5880
 epoch: 28, train_loss: 0.7552, test_loss: 0.8734, test_f1: 0.5404
 epoch: 29, train_loss: 0.7451, test_loss: 0.8489, test_f1: 0.5727
 epoch: 30, train_loss: 0.7332, test_loss: 0.8705, test_f1: 0.5522
 epoch: 31, train_loss: 0.7299, test_loss: 0.8752, test_f1: 0.5850
 epoch: 32, train_loss: 0.7196, test_loss: 0.8795, test_f1: 0.5351
 epoch: 33, train_loss: 0.7216, test_loss: 0.8327, test_f1: 0.5489
 epoch: 34, train_loss: 0.7048, test_loss: 0.8166, test_f1: 0.6227
 epoch: 35, train_loss: 0.7029, test_loss: 0.8381, test_f1: 0.5677
 epoch: 36, train_loss: 0.6864, test_loss: 0.8389, test_f1: 0.6038
 epoch: 37, train_loss: 0.6892, test_loss: 0.8430, test_f1: 0.5865
 epoch: 38, train_loss: 0.6863, test_loss: 0.9114, test_f1: 0.5970
 epoch: 39, train_loss: 0.6803, test_loss: 0.8966, test_f1: 0.5956
 epoch: 40, train_loss: 0.6878, test_loss: 0.8310, test_f1: 0.5723
 epoch: 41, train_loss: 0.6704, test_loss: 0.8885, test_f1: 0.5890
 epoch: 42, train_loss: 0.6630, test_loss: 0.7785, test_f1: 0.6015
 epoch: 43, train_loss: 0.6643, test_loss: 0.8365, test_f1: 0.6050
 epoch: 44, train_loss: 0.6499, test_loss: 0.8461, test_f1: 0.5981
 epoch: 45, train_loss: 0.6418, test_loss: 0.8432, test_f1: 0.6419
 epoch: 46, train_loss: 0.6453, test_loss: 0.8896, test_f1: 0.6231
 epoch: 47, train_loss: 0.6604, test_loss: 0.7716, test_f1: 0.6377
 epoch: 48, train_loss: 0.6347, test_loss: 0.8374, test_f1: 0.6322
 epoch: 49, train_loss: 0.6296, test_loss: 0.9089, test_f1: 0.6242
 epoch: 50, train_loss: 0.6173, test_loss: 0.8917, test_f1: 0.6374
 epoch: 51, train_loss: 0.6143, test_loss: 0.8692, test_f1: 0.6213
 epoch: 52, train_loss: 0.5967, test_loss: 0.8975, test_f1: 0.6480
 epoch: 53, train_loss: 0.5900, test_loss: 0.9657, test_f1: 0.6352
 epoch: 54, train_loss: 0.5846, test_loss: 0.8853, test_f1: 0.6092
 epoch: 55, train_loss: 0.5877, test_loss: 0.9146, test_f1: 0.6333
 epoch: 56, train_loss: 0.5896, test_loss: 0.8953, test_f1: 0.6278
 epoch: 57, train_loss: 0.5748, test_loss: 0.9109, test_f1: 0.6282
 epoch: 58, train_loss: 0.5662, test_loss: 0.9274, test_f1: 0.6401
 epoch: 59, train_loss: 0.5633, test_loss: 0.9359, test_f1: 0.6324
 epoch: 60, train_loss: 0.5745, test_loss: 0.9383, test_f1: 0.6500
 epoch: 61, train_loss: 0.5679, test_loss: 0.9577, test_f1: 0.6487
 epoch: 62, train_loss: 0.5541, test_loss: 0.9217, test_f1: 0.6377
 epoch: 63, train_loss: 0.5545, test_loss: 0.8609, test_f1: 0.6516
 epoch: 64, train_loss: 0.5529, test_loss: 0.9509, test_f1: 0.6347
 epoch: 65, train_loss: 0.5437, test_loss: 1.0080, test_f1: 0.6379
 epoch: 66, train_loss: 0.5587, test_loss: 0.9057, test_f1: 0.6485
 epoch: 67, train_loss: 0.5399, test_loss: 0.9875, test_f1: 0.6437
 epoch: 68, train_loss: 0.5341, test_loss: 0.9781, test_f1: 0.6380
 epoch: 69, train_loss: 0.5354, test_loss: 0.9835, test_f1: 0.6414
 epoch: 70, train_loss: 0.5414, test_loss: 0.9774, test_f1: 0.6365
 epoch: 71, train_loss: 0.5343, test_loss: 1.0292, test_f1: 0.6412
 epoch: 72, train_loss: 0.5366, test_loss: 1.0042, test_f1: 0.6505
 epoch: 73, train_loss: 0.5267, test_loss: 1.0126, test_f1: 0.6511
 epoch: 74, train_loss: 0.5262, test_loss: 0.9516, test_f1: 0.6493
 epoch: 75, train_loss: 0.5124, test_loss: 1.0303, test_f1: 0.6477
 epoch: 76, train_loss: 0.5358, test_loss: 0.9894, test_f1: 0.6346
 epoch: 77, train_loss: 0.5134, test_loss: 1.0690, test_f1: 0.6548
 epoch: 78, train_loss: 0.5105, test_loss: 0.9926, test_f1: 0.6412
 epoch: 79, train_loss: 0.5156, test_loss: 1.0528, test_f1: 0.6297
 epoch: 80, train_loss: 0.5170, test_loss: 1.0014, test_f1: 0.6456
 epoch: 81, train_loss: 0.5101, test_loss: 0.9738, test_f1: 0.6468
 epoch: 82, train_loss: 0.5104, test_loss: 1.1209, test_f1: 0.6380
 epoch: 83, train_loss: 0.5007, test_loss: 1.0466, test_f1: 0.6256
 epoch: 84, train_loss: 0.4932, test_loss: 1.1036, test_f1: 0.6451
 epoch: 85, train_loss: 0.4913, test_loss: 1.0830, test_f1: 0.6443
 epoch: 86, train_loss: 0.4885, test_loss: 1.1307, test_f1: 0.6237
 epoch: 87, train_loss: 0.4991, test_loss: 1.0843, test_f1: 0.6196
 epoch: 88, train_loss: 0.5002, test_loss: 1.0972, test_f1: 0.6183
 epoch: 89, train_loss: 0.4867, test_loss: 1.1174, test_f1: 0.6364
 epoch: 90, train_loss: 0.4949, test_loss: 1.1304, test_f1: 0.6344
 epoch: 91, train_loss: 0.4736, test_loss: 1.0891, test_f1: 0.6343
 epoch: 92, train_loss: 0.4677, test_loss: 1.1133, test_f1: 0.6222
 epoch: 93, train_loss: 0.4893, test_loss: 1.0996, test_f1: 0.6324
 epoch: 94, train_loss: 0.4719, test_loss: 1.1109, test_f1: 0.6384
 epoch: 95, train_loss: 0.4575, test_loss: 1.1585, test_f1: 0.6328
 epoch: 96, train_loss: 0.4761, test_loss: 1.1152, test_f1: 0.6514
 epoch: 97, train_loss: 0.4655, test_loss: 1.1747, test_f1: 0.6309
 epoch: 98, train_loss: 0.4635, test_loss: 1.1826, test_f1: 0.6354
 epoch: 99, train_loss: 0.4573, test_loss: 1.1183, test_f1: 0.6509
##################ITERATION #1 ****************************************
 epoch: 0, train_loss: 1.1660, test_loss: 1.0278, test_f1: 0.4596
 epoch: 1, train_loss: 1.0117, test_loss: 0.9953, test_f1: 0.4819
 epoch: 2, train_loss: 0.9854, test_loss: 0.9695, test_f1: 0.4983
 epoch: 3, train_loss: 0.9576, test_loss: 0.9462, test_f1: 0.5160
 epoch: 4, train_loss: 0.9370, test_loss: 0.9420, test_f1: 0.5449
 epoch: 5, train_loss: 0.9163, test_loss: 0.9356, test_f1: 0.5203
 epoch: 6, train_loss: 0.9088, test_loss: 0.8973, test_f1: 0.5301
 epoch: 7, train_loss: 0.8993, test_loss: 0.8962, test_f1: 0.5394
 epoch: 8, train_loss: 0.8731, test_loss: 0.8753, test_f1: 0.5385
 epoch: 9, train_loss: 0.8625, test_loss: 0.8724, test_f1: 0.5448
 epoch: 10, train_loss: 0.8531, test_loss: 0.8768, test_f1: 0.5604
 epoch: 11, train_loss: 0.8392, test_loss: 0.8697, test_f1: 0.5465
 epoch: 12, train_loss: 0.8358, test_loss: 0.8552, test_f1: 0.5492
 epoch: 13, train_loss: 0.8248, test_loss: 0.8072, test_f1: 0.5853
 epoch: 14, train_loss: 0.8089, test_loss: 0.8108, test_f1: 0.5766
 epoch: 15, train_loss: 0.7968, test_loss: 0.8223, test_f1: 0.5759
 epoch: 16, train_loss: 0.7927, test_loss: 0.8290, test_f1: 0.5603
 epoch: 17, train_loss: 0.7819, test_loss: 0.8173, test_f1: 0.5776
 epoch: 18, train_loss: 0.7714, test_loss: 0.8213, test_f1: 0.5965
 epoch: 19, train_loss: 0.7618, test_loss: 0.8135, test_f1: 0.5672
 epoch: 20, train_loss: 0.7453, test_loss: 0.7741, test_f1: 0.6060
 epoch: 21, train_loss: 0.7421, test_loss: 0.8358, test_f1: 0.5831
 epoch: 22, train_loss: 0.7336, test_loss: 0.8477, test_f1: 0.6010
 epoch: 23, train_loss: 0.7307, test_loss: 0.8574, test_f1: 0.5953
 epoch: 24, train_loss: 0.7185, test_loss: 0.8350, test_f1: 0.5892
 epoch: 25, train_loss: 0.7229, test_loss: 0.8277, test_f1: 0.5851
 epoch: 26, train_loss: 0.7091, test_loss: 0.8751, test_f1: 0.5952
 epoch: 27, train_loss: 0.6965, test_loss: 0.8363, test_f1: 0.5956
 epoch: 28, train_loss: 0.6848, test_loss: 0.8554, test_f1: 0.5974
 epoch: 29, train_loss: 0.6821, test_loss: 0.8447, test_f1: 0.6169
 epoch: 30, train_loss: 0.6670, test_loss: 0.7962, test_f1: 0.6223
 epoch: 31, train_loss: 0.6729, test_loss: 0.8294, test_f1: 0.6120
 epoch: 32, train_loss: 0.6641, test_loss: 0.8101, test_f1: 0.6291
 epoch: 33, train_loss: 0.6535, test_loss: 0.7737, test_f1: 0.6418
 epoch: 34, train_loss: 0.6460, test_loss: 0.8340, test_f1: 0.6122
 epoch: 35, train_loss: 0.6350, test_loss: 0.8167, test_f1: 0.6501
 epoch: 36, train_loss: 0.6260, test_loss: 0.8622, test_f1: 0.6783
 epoch: 37, train_loss: 0.6314, test_loss: 0.8348, test_f1: 0.6458
 epoch: 38, train_loss: 0.6125, test_loss: 0.8840, test_f1: 0.6398
 epoch: 39, train_loss: 0.6150, test_loss: 0.8429, test_f1: 0.6216
 epoch: 40, train_loss: 0.6064, test_loss: 0.7644, test_f1: 0.6518
 epoch: 41, train_loss: 0.5915, test_loss: 0.8656, test_f1: 0.6604
 epoch: 42, train_loss: 0.5952, test_loss: 0.8543, test_f1: 0.6227
 epoch: 43, train_loss: 0.5848, test_loss: 0.8465, test_f1: 0.6366
 epoch: 44, train_loss: 0.5779, test_loss: 0.8826, test_f1: 0.6596
 epoch: 45, train_loss: 0.5687, test_loss: 0.8588, test_f1: 0.6320
 epoch: 46, train_loss: 0.5759, test_loss: 0.9468, test_f1: 0.6406
 epoch: 47, train_loss: 0.5639, test_loss: 0.9186, test_f1: 0.6395
 epoch: 48, train_loss: 0.5710, test_loss: 0.9286, test_f1: 0.6323
 epoch: 49, train_loss: 0.5578, test_loss: 0.9445, test_f1: 0.6589
 epoch: 50, train_loss: 0.5499, test_loss: 0.9765, test_f1: 0.6306
 epoch: 51, train_loss: 0.5275, test_loss: 0.9144, test_f1: 0.6543
 epoch: 52, train_loss: 0.5204, test_loss: 0.8943, test_f1: 0.6426
 epoch: 53, train_loss: 0.5220, test_loss: 0.9227, test_f1: 0.6543
 epoch: 54, train_loss: 0.5102, test_loss: 0.9361, test_f1: 0.6497
 epoch: 55, train_loss: 0.5109, test_loss: 0.9561, test_f1: 0.6431
 epoch: 56, train_loss: 0.5080, test_loss: 0.9185, test_f1: 0.6425
 epoch: 57, train_loss: 0.4966, test_loss: 0.9383, test_f1: 0.6531
 epoch: 58, train_loss: 0.4812, test_loss: 0.9301, test_f1: 0.6435
 epoch: 59, train_loss: 0.4948, test_loss: 0.9970, test_f1: 0.6479
 epoch: 60, train_loss: 0.4889, test_loss: 0.9566, test_f1: 0.6562
 epoch: 61, train_loss: 0.4852, test_loss: 0.9769, test_f1: 0.6515
 epoch: 62, train_loss: 0.4884, test_loss: 1.0148, test_f1: 0.6411
 epoch: 63, train_loss: 0.4843, test_loss: 0.9345, test_f1: 0.6489
 epoch: 64, train_loss: 0.4879, test_loss: 1.0204, test_f1: 0.6550
 epoch: 65, train_loss: 0.4676, test_loss: 1.0111, test_f1: 0.6422
 epoch: 66, train_loss: 0.4794, test_loss: 0.9677, test_f1: 0.6352
 epoch: 67, train_loss: 0.4662, test_loss: 1.0112, test_f1: 0.6525
 epoch: 68, train_loss: 0.4729, test_loss: 1.0671, test_f1: 0.6499
 epoch: 69, train_loss: 0.4595, test_loss: 0.9875, test_f1: 0.6546
 epoch: 70, train_loss: 0.4560, test_loss: 1.0605, test_f1: 0.6505
 epoch: 71, train_loss: 0.4600, test_loss: 1.0283, test_f1: 0.6500
 epoch: 72, train_loss: 0.4567, test_loss: 1.0603, test_f1: 0.6558
 epoch: 73, train_loss: 0.4579, test_loss: 1.0123, test_f1: 0.6452
 epoch: 74, train_loss: 0.4498, test_loss: 1.1558, test_f1: 0.6111
 epoch: 75, train_loss: 0.4548, test_loss: 1.0612, test_f1: 0.6350
 epoch: 76, train_loss: 0.4574, test_loss: 1.0557, test_f1: 0.6271
 epoch: 77, train_loss: 0.4515, test_loss: 1.0421, test_f1: 0.6533
 epoch: 78, train_loss: 0.4447, test_loss: 1.0651, test_f1: 0.6422
 epoch: 79, train_loss: 0.4359, test_loss: 1.0684, test_f1: 0.6498
 epoch: 80, train_loss: 0.4348, test_loss: 1.0622, test_f1: 0.6523
 epoch: 81, train_loss: 0.4291, test_loss: 1.1333, test_f1: 0.6442
 epoch: 82, train_loss: 0.4318, test_loss: 1.0539, test_f1: 0.6693
 epoch: 83, train_loss: 0.4308, test_loss: 1.0549, test_f1: 0.6464
 epoch: 84, train_loss: 0.4275, test_loss: 1.0607, test_f1: 0.6557
 epoch: 85, train_loss: 0.4221, test_loss: 1.0793, test_f1: 0.6424
 epoch: 86, train_loss: 0.4219, test_loss: 1.0394, test_f1: 0.6879
 epoch: 87, train_loss: 0.4288, test_loss: 1.1199, test_f1: 0.6522
 epoch: 88, train_loss: 0.4114, test_loss: 1.0946, test_f1: 0.6550
 epoch: 89, train_loss: 0.4193, test_loss: 1.1032, test_f1: 0.6536
 epoch: 90, train_loss: 0.4099, test_loss: 1.0995, test_f1: 0.6448
 epoch: 91, train_loss: 0.4120, test_loss: 1.1655, test_f1: 0.6461
 epoch: 92, train_loss: 0.4092, test_loss: 1.1399, test_f1: 0.6448
 epoch: 93, train_loss: 0.4089, test_loss: 1.1003, test_f1: 0.6535
 epoch: 94, train_loss: 0.4010, test_loss: 1.1567, test_f1: 0.6484
 epoch: 95, train_loss: 0.4149, test_loss: 1.2011, test_f1: 0.6476
 epoch: 96, train_loss: 0.4125, test_loss: 1.2149, test_f1: 0.6439
 epoch: 97, train_loss: 0.3947, test_loss: 1.1744, test_f1: 0.6500
 epoch: 98, train_loss: 0.4088, test_loss: 1.2648, test_f1: 0.6450
 epoch: 99, train_loss: 0.3916, test_loss: 1.1331, test_f1: 0.6635
##################ITERATION #2 ****************************************
 epoch: 0, train_loss: 1.1253, test_loss: 1.0224, test_f1: 0.4912
 epoch: 1, train_loss: 0.9988, test_loss: 0.9694, test_f1: 0.5090
 epoch: 2, train_loss: 0.9637, test_loss: 0.9393, test_f1: 0.5344
 epoch: 3, train_loss: 0.9410, test_loss: 0.9333, test_f1: 0.5284
 epoch: 4, train_loss: 0.9231, test_loss: 0.9007, test_f1: 0.5470
 epoch: 5, train_loss: 0.9007, test_loss: 0.8834, test_f1: 0.5384
 epoch: 6, train_loss: 0.8859, test_loss: 0.8811, test_f1: 0.5441
 epoch: 7, train_loss: 0.8674, test_loss: 0.8574, test_f1: 0.5618
 epoch: 8, train_loss: 0.8547, test_loss: 0.8584, test_f1: 0.5623
 epoch: 9, train_loss: 0.8516, test_loss: 0.8357, test_f1: 0.5674
 epoch: 10, train_loss: 0.8363, test_loss: 0.8232, test_f1: 0.5667
 epoch: 11, train_loss: 0.8258, test_loss: 0.8223, test_f1: 0.5923
 epoch: 12, train_loss: 0.8209, test_loss: 0.8037, test_f1: 0.5867
 epoch: 13, train_loss: 0.8111, test_loss: 0.8154, test_f1: 0.5945
 epoch: 14, train_loss: 0.7797, test_loss: 0.7909, test_f1: 0.6128
 epoch: 15, train_loss: 0.7800, test_loss: 0.8004, test_f1: 0.6271
 epoch: 16, train_loss: 0.7779, test_loss: 0.7996, test_f1: 0.6278
 epoch: 17, train_loss: 0.7646, test_loss: 0.7755, test_f1: 0.6241
 epoch: 18, train_loss: 0.7390, test_loss: 0.7920, test_f1: 0.6016
 epoch: 19, train_loss: 0.7514, test_loss: 0.8115, test_f1: 0.6134
 epoch: 20, train_loss: 0.7397, test_loss: 0.7811, test_f1: 0.6105
 epoch: 21, train_loss: 0.7307, test_loss: 0.7564, test_f1: 0.6120
 epoch: 22, train_loss: 0.7218, test_loss: 0.7691, test_f1: 0.6207
 epoch: 23, train_loss: 0.7035, test_loss: 0.8204, test_f1: 0.6146
 epoch: 24, train_loss: 0.7084, test_loss: 0.7451, test_f1: 0.6249
 epoch: 25, train_loss: 0.6949, test_loss: 0.8011, test_f1: 0.6316
 epoch: 26, train_loss: 0.6904, test_loss: 0.7351, test_f1: 0.6480
 epoch: 27, train_loss: 0.6816, test_loss: 0.7936, test_f1: 0.6244
 epoch: 28, train_loss: 0.6811, test_loss: 0.8544, test_f1: 0.6000
 epoch: 29, train_loss: 0.6527, test_loss: 0.8100, test_f1: 0.6221
 epoch: 30, train_loss: 0.6641, test_loss: 0.7786, test_f1: 0.6088
 epoch: 31, train_loss: 0.6416, test_loss: 0.7777, test_f1: 0.6278
 epoch: 32, train_loss: 0.6467, test_loss: 0.7842, test_f1: 0.6239
 epoch: 33, train_loss: 0.6346, test_loss: 0.8381, test_f1: 0.6318
 epoch: 34, train_loss: 0.6373, test_loss: 0.8002, test_f1: 0.6127
 epoch: 35, train_loss: 0.6282, test_loss: 0.8247, test_f1: 0.6312
 epoch: 36, train_loss: 0.6201, test_loss: 0.8646, test_f1: 0.6362
 epoch: 37, train_loss: 0.6131, test_loss: 0.8249, test_f1: 0.6304
 epoch: 38, train_loss: 0.5998, test_loss: 0.8953, test_f1: 0.6051
 epoch: 39, train_loss: 0.5985, test_loss: 0.8810, test_f1: 0.6085
 epoch: 40, train_loss: 0.5859, test_loss: 0.8873, test_f1: 0.6185
 epoch: 41, train_loss: 0.5981, test_loss: 0.8016, test_f1: 0.6345
 epoch: 42, train_loss: 0.5852, test_loss: 0.8077, test_f1: 0.6331
 epoch: 43, train_loss: 0.5850, test_loss: 0.8528, test_f1: 0.6178
 epoch: 44, train_loss: 0.5565, test_loss: 0.9436, test_f1: 0.5984
 epoch: 45, train_loss: 0.5743, test_loss: 0.9174, test_f1: 0.6117
 epoch: 46, train_loss: 0.5535, test_loss: 0.8719, test_f1: 0.6362
 epoch: 47, train_loss: 0.5537, test_loss: 0.8855, test_f1: 0.6282
 epoch: 48, train_loss: 0.5543, test_loss: 0.9102, test_f1: 0.6239
 epoch: 49, train_loss: 0.5338, test_loss: 0.8948, test_f1: 0.6350
 epoch: 50, train_loss: 0.5350, test_loss: 0.9453, test_f1: 0.6239
 epoch: 51, train_loss: 0.5087, test_loss: 0.9647, test_f1: 0.6227
 epoch: 52, train_loss: 0.5143, test_loss: 0.9310, test_f1: 0.6194
 epoch: 53, train_loss: 0.4969, test_loss: 0.9445, test_f1: 0.6300
 epoch: 54, train_loss: 0.4831, test_loss: 1.0151, test_f1: 0.6267
 epoch: 55, train_loss: 0.4848, test_loss: 1.0004, test_f1: 0.6478
 epoch: 56, train_loss: 0.4810, test_loss: 1.0565, test_f1: 0.6213
 epoch: 57, train_loss: 0.4886, test_loss: 0.9695, test_f1: 0.6276
 epoch: 58, train_loss: 0.4789, test_loss: 1.0438, test_f1: 0.6314
 epoch: 59, train_loss: 0.4710, test_loss: 1.0401, test_f1: 0.6287
 epoch: 60, train_loss: 0.4644, test_loss: 1.0793, test_f1: 0.6264
 epoch: 61, train_loss: 0.4608, test_loss: 1.0800, test_f1: 0.6295
 epoch: 62, train_loss: 0.4535, test_loss: 1.1398, test_f1: 0.6202
 epoch: 63, train_loss: 0.4611, test_loss: 1.0759, test_f1: 0.6368
 epoch: 64, train_loss: 0.4529, test_loss: 1.1171, test_f1: 0.6345
 epoch: 65, train_loss: 0.4676, test_loss: 1.1495, test_f1: 0.6235
 epoch: 66, train_loss: 0.4533, test_loss: 1.0539, test_f1: 0.6519
 epoch: 67, train_loss: 0.4650, test_loss: 1.0919, test_f1: 0.6422
 epoch: 68, train_loss: 0.4417, test_loss: 1.1411, test_f1: 0.6340
 epoch: 69, train_loss: 0.4462, test_loss: 1.1362, test_f1: 0.6327
 epoch: 70, train_loss: 0.4290, test_loss: 1.1517, test_f1: 0.6415
 epoch: 71, train_loss: 0.4414, test_loss: 1.1844, test_f1: 0.6364
 epoch: 72, train_loss: 0.4408, test_loss: 1.1480, test_f1: 0.6410
 epoch: 73, train_loss: 0.4382, test_loss: 1.2123, test_f1: 0.6286
 epoch: 74, train_loss: 0.4275, test_loss: 1.2089, test_f1: 0.6458
 epoch: 75, train_loss: 0.4226, test_loss: 1.1983, test_f1: 0.6375
 epoch: 76, train_loss: 0.4258, test_loss: 1.1587, test_f1: 0.6391
 epoch: 77, train_loss: 0.4245, test_loss: 1.1869, test_f1: 0.6407
 epoch: 78, train_loss: 0.4173, test_loss: 1.2338, test_f1: 0.6511
 epoch: 79, train_loss: 0.4251, test_loss: 1.2331, test_f1: 0.6370
 epoch: 80, train_loss: 0.4064, test_loss: 1.1327, test_f1: 0.6410
 epoch: 81, train_loss: 0.4061, test_loss: 1.2720, test_f1: 0.6456
 epoch: 82, train_loss: 0.4118, test_loss: 1.2267, test_f1: 0.6424
 epoch: 83, train_loss: 0.4037, test_loss: 1.2788, test_f1: 0.6437
 epoch: 84, train_loss: 0.4142, test_loss: 1.3101, test_f1: 0.6380
 epoch: 85, train_loss: 0.4020, test_loss: 1.2459, test_f1: 0.6312
 epoch: 86, train_loss: 0.3933, test_loss: 1.2392, test_f1: 0.6254
 epoch: 87, train_loss: 0.4121, test_loss: 1.3658, test_f1: 0.6408
 epoch: 88, train_loss: 0.3908, test_loss: 1.2782, test_f1: 0.6431
 epoch: 89, train_loss: 0.3776, test_loss: 1.3304, test_f1: 0.6451
 epoch: 90, train_loss: 0.3773, test_loss: 1.3544, test_f1: 0.6383
 epoch: 91, train_loss: 0.3712, test_loss: 1.3213, test_f1: 0.6366
 epoch: 92, train_loss: 0.3798, test_loss: 1.3389, test_f1: 0.6482
 epoch: 93, train_loss: 0.3785, test_loss: 1.3994, test_f1: 0.6438
 epoch: 94, train_loss: 0.3729, test_loss: 1.4016, test_f1: 0.6313
 epoch: 95, train_loss: 0.3735, test_loss: 1.3700, test_f1: 0.6457
 epoch: 96, train_loss: 0.3615, test_loss: 1.3586, test_f1: 0.6334
 epoch: 97, train_loss: 0.3929, test_loss: 1.4771, test_f1: 0.6424
 epoch: 98, train_loss: 0.3729, test_loss: 1.3520, test_f1: 0.6471
 epoch: 99, train_loss: 0.3420, test_loss: 1.4484, test_f1: 0.6455
##################ITERATION #3 ****************************************
 epoch: 0, train_loss: 1.1078, test_loss: 0.9688, test_f1: 0.5064
 epoch: 1, train_loss: 0.9863, test_loss: 0.9375, test_f1: 0.5443
 epoch: 2, train_loss: 0.9586, test_loss: 0.8999, test_f1: 0.5170
 epoch: 3, train_loss: 0.9399, test_loss: 0.8743, test_f1: 0.5406
 epoch: 4, train_loss: 0.9153, test_loss: 0.8613, test_f1: 0.5427
 epoch: 5, train_loss: 0.8963, test_loss: 0.8459, test_f1: 0.5396
 epoch: 6, train_loss: 0.8733, test_loss: 0.8350, test_f1: 0.5386
 epoch: 7, train_loss: 0.8693, test_loss: 0.8195, test_f1: 0.5518
 epoch: 8, train_loss: 0.8501, test_loss: 0.8161, test_f1: 0.5406
 epoch: 9, train_loss: 0.8257, test_loss: 0.8067, test_f1: 0.5621
 epoch: 10, train_loss: 0.8227, test_loss: 0.7898, test_f1: 0.5679
 epoch: 11, train_loss: 0.8091, test_loss: 0.7769, test_f1: 0.6027
 epoch: 12, train_loss: 0.7873, test_loss: 0.7800, test_f1: 0.6039
 epoch: 13, train_loss: 0.7885, test_loss: 0.7560, test_f1: 0.6044
 epoch: 14, train_loss: 0.7811, test_loss: 0.7366, test_f1: 0.6096
 epoch: 15, train_loss: 0.7885, test_loss: 0.7302, test_f1: 0.6339
 epoch: 16, train_loss: 0.7494, test_loss: 0.7351, test_f1: 0.6568
 epoch: 17, train_loss: 0.7555, test_loss: 0.7344, test_f1: 0.6179
 epoch: 18, train_loss: 0.7372, test_loss: 0.7634, test_f1: 0.6484
 epoch: 19, train_loss: 0.7205, test_loss: 0.7252, test_f1: 0.6247
 epoch: 20, train_loss: 0.7157, test_loss: 0.7139, test_f1: 0.6497
 epoch: 21, train_loss: 0.7044, test_loss: 0.7185, test_f1: 0.6326
 epoch: 22, train_loss: 0.6896, test_loss: 0.7397, test_f1: 0.6323
 epoch: 23, train_loss: 0.6933, test_loss: 0.7188, test_f1: 0.6674
 epoch: 24, train_loss: 0.6877, test_loss: 0.6986, test_f1: 0.6906
 epoch: 25, train_loss: 0.6838, test_loss: 0.7213, test_f1: 0.6568
 epoch: 26, train_loss: 0.6736, test_loss: 0.6937, test_f1: 0.6681
 epoch: 27, train_loss: 0.6662, test_loss: 0.6953, test_f1: 0.6844
 epoch: 28, train_loss: 0.6640, test_loss: 0.6944, test_f1: 0.6801
 epoch: 29, train_loss: 0.6585, test_loss: 0.7082, test_f1: 0.6494
 epoch: 30, train_loss: 0.6349, test_loss: 0.6825, test_f1: 0.6983
 epoch: 31, train_loss: 0.6339, test_loss: 0.7189, test_f1: 0.6821
 epoch: 32, train_loss: 0.6234, test_loss: 0.7232, test_f1: 0.6600
 epoch: 33, train_loss: 0.6139, test_loss: 0.6957, test_f1: 0.6799
 epoch: 34, train_loss: 0.6061, test_loss: 0.7610, test_f1: 0.6681
 epoch: 35, train_loss: 0.6120, test_loss: 0.7517, test_f1: 0.6496
 epoch: 36, train_loss: 0.6059, test_loss: 0.7147, test_f1: 0.6451
 epoch: 37, train_loss: 0.6002, test_loss: 0.7458, test_f1: 0.6833
 epoch: 38, train_loss: 0.5926, test_loss: 0.7213, test_f1: 0.6629
 epoch: 39, train_loss: 0.5833, test_loss: 0.7174, test_f1: 0.6583
 epoch: 40, train_loss: 0.5713, test_loss: 0.7255, test_f1: 0.6540
 epoch: 41, train_loss: 0.5682, test_loss: 0.7706, test_f1: 0.6407
 epoch: 42, train_loss: 0.5720, test_loss: 0.7165, test_f1: 0.6689
 epoch: 43, train_loss: 0.5614, test_loss: 0.7508, test_f1: 0.6535
 epoch: 44, train_loss: 0.5481, test_loss: 0.7881, test_f1: 0.6642
 epoch: 45, train_loss: 0.5442, test_loss: 0.7934, test_f1: 0.6823
 epoch: 46, train_loss: 0.5381, test_loss: 0.7873, test_f1: 0.6640
 epoch: 47, train_loss: 0.5244, test_loss: 0.7668, test_f1: 0.6900
 epoch: 48, train_loss: 0.5416, test_loss: 0.8356, test_f1: 0.6567
 epoch: 49, train_loss: 0.5403, test_loss: 0.8899, test_f1: 0.6486
 epoch: 50, train_loss: 0.5283, test_loss: 0.7690, test_f1: 0.6546
 epoch: 51, train_loss: 0.4981, test_loss: 0.8438, test_f1: 0.6755
 epoch: 52, train_loss: 0.4846, test_loss: 0.8006, test_f1: 0.6757
 epoch: 53, train_loss: 0.4878, test_loss: 0.8239, test_f1: 0.6828
 epoch: 54, train_loss: 0.4783, test_loss: 0.8456, test_f1: 0.6765
 epoch: 55, train_loss: 0.4623, test_loss: 0.8680, test_f1: 0.6680
 epoch: 56, train_loss: 0.4762, test_loss: 0.8738, test_f1: 0.6665
 epoch: 57, train_loss: 0.4688, test_loss: 0.8691, test_f1: 0.6825
 epoch: 58, train_loss: 0.4627, test_loss: 0.9380, test_f1: 0.6589
 epoch: 59, train_loss: 0.4614, test_loss: 0.9066, test_f1: 0.6658
 epoch: 60, train_loss: 0.4566, test_loss: 0.9170, test_f1: 0.6952
 epoch: 61, train_loss: 0.4540, test_loss: 0.9249, test_f1: 0.6852
 epoch: 62, train_loss: 0.4572, test_loss: 0.9312, test_f1: 0.6647
 epoch: 63, train_loss: 0.4503, test_loss: 0.9425, test_f1: 0.6837
 epoch: 64, train_loss: 0.4545, test_loss: 0.9400, test_f1: 0.6844
 epoch: 65, train_loss: 0.4443, test_loss: 0.9792, test_f1: 0.6675
 epoch: 66, train_loss: 0.4436, test_loss: 0.9387, test_f1: 0.6745
 epoch: 67, train_loss: 0.4426, test_loss: 0.9674, test_f1: 0.6733
 epoch: 68, train_loss: 0.4300, test_loss: 0.9765, test_f1: 0.6879
 epoch: 69, train_loss: 0.4325, test_loss: 0.9474, test_f1: 0.6870
 epoch: 70, train_loss: 0.4190, test_loss: 1.0415, test_f1: 0.6660
 epoch: 71, train_loss: 0.4248, test_loss: 1.1017, test_f1: 0.6672
 epoch: 72, train_loss: 0.4371, test_loss: 1.0387, test_f1: 0.6828
 epoch: 73, train_loss: 0.4281, test_loss: 1.0864, test_f1: 0.6807
 epoch: 74, train_loss: 0.4112, test_loss: 1.0719, test_f1: 0.6635
 epoch: 75, train_loss: 0.4002, test_loss: 0.9721, test_f1: 0.6902
 epoch: 76, train_loss: 0.4152, test_loss: 1.0508, test_f1: 0.6739
 epoch: 77, train_loss: 0.4160, test_loss: 1.0378, test_f1: 0.6792
 epoch: 78, train_loss: 0.4071, test_loss: 1.1448, test_f1: 0.6638
 epoch: 79, train_loss: 0.4058, test_loss: 1.0828, test_f1: 0.6751
 epoch: 80, train_loss: 0.3886, test_loss: 1.0513, test_f1: 0.6722
 epoch: 81, train_loss: 0.4066, test_loss: 1.0371, test_f1: 0.6847
 epoch: 82, train_loss: 0.4066, test_loss: 1.1848, test_f1: 0.6684
 epoch: 83, train_loss: 0.3926, test_loss: 1.0812, test_f1: 0.6832
 epoch: 84, train_loss: 0.3866, test_loss: 1.1127, test_f1: 0.6826
 epoch: 85, train_loss: 0.3945, test_loss: 1.1416, test_f1: 0.6746
 epoch: 86, train_loss: 0.3915, test_loss: 1.1442, test_f1: 0.6632
 epoch: 87, train_loss: 0.3727, test_loss: 1.1898, test_f1: 0.6641
 epoch: 88, train_loss: 0.3741, test_loss: 1.2345, test_f1: 0.6617
 epoch: 89, train_loss: 0.3835, test_loss: 1.2128, test_f1: 0.6643
 epoch: 90, train_loss: 0.3724, test_loss: 1.2621, test_f1: 0.6620
 epoch: 91, train_loss: 0.3784, test_loss: 1.2877, test_f1: 0.6628
 epoch: 92, train_loss: 0.3837, test_loss: 1.2330, test_f1: 0.6666
 epoch: 93, train_loss: 0.3709, test_loss: 1.2443, test_f1: 0.6689
 epoch: 94, train_loss: 0.3779, test_loss: 1.1686, test_f1: 0.6666
 epoch: 95, train_loss: 0.3648, test_loss: 1.2420, test_f1: 0.6844
 epoch: 96, train_loss: 0.3647, test_loss: 1.1903, test_f1: 0.6731
 epoch: 97, train_loss: 0.3590, test_loss: 1.2614, test_f1: 0.6805
 epoch: 98, train_loss: 0.3485, test_loss: 1.2146, test_f1: 0.6701
 epoch: 99, train_loss: 0.3534, test_loss: 1.2164, test_f1: 0.6698
##################ITERATION #4 ****************************************
 epoch: 0, train_loss: 1.1116, test_loss: 0.9608, test_f1: 0.5264
 epoch: 1, train_loss: 0.9937, test_loss: 0.9260, test_f1: 0.5038
 epoch: 2, train_loss: 0.9656, test_loss: 0.8959, test_f1: 0.5242
 epoch: 3, train_loss: 0.9339, test_loss: 0.9009, test_f1: 0.5291
 epoch: 4, train_loss: 0.9193, test_loss: 0.8867, test_f1: 0.5369
 epoch: 5, train_loss: 0.9012, test_loss: 0.8753, test_f1: 0.5194
 epoch: 6, train_loss: 0.8891, test_loss: 0.8425, test_f1: 0.5514
 epoch: 7, train_loss: 0.8674, test_loss: 0.8668, test_f1: 0.5617
 epoch: 8, train_loss: 0.8562, test_loss: 0.8696, test_f1: 0.5702
 epoch: 9, train_loss: 0.8474, test_loss: 0.8437, test_f1: 0.5920
 epoch: 10, train_loss: 0.8271, test_loss: 0.8071, test_f1: 0.5593
 epoch: 11, train_loss: 0.8075, test_loss: 0.8763, test_f1: 0.5566
 epoch: 12, train_loss: 0.8062, test_loss: 0.8421, test_f1: 0.5711
 epoch: 13, train_loss: 0.7988, test_loss: 0.8381, test_f1: 0.5990
 epoch: 14, train_loss: 0.7831, test_loss: 0.8291, test_f1: 0.5900
 epoch: 15, train_loss: 0.7653, test_loss: 0.8165, test_f1: 0.6180
 epoch: 16, train_loss: 0.7650, test_loss: 0.7738, test_f1: 0.6110
 epoch: 17, train_loss: 0.7593, test_loss: 0.8061, test_f1: 0.6060
 epoch: 18, train_loss: 0.7446, test_loss: 0.7866, test_f1: 0.6364
 epoch: 19, train_loss: 0.7331, test_loss: 0.7777, test_f1: 0.6475
 epoch: 20, train_loss: 0.7231, test_loss: 0.7388, test_f1: 0.6658
 epoch: 21, train_loss: 0.6960, test_loss: 0.7740, test_f1: 0.6342
 epoch: 22, train_loss: 0.7054, test_loss: 0.7886, test_f1: 0.6243
 epoch: 23, train_loss: 0.6825, test_loss: 0.7601, test_f1: 0.6314
 epoch: 24, train_loss: 0.6879, test_loss: 0.7217, test_f1: 0.6201
 epoch: 25, train_loss: 0.6702, test_loss: 0.7512, test_f1: 0.6297
 epoch: 26, train_loss: 0.6636, test_loss: 0.8052, test_f1: 0.6179
 epoch: 27, train_loss: 0.6570, test_loss: 0.7620, test_f1: 0.6512
 epoch: 28, train_loss: 0.6546, test_loss: 0.7842, test_f1: 0.6508
 epoch: 29, train_loss: 0.6413, test_loss: 0.7478, test_f1: 0.6458
 epoch: 30, train_loss: 0.6367, test_loss: 0.7830, test_f1: 0.6429
 epoch: 31, train_loss: 0.6232, test_loss: 0.8441, test_f1: 0.6316
 epoch: 32, train_loss: 0.6230, test_loss: 0.8148, test_f1: 0.6533
 epoch: 33, train_loss: 0.6217, test_loss: 0.7512, test_f1: 0.6519
 epoch: 34, train_loss: 0.6086, test_loss: 0.8753, test_f1: 0.6199
 epoch: 35, train_loss: 0.6093, test_loss: 0.7459, test_f1: 0.6457
 epoch: 36, train_loss: 0.6053, test_loss: 0.8047, test_f1: 0.6648
 epoch: 37, train_loss: 0.5755, test_loss: 0.8132, test_f1: 0.6260
 epoch: 38, train_loss: 0.5876, test_loss: 0.7895, test_f1: 0.6311
 epoch: 39, train_loss: 0.5645, test_loss: 0.9022, test_f1: 0.6540
 epoch: 40, train_loss: 0.5657, test_loss: 0.8667, test_f1: 0.6423
 epoch: 41, train_loss: 0.5435, test_loss: 0.8497, test_f1: 0.6465
 epoch: 42, train_loss: 0.5517, test_loss: 0.8974, test_f1: 0.6469
 epoch: 43, train_loss: 0.5453, test_loss: 0.8848, test_f1: 0.6709
 epoch: 44, train_loss: 0.5518, test_loss: 0.8970, test_f1: 0.6726
 epoch: 45, train_loss: 0.5518, test_loss: 0.9290, test_f1: 0.6415
 epoch: 46, train_loss: 0.5413, test_loss: 0.9065, test_f1: 0.6366
 epoch: 47, train_loss: 0.5274, test_loss: 0.8790, test_f1: 0.6593
 epoch: 48, train_loss: 0.5219, test_loss: 0.9211, test_f1: 0.6445
 epoch: 49, train_loss: 0.5126, test_loss: 0.8988, test_f1: 0.6534
 epoch: 50, train_loss: 0.5204, test_loss: 1.0075, test_f1: 0.6614
 epoch: 51, train_loss: 0.4935, test_loss: 0.9735, test_f1: 0.6500
 epoch: 52, train_loss: 0.4818, test_loss: 0.9931, test_f1: 0.6546
 epoch: 53, train_loss: 0.4798, test_loss: 0.9415, test_f1: 0.6542
 epoch: 54, train_loss: 0.4732, test_loss: 1.0064, test_f1: 0.6501
 epoch: 55, train_loss: 0.4525, test_loss: 0.9575, test_f1: 0.6718
 epoch: 56, train_loss: 0.4544, test_loss: 1.0359, test_f1: 0.6643
 epoch: 57, train_loss: 0.4653, test_loss: 0.9866, test_f1: 0.6639
 epoch: 58, train_loss: 0.4634, test_loss: 1.0012, test_f1: 0.6535
 epoch: 59, train_loss: 0.4462, test_loss: 1.0577, test_f1: 0.6668
 epoch: 60, train_loss: 0.4595, test_loss: 0.9943, test_f1: 0.6595
 epoch: 61, train_loss: 0.4616, test_loss: 1.1048, test_f1: 0.6501
 epoch: 62, train_loss: 0.4470, test_loss: 1.1001, test_f1: 0.6320
 epoch: 63, train_loss: 0.4402, test_loss: 1.0898, test_f1: 0.6610
 epoch: 64, train_loss: 0.4311, test_loss: 1.1594, test_f1: 0.6523
 epoch: 65, train_loss: 0.4245, test_loss: 1.1860, test_f1: 0.6321
 epoch: 66, train_loss: 0.4238, test_loss: 1.0780, test_f1: 0.6544
 epoch: 67, train_loss: 0.4180, test_loss: 1.0953, test_f1: 0.6422
 epoch: 68, train_loss: 0.4238, test_loss: 1.2026, test_f1: 0.6379
 epoch: 69, train_loss: 0.4206, test_loss: 1.1844, test_f1: 0.6592
 epoch: 70, train_loss: 0.4105, test_loss: 1.1049, test_f1: 0.6513
 epoch: 71, train_loss: 0.4109, test_loss: 1.0881, test_f1: 0.6555
 epoch: 72, train_loss: 0.4143, test_loss: 1.1870, test_f1: 0.6612
 epoch: 73, train_loss: 0.4162, test_loss: 1.1755, test_f1: 0.6652
 epoch: 74, train_loss: 0.3988, test_loss: 1.1956, test_f1: 0.6561
 epoch: 75, train_loss: 0.4010, test_loss: 1.2028, test_f1: 0.6507
 epoch: 76, train_loss: 0.4037, test_loss: 1.1258, test_f1: 0.6682
 epoch: 77, train_loss: 0.4055, test_loss: 1.1639, test_f1: 0.6832
 epoch: 78, train_loss: 0.4037, test_loss: 1.2507, test_f1: 0.6319
 epoch: 79, train_loss: 0.3857, test_loss: 1.2250, test_f1: 0.6436
 epoch: 80, train_loss: 0.3970, test_loss: 1.2339, test_f1: 0.6489
 epoch: 81, train_loss: 0.3867, test_loss: 1.2653, test_f1: 0.6529
 epoch: 82, train_loss: 0.3872, test_loss: 1.2091, test_f1: 0.6574
 epoch: 83, train_loss: 0.3815, test_loss: 1.2577, test_f1: 0.6624
 epoch: 84, train_loss: 0.3706, test_loss: 1.2802, test_f1: 0.6564
 epoch: 85, train_loss: 0.3873, test_loss: 1.2545, test_f1: 0.6668
 epoch: 86, train_loss: 0.3619, test_loss: 1.3442, test_f1: 0.6602
 epoch: 87, train_loss: 0.3733, test_loss: 1.2604, test_f1: 0.6773
 epoch: 88, train_loss: 0.3547, test_loss: 1.2742, test_f1: 0.6731
 epoch: 89, train_loss: 0.3634, test_loss: 1.3838, test_f1: 0.6499
 epoch: 90, train_loss: 0.3634, test_loss: 1.4109, test_f1: 0.6490
 epoch: 91, train_loss: 0.3692, test_loss: 1.3084, test_f1: 0.6665
 epoch: 92, train_loss: 0.3618, test_loss: 1.2974, test_f1: 0.6512
 epoch: 93, train_loss: 0.3558, test_loss: 1.4150, test_f1: 0.6611
 epoch: 94, train_loss: 0.3581, test_loss: 1.4432, test_f1: 0.6453
 epoch: 95, train_loss: 0.3717, test_loss: 1.4482, test_f1: 0.6542
 epoch: 96, train_loss: 0.3456, test_loss: 1.5042, test_f1: 0.6347
 epoch: 97, train_loss: 0.3480, test_loss: 1.3954, test_f1: 0.6652
 epoch: 98, train_loss: 0.3419, test_loss: 1.3881, test_f1: 0.6466
 epoch: 99, train_loss: 0.3250, test_loss: 1.4216, test_f1: 0.6489
##################ITERATION #5 ****************************************
 epoch: 0, train_loss: 1.1705, test_loss: 0.9853, test_f1: 0.4920
 epoch: 1, train_loss: 1.0070, test_loss: 0.9372, test_f1: 0.5324
 epoch: 2, train_loss: 0.9703, test_loss: 0.9214, test_f1: 0.5040
 epoch: 3, train_loss: 0.9436, test_loss: 0.9093, test_f1: 0.5323
 epoch: 4, train_loss: 0.9232, test_loss: 0.8924, test_f1: 0.5388
 epoch: 5, train_loss: 0.9066, test_loss: 0.9022, test_f1: 0.5497
 epoch: 6, train_loss: 0.8929, test_loss: 0.8517, test_f1: 0.5235
 epoch: 7, train_loss: 0.8702, test_loss: 0.8489, test_f1: 0.5722
 epoch: 8, train_loss: 0.8577, test_loss: 0.8448, test_f1: 0.5449
 epoch: 9, train_loss: 0.8462, test_loss: 0.8358, test_f1: 0.5780
 epoch: 10, train_loss: 0.8372, test_loss: 0.8797, test_f1: 0.5579
 epoch: 11, train_loss: 0.8171, test_loss: 0.8095, test_f1: 0.5839
 epoch: 12, train_loss: 0.8285, test_loss: 0.8130, test_f1: 0.5814
 epoch: 13, train_loss: 0.7992, test_loss: 0.8332, test_f1: 0.6151
 epoch: 14, train_loss: 0.7822, test_loss: 0.8348, test_f1: 0.5536
 epoch: 15, train_loss: 0.7822, test_loss: 0.8063, test_f1: 0.5950
 epoch: 16, train_loss: 0.7710, test_loss: 0.7818, test_f1: 0.6065
 epoch: 17, train_loss: 0.7575, test_loss: 0.7918, test_f1: 0.6121
 epoch: 18, train_loss: 0.7403, test_loss: 0.7661, test_f1: 0.6257
 epoch: 19, train_loss: 0.7430, test_loss: 0.7677, test_f1: 0.6035
 epoch: 20, train_loss: 0.7358, test_loss: 0.7864, test_f1: 0.6440
 epoch: 21, train_loss: 0.7241, test_loss: 0.8145, test_f1: 0.5962
 epoch: 22, train_loss: 0.7147, test_loss: 0.7994, test_f1: 0.6196
 epoch: 23, train_loss: 0.7098, test_loss: 0.7399, test_f1: 0.6623
 epoch: 24, train_loss: 0.6928, test_loss: 0.7743, test_f1: 0.6161
 epoch: 25, train_loss: 0.6910, test_loss: 0.7769, test_f1: 0.6099
 epoch: 26, train_loss: 0.6762, test_loss: 0.7512, test_f1: 0.6423
 epoch: 27, train_loss: 0.6930, test_loss: 0.7890, test_f1: 0.6214
 epoch: 28, train_loss: 0.6620, test_loss: 0.7992, test_f1: 0.6405
 epoch: 29, train_loss: 0.6722, test_loss: 0.7558, test_f1: 0.6594
 epoch: 30, train_loss: 0.6484, test_loss: 0.7376, test_f1: 0.6481
 epoch: 31, train_loss: 0.6364, test_loss: 0.7844, test_f1: 0.6419
 epoch: 32, train_loss: 0.6418, test_loss: 0.8095, test_f1: 0.6420
 epoch: 33, train_loss: 0.6321, test_loss: 0.8264, test_f1: 0.6500
 epoch: 34, train_loss: 0.6271, test_loss: 0.8534, test_f1: 0.6392
 epoch: 35, train_loss: 0.6371, test_loss: 0.7649, test_f1: 0.6386
 epoch: 36, train_loss: 0.6092, test_loss: 0.7724, test_f1: 0.6165
 epoch: 37, train_loss: 0.5984, test_loss: 0.8009, test_f1: 0.6345
 epoch: 38, train_loss: 0.5940, test_loss: 0.8726, test_f1: 0.6465
 epoch: 39, train_loss: 0.5898, test_loss: 0.8376, test_f1: 0.6396
 epoch: 40, train_loss: 0.5872, test_loss: 0.8749, test_f1: 0.6330
 epoch: 41, train_loss: 0.5847, test_loss: 0.8605, test_f1: 0.6510
 epoch: 42, train_loss: 0.5647, test_loss: 0.8409, test_f1: 0.6511
 epoch: 43, train_loss: 0.5763, test_loss: 0.9357, test_f1: 0.6103
 epoch: 44, train_loss: 0.5705, test_loss: 0.9590, test_f1: 0.6378
 epoch: 45, train_loss: 0.5668, test_loss: 0.8931, test_f1: 0.6393
 epoch: 46, train_loss: 0.5476, test_loss: 0.8974, test_f1: 0.6355
 epoch: 47, train_loss: 0.5375, test_loss: 0.9786, test_f1: 0.6336
 epoch: 48, train_loss: 0.5504, test_loss: 0.8802, test_f1: 0.6643
 epoch: 49, train_loss: 0.5333, test_loss: 0.9869, test_f1: 0.6106
 epoch: 50, train_loss: 0.5336, test_loss: 0.8628, test_f1: 0.6550
 epoch: 51, train_loss: 0.5071, test_loss: 0.9291, test_f1: 0.6396
 epoch: 52, train_loss: 0.5010, test_loss: 0.8867, test_f1: 0.6591
 epoch: 53, train_loss: 0.4827, test_loss: 0.9649, test_f1: 0.6379
 epoch: 54, train_loss: 0.4854, test_loss: 1.0028, test_f1: 0.6224
 epoch: 55, train_loss: 0.4984, test_loss: 0.9959, test_f1: 0.6579
 epoch: 56, train_loss: 0.4902, test_loss: 0.9844, test_f1: 0.6354
 epoch: 57, train_loss: 0.4848, test_loss: 0.9862, test_f1: 0.6382
 epoch: 58, train_loss: 0.4829, test_loss: 0.9644, test_f1: 0.6410
 epoch: 59, train_loss: 0.4690, test_loss: 0.9710, test_f1: 0.6397
 epoch: 60, train_loss: 0.4684, test_loss: 1.0078, test_f1: 0.6262
 epoch: 61, train_loss: 0.4666, test_loss: 1.0302, test_f1: 0.6241
 epoch: 62, train_loss: 0.4755, test_loss: 0.9195, test_f1: 0.6335
 epoch: 63, train_loss: 0.4514, test_loss: 0.9547, test_f1: 0.6381
 epoch: 64, train_loss: 0.4499, test_loss: 1.0161, test_f1: 0.6256
 epoch: 65, train_loss: 0.4527, test_loss: 1.0127, test_f1: 0.6419
 epoch: 66, train_loss: 0.4339, test_loss: 0.9906, test_f1: 0.6390
 epoch: 67, train_loss: 0.4413, test_loss: 0.9763, test_f1: 0.6300
 epoch: 68, train_loss: 0.4369, test_loss: 1.0089, test_f1: 0.6351
 epoch: 69, train_loss: 0.4313, test_loss: 1.0350, test_f1: 0.6283
 epoch: 70, train_loss: 0.4367, test_loss: 0.9559, test_f1: 0.6320
 epoch: 71, train_loss: 0.4377, test_loss: 1.0702, test_f1: 0.6309
 epoch: 72, train_loss: 0.4245, test_loss: 1.0833, test_f1: 0.6385
 epoch: 73, train_loss: 0.4301, test_loss: 1.0289, test_f1: 0.6388
 epoch: 74, train_loss: 0.4403, test_loss: 1.0459, test_f1: 0.6467
 epoch: 75, train_loss: 0.4256, test_loss: 1.1211, test_f1: 0.6416
 epoch: 76, train_loss: 0.4207, test_loss: 1.1000, test_f1: 0.6320
 epoch: 77, train_loss: 0.4105, test_loss: 1.1272, test_f1: 0.6390
 epoch: 78, train_loss: 0.4037, test_loss: 1.1507, test_f1: 0.6335
 epoch: 79, train_loss: 0.3975, test_loss: 1.1525, test_f1: 0.6512
 epoch: 80, train_loss: 0.4046, test_loss: 1.1327, test_f1: 0.6421
 epoch: 81, train_loss: 0.4026, test_loss: 1.1238, test_f1: 0.6476
 epoch: 82, train_loss: 0.4014, test_loss: 1.1398, test_f1: 0.6346
 epoch: 83, train_loss: 0.3958, test_loss: 1.1655, test_f1: 0.6483
 epoch: 84, train_loss: 0.3874, test_loss: 1.1781, test_f1: 0.6383
 epoch: 85, train_loss: 0.4090, test_loss: 1.2233, test_f1: 0.6309
 epoch: 86, train_loss: 0.3982, test_loss: 1.2228, test_f1: 0.6422
 epoch: 87, train_loss: 0.3873, test_loss: 1.2706, test_f1: 0.6399
 epoch: 88, train_loss: 0.3774, test_loss: 1.1966, test_f1: 0.6607
 epoch: 89, train_loss: 0.3821, test_loss: 1.2477, test_f1: 0.6540
 epoch: 90, train_loss: 0.3988, test_loss: 1.2398, test_f1: 0.6291
 epoch: 91, train_loss: 0.3690, test_loss: 1.2727, test_f1: 0.6467
 epoch: 92, train_loss: 0.3821, test_loss: 1.2609, test_f1: 0.6311
 epoch: 93, train_loss: 0.3646, test_loss: 1.3072, test_f1: 0.6292
 epoch: 94, train_loss: 0.3667, test_loss: 1.2299, test_f1: 0.6517
 epoch: 95, train_loss: 0.3695, test_loss: 1.3247, test_f1: 0.6711
 epoch: 96, train_loss: 0.3667, test_loss: 1.3196, test_f1: 0.6559
 epoch: 97, train_loss: 0.3652, test_loss: 1.3554, test_f1: 0.6252
 epoch: 98, train_loss: 0.3632, test_loss: 1.3452, test_f1: 0.6688
 epoch: 99, train_loss: 0.3585, test_loss: 1.3972, test_f1: 0.6444
##################ITERATION #6 ****************************************
 epoch: 0, train_loss: 1.1628, test_loss: 1.0417, test_f1: 0.4617
 epoch: 1, train_loss: 1.0137, test_loss: 0.9583, test_f1: 0.5098
 epoch: 2, train_loss: 0.9699, test_loss: 0.9307, test_f1: 0.5421
 epoch: 3, train_loss: 0.9645, test_loss: 0.9164, test_f1: 0.4836
 epoch: 4, train_loss: 0.9397, test_loss: 0.9075, test_f1: 0.5096
 epoch: 5, train_loss: 0.9176, test_loss: 0.8877, test_f1: 0.5320
 epoch: 6, train_loss: 0.8948, test_loss: 0.8837, test_f1: 0.5129
 epoch: 7, train_loss: 0.8912, test_loss: 0.8649, test_f1: 0.5399
 epoch: 8, train_loss: 0.8582, test_loss: 0.8246, test_f1: 0.5507
 epoch: 9, train_loss: 0.8526, test_loss: 0.8498, test_f1: 0.5312
 epoch: 10, train_loss: 0.8460, test_loss: 0.8256, test_f1: 0.5584
 epoch: 11, train_loss: 0.8267, test_loss: 0.8275, test_f1: 0.5660
 epoch: 12, train_loss: 0.8110, test_loss: 0.8219, test_f1: 0.5639
 epoch: 13, train_loss: 0.8041, test_loss: 0.8169, test_f1: 0.5989
 epoch: 14, train_loss: 0.7959, test_loss: 0.7813, test_f1: 0.6010
 epoch: 15, train_loss: 0.7889, test_loss: 0.8123, test_f1: 0.5832
 epoch: 16, train_loss: 0.7688, test_loss: 0.7645, test_f1: 0.5997
 epoch: 17, train_loss: 0.7697, test_loss: 0.8155, test_f1: 0.5918
 epoch: 18, train_loss: 0.7550, test_loss: 0.7741, test_f1: 0.6168
 epoch: 19, train_loss: 0.7455, test_loss: 0.7877, test_f1: 0.6040
 epoch: 20, train_loss: 0.7340, test_loss: 0.7793, test_f1: 0.5943
 epoch: 21, train_loss: 0.7199, test_loss: 0.7579, test_f1: 0.6156
 epoch: 22, train_loss: 0.7251, test_loss: 0.7820, test_f1: 0.6055
 epoch: 23, train_loss: 0.7129, test_loss: 0.7687, test_f1: 0.6279
 epoch: 24, train_loss: 0.6971, test_loss: 0.7646, test_f1: 0.6075
 epoch: 25, train_loss: 0.6964, test_loss: 0.7424, test_f1: 0.6149
 epoch: 26, train_loss: 0.6823, test_loss: 0.7382, test_f1: 0.6176
 epoch: 27, train_loss: 0.6870, test_loss: 0.7501, test_f1: 0.6148
 epoch: 28, train_loss: 0.6746, test_loss: 0.8081, test_f1: 0.6359
 epoch: 29, train_loss: 0.6634, test_loss: 0.7442, test_f1: 0.6559
 epoch: 30, train_loss: 0.6683, test_loss: 0.7904, test_f1: 0.6193
 epoch: 31, train_loss: 0.6425, test_loss: 0.7626, test_f1: 0.6186
 epoch: 32, train_loss: 0.6491, test_loss: 0.7533, test_f1: 0.6592
 epoch: 33, train_loss: 0.6285, test_loss: 0.7541, test_f1: 0.6446
 epoch: 34, train_loss: 0.6343, test_loss: 0.7341, test_f1: 0.6721
 epoch: 35, train_loss: 0.6353, test_loss: 0.7470, test_f1: 0.6401
 epoch: 36, train_loss: 0.6182, test_loss: 0.7657, test_f1: 0.6333
 epoch: 37, train_loss: 0.6075, test_loss: 0.8250, test_f1: 0.6459
 epoch: 38, train_loss: 0.6047, test_loss: 0.8178, test_f1: 0.6492
 epoch: 39, train_loss: 0.6003, test_loss: 0.7770, test_f1: 0.6613
 epoch: 40, train_loss: 0.5868, test_loss: 0.7602, test_f1: 0.6410
 epoch: 41, train_loss: 0.5790, test_loss: 0.7992, test_f1: 0.6493
 epoch: 42, train_loss: 0.5994, test_loss: 0.7776, test_f1: 0.6322
 epoch: 43, train_loss: 0.5813, test_loss: 0.8481, test_f1: 0.6181
 epoch: 44, train_loss: 0.5695, test_loss: 0.8081, test_f1: 0.6817
 epoch: 45, train_loss: 0.5672, test_loss: 0.7981, test_f1: 0.6366
 epoch: 46, train_loss: 0.5537, test_loss: 0.7682, test_f1: 0.6615
 epoch: 47, train_loss: 0.5461, test_loss: 0.7873, test_f1: 0.6616
 epoch: 48, train_loss: 0.5475, test_loss: 0.7765, test_f1: 0.6847
 epoch: 49, train_loss: 0.5370, test_loss: 0.8452, test_f1: 0.6801
 epoch: 50, train_loss: 0.5362, test_loss: 0.8932, test_f1: 0.6388
 epoch: 51, train_loss: 0.5122, test_loss: 0.8639, test_f1: 0.6437
 epoch: 52, train_loss: 0.5134, test_loss: 0.8032, test_f1: 0.6703
 epoch: 53, train_loss: 0.4910, test_loss: 0.8281, test_f1: 0.6506
 epoch: 54, train_loss: 0.4922, test_loss: 0.8716, test_f1: 0.6433
 epoch: 55, train_loss: 0.4790, test_loss: 0.8720, test_f1: 0.6476
 epoch: 56, train_loss: 0.4818, test_loss: 0.8724, test_f1: 0.6373
 epoch: 57, train_loss: 0.4787, test_loss: 0.8451, test_f1: 0.6348
 epoch: 58, train_loss: 0.4758, test_loss: 0.8750, test_f1: 0.6475
 epoch: 59, train_loss: 0.4586, test_loss: 0.8793, test_f1: 0.6622
 epoch: 60, train_loss: 0.4698, test_loss: 0.9011, test_f1: 0.6481
 epoch: 61, train_loss: 0.4530, test_loss: 0.9699, test_f1: 0.6375
 epoch: 62, train_loss: 0.4712, test_loss: 0.9006, test_f1: 0.6466
 epoch: 63, train_loss: 0.4638, test_loss: 0.9274, test_f1: 0.6367
 epoch: 64, train_loss: 0.4471, test_loss: 0.8886, test_f1: 0.6445
 epoch: 65, train_loss: 0.4572, test_loss: 0.9079, test_f1: 0.6321
 epoch: 66, train_loss: 0.4597, test_loss: 0.9379, test_f1: 0.6317
 epoch: 67, train_loss: 0.4459, test_loss: 0.8977, test_f1: 0.6593
 epoch: 68, train_loss: 0.4478, test_loss: 1.0141, test_f1: 0.6307
 epoch: 69, train_loss: 0.4568, test_loss: 0.9320, test_f1: 0.6392
 epoch: 70, train_loss: 0.4376, test_loss: 0.8875, test_f1: 0.6459
 epoch: 71, train_loss: 0.4313, test_loss: 0.9282, test_f1: 0.6538
 epoch: 72, train_loss: 0.4256, test_loss: 0.9783, test_f1: 0.6480
 epoch: 73, train_loss: 0.4265, test_loss: 0.9455, test_f1: 0.6572
 epoch: 74, train_loss: 0.4404, test_loss: 0.9644, test_f1: 0.6315
 epoch: 75, train_loss: 0.4223, test_loss: 1.0149, test_f1: 0.6399
 epoch: 76, train_loss: 0.4268, test_loss: 0.9534, test_f1: 0.6277
 epoch: 77, train_loss: 0.4250, test_loss: 0.9377, test_f1: 0.6507
 epoch: 78, train_loss: 0.4228, test_loss: 0.9602, test_f1: 0.6425
 epoch: 79, train_loss: 0.4203, test_loss: 0.9504, test_f1: 0.6609
 epoch: 80, train_loss: 0.3965, test_loss: 0.9971, test_f1: 0.6400
 epoch: 81, train_loss: 0.4166, test_loss: 0.9921, test_f1: 0.6549
 epoch: 82, train_loss: 0.4042, test_loss: 1.0532, test_f1: 0.6435
 epoch: 83, train_loss: 0.3918, test_loss: 1.0587, test_f1: 0.6430
 epoch: 84, train_loss: 0.3976, test_loss: 1.0740, test_f1: 0.6407
 epoch: 85, train_loss: 0.3926, test_loss: 1.0966, test_f1: 0.6442
 epoch: 86, train_loss: 0.3760, test_loss: 1.1934, test_f1: 0.6316
 epoch: 87, train_loss: 0.3898, test_loss: 1.1018, test_f1: 0.6380
 epoch: 88, train_loss: 0.3877, test_loss: 1.0792, test_f1: 0.6499
 epoch: 89, train_loss: 0.3851, test_loss: 1.0788, test_f1: 0.6349
 epoch: 90, train_loss: 0.3906, test_loss: 1.1400, test_f1: 0.6533
 epoch: 91, train_loss: 0.3802, test_loss: 1.1701, test_f1: 0.6381
 epoch: 92, train_loss: 0.3871, test_loss: 1.1909, test_f1: 0.6406
 epoch: 93, train_loss: 0.3767, test_loss: 1.1810, test_f1: 0.6317
 epoch: 94, train_loss: 0.3755, test_loss: 1.0163, test_f1: 0.6633
 epoch: 95, train_loss: 0.3593, test_loss: 1.1853, test_f1: 0.6485
 epoch: 96, train_loss: 0.3618, test_loss: 1.2860, test_f1: 0.6331
 epoch: 97, train_loss: 0.3698, test_loss: 1.1916, test_f1: 0.6390
 epoch: 98, train_loss: 0.3646, test_loss: 1.2042, test_f1: 0.6566
 epoch: 99, train_loss: 0.3414, test_loss: 1.2694, test_f1: 0.6395
##################ITERATION #7 ****************************************
 epoch: 0, train_loss: 1.1589, test_loss: 0.9788, test_f1: 0.4900
 epoch: 1, train_loss: 1.0378, test_loss: 0.9670, test_f1: 0.5172
 epoch: 2, train_loss: 0.9867, test_loss: 0.9137, test_f1: 0.4872
 epoch: 3, train_loss: 0.9551, test_loss: 0.9013, test_f1: 0.5534
 epoch: 4, train_loss: 0.9263, test_loss: 0.8905, test_f1: 0.5529
 epoch: 5, train_loss: 0.9169, test_loss: 0.8924, test_f1: 0.5471
 epoch: 6, train_loss: 0.8982, test_loss: 0.8467, test_f1: 0.5320
 epoch: 7, train_loss: 0.8736, test_loss: 0.8368, test_f1: 0.5180
 epoch: 8, train_loss: 0.8742, test_loss: 0.8379, test_f1: 0.5570
 epoch: 9, train_loss: 0.8555, test_loss: 0.8202, test_f1: 0.5412
 epoch: 10, train_loss: 0.8342, test_loss: 0.8565, test_f1: 0.5505
 epoch: 11, train_loss: 0.8331, test_loss: 0.8241, test_f1: 0.5480
 epoch: 12, train_loss: 0.8159, test_loss: 0.7990, test_f1: 0.5751
 epoch: 13, train_loss: 0.8127, test_loss: 0.7930, test_f1: 0.5774
 epoch: 14, train_loss: 0.7893, test_loss: 0.8131, test_f1: 0.6118
 epoch: 15, train_loss: 0.7851, test_loss: 0.7767, test_f1: 0.5916
 epoch: 16, train_loss: 0.7702, test_loss: 0.7746, test_f1: 0.5965
 epoch: 17, train_loss: 0.7751, test_loss: 0.7743, test_f1: 0.6162
 epoch: 18, train_loss: 0.7565, test_loss: 0.7579, test_f1: 0.6164
 epoch: 19, train_loss: 0.7411, test_loss: 0.7491, test_f1: 0.6363
 epoch: 20, train_loss: 0.7314, test_loss: 0.7342, test_f1: 0.6208
 epoch: 21, train_loss: 0.7256, test_loss: 0.7613, test_f1: 0.5989
 epoch: 22, train_loss: 0.7304, test_loss: 0.7454, test_f1: 0.6387
 epoch: 23, train_loss: 0.7140, test_loss: 0.7415, test_f1: 0.6106
 epoch: 24, train_loss: 0.6985, test_loss: 0.7337, test_f1: 0.6411
 epoch: 25, train_loss: 0.6880, test_loss: 0.7584, test_f1: 0.6634
 epoch: 26, train_loss: 0.6939, test_loss: 0.7237, test_f1: 0.6469
 epoch: 27, train_loss: 0.6828, test_loss: 0.7352, test_f1: 0.6473
 epoch: 28, train_loss: 0.6842, test_loss: 0.7296, test_f1: 0.6786
 epoch: 29, train_loss: 0.6691, test_loss: 0.7963, test_f1: 0.6761
 epoch: 30, train_loss: 0.6639, test_loss: 0.8086, test_f1: 0.6559
 epoch: 31, train_loss: 0.6464, test_loss: 0.7656, test_f1: 0.6453
 epoch: 32, train_loss: 0.6436, test_loss: 0.7324, test_f1: 0.6765
 epoch: 33, train_loss: 0.6410, test_loss: 0.7525, test_f1: 0.6801
 epoch: 34, train_loss: 0.6306, test_loss: 0.7613, test_f1: 0.6761
 epoch: 35, train_loss: 0.6322, test_loss: 0.7232, test_f1: 0.6920
 epoch: 36, train_loss: 0.6308, test_loss: 0.7691, test_f1: 0.6826
 epoch: 37, train_loss: 0.6064, test_loss: 0.7377, test_f1: 0.6774
 epoch: 38, train_loss: 0.6115, test_loss: 0.7080, test_f1: 0.6773
 epoch: 39, train_loss: 0.6025, test_loss: 0.8026, test_f1: 0.6441
 epoch: 40, train_loss: 0.6121, test_loss: 0.8503, test_f1: 0.6743
 epoch: 41, train_loss: 0.5961, test_loss: 0.8693, test_f1: 0.6721
 epoch: 42, train_loss: 0.5816, test_loss: 0.7510, test_f1: 0.6765
 epoch: 43, train_loss: 0.5924, test_loss: 0.7770, test_f1: 0.6606
 epoch: 44, train_loss: 0.5727, test_loss: 0.8294, test_f1: 0.6523
 epoch: 45, train_loss: 0.5654, test_loss: 0.8170, test_f1: 0.6437
 epoch: 46, train_loss: 0.5593, test_loss: 0.7289, test_f1: 0.6901
 epoch: 47, train_loss: 0.5622, test_loss: 0.7313, test_f1: 0.6862
 epoch: 48, train_loss: 0.5468, test_loss: 0.7829, test_f1: 0.6613
 epoch: 49, train_loss: 0.5441, test_loss: 0.7737, test_f1: 0.6957
 epoch: 50, train_loss: 0.5447, test_loss: 0.7394, test_f1: 0.6620
 epoch: 51, train_loss: 0.5236, test_loss: 0.7525, test_f1: 0.6757
 epoch: 52, train_loss: 0.5071, test_loss: 0.7804, test_f1: 0.6817
 epoch: 53, train_loss: 0.4994, test_loss: 0.8082, test_f1: 0.6644
 epoch: 54, train_loss: 0.4993, test_loss: 0.7655, test_f1: 0.6813
 epoch: 55, train_loss: 0.4954, test_loss: 0.8820, test_f1: 0.6754
 epoch: 56, train_loss: 0.5017, test_loss: 0.8331, test_f1: 0.6534
 epoch: 57, train_loss: 0.4890, test_loss: 0.8077, test_f1: 0.6642
 epoch: 58, train_loss: 0.4787, test_loss: 0.8259, test_f1: 0.6671
 epoch: 59, train_loss: 0.4799, test_loss: 0.8385, test_f1: 0.6600
 epoch: 60, train_loss: 0.4762, test_loss: 0.8455, test_f1: 0.6856
 epoch: 61, train_loss: 0.4611, test_loss: 0.8002, test_f1: 0.6800
 epoch: 62, train_loss: 0.4710, test_loss: 0.8357, test_f1: 0.6635
 epoch: 63, train_loss: 0.4777, test_loss: 0.9006, test_f1: 0.6583
 epoch: 64, train_loss: 0.4550, test_loss: 0.9323, test_f1: 0.6408
 epoch: 65, train_loss: 0.4773, test_loss: 0.8891, test_f1: 0.6432
 epoch: 66, train_loss: 0.4700, test_loss: 0.8911, test_f1: 0.6352
 epoch: 67, train_loss: 0.4651, test_loss: 0.8716, test_f1: 0.6554
 epoch: 68, train_loss: 0.4584, test_loss: 0.9129, test_f1: 0.6526
 epoch: 69, train_loss: 0.4584, test_loss: 0.8666, test_f1: 0.6839
 epoch: 70, train_loss: 0.4500, test_loss: 0.8938, test_f1: 0.6632
 epoch: 71, train_loss: 0.4315, test_loss: 0.9242, test_f1: 0.6485
 epoch: 72, train_loss: 0.4492, test_loss: 0.9175, test_f1: 0.6597
 epoch: 73, train_loss: 0.4359, test_loss: 0.8492, test_f1: 0.6715
 epoch: 74, train_loss: 0.4378, test_loss: 0.9125, test_f1: 0.6615
 epoch: 75, train_loss: 0.4254, test_loss: 0.9149, test_f1: 0.6726
 epoch: 76, train_loss: 0.4313, test_loss: 0.9451, test_f1: 0.6844
 epoch: 77, train_loss: 0.4264, test_loss: 0.9048, test_f1: 0.6736
 epoch: 78, train_loss: 0.4178, test_loss: 0.9404, test_f1: 0.6804
 epoch: 79, train_loss: 0.4131, test_loss: 0.9717, test_f1: 0.6797
 epoch: 80, train_loss: 0.4109, test_loss: 0.9538, test_f1: 0.6898
 epoch: 81, train_loss: 0.4146, test_loss: 0.9555, test_f1: 0.6726
 epoch: 82, train_loss: 0.4084, test_loss: 0.9944, test_f1: 0.6701
 epoch: 83, train_loss: 0.4077, test_loss: 0.9502, test_f1: 0.6885
 epoch: 84, train_loss: 0.4031, test_loss: 0.9797, test_f1: 0.6607
 epoch: 85, train_loss: 0.4042, test_loss: 0.9903, test_f1: 0.6735
 epoch: 86, train_loss: 0.4033, test_loss: 0.9601, test_f1: 0.6706
 epoch: 87, train_loss: 0.3932, test_loss: 0.9648, test_f1: 0.6796
 epoch: 88, train_loss: 0.3875, test_loss: 0.9579, test_f1: 0.6881
 epoch: 89, train_loss: 0.4050, test_loss: 1.0355, test_f1: 0.6689
 epoch: 90, train_loss: 0.3852, test_loss: 1.0084, test_f1: 0.6851
 epoch: 91, train_loss: 0.3743, test_loss: 1.0423, test_f1: 0.6668
 epoch: 92, train_loss: 0.3960, test_loss: 1.0066, test_f1: 0.6890
 epoch: 93, train_loss: 0.3621, test_loss: 1.0342, test_f1: 0.6704
 epoch: 94, train_loss: 0.3843, test_loss: 1.0625, test_f1: 0.6708
 epoch: 95, train_loss: 0.3784, test_loss: 1.0080, test_f1: 0.6933
 epoch: 96, train_loss: 0.3737, test_loss: 1.1108, test_f1: 0.6731
 epoch: 97, train_loss: 0.3840, test_loss: 1.0960, test_f1: 0.6699
 epoch: 98, train_loss: 0.3858, test_loss: 1.0933, test_f1: 0.6768
 epoch: 99, train_loss: 0.3649, test_loss: 1.0583, test_f1: 0.6966
##################ITERATION #8 ****************************************
 epoch: 0, train_loss: 1.2114, test_loss: 0.9733, test_f1: 0.4964
 epoch: 1, train_loss: 1.0339, test_loss: 0.9781, test_f1: 0.4786
 epoch: 2, train_loss: 0.9912, test_loss: 0.9554, test_f1: 0.4919
 epoch: 3, train_loss: 0.9538, test_loss: 0.9363, test_f1: 0.5281
 epoch: 4, train_loss: 0.9380, test_loss: 0.9222, test_f1: 0.5110
 epoch: 5, train_loss: 0.9046, test_loss: 0.9070, test_f1: 0.5350
 epoch: 6, train_loss: 0.9143, test_loss: 0.8875, test_f1: 0.5276
 epoch: 7, train_loss: 0.8870, test_loss: 0.8853, test_f1: 0.5638
 epoch: 8, train_loss: 0.8688, test_loss: 0.8742, test_f1: 0.5312
 epoch: 9, train_loss: 0.8771, test_loss: 0.8741, test_f1: 0.5833
 epoch: 10, train_loss: 0.8482, test_loss: 0.8634, test_f1: 0.5400
 epoch: 11, train_loss: 0.8261, test_loss: 0.8409, test_f1: 0.5765
 epoch: 12, train_loss: 0.8150, test_loss: 0.8474, test_f1: 0.5766
 epoch: 13, train_loss: 0.8129, test_loss: 0.8212, test_f1: 0.5761
 epoch: 14, train_loss: 0.8051, test_loss: 0.7931, test_f1: 0.5781
 epoch: 15, train_loss: 0.7852, test_loss: 0.8199, test_f1: 0.5942
 epoch: 16, train_loss: 0.7860, test_loss: 0.7908, test_f1: 0.6003
 epoch: 17, train_loss: 0.7799, test_loss: 0.7935, test_f1: 0.5960
 epoch: 18, train_loss: 0.7632, test_loss: 0.7937, test_f1: 0.5921
 epoch: 19, train_loss: 0.7562, test_loss: 0.7851, test_f1: 0.6055
 epoch: 20, train_loss: 0.7455, test_loss: 0.7799, test_f1: 0.5775
 epoch: 21, train_loss: 0.7353, test_loss: 0.7824, test_f1: 0.5881
 epoch: 22, train_loss: 0.7232, test_loss: 0.7723, test_f1: 0.5859
 epoch: 23, train_loss: 0.7222, test_loss: 0.7739, test_f1: 0.5879
 epoch: 24, train_loss: 0.7165, test_loss: 0.7657, test_f1: 0.6133
 epoch: 25, train_loss: 0.7083, test_loss: 0.7614, test_f1: 0.6149
 epoch: 26, train_loss: 0.6917, test_loss: 0.7777, test_f1: 0.6122
 epoch: 27, train_loss: 0.7109, test_loss: 0.7425, test_f1: 0.6357
 epoch: 28, train_loss: 0.6901, test_loss: 0.7616, test_f1: 0.6112
 epoch: 29, train_loss: 0.6854, test_loss: 0.7562, test_f1: 0.5985
 epoch: 30, train_loss: 0.6760, test_loss: 0.7480, test_f1: 0.6242
 epoch: 31, train_loss: 0.6727, test_loss: 0.7539, test_f1: 0.6739
 epoch: 32, train_loss: 0.6503, test_loss: 0.7673, test_f1: 0.6597
 epoch: 33, train_loss: 0.6669, test_loss: 0.7428, test_f1: 0.6539
 epoch: 34, train_loss: 0.6511, test_loss: 0.7457, test_f1: 0.6442
 epoch: 35, train_loss: 0.6244, test_loss: 0.7842, test_f1: 0.6362
 epoch: 36, train_loss: 0.6270, test_loss: 0.7578, test_f1: 0.6367
 epoch: 37, train_loss: 0.6255, test_loss: 0.7535, test_f1: 0.6429
 epoch: 38, train_loss: 0.6277, test_loss: 0.7988, test_f1: 0.6211
 epoch: 39, train_loss: 0.6194, test_loss: 0.7825, test_f1: 0.6573
 epoch: 40, train_loss: 0.6147, test_loss: 0.7559, test_f1: 0.6345
 epoch: 41, train_loss: 0.5933, test_loss: 0.7792, test_f1: 0.6448
 epoch: 42, train_loss: 0.5927, test_loss: 0.8094, test_f1: 0.6370
 epoch: 43, train_loss: 0.5889, test_loss: 0.8000, test_f1: 0.6271
 epoch: 44, train_loss: 0.6079, test_loss: 0.7901, test_f1: 0.6429
 epoch: 45, train_loss: 0.5862, test_loss: 0.8001, test_f1: 0.6298
 epoch: 46, train_loss: 0.5824, test_loss: 0.8026, test_f1: 0.6720
 epoch: 47, train_loss: 0.5723, test_loss: 0.8168, test_f1: 0.6349
 epoch: 48, train_loss: 0.5667, test_loss: 0.8276, test_f1: 0.6263
 epoch: 49, train_loss: 0.5813, test_loss: 0.8532, test_f1: 0.6351
 epoch: 50, train_loss: 0.5537, test_loss: 0.8131, test_f1: 0.6502
 epoch: 51, train_loss: 0.5352, test_loss: 0.7973, test_f1: 0.6668
 epoch: 52, train_loss: 0.5353, test_loss: 0.7987, test_f1: 0.6680
 epoch: 53, train_loss: 0.5206, test_loss: 0.8160, test_f1: 0.6394
 epoch: 54, train_loss: 0.5103, test_loss: 0.8294, test_f1: 0.6353
 epoch: 55, train_loss: 0.5181, test_loss: 0.8572, test_f1: 0.6377
 epoch: 56, train_loss: 0.5032, test_loss: 0.8573, test_f1: 0.6396
 epoch: 57, train_loss: 0.5084, test_loss: 0.8270, test_f1: 0.6534
 epoch: 58, train_loss: 0.5135, test_loss: 0.8320, test_f1: 0.6464
 epoch: 59, train_loss: 0.5068, test_loss: 0.8212, test_f1: 0.6593
 epoch: 60, train_loss: 0.5085, test_loss: 0.8141, test_f1: 0.6363
 epoch: 61, train_loss: 0.5026, test_loss: 0.8346, test_f1: 0.6395
 epoch: 62, train_loss: 0.4843, test_loss: 0.8730, test_f1: 0.6332
 epoch: 63, train_loss: 0.4860, test_loss: 0.8807, test_f1: 0.6264
 epoch: 64, train_loss: 0.4875, test_loss: 0.8424, test_f1: 0.6539
 epoch: 65, train_loss: 0.4823, test_loss: 0.8618, test_f1: 0.6506
 epoch: 66, train_loss: 0.4822, test_loss: 0.9098, test_f1: 0.6357
 epoch: 67, train_loss: 0.4724, test_loss: 0.9093, test_f1: 0.6558
 epoch: 68, train_loss: 0.4615, test_loss: 0.8660, test_f1: 0.6804
 epoch: 69, train_loss: 0.4646, test_loss: 0.8950, test_f1: 0.6386
 epoch: 70, train_loss: 0.4639, test_loss: 0.8692, test_f1: 0.6573
 epoch: 71, train_loss: 0.4509, test_loss: 0.8876, test_f1: 0.6466
 epoch: 72, train_loss: 0.4571, test_loss: 0.8613, test_f1: 0.6229
 epoch: 73, train_loss: 0.4578, test_loss: 0.9341, test_f1: 0.6257
 epoch: 74, train_loss: 0.4519, test_loss: 0.9501, test_f1: 0.6395
 epoch: 75, train_loss: 0.4478, test_loss: 0.9278, test_f1: 0.6246
 epoch: 76, train_loss: 0.4414, test_loss: 0.8956, test_f1: 0.6359
 epoch: 77, train_loss: 0.4446, test_loss: 0.9389, test_f1: 0.6424
 epoch: 78, train_loss: 0.4243, test_loss: 0.9533, test_f1: 0.6393
 epoch: 79, train_loss: 0.4274, test_loss: 0.9396, test_f1: 0.6439
 epoch: 80, train_loss: 0.4264, test_loss: 0.9799, test_f1: 0.6362
 epoch: 81, train_loss: 0.4355, test_loss: 0.9183, test_f1: 0.6382
 epoch: 82, train_loss: 0.4183, test_loss: 0.9598, test_f1: 0.6357
 epoch: 83, train_loss: 0.4346, test_loss: 0.9290, test_f1: 0.6600
 epoch: 84, train_loss: 0.4292, test_loss: 0.9583, test_f1: 0.6416
 epoch: 85, train_loss: 0.4162, test_loss: 0.9677, test_f1: 0.6432
 epoch: 86, train_loss: 0.4143, test_loss: 1.0014, test_f1: 0.6467
 epoch: 87, train_loss: 0.4273, test_loss: 1.0001, test_f1: 0.6364
 epoch: 88, train_loss: 0.4219, test_loss: 0.9958, test_f1: 0.6363
 epoch: 89, train_loss: 0.4160, test_loss: 1.0095, test_f1: 0.6518
 epoch: 90, train_loss: 0.4020, test_loss: 1.0445, test_f1: 0.6339
 epoch: 91, train_loss: 0.4057, test_loss: 1.0366, test_f1: 0.6515
 epoch: 92, train_loss: 0.4055, test_loss: 1.0366, test_f1: 0.6277
 epoch: 93, train_loss: 0.3961, test_loss: 1.0261, test_f1: 0.6468
 epoch: 94, train_loss: 0.4088, test_loss: 1.0759, test_f1: 0.6449
 epoch: 95, train_loss: 0.4013, test_loss: 1.0893, test_f1: 0.6275
 epoch: 96, train_loss: 0.4052, test_loss: 1.0718, test_f1: 0.6327
 epoch: 97, train_loss: 0.3967, test_loss: 1.0747, test_f1: 0.6366
 epoch: 98, train_loss: 0.3905, test_loss: 1.1301, test_f1: 0.6144
 epoch: 99, train_loss: 0.3773, test_loss: 1.0024, test_f1: 0.6340
##################ITERATION #9 ****************************************
 epoch: 0, train_loss: 1.2856, test_loss: 0.9509, test_f1: 0.4976
 epoch: 1, train_loss: 1.0480, test_loss: 0.9735, test_f1: 0.4748
 epoch: 2, train_loss: 1.0085, test_loss: 0.9411, test_f1: 0.4855
 epoch: 3, train_loss: 0.9609, test_loss: 0.9221, test_f1: 0.5073
 epoch: 4, train_loss: 0.9436, test_loss: 0.9482, test_f1: 0.5043
 epoch: 5, train_loss: 0.9139, test_loss: 0.9195, test_f1: 0.4920
 epoch: 6, train_loss: 0.9173, test_loss: 0.8818, test_f1: 0.5070
 epoch: 7, train_loss: 0.9000, test_loss: 0.8860, test_f1: 0.5083
 epoch: 8, train_loss: 0.8778, test_loss: 0.8594, test_f1: 0.5195
 epoch: 9, train_loss: 0.8769, test_loss: 0.8206, test_f1: 0.5480
 epoch: 10, train_loss: 0.8510, test_loss: 0.8209, test_f1: 0.5606
 epoch: 11, train_loss: 0.8491, test_loss: 0.8143, test_f1: 0.5584
 epoch: 12, train_loss: 0.8270, test_loss: 0.7944, test_f1: 0.6241
 epoch: 13, train_loss: 0.8211, test_loss: 0.8087, test_f1: 0.5771
 epoch: 14, train_loss: 0.8001, test_loss: 0.7958, test_f1: 0.6056
 epoch: 15, train_loss: 0.8068, test_loss: 0.7892, test_f1: 0.6098
 epoch: 16, train_loss: 0.7999, test_loss: 0.7823, test_f1: 0.6191
 epoch: 17, train_loss: 0.7765, test_loss: 0.7806, test_f1: 0.6050
 epoch: 18, train_loss: 0.7610, test_loss: 0.7722, test_f1: 0.6296
 epoch: 19, train_loss: 0.7448, test_loss: 0.7854, test_f1: 0.6088
 epoch: 20, train_loss: 0.7532, test_loss: 0.8057, test_f1: 0.5989
 epoch: 21, train_loss: 0.7345, test_loss: 0.7667, test_f1: 0.6418
 epoch: 22, train_loss: 0.7298, test_loss: 0.7739, test_f1: 0.6436
 epoch: 23, train_loss: 0.7274, test_loss: 0.7729, test_f1: 0.6260
 epoch: 24, train_loss: 0.7211, test_loss: 0.7649, test_f1: 0.6227
 epoch: 25, train_loss: 0.7059, test_loss: 0.7718, test_f1: 0.6366
 epoch: 26, train_loss: 0.6932, test_loss: 0.7814, test_f1: 0.6380
 epoch: 27, train_loss: 0.6995, test_loss: 0.8208, test_f1: 0.6464
 epoch: 28, train_loss: 0.6808, test_loss: 0.7731, test_f1: 0.6299
 epoch: 29, train_loss: 0.6701, test_loss: 0.7726, test_f1: 0.6337
 epoch: 30, train_loss: 0.6701, test_loss: 0.7524, test_f1: 0.6479
 epoch: 31, train_loss: 0.6786, test_loss: 0.7693, test_f1: 0.6256
 epoch: 32, train_loss: 0.6649, test_loss: 0.7706, test_f1: 0.6397
 epoch: 33, train_loss: 0.6451, test_loss: 0.7663, test_f1: 0.6244
 epoch: 34, train_loss: 0.6565, test_loss: 0.7867, test_f1: 0.6410
 epoch: 35, train_loss: 0.6520, test_loss: 0.7958, test_f1: 0.6268
 epoch: 36, train_loss: 0.6410, test_loss: 0.7924, test_f1: 0.6245
 epoch: 37, train_loss: 0.6308, test_loss: 0.7640, test_f1: 0.6319
 epoch: 38, train_loss: 0.6204, test_loss: 0.7950, test_f1: 0.6210
 epoch: 39, train_loss: 0.6196, test_loss: 0.8600, test_f1: 0.6471
 epoch: 40, train_loss: 0.6060, test_loss: 0.8048, test_f1: 0.6392
 epoch: 41, train_loss: 0.6123, test_loss: 0.8125, test_f1: 0.6542
 epoch: 42, train_loss: 0.6173, test_loss: 0.8273, test_f1: 0.6312
 epoch: 43, train_loss: 0.5984, test_loss: 0.8360, test_f1: 0.6306
 epoch: 44, train_loss: 0.5884, test_loss: 0.8217, test_f1: 0.6657
 epoch: 45, train_loss: 0.5800, test_loss: 0.8162, test_f1: 0.6443
 epoch: 46, train_loss: 0.5677, test_loss: 0.8741, test_f1: 0.6492
 epoch: 47, train_loss: 0.5730, test_loss: 0.8256, test_f1: 0.6498
 epoch: 48, train_loss: 0.5740, test_loss: 0.8840, test_f1: 0.6472
 epoch: 49, train_loss: 0.5723, test_loss: 0.8743, test_f1: 0.6163
 epoch: 50, train_loss: 0.5448, test_loss: 0.9161, test_f1: 0.6190
 epoch: 51, train_loss: 0.5366, test_loss: 0.9245, test_f1: 0.6373
 epoch: 52, train_loss: 0.5223, test_loss: 0.8892, test_f1: 0.6484
 epoch: 53, train_loss: 0.5188, test_loss: 0.9096, test_f1: 0.6390
 epoch: 54, train_loss: 0.5126, test_loss: 0.9137, test_f1: 0.6464
 epoch: 55, train_loss: 0.5011, test_loss: 0.9083, test_f1: 0.6479
 epoch: 56, train_loss: 0.5044, test_loss: 0.9377, test_f1: 0.6289
 epoch: 57, train_loss: 0.4854, test_loss: 0.9579, test_f1: 0.6448
 epoch: 58, train_loss: 0.4886, test_loss: 0.9620, test_f1: 0.6436
 epoch: 59, train_loss: 0.4899, test_loss: 0.9783, test_f1: 0.6375
 epoch: 60, train_loss: 0.4944, test_loss: 1.0204, test_f1: 0.6431
 epoch: 61, train_loss: 0.4892, test_loss: 1.0122, test_f1: 0.6450
 epoch: 62, train_loss: 0.4859, test_loss: 1.0509, test_f1: 0.6493
 epoch: 63, train_loss: 0.4796, test_loss: 1.0143, test_f1: 0.6559
 epoch: 64, train_loss: 0.4610, test_loss: 1.0341, test_f1: 0.6403
 epoch: 65, train_loss: 0.4764, test_loss: 1.0672, test_f1: 0.6404
 epoch: 66, train_loss: 0.4626, test_loss: 1.0146, test_f1: 0.6372
 epoch: 67, train_loss: 0.4663, test_loss: 0.9848, test_f1: 0.6354
 epoch: 68, train_loss: 0.4657, test_loss: 1.0782, test_f1: 0.6516
 epoch: 69, train_loss: 0.4652, test_loss: 1.0080, test_f1: 0.6315
 epoch: 70, train_loss: 0.4647, test_loss: 1.0770, test_f1: 0.6336
 epoch: 71, train_loss: 0.4594, test_loss: 1.0751, test_f1: 0.6558
 epoch: 72, train_loss: 0.4411, test_loss: 1.0950, test_f1: 0.6463
 epoch: 73, train_loss: 0.4437, test_loss: 1.0412, test_f1: 0.6612
 epoch: 74, train_loss: 0.4504, test_loss: 1.0545, test_f1: 0.6391
 epoch: 75, train_loss: 0.4419, test_loss: 1.0044, test_f1: 0.6459
 epoch: 76, train_loss: 0.4415, test_loss: 1.1224, test_f1: 0.6342
 epoch: 77, train_loss: 0.4334, test_loss: 1.1375, test_f1: 0.6510
 epoch: 78, train_loss: 0.4233, test_loss: 1.1722, test_f1: 0.6439
 epoch: 79, train_loss: 0.4186, test_loss: 1.1081, test_f1: 0.6667
 epoch: 80, train_loss: 0.4388, test_loss: 1.0545, test_f1: 0.6529
 epoch: 81, train_loss: 0.4264, test_loss: 1.0777, test_f1: 0.6573
 epoch: 82, train_loss: 0.4379, test_loss: 1.1492, test_f1: 0.6233
 epoch: 83, train_loss: 0.4119, test_loss: 1.1408, test_f1: 0.6399
 epoch: 84, train_loss: 0.4287, test_loss: 1.1380, test_f1: 0.6560
 epoch: 85, train_loss: 0.4182, test_loss: 1.1113, test_f1: 0.6301
 epoch: 86, train_loss: 0.4159, test_loss: 1.1114, test_f1: 0.6254
 epoch: 87, train_loss: 0.4022, test_loss: 1.1785, test_f1: 0.6457
 epoch: 88, train_loss: 0.4145, test_loss: 1.2089, test_f1: 0.6406
 epoch: 89, train_loss: 0.4068, test_loss: 1.2055, test_f1: 0.6378
 epoch: 90, train_loss: 0.4082, test_loss: 1.2122, test_f1: 0.6370
 epoch: 91, train_loss: 0.3936, test_loss: 1.2439, test_f1: 0.6670
 epoch: 92, train_loss: 0.4033, test_loss: 1.1179, test_f1: 0.6374
 epoch: 93, train_loss: 0.3902, test_loss: 1.1027, test_f1: 0.6692
 epoch: 94, train_loss: 0.3883, test_loss: 1.1141, test_f1: 0.6680
 epoch: 95, train_loss: 0.3982, test_loss: 1.1546, test_f1: 0.6719
 epoch: 96, train_loss: 0.3835, test_loss: 1.2322, test_f1: 0.6592
 epoch: 97, train_loss: 0.3970, test_loss: 1.0985, test_f1: 0.6727
 epoch: 98, train_loss: 0.3932, test_loss: 1.1796, test_f1: 0.6473
 epoch: 99, train_loss: 0.3831, test_loss: 1.2777, test_f1: 0.6568

Training completed in 1195.85 seconds
Best F1: 0.6983 at epoch 30
Mean F1 across iterations: 0.6782  0.0149
========================FINAL RESULTS================================
FEGIN weighted F1: 0.6983  0.0149
python main.py --data ltspice_examples --representation component_pin_net --model FEGIN --layers 4 --hiddens 128 --batch_size 32 --lr 0.0001 --emb_size 512 --epochs 100 --save_appendix component_pin_net_L4_H128_BS32_LR0.0001_E512 --no_val
-----



STDERR:
  File "main.py", line 370, in <module>
    main()
  File "main.py", line 254, in main
    dataset = dataset_class(
  File "/home/philip/projects/ltspice_examples_code_repo/Circuit-Completion-Using-GNNs/component_classification_with_link_prediction_head/evaluation/FEGIN/kernel/circuit_datasets.py", line 15, in __init__
    self.data, self.slices = torch.load(self.processed_paths[0])
  File "/home/philip/.local/lib/python3.8/site-packages/torch/serialization.py", line 1040, in load
    warnings.warn(
  File "/usr/lib/python3.8/warnings.py", line 109, in _showwarnmsg
    sw(msg.message, msg.category, msg.filename, msg.lineno,
  File "main.py", line 47, in warn_with_traceback
    traceback.print_stack(file=log)
/home/philip/projects/ltspice_examples_code_repo/Circuit-Completion-Using-GNNs/component_classification_with_link_prediction_head/evaluation/FEGIN/kernel/circuit_datasets.py:15: FutureWarning: You are using `torch.load` with `weights_only=False` (the current default value), which uses the default pickle module implicitly. It is possible to construct malicious pickle data which will execute arbitrary code during unpickling (See https://github.com/pytorch/pytorch/blob/main/SECURITY.md#untrusted-models for more details). In a future release, the default value for `weights_only` will be flipped to `True`. This limits the functions that could be executed during unpickling. Arbitrary objects will no longer be allowed to be loaded via this mode unless they are explicitly allowlisted by the user via `torch.serialization.add_safe_globals`. We recommend you start setting `weights_only=True` for any use case where you don't have full control of the loaded file. Please open an issue on GitHub for any issues related to this experimental feature.
  self.data, self.slices = torch.load(self.processed_paths[0])
