STDOUT:
Results will be saved in /home/philip/projects/ltspice_examples_code_repo/Circuit-Completion-Using-GNNs/component_classification_with_link_prediction_head/evaluation/FEGIN/results/model_FEGIN_dataset_ltspice_examples
Command line input: python main.py --data ltspice_examples --representation component_net --model FEGIN --layers 2 --hiddens 16 --batch_size 256 --lr 0.001 --emb_size 250 --epochs 100 --save_appendix component_net_L2_H16_BS256_LR0.001_E250 --no_val
 is saved.
-----
ltspice_examples - FEGIN
Using 2 layers, 16 hidden units, h = 2
Loading component_net representation dataset
ENTERED
Training FEGIN on component_net representation
Train: 3558, Test: 846
##################ITERATION #0 ****************************************
 epoch: 0, train_loss: 1.4087, test_loss: 1.3918, test_f1: 0.1004
 epoch: 1, train_loss: 1.3876, test_loss: 1.3821, test_f1: 0.1004
 epoch: 2, train_loss: 1.3740, test_loss: 1.3699, test_f1: 0.1004
 epoch: 3, train_loss: 1.3585, test_loss: 1.3522, test_f1: 0.1703
 epoch: 4, train_loss: 1.3376, test_loss: 1.3266, test_f1: 0.3329
 epoch: 5, train_loss: 1.3141, test_loss: 1.2949, test_f1: 0.2373
 epoch: 6, train_loss: 1.2866, test_loss: 1.2683, test_f1: 0.2285
 epoch: 7, train_loss: 1.2665, test_loss: 1.2492, test_f1: 0.2289
 epoch: 8, train_loss: 1.2531, test_loss: 1.2319, test_f1: 0.2368
 epoch: 9, train_loss: 1.2419, test_loss: 1.2168, test_f1: 0.2439
 epoch: 10, train_loss: 1.2282, test_loss: 1.2013, test_f1: 0.2790
 epoch: 11, train_loss: 1.2103, test_loss: 1.1865, test_f1: 0.2951
 epoch: 12, train_loss: 1.1923, test_loss: 1.1661, test_f1: 0.3666
 epoch: 13, train_loss: 1.1838, test_loss: 1.1467, test_f1: 0.3848
 epoch: 14, train_loss: 1.1660, test_loss: 1.1280, test_f1: 0.3953
 epoch: 15, train_loss: 1.1469, test_loss: 1.1070, test_f1: 0.3978
 epoch: 16, train_loss: 1.1294, test_loss: 1.0994, test_f1: 0.3971
 epoch: 17, train_loss: 1.1114, test_loss: 1.0770, test_f1: 0.4074
 epoch: 18, train_loss: 1.1111, test_loss: 1.0853, test_f1: 0.3938
 epoch: 19, train_loss: 1.0897, test_loss: 1.0526, test_f1: 0.4300
 epoch: 20, train_loss: 1.0837, test_loss: 1.0588, test_f1: 0.4016
 epoch: 21, train_loss: 1.0703, test_loss: 1.0440, test_f1: 0.4227
 epoch: 22, train_loss: 1.0576, test_loss: 1.0332, test_f1: 0.4134
 epoch: 23, train_loss: 1.0482, test_loss: 1.0231, test_f1: 0.4260
 epoch: 24, train_loss: 1.0519, test_loss: 1.0225, test_f1: 0.4625
 epoch: 25, train_loss: 1.0333, test_loss: 1.0228, test_f1: 0.4561
 epoch: 26, train_loss: 1.0307, test_loss: 1.0151, test_f1: 0.4614
 epoch: 27, train_loss: 1.0198, test_loss: 1.0016, test_f1: 0.4563
 epoch: 28, train_loss: 1.0220, test_loss: 1.0020, test_f1: 0.4621
 epoch: 29, train_loss: 1.0142, test_loss: 0.9980, test_f1: 0.4426
 epoch: 30, train_loss: 1.0025, test_loss: 0.9818, test_f1: 0.4837
 epoch: 31, train_loss: 1.0067, test_loss: 1.0002, test_f1: 0.4823
 epoch: 32, train_loss: 0.9997, test_loss: 0.9873, test_f1: 0.4792
 epoch: 33, train_loss: 0.9966, test_loss: 0.9970, test_f1: 0.4841
 epoch: 34, train_loss: 0.9886, test_loss: 0.9699, test_f1: 0.4933
 epoch: 35, train_loss: 0.9768, test_loss: 0.9818, test_f1: 0.4875
 epoch: 36, train_loss: 0.9778, test_loss: 0.9733, test_f1: 0.4721
 epoch: 37, train_loss: 0.9773, test_loss: 1.0001, test_f1: 0.4923
 epoch: 38, train_loss: 0.9810, test_loss: 0.9844, test_f1: 0.4876
 epoch: 39, train_loss: 0.9716, test_loss: 0.9536, test_f1: 0.4830
 epoch: 40, train_loss: 0.9625, test_loss: 0.9860, test_f1: 0.4964
 epoch: 41, train_loss: 0.9708, test_loss: 0.9668, test_f1: 0.4928
 epoch: 42, train_loss: 0.9704, test_loss: 0.9546, test_f1: 0.4901
 epoch: 43, train_loss: 0.9606, test_loss: 0.9472, test_f1: 0.4905
 epoch: 44, train_loss: 0.9576, test_loss: 0.9551, test_f1: 0.5092
 epoch: 45, train_loss: 0.9584, test_loss: 0.9682, test_f1: 0.5052
 epoch: 46, train_loss: 0.9474, test_loss: 0.9471, test_f1: 0.4935
 epoch: 47, train_loss: 0.9347, test_loss: 0.9549, test_f1: 0.5225
 epoch: 48, train_loss: 0.9458, test_loss: 0.9272, test_f1: 0.5140
 epoch: 49, train_loss: 0.9317, test_loss: 0.9573, test_f1: 0.5159
 epoch: 50, train_loss: 0.9417, test_loss: 0.9390, test_f1: 0.5011
 epoch: 51, train_loss: 0.9328, test_loss: 0.9570, test_f1: 0.5340
 epoch: 52, train_loss: 0.9314, test_loss: 0.9328, test_f1: 0.5299
 epoch: 53, train_loss: 0.9261, test_loss: 0.9404, test_f1: 0.5285
 epoch: 54, train_loss: 0.9242, test_loss: 0.9296, test_f1: 0.5174
 epoch: 55, train_loss: 0.9271, test_loss: 0.9620, test_f1: 0.5296
 epoch: 56, train_loss: 0.9238, test_loss: 0.9265, test_f1: 0.5318
 epoch: 57, train_loss: 0.9294, test_loss: 0.9208, test_f1: 0.5283
 epoch: 58, train_loss: 0.9266, test_loss: 0.9582, test_f1: 0.5279
 epoch: 59, train_loss: 0.9286, test_loss: 0.9190, test_f1: 0.5297
 epoch: 60, train_loss: 0.9226, test_loss: 0.9580, test_f1: 0.5277
 epoch: 61, train_loss: 0.9242, test_loss: 0.9305, test_f1: 0.5269
 epoch: 62, train_loss: 0.9203, test_loss: 0.9486, test_f1: 0.5324
 epoch: 63, train_loss: 0.9149, test_loss: 0.9514, test_f1: 0.5376
 epoch: 64, train_loss: 0.9098, test_loss: 0.9325, test_f1: 0.5339
 epoch: 65, train_loss: 0.9150, test_loss: 0.9372, test_f1: 0.5335
 epoch: 66, train_loss: 0.9173, test_loss: 0.9390, test_f1: 0.5354
 epoch: 67, train_loss: 0.9055, test_loss: 0.9307, test_f1: 0.5245
 epoch: 68, train_loss: 0.9092, test_loss: 0.9313, test_f1: 0.5305
 epoch: 69, train_loss: 0.9090, test_loss: 0.9439, test_f1: 0.5345
 epoch: 70, train_loss: 0.9126, test_loss: 0.9311, test_f1: 0.5350
 epoch: 71, train_loss: 0.9101, test_loss: 0.9277, test_f1: 0.5264
 epoch: 72, train_loss: 0.9086, test_loss: 0.9470, test_f1: 0.5399
 epoch: 73, train_loss: 0.9025, test_loss: 0.9390, test_f1: 0.5328
 epoch: 74, train_loss: 0.9058, test_loss: 0.9274, test_f1: 0.5329
 epoch: 75, train_loss: 0.9029, test_loss: 0.9408, test_f1: 0.5364
 epoch: 76, train_loss: 0.9022, test_loss: 0.9329, test_f1: 0.5317
 epoch: 77, train_loss: 0.8985, test_loss: 0.9375, test_f1: 0.5324
 epoch: 78, train_loss: 0.9087, test_loss: 0.9264, test_f1: 0.5224
 epoch: 79, train_loss: 0.9022, test_loss: 0.9652, test_f1: 0.5346
 epoch: 80, train_loss: 0.9037, test_loss: 0.9130, test_f1: 0.5354
 epoch: 81, train_loss: 0.8997, test_loss: 0.9486, test_f1: 0.5310
 epoch: 82, train_loss: 0.8927, test_loss: 0.9307, test_f1: 0.5220
 epoch: 83, train_loss: 0.8946, test_loss: 0.9270, test_f1: 0.5321
 epoch: 84, train_loss: 0.8949, test_loss: 0.9286, test_f1: 0.5305
 epoch: 85, train_loss: 0.8905, test_loss: 0.9375, test_f1: 0.5358
 epoch: 86, train_loss: 0.8936, test_loss: 0.9346, test_f1: 0.5345
 epoch: 87, train_loss: 0.8833, test_loss: 0.9313, test_f1: 0.5246
 epoch: 88, train_loss: 0.8951, test_loss: 0.9340, test_f1: 0.5322
 epoch: 89, train_loss: 0.9050, test_loss: 0.9373, test_f1: 0.5288
 epoch: 90, train_loss: 0.8949, test_loss: 0.9162, test_f1: 0.5292
 epoch: 91, train_loss: 0.8960, test_loss: 0.9163, test_f1: 0.5381
 epoch: 92, train_loss: 0.8908, test_loss: 0.9434, test_f1: 0.5342
 epoch: 93, train_loss: 0.8944, test_loss: 0.9396, test_f1: 0.5298
 epoch: 94, train_loss: 0.8856, test_loss: 0.9344, test_f1: 0.5364
 epoch: 95, train_loss: 0.8879, test_loss: 0.9312, test_f1: 0.5342
 epoch: 96, train_loss: 0.8829, test_loss: 0.9412, test_f1: 0.5332
 epoch: 97, train_loss: 0.8865, test_loss: 0.9417, test_f1: 0.5388
 epoch: 98, train_loss: 0.8850, test_loss: 0.9309, test_f1: 0.5255
 epoch: 99, train_loss: 0.8927, test_loss: 0.9670, test_f1: 0.5366
##################ITERATION #1 ****************************************
 epoch: 0, train_loss: 1.3274, test_loss: 1.3347, test_f1: 0.1004
 epoch: 1, train_loss: 1.2865, test_loss: 1.3136, test_f1: 0.2270
 epoch: 2, train_loss: 1.2609, test_loss: 1.2709, test_f1: 0.2270
 epoch: 3, train_loss: 1.2380, test_loss: 1.2240, test_f1: 0.2591
 epoch: 4, train_loss: 1.2184, test_loss: 1.1865, test_f1: 0.3206
 epoch: 5, train_loss: 1.1944, test_loss: 1.1531, test_f1: 0.3301
 epoch: 6, train_loss: 1.1688, test_loss: 1.1220, test_f1: 0.3370
 epoch: 7, train_loss: 1.1437, test_loss: 1.1005, test_f1: 0.3450
 epoch: 8, train_loss: 1.1223, test_loss: 1.0855, test_f1: 0.3525
 epoch: 9, train_loss: 1.1072, test_loss: 1.0721, test_f1: 0.3705
 epoch: 10, train_loss: 1.0943, test_loss: 1.0601, test_f1: 0.3777
 epoch: 11, train_loss: 1.0844, test_loss: 1.0534, test_f1: 0.3844
 epoch: 12, train_loss: 1.0687, test_loss: 1.0435, test_f1: 0.4063
 epoch: 13, train_loss: 1.0615, test_loss: 1.0384, test_f1: 0.4118
 epoch: 14, train_loss: 1.0570, test_loss: 1.0397, test_f1: 0.4104
 epoch: 15, train_loss: 1.0435, test_loss: 1.0251, test_f1: 0.4235
 epoch: 16, train_loss: 1.0363, test_loss: 1.0169, test_f1: 0.4287
 epoch: 17, train_loss: 1.0210, test_loss: 1.0091, test_f1: 0.4404
 epoch: 18, train_loss: 1.0200, test_loss: 1.0053, test_f1: 0.4382
 epoch: 19, train_loss: 1.0133, test_loss: 1.0147, test_f1: 0.4458
 epoch: 20, train_loss: 0.9991, test_loss: 0.9955, test_f1: 0.4462
 epoch: 21, train_loss: 0.9949, test_loss: 0.9945, test_f1: 0.4441
 epoch: 22, train_loss: 0.9939, test_loss: 1.0047, test_f1: 0.4558
 epoch: 23, train_loss: 0.9860, test_loss: 0.9878, test_f1: 0.4539
 epoch: 24, train_loss: 0.9780, test_loss: 0.9935, test_f1: 0.4768
 epoch: 25, train_loss: 0.9807, test_loss: 0.9909, test_f1: 0.4871
 epoch: 26, train_loss: 0.9684, test_loss: 1.0064, test_f1: 0.4978
 epoch: 27, train_loss: 0.9635, test_loss: 0.9819, test_f1: 0.4903
 epoch: 28, train_loss: 0.9614, test_loss: 0.9664, test_f1: 0.4865
 epoch: 29, train_loss: 0.9641, test_loss: 0.9753, test_f1: 0.5014
 epoch: 30, train_loss: 0.9564, test_loss: 0.9723, test_f1: 0.5034
 epoch: 31, train_loss: 0.9531, test_loss: 0.9755, test_f1: 0.5109
 epoch: 32, train_loss: 0.9458, test_loss: 0.9769, test_f1: 0.5053
 epoch: 33, train_loss: 0.9462, test_loss: 0.9651, test_f1: 0.5093
 epoch: 34, train_loss: 0.9414, test_loss: 0.9689, test_f1: 0.5180
 epoch: 35, train_loss: 0.9382, test_loss: 0.9717, test_f1: 0.5174
 epoch: 36, train_loss: 0.9418, test_loss: 0.9716, test_f1: 0.5120
 epoch: 37, train_loss: 0.9424, test_loss: 0.9797, test_f1: 0.5074
 epoch: 38, train_loss: 0.9420, test_loss: 0.9703, test_f1: 0.4949
 epoch: 39, train_loss: 0.9247, test_loss: 0.9593, test_f1: 0.5117
 epoch: 40, train_loss: 0.9249, test_loss: 0.9664, test_f1: 0.5098
 epoch: 41, train_loss: 0.9196, test_loss: 0.9564, test_f1: 0.4988
 epoch: 42, train_loss: 0.9103, test_loss: 0.9759, test_f1: 0.5044
 epoch: 43, train_loss: 0.9226, test_loss: 0.9585, test_f1: 0.5001
 epoch: 44, train_loss: 0.9126, test_loss: 0.9713, test_f1: 0.4925
 epoch: 45, train_loss: 0.9077, test_loss: 0.9756, test_f1: 0.5089
 epoch: 46, train_loss: 0.9093, test_loss: 0.9970, test_f1: 0.4921
 epoch: 47, train_loss: 0.9141, test_loss: 0.9475, test_f1: 0.5165
 epoch: 48, train_loss: 0.9140, test_loss: 0.9666, test_f1: 0.5145
 epoch: 49, train_loss: 0.8996, test_loss: 0.9707, test_f1: 0.4974
 epoch: 50, train_loss: 0.8994, test_loss: 0.9737, test_f1: 0.5062
 epoch: 51, train_loss: 0.9143, test_loss: 0.9675, test_f1: 0.5077
 epoch: 52, train_loss: 0.8915, test_loss: 0.9531, test_f1: 0.5176
 epoch: 53, train_loss: 0.8857, test_loss: 0.9482, test_f1: 0.5171
 epoch: 54, train_loss: 0.8885, test_loss: 0.9514, test_f1: 0.5146
 epoch: 55, train_loss: 0.8919, test_loss: 0.9460, test_f1: 0.5167
 epoch: 56, train_loss: 0.8892, test_loss: 0.9506, test_f1: 0.5156
 epoch: 57, train_loss: 0.8916, test_loss: 0.9442, test_f1: 0.5167
 epoch: 58, train_loss: 0.8832, test_loss: 0.9458, test_f1: 0.5125
 epoch: 59, train_loss: 0.8868, test_loss: 0.9424, test_f1: 0.5103
 epoch: 60, train_loss: 0.8916, test_loss: 0.9622, test_f1: 0.5121
 epoch: 61, train_loss: 0.8791, test_loss: 0.9488, test_f1: 0.5161
 epoch: 62, train_loss: 0.8815, test_loss: 0.9664, test_f1: 0.5080
 epoch: 63, train_loss: 0.8837, test_loss: 0.9502, test_f1: 0.5123
 epoch: 64, train_loss: 0.8876, test_loss: 0.9547, test_f1: 0.4999
 epoch: 65, train_loss: 0.8936, test_loss: 0.9456, test_f1: 0.5228
 epoch: 66, train_loss: 0.8850, test_loss: 0.9345, test_f1: 0.5129
 epoch: 67, train_loss: 0.8800, test_loss: 0.9499, test_f1: 0.5056
 epoch: 68, train_loss: 0.8804, test_loss: 0.9549, test_f1: 0.5027
 epoch: 69, train_loss: 0.8739, test_loss: 0.9469, test_f1: 0.5134
 epoch: 70, train_loss: 0.8774, test_loss: 0.9469, test_f1: 0.5164
 epoch: 71, train_loss: 0.8714, test_loss: 0.9456, test_f1: 0.5086
 epoch: 72, train_loss: 0.8743, test_loss: 0.9525, test_f1: 0.5176
 epoch: 73, train_loss: 0.8777, test_loss: 0.9605, test_f1: 0.5037
 epoch: 74, train_loss: 0.8729, test_loss: 0.9513, test_f1: 0.5166
 epoch: 75, train_loss: 0.8749, test_loss: 0.9471, test_f1: 0.5080
 epoch: 76, train_loss: 0.8700, test_loss: 0.9345, test_f1: 0.5170
 epoch: 77, train_loss: 0.8671, test_loss: 0.9429, test_f1: 0.5147
 epoch: 78, train_loss: 0.8695, test_loss: 0.9618, test_f1: 0.5142
 epoch: 79, train_loss: 0.8706, test_loss: 0.9441, test_f1: 0.5258
 epoch: 80, train_loss: 0.8717, test_loss: 0.9440, test_f1: 0.4962
 epoch: 81, train_loss: 0.8667, test_loss: 0.9505, test_f1: 0.5171
 epoch: 82, train_loss: 0.8636, test_loss: 0.9497, test_f1: 0.5118
 epoch: 83, train_loss: 0.8628, test_loss: 0.9781, test_f1: 0.5161
 epoch: 84, train_loss: 0.8716, test_loss: 0.9726, test_f1: 0.5080
 epoch: 85, train_loss: 0.8703, test_loss: 0.9557, test_f1: 0.5097
 epoch: 86, train_loss: 0.8645, test_loss: 0.9649, test_f1: 0.5168
 epoch: 87, train_loss: 0.8602, test_loss: 0.9678, test_f1: 0.5104
 epoch: 88, train_loss: 0.8528, test_loss: 0.9636, test_f1: 0.5388
 epoch: 89, train_loss: 0.8624, test_loss: 0.9618, test_f1: 0.5134
 epoch: 90, train_loss: 0.8660, test_loss: 0.9657, test_f1: 0.5235
 epoch: 91, train_loss: 0.8526, test_loss: 0.9738, test_f1: 0.5245
 epoch: 92, train_loss: 0.8678, test_loss: 0.9401, test_f1: 0.5157
 epoch: 93, train_loss: 0.8544, test_loss: 0.9518, test_f1: 0.5209
 epoch: 94, train_loss: 0.8610, test_loss: 0.9560, test_f1: 0.5276
 epoch: 95, train_loss: 0.8513, test_loss: 0.9628, test_f1: 0.5326
 epoch: 96, train_loss: 0.8532, test_loss: 0.9704, test_f1: 0.5366
 epoch: 97, train_loss: 0.8474, test_loss: 0.9447, test_f1: 0.5303
 epoch: 98, train_loss: 0.8508, test_loss: 0.9819, test_f1: 0.5340
 epoch: 99, train_loss: 0.8611, test_loss: 0.9593, test_f1: 0.5235
##################ITERATION #2 ****************************************
 epoch: 0, train_loss: 1.2916, test_loss: 1.3140, test_f1: 0.2270
 epoch: 1, train_loss: 1.2397, test_loss: 1.2988, test_f1: 0.2270
 epoch: 2, train_loss: 1.2187, test_loss: 1.2531, test_f1: 0.2270
 epoch: 3, train_loss: 1.1948, test_loss: 1.1999, test_f1: 0.2295
 epoch: 4, train_loss: 1.1771, test_loss: 1.1543, test_f1: 0.3036
 epoch: 5, train_loss: 1.1484, test_loss: 1.1142, test_f1: 0.3825
 epoch: 6, train_loss: 1.1288, test_loss: 1.0904, test_f1: 0.3955
 epoch: 7, train_loss: 1.1133, test_loss: 1.0699, test_f1: 0.4163
 epoch: 8, train_loss: 1.0895, test_loss: 1.0582, test_f1: 0.3953
 epoch: 9, train_loss: 1.0772, test_loss: 1.0353, test_f1: 0.3930
 epoch: 10, train_loss: 1.0647, test_loss: 1.0214, test_f1: 0.4219
 epoch: 11, train_loss: 1.0540, test_loss: 1.0193, test_f1: 0.4006
 epoch: 12, train_loss: 1.0423, test_loss: 1.0108, test_f1: 0.4164
 epoch: 13, train_loss: 1.0264, test_loss: 0.9993, test_f1: 0.4124
 epoch: 14, train_loss: 1.0258, test_loss: 1.0138, test_f1: 0.4174
 epoch: 15, train_loss: 1.0266, test_loss: 1.0030, test_f1: 0.4212
 epoch: 16, train_loss: 1.0141, test_loss: 0.9842, test_f1: 0.4419
 epoch: 17, train_loss: 1.0046, test_loss: 0.9865, test_f1: 0.4455
 epoch: 18, train_loss: 1.0064, test_loss: 0.9796, test_f1: 0.4439
 epoch: 19, train_loss: 1.0141, test_loss: 0.9883, test_f1: 0.4671
 epoch: 20, train_loss: 0.9978, test_loss: 0.9932, test_f1: 0.4452
 epoch: 21, train_loss: 0.9813, test_loss: 0.9807, test_f1: 0.4669
 epoch: 22, train_loss: 0.9802, test_loss: 0.9749, test_f1: 0.4726
 epoch: 23, train_loss: 0.9794, test_loss: 0.9609, test_f1: 0.4902
 epoch: 24, train_loss: 0.9681, test_loss: 0.9645, test_f1: 0.4827
 epoch: 25, train_loss: 0.9635, test_loss: 0.9499, test_f1: 0.4701
 epoch: 26, train_loss: 0.9717, test_loss: 0.9500, test_f1: 0.4825
 epoch: 27, train_loss: 0.9641, test_loss: 0.9731, test_f1: 0.4896
 epoch: 28, train_loss: 0.9606, test_loss: 0.9650, test_f1: 0.4884
 epoch: 29, train_loss: 0.9565, test_loss: 0.9524, test_f1: 0.4794
 epoch: 30, train_loss: 0.9438, test_loss: 0.9451, test_f1: 0.4882
 epoch: 31, train_loss: 0.9387, test_loss: 0.9466, test_f1: 0.4864
 epoch: 32, train_loss: 0.9427, test_loss: 0.9481, test_f1: 0.4941
 epoch: 33, train_loss: 0.9387, test_loss: 0.9622, test_f1: 0.4954
 epoch: 34, train_loss: 0.9356, test_loss: 0.9737, test_f1: 0.4828
 epoch: 35, train_loss: 0.9253, test_loss: 0.9339, test_f1: 0.5184
 epoch: 36, train_loss: 0.9201, test_loss: 0.9466, test_f1: 0.5139
 epoch: 37, train_loss: 0.9164, test_loss: 0.9117, test_f1: 0.5104
 epoch: 38, train_loss: 0.9164, test_loss: 0.9550, test_f1: 0.5082
 epoch: 39, train_loss: 0.9291, test_loss: 0.9585, test_f1: 0.4956
 epoch: 40, train_loss: 0.9259, test_loss: 0.9496, test_f1: 0.5163
 epoch: 41, train_loss: 0.9206, test_loss: 0.9517, test_f1: 0.5151
 epoch: 42, train_loss: 0.9103, test_loss: 0.9249, test_f1: 0.5072
 epoch: 43, train_loss: 0.9176, test_loss: 0.9561, test_f1: 0.4877
 epoch: 44, train_loss: 0.9099, test_loss: 0.9332, test_f1: 0.5096
 epoch: 45, train_loss: 0.9045, test_loss: 0.9476, test_f1: 0.5094
 epoch: 46, train_loss: 0.9127, test_loss: 0.9682, test_f1: 0.4963
 epoch: 47, train_loss: 0.8978, test_loss: 0.9289, test_f1: 0.5032
 epoch: 48, train_loss: 0.8995, test_loss: 0.9233, test_f1: 0.5088
 epoch: 49, train_loss: 0.9001, test_loss: 0.9095, test_f1: 0.5201
 epoch: 50, train_loss: 0.8913, test_loss: 0.9139, test_f1: 0.5242
 epoch: 51, train_loss: 0.8975, test_loss: 0.9493, test_f1: 0.5014
 epoch: 52, train_loss: 0.8883, test_loss: 0.9084, test_f1: 0.5213
 epoch: 53, train_loss: 0.8914, test_loss: 0.9246, test_f1: 0.5099
 epoch: 54, train_loss: 0.8934, test_loss: 0.9032, test_f1: 0.5196
 epoch: 55, train_loss: 0.8906, test_loss: 0.9635, test_f1: 0.5134
 epoch: 56, train_loss: 0.8903, test_loss: 0.9472, test_f1: 0.5066
 epoch: 57, train_loss: 0.9066, test_loss: 0.9225, test_f1: 0.5126
 epoch: 58, train_loss: 0.8815, test_loss: 0.9286, test_f1: 0.5217
 epoch: 59, train_loss: 0.8751, test_loss: 0.9328, test_f1: 0.5202
 epoch: 60, train_loss: 0.8824, test_loss: 0.9223, test_f1: 0.5277
 epoch: 61, train_loss: 0.8831, test_loss: 0.9264, test_f1: 0.5251
 epoch: 62, train_loss: 0.8879, test_loss: 0.9339, test_f1: 0.5298
 epoch: 63, train_loss: 0.8797, test_loss: 0.9374, test_f1: 0.5169
 epoch: 64, train_loss: 0.8803, test_loss: 0.9348, test_f1: 0.5214
 epoch: 65, train_loss: 0.8788, test_loss: 0.9201, test_f1: 0.5172
 epoch: 66, train_loss: 0.8815, test_loss: 0.9463, test_f1: 0.5143
 epoch: 67, train_loss: 0.8789, test_loss: 0.9155, test_f1: 0.5214
 epoch: 68, train_loss: 0.8771, test_loss: 0.9218, test_f1: 0.5173
 epoch: 69, train_loss: 0.8761, test_loss: 0.9245, test_f1: 0.5191
 epoch: 70, train_loss: 0.8821, test_loss: 0.9402, test_f1: 0.5155
 epoch: 71, train_loss: 0.8776, test_loss: 0.9368, test_f1: 0.5169
 epoch: 72, train_loss: 0.8607, test_loss: 0.9360, test_f1: 0.5105
 epoch: 73, train_loss: 0.8699, test_loss: 0.9320, test_f1: 0.5205
 epoch: 74, train_loss: 0.8663, test_loss: 0.9447, test_f1: 0.5190
 epoch: 75, train_loss: 0.8755, test_loss: 0.9337, test_f1: 0.5150
 epoch: 76, train_loss: 0.8691, test_loss: 0.9488, test_f1: 0.5191
 epoch: 77, train_loss: 0.8692, test_loss: 0.9376, test_f1: 0.5167
 epoch: 78, train_loss: 0.8673, test_loss: 0.9371, test_f1: 0.5173
 epoch: 79, train_loss: 0.8692, test_loss: 0.9480, test_f1: 0.5145
 epoch: 80, train_loss: 0.8775, test_loss: 0.9500, test_f1: 0.4938
 epoch: 81, train_loss: 0.8776, test_loss: 0.9683, test_f1: 0.5024
 epoch: 82, train_loss: 0.8798, test_loss: 0.9415, test_f1: 0.5246
 epoch: 83, train_loss: 0.8687, test_loss: 0.9319, test_f1: 0.5170
 epoch: 84, train_loss: 0.8646, test_loss: 0.9300, test_f1: 0.5179
 epoch: 85, train_loss: 0.8559, test_loss: 0.9314, test_f1: 0.5236
 epoch: 86, train_loss: 0.8690, test_loss: 0.9263, test_f1: 0.5225
 epoch: 87, train_loss: 0.8659, test_loss: 0.9371, test_f1: 0.5234
 epoch: 88, train_loss: 0.8722, test_loss: 0.9223, test_f1: 0.5153
 epoch: 89, train_loss: 0.8649, test_loss: 0.9666, test_f1: 0.5221
 epoch: 90, train_loss: 0.8557, test_loss: 0.9185, test_f1: 0.5152
 epoch: 91, train_loss: 0.8679, test_loss: 0.9359, test_f1: 0.5201
 epoch: 92, train_loss: 0.8559, test_loss: 0.9357, test_f1: 0.5070
 epoch: 93, train_loss: 0.8617, test_loss: 0.9234, test_f1: 0.5259
 epoch: 94, train_loss: 0.8556, test_loss: 0.9377, test_f1: 0.5192
 epoch: 95, train_loss: 0.8638, test_loss: 0.9403, test_f1: 0.5295
 epoch: 96, train_loss: 0.8683, test_loss: 0.9322, test_f1: 0.5227
 epoch: 97, train_loss: 0.8637, test_loss: 0.9495, test_f1: 0.5102
 epoch: 98, train_loss: 0.8431, test_loss: 0.9370, test_f1: 0.5208
 epoch: 99, train_loss: 0.8466, test_loss: 0.9381, test_f1: 0.5182
##################ITERATION #3 ****************************************
 epoch: 0, train_loss: 1.2930, test_loss: 1.3161, test_f1: 0.2270
 epoch: 1, train_loss: 1.2358, test_loss: 1.2894, test_f1: 0.2270
 epoch: 2, train_loss: 1.2065, test_loss: 1.2617, test_f1: 0.2270
 epoch: 3, train_loss: 1.1909, test_loss: 1.2249, test_f1: 0.2295
 epoch: 4, train_loss: 1.1766, test_loss: 1.1911, test_f1: 0.2495
 epoch: 5, train_loss: 1.1652, test_loss: 1.1422, test_f1: 0.3228
 epoch: 6, train_loss: 1.1537, test_loss: 1.1139, test_f1: 0.3689
 epoch: 7, train_loss: 1.1457, test_loss: 1.0845, test_f1: 0.3907
 epoch: 8, train_loss: 1.1302, test_loss: 1.0983, test_f1: 0.3833
 epoch: 9, train_loss: 1.1242, test_loss: 1.0676, test_f1: 0.4097
 epoch: 10, train_loss: 1.1158, test_loss: 1.0560, test_f1: 0.4173
 epoch: 11, train_loss: 1.1084, test_loss: 1.0481, test_f1: 0.4178
 epoch: 12, train_loss: 1.1017, test_loss: 1.0468, test_f1: 0.4086
 epoch: 13, train_loss: 1.0864, test_loss: 1.0340, test_f1: 0.4116
 epoch: 14, train_loss: 1.0836, test_loss: 1.0249, test_f1: 0.4254
 epoch: 15, train_loss: 1.0796, test_loss: 1.0213, test_f1: 0.4178
 epoch: 16, train_loss: 1.0688, test_loss: 1.0191, test_f1: 0.4289
 epoch: 17, train_loss: 1.0725, test_loss: 1.0158, test_f1: 0.4256
 epoch: 18, train_loss: 1.0569, test_loss: 1.0146, test_f1: 0.4497
 epoch: 19, train_loss: 1.0550, test_loss: 1.0077, test_f1: 0.4496
 epoch: 20, train_loss: 1.0480, test_loss: 1.0078, test_f1: 0.4322
 epoch: 21, train_loss: 1.0302, test_loss: 0.9962, test_f1: 0.4540
 epoch: 22, train_loss: 1.0326, test_loss: 0.9935, test_f1: 0.4504
 epoch: 23, train_loss: 1.0222, test_loss: 1.0053, test_f1: 0.4585
 epoch: 24, train_loss: 1.0147, test_loss: 0.9979, test_f1: 0.4418
 epoch: 25, train_loss: 1.0113, test_loss: 0.9980, test_f1: 0.4480
 epoch: 26, train_loss: 1.0098, test_loss: 0.9984, test_f1: 0.4567
 epoch: 27, train_loss: 1.0073, test_loss: 0.9904, test_f1: 0.4591
 epoch: 28, train_loss: 0.9984, test_loss: 0.9990, test_f1: 0.4569
 epoch: 29, train_loss: 0.9833, test_loss: 0.9877, test_f1: 0.4628
 epoch: 30, train_loss: 0.9892, test_loss: 0.9997, test_f1: 0.4692
 epoch: 31, train_loss: 0.9813, test_loss: 0.9871, test_f1: 0.4846
 epoch: 32, train_loss: 0.9871, test_loss: 0.9943, test_f1: 0.4693
 epoch: 33, train_loss: 0.9867, test_loss: 0.9884, test_f1: 0.4647
 epoch: 34, train_loss: 0.9835, test_loss: 0.9842, test_f1: 0.4736
 epoch: 35, train_loss: 0.9762, test_loss: 0.9892, test_f1: 0.4699
 epoch: 36, train_loss: 0.9749, test_loss: 0.9888, test_f1: 0.4662
 epoch: 37, train_loss: 0.9674, test_loss: 1.0001, test_f1: 0.4743
 epoch: 38, train_loss: 0.9661, test_loss: 0.9945, test_f1: 0.4894
 epoch: 39, train_loss: 0.9668, test_loss: 0.9976, test_f1: 0.4853
 epoch: 40, train_loss: 0.9748, test_loss: 0.9901, test_f1: 0.4829
 epoch: 41, train_loss: 0.9569, test_loss: 0.9889, test_f1: 0.4790
 epoch: 42, train_loss: 0.9579, test_loss: 1.0267, test_f1: 0.4773
 epoch: 43, train_loss: 0.9581, test_loss: 0.9998, test_f1: 0.4775
 epoch: 44, train_loss: 0.9632, test_loss: 0.9969, test_f1: 0.4814
 epoch: 45, train_loss: 0.9577, test_loss: 0.9841, test_f1: 0.4886
 epoch: 46, train_loss: 0.9492, test_loss: 1.0088, test_f1: 0.4778
 epoch: 47, train_loss: 0.9559, test_loss: 0.9910, test_f1: 0.4828
 epoch: 48, train_loss: 0.9513, test_loss: 0.9929, test_f1: 0.4828
 epoch: 49, train_loss: 0.9477, test_loss: 0.9870, test_f1: 0.4822
 epoch: 50, train_loss: 0.9506, test_loss: 0.9827, test_f1: 0.4931
 epoch: 51, train_loss: 0.9473, test_loss: 0.9952, test_f1: 0.4874
 epoch: 52, train_loss: 0.9455, test_loss: 0.9845, test_f1: 0.4958
 epoch: 53, train_loss: 0.9456, test_loss: 0.9824, test_f1: 0.4901
 epoch: 54, train_loss: 0.9386, test_loss: 0.9856, test_f1: 0.4957
 epoch: 55, train_loss: 0.9445, test_loss: 0.9810, test_f1: 0.4915
 epoch: 56, train_loss: 0.9356, test_loss: 0.9773, test_f1: 0.4963
 epoch: 57, train_loss: 0.9311, test_loss: 0.9919, test_f1: 0.4974
 epoch: 58, train_loss: 0.9412, test_loss: 0.9780, test_f1: 0.4889
 epoch: 59, train_loss: 0.9348, test_loss: 0.9855, test_f1: 0.4940
 epoch: 60, train_loss: 0.9335, test_loss: 0.9876, test_f1: 0.4990
 epoch: 61, train_loss: 0.9333, test_loss: 0.9789, test_f1: 0.4968
 epoch: 62, train_loss: 0.9341, test_loss: 0.9771, test_f1: 0.4933
 epoch: 63, train_loss: 0.9380, test_loss: 0.9840, test_f1: 0.4905
 epoch: 64, train_loss: 0.9375, test_loss: 0.9745, test_f1: 0.4959
 epoch: 65, train_loss: 0.9297, test_loss: 0.9806, test_f1: 0.4988
 epoch: 66, train_loss: 0.9282, test_loss: 0.9724, test_f1: 0.4951
 epoch: 67, train_loss: 0.9343, test_loss: 0.9770, test_f1: 0.5015
 epoch: 68, train_loss: 0.9275, test_loss: 0.9843, test_f1: 0.4997
 epoch: 69, train_loss: 0.9269, test_loss: 0.9761, test_f1: 0.4905
 epoch: 70, train_loss: 0.9278, test_loss: 0.9875, test_f1: 0.4985
 epoch: 71, train_loss: 0.9227, test_loss: 0.9830, test_f1: 0.4843
 epoch: 72, train_loss: 0.9257, test_loss: 0.9842, test_f1: 0.4949
 epoch: 73, train_loss: 0.9185, test_loss: 0.9835, test_f1: 0.4972
 epoch: 74, train_loss: 0.9162, test_loss: 0.9904, test_f1: 0.5026
 epoch: 75, train_loss: 0.9233, test_loss: 0.9788, test_f1: 0.5006
 epoch: 76, train_loss: 0.9332, test_loss: 0.9794, test_f1: 0.5014
 epoch: 77, train_loss: 0.9156, test_loss: 0.9854, test_f1: 0.4973
 epoch: 78, train_loss: 0.9194, test_loss: 0.9812, test_f1: 0.5014
 epoch: 79, train_loss: 0.9245, test_loss: 0.9780, test_f1: 0.5052
 epoch: 80, train_loss: 0.9188, test_loss: 0.9751, test_f1: 0.4971
 epoch: 81, train_loss: 0.9176, test_loss: 0.9870, test_f1: 0.5053
 epoch: 82, train_loss: 0.9274, test_loss: 0.9805, test_f1: 0.4956
 epoch: 83, train_loss: 0.9200, test_loss: 0.9789, test_f1: 0.4937
 epoch: 84, train_loss: 0.9213, test_loss: 1.0086, test_f1: 0.5040
 epoch: 85, train_loss: 0.9153, test_loss: 0.9898, test_f1: 0.5015
 epoch: 86, train_loss: 0.9159, test_loss: 0.9738, test_f1: 0.5047
 epoch: 87, train_loss: 0.9252, test_loss: 0.9784, test_f1: 0.5033
 epoch: 88, train_loss: 0.9171, test_loss: 0.9688, test_f1: 0.5010
 epoch: 89, train_loss: 0.9198, test_loss: 0.9942, test_f1: 0.4897
 epoch: 90, train_loss: 0.9046, test_loss: 0.9791, test_f1: 0.5080
 epoch: 91, train_loss: 0.9045, test_loss: 0.9754, test_f1: 0.5086
 epoch: 92, train_loss: 0.9111, test_loss: 0.9671, test_f1: 0.5053
 epoch: 93, train_loss: 0.9075, test_loss: 0.9889, test_f1: 0.4975
 epoch: 94, train_loss: 0.9032, test_loss: 0.9674, test_f1: 0.5130
 epoch: 95, train_loss: 0.8964, test_loss: 0.9643, test_f1: 0.5095
 epoch: 96, train_loss: 0.9016, test_loss: 0.9677, test_f1: 0.5107
 epoch: 97, train_loss: 0.9075, test_loss: 0.9786, test_f1: 0.5123
 epoch: 98, train_loss: 0.9102, test_loss: 0.9679, test_f1: 0.4997
 epoch: 99, train_loss: 0.9118, test_loss: 0.9790, test_f1: 0.5084
##################ITERATION #4 ****************************************
 epoch: 0, train_loss: 1.3055, test_loss: 1.3425, test_f1: 0.2270
 epoch: 1, train_loss: 1.2288, test_loss: 1.2877, test_f1: 0.2270
 epoch: 2, train_loss: 1.2002, test_loss: 1.2416, test_f1: 0.2320
 epoch: 3, train_loss: 1.1665, test_loss: 1.1942, test_f1: 0.2596
 epoch: 4, train_loss: 1.1575, test_loss: 1.1377, test_f1: 0.3254
 epoch: 5, train_loss: 1.1365, test_loss: 1.0946, test_f1: 0.3363
 epoch: 6, train_loss: 1.1231, test_loss: 1.0754, test_f1: 0.3605
 epoch: 7, train_loss: 1.0989, test_loss: 1.0673, test_f1: 0.3584
 epoch: 8, train_loss: 1.0831, test_loss: 1.0456, test_f1: 0.3682
 epoch: 9, train_loss: 1.0744, test_loss: 1.0429, test_f1: 0.3919
 epoch: 10, train_loss: 1.0638, test_loss: 1.0304, test_f1: 0.4067
 epoch: 11, train_loss: 1.0542, test_loss: 1.0123, test_f1: 0.4335
 epoch: 12, train_loss: 1.0411, test_loss: 1.0158, test_f1: 0.4479
 epoch: 13, train_loss: 1.0351, test_loss: 1.0112, test_f1: 0.4774
 epoch: 14, train_loss: 1.0258, test_loss: 1.0064, test_f1: 0.4625
 epoch: 15, train_loss: 1.0087, test_loss: 0.9973, test_f1: 0.4807
 epoch: 16, train_loss: 1.0121, test_loss: 0.9873, test_f1: 0.4810
 epoch: 17, train_loss: 1.0036, test_loss: 1.0027, test_f1: 0.4723
 epoch: 18, train_loss: 1.0055, test_loss: 0.9939, test_f1: 0.4787
 epoch: 19, train_loss: 1.0035, test_loss: 0.9946, test_f1: 0.4802
 epoch: 20, train_loss: 1.0006, test_loss: 0.9975, test_f1: 0.4971
 epoch: 21, train_loss: 0.9908, test_loss: 1.0012, test_f1: 0.5089
 epoch: 22, train_loss: 0.9822, test_loss: 0.9797, test_f1: 0.5047
 epoch: 23, train_loss: 0.9855, test_loss: 0.9760, test_f1: 0.4872
 epoch: 24, train_loss: 0.9690, test_loss: 0.9953, test_f1: 0.4977
 epoch: 25, train_loss: 0.9738, test_loss: 0.9686, test_f1: 0.4970
 epoch: 26, train_loss: 0.9716, test_loss: 0.9901, test_f1: 0.4994
 epoch: 27, train_loss: 0.9616, test_loss: 0.9986, test_f1: 0.5124
 epoch: 28, train_loss: 0.9626, test_loss: 0.9920, test_f1: 0.4985
 epoch: 29, train_loss: 0.9530, test_loss: 0.9737, test_f1: 0.5037
 epoch: 30, train_loss: 0.9538, test_loss: 0.9993, test_f1: 0.5141
 epoch: 31, train_loss: 0.9458, test_loss: 0.9747, test_f1: 0.5054
 epoch: 32, train_loss: 0.9330, test_loss: 0.9668, test_f1: 0.5046
 epoch: 33, train_loss: 0.9398, test_loss: 1.0043, test_f1: 0.4972
 epoch: 34, train_loss: 0.9438, test_loss: 0.9732, test_f1: 0.5127
 epoch: 35, train_loss: 0.9370, test_loss: 0.9872, test_f1: 0.5059
 epoch: 36, train_loss: 0.9404, test_loss: 0.9532, test_f1: 0.5138
 epoch: 37, train_loss: 0.9335, test_loss: 0.9855, test_f1: 0.4974
 epoch: 38, train_loss: 0.9243, test_loss: 0.9561, test_f1: 0.5113
 epoch: 39, train_loss: 0.9279, test_loss: 0.9888, test_f1: 0.5102
 epoch: 40, train_loss: 0.9259, test_loss: 0.9694, test_f1: 0.5212
 epoch: 41, train_loss: 0.9287, test_loss: 0.9732, test_f1: 0.5194
 epoch: 42, train_loss: 0.9297, test_loss: 0.9786, test_f1: 0.5262
 epoch: 43, train_loss: 0.9161, test_loss: 0.9840, test_f1: 0.5149
 epoch: 44, train_loss: 0.9172, test_loss: 0.9672, test_f1: 0.5039
 epoch: 45, train_loss: 0.9183, test_loss: 1.0149, test_f1: 0.5155
 epoch: 46, train_loss: 0.9106, test_loss: 0.9749, test_f1: 0.5117
 epoch: 47, train_loss: 0.9156, test_loss: 1.0180, test_f1: 0.5262
 epoch: 48, train_loss: 0.9037, test_loss: 0.9802, test_f1: 0.5090
 epoch: 49, train_loss: 0.9094, test_loss: 0.9889, test_f1: 0.5185
 epoch: 50, train_loss: 0.9107, test_loss: 0.9679, test_f1: 0.5093
 epoch: 51, train_loss: 0.9024, test_loss: 0.9838, test_f1: 0.5178
 epoch: 52, train_loss: 0.8998, test_loss: 0.9852, test_f1: 0.5215
 epoch: 53, train_loss: 0.9119, test_loss: 0.9797, test_f1: 0.5226
 epoch: 54, train_loss: 0.8937, test_loss: 0.9865, test_f1: 0.5156
 epoch: 55, train_loss: 0.9033, test_loss: 0.9796, test_f1: 0.5229
 epoch: 56, train_loss: 0.8901, test_loss: 0.9814, test_f1: 0.5268
 epoch: 57, train_loss: 0.8964, test_loss: 0.9900, test_f1: 0.5152
 epoch: 58, train_loss: 0.8960, test_loss: 1.0008, test_f1: 0.5087
 epoch: 59, train_loss: 0.8932, test_loss: 0.9590, test_f1: 0.5180
 epoch: 60, train_loss: 0.9021, test_loss: 0.9737, test_f1: 0.5242
 epoch: 61, train_loss: 0.9012, test_loss: 1.0059, test_f1: 0.5231
 epoch: 62, train_loss: 0.8987, test_loss: 0.9865, test_f1: 0.5361
 epoch: 63, train_loss: 0.8864, test_loss: 0.9934, test_f1: 0.5174
 epoch: 64, train_loss: 0.8869, test_loss: 0.9907, test_f1: 0.5141
 epoch: 65, train_loss: 0.8867, test_loss: 0.9836, test_f1: 0.5197
 epoch: 66, train_loss: 0.8865, test_loss: 0.9860, test_f1: 0.5253
 epoch: 67, train_loss: 0.8921, test_loss: 0.9852, test_f1: 0.5277
 epoch: 68, train_loss: 0.8823, test_loss: 0.9692, test_f1: 0.5252
 epoch: 69, train_loss: 0.8845, test_loss: 0.9672, test_f1: 0.5206
 epoch: 70, train_loss: 0.8815, test_loss: 0.9916, test_f1: 0.5201
 epoch: 71, train_loss: 0.8803, test_loss: 0.9777, test_f1: 0.5277
 epoch: 72, train_loss: 0.8773, test_loss: 0.9471, test_f1: 0.5174
 epoch: 73, train_loss: 0.8798, test_loss: 0.9965, test_f1: 0.5092
 epoch: 74, train_loss: 0.8796, test_loss: 0.9811, test_f1: 0.5263
 epoch: 75, train_loss: 0.8771, test_loss: 0.9798, test_f1: 0.5250
 epoch: 76, train_loss: 0.8839, test_loss: 0.9571, test_f1: 0.5130
 epoch: 77, train_loss: 0.8815, test_loss: 0.9788, test_f1: 0.5122
 epoch: 78, train_loss: 0.8776, test_loss: 0.9848, test_f1: 0.5152
 epoch: 79, train_loss: 0.8729, test_loss: 0.9919, test_f1: 0.5069
 epoch: 80, train_loss: 0.8790, test_loss: 1.0019, test_f1: 0.5105
 epoch: 81, train_loss: 0.8760, test_loss: 0.9959, test_f1: 0.5285
 epoch: 82, train_loss: 0.8693, test_loss: 0.9806, test_f1: 0.5287
 epoch: 83, train_loss: 0.8648, test_loss: 1.0014, test_f1: 0.5083
 epoch: 84, train_loss: 0.8668, test_loss: 1.0016, test_f1: 0.5099
 epoch: 85, train_loss: 0.8681, test_loss: 0.9902, test_f1: 0.5136
 epoch: 86, train_loss: 0.8717, test_loss: 0.9987, test_f1: 0.5126
 epoch: 87, train_loss: 0.8688, test_loss: 1.0197, test_f1: 0.5089
 epoch: 88, train_loss: 0.8739, test_loss: 0.9914, test_f1: 0.5133
 epoch: 89, train_loss: 0.8738, test_loss: 0.9846, test_f1: 0.5100
 epoch: 90, train_loss: 0.8731, test_loss: 0.9812, test_f1: 0.5129
 epoch: 91, train_loss: 0.8731, test_loss: 1.0238, test_f1: 0.5165
 epoch: 92, train_loss: 0.8708, test_loss: 0.9716, test_f1: 0.5203
 epoch: 93, train_loss: 0.8723, test_loss: 0.9899, test_f1: 0.5136
 epoch: 94, train_loss: 0.8594, test_loss: 1.0096, test_f1: 0.5138
 epoch: 95, train_loss: 0.8715, test_loss: 0.9916, test_f1: 0.5278
 epoch: 96, train_loss: 0.8700, test_loss: 0.9980, test_f1: 0.5159
 epoch: 97, train_loss: 0.8632, test_loss: 0.9922, test_f1: 0.5122
 epoch: 98, train_loss: 0.8566, test_loss: 1.0052, test_f1: 0.5126
 epoch: 99, train_loss: 0.8601, test_loss: 0.9945, test_f1: 0.5131
##################ITERATION #5 ****************************************
 epoch: 0, train_loss: 1.3663, test_loss: 1.3668, test_f1: 0.2270
 epoch: 1, train_loss: 1.2498, test_loss: 1.3075, test_f1: 0.2270
 epoch: 2, train_loss: 1.2189, test_loss: 1.2381, test_f1: 0.2270
 epoch: 3, train_loss: 1.1989, test_loss: 1.1781, test_f1: 0.2936
 epoch: 4, train_loss: 1.1862, test_loss: 1.1463, test_f1: 0.3224
 epoch: 5, train_loss: 1.1722, test_loss: 1.1251, test_f1: 0.3275
 epoch: 6, train_loss: 1.1538, test_loss: 1.1116, test_f1: 0.3243
 epoch: 7, train_loss: 1.1391, test_loss: 1.0954, test_f1: 0.3372
 epoch: 8, train_loss: 1.1265, test_loss: 1.0844, test_f1: 0.3500
 epoch: 9, train_loss: 1.1100, test_loss: 1.0768, test_f1: 0.3507
 epoch: 10, train_loss: 1.0954, test_loss: 1.0672, test_f1: 0.3581
 epoch: 11, train_loss: 1.0850, test_loss: 1.0568, test_f1: 0.3732
 epoch: 12, train_loss: 1.0741, test_loss: 1.0513, test_f1: 0.3727
 epoch: 13, train_loss: 1.0680, test_loss: 1.0167, test_f1: 0.3851
 epoch: 14, train_loss: 1.0561, test_loss: 1.0160, test_f1: 0.3978
 epoch: 15, train_loss: 1.0478, test_loss: 1.0170, test_f1: 0.4088
 epoch: 16, train_loss: 1.0364, test_loss: 0.9980, test_f1: 0.4180
 epoch: 17, train_loss: 1.0326, test_loss: 1.0269, test_f1: 0.4288
 epoch: 18, train_loss: 1.0194, test_loss: 1.0108, test_f1: 0.4214
 epoch: 19, train_loss: 1.0217, test_loss: 0.9943, test_f1: 0.4623
 epoch: 20, train_loss: 1.0166, test_loss: 1.0472, test_f1: 0.4218
 epoch: 21, train_loss: 1.0058, test_loss: 0.9766, test_f1: 0.4477
 epoch: 22, train_loss: 1.0033, test_loss: 0.9732, test_f1: 0.4550
 epoch: 23, train_loss: 0.9930, test_loss: 0.9911, test_f1: 0.4512
 epoch: 24, train_loss: 0.9889, test_loss: 0.9628, test_f1: 0.4741
 epoch: 25, train_loss: 0.9828, test_loss: 0.9530, test_f1: 0.4589
 epoch: 26, train_loss: 0.9686, test_loss: 0.9580, test_f1: 0.4878
 epoch: 27, train_loss: 0.9794, test_loss: 0.9445, test_f1: 0.4890
 epoch: 28, train_loss: 0.9766, test_loss: 0.9596, test_f1: 0.4940
 epoch: 29, train_loss: 0.9598, test_loss: 0.9319, test_f1: 0.5159
 epoch: 30, train_loss: 0.9660, test_loss: 0.9414, test_f1: 0.4800
 epoch: 31, train_loss: 0.9614, test_loss: 0.9335, test_f1: 0.5113
 epoch: 32, train_loss: 0.9635, test_loss: 0.9342, test_f1: 0.4924
 epoch: 33, train_loss: 0.9568, test_loss: 0.9244, test_f1: 0.4994
 epoch: 34, train_loss: 0.9558, test_loss: 0.9632, test_f1: 0.4953
 epoch: 35, train_loss: 0.9506, test_loss: 0.9375, test_f1: 0.4934
 epoch: 36, train_loss: 0.9459, test_loss: 0.9859, test_f1: 0.4761
 epoch: 37, train_loss: 0.9465, test_loss: 0.9224, test_f1: 0.4981
 epoch: 38, train_loss: 0.9482, test_loss: 0.9664, test_f1: 0.4782
 epoch: 39, train_loss: 0.9496, test_loss: 0.9794, test_f1: 0.4799
 epoch: 40, train_loss: 0.9471, test_loss: 0.9545, test_f1: 0.4761
 epoch: 41, train_loss: 0.9393, test_loss: 0.9201, test_f1: 0.5197
 epoch: 42, train_loss: 0.9359, test_loss: 0.9391, test_f1: 0.4878
 epoch: 43, train_loss: 0.9411, test_loss: 0.9288, test_f1: 0.5083
 epoch: 44, train_loss: 0.9306, test_loss: 0.9575, test_f1: 0.4873
 epoch: 45, train_loss: 0.9340, test_loss: 0.9865, test_f1: 0.4738
 epoch: 46, train_loss: 0.9331, test_loss: 0.9531, test_f1: 0.4953
 epoch: 47, train_loss: 0.9367, test_loss: 0.9779, test_f1: 0.4996
 epoch: 48, train_loss: 0.9313, test_loss: 1.0815, test_f1: 0.4939
 epoch: 49, train_loss: 0.9268, test_loss: 1.0062, test_f1: 0.4977
 epoch: 50, train_loss: 0.9310, test_loss: 0.9296, test_f1: 0.5162
 epoch: 51, train_loss: 0.9220, test_loss: 1.0048, test_f1: 0.5052
 epoch: 52, train_loss: 0.9213, test_loss: 0.9292, test_f1: 0.5182
 epoch: 53, train_loss: 0.9189, test_loss: 0.9889, test_f1: 0.5077
 epoch: 54, train_loss: 0.9211, test_loss: 0.9315, test_f1: 0.5251
 epoch: 55, train_loss: 0.9118, test_loss: 0.9447, test_f1: 0.5092
 epoch: 56, train_loss: 0.9139, test_loss: 0.9766, test_f1: 0.4901
 epoch: 57, train_loss: 0.9141, test_loss: 0.9395, test_f1: 0.4964
 epoch: 58, train_loss: 0.9086, test_loss: 1.0190, test_f1: 0.5063
 epoch: 59, train_loss: 0.9158, test_loss: 0.9264, test_f1: 0.5237
 epoch: 60, train_loss: 0.9205, test_loss: 0.9875, test_f1: 0.5000
 epoch: 61, train_loss: 0.9117, test_loss: 0.9288, test_f1: 0.5025
 epoch: 62, train_loss: 0.9099, test_loss: 1.0237, test_f1: 0.5127
 epoch: 63, train_loss: 0.9064, test_loss: 0.9510, test_f1: 0.5035
 epoch: 64, train_loss: 0.9090, test_loss: 0.9356, test_f1: 0.5326
 epoch: 65, train_loss: 0.9098, test_loss: 0.9422, test_f1: 0.5156
 epoch: 66, train_loss: 0.9122, test_loss: 0.9442, test_f1: 0.5006
 epoch: 67, train_loss: 0.9069, test_loss: 0.9543, test_f1: 0.5200
 epoch: 68, train_loss: 0.9014, test_loss: 0.9683, test_f1: 0.5071
 epoch: 69, train_loss: 0.9069, test_loss: 0.9695, test_f1: 0.4989
 epoch: 70, train_loss: 0.9104, test_loss: 0.9816, test_f1: 0.5049
 epoch: 71, train_loss: 0.9043, test_loss: 0.9420, test_f1: 0.5051
 epoch: 72, train_loss: 0.9091, test_loss: 0.9900, test_f1: 0.5045
 epoch: 73, train_loss: 0.9005, test_loss: 0.9512, test_f1: 0.5108
 epoch: 74, train_loss: 0.8922, test_loss: 0.9667, test_f1: 0.4961
 epoch: 75, train_loss: 0.9032, test_loss: 0.9607, test_f1: 0.5111
 epoch: 76, train_loss: 0.9019, test_loss: 0.9407, test_f1: 0.5131
 epoch: 77, train_loss: 0.9031, test_loss: 0.9481, test_f1: 0.5279
 epoch: 78, train_loss: 0.8954, test_loss: 0.9562, test_f1: 0.5072
 epoch: 79, train_loss: 0.9015, test_loss: 0.9195, test_f1: 0.5113
 epoch: 80, train_loss: 0.9008, test_loss: 1.0091, test_f1: 0.5105
 epoch: 81, train_loss: 0.8973, test_loss: 0.9641, test_f1: 0.4983
 epoch: 82, train_loss: 0.8949, test_loss: 0.9619, test_f1: 0.5029
 epoch: 83, train_loss: 0.8951, test_loss: 0.9365, test_f1: 0.5143
 epoch: 84, train_loss: 0.8999, test_loss: 0.9820, test_f1: 0.5057
 epoch: 85, train_loss: 0.8982, test_loss: 0.9453, test_f1: 0.5117
 epoch: 86, train_loss: 0.8942, test_loss: 0.9861, test_f1: 0.5081
 epoch: 87, train_loss: 0.8917, test_loss: 0.9529, test_f1: 0.4953
 epoch: 88, train_loss: 0.8924, test_loss: 0.9503, test_f1: 0.5123
 epoch: 89, train_loss: 0.8934, test_loss: 0.9547, test_f1: 0.5174
 epoch: 90, train_loss: 0.8815, test_loss: 0.9457, test_f1: 0.5249
 epoch: 91, train_loss: 0.8838, test_loss: 0.9802, test_f1: 0.5136
 epoch: 92, train_loss: 0.8838, test_loss: 0.9408, test_f1: 0.5125
 epoch: 93, train_loss: 0.8853, test_loss: 0.9322, test_f1: 0.5258
 epoch: 94, train_loss: 0.8917, test_loss: 0.9756, test_f1: 0.5040
 epoch: 95, train_loss: 0.8856, test_loss: 1.0038, test_f1: 0.5108
 epoch: 96, train_loss: 0.8896, test_loss: 0.9000, test_f1: 0.5467
 epoch: 97, train_loss: 0.8780, test_loss: 1.0447, test_f1: 0.4949
 epoch: 98, train_loss: 0.8825, test_loss: 0.9140, test_f1: 0.5275
 epoch: 99, train_loss: 0.8838, test_loss: 0.9879, test_f1: 0.5095
##################ITERATION #6 ****************************************
 epoch: 0, train_loss: 1.3638, test_loss: 1.3144, test_f1: 0.2270
 epoch: 1, train_loss: 1.2498, test_loss: 1.2563, test_f1: 0.2270
 epoch: 2, train_loss: 1.2132, test_loss: 1.2027, test_f1: 0.2686
 epoch: 3, train_loss: 1.1752, test_loss: 1.1632, test_f1: 0.3269
 epoch: 4, train_loss: 1.1521, test_loss: 1.1338, test_f1: 0.3612
 epoch: 5, train_loss: 1.1375, test_loss: 1.1154, test_f1: 0.3620
 epoch: 6, train_loss: 1.1297, test_loss: 1.0787, test_f1: 0.3880
 epoch: 7, train_loss: 1.1174, test_loss: 1.0766, test_f1: 0.3831
 epoch: 8, train_loss: 1.1078, test_loss: 1.0640, test_f1: 0.3934
 epoch: 9, train_loss: 1.0966, test_loss: 1.0610, test_f1: 0.4076
 epoch: 10, train_loss: 1.0939, test_loss: 1.0673, test_f1: 0.4060
 epoch: 11, train_loss: 1.0774, test_loss: 1.0559, test_f1: 0.4232
 epoch: 12, train_loss: 1.0678, test_loss: 1.0522, test_f1: 0.4117
 epoch: 13, train_loss: 1.0608, test_loss: 1.0360, test_f1: 0.4413
 epoch: 14, train_loss: 1.0468, test_loss: 1.0460, test_f1: 0.4239
 epoch: 15, train_loss: 1.0451, test_loss: 1.0501, test_f1: 0.4220
 epoch: 16, train_loss: 1.0321, test_loss: 1.0378, test_f1: 0.4296
 epoch: 17, train_loss: 1.0372, test_loss: 1.0230, test_f1: 0.4414
 epoch: 18, train_loss: 1.0258, test_loss: 1.0247, test_f1: 0.4437
 epoch: 19, train_loss: 1.0183, test_loss: 1.0262, test_f1: 0.4332
 epoch: 20, train_loss: 1.0193, test_loss: 1.0183, test_f1: 0.4481
 epoch: 21, train_loss: 1.0118, test_loss: 1.0108, test_f1: 0.4455
 epoch: 22, train_loss: 1.0056, test_loss: 1.0209, test_f1: 0.4478
 epoch: 23, train_loss: 1.0023, test_loss: 1.0309, test_f1: 0.4371
 epoch: 24, train_loss: 0.9986, test_loss: 0.9995, test_f1: 0.4578
 epoch: 25, train_loss: 0.9972, test_loss: 1.0067, test_f1: 0.4444
 epoch: 26, train_loss: 0.9887, test_loss: 1.0137, test_f1: 0.4553
 epoch: 27, train_loss: 0.9792, test_loss: 1.0028, test_f1: 0.4587
 epoch: 28, train_loss: 0.9697, test_loss: 1.0042, test_f1: 0.4505
 epoch: 29, train_loss: 0.9741, test_loss: 1.0032, test_f1: 0.4591
 epoch: 30, train_loss: 0.9680, test_loss: 1.0016, test_f1: 0.4616
 epoch: 31, train_loss: 0.9759, test_loss: 0.9869, test_f1: 0.4707
 epoch: 32, train_loss: 0.9668, test_loss: 0.9993, test_f1: 0.4767
 epoch: 33, train_loss: 0.9578, test_loss: 0.9823, test_f1: 0.4825
 epoch: 34, train_loss: 0.9557, test_loss: 0.9920, test_f1: 0.4791
 epoch: 35, train_loss: 0.9527, test_loss: 0.9942, test_f1: 0.4800
 epoch: 36, train_loss: 0.9528, test_loss: 0.9907, test_f1: 0.4768
 epoch: 37, train_loss: 0.9541, test_loss: 1.0030, test_f1: 0.4787
 epoch: 38, train_loss: 0.9431, test_loss: 0.9860, test_f1: 0.4828
 epoch: 39, train_loss: 0.9438, test_loss: 0.9859, test_f1: 0.4778
 epoch: 40, train_loss: 0.9385, test_loss: 0.9683, test_f1: 0.4906
 epoch: 41, train_loss: 0.9404, test_loss: 0.9770, test_f1: 0.5103
 epoch: 42, train_loss: 0.9368, test_loss: 0.9939, test_f1: 0.4947
 epoch: 43, train_loss: 0.9316, test_loss: 0.9862, test_f1: 0.4969
 epoch: 44, train_loss: 0.9277, test_loss: 0.9655, test_f1: 0.4944
 epoch: 45, train_loss: 0.9317, test_loss: 0.9702, test_f1: 0.4937
 epoch: 46, train_loss: 0.9275, test_loss: 0.9732, test_f1: 0.5016
 epoch: 47, train_loss: 0.9306, test_loss: 0.9833, test_f1: 0.5049
 epoch: 48, train_loss: 0.9218, test_loss: 0.9844, test_f1: 0.5050
 epoch: 49, train_loss: 0.9167, test_loss: 0.9768, test_f1: 0.4997
 epoch: 50, train_loss: 0.9184, test_loss: 0.9824, test_f1: 0.5012
 epoch: 51, train_loss: 0.9273, test_loss: 0.9784, test_f1: 0.5154
 epoch: 52, train_loss: 0.9142, test_loss: 0.9741, test_f1: 0.5107
 epoch: 53, train_loss: 0.9239, test_loss: 0.9770, test_f1: 0.4967
 epoch: 54, train_loss: 0.9163, test_loss: 0.9706, test_f1: 0.5183
 epoch: 55, train_loss: 0.9155, test_loss: 0.9749, test_f1: 0.5132
 epoch: 56, train_loss: 0.9145, test_loss: 0.9816, test_f1: 0.5160
 epoch: 57, train_loss: 0.9223, test_loss: 0.9679, test_f1: 0.5213
 epoch: 58, train_loss: 0.9156, test_loss: 0.9699, test_f1: 0.5181
 epoch: 59, train_loss: 0.9148, test_loss: 0.9738, test_f1: 0.5171
 epoch: 60, train_loss: 0.9085, test_loss: 0.9679, test_f1: 0.5241
 epoch: 61, train_loss: 0.9152, test_loss: 0.9634, test_f1: 0.5153
 epoch: 62, train_loss: 0.8998, test_loss: 0.9698, test_f1: 0.5224
 epoch: 63, train_loss: 0.9022, test_loss: 0.9704, test_f1: 0.5241
 epoch: 64, train_loss: 0.9087, test_loss: 0.9689, test_f1: 0.5256
 epoch: 65, train_loss: 0.9053, test_loss: 0.9677, test_f1: 0.5232
 epoch: 66, train_loss: 0.9047, test_loss: 0.9749, test_f1: 0.5163
 epoch: 67, train_loss: 0.9064, test_loss: 0.9745, test_f1: 0.5175
 epoch: 68, train_loss: 0.9085, test_loss: 0.9721, test_f1: 0.5256
 epoch: 69, train_loss: 0.9005, test_loss: 0.9644, test_f1: 0.5178
 epoch: 70, train_loss: 0.8997, test_loss: 0.9742, test_f1: 0.5184
 epoch: 71, train_loss: 0.9026, test_loss: 0.9661, test_f1: 0.5263
 epoch: 72, train_loss: 0.9051, test_loss: 0.9718, test_f1: 0.5196
 epoch: 73, train_loss: 0.9054, test_loss: 0.9681, test_f1: 0.5212
 epoch: 74, train_loss: 0.8906, test_loss: 0.9644, test_f1: 0.5201
 epoch: 75, train_loss: 0.9059, test_loss: 0.9713, test_f1: 0.5177
 epoch: 76, train_loss: 0.9004, test_loss: 0.9650, test_f1: 0.5261
 epoch: 77, train_loss: 0.8965, test_loss: 0.9761, test_f1: 0.5230
 epoch: 78, train_loss: 0.8959, test_loss: 0.9683, test_f1: 0.5228
 epoch: 79, train_loss: 0.8969, test_loss: 0.9720, test_f1: 0.5250
 epoch: 80, train_loss: 0.8948, test_loss: 0.9696, test_f1: 0.5299
 epoch: 81, train_loss: 0.8988, test_loss: 0.9576, test_f1: 0.5304
 epoch: 82, train_loss: 0.8937, test_loss: 0.9740, test_f1: 0.5236
 epoch: 83, train_loss: 0.8924, test_loss: 0.9696, test_f1: 0.5323
 epoch: 84, train_loss: 0.8923, test_loss: 0.9656, test_f1: 0.5269
 epoch: 85, train_loss: 0.8960, test_loss: 0.9688, test_f1: 0.5135
 epoch: 86, train_loss: 0.8891, test_loss: 0.9791, test_f1: 0.5149
 epoch: 87, train_loss: 0.8866, test_loss: 0.9678, test_f1: 0.5231
 epoch: 88, train_loss: 0.8825, test_loss: 0.9783, test_f1: 0.5200
 epoch: 89, train_loss: 0.8978, test_loss: 0.9724, test_f1: 0.5206
 epoch: 90, train_loss: 0.8921, test_loss: 0.9674, test_f1: 0.5231
 epoch: 91, train_loss: 0.8900, test_loss: 0.9723, test_f1: 0.5347
 epoch: 92, train_loss: 0.8969, test_loss: 0.9711, test_f1: 0.5281
 epoch: 93, train_loss: 0.8905, test_loss: 0.9744, test_f1: 0.5287
 epoch: 94, train_loss: 0.8904, test_loss: 0.9785, test_f1: 0.5114
 epoch: 95, train_loss: 0.8864, test_loss: 0.9825, test_f1: 0.5118
 epoch: 96, train_loss: 0.8935, test_loss: 0.9682, test_f1: 0.5324
 epoch: 97, train_loss: 0.8873, test_loss: 0.9735, test_f1: 0.5291
 epoch: 98, train_loss: 0.8936, test_loss: 0.9676, test_f1: 0.5328
 epoch: 99, train_loss: 0.8855, test_loss: 0.9792, test_f1: 0.5161
##################ITERATION #7 ****************************************
 epoch: 0, train_loss: 1.4032, test_loss: 1.3205, test_f1: 0.2270
 epoch: 1, train_loss: 1.2727, test_loss: 1.3279, test_f1: 0.2270
 epoch: 2, train_loss: 1.2399, test_loss: 1.2920, test_f1: 0.2270
 epoch: 3, train_loss: 1.2252, test_loss: 1.2343, test_f1: 0.2295
 epoch: 4, train_loss: 1.2061, test_loss: 1.1879, test_f1: 0.3046
 epoch: 5, train_loss: 1.1952, test_loss: 1.1638, test_f1: 0.3167
 epoch: 6, train_loss: 1.1766, test_loss: 1.1377, test_f1: 0.3517
 epoch: 7, train_loss: 1.1678, test_loss: 1.1202, test_f1: 0.3667
 epoch: 8, train_loss: 1.1477, test_loss: 1.1070, test_f1: 0.3748
 epoch: 9, train_loss: 1.1314, test_loss: 1.0847, test_f1: 0.3696
 epoch: 10, train_loss: 1.1189, test_loss: 1.0697, test_f1: 0.3861
 epoch: 11, train_loss: 1.1085, test_loss: 1.0576, test_f1: 0.4048
 epoch: 12, train_loss: 1.0965, test_loss: 1.0455, test_f1: 0.4040
 epoch: 13, train_loss: 1.0833, test_loss: 1.0280, test_f1: 0.4354
 epoch: 14, train_loss: 1.0780, test_loss: 1.0256, test_f1: 0.4342
 epoch: 15, train_loss: 1.0575, test_loss: 1.0150, test_f1: 0.4417
 epoch: 16, train_loss: 1.0587, test_loss: 1.0283, test_f1: 0.4401
 epoch: 17, train_loss: 1.0481, test_loss: 0.9986, test_f1: 0.4452
 epoch: 18, train_loss: 1.0401, test_loss: 1.0105, test_f1: 0.4481
 epoch: 19, train_loss: 1.0336, test_loss: 0.9934, test_f1: 0.4380
 epoch: 20, train_loss: 1.0272, test_loss: 1.0004, test_f1: 0.4487
 epoch: 21, train_loss: 1.0197, test_loss: 1.0086, test_f1: 0.4578
 epoch: 22, train_loss: 1.0089, test_loss: 0.9973, test_f1: 0.4563
 epoch: 23, train_loss: 1.0104, test_loss: 1.0208, test_f1: 0.4474
 epoch: 24, train_loss: 1.0108, test_loss: 0.9822, test_f1: 0.4510
 epoch: 25, train_loss: 0.9976, test_loss: 0.9698, test_f1: 0.4651
 epoch: 26, train_loss: 0.9902, test_loss: 0.9855, test_f1: 0.4613
 epoch: 27, train_loss: 0.9856, test_loss: 0.9625, test_f1: 0.4689
 epoch: 28, train_loss: 0.9823, test_loss: 0.9741, test_f1: 0.4669
 epoch: 29, train_loss: 0.9854, test_loss: 1.0476, test_f1: 0.4368
 epoch: 30, train_loss: 0.9798, test_loss: 0.9797, test_f1: 0.4768
 epoch: 31, train_loss: 0.9706, test_loss: 0.9889, test_f1: 0.4783
 epoch: 32, train_loss: 0.9705, test_loss: 1.0108, test_f1: 0.4617
 epoch: 33, train_loss: 0.9568, test_loss: 0.9585, test_f1: 0.4793
 epoch: 34, train_loss: 0.9655, test_loss: 0.9891, test_f1: 0.4777
 epoch: 35, train_loss: 0.9540, test_loss: 1.0224, test_f1: 0.4693
 epoch: 36, train_loss: 0.9644, test_loss: 0.9864, test_f1: 0.4909
 epoch: 37, train_loss: 0.9629, test_loss: 0.9534, test_f1: 0.4877
 epoch: 38, train_loss: 0.9509, test_loss: 0.9994, test_f1: 0.4895
 epoch: 39, train_loss: 0.9480, test_loss: 0.9593, test_f1: 0.4927
 epoch: 40, train_loss: 0.9435, test_loss: 0.9779, test_f1: 0.4919
 epoch: 41, train_loss: 0.9437, test_loss: 0.9542, test_f1: 0.4855
 epoch: 42, train_loss: 0.9406, test_loss: 0.9592, test_f1: 0.4985
 epoch: 43, train_loss: 0.9448, test_loss: 0.9626, test_f1: 0.4871
 epoch: 44, train_loss: 0.9393, test_loss: 0.9501, test_f1: 0.5063
 epoch: 45, train_loss: 0.9410, test_loss: 0.9998, test_f1: 0.4925
 epoch: 46, train_loss: 0.9245, test_loss: 0.9600, test_f1: 0.5035
 epoch: 47, train_loss: 0.9259, test_loss: 0.9794, test_f1: 0.4994
 epoch: 48, train_loss: 0.9323, test_loss: 0.9467, test_f1: 0.5055
 epoch: 49, train_loss: 0.9208, test_loss: 0.9758, test_f1: 0.4954
 epoch: 50, train_loss: 0.9214, test_loss: 0.9356, test_f1: 0.5032
 epoch: 51, train_loss: 0.9234, test_loss: 0.9773, test_f1: 0.5031
 epoch: 52, train_loss: 0.9234, test_loss: 0.9673, test_f1: 0.5128
 epoch: 53, train_loss: 0.9202, test_loss: 0.9772, test_f1: 0.5074
 epoch: 54, train_loss: 0.9099, test_loss: 0.9834, test_f1: 0.5006
 epoch: 55, train_loss: 0.9118, test_loss: 1.0097, test_f1: 0.4910
 epoch: 56, train_loss: 0.9211, test_loss: 0.9958, test_f1: 0.4995
 epoch: 57, train_loss: 0.9137, test_loss: 0.9773, test_f1: 0.5113
 epoch: 58, train_loss: 0.9125, test_loss: 0.9799, test_f1: 0.5086
 epoch: 59, train_loss: 0.9145, test_loss: 0.9936, test_f1: 0.4890
 epoch: 60, train_loss: 0.9069, test_loss: 0.9807, test_f1: 0.5022
 epoch: 61, train_loss: 0.9098, test_loss: 0.9836, test_f1: 0.4954
 epoch: 62, train_loss: 0.9056, test_loss: 0.9657, test_f1: 0.5058
 epoch: 63, train_loss: 0.9061, test_loss: 0.9965, test_f1: 0.4988
 epoch: 64, train_loss: 0.9094, test_loss: 0.9906, test_f1: 0.4901
 epoch: 65, train_loss: 0.9099, test_loss: 0.9815, test_f1: 0.5035
 epoch: 66, train_loss: 0.9033, test_loss: 0.9827, test_f1: 0.5095
 epoch: 67, train_loss: 0.9093, test_loss: 0.9985, test_f1: 0.4912
 epoch: 68, train_loss: 0.8991, test_loss: 0.9962, test_f1: 0.4953
 epoch: 69, train_loss: 0.9093, test_loss: 0.9724, test_f1: 0.5086
 epoch: 70, train_loss: 0.9002, test_loss: 0.9789, test_f1: 0.5104
 epoch: 71, train_loss: 0.8989, test_loss: 0.9973, test_f1: 0.4912
 epoch: 72, train_loss: 0.8989, test_loss: 0.9798, test_f1: 0.5066
 epoch: 73, train_loss: 0.9028, test_loss: 0.9747, test_f1: 0.4996
 epoch: 74, train_loss: 0.9005, test_loss: 0.9738, test_f1: 0.5094
 epoch: 75, train_loss: 0.8918, test_loss: 1.0078, test_f1: 0.4872
 epoch: 76, train_loss: 0.8908, test_loss: 0.9690, test_f1: 0.5103
 epoch: 77, train_loss: 0.8921, test_loss: 0.9774, test_f1: 0.5094
 epoch: 78, train_loss: 0.8973, test_loss: 0.9768, test_f1: 0.5076
 epoch: 79, train_loss: 0.8930, test_loss: 0.9828, test_f1: 0.5006
 epoch: 80, train_loss: 0.8879, test_loss: 0.9742, test_f1: 0.5097
 epoch: 81, train_loss: 0.8891, test_loss: 0.9780, test_f1: 0.5125
 epoch: 82, train_loss: 0.8993, test_loss: 1.0124, test_f1: 0.4935
 epoch: 83, train_loss: 0.8892, test_loss: 0.9676, test_f1: 0.5104
 epoch: 84, train_loss: 0.8811, test_loss: 0.9717, test_f1: 0.5003
 epoch: 85, train_loss: 0.8904, test_loss: 0.9874, test_f1: 0.5054
 epoch: 86, train_loss: 0.8977, test_loss: 0.9826, test_f1: 0.4998
 epoch: 87, train_loss: 0.8999, test_loss: 0.9484, test_f1: 0.5192
 epoch: 88, train_loss: 0.8872, test_loss: 0.9352, test_f1: 0.5120
 epoch: 89, train_loss: 0.8819, test_loss: 0.9614, test_f1: 0.5103
 epoch: 90, train_loss: 0.8790, test_loss: 0.9632, test_f1: 0.5055
 epoch: 91, train_loss: 0.8798, test_loss: 0.9630, test_f1: 0.5067
 epoch: 92, train_loss: 0.8831, test_loss: 0.9650, test_f1: 0.5014
 epoch: 93, train_loss: 0.8898, test_loss: 0.9894, test_f1: 0.5043
 epoch: 94, train_loss: 0.8815, test_loss: 0.9586, test_f1: 0.5165
 epoch: 95, train_loss: 0.8836, test_loss: 0.9716, test_f1: 0.5069
 epoch: 96, train_loss: 0.8872, test_loss: 0.9743, test_f1: 0.5080
 epoch: 97, train_loss: 0.8805, test_loss: 0.9499, test_f1: 0.5153
 epoch: 98, train_loss: 0.8778, test_loss: 0.9694, test_f1: 0.5122
 epoch: 99, train_loss: 0.8722, test_loss: 0.9620, test_f1: 0.5084
##################ITERATION #8 ****************************************
 epoch: 0, train_loss: 1.3348, test_loss: 1.3383, test_f1: 0.2270
 epoch: 1, train_loss: 1.2132, test_loss: 1.3210, test_f1: 0.2270
 epoch: 2, train_loss: 1.2003, test_loss: 1.2533, test_f1: 0.2416
 epoch: 3, train_loss: 1.1759, test_loss: 1.1738, test_f1: 0.3163
 epoch: 4, train_loss: 1.1448, test_loss: 1.1137, test_f1: 0.3357
 epoch: 5, train_loss: 1.1285, test_loss: 1.0827, test_f1: 0.3560
 epoch: 6, train_loss: 1.0946, test_loss: 1.0612, test_f1: 0.3683
 epoch: 7, train_loss: 1.0845, test_loss: 1.0477, test_f1: 0.3782
 epoch: 8, train_loss: 1.0808, test_loss: 1.0401, test_f1: 0.3755
 epoch: 9, train_loss: 1.0789, test_loss: 1.0304, test_f1: 0.4059
 epoch: 10, train_loss: 1.0574, test_loss: 1.0248, test_f1: 0.4154
 epoch: 11, train_loss: 1.0595, test_loss: 1.0202, test_f1: 0.4267
 epoch: 12, train_loss: 1.0435, test_loss: 1.0163, test_f1: 0.4309
 epoch: 13, train_loss: 1.0352, test_loss: 1.0121, test_f1: 0.4394
 epoch: 14, train_loss: 1.0296, test_loss: 1.0070, test_f1: 0.4378
 epoch: 15, train_loss: 1.0230, test_loss: 0.9995, test_f1: 0.4415
 epoch: 16, train_loss: 1.0155, test_loss: 0.9991, test_f1: 0.4475
 epoch: 17, train_loss: 1.0049, test_loss: 0.9888, test_f1: 0.4492
 epoch: 18, train_loss: 0.9988, test_loss: 0.9850, test_f1: 0.4625
 epoch: 19, train_loss: 0.9957, test_loss: 0.9813, test_f1: 0.4602
 epoch: 20, train_loss: 0.9985, test_loss: 0.9772, test_f1: 0.4536
 epoch: 21, train_loss: 0.9897, test_loss: 0.9793, test_f1: 0.4585
 epoch: 22, train_loss: 0.9920, test_loss: 0.9704, test_f1: 0.4759
 epoch: 23, train_loss: 0.9868, test_loss: 0.9686, test_f1: 0.4753
 epoch: 24, train_loss: 0.9816, test_loss: 0.9695, test_f1: 0.4632
 epoch: 25, train_loss: 0.9765, test_loss: 0.9626, test_f1: 0.4798
 epoch: 26, train_loss: 0.9739, test_loss: 0.9609, test_f1: 0.4737
 epoch: 27, train_loss: 0.9628, test_loss: 0.9607, test_f1: 0.4749
 epoch: 28, train_loss: 0.9607, test_loss: 0.9490, test_f1: 0.4886
 epoch: 29, train_loss: 0.9569, test_loss: 0.9497, test_f1: 0.4815
 epoch: 30, train_loss: 0.9526, test_loss: 0.9384, test_f1: 0.4820
 epoch: 31, train_loss: 0.9545, test_loss: 0.9333, test_f1: 0.4746
 epoch: 32, train_loss: 0.9489, test_loss: 0.9264, test_f1: 0.4761
 epoch: 33, train_loss: 0.9517, test_loss: 0.9264, test_f1: 0.4878
 epoch: 34, train_loss: 0.9361, test_loss: 0.9345, test_f1: 0.4850
 epoch: 35, train_loss: 0.9433, test_loss: 0.9308, test_f1: 0.4850
 epoch: 36, train_loss: 0.9504, test_loss: 0.9300, test_f1: 0.4863
 epoch: 37, train_loss: 0.9280, test_loss: 0.9202, test_f1: 0.4842
 epoch: 38, train_loss: 0.9412, test_loss: 0.9271, test_f1: 0.4844
 epoch: 39, train_loss: 0.9275, test_loss: 0.9161, test_f1: 0.4946
 epoch: 40, train_loss: 0.9425, test_loss: 0.9123, test_f1: 0.4950
 epoch: 41, train_loss: 0.9213, test_loss: 0.9286, test_f1: 0.4849
 epoch: 42, train_loss: 0.9235, test_loss: 0.9111, test_f1: 0.4879
 epoch: 43, train_loss: 0.9260, test_loss: 0.9088, test_f1: 0.5005
 epoch: 44, train_loss: 0.9223, test_loss: 0.9118, test_f1: 0.4873
 epoch: 45, train_loss: 0.9246, test_loss: 0.9332, test_f1: 0.4814
 epoch: 46, train_loss: 0.9186, test_loss: 0.9103, test_f1: 0.4966
 epoch: 47, train_loss: 0.9233, test_loss: 0.9188, test_f1: 0.4975
 epoch: 48, train_loss: 0.9104, test_loss: 0.9153, test_f1: 0.4899
 epoch: 49, train_loss: 0.9152, test_loss: 0.9145, test_f1: 0.4907
 epoch: 50, train_loss: 0.9028, test_loss: 0.9268, test_f1: 0.4938
 epoch: 51, train_loss: 0.9038, test_loss: 0.9152, test_f1: 0.4912
 epoch: 52, train_loss: 0.9012, test_loss: 0.9149, test_f1: 0.5000
 epoch: 53, train_loss: 0.9045, test_loss: 0.9169, test_f1: 0.4976
 epoch: 54, train_loss: 0.9052, test_loss: 0.9134, test_f1: 0.4928
 epoch: 55, train_loss: 0.9060, test_loss: 0.9140, test_f1: 0.4870
 epoch: 56, train_loss: 0.9024, test_loss: 0.9181, test_f1: 0.4943
 epoch: 57, train_loss: 0.9023, test_loss: 0.9142, test_f1: 0.4962
 epoch: 58, train_loss: 0.9083, test_loss: 0.9025, test_f1: 0.4945
 epoch: 59, train_loss: 0.9020, test_loss: 0.9089, test_f1: 0.4938
 epoch: 60, train_loss: 0.9062, test_loss: 0.9174, test_f1: 0.5017
 epoch: 61, train_loss: 0.9000, test_loss: 0.9192, test_f1: 0.5023
 epoch: 62, train_loss: 0.9056, test_loss: 0.9116, test_f1: 0.5014
 epoch: 63, train_loss: 0.8908, test_loss: 0.9083, test_f1: 0.5033
 epoch: 64, train_loss: 0.8946, test_loss: 0.9042, test_f1: 0.4946
 epoch: 65, train_loss: 0.9012, test_loss: 0.9085, test_f1: 0.4995
 epoch: 66, train_loss: 0.8917, test_loss: 0.9021, test_f1: 0.5013
 epoch: 67, train_loss: 0.8999, test_loss: 0.9067, test_f1: 0.4906
 epoch: 68, train_loss: 0.9054, test_loss: 0.9032, test_f1: 0.4933
 epoch: 69, train_loss: 0.8918, test_loss: 0.8995, test_f1: 0.5035
 epoch: 70, train_loss: 0.8999, test_loss: 0.9012, test_f1: 0.4977
 epoch: 71, train_loss: 0.8915, test_loss: 0.9000, test_f1: 0.4949
 epoch: 72, train_loss: 0.8895, test_loss: 0.9041, test_f1: 0.4992
 epoch: 73, train_loss: 0.8807, test_loss: 0.8951, test_f1: 0.4968
 epoch: 74, train_loss: 0.8826, test_loss: 0.8942, test_f1: 0.4997
 epoch: 75, train_loss: 0.8889, test_loss: 0.9011, test_f1: 0.4941
 epoch: 76, train_loss: 0.8906, test_loss: 0.8974, test_f1: 0.5009
 epoch: 77, train_loss: 0.8880, test_loss: 0.9046, test_f1: 0.5064
 epoch: 78, train_loss: 0.8785, test_loss: 0.9328, test_f1: 0.4982
 epoch: 79, train_loss: 0.8841, test_loss: 0.9046, test_f1: 0.5023
 epoch: 80, train_loss: 0.8815, test_loss: 0.8958, test_f1: 0.5043
 epoch: 81, train_loss: 0.8780, test_loss: 0.9046, test_f1: 0.4935
 epoch: 82, train_loss: 0.8853, test_loss: 0.8979, test_f1: 0.4982
 epoch: 83, train_loss: 0.8817, test_loss: 0.8960, test_f1: 0.5049
 epoch: 84, train_loss: 0.8801, test_loss: 0.8943, test_f1: 0.5033
 epoch: 85, train_loss: 0.8759, test_loss: 0.9022, test_f1: 0.4989
 epoch: 86, train_loss: 0.8828, test_loss: 0.9073, test_f1: 0.5013
 epoch: 87, train_loss: 0.8779, test_loss: 0.8975, test_f1: 0.4952
 epoch: 88, train_loss: 0.8708, test_loss: 0.9046, test_f1: 0.4953
 epoch: 89, train_loss: 0.8744, test_loss: 0.8936, test_f1: 0.5020
 epoch: 90, train_loss: 0.8843, test_loss: 0.9013, test_f1: 0.5021
 epoch: 91, train_loss: 0.8784, test_loss: 0.8954, test_f1: 0.4948
 epoch: 92, train_loss: 0.8720, test_loss: 0.9029, test_f1: 0.4999
 epoch: 93, train_loss: 0.8635, test_loss: 0.9029, test_f1: 0.5003
 epoch: 94, train_loss: 0.8763, test_loss: 0.8977, test_f1: 0.5041
 epoch: 95, train_loss: 0.8702, test_loss: 0.9003, test_f1: 0.4967
 epoch: 96, train_loss: 0.8692, test_loss: 0.9048, test_f1: 0.5010
 epoch: 97, train_loss: 0.8741, test_loss: 0.8965, test_f1: 0.5084
 epoch: 98, train_loss: 0.8696, test_loss: 0.9015, test_f1: 0.4951
 epoch: 99, train_loss: 0.8760, test_loss: 0.9032, test_f1: 0.4989
##################ITERATION #9 ****************************************
 epoch: 0, train_loss: 1.4716, test_loss: 1.3408, test_f1: 0.2307
 epoch: 1, train_loss: 1.2791, test_loss: 1.2954, test_f1: 0.2863
 epoch: 2, train_loss: 1.2391, test_loss: 1.2348, test_f1: 0.2978
 epoch: 3, train_loss: 1.1895, test_loss: 1.1610, test_f1: 0.3583
 epoch: 4, train_loss: 1.1615, test_loss: 1.1001, test_f1: 0.3606
 epoch: 5, train_loss: 1.1444, test_loss: 1.0691, test_f1: 0.3483
 epoch: 6, train_loss: 1.1278, test_loss: 1.0563, test_f1: 0.3524
 epoch: 7, train_loss: 1.0952, test_loss: 1.0449, test_f1: 0.3434
 epoch: 8, train_loss: 1.0913, test_loss: 1.0387, test_f1: 0.3583
 epoch: 9, train_loss: 1.0776, test_loss: 1.0360, test_f1: 0.3568
 epoch: 10, train_loss: 1.0866, test_loss: 1.0330, test_f1: 0.3677
 epoch: 11, train_loss: 1.0758, test_loss: 1.0300, test_f1: 0.3595
 epoch: 12, train_loss: 1.0657, test_loss: 1.0253, test_f1: 0.3724
 epoch: 13, train_loss: 1.0570, test_loss: 1.0176, test_f1: 0.3779
 epoch: 14, train_loss: 1.0526, test_loss: 1.0161, test_f1: 0.3896
 epoch: 15, train_loss: 1.0383, test_loss: 1.0080, test_f1: 0.4017
 epoch: 16, train_loss: 1.0353, test_loss: 1.0117, test_f1: 0.4109
 epoch: 17, train_loss: 1.0309, test_loss: 1.0089, test_f1: 0.4224
 epoch: 18, train_loss: 1.0228, test_loss: 1.0060, test_f1: 0.4253
 epoch: 19, train_loss: 1.0108, test_loss: 0.9924, test_f1: 0.4340
 epoch: 20, train_loss: 1.0126, test_loss: 1.0137, test_f1: 0.4346
 epoch: 21, train_loss: 1.0093, test_loss: 0.9917, test_f1: 0.4348
 epoch: 22, train_loss: 1.0018, test_loss: 0.9973, test_f1: 0.4271
 epoch: 23, train_loss: 0.9954, test_loss: 0.9792, test_f1: 0.4444
 epoch: 24, train_loss: 0.9969, test_loss: 0.9838, test_f1: 0.4398
 epoch: 25, train_loss: 1.0007, test_loss: 0.9696, test_f1: 0.4594
 epoch: 26, train_loss: 0.9936, test_loss: 1.0001, test_f1: 0.4507
 epoch: 27, train_loss: 0.9818, test_loss: 0.9749, test_f1: 0.4686
 epoch: 28, train_loss: 0.9764, test_loss: 0.9711, test_f1: 0.4465
 epoch: 29, train_loss: 0.9795, test_loss: 0.9720, test_f1: 0.4605
 epoch: 30, train_loss: 0.9670, test_loss: 0.9707, test_f1: 0.4728
 epoch: 31, train_loss: 0.9677, test_loss: 0.9776, test_f1: 0.4814
 epoch: 32, train_loss: 0.9678, test_loss: 0.9749, test_f1: 0.4732
 epoch: 33, train_loss: 0.9626, test_loss: 0.9560, test_f1: 0.4794
 epoch: 34, train_loss: 0.9577, test_loss: 0.9732, test_f1: 0.4931
 epoch: 35, train_loss: 0.9593, test_loss: 0.9635, test_f1: 0.4996
 epoch: 36, train_loss: 0.9527, test_loss: 0.9564, test_f1: 0.5000
 epoch: 37, train_loss: 0.9493, test_loss: 0.9604, test_f1: 0.4986
 epoch: 38, train_loss: 0.9460, test_loss: 0.9642, test_f1: 0.4974
 epoch: 39, train_loss: 0.9513, test_loss: 0.9580, test_f1: 0.4938
 epoch: 40, train_loss: 0.9525, test_loss: 0.9475, test_f1: 0.5066
 epoch: 41, train_loss: 0.9401, test_loss: 0.9578, test_f1: 0.4841
 epoch: 42, train_loss: 0.9359, test_loss: 0.9458, test_f1: 0.4847
 epoch: 43, train_loss: 0.9286, test_loss: 0.9432, test_f1: 0.5029
 epoch: 44, train_loss: 0.9327, test_loss: 0.9361, test_f1: 0.5168
 epoch: 45, train_loss: 0.9338, test_loss: 0.9483, test_f1: 0.5097
 epoch: 46, train_loss: 0.9354, test_loss: 0.9525, test_f1: 0.5093
 epoch: 47, train_loss: 0.9336, test_loss: 0.9383, test_f1: 0.5046
 epoch: 48, train_loss: 0.9326, test_loss: 0.9552, test_f1: 0.5045
 epoch: 49, train_loss: 0.9349, test_loss: 0.9370, test_f1: 0.5087
 epoch: 50, train_loss: 0.9183, test_loss: 0.9633, test_f1: 0.5065
 epoch: 51, train_loss: 0.9206, test_loss: 0.9409, test_f1: 0.5172
 epoch: 52, train_loss: 0.9152, test_loss: 0.9496, test_f1: 0.5157
 epoch: 53, train_loss: 0.9179, test_loss: 0.9387, test_f1: 0.5200
 epoch: 54, train_loss: 0.9125, test_loss: 0.9448, test_f1: 0.5100
 epoch: 55, train_loss: 0.9104, test_loss: 0.9449, test_f1: 0.5164
 epoch: 56, train_loss: 0.9173, test_loss: 0.9471, test_f1: 0.5160
 epoch: 57, train_loss: 0.9204, test_loss: 0.9416, test_f1: 0.5130
 epoch: 58, train_loss: 0.9216, test_loss: 0.9448, test_f1: 0.5204
 epoch: 59, train_loss: 0.9162, test_loss: 0.9477, test_f1: 0.5133
 epoch: 60, train_loss: 0.9139, test_loss: 0.9422, test_f1: 0.5101
 epoch: 61, train_loss: 0.9096, test_loss: 0.9361, test_f1: 0.5098
 epoch: 62, train_loss: 0.9079, test_loss: 0.9406, test_f1: 0.5183
 epoch: 63, train_loss: 0.9125, test_loss: 0.9430, test_f1: 0.5156
 epoch: 64, train_loss: 0.9056, test_loss: 0.9403, test_f1: 0.5187
 epoch: 65, train_loss: 0.9155, test_loss: 0.9330, test_f1: 0.5171
 epoch: 66, train_loss: 0.9091, test_loss: 0.9398, test_f1: 0.5139
 epoch: 67, train_loss: 0.8968, test_loss: 0.9479, test_f1: 0.5109
 epoch: 68, train_loss: 0.9021, test_loss: 0.9412, test_f1: 0.5177
 epoch: 69, train_loss: 0.9017, test_loss: 0.9300, test_f1: 0.5149
 epoch: 70, train_loss: 0.9036, test_loss: 0.9375, test_f1: 0.5156
 epoch: 71, train_loss: 0.9144, test_loss: 0.9377, test_f1: 0.5176
 epoch: 72, train_loss: 0.9029, test_loss: 0.9386, test_f1: 0.5114
 epoch: 73, train_loss: 0.9044, test_loss: 0.9315, test_f1: 0.5209
 epoch: 74, train_loss: 0.9007, test_loss: 0.9633, test_f1: 0.5098
 epoch: 75, train_loss: 0.8974, test_loss: 0.9408, test_f1: 0.5194
 epoch: 76, train_loss: 0.9010, test_loss: 0.9429, test_f1: 0.5218
 epoch: 77, train_loss: 0.9038, test_loss: 0.9535, test_f1: 0.5164
 epoch: 78, train_loss: 0.8923, test_loss: 0.9403, test_f1: 0.5216
 epoch: 79, train_loss: 0.8956, test_loss: 0.9373, test_f1: 0.5238
 epoch: 80, train_loss: 0.8995, test_loss: 0.9380, test_f1: 0.5261
 epoch: 81, train_loss: 0.8918, test_loss: 0.9432, test_f1: 0.5200
 epoch: 82, train_loss: 0.8979, test_loss: 0.9300, test_f1: 0.5297
 epoch: 83, train_loss: 0.8968, test_loss: 0.9436, test_f1: 0.5297
 epoch: 84, train_loss: 0.9004, test_loss: 0.9507, test_f1: 0.5220
 epoch: 85, train_loss: 0.8991, test_loss: 0.9448, test_f1: 0.5168
 epoch: 86, train_loss: 0.8931, test_loss: 0.9360, test_f1: 0.5245
 epoch: 87, train_loss: 0.9024, test_loss: 0.9389, test_f1: 0.5179
 epoch: 88, train_loss: 0.8975, test_loss: 0.9401, test_f1: 0.5263
 epoch: 89, train_loss: 0.8934, test_loss: 0.9402, test_f1: 0.5303
 epoch: 90, train_loss: 0.8877, test_loss: 0.9489, test_f1: 0.5156
 epoch: 91, train_loss: 0.8891, test_loss: 0.9458, test_f1: 0.5210
 epoch: 92, train_loss: 0.8869, test_loss: 0.9484, test_f1: 0.5239
 epoch: 93, train_loss: 0.8858, test_loss: 0.9415, test_f1: 0.5267
 epoch: 94, train_loss: 0.8882, test_loss: 0.9527, test_f1: 0.5245
 epoch: 95, train_loss: 0.8806, test_loss: 0.9468, test_f1: 0.5237
 epoch: 96, train_loss: 0.8830, test_loss: 0.9414, test_f1: 0.5285
 epoch: 97, train_loss: 0.8936, test_loss: 0.9407, test_f1: 0.5214
 epoch: 98, train_loss: 0.8864, test_loss: 0.9414, test_f1: 0.5236
 epoch: 99, train_loss: 0.8897, test_loss: 0.9448, test_f1: 0.5234

Training completed in 367.46 seconds
Best F1: 0.5467 at epoch 96
Mean F1 across iterations: 0.5297  0.0118
========================FINAL RESULTS================================
FEGIN weighted F1: 0.5467  0.0118
python main.py --data ltspice_examples --representation component_net --model FEGIN --layers 2 --hiddens 16 --batch_size 256 --lr 0.001 --emb_size 250 --epochs 100 --save_appendix component_net_L2_H16_BS256_LR0.001_E250 --no_val
-----



STDERR:
  File "main.py", line 370, in <module>
    main()
  File "main.py", line 254, in main
    dataset = dataset_class(
  File "/home/philip/projects/ltspice_examples_code_repo/Circuit-Completion-Using-GNNs/component_classification_with_link_prediction_head/evaluation/FEGIN/kernel/circuit_datasets.py", line 15, in __init__
    self.data, self.slices = torch.load(self.processed_paths[0])
  File "/home/philip/.local/lib/python3.8/site-packages/torch/serialization.py", line 1040, in load
    warnings.warn(
  File "/usr/lib/python3.8/warnings.py", line 109, in _showwarnmsg
    sw(msg.message, msg.category, msg.filename, msg.lineno,
  File "main.py", line 47, in warn_with_traceback
    traceback.print_stack(file=log)
/home/philip/projects/ltspice_examples_code_repo/Circuit-Completion-Using-GNNs/component_classification_with_link_prediction_head/evaluation/FEGIN/kernel/circuit_datasets.py:15: FutureWarning: You are using `torch.load` with `weights_only=False` (the current default value), which uses the default pickle module implicitly. It is possible to construct malicious pickle data which will execute arbitrary code during unpickling (See https://github.com/pytorch/pytorch/blob/main/SECURITY.md#untrusted-models for more details). In a future release, the default value for `weights_only` will be flipped to `True`. This limits the functions that could be executed during unpickling. Arbitrary objects will no longer be allowed to be loaded via this mode unless they are explicitly allowlisted by the user via `torch.serialization.add_safe_globals`. We recommend you start setting `weights_only=True` for any use case where you don't have full control of the loaded file. Please open an issue on GitHub for any issues related to this experimental feature.
  self.data, self.slices = torch.load(self.processed_paths[0])
