STDOUT:
Results will be saved in /home/philip/projects/ltspice_examples_code_repo/Circuit-Completion-Using-GNNs/component_classification_with_link_prediction_head/evaluation/FEGIN/results/model_FEGIN_dataset_ltspice_examples
Command line input: python main.py --data ltspice_examples --representation component_component --model FEGIN --layers 5 --hiddens 16 --batch_size 64 --lr 0.0001 --emb_size 128 --epochs 100 --save_appendix component_component_L5_H16_BS64_LR0.0001_E128 --no_val
 is saved.
-----
ltspice_examples - FEGIN
Using 5 layers, 16 hidden units, h = 2
Loading component_component representation dataset
ENTERED
Training FEGIN on component_component representation
Train: 3556, Test: 845
##################ITERATION #0 ****************************************
 epoch: 0, train_loss: 1.4169, test_loss: 1.4148, test_f1: 0.0295
 epoch: 1, train_loss: 1.4097, test_loss: 1.4094, test_f1: 0.0295
 epoch: 2, train_loss: 1.4043, test_loss: 1.4048, test_f1: 0.0295
 epoch: 3, train_loss: 1.3991, test_loss: 1.3989, test_f1: 0.0295
 epoch: 4, train_loss: 1.3931, test_loss: 1.3931, test_f1: 0.0477
 epoch: 5, train_loss: 1.3860, test_loss: 1.3860, test_f1: 0.2298
 epoch: 6, train_loss: 1.3781, test_loss: 1.3789, test_f1: 0.2301
 epoch: 7, train_loss: 1.3697, test_loss: 1.3712, test_f1: 0.2238
 epoch: 8, train_loss: 1.3621, test_loss: 1.3642, test_f1: 0.2243
 epoch: 9, train_loss: 1.3507, test_loss: 1.3528, test_f1: 0.2250
 epoch: 10, train_loss: 1.3423, test_loss: 1.3458, test_f1: 0.2257
 epoch: 11, train_loss: 1.3342, test_loss: 1.3377, test_f1: 0.2274
 epoch: 12, train_loss: 1.3296, test_loss: 1.3307, test_f1: 0.2274
 epoch: 13, train_loss: 1.3210, test_loss: 1.3256, test_f1: 0.2274
 epoch: 14, train_loss: 1.3176, test_loss: 1.3203, test_f1: 0.2274
 epoch: 15, train_loss: 1.3108, test_loss: 1.3148, test_f1: 0.2274
 epoch: 16, train_loss: 1.3060, test_loss: 1.3090, test_f1: 0.2274
 epoch: 17, train_loss: 1.3026, test_loss: 1.3048, test_f1: 0.2274
 epoch: 18, train_loss: 1.3004, test_loss: 1.3004, test_f1: 0.2274
 epoch: 19, train_loss: 1.2959, test_loss: 1.2967, test_f1: 0.2274
 epoch: 20, train_loss: 1.2945, test_loss: 1.2934, test_f1: 0.2274
 epoch: 21, train_loss: 1.2914, test_loss: 1.2892, test_f1: 0.2274
 epoch: 22, train_loss: 1.2879, test_loss: 1.2843, test_f1: 0.2274
 epoch: 23, train_loss: 1.2858, test_loss: 1.2839, test_f1: 0.2274
 epoch: 24, train_loss: 1.2815, test_loss: 1.2808, test_f1: 0.2274
 epoch: 25, train_loss: 1.2817, test_loss: 1.2780, test_f1: 0.2274
 epoch: 26, train_loss: 1.2773, test_loss: 1.2750, test_f1: 0.2274
 epoch: 27, train_loss: 1.2751, test_loss: 1.2724, test_f1: 0.2274
 epoch: 28, train_loss: 1.2754, test_loss: 1.2699, test_f1: 0.2274
 epoch: 29, train_loss: 1.2711, test_loss: 1.2697, test_f1: 0.2274
 epoch: 30, train_loss: 1.2692, test_loss: 1.2657, test_f1: 0.2274
 epoch: 31, train_loss: 1.2685, test_loss: 1.2652, test_f1: 0.2274
 epoch: 32, train_loss: 1.2683, test_loss: 1.2595, test_f1: 0.2274
 epoch: 33, train_loss: 1.2633, test_loss: 1.2560, test_f1: 0.2274
 epoch: 34, train_loss: 1.2607, test_loss: 1.2571, test_f1: 0.2274
 epoch: 35, train_loss: 1.2598, test_loss: 1.2524, test_f1: 0.2274
 epoch: 36, train_loss: 1.2584, test_loss: 1.2487, test_f1: 0.2274
 epoch: 37, train_loss: 1.2552, test_loss: 1.2464, test_f1: 0.2274
 epoch: 38, train_loss: 1.2583, test_loss: 1.2452, test_f1: 0.2274
 epoch: 39, train_loss: 1.2466, test_loss: 1.2418, test_f1: 0.2274
 epoch: 40, train_loss: 1.2474, test_loss: 1.2407, test_f1: 0.2274
 epoch: 41, train_loss: 1.2489, test_loss: 1.2383, test_f1: 0.2274
 epoch: 42, train_loss: 1.2428, test_loss: 1.2325, test_f1: 0.2274
 epoch: 43, train_loss: 1.2415, test_loss: 1.2301, test_f1: 0.2274
 epoch: 44, train_loss: 1.2423, test_loss: 1.2285, test_f1: 0.2274
 epoch: 45, train_loss: 1.2394, test_loss: 1.2250, test_f1: 0.2300
 epoch: 46, train_loss: 1.2365, test_loss: 1.2221, test_f1: 0.2497
 epoch: 47, train_loss: 1.2363, test_loss: 1.2191, test_f1: 0.2497
 epoch: 48, train_loss: 1.2391, test_loss: 1.2161, test_f1: 0.2613
 epoch: 49, train_loss: 1.2317, test_loss: 1.2133, test_f1: 0.2590
 epoch: 50, train_loss: 1.2273, test_loss: 1.2108, test_f1: 0.2702
 epoch: 51, train_loss: 1.2276, test_loss: 1.2120, test_f1: 0.2852
 epoch: 52, train_loss: 1.2250, test_loss: 1.2098, test_f1: 0.2865
 epoch: 53, train_loss: 1.2286, test_loss: 1.2082, test_f1: 0.2831
 epoch: 54, train_loss: 1.2248, test_loss: 1.2057, test_f1: 0.2804
 epoch: 55, train_loss: 1.2243, test_loss: 1.2071, test_f1: 0.2899
 epoch: 56, train_loss: 1.2225, test_loss: 1.2051, test_f1: 0.2903
 epoch: 57, train_loss: 1.2267, test_loss: 1.2056, test_f1: 0.2911
 epoch: 58, train_loss: 1.2184, test_loss: 1.2006, test_f1: 0.2865
 epoch: 59, train_loss: 1.2155, test_loss: 1.2008, test_f1: 0.3044
 epoch: 60, train_loss: 1.2132, test_loss: 1.1996, test_f1: 0.3123
 epoch: 61, train_loss: 1.2155, test_loss: 1.1981, test_f1: 0.3216
 epoch: 62, train_loss: 1.2164, test_loss: 1.1966, test_f1: 0.3363
 epoch: 63, train_loss: 1.2133, test_loss: 1.1955, test_f1: 0.3390
 epoch: 64, train_loss: 1.2119, test_loss: 1.1953, test_f1: 0.3431
 epoch: 65, train_loss: 1.2184, test_loss: 1.1934, test_f1: 0.3704
 epoch: 66, train_loss: 1.2109, test_loss: 1.1939, test_f1: 0.3892
 epoch: 67, train_loss: 1.2109, test_loss: 1.1944, test_f1: 0.3891
 epoch: 68, train_loss: 1.2088, test_loss: 1.1912, test_f1: 0.3922
 epoch: 69, train_loss: 1.2068, test_loss: 1.1884, test_f1: 0.3952
 epoch: 70, train_loss: 1.2077, test_loss: 1.1902, test_f1: 0.4062
 epoch: 71, train_loss: 1.2142, test_loss: 1.1871, test_f1: 0.3988
 epoch: 72, train_loss: 1.2128, test_loss: 1.1871, test_f1: 0.4025
 epoch: 73, train_loss: 1.2059, test_loss: 1.1852, test_f1: 0.4113
 epoch: 74, train_loss: 1.2109, test_loss: 1.1851, test_f1: 0.4067
 epoch: 75, train_loss: 1.2077, test_loss: 1.1833, test_f1: 0.4054
 epoch: 76, train_loss: 1.2051, test_loss: 1.1815, test_f1: 0.4106
 epoch: 77, train_loss: 1.2091, test_loss: 1.1825, test_f1: 0.4274
 epoch: 78, train_loss: 1.2067, test_loss: 1.1803, test_f1: 0.4267
 epoch: 79, train_loss: 1.2034, test_loss: 1.1805, test_f1: 0.4321
 epoch: 80, train_loss: 1.2036, test_loss: 1.1794, test_f1: 0.4277
 epoch: 81, train_loss: 1.2083, test_loss: 1.1776, test_f1: 0.4364
 epoch: 82, train_loss: 1.2025, test_loss: 1.1798, test_f1: 0.4308
 epoch: 83, train_loss: 1.2005, test_loss: 1.1766, test_f1: 0.4307
 epoch: 84, train_loss: 1.2022, test_loss: 1.1760, test_f1: 0.4354
 epoch: 85, train_loss: 1.1989, test_loss: 1.1730, test_f1: 0.4290
 epoch: 86, train_loss: 1.1993, test_loss: 1.1718, test_f1: 0.4271
 epoch: 87, train_loss: 1.1910, test_loss: 1.1699, test_f1: 0.4241
 epoch: 88, train_loss: 1.1955, test_loss: 1.1728, test_f1: 0.4296
 epoch: 89, train_loss: 1.1942, test_loss: 1.1685, test_f1: 0.4291
 epoch: 90, train_loss: 1.1926, test_loss: 1.1676, test_f1: 0.4349
 epoch: 91, train_loss: 1.1921, test_loss: 1.1679, test_f1: 0.4343
 epoch: 92, train_loss: 1.1866, test_loss: 1.1676, test_f1: 0.4390
 epoch: 93, train_loss: 1.1885, test_loss: 1.1649, test_f1: 0.4461
 epoch: 94, train_loss: 1.1931, test_loss: 1.1638, test_f1: 0.4403
 epoch: 95, train_loss: 1.1883, test_loss: 1.1642, test_f1: 0.4437
 epoch: 96, train_loss: 1.1874, test_loss: 1.1621, test_f1: 0.4405
 epoch: 97, train_loss: 1.1855, test_loss: 1.1623, test_f1: 0.4436
 epoch: 98, train_loss: 1.1834, test_loss: 1.1606, test_f1: 0.4397
 epoch: 99, train_loss: 1.1827, test_loss: 1.1599, test_f1: 0.4478
##################ITERATION #1 ****************************************
 epoch: 0, train_loss: 1.3500, test_loss: 1.3419, test_f1: 0.2274
 epoch: 1, train_loss: 1.3388, test_loss: 1.3322, test_f1: 0.2274
 epoch: 2, train_loss: 1.3328, test_loss: 1.3261, test_f1: 0.2274
 epoch: 3, train_loss: 1.3261, test_loss: 1.3187, test_f1: 0.2274
 epoch: 4, train_loss: 1.3190, test_loss: 1.3121, test_f1: 0.2274
 epoch: 5, train_loss: 1.3124, test_loss: 1.3060, test_f1: 0.2274
 epoch: 6, train_loss: 1.3053, test_loss: 1.3026, test_f1: 0.2274
 epoch: 7, train_loss: 1.2999, test_loss: 1.2943, test_f1: 0.2274
 epoch: 8, train_loss: 1.2957, test_loss: 1.2909, test_f1: 0.2274
 epoch: 9, train_loss: 1.2923, test_loss: 1.2845, test_f1: 0.2274
 epoch: 10, train_loss: 1.2881, test_loss: 1.2791, test_f1: 0.2274
 epoch: 11, train_loss: 1.2832, test_loss: 1.2762, test_f1: 0.2274
 epoch: 12, train_loss: 1.2806, test_loss: 1.2736, test_f1: 0.2274
 epoch: 13, train_loss: 1.2747, test_loss: 1.2686, test_f1: 0.2274
 epoch: 14, train_loss: 1.2751, test_loss: 1.2664, test_f1: 0.2274
 epoch: 15, train_loss: 1.2741, test_loss: 1.2654, test_f1: 0.2274
 epoch: 16, train_loss: 1.2711, test_loss: 1.2654, test_f1: 0.2274
 epoch: 17, train_loss: 1.2711, test_loss: 1.2654, test_f1: 0.2274
 epoch: 18, train_loss: 1.2705, test_loss: 1.2601, test_f1: 0.2274
 epoch: 19, train_loss: 1.2661, test_loss: 1.2564, test_f1: 0.2274
 epoch: 20, train_loss: 1.2651, test_loss: 1.2561, test_f1: 0.2274
 epoch: 21, train_loss: 1.2640, test_loss: 1.2544, test_f1: 0.2274
 epoch: 22, train_loss: 1.2603, test_loss: 1.2493, test_f1: 0.2274
 epoch: 23, train_loss: 1.2639, test_loss: 1.2494, test_f1: 0.2274
 epoch: 24, train_loss: 1.2594, test_loss: 1.2488, test_f1: 0.2274
 epoch: 25, train_loss: 1.2616, test_loss: 1.2461, test_f1: 0.2274
 epoch: 26, train_loss: 1.2535, test_loss: 1.2431, test_f1: 0.2274
 epoch: 27, train_loss: 1.2557, test_loss: 1.2402, test_f1: 0.2274
 epoch: 28, train_loss: 1.2557, test_loss: 1.2390, test_f1: 0.2276
 epoch: 29, train_loss: 1.2521, test_loss: 1.2394, test_f1: 0.2271
 epoch: 30, train_loss: 1.2509, test_loss: 1.2364, test_f1: 0.2555
 epoch: 31, train_loss: 1.2486, test_loss: 1.2359, test_f1: 0.2555
 epoch: 32, train_loss: 1.2456, test_loss: 1.2338, test_f1: 0.2555
 epoch: 33, train_loss: 1.2462, test_loss: 1.2304, test_f1: 0.2555
 epoch: 34, train_loss: 1.2490, test_loss: 1.2273, test_f1: 0.2555
 epoch: 35, train_loss: 1.2439, test_loss: 1.2288, test_f1: 0.2555
 epoch: 36, train_loss: 1.2428, test_loss: 1.2284, test_f1: 0.2555
 epoch: 37, train_loss: 1.2415, test_loss: 1.2266, test_f1: 0.2580
 epoch: 38, train_loss: 1.2362, test_loss: 1.2229, test_f1: 0.2602
 epoch: 39, train_loss: 1.2415, test_loss: 1.2216, test_f1: 0.2628
 epoch: 40, train_loss: 1.2355, test_loss: 1.2205, test_f1: 0.2662
 epoch: 41, train_loss: 1.2403, test_loss: 1.2221, test_f1: 0.2682
 epoch: 42, train_loss: 1.2339, test_loss: 1.2186, test_f1: 0.2725
 epoch: 43, train_loss: 1.2401, test_loss: 1.2187, test_f1: 0.2739
 epoch: 44, train_loss: 1.2337, test_loss: 1.2132, test_f1: 0.2883
 epoch: 45, train_loss: 1.2351, test_loss: 1.2152, test_f1: 0.2879
 epoch: 46, train_loss: 1.2324, test_loss: 1.2142, test_f1: 0.2947
 epoch: 47, train_loss: 1.2328, test_loss: 1.2140, test_f1: 0.3181
 epoch: 48, train_loss: 1.2319, test_loss: 1.2089, test_f1: 0.3395
 epoch: 49, train_loss: 1.2318, test_loss: 1.2078, test_f1: 0.3307
 epoch: 50, train_loss: 1.2245, test_loss: 1.2093, test_f1: 0.3435
 epoch: 51, train_loss: 1.2258, test_loss: 1.2077, test_f1: 0.3522
 epoch: 52, train_loss: 1.2265, test_loss: 1.2069, test_f1: 0.3518
 epoch: 53, train_loss: 1.2291, test_loss: 1.2057, test_f1: 0.3477
 epoch: 54, train_loss: 1.2283, test_loss: 1.2074, test_f1: 0.3529
 epoch: 55, train_loss: 1.2221, test_loss: 1.2062, test_f1: 0.3503
 epoch: 56, train_loss: 1.2252, test_loss: 1.2040, test_f1: 0.3566
 epoch: 57, train_loss: 1.2234, test_loss: 1.2020, test_f1: 0.3505
 epoch: 58, train_loss: 1.2225, test_loss: 1.2032, test_f1: 0.3543
 epoch: 59, train_loss: 1.2215, test_loss: 1.2058, test_f1: 0.3537
 epoch: 60, train_loss: 1.2220, test_loss: 1.2036, test_f1: 0.3528
 epoch: 61, train_loss: 1.2220, test_loss: 1.2032, test_f1: 0.3504
 epoch: 62, train_loss: 1.2225, test_loss: 1.2025, test_f1: 0.3505
 epoch: 63, train_loss: 1.2250, test_loss: 1.2024, test_f1: 0.3531
 epoch: 64, train_loss: 1.2190, test_loss: 1.1990, test_f1: 0.3475
 epoch: 65, train_loss: 1.2220, test_loss: 1.2007, test_f1: 0.3533
 epoch: 66, train_loss: 1.2175, test_loss: 1.2010, test_f1: 0.3503
 epoch: 67, train_loss: 1.2213, test_loss: 1.1996, test_f1: 0.3457
 epoch: 68, train_loss: 1.2225, test_loss: 1.1973, test_f1: 0.3476
 epoch: 69, train_loss: 1.2166, test_loss: 1.1960, test_f1: 0.3463
 epoch: 70, train_loss: 1.2210, test_loss: 1.1959, test_f1: 0.3446
 epoch: 71, train_loss: 1.2123, test_loss: 1.1977, test_f1: 0.3477
 epoch: 72, train_loss: 1.2147, test_loss: 1.1987, test_f1: 0.3451
 epoch: 73, train_loss: 1.2166, test_loss: 1.1983, test_f1: 0.3464
 epoch: 74, train_loss: 1.2138, test_loss: 1.1928, test_f1: 0.3458
 epoch: 75, train_loss: 1.2121, test_loss: 1.1955, test_f1: 0.3438
 epoch: 76, train_loss: 1.2097, test_loss: 1.1934, test_f1: 0.3446
 epoch: 77, train_loss: 1.2129, test_loss: 1.1931, test_f1: 0.3452
 epoch: 78, train_loss: 1.2114, test_loss: 1.1942, test_f1: 0.3447
 epoch: 79, train_loss: 1.2093, test_loss: 1.1924, test_f1: 0.3441
 epoch: 80, train_loss: 1.2083, test_loss: 1.1934, test_f1: 0.3473
 epoch: 81, train_loss: 1.2107, test_loss: 1.1921, test_f1: 0.3414
 epoch: 82, train_loss: 1.2087, test_loss: 1.1918, test_f1: 0.3450
 epoch: 83, train_loss: 1.2075, test_loss: 1.1882, test_f1: 0.3449
 epoch: 84, train_loss: 1.2103, test_loss: 1.1870, test_f1: 0.3500
 epoch: 85, train_loss: 1.2093, test_loss: 1.1888, test_f1: 0.3458
 epoch: 86, train_loss: 1.2102, test_loss: 1.1898, test_f1: 0.3446
 epoch: 87, train_loss: 1.2002, test_loss: 1.1889, test_f1: 0.3443
 epoch: 88, train_loss: 1.2040, test_loss: 1.1845, test_f1: 0.3429
 epoch: 89, train_loss: 1.2036, test_loss: 1.1856, test_f1: 0.3435
 epoch: 90, train_loss: 1.2053, test_loss: 1.1854, test_f1: 0.3397
 epoch: 91, train_loss: 1.1994, test_loss: 1.1852, test_f1: 0.3454
 epoch: 92, train_loss: 1.2086, test_loss: 1.1856, test_f1: 0.3402
 epoch: 93, train_loss: 1.2042, test_loss: 1.1875, test_f1: 0.3451
 epoch: 94, train_loss: 1.2038, test_loss: 1.1845, test_f1: 0.3433
 epoch: 95, train_loss: 1.2057, test_loss: 1.1846, test_f1: 0.3442
 epoch: 96, train_loss: 1.2064, test_loss: 1.1822, test_f1: 0.3481
 epoch: 97, train_loss: 1.2017, test_loss: 1.1832, test_f1: 0.3428
 epoch: 98, train_loss: 1.1912, test_loss: 1.1830, test_f1: 0.3473
 epoch: 99, train_loss: 1.2002, test_loss: 1.1813, test_f1: 0.3440
##################ITERATION #2 ****************************************
 epoch: 0, train_loss: 1.3201, test_loss: 1.3262, test_f1: 0.2274
 epoch: 1, train_loss: 1.3123, test_loss: 1.3221, test_f1: 0.2274
 epoch: 2, train_loss: 1.3092, test_loss: 1.3187, test_f1: 0.2274
 epoch: 3, train_loss: 1.3022, test_loss: 1.3140, test_f1: 0.2274
 epoch: 4, train_loss: 1.2974, test_loss: 1.3076, test_f1: 0.2274
 epoch: 5, train_loss: 1.2927, test_loss: 1.3059, test_f1: 0.2274
 epoch: 6, train_loss: 1.2910, test_loss: 1.3006, test_f1: 0.2274
 epoch: 7, train_loss: 1.2851, test_loss: 1.2952, test_f1: 0.2274
 epoch: 8, train_loss: 1.2829, test_loss: 1.2920, test_f1: 0.2274
 epoch: 9, train_loss: 1.2792, test_loss: 1.2893, test_f1: 0.2274
 epoch: 10, train_loss: 1.2749, test_loss: 1.2858, test_f1: 0.2274
 epoch: 11, train_loss: 1.2723, test_loss: 1.2812, test_f1: 0.2274
 epoch: 12, train_loss: 1.2719, test_loss: 1.2809, test_f1: 0.2274
 epoch: 13, train_loss: 1.2683, test_loss: 1.2765, test_f1: 0.2274
 epoch: 14, train_loss: 1.2638, test_loss: 1.2740, test_f1: 0.2274
 epoch: 15, train_loss: 1.2619, test_loss: 1.2721, test_f1: 0.2274
 epoch: 16, train_loss: 1.2585, test_loss: 1.2650, test_f1: 0.2274
 epoch: 17, train_loss: 1.2575, test_loss: 1.2636, test_f1: 0.2274
 epoch: 18, train_loss: 1.2511, test_loss: 1.2602, test_f1: 0.2274
 epoch: 19, train_loss: 1.2527, test_loss: 1.2570, test_f1: 0.2274
 epoch: 20, train_loss: 1.2492, test_loss: 1.2531, test_f1: 0.2274
 epoch: 21, train_loss: 1.2468, test_loss: 1.2529, test_f1: 0.2274
 epoch: 22, train_loss: 1.2478, test_loss: 1.2510, test_f1: 0.2274
 epoch: 23, train_loss: 1.2473, test_loss: 1.2473, test_f1: 0.2278
 epoch: 24, train_loss: 1.2437, test_loss: 1.2470, test_f1: 0.2274
 epoch: 25, train_loss: 1.2438, test_loss: 1.2437, test_f1: 0.2395
 epoch: 26, train_loss: 1.2429, test_loss: 1.2407, test_f1: 0.2397
 epoch: 27, train_loss: 1.2443, test_loss: 1.2382, test_f1: 0.2397
 epoch: 28, train_loss: 1.2379, test_loss: 1.2355, test_f1: 0.2397
 epoch: 29, train_loss: 1.2364, test_loss: 1.2362, test_f1: 0.2397
 epoch: 30, train_loss: 1.2271, test_loss: 1.2337, test_f1: 0.2397
 epoch: 31, train_loss: 1.2309, test_loss: 1.2265, test_f1: 0.2397
 epoch: 32, train_loss: 1.2284, test_loss: 1.2264, test_f1: 0.2385
 epoch: 33, train_loss: 1.2277, test_loss: 1.2243, test_f1: 0.2397
 epoch: 34, train_loss: 1.2275, test_loss: 1.2218, test_f1: 0.2392
 epoch: 35, train_loss: 1.2275, test_loss: 1.2192, test_f1: 0.2382
 epoch: 36, train_loss: 1.2252, test_loss: 1.2192, test_f1: 0.2359
 epoch: 37, train_loss: 1.2163, test_loss: 1.2157, test_f1: 0.2473
 epoch: 38, train_loss: 1.2203, test_loss: 1.2150, test_f1: 0.2471
 epoch: 39, train_loss: 1.2190, test_loss: 1.2133, test_f1: 0.2623
 epoch: 40, train_loss: 1.2150, test_loss: 1.2112, test_f1: 0.2828
 epoch: 41, train_loss: 1.2111, test_loss: 1.2074, test_f1: 0.2930
 epoch: 42, train_loss: 1.2119, test_loss: 1.2022, test_f1: 0.2928
 epoch: 43, train_loss: 1.2138, test_loss: 1.2022, test_f1: 0.2918
 epoch: 44, train_loss: 1.2087, test_loss: 1.2005, test_f1: 0.3065
 epoch: 45, train_loss: 1.2046, test_loss: 1.2012, test_f1: 0.3064
 epoch: 46, train_loss: 1.2067, test_loss: 1.1955, test_f1: 0.3265
 epoch: 47, train_loss: 1.2036, test_loss: 1.1925, test_f1: 0.3309
 epoch: 48, train_loss: 1.2047, test_loss: 1.1931, test_f1: 0.3185
 epoch: 49, train_loss: 1.1998, test_loss: 1.1868, test_f1: 0.3375
 epoch: 50, train_loss: 1.2014, test_loss: 1.1850, test_f1: 0.3357
 epoch: 51, train_loss: 1.2026, test_loss: 1.1881, test_f1: 0.3338
 epoch: 52, train_loss: 1.1995, test_loss: 1.1829, test_f1: 0.3396
 epoch: 53, train_loss: 1.1955, test_loss: 1.1871, test_f1: 0.3534
 epoch: 54, train_loss: 1.1983, test_loss: 1.1834, test_f1: 0.3431
 epoch: 55, train_loss: 1.1934, test_loss: 1.1775, test_f1: 0.3504
 epoch: 56, train_loss: 1.1920, test_loss: 1.1827, test_f1: 0.3431
 epoch: 57, train_loss: 1.2012, test_loss: 1.1821, test_f1: 0.3355
 epoch: 58, train_loss: 1.1962, test_loss: 1.1802, test_f1: 0.3581
 epoch: 59, train_loss: 1.1941, test_loss: 1.1833, test_f1: 0.3383
 epoch: 60, train_loss: 1.1916, test_loss: 1.1785, test_f1: 0.3615
 epoch: 61, train_loss: 1.1908, test_loss: 1.1773, test_f1: 0.3538
 epoch: 62, train_loss: 1.1938, test_loss: 1.1727, test_f1: 0.3517
 epoch: 63, train_loss: 1.1861, test_loss: 1.1780, test_f1: 0.3532
 epoch: 64, train_loss: 1.1860, test_loss: 1.1733, test_f1: 0.3696
 epoch: 65, train_loss: 1.1892, test_loss: 1.1766, test_f1: 0.3579
 epoch: 66, train_loss: 1.1926, test_loss: 1.1743, test_f1: 0.3545
 epoch: 67, train_loss: 1.1872, test_loss: 1.1747, test_f1: 0.3437
 epoch: 68, train_loss: 1.1896, test_loss: 1.1721, test_f1: 0.3674
 epoch: 69, train_loss: 1.1839, test_loss: 1.1728, test_f1: 0.3711
 epoch: 70, train_loss: 1.1854, test_loss: 1.1720, test_f1: 0.3700
 epoch: 71, train_loss: 1.1839, test_loss: 1.1729, test_f1: 0.3720
 epoch: 72, train_loss: 1.1836, test_loss: 1.1740, test_f1: 0.3745
 epoch: 73, train_loss: 1.1843, test_loss: 1.1753, test_f1: 0.3615
 epoch: 74, train_loss: 1.1799, test_loss: 1.1725, test_f1: 0.3797
 epoch: 75, train_loss: 1.1886, test_loss: 1.1711, test_f1: 0.3600
 epoch: 76, train_loss: 1.1829, test_loss: 1.1722, test_f1: 0.3863
 epoch: 77, train_loss: 1.1748, test_loss: 1.1778, test_f1: 0.3522
 epoch: 78, train_loss: 1.1862, test_loss: 1.1689, test_f1: 0.3691
 epoch: 79, train_loss: 1.1771, test_loss: 1.1695, test_f1: 0.3698
 epoch: 80, train_loss: 1.1824, test_loss: 1.1715, test_f1: 0.3675
 epoch: 81, train_loss: 1.1757, test_loss: 1.1680, test_f1: 0.3683
 epoch: 82, train_loss: 1.1774, test_loss: 1.1645, test_f1: 0.3749
 epoch: 83, train_loss: 1.1732, test_loss: 1.1714, test_f1: 0.3733
 epoch: 84, train_loss: 1.1858, test_loss: 1.1651, test_f1: 0.3813
 epoch: 85, train_loss: 1.1764, test_loss: 1.1729, test_f1: 0.3831
 epoch: 86, train_loss: 1.1794, test_loss: 1.1787, test_f1: 0.3746
 epoch: 87, train_loss: 1.1789, test_loss: 1.1751, test_f1: 0.3861
 epoch: 88, train_loss: 1.1796, test_loss: 1.1686, test_f1: 0.3761
 epoch: 89, train_loss: 1.1717, test_loss: 1.1770, test_f1: 0.3753
 epoch: 90, train_loss: 1.1771, test_loss: 1.1798, test_f1: 0.3820
 epoch: 91, train_loss: 1.1734, test_loss: 1.1861, test_f1: 0.3802
 epoch: 92, train_loss: 1.1769, test_loss: 1.1850, test_f1: 0.3765
 epoch: 93, train_loss: 1.1793, test_loss: 1.1766, test_f1: 0.3829
 epoch: 94, train_loss: 1.1769, test_loss: 1.1805, test_f1: 0.3787
 epoch: 95, train_loss: 1.1740, test_loss: 1.1885, test_f1: 0.3833
 epoch: 96, train_loss: 1.1689, test_loss: 1.1907, test_f1: 0.3832
 epoch: 97, train_loss: 1.1839, test_loss: 1.1908, test_f1: 0.3823
 epoch: 98, train_loss: 1.1662, test_loss: 1.1920, test_f1: 0.3875
 epoch: 99, train_loss: 1.1739, test_loss: 1.1873, test_f1: 0.3713
##################ITERATION #3 ****************************************
 epoch: 0, train_loss: 1.3127, test_loss: 1.3117, test_f1: 0.2578
 epoch: 1, train_loss: 1.3027, test_loss: 1.3030, test_f1: 0.2264
 epoch: 2, train_loss: 1.2981, test_loss: 1.2930, test_f1: 0.2555
 epoch: 3, train_loss: 1.2939, test_loss: 1.2864, test_f1: 0.2613
 epoch: 4, train_loss: 1.2906, test_loss: 1.2841, test_f1: 0.2555
 epoch: 5, train_loss: 1.2869, test_loss: 1.2761, test_f1: 0.2581
 epoch: 6, train_loss: 1.2814, test_loss: 1.2750, test_f1: 0.2613
 epoch: 7, train_loss: 1.2746, test_loss: 1.2722, test_f1: 0.2555
 epoch: 8, train_loss: 1.2727, test_loss: 1.2695, test_f1: 0.2555
 epoch: 9, train_loss: 1.2689, test_loss: 1.2630, test_f1: 0.2555
 epoch: 10, train_loss: 1.2639, test_loss: 1.2569, test_f1: 0.2555
 epoch: 11, train_loss: 1.2609, test_loss: 1.2521, test_f1: 0.2555
 epoch: 12, train_loss: 1.2575, test_loss: 1.2482, test_f1: 0.2551
 epoch: 13, train_loss: 1.2562, test_loss: 1.2406, test_f1: 0.2643
 epoch: 14, train_loss: 1.2520, test_loss: 1.2382, test_f1: 0.2551
 epoch: 15, train_loss: 1.2510, test_loss: 1.2340, test_f1: 0.2548
 epoch: 16, train_loss: 1.2470, test_loss: 1.2307, test_f1: 0.2543
 epoch: 17, train_loss: 1.2448, test_loss: 1.2240, test_f1: 0.2544
 epoch: 18, train_loss: 1.2425, test_loss: 1.2220, test_f1: 0.2656
 epoch: 19, train_loss: 1.2397, test_loss: 1.2145, test_f1: 0.2692
 epoch: 20, train_loss: 1.2311, test_loss: 1.2131, test_f1: 0.2685
 epoch: 21, train_loss: 1.2343, test_loss: 1.2121, test_f1: 0.2761
 epoch: 22, train_loss: 1.2280, test_loss: 1.2080, test_f1: 0.2752
 epoch: 23, train_loss: 1.2234, test_loss: 1.2027, test_f1: 0.3095
 epoch: 24, train_loss: 1.2238, test_loss: 1.1994, test_f1: 0.3234
 epoch: 25, train_loss: 1.2249, test_loss: 1.1975, test_f1: 0.3348
 epoch: 26, train_loss: 1.2163, test_loss: 1.1898, test_f1: 0.3372
 epoch: 27, train_loss: 1.2162, test_loss: 1.1893, test_f1: 0.3506
 epoch: 28, train_loss: 1.2174, test_loss: 1.1873, test_f1: 0.3546
 epoch: 29, train_loss: 1.2143, test_loss: 1.1818, test_f1: 0.3644
 epoch: 30, train_loss: 1.2069, test_loss: 1.1787, test_f1: 0.3922
 epoch: 31, train_loss: 1.2054, test_loss: 1.1764, test_f1: 0.4021
 epoch: 32, train_loss: 1.2025, test_loss: 1.1731, test_f1: 0.3928
 epoch: 33, train_loss: 1.2030, test_loss: 1.1709, test_f1: 0.4137
 epoch: 34, train_loss: 1.2006, test_loss: 1.1660, test_f1: 0.4062
 epoch: 35, train_loss: 1.2033, test_loss: 1.1630, test_f1: 0.4081
 epoch: 36, train_loss: 1.1916, test_loss: 1.1605, test_f1: 0.4042
 epoch: 37, train_loss: 1.1939, test_loss: 1.1596, test_f1: 0.4252
 epoch: 38, train_loss: 1.1904, test_loss: 1.1550, test_f1: 0.4181
 epoch: 39, train_loss: 1.1892, test_loss: 1.1533, test_f1: 0.4323
 epoch: 40, train_loss: 1.1896, test_loss: 1.1490, test_f1: 0.4304
 epoch: 41, train_loss: 1.1925, test_loss: 1.1479, test_f1: 0.4407
 epoch: 42, train_loss: 1.1848, test_loss: 1.1445, test_f1: 0.4366
 epoch: 43, train_loss: 1.1810, test_loss: 1.1400, test_f1: 0.4389
 epoch: 44, train_loss: 1.1836, test_loss: 1.1409, test_f1: 0.4337
 epoch: 45, train_loss: 1.1752, test_loss: 1.1344, test_f1: 0.4498
 epoch: 46, train_loss: 1.1786, test_loss: 1.1339, test_f1: 0.4429
 epoch: 47, train_loss: 1.1713, test_loss: 1.1318, test_f1: 0.4291
 epoch: 48, train_loss: 1.1688, test_loss: 1.1262, test_f1: 0.4450
 epoch: 49, train_loss: 1.1673, test_loss: 1.1270, test_f1: 0.4491
 epoch: 50, train_loss: 1.1634, test_loss: 1.1236, test_f1: 0.4449
 epoch: 51, train_loss: 1.1688, test_loss: 1.1217, test_f1: 0.4518
 epoch: 52, train_loss: 1.1597, test_loss: 1.1187, test_f1: 0.4487
 epoch: 53, train_loss: 1.1614, test_loss: 1.1173, test_f1: 0.4529
 epoch: 54, train_loss: 1.1547, test_loss: 1.1175, test_f1: 0.4445
 epoch: 55, train_loss: 1.1557, test_loss: 1.1174, test_f1: 0.4506
 epoch: 56, train_loss: 1.1601, test_loss: 1.1132, test_f1: 0.4536
 epoch: 57, train_loss: 1.1586, test_loss: 1.1170, test_f1: 0.4485
 epoch: 58, train_loss: 1.1580, test_loss: 1.1163, test_f1: 0.4399
 epoch: 59, train_loss: 1.1547, test_loss: 1.1133, test_f1: 0.4476
 epoch: 60, train_loss: 1.1475, test_loss: 1.1134, test_f1: 0.4379
 epoch: 61, train_loss: 1.1532, test_loss: 1.1132, test_f1: 0.4447
 epoch: 62, train_loss: 1.1594, test_loss: 1.1095, test_f1: 0.4471
 epoch: 63, train_loss: 1.1541, test_loss: 1.1086, test_f1: 0.4365
 epoch: 64, train_loss: 1.1556, test_loss: 1.1060, test_f1: 0.4440
 epoch: 65, train_loss: 1.1477, test_loss: 1.1057, test_f1: 0.4514
 epoch: 66, train_loss: 1.1478, test_loss: 1.1072, test_f1: 0.4438
 epoch: 67, train_loss: 1.1543, test_loss: 1.1033, test_f1: 0.4515
 epoch: 68, train_loss: 1.1467, test_loss: 1.1066, test_f1: 0.4522
 epoch: 69, train_loss: 1.1431, test_loss: 1.1024, test_f1: 0.4478
 epoch: 70, train_loss: 1.1481, test_loss: 1.1056, test_f1: 0.4403
 epoch: 71, train_loss: 1.1474, test_loss: 1.1026, test_f1: 0.4354
 epoch: 72, train_loss: 1.1449, test_loss: 1.1049, test_f1: 0.4319
 epoch: 73, train_loss: 1.1490, test_loss: 1.0979, test_f1: 0.4531
 epoch: 74, train_loss: 1.1460, test_loss: 1.1006, test_f1: 0.4390
 epoch: 75, train_loss: 1.1443, test_loss: 1.0989, test_f1: 0.4431
 epoch: 76, train_loss: 1.1389, test_loss: 1.0979, test_f1: 0.4338
 epoch: 77, train_loss: 1.1397, test_loss: 1.0956, test_f1: 0.4448
 epoch: 78, train_loss: 1.1388, test_loss: 1.0941, test_f1: 0.4486
 epoch: 79, train_loss: 1.1386, test_loss: 1.0958, test_f1: 0.4330
 epoch: 80, train_loss: 1.1358, test_loss: 1.0913, test_f1: 0.4524
 epoch: 81, train_loss: 1.1407, test_loss: 1.0905, test_f1: 0.4307
 epoch: 82, train_loss: 1.1336, test_loss: 1.0929, test_f1: 0.4388
 epoch: 83, train_loss: 1.1266, test_loss: 1.0923, test_f1: 0.4353
 epoch: 84, train_loss: 1.1291, test_loss: 1.0920, test_f1: 0.4369
 epoch: 85, train_loss: 1.1384, test_loss: 1.0882, test_f1: 0.4267
 epoch: 86, train_loss: 1.1376, test_loss: 1.0881, test_f1: 0.4376
 epoch: 87, train_loss: 1.1314, test_loss: 1.0927, test_f1: 0.4288
 epoch: 88, train_loss: 1.1364, test_loss: 1.0845, test_f1: 0.4374
 epoch: 89, train_loss: 1.1367, test_loss: 1.0878, test_f1: 0.4412
 epoch: 90, train_loss: 1.1318, test_loss: 1.0841, test_f1: 0.4392
 epoch: 91, train_loss: 1.1293, test_loss: 1.0843, test_f1: 0.4309
 epoch: 92, train_loss: 1.1281, test_loss: 1.0833, test_f1: 0.4469
 epoch: 93, train_loss: 1.1297, test_loss: 1.0831, test_f1: 0.4374
 epoch: 94, train_loss: 1.1286, test_loss: 1.0858, test_f1: 0.4362
 epoch: 95, train_loss: 1.1306, test_loss: 1.0874, test_f1: 0.4337
 epoch: 96, train_loss: 1.1243, test_loss: 1.0827, test_f1: 0.4496
 epoch: 97, train_loss: 1.1255, test_loss: 1.0776, test_f1: 0.4494
 epoch: 98, train_loss: 1.1253, test_loss: 1.0789, test_f1: 0.4381
 epoch: 99, train_loss: 1.1315, test_loss: 1.0809, test_f1: 0.4378
##################ITERATION #4 ****************************************
 epoch: 0, train_loss: 1.3126, test_loss: 1.3105, test_f1: 0.2274
 epoch: 1, train_loss: 1.3031, test_loss: 1.3105, test_f1: 0.2274
 epoch: 2, train_loss: 1.2995, test_loss: 1.3083, test_f1: 0.2274
 epoch: 3, train_loss: 1.2966, test_loss: 1.3000, test_f1: 0.2274
 epoch: 4, train_loss: 1.2955, test_loss: 1.2989, test_f1: 0.2274
 epoch: 5, train_loss: 1.2898, test_loss: 1.2940, test_f1: 0.2274
 epoch: 6, train_loss: 1.2871, test_loss: 1.2906, test_f1: 0.2274
 epoch: 7, train_loss: 1.2838, test_loss: 1.2881, test_f1: 0.2274
 epoch: 8, train_loss: 1.2784, test_loss: 1.2825, test_f1: 0.2274
 epoch: 9, train_loss: 1.2762, test_loss: 1.2791, test_f1: 0.2274
 epoch: 10, train_loss: 1.2718, test_loss: 1.2753, test_f1: 0.2274
 epoch: 11, train_loss: 1.2699, test_loss: 1.2732, test_f1: 0.2274
 epoch: 12, train_loss: 1.2648, test_loss: 1.2683, test_f1: 0.2274
 epoch: 13, train_loss: 1.2615, test_loss: 1.2646, test_f1: 0.2274
 epoch: 14, train_loss: 1.2589, test_loss: 1.2614, test_f1: 0.2274
 epoch: 15, train_loss: 1.2537, test_loss: 1.2495, test_f1: 0.2325
 epoch: 16, train_loss: 1.2568, test_loss: 1.2474, test_f1: 0.2385
 epoch: 17, train_loss: 1.2486, test_loss: 1.2426, test_f1: 0.2379
 epoch: 18, train_loss: 1.2437, test_loss: 1.2371, test_f1: 0.2561
 epoch: 19, train_loss: 1.2430, test_loss: 1.2321, test_f1: 0.2826
 epoch: 20, train_loss: 1.2405, test_loss: 1.2267, test_f1: 0.2973
 epoch: 21, train_loss: 1.2366, test_loss: 1.2183, test_f1: 0.3097
 epoch: 22, train_loss: 1.2339, test_loss: 1.2186, test_f1: 0.3224
 epoch: 23, train_loss: 1.2331, test_loss: 1.2151, test_f1: 0.3217
 epoch: 24, train_loss: 1.2264, test_loss: 1.2167, test_f1: 0.3206
 epoch: 25, train_loss: 1.2278, test_loss: 1.2115, test_f1: 0.3325
 epoch: 26, train_loss: 1.2251, test_loss: 1.2100, test_f1: 0.3392
 epoch: 27, train_loss: 1.2169, test_loss: 1.2067, test_f1: 0.3461
 epoch: 28, train_loss: 1.2191, test_loss: 1.2035, test_f1: 0.3564
 epoch: 29, train_loss: 1.2171, test_loss: 1.1987, test_f1: 0.3763
 epoch: 30, train_loss: 1.2164, test_loss: 1.2012, test_f1: 0.3470
 epoch: 31, train_loss: 1.2167, test_loss: 1.1983, test_f1: 0.3550
 epoch: 32, train_loss: 1.2104, test_loss: 1.1975, test_f1: 0.3482
 epoch: 33, train_loss: 1.2090, test_loss: 1.1934, test_f1: 0.3378
 epoch: 34, train_loss: 1.2128, test_loss: 1.1897, test_f1: 0.3528
 epoch: 35, train_loss: 1.2066, test_loss: 1.1905, test_f1: 0.3472
 epoch: 36, train_loss: 1.2094, test_loss: 1.1856, test_f1: 0.3459
 epoch: 37, train_loss: 1.2065, test_loss: 1.1866, test_f1: 0.3615
 epoch: 38, train_loss: 1.2066, test_loss: 1.1841, test_f1: 0.3678
 epoch: 39, train_loss: 1.1967, test_loss: 1.1809, test_f1: 0.3562
 epoch: 40, train_loss: 1.1963, test_loss: 1.1782, test_f1: 0.3566
 epoch: 41, train_loss: 1.1977, test_loss: 1.1771, test_f1: 0.3582
 epoch: 42, train_loss: 1.1981, test_loss: 1.1729, test_f1: 0.3663
 epoch: 43, train_loss: 1.1959, test_loss: 1.1707, test_f1: 0.3671
 epoch: 44, train_loss: 1.1932, test_loss: 1.1735, test_f1: 0.3653
 epoch: 45, train_loss: 1.1932, test_loss: 1.1685, test_f1: 0.3536
 epoch: 46, train_loss: 1.1925, test_loss: 1.1700, test_f1: 0.3458
 epoch: 47, train_loss: 1.1922, test_loss: 1.1678, test_f1: 0.3622
 epoch: 48, train_loss: 1.1860, test_loss: 1.1623, test_f1: 0.3608
 epoch: 49, train_loss: 1.1863, test_loss: 1.1619, test_f1: 0.3722
 epoch: 50, train_loss: 1.1870, test_loss: 1.1581, test_f1: 0.3849
 epoch: 51, train_loss: 1.1798, test_loss: 1.1596, test_f1: 0.3706
 epoch: 52, train_loss: 1.1846, test_loss: 1.1558, test_f1: 0.3803
 epoch: 53, train_loss: 1.1859, test_loss: 1.1563, test_f1: 0.3646
 epoch: 54, train_loss: 1.1892, test_loss: 1.1543, test_f1: 0.3859
 epoch: 55, train_loss: 1.1796, test_loss: 1.1544, test_f1: 0.3936
 epoch: 56, train_loss: 1.1846, test_loss: 1.1549, test_f1: 0.3846
 epoch: 57, train_loss: 1.1849, test_loss: 1.1513, test_f1: 0.3823
 epoch: 58, train_loss: 1.1814, test_loss: 1.1495, test_f1: 0.3906
 epoch: 59, train_loss: 1.1872, test_loss: 1.1530, test_f1: 0.3931
 epoch: 60, train_loss: 1.1806, test_loss: 1.1489, test_f1: 0.3875
 epoch: 61, train_loss: 1.1783, test_loss: 1.1485, test_f1: 0.4033
 epoch: 62, train_loss: 1.1828, test_loss: 1.1474, test_f1: 0.4122
 epoch: 63, train_loss: 1.1826, test_loss: 1.1469, test_f1: 0.4047
 epoch: 64, train_loss: 1.1742, test_loss: 1.1469, test_f1: 0.4016
 epoch: 65, train_loss: 1.1790, test_loss: 1.1450, test_f1: 0.4134
 epoch: 66, train_loss: 1.1781, test_loss: 1.1472, test_f1: 0.3904
 epoch: 67, train_loss: 1.1675, test_loss: 1.1450, test_f1: 0.4092
 epoch: 68, train_loss: 1.1741, test_loss: 1.1447, test_f1: 0.4079
 epoch: 69, train_loss: 1.1764, test_loss: 1.1425, test_f1: 0.4115
 epoch: 70, train_loss: 1.1673, test_loss: 1.1409, test_f1: 0.4153
 epoch: 71, train_loss: 1.1723, test_loss: 1.1418, test_f1: 0.4104
 epoch: 72, train_loss: 1.1699, test_loss: 1.1392, test_f1: 0.4183
 epoch: 73, train_loss: 1.1705, test_loss: 1.1409, test_f1: 0.4098
 epoch: 74, train_loss: 1.1646, test_loss: 1.1364, test_f1: 0.4122
 epoch: 75, train_loss: 1.1660, test_loss: 1.1362, test_f1: 0.4265
 epoch: 76, train_loss: 1.1727, test_loss: 1.1361, test_f1: 0.3961
 epoch: 77, train_loss: 1.1721, test_loss: 1.1366, test_f1: 0.4138
 epoch: 78, train_loss: 1.1654, test_loss: 1.1342, test_f1: 0.4156
 epoch: 79, train_loss: 1.1724, test_loss: 1.1386, test_f1: 0.4089
 epoch: 80, train_loss: 1.1695, test_loss: 1.1349, test_f1: 0.4295
 epoch: 81, train_loss: 1.1749, test_loss: 1.1344, test_f1: 0.4294
 epoch: 82, train_loss: 1.1587, test_loss: 1.1350, test_f1: 0.4117
 epoch: 83, train_loss: 1.1666, test_loss: 1.1296, test_f1: 0.4262
 epoch: 84, train_loss: 1.1656, test_loss: 1.1298, test_f1: 0.4265
 epoch: 85, train_loss: 1.1629, test_loss: 1.1299, test_f1: 0.4377
 epoch: 86, train_loss: 1.1585, test_loss: 1.1277, test_f1: 0.4405
 epoch: 87, train_loss: 1.1639, test_loss: 1.1265, test_f1: 0.4360
 epoch: 88, train_loss: 1.1687, test_loss: 1.1291, test_f1: 0.4387
 epoch: 89, train_loss: 1.1591, test_loss: 1.1270, test_f1: 0.4396
 epoch: 90, train_loss: 1.1612, test_loss: 1.1270, test_f1: 0.4347
 epoch: 91, train_loss: 1.1588, test_loss: 1.1281, test_f1: 0.4260
 epoch: 92, train_loss: 1.1626, test_loss: 1.1260, test_f1: 0.4327
 epoch: 93, train_loss: 1.1557, test_loss: 1.1247, test_f1: 0.4365
 epoch: 94, train_loss: 1.1581, test_loss: 1.1262, test_f1: 0.4314
 epoch: 95, train_loss: 1.1489, test_loss: 1.1212, test_f1: 0.4361
 epoch: 96, train_loss: 1.1548, test_loss: 1.1234, test_f1: 0.4350
 epoch: 97, train_loss: 1.1621, test_loss: 1.1191, test_f1: 0.4353
 epoch: 98, train_loss: 1.1562, test_loss: 1.1227, test_f1: 0.4384
 epoch: 99, train_loss: 1.1478, test_loss: 1.1188, test_f1: 0.4246
##################ITERATION #5 ****************************************
 epoch: 0, train_loss: 1.3072, test_loss: 1.2894, test_f1: 0.2274
 epoch: 1, train_loss: 1.2929, test_loss: 1.2731, test_f1: 0.2414
 epoch: 2, train_loss: 1.2854, test_loss: 1.2655, test_f1: 0.2301
 epoch: 3, train_loss: 1.2828, test_loss: 1.2606, test_f1: 0.2390
 epoch: 4, train_loss: 1.2754, test_loss: 1.2555, test_f1: 0.2579
 epoch: 5, train_loss: 1.2744, test_loss: 1.2512, test_f1: 0.2578
 epoch: 6, train_loss: 1.2676, test_loss: 1.2450, test_f1: 0.2600
 epoch: 7, train_loss: 1.2651, test_loss: 1.2414, test_f1: 0.2617
 epoch: 8, train_loss: 1.2644, test_loss: 1.2392, test_f1: 0.2727
 epoch: 9, train_loss: 1.2634, test_loss: 1.2316, test_f1: 0.2699
 epoch: 10, train_loss: 1.2626, test_loss: 1.2363, test_f1: 0.2804
 epoch: 11, train_loss: 1.2559, test_loss: 1.2309, test_f1: 0.2844
 epoch: 12, train_loss: 1.2530, test_loss: 1.2305, test_f1: 0.2823
 epoch: 13, train_loss: 1.2587, test_loss: 1.2254, test_f1: 0.3009
 epoch: 14, train_loss: 1.2574, test_loss: 1.2251, test_f1: 0.2901
 epoch: 15, train_loss: 1.2486, test_loss: 1.2217, test_f1: 0.2843
 epoch: 16, train_loss: 1.2444, test_loss: 1.2164, test_f1: 0.3091
 epoch: 17, train_loss: 1.2505, test_loss: 1.2146, test_f1: 0.3017
 epoch: 18, train_loss: 1.2506, test_loss: 1.2150, test_f1: 0.2925
 epoch: 19, train_loss: 1.2425, test_loss: 1.2109, test_f1: 0.2976
 epoch: 20, train_loss: 1.2390, test_loss: 1.2086, test_f1: 0.2962
 epoch: 21, train_loss: 1.2412, test_loss: 1.2097, test_f1: 0.3033
 epoch: 22, train_loss: 1.2374, test_loss: 1.2083, test_f1: 0.2981
 epoch: 23, train_loss: 1.2352, test_loss: 1.2016, test_f1: 0.3079
 epoch: 24, train_loss: 1.2364, test_loss: 1.2039, test_f1: 0.3095
 epoch: 25, train_loss: 1.2336, test_loss: 1.1988, test_f1: 0.2972
 epoch: 26, train_loss: 1.2264, test_loss: 1.1981, test_f1: 0.3160
 epoch: 27, train_loss: 1.2257, test_loss: 1.1950, test_f1: 0.3081
 epoch: 28, train_loss: 1.2185, test_loss: 1.1925, test_f1: 0.3140
 epoch: 29, train_loss: 1.2193, test_loss: 1.1932, test_f1: 0.3245
 epoch: 30, train_loss: 1.2223, test_loss: 1.1892, test_f1: 0.3256
 epoch: 31, train_loss: 1.2239, test_loss: 1.1874, test_f1: 0.3223
 epoch: 32, train_loss: 1.2220, test_loss: 1.1856, test_f1: 0.3287
 epoch: 33, train_loss: 1.2183, test_loss: 1.1839, test_f1: 0.3201
 epoch: 34, train_loss: 1.2218, test_loss: 1.1849, test_f1: 0.3272
 epoch: 35, train_loss: 1.2192, test_loss: 1.1807, test_f1: 0.3242
 epoch: 36, train_loss: 1.2224, test_loss: 1.1816, test_f1: 0.3238
 epoch: 37, train_loss: 1.2163, test_loss: 1.1777, test_f1: 0.3247
 epoch: 38, train_loss: 1.2089, test_loss: 1.1722, test_f1: 0.3428
 epoch: 39, train_loss: 1.2087, test_loss: 1.1763, test_f1: 0.3510
 epoch: 40, train_loss: 1.2084, test_loss: 1.1734, test_f1: 0.3541
 epoch: 41, train_loss: 1.2084, test_loss: 1.1702, test_f1: 0.3564
 epoch: 42, train_loss: 1.2025, test_loss: 1.1686, test_f1: 0.3669
 epoch: 43, train_loss: 1.2060, test_loss: 1.1683, test_f1: 0.3616
 epoch: 44, train_loss: 1.2052, test_loss: 1.1642, test_f1: 0.3633
 epoch: 45, train_loss: 1.2107, test_loss: 1.1628, test_f1: 0.3650
 epoch: 46, train_loss: 1.1964, test_loss: 1.1608, test_f1: 0.3659
 epoch: 47, train_loss: 1.1984, test_loss: 1.1574, test_f1: 0.3921
 epoch: 48, train_loss: 1.2049, test_loss: 1.1589, test_f1: 0.3666
 epoch: 49, train_loss: 1.1941, test_loss: 1.1575, test_f1: 0.3882
 epoch: 50, train_loss: 1.1944, test_loss: 1.1566, test_f1: 0.3885
 epoch: 51, train_loss: 1.1949, test_loss: 1.1560, test_f1: 0.4014
 epoch: 52, train_loss: 1.1914, test_loss: 1.1570, test_f1: 0.3995
 epoch: 53, train_loss: 1.1910, test_loss: 1.1507, test_f1: 0.4011
 epoch: 54, train_loss: 1.1957, test_loss: 1.1516, test_f1: 0.3946
 epoch: 55, train_loss: 1.1915, test_loss: 1.1534, test_f1: 0.3944
 epoch: 56, train_loss: 1.1925, test_loss: 1.1525, test_f1: 0.4014
 epoch: 57, train_loss: 1.1861, test_loss: 1.1536, test_f1: 0.3972
 epoch: 58, train_loss: 1.1902, test_loss: 1.1530, test_f1: 0.3957
 epoch: 59, train_loss: 1.1899, test_loss: 1.1510, test_f1: 0.4017
 epoch: 60, train_loss: 1.1931, test_loss: 1.1522, test_f1: 0.3979
 epoch: 61, train_loss: 1.1849, test_loss: 1.1472, test_f1: 0.4070
 epoch: 62, train_loss: 1.1873, test_loss: 1.1453, test_f1: 0.4050
 epoch: 63, train_loss: 1.1871, test_loss: 1.1460, test_f1: 0.3986
 epoch: 64, train_loss: 1.1819, test_loss: 1.1464, test_f1: 0.4017
 epoch: 65, train_loss: 1.1783, test_loss: 1.1507, test_f1: 0.4043
 epoch: 66, train_loss: 1.1789, test_loss: 1.1462, test_f1: 0.4018
 epoch: 67, train_loss: 1.1852, test_loss: 1.1442, test_f1: 0.4029
 epoch: 68, train_loss: 1.1841, test_loss: 1.1439, test_f1: 0.4036
 epoch: 69, train_loss: 1.1810, test_loss: 1.1448, test_f1: 0.4016
 epoch: 70, train_loss: 1.1815, test_loss: 1.1436, test_f1: 0.4029
 epoch: 71, train_loss: 1.1782, test_loss: 1.1432, test_f1: 0.4051
 epoch: 72, train_loss: 1.1787, test_loss: 1.1406, test_f1: 0.4102
 epoch: 73, train_loss: 1.1825, test_loss: 1.1414, test_f1: 0.3948
 epoch: 74, train_loss: 1.1773, test_loss: 1.1430, test_f1: 0.3989
 epoch: 75, train_loss: 1.1740, test_loss: 1.1397, test_f1: 0.4002
 epoch: 76, train_loss: 1.1795, test_loss: 1.1425, test_f1: 0.4127
 epoch: 77, train_loss: 1.1759, test_loss: 1.1402, test_f1: 0.4054
 epoch: 78, train_loss: 1.1770, test_loss: 1.1386, test_f1: 0.4040
 epoch: 79, train_loss: 1.1794, test_loss: 1.1371, test_f1: 0.4094
 epoch: 80, train_loss: 1.1729, test_loss: 1.1366, test_f1: 0.4107
 epoch: 81, train_loss: 1.1722, test_loss: 1.1364, test_f1: 0.4044
 epoch: 82, train_loss: 1.1732, test_loss: 1.1365, test_f1: 0.4011
 epoch: 83, train_loss: 1.1638, test_loss: 1.1356, test_f1: 0.4000
 epoch: 84, train_loss: 1.1665, test_loss: 1.1345, test_f1: 0.4022
 epoch: 85, train_loss: 1.1710, test_loss: 1.1313, test_f1: 0.4053
 epoch: 86, train_loss: 1.1637, test_loss: 1.1297, test_f1: 0.4120
 epoch: 87, train_loss: 1.1662, test_loss: 1.1335, test_f1: 0.4106
 epoch: 88, train_loss: 1.1675, test_loss: 1.1285, test_f1: 0.4125
 epoch: 89, train_loss: 1.1700, test_loss: 1.1273, test_f1: 0.4100
 epoch: 90, train_loss: 1.1639, test_loss: 1.1309, test_f1: 0.4077
 epoch: 91, train_loss: 1.1691, test_loss: 1.1278, test_f1: 0.4071
 epoch: 92, train_loss: 1.1664, test_loss: 1.1284, test_f1: 0.4110
 epoch: 93, train_loss: 1.1590, test_loss: 1.1240, test_f1: 0.4138
 epoch: 94, train_loss: 1.1687, test_loss: 1.1246, test_f1: 0.4154
 epoch: 95, train_loss: 1.1686, test_loss: 1.1230, test_f1: 0.4159
 epoch: 96, train_loss: 1.1594, test_loss: 1.1260, test_f1: 0.4132
 epoch: 97, train_loss: 1.1659, test_loss: 1.1277, test_f1: 0.4175
 epoch: 98, train_loss: 1.1607, test_loss: 1.1225, test_f1: 0.4173
 epoch: 99, train_loss: 1.1622, test_loss: 1.1240, test_f1: 0.4172
##################ITERATION #6 ****************************************
 epoch: 0, train_loss: 1.3343, test_loss: 1.3441, test_f1: 0.2562
 epoch: 1, train_loss: 1.3124, test_loss: 1.3215, test_f1: 0.2635
 epoch: 2, train_loss: 1.3069, test_loss: 1.3069, test_f1: 0.2747
 epoch: 3, train_loss: 1.2964, test_loss: 1.2925, test_f1: 0.2727
 epoch: 4, train_loss: 1.2822, test_loss: 1.2754, test_f1: 0.2783
 epoch: 5, train_loss: 1.2791, test_loss: 1.2703, test_f1: 0.2907
 epoch: 6, train_loss: 1.2734, test_loss: 1.2628, test_f1: 0.2803
 epoch: 7, train_loss: 1.2754, test_loss: 1.2537, test_f1: 0.2983
 epoch: 8, train_loss: 1.2657, test_loss: 1.2504, test_f1: 0.3021
 epoch: 9, train_loss: 1.2628, test_loss: 1.2460, test_f1: 0.3093
 epoch: 10, train_loss: 1.2627, test_loss: 1.2375, test_f1: 0.3075
 epoch: 11, train_loss: 1.2615, test_loss: 1.2356, test_f1: 0.3103
 epoch: 12, train_loss: 1.2520, test_loss: 1.2320, test_f1: 0.3147
 epoch: 13, train_loss: 1.2550, test_loss: 1.2303, test_f1: 0.3131
 epoch: 14, train_loss: 1.2469, test_loss: 1.2288, test_f1: 0.3148
 epoch: 15, train_loss: 1.2492, test_loss: 1.2221, test_f1: 0.3156
 epoch: 16, train_loss: 1.2454, test_loss: 1.2208, test_f1: 0.3194
 epoch: 17, train_loss: 1.2441, test_loss: 1.2177, test_f1: 0.3276
 epoch: 18, train_loss: 1.2429, test_loss: 1.2143, test_f1: 0.3327
 epoch: 19, train_loss: 1.2311, test_loss: 1.2129, test_f1: 0.3346
 epoch: 20, train_loss: 1.2346, test_loss: 1.2073, test_f1: 0.3251
 epoch: 21, train_loss: 1.2282, test_loss: 1.2087, test_f1: 0.3416
 epoch: 22, train_loss: 1.2376, test_loss: 1.2086, test_f1: 0.3383
 epoch: 23, train_loss: 1.2308, test_loss: 1.2097, test_f1: 0.3292
 epoch: 24, train_loss: 1.2301, test_loss: 1.2051, test_f1: 0.3483
 epoch: 25, train_loss: 1.2293, test_loss: 1.2022, test_f1: 0.3440
 epoch: 26, train_loss: 1.2238, test_loss: 1.1992, test_f1: 0.3477
 epoch: 27, train_loss: 1.2216, test_loss: 1.1999, test_f1: 0.3475
 epoch: 28, train_loss: 1.2141, test_loss: 1.1979, test_f1: 0.3544
 epoch: 29, train_loss: 1.2215, test_loss: 1.1933, test_f1: 0.3507
 epoch: 30, train_loss: 1.2169, test_loss: 1.1881, test_f1: 0.3667
 epoch: 31, train_loss: 1.2183, test_loss: 1.1889, test_f1: 0.3518
 epoch: 32, train_loss: 1.2212, test_loss: 1.1867, test_f1: 0.3616
 epoch: 33, train_loss: 1.2085, test_loss: 1.1818, test_f1: 0.3724
 epoch: 34, train_loss: 1.2085, test_loss: 1.1831, test_f1: 0.3710
 epoch: 35, train_loss: 1.2064, test_loss: 1.1789, test_f1: 0.3772
 epoch: 36, train_loss: 1.2073, test_loss: 1.1796, test_f1: 0.3767
 epoch: 37, train_loss: 1.2063, test_loss: 1.1749, test_f1: 0.3742
 epoch: 38, train_loss: 1.2074, test_loss: 1.1755, test_f1: 0.3734
 epoch: 39, train_loss: 1.2054, test_loss: 1.1761, test_f1: 0.3656
 epoch: 40, train_loss: 1.1988, test_loss: 1.1731, test_f1: 0.3805
 epoch: 41, train_loss: 1.1994, test_loss: 1.1689, test_f1: 0.3682
 epoch: 42, train_loss: 1.2032, test_loss: 1.1696, test_f1: 0.3741
 epoch: 43, train_loss: 1.1961, test_loss: 1.1640, test_f1: 0.3959
 epoch: 44, train_loss: 1.1928, test_loss: 1.1624, test_f1: 0.3761
 epoch: 45, train_loss: 1.1947, test_loss: 1.1616, test_f1: 0.3885
 epoch: 46, train_loss: 1.1915, test_loss: 1.1615, test_f1: 0.3799
 epoch: 47, train_loss: 1.1921, test_loss: 1.1612, test_f1: 0.3752
 epoch: 48, train_loss: 1.1926, test_loss: 1.1590, test_f1: 0.3799
 epoch: 49, train_loss: 1.1911, test_loss: 1.1562, test_f1: 0.3928
 epoch: 50, train_loss: 1.1877, test_loss: 1.1562, test_f1: 0.3957
 epoch: 51, train_loss: 1.1831, test_loss: 1.1528, test_f1: 0.3981
 epoch: 52, train_loss: 1.1915, test_loss: 1.1533, test_f1: 0.3960
 epoch: 53, train_loss: 1.1830, test_loss: 1.1523, test_f1: 0.3877
 epoch: 54, train_loss: 1.1846, test_loss: 1.1511, test_f1: 0.3952
 epoch: 55, train_loss: 1.1790, test_loss: 1.1478, test_f1: 0.3935
 epoch: 56, train_loss: 1.1773, test_loss: 1.1480, test_f1: 0.3885
 epoch: 57, train_loss: 1.1855, test_loss: 1.1500, test_f1: 0.4023
 epoch: 58, train_loss: 1.1837, test_loss: 1.1473, test_f1: 0.4018
 epoch: 59, train_loss: 1.1796, test_loss: 1.1475, test_f1: 0.3942
 epoch: 60, train_loss: 1.1815, test_loss: 1.1471, test_f1: 0.3991
 epoch: 61, train_loss: 1.1741, test_loss: 1.1440, test_f1: 0.3901
 epoch: 62, train_loss: 1.1769, test_loss: 1.1438, test_f1: 0.3839
 epoch: 63, train_loss: 1.1812, test_loss: 1.1450, test_f1: 0.3912
 epoch: 64, train_loss: 1.1743, test_loss: 1.1440, test_f1: 0.4019
 epoch: 65, train_loss: 1.1716, test_loss: 1.1458, test_f1: 0.3932
 epoch: 66, train_loss: 1.1702, test_loss: 1.1435, test_f1: 0.3997
 epoch: 67, train_loss: 1.1690, test_loss: 1.1439, test_f1: 0.3875
 epoch: 68, train_loss: 1.1733, test_loss: 1.1441, test_f1: 0.3919
 epoch: 69, train_loss: 1.1737, test_loss: 1.1411, test_f1: 0.3896
 epoch: 70, train_loss: 1.1629, test_loss: 1.1431, test_f1: 0.3899
 epoch: 71, train_loss: 1.1717, test_loss: 1.1412, test_f1: 0.3871
 epoch: 72, train_loss: 1.1721, test_loss: 1.1386, test_f1: 0.4041
 epoch: 73, train_loss: 1.1636, test_loss: 1.1378, test_f1: 0.4018
 epoch: 74, train_loss: 1.1633, test_loss: 1.1377, test_f1: 0.4111
 epoch: 75, train_loss: 1.1634, test_loss: 1.1397, test_f1: 0.3942
 epoch: 76, train_loss: 1.1723, test_loss: 1.1371, test_f1: 0.3887
 epoch: 77, train_loss: 1.1645, test_loss: 1.1374, test_f1: 0.4011
 epoch: 78, train_loss: 1.1697, test_loss: 1.1384, test_f1: 0.3995
 epoch: 79, train_loss: 1.1633, test_loss: 1.1382, test_f1: 0.3919
 epoch: 80, train_loss: 1.1702, test_loss: 1.1348, test_f1: 0.3977
 epoch: 81, train_loss: 1.1645, test_loss: 1.1344, test_f1: 0.4001
 epoch: 82, train_loss: 1.1576, test_loss: 1.1367, test_f1: 0.3945
 epoch: 83, train_loss: 1.1657, test_loss: 1.1309, test_f1: 0.3980
 epoch: 84, train_loss: 1.1567, test_loss: 1.1340, test_f1: 0.3904
 epoch: 85, train_loss: 1.1576, test_loss: 1.1328, test_f1: 0.3913
 epoch: 86, train_loss: 1.1603, test_loss: 1.1337, test_f1: 0.3929
 epoch: 87, train_loss: 1.1639, test_loss: 1.1310, test_f1: 0.3966
 epoch: 88, train_loss: 1.1604, test_loss: 1.1324, test_f1: 0.4032
 epoch: 89, train_loss: 1.1520, test_loss: 1.1288, test_f1: 0.4081
 epoch: 90, train_loss: 1.1451, test_loss: 1.1305, test_f1: 0.4060
 epoch: 91, train_loss: 1.1569, test_loss: 1.1291, test_f1: 0.4094
 epoch: 92, train_loss: 1.1556, test_loss: 1.1306, test_f1: 0.4128
 epoch: 93, train_loss: 1.1527, test_loss: 1.1262, test_f1: 0.4071
 epoch: 94, train_loss: 1.1582, test_loss: 1.1272, test_f1: 0.4019
 epoch: 95, train_loss: 1.1541, test_loss: 1.1264, test_f1: 0.4005
 epoch: 96, train_loss: 1.1522, test_loss: 1.1249, test_f1: 0.4112
 epoch: 97, train_loss: 1.1507, test_loss: 1.1242, test_f1: 0.4084
 epoch: 98, train_loss: 1.1471, test_loss: 1.1262, test_f1: 0.4122
 epoch: 99, train_loss: 1.1508, test_loss: 1.1241, test_f1: 0.4118
##################ITERATION #7 ****************************************
 epoch: 0, train_loss: 1.3399, test_loss: 1.3272, test_f1: 0.2274
 epoch: 1, train_loss: 1.3171, test_loss: 1.3247, test_f1: 0.2274
 epoch: 2, train_loss: 1.3104, test_loss: 1.3118, test_f1: 0.2274
 epoch: 3, train_loss: 1.3011, test_loss: 1.3043, test_f1: 0.2274
 epoch: 4, train_loss: 1.2930, test_loss: 1.2938, test_f1: 0.2274
 epoch: 5, train_loss: 1.2865, test_loss: 1.2910, test_f1: 0.2274
 epoch: 6, train_loss: 1.2816, test_loss: 1.2823, test_f1: 0.2274
 epoch: 7, train_loss: 1.2694, test_loss: 1.2699, test_f1: 0.2274
 epoch: 8, train_loss: 1.2704, test_loss: 1.2690, test_f1: 0.2274
 epoch: 9, train_loss: 1.2635, test_loss: 1.2663, test_f1: 0.2274
 epoch: 10, train_loss: 1.2628, test_loss: 1.2550, test_f1: 0.2274
 epoch: 11, train_loss: 1.2559, test_loss: 1.2519, test_f1: 0.2274
 epoch: 12, train_loss: 1.2541, test_loss: 1.2467, test_f1: 0.2274
 epoch: 13, train_loss: 1.2559, test_loss: 1.2417, test_f1: 0.2271
 epoch: 14, train_loss: 1.2496, test_loss: 1.2403, test_f1: 0.2303
 epoch: 15, train_loss: 1.2486, test_loss: 1.2370, test_f1: 0.2417
 epoch: 16, train_loss: 1.2472, test_loss: 1.2317, test_f1: 0.2298
 epoch: 17, train_loss: 1.2470, test_loss: 1.2292, test_f1: 0.2582
 epoch: 18, train_loss: 1.2490, test_loss: 1.2267, test_f1: 0.2443
 epoch: 19, train_loss: 1.2439, test_loss: 1.2266, test_f1: 0.2443
 epoch: 20, train_loss: 1.2351, test_loss: 1.2192, test_f1: 0.2611
 epoch: 21, train_loss: 1.2446, test_loss: 1.2198, test_f1: 0.2631
 epoch: 22, train_loss: 1.2338, test_loss: 1.2145, test_f1: 0.2610
 epoch: 23, train_loss: 1.2332, test_loss: 1.2122, test_f1: 0.2609
 epoch: 24, train_loss: 1.2341, test_loss: 1.2130, test_f1: 0.2705
 epoch: 25, train_loss: 1.2283, test_loss: 1.2051, test_f1: 0.2818
 epoch: 26, train_loss: 1.2321, test_loss: 1.2044, test_f1: 0.2751
 epoch: 27, train_loss: 1.2275, test_loss: 1.2025, test_f1: 0.2861
 epoch: 28, train_loss: 1.2269, test_loss: 1.1970, test_f1: 0.2951
 epoch: 29, train_loss: 1.2240, test_loss: 1.1991, test_f1: 0.3126
 epoch: 30, train_loss: 1.2192, test_loss: 1.1945, test_f1: 0.3104
 epoch: 31, train_loss: 1.2174, test_loss: 1.1901, test_f1: 0.3244
 epoch: 32, train_loss: 1.2199, test_loss: 1.1924, test_f1: 0.3266
 epoch: 33, train_loss: 1.2177, test_loss: 1.1883, test_f1: 0.3266
 epoch: 34, train_loss: 1.2182, test_loss: 1.1896, test_f1: 0.3430
 epoch: 35, train_loss: 1.2132, test_loss: 1.1831, test_f1: 0.3333
 epoch: 36, train_loss: 1.2153, test_loss: 1.1837, test_f1: 0.3447
 epoch: 37, train_loss: 1.2066, test_loss: 1.1814, test_f1: 0.3511
 epoch: 38, train_loss: 1.2128, test_loss: 1.1817, test_f1: 0.3403
 epoch: 39, train_loss: 1.2034, test_loss: 1.1816, test_f1: 0.3547
 epoch: 40, train_loss: 1.2098, test_loss: 1.1756, test_f1: 0.3465
 epoch: 41, train_loss: 1.2050, test_loss: 1.1769, test_f1: 0.3579
 epoch: 42, train_loss: 1.2032, test_loss: 1.1735, test_f1: 0.3598
 epoch: 43, train_loss: 1.2081, test_loss: 1.1739, test_f1: 0.3611
 epoch: 44, train_loss: 1.1969, test_loss: 1.1720, test_f1: 0.3659
 epoch: 45, train_loss: 1.2010, test_loss: 1.1715, test_f1: 0.3759
 epoch: 46, train_loss: 1.1981, test_loss: 1.1684, test_f1: 0.3770
 epoch: 47, train_loss: 1.1983, test_loss: 1.1673, test_f1: 0.3791
 epoch: 48, train_loss: 1.1938, test_loss: 1.1624, test_f1: 0.3753
 epoch: 49, train_loss: 1.1877, test_loss: 1.1630, test_f1: 0.3912
 epoch: 50, train_loss: 1.1934, test_loss: 1.1560, test_f1: 0.3852
 epoch: 51, train_loss: 1.1917, test_loss: 1.1622, test_f1: 0.3914
 epoch: 52, train_loss: 1.1869, test_loss: 1.1587, test_f1: 0.3891
 epoch: 53, train_loss: 1.1855, test_loss: 1.1581, test_f1: 0.3871
 epoch: 54, train_loss: 1.1864, test_loss: 1.1591, test_f1: 0.3943
 epoch: 55, train_loss: 1.1788, test_loss: 1.1570, test_f1: 0.3924
 epoch: 56, train_loss: 1.1797, test_loss: 1.1553, test_f1: 0.4021
 epoch: 57, train_loss: 1.1844, test_loss: 1.1542, test_f1: 0.4000
 epoch: 58, train_loss: 1.1836, test_loss: 1.1550, test_f1: 0.3943
 epoch: 59, train_loss: 1.1906, test_loss: 1.1513, test_f1: 0.4049
 epoch: 60, train_loss: 1.1846, test_loss: 1.1560, test_f1: 0.3957
 epoch: 61, train_loss: 1.1765, test_loss: 1.1550, test_f1: 0.4005
 epoch: 62, train_loss: 1.1810, test_loss: 1.1542, test_f1: 0.3988
 epoch: 63, train_loss: 1.1805, test_loss: 1.1536, test_f1: 0.3943
 epoch: 64, train_loss: 1.1771, test_loss: 1.1508, test_f1: 0.4007
 epoch: 65, train_loss: 1.1821, test_loss: 1.1506, test_f1: 0.3997
 epoch: 66, train_loss: 1.1748, test_loss: 1.1495, test_f1: 0.3966
 epoch: 67, train_loss: 1.1766, test_loss: 1.1502, test_f1: 0.3972
 epoch: 68, train_loss: 1.1760, test_loss: 1.1498, test_f1: 0.3996
 epoch: 69, train_loss: 1.1758, test_loss: 1.1497, test_f1: 0.3994
 epoch: 70, train_loss: 1.1776, test_loss: 1.1461, test_f1: 0.4047
 epoch: 71, train_loss: 1.1704, test_loss: 1.1436, test_f1: 0.4028
 epoch: 72, train_loss: 1.1714, test_loss: 1.1425, test_f1: 0.4041
 epoch: 73, train_loss: 1.1689, test_loss: 1.1459, test_f1: 0.4018
 epoch: 74, train_loss: 1.1796, test_loss: 1.1442, test_f1: 0.4044
 epoch: 75, train_loss: 1.1683, test_loss: 1.1411, test_f1: 0.4098
 epoch: 76, train_loss: 1.1691, test_loss: 1.1430, test_f1: 0.4079
 epoch: 77, train_loss: 1.1664, test_loss: 1.1430, test_f1: 0.4131
 epoch: 78, train_loss: 1.1681, test_loss: 1.1413, test_f1: 0.4106
 epoch: 79, train_loss: 1.1722, test_loss: 1.1380, test_f1: 0.4117
 epoch: 80, train_loss: 1.1674, test_loss: 1.1428, test_f1: 0.4084
 epoch: 81, train_loss: 1.1629, test_loss: 1.1389, test_f1: 0.4138
 epoch: 82, train_loss: 1.1640, test_loss: 1.1398, test_f1: 0.4083
 epoch: 83, train_loss: 1.1682, test_loss: 1.1400, test_f1: 0.4116
 epoch: 84, train_loss: 1.1657, test_loss: 1.1368, test_f1: 0.4061
 epoch: 85, train_loss: 1.1691, test_loss: 1.1319, test_f1: 0.4132
 epoch: 86, train_loss: 1.1532, test_loss: 1.1333, test_f1: 0.4146
 epoch: 87, train_loss: 1.1681, test_loss: 1.1371, test_f1: 0.4084
 epoch: 88, train_loss: 1.1664, test_loss: 1.1342, test_f1: 0.4195
 epoch: 89, train_loss: 1.1695, test_loss: 1.1366, test_f1: 0.4192
 epoch: 90, train_loss: 1.1638, test_loss: 1.1343, test_f1: 0.4172
 epoch: 91, train_loss: 1.1623, test_loss: 1.1329, test_f1: 0.4175
 epoch: 92, train_loss: 1.1608, test_loss: 1.1338, test_f1: 0.4170
 epoch: 93, train_loss: 1.1566, test_loss: 1.1310, test_f1: 0.4210
 epoch: 94, train_loss: 1.1657, test_loss: 1.1321, test_f1: 0.4251
 epoch: 95, train_loss: 1.1589, test_loss: 1.1306, test_f1: 0.4220
 epoch: 96, train_loss: 1.1488, test_loss: 1.1296, test_f1: 0.4263
 epoch: 97, train_loss: 1.1488, test_loss: 1.1277, test_f1: 0.4216
 epoch: 98, train_loss: 1.1601, test_loss: 1.1293, test_f1: 0.4278
 epoch: 99, train_loss: 1.1495, test_loss: 1.1283, test_f1: 0.4222
##################ITERATION #8 ****************************************
 epoch: 0, train_loss: 1.3551, test_loss: 1.3550, test_f1: 0.2249
 epoch: 1, train_loss: 1.3302, test_loss: 1.3181, test_f1: 0.2285
 epoch: 2, train_loss: 1.3220, test_loss: 1.2983, test_f1: 0.2298
 epoch: 3, train_loss: 1.2986, test_loss: 1.2915, test_f1: 0.2260
 epoch: 4, train_loss: 1.2948, test_loss: 1.2811, test_f1: 0.2290
 epoch: 5, train_loss: 1.2888, test_loss: 1.2734, test_f1: 0.2341
 epoch: 6, train_loss: 1.2778, test_loss: 1.2612, test_f1: 0.2509
 epoch: 7, train_loss: 1.2767, test_loss: 1.2579, test_f1: 0.2616
 epoch: 8, train_loss: 1.2675, test_loss: 1.2550, test_f1: 0.2381
 epoch: 9, train_loss: 1.2669, test_loss: 1.2494, test_f1: 0.2699
 epoch: 10, train_loss: 1.2616, test_loss: 1.2515, test_f1: 0.2745
 epoch: 11, train_loss: 1.2518, test_loss: 1.2455, test_f1: 0.2540
 epoch: 12, train_loss: 1.2579, test_loss: 1.2407, test_f1: 0.2721
 epoch: 13, train_loss: 1.2508, test_loss: 1.2363, test_f1: 0.2737
 epoch: 14, train_loss: 1.2500, test_loss: 1.2335, test_f1: 0.2769
 epoch: 15, train_loss: 1.2434, test_loss: 1.2259, test_f1: 0.2817
 epoch: 16, train_loss: 1.2401, test_loss: 1.2231, test_f1: 0.2764
 epoch: 17, train_loss: 1.2413, test_loss: 1.2177, test_f1: 0.2941
 epoch: 18, train_loss: 1.2392, test_loss: 1.2170, test_f1: 0.2938
 epoch: 19, train_loss: 1.2412, test_loss: 1.2170, test_f1: 0.2771
 epoch: 20, train_loss: 1.2304, test_loss: 1.2176, test_f1: 0.2863
 epoch: 21, train_loss: 1.2384, test_loss: 1.2182, test_f1: 0.3018
 epoch: 22, train_loss: 1.2382, test_loss: 1.2122, test_f1: 0.3169
 epoch: 23, train_loss: 1.2333, test_loss: 1.2068, test_f1: 0.3246
 epoch: 24, train_loss: 1.2247, test_loss: 1.2053, test_f1: 0.3208
 epoch: 25, train_loss: 1.2255, test_loss: 1.2023, test_f1: 0.3262
 epoch: 26, train_loss: 1.2221, test_loss: 1.1983, test_f1: 0.3404
 epoch: 27, train_loss: 1.2273, test_loss: 1.2023, test_f1: 0.3177
 epoch: 28, train_loss: 1.2213, test_loss: 1.1969, test_f1: 0.3390
 epoch: 29, train_loss: 1.2237, test_loss: 1.1967, test_f1: 0.3441
 epoch: 30, train_loss: 1.2201, test_loss: 1.1955, test_f1: 0.3329
 epoch: 31, train_loss: 1.2166, test_loss: 1.1929, test_f1: 0.3412
 epoch: 32, train_loss: 1.2120, test_loss: 1.1889, test_f1: 0.3516
 epoch: 33, train_loss: 1.2171, test_loss: 1.1886, test_f1: 0.3517
 epoch: 34, train_loss: 1.2141, test_loss: 1.1878, test_f1: 0.3497
 epoch: 35, train_loss: 1.2108, test_loss: 1.1856, test_f1: 0.3581
 epoch: 36, train_loss: 1.2092, test_loss: 1.1806, test_f1: 0.3567
 epoch: 37, train_loss: 1.2081, test_loss: 1.1810, test_f1: 0.3652
 epoch: 38, train_loss: 1.2056, test_loss: 1.1831, test_f1: 0.3648
 epoch: 39, train_loss: 1.1996, test_loss: 1.1777, test_f1: 0.3725
 epoch: 40, train_loss: 1.2053, test_loss: 1.1782, test_f1: 0.3683
 epoch: 41, train_loss: 1.2019, test_loss: 1.1751, test_f1: 0.3724
 epoch: 42, train_loss: 1.2030, test_loss: 1.1732, test_f1: 0.3718
 epoch: 43, train_loss: 1.2030, test_loss: 1.1716, test_f1: 0.3777
 epoch: 44, train_loss: 1.2047, test_loss: 1.1672, test_f1: 0.3746
 epoch: 45, train_loss: 1.1995, test_loss: 1.1673, test_f1: 0.3815
 epoch: 46, train_loss: 1.1943, test_loss: 1.1667, test_f1: 0.3832
 epoch: 47, train_loss: 1.2003, test_loss: 1.1665, test_f1: 0.3782
 epoch: 48, train_loss: 1.1911, test_loss: 1.1646, test_f1: 0.3818
 epoch: 49, train_loss: 1.1930, test_loss: 1.1617, test_f1: 0.3834
 epoch: 50, train_loss: 1.1886, test_loss: 1.1605, test_f1: 0.3786
 epoch: 51, train_loss: 1.1838, test_loss: 1.1603, test_f1: 0.3759
 epoch: 52, train_loss: 1.1875, test_loss: 1.1592, test_f1: 0.3781
 epoch: 53, train_loss: 1.1857, test_loss: 1.1595, test_f1: 0.3824
 epoch: 54, train_loss: 1.1856, test_loss: 1.1585, test_f1: 0.3824
 epoch: 55, train_loss: 1.1867, test_loss: 1.1591, test_f1: 0.3803
 epoch: 56, train_loss: 1.1885, test_loss: 1.1570, test_f1: 0.3824
 epoch: 57, train_loss: 1.1836, test_loss: 1.1574, test_f1: 0.3771
 epoch: 58, train_loss: 1.1809, test_loss: 1.1554, test_f1: 0.3829
 epoch: 59, train_loss: 1.1879, test_loss: 1.1562, test_f1: 0.3877
 epoch: 60, train_loss: 1.1839, test_loss: 1.1539, test_f1: 0.3821
 epoch: 61, train_loss: 1.1898, test_loss: 1.1509, test_f1: 0.3801
 epoch: 62, train_loss: 1.1873, test_loss: 1.1547, test_f1: 0.3822
 epoch: 63, train_loss: 1.1807, test_loss: 1.1524, test_f1: 0.3792
 epoch: 64, train_loss: 1.1780, test_loss: 1.1523, test_f1: 0.3797
 epoch: 65, train_loss: 1.1785, test_loss: 1.1509, test_f1: 0.3861
 epoch: 66, train_loss: 1.1648, test_loss: 1.1513, test_f1: 0.3823
 epoch: 67, train_loss: 1.1838, test_loss: 1.1491, test_f1: 0.3789
 epoch: 68, train_loss: 1.1722, test_loss: 1.1509, test_f1: 0.3854
 epoch: 69, train_loss: 1.1720, test_loss: 1.1469, test_f1: 0.3972
 epoch: 70, train_loss: 1.1710, test_loss: 1.1496, test_f1: 0.3808
 epoch: 71, train_loss: 1.1744, test_loss: 1.1475, test_f1: 0.3896
 epoch: 72, train_loss: 1.1782, test_loss: 1.1456, test_f1: 0.3922
 epoch: 73, train_loss: 1.1776, test_loss: 1.1470, test_f1: 0.3811
 epoch: 74, train_loss: 1.1709, test_loss: 1.1469, test_f1: 0.3886
 epoch: 75, train_loss: 1.1754, test_loss: 1.1447, test_f1: 0.3850
 epoch: 76, train_loss: 1.1768, test_loss: 1.1458, test_f1: 0.3880
 epoch: 77, train_loss: 1.1740, test_loss: 1.1431, test_f1: 0.3806
 epoch: 78, train_loss: 1.1691, test_loss: 1.1428, test_f1: 0.3838
 epoch: 79, train_loss: 1.1632, test_loss: 1.1417, test_f1: 0.3860
 epoch: 80, train_loss: 1.1641, test_loss: 1.1409, test_f1: 0.3872
 epoch: 81, train_loss: 1.1688, test_loss: 1.1397, test_f1: 0.3906
 epoch: 82, train_loss: 1.1687, test_loss: 1.1414, test_f1: 0.3919
 epoch: 83, train_loss: 1.1706, test_loss: 1.1381, test_f1: 0.3918
 epoch: 84, train_loss: 1.1648, test_loss: 1.1378, test_f1: 0.3886
 epoch: 85, train_loss: 1.1652, test_loss: 1.1378, test_f1: 0.3938
 epoch: 86, train_loss: 1.1655, test_loss: 1.1385, test_f1: 0.3860
 epoch: 87, train_loss: 1.1634, test_loss: 1.1376, test_f1: 0.3833
 epoch: 88, train_loss: 1.1652, test_loss: 1.1377, test_f1: 0.3898
 epoch: 89, train_loss: 1.1591, test_loss: 1.1378, test_f1: 0.3878
 epoch: 90, train_loss: 1.1634, test_loss: 1.1416, test_f1: 0.3866
 epoch: 91, train_loss: 1.1510, test_loss: 1.1351, test_f1: 0.3915
 epoch: 92, train_loss: 1.1542, test_loss: 1.1323, test_f1: 0.3989
 epoch: 93, train_loss: 1.1611, test_loss: 1.1336, test_f1: 0.3881
 epoch: 94, train_loss: 1.1578, test_loss: 1.1345, test_f1: 0.3969
 epoch: 95, train_loss: 1.1631, test_loss: 1.1286, test_f1: 0.4005
 epoch: 96, train_loss: 1.1551, test_loss: 1.1292, test_f1: 0.3964
 epoch: 97, train_loss: 1.1551, test_loss: 1.1327, test_f1: 0.3991
 epoch: 98, train_loss: 1.1667, test_loss: 1.1311, test_f1: 0.3939
 epoch: 99, train_loss: 1.1636, test_loss: 1.1295, test_f1: 0.3956
##################ITERATION #9 ****************************************
 epoch: 0, train_loss: 1.3308, test_loss: 1.3114, test_f1: 0.2274
 epoch: 1, train_loss: 1.3143, test_loss: 1.3050, test_f1: 0.2274
 epoch: 2, train_loss: 1.3075, test_loss: 1.2992, test_f1: 0.2274
 epoch: 3, train_loss: 1.3020, test_loss: 1.2974, test_f1: 0.2274
 epoch: 4, train_loss: 1.2972, test_loss: 1.2950, test_f1: 0.2274
 epoch: 5, train_loss: 1.2928, test_loss: 1.2882, test_f1: 0.2274
 epoch: 6, train_loss: 1.2877, test_loss: 1.2877, test_f1: 0.2274
 epoch: 7, train_loss: 1.2829, test_loss: 1.2837, test_f1: 0.2274
 epoch: 8, train_loss: 1.2775, test_loss: 1.2802, test_f1: 0.2274
 epoch: 9, train_loss: 1.2717, test_loss: 1.2785, test_f1: 0.2300
 epoch: 10, train_loss: 1.2737, test_loss: 1.2703, test_f1: 0.2337
 epoch: 11, train_loss: 1.2689, test_loss: 1.2610, test_f1: 0.2325
 epoch: 12, train_loss: 1.2654, test_loss: 1.2582, test_f1: 0.2350
 epoch: 13, train_loss: 1.2643, test_loss: 1.2562, test_f1: 0.2402
 epoch: 14, train_loss: 1.2549, test_loss: 1.2553, test_f1: 0.2364
 epoch: 15, train_loss: 1.2614, test_loss: 1.2472, test_f1: 0.2373
 epoch: 16, train_loss: 1.2613, test_loss: 1.2468, test_f1: 0.2442
 epoch: 17, train_loss: 1.2506, test_loss: 1.2429, test_f1: 0.2347
 epoch: 18, train_loss: 1.2520, test_loss: 1.2414, test_f1: 0.2580
 epoch: 19, train_loss: 1.2498, test_loss: 1.2363, test_f1: 0.2435
 epoch: 20, train_loss: 1.2496, test_loss: 1.2337, test_f1: 0.2504
 epoch: 21, train_loss: 1.2427, test_loss: 1.2390, test_f1: 0.2552
 epoch: 22, train_loss: 1.2401, test_loss: 1.2296, test_f1: 0.2689
 epoch: 23, train_loss: 1.2412, test_loss: 1.2262, test_f1: 0.2679
 epoch: 24, train_loss: 1.2438, test_loss: 1.2251, test_f1: 0.2843
 epoch: 25, train_loss: 1.2370, test_loss: 1.2298, test_f1: 0.2640
 epoch: 26, train_loss: 1.2423, test_loss: 1.2244, test_f1: 0.2923
 epoch: 27, train_loss: 1.2370, test_loss: 1.2234, test_f1: 0.2839
 epoch: 28, train_loss: 1.2337, test_loss: 1.2175, test_f1: 0.3000
 epoch: 29, train_loss: 1.2351, test_loss: 1.2130, test_f1: 0.3188
 epoch: 30, train_loss: 1.2250, test_loss: 1.2121, test_f1: 0.3085
 epoch: 31, train_loss: 1.2287, test_loss: 1.2125, test_f1: 0.3063
 epoch: 32, train_loss: 1.2289, test_loss: 1.2112, test_f1: 0.3026
 epoch: 33, train_loss: 1.2286, test_loss: 1.2032, test_f1: 0.3286
 epoch: 34, train_loss: 1.2237, test_loss: 1.2028, test_f1: 0.3199
 epoch: 35, train_loss: 1.2326, test_loss: 1.2043, test_f1: 0.3228
 epoch: 36, train_loss: 1.2209, test_loss: 1.2003, test_f1: 0.3145
 epoch: 37, train_loss: 1.2225, test_loss: 1.2013, test_f1: 0.3363
 epoch: 38, train_loss: 1.2190, test_loss: 1.2012, test_f1: 0.3463
 epoch: 39, train_loss: 1.2190, test_loss: 1.2001, test_f1: 0.3567
 epoch: 40, train_loss: 1.2243, test_loss: 1.1947, test_f1: 0.3418
 epoch: 41, train_loss: 1.2177, test_loss: 1.1933, test_f1: 0.3375
 epoch: 42, train_loss: 1.2170, test_loss: 1.1937, test_f1: 0.3524
 epoch: 43, train_loss: 1.2079, test_loss: 1.1904, test_f1: 0.3614
 epoch: 44, train_loss: 1.2173, test_loss: 1.1862, test_f1: 0.3516
 epoch: 45, train_loss: 1.2058, test_loss: 1.1909, test_f1: 0.3612
 epoch: 46, train_loss: 1.2086, test_loss: 1.1872, test_f1: 0.3727
 epoch: 47, train_loss: 1.2114, test_loss: 1.1875, test_f1: 0.3585
 epoch: 48, train_loss: 1.2092, test_loss: 1.1861, test_f1: 0.3735
 epoch: 49, train_loss: 1.2008, test_loss: 1.1832, test_f1: 0.3745
 epoch: 50, train_loss: 1.2113, test_loss: 1.1816, test_f1: 0.3771
 epoch: 51, train_loss: 1.2047, test_loss: 1.1809, test_f1: 0.3731
 epoch: 52, train_loss: 1.2072, test_loss: 1.1800, test_f1: 0.3744
 epoch: 53, train_loss: 1.2082, test_loss: 1.1815, test_f1: 0.3709
 epoch: 54, train_loss: 1.1997, test_loss: 1.1779, test_f1: 0.3748
 epoch: 55, train_loss: 1.2020, test_loss: 1.1777, test_f1: 0.3806
 epoch: 56, train_loss: 1.2094, test_loss: 1.1792, test_f1: 0.3781
 epoch: 57, train_loss: 1.1942, test_loss: 1.1790, test_f1: 0.3751
 epoch: 58, train_loss: 1.1997, test_loss: 1.1764, test_f1: 0.3759
 epoch: 59, train_loss: 1.2037, test_loss: 1.1771, test_f1: 0.3690
 epoch: 60, train_loss: 1.2069, test_loss: 1.1755, test_f1: 0.3843
 epoch: 61, train_loss: 1.2038, test_loss: 1.1758, test_f1: 0.3760
 epoch: 62, train_loss: 1.1975, test_loss: 1.1777, test_f1: 0.3775
 epoch: 63, train_loss: 1.1970, test_loss: 1.1763, test_f1: 0.3761
 epoch: 64, train_loss: 1.2021, test_loss: 1.1736, test_f1: 0.3830
 epoch: 65, train_loss: 1.1994, test_loss: 1.1734, test_f1: 0.3745
 epoch: 66, train_loss: 1.1969, test_loss: 1.1711, test_f1: 0.3885
 epoch: 67, train_loss: 1.1943, test_loss: 1.1723, test_f1: 0.3881
 epoch: 68, train_loss: 1.1963, test_loss: 1.1703, test_f1: 0.3880
 epoch: 69, train_loss: 1.1974, test_loss: 1.1696, test_f1: 0.3893
 epoch: 70, train_loss: 1.2024, test_loss: 1.1719, test_f1: 0.3876
 epoch: 71, train_loss: 1.1992, test_loss: 1.1713, test_f1: 0.3867
 epoch: 72, train_loss: 1.1960, test_loss: 1.1681, test_f1: 0.3879
 epoch: 73, train_loss: 1.1984, test_loss: 1.1700, test_f1: 0.3820
 epoch: 74, train_loss: 1.1949, test_loss: 1.1686, test_f1: 0.3827
 epoch: 75, train_loss: 1.1942, test_loss: 1.1683, test_f1: 0.3810
 epoch: 76, train_loss: 1.1964, test_loss: 1.1690, test_f1: 0.3897
 epoch: 77, train_loss: 1.1923, test_loss: 1.1666, test_f1: 0.3814
 epoch: 78, train_loss: 1.1896, test_loss: 1.1661, test_f1: 0.3880
 epoch: 79, train_loss: 1.1931, test_loss: 1.1670, test_f1: 0.3890
 epoch: 80, train_loss: 1.1966, test_loss: 1.1652, test_f1: 0.3891
 epoch: 81, train_loss: 1.1933, test_loss: 1.1639, test_f1: 0.3932
 epoch: 82, train_loss: 1.1967, test_loss: 1.1634, test_f1: 0.3924
 epoch: 83, train_loss: 1.1951, test_loss: 1.1628, test_f1: 0.3944
 epoch: 84, train_loss: 1.1945, test_loss: 1.1632, test_f1: 0.3863
 epoch: 85, train_loss: 1.1944, test_loss: 1.1649, test_f1: 0.3853
 epoch: 86, train_loss: 1.1856, test_loss: 1.1647, test_f1: 0.3741
 epoch: 87, train_loss: 1.1879, test_loss: 1.1610, test_f1: 0.3901
 epoch: 88, train_loss: 1.1930, test_loss: 1.1613, test_f1: 0.3909
 epoch: 89, train_loss: 1.1860, test_loss: 1.1612, test_f1: 0.3833
 epoch: 90, train_loss: 1.1879, test_loss: 1.1614, test_f1: 0.3802
 epoch: 91, train_loss: 1.1915, test_loss: 1.1611, test_f1: 0.3898
 epoch: 92, train_loss: 1.1833, test_loss: 1.1604, test_f1: 0.3937
 epoch: 93, train_loss: 1.1882, test_loss: 1.1593, test_f1: 0.3921
 epoch: 94, train_loss: 1.1985, test_loss: 1.1598, test_f1: 0.3812
 epoch: 95, train_loss: 1.1914, test_loss: 1.1600, test_f1: 0.3791
 epoch: 96, train_loss: 1.1846, test_loss: 1.1597, test_f1: 0.3863
 epoch: 97, train_loss: 1.1812, test_loss: 1.1583, test_f1: 0.3955
 epoch: 98, train_loss: 1.1865, test_loss: 1.1576, test_f1: 0.3849
 epoch: 99, train_loss: 1.1809, test_loss: 1.1575, test_f1: 0.3792

Training completed in 734.21 seconds
Best F1: 0.4536 at epoch 56
Mean F1 across iterations: 0.4140  0.0285
========================FINAL RESULTS================================
FEGIN weighted F1: 0.4536  0.0285
python main.py --data ltspice_examples --representation component_component --model FEGIN --layers 5 --hiddens 16 --batch_size 64 --lr 0.0001 --emb_size 128 --epochs 100 --save_appendix component_component_L5_H16_BS64_LR0.0001_E128 --no_val
-----



STDERR:
  File "main.py", line 370, in <module>
    main()
  File "main.py", line 254, in main
    dataset = dataset_class(
  File "/home/philip/projects/ltspice_examples_code_repo/Circuit-Completion-Using-GNNs/component_classification_with_link_prediction_head/evaluation/FEGIN/kernel/circuit_datasets.py", line 15, in __init__
    self.data, self.slices = torch.load(self.processed_paths[0])
  File "/home/philip/.local/lib/python3.8/site-packages/torch/serialization.py", line 1040, in load
    warnings.warn(
  File "/usr/lib/python3.8/warnings.py", line 109, in _showwarnmsg
    sw(msg.message, msg.category, msg.filename, msg.lineno,
  File "main.py", line 47, in warn_with_traceback
    traceback.print_stack(file=log)
/home/philip/projects/ltspice_examples_code_repo/Circuit-Completion-Using-GNNs/component_classification_with_link_prediction_head/evaluation/FEGIN/kernel/circuit_datasets.py:15: FutureWarning: You are using `torch.load` with `weights_only=False` (the current default value), which uses the default pickle module implicitly. It is possible to construct malicious pickle data which will execute arbitrary code during unpickling (See https://github.com/pytorch/pytorch/blob/main/SECURITY.md#untrusted-models for more details). In a future release, the default value for `weights_only` will be flipped to `True`. This limits the functions that could be executed during unpickling. Arbitrary objects will no longer be allowed to be loaded via this mode unless they are explicitly allowlisted by the user via `torch.serialization.add_safe_globals`. We recommend you start setting `weights_only=True` for any use case where you don't have full control of the loaded file. Please open an issue on GitHub for any issues related to this experimental feature.
  self.data, self.slices = torch.load(self.processed_paths[0])
