STDOUT:
Results will be saved in /home/philip/projects/ltspice_examples_code_repo/Circuit-Completion-Using-GNNs/component_classification_with_link_prediction_head/evaluation/FEGIN/results/model_FEGIN_dataset_ltspice_examples
Command line input: python main.py --data ltspice_examples --representation component_pin_net --model FEGIN --layers 6 --hiddens 128 --batch_size 128 --lr 0.01 --emb_size 250 --epochs 100 --save_appendix component_pin_net_L6_H128_BS128_LR0.01_E250 --no_val
 is saved.
-----
ltspice_examples - FEGIN
Using 6 layers, 128 hidden units, h = 2
Loading component_pin_net representation dataset
ENTERED
Training FEGIN on component_pin_net representation
Train: 3558, Test: 846
##################ITERATION #0 ****************************************
 epoch: 0, train_loss: 1.1742, test_loss: 1.1692, test_f1: 0.3526
 epoch: 1, train_loss: 1.0350, test_loss: 1.0982, test_f1: 0.4617
 epoch: 2, train_loss: 0.9904, test_loss: 1.0596, test_f1: 0.4474
 epoch: 3, train_loss: 0.9747, test_loss: 0.9685, test_f1: 0.4739
 epoch: 4, train_loss: 0.9430, test_loss: 1.0753, test_f1: 0.4819
 epoch: 5, train_loss: 0.9731, test_loss: 1.1921, test_f1: 0.3960
 epoch: 6, train_loss: 0.9379, test_loss: 0.9353, test_f1: 0.5237
 epoch: 7, train_loss: 0.9097, test_loss: 1.0557, test_f1: 0.5340
 epoch: 8, train_loss: 0.8914, test_loss: 1.0951, test_f1: 0.4930
 epoch: 9, train_loss: 0.8744, test_loss: 1.0454, test_f1: 0.5513
 epoch: 10, train_loss: 0.8680, test_loss: 1.0742, test_f1: 0.5290
 epoch: 11, train_loss: 0.8610, test_loss: 0.8563, test_f1: 0.5781
 epoch: 12, train_loss: 0.8393, test_loss: 1.0269, test_f1: 0.5254
 epoch: 13, train_loss: 0.8069, test_loss: 0.9218, test_f1: 0.5556
 epoch: 14, train_loss: 0.7766, test_loss: 1.0668, test_f1: 0.5035
 epoch: 15, train_loss: 0.7626, test_loss: 0.8667, test_f1: 0.5931
 epoch: 16, train_loss: 0.7688, test_loss: 1.0398, test_f1: 0.5781
 epoch: 17, train_loss: 0.7584, test_loss: 1.0275, test_f1: 0.5396
 epoch: 18, train_loss: 0.7521, test_loss: 0.8411, test_f1: 0.6232
 epoch: 19, train_loss: 0.7464, test_loss: 1.0290, test_f1: 0.5444
 epoch: 20, train_loss: 0.7487, test_loss: 1.1217, test_f1: 0.5655
 epoch: 21, train_loss: 0.7439, test_loss: 1.0772, test_f1: 0.6088
 epoch: 22, train_loss: 0.7111, test_loss: 1.1322, test_f1: 0.5815
 epoch: 23, train_loss: 0.7166, test_loss: 0.9363, test_f1: 0.6335
 epoch: 24, train_loss: 0.6957, test_loss: 0.8633, test_f1: 0.6101
 epoch: 25, train_loss: 0.6845, test_loss: 0.9954, test_f1: 0.5704
 epoch: 26, train_loss: 0.6818, test_loss: 1.0428, test_f1: 0.5862
 epoch: 27, train_loss: 0.6630, test_loss: 0.8917, test_f1: 0.6215
 epoch: 28, train_loss: 0.6615, test_loss: 0.8383, test_f1: 0.6260
 epoch: 29, train_loss: 0.6561, test_loss: 0.9048, test_f1: 0.5938
 epoch: 30, train_loss: 0.6516, test_loss: 0.8538, test_f1: 0.6377
 epoch: 31, train_loss: 0.6380, test_loss: 0.8019, test_f1: 0.6343
 epoch: 32, train_loss: 0.6286, test_loss: 1.1017, test_f1: 0.5522
 epoch: 33, train_loss: 0.6375, test_loss: 0.8103, test_f1: 0.6244
 epoch: 34, train_loss: 0.6279, test_loss: 1.0675, test_f1: 0.6052
 epoch: 35, train_loss: 0.6235, test_loss: 0.8192, test_f1: 0.5988
 epoch: 36, train_loss: 0.6285, test_loss: 0.8803, test_f1: 0.6283
 epoch: 37, train_loss: 0.6070, test_loss: 1.0155, test_f1: 0.6240
 epoch: 38, train_loss: 0.5963, test_loss: 1.0225, test_f1: 0.6022
 epoch: 39, train_loss: 0.6132, test_loss: 0.9088, test_f1: 0.6486
 epoch: 40, train_loss: 0.6211, test_loss: 0.9067, test_f1: 0.6630
 epoch: 41, train_loss: 0.5970, test_loss: 1.0286, test_f1: 0.6255
 epoch: 42, train_loss: 0.5732, test_loss: 1.1247, test_f1: 0.6303
 epoch: 43, train_loss: 0.5895, test_loss: 0.9668, test_f1: 0.6636
 epoch: 44, train_loss: 0.5709, test_loss: 0.9336, test_f1: 0.6595
 epoch: 45, train_loss: 0.5486, test_loss: 1.0095, test_f1: 0.6205
 epoch: 46, train_loss: 0.5895, test_loss: 1.0345, test_f1: 0.6304
 epoch: 47, train_loss: 0.5576, test_loss: 1.0230, test_f1: 0.6289
 epoch: 48, train_loss: 0.5468, test_loss: 1.0504, test_f1: 0.6338
 epoch: 49, train_loss: 0.5596, test_loss: 1.1136, test_f1: 0.5484
 epoch: 50, train_loss: 0.5200, test_loss: 1.0177, test_f1: 0.6198
 epoch: 51, train_loss: 0.4685, test_loss: 1.2369, test_f1: 0.6045
 epoch: 52, train_loss: 0.4620, test_loss: 1.1021, test_f1: 0.6523
 epoch: 53, train_loss: 0.4450, test_loss: 1.2083, test_f1: 0.6426
 epoch: 54, train_loss: 0.4522, test_loss: 1.0885, test_f1: 0.6564
 epoch: 55, train_loss: 0.4205, test_loss: 1.1563, test_f1: 0.6536
 epoch: 56, train_loss: 0.4242, test_loss: 1.0894, test_f1: 0.6787
 epoch: 57, train_loss: 0.4310, test_loss: 1.1597, test_f1: 0.6561
 epoch: 58, train_loss: 0.4249, test_loss: 1.1534, test_f1: 0.6588
 epoch: 59, train_loss: 0.4303, test_loss: 1.1810, test_f1: 0.6438
 epoch: 60, train_loss: 0.4152, test_loss: 1.1819, test_f1: 0.6513
 epoch: 61, train_loss: 0.4006, test_loss: 1.2224, test_f1: 0.6811
 epoch: 62, train_loss: 0.3958, test_loss: 1.3067, test_f1: 0.6349
 epoch: 63, train_loss: 0.4239, test_loss: 1.3713, test_f1: 0.5932
 epoch: 64, train_loss: 0.3981, test_loss: 1.1104, test_f1: 0.6189
 epoch: 65, train_loss: 0.3659, test_loss: 1.2247, test_f1: 0.6590
 epoch: 66, train_loss: 0.3897, test_loss: 1.2846, test_f1: 0.6735
 epoch: 67, train_loss: 0.3940, test_loss: 1.2064, test_f1: 0.6448
 epoch: 68, train_loss: 0.3826, test_loss: 1.2847, test_f1: 0.6774
 epoch: 69, train_loss: 0.4006, test_loss: 1.1694, test_f1: 0.6293
 epoch: 70, train_loss: 0.3735, test_loss: 1.1867, test_f1: 0.6347
 epoch: 71, train_loss: 0.3483, test_loss: 1.3795, test_f1: 0.6168
 epoch: 72, train_loss: 0.3634, test_loss: 1.3396, test_f1: 0.6394
 epoch: 73, train_loss: 0.3538, test_loss: 1.2026, test_f1: 0.6607
 epoch: 74, train_loss: 0.3527, test_loss: 1.2351, test_f1: 0.6523
 epoch: 75, train_loss: 0.3604, test_loss: 1.2457, test_f1: 0.6477
 epoch: 76, train_loss: 0.3511, test_loss: 1.4207, test_f1: 0.6474
 epoch: 77, train_loss: 0.3371, test_loss: 1.2478, test_f1: 0.6450
 epoch: 78, train_loss: 0.3531, test_loss: 1.3980, test_f1: 0.6711
 epoch: 79, train_loss: 0.3727, test_loss: 1.2559, test_f1: 0.6460
 epoch: 80, train_loss: 0.3403, test_loss: 1.2914, test_f1: 0.6848
 epoch: 81, train_loss: 0.3428, test_loss: 1.3022, test_f1: 0.6444
 epoch: 82, train_loss: 0.3257, test_loss: 1.4037, test_f1: 0.6366
 epoch: 83, train_loss: 0.3248, test_loss: 1.5053, test_f1: 0.6401
 epoch: 84, train_loss: 0.3241, test_loss: 1.4935, test_f1: 0.6562
 epoch: 85, train_loss: 0.3514, test_loss: 1.3816, test_f1: 0.6590
 epoch: 86, train_loss: 0.3387, test_loss: 1.4011, test_f1: 0.6916
 epoch: 87, train_loss: 0.3184, test_loss: 1.3415, test_f1: 0.6480
 epoch: 88, train_loss: 0.2923, test_loss: 1.5093, test_f1: 0.6087
 epoch: 89, train_loss: 0.3294, test_loss: 1.3859, test_f1: 0.6321
 epoch: 90, train_loss: 0.2983, test_loss: 1.4859, test_f1: 0.6560
 epoch: 91, train_loss: 0.3348, test_loss: 1.5610, test_f1: 0.6164
 epoch: 92, train_loss: 0.3228, test_loss: 1.6302, test_f1: 0.6241
 epoch: 93, train_loss: 0.3106, test_loss: 1.2765, test_f1: 0.6519
 epoch: 94, train_loss: 0.3120, test_loss: 1.4470, test_f1: 0.6685
 epoch: 95, train_loss: 0.2958, test_loss: 1.5997, test_f1: 0.6488
 epoch: 96, train_loss: 0.2970, test_loss: 1.5079, test_f1: 0.6663
 epoch: 97, train_loss: 0.2768, test_loss: 1.4095, test_f1: 0.6566
 epoch: 98, train_loss: 0.2925, test_loss: 1.4060, test_f1: 0.6695
 epoch: 99, train_loss: 0.2673, test_loss: 1.4397, test_f1: 0.6588
##################ITERATION #1 ****************************************
 epoch: 0, train_loss: 1.1748, test_loss: 1.1043, test_f1: 0.3286
 epoch: 1, train_loss: 1.0201, test_loss: 1.1196, test_f1: 0.4565
 epoch: 2, train_loss: 0.9797, test_loss: 0.9569, test_f1: 0.4930
 epoch: 3, train_loss: 0.9578, test_loss: 0.9342, test_f1: 0.4856
 epoch: 4, train_loss: 0.9513, test_loss: 0.8924, test_f1: 0.5518
 epoch: 5, train_loss: 0.9214, test_loss: 0.9361, test_f1: 0.4879
 epoch: 6, train_loss: 0.9038, test_loss: 0.9571, test_f1: 0.5370
 epoch: 7, train_loss: 0.8887, test_loss: 0.9343, test_f1: 0.5213
 epoch: 8, train_loss: 0.8827, test_loss: 0.9070, test_f1: 0.5534
 epoch: 9, train_loss: 0.8587, test_loss: 0.8598, test_f1: 0.5290
 epoch: 10, train_loss: 0.8641, test_loss: 1.0037, test_f1: 0.5349
 epoch: 11, train_loss: 0.8360, test_loss: 0.9957, test_f1: 0.5265
 epoch: 12, train_loss: 0.8279, test_loss: 0.9521, test_f1: 0.5069
 epoch: 13, train_loss: 0.8137, test_loss: 0.8617, test_f1: 0.5294
 epoch: 14, train_loss: 0.8033, test_loss: 0.8515, test_f1: 0.5720
 epoch: 15, train_loss: 0.7818, test_loss: 0.8546, test_f1: 0.5329
 epoch: 16, train_loss: 0.7800, test_loss: 0.7891, test_f1: 0.5727
 epoch: 17, train_loss: 0.7626, test_loss: 0.9554, test_f1: 0.5811
 epoch: 18, train_loss: 0.7621, test_loss: 0.8005, test_f1: 0.5494
 epoch: 19, train_loss: 0.7424, test_loss: 0.7845, test_f1: 0.5986
 epoch: 20, train_loss: 0.7342, test_loss: 0.8642, test_f1: 0.5474
 epoch: 21, train_loss: 0.7318, test_loss: 0.8087, test_f1: 0.6013
 epoch: 22, train_loss: 0.7336, test_loss: 0.8684, test_f1: 0.5963
 epoch: 23, train_loss: 0.6972, test_loss: 0.9401, test_f1: 0.5912
 epoch: 24, train_loss: 0.7039, test_loss: 0.8138, test_f1: 0.5899
 epoch: 25, train_loss: 0.6839, test_loss: 0.9108, test_f1: 0.5752
 epoch: 26, train_loss: 0.6717, test_loss: 0.8243, test_f1: 0.5905
 epoch: 27, train_loss: 0.6572, test_loss: 0.7645, test_f1: 0.6355
 epoch: 28, train_loss: 0.6775, test_loss: 0.8719, test_f1: 0.5842
 epoch: 29, train_loss: 0.6656, test_loss: 0.9113, test_f1: 0.5955
 epoch: 30, train_loss: 0.6270, test_loss: 0.7751, test_f1: 0.6035
 epoch: 31, train_loss: 0.6331, test_loss: 0.8611, test_f1: 0.5958
 epoch: 32, train_loss: 0.6517, test_loss: 0.9771, test_f1: 0.5787
 epoch: 33, train_loss: 0.6579, test_loss: 0.7701, test_f1: 0.6404
 epoch: 34, train_loss: 0.6211, test_loss: 1.0538, test_f1: 0.5686
 epoch: 35, train_loss: 0.6181, test_loss: 0.8413, test_f1: 0.6008
 epoch: 36, train_loss: 0.6067, test_loss: 0.8137, test_f1: 0.6438
 epoch: 37, train_loss: 0.6048, test_loss: 0.7307, test_f1: 0.6260
 epoch: 38, train_loss: 0.6141, test_loss: 0.7289, test_f1: 0.6621
 epoch: 39, train_loss: 0.5933, test_loss: 0.7284, test_f1: 0.6153
 epoch: 40, train_loss: 0.5823, test_loss: 0.8901, test_f1: 0.6022
 epoch: 41, train_loss: 0.5761, test_loss: 0.9954, test_f1: 0.6138
 epoch: 42, train_loss: 0.5954, test_loss: 0.8597, test_f1: 0.6291
 epoch: 43, train_loss: 0.5722, test_loss: 0.7954, test_f1: 0.6543
 epoch: 44, train_loss: 0.5697, test_loss: 0.7661, test_f1: 0.6756
 epoch: 45, train_loss: 0.5479, test_loss: 0.9579, test_f1: 0.6597
 epoch: 46, train_loss: 0.5641, test_loss: 0.8427, test_f1: 0.6588
 epoch: 47, train_loss: 0.5290, test_loss: 0.7693, test_f1: 0.6644
 epoch: 48, train_loss: 0.5154, test_loss: 0.8404, test_f1: 0.6448
 epoch: 49, train_loss: 0.5055, test_loss: 0.9393, test_f1: 0.6000
 epoch: 50, train_loss: 0.5111, test_loss: 0.9648, test_f1: 0.6353
 epoch: 51, train_loss: 0.4605, test_loss: 0.9930, test_f1: 0.6982
 epoch: 52, train_loss: 0.4385, test_loss: 1.0808, test_f1: 0.6693
 epoch: 53, train_loss: 0.4161, test_loss: 1.0516, test_f1: 0.6702
 epoch: 54, train_loss: 0.4303, test_loss: 0.9651, test_f1: 0.6805
 epoch: 55, train_loss: 0.4087, test_loss: 0.9315, test_f1: 0.6735
 epoch: 56, train_loss: 0.4032, test_loss: 1.0358, test_f1: 0.6662
 epoch: 57, train_loss: 0.3934, test_loss: 1.0352, test_f1: 0.6738
 epoch: 58, train_loss: 0.4052, test_loss: 1.0136, test_f1: 0.6687
 epoch: 59, train_loss: 0.4078, test_loss: 1.0703, test_f1: 0.6577
 epoch: 60, train_loss: 0.3922, test_loss: 1.1639, test_f1: 0.6441
 epoch: 61, train_loss: 0.3812, test_loss: 1.1423, test_f1: 0.6756
 epoch: 62, train_loss: 0.3895, test_loss: 0.9741, test_f1: 0.6758
 epoch: 63, train_loss: 0.3612, test_loss: 1.0374, test_f1: 0.6511
 epoch: 64, train_loss: 0.3856, test_loss: 1.0614, test_f1: 0.6794
 epoch: 65, train_loss: 0.3581, test_loss: 1.1491, test_f1: 0.6838
 epoch: 66, train_loss: 0.3531, test_loss: 1.0008, test_f1: 0.6405
 epoch: 67, train_loss: 0.3619, test_loss: 1.0076, test_f1: 0.6760
 epoch: 68, train_loss: 0.3341, test_loss: 1.0824, test_f1: 0.6858
 epoch: 69, train_loss: 0.3457, test_loss: 1.2390, test_f1: 0.6517
 epoch: 70, train_loss: 0.3362, test_loss: 1.1485, test_f1: 0.6579
 epoch: 71, train_loss: 0.3381, test_loss: 1.1864, test_f1: 0.6777
 epoch: 72, train_loss: 0.3386, test_loss: 1.2355, test_f1: 0.6604
 epoch: 73, train_loss: 0.3149, test_loss: 1.3841, test_f1: 0.6353
 epoch: 74, train_loss: 0.3563, test_loss: 1.0688, test_f1: 0.6642
 epoch: 75, train_loss: 0.3238, test_loss: 1.2461, test_f1: 0.6632
 epoch: 76, train_loss: 0.3062, test_loss: 1.3544, test_f1: 0.6581
 epoch: 77, train_loss: 0.3355, test_loss: 1.3662, test_f1: 0.6587
 epoch: 78, train_loss: 0.3361, test_loss: 1.1270, test_f1: 0.6650
 epoch: 79, train_loss: 0.3243, test_loss: 1.3225, test_f1: 0.6686
 epoch: 80, train_loss: 0.3249, test_loss: 1.3793, test_f1: 0.6416
 epoch: 81, train_loss: 0.3486, test_loss: 1.2233, test_f1: 0.6689
 epoch: 82, train_loss: 0.2994, test_loss: 1.2179, test_f1: 0.6455
 epoch: 83, train_loss: 0.2980, test_loss: 1.3333, test_f1: 0.6806
 epoch: 84, train_loss: 0.3361, test_loss: 1.2834, test_f1: 0.6724
 epoch: 85, train_loss: 0.2930, test_loss: 1.3701, test_f1: 0.6444
 epoch: 86, train_loss: 0.3017, test_loss: 1.2349, test_f1: 0.6744
 epoch: 87, train_loss: 0.2833, test_loss: 1.1852, test_f1: 0.6853
 epoch: 88, train_loss: 0.2772, test_loss: 1.4453, test_f1: 0.6660
 epoch: 89, train_loss: 0.2662, test_loss: 1.1533, test_f1: 0.6818
 epoch: 90, train_loss: 0.2750, test_loss: 1.3785, test_f1: 0.6729
 epoch: 91, train_loss: 0.3215, test_loss: 0.9798, test_f1: 0.6776
 epoch: 92, train_loss: 0.2878, test_loss: 1.3426, test_f1: 0.6757
 epoch: 93, train_loss: 0.2716, test_loss: 1.5387, test_f1: 0.6666
 epoch: 94, train_loss: 0.2665, test_loss: 1.3722, test_f1: 0.6814
 epoch: 95, train_loss: 0.2823, test_loss: 1.3688, test_f1: 0.6660
 epoch: 96, train_loss: 0.2574, test_loss: 1.4995, test_f1: 0.6619
 epoch: 97, train_loss: 0.2625, test_loss: 1.3080, test_f1: 0.6737
 epoch: 98, train_loss: 0.2583, test_loss: 1.4438, test_f1: 0.6761
 epoch: 99, train_loss: 0.2476, test_loss: 1.3466, test_f1: 0.6862
##################ITERATION #2 ****************************************
 epoch: 0, train_loss: 1.2105, test_loss: 1.3983, test_f1: 0.2677
 epoch: 1, train_loss: 1.0343, test_loss: 1.2036, test_f1: 0.3879
 epoch: 2, train_loss: 0.9949, test_loss: 1.0623, test_f1: 0.4557
 epoch: 3, train_loss: 0.9812, test_loss: 1.2019, test_f1: 0.4679
 epoch: 4, train_loss: 0.9758, test_loss: 1.0544, test_f1: 0.4771
 epoch: 5, train_loss: 0.9578, test_loss: 1.0045, test_f1: 0.4623
 epoch: 6, train_loss: 0.9377, test_loss: 1.1044, test_f1: 0.4714
 epoch: 7, train_loss: 0.9274, test_loss: 1.0808, test_f1: 0.4929
 epoch: 8, train_loss: 0.9325, test_loss: 1.2674, test_f1: 0.4947
 epoch: 9, train_loss: 0.9295, test_loss: 0.9057, test_f1: 0.5464
 epoch: 10, train_loss: 0.9117, test_loss: 1.0257, test_f1: 0.5329
 epoch: 11, train_loss: 0.8884, test_loss: 1.0374, test_f1: 0.5634
 epoch: 12, train_loss: 0.8865, test_loss: 0.9082, test_f1: 0.5121
 epoch: 13, train_loss: 0.8656, test_loss: 0.9606, test_f1: 0.4991
 epoch: 14, train_loss: 0.8657, test_loss: 0.9269, test_f1: 0.5192
 epoch: 15, train_loss: 0.8560, test_loss: 0.9448, test_f1: 0.5677
 epoch: 16, train_loss: 0.8342, test_loss: 0.9011, test_f1: 0.5662
 epoch: 17, train_loss: 0.8295, test_loss: 1.0604, test_f1: 0.5153
 epoch: 18, train_loss: 0.8227, test_loss: 0.8925, test_f1: 0.5486
 epoch: 19, train_loss: 0.8023, test_loss: 0.9729, test_f1: 0.5785
 epoch: 20, train_loss: 0.8033, test_loss: 1.0153, test_f1: 0.5501
 epoch: 21, train_loss: 0.7961, test_loss: 0.9097, test_f1: 0.5483
 epoch: 22, train_loss: 0.7947, test_loss: 0.9570, test_f1: 0.5367
 epoch: 23, train_loss: 0.7808, test_loss: 0.8924, test_f1: 0.5625
 epoch: 24, train_loss: 0.7783, test_loss: 1.0708, test_f1: 0.5392
 epoch: 25, train_loss: 0.7548, test_loss: 0.8791, test_f1: 0.5837
 epoch: 26, train_loss: 0.7597, test_loss: 0.9080, test_f1: 0.5903
 epoch: 27, train_loss: 0.7248, test_loss: 0.8687, test_f1: 0.6017
 epoch: 28, train_loss: 0.7237, test_loss: 0.9547, test_f1: 0.6239
 epoch: 29, train_loss: 0.7171, test_loss: 0.8922, test_f1: 0.5631
 epoch: 30, train_loss: 0.6991, test_loss: 0.9306, test_f1: 0.5566
 epoch: 31, train_loss: 0.6811, test_loss: 0.9516, test_f1: 0.5407
 epoch: 32, train_loss: 0.6874, test_loss: 0.9375, test_f1: 0.5995
 epoch: 33, train_loss: 0.6969, test_loss: 1.1451, test_f1: 0.5978
 epoch: 34, train_loss: 0.6794, test_loss: 0.8909, test_f1: 0.6440
 epoch: 35, train_loss: 0.6527, test_loss: 1.1336, test_f1: 0.5298
 epoch: 36, train_loss: 0.6928, test_loss: 1.1512, test_f1: 0.5394
 epoch: 37, train_loss: 0.6870, test_loss: 1.0521, test_f1: 0.5888
 epoch: 38, train_loss: 0.6621, test_loss: 1.3551, test_f1: 0.4440
 epoch: 39, train_loss: 0.6546, test_loss: 0.9075, test_f1: 0.5786
 epoch: 40, train_loss: 0.6524, test_loss: 1.0549, test_f1: 0.6365
 epoch: 41, train_loss: 0.6110, test_loss: 0.8701, test_f1: 0.6253
 epoch: 42, train_loss: 0.6286, test_loss: 1.0547, test_f1: 0.5889
 epoch: 43, train_loss: 0.6319, test_loss: 0.9065, test_f1: 0.6065
 epoch: 44, train_loss: 0.6531, test_loss: 0.9406, test_f1: 0.6026
 epoch: 45, train_loss: 0.6104, test_loss: 1.1346, test_f1: 0.6029
 epoch: 46, train_loss: 0.6139, test_loss: 1.0652, test_f1: 0.6665
 epoch: 47, train_loss: 0.6243, test_loss: 1.0817, test_f1: 0.6149
 epoch: 48, train_loss: 0.5994, test_loss: 0.7747, test_f1: 0.6311
 epoch: 49, train_loss: 0.5869, test_loss: 1.1745, test_f1: 0.5858
 epoch: 50, train_loss: 0.5865, test_loss: 0.9350, test_f1: 0.6155
 epoch: 51, train_loss: 0.5478, test_loss: 1.0059, test_f1: 0.6265
 epoch: 52, train_loss: 0.5146, test_loss: 0.9304, test_f1: 0.6628
 epoch: 53, train_loss: 0.5046, test_loss: 0.9822, test_f1: 0.6463
 epoch: 54, train_loss: 0.4846, test_loss: 0.9758, test_f1: 0.6309
 epoch: 55, train_loss: 0.5091, test_loss: 1.2453, test_f1: 0.6427
 epoch: 56, train_loss: 0.4907, test_loss: 1.0675, test_f1: 0.6500
 epoch: 57, train_loss: 0.4639, test_loss: 1.0126, test_f1: 0.6504
 epoch: 58, train_loss: 0.4759, test_loss: 1.1387, test_f1: 0.6097
 epoch: 59, train_loss: 0.4526, test_loss: 1.1585, test_f1: 0.6533
 epoch: 60, train_loss: 0.4564, test_loss: 1.2061, test_f1: 0.6523
 epoch: 61, train_loss: 0.4683, test_loss: 0.9056, test_f1: 0.6787
 epoch: 62, train_loss: 0.4326, test_loss: 1.0029, test_f1: 0.7008
 epoch: 63, train_loss: 0.4395, test_loss: 1.1309, test_f1: 0.6554
 epoch: 64, train_loss: 0.4409, test_loss: 1.0933, test_f1: 0.6768
 epoch: 65, train_loss: 0.4481, test_loss: 1.1556, test_f1: 0.6856
 epoch: 66, train_loss: 0.4269, test_loss: 1.2022, test_f1: 0.6156
 epoch: 67, train_loss: 0.4093, test_loss: 1.0517, test_f1: 0.6612
 epoch: 68, train_loss: 0.4140, test_loss: 0.9228, test_f1: 0.6654
 epoch: 69, train_loss: 0.4307, test_loss: 1.1583, test_f1: 0.6554
 epoch: 70, train_loss: 0.3951, test_loss: 1.1420, test_f1: 0.6704
 epoch: 71, train_loss: 0.4129, test_loss: 1.1491, test_f1: 0.6857
 epoch: 72, train_loss: 0.4087, test_loss: 0.8475, test_f1: 0.6594
 epoch: 73, train_loss: 0.4056, test_loss: 1.1958, test_f1: 0.6638
 epoch: 74, train_loss: 0.4035, test_loss: 1.0746, test_f1: 0.6460
 epoch: 75, train_loss: 0.3990, test_loss: 1.3751, test_f1: 0.6840
 epoch: 76, train_loss: 0.3850, test_loss: 1.0926, test_f1: 0.6447
 epoch: 77, train_loss: 0.3919, test_loss: 1.2747, test_f1: 0.6747
 epoch: 78, train_loss: 0.3880, test_loss: 1.2485, test_f1: 0.6747
 epoch: 79, train_loss: 0.3665, test_loss: 1.2815, test_f1: 0.6672
 epoch: 80, train_loss: 0.3575, test_loss: 0.9483, test_f1: 0.6788
 epoch: 81, train_loss: 0.3518, test_loss: 1.5618, test_f1: 0.6412
 epoch: 82, train_loss: 0.3709, test_loss: 1.4449, test_f1: 0.6467
 epoch: 83, train_loss: 0.3924, test_loss: 1.2230, test_f1: 0.6678
 epoch: 84, train_loss: 0.3732, test_loss: 1.2198, test_f1: 0.6816
 epoch: 85, train_loss: 0.3369, test_loss: 1.2725, test_f1: 0.6696
 epoch: 86, train_loss: 0.3408, test_loss: 1.4551, test_f1: 0.6837
 epoch: 87, train_loss: 0.3315, test_loss: 1.3521, test_f1: 0.6881
 epoch: 88, train_loss: 0.3508, test_loss: 1.3226, test_f1: 0.6748
 epoch: 89, train_loss: 0.3341, test_loss: 1.2951, test_f1: 0.6445
 epoch: 90, train_loss: 0.3312, test_loss: 1.5111, test_f1: 0.6398
 epoch: 91, train_loss: 0.3390, test_loss: 1.2654, test_f1: 0.6406
 epoch: 92, train_loss: 0.3235, test_loss: 1.4341, test_f1: 0.6532
 epoch: 93, train_loss: 0.3553, test_loss: 1.4137, test_f1: 0.6749
 epoch: 94, train_loss: 0.3174, test_loss: 1.3055, test_f1: 0.6783
 epoch: 95, train_loss: 0.3065, test_loss: 1.2933, test_f1: 0.6730
 epoch: 96, train_loss: 0.2995, test_loss: 1.3243, test_f1: 0.6713
 epoch: 97, train_loss: 0.3092, test_loss: 1.4430, test_f1: 0.6895
 epoch: 98, train_loss: 0.3236, test_loss: 1.4116, test_f1: 0.6738
 epoch: 99, train_loss: 0.3320, test_loss: 1.3154, test_f1: 0.7096
##################ITERATION #3 ****************************************
 epoch: 0, train_loss: 1.2085, test_loss: 1.5022, test_f1: 0.3515
 epoch: 1, train_loss: 1.0169, test_loss: 1.0199, test_f1: 0.4925
 epoch: 2, train_loss: 0.9842, test_loss: 0.9606, test_f1: 0.4930
 epoch: 3, train_loss: 0.9543, test_loss: 0.9650, test_f1: 0.5094
 epoch: 4, train_loss: 0.9502, test_loss: 0.9999, test_f1: 0.4707
 epoch: 5, train_loss: 0.9525, test_loss: 0.9655, test_f1: 0.4980
 epoch: 6, train_loss: 0.9465, test_loss: 0.9602, test_f1: 0.4920
 epoch: 7, train_loss: 0.9327, test_loss: 0.9552, test_f1: 0.5195
 epoch: 8, train_loss: 0.9222, test_loss: 0.9532, test_f1: 0.4948
 epoch: 9, train_loss: 0.8864, test_loss: 0.9750, test_f1: 0.5020
 epoch: 10, train_loss: 0.8736, test_loss: 0.9933, test_f1: 0.5200
 epoch: 11, train_loss: 0.8714, test_loss: 0.9553, test_f1: 0.4653
 epoch: 12, train_loss: 0.8466, test_loss: 0.9100, test_f1: 0.5441
 epoch: 13, train_loss: 0.8363, test_loss: 0.9200, test_f1: 0.5124
 epoch: 14, train_loss: 0.8308, test_loss: 0.8640, test_f1: 0.5421
 epoch: 15, train_loss: 0.8244, test_loss: 1.1246, test_f1: 0.5355
 epoch: 16, train_loss: 0.8174, test_loss: 0.8854, test_f1: 0.5220
 epoch: 17, train_loss: 0.8178, test_loss: 1.2221, test_f1: 0.4431
 epoch: 18, train_loss: 0.7806, test_loss: 0.8773, test_f1: 0.5883
 epoch: 19, train_loss: 0.7793, test_loss: 0.9338, test_f1: 0.5433
 epoch: 20, train_loss: 0.7727, test_loss: 0.8649, test_f1: 0.5318
 epoch: 21, train_loss: 0.7468, test_loss: 0.9249, test_f1: 0.5853
 epoch: 22, train_loss: 0.7398, test_loss: 0.9291, test_f1: 0.5202
 epoch: 23, train_loss: 0.7334, test_loss: 0.8628, test_f1: 0.5971
 epoch: 24, train_loss: 0.7217, test_loss: 0.8221, test_f1: 0.5932
 epoch: 25, train_loss: 0.7122, test_loss: 0.9951, test_f1: 0.6201
 epoch: 26, train_loss: 0.6963, test_loss: 0.8193, test_f1: 0.5815
 epoch: 27, train_loss: 0.7280, test_loss: 0.8452, test_f1: 0.6014
 epoch: 28, train_loss: 0.6921, test_loss: 0.8992, test_f1: 0.5573
 epoch: 29, train_loss: 0.6781, test_loss: 1.0137, test_f1: 0.5516
 epoch: 30, train_loss: 0.6907, test_loss: 0.8186, test_f1: 0.6039
 epoch: 31, train_loss: 0.6834, test_loss: 0.7923, test_f1: 0.5713
 epoch: 32, train_loss: 0.6463, test_loss: 0.7940, test_f1: 0.6348
 epoch: 33, train_loss: 0.6486, test_loss: 0.9343, test_f1: 0.5674
 epoch: 34, train_loss: 0.6507, test_loss: 0.8478, test_f1: 0.6251
 epoch: 35, train_loss: 0.6477, test_loss: 0.8602, test_f1: 0.6307
 epoch: 36, train_loss: 0.6377, test_loss: 0.9668, test_f1: 0.5486
 epoch: 37, train_loss: 0.6115, test_loss: 0.8526, test_f1: 0.6182
 epoch: 38, train_loss: 0.6229, test_loss: 0.7339, test_f1: 0.6508
 epoch: 39, train_loss: 0.6196, test_loss: 0.9137, test_f1: 0.6048
 epoch: 40, train_loss: 0.5835, test_loss: 0.9171, test_f1: 0.6015
 epoch: 41, train_loss: 0.6176, test_loss: 0.7945, test_f1: 0.6300
 epoch: 42, train_loss: 0.6150, test_loss: 0.9459, test_f1: 0.5688
 epoch: 43, train_loss: 0.6206, test_loss: 0.7947, test_f1: 0.6564
 epoch: 44, train_loss: 0.5780, test_loss: 0.8754, test_f1: 0.6069
 epoch: 45, train_loss: 0.5737, test_loss: 0.8175, test_f1: 0.6382
 epoch: 46, train_loss: 0.5872, test_loss: 0.7349, test_f1: 0.6078
 epoch: 47, train_loss: 0.5827, test_loss: 1.0149, test_f1: 0.5741
 epoch: 48, train_loss: 0.5680, test_loss: 0.7682, test_f1: 0.6763
 epoch: 49, train_loss: 0.5699, test_loss: 0.7134, test_f1: 0.6621
 epoch: 50, train_loss: 0.5671, test_loss: 0.9476, test_f1: 0.6136
 epoch: 51, train_loss: 0.5131, test_loss: 0.7372, test_f1: 0.6576
 epoch: 52, train_loss: 0.4747, test_loss: 0.7383, test_f1: 0.6760
 epoch: 53, train_loss: 0.4654, test_loss: 0.7355, test_f1: 0.6706
 epoch: 54, train_loss: 0.4555, test_loss: 0.7277, test_f1: 0.6773
 epoch: 55, train_loss: 0.4450, test_loss: 0.8825, test_f1: 0.6388
 epoch: 56, train_loss: 0.4378, test_loss: 0.8066, test_f1: 0.6578
 epoch: 57, train_loss: 0.4410, test_loss: 0.7303, test_f1: 0.6917
 epoch: 58, train_loss: 0.4217, test_loss: 0.8169, test_f1: 0.7050
 epoch: 59, train_loss: 0.4140, test_loss: 0.7563, test_f1: 0.6841
 epoch: 60, train_loss: 0.4257, test_loss: 0.8607, test_f1: 0.6786
 epoch: 61, train_loss: 0.4084, test_loss: 0.7787, test_f1: 0.6914
 epoch: 62, train_loss: 0.4018, test_loss: 0.7645, test_f1: 0.6967
 epoch: 63, train_loss: 0.3996, test_loss: 0.7308, test_f1: 0.6968
 epoch: 64, train_loss: 0.4033, test_loss: 0.7569, test_f1: 0.6818
 epoch: 65, train_loss: 0.3998, test_loss: 0.8167, test_f1: 0.6516
 epoch: 66, train_loss: 0.3833, test_loss: 0.7696, test_f1: 0.6557
 epoch: 67, train_loss: 0.4134, test_loss: 0.8991, test_f1: 0.6458
 epoch: 68, train_loss: 0.3650, test_loss: 0.7600, test_f1: 0.6792
 epoch: 69, train_loss: 0.3877, test_loss: 0.8940, test_f1: 0.6668
 epoch: 70, train_loss: 0.4064, test_loss: 0.8129, test_f1: 0.6891
 epoch: 71, train_loss: 0.3823, test_loss: 0.8706, test_f1: 0.6640
 epoch: 72, train_loss: 0.3831, test_loss: 0.7710, test_f1: 0.6862
 epoch: 73, train_loss: 0.3627, test_loss: 0.8594, test_f1: 0.6539
 epoch: 74, train_loss: 0.3743, test_loss: 0.7546, test_f1: 0.6911
 epoch: 75, train_loss: 0.3741, test_loss: 0.8205, test_f1: 0.6950
 epoch: 76, train_loss: 0.3535, test_loss: 0.7450, test_f1: 0.6933
 epoch: 77, train_loss: 0.3649, test_loss: 0.9342, test_f1: 0.6596
 epoch: 78, train_loss: 0.3469, test_loss: 0.7913, test_f1: 0.6832
 epoch: 79, train_loss: 0.3664, test_loss: 0.8601, test_f1: 0.6691
 epoch: 80, train_loss: 0.3505, test_loss: 0.8473, test_f1: 0.6406
 epoch: 81, train_loss: 0.3234, test_loss: 0.7724, test_f1: 0.6875
 epoch: 82, train_loss: 0.3224, test_loss: 0.8164, test_f1: 0.6896
 epoch: 83, train_loss: 0.3280, test_loss: 0.9473, test_f1: 0.6341
 epoch: 84, train_loss: 0.3393, test_loss: 0.9848, test_f1: 0.6907
 epoch: 85, train_loss: 0.3630, test_loss: 0.8050, test_f1: 0.6804
 epoch: 86, train_loss: 0.3179, test_loss: 0.8475, test_f1: 0.6746
 epoch: 87, train_loss: 0.3208, test_loss: 0.8560, test_f1: 0.6768
 epoch: 88, train_loss: 0.3125, test_loss: 0.8462, test_f1: 0.7043
 epoch: 89, train_loss: 0.3321, test_loss: 0.8404, test_f1: 0.6932
 epoch: 90, train_loss: 0.3033, test_loss: 0.9324, test_f1: 0.6862
 epoch: 91, train_loss: 0.2968, test_loss: 0.9339, test_f1: 0.6536
 epoch: 92, train_loss: 0.3164, test_loss: 0.9554, test_f1: 0.6778
 epoch: 93, train_loss: 0.2942, test_loss: 0.9545, test_f1: 0.6816
 epoch: 94, train_loss: 0.2993, test_loss: 0.9736, test_f1: 0.6719
 epoch: 95, train_loss: 0.3039, test_loss: 0.9237, test_f1: 0.6846
 epoch: 96, train_loss: 0.2875, test_loss: 1.0051, test_f1: 0.6560
 epoch: 97, train_loss: 0.2859, test_loss: 0.8729, test_f1: 0.6767
 epoch: 98, train_loss: 0.2984, test_loss: 0.9069, test_f1: 0.6896
 epoch: 99, train_loss: 0.2913, test_loss: 0.8808, test_f1: 0.6716
##################ITERATION #4 ****************************************
 epoch: 0, train_loss: 1.2137, test_loss: 1.2871, test_f1: 0.3715
 epoch: 1, train_loss: 0.9874, test_loss: 1.0336, test_f1: 0.4611
 epoch: 2, train_loss: 0.9798, test_loss: 1.0917, test_f1: 0.4720
 epoch: 3, train_loss: 0.9659, test_loss: 0.9633, test_f1: 0.4680
 epoch: 4, train_loss: 0.9297, test_loss: 1.0230, test_f1: 0.5035
 epoch: 5, train_loss: 0.9274, test_loss: 0.9369, test_f1: 0.5132
 epoch: 6, train_loss: 0.8958, test_loss: 0.9506, test_f1: 0.5189
 epoch: 7, train_loss: 0.8781, test_loss: 0.9742, test_f1: 0.5078
 epoch: 8, train_loss: 0.8724, test_loss: 0.9108, test_f1: 0.5515
 epoch: 9, train_loss: 0.8635, test_loss: 0.8898, test_f1: 0.5158
 epoch: 10, train_loss: 0.8599, test_loss: 0.8752, test_f1: 0.5285
 epoch: 11, train_loss: 0.8241, test_loss: 0.9239, test_f1: 0.5368
 epoch: 12, train_loss: 0.7991, test_loss: 0.8800, test_f1: 0.5187
 epoch: 13, train_loss: 0.8116, test_loss: 0.9368, test_f1: 0.5488
 epoch: 14, train_loss: 0.8017, test_loss: 1.0517, test_f1: 0.5604
 epoch: 15, train_loss: 0.7764, test_loss: 0.7626, test_f1: 0.5884
 epoch: 16, train_loss: 0.7555, test_loss: 0.9892, test_f1: 0.5300
 epoch: 17, train_loss: 0.7603, test_loss: 0.8312, test_f1: 0.6044
 epoch: 18, train_loss: 0.7163, test_loss: 0.7499, test_f1: 0.6138
 epoch: 19, train_loss: 0.7170, test_loss: 1.0888, test_f1: 0.5753
 epoch: 20, train_loss: 0.7210, test_loss: 0.7611, test_f1: 0.6262
 epoch: 21, train_loss: 0.7039, test_loss: 1.0115, test_f1: 0.5163
 epoch: 22, train_loss: 0.7003, test_loss: 0.8343, test_f1: 0.5796
 epoch: 23, train_loss: 0.6969, test_loss: 0.8499, test_f1: 0.5825
 epoch: 24, train_loss: 0.7033, test_loss: 0.9109, test_f1: 0.5649
 epoch: 25, train_loss: 0.6860, test_loss: 0.9697, test_f1: 0.5764
 epoch: 26, train_loss: 0.6549, test_loss: 0.7395, test_f1: 0.6129
 epoch: 27, train_loss: 0.6718, test_loss: 0.7693, test_f1: 0.5843
 epoch: 28, train_loss: 0.6537, test_loss: 0.8359, test_f1: 0.5944
 epoch: 29, train_loss: 0.6340, test_loss: 0.9220, test_f1: 0.5831
 epoch: 30, train_loss: 0.6342, test_loss: 0.8741, test_f1: 0.6482
 epoch: 31, train_loss: 0.6457, test_loss: 0.7386, test_f1: 0.6556
 epoch: 32, train_loss: 0.6375, test_loss: 0.7830, test_f1: 0.6373
 epoch: 33, train_loss: 0.6397, test_loss: 0.8367, test_f1: 0.6158
 epoch: 34, train_loss: 0.6169, test_loss: 0.7498, test_f1: 0.6404
 epoch: 35, train_loss: 0.6224, test_loss: 1.0895, test_f1: 0.5801
 epoch: 36, train_loss: 0.5942, test_loss: 0.8469, test_f1: 0.5757
 epoch: 37, train_loss: 0.5980, test_loss: 1.0760, test_f1: 0.5861
 epoch: 38, train_loss: 0.5822, test_loss: 0.7848, test_f1: 0.5969
 epoch: 39, train_loss: 0.5672, test_loss: 0.7773, test_f1: 0.6441
 epoch: 40, train_loss: 0.5717, test_loss: 0.8418, test_f1: 0.6609
 epoch: 41, train_loss: 0.5547, test_loss: 0.9057, test_f1: 0.6123
 epoch: 42, train_loss: 0.5459, test_loss: 1.0800, test_f1: 0.6489
 epoch: 43, train_loss: 0.5352, test_loss: 0.8597, test_f1: 0.6924
 epoch: 44, train_loss: 0.5259, test_loss: 0.7871, test_f1: 0.6316
 epoch: 45, train_loss: 0.5587, test_loss: 0.7654, test_f1: 0.6123
 epoch: 46, train_loss: 0.5508, test_loss: 0.7585, test_f1: 0.6480
 epoch: 47, train_loss: 0.5454, test_loss: 0.7288, test_f1: 0.6724
 epoch: 48, train_loss: 0.5484, test_loss: 0.7301, test_f1: 0.6780
 epoch: 49, train_loss: 0.5450, test_loss: 1.0136, test_f1: 0.5592
 epoch: 50, train_loss: 0.5504, test_loss: 1.0516, test_f1: 0.5773
 epoch: 51, train_loss: 0.4855, test_loss: 0.7443, test_f1: 0.6718
 epoch: 52, train_loss: 0.4291, test_loss: 0.9959, test_f1: 0.5846
 epoch: 53, train_loss: 0.4321, test_loss: 0.9466, test_f1: 0.6618
 epoch: 54, train_loss: 0.4145, test_loss: 0.8846, test_f1: 0.6914
 epoch: 55, train_loss: 0.4114, test_loss: 0.8691, test_f1: 0.6605
 epoch: 56, train_loss: 0.4003, test_loss: 1.0473, test_f1: 0.6601
 epoch: 57, train_loss: 0.4132, test_loss: 1.1009, test_f1: 0.6797
 epoch: 58, train_loss: 0.3917, test_loss: 0.9771, test_f1: 0.6395
 epoch: 59, train_loss: 0.3847, test_loss: 1.0896, test_f1: 0.6688
 epoch: 60, train_loss: 0.3843, test_loss: 0.9453, test_f1: 0.6869
 epoch: 61, train_loss: 0.3865, test_loss: 1.0520, test_f1: 0.6631
 epoch: 62, train_loss: 0.4038, test_loss: 0.8262, test_f1: 0.7053
 epoch: 63, train_loss: 0.3948, test_loss: 1.1997, test_f1: 0.6581
 epoch: 64, train_loss: 0.3973, test_loss: 0.8668, test_f1: 0.6868
 epoch: 65, train_loss: 0.3765, test_loss: 0.8289, test_f1: 0.7012
 epoch: 66, train_loss: 0.3643, test_loss: 0.8828, test_f1: 0.6972
 epoch: 67, train_loss: 0.3652, test_loss: 0.7979, test_f1: 0.7079
 epoch: 68, train_loss: 0.3620, test_loss: 0.8625, test_f1: 0.6941
 epoch: 69, train_loss: 0.3382, test_loss: 0.9587, test_f1: 0.6810
 epoch: 70, train_loss: 0.3588, test_loss: 0.9791, test_f1: 0.6736
 epoch: 71, train_loss: 0.3640, test_loss: 0.8932, test_f1: 0.7125
 epoch: 72, train_loss: 0.3357, test_loss: 0.9135, test_f1: 0.6773
 epoch: 73, train_loss: 0.3514, test_loss: 0.9283, test_f1: 0.6593
 epoch: 74, train_loss: 0.3238, test_loss: 1.0098, test_f1: 0.6875
 epoch: 75, train_loss: 0.3372, test_loss: 1.2455, test_f1: 0.6793
 epoch: 76, train_loss: 0.3376, test_loss: 0.9465, test_f1: 0.6778
 epoch: 77, train_loss: 0.3602, test_loss: 1.0333, test_f1: 0.6493
 epoch: 78, train_loss: 0.3398, test_loss: 0.9924, test_f1: 0.6651
 epoch: 79, train_loss: 0.3294, test_loss: 1.1791, test_f1: 0.6206
 epoch: 80, train_loss: 0.3182, test_loss: 1.0776, test_f1: 0.6809
 epoch: 81, train_loss: 0.3215, test_loss: 1.0711, test_f1: 0.6507
 epoch: 82, train_loss: 0.3372, test_loss: 1.0118, test_f1: 0.6751
 epoch: 83, train_loss: 0.2997, test_loss: 1.0609, test_f1: 0.6873
 epoch: 84, train_loss: 0.3074, test_loss: 0.9876, test_f1: 0.6904
 epoch: 85, train_loss: 0.3166, test_loss: 1.0497, test_f1: 0.6850
 epoch: 86, train_loss: 0.3091, test_loss: 1.1489, test_f1: 0.6723
 epoch: 87, train_loss: 0.3089, test_loss: 1.1520, test_f1: 0.6570
 epoch: 88, train_loss: 0.3206, test_loss: 1.0534, test_f1: 0.6559
 epoch: 89, train_loss: 0.3142, test_loss: 1.3417, test_f1: 0.6566
 epoch: 90, train_loss: 0.2999, test_loss: 1.0781, test_f1: 0.6907
 epoch: 91, train_loss: 0.2822, test_loss: 1.2967, test_f1: 0.6826
 epoch: 92, train_loss: 0.3031, test_loss: 1.1214, test_f1: 0.6893
 epoch: 93, train_loss: 0.3057, test_loss: 1.2701, test_f1: 0.6740
 epoch: 94, train_loss: 0.2943, test_loss: 1.1076, test_f1: 0.6661
 epoch: 95, train_loss: 0.2640, test_loss: 1.1571, test_f1: 0.6845
 epoch: 96, train_loss: 0.2607, test_loss: 1.1006, test_f1: 0.7202
 epoch: 97, train_loss: 0.3171, test_loss: 1.3915, test_f1: 0.6643
 epoch: 98, train_loss: 0.3095, test_loss: 1.1343, test_f1: 0.6699
 epoch: 99, train_loss: 0.2979, test_loss: 1.0008, test_f1: 0.6888
##################ITERATION #5 ****************************************
 epoch: 0, train_loss: 1.3602, test_loss: 1.1831, test_f1: 0.3723
 epoch: 1, train_loss: 0.9949, test_loss: 1.0577, test_f1: 0.4697
 epoch: 2, train_loss: 0.9585, test_loss: 0.9245, test_f1: 0.4861
 epoch: 3, train_loss: 0.9149, test_loss: 0.9563, test_f1: 0.5202
 epoch: 4, train_loss: 0.9198, test_loss: 0.9388, test_f1: 0.5127
 epoch: 5, train_loss: 0.8905, test_loss: 0.9762, test_f1: 0.5604
 epoch: 6, train_loss: 0.8757, test_loss: 1.0430, test_f1: 0.4984
 epoch: 7, train_loss: 0.8571, test_loss: 0.8993, test_f1: 0.5480
 epoch: 8, train_loss: 0.8337, test_loss: 0.9064, test_f1: 0.5317
 epoch: 9, train_loss: 0.8234, test_loss: 0.9118, test_f1: 0.5461
 epoch: 10, train_loss: 0.8165, test_loss: 0.8365, test_f1: 0.5830
 epoch: 11, train_loss: 0.8037, test_loss: 0.8953, test_f1: 0.5881
 epoch: 12, train_loss: 0.7721, test_loss: 0.8539, test_f1: 0.5917
 epoch: 13, train_loss: 0.8048, test_loss: 0.9918, test_f1: 0.5475
 epoch: 14, train_loss: 0.7738, test_loss: 0.8767, test_f1: 0.6110
 epoch: 15, train_loss: 0.7468, test_loss: 0.8635, test_f1: 0.6169
 epoch: 16, train_loss: 0.7325, test_loss: 1.0456, test_f1: 0.5949
 epoch: 17, train_loss: 0.7558, test_loss: 0.8411, test_f1: 0.5506
 epoch: 18, train_loss: 0.7216, test_loss: 0.9200, test_f1: 0.5697
 epoch: 19, train_loss: 0.7029, test_loss: 0.8765, test_f1: 0.6145
 epoch: 20, train_loss: 0.6790, test_loss: 0.9580, test_f1: 0.6366
 epoch: 21, train_loss: 0.7260, test_loss: 1.1436, test_f1: 0.5281
 epoch: 22, train_loss: 0.6984, test_loss: 0.9506, test_f1: 0.5742
 epoch: 23, train_loss: 0.6722, test_loss: 0.8206, test_f1: 0.6121
 epoch: 24, train_loss: 0.6722, test_loss: 0.8855, test_f1: 0.5633
 epoch: 25, train_loss: 0.7371, test_loss: 0.9749, test_f1: 0.5416
 epoch: 26, train_loss: 0.7340, test_loss: 0.8451, test_f1: 0.6027
 epoch: 27, train_loss: 0.7170, test_loss: 0.8498, test_f1: 0.5980
 epoch: 28, train_loss: 0.6703, test_loss: 0.8854, test_f1: 0.6230
 epoch: 29, train_loss: 0.6820, test_loss: 0.8679, test_f1: 0.6505
 epoch: 30, train_loss: 0.6425, test_loss: 0.9585, test_f1: 0.6087
 epoch: 31, train_loss: 0.6358, test_loss: 1.8500, test_f1: 0.4630
 epoch: 32, train_loss: 0.6305, test_loss: 0.9181, test_f1: 0.6105
 epoch: 33, train_loss: 0.6267, test_loss: 0.9780, test_f1: 0.6133
 epoch: 34, train_loss: 0.6182, test_loss: 0.9471, test_f1: 0.5833
 epoch: 35, train_loss: 0.6378, test_loss: 0.9308, test_f1: 0.6364
 epoch: 36, train_loss: 0.6204, test_loss: 0.8754, test_f1: 0.6286
 epoch: 37, train_loss: 0.6056, test_loss: 0.9027, test_f1: 0.6447
 epoch: 38, train_loss: 0.5864, test_loss: 0.9461, test_f1: 0.6235
 epoch: 39, train_loss: 0.6073, test_loss: 0.9497, test_f1: 0.6768
 epoch: 40, train_loss: 0.5938, test_loss: 0.8830, test_f1: 0.6529
 epoch: 41, train_loss: 0.5893, test_loss: 0.8802, test_f1: 0.6812
 epoch: 42, train_loss: 0.5681, test_loss: 0.9916, test_f1: 0.6143
 epoch: 43, train_loss: 0.6063, test_loss: 1.0181, test_f1: 0.6579
 epoch: 44, train_loss: 0.5862, test_loss: 0.8513, test_f1: 0.6215
 epoch: 45, train_loss: 0.5479, test_loss: 1.0129, test_f1: 0.6607
 epoch: 46, train_loss: 0.5642, test_loss: 0.8576, test_f1: 0.6133
 epoch: 47, train_loss: 0.5614, test_loss: 0.8680, test_f1: 0.6548
 epoch: 48, train_loss: 0.5649, test_loss: 0.8843, test_f1: 0.6616
 epoch: 49, train_loss: 0.5377, test_loss: 0.8886, test_f1: 0.6502
 epoch: 50, train_loss: 0.5299, test_loss: 1.0243, test_f1: 0.5988
 epoch: 51, train_loss: 0.4906, test_loss: 0.8224, test_f1: 0.7039
 epoch: 52, train_loss: 0.4667, test_loss: 0.9407, test_f1: 0.6731
 epoch: 53, train_loss: 0.4805, test_loss: 0.9657, test_f1: 0.6950
 epoch: 54, train_loss: 0.4359, test_loss: 0.9491, test_f1: 0.6858
 epoch: 55, train_loss: 0.4485, test_loss: 0.9947, test_f1: 0.6753
 epoch: 56, train_loss: 0.4418, test_loss: 0.9620, test_f1: 0.6803
 epoch: 57, train_loss: 0.4128, test_loss: 0.9680, test_f1: 0.6897
 epoch: 58, train_loss: 0.3899, test_loss: 1.0845, test_f1: 0.6643
 epoch: 59, train_loss: 0.4285, test_loss: 1.1233, test_f1: 0.6929
 epoch: 60, train_loss: 0.3893, test_loss: 1.1661, test_f1: 0.6693
 epoch: 61, train_loss: 0.4116, test_loss: 1.0523, test_f1: 0.6867
 epoch: 62, train_loss: 0.3803, test_loss: 1.3137, test_f1: 0.6789
 epoch: 63, train_loss: 0.4155, test_loss: 0.9266, test_f1: 0.6926
 epoch: 64, train_loss: 0.3864, test_loss: 1.1155, test_f1: 0.6706
 epoch: 65, train_loss: 0.3845, test_loss: 1.1867, test_f1: 0.6454
 epoch: 66, train_loss: 0.4027, test_loss: 1.3311, test_f1: 0.6807
 epoch: 67, train_loss: 0.4001, test_loss: 1.1074, test_f1: 0.6834
 epoch: 68, train_loss: 0.3709, test_loss: 1.1483, test_f1: 0.6836
 epoch: 69, train_loss: 0.3662, test_loss: 1.1059, test_f1: 0.6888
 epoch: 70, train_loss: 0.3657, test_loss: 1.2111, test_f1: 0.6395
 epoch: 71, train_loss: 0.3844, test_loss: 1.1078, test_f1: 0.6899
 epoch: 72, train_loss: 0.3665, test_loss: 1.1475, test_f1: 0.7039
 epoch: 73, train_loss: 0.3655, test_loss: 1.1989, test_f1: 0.6640
 epoch: 74, train_loss: 0.3697, test_loss: 1.3782, test_f1: 0.6931
 epoch: 75, train_loss: 0.3510, test_loss: 1.2452, test_f1: 0.6911
 epoch: 76, train_loss: 0.3412, test_loss: 1.2930, test_f1: 0.6653
 epoch: 77, train_loss: 0.3583, test_loss: 1.3777, test_f1: 0.6744
 epoch: 78, train_loss: 0.3506, test_loss: 1.2085, test_f1: 0.6777
 epoch: 79, train_loss: 0.3486, test_loss: 1.2931, test_f1: 0.7017
 epoch: 80, train_loss: 0.3395, test_loss: 1.4112, test_f1: 0.6902
 epoch: 81, train_loss: 0.3391, test_loss: 1.4037, test_f1: 0.6502
 epoch: 82, train_loss: 0.3386, test_loss: 1.1918, test_f1: 0.6874
 epoch: 83, train_loss: 0.3391, test_loss: 1.1853, test_f1: 0.7047
 epoch: 84, train_loss: 0.3282, test_loss: 1.4955, test_f1: 0.6749
 epoch: 85, train_loss: 0.3686, test_loss: 1.3526, test_f1: 0.6843
 epoch: 86, train_loss: 0.3467, test_loss: 1.3269, test_f1: 0.6823
 epoch: 87, train_loss: 0.3355, test_loss: 1.4251, test_f1: 0.6563
 epoch: 88, train_loss: 0.3419, test_loss: 1.2089, test_f1: 0.6644
 epoch: 89, train_loss: 0.3247, test_loss: 1.4238, test_f1: 0.6800
 epoch: 90, train_loss: 0.3138, test_loss: 1.3786, test_f1: 0.6791
 epoch: 91, train_loss: 0.3091, test_loss: 1.4042, test_f1: 0.6834
 epoch: 92, train_loss: 0.3262, test_loss: 1.3367, test_f1: 0.6862
 epoch: 93, train_loss: 0.2993, test_loss: 1.4390, test_f1: 0.6893
 epoch: 94, train_loss: 0.3065, test_loss: 1.5066, test_f1: 0.6711
 epoch: 95, train_loss: 0.2999, test_loss: 1.5959, test_f1: 0.6676
 epoch: 96, train_loss: 0.3071, test_loss: 1.5964, test_f1: 0.6422
 epoch: 97, train_loss: 0.2946, test_loss: 1.3636, test_f1: 0.6807
 epoch: 98, train_loss: 0.2856, test_loss: 1.5013, test_f1: 0.6796
 epoch: 99, train_loss: 0.2658, test_loss: 1.5236, test_f1: 0.6836
##################ITERATION #6 ****************************************
 epoch: 0, train_loss: 1.3354, test_loss: 1.2645, test_f1: 0.3432
 epoch: 1, train_loss: 0.9843, test_loss: 0.9761, test_f1: 0.4672
 epoch: 2, train_loss: 0.9475, test_loss: 0.9586, test_f1: 0.4986
 epoch: 3, train_loss: 0.9248, test_loss: 0.9324, test_f1: 0.5043
 epoch: 4, train_loss: 0.9320, test_loss: 1.0693, test_f1: 0.4890
 epoch: 5, train_loss: 0.8937, test_loss: 0.9010, test_f1: 0.4946
 epoch: 6, train_loss: 0.8744, test_loss: 0.8829, test_f1: 0.5293
 epoch: 7, train_loss: 0.8585, test_loss: 0.9942, test_f1: 0.5288
 epoch: 8, train_loss: 0.8436, test_loss: 0.8654, test_f1: 0.5269
 epoch: 9, train_loss: 0.8250, test_loss: 0.8720, test_f1: 0.5809
 epoch: 10, train_loss: 0.8081, test_loss: 0.7843, test_f1: 0.6122
 epoch: 11, train_loss: 0.8062, test_loss: 0.7954, test_f1: 0.5975
 epoch: 12, train_loss: 0.7843, test_loss: 0.9307, test_f1: 0.5595
 epoch: 13, train_loss: 0.7832, test_loss: 0.7730, test_f1: 0.5988
 epoch: 14, train_loss: 0.7627, test_loss: 0.7663, test_f1: 0.6265
 epoch: 15, train_loss: 0.7449, test_loss: 0.7440, test_f1: 0.6220
 epoch: 16, train_loss: 0.7317, test_loss: 0.8471, test_f1: 0.5932
 epoch: 17, train_loss: 0.7669, test_loss: 0.7752, test_f1: 0.6100
 epoch: 18, train_loss: 0.7340, test_loss: 0.8505, test_f1: 0.5652
 epoch: 19, train_loss: 0.7238, test_loss: 0.8064, test_f1: 0.5980
 epoch: 20, train_loss: 0.7303, test_loss: 0.7614, test_f1: 0.6273
 epoch: 21, train_loss: 0.7056, test_loss: 0.9140, test_f1: 0.5656
 epoch: 22, train_loss: 0.7095, test_loss: 0.8269, test_f1: 0.6218
 epoch: 23, train_loss: 0.7086, test_loss: 0.7589, test_f1: 0.6773
 epoch: 24, train_loss: 0.6650, test_loss: 0.7499, test_f1: 0.6171
 epoch: 25, train_loss: 0.6668, test_loss: 0.8268, test_f1: 0.5681
 epoch: 26, train_loss: 0.6751, test_loss: 0.7946, test_f1: 0.6249
 epoch: 27, train_loss: 0.6618, test_loss: 0.7607, test_f1: 0.6420
 epoch: 28, train_loss: 0.6490, test_loss: 0.7795, test_f1: 0.6259
 epoch: 29, train_loss: 0.6317, test_loss: 0.7736, test_f1: 0.6178
 epoch: 30, train_loss: 0.6321, test_loss: 0.7976, test_f1: 0.6338
 epoch: 31, train_loss: 0.6287, test_loss: 0.8503, test_f1: 0.6083
 epoch: 32, train_loss: 0.6093, test_loss: 0.8414, test_f1: 0.6293
 epoch: 33, train_loss: 0.6308, test_loss: 0.8455, test_f1: 0.6184
 epoch: 34, train_loss: 0.6131, test_loss: 0.8386, test_f1: 0.6510
 epoch: 35, train_loss: 0.5903, test_loss: 0.7911, test_f1: 0.6598
 epoch: 36, train_loss: 0.6013, test_loss: 0.8532, test_f1: 0.6342
 epoch: 37, train_loss: 0.5807, test_loss: 0.9296, test_f1: 0.6192
 epoch: 38, train_loss: 0.5704, test_loss: 0.8093, test_f1: 0.6354
 epoch: 39, train_loss: 0.5856, test_loss: 1.5631, test_f1: 0.5168
 epoch: 40, train_loss: 0.6036, test_loss: 1.1291, test_f1: 0.6022
 epoch: 41, train_loss: 0.5848, test_loss: 0.7544, test_f1: 0.6568
 epoch: 42, train_loss: 0.5627, test_loss: 0.8484, test_f1: 0.6419
 epoch: 43, train_loss: 0.5506, test_loss: 0.7527, test_f1: 0.6506
 epoch: 44, train_loss: 0.5211, test_loss: 0.7919, test_f1: 0.6465
 epoch: 45, train_loss: 0.5264, test_loss: 0.8185, test_f1: 0.6638
 epoch: 46, train_loss: 0.5623, test_loss: 0.8356, test_f1: 0.6020
 epoch: 47, train_loss: 0.5433, test_loss: 1.0367, test_f1: 0.6365
 epoch: 48, train_loss: 0.5307, test_loss: 0.8765, test_f1: 0.6261
 epoch: 49, train_loss: 0.5507, test_loss: 0.8281, test_f1: 0.6532
 epoch: 50, train_loss: 0.5285, test_loss: 0.8754, test_f1: 0.6281
 epoch: 51, train_loss: 0.4822, test_loss: 0.8619, test_f1: 0.6696
 epoch: 52, train_loss: 0.4441, test_loss: 0.9109, test_f1: 0.6730
 epoch: 53, train_loss: 0.4220, test_loss: 0.9110, test_f1: 0.6610
 epoch: 54, train_loss: 0.4390, test_loss: 1.0164, test_f1: 0.6531
 epoch: 55, train_loss: 0.4095, test_loss: 0.9361, test_f1: 0.6440
 epoch: 56, train_loss: 0.4065, test_loss: 1.1692, test_f1: 0.6410
 epoch: 57, train_loss: 0.3866, test_loss: 1.0976, test_f1: 0.6487
 epoch: 58, train_loss: 0.3815, test_loss: 1.0066, test_f1: 0.6684
 epoch: 59, train_loss: 0.3923, test_loss: 1.0763, test_f1: 0.6496
 epoch: 60, train_loss: 0.4061, test_loss: 1.0148, test_f1: 0.6532
 epoch: 61, train_loss: 0.3894, test_loss: 1.0545, test_f1: 0.6164
 epoch: 62, train_loss: 0.3908, test_loss: 0.9982, test_f1: 0.6523
 epoch: 63, train_loss: 0.3762, test_loss: 1.0639, test_f1: 0.6527
 epoch: 64, train_loss: 0.3581, test_loss: 1.0419, test_f1: 0.6708
 epoch: 65, train_loss: 0.3631, test_loss: 1.2036, test_f1: 0.6391
 epoch: 66, train_loss: 0.3615, test_loss: 1.1998, test_f1: 0.6477
 epoch: 67, train_loss: 0.3848, test_loss: 0.9416, test_f1: 0.6574
 epoch: 68, train_loss: 0.3579, test_loss: 1.1710, test_f1: 0.6436
 epoch: 69, train_loss: 0.3644, test_loss: 0.8784, test_f1: 0.6648
 epoch: 70, train_loss: 0.3485, test_loss: 1.2135, test_f1: 0.6487
 epoch: 71, train_loss: 0.3575, test_loss: 1.3411, test_f1: 0.6608
 epoch: 72, train_loss: 0.3703, test_loss: 1.1762, test_f1: 0.6383
 epoch: 73, train_loss: 0.3613, test_loss: 1.1809, test_f1: 0.6285
 epoch: 74, train_loss: 0.3761, test_loss: 1.3581, test_f1: 0.6020
 epoch: 75, train_loss: 0.3746, test_loss: 1.0503, test_f1: 0.6396
 epoch: 76, train_loss: 0.3267, test_loss: 1.2935, test_f1: 0.6688
 epoch: 77, train_loss: 0.3391, test_loss: 1.2983, test_f1: 0.6569
 epoch: 78, train_loss: 0.3225, test_loss: 1.4383, test_f1: 0.6132
 epoch: 79, train_loss: 0.3523, test_loss: 1.4019, test_f1: 0.6353
 epoch: 80, train_loss: 0.3425, test_loss: 1.4019, test_f1: 0.6084
 epoch: 81, train_loss: 0.3408, test_loss: 1.3378, test_f1: 0.6721
 epoch: 82, train_loss: 0.3217, test_loss: 1.1016, test_f1: 0.6521
 epoch: 83, train_loss: 0.3319, test_loss: 1.0800, test_f1: 0.6610
 epoch: 84, train_loss: 0.3307, test_loss: 1.6317, test_f1: 0.6345
 epoch: 85, train_loss: 0.3195, test_loss: 1.2893, test_f1: 0.6842
 epoch: 86, train_loss: 0.3297, test_loss: 1.4783, test_f1: 0.6485
 epoch: 87, train_loss: 0.3238, test_loss: 1.5426, test_f1: 0.6278
 epoch: 88, train_loss: 0.3004, test_loss: 1.3631, test_f1: 0.6406
 epoch: 89, train_loss: 0.2917, test_loss: 1.4197, test_f1: 0.6504
 epoch: 90, train_loss: 0.2842, test_loss: 1.7619, test_f1: 0.6346
 epoch: 91, train_loss: 0.3091, test_loss: 1.7043, test_f1: 0.6101
 epoch: 92, train_loss: 0.2994, test_loss: 1.5081, test_f1: 0.6640
 epoch: 93, train_loss: 0.2955, test_loss: 1.3176, test_f1: 0.6675
 epoch: 94, train_loss: 0.3095, test_loss: 1.5409, test_f1: 0.6540
 epoch: 95, train_loss: 0.2953, test_loss: 1.1682, test_f1: 0.6575
 epoch: 96, train_loss: 0.3013, test_loss: 1.5704, test_f1: 0.6723
 epoch: 97, train_loss: 0.2833, test_loss: 1.6698, test_f1: 0.6511
 epoch: 98, train_loss: 0.3136, test_loss: 1.2699, test_f1: 0.6468
 epoch: 99, train_loss: 0.2832, test_loss: 1.3007, test_f1: 0.6549
##################ITERATION #7 ****************************************
 epoch: 0, train_loss: 1.3603, test_loss: 1.0947, test_f1: 0.3871
 epoch: 1, train_loss: 1.0171, test_loss: 1.0510, test_f1: 0.4573
 epoch: 2, train_loss: 0.9720, test_loss: 1.0618, test_f1: 0.4016
 epoch: 3, train_loss: 0.9664, test_loss: 1.0184, test_f1: 0.5014
 epoch: 4, train_loss: 0.9365, test_loss: 0.9186, test_f1: 0.4985
 epoch: 5, train_loss: 0.9140, test_loss: 0.9594, test_f1: 0.4751
 epoch: 6, train_loss: 0.9161, test_loss: 0.9071, test_f1: 0.5105
 epoch: 7, train_loss: 0.8784, test_loss: 0.8780, test_f1: 0.5344
 epoch: 8, train_loss: 0.8757, test_loss: 1.2789, test_f1: 0.4399
 epoch: 9, train_loss: 0.8611, test_loss: 0.8960, test_f1: 0.5160
 epoch: 10, train_loss: 0.8483, test_loss: 1.0181, test_f1: 0.5308
 epoch: 11, train_loss: 0.8471, test_loss: 0.8646, test_f1: 0.5506
 epoch: 12, train_loss: 0.8279, test_loss: 0.9933, test_f1: 0.5492
 epoch: 13, train_loss: 0.8053, test_loss: 0.8562, test_f1: 0.5583
 epoch: 14, train_loss: 0.8218, test_loss: 0.9567, test_f1: 0.5669
 epoch: 15, train_loss: 0.8235, test_loss: 0.9423, test_f1: 0.5443
 epoch: 16, train_loss: 0.7985, test_loss: 0.8996, test_f1: 0.5371
 epoch: 17, train_loss: 0.7849, test_loss: 0.8916, test_f1: 0.5780
 epoch: 18, train_loss: 0.7745, test_loss: 1.0682, test_f1: 0.5208
 epoch: 19, train_loss: 0.7610, test_loss: 0.9167, test_f1: 0.5550
 epoch: 20, train_loss: 0.7396, test_loss: 0.9892, test_f1: 0.5376
 epoch: 21, train_loss: 0.7161, test_loss: 1.2450, test_f1: 0.5125
 epoch: 22, train_loss: 0.7369, test_loss: 1.1739, test_f1: 0.5275
 epoch: 23, train_loss: 0.7395, test_loss: 0.7851, test_f1: 0.5836
 epoch: 24, train_loss: 0.7060, test_loss: 0.9198, test_f1: 0.5983
 epoch: 25, train_loss: 0.7348, test_loss: 0.8150, test_f1: 0.5888
 epoch: 26, train_loss: 0.7016, test_loss: 0.8626, test_f1: 0.6019
 epoch: 27, train_loss: 0.6845, test_loss: 0.8679, test_f1: 0.5823
 epoch: 28, train_loss: 0.7084, test_loss: 0.8293, test_f1: 0.6061
 epoch: 29, train_loss: 0.6758, test_loss: 0.9910, test_f1: 0.5783
 epoch: 30, train_loss: 0.6792, test_loss: 0.9046, test_f1: 0.6008
 epoch: 31, train_loss: 0.6706, test_loss: 0.8651, test_f1: 0.5907
 epoch: 32, train_loss: 0.7041, test_loss: 0.8522, test_f1: 0.6000
 epoch: 33, train_loss: 0.6521, test_loss: 1.0224, test_f1: 0.5800
 epoch: 34, train_loss: 0.6532, test_loss: 0.9300, test_f1: 0.6217
 epoch: 35, train_loss: 0.6580, test_loss: 0.8442, test_f1: 0.6011
 epoch: 36, train_loss: 0.6581, test_loss: 1.1285, test_f1: 0.6431
 epoch: 37, train_loss: 0.6340, test_loss: 1.1136, test_f1: 0.6145
 epoch: 38, train_loss: 0.6493, test_loss: 0.9533, test_f1: 0.6010
 epoch: 39, train_loss: 0.6325, test_loss: 0.9671, test_f1: 0.5921
 epoch: 40, train_loss: 0.6300, test_loss: 0.7574, test_f1: 0.6457
 epoch: 41, train_loss: 0.6156, test_loss: 0.9173, test_f1: 0.6066
 epoch: 42, train_loss: 0.6208, test_loss: 1.1944, test_f1: 0.6464
 epoch: 43, train_loss: 0.5949, test_loss: 1.0812, test_f1: 0.5964
 epoch: 44, train_loss: 0.6028, test_loss: 1.5953, test_f1: 0.5896
 epoch: 45, train_loss: 0.6039, test_loss: 0.9846, test_f1: 0.5819
 epoch: 46, train_loss: 0.5989, test_loss: 0.8974, test_f1: 0.6470
 epoch: 47, train_loss: 0.5932, test_loss: 0.8383, test_f1: 0.6322
 epoch: 48, train_loss: 0.5899, test_loss: 0.9503, test_f1: 0.5981
 epoch: 49, train_loss: 0.5880, test_loss: 0.8951, test_f1: 0.6435
 epoch: 50, train_loss: 0.5922, test_loss: 0.7923, test_f1: 0.6414
 epoch: 51, train_loss: 0.5415, test_loss: 0.8469, test_f1: 0.6186
 epoch: 52, train_loss: 0.5026, test_loss: 0.7858, test_f1: 0.6508
 epoch: 53, train_loss: 0.4845, test_loss: 1.0103, test_f1: 0.6496
 epoch: 54, train_loss: 0.4652, test_loss: 1.1103, test_f1: 0.5834
 epoch: 55, train_loss: 0.4875, test_loss: 1.1113, test_f1: 0.6610
 epoch: 56, train_loss: 0.4672, test_loss: 0.9257, test_f1: 0.6466
 epoch: 57, train_loss: 0.4552, test_loss: 1.1590, test_f1: 0.6398
 epoch: 58, train_loss: 0.4693, test_loss: 1.3182, test_f1: 0.6282
 epoch: 59, train_loss: 0.4572, test_loss: 0.9762, test_f1: 0.6263
 epoch: 60, train_loss: 0.4469, test_loss: 1.0755, test_f1: 0.6633
 epoch: 61, train_loss: 0.4524, test_loss: 1.1439, test_f1: 0.6402
 epoch: 62, train_loss: 0.4505, test_loss: 0.9862, test_f1: 0.6498
 epoch: 63, train_loss: 0.4557, test_loss: 1.0487, test_f1: 0.6201
 epoch: 64, train_loss: 0.4270, test_loss: 1.1160, test_f1: 0.6588
 epoch: 65, train_loss: 0.4251, test_loss: 1.1752, test_f1: 0.6442
 epoch: 66, train_loss: 0.4238, test_loss: 1.4381, test_f1: 0.6563
 epoch: 67, train_loss: 0.4399, test_loss: 1.1452, test_f1: 0.6501
 epoch: 68, train_loss: 0.4154, test_loss: 1.1082, test_f1: 0.6680
 epoch: 69, train_loss: 0.4354, test_loss: 1.2263, test_f1: 0.6402
 epoch: 70, train_loss: 0.4192, test_loss: 1.0626, test_f1: 0.6443
 epoch: 71, train_loss: 0.3966, test_loss: 0.9554, test_f1: 0.6587
 epoch: 72, train_loss: 0.4056, test_loss: 1.2481, test_f1: 0.6690
 epoch: 73, train_loss: 0.4159, test_loss: 1.1283, test_f1: 0.6405
 epoch: 74, train_loss: 0.3928, test_loss: 1.1712, test_f1: 0.6515
 epoch: 75, train_loss: 0.3872, test_loss: 1.5296, test_f1: 0.6596
 epoch: 76, train_loss: 0.4059, test_loss: 1.5802, test_f1: 0.6395
 epoch: 77, train_loss: 0.4393, test_loss: 0.9658, test_f1: 0.6592
 epoch: 78, train_loss: 0.3943, test_loss: 1.2743, test_f1: 0.6595
 epoch: 79, train_loss: 0.3644, test_loss: 1.3845, test_f1: 0.6421
 epoch: 80, train_loss: 0.3671, test_loss: 1.1985, test_f1: 0.6779
 epoch: 81, train_loss: 0.3926, test_loss: 1.3552, test_f1: 0.6549
 epoch: 82, train_loss: 0.3620, test_loss: 1.4267, test_f1: 0.6487
 epoch: 83, train_loss: 0.3591, test_loss: 1.3013, test_f1: 0.6342
 epoch: 84, train_loss: 0.3659, test_loss: 1.2234, test_f1: 0.6543
 epoch: 85, train_loss: 0.3553, test_loss: 1.3605, test_f1: 0.6478
 epoch: 86, train_loss: 0.3590, test_loss: 1.6043, test_f1: 0.6593
 epoch: 87, train_loss: 0.3641, test_loss: 1.1179, test_f1: 0.6540
 epoch: 88, train_loss: 0.3790, test_loss: 1.1122, test_f1: 0.6676
 epoch: 89, train_loss: 0.3529, test_loss: 1.1377, test_f1: 0.6804
 epoch: 90, train_loss: 0.3377, test_loss: 1.5929, test_f1: 0.6382
 epoch: 91, train_loss: 0.3397, test_loss: 1.4142, test_f1: 0.6463
 epoch: 92, train_loss: 0.3471, test_loss: 1.4912, test_f1: 0.6596
 epoch: 93, train_loss: 0.3418, test_loss: 1.5202, test_f1: 0.6597
 epoch: 94, train_loss: 0.3418, test_loss: 1.3276, test_f1: 0.6712
 epoch: 95, train_loss: 0.3445, test_loss: 1.2873, test_f1: 0.6685
 epoch: 96, train_loss: 0.3458, test_loss: 1.5447, test_f1: 0.6582
 epoch: 97, train_loss: 0.3290, test_loss: 1.3734, test_f1: 0.6576
 epoch: 98, train_loss: 0.3335, test_loss: 1.6549, test_f1: 0.6464
 epoch: 99, train_loss: 0.3225, test_loss: 1.4220, test_f1: 0.6849
##################ITERATION #8 ****************************************
 epoch: 0, train_loss: 1.4251, test_loss: 1.3840, test_f1: 0.3369
 epoch: 1, train_loss: 0.9962, test_loss: 1.0752, test_f1: 0.4637
 epoch: 2, train_loss: 0.9657, test_loss: 1.0171, test_f1: 0.5374
 epoch: 3, train_loss: 0.9322, test_loss: 0.9524, test_f1: 0.5349
 epoch: 4, train_loss: 0.9207, test_loss: 0.9313, test_f1: 0.5447
 epoch: 5, train_loss: 0.9259, test_loss: 0.9601, test_f1: 0.5492
 epoch: 6, train_loss: 0.9075, test_loss: 0.9605, test_f1: 0.5146
 epoch: 7, train_loss: 0.8767, test_loss: 1.0114, test_f1: 0.4458
 epoch: 8, train_loss: 0.8716, test_loss: 0.9106, test_f1: 0.5322
 epoch: 9, train_loss: 0.8913, test_loss: 0.9583, test_f1: 0.4801
 epoch: 10, train_loss: 0.8922, test_loss: 0.8743, test_f1: 0.5821
 epoch: 11, train_loss: 0.8283, test_loss: 0.8870, test_f1: 0.5252
 epoch: 12, train_loss: 0.8340, test_loss: 0.8775, test_f1: 0.5967
 epoch: 13, train_loss: 0.8102, test_loss: 0.8958, test_f1: 0.5827
 epoch: 14, train_loss: 0.7904, test_loss: 0.9383, test_f1: 0.5802
 epoch: 15, train_loss: 0.7995, test_loss: 0.8259, test_f1: 0.6366
 epoch: 16, train_loss: 0.7926, test_loss: 1.1168, test_f1: 0.5195
 epoch: 17, train_loss: 0.7620, test_loss: 0.8130, test_f1: 0.6015
 epoch: 18, train_loss: 0.7515, test_loss: 0.7461, test_f1: 0.6300
 epoch: 19, train_loss: 0.7541, test_loss: 0.8061, test_f1: 0.5993
 epoch: 20, train_loss: 0.7377, test_loss: 0.9919, test_f1: 0.5572
 epoch: 21, train_loss: 0.7232, test_loss: 0.9185, test_f1: 0.5673
 epoch: 22, train_loss: 0.7247, test_loss: 0.7860, test_f1: 0.6036
 epoch: 23, train_loss: 0.6932, test_loss: 0.8530, test_f1: 0.6173
 epoch: 24, train_loss: 0.6958, test_loss: 0.8262, test_f1: 0.6098
 epoch: 25, train_loss: 0.6986, test_loss: 1.0916, test_f1: 0.5274
 epoch: 26, train_loss: 0.6838, test_loss: 0.7643, test_f1: 0.6099
 epoch: 27, train_loss: 0.6767, test_loss: 0.8716, test_f1: 0.5551
 epoch: 28, train_loss: 0.6642, test_loss: 0.7752, test_f1: 0.6490
 epoch: 29, train_loss: 0.6651, test_loss: 0.9599, test_f1: 0.6502
 epoch: 30, train_loss: 0.6685, test_loss: 0.7755, test_f1: 0.6341
 epoch: 31, train_loss: 0.6301, test_loss: 0.7675, test_f1: 0.6391
 epoch: 32, train_loss: 0.5968, test_loss: 0.7933, test_f1: 0.6203
 epoch: 33, train_loss: 0.6317, test_loss: 0.8321, test_f1: 0.6340
 epoch: 34, train_loss: 0.6140, test_loss: 0.8685, test_f1: 0.6301
 epoch: 35, train_loss: 0.6095, test_loss: 0.8977, test_f1: 0.6341
 epoch: 36, train_loss: 0.5844, test_loss: 0.7924, test_f1: 0.6420
 epoch: 37, train_loss: 0.6130, test_loss: 0.7371, test_f1: 0.6534
 epoch: 38, train_loss: 0.6149, test_loss: 0.9353, test_f1: 0.5868
 epoch: 39, train_loss: 0.5771, test_loss: 0.9330, test_f1: 0.5764
 epoch: 40, train_loss: 0.5835, test_loss: 0.7747, test_f1: 0.6482
 epoch: 41, train_loss: 0.5733, test_loss: 0.8124, test_f1: 0.6375
 epoch: 42, train_loss: 0.5729, test_loss: 1.0982, test_f1: 0.6058
 epoch: 43, train_loss: 0.5910, test_loss: 0.7688, test_f1: 0.6460
 epoch: 44, train_loss: 0.5669, test_loss: 0.8407, test_f1: 0.6418
 epoch: 45, train_loss: 0.5788, test_loss: 1.0009, test_f1: 0.6135
 epoch: 46, train_loss: 0.5847, test_loss: 0.8244, test_f1: 0.6399
 epoch: 47, train_loss: 0.5713, test_loss: 0.9148, test_f1: 0.5974
 epoch: 48, train_loss: 0.5466, test_loss: 0.7144, test_f1: 0.6604
 epoch: 49, train_loss: 0.5551, test_loss: 0.8662, test_f1: 0.6354
 epoch: 50, train_loss: 0.5615, test_loss: 0.9858, test_f1: 0.6147
 epoch: 51, train_loss: 0.4840, test_loss: 0.7879, test_f1: 0.6765
 epoch: 52, train_loss: 0.4525, test_loss: 0.9022, test_f1: 0.6719
 epoch: 53, train_loss: 0.4292, test_loss: 0.9278, test_f1: 0.6732
 epoch: 54, train_loss: 0.4277, test_loss: 0.9290, test_f1: 0.6583
 epoch: 55, train_loss: 0.4198, test_loss: 0.8382, test_f1: 0.6868
 epoch: 56, train_loss: 0.4142, test_loss: 0.9051, test_f1: 0.6831
 epoch: 57, train_loss: 0.4046, test_loss: 0.8637, test_f1: 0.6863
 epoch: 58, train_loss: 0.3938, test_loss: 0.8997, test_f1: 0.6751
 epoch: 59, train_loss: 0.4163, test_loss: 0.8924, test_f1: 0.6726
 epoch: 60, train_loss: 0.4001, test_loss: 1.0093, test_f1: 0.6869
 epoch: 61, train_loss: 0.3996, test_loss: 0.8961, test_f1: 0.7203
 epoch: 62, train_loss: 0.4060, test_loss: 0.9296, test_f1: 0.6530
 epoch: 63, train_loss: 0.3625, test_loss: 0.9209, test_f1: 0.7005
 epoch: 64, train_loss: 0.3854, test_loss: 0.8990, test_f1: 0.6826
 epoch: 65, train_loss: 0.3580, test_loss: 1.0399, test_f1: 0.6466
 epoch: 66, train_loss: 0.3615, test_loss: 0.9597, test_f1: 0.6837
 epoch: 67, train_loss: 0.3596, test_loss: 0.9449, test_f1: 0.6853
 epoch: 68, train_loss: 0.3792, test_loss: 0.9379, test_f1: 0.6731
 epoch: 69, train_loss: 0.3369, test_loss: 1.0220, test_f1: 0.6743
 epoch: 70, train_loss: 0.3447, test_loss: 1.0753, test_f1: 0.6629
 epoch: 71, train_loss: 0.3562, test_loss: 0.9674, test_f1: 0.6988
 epoch: 72, train_loss: 0.3647, test_loss: 0.9618, test_f1: 0.7030
 epoch: 73, train_loss: 0.3605, test_loss: 1.0117, test_f1: 0.6696
 epoch: 74, train_loss: 0.3426, test_loss: 0.9764, test_f1: 0.6936
 epoch: 75, train_loss: 0.3557, test_loss: 1.0215, test_f1: 0.6850
 epoch: 76, train_loss: 0.3269, test_loss: 1.0005, test_f1: 0.6913
 epoch: 77, train_loss: 0.3422, test_loss: 1.6080, test_f1: 0.4698
 epoch: 78, train_loss: 0.3228, test_loss: 1.0926, test_f1: 0.6833
 epoch: 79, train_loss: 0.3430, test_loss: 0.9859, test_f1: 0.6930
 epoch: 80, train_loss: 0.3198, test_loss: 1.1130, test_f1: 0.6760
 epoch: 81, train_loss: 0.3149, test_loss: 1.0473, test_f1: 0.6453
 epoch: 82, train_loss: 0.3217, test_loss: 1.1110, test_f1: 0.6721
 epoch: 83, train_loss: 0.3308, test_loss: 1.0647, test_f1: 0.6479
 epoch: 84, train_loss: 0.3248, test_loss: 0.9714, test_f1: 0.6776
 epoch: 85, train_loss: 0.3059, test_loss: 1.0822, test_f1: 0.6871
 epoch: 86, train_loss: 0.3189, test_loss: 0.9579, test_f1: 0.7066
 epoch: 87, train_loss: 0.3016, test_loss: 1.0438, test_f1: 0.7008
 epoch: 88, train_loss: 0.2979, test_loss: 1.1678, test_f1: 0.6682
 epoch: 89, train_loss: 0.2767, test_loss: 1.1208, test_f1: 0.6905
 epoch: 90, train_loss: 0.3062, test_loss: 1.2537, test_f1: 0.6370
 epoch: 91, train_loss: 0.3198, test_loss: 1.1227, test_f1: 0.6826
 epoch: 92, train_loss: 0.2939, test_loss: 1.2213, test_f1: 0.6695
 epoch: 93, train_loss: 0.3001, test_loss: 1.2850, test_f1: 0.6514
 epoch: 94, train_loss: 0.2730, test_loss: 1.5080, test_f1: 0.6497
 epoch: 95, train_loss: 0.3038, test_loss: 1.0318, test_f1: 0.6620
 epoch: 96, train_loss: 0.3367, test_loss: 0.9599, test_f1: 0.6819
 epoch: 97, train_loss: 0.2836, test_loss: 1.2556, test_f1: 0.6598
 epoch: 98, train_loss: 0.2676, test_loss: 1.4113, test_f1: 0.6801
 epoch: 99, train_loss: 0.2865, test_loss: 1.3236, test_f1: 0.6572
##################ITERATION #9 ****************************************
 epoch: 0, train_loss: 1.3606, test_loss: 1.2372, test_f1: 0.3284
 epoch: 1, train_loss: 0.9870, test_loss: 0.9496, test_f1: 0.4733
 epoch: 2, train_loss: 0.9506, test_loss: 0.9148, test_f1: 0.4912
 epoch: 3, train_loss: 0.9315, test_loss: 0.8894, test_f1: 0.5286
 epoch: 4, train_loss: 0.8988, test_loss: 0.8902, test_f1: 0.5586
 epoch: 5, train_loss: 0.8698, test_loss: 0.9084, test_f1: 0.5282
 epoch: 6, train_loss: 0.8572, test_loss: 0.9296, test_f1: 0.5487
 epoch: 7, train_loss: 0.8656, test_loss: 0.8865, test_f1: 0.5750
 epoch: 8, train_loss: 0.8300, test_loss: 0.9794, test_f1: 0.5452
 epoch: 9, train_loss: 0.8189, test_loss: 0.8032, test_f1: 0.6306
 epoch: 10, train_loss: 0.7985, test_loss: 0.8876, test_f1: 0.5659
 epoch: 11, train_loss: 0.7857, test_loss: 0.8554, test_f1: 0.5478
 epoch: 12, train_loss: 0.7766, test_loss: 0.8159, test_f1: 0.6107
 epoch: 13, train_loss: 0.7734, test_loss: 0.8728, test_f1: 0.6183
 epoch: 14, train_loss: 0.7752, test_loss: 0.9348, test_f1: 0.5636
 epoch: 15, train_loss: 0.7583, test_loss: 0.8688, test_f1: 0.5952
 epoch: 16, train_loss: 0.7362, test_loss: 0.8380, test_f1: 0.6009
 epoch: 17, train_loss: 0.7336, test_loss: 0.8608, test_f1: 0.5998
 epoch: 18, train_loss: 0.7331, test_loss: 0.8240, test_f1: 0.5734
 epoch: 19, train_loss: 0.7074, test_loss: 0.8346, test_f1: 0.6035
 epoch: 20, train_loss: 0.7058, test_loss: 0.8805, test_f1: 0.6118
 epoch: 21, train_loss: 0.6965, test_loss: 0.9765, test_f1: 0.5244
 epoch: 22, train_loss: 0.6792, test_loss: 0.8343, test_f1: 0.6058
 epoch: 23, train_loss: 0.6673, test_loss: 0.8006, test_f1: 0.6389
 epoch: 24, train_loss: 0.6774, test_loss: 0.8587, test_f1: 0.5907
 epoch: 25, train_loss: 0.6582, test_loss: 0.7407, test_f1: 0.6535
 epoch: 26, train_loss: 0.6542, test_loss: 0.9506, test_f1: 0.5841
 epoch: 27, train_loss: 0.6475, test_loss: 0.8078, test_f1: 0.6016
 epoch: 28, train_loss: 0.6409, test_loss: 0.8848, test_f1: 0.6118
 epoch: 29, train_loss: 0.6441, test_loss: 0.7757, test_f1: 0.6269
 epoch: 30, train_loss: 0.6113, test_loss: 0.8030, test_f1: 0.6448
 epoch: 31, train_loss: 0.6094, test_loss: 1.0285, test_f1: 0.5978
 epoch: 32, train_loss: 0.6404, test_loss: 0.7510, test_f1: 0.6529
 epoch: 33, train_loss: 0.5980, test_loss: 0.7311, test_f1: 0.6660
 epoch: 34, train_loss: 0.5927, test_loss: 0.8684, test_f1: 0.6126
 epoch: 35, train_loss: 0.6058, test_loss: 0.7694, test_f1: 0.6213
 epoch: 36, train_loss: 0.5818, test_loss: 0.9638, test_f1: 0.6299
 epoch: 37, train_loss: 0.5764, test_loss: 0.9011, test_f1: 0.5996
 epoch: 38, train_loss: 0.6206, test_loss: 0.7561, test_f1: 0.6712
 epoch: 39, train_loss: 0.5796, test_loss: 0.8384, test_f1: 0.6450
 epoch: 40, train_loss: 0.5587, test_loss: 0.8095, test_f1: 0.6598
 epoch: 41, train_loss: 0.5674, test_loss: 0.7752, test_f1: 0.6629
 epoch: 42, train_loss: 0.5697, test_loss: 1.0371, test_f1: 0.5688
 epoch: 43, train_loss: 0.5666, test_loss: 0.8701, test_f1: 0.6319
 epoch: 44, train_loss: 0.5462, test_loss: 0.8237, test_f1: 0.6752
 epoch: 45, train_loss: 0.5595, test_loss: 0.8046, test_f1: 0.6190
 epoch: 46, train_loss: 0.5281, test_loss: 0.8994, test_f1: 0.6230
 epoch: 47, train_loss: 0.5142, test_loss: 0.8467, test_f1: 0.6292
 epoch: 48, train_loss: 0.5264, test_loss: 0.7774, test_f1: 0.6697
 epoch: 49, train_loss: 0.5407, test_loss: 0.7667, test_f1: 0.6717
 epoch: 50, train_loss: 0.5163, test_loss: 1.3083, test_f1: 0.5838
 epoch: 51, train_loss: 0.4682, test_loss: 0.8142, test_f1: 0.6659
 epoch: 52, train_loss: 0.4270, test_loss: 0.9042, test_f1: 0.6938
 epoch: 53, train_loss: 0.4222, test_loss: 0.8992, test_f1: 0.6484
 epoch: 54, train_loss: 0.4146, test_loss: 0.8459, test_f1: 0.6687
 epoch: 55, train_loss: 0.4039, test_loss: 0.9175, test_f1: 0.6586
 epoch: 56, train_loss: 0.3888, test_loss: 0.9022, test_f1: 0.6399
 epoch: 57, train_loss: 0.3785, test_loss: 0.9411, test_f1: 0.6488
 epoch: 58, train_loss: 0.3841, test_loss: 1.0036, test_f1: 0.6590
 epoch: 59, train_loss: 0.3784, test_loss: 0.9914, test_f1: 0.6438
 epoch: 60, train_loss: 0.3715, test_loss: 0.9923, test_f1: 0.6540
 epoch: 61, train_loss: 0.3826, test_loss: 0.9372, test_f1: 0.6594
 epoch: 62, train_loss: 0.3675, test_loss: 1.0188, test_f1: 0.6550
 epoch: 63, train_loss: 0.3828, test_loss: 0.8036, test_f1: 0.6825
 epoch: 64, train_loss: 0.3552, test_loss: 0.8690, test_f1: 0.6810
 epoch: 65, train_loss: 0.3518, test_loss: 0.9960, test_f1: 0.6779
 epoch: 66, train_loss: 0.3425, test_loss: 1.1064, test_f1: 0.6773
 epoch: 67, train_loss: 0.3504, test_loss: 1.1480, test_f1: 0.6584
 epoch: 68, train_loss: 0.3541, test_loss: 1.0163, test_f1: 0.6706
 epoch: 69, train_loss: 0.3407, test_loss: 1.0942, test_f1: 0.6732
 epoch: 70, train_loss: 0.3462, test_loss: 1.0128, test_f1: 0.6729
 epoch: 71, train_loss: 0.3425, test_loss: 1.0737, test_f1: 0.6607
 epoch: 72, train_loss: 0.3590, test_loss: 1.0730, test_f1: 0.6656
 epoch: 73, train_loss: 0.3503, test_loss: 1.0441, test_f1: 0.6774
 epoch: 74, train_loss: 0.3292, test_loss: 1.1033, test_f1: 0.6560
 epoch: 75, train_loss: 0.3202, test_loss: 1.0244, test_f1: 0.6772
 epoch: 76, train_loss: 0.3280, test_loss: 1.0153, test_f1: 0.6701
 epoch: 77, train_loss: 0.3210, test_loss: 1.0109, test_f1: 0.6694
 epoch: 78, train_loss: 0.3331, test_loss: 1.2970, test_f1: 0.6373
 epoch: 79, train_loss: 0.3201, test_loss: 1.3028, test_f1: 0.6496
 epoch: 80, train_loss: 0.3148, test_loss: 2.9602, test_f1: 0.4499
 epoch: 81, train_loss: 0.3139, test_loss: 1.1575, test_f1: 0.6760
 epoch: 82, train_loss: 0.3058, test_loss: 1.2741, test_f1: 0.6441
 epoch: 83, train_loss: 0.2800, test_loss: 1.2829, test_f1: 0.6654
 epoch: 84, train_loss: 0.2908, test_loss: 1.1287, test_f1: 0.6640
 epoch: 85, train_loss: 0.2917, test_loss: 1.0321, test_f1: 0.6830
 epoch: 86, train_loss: 0.2896, test_loss: 1.3177, test_f1: 0.6635
 epoch: 87, train_loss: 0.2818, test_loss: 1.2589, test_f1: 0.6395
 epoch: 88, train_loss: 0.2713, test_loss: 1.3324, test_f1: 0.6455
 epoch: 89, train_loss: 0.2955, test_loss: 1.2940, test_f1: 0.6466
 epoch: 90, train_loss: 0.2642, test_loss: 1.1139, test_f1: 0.6477
 epoch: 91, train_loss: 0.2906, test_loss: 1.1808, test_f1: 0.6670
 epoch: 92, train_loss: 0.2677, test_loss: 1.4165, test_f1: 0.6521
 epoch: 93, train_loss: 0.2564, test_loss: 1.3972, test_f1: 0.6745
 epoch: 94, train_loss: 0.2723, test_loss: 1.2217, test_f1: 0.6684
 epoch: 95, train_loss: 0.2584, test_loss: 1.4332, test_f1: 0.6417
 epoch: 96, train_loss: 0.2815, test_loss: 1.2237, test_f1: 0.6684
 epoch: 97, train_loss: 0.2793, test_loss: 1.3219, test_f1: 0.6752
 epoch: 98, train_loss: 0.2844, test_loss: 1.3332, test_f1: 0.6484
 epoch: 99, train_loss: 0.2984, test_loss: 1.3648, test_f1: 0.6645

Training completed in 615.44 seconds
Best F1: 0.7203 at epoch 61
Mean F1 across iterations: 0.7013  0.0124
========================FINAL RESULTS================================
FEGIN weighted F1: 0.7203  0.0124
python main.py --data ltspice_examples --representation component_pin_net --model FEGIN --layers 6 --hiddens 128 --batch_size 128 --lr 0.01 --emb_size 250 --epochs 100 --save_appendix component_pin_net_L6_H128_BS128_LR0.01_E250 --no_val
-----



STDERR:
  File "main.py", line 370, in <module>
    main()
  File "main.py", line 254, in main
    dataset = dataset_class(
  File "/home/philip/projects/ltspice_examples_code_repo/Circuit-Completion-Using-GNNs/component_classification_with_link_prediction_head/evaluation/FEGIN/kernel/circuit_datasets.py", line 15, in __init__
    self.data, self.slices = torch.load(self.processed_paths[0])
  File "/home/philip/.local/lib/python3.8/site-packages/torch/serialization.py", line 1040, in load
    warnings.warn(
  File "/usr/lib/python3.8/warnings.py", line 109, in _showwarnmsg
    sw(msg.message, msg.category, msg.filename, msg.lineno,
  File "main.py", line 47, in warn_with_traceback
    traceback.print_stack(file=log)
/home/philip/projects/ltspice_examples_code_repo/Circuit-Completion-Using-GNNs/component_classification_with_link_prediction_head/evaluation/FEGIN/kernel/circuit_datasets.py:15: FutureWarning: You are using `torch.load` with `weights_only=False` (the current default value), which uses the default pickle module implicitly. It is possible to construct malicious pickle data which will execute arbitrary code during unpickling (See https://github.com/pytorch/pytorch/blob/main/SECURITY.md#untrusted-models for more details). In a future release, the default value for `weights_only` will be flipped to `True`. This limits the functions that could be executed during unpickling. Arbitrary objects will no longer be allowed to be loaded via this mode unless they are explicitly allowlisted by the user via `torch.serialization.add_safe_globals`. We recommend you start setting `weights_only=True` for any use case where you don't have full control of the loaded file. Please open an issue on GitHub for any issues related to this experimental feature.
  self.data, self.slices = torch.load(self.processed_paths[0])
