STDOUT:
Results will be saved in /home/philip/projects/ltspice_examples_code_repo/Circuit-Completion-Using-GNNs/component_classification_with_link_prediction_head/evaluation/FEGIN/results/model_FEGIN_dataset_ltspice_demos
Command line input: python main.py --data ltspice_demos --representation component_pin --model FEGIN --layers 3 --hiddens 64 --batch_size 64 --lr 0.001 --emb_size 250 --epochs 100 --save_appendix component_pin_L3_H64_BS64_LR0.001_E250 --no_val
 is saved.
-----
ltspice_demos - FEGIN
Using 3 layers, 64 hidden units, h = 2
Loading component_pin representation dataset
ENTERED
Training FEGIN on component_pin representation
Train: 1565, Test: 383
##################ITERATION #0 ****************************************
 epoch: 0, train_loss: 1.3132, test_loss: 1.3036, test_f1: 0.2655
 epoch: 1, train_loss: 1.1782, test_loss: 1.2476, test_f1: 0.3480
 epoch: 2, train_loss: 1.1347, test_loss: 1.1982, test_f1: 0.4512
 epoch: 3, train_loss: 1.0857, test_loss: 1.1612, test_f1: 0.4593
 epoch: 4, train_loss: 1.0138, test_loss: 1.1204, test_f1: 0.4357
 epoch: 5, train_loss: 0.9723, test_loss: 1.0347, test_f1: 0.5082
 epoch: 6, train_loss: 0.9336, test_loss: 1.0141, test_f1: 0.5528
 epoch: 7, train_loss: 0.8811, test_loss: 1.0291, test_f1: 0.5536
 epoch: 8, train_loss: 0.8588, test_loss: 1.0179, test_f1: 0.5772
 epoch: 9, train_loss: 0.8206, test_loss: 1.0023, test_f1: 0.5932
 epoch: 10, train_loss: 0.8085, test_loss: 0.9814, test_f1: 0.6147
 epoch: 11, train_loss: 0.7693, test_loss: 0.9429, test_f1: 0.5861
 epoch: 12, train_loss: 0.7649, test_loss: 0.9661, test_f1: 0.6147
 epoch: 13, train_loss: 0.7394, test_loss: 1.0058, test_f1: 0.5786
 epoch: 14, train_loss: 0.7057, test_loss: 0.9613, test_f1: 0.6278
 epoch: 15, train_loss: 0.6939, test_loss: 0.9477, test_f1: 0.6446
 epoch: 16, train_loss: 0.6749, test_loss: 1.0442, test_f1: 0.5885
 epoch: 17, train_loss: 0.6748, test_loss: 0.9918, test_f1: 0.5484
 epoch: 18, train_loss: 0.6600, test_loss: 0.9708, test_f1: 0.5558
 epoch: 19, train_loss: 0.6377, test_loss: 1.0813, test_f1: 0.5718
 epoch: 20, train_loss: 0.6292, test_loss: 1.0634, test_f1: 0.5879
 epoch: 21, train_loss: 0.6103, test_loss: 1.0971, test_f1: 0.5401
 epoch: 22, train_loss: 0.5887, test_loss: 1.0880, test_f1: 0.5576
 epoch: 23, train_loss: 0.5737, test_loss: 1.0714, test_f1: 0.6225
 epoch: 24, train_loss: 0.5826, test_loss: 1.1410, test_f1: 0.6347
 epoch: 25, train_loss: 0.6041, test_loss: 1.0080, test_f1: 0.6466
 epoch: 26, train_loss: 0.5764, test_loss: 1.1322, test_f1: 0.6097
 epoch: 27, train_loss: 0.5573, test_loss: 1.1773, test_f1: 0.5895
 epoch: 28, train_loss: 0.5225, test_loss: 1.1473, test_f1: 0.6024
 epoch: 29, train_loss: 0.5208, test_loss: 1.0284, test_f1: 0.6364
 epoch: 30, train_loss: 0.5073, test_loss: 1.1373, test_f1: 0.5960
 epoch: 31, train_loss: 0.4874, test_loss: 1.1045, test_f1: 0.6678
 epoch: 32, train_loss: 0.5039, test_loss: 1.3162, test_f1: 0.5670
 epoch: 33, train_loss: 0.4839, test_loss: 1.2202, test_f1: 0.6375
 epoch: 34, train_loss: 0.4814, test_loss: 1.1633, test_f1: 0.6664
 epoch: 35, train_loss: 0.4547, test_loss: 1.2230, test_f1: 0.5894
 epoch: 36, train_loss: 0.4471, test_loss: 1.2042, test_f1: 0.6128
 epoch: 37, train_loss: 0.4060, test_loss: 1.4232, test_f1: 0.6367
 epoch: 38, train_loss: 0.4007, test_loss: 1.2155, test_f1: 0.6476
 epoch: 39, train_loss: 0.4144, test_loss: 1.2959, test_f1: 0.6394
 epoch: 40, train_loss: 0.3921, test_loss: 1.2691, test_f1: 0.6281
 epoch: 41, train_loss: 0.4021, test_loss: 1.4130, test_f1: 0.5896
 epoch: 42, train_loss: 0.3719, test_loss: 1.3620, test_f1: 0.6844
 epoch: 43, train_loss: 0.3490, test_loss: 1.4038, test_f1: 0.6274
 epoch: 44, train_loss: 0.3610, test_loss: 1.8056, test_f1: 0.5858
 epoch: 45, train_loss: 0.3871, test_loss: 1.6982, test_f1: 0.6430
 epoch: 46, train_loss: 0.3424, test_loss: 1.5489, test_f1: 0.5932
 epoch: 47, train_loss: 0.3227, test_loss: 1.6991, test_f1: 0.6344
 epoch: 48, train_loss: 0.3105, test_loss: 1.5921, test_f1: 0.6150
 epoch: 49, train_loss: 0.3068, test_loss: 1.6676, test_f1: 0.6189
 epoch: 50, train_loss: 0.2809, test_loss: 1.4663, test_f1: 0.6726
 epoch: 51, train_loss: 0.2771, test_loss: 1.5661, test_f1: 0.6372
 epoch: 52, train_loss: 0.2486, test_loss: 1.6769, test_f1: 0.5928
 epoch: 53, train_loss: 0.2323, test_loss: 1.6562, test_f1: 0.6467
 epoch: 54, train_loss: 0.2112, test_loss: 1.6263, test_f1: 0.6720
 epoch: 55, train_loss: 0.2046, test_loss: 1.8834, test_f1: 0.5809
 epoch: 56, train_loss: 0.2314, test_loss: 1.7607, test_f1: 0.6085
 epoch: 57, train_loss: 0.2410, test_loss: 2.0133, test_f1: 0.6120
 epoch: 58, train_loss: 0.1892, test_loss: 1.7972, test_f1: 0.6185
 epoch: 59, train_loss: 0.2015, test_loss: 1.9003, test_f1: 0.6076
 epoch: 60, train_loss: 0.1949, test_loss: 1.9970, test_f1: 0.6091
 epoch: 61, train_loss: 0.2066, test_loss: 2.0424, test_f1: 0.6625
 epoch: 62, train_loss: 0.1850, test_loss: 2.0584, test_f1: 0.6025
 epoch: 63, train_loss: 0.2115, test_loss: 2.1389, test_f1: 0.6116
 epoch: 64, train_loss: 0.2158, test_loss: 1.9199, test_f1: 0.6481
 epoch: 65, train_loss: 0.1769, test_loss: 1.9226, test_f1: 0.6188
 epoch: 66, train_loss: 0.1685, test_loss: 2.0003, test_f1: 0.6245
 epoch: 67, train_loss: 0.1540, test_loss: 2.2539, test_f1: 0.6036
 epoch: 68, train_loss: 0.1649, test_loss: 2.1980, test_f1: 0.5597
 epoch: 69, train_loss: 0.1548, test_loss: 2.0999, test_f1: 0.6394
 epoch: 70, train_loss: 0.1527, test_loss: 2.1417, test_f1: 0.6375
 epoch: 71, train_loss: 0.1641, test_loss: 2.1860, test_f1: 0.6128
 epoch: 72, train_loss: 0.1902, test_loss: 2.2848, test_f1: 0.6246
 epoch: 73, train_loss: 0.1643, test_loss: 2.3702, test_f1: 0.5705
 epoch: 74, train_loss: 0.1446, test_loss: 2.1060, test_f1: 0.6066
 epoch: 75, train_loss: 0.1597, test_loss: 2.3355, test_f1: 0.6152
 epoch: 76, train_loss: 0.1546, test_loss: 2.1472, test_f1: 0.6510
 epoch: 77, train_loss: 0.1434, test_loss: 2.2984, test_f1: 0.6197
 epoch: 78, train_loss: 0.1461, test_loss: 2.2029, test_f1: 0.6229
 epoch: 79, train_loss: 0.1468, test_loss: 2.3162, test_f1: 0.6133
 epoch: 80, train_loss: 0.1661, test_loss: 2.2561, test_f1: 0.6440
 epoch: 81, train_loss: 0.1704, test_loss: 2.1802, test_f1: 0.6004
 epoch: 82, train_loss: 0.1425, test_loss: 2.1815, test_f1: 0.6494
 epoch: 83, train_loss: 0.1290, test_loss: 2.3479, test_f1: 0.6288
 epoch: 84, train_loss: 0.1454, test_loss: 2.6408, test_f1: 0.6440
 epoch: 85, train_loss: 0.1348, test_loss: 2.2249, test_f1: 0.6485
 epoch: 86, train_loss: 0.1595, test_loss: 2.3674, test_f1: 0.6514
 epoch: 87, train_loss: 0.1504, test_loss: 2.5848, test_f1: 0.6113
 epoch: 88, train_loss: 0.1516, test_loss: 2.5460, test_f1: 0.6402
 epoch: 89, train_loss: 0.1745, test_loss: 2.4942, test_f1: 0.6027
 epoch: 90, train_loss: 0.1721, test_loss: 2.2351, test_f1: 0.6416
 epoch: 91, train_loss: 0.1315, test_loss: 2.3581, test_f1: 0.5872
 epoch: 92, train_loss: 0.1347, test_loss: 2.4714, test_f1: 0.5974
 epoch: 93, train_loss: 0.1189, test_loss: 2.6360, test_f1: 0.6040
 epoch: 94, train_loss: 0.1492, test_loss: 2.1709, test_f1: 0.6204
 epoch: 95, train_loss: 0.1063, test_loss: 2.7439, test_f1: 0.6065
 epoch: 96, train_loss: 0.1256, test_loss: 2.4180, test_f1: 0.6350
 epoch: 97, train_loss: 0.1062, test_loss: 2.5134, test_f1: 0.6314
 epoch: 98, train_loss: 0.1227, test_loss: 2.6323, test_f1: 0.6104
 epoch: 99, train_loss: 0.1223, test_loss: 2.5005, test_f1: 0.6445
##################ITERATION #1 ****************************************
 epoch: 0, train_loss: 1.2018, test_loss: 1.3091, test_f1: 0.2587
 epoch: 1, train_loss: 1.0457, test_loss: 1.3218, test_f1: 0.3493
 epoch: 2, train_loss: 0.9721, test_loss: 1.0358, test_f1: 0.5759
 epoch: 3, train_loss: 0.8898, test_loss: 1.0263, test_f1: 0.5598
 epoch: 4, train_loss: 0.8588, test_loss: 1.0090, test_f1: 0.5971
 epoch: 5, train_loss: 0.8153, test_loss: 0.9764, test_f1: 0.5282
 epoch: 6, train_loss: 0.7857, test_loss: 0.9306, test_f1: 0.6146
 epoch: 7, train_loss: 0.7618, test_loss: 0.9337, test_f1: 0.6007
 epoch: 8, train_loss: 0.7308, test_loss: 0.9389, test_f1: 0.6536
 epoch: 9, train_loss: 0.7341, test_loss: 1.1164, test_f1: 0.5786
 epoch: 10, train_loss: 0.7117, test_loss: 0.9608, test_f1: 0.6250
 epoch: 11, train_loss: 0.6910, test_loss: 1.0335, test_f1: 0.6339
 epoch: 12, train_loss: 0.6718, test_loss: 1.1038, test_f1: 0.5925
 epoch: 13, train_loss: 0.6554, test_loss: 1.0041, test_f1: 0.6363
 epoch: 14, train_loss: 0.6445, test_loss: 1.0023, test_f1: 0.6163
 epoch: 15, train_loss: 0.6367, test_loss: 1.2085, test_f1: 0.6044
 epoch: 16, train_loss: 0.6204, test_loss: 1.1281, test_f1: 0.6275
 epoch: 17, train_loss: 0.6193, test_loss: 1.0210, test_f1: 0.6242
 epoch: 18, train_loss: 0.6008, test_loss: 1.0262, test_f1: 0.6396
 epoch: 19, train_loss: 0.5828, test_loss: 1.2130, test_f1: 0.5788
 epoch: 20, train_loss: 0.5551, test_loss: 1.0659, test_f1: 0.6254
 epoch: 21, train_loss: 0.5708, test_loss: 1.3442, test_f1: 0.6039
 epoch: 22, train_loss: 0.5336, test_loss: 1.2569, test_f1: 0.5557
 epoch: 23, train_loss: 0.5236, test_loss: 1.1443, test_f1: 0.6746
 epoch: 24, train_loss: 0.5189, test_loss: 1.3013, test_f1: 0.5685
 epoch: 25, train_loss: 0.5501, test_loss: 1.4534, test_f1: 0.5766
 epoch: 26, train_loss: 0.4913, test_loss: 1.1944, test_f1: 0.6426
 epoch: 27, train_loss: 0.4790, test_loss: 1.3752, test_f1: 0.5872
 epoch: 28, train_loss: 0.4993, test_loss: 1.3478, test_f1: 0.6241
 epoch: 29, train_loss: 0.4684, test_loss: 1.4777, test_f1: 0.6098
 epoch: 30, train_loss: 0.4236, test_loss: 1.3033, test_f1: 0.6383
 epoch: 31, train_loss: 0.4514, test_loss: 1.3519, test_f1: 0.6205
 epoch: 32, train_loss: 0.4399, test_loss: 1.5402, test_f1: 0.6089
 epoch: 33, train_loss: 0.4269, test_loss: 1.5746, test_f1: 0.6410
 epoch: 34, train_loss: 0.4266, test_loss: 1.8002, test_f1: 0.5487
 epoch: 35, train_loss: 0.3960, test_loss: 1.6171, test_f1: 0.5850
 epoch: 36, train_loss: 0.3825, test_loss: 1.5157, test_f1: 0.6324
 epoch: 37, train_loss: 0.3636, test_loss: 1.5002, test_f1: 0.6088
 epoch: 38, train_loss: 0.3480, test_loss: 1.9558, test_f1: 0.5717
 epoch: 39, train_loss: 0.3802, test_loss: 1.6941, test_f1: 0.5878
 epoch: 40, train_loss: 0.3548, test_loss: 1.7347, test_f1: 0.5761
 epoch: 41, train_loss: 0.3635, test_loss: 1.7126, test_f1: 0.5971
 epoch: 42, train_loss: 0.3737, test_loss: 1.7568, test_f1: 0.6178
 epoch: 43, train_loss: 0.3685, test_loss: 1.5876, test_f1: 0.6746
 epoch: 44, train_loss: 0.3476, test_loss: 1.9059, test_f1: 0.5704
 epoch: 45, train_loss: 0.3440, test_loss: 1.8113, test_f1: 0.6588
 epoch: 46, train_loss: 0.3191, test_loss: 2.0545, test_f1: 0.6369
 epoch: 47, train_loss: 0.3189, test_loss: 1.9998, test_f1: 0.6268
 epoch: 48, train_loss: 0.2876, test_loss: 2.1085, test_f1: 0.5571
 epoch: 49, train_loss: 0.2969, test_loss: 1.9616, test_f1: 0.6009
 epoch: 50, train_loss: 0.3090, test_loss: 1.6578, test_f1: 0.6474
 epoch: 51, train_loss: 0.2581, test_loss: 1.9453, test_f1: 0.6320
 epoch: 52, train_loss: 0.2392, test_loss: 1.9950, test_f1: 0.6339
 epoch: 53, train_loss: 0.2074, test_loss: 2.2219, test_f1: 0.6080
 epoch: 54, train_loss: 0.2085, test_loss: 2.2053, test_f1: 0.6269
 epoch: 55, train_loss: 0.2178, test_loss: 2.1495, test_f1: 0.6395
 epoch: 56, train_loss: 0.2182, test_loss: 2.3642, test_f1: 0.5904
 epoch: 57, train_loss: 0.2077, test_loss: 2.2711, test_f1: 0.6254
 epoch: 58, train_loss: 0.2051, test_loss: 2.2899, test_f1: 0.6486
 epoch: 59, train_loss: 0.2049, test_loss: 2.2611, test_f1: 0.6416
 epoch: 60, train_loss: 0.1767, test_loss: 2.4638, test_f1: 0.6316
 epoch: 61, train_loss: 0.1693, test_loss: 2.1511, test_f1: 0.6417
 epoch: 62, train_loss: 0.1925, test_loss: 2.4793, test_f1: 0.6342
 epoch: 63, train_loss: 0.1854, test_loss: 2.4349, test_f1: 0.6195
 epoch: 64, train_loss: 0.1748, test_loss: 2.6216, test_f1: 0.6154
 epoch: 65, train_loss: 0.1755, test_loss: 2.3966, test_f1: 0.6099
 epoch: 66, train_loss: 0.1826, test_loss: 2.6507, test_f1: 0.6289
 epoch: 67, train_loss: 0.1747, test_loss: 2.4657, test_f1: 0.6291
 epoch: 68, train_loss: 0.1704, test_loss: 2.6347, test_f1: 0.6260
 epoch: 69, train_loss: 0.1665, test_loss: 2.7940, test_f1: 0.6265
 epoch: 70, train_loss: 0.1681, test_loss: 2.6694, test_f1: 0.5901
 epoch: 71, train_loss: 0.1784, test_loss: 2.5980, test_f1: 0.6012
 epoch: 72, train_loss: 0.1564, test_loss: 2.6370, test_f1: 0.6232
 epoch: 73, train_loss: 0.1516, test_loss: 2.6536, test_f1: 0.6189
 epoch: 74, train_loss: 0.1417, test_loss: 2.6590, test_f1: 0.6118
 epoch: 75, train_loss: 0.1471, test_loss: 2.7102, test_f1: 0.6020
 epoch: 76, train_loss: 0.1486, test_loss: 2.8479, test_f1: 0.6246
 epoch: 77, train_loss: 0.1775, test_loss: 2.6268, test_f1: 0.6256
 epoch: 78, train_loss: 0.1766, test_loss: 2.5618, test_f1: 0.6451
 epoch: 79, train_loss: 0.1599, test_loss: 2.9095, test_f1: 0.5904
 epoch: 80, train_loss: 0.1498, test_loss: 2.7765, test_f1: 0.6191
 epoch: 81, train_loss: 0.1574, test_loss: 2.8137, test_f1: 0.6077
 epoch: 82, train_loss: 0.1301, test_loss: 2.8699, test_f1: 0.6357
 epoch: 83, train_loss: 0.1741, test_loss: 2.7415, test_f1: 0.6291
 epoch: 84, train_loss: 0.1339, test_loss: 2.7627, test_f1: 0.6112
 epoch: 85, train_loss: 0.1204, test_loss: 2.9735, test_f1: 0.6347
 epoch: 86, train_loss: 0.1236, test_loss: 2.9250, test_f1: 0.6148
 epoch: 87, train_loss: 0.1216, test_loss: 2.9010, test_f1: 0.6398
 epoch: 88, train_loss: 0.1262, test_loss: 2.9067, test_f1: 0.5978
 epoch: 89, train_loss: 0.1307, test_loss: 2.9391, test_f1: 0.6298
 epoch: 90, train_loss: 0.1486, test_loss: 2.8704, test_f1: 0.6463
 epoch: 91, train_loss: 0.1231, test_loss: 2.9795, test_f1: 0.6310
 epoch: 92, train_loss: 0.1113, test_loss: 3.2808, test_f1: 0.6126
 epoch: 93, train_loss: 0.1206, test_loss: 3.1123, test_f1: 0.6107
 epoch: 94, train_loss: 0.1411, test_loss: 3.0454, test_f1: 0.6034
 epoch: 95, train_loss: 0.1286, test_loss: 2.9395, test_f1: 0.6165
 epoch: 96, train_loss: 0.1236, test_loss: 3.0828, test_f1: 0.6346
 epoch: 97, train_loss: 0.1033, test_loss: 3.1632, test_f1: 0.6229
 epoch: 98, train_loss: 0.1112, test_loss: 3.2070, test_f1: 0.6355
 epoch: 99, train_loss: 0.1530, test_loss: 3.4386, test_f1: 0.6052
##################ITERATION #2 ****************************************
 epoch: 0, train_loss: 1.1704, test_loss: 1.2897, test_f1: 0.4017
 epoch: 1, train_loss: 0.9893, test_loss: 1.1119, test_f1: 0.5026
 epoch: 2, train_loss: 0.9153, test_loss: 1.0103, test_f1: 0.5864
 epoch: 3, train_loss: 0.8740, test_loss: 0.9632, test_f1: 0.6177
 epoch: 4, train_loss: 0.8328, test_loss: 0.9202, test_f1: 0.6236
 epoch: 5, train_loss: 0.7991, test_loss: 1.2175, test_f1: 0.4789
 epoch: 6, train_loss: 0.8014, test_loss: 0.9938, test_f1: 0.5572
 epoch: 7, train_loss: 0.7713, test_loss: 0.9012, test_f1: 0.6129
 epoch: 8, train_loss: 0.6959, test_loss: 1.1694, test_f1: 0.5254
 epoch: 9, train_loss: 0.7019, test_loss: 0.8962, test_f1: 0.6342
 epoch: 10, train_loss: 0.6985, test_loss: 0.9906, test_f1: 0.5173
 epoch: 11, train_loss: 0.6650, test_loss: 1.2024, test_f1: 0.5110
 epoch: 12, train_loss: 0.6411, test_loss: 1.0014, test_f1: 0.5819
 epoch: 13, train_loss: 0.6354, test_loss: 1.0350, test_f1: 0.5818
 epoch: 14, train_loss: 0.6145, test_loss: 0.9836, test_f1: 0.5712
 epoch: 15, train_loss: 0.6073, test_loss: 1.0141, test_f1: 0.6126
 epoch: 16, train_loss: 0.6065, test_loss: 1.1657, test_f1: 0.5366
 epoch: 17, train_loss: 0.5907, test_loss: 0.9900, test_f1: 0.5675
 epoch: 18, train_loss: 0.5695, test_loss: 1.1604, test_f1: 0.5747
 epoch: 19, train_loss: 0.5631, test_loss: 1.1446, test_f1: 0.5906
 epoch: 20, train_loss: 0.5389, test_loss: 1.1949, test_f1: 0.5609
 epoch: 21, train_loss: 0.5221, test_loss: 1.2849, test_f1: 0.5958
 epoch: 22, train_loss: 0.5268, test_loss: 1.2532, test_f1: 0.5500
 epoch: 23, train_loss: 0.5593, test_loss: 1.3696, test_f1: 0.5676
 epoch: 24, train_loss: 0.5349, test_loss: 1.1337, test_f1: 0.6246
 epoch: 25, train_loss: 0.5010, test_loss: 1.2178, test_f1: 0.5470
 epoch: 26, train_loss: 0.4879, test_loss: 1.4477, test_f1: 0.5334
 epoch: 27, train_loss: 0.4961, test_loss: 1.1155, test_f1: 0.6423
 epoch: 28, train_loss: 0.4504, test_loss: 1.3469, test_f1: 0.5729
 epoch: 29, train_loss: 0.4467, test_loss: 1.3540, test_f1: 0.6035
 epoch: 30, train_loss: 0.4621, test_loss: 1.2979, test_f1: 0.5408
 epoch: 31, train_loss: 0.4193, test_loss: 1.4063, test_f1: 0.6058
 epoch: 32, train_loss: 0.3892, test_loss: 1.2610, test_f1: 0.6234
 epoch: 33, train_loss: 0.3819, test_loss: 1.5234, test_f1: 0.5529
 epoch: 34, train_loss: 0.4258, test_loss: 1.4897, test_f1: 0.5403
 epoch: 35, train_loss: 0.4049, test_loss: 1.4438, test_f1: 0.5924
 epoch: 36, train_loss: 0.3727, test_loss: 1.3768, test_f1: 0.5614
 epoch: 37, train_loss: 0.3908, test_loss: 1.6698, test_f1: 0.5336
 epoch: 38, train_loss: 0.3570, test_loss: 1.4770, test_f1: 0.6440
 epoch: 39, train_loss: 0.3258, test_loss: 1.7894, test_f1: 0.5316
 epoch: 40, train_loss: 0.3852, test_loss: 1.5911, test_f1: 0.5937
 epoch: 41, train_loss: 0.3803, test_loss: 1.4360, test_f1: 0.6160
 epoch: 42, train_loss: 0.3460, test_loss: 1.4268, test_f1: 0.6142
 epoch: 43, train_loss: 0.3354, test_loss: 1.6627, test_f1: 0.5831
 epoch: 44, train_loss: 0.3272, test_loss: 1.6372, test_f1: 0.6170
 epoch: 45, train_loss: 0.3040, test_loss: 1.5889, test_f1: 0.6140
 epoch: 46, train_loss: 0.3135, test_loss: 1.6257, test_f1: 0.5923
 epoch: 47, train_loss: 0.2983, test_loss: 1.8168, test_f1: 0.5392
 epoch: 48, train_loss: 0.2669, test_loss: 1.6848, test_f1: 0.6378
 epoch: 49, train_loss: 0.3050, test_loss: 1.7797, test_f1: 0.5824
 epoch: 50, train_loss: 0.2691, test_loss: 1.7599, test_f1: 0.6222
 epoch: 51, train_loss: 0.2441, test_loss: 1.7529, test_f1: 0.5678
 epoch: 52, train_loss: 0.2449, test_loss: 1.9189, test_f1: 0.6017
 epoch: 53, train_loss: 0.2088, test_loss: 1.8807, test_f1: 0.5855
 epoch: 54, train_loss: 0.1951, test_loss: 1.7777, test_f1: 0.6183
 epoch: 55, train_loss: 0.2063, test_loss: 2.0556, test_f1: 0.6136
 epoch: 56, train_loss: 0.1987, test_loss: 1.9710, test_f1: 0.6148
 epoch: 57, train_loss: 0.1753, test_loss: 2.0457, test_f1: 0.5935
 epoch: 58, train_loss: 0.1820, test_loss: 2.0875, test_f1: 0.6014
 epoch: 59, train_loss: 0.1934, test_loss: 1.9919, test_f1: 0.6008
 epoch: 60, train_loss: 0.1731, test_loss: 2.1201, test_f1: 0.6277
 epoch: 61, train_loss: 0.1599, test_loss: 2.0755, test_f1: 0.5923
 epoch: 62, train_loss: 0.1739, test_loss: 2.2478, test_f1: 0.5787
 epoch: 63, train_loss: 0.2001, test_loss: 1.9795, test_f1: 0.6335
 epoch: 64, train_loss: 0.1710, test_loss: 2.2176, test_f1: 0.6010
 epoch: 65, train_loss: 0.1538, test_loss: 2.0703, test_f1: 0.5954
 epoch: 66, train_loss: 0.1575, test_loss: 2.0793, test_f1: 0.6213
 epoch: 67, train_loss: 0.1558, test_loss: 2.2333, test_f1: 0.5884
 epoch: 68, train_loss: 0.2013, test_loss: 2.2088, test_f1: 0.6284
 epoch: 69, train_loss: 0.1945, test_loss: 2.1029, test_f1: 0.6110
 epoch: 70, train_loss: 0.1624, test_loss: 2.1559, test_f1: 0.6183
 epoch: 71, train_loss: 0.1335, test_loss: 2.3470, test_f1: 0.6147
 epoch: 72, train_loss: 0.1264, test_loss: 2.1846, test_f1: 0.6240
 epoch: 73, train_loss: 0.1628, test_loss: 2.1838, test_f1: 0.6041
 epoch: 74, train_loss: 0.1457, test_loss: 2.4346, test_f1: 0.5879
 epoch: 75, train_loss: 0.1405, test_loss: 2.5427, test_f1: 0.5931
 epoch: 76, train_loss: 0.1358, test_loss: 2.3817, test_f1: 0.5868
 epoch: 77, train_loss: 0.1638, test_loss: 2.6391, test_f1: 0.6277
 epoch: 78, train_loss: 0.1779, test_loss: 2.1327, test_f1: 0.6158
 epoch: 79, train_loss: 0.1768, test_loss: 2.4017, test_f1: 0.6100
 epoch: 80, train_loss: 0.1418, test_loss: 2.5599, test_f1: 0.5975
 epoch: 81, train_loss: 0.1445, test_loss: 2.4916, test_f1: 0.5936
 epoch: 82, train_loss: 0.1553, test_loss: 2.3352, test_f1: 0.6003
 epoch: 83, train_loss: 0.1537, test_loss: 2.6235, test_f1: 0.6029
 epoch: 84, train_loss: 0.1355, test_loss: 2.4112, test_f1: 0.5944
 epoch: 85, train_loss: 0.1239, test_loss: 2.5345, test_f1: 0.5915
 epoch: 86, train_loss: 0.1513, test_loss: 2.7685, test_f1: 0.5924
 epoch: 87, train_loss: 0.1446, test_loss: 2.5164, test_f1: 0.6028
 epoch: 88, train_loss: 0.1494, test_loss: 2.4572, test_f1: 0.5964
 epoch: 89, train_loss: 0.1220, test_loss: 2.7556, test_f1: 0.5591
 epoch: 90, train_loss: 0.1295, test_loss: 2.3728, test_f1: 0.5871
 epoch: 91, train_loss: 0.1163, test_loss: 2.5434, test_f1: 0.6148
 epoch: 92, train_loss: 0.1063, test_loss: 2.6314, test_f1: 0.6118
 epoch: 93, train_loss: 0.1029, test_loss: 2.7174, test_f1: 0.6150
 epoch: 94, train_loss: 0.1055, test_loss: 2.7252, test_f1: 0.6194
 epoch: 95, train_loss: 0.1223, test_loss: 2.5365, test_f1: 0.6156
 epoch: 96, train_loss: 0.1052, test_loss: 2.5640, test_f1: 0.6105
 epoch: 97, train_loss: 0.1331, test_loss: 2.8893, test_f1: 0.6183
 epoch: 98, train_loss: 0.1187, test_loss: 2.6735, test_f1: 0.6042
 epoch: 99, train_loss: 0.1225, test_loss: 2.6342, test_f1: 0.6070
##################ITERATION #3 ****************************************
 epoch: 0, train_loss: 1.2204, test_loss: 1.3003, test_f1: 0.1907
 epoch: 1, train_loss: 1.0083, test_loss: 1.2204, test_f1: 0.3685
 epoch: 2, train_loss: 0.9516, test_loss: 1.1399, test_f1: 0.5130
 epoch: 3, train_loss: 0.9156, test_loss: 1.0277, test_f1: 0.5512
 epoch: 4, train_loss: 0.8860, test_loss: 0.9959, test_f1: 0.5704
 epoch: 5, train_loss: 0.8543, test_loss: 0.9428, test_f1: 0.5919
 epoch: 6, train_loss: 0.8086, test_loss: 1.0008, test_f1: 0.5765
 epoch: 7, train_loss: 0.7750, test_loss: 1.1505, test_f1: 0.5222
 epoch: 8, train_loss: 0.7615, test_loss: 0.9662, test_f1: 0.5137
 epoch: 9, train_loss: 0.7394, test_loss: 0.9767, test_f1: 0.5744
 epoch: 10, train_loss: 0.7293, test_loss: 0.9756, test_f1: 0.5533
 epoch: 11, train_loss: 0.7124, test_loss: 1.1790, test_f1: 0.5721
 epoch: 12, train_loss: 0.6793, test_loss: 0.9711, test_f1: 0.5808
 epoch: 13, train_loss: 0.6653, test_loss: 1.2506, test_f1: 0.5259
 epoch: 14, train_loss: 0.6736, test_loss: 1.1116, test_f1: 0.5953
 epoch: 15, train_loss: 0.6406, test_loss: 0.9948, test_f1: 0.5861
 epoch: 16, train_loss: 0.6096, test_loss: 1.0614, test_f1: 0.5518
 epoch: 17, train_loss: 0.6204, test_loss: 1.2172, test_f1: 0.5534
 epoch: 18, train_loss: 0.5995, test_loss: 1.0626, test_f1: 0.5370
 epoch: 19, train_loss: 0.5846, test_loss: 1.0728, test_f1: 0.5922
 epoch: 20, train_loss: 0.5696, test_loss: 1.3317, test_f1: 0.5417
 epoch: 21, train_loss: 0.5665, test_loss: 1.3494, test_f1: 0.5377
 epoch: 22, train_loss: 0.5641, test_loss: 1.2257, test_f1: 0.5496
 epoch: 23, train_loss: 0.5457, test_loss: 1.1619, test_f1: 0.6245
 epoch: 24, train_loss: 0.5079, test_loss: 1.3531, test_f1: 0.5479
 epoch: 25, train_loss: 0.5173, test_loss: 1.5291, test_f1: 0.5424
 epoch: 26, train_loss: 0.5069, test_loss: 1.1634, test_f1: 0.5080
 epoch: 27, train_loss: 0.5236, test_loss: 1.2549, test_f1: 0.5722
 epoch: 28, train_loss: 0.4799, test_loss: 0.9792, test_f1: 0.6213
 epoch: 29, train_loss: 0.4779, test_loss: 1.2968, test_f1: 0.5349
 epoch: 30, train_loss: 0.4691, test_loss: 1.3673, test_f1: 0.5775
 epoch: 31, train_loss: 0.4477, test_loss: 1.6497, test_f1: 0.5328
 epoch: 32, train_loss: 0.4277, test_loss: 1.4074, test_f1: 0.5336
 epoch: 33, train_loss: 0.4400, test_loss: 1.4838, test_f1: 0.5344
 epoch: 34, train_loss: 0.4198, test_loss: 1.2661, test_f1: 0.5519
 epoch: 35, train_loss: 0.4309, test_loss: 1.3628, test_f1: 0.5976
 epoch: 36, train_loss: 0.4263, test_loss: 1.2442, test_f1: 0.5892
 epoch: 37, train_loss: 0.4091, test_loss: 1.1443, test_f1: 0.6300
 epoch: 38, train_loss: 0.3812, test_loss: 1.2273, test_f1: 0.6160
 epoch: 39, train_loss: 0.3611, test_loss: 1.2368, test_f1: 0.6210
 epoch: 40, train_loss: 0.3495, test_loss: 1.8567, test_f1: 0.5200
 epoch: 41, train_loss: 0.4160, test_loss: 1.3082, test_f1: 0.6457
 epoch: 42, train_loss: 0.3697, test_loss: 1.4123, test_f1: 0.5816
 epoch: 43, train_loss: 0.3521, test_loss: 1.3629, test_f1: 0.5673
 epoch: 44, train_loss: 0.3457, test_loss: 1.3381, test_f1: 0.5838
 epoch: 45, train_loss: 0.3584, test_loss: 1.3090, test_f1: 0.5974
 epoch: 46, train_loss: 0.3434, test_loss: 1.3497, test_f1: 0.5721
 epoch: 47, train_loss: 0.3432, test_loss: 1.5995, test_f1: 0.5954
 epoch: 48, train_loss: 0.3296, test_loss: 1.3232, test_f1: 0.5817
 epoch: 49, train_loss: 0.2955, test_loss: 1.6326, test_f1: 0.5879
 epoch: 50, train_loss: 0.3011, test_loss: 1.3868, test_f1: 0.6203
 epoch: 51, train_loss: 0.2510, test_loss: 1.2907, test_f1: 0.6217
 epoch: 52, train_loss: 0.2344, test_loss: 1.4580, test_f1: 0.6283
 epoch: 53, train_loss: 0.2332, test_loss: 1.4626, test_f1: 0.6217
 epoch: 54, train_loss: 0.2075, test_loss: 1.7095, test_f1: 0.5989
 epoch: 55, train_loss: 0.1970, test_loss: 1.5919, test_f1: 0.6234
 epoch: 56, train_loss: 0.2147, test_loss: 1.7069, test_f1: 0.5982
 epoch: 57, train_loss: 0.1891, test_loss: 1.6210, test_f1: 0.5858
 epoch: 58, train_loss: 0.1877, test_loss: 1.8065, test_f1: 0.6134
 epoch: 59, train_loss: 0.1995, test_loss: 1.8376, test_f1: 0.6103
 epoch: 60, train_loss: 0.1866, test_loss: 1.8522, test_f1: 0.5887
 epoch: 61, train_loss: 0.2016, test_loss: 1.7253, test_f1: 0.6084
 epoch: 62, train_loss: 0.1789, test_loss: 1.8236, test_f1: 0.6111
 epoch: 63, train_loss: 0.1658, test_loss: 1.8418, test_f1: 0.6112
 epoch: 64, train_loss: 0.1685, test_loss: 1.6737, test_f1: 0.6193
 epoch: 65, train_loss: 0.1662, test_loss: 2.0002, test_f1: 0.5842
 epoch: 66, train_loss: 0.1798, test_loss: 2.0473, test_f1: 0.5965
 epoch: 67, train_loss: 0.1676, test_loss: 1.9688, test_f1: 0.6097
 epoch: 68, train_loss: 0.2050, test_loss: 1.8892, test_f1: 0.6207
 epoch: 69, train_loss: 0.1666, test_loss: 1.9443, test_f1: 0.5978
 epoch: 70, train_loss: 0.1838, test_loss: 1.9904, test_f1: 0.5864
 epoch: 71, train_loss: 0.1779, test_loss: 2.0890, test_f1: 0.5993
 epoch: 72, train_loss: 0.1740, test_loss: 1.9225, test_f1: 0.6350
 epoch: 73, train_loss: 0.1700, test_loss: 2.0421, test_f1: 0.5789
 epoch: 74, train_loss: 0.1830, test_loss: 1.9976, test_f1: 0.6089
 epoch: 75, train_loss: 0.1628, test_loss: 2.0610, test_f1: 0.6043
 epoch: 76, train_loss: 0.1514, test_loss: 1.9205, test_f1: 0.6039
 epoch: 77, train_loss: 0.1878, test_loss: 1.9117, test_f1: 0.6222
 epoch: 78, train_loss: 0.1488, test_loss: 2.2038, test_f1: 0.6018
 epoch: 79, train_loss: 0.1470, test_loss: 2.1357, test_f1: 0.6112
 epoch: 80, train_loss: 0.1693, test_loss: 2.2966, test_f1: 0.6006
 epoch: 81, train_loss: 0.1578, test_loss: 2.2089, test_f1: 0.5976
 epoch: 82, train_loss: 0.1639, test_loss: 2.0849, test_f1: 0.5886
 epoch: 83, train_loss: 0.1384, test_loss: 1.9489, test_f1: 0.6108
 epoch: 84, train_loss: 0.1378, test_loss: 2.1845, test_f1: 0.5664
 epoch: 85, train_loss: 0.1165, test_loss: 2.1754, test_f1: 0.6051
 epoch: 86, train_loss: 0.1220, test_loss: 2.4173, test_f1: 0.6070
 epoch: 87, train_loss: 0.1345, test_loss: 1.9955, test_f1: 0.5873
 epoch: 88, train_loss: 0.1185, test_loss: 2.3747, test_f1: 0.5871
 epoch: 89, train_loss: 0.1201, test_loss: 2.1276, test_f1: 0.6157
 epoch: 90, train_loss: 0.1233, test_loss: 2.4467, test_f1: 0.5908
 epoch: 91, train_loss: 0.1286, test_loss: 2.4042, test_f1: 0.5852
 epoch: 92, train_loss: 0.1196, test_loss: 2.3757, test_f1: 0.5567
 epoch: 93, train_loss: 0.1150, test_loss: 2.4416, test_f1: 0.5766
 epoch: 94, train_loss: 0.1363, test_loss: 2.1222, test_f1: 0.5918
 epoch: 95, train_loss: 0.1447, test_loss: 2.2418, test_f1: 0.6171
 epoch: 96, train_loss: 0.1365, test_loss: 2.2400, test_f1: 0.6114
 epoch: 97, train_loss: 0.1383, test_loss: 2.4231, test_f1: 0.6098
 epoch: 98, train_loss: 0.1176, test_loss: 2.4949, test_f1: 0.6209
 epoch: 99, train_loss: 0.1088, test_loss: 2.5118, test_f1: 0.5827
##################ITERATION #4 ****************************************
 epoch: 0, train_loss: 1.2186, test_loss: 1.4465, test_f1: 0.1374
 epoch: 1, train_loss: 1.0026, test_loss: 1.2565, test_f1: 0.3355
 epoch: 2, train_loss: 0.9489, test_loss: 1.0646, test_f1: 0.5425
 epoch: 3, train_loss: 0.9047, test_loss: 0.9989, test_f1: 0.6080
 epoch: 4, train_loss: 0.8556, test_loss: 1.0138, test_f1: 0.5708
 epoch: 5, train_loss: 0.8134, test_loss: 1.0242, test_f1: 0.5636
 epoch: 6, train_loss: 0.7861, test_loss: 0.9935, test_f1: 0.5750
 epoch: 7, train_loss: 0.7716, test_loss: 0.9945, test_f1: 0.6219
 epoch: 8, train_loss: 0.7712, test_loss: 0.9866, test_f1: 0.5555
 epoch: 9, train_loss: 0.7210, test_loss: 1.0297, test_f1: 0.5203
 epoch: 10, train_loss: 0.7168, test_loss: 1.0706, test_f1: 0.6010
 epoch: 11, train_loss: 0.7071, test_loss: 1.0499, test_f1: 0.5474
 epoch: 12, train_loss: 0.6870, test_loss: 0.9757, test_f1: 0.5802
 epoch: 13, train_loss: 0.6483, test_loss: 1.0303, test_f1: 0.5471
 epoch: 14, train_loss: 0.6314, test_loss: 1.0040, test_f1: 0.5704
 epoch: 15, train_loss: 0.6124, test_loss: 1.0033, test_f1: 0.6018
 epoch: 16, train_loss: 0.6155, test_loss: 0.9856, test_f1: 0.6228
 epoch: 17, train_loss: 0.5920, test_loss: 1.1295, test_f1: 0.6185
 epoch: 18, train_loss: 0.5836, test_loss: 1.0305, test_f1: 0.6332
 epoch: 19, train_loss: 0.5710, test_loss: 1.1028, test_f1: 0.6434
 epoch: 20, train_loss: 0.5317, test_loss: 1.0545, test_f1: 0.6293
 epoch: 21, train_loss: 0.5536, test_loss: 1.2561, test_f1: 0.5661
 epoch: 22, train_loss: 0.5449, test_loss: 1.0880, test_f1: 0.6123
 epoch: 23, train_loss: 0.5188, test_loss: 1.1730, test_f1: 0.6428
 epoch: 24, train_loss: 0.5026, test_loss: 1.1964, test_f1: 0.5919
 epoch: 25, train_loss: 0.5215, test_loss: 1.1843, test_f1: 0.6433
 epoch: 26, train_loss: 0.5059, test_loss: 1.1632, test_f1: 0.6108
 epoch: 27, train_loss: 0.4579, test_loss: 1.1768, test_f1: 0.5889
 epoch: 28, train_loss: 0.4476, test_loss: 1.1589, test_f1: 0.5947
 epoch: 29, train_loss: 0.4501, test_loss: 1.2275, test_f1: 0.6329
 epoch: 30, train_loss: 0.4250, test_loss: 1.3502, test_f1: 0.6443
 epoch: 31, train_loss: 0.4193, test_loss: 1.2812, test_f1: 0.6488
 epoch: 32, train_loss: 0.4063, test_loss: 1.3102, test_f1: 0.6439
 epoch: 33, train_loss: 0.3976, test_loss: 1.1543, test_f1: 0.6732
 epoch: 34, train_loss: 0.3850, test_loss: 1.3844, test_f1: 0.6078
 epoch: 35, train_loss: 0.3849, test_loss: 1.5584, test_f1: 0.6278
 epoch: 36, train_loss: 0.4007, test_loss: 1.8130, test_f1: 0.5894
 epoch: 37, train_loss: 0.3944, test_loss: 1.3166, test_f1: 0.6408
 epoch: 38, train_loss: 0.3785, test_loss: 1.6205, test_f1: 0.6250
 epoch: 39, train_loss: 0.3571, test_loss: 1.4218, test_f1: 0.6089
 epoch: 40, train_loss: 0.3337, test_loss: 1.3491, test_f1: 0.6698
 epoch: 41, train_loss: 0.3385, test_loss: 1.3519, test_f1: 0.6654
 epoch: 42, train_loss: 0.3179, test_loss: 1.6987, test_f1: 0.6000
 epoch: 43, train_loss: 0.2976, test_loss: 1.5596, test_f1: 0.6554
 epoch: 44, train_loss: 0.3275, test_loss: 1.6761, test_f1: 0.5860
 epoch: 45, train_loss: 0.3074, test_loss: 1.5942, test_f1: 0.6551
 epoch: 46, train_loss: 0.2863, test_loss: 1.5796, test_f1: 0.6075
 epoch: 47, train_loss: 0.2958, test_loss: 1.4190, test_f1: 0.6208
 epoch: 48, train_loss: 0.3215, test_loss: 1.6626, test_f1: 0.6396
 epoch: 49, train_loss: 0.2881, test_loss: 1.6749, test_f1: 0.6343
 epoch: 50, train_loss: 0.2647, test_loss: 1.8833, test_f1: 0.5808
 epoch: 51, train_loss: 0.2345, test_loss: 1.7248, test_f1: 0.6316
 epoch: 52, train_loss: 0.2003, test_loss: 1.7457, test_f1: 0.6015
 epoch: 53, train_loss: 0.1768, test_loss: 1.8022, test_f1: 0.6242
 epoch: 54, train_loss: 0.1848, test_loss: 1.8218, test_f1: 0.6162
 epoch: 55, train_loss: 0.1750, test_loss: 1.8723, test_f1: 0.6313
 epoch: 56, train_loss: 0.1827, test_loss: 1.9983, test_f1: 0.6083
 epoch: 57, train_loss: 0.1693, test_loss: 1.8352, test_f1: 0.6192
 epoch: 58, train_loss: 0.1672, test_loss: 2.0016, test_f1: 0.5850
 epoch: 59, train_loss: 0.1846, test_loss: 1.9685, test_f1: 0.6169
 epoch: 60, train_loss: 0.1516, test_loss: 2.0023, test_f1: 0.6251
 epoch: 61, train_loss: 0.1558, test_loss: 2.0775, test_f1: 0.6270
 epoch: 62, train_loss: 0.1546, test_loss: 1.9468, test_f1: 0.6146
 epoch: 63, train_loss: 0.1592, test_loss: 2.1937, test_f1: 0.5989
 epoch: 64, train_loss: 0.1461, test_loss: 2.0947, test_f1: 0.5824
 epoch: 65, train_loss: 0.1521, test_loss: 2.0182, test_f1: 0.6192
 epoch: 66, train_loss: 0.1532, test_loss: 2.3033, test_f1: 0.5819
 epoch: 67, train_loss: 0.1513, test_loss: 2.0007, test_f1: 0.6574
 epoch: 68, train_loss: 0.1527, test_loss: 2.1408, test_f1: 0.6187
 epoch: 69, train_loss: 0.1612, test_loss: 2.0420, test_f1: 0.6193
 epoch: 70, train_loss: 0.1254, test_loss: 1.9870, test_f1: 0.6458
 epoch: 71, train_loss: 0.1309, test_loss: 2.1564, test_f1: 0.5928
 epoch: 72, train_loss: 0.1464, test_loss: 2.0958, test_f1: 0.6258
 epoch: 73, train_loss: 0.1390, test_loss: 2.0900, test_f1: 0.6547
 epoch: 74, train_loss: 0.1546, test_loss: 2.2270, test_f1: 0.5805
 epoch: 75, train_loss: 0.1746, test_loss: 2.1948, test_f1: 0.5800
 epoch: 76, train_loss: 0.1411, test_loss: 2.1803, test_f1: 0.6081
 epoch: 77, train_loss: 0.1344, test_loss: 2.2329, test_f1: 0.6088
 epoch: 78, train_loss: 0.1169, test_loss: 2.1925, test_f1: 0.6017
 epoch: 79, train_loss: 0.1210, test_loss: 2.2586, test_f1: 0.5879
 epoch: 80, train_loss: 0.1422, test_loss: 2.5070, test_f1: 0.5981
 epoch: 81, train_loss: 0.1271, test_loss: 2.1491, test_f1: 0.6130
 epoch: 82, train_loss: 0.1380, test_loss: 2.2742, test_f1: 0.6097
 epoch: 83, train_loss: 0.1091, test_loss: 2.3660, test_f1: 0.6095
 epoch: 84, train_loss: 0.1188, test_loss: 2.2013, test_f1: 0.6262
 epoch: 85, train_loss: 0.1367, test_loss: 2.4422, test_f1: 0.6201
 epoch: 86, train_loss: 0.1255, test_loss: 2.4922, test_f1: 0.5940
 epoch: 87, train_loss: 0.1237, test_loss: 2.5113, test_f1: 0.5921
 epoch: 88, train_loss: 0.1299, test_loss: 2.2642, test_f1: 0.6410
 epoch: 89, train_loss: 0.1106, test_loss: 2.3732, test_f1: 0.5860
 epoch: 90, train_loss: 0.1292, test_loss: 2.1130, test_f1: 0.6307
 epoch: 91, train_loss: 0.1160, test_loss: 2.3063, test_f1: 0.6140
 epoch: 92, train_loss: 0.0871, test_loss: 2.3764, test_f1: 0.6223
 epoch: 93, train_loss: 0.0855, test_loss: 2.3876, test_f1: 0.6130
 epoch: 94, train_loss: 0.0997, test_loss: 2.4914, test_f1: 0.6175
 epoch: 95, train_loss: 0.1345, test_loss: 2.4674, test_f1: 0.6135
 epoch: 96, train_loss: 0.1234, test_loss: 2.4178, test_f1: 0.6173
 epoch: 97, train_loss: 0.1112, test_loss: 2.4600, test_f1: 0.6270
 epoch: 98, train_loss: 0.1034, test_loss: 2.5176, test_f1: 0.6020
 epoch: 99, train_loss: 0.1078, test_loss: 2.4593, test_f1: 0.6213
##################ITERATION #5 ****************************************
 epoch: 0, train_loss: 1.1945, test_loss: 1.2729, test_f1: 0.2618
 epoch: 1, train_loss: 0.9970, test_loss: 1.1469, test_f1: 0.5307
 epoch: 2, train_loss: 0.9217, test_loss: 1.0459, test_f1: 0.5982
 epoch: 3, train_loss: 0.8857, test_loss: 1.0398, test_f1: 0.5967
 epoch: 4, train_loss: 0.8514, test_loss: 1.0256, test_f1: 0.5666
 epoch: 5, train_loss: 0.7926, test_loss: 1.3114, test_f1: 0.5066
 epoch: 6, train_loss: 0.8050, test_loss: 1.0558, test_f1: 0.5568
 epoch: 7, train_loss: 0.7780, test_loss: 1.0996, test_f1: 0.5591
 epoch: 8, train_loss: 0.7348, test_loss: 1.0130, test_f1: 0.6215
 epoch: 9, train_loss: 0.7424, test_loss: 1.0698, test_f1: 0.6290
 epoch: 10, train_loss: 0.7223, test_loss: 1.0257, test_f1: 0.6264
 epoch: 11, train_loss: 0.7107, test_loss: 1.0858, test_f1: 0.6425
 epoch: 12, train_loss: 0.6591, test_loss: 1.1025, test_f1: 0.5483
 epoch: 13, train_loss: 0.6776, test_loss: 1.0802, test_f1: 0.6230
 epoch: 14, train_loss: 0.6603, test_loss: 1.0990, test_f1: 0.5857
 epoch: 15, train_loss: 0.6564, test_loss: 1.1840, test_f1: 0.6186
 epoch: 16, train_loss: 0.6394, test_loss: 1.0830, test_f1: 0.6009
 epoch: 17, train_loss: 0.5952, test_loss: 1.3804, test_f1: 0.5639
 epoch: 18, train_loss: 0.5885, test_loss: 1.1531, test_f1: 0.6071
 epoch: 19, train_loss: 0.6079, test_loss: 1.3824, test_f1: 0.6004
 epoch: 20, train_loss: 0.5404, test_loss: 1.2929, test_f1: 0.6109
 epoch: 21, train_loss: 0.5315, test_loss: 1.2004, test_f1: 0.6361
 epoch: 22, train_loss: 0.5256, test_loss: 1.3619, test_f1: 0.6262
 epoch: 23, train_loss: 0.5256, test_loss: 1.2832, test_f1: 0.6463
 epoch: 24, train_loss: 0.4977, test_loss: 1.3880, test_f1: 0.6229
 epoch: 25, train_loss: 0.5164, test_loss: 1.4544, test_f1: 0.5904
 epoch: 26, train_loss: 0.4835, test_loss: 1.3461, test_f1: 0.6227
 epoch: 27, train_loss: 0.4399, test_loss: 1.3186, test_f1: 0.6213
 epoch: 28, train_loss: 0.4803, test_loss: 1.5290, test_f1: 0.5748
 epoch: 29, train_loss: 0.4401, test_loss: 1.9183, test_f1: 0.5631
 epoch: 30, train_loss: 0.4452, test_loss: 1.4202, test_f1: 0.6221
 epoch: 31, train_loss: 0.4103, test_loss: 1.8626, test_f1: 0.5888
 epoch: 32, train_loss: 0.4708, test_loss: 1.3572, test_f1: 0.6003
 epoch: 33, train_loss: 0.4417, test_loss: 1.6229, test_f1: 0.5636
 epoch: 34, train_loss: 0.4336, test_loss: 1.5153, test_f1: 0.5973
 epoch: 35, train_loss: 0.4062, test_loss: 1.7401, test_f1: 0.6336
 epoch: 36, train_loss: 0.3926, test_loss: 1.8093, test_f1: 0.5916
 epoch: 37, train_loss: 0.3962, test_loss: 1.6674, test_f1: 0.6352
 epoch: 38, train_loss: 0.4088, test_loss: 1.5453, test_f1: 0.6268
 epoch: 39, train_loss: 0.3911, test_loss: 1.6072, test_f1: 0.6509
 epoch: 40, train_loss: 0.3497, test_loss: 1.9421, test_f1: 0.6139
 epoch: 41, train_loss: 0.3445, test_loss: 1.8262, test_f1: 0.5884
 epoch: 42, train_loss: 0.3437, test_loss: 2.0394, test_f1: 0.5974
 epoch: 43, train_loss: 0.3441, test_loss: 1.7223, test_f1: 0.5703
 epoch: 44, train_loss: 0.3461, test_loss: 2.2192, test_f1: 0.6072
 epoch: 45, train_loss: 0.3303, test_loss: 1.7807, test_f1: 0.6117
 epoch: 46, train_loss: 0.3472, test_loss: 2.6923, test_f1: 0.5449
 epoch: 47, train_loss: 0.3482, test_loss: 1.9890, test_f1: 0.5640
 epoch: 48, train_loss: 0.3461, test_loss: 1.9417, test_f1: 0.5923
 epoch: 49, train_loss: 0.2905, test_loss: 1.8832, test_f1: 0.6074
 epoch: 50, train_loss: 0.3015, test_loss: 1.8153, test_f1: 0.5970
 epoch: 51, train_loss: 0.2601, test_loss: 2.0977, test_f1: 0.6198
 epoch: 52, train_loss: 0.2282, test_loss: 2.0027, test_f1: 0.6003
 epoch: 53, train_loss: 0.2177, test_loss: 2.0016, test_f1: 0.6006
 epoch: 54, train_loss: 0.2292, test_loss: 2.2440, test_f1: 0.6081
 epoch: 55, train_loss: 0.1952, test_loss: 2.0139, test_f1: 0.6261
 epoch: 56, train_loss: 0.1960, test_loss: 2.2062, test_f1: 0.6027
 epoch: 57, train_loss: 0.2233, test_loss: 2.1574, test_f1: 0.6152
 epoch: 58, train_loss: 0.1946, test_loss: 2.5563, test_f1: 0.5993
 epoch: 59, train_loss: 0.1912, test_loss: 2.0592, test_f1: 0.6302
 epoch: 60, train_loss: 0.1913, test_loss: 2.1526, test_f1: 0.6163
 epoch: 61, train_loss: 0.1937, test_loss: 2.3681, test_f1: 0.5648
 epoch: 62, train_loss: 0.1971, test_loss: 2.3459, test_f1: 0.5837
 epoch: 63, train_loss: 0.1871, test_loss: 2.3362, test_f1: 0.6251
 epoch: 64, train_loss: 0.1786, test_loss: 2.5289, test_f1: 0.5972
 epoch: 65, train_loss: 0.1591, test_loss: 2.3527, test_f1: 0.5813
 epoch: 66, train_loss: 0.1845, test_loss: 2.3264, test_f1: 0.5869
 epoch: 67, train_loss: 0.1652, test_loss: 2.5111, test_f1: 0.6011
 epoch: 68, train_loss: 0.2109, test_loss: 2.6405, test_f1: 0.6080
 epoch: 69, train_loss: 0.1973, test_loss: 2.5696, test_f1: 0.5838
 epoch: 70, train_loss: 0.1524, test_loss: 2.5517, test_f1: 0.6098
 epoch: 71, train_loss: 0.1959, test_loss: 2.6232, test_f1: 0.5788
 epoch: 72, train_loss: 0.1824, test_loss: 2.3733, test_f1: 0.6169
 epoch: 73, train_loss: 0.1892, test_loss: 2.4059, test_f1: 0.6303
 epoch: 74, train_loss: 0.1524, test_loss: 2.4215, test_f1: 0.6152
 epoch: 75, train_loss: 0.1496, test_loss: 2.5478, test_f1: 0.5798
 epoch: 76, train_loss: 0.1393, test_loss: 2.4833, test_f1: 0.5932
 epoch: 77, train_loss: 0.1581, test_loss: 2.4862, test_f1: 0.5850
 epoch: 78, train_loss: 0.1569, test_loss: 2.4775, test_f1: 0.5963
 epoch: 79, train_loss: 0.1396, test_loss: 2.5728, test_f1: 0.5896
 epoch: 80, train_loss: 0.1533, test_loss: 2.5589, test_f1: 0.5853
 epoch: 81, train_loss: 0.1358, test_loss: 2.5952, test_f1: 0.5719
 epoch: 82, train_loss: 0.1463, test_loss: 2.6280, test_f1: 0.6002
 epoch: 83, train_loss: 0.1355, test_loss: 2.5577, test_f1: 0.6067
 epoch: 84, train_loss: 0.1353, test_loss: 2.4449, test_f1: 0.6028
 epoch: 85, train_loss: 0.1552, test_loss: 2.6281, test_f1: 0.5826
 epoch: 86, train_loss: 0.1366, test_loss: 2.7969, test_f1: 0.5971
 epoch: 87, train_loss: 0.1306, test_loss: 2.6013, test_f1: 0.5848
 epoch: 88, train_loss: 0.1121, test_loss: 2.7745, test_f1: 0.5800
 epoch: 89, train_loss: 0.1511, test_loss: 2.6709, test_f1: 0.6013
 epoch: 90, train_loss: 0.1375, test_loss: 2.7881, test_f1: 0.6041
 epoch: 91, train_loss: 0.1241, test_loss: 2.7006, test_f1: 0.6037
 epoch: 92, train_loss: 0.1103, test_loss: 2.9566, test_f1: 0.6059
 epoch: 93, train_loss: 0.1175, test_loss: 2.6930, test_f1: 0.5911
 epoch: 94, train_loss: 0.1181, test_loss: 2.8183, test_f1: 0.5920
 epoch: 95, train_loss: 0.1105, test_loss: 2.8788, test_f1: 0.6013
 epoch: 96, train_loss: 0.1215, test_loss: 2.6809, test_f1: 0.6214
 epoch: 97, train_loss: 0.1313, test_loss: 2.6393, test_f1: 0.6391
 epoch: 98, train_loss: 0.1294, test_loss: 2.7008, test_f1: 0.6078
 epoch: 99, train_loss: 0.1126, test_loss: 3.2041, test_f1: 0.5746
##################ITERATION #6 ****************************************
 epoch: 0, train_loss: 1.3890, test_loss: 1.4069, test_f1: 0.1793
 epoch: 1, train_loss: 1.0423, test_loss: 1.3275, test_f1: 0.3273
 epoch: 2, train_loss: 0.9669, test_loss: 1.1225, test_f1: 0.5024
 epoch: 3, train_loss: 0.9271, test_loss: 1.0077, test_f1: 0.5666
 epoch: 4, train_loss: 0.8890, test_loss: 1.0556, test_f1: 0.5383
 epoch: 5, train_loss: 0.8463, test_loss: 1.0526, test_f1: 0.5777
 epoch: 6, train_loss: 0.8330, test_loss: 1.0740, test_f1: 0.5745
 epoch: 7, train_loss: 0.8277, test_loss: 1.0968, test_f1: 0.5545
 epoch: 8, train_loss: 0.8040, test_loss: 0.9782, test_f1: 0.6006
 epoch: 9, train_loss: 0.7601, test_loss: 1.0736, test_f1: 0.5735
 epoch: 10, train_loss: 0.7596, test_loss: 1.0432, test_f1: 0.5665
 epoch: 11, train_loss: 0.7246, test_loss: 1.0542, test_f1: 0.6062
 epoch: 12, train_loss: 0.6999, test_loss: 1.1050, test_f1: 0.5643
 epoch: 13, train_loss: 0.7043, test_loss: 1.0994, test_f1: 0.5855
 epoch: 14, train_loss: 0.6750, test_loss: 1.0870, test_f1: 0.6148
 epoch: 15, train_loss: 0.6697, test_loss: 1.1257, test_f1: 0.5862
 epoch: 16, train_loss: 0.6624, test_loss: 1.2194, test_f1: 0.5732
 epoch: 17, train_loss: 0.6857, test_loss: 1.0877, test_f1: 0.5719
 epoch: 18, train_loss: 0.6334, test_loss: 1.0417, test_f1: 0.5840
 epoch: 19, train_loss: 0.6251, test_loss: 1.1228, test_f1: 0.5712
 epoch: 20, train_loss: 0.6316, test_loss: 1.0860, test_f1: 0.5921
 epoch: 21, train_loss: 0.6001, test_loss: 1.1506, test_f1: 0.5229
 epoch: 22, train_loss: 0.5905, test_loss: 1.3131, test_f1: 0.5602
 epoch: 23, train_loss: 0.5881, test_loss: 1.1865, test_f1: 0.5849
 epoch: 24, train_loss: 0.5740, test_loss: 1.0847, test_f1: 0.6072
 epoch: 25, train_loss: 0.5465, test_loss: 1.2556, test_f1: 0.5797
 epoch: 26, train_loss: 0.5561, test_loss: 1.1307, test_f1: 0.6254
 epoch: 27, train_loss: 0.5554, test_loss: 1.2285, test_f1: 0.6209
 epoch: 28, train_loss: 0.5290, test_loss: 1.4644, test_f1: 0.5394
 epoch: 29, train_loss: 0.5451, test_loss: 1.1828, test_f1: 0.6199
 epoch: 30, train_loss: 0.5415, test_loss: 1.2450, test_f1: 0.5989
 epoch: 31, train_loss: 0.5076, test_loss: 1.2129, test_f1: 0.6314
 epoch: 32, train_loss: 0.4839, test_loss: 1.2550, test_f1: 0.6011
 epoch: 33, train_loss: 0.4759, test_loss: 1.4201, test_f1: 0.5566
 epoch: 34, train_loss: 0.4867, test_loss: 1.1902, test_f1: 0.6207
 epoch: 35, train_loss: 0.4568, test_loss: 1.2728, test_f1: 0.6228
 epoch: 36, train_loss: 0.4745, test_loss: 1.1939, test_f1: 0.6166
 epoch: 37, train_loss: 0.5209, test_loss: 1.4335, test_f1: 0.5056
 epoch: 38, train_loss: 0.4602, test_loss: 1.1720, test_f1: 0.6019
 epoch: 39, train_loss: 0.4050, test_loss: 1.2034, test_f1: 0.6517
 epoch: 40, train_loss: 0.4313, test_loss: 1.3771, test_f1: 0.5975
 epoch: 41, train_loss: 0.4027, test_loss: 1.4987, test_f1: 0.6061
 epoch: 42, train_loss: 0.4262, test_loss: 1.3869, test_f1: 0.6232
 epoch: 43, train_loss: 0.4041, test_loss: 1.4568, test_f1: 0.6529
 epoch: 44, train_loss: 0.4012, test_loss: 1.5829, test_f1: 0.6453
 epoch: 45, train_loss: 0.3725, test_loss: 1.4075, test_f1: 0.5874
 epoch: 46, train_loss: 0.3538, test_loss: 1.4502, test_f1: 0.6462
 epoch: 47, train_loss: 0.3972, test_loss: 1.3887, test_f1: 0.5671
 epoch: 48, train_loss: 0.3852, test_loss: 1.5129, test_f1: 0.6150
 epoch: 49, train_loss: 0.3572, test_loss: 1.4629, test_f1: 0.6128
 epoch: 50, train_loss: 0.3463, test_loss: 1.7439, test_f1: 0.5844
 epoch: 51, train_loss: 0.2902, test_loss: 1.5515, test_f1: 0.6324
 epoch: 52, train_loss: 0.2842, test_loss: 1.5469, test_f1: 0.6168
 epoch: 53, train_loss: 0.2809, test_loss: 1.6690, test_f1: 0.6229
 epoch: 54, train_loss: 0.2635, test_loss: 1.7160, test_f1: 0.6232
 epoch: 55, train_loss: 0.2613, test_loss: 1.6426, test_f1: 0.6358
 epoch: 56, train_loss: 0.2371, test_loss: 1.6243, test_f1: 0.6399
 epoch: 57, train_loss: 0.2289, test_loss: 1.7893, test_f1: 0.6087
 epoch: 58, train_loss: 0.2564, test_loss: 1.7755, test_f1: 0.6098
 epoch: 59, train_loss: 0.2440, test_loss: 1.7191, test_f1: 0.6041
 epoch: 60, train_loss: 0.2452, test_loss: 1.7220, test_f1: 0.6149
 epoch: 61, train_loss: 0.2166, test_loss: 1.7323, test_f1: 0.6350
 epoch: 62, train_loss: 0.2228, test_loss: 1.8222, test_f1: 0.6089
 epoch: 63, train_loss: 0.2461, test_loss: 1.8287, test_f1: 0.6357
 epoch: 64, train_loss: 0.2177, test_loss: 1.8515, test_f1: 0.6261
 epoch: 65, train_loss: 0.1989, test_loss: 1.8331, test_f1: 0.6355
 epoch: 66, train_loss: 0.2148, test_loss: 1.9323, test_f1: 0.6355
 epoch: 67, train_loss: 0.2040, test_loss: 1.7919, test_f1: 0.6276
 epoch: 68, train_loss: 0.2224, test_loss: 1.8651, test_f1: 0.6245
 epoch: 69, train_loss: 0.2312, test_loss: 1.7275, test_f1: 0.6474
 epoch: 70, train_loss: 0.2046, test_loss: 1.8824, test_f1: 0.6331
 epoch: 71, train_loss: 0.1949, test_loss: 1.7898, test_f1: 0.6227
 epoch: 72, train_loss: 0.1789, test_loss: 1.8531, test_f1: 0.6288
 epoch: 73, train_loss: 0.1740, test_loss: 1.9207, test_f1: 0.6027
 epoch: 74, train_loss: 0.1763, test_loss: 1.9741, test_f1: 0.6151
 epoch: 75, train_loss: 0.1981, test_loss: 2.0948, test_f1: 0.6429
 epoch: 76, train_loss: 0.1787, test_loss: 2.0050, test_f1: 0.6610
 epoch: 77, train_loss: 0.1567, test_loss: 2.0782, test_f1: 0.6328
 epoch: 78, train_loss: 0.1698, test_loss: 1.9887, test_f1: 0.6161
 epoch: 79, train_loss: 0.2064, test_loss: 2.0970, test_f1: 0.6228
 epoch: 80, train_loss: 0.2127, test_loss: 1.9116, test_f1: 0.6234
 epoch: 81, train_loss: 0.1772, test_loss: 2.1733, test_f1: 0.6418
 epoch: 82, train_loss: 0.1746, test_loss: 2.0064, test_f1: 0.6342
 epoch: 83, train_loss: 0.1577, test_loss: 2.1323, test_f1: 0.6116
 epoch: 84, train_loss: 0.1713, test_loss: 1.8929, test_f1: 0.6369
 epoch: 85, train_loss: 0.1747, test_loss: 2.2064, test_f1: 0.6112
 epoch: 86, train_loss: 0.1673, test_loss: 2.0983, test_f1: 0.6064
 epoch: 87, train_loss: 0.1595, test_loss: 2.1140, test_f1: 0.6437
 epoch: 88, train_loss: 0.1764, test_loss: 2.2584, test_f1: 0.6269
 epoch: 89, train_loss: 0.1616, test_loss: 2.0881, test_f1: 0.5971
 epoch: 90, train_loss: 0.1904, test_loss: 2.2018, test_f1: 0.6283
 epoch: 91, train_loss: 0.1570, test_loss: 2.1117, test_f1: 0.6001
 epoch: 92, train_loss: 0.1614, test_loss: 2.1863, test_f1: 0.6547
 epoch: 93, train_loss: 0.1335, test_loss: 2.3063, test_f1: 0.6046
 epoch: 94, train_loss: 0.1560, test_loss: 2.3155, test_f1: 0.6156
 epoch: 95, train_loss: 0.1520, test_loss: 2.1828, test_f1: 0.6073
 epoch: 96, train_loss: 0.1563, test_loss: 2.2376, test_f1: 0.6218
 epoch: 97, train_loss: 0.1761, test_loss: 2.3331, test_f1: 0.5711
 epoch: 98, train_loss: 0.1571, test_loss: 2.2268, test_f1: 0.6023
 epoch: 99, train_loss: 0.1643, test_loss: 2.2922, test_f1: 0.5980
##################ITERATION #7 ****************************************
 epoch: 0, train_loss: 1.3314, test_loss: 1.5136, test_f1: 0.1765
 epoch: 1, train_loss: 1.0676, test_loss: 1.1311, test_f1: 0.4837
 epoch: 2, train_loss: 0.9594, test_loss: 1.0744, test_f1: 0.5595
 epoch: 3, train_loss: 0.9063, test_loss: 1.0813, test_f1: 0.5795
 epoch: 4, train_loss: 0.8449, test_loss: 1.0293, test_f1: 0.5743
 epoch: 5, train_loss: 0.8254, test_loss: 1.0154, test_f1: 0.6053
 epoch: 6, train_loss: 0.8165, test_loss: 1.0135, test_f1: 0.6014
 epoch: 7, train_loss: 0.7790, test_loss: 0.9669, test_f1: 0.5827
 epoch: 8, train_loss: 0.7521, test_loss: 1.0433, test_f1: 0.5876
 epoch: 9, train_loss: 0.7266, test_loss: 1.1360, test_f1: 0.6027
 epoch: 10, train_loss: 0.7111, test_loss: 1.1997, test_f1: 0.5297
 epoch: 11, train_loss: 0.6975, test_loss: 1.0202, test_f1: 0.5550
 epoch: 12, train_loss: 0.6734, test_loss: 1.0368, test_f1: 0.5965
 epoch: 13, train_loss: 0.6624, test_loss: 1.1353, test_f1: 0.6134
 epoch: 14, train_loss: 0.6365, test_loss: 1.0539, test_f1: 0.5649
 epoch: 15, train_loss: 0.6325, test_loss: 1.1724, test_f1: 0.5468
 epoch: 16, train_loss: 0.6322, test_loss: 1.1432, test_f1: 0.5829
 epoch: 17, train_loss: 0.6056, test_loss: 1.1535, test_f1: 0.6064
 epoch: 18, train_loss: 0.5765, test_loss: 1.2787, test_f1: 0.5282
 epoch: 19, train_loss: 0.6090, test_loss: 1.1959, test_f1: 0.6056
 epoch: 20, train_loss: 0.5743, test_loss: 1.2385, test_f1: 0.5179
 epoch: 21, train_loss: 0.5719, test_loss: 1.1255, test_f1: 0.6176
 epoch: 22, train_loss: 0.5357, test_loss: 1.3552, test_f1: 0.5662
 epoch: 23, train_loss: 0.5399, test_loss: 1.2141, test_f1: 0.6145
 epoch: 24, train_loss: 0.5368, test_loss: 1.4410, test_f1: 0.5336
 epoch: 25, train_loss: 0.5548, test_loss: 1.2194, test_f1: 0.5805
 epoch: 26, train_loss: 0.5313, test_loss: 1.3454, test_f1: 0.5785
 epoch: 27, train_loss: 0.4925, test_loss: 1.3494, test_f1: 0.6100
 epoch: 28, train_loss: 0.4954, test_loss: 1.1953, test_f1: 0.5697
 epoch: 29, train_loss: 0.4762, test_loss: 1.3427, test_f1: 0.6124
 epoch: 30, train_loss: 0.4306, test_loss: 1.4093, test_f1: 0.5718
 epoch: 31, train_loss: 0.4314, test_loss: 1.4391, test_f1: 0.5753
 epoch: 32, train_loss: 0.4221, test_loss: 1.2972, test_f1: 0.6011
 epoch: 33, train_loss: 0.4319, test_loss: 1.4680, test_f1: 0.6236
 epoch: 34, train_loss: 0.4304, test_loss: 1.6348, test_f1: 0.5651
 epoch: 35, train_loss: 0.4151, test_loss: 1.5575, test_f1: 0.5933
 epoch: 36, train_loss: 0.4206, test_loss: 1.6988, test_f1: 0.5901
 epoch: 37, train_loss: 0.3660, test_loss: 1.5445, test_f1: 0.6174
 epoch: 38, train_loss: 0.3955, test_loss: 2.0530, test_f1: 0.5513
 epoch: 39, train_loss: 0.3896, test_loss: 1.4536, test_f1: 0.5785
 epoch: 40, train_loss: 0.3714, test_loss: 1.6218, test_f1: 0.6414
 epoch: 41, train_loss: 0.3417, test_loss: 1.6567, test_f1: 0.5860
 epoch: 42, train_loss: 0.3403, test_loss: 1.9529, test_f1: 0.6110
 epoch: 43, train_loss: 0.3708, test_loss: 1.8972, test_f1: 0.5589
 epoch: 44, train_loss: 0.3654, test_loss: 1.7748, test_f1: 0.5981
 epoch: 45, train_loss: 0.3273, test_loss: 1.8791, test_f1: 0.5888
 epoch: 46, train_loss: 0.3544, test_loss: 1.7646, test_f1: 0.6188
 epoch: 47, train_loss: 0.3466, test_loss: 1.6836, test_f1: 0.5681
 epoch: 48, train_loss: 0.3104, test_loss: 2.0369, test_f1: 0.6031
 epoch: 49, train_loss: 0.3220, test_loss: 1.7231, test_f1: 0.6111
 epoch: 50, train_loss: 0.3252, test_loss: 1.8467, test_f1: 0.5847
 epoch: 51, train_loss: 0.3038, test_loss: 1.9035, test_f1: 0.5870
 epoch: 52, train_loss: 0.2443, test_loss: 1.8653, test_f1: 0.5974
 epoch: 53, train_loss: 0.2299, test_loss: 1.8286, test_f1: 0.6097
 epoch: 54, train_loss: 0.2110, test_loss: 2.1310, test_f1: 0.5918
 epoch: 55, train_loss: 0.2306, test_loss: 1.8222, test_f1: 0.5932
 epoch: 56, train_loss: 0.2227, test_loss: 2.0862, test_f1: 0.5792
 epoch: 57, train_loss: 0.1988, test_loss: 1.9082, test_f1: 0.6250
 epoch: 58, train_loss: 0.2260, test_loss: 2.1057, test_f1: 0.5931
 epoch: 59, train_loss: 0.1791, test_loss: 2.0354, test_f1: 0.6025
 epoch: 60, train_loss: 0.1928, test_loss: 2.1308, test_f1: 0.5806
 epoch: 61, train_loss: 0.1936, test_loss: 2.0507, test_f1: 0.6105
 epoch: 62, train_loss: 0.2086, test_loss: 2.3804, test_f1: 0.6075
 epoch: 63, train_loss: 0.1873, test_loss: 2.4433, test_f1: 0.5897
 epoch: 64, train_loss: 0.1939, test_loss: 2.4244, test_f1: 0.5757
 epoch: 65, train_loss: 0.1768, test_loss: 2.4543, test_f1: 0.5916
 epoch: 66, train_loss: 0.2102, test_loss: 2.7165, test_f1: 0.5839
 epoch: 67, train_loss: 0.1827, test_loss: 2.3260, test_f1: 0.5945
 epoch: 68, train_loss: 0.1729, test_loss: 2.4022, test_f1: 0.5838
 epoch: 69, train_loss: 0.1724, test_loss: 2.4611, test_f1: 0.6157
 epoch: 70, train_loss: 0.1541, test_loss: 2.4664, test_f1: 0.6011
 epoch: 71, train_loss: 0.1591, test_loss: 2.6811, test_f1: 0.5814
 epoch: 72, train_loss: 0.1552, test_loss: 2.4619, test_f1: 0.5956
 epoch: 73, train_loss: 0.1542, test_loss: 2.5865, test_f1: 0.6086
 epoch: 74, train_loss: 0.1548, test_loss: 2.5507, test_f1: 0.6043
 epoch: 75, train_loss: 0.1721, test_loss: 2.4908, test_f1: 0.6173
 epoch: 76, train_loss: 0.1509, test_loss: 2.4793, test_f1: 0.6250
 epoch: 77, train_loss: 0.1573, test_loss: 2.5678, test_f1: 0.6056
 epoch: 78, train_loss: 0.1747, test_loss: 2.7465, test_f1: 0.5986
 epoch: 79, train_loss: 0.1597, test_loss: 2.4873, test_f1: 0.6259
 epoch: 80, train_loss: 0.1513, test_loss: 2.6396, test_f1: 0.5930
 epoch: 81, train_loss: 0.1635, test_loss: 2.6774, test_f1: 0.6105
 epoch: 82, train_loss: 0.1646, test_loss: 2.4207, test_f1: 0.6190
 epoch: 83, train_loss: 0.1321, test_loss: 2.9627, test_f1: 0.6111
 epoch: 84, train_loss: 0.1305, test_loss: 2.8352, test_f1: 0.5899
 epoch: 85, train_loss: 0.1810, test_loss: 2.8522, test_f1: 0.5276
 epoch: 86, train_loss: 0.1625, test_loss: 2.7523, test_f1: 0.5925
 epoch: 87, train_loss: 0.1627, test_loss: 2.7246, test_f1: 0.6075
 epoch: 88, train_loss: 0.1342, test_loss: 2.5252, test_f1: 0.6263
 epoch: 89, train_loss: 0.1448, test_loss: 2.9465, test_f1: 0.6098
 epoch: 90, train_loss: 0.1203, test_loss: 2.8291, test_f1: 0.5958
 epoch: 91, train_loss: 0.1086, test_loss: 3.0028, test_f1: 0.5909
 epoch: 92, train_loss: 0.1320, test_loss: 2.7415, test_f1: 0.6207
 epoch: 93, train_loss: 0.1674, test_loss: 3.1114, test_f1: 0.5593
 epoch: 94, train_loss: 0.1176, test_loss: 2.8874, test_f1: 0.6135
 epoch: 95, train_loss: 0.1352, test_loss: 2.7259, test_f1: 0.6060
 epoch: 96, train_loss: 0.1275, test_loss: 2.7666, test_f1: 0.6070
 epoch: 97, train_loss: 0.1206, test_loss: 2.8834, test_f1: 0.6199
 epoch: 98, train_loss: 0.1294, test_loss: 2.9862, test_f1: 0.6190
 epoch: 99, train_loss: 0.1283, test_loss: 2.8385, test_f1: 0.5935
##################ITERATION #8 ****************************************
 epoch: 0, train_loss: 1.4015, test_loss: 1.3795, test_f1: 0.3138
 epoch: 1, train_loss: 1.0773, test_loss: 1.2044, test_f1: 0.3391
 epoch: 2, train_loss: 0.9899, test_loss: 1.0720, test_f1: 0.5539
 epoch: 3, train_loss: 0.9308, test_loss: 1.0284, test_f1: 0.5404
 epoch: 4, train_loss: 0.8638, test_loss: 1.0417, test_f1: 0.5737
 epoch: 5, train_loss: 0.8476, test_loss: 1.0591, test_f1: 0.5448
 epoch: 6, train_loss: 0.8225, test_loss: 1.0277, test_f1: 0.5757
 epoch: 7, train_loss: 0.7951, test_loss: 1.0303, test_f1: 0.5022
 epoch: 8, train_loss: 0.7733, test_loss: 1.3008, test_f1: 0.5173
 epoch: 9, train_loss: 0.7986, test_loss: 1.1628, test_f1: 0.5862
 epoch: 10, train_loss: 0.7644, test_loss: 1.0620, test_f1: 0.5741
 epoch: 11, train_loss: 0.7265, test_loss: 1.1631, test_f1: 0.5729
 epoch: 12, train_loss: 0.7246, test_loss: 1.0671, test_f1: 0.5756
 epoch: 13, train_loss: 0.6906, test_loss: 1.1109, test_f1: 0.5876
 epoch: 14, train_loss: 0.6801, test_loss: 1.1533, test_f1: 0.5779
 epoch: 15, train_loss: 0.6660, test_loss: 1.1651, test_f1: 0.5882
 epoch: 16, train_loss: 0.6797, test_loss: 1.1247, test_f1: 0.5649
 epoch: 17, train_loss: 0.6531, test_loss: 1.2073, test_f1: 0.5745
 epoch: 18, train_loss: 0.6271, test_loss: 1.1592, test_f1: 0.5957
 epoch: 19, train_loss: 0.6047, test_loss: 1.2111, test_f1: 0.5731
 epoch: 20, train_loss: 0.6097, test_loss: 1.2419, test_f1: 0.5747
 epoch: 21, train_loss: 0.5886, test_loss: 1.2366, test_f1: 0.5571
 epoch: 22, train_loss: 0.5554, test_loss: 1.2599, test_f1: 0.5709
 epoch: 23, train_loss: 0.5574, test_loss: 1.2787, test_f1: 0.5723
 epoch: 24, train_loss: 0.5958, test_loss: 1.2189, test_f1: 0.5573
 epoch: 25, train_loss: 0.5387, test_loss: 1.2733, test_f1: 0.6107
 epoch: 26, train_loss: 0.5143, test_loss: 1.3975, test_f1: 0.5827
 epoch: 27, train_loss: 0.5191, test_loss: 1.2436, test_f1: 0.6272
 epoch: 28, train_loss: 0.5319, test_loss: 1.5671, test_f1: 0.5689
 epoch: 29, train_loss: 0.4868, test_loss: 1.3071, test_f1: 0.5928
 epoch: 30, train_loss: 0.4865, test_loss: 1.5033, test_f1: 0.6002
 epoch: 31, train_loss: 0.4812, test_loss: 1.5064, test_f1: 0.6068
 epoch: 32, train_loss: 0.4699, test_loss: 1.4745, test_f1: 0.5751
 epoch: 33, train_loss: 0.4525, test_loss: 1.4524, test_f1: 0.6377
 epoch: 34, train_loss: 0.4463, test_loss: 1.7205, test_f1: 0.5976
 epoch: 35, train_loss: 0.4271, test_loss: 1.6364, test_f1: 0.5844
 epoch: 36, train_loss: 0.4477, test_loss: 1.6068, test_f1: 0.5897
 epoch: 37, train_loss: 0.4139, test_loss: 1.3664, test_f1: 0.6519
 epoch: 38, train_loss: 0.4325, test_loss: 1.4869, test_f1: 0.5956
 epoch: 39, train_loss: 0.3846, test_loss: 1.8172, test_f1: 0.5939
 epoch: 40, train_loss: 0.3558, test_loss: 1.5326, test_f1: 0.6532
 epoch: 41, train_loss: 0.3632, test_loss: 1.8531, test_f1: 0.6031
 epoch: 42, train_loss: 0.3980, test_loss: 1.6051, test_f1: 0.6415
 epoch: 43, train_loss: 0.4114, test_loss: 1.6022, test_f1: 0.5696
 epoch: 44, train_loss: 0.3658, test_loss: 1.7037, test_f1: 0.6087
 epoch: 45, train_loss: 0.3456, test_loss: 1.6897, test_f1: 0.5968
 epoch: 46, train_loss: 0.3237, test_loss: 1.5417, test_f1: 0.6087
 epoch: 47, train_loss: 0.3315, test_loss: 1.7109, test_f1: 0.6246
 epoch: 48, train_loss: 0.3279, test_loss: 1.8488, test_f1: 0.6319
 epoch: 49, train_loss: 0.3313, test_loss: 1.9495, test_f1: 0.5771
 epoch: 50, train_loss: 0.2878, test_loss: 2.0565, test_f1: 0.5817
 epoch: 51, train_loss: 0.2593, test_loss: 1.7475, test_f1: 0.6205
 epoch: 52, train_loss: 0.2536, test_loss: 1.8698, test_f1: 0.6016
 epoch: 53, train_loss: 0.2326, test_loss: 1.7396, test_f1: 0.6223
 epoch: 54, train_loss: 0.2558, test_loss: 1.7854, test_f1: 0.6042
 epoch: 55, train_loss: 0.2098, test_loss: 1.9166, test_f1: 0.6206
 epoch: 56, train_loss: 0.2388, test_loss: 1.8149, test_f1: 0.6207
 epoch: 57, train_loss: 0.2159, test_loss: 2.1309, test_f1: 0.5845
 epoch: 58, train_loss: 0.1970, test_loss: 1.9853, test_f1: 0.5906
 epoch: 59, train_loss: 0.2166, test_loss: 2.1312, test_f1: 0.6064
 epoch: 60, train_loss: 0.2000, test_loss: 1.9804, test_f1: 0.6025
 epoch: 61, train_loss: 0.2068, test_loss: 2.1625, test_f1: 0.6017
 epoch: 62, train_loss: 0.1878, test_loss: 2.0483, test_f1: 0.6148
 epoch: 63, train_loss: 0.1938, test_loss: 2.0333, test_f1: 0.6236
 epoch: 64, train_loss: 0.2170, test_loss: 2.2734, test_f1: 0.6153
 epoch: 65, train_loss: 0.1903, test_loss: 2.1792, test_f1: 0.6150
 epoch: 66, train_loss: 0.1991, test_loss: 2.2316, test_f1: 0.5880
 epoch: 67, train_loss: 0.1913, test_loss: 2.2125, test_f1: 0.5862
 epoch: 68, train_loss: 0.2129, test_loss: 2.2294, test_f1: 0.6031
 epoch: 69, train_loss: 0.1711, test_loss: 2.1465, test_f1: 0.6153
 epoch: 70, train_loss: 0.1707, test_loss: 2.2865, test_f1: 0.6122
 epoch: 71, train_loss: 0.1934, test_loss: 2.1869, test_f1: 0.5919
 epoch: 72, train_loss: 0.1646, test_loss: 2.2666, test_f1: 0.5929
 epoch: 73, train_loss: 0.1574, test_loss: 2.2906, test_f1: 0.6002
 epoch: 74, train_loss: 0.1683, test_loss: 2.2499, test_f1: 0.5900
 epoch: 75, train_loss: 0.1605, test_loss: 2.2124, test_f1: 0.6303
 epoch: 76, train_loss: 0.1444, test_loss: 2.2602, test_f1: 0.6132
 epoch: 77, train_loss: 0.1463, test_loss: 2.2805, test_f1: 0.5892
 epoch: 78, train_loss: 0.1356, test_loss: 2.5419, test_f1: 0.6209
 epoch: 79, train_loss: 0.1392, test_loss: 2.3933, test_f1: 0.5980
 epoch: 80, train_loss: 0.1602, test_loss: 2.3575, test_f1: 0.6044
 epoch: 81, train_loss: 0.1712, test_loss: 2.4474, test_f1: 0.6326
 epoch: 82, train_loss: 0.1812, test_loss: 2.3139, test_f1: 0.5902
 epoch: 83, train_loss: 0.1666, test_loss: 2.5069, test_f1: 0.5959
 epoch: 84, train_loss: 0.1510, test_loss: 2.2586, test_f1: 0.6061
 epoch: 85, train_loss: 0.1500, test_loss: 2.4998, test_f1: 0.5940
 epoch: 86, train_loss: 0.1412, test_loss: 2.3425, test_f1: 0.6099
 epoch: 87, train_loss: 0.1373, test_loss: 2.4629, test_f1: 0.6200
 epoch: 88, train_loss: 0.1483, test_loss: 2.3034, test_f1: 0.6048
 epoch: 89, train_loss: 0.1235, test_loss: 2.5360, test_f1: 0.6082
 epoch: 90, train_loss: 0.1436, test_loss: 2.5245, test_f1: 0.6196
 epoch: 91, train_loss: 0.1633, test_loss: 2.2409, test_f1: 0.6210
 epoch: 92, train_loss: 0.1281, test_loss: 2.6017, test_f1: 0.6132
 epoch: 93, train_loss: 0.1806, test_loss: 2.3916, test_f1: 0.6129
 epoch: 94, train_loss: 0.1905, test_loss: 2.2822, test_f1: 0.5984
 epoch: 95, train_loss: 0.1495, test_loss: 2.4207, test_f1: 0.5851
 epoch: 96, train_loss: 0.1334, test_loss: 2.3889, test_f1: 0.6116
 epoch: 97, train_loss: 0.1169, test_loss: 2.5118, test_f1: 0.6046
 epoch: 98, train_loss: 0.1124, test_loss: 2.4495, test_f1: 0.6199
 epoch: 99, train_loss: 0.1330, test_loss: 2.4355, test_f1: 0.5984
##################ITERATION #9 ****************************************
 epoch: 0, train_loss: 1.3784, test_loss: 1.3857, test_f1: 0.2997
 epoch: 1, train_loss: 1.1065, test_loss: 1.2508, test_f1: 0.4014
 epoch: 2, train_loss: 1.0031, test_loss: 1.1520, test_f1: 0.5027
 epoch: 3, train_loss: 0.9221, test_loss: 1.0147, test_f1: 0.6127
 epoch: 4, train_loss: 0.8957, test_loss: 1.1324, test_f1: 0.5687
 epoch: 5, train_loss: 0.8715, test_loss: 1.0545, test_f1: 0.6089
 epoch: 6, train_loss: 0.8079, test_loss: 1.0391, test_f1: 0.5849
 epoch: 7, train_loss: 0.8107, test_loss: 1.0293, test_f1: 0.6086
 epoch: 8, train_loss: 0.7522, test_loss: 1.2872, test_f1: 0.5612
 epoch: 9, train_loss: 0.7301, test_loss: 1.0366, test_f1: 0.6170
 epoch: 10, train_loss: 0.7119, test_loss: 1.0725, test_f1: 0.6322
 epoch: 11, train_loss: 0.6740, test_loss: 1.1647, test_f1: 0.5624
 epoch: 12, train_loss: 0.6692, test_loss: 1.1175, test_f1: 0.6279
 epoch: 13, train_loss: 0.6925, test_loss: 1.2494, test_f1: 0.6153
 epoch: 14, train_loss: 0.6617, test_loss: 1.0934, test_f1: 0.5970
 epoch: 15, train_loss: 0.6398, test_loss: 1.1547, test_f1: 0.6015
 epoch: 16, train_loss: 0.6053, test_loss: 1.1581, test_f1: 0.6405
 epoch: 17, train_loss: 0.5877, test_loss: 1.3156, test_f1: 0.5382
 epoch: 18, train_loss: 0.5869, test_loss: 1.2077, test_f1: 0.6292
 epoch: 19, train_loss: 0.5618, test_loss: 1.1709, test_f1: 0.6336
 epoch: 20, train_loss: 0.5516, test_loss: 1.1255, test_f1: 0.5997
 epoch: 21, train_loss: 0.5507, test_loss: 1.4733, test_f1: 0.5375
 epoch: 22, train_loss: 0.5156, test_loss: 1.3401, test_f1: 0.6174
 epoch: 23, train_loss: 0.5502, test_loss: 1.1791, test_f1: 0.5896
 epoch: 24, train_loss: 0.5366, test_loss: 1.3441, test_f1: 0.6012
 epoch: 25, train_loss: 0.5322, test_loss: 1.3279, test_f1: 0.5993
 epoch: 26, train_loss: 0.5160, test_loss: 1.4682, test_f1: 0.5707
 epoch: 27, train_loss: 0.4995, test_loss: 1.2617, test_f1: 0.6281
 epoch: 28, train_loss: 0.4963, test_loss: 1.5128, test_f1: 0.5101
 epoch: 29, train_loss: 0.4761, test_loss: 1.5994, test_f1: 0.5803
 epoch: 30, train_loss: 0.4328, test_loss: 1.3320, test_f1: 0.6445
 epoch: 31, train_loss: 0.4365, test_loss: 1.4646, test_f1: 0.5821
 epoch: 32, train_loss: 0.4096, test_loss: 1.7215, test_f1: 0.5769
 epoch: 33, train_loss: 0.4258, test_loss: 1.6743, test_f1: 0.5709
 epoch: 34, train_loss: 0.4597, test_loss: 1.7410, test_f1: 0.5827
 epoch: 35, train_loss: 0.4274, test_loss: 1.5849, test_f1: 0.5806
 epoch: 36, train_loss: 0.4219, test_loss: 1.6284, test_f1: 0.5910
 epoch: 37, train_loss: 0.4481, test_loss: 1.6170, test_f1: 0.5719
 epoch: 38, train_loss: 0.4052, test_loss: 1.5983, test_f1: 0.6110
 epoch: 39, train_loss: 0.3936, test_loss: 1.5261, test_f1: 0.5807
 epoch: 40, train_loss: 0.3532, test_loss: 1.4174, test_f1: 0.6209
 epoch: 41, train_loss: 0.3808, test_loss: 1.4245, test_f1: 0.6459
 epoch: 42, train_loss: 0.3542, test_loss: 1.6105, test_f1: 0.6380
 epoch: 43, train_loss: 0.3722, test_loss: 1.5844, test_f1: 0.6060
 epoch: 44, train_loss: 0.3572, test_loss: 1.4824, test_f1: 0.6285
 epoch: 45, train_loss: 0.3890, test_loss: 1.9758, test_f1: 0.5696
 epoch: 46, train_loss: 0.3671, test_loss: 1.6585, test_f1: 0.6117
 epoch: 47, train_loss: 0.3443, test_loss: 1.7721, test_f1: 0.5926
 epoch: 48, train_loss: 0.3463, test_loss: 2.0910, test_f1: 0.5602
 epoch: 49, train_loss: 0.3462, test_loss: 1.7123, test_f1: 0.6190
 epoch: 50, train_loss: 0.3336, test_loss: 1.8084, test_f1: 0.6187
 epoch: 51, train_loss: 0.2921, test_loss: 1.6981, test_f1: 0.6327
 epoch: 52, train_loss: 0.2670, test_loss: 1.7264, test_f1: 0.6057
 epoch: 53, train_loss: 0.2434, test_loss: 1.8935, test_f1: 0.5857
 epoch: 54, train_loss: 0.2409, test_loss: 1.9459, test_f1: 0.6195
 epoch: 55, train_loss: 0.2214, test_loss: 2.0290, test_f1: 0.5882
 epoch: 56, train_loss: 0.2605, test_loss: 1.9312, test_f1: 0.5870
 epoch: 57, train_loss: 0.2239, test_loss: 1.9008, test_f1: 0.6175
 epoch: 58, train_loss: 0.2406, test_loss: 2.0425, test_f1: 0.5687
 epoch: 59, train_loss: 0.2383, test_loss: 2.2326, test_f1: 0.5905
 epoch: 60, train_loss: 0.2060, test_loss: 2.0160, test_f1: 0.6152
 epoch: 61, train_loss: 0.2204, test_loss: 2.1442, test_f1: 0.5741
 epoch: 62, train_loss: 0.2204, test_loss: 1.8765, test_f1: 0.5886
 epoch: 63, train_loss: 0.2212, test_loss: 1.9267, test_f1: 0.5775
 epoch: 64, train_loss: 0.2170, test_loss: 1.9677, test_f1: 0.5852
 epoch: 65, train_loss: 0.2107, test_loss: 2.0464, test_f1: 0.6041
 epoch: 66, train_loss: 0.1854, test_loss: 2.1263, test_f1: 0.5914
 epoch: 67, train_loss: 0.2102, test_loss: 2.1002, test_f1: 0.5783
 epoch: 68, train_loss: 0.1767, test_loss: 2.1061, test_f1: 0.6044
 epoch: 69, train_loss: 0.1866, test_loss: 2.1652, test_f1: 0.5860
 epoch: 70, train_loss: 0.1788, test_loss: 2.2405, test_f1: 0.6303
 epoch: 71, train_loss: 0.1743, test_loss: 2.3738, test_f1: 0.5675
 epoch: 72, train_loss: 0.1970, test_loss: 2.3716, test_f1: 0.5949
 epoch: 73, train_loss: 0.2042, test_loss: 2.4285, test_f1: 0.5937
 epoch: 74, train_loss: 0.1859, test_loss: 2.2529, test_f1: 0.6108
 epoch: 75, train_loss: 0.1785, test_loss: 2.3204, test_f1: 0.5714
 epoch: 76, train_loss: 0.1690, test_loss: 2.2877, test_f1: 0.5978
 epoch: 77, train_loss: 0.1702, test_loss: 2.1499, test_f1: 0.6005
 epoch: 78, train_loss: 0.1506, test_loss: 2.4680, test_f1: 0.5935
 epoch: 79, train_loss: 0.1466, test_loss: 2.2299, test_f1: 0.5878
 epoch: 80, train_loss: 0.1441, test_loss: 2.4270, test_f1: 0.5833
 epoch: 81, train_loss: 0.1812, test_loss: 2.4055, test_f1: 0.5726
 epoch: 82, train_loss: 0.1895, test_loss: 2.2914, test_f1: 0.5681
 epoch: 83, train_loss: 0.1755, test_loss: 2.3240, test_f1: 0.5752
 epoch: 84, train_loss: 0.1688, test_loss: 2.4478, test_f1: 0.5711
 epoch: 85, train_loss: 0.1580, test_loss: 2.2382, test_f1: 0.5757
 epoch: 86, train_loss: 0.1880, test_loss: 2.2398, test_f1: 0.6131
 epoch: 87, train_loss: 0.1530, test_loss: 2.3617, test_f1: 0.5833
 epoch: 88, train_loss: 0.1510, test_loss: 2.4491, test_f1: 0.6022
 epoch: 89, train_loss: 0.1478, test_loss: 2.6396, test_f1: 0.5902
 epoch: 90, train_loss: 0.1279, test_loss: 2.6863, test_f1: 0.5673
 epoch: 91, train_loss: 0.1377, test_loss: 2.5110, test_f1: 0.5773
 epoch: 92, train_loss: 0.1619, test_loss: 2.7428, test_f1: 0.5766
 epoch: 93, train_loss: 0.1637, test_loss: 2.5829, test_f1: 0.5954
 epoch: 94, train_loss: 0.1658, test_loss: 2.3585, test_f1: 0.5933
 epoch: 95, train_loss: 0.1733, test_loss: 2.7002, test_f1: 0.5866
 epoch: 96, train_loss: 0.1466, test_loss: 2.4107, test_f1: 0.6040
 epoch: 97, train_loss: 0.1533, test_loss: 2.3724, test_f1: 0.5917
 epoch: 98, train_loss: 0.1334, test_loss: 2.4344, test_f1: 0.6076
 epoch: 99, train_loss: 0.1155, test_loss: 2.4897, test_f1: 0.5956

Training completed in 421.42 seconds
Best F1: 0.6844 at epoch 42
Mean F1 across iterations: 0.6574  0.0143
========================FINAL RESULTS================================
FEGIN weighted F1: 0.6844  0.0143
python main.py --data ltspice_demos --representation component_pin --model FEGIN --layers 3 --hiddens 64 --batch_size 64 --lr 0.001 --emb_size 250 --epochs 100 --save_appendix component_pin_L3_H64_BS64_LR0.001_E250 --no_val
-----



STDERR:
  File "main.py", line 370, in <module>
    main()
  File "main.py", line 254, in main
    dataset = dataset_class(
  File "/home/philip/projects/ltspice_examples_code_repo/Circuit-Completion-Using-GNNs/component_classification_with_link_prediction_head/evaluation/FEGIN/kernel/circuit_datasets.py", line 15, in __init__
    self.data, self.slices = torch.load(self.processed_paths[0])
  File "/home/philip/.local/lib/python3.8/site-packages/torch/serialization.py", line 1040, in load
    warnings.warn(
  File "/usr/lib/python3.8/warnings.py", line 109, in _showwarnmsg
    sw(msg.message, msg.category, msg.filename, msg.lineno,
  File "main.py", line 47, in warn_with_traceback
    traceback.print_stack(file=log)
/home/philip/projects/ltspice_examples_code_repo/Circuit-Completion-Using-GNNs/component_classification_with_link_prediction_head/evaluation/FEGIN/kernel/circuit_datasets.py:15: FutureWarning: You are using `torch.load` with `weights_only=False` (the current default value), which uses the default pickle module implicitly. It is possible to construct malicious pickle data which will execute arbitrary code during unpickling (See https://github.com/pytorch/pytorch/blob/main/SECURITY.md#untrusted-models for more details). In a future release, the default value for `weights_only` will be flipped to `True`. This limits the functions that could be executed during unpickling. Arbitrary objects will no longer be allowed to be loaded via this mode unless they are explicitly allowlisted by the user via `torch.serialization.add_safe_globals`. We recommend you start setting `weights_only=True` for any use case where you don't have full control of the loaded file. Please open an issue on GitHub for any issues related to this experimental feature.
  self.data, self.slices = torch.load(self.processed_paths[0])
