STDOUT:
Results will be saved in /home/philip/projects/ltspice_examples_code_repo/Circuit-Completion-Using-GNNs/component_classification_with_link_prediction_head/evaluation/FEGIN/results/model_FEGIN_dataset_ltspice_demos
Command line input: python main.py --data ltspice_demos --representation component_pin --model FEGIN --layers 2 --hiddens 128 --batch_size 32 --lr 0.0001 --emb_size 250 --epochs 100 --save_appendix component_pin_L2_H128_BS32_LR0.0001_E250 --no_val
 is saved.
-----
ltspice_demos - FEGIN
Using 2 layers, 128 hidden units, h = 2
Loading component_pin representation dataset
ENTERED
Training FEGIN on component_pin representation
Train: 1565, Test: 383
##################ITERATION #0 ****************************************
 epoch: 0, train_loss: 1.3518, test_loss: 1.3472, test_f1: 0.3381
 epoch: 1, train_loss: 1.3004, test_loss: 1.3038, test_f1: 0.2850
 epoch: 2, train_loss: 1.2428, test_loss: 1.2569, test_f1: 0.2872
 epoch: 3, train_loss: 1.1857, test_loss: 1.2237, test_f1: 0.4206
 epoch: 4, train_loss: 1.1398, test_loss: 1.1914, test_f1: 0.4522
 epoch: 5, train_loss: 1.1032, test_loss: 1.1470, test_f1: 0.4490
 epoch: 6, train_loss: 1.0565, test_loss: 1.1172, test_f1: 0.4529
 epoch: 7, train_loss: 1.0256, test_loss: 1.0893, test_f1: 0.4567
 epoch: 8, train_loss: 1.0031, test_loss: 1.0678, test_f1: 0.4497
 epoch: 9, train_loss: 0.9810, test_loss: 1.0527, test_f1: 0.4513
 epoch: 10, train_loss: 0.9650, test_loss: 1.0432, test_f1: 0.4610
 epoch: 11, train_loss: 0.9482, test_loss: 1.0150, test_f1: 0.4556
 epoch: 12, train_loss: 0.9280, test_loss: 1.0215, test_f1: 0.4904
 epoch: 13, train_loss: 0.9077, test_loss: 0.9969, test_f1: 0.5374
 epoch: 14, train_loss: 0.8908, test_loss: 0.9911, test_f1: 0.5406
 epoch: 15, train_loss: 0.8773, test_loss: 0.9750, test_f1: 0.5669
 epoch: 16, train_loss: 0.8575, test_loss: 0.9634, test_f1: 0.5850
 epoch: 17, train_loss: 0.8448, test_loss: 0.9694, test_f1: 0.5928
 epoch: 18, train_loss: 0.8265, test_loss: 0.9714, test_f1: 0.6125
 epoch: 19, train_loss: 0.8000, test_loss: 0.9644, test_f1: 0.6048
 epoch: 20, train_loss: 0.7929, test_loss: 0.9678, test_f1: 0.6129
 epoch: 21, train_loss: 0.7743, test_loss: 0.9538, test_f1: 0.6114
 epoch: 22, train_loss: 0.7612, test_loss: 0.9532, test_f1: 0.6066
 epoch: 23, train_loss: 0.7518, test_loss: 0.9637, test_f1: 0.6093
 epoch: 24, train_loss: 0.7324, test_loss: 0.9504, test_f1: 0.6339
 epoch: 25, train_loss: 0.7125, test_loss: 0.9592, test_f1: 0.6080
 epoch: 26, train_loss: 0.7130, test_loss: 0.9572, test_f1: 0.6046
 epoch: 27, train_loss: 0.6994, test_loss: 0.9562, test_f1: 0.6226
 epoch: 28, train_loss: 0.6858, test_loss: 0.9896, test_f1: 0.5892
 epoch: 29, train_loss: 0.6847, test_loss: 0.9914, test_f1: 0.6050
 epoch: 30, train_loss: 0.6709, test_loss: 0.9682, test_f1: 0.5894
 epoch: 31, train_loss: 0.6651, test_loss: 1.0162, test_f1: 0.6156
 epoch: 32, train_loss: 0.6614, test_loss: 1.0061, test_f1: 0.6128
 epoch: 33, train_loss: 0.6576, test_loss: 1.0356, test_f1: 0.5941
 epoch: 34, train_loss: 0.6438, test_loss: 0.9907, test_f1: 0.5991
 epoch: 35, train_loss: 0.6256, test_loss: 1.0443, test_f1: 0.5826
 epoch: 36, train_loss: 0.6384, test_loss: 1.0080, test_f1: 0.6211
 epoch: 37, train_loss: 0.6227, test_loss: 0.9774, test_f1: 0.6101
 epoch: 38, train_loss: 0.6345, test_loss: 1.0162, test_f1: 0.6152
 epoch: 39, train_loss: 0.6116, test_loss: 1.0385, test_f1: 0.6110
 epoch: 40, train_loss: 0.6037, test_loss: 1.0286, test_f1: 0.5752
 epoch: 41, train_loss: 0.6093, test_loss: 1.0444, test_f1: 0.5879
 epoch: 42, train_loss: 0.5837, test_loss: 1.0573, test_f1: 0.5852
 epoch: 43, train_loss: 0.5721, test_loss: 1.0258, test_f1: 0.5975
 epoch: 44, train_loss: 0.5788, test_loss: 1.0671, test_f1: 0.6073
 epoch: 45, train_loss: 0.5864, test_loss: 1.0702, test_f1: 0.5942
 epoch: 46, train_loss: 0.5645, test_loss: 1.0245, test_f1: 0.5995
 epoch: 47, train_loss: 0.5846, test_loss: 1.0656, test_f1: 0.6161
 epoch: 48, train_loss: 0.5619, test_loss: 1.0242, test_f1: 0.6121
 epoch: 49, train_loss: 0.5456, test_loss: 1.0489, test_f1: 0.6083
 epoch: 50, train_loss: 0.5582, test_loss: 1.1640, test_f1: 0.5344
 epoch: 51, train_loss: 0.5207, test_loss: 1.0947, test_f1: 0.5683
 epoch: 52, train_loss: 0.5198, test_loss: 1.1314, test_f1: 0.5441
 epoch: 53, train_loss: 0.5190, test_loss: 1.1371, test_f1: 0.5484
 epoch: 54, train_loss: 0.5073, test_loss: 1.0732, test_f1: 0.5957
 epoch: 55, train_loss: 0.5136, test_loss: 1.1052, test_f1: 0.5902
 epoch: 56, train_loss: 0.5177, test_loss: 1.0453, test_f1: 0.6082
 epoch: 57, train_loss: 0.5012, test_loss: 1.0874, test_f1: 0.5881
 epoch: 58, train_loss: 0.4986, test_loss: 1.1031, test_f1: 0.6010
 epoch: 59, train_loss: 0.5046, test_loss: 1.1244, test_f1: 0.5704
 epoch: 60, train_loss: 0.4893, test_loss: 1.1462, test_f1: 0.5767
 epoch: 61, train_loss: 0.4756, test_loss: 1.2059, test_f1: 0.5683
 epoch: 62, train_loss: 0.4837, test_loss: 1.2052, test_f1: 0.5669
 epoch: 63, train_loss: 0.4791, test_loss: 1.1812, test_f1: 0.5822
 epoch: 64, train_loss: 0.4854, test_loss: 1.1751, test_f1: 0.5674
 epoch: 65, train_loss: 0.4846, test_loss: 1.1014, test_f1: 0.6295
 epoch: 66, train_loss: 0.4625, test_loss: 1.1755, test_f1: 0.6117
 epoch: 67, train_loss: 0.4723, test_loss: 1.1265, test_f1: 0.6257
 epoch: 68, train_loss: 0.4646, test_loss: 1.1647, test_f1: 0.5964
 epoch: 69, train_loss: 0.4616, test_loss: 1.2116, test_f1: 0.5883
 epoch: 70, train_loss: 0.4609, test_loss: 1.2044, test_f1: 0.6159
 epoch: 71, train_loss: 0.4559, test_loss: 1.2449, test_f1: 0.5988
 epoch: 72, train_loss: 0.4492, test_loss: 1.1279, test_f1: 0.6304
 epoch: 73, train_loss: 0.4491, test_loss: 1.1831, test_f1: 0.6120
 epoch: 74, train_loss: 0.4498, test_loss: 1.3139, test_f1: 0.5728
 epoch: 75, train_loss: 0.4386, test_loss: 1.2968, test_f1: 0.5593
 epoch: 76, train_loss: 0.4315, test_loss: 1.2768, test_f1: 0.5685
 epoch: 77, train_loss: 0.4381, test_loss: 1.2653, test_f1: 0.5888
 epoch: 78, train_loss: 0.4334, test_loss: 1.2893, test_f1: 0.5675
 epoch: 79, train_loss: 0.4221, test_loss: 1.1946, test_f1: 0.6274
 epoch: 80, train_loss: 0.4221, test_loss: 1.2667, test_f1: 0.5999
 epoch: 81, train_loss: 0.4309, test_loss: 1.2948, test_f1: 0.6002
 epoch: 82, train_loss: 0.4150, test_loss: 1.2436, test_f1: 0.6020
 epoch: 83, train_loss: 0.4225, test_loss: 1.2699, test_f1: 0.6116
 epoch: 84, train_loss: 0.4216, test_loss: 1.2255, test_f1: 0.6082
 epoch: 85, train_loss: 0.4261, test_loss: 1.3079, test_f1: 0.6114
 epoch: 86, train_loss: 0.4135, test_loss: 1.2899, test_f1: 0.6089
 epoch: 87, train_loss: 0.3953, test_loss: 1.2948, test_f1: 0.6145
 epoch: 88, train_loss: 0.4183, test_loss: 1.2293, test_f1: 0.6068
 epoch: 89, train_loss: 0.4216, test_loss: 1.2667, test_f1: 0.6305
 epoch: 90, train_loss: 0.4121, test_loss: 1.2327, test_f1: 0.6130
 epoch: 91, train_loss: 0.3939, test_loss: 1.2493, test_f1: 0.6112
 epoch: 92, train_loss: 0.3846, test_loss: 1.2765, test_f1: 0.6143
 epoch: 93, train_loss: 0.3854, test_loss: 1.2792, test_f1: 0.6173
 epoch: 94, train_loss: 0.3771, test_loss: 1.3575, test_f1: 0.5958
 epoch: 95, train_loss: 0.3794, test_loss: 1.3002, test_f1: 0.6437
 epoch: 96, train_loss: 0.3970, test_loss: 1.3524, test_f1: 0.6062
 epoch: 97, train_loss: 0.3840, test_loss: 1.3532, test_f1: 0.6222
 epoch: 98, train_loss: 0.3702, test_loss: 1.2831, test_f1: 0.6218
 epoch: 99, train_loss: 0.3836, test_loss: 1.3860, test_f1: 0.6355
##################ITERATION #1 ****************************************
 epoch: 0, train_loss: 1.2552, test_loss: 1.2922, test_f1: 0.2614
 epoch: 1, train_loss: 1.1770, test_loss: 1.2250, test_f1: 0.4278
 epoch: 2, train_loss: 1.1293, test_loss: 1.1827, test_f1: 0.4275
 epoch: 3, train_loss: 1.0695, test_loss: 1.1333, test_f1: 0.4282
 epoch: 4, train_loss: 1.0259, test_loss: 1.0951, test_f1: 0.4996
 epoch: 5, train_loss: 0.9850, test_loss: 1.0516, test_f1: 0.5306
 epoch: 6, train_loss: 0.9514, test_loss: 1.0332, test_f1: 0.5426
 epoch: 7, train_loss: 0.9197, test_loss: 1.0138, test_f1: 0.5607
 epoch: 8, train_loss: 0.9080, test_loss: 1.0172, test_f1: 0.5879
 epoch: 9, train_loss: 0.8761, test_loss: 1.0075, test_f1: 0.5928
 epoch: 10, train_loss: 0.8609, test_loss: 0.9846, test_f1: 0.6031
 epoch: 11, train_loss: 0.8436, test_loss: 0.9750, test_f1: 0.5930
 epoch: 12, train_loss: 0.8321, test_loss: 0.9755, test_f1: 0.5926
 epoch: 13, train_loss: 0.8001, test_loss: 0.9745, test_f1: 0.5874
 epoch: 14, train_loss: 0.7826, test_loss: 0.9829, test_f1: 0.5803
 epoch: 15, train_loss: 0.7766, test_loss: 0.9724, test_f1: 0.5805
 epoch: 16, train_loss: 0.7554, test_loss: 1.0044, test_f1: 0.5805
 epoch: 17, train_loss: 0.7422, test_loss: 1.0131, test_f1: 0.5781
 epoch: 18, train_loss: 0.7445, test_loss: 0.9990, test_f1: 0.6000
 epoch: 19, train_loss: 0.7227, test_loss: 1.0093, test_f1: 0.5827
 epoch: 20, train_loss: 0.7096, test_loss: 0.9876, test_f1: 0.5961
 epoch: 21, train_loss: 0.7089, test_loss: 0.9700, test_f1: 0.5973
 epoch: 22, train_loss: 0.6754, test_loss: 0.9953, test_f1: 0.6059
 epoch: 23, train_loss: 0.6781, test_loss: 1.0347, test_f1: 0.5749
 epoch: 24, train_loss: 0.6645, test_loss: 1.0425, test_f1: 0.5902
 epoch: 25, train_loss: 0.6640, test_loss: 1.0319, test_f1: 0.5823
 epoch: 26, train_loss: 0.6369, test_loss: 1.0132, test_f1: 0.5925
 epoch: 27, train_loss: 0.6526, test_loss: 1.0418, test_f1: 0.5793
 epoch: 28, train_loss: 0.6378, test_loss: 0.9940, test_f1: 0.6201
 epoch: 29, train_loss: 0.6147, test_loss: 1.0478, test_f1: 0.6162
 epoch: 30, train_loss: 0.6107, test_loss: 0.9948, test_f1: 0.6051
 epoch: 31, train_loss: 0.5931, test_loss: 1.0809, test_f1: 0.6234
 epoch: 32, train_loss: 0.5964, test_loss: 1.0489, test_f1: 0.5764
 epoch: 33, train_loss: 0.5863, test_loss: 1.0334, test_f1: 0.5811
 epoch: 34, train_loss: 0.5744, test_loss: 1.0720, test_f1: 0.6092
 epoch: 35, train_loss: 0.5855, test_loss: 1.0892, test_f1: 0.6121
 epoch: 36, train_loss: 0.5704, test_loss: 1.1065, test_f1: 0.6006
 epoch: 37, train_loss: 0.5644, test_loss: 1.1825, test_f1: 0.5823
 epoch: 38, train_loss: 0.5415, test_loss: 1.0905, test_f1: 0.6102
 epoch: 39, train_loss: 0.5472, test_loss: 1.1058, test_f1: 0.6110
 epoch: 40, train_loss: 0.5450, test_loss: 1.1822, test_f1: 0.5854
 epoch: 41, train_loss: 0.5141, test_loss: 1.1659, test_f1: 0.6170
 epoch: 42, train_loss: 0.5032, test_loss: 1.1650, test_f1: 0.6074
 epoch: 43, train_loss: 0.4970, test_loss: 1.1776, test_f1: 0.5907
 epoch: 44, train_loss: 0.5198, test_loss: 1.1169, test_f1: 0.6066
 epoch: 45, train_loss: 0.5084, test_loss: 1.1558, test_f1: 0.6186
 epoch: 46, train_loss: 0.5010, test_loss: 1.1955, test_f1: 0.5976
 epoch: 47, train_loss: 0.4758, test_loss: 1.2534, test_f1: 0.6033
 epoch: 48, train_loss: 0.4773, test_loss: 1.3944, test_f1: 0.5914
 epoch: 49, train_loss: 0.4763, test_loss: 1.2837, test_f1: 0.5989
 epoch: 50, train_loss: 0.4682, test_loss: 1.3185, test_f1: 0.6042
 epoch: 51, train_loss: 0.4484, test_loss: 1.3538, test_f1: 0.6055
 epoch: 52, train_loss: 0.4430, test_loss: 1.3335, test_f1: 0.6109
 epoch: 53, train_loss: 0.4332, test_loss: 1.3757, test_f1: 0.6041
 epoch: 54, train_loss: 0.4373, test_loss: 1.3265, test_f1: 0.6138
 epoch: 55, train_loss: 0.4406, test_loss: 1.3395, test_f1: 0.6017
 epoch: 56, train_loss: 0.4275, test_loss: 1.3154, test_f1: 0.6068
 epoch: 57, train_loss: 0.4422, test_loss: 1.3528, test_f1: 0.6218
 epoch: 58, train_loss: 0.4178, test_loss: 1.3626, test_f1: 0.5937
 epoch: 59, train_loss: 0.4078, test_loss: 1.3068, test_f1: 0.6199
 epoch: 60, train_loss: 0.4194, test_loss: 1.3630, test_f1: 0.6213
 epoch: 61, train_loss: 0.4044, test_loss: 1.4044, test_f1: 0.6126
 epoch: 62, train_loss: 0.3931, test_loss: 1.4398, test_f1: 0.5961
 epoch: 63, train_loss: 0.3951, test_loss: 1.3949, test_f1: 0.6027
 epoch: 64, train_loss: 0.4017, test_loss: 1.4422, test_f1: 0.6064
 epoch: 65, train_loss: 0.3980, test_loss: 1.4745, test_f1: 0.6241
 epoch: 66, train_loss: 0.3880, test_loss: 1.5523, test_f1: 0.6093
 epoch: 67, train_loss: 0.3816, test_loss: 1.4503, test_f1: 0.6010
 epoch: 68, train_loss: 0.3767, test_loss: 1.4421, test_f1: 0.6183
 epoch: 69, train_loss: 0.3851, test_loss: 1.5073, test_f1: 0.6382
 epoch: 70, train_loss: 0.3817, test_loss: 1.5823, test_f1: 0.6050
 epoch: 71, train_loss: 0.3780, test_loss: 1.5180, test_f1: 0.6105
 epoch: 72, train_loss: 0.3763, test_loss: 1.6802, test_f1: 0.5940
 epoch: 73, train_loss: 0.3679, test_loss: 1.6738, test_f1: 0.5989
 epoch: 74, train_loss: 0.3598, test_loss: 1.6975, test_f1: 0.5775
 epoch: 75, train_loss: 0.3562, test_loss: 1.5046, test_f1: 0.6130
 epoch: 76, train_loss: 0.3535, test_loss: 1.6668, test_f1: 0.5740
 epoch: 77, train_loss: 0.3488, test_loss: 1.7160, test_f1: 0.5981
 epoch: 78, train_loss: 0.3376, test_loss: 1.7968, test_f1: 0.5867
 epoch: 79, train_loss: 0.3431, test_loss: 1.6429, test_f1: 0.6277
 epoch: 80, train_loss: 0.3338, test_loss: 1.6832, test_f1: 0.6013
 epoch: 81, train_loss: 0.3336, test_loss: 1.7019, test_f1: 0.6028
 epoch: 82, train_loss: 0.3447, test_loss: 1.6951, test_f1: 0.5931
 epoch: 83, train_loss: 0.3583, test_loss: 1.7956, test_f1: 0.5948
 epoch: 84, train_loss: 0.3215, test_loss: 1.8166, test_f1: 0.6001
 epoch: 85, train_loss: 0.3308, test_loss: 1.8784, test_f1: 0.6045
 epoch: 86, train_loss: 0.3298, test_loss: 1.7523, test_f1: 0.5876
 epoch: 87, train_loss: 0.3181, test_loss: 1.8391, test_f1: 0.6039
 epoch: 88, train_loss: 0.3325, test_loss: 1.7477, test_f1: 0.5972
 epoch: 89, train_loss: 0.3291, test_loss: 1.6529, test_f1: 0.5988
 epoch: 90, train_loss: 0.3053, test_loss: 1.7605, test_f1: 0.6183
 epoch: 91, train_loss: 0.3093, test_loss: 1.7479, test_f1: 0.6138
 epoch: 92, train_loss: 0.3124, test_loss: 1.7971, test_f1: 0.6183
 epoch: 93, train_loss: 0.3018, test_loss: 1.7558, test_f1: 0.6111
 epoch: 94, train_loss: 0.2932, test_loss: 1.9110, test_f1: 0.6006
 epoch: 95, train_loss: 0.2870, test_loss: 1.7997, test_f1: 0.6025
 epoch: 96, train_loss: 0.3026, test_loss: 1.8085, test_f1: 0.5968
 epoch: 97, train_loss: 0.2960, test_loss: 1.8196, test_f1: 0.6088
 epoch: 98, train_loss: 0.3111, test_loss: 1.8103, test_f1: 0.6365
 epoch: 99, train_loss: 0.2942, test_loss: 2.2265, test_f1: 0.6257
##################ITERATION #2 ****************************************
 epoch: 0, train_loss: 1.2202, test_loss: 1.2584, test_f1: 0.3667
 epoch: 1, train_loss: 1.1242, test_loss: 1.1702, test_f1: 0.4568
 epoch: 2, train_loss: 1.0782, test_loss: 1.1329, test_f1: 0.4445
 epoch: 3, train_loss: 1.0351, test_loss: 1.0940, test_f1: 0.5204
 epoch: 4, train_loss: 0.9972, test_loss: 1.0578, test_f1: 0.5191
 epoch: 5, train_loss: 0.9650, test_loss: 1.0226, test_f1: 0.5427
 epoch: 6, train_loss: 0.9273, test_loss: 0.9955, test_f1: 0.5585
 epoch: 7, train_loss: 0.9139, test_loss: 0.9769, test_f1: 0.5767
 epoch: 8, train_loss: 0.8848, test_loss: 0.9700, test_f1: 0.5890
 epoch: 9, train_loss: 0.8659, test_loss: 0.9579, test_f1: 0.5775
 epoch: 10, train_loss: 0.8432, test_loss: 0.9512, test_f1: 0.6126
 epoch: 11, train_loss: 0.8247, test_loss: 0.9454, test_f1: 0.6048
 epoch: 12, train_loss: 0.8074, test_loss: 0.9408, test_f1: 0.6180
 epoch: 13, train_loss: 0.7972, test_loss: 0.9458, test_f1: 0.6372
 epoch: 14, train_loss: 0.7782, test_loss: 0.9458, test_f1: 0.6312
 epoch: 15, train_loss: 0.7441, test_loss: 0.9535, test_f1: 0.6063
 epoch: 16, train_loss: 0.7472, test_loss: 0.9626, test_f1: 0.6546
 epoch: 17, train_loss: 0.7268, test_loss: 0.9627, test_f1: 0.6092
 epoch: 18, train_loss: 0.7148, test_loss: 0.9945, test_f1: 0.6088
 epoch: 19, train_loss: 0.7027, test_loss: 1.0058, test_f1: 0.6055
 epoch: 20, train_loss: 0.6906, test_loss: 1.0096, test_f1: 0.6312
 epoch: 21, train_loss: 0.6952, test_loss: 1.0017, test_f1: 0.5977
 epoch: 22, train_loss: 0.6723, test_loss: 1.0473, test_f1: 0.5969
 epoch: 23, train_loss: 0.6685, test_loss: 1.0037, test_f1: 0.6022
 epoch: 24, train_loss: 0.6565, test_loss: 1.0343, test_f1: 0.6134
 epoch: 25, train_loss: 0.6494, test_loss: 1.0303, test_f1: 0.5912
 epoch: 26, train_loss: 0.6438, test_loss: 1.0457, test_f1: 0.6299
 epoch: 27, train_loss: 0.6214, test_loss: 1.0916, test_f1: 0.6258
 epoch: 28, train_loss: 0.6277, test_loss: 1.0597, test_f1: 0.6326
 epoch: 29, train_loss: 0.6221, test_loss: 1.0616, test_f1: 0.6241
 epoch: 30, train_loss: 0.5978, test_loss: 1.0696, test_f1: 0.5966
 epoch: 31, train_loss: 0.5925, test_loss: 1.1231, test_f1: 0.6096
 epoch: 32, train_loss: 0.5899, test_loss: 1.1026, test_f1: 0.5903
 epoch: 33, train_loss: 0.5651, test_loss: 1.0925, test_f1: 0.5846
 epoch: 34, train_loss: 0.5700, test_loss: 1.1152, test_f1: 0.6142
 epoch: 35, train_loss: 0.5587, test_loss: 1.1883, test_f1: 0.5977
 epoch: 36, train_loss: 0.5569, test_loss: 1.1439, test_f1: 0.5929
 epoch: 37, train_loss: 0.5495, test_loss: 1.1933, test_f1: 0.5872
 epoch: 38, train_loss: 0.5368, test_loss: 1.2683, test_f1: 0.5763
 epoch: 39, train_loss: 0.5270, test_loss: 1.2547, test_f1: 0.5996
 epoch: 40, train_loss: 0.5468, test_loss: 1.2220, test_f1: 0.6111
 epoch: 41, train_loss: 0.5108, test_loss: 1.2794, test_f1: 0.5965
 epoch: 42, train_loss: 0.5113, test_loss: 1.1696, test_f1: 0.5911
 epoch: 43, train_loss: 0.4981, test_loss: 1.3035, test_f1: 0.5898
 epoch: 44, train_loss: 0.5097, test_loss: 1.2880, test_f1: 0.6133
 epoch: 45, train_loss: 0.4956, test_loss: 1.3419, test_f1: 0.5857
 epoch: 46, train_loss: 0.4913, test_loss: 1.2411, test_f1: 0.5902
 epoch: 47, train_loss: 0.4589, test_loss: 1.3025, test_f1: 0.5926
 epoch: 48, train_loss: 0.4712, test_loss: 1.3807, test_f1: 0.5655
 epoch: 49, train_loss: 0.4731, test_loss: 1.3172, test_f1: 0.6237
 epoch: 50, train_loss: 0.4639, test_loss: 1.2489, test_f1: 0.6144
 epoch: 51, train_loss: 0.4544, test_loss: 1.2761, test_f1: 0.5952
 epoch: 52, train_loss: 0.4230, test_loss: 1.3627, test_f1: 0.6070
 epoch: 53, train_loss: 0.4198, test_loss: 1.3623, test_f1: 0.5923
 epoch: 54, train_loss: 0.4258, test_loss: 1.3555, test_f1: 0.6115
 epoch: 55, train_loss: 0.4245, test_loss: 1.4410, test_f1: 0.5966
 epoch: 56, train_loss: 0.4268, test_loss: 1.3368, test_f1: 0.6049
 epoch: 57, train_loss: 0.4075, test_loss: 1.3489, test_f1: 0.6200
 epoch: 58, train_loss: 0.3923, test_loss: 1.4117, test_f1: 0.5859
 epoch: 59, train_loss: 0.4096, test_loss: 1.5143, test_f1: 0.5992
 epoch: 60, train_loss: 0.3924, test_loss: 1.4429, test_f1: 0.5925
 epoch: 61, train_loss: 0.3908, test_loss: 1.5372, test_f1: 0.6175
 epoch: 62, train_loss: 0.3827, test_loss: 1.4350, test_f1: 0.6033
 epoch: 63, train_loss: 0.3869, test_loss: 1.5187, test_f1: 0.6088
 epoch: 64, train_loss: 0.3918, test_loss: 1.4613, test_f1: 0.6044
 epoch: 65, train_loss: 0.3672, test_loss: 1.4734, test_f1: 0.5913
 epoch: 66, train_loss: 0.3674, test_loss: 1.4489, test_f1: 0.5998
 epoch: 67, train_loss: 0.3749, test_loss: 1.5097, test_f1: 0.5970
 epoch: 68, train_loss: 0.3777, test_loss: 1.6383, test_f1: 0.5673
 epoch: 69, train_loss: 0.3738, test_loss: 1.5347, test_f1: 0.6186
 epoch: 70, train_loss: 0.3721, test_loss: 1.4948, test_f1: 0.5795
 epoch: 71, train_loss: 0.3642, test_loss: 1.4691, test_f1: 0.6135
 epoch: 72, train_loss: 0.3470, test_loss: 1.5612, test_f1: 0.6070
 epoch: 73, train_loss: 0.3563, test_loss: 1.6140, test_f1: 0.6294
 epoch: 74, train_loss: 0.3442, test_loss: 1.5483, test_f1: 0.6145
 epoch: 75, train_loss: 0.3391, test_loss: 1.5896, test_f1: 0.6219
 epoch: 76, train_loss: 0.3267, test_loss: 1.5361, test_f1: 0.6073
 epoch: 77, train_loss: 0.3299, test_loss: 1.5703, test_f1: 0.6024
 epoch: 78, train_loss: 0.3405, test_loss: 1.5965, test_f1: 0.5950
 epoch: 79, train_loss: 0.3507, test_loss: 1.6014, test_f1: 0.6269
 epoch: 80, train_loss: 0.3380, test_loss: 1.6467, test_f1: 0.6020
 epoch: 81, train_loss: 0.3218, test_loss: 1.7154, test_f1: 0.5947
 epoch: 82, train_loss: 0.3227, test_loss: 1.6625, test_f1: 0.6307
 epoch: 83, train_loss: 0.3283, test_loss: 1.7645, test_f1: 0.6041
 epoch: 84, train_loss: 0.3256, test_loss: 1.5957, test_f1: 0.5942
 epoch: 85, train_loss: 0.3207, test_loss: 1.6041, test_f1: 0.6140
 epoch: 86, train_loss: 0.3129, test_loss: 1.7644, test_f1: 0.6236
 epoch: 87, train_loss: 0.3171, test_loss: 1.7050, test_f1: 0.6097
 epoch: 88, train_loss: 0.3156, test_loss: 1.7104, test_f1: 0.6378
 epoch: 89, train_loss: 0.2835, test_loss: 1.7540, test_f1: 0.5987
 epoch: 90, train_loss: 0.2936, test_loss: 1.7531, test_f1: 0.6209
 epoch: 91, train_loss: 0.3010, test_loss: 1.7093, test_f1: 0.5970
 epoch: 92, train_loss: 0.3269, test_loss: 1.7381, test_f1: 0.6260
 epoch: 93, train_loss: 0.2914, test_loss: 1.7010, test_f1: 0.6303
 epoch: 94, train_loss: 0.2713, test_loss: 1.6688, test_f1: 0.6162
 epoch: 95, train_loss: 0.2852, test_loss: 1.8136, test_f1: 0.6010
 epoch: 96, train_loss: 0.3042, test_loss: 1.7332, test_f1: 0.6123
 epoch: 97, train_loss: 0.2875, test_loss: 1.8160, test_f1: 0.6158
 epoch: 98, train_loss: 0.2798, test_loss: 1.7444, test_f1: 0.5918
 epoch: 99, train_loss: 0.2845, test_loss: 1.8075, test_f1: 0.5900
##################ITERATION #3 ****************************************
 epoch: 0, train_loss: 1.2044, test_loss: 1.2289, test_f1: 0.3212
 epoch: 1, train_loss: 1.0931, test_loss: 1.1177, test_f1: 0.4916
 epoch: 2, train_loss: 1.0400, test_loss: 1.0820, test_f1: 0.5269
 epoch: 3, train_loss: 0.9956, test_loss: 1.0365, test_f1: 0.5514
 epoch: 4, train_loss: 0.9531, test_loss: 1.0205, test_f1: 0.5662
 epoch: 5, train_loss: 0.9089, test_loss: 1.0020, test_f1: 0.5852
 epoch: 6, train_loss: 0.8805, test_loss: 0.9796, test_f1: 0.5944
 epoch: 7, train_loss: 0.8503, test_loss: 0.9718, test_f1: 0.5967
 epoch: 8, train_loss: 0.8352, test_loss: 0.9292, test_f1: 0.5863
 epoch: 9, train_loss: 0.8015, test_loss: 0.9559, test_f1: 0.6053
 epoch: 10, train_loss: 0.7830, test_loss: 0.9599, test_f1: 0.6183
 epoch: 11, train_loss: 0.7754, test_loss: 0.9554, test_f1: 0.6090
 epoch: 12, train_loss: 0.7503, test_loss: 0.9501, test_f1: 0.6234
 epoch: 13, train_loss: 0.7486, test_loss: 0.9357, test_f1: 0.6062
 epoch: 14, train_loss: 0.7258, test_loss: 0.9449, test_f1: 0.6306
 epoch: 15, train_loss: 0.7125, test_loss: 0.9386, test_f1: 0.6175
 epoch: 16, train_loss: 0.7240, test_loss: 0.9244, test_f1: 0.5989
 epoch: 17, train_loss: 0.6913, test_loss: 0.9583, test_f1: 0.6188
 epoch: 18, train_loss: 0.6724, test_loss: 0.9603, test_f1: 0.6000
 epoch: 19, train_loss: 0.6784, test_loss: 1.0714, test_f1: 0.6028
 epoch: 20, train_loss: 0.6764, test_loss: 0.9589, test_f1: 0.6445
 epoch: 21, train_loss: 0.6757, test_loss: 0.9573, test_f1: 0.6102
 epoch: 22, train_loss: 0.6556, test_loss: 1.0009, test_f1: 0.6100
 epoch: 23, train_loss: 0.6571, test_loss: 1.0006, test_f1: 0.5988
 epoch: 24, train_loss: 0.6381, test_loss: 0.9976, test_f1: 0.6109
 epoch: 25, train_loss: 0.6260, test_loss: 0.9824, test_f1: 0.5819
 epoch: 26, train_loss: 0.6253, test_loss: 0.9715, test_f1: 0.6173
 epoch: 27, train_loss: 0.6165, test_loss: 1.0765, test_f1: 0.5761
 epoch: 28, train_loss: 0.5838, test_loss: 1.0172, test_f1: 0.5937
 epoch: 29, train_loss: 0.5889, test_loss: 1.0707, test_f1: 0.5743
 epoch: 30, train_loss: 0.5899, test_loss: 1.1285, test_f1: 0.5833
 epoch: 31, train_loss: 0.5908, test_loss: 1.1306, test_f1: 0.5819
 epoch: 32, train_loss: 0.5623, test_loss: 1.0996, test_f1: 0.5460
 epoch: 33, train_loss: 0.5700, test_loss: 1.0405, test_f1: 0.5656
 epoch: 34, train_loss: 0.5555, test_loss: 1.1423, test_f1: 0.5761
 epoch: 35, train_loss: 0.5563, test_loss: 1.0634, test_f1: 0.6168
 epoch: 36, train_loss: 0.5574, test_loss: 1.1430, test_f1: 0.6058
 epoch: 37, train_loss: 0.5449, test_loss: 1.1581, test_f1: 0.6043
 epoch: 38, train_loss: 0.5455, test_loss: 1.1481, test_f1: 0.5617
 epoch: 39, train_loss: 0.5517, test_loss: 1.1477, test_f1: 0.5989
 epoch: 40, train_loss: 0.5251, test_loss: 1.1435, test_f1: 0.5944
 epoch: 41, train_loss: 0.5243, test_loss: 1.1393, test_f1: 0.5960
 epoch: 42, train_loss: 0.5151, test_loss: 1.1383, test_f1: 0.5956
 epoch: 43, train_loss: 0.5159, test_loss: 1.1777, test_f1: 0.5618
 epoch: 44, train_loss: 0.5113, test_loss: 1.1458, test_f1: 0.5949
 epoch: 45, train_loss: 0.4849, test_loss: 1.1978, test_f1: 0.5890
 epoch: 46, train_loss: 0.4801, test_loss: 1.1585, test_f1: 0.6261
 epoch: 47, train_loss: 0.4826, test_loss: 1.2067, test_f1: 0.5762
 epoch: 48, train_loss: 0.4817, test_loss: 1.2504, test_f1: 0.6309
 epoch: 49, train_loss: 0.4844, test_loss: 1.2291, test_f1: 0.5828
 epoch: 50, train_loss: 0.4718, test_loss: 1.3855, test_f1: 0.5953
 epoch: 51, train_loss: 0.4576, test_loss: 1.3691, test_f1: 0.5702
 epoch: 52, train_loss: 0.4531, test_loss: 1.3543, test_f1: 0.5831
 epoch: 53, train_loss: 0.4508, test_loss: 1.2968, test_f1: 0.5816
 epoch: 54, train_loss: 0.4379, test_loss: 1.3220, test_f1: 0.5991
 epoch: 55, train_loss: 0.4366, test_loss: 1.3314, test_f1: 0.5936
 epoch: 56, train_loss: 0.4250, test_loss: 1.3961, test_f1: 0.5918
 epoch: 57, train_loss: 0.4223, test_loss: 1.4332, test_f1: 0.5856
 epoch: 58, train_loss: 0.4290, test_loss: 1.4754, test_f1: 0.5806
 epoch: 59, train_loss: 0.4221, test_loss: 1.3333, test_f1: 0.5934
 epoch: 60, train_loss: 0.4316, test_loss: 1.4154, test_f1: 0.5859
 epoch: 61, train_loss: 0.4014, test_loss: 1.4501, test_f1: 0.6006
 epoch: 62, train_loss: 0.4118, test_loss: 1.3767, test_f1: 0.5845
 epoch: 63, train_loss: 0.4258, test_loss: 1.4742, test_f1: 0.6031
 epoch: 64, train_loss: 0.4029, test_loss: 1.4403, test_f1: 0.5971
 epoch: 65, train_loss: 0.4068, test_loss: 1.5109, test_f1: 0.5974
 epoch: 66, train_loss: 0.4063, test_loss: 1.5637, test_f1: 0.6021
 epoch: 67, train_loss: 0.3788, test_loss: 1.5468, test_f1: 0.5922
 epoch: 68, train_loss: 0.3744, test_loss: 1.4318, test_f1: 0.5866
 epoch: 69, train_loss: 0.3753, test_loss: 1.4771, test_f1: 0.5940
 epoch: 70, train_loss: 0.3836, test_loss: 1.5990, test_f1: 0.6020
 epoch: 71, train_loss: 0.3989, test_loss: 1.5500, test_f1: 0.5870
 epoch: 72, train_loss: 0.3692, test_loss: 1.5175, test_f1: 0.5992
 epoch: 73, train_loss: 0.3867, test_loss: 1.5505, test_f1: 0.5953
 epoch: 74, train_loss: 0.3873, test_loss: 1.6765, test_f1: 0.5934
 epoch: 75, train_loss: 0.3710, test_loss: 1.6834, test_f1: 0.5921
 epoch: 76, train_loss: 0.3742, test_loss: 1.7026, test_f1: 0.5892
 epoch: 77, train_loss: 0.3761, test_loss: 1.6466, test_f1: 0.5928
 epoch: 78, train_loss: 0.3658, test_loss: 1.6568, test_f1: 0.5936
 epoch: 79, train_loss: 0.3697, test_loss: 1.7872, test_f1: 0.5982
 epoch: 80, train_loss: 0.3664, test_loss: 1.8209, test_f1: 0.5893
 epoch: 81, train_loss: 0.3456, test_loss: 1.7255, test_f1: 0.5939
 epoch: 82, train_loss: 0.3353, test_loss: 1.6680, test_f1: 0.5939
 epoch: 83, train_loss: 0.3594, test_loss: 1.8211, test_f1: 0.5923
 epoch: 84, train_loss: 0.3473, test_loss: 1.6838, test_f1: 0.5956
 epoch: 85, train_loss: 0.3302, test_loss: 1.7821, test_f1: 0.5948
 epoch: 86, train_loss: 0.3217, test_loss: 1.8205, test_f1: 0.5896
 epoch: 87, train_loss: 0.3403, test_loss: 1.7864, test_f1: 0.5901
 epoch: 88, train_loss: 0.3387, test_loss: 1.8197, test_f1: 0.5863
 epoch: 89, train_loss: 0.3363, test_loss: 1.8912, test_f1: 0.5769
 epoch: 90, train_loss: 0.3477, test_loss: 1.8096, test_f1: 0.5960
 epoch: 91, train_loss: 0.3268, test_loss: 1.8981, test_f1: 0.5936
 epoch: 92, train_loss: 0.3449, test_loss: 1.9575, test_f1: 0.5943
 epoch: 93, train_loss: 0.3212, test_loss: 2.0140, test_f1: 0.5965
 epoch: 94, train_loss: 0.3232, test_loss: 1.9862, test_f1: 0.5989
 epoch: 95, train_loss: 0.3253, test_loss: 1.9585, test_f1: 0.5947
 epoch: 96, train_loss: 0.3180, test_loss: 1.8100, test_f1: 0.5990
 epoch: 97, train_loss: 0.3198, test_loss: 2.0087, test_f1: 0.5853
 epoch: 98, train_loss: 0.3118, test_loss: 1.9989, test_f1: 0.5842
 epoch: 99, train_loss: 0.2941, test_loss: 1.9747, test_f1: 0.6130
##################ITERATION #4 ****************************************
 epoch: 0, train_loss: 1.1902, test_loss: 1.2068, test_f1: 0.3678
 epoch: 1, train_loss: 1.0784, test_loss: 1.0970, test_f1: 0.5124
 epoch: 2, train_loss: 1.0032, test_loss: 1.0588, test_f1: 0.5189
 epoch: 3, train_loss: 0.9772, test_loss: 1.0326, test_f1: 0.5599
 epoch: 4, train_loss: 0.9449, test_loss: 0.9900, test_f1: 0.5725
 epoch: 5, train_loss: 0.9193, test_loss: 1.0007, test_f1: 0.5215
 epoch: 6, train_loss: 0.8919, test_loss: 0.9615, test_f1: 0.5847
 epoch: 7, train_loss: 0.8779, test_loss: 0.9504, test_f1: 0.5589
 epoch: 8, train_loss: 0.8400, test_loss: 0.9710, test_f1: 0.5890
 epoch: 9, train_loss: 0.8221, test_loss: 0.9858, test_f1: 0.5453
 epoch: 10, train_loss: 0.8142, test_loss: 0.9691, test_f1: 0.5462
 epoch: 11, train_loss: 0.7945, test_loss: 0.9850, test_f1: 0.5722
 epoch: 12, train_loss: 0.7713, test_loss: 0.9843, test_f1: 0.5524
 epoch: 13, train_loss: 0.7518, test_loss: 1.0013, test_f1: 0.5704
 epoch: 14, train_loss: 0.7393, test_loss: 1.0275, test_f1: 0.5490
 epoch: 15, train_loss: 0.7399, test_loss: 0.9673, test_f1: 0.5872
 epoch: 16, train_loss: 0.7249, test_loss: 0.9763, test_f1: 0.6078
 epoch: 17, train_loss: 0.6938, test_loss: 1.0413, test_f1: 0.6019
 epoch: 18, train_loss: 0.7062, test_loss: 1.0508, test_f1: 0.6084
 epoch: 19, train_loss: 0.6916, test_loss: 1.0219, test_f1: 0.6039
 epoch: 20, train_loss: 0.6716, test_loss: 1.0533, test_f1: 0.6148
 epoch: 21, train_loss: 0.6622, test_loss: 1.0450, test_f1: 0.6016
 epoch: 22, train_loss: 0.6557, test_loss: 1.1007, test_f1: 0.5785
 epoch: 23, train_loss: 0.6555, test_loss: 1.0383, test_f1: 0.5877
 epoch: 24, train_loss: 0.6303, test_loss: 1.0970, test_f1: 0.5941
 epoch: 25, train_loss: 0.6242, test_loss: 1.1381, test_f1: 0.5944
 epoch: 26, train_loss: 0.6179, test_loss: 1.0657, test_f1: 0.6038
 epoch: 27, train_loss: 0.6034, test_loss: 1.1162, test_f1: 0.5998
 epoch: 28, train_loss: 0.6107, test_loss: 1.1421, test_f1: 0.5868
 epoch: 29, train_loss: 0.5906, test_loss: 1.1447, test_f1: 0.5739
 epoch: 30, train_loss: 0.5773, test_loss: 1.2035, test_f1: 0.5873
 epoch: 31, train_loss: 0.5832, test_loss: 1.1749, test_f1: 0.5701
 epoch: 32, train_loss: 0.5620, test_loss: 1.1762, test_f1: 0.5785
 epoch: 33, train_loss: 0.5535, test_loss: 1.2381, test_f1: 0.5813
 epoch: 34, train_loss: 0.5489, test_loss: 1.2059, test_f1: 0.5817
 epoch: 35, train_loss: 0.5467, test_loss: 1.3175, test_f1: 0.5918
 epoch: 36, train_loss: 0.5465, test_loss: 1.2687, test_f1: 0.5863
 epoch: 37, train_loss: 0.5445, test_loss: 1.3827, test_f1: 0.6076
 epoch: 38, train_loss: 0.5433, test_loss: 1.2881, test_f1: 0.5923
 epoch: 39, train_loss: 0.5235, test_loss: 1.3030, test_f1: 0.5858
 epoch: 40, train_loss: 0.5257, test_loss: 1.2166, test_f1: 0.5946
 epoch: 41, train_loss: 0.5312, test_loss: 1.3642, test_f1: 0.5914
 epoch: 42, train_loss: 0.4804, test_loss: 1.3807, test_f1: 0.6067
 epoch: 43, train_loss: 0.4929, test_loss: 1.4232, test_f1: 0.6030
 epoch: 44, train_loss: 0.4730, test_loss: 1.3223, test_f1: 0.6183
 epoch: 45, train_loss: 0.4815, test_loss: 1.4507, test_f1: 0.5722
 epoch: 46, train_loss: 0.4845, test_loss: 1.4179, test_f1: 0.6054
 epoch: 47, train_loss: 0.4675, test_loss: 1.4425, test_f1: 0.5958
 epoch: 48, train_loss: 0.4805, test_loss: 1.4478, test_f1: 0.5960
 epoch: 49, train_loss: 0.4300, test_loss: 1.5048, test_f1: 0.6028
 epoch: 50, train_loss: 0.4603, test_loss: 1.4197, test_f1: 0.5936
 epoch: 51, train_loss: 0.4351, test_loss: 1.4241, test_f1: 0.5940
 epoch: 52, train_loss: 0.4191, test_loss: 1.5850, test_f1: 0.5712
 epoch: 53, train_loss: 0.4102, test_loss: 1.5509, test_f1: 0.5942
 epoch: 54, train_loss: 0.4122, test_loss: 1.5239, test_f1: 0.5884
 epoch: 55, train_loss: 0.4001, test_loss: 1.5810, test_f1: 0.5810
 epoch: 56, train_loss: 0.3976, test_loss: 1.5802, test_f1: 0.5881
 epoch: 57, train_loss: 0.3979, test_loss: 1.5412, test_f1: 0.5798
 epoch: 58, train_loss: 0.4194, test_loss: 1.6076, test_f1: 0.6016
 epoch: 59, train_loss: 0.4061, test_loss: 1.6288, test_f1: 0.6069
 epoch: 60, train_loss: 0.3901, test_loss: 1.5990, test_f1: 0.5930
 epoch: 61, train_loss: 0.3824, test_loss: 1.6850, test_f1: 0.5820
 epoch: 62, train_loss: 0.3720, test_loss: 1.7042, test_f1: 0.5902
 epoch: 63, train_loss: 0.3784, test_loss: 1.6765, test_f1: 0.5894
 epoch: 64, train_loss: 0.3889, test_loss: 1.7023, test_f1: 0.5803
 epoch: 65, train_loss: 0.3719, test_loss: 1.6793, test_f1: 0.5748
 epoch: 66, train_loss: 0.3815, test_loss: 1.7320, test_f1: 0.5825
 epoch: 67, train_loss: 0.3574, test_loss: 1.7760, test_f1: 0.5858
 epoch: 68, train_loss: 0.3784, test_loss: 1.7073, test_f1: 0.5754
 epoch: 69, train_loss: 0.3607, test_loss: 1.6851, test_f1: 0.5930
 epoch: 70, train_loss: 0.3463, test_loss: 1.8057, test_f1: 0.6003
 epoch: 71, train_loss: 0.3461, test_loss: 1.7379, test_f1: 0.5929
 epoch: 72, train_loss: 0.3726, test_loss: 1.7961, test_f1: 0.5947
 epoch: 73, train_loss: 0.3437, test_loss: 1.7922, test_f1: 0.6012
 epoch: 74, train_loss: 0.3468, test_loss: 1.8144, test_f1: 0.5931
 epoch: 75, train_loss: 0.3652, test_loss: 1.8673, test_f1: 0.5901
 epoch: 76, train_loss: 0.3430, test_loss: 1.8489, test_f1: 0.5885
 epoch: 77, train_loss: 0.3308, test_loss: 1.8487, test_f1: 0.5924
 epoch: 78, train_loss: 0.3244, test_loss: 1.8134, test_f1: 0.5992
 epoch: 79, train_loss: 0.3248, test_loss: 2.0540, test_f1: 0.5752
 epoch: 80, train_loss: 0.3298, test_loss: 1.8655, test_f1: 0.6021
 epoch: 81, train_loss: 0.3357, test_loss: 1.9648, test_f1: 0.5746
 epoch: 82, train_loss: 0.3209, test_loss: 1.8669, test_f1: 0.6023
 epoch: 83, train_loss: 0.3246, test_loss: 1.8906, test_f1: 0.5985
 epoch: 84, train_loss: 0.3149, test_loss: 1.9611, test_f1: 0.5956
 epoch: 85, train_loss: 0.3257, test_loss: 2.0551, test_f1: 0.6036
 epoch: 86, train_loss: 0.3142, test_loss: 2.0038, test_f1: 0.5976
 epoch: 87, train_loss: 0.3009, test_loss: 1.8988, test_f1: 0.6064
 epoch: 88, train_loss: 0.3026, test_loss: 1.9578, test_f1: 0.5992
 epoch: 89, train_loss: 0.2939, test_loss: 2.0211, test_f1: 0.5925
 epoch: 90, train_loss: 0.2962, test_loss: 1.9998, test_f1: 0.5919
 epoch: 91, train_loss: 0.2860, test_loss: 2.0730, test_f1: 0.5822
 epoch: 92, train_loss: 0.2979, test_loss: 2.0627, test_f1: 0.6197
 epoch: 93, train_loss: 0.2863, test_loss: 2.1702, test_f1: 0.5957
 epoch: 94, train_loss: 0.2967, test_loss: 2.1174, test_f1: 0.6011
 epoch: 95, train_loss: 0.2868, test_loss: 2.1123, test_f1: 0.5843
 epoch: 96, train_loss: 0.2927, test_loss: 2.1634, test_f1: 0.5895
 epoch: 97, train_loss: 0.2843, test_loss: 2.0509, test_f1: 0.5881
 epoch: 98, train_loss: 0.2680, test_loss: 2.1611, test_f1: 0.5873
 epoch: 99, train_loss: 0.2799, test_loss: 2.0982, test_f1: 0.5890
##################ITERATION #5 ****************************************
 epoch: 0, train_loss: 1.1850, test_loss: 1.2561, test_f1: 0.2749
 epoch: 1, train_loss: 1.0677, test_loss: 1.0930, test_f1: 0.5109
 epoch: 2, train_loss: 1.0136, test_loss: 1.0620, test_f1: 0.5144
 epoch: 3, train_loss: 0.9906, test_loss: 1.0375, test_f1: 0.5541
 epoch: 4, train_loss: 0.9349, test_loss: 1.0247, test_f1: 0.5555
 epoch: 5, train_loss: 0.9132, test_loss: 1.0311, test_f1: 0.5733
 epoch: 6, train_loss: 0.8892, test_loss: 1.0193, test_f1: 0.5807
 epoch: 7, train_loss: 0.8601, test_loss: 1.0183, test_f1: 0.5736
 epoch: 8, train_loss: 0.8421, test_loss: 1.0139, test_f1: 0.5911
 epoch: 9, train_loss: 0.8160, test_loss: 1.0465, test_f1: 0.5669
 epoch: 10, train_loss: 0.8274, test_loss: 1.0088, test_f1: 0.5628
 epoch: 11, train_loss: 0.7949, test_loss: 1.0150, test_f1: 0.5548
 epoch: 12, train_loss: 0.7952, test_loss: 1.0214, test_f1: 0.5811
 epoch: 13, train_loss: 0.7572, test_loss: 0.9904, test_f1: 0.6549
 epoch: 14, train_loss: 0.7559, test_loss: 0.9900, test_f1: 0.6339
 epoch: 15, train_loss: 0.7433, test_loss: 1.0673, test_f1: 0.5474
 epoch: 16, train_loss: 0.7235, test_loss: 0.9864, test_f1: 0.6291
 epoch: 17, train_loss: 0.7172, test_loss: 1.0372, test_f1: 0.6339
 epoch: 18, train_loss: 0.7116, test_loss: 1.0186, test_f1: 0.6124
 epoch: 19, train_loss: 0.7026, test_loss: 1.0288, test_f1: 0.6092
 epoch: 20, train_loss: 0.6938, test_loss: 1.0820, test_f1: 0.5937
 epoch: 21, train_loss: 0.6795, test_loss: 1.0921, test_f1: 0.5770
 epoch: 22, train_loss: 0.6715, test_loss: 1.0310, test_f1: 0.6174
 epoch: 23, train_loss: 0.6727, test_loss: 1.0842, test_f1: 0.5845
 epoch: 24, train_loss: 0.6566, test_loss: 1.0787, test_f1: 0.5929
 epoch: 25, train_loss: 0.6550, test_loss: 1.1342, test_f1: 0.5622
 epoch: 26, train_loss: 0.6369, test_loss: 1.0633, test_f1: 0.6055
 epoch: 27, train_loss: 0.6358, test_loss: 1.0002, test_f1: 0.6338
 epoch: 28, train_loss: 0.6283, test_loss: 1.1326, test_f1: 0.6041
 epoch: 29, train_loss: 0.6079, test_loss: 1.1015, test_f1: 0.6304
 epoch: 30, train_loss: 0.6245, test_loss: 1.0809, test_f1: 0.6001
 epoch: 31, train_loss: 0.5977, test_loss: 1.1196, test_f1: 0.5891
 epoch: 32, train_loss: 0.5790, test_loss: 1.0640, test_f1: 0.6428
 epoch: 33, train_loss: 0.5860, test_loss: 1.1271, test_f1: 0.5847
 epoch: 34, train_loss: 0.5818, test_loss: 1.1663, test_f1: 0.5942
 epoch: 35, train_loss: 0.5502, test_loss: 1.1778, test_f1: 0.5811
 epoch: 36, train_loss: 0.5835, test_loss: 1.2166, test_f1: 0.5901
 epoch: 37, train_loss: 0.5553, test_loss: 1.1579, test_f1: 0.5868
 epoch: 38, train_loss: 0.5520, test_loss: 1.1370, test_f1: 0.5638
 epoch: 39, train_loss: 0.5517, test_loss: 1.1205, test_f1: 0.6213
 epoch: 40, train_loss: 0.5257, test_loss: 1.2787, test_f1: 0.6140
 epoch: 41, train_loss: 0.5548, test_loss: 1.2545, test_f1: 0.5698
 epoch: 42, train_loss: 0.5345, test_loss: 1.1218, test_f1: 0.6294
 epoch: 43, train_loss: 0.5414, test_loss: 1.2124, test_f1: 0.6327
 epoch: 44, train_loss: 0.5225, test_loss: 1.1319, test_f1: 0.6720
 epoch: 45, train_loss: 0.5185, test_loss: 1.1855, test_f1: 0.6748
 epoch: 46, train_loss: 0.5085, test_loss: 1.2199, test_f1: 0.5999
 epoch: 47, train_loss: 0.4849, test_loss: 1.2414, test_f1: 0.6204
 epoch: 48, train_loss: 0.4844, test_loss: 1.2415, test_f1: 0.5858
 epoch: 49, train_loss: 0.4858, test_loss: 1.1870, test_f1: 0.6328
 epoch: 50, train_loss: 0.4816, test_loss: 1.2312, test_f1: 0.6280
 epoch: 51, train_loss: 0.4354, test_loss: 1.2759, test_f1: 0.6203
 epoch: 52, train_loss: 0.4465, test_loss: 1.3737, test_f1: 0.5959
 epoch: 53, train_loss: 0.4345, test_loss: 1.2758, test_f1: 0.6267
 epoch: 54, train_loss: 0.4323, test_loss: 1.3626, test_f1: 0.5903
 epoch: 55, train_loss: 0.4496, test_loss: 1.3497, test_f1: 0.5824
 epoch: 56, train_loss: 0.4319, test_loss: 1.2695, test_f1: 0.6175
 epoch: 57, train_loss: 0.4195, test_loss: 1.3741, test_f1: 0.6145
 epoch: 58, train_loss: 0.4511, test_loss: 1.3442, test_f1: 0.6168
 epoch: 59, train_loss: 0.4261, test_loss: 1.3185, test_f1: 0.6400
 epoch: 60, train_loss: 0.4098, test_loss: 1.3783, test_f1: 0.6331
 epoch: 61, train_loss: 0.4190, test_loss: 1.4020, test_f1: 0.5873
 epoch: 62, train_loss: 0.3896, test_loss: 1.3945, test_f1: 0.6214
 epoch: 63, train_loss: 0.4256, test_loss: 1.4377, test_f1: 0.5900
 epoch: 64, train_loss: 0.4058, test_loss: 1.3543, test_f1: 0.6440
 epoch: 65, train_loss: 0.3929, test_loss: 1.4168, test_f1: 0.6129
 epoch: 66, train_loss: 0.4105, test_loss: 1.4418, test_f1: 0.5891
 epoch: 67, train_loss: 0.3985, test_loss: 1.4555, test_f1: 0.5912
 epoch: 68, train_loss: 0.3843, test_loss: 1.3740, test_f1: 0.6037
 epoch: 69, train_loss: 0.3972, test_loss: 1.4855, test_f1: 0.5962
 epoch: 70, train_loss: 0.3839, test_loss: 1.3926, test_f1: 0.6131
 epoch: 71, train_loss: 0.3788, test_loss: 1.4139, test_f1: 0.6437
 epoch: 72, train_loss: 0.3801, test_loss: 1.4300, test_f1: 0.6104
 epoch: 73, train_loss: 0.3669, test_loss: 1.5122, test_f1: 0.5849
 epoch: 74, train_loss: 0.3834, test_loss: 1.5042, test_f1: 0.5869
 epoch: 75, train_loss: 0.3666, test_loss: 1.5341, test_f1: 0.6011
 epoch: 76, train_loss: 0.3856, test_loss: 1.4936, test_f1: 0.5953
 epoch: 77, train_loss: 0.3834, test_loss: 1.5575, test_f1: 0.5885
 epoch: 78, train_loss: 0.3833, test_loss: 1.5472, test_f1: 0.6030
 epoch: 79, train_loss: 0.3684, test_loss: 1.3890, test_f1: 0.6296
 epoch: 80, train_loss: 0.3761, test_loss: 1.4971, test_f1: 0.6093
 epoch: 81, train_loss: 0.3517, test_loss: 1.5684, test_f1: 0.6169
 epoch: 82, train_loss: 0.3614, test_loss: 1.4634, test_f1: 0.6141
 epoch: 83, train_loss: 0.3424, test_loss: 1.5755, test_f1: 0.5894
 epoch: 84, train_loss: 0.3418, test_loss: 1.6154, test_f1: 0.6146
 epoch: 85, train_loss: 0.3209, test_loss: 1.5621, test_f1: 0.6179
 epoch: 86, train_loss: 0.3214, test_loss: 1.5327, test_f1: 0.6202
 epoch: 87, train_loss: 0.3272, test_loss: 1.6252, test_f1: 0.6042
 epoch: 88, train_loss: 0.3210, test_loss: 1.5105, test_f1: 0.6229
 epoch: 89, train_loss: 0.3491, test_loss: 1.5758, test_f1: 0.6134
 epoch: 90, train_loss: 0.3508, test_loss: 1.7154, test_f1: 0.6045
 epoch: 91, train_loss: 0.3355, test_loss: 1.5611, test_f1: 0.6270
 epoch: 92, train_loss: 0.3312, test_loss: 1.5892, test_f1: 0.5807
 epoch: 93, train_loss: 0.3423, test_loss: 1.5586, test_f1: 0.6010
 epoch: 94, train_loss: 0.3147, test_loss: 1.5881, test_f1: 0.6125
 epoch: 95, train_loss: 0.3213, test_loss: 1.5071, test_f1: 0.6426
 epoch: 96, train_loss: 0.3068, test_loss: 1.7118, test_f1: 0.6098
 epoch: 97, train_loss: 0.3174, test_loss: 1.5752, test_f1: 0.6323
 epoch: 98, train_loss: 0.3054, test_loss: 1.6163, test_f1: 0.6127
 epoch: 99, train_loss: 0.3017, test_loss: 1.5578, test_f1: 0.6449
##################ITERATION #6 ****************************************
 epoch: 0, train_loss: 1.2253, test_loss: 1.2299, test_f1: 0.4317
 epoch: 1, train_loss: 1.0781, test_loss: 1.1285, test_f1: 0.5028
 epoch: 2, train_loss: 1.0380, test_loss: 1.0975, test_f1: 0.5550
 epoch: 3, train_loss: 0.9822, test_loss: 1.0600, test_f1: 0.5472
 epoch: 4, train_loss: 0.9613, test_loss: 1.0342, test_f1: 0.5525
 epoch: 5, train_loss: 0.9232, test_loss: 1.0277, test_f1: 0.5566
 epoch: 6, train_loss: 0.8974, test_loss: 1.0088, test_f1: 0.5777
 epoch: 7, train_loss: 0.8810, test_loss: 0.9791, test_f1: 0.5836
 epoch: 8, train_loss: 0.8733, test_loss: 0.9884, test_f1: 0.5768
 epoch: 9, train_loss: 0.8301, test_loss: 0.9725, test_f1: 0.5988
 epoch: 10, train_loss: 0.8108, test_loss: 0.9878, test_f1: 0.5842
 epoch: 11, train_loss: 0.8108, test_loss: 0.9546, test_f1: 0.6048
 epoch: 12, train_loss: 0.7995, test_loss: 0.9743, test_f1: 0.6091
 epoch: 13, train_loss: 0.7865, test_loss: 0.9581, test_f1: 0.6047
 epoch: 14, train_loss: 0.7694, test_loss: 0.9592, test_f1: 0.6259
 epoch: 15, train_loss: 0.7577, test_loss: 0.9759, test_f1: 0.6171
 epoch: 16, train_loss: 0.7350, test_loss: 0.9750, test_f1: 0.6033
 epoch: 17, train_loss: 0.7208, test_loss: 0.9485, test_f1: 0.6198
 epoch: 18, train_loss: 0.7152, test_loss: 0.9771, test_f1: 0.6067
 epoch: 19, train_loss: 0.6970, test_loss: 0.9266, test_f1: 0.6261
 epoch: 20, train_loss: 0.6985, test_loss: 0.9539, test_f1: 0.6244
 epoch: 21, train_loss: 0.6898, test_loss: 1.0037, test_f1: 0.6057
 epoch: 22, train_loss: 0.6864, test_loss: 0.9831, test_f1: 0.6269
 epoch: 23, train_loss: 0.6972, test_loss: 0.9689, test_f1: 0.6199
 epoch: 24, train_loss: 0.6564, test_loss: 0.9446, test_f1: 0.6205
 epoch: 25, train_loss: 0.6542, test_loss: 0.9613, test_f1: 0.6327
 epoch: 26, train_loss: 0.6531, test_loss: 0.9012, test_f1: 0.6556
 epoch: 27, train_loss: 0.6442, test_loss: 1.0022, test_f1: 0.5868
 epoch: 28, train_loss: 0.6147, test_loss: 0.9539, test_f1: 0.5970
 epoch: 29, train_loss: 0.6384, test_loss: 0.9676, test_f1: 0.6305
 epoch: 30, train_loss: 0.6079, test_loss: 0.9754, test_f1: 0.6260
 epoch: 31, train_loss: 0.6012, test_loss: 0.9747, test_f1: 0.6205
 epoch: 32, train_loss: 0.5886, test_loss: 0.9540, test_f1: 0.6144
 epoch: 33, train_loss: 0.5890, test_loss: 0.9549, test_f1: 0.6120
 epoch: 34, train_loss: 0.5698, test_loss: 1.0512, test_f1: 0.5857
 epoch: 35, train_loss: 0.5528, test_loss: 1.0329, test_f1: 0.5982
 epoch: 36, train_loss: 0.5744, test_loss: 1.0723, test_f1: 0.6400
 epoch: 37, train_loss: 0.5659, test_loss: 0.9746, test_f1: 0.6508
 epoch: 38, train_loss: 0.5401, test_loss: 1.0010, test_f1: 0.6267
 epoch: 39, train_loss: 0.5548, test_loss: 1.0797, test_f1: 0.6397
 epoch: 40, train_loss: 0.5542, test_loss: 1.0444, test_f1: 0.6446
 epoch: 41, train_loss: 0.5569, test_loss: 1.1045, test_f1: 0.5995
 epoch: 42, train_loss: 0.5357, test_loss: 1.0859, test_f1: 0.6342
 epoch: 43, train_loss: 0.5396, test_loss: 1.0730, test_f1: 0.6470
 epoch: 44, train_loss: 0.5242, test_loss: 1.1245, test_f1: 0.6273
 epoch: 45, train_loss: 0.5017, test_loss: 1.1661, test_f1: 0.6147
 epoch: 46, train_loss: 0.5070, test_loss: 1.0523, test_f1: 0.6303
 epoch: 47, train_loss: 0.4924, test_loss: 1.1176, test_f1: 0.6296
 epoch: 48, train_loss: 0.5172, test_loss: 1.1933, test_f1: 0.6067
 epoch: 49, train_loss: 0.4923, test_loss: 1.2978, test_f1: 0.5980
 epoch: 50, train_loss: 0.4782, test_loss: 1.1397, test_f1: 0.6097
 epoch: 51, train_loss: 0.4674, test_loss: 1.1987, test_f1: 0.5856
 epoch: 52, train_loss: 0.4501, test_loss: 1.1532, test_f1: 0.6131
 epoch: 53, train_loss: 0.4654, test_loss: 1.1359, test_f1: 0.6505
 epoch: 54, train_loss: 0.4468, test_loss: 1.1793, test_f1: 0.6490
 epoch: 55, train_loss: 0.4748, test_loss: 1.1742, test_f1: 0.6292
 epoch: 56, train_loss: 0.4287, test_loss: 1.1805, test_f1: 0.6378
 epoch: 57, train_loss: 0.4381, test_loss: 1.2284, test_f1: 0.6315
 epoch: 58, train_loss: 0.4374, test_loss: 1.2491, test_f1: 0.6176
 epoch: 59, train_loss: 0.4361, test_loss: 1.2145, test_f1: 0.6318
 epoch: 60, train_loss: 0.4149, test_loss: 1.2249, test_f1: 0.6592
 epoch: 61, train_loss: 0.4146, test_loss: 1.2293, test_f1: 0.6428
 epoch: 62, train_loss: 0.4162, test_loss: 1.2445, test_f1: 0.6722
 epoch: 63, train_loss: 0.4375, test_loss: 1.2675, test_f1: 0.6288
 epoch: 64, train_loss: 0.4173, test_loss: 1.2809, test_f1: 0.6313
 epoch: 65, train_loss: 0.3943, test_loss: 1.2522, test_f1: 0.6343
 epoch: 66, train_loss: 0.4207, test_loss: 1.2629, test_f1: 0.6369
 epoch: 67, train_loss: 0.3874, test_loss: 1.2673, test_f1: 0.6315
 epoch: 68, train_loss: 0.3851, test_loss: 1.2909, test_f1: 0.6344
 epoch: 69, train_loss: 0.3820, test_loss: 1.3096, test_f1: 0.6063
 epoch: 70, train_loss: 0.3893, test_loss: 1.2689, test_f1: 0.6170
 epoch: 71, train_loss: 0.3701, test_loss: 1.3404, test_f1: 0.6096
 epoch: 72, train_loss: 0.4065, test_loss: 1.3346, test_f1: 0.6017
 epoch: 73, train_loss: 0.3911, test_loss: 1.3788, test_f1: 0.6092
 epoch: 74, train_loss: 0.3796, test_loss: 1.3467, test_f1: 0.6126
 epoch: 75, train_loss: 0.4042, test_loss: 1.3086, test_f1: 0.6289
 epoch: 76, train_loss: 0.3746, test_loss: 1.3846, test_f1: 0.6051
 epoch: 77, train_loss: 0.3843, test_loss: 1.3676, test_f1: 0.6317
 epoch: 78, train_loss: 0.3724, test_loss: 1.3523, test_f1: 0.6492
 epoch: 79, train_loss: 0.3660, test_loss: 1.3569, test_f1: 0.6180
 epoch: 80, train_loss: 0.3730, test_loss: 1.4052, test_f1: 0.6025
 epoch: 81, train_loss: 0.3586, test_loss: 1.4424, test_f1: 0.6070
 epoch: 82, train_loss: 0.4027, test_loss: 1.3926, test_f1: 0.6231
 epoch: 83, train_loss: 0.3617, test_loss: 1.4155, test_f1: 0.6114
 epoch: 84, train_loss: 0.3555, test_loss: 1.4152, test_f1: 0.6177
 epoch: 85, train_loss: 0.3640, test_loss: 1.4620, test_f1: 0.6069
 epoch: 86, train_loss: 0.3471, test_loss: 1.5106, test_f1: 0.6049
 epoch: 87, train_loss: 0.3523, test_loss: 1.5424, test_f1: 0.6131
 epoch: 88, train_loss: 0.3468, test_loss: 1.5334, test_f1: 0.5912
 epoch: 89, train_loss: 0.3485, test_loss: 1.5067, test_f1: 0.6160
 epoch: 90, train_loss: 0.3405, test_loss: 1.5067, test_f1: 0.5945
 epoch: 91, train_loss: 0.3351, test_loss: 1.5247, test_f1: 0.6096
 epoch: 92, train_loss: 0.3484, test_loss: 1.5371, test_f1: 0.6203
 epoch: 93, train_loss: 0.3311, test_loss: 1.5640, test_f1: 0.6049
 epoch: 94, train_loss: 0.3202, test_loss: 1.5124, test_f1: 0.6271
 epoch: 95, train_loss: 0.3305, test_loss: 1.5783, test_f1: 0.5944
 epoch: 96, train_loss: 0.3361, test_loss: 1.5422, test_f1: 0.6292
 epoch: 97, train_loss: 0.3198, test_loss: 1.5536, test_f1: 0.6134
 epoch: 98, train_loss: 0.3367, test_loss: 1.5409, test_f1: 0.6099
 epoch: 99, train_loss: 0.3146, test_loss: 1.5466, test_f1: 0.6046
##################ITERATION #7 ****************************************
 epoch: 0, train_loss: 1.2316, test_loss: 1.2855, test_f1: 0.2197
 epoch: 1, train_loss: 1.0592, test_loss: 1.1727, test_f1: 0.5410
 epoch: 2, train_loss: 1.0062, test_loss: 1.1555, test_f1: 0.5335
 epoch: 3, train_loss: 0.9843, test_loss: 1.0968, test_f1: 0.5291
 epoch: 4, train_loss: 0.9630, test_loss: 1.1176, test_f1: 0.5273
 epoch: 5, train_loss: 0.9438, test_loss: 1.0740, test_f1: 0.5246
 epoch: 6, train_loss: 0.9110, test_loss: 1.0556, test_f1: 0.5345
 epoch: 7, train_loss: 0.8753, test_loss: 1.0667, test_f1: 0.5236
 epoch: 8, train_loss: 0.8543, test_loss: 1.0751, test_f1: 0.5311
 epoch: 9, train_loss: 0.8520, test_loss: 1.0589, test_f1: 0.5489
 epoch: 10, train_loss: 0.8196, test_loss: 1.0554, test_f1: 0.5239
 epoch: 11, train_loss: 0.7984, test_loss: 1.0393, test_f1: 0.5593
 epoch: 12, train_loss: 0.7750, test_loss: 1.0209, test_f1: 0.5413
 epoch: 13, train_loss: 0.7668, test_loss: 1.0505, test_f1: 0.5496
 epoch: 14, train_loss: 0.7533, test_loss: 1.0382, test_f1: 0.5951
 epoch: 15, train_loss: 0.7486, test_loss: 1.0411, test_f1: 0.5955
 epoch: 16, train_loss: 0.7369, test_loss: 1.0521, test_f1: 0.5926
 epoch: 17, train_loss: 0.7352, test_loss: 1.0894, test_f1: 0.5953
 epoch: 18, train_loss: 0.7278, test_loss: 1.0607, test_f1: 0.5801
 epoch: 19, train_loss: 0.7051, test_loss: 1.0830, test_f1: 0.6010
 epoch: 20, train_loss: 0.6843, test_loss: 1.1080, test_f1: 0.5907
 epoch: 21, train_loss: 0.6803, test_loss: 1.0988, test_f1: 0.6067
 epoch: 22, train_loss: 0.6777, test_loss: 1.0995, test_f1: 0.6113
 epoch: 23, train_loss: 0.6762, test_loss: 1.1635, test_f1: 0.5612
 epoch: 24, train_loss: 0.6637, test_loss: 1.0756, test_f1: 0.6038
 epoch: 25, train_loss: 0.6594, test_loss: 1.1275, test_f1: 0.5807
 epoch: 26, train_loss: 0.6305, test_loss: 1.1037, test_f1: 0.6102
 epoch: 27, train_loss: 0.6328, test_loss: 1.1509, test_f1: 0.5728
 epoch: 28, train_loss: 0.6296, test_loss: 1.2237, test_f1: 0.5656
 epoch: 29, train_loss: 0.6082, test_loss: 1.1488, test_f1: 0.5954
 epoch: 30, train_loss: 0.6167, test_loss: 1.1185, test_f1: 0.6023
 epoch: 31, train_loss: 0.6027, test_loss: 1.1995, test_f1: 0.6071
 epoch: 32, train_loss: 0.6168, test_loss: 1.1827, test_f1: 0.6088
 epoch: 33, train_loss: 0.5861, test_loss: 1.2345, test_f1: 0.6162
 epoch: 34, train_loss: 0.5840, test_loss: 1.2558, test_f1: 0.6225
 epoch: 35, train_loss: 0.5674, test_loss: 1.1681, test_f1: 0.6185
 epoch: 36, train_loss: 0.5685, test_loss: 1.2617, test_f1: 0.6024
 epoch: 37, train_loss: 0.5429, test_loss: 1.2033, test_f1: 0.5988
 epoch: 38, train_loss: 0.5497, test_loss: 1.2116, test_f1: 0.6165
 epoch: 39, train_loss: 0.5363, test_loss: 1.2057, test_f1: 0.6080
 epoch: 40, train_loss: 0.5489, test_loss: 1.2793, test_f1: 0.6031
 epoch: 41, train_loss: 0.5304, test_loss: 1.2693, test_f1: 0.6294
 epoch: 42, train_loss: 0.5329, test_loss: 1.2844, test_f1: 0.6047
 epoch: 43, train_loss: 0.5046, test_loss: 1.2027, test_f1: 0.6264
 epoch: 44, train_loss: 0.5119, test_loss: 1.2711, test_f1: 0.6095
 epoch: 45, train_loss: 0.5034, test_loss: 1.2761, test_f1: 0.6299
 epoch: 46, train_loss: 0.4970, test_loss: 1.3141, test_f1: 0.6148
 epoch: 47, train_loss: 0.4909, test_loss: 1.3526, test_f1: 0.5956
 epoch: 48, train_loss: 0.4914, test_loss: 1.3682, test_f1: 0.5878
 epoch: 49, train_loss: 0.4786, test_loss: 1.3840, test_f1: 0.6237
 epoch: 50, train_loss: 0.4830, test_loss: 1.3854, test_f1: 0.6367
 epoch: 51, train_loss: 0.4655, test_loss: 1.3795, test_f1: 0.6204
 epoch: 52, train_loss: 0.4663, test_loss: 1.3657, test_f1: 0.6556
 epoch: 53, train_loss: 0.4402, test_loss: 1.4313, test_f1: 0.5923
 epoch: 54, train_loss: 0.4341, test_loss: 1.2947, test_f1: 0.6513
 epoch: 55, train_loss: 0.4391, test_loss: 1.3952, test_f1: 0.6331
 epoch: 56, train_loss: 0.4341, test_loss: 1.4017, test_f1: 0.6412
 epoch: 57, train_loss: 0.4193, test_loss: 1.4043, test_f1: 0.6395
 epoch: 58, train_loss: 0.4237, test_loss: 1.4269, test_f1: 0.6501
 epoch: 59, train_loss: 0.4303, test_loss: 1.4873, test_f1: 0.6190
 epoch: 60, train_loss: 0.4078, test_loss: 1.4578, test_f1: 0.6235
 epoch: 61, train_loss: 0.4044, test_loss: 1.4390, test_f1: 0.6163
 epoch: 62, train_loss: 0.4073, test_loss: 1.4542, test_f1: 0.6209
 epoch: 63, train_loss: 0.4087, test_loss: 1.4897, test_f1: 0.6282
 epoch: 64, train_loss: 0.4090, test_loss: 1.5140, test_f1: 0.6290
 epoch: 65, train_loss: 0.3881, test_loss: 1.4476, test_f1: 0.6502
 epoch: 66, train_loss: 0.3794, test_loss: 1.5067, test_f1: 0.6343
 epoch: 67, train_loss: 0.4145, test_loss: 1.5496, test_f1: 0.6236
 epoch: 68, train_loss: 0.3820, test_loss: 1.4463, test_f1: 0.6356
 epoch: 69, train_loss: 0.3990, test_loss: 1.5753, test_f1: 0.6210
 epoch: 70, train_loss: 0.3851, test_loss: 1.5504, test_f1: 0.6361
 epoch: 71, train_loss: 0.3753, test_loss: 1.5662, test_f1: 0.6201
 epoch: 72, train_loss: 0.3801, test_loss: 1.5824, test_f1: 0.6501
 epoch: 73, train_loss: 0.3822, test_loss: 1.4608, test_f1: 0.6639
 epoch: 74, train_loss: 0.3739, test_loss: 1.5287, test_f1: 0.6278
 epoch: 75, train_loss: 0.3630, test_loss: 1.5280, test_f1: 0.6282
 epoch: 76, train_loss: 0.3664, test_loss: 1.5912, test_f1: 0.6251
 epoch: 77, train_loss: 0.3606, test_loss: 1.5824, test_f1: 0.6109
 epoch: 78, train_loss: 0.3645, test_loss: 1.6440, test_f1: 0.6260
 epoch: 79, train_loss: 0.3489, test_loss: 1.5511, test_f1: 0.6208
 epoch: 80, train_loss: 0.3624, test_loss: 1.6496, test_f1: 0.6422
 epoch: 81, train_loss: 0.3314, test_loss: 1.6597, test_f1: 0.6237
 epoch: 82, train_loss: 0.3596, test_loss: 1.5528, test_f1: 0.6383
 epoch: 83, train_loss: 0.3457, test_loss: 1.6913, test_f1: 0.6193
 epoch: 84, train_loss: 0.3494, test_loss: 1.6747, test_f1: 0.6528
 epoch: 85, train_loss: 0.3341, test_loss: 1.6828, test_f1: 0.6057
 epoch: 86, train_loss: 0.3751, test_loss: 1.6786, test_f1: 0.6237
 epoch: 87, train_loss: 0.3412, test_loss: 1.7043, test_f1: 0.6313
 epoch: 88, train_loss: 0.3292, test_loss: 1.7280, test_f1: 0.6491
 epoch: 89, train_loss: 0.3300, test_loss: 1.7794, test_f1: 0.6319
 epoch: 90, train_loss: 0.3262, test_loss: 1.7440, test_f1: 0.6316
 epoch: 91, train_loss: 0.3170, test_loss: 1.8016, test_f1: 0.6440
 epoch: 92, train_loss: 0.3489, test_loss: 1.7048, test_f1: 0.6479
 epoch: 93, train_loss: 0.3330, test_loss: 1.7430, test_f1: 0.6437
 epoch: 94, train_loss: 0.3134, test_loss: 1.8188, test_f1: 0.6398
 epoch: 95, train_loss: 0.3145, test_loss: 1.7613, test_f1: 0.6214
 epoch: 96, train_loss: 0.3420, test_loss: 1.7863, test_f1: 0.6305
 epoch: 97, train_loss: 0.3048, test_loss: 1.7386, test_f1: 0.6283
 epoch: 98, train_loss: 0.3080, test_loss: 1.8159, test_f1: 0.6300
 epoch: 99, train_loss: 0.3227, test_loss: 1.8141, test_f1: 0.6333
##################ITERATION #8 ****************************************
 epoch: 0, train_loss: 1.2952, test_loss: 1.2622, test_f1: 0.3267
 epoch: 1, train_loss: 1.1044, test_loss: 1.1162, test_f1: 0.4665
 epoch: 2, train_loss: 1.0213, test_loss: 1.0648, test_f1: 0.5001
 epoch: 3, train_loss: 1.0194, test_loss: 1.0484, test_f1: 0.5258
 epoch: 4, train_loss: 0.9631, test_loss: 1.0315, test_f1: 0.5261
 epoch: 5, train_loss: 0.9351, test_loss: 1.0592, test_f1: 0.5239
 epoch: 6, train_loss: 0.9071, test_loss: 1.0120, test_f1: 0.5812
 epoch: 7, train_loss: 0.8837, test_loss: 1.0205, test_f1: 0.5774
 epoch: 8, train_loss: 0.8641, test_loss: 1.0275, test_f1: 0.5496
 epoch: 9, train_loss: 0.8431, test_loss: 1.0062, test_f1: 0.5761
 epoch: 10, train_loss: 0.8256, test_loss: 0.9818, test_f1: 0.6095
 epoch: 11, train_loss: 0.8065, test_loss: 1.0077, test_f1: 0.5914
 epoch: 12, train_loss: 0.8103, test_loss: 1.0289, test_f1: 0.5664
 epoch: 13, train_loss: 0.7825, test_loss: 0.9979, test_f1: 0.5726
 epoch: 14, train_loss: 0.7894, test_loss: 1.0085, test_f1: 0.5839
 epoch: 15, train_loss: 0.7667, test_loss: 0.9722, test_f1: 0.5959
 epoch: 16, train_loss: 0.7433, test_loss: 1.0285, test_f1: 0.5695
 epoch: 17, train_loss: 0.7466, test_loss: 1.0677, test_f1: 0.5755
 epoch: 18, train_loss: 0.7102, test_loss: 1.0911, test_f1: 0.5530
 epoch: 19, train_loss: 0.7298, test_loss: 1.0239, test_f1: 0.6090
 epoch: 20, train_loss: 0.7335, test_loss: 1.0476, test_f1: 0.5719
 epoch: 21, train_loss: 0.7033, test_loss: 1.0283, test_f1: 0.6003
 epoch: 22, train_loss: 0.6960, test_loss: 1.0609, test_f1: 0.5896
 epoch: 23, train_loss: 0.6822, test_loss: 1.0532, test_f1: 0.5808
 epoch: 24, train_loss: 0.6876, test_loss: 1.0655, test_f1: 0.5661
 epoch: 25, train_loss: 0.6715, test_loss: 1.0749, test_f1: 0.6028
 epoch: 26, train_loss: 0.6569, test_loss: 1.0834, test_f1: 0.6197
 epoch: 27, train_loss: 0.6565, test_loss: 1.0588, test_f1: 0.5769
 epoch: 28, train_loss: 0.6408, test_loss: 1.0432, test_f1: 0.5758
 epoch: 29, train_loss: 0.6298, test_loss: 1.0784, test_f1: 0.5854
 epoch: 30, train_loss: 0.6101, test_loss: 1.0490, test_f1: 0.6036
 epoch: 31, train_loss: 0.6074, test_loss: 1.0761, test_f1: 0.6112
 epoch: 32, train_loss: 0.6118, test_loss: 1.0959, test_f1: 0.5731
 epoch: 33, train_loss: 0.5833, test_loss: 1.1321, test_f1: 0.5745
 epoch: 34, train_loss: 0.5953, test_loss: 1.2314, test_f1: 0.5989
 epoch: 35, train_loss: 0.5981, test_loss: 1.0896, test_f1: 0.6083
 epoch: 36, train_loss: 0.5927, test_loss: 1.0964, test_f1: 0.5745
 epoch: 37, train_loss: 0.5827, test_loss: 1.1171, test_f1: 0.5923
 epoch: 38, train_loss: 0.5541, test_loss: 1.0809, test_f1: 0.5889
 epoch: 39, train_loss: 0.5536, test_loss: 1.2532, test_f1: 0.5570
 epoch: 40, train_loss: 0.5528, test_loss: 1.1415, test_f1: 0.6004
 epoch: 41, train_loss: 0.5513, test_loss: 1.0562, test_f1: 0.5990
 epoch: 42, train_loss: 0.5543, test_loss: 1.1193, test_f1: 0.5811
 epoch: 43, train_loss: 0.5101, test_loss: 1.1269, test_f1: 0.6062
 epoch: 44, train_loss: 0.5152, test_loss: 1.2017, test_f1: 0.5679
 epoch: 45, train_loss: 0.5251, test_loss: 1.2023, test_f1: 0.5863
 epoch: 46, train_loss: 0.5002, test_loss: 1.1672, test_f1: 0.6053
 epoch: 47, train_loss: 0.5054, test_loss: 1.2278, test_f1: 0.5792
 epoch: 48, train_loss: 0.5015, test_loss: 1.3295, test_f1: 0.5629
 epoch: 49, train_loss: 0.4959, test_loss: 1.2869, test_f1: 0.5515
 epoch: 50, train_loss: 0.4985, test_loss: 1.3118, test_f1: 0.5645
 epoch: 51, train_loss: 0.4605, test_loss: 1.2981, test_f1: 0.5790
 epoch: 52, train_loss: 0.4564, test_loss: 1.2620, test_f1: 0.5800
 epoch: 53, train_loss: 0.4339, test_loss: 1.2587, test_f1: 0.5623
 epoch: 54, train_loss: 0.4459, test_loss: 1.2968, test_f1: 0.5768
 epoch: 55, train_loss: 0.4281, test_loss: 1.3210, test_f1: 0.5747
 epoch: 56, train_loss: 0.4566, test_loss: 1.3049, test_f1: 0.5783
 epoch: 57, train_loss: 0.4235, test_loss: 1.3603, test_f1: 0.5737
 epoch: 58, train_loss: 0.4193, test_loss: 1.4106, test_f1: 0.5586
 epoch: 59, train_loss: 0.4265, test_loss: 1.3809, test_f1: 0.5720
 epoch: 60, train_loss: 0.4346, test_loss: 1.4340, test_f1: 0.5752
 epoch: 61, train_loss: 0.4308, test_loss: 1.4107, test_f1: 0.5710
 epoch: 62, train_loss: 0.4312, test_loss: 1.3863, test_f1: 0.5688
 epoch: 63, train_loss: 0.4114, test_loss: 1.4549, test_f1: 0.5644
 epoch: 64, train_loss: 0.4125, test_loss: 1.3825, test_f1: 0.5841
 epoch: 65, train_loss: 0.3998, test_loss: 1.4850, test_f1: 0.5566
 epoch: 66, train_loss: 0.3851, test_loss: 1.4515, test_f1: 0.5712
 epoch: 67, train_loss: 0.4265, test_loss: 1.4904, test_f1: 0.5748
 epoch: 68, train_loss: 0.3945, test_loss: 1.4719, test_f1: 0.5763
 epoch: 69, train_loss: 0.3849, test_loss: 1.4405, test_f1: 0.5929
 epoch: 70, train_loss: 0.3957, test_loss: 1.5210, test_f1: 0.5660
 epoch: 71, train_loss: 0.3671, test_loss: 1.5312, test_f1: 0.5864
 epoch: 72, train_loss: 0.4109, test_loss: 1.4727, test_f1: 0.5861
 epoch: 73, train_loss: 0.3780, test_loss: 1.5552, test_f1: 0.5845
 epoch: 74, train_loss: 0.3883, test_loss: 1.5604, test_f1: 0.5763
 epoch: 75, train_loss: 0.3909, test_loss: 1.5401, test_f1: 0.5893
 epoch: 76, train_loss: 0.3596, test_loss: 1.5700, test_f1: 0.5842
 epoch: 77, train_loss: 0.3647, test_loss: 1.5229, test_f1: 0.5791
 epoch: 78, train_loss: 0.3980, test_loss: 1.5484, test_f1: 0.5772
 epoch: 79, train_loss: 0.3650, test_loss: 1.5817, test_f1: 0.5690
 epoch: 80, train_loss: 0.3476, test_loss: 1.5710, test_f1: 0.5766
 epoch: 81, train_loss: 0.3462, test_loss: 1.5876, test_f1: 0.5652
 epoch: 82, train_loss: 0.3611, test_loss: 1.6309, test_f1: 0.5423
 epoch: 83, train_loss: 0.3430, test_loss: 1.4931, test_f1: 0.5833
 epoch: 84, train_loss: 0.3586, test_loss: 1.5656, test_f1: 0.5716
 epoch: 85, train_loss: 0.3483, test_loss: 1.5647, test_f1: 0.5642
 epoch: 86, train_loss: 0.3340, test_loss: 1.6029, test_f1: 0.5605
 epoch: 87, train_loss: 0.3365, test_loss: 1.5244, test_f1: 0.5936
 epoch: 88, train_loss: 0.3508, test_loss: 1.6116, test_f1: 0.5690
 epoch: 89, train_loss: 0.3661, test_loss: 1.6268, test_f1: 0.5869
 epoch: 90, train_loss: 0.3476, test_loss: 1.6382, test_f1: 0.5701
 epoch: 91, train_loss: 0.3382, test_loss: 1.6893, test_f1: 0.5554
 epoch: 92, train_loss: 0.3521, test_loss: 1.7151, test_f1: 0.5765
 epoch: 93, train_loss: 0.3412, test_loss: 1.5957, test_f1: 0.5909
 epoch: 94, train_loss: 0.3266, test_loss: 1.6993, test_f1: 0.5706
 epoch: 95, train_loss: 0.3304, test_loss: 1.7098, test_f1: 0.5841
 epoch: 96, train_loss: 0.3028, test_loss: 1.6770, test_f1: 0.5880
 epoch: 97, train_loss: 0.3386, test_loss: 1.6715, test_f1: 0.5683
 epoch: 98, train_loss: 0.3078, test_loss: 1.6503, test_f1: 0.5971
 epoch: 99, train_loss: 0.3167, test_loss: 1.6480, test_f1: 0.5926
##################ITERATION #9 ****************************************
 epoch: 0, train_loss: 1.2560, test_loss: 1.2751, test_f1: 0.3533
 epoch: 1, train_loss: 1.0420, test_loss: 1.1127, test_f1: 0.5392
 epoch: 2, train_loss: 0.9858, test_loss: 1.0485, test_f1: 0.5931
 epoch: 3, train_loss: 0.9428, test_loss: 1.0246, test_f1: 0.5623
 epoch: 4, train_loss: 0.9304, test_loss: 1.0264, test_f1: 0.5616
 epoch: 5, train_loss: 0.8971, test_loss: 1.0029, test_f1: 0.5740
 epoch: 6, train_loss: 0.8891, test_loss: 1.0068, test_f1: 0.5611
 epoch: 7, train_loss: 0.8507, test_loss: 1.0349, test_f1: 0.5404
 epoch: 8, train_loss: 0.8361, test_loss: 0.9992, test_f1: 0.5740
 epoch: 9, train_loss: 0.8288, test_loss: 0.9750, test_f1: 0.5721
 epoch: 10, train_loss: 0.7955, test_loss: 0.9752, test_f1: 0.5731
 epoch: 11, train_loss: 0.8022, test_loss: 0.9532, test_f1: 0.5847
 epoch: 12, train_loss: 0.7645, test_loss: 0.9613, test_f1: 0.5956
 epoch: 13, train_loss: 0.7619, test_loss: 0.9847, test_f1: 0.5851
 epoch: 14, train_loss: 0.7615, test_loss: 0.9720, test_f1: 0.5620
 epoch: 15, train_loss: 0.7370, test_loss: 0.9896, test_f1: 0.5888
 epoch: 16, train_loss: 0.7210, test_loss: 0.9754, test_f1: 0.5878
 epoch: 17, train_loss: 0.7268, test_loss: 0.9685, test_f1: 0.5836
 epoch: 18, train_loss: 0.6882, test_loss: 0.9627, test_f1: 0.6035
 epoch: 19, train_loss: 0.6901, test_loss: 0.9783, test_f1: 0.5926
 epoch: 20, train_loss: 0.6699, test_loss: 1.0101, test_f1: 0.5885
 epoch: 21, train_loss: 0.6390, test_loss: 0.9940, test_f1: 0.6061
 epoch: 22, train_loss: 0.6432, test_loss: 0.9507, test_f1: 0.6127
 epoch: 23, train_loss: 0.6313, test_loss: 0.9921, test_f1: 0.6090
 epoch: 24, train_loss: 0.6292, test_loss: 0.9959, test_f1: 0.6175
 epoch: 25, train_loss: 0.6362, test_loss: 0.9632, test_f1: 0.5895
 epoch: 26, train_loss: 0.6049, test_loss: 0.9688, test_f1: 0.6218
 epoch: 27, train_loss: 0.6076, test_loss: 1.0096, test_f1: 0.5986
 epoch: 28, train_loss: 0.5930, test_loss: 1.0454, test_f1: 0.6156
 epoch: 29, train_loss: 0.5958, test_loss: 0.9889, test_f1: 0.6315
 epoch: 30, train_loss: 0.5737, test_loss: 1.0244, test_f1: 0.5988
 epoch: 31, train_loss: 0.5788, test_loss: 0.9753, test_f1: 0.6451
 epoch: 32, train_loss: 0.5603, test_loss: 1.1344, test_f1: 0.5850
 epoch: 33, train_loss: 0.5597, test_loss: 1.0615, test_f1: 0.6047
 epoch: 34, train_loss: 0.5497, test_loss: 1.0715, test_f1: 0.6156
 epoch: 35, train_loss: 0.5617, test_loss: 1.0260, test_f1: 0.6247
 epoch: 36, train_loss: 0.5405, test_loss: 1.0453, test_f1: 0.6039
 epoch: 37, train_loss: 0.5254, test_loss: 1.0718, test_f1: 0.6192
 epoch: 38, train_loss: 0.5022, test_loss: 1.1300, test_f1: 0.6087
 epoch: 39, train_loss: 0.5205, test_loss: 1.2598, test_f1: 0.5578
 epoch: 40, train_loss: 0.5181, test_loss: 1.1378, test_f1: 0.6150
 epoch: 41, train_loss: 0.5047, test_loss: 1.1478, test_f1: 0.5950
 epoch: 42, train_loss: 0.4920, test_loss: 1.2952, test_f1: 0.5674
 epoch: 43, train_loss: 0.4778, test_loss: 1.1627, test_f1: 0.6215
 epoch: 44, train_loss: 0.4923, test_loss: 1.2988, test_f1: 0.5879
 epoch: 45, train_loss: 0.4706, test_loss: 1.1449, test_f1: 0.5994
 epoch: 46, train_loss: 0.4540, test_loss: 1.1533, test_f1: 0.6017
 epoch: 47, train_loss: 0.4748, test_loss: 1.2588, test_f1: 0.5520
 epoch: 48, train_loss: 0.4654, test_loss: 1.1290, test_f1: 0.6348
 epoch: 49, train_loss: 0.4458, test_loss: 1.2060, test_f1: 0.5912
 epoch: 50, train_loss: 0.4309, test_loss: 1.2763, test_f1: 0.6060
 epoch: 51, train_loss: 0.4123, test_loss: 1.1472, test_f1: 0.6213
 epoch: 52, train_loss: 0.4419, test_loss: 1.2709, test_f1: 0.5972
 epoch: 53, train_loss: 0.3997, test_loss: 1.2151, test_f1: 0.6106
 epoch: 54, train_loss: 0.4172, test_loss: 1.2216, test_f1: 0.6109
 epoch: 55, train_loss: 0.3966, test_loss: 1.2887, test_f1: 0.6018
 epoch: 56, train_loss: 0.3992, test_loss: 1.2791, test_f1: 0.6055
 epoch: 57, train_loss: 0.4033, test_loss: 1.3137, test_f1: 0.6116
 epoch: 58, train_loss: 0.3888, test_loss: 1.3298, test_f1: 0.6163
 epoch: 59, train_loss: 0.3931, test_loss: 1.3532, test_f1: 0.5957
 epoch: 60, train_loss: 0.3908, test_loss: 1.3230, test_f1: 0.6170
 epoch: 61, train_loss: 0.3865, test_loss: 1.3891, test_f1: 0.6026
 epoch: 62, train_loss: 0.3774, test_loss: 1.3426, test_f1: 0.6177
 epoch: 63, train_loss: 0.3777, test_loss: 1.3989, test_f1: 0.6020
 epoch: 64, train_loss: 0.3665, test_loss: 1.2926, test_f1: 0.6073
 epoch: 65, train_loss: 0.3715, test_loss: 1.3864, test_f1: 0.6159
 epoch: 66, train_loss: 0.3658, test_loss: 1.3609, test_f1: 0.6097
 epoch: 67, train_loss: 0.3525, test_loss: 1.4239, test_f1: 0.6021
 epoch: 68, train_loss: 0.3647, test_loss: 1.3120, test_f1: 0.6140
 epoch: 69, train_loss: 0.3368, test_loss: 1.4427, test_f1: 0.6285
 epoch: 70, train_loss: 0.3705, test_loss: 1.3837, test_f1: 0.6070
 epoch: 71, train_loss: 0.3464, test_loss: 1.3506, test_f1: 0.6170
 epoch: 72, train_loss: 0.3442, test_loss: 1.3417, test_f1: 0.6195
 epoch: 73, train_loss: 0.3445, test_loss: 1.3719, test_f1: 0.5970
 epoch: 74, train_loss: 0.3346, test_loss: 1.3989, test_f1: 0.6061
 epoch: 75, train_loss: 0.3492, test_loss: 1.4561, test_f1: 0.6141
 epoch: 76, train_loss: 0.3425, test_loss: 1.4852, test_f1: 0.5949
 epoch: 77, train_loss: 0.3268, test_loss: 1.4305, test_f1: 0.6168
 epoch: 78, train_loss: 0.3278, test_loss: 1.5251, test_f1: 0.6069
 epoch: 79, train_loss: 0.3131, test_loss: 1.5007, test_f1: 0.6140
 epoch: 80, train_loss: 0.3064, test_loss: 1.5139, test_f1: 0.6095
 epoch: 81, train_loss: 0.3182, test_loss: 1.5968, test_f1: 0.5851
 epoch: 82, train_loss: 0.3076, test_loss: 1.5139, test_f1: 0.6155
 epoch: 83, train_loss: 0.3173, test_loss: 1.6004, test_f1: 0.5964
 epoch: 84, train_loss: 0.3253, test_loss: 1.6464, test_f1: 0.6013
 epoch: 85, train_loss: 0.3150, test_loss: 1.6283, test_f1: 0.6071
 epoch: 86, train_loss: 0.3149, test_loss: 1.5524, test_f1: 0.5997
 epoch: 87, train_loss: 0.3098, test_loss: 1.6421, test_f1: 0.5797
 epoch: 88, train_loss: 0.2984, test_loss: 1.6096, test_f1: 0.6060
 epoch: 89, train_loss: 0.3146, test_loss: 1.5774, test_f1: 0.6156
 epoch: 90, train_loss: 0.3035, test_loss: 1.5926, test_f1: 0.6110
 epoch: 91, train_loss: 0.2909, test_loss: 1.5386, test_f1: 0.6124
 epoch: 92, train_loss: 0.2799, test_loss: 1.5823, test_f1: 0.6310
 epoch: 93, train_loss: 0.3015, test_loss: 1.6445, test_f1: 0.6079
 epoch: 94, train_loss: 0.2746, test_loss: 1.6092, test_f1: 0.6087
 epoch: 95, train_loss: 0.2843, test_loss: 1.6260, test_f1: 0.6080
 epoch: 96, train_loss: 0.2811, test_loss: 1.5688, test_f1: 0.6108
 epoch: 97, train_loss: 0.3030, test_loss: 1.7525, test_f1: 0.5952
 epoch: 98, train_loss: 0.2815, test_loss: 1.5285, test_f1: 0.6277
 epoch: 99, train_loss: 0.2719, test_loss: 1.6411, test_f1: 0.6240

Training completed in 821.53 seconds
Best F1: 0.6748 at epoch 45
Mean F1 across iterations: 0.6477  0.0183
========================FINAL RESULTS================================
FEGIN weighted F1: 0.6748  0.0183
python main.py --data ltspice_demos --representation component_pin --model FEGIN --layers 2 --hiddens 128 --batch_size 32 --lr 0.0001 --emb_size 250 --epochs 100 --save_appendix component_pin_L2_H128_BS32_LR0.0001_E250 --no_val
-----



STDERR:
  File "main.py", line 370, in <module>
    main()
  File "main.py", line 254, in main
    dataset = dataset_class(
  File "/home/philip/projects/ltspice_examples_code_repo/Circuit-Completion-Using-GNNs/component_classification_with_link_prediction_head/evaluation/FEGIN/kernel/circuit_datasets.py", line 15, in __init__
    self.data, self.slices = torch.load(self.processed_paths[0])
  File "/home/philip/.local/lib/python3.8/site-packages/torch/serialization.py", line 1040, in load
    warnings.warn(
  File "/usr/lib/python3.8/warnings.py", line 109, in _showwarnmsg
    sw(msg.message, msg.category, msg.filename, msg.lineno,
  File "main.py", line 47, in warn_with_traceback
    traceback.print_stack(file=log)
/home/philip/projects/ltspice_examples_code_repo/Circuit-Completion-Using-GNNs/component_classification_with_link_prediction_head/evaluation/FEGIN/kernel/circuit_datasets.py:15: FutureWarning: You are using `torch.load` with `weights_only=False` (the current default value), which uses the default pickle module implicitly. It is possible to construct malicious pickle data which will execute arbitrary code during unpickling (See https://github.com/pytorch/pytorch/blob/main/SECURITY.md#untrusted-models for more details). In a future release, the default value for `weights_only` will be flipped to `True`. This limits the functions that could be executed during unpickling. Arbitrary objects will no longer be allowed to be loaded via this mode unless they are explicitly allowlisted by the user via `torch.serialization.add_safe_globals`. We recommend you start setting `weights_only=True` for any use case where you don't have full control of the loaded file. Please open an issue on GitHub for any issues related to this experimental feature.
  self.data, self.slices = torch.load(self.processed_paths[0])
