STDOUT:
Results will be saved in /home/philip/projects/ltspice_examples_code_repo/Circuit-Completion-Using-GNNs/component_classification_with_link_prediction_head/evaluation/FEGIN/results/model_FEGIN_dataset_ltspice_demos
Command line input: python main.py --data ltspice_demos --representation component_pin --model FEGIN --layers 5 --hiddens 16 --batch_size 32 --lr 0.0001 --emb_size 128 --epochs 100 --save_appendix component_pin_L5_H16_BS32_LR0.0001_E128 --no_val
 is saved.
-----
ltspice_demos - FEGIN
Using 5 layers, 16 hidden units, h = 2
Loading component_pin representation dataset
ENTERED
Training FEGIN on component_pin representation
Train: 1565, Test: 383
##################ITERATION #0 ****************************************
 epoch: 0, train_loss: 1.4783, test_loss: 1.4624, test_f1: 0.0507
 epoch: 1, train_loss: 1.4709, test_loss: 1.4578, test_f1: 0.0507
 epoch: 2, train_loss: 1.4670, test_loss: 1.4542, test_f1: 0.0507
 epoch: 3, train_loss: 1.4629, test_loss: 1.4506, test_f1: 0.0507
 epoch: 4, train_loss: 1.4587, test_loss: 1.4468, test_f1: 0.0507
 epoch: 5, train_loss: 1.4540, test_loss: 1.4429, test_f1: 0.0507
 epoch: 6, train_loss: 1.4505, test_loss: 1.4388, test_f1: 0.0507
 epoch: 7, train_loss: 1.4447, test_loss: 1.4341, test_f1: 0.0507
 epoch: 8, train_loss: 1.4393, test_loss: 1.4297, test_f1: 0.0507
 epoch: 9, train_loss: 1.4341, test_loss: 1.4234, test_f1: 0.0507
 epoch: 10, train_loss: 1.4261, test_loss: 1.4179, test_f1: 0.0507
 epoch: 11, train_loss: 1.4191, test_loss: 1.4097, test_f1: 0.0507
 epoch: 12, train_loss: 1.4081, test_loss: 1.3995, test_f1: 0.0507
 epoch: 13, train_loss: 1.3987, test_loss: 1.3902, test_f1: 0.0507
 epoch: 14, train_loss: 1.3878, test_loss: 1.3796, test_f1: 0.0507
 epoch: 15, train_loss: 1.3741, test_loss: 1.3666, test_f1: 0.1945
 epoch: 16, train_loss: 1.3605, test_loss: 1.3537, test_f1: 0.2385
 epoch: 17, train_loss: 1.3500, test_loss: 1.3425, test_f1: 0.3147
 epoch: 18, train_loss: 1.3351, test_loss: 1.3318, test_f1: 0.3363
 epoch: 19, train_loss: 1.3193, test_loss: 1.3192, test_f1: 0.3318
 epoch: 20, train_loss: 1.3073, test_loss: 1.3125, test_f1: 0.3334
 epoch: 21, train_loss: 1.2988, test_loss: 1.3068, test_f1: 0.3409
 epoch: 22, train_loss: 1.2834, test_loss: 1.2972, test_f1: 0.3225
 epoch: 23, train_loss: 1.2750, test_loss: 1.2918, test_f1: 0.3280
 epoch: 24, train_loss: 1.2601, test_loss: 1.2852, test_f1: 0.3233
 epoch: 25, train_loss: 1.2575, test_loss: 1.2783, test_f1: 0.3390
 epoch: 26, train_loss: 1.2459, test_loss: 1.2730, test_f1: 0.3466
 epoch: 27, train_loss: 1.2413, test_loss: 1.2677, test_f1: 0.3441
 epoch: 28, train_loss: 1.2353, test_loss: 1.2646, test_f1: 0.3457
 epoch: 29, train_loss: 1.2338, test_loss: 1.2607, test_f1: 0.3457
 epoch: 30, train_loss: 1.2284, test_loss: 1.2572, test_f1: 0.3285
 epoch: 31, train_loss: 1.2227, test_loss: 1.2528, test_f1: 0.3520
 epoch: 32, train_loss: 1.2139, test_loss: 1.2485, test_f1: 0.3283
 epoch: 33, train_loss: 1.2101, test_loss: 1.2463, test_f1: 0.3204
 epoch: 34, train_loss: 1.2133, test_loss: 1.2433, test_f1: 0.3018
 epoch: 35, train_loss: 1.2071, test_loss: 1.2409, test_f1: 0.3482
 epoch: 36, train_loss: 1.2065, test_loss: 1.2359, test_f1: 0.3070
 epoch: 37, train_loss: 1.1909, test_loss: 1.2361, test_f1: 0.3392
 epoch: 38, train_loss: 1.1888, test_loss: 1.2301, test_f1: 0.3186
 epoch: 39, train_loss: 1.1979, test_loss: 1.2253, test_f1: 0.2949
 epoch: 40, train_loss: 1.1872, test_loss: 1.2240, test_f1: 0.2917
 epoch: 41, train_loss: 1.1826, test_loss: 1.2209, test_f1: 0.3023
 epoch: 42, train_loss: 1.1758, test_loss: 1.2192, test_f1: 0.2989
 epoch: 43, train_loss: 1.1797, test_loss: 1.2165, test_f1: 0.2955
 epoch: 44, train_loss: 1.1715, test_loss: 1.2139, test_f1: 0.2951
 epoch: 45, train_loss: 1.1674, test_loss: 1.2109, test_f1: 0.3024
 epoch: 46, train_loss: 1.1690, test_loss: 1.2071, test_f1: 0.2935
 epoch: 47, train_loss: 1.1638, test_loss: 1.2036, test_f1: 0.3054
 epoch: 48, train_loss: 1.1582, test_loss: 1.2017, test_f1: 0.3007
 epoch: 49, train_loss: 1.1551, test_loss: 1.1944, test_f1: 0.2969
 epoch: 50, train_loss: 1.1505, test_loss: 1.1957, test_f1: 0.3104
 epoch: 51, train_loss: 1.1450, test_loss: 1.1910, test_f1: 0.3071
 epoch: 52, train_loss: 1.1497, test_loss: 1.1904, test_f1: 0.3054
 epoch: 53, train_loss: 1.1481, test_loss: 1.1879, test_f1: 0.2971
 epoch: 54, train_loss: 1.1493, test_loss: 1.1873, test_f1: 0.2971
 epoch: 55, train_loss: 1.1294, test_loss: 1.1865, test_f1: 0.3040
 epoch: 56, train_loss: 1.1450, test_loss: 1.1847, test_f1: 0.3073
 epoch: 57, train_loss: 1.1366, test_loss: 1.1817, test_f1: 0.3057
 epoch: 58, train_loss: 1.1380, test_loss: 1.1812, test_f1: 0.3203
 epoch: 59, train_loss: 1.1404, test_loss: 1.1756, test_f1: 0.3196
 epoch: 60, train_loss: 1.1312, test_loss: 1.1761, test_f1: 0.3189
 epoch: 61, train_loss: 1.1323, test_loss: 1.1756, test_f1: 0.3271
 epoch: 62, train_loss: 1.1356, test_loss: 1.1718, test_f1: 0.3353
 epoch: 63, train_loss: 1.1203, test_loss: 1.1720, test_f1: 0.3441
 epoch: 64, train_loss: 1.1168, test_loss: 1.1711, test_f1: 0.3543
 epoch: 65, train_loss: 1.1235, test_loss: 1.1674, test_f1: 0.3620
 epoch: 66, train_loss: 1.1192, test_loss: 1.1639, test_f1: 0.3554
 epoch: 67, train_loss: 1.1209, test_loss: 1.1628, test_f1: 0.3716
 epoch: 68, train_loss: 1.1108, test_loss: 1.1612, test_f1: 0.3718
 epoch: 69, train_loss: 1.1032, test_loss: 1.1602, test_f1: 0.3925
 epoch: 70, train_loss: 1.1117, test_loss: 1.1539, test_f1: 0.3696
 epoch: 71, train_loss: 1.1130, test_loss: 1.1534, test_f1: 0.3785
 epoch: 72, train_loss: 1.1091, test_loss: 1.1530, test_f1: 0.3964
 epoch: 73, train_loss: 1.1052, test_loss: 1.1461, test_f1: 0.3773
 epoch: 74, train_loss: 1.1070, test_loss: 1.1465, test_f1: 0.3832
 epoch: 75, train_loss: 1.1016, test_loss: 1.1470, test_f1: 0.3981
 epoch: 76, train_loss: 1.0991, test_loss: 1.1423, test_f1: 0.3986
 epoch: 77, train_loss: 1.0990, test_loss: 1.1433, test_f1: 0.4118
 epoch: 78, train_loss: 1.0972, test_loss: 1.1435, test_f1: 0.4115
 epoch: 79, train_loss: 1.0933, test_loss: 1.1400, test_f1: 0.4051
 epoch: 80, train_loss: 1.0903, test_loss: 1.1376, test_f1: 0.4184
 epoch: 81, train_loss: 1.0897, test_loss: 1.1367, test_f1: 0.4228
 epoch: 82, train_loss: 1.0912, test_loss: 1.1355, test_f1: 0.4200
 epoch: 83, train_loss: 1.0899, test_loss: 1.1321, test_f1: 0.4308
 epoch: 84, train_loss: 1.0802, test_loss: 1.1278, test_f1: 0.4061
 epoch: 85, train_loss: 1.0837, test_loss: 1.1259, test_f1: 0.4253
 epoch: 86, train_loss: 1.0698, test_loss: 1.1207, test_f1: 0.4103
 epoch: 87, train_loss: 1.0835, test_loss: 1.1214, test_f1: 0.4425
 epoch: 88, train_loss: 1.0843, test_loss: 1.1202, test_f1: 0.4263
 epoch: 89, train_loss: 1.0693, test_loss: 1.1171, test_f1: 0.4421
 epoch: 90, train_loss: 1.0724, test_loss: 1.1140, test_f1: 0.4469
 epoch: 91, train_loss: 1.0747, test_loss: 1.1121, test_f1: 0.4259
 epoch: 92, train_loss: 1.0735, test_loss: 1.1105, test_f1: 0.4570
 epoch: 93, train_loss: 1.0708, test_loss: 1.1093, test_f1: 0.4456
 epoch: 94, train_loss: 1.0730, test_loss: 1.1070, test_f1: 0.4424
 epoch: 95, train_loss: 1.0588, test_loss: 1.1057, test_f1: 0.4577
 epoch: 96, train_loss: 1.0586, test_loss: 1.1019, test_f1: 0.4615
 epoch: 97, train_loss: 1.0698, test_loss: 1.1006, test_f1: 0.4246
 epoch: 98, train_loss: 1.0537, test_loss: 1.1004, test_f1: 0.4481
 epoch: 99, train_loss: 1.0592, test_loss: 1.0967, test_f1: 0.4355
##################ITERATION #1 ****************************************
 epoch: 0, train_loss: 1.3839, test_loss: 1.3824, test_f1: 0.1365
 epoch: 1, train_loss: 1.3713, test_loss: 1.3773, test_f1: 0.1365
 epoch: 2, train_loss: 1.3645, test_loss: 1.3707, test_f1: 0.1365
 epoch: 3, train_loss: 1.3555, test_loss: 1.3629, test_f1: 0.1365
 epoch: 4, train_loss: 1.3477, test_loss: 1.3560, test_f1: 0.1365
 epoch: 5, train_loss: 1.3377, test_loss: 1.3484, test_f1: 0.1365
 epoch: 6, train_loss: 1.3261, test_loss: 1.3399, test_f1: 0.1365
 epoch: 7, train_loss: 1.3209, test_loss: 1.3329, test_f1: 0.1365
 epoch: 8, train_loss: 1.3075, test_loss: 1.3237, test_f1: 0.1365
 epoch: 9, train_loss: 1.2959, test_loss: 1.3160, test_f1: 0.1423
 epoch: 10, train_loss: 1.2823, test_loss: 1.3067, test_f1: 0.1719
 epoch: 11, train_loss: 1.2686, test_loss: 1.2980, test_f1: 0.3259
 epoch: 12, train_loss: 1.2585, test_loss: 1.2891, test_f1: 0.3339
 epoch: 13, train_loss: 1.2519, test_loss: 1.2791, test_f1: 0.3409
 epoch: 14, train_loss: 1.2453, test_loss: 1.2729, test_f1: 0.3403
 epoch: 15, train_loss: 1.2312, test_loss: 1.2662, test_f1: 0.3421
 epoch: 16, train_loss: 1.2175, test_loss: 1.2607, test_f1: 0.3371
 epoch: 17, train_loss: 1.2174, test_loss: 1.2527, test_f1: 0.3122
 epoch: 18, train_loss: 1.2023, test_loss: 1.2488, test_f1: 0.3066
 epoch: 19, train_loss: 1.1898, test_loss: 1.2402, test_f1: 0.3129
 epoch: 20, train_loss: 1.1887, test_loss: 1.2349, test_f1: 0.3140
 epoch: 21, train_loss: 1.1795, test_loss: 1.2273, test_f1: 0.3370
 epoch: 22, train_loss: 1.1700, test_loss: 1.2236, test_f1: 0.3600
 epoch: 23, train_loss: 1.1651, test_loss: 1.2160, test_f1: 0.3701
 epoch: 24, train_loss: 1.1577, test_loss: 1.2059, test_f1: 0.3700
 epoch: 25, train_loss: 1.1502, test_loss: 1.2000, test_f1: 0.3795
 epoch: 26, train_loss: 1.1418, test_loss: 1.1929, test_f1: 0.3825
 epoch: 27, train_loss: 1.1338, test_loss: 1.1872, test_f1: 0.3828
 epoch: 28, train_loss: 1.1300, test_loss: 1.1852, test_f1: 0.3804
 epoch: 29, train_loss: 1.1255, test_loss: 1.1784, test_f1: 0.3713
 epoch: 30, train_loss: 1.1144, test_loss: 1.1765, test_f1: 0.3708
 epoch: 31, train_loss: 1.1094, test_loss: 1.1714, test_f1: 0.3726
 epoch: 32, train_loss: 1.1027, test_loss: 1.1599, test_f1: 0.3823
 epoch: 33, train_loss: 1.0992, test_loss: 1.1513, test_f1: 0.3816
 epoch: 34, train_loss: 1.0884, test_loss: 1.1520, test_f1: 0.3784
 epoch: 35, train_loss: 1.0909, test_loss: 1.1489, test_f1: 0.3925
 epoch: 36, train_loss: 1.0838, test_loss: 1.1432, test_f1: 0.3888
 epoch: 37, train_loss: 1.0741, test_loss: 1.1388, test_f1: 0.3871
 epoch: 38, train_loss: 1.0738, test_loss: 1.1378, test_f1: 0.3836
 epoch: 39, train_loss: 1.0663, test_loss: 1.1334, test_f1: 0.3869
 epoch: 40, train_loss: 1.0762, test_loss: 1.1259, test_f1: 0.3889
 epoch: 41, train_loss: 1.0539, test_loss: 1.1261, test_f1: 0.4232
 epoch: 42, train_loss: 1.0470, test_loss: 1.1150, test_f1: 0.4033
 epoch: 43, train_loss: 1.0542, test_loss: 1.1184, test_f1: 0.3970
 epoch: 44, train_loss: 1.0496, test_loss: 1.1135, test_f1: 0.3980
 epoch: 45, train_loss: 1.0423, test_loss: 1.1077, test_f1: 0.4067
 epoch: 46, train_loss: 1.0352, test_loss: 1.1131, test_f1: 0.3973
 epoch: 47, train_loss: 1.0357, test_loss: 1.1087, test_f1: 0.4006
 epoch: 48, train_loss: 1.0265, test_loss: 1.1014, test_f1: 0.4073
 epoch: 49, train_loss: 1.0304, test_loss: 1.1064, test_f1: 0.4078
 epoch: 50, train_loss: 1.0176, test_loss: 1.0993, test_f1: 0.3864
 epoch: 51, train_loss: 1.0192, test_loss: 1.0970, test_f1: 0.3910
 epoch: 52, train_loss: 1.0234, test_loss: 1.0997, test_f1: 0.4006
 epoch: 53, train_loss: 1.0269, test_loss: 1.0940, test_f1: 0.4001
 epoch: 54, train_loss: 1.0166, test_loss: 1.0896, test_f1: 0.4050
 epoch: 55, train_loss: 1.0175, test_loss: 1.0925, test_f1: 0.4028
 epoch: 56, train_loss: 1.0274, test_loss: 1.0923, test_f1: 0.3962
 epoch: 57, train_loss: 1.0176, test_loss: 1.0943, test_f1: 0.4042
 epoch: 58, train_loss: 1.0094, test_loss: 1.0885, test_f1: 0.4171
 epoch: 59, train_loss: 1.0115, test_loss: 1.0920, test_f1: 0.4137
 epoch: 60, train_loss: 1.0023, test_loss: 1.0875, test_f1: 0.4067
 epoch: 61, train_loss: 1.0113, test_loss: 1.0921, test_f1: 0.4089
 epoch: 62, train_loss: 1.0185, test_loss: 1.0905, test_f1: 0.4007
 epoch: 63, train_loss: 1.0038, test_loss: 1.0890, test_f1: 0.4034
 epoch: 64, train_loss: 1.0150, test_loss: 1.0858, test_f1: 0.4164
 epoch: 65, train_loss: 1.0089, test_loss: 1.0845, test_f1: 0.4107
 epoch: 66, train_loss: 1.0022, test_loss: 1.0834, test_f1: 0.4199
 epoch: 67, train_loss: 1.0055, test_loss: 1.0857, test_f1: 0.4275
 epoch: 68, train_loss: 1.0079, test_loss: 1.0883, test_f1: 0.4113
 epoch: 69, train_loss: 1.0028, test_loss: 1.0853, test_f1: 0.4262
 epoch: 70, train_loss: 1.0006, test_loss: 1.0831, test_f1: 0.4056
 epoch: 71, train_loss: 1.0022, test_loss: 1.0798, test_f1: 0.4228
 epoch: 72, train_loss: 0.9974, test_loss: 1.0862, test_f1: 0.4186
 epoch: 73, train_loss: 0.9904, test_loss: 1.0878, test_f1: 0.4059
 epoch: 74, train_loss: 0.9960, test_loss: 1.0832, test_f1: 0.4081
 epoch: 75, train_loss: 1.0008, test_loss: 1.0809, test_f1: 0.4128
 epoch: 76, train_loss: 0.9911, test_loss: 1.0863, test_f1: 0.3999
 epoch: 77, train_loss: 0.9917, test_loss: 1.0797, test_f1: 0.4168
 epoch: 78, train_loss: 0.9978, test_loss: 1.0790, test_f1: 0.4171
 epoch: 79, train_loss: 0.9839, test_loss: 1.0772, test_f1: 0.4194
 epoch: 80, train_loss: 0.9905, test_loss: 1.0729, test_f1: 0.4293
 epoch: 81, train_loss: 0.9879, test_loss: 1.0758, test_f1: 0.4302
 epoch: 82, train_loss: 0.9944, test_loss: 1.0694, test_f1: 0.4249
 epoch: 83, train_loss: 0.9770, test_loss: 1.0699, test_f1: 0.4279
 epoch: 84, train_loss: 0.9883, test_loss: 1.0717, test_f1: 0.4156
 epoch: 85, train_loss: 0.9845, test_loss: 1.0877, test_f1: 0.4073
 epoch: 86, train_loss: 0.9872, test_loss: 1.0839, test_f1: 0.4221
 epoch: 87, train_loss: 0.9807, test_loss: 1.0736, test_f1: 0.4200
 epoch: 88, train_loss: 0.9873, test_loss: 1.0731, test_f1: 0.4182
 epoch: 89, train_loss: 0.9865, test_loss: 1.0845, test_f1: 0.4218
 epoch: 90, train_loss: 0.9814, test_loss: 1.0814, test_f1: 0.4231
 epoch: 91, train_loss: 0.9865, test_loss: 1.0728, test_f1: 0.4163
 epoch: 92, train_loss: 0.9781, test_loss: 1.0894, test_f1: 0.4188
 epoch: 93, train_loss: 0.9814, test_loss: 1.0716, test_f1: 0.4194
 epoch: 94, train_loss: 0.9809, test_loss: 1.0759, test_f1: 0.4234
 epoch: 95, train_loss: 0.9783, test_loss: 1.0616, test_f1: 0.4337
 epoch: 96, train_loss: 0.9704, test_loss: 1.0669, test_f1: 0.4235
 epoch: 97, train_loss: 0.9779, test_loss: 1.0906, test_f1: 0.3939
 epoch: 98, train_loss: 0.9781, test_loss: 1.0703, test_f1: 0.4193
 epoch: 99, train_loss: 0.9762, test_loss: 1.0788, test_f1: 0.4178
##################ITERATION #2 ****************************************
 epoch: 0, train_loss: 1.3291, test_loss: 1.3426, test_f1: 0.1365
 epoch: 1, train_loss: 1.3119, test_loss: 1.3303, test_f1: 0.1527
 epoch: 2, train_loss: 1.3028, test_loss: 1.3227, test_f1: 0.1582
 epoch: 3, train_loss: 1.2933, test_loss: 1.3150, test_f1: 0.1527
 epoch: 4, train_loss: 1.2813, test_loss: 1.3061, test_f1: 0.1836
 epoch: 5, train_loss: 1.2748, test_loss: 1.2992, test_f1: 0.2535
 epoch: 6, train_loss: 1.2638, test_loss: 1.2921, test_f1: 0.2935
 epoch: 7, train_loss: 1.2551, test_loss: 1.2859, test_f1: 0.3036
 epoch: 8, train_loss: 1.2437, test_loss: 1.2797, test_f1: 0.2667
 epoch: 9, train_loss: 1.2379, test_loss: 1.2734, test_f1: 0.2585
 epoch: 10, train_loss: 1.2262, test_loss: 1.2675, test_f1: 0.2582
 epoch: 11, train_loss: 1.2221, test_loss: 1.2617, test_f1: 0.2585
 epoch: 12, train_loss: 1.2114, test_loss: 1.2567, test_f1: 0.2666
 epoch: 13, train_loss: 1.2105, test_loss: 1.2499, test_f1: 0.2285
 epoch: 14, train_loss: 1.1949, test_loss: 1.2456, test_f1: 0.2285
 epoch: 15, train_loss: 1.1932, test_loss: 1.2363, test_f1: 0.2608
 epoch: 16, train_loss: 1.1814, test_loss: 1.2324, test_f1: 0.2736
 epoch: 17, train_loss: 1.1686, test_loss: 1.2270, test_f1: 0.2716
 epoch: 18, train_loss: 1.1706, test_loss: 1.2206, test_f1: 0.3205
 epoch: 19, train_loss: 1.1671, test_loss: 1.2160, test_f1: 0.3176
 epoch: 20, train_loss: 1.1524, test_loss: 1.2113, test_f1: 0.3239
 epoch: 21, train_loss: 1.1374, test_loss: 1.2011, test_f1: 0.3489
 epoch: 22, train_loss: 1.1450, test_loss: 1.1951, test_f1: 0.3508
 epoch: 23, train_loss: 1.1277, test_loss: 1.1914, test_f1: 0.3685
 epoch: 24, train_loss: 1.1247, test_loss: 1.1908, test_f1: 0.3650
 epoch: 25, train_loss: 1.1145, test_loss: 1.1844, test_f1: 0.3636
 epoch: 26, train_loss: 1.1141, test_loss: 1.1816, test_f1: 0.3445
 epoch: 27, train_loss: 1.1059, test_loss: 1.1686, test_f1: 0.3509
 epoch: 28, train_loss: 1.1001, test_loss: 1.1686, test_f1: 0.3459
 epoch: 29, train_loss: 1.0984, test_loss: 1.1653, test_f1: 0.3423
 epoch: 30, train_loss: 1.0922, test_loss: 1.1561, test_f1: 0.3384
 epoch: 31, train_loss: 1.0976, test_loss: 1.1600, test_f1: 0.3423
 epoch: 32, train_loss: 1.0821, test_loss: 1.1599, test_f1: 0.3364
 epoch: 33, train_loss: 1.0678, test_loss: 1.1623, test_f1: 0.3454
 epoch: 34, train_loss: 1.0796, test_loss: 1.1599, test_f1: 0.3417
 epoch: 35, train_loss: 1.0664, test_loss: 1.1680, test_f1: 0.3423
 epoch: 36, train_loss: 1.0646, test_loss: 1.1530, test_f1: 0.3364
 epoch: 37, train_loss: 1.0559, test_loss: 1.1568, test_f1: 0.3364
 epoch: 38, train_loss: 1.0545, test_loss: 1.1845, test_f1: 0.3476
 epoch: 39, train_loss: 1.0550, test_loss: 1.1879, test_f1: 0.3364
 epoch: 40, train_loss: 1.0692, test_loss: 1.1667, test_f1: 0.3432
 epoch: 41, train_loss: 1.0567, test_loss: 1.1817, test_f1: 0.3432
 epoch: 42, train_loss: 1.0530, test_loss: 1.1636, test_f1: 0.3449
 epoch: 43, train_loss: 1.0370, test_loss: 1.1740, test_f1: 0.3356
 epoch: 44, train_loss: 1.0311, test_loss: 1.2144, test_f1: 0.3390
 epoch: 45, train_loss: 1.0387, test_loss: 1.1636, test_f1: 0.3463
 epoch: 46, train_loss: 1.0437, test_loss: 1.1858, test_f1: 0.3537
 epoch: 47, train_loss: 1.0389, test_loss: 1.1837, test_f1: 0.3598
 epoch: 48, train_loss: 1.0307, test_loss: 1.1872, test_f1: 0.3472
 epoch: 49, train_loss: 1.0388, test_loss: 1.2101, test_f1: 0.3535
 epoch: 50, train_loss: 1.0323, test_loss: 1.1738, test_f1: 0.3516
 epoch: 51, train_loss: 1.0201, test_loss: 1.1903, test_f1: 0.3474
 epoch: 52, train_loss: 1.0224, test_loss: 1.1734, test_f1: 0.3557
 epoch: 53, train_loss: 1.0223, test_loss: 1.1966, test_f1: 0.3477
 epoch: 54, train_loss: 1.0179, test_loss: 1.1927, test_f1: 0.3567
 epoch: 55, train_loss: 1.0179, test_loss: 1.1991, test_f1: 0.3568
 epoch: 56, train_loss: 1.0150, test_loss: 1.1932, test_f1: 0.3589
 epoch: 57, train_loss: 1.0275, test_loss: 1.2445, test_f1: 0.3432
 epoch: 58, train_loss: 1.0224, test_loss: 1.2170, test_f1: 0.3484
 epoch: 59, train_loss: 1.0234, test_loss: 1.2074, test_f1: 0.3516
 epoch: 60, train_loss: 1.0129, test_loss: 1.1787, test_f1: 0.3614
 epoch: 61, train_loss: 1.0163, test_loss: 1.2381, test_f1: 0.3650
 epoch: 62, train_loss: 1.0169, test_loss: 1.1777, test_f1: 0.3568
 epoch: 63, train_loss: 1.0140, test_loss: 1.2172, test_f1: 0.3670
 epoch: 64, train_loss: 1.0104, test_loss: 1.1984, test_f1: 0.3611
 epoch: 65, train_loss: 1.0136, test_loss: 1.2164, test_f1: 0.3574
 epoch: 66, train_loss: 1.0093, test_loss: 1.2467, test_f1: 0.3652
 epoch: 67, train_loss: 1.0054, test_loss: 1.2250, test_f1: 0.3566
 epoch: 68, train_loss: 1.0038, test_loss: 1.2224, test_f1: 0.3689
 epoch: 69, train_loss: 0.9993, test_loss: 1.2086, test_f1: 0.3651
 epoch: 70, train_loss: 1.0099, test_loss: 1.2460, test_f1: 0.3737
 epoch: 71, train_loss: 1.0001, test_loss: 1.2480, test_f1: 0.3806
 epoch: 72, train_loss: 1.0052, test_loss: 1.2102, test_f1: 0.3763
 epoch: 73, train_loss: 1.0045, test_loss: 1.2281, test_f1: 0.3709
 epoch: 74, train_loss: 1.0058, test_loss: 1.2294, test_f1: 0.3713
 epoch: 75, train_loss: 1.0026, test_loss: 1.2477, test_f1: 0.3775
 epoch: 76, train_loss: 0.9985, test_loss: 1.2464, test_f1: 0.3700
 epoch: 77, train_loss: 0.9989, test_loss: 1.2587, test_f1: 0.3697
 epoch: 78, train_loss: 0.9961, test_loss: 1.2854, test_f1: 0.3689
 epoch: 79, train_loss: 0.9950, test_loss: 1.2619, test_f1: 0.3769
 epoch: 80, train_loss: 1.0060, test_loss: 1.2445, test_f1: 0.3780
 epoch: 81, train_loss: 0.9929, test_loss: 1.2479, test_f1: 0.3703
 epoch: 82, train_loss: 0.9962, test_loss: 1.2219, test_f1: 0.3613
 epoch: 83, train_loss: 0.9997, test_loss: 1.2387, test_f1: 0.3699
 epoch: 84, train_loss: 0.9887, test_loss: 1.2732, test_f1: 0.3731
 epoch: 85, train_loss: 1.0017, test_loss: 1.2572, test_f1: 0.3564
 epoch: 86, train_loss: 1.0010, test_loss: 1.2784, test_f1: 0.3602
 epoch: 87, train_loss: 0.9876, test_loss: 1.2741, test_f1: 0.3604
 epoch: 88, train_loss: 0.9900, test_loss: 1.2939, test_f1: 0.3578
 epoch: 89, train_loss: 0.9873, test_loss: 1.2734, test_f1: 0.3634
 epoch: 90, train_loss: 0.9882, test_loss: 1.2473, test_f1: 0.3614
 epoch: 91, train_loss: 0.9850, test_loss: 1.2278, test_f1: 0.3612
 epoch: 92, train_loss: 0.9867, test_loss: 1.2829, test_f1: 0.3719
 epoch: 93, train_loss: 0.9825, test_loss: 1.2615, test_f1: 0.3743
 epoch: 94, train_loss: 0.9894, test_loss: 1.2577, test_f1: 0.3703
 epoch: 95, train_loss: 0.9941, test_loss: 1.2423, test_f1: 0.3861
 epoch: 96, train_loss: 0.9824, test_loss: 1.2572, test_f1: 0.3794
 epoch: 97, train_loss: 0.9842, test_loss: 1.2626, test_f1: 0.3679
 epoch: 98, train_loss: 0.9857, test_loss: 1.2513, test_f1: 0.3718
 epoch: 99, train_loss: 0.9918, test_loss: 1.2195, test_f1: 0.3756
##################ITERATION #3 ****************************************
 epoch: 0, train_loss: 1.2717, test_loss: 1.3165, test_f1: 0.1365
 epoch: 1, train_loss: 1.2616, test_loss: 1.3470, test_f1: 0.1583
 epoch: 2, train_loss: 1.2527, test_loss: 1.6327, test_f1: 0.1944
 epoch: 3, train_loss: 1.2476, test_loss: 1.4386, test_f1: 0.1820
 epoch: 4, train_loss: 1.2424, test_loss: 1.4293, test_f1: 0.2094
 epoch: 5, train_loss: 1.2345, test_loss: 1.3207, test_f1: 0.2577
 epoch: 6, train_loss: 1.2229, test_loss: 1.3096, test_f1: 0.2912
 epoch: 7, train_loss: 1.2185, test_loss: 1.2676, test_f1: 0.2870
 epoch: 8, train_loss: 1.2038, test_loss: 1.3550, test_f1: 0.2850
 epoch: 9, train_loss: 1.2049, test_loss: 1.2801, test_f1: 0.2579
 epoch: 10, train_loss: 1.1867, test_loss: 1.2672, test_f1: 0.2741
 epoch: 11, train_loss: 1.1820, test_loss: 1.3845, test_f1: 0.2783
 epoch: 12, train_loss: 1.1778, test_loss: 1.2916, test_f1: 0.2986
 epoch: 13, train_loss: 1.1683, test_loss: 1.2393, test_f1: 0.3023
 epoch: 14, train_loss: 1.1647, test_loss: 1.2338, test_f1: 0.3170
 epoch: 15, train_loss: 1.1592, test_loss: 1.2396, test_f1: 0.3220
 epoch: 16, train_loss: 1.1564, test_loss: 1.2737, test_f1: 0.3328
 epoch: 17, train_loss: 1.1471, test_loss: 1.2459, test_f1: 0.3344
 epoch: 18, train_loss: 1.1447, test_loss: 1.5013, test_f1: 0.3577
 epoch: 19, train_loss: 1.1345, test_loss: 1.4085, test_f1: 0.3440
 epoch: 20, train_loss: 1.1320, test_loss: 1.3907, test_f1: 0.3646
 epoch: 21, train_loss: 1.1236, test_loss: 1.3129, test_f1: 0.3607
 epoch: 22, train_loss: 1.1145, test_loss: 1.2819, test_f1: 0.3506
 epoch: 23, train_loss: 1.1115, test_loss: 1.2919, test_f1: 0.3760
 epoch: 24, train_loss: 1.1137, test_loss: 1.2903, test_f1: 0.3438
 epoch: 25, train_loss: 1.0998, test_loss: 1.2194, test_f1: 0.3627
 epoch: 26, train_loss: 1.0970, test_loss: 1.2290, test_f1: 0.3785
 epoch: 27, train_loss: 1.0899, test_loss: 1.1657, test_f1: 0.3751
 epoch: 28, train_loss: 1.0853, test_loss: 1.2698, test_f1: 0.3588
 epoch: 29, train_loss: 1.0880, test_loss: 1.1617, test_f1: 0.3844
 epoch: 30, train_loss: 1.0690, test_loss: 1.1585, test_f1: 0.3669
 epoch: 31, train_loss: 1.0793, test_loss: 1.1891, test_f1: 0.3749
 epoch: 32, train_loss: 1.0626, test_loss: 1.1982, test_f1: 0.3769
 epoch: 33, train_loss: 1.0746, test_loss: 1.1487, test_f1: 0.3643
 epoch: 34, train_loss: 1.0598, test_loss: 1.1317, test_f1: 0.3641
 epoch: 35, train_loss: 1.0532, test_loss: 1.1574, test_f1: 0.3726
 epoch: 36, train_loss: 1.0502, test_loss: 1.1991, test_f1: 0.3587
 epoch: 37, train_loss: 1.0484, test_loss: 1.1539, test_f1: 0.3771
 epoch: 38, train_loss: 1.0345, test_loss: 1.1594, test_f1: 0.3655
 epoch: 39, train_loss: 1.0454, test_loss: 1.1981, test_f1: 0.3578
 epoch: 40, train_loss: 1.0414, test_loss: 1.1520, test_f1: 0.3712
 epoch: 41, train_loss: 1.0357, test_loss: 1.1816, test_f1: 0.3682
 epoch: 42, train_loss: 1.0394, test_loss: 1.1221, test_f1: 0.3779
 epoch: 43, train_loss: 1.0287, test_loss: 1.3788, test_f1: 0.3578
 epoch: 44, train_loss: 1.0321, test_loss: 1.1841, test_f1: 0.3583
 epoch: 45, train_loss: 1.0282, test_loss: 1.1826, test_f1: 0.3712
 epoch: 46, train_loss: 1.0228, test_loss: 1.2606, test_f1: 0.3551
 epoch: 47, train_loss: 1.0242, test_loss: 1.1654, test_f1: 0.3705
 epoch: 48, train_loss: 1.0187, test_loss: 1.2068, test_f1: 0.3787
 epoch: 49, train_loss: 1.0141, test_loss: 1.1566, test_f1: 0.3868
 epoch: 50, train_loss: 1.0132, test_loss: 1.1853, test_f1: 0.3850
 epoch: 51, train_loss: 1.0141, test_loss: 1.2150, test_f1: 0.3894
 epoch: 52, train_loss: 1.0048, test_loss: 1.1398, test_f1: 0.3954
 epoch: 53, train_loss: 1.0135, test_loss: 1.1769, test_f1: 0.3870
 epoch: 54, train_loss: 1.0099, test_loss: 1.2073, test_f1: 0.3831
 epoch: 55, train_loss: 0.9974, test_loss: 1.1812, test_f1: 0.3914
 epoch: 56, train_loss: 1.0021, test_loss: 1.2234, test_f1: 0.3972
 epoch: 57, train_loss: 1.0020, test_loss: 1.1733, test_f1: 0.3914
 epoch: 58, train_loss: 1.0042, test_loss: 1.1628, test_f1: 0.3808
 epoch: 59, train_loss: 1.0040, test_loss: 1.2055, test_f1: 0.3871
 epoch: 60, train_loss: 1.0025, test_loss: 1.2769, test_f1: 0.3838
 epoch: 61, train_loss: 0.9992, test_loss: 1.2868, test_f1: 0.3794
 epoch: 62, train_loss: 0.9992, test_loss: 1.1404, test_f1: 0.3815
 epoch: 63, train_loss: 0.9926, test_loss: 1.1568, test_f1: 0.3904
 epoch: 64, train_loss: 0.9995, test_loss: 1.1683, test_f1: 0.3947
 epoch: 65, train_loss: 0.9937, test_loss: 1.2341, test_f1: 0.3779
 epoch: 66, train_loss: 0.9957, test_loss: 1.2128, test_f1: 0.3893
 epoch: 67, train_loss: 0.9924, test_loss: 1.1574, test_f1: 0.4049
 epoch: 68, train_loss: 0.9914, test_loss: 1.1735, test_f1: 0.3930
 epoch: 69, train_loss: 0.9929, test_loss: 1.2140, test_f1: 0.3955
 epoch: 70, train_loss: 0.9925, test_loss: 1.1870, test_f1: 0.3964
 epoch: 71, train_loss: 0.9868, test_loss: 1.1902, test_f1: 0.3740
 epoch: 72, train_loss: 0.9857, test_loss: 1.1636, test_f1: 0.3851
 epoch: 73, train_loss: 0.9901, test_loss: 1.1540, test_f1: 0.3880
 epoch: 74, train_loss: 0.9941, test_loss: 1.1737, test_f1: 0.4015
 epoch: 75, train_loss: 0.9824, test_loss: 1.3042, test_f1: 0.3978
 epoch: 76, train_loss: 0.9883, test_loss: 1.1954, test_f1: 0.3959
 epoch: 77, train_loss: 0.9888, test_loss: 1.2580, test_f1: 0.3848
 epoch: 78, train_loss: 0.9834, test_loss: 1.1978, test_f1: 0.4083
 epoch: 79, train_loss: 0.9790, test_loss: 1.2817, test_f1: 0.3891
 epoch: 80, train_loss: 0.9811, test_loss: 1.2172, test_f1: 0.3877
 epoch: 81, train_loss: 0.9960, test_loss: 1.1892, test_f1: 0.4041
 epoch: 82, train_loss: 0.9823, test_loss: 1.1315, test_f1: 0.3983
 epoch: 83, train_loss: 0.9663, test_loss: 1.2292, test_f1: 0.3849
 epoch: 84, train_loss: 0.9719, test_loss: 1.2333, test_f1: 0.4029
 epoch: 85, train_loss: 0.9806, test_loss: 1.1525, test_f1: 0.4132
 epoch: 86, train_loss: 0.9759, test_loss: 1.1523, test_f1: 0.3972
 epoch: 87, train_loss: 0.9737, test_loss: 1.1612, test_f1: 0.4039
 epoch: 88, train_loss: 0.9794, test_loss: 1.2157, test_f1: 0.3982
 epoch: 89, train_loss: 0.9763, test_loss: 1.2184, test_f1: 0.3855
 epoch: 90, train_loss: 0.9649, test_loss: 1.1797, test_f1: 0.4131
 epoch: 91, train_loss: 0.9723, test_loss: 1.1785, test_f1: 0.3974
 epoch: 92, train_loss: 0.9666, test_loss: 1.2115, test_f1: 0.3927
 epoch: 93, train_loss: 0.9762, test_loss: 1.1442, test_f1: 0.4155
 epoch: 94, train_loss: 0.9670, test_loss: 1.1943, test_f1: 0.4055
 epoch: 95, train_loss: 0.9605, test_loss: 1.1698, test_f1: 0.4118
 epoch: 96, train_loss: 0.9698, test_loss: 1.1479, test_f1: 0.4121
 epoch: 97, train_loss: 0.9663, test_loss: 1.1377, test_f1: 0.4064
 epoch: 98, train_loss: 0.9746, test_loss: 1.3443, test_f1: 0.3896
 epoch: 99, train_loss: 0.9703, test_loss: 1.1659, test_f1: 0.4027
##################ITERATION #4 ****************************************
 epoch: 0, train_loss: 1.2743, test_loss: 1.3058, test_f1: 0.3320
 epoch: 1, train_loss: 1.2592, test_loss: 1.2950, test_f1: 0.2642
 epoch: 2, train_loss: 1.2485, test_loss: 1.2912, test_f1: 0.2281
 epoch: 3, train_loss: 1.2454, test_loss: 1.2862, test_f1: 0.2281
 epoch: 4, train_loss: 1.2350, test_loss: 1.2820, test_f1: 0.2281
 epoch: 5, train_loss: 1.2341, test_loss: 1.2779, test_f1: 0.2281
 epoch: 6, train_loss: 1.2204, test_loss: 1.2746, test_f1: 0.2281
 epoch: 7, train_loss: 1.2167, test_loss: 1.2702, test_f1: 0.2281
 epoch: 8, train_loss: 1.2121, test_loss: 1.2679, test_f1: 0.2281
 epoch: 9, train_loss: 1.2067, test_loss: 1.2637, test_f1: 0.2281
 epoch: 10, train_loss: 1.2068, test_loss: 1.2598, test_f1: 0.2281
 epoch: 11, train_loss: 1.1968, test_loss: 1.2582, test_f1: 0.2398
 epoch: 12, train_loss: 1.2008, test_loss: 1.2533, test_f1: 0.2274
 epoch: 13, train_loss: 1.1837, test_loss: 1.2495, test_f1: 0.2270
 epoch: 14, train_loss: 1.1759, test_loss: 1.2445, test_f1: 0.2390
 epoch: 15, train_loss: 1.1713, test_loss: 1.2397, test_f1: 0.2500
 epoch: 16, train_loss: 1.1691, test_loss: 1.2344, test_f1: 0.2931
 epoch: 17, train_loss: 1.1616, test_loss: 1.2283, test_f1: 0.3189
 epoch: 18, train_loss: 1.1567, test_loss: 1.2204, test_f1: 0.3511
 epoch: 19, train_loss: 1.1537, test_loss: 1.2152, test_f1: 0.3481
 epoch: 20, train_loss: 1.1407, test_loss: 1.2099, test_f1: 0.4020
 epoch: 21, train_loss: 1.1427, test_loss: 1.2098, test_f1: 0.3774
 epoch: 22, train_loss: 1.1361, test_loss: 1.2064, test_f1: 0.3820
 epoch: 23, train_loss: 1.1270, test_loss: 1.2009, test_f1: 0.4034
 epoch: 24, train_loss: 1.1180, test_loss: 1.1937, test_f1: 0.3961
 epoch: 25, train_loss: 1.1250, test_loss: 1.1896, test_f1: 0.4046
 epoch: 26, train_loss: 1.1121, test_loss: 1.1881, test_f1: 0.3984
 epoch: 27, train_loss: 1.0973, test_loss: 1.1839, test_f1: 0.4001
 epoch: 28, train_loss: 1.1030, test_loss: 1.1673, test_f1: 0.3735
 epoch: 29, train_loss: 1.1039, test_loss: 1.1703, test_f1: 0.3906
 epoch: 30, train_loss: 1.0956, test_loss: 1.1630, test_f1: 0.3860
 epoch: 31, train_loss: 1.0884, test_loss: 1.1597, test_f1: 0.4114
 epoch: 32, train_loss: 1.0888, test_loss: 1.1592, test_f1: 0.4025
 epoch: 33, train_loss: 1.0778, test_loss: 1.1568, test_f1: 0.3983
 epoch: 34, train_loss: 1.0681, test_loss: 1.1481, test_f1: 0.4109
 epoch: 35, train_loss: 1.0733, test_loss: 1.1462, test_f1: 0.3955
 epoch: 36, train_loss: 1.0720, test_loss: 1.1503, test_f1: 0.3845
 epoch: 37, train_loss: 1.0599, test_loss: 1.1359, test_f1: 0.4222
 epoch: 38, train_loss: 1.0633, test_loss: 1.1336, test_f1: 0.4144
 epoch: 39, train_loss: 1.0546, test_loss: 1.1323, test_f1: 0.4130
 epoch: 40, train_loss: 1.0478, test_loss: 1.1318, test_f1: 0.4087
 epoch: 41, train_loss: 1.0454, test_loss: 1.1329, test_f1: 0.4047
 epoch: 42, train_loss: 1.0554, test_loss: 1.1259, test_f1: 0.4063
 epoch: 43, train_loss: 1.0445, test_loss: 1.1321, test_f1: 0.4014
 epoch: 44, train_loss: 1.0388, test_loss: 1.1329, test_f1: 0.3748
 epoch: 45, train_loss: 1.0375, test_loss: 1.1252, test_f1: 0.3958
 epoch: 46, train_loss: 1.0338, test_loss: 1.1202, test_f1: 0.4054
 epoch: 47, train_loss: 1.0306, test_loss: 1.1231, test_f1: 0.3959
 epoch: 48, train_loss: 1.0339, test_loss: 1.1307, test_f1: 0.4034
 epoch: 49, train_loss: 1.0276, test_loss: 1.1173, test_f1: 0.4009
 epoch: 50, train_loss: 1.0205, test_loss: 1.1244, test_f1: 0.4138
 epoch: 51, train_loss: 1.0222, test_loss: 1.1167, test_f1: 0.4145
 epoch: 52, train_loss: 1.0169, test_loss: 1.1215, test_f1: 0.3903
 epoch: 53, train_loss: 1.0215, test_loss: 1.1263, test_f1: 0.4033
 epoch: 54, train_loss: 1.0145, test_loss: 1.1166, test_f1: 0.4060
 epoch: 55, train_loss: 1.0144, test_loss: 1.1286, test_f1: 0.3903
 epoch: 56, train_loss: 1.0095, test_loss: 1.1381, test_f1: 0.3724
 epoch: 57, train_loss: 1.0116, test_loss: 1.1107, test_f1: 0.3856
 epoch: 58, train_loss: 1.0210, test_loss: 1.1182, test_f1: 0.3827
 epoch: 59, train_loss: 1.0055, test_loss: 1.1260, test_f1: 0.3880
 epoch: 60, train_loss: 1.0033, test_loss: 1.1182, test_f1: 0.3904
 epoch: 61, train_loss: 1.0123, test_loss: 1.1310, test_f1: 0.3782
 epoch: 62, train_loss: 1.0107, test_loss: 1.1200, test_f1: 0.3787
 epoch: 63, train_loss: 0.9949, test_loss: 1.1099, test_f1: 0.3830
 epoch: 64, train_loss: 0.9977, test_loss: 1.1110, test_f1: 0.3888
 epoch: 65, train_loss: 1.0057, test_loss: 1.1165, test_f1: 0.3786
 epoch: 66, train_loss: 1.0158, test_loss: 1.1197, test_f1: 0.3827
 epoch: 67, train_loss: 0.9951, test_loss: 1.1205, test_f1: 0.3931
 epoch: 68, train_loss: 1.0000, test_loss: 1.1216, test_f1: 0.3838
 epoch: 69, train_loss: 0.9983, test_loss: 1.1272, test_f1: 0.3784
 epoch: 70, train_loss: 1.0095, test_loss: 1.1152, test_f1: 0.3911
 epoch: 71, train_loss: 0.9926, test_loss: 1.1135, test_f1: 0.3848
 epoch: 72, train_loss: 0.9963, test_loss: 1.1165, test_f1: 0.3875
 epoch: 73, train_loss: 0.9965, test_loss: 1.1174, test_f1: 0.3876
 epoch: 74, train_loss: 1.0011, test_loss: 1.1069, test_f1: 0.3886
 epoch: 75, train_loss: 0.9830, test_loss: 1.1189, test_f1: 0.3747
 epoch: 76, train_loss: 0.9926, test_loss: 1.1230, test_f1: 0.3896
 epoch: 77, train_loss: 0.9868, test_loss: 1.1253, test_f1: 0.3705
 epoch: 78, train_loss: 0.9992, test_loss: 1.1009, test_f1: 0.4091
 epoch: 79, train_loss: 0.9937, test_loss: 1.1144, test_f1: 0.3892
 epoch: 80, train_loss: 0.9942, test_loss: 1.1246, test_f1: 0.3724
 epoch: 81, train_loss: 0.9939, test_loss: 1.1304, test_f1: 0.3727
 epoch: 82, train_loss: 0.9886, test_loss: 1.0973, test_f1: 0.4127
 epoch: 83, train_loss: 0.9738, test_loss: 1.1210, test_f1: 0.3801
 epoch: 84, train_loss: 0.9878, test_loss: 1.1071, test_f1: 0.3901
 epoch: 85, train_loss: 0.9890, test_loss: 1.1003, test_f1: 0.3946
 epoch: 86, train_loss: 0.9772, test_loss: 1.0998, test_f1: 0.3946
 epoch: 87, train_loss: 0.9772, test_loss: 1.1030, test_f1: 0.3764
 epoch: 88, train_loss: 0.9822, test_loss: 1.1162, test_f1: 0.3661
 epoch: 89, train_loss: 0.9768, test_loss: 1.1095, test_f1: 0.3686
 epoch: 90, train_loss: 0.9745, test_loss: 1.0927, test_f1: 0.3811
 epoch: 91, train_loss: 0.9752, test_loss: 1.0989, test_f1: 0.3769
 epoch: 92, train_loss: 0.9841, test_loss: 1.0954, test_f1: 0.3785
 epoch: 93, train_loss: 0.9795, test_loss: 1.1099, test_f1: 0.3744
 epoch: 94, train_loss: 0.9762, test_loss: 1.1044, test_f1: 0.3800
 epoch: 95, train_loss: 0.9730, test_loss: 1.1260, test_f1: 0.3611
 epoch: 96, train_loss: 0.9771, test_loss: 1.0906, test_f1: 0.3862
 epoch: 97, train_loss: 0.9736, test_loss: 1.1071, test_f1: 0.3667
 epoch: 98, train_loss: 0.9781, test_loss: 1.0992, test_f1: 0.3825
 epoch: 99, train_loss: 0.9748, test_loss: 1.1259, test_f1: 0.3629
##################ITERATION #5 ****************************************
 epoch: 0, train_loss: 1.2913, test_loss: 1.3212, test_f1: 0.2281
 epoch: 1, train_loss: 1.2768, test_loss: 1.3271, test_f1: 0.2285
 epoch: 2, train_loss: 1.2562, test_loss: 1.3126, test_f1: 0.2285
 epoch: 3, train_loss: 1.2483, test_loss: 1.3023, test_f1: 0.2289
 epoch: 4, train_loss: 1.2453, test_loss: 1.3098, test_f1: 0.2285
 epoch: 5, train_loss: 1.2347, test_loss: 1.2851, test_f1: 0.2285
 epoch: 6, train_loss: 1.2286, test_loss: 1.2833, test_f1: 0.2246
 epoch: 7, train_loss: 1.2207, test_loss: 1.2803, test_f1: 0.2289
 epoch: 8, train_loss: 1.2037, test_loss: 1.2687, test_f1: 0.2261
 epoch: 9, train_loss: 1.1995, test_loss: 1.2579, test_f1: 0.2285
 epoch: 10, train_loss: 1.2027, test_loss: 1.2614, test_f1: 0.2285
 epoch: 11, train_loss: 1.1990, test_loss: 1.2501, test_f1: 0.2285
 epoch: 12, train_loss: 1.1893, test_loss: 1.2474, test_f1: 0.2495
 epoch: 13, train_loss: 1.1788, test_loss: 1.2465, test_f1: 0.2680
 epoch: 14, train_loss: 1.1692, test_loss: 1.2430, test_f1: 0.2718
 epoch: 15, train_loss: 1.1615, test_loss: 1.2399, test_f1: 0.2799
 epoch: 16, train_loss: 1.1708, test_loss: 1.2226, test_f1: 0.2876
 epoch: 17, train_loss: 1.1691, test_loss: 1.2188, test_f1: 0.3051
 epoch: 18, train_loss: 1.1561, test_loss: 1.2128, test_f1: 0.2876
 epoch: 19, train_loss: 1.1456, test_loss: 1.2070, test_f1: 0.2953
 epoch: 20, train_loss: 1.1355, test_loss: 1.2055, test_f1: 0.3154
 epoch: 21, train_loss: 1.1334, test_loss: 1.2073, test_f1: 0.3158
 epoch: 22, train_loss: 1.1277, test_loss: 1.2006, test_f1: 0.3226
 epoch: 23, train_loss: 1.1289, test_loss: 1.1945, test_f1: 0.3240
 epoch: 24, train_loss: 1.1200, test_loss: 1.1843, test_f1: 0.3262
 epoch: 25, train_loss: 1.1196, test_loss: 1.1885, test_f1: 0.3144
 epoch: 26, train_loss: 1.1132, test_loss: 1.1795, test_f1: 0.3172
 epoch: 27, train_loss: 1.1050, test_loss: 1.1710, test_f1: 0.3250
 epoch: 28, train_loss: 1.1057, test_loss: 1.1734, test_f1: 0.3263
 epoch: 29, train_loss: 1.1009, test_loss: 1.1765, test_f1: 0.3144
 epoch: 30, train_loss: 1.0995, test_loss: 1.1810, test_f1: 0.3135
 epoch: 31, train_loss: 1.0874, test_loss: 1.1867, test_f1: 0.3160
 epoch: 32, train_loss: 1.0706, test_loss: 1.1718, test_f1: 0.3139
 epoch: 33, train_loss: 1.0836, test_loss: 1.1621, test_f1: 0.3668
 epoch: 34, train_loss: 1.0894, test_loss: 1.1898, test_f1: 0.3173
 epoch: 35, train_loss: 1.0749, test_loss: 1.1604, test_f1: 0.3247
 epoch: 36, train_loss: 1.0708, test_loss: 1.1741, test_f1: 0.3581
 epoch: 37, train_loss: 1.0658, test_loss: 1.1684, test_f1: 0.3472
 epoch: 38, train_loss: 1.0621, test_loss: 1.1622, test_f1: 0.3545
 epoch: 39, train_loss: 1.0592, test_loss: 1.1844, test_f1: 0.3548
 epoch: 40, train_loss: 1.0585, test_loss: 1.1743, test_f1: 0.3154
 epoch: 41, train_loss: 1.0551, test_loss: 1.1774, test_f1: 0.3498
 epoch: 42, train_loss: 1.0453, test_loss: 1.1654, test_f1: 0.3503
 epoch: 43, train_loss: 1.0305, test_loss: 1.1789, test_f1: 0.3481
 epoch: 44, train_loss: 1.0408, test_loss: 1.1549, test_f1: 0.3584
 epoch: 45, train_loss: 1.0348, test_loss: 1.1590, test_f1: 0.3501
 epoch: 46, train_loss: 1.0390, test_loss: 1.1456, test_f1: 0.3467
 epoch: 47, train_loss: 1.0367, test_loss: 1.1822, test_f1: 0.3510
 epoch: 48, train_loss: 1.0325, test_loss: 1.1622, test_f1: 0.3481
 epoch: 49, train_loss: 1.0324, test_loss: 1.1474, test_f1: 0.3504
 epoch: 50, train_loss: 1.0216, test_loss: 1.2381, test_f1: 0.3389
 epoch: 51, train_loss: 1.0151, test_loss: 1.1589, test_f1: 0.3484
 epoch: 52, train_loss: 1.0172, test_loss: 1.1637, test_f1: 0.3461
 epoch: 53, train_loss: 1.0193, test_loss: 1.1867, test_f1: 0.3498
 epoch: 54, train_loss: 1.0140, test_loss: 1.1687, test_f1: 0.3434
 epoch: 55, train_loss: 1.0098, test_loss: 1.1754, test_f1: 0.3505
 epoch: 56, train_loss: 1.0201, test_loss: 1.1952, test_f1: 0.3500
 epoch: 57, train_loss: 1.0138, test_loss: 1.1793, test_f1: 0.3530
 epoch: 58, train_loss: 1.0028, test_loss: 1.1864, test_f1: 0.3496
 epoch: 59, train_loss: 1.0055, test_loss: 1.1687, test_f1: 0.3551
 epoch: 60, train_loss: 1.0029, test_loss: 1.1525, test_f1: 0.3466
 epoch: 61, train_loss: 1.0017, test_loss: 1.2515, test_f1: 0.3461
 epoch: 62, train_loss: 1.0067, test_loss: 1.1858, test_f1: 0.3533
 epoch: 63, train_loss: 1.0022, test_loss: 1.3417, test_f1: 0.3459
 epoch: 64, train_loss: 1.0032, test_loss: 1.1560, test_f1: 0.3561
 epoch: 65, train_loss: 0.9984, test_loss: 1.1876, test_f1: 0.3582
 epoch: 66, train_loss: 0.9917, test_loss: 1.1664, test_f1: 0.3516
 epoch: 67, train_loss: 0.9992, test_loss: 1.1723, test_f1: 0.3490
 epoch: 68, train_loss: 0.9819, test_loss: 1.2179, test_f1: 0.3420
 epoch: 69, train_loss: 0.9971, test_loss: 1.1543, test_f1: 0.3582
 epoch: 70, train_loss: 0.9857, test_loss: 1.1681, test_f1: 0.3526
 epoch: 71, train_loss: 0.9935, test_loss: 1.1643, test_f1: 0.3612
 epoch: 72, train_loss: 0.9954, test_loss: 1.2286, test_f1: 0.3651
 epoch: 73, train_loss: 0.9801, test_loss: 1.3989, test_f1: 0.3669
 epoch: 74, train_loss: 0.9863, test_loss: 1.1375, test_f1: 0.3586
 epoch: 75, train_loss: 0.9953, test_loss: 1.1811, test_f1: 0.3474
 epoch: 76, train_loss: 0.9909, test_loss: 1.1642, test_f1: 0.3542
 epoch: 77, train_loss: 0.9863, test_loss: 1.1577, test_f1: 0.3613
 epoch: 78, train_loss: 0.9938, test_loss: 1.1889, test_f1: 0.3443
 epoch: 79, train_loss: 0.9803, test_loss: 1.1508, test_f1: 0.3708
 epoch: 80, train_loss: 0.9775, test_loss: 1.1914, test_f1: 0.3465
 epoch: 81, train_loss: 0.9762, test_loss: 1.2426, test_f1: 0.3480
 epoch: 82, train_loss: 0.9740, test_loss: 1.2876, test_f1: 0.3556
 epoch: 83, train_loss: 0.9717, test_loss: 1.2217, test_f1: 0.3457
 epoch: 84, train_loss: 0.9720, test_loss: 1.1618, test_f1: 0.3661
 epoch: 85, train_loss: 0.9765, test_loss: 1.1984, test_f1: 0.3632
 epoch: 86, train_loss: 0.9781, test_loss: 1.2715, test_f1: 0.3649
 epoch: 87, train_loss: 0.9762, test_loss: 1.1656, test_f1: 0.3442
 epoch: 88, train_loss: 0.9708, test_loss: 1.1975, test_f1: 0.3466
 epoch: 89, train_loss: 0.9717, test_loss: 1.1660, test_f1: 0.3690
 epoch: 90, train_loss: 0.9677, test_loss: 1.2038, test_f1: 0.3856
 epoch: 91, train_loss: 0.9760, test_loss: 1.1643, test_f1: 0.3581
 epoch: 92, train_loss: 0.9649, test_loss: 1.1619, test_f1: 0.3674
 epoch: 93, train_loss: 0.9671, test_loss: 1.1699, test_f1: 0.3585
 epoch: 94, train_loss: 0.9717, test_loss: 1.1853, test_f1: 0.3472
 epoch: 95, train_loss: 0.9639, test_loss: 1.1554, test_f1: 0.3648
 epoch: 96, train_loss: 0.9581, test_loss: 1.1787, test_f1: 0.3685
 epoch: 97, train_loss: 0.9697, test_loss: 1.1831, test_f1: 0.3590
 epoch: 98, train_loss: 0.9648, test_loss: 1.2619, test_f1: 0.3665
 epoch: 99, train_loss: 0.9587, test_loss: 1.2927, test_f1: 0.3644
##################ITERATION #6 ****************************************
 epoch: 0, train_loss: 1.2793, test_loss: 1.3178, test_f1: 0.2263
 epoch: 1, train_loss: 1.2629, test_loss: 1.3223, test_f1: 0.2642
 epoch: 2, train_loss: 1.2551, test_loss: 1.3191, test_f1: 0.2587
 epoch: 3, train_loss: 1.2494, test_loss: 1.3128, test_f1: 0.2587
 epoch: 4, train_loss: 1.2354, test_loss: 1.3125, test_f1: 0.2587
 epoch: 5, train_loss: 1.2321, test_loss: 1.3072, test_f1: 0.2585
 epoch: 6, train_loss: 1.2382, test_loss: 1.3026, test_f1: 0.2610
 epoch: 7, train_loss: 1.2356, test_loss: 1.2982, test_f1: 0.2611
 epoch: 8, train_loss: 1.2293, test_loss: 1.2948, test_f1: 0.2613
 epoch: 9, train_loss: 1.2177, test_loss: 1.2875, test_f1: 0.2610
 epoch: 10, train_loss: 1.2171, test_loss: 1.2900, test_f1: 0.2679
 epoch: 11, train_loss: 1.2183, test_loss: 1.2815, test_f1: 0.2678
 epoch: 12, train_loss: 1.2006, test_loss: 1.2825, test_f1: 0.2611
 epoch: 13, train_loss: 1.2058, test_loss: 1.2783, test_f1: 0.2505
 epoch: 14, train_loss: 1.1871, test_loss: 1.2733, test_f1: 0.2664
 epoch: 15, train_loss: 1.1892, test_loss: 1.2667, test_f1: 0.2680
 epoch: 16, train_loss: 1.1800, test_loss: 1.2634, test_f1: 0.2666
 epoch: 17, train_loss: 1.1782, test_loss: 1.2626, test_f1: 0.3062
 epoch: 18, train_loss: 1.1835, test_loss: 1.2550, test_f1: 0.3170
 epoch: 19, train_loss: 1.1654, test_loss: 1.2494, test_f1: 0.3323
 epoch: 20, train_loss: 1.1613, test_loss: 1.2420, test_f1: 0.3419
 epoch: 21, train_loss: 1.1539, test_loss: 1.2252, test_f1: 0.3433
 epoch: 22, train_loss: 1.1565, test_loss: 1.2380, test_f1: 0.3733
 epoch: 23, train_loss: 1.1523, test_loss: 1.2286, test_f1: 0.3719
 epoch: 24, train_loss: 1.1450, test_loss: 1.2475, test_f1: 0.3699
 epoch: 25, train_loss: 1.1366, test_loss: 1.2293, test_f1: 0.3679
 epoch: 26, train_loss: 1.1301, test_loss: 1.2240, test_f1: 0.3650
 epoch: 27, train_loss: 1.1348, test_loss: 1.2285, test_f1: 0.3402
 epoch: 28, train_loss: 1.1314, test_loss: 1.2343, test_f1: 0.3498
 epoch: 29, train_loss: 1.1180, test_loss: 1.2222, test_f1: 0.3449
 epoch: 30, train_loss: 1.1261, test_loss: 1.2373, test_f1: 0.3384
 epoch: 31, train_loss: 1.1055, test_loss: 1.2183, test_f1: 0.3398
 epoch: 32, train_loss: 1.1097, test_loss: 1.2038, test_f1: 0.3467
 epoch: 33, train_loss: 1.1032, test_loss: 1.2052, test_f1: 0.3424
 epoch: 34, train_loss: 1.0973, test_loss: 1.2494, test_f1: 0.3223
 epoch: 35, train_loss: 1.0991, test_loss: 1.2245, test_f1: 0.3401
 epoch: 36, train_loss: 1.0956, test_loss: 1.2061, test_f1: 0.3444
 epoch: 37, train_loss: 1.0938, test_loss: 1.2329, test_f1: 0.3241
 epoch: 38, train_loss: 1.0760, test_loss: 1.2168, test_f1: 0.3396
 epoch: 39, train_loss: 1.0718, test_loss: 1.2309, test_f1: 0.3259
 epoch: 40, train_loss: 1.0806, test_loss: 1.2271, test_f1: 0.3183
 epoch: 41, train_loss: 1.0800, test_loss: 1.2035, test_f1: 0.3402
 epoch: 42, train_loss: 1.0774, test_loss: 1.2453, test_f1: 0.3111
 epoch: 43, train_loss: 1.0612, test_loss: 1.2614, test_f1: 0.3200
 epoch: 44, train_loss: 1.0529, test_loss: 1.2475, test_f1: 0.3128
 epoch: 45, train_loss: 1.0665, test_loss: 1.2276, test_f1: 0.3165
 epoch: 46, train_loss: 1.0668, test_loss: 1.2044, test_f1: 0.3338
 epoch: 47, train_loss: 1.0553, test_loss: 1.2514, test_f1: 0.3134
 epoch: 48, train_loss: 1.0558, test_loss: 1.2595, test_f1: 0.3132
 epoch: 49, train_loss: 1.0522, test_loss: 1.2184, test_f1: 0.3205
 epoch: 50, train_loss: 1.0536, test_loss: 1.2421, test_f1: 0.3148
 epoch: 51, train_loss: 1.0485, test_loss: 1.2749, test_f1: 0.3125
 epoch: 52, train_loss: 1.0517, test_loss: 1.2460, test_f1: 0.3150
 epoch: 53, train_loss: 1.0536, test_loss: 1.2353, test_f1: 0.3167
 epoch: 54, train_loss: 1.0417, test_loss: 1.2542, test_f1: 0.3132
 epoch: 55, train_loss: 1.0422, test_loss: 1.2400, test_f1: 0.3149
 epoch: 56, train_loss: 1.0585, test_loss: 1.1967, test_f1: 0.3394
 epoch: 57, train_loss: 1.0488, test_loss: 1.2746, test_f1: 0.3118
 epoch: 58, train_loss: 1.0352, test_loss: 1.2444, test_f1: 0.3130
 epoch: 59, train_loss: 1.0339, test_loss: 1.2480, test_f1: 0.3131
 epoch: 60, train_loss: 1.0420, test_loss: 1.2665, test_f1: 0.3129
 epoch: 61, train_loss: 1.0344, test_loss: 1.2631, test_f1: 0.3134
 epoch: 62, train_loss: 1.0306, test_loss: 1.2462, test_f1: 0.3144
 epoch: 63, train_loss: 1.0314, test_loss: 1.2091, test_f1: 0.3373
 epoch: 64, train_loss: 1.0315, test_loss: 1.2697, test_f1: 0.3130
 epoch: 65, train_loss: 1.0359, test_loss: 1.2512, test_f1: 0.3148
 epoch: 66, train_loss: 1.0305, test_loss: 1.2729, test_f1: 0.3135
 epoch: 67, train_loss: 1.0294, test_loss: 1.2772, test_f1: 0.3131
 epoch: 68, train_loss: 1.0302, test_loss: 1.2679, test_f1: 0.3148
 epoch: 69, train_loss: 1.0269, test_loss: 1.2980, test_f1: 0.3151
 epoch: 70, train_loss: 1.0134, test_loss: 1.2517, test_f1: 0.3147
 epoch: 71, train_loss: 1.0293, test_loss: 1.2994, test_f1: 0.3139
 epoch: 72, train_loss: 1.0301, test_loss: 1.2990, test_f1: 0.3133
 epoch: 73, train_loss: 1.0243, test_loss: 1.2965, test_f1: 0.3132
 epoch: 74, train_loss: 1.0210, test_loss: 1.2417, test_f1: 0.3223
 epoch: 75, train_loss: 1.0220, test_loss: 1.3000, test_f1: 0.3135
 epoch: 76, train_loss: 1.0193, test_loss: 1.2494, test_f1: 0.3129
 epoch: 77, train_loss: 1.0234, test_loss: 1.2490, test_f1: 0.3148
 epoch: 78, train_loss: 1.0173, test_loss: 1.2387, test_f1: 0.3258
 epoch: 79, train_loss: 1.0107, test_loss: 1.2725, test_f1: 0.3130
 epoch: 80, train_loss: 1.0233, test_loss: 1.2991, test_f1: 0.3131
 epoch: 81, train_loss: 1.0101, test_loss: 1.2417, test_f1: 0.3258
 epoch: 82, train_loss: 1.0209, test_loss: 1.3262, test_f1: 0.3139
 epoch: 83, train_loss: 1.0245, test_loss: 1.3000, test_f1: 0.3136
 epoch: 84, train_loss: 1.0163, test_loss: 1.2789, test_f1: 0.3222
 epoch: 85, train_loss: 1.0119, test_loss: 1.2697, test_f1: 0.3240
 epoch: 86, train_loss: 1.0085, test_loss: 1.3360, test_f1: 0.3121
 epoch: 87, train_loss: 1.0024, test_loss: 1.2943, test_f1: 0.3170
 epoch: 88, train_loss: 1.0121, test_loss: 1.2761, test_f1: 0.3203
 epoch: 89, train_loss: 1.0002, test_loss: 1.2884, test_f1: 0.3205
 epoch: 90, train_loss: 1.0046, test_loss: 1.2661, test_f1: 0.3131
 epoch: 91, train_loss: 1.0055, test_loss: 1.3655, test_f1: 0.3036
 epoch: 92, train_loss: 1.0056, test_loss: 1.2503, test_f1: 0.3315
 epoch: 93, train_loss: 1.0120, test_loss: 1.2938, test_f1: 0.3128
 epoch: 94, train_loss: 1.0003, test_loss: 1.3549, test_f1: 0.3107
 epoch: 95, train_loss: 1.0028, test_loss: 1.3310, test_f1: 0.3082
 epoch: 96, train_loss: 1.0095, test_loss: 1.3266, test_f1: 0.3104
 epoch: 97, train_loss: 1.0044, test_loss: 1.3434, test_f1: 0.3105
 epoch: 98, train_loss: 1.0030, test_loss: 1.2405, test_f1: 0.3223
 epoch: 99, train_loss: 0.9954, test_loss: 1.3339, test_f1: 0.3068
##################ITERATION #7 ****************************************
 epoch: 0, train_loss: 1.2822, test_loss: 1.2979, test_f1: 0.2281
 epoch: 1, train_loss: 1.2549, test_loss: 1.2898, test_f1: 0.2281
 epoch: 2, train_loss: 1.2412, test_loss: 1.2841, test_f1: 0.2281
 epoch: 3, train_loss: 1.2293, test_loss: 1.2796, test_f1: 0.2281
 epoch: 4, train_loss: 1.2214, test_loss: 1.2699, test_f1: 0.2281
 epoch: 5, train_loss: 1.2111, test_loss: 1.2655, test_f1: 0.2281
 epoch: 6, train_loss: 1.2021, test_loss: 1.2519, test_f1: 0.2281
 epoch: 7, train_loss: 1.1870, test_loss: 1.2468, test_f1: 0.2281
 epoch: 8, train_loss: 1.1875, test_loss: 1.2449, test_f1: 0.2281
 epoch: 9, train_loss: 1.1801, test_loss: 1.2390, test_f1: 0.2281
 epoch: 10, train_loss: 1.1678, test_loss: 1.2350, test_f1: 0.2281
 epoch: 11, train_loss: 1.1623, test_loss: 1.2263, test_f1: 0.2325
 epoch: 12, train_loss: 1.1577, test_loss: 1.2190, test_f1: 0.2544
 epoch: 13, train_loss: 1.1406, test_loss: 1.2160, test_f1: 0.2975
 epoch: 14, train_loss: 1.1415, test_loss: 1.2129, test_f1: 0.2933
 epoch: 15, train_loss: 1.1352, test_loss: 1.2074, test_f1: 0.3417
 epoch: 16, train_loss: 1.1204, test_loss: 1.2069, test_f1: 0.3385
 epoch: 17, train_loss: 1.1156, test_loss: 1.2000, test_f1: 0.3403
 epoch: 18, train_loss: 1.1127, test_loss: 1.1922, test_f1: 0.3537
 epoch: 19, train_loss: 1.1065, test_loss: 1.1891, test_f1: 0.3525
 epoch: 20, train_loss: 1.0988, test_loss: 1.1855, test_f1: 0.3525
 epoch: 21, train_loss: 1.1034, test_loss: 1.1818, test_f1: 0.3589
 epoch: 22, train_loss: 1.0907, test_loss: 1.1749, test_f1: 0.3732
 epoch: 23, train_loss: 1.0896, test_loss: 1.1686, test_f1: 0.3657
 epoch: 24, train_loss: 1.0865, test_loss: 1.1629, test_f1: 0.3712
 epoch: 25, train_loss: 1.0749, test_loss: 1.1625, test_f1: 0.3747
 epoch: 26, train_loss: 1.0652, test_loss: 1.1555, test_f1: 0.3789
 epoch: 27, train_loss: 1.0693, test_loss: 1.1567, test_f1: 0.3728
 epoch: 28, train_loss: 1.0691, test_loss: 1.1499, test_f1: 0.3720
 epoch: 29, train_loss: 1.0766, test_loss: 1.1442, test_f1: 0.3941
 epoch: 30, train_loss: 1.0716, test_loss: 1.1483, test_f1: 0.3941
 epoch: 31, train_loss: 1.0553, test_loss: 1.1523, test_f1: 0.3988
 epoch: 32, train_loss: 1.0555, test_loss: 1.1435, test_f1: 0.3967
 epoch: 33, train_loss: 1.0444, test_loss: 1.1371, test_f1: 0.4027
 epoch: 34, train_loss: 1.0548, test_loss: 1.1325, test_f1: 0.3968
 epoch: 35, train_loss: 1.0439, test_loss: 1.1393, test_f1: 0.4060
 epoch: 36, train_loss: 1.0442, test_loss: 1.1312, test_f1: 0.4162
 epoch: 37, train_loss: 1.0407, test_loss: 1.1392, test_f1: 0.4011
 epoch: 38, train_loss: 1.0427, test_loss: 1.1280, test_f1: 0.4081
 epoch: 39, train_loss: 1.0250, test_loss: 1.1237, test_f1: 0.4037
 epoch: 40, train_loss: 1.0322, test_loss: 1.1312, test_f1: 0.3977
 epoch: 41, train_loss: 1.0260, test_loss: 1.1161, test_f1: 0.4101
 epoch: 42, train_loss: 1.0249, test_loss: 1.1224, test_f1: 0.4064
 epoch: 43, train_loss: 1.0137, test_loss: 1.1240, test_f1: 0.4097
 epoch: 44, train_loss: 1.0201, test_loss: 1.1197, test_f1: 0.4117
 epoch: 45, train_loss: 1.0034, test_loss: 1.1263, test_f1: 0.4079
 epoch: 46, train_loss: 1.0226, test_loss: 1.1134, test_f1: 0.4130
 epoch: 47, train_loss: 1.0123, test_loss: 1.1168, test_f1: 0.4105
 epoch: 48, train_loss: 1.0114, test_loss: 1.1085, test_f1: 0.4110
 epoch: 49, train_loss: 1.0110, test_loss: 1.1216, test_f1: 0.4129
 epoch: 50, train_loss: 1.0052, test_loss: 1.1327, test_f1: 0.4160
 epoch: 51, train_loss: 1.0055, test_loss: 1.1174, test_f1: 0.4170
 epoch: 52, train_loss: 0.9877, test_loss: 1.1149, test_f1: 0.4170
 epoch: 53, train_loss: 1.0000, test_loss: 1.1184, test_f1: 0.4193
 epoch: 54, train_loss: 0.9978, test_loss: 1.1182, test_f1: 0.4088
 epoch: 55, train_loss: 0.9903, test_loss: 1.1203, test_f1: 0.4179
 epoch: 56, train_loss: 0.9967, test_loss: 1.1132, test_f1: 0.4119
 epoch: 57, train_loss: 0.9939, test_loss: 1.1185, test_f1: 0.4145
 epoch: 58, train_loss: 1.0000, test_loss: 1.1079, test_f1: 0.4198
 epoch: 59, train_loss: 0.9960, test_loss: 1.1198, test_f1: 0.4150
 epoch: 60, train_loss: 0.9942, test_loss: 1.1207, test_f1: 0.4150
 epoch: 61, train_loss: 0.9995, test_loss: 1.1184, test_f1: 0.4089
 epoch: 62, train_loss: 0.9875, test_loss: 1.1187, test_f1: 0.4150
 epoch: 63, train_loss: 0.9933, test_loss: 1.1086, test_f1: 0.4197
 epoch: 64, train_loss: 0.9931, test_loss: 1.1088, test_f1: 0.4172
 epoch: 65, train_loss: 0.9928, test_loss: 1.1035, test_f1: 0.4148
 epoch: 66, train_loss: 0.9842, test_loss: 1.1195, test_f1: 0.4150
 epoch: 67, train_loss: 0.9950, test_loss: 1.1130, test_f1: 0.4142
 epoch: 68, train_loss: 0.9958, test_loss: 1.1135, test_f1: 0.4194
 epoch: 69, train_loss: 0.9797, test_loss: 1.1086, test_f1: 0.4199
 epoch: 70, train_loss: 0.9774, test_loss: 1.1104, test_f1: 0.4194
 epoch: 71, train_loss: 0.9813, test_loss: 1.1076, test_f1: 0.4179
 epoch: 72, train_loss: 0.9807, test_loss: 1.1105, test_f1: 0.4185
 epoch: 73, train_loss: 0.9898, test_loss: 1.1101, test_f1: 0.4166
 epoch: 74, train_loss: 0.9780, test_loss: 1.1028, test_f1: 0.4182
 epoch: 75, train_loss: 0.9702, test_loss: 1.1035, test_f1: 0.4200
 epoch: 76, train_loss: 0.9870, test_loss: 1.1061, test_f1: 0.4177
 epoch: 77, train_loss: 0.9834, test_loss: 1.1053, test_f1: 0.4039
 epoch: 78, train_loss: 0.9743, test_loss: 1.1103, test_f1: 0.4132
 epoch: 79, train_loss: 0.9868, test_loss: 1.1182, test_f1: 0.4127
 epoch: 80, train_loss: 0.9878, test_loss: 1.1137, test_f1: 0.4219
 epoch: 81, train_loss: 0.9747, test_loss: 1.1311, test_f1: 0.4117
 epoch: 82, train_loss: 0.9696, test_loss: 1.1321, test_f1: 0.4124
 epoch: 83, train_loss: 0.9828, test_loss: 1.1225, test_f1: 0.4089
 epoch: 84, train_loss: 0.9670, test_loss: 1.1195, test_f1: 0.4176
 epoch: 85, train_loss: 0.9747, test_loss: 1.1011, test_f1: 0.4192
 epoch: 86, train_loss: 0.9695, test_loss: 1.1164, test_f1: 0.4143
 epoch: 87, train_loss: 0.9721, test_loss: 1.1081, test_f1: 0.4160
 epoch: 88, train_loss: 0.9746, test_loss: 1.1217, test_f1: 0.4144
 epoch: 89, train_loss: 0.9792, test_loss: 1.1222, test_f1: 0.4084
 epoch: 90, train_loss: 0.9620, test_loss: 1.1140, test_f1: 0.4145
 epoch: 91, train_loss: 0.9578, test_loss: 1.1111, test_f1: 0.4157
 epoch: 92, train_loss: 0.9762, test_loss: 1.1116, test_f1: 0.4159
 epoch: 93, train_loss: 0.9632, test_loss: 1.1143, test_f1: 0.4218
 epoch: 94, train_loss: 0.9643, test_loss: 1.1295, test_f1: 0.4141
 epoch: 95, train_loss: 0.9737, test_loss: 1.1203, test_f1: 0.4161
 epoch: 96, train_loss: 0.9747, test_loss: 1.1111, test_f1: 0.4132
 epoch: 97, train_loss: 0.9788, test_loss: 1.1164, test_f1: 0.4140
 epoch: 98, train_loss: 0.9586, test_loss: 1.1186, test_f1: 0.4187
 epoch: 99, train_loss: 0.9658, test_loss: 1.1197, test_f1: 0.4193
##################ITERATION #8 ****************************************
 epoch: 0, train_loss: 1.2359, test_loss: 1.2986, test_f1: 0.2281
 epoch: 1, train_loss: 1.2099, test_loss: 1.2652, test_f1: 0.2336
 epoch: 2, train_loss: 1.2090, test_loss: 1.2519, test_f1: 0.2390
 epoch: 3, train_loss: 1.2049, test_loss: 1.2395, test_f1: 0.2441
 epoch: 4, train_loss: 1.1817, test_loss: 1.2320, test_f1: 0.2390
 epoch: 5, train_loss: 1.1790, test_loss: 1.2198, test_f1: 0.2586
 epoch: 6, train_loss: 1.1682, test_loss: 1.2118, test_f1: 0.2759
 epoch: 7, train_loss: 1.1607, test_loss: 1.1991, test_f1: 0.2876
 epoch: 8, train_loss: 1.1427, test_loss: 1.1958, test_f1: 0.3018
 epoch: 9, train_loss: 1.1425, test_loss: 1.1969, test_f1: 0.3018
 epoch: 10, train_loss: 1.1383, test_loss: 1.1940, test_f1: 0.3083
 epoch: 11, train_loss: 1.1282, test_loss: 1.1878, test_f1: 0.3396
 epoch: 12, train_loss: 1.1288, test_loss: 1.1839, test_f1: 0.3349
 epoch: 13, train_loss: 1.1209, test_loss: 1.1738, test_f1: 0.3470
 epoch: 14, train_loss: 1.1053, test_loss: 1.1726, test_f1: 0.3441
 epoch: 15, train_loss: 1.1089, test_loss: 1.1621, test_f1: 0.3537
 epoch: 16, train_loss: 1.1048, test_loss: 1.1656, test_f1: 0.3443
 epoch: 17, train_loss: 1.0929, test_loss: 1.1648, test_f1: 0.3460
 epoch: 18, train_loss: 1.0865, test_loss: 1.1526, test_f1: 0.3631
 epoch: 19, train_loss: 1.0824, test_loss: 1.1465, test_f1: 0.3679
 epoch: 20, train_loss: 1.0842, test_loss: 1.1424, test_f1: 0.3581
 epoch: 21, train_loss: 1.0841, test_loss: 1.1378, test_f1: 0.3631
 epoch: 22, train_loss: 1.0760, test_loss: 1.1374, test_f1: 0.3679
 epoch: 23, train_loss: 1.0694, test_loss: 1.1358, test_f1: 0.3656
 epoch: 24, train_loss: 1.0618, test_loss: 1.1290, test_f1: 0.3679
 epoch: 25, train_loss: 1.0504, test_loss: 1.1401, test_f1: 0.3524
 epoch: 26, train_loss: 1.0486, test_loss: 1.1330, test_f1: 0.3555
 epoch: 27, train_loss: 1.0468, test_loss: 1.1255, test_f1: 0.3635
 epoch: 28, train_loss: 1.0461, test_loss: 1.1258, test_f1: 0.3654
 epoch: 29, train_loss: 1.0391, test_loss: 1.1298, test_f1: 0.3526
 epoch: 30, train_loss: 1.0361, test_loss: 1.1238, test_f1: 0.3900
 epoch: 31, train_loss: 1.0415, test_loss: 1.1129, test_f1: 0.3683
 epoch: 32, train_loss: 1.0329, test_loss: 1.1160, test_f1: 0.3660
 epoch: 33, train_loss: 1.0311, test_loss: 1.1289, test_f1: 0.3465
 epoch: 34, train_loss: 1.0268, test_loss: 1.1256, test_f1: 0.3585
 epoch: 35, train_loss: 1.0146, test_loss: 1.1300, test_f1: 0.3560
 epoch: 36, train_loss: 1.0301, test_loss: 1.1388, test_f1: 0.3722
 epoch: 37, train_loss: 1.0156, test_loss: 1.1294, test_f1: 0.3806
 epoch: 38, train_loss: 1.0092, test_loss: 1.1203, test_f1: 0.3679
 epoch: 39, train_loss: 1.0090, test_loss: 1.1332, test_f1: 0.3719
 epoch: 40, train_loss: 1.0135, test_loss: 1.1370, test_f1: 0.3304
 epoch: 41, train_loss: 1.0044, test_loss: 1.1128, test_f1: 0.3907
 epoch: 42, train_loss: 1.0098, test_loss: 1.1141, test_f1: 0.3905
 epoch: 43, train_loss: 1.0066, test_loss: 1.1241, test_f1: 0.3822
 epoch: 44, train_loss: 1.0031, test_loss: 1.1129, test_f1: 0.3672
 epoch: 45, train_loss: 1.0036, test_loss: 1.1024, test_f1: 0.3854
 epoch: 46, train_loss: 0.9962, test_loss: 1.1108, test_f1: 0.3842
 epoch: 47, train_loss: 0.9883, test_loss: 1.1196, test_f1: 0.3983
 epoch: 48, train_loss: 1.0033, test_loss: 1.1173, test_f1: 0.3738
 epoch: 49, train_loss: 0.9930, test_loss: 1.1057, test_f1: 0.4002
 epoch: 50, train_loss: 0.9912, test_loss: 1.0981, test_f1: 0.3892
 epoch: 51, train_loss: 0.9875, test_loss: 1.1118, test_f1: 0.4021
 epoch: 52, train_loss: 0.9870, test_loss: 1.1220, test_f1: 0.4002
 epoch: 53, train_loss: 0.9883, test_loss: 1.1099, test_f1: 0.3933
 epoch: 54, train_loss: 0.9898, test_loss: 1.1062, test_f1: 0.3983
 epoch: 55, train_loss: 0.9852, test_loss: 1.0890, test_f1: 0.3999
 epoch: 56, train_loss: 0.9884, test_loss: 1.1136, test_f1: 0.4002
 epoch: 57, train_loss: 0.9713, test_loss: 1.1108, test_f1: 0.3964
 epoch: 58, train_loss: 0.9782, test_loss: 1.0966, test_f1: 0.3952
 epoch: 59, train_loss: 0.9798, test_loss: 1.1291, test_f1: 0.3966
 epoch: 60, train_loss: 0.9743, test_loss: 1.0946, test_f1: 0.3930
 epoch: 61, train_loss: 0.9717, test_loss: 1.1002, test_f1: 0.3986
 epoch: 62, train_loss: 0.9749, test_loss: 1.1043, test_f1: 0.3900
 epoch: 63, train_loss: 0.9765, test_loss: 1.1213, test_f1: 0.3984
 epoch: 64, train_loss: 0.9719, test_loss: 1.0845, test_f1: 0.3940
 epoch: 65, train_loss: 0.9678, test_loss: 1.0971, test_f1: 0.3978
 epoch: 66, train_loss: 0.9731, test_loss: 1.0881, test_f1: 0.4077
 epoch: 67, train_loss: 0.9694, test_loss: 1.0829, test_f1: 0.4195
 epoch: 68, train_loss: 0.9622, test_loss: 1.1139, test_f1: 0.3905
 epoch: 69, train_loss: 0.9676, test_loss: 1.0890, test_f1: 0.3975
 epoch: 70, train_loss: 0.9682, test_loss: 1.1260, test_f1: 0.3962
 epoch: 71, train_loss: 0.9615, test_loss: 1.1097, test_f1: 0.3890
 epoch: 72, train_loss: 0.9686, test_loss: 1.0955, test_f1: 0.3929
 epoch: 73, train_loss: 0.9630, test_loss: 1.1007, test_f1: 0.3889
 epoch: 74, train_loss: 0.9638, test_loss: 1.0944, test_f1: 0.3989
 epoch: 75, train_loss: 0.9505, test_loss: 1.0973, test_f1: 0.3926
 epoch: 76, train_loss: 0.9639, test_loss: 1.1043, test_f1: 0.3923
 epoch: 77, train_loss: 0.9557, test_loss: 1.1054, test_f1: 0.3943
 epoch: 78, train_loss: 0.9618, test_loss: 1.1032, test_f1: 0.3989
 epoch: 79, train_loss: 0.9629, test_loss: 1.0834, test_f1: 0.3915
 epoch: 80, train_loss: 0.9449, test_loss: 1.0941, test_f1: 0.3944
 epoch: 81, train_loss: 0.9609, test_loss: 1.1274, test_f1: 0.3906
 epoch: 82, train_loss: 0.9440, test_loss: 1.1112, test_f1: 0.3942
 epoch: 83, train_loss: 0.9554, test_loss: 1.1107, test_f1: 0.3963
 epoch: 84, train_loss: 0.9484, test_loss: 1.0947, test_f1: 0.3944
 epoch: 85, train_loss: 0.9560, test_loss: 1.1037, test_f1: 0.3944
 epoch: 86, train_loss: 0.9502, test_loss: 1.1198, test_f1: 0.3945
 epoch: 87, train_loss: 0.9474, test_loss: 1.1076, test_f1: 0.3964
 epoch: 88, train_loss: 0.9437, test_loss: 1.1051, test_f1: 0.3964
 epoch: 89, train_loss: 0.9472, test_loss: 1.1293, test_f1: 0.3957
 epoch: 90, train_loss: 0.9468, test_loss: 1.1220, test_f1: 0.3982
 epoch: 91, train_loss: 0.9449, test_loss: 1.0978, test_f1: 0.3981
 epoch: 92, train_loss: 0.9428, test_loss: 1.1138, test_f1: 0.3938
 epoch: 93, train_loss: 0.9485, test_loss: 1.0755, test_f1: 0.3952
 epoch: 94, train_loss: 0.9362, test_loss: 1.0936, test_f1: 0.3997
 epoch: 95, train_loss: 0.9368, test_loss: 1.0918, test_f1: 0.3945
 epoch: 96, train_loss: 0.9461, test_loss: 1.0887, test_f1: 0.3945
 epoch: 97, train_loss: 0.9348, test_loss: 1.0846, test_f1: 0.3945
 epoch: 98, train_loss: 0.9338, test_loss: 1.0876, test_f1: 0.3945
 epoch: 99, train_loss: 0.9351, test_loss: 1.1017, test_f1: 0.3926
##################ITERATION #9 ****************************************
 epoch: 0, train_loss: 1.2537, test_loss: 1.2873, test_f1: 0.2281
 epoch: 1, train_loss: 1.2460, test_loss: 1.2874, test_f1: 0.2248
 epoch: 2, train_loss: 1.2316, test_loss: 1.2810, test_f1: 0.2248
 epoch: 3, train_loss: 1.2293, test_loss: 1.2740, test_f1: 0.2248
 epoch: 4, train_loss: 1.2174, test_loss: 1.2695, test_f1: 0.2281
 epoch: 5, train_loss: 1.1960, test_loss: 1.2501, test_f1: 0.2336
 epoch: 6, train_loss: 1.1997, test_loss: 1.2500, test_f1: 0.2336
 epoch: 7, train_loss: 1.1812, test_loss: 1.2398, test_f1: 0.2441
 epoch: 8, train_loss: 1.1783, test_loss: 1.2324, test_f1: 0.2675
 epoch: 9, train_loss: 1.1683, test_loss: 1.2329, test_f1: 0.2799
 epoch: 10, train_loss: 1.1620, test_loss: 1.2255, test_f1: 0.2913
 epoch: 11, train_loss: 1.1476, test_loss: 1.2189, test_f1: 0.2949
 epoch: 12, train_loss: 1.1408, test_loss: 1.2023, test_f1: 0.3250
 epoch: 13, train_loss: 1.1211, test_loss: 1.1928, test_f1: 0.3258
 epoch: 14, train_loss: 1.1279, test_loss: 1.1904, test_f1: 0.3427
 epoch: 15, train_loss: 1.1205, test_loss: 1.1796, test_f1: 0.3602
 epoch: 16, train_loss: 1.1111, test_loss: 1.1730, test_f1: 0.3655
 epoch: 17, train_loss: 1.1219, test_loss: 1.1718, test_f1: 0.3801
 epoch: 18, train_loss: 1.0949, test_loss: 1.1678, test_f1: 0.3864
 epoch: 19, train_loss: 1.0876, test_loss: 1.1690, test_f1: 0.3662
 epoch: 20, train_loss: 1.0978, test_loss: 1.1627, test_f1: 0.3847
 epoch: 21, train_loss: 1.0927, test_loss: 1.1649, test_f1: 0.3847
 epoch: 22, train_loss: 1.0897, test_loss: 1.1524, test_f1: 0.3954
 epoch: 23, train_loss: 1.0789, test_loss: 1.1516, test_f1: 0.3936
 epoch: 24, train_loss: 1.0697, test_loss: 1.1470, test_f1: 0.3997
 epoch: 25, train_loss: 1.0653, test_loss: 1.1496, test_f1: 0.3938
 epoch: 26, train_loss: 1.0664, test_loss: 1.1377, test_f1: 0.3936
 epoch: 27, train_loss: 1.0485, test_loss: 1.1378, test_f1: 0.4049
 epoch: 28, train_loss: 1.0612, test_loss: 1.1345, test_f1: 0.3962
 epoch: 29, train_loss: 1.0588, test_loss: 1.1323, test_f1: 0.4083
 epoch: 30, train_loss: 1.0551, test_loss: 1.1299, test_f1: 0.4030
 epoch: 31, train_loss: 1.0363, test_loss: 1.1347, test_f1: 0.4015
 epoch: 32, train_loss: 1.0398, test_loss: 1.1283, test_f1: 0.4164
 epoch: 33, train_loss: 1.0311, test_loss: 1.1187, test_f1: 0.4187
 epoch: 34, train_loss: 1.0340, test_loss: 1.1217, test_f1: 0.4189
 epoch: 35, train_loss: 1.0428, test_loss: 1.1235, test_f1: 0.4199
 epoch: 36, train_loss: 1.0286, test_loss: 1.1214, test_f1: 0.4241
 epoch: 37, train_loss: 1.0313, test_loss: 1.1232, test_f1: 0.4272
 epoch: 38, train_loss: 1.0194, test_loss: 1.1095, test_f1: 0.4250
 epoch: 39, train_loss: 1.0146, test_loss: 1.1112, test_f1: 0.4222
 epoch: 40, train_loss: 1.0185, test_loss: 1.1221, test_f1: 0.4207
 epoch: 41, train_loss: 1.0223, test_loss: 1.1088, test_f1: 0.4245
 epoch: 42, train_loss: 1.0092, test_loss: 1.1140, test_f1: 0.4256
 epoch: 43, train_loss: 1.0187, test_loss: 1.1062, test_f1: 0.4286
 epoch: 44, train_loss: 1.0067, test_loss: 1.1070, test_f1: 0.4287
 epoch: 45, train_loss: 1.0043, test_loss: 1.1112, test_f1: 0.4241
 epoch: 46, train_loss: 1.0066, test_loss: 1.1039, test_f1: 0.4256
 epoch: 47, train_loss: 1.0055, test_loss: 1.1072, test_f1: 0.4244
 epoch: 48, train_loss: 0.9968, test_loss: 1.1025, test_f1: 0.4254
 epoch: 49, train_loss: 0.9823, test_loss: 1.1059, test_f1: 0.4301
 epoch: 50, train_loss: 0.9897, test_loss: 1.0983, test_f1: 0.4303
 epoch: 51, train_loss: 0.9927, test_loss: 1.1010, test_f1: 0.4363
 epoch: 52, train_loss: 0.9867, test_loss: 1.1025, test_f1: 0.4232
 epoch: 53, train_loss: 0.9892, test_loss: 1.0992, test_f1: 0.4384
 epoch: 54, train_loss: 0.9738, test_loss: 1.0992, test_f1: 0.4255
 epoch: 55, train_loss: 0.9890, test_loss: 1.0902, test_f1: 0.4275
 epoch: 56, train_loss: 0.9823, test_loss: 1.0955, test_f1: 0.4273
 epoch: 57, train_loss: 0.9797, test_loss: 1.0904, test_f1: 0.4362
 epoch: 58, train_loss: 0.9860, test_loss: 1.0983, test_f1: 0.4242
 epoch: 59, train_loss: 0.9771, test_loss: 1.0931, test_f1: 0.4279
 epoch: 60, train_loss: 0.9766, test_loss: 1.0862, test_f1: 0.4319
 epoch: 61, train_loss: 0.9642, test_loss: 1.0999, test_f1: 0.4345
 epoch: 62, train_loss: 0.9931, test_loss: 1.0782, test_f1: 0.4351
 epoch: 63, train_loss: 0.9776, test_loss: 1.0875, test_f1: 0.4344
 epoch: 64, train_loss: 0.9698, test_loss: 1.0825, test_f1: 0.4295
 epoch: 65, train_loss: 0.9728, test_loss: 1.0813, test_f1: 0.4290
 epoch: 66, train_loss: 0.9665, test_loss: 1.0860, test_f1: 0.4369
 epoch: 67, train_loss: 0.9801, test_loss: 1.0874, test_f1: 0.4400
 epoch: 68, train_loss: 0.9638, test_loss: 1.0908, test_f1: 0.4330
 epoch: 69, train_loss: 0.9650, test_loss: 1.0831, test_f1: 0.4300
 epoch: 70, train_loss: 0.9709, test_loss: 1.0805, test_f1: 0.4393
 epoch: 71, train_loss: 0.9661, test_loss: 1.0833, test_f1: 0.4385
 epoch: 72, train_loss: 0.9729, test_loss: 1.0794, test_f1: 0.4348
 epoch: 73, train_loss: 0.9582, test_loss: 1.0836, test_f1: 0.4356
 epoch: 74, train_loss: 0.9676, test_loss: 1.0805, test_f1: 0.4347
 epoch: 75, train_loss: 0.9720, test_loss: 1.0798, test_f1: 0.4332
 epoch: 76, train_loss: 0.9608, test_loss: 1.0808, test_f1: 0.4309
 epoch: 77, train_loss: 0.9527, test_loss: 1.0764, test_f1: 0.4339
 epoch: 78, train_loss: 0.9717, test_loss: 1.0768, test_f1: 0.4348
 epoch: 79, train_loss: 0.9572, test_loss: 1.0776, test_f1: 0.4319
 epoch: 80, train_loss: 0.9567, test_loss: 1.0789, test_f1: 0.4330
 epoch: 81, train_loss: 0.9549, test_loss: 1.0816, test_f1: 0.4330
 epoch: 82, train_loss: 0.9616, test_loss: 1.0704, test_f1: 0.4461
 epoch: 83, train_loss: 0.9678, test_loss: 1.0729, test_f1: 0.4358
 epoch: 84, train_loss: 0.9596, test_loss: 1.0643, test_f1: 0.4394
 epoch: 85, train_loss: 0.9516, test_loss: 1.0724, test_f1: 0.4284
 epoch: 86, train_loss: 0.9742, test_loss: 1.0689, test_f1: 0.4297
 epoch: 87, train_loss: 0.9532, test_loss: 1.0763, test_f1: 0.4366
 epoch: 88, train_loss: 0.9532, test_loss: 1.0788, test_f1: 0.4347
 epoch: 89, train_loss: 0.9597, test_loss: 1.0688, test_f1: 0.4306
 epoch: 90, train_loss: 0.9478, test_loss: 1.0715, test_f1: 0.4337
 epoch: 91, train_loss: 0.9496, test_loss: 1.0752, test_f1: 0.4418
 epoch: 92, train_loss: 0.9620, test_loss: 1.0728, test_f1: 0.4403
 epoch: 93, train_loss: 0.9425, test_loss: 1.0652, test_f1: 0.4423
 epoch: 94, train_loss: 0.9439, test_loss: 1.0755, test_f1: 0.4412
 epoch: 95, train_loss: 0.9393, test_loss: 1.0721, test_f1: 0.4472
 epoch: 96, train_loss: 0.9455, test_loss: 1.0670, test_f1: 0.4479
 epoch: 97, train_loss: 0.9527, test_loss: 1.0725, test_f1: 0.4362
 epoch: 98, train_loss: 0.9480, test_loss: 1.0774, test_f1: 0.4604
 epoch: 99, train_loss: 0.9471, test_loss: 1.0805, test_f1: 0.4613

Training completed in 728.73 seconds
Best F1: 0.4615 at epoch 96
Mean F1 across iterations: 0.4180  0.0285
========================FINAL RESULTS================================
FEGIN weighted F1: 0.4615  0.0285
python main.py --data ltspice_demos --representation component_pin --model FEGIN --layers 5 --hiddens 16 --batch_size 32 --lr 0.0001 --emb_size 128 --epochs 100 --save_appendix component_pin_L5_H16_BS32_LR0.0001_E128 --no_val
-----



STDERR:
  File "main.py", line 370, in <module>
    main()
  File "main.py", line 254, in main
    dataset = dataset_class(
  File "/home/philip/projects/ltspice_examples_code_repo/Circuit-Completion-Using-GNNs/component_classification_with_link_prediction_head/evaluation/FEGIN/kernel/circuit_datasets.py", line 15, in __init__
    self.data, self.slices = torch.load(self.processed_paths[0])
  File "/home/philip/.local/lib/python3.8/site-packages/torch/serialization.py", line 1040, in load
    warnings.warn(
  File "/usr/lib/python3.8/warnings.py", line 109, in _showwarnmsg
    sw(msg.message, msg.category, msg.filename, msg.lineno,
  File "main.py", line 47, in warn_with_traceback
    traceback.print_stack(file=log)
/home/philip/projects/ltspice_examples_code_repo/Circuit-Completion-Using-GNNs/component_classification_with_link_prediction_head/evaluation/FEGIN/kernel/circuit_datasets.py:15: FutureWarning: You are using `torch.load` with `weights_only=False` (the current default value), which uses the default pickle module implicitly. It is possible to construct malicious pickle data which will execute arbitrary code during unpickling (See https://github.com/pytorch/pytorch/blob/main/SECURITY.md#untrusted-models for more details). In a future release, the default value for `weights_only` will be flipped to `True`. This limits the functions that could be executed during unpickling. Arbitrary objects will no longer be allowed to be loaded via this mode unless they are explicitly allowlisted by the user via `torch.serialization.add_safe_globals`. We recommend you start setting `weights_only=True` for any use case where you don't have full control of the loaded file. Please open an issue on GitHub for any issues related to this experimental feature.
  self.data, self.slices = torch.load(self.processed_paths[0])
