STDOUT:
Results will be saved in /home/philip/projects/ltspice_examples_code_repo/Circuit-Completion-Using-GNNs/component_classification_with_link_prediction_head/evaluation/FEGIN/results/model_FEGIN_dataset_ltspice_demos
Command line input: python main.py --data ltspice_demos --representation component_net --model FEGIN --layers 4 --hiddens 32 --batch_size 32 --lr 0.01 --emb_size 128 --epochs 100 --save_appendix component_net_L4_H32_BS32_LR0.01_E128 --no_val
 is saved.
-----
ltspice_demos - FEGIN
Using 4 layers, 32 hidden units, h = 2
Loading component_net representation dataset
ENTERED
Training FEGIN on component_net representation
Train: 1565, Test: 383
##################ITERATION #0 ****************************************
 epoch: 0, train_loss: 1.2084, test_loss: 1.2556, test_f1: 0.2949
 epoch: 1, train_loss: 1.0442, test_loss: 1.1268, test_f1: 0.4336
 epoch: 2, train_loss: 1.0035, test_loss: 1.0686, test_f1: 0.4823
 epoch: 3, train_loss: 1.0002, test_loss: 1.1756, test_f1: 0.4589
 epoch: 4, train_loss: 0.9654, test_loss: 1.0685, test_f1: 0.4176
 epoch: 5, train_loss: 0.9658, test_loss: 1.1107, test_f1: 0.5027
 epoch: 6, train_loss: 0.9442, test_loss: 1.0747, test_f1: 0.5235
 epoch: 7, train_loss: 0.9377, test_loss: 1.0444, test_f1: 0.5262
 epoch: 8, train_loss: 0.9188, test_loss: 1.1058, test_f1: 0.5063
 epoch: 9, train_loss: 0.9265, test_loss: 1.1898, test_f1: 0.4798
 epoch: 10, train_loss: 0.9213, test_loss: 1.0404, test_f1: 0.5541
 epoch: 11, train_loss: 0.9124, test_loss: 1.1557, test_f1: 0.4587
 epoch: 12, train_loss: 0.9065, test_loss: 1.1071, test_f1: 0.5451
 epoch: 13, train_loss: 0.9180, test_loss: 1.0844, test_f1: 0.5255
 epoch: 14, train_loss: 0.8962, test_loss: 1.0232, test_f1: 0.5394
 epoch: 15, train_loss: 0.8804, test_loss: 1.1078, test_f1: 0.5587
 epoch: 16, train_loss: 0.8633, test_loss: 1.2232, test_f1: 0.4336
 epoch: 17, train_loss: 0.8736, test_loss: 1.1439, test_f1: 0.4578
 epoch: 18, train_loss: 0.8598, test_loss: 1.1808, test_f1: 0.4658
 epoch: 19, train_loss: 0.8445, test_loss: 1.2001, test_f1: 0.4902
 epoch: 20, train_loss: 0.8389, test_loss: 0.9630, test_f1: 0.5576
 epoch: 21, train_loss: 0.8251, test_loss: 1.0956, test_f1: 0.5690
 epoch: 22, train_loss: 0.8338, test_loss: 1.0612, test_f1: 0.5343
 epoch: 23, train_loss: 0.8193, test_loss: 1.1527, test_f1: 0.5513
 epoch: 24, train_loss: 0.8444, test_loss: 1.0951, test_f1: 0.5490
 epoch: 25, train_loss: 0.7950, test_loss: 1.0462, test_f1: 0.5677
 epoch: 26, train_loss: 0.8085, test_loss: 1.1632, test_f1: 0.5476
 epoch: 27, train_loss: 0.7955, test_loss: 1.2637, test_f1: 0.5192
 epoch: 28, train_loss: 0.7709, test_loss: 1.1760, test_f1: 0.5495
 epoch: 29, train_loss: 0.7743, test_loss: 1.1507, test_f1: 0.5240
 epoch: 30, train_loss: 0.7622, test_loss: 1.3635, test_f1: 0.5227
 epoch: 31, train_loss: 0.7498, test_loss: 1.0609, test_f1: 0.4806
 epoch: 32, train_loss: 0.7403, test_loss: 1.1664, test_f1: 0.5369
 epoch: 33, train_loss: 0.7415, test_loss: 1.0566, test_f1: 0.5999
 epoch: 34, train_loss: 0.7423, test_loss: 1.1786, test_f1: 0.5614
 epoch: 35, train_loss: 0.7580, test_loss: 1.0999, test_f1: 0.5515
 epoch: 36, train_loss: 0.7449, test_loss: 1.1142, test_f1: 0.5254
 epoch: 37, train_loss: 0.7195, test_loss: 1.2494, test_f1: 0.5352
 epoch: 38, train_loss: 0.7178, test_loss: 1.2197, test_f1: 0.5621
 epoch: 39, train_loss: 0.7045, test_loss: 1.1610, test_f1: 0.5605
 epoch: 40, train_loss: 0.7303, test_loss: 1.2216, test_f1: 0.5648
 epoch: 41, train_loss: 0.7483, test_loss: 1.3503, test_f1: 0.5504
 epoch: 42, train_loss: 0.7509, test_loss: 1.1076, test_f1: 0.5899
 epoch: 43, train_loss: 0.7181, test_loss: 1.1365, test_f1: 0.5782
 epoch: 44, train_loss: 0.6897, test_loss: 1.1073, test_f1: 0.6080
 epoch: 45, train_loss: 0.6747, test_loss: 1.1150, test_f1: 0.5923
 epoch: 46, train_loss: 0.6692, test_loss: 1.0760, test_f1: 0.6179
 epoch: 47, train_loss: 0.7023, test_loss: 1.1437, test_f1: 0.6368
 epoch: 48, train_loss: 0.6663, test_loss: 1.1267, test_f1: 0.6219
 epoch: 49, train_loss: 0.6889, test_loss: 1.2146, test_f1: 0.5397
 epoch: 50, train_loss: 0.6962, test_loss: 1.2781, test_f1: 0.5572
 epoch: 51, train_loss: 0.6725, test_loss: 1.1471, test_f1: 0.5826
 epoch: 52, train_loss: 0.6147, test_loss: 1.1924, test_f1: 0.6336
 epoch: 53, train_loss: 0.5890, test_loss: 1.3312, test_f1: 0.5960
 epoch: 54, train_loss: 0.5952, test_loss: 1.3121, test_f1: 0.5807
 epoch: 55, train_loss: 0.6093, test_loss: 1.2519, test_f1: 0.6240
 epoch: 56, train_loss: 0.5922, test_loss: 1.2679, test_f1: 0.6061
 epoch: 57, train_loss: 0.5997, test_loss: 1.5523, test_f1: 0.5800
 epoch: 58, train_loss: 0.5691, test_loss: 1.3203, test_f1: 0.6107
 epoch: 59, train_loss: 0.5885, test_loss: 1.2685, test_f1: 0.6122
 epoch: 60, train_loss: 0.5780, test_loss: 1.2818, test_f1: 0.5574
 epoch: 61, train_loss: 0.5782, test_loss: 1.3336, test_f1: 0.5965
 epoch: 62, train_loss: 0.5860, test_loss: 1.3804, test_f1: 0.5966
 epoch: 63, train_loss: 0.5519, test_loss: 1.4494, test_f1: 0.6021
 epoch: 64, train_loss: 0.5692, test_loss: 1.2977, test_f1: 0.6305
 epoch: 65, train_loss: 0.5865, test_loss: 1.3080, test_f1: 0.6131
 epoch: 66, train_loss: 0.5560, test_loss: 1.4215, test_f1: 0.5854
 epoch: 67, train_loss: 0.5502, test_loss: 1.4550, test_f1: 0.6118
 epoch: 68, train_loss: 0.5522, test_loss: 1.4218, test_f1: 0.6127
 epoch: 69, train_loss: 0.5292, test_loss: 1.3717, test_f1: 0.6006
 epoch: 70, train_loss: 0.5265, test_loss: 1.4437, test_f1: 0.5993
 epoch: 71, train_loss: 0.5381, test_loss: 1.3212, test_f1: 0.6112
 epoch: 72, train_loss: 0.5447, test_loss: 1.4131, test_f1: 0.6015
 epoch: 73, train_loss: 0.5179, test_loss: 1.5030, test_f1: 0.5917
 epoch: 74, train_loss: 0.5206, test_loss: 1.5023, test_f1: 0.6197
 epoch: 75, train_loss: 0.5328, test_loss: 1.4319, test_f1: 0.6171
 epoch: 76, train_loss: 0.5314, test_loss: 1.3892, test_f1: 0.6068
 epoch: 77, train_loss: 0.5087, test_loss: 1.5290, test_f1: 0.5941
 epoch: 78, train_loss: 0.4958, test_loss: 1.5270, test_f1: 0.5561
 epoch: 79, train_loss: 0.5197, test_loss: 1.5910, test_f1: 0.5867
 epoch: 80, train_loss: 0.5125, test_loss: 1.4521, test_f1: 0.6327
 epoch: 81, train_loss: 0.5081, test_loss: 1.5316, test_f1: 0.6078
 epoch: 82, train_loss: 0.5034, test_loss: 1.6123, test_f1: 0.5907
 epoch: 83, train_loss: 0.5095, test_loss: 1.4734, test_f1: 0.6281
 epoch: 84, train_loss: 0.5386, test_loss: 1.5149, test_f1: 0.5991
 epoch: 85, train_loss: 0.4925, test_loss: 1.5548, test_f1: 0.6384
 epoch: 86, train_loss: 0.4907, test_loss: 1.5354, test_f1: 0.6172
 epoch: 87, train_loss: 0.4960, test_loss: 1.7363, test_f1: 0.5808
 epoch: 88, train_loss: 0.4970, test_loss: 1.4613, test_f1: 0.6427
 epoch: 89, train_loss: 0.5134, test_loss: 1.4548, test_f1: 0.6229
 epoch: 90, train_loss: 0.4729, test_loss: 1.5888, test_f1: 0.6029
 epoch: 91, train_loss: 0.4701, test_loss: 1.5342, test_f1: 0.6259
 epoch: 92, train_loss: 0.4781, test_loss: 1.6650, test_f1: 0.5581
 epoch: 93, train_loss: 0.4825, test_loss: 1.6541, test_f1: 0.5893
 epoch: 94, train_loss: 0.4780, test_loss: 1.5910, test_f1: 0.6352
 epoch: 95, train_loss: 0.4672, test_loss: 1.8509, test_f1: 0.6091
 epoch: 96, train_loss: 0.4536, test_loss: 1.8681, test_f1: 0.5966
 epoch: 97, train_loss: 0.5025, test_loss: 1.6380, test_f1: 0.6026
 epoch: 98, train_loss: 0.4828, test_loss: 1.6233, test_f1: 0.6336
 epoch: 99, train_loss: 0.4628, test_loss: 1.7570, test_f1: 0.6348
##################ITERATION #1 ****************************************
 epoch: 0, train_loss: 1.1946, test_loss: 1.2058, test_f1: 0.4366
 epoch: 1, train_loss: 1.0507, test_loss: 1.1280, test_f1: 0.3680
 epoch: 2, train_loss: 1.0321, test_loss: 1.1524, test_f1: 0.4003
 epoch: 3, train_loss: 0.9847, test_loss: 1.1120, test_f1: 0.4789
 epoch: 4, train_loss: 0.9660, test_loss: 1.1777, test_f1: 0.3684
 epoch: 5, train_loss: 0.9893, test_loss: 1.0805, test_f1: 0.5116
 epoch: 6, train_loss: 0.9496, test_loss: 1.0079, test_f1: 0.5572
 epoch: 7, train_loss: 0.9222, test_loss: 1.0635, test_f1: 0.4217
 epoch: 8, train_loss: 0.9250, test_loss: 0.9997, test_f1: 0.5565
 epoch: 9, train_loss: 0.9191, test_loss: 1.0677, test_f1: 0.5826
 epoch: 10, train_loss: 0.8937, test_loss: 1.0455, test_f1: 0.5257
 epoch: 11, train_loss: 0.8776, test_loss: 1.0132, test_f1: 0.5819
 epoch: 12, train_loss: 0.8855, test_loss: 1.1142, test_f1: 0.5133
 epoch: 13, train_loss: 0.8991, test_loss: 1.0279, test_f1: 0.5651
 epoch: 14, train_loss: 0.8787, test_loss: 1.0379, test_f1: 0.5396
 epoch: 15, train_loss: 0.8633, test_loss: 1.1646, test_f1: 0.5029
 epoch: 16, train_loss: 0.8472, test_loss: 1.7847, test_f1: 0.3437
 epoch: 17, train_loss: 0.8512, test_loss: 1.1096, test_f1: 0.5686
 epoch: 18, train_loss: 0.8398, test_loss: 1.0689, test_f1: 0.5913
 epoch: 19, train_loss: 0.8131, test_loss: 1.0707, test_f1: 0.5451
 epoch: 20, train_loss: 0.7861, test_loss: 1.0686, test_f1: 0.5856
 epoch: 21, train_loss: 0.8274, test_loss: 0.9748, test_f1: 0.5955
 epoch: 22, train_loss: 0.7774, test_loss: 1.1482, test_f1: 0.5740
 epoch: 23, train_loss: 0.7932, test_loss: 1.1090, test_f1: 0.5804
 epoch: 24, train_loss: 0.7771, test_loss: 1.1517, test_f1: 0.5753
 epoch: 25, train_loss: 0.7660, test_loss: 1.0519, test_f1: 0.5612
 epoch: 26, train_loss: 0.7784, test_loss: 1.1242, test_f1: 0.5326
 epoch: 27, train_loss: 0.7530, test_loss: 1.1528, test_f1: 0.5907
 epoch: 28, train_loss: 0.7779, test_loss: 1.1748, test_f1: 0.5088
 epoch: 29, train_loss: 0.7610, test_loss: 1.1508, test_f1: 0.4580
 epoch: 30, train_loss: 0.7413, test_loss: 1.2341, test_f1: 0.4807
 epoch: 31, train_loss: 0.7305, test_loss: 1.1607, test_f1: 0.5777
 epoch: 32, train_loss: 0.7444, test_loss: 1.1148, test_f1: 0.5816
 epoch: 33, train_loss: 0.7358, test_loss: 1.1090, test_f1: 0.6011
 epoch: 34, train_loss: 0.7271, test_loss: 1.1387, test_f1: 0.6137
 epoch: 35, train_loss: 0.7081, test_loss: 1.1827, test_f1: 0.5891
 epoch: 36, train_loss: 0.7037, test_loss: 1.4012, test_f1: 0.4303
 epoch: 37, train_loss: 0.7416, test_loss: 1.1980, test_f1: 0.5639
 epoch: 38, train_loss: 0.6991, test_loss: 1.1381, test_f1: 0.6335
 epoch: 39, train_loss: 0.7100, test_loss: 1.1537, test_f1: 0.5845
 epoch: 40, train_loss: 0.6949, test_loss: 1.3697, test_f1: 0.5634
 epoch: 41, train_loss: 0.7273, test_loss: 1.2375, test_f1: 0.4597
 epoch: 42, train_loss: 0.6927, test_loss: 1.2397, test_f1: 0.5569
 epoch: 43, train_loss: 0.6765, test_loss: 1.1994, test_f1: 0.5716
 epoch: 44, train_loss: 0.6992, test_loss: 1.0862, test_f1: 0.5272
 epoch: 45, train_loss: 0.6923, test_loss: 1.2179, test_f1: 0.5270
 epoch: 46, train_loss: 0.7014, test_loss: 1.0991, test_f1: 0.5577
 epoch: 47, train_loss: 0.6877, test_loss: 1.3719, test_f1: 0.4207
 epoch: 48, train_loss: 0.6781, test_loss: 1.2318, test_f1: 0.6080
 epoch: 49, train_loss: 0.6950, test_loss: 1.2982, test_f1: 0.5775
 epoch: 50, train_loss: 0.7124, test_loss: 1.0856, test_f1: 0.6033
 epoch: 51, train_loss: 0.6561, test_loss: 1.1293, test_f1: 0.5788
 epoch: 52, train_loss: 0.6256, test_loss: 1.2098, test_f1: 0.6473
 epoch: 53, train_loss: 0.5934, test_loss: 1.1953, test_f1: 0.6299
 epoch: 54, train_loss: 0.6051, test_loss: 1.1818, test_f1: 0.6511
 epoch: 55, train_loss: 0.6168, test_loss: 1.1880, test_f1: 0.5965
 epoch: 56, train_loss: 0.6079, test_loss: 1.2503, test_f1: 0.6076
 epoch: 57, train_loss: 0.5924, test_loss: 1.2369, test_f1: 0.6167
 epoch: 58, train_loss: 0.5948, test_loss: 1.3533, test_f1: 0.6000
 epoch: 59, train_loss: 0.5981, test_loss: 1.2875, test_f1: 0.5994
 epoch: 60, train_loss: 0.6113, test_loss: 1.2762, test_f1: 0.6404
 epoch: 61, train_loss: 0.6037, test_loss: 1.3781, test_f1: 0.6061
 epoch: 62, train_loss: 0.5891, test_loss: 1.2498, test_f1: 0.6189
 epoch: 63, train_loss: 0.5829, test_loss: 1.2426, test_f1: 0.6520
 epoch: 64, train_loss: 0.5921, test_loss: 1.2834, test_f1: 0.6188
 epoch: 65, train_loss: 0.5852, test_loss: 1.2102, test_f1: 0.5809
 epoch: 66, train_loss: 0.5768, test_loss: 1.3308, test_f1: 0.5867
 epoch: 67, train_loss: 0.5797, test_loss: 1.2937, test_f1: 0.6043
 epoch: 68, train_loss: 0.5638, test_loss: 1.1989, test_f1: 0.6059
 epoch: 69, train_loss: 0.5459, test_loss: 1.3227, test_f1: 0.6262
 epoch: 70, train_loss: 0.5800, test_loss: 1.2790, test_f1: 0.6581
 epoch: 71, train_loss: 0.5655, test_loss: 1.2527, test_f1: 0.5786
 epoch: 72, train_loss: 0.5552, test_loss: 1.3507, test_f1: 0.6395
 epoch: 73, train_loss: 0.5473, test_loss: 1.3191, test_f1: 0.5981
 epoch: 74, train_loss: 0.5304, test_loss: 1.4629, test_f1: 0.6076
 epoch: 75, train_loss: 0.5754, test_loss: 1.2050, test_f1: 0.6106
 epoch: 76, train_loss: 0.5666, test_loss: 1.4026, test_f1: 0.5514
 epoch: 77, train_loss: 0.5369, test_loss: 1.3868, test_f1: 0.6134
 epoch: 78, train_loss: 0.5762, test_loss: 1.3831, test_f1: 0.6254
 epoch: 79, train_loss: 0.5399, test_loss: 1.3031, test_f1: 0.6300
 epoch: 80, train_loss: 0.5365, test_loss: 1.3956, test_f1: 0.5973
 epoch: 81, train_loss: 0.5181, test_loss: 1.4661, test_f1: 0.6295
 epoch: 82, train_loss: 0.5435, test_loss: 1.4058, test_f1: 0.6348
 epoch: 83, train_loss: 0.5499, test_loss: 1.2599, test_f1: 0.6024
 epoch: 84, train_loss: 0.5447, test_loss: 1.5271, test_f1: 0.6414
 epoch: 85, train_loss: 0.5325, test_loss: 1.3874, test_f1: 0.6015
 epoch: 86, train_loss: 0.5484, test_loss: 1.3867, test_f1: 0.5786
 epoch: 87, train_loss: 0.5164, test_loss: 1.4392, test_f1: 0.6033
 epoch: 88, train_loss: 0.5357, test_loss: 1.5290, test_f1: 0.6182
 epoch: 89, train_loss: 0.5602, test_loss: 1.4958, test_f1: 0.6109
 epoch: 90, train_loss: 0.5271, test_loss: 1.4016, test_f1: 0.5786
 epoch: 91, train_loss: 0.5299, test_loss: 1.4144, test_f1: 0.6413
 epoch: 92, train_loss: 0.5201, test_loss: 1.3142, test_f1: 0.6021
 epoch: 93, train_loss: 0.4880, test_loss: 1.4925, test_f1: 0.5887
 epoch: 94, train_loss: 0.5607, test_loss: 1.3393, test_f1: 0.6382
 epoch: 95, train_loss: 0.5188, test_loss: 1.6307, test_f1: 0.6344
 epoch: 96, train_loss: 0.5184, test_loss: 1.3181, test_f1: 0.6392
 epoch: 97, train_loss: 0.5131, test_loss: 1.6087, test_f1: 0.6011
 epoch: 98, train_loss: 0.4982, test_loss: 1.5271, test_f1: 0.5965
 epoch: 99, train_loss: 0.4824, test_loss: 1.5551, test_f1: 0.5725
##################ITERATION #2 ****************************************
 epoch: 0, train_loss: 1.1909, test_loss: 1.1454, test_f1: 0.3731
 epoch: 1, train_loss: 1.0634, test_loss: 1.1061, test_f1: 0.4018
 epoch: 2, train_loss: 1.0053, test_loss: 1.0544, test_f1: 0.5055
 epoch: 3, train_loss: 0.9685, test_loss: 1.0568, test_f1: 0.3910
 epoch: 4, train_loss: 0.9491, test_loss: 1.0551, test_f1: 0.4338
 epoch: 5, train_loss: 0.9349, test_loss: 1.0683, test_f1: 0.5573
 epoch: 6, train_loss: 0.9457, test_loss: 1.0483, test_f1: 0.4415
 epoch: 7, train_loss: 0.9079, test_loss: 1.0441, test_f1: 0.5622
 epoch: 8, train_loss: 0.8845, test_loss: 1.1131, test_f1: 0.4617
 epoch: 9, train_loss: 0.8742, test_loss: 1.0820, test_f1: 0.4973
 epoch: 10, train_loss: 0.8762, test_loss: 1.1269, test_f1: 0.4891
 epoch: 11, train_loss: 0.8503, test_loss: 0.9467, test_f1: 0.5793
 epoch: 12, train_loss: 0.8526, test_loss: 1.0101, test_f1: 0.5382
 epoch: 13, train_loss: 0.8599, test_loss: 1.1876, test_f1: 0.4815
 epoch: 14, train_loss: 0.8283, test_loss: 1.0431, test_f1: 0.5896
 epoch: 15, train_loss: 0.7981, test_loss: 1.0146, test_f1: 0.5917
 epoch: 16, train_loss: 0.8061, test_loss: 1.1034, test_f1: 0.5494
 epoch: 17, train_loss: 0.7727, test_loss: 1.1135, test_f1: 0.5848
 epoch: 18, train_loss: 0.8231, test_loss: 1.2773, test_f1: 0.4872
 epoch: 19, train_loss: 0.8116, test_loss: 1.0033, test_f1: 0.5531
 epoch: 20, train_loss: 0.7862, test_loss: 1.0571, test_f1: 0.5654
 epoch: 21, train_loss: 0.7822, test_loss: 0.9651, test_f1: 0.6265
 epoch: 22, train_loss: 0.7550, test_loss: 0.9693, test_f1: 0.5858
 epoch: 23, train_loss: 0.7541, test_loss: 1.0067, test_f1: 0.5070
 epoch: 24, train_loss: 0.7398, test_loss: 1.0063, test_f1: 0.5894
 epoch: 25, train_loss: 0.7277, test_loss: 1.0998, test_f1: 0.5349
 epoch: 26, train_loss: 0.7452, test_loss: 1.0980, test_f1: 0.6003
 epoch: 27, train_loss: 0.7540, test_loss: 1.0731, test_f1: 0.5971
 epoch: 28, train_loss: 0.7242, test_loss: 1.1333, test_f1: 0.5315
 epoch: 29, train_loss: 0.7456, test_loss: 1.0500, test_f1: 0.5079
 epoch: 30, train_loss: 0.7215, test_loss: 1.3619, test_f1: 0.4979
 epoch: 31, train_loss: 0.7510, test_loss: 1.0148, test_f1: 0.5956
 epoch: 32, train_loss: 0.7139, test_loss: 1.0559, test_f1: 0.5949
 epoch: 33, train_loss: 0.7133, test_loss: 1.1308, test_f1: 0.5497
 epoch: 34, train_loss: 0.6966, test_loss: 1.0333, test_f1: 0.5723
 epoch: 35, train_loss: 0.6997, test_loss: 1.0449, test_f1: 0.6017
 epoch: 36, train_loss: 0.6704, test_loss: 1.0661, test_f1: 0.5671
 epoch: 37, train_loss: 0.6781, test_loss: 1.1354, test_f1: 0.5166
 epoch: 38, train_loss: 0.6808, test_loss: 1.0283, test_f1: 0.5617
 epoch: 39, train_loss: 0.6672, test_loss: 1.2597, test_f1: 0.5696
 epoch: 40, train_loss: 0.7297, test_loss: 1.0381, test_f1: 0.5990
 epoch: 41, train_loss: 0.6934, test_loss: 1.0157, test_f1: 0.6052
 epoch: 42, train_loss: 0.6689, test_loss: 1.1668, test_f1: 0.5165
 epoch: 43, train_loss: 0.6526, test_loss: 1.1214, test_f1: 0.5377
 epoch: 44, train_loss: 0.6390, test_loss: 1.0727, test_f1: 0.5960
 epoch: 45, train_loss: 0.6414, test_loss: 1.0783, test_f1: 0.5983
 epoch: 46, train_loss: 0.6638, test_loss: 1.1328, test_f1: 0.5785
 epoch: 47, train_loss: 0.6584, test_loss: 1.1543, test_f1: 0.5479
 epoch: 48, train_loss: 0.6483, test_loss: 1.1352, test_f1: 0.5827
 epoch: 49, train_loss: 0.6467, test_loss: 1.0662, test_f1: 0.6361
 epoch: 50, train_loss: 0.6509, test_loss: 1.1890, test_f1: 0.5446
 epoch: 51, train_loss: 0.6087, test_loss: 1.0906, test_f1: 0.6353
 epoch: 52, train_loss: 0.6051, test_loss: 1.0789, test_f1: 0.5969
 epoch: 53, train_loss: 0.5770, test_loss: 1.0083, test_f1: 0.6424
 epoch: 54, train_loss: 0.5372, test_loss: 1.1534, test_f1: 0.6164
 epoch: 55, train_loss: 0.5642, test_loss: 1.1296, test_f1: 0.6252
 epoch: 56, train_loss: 0.5387, test_loss: 1.1807, test_f1: 0.6134
 epoch: 57, train_loss: 0.5544, test_loss: 1.1909, test_f1: 0.6272
 epoch: 58, train_loss: 0.5334, test_loss: 1.1393, test_f1: 0.6232
 epoch: 59, train_loss: 0.5399, test_loss: 1.2197, test_f1: 0.5879
 epoch: 60, train_loss: 0.5388, test_loss: 1.2398, test_f1: 0.5983
 epoch: 61, train_loss: 0.5592, test_loss: 1.1920, test_f1: 0.6000
 epoch: 62, train_loss: 0.5256, test_loss: 1.3290, test_f1: 0.5605
 epoch: 63, train_loss: 0.5411, test_loss: 1.2106, test_f1: 0.5833
 epoch: 64, train_loss: 0.5538, test_loss: 1.1473, test_f1: 0.6011
 epoch: 65, train_loss: 0.5145, test_loss: 1.2562, test_f1: 0.6055
 epoch: 66, train_loss: 0.5285, test_loss: 1.2481, test_f1: 0.5829
 epoch: 67, train_loss: 0.5533, test_loss: 1.2643, test_f1: 0.6006
 epoch: 68, train_loss: 0.5386, test_loss: 1.3799, test_f1: 0.6192
 epoch: 69, train_loss: 0.5100, test_loss: 1.3953, test_f1: 0.5718
 epoch: 70, train_loss: 0.4942, test_loss: 1.3638, test_f1: 0.5838
 epoch: 71, train_loss: 0.5126, test_loss: 1.4065, test_f1: 0.5749
 epoch: 72, train_loss: 0.4932, test_loss: 1.3669, test_f1: 0.5774
 epoch: 73, train_loss: 0.5193, test_loss: 1.3420, test_f1: 0.6092
 epoch: 74, train_loss: 0.5017, test_loss: 1.4397, test_f1: 0.5700
 epoch: 75, train_loss: 0.5055, test_loss: 1.3383, test_f1: 0.5966
 epoch: 76, train_loss: 0.5201, test_loss: 1.3204, test_f1: 0.5683
 epoch: 77, train_loss: 0.5038, test_loss: 1.4431, test_f1: 0.6110
 epoch: 78, train_loss: 0.4927, test_loss: 1.3400, test_f1: 0.6185
 epoch: 79, train_loss: 0.4905, test_loss: 1.3623, test_f1: 0.6288
 epoch: 80, train_loss: 0.5048, test_loss: 1.4533, test_f1: 0.6095
 epoch: 81, train_loss: 0.5466, test_loss: 1.2768, test_f1: 0.5985
 epoch: 82, train_loss: 0.5008, test_loss: 1.3644, test_f1: 0.6219
 epoch: 83, train_loss: 0.4927, test_loss: 1.5101, test_f1: 0.5720
 epoch: 84, train_loss: 0.4771, test_loss: 1.3737, test_f1: 0.5937
 epoch: 85, train_loss: 0.4937, test_loss: 1.4468, test_f1: 0.6130
 epoch: 86, train_loss: 0.4666, test_loss: 1.4782, test_f1: 0.5701
 epoch: 87, train_loss: 0.4624, test_loss: 1.4852, test_f1: 0.5731
 epoch: 88, train_loss: 0.4832, test_loss: 1.5078, test_f1: 0.5962
 epoch: 89, train_loss: 0.4586, test_loss: 1.3945, test_f1: 0.6042
 epoch: 90, train_loss: 0.4711, test_loss: 1.3811, test_f1: 0.6170
 epoch: 91, train_loss: 0.4701, test_loss: 1.5065, test_f1: 0.6455
 epoch: 92, train_loss: 0.4682, test_loss: 1.4979, test_f1: 0.6295
 epoch: 93, train_loss: 0.4831, test_loss: 1.4434, test_f1: 0.5667
 epoch: 94, train_loss: 0.4587, test_loss: 1.9157, test_f1: 0.5354
 epoch: 95, train_loss: 0.4835, test_loss: 1.5299, test_f1: 0.5821
 epoch: 96, train_loss: 0.4577, test_loss: 1.5337, test_f1: 0.5959
 epoch: 97, train_loss: 0.4567, test_loss: 1.6352, test_f1: 0.5733
 epoch: 98, train_loss: 0.4691, test_loss: 1.5624, test_f1: 0.5983
 epoch: 99, train_loss: 0.4853, test_loss: 1.3434, test_f1: 0.6128
##################ITERATION #3 ****************************************
 epoch: 0, train_loss: 1.1905, test_loss: 1.1744, test_f1: 0.4064
 epoch: 1, train_loss: 1.0574, test_loss: 1.0583, test_f1: 0.5209
 epoch: 2, train_loss: 1.0110, test_loss: 1.0812, test_f1: 0.4748
 epoch: 3, train_loss: 1.0083, test_loss: 1.1091, test_f1: 0.4856
 epoch: 4, train_loss: 0.9677, test_loss: 1.1173, test_f1: 0.4742
 epoch: 5, train_loss: 0.9558, test_loss: 1.1397, test_f1: 0.4197
 epoch: 6, train_loss: 0.9427, test_loss: 1.1462, test_f1: 0.4896
 epoch: 7, train_loss: 0.9229, test_loss: 1.0143, test_f1: 0.5289
 epoch: 8, train_loss: 0.9285, test_loss: 1.0646, test_f1: 0.5481
 epoch: 9, train_loss: 0.8956, test_loss: 1.0079, test_f1: 0.5292
 epoch: 10, train_loss: 0.8963, test_loss: 1.0175, test_f1: 0.5160
 epoch: 11, train_loss: 0.8914, test_loss: 1.1986, test_f1: 0.5129
 epoch: 12, train_loss: 0.8790, test_loss: 0.9917, test_f1: 0.5488
 epoch: 13, train_loss: 0.8527, test_loss: 1.0588, test_f1: 0.5510
 epoch: 14, train_loss: 0.8378, test_loss: 1.0370, test_f1: 0.4724
 epoch: 15, train_loss: 0.8090, test_loss: 1.0612, test_f1: 0.5432
 epoch: 16, train_loss: 0.8276, test_loss: 0.9881, test_f1: 0.5720
 epoch: 17, train_loss: 0.8329, test_loss: 1.0043, test_f1: 0.6079
 epoch: 18, train_loss: 0.8078, test_loss: 1.0256, test_f1: 0.5568
 epoch: 19, train_loss: 0.7887, test_loss: 1.1017, test_f1: 0.5120
 epoch: 20, train_loss: 0.7852, test_loss: 1.0672, test_f1: 0.5388
 epoch: 21, train_loss: 0.7898, test_loss: 1.0511, test_f1: 0.4685
 epoch: 22, train_loss: 0.7962, test_loss: 1.0798, test_f1: 0.5717
 epoch: 23, train_loss: 0.7702, test_loss: 1.0905, test_f1: 0.5976
 epoch: 24, train_loss: 0.7567, test_loss: 1.1171, test_f1: 0.5747
 epoch: 25, train_loss: 0.7535, test_loss: 1.0314, test_f1: 0.5567
 epoch: 26, train_loss: 0.7663, test_loss: 1.0521, test_f1: 0.5623
 epoch: 27, train_loss: 0.7931, test_loss: 1.1952, test_f1: 0.5382
 epoch: 28, train_loss: 0.7572, test_loss: 1.1110, test_f1: 0.6053
 epoch: 29, train_loss: 0.7654, test_loss: 1.1513, test_f1: 0.5308
 epoch: 30, train_loss: 0.7600, test_loss: 1.0681, test_f1: 0.5528
 epoch: 31, train_loss: 0.7353, test_loss: 1.0638, test_f1: 0.5508
 epoch: 32, train_loss: 0.7178, test_loss: 1.0634, test_f1: 0.5668
 epoch: 33, train_loss: 0.7485, test_loss: 1.0859, test_f1: 0.5714
 epoch: 34, train_loss: 0.7431, test_loss: 1.0080, test_f1: 0.6267
 epoch: 35, train_loss: 0.7314, test_loss: 1.0261, test_f1: 0.6224
 epoch: 36, train_loss: 0.7080, test_loss: 1.0929, test_f1: 0.5945
 epoch: 37, train_loss: 0.7411, test_loss: 1.2041, test_f1: 0.5623
 epoch: 38, train_loss: 0.7145, test_loss: 1.0190, test_f1: 0.5672
 epoch: 39, train_loss: 0.7235, test_loss: 1.0229, test_f1: 0.6035
 epoch: 40, train_loss: 0.7232, test_loss: 1.0635, test_f1: 0.5889
 epoch: 41, train_loss: 0.6852, test_loss: 1.0514, test_f1: 0.6109
 epoch: 42, train_loss: 0.6980, test_loss: 1.1573, test_f1: 0.5594
 epoch: 43, train_loss: 0.6866, test_loss: 1.1464, test_f1: 0.5854
 epoch: 44, train_loss: 0.7549, test_loss: 1.0755, test_f1: 0.5776
 epoch: 45, train_loss: 0.6933, test_loss: 1.1091, test_f1: 0.5989
 epoch: 46, train_loss: 0.6786, test_loss: 1.1160, test_f1: 0.6548
 epoch: 47, train_loss: 0.7008, test_loss: 1.1137, test_f1: 0.6036
 epoch: 48, train_loss: 0.7032, test_loss: 1.2267, test_f1: 0.5071
 epoch: 49, train_loss: 0.7030, test_loss: 1.0735, test_f1: 0.6152
 epoch: 50, train_loss: 0.6879, test_loss: 1.0372, test_f1: 0.6437
 epoch: 51, train_loss: 0.6745, test_loss: 1.0543, test_f1: 0.6668
 epoch: 52, train_loss: 0.6247, test_loss: 1.2187, test_f1: 0.6050
 epoch: 53, train_loss: 0.6065, test_loss: 1.3305, test_f1: 0.5645
 epoch: 54, train_loss: 0.6082, test_loss: 1.1890, test_f1: 0.5827
 epoch: 55, train_loss: 0.6013, test_loss: 1.3391, test_f1: 0.6321
 epoch: 56, train_loss: 0.6029, test_loss: 1.2350, test_f1: 0.6211
 epoch: 57, train_loss: 0.6015, test_loss: 1.2269, test_f1: 0.6026
 epoch: 58, train_loss: 0.5902, test_loss: 1.3622, test_f1: 0.6140
 epoch: 59, train_loss: 0.6077, test_loss: 1.4259, test_f1: 0.5979
 epoch: 60, train_loss: 0.6051, test_loss: 1.3244, test_f1: 0.5850
 epoch: 61, train_loss: 0.5799, test_loss: 1.3221, test_f1: 0.6088
 epoch: 62, train_loss: 0.5850, test_loss: 1.4312, test_f1: 0.5495
 epoch: 63, train_loss: 0.5844, test_loss: 1.3718, test_f1: 0.5863
 epoch: 64, train_loss: 0.5799, test_loss: 1.3739, test_f1: 0.6212
 epoch: 65, train_loss: 0.5685, test_loss: 1.2962, test_f1: 0.6155
 epoch: 66, train_loss: 0.5858, test_loss: 1.3420, test_f1: 0.6221
 epoch: 67, train_loss: 0.5621, test_loss: 1.3768, test_f1: 0.6054
 epoch: 68, train_loss: 0.5462, test_loss: 1.3669, test_f1: 0.5890
 epoch: 69, train_loss: 0.5817, test_loss: 1.5242, test_f1: 0.5992
 epoch: 70, train_loss: 0.5870, test_loss: 1.2291, test_f1: 0.6544
 epoch: 71, train_loss: 0.5726, test_loss: 1.3394, test_f1: 0.5941
 epoch: 72, train_loss: 0.5905, test_loss: 1.3187, test_f1: 0.5819
 epoch: 73, train_loss: 0.5595, test_loss: 1.5185, test_f1: 0.5654
 epoch: 74, train_loss: 0.5486, test_loss: 1.3645, test_f1: 0.6187
 epoch: 75, train_loss: 0.5637, test_loss: 1.2647, test_f1: 0.6218
 epoch: 76, train_loss: 0.5401, test_loss: 1.6250, test_f1: 0.5966
 epoch: 77, train_loss: 0.5445, test_loss: 1.2703, test_f1: 0.6268
 epoch: 78, train_loss: 0.5310, test_loss: 1.3027, test_f1: 0.6069
 epoch: 79, train_loss: 0.5357, test_loss: 1.4953, test_f1: 0.6023
 epoch: 80, train_loss: 0.5389, test_loss: 1.5130, test_f1: 0.6223
 epoch: 81, train_loss: 0.5347, test_loss: 1.4606, test_f1: 0.6168
 epoch: 82, train_loss: 0.5607, test_loss: 1.4899, test_f1: 0.5715
 epoch: 83, train_loss: 0.5407, test_loss: 1.6068, test_f1: 0.6004
 epoch: 84, train_loss: 0.5121, test_loss: 1.6447, test_f1: 0.6097
 epoch: 85, train_loss: 0.5122, test_loss: 1.3542, test_f1: 0.6304
 epoch: 86, train_loss: 0.5456, test_loss: 1.4221, test_f1: 0.6195
 epoch: 87, train_loss: 0.5140, test_loss: 1.5428, test_f1: 0.6112
 epoch: 88, train_loss: 0.5069, test_loss: 1.5889, test_f1: 0.6089
 epoch: 89, train_loss: 0.5439, test_loss: 1.4749, test_f1: 0.5592
 epoch: 90, train_loss: 0.5183, test_loss: 1.4312, test_f1: 0.6268
 epoch: 91, train_loss: 0.5227, test_loss: 1.4059, test_f1: 0.6038
 epoch: 92, train_loss: 0.5153, test_loss: 1.6237, test_f1: 0.6285
 epoch: 93, train_loss: 0.5016, test_loss: 1.4221, test_f1: 0.6365
 epoch: 94, train_loss: 0.5323, test_loss: 1.5385, test_f1: 0.6162
 epoch: 95, train_loss: 0.5169, test_loss: 1.4693, test_f1: 0.5936
 epoch: 96, train_loss: 0.4925, test_loss: 1.4410, test_f1: 0.6430
 epoch: 97, train_loss: 0.4946, test_loss: 1.4763, test_f1: 0.6240
 epoch: 98, train_loss: 0.4937, test_loss: 1.3874, test_f1: 0.6620
 epoch: 99, train_loss: 0.4867, test_loss: 1.6685, test_f1: 0.5984
##################ITERATION #4 ****************************************
 epoch: 0, train_loss: 1.2527, test_loss: 1.2035, test_f1: 0.3775
 epoch: 1, train_loss: 1.0809, test_loss: 1.1735, test_f1: 0.3985
 epoch: 2, train_loss: 1.0320, test_loss: 1.0856, test_f1: 0.4386
 epoch: 3, train_loss: 0.9871, test_loss: 1.0907, test_f1: 0.5113
 epoch: 4, train_loss: 0.9684, test_loss: 1.0671, test_f1: 0.4647
 epoch: 5, train_loss: 0.9769, test_loss: 1.0749, test_f1: 0.4176
 epoch: 6, train_loss: 0.9765, test_loss: 1.0052, test_f1: 0.5030
 epoch: 7, train_loss: 0.9483, test_loss: 1.0075, test_f1: 0.4734
 epoch: 8, train_loss: 0.9474, test_loss: 1.2901, test_f1: 0.4478
 epoch: 9, train_loss: 0.9347, test_loss: 1.0102, test_f1: 0.4748
 epoch: 10, train_loss: 0.9359, test_loss: 1.0612, test_f1: 0.4302
 epoch: 11, train_loss: 0.9203, test_loss: 1.0361, test_f1: 0.5471
 epoch: 12, train_loss: 0.9318, test_loss: 1.0067, test_f1: 0.5076
 epoch: 13, train_loss: 0.9028, test_loss: 1.0894, test_f1: 0.4879
 epoch: 14, train_loss: 0.9129, test_loss: 1.0036, test_f1: 0.5599
 epoch: 15, train_loss: 0.9108, test_loss: 1.1327, test_f1: 0.4807
 epoch: 16, train_loss: 0.8730, test_loss: 1.0414, test_f1: 0.5303
 epoch: 17, train_loss: 0.8855, test_loss: 1.0620, test_f1: 0.4731
 epoch: 18, train_loss: 0.8531, test_loss: 0.9836, test_f1: 0.5802
 epoch: 19, train_loss: 0.8683, test_loss: 1.1823, test_f1: 0.4239
 epoch: 20, train_loss: 0.8593, test_loss: 1.0117, test_f1: 0.4117
 epoch: 21, train_loss: 0.8310, test_loss: 1.0977, test_f1: 0.5140
 epoch: 22, train_loss: 0.8120, test_loss: 1.1260, test_f1: 0.4701
 epoch: 23, train_loss: 0.8244, test_loss: 0.9805, test_f1: 0.4724
 epoch: 24, train_loss: 0.8177, test_loss: 1.0003, test_f1: 0.5815
 epoch: 25, train_loss: 0.8000, test_loss: 1.0124, test_f1: 0.4528
 epoch: 26, train_loss: 0.8358, test_loss: 0.9701, test_f1: 0.5740
 epoch: 27, train_loss: 0.8023, test_loss: 0.9872, test_f1: 0.5760
 epoch: 28, train_loss: 0.7957, test_loss: 1.0911, test_f1: 0.4568
 epoch: 29, train_loss: 0.8036, test_loss: 1.0480, test_f1: 0.5063
 epoch: 30, train_loss: 0.8223, test_loss: 1.0616, test_f1: 0.5397
 epoch: 31, train_loss: 0.8111, test_loss: 1.0111, test_f1: 0.5889
 epoch: 32, train_loss: 0.8124, test_loss: 1.0377, test_f1: 0.5652
 epoch: 33, train_loss: 0.7912, test_loss: 0.9715, test_f1: 0.5861
 epoch: 34, train_loss: 0.7700, test_loss: 1.0427, test_f1: 0.5954
 epoch: 35, train_loss: 0.7628, test_loss: 1.0446, test_f1: 0.5617
 epoch: 36, train_loss: 0.7895, test_loss: 1.0334, test_f1: 0.5786
 epoch: 37, train_loss: 0.8110, test_loss: 0.9612, test_f1: 0.6075
 epoch: 38, train_loss: 0.7614, test_loss: 1.0388, test_f1: 0.5468
 epoch: 39, train_loss: 0.7678, test_loss: 1.0586, test_f1: 0.5283
 epoch: 40, train_loss: 0.7573, test_loss: 1.0330, test_f1: 0.5338
 epoch: 41, train_loss: 0.7514, test_loss: 1.1603, test_f1: 0.5594
 epoch: 42, train_loss: 0.7622, test_loss: 1.0414, test_f1: 0.5030
 epoch: 43, train_loss: 0.7502, test_loss: 1.0500, test_f1: 0.6252
 epoch: 44, train_loss: 0.7521, test_loss: 1.0389, test_f1: 0.5428
 epoch: 45, train_loss: 0.7501, test_loss: 1.0192, test_f1: 0.6505
 epoch: 46, train_loss: 0.7312, test_loss: 1.0038, test_f1: 0.6142
 epoch: 47, train_loss: 0.7162, test_loss: 1.0641, test_f1: 0.6399
 epoch: 48, train_loss: 0.7290, test_loss: 1.1479, test_f1: 0.5759
 epoch: 49, train_loss: 0.7669, test_loss: 1.1894, test_f1: 0.4898
 epoch: 50, train_loss: 0.7472, test_loss: 1.0508, test_f1: 0.5448
 epoch: 51, train_loss: 0.6888, test_loss: 0.9909, test_f1: 0.5989
 epoch: 52, train_loss: 0.6797, test_loss: 1.0642, test_f1: 0.6294
 epoch: 53, train_loss: 0.6746, test_loss: 1.0264, test_f1: 0.6022
 epoch: 54, train_loss: 0.6625, test_loss: 0.9848, test_f1: 0.6195
 epoch: 55, train_loss: 0.6602, test_loss: 1.2607, test_f1: 0.5174
 epoch: 56, train_loss: 0.6579, test_loss: 1.0817, test_f1: 0.5062
 epoch: 57, train_loss: 0.6561, test_loss: 1.1911, test_f1: 0.5989
 epoch: 58, train_loss: 0.6494, test_loss: 1.0519, test_f1: 0.6134
 epoch: 59, train_loss: 0.6552, test_loss: 1.1190, test_f1: 0.5992
 epoch: 60, train_loss: 0.6391, test_loss: 1.0682, test_f1: 0.5765
 epoch: 61, train_loss: 0.6422, test_loss: 1.1626, test_f1: 0.6159
 epoch: 62, train_loss: 0.6522, test_loss: 1.3257, test_f1: 0.6036
 epoch: 63, train_loss: 0.6551, test_loss: 1.2061, test_f1: 0.5947
 epoch: 64, train_loss: 0.6356, test_loss: 1.0999, test_f1: 0.5813
 epoch: 65, train_loss: 0.6237, test_loss: 1.1471, test_f1: 0.6171
 epoch: 66, train_loss: 0.6382, test_loss: 1.1401, test_f1: 0.6191
 epoch: 67, train_loss: 0.6253, test_loss: 1.1157, test_f1: 0.6272
 epoch: 68, train_loss: 0.6188, test_loss: 1.1497, test_f1: 0.6242
 epoch: 69, train_loss: 0.6221, test_loss: 1.0921, test_f1: 0.6169
 epoch: 70, train_loss: 0.6474, test_loss: 1.1984, test_f1: 0.6293
 epoch: 71, train_loss: 0.6340, test_loss: 1.1091, test_f1: 0.6096
 epoch: 72, train_loss: 0.6151, test_loss: 1.0828, test_f1: 0.6285
 epoch: 73, train_loss: 0.6268, test_loss: 1.0897, test_f1: 0.6361
 epoch: 74, train_loss: 0.6038, test_loss: 1.0322, test_f1: 0.6582
 epoch: 75, train_loss: 0.5816, test_loss: 1.1910, test_f1: 0.6122
 epoch: 76, train_loss: 0.6073, test_loss: 1.4734, test_f1: 0.5415
 epoch: 77, train_loss: 0.5846, test_loss: 1.2085, test_f1: 0.6281
 epoch: 78, train_loss: 0.5917, test_loss: 1.1914, test_f1: 0.6192
 epoch: 79, train_loss: 0.5952, test_loss: 1.2319, test_f1: 0.5909
 epoch: 80, train_loss: 0.5992, test_loss: 1.1513, test_f1: 0.5772
 epoch: 81, train_loss: 0.5971, test_loss: 1.2248, test_f1: 0.6093
 epoch: 82, train_loss: 0.6239, test_loss: 1.1415, test_f1: 0.5889
 epoch: 83, train_loss: 0.5831, test_loss: 1.1426, test_f1: 0.6264
 epoch: 84, train_loss: 0.6015, test_loss: 1.2387, test_f1: 0.6291
 epoch: 85, train_loss: 0.5823, test_loss: 1.2301, test_f1: 0.5685
 epoch: 86, train_loss: 0.5806, test_loss: 1.1662, test_f1: 0.6706
 epoch: 87, train_loss: 0.5724, test_loss: 1.2500, test_f1: 0.5965
 epoch: 88, train_loss: 0.5993, test_loss: 1.1799, test_f1: 0.6294
 epoch: 89, train_loss: 0.5799, test_loss: 1.3122, test_f1: 0.6096
 epoch: 90, train_loss: 0.5959, test_loss: 1.1722, test_f1: 0.6216
 epoch: 91, train_loss: 0.5725, test_loss: 1.2408, test_f1: 0.5879
 epoch: 92, train_loss: 0.5661, test_loss: 1.2214, test_f1: 0.6141
 epoch: 93, train_loss: 0.5808, test_loss: 1.2511, test_f1: 0.6568
 epoch: 94, train_loss: 0.5750, test_loss: 1.2257, test_f1: 0.6236
 epoch: 95, train_loss: 0.5670, test_loss: 1.4110, test_f1: 0.5721
 epoch: 96, train_loss: 0.5905, test_loss: 1.4057, test_f1: 0.5407
 epoch: 97, train_loss: 0.5875, test_loss: 1.5862, test_f1: 0.5392
 epoch: 98, train_loss: 0.5877, test_loss: 1.1203, test_f1: 0.6163
 epoch: 99, train_loss: 0.6010, test_loss: 1.3964, test_f1: 0.6032
##################ITERATION #5 ****************************************
 epoch: 0, train_loss: 1.2031, test_loss: 1.2125, test_f1: 0.2544
 epoch: 1, train_loss: 1.0570, test_loss: 1.0899, test_f1: 0.4258
 epoch: 2, train_loss: 1.0014, test_loss: 1.0437, test_f1: 0.5101
 epoch: 3, train_loss: 0.9651, test_loss: 1.1885, test_f1: 0.4409
 epoch: 4, train_loss: 0.9731, test_loss: 1.0607, test_f1: 0.4915
 epoch: 5, train_loss: 0.9607, test_loss: 1.1623, test_f1: 0.4682
 epoch: 6, train_loss: 0.9729, test_loss: 1.0754, test_f1: 0.4628
 epoch: 7, train_loss: 0.9560, test_loss: 1.2114, test_f1: 0.3414
 epoch: 8, train_loss: 0.9598, test_loss: 1.1134, test_f1: 0.3828
 epoch: 9, train_loss: 0.9455, test_loss: 1.0949, test_f1: 0.5224
 epoch: 10, train_loss: 0.9475, test_loss: 1.0676, test_f1: 0.5474
 epoch: 11, train_loss: 0.9340, test_loss: 1.0841, test_f1: 0.5499
 epoch: 12, train_loss: 0.9203, test_loss: 1.0703, test_f1: 0.5178
 epoch: 13, train_loss: 0.9157, test_loss: 1.1398, test_f1: 0.4960
 epoch: 14, train_loss: 0.9393, test_loss: 1.0107, test_f1: 0.5618
 epoch: 15, train_loss: 0.9013, test_loss: 1.0858, test_f1: 0.5103
 epoch: 16, train_loss: 0.8889, test_loss: 1.0159, test_f1: 0.4456
 epoch: 17, train_loss: 0.9058, test_loss: 1.0860, test_f1: 0.5430
 epoch: 18, train_loss: 0.8686, test_loss: 1.1286, test_f1: 0.5162
 epoch: 19, train_loss: 0.8745, test_loss: 1.0775, test_f1: 0.5373
 epoch: 20, train_loss: 0.8714, test_loss: 0.9870, test_f1: 0.5613
 epoch: 21, train_loss: 0.8749, test_loss: 0.9508, test_f1: 0.5763
 epoch: 22, train_loss: 0.8656, test_loss: 1.0828, test_f1: 0.5410
 epoch: 23, train_loss: 0.8569, test_loss: 0.9685, test_f1: 0.5839
 epoch: 24, train_loss: 0.8620, test_loss: 0.9696, test_f1: 0.5462
 epoch: 25, train_loss: 0.8330, test_loss: 1.1546, test_f1: 0.5496
 epoch: 26, train_loss: 0.8644, test_loss: 0.9908, test_f1: 0.5705
 epoch: 27, train_loss: 0.8375, test_loss: 1.0276, test_f1: 0.5580
 epoch: 28, train_loss: 0.8319, test_loss: 1.1278, test_f1: 0.5373
 epoch: 29, train_loss: 0.8294, test_loss: 1.0093, test_f1: 0.5459
 epoch: 30, train_loss: 0.8092, test_loss: 1.0334, test_f1: 0.5389
 epoch: 31, train_loss: 0.7964, test_loss: 1.0976, test_f1: 0.5095
 epoch: 32, train_loss: 0.8001, test_loss: 1.1161, test_f1: 0.5623
 epoch: 33, train_loss: 0.8200, test_loss: 1.0293, test_f1: 0.5582
 epoch: 34, train_loss: 0.7928, test_loss: 1.0894, test_f1: 0.5833
 epoch: 35, train_loss: 0.7988, test_loss: 1.0315, test_f1: 0.5465
 epoch: 36, train_loss: 0.7934, test_loss: 1.2002, test_f1: 0.4370
 epoch: 37, train_loss: 0.7853, test_loss: 1.0499, test_f1: 0.5063
 epoch: 38, train_loss: 0.7892, test_loss: 1.1179, test_f1: 0.5536
 epoch: 39, train_loss: 0.7935, test_loss: 1.0455, test_f1: 0.5650
 epoch: 40, train_loss: 0.7580, test_loss: 1.1274, test_f1: 0.5315
 epoch: 41, train_loss: 0.7648, test_loss: 0.9887, test_f1: 0.5734
 epoch: 42, train_loss: 0.7835, test_loss: 1.1208, test_f1: 0.5025
 epoch: 43, train_loss: 0.7632, test_loss: 1.0061, test_f1: 0.5984
 epoch: 44, train_loss: 0.7621, test_loss: 1.0581, test_f1: 0.5637
 epoch: 45, train_loss: 0.7349, test_loss: 1.2113, test_f1: 0.5336
 epoch: 46, train_loss: 0.7713, test_loss: 1.0989, test_f1: 0.5980
 epoch: 47, train_loss: 0.7407, test_loss: 1.0396, test_f1: 0.5973
 epoch: 48, train_loss: 0.7376, test_loss: 1.0812, test_f1: 0.6147
 epoch: 49, train_loss: 0.7554, test_loss: 1.1366, test_f1: 0.5723
 epoch: 50, train_loss: 0.7591, test_loss: 1.1328, test_f1: 0.6164
 epoch: 51, train_loss: 0.7158, test_loss: 1.1718, test_f1: 0.6073
 epoch: 52, train_loss: 0.6705, test_loss: 1.1424, test_f1: 0.6332
 epoch: 53, train_loss: 0.6845, test_loss: 1.1372, test_f1: 0.6115
 epoch: 54, train_loss: 0.6779, test_loss: 1.2199, test_f1: 0.6208
 epoch: 55, train_loss: 0.6885, test_loss: 1.1662, test_f1: 0.6402
 epoch: 56, train_loss: 0.6609, test_loss: 1.1833, test_f1: 0.6495
 epoch: 57, train_loss: 0.6418, test_loss: 1.2260, test_f1: 0.6105
 epoch: 58, train_loss: 0.6565, test_loss: 1.3255, test_f1: 0.5991
 epoch: 59, train_loss: 0.6608, test_loss: 1.3108, test_f1: 0.6215
 epoch: 60, train_loss: 0.6290, test_loss: 1.2674, test_f1: 0.6193
 epoch: 61, train_loss: 0.6301, test_loss: 1.1470, test_f1: 0.6496
 epoch: 62, train_loss: 0.6389, test_loss: 1.1981, test_f1: 0.6469
 epoch: 63, train_loss: 0.6364, test_loss: 1.2329, test_f1: 0.6099
 epoch: 64, train_loss: 0.6509, test_loss: 1.1761, test_f1: 0.6361
 epoch: 65, train_loss: 0.6286, test_loss: 1.1767, test_f1: 0.6392
 epoch: 66, train_loss: 0.6239, test_loss: 1.3031, test_f1: 0.5893
 epoch: 67, train_loss: 0.6041, test_loss: 1.3327, test_f1: 0.6428
 epoch: 68, train_loss: 0.6021, test_loss: 1.1536, test_f1: 0.6163
 epoch: 69, train_loss: 0.6268, test_loss: 1.3285, test_f1: 0.6052
 epoch: 70, train_loss: 0.6135, test_loss: 1.3696, test_f1: 0.6296
 epoch: 71, train_loss: 0.6024, test_loss: 1.1696, test_f1: 0.6572
 epoch: 72, train_loss: 0.6106, test_loss: 1.2389, test_f1: 0.6557
 epoch: 73, train_loss: 0.5892, test_loss: 1.3265, test_f1: 0.6495
 epoch: 74, train_loss: 0.5787, test_loss: 1.3223, test_f1: 0.6323
 epoch: 75, train_loss: 0.5846, test_loss: 1.1719, test_f1: 0.6873
 epoch: 76, train_loss: 0.6016, test_loss: 1.1651, test_f1: 0.6326
 epoch: 77, train_loss: 0.5669, test_loss: 1.3546, test_f1: 0.6462
 epoch: 78, train_loss: 0.5796, test_loss: 1.3212, test_f1: 0.6093
 epoch: 79, train_loss: 0.5850, test_loss: 1.2481, test_f1: 0.6513
 epoch: 80, train_loss: 0.6374, test_loss: 1.2162, test_f1: 0.6448
 epoch: 81, train_loss: 0.5824, test_loss: 1.1826, test_f1: 0.6614
 epoch: 82, train_loss: 0.5687, test_loss: 1.5211, test_f1: 0.6047
 epoch: 83, train_loss: 0.5754, test_loss: 1.1944, test_f1: 0.6569
 epoch: 84, train_loss: 0.5708, test_loss: 1.2434, test_f1: 0.6702
 epoch: 85, train_loss: 0.5684, test_loss: 1.3133, test_f1: 0.6365
 epoch: 86, train_loss: 0.5671, test_loss: 1.4494, test_f1: 0.6722
 epoch: 87, train_loss: 0.5766, test_loss: 1.2410, test_f1: 0.6451
 epoch: 88, train_loss: 0.5656, test_loss: 1.2921, test_f1: 0.6548
 epoch: 89, train_loss: 0.5597, test_loss: 1.4826, test_f1: 0.6536
 epoch: 90, train_loss: 0.5360, test_loss: 1.2788, test_f1: 0.6153
 epoch: 91, train_loss: 0.5628, test_loss: 1.4583, test_f1: 0.6569
 epoch: 92, train_loss: 0.5572, test_loss: 1.2003, test_f1: 0.6671
 epoch: 93, train_loss: 0.5723, test_loss: 1.3616, test_f1: 0.6712
 epoch: 94, train_loss: 0.5347, test_loss: 1.2725, test_f1: 0.6279
 epoch: 95, train_loss: 0.5386, test_loss: 1.3230, test_f1: 0.6731
 epoch: 96, train_loss: 0.5571, test_loss: 1.2668, test_f1: 0.6549
 epoch: 97, train_loss: 0.5569, test_loss: 1.3322, test_f1: 0.5961
 epoch: 98, train_loss: 0.5168, test_loss: 1.2364, test_f1: 0.6554
 epoch: 99, train_loss: 0.5173, test_loss: 1.4582, test_f1: 0.5713
##################ITERATION #6 ****************************************
 epoch: 0, train_loss: 1.2030, test_loss: 1.2267, test_f1: 0.3223
 epoch: 1, train_loss: 1.0616, test_loss: 1.0698, test_f1: 0.4097
 epoch: 2, train_loss: 1.0146, test_loss: 1.0509, test_f1: 0.4946
 epoch: 3, train_loss: 1.0102, test_loss: 1.0618, test_f1: 0.5075
 epoch: 4, train_loss: 0.9931, test_loss: 1.1040, test_f1: 0.5083
 epoch: 5, train_loss: 0.9808, test_loss: 1.0698, test_f1: 0.4935
 epoch: 6, train_loss: 0.9646, test_loss: 1.1049, test_f1: 0.4578
 epoch: 7, train_loss: 0.9562, test_loss: 1.0103, test_f1: 0.4443
 epoch: 8, train_loss: 0.9362, test_loss: 1.0861, test_f1: 0.5212
 epoch: 9, train_loss: 0.9357, test_loss: 1.2363, test_f1: 0.4634
 epoch: 10, train_loss: 0.9470, test_loss: 1.0073, test_f1: 0.5130
 epoch: 11, train_loss: 0.9186, test_loss: 1.0277, test_f1: 0.5169
 epoch: 12, train_loss: 0.9120, test_loss: 1.0264, test_f1: 0.5437
 epoch: 13, train_loss: 0.8943, test_loss: 1.0019, test_f1: 0.5689
 epoch: 14, train_loss: 0.8649, test_loss: 0.9960, test_f1: 0.5727
 epoch: 15, train_loss: 0.8617, test_loss: 1.0646, test_f1: 0.5342
 epoch: 16, train_loss: 0.9027, test_loss: 1.0174, test_f1: 0.4819
 epoch: 17, train_loss: 0.9184, test_loss: 1.0151, test_f1: 0.5255
 epoch: 18, train_loss: 0.8981, test_loss: 0.9759, test_f1: 0.5579
 epoch: 19, train_loss: 0.9052, test_loss: 1.0042, test_f1: 0.5492
 epoch: 20, train_loss: 0.8835, test_loss: 1.0282, test_f1: 0.5549
 epoch: 21, train_loss: 0.8607, test_loss: 1.0426, test_f1: 0.5585
 epoch: 22, train_loss: 0.8441, test_loss: 0.9923, test_f1: 0.5856
 epoch: 23, train_loss: 0.8344, test_loss: 1.0395, test_f1: 0.5665
 epoch: 24, train_loss: 0.8361, test_loss: 1.1369, test_f1: 0.5808
 epoch: 25, train_loss: 0.8168, test_loss: 1.0417, test_f1: 0.5725
 epoch: 26, train_loss: 0.8199, test_loss: 1.0383, test_f1: 0.5776
 epoch: 27, train_loss: 0.7849, test_loss: 1.0226, test_f1: 0.5499
 epoch: 28, train_loss: 0.8182, test_loss: 1.0924, test_f1: 0.5527
 epoch: 29, train_loss: 0.8362, test_loss: 1.1169, test_f1: 0.5403
 epoch: 30, train_loss: 0.7949, test_loss: 1.1720, test_f1: 0.5616
 epoch: 31, train_loss: 0.8117, test_loss: 1.0958, test_f1: 0.5699
 epoch: 32, train_loss: 0.7775, test_loss: 1.1758, test_f1: 0.5700
 epoch: 33, train_loss: 0.7908, test_loss: 1.0727, test_f1: 0.5885
 epoch: 34, train_loss: 0.8131, test_loss: 1.2915, test_f1: 0.4562
 epoch: 35, train_loss: 0.7762, test_loss: 0.9959, test_f1: 0.5698
 epoch: 36, train_loss: 0.7929, test_loss: 1.0601, test_f1: 0.5755
 epoch: 37, train_loss: 0.7794, test_loss: 1.0401, test_f1: 0.5939
 epoch: 38, train_loss: 0.7762, test_loss: 1.1032, test_f1: 0.5897
 epoch: 39, train_loss: 0.7753, test_loss: 1.3110, test_f1: 0.4912
 epoch: 40, train_loss: 0.7801, test_loss: 1.1383, test_f1: 0.5409
 epoch: 41, train_loss: 0.7708, test_loss: 1.4510, test_f1: 0.4941
 epoch: 42, train_loss: 0.7691, test_loss: 1.0665, test_f1: 0.5106
 epoch: 43, train_loss: 0.7696, test_loss: 1.0099, test_f1: 0.5627
 epoch: 44, train_loss: 0.7575, test_loss: 1.0985, test_f1: 0.5858
 epoch: 45, train_loss: 0.7324, test_loss: 1.1661, test_f1: 0.5413
 epoch: 46, train_loss: 0.7496, test_loss: 1.2389, test_f1: 0.5554
 epoch: 47, train_loss: 0.7578, test_loss: 1.0022, test_f1: 0.6123
 epoch: 48, train_loss: 0.7389, test_loss: 1.3465, test_f1: 0.5309
 epoch: 49, train_loss: 0.7361, test_loss: 1.3002, test_f1: 0.5772
 epoch: 50, train_loss: 0.7170, test_loss: 1.0365, test_f1: 0.5616
 epoch: 51, train_loss: 0.7060, test_loss: 1.2208, test_f1: 0.5912
 epoch: 52, train_loss: 0.6971, test_loss: 1.2919, test_f1: 0.5946
 epoch: 53, train_loss: 0.6730, test_loss: 1.1080, test_f1: 0.6256
 epoch: 54, train_loss: 0.6904, test_loss: 1.1613, test_f1: 0.5817
 epoch: 55, train_loss: 0.6831, test_loss: 1.3298, test_f1: 0.5827
 epoch: 56, train_loss: 0.6851, test_loss: 1.1932, test_f1: 0.6037
 epoch: 57, train_loss: 0.6871, test_loss: 1.0782, test_f1: 0.5924
 epoch: 58, train_loss: 0.6810, test_loss: 1.2676, test_f1: 0.5902
 epoch: 59, train_loss: 0.6564, test_loss: 1.5211, test_f1: 0.6291
 epoch: 60, train_loss: 0.6535, test_loss: 1.2499, test_f1: 0.6164
 epoch: 61, train_loss: 0.6592, test_loss: 1.2210, test_f1: 0.5937
 epoch: 62, train_loss: 0.6750, test_loss: 1.1537, test_f1: 0.6073
 epoch: 63, train_loss: 0.6778, test_loss: 1.1115, test_f1: 0.6311
 epoch: 64, train_loss: 0.6625, test_loss: 1.1117, test_f1: 0.6212
 epoch: 65, train_loss: 0.6328, test_loss: 1.3002, test_f1: 0.6064
 epoch: 66, train_loss: 0.6392, test_loss: 1.2745, test_f1: 0.6150
 epoch: 67, train_loss: 0.6505, test_loss: 1.1206, test_f1: 0.6312
 epoch: 68, train_loss: 0.6620, test_loss: 1.1912, test_f1: 0.6025
 epoch: 69, train_loss: 0.6298, test_loss: 1.1650, test_f1: 0.6058
 epoch: 70, train_loss: 0.6472, test_loss: 1.3437, test_f1: 0.5856
 epoch: 71, train_loss: 0.6421, test_loss: 1.2661, test_f1: 0.5877
 epoch: 72, train_loss: 0.6213, test_loss: 1.3187, test_f1: 0.6015
 epoch: 73, train_loss: 0.6360, test_loss: 1.4576, test_f1: 0.6004
 epoch: 74, train_loss: 0.6144, test_loss: 1.3488, test_f1: 0.6327
 epoch: 75, train_loss: 0.6171, test_loss: 1.2546, test_f1: 0.5962
 epoch: 76, train_loss: 0.6095, test_loss: 1.2912, test_f1: 0.6123
 epoch: 77, train_loss: 0.6228, test_loss: 1.3776, test_f1: 0.6158
 epoch: 78, train_loss: 0.6272, test_loss: 1.3304, test_f1: 0.5828
 epoch: 79, train_loss: 0.6071, test_loss: 1.3043, test_f1: 0.6034
 epoch: 80, train_loss: 0.5903, test_loss: 1.3881, test_f1: 0.6225
 epoch: 81, train_loss: 0.6152, test_loss: 1.4428, test_f1: 0.6174
 epoch: 82, train_loss: 0.6264, test_loss: 1.2819, test_f1: 0.6105
 epoch: 83, train_loss: 0.5917, test_loss: 1.2825, test_f1: 0.5882
 epoch: 84, train_loss: 0.6109, test_loss: 1.2538, test_f1: 0.6140
 epoch: 85, train_loss: 0.5938, test_loss: 1.4124, test_f1: 0.6358
 epoch: 86, train_loss: 0.5849, test_loss: 1.3335, test_f1: 0.5771
 epoch: 87, train_loss: 0.6033, test_loss: 1.2458, test_f1: 0.6394
 epoch: 88, train_loss: 0.5812, test_loss: 1.4387, test_f1: 0.6199
 epoch: 89, train_loss: 0.6035, test_loss: 1.2317, test_f1: 0.6317
 epoch: 90, train_loss: 0.5958, test_loss: 1.1988, test_f1: 0.6253
 epoch: 91, train_loss: 0.5877, test_loss: 1.2005, test_f1: 0.6209
 epoch: 92, train_loss: 0.5784, test_loss: 1.1780, test_f1: 0.6404
 epoch: 93, train_loss: 0.5912, test_loss: 1.2504, test_f1: 0.6326
 epoch: 94, train_loss: 0.5904, test_loss: 1.2193, test_f1: 0.6545
 epoch: 95, train_loss: 0.5783, test_loss: 1.3631, test_f1: 0.6273
 epoch: 96, train_loss: 0.5619, test_loss: 1.3644, test_f1: 0.6341
 epoch: 97, train_loss: 0.5661, test_loss: 1.2534, test_f1: 0.5975
 epoch: 98, train_loss: 0.5616, test_loss: 1.1493, test_f1: 0.6437
 epoch: 99, train_loss: 0.6036, test_loss: 1.4069, test_f1: 0.5885
##################ITERATION #7 ****************************************
 epoch: 0, train_loss: 1.2008, test_loss: 1.1410, test_f1: 0.4509
 epoch: 1, train_loss: 1.0836, test_loss: 1.0906, test_f1: 0.4889
 epoch: 2, train_loss: 1.0303, test_loss: 1.2390, test_f1: 0.3466
 epoch: 3, train_loss: 1.0147, test_loss: 1.0774, test_f1: 0.4329
 epoch: 4, train_loss: 0.9762, test_loss: 1.0389, test_f1: 0.4979
 epoch: 5, train_loss: 0.9582, test_loss: 1.0535, test_f1: 0.5160
 epoch: 6, train_loss: 0.9780, test_loss: 1.0574, test_f1: 0.5334
 epoch: 7, train_loss: 0.9576, test_loss: 1.0873, test_f1: 0.4986
 epoch: 8, train_loss: 0.9279, test_loss: 0.9968, test_f1: 0.5435
 epoch: 9, train_loss: 0.9498, test_loss: 1.0444, test_f1: 0.5112
 epoch: 10, train_loss: 0.9519, test_loss: 1.0785, test_f1: 0.4947
 epoch: 11, train_loss: 0.9396, test_loss: 1.0056, test_f1: 0.5222
 epoch: 12, train_loss: 0.9345, test_loss: 0.9889, test_f1: 0.5109
 epoch: 13, train_loss: 0.9425, test_loss: 1.0216, test_f1: 0.5133
 epoch: 14, train_loss: 0.9000, test_loss: 0.9718, test_f1: 0.5293
 epoch: 15, train_loss: 0.9283, test_loss: 1.0379, test_f1: 0.5675
 epoch: 16, train_loss: 0.9185, test_loss: 0.9520, test_f1: 0.5580
 epoch: 17, train_loss: 0.8620, test_loss: 0.9978, test_f1: 0.5430
 epoch: 18, train_loss: 0.8460, test_loss: 1.1276, test_f1: 0.5083
 epoch: 19, train_loss: 0.8387, test_loss: 0.9998, test_f1: 0.5307
 epoch: 20, train_loss: 0.8332, test_loss: 0.9714, test_f1: 0.5542
 epoch: 21, train_loss: 0.8227, test_loss: 1.0199, test_f1: 0.5794
 epoch: 22, train_loss: 0.7915, test_loss: 1.0082, test_f1: 0.5759
 epoch: 23, train_loss: 0.8014, test_loss: 0.9554, test_f1: 0.5997
 epoch: 24, train_loss: 0.8055, test_loss: 1.0968, test_f1: 0.4633
 epoch: 25, train_loss: 0.7954, test_loss: 1.0077, test_f1: 0.5674
 epoch: 26, train_loss: 0.7731, test_loss: 1.1304, test_f1: 0.4886
 epoch: 27, train_loss: 0.7761, test_loss: 1.1438, test_f1: 0.5598
 epoch: 28, train_loss: 0.7712, test_loss: 1.0468, test_f1: 0.5894
 epoch: 29, train_loss: 0.7698, test_loss: 1.2841, test_f1: 0.5281
 epoch: 30, train_loss: 0.8160, test_loss: 0.9755, test_f1: 0.6222
 epoch: 31, train_loss: 0.7701, test_loss: 0.9914, test_f1: 0.5781
 epoch: 32, train_loss: 0.7414, test_loss: 1.0401, test_f1: 0.5962
 epoch: 33, train_loss: 0.7385, test_loss: 1.0812, test_f1: 0.5678
 epoch: 34, train_loss: 0.7543, test_loss: 1.0716, test_f1: 0.5329
 epoch: 35, train_loss: 0.7380, test_loss: 1.1792, test_f1: 0.5299
 epoch: 36, train_loss: 0.7352, test_loss: 1.0671, test_f1: 0.5713
 epoch: 37, train_loss: 0.7271, test_loss: 1.1134, test_f1: 0.6108
 epoch: 38, train_loss: 0.7102, test_loss: 1.1381, test_f1: 0.5806
 epoch: 39, train_loss: 0.7279, test_loss: 1.2349, test_f1: 0.5653
 epoch: 40, train_loss: 0.7612, test_loss: 1.1629, test_f1: 0.5634
 epoch: 41, train_loss: 0.7209, test_loss: 1.1051, test_f1: 0.5715
 epoch: 42, train_loss: 0.7232, test_loss: 1.0249, test_f1: 0.5811
 epoch: 43, train_loss: 0.7261, test_loss: 1.0567, test_f1: 0.6034
 epoch: 44, train_loss: 0.7035, test_loss: 1.1417, test_f1: 0.5757
 epoch: 45, train_loss: 0.6958, test_loss: 1.2799, test_f1: 0.5184
 epoch: 46, train_loss: 0.7378, test_loss: 1.1906, test_f1: 0.5436
 epoch: 47, train_loss: 0.7135, test_loss: 1.1978, test_f1: 0.5135
 epoch: 48, train_loss: 0.7429, test_loss: 1.1808, test_f1: 0.5333
 epoch: 49, train_loss: 0.7008, test_loss: 1.1815, test_f1: 0.5787
 epoch: 50, train_loss: 0.7017, test_loss: 1.0510, test_f1: 0.6283
 epoch: 51, train_loss: 0.6941, test_loss: 1.0468, test_f1: 0.5905
 epoch: 52, train_loss: 0.6397, test_loss: 1.1406, test_f1: 0.5448
 epoch: 53, train_loss: 0.6715, test_loss: 1.1478, test_f1: 0.5869
 epoch: 54, train_loss: 0.6257, test_loss: 1.2542, test_f1: 0.5238
 epoch: 55, train_loss: 0.6386, test_loss: 1.1267, test_f1: 0.5853
 epoch: 56, train_loss: 0.6444, test_loss: 1.1393, test_f1: 0.6150
 epoch: 57, train_loss: 0.6400, test_loss: 1.1863, test_f1: 0.5559
 epoch: 58, train_loss: 0.6269, test_loss: 1.1840, test_f1: 0.5927
 epoch: 59, train_loss: 0.5956, test_loss: 1.1733, test_f1: 0.6080
 epoch: 60, train_loss: 0.6086, test_loss: 1.3480, test_f1: 0.5667
 epoch: 61, train_loss: 0.5995, test_loss: 1.2531, test_f1: 0.5768
 epoch: 62, train_loss: 0.6156, test_loss: 1.1537, test_f1: 0.6297
 epoch: 63, train_loss: 0.6224, test_loss: 1.1202, test_f1: 0.5918
 epoch: 64, train_loss: 0.6305, test_loss: 1.1654, test_f1: 0.5782
 epoch: 65, train_loss: 0.6084, test_loss: 1.1494, test_f1: 0.5936
 epoch: 66, train_loss: 0.5946, test_loss: 1.1831, test_f1: 0.6225
 epoch: 67, train_loss: 0.6006, test_loss: 1.3215, test_f1: 0.5655
 epoch: 68, train_loss: 0.5815, test_loss: 1.2247, test_f1: 0.5799
 epoch: 69, train_loss: 0.6058, test_loss: 1.1580, test_f1: 0.6014
 epoch: 70, train_loss: 0.5834, test_loss: 1.2677, test_f1: 0.5632
 epoch: 71, train_loss: 0.5758, test_loss: 1.2290, test_f1: 0.5925
 epoch: 72, train_loss: 0.5872, test_loss: 1.3449, test_f1: 0.5627
 epoch: 73, train_loss: 0.5750, test_loss: 1.3220, test_f1: 0.5700
 epoch: 74, train_loss: 0.5847, test_loss: 1.2965, test_f1: 0.5697
 epoch: 75, train_loss: 0.5775, test_loss: 1.2896, test_f1: 0.5693
 epoch: 76, train_loss: 0.5757, test_loss: 1.2673, test_f1: 0.5871
 epoch: 77, train_loss: 0.5540, test_loss: 1.3393, test_f1: 0.5606
 epoch: 78, train_loss: 0.5446, test_loss: 1.3581, test_f1: 0.5502
 epoch: 79, train_loss: 0.5607, test_loss: 1.3874, test_f1: 0.5276
 epoch: 80, train_loss: 0.5471, test_loss: 1.4000, test_f1: 0.6085
 epoch: 81, train_loss: 0.5995, test_loss: 1.3141, test_f1: 0.5756
 epoch: 82, train_loss: 0.5551, test_loss: 1.3903, test_f1: 0.6031
 epoch: 83, train_loss: 0.5322, test_loss: 1.4382, test_f1: 0.5718
 epoch: 84, train_loss: 0.5545, test_loss: 1.3687, test_f1: 0.5939
 epoch: 85, train_loss: 0.5618, test_loss: 1.2769, test_f1: 0.5900
 epoch: 86, train_loss: 0.5778, test_loss: 1.3313, test_f1: 0.5854
 epoch: 87, train_loss: 0.5477, test_loss: 1.2597, test_f1: 0.5649
 epoch: 88, train_loss: 0.5680, test_loss: 1.2493, test_f1: 0.5849
 epoch: 89, train_loss: 0.5642, test_loss: 1.4019, test_f1: 0.5518
 epoch: 90, train_loss: 0.5400, test_loss: 1.2231, test_f1: 0.6086
 epoch: 91, train_loss: 0.5717, test_loss: 1.2830, test_f1: 0.5900
 epoch: 92, train_loss: 0.5556, test_loss: 1.2766, test_f1: 0.5735
 epoch: 93, train_loss: 0.5471, test_loss: 1.3558, test_f1: 0.5980
 epoch: 94, train_loss: 0.5623, test_loss: 1.2329, test_f1: 0.6196
 epoch: 95, train_loss: 0.5387, test_loss: 1.2033, test_f1: 0.6428
 epoch: 96, train_loss: 0.5425, test_loss: 1.2535, test_f1: 0.6266
 epoch: 97, train_loss: 0.5397, test_loss: 1.3648, test_f1: 0.5872
 epoch: 98, train_loss: 0.5039, test_loss: 1.2589, test_f1: 0.5789
 epoch: 99, train_loss: 0.5252, test_loss: 1.4935, test_f1: 0.5851
##################ITERATION #8 ****************************************
 epoch: 0, train_loss: 1.1909, test_loss: 1.1200, test_f1: 0.4470
 epoch: 1, train_loss: 1.0337, test_loss: 1.0818, test_f1: 0.4675
 epoch: 2, train_loss: 1.0042, test_loss: 1.0897, test_f1: 0.5151
 epoch: 3, train_loss: 0.9768, test_loss: 1.0812, test_f1: 0.5318
 epoch: 4, train_loss: 0.9760, test_loss: 1.0743, test_f1: 0.5055
 epoch: 5, train_loss: 0.9537, test_loss: 1.0475, test_f1: 0.5192
 epoch: 6, train_loss: 0.9231, test_loss: 1.0929, test_f1: 0.5258
 epoch: 7, train_loss: 0.8905, test_loss: 1.0997, test_f1: 0.5270
 epoch: 8, train_loss: 0.9087, test_loss: 1.0113, test_f1: 0.5932
 epoch: 9, train_loss: 0.8691, test_loss: 1.0170, test_f1: 0.5862
 epoch: 10, train_loss: 0.9014, test_loss: 1.1225, test_f1: 0.5133
 epoch: 11, train_loss: 0.8930, test_loss: 1.0471, test_f1: 0.5551
 epoch: 12, train_loss: 0.8650, test_loss: 0.9884, test_f1: 0.5779
 epoch: 13, train_loss: 0.8427, test_loss: 1.0781, test_f1: 0.5185
 epoch: 14, train_loss: 0.8410, test_loss: 1.0105, test_f1: 0.5882
 epoch: 15, train_loss: 0.8171, test_loss: 0.9765, test_f1: 0.5919
 epoch: 16, train_loss: 0.8173, test_loss: 1.0217, test_f1: 0.5391
 epoch: 17, train_loss: 0.8245, test_loss: 1.0575, test_f1: 0.5872
 epoch: 18, train_loss: 0.8227, test_loss: 1.0724, test_f1: 0.5849
 epoch: 19, train_loss: 0.8123, test_loss: 1.0090, test_f1: 0.5401
 epoch: 20, train_loss: 0.8262, test_loss: 0.9977, test_f1: 0.5810
 epoch: 21, train_loss: 0.7912, test_loss: 1.0420, test_f1: 0.5573
 epoch: 22, train_loss: 0.7820, test_loss: 1.1205, test_f1: 0.5598
 epoch: 23, train_loss: 0.7817, test_loss: 0.9743, test_f1: 0.6205
 epoch: 24, train_loss: 0.7543, test_loss: 1.0813, test_f1: 0.4852
 epoch: 25, train_loss: 0.7872, test_loss: 1.0893, test_f1: 0.4962
 epoch: 26, train_loss: 0.7611, test_loss: 1.1713, test_f1: 0.5878
 epoch: 27, train_loss: 0.7465, test_loss: 1.2522, test_f1: 0.5806
 epoch: 28, train_loss: 0.7523, test_loss: 1.1029, test_f1: 0.5648
 epoch: 29, train_loss: 0.7562, test_loss: 1.1358, test_f1: 0.6173
 epoch: 30, train_loss: 0.7152, test_loss: 1.2174, test_f1: 0.5655
 epoch: 31, train_loss: 0.7498, test_loss: 0.9989, test_f1: 0.6411
 epoch: 32, train_loss: 0.7324, test_loss: 1.1235, test_f1: 0.5438
 epoch: 33, train_loss: 0.7054, test_loss: 1.0691, test_f1: 0.5313
 epoch: 34, train_loss: 0.7228, test_loss: 1.0635, test_f1: 0.6099
 epoch: 35, train_loss: 0.7192, test_loss: 1.3438, test_f1: 0.5158
 epoch: 36, train_loss: 0.7205, test_loss: 1.0519, test_f1: 0.5840
 epoch: 37, train_loss: 0.7249, test_loss: 1.0514, test_f1: 0.5036
 epoch: 38, train_loss: 0.7074, test_loss: 1.0846, test_f1: 0.6057
 epoch: 39, train_loss: 0.7127, test_loss: 1.0080, test_f1: 0.6252
 epoch: 40, train_loss: 0.7029, test_loss: 1.0351, test_f1: 0.6058
 epoch: 41, train_loss: 0.6914, test_loss: 1.1103, test_f1: 0.5979
 epoch: 42, train_loss: 0.6838, test_loss: 1.1521, test_f1: 0.5647
 epoch: 43, train_loss: 0.6946, test_loss: 1.1085, test_f1: 0.6220
 epoch: 44, train_loss: 0.7449, test_loss: 1.0365, test_f1: 0.5730
 epoch: 45, train_loss: 0.7064, test_loss: 1.0624, test_f1: 0.5810
 epoch: 46, train_loss: 0.6591, test_loss: 1.0133, test_f1: 0.6422
 epoch: 47, train_loss: 0.6659, test_loss: 1.1074, test_f1: 0.6178
 epoch: 48, train_loss: 0.6781, test_loss: 1.1653, test_f1: 0.5927
 epoch: 49, train_loss: 0.6772, test_loss: 1.1336, test_f1: 0.5803
 epoch: 50, train_loss: 0.6596, test_loss: 1.0267, test_f1: 0.6226
 epoch: 51, train_loss: 0.6526, test_loss: 1.0838, test_f1: 0.5690
 epoch: 52, train_loss: 0.5968, test_loss: 1.1322, test_f1: 0.6008
 epoch: 53, train_loss: 0.5852, test_loss: 1.1122, test_f1: 0.6465
 epoch: 54, train_loss: 0.5940, test_loss: 1.1862, test_f1: 0.6184
 epoch: 55, train_loss: 0.5756, test_loss: 1.2197, test_f1: 0.6237
 epoch: 56, train_loss: 0.6333, test_loss: 1.1598, test_f1: 0.6216
 epoch: 57, train_loss: 0.5877, test_loss: 1.1893, test_f1: 0.5999
 epoch: 58, train_loss: 0.5866, test_loss: 1.1871, test_f1: 0.6087
 epoch: 59, train_loss: 0.5813, test_loss: 1.2000, test_f1: 0.5863
 epoch: 60, train_loss: 0.5601, test_loss: 1.2321, test_f1: 0.5841
 epoch: 61, train_loss: 0.5838, test_loss: 1.2074, test_f1: 0.6205
 epoch: 62, train_loss: 0.5760, test_loss: 1.1650, test_f1: 0.6274
 epoch: 63, train_loss: 0.5821, test_loss: 1.1712, test_f1: 0.6267
 epoch: 64, train_loss: 0.5918, test_loss: 1.2465, test_f1: 0.5768
 epoch: 65, train_loss: 0.5649, test_loss: 1.1806, test_f1: 0.6382
 epoch: 66, train_loss: 0.5763, test_loss: 1.2627, test_f1: 0.5875
 epoch: 67, train_loss: 0.5896, test_loss: 1.1649, test_f1: 0.6278
 epoch: 68, train_loss: 0.5743, test_loss: 1.1977, test_f1: 0.6366
 epoch: 69, train_loss: 0.5618, test_loss: 1.1574, test_f1: 0.6446
 epoch: 70, train_loss: 0.5481, test_loss: 1.2871, test_f1: 0.6024
 epoch: 71, train_loss: 0.5691, test_loss: 1.1559, test_f1: 0.6040
 epoch: 72, train_loss: 0.5924, test_loss: 1.2300, test_f1: 0.6200
 epoch: 73, train_loss: 0.5300, test_loss: 1.2387, test_f1: 0.6366
 epoch: 74, train_loss: 0.5456, test_loss: 1.1456, test_f1: 0.6526
 epoch: 75, train_loss: 0.5518, test_loss: 1.2067, test_f1: 0.6393
 epoch: 76, train_loss: 0.5376, test_loss: 1.1611, test_f1: 0.6411
 epoch: 77, train_loss: 0.5430, test_loss: 1.2112, test_f1: 0.6212
 epoch: 78, train_loss: 0.5131, test_loss: 1.2498, test_f1: 0.6312
 epoch: 79, train_loss: 0.5477, test_loss: 1.3060, test_f1: 0.6143
 epoch: 80, train_loss: 0.5554, test_loss: 1.1853, test_f1: 0.5952
 epoch: 81, train_loss: 0.5197, test_loss: 1.3319, test_f1: 0.6247
 epoch: 82, train_loss: 0.5523, test_loss: 1.2333, test_f1: 0.6259
 epoch: 83, train_loss: 0.5404, test_loss: 1.1940, test_f1: 0.6487
 epoch: 84, train_loss: 0.5303, test_loss: 1.2520, test_f1: 0.6224
 epoch: 85, train_loss: 0.5495, test_loss: 1.2955, test_f1: 0.5860
 epoch: 86, train_loss: 0.5270, test_loss: 1.1952, test_f1: 0.6355
 epoch: 87, train_loss: 0.5114, test_loss: 1.2851, test_f1: 0.6541
 epoch: 88, train_loss: 0.5309, test_loss: 1.2981, test_f1: 0.6258
 epoch: 89, train_loss: 0.5131, test_loss: 1.2988, test_f1: 0.6357
 epoch: 90, train_loss: 0.5472, test_loss: 1.2680, test_f1: 0.6369
 epoch: 91, train_loss: 0.4991, test_loss: 1.3529, test_f1: 0.6388
 epoch: 92, train_loss: 0.5122, test_loss: 1.2987, test_f1: 0.6014
 epoch: 93, train_loss: 0.5330, test_loss: 1.2190, test_f1: 0.6412
 epoch: 94, train_loss: 0.5247, test_loss: 1.3032, test_f1: 0.6466
 epoch: 95, train_loss: 0.4858, test_loss: 1.3735, test_f1: 0.6177
 epoch: 96, train_loss: 0.5281, test_loss: 1.3514, test_f1: 0.6371
 epoch: 97, train_loss: 0.5062, test_loss: 1.4367, test_f1: 0.6013
 epoch: 98, train_loss: 0.5011, test_loss: 1.3673, test_f1: 0.6164
 epoch: 99, train_loss: 0.5136, test_loss: 1.2036, test_f1: 0.6508
##################ITERATION #9 ****************************************
 epoch: 0, train_loss: 1.2290, test_loss: 1.2985, test_f1: 0.2977
 epoch: 1, train_loss: 1.0962, test_loss: 1.1220, test_f1: 0.4365
 epoch: 2, train_loss: 1.0308, test_loss: 1.1089, test_f1: 0.4582
 epoch: 3, train_loss: 1.0007, test_loss: 1.0698, test_f1: 0.5203
 epoch: 4, train_loss: 1.0023, test_loss: 1.0548, test_f1: 0.4591
 epoch: 5, train_loss: 1.0014, test_loss: 1.0702, test_f1: 0.4330
 epoch: 6, train_loss: 0.9757, test_loss: 1.0497, test_f1: 0.4747
 epoch: 7, train_loss: 0.9644, test_loss: 0.9983, test_f1: 0.5215
 epoch: 8, train_loss: 0.9543, test_loss: 1.0204, test_f1: 0.5011
 epoch: 9, train_loss: 0.9438, test_loss: 1.0342, test_f1: 0.4940
 epoch: 10, train_loss: 0.9461, test_loss: 1.0107, test_f1: 0.5185
 epoch: 11, train_loss: 0.9310, test_loss: 1.0753, test_f1: 0.4903
 epoch: 12, train_loss: 0.9709, test_loss: 1.0776, test_f1: 0.4714
 epoch: 13, train_loss: 0.9529, test_loss: 1.1067, test_f1: 0.5197
 epoch: 14, train_loss: 0.9432, test_loss: 1.0839, test_f1: 0.5343
 epoch: 15, train_loss: 0.9368, test_loss: 1.0414, test_f1: 0.5112
 epoch: 16, train_loss: 0.9141, test_loss: 1.0756, test_f1: 0.4332
 epoch: 17, train_loss: 0.9115, test_loss: 1.4850, test_f1: 0.4344
 epoch: 18, train_loss: 0.9222, test_loss: 1.0441, test_f1: 0.5385
 epoch: 19, train_loss: 0.8762, test_loss: 1.0404, test_f1: 0.5310
 epoch: 20, train_loss: 0.9012, test_loss: 0.9830, test_f1: 0.5100
 epoch: 21, train_loss: 0.8666, test_loss: 1.0033, test_f1: 0.5421
 epoch: 22, train_loss: 0.8929, test_loss: 0.9658, test_f1: 0.5368
 epoch: 23, train_loss: 0.8843, test_loss: 1.0013, test_f1: 0.5692
 epoch: 24, train_loss: 0.8631, test_loss: 1.0584, test_f1: 0.5681
 epoch: 25, train_loss: 0.8541, test_loss: 0.9875, test_f1: 0.5407
 epoch: 26, train_loss: 0.8563, test_loss: 1.0030, test_f1: 0.5423
 epoch: 27, train_loss: 0.8313, test_loss: 0.9817, test_f1: 0.5505
 epoch: 28, train_loss: 0.8089, test_loss: 1.0190, test_f1: 0.5792
 epoch: 29, train_loss: 0.8074, test_loss: 1.0375, test_f1: 0.5293
 epoch: 30, train_loss: 0.8177, test_loss: 1.0190, test_f1: 0.5913
 epoch: 31, train_loss: 0.8264, test_loss: 1.0384, test_f1: 0.5778
 epoch: 32, train_loss: 0.8025, test_loss: 1.0420, test_f1: 0.5668
 epoch: 33, train_loss: 0.8062, test_loss: 1.0641, test_f1: 0.5516
 epoch: 34, train_loss: 0.7675, test_loss: 1.0866, test_f1: 0.5500
 epoch: 35, train_loss: 0.7809, test_loss: 1.0634, test_f1: 0.5280
 epoch: 36, train_loss: 0.7754, test_loss: 1.0593, test_f1: 0.5210
 epoch: 37, train_loss: 0.7715, test_loss: 1.0574, test_f1: 0.5869
 epoch: 38, train_loss: 0.7659, test_loss: 1.0090, test_f1: 0.5869
 epoch: 39, train_loss: 0.7565, test_loss: 1.0838, test_f1: 0.5247
 epoch: 40, train_loss: 0.7337, test_loss: 1.1348, test_f1: 0.5505
 epoch: 41, train_loss: 0.7370, test_loss: 1.0903, test_f1: 0.5423
 epoch: 42, train_loss: 0.7339, test_loss: 1.0850, test_f1: 0.5858
 epoch: 43, train_loss: 0.7278, test_loss: 1.0340, test_f1: 0.5699
 epoch: 44, train_loss: 0.7716, test_loss: 1.0824, test_f1: 0.6024
 epoch: 45, train_loss: 0.7461, test_loss: 0.9977, test_f1: 0.5750
 epoch: 46, train_loss: 0.7600, test_loss: 0.9951, test_f1: 0.6219
 epoch: 47, train_loss: 0.7229, test_loss: 1.1078, test_f1: 0.5641
 epoch: 48, train_loss: 0.7152, test_loss: 1.0332, test_f1: 0.5876
 epoch: 49, train_loss: 0.7246, test_loss: 1.2140, test_f1: 0.5336
 epoch: 50, train_loss: 0.7199, test_loss: 1.1619, test_f1: 0.5889
 epoch: 51, train_loss: 0.6850, test_loss: 1.1100, test_f1: 0.5691
 epoch: 52, train_loss: 0.6709, test_loss: 1.1814, test_f1: 0.5615
 epoch: 53, train_loss: 0.6688, test_loss: 1.1077, test_f1: 0.6095
 epoch: 54, train_loss: 0.6590, test_loss: 1.1558, test_f1: 0.6054
 epoch: 55, train_loss: 0.6660, test_loss: 1.1457, test_f1: 0.6057
 epoch: 56, train_loss: 0.6412, test_loss: 1.1522, test_f1: 0.6128
 epoch: 57, train_loss: 0.6380, test_loss: 1.1624, test_f1: 0.5679
 epoch: 58, train_loss: 0.6457, test_loss: 1.2094, test_f1: 0.5550
 epoch: 59, train_loss: 0.6365, test_loss: 1.1883, test_f1: 0.5963
 epoch: 60, train_loss: 0.6408, test_loss: 1.1285, test_f1: 0.6020
 epoch: 61, train_loss: 0.6111, test_loss: 1.1718, test_f1: 0.6118
 epoch: 62, train_loss: 0.6459, test_loss: 1.1248, test_f1: 0.6006
 epoch: 63, train_loss: 0.6329, test_loss: 1.2121, test_f1: 0.6167
 epoch: 64, train_loss: 0.6143, test_loss: 1.1286, test_f1: 0.6283
 epoch: 65, train_loss: 0.6200, test_loss: 1.2032, test_f1: 0.5977
 epoch: 66, train_loss: 0.6072, test_loss: 1.1329, test_f1: 0.6100
 epoch: 67, train_loss: 0.6197, test_loss: 1.1743, test_f1: 0.6207
 epoch: 68, train_loss: 0.6263, test_loss: 1.1631, test_f1: 0.6313
 epoch: 69, train_loss: 0.6040, test_loss: 1.1338, test_f1: 0.6254
 epoch: 70, train_loss: 0.5913, test_loss: 1.2325, test_f1: 0.6336
 epoch: 71, train_loss: 0.5954, test_loss: 1.2100, test_f1: 0.6378
 epoch: 72, train_loss: 0.5665, test_loss: 1.2131, test_f1: 0.6036
 epoch: 73, train_loss: 0.6072, test_loss: 1.1394, test_f1: 0.6250
 epoch: 74, train_loss: 0.5974, test_loss: 1.1674, test_f1: 0.6359
 epoch: 75, train_loss: 0.5934, test_loss: 1.2258, test_f1: 0.6022
 epoch: 76, train_loss: 0.5904, test_loss: 1.2666, test_f1: 0.5985
 epoch: 77, train_loss: 0.5903, test_loss: 1.1826, test_f1: 0.6114
 epoch: 78, train_loss: 0.6054, test_loss: 1.2510, test_f1: 0.6171
 epoch: 79, train_loss: 0.6031, test_loss: 1.1833, test_f1: 0.6343
 epoch: 80, train_loss: 0.5821, test_loss: 1.2609, test_f1: 0.6143
 epoch: 81, train_loss: 0.5981, test_loss: 1.4336, test_f1: 0.5829
 epoch: 82, train_loss: 0.5960, test_loss: 1.2175, test_f1: 0.5890
 epoch: 83, train_loss: 0.5758, test_loss: 1.2497, test_f1: 0.5990
 epoch: 84, train_loss: 0.5790, test_loss: 1.1879, test_f1: 0.6107
 epoch: 85, train_loss: 0.5715, test_loss: 1.2371, test_f1: 0.6229
 epoch: 86, train_loss: 0.5993, test_loss: 1.3311, test_f1: 0.5927
 epoch: 87, train_loss: 0.5711, test_loss: 1.1865, test_f1: 0.6277
 epoch: 88, train_loss: 0.5686, test_loss: 1.2952, test_f1: 0.6249
 epoch: 89, train_loss: 0.5608, test_loss: 1.2422, test_f1: 0.6038
 epoch: 90, train_loss: 0.5635, test_loss: 1.4167, test_f1: 0.5783
 epoch: 91, train_loss: 0.5760, test_loss: 1.2175, test_f1: 0.6454
 epoch: 92, train_loss: 0.5549, test_loss: 1.3044, test_f1: 0.6022
 epoch: 93, train_loss: 0.5784, test_loss: 1.2447, test_f1: 0.6444
 epoch: 94, train_loss: 0.5486, test_loss: 1.4733, test_f1: 0.5855
 epoch: 95, train_loss: 0.5767, test_loss: 1.2634, test_f1: 0.6128
 epoch: 96, train_loss: 0.5461, test_loss: 1.2723, test_f1: 0.6221
 epoch: 97, train_loss: 0.5612, test_loss: 1.2350, test_f1: 0.6438
 epoch: 98, train_loss: 0.5410, test_loss: 1.4807, test_f1: 0.6211
 epoch: 99, train_loss: 0.5328, test_loss: 1.3242, test_f1: 0.6287

Training completed in 885.25 seconds
Best F1: 0.6873 at epoch 75
Mean F1 across iterations: 0.6568  0.0137
========================FINAL RESULTS================================
FEGIN weighted F1: 0.6873  0.0137
python main.py --data ltspice_demos --representation component_net --model FEGIN --layers 4 --hiddens 32 --batch_size 32 --lr 0.01 --emb_size 128 --epochs 100 --save_appendix component_net_L4_H32_BS32_LR0.01_E128 --no_val
-----



STDERR:
  File "main.py", line 370, in <module>
    main()
  File "main.py", line 254, in main
    dataset = dataset_class(
  File "/home/philip/projects/ltspice_examples_code_repo/Circuit-Completion-Using-GNNs/component_classification_with_link_prediction_head/evaluation/FEGIN/kernel/circuit_datasets.py", line 15, in __init__
    self.data, self.slices = torch.load(self.processed_paths[0])
  File "/home/philip/.local/lib/python3.8/site-packages/torch/serialization.py", line 1040, in load
    warnings.warn(
  File "/usr/lib/python3.8/warnings.py", line 109, in _showwarnmsg
    sw(msg.message, msg.category, msg.filename, msg.lineno,
  File "main.py", line 47, in warn_with_traceback
    traceback.print_stack(file=log)
/home/philip/projects/ltspice_examples_code_repo/Circuit-Completion-Using-GNNs/component_classification_with_link_prediction_head/evaluation/FEGIN/kernel/circuit_datasets.py:15: FutureWarning: You are using `torch.load` with `weights_only=False` (the current default value), which uses the default pickle module implicitly. It is possible to construct malicious pickle data which will execute arbitrary code during unpickling (See https://github.com/pytorch/pytorch/blob/main/SECURITY.md#untrusted-models for more details). In a future release, the default value for `weights_only` will be flipped to `True`. This limits the functions that could be executed during unpickling. Arbitrary objects will no longer be allowed to be loaded via this mode unless they are explicitly allowlisted by the user via `torch.serialization.add_safe_globals`. We recommend you start setting `weights_only=True` for any use case where you don't have full control of the loaded file. Please open an issue on GitHub for any issues related to this experimental feature.
  self.data, self.slices = torch.load(self.processed_paths[0])
