STDOUT:
Results will be saved in /home/philip/projects/ltspice_examples_code_repo/Circuit-Completion-Using-GNNs/component_classification_with_link_prediction_head/evaluation/FEGIN/results/model_FEGIN_dataset_ltspice_demos
Command line input: python main.py --data ltspice_demos --representation component_pin --model FEGIN --layers 3 --hiddens 16 --batch_size 64 --lr 0.001 --emb_size 250 --epochs 100 --save_appendix component_pin_L3_H16_BS64_LR0.001_E250 --no_val
 is saved.
-----
ltspice_demos - FEGIN
Using 3 layers, 16 hidden units, h = 2
Loading component_pin representation dataset
ENTERED
Training FEGIN on component_pin representation
Train: 1565, Test: 383
##################ITERATION #0 ****************************************
 epoch: 0, train_loss: 1.3598, test_loss: 1.3479, test_f1: 0.2281
 epoch: 1, train_loss: 1.3307, test_loss: 1.3295, test_f1: 0.2281
 epoch: 2, train_loss: 1.3020, test_loss: 1.3014, test_f1: 0.2285
 epoch: 3, train_loss: 1.2623, test_loss: 1.2686, test_f1: 0.2252
 epoch: 4, train_loss: 1.2164, test_loss: 1.2438, test_f1: 0.2395
 epoch: 5, train_loss: 1.1683, test_loss: 1.2342, test_f1: 0.2420
 epoch: 6, train_loss: 1.1308, test_loss: 1.2112, test_f1: 0.2748
 epoch: 7, train_loss: 1.0746, test_loss: 1.3002, test_f1: 0.2604
 epoch: 8, train_loss: 1.0383, test_loss: 1.0853, test_f1: 0.3516
 epoch: 9, train_loss: 1.0036, test_loss: 1.2146, test_f1: 0.3428
 epoch: 10, train_loss: 0.9762, test_loss: 1.0598, test_f1: 0.4211
 epoch: 11, train_loss: 0.9595, test_loss: 2.8444, test_f1: 0.1302
 epoch: 12, train_loss: 0.9440, test_loss: 1.0568, test_f1: 0.4214
 epoch: 13, train_loss: 0.9360, test_loss: 1.0489, test_f1: 0.4845
 epoch: 14, train_loss: 0.9201, test_loss: 1.0392, test_f1: 0.4748
 epoch: 15, train_loss: 0.8908, test_loss: 1.0665, test_f1: 0.5181
 epoch: 16, train_loss: 0.8829, test_loss: 1.0360, test_f1: 0.5151
 epoch: 17, train_loss: 0.8740, test_loss: 1.0057, test_f1: 0.5364
 epoch: 18, train_loss: 0.8653, test_loss: 0.9828, test_f1: 0.5333
 epoch: 19, train_loss: 0.8542, test_loss: 0.9714, test_f1: 0.5166
 epoch: 20, train_loss: 0.8423, test_loss: 0.9780, test_f1: 0.5626
 epoch: 21, train_loss: 0.8348, test_loss: 0.9906, test_f1: 0.5373
 epoch: 22, train_loss: 0.8157, test_loss: 1.2714, test_f1: 0.5382
 epoch: 23, train_loss: 0.8274, test_loss: 1.2648, test_f1: 0.5292
 epoch: 24, train_loss: 0.8073, test_loss: 1.0109, test_f1: 0.5549
 epoch: 25, train_loss: 0.8058, test_loss: 1.1111, test_f1: 0.4902
 epoch: 26, train_loss: 0.8058, test_loss: 0.9501, test_f1: 0.5918
 epoch: 27, train_loss: 0.8016, test_loss: 1.1042, test_f1: 0.4848
 epoch: 28, train_loss: 0.8033, test_loss: 0.9841, test_f1: 0.5592
 epoch: 29, train_loss: 0.7850, test_loss: 1.4753, test_f1: 0.5645
 epoch: 30, train_loss: 0.7868, test_loss: 0.9529, test_f1: 0.5306
 epoch: 31, train_loss: 0.7888, test_loss: 0.9720, test_f1: 0.5898
 epoch: 32, train_loss: 0.7771, test_loss: 1.0131, test_f1: 0.5618
 epoch: 33, train_loss: 0.7767, test_loss: 1.0195, test_f1: 0.5756
 epoch: 34, train_loss: 0.7821, test_loss: 1.2571, test_f1: 0.4485
 epoch: 35, train_loss: 0.7739, test_loss: 1.0619, test_f1: 0.5342
 epoch: 36, train_loss: 0.7651, test_loss: 0.9950, test_f1: 0.5605
 epoch: 37, train_loss: 0.7471, test_loss: 1.0029, test_f1: 0.5472
 epoch: 38, train_loss: 0.7593, test_loss: 1.3908, test_f1: 0.4752
 epoch: 39, train_loss: 0.7645, test_loss: 1.0958, test_f1: 0.5636
 epoch: 40, train_loss: 0.7603, test_loss: 1.4677, test_f1: 0.5303
 epoch: 41, train_loss: 0.7535, test_loss: 1.0240, test_f1: 0.5470
 epoch: 42, train_loss: 0.7649, test_loss: 1.0133, test_f1: 0.5569
 epoch: 43, train_loss: 0.7414, test_loss: 1.0708, test_f1: 0.5622
 epoch: 44, train_loss: 0.7487, test_loss: 1.0663, test_f1: 0.4911
 epoch: 45, train_loss: 0.7378, test_loss: 1.4082, test_f1: 0.5716
 epoch: 46, train_loss: 0.7284, test_loss: 1.5352, test_f1: 0.5324
 epoch: 47, train_loss: 0.7319, test_loss: 2.4642, test_f1: 0.5393
 epoch: 48, train_loss: 0.7390, test_loss: 1.1006, test_f1: 0.5616
 epoch: 49, train_loss: 0.7371, test_loss: 1.0265, test_f1: 0.5603
 epoch: 50, train_loss: 0.7241, test_loss: 1.0366, test_f1: 0.5489
 epoch: 51, train_loss: 0.7245, test_loss: 1.0794, test_f1: 0.5642
 epoch: 52, train_loss: 0.7188, test_loss: 1.1153, test_f1: 0.5620
 epoch: 53, train_loss: 0.7220, test_loss: 1.0818, test_f1: 0.5536
 epoch: 54, train_loss: 0.7137, test_loss: 1.1011, test_f1: 0.5610
 epoch: 55, train_loss: 0.6972, test_loss: 1.1752, test_f1: 0.5608
 epoch: 56, train_loss: 0.6908, test_loss: 1.2041, test_f1: 0.5622
 epoch: 57, train_loss: 0.6977, test_loss: 1.1589, test_f1: 0.5621
 epoch: 58, train_loss: 0.7127, test_loss: 1.0907, test_f1: 0.5485
 epoch: 59, train_loss: 0.6963, test_loss: 1.2756, test_f1: 0.5471
 epoch: 60, train_loss: 0.6893, test_loss: 1.1186, test_f1: 0.5649
 epoch: 61, train_loss: 0.6950, test_loss: 1.1364, test_f1: 0.5660
 epoch: 62, train_loss: 0.6962, test_loss: 1.1921, test_f1: 0.5572
 epoch: 63, train_loss: 0.7028, test_loss: 1.1150, test_f1: 0.5538
 epoch: 64, train_loss: 0.6842, test_loss: 1.1291, test_f1: 0.5542
 epoch: 65, train_loss: 0.6905, test_loss: 1.2468, test_f1: 0.5556
 epoch: 66, train_loss: 0.6808, test_loss: 1.1326, test_f1: 0.5809
 epoch: 67, train_loss: 0.7051, test_loss: 1.1300, test_f1: 0.5575
 epoch: 68, train_loss: 0.6905, test_loss: 1.1588, test_f1: 0.5628
 epoch: 69, train_loss: 0.6858, test_loss: 1.1157, test_f1: 0.5673
 epoch: 70, train_loss: 0.6799, test_loss: 1.1318, test_f1: 0.5873
 epoch: 71, train_loss: 0.6676, test_loss: 1.1409, test_f1: 0.5410
 epoch: 72, train_loss: 0.6767, test_loss: 1.1328, test_f1: 0.5668
 epoch: 73, train_loss: 0.6778, test_loss: 1.1468, test_f1: 0.5553
 epoch: 74, train_loss: 0.6775, test_loss: 1.2272, test_f1: 0.5554
 epoch: 75, train_loss: 0.6749, test_loss: 1.2118, test_f1: 0.5634
 epoch: 76, train_loss: 0.6753, test_loss: 1.1966, test_f1: 0.5692
 epoch: 77, train_loss: 0.6694, test_loss: 1.1737, test_f1: 0.5818
 epoch: 78, train_loss: 0.6907, test_loss: 1.2665, test_f1: 0.5732
 epoch: 79, train_loss: 0.6732, test_loss: 1.3410, test_f1: 0.5438
 epoch: 80, train_loss: 0.6904, test_loss: 1.2247, test_f1: 0.5647
 epoch: 81, train_loss: 0.6835, test_loss: 1.3098, test_f1: 0.5669
 epoch: 82, train_loss: 0.6822, test_loss: 1.2518, test_f1: 0.5787
 epoch: 83, train_loss: 0.6711, test_loss: 1.2376, test_f1: 0.5436
 epoch: 84, train_loss: 0.6560, test_loss: 1.3383, test_f1: 0.5452
 epoch: 85, train_loss: 0.6740, test_loss: 1.3644, test_f1: 0.5581
 epoch: 86, train_loss: 0.6835, test_loss: 1.2356, test_f1: 0.5823
 epoch: 87, train_loss: 0.6749, test_loss: 1.2343, test_f1: 0.5682
 epoch: 88, train_loss: 0.6751, test_loss: 1.4727, test_f1: 0.5178
 epoch: 89, train_loss: 0.6669, test_loss: 1.4086, test_f1: 0.5353
 epoch: 90, train_loss: 0.6749, test_loss: 1.2478, test_f1: 0.5757
 epoch: 91, train_loss: 0.6727, test_loss: 1.2619, test_f1: 0.5682
 epoch: 92, train_loss: 0.6561, test_loss: 1.2678, test_f1: 0.5729
 epoch: 93, train_loss: 0.6569, test_loss: 1.3599, test_f1: 0.5679
 epoch: 94, train_loss: 0.6577, test_loss: 1.2756, test_f1: 0.5758
 epoch: 95, train_loss: 0.6621, test_loss: 1.3490, test_f1: 0.5598
 epoch: 96, train_loss: 0.6656, test_loss: 1.4899, test_f1: 0.5496
 epoch: 97, train_loss: 0.6727, test_loss: 1.4292, test_f1: 0.5477
 epoch: 98, train_loss: 0.6643, test_loss: 1.3226, test_f1: 0.5530
 epoch: 99, train_loss: 0.6768, test_loss: 1.3559, test_f1: 0.5540
##################ITERATION #1 ****************************************
 epoch: 0, train_loss: 1.3733, test_loss: 1.3122, test_f1: 0.2281
 epoch: 1, train_loss: 1.2572, test_loss: 1.2788, test_f1: 0.2281
 epoch: 2, train_loss: 1.2043, test_loss: 1.2534, test_f1: 0.2281
 epoch: 3, train_loss: 1.1799, test_loss: 1.2221, test_f1: 0.3262
 epoch: 4, train_loss: 1.1505, test_loss: 1.1939, test_f1: 0.3592
 epoch: 5, train_loss: 1.1168, test_loss: 1.1844, test_f1: 0.3622
 epoch: 6, train_loss: 1.0911, test_loss: 1.1557, test_f1: 0.3517
 epoch: 7, train_loss: 1.0628, test_loss: 1.1188, test_f1: 0.3444
 epoch: 8, train_loss: 1.0614, test_loss: 1.1224, test_f1: 0.3302
 epoch: 9, train_loss: 1.0288, test_loss: 1.0905, test_f1: 0.3405
 epoch: 10, train_loss: 1.0156, test_loss: 1.1175, test_f1: 0.3739
 epoch: 11, train_loss: 1.0066, test_loss: 1.0975, test_f1: 0.3723
 epoch: 12, train_loss: 0.9828, test_loss: 1.0773, test_f1: 0.3883
 epoch: 13, train_loss: 0.9756, test_loss: 1.0714, test_f1: 0.4219
 epoch: 14, train_loss: 0.9537, test_loss: 1.0682, test_f1: 0.4508
 epoch: 15, train_loss: 0.9436, test_loss: 1.0711, test_f1: 0.4816
 epoch: 16, train_loss: 0.9374, test_loss: 1.1162, test_f1: 0.4368
 epoch: 17, train_loss: 0.9256, test_loss: 1.0530, test_f1: 0.4903
 epoch: 18, train_loss: 0.9130, test_loss: 1.0545, test_f1: 0.4901
 epoch: 19, train_loss: 0.9144, test_loss: 1.0466, test_f1: 0.4365
 epoch: 20, train_loss: 0.8991, test_loss: 1.0183, test_f1: 0.4751
 epoch: 21, train_loss: 0.8752, test_loss: 1.0291, test_f1: 0.4793
 epoch: 22, train_loss: 0.8857, test_loss: 1.0291, test_f1: 0.4845
 epoch: 23, train_loss: 0.8642, test_loss: 1.0126, test_f1: 0.4460
 epoch: 24, train_loss: 0.8474, test_loss: 1.0569, test_f1: 0.4482
 epoch: 25, train_loss: 0.8511, test_loss: 1.0393, test_f1: 0.5034
 epoch: 26, train_loss: 0.8371, test_loss: 0.9774, test_f1: 0.5078
 epoch: 27, train_loss: 0.8274, test_loss: 0.9579, test_f1: 0.4913
 epoch: 28, train_loss: 0.8279, test_loss: 0.9798, test_f1: 0.5113
 epoch: 29, train_loss: 0.8143, test_loss: 0.9762, test_f1: 0.5178
 epoch: 30, train_loss: 0.8160, test_loss: 0.9607, test_f1: 0.5279
 epoch: 31, train_loss: 0.7986, test_loss: 0.9710, test_f1: 0.5059
 epoch: 32, train_loss: 0.8053, test_loss: 1.0116, test_f1: 0.5017
 epoch: 33, train_loss: 0.7779, test_loss: 0.9864, test_f1: 0.5263
 epoch: 34, train_loss: 0.7973, test_loss: 0.9569, test_f1: 0.5155
 epoch: 35, train_loss: 0.7794, test_loss: 0.9867, test_f1: 0.5410
 epoch: 36, train_loss: 0.7778, test_loss: 0.9836, test_f1: 0.5379
 epoch: 37, train_loss: 0.7654, test_loss: 1.0033, test_f1: 0.5163
 epoch: 38, train_loss: 0.7716, test_loss: 0.9588, test_f1: 0.5372
 epoch: 39, train_loss: 0.7597, test_loss: 1.1089, test_f1: 0.5024
 epoch: 40, train_loss: 0.7504, test_loss: 0.9273, test_f1: 0.5476
 epoch: 41, train_loss: 0.7436, test_loss: 1.0339, test_f1: 0.5379
 epoch: 42, train_loss: 0.7293, test_loss: 1.0090, test_f1: 0.5364
 epoch: 43, train_loss: 0.7196, test_loss: 1.0732, test_f1: 0.5276
 epoch: 44, train_loss: 0.7157, test_loss: 0.9646, test_f1: 0.5843
 epoch: 45, train_loss: 0.7276, test_loss: 0.9683, test_f1: 0.5624
 epoch: 46, train_loss: 0.7172, test_loss: 0.9516, test_f1: 0.5956
 epoch: 47, train_loss: 0.7110, test_loss: 1.0382, test_f1: 0.5600
 epoch: 48, train_loss: 0.7197, test_loss: 1.0200, test_f1: 0.6143
 epoch: 49, train_loss: 0.7001, test_loss: 0.9670, test_f1: 0.5577
 epoch: 50, train_loss: 0.6938, test_loss: 0.9628, test_f1: 0.6036
 epoch: 51, train_loss: 0.6954, test_loss: 0.9662, test_f1: 0.6074
 epoch: 52, train_loss: 0.6847, test_loss: 1.0020, test_f1: 0.5688
 epoch: 53, train_loss: 0.6833, test_loss: 0.9787, test_f1: 0.6055
 epoch: 54, train_loss: 0.6952, test_loss: 0.9732, test_f1: 0.6101
 epoch: 55, train_loss: 0.6872, test_loss: 0.9793, test_f1: 0.5846
 epoch: 56, train_loss: 0.6752, test_loss: 1.0538, test_f1: 0.5710
 epoch: 57, train_loss: 0.6811, test_loss: 1.0068, test_f1: 0.5853
 epoch: 58, train_loss: 0.6868, test_loss: 1.0023, test_f1: 0.5762
 epoch: 59, train_loss: 0.6730, test_loss: 1.0418, test_f1: 0.5689
 epoch: 60, train_loss: 0.6682, test_loss: 1.0291, test_f1: 0.5517
 epoch: 61, train_loss: 0.6694, test_loss: 0.9563, test_f1: 0.6174
 epoch: 62, train_loss: 0.6598, test_loss: 0.9935, test_f1: 0.6089
 epoch: 63, train_loss: 0.6738, test_loss: 0.9870, test_f1: 0.6013
 epoch: 64, train_loss: 0.6783, test_loss: 0.9892, test_f1: 0.5795
 epoch: 65, train_loss: 0.6636, test_loss: 1.0231, test_f1: 0.5885
 epoch: 66, train_loss: 0.6552, test_loss: 0.9690, test_f1: 0.5872
 epoch: 67, train_loss: 0.6525, test_loss: 0.9559, test_f1: 0.6169
 epoch: 68, train_loss: 0.6625, test_loss: 0.9611, test_f1: 0.5915
 epoch: 69, train_loss: 0.6656, test_loss: 1.0235, test_f1: 0.5527
 epoch: 70, train_loss: 0.6591, test_loss: 1.0083, test_f1: 0.5732
 epoch: 71, train_loss: 0.6574, test_loss: 0.9977, test_f1: 0.5827
 epoch: 72, train_loss: 0.6475, test_loss: 1.0370, test_f1: 0.5776
 epoch: 73, train_loss: 0.6427, test_loss: 1.0278, test_f1: 0.5879
 epoch: 74, train_loss: 0.6513, test_loss: 1.0357, test_f1: 0.5834
 epoch: 75, train_loss: 0.6407, test_loss: 1.0376, test_f1: 0.5902
 epoch: 76, train_loss: 0.6572, test_loss: 0.9999, test_f1: 0.5815
 epoch: 77, train_loss: 0.6428, test_loss: 1.0138, test_f1: 0.5921
 epoch: 78, train_loss: 0.6411, test_loss: 1.0300, test_f1: 0.5967
 epoch: 79, train_loss: 0.6385, test_loss: 1.0637, test_f1: 0.5901
 epoch: 80, train_loss: 0.6485, test_loss: 0.9626, test_f1: 0.6022
 epoch: 81, train_loss: 0.6479, test_loss: 1.0769, test_f1: 0.5782
 epoch: 82, train_loss: 0.6505, test_loss: 1.1224, test_f1: 0.5500
 epoch: 83, train_loss: 0.6410, test_loss: 1.0415, test_f1: 0.5972
 epoch: 84, train_loss: 0.6381, test_loss: 1.0162, test_f1: 0.5869
 epoch: 85, train_loss: 0.6396, test_loss: 1.0524, test_f1: 0.5770
 epoch: 86, train_loss: 0.6331, test_loss: 1.0186, test_f1: 0.5889
 epoch: 87, train_loss: 0.6328, test_loss: 1.0915, test_f1: 0.5782
 epoch: 88, train_loss: 0.6388, test_loss: 1.0759, test_f1: 0.5819
 epoch: 89, train_loss: 0.6256, test_loss: 1.0809, test_f1: 0.5916
 epoch: 90, train_loss: 0.6332, test_loss: 1.1033, test_f1: 0.5751
 epoch: 91, train_loss: 0.6395, test_loss: 1.1392, test_f1: 0.5675
 epoch: 92, train_loss: 0.6278, test_loss: 1.1153, test_f1: 0.5916
 epoch: 93, train_loss: 0.6296, test_loss: 1.1202, test_f1: 0.5858
 epoch: 94, train_loss: 0.6318, test_loss: 1.1179, test_f1: 0.5639
 epoch: 95, train_loss: 0.6239, test_loss: 1.0653, test_f1: 0.5672
 epoch: 96, train_loss: 0.6403, test_loss: 1.0625, test_f1: 0.5972
 epoch: 97, train_loss: 0.6339, test_loss: 1.0751, test_f1: 0.5659
 epoch: 98, train_loss: 0.6285, test_loss: 1.1060, test_f1: 0.5711
 epoch: 99, train_loss: 0.6229, test_loss: 1.0948, test_f1: 0.5697
##################ITERATION #2 ****************************************
 epoch: 0, train_loss: 1.3328, test_loss: 1.3013, test_f1: 0.2281
 epoch: 1, train_loss: 1.2151, test_loss: 1.2831, test_f1: 0.2281
 epoch: 2, train_loss: 1.1781, test_loss: 1.2352, test_f1: 0.2281
 epoch: 3, train_loss: 1.1370, test_loss: 1.1928, test_f1: 0.3126
 epoch: 4, train_loss: 1.0918, test_loss: 1.1732, test_f1: 0.3633
 epoch: 5, train_loss: 1.0725, test_loss: 1.1451, test_f1: 0.3859
 epoch: 6, train_loss: 1.0434, test_loss: 1.1012, test_f1: 0.3920
 epoch: 7, train_loss: 1.0123, test_loss: 1.0805, test_f1: 0.4114
 epoch: 8, train_loss: 0.9860, test_loss: 1.0671, test_f1: 0.4583
 epoch: 9, train_loss: 0.9798, test_loss: 1.0377, test_f1: 0.4529
 epoch: 10, train_loss: 0.9395, test_loss: 1.0375, test_f1: 0.4826
 epoch: 11, train_loss: 0.9263, test_loss: 1.0040, test_f1: 0.4865
 epoch: 12, train_loss: 0.9093, test_loss: 1.0062, test_f1: 0.5436
 epoch: 13, train_loss: 0.9016, test_loss: 0.9882, test_f1: 0.5243
 epoch: 14, train_loss: 0.9005, test_loss: 1.0604, test_f1: 0.5048
 epoch: 15, train_loss: 0.8780, test_loss: 0.9695, test_f1: 0.5036
 epoch: 16, train_loss: 0.8624, test_loss: 0.9910, test_f1: 0.5452
 epoch: 17, train_loss: 0.8527, test_loss: 0.9823, test_f1: 0.4976
 epoch: 18, train_loss: 0.8465, test_loss: 0.9541, test_f1: 0.5784
 epoch: 19, train_loss: 0.8218, test_loss: 0.9558, test_f1: 0.5693
 epoch: 20, train_loss: 0.8223, test_loss: 0.9604, test_f1: 0.5359
 epoch: 21, train_loss: 0.8084, test_loss: 0.9157, test_f1: 0.6040
 epoch: 22, train_loss: 0.8065, test_loss: 0.9776, test_f1: 0.5135
 epoch: 23, train_loss: 0.8157, test_loss: 0.9809, test_f1: 0.5464
 epoch: 24, train_loss: 0.7998, test_loss: 0.9491, test_f1: 0.6088
 epoch: 25, train_loss: 0.7834, test_loss: 1.0532, test_f1: 0.5074
 epoch: 26, train_loss: 0.7896, test_loss: 0.9737, test_f1: 0.5439
 epoch: 27, train_loss: 0.7908, test_loss: 1.0132, test_f1: 0.5043
 epoch: 28, train_loss: 0.8008, test_loss: 0.9937, test_f1: 0.5658
 epoch: 29, train_loss: 0.7974, test_loss: 0.9922, test_f1: 0.5336
 epoch: 30, train_loss: 0.7628, test_loss: 0.9807, test_f1: 0.5370
 epoch: 31, train_loss: 0.7784, test_loss: 1.0338, test_f1: 0.5063
 epoch: 32, train_loss: 0.7572, test_loss: 0.9476, test_f1: 0.5722
 epoch: 33, train_loss: 0.7483, test_loss: 0.9702, test_f1: 0.5510
 epoch: 34, train_loss: 0.7321, test_loss: 0.9836, test_f1: 0.5632
 epoch: 35, train_loss: 0.7446, test_loss: 0.9352, test_f1: 0.5971
 epoch: 36, train_loss: 0.7351, test_loss: 0.9153, test_f1: 0.5682
 epoch: 37, train_loss: 0.7314, test_loss: 0.9272, test_f1: 0.5527
 epoch: 38, train_loss: 0.7372, test_loss: 0.9631, test_f1: 0.5626
 epoch: 39, train_loss: 0.7320, test_loss: 0.9851, test_f1: 0.5970
 epoch: 40, train_loss: 0.7339, test_loss: 0.9699, test_f1: 0.5637
 epoch: 41, train_loss: 0.7623, test_loss: 1.0069, test_f1: 0.5586
 epoch: 42, train_loss: 0.7293, test_loss: 0.9531, test_f1: 0.5816
 epoch: 43, train_loss: 0.7279, test_loss: 0.9593, test_f1: 0.5887
 epoch: 44, train_loss: 0.7137, test_loss: 0.9256, test_f1: 0.5610
 epoch: 45, train_loss: 0.7220, test_loss: 0.9121, test_f1: 0.6087
 epoch: 46, train_loss: 0.7094, test_loss: 1.0061, test_f1: 0.5703
 epoch: 47, train_loss: 0.7112, test_loss: 1.0006, test_f1: 0.5988
 epoch: 48, train_loss: 0.7074, test_loss: 0.9804, test_f1: 0.5656
 epoch: 49, train_loss: 0.7119, test_loss: 1.0251, test_f1: 0.5942
 epoch: 50, train_loss: 0.6909, test_loss: 0.9646, test_f1: 0.6034
 epoch: 51, train_loss: 0.7071, test_loss: 0.9623, test_f1: 0.6054
 epoch: 52, train_loss: 0.6917, test_loss: 0.9966, test_f1: 0.6154
 epoch: 53, train_loss: 0.6800, test_loss: 1.0360, test_f1: 0.5765
 epoch: 54, train_loss: 0.6824, test_loss: 0.9803, test_f1: 0.6195
 epoch: 55, train_loss: 0.6769, test_loss: 0.9779, test_f1: 0.5999
 epoch: 56, train_loss: 0.6728, test_loss: 0.9864, test_f1: 0.5969
 epoch: 57, train_loss: 0.6840, test_loss: 0.9792, test_f1: 0.6233
 epoch: 58, train_loss: 0.6901, test_loss: 0.9560, test_f1: 0.6209
 epoch: 59, train_loss: 0.6808, test_loss: 1.0375, test_f1: 0.5680
 epoch: 60, train_loss: 0.6803, test_loss: 0.9832, test_f1: 0.6160
 epoch: 61, train_loss: 0.6655, test_loss: 0.9840, test_f1: 0.6218
 epoch: 62, train_loss: 0.6779, test_loss: 0.9611, test_f1: 0.6287
 epoch: 63, train_loss: 0.6604, test_loss: 0.9941, test_f1: 0.6207
 epoch: 64, train_loss: 0.6648, test_loss: 0.9912, test_f1: 0.6120
 epoch: 65, train_loss: 0.6687, test_loss: 1.0530, test_f1: 0.5796
 epoch: 66, train_loss: 0.6610, test_loss: 1.0130, test_f1: 0.6034
 epoch: 67, train_loss: 0.6751, test_loss: 0.9929, test_f1: 0.6054
 epoch: 68, train_loss: 0.6689, test_loss: 1.0634, test_f1: 0.5789
 epoch: 69, train_loss: 0.6641, test_loss: 0.9907, test_f1: 0.6150
 epoch: 70, train_loss: 0.6427, test_loss: 1.0107, test_f1: 0.5842
 epoch: 71, train_loss: 0.6558, test_loss: 1.0266, test_f1: 0.5722
 epoch: 72, train_loss: 0.6592, test_loss: 1.0043, test_f1: 0.5841
 epoch: 73, train_loss: 0.6654, test_loss: 1.0302, test_f1: 0.5688
 epoch: 74, train_loss: 0.6521, test_loss: 1.0243, test_f1: 0.6085
 epoch: 75, train_loss: 0.6545, test_loss: 1.0160, test_f1: 0.5881
 epoch: 76, train_loss: 0.6546, test_loss: 1.0292, test_f1: 0.5931
 epoch: 77, train_loss: 0.6570, test_loss: 0.9959, test_f1: 0.6244
 epoch: 78, train_loss: 0.6481, test_loss: 1.0468, test_f1: 0.5887
 epoch: 79, train_loss: 0.6488, test_loss: 1.0045, test_f1: 0.6009
 epoch: 80, train_loss: 0.6412, test_loss: 1.0274, test_f1: 0.6177
 epoch: 81, train_loss: 0.6438, test_loss: 1.0019, test_f1: 0.6288
 epoch: 82, train_loss: 0.6487, test_loss: 1.0293, test_f1: 0.5871
 epoch: 83, train_loss: 0.6375, test_loss: 1.0488, test_f1: 0.6194
 epoch: 84, train_loss: 0.6636, test_loss: 1.0574, test_f1: 0.5952
 epoch: 85, train_loss: 0.6211, test_loss: 1.0646, test_f1: 0.5870
 epoch: 86, train_loss: 0.6314, test_loss: 1.0882, test_f1: 0.5751
 epoch: 87, train_loss: 0.6371, test_loss: 1.0176, test_f1: 0.6109
 epoch: 88, train_loss: 0.6388, test_loss: 1.0323, test_f1: 0.6515
 epoch: 89, train_loss: 0.6405, test_loss: 1.0633, test_f1: 0.5956
 epoch: 90, train_loss: 0.6514, test_loss: 1.0866, test_f1: 0.6040
 epoch: 91, train_loss: 0.6293, test_loss: 1.0345, test_f1: 0.5969
 epoch: 92, train_loss: 0.6465, test_loss: 1.0830, test_f1: 0.5965
 epoch: 93, train_loss: 0.6424, test_loss: 1.1138, test_f1: 0.5881
 epoch: 94, train_loss: 0.6304, test_loss: 1.0342, test_f1: 0.6188
 epoch: 95, train_loss: 0.6349, test_loss: 1.0183, test_f1: 0.6162
 epoch: 96, train_loss: 0.6194, test_loss: 1.1006, test_f1: 0.5865
 epoch: 97, train_loss: 0.6420, test_loss: 1.0009, test_f1: 0.6409
 epoch: 98, train_loss: 0.6234, test_loss: 1.0772, test_f1: 0.5863
 epoch: 99, train_loss: 0.6321, test_loss: 1.1005, test_f1: 0.5899
##################ITERATION #3 ****************************************
 epoch: 0, train_loss: 1.2473, test_loss: 1.3458, test_f1: 0.3001
 epoch: 1, train_loss: 1.1557, test_loss: 1.2448, test_f1: 0.3385
 epoch: 2, train_loss: 1.1072, test_loss: 1.1588, test_f1: 0.3957
 epoch: 3, train_loss: 1.0752, test_loss: 1.1125, test_f1: 0.4502
 epoch: 4, train_loss: 1.0354, test_loss: 1.0862, test_f1: 0.4699
 epoch: 5, train_loss: 1.0201, test_loss: 1.0754, test_f1: 0.4818
 epoch: 6, train_loss: 0.9914, test_loss: 1.0626, test_f1: 0.4869
 epoch: 7, train_loss: 0.9547, test_loss: 1.0375, test_f1: 0.5223
 epoch: 8, train_loss: 0.9549, test_loss: 1.0198, test_f1: 0.5395
 epoch: 9, train_loss: 0.9440, test_loss: 1.0396, test_f1: 0.4865
 epoch: 10, train_loss: 0.9254, test_loss: 1.0133, test_f1: 0.5081
 epoch: 11, train_loss: 0.9028, test_loss: 1.0298, test_f1: 0.5231
 epoch: 12, train_loss: 0.8767, test_loss: 0.9767, test_f1: 0.5543
 epoch: 13, train_loss: 0.8773, test_loss: 0.9966, test_f1: 0.5596
 epoch: 14, train_loss: 0.8610, test_loss: 0.9915, test_f1: 0.5461
 epoch: 15, train_loss: 0.8626, test_loss: 0.9904, test_f1: 0.5465
 epoch: 16, train_loss: 0.8315, test_loss: 1.0183, test_f1: 0.5099
 epoch: 17, train_loss: 0.8271, test_loss: 0.9820, test_f1: 0.5548
 epoch: 18, train_loss: 0.8294, test_loss: 1.0598, test_f1: 0.4936
 epoch: 19, train_loss: 0.8042, test_loss: 0.9984, test_f1: 0.5373
 epoch: 20, train_loss: 0.7962, test_loss: 1.0655, test_f1: 0.5080
 epoch: 21, train_loss: 0.8066, test_loss: 1.0038, test_f1: 0.5485
 epoch: 22, train_loss: 0.8055, test_loss: 0.9853, test_f1: 0.5699
 epoch: 23, train_loss: 0.8102, test_loss: 1.0514, test_f1: 0.5265
 epoch: 24, train_loss: 0.7888, test_loss: 1.0022, test_f1: 0.5729
 epoch: 25, train_loss: 0.7889, test_loss: 1.0597, test_f1: 0.5415
 epoch: 26, train_loss: 0.7783, test_loss: 1.0035, test_f1: 0.5698
 epoch: 27, train_loss: 0.7600, test_loss: 1.0445, test_f1: 0.5398
 epoch: 28, train_loss: 0.7669, test_loss: 1.0194, test_f1: 0.5621
 epoch: 29, train_loss: 0.7652, test_loss: 1.0303, test_f1: 0.5869
 epoch: 30, train_loss: 0.7641, test_loss: 1.0529, test_f1: 0.5438
 epoch: 31, train_loss: 0.7479, test_loss: 1.0033, test_f1: 0.5645
 epoch: 32, train_loss: 0.7323, test_loss: 1.0192, test_f1: 0.5929
 epoch: 33, train_loss: 0.7305, test_loss: 1.0796, test_f1: 0.5462
 epoch: 34, train_loss: 0.7325, test_loss: 1.0259, test_f1: 0.5828
 epoch: 35, train_loss: 0.7466, test_loss: 0.9946, test_f1: 0.5996
 epoch: 36, train_loss: 0.7368, test_loss: 1.1030, test_f1: 0.5256
 epoch: 37, train_loss: 0.7382, test_loss: 0.9849, test_f1: 0.5852
 epoch: 38, train_loss: 0.7261, test_loss: 0.9996, test_f1: 0.5781
 epoch: 39, train_loss: 0.7184, test_loss: 1.0969, test_f1: 0.5685
 epoch: 40, train_loss: 0.7201, test_loss: 0.9473, test_f1: 0.6048
 epoch: 41, train_loss: 0.7192, test_loss: 1.0297, test_f1: 0.5364
 epoch: 42, train_loss: 0.7052, test_loss: 1.0075, test_f1: 0.5816
 epoch: 43, train_loss: 0.7106, test_loss: 1.0645, test_f1: 0.5258
 epoch: 44, train_loss: 0.7183, test_loss: 1.0027, test_f1: 0.5632
 epoch: 45, train_loss: 0.7093, test_loss: 0.9672, test_f1: 0.6095
 epoch: 46, train_loss: 0.7115, test_loss: 1.0537, test_f1: 0.5864
 epoch: 47, train_loss: 0.6978, test_loss: 1.0114, test_f1: 0.5726
 epoch: 48, train_loss: 0.7062, test_loss: 1.0296, test_f1: 0.6130
 epoch: 49, train_loss: 0.7009, test_loss: 1.0496, test_f1: 0.5856
 epoch: 50, train_loss: 0.6899, test_loss: 0.9972, test_f1: 0.5709
 epoch: 51, train_loss: 0.6760, test_loss: 1.0031, test_f1: 0.6028
 epoch: 52, train_loss: 0.6746, test_loss: 1.0540, test_f1: 0.5642
 epoch: 53, train_loss: 0.6716, test_loss: 1.0712, test_f1: 0.5952
 epoch: 54, train_loss: 0.6769, test_loss: 0.9928, test_f1: 0.6067
 epoch: 55, train_loss: 0.6649, test_loss: 1.0403, test_f1: 0.5801
 epoch: 56, train_loss: 0.6828, test_loss: 1.0155, test_f1: 0.5705
 epoch: 57, train_loss: 0.6656, test_loss: 1.0275, test_f1: 0.6157
 epoch: 58, train_loss: 0.6699, test_loss: 1.0255, test_f1: 0.5771
 epoch: 59, train_loss: 0.6703, test_loss: 1.0309, test_f1: 0.5781
 epoch: 60, train_loss: 0.6618, test_loss: 1.0021, test_f1: 0.6082
 epoch: 61, train_loss: 0.6732, test_loss: 0.9923, test_f1: 0.6075
 epoch: 62, train_loss: 0.6454, test_loss: 1.0074, test_f1: 0.5992
 epoch: 63, train_loss: 0.6728, test_loss: 1.0977, test_f1: 0.5558
 epoch: 64, train_loss: 0.6667, test_loss: 1.0831, test_f1: 0.5747
 epoch: 65, train_loss: 0.6669, test_loss: 1.0984, test_f1: 0.5599
 epoch: 66, train_loss: 0.6624, test_loss: 1.0256, test_f1: 0.5667
 epoch: 67, train_loss: 0.6577, test_loss: 1.0662, test_f1: 0.5377
 epoch: 68, train_loss: 0.6529, test_loss: 1.0601, test_f1: 0.5697
 epoch: 69, train_loss: 0.6675, test_loss: 1.0664, test_f1: 0.5664
 epoch: 70, train_loss: 0.6481, test_loss: 1.0520, test_f1: 0.5965
 epoch: 71, train_loss: 0.6639, test_loss: 1.0534, test_f1: 0.5897
 epoch: 72, train_loss: 0.6571, test_loss: 1.0401, test_f1: 0.5941
 epoch: 73, train_loss: 0.6486, test_loss: 1.0518, test_f1: 0.5673
 epoch: 74, train_loss: 0.6584, test_loss: 1.0707, test_f1: 0.5922
 epoch: 75, train_loss: 0.6590, test_loss: 1.1275, test_f1: 0.5375
 epoch: 76, train_loss: 0.6685, test_loss: 1.0379, test_f1: 0.6038
 epoch: 77, train_loss: 0.6490, test_loss: 1.0668, test_f1: 0.6014
 epoch: 78, train_loss: 0.6498, test_loss: 1.0555, test_f1: 0.5916
 epoch: 79, train_loss: 0.6493, test_loss: 1.1375, test_f1: 0.5451
 epoch: 80, train_loss: 0.6464, test_loss: 1.0894, test_f1: 0.5510
 epoch: 81, train_loss: 0.6571, test_loss: 1.0398, test_f1: 0.5597
 epoch: 82, train_loss: 0.6531, test_loss: 1.0675, test_f1: 0.5827
 epoch: 83, train_loss: 0.6383, test_loss: 1.1424, test_f1: 0.5683
 epoch: 84, train_loss: 0.6358, test_loss: 1.0771, test_f1: 0.5567
 epoch: 85, train_loss: 0.6488, test_loss: 1.0500, test_f1: 0.5683
 epoch: 86, train_loss: 0.6483, test_loss: 1.0927, test_f1: 0.5717
 epoch: 87, train_loss: 0.6445, test_loss: 1.0869, test_f1: 0.5854
 epoch: 88, train_loss: 0.6341, test_loss: 1.0941, test_f1: 0.5787
 epoch: 89, train_loss: 0.6430, test_loss: 1.0542, test_f1: 0.6055
 epoch: 90, train_loss: 0.6245, test_loss: 1.0893, test_f1: 0.5790
 epoch: 91, train_loss: 0.6298, test_loss: 1.0953, test_f1: 0.5793
 epoch: 92, train_loss: 0.6327, test_loss: 1.1460, test_f1: 0.5811
 epoch: 93, train_loss: 0.6349, test_loss: 1.1022, test_f1: 0.5828
 epoch: 94, train_loss: 0.6191, test_loss: 1.1108, test_f1: 0.5744
 epoch: 95, train_loss: 0.6289, test_loss: 1.1316, test_f1: 0.5652
 epoch: 96, train_loss: 0.6195, test_loss: 1.0823, test_f1: 0.5871
 epoch: 97, train_loss: 0.6324, test_loss: 1.1575, test_f1: 0.5579
 epoch: 98, train_loss: 0.6303, test_loss: 1.1372, test_f1: 0.5435
 epoch: 99, train_loss: 0.6305, test_loss: 1.0638, test_f1: 0.5714
##################ITERATION #4 ****************************************
 epoch: 0, train_loss: 1.5377, test_loss: 1.3425, test_f1: 0.2655
 epoch: 1, train_loss: 1.2272, test_loss: 1.2978, test_f1: 0.2604
 epoch: 2, train_loss: 1.1879, test_loss: 1.2202, test_f1: 0.3223
 epoch: 3, train_loss: 1.1614, test_loss: 1.1866, test_f1: 0.4005
 epoch: 4, train_loss: 1.1334, test_loss: 1.1588, test_f1: 0.4104
 epoch: 5, train_loss: 1.1048, test_loss: 1.1448, test_f1: 0.4227
 epoch: 6, train_loss: 1.0780, test_loss: 1.1205, test_f1: 0.4658
 epoch: 7, train_loss: 1.0480, test_loss: 1.0816, test_f1: 0.4700
 epoch: 8, train_loss: 1.0379, test_loss: 1.0492, test_f1: 0.5361
 epoch: 9, train_loss: 1.0135, test_loss: 1.0297, test_f1: 0.5461
 epoch: 10, train_loss: 0.9830, test_loss: 1.0248, test_f1: 0.5307
 epoch: 11, train_loss: 0.9778, test_loss: 1.0042, test_f1: 0.5432
 epoch: 12, train_loss: 0.9663, test_loss: 0.9945, test_f1: 0.5560
 epoch: 13, train_loss: 0.9696, test_loss: 1.0022, test_f1: 0.5580
 epoch: 14, train_loss: 0.9471, test_loss: 0.9769, test_f1: 0.6047
 epoch: 15, train_loss: 0.9225, test_loss: 0.9793, test_f1: 0.5663
 epoch: 16, train_loss: 0.9216, test_loss: 1.0045, test_f1: 0.5455
 epoch: 17, train_loss: 0.9208, test_loss: 0.9625, test_f1: 0.5837
 epoch: 18, train_loss: 0.9078, test_loss: 1.0057, test_f1: 0.5450
 epoch: 19, train_loss: 0.8841, test_loss: 0.9304, test_f1: 0.5974
 epoch: 20, train_loss: 0.8795, test_loss: 1.0157, test_f1: 0.5705
 epoch: 21, train_loss: 0.8854, test_loss: 0.9984, test_f1: 0.5773
 epoch: 22, train_loss: 0.8617, test_loss: 1.0062, test_f1: 0.5494
 epoch: 23, train_loss: 0.8514, test_loss: 0.9325, test_f1: 0.5923
 epoch: 24, train_loss: 0.8617, test_loss: 0.9391, test_f1: 0.5969
 epoch: 25, train_loss: 0.8327, test_loss: 0.9501, test_f1: 0.5678
 epoch: 26, train_loss: 0.8432, test_loss: 1.0855, test_f1: 0.5345
 epoch: 27, train_loss: 0.8332, test_loss: 0.9729, test_f1: 0.5685
 epoch: 28, train_loss: 0.8170, test_loss: 1.0294, test_f1: 0.5629
 epoch: 29, train_loss: 0.8171, test_loss: 1.0021, test_f1: 0.5843
 epoch: 30, train_loss: 0.8086, test_loss: 1.2262, test_f1: 0.5173
 epoch: 31, train_loss: 0.8186, test_loss: 1.0304, test_f1: 0.5779
 epoch: 32, train_loss: 0.7975, test_loss: 0.9648, test_f1: 0.5572
 epoch: 33, train_loss: 0.7922, test_loss: 1.1613, test_f1: 0.5473
 epoch: 34, train_loss: 0.7996, test_loss: 1.0290, test_f1: 0.5648
 epoch: 35, train_loss: 0.8024, test_loss: 1.1033, test_f1: 0.5048
 epoch: 36, train_loss: 0.7811, test_loss: 1.1310, test_f1: 0.5655
 epoch: 37, train_loss: 0.7928, test_loss: 0.9501, test_f1: 0.5469
 epoch: 38, train_loss: 0.7690, test_loss: 1.1643, test_f1: 0.5285
 epoch: 39, train_loss: 0.7856, test_loss: 1.0286, test_f1: 0.5564
 epoch: 40, train_loss: 0.7644, test_loss: 1.0005, test_f1: 0.5724
 epoch: 41, train_loss: 0.7593, test_loss: 1.0439, test_f1: 0.5712
 epoch: 42, train_loss: 0.7732, test_loss: 0.9200, test_f1: 0.5823
 epoch: 43, train_loss: 0.7473, test_loss: 1.0364, test_f1: 0.5445
 epoch: 44, train_loss: 0.7360, test_loss: 1.0284, test_f1: 0.5742
 epoch: 45, train_loss: 0.7521, test_loss: 1.0098, test_f1: 0.5944
 epoch: 46, train_loss: 0.7474, test_loss: 0.9422, test_f1: 0.6099
 epoch: 47, train_loss: 0.7603, test_loss: 0.9995, test_f1: 0.5090
 epoch: 48, train_loss: 0.7536, test_loss: 1.0155, test_f1: 0.5516
 epoch: 49, train_loss: 0.7392, test_loss: 0.9956, test_f1: 0.5741
 epoch: 50, train_loss: 0.7309, test_loss: 1.0979, test_f1: 0.5628
 epoch: 51, train_loss: 0.7241, test_loss: 0.9405, test_f1: 0.6125
 epoch: 52, train_loss: 0.7072, test_loss: 0.9908, test_f1: 0.5407
 epoch: 53, train_loss: 0.7119, test_loss: 0.9836, test_f1: 0.5834
 epoch: 54, train_loss: 0.7247, test_loss: 0.9269, test_f1: 0.5752
 epoch: 55, train_loss: 0.7030, test_loss: 0.9507, test_f1: 0.5634
 epoch: 56, train_loss: 0.7307, test_loss: 0.9566, test_f1: 0.6190
 epoch: 57, train_loss: 0.7108, test_loss: 0.9534, test_f1: 0.6061
 epoch: 58, train_loss: 0.7064, test_loss: 0.9327, test_f1: 0.6006
 epoch: 59, train_loss: 0.7186, test_loss: 0.9054, test_f1: 0.5980
 epoch: 60, train_loss: 0.7267, test_loss: 0.9311, test_f1: 0.5858
 epoch: 61, train_loss: 0.7004, test_loss: 0.9830, test_f1: 0.5593
 epoch: 62, train_loss: 0.6886, test_loss: 0.9869, test_f1: 0.5575
 epoch: 63, train_loss: 0.7167, test_loss: 0.9774, test_f1: 0.6009
 epoch: 64, train_loss: 0.6975, test_loss: 0.9749, test_f1: 0.5513
 epoch: 65, train_loss: 0.7080, test_loss: 0.9420, test_f1: 0.6051
 epoch: 66, train_loss: 0.7139, test_loss: 0.9704, test_f1: 0.5548
 epoch: 67, train_loss: 0.7005, test_loss: 1.0035, test_f1: 0.5452
 epoch: 68, train_loss: 0.6963, test_loss: 0.9934, test_f1: 0.5615
 epoch: 69, train_loss: 0.7045, test_loss: 1.0037, test_f1: 0.5758
 epoch: 70, train_loss: 0.7028, test_loss: 0.9821, test_f1: 0.6160
 epoch: 71, train_loss: 0.6939, test_loss: 0.9894, test_f1: 0.5469
 epoch: 72, train_loss: 0.6851, test_loss: 0.9157, test_f1: 0.5800
 epoch: 73, train_loss: 0.6928, test_loss: 1.0403, test_f1: 0.5865
 epoch: 74, train_loss: 0.6982, test_loss: 0.9620, test_f1: 0.5677
 epoch: 75, train_loss: 0.6787, test_loss: 1.0010, test_f1: 0.5535
 epoch: 76, train_loss: 0.6907, test_loss: 1.0118, test_f1: 0.5834
 epoch: 77, train_loss: 0.7089, test_loss: 1.0170, test_f1: 0.5632
 epoch: 78, train_loss: 0.6725, test_loss: 1.0220, test_f1: 0.5642
 epoch: 79, train_loss: 0.6891, test_loss: 0.9342, test_f1: 0.5838
 epoch: 80, train_loss: 0.6999, test_loss: 1.0516, test_f1: 0.5556
 epoch: 81, train_loss: 0.6807, test_loss: 0.9707, test_f1: 0.5791
 epoch: 82, train_loss: 0.6860, test_loss: 0.9567, test_f1: 0.5746
 epoch: 83, train_loss: 0.6682, test_loss: 1.0098, test_f1: 0.5802
 epoch: 84, train_loss: 0.6799, test_loss: 0.9938, test_f1: 0.6074
 epoch: 85, train_loss: 0.6902, test_loss: 1.0337, test_f1: 0.5832
 epoch: 86, train_loss: 0.6778, test_loss: 0.9866, test_f1: 0.5996
 epoch: 87, train_loss: 0.6625, test_loss: 1.0262, test_f1: 0.5752
 epoch: 88, train_loss: 0.6808, test_loss: 1.0690, test_f1: 0.5613
 epoch: 89, train_loss: 0.6779, test_loss: 0.9974, test_f1: 0.5990
 epoch: 90, train_loss: 0.6744, test_loss: 1.0200, test_f1: 0.5982
 epoch: 91, train_loss: 0.6709, test_loss: 1.1029, test_f1: 0.5566
 epoch: 92, train_loss: 0.6659, test_loss: 1.0400, test_f1: 0.5660
 epoch: 93, train_loss: 0.6708, test_loss: 1.0059, test_f1: 0.5725
 epoch: 94, train_loss: 0.6697, test_loss: 1.0377, test_f1: 0.5481
 epoch: 95, train_loss: 0.6578, test_loss: 0.9871, test_f1: 0.5767
 epoch: 96, train_loss: 0.6604, test_loss: 1.0021, test_f1: 0.5835
 epoch: 97, train_loss: 0.6581, test_loss: 1.0842, test_f1: 0.5772
 epoch: 98, train_loss: 0.6669, test_loss: 1.1064, test_f1: 0.5459
 epoch: 99, train_loss: 0.6693, test_loss: 1.0452, test_f1: 0.5768
##################ITERATION #5 ****************************************
 epoch: 0, train_loss: 1.3477, test_loss: 1.3539, test_f1: 0.3193
 epoch: 1, train_loss: 1.2448, test_loss: 1.2979, test_f1: 0.3364
 epoch: 2, train_loss: 1.2004, test_loss: 1.2401, test_f1: 0.3329
 epoch: 3, train_loss: 1.1468, test_loss: 1.2127, test_f1: 0.3528
 epoch: 4, train_loss: 1.1428, test_loss: 1.1784, test_f1: 0.3774
 epoch: 5, train_loss: 1.1074, test_loss: 1.1693, test_f1: 0.4407
 epoch: 6, train_loss: 1.0662, test_loss: 1.1158, test_f1: 0.4216
 epoch: 7, train_loss: 1.0588, test_loss: 1.1272, test_f1: 0.4302
 epoch: 8, train_loss: 1.0289, test_loss: 1.0796, test_f1: 0.4851
 epoch: 9, train_loss: 1.0102, test_loss: 1.1168, test_f1: 0.4373
 epoch: 10, train_loss: 0.9912, test_loss: 1.0874, test_f1: 0.4499
 epoch: 11, train_loss: 0.9684, test_loss: 1.0297, test_f1: 0.5624
 epoch: 12, train_loss: 0.9485, test_loss: 1.0190, test_f1: 0.5786
 epoch: 13, train_loss: 0.9464, test_loss: 1.0375, test_f1: 0.5071
 epoch: 14, train_loss: 0.9312, test_loss: 1.0130, test_f1: 0.5476
 epoch: 15, train_loss: 0.9197, test_loss: 1.0032, test_f1: 0.5661
 epoch: 16, train_loss: 0.9131, test_loss: 0.9904, test_f1: 0.5622
 epoch: 17, train_loss: 0.8974, test_loss: 1.0276, test_f1: 0.5501
 epoch: 18, train_loss: 0.8882, test_loss: 1.0078, test_f1: 0.5473
 epoch: 19, train_loss: 0.8801, test_loss: 1.0193, test_f1: 0.5614
 epoch: 20, train_loss: 0.8400, test_loss: 0.9752, test_f1: 0.5399
 epoch: 21, train_loss: 0.8530, test_loss: 0.9958, test_f1: 0.5451
 epoch: 22, train_loss: 0.8453, test_loss: 0.9849, test_f1: 0.5361
 epoch: 23, train_loss: 0.8508, test_loss: 0.9647, test_f1: 0.5932
 epoch: 24, train_loss: 0.8230, test_loss: 0.9978, test_f1: 0.5486
 epoch: 25, train_loss: 0.8306, test_loss: 0.9446, test_f1: 0.5853
 epoch: 26, train_loss: 0.8229, test_loss: 1.0027, test_f1: 0.5582
 epoch: 27, train_loss: 0.8107, test_loss: 0.9684, test_f1: 0.5807
 epoch: 28, train_loss: 0.8122, test_loss: 1.1480, test_f1: 0.5204
 epoch: 29, train_loss: 0.7879, test_loss: 1.0792, test_f1: 0.5468
 epoch: 30, train_loss: 0.7831, test_loss: 1.0833, test_f1: 0.5508
 epoch: 31, train_loss: 0.7963, test_loss: 0.9674, test_f1: 0.5897
 epoch: 32, train_loss: 0.7901, test_loss: 0.9866, test_f1: 0.5634
 epoch: 33, train_loss: 0.7857, test_loss: 1.1473, test_f1: 0.5520
 epoch: 34, train_loss: 0.7712, test_loss: 1.1239, test_f1: 0.5600
 epoch: 35, train_loss: 0.7861, test_loss: 1.0343, test_f1: 0.5425
 epoch: 36, train_loss: 0.7690, test_loss: 1.3596, test_f1: 0.5570
 epoch: 37, train_loss: 0.7691, test_loss: 1.2442, test_f1: 0.5585
 epoch: 38, train_loss: 0.7649, test_loss: 1.2885, test_f1: 0.5331
 epoch: 39, train_loss: 0.7546, test_loss: 1.2095, test_f1: 0.5682
 epoch: 40, train_loss: 0.7521, test_loss: 1.2514, test_f1: 0.5144
 epoch: 41, train_loss: 0.7525, test_loss: 1.3033, test_f1: 0.5327
 epoch: 42, train_loss: 0.7502, test_loss: 1.4294, test_f1: 0.5533
 epoch: 43, train_loss: 0.7525, test_loss: 1.1616, test_f1: 0.5597
 epoch: 44, train_loss: 0.7482, test_loss: 1.0354, test_f1: 0.5699
 epoch: 45, train_loss: 0.7371, test_loss: 1.3285, test_f1: 0.5364
 epoch: 46, train_loss: 0.7561, test_loss: 1.2822, test_f1: 0.5362
 epoch: 47, train_loss: 0.7532, test_loss: 1.1849, test_f1: 0.5472
 epoch: 48, train_loss: 0.7460, test_loss: 1.2064, test_f1: 0.5221
 epoch: 49, train_loss: 0.7398, test_loss: 1.2948, test_f1: 0.5740
 epoch: 50, train_loss: 0.7373, test_loss: 1.4043, test_f1: 0.5263
 epoch: 51, train_loss: 0.7325, test_loss: 1.3269, test_f1: 0.5651
 epoch: 52, train_loss: 0.7115, test_loss: 1.3132, test_f1: 0.5556
 epoch: 53, train_loss: 0.7082, test_loss: 1.5441, test_f1: 0.5544
 epoch: 54, train_loss: 0.7303, test_loss: 1.2958, test_f1: 0.5495
 epoch: 55, train_loss: 0.7001, test_loss: 1.3831, test_f1: 0.5436
 epoch: 56, train_loss: 0.7254, test_loss: 1.5555, test_f1: 0.5336
 epoch: 57, train_loss: 0.7105, test_loss: 1.5155, test_f1: 0.5273
 epoch: 58, train_loss: 0.7137, test_loss: 1.4900, test_f1: 0.5358
 epoch: 59, train_loss: 0.7028, test_loss: 1.4149, test_f1: 0.5235
 epoch: 60, train_loss: 0.7130, test_loss: 1.3696, test_f1: 0.5309
 epoch: 61, train_loss: 0.7172, test_loss: 1.4569, test_f1: 0.5204
 epoch: 62, train_loss: 0.7018, test_loss: 1.4228, test_f1: 0.5333
 epoch: 63, train_loss: 0.7072, test_loss: 1.6070, test_f1: 0.5246
 epoch: 64, train_loss: 0.6902, test_loss: 1.5666, test_f1: 0.5286
 epoch: 65, train_loss: 0.6966, test_loss: 1.5992, test_f1: 0.5493
 epoch: 66, train_loss: 0.7081, test_loss: 1.6361, test_f1: 0.5578
 epoch: 67, train_loss: 0.6979, test_loss: 1.5309, test_f1: 0.5354
 epoch: 68, train_loss: 0.6837, test_loss: 1.5212, test_f1: 0.5590
 epoch: 69, train_loss: 0.6935, test_loss: 1.5155, test_f1: 0.5268
 epoch: 70, train_loss: 0.7139, test_loss: 1.5355, test_f1: 0.5323
 epoch: 71, train_loss: 0.6989, test_loss: 1.6236, test_f1: 0.5248
 epoch: 72, train_loss: 0.6863, test_loss: 1.5834, test_f1: 0.5440
 epoch: 73, train_loss: 0.6978, test_loss: 1.5104, test_f1: 0.5314
 epoch: 74, train_loss: 0.6911, test_loss: 1.7343, test_f1: 0.5521
 epoch: 75, train_loss: 0.6895, test_loss: 1.6885, test_f1: 0.5526
 epoch: 76, train_loss: 0.6921, test_loss: 1.7341, test_f1: 0.5393
 epoch: 77, train_loss: 0.6864, test_loss: 1.5747, test_f1: 0.5459
 epoch: 78, train_loss: 0.6828, test_loss: 1.9219, test_f1: 0.5566
 epoch: 79, train_loss: 0.6780, test_loss: 1.3324, test_f1: 0.5562
 epoch: 80, train_loss: 0.6704, test_loss: 1.6423, test_f1: 0.5544
 epoch: 81, train_loss: 0.6771, test_loss: 1.8216, test_f1: 0.5148
 epoch: 82, train_loss: 0.6864, test_loss: 1.7991, test_f1: 0.5339
 epoch: 83, train_loss: 0.6662, test_loss: 1.6298, test_f1: 0.5416
 epoch: 84, train_loss: 0.6869, test_loss: 1.6285, test_f1: 0.5363
 epoch: 85, train_loss: 0.6971, test_loss: 1.7320, test_f1: 0.5067
 epoch: 86, train_loss: 0.6784, test_loss: 1.6592, test_f1: 0.5348
 epoch: 87, train_loss: 0.6843, test_loss: 1.7232, test_f1: 0.5075
 epoch: 88, train_loss: 0.6829, test_loss: 1.8920, test_f1: 0.5193
 epoch: 89, train_loss: 0.6844, test_loss: 1.7794, test_f1: 0.5393
 epoch: 90, train_loss: 0.6702, test_loss: 1.6380, test_f1: 0.5078
 epoch: 91, train_loss: 0.6707, test_loss: 1.7146, test_f1: 0.5277
 epoch: 92, train_loss: 0.6825, test_loss: 1.8812, test_f1: 0.5316
 epoch: 93, train_loss: 0.6814, test_loss: 1.9861, test_f1: 0.5201
 epoch: 94, train_loss: 0.6738, test_loss: 1.7254, test_f1: 0.5239
 epoch: 95, train_loss: 0.6957, test_loss: 1.8130, test_f1: 0.5400
 epoch: 96, train_loss: 0.6793, test_loss: 1.8618, test_f1: 0.5327
 epoch: 97, train_loss: 0.6680, test_loss: 1.7920, test_f1: 0.5427
 epoch: 98, train_loss: 0.6583, test_loss: 1.8986, test_f1: 0.5354
 epoch: 99, train_loss: 0.6649, test_loss: 1.9063, test_f1: 0.5001
##################ITERATION #6 ****************************************
 epoch: 0, train_loss: 1.6599, test_loss: 1.3172, test_f1: 0.2281
 epoch: 1, train_loss: 1.2946, test_loss: 1.3249, test_f1: 0.3071
 epoch: 2, train_loss: 1.2339, test_loss: 1.2592, test_f1: 0.3234
 epoch: 3, train_loss: 1.2307, test_loss: 1.2396, test_f1: 0.3670
 epoch: 4, train_loss: 1.1834, test_loss: 1.2135, test_f1: 0.3774
 epoch: 5, train_loss: 1.1683, test_loss: 1.1883, test_f1: 0.4272
 epoch: 6, train_loss: 1.1174, test_loss: 1.1666, test_f1: 0.4361
 epoch: 7, train_loss: 1.0884, test_loss: 1.1359, test_f1: 0.4968
 epoch: 8, train_loss: 1.0569, test_loss: 1.1078, test_f1: 0.5175
 epoch: 9, train_loss: 1.0346, test_loss: 1.1253, test_f1: 0.4859
 epoch: 10, train_loss: 1.0049, test_loss: 1.1066, test_f1: 0.4919
 epoch: 11, train_loss: 1.0006, test_loss: 1.1799, test_f1: 0.4713
 epoch: 12, train_loss: 0.9822, test_loss: 1.0886, test_f1: 0.5209
 epoch: 13, train_loss: 0.9751, test_loss: 1.0742, test_f1: 0.5092
 epoch: 14, train_loss: 0.9518, test_loss: 1.1920, test_f1: 0.4085
 epoch: 15, train_loss: 0.9326, test_loss: 1.1108, test_f1: 0.5049
 epoch: 16, train_loss: 0.9203, test_loss: 1.0522, test_f1: 0.4963
 epoch: 17, train_loss: 0.9239, test_loss: 1.1213, test_f1: 0.5359
 epoch: 18, train_loss: 0.9210, test_loss: 1.0893, test_f1: 0.5219
 epoch: 19, train_loss: 0.9137, test_loss: 1.1085, test_f1: 0.5455
 epoch: 20, train_loss: 0.8952, test_loss: 1.1385, test_f1: 0.4966
 epoch: 21, train_loss: 0.8742, test_loss: 1.0890, test_f1: 0.5461
 epoch: 22, train_loss: 0.8664, test_loss: 1.1222, test_f1: 0.5249
 epoch: 23, train_loss: 0.8741, test_loss: 1.1289, test_f1: 0.5254
 epoch: 24, train_loss: 0.8525, test_loss: 1.1803, test_f1: 0.5260
 epoch: 25, train_loss: 0.8339, test_loss: 1.2209, test_f1: 0.5252
 epoch: 26, train_loss: 0.8438, test_loss: 1.1387, test_f1: 0.5493
 epoch: 27, train_loss: 0.8412, test_loss: 1.1908, test_f1: 0.5310
 epoch: 28, train_loss: 0.8204, test_loss: 1.1256, test_f1: 0.5849
 epoch: 29, train_loss: 0.8080, test_loss: 1.1984, test_f1: 0.5443
 epoch: 30, train_loss: 0.8129, test_loss: 1.1739, test_f1: 0.5340
 epoch: 31, train_loss: 0.8054, test_loss: 1.5643, test_f1: 0.4627
 epoch: 32, train_loss: 0.8099, test_loss: 1.1849, test_f1: 0.5412
 epoch: 33, train_loss: 0.7907, test_loss: 1.1471, test_f1: 0.5898
 epoch: 34, train_loss: 0.7873, test_loss: 1.2585, test_f1: 0.5160
 epoch: 35, train_loss: 0.7869, test_loss: 1.1857, test_f1: 0.5527
 epoch: 36, train_loss: 0.7677, test_loss: 1.2848, test_f1: 0.5355
 epoch: 37, train_loss: 0.7782, test_loss: 1.3704, test_f1: 0.5116
 epoch: 38, train_loss: 0.7666, test_loss: 1.2452, test_f1: 0.5796
 epoch: 39, train_loss: 0.7624, test_loss: 1.3139, test_f1: 0.5390
 epoch: 40, train_loss: 0.7551, test_loss: 1.2999, test_f1: 0.5401
 epoch: 41, train_loss: 0.7482, test_loss: 1.2980, test_f1: 0.5510
 epoch: 42, train_loss: 0.7482, test_loss: 1.2626, test_f1: 0.5990
 epoch: 43, train_loss: 0.7437, test_loss: 1.2052, test_f1: 0.5592
 epoch: 44, train_loss: 0.7352, test_loss: 1.2619, test_f1: 0.5701
 epoch: 45, train_loss: 0.7323, test_loss: 1.2058, test_f1: 0.5666
 epoch: 46, train_loss: 0.7264, test_loss: 1.2567, test_f1: 0.5038
 epoch: 47, train_loss: 0.7285, test_loss: 1.2885, test_f1: 0.5552
 epoch: 48, train_loss: 0.7434, test_loss: 1.3424, test_f1: 0.5349
 epoch: 49, train_loss: 0.7127, test_loss: 1.1840, test_f1: 0.5556
 epoch: 50, train_loss: 0.7092, test_loss: 1.2204, test_f1: 0.5905
 epoch: 51, train_loss: 0.6980, test_loss: 1.1983, test_f1: 0.5730
 epoch: 52, train_loss: 0.7223, test_loss: 1.2004, test_f1: 0.5578
 epoch: 53, train_loss: 0.6823, test_loss: 1.2474, test_f1: 0.5604
 epoch: 54, train_loss: 0.6869, test_loss: 1.2448, test_f1: 0.5475
 epoch: 55, train_loss: 0.6865, test_loss: 1.2868, test_f1: 0.5509
 epoch: 56, train_loss: 0.6861, test_loss: 1.2704, test_f1: 0.5601
 epoch: 57, train_loss: 0.6827, test_loss: 1.3051, test_f1: 0.5439
 epoch: 58, train_loss: 0.6721, test_loss: 1.3367, test_f1: 0.5404
 epoch: 59, train_loss: 0.6817, test_loss: 1.3201, test_f1: 0.5559
 epoch: 60, train_loss: 0.6894, test_loss: 1.2642, test_f1: 0.5937
 epoch: 61, train_loss: 0.6885, test_loss: 1.3912, test_f1: 0.5473
 epoch: 62, train_loss: 0.6921, test_loss: 1.3042, test_f1: 0.5713
 epoch: 63, train_loss: 0.6753, test_loss: 1.3907, test_f1: 0.5451
 epoch: 64, train_loss: 0.6769, test_loss: 1.3720, test_f1: 0.5446
 epoch: 65, train_loss: 0.6710, test_loss: 1.3788, test_f1: 0.5312
 epoch: 66, train_loss: 0.6571, test_loss: 1.3610, test_f1: 0.5576
 epoch: 67, train_loss: 0.6750, test_loss: 1.3706, test_f1: 0.5221
 epoch: 68, train_loss: 0.6660, test_loss: 1.3366, test_f1: 0.5546
 epoch: 69, train_loss: 0.6709, test_loss: 1.4016, test_f1: 0.5380
 epoch: 70, train_loss: 0.6566, test_loss: 1.4003, test_f1: 0.5306
 epoch: 71, train_loss: 0.6559, test_loss: 1.2801, test_f1: 0.5442
 epoch: 72, train_loss: 0.6722, test_loss: 1.4129, test_f1: 0.5215
 epoch: 73, train_loss: 0.6476, test_loss: 1.3263, test_f1: 0.5473
 epoch: 74, train_loss: 0.6429, test_loss: 1.4088, test_f1: 0.5456
 epoch: 75, train_loss: 0.6541, test_loss: 1.2598, test_f1: 0.5482
 epoch: 76, train_loss: 0.6551, test_loss: 1.3682, test_f1: 0.5577
 epoch: 77, train_loss: 0.6514, test_loss: 1.3929, test_f1: 0.5370
 epoch: 78, train_loss: 0.6492, test_loss: 1.2893, test_f1: 0.5429
 epoch: 79, train_loss: 0.6408, test_loss: 1.4034, test_f1: 0.5421
 epoch: 80, train_loss: 0.6492, test_loss: 1.3761, test_f1: 0.5452
 epoch: 81, train_loss: 0.6469, test_loss: 1.4061, test_f1: 0.5214
 epoch: 82, train_loss: 0.6541, test_loss: 1.3109, test_f1: 0.5561
 epoch: 83, train_loss: 0.6359, test_loss: 1.3722, test_f1: 0.5215
 epoch: 84, train_loss: 0.6461, test_loss: 1.2399, test_f1: 0.5488
 epoch: 85, train_loss: 0.6370, test_loss: 1.3833, test_f1: 0.5427
 epoch: 86, train_loss: 0.6451, test_loss: 1.4036, test_f1: 0.5440
 epoch: 87, train_loss: 0.6399, test_loss: 1.3891, test_f1: 0.5538
 epoch: 88, train_loss: 0.6501, test_loss: 1.4793, test_f1: 0.5379
 epoch: 89, train_loss: 0.6467, test_loss: 1.3425, test_f1: 0.5533
 epoch: 90, train_loss: 0.6340, test_loss: 1.4421, test_f1: 0.5404
 epoch: 91, train_loss: 0.6243, test_loss: 1.3215, test_f1: 0.5315
 epoch: 92, train_loss: 0.6303, test_loss: 1.3849, test_f1: 0.5647
 epoch: 93, train_loss: 0.6335, test_loss: 1.3914, test_f1: 0.5265
 epoch: 94, train_loss: 0.6259, test_loss: 1.2802, test_f1: 0.5458
 epoch: 95, train_loss: 0.6481, test_loss: 1.3784, test_f1: 0.5422
 epoch: 96, train_loss: 0.6501, test_loss: 1.3428, test_f1: 0.5540
 epoch: 97, train_loss: 0.6242, test_loss: 1.3205, test_f1: 0.5394
 epoch: 98, train_loss: 0.6322, test_loss: 1.2843, test_f1: 0.5546
 epoch: 99, train_loss: 0.6268, test_loss: 1.3698, test_f1: 0.5340
##################ITERATION #7 ****************************************
 epoch: 0, train_loss: 1.3746, test_loss: 1.3677, test_f1: 0.2281
 epoch: 1, train_loss: 1.1411, test_loss: 1.2774, test_f1: 0.3134
 epoch: 2, train_loss: 1.0903, test_loss: 1.1292, test_f1: 0.4165
 epoch: 3, train_loss: 1.0599, test_loss: 1.1012, test_f1: 0.4857
 epoch: 4, train_loss: 1.0400, test_loss: 1.1166, test_f1: 0.4691
 epoch: 5, train_loss: 1.0119, test_loss: 1.0700, test_f1: 0.5231
 epoch: 6, train_loss: 0.9832, test_loss: 1.0828, test_f1: 0.4988
 epoch: 7, train_loss: 0.9644, test_loss: 1.0512, test_f1: 0.5345
 epoch: 8, train_loss: 0.9528, test_loss: 1.1324, test_f1: 0.5125
 epoch: 9, train_loss: 0.9409, test_loss: 1.0225, test_f1: 0.5333
 epoch: 10, train_loss: 0.9490, test_loss: 1.0639, test_f1: 0.5207
 epoch: 11, train_loss: 0.9343, test_loss: 1.3040, test_f1: 0.4450
 epoch: 12, train_loss: 0.9383, test_loss: 1.0231, test_f1: 0.5171
 epoch: 13, train_loss: 0.9037, test_loss: 1.0521, test_f1: 0.5283
 epoch: 14, train_loss: 0.8923, test_loss: 1.0483, test_f1: 0.5416
 epoch: 15, train_loss: 0.8838, test_loss: 1.1456, test_f1: 0.4853
 epoch: 16, train_loss: 0.8764, test_loss: 1.0390, test_f1: 0.5567
 epoch: 17, train_loss: 0.8803, test_loss: 1.0422, test_f1: 0.5300
 epoch: 18, train_loss: 0.8681, test_loss: 1.0833, test_f1: 0.5277
 epoch: 19, train_loss: 0.8554, test_loss: 1.0810, test_f1: 0.5527
 epoch: 20, train_loss: 0.8724, test_loss: 1.1098, test_f1: 0.5366
 epoch: 21, train_loss: 0.8464, test_loss: 1.0310, test_f1: 0.5452
 epoch: 22, train_loss: 0.8344, test_loss: 1.1892, test_f1: 0.5117
 epoch: 23, train_loss: 0.8388, test_loss: 1.0719, test_f1: 0.5417
 epoch: 24, train_loss: 0.8321, test_loss: 1.4400, test_f1: 0.4496
 epoch: 25, train_loss: 0.8173, test_loss: 1.0748, test_f1: 0.5260
 epoch: 26, train_loss: 0.8024, test_loss: 1.0937, test_f1: 0.5495
 epoch: 27, train_loss: 0.8126, test_loss: 1.0763, test_f1: 0.5544
 epoch: 28, train_loss: 0.8014, test_loss: 1.1147, test_f1: 0.5799
 epoch: 29, train_loss: 0.7973, test_loss: 1.0187, test_f1: 0.5713
 epoch: 30, train_loss: 0.8037, test_loss: 1.1700, test_f1: 0.5012
 epoch: 31, train_loss: 0.7981, test_loss: 1.1287, test_f1: 0.5717
 epoch: 32, train_loss: 0.7932, test_loss: 1.0864, test_f1: 0.5617
 epoch: 33, train_loss: 0.7817, test_loss: 1.0421, test_f1: 0.5488
 epoch: 34, train_loss: 0.7775, test_loss: 1.1439, test_f1: 0.5705
 epoch: 35, train_loss: 0.7977, test_loss: 1.2207, test_f1: 0.5482
 epoch: 36, train_loss: 0.7712, test_loss: 1.0849, test_f1: 0.5669
 epoch: 37, train_loss: 0.7785, test_loss: 1.1191, test_f1: 0.5586
 epoch: 38, train_loss: 0.7615, test_loss: 1.0130, test_f1: 0.5791
 epoch: 39, train_loss: 0.7667, test_loss: 1.0632, test_f1: 0.5304
 epoch: 40, train_loss: 0.7708, test_loss: 1.3456, test_f1: 0.5436
 epoch: 41, train_loss: 0.7619, test_loss: 1.2236, test_f1: 0.5739
 epoch: 42, train_loss: 0.7456, test_loss: 1.1839, test_f1: 0.5613
 epoch: 43, train_loss: 0.7574, test_loss: 1.3226, test_f1: 0.5543
 epoch: 44, train_loss: 0.7473, test_loss: 1.4193, test_f1: 0.5162
 epoch: 45, train_loss: 0.7739, test_loss: 1.2781, test_f1: 0.5539
 epoch: 46, train_loss: 0.7537, test_loss: 1.2115, test_f1: 0.5449
 epoch: 47, train_loss: 0.7378, test_loss: 1.2377, test_f1: 0.5668
 epoch: 48, train_loss: 0.7724, test_loss: 1.1434, test_f1: 0.5544
 epoch: 49, train_loss: 0.7289, test_loss: 1.3339, test_f1: 0.5538
 epoch: 50, train_loss: 0.7423, test_loss: 1.2021, test_f1: 0.5745
 epoch: 51, train_loss: 0.7305, test_loss: 1.2266, test_f1: 0.5693
 epoch: 52, train_loss: 0.7189, test_loss: 1.2037, test_f1: 0.5547
 epoch: 53, train_loss: 0.7394, test_loss: 1.1909, test_f1: 0.5728
 epoch: 54, train_loss: 0.7092, test_loss: 1.1805, test_f1: 0.5664
 epoch: 55, train_loss: 0.7127, test_loss: 1.1874, test_f1: 0.5624
 epoch: 56, train_loss: 0.7311, test_loss: 1.2190, test_f1: 0.5723
 epoch: 57, train_loss: 0.7169, test_loss: 1.2252, test_f1: 0.5731
 epoch: 58, train_loss: 0.6988, test_loss: 1.3382, test_f1: 0.5754
 epoch: 59, train_loss: 0.7008, test_loss: 1.2966, test_f1: 0.5641
 epoch: 60, train_loss: 0.7003, test_loss: 1.2624, test_f1: 0.5626
 epoch: 61, train_loss: 0.7386, test_loss: 1.1958, test_f1: 0.5672
 epoch: 62, train_loss: 0.7036, test_loss: 1.3434, test_f1: 0.5604
 epoch: 63, train_loss: 0.7257, test_loss: 1.2441, test_f1: 0.5729
 epoch: 64, train_loss: 0.7095, test_loss: 1.1960, test_f1: 0.5559
 epoch: 65, train_loss: 0.7169, test_loss: 1.2273, test_f1: 0.5606
 epoch: 66, train_loss: 0.7134, test_loss: 1.2724, test_f1: 0.5617
 epoch: 67, train_loss: 0.7019, test_loss: 1.2257, test_f1: 0.5888
 epoch: 68, train_loss: 0.6880, test_loss: 1.1453, test_f1: 0.5778
 epoch: 69, train_loss: 0.6965, test_loss: 1.2540, test_f1: 0.5605
 epoch: 70, train_loss: 0.6922, test_loss: 1.2563, test_f1: 0.5673
 epoch: 71, train_loss: 0.6938, test_loss: 1.3168, test_f1: 0.5538
 epoch: 72, train_loss: 0.6948, test_loss: 1.2856, test_f1: 0.5659
 epoch: 73, train_loss: 0.6950, test_loss: 1.3221, test_f1: 0.5661
 epoch: 74, train_loss: 0.6925, test_loss: 1.3858, test_f1: 0.5622
 epoch: 75, train_loss: 0.6840, test_loss: 1.1819, test_f1: 0.5465
 epoch: 76, train_loss: 0.6985, test_loss: 1.3065, test_f1: 0.5639
 epoch: 77, train_loss: 0.6916, test_loss: 1.1630, test_f1: 0.5528
 epoch: 78, train_loss: 0.7051, test_loss: 1.2074, test_f1: 0.5805
 epoch: 79, train_loss: 0.6942, test_loss: 1.2653, test_f1: 0.5783
 epoch: 80, train_loss: 0.6956, test_loss: 1.1288, test_f1: 0.5692
 epoch: 81, train_loss: 0.6861, test_loss: 1.3501, test_f1: 0.5665
 epoch: 82, train_loss: 0.6886, test_loss: 1.2431, test_f1: 0.5735
 epoch: 83, train_loss: 0.6889, test_loss: 1.1728, test_f1: 0.5812
 epoch: 84, train_loss: 0.6727, test_loss: 1.3764, test_f1: 0.5547
 epoch: 85, train_loss: 0.6835, test_loss: 1.2590, test_f1: 0.5639
 epoch: 86, train_loss: 0.6656, test_loss: 1.3680, test_f1: 0.5685
 epoch: 87, train_loss: 0.6604, test_loss: 1.2886, test_f1: 0.5732
 epoch: 88, train_loss: 0.6776, test_loss: 1.3132, test_f1: 0.5344
 epoch: 89, train_loss: 0.6676, test_loss: 1.4213, test_f1: 0.5677
 epoch: 90, train_loss: 0.6459, test_loss: 1.3284, test_f1: 0.5629
 epoch: 91, train_loss: 0.6796, test_loss: 1.4003, test_f1: 0.5538
 epoch: 92, train_loss: 0.6763, test_loss: 1.2992, test_f1: 0.5444
 epoch: 93, train_loss: 0.6680, test_loss: 1.3986, test_f1: 0.5696
 epoch: 94, train_loss: 0.6551, test_loss: 1.2431, test_f1: 0.5565
 epoch: 95, train_loss: 0.6782, test_loss: 1.3462, test_f1: 0.5487
 epoch: 96, train_loss: 0.6737, test_loss: 1.3554, test_f1: 0.5693
 epoch: 97, train_loss: 0.6746, test_loss: 1.3294, test_f1: 0.5623
 epoch: 98, train_loss: 0.6723, test_loss: 1.3908, test_f1: 0.5577
 epoch: 99, train_loss: 0.6655, test_loss: 1.3270, test_f1: 0.5396
##################ITERATION #8 ****************************************
 epoch: 0, train_loss: 1.3067, test_loss: 1.4123, test_f1: 0.2404
 epoch: 1, train_loss: 1.1242, test_loss: 1.2769, test_f1: 0.2713
 epoch: 2, train_loss: 1.0858, test_loss: 1.1180, test_f1: 0.5137
 epoch: 3, train_loss: 1.0576, test_loss: 1.0781, test_f1: 0.5241
 epoch: 4, train_loss: 1.0352, test_loss: 1.0556, test_f1: 0.5396
 epoch: 5, train_loss: 1.0026, test_loss: 1.0336, test_f1: 0.5563
 epoch: 6, train_loss: 0.9963, test_loss: 1.0442, test_f1: 0.5337
 epoch: 7, train_loss: 0.9784, test_loss: 1.0260, test_f1: 0.5266
 epoch: 8, train_loss: 0.9695, test_loss: 1.0328, test_f1: 0.5208
 epoch: 9, train_loss: 0.9678, test_loss: 0.9974, test_f1: 0.5711
 epoch: 10, train_loss: 0.9424, test_loss: 1.0199, test_f1: 0.5625
 epoch: 11, train_loss: 0.9308, test_loss: 1.0077, test_f1: 0.5619
 epoch: 12, train_loss: 0.9174, test_loss: 1.0322, test_f1: 0.5077
 epoch: 13, train_loss: 0.9060, test_loss: 1.0029, test_f1: 0.5667
 epoch: 14, train_loss: 0.9086, test_loss: 0.9846, test_f1: 0.5646
 epoch: 15, train_loss: 0.8939, test_loss: 1.0071, test_f1: 0.5526
 epoch: 16, train_loss: 0.8987, test_loss: 1.0005, test_f1: 0.5644
 epoch: 17, train_loss: 0.8689, test_loss: 1.0009, test_f1: 0.5697
 epoch: 18, train_loss: 0.8681, test_loss: 0.9969, test_f1: 0.5587
 epoch: 19, train_loss: 0.8604, test_loss: 0.9907, test_f1: 0.5372
 epoch: 20, train_loss: 0.8673, test_loss: 1.0202, test_f1: 0.5755
 epoch: 21, train_loss: 0.8385, test_loss: 0.9953, test_f1: 0.5769
 epoch: 22, train_loss: 0.8532, test_loss: 1.0038, test_f1: 0.5106
 epoch: 23, train_loss: 0.8326, test_loss: 1.0833, test_f1: 0.5478
 epoch: 24, train_loss: 0.8341, test_loss: 1.0544, test_f1: 0.5365
 epoch: 25, train_loss: 0.8174, test_loss: 1.1955, test_f1: 0.4886
 epoch: 26, train_loss: 0.8307, test_loss: 1.1229, test_f1: 0.5503
 epoch: 27, train_loss: 0.8183, test_loss: 1.0336, test_f1: 0.5624
 epoch: 28, train_loss: 0.8132, test_loss: 1.0841, test_f1: 0.5448
 epoch: 29, train_loss: 0.8078, test_loss: 1.1246, test_f1: 0.5410
 epoch: 30, train_loss: 0.8066, test_loss: 1.0215, test_f1: 0.5820
 epoch: 31, train_loss: 0.8026, test_loss: 1.1199, test_f1: 0.5619
 epoch: 32, train_loss: 0.7945, test_loss: 1.0654, test_f1: 0.5610
 epoch: 33, train_loss: 0.7735, test_loss: 1.0683, test_f1: 0.5531
 epoch: 34, train_loss: 0.7821, test_loss: 1.0199, test_f1: 0.5957
 epoch: 35, train_loss: 0.7728, test_loss: 0.9971, test_f1: 0.5810
 epoch: 36, train_loss: 0.7880, test_loss: 1.0437, test_f1: 0.5215
 epoch: 37, train_loss: 0.7664, test_loss: 1.0552, test_f1: 0.5531
 epoch: 38, train_loss: 0.7698, test_loss: 1.2024, test_f1: 0.5673
 epoch: 39, train_loss: 0.7650, test_loss: 1.1737, test_f1: 0.5456
 epoch: 40, train_loss: 0.7544, test_loss: 1.1582, test_f1: 0.5296
 epoch: 41, train_loss: 0.7646, test_loss: 1.0875, test_f1: 0.5688
 epoch: 42, train_loss: 0.7612, test_loss: 1.0661, test_f1: 0.5526
 epoch: 43, train_loss: 0.7601, test_loss: 1.0887, test_f1: 0.5902
 epoch: 44, train_loss: 0.7546, test_loss: 1.1508, test_f1: 0.5702
 epoch: 45, train_loss: 0.7576, test_loss: 1.1435, test_f1: 0.5716
 epoch: 46, train_loss: 0.7567, test_loss: 1.0635, test_f1: 0.5585
 epoch: 47, train_loss: 0.7461, test_loss: 1.2282, test_f1: 0.5572
 epoch: 48, train_loss: 0.7528, test_loss: 1.0816, test_f1: 0.5586
 epoch: 49, train_loss: 0.7229, test_loss: 1.2847, test_f1: 0.5460
 epoch: 50, train_loss: 0.7318, test_loss: 1.1521, test_f1: 0.5829
 epoch: 51, train_loss: 0.7136, test_loss: 1.1856, test_f1: 0.5641
 epoch: 52, train_loss: 0.7232, test_loss: 1.1845, test_f1: 0.5724
 epoch: 53, train_loss: 0.7324, test_loss: 1.1507, test_f1: 0.5523
 epoch: 54, train_loss: 0.7204, test_loss: 1.1065, test_f1: 0.5710
 epoch: 55, train_loss: 0.6954, test_loss: 1.1896, test_f1: 0.5613
 epoch: 56, train_loss: 0.7078, test_loss: 1.2285, test_f1: 0.5383
 epoch: 57, train_loss: 0.7045, test_loss: 1.1789, test_f1: 0.5477
 epoch: 58, train_loss: 0.7000, test_loss: 1.1562, test_f1: 0.5639
 epoch: 59, train_loss: 0.7073, test_loss: 1.2698, test_f1: 0.5357
 epoch: 60, train_loss: 0.6916, test_loss: 1.2362, test_f1: 0.5498
 epoch: 61, train_loss: 0.7144, test_loss: 1.2853, test_f1: 0.5389
 epoch: 62, train_loss: 0.7061, test_loss: 1.1520, test_f1: 0.5671
 epoch: 63, train_loss: 0.6873, test_loss: 1.2570, test_f1: 0.5566
 epoch: 64, train_loss: 0.6890, test_loss: 1.2204, test_f1: 0.5630
 epoch: 65, train_loss: 0.7089, test_loss: 1.3382, test_f1: 0.5378
 epoch: 66, train_loss: 0.7017, test_loss: 1.1828, test_f1: 0.5876
 epoch: 67, train_loss: 0.6881, test_loss: 1.3008, test_f1: 0.5424
 epoch: 68, train_loss: 0.6739, test_loss: 1.2942, test_f1: 0.5518
 epoch: 69, train_loss: 0.6944, test_loss: 1.3051, test_f1: 0.5779
 epoch: 70, train_loss: 0.6743, test_loss: 1.3143, test_f1: 0.5585
 epoch: 71, train_loss: 0.6846, test_loss: 1.2887, test_f1: 0.5693
 epoch: 72, train_loss: 0.6872, test_loss: 1.2523, test_f1: 0.5685
 epoch: 73, train_loss: 0.6838, test_loss: 1.3306, test_f1: 0.5773
 epoch: 74, train_loss: 0.6816, test_loss: 1.2406, test_f1: 0.5724
 epoch: 75, train_loss: 0.6754, test_loss: 1.4316, test_f1: 0.5632
 epoch: 76, train_loss: 0.6905, test_loss: 1.3399, test_f1: 0.5801
 epoch: 77, train_loss: 0.6734, test_loss: 1.2649, test_f1: 0.5515
 epoch: 78, train_loss: 0.6733, test_loss: 1.5070, test_f1: 0.5489
 epoch: 79, train_loss: 0.6858, test_loss: 1.2687, test_f1: 0.5736
 epoch: 80, train_loss: 0.6763, test_loss: 1.3609, test_f1: 0.5477
 epoch: 81, train_loss: 0.6686, test_loss: 1.3615, test_f1: 0.5612
 epoch: 82, train_loss: 0.6876, test_loss: 1.3323, test_f1: 0.5585
 epoch: 83, train_loss: 0.6747, test_loss: 1.4463, test_f1: 0.5621
 epoch: 84, train_loss: 0.6687, test_loss: 1.4252, test_f1: 0.5856
 epoch: 85, train_loss: 0.6839, test_loss: 1.4109, test_f1: 0.5402
 epoch: 86, train_loss: 0.6801, test_loss: 1.4412, test_f1: 0.5519
 epoch: 87, train_loss: 0.6558, test_loss: 1.3509, test_f1: 0.5481
 epoch: 88, train_loss: 0.6678, test_loss: 1.4106, test_f1: 0.5587
 epoch: 89, train_loss: 0.6620, test_loss: 1.5881, test_f1: 0.5535
 epoch: 90, train_loss: 0.6713, test_loss: 1.3805, test_f1: 0.5681
 epoch: 91, train_loss: 0.6481, test_loss: 1.3871, test_f1: 0.5742
 epoch: 92, train_loss: 0.6641, test_loss: 1.4791, test_f1: 0.5605
 epoch: 93, train_loss: 0.6772, test_loss: 1.4322, test_f1: 0.5822
 epoch: 94, train_loss: 0.6484, test_loss: 1.4903, test_f1: 0.5537
 epoch: 95, train_loss: 0.6474, test_loss: 1.3141, test_f1: 0.5767
 epoch: 96, train_loss: 0.6560, test_loss: 1.5330, test_f1: 0.5402
 epoch: 97, train_loss: 0.6699, test_loss: 1.3739, test_f1: 0.5613
 epoch: 98, train_loss: 0.6618, test_loss: 1.5419, test_f1: 0.5534
 epoch: 99, train_loss: 0.6614, test_loss: 1.4233, test_f1: 0.5765
##################ITERATION #9 ****************************************
 epoch: 0, train_loss: 1.3067, test_loss: 1.4450, test_f1: 0.2316
 epoch: 1, train_loss: 1.1175, test_loss: 1.3705, test_f1: 0.2958
 epoch: 2, train_loss: 1.0860, test_loss: 1.2538, test_f1: 0.3809
 epoch: 3, train_loss: 1.0749, test_loss: 1.4950, test_f1: 0.4534
 epoch: 4, train_loss: 1.0483, test_loss: 1.1105, test_f1: 0.4848
 epoch: 5, train_loss: 1.0027, test_loss: 1.1234, test_f1: 0.4946
 epoch: 6, train_loss: 1.0110, test_loss: 1.1161, test_f1: 0.5248
 epoch: 7, train_loss: 0.9692, test_loss: 1.0684, test_f1: 0.5241
 epoch: 8, train_loss: 0.9904, test_loss: 1.0705, test_f1: 0.4991
 epoch: 9, train_loss: 0.9472, test_loss: 1.0497, test_f1: 0.5275
 epoch: 10, train_loss: 0.9485, test_loss: 1.0627, test_f1: 0.5395
 epoch: 11, train_loss: 0.9435, test_loss: 1.0292, test_f1: 0.5460
 epoch: 12, train_loss: 0.9133, test_loss: 1.0036, test_f1: 0.5427
 epoch: 13, train_loss: 0.9122, test_loss: 1.0156, test_f1: 0.5556
 epoch: 14, train_loss: 0.8891, test_loss: 0.9977, test_f1: 0.5465
 epoch: 15, train_loss: 0.8747, test_loss: 1.0120, test_f1: 0.5369
 epoch: 16, train_loss: 0.8822, test_loss: 1.0012, test_f1: 0.5484
 epoch: 17, train_loss: 0.8573, test_loss: 0.9909, test_f1: 0.5533
 epoch: 18, train_loss: 0.8472, test_loss: 0.9880, test_f1: 0.5497
 epoch: 19, train_loss: 0.8530, test_loss: 0.9853, test_f1: 0.5433
 epoch: 20, train_loss: 0.8389, test_loss: 0.9940, test_f1: 0.5751
 epoch: 21, train_loss: 0.8273, test_loss: 0.9668, test_f1: 0.5672
 epoch: 22, train_loss: 0.8270, test_loss: 1.0651, test_f1: 0.5282
 epoch: 23, train_loss: 0.8241, test_loss: 1.0204, test_f1: 0.5621
 epoch: 24, train_loss: 0.8079, test_loss: 0.9922, test_f1: 0.5549
 epoch: 25, train_loss: 0.8047, test_loss: 0.9674, test_f1: 0.5545
 epoch: 26, train_loss: 0.8054, test_loss: 1.0471, test_f1: 0.5220
 epoch: 27, train_loss: 0.7863, test_loss: 0.9881, test_f1: 0.5824
 epoch: 28, train_loss: 0.7797, test_loss: 1.0371, test_f1: 0.5542
 epoch: 29, train_loss: 0.7683, test_loss: 0.9536, test_f1: 0.5774
 epoch: 30, train_loss: 0.7871, test_loss: 0.9507, test_f1: 0.5627
 epoch: 31, train_loss: 0.7977, test_loss: 1.0045, test_f1: 0.5829
 epoch: 32, train_loss: 0.7772, test_loss: 1.0017, test_f1: 0.5531
 epoch: 33, train_loss: 0.7690, test_loss: 0.9263, test_f1: 0.5643
 epoch: 34, train_loss: 0.7792, test_loss: 0.9572, test_f1: 0.5714
 epoch: 35, train_loss: 0.7668, test_loss: 1.0535, test_f1: 0.5588
 epoch: 36, train_loss: 0.7588, test_loss: 0.9512, test_f1: 0.5790
 epoch: 37, train_loss: 0.7479, test_loss: 1.0353, test_f1: 0.5672
 epoch: 38, train_loss: 0.7505, test_loss: 1.0785, test_f1: 0.5369
 epoch: 39, train_loss: 0.7394, test_loss: 0.9900, test_f1: 0.5511
 epoch: 40, train_loss: 0.7224, test_loss: 0.9861, test_f1: 0.5889
 epoch: 41, train_loss: 0.7364, test_loss: 1.0800, test_f1: 0.5284
 epoch: 42, train_loss: 0.7220, test_loss: 1.1079, test_f1: 0.5550
 epoch: 43, train_loss: 0.7214, test_loss: 1.0542, test_f1: 0.5619
 epoch: 44, train_loss: 0.7338, test_loss: 1.0922, test_f1: 0.5480
 epoch: 45, train_loss: 0.7296, test_loss: 1.1969, test_f1: 0.5323
 epoch: 46, train_loss: 0.7162, test_loss: 1.0807, test_f1: 0.5878
 epoch: 47, train_loss: 0.7160, test_loss: 1.1570, test_f1: 0.5617
 epoch: 48, train_loss: 0.7223, test_loss: 1.1602, test_f1: 0.5536
 epoch: 49, train_loss: 0.7004, test_loss: 1.0456, test_f1: 0.5683
 epoch: 50, train_loss: 0.6950, test_loss: 1.2839, test_f1: 0.5625
 epoch: 51, train_loss: 0.6924, test_loss: 1.0713, test_f1: 0.5410
 epoch: 52, train_loss: 0.6939, test_loss: 1.1314, test_f1: 0.5616
 epoch: 53, train_loss: 0.6907, test_loss: 1.2489, test_f1: 0.5734
 epoch: 54, train_loss: 0.6824, test_loss: 1.1821, test_f1: 0.5662
 epoch: 55, train_loss: 0.6745, test_loss: 1.1158, test_f1: 0.5567
 epoch: 56, train_loss: 0.6805, test_loss: 1.1318, test_f1: 0.5530
 epoch: 57, train_loss: 0.6817, test_loss: 1.2391, test_f1: 0.5524
 epoch: 58, train_loss: 0.6810, test_loss: 1.2238, test_f1: 0.5638
 epoch: 59, train_loss: 0.6725, test_loss: 1.2953, test_f1: 0.5502
 epoch: 60, train_loss: 0.6884, test_loss: 1.2384, test_f1: 0.5623
 epoch: 61, train_loss: 0.6618, test_loss: 1.2812, test_f1: 0.5562
 epoch: 62, train_loss: 0.6750, test_loss: 1.1715, test_f1: 0.5618
 epoch: 63, train_loss: 0.6707, test_loss: 1.5292, test_f1: 0.5487
 epoch: 64, train_loss: 0.6849, test_loss: 1.2853, test_f1: 0.5629
 epoch: 65, train_loss: 0.6724, test_loss: 1.2956, test_f1: 0.5599
 epoch: 66, train_loss: 0.6682, test_loss: 1.1594, test_f1: 0.5521
 epoch: 67, train_loss: 0.6577, test_loss: 1.1747, test_f1: 0.5791
 epoch: 68, train_loss: 0.6609, test_loss: 1.1597, test_f1: 0.5837
 epoch: 69, train_loss: 0.6722, test_loss: 1.1495, test_f1: 0.5651
 epoch: 70, train_loss: 0.6587, test_loss: 1.1431, test_f1: 0.5717
 epoch: 71, train_loss: 0.6380, test_loss: 1.2610, test_f1: 0.5601
 epoch: 72, train_loss: 0.6677, test_loss: 1.3884, test_f1: 0.5691
 epoch: 73, train_loss: 0.6518, test_loss: 1.1059, test_f1: 0.5770
 epoch: 74, train_loss: 0.6481, test_loss: 1.3602, test_f1: 0.5554
 epoch: 75, train_loss: 0.6434, test_loss: 1.1815, test_f1: 0.5673
 epoch: 76, train_loss: 0.6407, test_loss: 1.3303, test_f1: 0.5681
 epoch: 77, train_loss: 0.6600, test_loss: 1.2565, test_f1: 0.5797
 epoch: 78, train_loss: 0.6456, test_loss: 1.3000, test_f1: 0.5659
 epoch: 79, train_loss: 0.6417, test_loss: 1.2434, test_f1: 0.5641
 epoch: 80, train_loss: 0.6318, test_loss: 1.2156, test_f1: 0.5706
 epoch: 81, train_loss: 0.6494, test_loss: 1.2642, test_f1: 0.5702
 epoch: 82, train_loss: 0.6373, test_loss: 1.0958, test_f1: 0.5712
 epoch: 83, train_loss: 0.6383, test_loss: 1.3667, test_f1: 0.5637
 epoch: 84, train_loss: 0.6253, test_loss: 1.3651, test_f1: 0.5909
 epoch: 85, train_loss: 0.6339, test_loss: 1.3689, test_f1: 0.5882
 epoch: 86, train_loss: 0.6494, test_loss: 1.3262, test_f1: 0.5721
 epoch: 87, train_loss: 0.6417, test_loss: 1.2471, test_f1: 0.5863
 epoch: 88, train_loss: 0.6326, test_loss: 1.4139, test_f1: 0.5657
 epoch: 89, train_loss: 0.6300, test_loss: 1.3091, test_f1: 0.5723
 epoch: 90, train_loss: 0.6266, test_loss: 1.3010, test_f1: 0.5803
 epoch: 91, train_loss: 0.6363, test_loss: 1.4015, test_f1: 0.5887
 epoch: 92, train_loss: 0.6386, test_loss: 1.2836, test_f1: 0.5956
 epoch: 93, train_loss: 0.6224, test_loss: 1.3320, test_f1: 0.5623
 epoch: 94, train_loss: 0.6304, test_loss: 1.2752, test_f1: 0.5726
 epoch: 95, train_loss: 0.6171, test_loss: 1.2465, test_f1: 0.5910
 epoch: 96, train_loss: 0.6259, test_loss: 1.3652, test_f1: 0.5638
 epoch: 97, train_loss: 0.6204, test_loss: 1.3002, test_f1: 0.5643
 epoch: 98, train_loss: 0.6113, test_loss: 1.4916, test_f1: 0.5935
 epoch: 99, train_loss: 0.6284, test_loss: 1.6347, test_f1: 0.5773

Training completed in 409.07 seconds
Best F1: 0.6515 at epoch 88
Mean F1 across iterations: 0.6068  0.0184
========================FINAL RESULTS================================
FEGIN weighted F1: 0.6515  0.0184
python main.py --data ltspice_demos --representation component_pin --model FEGIN --layers 3 --hiddens 16 --batch_size 64 --lr 0.001 --emb_size 250 --epochs 100 --save_appendix component_pin_L3_H16_BS64_LR0.001_E250 --no_val
-----



STDERR:
  File "main.py", line 370, in <module>
    main()
  File "main.py", line 254, in main
    dataset = dataset_class(
  File "/home/philip/projects/ltspice_examples_code_repo/Circuit-Completion-Using-GNNs/component_classification_with_link_prediction_head/evaluation/FEGIN/kernel/circuit_datasets.py", line 15, in __init__
    self.data, self.slices = torch.load(self.processed_paths[0])
  File "/home/philip/.local/lib/python3.8/site-packages/torch/serialization.py", line 1040, in load
    warnings.warn(
  File "/usr/lib/python3.8/warnings.py", line 109, in _showwarnmsg
    sw(msg.message, msg.category, msg.filename, msg.lineno,
  File "main.py", line 47, in warn_with_traceback
    traceback.print_stack(file=log)
/home/philip/projects/ltspice_examples_code_repo/Circuit-Completion-Using-GNNs/component_classification_with_link_prediction_head/evaluation/FEGIN/kernel/circuit_datasets.py:15: FutureWarning: You are using `torch.load` with `weights_only=False` (the current default value), which uses the default pickle module implicitly. It is possible to construct malicious pickle data which will execute arbitrary code during unpickling (See https://github.com/pytorch/pytorch/blob/main/SECURITY.md#untrusted-models for more details). In a future release, the default value for `weights_only` will be flipped to `True`. This limits the functions that could be executed during unpickling. Arbitrary objects will no longer be allowed to be loaded via this mode unless they are explicitly allowlisted by the user via `torch.serialization.add_safe_globals`. We recommend you start setting `weights_only=True` for any use case where you don't have full control of the loaded file. Please open an issue on GitHub for any issues related to this experimental feature.
  self.data, self.slices = torch.load(self.processed_paths[0])
