STDOUT:
Results will be saved in /home/philip/projects/ltspice_examples_code_repo/Circuit-Completion-Using-GNNs/component_classification_with_link_prediction_head/evaluation/FEGIN/results/model_FEGIN_dataset_ltspice_examples
Command line input: python main.py --data ltspice_examples --representation component_pin --model FEGIN --layers 4 --hiddens 16 --batch_size 64 --lr 0.001 --emb_size 250 --epochs 100 --save_appendix component_pin_L4_H16_BS64_LR0.001_E250 --no_val
 is saved.
-----
ltspice_examples - FEGIN
Using 4 layers, 16 hidden units, h = 2
Loading component_pin representation dataset
ENTERED
Training FEGIN on component_pin representation
Train: 3560, Test: 848
##################ITERATION #0 ****************************************
 epoch: 0, train_loss: 1.3829, test_loss: 1.3141, test_f1: 0.3601
 epoch: 1, train_loss: 1.2678, test_loss: 1.2091, test_f1: 0.2381
 epoch: 2, train_loss: 1.2108, test_loss: 1.1680, test_f1: 0.2458
 epoch: 3, train_loss: 1.1792, test_loss: 1.1370, test_f1: 0.3539
 epoch: 4, train_loss: 1.1319, test_loss: 1.0895, test_f1: 0.3330
 epoch: 5, train_loss: 1.0637, test_loss: 1.0474, test_f1: 0.3538
 epoch: 6, train_loss: 1.0216, test_loss: 1.0227, test_f1: 0.4012
 epoch: 7, train_loss: 0.9943, test_loss: 1.0069, test_f1: 0.4328
 epoch: 8, train_loss: 0.9774, test_loss: 0.9820, test_f1: 0.4655
 epoch: 9, train_loss: 0.9526, test_loss: 0.9608, test_f1: 0.4784
 epoch: 10, train_loss: 0.9457, test_loss: 0.9762, test_f1: 0.4782
 epoch: 11, train_loss: 0.9321, test_loss: 0.9549, test_f1: 0.4894
 epoch: 12, train_loss: 0.9178, test_loss: 0.9614, test_f1: 0.4820
 epoch: 13, train_loss: 0.9263, test_loss: 0.9652, test_f1: 0.5033
 epoch: 14, train_loss: 0.9178, test_loss: 0.9695, test_f1: 0.4763
 epoch: 15, train_loss: 0.9046, test_loss: 0.9566, test_f1: 0.4874
 epoch: 16, train_loss: 0.8922, test_loss: 0.9512, test_f1: 0.4989
 epoch: 17, train_loss: 0.9020, test_loss: 0.9790, test_f1: 0.5004
 epoch: 18, train_loss: 0.9061, test_loss: 0.9766, test_f1: 0.5032
 epoch: 19, train_loss: 0.8915, test_loss: 0.9295, test_f1: 0.5096
 epoch: 20, train_loss: 0.8955, test_loss: 0.9621, test_f1: 0.5102
 epoch: 21, train_loss: 0.8787, test_loss: 0.9407, test_f1: 0.5114
 epoch: 22, train_loss: 0.8714, test_loss: 0.9260, test_f1: 0.5263
 epoch: 23, train_loss: 0.8763, test_loss: 0.9445, test_f1: 0.5045
 epoch: 24, train_loss: 0.8716, test_loss: 0.8416, test_f1: 0.5364
 epoch: 25, train_loss: 0.8597, test_loss: 0.9164, test_f1: 0.5369
 epoch: 26, train_loss: 0.8616, test_loss: 0.9200, test_f1: 0.5178
 epoch: 27, train_loss: 0.8486, test_loss: 0.9219, test_f1: 0.5205
 epoch: 28, train_loss: 0.8628, test_loss: 0.9358, test_f1: 0.5299
 epoch: 29, train_loss: 0.8550, test_loss: 0.9520, test_f1: 0.5149
 epoch: 30, train_loss: 0.8427, test_loss: 0.9453, test_f1: 0.5094
 epoch: 31, train_loss: 0.8505, test_loss: 0.9424, test_f1: 0.5133
 epoch: 32, train_loss: 0.8394, test_loss: 0.9209, test_f1: 0.5115
 epoch: 33, train_loss: 0.8438, test_loss: 0.9298, test_f1: 0.5102
 epoch: 34, train_loss: 0.8489, test_loss: 0.9377, test_f1: 0.5133
 epoch: 35, train_loss: 0.8362, test_loss: 0.9590, test_f1: 0.5083
 epoch: 36, train_loss: 0.8317, test_loss: 0.9170, test_f1: 0.5104
 epoch: 37, train_loss: 0.8175, test_loss: 0.9422, test_f1: 0.5133
 epoch: 38, train_loss: 0.8270, test_loss: 0.9518, test_f1: 0.4944
 epoch: 39, train_loss: 0.8163, test_loss: 0.9900, test_f1: 0.5149
 epoch: 40, train_loss: 0.8225, test_loss: 0.9376, test_f1: 0.5223
 epoch: 41, train_loss: 0.8181, test_loss: 0.9412, test_f1: 0.5268
 epoch: 42, train_loss: 0.8084, test_loss: 0.9480, test_f1: 0.5273
 epoch: 43, train_loss: 0.8177, test_loss: 0.9099, test_f1: 0.5211
 epoch: 44, train_loss: 0.8152, test_loss: 0.9283, test_f1: 0.5152
 epoch: 45, train_loss: 0.8118, test_loss: 0.9267, test_f1: 0.5512
 epoch: 46, train_loss: 0.7922, test_loss: 0.9742, test_f1: 0.5157
 epoch: 47, train_loss: 0.8044, test_loss: 0.9278, test_f1: 0.5240
 epoch: 48, train_loss: 0.7978, test_loss: 0.9251, test_f1: 0.5253
 epoch: 49, train_loss: 0.7813, test_loss: 0.8741, test_f1: 0.5369
 epoch: 50, train_loss: 0.7885, test_loss: 0.9965, test_f1: 0.4878
 epoch: 51, train_loss: 0.7698, test_loss: 0.8936, test_f1: 0.5416
 epoch: 52, train_loss: 0.7638, test_loss: 0.8954, test_f1: 0.5336
 epoch: 53, train_loss: 0.7705, test_loss: 0.8993, test_f1: 0.5498
 epoch: 54, train_loss: 0.7619, test_loss: 0.8805, test_f1: 0.5272
 epoch: 55, train_loss: 0.7551, test_loss: 0.8793, test_f1: 0.5473
 epoch: 56, train_loss: 0.7645, test_loss: 0.9096, test_f1: 0.5498
 epoch: 57, train_loss: 0.7604, test_loss: 0.8912, test_f1: 0.5441
 epoch: 58, train_loss: 0.7711, test_loss: 0.8865, test_f1: 0.5479
 epoch: 59, train_loss: 0.7655, test_loss: 0.9074, test_f1: 0.5370
 epoch: 60, train_loss: 0.7513, test_loss: 0.8912, test_f1: 0.5463
 epoch: 61, train_loss: 0.7502, test_loss: 0.8900, test_f1: 0.5409
 epoch: 62, train_loss: 0.7539, test_loss: 0.9098, test_f1: 0.5278
 epoch: 63, train_loss: 0.7555, test_loss: 0.9380, test_f1: 0.5292
 epoch: 64, train_loss: 0.7432, test_loss: 0.8835, test_f1: 0.5476
 epoch: 65, train_loss: 0.7402, test_loss: 0.8672, test_f1: 0.5376
 epoch: 66, train_loss: 0.7459, test_loss: 0.8841, test_f1: 0.5496
 epoch: 67, train_loss: 0.7443, test_loss: 0.9444, test_f1: 0.5202
 epoch: 68, train_loss: 0.7502, test_loss: 0.8811, test_f1: 0.5487
 epoch: 69, train_loss: 0.7361, test_loss: 0.8930, test_f1: 0.5544
 epoch: 70, train_loss: 0.7486, test_loss: 0.8870, test_f1: 0.5335
 epoch: 71, train_loss: 0.7368, test_loss: 0.8738, test_f1: 0.5395
 epoch: 72, train_loss: 0.7294, test_loss: 0.9020, test_f1: 0.5251
 epoch: 73, train_loss: 0.7406, test_loss: 0.8958, test_f1: 0.5364
 epoch: 74, train_loss: 0.7265, test_loss: 0.9677, test_f1: 0.5388
 epoch: 75, train_loss: 0.7351, test_loss: 0.9044, test_f1: 0.5366
 epoch: 76, train_loss: 0.7418, test_loss: 0.8699, test_f1: 0.5399
 epoch: 77, train_loss: 0.7335, test_loss: 0.8641, test_f1: 0.5388
 epoch: 78, train_loss: 0.7282, test_loss: 0.8657, test_f1: 0.5484
 epoch: 79, train_loss: 0.7409, test_loss: 0.8992, test_f1: 0.5371
 epoch: 80, train_loss: 0.7276, test_loss: 0.8840, test_f1: 0.5358
 epoch: 81, train_loss: 0.7271, test_loss: 0.8695, test_f1: 0.5500
 epoch: 82, train_loss: 0.7253, test_loss: 0.8957, test_f1: 0.5226
 epoch: 83, train_loss: 0.7294, test_loss: 0.9015, test_f1: 0.5319
 epoch: 84, train_loss: 0.7219, test_loss: 0.8451, test_f1: 0.5502
 epoch: 85, train_loss: 0.7150, test_loss: 0.9336, test_f1: 0.5394
 epoch: 86, train_loss: 0.7191, test_loss: 0.8813, test_f1: 0.5504
 epoch: 87, train_loss: 0.7250, test_loss: 0.8793, test_f1: 0.5392
 epoch: 88, train_loss: 0.7172, test_loss: 0.9135, test_f1: 0.5367
 epoch: 89, train_loss: 0.7192, test_loss: 0.8916, test_f1: 0.5440
 epoch: 90, train_loss: 0.7129, test_loss: 0.8807, test_f1: 0.5401
 epoch: 91, train_loss: 0.7208, test_loss: 0.8664, test_f1: 0.5389
 epoch: 92, train_loss: 0.7233, test_loss: 0.8874, test_f1: 0.5322
 epoch: 93, train_loss: 0.7196, test_loss: 0.9061, test_f1: 0.5332
 epoch: 94, train_loss: 0.7130, test_loss: 0.8969, test_f1: 0.5448
 epoch: 95, train_loss: 0.7213, test_loss: 0.8945, test_f1: 0.5329
 epoch: 96, train_loss: 0.7203, test_loss: 0.8968, test_f1: 0.5374
 epoch: 97, train_loss: 0.7089, test_loss: 0.9133, test_f1: 0.5289
 epoch: 98, train_loss: 0.7119, test_loss: 0.8728, test_f1: 0.5570
 epoch: 99, train_loss: 0.7185, test_loss: 0.8610, test_f1: 0.5562
##################ITERATION #1 ****************************************
 epoch: 0, train_loss: 1.2907, test_loss: 1.2183, test_f1: 0.2286
 epoch: 1, train_loss: 1.1916, test_loss: 1.1586, test_f1: 0.3206
 epoch: 2, train_loss: 1.1415, test_loss: 1.1083, test_f1: 0.3111
 epoch: 3, train_loss: 1.0869, test_loss: 1.2536, test_f1: 0.2652
 epoch: 4, train_loss: 1.0580, test_loss: 1.1317, test_f1: 0.3595
 epoch: 5, train_loss: 1.0261, test_loss: 1.0618, test_f1: 0.4367
 epoch: 6, train_loss: 1.0239, test_loss: 1.0432, test_f1: 0.4604
 epoch: 7, train_loss: 0.9940, test_loss: 1.0998, test_f1: 0.4368
 epoch: 8, train_loss: 0.9902, test_loss: 1.0529, test_f1: 0.4745
 epoch: 9, train_loss: 0.9764, test_loss: 1.0297, test_f1: 0.4737
 epoch: 10, train_loss: 0.9645, test_loss: 1.0585, test_f1: 0.4471
 epoch: 11, train_loss: 0.9610, test_loss: 1.0382, test_f1: 0.4700
 epoch: 12, train_loss: 0.9590, test_loss: 1.0171, test_f1: 0.4878
 epoch: 13, train_loss: 0.9456, test_loss: 1.0309, test_f1: 0.4870
 epoch: 14, train_loss: 0.9450, test_loss: 0.9693, test_f1: 0.4971
 epoch: 15, train_loss: 0.9321, test_loss: 1.0437, test_f1: 0.4698
 epoch: 16, train_loss: 0.9229, test_loss: 1.0516, test_f1: 0.4715
 epoch: 17, train_loss: 0.9169, test_loss: 1.0181, test_f1: 0.4971
 epoch: 18, train_loss: 0.9080, test_loss: 0.9296, test_f1: 0.5174
 epoch: 19, train_loss: 0.9071, test_loss: 0.9838, test_f1: 0.5029
 epoch: 20, train_loss: 0.9058, test_loss: 0.9454, test_f1: 0.5269
 epoch: 21, train_loss: 0.8968, test_loss: 0.9428, test_f1: 0.5154
 epoch: 22, train_loss: 0.8817, test_loss: 0.9326, test_f1: 0.5069
 epoch: 23, train_loss: 0.8941, test_loss: 0.9085, test_f1: 0.5049
 epoch: 24, train_loss: 0.8872, test_loss: 0.9729, test_f1: 0.4956
 epoch: 25, train_loss: 0.8813, test_loss: 0.8670, test_f1: 0.5306
 epoch: 26, train_loss: 0.8692, test_loss: 0.9075, test_f1: 0.5180
 epoch: 27, train_loss: 0.8611, test_loss: 0.8403, test_f1: 0.5272
 epoch: 28, train_loss: 0.8744, test_loss: 0.9409, test_f1: 0.5209
 epoch: 29, train_loss: 0.8694, test_loss: 1.0391, test_f1: 0.4847
 epoch: 30, train_loss: 0.8671, test_loss: 0.9494, test_f1: 0.5133
 epoch: 31, train_loss: 0.8497, test_loss: 0.9029, test_f1: 0.5296
 epoch: 32, train_loss: 0.8433, test_loss: 0.8870, test_f1: 0.5221
 epoch: 33, train_loss: 0.8401, test_loss: 0.9211, test_f1: 0.5236
 epoch: 34, train_loss: 0.8505, test_loss: 0.8829, test_f1: 0.5282
 epoch: 35, train_loss: 0.8394, test_loss: 0.8248, test_f1: 0.5333
 epoch: 36, train_loss: 0.8452, test_loss: 0.8918, test_f1: 0.5327
 epoch: 37, train_loss: 0.8367, test_loss: 0.9395, test_f1: 0.5295
 epoch: 38, train_loss: 0.8344, test_loss: 0.8739, test_f1: 0.5327
 epoch: 39, train_loss: 0.8308, test_loss: 1.0156, test_f1: 0.4948
 epoch: 40, train_loss: 0.8270, test_loss: 0.9982, test_f1: 0.4846
 epoch: 41, train_loss: 0.8367, test_loss: 0.8959, test_f1: 0.5194
 epoch: 42, train_loss: 0.8204, test_loss: 0.9060, test_f1: 0.5326
 epoch: 43, train_loss: 0.8264, test_loss: 0.9032, test_f1: 0.5334
 epoch: 44, train_loss: 0.8213, test_loss: 0.8998, test_f1: 0.5201
 epoch: 45, train_loss: 0.8136, test_loss: 0.9405, test_f1: 0.5160
 epoch: 46, train_loss: 0.8131, test_loss: 0.9490, test_f1: 0.5183
 epoch: 47, train_loss: 0.8080, test_loss: 0.8986, test_f1: 0.5425
 epoch: 48, train_loss: 0.8101, test_loss: 0.9375, test_f1: 0.5090
 epoch: 49, train_loss: 0.8066, test_loss: 0.9947, test_f1: 0.4992
 epoch: 50, train_loss: 0.8069, test_loss: 0.9609, test_f1: 0.5046
 epoch: 51, train_loss: 0.7948, test_loss: 0.9046, test_f1: 0.5497
 epoch: 52, train_loss: 0.7861, test_loss: 0.9221, test_f1: 0.5452
 epoch: 53, train_loss: 0.7916, test_loss: 0.9024, test_f1: 0.5370
 epoch: 54, train_loss: 0.7864, test_loss: 0.8870, test_f1: 0.5269
 epoch: 55, train_loss: 0.7818, test_loss: 0.9282, test_f1: 0.5234
 epoch: 56, train_loss: 0.7769, test_loss: 0.8971, test_f1: 0.5451
 epoch: 57, train_loss: 0.7879, test_loss: 0.8992, test_f1: 0.5501
 epoch: 58, train_loss: 0.7852, test_loss: 0.8979, test_f1: 0.5437
 epoch: 59, train_loss: 0.7721, test_loss: 0.9238, test_f1: 0.5378
 epoch: 60, train_loss: 0.7809, test_loss: 0.9495, test_f1: 0.5205
 epoch: 61, train_loss: 0.7766, test_loss: 0.9447, test_f1: 0.5326
 epoch: 62, train_loss: 0.7778, test_loss: 0.9052, test_f1: 0.5368
 epoch: 63, train_loss: 0.7704, test_loss: 0.9244, test_f1: 0.5347
 epoch: 64, train_loss: 0.7686, test_loss: 0.9037, test_f1: 0.5360
 epoch: 65, train_loss: 0.7676, test_loss: 0.9290, test_f1: 0.5415
 epoch: 66, train_loss: 0.7687, test_loss: 0.9427, test_f1: 0.5365
 epoch: 67, train_loss: 0.7665, test_loss: 0.9161, test_f1: 0.5383
 epoch: 68, train_loss: 0.7638, test_loss: 0.9600, test_f1: 0.5402
 epoch: 69, train_loss: 0.7708, test_loss: 0.9708, test_f1: 0.5191
 epoch: 70, train_loss: 0.7673, test_loss: 0.9370, test_f1: 0.5257
 epoch: 71, train_loss: 0.7627, test_loss: 0.9537, test_f1: 0.5341
 epoch: 72, train_loss: 0.7579, test_loss: 0.9169, test_f1: 0.5435
 epoch: 73, train_loss: 0.7606, test_loss: 0.9223, test_f1: 0.5442
 epoch: 74, train_loss: 0.7538, test_loss: 0.9473, test_f1: 0.5292
 epoch: 75, train_loss: 0.7625, test_loss: 0.9746, test_f1: 0.5219
 epoch: 76, train_loss: 0.7572, test_loss: 0.9153, test_f1: 0.5255
 epoch: 77, train_loss: 0.7559, test_loss: 0.9301, test_f1: 0.5382
 epoch: 78, train_loss: 0.7643, test_loss: 0.9242, test_f1: 0.5441
 epoch: 79, train_loss: 0.7440, test_loss: 0.9588, test_f1: 0.5194
 epoch: 80, train_loss: 0.7449, test_loss: 0.9498, test_f1: 0.5222
 epoch: 81, train_loss: 0.7611, test_loss: 0.9277, test_f1: 0.5322
 epoch: 82, train_loss: 0.7476, test_loss: 0.9374, test_f1: 0.5356
 epoch: 83, train_loss: 0.7385, test_loss: 0.9557, test_f1: 0.5190
 epoch: 84, train_loss: 0.7527, test_loss: 0.9383, test_f1: 0.5213
 epoch: 85, train_loss: 0.7603, test_loss: 0.9482, test_f1: 0.5244
 epoch: 86, train_loss: 0.7393, test_loss: 0.9473, test_f1: 0.5249
 epoch: 87, train_loss: 0.7484, test_loss: 0.9491, test_f1: 0.5327
 epoch: 88, train_loss: 0.7427, test_loss: 0.9374, test_f1: 0.5232
 epoch: 89, train_loss: 0.7485, test_loss: 0.9561, test_f1: 0.5235
 epoch: 90, train_loss: 0.7401, test_loss: 0.9975, test_f1: 0.5076
 epoch: 91, train_loss: 0.7429, test_loss: 0.9884, test_f1: 0.5164
 epoch: 92, train_loss: 0.7403, test_loss: 0.9629, test_f1: 0.5203
 epoch: 93, train_loss: 0.7422, test_loss: 0.9552, test_f1: 0.5152
 epoch: 94, train_loss: 0.7449, test_loss: 0.9476, test_f1: 0.5060
 epoch: 95, train_loss: 0.7348, test_loss: 0.9267, test_f1: 0.5489
 epoch: 96, train_loss: 0.7398, test_loss: 0.9278, test_f1: 0.5281
 epoch: 97, train_loss: 0.7342, test_loss: 0.9273, test_f1: 0.5503
 epoch: 98, train_loss: 0.7291, test_loss: 0.9264, test_f1: 0.5486
 epoch: 99, train_loss: 0.7396, test_loss: 0.9121, test_f1: 0.5299
##################ITERATION #2 ****************************************
 epoch: 0, train_loss: 1.2927, test_loss: 1.2194, test_f1: 0.2336
 epoch: 1, train_loss: 1.1729, test_loss: 1.1292, test_f1: 0.3990
 epoch: 2, train_loss: 1.1228, test_loss: 1.0754, test_f1: 0.4409
 epoch: 3, train_loss: 1.0858, test_loss: 1.0639, test_f1: 0.4073
 epoch: 4, train_loss: 1.0655, test_loss: 1.0725, test_f1: 0.4133
 epoch: 5, train_loss: 1.0676, test_loss: 1.0325, test_f1: 0.4528
 epoch: 6, train_loss: 1.0411, test_loss: 1.0257, test_f1: 0.4522
 epoch: 7, train_loss: 1.0309, test_loss: 1.0123, test_f1: 0.4510
 epoch: 8, train_loss: 1.0257, test_loss: 1.0264, test_f1: 0.4557
 epoch: 9, train_loss: 1.0111, test_loss: 1.0383, test_f1: 0.4464
 epoch: 10, train_loss: 1.0047, test_loss: 1.1088, test_f1: 0.4014
 epoch: 11, train_loss: 0.9972, test_loss: 1.0338, test_f1: 0.4413
 epoch: 12, train_loss: 0.9883, test_loss: 1.0085, test_f1: 0.4729
 epoch: 13, train_loss: 0.9968, test_loss: 1.0377, test_f1: 0.4530
 epoch: 14, train_loss: 0.9807, test_loss: 1.0035, test_f1: 0.4601
 epoch: 15, train_loss: 0.9739, test_loss: 1.0408, test_f1: 0.4864
 epoch: 16, train_loss: 0.9869, test_loss: 1.0129, test_f1: 0.4493
 epoch: 17, train_loss: 0.9677, test_loss: 1.0292, test_f1: 0.4574
 epoch: 18, train_loss: 0.9521, test_loss: 0.9687, test_f1: 0.4706
 epoch: 19, train_loss: 0.9458, test_loss: 0.9887, test_f1: 0.4827
 epoch: 20, train_loss: 0.9407, test_loss: 0.9699, test_f1: 0.4704
 epoch: 21, train_loss: 0.9539, test_loss: 0.9894, test_f1: 0.4728
 epoch: 22, train_loss: 0.9376, test_loss: 1.0700, test_f1: 0.4559
 epoch: 23, train_loss: 0.9378, test_loss: 0.9435, test_f1: 0.4861
 epoch: 24, train_loss: 0.9347, test_loss: 1.0020, test_f1: 0.4764
 epoch: 25, train_loss: 0.9234, test_loss: 1.0142, test_f1: 0.4891
 epoch: 26, train_loss: 0.9245, test_loss: 0.9152, test_f1: 0.4786
 epoch: 27, train_loss: 0.9059, test_loss: 0.9978, test_f1: 0.4732
 epoch: 28, train_loss: 0.9089, test_loss: 1.0010, test_f1: 0.4576
 epoch: 29, train_loss: 0.9239, test_loss: 1.0018, test_f1: 0.4907
 epoch: 30, train_loss: 0.9077, test_loss: 0.9732, test_f1: 0.4671
 epoch: 31, train_loss: 0.9053, test_loss: 0.9294, test_f1: 0.5052
 epoch: 32, train_loss: 0.8983, test_loss: 0.9586, test_f1: 0.4779
 epoch: 33, train_loss: 0.8841, test_loss: 0.9943, test_f1: 0.4861
 epoch: 34, train_loss: 0.9027, test_loss: 0.9575, test_f1: 0.4871
 epoch: 35, train_loss: 0.8798, test_loss: 0.9525, test_f1: 0.4986
 epoch: 36, train_loss: 0.8852, test_loss: 0.9783, test_f1: 0.4740
 epoch: 37, train_loss: 0.8800, test_loss: 1.0005, test_f1: 0.4891
 epoch: 38, train_loss: 0.8986, test_loss: 0.9961, test_f1: 0.4757
 epoch: 39, train_loss: 0.8868, test_loss: 0.9758, test_f1: 0.4795
 epoch: 40, train_loss: 0.8727, test_loss: 0.9006, test_f1: 0.5054
 epoch: 41, train_loss: 0.8688, test_loss: 0.9340, test_f1: 0.5010
 epoch: 42, train_loss: 0.8717, test_loss: 0.9129, test_f1: 0.4983
 epoch: 43, train_loss: 0.8668, test_loss: 0.8938, test_f1: 0.5157
 epoch: 44, train_loss: 0.8703, test_loss: 0.8859, test_f1: 0.5130
 epoch: 45, train_loss: 0.8561, test_loss: 0.8662, test_f1: 0.5245
 epoch: 46, train_loss: 0.8636, test_loss: 0.9821, test_f1: 0.5090
 epoch: 47, train_loss: 0.8606, test_loss: 0.9490, test_f1: 0.5236
 epoch: 48, train_loss: 0.8494, test_loss: 0.9316, test_f1: 0.5115
 epoch: 49, train_loss: 0.8496, test_loss: 0.9874, test_f1: 0.4791
 epoch: 50, train_loss: 0.8647, test_loss: 0.8910, test_f1: 0.5238
 epoch: 51, train_loss: 0.8435, test_loss: 0.9053, test_f1: 0.5278
 epoch: 52, train_loss: 0.8307, test_loss: 0.8938, test_f1: 0.5010
 epoch: 53, train_loss: 0.8377, test_loss: 0.8956, test_f1: 0.5088
 epoch: 54, train_loss: 0.8323, test_loss: 0.9024, test_f1: 0.5185
 epoch: 55, train_loss: 0.8294, test_loss: 0.9280, test_f1: 0.5123
 epoch: 56, train_loss: 0.8384, test_loss: 0.8938, test_f1: 0.5005
 epoch: 57, train_loss: 0.8268, test_loss: 0.9127, test_f1: 0.5243
 epoch: 58, train_loss: 0.8239, test_loss: 0.9370, test_f1: 0.5196
 epoch: 59, train_loss: 0.8192, test_loss: 0.8941, test_f1: 0.5238
 epoch: 60, train_loss: 0.8192, test_loss: 0.9289, test_f1: 0.5203
 epoch: 61, train_loss: 0.8214, test_loss: 0.9183, test_f1: 0.5246
 epoch: 62, train_loss: 0.8194, test_loss: 0.8549, test_f1: 0.5257
 epoch: 63, train_loss: 0.8219, test_loss: 0.8805, test_f1: 0.5188
 epoch: 64, train_loss: 0.8160, test_loss: 0.9251, test_f1: 0.5193
 epoch: 65, train_loss: 0.8176, test_loss: 0.9247, test_f1: 0.5190
 epoch: 66, train_loss: 0.8186, test_loss: 0.9560, test_f1: 0.5260
 epoch: 67, train_loss: 0.8139, test_loss: 0.9364, test_f1: 0.5101
 epoch: 68, train_loss: 0.8159, test_loss: 0.9339, test_f1: 0.5153
 epoch: 69, train_loss: 0.8045, test_loss: 0.9502, test_f1: 0.5189
 epoch: 70, train_loss: 0.8091, test_loss: 0.9367, test_f1: 0.5309
 epoch: 71, train_loss: 0.8014, test_loss: 0.9393, test_f1: 0.5267
 epoch: 72, train_loss: 0.8066, test_loss: 0.9515, test_f1: 0.5145
 epoch: 73, train_loss: 0.8090, test_loss: 0.9507, test_f1: 0.5292
 epoch: 74, train_loss: 0.8053, test_loss: 0.9495, test_f1: 0.5190
 epoch: 75, train_loss: 0.8040, test_loss: 0.9400, test_f1: 0.5205
 epoch: 76, train_loss: 0.7883, test_loss: 0.9044, test_f1: 0.5218
 epoch: 77, train_loss: 0.7949, test_loss: 0.9516, test_f1: 0.5241
 epoch: 78, train_loss: 0.7967, test_loss: 0.9297, test_f1: 0.5217
 epoch: 79, train_loss: 0.8009, test_loss: 0.9311, test_f1: 0.5344
 epoch: 80, train_loss: 0.7946, test_loss: 0.9289, test_f1: 0.5323
 epoch: 81, train_loss: 0.7852, test_loss: 0.9782, test_f1: 0.5111
 epoch: 82, train_loss: 0.8003, test_loss: 0.9441, test_f1: 0.5271
 epoch: 83, train_loss: 0.7819, test_loss: 0.9394, test_f1: 0.5190
 epoch: 84, train_loss: 0.7897, test_loss: 0.9410, test_f1: 0.5256
 epoch: 85, train_loss: 0.7937, test_loss: 0.9192, test_f1: 0.5357
 epoch: 86, train_loss: 0.7900, test_loss: 0.9573, test_f1: 0.5111
 epoch: 87, train_loss: 0.7846, test_loss: 0.8991, test_f1: 0.5262
 epoch: 88, train_loss: 0.7821, test_loss: 0.9272, test_f1: 0.5312
 epoch: 89, train_loss: 0.7900, test_loss: 0.9518, test_f1: 0.5209
 epoch: 90, train_loss: 0.7710, test_loss: 0.9472, test_f1: 0.5179
 epoch: 91, train_loss: 0.7837, test_loss: 0.9511, test_f1: 0.5231
 epoch: 92, train_loss: 0.7822, test_loss: 0.9699, test_f1: 0.5181
 epoch: 93, train_loss: 0.7827, test_loss: 0.9917, test_f1: 0.5086
 epoch: 94, train_loss: 0.7789, test_loss: 0.9675, test_f1: 0.5194
 epoch: 95, train_loss: 0.7858, test_loss: 0.9252, test_f1: 0.5243
 epoch: 96, train_loss: 0.7891, test_loss: 0.9629, test_f1: 0.5099
 epoch: 97, train_loss: 0.7869, test_loss: 0.9879, test_f1: 0.5280
 epoch: 98, train_loss: 0.7890, test_loss: 0.9101, test_f1: 0.5244
 epoch: 99, train_loss: 0.7889, test_loss: 0.9342, test_f1: 0.5253
##################ITERATION #3 ****************************************
 epoch: 0, train_loss: 1.2394, test_loss: 1.1699, test_f1: 0.4244
 epoch: 1, train_loss: 1.1199, test_loss: 1.0494, test_f1: 0.4458
 epoch: 2, train_loss: 1.0830, test_loss: 1.0313, test_f1: 0.4551
 epoch: 3, train_loss: 1.0360, test_loss: 1.0122, test_f1: 0.4618
 epoch: 4, train_loss: 1.0230, test_loss: 1.0126, test_f1: 0.4624
 epoch: 5, train_loss: 1.0170, test_loss: 1.0210, test_f1: 0.4818
 epoch: 6, train_loss: 0.9965, test_loss: 0.9866, test_f1: 0.4761
 epoch: 7, train_loss: 0.9881, test_loss: 0.9895, test_f1: 0.4934
 epoch: 8, train_loss: 0.9636, test_loss: 1.0413, test_f1: 0.4597
 epoch: 9, train_loss: 0.9508, test_loss: 1.0119, test_f1: 0.4775
 epoch: 10, train_loss: 0.9503, test_loss: 0.9636, test_f1: 0.5232
 epoch: 11, train_loss: 0.9375, test_loss: 0.9417, test_f1: 0.5015
 epoch: 12, train_loss: 0.9361, test_loss: 0.9781, test_f1: 0.4865
 epoch: 13, train_loss: 0.9177, test_loss: 0.9657, test_f1: 0.5186
 epoch: 14, train_loss: 0.9104, test_loss: 0.9181, test_f1: 0.5060
 epoch: 15, train_loss: 0.9056, test_loss: 0.9250, test_f1: 0.5153
 epoch: 16, train_loss: 0.9002, test_loss: 0.9336, test_f1: 0.5108
 epoch: 17, train_loss: 0.8875, test_loss: 0.9130, test_f1: 0.5013
 epoch: 18, train_loss: 0.8918, test_loss: 0.9227, test_f1: 0.5019
 epoch: 19, train_loss: 0.8881, test_loss: 0.8735, test_f1: 0.5201
 epoch: 20, train_loss: 0.8860, test_loss: 0.9045, test_f1: 0.5231
 epoch: 21, train_loss: 0.8785, test_loss: 0.9155, test_f1: 0.5203
 epoch: 22, train_loss: 0.8560, test_loss: 0.8816, test_f1: 0.5280
 epoch: 23, train_loss: 0.8727, test_loss: 0.9454, test_f1: 0.5391
 epoch: 24, train_loss: 0.8627, test_loss: 0.9365, test_f1: 0.5265
 epoch: 25, train_loss: 0.8556, test_loss: 0.9371, test_f1: 0.5191
 epoch: 26, train_loss: 0.8460, test_loss: 0.9841, test_f1: 0.4869
 epoch: 27, train_loss: 0.8524, test_loss: 0.8935, test_f1: 0.5371
 epoch: 28, train_loss: 0.8454, test_loss: 0.8957, test_f1: 0.5329
 epoch: 29, train_loss: 0.8501, test_loss: 0.8924, test_f1: 0.5291
 epoch: 30, train_loss: 0.8394, test_loss: 0.8996, test_f1: 0.5513
 epoch: 31, train_loss: 0.8157, test_loss: 0.9033, test_f1: 0.5302
 epoch: 32, train_loss: 0.8199, test_loss: 0.9408, test_f1: 0.5101
 epoch: 33, train_loss: 0.8445, test_loss: 0.9235, test_f1: 0.5260
 epoch: 34, train_loss: 0.8540, test_loss: 0.9498, test_f1: 0.5013
 epoch: 35, train_loss: 0.8277, test_loss: 0.8879, test_f1: 0.5541
 epoch: 36, train_loss: 0.8214, test_loss: 0.9208, test_f1: 0.5521
 epoch: 37, train_loss: 0.8227, test_loss: 0.9176, test_f1: 0.5342
 epoch: 38, train_loss: 0.8154, test_loss: 1.0064, test_f1: 0.4755
 epoch: 39, train_loss: 0.8235, test_loss: 0.9420, test_f1: 0.5463
 epoch: 40, train_loss: 0.8130, test_loss: 0.9317, test_f1: 0.5286
 epoch: 41, train_loss: 0.8152, test_loss: 0.9329, test_f1: 0.5358
 epoch: 42, train_loss: 0.8108, test_loss: 0.9473, test_f1: 0.5444
 epoch: 43, train_loss: 0.7908, test_loss: 0.9549, test_f1: 0.5316
 epoch: 44, train_loss: 0.8009, test_loss: 0.8993, test_f1: 0.5467
 epoch: 45, train_loss: 0.7952, test_loss: 0.9324, test_f1: 0.5437
 epoch: 46, train_loss: 0.8114, test_loss: 0.9015, test_f1: 0.5493
 epoch: 47, train_loss: 0.7911, test_loss: 0.9230, test_f1: 0.5310
 epoch: 48, train_loss: 0.7856, test_loss: 0.9635, test_f1: 0.5292
 epoch: 49, train_loss: 0.7897, test_loss: 0.9374, test_f1: 0.5288
 epoch: 50, train_loss: 0.7909, test_loss: 0.9006, test_f1: 0.5384
 epoch: 51, train_loss: 0.7790, test_loss: 0.9401, test_f1: 0.5286
 epoch: 52, train_loss: 0.7774, test_loss: 0.9074, test_f1: 0.5516
 epoch: 53, train_loss: 0.7658, test_loss: 0.9264, test_f1: 0.5513
 epoch: 54, train_loss: 0.7657, test_loss: 0.9015, test_f1: 0.5500
 epoch: 55, train_loss: 0.7643, test_loss: 0.9308, test_f1: 0.5439
 epoch: 56, train_loss: 0.7690, test_loss: 0.9285, test_f1: 0.5422
 epoch: 57, train_loss: 0.7603, test_loss: 0.9436, test_f1: 0.5439
 epoch: 58, train_loss: 0.7520, test_loss: 0.9455, test_f1: 0.5257
 epoch: 59, train_loss: 0.7644, test_loss: 0.9362, test_f1: 0.5427
 epoch: 60, train_loss: 0.7671, test_loss: 0.9066, test_f1: 0.5545
 epoch: 61, train_loss: 0.7627, test_loss: 0.9273, test_f1: 0.5420
 epoch: 62, train_loss: 0.7545, test_loss: 0.8974, test_f1: 0.5500
 epoch: 63, train_loss: 0.7570, test_loss: 0.9915, test_f1: 0.5232
 epoch: 64, train_loss: 0.7683, test_loss: 0.9059, test_f1: 0.5414
 epoch: 65, train_loss: 0.7576, test_loss: 0.9098, test_f1: 0.5542
 epoch: 66, train_loss: 0.7584, test_loss: 0.9140, test_f1: 0.5527
 epoch: 67, train_loss: 0.7619, test_loss: 0.9174, test_f1: 0.5502
 epoch: 68, train_loss: 0.7551, test_loss: 0.9271, test_f1: 0.5447
 epoch: 69, train_loss: 0.7474, test_loss: 0.9133, test_f1: 0.5587
 epoch: 70, train_loss: 0.7436, test_loss: 0.9410, test_f1: 0.5434
 epoch: 71, train_loss: 0.7451, test_loss: 0.9282, test_f1: 0.5471
 epoch: 72, train_loss: 0.7482, test_loss: 0.9544, test_f1: 0.5400
 epoch: 73, train_loss: 0.7532, test_loss: 0.9225, test_f1: 0.5500
 epoch: 74, train_loss: 0.7552, test_loss: 0.9695, test_f1: 0.5261
 epoch: 75, train_loss: 0.7374, test_loss: 0.9880, test_f1: 0.5193
 epoch: 76, train_loss: 0.7463, test_loss: 0.9136, test_f1: 0.5441
 epoch: 77, train_loss: 0.7377, test_loss: 0.9086, test_f1: 0.5510
 epoch: 78, train_loss: 0.7367, test_loss: 0.9083, test_f1: 0.5529
 epoch: 79, train_loss: 0.7499, test_loss: 0.9138, test_f1: 0.5492
 epoch: 80, train_loss: 0.7411, test_loss: 0.9406, test_f1: 0.5448
 epoch: 81, train_loss: 0.7428, test_loss: 0.8999, test_f1: 0.5641
 epoch: 82, train_loss: 0.7485, test_loss: 0.9266, test_f1: 0.5429
 epoch: 83, train_loss: 0.7259, test_loss: 0.9860, test_f1: 0.5438
 epoch: 84, train_loss: 0.7381, test_loss: 0.9169, test_f1: 0.5611
 epoch: 85, train_loss: 0.7313, test_loss: 0.9390, test_f1: 0.5612
 epoch: 86, train_loss: 0.7430, test_loss: 0.9843, test_f1: 0.5403
 epoch: 87, train_loss: 0.7358, test_loss: 0.9390, test_f1: 0.5432
 epoch: 88, train_loss: 0.7261, test_loss: 0.9566, test_f1: 0.5483
 epoch: 89, train_loss: 0.7381, test_loss: 0.9350, test_f1: 0.5482
 epoch: 90, train_loss: 0.7258, test_loss: 0.9339, test_f1: 0.5525
 epoch: 91, train_loss: 0.7277, test_loss: 0.9798, test_f1: 0.5330
 epoch: 92, train_loss: 0.7215, test_loss: 0.9323, test_f1: 0.5568
 epoch: 93, train_loss: 0.7281, test_loss: 0.9129, test_f1: 0.5553
 epoch: 94, train_loss: 0.7297, test_loss: 0.9336, test_f1: 0.5448
 epoch: 95, train_loss: 0.7238, test_loss: 0.9270, test_f1: 0.5656
 epoch: 96, train_loss: 0.7234, test_loss: 0.9384, test_f1: 0.5471
 epoch: 97, train_loss: 0.7201, test_loss: 0.9570, test_f1: 0.5442
 epoch: 98, train_loss: 0.7101, test_loss: 0.9860, test_f1: 0.5398
 epoch: 99, train_loss: 0.7082, test_loss: 0.9620, test_f1: 0.5412
##################ITERATION #4 ****************************************
 epoch: 0, train_loss: 1.2812, test_loss: 1.0860, test_f1: 0.3745
 epoch: 1, train_loss: 1.0950, test_loss: 1.0410, test_f1: 0.3784
 epoch: 2, train_loss: 1.0651, test_loss: 0.9961, test_f1: 0.4681
 epoch: 3, train_loss: 1.0506, test_loss: 0.9826, test_f1: 0.4604
 epoch: 4, train_loss: 1.0324, test_loss: 0.9996, test_f1: 0.4909
 epoch: 5, train_loss: 1.0174, test_loss: 1.0147, test_f1: 0.4638
 epoch: 6, train_loss: 0.9946, test_loss: 1.0115, test_f1: 0.4371
 epoch: 7, train_loss: 0.9858, test_loss: 0.9605, test_f1: 0.4596
 epoch: 8, train_loss: 0.9926, test_loss: 0.9375, test_f1: 0.5104
 epoch: 9, train_loss: 0.9692, test_loss: 0.9658, test_f1: 0.5030
 epoch: 10, train_loss: 0.9658, test_loss: 0.9548, test_f1: 0.5209
 epoch: 11, train_loss: 0.9633, test_loss: 0.9719, test_f1: 0.4663
 epoch: 12, train_loss: 0.9522, test_loss: 0.9534, test_f1: 0.5156
 epoch: 13, train_loss: 0.9527, test_loss: 0.9881, test_f1: 0.5125
 epoch: 14, train_loss: 0.9294, test_loss: 0.9849, test_f1: 0.5170
 epoch: 15, train_loss: 0.9287, test_loss: 0.9931, test_f1: 0.5145
 epoch: 16, train_loss: 0.9375, test_loss: 0.9526, test_f1: 0.5294
 epoch: 17, train_loss: 0.9207, test_loss: 0.9571, test_f1: 0.5205
 epoch: 18, train_loss: 0.9046, test_loss: 0.9567, test_f1: 0.5174
 epoch: 19, train_loss: 0.8970, test_loss: 0.9464, test_f1: 0.5323
 epoch: 20, train_loss: 0.9073, test_loss: 0.9490, test_f1: 0.5561
 epoch: 21, train_loss: 0.8883, test_loss: 1.0013, test_f1: 0.4731
 epoch: 22, train_loss: 0.8830, test_loss: 0.9788, test_f1: 0.5123
 epoch: 23, train_loss: 0.8743, test_loss: 0.9852, test_f1: 0.5258
 epoch: 24, train_loss: 0.8734, test_loss: 0.9856, test_f1: 0.5039
 epoch: 25, train_loss: 0.8781, test_loss: 0.9588, test_f1: 0.5168
 epoch: 26, train_loss: 0.8776, test_loss: 0.9466, test_f1: 0.5396
 epoch: 27, train_loss: 0.8752, test_loss: 0.9564, test_f1: 0.5504
 epoch: 28, train_loss: 0.8783, test_loss: 0.9632, test_f1: 0.5294
 epoch: 29, train_loss: 0.8646, test_loss: 0.9155, test_f1: 0.5502
 epoch: 30, train_loss: 0.8625, test_loss: 0.9535, test_f1: 0.5368
 epoch: 31, train_loss: 0.8566, test_loss: 0.9442, test_f1: 0.5401
 epoch: 32, train_loss: 0.8534, test_loss: 0.9539, test_f1: 0.5479
 epoch: 33, train_loss: 0.8392, test_loss: 0.9150, test_f1: 0.5746
 epoch: 34, train_loss: 0.8459, test_loss: 0.9013, test_f1: 0.5562
 epoch: 35, train_loss: 0.8402, test_loss: 0.9561, test_f1: 0.5338
 epoch: 36, train_loss: 0.8395, test_loss: 0.9380, test_f1: 0.5478
 epoch: 37, train_loss: 0.8328, test_loss: 0.9127, test_f1: 0.5768
 epoch: 38, train_loss: 0.8371, test_loss: 0.9789, test_f1: 0.4975
 epoch: 39, train_loss: 0.8396, test_loss: 0.8921, test_f1: 0.5485
 epoch: 40, train_loss: 0.8464, test_loss: 0.9200, test_f1: 0.5316
 epoch: 41, train_loss: 0.8280, test_loss: 0.9246, test_f1: 0.5414
 epoch: 42, train_loss: 0.8191, test_loss: 0.9359, test_f1: 0.5111
 epoch: 43, train_loss: 0.8243, test_loss: 0.9006, test_f1: 0.5297
 epoch: 44, train_loss: 0.8218, test_loss: 0.9315, test_f1: 0.5264
 epoch: 45, train_loss: 0.8231, test_loss: 0.9144, test_f1: 0.5363
 epoch: 46, train_loss: 0.8161, test_loss: 0.9106, test_f1: 0.5368
 epoch: 47, train_loss: 0.8166, test_loss: 0.9359, test_f1: 0.5766
 epoch: 48, train_loss: 0.8143, test_loss: 0.8963, test_f1: 0.5426
 epoch: 49, train_loss: 0.8157, test_loss: 0.8877, test_f1: 0.5556
 epoch: 50, train_loss: 0.8106, test_loss: 0.9094, test_f1: 0.5452
 epoch: 51, train_loss: 0.7921, test_loss: 0.8949, test_f1: 0.5466
 epoch: 52, train_loss: 0.7841, test_loss: 0.8980, test_f1: 0.5386
 epoch: 53, train_loss: 0.7899, test_loss: 0.8855, test_f1: 0.5444
 epoch: 54, train_loss: 0.7902, test_loss: 0.8711, test_f1: 0.5437
 epoch: 55, train_loss: 0.7828, test_loss: 0.8724, test_f1: 0.5516
 epoch: 56, train_loss: 0.7839, test_loss: 0.9121, test_f1: 0.5374
 epoch: 57, train_loss: 0.7888, test_loss: 0.8822, test_f1: 0.5469
 epoch: 58, train_loss: 0.7639, test_loss: 0.9088, test_f1: 0.5395
 epoch: 59, train_loss: 0.7828, test_loss: 0.9046, test_f1: 0.5212
 epoch: 60, train_loss: 0.7675, test_loss: 0.8758, test_f1: 0.5569
 epoch: 61, train_loss: 0.7744, test_loss: 0.8875, test_f1: 0.5496
 epoch: 62, train_loss: 0.7682, test_loss: 0.8704, test_f1: 0.5518
 epoch: 63, train_loss: 0.7677, test_loss: 0.8846, test_f1: 0.5497
 epoch: 64, train_loss: 0.7748, test_loss: 0.8867, test_f1: 0.5455
 epoch: 65, train_loss: 0.7746, test_loss: 0.8614, test_f1: 0.5530
 epoch: 66, train_loss: 0.7777, test_loss: 0.8735, test_f1: 0.5369
 epoch: 67, train_loss: 0.7674, test_loss: 0.8989, test_f1: 0.5388
 epoch: 68, train_loss: 0.7619, test_loss: 0.9058, test_f1: 0.5346
 epoch: 69, train_loss: 0.7767, test_loss: 0.8636, test_f1: 0.5737
 epoch: 70, train_loss: 0.7722, test_loss: 0.9189, test_f1: 0.5318
 epoch: 71, train_loss: 0.7660, test_loss: 0.8883, test_f1: 0.5529
 epoch: 72, train_loss: 0.7618, test_loss: 0.8784, test_f1: 0.5558
 epoch: 73, train_loss: 0.7607, test_loss: 0.8760, test_f1: 0.5508
 epoch: 74, train_loss: 0.7649, test_loss: 0.8692, test_f1: 0.5604
 epoch: 75, train_loss: 0.7631, test_loss: 0.8913, test_f1: 0.5357
 epoch: 76, train_loss: 0.7619, test_loss: 0.8767, test_f1: 0.5506
 epoch: 77, train_loss: 0.7670, test_loss: 0.9292, test_f1: 0.5261
 epoch: 78, train_loss: 0.7547, test_loss: 0.8585, test_f1: 0.5668
 epoch: 79, train_loss: 0.7578, test_loss: 0.8638, test_f1: 0.5584
 epoch: 80, train_loss: 0.7653, test_loss: 0.8605, test_f1: 0.5608
 epoch: 81, train_loss: 0.7437, test_loss: 0.8734, test_f1: 0.5608
 epoch: 82, train_loss: 0.7506, test_loss: 0.8590, test_f1: 0.5593
 epoch: 83, train_loss: 0.7510, test_loss: 0.8567, test_f1: 0.5567
 epoch: 84, train_loss: 0.7575, test_loss: 0.8592, test_f1: 0.5630
 epoch: 85, train_loss: 0.7468, test_loss: 0.8612, test_f1: 0.5579
 epoch: 86, train_loss: 0.7558, test_loss: 0.8784, test_f1: 0.5611
 epoch: 87, train_loss: 0.7418, test_loss: 0.8703, test_f1: 0.5732
 epoch: 88, train_loss: 0.7484, test_loss: 0.8797, test_f1: 0.5548
 epoch: 89, train_loss: 0.7415, test_loss: 0.8987, test_f1: 0.5516
 epoch: 90, train_loss: 0.7381, test_loss: 0.8689, test_f1: 0.5601
 epoch: 91, train_loss: 0.7504, test_loss: 0.8832, test_f1: 0.5542
 epoch: 92, train_loss: 0.7496, test_loss: 0.8785, test_f1: 0.5445
 epoch: 93, train_loss: 0.7505, test_loss: 0.8823, test_f1: 0.5562
 epoch: 94, train_loss: 0.7486, test_loss: 0.8709, test_f1: 0.5593
 epoch: 95, train_loss: 0.7504, test_loss: 0.8604, test_f1: 0.5560
 epoch: 96, train_loss: 0.7384, test_loss: 0.8792, test_f1: 0.5553
 epoch: 97, train_loss: 0.7332, test_loss: 0.8445, test_f1: 0.5627
 epoch: 98, train_loss: 0.7479, test_loss: 0.8737, test_f1: 0.5564
 epoch: 99, train_loss: 0.7316, test_loss: 0.8535, test_f1: 0.5530
##################ITERATION #5 ****************************************
 epoch: 0, train_loss: 1.2930, test_loss: 1.1301, test_f1: 0.3612
 epoch: 1, train_loss: 1.1395, test_loss: 1.0386, test_f1: 0.4613
 epoch: 2, train_loss: 1.0856, test_loss: 1.0051, test_f1: 0.4524
 epoch: 3, train_loss: 1.0427, test_loss: 0.9934, test_f1: 0.4600
 epoch: 4, train_loss: 1.0346, test_loss: 0.9696, test_f1: 0.5010
 epoch: 5, train_loss: 1.0152, test_loss: 0.9910, test_f1: 0.4705
 epoch: 6, train_loss: 0.9812, test_loss: 0.9453, test_f1: 0.5041
 epoch: 7, train_loss: 0.9739, test_loss: 0.9503, test_f1: 0.5054
 epoch: 8, train_loss: 0.9638, test_loss: 1.0136, test_f1: 0.4531
 epoch: 9, train_loss: 0.9635, test_loss: 0.9674, test_f1: 0.4913
 epoch: 10, train_loss: 0.9562, test_loss: 0.9465, test_f1: 0.5122
 epoch: 11, train_loss: 0.9440, test_loss: 0.9376, test_f1: 0.5165
 epoch: 12, train_loss: 0.9359, test_loss: 0.9608, test_f1: 0.5020
 epoch: 13, train_loss: 0.9335, test_loss: 0.9607, test_f1: 0.5172
 epoch: 14, train_loss: 0.9301, test_loss: 0.9556, test_f1: 0.5077
 epoch: 15, train_loss: 0.9343, test_loss: 0.9395, test_f1: 0.5125
 epoch: 16, train_loss: 0.9177, test_loss: 0.9504, test_f1: 0.4835
 epoch: 17, train_loss: 0.9060, test_loss: 0.9336, test_f1: 0.5184
 epoch: 18, train_loss: 0.8938, test_loss: 0.9347, test_f1: 0.5001
 epoch: 19, train_loss: 0.9092, test_loss: 0.9424, test_f1: 0.4949
 epoch: 20, train_loss: 0.8953, test_loss: 0.9240, test_f1: 0.5210
 epoch: 21, train_loss: 0.8880, test_loss: 0.9237, test_f1: 0.5272
 epoch: 22, train_loss: 0.8738, test_loss: 0.9427, test_f1: 0.5195
 epoch: 23, train_loss: 0.8886, test_loss: 0.9124, test_f1: 0.5254
 epoch: 24, train_loss: 0.8814, test_loss: 1.0628, test_f1: 0.4620
 epoch: 25, train_loss: 0.8757, test_loss: 0.9309, test_f1: 0.5082
 epoch: 26, train_loss: 0.8735, test_loss: 0.9592, test_f1: 0.5119
 epoch: 27, train_loss: 0.8664, test_loss: 0.9396, test_f1: 0.5369
 epoch: 28, train_loss: 0.8575, test_loss: 0.9275, test_f1: 0.5179
 epoch: 29, train_loss: 0.8460, test_loss: 0.8960, test_f1: 0.5333
 epoch: 30, train_loss: 0.8576, test_loss: 0.9195, test_f1: 0.5139
 epoch: 31, train_loss: 0.8554, test_loss: 0.9472, test_f1: 0.5092
 epoch: 32, train_loss: 0.8464, test_loss: 0.9427, test_f1: 0.5276
 epoch: 33, train_loss: 0.8423, test_loss: 0.9247, test_f1: 0.5379
 epoch: 34, train_loss: 0.8340, test_loss: 0.9251, test_f1: 0.5293
 epoch: 35, train_loss: 0.8318, test_loss: 0.9166, test_f1: 0.5342
 epoch: 36, train_loss: 0.8285, test_loss: 0.9189, test_f1: 0.5325
 epoch: 37, train_loss: 0.8461, test_loss: 0.9320, test_f1: 0.5224
 epoch: 38, train_loss: 0.8345, test_loss: 0.9138, test_f1: 0.5299
 epoch: 39, train_loss: 0.8166, test_loss: 0.9093, test_f1: 0.5237
 epoch: 40, train_loss: 0.8209, test_loss: 0.9428, test_f1: 0.5301
 epoch: 41, train_loss: 0.8262, test_loss: 0.8926, test_f1: 0.5406
 epoch: 42, train_loss: 0.8210, test_loss: 0.9061, test_f1: 0.5456
 epoch: 43, train_loss: 0.8164, test_loss: 0.8888, test_f1: 0.5276
 epoch: 44, train_loss: 0.8199, test_loss: 0.9003, test_f1: 0.5415
 epoch: 45, train_loss: 0.8167, test_loss: 0.9060, test_f1: 0.5185
 epoch: 46, train_loss: 0.8105, test_loss: 0.9363, test_f1: 0.5004
 epoch: 47, train_loss: 0.8078, test_loss: 0.9150, test_f1: 0.5473
 epoch: 48, train_loss: 0.7980, test_loss: 0.8955, test_f1: 0.5308
 epoch: 49, train_loss: 0.8067, test_loss: 0.9162, test_f1: 0.5316
 epoch: 50, train_loss: 0.7977, test_loss: 0.9154, test_f1: 0.5346
 epoch: 51, train_loss: 0.7914, test_loss: 0.9385, test_f1: 0.5155
 epoch: 52, train_loss: 0.7771, test_loss: 0.8876, test_f1: 0.5456
 epoch: 53, train_loss: 0.7836, test_loss: 0.8711, test_f1: 0.5555
 epoch: 54, train_loss: 0.7648, test_loss: 0.9042, test_f1: 0.5303
 epoch: 55, train_loss: 0.7799, test_loss: 0.8886, test_f1: 0.5330
 epoch: 56, train_loss: 0.7766, test_loss: 0.8996, test_f1: 0.5436
 epoch: 57, train_loss: 0.7688, test_loss: 0.9186, test_f1: 0.5252
 epoch: 58, train_loss: 0.7742, test_loss: 0.9101, test_f1: 0.5324
 epoch: 59, train_loss: 0.7638, test_loss: 0.9423, test_f1: 0.5369
 epoch: 60, train_loss: 0.7814, test_loss: 0.9866, test_f1: 0.5085
 epoch: 61, train_loss: 0.7741, test_loss: 0.9275, test_f1: 0.5255
 epoch: 62, train_loss: 0.7717, test_loss: 0.9233, test_f1: 0.5238
 epoch: 63, train_loss: 0.7555, test_loss: 0.8953, test_f1: 0.5301
 epoch: 64, train_loss: 0.7572, test_loss: 0.9187, test_f1: 0.5316
 epoch: 65, train_loss: 0.7635, test_loss: 0.8927, test_f1: 0.5515
 epoch: 66, train_loss: 0.7628, test_loss: 0.8909, test_f1: 0.5313
 epoch: 67, train_loss: 0.7666, test_loss: 0.9414, test_f1: 0.5287
 epoch: 68, train_loss: 0.7608, test_loss: 0.8788, test_f1: 0.5513
 epoch: 69, train_loss: 0.7564, test_loss: 0.8895, test_f1: 0.5414
 epoch: 70, train_loss: 0.7545, test_loss: 0.8691, test_f1: 0.5490
 epoch: 71, train_loss: 0.7658, test_loss: 0.9016, test_f1: 0.5350
 epoch: 72, train_loss: 0.7485, test_loss: 0.9286, test_f1: 0.5289
 epoch: 73, train_loss: 0.7625, test_loss: 0.8826, test_f1: 0.5494
 epoch: 74, train_loss: 0.7562, test_loss: 0.9271, test_f1: 0.5272
 epoch: 75, train_loss: 0.7472, test_loss: 0.8683, test_f1: 0.5486
 epoch: 76, train_loss: 0.7475, test_loss: 0.9328, test_f1: 0.5197
 epoch: 77, train_loss: 0.7446, test_loss: 0.9076, test_f1: 0.5331
 epoch: 78, train_loss: 0.7563, test_loss: 0.9091, test_f1: 0.5240
 epoch: 79, train_loss: 0.7403, test_loss: 0.8594, test_f1: 0.5549
 epoch: 80, train_loss: 0.7502, test_loss: 0.9105, test_f1: 0.5275
 epoch: 81, train_loss: 0.7500, test_loss: 0.9553, test_f1: 0.5252
 epoch: 82, train_loss: 0.7380, test_loss: 0.9063, test_f1: 0.5328
 epoch: 83, train_loss: 0.7500, test_loss: 0.9172, test_f1: 0.5183
 epoch: 84, train_loss: 0.7373, test_loss: 0.9043, test_f1: 0.5426
 epoch: 85, train_loss: 0.7254, test_loss: 0.9126, test_f1: 0.5209
 epoch: 86, train_loss: 0.7397, test_loss: 0.9076, test_f1: 0.5272
 epoch: 87, train_loss: 0.7432, test_loss: 0.9160, test_f1: 0.5407
 epoch: 88, train_loss: 0.7386, test_loss: 0.8874, test_f1: 0.5428
 epoch: 89, train_loss: 0.7335, test_loss: 0.9029, test_f1: 0.5308
 epoch: 90, train_loss: 0.7443, test_loss: 0.8821, test_f1: 0.5379
 epoch: 91, train_loss: 0.7365, test_loss: 0.9040, test_f1: 0.5330
 epoch: 92, train_loss: 0.7253, test_loss: 0.9135, test_f1: 0.5324
 epoch: 93, train_loss: 0.7333, test_loss: 0.8573, test_f1: 0.5521
 epoch: 94, train_loss: 0.7361, test_loss: 0.8861, test_f1: 0.5350
 epoch: 95, train_loss: 0.7207, test_loss: 0.8665, test_f1: 0.5626
 epoch: 96, train_loss: 0.7241, test_loss: 0.9349, test_f1: 0.5352
 epoch: 97, train_loss: 0.7231, test_loss: 0.9199, test_f1: 0.5449
 epoch: 98, train_loss: 0.7303, test_loss: 0.9066, test_f1: 0.5544
 epoch: 99, train_loss: 0.7293, test_loss: 0.9227, test_f1: 0.5367
##################ITERATION #6 ****************************************
 epoch: 0, train_loss: 1.3534, test_loss: 1.1813, test_f1: 0.3280
 epoch: 1, train_loss: 1.1129, test_loss: 1.0784, test_f1: 0.3796
 epoch: 2, train_loss: 1.0788, test_loss: 1.0718, test_f1: 0.3946
 epoch: 3, train_loss: 1.0664, test_loss: 1.0697, test_f1: 0.4019
 epoch: 4, train_loss: 1.0416, test_loss: 1.0552, test_f1: 0.4361
 epoch: 5, train_loss: 1.0266, test_loss: 1.0395, test_f1: 0.4592
 epoch: 6, train_loss: 1.0105, test_loss: 1.0317, test_f1: 0.4809
 epoch: 7, train_loss: 0.9969, test_loss: 1.0426, test_f1: 0.4858
 epoch: 8, train_loss: 0.9929, test_loss: 1.0316, test_f1: 0.4808
 epoch: 9, train_loss: 0.9666, test_loss: 1.0355, test_f1: 0.4923
 epoch: 10, train_loss: 0.9680, test_loss: 1.0239, test_f1: 0.4874
 epoch: 11, train_loss: 0.9650, test_loss: 1.0310, test_f1: 0.4905
 epoch: 12, train_loss: 0.9556, test_loss: 1.0348, test_f1: 0.4714
 epoch: 13, train_loss: 0.9415, test_loss: 1.0105, test_f1: 0.5069
 epoch: 14, train_loss: 0.9397, test_loss: 1.0035, test_f1: 0.5180
 epoch: 15, train_loss: 0.9273, test_loss: 1.0241, test_f1: 0.4897
 epoch: 16, train_loss: 0.9232, test_loss: 1.0183, test_f1: 0.5173
 epoch: 17, train_loss: 0.9219, test_loss: 0.9771, test_f1: 0.5161
 epoch: 18, train_loss: 0.9227, test_loss: 1.0008, test_f1: 0.4908
 epoch: 19, train_loss: 0.9048, test_loss: 0.9721, test_f1: 0.5198
 epoch: 20, train_loss: 0.8864, test_loss: 0.9835, test_f1: 0.5415
 epoch: 21, train_loss: 0.8959, test_loss: 0.9377, test_f1: 0.5245
 epoch: 22, train_loss: 0.8947, test_loss: 0.9949, test_f1: 0.5047
 epoch: 23, train_loss: 0.8817, test_loss: 0.9187, test_f1: 0.5381
 epoch: 24, train_loss: 0.8794, test_loss: 0.8960, test_f1: 0.5464
 epoch: 25, train_loss: 0.8834, test_loss: 0.9578, test_f1: 0.5353
 epoch: 26, train_loss: 0.8615, test_loss: 0.8846, test_f1: 0.5374
 epoch: 27, train_loss: 0.8685, test_loss: 0.9307, test_f1: 0.5259
 epoch: 28, train_loss: 0.8655, test_loss: 0.9244, test_f1: 0.5175
 epoch: 29, train_loss: 0.8553, test_loss: 0.9261, test_f1: 0.5085
 epoch: 30, train_loss: 0.8686, test_loss: 0.9001, test_f1: 0.5427
 epoch: 31, train_loss: 0.8554, test_loss: 0.9211, test_f1: 0.5260
 epoch: 32, train_loss: 0.8564, test_loss: 0.8748, test_f1: 0.5519
 epoch: 33, train_loss: 0.8475, test_loss: 0.9826, test_f1: 0.5204
 epoch: 34, train_loss: 0.8472, test_loss: 0.9185, test_f1: 0.5270
 epoch: 35, train_loss: 0.8469, test_loss: 0.8973, test_f1: 0.5393
 epoch: 36, train_loss: 0.8392, test_loss: 0.8645, test_f1: 0.5527
 epoch: 37, train_loss: 0.8316, test_loss: 0.9561, test_f1: 0.5063
 epoch: 38, train_loss: 0.8275, test_loss: 0.9007, test_f1: 0.5282
 epoch: 39, train_loss: 0.8214, test_loss: 0.8934, test_f1: 0.5370
 epoch: 40, train_loss: 0.8233, test_loss: 0.9178, test_f1: 0.5223
 epoch: 41, train_loss: 0.8344, test_loss: 0.8742, test_f1: 0.5440
 epoch: 42, train_loss: 0.8290, test_loss: 0.8717, test_f1: 0.5588
 epoch: 43, train_loss: 0.8317, test_loss: 0.9002, test_f1: 0.5416
 epoch: 44, train_loss: 0.8197, test_loss: 0.8869, test_f1: 0.5531
 epoch: 45, train_loss: 0.8127, test_loss: 0.9077, test_f1: 0.5194
 epoch: 46, train_loss: 0.8012, test_loss: 0.9001, test_f1: 0.5448
 epoch: 47, train_loss: 0.8039, test_loss: 0.8817, test_f1: 0.5532
 epoch: 48, train_loss: 0.7979, test_loss: 0.8830, test_f1: 0.5305
 epoch: 49, train_loss: 0.8102, test_loss: 0.8765, test_f1: 0.5268
 epoch: 50, train_loss: 0.8134, test_loss: 0.9162, test_f1: 0.5221
 epoch: 51, train_loss: 0.7887, test_loss: 0.8734, test_f1: 0.5344
 epoch: 52, train_loss: 0.7934, test_loss: 0.9091, test_f1: 0.5270
 epoch: 53, train_loss: 0.7805, test_loss: 0.9207, test_f1: 0.5306
 epoch: 54, train_loss: 0.7780, test_loss: 0.8668, test_f1: 0.5471
 epoch: 55, train_loss: 0.7706, test_loss: 0.8714, test_f1: 0.5488
 epoch: 56, train_loss: 0.7689, test_loss: 0.8664, test_f1: 0.5480
 epoch: 57, train_loss: 0.7663, test_loss: 0.8833, test_f1: 0.5400
 epoch: 58, train_loss: 0.7735, test_loss: 0.8826, test_f1: 0.5512
 epoch: 59, train_loss: 0.7670, test_loss: 0.8708, test_f1: 0.5339
 epoch: 60, train_loss: 0.7595, test_loss: 0.8817, test_f1: 0.5298
 epoch: 61, train_loss: 0.7556, test_loss: 0.8713, test_f1: 0.5317
 epoch: 62, train_loss: 0.7675, test_loss: 0.8971, test_f1: 0.5296
 epoch: 63, train_loss: 0.7452, test_loss: 0.8723, test_f1: 0.5393
 epoch: 64, train_loss: 0.7742, test_loss: 0.8668, test_f1: 0.5491
 epoch: 65, train_loss: 0.7637, test_loss: 0.8900, test_f1: 0.5309
 epoch: 66, train_loss: 0.7626, test_loss: 0.9030, test_f1: 0.5358
 epoch: 67, train_loss: 0.7595, test_loss: 0.8435, test_f1: 0.5620
 epoch: 68, train_loss: 0.7563, test_loss: 0.8748, test_f1: 0.5413
 epoch: 69, train_loss: 0.7543, test_loss: 0.8981, test_f1: 0.5316
 epoch: 70, train_loss: 0.7462, test_loss: 0.9108, test_f1: 0.5319
 epoch: 71, train_loss: 0.7523, test_loss: 0.8647, test_f1: 0.5409
 epoch: 72, train_loss: 0.7446, test_loss: 0.8538, test_f1: 0.5546
 epoch: 73, train_loss: 0.7501, test_loss: 0.9240, test_f1: 0.5166
 epoch: 74, train_loss: 0.7562, test_loss: 0.8637, test_f1: 0.5485
 epoch: 75, train_loss: 0.7446, test_loss: 0.9088, test_f1: 0.5318
 epoch: 76, train_loss: 0.7597, test_loss: 0.8283, test_f1: 0.5620
 epoch: 77, train_loss: 0.7523, test_loss: 0.8916, test_f1: 0.5406
 epoch: 78, train_loss: 0.7494, test_loss: 0.9005, test_f1: 0.5307
 epoch: 79, train_loss: 0.7432, test_loss: 0.8821, test_f1: 0.5419
 epoch: 80, train_loss: 0.7433, test_loss: 0.8497, test_f1: 0.5514
 epoch: 81, train_loss: 0.7274, test_loss: 0.9383, test_f1: 0.5313
 epoch: 82, train_loss: 0.7331, test_loss: 0.8740, test_f1: 0.5488
 epoch: 83, train_loss: 0.7456, test_loss: 0.9105, test_f1: 0.5516
 epoch: 84, train_loss: 0.7323, test_loss: 0.8613, test_f1: 0.5445
 epoch: 85, train_loss: 0.7406, test_loss: 0.8562, test_f1: 0.5501
 epoch: 86, train_loss: 0.7284, test_loss: 0.8907, test_f1: 0.5378
 epoch: 87, train_loss: 0.7349, test_loss: 0.8778, test_f1: 0.5545
 epoch: 88, train_loss: 0.7452, test_loss: 0.9023, test_f1: 0.5395
 epoch: 89, train_loss: 0.7295, test_loss: 0.9159, test_f1: 0.5372
 epoch: 90, train_loss: 0.7332, test_loss: 0.9051, test_f1: 0.5497
 epoch: 91, train_loss: 0.7374, test_loss: 0.9250, test_f1: 0.5198
 epoch: 92, train_loss: 0.7257, test_loss: 0.8702, test_f1: 0.5437
 epoch: 93, train_loss: 0.7402, test_loss: 0.8893, test_f1: 0.5371
 epoch: 94, train_loss: 0.7328, test_loss: 0.8618, test_f1: 0.5365
 epoch: 95, train_loss: 0.7267, test_loss: 0.8614, test_f1: 0.5461
 epoch: 96, train_loss: 0.7299, test_loss: 0.9040, test_f1: 0.5345
 epoch: 97, train_loss: 0.7212, test_loss: 0.8528, test_f1: 0.5522
 epoch: 98, train_loss: 0.7216, test_loss: 0.8959, test_f1: 0.5310
 epoch: 99, train_loss: 0.7344, test_loss: 0.8941, test_f1: 0.5507
##################ITERATION #7 ****************************************
 epoch: 0, train_loss: 1.2681, test_loss: 1.1783, test_f1: 0.4319
 epoch: 1, train_loss: 1.1447, test_loss: 1.0355, test_f1: 0.4782
 epoch: 2, train_loss: 1.0908, test_loss: 1.0130, test_f1: 0.4743
 epoch: 3, train_loss: 1.0747, test_loss: 0.9906, test_f1: 0.4454
 epoch: 4, train_loss: 1.0373, test_loss: 1.0251, test_f1: 0.4023
 epoch: 5, train_loss: 1.0141, test_loss: 0.9859, test_f1: 0.4900
 epoch: 6, train_loss: 1.0067, test_loss: 0.9919, test_f1: 0.4885
 epoch: 7, train_loss: 0.9998, test_loss: 0.9901, test_f1: 0.4688
 epoch: 8, train_loss: 0.9973, test_loss: 0.9961, test_f1: 0.4681
 epoch: 9, train_loss: 0.9828, test_loss: 1.0091, test_f1: 0.4745
 epoch: 10, train_loss: 0.9673, test_loss: 0.9653, test_f1: 0.4996
 epoch: 11, train_loss: 0.9667, test_loss: 1.0937, test_f1: 0.4753
 epoch: 12, train_loss: 0.9641, test_loss: 0.9992, test_f1: 0.4856
 epoch: 13, train_loss: 0.9449, test_loss: 0.9550, test_f1: 0.5166
 epoch: 14, train_loss: 0.9398, test_loss: 0.9635, test_f1: 0.5273
 epoch: 15, train_loss: 0.9383, test_loss: 0.9691, test_f1: 0.5174
 epoch: 16, train_loss: 0.9283, test_loss: 0.9847, test_f1: 0.5129
 epoch: 17, train_loss: 0.9252, test_loss: 0.9867, test_f1: 0.5103
 epoch: 18, train_loss: 0.9126, test_loss: 0.9532, test_f1: 0.5424
 epoch: 19, train_loss: 0.9159, test_loss: 0.9502, test_f1: 0.5095
 epoch: 20, train_loss: 0.9023, test_loss: 0.9189, test_f1: 0.5421
 epoch: 21, train_loss: 0.9005, test_loss: 0.9530, test_f1: 0.5303
 epoch: 22, train_loss: 0.9004, test_loss: 0.9693, test_f1: 0.5227
 epoch: 23, train_loss: 0.8984, test_loss: 0.9674, test_f1: 0.5445
 epoch: 24, train_loss: 0.8938, test_loss: 0.9542, test_f1: 0.5115
 epoch: 25, train_loss: 0.8860, test_loss: 0.9371, test_f1: 0.5311
 epoch: 26, train_loss: 0.8855, test_loss: 1.0071, test_f1: 0.5215
 epoch: 27, train_loss: 0.8858, test_loss: 0.9823, test_f1: 0.5141
 epoch: 28, train_loss: 0.8772, test_loss: 0.9270, test_f1: 0.5239
 epoch: 29, train_loss: 0.8714, test_loss: 0.9315, test_f1: 0.5265
 epoch: 30, train_loss: 0.8567, test_loss: 1.0065, test_f1: 0.5065
 epoch: 31, train_loss: 0.8693, test_loss: 0.9397, test_f1: 0.5149
 epoch: 32, train_loss: 0.8635, test_loss: 1.0484, test_f1: 0.5085
 epoch: 33, train_loss: 0.8697, test_loss: 1.0297, test_f1: 0.5111
 epoch: 34, train_loss: 0.8539, test_loss: 0.9226, test_f1: 0.5321
 epoch: 35, train_loss: 0.8567, test_loss: 0.9537, test_f1: 0.5150
 epoch: 36, train_loss: 0.8484, test_loss: 0.9217, test_f1: 0.5435
 epoch: 37, train_loss: 0.8408, test_loss: 0.9819, test_f1: 0.4910
 epoch: 38, train_loss: 0.8507, test_loss: 0.9738, test_f1: 0.5179
 epoch: 39, train_loss: 0.8499, test_loss: 0.9581, test_f1: 0.5167
 epoch: 40, train_loss: 0.8383, test_loss: 0.9411, test_f1: 0.5359
 epoch: 41, train_loss: 0.8406, test_loss: 0.9358, test_f1: 0.5384
 epoch: 42, train_loss: 0.8299, test_loss: 0.9911, test_f1: 0.5078
 epoch: 43, train_loss: 0.8432, test_loss: 0.9284, test_f1: 0.5316
 epoch: 44, train_loss: 0.8436, test_loss: 0.9237, test_f1: 0.5313
 epoch: 45, train_loss: 0.8498, test_loss: 0.9293, test_f1: 0.5194
 epoch: 46, train_loss: 0.8361, test_loss: 0.9282, test_f1: 0.5373
 epoch: 47, train_loss: 0.8417, test_loss: 0.9302, test_f1: 0.5332
 epoch: 48, train_loss: 0.8127, test_loss: 0.9258, test_f1: 0.5534
 epoch: 49, train_loss: 0.8374, test_loss: 0.9464, test_f1: 0.5222
 epoch: 50, train_loss: 0.8171, test_loss: 0.9881, test_f1: 0.5414
 epoch: 51, train_loss: 0.8126, test_loss: 0.9504, test_f1: 0.5355
 epoch: 52, train_loss: 0.8097, test_loss: 0.9170, test_f1: 0.5555
 epoch: 53, train_loss: 0.8028, test_loss: 0.9197, test_f1: 0.5469
 epoch: 54, train_loss: 0.7970, test_loss: 0.9235, test_f1: 0.5544
 epoch: 55, train_loss: 0.7935, test_loss: 0.9648, test_f1: 0.5327
 epoch: 56, train_loss: 0.8020, test_loss: 0.9251, test_f1: 0.5531
 epoch: 57, train_loss: 0.7984, test_loss: 0.9417, test_f1: 0.5196
 epoch: 58, train_loss: 0.7975, test_loss: 0.9744, test_f1: 0.5209
 epoch: 59, train_loss: 0.7903, test_loss: 0.9567, test_f1: 0.5419
 epoch: 60, train_loss: 0.7850, test_loss: 0.9097, test_f1: 0.5454
 epoch: 61, train_loss: 0.7756, test_loss: 0.9208, test_f1: 0.5483
 epoch: 62, train_loss: 0.7906, test_loss: 0.9240, test_f1: 0.5537
 epoch: 63, train_loss: 0.7896, test_loss: 0.9665, test_f1: 0.5329
 epoch: 64, train_loss: 0.7871, test_loss: 0.9671, test_f1: 0.5296
 epoch: 65, train_loss: 0.7781, test_loss: 0.9376, test_f1: 0.5282
 epoch: 66, train_loss: 0.7862, test_loss: 0.9765, test_f1: 0.5309
 epoch: 67, train_loss: 0.7857, test_loss: 0.9105, test_f1: 0.5490
 epoch: 68, train_loss: 0.7835, test_loss: 0.9424, test_f1: 0.5165
 epoch: 69, train_loss: 0.7850, test_loss: 1.0203, test_f1: 0.5365
 epoch: 70, train_loss: 0.7836, test_loss: 0.9357, test_f1: 0.5438
 epoch: 71, train_loss: 0.7822, test_loss: 1.0248, test_f1: 0.5317
 epoch: 72, train_loss: 0.7755, test_loss: 0.9295, test_f1: 0.5484
 epoch: 73, train_loss: 0.7752, test_loss: 0.9272, test_f1: 0.5414
 epoch: 74, train_loss: 0.7869, test_loss: 0.9436, test_f1: 0.5363
 epoch: 75, train_loss: 0.7717, test_loss: 0.9304, test_f1: 0.5474
 epoch: 76, train_loss: 0.7731, test_loss: 0.9440, test_f1: 0.5440
 epoch: 77, train_loss: 0.7698, test_loss: 0.9375, test_f1: 0.5465
 epoch: 78, train_loss: 0.7798, test_loss: 1.0413, test_f1: 0.5186
 epoch: 79, train_loss: 0.7798, test_loss: 0.9069, test_f1: 0.5598
 epoch: 80, train_loss: 0.7743, test_loss: 0.9886, test_f1: 0.5439
 epoch: 81, train_loss: 0.7727, test_loss: 0.9476, test_f1: 0.5339
 epoch: 82, train_loss: 0.7723, test_loss: 0.9444, test_f1: 0.5489
 epoch: 83, train_loss: 0.7796, test_loss: 0.9608, test_f1: 0.5396
 epoch: 84, train_loss: 0.7619, test_loss: 0.9415, test_f1: 0.5446
 epoch: 85, train_loss: 0.7700, test_loss: 0.9231, test_f1: 0.5522
 epoch: 86, train_loss: 0.7609, test_loss: 0.9469, test_f1: 0.5356
 epoch: 87, train_loss: 0.7612, test_loss: 0.9390, test_f1: 0.5499
 epoch: 88, train_loss: 0.7663, test_loss: 0.9244, test_f1: 0.5513
 epoch: 89, train_loss: 0.7618, test_loss: 0.9212, test_f1: 0.5608
 epoch: 90, train_loss: 0.7505, test_loss: 0.9664, test_f1: 0.5247
 epoch: 91, train_loss: 0.7593, test_loss: 0.9077, test_f1: 0.5714
 epoch: 92, train_loss: 0.7522, test_loss: 0.9408, test_f1: 0.5544
 epoch: 93, train_loss: 0.7510, test_loss: 0.8921, test_f1: 0.5767
 epoch: 94, train_loss: 0.7613, test_loss: 0.9497, test_f1: 0.5476
 epoch: 95, train_loss: 0.7622, test_loss: 0.9243, test_f1: 0.5730
 epoch: 96, train_loss: 0.7529, test_loss: 0.9663, test_f1: 0.5470
 epoch: 97, train_loss: 0.7524, test_loss: 0.9790, test_f1: 0.5449
 epoch: 98, train_loss: 0.7666, test_loss: 0.9184, test_f1: 0.5546
 epoch: 99, train_loss: 0.7562, test_loss: 0.9103, test_f1: 0.5624
##################ITERATION #8 ****************************************
 epoch: 0, train_loss: 1.3814, test_loss: 1.2008, test_f1: 0.2448
 epoch: 1, train_loss: 1.1809, test_loss: 1.1012, test_f1: 0.3863
 epoch: 2, train_loss: 1.1391, test_loss: 1.0593, test_f1: 0.3619
 epoch: 3, train_loss: 1.0949, test_loss: 1.0298, test_f1: 0.4003
 epoch: 4, train_loss: 1.0764, test_loss: 1.0175, test_f1: 0.4051
 epoch: 5, train_loss: 1.0569, test_loss: 0.9981, test_f1: 0.4633
 epoch: 6, train_loss: 1.0388, test_loss: 0.9915, test_f1: 0.4856
 epoch: 7, train_loss: 1.0271, test_loss: 1.0031, test_f1: 0.4797
 epoch: 8, train_loss: 1.0251, test_loss: 0.9926, test_f1: 0.4710
 epoch: 9, train_loss: 1.0095, test_loss: 1.0053, test_f1: 0.4580
 epoch: 10, train_loss: 1.0013, test_loss: 0.9906, test_f1: 0.4825
 epoch: 11, train_loss: 0.9907, test_loss: 1.0014, test_f1: 0.4471
 epoch: 12, train_loss: 0.9867, test_loss: 0.9966, test_f1: 0.4821
 epoch: 13, train_loss: 0.9767, test_loss: 0.9940, test_f1: 0.4466
 epoch: 14, train_loss: 0.9717, test_loss: 0.9698, test_f1: 0.4962
 epoch: 15, train_loss: 0.9707, test_loss: 0.9639, test_f1: 0.5013
 epoch: 16, train_loss: 0.9532, test_loss: 0.9681, test_f1: 0.5179
 epoch: 17, train_loss: 0.9416, test_loss: 0.9566, test_f1: 0.5088
 epoch: 18, train_loss: 0.9376, test_loss: 0.9569, test_f1: 0.5216
 epoch: 19, train_loss: 0.9381, test_loss: 0.9618, test_f1: 0.5121
 epoch: 20, train_loss: 0.9455, test_loss: 0.9657, test_f1: 0.5093
 epoch: 21, train_loss: 0.9269, test_loss: 0.9526, test_f1: 0.5118
 epoch: 22, train_loss: 0.9206, test_loss: 0.9565, test_f1: 0.5146
 epoch: 23, train_loss: 0.9236, test_loss: 0.9781, test_f1: 0.5042
 epoch: 24, train_loss: 0.9132, test_loss: 0.9781, test_f1: 0.4886
 epoch: 25, train_loss: 0.9156, test_loss: 0.9564, test_f1: 0.5072
 epoch: 26, train_loss: 0.8984, test_loss: 0.9406, test_f1: 0.5251
 epoch: 27, train_loss: 0.8875, test_loss: 0.9738, test_f1: 0.4949
 epoch: 28, train_loss: 0.8881, test_loss: 0.9559, test_f1: 0.5119
 epoch: 29, train_loss: 0.8999, test_loss: 0.9322, test_f1: 0.5213
 epoch: 30, train_loss: 0.8828, test_loss: 0.9176, test_f1: 0.5384
 epoch: 31, train_loss: 0.8735, test_loss: 0.9287, test_f1: 0.5314
 epoch: 32, train_loss: 0.8699, test_loss: 0.9299, test_f1: 0.5152
 epoch: 33, train_loss: 0.8766, test_loss: 0.9651, test_f1: 0.5131
 epoch: 34, train_loss: 0.8789, test_loss: 0.9121, test_f1: 0.5347
 epoch: 35, train_loss: 0.8724, test_loss: 0.9172, test_f1: 0.5468
 epoch: 36, train_loss: 0.8548, test_loss: 0.9361, test_f1: 0.5249
 epoch: 37, train_loss: 0.8457, test_loss: 0.9676, test_f1: 0.5197
 epoch: 38, train_loss: 0.8588, test_loss: 0.9197, test_f1: 0.5485
 epoch: 39, train_loss: 0.8476, test_loss: 0.9137, test_f1: 0.5329
 epoch: 40, train_loss: 0.8425, test_loss: 0.9365, test_f1: 0.5133
 epoch: 41, train_loss: 0.8466, test_loss: 0.9718, test_f1: 0.5177
 epoch: 42, train_loss: 0.8340, test_loss: 0.9119, test_f1: 0.5231
 epoch: 43, train_loss: 0.8234, test_loss: 0.9341, test_f1: 0.5444
 epoch: 44, train_loss: 0.8333, test_loss: 0.9127, test_f1: 0.5349
 epoch: 45, train_loss: 0.8110, test_loss: 0.9060, test_f1: 0.5396
 epoch: 46, train_loss: 0.8147, test_loss: 0.8918, test_f1: 0.5605
 epoch: 47, train_loss: 0.8236, test_loss: 0.8711, test_f1: 0.5644
 epoch: 48, train_loss: 0.8062, test_loss: 0.8904, test_f1: 0.5477
 epoch: 49, train_loss: 0.8059, test_loss: 0.8771, test_f1: 0.5611
 epoch: 50, train_loss: 0.8117, test_loss: 0.9290, test_f1: 0.5505
 epoch: 51, train_loss: 0.8082, test_loss: 0.9082, test_f1: 0.5376
 epoch: 52, train_loss: 0.7911, test_loss: 0.8947, test_f1: 0.5434
 epoch: 53, train_loss: 0.7941, test_loss: 0.8840, test_f1: 0.5569
 epoch: 54, train_loss: 0.7852, test_loss: 0.9015, test_f1: 0.5454
 epoch: 55, train_loss: 0.7791, test_loss: 0.8747, test_f1: 0.5527
 epoch: 56, train_loss: 0.7786, test_loss: 0.8828, test_f1: 0.5697
 epoch: 57, train_loss: 0.7684, test_loss: 0.8822, test_f1: 0.5538
 epoch: 58, train_loss: 0.7779, test_loss: 0.8846, test_f1: 0.5726
 epoch: 59, train_loss: 0.7749, test_loss: 0.8791, test_f1: 0.5818
 epoch: 60, train_loss: 0.7726, test_loss: 0.8599, test_f1: 0.5656
 epoch: 61, train_loss: 0.7687, test_loss: 0.8528, test_f1: 0.5579
 epoch: 62, train_loss: 0.7719, test_loss: 0.8789, test_f1: 0.5626
 epoch: 63, train_loss: 0.7683, test_loss: 0.8815, test_f1: 0.5583
 epoch: 64, train_loss: 0.7684, test_loss: 0.8622, test_f1: 0.5725
 epoch: 65, train_loss: 0.7727, test_loss: 0.8663, test_f1: 0.5618
 epoch: 66, train_loss: 0.7637, test_loss: 0.8639, test_f1: 0.5693
 epoch: 67, train_loss: 0.7644, test_loss: 0.8784, test_f1: 0.5566
 epoch: 68, train_loss: 0.7563, test_loss: 0.8576, test_f1: 0.5655
 epoch: 69, train_loss: 0.7626, test_loss: 0.8585, test_f1: 0.5726
 epoch: 70, train_loss: 0.7570, test_loss: 0.8913, test_f1: 0.5536
 epoch: 71, train_loss: 0.7525, test_loss: 0.8635, test_f1: 0.5840
 epoch: 72, train_loss: 0.7517, test_loss: 0.8712, test_f1: 0.5695
 epoch: 73, train_loss: 0.7431, test_loss: 0.8813, test_f1: 0.5665
 epoch: 74, train_loss: 0.7496, test_loss: 0.8688, test_f1: 0.5715
 epoch: 75, train_loss: 0.7423, test_loss: 0.8798, test_f1: 0.5610
 epoch: 76, train_loss: 0.7469, test_loss: 0.8677, test_f1: 0.5755
 epoch: 77, train_loss: 0.7403, test_loss: 0.8685, test_f1: 0.5733
 epoch: 78, train_loss: 0.7589, test_loss: 0.8816, test_f1: 0.5714
 epoch: 79, train_loss: 0.7398, test_loss: 0.8741, test_f1: 0.5639
 epoch: 80, train_loss: 0.7376, test_loss: 0.8575, test_f1: 0.5752
 epoch: 81, train_loss: 0.7396, test_loss: 0.8547, test_f1: 0.5748
 epoch: 82, train_loss: 0.7454, test_loss: 0.8830, test_f1: 0.5775
 epoch: 83, train_loss: 0.7320, test_loss: 0.8682, test_f1: 0.5560
 epoch: 84, train_loss: 0.7380, test_loss: 0.8925, test_f1: 0.5692
 epoch: 85, train_loss: 0.7484, test_loss: 0.8882, test_f1: 0.5649
 epoch: 86, train_loss: 0.7291, test_loss: 0.8859, test_f1: 0.5741
 epoch: 87, train_loss: 0.7325, test_loss: 0.8752, test_f1: 0.5710
 epoch: 88, train_loss: 0.7415, test_loss: 0.9016, test_f1: 0.5565
 epoch: 89, train_loss: 0.7332, test_loss: 0.8524, test_f1: 0.5812
 epoch: 90, train_loss: 0.7332, test_loss: 0.8661, test_f1: 0.5842
 epoch: 91, train_loss: 0.7304, test_loss: 0.8683, test_f1: 0.5779
 epoch: 92, train_loss: 0.7236, test_loss: 0.8917, test_f1: 0.5735
 epoch: 93, train_loss: 0.7405, test_loss: 0.9046, test_f1: 0.5642
 epoch: 94, train_loss: 0.7196, test_loss: 0.8965, test_f1: 0.5578
 epoch: 95, train_loss: 0.7199, test_loss: 0.9064, test_f1: 0.5556
 epoch: 96, train_loss: 0.7325, test_loss: 0.8991, test_f1: 0.5556
 epoch: 97, train_loss: 0.7167, test_loss: 0.8700, test_f1: 0.5785
 epoch: 98, train_loss: 0.7235, test_loss: 0.9142, test_f1: 0.5654
 epoch: 99, train_loss: 0.7230, test_loss: 0.8898, test_f1: 0.5768
##################ITERATION #9 ****************************************
 epoch: 0, train_loss: 1.4187, test_loss: 1.1793, test_f1: 0.2766
 epoch: 1, train_loss: 1.2082, test_loss: 1.0997, test_f1: 0.4405
 epoch: 2, train_loss: 1.1467, test_loss: 1.0512, test_f1: 0.4521
 epoch: 3, train_loss: 1.0946, test_loss: 1.0128, test_f1: 0.4518
 epoch: 4, train_loss: 1.0539, test_loss: 1.0132, test_f1: 0.4667
 epoch: 5, train_loss: 1.0459, test_loss: 1.0077, test_f1: 0.4592
 epoch: 6, train_loss: 1.0149, test_loss: 1.0152, test_f1: 0.4542
 epoch: 7, train_loss: 1.0148, test_loss: 0.9621, test_f1: 0.4970
 epoch: 8, train_loss: 0.9883, test_loss: 0.9422, test_f1: 0.4995
 epoch: 9, train_loss: 0.9935, test_loss: 1.0011, test_f1: 0.4944
 epoch: 10, train_loss: 0.9671, test_loss: 0.9671, test_f1: 0.5156
 epoch: 11, train_loss: 0.9633, test_loss: 0.9014, test_f1: 0.5076
 epoch: 12, train_loss: 0.9719, test_loss: 0.9365, test_f1: 0.5166
 epoch: 13, train_loss: 0.9508, test_loss: 0.9284, test_f1: 0.5064
 epoch: 14, train_loss: 0.9357, test_loss: 0.9283, test_f1: 0.5102
 epoch: 15, train_loss: 0.9231, test_loss: 0.9192, test_f1: 0.5080
 epoch: 16, train_loss: 0.9141, test_loss: 0.9193, test_f1: 0.5030
 epoch: 17, train_loss: 0.9198, test_loss: 0.9434, test_f1: 0.4727
 epoch: 18, train_loss: 0.9134, test_loss: 0.9163, test_f1: 0.5048
 epoch: 19, train_loss: 0.9112, test_loss: 0.9308, test_f1: 0.4893
 epoch: 20, train_loss: 0.8980, test_loss: 0.9302, test_f1: 0.5118
 epoch: 21, train_loss: 0.8983, test_loss: 0.9079, test_f1: 0.5141
 epoch: 22, train_loss: 0.8891, test_loss: 0.8785, test_f1: 0.5028
 epoch: 23, train_loss: 0.8856, test_loss: 0.9141, test_f1: 0.5211
 epoch: 24, train_loss: 0.8797, test_loss: 0.8920, test_f1: 0.5264
 epoch: 25, train_loss: 0.8795, test_loss: 0.9165, test_f1: 0.5236
 epoch: 26, train_loss: 0.8875, test_loss: 0.9019, test_f1: 0.5156
 epoch: 27, train_loss: 0.8765, test_loss: 0.9107, test_f1: 0.5118
 epoch: 28, train_loss: 0.8580, test_loss: 0.8992, test_f1: 0.5387
 epoch: 29, train_loss: 0.8615, test_loss: 0.9005, test_f1: 0.5313
 epoch: 30, train_loss: 0.8590, test_loss: 0.9217, test_f1: 0.5234
 epoch: 31, train_loss: 0.8445, test_loss: 0.8964, test_f1: 0.5217
 epoch: 32, train_loss: 0.8367, test_loss: 0.9332, test_f1: 0.5219
 epoch: 33, train_loss: 0.8388, test_loss: 0.9140, test_f1: 0.5289
 epoch: 34, train_loss: 0.8454, test_loss: 0.8954, test_f1: 0.5453
 epoch: 35, train_loss: 0.8431, test_loss: 0.9318, test_f1: 0.5086
 epoch: 36, train_loss: 0.8311, test_loss: 0.8807, test_f1: 0.5410
 epoch: 37, train_loss: 0.8385, test_loss: 0.8780, test_f1: 0.5448
 epoch: 38, train_loss: 0.8218, test_loss: 0.8946, test_f1: 0.5318
 epoch: 39, train_loss: 0.8266, test_loss: 0.8755, test_f1: 0.5399
 epoch: 40, train_loss: 0.8230, test_loss: 0.9009, test_f1: 0.5404
 epoch: 41, train_loss: 0.8070, test_loss: 0.8819, test_f1: 0.5473
 epoch: 42, train_loss: 0.8165, test_loss: 0.8942, test_f1: 0.5456
 epoch: 43, train_loss: 0.8128, test_loss: 0.8609, test_f1: 0.5492
 epoch: 44, train_loss: 0.8102, test_loss: 0.9076, test_f1: 0.5319
 epoch: 45, train_loss: 0.8144, test_loss: 0.9452, test_f1: 0.5279
 epoch: 46, train_loss: 0.7936, test_loss: 0.8898, test_f1: 0.5433
 epoch: 47, train_loss: 0.7872, test_loss: 0.8942, test_f1: 0.5355
 epoch: 48, train_loss: 0.7970, test_loss: 0.8994, test_f1: 0.5358
 epoch: 49, train_loss: 0.7960, test_loss: 0.8874, test_f1: 0.5404
 epoch: 50, train_loss: 0.7931, test_loss: 0.8923, test_f1: 0.5398
 epoch: 51, train_loss: 0.7861, test_loss: 0.8668, test_f1: 0.5627
 epoch: 52, train_loss: 0.7731, test_loss: 0.8503, test_f1: 0.5536
 epoch: 53, train_loss: 0.7769, test_loss: 0.8683, test_f1: 0.5609
 epoch: 54, train_loss: 0.7714, test_loss: 0.8784, test_f1: 0.5459
 epoch: 55, train_loss: 0.7619, test_loss: 0.9042, test_f1: 0.5395
 epoch: 56, train_loss: 0.7503, test_loss: 0.9038, test_f1: 0.5483
 epoch: 57, train_loss: 0.7594, test_loss: 0.8851, test_f1: 0.5550
 epoch: 58, train_loss: 0.7582, test_loss: 0.8728, test_f1: 0.5401
 epoch: 59, train_loss: 0.7629, test_loss: 0.8534, test_f1: 0.5660
 epoch: 60, train_loss: 0.7621, test_loss: 0.8639, test_f1: 0.5581
 epoch: 61, train_loss: 0.7522, test_loss: 0.8674, test_f1: 0.5435
 epoch: 62, train_loss: 0.7561, test_loss: 0.8774, test_f1: 0.5520
 epoch: 63, train_loss: 0.7639, test_loss: 0.8803, test_f1: 0.5495
 epoch: 64, train_loss: 0.7541, test_loss: 0.8694, test_f1: 0.5493
 epoch: 65, train_loss: 0.7496, test_loss: 0.8909, test_f1: 0.5405
 epoch: 66, train_loss: 0.7425, test_loss: 0.8775, test_f1: 0.5577
 epoch: 67, train_loss: 0.7496, test_loss: 0.9082, test_f1: 0.5503
 epoch: 68, train_loss: 0.7556, test_loss: 0.8578, test_f1: 0.5571
 epoch: 69, train_loss: 0.7493, test_loss: 0.9044, test_f1: 0.5411
 epoch: 70, train_loss: 0.7475, test_loss: 0.8656, test_f1: 0.5691
 epoch: 71, train_loss: 0.7539, test_loss: 0.8681, test_f1: 0.5460
 epoch: 72, train_loss: 0.7491, test_loss: 0.8580, test_f1: 0.5502
 epoch: 73, train_loss: 0.7471, test_loss: 0.8175, test_f1: 0.5709
 epoch: 74, train_loss: 0.7450, test_loss: 0.8813, test_f1: 0.5506
 epoch: 75, train_loss: 0.7401, test_loss: 0.8632, test_f1: 0.5630
 epoch: 76, train_loss: 0.7420, test_loss: 0.8706, test_f1: 0.5478
 epoch: 77, train_loss: 0.7414, test_loss: 0.8614, test_f1: 0.5677
 epoch: 78, train_loss: 0.7383, test_loss: 0.9086, test_f1: 0.5550
 epoch: 79, train_loss: 0.7417, test_loss: 0.8939, test_f1: 0.5486
 epoch: 80, train_loss: 0.7527, test_loss: 0.8721, test_f1: 0.5433
 epoch: 81, train_loss: 0.7313, test_loss: 0.8939, test_f1: 0.5474
 epoch: 82, train_loss: 0.7266, test_loss: 0.8712, test_f1: 0.5571
 epoch: 83, train_loss: 0.7330, test_loss: 0.8529, test_f1: 0.5499
 epoch: 84, train_loss: 0.7284, test_loss: 0.8489, test_f1: 0.5558
 epoch: 85, train_loss: 0.7243, test_loss: 0.8722, test_f1: 0.5597
 epoch: 86, train_loss: 0.7299, test_loss: 0.8961, test_f1: 0.5576
 epoch: 87, train_loss: 0.7326, test_loss: 0.8790, test_f1: 0.5417
 epoch: 88, train_loss: 0.7295, test_loss: 0.8949, test_f1: 0.5571
 epoch: 89, train_loss: 0.7209, test_loss: 0.8785, test_f1: 0.5522
 epoch: 90, train_loss: 0.7255, test_loss: 0.9088, test_f1: 0.5678
 epoch: 91, train_loss: 0.7290, test_loss: 0.8761, test_f1: 0.5596
 epoch: 92, train_loss: 0.7204, test_loss: 0.8863, test_f1: 0.5481
 epoch: 93, train_loss: 0.7217, test_loss: 0.8884, test_f1: 0.5635
 epoch: 94, train_loss: 0.7168, test_loss: 0.9025, test_f1: 0.5556
 epoch: 95, train_loss: 0.7229, test_loss: 0.9063, test_f1: 0.5514
 epoch: 96, train_loss: 0.7142, test_loss: 0.9003, test_f1: 0.5576
 epoch: 97, train_loss: 0.7169, test_loss: 0.9182, test_f1: 0.5445
 epoch: 98, train_loss: 0.7273, test_loss: 0.9072, test_f1: 0.5570
 epoch: 99, train_loss: 0.7250, test_loss: 0.9408, test_f1: 0.5339

Training completed in 683.46 seconds
Best F1: 0.5842 at epoch 90
Mean F1 across iterations: 0.5642  0.0135
========================FINAL RESULTS================================
FEGIN weighted F1: 0.5842  0.0135
python main.py --data ltspice_examples --representation component_pin --model FEGIN --layers 4 --hiddens 16 --batch_size 64 --lr 0.001 --emb_size 250 --epochs 100 --save_appendix component_pin_L4_H16_BS64_LR0.001_E250 --no_val
-----



STDERR:
  File "main.py", line 370, in <module>
    main()
  File "main.py", line 254, in main
    dataset = dataset_class(
  File "/home/philip/projects/ltspice_examples_code_repo/Circuit-Completion-Using-GNNs/component_classification_with_link_prediction_head/evaluation/FEGIN/kernel/circuit_datasets.py", line 15, in __init__
    self.data, self.slices = torch.load(self.processed_paths[0])
  File "/home/philip/.local/lib/python3.8/site-packages/torch/serialization.py", line 1040, in load
    warnings.warn(
  File "/usr/lib/python3.8/warnings.py", line 109, in _showwarnmsg
    sw(msg.message, msg.category, msg.filename, msg.lineno,
  File "main.py", line 47, in warn_with_traceback
    traceback.print_stack(file=log)
/home/philip/projects/ltspice_examples_code_repo/Circuit-Completion-Using-GNNs/component_classification_with_link_prediction_head/evaluation/FEGIN/kernel/circuit_datasets.py:15: FutureWarning: You are using `torch.load` with `weights_only=False` (the current default value), which uses the default pickle module implicitly. It is possible to construct malicious pickle data which will execute arbitrary code during unpickling (See https://github.com/pytorch/pytorch/blob/main/SECURITY.md#untrusted-models for more details). In a future release, the default value for `weights_only` will be flipped to `True`. This limits the functions that could be executed during unpickling. Arbitrary objects will no longer be allowed to be loaded via this mode unless they are explicitly allowlisted by the user via `torch.serialization.add_safe_globals`. We recommend you start setting `weights_only=True` for any use case where you don't have full control of the loaded file. Please open an issue on GitHub for any issues related to this experimental feature.
  self.data, self.slices = torch.load(self.processed_paths[0])
