STDOUT:
Results will be saved in /home/philip/projects/ltspice_examples_code_repo/Circuit-Completion-Using-GNNs/component_classification_with_link_prediction_head/evaluation/FEGIN/results/model_FEGIN_dataset_ltspice_demos
Command line input: python main.py --data ltspice_demos --representation component_pin --model FEGIN --layers 2 --hiddens 128 --batch_size 64 --lr 0.01 --emb_size 512 --epochs 100 --save_appendix component_pin_L2_H128_BS64_LR0.01_E512 --no_val
 is saved.
-----
ltspice_demos - FEGIN
Using 2 layers, 128 hidden units, h = 2
Loading component_pin representation dataset
ENTERED
Training FEGIN on component_pin representation
Train: 1565, Test: 383
##################ITERATION #0 ****************************************
 epoch: 0, train_loss: 1.1782, test_loss: 1.4149, test_f1: 0.1414
 epoch: 1, train_loss: 1.0194, test_loss: 1.4375, test_f1: 0.3219
 epoch: 2, train_loss: 0.9371, test_loss: 1.4185, test_f1: 0.4243
 epoch: 3, train_loss: 0.8949, test_loss: 1.0276, test_f1: 0.5470
 epoch: 4, train_loss: 0.8584, test_loss: 1.2127, test_f1: 0.4527
 epoch: 5, train_loss: 0.8411, test_loss: 1.3719, test_f1: 0.4474
 epoch: 6, train_loss: 0.8231, test_loss: 1.0404, test_f1: 0.5215
 epoch: 7, train_loss: 0.8242, test_loss: 0.9380, test_f1: 0.6093
 epoch: 8, train_loss: 0.7897, test_loss: 0.9951, test_f1: 0.5880
 epoch: 9, train_loss: 0.8002, test_loss: 1.4257, test_f1: 0.3274
 epoch: 10, train_loss: 0.7801, test_loss: 1.0800, test_f1: 0.6235
 epoch: 11, train_loss: 0.7771, test_loss: 1.0888, test_f1: 0.5918
 epoch: 12, train_loss: 0.7436, test_loss: 1.3224, test_f1: 0.4639
 epoch: 13, train_loss: 0.7771, test_loss: 1.0521, test_f1: 0.4678
 epoch: 14, train_loss: 0.7528, test_loss: 0.9230, test_f1: 0.5842
 epoch: 15, train_loss: 0.7321, test_loss: 0.9270, test_f1: 0.6413
 epoch: 16, train_loss: 0.7510, test_loss: 1.0091, test_f1: 0.6193
 epoch: 17, train_loss: 0.7271, test_loss: 1.2450, test_f1: 0.5317
 epoch: 18, train_loss: 0.7243, test_loss: 1.0495, test_f1: 0.5511
 epoch: 19, train_loss: 0.6927, test_loss: 0.9321, test_f1: 0.6198
 epoch: 20, train_loss: 0.6956, test_loss: 1.3576, test_f1: 0.5632
 epoch: 21, train_loss: 0.6874, test_loss: 1.0927, test_f1: 0.6155
 epoch: 22, train_loss: 0.6741, test_loss: 1.0097, test_f1: 0.6119
 epoch: 23, train_loss: 0.6547, test_loss: 0.9240, test_f1: 0.6449
 epoch: 24, train_loss: 0.6263, test_loss: 0.9709, test_f1: 0.6221
 epoch: 25, train_loss: 0.6468, test_loss: 1.2544, test_f1: 0.6253
 epoch: 26, train_loss: 0.6660, test_loss: 1.1158, test_f1: 0.6125
 epoch: 27, train_loss: 0.6281, test_loss: 1.0339, test_f1: 0.6275
 epoch: 28, train_loss: 0.6448, test_loss: 1.0187, test_f1: 0.6031
 epoch: 29, train_loss: 0.6173, test_loss: 1.0790, test_f1: 0.6487
 epoch: 30, train_loss: 0.6135, test_loss: 1.4216, test_f1: 0.6298
 epoch: 31, train_loss: 0.6214, test_loss: 1.1646, test_f1: 0.5626
 epoch: 32, train_loss: 0.5798, test_loss: 1.3872, test_f1: 0.5805
 epoch: 33, train_loss: 0.5994, test_loss: 1.8576, test_f1: 0.5733
 epoch: 34, train_loss: 0.5897, test_loss: 1.1339, test_f1: 0.6323
 epoch: 35, train_loss: 0.5778, test_loss: 1.3135, test_f1: 0.6226
 epoch: 36, train_loss: 0.5702, test_loss: 1.2935, test_f1: 0.6109
 epoch: 37, train_loss: 0.5604, test_loss: 1.6092, test_f1: 0.5728
 epoch: 38, train_loss: 0.5610, test_loss: 1.4712, test_f1: 0.6012
 epoch: 39, train_loss: 0.5672, test_loss: 0.9645, test_f1: 0.5824
 epoch: 40, train_loss: 0.5596, test_loss: 1.1321, test_f1: 0.6129
 epoch: 41, train_loss: 0.5217, test_loss: 1.4319, test_f1: 0.6254
 epoch: 42, train_loss: 0.4789, test_loss: 1.8352, test_f1: 0.6215
 epoch: 43, train_loss: 0.5110, test_loss: 1.4982, test_f1: 0.6216
 epoch: 44, train_loss: 0.5311, test_loss: 1.2242, test_f1: 0.5656
 epoch: 45, train_loss: 0.5627, test_loss: 2.3764, test_f1: 0.5410
 epoch: 46, train_loss: 0.5030, test_loss: 1.6596, test_f1: 0.5943
 epoch: 47, train_loss: 0.5180, test_loss: 1.7849, test_f1: 0.5712
 epoch: 48, train_loss: 0.5202, test_loss: 1.2655, test_f1: 0.5690
 epoch: 49, train_loss: 0.5021, test_loss: 1.2154, test_f1: 0.6369
 epoch: 50, train_loss: 0.5032, test_loss: 1.3719, test_f1: 0.6013
 epoch: 51, train_loss: 0.4448, test_loss: 1.3237, test_f1: 0.6135
 epoch: 52, train_loss: 0.3833, test_loss: 1.6973, test_f1: 0.6233
 epoch: 53, train_loss: 0.3943, test_loss: 1.8957, test_f1: 0.6119
 epoch: 54, train_loss: 0.3823, test_loss: 1.5437, test_f1: 0.6467
 epoch: 55, train_loss: 0.3550, test_loss: 2.0325, test_f1: 0.6273
 epoch: 56, train_loss: 0.3473, test_loss: 1.6087, test_f1: 0.6454
 epoch: 57, train_loss: 0.3794, test_loss: 1.6980, test_f1: 0.6450
 epoch: 58, train_loss: 0.3616, test_loss: 1.5122, test_f1: 0.6472
 epoch: 59, train_loss: 0.3321, test_loss: 1.4198, test_f1: 0.6591
 epoch: 60, train_loss: 0.3843, test_loss: 1.5849, test_f1: 0.6255
 epoch: 61, train_loss: 0.3378, test_loss: 1.6675, test_f1: 0.6334
 epoch: 62, train_loss: 0.3508, test_loss: 1.8087, test_f1: 0.6204
 epoch: 63, train_loss: 0.3305, test_loss: 1.9436, test_f1: 0.6365
 epoch: 64, train_loss: 0.3210, test_loss: 1.6835, test_f1: 0.6509
 epoch: 65, train_loss: 0.2944, test_loss: 2.0755, test_f1: 0.6383
 epoch: 66, train_loss: 0.2916, test_loss: 2.1021, test_f1: 0.6325
 epoch: 67, train_loss: 0.2941, test_loss: 1.9392, test_f1: 0.6540
 epoch: 68, train_loss: 0.2617, test_loss: 1.5964, test_f1: 0.6338
 epoch: 69, train_loss: 0.2927, test_loss: 2.0700, test_f1: 0.6615
 epoch: 70, train_loss: 0.2995, test_loss: 1.7512, test_f1: 0.6710
 epoch: 71, train_loss: 0.2724, test_loss: 1.6514, test_f1: 0.6171
 epoch: 72, train_loss: 0.2595, test_loss: 2.0777, test_f1: 0.6477
 epoch: 73, train_loss: 0.2987, test_loss: 1.7785, test_f1: 0.6153
 epoch: 74, train_loss: 0.2514, test_loss: 2.2632, test_f1: 0.6254
 epoch: 75, train_loss: 0.2798, test_loss: 1.8565, test_f1: 0.6398
 epoch: 76, train_loss: 0.2409, test_loss: 1.7983, test_f1: 0.6646
 epoch: 77, train_loss: 0.2426, test_loss: 1.8767, test_f1: 0.6585
 epoch: 78, train_loss: 0.1977, test_loss: 2.5101, test_f1: 0.6607
 epoch: 79, train_loss: 0.2244, test_loss: 1.8893, test_f1: 0.6542
 epoch: 80, train_loss: 0.2467, test_loss: 2.1206, test_f1: 0.6435
 epoch: 81, train_loss: 0.2226, test_loss: 2.3541, test_f1: 0.6600
 epoch: 82, train_loss: 0.1959, test_loss: 2.7621, test_f1: 0.6626
 epoch: 83, train_loss: 0.2492, test_loss: 2.1251, test_f1: 0.6599
 epoch: 84, train_loss: 0.2627, test_loss: 2.2300, test_f1: 0.6274
 epoch: 85, train_loss: 0.2546, test_loss: 1.8567, test_f1: 0.6777
 epoch: 86, train_loss: 0.2066, test_loss: 1.7955, test_f1: 0.6939
 epoch: 87, train_loss: 0.2305, test_loss: 1.9357, test_f1: 0.6658
 epoch: 88, train_loss: 0.2245, test_loss: 2.0305, test_f1: 0.7079
 epoch: 89, train_loss: 0.2494, test_loss: 2.0530, test_f1: 0.6295
 epoch: 90, train_loss: 0.2404, test_loss: 1.7799, test_f1: 0.6367
 epoch: 91, train_loss: 0.2031, test_loss: 2.0075, test_f1: 0.6568
 epoch: 92, train_loss: 0.2093, test_loss: 2.1671, test_f1: 0.6576
 epoch: 93, train_loss: 0.1964, test_loss: 2.3848, test_f1: 0.5988
 epoch: 94, train_loss: 0.2034, test_loss: 2.2846, test_f1: 0.6558
 epoch: 95, train_loss: 0.1910, test_loss: 2.2610, test_f1: 0.6848
 epoch: 96, train_loss: 0.2082, test_loss: 2.2513, test_f1: 0.6508
 epoch: 97, train_loss: 0.1667, test_loss: 2.2218, test_f1: 0.6361
 epoch: 98, train_loss: 0.1922, test_loss: 2.0050, test_f1: 0.7154
 epoch: 99, train_loss: 0.1945, test_loss: 2.2614, test_f1: 0.6752
##################ITERATION #1 ****************************************
 epoch: 0, train_loss: 1.1724, test_loss: 1.6223, test_f1: 0.1916
 epoch: 1, train_loss: 0.9624, test_loss: 1.1273, test_f1: 0.4716
 epoch: 2, train_loss: 0.9006, test_loss: 1.0179, test_f1: 0.4473
 epoch: 3, train_loss: 0.8573, test_loss: 1.3612, test_f1: 0.3933
 epoch: 4, train_loss: 0.8250, test_loss: 1.0371, test_f1: 0.5831
 epoch: 5, train_loss: 0.8084, test_loss: 1.0315, test_f1: 0.5235
 epoch: 6, train_loss: 0.7863, test_loss: 1.0975, test_f1: 0.5447
 epoch: 7, train_loss: 0.7967, test_loss: 1.0807, test_f1: 0.5552
 epoch: 8, train_loss: 0.7690, test_loss: 1.9217, test_f1: 0.4462
 epoch: 9, train_loss: 0.7585, test_loss: 1.0363, test_f1: 0.5801
 epoch: 10, train_loss: 0.7894, test_loss: 1.0053, test_f1: 0.5544
 epoch: 11, train_loss: 0.7532, test_loss: 0.9549, test_f1: 0.5983
 epoch: 12, train_loss: 0.7317, test_loss: 1.0836, test_f1: 0.5582
 epoch: 13, train_loss: 0.7232, test_loss: 1.1841, test_f1: 0.4560
 epoch: 14, train_loss: 0.7512, test_loss: 2.5455, test_f1: 0.2099
 epoch: 15, train_loss: 0.6959, test_loss: 1.0077, test_f1: 0.5786
 epoch: 16, train_loss: 0.6807, test_loss: 0.9580, test_f1: 0.6297
 epoch: 17, train_loss: 0.6771, test_loss: 1.2967, test_f1: 0.5474
 epoch: 18, train_loss: 0.6726, test_loss: 1.2101, test_f1: 0.6069
 epoch: 19, train_loss: 0.6305, test_loss: 1.5731, test_f1: 0.5167
 epoch: 20, train_loss: 0.6541, test_loss: 1.1018, test_f1: 0.6743
 epoch: 21, train_loss: 0.6305, test_loss: 1.2284, test_f1: 0.5533
 epoch: 22, train_loss: 0.6538, test_loss: 0.9867, test_f1: 0.6569
 epoch: 23, train_loss: 0.6179, test_loss: 1.2594, test_f1: 0.5109
 epoch: 24, train_loss: 0.6431, test_loss: 1.0585, test_f1: 0.6021
 epoch: 25, train_loss: 0.6113, test_loss: 1.2480, test_f1: 0.5892
 epoch: 26, train_loss: 0.5931, test_loss: 1.1828, test_f1: 0.5240
 epoch: 27, train_loss: 0.5989, test_loss: 1.0260, test_f1: 0.5580
 epoch: 28, train_loss: 0.5517, test_loss: 1.1084, test_f1: 0.5991
 epoch: 29, train_loss: 0.5508, test_loss: 1.3851, test_f1: 0.5972
 epoch: 30, train_loss: 0.5814, test_loss: 1.3767, test_f1: 0.4567
 epoch: 31, train_loss: 0.5619, test_loss: 1.1279, test_f1: 0.5697
 epoch: 32, train_loss: 0.5497, test_loss: 1.1201, test_f1: 0.6029
 epoch: 33, train_loss: 0.5525, test_loss: 1.1735, test_f1: 0.5969
 epoch: 34, train_loss: 0.6327, test_loss: 1.2432, test_f1: 0.5473
 epoch: 35, train_loss: 0.5762, test_loss: 1.1666, test_f1: 0.5568
 epoch: 36, train_loss: 0.5478, test_loss: 1.8012, test_f1: 0.5330
 epoch: 37, train_loss: 0.5550, test_loss: 0.9585, test_f1: 0.6593
 epoch: 38, train_loss: 0.4813, test_loss: 1.1523, test_f1: 0.6353
 epoch: 39, train_loss: 0.4926, test_loss: 1.0819, test_f1: 0.6078
 epoch: 40, train_loss: 0.4992, test_loss: 1.0774, test_f1: 0.6330
 epoch: 41, train_loss: 0.5398, test_loss: 1.0607, test_f1: 0.6593
 epoch: 42, train_loss: 0.5357, test_loss: 1.0149, test_f1: 0.6251
 epoch: 43, train_loss: 0.4759, test_loss: 1.2992, test_f1: 0.6170
 epoch: 44, train_loss: 0.4704, test_loss: 1.1249, test_f1: 0.6490
 epoch: 45, train_loss: 0.4588, test_loss: 1.0730, test_f1: 0.6400
 epoch: 46, train_loss: 0.4694, test_loss: 1.1975, test_f1: 0.6248
 epoch: 47, train_loss: 0.4680, test_loss: 1.0415, test_f1: 0.6596
 epoch: 48, train_loss: 0.4313, test_loss: 1.2089, test_f1: 0.6135
 epoch: 49, train_loss: 0.4210, test_loss: 1.3178, test_f1: 0.6349
 epoch: 50, train_loss: 0.4175, test_loss: 1.3114, test_f1: 0.6099
 epoch: 51, train_loss: 0.4006, test_loss: 1.3332, test_f1: 0.6208
 epoch: 52, train_loss: 0.3508, test_loss: 1.4862, test_f1: 0.6063
 epoch: 53, train_loss: 0.3316, test_loss: 1.5414, test_f1: 0.6364
 epoch: 54, train_loss: 0.3524, test_loss: 1.2979, test_f1: 0.6419
 epoch: 55, train_loss: 0.3090, test_loss: 1.6925, test_f1: 0.6182
 epoch: 56, train_loss: 0.3084, test_loss: 1.7660, test_f1: 0.6052
 epoch: 57, train_loss: 0.3223, test_loss: 1.6493, test_f1: 0.6387
 epoch: 58, train_loss: 0.3400, test_loss: 1.5116, test_f1: 0.6288
 epoch: 59, train_loss: 0.2913, test_loss: 1.6204, test_f1: 0.6429
 epoch: 60, train_loss: 0.2997, test_loss: 1.4554, test_f1: 0.6330
 epoch: 61, train_loss: 0.2863, test_loss: 1.5540, test_f1: 0.6313
 epoch: 62, train_loss: 0.2725, test_loss: 1.6082, test_f1: 0.6151
 epoch: 63, train_loss: 0.2752, test_loss: 1.6843, test_f1: 0.6692
 epoch: 64, train_loss: 0.2835, test_loss: 1.6425, test_f1: 0.6408
 epoch: 65, train_loss: 0.3064, test_loss: 1.5241, test_f1: 0.6348
 epoch: 66, train_loss: 0.2996, test_loss: 1.8829, test_f1: 0.6177
 epoch: 67, train_loss: 0.3146, test_loss: 2.0523, test_f1: 0.5276
 epoch: 68, train_loss: 0.3046, test_loss: 1.2982, test_f1: 0.6706
 epoch: 69, train_loss: 0.2889, test_loss: 1.3980, test_f1: 0.6540
 epoch: 70, train_loss: 0.2645, test_loss: 1.6536, test_f1: 0.6223
 epoch: 71, train_loss: 0.2668, test_loss: 1.6440, test_f1: 0.6370
 epoch: 72, train_loss: 0.2576, test_loss: 1.6285, test_f1: 0.6310
 epoch: 73, train_loss: 0.2696, test_loss: 1.8051, test_f1: 0.6083
 epoch: 74, train_loss: 0.2674, test_loss: 1.8309, test_f1: 0.6557
 epoch: 75, train_loss: 0.2514, test_loss: 1.7016, test_f1: 0.6611
 epoch: 76, train_loss: 0.2237, test_loss: 1.8580, test_f1: 0.6616
 epoch: 77, train_loss: 0.2274, test_loss: 2.0673, test_f1: 0.6338
 epoch: 78, train_loss: 0.2540, test_loss: 1.8794, test_f1: 0.6439
 epoch: 79, train_loss: 0.2355, test_loss: 2.2041, test_f1: 0.6206
 epoch: 80, train_loss: 0.2522, test_loss: 1.8672, test_f1: 0.6372
 epoch: 81, train_loss: 0.2376, test_loss: 2.0315, test_f1: 0.6656
 epoch: 82, train_loss: 0.2347, test_loss: 1.8652, test_f1: 0.6322
 epoch: 83, train_loss: 0.2839, test_loss: 1.9500, test_f1: 0.6141
 epoch: 84, train_loss: 0.2259, test_loss: 1.9766, test_f1: 0.6411
 epoch: 85, train_loss: 0.2029, test_loss: 1.7858, test_f1: 0.6309
 epoch: 86, train_loss: 0.2284, test_loss: 2.2281, test_f1: 0.6322
 epoch: 87, train_loss: 0.2320, test_loss: 1.9658, test_f1: 0.6706
 epoch: 88, train_loss: 0.2228, test_loss: 1.7463, test_f1: 0.6387
 epoch: 89, train_loss: 0.2644, test_loss: 1.8010, test_f1: 0.6735
 epoch: 90, train_loss: 0.1847, test_loss: 1.7102, test_f1: 0.6489
 epoch: 91, train_loss: 0.2059, test_loss: 2.0026, test_f1: 0.6726
 epoch: 92, train_loss: 0.1788, test_loss: 1.9995, test_f1: 0.6338
 epoch: 93, train_loss: 0.1664, test_loss: 2.1846, test_f1: 0.6481
 epoch: 94, train_loss: 0.1746, test_loss: 2.3363, test_f1: 0.6516
 epoch: 95, train_loss: 0.2090, test_loss: 1.9287, test_f1: 0.6822
 epoch: 96, train_loss: 0.2452, test_loss: 1.8686, test_f1: 0.6771
 epoch: 97, train_loss: 0.2086, test_loss: 1.8561, test_f1: 0.6563
 epoch: 98, train_loss: 0.1791, test_loss: 2.0127, test_f1: 0.6566
 epoch: 99, train_loss: 0.2034, test_loss: 1.6968, test_f1: 0.6636
##################ITERATION #2 ****************************************
 epoch: 0, train_loss: 1.1777, test_loss: 1.4843, test_f1: 0.4298
 epoch: 1, train_loss: 0.9344, test_loss: 1.1666, test_f1: 0.4761
 epoch: 2, train_loss: 0.8812, test_loss: 1.0624, test_f1: 0.5545
 epoch: 3, train_loss: 0.8555, test_loss: 1.1238, test_f1: 0.4352
 epoch: 4, train_loss: 0.8266, test_loss: 0.9923, test_f1: 0.4641
 epoch: 5, train_loss: 0.8107, test_loss: 1.0005, test_f1: 0.5138
 epoch: 6, train_loss: 0.7957, test_loss: 1.0191, test_f1: 0.5904
 epoch: 7, train_loss: 0.8186, test_loss: 1.1270, test_f1: 0.4582
 epoch: 8, train_loss: 0.7703, test_loss: 1.0921, test_f1: 0.5078
 epoch: 9, train_loss: 0.7767, test_loss: 1.2321, test_f1: 0.5899
 epoch: 10, train_loss: 0.7513, test_loss: 0.9735, test_f1: 0.5932
 epoch: 11, train_loss: 0.7427, test_loss: 1.0742, test_f1: 0.6457
 epoch: 12, train_loss: 0.7368, test_loss: 1.1657, test_f1: 0.5591
 epoch: 13, train_loss: 0.7292, test_loss: 0.9863, test_f1: 0.6239
 epoch: 14, train_loss: 0.7187, test_loss: 1.5430, test_f1: 0.5154
 epoch: 15, train_loss: 0.7253, test_loss: 2.0348, test_f1: 0.5119
 epoch: 16, train_loss: 0.7165, test_loss: 0.9813, test_f1: 0.5973
 epoch: 17, train_loss: 0.7034, test_loss: 1.0450, test_f1: 0.5795
 epoch: 18, train_loss: 0.6853, test_loss: 1.1337, test_f1: 0.5936
 epoch: 19, train_loss: 0.7031, test_loss: 1.2412, test_f1: 0.5128
 epoch: 20, train_loss: 0.7086, test_loss: 1.0932, test_f1: 0.6037
 epoch: 21, train_loss: 0.6709, test_loss: 1.1093, test_f1: 0.6005
 epoch: 22, train_loss: 0.6421, test_loss: 1.3444, test_f1: 0.5782
 epoch: 23, train_loss: 0.6289, test_loss: 1.4592, test_f1: 0.5249
 epoch: 24, train_loss: 0.6594, test_loss: 1.1759, test_f1: 0.5994
 epoch: 25, train_loss: 0.6694, test_loss: 1.0358, test_f1: 0.6627
 epoch: 26, train_loss: 0.6326, test_loss: 1.2622, test_f1: 0.6132
 epoch: 27, train_loss: 0.5905, test_loss: 1.9253, test_f1: 0.5847
 epoch: 28, train_loss: 0.6100, test_loss: 1.3856, test_f1: 0.5989
 epoch: 29, train_loss: 0.6255, test_loss: 1.2221, test_f1: 0.6109
 epoch: 30, train_loss: 0.5782, test_loss: 1.5334, test_f1: 0.5537
 epoch: 31, train_loss: 0.6050, test_loss: 1.4205, test_f1: 0.6837
 epoch: 32, train_loss: 0.5843, test_loss: 1.1885, test_f1: 0.6186
 epoch: 33, train_loss: 0.5533, test_loss: 1.9090, test_f1: 0.5345
 epoch: 34, train_loss: 0.5455, test_loss: 1.3329, test_f1: 0.5766
 epoch: 35, train_loss: 0.5859, test_loss: 1.4464, test_f1: 0.5709
 epoch: 36, train_loss: 0.5289, test_loss: 1.1018, test_f1: 0.5554
 epoch: 37, train_loss: 0.5961, test_loss: 1.2043, test_f1: 0.5628
 epoch: 38, train_loss: 0.5154, test_loss: 1.3367, test_f1: 0.5844
 epoch: 39, train_loss: 0.5335, test_loss: 1.1102, test_f1: 0.6340
 epoch: 40, train_loss: 0.5233, test_loss: 1.5034, test_f1: 0.5732
 epoch: 41, train_loss: 0.5267, test_loss: 1.3599, test_f1: 0.6101
 epoch: 42, train_loss: 0.5036, test_loss: 1.2713, test_f1: 0.5751
 epoch: 43, train_loss: 0.5054, test_loss: 1.5021, test_f1: 0.6415
 epoch: 44, train_loss: 0.5238, test_loss: 1.4848, test_f1: 0.5692
 epoch: 45, train_loss: 0.4861, test_loss: 1.5816, test_f1: 0.5380
 epoch: 46, train_loss: 0.4672, test_loss: 1.2751, test_f1: 0.5778
 epoch: 47, train_loss: 0.4809, test_loss: 1.3920, test_f1: 0.6263
 epoch: 48, train_loss: 0.4440, test_loss: 1.2889, test_f1: 0.6266
 epoch: 49, train_loss: 0.4403, test_loss: 2.3776, test_f1: 0.5594
 epoch: 50, train_loss: 0.4954, test_loss: 1.5662, test_f1: 0.5677
 epoch: 51, train_loss: 0.4446, test_loss: 1.4179, test_f1: 0.6158
 epoch: 52, train_loss: 0.3770, test_loss: 1.6853, test_f1: 0.6218
 epoch: 53, train_loss: 0.3650, test_loss: 1.6220, test_f1: 0.5648
 epoch: 54, train_loss: 0.3506, test_loss: 1.8347, test_f1: 0.6178
 epoch: 55, train_loss: 0.3231, test_loss: 1.6792, test_f1: 0.6028
 epoch: 56, train_loss: 0.3536, test_loss: 1.6107, test_f1: 0.6274
 epoch: 57, train_loss: 0.3127, test_loss: 1.7966, test_f1: 0.6273
 epoch: 58, train_loss: 0.3198, test_loss: 2.0939, test_f1: 0.5943
 epoch: 59, train_loss: 0.2969, test_loss: 2.2369, test_f1: 0.6389
 epoch: 60, train_loss: 0.2963, test_loss: 2.0012, test_f1: 0.6064
 epoch: 61, train_loss: 0.2718, test_loss: 2.1882, test_f1: 0.5968
 epoch: 62, train_loss: 0.3041, test_loss: 2.2945, test_f1: 0.6262
 epoch: 63, train_loss: 0.2559, test_loss: 2.2006, test_f1: 0.6022
 epoch: 64, train_loss: 0.2729, test_loss: 2.1480, test_f1: 0.6209
 epoch: 65, train_loss: 0.2746, test_loss: 1.9058, test_f1: 0.6563
 epoch: 66, train_loss: 0.2812, test_loss: 2.1068, test_f1: 0.5994
 epoch: 67, train_loss: 0.2843, test_loss: 2.0578, test_f1: 0.6312
 epoch: 68, train_loss: 0.2525, test_loss: 2.1647, test_f1: 0.5826
 epoch: 69, train_loss: 0.2462, test_loss: 2.3978, test_f1: 0.6314
 epoch: 70, train_loss: 0.2558, test_loss: 2.4495, test_f1: 0.6210
 epoch: 71, train_loss: 0.2244, test_loss: 2.5294, test_f1: 0.6323
 epoch: 72, train_loss: 0.2403, test_loss: 2.3610, test_f1: 0.6107
 epoch: 73, train_loss: 0.2557, test_loss: 2.7776, test_f1: 0.5705
 epoch: 74, train_loss: 0.2247, test_loss: 2.8148, test_f1: 0.6333
 epoch: 75, train_loss: 0.2326, test_loss: 2.7792, test_f1: 0.5944
 epoch: 76, train_loss: 0.2042, test_loss: 2.7588, test_f1: 0.6254
 epoch: 77, train_loss: 0.2047, test_loss: 2.6644, test_f1: 0.6249
 epoch: 78, train_loss: 0.2054, test_loss: 2.5304, test_f1: 0.6397
 epoch: 79, train_loss: 0.2348, test_loss: 2.6912, test_f1: 0.5843
 epoch: 80, train_loss: 0.2291, test_loss: 2.7675, test_f1: 0.6303
 epoch: 81, train_loss: 0.2225, test_loss: 2.8297, test_f1: 0.5906
 epoch: 82, train_loss: 0.2151, test_loss: 2.6458, test_f1: 0.5834
 epoch: 83, train_loss: 0.1948, test_loss: 2.4709, test_f1: 0.5884
 epoch: 84, train_loss: 0.2123, test_loss: 2.4441, test_f1: 0.6227
 epoch: 85, train_loss: 0.1532, test_loss: 2.6656, test_f1: 0.6382
 epoch: 86, train_loss: 0.2372, test_loss: 2.4276, test_f1: 0.5649
 epoch: 87, train_loss: 0.2234, test_loss: 2.8822, test_f1: 0.6306
 epoch: 88, train_loss: 0.1834, test_loss: 2.6746, test_f1: 0.6136
 epoch: 89, train_loss: 0.1731, test_loss: 2.8870, test_f1: 0.6297
 epoch: 90, train_loss: 0.1719, test_loss: 2.6126, test_f1: 0.6332
 epoch: 91, train_loss: 0.1641, test_loss: 2.9406, test_f1: 0.6344
 epoch: 92, train_loss: 0.1591, test_loss: 2.8880, test_f1: 0.6309
 epoch: 93, train_loss: 0.2390, test_loss: 2.4031, test_f1: 0.6158
 epoch: 94, train_loss: 0.1710, test_loss: 2.7676, test_f1: 0.6332
 epoch: 95, train_loss: 0.2136, test_loss: 2.3145, test_f1: 0.6316
 epoch: 96, train_loss: 0.1644, test_loss: 2.6037, test_f1: 0.6192
 epoch: 97, train_loss: 0.1609, test_loss: 2.8357, test_f1: 0.6249
 epoch: 98, train_loss: 0.1460, test_loss: 2.4819, test_f1: 0.6520
 epoch: 99, train_loss: 0.1424, test_loss: 2.7162, test_f1: 0.6211
##################ITERATION #3 ****************************************
 epoch: 0, train_loss: 1.2458, test_loss: 1.3417, test_f1: 0.2311
 epoch: 1, train_loss: 0.9930, test_loss: 1.2303, test_f1: 0.5337
 epoch: 2, train_loss: 0.9108, test_loss: 1.0503, test_f1: 0.5191
 epoch: 3, train_loss: 0.8586, test_loss: 1.0833, test_f1: 0.5339
 epoch: 4, train_loss: 0.8411, test_loss: 1.0990, test_f1: 0.5072
 epoch: 5, train_loss: 0.7867, test_loss: 0.9748, test_f1: 0.5675
 epoch: 6, train_loss: 0.7826, test_loss: 1.0179, test_f1: 0.5883
 epoch: 7, train_loss: 0.7760, test_loss: 1.0183, test_f1: 0.5411
 epoch: 8, train_loss: 0.7635, test_loss: 1.0488, test_f1: 0.5825
 epoch: 9, train_loss: 0.7787, test_loss: 1.2065, test_f1: 0.5303
 epoch: 10, train_loss: 0.8091, test_loss: 1.0054, test_f1: 0.5433
 epoch: 11, train_loss: 0.7896, test_loss: 1.0854, test_f1: 0.5086
 epoch: 12, train_loss: 0.7535, test_loss: 1.0706, test_f1: 0.5547
 epoch: 13, train_loss: 0.7429, test_loss: 1.2752, test_f1: 0.5157
 epoch: 14, train_loss: 0.7149, test_loss: 1.1905, test_f1: 0.5788
 epoch: 15, train_loss: 0.6876, test_loss: 1.0073, test_f1: 0.5953
 epoch: 16, train_loss: 0.6870, test_loss: 1.2875, test_f1: 0.5912
 epoch: 17, train_loss: 0.6925, test_loss: 1.0474, test_f1: 0.6100
 epoch: 18, train_loss: 0.6377, test_loss: 0.9422, test_f1: 0.6391
 epoch: 19, train_loss: 0.6226, test_loss: 1.1843, test_f1: 0.5982
 epoch: 20, train_loss: 0.6581, test_loss: 1.0538, test_f1: 0.6959
 epoch: 21, train_loss: 0.6438, test_loss: 1.0456, test_f1: 0.5625
 epoch: 22, train_loss: 0.6524, test_loss: 1.4156, test_f1: 0.5792
 epoch: 23, train_loss: 0.6350, test_loss: 0.9966, test_f1: 0.6165
 epoch: 24, train_loss: 0.6233, test_loss: 1.0173, test_f1: 0.6499
 epoch: 25, train_loss: 0.6028, test_loss: 1.1436, test_f1: 0.5614
 epoch: 26, train_loss: 0.5748, test_loss: 1.0528, test_f1: 0.6568
 epoch: 27, train_loss: 0.5637, test_loss: 1.4144, test_f1: 0.6011
 epoch: 28, train_loss: 0.5883, test_loss: 0.9427, test_f1: 0.6432
 epoch: 29, train_loss: 0.5570, test_loss: 1.4112, test_f1: 0.6144
 epoch: 30, train_loss: 0.5773, test_loss: 1.1203, test_f1: 0.6463
 epoch: 31, train_loss: 0.5440, test_loss: 1.2288, test_f1: 0.6069
 epoch: 32, train_loss: 0.5319, test_loss: 1.3252, test_f1: 0.5999
 epoch: 33, train_loss: 0.5076, test_loss: 1.1409, test_f1: 0.6275
 epoch: 34, train_loss: 0.5126, test_loss: 1.2834, test_f1: 0.6521
 epoch: 35, train_loss: 0.4979, test_loss: 1.1020, test_f1: 0.6130
 epoch: 36, train_loss: 0.5092, test_loss: 1.0468, test_f1: 0.6680
 epoch: 37, train_loss: 0.5407, test_loss: 1.0740, test_f1: 0.6501
 epoch: 38, train_loss: 0.4992, test_loss: 1.1504, test_f1: 0.6352
 epoch: 39, train_loss: 0.4911, test_loss: 1.3124, test_f1: 0.5859
 epoch: 40, train_loss: 0.4966, test_loss: 1.2301, test_f1: 0.6329
 epoch: 41, train_loss: 0.4540, test_loss: 1.5250, test_f1: 0.6245
 epoch: 42, train_loss: 0.4959, test_loss: 1.1799, test_f1: 0.6162
 epoch: 43, train_loss: 0.5269, test_loss: 1.3098, test_f1: 0.5633
 epoch: 44, train_loss: 0.4430, test_loss: 1.1621, test_f1: 0.6645
 epoch: 45, train_loss: 0.4564, test_loss: 1.2908, test_f1: 0.6581
 epoch: 46, train_loss: 0.4402, test_loss: 1.3632, test_f1: 0.6631
 epoch: 47, train_loss: 0.4368, test_loss: 1.6026, test_f1: 0.6363
 epoch: 48, train_loss: 0.4089, test_loss: 1.4032, test_f1: 0.5895
 epoch: 49, train_loss: 0.4488, test_loss: 1.6907, test_f1: 0.5825
 epoch: 50, train_loss: 0.4103, test_loss: 1.9782, test_f1: 0.5409
 epoch: 51, train_loss: 0.4000, test_loss: 1.5815, test_f1: 0.6030
 epoch: 52, train_loss: 0.3394, test_loss: 1.7969, test_f1: 0.6297
 epoch: 53, train_loss: 0.3345, test_loss: 1.5703, test_f1: 0.6699
 epoch: 54, train_loss: 0.2993, test_loss: 1.6581, test_f1: 0.6740
 epoch: 55, train_loss: 0.2873, test_loss: 1.8665, test_f1: 0.6527
 epoch: 56, train_loss: 0.3055, test_loss: 1.7230, test_f1: 0.6375
 epoch: 57, train_loss: 0.3558, test_loss: 1.6655, test_f1: 0.6793
 epoch: 58, train_loss: 0.3096, test_loss: 1.4894, test_f1: 0.7029
 epoch: 59, train_loss: 0.3024, test_loss: 1.6084, test_f1: 0.6522
 epoch: 60, train_loss: 0.2583, test_loss: 1.6174, test_f1: 0.6582
 epoch: 61, train_loss: 0.2752, test_loss: 2.1123, test_f1: 0.6248
 epoch: 62, train_loss: 0.2968, test_loss: 2.1046, test_f1: 0.6466
 epoch: 63, train_loss: 0.3186, test_loss: 1.6856, test_f1: 0.6404
 epoch: 64, train_loss: 0.2668, test_loss: 1.6701, test_f1: 0.6911
 epoch: 65, train_loss: 0.2492, test_loss: 1.7547, test_f1: 0.6725
 epoch: 66, train_loss: 0.2624, test_loss: 1.8132, test_f1: 0.6442
 epoch: 67, train_loss: 0.2508, test_loss: 1.7182, test_f1: 0.6505
 epoch: 68, train_loss: 0.2412, test_loss: 1.7197, test_f1: 0.6750
 epoch: 69, train_loss: 0.2267, test_loss: 2.0897, test_f1: 0.6318
 epoch: 70, train_loss: 0.2409, test_loss: 1.9187, test_f1: 0.6798
 epoch: 71, train_loss: 0.2034, test_loss: 1.9741, test_f1: 0.6751
 epoch: 72, train_loss: 0.2308, test_loss: 1.9106, test_f1: 0.6530
 epoch: 73, train_loss: 0.2599, test_loss: 2.6409, test_f1: 0.6151
 epoch: 74, train_loss: 0.2449, test_loss: 2.3408, test_f1: 0.6526
 epoch: 75, train_loss: 0.2037, test_loss: 2.3728, test_f1: 0.6637
 epoch: 76, train_loss: 0.1894, test_loss: 2.3643, test_f1: 0.6340
 epoch: 77, train_loss: 0.2350, test_loss: 2.2613, test_f1: 0.6282
 epoch: 78, train_loss: 0.2485, test_loss: 1.9520, test_f1: 0.7028
 epoch: 79, train_loss: 0.2391, test_loss: 2.4167, test_f1: 0.6183
 epoch: 80, train_loss: 0.2229, test_loss: 2.1148, test_f1: 0.6503
 epoch: 81, train_loss: 0.2357, test_loss: 2.1253, test_f1: 0.6380
 epoch: 82, train_loss: 0.1932, test_loss: 2.3111, test_f1: 0.6548
 epoch: 83, train_loss: 0.2066, test_loss: 1.9977, test_f1: 0.6272
 epoch: 84, train_loss: 0.1713, test_loss: 2.4110, test_f1: 0.6554
 epoch: 85, train_loss: 0.2019, test_loss: 2.4997, test_f1: 0.6812
 epoch: 86, train_loss: 0.1720, test_loss: 2.0512, test_f1: 0.6684
 epoch: 87, train_loss: 0.1744, test_loss: 2.8198, test_f1: 0.6010
 epoch: 88, train_loss: 0.1738, test_loss: 2.4686, test_f1: 0.6315
 epoch: 89, train_loss: 0.1796, test_loss: 2.3811, test_f1: 0.6646
 epoch: 90, train_loss: 0.2037, test_loss: 2.5297, test_f1: 0.6475
 epoch: 91, train_loss: 0.1749, test_loss: 2.4663, test_f1: 0.6544
 epoch: 92, train_loss: 0.1724, test_loss: 2.5512, test_f1: 0.6678
 epoch: 93, train_loss: 0.1588, test_loss: 2.3146, test_f1: 0.6753
 epoch: 94, train_loss: 0.1739, test_loss: 2.3412, test_f1: 0.6471
 epoch: 95, train_loss: 0.1809, test_loss: 2.8546, test_f1: 0.6312
 epoch: 96, train_loss: 0.1989, test_loss: 2.3929, test_f1: 0.6544
 epoch: 97, train_loss: 0.1918, test_loss: 2.5581, test_f1: 0.6267
 epoch: 98, train_loss: 0.1691, test_loss: 2.3675, test_f1: 0.6668
 epoch: 99, train_loss: 0.1597, test_loss: 2.4829, test_f1: 0.6644
##################ITERATION #4 ****************************************
 epoch: 0, train_loss: 1.2959, test_loss: 1.2174, test_f1: 0.3789
 epoch: 1, train_loss: 1.0256, test_loss: 1.1588, test_f1: 0.3602
 epoch: 2, train_loss: 0.9844, test_loss: 1.1931, test_f1: 0.4192
 epoch: 3, train_loss: 0.9333, test_loss: 1.2896, test_f1: 0.4612
 epoch: 4, train_loss: 0.8784, test_loss: 1.0800, test_f1: 0.5382
 epoch: 5, train_loss: 0.8498, test_loss: 1.2150, test_f1: 0.5136
 epoch: 6, train_loss: 0.8077, test_loss: 2.2986, test_f1: 0.4035
 epoch: 7, train_loss: 0.7957, test_loss: 1.2463, test_f1: 0.4489
 epoch: 8, train_loss: 0.8113, test_loss: 0.9769, test_f1: 0.5352
 epoch: 9, train_loss: 0.7749, test_loss: 1.0791, test_f1: 0.5692
 epoch: 10, train_loss: 0.7802, test_loss: 0.9900, test_f1: 0.5882
 epoch: 11, train_loss: 0.7522, test_loss: 1.1255, test_f1: 0.5541
 epoch: 12, train_loss: 0.7585, test_loss: 1.1798, test_f1: 0.5490
 epoch: 13, train_loss: 0.7156, test_loss: 1.0674, test_f1: 0.5641
 epoch: 14, train_loss: 0.7017, test_loss: 1.3196, test_f1: 0.5976
 epoch: 15, train_loss: 0.7099, test_loss: 1.0469, test_f1: 0.5205
 epoch: 16, train_loss: 0.7012, test_loss: 2.1937, test_f1: 0.4412
 epoch: 17, train_loss: 0.7315, test_loss: 1.0772, test_f1: 0.6023
 epoch: 18, train_loss: 0.6785, test_loss: 1.2098, test_f1: 0.5787
 epoch: 19, train_loss: 0.6851, test_loss: 1.0865, test_f1: 0.5705
 epoch: 20, train_loss: 0.6771, test_loss: 0.9858, test_f1: 0.6243
 epoch: 21, train_loss: 0.6401, test_loss: 1.0692, test_f1: 0.6240
 epoch: 22, train_loss: 0.6468, test_loss: 1.0857, test_f1: 0.6241
 epoch: 23, train_loss: 0.6459, test_loss: 1.1419, test_f1: 0.6077
 epoch: 24, train_loss: 0.6555, test_loss: 1.0222, test_f1: 0.6092
 epoch: 25, train_loss: 0.6332, test_loss: 1.2370, test_f1: 0.5845
 epoch: 26, train_loss: 0.6223, test_loss: 1.1874, test_f1: 0.6069
 epoch: 27, train_loss: 0.6258, test_loss: 1.0386, test_f1: 0.5872
 epoch: 28, train_loss: 0.6257, test_loss: 1.1277, test_f1: 0.6030
 epoch: 29, train_loss: 0.6570, test_loss: 1.2033, test_f1: 0.6587
 epoch: 30, train_loss: 0.5962, test_loss: 1.2396, test_f1: 0.6175
 epoch: 31, train_loss: 0.5717, test_loss: 1.1359, test_f1: 0.5620
 epoch: 32, train_loss: 0.5903, test_loss: 1.1380, test_f1: 0.6266
 epoch: 33, train_loss: 0.5768, test_loss: 1.1734, test_f1: 0.6604
 epoch: 34, train_loss: 0.5697, test_loss: 1.4244, test_f1: 0.6591
 epoch: 35, train_loss: 0.5457, test_loss: 1.4674, test_f1: 0.5384
 epoch: 36, train_loss: 0.5842, test_loss: 1.1256, test_f1: 0.6050
 epoch: 37, train_loss: 0.5497, test_loss: 1.2846, test_f1: 0.5922
 epoch: 38, train_loss: 0.5340, test_loss: 1.3319, test_f1: 0.5614
 epoch: 39, train_loss: 0.5476, test_loss: 1.0867, test_f1: 0.6113
 epoch: 40, train_loss: 0.5197, test_loss: 1.3284, test_f1: 0.6025
 epoch: 41, train_loss: 0.5156, test_loss: 1.2275, test_f1: 0.5745
 epoch: 42, train_loss: 0.5150, test_loss: 1.3578, test_f1: 0.5763
 epoch: 43, train_loss: 0.4957, test_loss: 1.4692, test_f1: 0.5495
 epoch: 44, train_loss: 0.4962, test_loss: 1.2582, test_f1: 0.6205
 epoch: 45, train_loss: 0.4730, test_loss: 1.8513, test_f1: 0.5567
 epoch: 46, train_loss: 0.5180, test_loss: 1.5208, test_f1: 0.5951
 epoch: 47, train_loss: 0.4967, test_loss: 1.4298, test_f1: 0.6043
 epoch: 48, train_loss: 0.4919, test_loss: 1.3080, test_f1: 0.6553
 epoch: 49, train_loss: 0.4219, test_loss: 1.8638, test_f1: 0.5464
 epoch: 50, train_loss: 0.4408, test_loss: 1.5684, test_f1: 0.6441
 epoch: 51, train_loss: 0.3865, test_loss: 1.5458, test_f1: 0.6132
 epoch: 52, train_loss: 0.3780, test_loss: 1.6704, test_f1: 0.6127
 epoch: 53, train_loss: 0.3531, test_loss: 1.8528, test_f1: 0.6009
 epoch: 54, train_loss: 0.3746, test_loss: 1.8811, test_f1: 0.5952
 epoch: 55, train_loss: 0.3415, test_loss: 1.8661, test_f1: 0.6073
 epoch: 56, train_loss: 0.3268, test_loss: 1.7046, test_f1: 0.6351
 epoch: 57, train_loss: 0.3416, test_loss: 2.0917, test_f1: 0.5628
 epoch: 58, train_loss: 0.3426, test_loss: 1.7279, test_f1: 0.6022
 epoch: 59, train_loss: 0.3094, test_loss: 1.8379, test_f1: 0.5712
 epoch: 60, train_loss: 0.3188, test_loss: 1.9653, test_f1: 0.6075
 epoch: 61, train_loss: 0.3005, test_loss: 1.8642, test_f1: 0.6294
 epoch: 62, train_loss: 0.3041, test_loss: 1.8762, test_f1: 0.6064
 epoch: 63, train_loss: 0.3205, test_loss: 1.8954, test_f1: 0.6063
 epoch: 64, train_loss: 0.3176, test_loss: 2.0655, test_f1: 0.5771
 epoch: 65, train_loss: 0.3426, test_loss: 1.9738, test_f1: 0.6086
 epoch: 66, train_loss: 0.3380, test_loss: 1.8700, test_f1: 0.6004
 epoch: 67, train_loss: 0.2892, test_loss: 2.0851, test_f1: 0.5893
 epoch: 68, train_loss: 0.3176, test_loss: 2.0029, test_f1: 0.6216
 epoch: 69, train_loss: 0.2995, test_loss: 1.9317, test_f1: 0.6029
 epoch: 70, train_loss: 0.2950, test_loss: 2.0483, test_f1: 0.6305
 epoch: 71, train_loss: 0.2872, test_loss: 1.9175, test_f1: 0.6204
 epoch: 72, train_loss: 0.2934, test_loss: 1.7985, test_f1: 0.6437
 epoch: 73, train_loss: 0.2863, test_loss: 4.0099, test_f1: 0.5366
 epoch: 74, train_loss: 0.2846, test_loss: 1.8828, test_f1: 0.5986
 epoch: 75, train_loss: 0.2789, test_loss: 1.7759, test_f1: 0.6021
 epoch: 76, train_loss: 0.2463, test_loss: 2.2495, test_f1: 0.5831
 epoch: 77, train_loss: 0.2814, test_loss: 2.2173, test_f1: 0.6202
 epoch: 78, train_loss: 0.2569, test_loss: 1.9640, test_f1: 0.6426
 epoch: 79, train_loss: 0.2617, test_loss: 2.2467, test_f1: 0.5982
 epoch: 80, train_loss: 0.2924, test_loss: 2.3577, test_f1: 0.6314
 epoch: 81, train_loss: 0.2984, test_loss: 2.0479, test_f1: 0.6006
 epoch: 82, train_loss: 0.2518, test_loss: 2.0943, test_f1: 0.6029
 epoch: 83, train_loss: 0.2515, test_loss: 1.8546, test_f1: 0.6513
 epoch: 84, train_loss: 0.1984, test_loss: 2.1035, test_f1: 0.6273
 epoch: 85, train_loss: 0.2360, test_loss: 2.0160, test_f1: 0.5869
 epoch: 86, train_loss: 0.2524, test_loss: 2.1118, test_f1: 0.6197
 epoch: 87, train_loss: 0.2391, test_loss: 2.1199, test_f1: 0.6162
 epoch: 88, train_loss: 0.2268, test_loss: 2.0711, test_f1: 0.6280
 epoch: 89, train_loss: 0.2190, test_loss: 2.2722, test_f1: 0.5725
 epoch: 90, train_loss: 0.2232, test_loss: 2.0123, test_f1: 0.6300
 epoch: 91, train_loss: 0.1997, test_loss: 2.2952, test_f1: 0.6123
 epoch: 92, train_loss: 0.2608, test_loss: 2.0791, test_f1: 0.6226
 epoch: 93, train_loss: 0.2385, test_loss: 1.8458, test_f1: 0.6183
 epoch: 94, train_loss: 0.2478, test_loss: 1.9728, test_f1: 0.6445
 epoch: 95, train_loss: 0.2568, test_loss: 2.0614, test_f1: 0.6396
 epoch: 96, train_loss: 0.2142, test_loss: 1.9376, test_f1: 0.6454
 epoch: 97, train_loss: 0.2251, test_loss: 2.0786, test_f1: 0.6218
 epoch: 98, train_loss: 0.1784, test_loss: 2.0763, test_f1: 0.6528
 epoch: 99, train_loss: 0.1999, test_loss: 2.0467, test_f1: 0.6402
##################ITERATION #5 ****************************************
 epoch: 0, train_loss: 1.3818, test_loss: 1.2396, test_f1: 0.3026
 epoch: 1, train_loss: 0.9796, test_loss: 1.0784, test_f1: 0.5285
 epoch: 2, train_loss: 0.8908, test_loss: 1.2428, test_f1: 0.4496
 epoch: 3, train_loss: 0.8609, test_loss: 1.4552, test_f1: 0.3848
 epoch: 4, train_loss: 0.8569, test_loss: 1.1327, test_f1: 0.5216
 epoch: 5, train_loss: 0.7913, test_loss: 1.1435, test_f1: 0.5639
 epoch: 6, train_loss: 0.8227, test_loss: 1.0149, test_f1: 0.5563
 epoch: 7, train_loss: 0.7748, test_loss: 1.0342, test_f1: 0.6149
 epoch: 8, train_loss: 0.7535, test_loss: 1.0496, test_f1: 0.6018
 epoch: 9, train_loss: 0.7775, test_loss: 1.5272, test_f1: 0.4281
 epoch: 10, train_loss: 0.7523, test_loss: 0.9358, test_f1: 0.5931
 epoch: 11, train_loss: 0.7156, test_loss: 1.1320, test_f1: 0.5739
 epoch: 12, train_loss: 0.7152, test_loss: 1.0609, test_f1: 0.5968
 epoch: 13, train_loss: 0.7026, test_loss: 1.2345, test_f1: 0.5932
 epoch: 14, train_loss: 0.7110, test_loss: 1.0773, test_f1: 0.5094
 epoch: 15, train_loss: 0.6958, test_loss: 1.1926, test_f1: 0.5498
 epoch: 16, train_loss: 0.6807, test_loss: 1.1059, test_f1: 0.4667
 epoch: 17, train_loss: 0.6937, test_loss: 0.9112, test_f1: 0.6750
 epoch: 18, train_loss: 0.6736, test_loss: 1.0757, test_f1: 0.6451
 epoch: 19, train_loss: 0.6829, test_loss: 1.0377, test_f1: 0.5437
 epoch: 20, train_loss: 0.6558, test_loss: 0.8988, test_f1: 0.6037
 epoch: 21, train_loss: 0.6683, test_loss: 1.2638, test_f1: 0.5160
 epoch: 22, train_loss: 0.6786, test_loss: 1.0562, test_f1: 0.5923
 epoch: 23, train_loss: 0.6298, test_loss: 0.9674, test_f1: 0.6008
 epoch: 24, train_loss: 0.6183, test_loss: 1.2012, test_f1: 0.5402
 epoch: 25, train_loss: 0.6146, test_loss: 1.1337, test_f1: 0.5651
 epoch: 26, train_loss: 0.6175, test_loss: 1.0974, test_f1: 0.5830
 epoch: 27, train_loss: 0.5969, test_loss: 0.9870, test_f1: 0.6248
 epoch: 28, train_loss: 0.5845, test_loss: 1.2361, test_f1: 0.5860
 epoch: 29, train_loss: 0.5908, test_loss: 1.0016, test_f1: 0.6604
 epoch: 30, train_loss: 0.5707, test_loss: 1.1823, test_f1: 0.6125
 epoch: 31, train_loss: 0.5701, test_loss: 1.1189, test_f1: 0.5970
 epoch: 32, train_loss: 0.5800, test_loss: 1.2634, test_f1: 0.5761
 epoch: 33, train_loss: 0.5851, test_loss: 1.1044, test_f1: 0.6094
 epoch: 34, train_loss: 0.5568, test_loss: 1.0188, test_f1: 0.6616
 epoch: 35, train_loss: 0.5440, test_loss: 1.1042, test_f1: 0.5786
 epoch: 36, train_loss: 0.5729, test_loss: 0.9587, test_f1: 0.6426
 epoch: 37, train_loss: 0.5682, test_loss: 0.9834, test_f1: 0.6741
 epoch: 38, train_loss: 0.5587, test_loss: 1.1602, test_f1: 0.5971
 epoch: 39, train_loss: 0.5372, test_loss: 1.3046, test_f1: 0.5614
 epoch: 40, train_loss: 0.5013, test_loss: 1.0697, test_f1: 0.6234
 epoch: 41, train_loss: 0.5579, test_loss: 1.4405, test_f1: 0.6045
 epoch: 42, train_loss: 0.5227, test_loss: 1.2604, test_f1: 0.5459
 epoch: 43, train_loss: 0.5299, test_loss: 1.0458, test_f1: 0.6076
 epoch: 44, train_loss: 0.4866, test_loss: 1.0344, test_f1: 0.6230
 epoch: 45, train_loss: 0.4732, test_loss: 1.2356, test_f1: 0.5884
 epoch: 46, train_loss: 0.4934, test_loss: 1.0376, test_f1: 0.6196
 epoch: 47, train_loss: 0.4674, test_loss: 1.4230, test_f1: 0.6676
 epoch: 48, train_loss: 0.4465, test_loss: 1.2347, test_f1: 0.5801
 epoch: 49, train_loss: 0.4936, test_loss: 1.0802, test_f1: 0.6523
 epoch: 50, train_loss: 0.4537, test_loss: 1.5040, test_f1: 0.5462
 epoch: 51, train_loss: 0.4333, test_loss: 1.1935, test_f1: 0.6019
 epoch: 52, train_loss: 0.3946, test_loss: 1.3536, test_f1: 0.6011
 epoch: 53, train_loss: 0.3653, test_loss: 1.2308, test_f1: 0.6084
 epoch: 54, train_loss: 0.4096, test_loss: 1.2266, test_f1: 0.6240
 epoch: 55, train_loss: 0.3693, test_loss: 1.3555, test_f1: 0.5916
 epoch: 56, train_loss: 0.3503, test_loss: 1.2668, test_f1: 0.6159
 epoch: 57, train_loss: 0.3447, test_loss: 1.3428, test_f1: 0.6446
 epoch: 58, train_loss: 0.3603, test_loss: 1.2428, test_f1: 0.6115
 epoch: 59, train_loss: 0.3281, test_loss: 1.3137, test_f1: 0.6175
 epoch: 60, train_loss: 0.3134, test_loss: 1.3195, test_f1: 0.6249
 epoch: 61, train_loss: 0.2935, test_loss: 1.4419, test_f1: 0.6214
 epoch: 62, train_loss: 0.3062, test_loss: 1.4034, test_f1: 0.6706
 epoch: 63, train_loss: 0.3641, test_loss: 1.2766, test_f1: 0.6384
 epoch: 64, train_loss: 0.3131, test_loss: 1.4189, test_f1: 0.6159
 epoch: 65, train_loss: 0.3369, test_loss: 1.3888, test_f1: 0.6320
 epoch: 66, train_loss: 0.3416, test_loss: 1.4340, test_f1: 0.6354
 epoch: 67, train_loss: 0.2910, test_loss: 1.3776, test_f1: 0.6545
 epoch: 68, train_loss: 0.2920, test_loss: 1.5646, test_f1: 0.6396
 epoch: 69, train_loss: 0.2914, test_loss: 1.5929, test_f1: 0.6263
 epoch: 70, train_loss: 0.2743, test_loss: 1.6213, test_f1: 0.6341
 epoch: 71, train_loss: 0.2659, test_loss: 1.4581, test_f1: 0.6515
 epoch: 72, train_loss: 0.2592, test_loss: 1.6564, test_f1: 0.6306
 epoch: 73, train_loss: 0.2799, test_loss: 1.8205, test_f1: 0.6197
 epoch: 74, train_loss: 0.2787, test_loss: 1.7977, test_f1: 0.6371
 epoch: 75, train_loss: 0.3048, test_loss: 1.8142, test_f1: 0.5868
 epoch: 76, train_loss: 0.2703, test_loss: 1.6301, test_f1: 0.6244
 epoch: 77, train_loss: 0.2611, test_loss: 2.0615, test_f1: 0.6199
 epoch: 78, train_loss: 0.2857, test_loss: 1.7066, test_f1: 0.6310
 epoch: 79, train_loss: 0.2819, test_loss: 1.7752, test_f1: 0.6416
 epoch: 80, train_loss: 0.2344, test_loss: 1.6024, test_f1: 0.6479
 epoch: 81, train_loss: 0.2389, test_loss: 1.7075, test_f1: 0.6460
 epoch: 82, train_loss: 0.2229, test_loss: 2.2571, test_f1: 0.6272
 epoch: 83, train_loss: 0.2488, test_loss: 1.6943, test_f1: 0.6357
 epoch: 84, train_loss: 0.2857, test_loss: 1.8020, test_f1: 0.6211
 epoch: 85, train_loss: 0.2394, test_loss: 1.7110, test_f1: 0.6336
 epoch: 86, train_loss: 0.2118, test_loss: 1.9180, test_f1: 0.6223
 epoch: 87, train_loss: 0.2168, test_loss: 2.2381, test_f1: 0.6303
 epoch: 88, train_loss: 0.2103, test_loss: 1.8950, test_f1: 0.6515
 epoch: 89, train_loss: 0.2330, test_loss: 1.8301, test_f1: 0.6556
 epoch: 90, train_loss: 0.2647, test_loss: 1.9908, test_f1: 0.6373
 epoch: 91, train_loss: 0.2701, test_loss: 1.6118, test_f1: 0.6578
 epoch: 92, train_loss: 0.1958, test_loss: 2.1140, test_f1: 0.6106
 epoch: 93, train_loss: 0.1973, test_loss: 1.9585, test_f1: 0.6237
 epoch: 94, train_loss: 0.2321, test_loss: 2.0514, test_f1: 0.6150
 epoch: 95, train_loss: 0.1919, test_loss: 2.1043, test_f1: 0.6620
 epoch: 96, train_loss: 0.2093, test_loss: 2.0014, test_f1: 0.6250
 epoch: 97, train_loss: 0.2517, test_loss: 2.0108, test_f1: 0.6652
 epoch: 98, train_loss: 0.2340, test_loss: 1.6916, test_f1: 0.6451
 epoch: 99, train_loss: 0.1892, test_loss: 1.9898, test_f1: 0.6653
##################ITERATION #6 ****************************************
 epoch: 0, train_loss: 1.2092, test_loss: 1.1370, test_f1: 0.3974
 epoch: 1, train_loss: 0.9869, test_loss: 1.1601, test_f1: 0.4249
 epoch: 2, train_loss: 0.9290, test_loss: 1.0994, test_f1: 0.5224
 epoch: 3, train_loss: 0.8819, test_loss: 1.0170, test_f1: 0.5682
 epoch: 4, train_loss: 0.8448, test_loss: 0.9991, test_f1: 0.5961
 epoch: 5, train_loss: 0.8097, test_loss: 1.0547, test_f1: 0.5483
 epoch: 6, train_loss: 0.8661, test_loss: 1.5398, test_f1: 0.4098
 epoch: 7, train_loss: 0.8332, test_loss: 1.1223, test_f1: 0.5491
 epoch: 8, train_loss: 0.7831, test_loss: 1.0266, test_f1: 0.5884
 epoch: 9, train_loss: 0.7693, test_loss: 1.0967, test_f1: 0.5964
 epoch: 10, train_loss: 0.7252, test_loss: 1.1518, test_f1: 0.6211
 epoch: 11, train_loss: 0.7539, test_loss: 1.4490, test_f1: 0.4524
 epoch: 12, train_loss: 0.7540, test_loss: 1.3824, test_f1: 0.4959
 epoch: 13, train_loss: 0.7183, test_loss: 0.9624, test_f1: 0.6013
 epoch: 14, train_loss: 0.7005, test_loss: 1.3496, test_f1: 0.5624
 epoch: 15, train_loss: 0.6945, test_loss: 1.2767, test_f1: 0.5861
 epoch: 16, train_loss: 0.6786, test_loss: 1.1520, test_f1: 0.6370
 epoch: 17, train_loss: 0.6834, test_loss: 1.0807, test_f1: 0.6420
 epoch: 18, train_loss: 0.6534, test_loss: 1.7597, test_f1: 0.4351
 epoch: 19, train_loss: 0.6747, test_loss: 1.0793, test_f1: 0.6044
 epoch: 20, train_loss: 0.6966, test_loss: 1.1370, test_f1: 0.5924
 epoch: 21, train_loss: 0.6695, test_loss: 1.1896, test_f1: 0.6152
 epoch: 22, train_loss: 0.6599, test_loss: 1.1175, test_f1: 0.6197
 epoch: 23, train_loss: 0.6311, test_loss: 1.2329, test_f1: 0.5788
 epoch: 24, train_loss: 0.6133, test_loss: 1.0737, test_f1: 0.6028
 epoch: 25, train_loss: 0.6375, test_loss: 1.3061, test_f1: 0.5709
 epoch: 26, train_loss: 0.6182, test_loss: 1.1714, test_f1: 0.5447
 epoch: 27, train_loss: 0.6202, test_loss: 1.5637, test_f1: 0.4553
 epoch: 28, train_loss: 0.5991, test_loss: 1.9720, test_f1: 0.4656
 epoch: 29, train_loss: 0.5898, test_loss: 1.1144, test_f1: 0.5992
 epoch: 30, train_loss: 0.6072, test_loss: 1.3238, test_f1: 0.5852
 epoch: 31, train_loss: 0.5714, test_loss: 1.8289, test_f1: 0.5835
 epoch: 32, train_loss: 0.5821, test_loss: 1.1970, test_f1: 0.6050
 epoch: 33, train_loss: 0.5804, test_loss: 1.1356, test_f1: 0.5907
 epoch: 34, train_loss: 0.5730, test_loss: 1.2883, test_f1: 0.5656
 epoch: 35, train_loss: 0.5363, test_loss: 1.3658, test_f1: 0.5974
 epoch: 36, train_loss: 0.4884, test_loss: 1.3998, test_f1: 0.6100
 epoch: 37, train_loss: 0.4797, test_loss: 1.6121, test_f1: 0.5741
 epoch: 38, train_loss: 0.5181, test_loss: 1.1750, test_f1: 0.6514
 epoch: 39, train_loss: 0.5576, test_loss: 1.5024, test_f1: 0.5050
 epoch: 40, train_loss: 0.5699, test_loss: 1.2581, test_f1: 0.5212
 epoch: 41, train_loss: 0.5043, test_loss: 1.4458, test_f1: 0.5729
 epoch: 42, train_loss: 0.4885, test_loss: 1.4514, test_f1: 0.6034
 epoch: 43, train_loss: 0.5230, test_loss: 1.2176, test_f1: 0.6429
 epoch: 44, train_loss: 0.4871, test_loss: 1.9101, test_f1: 0.5592
 epoch: 45, train_loss: 0.4393, test_loss: 1.4999, test_f1: 0.6694
 epoch: 46, train_loss: 0.4750, test_loss: 1.2320, test_f1: 0.6272
 epoch: 47, train_loss: 0.4405, test_loss: 1.6198, test_f1: 0.6265
 epoch: 48, train_loss: 0.4365, test_loss: 1.4992, test_f1: 0.6146
 epoch: 49, train_loss: 0.4370, test_loss: 1.6624, test_f1: 0.6075
 epoch: 50, train_loss: 0.4837, test_loss: 2.9932, test_f1: 0.5745
 epoch: 51, train_loss: 0.4013, test_loss: 1.6706, test_f1: 0.6131
 epoch: 52, train_loss: 0.3528, test_loss: 1.7702, test_f1: 0.5676
 epoch: 53, train_loss: 0.3289, test_loss: 2.1485, test_f1: 0.5644
 epoch: 54, train_loss: 0.3243, test_loss: 1.8540, test_f1: 0.6016
 epoch: 55, train_loss: 0.3715, test_loss: 1.8780, test_f1: 0.5799
 epoch: 56, train_loss: 0.3110, test_loss: 2.0836, test_f1: 0.5888
 epoch: 57, train_loss: 0.2933, test_loss: 1.8024, test_f1: 0.5939
 epoch: 58, train_loss: 0.2909, test_loss: 2.3108, test_f1: 0.6204
 epoch: 59, train_loss: 0.3182, test_loss: 2.6217, test_f1: 0.5647
 epoch: 60, train_loss: 0.2856, test_loss: 2.0111, test_f1: 0.6271
 epoch: 61, train_loss: 0.2610, test_loss: 2.4275, test_f1: 0.6152
 epoch: 62, train_loss: 0.2700, test_loss: 2.1063, test_f1: 0.6216
 epoch: 63, train_loss: 0.2628, test_loss: 2.3226, test_f1: 0.6355
 epoch: 64, train_loss: 0.2841, test_loss: 2.0644, test_f1: 0.6306
 epoch: 65, train_loss: 0.2855, test_loss: 1.9905, test_f1: 0.5759
 epoch: 66, train_loss: 0.2881, test_loss: 2.2231, test_f1: 0.5746
 epoch: 67, train_loss: 0.2625, test_loss: 2.1592, test_f1: 0.6190
 epoch: 68, train_loss: 0.2620, test_loss: 2.5522, test_f1: 0.5986
 epoch: 69, train_loss: 0.2513, test_loss: 2.2808, test_f1: 0.6092
 epoch: 70, train_loss: 0.2391, test_loss: 2.4232, test_f1: 0.5591
 epoch: 71, train_loss: 0.2641, test_loss: 2.0587, test_f1: 0.5987
 epoch: 72, train_loss: 0.2707, test_loss: 2.2639, test_f1: 0.6376
 epoch: 73, train_loss: 0.3220, test_loss: 1.6701, test_f1: 0.6040
 epoch: 74, train_loss: 0.2612, test_loss: 2.3287, test_f1: 0.6472
 epoch: 75, train_loss: 0.2792, test_loss: 1.9954, test_f1: 0.6223
 epoch: 76, train_loss: 0.2363, test_loss: 2.1334, test_f1: 0.5805
 epoch: 77, train_loss: 0.2252, test_loss: 2.5967, test_f1: 0.5725
 epoch: 78, train_loss: 0.2141, test_loss: 2.3449, test_f1: 0.6385
 epoch: 79, train_loss: 0.2101, test_loss: 2.3873, test_f1: 0.6238
 epoch: 80, train_loss: 0.2398, test_loss: 1.9999, test_f1: 0.6151
 epoch: 81, train_loss: 0.2722, test_loss: 2.5160, test_f1: 0.6388
 epoch: 82, train_loss: 0.2013, test_loss: 2.4913, test_f1: 0.5976
 epoch: 83, train_loss: 0.2116, test_loss: 2.6442, test_f1: 0.5634
 epoch: 84, train_loss: 0.2063, test_loss: 2.2746, test_f1: 0.6155
 epoch: 85, train_loss: 0.2225, test_loss: 2.4032, test_f1: 0.5941
 epoch: 86, train_loss: 0.2023, test_loss: 2.7338, test_f1: 0.6158
 epoch: 87, train_loss: 0.1994, test_loss: 2.5427, test_f1: 0.6131
 epoch: 88, train_loss: 0.1945, test_loss: 2.4320, test_f1: 0.6272
 epoch: 89, train_loss: 0.2093, test_loss: 2.3535, test_f1: 0.6056
 epoch: 90, train_loss: 0.1803, test_loss: 2.5749, test_f1: 0.6063
 epoch: 91, train_loss: 0.1684, test_loss: 2.3900, test_f1: 0.6065
 epoch: 92, train_loss: 0.1875, test_loss: 2.6141, test_f1: 0.5881
 epoch: 93, train_loss: 0.1912, test_loss: 2.7679, test_f1: 0.6153
 epoch: 94, train_loss: 0.1687, test_loss: 3.1902, test_f1: 0.6071
 epoch: 95, train_loss: 0.1779, test_loss: 3.1606, test_f1: 0.6039
 epoch: 96, train_loss: 0.1466, test_loss: 2.7372, test_f1: 0.6258
 epoch: 97, train_loss: 0.1525, test_loss: 2.9998, test_f1: 0.6089
 epoch: 98, train_loss: 0.2076, test_loss: 2.6799, test_f1: 0.5940
 epoch: 99, train_loss: 0.1762, test_loss: 3.1074, test_f1: 0.5984
##################ITERATION #7 ****************************************
 epoch: 0, train_loss: 1.3863, test_loss: 1.2805, test_f1: 0.2842
 epoch: 1, train_loss: 0.9716, test_loss: 1.0417, test_f1: 0.5287
 epoch: 2, train_loss: 0.9002, test_loss: 1.1398, test_f1: 0.4177
 epoch: 3, train_loss: 0.8545, test_loss: 1.2666, test_f1: 0.4359
 epoch: 4, train_loss: 0.8186, test_loss: 1.0462, test_f1: 0.4922
 epoch: 5, train_loss: 0.8277, test_loss: 1.2228, test_f1: 0.5927
 epoch: 6, train_loss: 0.8072, test_loss: 1.5664, test_f1: 0.3531
 epoch: 7, train_loss: 0.8002, test_loss: 1.0968, test_f1: 0.4227
 epoch: 8, train_loss: 0.7564, test_loss: 1.7659, test_f1: 0.3917
 epoch: 9, train_loss: 0.7976, test_loss: 1.0098, test_f1: 0.5705
 epoch: 10, train_loss: 0.7700, test_loss: 1.2187, test_f1: 0.4500
 epoch: 11, train_loss: 0.7511, test_loss: 1.7140, test_f1: 0.4178
 epoch: 12, train_loss: 0.7347, test_loss: 1.0471, test_f1: 0.5577
 epoch: 13, train_loss: 0.7248, test_loss: 0.9959, test_f1: 0.5781
 epoch: 14, train_loss: 0.7024, test_loss: 0.9912, test_f1: 0.6414
 epoch: 15, train_loss: 0.7123, test_loss: 1.1442, test_f1: 0.5583
 epoch: 16, train_loss: 0.6830, test_loss: 1.0612, test_f1: 0.5591
 epoch: 17, train_loss: 0.6614, test_loss: 1.0274, test_f1: 0.6090
 epoch: 18, train_loss: 0.7208, test_loss: 1.0042, test_f1: 0.5902
 epoch: 19, train_loss: 0.6729, test_loss: 0.9945, test_f1: 0.6007
 epoch: 20, train_loss: 0.6880, test_loss: 1.1049, test_f1: 0.5593
 epoch: 21, train_loss: 0.6478, test_loss: 1.1532, test_f1: 0.5946
 epoch: 22, train_loss: 0.6486, test_loss: 1.3757, test_f1: 0.5772
 epoch: 23, train_loss: 0.6567, test_loss: 1.0205, test_f1: 0.5827
 epoch: 24, train_loss: 0.6284, test_loss: 1.7965, test_f1: 0.4878
 epoch: 25, train_loss: 0.6532, test_loss: 0.9100, test_f1: 0.6755
 epoch: 26, train_loss: 0.6111, test_loss: 1.1686, test_f1: 0.6103
 epoch: 27, train_loss: 0.6212, test_loss: 1.0930, test_f1: 0.5724
 epoch: 28, train_loss: 0.6394, test_loss: 1.1412, test_f1: 0.5663
 epoch: 29, train_loss: 0.5976, test_loss: 1.0735, test_f1: 0.5961
 epoch: 30, train_loss: 0.5842, test_loss: 1.4170, test_f1: 0.5978
 epoch: 31, train_loss: 0.5549, test_loss: 1.1996, test_f1: 0.6100
 epoch: 32, train_loss: 0.5599, test_loss: 1.0775, test_f1: 0.5717
 epoch: 33, train_loss: 0.5553, test_loss: 1.1914, test_f1: 0.5939
 epoch: 34, train_loss: 0.5488, test_loss: 1.3845, test_f1: 0.5702
 epoch: 35, train_loss: 0.5615, test_loss: 1.0649, test_f1: 0.6596
 epoch: 36, train_loss: 0.5240, test_loss: 1.3780, test_f1: 0.6373
 epoch: 37, train_loss: 0.5545, test_loss: 1.0559, test_f1: 0.6559
 epoch: 38, train_loss: 0.5600, test_loss: 1.0827, test_f1: 0.5616
 epoch: 39, train_loss: 0.5592, test_loss: 1.0755, test_f1: 0.6193
 epoch: 40, train_loss: 0.5086, test_loss: 1.2556, test_f1: 0.6622
 epoch: 41, train_loss: 0.5126, test_loss: 1.1246, test_f1: 0.6342
 epoch: 42, train_loss: 0.5175, test_loss: 1.0980, test_f1: 0.6262
 epoch: 43, train_loss: 0.5282, test_loss: 1.0177, test_f1: 0.6544
 epoch: 44, train_loss: 0.4678, test_loss: 1.4532, test_f1: 0.6269
 epoch: 45, train_loss: 0.4977, test_loss: 1.0876, test_f1: 0.6385
 epoch: 46, train_loss: 0.4893, test_loss: 1.0442, test_f1: 0.6368
 epoch: 47, train_loss: 0.4987, test_loss: 1.8397, test_f1: 0.5841
 epoch: 48, train_loss: 0.5082, test_loss: 1.1810, test_f1: 0.5984
 epoch: 49, train_loss: 0.5214, test_loss: 1.1505, test_f1: 0.6017
 epoch: 50, train_loss: 0.4714, test_loss: 1.3419, test_f1: 0.5688
 epoch: 51, train_loss: 0.4465, test_loss: 1.2490, test_f1: 0.6037
 epoch: 52, train_loss: 0.3818, test_loss: 1.2146, test_f1: 0.6275
 epoch: 53, train_loss: 0.3619, test_loss: 1.3330, test_f1: 0.6106
 epoch: 54, train_loss: 0.3399, test_loss: 1.3200, test_f1: 0.6018
 epoch: 55, train_loss: 0.3238, test_loss: 1.5142, test_f1: 0.6196
 epoch: 56, train_loss: 0.3754, test_loss: 1.6989, test_f1: 0.6276
 epoch: 57, train_loss: 0.3525, test_loss: 1.6048, test_f1: 0.6277
 epoch: 58, train_loss: 0.3313, test_loss: 1.2995, test_f1: 0.6367
 epoch: 59, train_loss: 0.3232, test_loss: 1.5179, test_f1: 0.6232
 epoch: 60, train_loss: 0.3355, test_loss: 1.6385, test_f1: 0.6039
 epoch: 61, train_loss: 0.2947, test_loss: 1.7469, test_f1: 0.6069
 epoch: 62, train_loss: 0.3066, test_loss: 1.5763, test_f1: 0.5991
 epoch: 63, train_loss: 0.3400, test_loss: 1.4336, test_f1: 0.6847
 epoch: 64, train_loss: 0.2824, test_loss: 1.7682, test_f1: 0.6393
 epoch: 65, train_loss: 0.2778, test_loss: 1.4285, test_f1: 0.6431
 epoch: 66, train_loss: 0.2994, test_loss: 1.4006, test_f1: 0.6595
 epoch: 67, train_loss: 0.3196, test_loss: 1.7320, test_f1: 0.6170
 epoch: 68, train_loss: 0.2783, test_loss: 1.4877, test_f1: 0.6549
 epoch: 69, train_loss: 0.2678, test_loss: 1.7576, test_f1: 0.6818
 epoch: 70, train_loss: 0.2739, test_loss: 1.5453, test_f1: 0.6736
 epoch: 71, train_loss: 0.2568, test_loss: 1.9058, test_f1: 0.6021
 epoch: 72, train_loss: 0.2597, test_loss: 1.5193, test_f1: 0.6116
 epoch: 73, train_loss: 0.2711, test_loss: 2.0585, test_f1: 0.5739
 epoch: 74, train_loss: 0.2691, test_loss: 1.7358, test_f1: 0.5913
 epoch: 75, train_loss: 0.2382, test_loss: 1.8899, test_f1: 0.6153
 epoch: 76, train_loss: 0.2576, test_loss: 1.8635, test_f1: 0.6225
 epoch: 77, train_loss: 0.2552, test_loss: 1.7849, test_f1: 0.6055
 epoch: 78, train_loss: 0.2253, test_loss: 1.8396, test_f1: 0.6539
 epoch: 79, train_loss: 0.2411, test_loss: 1.4848, test_f1: 0.6209
 epoch: 80, train_loss: 0.2470, test_loss: 1.7446, test_f1: 0.6280
 epoch: 81, train_loss: 0.2375, test_loss: 1.8004, test_f1: 0.6317
 epoch: 82, train_loss: 0.2224, test_loss: 2.1983, test_f1: 0.5828
 epoch: 83, train_loss: 0.2398, test_loss: 1.7051, test_f1: 0.6501
 epoch: 84, train_loss: 0.2452, test_loss: 2.0937, test_f1: 0.6033
 epoch: 85, train_loss: 0.2511, test_loss: 1.8167, test_f1: 0.6460
 epoch: 86, train_loss: 0.2697, test_loss: 1.8423, test_f1: 0.6230
 epoch: 87, train_loss: 0.2249, test_loss: 1.8612, test_f1: 0.6449
 epoch: 88, train_loss: 0.2408, test_loss: 2.1264, test_f1: 0.6463
 epoch: 89, train_loss: 0.2358, test_loss: 2.1543, test_f1: 0.6295
 epoch: 90, train_loss: 0.2368, test_loss: 1.8579, test_f1: 0.6494
 epoch: 91, train_loss: 0.2090, test_loss: 1.9228, test_f1: 0.6198
 epoch: 92, train_loss: 0.2077, test_loss: 1.8714, test_f1: 0.6327
 epoch: 93, train_loss: 0.1993, test_loss: 1.8345, test_f1: 0.6261
 epoch: 94, train_loss: 0.2223, test_loss: 1.9235, test_f1: 0.6171
 epoch: 95, train_loss: 0.2337, test_loss: 2.1788, test_f1: 0.5883
 epoch: 96, train_loss: 0.2414, test_loss: 1.9947, test_f1: 0.6073
 epoch: 97, train_loss: 0.1985, test_loss: 2.0337, test_f1: 0.6414
 epoch: 98, train_loss: 0.2123, test_loss: 1.7389, test_f1: 0.6276
 epoch: 99, train_loss: 0.2039, test_loss: 1.9832, test_f1: 0.5985
##################ITERATION #8 ****************************************
 epoch: 0, train_loss: 1.4489, test_loss: 1.3748, test_f1: 0.3368
 epoch: 1, train_loss: 1.0508, test_loss: 1.0881, test_f1: 0.4540
 epoch: 2, train_loss: 0.9948, test_loss: 1.0430, test_f1: 0.5117
 epoch: 3, train_loss: 0.9398, test_loss: 1.2633, test_f1: 0.4182
 epoch: 4, train_loss: 0.9189, test_loss: 0.9998, test_f1: 0.5652
 epoch: 5, train_loss: 0.8948, test_loss: 0.9886, test_f1: 0.6024
 epoch: 6, train_loss: 0.8842, test_loss: 0.9641, test_f1: 0.5846
 epoch: 7, train_loss: 0.8371, test_loss: 1.3595, test_f1: 0.4550
 epoch: 8, train_loss: 0.8154, test_loss: 1.3291, test_f1: 0.4190
 epoch: 9, train_loss: 0.8019, test_loss: 1.0169, test_f1: 0.5857
 epoch: 10, train_loss: 0.7786, test_loss: 1.0309, test_f1: 0.5510
 epoch: 11, train_loss: 0.7866, test_loss: 0.9561, test_f1: 0.5847
 epoch: 12, train_loss: 0.7831, test_loss: 0.9674, test_f1: 0.5919
 epoch: 13, train_loss: 0.7983, test_loss: 0.8799, test_f1: 0.6285
 epoch: 14, train_loss: 0.7693, test_loss: 0.9963, test_f1: 0.5814
 epoch: 15, train_loss: 0.7538, test_loss: 0.9849, test_f1: 0.5747
 epoch: 16, train_loss: 0.7412, test_loss: 1.4504, test_f1: 0.4773
 epoch: 17, train_loss: 0.7417, test_loss: 1.0792, test_f1: 0.5466
 epoch: 18, train_loss: 0.7218, test_loss: 0.9727, test_f1: 0.6181
 epoch: 19, train_loss: 0.7042, test_loss: 0.9742, test_f1: 0.6082
 epoch: 20, train_loss: 0.6930, test_loss: 1.0116, test_f1: 0.6098
 epoch: 21, train_loss: 0.7368, test_loss: 1.0078, test_f1: 0.5780
 epoch: 22, train_loss: 0.7364, test_loss: 1.5032, test_f1: 0.4554
 epoch: 23, train_loss: 0.7105, test_loss: 0.9861, test_f1: 0.6233
 epoch: 24, train_loss: 0.7303, test_loss: 1.0583, test_f1: 0.5912
 epoch: 25, train_loss: 0.6839, test_loss: 1.3529, test_f1: 0.4908
 epoch: 26, train_loss: 0.6683, test_loss: 1.0074, test_f1: 0.6266
 epoch: 27, train_loss: 0.7185, test_loss: 1.2603, test_f1: 0.4727
 epoch: 28, train_loss: 0.6677, test_loss: 0.9511, test_f1: 0.6200
 epoch: 29, train_loss: 0.6533, test_loss: 1.0013, test_f1: 0.6057
 epoch: 30, train_loss: 0.6687, test_loss: 1.0942, test_f1: 0.6497
 epoch: 31, train_loss: 0.6508, test_loss: 1.0094, test_f1: 0.5448
 epoch: 32, train_loss: 0.6612, test_loss: 1.1976, test_f1: 0.5635
 epoch: 33, train_loss: 0.6854, test_loss: 1.0369, test_f1: 0.5949
 epoch: 34, train_loss: 0.6411, test_loss: 1.1442, test_f1: 0.5490
 epoch: 35, train_loss: 0.6159, test_loss: 0.9467, test_f1: 0.6354
 epoch: 36, train_loss: 0.6616, test_loss: 1.0786, test_f1: 0.5773
 epoch: 37, train_loss: 0.6159, test_loss: 1.1419, test_f1: 0.6400
 epoch: 38, train_loss: 0.5854, test_loss: 1.4784, test_f1: 0.5972
 epoch: 39, train_loss: 0.6031, test_loss: 1.2102, test_f1: 0.6269
 epoch: 40, train_loss: 0.6243, test_loss: 1.0762, test_f1: 0.6151
 epoch: 41, train_loss: 0.6407, test_loss: 0.9696, test_f1: 0.5921
 epoch: 42, train_loss: 0.6039, test_loss: 1.1966, test_f1: 0.5978
 epoch: 43, train_loss: 0.5670, test_loss: 1.2838, test_f1: 0.5555
 epoch: 44, train_loss: 0.6005, test_loss: 1.1028, test_f1: 0.5879
 epoch: 45, train_loss: 0.5842, test_loss: 1.1427, test_f1: 0.5688
 epoch: 46, train_loss: 0.5667, test_loss: 1.1878, test_f1: 0.6172
 epoch: 47, train_loss: 0.5642, test_loss: 1.1056, test_f1: 0.5938
 epoch: 48, train_loss: 0.5559, test_loss: 1.1684, test_f1: 0.5738
 epoch: 49, train_loss: 0.5518, test_loss: 1.1132, test_f1: 0.6260
 epoch: 50, train_loss: 0.5434, test_loss: 1.3595, test_f1: 0.5610
 epoch: 51, train_loss: 0.4904, test_loss: 1.3717, test_f1: 0.5746
 epoch: 52, train_loss: 0.4744, test_loss: 1.2270, test_f1: 0.6338
 epoch: 53, train_loss: 0.4796, test_loss: 1.2773, test_f1: 0.5948
 epoch: 54, train_loss: 0.4618, test_loss: 1.2955, test_f1: 0.6170
 epoch: 55, train_loss: 0.4243, test_loss: 1.2466, test_f1: 0.6158
 epoch: 56, train_loss: 0.4385, test_loss: 1.3861, test_f1: 0.5497
 epoch: 57, train_loss: 0.4247, test_loss: 1.2981, test_f1: 0.5883
 epoch: 58, train_loss: 0.4132, test_loss: 1.3613, test_f1: 0.6225
 epoch: 59, train_loss: 0.4686, test_loss: 1.2077, test_f1: 0.6415
 epoch: 60, train_loss: 0.4489, test_loss: 1.3150, test_f1: 0.6427
 epoch: 61, train_loss: 0.3976, test_loss: 1.3039, test_f1: 0.5946
 epoch: 62, train_loss: 0.4173, test_loss: 1.5350, test_f1: 0.5300
 epoch: 63, train_loss: 0.3930, test_loss: 1.3715, test_f1: 0.6076
 epoch: 64, train_loss: 0.3937, test_loss: 1.2612, test_f1: 0.6072
 epoch: 65, train_loss: 0.4091, test_loss: 1.3790, test_f1: 0.6037
 epoch: 66, train_loss: 0.3880, test_loss: 1.5122, test_f1: 0.5427
 epoch: 67, train_loss: 0.3803, test_loss: 1.4641, test_f1: 0.5744
 epoch: 68, train_loss: 0.3520, test_loss: 1.5269, test_f1: 0.6515
 epoch: 69, train_loss: 0.3750, test_loss: 1.3371, test_f1: 0.5941
 epoch: 70, train_loss: 0.3781, test_loss: 1.5793, test_f1: 0.5977
 epoch: 71, train_loss: 0.3411, test_loss: 1.3579, test_f1: 0.6013
 epoch: 72, train_loss: 0.3408, test_loss: 1.9108, test_f1: 0.5613
 epoch: 73, train_loss: 0.3645, test_loss: 1.5625, test_f1: 0.5783
 epoch: 74, train_loss: 0.3204, test_loss: 1.5667, test_f1: 0.5760
 epoch: 75, train_loss: 0.3086, test_loss: 1.8457, test_f1: 0.5819
 epoch: 76, train_loss: 0.3390, test_loss: 1.6493, test_f1: 0.5871
 epoch: 77, train_loss: 0.3174, test_loss: 1.6705, test_f1: 0.6214
 epoch: 78, train_loss: 0.3562, test_loss: 1.8623, test_f1: 0.5790
 epoch: 79, train_loss: 0.3525, test_loss: 1.5810, test_f1: 0.6267
 epoch: 80, train_loss: 0.3329, test_loss: 1.5651, test_f1: 0.5988
 epoch: 81, train_loss: 0.2789, test_loss: 2.0148, test_f1: 0.5652
 epoch: 82, train_loss: 0.3016, test_loss: 1.6629, test_f1: 0.6177
 epoch: 83, train_loss: 0.3246, test_loss: 1.9508, test_f1: 0.5988
 epoch: 84, train_loss: 0.3203, test_loss: 1.5191, test_f1: 0.5758
 epoch: 85, train_loss: 0.2781, test_loss: 1.7586, test_f1: 0.6246
 epoch: 86, train_loss: 0.2743, test_loss: 1.6830, test_f1: 0.5646
 epoch: 87, train_loss: 0.3212, test_loss: 1.6674, test_f1: 0.6176
 epoch: 88, train_loss: 0.3065, test_loss: 1.5649, test_f1: 0.6033
 epoch: 89, train_loss: 0.2653, test_loss: 1.5540, test_f1: 0.6398
 epoch: 90, train_loss: 0.2838, test_loss: 1.6115, test_f1: 0.6448
 epoch: 91, train_loss: 0.3173, test_loss: 1.4805, test_f1: 0.6299
 epoch: 92, train_loss: 0.2685, test_loss: 1.6147, test_f1: 0.6647
 epoch: 93, train_loss: 0.2595, test_loss: 1.9709, test_f1: 0.6246
 epoch: 94, train_loss: 0.2601, test_loss: 1.6697, test_f1: 0.5873
 epoch: 95, train_loss: 0.2838, test_loss: 1.5114, test_f1: 0.6003
 epoch: 96, train_loss: 0.2205, test_loss: 1.7604, test_f1: 0.6291
 epoch: 97, train_loss: 0.2456, test_loss: 1.5425, test_f1: 0.6388
 epoch: 98, train_loss: 0.2937, test_loss: 1.7685, test_f1: 0.6069
 epoch: 99, train_loss: 0.2613, test_loss: 1.6279, test_f1: 0.6069
##################ITERATION #9 ****************************************
 epoch: 0, train_loss: 1.3638, test_loss: 1.2911, test_f1: 0.4360
 epoch: 1, train_loss: 0.9573, test_loss: 1.0296, test_f1: 0.5289
 epoch: 2, train_loss: 0.8539, test_loss: 1.1427, test_f1: 0.4873
 epoch: 3, train_loss: 0.8423, test_loss: 1.0274, test_f1: 0.5457
 epoch: 4, train_loss: 0.8554, test_loss: 1.1843, test_f1: 0.4512
 epoch: 5, train_loss: 0.7955, test_loss: 1.8897, test_f1: 0.4468
 epoch: 6, train_loss: 0.7948, test_loss: 1.1849, test_f1: 0.5110
 epoch: 7, train_loss: 0.7452, test_loss: 0.9840, test_f1: 0.5794
 epoch: 8, train_loss: 0.7440, test_loss: 1.1126, test_f1: 0.5335
 epoch: 9, train_loss: 0.7171, test_loss: 1.1327, test_f1: 0.4394
 epoch: 10, train_loss: 0.7048, test_loss: 1.0459, test_f1: 0.5801
 epoch: 11, train_loss: 0.7050, test_loss: 0.9259, test_f1: 0.5956
 epoch: 12, train_loss: 0.6644, test_loss: 1.2016, test_f1: 0.5427
 epoch: 13, train_loss: 0.6873, test_loss: 0.9894, test_f1: 0.5737
 epoch: 14, train_loss: 0.7164, test_loss: 0.9584, test_f1: 0.6066
 epoch: 15, train_loss: 0.6696, test_loss: 0.9212, test_f1: 0.6549
 epoch: 16, train_loss: 0.6311, test_loss: 0.9410, test_f1: 0.6196
 epoch: 17, train_loss: 0.6413, test_loss: 1.0579, test_f1: 0.6219
 epoch: 18, train_loss: 0.6342, test_loss: 1.1411, test_f1: 0.5719
 epoch: 19, train_loss: 0.6488, test_loss: 1.1440, test_f1: 0.5740
 epoch: 20, train_loss: 0.6188, test_loss: 1.5305, test_f1: 0.4946
 epoch: 21, train_loss: 0.6225, test_loss: 1.0492, test_f1: 0.5850
 epoch: 22, train_loss: 0.6112, test_loss: 1.0826, test_f1: 0.5917
 epoch: 23, train_loss: 0.5945, test_loss: 1.3259, test_f1: 0.5526
 epoch: 24, train_loss: 0.5518, test_loss: 0.9952, test_f1: 0.6424
 epoch: 25, train_loss: 0.5709, test_loss: 1.0263, test_f1: 0.6084
 epoch: 26, train_loss: 0.5327, test_loss: 1.1962, test_f1: 0.5360
 epoch: 27, train_loss: 0.5639, test_loss: 1.5578, test_f1: 0.5541
 epoch: 28, train_loss: 0.5501, test_loss: 1.1631, test_f1: 0.5794
 epoch: 29, train_loss: 0.5662, test_loss: 1.0941, test_f1: 0.6391
 epoch: 30, train_loss: 0.5472, test_loss: 1.1974, test_f1: 0.6116
 epoch: 31, train_loss: 0.4965, test_loss: 1.1377, test_f1: 0.6024
 epoch: 32, train_loss: 0.5093, test_loss: 0.9884, test_f1: 0.6310
 epoch: 33, train_loss: 0.5443, test_loss: 1.0009, test_f1: 0.6569
 epoch: 34, train_loss: 0.5201, test_loss: 1.0730, test_f1: 0.5973
 epoch: 35, train_loss: 0.5447, test_loss: 1.2148, test_f1: 0.6139
 epoch: 36, train_loss: 0.5102, test_loss: 1.0730, test_f1: 0.6217
 epoch: 37, train_loss: 0.4498, test_loss: 1.1625, test_f1: 0.6187
 epoch: 38, train_loss: 0.5052, test_loss: 1.1223, test_f1: 0.6334
 epoch: 39, train_loss: 0.4988, test_loss: 1.1228, test_f1: 0.6450
 epoch: 40, train_loss: 0.4791, test_loss: 1.2896, test_f1: 0.6187
 epoch: 41, train_loss: 0.4330, test_loss: 1.1036, test_f1: 0.6361
 epoch: 42, train_loss: 0.4605, test_loss: 1.5687, test_f1: 0.5308
 epoch: 43, train_loss: 0.4441, test_loss: 1.2112, test_f1: 0.5720
 epoch: 44, train_loss: 0.4643, test_loss: 1.4459, test_f1: 0.5754
 epoch: 45, train_loss: 0.4655, test_loss: 1.2802, test_f1: 0.6121
 epoch: 46, train_loss: 0.4097, test_loss: 1.1353, test_f1: 0.6316
 epoch: 47, train_loss: 0.4077, test_loss: 1.0594, test_f1: 0.6442
 epoch: 48, train_loss: 0.4154, test_loss: 1.2306, test_f1: 0.6453
 epoch: 49, train_loss: 0.4088, test_loss: 1.3139, test_f1: 0.5588
 epoch: 50, train_loss: 0.3795, test_loss: 1.2663, test_f1: 0.5780
 epoch: 51, train_loss: 0.3712, test_loss: 1.4249, test_f1: 0.6632
 epoch: 52, train_loss: 0.3359, test_loss: 1.2475, test_f1: 0.6528
 epoch: 53, train_loss: 0.3053, test_loss: 1.5360, test_f1: 0.6364
 epoch: 54, train_loss: 0.3259, test_loss: 1.2967, test_f1: 0.6479
 epoch: 55, train_loss: 0.3225, test_loss: 1.3799, test_f1: 0.6275
 epoch: 56, train_loss: 0.2856, test_loss: 1.5192, test_f1: 0.6482
 epoch: 57, train_loss: 0.2535, test_loss: 1.5698, test_f1: 0.6261
 epoch: 58, train_loss: 0.2675, test_loss: 1.4936, test_f1: 0.6498
 epoch: 59, train_loss: 0.2615, test_loss: 1.6393, test_f1: 0.6680
 epoch: 60, train_loss: 0.2440, test_loss: 1.5687, test_f1: 0.6216
 epoch: 61, train_loss: 0.2365, test_loss: 1.5707, test_f1: 0.6540
 epoch: 62, train_loss: 0.2578, test_loss: 1.8663, test_f1: 0.6103
 epoch: 63, train_loss: 0.2433, test_loss: 1.4767, test_f1: 0.6509
 epoch: 64, train_loss: 0.2514, test_loss: 1.6325, test_f1: 0.6303
 epoch: 65, train_loss: 0.2318, test_loss: 1.4235, test_f1: 0.6435
 epoch: 66, train_loss: 0.2337, test_loss: 1.4755, test_f1: 0.6377
 epoch: 67, train_loss: 0.2180, test_loss: 1.5752, test_f1: 0.6224
 epoch: 68, train_loss: 0.2416, test_loss: 1.5994, test_f1: 0.6421
 epoch: 69, train_loss: 0.2206, test_loss: 1.7929, test_f1: 0.6259
 epoch: 70, train_loss: 0.2078, test_loss: 1.7076, test_f1: 0.6638
 epoch: 71, train_loss: 0.2346, test_loss: 1.9159, test_f1: 0.6590
 epoch: 72, train_loss: 0.2560, test_loss: 1.6277, test_f1: 0.6727
 epoch: 73, train_loss: 0.2178, test_loss: 1.8545, test_f1: 0.6512
 epoch: 74, train_loss: 0.2449, test_loss: 1.4692, test_f1: 0.6543
 epoch: 75, train_loss: 0.2166, test_loss: 2.0461, test_f1: 0.5714
 epoch: 76, train_loss: 0.2970, test_loss: 1.6670, test_f1: 0.6194
 epoch: 77, train_loss: 0.2402, test_loss: 1.4139, test_f1: 0.6435
 epoch: 78, train_loss: 0.2052, test_loss: 1.8133, test_f1: 0.6486
 epoch: 79, train_loss: 0.2248, test_loss: 1.7671, test_f1: 0.6452
 epoch: 80, train_loss: 0.2119, test_loss: 1.7037, test_f1: 0.6595
 epoch: 81, train_loss: 0.1789, test_loss: 1.8735, test_f1: 0.6336
 epoch: 82, train_loss: 0.1946, test_loss: 2.0659, test_f1: 0.6221
 epoch: 83, train_loss: 0.2212, test_loss: 2.3829, test_f1: 0.6222
 epoch: 84, train_loss: 0.1794, test_loss: 1.7962, test_f1: 0.6423
 epoch: 85, train_loss: 0.1810, test_loss: 2.0821, test_f1: 0.6313
 epoch: 86, train_loss: 0.1950, test_loss: 2.0236, test_f1: 0.6424
 epoch: 87, train_loss: 0.1614, test_loss: 2.2774, test_f1: 0.6167
 epoch: 88, train_loss: 0.1338, test_loss: 2.2552, test_f1: 0.6279
 epoch: 89, train_loss: 0.1741, test_loss: 2.0727, test_f1: 0.6400
 epoch: 90, train_loss: 0.2174, test_loss: 1.9858, test_f1: 0.6259
 epoch: 91, train_loss: 0.2409, test_loss: 2.1200, test_f1: 0.6243
 epoch: 92, train_loss: 0.1744, test_loss: 2.0858, test_f1: 0.6298
 epoch: 93, train_loss: 0.1679, test_loss: 2.1096, test_f1: 0.6336
 epoch: 94, train_loss: 0.1510, test_loss: 2.1844, test_f1: 0.6553
 epoch: 95, train_loss: 0.1532, test_loss: 2.1893, test_f1: 0.6470
 epoch: 96, train_loss: 0.1645, test_loss: 2.1088, test_f1: 0.6508
 epoch: 97, train_loss: 0.1590, test_loss: 1.9872, test_f1: 0.6367
 epoch: 98, train_loss: 0.1445, test_loss: 2.1951, test_f1: 0.6486
 epoch: 99, train_loss: 0.1298, test_loss: 2.2736, test_f1: 0.6385

Training completed in 390.48 seconds
Best F1: 0.7154 at epoch 98
Mean F1 across iterations: 0.6811  0.0162
========================FINAL RESULTS================================
FEGIN weighted F1: 0.7154  0.0162
python main.py --data ltspice_demos --representation component_pin --model FEGIN --layers 2 --hiddens 128 --batch_size 64 --lr 0.01 --emb_size 512 --epochs 100 --save_appendix component_pin_L2_H128_BS64_LR0.01_E512 --no_val
-----



STDERR:
  File "main.py", line 370, in <module>
    main()
  File "main.py", line 254, in main
    dataset = dataset_class(
  File "/home/philip/projects/ltspice_examples_code_repo/Circuit-Completion-Using-GNNs/component_classification_with_link_prediction_head/evaluation/FEGIN/kernel/circuit_datasets.py", line 15, in __init__
    self.data, self.slices = torch.load(self.processed_paths[0])
  File "/home/philip/.local/lib/python3.8/site-packages/torch/serialization.py", line 1040, in load
    warnings.warn(
  File "/usr/lib/python3.8/warnings.py", line 109, in _showwarnmsg
    sw(msg.message, msg.category, msg.filename, msg.lineno,
  File "main.py", line 47, in warn_with_traceback
    traceback.print_stack(file=log)
/home/philip/projects/ltspice_examples_code_repo/Circuit-Completion-Using-GNNs/component_classification_with_link_prediction_head/evaluation/FEGIN/kernel/circuit_datasets.py:15: FutureWarning: You are using `torch.load` with `weights_only=False` (the current default value), which uses the default pickle module implicitly. It is possible to construct malicious pickle data which will execute arbitrary code during unpickling (See https://github.com/pytorch/pytorch/blob/main/SECURITY.md#untrusted-models for more details). In a future release, the default value for `weights_only` will be flipped to `True`. This limits the functions that could be executed during unpickling. Arbitrary objects will no longer be allowed to be loaded via this mode unless they are explicitly allowlisted by the user via `torch.serialization.add_safe_globals`. We recommend you start setting `weights_only=True` for any use case where you don't have full control of the loaded file. Please open an issue on GitHub for any issues related to this experimental feature.
  self.data, self.slices = torch.load(self.processed_paths[0])
