STDOUT:
Results will be saved in /home/philip/projects/ltspice_examples_code_repo/Circuit-Completion-Using-GNNs/component_classification_with_link_prediction_head/evaluation/FEGIN/results/model_FEGIN_dataset_ltspice_examples
Command line input: python main.py --data ltspice_examples --representation component_component --model FEGIN --layers 2 --hiddens 64 --batch_size 64 --lr 0.0001 --emb_size 128 --epochs 100 --save_appendix component_component_L2_H64_BS64_LR0.0001_E128 --no_val
 is saved.
-----
ltspice_examples - FEGIN
Using 2 layers, 64 hidden units, h = 2
Loading component_component representation dataset
ENTERED
Training FEGIN on component_component representation
Train: 3556, Test: 845
##################ITERATION #0 ****************************************
 epoch: 0, train_loss: 1.3872, test_loss: 1.3789, test_f1: 0.2515
 epoch: 1, train_loss: 1.3651, test_loss: 1.3565, test_f1: 0.2552
 epoch: 2, train_loss: 1.3445, test_loss: 1.3288, test_f1: 0.2524
 epoch: 3, train_loss: 1.3181, test_loss: 1.2956, test_f1: 0.2657
 epoch: 4, train_loss: 1.2895, test_loss: 1.2668, test_f1: 0.2611
 epoch: 5, train_loss: 1.2659, test_loss: 1.2404, test_f1: 0.3161
 epoch: 6, train_loss: 1.2452, test_loss: 1.2199, test_f1: 0.3383
 epoch: 7, train_loss: 1.2290, test_loss: 1.2007, test_f1: 0.3502
 epoch: 8, train_loss: 1.2129, test_loss: 1.1836, test_f1: 0.3471
 epoch: 9, train_loss: 1.2011, test_loss: 1.1661, test_f1: 0.3475
 epoch: 10, train_loss: 1.1874, test_loss: 1.1549, test_f1: 0.3575
 epoch: 11, train_loss: 1.1765, test_loss: 1.1429, test_f1: 0.3604
 epoch: 12, train_loss: 1.1683, test_loss: 1.1324, test_f1: 0.3719
 epoch: 13, train_loss: 1.1560, test_loss: 1.1219, test_f1: 0.3833
 epoch: 14, train_loss: 1.1481, test_loss: 1.1114, test_f1: 0.3934
 epoch: 15, train_loss: 1.1337, test_loss: 1.1027, test_f1: 0.4213
 epoch: 16, train_loss: 1.1288, test_loss: 1.0947, test_f1: 0.4299
 epoch: 17, train_loss: 1.1267, test_loss: 1.0865, test_f1: 0.4403
 epoch: 18, train_loss: 1.1144, test_loss: 1.0790, test_f1: 0.4485
 epoch: 19, train_loss: 1.1043, test_loss: 1.0708, test_f1: 0.4546
 epoch: 20, train_loss: 1.1042, test_loss: 1.0629, test_f1: 0.4693
 epoch: 21, train_loss: 1.0933, test_loss: 1.0582, test_f1: 0.4712
 epoch: 22, train_loss: 1.0818, test_loss: 1.0525, test_f1: 0.4679
 epoch: 23, train_loss: 1.0785, test_loss: 1.0419, test_f1: 0.4736
 epoch: 24, train_loss: 1.0693, test_loss: 1.0348, test_f1: 0.4746
 epoch: 25, train_loss: 1.0679, test_loss: 1.0278, test_f1: 0.4788
 epoch: 26, train_loss: 1.0598, test_loss: 1.0240, test_f1: 0.4753
 epoch: 27, train_loss: 1.0546, test_loss: 1.0180, test_f1: 0.4864
 epoch: 28, train_loss: 1.0494, test_loss: 1.0113, test_f1: 0.4891
 epoch: 29, train_loss: 1.0405, test_loss: 1.0016, test_f1: 0.4846
 epoch: 30, train_loss: 1.0341, test_loss: 0.9973, test_f1: 0.4776
 epoch: 31, train_loss: 1.0342, test_loss: 0.9930, test_f1: 0.4850
 epoch: 32, train_loss: 1.0239, test_loss: 0.9925, test_f1: 0.5000
 epoch: 33, train_loss: 1.0228, test_loss: 0.9796, test_f1: 0.4952
 epoch: 34, train_loss: 1.0116, test_loss: 0.9788, test_f1: 0.4855
 epoch: 35, train_loss: 1.0096, test_loss: 0.9750, test_f1: 0.4871
 epoch: 36, train_loss: 1.0002, test_loss: 0.9666, test_f1: 0.5039
 epoch: 37, train_loss: 0.9940, test_loss: 0.9610, test_f1: 0.5113
 epoch: 38, train_loss: 0.9898, test_loss: 0.9601, test_f1: 0.4901
 epoch: 39, train_loss: 0.9853, test_loss: 0.9630, test_f1: 0.4856
 epoch: 40, train_loss: 0.9855, test_loss: 0.9520, test_f1: 0.4933
 epoch: 41, train_loss: 0.9744, test_loss: 0.9522, test_f1: 0.4898
 epoch: 42, train_loss: 0.9751, test_loss: 0.9545, test_f1: 0.4966
 epoch: 43, train_loss: 0.9697, test_loss: 0.9469, test_f1: 0.4907
 epoch: 44, train_loss: 0.9529, test_loss: 0.9472, test_f1: 0.4968
 epoch: 45, train_loss: 0.9661, test_loss: 0.9449, test_f1: 0.4904
 epoch: 46, train_loss: 0.9449, test_loss: 0.9351, test_f1: 0.4825
 epoch: 47, train_loss: 0.9425, test_loss: 0.9295, test_f1: 0.4945
 epoch: 48, train_loss: 0.9453, test_loss: 0.9399, test_f1: 0.4977
 epoch: 49, train_loss: 0.9424, test_loss: 0.9474, test_f1: 0.4876
 epoch: 50, train_loss: 0.9379, test_loss: 0.9463, test_f1: 0.4988
 epoch: 51, train_loss: 0.9308, test_loss: 0.9397, test_f1: 0.5100
 epoch: 52, train_loss: 0.9299, test_loss: 0.9311, test_f1: 0.5103
 epoch: 53, train_loss: 0.9193, test_loss: 0.9287, test_f1: 0.4991
 epoch: 54, train_loss: 0.9234, test_loss: 0.9388, test_f1: 0.5122
 epoch: 55, train_loss: 0.9200, test_loss: 0.9352, test_f1: 0.4949
 epoch: 56, train_loss: 0.9227, test_loss: 0.9298, test_f1: 0.5048
 epoch: 57, train_loss: 0.9251, test_loss: 0.9398, test_f1: 0.5212
 epoch: 58, train_loss: 0.9136, test_loss: 0.9384, test_f1: 0.5180
 epoch: 59, train_loss: 0.9129, test_loss: 0.9406, test_f1: 0.5170
 epoch: 60, train_loss: 0.9157, test_loss: 0.9358, test_f1: 0.5022
 epoch: 61, train_loss: 0.9109, test_loss: 0.9302, test_f1: 0.5182
 epoch: 62, train_loss: 0.9193, test_loss: 0.9379, test_f1: 0.5172
 epoch: 63, train_loss: 0.9091, test_loss: 0.9443, test_f1: 0.5182
 epoch: 64, train_loss: 0.9034, test_loss: 0.9357, test_f1: 0.5141
 epoch: 65, train_loss: 0.9087, test_loss: 0.9348, test_f1: 0.5119
 epoch: 66, train_loss: 0.8980, test_loss: 0.9307, test_f1: 0.5219
 epoch: 67, train_loss: 0.8993, test_loss: 0.9332, test_f1: 0.5202
 epoch: 68, train_loss: 0.8962, test_loss: 0.9327, test_f1: 0.5187
 epoch: 69, train_loss: 0.8961, test_loss: 0.9383, test_f1: 0.5191
 epoch: 70, train_loss: 0.9025, test_loss: 0.9300, test_f1: 0.5066
 epoch: 71, train_loss: 0.9009, test_loss: 0.9345, test_f1: 0.5146
 epoch: 72, train_loss: 0.8982, test_loss: 0.9259, test_f1: 0.5152
 epoch: 73, train_loss: 0.8986, test_loss: 0.9311, test_f1: 0.5277
 epoch: 74, train_loss: 0.8880, test_loss: 0.9386, test_f1: 0.5188
 epoch: 75, train_loss: 0.8834, test_loss: 0.9344, test_f1: 0.5140
 epoch: 76, train_loss: 0.8930, test_loss: 0.9356, test_f1: 0.5260
 epoch: 77, train_loss: 0.8919, test_loss: 0.9341, test_f1: 0.5229
 epoch: 78, train_loss: 0.8909, test_loss: 0.9341, test_f1: 0.5294
 epoch: 79, train_loss: 0.8869, test_loss: 0.9352, test_f1: 0.5217
 epoch: 80, train_loss: 0.8835, test_loss: 0.9425, test_f1: 0.5148
 epoch: 81, train_loss: 0.8864, test_loss: 0.9398, test_f1: 0.5185
 epoch: 82, train_loss: 0.8827, test_loss: 0.9335, test_f1: 0.5272
 epoch: 83, train_loss: 0.8778, test_loss: 0.9411, test_f1: 0.5180
 epoch: 84, train_loss: 0.8847, test_loss: 0.9312, test_f1: 0.5300
 epoch: 85, train_loss: 0.8783, test_loss: 0.9306, test_f1: 0.5258
 epoch: 86, train_loss: 0.8772, test_loss: 0.9407, test_f1: 0.5225
 epoch: 87, train_loss: 0.8745, test_loss: 0.9376, test_f1: 0.5257
 epoch: 88, train_loss: 0.8792, test_loss: 0.9330, test_f1: 0.5183
 epoch: 89, train_loss: 0.8840, test_loss: 0.9398, test_f1: 0.5195
 epoch: 90, train_loss: 0.8734, test_loss: 0.9433, test_f1: 0.5102
 epoch: 91, train_loss: 0.8755, test_loss: 0.9396, test_f1: 0.5184
 epoch: 92, train_loss: 0.8728, test_loss: 0.9347, test_f1: 0.5246
 epoch: 93, train_loss: 0.8796, test_loss: 0.9466, test_f1: 0.5231
 epoch: 94, train_loss: 0.8718, test_loss: 0.9426, test_f1: 0.5127
 epoch: 95, train_loss: 0.8755, test_loss: 0.9374, test_f1: 0.5225
 epoch: 96, train_loss: 0.8642, test_loss: 0.9306, test_f1: 0.5217
 epoch: 97, train_loss: 0.8677, test_loss: 0.9398, test_f1: 0.5230
 epoch: 98, train_loss: 0.8661, test_loss: 0.9389, test_f1: 0.5271
 epoch: 99, train_loss: 0.8628, test_loss: 0.9369, test_f1: 0.5208
##################ITERATION #1 ****************************************
 epoch: 0, train_loss: 1.3479, test_loss: 1.3099, test_f1: 0.2274
 epoch: 1, train_loss: 1.2907, test_loss: 1.2708, test_f1: 0.2274
 epoch: 2, train_loss: 1.2638, test_loss: 1.2439, test_f1: 0.2498
 epoch: 3, train_loss: 1.2457, test_loss: 1.2262, test_f1: 0.2696
 epoch: 4, train_loss: 1.2287, test_loss: 1.2112, test_f1: 0.2756
 epoch: 5, train_loss: 1.2147, test_loss: 1.1921, test_f1: 0.3243
 epoch: 6, train_loss: 1.2043, test_loss: 1.1708, test_f1: 0.4183
 epoch: 7, train_loss: 1.1891, test_loss: 1.1578, test_f1: 0.4408
 epoch: 8, train_loss: 1.1738, test_loss: 1.1420, test_f1: 0.4360
 epoch: 9, train_loss: 1.1586, test_loss: 1.1202, test_f1: 0.4254
 epoch: 10, train_loss: 1.1434, test_loss: 1.1046, test_f1: 0.4236
 epoch: 11, train_loss: 1.1298, test_loss: 1.0906, test_f1: 0.4269
 epoch: 12, train_loss: 1.1179, test_loss: 1.0764, test_f1: 0.4349
 epoch: 13, train_loss: 1.1016, test_loss: 1.0617, test_f1: 0.4576
 epoch: 14, train_loss: 1.0945, test_loss: 1.0494, test_f1: 0.4437
 epoch: 15, train_loss: 1.0757, test_loss: 1.0338, test_f1: 0.4415
 epoch: 16, train_loss: 1.0673, test_loss: 1.0232, test_f1: 0.4597
 epoch: 17, train_loss: 1.0598, test_loss: 1.0152, test_f1: 0.4789
 epoch: 18, train_loss: 1.0505, test_loss: 1.0066, test_f1: 0.4709
 epoch: 19, train_loss: 1.0422, test_loss: 1.0049, test_f1: 0.4613
 epoch: 20, train_loss: 1.0340, test_loss: 0.9952, test_f1: 0.4707
 epoch: 21, train_loss: 1.0295, test_loss: 0.9855, test_f1: 0.4883
 epoch: 22, train_loss: 1.0292, test_loss: 0.9816, test_f1: 0.4891
 epoch: 23, train_loss: 1.0103, test_loss: 0.9738, test_f1: 0.4886
 epoch: 24, train_loss: 1.0037, test_loss: 0.9667, test_f1: 0.5012
 epoch: 25, train_loss: 1.0071, test_loss: 0.9692, test_f1: 0.4899
 epoch: 26, train_loss: 0.9925, test_loss: 0.9804, test_f1: 0.4866
 epoch: 27, train_loss: 0.9941, test_loss: 0.9675, test_f1: 0.4914
 epoch: 28, train_loss: 0.9759, test_loss: 0.9610, test_f1: 0.4939
 epoch: 29, train_loss: 0.9749, test_loss: 0.9637, test_f1: 0.5018
 epoch: 30, train_loss: 0.9776, test_loss: 0.9560, test_f1: 0.5054
 epoch: 31, train_loss: 0.9657, test_loss: 0.9656, test_f1: 0.4957
 epoch: 32, train_loss: 0.9618, test_loss: 0.9623, test_f1: 0.4998
 epoch: 33, train_loss: 0.9588, test_loss: 0.9544, test_f1: 0.5015
 epoch: 34, train_loss: 0.9586, test_loss: 0.9528, test_f1: 0.4939
 epoch: 35, train_loss: 0.9482, test_loss: 0.9749, test_f1: 0.4982
 epoch: 36, train_loss: 0.9532, test_loss: 0.9631, test_f1: 0.5114
 epoch: 37, train_loss: 0.9438, test_loss: 0.9571, test_f1: 0.5083
 epoch: 38, train_loss: 0.9289, test_loss: 0.9553, test_f1: 0.5058
 epoch: 39, train_loss: 0.9409, test_loss: 0.9508, test_f1: 0.5059
 epoch: 40, train_loss: 0.9298, test_loss: 0.9501, test_f1: 0.5042
 epoch: 41, train_loss: 0.9227, test_loss: 0.9615, test_f1: 0.5028
 epoch: 42, train_loss: 0.9187, test_loss: 0.9544, test_f1: 0.4923
 epoch: 43, train_loss: 0.9255, test_loss: 0.9339, test_f1: 0.5133
 epoch: 44, train_loss: 0.9164, test_loss: 0.9726, test_f1: 0.4970
 epoch: 45, train_loss: 0.9122, test_loss: 0.9684, test_f1: 0.4946
 epoch: 46, train_loss: 0.9122, test_loss: 0.9674, test_f1: 0.5055
 epoch: 47, train_loss: 0.9088, test_loss: 0.9614, test_f1: 0.4966
 epoch: 48, train_loss: 0.9009, test_loss: 0.9664, test_f1: 0.4844
 epoch: 49, train_loss: 0.9024, test_loss: 0.9613, test_f1: 0.4956
 epoch: 50, train_loss: 0.8979, test_loss: 0.9698, test_f1: 0.4745
 epoch: 51, train_loss: 0.8966, test_loss: 0.9645, test_f1: 0.4986
 epoch: 52, train_loss: 0.8921, test_loss: 0.9748, test_f1: 0.4939
 epoch: 53, train_loss: 0.8828, test_loss: 0.9696, test_f1: 0.4951
 epoch: 54, train_loss: 0.8860, test_loss: 0.9674, test_f1: 0.5010
 epoch: 55, train_loss: 0.8828, test_loss: 0.9632, test_f1: 0.4896
 epoch: 56, train_loss: 0.8792, test_loss: 0.9693, test_f1: 0.5082
 epoch: 57, train_loss: 0.8844, test_loss: 0.9649, test_f1: 0.5060
 epoch: 58, train_loss: 0.8796, test_loss: 0.9685, test_f1: 0.5092
 epoch: 59, train_loss: 0.8771, test_loss: 0.9703, test_f1: 0.5096
 epoch: 60, train_loss: 0.8817, test_loss: 0.9727, test_f1: 0.5132
 epoch: 61, train_loss: 0.8761, test_loss: 0.9702, test_f1: 0.4840
 epoch: 62, train_loss: 0.8780, test_loss: 0.9508, test_f1: 0.4999
 epoch: 63, train_loss: 0.8769, test_loss: 0.9785, test_f1: 0.4888
 epoch: 64, train_loss: 0.8718, test_loss: 0.9765, test_f1: 0.4912
 epoch: 65, train_loss: 0.8788, test_loss: 0.9681, test_f1: 0.4880
 epoch: 66, train_loss: 0.8708, test_loss: 0.9732, test_f1: 0.4763
 epoch: 67, train_loss: 0.8599, test_loss: 0.9632, test_f1: 0.4999
 epoch: 68, train_loss: 0.8745, test_loss: 0.9726, test_f1: 0.5132
 epoch: 69, train_loss: 0.8668, test_loss: 0.9638, test_f1: 0.5031
 epoch: 70, train_loss: 0.8632, test_loss: 0.9768, test_f1: 0.5009
 epoch: 71, train_loss: 0.8695, test_loss: 0.9811, test_f1: 0.4998
 epoch: 72, train_loss: 0.8685, test_loss: 0.9737, test_f1: 0.4881
 epoch: 73, train_loss: 0.8665, test_loss: 0.9637, test_f1: 0.5023
 epoch: 74, train_loss: 0.8601, test_loss: 0.9692, test_f1: 0.5083
 epoch: 75, train_loss: 0.8608, test_loss: 0.9758, test_f1: 0.5009
 epoch: 76, train_loss: 0.8585, test_loss: 0.9723, test_f1: 0.4879
 epoch: 77, train_loss: 0.8609, test_loss: 0.9742, test_f1: 0.4888
 epoch: 78, train_loss: 0.8572, test_loss: 0.9740, test_f1: 0.5100
 epoch: 79, train_loss: 0.8549, test_loss: 0.9824, test_f1: 0.5047
 epoch: 80, train_loss: 0.8591, test_loss: 0.9830, test_f1: 0.4882
 epoch: 81, train_loss: 0.8587, test_loss: 0.9728, test_f1: 0.4974
 epoch: 82, train_loss: 0.8534, test_loss: 0.9849, test_f1: 0.5056
 epoch: 83, train_loss: 0.8512, test_loss: 0.9720, test_f1: 0.4900
 epoch: 84, train_loss: 0.8560, test_loss: 0.9736, test_f1: 0.4971
 epoch: 85, train_loss: 0.8488, test_loss: 1.0024, test_f1: 0.4814
 epoch: 86, train_loss: 0.8491, test_loss: 0.9743, test_f1: 0.5102
 epoch: 87, train_loss: 0.8418, test_loss: 0.9842, test_f1: 0.4892
 epoch: 88, train_loss: 0.8436, test_loss: 0.9812, test_f1: 0.4887
 epoch: 89, train_loss: 0.8525, test_loss: 0.9835, test_f1: 0.4910
 epoch: 90, train_loss: 0.8436, test_loss: 0.9908, test_f1: 0.4995
 epoch: 91, train_loss: 0.8326, test_loss: 0.9786, test_f1: 0.5017
 epoch: 92, train_loss: 0.8321, test_loss: 0.9981, test_f1: 0.5034
 epoch: 93, train_loss: 0.8377, test_loss: 1.0052, test_f1: 0.4958
 epoch: 94, train_loss: 0.8426, test_loss: 0.9963, test_f1: 0.4829
 epoch: 95, train_loss: 0.8291, test_loss: 1.0011, test_f1: 0.4706
 epoch: 96, train_loss: 0.8401, test_loss: 0.9915, test_f1: 0.4883
 epoch: 97, train_loss: 0.8307, test_loss: 0.9904, test_f1: 0.4794
 epoch: 98, train_loss: 0.8340, test_loss: 0.9921, test_f1: 0.4862
 epoch: 99, train_loss: 0.8327, test_loss: 1.0051, test_f1: 0.4880
##################ITERATION #2 ****************************************
 epoch: 0, train_loss: 1.3690, test_loss: 1.3127, test_f1: 0.3280
 epoch: 1, train_loss: 1.2870, test_loss: 1.2481, test_f1: 0.3616
 epoch: 2, train_loss: 1.2620, test_loss: 1.2178, test_f1: 0.3707
 epoch: 3, train_loss: 1.2379, test_loss: 1.1953, test_f1: 0.4099
 epoch: 4, train_loss: 1.2219, test_loss: 1.1808, test_f1: 0.4209
 epoch: 5, train_loss: 1.2059, test_loss: 1.1639, test_f1: 0.4262
 epoch: 6, train_loss: 1.1999, test_loss: 1.1509, test_f1: 0.4234
 epoch: 7, train_loss: 1.1868, test_loss: 1.1357, test_f1: 0.4353
 epoch: 8, train_loss: 1.1741, test_loss: 1.1249, test_f1: 0.4308
 epoch: 9, train_loss: 1.1601, test_loss: 1.1155, test_f1: 0.4387
 epoch: 10, train_loss: 1.1453, test_loss: 1.1029, test_f1: 0.4456
 epoch: 11, train_loss: 1.1403, test_loss: 1.0913, test_f1: 0.4514
 epoch: 12, train_loss: 1.1320, test_loss: 1.0816, test_f1: 0.4508
 epoch: 13, train_loss: 1.1214, test_loss: 1.0696, test_f1: 0.4519
 epoch: 14, train_loss: 1.1132, test_loss: 1.0692, test_f1: 0.4527
 epoch: 15, train_loss: 1.1031, test_loss: 1.0540, test_f1: 0.4601
 epoch: 16, train_loss: 1.0978, test_loss: 1.0469, test_f1: 0.4439
 epoch: 17, train_loss: 1.0848, test_loss: 1.0419, test_f1: 0.4511
 epoch: 18, train_loss: 1.0764, test_loss: 1.0320, test_f1: 0.4680
 epoch: 19, train_loss: 1.0752, test_loss: 1.0249, test_f1: 0.4548
 epoch: 20, train_loss: 1.0608, test_loss: 1.0172, test_f1: 0.4673
 epoch: 21, train_loss: 1.0539, test_loss: 1.0108, test_f1: 0.4796
 epoch: 22, train_loss: 1.0533, test_loss: 1.0078, test_f1: 0.4488
 epoch: 23, train_loss: 1.0500, test_loss: 1.0022, test_f1: 0.4807
 epoch: 24, train_loss: 1.0455, test_loss: 0.9973, test_f1: 0.4856
 epoch: 25, train_loss: 1.0310, test_loss: 0.9922, test_f1: 0.4858
 epoch: 26, train_loss: 1.0277, test_loss: 0.9913, test_f1: 0.4537
 epoch: 27, train_loss: 1.0217, test_loss: 0.9874, test_f1: 0.4462
 epoch: 28, train_loss: 1.0174, test_loss: 0.9820, test_f1: 0.4748
 epoch: 29, train_loss: 1.0115, test_loss: 0.9805, test_f1: 0.4904
 epoch: 30, train_loss: 1.0091, test_loss: 0.9700, test_f1: 0.4966
 epoch: 31, train_loss: 1.0046, test_loss: 0.9678, test_f1: 0.4618
 epoch: 32, train_loss: 0.9978, test_loss: 0.9711, test_f1: 0.4670
 epoch: 33, train_loss: 0.9992, test_loss: 0.9653, test_f1: 0.4858
 epoch: 34, train_loss: 0.9836, test_loss: 0.9756, test_f1: 0.4827
 epoch: 35, train_loss: 0.9854, test_loss: 0.9674, test_f1: 0.4738
 epoch: 36, train_loss: 0.9846, test_loss: 0.9516, test_f1: 0.4532
 epoch: 37, train_loss: 0.9791, test_loss: 0.9701, test_f1: 0.4774
 epoch: 38, train_loss: 0.9749, test_loss: 0.9494, test_f1: 0.4866
 epoch: 39, train_loss: 0.9707, test_loss: 0.9678, test_f1: 0.4657
 epoch: 40, train_loss: 0.9640, test_loss: 0.9544, test_f1: 0.4883
 epoch: 41, train_loss: 0.9635, test_loss: 0.9497, test_f1: 0.4879
 epoch: 42, train_loss: 0.9562, test_loss: 0.9496, test_f1: 0.5038
 epoch: 43, train_loss: 0.9590, test_loss: 0.9834, test_f1: 0.4705
 epoch: 44, train_loss: 0.9467, test_loss: 0.9389, test_f1: 0.5013
 epoch: 45, train_loss: 0.9467, test_loss: 0.9495, test_f1: 0.4960
 epoch: 46, train_loss: 0.9420, test_loss: 0.9565, test_f1: 0.4714
 epoch: 47, train_loss: 0.9446, test_loss: 0.9547, test_f1: 0.4693
 epoch: 48, train_loss: 0.9365, test_loss: 0.9506, test_f1: 0.4812
 epoch: 49, train_loss: 0.9335, test_loss: 0.9412, test_f1: 0.5013
 epoch: 50, train_loss: 0.9281, test_loss: 0.9715, test_f1: 0.4730
 epoch: 51, train_loss: 0.9258, test_loss: 0.9605, test_f1: 0.4795
 epoch: 52, train_loss: 0.9269, test_loss: 0.9536, test_f1: 0.5037
 epoch: 53, train_loss: 0.9213, test_loss: 0.9842, test_f1: 0.4730
 epoch: 54, train_loss: 0.9222, test_loss: 0.9496, test_f1: 0.4746
 epoch: 55, train_loss: 0.9172, test_loss: 0.9595, test_f1: 0.4716
 epoch: 56, train_loss: 0.9116, test_loss: 0.9423, test_f1: 0.5031
 epoch: 57, train_loss: 0.9168, test_loss: 0.9497, test_f1: 0.4828
 epoch: 58, train_loss: 0.9161, test_loss: 0.9481, test_f1: 0.4804
 epoch: 59, train_loss: 0.9145, test_loss: 0.9681, test_f1: 0.4844
 epoch: 60, train_loss: 0.9085, test_loss: 0.9762, test_f1: 0.4780
 epoch: 61, train_loss: 0.9110, test_loss: 0.9575, test_f1: 0.4801
 epoch: 62, train_loss: 0.9122, test_loss: 0.9805, test_f1: 0.4746
 epoch: 63, train_loss: 0.8976, test_loss: 0.9599, test_f1: 0.4798
 epoch: 64, train_loss: 0.9129, test_loss: 0.9495, test_f1: 0.4911
 epoch: 65, train_loss: 0.9035, test_loss: 0.9734, test_f1: 0.4776
 epoch: 66, train_loss: 0.9008, test_loss: 0.9645, test_f1: 0.4782
 epoch: 67, train_loss: 0.8954, test_loss: 0.9702, test_f1: 0.4805
 epoch: 68, train_loss: 0.8995, test_loss: 0.9517, test_f1: 0.4850
 epoch: 69, train_loss: 0.8923, test_loss: 0.9814, test_f1: 0.4793
 epoch: 70, train_loss: 0.9008, test_loss: 0.9879, test_f1: 0.4781
 epoch: 71, train_loss: 0.8910, test_loss: 0.9621, test_f1: 0.4780
 epoch: 72, train_loss: 0.8948, test_loss: 0.9630, test_f1: 0.4781
 epoch: 73, train_loss: 0.8899, test_loss: 0.9728, test_f1: 0.4751
 epoch: 74, train_loss: 0.8870, test_loss: 0.9938, test_f1: 0.4848
 epoch: 75, train_loss: 0.8853, test_loss: 0.9511, test_f1: 0.4916
 epoch: 76, train_loss: 0.8821, test_loss: 0.9874, test_f1: 0.4757
 epoch: 77, train_loss: 0.8846, test_loss: 0.9628, test_f1: 0.4822
 epoch: 78, train_loss: 0.8824, test_loss: 0.9592, test_f1: 0.4806
 epoch: 79, train_loss: 0.8902, test_loss: 0.9753, test_f1: 0.4859
 epoch: 80, train_loss: 0.8779, test_loss: 0.9613, test_f1: 0.5126
 epoch: 81, train_loss: 0.8816, test_loss: 0.9615, test_f1: 0.4867
 epoch: 82, train_loss: 0.8766, test_loss: 0.9606, test_f1: 0.4807
 epoch: 83, train_loss: 0.8628, test_loss: 0.9546, test_f1: 0.5053
 epoch: 84, train_loss: 0.8866, test_loss: 0.9605, test_f1: 0.4856
 epoch: 85, train_loss: 0.8856, test_loss: 0.9823, test_f1: 0.4768
 epoch: 86, train_loss: 0.8730, test_loss: 0.9745, test_f1: 0.4825
 epoch: 87, train_loss: 0.8705, test_loss: 0.9725, test_f1: 0.4793
 epoch: 88, train_loss: 0.8722, test_loss: 0.9677, test_f1: 0.4786
 epoch: 89, train_loss: 0.8648, test_loss: 0.9392, test_f1: 0.5138
 epoch: 90, train_loss: 0.8656, test_loss: 0.9560, test_f1: 0.4832
 epoch: 91, train_loss: 0.8664, test_loss: 0.9668, test_f1: 0.4851
 epoch: 92, train_loss: 0.8666, test_loss: 0.9875, test_f1: 0.4943
 epoch: 93, train_loss: 0.8705, test_loss: 0.9617, test_f1: 0.4993
 epoch: 94, train_loss: 0.8714, test_loss: 0.9480, test_f1: 0.5283
 epoch: 95, train_loss: 0.8607, test_loss: 1.0117, test_f1: 0.4806
 epoch: 96, train_loss: 0.8605, test_loss: 0.9687, test_f1: 0.4884
 epoch: 97, train_loss: 0.8497, test_loss: 0.9837, test_f1: 0.4865
 epoch: 98, train_loss: 0.8670, test_loss: 0.9671, test_f1: 0.5012
 epoch: 99, train_loss: 0.8508, test_loss: 0.9877, test_f1: 0.4822
##################ITERATION #3 ****************************************
 epoch: 0, train_loss: 1.3065, test_loss: 1.2503, test_f1: 0.2676
 epoch: 1, train_loss: 1.2473, test_loss: 1.2045, test_f1: 0.3413
 epoch: 2, train_loss: 1.2248, test_loss: 1.1802, test_f1: 0.3894
 epoch: 3, train_loss: 1.2003, test_loss: 1.1611, test_f1: 0.4008
 epoch: 4, train_loss: 1.1897, test_loss: 1.1415, test_f1: 0.4205
 epoch: 5, train_loss: 1.1768, test_loss: 1.1273, test_f1: 0.4370
 epoch: 6, train_loss: 1.1623, test_loss: 1.1134, test_f1: 0.4365
 epoch: 7, train_loss: 1.1511, test_loss: 1.1007, test_f1: 0.4414
 epoch: 8, train_loss: 1.1423, test_loss: 1.0879, test_f1: 0.4302
 epoch: 9, train_loss: 1.1213, test_loss: 1.0808, test_f1: 0.4307
 epoch: 10, train_loss: 1.1224, test_loss: 1.0741, test_f1: 0.4533
 epoch: 11, train_loss: 1.1098, test_loss: 1.0697, test_f1: 0.4488
 epoch: 12, train_loss: 1.0950, test_loss: 1.0534, test_f1: 0.4595
 epoch: 13, train_loss: 1.0944, test_loss: 1.0497, test_f1: 0.4626
 epoch: 14, train_loss: 1.0838, test_loss: 1.0395, test_f1: 0.4658
 epoch: 15, train_loss: 1.0764, test_loss: 1.0324, test_f1: 0.4555
 epoch: 16, train_loss: 1.0645, test_loss: 1.0294, test_f1: 0.4688
 epoch: 17, train_loss: 1.0623, test_loss: 1.0168, test_f1: 0.4640
 epoch: 18, train_loss: 1.0573, test_loss: 1.0063, test_f1: 0.4718
 epoch: 19, train_loss: 1.0442, test_loss: 1.0018, test_f1: 0.4739
 epoch: 20, train_loss: 1.0413, test_loss: 1.0018, test_f1: 0.4729
 epoch: 21, train_loss: 1.0321, test_loss: 0.9907, test_f1: 0.4789
 epoch: 22, train_loss: 1.0288, test_loss: 0.9823, test_f1: 0.4817
 epoch: 23, train_loss: 1.0218, test_loss: 0.9831, test_f1: 0.4820
 epoch: 24, train_loss: 1.0161, test_loss: 0.9839, test_f1: 0.4684
 epoch: 25, train_loss: 1.0080, test_loss: 0.9810, test_f1: 0.4819
 epoch: 26, train_loss: 1.0024, test_loss: 0.9821, test_f1: 0.4893
 epoch: 27, train_loss: 0.9972, test_loss: 0.9759, test_f1: 0.4830
 epoch: 28, train_loss: 0.9963, test_loss: 0.9775, test_f1: 0.4742
 epoch: 29, train_loss: 0.9927, test_loss: 0.9725, test_f1: 0.4884
 epoch: 30, train_loss: 0.9861, test_loss: 0.9759, test_f1: 0.4808
 epoch: 31, train_loss: 0.9830, test_loss: 0.9623, test_f1: 0.4987
 epoch: 32, train_loss: 0.9720, test_loss: 0.9570, test_f1: 0.4980
 epoch: 33, train_loss: 0.9768, test_loss: 0.9597, test_f1: 0.4863
 epoch: 34, train_loss: 0.9636, test_loss: 0.9645, test_f1: 0.4794
 epoch: 35, train_loss: 0.9728, test_loss: 0.9612, test_f1: 0.4779
 epoch: 36, train_loss: 0.9586, test_loss: 0.9561, test_f1: 0.4952
 epoch: 37, train_loss: 0.9625, test_loss: 0.9507, test_f1: 0.4997
 epoch: 38, train_loss: 0.9528, test_loss: 0.9505, test_f1: 0.5012
 epoch: 39, train_loss: 0.9454, test_loss: 0.9529, test_f1: 0.4979
 epoch: 40, train_loss: 0.9549, test_loss: 0.9578, test_f1: 0.4929
 epoch: 41, train_loss: 0.9396, test_loss: 0.9549, test_f1: 0.4970
 epoch: 42, train_loss: 0.9416, test_loss: 0.9580, test_f1: 0.4811
 epoch: 43, train_loss: 0.9403, test_loss: 0.9567, test_f1: 0.4915
 epoch: 44, train_loss: 0.9272, test_loss: 0.9620, test_f1: 0.4761
 epoch: 45, train_loss: 0.9263, test_loss: 0.9383, test_f1: 0.4754
 epoch: 46, train_loss: 0.9235, test_loss: 0.9504, test_f1: 0.4841
 epoch: 47, train_loss: 0.9170, test_loss: 0.9349, test_f1: 0.4981
 epoch: 48, train_loss: 0.9122, test_loss: 0.9320, test_f1: 0.4984
 epoch: 49, train_loss: 0.9092, test_loss: 0.9489, test_f1: 0.4873
 epoch: 50, train_loss: 0.9066, test_loss: 0.9366, test_f1: 0.4965
 epoch: 51, train_loss: 0.9072, test_loss: 0.9267, test_f1: 0.5000
 epoch: 52, train_loss: 0.9016, test_loss: 0.9385, test_f1: 0.4894
 epoch: 53, train_loss: 0.9032, test_loss: 0.9346, test_f1: 0.5003
 epoch: 54, train_loss: 0.9069, test_loss: 0.9334, test_f1: 0.4985
 epoch: 55, train_loss: 0.9006, test_loss: 0.9503, test_f1: 0.5020
 epoch: 56, train_loss: 0.8915, test_loss: 0.9420, test_f1: 0.5007
 epoch: 57, train_loss: 0.8930, test_loss: 0.9351, test_f1: 0.5008
 epoch: 58, train_loss: 0.8992, test_loss: 0.9400, test_f1: 0.4986
 epoch: 59, train_loss: 0.8925, test_loss: 0.9375, test_f1: 0.4913
 epoch: 60, train_loss: 0.8846, test_loss: 0.9462, test_f1: 0.4872
 epoch: 61, train_loss: 0.8840, test_loss: 0.9441, test_f1: 0.5012
 epoch: 62, train_loss: 0.8849, test_loss: 0.9381, test_f1: 0.4925
 epoch: 63, train_loss: 0.8767, test_loss: 0.9293, test_f1: 0.5051
 epoch: 64, train_loss: 0.8877, test_loss: 0.9543, test_f1: 0.5038
 epoch: 65, train_loss: 0.8786, test_loss: 0.9519, test_f1: 0.5001
 epoch: 66, train_loss: 0.8772, test_loss: 0.9667, test_f1: 0.4944
 epoch: 67, train_loss: 0.8793, test_loss: 0.9599, test_f1: 0.4963
 epoch: 68, train_loss: 0.8852, test_loss: 0.9574, test_f1: 0.5054
 epoch: 69, train_loss: 0.8791, test_loss: 0.9423, test_f1: 0.4978
 epoch: 70, train_loss: 0.8638, test_loss: 0.9399, test_f1: 0.4926
 epoch: 71, train_loss: 0.8786, test_loss: 0.9426, test_f1: 0.4994
 epoch: 72, train_loss: 0.8645, test_loss: 0.9500, test_f1: 0.4964
 epoch: 73, train_loss: 0.8662, test_loss: 0.9482, test_f1: 0.4956
 epoch: 74, train_loss: 0.8731, test_loss: 0.9530, test_f1: 0.4931
 epoch: 75, train_loss: 0.8734, test_loss: 0.9431, test_f1: 0.5033
 epoch: 76, train_loss: 0.8661, test_loss: 0.9499, test_f1: 0.4963
 epoch: 77, train_loss: 0.8633, test_loss: 0.9474, test_f1: 0.5025
 epoch: 78, train_loss: 0.8669, test_loss: 0.9513, test_f1: 0.4943
 epoch: 79, train_loss: 0.8624, test_loss: 0.9422, test_f1: 0.4950
 epoch: 80, train_loss: 0.8679, test_loss: 0.9624, test_f1: 0.5016
 epoch: 81, train_loss: 0.8561, test_loss: 0.9615, test_f1: 0.4991
 epoch: 82, train_loss: 0.8632, test_loss: 0.9668, test_f1: 0.5017
 epoch: 83, train_loss: 0.8520, test_loss: 0.9393, test_f1: 0.4978
 epoch: 84, train_loss: 0.8413, test_loss: 0.9571, test_f1: 0.5034
 epoch: 85, train_loss: 0.8491, test_loss: 0.9448, test_f1: 0.4964
 epoch: 86, train_loss: 0.8491, test_loss: 0.9441, test_f1: 0.4934
 epoch: 87, train_loss: 0.8486, test_loss: 0.9635, test_f1: 0.4860
 epoch: 88, train_loss: 0.8454, test_loss: 0.9520, test_f1: 0.4986
 epoch: 89, train_loss: 0.8491, test_loss: 0.9477, test_f1: 0.4953
 epoch: 90, train_loss: 0.8507, test_loss: 0.9517, test_f1: 0.5063
 epoch: 91, train_loss: 0.8333, test_loss: 0.9406, test_f1: 0.4954
 epoch: 92, train_loss: 0.8431, test_loss: 0.9516, test_f1: 0.5035
 epoch: 93, train_loss: 0.8422, test_loss: 0.9525, test_f1: 0.5002
 epoch: 94, train_loss: 0.8304, test_loss: 0.9661, test_f1: 0.4953
 epoch: 95, train_loss: 0.8391, test_loss: 0.9619, test_f1: 0.4914
 epoch: 96, train_loss: 0.8281, test_loss: 0.9537, test_f1: 0.4992
 epoch: 97, train_loss: 0.8438, test_loss: 0.9505, test_f1: 0.4892
 epoch: 98, train_loss: 0.8301, test_loss: 0.9734, test_f1: 0.4968
 epoch: 99, train_loss: 0.8363, test_loss: 0.9656, test_f1: 0.4824
##################ITERATION #4 ****************************************
 epoch: 0, train_loss: 1.3401, test_loss: 1.2549, test_f1: 0.2394
 epoch: 1, train_loss: 1.2552, test_loss: 1.2059, test_f1: 0.3338
 epoch: 2, train_loss: 1.2435, test_loss: 1.1858, test_f1: 0.3724
 epoch: 3, train_loss: 1.2225, test_loss: 1.1673, test_f1: 0.3811
 epoch: 4, train_loss: 1.2033, test_loss: 1.1567, test_f1: 0.3774
 epoch: 5, train_loss: 1.1930, test_loss: 1.1457, test_f1: 0.3991
 epoch: 6, train_loss: 1.1785, test_loss: 1.1288, test_f1: 0.3988
 epoch: 7, train_loss: 1.1657, test_loss: 1.1201, test_f1: 0.4056
 epoch: 8, train_loss: 1.1575, test_loss: 1.1099, test_f1: 0.4484
 epoch: 9, train_loss: 1.1567, test_loss: 1.0978, test_f1: 0.4215
 epoch: 10, train_loss: 1.1468, test_loss: 1.0901, test_f1: 0.4334
 epoch: 11, train_loss: 1.1351, test_loss: 1.0808, test_f1: 0.4443
 epoch: 12, train_loss: 1.1223, test_loss: 1.0721, test_f1: 0.4326
 epoch: 13, train_loss: 1.1172, test_loss: 1.0662, test_f1: 0.4379
 epoch: 14, train_loss: 1.1073, test_loss: 1.0596, test_f1: 0.4518
 epoch: 15, train_loss: 1.0967, test_loss: 1.0596, test_f1: 0.4430
 epoch: 16, train_loss: 1.0847, test_loss: 1.0435, test_f1: 0.4417
 epoch: 17, train_loss: 1.0862, test_loss: 1.0416, test_f1: 0.4639
 epoch: 18, train_loss: 1.0688, test_loss: 1.0296, test_f1: 0.4666
 epoch: 19, train_loss: 1.0691, test_loss: 1.0264, test_f1: 0.4508
 epoch: 20, train_loss: 1.0636, test_loss: 1.0277, test_f1: 0.4518
 epoch: 21, train_loss: 1.0528, test_loss: 1.0231, test_f1: 0.4499
 epoch: 22, train_loss: 1.0588, test_loss: 1.0062, test_f1: 0.4621
 epoch: 23, train_loss: 1.0426, test_loss: 1.0004, test_f1: 0.4598
 epoch: 24, train_loss: 1.0385, test_loss: 0.9942, test_f1: 0.4724
 epoch: 25, train_loss: 1.0424, test_loss: 0.9884, test_f1: 0.4762
 epoch: 26, train_loss: 1.0334, test_loss: 0.9821, test_f1: 0.4724
 epoch: 27, train_loss: 1.0193, test_loss: 0.9772, test_f1: 0.4752
 epoch: 28, train_loss: 1.0241, test_loss: 0.9736, test_f1: 0.4796
 epoch: 29, train_loss: 1.0134, test_loss: 0.9755, test_f1: 0.4743
 epoch: 30, train_loss: 1.0108, test_loss: 0.9740, test_f1: 0.4691
 epoch: 31, train_loss: 0.9925, test_loss: 0.9698, test_f1: 0.4738
 epoch: 32, train_loss: 0.9893, test_loss: 0.9646, test_f1: 0.4792
 epoch: 33, train_loss: 0.9878, test_loss: 0.9545, test_f1: 0.4771
 epoch: 34, train_loss: 0.9832, test_loss: 0.9597, test_f1: 0.4862
 epoch: 35, train_loss: 0.9772, test_loss: 0.9492, test_f1: 0.4830
 epoch: 36, train_loss: 0.9768, test_loss: 0.9535, test_f1: 0.4803
 epoch: 37, train_loss: 0.9806, test_loss: 0.9486, test_f1: 0.4700
 epoch: 38, train_loss: 0.9707, test_loss: 0.9489, test_f1: 0.4733
 epoch: 39, train_loss: 0.9633, test_loss: 0.9369, test_f1: 0.4663
 epoch: 40, train_loss: 0.9632, test_loss: 0.9431, test_f1: 0.4844
 epoch: 41, train_loss: 0.9600, test_loss: 0.9469, test_f1: 0.4597
 epoch: 42, train_loss: 0.9510, test_loss: 0.9365, test_f1: 0.4854
 epoch: 43, train_loss: 0.9598, test_loss: 0.9406, test_f1: 0.4731
 epoch: 44, train_loss: 0.9495, test_loss: 0.9271, test_f1: 0.4811
 epoch: 45, train_loss: 0.9429, test_loss: 0.9269, test_f1: 0.4813
 epoch: 46, train_loss: 0.9427, test_loss: 0.9303, test_f1: 0.4871
 epoch: 47, train_loss: 0.9387, test_loss: 0.9271, test_f1: 0.4861
 epoch: 48, train_loss: 0.9295, test_loss: 0.9223, test_f1: 0.4865
 epoch: 49, train_loss: 0.9233, test_loss: 0.9195, test_f1: 0.5021
 epoch: 50, train_loss: 0.9349, test_loss: 0.9347, test_f1: 0.4538
 epoch: 51, train_loss: 0.9204, test_loss: 0.9291, test_f1: 0.4936
 epoch: 52, train_loss: 0.9260, test_loss: 0.9278, test_f1: 0.4957
 epoch: 53, train_loss: 0.9177, test_loss: 0.9174, test_f1: 0.5173
 epoch: 54, train_loss: 0.9242, test_loss: 0.9238, test_f1: 0.5101
 epoch: 55, train_loss: 0.9080, test_loss: 0.9210, test_f1: 0.5025
 epoch: 56, train_loss: 0.9126, test_loss: 0.9283, test_f1: 0.5123
 epoch: 57, train_loss: 0.9108, test_loss: 0.9279, test_f1: 0.5027
 epoch: 58, train_loss: 0.9149, test_loss: 0.9299, test_f1: 0.4973
 epoch: 59, train_loss: 0.9016, test_loss: 0.9261, test_f1: 0.5007
 epoch: 60, train_loss: 0.9060, test_loss: 0.9322, test_f1: 0.4890
 epoch: 61, train_loss: 0.9018, test_loss: 0.9305, test_f1: 0.4902
 epoch: 62, train_loss: 0.9109, test_loss: 0.9342, test_f1: 0.4830
 epoch: 63, train_loss: 0.9026, test_loss: 0.9360, test_f1: 0.4983
 epoch: 64, train_loss: 0.9007, test_loss: 0.9340, test_f1: 0.4831
 epoch: 65, train_loss: 0.9040, test_loss: 0.9282, test_f1: 0.5056
 epoch: 66, train_loss: 0.8923, test_loss: 0.9403, test_f1: 0.4957
 epoch: 67, train_loss: 0.8988, test_loss: 0.9303, test_f1: 0.4923
 epoch: 68, train_loss: 0.8896, test_loss: 0.9274, test_f1: 0.4967
 epoch: 69, train_loss: 0.9006, test_loss: 0.9361, test_f1: 0.4948
 epoch: 70, train_loss: 0.8874, test_loss: 0.9197, test_f1: 0.5026
 epoch: 71, train_loss: 0.8936, test_loss: 0.9321, test_f1: 0.4835
 epoch: 72, train_loss: 0.8862, test_loss: 0.9295, test_f1: 0.4984
 epoch: 73, train_loss: 0.8852, test_loss: 0.9249, test_f1: 0.4976
 epoch: 74, train_loss: 0.8903, test_loss: 0.9354, test_f1: 0.4802
 epoch: 75, train_loss: 0.8839, test_loss: 0.9325, test_f1: 0.5026
 epoch: 76, train_loss: 0.8771, test_loss: 0.9219, test_f1: 0.5043
 epoch: 77, train_loss: 0.8834, test_loss: 0.9281, test_f1: 0.4993
 epoch: 78, train_loss: 0.8837, test_loss: 0.9277, test_f1: 0.4973
 epoch: 79, train_loss: 0.8823, test_loss: 0.9332, test_f1: 0.4951
 epoch: 80, train_loss: 0.8808, test_loss: 0.9492, test_f1: 0.4906
 epoch: 81, train_loss: 0.8765, test_loss: 0.9467, test_f1: 0.4996
 epoch: 82, train_loss: 0.8821, test_loss: 0.9349, test_f1: 0.5024
 epoch: 83, train_loss: 0.8661, test_loss: 0.9465, test_f1: 0.5054
 epoch: 84, train_loss: 0.8572, test_loss: 0.9404, test_f1: 0.4936
 epoch: 85, train_loss: 0.8638, test_loss: 0.9575, test_f1: 0.5064
 epoch: 86, train_loss: 0.8680, test_loss: 0.9398, test_f1: 0.4951
 epoch: 87, train_loss: 0.8665, test_loss: 0.9370, test_f1: 0.4979
 epoch: 88, train_loss: 0.8587, test_loss: 0.9468, test_f1: 0.4982
 epoch: 89, train_loss: 0.8701, test_loss: 0.9377, test_f1: 0.4814
 epoch: 90, train_loss: 0.8662, test_loss: 0.9521, test_f1: 0.4951
 epoch: 91, train_loss: 0.8579, test_loss: 0.9542, test_f1: 0.4994
 epoch: 92, train_loss: 0.8632, test_loss: 0.9565, test_f1: 0.4899
 epoch: 93, train_loss: 0.8590, test_loss: 0.9523, test_f1: 0.4957
 epoch: 94, train_loss: 0.8565, test_loss: 0.9329, test_f1: 0.4957
 epoch: 95, train_loss: 0.8516, test_loss: 0.9567, test_f1: 0.4915
 epoch: 96, train_loss: 0.8512, test_loss: 0.9494, test_f1: 0.5053
 epoch: 97, train_loss: 0.8581, test_loss: 0.9411, test_f1: 0.4935
 epoch: 98, train_loss: 0.8584, test_loss: 0.9638, test_f1: 0.5038
 epoch: 99, train_loss: 0.8501, test_loss: 0.9626, test_f1: 0.4998
##################ITERATION #5 ****************************************
 epoch: 0, train_loss: 1.3592, test_loss: 1.2619, test_f1: 0.3138
 epoch: 1, train_loss: 1.2676, test_loss: 1.2152, test_f1: 0.3662
 epoch: 2, train_loss: 1.2387, test_loss: 1.1876, test_f1: 0.3812
 epoch: 3, train_loss: 1.2198, test_loss: 1.1669, test_f1: 0.3880
 epoch: 4, train_loss: 1.2072, test_loss: 1.1451, test_f1: 0.4021
 epoch: 5, train_loss: 1.1926, test_loss: 1.1275, test_f1: 0.4246
 epoch: 6, train_loss: 1.1644, test_loss: 1.1121, test_f1: 0.4434
 epoch: 7, train_loss: 1.1539, test_loss: 1.0937, test_f1: 0.4602
 epoch: 8, train_loss: 1.1407, test_loss: 1.0787, test_f1: 0.4702
 epoch: 9, train_loss: 1.1335, test_loss: 1.0694, test_f1: 0.4693
 epoch: 10, train_loss: 1.1148, test_loss: 1.0545, test_f1: 0.4677
 epoch: 11, train_loss: 1.1078, test_loss: 1.0490, test_f1: 0.4658
 epoch: 12, train_loss: 1.0999, test_loss: 1.0385, test_f1: 0.4552
 epoch: 13, train_loss: 1.0787, test_loss: 1.0287, test_f1: 0.4691
 epoch: 14, train_loss: 1.0817, test_loss: 1.0228, test_f1: 0.4689
 epoch: 15, train_loss: 1.0727, test_loss: 1.0123, test_f1: 0.4605
 epoch: 16, train_loss: 1.0622, test_loss: 1.0129, test_f1: 0.4604
 epoch: 17, train_loss: 1.0526, test_loss: 1.0163, test_f1: 0.4552
 epoch: 18, train_loss: 1.0466, test_loss: 1.0042, test_f1: 0.4569
 epoch: 19, train_loss: 1.0435, test_loss: 1.0034, test_f1: 0.4556
 epoch: 20, train_loss: 1.0221, test_loss: 1.0064, test_f1: 0.4618
 epoch: 21, train_loss: 1.0236, test_loss: 0.9955, test_f1: 0.4702
 epoch: 22, train_loss: 1.0203, test_loss: 0.9835, test_f1: 0.4614
 epoch: 23, train_loss: 1.0143, test_loss: 0.9929, test_f1: 0.4634
 epoch: 24, train_loss: 1.0092, test_loss: 0.9918, test_f1: 0.4587
 epoch: 25, train_loss: 0.9976, test_loss: 0.9753, test_f1: 0.4693
 epoch: 26, train_loss: 0.9904, test_loss: 0.9734, test_f1: 0.4712
 epoch: 27, train_loss: 0.9861, test_loss: 0.9744, test_f1: 0.4626
 epoch: 28, train_loss: 0.9853, test_loss: 0.9596, test_f1: 0.4801
 epoch: 29, train_loss: 0.9844, test_loss: 0.9637, test_f1: 0.4731
 epoch: 30, train_loss: 0.9790, test_loss: 0.9704, test_f1: 0.4721
 epoch: 31, train_loss: 0.9737, test_loss: 0.9612, test_f1: 0.4718
 epoch: 32, train_loss: 0.9711, test_loss: 0.9592, test_f1: 0.4511
 epoch: 33, train_loss: 0.9691, test_loss: 0.9839, test_f1: 0.4759
 epoch: 34, train_loss: 0.9530, test_loss: 0.9415, test_f1: 0.4847
 epoch: 35, train_loss: 0.9534, test_loss: 0.9595, test_f1: 0.4819
 epoch: 36, train_loss: 0.9633, test_loss: 0.9424, test_f1: 0.4914
 epoch: 37, train_loss: 0.9487, test_loss: 0.9456, test_f1: 0.4954
 epoch: 38, train_loss: 0.9500, test_loss: 0.9488, test_f1: 0.4930
 epoch: 39, train_loss: 0.9385, test_loss: 0.9477, test_f1: 0.4922
 epoch: 40, train_loss: 0.9403, test_loss: 0.9515, test_f1: 0.4826
 epoch: 41, train_loss: 0.9331, test_loss: 0.9490, test_f1: 0.4976
 epoch: 42, train_loss: 0.9333, test_loss: 0.9451, test_f1: 0.4997
 epoch: 43, train_loss: 0.9199, test_loss: 0.9524, test_f1: 0.4927
 epoch: 44, train_loss: 0.9207, test_loss: 0.9283, test_f1: 0.5129
 epoch: 45, train_loss: 0.9176, test_loss: 0.9483, test_f1: 0.4899
 epoch: 46, train_loss: 0.9214, test_loss: 0.9524, test_f1: 0.4885
 epoch: 47, train_loss: 0.9190, test_loss: 0.9277, test_f1: 0.5030
 epoch: 48, train_loss: 0.9119, test_loss: 0.9389, test_f1: 0.4898
 epoch: 49, train_loss: 0.9110, test_loss: 0.9420, test_f1: 0.4881
 epoch: 50, train_loss: 0.9085, test_loss: 0.9490, test_f1: 0.4949
 epoch: 51, train_loss: 0.9002, test_loss: 0.9511, test_f1: 0.4849
 epoch: 52, train_loss: 0.8954, test_loss: 0.9449, test_f1: 0.4852
 epoch: 53, train_loss: 0.8873, test_loss: 0.9499, test_f1: 0.4888
 epoch: 54, train_loss: 0.8919, test_loss: 0.9550, test_f1: 0.4917
 epoch: 55, train_loss: 0.8899, test_loss: 0.9406, test_f1: 0.4912
 epoch: 56, train_loss: 0.8824, test_loss: 0.9640, test_f1: 0.4875
 epoch: 57, train_loss: 0.8938, test_loss: 0.9417, test_f1: 0.5016
 epoch: 58, train_loss: 0.8812, test_loss: 0.9487, test_f1: 0.4873
 epoch: 59, train_loss: 0.8857, test_loss: 0.9521, test_f1: 0.4820
 epoch: 60, train_loss: 0.8769, test_loss: 0.9519, test_f1: 0.4810
 epoch: 61, train_loss: 0.8908, test_loss: 0.9533, test_f1: 0.4896
 epoch: 62, train_loss: 0.8759, test_loss: 0.9379, test_f1: 0.4909
 epoch: 63, train_loss: 0.8804, test_loss: 0.9674, test_f1: 0.4943
 epoch: 64, train_loss: 0.8722, test_loss: 0.9363, test_f1: 0.4982
 epoch: 65, train_loss: 0.8754, test_loss: 0.9474, test_f1: 0.4902
 epoch: 66, train_loss: 0.8734, test_loss: 0.9437, test_f1: 0.4965
 epoch: 67, train_loss: 0.8750, test_loss: 0.9488, test_f1: 0.4879
 epoch: 68, train_loss: 0.8694, test_loss: 0.9575, test_f1: 0.4929
 epoch: 69, train_loss: 0.8662, test_loss: 0.9594, test_f1: 0.4956
 epoch: 70, train_loss: 0.8700, test_loss: 0.9623, test_f1: 0.4893
 epoch: 71, train_loss: 0.8724, test_loss: 0.9540, test_f1: 0.4991
 epoch: 72, train_loss: 0.8714, test_loss: 0.9578, test_f1: 0.4996
 epoch: 73, train_loss: 0.8668, test_loss: 0.9594, test_f1: 0.4897
 epoch: 74, train_loss: 0.8649, test_loss: 0.9601, test_f1: 0.4948
 epoch: 75, train_loss: 0.8592, test_loss: 0.9421, test_f1: 0.5001
 epoch: 76, train_loss: 0.8518, test_loss: 0.9539, test_f1: 0.4970
 epoch: 77, train_loss: 0.8566, test_loss: 0.9628, test_f1: 0.4976
 epoch: 78, train_loss: 0.8556, test_loss: 0.9641, test_f1: 0.4969
 epoch: 79, train_loss: 0.8584, test_loss: 0.9779, test_f1: 0.4888
 epoch: 80, train_loss: 0.8488, test_loss: 0.9653, test_f1: 0.5027
 epoch: 81, train_loss: 0.8585, test_loss: 0.9602, test_f1: 0.5037
 epoch: 82, train_loss: 0.8534, test_loss: 0.9503, test_f1: 0.4993
 epoch: 83, train_loss: 0.8505, test_loss: 0.9553, test_f1: 0.5035
 epoch: 84, train_loss: 0.8450, test_loss: 0.9505, test_f1: 0.5074
 epoch: 85, train_loss: 0.8545, test_loss: 0.9645, test_f1: 0.5089
 epoch: 86, train_loss: 0.8480, test_loss: 0.9520, test_f1: 0.4978
 epoch: 87, train_loss: 0.8524, test_loss: 0.9618, test_f1: 0.5056
 epoch: 88, train_loss: 0.8416, test_loss: 0.9605, test_f1: 0.5094
 epoch: 89, train_loss: 0.8434, test_loss: 0.9627, test_f1: 0.5011
 epoch: 90, train_loss: 0.8443, test_loss: 0.9779, test_f1: 0.5040
 epoch: 91, train_loss: 0.8420, test_loss: 0.9739, test_f1: 0.4977
 epoch: 92, train_loss: 0.8410, test_loss: 0.9646, test_f1: 0.5009
 epoch: 93, train_loss: 0.8373, test_loss: 0.9611, test_f1: 0.5085
 epoch: 94, train_loss: 0.8354, test_loss: 0.9945, test_f1: 0.5059
 epoch: 95, train_loss: 0.8477, test_loss: 0.9550, test_f1: 0.5031
 epoch: 96, train_loss: 0.8384, test_loss: 0.9767, test_f1: 0.5185
 epoch: 97, train_loss: 0.8286, test_loss: 0.9604, test_f1: 0.5011
 epoch: 98, train_loss: 0.8411, test_loss: 0.9713, test_f1: 0.5112
 epoch: 99, train_loss: 0.8231, test_loss: 1.0002, test_f1: 0.5025
##################ITERATION #6 ****************************************
 epoch: 0, train_loss: 1.3382, test_loss: 1.2479, test_f1: 0.3092
 epoch: 1, train_loss: 1.2574, test_loss: 1.2099, test_f1: 0.4113
 epoch: 2, train_loss: 1.2327, test_loss: 1.1951, test_f1: 0.4089
 epoch: 3, train_loss: 1.2151, test_loss: 1.1744, test_f1: 0.4222
 epoch: 4, train_loss: 1.1971, test_loss: 1.1595, test_f1: 0.4359
 epoch: 5, train_loss: 1.1930, test_loss: 1.1444, test_f1: 0.4527
 epoch: 6, train_loss: 1.1699, test_loss: 1.1363, test_f1: 0.4561
 epoch: 7, train_loss: 1.1606, test_loss: 1.1188, test_f1: 0.4556
 epoch: 8, train_loss: 1.1515, test_loss: 1.1064, test_f1: 0.4685
 epoch: 9, train_loss: 1.1404, test_loss: 1.1124, test_f1: 0.4429
 epoch: 10, train_loss: 1.1300, test_loss: 1.0870, test_f1: 0.4700
 epoch: 11, train_loss: 1.1186, test_loss: 1.0856, test_f1: 0.4516
 epoch: 12, train_loss: 1.1167, test_loss: 1.0809, test_f1: 0.4599
 epoch: 13, train_loss: 1.1065, test_loss: 1.0727, test_f1: 0.4564
 epoch: 14, train_loss: 1.1045, test_loss: 1.0630, test_f1: 0.4637
 epoch: 15, train_loss: 1.0935, test_loss: 1.0466, test_f1: 0.4645
 epoch: 16, train_loss: 1.0877, test_loss: 1.0439, test_f1: 0.4785
 epoch: 17, train_loss: 1.0697, test_loss: 1.0335, test_f1: 0.4763
 epoch: 18, train_loss: 1.0679, test_loss: 1.0254, test_f1: 0.4819
 epoch: 19, train_loss: 1.0577, test_loss: 1.0284, test_f1: 0.4715
 epoch: 20, train_loss: 1.0492, test_loss: 1.0199, test_f1: 0.4763
 epoch: 21, train_loss: 1.0524, test_loss: 1.0205, test_f1: 0.4849
 epoch: 22, train_loss: 1.0401, test_loss: 1.0098, test_f1: 0.4637
 epoch: 23, train_loss: 1.0398, test_loss: 1.0100, test_f1: 0.4840
 epoch: 24, train_loss: 1.0432, test_loss: 0.9968, test_f1: 0.4915
 epoch: 25, train_loss: 1.0300, test_loss: 1.0096, test_f1: 0.4640
 epoch: 26, train_loss: 1.0215, test_loss: 0.9934, test_f1: 0.4985
 epoch: 27, train_loss: 1.0261, test_loss: 0.9933, test_f1: 0.4871
 epoch: 28, train_loss: 1.0227, test_loss: 0.9941, test_f1: 0.4785
 epoch: 29, train_loss: 1.0089, test_loss: 0.9894, test_f1: 0.4796
 epoch: 30, train_loss: 1.0113, test_loss: 0.9857, test_f1: 0.4873
 epoch: 31, train_loss: 1.0032, test_loss: 0.9893, test_f1: 0.4760
 epoch: 32, train_loss: 0.9980, test_loss: 0.9874, test_f1: 0.4773
 epoch: 33, train_loss: 0.9949, test_loss: 0.9774, test_f1: 0.4892
 epoch: 34, train_loss: 0.9966, test_loss: 0.9785, test_f1: 0.4709
 epoch: 35, train_loss: 0.9895, test_loss: 0.9824, test_f1: 0.4880
 epoch: 36, train_loss: 0.9859, test_loss: 0.9699, test_f1: 0.4995
 epoch: 37, train_loss: 0.9808, test_loss: 0.9633, test_f1: 0.4846
 epoch: 38, train_loss: 0.9758, test_loss: 0.9724, test_f1: 0.4918
 epoch: 39, train_loss: 0.9723, test_loss: 0.9548, test_f1: 0.4930
 epoch: 40, train_loss: 0.9612, test_loss: 0.9779, test_f1: 0.4618
 epoch: 41, train_loss: 0.9659, test_loss: 0.9670, test_f1: 0.4822
 epoch: 42, train_loss: 0.9620, test_loss: 0.9613, test_f1: 0.4906
 epoch: 43, train_loss: 0.9552, test_loss: 0.9603, test_f1: 0.5040
 epoch: 44, train_loss: 0.9562, test_loss: 0.9616, test_f1: 0.4989
 epoch: 45, train_loss: 0.9404, test_loss: 0.9610, test_f1: 0.5016
 epoch: 46, train_loss: 0.9443, test_loss: 0.9591, test_f1: 0.4911
 epoch: 47, train_loss: 0.9408, test_loss: 0.9498, test_f1: 0.5019
 epoch: 48, train_loss: 0.9359, test_loss: 0.9457, test_f1: 0.4895
 epoch: 49, train_loss: 0.9347, test_loss: 0.9652, test_f1: 0.4917
 epoch: 50, train_loss: 0.9437, test_loss: 0.9545, test_f1: 0.4945
 epoch: 51, train_loss: 0.9294, test_loss: 0.9557, test_f1: 0.5040
 epoch: 52, train_loss: 0.9074, test_loss: 0.9568, test_f1: 0.4972
 epoch: 53, train_loss: 0.9238, test_loss: 0.9481, test_f1: 0.4953
 epoch: 54, train_loss: 0.9212, test_loss: 0.9664, test_f1: 0.5082
 epoch: 55, train_loss: 0.9256, test_loss: 0.9552, test_f1: 0.5102
 epoch: 56, train_loss: 0.9277, test_loss: 0.9700, test_f1: 0.4879
 epoch: 57, train_loss: 0.9160, test_loss: 0.9629, test_f1: 0.4970
 epoch: 58, train_loss: 0.9136, test_loss: 0.9481, test_f1: 0.5055
 epoch: 59, train_loss: 0.8979, test_loss: 0.9511, test_f1: 0.5113
 epoch: 60, train_loss: 0.9140, test_loss: 0.9553, test_f1: 0.4980
 epoch: 61, train_loss: 0.9128, test_loss: 0.9467, test_f1: 0.5048
 epoch: 62, train_loss: 0.9107, test_loss: 0.9561, test_f1: 0.4945
 epoch: 63, train_loss: 0.9004, test_loss: 0.9648, test_f1: 0.5017
 epoch: 64, train_loss: 0.8988, test_loss: 0.9490, test_f1: 0.5011
 epoch: 65, train_loss: 0.9075, test_loss: 0.9597, test_f1: 0.4954
 epoch: 66, train_loss: 0.9091, test_loss: 0.9504, test_f1: 0.5115
 epoch: 67, train_loss: 0.9158, test_loss: 0.9649, test_f1: 0.5038
 epoch: 68, train_loss: 0.9062, test_loss: 0.9482, test_f1: 0.5217
 epoch: 69, train_loss: 0.9033, test_loss: 0.9635, test_f1: 0.5045
 epoch: 70, train_loss: 0.8910, test_loss: 0.9611, test_f1: 0.4791
 epoch: 71, train_loss: 0.9015, test_loss: 0.9544, test_f1: 0.5038
 epoch: 72, train_loss: 0.8895, test_loss: 0.9590, test_f1: 0.5135
 epoch: 73, train_loss: 0.8884, test_loss: 0.9594, test_f1: 0.5068
 epoch: 74, train_loss: 0.8862, test_loss: 0.9816, test_f1: 0.4744
 epoch: 75, train_loss: 0.8943, test_loss: 0.9598, test_f1: 0.5036
 epoch: 76, train_loss: 0.8811, test_loss: 0.9643, test_f1: 0.4999
 epoch: 77, train_loss: 0.8810, test_loss: 0.9628, test_f1: 0.5054
 epoch: 78, train_loss: 0.8920, test_loss: 0.9685, test_f1: 0.4706
 epoch: 79, train_loss: 0.8813, test_loss: 0.9548, test_f1: 0.5124
 epoch: 80, train_loss: 0.8735, test_loss: 0.9595, test_f1: 0.5108
 epoch: 81, train_loss: 0.8851, test_loss: 0.9794, test_f1: 0.4755
 epoch: 82, train_loss: 0.8806, test_loss: 0.9566, test_f1: 0.4831
 epoch: 83, train_loss: 0.8796, test_loss: 0.9673, test_f1: 0.4851
 epoch: 84, train_loss: 0.8811, test_loss: 0.9732, test_f1: 0.4864
 epoch: 85, train_loss: 0.8736, test_loss: 0.9586, test_f1: 0.5166
 epoch: 86, train_loss: 0.8743, test_loss: 0.9664, test_f1: 0.4883
 epoch: 87, train_loss: 0.8772, test_loss: 0.9641, test_f1: 0.4961
 epoch: 88, train_loss: 0.8763, test_loss: 0.9535, test_f1: 0.5174
 epoch: 89, train_loss: 0.8775, test_loss: 0.9618, test_f1: 0.5003
 epoch: 90, train_loss: 0.8775, test_loss: 0.9913, test_f1: 0.4867
 epoch: 91, train_loss: 0.8760, test_loss: 0.9864, test_f1: 0.4823
 epoch: 92, train_loss: 0.8696, test_loss: 0.9766, test_f1: 0.4796
 epoch: 93, train_loss: 0.8674, test_loss: 0.9633, test_f1: 0.5095
 epoch: 94, train_loss: 0.8803, test_loss: 0.9695, test_f1: 0.4848
 epoch: 95, train_loss: 0.8523, test_loss: 0.9797, test_f1: 0.4899
 epoch: 96, train_loss: 0.8734, test_loss: 0.9696, test_f1: 0.4973
 epoch: 97, train_loss: 0.8747, test_loss: 0.9755, test_f1: 0.4879
 epoch: 98, train_loss: 0.8662, test_loss: 1.0075, test_f1: 0.4792
 epoch: 99, train_loss: 0.8580, test_loss: 0.9684, test_f1: 0.5111
##################ITERATION #7 ****************************************
 epoch: 0, train_loss: 1.3309, test_loss: 1.2424, test_f1: 0.2970
 epoch: 1, train_loss: 1.2593, test_loss: 1.1644, test_f1: 0.4342
 epoch: 2, train_loss: 1.2224, test_loss: 1.1459, test_f1: 0.4409
 epoch: 3, train_loss: 1.1996, test_loss: 1.1289, test_f1: 0.4513
 epoch: 4, train_loss: 1.1945, test_loss: 1.1103, test_f1: 0.4623
 epoch: 5, train_loss: 1.1771, test_loss: 1.0949, test_f1: 0.4643
 epoch: 6, train_loss: 1.1655, test_loss: 1.0878, test_f1: 0.4548
 epoch: 7, train_loss: 1.1379, test_loss: 1.0729, test_f1: 0.4678
 epoch: 8, train_loss: 1.1252, test_loss: 1.0642, test_f1: 0.4739
 epoch: 9, train_loss: 1.1226, test_loss: 1.0545, test_f1: 0.4715
 epoch: 10, train_loss: 1.1091, test_loss: 1.0464, test_f1: 0.4650
 epoch: 11, train_loss: 1.0876, test_loss: 1.0382, test_f1: 0.4845
 epoch: 12, train_loss: 1.0901, test_loss: 1.0290, test_f1: 0.4794
 epoch: 13, train_loss: 1.0907, test_loss: 1.0197, test_f1: 0.4992
 epoch: 14, train_loss: 1.0741, test_loss: 1.0090, test_f1: 0.4942
 epoch: 15, train_loss: 1.0731, test_loss: 1.0069, test_f1: 0.4911
 epoch: 16, train_loss: 1.0538, test_loss: 1.0045, test_f1: 0.4856
 epoch: 17, train_loss: 1.0580, test_loss: 0.9964, test_f1: 0.4808
 epoch: 18, train_loss: 1.0402, test_loss: 0.9919, test_f1: 0.4734
 epoch: 19, train_loss: 1.0496, test_loss: 0.9887, test_f1: 0.4797
 epoch: 20, train_loss: 1.0505, test_loss: 0.9802, test_f1: 0.4860
 epoch: 21, train_loss: 1.0254, test_loss: 0.9762, test_f1: 0.4975
 epoch: 22, train_loss: 1.0301, test_loss: 0.9729, test_f1: 0.4841
 epoch: 23, train_loss: 1.0294, test_loss: 0.9708, test_f1: 0.4847
 epoch: 24, train_loss: 1.0122, test_loss: 0.9690, test_f1: 0.4814
 epoch: 25, train_loss: 1.0123, test_loss: 0.9576, test_f1: 0.4907
 epoch: 26, train_loss: 1.0004, test_loss: 0.9543, test_f1: 0.4804
 epoch: 27, train_loss: 1.0026, test_loss: 0.9547, test_f1: 0.4792
 epoch: 28, train_loss: 1.0025, test_loss: 0.9529, test_f1: 0.4801
 epoch: 29, train_loss: 0.9919, test_loss: 0.9537, test_f1: 0.4731
 epoch: 30, train_loss: 0.9875, test_loss: 0.9462, test_f1: 0.4855
 epoch: 31, train_loss: 0.9850, test_loss: 0.9454, test_f1: 0.4784
 epoch: 32, train_loss: 0.9892, test_loss: 0.9466, test_f1: 0.4715
 epoch: 33, train_loss: 0.9836, test_loss: 0.9431, test_f1: 0.4736
 epoch: 34, train_loss: 0.9789, test_loss: 0.9437, test_f1: 0.4796
 epoch: 35, train_loss: 0.9904, test_loss: 0.9383, test_f1: 0.4801
 epoch: 36, train_loss: 0.9732, test_loss: 0.9336, test_f1: 0.4775
 epoch: 37, train_loss: 0.9729, test_loss: 0.9409, test_f1: 0.4884
 epoch: 38, train_loss: 0.9656, test_loss: 0.9310, test_f1: 0.4862
 epoch: 39, train_loss: 0.9628, test_loss: 0.9265, test_f1: 0.4910
 epoch: 40, train_loss: 0.9586, test_loss: 0.9298, test_f1: 0.4911
 epoch: 41, train_loss: 0.9640, test_loss: 0.9338, test_f1: 0.4940
 epoch: 42, train_loss: 0.9513, test_loss: 0.9283, test_f1: 0.4972
 epoch: 43, train_loss: 0.9443, test_loss: 0.9364, test_f1: 0.4918
 epoch: 44, train_loss: 0.9446, test_loss: 0.9272, test_f1: 0.5043
 epoch: 45, train_loss: 0.9395, test_loss: 0.9262, test_f1: 0.5012
 epoch: 46, train_loss: 0.9393, test_loss: 0.9316, test_f1: 0.4979
 epoch: 47, train_loss: 0.9343, test_loss: 0.9373, test_f1: 0.5095
 epoch: 48, train_loss: 0.9239, test_loss: 0.9224, test_f1: 0.4978
 epoch: 49, train_loss: 0.9270, test_loss: 0.9232, test_f1: 0.4984
 epoch: 50, train_loss: 0.9229, test_loss: 0.9248, test_f1: 0.4964
 epoch: 51, train_loss: 0.9255, test_loss: 0.9244, test_f1: 0.4991
 epoch: 52, train_loss: 0.9235, test_loss: 0.9281, test_f1: 0.4941
 epoch: 53, train_loss: 0.9130, test_loss: 0.9216, test_f1: 0.5062
 epoch: 54, train_loss: 0.9240, test_loss: 0.9212, test_f1: 0.4899
 epoch: 55, train_loss: 0.9117, test_loss: 0.9213, test_f1: 0.4960
 epoch: 56, train_loss: 0.9109, test_loss: 0.9172, test_f1: 0.5043
 epoch: 57, train_loss: 0.9066, test_loss: 0.9288, test_f1: 0.4932
 epoch: 58, train_loss: 0.9061, test_loss: 0.9212, test_f1: 0.4974
 epoch: 59, train_loss: 0.9069, test_loss: 0.9330, test_f1: 0.4931
 epoch: 60, train_loss: 0.9128, test_loss: 0.9251, test_f1: 0.4934
 epoch: 61, train_loss: 0.9068, test_loss: 0.9249, test_f1: 0.5049
 epoch: 62, train_loss: 0.8950, test_loss: 0.9266, test_f1: 0.5222
 epoch: 63, train_loss: 0.9057, test_loss: 0.9241, test_f1: 0.5270
 epoch: 64, train_loss: 0.9112, test_loss: 0.9224, test_f1: 0.4949
 epoch: 65, train_loss: 0.8958, test_loss: 0.9203, test_f1: 0.4906
 epoch: 66, train_loss: 0.9009, test_loss: 0.9255, test_f1: 0.5116
 epoch: 67, train_loss: 0.8906, test_loss: 0.9256, test_f1: 0.4990
 epoch: 68, train_loss: 0.9036, test_loss: 0.9291, test_f1: 0.5044
 epoch: 69, train_loss: 0.8920, test_loss: 0.9212, test_f1: 0.5076
 epoch: 70, train_loss: 0.8884, test_loss: 0.9137, test_f1: 0.5009
 epoch: 71, train_loss: 0.8978, test_loss: 0.9219, test_f1: 0.4939
 epoch: 72, train_loss: 0.8943, test_loss: 0.9187, test_f1: 0.5083
 epoch: 73, train_loss: 0.9047, test_loss: 0.9296, test_f1: 0.5130
 epoch: 74, train_loss: 0.8879, test_loss: 0.9265, test_f1: 0.5034
 epoch: 75, train_loss: 0.8860, test_loss: 0.9184, test_f1: 0.4979
 epoch: 76, train_loss: 0.8919, test_loss: 0.9192, test_f1: 0.5000
 epoch: 77, train_loss: 0.8945, test_loss: 0.9247, test_f1: 0.5144
 epoch: 78, train_loss: 0.8805, test_loss: 0.9195, test_f1: 0.5167
 epoch: 79, train_loss: 0.8803, test_loss: 0.9163, test_f1: 0.5073
 epoch: 80, train_loss: 0.8777, test_loss: 0.9218, test_f1: 0.5089
 epoch: 81, train_loss: 0.8877, test_loss: 0.9246, test_f1: 0.5066
 epoch: 82, train_loss: 0.8810, test_loss: 0.9254, test_f1: 0.5109
 epoch: 83, train_loss: 0.8717, test_loss: 0.9244, test_f1: 0.5125
 epoch: 84, train_loss: 0.8735, test_loss: 0.9239, test_f1: 0.5299
 epoch: 85, train_loss: 0.8812, test_loss: 0.9230, test_f1: 0.5062
 epoch: 86, train_loss: 0.8721, test_loss: 0.9220, test_f1: 0.5152
 epoch: 87, train_loss: 0.8746, test_loss: 0.9289, test_f1: 0.4908
 epoch: 88, train_loss: 0.8643, test_loss: 0.9201, test_f1: 0.5253
 epoch: 89, train_loss: 0.8715, test_loss: 0.9202, test_f1: 0.5109
 epoch: 90, train_loss: 0.8617, test_loss: 0.9227, test_f1: 0.5100
 epoch: 91, train_loss: 0.8698, test_loss: 0.9301, test_f1: 0.5219
 epoch: 92, train_loss: 0.8662, test_loss: 0.9268, test_f1: 0.5257
 epoch: 93, train_loss: 0.8684, test_loss: 0.9253, test_f1: 0.5185
 epoch: 94, train_loss: 0.8705, test_loss: 0.9223, test_f1: 0.5205
 epoch: 95, train_loss: 0.8628, test_loss: 0.9269, test_f1: 0.5241
 epoch: 96, train_loss: 0.8608, test_loss: 0.9311, test_f1: 0.5285
 epoch: 97, train_loss: 0.8539, test_loss: 0.9311, test_f1: 0.5271
 epoch: 98, train_loss: 0.8607, test_loss: 0.9238, test_f1: 0.5278
 epoch: 99, train_loss: 0.8647, test_loss: 0.9201, test_f1: 0.5222
##################ITERATION #8 ****************************************
 epoch: 0, train_loss: 1.3549, test_loss: 1.2189, test_f1: 0.2530
 epoch: 1, train_loss: 1.2672, test_loss: 1.1635, test_f1: 0.3823
 epoch: 2, train_loss: 1.2488, test_loss: 1.1461, test_f1: 0.3968
 epoch: 3, train_loss: 1.2245, test_loss: 1.1391, test_f1: 0.4168
 epoch: 4, train_loss: 1.2044, test_loss: 1.1211, test_f1: 0.4391
 epoch: 5, train_loss: 1.1979, test_loss: 1.1205, test_f1: 0.4419
 epoch: 6, train_loss: 1.1759, test_loss: 1.1199, test_f1: 0.4555
 epoch: 7, train_loss: 1.1687, test_loss: 1.1141, test_f1: 0.4481
 epoch: 8, train_loss: 1.1660, test_loss: 1.1010, test_f1: 0.4518
 epoch: 9, train_loss: 1.1435, test_loss: 1.1104, test_f1: 0.4482
 epoch: 10, train_loss: 1.1370, test_loss: 1.0998, test_f1: 0.4444
 epoch: 11, train_loss: 1.1333, test_loss: 1.0952, test_f1: 0.4468
 epoch: 12, train_loss: 1.1155, test_loss: 1.0894, test_f1: 0.4637
 epoch: 13, train_loss: 1.1162, test_loss: 1.0796, test_f1: 0.4642
 epoch: 14, train_loss: 1.1102, test_loss: 1.0759, test_f1: 0.4528
 epoch: 15, train_loss: 1.0994, test_loss: 1.0799, test_f1: 0.4502
 epoch: 16, train_loss: 1.0973, test_loss: 1.0612, test_f1: 0.4673
 epoch: 17, train_loss: 1.0852, test_loss: 1.0638, test_f1: 0.4527
 epoch: 18, train_loss: 1.0870, test_loss: 1.0592, test_f1: 0.4583
 epoch: 19, train_loss: 1.0863, test_loss: 1.0631, test_f1: 0.4420
 epoch: 20, train_loss: 1.0762, test_loss: 1.0477, test_f1: 0.4706
 epoch: 21, train_loss: 1.0664, test_loss: 1.0432, test_f1: 0.4697
 epoch: 22, train_loss: 1.0703, test_loss: 1.0402, test_f1: 0.4652
 epoch: 23, train_loss: 1.0678, test_loss: 1.0428, test_f1: 0.4662
 epoch: 24, train_loss: 1.0550, test_loss: 1.0373, test_f1: 0.4596
 epoch: 25, train_loss: 1.0390, test_loss: 1.0372, test_f1: 0.4454
 epoch: 26, train_loss: 1.0437, test_loss: 1.0374, test_f1: 0.4665
 epoch: 27, train_loss: 1.0497, test_loss: 1.0301, test_f1: 0.4731
 epoch: 28, train_loss: 1.0374, test_loss: 1.0276, test_f1: 0.4652
 epoch: 29, train_loss: 1.0247, test_loss: 1.0293, test_f1: 0.4618
 epoch: 30, train_loss: 1.0250, test_loss: 1.0205, test_f1: 0.4710
 epoch: 31, train_loss: 1.0162, test_loss: 1.0154, test_f1: 0.4681
 epoch: 32, train_loss: 1.0170, test_loss: 1.0198, test_f1: 0.4637
 epoch: 33, train_loss: 1.0129, test_loss: 1.0136, test_f1: 0.4667
 epoch: 34, train_loss: 1.0053, test_loss: 1.0082, test_f1: 0.4707
 epoch: 35, train_loss: 1.0048, test_loss: 1.0078, test_f1: 0.4791
 epoch: 36, train_loss: 0.9979, test_loss: 1.0060, test_f1: 0.4645
 epoch: 37, train_loss: 1.0074, test_loss: 1.0056, test_f1: 0.4835
 epoch: 38, train_loss: 1.0001, test_loss: 1.0172, test_f1: 0.4658
 epoch: 39, train_loss: 0.9875, test_loss: 1.0130, test_f1: 0.4651
 epoch: 40, train_loss: 0.9781, test_loss: 1.0124, test_f1: 0.4625
 epoch: 41, train_loss: 0.9810, test_loss: 1.0148, test_f1: 0.4679
 epoch: 42, train_loss: 0.9809, test_loss: 1.0023, test_f1: 0.4580
 epoch: 43, train_loss: 0.9724, test_loss: 1.0044, test_f1: 0.4666
 epoch: 44, train_loss: 0.9686, test_loss: 1.0027, test_f1: 0.4795
 epoch: 45, train_loss: 0.9709, test_loss: 0.9991, test_f1: 0.4808
 epoch: 46, train_loss: 0.9651, test_loss: 1.0023, test_f1: 0.4838
 epoch: 47, train_loss: 0.9630, test_loss: 1.0010, test_f1: 0.4832
 epoch: 48, train_loss: 0.9578, test_loss: 1.0140, test_f1: 0.4867
 epoch: 49, train_loss: 0.9627, test_loss: 0.9977, test_f1: 0.4997
 epoch: 50, train_loss: 0.9359, test_loss: 1.0114, test_f1: 0.4790
 epoch: 51, train_loss: 0.9442, test_loss: 1.0094, test_f1: 0.4872
 epoch: 52, train_loss: 0.9440, test_loss: 1.0017, test_f1: 0.5090
 epoch: 53, train_loss: 0.9557, test_loss: 1.0020, test_f1: 0.5070
 epoch: 54, train_loss: 0.9452, test_loss: 0.9987, test_f1: 0.5001
 epoch: 55, train_loss: 0.9351, test_loss: 1.0148, test_f1: 0.4995
 epoch: 56, train_loss: 0.9375, test_loss: 1.0072, test_f1: 0.4996
 epoch: 57, train_loss: 0.9285, test_loss: 1.0137, test_f1: 0.5154
 epoch: 58, train_loss: 0.9290, test_loss: 1.0069, test_f1: 0.5030
 epoch: 59, train_loss: 0.9350, test_loss: 1.0118, test_f1: 0.5057
 epoch: 60, train_loss: 0.9269, test_loss: 1.0164, test_f1: 0.5082
 epoch: 61, train_loss: 0.9229, test_loss: 1.0218, test_f1: 0.4851
 epoch: 62, train_loss: 0.9283, test_loss: 1.0071, test_f1: 0.5102
 epoch: 63, train_loss: 0.9170, test_loss: 1.0150, test_f1: 0.5145
 epoch: 64, train_loss: 0.9298, test_loss: 1.0097, test_f1: 0.5152
 epoch: 65, train_loss: 0.9271, test_loss: 1.0080, test_f1: 0.5166
 epoch: 66, train_loss: 0.9111, test_loss: 1.0107, test_f1: 0.5218
 epoch: 67, train_loss: 0.9150, test_loss: 1.0208, test_f1: 0.5077
 epoch: 68, train_loss: 0.9302, test_loss: 1.0169, test_f1: 0.5087
 epoch: 69, train_loss: 0.9147, test_loss: 1.0087, test_f1: 0.5056
 epoch: 70, train_loss: 0.9135, test_loss: 1.0102, test_f1: 0.5180
 epoch: 71, train_loss: 0.9117, test_loss: 1.0204, test_f1: 0.5017
 epoch: 72, train_loss: 0.9128, test_loss: 1.0141, test_f1: 0.5137
 epoch: 73, train_loss: 0.9197, test_loss: 1.0084, test_f1: 0.5068
 epoch: 74, train_loss: 0.9081, test_loss: 1.0064, test_f1: 0.5150
 epoch: 75, train_loss: 0.8979, test_loss: 1.0054, test_f1: 0.5091
 epoch: 76, train_loss: 0.9183, test_loss: 1.0158, test_f1: 0.5091
 epoch: 77, train_loss: 0.9086, test_loss: 1.0034, test_f1: 0.5145
 epoch: 78, train_loss: 0.9003, test_loss: 1.0202, test_f1: 0.5106
 epoch: 79, train_loss: 0.9073, test_loss: 1.0183, test_f1: 0.5021
 epoch: 80, train_loss: 0.9084, test_loss: 1.0214, test_f1: 0.5139
 epoch: 81, train_loss: 0.8926, test_loss: 1.0144, test_f1: 0.5065
 epoch: 82, train_loss: 0.9056, test_loss: 1.0150, test_f1: 0.5070
 epoch: 83, train_loss: 0.8936, test_loss: 1.0192, test_f1: 0.5082
 epoch: 84, train_loss: 0.8942, test_loss: 1.0071, test_f1: 0.5075
 epoch: 85, train_loss: 0.8952, test_loss: 1.0281, test_f1: 0.5073
 epoch: 86, train_loss: 0.8979, test_loss: 1.0135, test_f1: 0.5165
 epoch: 87, train_loss: 0.8986, test_loss: 1.0219, test_f1: 0.4950
 epoch: 88, train_loss: 0.8885, test_loss: 1.0263, test_f1: 0.5115
 epoch: 89, train_loss: 0.8855, test_loss: 1.0301, test_f1: 0.5020
 epoch: 90, train_loss: 0.8929, test_loss: 1.0141, test_f1: 0.5083
 epoch: 91, train_loss: 0.8875, test_loss: 1.0139, test_f1: 0.5183
 epoch: 92, train_loss: 0.8951, test_loss: 1.0267, test_f1: 0.5098
 epoch: 93, train_loss: 0.8766, test_loss: 1.0335, test_f1: 0.5039
 epoch: 94, train_loss: 0.8813, test_loss: 1.0314, test_f1: 0.5122
 epoch: 95, train_loss: 0.8734, test_loss: 1.0311, test_f1: 0.5102
 epoch: 96, train_loss: 0.8909, test_loss: 1.0234, test_f1: 0.5168
 epoch: 97, train_loss: 0.8811, test_loss: 1.0349, test_f1: 0.5133
 epoch: 98, train_loss: 0.8848, test_loss: 1.0346, test_f1: 0.5111
 epoch: 99, train_loss: 0.8656, test_loss: 1.0301, test_f1: 0.5156
##################ITERATION #9 ****************************************
 epoch: 0, train_loss: 1.3787, test_loss: 1.2352, test_f1: 0.3562
 epoch: 1, train_loss: 1.2887, test_loss: 1.1949, test_f1: 0.3930
 epoch: 2, train_loss: 1.2492, test_loss: 1.1707, test_f1: 0.4139
 epoch: 3, train_loss: 1.2339, test_loss: 1.1574, test_f1: 0.4151
 epoch: 4, train_loss: 1.2155, test_loss: 1.1435, test_f1: 0.4177
 epoch: 5, train_loss: 1.1990, test_loss: 1.1271, test_f1: 0.4325
 epoch: 6, train_loss: 1.1750, test_loss: 1.1141, test_f1: 0.4339
 epoch: 7, train_loss: 1.1665, test_loss: 1.1067, test_f1: 0.4343
 epoch: 8, train_loss: 1.1487, test_loss: 1.0894, test_f1: 0.4307
 epoch: 9, train_loss: 1.1437, test_loss: 1.0853, test_f1: 0.4464
 epoch: 10, train_loss: 1.1339, test_loss: 1.0801, test_f1: 0.4230
 epoch: 11, train_loss: 1.1271, test_loss: 1.0677, test_f1: 0.4443
 epoch: 12, train_loss: 1.1148, test_loss: 1.0632, test_f1: 0.4192
 epoch: 13, train_loss: 1.1136, test_loss: 1.0560, test_f1: 0.4331
 epoch: 14, train_loss: 1.0982, test_loss: 1.0585, test_f1: 0.4186
 epoch: 15, train_loss: 1.1057, test_loss: 1.0618, test_f1: 0.4120
 epoch: 16, train_loss: 1.0945, test_loss: 1.0526, test_f1: 0.4295
 epoch: 17, train_loss: 1.0852, test_loss: 1.0362, test_f1: 0.4357
 epoch: 18, train_loss: 1.0847, test_loss: 1.0404, test_f1: 0.4292
 epoch: 19, train_loss: 1.0813, test_loss: 1.0428, test_f1: 0.4209
 epoch: 20, train_loss: 1.0655, test_loss: 1.0313, test_f1: 0.4314
 epoch: 21, train_loss: 1.0565, test_loss: 1.0169, test_f1: 0.4663
 epoch: 22, train_loss: 1.0580, test_loss: 1.0151, test_f1: 0.4669
 epoch: 23, train_loss: 1.0497, test_loss: 1.0045, test_f1: 0.4613
 epoch: 24, train_loss: 1.0448, test_loss: 1.0139, test_f1: 0.4745
 epoch: 25, train_loss: 1.0372, test_loss: 0.9999, test_f1: 0.4636
 epoch: 26, train_loss: 1.0374, test_loss: 1.0009, test_f1: 0.4802
 epoch: 27, train_loss: 1.0217, test_loss: 0.9950, test_f1: 0.4755
 epoch: 28, train_loss: 1.0090, test_loss: 1.0167, test_f1: 0.4684
 epoch: 29, train_loss: 1.0191, test_loss: 0.9975, test_f1: 0.4851
 epoch: 30, train_loss: 1.0098, test_loss: 0.9865, test_f1: 0.4615
 epoch: 31, train_loss: 1.0094, test_loss: 0.9938, test_f1: 0.4810
 epoch: 32, train_loss: 1.0053, test_loss: 0.9857, test_f1: 0.4574
 epoch: 33, train_loss: 0.9959, test_loss: 0.9820, test_f1: 0.4840
 epoch: 34, train_loss: 0.9945, test_loss: 0.9865, test_f1: 0.4776
 epoch: 35, train_loss: 0.9903, test_loss: 0.9832, test_f1: 0.4877
 epoch: 36, train_loss: 0.9816, test_loss: 1.0565, test_f1: 0.4472
 epoch: 37, train_loss: 0.9764, test_loss: 0.9899, test_f1: 0.4839
 epoch: 38, train_loss: 0.9803, test_loss: 0.9994, test_f1: 0.4860
 epoch: 39, train_loss: 0.9706, test_loss: 0.9733, test_f1: 0.4933
 epoch: 40, train_loss: 0.9739, test_loss: 0.9687, test_f1: 0.4967
 epoch: 41, train_loss: 0.9724, test_loss: 0.9712, test_f1: 0.4760
 epoch: 42, train_loss: 0.9563, test_loss: 0.9868, test_f1: 0.4884
 epoch: 43, train_loss: 0.9686, test_loss: 0.9820, test_f1: 0.4919
 epoch: 44, train_loss: 0.9618, test_loss: 0.9847, test_f1: 0.4603
 epoch: 45, train_loss: 0.9628, test_loss: 1.0505, test_f1: 0.4519
 epoch: 46, train_loss: 0.9495, test_loss: 0.9870, test_f1: 0.4789
 epoch: 47, train_loss: 0.9425, test_loss: 0.9811, test_f1: 0.4899
 epoch: 48, train_loss: 0.9445, test_loss: 0.9759, test_f1: 0.4860
 epoch: 49, train_loss: 0.9409, test_loss: 0.9675, test_f1: 0.4847
 epoch: 50, train_loss: 0.9402, test_loss: 0.9645, test_f1: 0.4876
 epoch: 51, train_loss: 0.9347, test_loss: 0.9672, test_f1: 0.4912
 epoch: 52, train_loss: 0.9182, test_loss: 0.9629, test_f1: 0.4922
 epoch: 53, train_loss: 0.9305, test_loss: 0.9817, test_f1: 0.4814
 epoch: 54, train_loss: 0.9224, test_loss: 0.9643, test_f1: 0.4889
 epoch: 55, train_loss: 0.9151, test_loss: 0.9667, test_f1: 0.4947
 epoch: 56, train_loss: 0.9205, test_loss: 0.9698, test_f1: 0.4838
 epoch: 57, train_loss: 0.9120, test_loss: 0.9552, test_f1: 0.4961
 epoch: 58, train_loss: 0.9121, test_loss: 0.9561, test_f1: 0.4828
 epoch: 59, train_loss: 0.9190, test_loss: 0.9610, test_f1: 0.4892
 epoch: 60, train_loss: 0.9132, test_loss: 0.9646, test_f1: 0.4838
 epoch: 61, train_loss: 0.8966, test_loss: 0.9594, test_f1: 0.4898
 epoch: 62, train_loss: 0.9154, test_loss: 0.9689, test_f1: 0.4906
 epoch: 63, train_loss: 0.9055, test_loss: 0.9589, test_f1: 0.4962
 epoch: 64, train_loss: 0.9026, test_loss: 0.9634, test_f1: 0.4919
 epoch: 65, train_loss: 0.9104, test_loss: 0.9767, test_f1: 0.4882
 epoch: 66, train_loss: 0.9023, test_loss: 0.9590, test_f1: 0.5012
 epoch: 67, train_loss: 0.8945, test_loss: 0.9722, test_f1: 0.4868
 epoch: 68, train_loss: 0.9045, test_loss: 0.9662, test_f1: 0.5004
 epoch: 69, train_loss: 0.8983, test_loss: 0.9542, test_f1: 0.4953
 epoch: 70, train_loss: 0.8985, test_loss: 0.9761, test_f1: 0.4892
 epoch: 71, train_loss: 0.8924, test_loss: 0.9618, test_f1: 0.4909
 epoch: 72, train_loss: 0.9019, test_loss: 0.9735, test_f1: 0.4896
 epoch: 73, train_loss: 0.8956, test_loss: 0.9703, test_f1: 0.4844
 epoch: 74, train_loss: 0.8928, test_loss: 0.9525, test_f1: 0.5064
 epoch: 75, train_loss: 0.8979, test_loss: 0.9729, test_f1: 0.4915
 epoch: 76, train_loss: 0.8906, test_loss: 0.9543, test_f1: 0.4926
 epoch: 77, train_loss: 0.8882, test_loss: 0.9761, test_f1: 0.4888
 epoch: 78, train_loss: 0.8900, test_loss: 0.9677, test_f1: 0.5064
 epoch: 79, train_loss: 0.8843, test_loss: 0.9731, test_f1: 0.4984
 epoch: 80, train_loss: 0.8855, test_loss: 0.9684, test_f1: 0.5001
 epoch: 81, train_loss: 0.8853, test_loss: 0.9639, test_f1: 0.5031
 epoch: 82, train_loss: 0.8850, test_loss: 0.9763, test_f1: 0.4881
 epoch: 83, train_loss: 0.8781, test_loss: 0.9714, test_f1: 0.4880
 epoch: 84, train_loss: 0.8768, test_loss: 0.9565, test_f1: 0.4939
 epoch: 85, train_loss: 0.8760, test_loss: 0.9674, test_f1: 0.4880
 epoch: 86, train_loss: 0.8886, test_loss: 0.9837, test_f1: 0.4878
 epoch: 87, train_loss: 0.8747, test_loss: 0.9605, test_f1: 0.4858
 epoch: 88, train_loss: 0.8824, test_loss: 0.9608, test_f1: 0.4872
 epoch: 89, train_loss: 0.8842, test_loss: 0.9682, test_f1: 0.4942
 epoch: 90, train_loss: 0.8701, test_loss: 0.9688, test_f1: 0.4868
 epoch: 91, train_loss: 0.8795, test_loss: 0.9786, test_f1: 0.4888
 epoch: 92, train_loss: 0.8626, test_loss: 0.9859, test_f1: 0.4878
 epoch: 93, train_loss: 0.8687, test_loss: 0.9701, test_f1: 0.4885
 epoch: 94, train_loss: 0.8654, test_loss: 0.9734, test_f1: 0.5007
 epoch: 95, train_loss: 0.8539, test_loss: 0.9703, test_f1: 0.4900
 epoch: 96, train_loss: 0.8629, test_loss: 0.9602, test_f1: 0.5035
 epoch: 97, train_loss: 0.8635, test_loss: 0.9896, test_f1: 0.4882
 epoch: 98, train_loss: 0.8632, test_loss: 0.9729, test_f1: 0.4893
 epoch: 99, train_loss: 0.8661, test_loss: 0.9641, test_f1: 0.4909

Training completed in 551.92 seconds
Best F1: 0.5300 at epoch 84
Mean F1 across iterations: 0.5193  0.0083
========================FINAL RESULTS================================
FEGIN weighted F1: 0.5300  0.0083
python main.py --data ltspice_examples --representation component_component --model FEGIN --layers 2 --hiddens 64 --batch_size 64 --lr 0.0001 --emb_size 128 --epochs 100 --save_appendix component_component_L2_H64_BS64_LR0.0001_E128 --no_val
-----



STDERR:
  File "main.py", line 370, in <module>
    main()
  File "main.py", line 254, in main
    dataset = dataset_class(
  File "/home/philip/projects/ltspice_examples_code_repo/Circuit-Completion-Using-GNNs/component_classification_with_link_prediction_head/evaluation/FEGIN/kernel/circuit_datasets.py", line 15, in __init__
    self.data, self.slices = torch.load(self.processed_paths[0])
  File "/home/philip/.local/lib/python3.8/site-packages/torch/serialization.py", line 1040, in load
    warnings.warn(
  File "/usr/lib/python3.8/warnings.py", line 109, in _showwarnmsg
    sw(msg.message, msg.category, msg.filename, msg.lineno,
  File "main.py", line 47, in warn_with_traceback
    traceback.print_stack(file=log)
/home/philip/projects/ltspice_examples_code_repo/Circuit-Completion-Using-GNNs/component_classification_with_link_prediction_head/evaluation/FEGIN/kernel/circuit_datasets.py:15: FutureWarning: You are using `torch.load` with `weights_only=False` (the current default value), which uses the default pickle module implicitly. It is possible to construct malicious pickle data which will execute arbitrary code during unpickling (See https://github.com/pytorch/pytorch/blob/main/SECURITY.md#untrusted-models for more details). In a future release, the default value for `weights_only` will be flipped to `True`. This limits the functions that could be executed during unpickling. Arbitrary objects will no longer be allowed to be loaded via this mode unless they are explicitly allowlisted by the user via `torch.serialization.add_safe_globals`. We recommend you start setting `weights_only=True` for any use case where you don't have full control of the loaded file. Please open an issue on GitHub for any issues related to this experimental feature.
  self.data, self.slices = torch.load(self.processed_paths[0])
