STDOUT:
Results will be saved in /home/philip/projects/ltspice_examples_code_repo/Circuit-Completion-Using-GNNs/component_classification_with_link_prediction_head/evaluation/FEGIN/results/model_FEGIN_dataset_ltspice_examples
Command line input: python main.py --data ltspice_examples --representation component_pin_net --model FEGIN --layers 6 --hiddens 16 --batch_size 32 --lr 0.0001 --emb_size 250 --epochs 100 --save_appendix component_pin_net_L6_H16_BS32_LR0.0001_E250 --no_val
 is saved.
-----
ltspice_examples - FEGIN
Using 6 layers, 16 hidden units, h = 2
Loading component_pin_net representation dataset
ENTERED
Training FEGIN on component_pin_net representation
Train: 3558, Test: 846
##################ITERATION #0 ****************************************
 epoch: 0, train_loss: 1.4580, test_loss: 1.4368, test_f1: 0.0793
 epoch: 1, train_loss: 1.4419, test_loss: 1.4283, test_f1: 0.0793
 epoch: 2, train_loss: 1.4329, test_loss: 1.4196, test_f1: 0.0794
 epoch: 3, train_loss: 1.4230, test_loss: 1.4088, test_f1: 0.1440
 epoch: 4, train_loss: 1.4118, test_loss: 1.3969, test_f1: 0.2085
 epoch: 5, train_loss: 1.3977, test_loss: 1.3831, test_f1: 0.2174
 epoch: 6, train_loss: 1.3792, test_loss: 1.3622, test_f1: 0.3081
 epoch: 7, train_loss: 1.3568, test_loss: 1.3320, test_f1: 0.3289
 epoch: 8, train_loss: 1.3267, test_loss: 1.3109, test_f1: 0.3262
 epoch: 9, train_loss: 1.3059, test_loss: 1.2842, test_f1: 0.2962
 epoch: 10, train_loss: 1.2860, test_loss: 1.2648, test_f1: 0.2922
 epoch: 11, train_loss: 1.2714, test_loss: 1.2484, test_f1: 0.2650
 epoch: 12, train_loss: 1.2599, test_loss: 1.2295, test_f1: 0.2663
 epoch: 13, train_loss: 1.2463, test_loss: 1.2159, test_f1: 0.3033
 epoch: 14, train_loss: 1.2365, test_loss: 1.1984, test_f1: 0.3518
 epoch: 15, train_loss: 1.2231, test_loss: 1.1873, test_f1: 0.3415
 epoch: 16, train_loss: 1.2107, test_loss: 1.1728, test_f1: 0.3503
 epoch: 17, train_loss: 1.2049, test_loss: 1.1577, test_f1: 0.3782
 epoch: 18, train_loss: 1.1890, test_loss: 1.1449, test_f1: 0.3479
 epoch: 19, train_loss: 1.1745, test_loss: 1.1305, test_f1: 0.3422
 epoch: 20, train_loss: 1.1672, test_loss: 1.1211, test_f1: 0.3410
 epoch: 21, train_loss: 1.1542, test_loss: 1.1141, test_f1: 0.3438
 epoch: 22, train_loss: 1.1518, test_loss: 1.1004, test_f1: 0.3420
 epoch: 23, train_loss: 1.1286, test_loss: 1.0924, test_f1: 0.3440
 epoch: 24, train_loss: 1.1268, test_loss: 1.0850, test_f1: 0.3438
 epoch: 25, train_loss: 1.1228, test_loss: 1.0766, test_f1: 0.3450
 epoch: 26, train_loss: 1.1087, test_loss: 1.0756, test_f1: 0.3438
 epoch: 27, train_loss: 1.1005, test_loss: 1.0717, test_f1: 0.3438
 epoch: 28, train_loss: 1.0905, test_loss: 1.0759, test_f1: 0.3419
 epoch: 29, train_loss: 1.0905, test_loss: 1.0695, test_f1: 0.3416
 epoch: 30, train_loss: 1.0837, test_loss: 1.0641, test_f1: 0.3448
 epoch: 31, train_loss: 1.0914, test_loss: 1.0569, test_f1: 0.3438
 epoch: 32, train_loss: 1.0841, test_loss: 1.0663, test_f1: 0.3416
 epoch: 33, train_loss: 1.0760, test_loss: 1.0601, test_f1: 0.3438
 epoch: 34, train_loss: 1.0760, test_loss: 1.0544, test_f1: 0.3450
 epoch: 35, train_loss: 1.0760, test_loss: 1.0615, test_f1: 0.3416
 epoch: 36, train_loss: 1.0750, test_loss: 1.0630, test_f1: 0.3427
 epoch: 37, train_loss: 1.0676, test_loss: 1.0609, test_f1: 0.3439
 epoch: 38, train_loss: 1.0649, test_loss: 1.0646, test_f1: 0.3448
 epoch: 39, train_loss: 1.0538, test_loss: 1.0483, test_f1: 0.3447
 epoch: 40, train_loss: 1.0610, test_loss: 1.0341, test_f1: 0.3459
 epoch: 41, train_loss: 1.0495, test_loss: 1.0614, test_f1: 0.3395
 epoch: 42, train_loss: 1.0535, test_loss: 1.0454, test_f1: 0.3469
 epoch: 43, train_loss: 1.0540, test_loss: 1.0562, test_f1: 0.3454
 epoch: 44, train_loss: 1.0504, test_loss: 1.0601, test_f1: 0.3482
 epoch: 45, train_loss: 1.0492, test_loss: 1.0557, test_f1: 0.3661
 epoch: 46, train_loss: 1.0442, test_loss: 1.0604, test_f1: 0.3471
 epoch: 47, train_loss: 1.0447, test_loss: 1.0372, test_f1: 0.3478
 epoch: 48, train_loss: 1.0446, test_loss: 1.0672, test_f1: 0.3708
 epoch: 49, train_loss: 1.0432, test_loss: 1.0551, test_f1: 0.3545
 epoch: 50, train_loss: 1.0338, test_loss: 1.0571, test_f1: 0.3754
 epoch: 51, train_loss: 1.0279, test_loss: 1.0568, test_f1: 0.3806
 epoch: 52, train_loss: 1.0323, test_loss: 1.0568, test_f1: 0.3557
 epoch: 53, train_loss: 1.0355, test_loss: 1.0477, test_f1: 0.3805
 epoch: 54, train_loss: 1.0299, test_loss: 1.0502, test_f1: 0.3940
 epoch: 55, train_loss: 1.0275, test_loss: 1.0413, test_f1: 0.3957
 epoch: 56, train_loss: 1.0236, test_loss: 1.0380, test_f1: 0.3986
 epoch: 57, train_loss: 1.0282, test_loss: 1.0478, test_f1: 0.3861
 epoch: 58, train_loss: 1.0292, test_loss: 1.0406, test_f1: 0.3939
 epoch: 59, train_loss: 1.0262, test_loss: 1.0445, test_f1: 0.4092
 epoch: 60, train_loss: 1.0260, test_loss: 1.0540, test_f1: 0.4127
 epoch: 61, train_loss: 1.0257, test_loss: 1.0295, test_f1: 0.4155
 epoch: 62, train_loss: 1.0290, test_loss: 1.0443, test_f1: 0.4038
 epoch: 63, train_loss: 1.0225, test_loss: 1.0552, test_f1: 0.4197
 epoch: 64, train_loss: 1.0228, test_loss: 1.0418, test_f1: 0.4412
 epoch: 65, train_loss: 1.0116, test_loss: 1.0321, test_f1: 0.4432
 epoch: 66, train_loss: 1.0208, test_loss: 1.0532, test_f1: 0.4213
 epoch: 67, train_loss: 1.0225, test_loss: 1.0251, test_f1: 0.4507
 epoch: 68, train_loss: 1.0219, test_loss: 1.0279, test_f1: 0.4466
 epoch: 69, train_loss: 1.0186, test_loss: 1.0423, test_f1: 0.4469
 epoch: 70, train_loss: 1.0208, test_loss: 1.0411, test_f1: 0.4344
 epoch: 71, train_loss: 1.0129, test_loss: 1.0100, test_f1: 0.4321
 epoch: 72, train_loss: 1.0162, test_loss: 1.0132, test_f1: 0.4441
 epoch: 73, train_loss: 1.0170, test_loss: 1.0110, test_f1: 0.4492
 epoch: 74, train_loss: 1.0126, test_loss: 1.0421, test_f1: 0.4413
 epoch: 75, train_loss: 1.0152, test_loss: 1.0121, test_f1: 0.4491
 epoch: 76, train_loss: 1.0141, test_loss: 1.0420, test_f1: 0.4616
 epoch: 77, train_loss: 1.0082, test_loss: 1.0286, test_f1: 0.4514
 epoch: 78, train_loss: 1.0069, test_loss: 1.0244, test_f1: 0.4556
 epoch: 79, train_loss: 1.0059, test_loss: 1.0453, test_f1: 0.4573
 epoch: 80, train_loss: 1.0090, test_loss: 1.0243, test_f1: 0.4539
 epoch: 81, train_loss: 1.0079, test_loss: 0.9970, test_f1: 0.4614
 epoch: 82, train_loss: 1.0089, test_loss: 1.0195, test_f1: 0.4569
 epoch: 83, train_loss: 1.0094, test_loss: 1.0122, test_f1: 0.4459
 epoch: 84, train_loss: 1.0004, test_loss: 1.0229, test_f1: 0.4613
 epoch: 85, train_loss: 1.0068, test_loss: 1.0040, test_f1: 0.4611
 epoch: 86, train_loss: 1.0038, test_loss: 1.0297, test_f1: 0.4587
 epoch: 87, train_loss: 1.0043, test_loss: 1.0026, test_f1: 0.4662
 epoch: 88, train_loss: 0.9959, test_loss: 0.9940, test_f1: 0.4625
 epoch: 89, train_loss: 0.9972, test_loss: 1.0121, test_f1: 0.4637
 epoch: 90, train_loss: 0.9966, test_loss: 1.0056, test_f1: 0.4678
 epoch: 91, train_loss: 0.9996, test_loss: 1.0366, test_f1: 0.4614
 epoch: 92, train_loss: 0.9952, test_loss: 1.0269, test_f1: 0.4594
 epoch: 93, train_loss: 0.9895, test_loss: 0.9931, test_f1: 0.4623
 epoch: 94, train_loss: 1.0007, test_loss: 1.0105, test_f1: 0.4700
 epoch: 95, train_loss: 0.9913, test_loss: 0.9912, test_f1: 0.4686
 epoch: 96, train_loss: 0.9946, test_loss: 0.9733, test_f1: 0.4705
 epoch: 97, train_loss: 0.9863, test_loss: 0.9786, test_f1: 0.4585
 epoch: 98, train_loss: 1.0020, test_loss: 0.9986, test_f1: 0.4617
 epoch: 99, train_loss: 0.9924, test_loss: 0.9968, test_f1: 0.4647
##################ITERATION #1 ****************************************
 epoch: 0, train_loss: 1.3636, test_loss: 1.3523, test_f1: 0.2374
 epoch: 1, train_loss: 1.3478, test_loss: 1.3404, test_f1: 0.2411
 epoch: 2, train_loss: 1.3320, test_loss: 1.3211, test_f1: 0.2270
 epoch: 3, train_loss: 1.3092, test_loss: 1.2942, test_f1: 0.2270
 epoch: 4, train_loss: 1.2843, test_loss: 1.2598, test_f1: 0.2270
 epoch: 5, train_loss: 1.2608, test_loss: 1.2274, test_f1: 0.3116
 epoch: 6, train_loss: 1.2301, test_loss: 1.1939, test_f1: 0.3493
 epoch: 7, train_loss: 1.2038, test_loss: 1.1584, test_f1: 0.3432
 epoch: 8, train_loss: 1.1860, test_loss: 1.1395, test_f1: 0.3438
 epoch: 9, train_loss: 1.1633, test_loss: 1.1154, test_f1: 0.3429
 epoch: 10, train_loss: 1.1508, test_loss: 1.1104, test_f1: 0.3395
 epoch: 11, train_loss: 1.1217, test_loss: 1.0908, test_f1: 0.3441
 epoch: 12, train_loss: 1.1206, test_loss: 1.0824, test_f1: 0.3407
 epoch: 13, train_loss: 1.1097, test_loss: 1.0764, test_f1: 0.3416
 epoch: 14, train_loss: 1.0932, test_loss: 1.0694, test_f1: 0.3339
 epoch: 15, train_loss: 1.0938, test_loss: 1.0628, test_f1: 0.3402
 epoch: 16, train_loss: 1.0916, test_loss: 1.0523, test_f1: 0.3446
 epoch: 17, train_loss: 1.0784, test_loss: 1.0479, test_f1: 0.3446
 epoch: 18, train_loss: 1.0716, test_loss: 1.0504, test_f1: 0.3449
 epoch: 19, train_loss: 1.0744, test_loss: 1.0391, test_f1: 0.3458
 epoch: 20, train_loss: 1.0686, test_loss: 1.0326, test_f1: 0.3495
 epoch: 21, train_loss: 1.0587, test_loss: 1.0404, test_f1: 0.3459
 epoch: 22, train_loss: 1.0608, test_loss: 1.0455, test_f1: 0.3473
 epoch: 23, train_loss: 1.0496, test_loss: 1.0334, test_f1: 0.3694
 epoch: 24, train_loss: 1.0511, test_loss: 1.0243, test_f1: 0.3884
 epoch: 25, train_loss: 1.0520, test_loss: 1.0265, test_f1: 0.3958
 epoch: 26, train_loss: 1.0374, test_loss: 1.0138, test_f1: 0.4053
 epoch: 27, train_loss: 1.0368, test_loss: 1.0138, test_f1: 0.4067
 epoch: 28, train_loss: 1.0354, test_loss: 1.0078, test_f1: 0.4228
 epoch: 29, train_loss: 1.0330, test_loss: 1.0122, test_f1: 0.4442
 epoch: 30, train_loss: 1.0319, test_loss: 1.0296, test_f1: 0.4362
 epoch: 31, train_loss: 1.0320, test_loss: 1.0024, test_f1: 0.4375
 epoch: 32, train_loss: 1.0283, test_loss: 1.0007, test_f1: 0.4477
 epoch: 33, train_loss: 1.0291, test_loss: 0.9941, test_f1: 0.4518
 epoch: 34, train_loss: 1.0114, test_loss: 0.9907, test_f1: 0.4583
 epoch: 35, train_loss: 1.0194, test_loss: 0.9980, test_f1: 0.4468
 epoch: 36, train_loss: 1.0235, test_loss: 0.9820, test_f1: 0.4699
 epoch: 37, train_loss: 1.0226, test_loss: 0.9809, test_f1: 0.4847
 epoch: 38, train_loss: 1.0078, test_loss: 0.9892, test_f1: 0.4595
 epoch: 39, train_loss: 1.0182, test_loss: 0.9805, test_f1: 0.4683
 epoch: 40, train_loss: 1.0128, test_loss: 0.9757, test_f1: 0.4649
 epoch: 41, train_loss: 1.0011, test_loss: 0.9940, test_f1: 0.4771
 epoch: 42, train_loss: 1.0094, test_loss: 0.9864, test_f1: 0.4703
 epoch: 43, train_loss: 0.9924, test_loss: 0.9808, test_f1: 0.4857
 epoch: 44, train_loss: 0.9994, test_loss: 0.9652, test_f1: 0.4823
 epoch: 45, train_loss: 0.9922, test_loss: 0.9677, test_f1: 0.4834
 epoch: 46, train_loss: 0.9910, test_loss: 0.9764, test_f1: 0.4864
 epoch: 47, train_loss: 0.9949, test_loss: 0.9704, test_f1: 0.4857
 epoch: 48, train_loss: 0.9955, test_loss: 0.9674, test_f1: 0.4959
 epoch: 49, train_loss: 0.9849, test_loss: 0.9712, test_f1: 0.4996
 epoch: 50, train_loss: 0.9872, test_loss: 0.9605, test_f1: 0.4833
 epoch: 51, train_loss: 0.9761, test_loss: 0.9643, test_f1: 0.4988
 epoch: 52, train_loss: 0.9835, test_loss: 0.9682, test_f1: 0.5029
 epoch: 53, train_loss: 0.9884, test_loss: 0.9644, test_f1: 0.5001
 epoch: 54, train_loss: 0.9725, test_loss: 0.9697, test_f1: 0.4968
 epoch: 55, train_loss: 0.9744, test_loss: 0.9555, test_f1: 0.4913
 epoch: 56, train_loss: 0.9743, test_loss: 0.9493, test_f1: 0.4963
 epoch: 57, train_loss: 0.9695, test_loss: 0.9560, test_f1: 0.5008
 epoch: 58, train_loss: 0.9803, test_loss: 0.9580, test_f1: 0.4826
 epoch: 59, train_loss: 0.9786, test_loss: 0.9538, test_f1: 0.5041
 epoch: 60, train_loss: 0.9763, test_loss: 0.9526, test_f1: 0.4979
 epoch: 61, train_loss: 0.9673, test_loss: 0.9410, test_f1: 0.4986
 epoch: 62, train_loss: 0.9694, test_loss: 0.9521, test_f1: 0.5104
 epoch: 63, train_loss: 0.9781, test_loss: 0.9392, test_f1: 0.5047
 epoch: 64, train_loss: 0.9697, test_loss: 0.9465, test_f1: 0.4989
 epoch: 65, train_loss: 0.9641, test_loss: 0.9419, test_f1: 0.5090
 epoch: 66, train_loss: 0.9751, test_loss: 0.9464, test_f1: 0.4980
 epoch: 67, train_loss: 0.9585, test_loss: 0.9647, test_f1: 0.4794
 epoch: 68, train_loss: 0.9674, test_loss: 0.9389, test_f1: 0.5074
 epoch: 69, train_loss: 0.9622, test_loss: 0.9527, test_f1: 0.5057
 epoch: 70, train_loss: 0.9624, test_loss: 0.9686, test_f1: 0.5066
 epoch: 71, train_loss: 0.9701, test_loss: 0.9575, test_f1: 0.5040
 epoch: 72, train_loss: 0.9630, test_loss: 0.9416, test_f1: 0.4982
 epoch: 73, train_loss: 0.9645, test_loss: 0.9452, test_f1: 0.5049
 epoch: 74, train_loss: 0.9615, test_loss: 0.9552, test_f1: 0.4963
 epoch: 75, train_loss: 0.9586, test_loss: 0.9491, test_f1: 0.4999
 epoch: 76, train_loss: 0.9678, test_loss: 0.9322, test_f1: 0.5099
 epoch: 77, train_loss: 0.9491, test_loss: 0.9607, test_f1: 0.5020
 epoch: 78, train_loss: 0.9522, test_loss: 0.9393, test_f1: 0.4998
 epoch: 79, train_loss: 0.9562, test_loss: 0.9503, test_f1: 0.4904
 epoch: 80, train_loss: 0.9550, test_loss: 0.9501, test_f1: 0.4852
 epoch: 81, train_loss: 0.9597, test_loss: 0.9238, test_f1: 0.4966
 epoch: 82, train_loss: 0.9449, test_loss: 0.9358, test_f1: 0.4981
 epoch: 83, train_loss: 0.9613, test_loss: 0.9368, test_f1: 0.5057
 epoch: 84, train_loss: 0.9565, test_loss: 0.9579, test_f1: 0.5011
 epoch: 85, train_loss: 0.9589, test_loss: 0.9266, test_f1: 0.5051
 epoch: 86, train_loss: 0.9554, test_loss: 0.9352, test_f1: 0.4986
 epoch: 87, train_loss: 0.9654, test_loss: 0.9352, test_f1: 0.5043
 epoch: 88, train_loss: 0.9600, test_loss: 0.9466, test_f1: 0.5132
 epoch: 89, train_loss: 0.9431, test_loss: 0.9501, test_f1: 0.5120
 epoch: 90, train_loss: 0.9604, test_loss: 0.9348, test_f1: 0.5088
 epoch: 91, train_loss: 0.9484, test_loss: 0.9292, test_f1: 0.5100
 epoch: 92, train_loss: 0.9547, test_loss: 0.9193, test_f1: 0.5005
 epoch: 93, train_loss: 0.9553, test_loss: 0.9288, test_f1: 0.5069
 epoch: 94, train_loss: 0.9482, test_loss: 0.9290, test_f1: 0.5076
 epoch: 95, train_loss: 0.9510, test_loss: 0.9303, test_f1: 0.5071
 epoch: 96, train_loss: 0.9443, test_loss: 0.9235, test_f1: 0.5118
 epoch: 97, train_loss: 0.9436, test_loss: 0.9271, test_f1: 0.5130
 epoch: 98, train_loss: 0.9489, test_loss: 0.9245, test_f1: 0.5148
 epoch: 99, train_loss: 0.9466, test_loss: 0.9219, test_f1: 0.5087
##################ITERATION #2 ****************************************
 epoch: 0, train_loss: 1.2962, test_loss: 1.2809, test_f1: 0.2270
 epoch: 1, train_loss: 1.2767, test_loss: 1.2655, test_f1: 0.2270
 epoch: 2, train_loss: 1.2649, test_loss: 1.2515, test_f1: 0.2270
 epoch: 3, train_loss: 1.2542, test_loss: 1.2393, test_f1: 0.2270
 epoch: 4, train_loss: 1.2428, test_loss: 1.2251, test_f1: 0.2270
 epoch: 5, train_loss: 1.2271, test_loss: 1.2067, test_f1: 0.2270
 epoch: 6, train_loss: 1.2136, test_loss: 1.1856, test_f1: 0.2295
 epoch: 7, train_loss: 1.1931, test_loss: 1.1655, test_f1: 0.2801
 epoch: 8, train_loss: 1.1768, test_loss: 1.1459, test_f1: 0.3478
 epoch: 9, train_loss: 1.1581, test_loss: 1.1221, test_f1: 0.3451
 epoch: 10, train_loss: 1.1461, test_loss: 1.1028, test_f1: 0.3441
 epoch: 11, train_loss: 1.1284, test_loss: 1.0904, test_f1: 0.3390
 epoch: 12, train_loss: 1.1173, test_loss: 1.0892, test_f1: 0.3348
 epoch: 13, train_loss: 1.1135, test_loss: 1.0728, test_f1: 0.3364
 epoch: 14, train_loss: 1.0920, test_loss: 1.0599, test_f1: 0.3416
 epoch: 15, train_loss: 1.0815, test_loss: 1.0512, test_f1: 0.3527
 epoch: 16, train_loss: 1.0832, test_loss: 1.0526, test_f1: 0.3575
 epoch: 17, train_loss: 1.0789, test_loss: 1.0500, test_f1: 0.3692
 epoch: 18, train_loss: 1.0618, test_loss: 1.0488, test_f1: 0.3765
 epoch: 19, train_loss: 1.0684, test_loss: 1.0490, test_f1: 0.3724
 epoch: 20, train_loss: 1.0677, test_loss: 1.0464, test_f1: 0.3962
 epoch: 21, train_loss: 1.0545, test_loss: 1.0439, test_f1: 0.3952
 epoch: 22, train_loss: 1.0499, test_loss: 1.0512, test_f1: 0.3892
 epoch: 23, train_loss: 1.0513, test_loss: 1.0558, test_f1: 0.3830
 epoch: 24, train_loss: 1.0399, test_loss: 1.0467, test_f1: 0.4050
 epoch: 25, train_loss: 1.0398, test_loss: 1.0470, test_f1: 0.3995
 epoch: 26, train_loss: 1.0359, test_loss: 1.0599, test_f1: 0.4013
 epoch: 27, train_loss: 1.0332, test_loss: 1.0427, test_f1: 0.4228
 epoch: 28, train_loss: 1.0311, test_loss: 1.0596, test_f1: 0.4051
 epoch: 29, train_loss: 1.0291, test_loss: 1.0412, test_f1: 0.4267
 epoch: 30, train_loss: 1.0344, test_loss: 1.0515, test_f1: 0.4200
 epoch: 31, train_loss: 1.0252, test_loss: 1.0380, test_f1: 0.4430
 epoch: 32, train_loss: 1.0208, test_loss: 1.0356, test_f1: 0.4468
 epoch: 33, train_loss: 1.0179, test_loss: 1.0425, test_f1: 0.4367
 epoch: 34, train_loss: 1.0161, test_loss: 1.0332, test_f1: 0.4560
 epoch: 35, train_loss: 1.0126, test_loss: 1.0228, test_f1: 0.4578
 epoch: 36, train_loss: 1.0125, test_loss: 1.0264, test_f1: 0.4572
 epoch: 37, train_loss: 1.0015, test_loss: 1.0225, test_f1: 0.4590
 epoch: 38, train_loss: 1.0036, test_loss: 1.0446, test_f1: 0.4278
 epoch: 39, train_loss: 0.9966, test_loss: 1.0114, test_f1: 0.4638
 epoch: 40, train_loss: 1.0042, test_loss: 1.0336, test_f1: 0.4555
 epoch: 41, train_loss: 0.9945, test_loss: 1.0128, test_f1: 0.4668
 epoch: 42, train_loss: 0.9966, test_loss: 1.0178, test_f1: 0.4790
 epoch: 43, train_loss: 0.9896, test_loss: 1.0421, test_f1: 0.4703
 epoch: 44, train_loss: 0.9872, test_loss: 1.0718, test_f1: 0.4482
 epoch: 45, train_loss: 0.9906, test_loss: 1.0166, test_f1: 0.4597
 epoch: 46, train_loss: 0.9850, test_loss: 1.0169, test_f1: 0.4553
 epoch: 47, train_loss: 0.9852, test_loss: 1.0126, test_f1: 0.4723
 epoch: 48, train_loss: 0.9746, test_loss: 1.0174, test_f1: 0.4612
 epoch: 49, train_loss: 0.9803, test_loss: 1.0154, test_f1: 0.4822
 epoch: 50, train_loss: 0.9763, test_loss: 1.0071, test_f1: 0.4723
 epoch: 51, train_loss: 0.9827, test_loss: 0.9980, test_f1: 0.4674
 epoch: 52, train_loss: 0.9734, test_loss: 1.0180, test_f1: 0.4779
 epoch: 53, train_loss: 0.9664, test_loss: 0.9987, test_f1: 0.4785
 epoch: 54, train_loss: 0.9797, test_loss: 1.0132, test_f1: 0.4886
 epoch: 55, train_loss: 0.9612, test_loss: 1.0113, test_f1: 0.4831
 epoch: 56, train_loss: 0.9740, test_loss: 1.0222, test_f1: 0.4799
 epoch: 57, train_loss: 0.9745, test_loss: 1.0017, test_f1: 0.4648
 epoch: 58, train_loss: 0.9649, test_loss: 1.0102, test_f1: 0.4977
 epoch: 59, train_loss: 0.9595, test_loss: 1.0102, test_f1: 0.4884
 epoch: 60, train_loss: 0.9701, test_loss: 0.9993, test_f1: 0.4969
 epoch: 61, train_loss: 0.9612, test_loss: 1.0650, test_f1: 0.4589
 epoch: 62, train_loss: 0.9660, test_loss: 0.9951, test_f1: 0.4919
 epoch: 63, train_loss: 0.9678, test_loss: 1.0220, test_f1: 0.4787
 epoch: 64, train_loss: 0.9593, test_loss: 1.0052, test_f1: 0.4718
 epoch: 65, train_loss: 0.9646, test_loss: 1.0070, test_f1: 0.4741
 epoch: 66, train_loss: 0.9718, test_loss: 1.0002, test_f1: 0.4802
 epoch: 67, train_loss: 0.9614, test_loss: 1.0094, test_f1: 0.5041
 epoch: 68, train_loss: 0.9608, test_loss: 0.9833, test_f1: 0.4906
 epoch: 69, train_loss: 0.9643, test_loss: 1.0030, test_f1: 0.4909
 epoch: 70, train_loss: 0.9560, test_loss: 1.0436, test_f1: 0.4765
 epoch: 71, train_loss: 0.9555, test_loss: 1.0260, test_f1: 0.4897
 epoch: 72, train_loss: 0.9619, test_loss: 0.9934, test_f1: 0.5050
 epoch: 73, train_loss: 0.9572, test_loss: 1.0231, test_f1: 0.4799
 epoch: 74, train_loss: 0.9635, test_loss: 1.0077, test_f1: 0.4927
 epoch: 75, train_loss: 0.9558, test_loss: 0.9949, test_f1: 0.5044
 epoch: 76, train_loss: 0.9552, test_loss: 1.0897, test_f1: 0.4661
 epoch: 77, train_loss: 0.9585, test_loss: 0.9945, test_f1: 0.4957
 epoch: 78, train_loss: 0.9541, test_loss: 0.9891, test_f1: 0.4970
 epoch: 79, train_loss: 0.9629, test_loss: 1.0026, test_f1: 0.5035
 epoch: 80, train_loss: 0.9699, test_loss: 1.0220, test_f1: 0.4705
 epoch: 81, train_loss: 0.9643, test_loss: 0.9894, test_f1: 0.5068
 epoch: 82, train_loss: 0.9567, test_loss: 0.9847, test_f1: 0.4940
 epoch: 83, train_loss: 0.9489, test_loss: 0.9721, test_f1: 0.5077
 epoch: 84, train_loss: 0.9535, test_loss: 0.9747, test_f1: 0.4970
 epoch: 85, train_loss: 0.9574, test_loss: 0.9849, test_f1: 0.5011
 epoch: 86, train_loss: 0.9472, test_loss: 0.9961, test_f1: 0.4987
 epoch: 87, train_loss: 0.9624, test_loss: 0.9856, test_f1: 0.5031
 epoch: 88, train_loss: 0.9493, test_loss: 0.9938, test_f1: 0.4946
 epoch: 89, train_loss: 0.9494, test_loss: 0.9960, test_f1: 0.5028
 epoch: 90, train_loss: 0.9454, test_loss: 0.9844, test_f1: 0.5016
 epoch: 91, train_loss: 0.9457, test_loss: 1.0040, test_f1: 0.4985
 epoch: 92, train_loss: 0.9534, test_loss: 0.9936, test_f1: 0.5047
 epoch: 93, train_loss: 0.9504, test_loss: 0.9864, test_f1: 0.4965
 epoch: 94, train_loss: 0.9474, test_loss: 1.0052, test_f1: 0.4974
 epoch: 95, train_loss: 0.9447, test_loss: 1.0103, test_f1: 0.4932
 epoch: 96, train_loss: 0.9525, test_loss: 1.0145, test_f1: 0.4894
 epoch: 97, train_loss: 0.9434, test_loss: 1.0150, test_f1: 0.4912
 epoch: 98, train_loss: 0.9425, test_loss: 0.9966, test_f1: 0.5012
 epoch: 99, train_loss: 0.9445, test_loss: 0.9971, test_f1: 0.5054
##################ITERATION #3 ****************************************
 epoch: 0, train_loss: 1.2877, test_loss: 1.2583, test_f1: 0.2270
 epoch: 1, train_loss: 1.2485, test_loss: 1.2144, test_f1: 0.2993
 epoch: 2, train_loss: 1.2113, test_loss: 1.1816, test_f1: 0.3303
 epoch: 3, train_loss: 1.1837, test_loss: 1.1549, test_f1: 0.3441
 epoch: 4, train_loss: 1.1666, test_loss: 1.1395, test_f1: 0.3421
 epoch: 5, train_loss: 1.1405, test_loss: 1.1165, test_f1: 0.3460
 epoch: 6, train_loss: 1.1282, test_loss: 1.1182, test_f1: 0.3441
 epoch: 7, train_loss: 1.1132, test_loss: 1.1072, test_f1: 0.3460
 epoch: 8, train_loss: 1.1072, test_loss: 1.0993, test_f1: 0.3450
 epoch: 9, train_loss: 1.1005, test_loss: 1.1084, test_f1: 0.3400
 epoch: 10, train_loss: 1.0961, test_loss: 1.0943, test_f1: 0.3440
 epoch: 11, train_loss: 1.0830, test_loss: 1.0815, test_f1: 0.3562
 epoch: 12, train_loss: 1.0777, test_loss: 1.0970, test_f1: 0.3430
 epoch: 13, train_loss: 1.0730, test_loss: 1.0894, test_f1: 0.3357
 epoch: 14, train_loss: 1.0684, test_loss: 1.0756, test_f1: 0.3494
 epoch: 15, train_loss: 1.0642, test_loss: 1.0790, test_f1: 0.3440
 epoch: 16, train_loss: 1.0553, test_loss: 1.0643, test_f1: 0.3513
 epoch: 17, train_loss: 1.0567, test_loss: 1.0581, test_f1: 0.3552
 epoch: 18, train_loss: 1.0521, test_loss: 1.0598, test_f1: 0.3556
 epoch: 19, train_loss: 1.0459, test_loss: 1.0607, test_f1: 0.3590
 epoch: 20, train_loss: 1.0388, test_loss: 1.0497, test_f1: 0.3790
 epoch: 21, train_loss: 1.0442, test_loss: 1.0318, test_f1: 0.3922
 epoch: 22, train_loss: 1.0396, test_loss: 1.0365, test_f1: 0.3922
 epoch: 23, train_loss: 1.0353, test_loss: 1.0314, test_f1: 0.3948
 epoch: 24, train_loss: 1.0347, test_loss: 1.0377, test_f1: 0.4103
 epoch: 25, train_loss: 1.0261, test_loss: 1.0327, test_f1: 0.4192
 epoch: 26, train_loss: 1.0155, test_loss: 1.0319, test_f1: 0.4022
 epoch: 27, train_loss: 1.0162, test_loss: 1.0288, test_f1: 0.4271
 epoch: 28, train_loss: 1.0188, test_loss: 1.0185, test_f1: 0.4232
 epoch: 29, train_loss: 1.0204, test_loss: 1.0201, test_f1: 0.4296
 epoch: 30, train_loss: 1.0116, test_loss: 1.0116, test_f1: 0.4743
 epoch: 31, train_loss: 1.0121, test_loss: 0.9911, test_f1: 0.4514
 epoch: 32, train_loss: 1.0080, test_loss: 1.0073, test_f1: 0.4623
 epoch: 33, train_loss: 0.9972, test_loss: 1.0158, test_f1: 0.4399
 epoch: 34, train_loss: 0.9999, test_loss: 1.0108, test_f1: 0.4522
 epoch: 35, train_loss: 0.9947, test_loss: 1.0080, test_f1: 0.4519
 epoch: 36, train_loss: 1.0026, test_loss: 1.0083, test_f1: 0.4624
 epoch: 37, train_loss: 0.9949, test_loss: 0.9989, test_f1: 0.4599
 epoch: 38, train_loss: 0.9891, test_loss: 0.9967, test_f1: 0.4827
 epoch: 39, train_loss: 0.9921, test_loss: 0.9836, test_f1: 0.4533
 epoch: 40, train_loss: 0.9922, test_loss: 0.9815, test_f1: 0.4681
 epoch: 41, train_loss: 0.9808, test_loss: 0.9991, test_f1: 0.4485
 epoch: 42, train_loss: 0.9839, test_loss: 0.9717, test_f1: 0.4774
 epoch: 43, train_loss: 0.9795, test_loss: 0.9653, test_f1: 0.4931
 epoch: 44, train_loss: 0.9807, test_loss: 1.0005, test_f1: 0.4687
 epoch: 45, train_loss: 0.9808, test_loss: 1.0055, test_f1: 0.4716
 epoch: 46, train_loss: 0.9847, test_loss: 0.9863, test_f1: 0.4908
 epoch: 47, train_loss: 0.9815, test_loss: 0.9783, test_f1: 0.4696
 epoch: 48, train_loss: 0.9695, test_loss: 0.9790, test_f1: 0.4813
 epoch: 49, train_loss: 0.9729, test_loss: 0.9487, test_f1: 0.4831
 epoch: 50, train_loss: 0.9799, test_loss: 0.9706, test_f1: 0.4809
 epoch: 51, train_loss: 0.9607, test_loss: 0.9669, test_f1: 0.4919
 epoch: 52, train_loss: 0.9740, test_loss: 0.9652, test_f1: 0.4985
 epoch: 53, train_loss: 0.9657, test_loss: 0.9505, test_f1: 0.4908
 epoch: 54, train_loss: 0.9700, test_loss: 0.9774, test_f1: 0.4504
 epoch: 55, train_loss: 0.9669, test_loss: 0.9523, test_f1: 0.5011
 epoch: 56, train_loss: 0.9590, test_loss: 0.9670, test_f1: 0.4810
 epoch: 57, train_loss: 0.9600, test_loss: 0.9825, test_f1: 0.4801
 epoch: 58, train_loss: 0.9618, test_loss: 0.9819, test_f1: 0.4937
 epoch: 59, train_loss: 0.9626, test_loss: 0.9623, test_f1: 0.4985
 epoch: 60, train_loss: 0.9634, test_loss: 0.9403, test_f1: 0.5069
 epoch: 61, train_loss: 0.9630, test_loss: 0.9373, test_f1: 0.4920
 epoch: 62, train_loss: 0.9584, test_loss: 0.9446, test_f1: 0.4954
 epoch: 63, train_loss: 0.9689, test_loss: 0.9417, test_f1: 0.5033
 epoch: 64, train_loss: 0.9556, test_loss: 0.9440, test_f1: 0.4978
 epoch: 65, train_loss: 0.9559, test_loss: 0.9563, test_f1: 0.4970
 epoch: 66, train_loss: 0.9609, test_loss: 0.9697, test_f1: 0.5030
 epoch: 67, train_loss: 0.9474, test_loss: 0.9793, test_f1: 0.5050
 epoch: 68, train_loss: 0.9548, test_loss: 0.9673, test_f1: 0.5034
 epoch: 69, train_loss: 0.9492, test_loss: 0.9730, test_f1: 0.5127
 epoch: 70, train_loss: 0.9521, test_loss: 0.9640, test_f1: 0.5045
 epoch: 71, train_loss: 0.9509, test_loss: 0.9939, test_f1: 0.4650
 epoch: 72, train_loss: 0.9554, test_loss: 0.9336, test_f1: 0.5056
 epoch: 73, train_loss: 0.9612, test_loss: 0.9582, test_f1: 0.5116
 epoch: 74, train_loss: 0.9460, test_loss: 0.9482, test_f1: 0.4864
 epoch: 75, train_loss: 0.9497, test_loss: 0.9666, test_f1: 0.5016
 epoch: 76, train_loss: 0.9476, test_loss: 0.9613, test_f1: 0.4923
 epoch: 77, train_loss: 0.9604, test_loss: 0.9442, test_f1: 0.5064
 epoch: 78, train_loss: 0.9479, test_loss: 0.9459, test_f1: 0.4983
 epoch: 79, train_loss: 0.9555, test_loss: 0.9324, test_f1: 0.5219
 epoch: 80, train_loss: 0.9480, test_loss: 0.9433, test_f1: 0.5110
 epoch: 81, train_loss: 0.9507, test_loss: 0.9697, test_f1: 0.4884
 epoch: 82, train_loss: 0.9467, test_loss: 0.9293, test_f1: 0.5273
 epoch: 83, train_loss: 0.9464, test_loss: 0.9675, test_f1: 0.4903
 epoch: 84, train_loss: 0.9512, test_loss: 0.9643, test_f1: 0.4991
 epoch: 85, train_loss: 0.9424, test_loss: 0.9462, test_f1: 0.5101
 epoch: 86, train_loss: 0.9508, test_loss: 0.9435, test_f1: 0.5123
 epoch: 87, train_loss: 0.9470, test_loss: 0.9528, test_f1: 0.4916
 epoch: 88, train_loss: 0.9398, test_loss: 0.9469, test_f1: 0.5190
 epoch: 89, train_loss: 0.9396, test_loss: 0.9158, test_f1: 0.5328
 epoch: 90, train_loss: 0.9330, test_loss: 0.9367, test_f1: 0.5151
 epoch: 91, train_loss: 0.9445, test_loss: 0.9269, test_f1: 0.5233
 epoch: 92, train_loss: 0.9379, test_loss: 0.9419, test_f1: 0.5159
 epoch: 93, train_loss: 0.9426, test_loss: 0.9228, test_f1: 0.5316
 epoch: 94, train_loss: 0.9487, test_loss: 0.9208, test_f1: 0.5282
 epoch: 95, train_loss: 0.9254, test_loss: 0.9227, test_f1: 0.5117
 epoch: 96, train_loss: 0.9295, test_loss: 0.9266, test_f1: 0.5215
 epoch: 97, train_loss: 0.9385, test_loss: 0.9006, test_f1: 0.5427
 epoch: 98, train_loss: 0.9387, test_loss: 0.9233, test_f1: 0.5242
 epoch: 99, train_loss: 0.9411, test_loss: 0.9278, test_f1: 0.5216
##################ITERATION #4 ****************************************
 epoch: 0, train_loss: 1.2815, test_loss: 1.2419, test_f1: 0.2570
 epoch: 1, train_loss: 1.2347, test_loss: 1.2052, test_f1: 0.3088
 epoch: 2, train_loss: 1.2081, test_loss: 1.1743, test_f1: 0.3405
 epoch: 3, train_loss: 1.1846, test_loss: 1.1510, test_f1: 0.3419
 epoch: 4, train_loss: 1.1619, test_loss: 1.1310, test_f1: 0.3493
 epoch: 5, train_loss: 1.1482, test_loss: 1.1152, test_f1: 0.3626
 epoch: 6, train_loss: 1.1208, test_loss: 1.1099, test_f1: 0.3679
 epoch: 7, train_loss: 1.1152, test_loss: 1.0955, test_f1: 0.3764
 epoch: 8, train_loss: 1.0994, test_loss: 1.0909, test_f1: 0.3959
 epoch: 9, train_loss: 1.0943, test_loss: 1.0825, test_f1: 0.4075
 epoch: 10, train_loss: 1.0820, test_loss: 1.0776, test_f1: 0.4019
 epoch: 11, train_loss: 1.0693, test_loss: 1.0788, test_f1: 0.4264
 epoch: 12, train_loss: 1.0687, test_loss: 1.0686, test_f1: 0.4207
 epoch: 13, train_loss: 1.0563, test_loss: 1.0718, test_f1: 0.4233
 epoch: 14, train_loss: 1.0549, test_loss: 1.0878, test_f1: 0.3987
 epoch: 15, train_loss: 1.0490, test_loss: 1.0652, test_f1: 0.4306
 epoch: 16, train_loss: 1.0333, test_loss: 1.0557, test_f1: 0.4388
 epoch: 17, train_loss: 1.0375, test_loss: 1.0401, test_f1: 0.4313
 epoch: 18, train_loss: 1.0355, test_loss: 1.0369, test_f1: 0.4444
 epoch: 19, train_loss: 1.0232, test_loss: 1.0303, test_f1: 0.4552
 epoch: 20, train_loss: 1.0179, test_loss: 1.0275, test_f1: 0.4493
 epoch: 21, train_loss: 1.0171, test_loss: 1.0248, test_f1: 0.4558
 epoch: 22, train_loss: 1.0116, test_loss: 1.0109, test_f1: 0.4571
 epoch: 23, train_loss: 1.0064, test_loss: 1.0081, test_f1: 0.4636
 epoch: 24, train_loss: 1.0019, test_loss: 1.0028, test_f1: 0.4563
 epoch: 25, train_loss: 0.9980, test_loss: 1.0040, test_f1: 0.4667
 epoch: 26, train_loss: 0.9947, test_loss: 0.9944, test_f1: 0.4684
 epoch: 27, train_loss: 1.0056, test_loss: 0.9903, test_f1: 0.4722
 epoch: 28, train_loss: 0.9976, test_loss: 0.9825, test_f1: 0.4692
 epoch: 29, train_loss: 0.9814, test_loss: 0.9841, test_f1: 0.4602
 epoch: 30, train_loss: 0.9879, test_loss: 0.9888, test_f1: 0.4711
 epoch: 31, train_loss: 0.9789, test_loss: 0.9735, test_f1: 0.4801
 epoch: 32, train_loss: 0.9845, test_loss: 0.9792, test_f1: 0.4749
 epoch: 33, train_loss: 0.9845, test_loss: 0.9698, test_f1: 0.4776
 epoch: 34, train_loss: 0.9712, test_loss: 0.9790, test_f1: 0.4935
 epoch: 35, train_loss: 0.9693, test_loss: 0.9698, test_f1: 0.4782
 epoch: 36, train_loss: 0.9705, test_loss: 0.9751, test_f1: 0.4942
 epoch: 37, train_loss: 0.9726, test_loss: 0.9731, test_f1: 0.4933
 epoch: 38, train_loss: 0.9650, test_loss: 0.9687, test_f1: 0.4991
 epoch: 39, train_loss: 0.9640, test_loss: 0.9688, test_f1: 0.4766
 epoch: 40, train_loss: 0.9670, test_loss: 0.9761, test_f1: 0.4851
 epoch: 41, train_loss: 0.9651, test_loss: 0.9569, test_f1: 0.4781
 epoch: 42, train_loss: 0.9573, test_loss: 0.9624, test_f1: 0.4986
 epoch: 43, train_loss: 0.9657, test_loss: 0.9587, test_f1: 0.4925
 epoch: 44, train_loss: 0.9636, test_loss: 0.9681, test_f1: 0.4942
 epoch: 45, train_loss: 0.9618, test_loss: 0.9691, test_f1: 0.4983
 epoch: 46, train_loss: 0.9659, test_loss: 0.9448, test_f1: 0.4749
 epoch: 47, train_loss: 0.9558, test_loss: 0.9529, test_f1: 0.4975
 epoch: 48, train_loss: 0.9563, test_loss: 0.9588, test_f1: 0.4839
 epoch: 49, train_loss: 0.9512, test_loss: 0.9340, test_f1: 0.4803
 epoch: 50, train_loss: 0.9510, test_loss: 0.9460, test_f1: 0.4906
 epoch: 51, train_loss: 0.9398, test_loss: 0.9328, test_f1: 0.5056
 epoch: 52, train_loss: 0.9455, test_loss: 0.9357, test_f1: 0.4786
 epoch: 53, train_loss: 0.9455, test_loss: 0.9375, test_f1: 0.4947
 epoch: 54, train_loss: 0.9386, test_loss: 0.9407, test_f1: 0.4891
 epoch: 55, train_loss: 0.9441, test_loss: 0.9447, test_f1: 0.4970
 epoch: 56, train_loss: 0.9517, test_loss: 0.9388, test_f1: 0.4947
 epoch: 57, train_loss: 0.9407, test_loss: 0.9420, test_f1: 0.4954
 epoch: 58, train_loss: 0.9411, test_loss: 0.9335, test_f1: 0.5050
 epoch: 59, train_loss: 0.9433, test_loss: 0.9413, test_f1: 0.4745
 epoch: 60, train_loss: 0.9491, test_loss: 0.9392, test_f1: 0.4990
 epoch: 61, train_loss: 0.9480, test_loss: 0.9313, test_f1: 0.5149
 epoch: 62, train_loss: 0.9414, test_loss: 0.9292, test_f1: 0.5089
 epoch: 63, train_loss: 0.9351, test_loss: 0.9277, test_f1: 0.4922
 epoch: 64, train_loss: 0.9454, test_loss: 0.9484, test_f1: 0.4879
 epoch: 65, train_loss: 0.9374, test_loss: 0.9369, test_f1: 0.5116
 epoch: 66, train_loss: 0.9331, test_loss: 0.9335, test_f1: 0.4979
 epoch: 67, train_loss: 0.9364, test_loss: 0.9214, test_f1: 0.4961
 epoch: 68, train_loss: 0.9389, test_loss: 0.9301, test_f1: 0.5083
 epoch: 69, train_loss: 0.9405, test_loss: 0.9288, test_f1: 0.5125
 epoch: 70, train_loss: 0.9337, test_loss: 0.9310, test_f1: 0.5010
 epoch: 71, train_loss: 0.9272, test_loss: 0.9255, test_f1: 0.4982
 epoch: 72, train_loss: 0.9361, test_loss: 0.9253, test_f1: 0.5166
 epoch: 73, train_loss: 0.9282, test_loss: 0.9190, test_f1: 0.4986
 epoch: 74, train_loss: 0.9356, test_loss: 0.9115, test_f1: 0.4985
 epoch: 75, train_loss: 0.9354, test_loss: 0.9301, test_f1: 0.5207
 epoch: 76, train_loss: 0.9283, test_loss: 0.9259, test_f1: 0.5183
 epoch: 77, train_loss: 0.9415, test_loss: 0.9141, test_f1: 0.5035
 epoch: 78, train_loss: 0.9286, test_loss: 0.9179, test_f1: 0.4975
 epoch: 79, train_loss: 0.9328, test_loss: 0.9228, test_f1: 0.4939
 epoch: 80, train_loss: 0.9366, test_loss: 0.9174, test_f1: 0.5029
 epoch: 81, train_loss: 0.9321, test_loss: 0.9199, test_f1: 0.5119
 epoch: 82, train_loss: 0.9356, test_loss: 0.9108, test_f1: 0.5024
 epoch: 83, train_loss: 0.9261, test_loss: 0.9182, test_f1: 0.5108
 epoch: 84, train_loss: 0.9282, test_loss: 0.9208, test_f1: 0.5162
 epoch: 85, train_loss: 0.9167, test_loss: 0.9174, test_f1: 0.5197
 epoch: 86, train_loss: 0.9239, test_loss: 0.9309, test_f1: 0.5188
 epoch: 87, train_loss: 0.9333, test_loss: 0.9144, test_f1: 0.5165
 epoch: 88, train_loss: 0.9269, test_loss: 0.9393, test_f1: 0.5043
 epoch: 89, train_loss: 0.9272, test_loss: 0.9247, test_f1: 0.5193
 epoch: 90, train_loss: 0.9287, test_loss: 0.9164, test_f1: 0.5146
 epoch: 91, train_loss: 0.9268, test_loss: 0.9137, test_f1: 0.5275
 epoch: 92, train_loss: 0.9270, test_loss: 0.9218, test_f1: 0.5249
 epoch: 93, train_loss: 0.9240, test_loss: 0.9265, test_f1: 0.5180
 epoch: 94, train_loss: 0.9197, test_loss: 0.9054, test_f1: 0.5032
 epoch: 95, train_loss: 0.9189, test_loss: 0.9070, test_f1: 0.5049
 epoch: 96, train_loss: 0.9171, test_loss: 0.9138, test_f1: 0.5231
 epoch: 97, train_loss: 0.9235, test_loss: 0.9151, test_f1: 0.5201
 epoch: 98, train_loss: 0.9196, test_loss: 0.9122, test_f1: 0.5225
 epoch: 99, train_loss: 0.9250, test_loss: 0.9138, test_f1: 0.5186
##################ITERATION #5 ****************************************
 epoch: 0, train_loss: 1.2605, test_loss: 1.1518, test_f1: 0.3324
 epoch: 1, train_loss: 1.1915, test_loss: 1.1240, test_f1: 0.3422
 epoch: 2, train_loss: 1.1637, test_loss: 1.1083, test_f1: 0.3443
 epoch: 3, train_loss: 1.1403, test_loss: 1.0980, test_f1: 0.3455
 epoch: 4, train_loss: 1.1270, test_loss: 1.0898, test_f1: 0.3486
 epoch: 5, train_loss: 1.1114, test_loss: 1.0853, test_f1: 0.3631
 epoch: 6, train_loss: 1.1028, test_loss: 1.0750, test_f1: 0.3600
 epoch: 7, train_loss: 1.0904, test_loss: 1.0684, test_f1: 0.3609
 epoch: 8, train_loss: 1.0888, test_loss: 1.0676, test_f1: 0.3631
 epoch: 9, train_loss: 1.0814, test_loss: 1.0647, test_f1: 0.3546
 epoch: 10, train_loss: 1.0782, test_loss: 1.0566, test_f1: 0.3546
 epoch: 11, train_loss: 1.0684, test_loss: 1.0539, test_f1: 0.3545
 epoch: 12, train_loss: 1.0705, test_loss: 1.0500, test_f1: 0.3569
 epoch: 13, train_loss: 1.0583, test_loss: 1.0487, test_f1: 0.3550
 epoch: 14, train_loss: 1.0601, test_loss: 1.0537, test_f1: 0.3543
 epoch: 15, train_loss: 1.0556, test_loss: 1.0446, test_f1: 0.3521
 epoch: 16, train_loss: 1.0508, test_loss: 1.0451, test_f1: 0.3546
 epoch: 17, train_loss: 1.0553, test_loss: 1.0422, test_f1: 0.3562
 epoch: 18, train_loss: 1.0440, test_loss: 1.0390, test_f1: 0.3550
 epoch: 19, train_loss: 1.0491, test_loss: 1.0469, test_f1: 0.3595
 epoch: 20, train_loss: 1.0375, test_loss: 1.0410, test_f1: 0.3670
 epoch: 21, train_loss: 1.0379, test_loss: 1.0356, test_f1: 0.3618
 epoch: 22, train_loss: 1.0364, test_loss: 1.0180, test_f1: 0.3654
 epoch: 23, train_loss: 1.0325, test_loss: 1.0272, test_f1: 0.3704
 epoch: 24, train_loss: 1.0286, test_loss: 1.0271, test_f1: 0.3771
 epoch: 25, train_loss: 1.0297, test_loss: 1.0086, test_f1: 0.3847
 epoch: 26, train_loss: 1.0255, test_loss: 1.0026, test_f1: 0.3896
 epoch: 27, train_loss: 1.0247, test_loss: 1.0049, test_f1: 0.3903
 epoch: 28, train_loss: 1.0114, test_loss: 0.9957, test_f1: 0.3941
 epoch: 29, train_loss: 1.0108, test_loss: 0.9894, test_f1: 0.4109
 epoch: 30, train_loss: 1.0077, test_loss: 1.0000, test_f1: 0.4179
 epoch: 31, train_loss: 1.0096, test_loss: 0.9917, test_f1: 0.4253
 epoch: 32, train_loss: 1.0063, test_loss: 0.9941, test_f1: 0.4220
 epoch: 33, train_loss: 1.0113, test_loss: 0.9898, test_f1: 0.4377
 epoch: 34, train_loss: 1.0012, test_loss: 0.9967, test_f1: 0.4306
 epoch: 35, train_loss: 1.0022, test_loss: 0.9758, test_f1: 0.4507
 epoch: 36, train_loss: 0.9981, test_loss: 0.9700, test_f1: 0.4462
 epoch: 37, train_loss: 0.9953, test_loss: 0.9677, test_f1: 0.4346
 epoch: 38, train_loss: 0.9901, test_loss: 0.9661, test_f1: 0.4684
 epoch: 39, train_loss: 0.9826, test_loss: 0.9652, test_f1: 0.4464
 epoch: 40, train_loss: 0.9883, test_loss: 0.9606, test_f1: 0.4474
 epoch: 41, train_loss: 0.9767, test_loss: 0.9542, test_f1: 0.4564
 epoch: 42, train_loss: 0.9801, test_loss: 0.9657, test_f1: 0.4518
 epoch: 43, train_loss: 0.9745, test_loss: 0.9569, test_f1: 0.4648
 epoch: 44, train_loss: 0.9694, test_loss: 0.9557, test_f1: 0.4730
 epoch: 45, train_loss: 0.9777, test_loss: 0.9485, test_f1: 0.4651
 epoch: 46, train_loss: 0.9765, test_loss: 0.9481, test_f1: 0.4794
 epoch: 47, train_loss: 0.9700, test_loss: 0.9384, test_f1: 0.4823
 epoch: 48, train_loss: 0.9660, test_loss: 0.9478, test_f1: 0.4893
 epoch: 49, train_loss: 0.9573, test_loss: 0.9517, test_f1: 0.4686
 epoch: 50, train_loss: 0.9625, test_loss: 0.9281, test_f1: 0.4793
 epoch: 51, train_loss: 0.9609, test_loss: 0.9369, test_f1: 0.4845
 epoch: 52, train_loss: 0.9600, test_loss: 0.9396, test_f1: 0.4793
 epoch: 53, train_loss: 0.9549, test_loss: 0.9372, test_f1: 0.4823
 epoch: 54, train_loss: 0.9518, test_loss: 0.9308, test_f1: 0.4817
 epoch: 55, train_loss: 0.9526, test_loss: 0.9284, test_f1: 0.4833
 epoch: 56, train_loss: 0.9504, test_loss: 0.9283, test_f1: 0.4921
 epoch: 57, train_loss: 0.9498, test_loss: 0.9312, test_f1: 0.4929
 epoch: 58, train_loss: 0.9484, test_loss: 0.9253, test_f1: 0.4874
 epoch: 59, train_loss: 0.9516, test_loss: 0.9191, test_f1: 0.4847
 epoch: 60, train_loss: 0.9508, test_loss: 0.9262, test_f1: 0.4885
 epoch: 61, train_loss: 0.9546, test_loss: 0.9187, test_f1: 0.4892
 epoch: 62, train_loss: 0.9511, test_loss: 0.9153, test_f1: 0.4890
 epoch: 63, train_loss: 0.9484, test_loss: 0.9143, test_f1: 0.4946
 epoch: 64, train_loss: 0.9544, test_loss: 0.9202, test_f1: 0.4853
 epoch: 65, train_loss: 0.9510, test_loss: 0.9139, test_f1: 0.4914
 epoch: 66, train_loss: 0.9422, test_loss: 0.9180, test_f1: 0.4990
 epoch: 67, train_loss: 0.9494, test_loss: 0.9122, test_f1: 0.5031
 epoch: 68, train_loss: 0.9411, test_loss: 0.9186, test_f1: 0.4915
 epoch: 69, train_loss: 0.9391, test_loss: 0.9141, test_f1: 0.4988
 epoch: 70, train_loss: 0.9423, test_loss: 0.9092, test_f1: 0.5057
 epoch: 71, train_loss: 0.9435, test_loss: 0.9122, test_f1: 0.5010
 epoch: 72, train_loss: 0.9396, test_loss: 0.9084, test_f1: 0.4989
 epoch: 73, train_loss: 0.9323, test_loss: 0.9091, test_f1: 0.5003
 epoch: 74, train_loss: 0.9386, test_loss: 0.9055, test_f1: 0.5108
 epoch: 75, train_loss: 0.9364, test_loss: 0.9095, test_f1: 0.4941
 epoch: 76, train_loss: 0.9395, test_loss: 0.9105, test_f1: 0.5029
 epoch: 77, train_loss: 0.9434, test_loss: 0.9131, test_f1: 0.4965
 epoch: 78, train_loss: 0.9335, test_loss: 0.9058, test_f1: 0.5007
 epoch: 79, train_loss: 0.9359, test_loss: 0.9010, test_f1: 0.5048
 epoch: 80, train_loss: 0.9306, test_loss: 0.9041, test_f1: 0.5041
 epoch: 81, train_loss: 0.9308, test_loss: 0.8983, test_f1: 0.5168
 epoch: 82, train_loss: 0.9341, test_loss: 0.9079, test_f1: 0.5096
 epoch: 83, train_loss: 0.9302, test_loss: 0.9050, test_f1: 0.5130
 epoch: 84, train_loss: 0.9209, test_loss: 0.9012, test_f1: 0.4987
 epoch: 85, train_loss: 0.9256, test_loss: 0.9039, test_f1: 0.5104
 epoch: 86, train_loss: 0.9232, test_loss: 0.9023, test_f1: 0.5114
 epoch: 87, train_loss: 0.9229, test_loss: 0.9010, test_f1: 0.5120
 epoch: 88, train_loss: 0.9310, test_loss: 0.9043, test_f1: 0.5036
 epoch: 89, train_loss: 0.9305, test_loss: 0.9055, test_f1: 0.4984
 epoch: 90, train_loss: 0.9207, test_loss: 0.9076, test_f1: 0.5036
 epoch: 91, train_loss: 0.9188, test_loss: 0.8981, test_f1: 0.5086
 epoch: 92, train_loss: 0.9227, test_loss: 0.9034, test_f1: 0.5065
 epoch: 93, train_loss: 0.9262, test_loss: 0.9005, test_f1: 0.5091
 epoch: 94, train_loss: 0.9233, test_loss: 0.8960, test_f1: 0.5068
 epoch: 95, train_loss: 0.9186, test_loss: 0.8944, test_f1: 0.5077
 epoch: 96, train_loss: 0.9225, test_loss: 0.8979, test_f1: 0.5239
 epoch: 97, train_loss: 0.9194, test_loss: 0.8966, test_f1: 0.5164
 epoch: 98, train_loss: 0.9175, test_loss: 0.9025, test_f1: 0.4916
 epoch: 99, train_loss: 0.9217, test_loss: 0.8959, test_f1: 0.5010
##################ITERATION #6 ****************************************
 epoch: 0, train_loss: 1.3078, test_loss: 1.1962, test_f1: 0.2512
 epoch: 1, train_loss: 1.2195, test_loss: 1.1472, test_f1: 0.3347
 epoch: 2, train_loss: 1.1823, test_loss: 1.1167, test_f1: 0.3529
 epoch: 3, train_loss: 1.1643, test_loss: 1.0990, test_f1: 0.3663
 epoch: 4, train_loss: 1.1445, test_loss: 1.0869, test_f1: 0.3631
 epoch: 5, train_loss: 1.1322, test_loss: 1.0750, test_f1: 0.3721
 epoch: 6, train_loss: 1.1127, test_loss: 1.0598, test_f1: 0.3797
 epoch: 7, train_loss: 1.1048, test_loss: 1.0481, test_f1: 0.3915
 epoch: 8, train_loss: 1.0931, test_loss: 1.0409, test_f1: 0.4012
 epoch: 9, train_loss: 1.0834, test_loss: 1.0522, test_f1: 0.4071
 epoch: 10, train_loss: 1.0741, test_loss: 1.0335, test_f1: 0.4090
 epoch: 11, train_loss: 1.0702, test_loss: 1.0241, test_f1: 0.4111
 epoch: 12, train_loss: 1.0551, test_loss: 1.0173, test_f1: 0.4330
 epoch: 13, train_loss: 1.0515, test_loss: 1.0025, test_f1: 0.4403
 epoch: 14, train_loss: 1.0432, test_loss: 1.0124, test_f1: 0.4233
 epoch: 15, train_loss: 1.0383, test_loss: 0.9984, test_f1: 0.4313
 epoch: 16, train_loss: 1.0339, test_loss: 0.9926, test_f1: 0.4379
 epoch: 17, train_loss: 1.0300, test_loss: 0.9820, test_f1: 0.4678
 epoch: 18, train_loss: 1.0221, test_loss: 0.9818, test_f1: 0.4639
 epoch: 19, train_loss: 1.0252, test_loss: 0.9870, test_f1: 0.4393
 epoch: 20, train_loss: 1.0207, test_loss: 0.9805, test_f1: 0.4804
 epoch: 21, train_loss: 1.0177, test_loss: 0.9730, test_f1: 0.4617
 epoch: 22, train_loss: 1.0113, test_loss: 0.9677, test_f1: 0.4735
 epoch: 23, train_loss: 1.0136, test_loss: 0.9735, test_f1: 0.4666
 epoch: 24, train_loss: 1.0050, test_loss: 0.9647, test_f1: 0.4698
 epoch: 25, train_loss: 1.0059, test_loss: 0.9632, test_f1: 0.4709
 epoch: 26, train_loss: 1.0026, test_loss: 0.9655, test_f1: 0.4534
 epoch: 27, train_loss: 1.0048, test_loss: 0.9605, test_f1: 0.4649
 epoch: 28, train_loss: 0.9992, test_loss: 0.9491, test_f1: 0.4972
 epoch: 29, train_loss: 0.9883, test_loss: 0.9571, test_f1: 0.4707
 epoch: 30, train_loss: 0.9826, test_loss: 0.9609, test_f1: 0.4926
 epoch: 31, train_loss: 0.9931, test_loss: 0.9560, test_f1: 0.4839
 epoch: 32, train_loss: 0.9920, test_loss: 0.9508, test_f1: 0.4800
 epoch: 33, train_loss: 0.9858, test_loss: 0.9387, test_f1: 0.5053
 epoch: 34, train_loss: 0.9860, test_loss: 0.9378, test_f1: 0.4995
 epoch: 35, train_loss: 0.9819, test_loss: 0.9310, test_f1: 0.5088
 epoch: 36, train_loss: 0.9791, test_loss: 0.9304, test_f1: 0.5021
 epoch: 37, train_loss: 0.9660, test_loss: 0.9292, test_f1: 0.4884
 epoch: 38, train_loss: 0.9712, test_loss: 0.9302, test_f1: 0.5061
 epoch: 39, train_loss: 0.9724, test_loss: 0.9290, test_f1: 0.4971
 epoch: 40, train_loss: 0.9653, test_loss: 0.9227, test_f1: 0.5085
 epoch: 41, train_loss: 0.9746, test_loss: 0.9226, test_f1: 0.5077
 epoch: 42, train_loss: 0.9725, test_loss: 0.9315, test_f1: 0.5086
 epoch: 43, train_loss: 0.9667, test_loss: 0.9210, test_f1: 0.5099
 epoch: 44, train_loss: 0.9717, test_loss: 0.9169, test_f1: 0.4932
 epoch: 45, train_loss: 0.9564, test_loss: 0.9096, test_f1: 0.5003
 epoch: 46, train_loss: 0.9604, test_loss: 0.9146, test_f1: 0.5100
 epoch: 47, train_loss: 0.9570, test_loss: 0.9071, test_f1: 0.5139
 epoch: 48, train_loss: 0.9613, test_loss: 0.9041, test_f1: 0.5141
 epoch: 49, train_loss: 0.9611, test_loss: 0.8937, test_f1: 0.5189
 epoch: 50, train_loss: 0.9504, test_loss: 0.9065, test_f1: 0.5076
 epoch: 51, train_loss: 0.9492, test_loss: 0.8943, test_f1: 0.5176
 epoch: 52, train_loss: 0.9548, test_loss: 0.8973, test_f1: 0.5180
 epoch: 53, train_loss: 0.9512, test_loss: 0.8999, test_f1: 0.5075
 epoch: 54, train_loss: 0.9476, test_loss: 0.8960, test_f1: 0.5055
 epoch: 55, train_loss: 0.9469, test_loss: 0.8920, test_f1: 0.5113
 epoch: 56, train_loss: 0.9551, test_loss: 0.8923, test_f1: 0.5216
 epoch: 57, train_loss: 0.9427, test_loss: 0.8928, test_f1: 0.5109
 epoch: 58, train_loss: 0.9518, test_loss: 0.8945, test_f1: 0.5206
 epoch: 59, train_loss: 0.9466, test_loss: 0.8938, test_f1: 0.5071
 epoch: 60, train_loss: 0.9445, test_loss: 0.8933, test_f1: 0.5259
 epoch: 61, train_loss: 0.9493, test_loss: 0.8890, test_f1: 0.5154
 epoch: 62, train_loss: 0.9381, test_loss: 0.8868, test_f1: 0.5260
 epoch: 63, train_loss: 0.9452, test_loss: 0.8855, test_f1: 0.5262
 epoch: 64, train_loss: 0.9423, test_loss: 0.8903, test_f1: 0.5221
 epoch: 65, train_loss: 0.9467, test_loss: 0.8896, test_f1: 0.5111
 epoch: 66, train_loss: 0.9412, test_loss: 0.8901, test_f1: 0.5242
 epoch: 67, train_loss: 0.9450, test_loss: 0.8860, test_f1: 0.5260
 epoch: 68, train_loss: 0.9405, test_loss: 0.8896, test_f1: 0.5182
 epoch: 69, train_loss: 0.9426, test_loss: 0.8888, test_f1: 0.5219
 epoch: 70, train_loss: 0.9319, test_loss: 0.8839, test_f1: 0.5228
 epoch: 71, train_loss: 0.9368, test_loss: 0.8824, test_f1: 0.5119
 epoch: 72, train_loss: 0.9368, test_loss: 0.8823, test_f1: 0.5229
 epoch: 73, train_loss: 0.9383, test_loss: 0.8915, test_f1: 0.5088
 epoch: 74, train_loss: 0.9269, test_loss: 0.8842, test_f1: 0.5166
 epoch: 75, train_loss: 0.9394, test_loss: 0.8857, test_f1: 0.5151
 epoch: 76, train_loss: 0.9398, test_loss: 0.8812, test_f1: 0.5062
 epoch: 77, train_loss: 0.9342, test_loss: 0.8789, test_f1: 0.5282
 epoch: 78, train_loss: 0.9505, test_loss: 0.8847, test_f1: 0.5045
 epoch: 79, train_loss: 0.9472, test_loss: 0.8799, test_f1: 0.5126
 epoch: 80, train_loss: 0.9362, test_loss: 0.8837, test_f1: 0.5098
 epoch: 81, train_loss: 0.9371, test_loss: 0.8824, test_f1: 0.5184
 epoch: 82, train_loss: 0.9327, test_loss: 0.8769, test_f1: 0.5296
 epoch: 83, train_loss: 0.9269, test_loss: 0.8796, test_f1: 0.5144
 epoch: 84, train_loss: 0.9409, test_loss: 0.8802, test_f1: 0.5260
 epoch: 85, train_loss: 0.9365, test_loss: 0.8765, test_f1: 0.5286
 epoch: 86, train_loss: 0.9352, test_loss: 0.8741, test_f1: 0.5246
 epoch: 87, train_loss: 0.9267, test_loss: 0.8764, test_f1: 0.5229
 epoch: 88, train_loss: 0.9221, test_loss: 0.8772, test_f1: 0.5191
 epoch: 89, train_loss: 0.9247, test_loss: 0.8785, test_f1: 0.5222
 epoch: 90, train_loss: 0.9212, test_loss: 0.8823, test_f1: 0.5153
 epoch: 91, train_loss: 0.9249, test_loss: 0.8734, test_f1: 0.5167
 epoch: 92, train_loss: 0.9200, test_loss: 0.8748, test_f1: 0.5297
 epoch: 93, train_loss: 0.9123, test_loss: 0.8800, test_f1: 0.5194
 epoch: 94, train_loss: 0.9267, test_loss: 0.8711, test_f1: 0.5116
 epoch: 95, train_loss: 0.9199, test_loss: 0.8706, test_f1: 0.5301
 epoch: 96, train_loss: 0.9225, test_loss: 0.8713, test_f1: 0.5163
 epoch: 97, train_loss: 0.9275, test_loss: 0.8695, test_f1: 0.5231
 epoch: 98, train_loss: 0.9203, test_loss: 0.8771, test_f1: 0.5159
 epoch: 99, train_loss: 0.9132, test_loss: 0.8775, test_f1: 0.5190
##################ITERATION #7 ****************************************
 epoch: 0, train_loss: 1.3304, test_loss: 1.2409, test_f1: 0.2819
 epoch: 1, train_loss: 1.2228, test_loss: 1.1740, test_f1: 0.3088
 epoch: 2, train_loss: 1.1949, test_loss: 1.1342, test_f1: 0.3310
 epoch: 3, train_loss: 1.1636, test_loss: 1.1142, test_f1: 0.3472
 epoch: 4, train_loss: 1.1413, test_loss: 1.0925, test_f1: 0.3492
 epoch: 5, train_loss: 1.1171, test_loss: 1.0784, test_f1: 0.3501
 epoch: 6, train_loss: 1.1063, test_loss: 1.0728, test_f1: 0.3581
 epoch: 7, train_loss: 1.0933, test_loss: 1.0616, test_f1: 0.3822
 epoch: 8, train_loss: 1.0833, test_loss: 1.0545, test_f1: 0.3832
 epoch: 9, train_loss: 1.0736, test_loss: 1.0483, test_f1: 0.3802
 epoch: 10, train_loss: 1.0641, test_loss: 1.0468, test_f1: 0.3878
 epoch: 11, train_loss: 1.0643, test_loss: 1.0364, test_f1: 0.4001
 epoch: 12, train_loss: 1.0555, test_loss: 1.0344, test_f1: 0.4073
 epoch: 13, train_loss: 1.0461, test_loss: 1.0303, test_f1: 0.3972
 epoch: 14, train_loss: 1.0427, test_loss: 1.0225, test_f1: 0.4494
 epoch: 15, train_loss: 1.0363, test_loss: 1.0398, test_f1: 0.4194
 epoch: 16, train_loss: 1.0345, test_loss: 1.0227, test_f1: 0.4618
 epoch: 17, train_loss: 1.0304, test_loss: 1.0200, test_f1: 0.4487
 epoch: 18, train_loss: 1.0185, test_loss: 1.0110, test_f1: 0.4684
 epoch: 19, train_loss: 1.0167, test_loss: 1.0098, test_f1: 0.4839
 epoch: 20, train_loss: 1.0225, test_loss: 1.0186, test_f1: 0.4921
 epoch: 21, train_loss: 1.0118, test_loss: 1.0156, test_f1: 0.4733
 epoch: 22, train_loss: 1.0028, test_loss: 1.0082, test_f1: 0.4655
 epoch: 23, train_loss: 1.0081, test_loss: 0.9960, test_f1: 0.4924
 epoch: 24, train_loss: 1.0021, test_loss: 1.0031, test_f1: 0.4733
 epoch: 25, train_loss: 0.9999, test_loss: 0.9939, test_f1: 0.4730
 epoch: 26, train_loss: 0.9948, test_loss: 0.9948, test_f1: 0.4814
 epoch: 27, train_loss: 0.9920, test_loss: 0.9975, test_f1: 0.4797
 epoch: 28, train_loss: 0.9904, test_loss: 0.9940, test_f1: 0.4908
 epoch: 29, train_loss: 0.9863, test_loss: 0.9856, test_f1: 0.4856
 epoch: 30, train_loss: 0.9824, test_loss: 0.9797, test_f1: 0.4761
 epoch: 31, train_loss: 0.9799, test_loss: 0.9895, test_f1: 0.4669
 epoch: 32, train_loss: 0.9770, test_loss: 0.9787, test_f1: 0.4791
 epoch: 33, train_loss: 0.9800, test_loss: 0.9859, test_f1: 0.4897
 epoch: 34, train_loss: 0.9898, test_loss: 0.9811, test_f1: 0.4732
 epoch: 35, train_loss: 0.9786, test_loss: 0.9775, test_f1: 0.4845
 epoch: 36, train_loss: 0.9784, test_loss: 0.9835, test_f1: 0.4881
 epoch: 37, train_loss: 0.9780, test_loss: 0.9851, test_f1: 0.4922
 epoch: 38, train_loss: 0.9689, test_loss: 0.9826, test_f1: 0.5009
 epoch: 39, train_loss: 0.9736, test_loss: 0.9794, test_f1: 0.4967
 epoch: 40, train_loss: 0.9726, test_loss: 0.9749, test_f1: 0.4967
 epoch: 41, train_loss: 0.9717, test_loss: 0.9686, test_f1: 0.4870
 epoch: 42, train_loss: 0.9681, test_loss: 0.9688, test_f1: 0.4889
 epoch: 43, train_loss: 0.9647, test_loss: 0.9705, test_f1: 0.4956
 epoch: 44, train_loss: 0.9610, test_loss: 0.9706, test_f1: 0.4851
 epoch: 45, train_loss: 0.9574, test_loss: 0.9726, test_f1: 0.4869
 epoch: 46, train_loss: 0.9600, test_loss: 0.9609, test_f1: 0.4935
 epoch: 47, train_loss: 0.9597, test_loss: 0.9678, test_f1: 0.4877
 epoch: 48, train_loss: 0.9538, test_loss: 0.9682, test_f1: 0.4821
 epoch: 49, train_loss: 0.9456, test_loss: 0.9597, test_f1: 0.4862
 epoch: 50, train_loss: 0.9507, test_loss: 0.9586, test_f1: 0.4963
 epoch: 51, train_loss: 0.9560, test_loss: 0.9597, test_f1: 0.4916
 epoch: 52, train_loss: 0.9420, test_loss: 0.9659, test_f1: 0.4984
 epoch: 53, train_loss: 0.9420, test_loss: 0.9591, test_f1: 0.4930
 epoch: 54, train_loss: 0.9495, test_loss: 0.9666, test_f1: 0.4987
 epoch: 55, train_loss: 0.9438, test_loss: 0.9591, test_f1: 0.4894
 epoch: 56, train_loss: 0.9455, test_loss: 0.9602, test_f1: 0.4894
 epoch: 57, train_loss: 0.9363, test_loss: 0.9617, test_f1: 0.4934
 epoch: 58, train_loss: 0.9430, test_loss: 0.9480, test_f1: 0.4941
 epoch: 59, train_loss: 0.9416, test_loss: 0.9548, test_f1: 0.4969
 epoch: 60, train_loss: 0.9497, test_loss: 0.9561, test_f1: 0.4983
 epoch: 61, train_loss: 0.9378, test_loss: 0.9402, test_f1: 0.4951
 epoch: 62, train_loss: 0.9383, test_loss: 0.9559, test_f1: 0.5013
 epoch: 63, train_loss: 0.9393, test_loss: 0.9536, test_f1: 0.5036
 epoch: 64, train_loss: 0.9407, test_loss: 0.9494, test_f1: 0.4916
 epoch: 65, train_loss: 0.9373, test_loss: 0.9508, test_f1: 0.5027
 epoch: 66, train_loss: 0.9270, test_loss: 0.9446, test_f1: 0.5073
 epoch: 67, train_loss: 0.9425, test_loss: 0.9485, test_f1: 0.5027
 epoch: 68, train_loss: 0.9317, test_loss: 0.9394, test_f1: 0.5008
 epoch: 69, train_loss: 0.9397, test_loss: 0.9492, test_f1: 0.5027
 epoch: 70, train_loss: 0.9394, test_loss: 0.9579, test_f1: 0.5055
 epoch: 71, train_loss: 0.9318, test_loss: 0.9480, test_f1: 0.5020
 epoch: 72, train_loss: 0.9366, test_loss: 0.9502, test_f1: 0.4958
 epoch: 73, train_loss: 0.9254, test_loss: 0.9431, test_f1: 0.4988
 epoch: 74, train_loss: 0.9269, test_loss: 0.9559, test_f1: 0.4945
 epoch: 75, train_loss: 0.9313, test_loss: 0.9363, test_f1: 0.4862
 epoch: 76, train_loss: 0.9210, test_loss: 0.9451, test_f1: 0.4923
 epoch: 77, train_loss: 0.9330, test_loss: 0.9371, test_f1: 0.4988
 epoch: 78, train_loss: 0.9242, test_loss: 0.9435, test_f1: 0.4961
 epoch: 79, train_loss: 0.9286, test_loss: 0.9305, test_f1: 0.4950
 epoch: 80, train_loss: 0.9196, test_loss: 0.9375, test_f1: 0.4874
 epoch: 81, train_loss: 0.9286, test_loss: 0.9409, test_f1: 0.4984
 epoch: 82, train_loss: 0.9159, test_loss: 0.9258, test_f1: 0.4953
 epoch: 83, train_loss: 0.9263, test_loss: 0.9404, test_f1: 0.4918
 epoch: 84, train_loss: 0.9219, test_loss: 0.9333, test_f1: 0.5023
 epoch: 85, train_loss: 0.9195, test_loss: 0.9301, test_f1: 0.4915
 epoch: 86, train_loss: 0.9251, test_loss: 0.9370, test_f1: 0.4925
 epoch: 87, train_loss: 0.9227, test_loss: 0.9423, test_f1: 0.4987
 epoch: 88, train_loss: 0.9236, test_loss: 0.9390, test_f1: 0.5011
 epoch: 89, train_loss: 0.9200, test_loss: 0.9408, test_f1: 0.4956
 epoch: 90, train_loss: 0.9111, test_loss: 0.9400, test_f1: 0.5029
 epoch: 91, train_loss: 0.9103, test_loss: 0.9385, test_f1: 0.4952
 epoch: 92, train_loss: 0.9226, test_loss: 0.9435, test_f1: 0.5077
 epoch: 93, train_loss: 0.9240, test_loss: 0.9252, test_f1: 0.5067
 epoch: 94, train_loss: 0.9095, test_loss: 0.9266, test_f1: 0.5215
 epoch: 95, train_loss: 0.9181, test_loss: 0.9237, test_f1: 0.5108
 epoch: 96, train_loss: 0.9038, test_loss: 0.9279, test_f1: 0.5176
 epoch: 97, train_loss: 0.9209, test_loss: 0.9268, test_f1: 0.5091
 epoch: 98, train_loss: 0.9178, test_loss: 0.9236, test_f1: 0.5008
 epoch: 99, train_loss: 0.9172, test_loss: 0.9265, test_f1: 0.5063
##################ITERATION #8 ****************************************
 epoch: 0, train_loss: 1.3481, test_loss: 1.2144, test_f1: 0.3032
 epoch: 1, train_loss: 1.2401, test_loss: 1.1916, test_f1: 0.3148
 epoch: 2, train_loss: 1.2230, test_loss: 1.1684, test_f1: 0.3125
 epoch: 3, train_loss: 1.1879, test_loss: 1.1399, test_f1: 0.3448
 epoch: 4, train_loss: 1.1785, test_loss: 1.1202, test_f1: 0.3359
 epoch: 5, train_loss: 1.1595, test_loss: 1.1148, test_f1: 0.3385
 epoch: 6, train_loss: 1.1519, test_loss: 1.0968, test_f1: 0.3486
 epoch: 7, train_loss: 1.1455, test_loss: 1.0771, test_f1: 0.3604
 epoch: 8, train_loss: 1.1303, test_loss: 1.0633, test_f1: 0.3744
 epoch: 9, train_loss: 1.1173, test_loss: 1.0573, test_f1: 0.3755
 epoch: 10, train_loss: 1.0972, test_loss: 1.0426, test_f1: 0.3888
 epoch: 11, train_loss: 1.1008, test_loss: 1.0387, test_f1: 0.3965
 epoch: 12, train_loss: 1.0825, test_loss: 1.0303, test_f1: 0.4008
 epoch: 13, train_loss: 1.0801, test_loss: 1.0205, test_f1: 0.4125
 epoch: 14, train_loss: 1.0750, test_loss: 1.0207, test_f1: 0.4084
 epoch: 15, train_loss: 1.0751, test_loss: 1.0117, test_f1: 0.4110
 epoch: 16, train_loss: 1.0613, test_loss: 1.0078, test_f1: 0.4243
 epoch: 17, train_loss: 1.0499, test_loss: 1.0012, test_f1: 0.4408
 epoch: 18, train_loss: 1.0443, test_loss: 1.0019, test_f1: 0.4256
 epoch: 19, train_loss: 1.0409, test_loss: 1.0001, test_f1: 0.4475
 epoch: 20, train_loss: 1.0416, test_loss: 0.9931, test_f1: 0.4451
 epoch: 21, train_loss: 1.0346, test_loss: 0.9987, test_f1: 0.4540
 epoch: 22, train_loss: 1.0234, test_loss: 0.9913, test_f1: 0.4491
 epoch: 23, train_loss: 1.0270, test_loss: 0.9956, test_f1: 0.4622
 epoch: 24, train_loss: 1.0164, test_loss: 0.9801, test_f1: 0.4733
 epoch: 25, train_loss: 1.0110, test_loss: 0.9821, test_f1: 0.4569
 epoch: 26, train_loss: 1.0089, test_loss: 0.9820, test_f1: 0.4714
 epoch: 27, train_loss: 1.0055, test_loss: 0.9757, test_f1: 0.4650
 epoch: 28, train_loss: 1.0020, test_loss: 0.9746, test_f1: 0.4692
 epoch: 29, train_loss: 0.9997, test_loss: 0.9688, test_f1: 0.4760
 epoch: 30, train_loss: 0.9940, test_loss: 0.9777, test_f1: 0.4713
 epoch: 31, train_loss: 0.9935, test_loss: 0.9656, test_f1: 0.4838
 epoch: 32, train_loss: 0.9828, test_loss: 0.9600, test_f1: 0.4842
 epoch: 33, train_loss: 0.9988, test_loss: 0.9570, test_f1: 0.4703
 epoch: 34, train_loss: 0.9881, test_loss: 0.9640, test_f1: 0.4820
 epoch: 35, train_loss: 0.9843, test_loss: 0.9561, test_f1: 0.4844
 epoch: 36, train_loss: 0.9914, test_loss: 0.9520, test_f1: 0.4897
 epoch: 37, train_loss: 0.9844, test_loss: 0.9472, test_f1: 0.4986
 epoch: 38, train_loss: 0.9757, test_loss: 0.9508, test_f1: 0.4826
 epoch: 39, train_loss: 0.9819, test_loss: 0.9462, test_f1: 0.4937
 epoch: 40, train_loss: 0.9704, test_loss: 0.9445, test_f1: 0.4865
 epoch: 41, train_loss: 0.9784, test_loss: 0.9333, test_f1: 0.5009
 epoch: 42, train_loss: 0.9696, test_loss: 0.9544, test_f1: 0.4833
 epoch: 43, train_loss: 0.9642, test_loss: 0.9380, test_f1: 0.4992
 epoch: 44, train_loss: 0.9672, test_loss: 0.9364, test_f1: 0.4988
 epoch: 45, train_loss: 0.9732, test_loss: 0.9463, test_f1: 0.4980
 epoch: 46, train_loss: 0.9646, test_loss: 0.9465, test_f1: 0.4906
 epoch: 47, train_loss: 0.9556, test_loss: 0.9393, test_f1: 0.4876
 epoch: 48, train_loss: 0.9521, test_loss: 0.9283, test_f1: 0.5039
 epoch: 49, train_loss: 0.9581, test_loss: 0.9261, test_f1: 0.5008
 epoch: 50, train_loss: 0.9639, test_loss: 0.9295, test_f1: 0.5041
 epoch: 51, train_loss: 0.9553, test_loss: 0.9271, test_f1: 0.5049
 epoch: 52, train_loss: 0.9606, test_loss: 0.9268, test_f1: 0.5115
 epoch: 53, train_loss: 0.9570, test_loss: 0.9263, test_f1: 0.5032
 epoch: 54, train_loss: 0.9576, test_loss: 0.9257, test_f1: 0.5039
 epoch: 55, train_loss: 0.9593, test_loss: 0.9342, test_f1: 0.5006
 epoch: 56, train_loss: 0.9541, test_loss: 0.9362, test_f1: 0.4996
 epoch: 57, train_loss: 0.9548, test_loss: 0.9271, test_f1: 0.5018
 epoch: 58, train_loss: 0.9523, test_loss: 0.9253, test_f1: 0.4996
 epoch: 59, train_loss: 0.9523, test_loss: 0.9250, test_f1: 0.4919
 epoch: 60, train_loss: 0.9402, test_loss: 0.9249, test_f1: 0.5003
 epoch: 61, train_loss: 0.9498, test_loss: 0.9202, test_f1: 0.5049
 epoch: 62, train_loss: 0.9517, test_loss: 0.9263, test_f1: 0.4982
 epoch: 63, train_loss: 0.9428, test_loss: 0.9284, test_f1: 0.5046
 epoch: 64, train_loss: 0.9416, test_loss: 0.9226, test_f1: 0.5031
 epoch: 65, train_loss: 0.9491, test_loss: 0.9300, test_f1: 0.4955
 epoch: 66, train_loss: 0.9483, test_loss: 0.9351, test_f1: 0.4893
 epoch: 67, train_loss: 0.9444, test_loss: 0.9322, test_f1: 0.5013
 epoch: 68, train_loss: 0.9589, test_loss: 0.9191, test_f1: 0.4993
 epoch: 69, train_loss: 0.9383, test_loss: 0.9241, test_f1: 0.4913
 epoch: 70, train_loss: 0.9390, test_loss: 0.9251, test_f1: 0.5046
 epoch: 71, train_loss: 0.9349, test_loss: 0.9239, test_f1: 0.5128
 epoch: 72, train_loss: 0.9471, test_loss: 0.9222, test_f1: 0.5058
 epoch: 73, train_loss: 0.9409, test_loss: 0.9184, test_f1: 0.5020
 epoch: 74, train_loss: 0.9373, test_loss: 0.9200, test_f1: 0.5030
 epoch: 75, train_loss: 0.9412, test_loss: 0.9138, test_f1: 0.5099
 epoch: 76, train_loss: 0.9468, test_loss: 0.9231, test_f1: 0.5121
 epoch: 77, train_loss: 0.9421, test_loss: 0.9163, test_f1: 0.5069
 epoch: 78, train_loss: 0.9393, test_loss: 0.9250, test_f1: 0.5071
 epoch: 79, train_loss: 0.9332, test_loss: 0.9180, test_f1: 0.5087
 epoch: 80, train_loss: 0.9384, test_loss: 0.9219, test_f1: 0.5071
 epoch: 81, train_loss: 0.9369, test_loss: 0.9283, test_f1: 0.5118
 epoch: 82, train_loss: 0.9358, test_loss: 0.9188, test_f1: 0.5083
 epoch: 83, train_loss: 0.9391, test_loss: 0.9230, test_f1: 0.4927
 epoch: 84, train_loss: 0.9406, test_loss: 0.9164, test_f1: 0.5100
 epoch: 85, train_loss: 0.9309, test_loss: 0.9174, test_f1: 0.5034
 epoch: 86, train_loss: 0.9389, test_loss: 0.9075, test_f1: 0.5089
 epoch: 87, train_loss: 0.9364, test_loss: 0.9179, test_f1: 0.5102
 epoch: 88, train_loss: 0.9400, test_loss: 0.9293, test_f1: 0.5145
 epoch: 89, train_loss: 0.9402, test_loss: 0.9198, test_f1: 0.5158
 epoch: 90, train_loss: 0.9263, test_loss: 0.9208, test_f1: 0.5107
 epoch: 91, train_loss: 0.9286, test_loss: 0.9064, test_f1: 0.5011
 epoch: 92, train_loss: 0.9360, test_loss: 0.9097, test_f1: 0.5122
 epoch: 93, train_loss: 0.9455, test_loss: 0.9115, test_f1: 0.5063
 epoch: 94, train_loss: 0.9248, test_loss: 0.9157, test_f1: 0.5069
 epoch: 95, train_loss: 0.9389, test_loss: 0.9077, test_f1: 0.5116
 epoch: 96, train_loss: 0.9304, test_loss: 0.9026, test_f1: 0.5066
 epoch: 97, train_loss: 0.9300, test_loss: 0.9085, test_f1: 0.5038
 epoch: 98, train_loss: 0.9347, test_loss: 0.9085, test_f1: 0.5090
 epoch: 99, train_loss: 0.9304, test_loss: 0.9044, test_f1: 0.5213
##################ITERATION #9 ****************************************
 epoch: 0, train_loss: 1.3250, test_loss: 1.1830, test_f1: 0.2926
 epoch: 1, train_loss: 1.2218, test_loss: 1.1405, test_f1: 0.3379
 epoch: 2, train_loss: 1.1895, test_loss: 1.1208, test_f1: 0.3680
 epoch: 3, train_loss: 1.1542, test_loss: 1.0909, test_f1: 0.4138
 epoch: 4, train_loss: 1.1438, test_loss: 1.0785, test_f1: 0.4119
 epoch: 5, train_loss: 1.1340, test_loss: 1.0608, test_f1: 0.4160
 epoch: 6, train_loss: 1.1148, test_loss: 1.0399, test_f1: 0.4311
 epoch: 7, train_loss: 1.1023, test_loss: 1.0332, test_f1: 0.4376
 epoch: 8, train_loss: 1.0981, test_loss: 1.0245, test_f1: 0.4316
 epoch: 9, train_loss: 1.0892, test_loss: 1.0198, test_f1: 0.4324
 epoch: 10, train_loss: 1.0800, test_loss: 1.0033, test_f1: 0.4414
 epoch: 11, train_loss: 1.0659, test_loss: 1.0026, test_f1: 0.4358
 epoch: 12, train_loss: 1.0585, test_loss: 0.9976, test_f1: 0.4371
 epoch: 13, train_loss: 1.0560, test_loss: 0.9997, test_f1: 0.4437
 epoch: 14, train_loss: 1.0402, test_loss: 0.9878, test_f1: 0.4442
 epoch: 15, train_loss: 1.0442, test_loss: 0.9862, test_f1: 0.4438
 epoch: 16, train_loss: 1.0398, test_loss: 0.9753, test_f1: 0.4457
 epoch: 17, train_loss: 1.0405, test_loss: 0.9752, test_f1: 0.4491
 epoch: 18, train_loss: 1.0365, test_loss: 0.9724, test_f1: 0.4578
 epoch: 19, train_loss: 1.0329, test_loss: 0.9701, test_f1: 0.4562
 epoch: 20, train_loss: 1.0211, test_loss: 0.9677, test_f1: 0.4547
 epoch: 21, train_loss: 1.0249, test_loss: 0.9696, test_f1: 0.4475
 epoch: 22, train_loss: 1.0196, test_loss: 0.9634, test_f1: 0.4708
 epoch: 23, train_loss: 1.0115, test_loss: 0.9623, test_f1: 0.4709
 epoch: 24, train_loss: 1.0082, test_loss: 0.9593, test_f1: 0.4658
 epoch: 25, train_loss: 1.0117, test_loss: 0.9573, test_f1: 0.4803
 epoch: 26, train_loss: 0.9959, test_loss: 0.9578, test_f1: 0.4851
 epoch: 27, train_loss: 0.9997, test_loss: 0.9552, test_f1: 0.4826
 epoch: 28, train_loss: 1.0026, test_loss: 0.9545, test_f1: 0.4586
 epoch: 29, train_loss: 0.9869, test_loss: 0.9501, test_f1: 0.4811
 epoch: 30, train_loss: 0.9881, test_loss: 0.9519, test_f1: 0.4686
 epoch: 31, train_loss: 0.9995, test_loss: 0.9519, test_f1: 0.4631
 epoch: 32, train_loss: 0.9848, test_loss: 0.9416, test_f1: 0.4862
 epoch: 33, train_loss: 0.9823, test_loss: 0.9468, test_f1: 0.4802
 epoch: 34, train_loss: 0.9749, test_loss: 0.9441, test_f1: 0.4943
 epoch: 35, train_loss: 0.9816, test_loss: 0.9350, test_f1: 0.5005
 epoch: 36, train_loss: 0.9810, test_loss: 0.9350, test_f1: 0.4930
 epoch: 37, train_loss: 0.9698, test_loss: 0.9409, test_f1: 0.4943
 epoch: 38, train_loss: 0.9734, test_loss: 0.9363, test_f1: 0.5002
 epoch: 39, train_loss: 0.9683, test_loss: 0.9435, test_f1: 0.4889
 epoch: 40, train_loss: 0.9816, test_loss: 0.9381, test_f1: 0.4985
 epoch: 41, train_loss: 0.9740, test_loss: 0.9288, test_f1: 0.5051
 epoch: 42, train_loss: 0.9685, test_loss: 0.9301, test_f1: 0.5143
 epoch: 43, train_loss: 0.9612, test_loss: 0.9322, test_f1: 0.4806
 epoch: 44, train_loss: 0.9691, test_loss: 0.9360, test_f1: 0.4952
 epoch: 45, train_loss: 0.9628, test_loss: 0.9386, test_f1: 0.4991
 epoch: 46, train_loss: 0.9589, test_loss: 0.9359, test_f1: 0.4899
 epoch: 47, train_loss: 0.9642, test_loss: 0.9311, test_f1: 0.4982
 epoch: 48, train_loss: 0.9579, test_loss: 0.9314, test_f1: 0.5013
 epoch: 49, train_loss: 0.9556, test_loss: 0.9443, test_f1: 0.5132
 epoch: 50, train_loss: 0.9590, test_loss: 0.9307, test_f1: 0.4957
 epoch: 51, train_loss: 0.9465, test_loss: 0.9289, test_f1: 0.4996
 epoch: 52, train_loss: 0.9568, test_loss: 0.9332, test_f1: 0.4882
 epoch: 53, train_loss: 0.9430, test_loss: 0.9338, test_f1: 0.4973
 epoch: 54, train_loss: 0.9410, test_loss: 0.9330, test_f1: 0.5035
 epoch: 55, train_loss: 0.9552, test_loss: 0.9305, test_f1: 0.4924
 epoch: 56, train_loss: 0.9496, test_loss: 0.9367, test_f1: 0.4883
 epoch: 57, train_loss: 0.9442, test_loss: 0.9369, test_f1: 0.5017
 epoch: 58, train_loss: 0.9540, test_loss: 0.9263, test_f1: 0.4976
 epoch: 59, train_loss: 0.9460, test_loss: 0.9253, test_f1: 0.4989
 epoch: 60, train_loss: 0.9456, test_loss: 0.9238, test_f1: 0.4912
 epoch: 61, train_loss: 0.9423, test_loss: 0.9287, test_f1: 0.4938
 epoch: 62, train_loss: 0.9362, test_loss: 0.9183, test_f1: 0.4922
 epoch: 63, train_loss: 0.9461, test_loss: 0.9165, test_f1: 0.5010
 epoch: 64, train_loss: 0.9451, test_loss: 0.9254, test_f1: 0.5158
 epoch: 65, train_loss: 0.9349, test_loss: 0.9152, test_f1: 0.5023
 epoch: 66, train_loss: 0.9319, test_loss: 0.9187, test_f1: 0.4986
 epoch: 67, train_loss: 0.9293, test_loss: 0.9267, test_f1: 0.5160
 epoch: 68, train_loss: 0.9367, test_loss: 0.9260, test_f1: 0.5015
 epoch: 69, train_loss: 0.9349, test_loss: 0.9371, test_f1: 0.5212
 epoch: 70, train_loss: 0.9419, test_loss: 0.9231, test_f1: 0.4993
 epoch: 71, train_loss: 0.9481, test_loss: 0.9247, test_f1: 0.5223
 epoch: 72, train_loss: 0.9483, test_loss: 0.9184, test_f1: 0.5072
 epoch: 73, train_loss: 0.9320, test_loss: 0.9121, test_f1: 0.5131
 epoch: 74, train_loss: 0.9339, test_loss: 0.9125, test_f1: 0.5074
 epoch: 75, train_loss: 0.9363, test_loss: 0.9144, test_f1: 0.5139
 epoch: 76, train_loss: 0.9337, test_loss: 0.9128, test_f1: 0.5203
 epoch: 77, train_loss: 0.9368, test_loss: 0.9170, test_f1: 0.5152
 epoch: 78, train_loss: 0.9378, test_loss: 0.9110, test_f1: 0.5066
 epoch: 79, train_loss: 0.9298, test_loss: 0.9218, test_f1: 0.5284
 epoch: 80, train_loss: 0.9310, test_loss: 0.9214, test_f1: 0.5364
 epoch: 81, train_loss: 0.9389, test_loss: 0.9214, test_f1: 0.5081
 epoch: 82, train_loss: 0.9317, test_loss: 0.9119, test_f1: 0.5154
 epoch: 83, train_loss: 0.9274, test_loss: 0.9175, test_f1: 0.5014
 epoch: 84, train_loss: 0.9312, test_loss: 0.9122, test_f1: 0.5101
 epoch: 85, train_loss: 0.9230, test_loss: 0.9199, test_f1: 0.5134
 epoch: 86, train_loss: 0.9336, test_loss: 0.9225, test_f1: 0.5251
 epoch: 87, train_loss: 0.9289, test_loss: 0.9188, test_f1: 0.5344
 epoch: 88, train_loss: 0.9388, test_loss: 0.9137, test_f1: 0.5131
 epoch: 89, train_loss: 0.9279, test_loss: 0.9170, test_f1: 0.5268
 epoch: 90, train_loss: 0.9219, test_loss: 0.9133, test_f1: 0.5388
 epoch: 91, train_loss: 0.9227, test_loss: 0.9178, test_f1: 0.5127
 epoch: 92, train_loss: 0.9351, test_loss: 0.9081, test_f1: 0.5189
 epoch: 93, train_loss: 0.9295, test_loss: 0.9104, test_f1: 0.5201
 epoch: 94, train_loss: 0.9245, test_loss: 0.9116, test_f1: 0.5279
 epoch: 95, train_loss: 0.9209, test_loss: 0.9200, test_f1: 0.5202
 epoch: 96, train_loss: 0.9228, test_loss: 0.9227, test_f1: 0.5225
 epoch: 97, train_loss: 0.9186, test_loss: 0.9159, test_f1: 0.5469
 epoch: 98, train_loss: 0.9266, test_loss: 0.9169, test_f1: 0.5322
 epoch: 99, train_loss: 0.9287, test_loss: 0.9331, test_f1: 0.5202

Training completed in 1420.96 seconds
Best F1: 0.5469 at epoch 97
Mean F1 across iterations: 0.5207  0.0201
========================FINAL RESULTS================================
FEGIN weighted F1: 0.5469  0.0201
python main.py --data ltspice_examples --representation component_pin_net --model FEGIN --layers 6 --hiddens 16 --batch_size 32 --lr 0.0001 --emb_size 250 --epochs 100 --save_appendix component_pin_net_L6_H16_BS32_LR0.0001_E250 --no_val
-----



STDERR:
  File "main.py", line 370, in <module>
    main()
  File "main.py", line 254, in main
    dataset = dataset_class(
  File "/home/philip/projects/ltspice_examples_code_repo/Circuit-Completion-Using-GNNs/component_classification_with_link_prediction_head/evaluation/FEGIN/kernel/circuit_datasets.py", line 15, in __init__
    self.data, self.slices = torch.load(self.processed_paths[0])
  File "/home/philip/.local/lib/python3.8/site-packages/torch/serialization.py", line 1040, in load
    warnings.warn(
  File "/usr/lib/python3.8/warnings.py", line 109, in _showwarnmsg
    sw(msg.message, msg.category, msg.filename, msg.lineno,
  File "main.py", line 47, in warn_with_traceback
    traceback.print_stack(file=log)
/home/philip/projects/ltspice_examples_code_repo/Circuit-Completion-Using-GNNs/component_classification_with_link_prediction_head/evaluation/FEGIN/kernel/circuit_datasets.py:15: FutureWarning: You are using `torch.load` with `weights_only=False` (the current default value), which uses the default pickle module implicitly. It is possible to construct malicious pickle data which will execute arbitrary code during unpickling (See https://github.com/pytorch/pytorch/blob/main/SECURITY.md#untrusted-models for more details). In a future release, the default value for `weights_only` will be flipped to `True`. This limits the functions that could be executed during unpickling. Arbitrary objects will no longer be allowed to be loaded via this mode unless they are explicitly allowlisted by the user via `torch.serialization.add_safe_globals`. We recommend you start setting `weights_only=True` for any use case where you don't have full control of the loaded file. Please open an issue on GitHub for any issues related to this experimental feature.
  self.data, self.slices = torch.load(self.processed_paths[0])
