STDOUT:
Results will be saved in /home/philip/projects/llm_inference_code_repo/Circuit-Completion-Using-GNNs/component_classification_with_link_prediction_head/evaluation/FEGIN/results/model_FEGIN_dataset_ltspice_examples
Command line input: python main.py --data ltspice_examples --representation component_net --model FEGIN --layers 2 --hiddens 16 --batch_size 32 --lr 0.001 --emb_size 250 --epochs 100 --save_appendix component_net_L2_H16_BS32_LR0.001_E250 --no_val
 is saved.
-----
ltspice_examples - FEGIN
Using 2 layers, 16 hidden units, h = 2
Loading component_net representation dataset
ENTERED
Training FEGIN on component_net representation
Train: 3558, Test: 846
##################ITERATION #0 ****************************************
 epoch: 0, train_loss: 1.3375, test_loss: 1.2416, test_f1: 0.2311
 epoch: 1, train_loss: 1.2362, test_loss: 1.2104, test_f1: 0.2975
 epoch: 2, train_loss: 1.2139, test_loss: 1.2047, test_f1: 0.3213
 epoch: 3, train_loss: 1.1836, test_loss: 1.1736, test_f1: 0.3305
 epoch: 4, train_loss: 1.1583, test_loss: 1.1283, test_f1: 0.3717
 epoch: 5, train_loss: 1.1271, test_loss: 1.0828, test_f1: 0.3649
 epoch: 6, train_loss: 1.1085, test_loss: 1.0633, test_f1: 0.3799
 epoch: 7, train_loss: 1.0783, test_loss: 1.0587, test_f1: 0.3740
 epoch: 8, train_loss: 1.0751, test_loss: 1.0286, test_f1: 0.3935
 epoch: 9, train_loss: 1.0607, test_loss: 1.0536, test_f1: 0.3830
 epoch: 10, train_loss: 1.0564, test_loss: 1.0170, test_f1: 0.3760
 epoch: 11, train_loss: 1.0404, test_loss: 1.0224, test_f1: 0.3608
 epoch: 12, train_loss: 1.0353, test_loss: 0.9944, test_f1: 0.4052
 epoch: 13, train_loss: 1.0293, test_loss: 1.0135, test_f1: 0.4344
 epoch: 14, train_loss: 1.0162, test_loss: 1.0611, test_f1: 0.4289
 epoch: 15, train_loss: 1.0071, test_loss: 1.0056, test_f1: 0.4444
 epoch: 16, train_loss: 1.0018, test_loss: 0.9666, test_f1: 0.4499
 epoch: 17, train_loss: 1.0025, test_loss: 1.0201, test_f1: 0.4260
 epoch: 18, train_loss: 0.9964, test_loss: 0.9604, test_f1: 0.4495
 epoch: 19, train_loss: 0.9951, test_loss: 0.9872, test_f1: 0.4583
 epoch: 20, train_loss: 0.9832, test_loss: 0.9572, test_f1: 0.4634
 epoch: 21, train_loss: 0.9861, test_loss: 0.9579, test_f1: 0.4701
 epoch: 22, train_loss: 0.9837, test_loss: 0.9572, test_f1: 0.4812
 epoch: 23, train_loss: 0.9699, test_loss: 0.9996, test_f1: 0.4393
 epoch: 24, train_loss: 0.9649, test_loss: 0.9676, test_f1: 0.4613
 epoch: 25, train_loss: 0.9681, test_loss: 1.0360, test_f1: 0.4848
 epoch: 26, train_loss: 0.9653, test_loss: 0.9582, test_f1: 0.4920
 epoch: 27, train_loss: 0.9702, test_loss: 0.9982, test_f1: 0.4743
 epoch: 28, train_loss: 0.9623, test_loss: 0.9914, test_f1: 0.4734
 epoch: 29, train_loss: 0.9529, test_loss: 0.9440, test_f1: 0.4813
 epoch: 30, train_loss: 0.9524, test_loss: 0.9711, test_f1: 0.4790
 epoch: 31, train_loss: 0.9539, test_loss: 0.9743, test_f1: 0.5027
 epoch: 32, train_loss: 0.9500, test_loss: 0.9680, test_f1: 0.5035
 epoch: 33, train_loss: 0.9452, test_loss: 0.9914, test_f1: 0.4898
 epoch: 34, train_loss: 0.9496, test_loss: 0.9698, test_f1: 0.4512
 epoch: 35, train_loss: 0.9411, test_loss: 0.9980, test_f1: 0.4839
 epoch: 36, train_loss: 0.9472, test_loss: 1.0135, test_f1: 0.4996
 epoch: 37, train_loss: 0.9437, test_loss: 0.9882, test_f1: 0.4942
 epoch: 38, train_loss: 0.9425, test_loss: 0.9493, test_f1: 0.5305
 epoch: 39, train_loss: 0.9341, test_loss: 0.9907, test_f1: 0.5088
 epoch: 40, train_loss: 0.9507, test_loss: 1.0020, test_f1: 0.5032
 epoch: 41, train_loss: 0.9337, test_loss: 0.9820, test_f1: 0.5029
 epoch: 42, train_loss: 0.9337, test_loss: 0.9517, test_f1: 0.4996
 epoch: 43, train_loss: 0.9425, test_loss: 0.9794, test_f1: 0.5037
 epoch: 44, train_loss: 0.9316, test_loss: 0.9928, test_f1: 0.4797
 epoch: 45, train_loss: 0.9326, test_loss: 0.9555, test_f1: 0.4957
 epoch: 46, train_loss: 0.9287, test_loss: 0.9436, test_f1: 0.5130
 epoch: 47, train_loss: 0.9280, test_loss: 0.9640, test_f1: 0.5112
 epoch: 48, train_loss: 0.9325, test_loss: 1.0208, test_f1: 0.4929
 epoch: 49, train_loss: 0.9242, test_loss: 0.9984, test_f1: 0.5188
 epoch: 50, train_loss: 0.9158, test_loss: 0.9538, test_f1: 0.4842
 epoch: 51, train_loss: 0.9052, test_loss: 0.9619, test_f1: 0.4990
 epoch: 52, train_loss: 0.9188, test_loss: 0.9422, test_f1: 0.5074
 epoch: 53, train_loss: 0.9054, test_loss: 0.9358, test_f1: 0.5068
 epoch: 54, train_loss: 0.9120, test_loss: 0.9309, test_f1: 0.5142
 epoch: 55, train_loss: 0.9057, test_loss: 0.9471, test_f1: 0.5019
 epoch: 56, train_loss: 0.9061, test_loss: 1.0045, test_f1: 0.5043
 epoch: 57, train_loss: 0.9052, test_loss: 0.9710, test_f1: 0.4997
 epoch: 58, train_loss: 0.9077, test_loss: 0.9757, test_f1: 0.5144
 epoch: 59, train_loss: 0.9006, test_loss: 0.9440, test_f1: 0.5154
 epoch: 60, train_loss: 0.9043, test_loss: 0.9554, test_f1: 0.5066
 epoch: 61, train_loss: 0.9195, test_loss: 0.9848, test_f1: 0.4935
 epoch: 62, train_loss: 0.9125, test_loss: 0.9855, test_f1: 0.4964
 epoch: 63, train_loss: 0.9068, test_loss: 0.9418, test_f1: 0.5009
 epoch: 64, train_loss: 0.9143, test_loss: 0.9803, test_f1: 0.5172
 epoch: 65, train_loss: 0.9010, test_loss: 0.9853, test_f1: 0.5088
 epoch: 66, train_loss: 0.9123, test_loss: 0.9902, test_f1: 0.5239
 epoch: 67, train_loss: 0.9092, test_loss: 0.9555, test_f1: 0.5238
 epoch: 68, train_loss: 0.9091, test_loss: 0.9806, test_f1: 0.5138
 epoch: 69, train_loss: 0.9064, test_loss: 0.9626, test_f1: 0.5169
 epoch: 70, train_loss: 0.8927, test_loss: 0.9859, test_f1: 0.5150
 epoch: 71, train_loss: 0.9021, test_loss: 0.9626, test_f1: 0.4844
 epoch: 72, train_loss: 0.8958, test_loss: 0.9838, test_f1: 0.5242
 epoch: 73, train_loss: 0.9004, test_loss: 0.9625, test_f1: 0.5238
 epoch: 74, train_loss: 0.9010, test_loss: 0.9881, test_f1: 0.5199
 epoch: 75, train_loss: 0.8866, test_loss: 0.9603, test_f1: 0.5429
 epoch: 76, train_loss: 0.8994, test_loss: 0.9420, test_f1: 0.5182
 epoch: 77, train_loss: 0.8979, test_loss: 0.9682, test_f1: 0.5139
 epoch: 78, train_loss: 0.8977, test_loss: 1.0330, test_f1: 0.4915
 epoch: 79, train_loss: 0.8974, test_loss: 0.9708, test_f1: 0.5250
 epoch: 80, train_loss: 0.9053, test_loss: 0.9677, test_f1: 0.5285
 epoch: 81, train_loss: 0.8967, test_loss: 0.9918, test_f1: 0.5157
 epoch: 82, train_loss: 0.8988, test_loss: 0.9939, test_f1: 0.5022
 epoch: 83, train_loss: 0.8949, test_loss: 0.9741, test_f1: 0.5143
 epoch: 84, train_loss: 0.8911, test_loss: 0.9768, test_f1: 0.5052
 epoch: 85, train_loss: 0.8920, test_loss: 0.9518, test_f1: 0.5216
 epoch: 86, train_loss: 0.8952, test_loss: 0.9534, test_f1: 0.5384
 epoch: 87, train_loss: 0.8916, test_loss: 0.9846, test_f1: 0.5058
 epoch: 88, train_loss: 0.8960, test_loss: 0.9737, test_f1: 0.5333
 epoch: 89, train_loss: 0.8892, test_loss: 0.9616, test_f1: 0.5016
 epoch: 90, train_loss: 0.8892, test_loss: 0.9222, test_f1: 0.5564
 epoch: 91, train_loss: 0.9100, test_loss: 0.9928, test_f1: 0.5220
 epoch: 92, train_loss: 0.8981, test_loss: 1.0112, test_f1: 0.5049
 epoch: 93, train_loss: 0.8941, test_loss: 0.9805, test_f1: 0.5287
 epoch: 94, train_loss: 0.8919, test_loss: 0.9881, test_f1: 0.5191
 epoch: 95, train_loss: 0.8841, test_loss: 1.0185, test_f1: 0.5101
 epoch: 96, train_loss: 0.8905, test_loss: 0.9781, test_f1: 0.5440
 epoch: 97, train_loss: 0.8955, test_loss: 0.9928, test_f1: 0.5279
 epoch: 98, train_loss: 0.8907, test_loss: 0.9558, test_f1: 0.5327
 epoch: 99, train_loss: 0.8914, test_loss: 0.9901, test_f1: 0.5250
##################ITERATION #1 ****************************************
 epoch: 0, train_loss: 1.2601, test_loss: 1.1534, test_f1: 0.3344
 epoch: 1, train_loss: 1.1459, test_loss: 1.0798, test_f1: 0.3535
 epoch: 2, train_loss: 1.1055, test_loss: 1.0410, test_f1: 0.3610
 epoch: 3, train_loss: 1.0803, test_loss: 1.0336, test_f1: 0.3564
 epoch: 4, train_loss: 1.0646, test_loss: 1.0294, test_f1: 0.3879
 epoch: 5, train_loss: 1.0386, test_loss: 1.0026, test_f1: 0.4032
 epoch: 6, train_loss: 1.0169, test_loss: 0.9717, test_f1: 0.4421
 epoch: 7, train_loss: 1.0083, test_loss: 0.9601, test_f1: 0.4723
 epoch: 8, train_loss: 0.9983, test_loss: 0.9969, test_f1: 0.4765
 epoch: 9, train_loss: 0.9916, test_loss: 0.9748, test_f1: 0.4596
 epoch: 10, train_loss: 0.9840, test_loss: 0.9861, test_f1: 0.4681
 epoch: 11, train_loss: 0.9816, test_loss: 0.9780, test_f1: 0.4932
 epoch: 12, train_loss: 0.9730, test_loss: 0.9816, test_f1: 0.4870
 epoch: 13, train_loss: 0.9686, test_loss: 0.9716, test_f1: 0.4758
 epoch: 14, train_loss: 0.9692, test_loss: 0.9717, test_f1: 0.4793
 epoch: 15, train_loss: 0.9563, test_loss: 0.9480, test_f1: 0.4902
 epoch: 16, train_loss: 0.9572, test_loss: 0.9437, test_f1: 0.4958
 epoch: 17, train_loss: 0.9483, test_loss: 0.9558, test_f1: 0.5365
 epoch: 18, train_loss: 0.9547, test_loss: 0.9730, test_f1: 0.4749
 epoch: 19, train_loss: 0.9617, test_loss: 0.9264, test_f1: 0.4934
 epoch: 20, train_loss: 0.9331, test_loss: 0.9527, test_f1: 0.4703
 epoch: 21, train_loss: 0.9421, test_loss: 0.9339, test_f1: 0.5059
 epoch: 22, train_loss: 0.9390, test_loss: 0.9383, test_f1: 0.5184
 epoch: 23, train_loss: 0.9329, test_loss: 0.9041, test_f1: 0.5296
 epoch: 24, train_loss: 0.9223, test_loss: 0.9305, test_f1: 0.4916
 epoch: 25, train_loss: 0.9367, test_loss: 0.9694, test_f1: 0.5110
 epoch: 26, train_loss: 0.9236, test_loss: 0.9388, test_f1: 0.5192
 epoch: 27, train_loss: 0.9187, test_loss: 0.9527, test_f1: 0.5159
 epoch: 28, train_loss: 0.9199, test_loss: 0.9449, test_f1: 0.4973
 epoch: 29, train_loss: 0.9176, test_loss: 0.9252, test_f1: 0.4974
 epoch: 30, train_loss: 0.9114, test_loss: 0.9162, test_f1: 0.5203
 epoch: 31, train_loss: 0.9063, test_loss: 0.9740, test_f1: 0.4897
 epoch: 32, train_loss: 0.9063, test_loss: 0.9443, test_f1: 0.5215
 epoch: 33, train_loss: 0.9130, test_loss: 0.9539, test_f1: 0.5425
 epoch: 34, train_loss: 0.9115, test_loss: 0.9418, test_f1: 0.4987
 epoch: 35, train_loss: 0.9007, test_loss: 0.9413, test_f1: 0.5173
 epoch: 36, train_loss: 0.9010, test_loss: 0.9335, test_f1: 0.5138
 epoch: 37, train_loss: 0.8957, test_loss: 0.9547, test_f1: 0.5324
 epoch: 38, train_loss: 0.8952, test_loss: 0.9345, test_f1: 0.5486
 epoch: 39, train_loss: 0.8997, test_loss: 0.9255, test_f1: 0.5139
 epoch: 40, train_loss: 0.9011, test_loss: 0.9636, test_f1: 0.5084
 epoch: 41, train_loss: 0.8942, test_loss: 0.9587, test_f1: 0.5177
 epoch: 42, train_loss: 0.9002, test_loss: 0.9357, test_f1: 0.5592
 epoch: 43, train_loss: 0.8867, test_loss: 0.9617, test_f1: 0.5678
 epoch: 44, train_loss: 0.8820, test_loss: 0.9295, test_f1: 0.5364
 epoch: 45, train_loss: 0.8763, test_loss: 0.9850, test_f1: 0.4947
 epoch: 46, train_loss: 0.8972, test_loss: 0.9185, test_f1: 0.5288
 epoch: 47, train_loss: 0.8844, test_loss: 0.9383, test_f1: 0.5113
 epoch: 48, train_loss: 0.8781, test_loss: 0.9622, test_f1: 0.5450
 epoch: 49, train_loss: 0.8785, test_loss: 0.9759, test_f1: 0.5649
 epoch: 50, train_loss: 0.8920, test_loss: 0.9575, test_f1: 0.5450
 epoch: 51, train_loss: 0.8742, test_loss: 0.9838, test_f1: 0.5411
 epoch: 52, train_loss: 0.8715, test_loss: 0.9573, test_f1: 0.5642
 epoch: 53, train_loss: 0.8688, test_loss: 0.9780, test_f1: 0.5195
 epoch: 54, train_loss: 0.8614, test_loss: 0.9659, test_f1: 0.5220
 epoch: 55, train_loss: 0.8697, test_loss: 0.9568, test_f1: 0.5784
 epoch: 56, train_loss: 0.8731, test_loss: 0.9609, test_f1: 0.5797
 epoch: 57, train_loss: 0.8721, test_loss: 0.9614, test_f1: 0.5292
 epoch: 58, train_loss: 0.8686, test_loss: 0.9437, test_f1: 0.5431
 epoch: 59, train_loss: 0.8708, test_loss: 0.9584, test_f1: 0.5403
 epoch: 60, train_loss: 0.8694, test_loss: 0.9575, test_f1: 0.5692
 epoch: 61, train_loss: 0.8591, test_loss: 0.9573, test_f1: 0.5337
 epoch: 62, train_loss: 0.8578, test_loss: 0.9552, test_f1: 0.5175
 epoch: 63, train_loss: 0.8666, test_loss: 0.9778, test_f1: 0.5378
 epoch: 64, train_loss: 0.8614, test_loss: 0.9604, test_f1: 0.5323
 epoch: 65, train_loss: 0.8684, test_loss: 0.9578, test_f1: 0.5433
 epoch: 66, train_loss: 0.8624, test_loss: 0.9617, test_f1: 0.5512
 epoch: 67, train_loss: 0.8571, test_loss: 0.9766, test_f1: 0.5629
 epoch: 68, train_loss: 0.8621, test_loss: 0.9563, test_f1: 0.5699
 epoch: 69, train_loss: 0.8577, test_loss: 0.9690, test_f1: 0.5783
 epoch: 70, train_loss: 0.8580, test_loss: 0.9700, test_f1: 0.5538
 epoch: 71, train_loss: 0.8497, test_loss: 0.9982, test_f1: 0.5526
 epoch: 72, train_loss: 0.8558, test_loss: 0.9783, test_f1: 0.5604
 epoch: 73, train_loss: 0.8592, test_loss: 0.9936, test_f1: 0.5868
 epoch: 74, train_loss: 0.8581, test_loss: 0.9592, test_f1: 0.5914
 epoch: 75, train_loss: 0.8727, test_loss: 0.9635, test_f1: 0.5769
 epoch: 76, train_loss: 0.8532, test_loss: 0.9737, test_f1: 0.5868
 epoch: 77, train_loss: 0.8488, test_loss: 0.9664, test_f1: 0.5475
 epoch: 78, train_loss: 0.8541, test_loss: 0.9616, test_f1: 0.5899
 epoch: 79, train_loss: 0.8478, test_loss: 0.9766, test_f1: 0.5389
 epoch: 80, train_loss: 0.8544, test_loss: 0.9639, test_f1: 0.6080
 epoch: 81, train_loss: 0.8375, test_loss: 0.9756, test_f1: 0.5574
 epoch: 82, train_loss: 0.8397, test_loss: 0.9654, test_f1: 0.5788
 epoch: 83, train_loss: 0.8520, test_loss: 0.9659, test_f1: 0.5689
 epoch: 84, train_loss: 0.8507, test_loss: 0.9906, test_f1: 0.5495
 epoch: 85, train_loss: 0.8644, test_loss: 0.9759, test_f1: 0.5461
 epoch: 86, train_loss: 0.8415, test_loss: 0.9887, test_f1: 0.5303
 epoch: 87, train_loss: 0.8457, test_loss: 0.9782, test_f1: 0.5594
 epoch: 88, train_loss: 0.8387, test_loss: 0.9602, test_f1: 0.5793
 epoch: 89, train_loss: 0.8403, test_loss: 0.9575, test_f1: 0.5573
 epoch: 90, train_loss: 0.8466, test_loss: 1.0028, test_f1: 0.5286
 epoch: 91, train_loss: 0.8504, test_loss: 0.9800, test_f1: 0.5937
 epoch: 92, train_loss: 0.8355, test_loss: 0.9860, test_f1: 0.5688
 epoch: 93, train_loss: 0.8334, test_loss: 0.9858, test_f1: 0.5510
 epoch: 94, train_loss: 0.8309, test_loss: 0.9960, test_f1: 0.5841
 epoch: 95, train_loss: 0.8496, test_loss: 0.9895, test_f1: 0.5624
 epoch: 96, train_loss: 0.8431, test_loss: 0.9907, test_f1: 0.5750
 epoch: 97, train_loss: 0.8434, test_loss: 0.9870, test_f1: 0.5930
 epoch: 98, train_loss: 0.8359, test_loss: 0.9660, test_f1: 0.5952
 epoch: 99, train_loss: 0.8422, test_loss: 0.9865, test_f1: 0.5628
##################ITERATION #2 ****************************************
 epoch: 0, train_loss: 1.2405, test_loss: 1.0754, test_f1: 0.3809
 epoch: 1, train_loss: 1.1097, test_loss: 1.0366, test_f1: 0.3780
 epoch: 2, train_loss: 1.0581, test_loss: 0.9921, test_f1: 0.4067
 epoch: 3, train_loss: 1.0487, test_loss: 0.9889, test_f1: 0.4503
 epoch: 4, train_loss: 1.0248, test_loss: 0.9603, test_f1: 0.4330
 epoch: 5, train_loss: 1.0181, test_loss: 1.0388, test_f1: 0.4139
 epoch: 6, train_loss: 1.0040, test_loss: 0.9587, test_f1: 0.4639
 epoch: 7, train_loss: 0.9970, test_loss: 0.9547, test_f1: 0.4680
 epoch: 8, train_loss: 0.9887, test_loss: 0.9402, test_f1: 0.4891
 epoch: 9, train_loss: 0.9841, test_loss: 0.9311, test_f1: 0.4814
 epoch: 10, train_loss: 0.9788, test_loss: 0.9750, test_f1: 0.4814
 epoch: 11, train_loss: 0.9692, test_loss: 0.9158, test_f1: 0.4688
 epoch: 12, train_loss: 0.9637, test_loss: 0.8977, test_f1: 0.5004
 epoch: 13, train_loss: 0.9478, test_loss: 0.8874, test_f1: 0.5043
 epoch: 14, train_loss: 0.9438, test_loss: 0.9138, test_f1: 0.4847
 epoch: 15, train_loss: 0.9344, test_loss: 0.9788, test_f1: 0.4904
 epoch: 16, train_loss: 0.9352, test_loss: 0.9425, test_f1: 0.4894
 epoch: 17, train_loss: 0.9286, test_loss: 0.9760, test_f1: 0.5077
 epoch: 18, train_loss: 0.9258, test_loss: 0.9040, test_f1: 0.5053
 epoch: 19, train_loss: 0.9272, test_loss: 0.8893, test_f1: 0.5061
 epoch: 20, train_loss: 0.9139, test_loss: 0.9649, test_f1: 0.5265
 epoch: 21, train_loss: 0.9180, test_loss: 0.9046, test_f1: 0.4869
 epoch: 22, train_loss: 0.9105, test_loss: 0.9894, test_f1: 0.5106
 epoch: 23, train_loss: 0.9186, test_loss: 0.9143, test_f1: 0.5421
 epoch: 24, train_loss: 0.9060, test_loss: 0.9559, test_f1: 0.5180
 epoch: 25, train_loss: 0.9048, test_loss: 0.9506, test_f1: 0.5176
 epoch: 26, train_loss: 0.9087, test_loss: 0.9494, test_f1: 0.4849
 epoch: 27, train_loss: 0.8929, test_loss: 0.8698, test_f1: 0.5256
 epoch: 28, train_loss: 0.8920, test_loss: 0.9295, test_f1: 0.5293
 epoch: 29, train_loss: 0.8986, test_loss: 0.9657, test_f1: 0.5298
 epoch: 30, train_loss: 0.8819, test_loss: 0.9629, test_f1: 0.5325
 epoch: 31, train_loss: 0.8796, test_loss: 0.9534, test_f1: 0.5355
 epoch: 32, train_loss: 0.9116, test_loss: 1.0426, test_f1: 0.4920
 epoch: 33, train_loss: 0.8854, test_loss: 0.9753, test_f1: 0.5268
 epoch: 34, train_loss: 0.8775, test_loss: 0.9389, test_f1: 0.5151
 epoch: 35, train_loss: 0.8789, test_loss: 0.9653, test_f1: 0.5394
 epoch: 36, train_loss: 0.8789, test_loss: 0.9177, test_f1: 0.5440
 epoch: 37, train_loss: 0.8817, test_loss: 0.9484, test_f1: 0.5274
 epoch: 38, train_loss: 0.8644, test_loss: 0.9321, test_f1: 0.5326
 epoch: 39, train_loss: 0.8802, test_loss: 0.9626, test_f1: 0.5509
 epoch: 40, train_loss: 0.8574, test_loss: 0.9422, test_f1: 0.5247
 epoch: 41, train_loss: 0.8595, test_loss: 0.9428, test_f1: 0.5852
 epoch: 42, train_loss: 0.8738, test_loss: 0.9330, test_f1: 0.5477
 epoch: 43, train_loss: 0.8610, test_loss: 0.9371, test_f1: 0.5529
 epoch: 44, train_loss: 0.8559, test_loss: 0.9291, test_f1: 0.5536
 epoch: 45, train_loss: 0.8534, test_loss: 0.9354, test_f1: 0.5512
 epoch: 46, train_loss: 0.8515, test_loss: 0.9339, test_f1: 0.5596
 epoch: 47, train_loss: 0.8562, test_loss: 0.9452, test_f1: 0.5612
 epoch: 48, train_loss: 0.8526, test_loss: 0.9437, test_f1: 0.5362
 epoch: 49, train_loss: 0.8498, test_loss: 0.9487, test_f1: 0.5269
 epoch: 50, train_loss: 0.8530, test_loss: 0.8872, test_f1: 0.5536
 epoch: 51, train_loss: 0.8401, test_loss: 0.9227, test_f1: 0.5540
 epoch: 52, train_loss: 0.8337, test_loss: 0.9090, test_f1: 0.5750
 epoch: 53, train_loss: 0.8394, test_loss: 0.9306, test_f1: 0.5548
 epoch: 54, train_loss: 0.8320, test_loss: 0.9248, test_f1: 0.5394
 epoch: 55, train_loss: 0.8361, test_loss: 0.9428, test_f1: 0.5370
 epoch: 56, train_loss: 0.8439, test_loss: 0.9430, test_f1: 0.5464
 epoch: 57, train_loss: 0.8379, test_loss: 0.9062, test_f1: 0.5657
 epoch: 58, train_loss: 0.8297, test_loss: 0.9157, test_f1: 0.5471
 epoch: 59, train_loss: 0.8316, test_loss: 0.9200, test_f1: 0.6008
 epoch: 60, train_loss: 0.8323, test_loss: 0.9269, test_f1: 0.5522
 epoch: 61, train_loss: 0.8229, test_loss: 0.9482, test_f1: 0.5452
 epoch: 62, train_loss: 0.8370, test_loss: 0.9278, test_f1: 0.5464
 epoch: 63, train_loss: 0.8218, test_loss: 0.9128, test_f1: 0.5884
 epoch: 64, train_loss: 0.8314, test_loss: 0.9544, test_f1: 0.5620
 epoch: 65, train_loss: 0.8302, test_loss: 0.9338, test_f1: 0.5470
 epoch: 66, train_loss: 0.8177, test_loss: 0.9044, test_f1: 0.5823
 epoch: 67, train_loss: 0.8176, test_loss: 0.9079, test_f1: 0.5527
 epoch: 68, train_loss: 0.8276, test_loss: 0.9255, test_f1: 0.5853
 epoch: 69, train_loss: 0.8330, test_loss: 0.9257, test_f1: 0.5464
 epoch: 70, train_loss: 0.8206, test_loss: 0.9151, test_f1: 0.5669
 epoch: 71, train_loss: 0.8165, test_loss: 0.9088, test_f1: 0.5705
 epoch: 72, train_loss: 0.8163, test_loss: 0.9653, test_f1: 0.5448
 epoch: 73, train_loss: 0.8253, test_loss: 0.9258, test_f1: 0.5742
 epoch: 74, train_loss: 0.8179, test_loss: 0.9255, test_f1: 0.5561
 epoch: 75, train_loss: 0.8214, test_loss: 0.9246, test_f1: 0.5813
 epoch: 76, train_loss: 0.8183, test_loss: 0.9390, test_f1: 0.5651
 epoch: 77, train_loss: 0.8195, test_loss: 0.9019, test_f1: 0.5912
 epoch: 78, train_loss: 0.8135, test_loss: 0.9022, test_f1: 0.6189
 epoch: 79, train_loss: 0.8233, test_loss: 0.9473, test_f1: 0.5629
 epoch: 80, train_loss: 0.8086, test_loss: 0.9342, test_f1: 0.5469
 epoch: 81, train_loss: 0.8211, test_loss: 0.9217, test_f1: 0.5732
 epoch: 82, train_loss: 0.8158, test_loss: 0.9127, test_f1: 0.6085
 epoch: 83, train_loss: 0.8151, test_loss: 0.9330, test_f1: 0.5881
 epoch: 84, train_loss: 0.8120, test_loss: 0.9386, test_f1: 0.5758
 epoch: 85, train_loss: 0.8053, test_loss: 0.9295, test_f1: 0.6090
 epoch: 86, train_loss: 0.8070, test_loss: 0.9519, test_f1: 0.5656
 epoch: 87, train_loss: 0.8215, test_loss: 0.9196, test_f1: 0.6176
 epoch: 88, train_loss: 0.8093, test_loss: 0.9240, test_f1: 0.5930
 epoch: 89, train_loss: 0.8211, test_loss: 0.9229, test_f1: 0.5760
 epoch: 90, train_loss: 0.8244, test_loss: 0.9671, test_f1: 0.5594
 epoch: 91, train_loss: 0.8163, test_loss: 0.9558, test_f1: 0.5853
 epoch: 92, train_loss: 0.8164, test_loss: 0.9374, test_f1: 0.5911
 epoch: 93, train_loss: 0.8107, test_loss: 0.9873, test_f1: 0.5852
 epoch: 94, train_loss: 0.8041, test_loss: 0.9250, test_f1: 0.5940
 epoch: 95, train_loss: 0.8168, test_loss: 0.9313, test_f1: 0.6023
 epoch: 96, train_loss: 0.8050, test_loss: 0.9368, test_f1: 0.5979
 epoch: 97, train_loss: 0.8105, test_loss: 0.9548, test_f1: 0.5965
 epoch: 98, train_loss: 0.8026, test_loss: 0.9300, test_f1: 0.5711
 epoch: 99, train_loss: 0.8109, test_loss: 0.9255, test_f1: 0.5898
##################ITERATION #3 ****************************************
 epoch: 0, train_loss: 1.2765, test_loss: 1.1556, test_f1: 0.3425
 epoch: 1, train_loss: 1.1571, test_loss: 1.0754, test_f1: 0.3659
 epoch: 2, train_loss: 1.1226, test_loss: 1.0569, test_f1: 0.3549
 epoch: 3, train_loss: 1.0793, test_loss: 1.0298, test_f1: 0.4080
 epoch: 4, train_loss: 1.0579, test_loss: 1.0155, test_f1: 0.4167
 epoch: 5, train_loss: 1.0336, test_loss: 0.9788, test_f1: 0.4459
 epoch: 6, train_loss: 1.0263, test_loss: 0.9868, test_f1: 0.4649
 epoch: 7, train_loss: 1.0133, test_loss: 0.9649, test_f1: 0.4606
 epoch: 8, train_loss: 1.0149, test_loss: 0.9500, test_f1: 0.4722
 epoch: 9, train_loss: 1.0058, test_loss: 0.9594, test_f1: 0.4937
 epoch: 10, train_loss: 1.0000, test_loss: 0.9529, test_f1: 0.4827
 epoch: 11, train_loss: 0.9989, test_loss: 0.9528, test_f1: 0.4630
 epoch: 12, train_loss: 0.9895, test_loss: 0.9685, test_f1: 0.4853
 epoch: 13, train_loss: 0.9771, test_loss: 0.9356, test_f1: 0.4786
 epoch: 14, train_loss: 0.9799, test_loss: 0.9620, test_f1: 0.4968
 epoch: 15, train_loss: 0.9710, test_loss: 0.9268, test_f1: 0.5102
 epoch: 16, train_loss: 0.9744, test_loss: 0.9862, test_f1: 0.5016
 epoch: 17, train_loss: 0.9622, test_loss: 0.9396, test_f1: 0.4931
 epoch: 18, train_loss: 0.9624, test_loss: 0.9591, test_f1: 0.5096
 epoch: 19, train_loss: 0.9606, test_loss: 0.9642, test_f1: 0.5211
 epoch: 20, train_loss: 0.9619, test_loss: 0.9918, test_f1: 0.4998
 epoch: 21, train_loss: 0.9605, test_loss: 0.9775, test_f1: 0.5099
 epoch: 22, train_loss: 0.9510, test_loss: 1.0153, test_f1: 0.5014
 epoch: 23, train_loss: 0.9450, test_loss: 0.9819, test_f1: 0.5065
 epoch: 24, train_loss: 0.9462, test_loss: 0.9670, test_f1: 0.5179
 epoch: 25, train_loss: 0.9463, test_loss: 0.9994, test_f1: 0.5147
 epoch: 26, train_loss: 0.9385, test_loss: 0.9514, test_f1: 0.5012
 epoch: 27, train_loss: 0.9385, test_loss: 0.9680, test_f1: 0.5177
 epoch: 28, train_loss: 0.9358, test_loss: 0.9924, test_f1: 0.5070
 epoch: 29, train_loss: 0.9215, test_loss: 0.9622, test_f1: 0.5189
 epoch: 30, train_loss: 0.9199, test_loss: 0.9088, test_f1: 0.5234
 epoch: 31, train_loss: 0.9176, test_loss: 0.9945, test_f1: 0.5234
 epoch: 32, train_loss: 0.9266, test_loss: 0.9621, test_f1: 0.5128
 epoch: 33, train_loss: 0.9182, test_loss: 0.9738, test_f1: 0.5215
 epoch: 34, train_loss: 0.9228, test_loss: 0.9651, test_f1: 0.5043
 epoch: 35, train_loss: 0.9163, test_loss: 0.9941, test_f1: 0.4921
 epoch: 36, train_loss: 0.9179, test_loss: 0.9637, test_f1: 0.5136
 epoch: 37, train_loss: 0.9148, test_loss: 0.9965, test_f1: 0.4914
 epoch: 38, train_loss: 0.9047, test_loss: 0.9526, test_f1: 0.5095
 epoch: 39, train_loss: 0.9044, test_loss: 0.9838, test_f1: 0.5115
 epoch: 40, train_loss: 0.9152, test_loss: 0.9784, test_f1: 0.5026
 epoch: 41, train_loss: 0.8920, test_loss: 0.9337, test_f1: 0.5449
 epoch: 42, train_loss: 0.9076, test_loss: 0.9545, test_f1: 0.5152
 epoch: 43, train_loss: 0.8882, test_loss: 0.8884, test_f1: 0.5370
 epoch: 44, train_loss: 0.9001, test_loss: 0.8706, test_f1: 0.5495
 epoch: 45, train_loss: 0.8882, test_loss: 0.9642, test_f1: 0.5319
 epoch: 46, train_loss: 0.8928, test_loss: 0.9913, test_f1: 0.5116
 epoch: 47, train_loss: 0.8819, test_loss: 0.9508, test_f1: 0.5366
 epoch: 48, train_loss: 0.8974, test_loss: 0.9343, test_f1: 0.5497
 epoch: 49, train_loss: 0.8966, test_loss: 0.9334, test_f1: 0.5466
 epoch: 50, train_loss: 0.8989, test_loss: 0.9710, test_f1: 0.5392
 epoch: 51, train_loss: 0.8861, test_loss: 0.9588, test_f1: 0.5318
 epoch: 52, train_loss: 0.8844, test_loss: 0.9471, test_f1: 0.5540
 epoch: 53, train_loss: 0.8787, test_loss: 0.9412, test_f1: 0.5531
 epoch: 54, train_loss: 0.8735, test_loss: 0.8767, test_f1: 0.5517
 epoch: 55, train_loss: 0.8751, test_loss: 0.9437, test_f1: 0.5190
 epoch: 56, train_loss: 0.8674, test_loss: 0.9590, test_f1: 0.5469
 epoch: 57, train_loss: 0.8665, test_loss: 0.9237, test_f1: 0.5529
 epoch: 58, train_loss: 0.8674, test_loss: 0.9075, test_f1: 0.5603
 epoch: 59, train_loss: 0.8823, test_loss: 0.9328, test_f1: 0.5501
 epoch: 60, train_loss: 0.8799, test_loss: 0.9428, test_f1: 0.5372
 epoch: 61, train_loss: 0.8681, test_loss: 0.9633, test_f1: 0.5328
 epoch: 62, train_loss: 0.8723, test_loss: 0.9546, test_f1: 0.5153
 epoch: 63, train_loss: 0.8755, test_loss: 0.9037, test_f1: 0.5268
 epoch: 64, train_loss: 0.8731, test_loss: 0.9561, test_f1: 0.5215
 epoch: 65, train_loss: 0.8759, test_loss: 0.9446, test_f1: 0.5444
 epoch: 66, train_loss: 0.8716, test_loss: 0.9458, test_f1: 0.5252
 epoch: 67, train_loss: 0.8759, test_loss: 0.9805, test_f1: 0.5442
 epoch: 68, train_loss: 0.8689, test_loss: 0.9557, test_f1: 0.5384
 epoch: 69, train_loss: 0.8563, test_loss: 0.9392, test_f1: 0.5535
 epoch: 70, train_loss: 0.8687, test_loss: 0.9451, test_f1: 0.5618
 epoch: 71, train_loss: 0.8740, test_loss: 0.9631, test_f1: 0.5416
 epoch: 72, train_loss: 0.8685, test_loss: 0.9490, test_f1: 0.5525
 epoch: 73, train_loss: 0.8585, test_loss: 0.9611, test_f1: 0.5333
 epoch: 74, train_loss: 0.8587, test_loss: 0.9575, test_f1: 0.5300
 epoch: 75, train_loss: 0.8557, test_loss: 0.9477, test_f1: 0.5395
 epoch: 76, train_loss: 0.8586, test_loss: 0.9408, test_f1: 0.5398
 epoch: 77, train_loss: 0.8613, test_loss: 0.9421, test_f1: 0.5558
 epoch: 78, train_loss: 0.8539, test_loss: 0.9471, test_f1: 0.5462
 epoch: 79, train_loss: 0.8609, test_loss: 0.9137, test_f1: 0.5365
 epoch: 80, train_loss: 0.8542, test_loss: 0.9510, test_f1: 0.5286
 epoch: 81, train_loss: 0.8588, test_loss: 0.9377, test_f1: 0.5465
 epoch: 82, train_loss: 0.8651, test_loss: 0.9333, test_f1: 0.5610
 epoch: 83, train_loss: 0.8513, test_loss: 0.9505, test_f1: 0.5411
 epoch: 84, train_loss: 0.8517, test_loss: 0.9736, test_f1: 0.5404
 epoch: 85, train_loss: 0.8555, test_loss: 0.9451, test_f1: 0.5403
 epoch: 86, train_loss: 0.8587, test_loss: 0.9505, test_f1: 0.5418
 epoch: 87, train_loss: 0.8566, test_loss: 0.9370, test_f1: 0.5587
 epoch: 88, train_loss: 0.8553, test_loss: 0.9691, test_f1: 0.5434
 epoch: 89, train_loss: 0.8551, test_loss: 0.9375, test_f1: 0.5546
 epoch: 90, train_loss: 0.8489, test_loss: 0.9245, test_f1: 0.5552
 epoch: 91, train_loss: 0.8625, test_loss: 0.9403, test_f1: 0.5593
 epoch: 92, train_loss: 0.8547, test_loss: 0.9405, test_f1: 0.5535
 epoch: 93, train_loss: 0.8406, test_loss: 0.9458, test_f1: 0.5511
 epoch: 94, train_loss: 0.8558, test_loss: 0.9489, test_f1: 0.5370
 epoch: 95, train_loss: 0.8522, test_loss: 0.9081, test_f1: 0.5458
 epoch: 96, train_loss: 0.8436, test_loss: 0.9467, test_f1: 0.5410
 epoch: 97, train_loss: 0.8544, test_loss: 0.8749, test_f1: 0.5479
 epoch: 98, train_loss: 0.8481, test_loss: 0.9182, test_f1: 0.5370
 epoch: 99, train_loss: 0.8493, test_loss: 0.9335, test_f1: 0.5665
##################ITERATION #4 ****************************************
 epoch: 0, train_loss: 1.2828, test_loss: 1.0646, test_f1: 0.4035
 epoch: 1, train_loss: 1.1065, test_loss: 1.0129, test_f1: 0.4305
 epoch: 2, train_loss: 1.0797, test_loss: 1.0055, test_f1: 0.4295
 epoch: 3, train_loss: 1.0540, test_loss: 1.0120, test_f1: 0.4430
 epoch: 4, train_loss: 1.0400, test_loss: 1.0005, test_f1: 0.4527
 epoch: 5, train_loss: 1.0187, test_loss: 0.9870, test_f1: 0.4619
 epoch: 6, train_loss: 1.0183, test_loss: 0.9955, test_f1: 0.4604
 epoch: 7, train_loss: 1.0102, test_loss: 0.9817, test_f1: 0.4520
 epoch: 8, train_loss: 0.9915, test_loss: 0.9733, test_f1: 0.4800
 epoch: 9, train_loss: 0.9876, test_loss: 0.9560, test_f1: 0.4536
 epoch: 10, train_loss: 0.9820, test_loss: 0.9839, test_f1: 0.4705
 epoch: 11, train_loss: 0.9808, test_loss: 0.9357, test_f1: 0.4818
 epoch: 12, train_loss: 0.9714, test_loss: 0.9772, test_f1: 0.4643
 epoch: 13, train_loss: 0.9636, test_loss: 0.9590, test_f1: 0.4778
 epoch: 14, train_loss: 0.9625, test_loss: 0.9882, test_f1: 0.4786
 epoch: 15, train_loss: 0.9646, test_loss: 0.9578, test_f1: 0.4779
 epoch: 16, train_loss: 0.9587, test_loss: 0.9888, test_f1: 0.4726
 epoch: 17, train_loss: 0.9540, test_loss: 0.9768, test_f1: 0.4936
 epoch: 18, train_loss: 0.9600, test_loss: 0.9472, test_f1: 0.4887
 epoch: 19, train_loss: 0.9457, test_loss: 0.9660, test_f1: 0.4939
 epoch: 20, train_loss: 0.9394, test_loss: 0.9709, test_f1: 0.4942
 epoch: 21, train_loss: 0.9515, test_loss: 0.9527, test_f1: 0.4728
 epoch: 22, train_loss: 0.9381, test_loss: 0.9495, test_f1: 0.4816
 epoch: 23, train_loss: 0.9252, test_loss: 0.9158, test_f1: 0.4968
 epoch: 24, train_loss: 0.9376, test_loss: 0.9364, test_f1: 0.4985
 epoch: 25, train_loss: 0.9332, test_loss: 0.9408, test_f1: 0.5096
 epoch: 26, train_loss: 0.9271, test_loss: 0.9300, test_f1: 0.5022
 epoch: 27, train_loss: 0.9238, test_loss: 0.9240, test_f1: 0.4978
 epoch: 28, train_loss: 0.9224, test_loss: 0.9173, test_f1: 0.5003
 epoch: 29, train_loss: 0.9186, test_loss: 0.9257, test_f1: 0.5013
 epoch: 30, train_loss: 0.9216, test_loss: 0.8932, test_f1: 0.5166
 epoch: 31, train_loss: 0.9165, test_loss: 0.9284, test_f1: 0.5169
 epoch: 32, train_loss: 0.9098, test_loss: 0.9288, test_f1: 0.5077
 epoch: 33, train_loss: 0.9113, test_loss: 0.9494, test_f1: 0.4886
 epoch: 34, train_loss: 0.9184, test_loss: 0.9199, test_f1: 0.5216
 epoch: 35, train_loss: 0.9135, test_loss: 0.9362, test_f1: 0.5294
 epoch: 36, train_loss: 0.9084, test_loss: 0.9440, test_f1: 0.5066
 epoch: 37, train_loss: 0.9078, test_loss: 0.9356, test_f1: 0.5361
 epoch: 38, train_loss: 0.8968, test_loss: 0.9381, test_f1: 0.5096
 epoch: 39, train_loss: 0.9053, test_loss: 0.9246, test_f1: 0.5485
 epoch: 40, train_loss: 0.9015, test_loss: 0.9276, test_f1: 0.5272
 epoch: 41, train_loss: 0.9018, test_loss: 0.9033, test_f1: 0.5410
 epoch: 42, train_loss: 0.8974, test_loss: 0.9322, test_f1: 0.5109
 epoch: 43, train_loss: 0.9001, test_loss: 0.9454, test_f1: 0.5557
 epoch: 44, train_loss: 0.8945, test_loss: 0.9197, test_f1: 0.5271
 epoch: 45, train_loss: 0.8901, test_loss: 0.9442, test_f1: 0.5385
 epoch: 46, train_loss: 0.8913, test_loss: 0.9599, test_f1: 0.5270
 epoch: 47, train_loss: 0.8894, test_loss: 0.9477, test_f1: 0.5403
 epoch: 48, train_loss: 0.8854, test_loss: 0.9404, test_f1: 0.5064
 epoch: 49, train_loss: 0.8929, test_loss: 0.9408, test_f1: 0.5482
 epoch: 50, train_loss: 0.8798, test_loss: 0.9546, test_f1: 0.5249
 epoch: 51, train_loss: 0.8857, test_loss: 0.9455, test_f1: 0.5539
 epoch: 52, train_loss: 0.8836, test_loss: 0.9291, test_f1: 0.5479
 epoch: 53, train_loss: 0.8695, test_loss: 0.9231, test_f1: 0.5484
 epoch: 54, train_loss: 0.8710, test_loss: 0.9241, test_f1: 0.5497
 epoch: 55, train_loss: 0.8706, test_loss: 0.9187, test_f1: 0.5422
 epoch: 56, train_loss: 0.8704, test_loss: 0.9177, test_f1: 0.5476
 epoch: 57, train_loss: 0.8644, test_loss: 0.9294, test_f1: 0.5487
 epoch: 58, train_loss: 0.8725, test_loss: 0.9036, test_f1: 0.5582
 epoch: 59, train_loss: 0.8735, test_loss: 0.9415, test_f1: 0.5506
 epoch: 60, train_loss: 0.8651, test_loss: 0.9331, test_f1: 0.5507
 epoch: 61, train_loss: 0.8666, test_loss: 0.9442, test_f1: 0.5487
 epoch: 62, train_loss: 0.8733, test_loss: 0.9423, test_f1: 0.5369
 epoch: 63, train_loss: 0.8679, test_loss: 0.9509, test_f1: 0.5704
 epoch: 64, train_loss: 0.8651, test_loss: 0.9280, test_f1: 0.5473
 epoch: 65, train_loss: 0.8578, test_loss: 0.9179, test_f1: 0.5332
 epoch: 66, train_loss: 0.8609, test_loss: 0.9198, test_f1: 0.5728
 epoch: 67, train_loss: 0.8648, test_loss: 0.9128, test_f1: 0.5422
 epoch: 68, train_loss: 0.8670, test_loss: 0.9326, test_f1: 0.5326
 epoch: 69, train_loss: 0.8673, test_loss: 0.9224, test_f1: 0.5474
 epoch: 70, train_loss: 0.8573, test_loss: 0.9274, test_f1: 0.5429
 epoch: 71, train_loss: 0.8541, test_loss: 0.9263, test_f1: 0.5563
 epoch: 72, train_loss: 0.8644, test_loss: 0.9253, test_f1: 0.5545
 epoch: 73, train_loss: 0.8509, test_loss: 0.9201, test_f1: 0.5543
 epoch: 74, train_loss: 0.8666, test_loss: 0.8861, test_f1: 0.5744
 epoch: 75, train_loss: 0.8579, test_loss: 0.9311, test_f1: 0.5462
 epoch: 76, train_loss: 0.8486, test_loss: 0.9135, test_f1: 0.5571
 epoch: 77, train_loss: 0.8571, test_loss: 0.9319, test_f1: 0.5548
 epoch: 78, train_loss: 0.8488, test_loss: 0.9398, test_f1: 0.5424
 epoch: 79, train_loss: 0.8571, test_loss: 0.9412, test_f1: 0.5604
 epoch: 80, train_loss: 0.8520, test_loss: 0.9413, test_f1: 0.5640
 epoch: 81, train_loss: 0.8583, test_loss: 0.9389, test_f1: 0.5549
 epoch: 82, train_loss: 0.8464, test_loss: 0.9341, test_f1: 0.5437
 epoch: 83, train_loss: 0.8563, test_loss: 0.9282, test_f1: 0.5625
 epoch: 84, train_loss: 0.8483, test_loss: 0.9308, test_f1: 0.5865
 epoch: 85, train_loss: 0.8513, test_loss: 0.9331, test_f1: 0.5667
 epoch: 86, train_loss: 0.8443, test_loss: 0.9488, test_f1: 0.5471
 epoch: 87, train_loss: 0.8495, test_loss: 0.9487, test_f1: 0.5428
 epoch: 88, train_loss: 0.8461, test_loss: 0.9326, test_f1: 0.5537
 epoch: 89, train_loss: 0.8453, test_loss: 0.9291, test_f1: 0.5555
 epoch: 90, train_loss: 0.8526, test_loss: 0.9463, test_f1: 0.5368
 epoch: 91, train_loss: 0.8488, test_loss: 0.9235, test_f1: 0.5531
 epoch: 92, train_loss: 0.8479, test_loss: 0.9459, test_f1: 0.5637
 epoch: 93, train_loss: 0.8569, test_loss: 0.9415, test_f1: 0.5590
 epoch: 94, train_loss: 0.8478, test_loss: 0.9362, test_f1: 0.5638
 epoch: 95, train_loss: 0.8460, test_loss: 0.9597, test_f1: 0.5246
 epoch: 96, train_loss: 0.8510, test_loss: 0.9416, test_f1: 0.5683
 epoch: 97, train_loss: 0.8399, test_loss: 0.9352, test_f1: 0.5628
 epoch: 98, train_loss: 0.8484, test_loss: 0.9311, test_f1: 0.5661
 epoch: 99, train_loss: 0.8437, test_loss: 0.9412, test_f1: 0.5617
##################ITERATION #5 ****************************************
 epoch: 0, train_loss: 1.3182, test_loss: 1.1165, test_f1: 0.4041
 epoch: 1, train_loss: 1.1419, test_loss: 1.0561, test_f1: 0.4064
 epoch: 2, train_loss: 1.0785, test_loss: 1.0031, test_f1: 0.4516
 epoch: 3, train_loss: 1.0525, test_loss: 0.9954, test_f1: 0.4278
 epoch: 4, train_loss: 1.0266, test_loss: 1.0166, test_f1: 0.4345
 epoch: 5, train_loss: 1.0116, test_loss: 0.9782, test_f1: 0.4777
 epoch: 6, train_loss: 1.0002, test_loss: 0.9659, test_f1: 0.4668
 epoch: 7, train_loss: 0.9906, test_loss: 0.9781, test_f1: 0.4551
 epoch: 8, train_loss: 0.9807, test_loss: 0.9681, test_f1: 0.5075
 epoch: 9, train_loss: 0.9714, test_loss: 0.9548, test_f1: 0.4825
 epoch: 10, train_loss: 0.9720, test_loss: 0.9753, test_f1: 0.5016
 epoch: 11, train_loss: 0.9638, test_loss: 0.9687, test_f1: 0.5075
 epoch: 12, train_loss: 0.9551, test_loss: 0.9699, test_f1: 0.5226
 epoch: 13, train_loss: 0.9769, test_loss: 0.9527, test_f1: 0.5030
 epoch: 14, train_loss: 0.9606, test_loss: 0.9635, test_f1: 0.5007
 epoch: 15, train_loss: 0.9514, test_loss: 0.9608, test_f1: 0.5098
 epoch: 16, train_loss: 0.9390, test_loss: 0.9653, test_f1: 0.5054
 epoch: 17, train_loss: 0.9420, test_loss: 0.9783, test_f1: 0.4903
 epoch: 18, train_loss: 0.9387, test_loss: 0.9761, test_f1: 0.4977
 epoch: 19, train_loss: 0.9334, test_loss: 0.9798, test_f1: 0.5114
 epoch: 20, train_loss: 0.9316, test_loss: 0.9599, test_f1: 0.5057
 epoch: 21, train_loss: 0.9317, test_loss: 0.9720, test_f1: 0.4979
 epoch: 22, train_loss: 0.9238, test_loss: 0.9798, test_f1: 0.4945
 epoch: 23, train_loss: 0.9206, test_loss: 0.9376, test_f1: 0.5141
 epoch: 24, train_loss: 0.9214, test_loss: 0.9448, test_f1: 0.5065
 epoch: 25, train_loss: 0.9220, test_loss: 0.9750, test_f1: 0.4710
 epoch: 26, train_loss: 0.9125, test_loss: 0.9530, test_f1: 0.5075
 epoch: 27, train_loss: 0.9192, test_loss: 0.9435, test_f1: 0.5183
 epoch: 28, train_loss: 0.9166, test_loss: 0.9509, test_f1: 0.5602
 epoch: 29, train_loss: 0.9156, test_loss: 0.9204, test_f1: 0.5451
 epoch: 30, train_loss: 0.9081, test_loss: 0.9622, test_f1: 0.4983
 epoch: 31, train_loss: 0.9096, test_loss: 0.9291, test_f1: 0.5185
 epoch: 32, train_loss: 0.9117, test_loss: 0.9384, test_f1: 0.5408
 epoch: 33, train_loss: 0.8993, test_loss: 0.9357, test_f1: 0.5446
 epoch: 34, train_loss: 0.9061, test_loss: 1.0032, test_f1: 0.4952
 epoch: 35, train_loss: 0.9024, test_loss: 0.9437, test_f1: 0.5222
 epoch: 36, train_loss: 0.8937, test_loss: 1.0037, test_f1: 0.4758
 epoch: 37, train_loss: 0.8940, test_loss: 0.9346, test_f1: 0.5282
 epoch: 38, train_loss: 0.8854, test_loss: 0.9691, test_f1: 0.5215
 epoch: 39, train_loss: 0.8921, test_loss: 0.9286, test_f1: 0.5380
 epoch: 40, train_loss: 0.8898, test_loss: 0.9798, test_f1: 0.5168
 epoch: 41, train_loss: 0.8829, test_loss: 0.8997, test_f1: 0.5535
 epoch: 42, train_loss: 0.8798, test_loss: 0.9605, test_f1: 0.5389
 epoch: 43, train_loss: 0.8850, test_loss: 0.9339, test_f1: 0.5434
 epoch: 44, train_loss: 0.8858, test_loss: 0.9345, test_f1: 0.5148
 epoch: 45, train_loss: 0.8752, test_loss: 0.9362, test_f1: 0.5191
 epoch: 46, train_loss: 0.8846, test_loss: 0.9129, test_f1: 0.5256
 epoch: 47, train_loss: 0.8763, test_loss: 0.9018, test_f1: 0.5293
 epoch: 48, train_loss: 0.8726, test_loss: 0.9269, test_f1: 0.5474
 epoch: 49, train_loss: 0.8772, test_loss: 0.9234, test_f1: 0.5498
 epoch: 50, train_loss: 0.8740, test_loss: 0.8973, test_f1: 0.5763
 epoch: 51, train_loss: 0.8729, test_loss: 0.8983, test_f1: 0.5555
 epoch: 52, train_loss: 0.8622, test_loss: 0.9250, test_f1: 0.5374
 epoch: 53, train_loss: 0.8608, test_loss: 0.9235, test_f1: 0.5455
 epoch: 54, train_loss: 0.8644, test_loss: 0.9139, test_f1: 0.5638
 epoch: 55, train_loss: 0.8667, test_loss: 0.9114, test_f1: 0.5361
 epoch: 56, train_loss: 0.8602, test_loss: 0.9301, test_f1: 0.5526
 epoch: 57, train_loss: 0.8622, test_loss: 0.9371, test_f1: 0.5334
 epoch: 58, train_loss: 0.8535, test_loss: 0.9379, test_f1: 0.5448
 epoch: 59, train_loss: 0.8560, test_loss: 0.9168, test_f1: 0.5493
 epoch: 60, train_loss: 0.8413, test_loss: 0.9030, test_f1: 0.5522
 epoch: 61, train_loss: 0.8543, test_loss: 0.9150, test_f1: 0.5527
 epoch: 62, train_loss: 0.8469, test_loss: 0.8892, test_f1: 0.5691
 epoch: 63, train_loss: 0.8405, test_loss: 0.9206, test_f1: 0.5510
 epoch: 64, train_loss: 0.8549, test_loss: 0.9224, test_f1: 0.5358
 epoch: 65, train_loss: 0.8594, test_loss: 0.9105, test_f1: 0.5549
 epoch: 66, train_loss: 0.8387, test_loss: 0.9280, test_f1: 0.5375
 epoch: 67, train_loss: 0.8477, test_loss: 0.9057, test_f1: 0.5533
 epoch: 68, train_loss: 0.8435, test_loss: 0.9126, test_f1: 0.5423
 epoch: 69, train_loss: 0.8345, test_loss: 0.9027, test_f1: 0.5496
 epoch: 70, train_loss: 0.8518, test_loss: 0.8947, test_f1: 0.5594
 epoch: 71, train_loss: 0.8550, test_loss: 0.9095, test_f1: 0.5641
 epoch: 72, train_loss: 0.8342, test_loss: 0.9026, test_f1: 0.5705
 epoch: 73, train_loss: 0.8452, test_loss: 0.9158, test_f1: 0.5733
 epoch: 74, train_loss: 0.8316, test_loss: 0.9314, test_f1: 0.5422
 epoch: 75, train_loss: 0.8283, test_loss: 0.9109, test_f1: 0.5460
 epoch: 76, train_loss: 0.8363, test_loss: 0.8994, test_f1: 0.5735
 epoch: 77, train_loss: 0.8394, test_loss: 0.8989, test_f1: 0.5766
 epoch: 78, train_loss: 0.8438, test_loss: 0.8924, test_f1: 0.5692
 epoch: 79, train_loss: 0.8331, test_loss: 0.9028, test_f1: 0.5594
 epoch: 80, train_loss: 0.8398, test_loss: 0.9102, test_f1: 0.5621
 epoch: 81, train_loss: 0.8433, test_loss: 0.9292, test_f1: 0.5452
 epoch: 82, train_loss: 0.8465, test_loss: 0.9208, test_f1: 0.5290
 epoch: 83, train_loss: 0.8364, test_loss: 0.9083, test_f1: 0.5579
 epoch: 84, train_loss: 0.8307, test_loss: 0.9136, test_f1: 0.5542
 epoch: 85, train_loss: 0.8471, test_loss: 0.9150, test_f1: 0.5705
 epoch: 86, train_loss: 0.8264, test_loss: 0.9130, test_f1: 0.5704
 epoch: 87, train_loss: 0.8367, test_loss: 0.9126, test_f1: 0.5445
 epoch: 88, train_loss: 0.8331, test_loss: 0.9197, test_f1: 0.5536
 epoch: 89, train_loss: 0.8261, test_loss: 0.9229, test_f1: 0.5347
 epoch: 90, train_loss: 0.8212, test_loss: 0.9048, test_f1: 0.5650
 epoch: 91, train_loss: 0.8292, test_loss: 0.9182, test_f1: 0.5632
 epoch: 92, train_loss: 0.8303, test_loss: 0.9511, test_f1: 0.5490
 epoch: 93, train_loss: 0.8345, test_loss: 0.9169, test_f1: 0.5507
 epoch: 94, train_loss: 0.8256, test_loss: 0.9289, test_f1: 0.5749
 epoch: 95, train_loss: 0.8161, test_loss: 0.9268, test_f1: 0.5655
 epoch: 96, train_loss: 0.8284, test_loss: 0.9018, test_f1: 0.5841
 epoch: 97, train_loss: 0.8357, test_loss: 0.9017, test_f1: 0.5780
 epoch: 98, train_loss: 0.8242, test_loss: 0.9072, test_f1: 0.5859
 epoch: 99, train_loss: 0.8164, test_loss: 0.9265, test_f1: 0.5666
##################ITERATION #6 ****************************************
 epoch: 0, train_loss: 1.2682, test_loss: 1.0521, test_f1: 0.3753
 epoch: 1, train_loss: 1.1153, test_loss: 1.0194, test_f1: 0.4009
 epoch: 2, train_loss: 1.0714, test_loss: 1.0214, test_f1: 0.4339
 epoch: 3, train_loss: 1.0334, test_loss: 1.0284, test_f1: 0.4740
 epoch: 4, train_loss: 1.0258, test_loss: 1.0352, test_f1: 0.4586
 epoch: 5, train_loss: 1.0130, test_loss: 1.0379, test_f1: 0.4746
 epoch: 6, train_loss: 1.0162, test_loss: 1.0272, test_f1: 0.4800
 epoch: 7, train_loss: 0.9907, test_loss: 1.0349, test_f1: 0.4723
 epoch: 8, train_loss: 0.9882, test_loss: 1.0122, test_f1: 0.4891
 epoch: 9, train_loss: 0.9814, test_loss: 1.0147, test_f1: 0.4931
 epoch: 10, train_loss: 0.9732, test_loss: 1.0262, test_f1: 0.4779
 epoch: 11, train_loss: 0.9621, test_loss: 1.0249, test_f1: 0.5077
 epoch: 12, train_loss: 0.9589, test_loss: 1.0164, test_f1: 0.4843
 epoch: 13, train_loss: 0.9456, test_loss: 1.0167, test_f1: 0.4886
 epoch: 14, train_loss: 0.9432, test_loss: 1.0000, test_f1: 0.5107
 epoch: 15, train_loss: 0.9447, test_loss: 0.9984, test_f1: 0.5158
 epoch: 16, train_loss: 0.9434, test_loss: 0.9890, test_f1: 0.5206
 epoch: 17, train_loss: 0.9389, test_loss: 1.0121, test_f1: 0.4900
 epoch: 18, train_loss: 0.9341, test_loss: 0.9952, test_f1: 0.4868
 epoch: 19, train_loss: 0.9366, test_loss: 0.9836, test_f1: 0.5038
 epoch: 20, train_loss: 0.9381, test_loss: 0.9920, test_f1: 0.5135
 epoch: 21, train_loss: 0.9224, test_loss: 0.9936, test_f1: 0.5123
 epoch: 22, train_loss: 0.9179, test_loss: 0.9932, test_f1: 0.5023
 epoch: 23, train_loss: 0.9179, test_loss: 0.9712, test_f1: 0.5059
 epoch: 24, train_loss: 0.9099, test_loss: 0.9830, test_f1: 0.5117
 epoch: 25, train_loss: 0.9171, test_loss: 0.9734, test_f1: 0.5127
 epoch: 26, train_loss: 0.9177, test_loss: 0.9660, test_f1: 0.5196
 epoch: 27, train_loss: 0.9181, test_loss: 0.9926, test_f1: 0.4963
 epoch: 28, train_loss: 0.9142, test_loss: 0.9420, test_f1: 0.5124
 epoch: 29, train_loss: 0.9050, test_loss: 0.9573, test_f1: 0.5296
 epoch: 30, train_loss: 0.9041, test_loss: 0.9633, test_f1: 0.5270
 epoch: 31, train_loss: 0.8938, test_loss: 0.9544, test_f1: 0.5300
 epoch: 32, train_loss: 0.8960, test_loss: 0.9626, test_f1: 0.5199
 epoch: 33, train_loss: 0.8902, test_loss: 0.9570, test_f1: 0.4847
 epoch: 34, train_loss: 0.8995, test_loss: 0.9396, test_f1: 0.5139
 epoch: 35, train_loss: 0.9008, test_loss: 0.9635, test_f1: 0.5127
 epoch: 36, train_loss: 0.8891, test_loss: 0.9704, test_f1: 0.5119
 epoch: 37, train_loss: 0.8920, test_loss: 0.9636, test_f1: 0.5174
 epoch: 38, train_loss: 0.8909, test_loss: 0.9897, test_f1: 0.4853
 epoch: 39, train_loss: 0.8872, test_loss: 0.9448, test_f1: 0.5378
 epoch: 40, train_loss: 0.8759, test_loss: 0.9408, test_f1: 0.5385
 epoch: 41, train_loss: 0.8917, test_loss: 0.8534, test_f1: 0.5363
 epoch: 42, train_loss: 0.8827, test_loss: 0.9135, test_f1: 0.5313
 epoch: 43, train_loss: 0.8749, test_loss: 0.9457, test_f1: 0.5136
 epoch: 44, train_loss: 0.8798, test_loss: 0.9569, test_f1: 0.5482
 epoch: 45, train_loss: 0.8751, test_loss: 0.9545, test_f1: 0.5231
 epoch: 46, train_loss: 0.8860, test_loss: 0.9299, test_f1: 0.5267
 epoch: 47, train_loss: 0.8774, test_loss: 0.9745, test_f1: 0.5256
 epoch: 48, train_loss: 0.8692, test_loss: 0.9017, test_f1: 0.5355
 epoch: 49, train_loss: 0.8776, test_loss: 0.9402, test_f1: 0.5298
 epoch: 50, train_loss: 0.8647, test_loss: 0.9202, test_f1: 0.5303
 epoch: 51, train_loss: 0.8575, test_loss: 0.9279, test_f1: 0.5404
 epoch: 52, train_loss: 0.8670, test_loss: 0.9300, test_f1: 0.5433
 epoch: 53, train_loss: 0.8565, test_loss: 0.9199, test_f1: 0.5392
 epoch: 54, train_loss: 0.8490, test_loss: 0.9121, test_f1: 0.5400
 epoch: 55, train_loss: 0.8665, test_loss: 0.9129, test_f1: 0.5423
 epoch: 56, train_loss: 0.8627, test_loss: 0.9032, test_f1: 0.5374
 epoch: 57, train_loss: 0.8533, test_loss: 0.9075, test_f1: 0.5283
 epoch: 58, train_loss: 0.8523, test_loss: 0.9285, test_f1: 0.5368
 epoch: 59, train_loss: 0.8522, test_loss: 0.9227, test_f1: 0.5269
 epoch: 60, train_loss: 0.8426, test_loss: 0.9120, test_f1: 0.5558
 epoch: 61, train_loss: 0.8407, test_loss: 0.9097, test_f1: 0.5418
 epoch: 62, train_loss: 0.8524, test_loss: 0.9161, test_f1: 0.5349
 epoch: 63, train_loss: 0.8422, test_loss: 0.9079, test_f1: 0.5323
 epoch: 64, train_loss: 0.8459, test_loss: 0.8975, test_f1: 0.5392
 epoch: 65, train_loss: 0.8394, test_loss: 0.9173, test_f1: 0.5413
 epoch: 66, train_loss: 0.8465, test_loss: 0.9261, test_f1: 0.5382
 epoch: 67, train_loss: 0.8459, test_loss: 0.9009, test_f1: 0.5496
 epoch: 68, train_loss: 0.8475, test_loss: 0.8963, test_f1: 0.5455
 epoch: 69, train_loss: 0.8445, test_loss: 0.9216, test_f1: 0.5458
 epoch: 70, train_loss: 0.8544, test_loss: 0.9075, test_f1: 0.5501
 epoch: 71, train_loss: 0.8458, test_loss: 0.9151, test_f1: 0.5379
 epoch: 72, train_loss: 0.8381, test_loss: 0.9071, test_f1: 0.5462
 epoch: 73, train_loss: 0.8343, test_loss: 0.9154, test_f1: 0.5469
 epoch: 74, train_loss: 0.8349, test_loss: 0.8957, test_f1: 0.5539
 epoch: 75, train_loss: 0.8406, test_loss: 0.9000, test_f1: 0.5420
 epoch: 76, train_loss: 0.8375, test_loss: 0.9082, test_f1: 0.5474
 epoch: 77, train_loss: 0.8354, test_loss: 0.8885, test_f1: 0.5539
 epoch: 78, train_loss: 0.8319, test_loss: 0.8916, test_f1: 0.5528
 epoch: 79, train_loss: 0.8303, test_loss: 0.8893, test_f1: 0.5411
 epoch: 80, train_loss: 0.8345, test_loss: 0.9028, test_f1: 0.5415
 epoch: 81, train_loss: 0.8352, test_loss: 0.9026, test_f1: 0.5502
 epoch: 82, train_loss: 0.8315, test_loss: 0.8986, test_f1: 0.5507
 epoch: 83, train_loss: 0.8276, test_loss: 0.8902, test_f1: 0.5505
 epoch: 84, train_loss: 0.8267, test_loss: 0.8896, test_f1: 0.5420
 epoch: 85, train_loss: 0.8285, test_loss: 0.9235, test_f1: 0.5446
 epoch: 86, train_loss: 0.8301, test_loss: 0.8853, test_f1: 0.5525
 epoch: 87, train_loss: 0.8296, test_loss: 0.9080, test_f1: 0.5345
 epoch: 88, train_loss: 0.8332, test_loss: 0.8884, test_f1: 0.5492
 epoch: 89, train_loss: 0.8349, test_loss: 0.8938, test_f1: 0.5549
 epoch: 90, train_loss: 0.8248, test_loss: 0.8677, test_f1: 0.5561
 epoch: 91, train_loss: 0.8285, test_loss: 0.8868, test_f1: 0.5596
 epoch: 92, train_loss: 0.8280, test_loss: 0.9034, test_f1: 0.5384
 epoch: 93, train_loss: 0.8230, test_loss: 0.8967, test_f1: 0.5470
 epoch: 94, train_loss: 0.8317, test_loss: 0.8880, test_f1: 0.5514
 epoch: 95, train_loss: 0.8159, test_loss: 0.8848, test_f1: 0.5524
 epoch: 96, train_loss: 0.8302, test_loss: 0.8931, test_f1: 0.5471
 epoch: 97, train_loss: 0.8157, test_loss: 0.9043, test_f1: 0.5486
 epoch: 98, train_loss: 0.8230, test_loss: 0.8857, test_f1: 0.5626
 epoch: 99, train_loss: 0.8123, test_loss: 0.8919, test_f1: 0.5506
##################ITERATION #7 ****************************************
 epoch: 0, train_loss: 1.3515, test_loss: 1.1243, test_f1: 0.3773
 epoch: 1, train_loss: 1.1589, test_loss: 1.0479, test_f1: 0.3891
 epoch: 2, train_loss: 1.1027, test_loss: 1.0571, test_f1: 0.4138
 epoch: 3, train_loss: 1.0843, test_loss: 1.0496, test_f1: 0.4475
 epoch: 4, train_loss: 1.0627, test_loss: 1.0200, test_f1: 0.4566
 epoch: 5, train_loss: 1.0404, test_loss: 1.0421, test_f1: 0.4659
 epoch: 6, train_loss: 1.0321, test_loss: 1.0483, test_f1: 0.4477
 epoch: 7, train_loss: 1.0129, test_loss: 1.0483, test_f1: 0.4755
 epoch: 8, train_loss: 1.0084, test_loss: 1.0391, test_f1: 0.4871
 epoch: 9, train_loss: 1.0056, test_loss: 1.0379, test_f1: 0.4772
 epoch: 10, train_loss: 0.9925, test_loss: 1.0407, test_f1: 0.5027
 epoch: 11, train_loss: 0.9923, test_loss: 1.0400, test_f1: 0.4739
 epoch: 12, train_loss: 0.9935, test_loss: 1.0304, test_f1: 0.4643
 epoch: 13, train_loss: 0.9880, test_loss: 1.0201, test_f1: 0.4757
 epoch: 14, train_loss: 0.9712, test_loss: 1.0340, test_f1: 0.4754
 epoch: 15, train_loss: 0.9671, test_loss: 1.0215, test_f1: 0.5045
 epoch: 16, train_loss: 0.9624, test_loss: 1.0271, test_f1: 0.4995
 epoch: 17, train_loss: 0.9585, test_loss: 1.0288, test_f1: 0.4950
 epoch: 18, train_loss: 0.9592, test_loss: 1.0234, test_f1: 0.5055
 epoch: 19, train_loss: 0.9622, test_loss: 1.0192, test_f1: 0.5077
 epoch: 20, train_loss: 0.9463, test_loss: 1.0133, test_f1: 0.5071
 epoch: 21, train_loss: 0.9459, test_loss: 0.9965, test_f1: 0.5120
 epoch: 22, train_loss: 0.9415, test_loss: 1.0179, test_f1: 0.5001
 epoch: 23, train_loss: 0.9393, test_loss: 1.0145, test_f1: 0.5196
 epoch: 24, train_loss: 0.9401, test_loss: 1.0074, test_f1: 0.5173
 epoch: 25, train_loss: 0.9467, test_loss: 1.0033, test_f1: 0.5105
 epoch: 26, train_loss: 0.9363, test_loss: 0.9945, test_f1: 0.5115
 epoch: 27, train_loss: 0.9322, test_loss: 0.9959, test_f1: 0.5235
 epoch: 28, train_loss: 0.9361, test_loss: 1.0091, test_f1: 0.5168
 epoch: 29, train_loss: 0.9219, test_loss: 0.9942, test_f1: 0.5219
 epoch: 30, train_loss: 0.9305, test_loss: 1.0023, test_f1: 0.5218
 epoch: 31, train_loss: 0.9171, test_loss: 1.0038, test_f1: 0.5142
 epoch: 32, train_loss: 0.9183, test_loss: 1.0031, test_f1: 0.5031
 epoch: 33, train_loss: 0.9248, test_loss: 0.9934, test_f1: 0.5057
 epoch: 34, train_loss: 0.9272, test_loss: 0.9849, test_f1: 0.5457
 epoch: 35, train_loss: 0.9149, test_loss: 0.9992, test_f1: 0.5189
 epoch: 36, train_loss: 0.9100, test_loss: 0.9859, test_f1: 0.5187
 epoch: 37, train_loss: 0.9165, test_loss: 0.9928, test_f1: 0.5110
 epoch: 38, train_loss: 0.9102, test_loss: 0.9875, test_f1: 0.5176
 epoch: 39, train_loss: 0.9027, test_loss: 0.9771, test_f1: 0.5122
 epoch: 40, train_loss: 0.9108, test_loss: 0.9752, test_f1: 0.5148
 epoch: 41, train_loss: 0.9003, test_loss: 1.0009, test_f1: 0.5099
 epoch: 42, train_loss: 0.9075, test_loss: 0.9924, test_f1: 0.5181
 epoch: 43, train_loss: 0.8980, test_loss: 0.9852, test_f1: 0.5236
 epoch: 44, train_loss: 0.9037, test_loss: 0.9817, test_f1: 0.5214
 epoch: 45, train_loss: 0.9022, test_loss: 0.9686, test_f1: 0.5196
 epoch: 46, train_loss: 0.8998, test_loss: 0.9801, test_f1: 0.5230
 epoch: 47, train_loss: 0.8965, test_loss: 0.9705, test_f1: 0.5139
 epoch: 48, train_loss: 0.9029, test_loss: 0.9824, test_f1: 0.5137
 epoch: 49, train_loss: 0.8972, test_loss: 0.9844, test_f1: 0.5083
 epoch: 50, train_loss: 0.8952, test_loss: 0.9661, test_f1: 0.5336
 epoch: 51, train_loss: 0.8799, test_loss: 0.9630, test_f1: 0.5193
 epoch: 52, train_loss: 0.8890, test_loss: 0.9670, test_f1: 0.5212
 epoch: 53, train_loss: 0.8934, test_loss: 0.9646, test_f1: 0.5256
 epoch: 54, train_loss: 0.8848, test_loss: 0.9631, test_f1: 0.5263
 epoch: 55, train_loss: 0.8836, test_loss: 0.9591, test_f1: 0.5331
 epoch: 56, train_loss: 0.8871, test_loss: 0.9651, test_f1: 0.5230
 epoch: 57, train_loss: 0.8853, test_loss: 0.9660, test_f1: 0.5114
 epoch: 58, train_loss: 0.8696, test_loss: 0.9728, test_f1: 0.5235
 epoch: 59, train_loss: 0.8869, test_loss: 0.9688, test_f1: 0.5264
 epoch: 60, train_loss: 0.8630, test_loss: 0.9727, test_f1: 0.5216
 epoch: 61, train_loss: 0.8732, test_loss: 0.9758, test_f1: 0.5205
 epoch: 62, train_loss: 0.8783, test_loss: 0.9547, test_f1: 0.5358
 epoch: 63, train_loss: 0.8731, test_loss: 0.9752, test_f1: 0.5205
 epoch: 64, train_loss: 0.8664, test_loss: 0.9697, test_f1: 0.5130
 epoch: 65, train_loss: 0.8721, test_loss: 0.9580, test_f1: 0.5233
 epoch: 66, train_loss: 0.8801, test_loss: 0.9645, test_f1: 0.5297
 epoch: 67, train_loss: 0.8617, test_loss: 0.9595, test_f1: 0.5142
 epoch: 68, train_loss: 0.8740, test_loss: 0.9644, test_f1: 0.5270
 epoch: 69, train_loss: 0.8759, test_loss: 0.9588, test_f1: 0.5220
 epoch: 70, train_loss: 0.8709, test_loss: 0.9560, test_f1: 0.5239
 epoch: 71, train_loss: 0.8626, test_loss: 0.9763, test_f1: 0.5235
 epoch: 72, train_loss: 0.8660, test_loss: 0.9870, test_f1: 0.5274
 epoch: 73, train_loss: 0.8718, test_loss: 0.9693, test_f1: 0.5287
 epoch: 74, train_loss: 0.8569, test_loss: 0.9696, test_f1: 0.5217
 epoch: 75, train_loss: 0.8685, test_loss: 0.9626, test_f1: 0.5272
 epoch: 76, train_loss: 0.8636, test_loss: 0.9765, test_f1: 0.5190
 epoch: 77, train_loss: 0.8696, test_loss: 0.9573, test_f1: 0.5172
 epoch: 78, train_loss: 0.8700, test_loss: 0.9667, test_f1: 0.5207
 epoch: 79, train_loss: 0.8538, test_loss: 0.9675, test_f1: 0.5299
 epoch: 80, train_loss: 0.8617, test_loss: 0.9615, test_f1: 0.5223
 epoch: 81, train_loss: 0.8611, test_loss: 0.9731, test_f1: 0.5394
 epoch: 82, train_loss: 0.8710, test_loss: 0.9822, test_f1: 0.5148
 epoch: 83, train_loss: 0.8691, test_loss: 0.9649, test_f1: 0.5357
 epoch: 84, train_loss: 0.8558, test_loss: 0.9681, test_f1: 0.5352
 epoch: 85, train_loss: 0.8699, test_loss: 0.9793, test_f1: 0.5197
 epoch: 86, train_loss: 0.8576, test_loss: 0.9639, test_f1: 0.5206
 epoch: 87, train_loss: 0.8584, test_loss: 0.9707, test_f1: 0.5336
 epoch: 88, train_loss: 0.8657, test_loss: 0.9734, test_f1: 0.5243
 epoch: 89, train_loss: 0.8574, test_loss: 0.9685, test_f1: 0.5154
 epoch: 90, train_loss: 0.8679, test_loss: 0.9748, test_f1: 0.5245
 epoch: 91, train_loss: 0.8597, test_loss: 0.9764, test_f1: 0.5205
 epoch: 92, train_loss: 0.8592, test_loss: 0.9521, test_f1: 0.5260
 epoch: 93, train_loss: 0.8607, test_loss: 0.9643, test_f1: 0.5108
 epoch: 94, train_loss: 0.8584, test_loss: 0.9620, test_f1: 0.5363
 epoch: 95, train_loss: 0.8640, test_loss: 0.9680, test_f1: 0.5362
 epoch: 96, train_loss: 0.8527, test_loss: 0.9732, test_f1: 0.5252
 epoch: 97, train_loss: 0.8647, test_loss: 0.9598, test_f1: 0.5121
 epoch: 98, train_loss: 0.8498, test_loss: 0.9681, test_f1: 0.5292
 epoch: 99, train_loss: 0.8672, test_loss: 0.9598, test_f1: 0.5124
##################ITERATION #8 ****************************************
 epoch: 0, train_loss: 1.5137, test_loss: 1.1937, test_f1: 0.2802
 epoch: 1, train_loss: 1.2189, test_loss: 1.1356, test_f1: 0.3064
 epoch: 2, train_loss: 1.1494, test_loss: 1.0819, test_f1: 0.3861
 epoch: 3, train_loss: 1.1039, test_loss: 1.0663, test_f1: 0.3898
 epoch: 4, train_loss: 1.0939, test_loss: 1.0499, test_f1: 0.4011
 epoch: 5, train_loss: 1.0665, test_loss: 1.0178, test_f1: 0.4360
 epoch: 6, train_loss: 1.0494, test_loss: 1.0044, test_f1: 0.4444
 epoch: 7, train_loss: 1.0277, test_loss: 0.9956, test_f1: 0.4380
 epoch: 8, train_loss: 1.0132, test_loss: 0.9879, test_f1: 0.4520
 epoch: 9, train_loss: 1.0085, test_loss: 0.9814, test_f1: 0.4675
 epoch: 10, train_loss: 1.0116, test_loss: 0.9712, test_f1: 0.4571
 epoch: 11, train_loss: 0.9899, test_loss: 0.9607, test_f1: 0.4774
 epoch: 12, train_loss: 0.9869, test_loss: 0.9549, test_f1: 0.4925
 epoch: 13, train_loss: 0.9810, test_loss: 0.9898, test_f1: 0.4613
 epoch: 14, train_loss: 0.9702, test_loss: 0.9550, test_f1: 0.4681
 epoch: 15, train_loss: 0.9753, test_loss: 0.9411, test_f1: 0.4737
 epoch: 16, train_loss: 0.9641, test_loss: 0.9489, test_f1: 0.4744
 epoch: 17, train_loss: 0.9592, test_loss: 0.9297, test_f1: 0.4830
 epoch: 18, train_loss: 0.9613, test_loss: 0.9435, test_f1: 0.4583
 epoch: 19, train_loss: 0.9462, test_loss: 0.9422, test_f1: 0.4702
 epoch: 20, train_loss: 0.9509, test_loss: 0.9231, test_f1: 0.4930
 epoch: 21, train_loss: 0.9464, test_loss: 0.9110, test_f1: 0.5016
 epoch: 22, train_loss: 0.9361, test_loss: 0.9396, test_f1: 0.4749
 epoch: 23, train_loss: 0.9321, test_loss: 0.9258, test_f1: 0.4983
 epoch: 24, train_loss: 0.9294, test_loss: 0.9113, test_f1: 0.5004
 epoch: 25, train_loss: 0.9265, test_loss: 0.9151, test_f1: 0.5019
 epoch: 26, train_loss: 0.9328, test_loss: 0.9269, test_f1: 0.4780
 epoch: 27, train_loss: 0.9173, test_loss: 0.9083, test_f1: 0.4989
 epoch: 28, train_loss: 0.9247, test_loss: 0.9306, test_f1: 0.4759
 epoch: 29, train_loss: 0.9117, test_loss: 0.9207, test_f1: 0.4745
 epoch: 30, train_loss: 0.9111, test_loss: 0.9224, test_f1: 0.4886
 epoch: 31, train_loss: 0.9221, test_loss: 0.9060, test_f1: 0.5000
 epoch: 32, train_loss: 0.9063, test_loss: 0.9051, test_f1: 0.5014
 epoch: 33, train_loss: 0.9147, test_loss: 0.9142, test_f1: 0.4888
 epoch: 34, train_loss: 0.9167, test_loss: 0.8992, test_f1: 0.4915
 epoch: 35, train_loss: 0.9011, test_loss: 0.9060, test_f1: 0.4925
 epoch: 36, train_loss: 0.9132, test_loss: 0.8951, test_f1: 0.4915
 epoch: 37, train_loss: 0.9011, test_loss: 0.8958, test_f1: 0.4922
 epoch: 38, train_loss: 0.9005, test_loss: 0.8958, test_f1: 0.4995
 epoch: 39, train_loss: 0.8871, test_loss: 0.8801, test_f1: 0.5227
 epoch: 40, train_loss: 0.8888, test_loss: 0.9001, test_f1: 0.5157
 epoch: 41, train_loss: 0.8959, test_loss: 0.9175, test_f1: 0.5007
 epoch: 42, train_loss: 0.8912, test_loss: 0.9144, test_f1: 0.4917
 epoch: 43, train_loss: 0.8852, test_loss: 0.8952, test_f1: 0.5203
 epoch: 44, train_loss: 0.8952, test_loss: 0.8899, test_f1: 0.5026
 epoch: 45, train_loss: 0.8844, test_loss: 0.8757, test_f1: 0.5361
 epoch: 46, train_loss: 0.8751, test_loss: 0.9030, test_f1: 0.5096
 epoch: 47, train_loss: 0.8738, test_loss: 0.8860, test_f1: 0.5215
 epoch: 48, train_loss: 0.8839, test_loss: 0.8831, test_f1: 0.5159
 epoch: 49, train_loss: 0.8793, test_loss: 0.8880, test_f1: 0.5189
 epoch: 50, train_loss: 0.8809, test_loss: 0.8957, test_f1: 0.5180
 epoch: 51, train_loss: 0.8722, test_loss: 0.8895, test_f1: 0.5280
 epoch: 52, train_loss: 0.8736, test_loss: 0.8822, test_f1: 0.5362
 epoch: 53, train_loss: 0.8670, test_loss: 0.8753, test_f1: 0.5385
 epoch: 54, train_loss: 0.8683, test_loss: 0.8772, test_f1: 0.5196
 epoch: 55, train_loss: 0.8665, test_loss: 0.8788, test_f1: 0.5519
 epoch: 56, train_loss: 0.8708, test_loss: 0.8706, test_f1: 0.5317
 epoch: 57, train_loss: 0.8616, test_loss: 0.8714, test_f1: 0.5691
 epoch: 58, train_loss: 0.8775, test_loss: 0.8801, test_f1: 0.5353
 epoch: 59, train_loss: 0.8546, test_loss: 0.8794, test_f1: 0.5292
 epoch: 60, train_loss: 0.8534, test_loss: 0.8725, test_f1: 0.5581
 epoch: 61, train_loss: 0.8573, test_loss: 0.8813, test_f1: 0.5261
 epoch: 62, train_loss: 0.8570, test_loss: 0.8884, test_f1: 0.5202
 epoch: 63, train_loss: 0.8524, test_loss: 0.8811, test_f1: 0.5419
 epoch: 64, train_loss: 0.8563, test_loss: 0.8782, test_f1: 0.5534
 epoch: 65, train_loss: 0.8516, test_loss: 0.8664, test_f1: 0.5198
 epoch: 66, train_loss: 0.8561, test_loss: 0.8937, test_f1: 0.5312
 epoch: 67, train_loss: 0.8418, test_loss: 0.8732, test_f1: 0.5494
 epoch: 68, train_loss: 0.8564, test_loss: 0.8720, test_f1: 0.5366
 epoch: 69, train_loss: 0.8531, test_loss: 0.8829, test_f1: 0.5451
 epoch: 70, train_loss: 0.8473, test_loss: 0.8856, test_f1: 0.5596
 epoch: 71, train_loss: 0.8480, test_loss: 0.8856, test_f1: 0.5585
 epoch: 72, train_loss: 0.8478, test_loss: 0.8750, test_f1: 0.5349
 epoch: 73, train_loss: 0.8555, test_loss: 0.8741, test_f1: 0.5190
 epoch: 74, train_loss: 0.8457, test_loss: 0.8710, test_f1: 0.5445
 epoch: 75, train_loss: 0.8479, test_loss: 0.8656, test_f1: 0.5478
 epoch: 76, train_loss: 0.8347, test_loss: 0.8654, test_f1: 0.5687
 epoch: 77, train_loss: 0.8456, test_loss: 0.8617, test_f1: 0.5551
 epoch: 78, train_loss: 0.8511, test_loss: 0.8608, test_f1: 0.5147
 epoch: 79, train_loss: 0.8476, test_loss: 0.8723, test_f1: 0.5414
 epoch: 80, train_loss: 0.8509, test_loss: 0.8641, test_f1: 0.5393
 epoch: 81, train_loss: 0.8409, test_loss: 0.8652, test_f1: 0.5263
 epoch: 82, train_loss: 0.8402, test_loss: 0.8631, test_f1: 0.5660
 epoch: 83, train_loss: 0.8367, test_loss: 0.8625, test_f1: 0.5461
 epoch: 84, train_loss: 0.8391, test_loss: 0.8613, test_f1: 0.5474
 epoch: 85, train_loss: 0.8406, test_loss: 0.8448, test_f1: 0.5843
 epoch: 86, train_loss: 0.8459, test_loss: 0.8567, test_f1: 0.5457
 epoch: 87, train_loss: 0.8338, test_loss: 0.8662, test_f1: 0.5564
 epoch: 88, train_loss: 0.8458, test_loss: 0.8668, test_f1: 0.5348
 epoch: 89, train_loss: 0.8285, test_loss: 0.8651, test_f1: 0.5345
 epoch: 90, train_loss: 0.8260, test_loss: 0.8788, test_f1: 0.5361
 epoch: 91, train_loss: 0.8208, test_loss: 0.8660, test_f1: 0.5486
 epoch: 92, train_loss: 0.8466, test_loss: 0.8471, test_f1: 0.5497
 epoch: 93, train_loss: 0.8331, test_loss: 0.8479, test_f1: 0.5701
 epoch: 94, train_loss: 0.8319, test_loss: 0.8572, test_f1: 0.5622
 epoch: 95, train_loss: 0.8336, test_loss: 0.8609, test_f1: 0.5379
 epoch: 96, train_loss: 0.8295, test_loss: 0.8540, test_f1: 0.5444
 epoch: 97, train_loss: 0.8339, test_loss: 0.8860, test_f1: 0.5328
 epoch: 98, train_loss: 0.8340, test_loss: 0.8548, test_f1: 0.5577
 epoch: 99, train_loss: 0.8428, test_loss: 0.8467, test_f1: 0.5486
##################ITERATION #9 ****************************************
 epoch: 0, train_loss: 1.3133, test_loss: 1.1544, test_f1: 0.3113
 epoch: 1, train_loss: 1.1857, test_loss: 1.1008, test_f1: 0.3509
 epoch: 2, train_loss: 1.1586, test_loss: 1.0669, test_f1: 0.4181
 epoch: 3, train_loss: 1.1282, test_loss: 1.0439, test_f1: 0.3955
 epoch: 4, train_loss: 1.0881, test_loss: 1.0346, test_f1: 0.4084
 epoch: 5, train_loss: 1.0826, test_loss: 1.0154, test_f1: 0.4289
 epoch: 6, train_loss: 1.0585, test_loss: 1.0055, test_f1: 0.4302
 epoch: 7, train_loss: 1.0448, test_loss: 0.9980, test_f1: 0.4495
 epoch: 8, train_loss: 1.0304, test_loss: 1.0180, test_f1: 0.4695
 epoch: 9, train_loss: 1.0066, test_loss: 1.0000, test_f1: 0.4576
 epoch: 10, train_loss: 1.0091, test_loss: 1.0321, test_f1: 0.4550
 epoch: 11, train_loss: 0.9863, test_loss: 0.9978, test_f1: 0.4769
 epoch: 12, train_loss: 0.9827, test_loss: 0.9948, test_f1: 0.4759
 epoch: 13, train_loss: 0.9807, test_loss: 1.0137, test_f1: 0.4762
 epoch: 14, train_loss: 0.9707, test_loss: 1.0178, test_f1: 0.4764
 epoch: 15, train_loss: 0.9648, test_loss: 0.9931, test_f1: 0.4786
 epoch: 16, train_loss: 0.9645, test_loss: 1.0213, test_f1: 0.4766
 epoch: 17, train_loss: 0.9487, test_loss: 1.0181, test_f1: 0.4923
 epoch: 18, train_loss: 0.9526, test_loss: 1.0195, test_f1: 0.4814
 epoch: 19, train_loss: 0.9429, test_loss: 0.9990, test_f1: 0.5051
 epoch: 20, train_loss: 0.9372, test_loss: 1.0005, test_f1: 0.5018
 epoch: 21, train_loss: 0.9378, test_loss: 1.0028, test_f1: 0.5019
 epoch: 22, train_loss: 0.9241, test_loss: 1.0028, test_f1: 0.4997
 epoch: 23, train_loss: 0.9356, test_loss: 0.9819, test_f1: 0.5080
 epoch: 24, train_loss: 0.9335, test_loss: 0.9909, test_f1: 0.5094
 epoch: 25, train_loss: 0.9268, test_loss: 0.9860, test_f1: 0.5069
 epoch: 26, train_loss: 0.9422, test_loss: 0.9932, test_f1: 0.5248
 epoch: 27, train_loss: 0.9140, test_loss: 0.9921, test_f1: 0.5189
 epoch: 28, train_loss: 0.9205, test_loss: 1.0134, test_f1: 0.5214
 epoch: 29, train_loss: 0.9195, test_loss: 0.9963, test_f1: 0.5067
 epoch: 30, train_loss: 0.9198, test_loss: 0.9808, test_f1: 0.5336
 epoch: 31, train_loss: 0.9113, test_loss: 0.9678, test_f1: 0.5309
 epoch: 32, train_loss: 0.9306, test_loss: 0.9722, test_f1: 0.5396
 epoch: 33, train_loss: 0.9045, test_loss: 0.9762, test_f1: 0.5291
 epoch: 34, train_loss: 0.9111, test_loss: 0.9867, test_f1: 0.5247
 epoch: 35, train_loss: 0.9206, test_loss: 0.9879, test_f1: 0.5180
 epoch: 36, train_loss: 0.9074, test_loss: 0.9762, test_f1: 0.5250
 epoch: 37, train_loss: 0.8930, test_loss: 0.9701, test_f1: 0.5096
 epoch: 38, train_loss: 0.9100, test_loss: 0.9589, test_f1: 0.5270
 epoch: 39, train_loss: 0.9125, test_loss: 0.9644, test_f1: 0.5466
 epoch: 40, train_loss: 0.9074, test_loss: 0.9630, test_f1: 0.5304
 epoch: 41, train_loss: 0.9063, test_loss: 0.9680, test_f1: 0.5111
 epoch: 42, train_loss: 0.8961, test_loss: 0.9619, test_f1: 0.5197
 epoch: 43, train_loss: 0.9161, test_loss: 0.9720, test_f1: 0.5220
 epoch: 44, train_loss: 0.8897, test_loss: 0.9772, test_f1: 0.5240
 epoch: 45, train_loss: 0.8871, test_loss: 0.9466, test_f1: 0.5430
 epoch: 46, train_loss: 0.8865, test_loss: 0.9528, test_f1: 0.5297
 epoch: 47, train_loss: 0.8969, test_loss: 0.9691, test_f1: 0.5197
 epoch: 48, train_loss: 0.8786, test_loss: 0.9767, test_f1: 0.4989
 epoch: 49, train_loss: 0.8855, test_loss: 0.9537, test_f1: 0.5223
 epoch: 50, train_loss: 0.8798, test_loss: 0.9518, test_f1: 0.5351
 epoch: 51, train_loss: 0.8814, test_loss: 0.9512, test_f1: 0.5692
 epoch: 52, train_loss: 0.8766, test_loss: 0.9516, test_f1: 0.5440
 epoch: 53, train_loss: 0.8660, test_loss: 0.9536, test_f1: 0.5094
 epoch: 54, train_loss: 0.8834, test_loss: 0.9457, test_f1: 0.5335
 epoch: 55, train_loss: 0.8660, test_loss: 0.9380, test_f1: 0.5490
 epoch: 56, train_loss: 0.8700, test_loss: 0.9480, test_f1: 0.5347
 epoch: 57, train_loss: 0.8838, test_loss: 0.9460, test_f1: 0.5563
 epoch: 58, train_loss: 0.8705, test_loss: 0.9471, test_f1: 0.5608
 epoch: 59, train_loss: 0.8669, test_loss: 0.9453, test_f1: 0.5560
 epoch: 60, train_loss: 0.8799, test_loss: 0.9416, test_f1: 0.5503
 epoch: 61, train_loss: 0.8740, test_loss: 0.9342, test_f1: 0.5538
 epoch: 62, train_loss: 0.8659, test_loss: 0.9481, test_f1: 0.5494
 epoch: 63, train_loss: 0.8668, test_loss: 0.9596, test_f1: 0.5253
 epoch: 64, train_loss: 0.8583, test_loss: 0.9443, test_f1: 0.5390
 epoch: 65, train_loss: 0.8670, test_loss: 0.9404, test_f1: 0.5408
 epoch: 66, train_loss: 0.8653, test_loss: 0.9468, test_f1: 0.5358
 epoch: 67, train_loss: 0.8622, test_loss: 0.9487, test_f1: 0.5536
 epoch: 68, train_loss: 0.8600, test_loss: 0.9469, test_f1: 0.5498
 epoch: 69, train_loss: 0.8537, test_loss: 0.9371, test_f1: 0.5502
 epoch: 70, train_loss: 0.8681, test_loss: 0.9499, test_f1: 0.5331
 epoch: 71, train_loss: 0.8660, test_loss: 0.9267, test_f1: 0.5384
 epoch: 72, train_loss: 0.8603, test_loss: 0.9472, test_f1: 0.5360
 epoch: 73, train_loss: 0.8461, test_loss: 0.9543, test_f1: 0.5338
 epoch: 74, train_loss: 0.8670, test_loss: 0.9430, test_f1: 0.5359
 epoch: 75, train_loss: 0.8594, test_loss: 0.9366, test_f1: 0.5478
 epoch: 76, train_loss: 0.8621, test_loss: 0.9532, test_f1: 0.5104
 epoch: 77, train_loss: 0.8512, test_loss: 0.9548, test_f1: 0.5379
 epoch: 78, train_loss: 0.8576, test_loss: 0.9405, test_f1: 0.5239
 epoch: 79, train_loss: 0.8480, test_loss: 0.9385, test_f1: 0.5563
 epoch: 80, train_loss: 0.8552, test_loss: 0.9415, test_f1: 0.5597
 epoch: 81, train_loss: 0.8593, test_loss: 0.9453, test_f1: 0.5618
 epoch: 82, train_loss: 0.8490, test_loss: 0.9411, test_f1: 0.5512
 epoch: 83, train_loss: 0.8570, test_loss: 0.9561, test_f1: 0.5363
 epoch: 84, train_loss: 0.8549, test_loss: 0.9477, test_f1: 0.5405
 epoch: 85, train_loss: 0.8599, test_loss: 0.9489, test_f1: 0.5344
 epoch: 86, train_loss: 0.8544, test_loss: 0.9439, test_f1: 0.5458
 epoch: 87, train_loss: 0.8486, test_loss: 0.9419, test_f1: 0.5410
 epoch: 88, train_loss: 0.8572, test_loss: 0.9414, test_f1: 0.5493
 epoch: 89, train_loss: 0.8574, test_loss: 0.9591, test_f1: 0.5122
 epoch: 90, train_loss: 0.8437, test_loss: 0.9401, test_f1: 0.5677
 epoch: 91, train_loss: 0.8546, test_loss: 0.9360, test_f1: 0.5710
 epoch: 92, train_loss: 0.8512, test_loss: 0.9516, test_f1: 0.5676
 epoch: 93, train_loss: 0.8491, test_loss: 0.9603, test_f1: 0.5317
 epoch: 94, train_loss: 0.8506, test_loss: 0.9355, test_f1: 0.5727
 epoch: 95, train_loss: 0.8491, test_loss: 0.9364, test_f1: 0.5654
 epoch: 96, train_loss: 0.8431, test_loss: 0.9415, test_f1: 0.5570
 epoch: 97, train_loss: 0.8444, test_loss: 0.9325, test_f1: 0.5549
 epoch: 98, train_loss: 0.8479, test_loss: 0.9302, test_f1: 0.5906
 epoch: 99, train_loss: 0.8387, test_loss: 0.9332, test_f1: 0.5740

Training completed in 818.27 seconds
Best F1: 0.6189 at epoch 78
Mean F1 across iterations: 0.5805  0.0217
========================FINAL RESULTS================================
FEGIN weighted F1: 0.6189  0.0217
python main.py --data ltspice_examples --representation component_net --model FEGIN --layers 2 --hiddens 16 --batch_size 32 --lr 0.001 --emb_size 250 --epochs 100 --save_appendix component_net_L2_H16_BS32_LR0.001_E250 --no_val
-----



STDERR:
  File "main.py", line 370, in <module>
    main()
  File "main.py", line 254, in main
    dataset = dataset_class(
  File "/home/philip/projects/llm_inference_code_repo/Circuit-Completion-Using-GNNs/component_classification_with_link_prediction_head/evaluation/FEGIN/kernel/circuit_datasets.py", line 15, in __init__
    self.data, self.slices = torch.load(self.processed_paths[0])
  File "/home/philip/.local/lib/python3.8/site-packages/torch/serialization.py", line 1040, in load
    warnings.warn(
  File "/usr/lib/python3.8/warnings.py", line 109, in _showwarnmsg
    sw(msg.message, msg.category, msg.filename, msg.lineno,
  File "main.py", line 47, in warn_with_traceback
    traceback.print_stack(file=log)
/home/philip/projects/llm_inference_code_repo/Circuit-Completion-Using-GNNs/component_classification_with_link_prediction_head/evaluation/FEGIN/kernel/circuit_datasets.py:15: FutureWarning: You are using `torch.load` with `weights_only=False` (the current default value), which uses the default pickle module implicitly. It is possible to construct malicious pickle data which will execute arbitrary code during unpickling (See https://github.com/pytorch/pytorch/blob/main/SECURITY.md#untrusted-models for more details). In a future release, the default value for `weights_only` will be flipped to `True`. This limits the functions that could be executed during unpickling. Arbitrary objects will no longer be allowed to be loaded via this mode unless they are explicitly allowlisted by the user via `torch.serialization.add_safe_globals`. We recommend you start setting `weights_only=True` for any use case where you don't have full control of the loaded file. Please open an issue on GitHub for any issues related to this experimental feature.
  self.data, self.slices = torch.load(self.processed_paths[0])
