STDOUT:
Results will be saved in /home/philip/projects/ltspice_examples_code_repo/Circuit-Completion-Using-GNNs/component_classification_with_link_prediction_head/evaluation/FEGIN/results/model_FEGIN_dataset_ltspice_demos
Command line input: python main.py --data ltspice_demos --representation component_component --model FEGIN --layers 4 --hiddens 64 --batch_size 32 --lr 0.001 --emb_size 128 --epochs 100 --save_appendix component_component_L4_H64_BS32_LR0.001_E128 --no_val
 is saved.
-----
ltspice_demos - FEGIN
Using 4 layers, 64 hidden units, h = 2
Loading component_component representation dataset
ENTERED
Training FEGIN on component_component representation
Train: 1565, Test: 383
##################ITERATION #0 ****************************************
 epoch: 0, train_loss: 1.2529, test_loss: 1.3513, test_f1: 0.3306
 epoch: 1, train_loss: 1.1605, test_loss: 1.2443, test_f1: 0.3689
 epoch: 2, train_loss: 1.1061, test_loss: 1.1907, test_f1: 0.3260
 epoch: 3, train_loss: 1.0700, test_loss: 1.2455, test_f1: 0.3838
 epoch: 4, train_loss: 1.0392, test_loss: 1.1670, test_f1: 0.4328
 epoch: 5, train_loss: 1.0078, test_loss: 1.1652, test_f1: 0.4398
 epoch: 6, train_loss: 0.9985, test_loss: 1.1740, test_f1: 0.4812
 epoch: 7, train_loss: 0.9635, test_loss: 1.1657, test_f1: 0.4629
 epoch: 8, train_loss: 0.9190, test_loss: 1.1384, test_f1: 0.5481
 epoch: 9, train_loss: 0.8840, test_loss: 1.1382, test_f1: 0.5174
 epoch: 10, train_loss: 0.8555, test_loss: 1.1260, test_f1: 0.5540
 epoch: 11, train_loss: 0.8439, test_loss: 1.1880, test_f1: 0.4976
 epoch: 12, train_loss: 0.8660, test_loss: 1.1954, test_f1: 0.5575
 epoch: 13, train_loss: 0.8342, test_loss: 1.0917, test_f1: 0.5337
 epoch: 14, train_loss: 0.8022, test_loss: 1.2173, test_f1: 0.4858
 epoch: 15, train_loss: 0.8044, test_loss: 1.1300, test_f1: 0.5975
 epoch: 16, train_loss: 0.7785, test_loss: 1.1878, test_f1: 0.5555
 epoch: 17, train_loss: 0.7696, test_loss: 1.1341, test_f1: 0.5789
 epoch: 18, train_loss: 0.7535, test_loss: 1.1386, test_f1: 0.5514
 epoch: 19, train_loss: 0.7448, test_loss: 1.1734, test_f1: 0.5348
 epoch: 20, train_loss: 0.7282, test_loss: 1.2091, test_f1: 0.5951
 epoch: 21, train_loss: 0.7370, test_loss: 1.2994, test_f1: 0.5383
 epoch: 22, train_loss: 0.7044, test_loss: 1.3534, test_f1: 0.5053
 epoch: 23, train_loss: 0.6989, test_loss: 1.2902, test_f1: 0.5449
 epoch: 24, train_loss: 0.6805, test_loss: 1.3098, test_f1: 0.5638
 epoch: 25, train_loss: 0.6765, test_loss: 1.3274, test_f1: 0.5632
 epoch: 26, train_loss: 0.6743, test_loss: 1.5463, test_f1: 0.5732
 epoch: 27, train_loss: 0.6996, test_loss: 1.4021, test_f1: 0.5589
 epoch: 28, train_loss: 0.6321, test_loss: 1.8549, test_f1: 0.5537
 epoch: 29, train_loss: 0.6327, test_loss: 2.1216, test_f1: 0.5606
 epoch: 30, train_loss: 0.6264, test_loss: 1.8093, test_f1: 0.5750
 epoch: 31, train_loss: 0.6281, test_loss: 1.9100, test_f1: 0.5944
 epoch: 32, train_loss: 0.6252, test_loss: 1.9717, test_f1: 0.5474
 epoch: 33, train_loss: 0.6114, test_loss: 2.2917, test_f1: 0.5344
 epoch: 34, train_loss: 0.5811, test_loss: 1.9229, test_f1: 0.5923
 epoch: 35, train_loss: 0.5934, test_loss: 1.7129, test_f1: 0.5483
 epoch: 36, train_loss: 0.5896, test_loss: 2.0260, test_f1: 0.5720
 epoch: 37, train_loss: 0.5754, test_loss: 1.6815, test_f1: 0.5869
 epoch: 38, train_loss: 0.5588, test_loss: 1.9428, test_f1: 0.5290
 epoch: 39, train_loss: 0.5546, test_loss: 2.0144, test_f1: 0.5454
 epoch: 40, train_loss: 0.5427, test_loss: 1.9551, test_f1: 0.5613
 epoch: 41, train_loss: 0.5630, test_loss: 2.0423, test_f1: 0.5896
 epoch: 42, train_loss: 0.5391, test_loss: 1.9145, test_f1: 0.5931
 epoch: 43, train_loss: 0.5651, test_loss: 1.9040, test_f1: 0.5882
 epoch: 44, train_loss: 0.5251, test_loss: 2.1483, test_f1: 0.5058
 epoch: 45, train_loss: 0.5313, test_loss: 1.8089, test_f1: 0.5558
 epoch: 46, train_loss: 0.5123, test_loss: 1.6267, test_f1: 0.5917
 epoch: 47, train_loss: 0.4748, test_loss: 2.0829, test_f1: 0.6106
 epoch: 48, train_loss: 0.5134, test_loss: 2.3993, test_f1: 0.4857
 epoch: 49, train_loss: 0.4876, test_loss: 2.2853, test_f1: 0.6166
 epoch: 50, train_loss: 0.4937, test_loss: 3.1566, test_f1: 0.5441
 epoch: 51, train_loss: 0.4378, test_loss: 2.5204, test_f1: 0.5778
 epoch: 52, train_loss: 0.4141, test_loss: 2.7570, test_f1: 0.5589
 epoch: 53, train_loss: 0.4184, test_loss: 2.9780, test_f1: 0.5943
 epoch: 54, train_loss: 0.3870, test_loss: 3.4649, test_f1: 0.5438
 epoch: 55, train_loss: 0.4013, test_loss: 3.5249, test_f1: 0.5498
 epoch: 56, train_loss: 0.3722, test_loss: 2.9757, test_f1: 0.5918
 epoch: 57, train_loss: 0.3887, test_loss: 3.2869, test_f1: 0.5764
 epoch: 58, train_loss: 0.3612, test_loss: 3.3125, test_f1: 0.5786
 epoch: 59, train_loss: 0.3660, test_loss: 2.6402, test_f1: 0.5540
 epoch: 60, train_loss: 0.3638, test_loss: 3.0853, test_f1: 0.5623
 epoch: 61, train_loss: 0.3551, test_loss: 2.8307, test_f1: 0.5935
 epoch: 62, train_loss: 0.3744, test_loss: 2.9705, test_f1: 0.5947
 epoch: 63, train_loss: 0.3417, test_loss: 2.9462, test_f1: 0.5683
 epoch: 64, train_loss: 0.3459, test_loss: 3.7416, test_f1: 0.5820
 epoch: 65, train_loss: 0.3588, test_loss: 3.0652, test_f1: 0.5681
 epoch: 66, train_loss: 0.3504, test_loss: 3.2957, test_f1: 0.5772
 epoch: 67, train_loss: 0.3681, test_loss: 3.2027, test_f1: 0.5564
 epoch: 68, train_loss: 0.3376, test_loss: 3.4390, test_f1: 0.6235
 epoch: 69, train_loss: 0.3469, test_loss: 3.1357, test_f1: 0.5515
 epoch: 70, train_loss: 0.3393, test_loss: 3.2658, test_f1: 0.5828
 epoch: 71, train_loss: 0.3358, test_loss: 3.4463, test_f1: 0.5734
 epoch: 72, train_loss: 0.3175, test_loss: 3.7604, test_f1: 0.5869
 epoch: 73, train_loss: 0.3050, test_loss: 3.2008, test_f1: 0.5677
 epoch: 74, train_loss: 0.2914, test_loss: 3.5066, test_f1: 0.5794
 epoch: 75, train_loss: 0.3105, test_loss: 3.1193, test_f1: 0.6000
 epoch: 76, train_loss: 0.3124, test_loss: 3.4622, test_f1: 0.6071
 epoch: 77, train_loss: 0.3460, test_loss: 3.4909, test_f1: 0.5762
 epoch: 78, train_loss: 0.3243, test_loss: 3.4833, test_f1: 0.5686
 epoch: 79, train_loss: 0.3097, test_loss: 3.2408, test_f1: 0.5904
 epoch: 80, train_loss: 0.2931, test_loss: 3.9211, test_f1: 0.6054
 epoch: 81, train_loss: 0.3097, test_loss: 3.9022, test_f1: 0.5723
 epoch: 82, train_loss: 0.3125, test_loss: 3.7935, test_f1: 0.5510
 epoch: 83, train_loss: 0.2964, test_loss: 3.8603, test_f1: 0.5940
 epoch: 84, train_loss: 0.3132, test_loss: 3.1540, test_f1: 0.5673
 epoch: 85, train_loss: 0.2891, test_loss: 3.5741, test_f1: 0.5784
 epoch: 86, train_loss: 0.2890, test_loss: 3.7842, test_f1: 0.5763
 epoch: 87, train_loss: 0.2664, test_loss: 4.0035, test_f1: 0.5715
 epoch: 88, train_loss: 0.2845, test_loss: 4.1442, test_f1: 0.5973
 epoch: 89, train_loss: 0.2740, test_loss: 4.0551, test_f1: 0.5913
 epoch: 90, train_loss: 0.2701, test_loss: 4.4260, test_f1: 0.5815
 epoch: 91, train_loss: 0.3114, test_loss: 4.2604, test_f1: 0.6107
 epoch: 92, train_loss: 0.2640, test_loss: 3.6230, test_f1: 0.5960
 epoch: 93, train_loss: 0.2955, test_loss: 4.5028, test_f1: 0.6087
 epoch: 94, train_loss: 0.2606, test_loss: 4.4255, test_f1: 0.5893
 epoch: 95, train_loss: 0.2887, test_loss: 3.9810, test_f1: 0.5889
 epoch: 96, train_loss: 0.2935, test_loss: 4.4047, test_f1: 0.5972
 epoch: 97, train_loss: 0.2473, test_loss: 3.6857, test_f1: 0.5632
 epoch: 98, train_loss: 0.2754, test_loss: 4.0164, test_f1: 0.5822
 epoch: 99, train_loss: 0.2743, test_loss: 4.7909, test_f1: 0.5605
##################ITERATION #1 ****************************************
 epoch: 0, train_loss: 1.2146, test_loss: 1.2386, test_f1: 0.4179
 epoch: 1, train_loss: 1.0917, test_loss: 1.1835, test_f1: 0.4643
 epoch: 2, train_loss: 1.0254, test_loss: 1.2476, test_f1: 0.5256
 epoch: 3, train_loss: 1.0216, test_loss: 1.1385, test_f1: 0.5459
 epoch: 4, train_loss: 1.0126, test_loss: 1.1836, test_f1: 0.5262
 epoch: 5, train_loss: 0.9611, test_loss: 1.2186, test_f1: 0.4881
 epoch: 6, train_loss: 0.9400, test_loss: 1.1418, test_f1: 0.5117
 epoch: 7, train_loss: 0.9011, test_loss: 1.1184, test_f1: 0.5572
 epoch: 8, train_loss: 0.8706, test_loss: 1.1538, test_f1: 0.5257
 epoch: 9, train_loss: 0.8335, test_loss: 1.0961, test_f1: 0.5345
 epoch: 10, train_loss: 0.8648, test_loss: 1.1234, test_f1: 0.5678
 epoch: 11, train_loss: 0.8387, test_loss: 1.2120, test_f1: 0.5244
 epoch: 12, train_loss: 0.8159, test_loss: 1.3101, test_f1: 0.6065
 epoch: 13, train_loss: 0.8055, test_loss: 1.3667, test_f1: 0.5149
 epoch: 14, train_loss: 0.7866, test_loss: 1.3021, test_f1: 0.5853
 epoch: 15, train_loss: 0.7665, test_loss: 1.5288, test_f1: 0.5635
 epoch: 16, train_loss: 0.7480, test_loss: 1.2975, test_f1: 0.5914
 epoch: 17, train_loss: 0.7207, test_loss: 1.5779, test_f1: 0.6284
 epoch: 18, train_loss: 0.7389, test_loss: 1.8671, test_f1: 0.4857
 epoch: 19, train_loss: 0.7423, test_loss: 1.6150, test_f1: 0.5760
 epoch: 20, train_loss: 0.7153, test_loss: 1.3144, test_f1: 0.5767
 epoch: 21, train_loss: 0.6921, test_loss: 1.3040, test_f1: 0.5428
 epoch: 22, train_loss: 0.6819, test_loss: 1.3305, test_f1: 0.6081
 epoch: 23, train_loss: 0.6562, test_loss: 1.4921, test_f1: 0.5329
 epoch: 24, train_loss: 0.6748, test_loss: 1.4015, test_f1: 0.6037
 epoch: 25, train_loss: 0.6700, test_loss: 1.5220, test_f1: 0.5779
 epoch: 26, train_loss: 0.6353, test_loss: 1.8643, test_f1: 0.5368
 epoch: 27, train_loss: 0.6537, test_loss: 1.3267, test_f1: 0.5921
 epoch: 28, train_loss: 0.6361, test_loss: 1.4914, test_f1: 0.5966
 epoch: 29, train_loss: 0.6252, test_loss: 1.6452, test_f1: 0.5474
 epoch: 30, train_loss: 0.5986, test_loss: 1.6142, test_f1: 0.5636
 epoch: 31, train_loss: 0.6267, test_loss: 1.6341, test_f1: 0.5757
 epoch: 32, train_loss: 0.5921, test_loss: 1.7829, test_f1: 0.5739
 epoch: 33, train_loss: 0.5834, test_loss: 1.9215, test_f1: 0.5786
 epoch: 34, train_loss: 0.5490, test_loss: 2.3080, test_f1: 0.5257
 epoch: 35, train_loss: 0.5853, test_loss: 1.7636, test_f1: 0.5596
 epoch: 36, train_loss: 0.5720, test_loss: 1.7041, test_f1: 0.5399
 epoch: 37, train_loss: 0.5796, test_loss: 2.1333, test_f1: 0.5588
 epoch: 38, train_loss: 0.5397, test_loss: 1.8245, test_f1: 0.5908
 epoch: 39, train_loss: 0.5515, test_loss: 1.7237, test_f1: 0.5936
 epoch: 40, train_loss: 0.5384, test_loss: 1.7170, test_f1: 0.6009
 epoch: 41, train_loss: 0.5452, test_loss: 1.8135, test_f1: 0.6083
 epoch: 42, train_loss: 0.5166, test_loss: 1.7581, test_f1: 0.5551
 epoch: 43, train_loss: 0.5276, test_loss: 1.8619, test_f1: 0.5765
 epoch: 44, train_loss: 0.5148, test_loss: 1.9733, test_f1: 0.5911
 epoch: 45, train_loss: 0.5096, test_loss: 1.9043, test_f1: 0.6147
 epoch: 46, train_loss: 0.5073, test_loss: 1.8823, test_f1: 0.5771
 epoch: 47, train_loss: 0.4839, test_loss: 2.1872, test_f1: 0.5673
 epoch: 48, train_loss: 0.4735, test_loss: 1.8628, test_f1: 0.6249
 epoch: 49, train_loss: 0.4923, test_loss: 2.2725, test_f1: 0.5651
 epoch: 50, train_loss: 0.5046, test_loss: 2.0994, test_f1: 0.6046
 epoch: 51, train_loss: 0.4589, test_loss: 2.2819, test_f1: 0.5660
 epoch: 52, train_loss: 0.4164, test_loss: 2.3950, test_f1: 0.5584
 epoch: 53, train_loss: 0.4074, test_loss: 2.4683, test_f1: 0.5792
 epoch: 54, train_loss: 0.4068, test_loss: 2.4372, test_f1: 0.5753
 epoch: 55, train_loss: 0.3881, test_loss: 2.4388, test_f1: 0.5861
 epoch: 56, train_loss: 0.3883, test_loss: 3.0461, test_f1: 0.5783
 epoch: 57, train_loss: 0.3928, test_loss: 2.4396, test_f1: 0.5827
 epoch: 58, train_loss: 0.3987, test_loss: 2.7378, test_f1: 0.5645
 epoch: 59, train_loss: 0.3720, test_loss: 2.6807, test_f1: 0.5691
 epoch: 60, train_loss: 0.3876, test_loss: 3.4077, test_f1: 0.5166
 epoch: 61, train_loss: 0.3912, test_loss: 2.8383, test_f1: 0.5710
 epoch: 62, train_loss: 0.3647, test_loss: 2.8474, test_f1: 0.5685
 epoch: 63, train_loss: 0.3820, test_loss: 2.7499, test_f1: 0.5700
 epoch: 64, train_loss: 0.3335, test_loss: 3.0575, test_f1: 0.5478
 epoch: 65, train_loss: 0.3721, test_loss: 3.2267, test_f1: 0.5545
 epoch: 66, train_loss: 0.3519, test_loss: 2.9004, test_f1: 0.5619
 epoch: 67, train_loss: 0.3411, test_loss: 2.8318, test_f1: 0.5767
 epoch: 68, train_loss: 0.3711, test_loss: 3.2437, test_f1: 0.5415
 epoch: 69, train_loss: 0.3393, test_loss: 2.6844, test_f1: 0.5788
 epoch: 70, train_loss: 0.3378, test_loss: 2.9074, test_f1: 0.5825
 epoch: 71, train_loss: 0.3501, test_loss: 2.6873, test_f1: 0.5770
 epoch: 72, train_loss: 0.3522, test_loss: 3.0337, test_f1: 0.5718
 epoch: 73, train_loss: 0.3574, test_loss: 2.8959, test_f1: 0.5518
 epoch: 74, train_loss: 0.3266, test_loss: 3.0134, test_f1: 0.5712
 epoch: 75, train_loss: 0.3239, test_loss: 2.8601, test_f1: 0.5931
 epoch: 76, train_loss: 0.3068, test_loss: 3.3161, test_f1: 0.5878
 epoch: 77, train_loss: 0.3068, test_loss: 3.5940, test_f1: 0.5931
 epoch: 78, train_loss: 0.3477, test_loss: 3.2394, test_f1: 0.5688
 epoch: 79, train_loss: 0.3346, test_loss: 2.9503, test_f1: 0.6064
 epoch: 80, train_loss: 0.3131, test_loss: 3.3214, test_f1: 0.5769
 epoch: 81, train_loss: 0.3203, test_loss: 3.1233, test_f1: 0.5948
 epoch: 82, train_loss: 0.3064, test_loss: 3.3842, test_f1: 0.5822
 epoch: 83, train_loss: 0.3109, test_loss: 3.3955, test_f1: 0.5687
 epoch: 84, train_loss: 0.3134, test_loss: 3.0829, test_f1: 0.5592
 epoch: 85, train_loss: 0.2693, test_loss: 3.6135, test_f1: 0.5858
 epoch: 86, train_loss: 0.2833, test_loss: 3.9340, test_f1: 0.5668
 epoch: 87, train_loss: 0.2877, test_loss: 4.0035, test_f1: 0.5531
 epoch: 88, train_loss: 0.2872, test_loss: 3.4460, test_f1: 0.6009
 epoch: 89, train_loss: 0.2844, test_loss: 3.3564, test_f1: 0.5812
 epoch: 90, train_loss: 0.2692, test_loss: 3.8488, test_f1: 0.5828
 epoch: 91, train_loss: 0.2728, test_loss: 4.1121, test_f1: 0.5739
 epoch: 92, train_loss: 0.2926, test_loss: 3.7608, test_f1: 0.5835
 epoch: 93, train_loss: 0.2816, test_loss: 4.0190, test_f1: 0.5878
 epoch: 94, train_loss: 0.2781, test_loss: 4.0382, test_f1: 0.5739
 epoch: 95, train_loss: 0.2522, test_loss: 4.0444, test_f1: 0.5561
 epoch: 96, train_loss: 0.2765, test_loss: 3.8425, test_f1: 0.5668
 epoch: 97, train_loss: 0.2996, test_loss: 4.0179, test_f1: 0.5727
 epoch: 98, train_loss: 0.2692, test_loss: 3.9888, test_f1: 0.5792
 epoch: 99, train_loss: 0.2630, test_loss: 4.2034, test_f1: 0.5725
##################ITERATION #2 ****************************************
 epoch: 0, train_loss: 1.2175, test_loss: 1.2109, test_f1: 0.3686
 epoch: 1, train_loss: 1.0939, test_loss: 1.1610, test_f1: 0.4750
 epoch: 2, train_loss: 1.0671, test_loss: 1.1253, test_f1: 0.5176
 epoch: 3, train_loss: 1.0076, test_loss: 1.1601, test_f1: 0.4902
 epoch: 4, train_loss: 0.9833, test_loss: 1.1285, test_f1: 0.5170
 epoch: 5, train_loss: 0.9595, test_loss: 1.0722, test_f1: 0.4998
 epoch: 6, train_loss: 0.9406, test_loss: 1.0676, test_f1: 0.5961
 epoch: 7, train_loss: 0.9255, test_loss: 1.0699, test_f1: 0.5121
 epoch: 8, train_loss: 0.9027, test_loss: 1.0694, test_f1: 0.5952
 epoch: 9, train_loss: 0.8871, test_loss: 1.0406, test_f1: 0.6157
 epoch: 10, train_loss: 0.8416, test_loss: 1.5258, test_f1: 0.5987
 epoch: 11, train_loss: 0.8710, test_loss: 1.1953, test_f1: 0.5178
 epoch: 12, train_loss: 0.8372, test_loss: 1.7782, test_f1: 0.5952
 epoch: 13, train_loss: 0.8214, test_loss: 1.1345, test_f1: 0.5330
 epoch: 14, train_loss: 0.8061, test_loss: 1.1413, test_f1: 0.5795
 epoch: 15, train_loss: 0.7870, test_loss: 1.0834, test_f1: 0.5783
 epoch: 16, train_loss: 0.7905, test_loss: 1.3297, test_f1: 0.5767
 epoch: 17, train_loss: 0.7771, test_loss: 1.3140, test_f1: 0.6074
 epoch: 18, train_loss: 0.7828, test_loss: 1.3211, test_f1: 0.5669
 epoch: 19, train_loss: 0.7686, test_loss: 1.4407, test_f1: 0.5513
 epoch: 20, train_loss: 0.7685, test_loss: 1.3709, test_f1: 0.5338
 epoch: 21, train_loss: 0.7373, test_loss: 1.4282, test_f1: 0.5558
 epoch: 22, train_loss: 0.7354, test_loss: 1.3222, test_f1: 0.5573
 epoch: 23, train_loss: 0.7150, test_loss: 1.2447, test_f1: 0.6098
 epoch: 24, train_loss: 0.7121, test_loss: 1.3366, test_f1: 0.5954
 epoch: 25, train_loss: 0.7091, test_loss: 1.7296, test_f1: 0.5845
 epoch: 26, train_loss: 0.7178, test_loss: 1.4217, test_f1: 0.5378
 epoch: 27, train_loss: 0.6941, test_loss: 1.6490, test_f1: 0.5449
 epoch: 28, train_loss: 0.6855, test_loss: 2.3939, test_f1: 0.5722
 epoch: 29, train_loss: 0.6906, test_loss: 1.6113, test_f1: 0.5829
 epoch: 30, train_loss: 0.6413, test_loss: 1.5970, test_f1: 0.5666
 epoch: 31, train_loss: 0.6504, test_loss: 1.7444, test_f1: 0.5513
 epoch: 32, train_loss: 0.6503, test_loss: 1.5956, test_f1: 0.5972
 epoch: 33, train_loss: 0.6641, test_loss: 1.5884, test_f1: 0.5066
 epoch: 34, train_loss: 0.6690, test_loss: 1.5297, test_f1: 0.5817
 epoch: 35, train_loss: 0.6124, test_loss: 1.5336, test_f1: 0.5865
 epoch: 36, train_loss: 0.6357, test_loss: 1.7313, test_f1: 0.5131
 epoch: 37, train_loss: 0.6163, test_loss: 1.5715, test_f1: 0.5718
 epoch: 38, train_loss: 0.5977, test_loss: 1.4937, test_f1: 0.5916
 epoch: 39, train_loss: 0.5767, test_loss: 1.8412, test_f1: 0.5406
 epoch: 40, train_loss: 0.6142, test_loss: 1.8451, test_f1: 0.5626
 epoch: 41, train_loss: 0.5924, test_loss: 1.5287, test_f1: 0.5681
 epoch: 42, train_loss: 0.5649, test_loss: 1.8003, test_f1: 0.5508
 epoch: 43, train_loss: 0.5737, test_loss: 1.9503, test_f1: 0.5530
 epoch: 44, train_loss: 0.5746, test_loss: 1.6393, test_f1: 0.5208
 epoch: 45, train_loss: 0.5362, test_loss: 1.7276, test_f1: 0.5614
 epoch: 46, train_loss: 0.5716, test_loss: 1.5888, test_f1: 0.5565
 epoch: 47, train_loss: 0.5703, test_loss: 1.5199, test_f1: 0.5420
 epoch: 48, train_loss: 0.5608, test_loss: 1.9378, test_f1: 0.5045
 epoch: 49, train_loss: 0.5216, test_loss: 2.0072, test_f1: 0.5600
 epoch: 50, train_loss: 0.5523, test_loss: 1.5331, test_f1: 0.5284
 epoch: 51, train_loss: 0.4900, test_loss: 1.5806, test_f1: 0.5728
 epoch: 52, train_loss: 0.4616, test_loss: 1.6969, test_f1: 0.5693
 epoch: 53, train_loss: 0.4454, test_loss: 1.9021, test_f1: 0.5513
 epoch: 54, train_loss: 0.4578, test_loss: 1.6163, test_f1: 0.5871
 epoch: 55, train_loss: 0.4326, test_loss: 2.0321, test_f1: 0.5723
 epoch: 56, train_loss: 0.4354, test_loss: 2.0807, test_f1: 0.5720
 epoch: 57, train_loss: 0.4465, test_loss: 1.8219, test_f1: 0.5903
 epoch: 58, train_loss: 0.4415, test_loss: 2.0567, test_f1: 0.5740
 epoch: 59, train_loss: 0.4258, test_loss: 2.0736, test_f1: 0.5786
 epoch: 60, train_loss: 0.4032, test_loss: 2.0396, test_f1: 0.6068
 epoch: 61, train_loss: 0.4579, test_loss: 1.9813, test_f1: 0.5475
 epoch: 62, train_loss: 0.4213, test_loss: 1.9553, test_f1: 0.5745
 epoch: 63, train_loss: 0.4283, test_loss: 1.9526, test_f1: 0.5633
 epoch: 64, train_loss: 0.4086, test_loss: 1.8796, test_f1: 0.5776
 epoch: 65, train_loss: 0.4058, test_loss: 2.2461, test_f1: 0.5497
 epoch: 66, train_loss: 0.4038, test_loss: 2.1498, test_f1: 0.5342
 epoch: 67, train_loss: 0.3882, test_loss: 2.0531, test_f1: 0.5719
 epoch: 68, train_loss: 0.3546, test_loss: 2.1752, test_f1: 0.5573
 epoch: 69, train_loss: 0.3706, test_loss: 1.9071, test_f1: 0.5771
 epoch: 70, train_loss: 0.3924, test_loss: 2.1575, test_f1: 0.5904
 epoch: 71, train_loss: 0.4024, test_loss: 1.8202, test_f1: 0.5644
 epoch: 72, train_loss: 0.3778, test_loss: 2.1920, test_f1: 0.5644
 epoch: 73, train_loss: 0.3571, test_loss: 2.1364, test_f1: 0.5564
 epoch: 74, train_loss: 0.3797, test_loss: 2.1639, test_f1: 0.5883
 epoch: 75, train_loss: 0.3882, test_loss: 2.3276, test_f1: 0.5914
 epoch: 76, train_loss: 0.3962, test_loss: 2.0751, test_f1: 0.5692
 epoch: 77, train_loss: 0.3787, test_loss: 2.4062, test_f1: 0.5702
 epoch: 78, train_loss: 0.3616, test_loss: 2.0109, test_f1: 0.5979
 epoch: 79, train_loss: 0.3580, test_loss: 1.8211, test_f1: 0.5742
 epoch: 80, train_loss: 0.3578, test_loss: 2.2167, test_f1: 0.5775
 epoch: 81, train_loss: 0.3367, test_loss: 2.0476, test_f1: 0.5964
 epoch: 82, train_loss: 0.3601, test_loss: 2.4352, test_f1: 0.5581
 epoch: 83, train_loss: 0.3530, test_loss: 2.4322, test_f1: 0.5680
 epoch: 84, train_loss: 0.3677, test_loss: 2.2393, test_f1: 0.6112
 epoch: 85, train_loss: 0.3562, test_loss: 2.4208, test_f1: 0.6031
 epoch: 86, train_loss: 0.3586, test_loss: 2.0979, test_f1: 0.5673
 epoch: 87, train_loss: 0.3541, test_loss: 2.4248, test_f1: 0.5775
 epoch: 88, train_loss: 0.3355, test_loss: 2.1253, test_f1: 0.5791
 epoch: 89, train_loss: 0.3227, test_loss: 2.2383, test_f1: 0.5618
 epoch: 90, train_loss: 0.3465, test_loss: 2.3102, test_f1: 0.5909
 epoch: 91, train_loss: 0.3504, test_loss: 2.2493, test_f1: 0.5742
 epoch: 92, train_loss: 0.2910, test_loss: 2.3690, test_f1: 0.5746
 epoch: 93, train_loss: 0.2889, test_loss: 2.3582, test_f1: 0.5728
 epoch: 94, train_loss: 0.3160, test_loss: 2.6028, test_f1: 0.6080
 epoch: 95, train_loss: 0.2935, test_loss: 2.2891, test_f1: 0.5989
 epoch: 96, train_loss: 0.3018, test_loss: 2.2634, test_f1: 0.5716
 epoch: 97, train_loss: 0.3634, test_loss: 2.5149, test_f1: 0.5920
 epoch: 98, train_loss: 0.3082, test_loss: 2.6491, test_f1: 0.5601
 epoch: 99, train_loss: 0.3361, test_loss: 2.7045, test_f1: 0.5607
##################ITERATION #3 ****************************************
 epoch: 0, train_loss: 1.2612, test_loss: 1.2915, test_f1: 0.4141
 epoch: 1, train_loss: 1.1633, test_loss: 1.2370, test_f1: 0.4261
 epoch: 2, train_loss: 1.1040, test_loss: 1.2218, test_f1: 0.5287
 epoch: 3, train_loss: 1.0504, test_loss: 1.2411, test_f1: 0.5187
 epoch: 4, train_loss: 1.0293, test_loss: 1.1117, test_f1: 0.5006
 epoch: 5, train_loss: 0.9750, test_loss: 1.0318, test_f1: 0.5941
 epoch: 6, train_loss: 0.9702, test_loss: 1.1149, test_f1: 0.4875
 epoch: 7, train_loss: 0.9608, test_loss: 1.0871, test_f1: 0.5637
 epoch: 8, train_loss: 0.9297, test_loss: 1.0879, test_f1: 0.5668
 epoch: 9, train_loss: 0.9207, test_loss: 1.1467, test_f1: 0.6055
 epoch: 10, train_loss: 0.8758, test_loss: 1.1498, test_f1: 0.5568
 epoch: 11, train_loss: 0.8978, test_loss: 1.2951, test_f1: 0.4989
 epoch: 12, train_loss: 0.8796, test_loss: 1.0172, test_f1: 0.5910
 epoch: 13, train_loss: 0.8536, test_loss: 1.1287, test_f1: 0.5409
 epoch: 14, train_loss: 0.8663, test_loss: 1.1628, test_f1: 0.5712
 epoch: 15, train_loss: 0.8371, test_loss: 1.0891, test_f1: 0.5852
 epoch: 16, train_loss: 0.8376, test_loss: 1.1663, test_f1: 0.5702
 epoch: 17, train_loss: 0.8197, test_loss: 1.1268, test_f1: 0.5988
 epoch: 18, train_loss: 0.8106, test_loss: 1.1201, test_f1: 0.5970
 epoch: 19, train_loss: 0.7924, test_loss: 1.1097, test_f1: 0.5797
 epoch: 20, train_loss: 0.7840, test_loss: 1.1099, test_f1: 0.5711
 epoch: 21, train_loss: 0.7664, test_loss: 1.1726, test_f1: 0.5633
 epoch: 22, train_loss: 0.7611, test_loss: 1.2086, test_f1: 0.5904
 epoch: 23, train_loss: 0.7403, test_loss: 1.2233, test_f1: 0.5643
 epoch: 24, train_loss: 0.7373, test_loss: 1.2490, test_f1: 0.5244
 epoch: 25, train_loss: 0.7238, test_loss: 1.4114, test_f1: 0.4850
 epoch: 26, train_loss: 0.7763, test_loss: 1.7609, test_f1: 0.4865
 epoch: 27, train_loss: 0.7314, test_loss: 1.2407, test_f1: 0.5812
 epoch: 28, train_loss: 0.7227, test_loss: 1.1539, test_f1: 0.5761
 epoch: 29, train_loss: 0.7188, test_loss: 1.1425, test_f1: 0.5617
 epoch: 30, train_loss: 0.7185, test_loss: 1.3183, test_f1: 0.5007
 epoch: 31, train_loss: 0.6782, test_loss: 1.3343, test_f1: 0.5691
 epoch: 32, train_loss: 0.6495, test_loss: 1.2894, test_f1: 0.5917
 epoch: 33, train_loss: 0.6578, test_loss: 1.3940, test_f1: 0.5742
 epoch: 34, train_loss: 0.6583, test_loss: 1.2937, test_f1: 0.5824
 epoch: 35, train_loss: 0.6475, test_loss: 1.2855, test_f1: 0.5710
 epoch: 36, train_loss: 0.6452, test_loss: 1.4874, test_f1: 0.5480
 epoch: 37, train_loss: 0.6415, test_loss: 1.4484, test_f1: 0.5246
 epoch: 38, train_loss: 0.6262, test_loss: 1.4061, test_f1: 0.5376
 epoch: 39, train_loss: 0.6188, test_loss: 1.5700, test_f1: 0.5740
 epoch: 40, train_loss: 0.6166, test_loss: 1.6363, test_f1: 0.5309
 epoch: 41, train_loss: 0.6155, test_loss: 1.5219, test_f1: 0.5427
 epoch: 42, train_loss: 0.6110, test_loss: 1.2619, test_f1: 0.5667
 epoch: 43, train_loss: 0.6190, test_loss: 1.4648, test_f1: 0.5421
 epoch: 44, train_loss: 0.5591, test_loss: 1.6002, test_f1: 0.5563
 epoch: 45, train_loss: 0.5371, test_loss: 1.6000, test_f1: 0.5650
 epoch: 46, train_loss: 0.5803, test_loss: 1.5839, test_f1: 0.5929
 epoch: 47, train_loss: 0.5509, test_loss: 1.7258, test_f1: 0.5527
 epoch: 48, train_loss: 0.5752, test_loss: 1.9461, test_f1: 0.5409
 epoch: 49, train_loss: 0.5707, test_loss: 1.7354, test_f1: 0.5141
 epoch: 50, train_loss: 0.5592, test_loss: 1.6135, test_f1: 0.5504
 epoch: 51, train_loss: 0.5216, test_loss: 1.6115, test_f1: 0.5955
 epoch: 52, train_loss: 0.5022, test_loss: 1.7075, test_f1: 0.5666
 epoch: 53, train_loss: 0.4782, test_loss: 1.7104, test_f1: 0.5753
 epoch: 54, train_loss: 0.4690, test_loss: 1.7869, test_f1: 0.5520
 epoch: 55, train_loss: 0.4606, test_loss: 1.5594, test_f1: 0.6101
 epoch: 56, train_loss: 0.4554, test_loss: 1.5714, test_f1: 0.6001
 epoch: 57, train_loss: 0.4512, test_loss: 1.6920, test_f1: 0.5731
 epoch: 58, train_loss: 0.4298, test_loss: 1.7311, test_f1: 0.5478
 epoch: 59, train_loss: 0.4220, test_loss: 1.6574, test_f1: 0.6086
 epoch: 60, train_loss: 0.4666, test_loss: 1.8495, test_f1: 0.5481
 epoch: 61, train_loss: 0.4241, test_loss: 1.7037, test_f1: 0.5831
 epoch: 62, train_loss: 0.4710, test_loss: 1.9468, test_f1: 0.5549
 epoch: 63, train_loss: 0.4329, test_loss: 1.7700, test_f1: 0.5645
 epoch: 64, train_loss: 0.4106, test_loss: 1.8095, test_f1: 0.5556
 epoch: 65, train_loss: 0.4333, test_loss: 1.9767, test_f1: 0.5331
 epoch: 66, train_loss: 0.4202, test_loss: 2.0076, test_f1: 0.5617
 epoch: 67, train_loss: 0.4150, test_loss: 2.0235, test_f1: 0.5533
 epoch: 68, train_loss: 0.4400, test_loss: 1.8876, test_f1: 0.5359
 epoch: 69, train_loss: 0.4178, test_loss: 1.9948, test_f1: 0.5288
 epoch: 70, train_loss: 0.4048, test_loss: 1.9844, test_f1: 0.5381
 epoch: 71, train_loss: 0.3907, test_loss: 2.0372, test_f1: 0.5318
 epoch: 72, train_loss: 0.3780, test_loss: 1.9716, test_f1: 0.5422
 epoch: 73, train_loss: 0.3889, test_loss: 2.2966, test_f1: 0.5465
 epoch: 74, train_loss: 0.4091, test_loss: 2.1965, test_f1: 0.5664
 epoch: 75, train_loss: 0.3737, test_loss: 2.1265, test_f1: 0.5533
 epoch: 76, train_loss: 0.3858, test_loss: 1.8618, test_f1: 0.5691
 epoch: 77, train_loss: 0.3654, test_loss: 1.9609, test_f1: 0.5603
 epoch: 78, train_loss: 0.3771, test_loss: 1.9783, test_f1: 0.5549
 epoch: 79, train_loss: 0.3668, test_loss: 1.9955, test_f1: 0.5716
 epoch: 80, train_loss: 0.3972, test_loss: 2.1294, test_f1: 0.5675
 epoch: 81, train_loss: 0.3909, test_loss: 2.1890, test_f1: 0.5623
 epoch: 82, train_loss: 0.3612, test_loss: 1.9956, test_f1: 0.5538
 epoch: 83, train_loss: 0.3863, test_loss: 1.9069, test_f1: 0.5747
 epoch: 84, train_loss: 0.3465, test_loss: 2.1665, test_f1: 0.5772
 epoch: 85, train_loss: 0.3480, test_loss: 2.1188, test_f1: 0.5658
 epoch: 86, train_loss: 0.3409, test_loss: 2.0281, test_f1: 0.5789
 epoch: 87, train_loss: 0.3681, test_loss: 2.1929, test_f1: 0.5572
 epoch: 88, train_loss: 0.3404, test_loss: 1.9935, test_f1: 0.6163
 epoch: 89, train_loss: 0.3618, test_loss: 2.1241, test_f1: 0.5850
 epoch: 90, train_loss: 0.3473, test_loss: 2.1699, test_f1: 0.5719
 epoch: 91, train_loss: 0.3223, test_loss: 2.2285, test_f1: 0.5999
 epoch: 92, train_loss: 0.2897, test_loss: 2.3244, test_f1: 0.5934
 epoch: 93, train_loss: 0.3383, test_loss: 2.1314, test_f1: 0.5892
 epoch: 94, train_loss: 0.3356, test_loss: 2.4101, test_f1: 0.5702
 epoch: 95, train_loss: 0.3322, test_loss: 2.1514, test_f1: 0.5968
 epoch: 96, train_loss: 0.3409, test_loss: 2.2473, test_f1: 0.6079
 epoch: 97, train_loss: 0.3501, test_loss: 2.3088, test_f1: 0.5734
 epoch: 98, train_loss: 0.3259, test_loss: 2.4348, test_f1: 0.5525
 epoch: 99, train_loss: 0.3425, test_loss: 2.2458, test_f1: 0.5847
##################ITERATION #4 ****************************************
 epoch: 0, train_loss: 1.2853, test_loss: 1.2495, test_f1: 0.3912
 epoch: 1, train_loss: 1.1382, test_loss: 1.1895, test_f1: 0.4746
 epoch: 2, train_loss: 1.0902, test_loss: 1.1757, test_f1: 0.4734
 epoch: 3, train_loss: 1.0466, test_loss: 1.2030, test_f1: 0.5083
 epoch: 4, train_loss: 1.0281, test_loss: 1.1402, test_f1: 0.5241
 epoch: 5, train_loss: 1.0080, test_loss: 1.1224, test_f1: 0.5629
 epoch: 6, train_loss: 0.9991, test_loss: 1.1562, test_f1: 0.5705
 epoch: 7, train_loss: 0.9609, test_loss: 1.0809, test_f1: 0.5508
 epoch: 8, train_loss: 0.9563, test_loss: 1.1790, test_f1: 0.5181
 epoch: 9, train_loss: 0.9455, test_loss: 1.0927, test_f1: 0.5745
 epoch: 10, train_loss: 0.9226, test_loss: 1.1502, test_f1: 0.4978
 epoch: 11, train_loss: 0.8927, test_loss: 1.1693, test_f1: 0.5154
 epoch: 12, train_loss: 0.8889, test_loss: 1.1932, test_f1: 0.5345
 epoch: 13, train_loss: 0.8957, test_loss: 1.1358, test_f1: 0.4874
 epoch: 14, train_loss: 0.8676, test_loss: 1.0968, test_f1: 0.6235
 epoch: 15, train_loss: 0.8236, test_loss: 1.1759, test_f1: 0.5641
 epoch: 16, train_loss: 0.8444, test_loss: 1.1718, test_f1: 0.5938
 epoch: 17, train_loss: 0.8492, test_loss: 1.0724, test_f1: 0.5710
 epoch: 18, train_loss: 0.8194, test_loss: 1.2508, test_f1: 0.5742
 epoch: 19, train_loss: 0.8110, test_loss: 1.1686, test_f1: 0.5719
 epoch: 20, train_loss: 0.8040, test_loss: 1.0827, test_f1: 0.6112
 epoch: 21, train_loss: 0.8039, test_loss: 1.1361, test_f1: 0.6359
 epoch: 22, train_loss: 0.7718, test_loss: 1.3389, test_f1: 0.5530
 epoch: 23, train_loss: 0.7856, test_loss: 1.2130, test_f1: 0.5309
 epoch: 24, train_loss: 0.7690, test_loss: 1.2138, test_f1: 0.5852
 epoch: 25, train_loss: 0.7709, test_loss: 1.2162, test_f1: 0.5675
 epoch: 26, train_loss: 0.7449, test_loss: 1.2038, test_f1: 0.6236
 epoch: 27, train_loss: 0.7355, test_loss: 1.3439, test_f1: 0.6134
 epoch: 28, train_loss: 0.7644, test_loss: 1.2221, test_f1: 0.5320
 epoch: 29, train_loss: 0.7401, test_loss: 1.0819, test_f1: 0.6450
 epoch: 30, train_loss: 0.7112, test_loss: 1.1500, test_f1: 0.6416
 epoch: 31, train_loss: 0.7216, test_loss: 1.8007, test_f1: 0.4825
 epoch: 32, train_loss: 0.7159, test_loss: 1.4554, test_f1: 0.6457
 epoch: 33, train_loss: 0.7073, test_loss: 1.2819, test_f1: 0.4952
 epoch: 34, train_loss: 0.6987, test_loss: 1.3504, test_f1: 0.5377
 epoch: 35, train_loss: 0.6871, test_loss: 1.3390, test_f1: 0.6118
 epoch: 36, train_loss: 0.6893, test_loss: 1.4601, test_f1: 0.5893
 epoch: 37, train_loss: 0.6841, test_loss: 1.4183, test_f1: 0.5907
 epoch: 38, train_loss: 0.6861, test_loss: 2.1377, test_f1: 0.5053
 epoch: 39, train_loss: 0.6675, test_loss: 1.3645, test_f1: 0.5580
 epoch: 40, train_loss: 0.6528, test_loss: 1.3883, test_f1: 0.5816
 epoch: 41, train_loss: 0.6321, test_loss: 1.5180, test_f1: 0.5798
 epoch: 42, train_loss: 0.6390, test_loss: 1.6954, test_f1: 0.6566
 epoch: 43, train_loss: 0.6176, test_loss: 1.6026, test_f1: 0.6295
 epoch: 44, train_loss: 0.6385, test_loss: 1.5367, test_f1: 0.6192
 epoch: 45, train_loss: 0.6226, test_loss: 1.6900, test_f1: 0.5785
 epoch: 46, train_loss: 0.6131, test_loss: 1.4990, test_f1: 0.5531
 epoch: 47, train_loss: 0.6375, test_loss: 1.6879, test_f1: 0.5579
 epoch: 48, train_loss: 0.6235, test_loss: 1.4632, test_f1: 0.5894
 epoch: 49, train_loss: 0.6282, test_loss: 1.4885, test_f1: 0.5836
 epoch: 50, train_loss: 0.5856, test_loss: 1.6903, test_f1: 0.5676
 epoch: 51, train_loss: 0.5419, test_loss: 1.6454, test_f1: 0.5843
 epoch: 52, train_loss: 0.5343, test_loss: 1.9225, test_f1: 0.5620
 epoch: 53, train_loss: 0.5466, test_loss: 2.1181, test_f1: 0.5494
 epoch: 54, train_loss: 0.5284, test_loss: 1.9210, test_f1: 0.6007
 epoch: 55, train_loss: 0.5080, test_loss: 2.3494, test_f1: 0.5752
 epoch: 56, train_loss: 0.4973, test_loss: 2.0789, test_f1: 0.5921
 epoch: 57, train_loss: 0.5295, test_loss: 2.0289, test_f1: 0.6185
 epoch: 58, train_loss: 0.4943, test_loss: 2.1187, test_f1: 0.6013
 epoch: 59, train_loss: 0.4955, test_loss: 2.2610, test_f1: 0.5563
 epoch: 60, train_loss: 0.4994, test_loss: 2.2102, test_f1: 0.5794
 epoch: 61, train_loss: 0.4851, test_loss: 2.0575, test_f1: 0.5945
 epoch: 62, train_loss: 0.4837, test_loss: 1.9602, test_f1: 0.5694
 epoch: 63, train_loss: 0.4767, test_loss: 2.2380, test_f1: 0.6178
 epoch: 64, train_loss: 0.4679, test_loss: 2.1437, test_f1: 0.5646
 epoch: 65, train_loss: 0.4530, test_loss: 2.2711, test_f1: 0.5753
 epoch: 66, train_loss: 0.4680, test_loss: 2.1510, test_f1: 0.5842
 epoch: 67, train_loss: 0.5034, test_loss: 2.0804, test_f1: 0.5947
 epoch: 68, train_loss: 0.4622, test_loss: 2.1407, test_f1: 0.5855
 epoch: 69, train_loss: 0.4608, test_loss: 2.1600, test_f1: 0.5984
 epoch: 70, train_loss: 0.4628, test_loss: 2.0132, test_f1: 0.6003
 epoch: 71, train_loss: 0.4333, test_loss: 2.2855, test_f1: 0.5685
 epoch: 72, train_loss: 0.4603, test_loss: 2.0668, test_f1: 0.5878
 epoch: 73, train_loss: 0.4412, test_loss: 2.1374, test_f1: 0.6189
 epoch: 74, train_loss: 0.4272, test_loss: 2.3646, test_f1: 0.5567
 epoch: 75, train_loss: 0.4485, test_loss: 2.4329, test_f1: 0.5979
 epoch: 76, train_loss: 0.4597, test_loss: 2.3275, test_f1: 0.5848
 epoch: 77, train_loss: 0.4096, test_loss: 2.7692, test_f1: 0.5801
 epoch: 78, train_loss: 0.4199, test_loss: 2.4098, test_f1: 0.5932
 epoch: 79, train_loss: 0.4165, test_loss: 2.9585, test_f1: 0.5890
 epoch: 80, train_loss: 0.4348, test_loss: 2.6139, test_f1: 0.5885
 epoch: 81, train_loss: 0.4337, test_loss: 2.3788, test_f1: 0.5944
 epoch: 82, train_loss: 0.4010, test_loss: 2.4993, test_f1: 0.5830
 epoch: 83, train_loss: 0.4361, test_loss: 2.8029, test_f1: 0.6062
 epoch: 84, train_loss: 0.3801, test_loss: 2.6803, test_f1: 0.5926
 epoch: 85, train_loss: 0.3949, test_loss: 2.9775, test_f1: 0.5870
 epoch: 86, train_loss: 0.4067, test_loss: 2.2552, test_f1: 0.5851
 epoch: 87, train_loss: 0.3977, test_loss: 2.5873, test_f1: 0.5838
 epoch: 88, train_loss: 0.3862, test_loss: 2.4849, test_f1: 0.5740
 epoch: 89, train_loss: 0.4176, test_loss: 2.2589, test_f1: 0.6177
 epoch: 90, train_loss: 0.4099, test_loss: 2.5491, test_f1: 0.6095
 epoch: 91, train_loss: 0.3889, test_loss: 2.3577, test_f1: 0.5972
 epoch: 92, train_loss: 0.3840, test_loss: 2.6330, test_f1: 0.6285
 epoch: 93, train_loss: 0.4039, test_loss: 2.6587, test_f1: 0.5882
 epoch: 94, train_loss: 0.4036, test_loss: 2.5410, test_f1: 0.6254
 epoch: 95, train_loss: 0.3696, test_loss: 2.4699, test_f1: 0.6128
 epoch: 96, train_loss: 0.3666, test_loss: 2.6767, test_f1: 0.5855
 epoch: 97, train_loss: 0.3595, test_loss: 2.8146, test_f1: 0.5825
 epoch: 98, train_loss: 0.3711, test_loss: 2.9943, test_f1: 0.5946
 epoch: 99, train_loss: 0.3662, test_loss: 2.8674, test_f1: 0.5363
##################ITERATION #5 ****************************************
 epoch: 0, train_loss: 1.3044, test_loss: 1.4511, test_f1: 0.4376
 epoch: 1, train_loss: 1.1395, test_loss: 1.2231, test_f1: 0.4642
 epoch: 2, train_loss: 1.0766, test_loss: 1.2630, test_f1: 0.5143
 epoch: 3, train_loss: 1.0295, test_loss: 1.2544, test_f1: 0.4791
 epoch: 4, train_loss: 1.0128, test_loss: 1.1723, test_f1: 0.5532
 epoch: 5, train_loss: 0.9597, test_loss: 1.1837, test_f1: 0.4741
 epoch: 6, train_loss: 0.9586, test_loss: 1.1100, test_f1: 0.5821
 epoch: 7, train_loss: 0.9338, test_loss: 1.1025, test_f1: 0.6095
 epoch: 8, train_loss: 0.9065, test_loss: 1.1203, test_f1: 0.5863
 epoch: 9, train_loss: 0.9273, test_loss: 1.0979, test_f1: 0.5588
 epoch: 10, train_loss: 0.8821, test_loss: 1.1070, test_f1: 0.5654
 epoch: 11, train_loss: 0.8779, test_loss: 1.1720, test_f1: 0.5471
 epoch: 12, train_loss: 0.8900, test_loss: 1.1588, test_f1: 0.5427
 epoch: 13, train_loss: 0.8525, test_loss: 1.0849, test_f1: 0.5911
 epoch: 14, train_loss: 0.8397, test_loss: 1.1677, test_f1: 0.6191
 epoch: 15, train_loss: 0.8567, test_loss: 1.6890, test_f1: 0.4209
 epoch: 16, train_loss: 0.8387, test_loss: 1.1682, test_f1: 0.6072
 epoch: 17, train_loss: 0.8063, test_loss: 1.2603, test_f1: 0.5784
 epoch: 18, train_loss: 0.8095, test_loss: 1.5359, test_f1: 0.4422
 epoch: 19, train_loss: 0.8181, test_loss: 1.1235, test_f1: 0.5776
 epoch: 20, train_loss: 0.7978, test_loss: 1.2721, test_f1: 0.5550
 epoch: 21, train_loss: 0.7928, test_loss: 1.1968, test_f1: 0.6017
 epoch: 22, train_loss: 0.7607, test_loss: 1.8946, test_f1: 0.4983
 epoch: 23, train_loss: 0.7718, test_loss: 1.3707, test_f1: 0.5848
 epoch: 24, train_loss: 0.7527, test_loss: 1.1142, test_f1: 0.5920
 epoch: 25, train_loss: 0.7143, test_loss: 1.5345, test_f1: 0.5746
 epoch: 26, train_loss: 0.7254, test_loss: 1.2158, test_f1: 0.5933
 epoch: 27, train_loss: 0.7171, test_loss: 1.1849, test_f1: 0.5999
 epoch: 28, train_loss: 0.7156, test_loss: 1.6981, test_f1: 0.5614
 epoch: 29, train_loss: 0.7303, test_loss: 1.7879, test_f1: 0.6099
 epoch: 30, train_loss: 0.7025, test_loss: 1.2775, test_f1: 0.5695
 epoch: 31, train_loss: 0.6954, test_loss: 1.4134, test_f1: 0.6086
 epoch: 32, train_loss: 0.6854, test_loss: 1.1046, test_f1: 0.6410
 epoch: 33, train_loss: 0.6778, test_loss: 1.2300, test_f1: 0.5603
 epoch: 34, train_loss: 0.6914, test_loss: 1.2653, test_f1: 0.6307
 epoch: 35, train_loss: 0.6697, test_loss: 1.2997, test_f1: 0.6139
 epoch: 36, train_loss: 0.6345, test_loss: 1.2679, test_f1: 0.6309
 epoch: 37, train_loss: 0.6758, test_loss: 1.3266, test_f1: 0.5810
 epoch: 38, train_loss: 0.6733, test_loss: 1.3127, test_f1: 0.6024
 epoch: 39, train_loss: 0.6668, test_loss: 1.5262, test_f1: 0.5636
 epoch: 40, train_loss: 0.6315, test_loss: 1.3414, test_f1: 0.5994
 epoch: 41, train_loss: 0.6140, test_loss: 1.3586, test_f1: 0.5766
 epoch: 42, train_loss: 0.6146, test_loss: 1.4159, test_f1: 0.5604
 epoch: 43, train_loss: 0.6095, test_loss: 1.2996, test_f1: 0.6475
 epoch: 44, train_loss: 0.6118, test_loss: 1.6231, test_f1: 0.6101
 epoch: 45, train_loss: 0.6113, test_loss: 1.5046, test_f1: 0.5927
 epoch: 46, train_loss: 0.5942, test_loss: 1.6256, test_f1: 0.6124
 epoch: 47, train_loss: 0.6257, test_loss: 1.5498, test_f1: 0.6092
 epoch: 48, train_loss: 0.5868, test_loss: 1.3291, test_f1: 0.6195
 epoch: 49, train_loss: 0.5841, test_loss: 1.4585, test_f1: 0.5665
 epoch: 50, train_loss: 0.5406, test_loss: 1.7077, test_f1: 0.5778
 epoch: 51, train_loss: 0.5426, test_loss: 1.8961, test_f1: 0.6029
 epoch: 52, train_loss: 0.5292, test_loss: 1.8741, test_f1: 0.5865
 epoch: 53, train_loss: 0.5072, test_loss: 1.9723, test_f1: 0.5998
 epoch: 54, train_loss: 0.5142, test_loss: 1.7340, test_f1: 0.5683
 epoch: 55, train_loss: 0.4971, test_loss: 1.4352, test_f1: 0.5851
 epoch: 56, train_loss: 0.4792, test_loss: 1.8472, test_f1: 0.5594
 epoch: 57, train_loss: 0.4666, test_loss: 1.7411, test_f1: 0.5836
 epoch: 58, train_loss: 0.4727, test_loss: 1.9513, test_f1: 0.5642
 epoch: 59, train_loss: 0.4626, test_loss: 1.6941, test_f1: 0.6099
 epoch: 60, train_loss: 0.4678, test_loss: 2.0771, test_f1: 0.6287
 epoch: 61, train_loss: 0.4488, test_loss: 2.0262, test_f1: 0.5883
 epoch: 62, train_loss: 0.4320, test_loss: 2.7636, test_f1: 0.5941
 epoch: 63, train_loss: 0.4371, test_loss: 1.9458, test_f1: 0.5887
 epoch: 64, train_loss: 0.4608, test_loss: 1.8433, test_f1: 0.6171
 epoch: 65, train_loss: 0.4491, test_loss: 1.9379, test_f1: 0.6124
 epoch: 66, train_loss: 0.4586, test_loss: 1.9844, test_f1: 0.6121
 epoch: 67, train_loss: 0.4653, test_loss: 1.9128, test_f1: 0.6287
 epoch: 68, train_loss: 0.4269, test_loss: 1.8058, test_f1: 0.5844
 epoch: 69, train_loss: 0.4550, test_loss: 1.8174, test_f1: 0.5900
 epoch: 70, train_loss: 0.4391, test_loss: 1.9007, test_f1: 0.6131
 epoch: 71, train_loss: 0.4282, test_loss: 1.8051, test_f1: 0.5928
 epoch: 72, train_loss: 0.4168, test_loss: 2.1559, test_f1: 0.5749
 epoch: 73, train_loss: 0.4277, test_loss: 2.1060, test_f1: 0.6191
 epoch: 74, train_loss: 0.4430, test_loss: 2.3722, test_f1: 0.5821
 epoch: 75, train_loss: 0.4207, test_loss: 2.4403, test_f1: 0.6096
 epoch: 76, train_loss: 0.4099, test_loss: 2.6157, test_f1: 0.6001
 epoch: 77, train_loss: 0.3917, test_loss: 2.3335, test_f1: 0.6086
 epoch: 78, train_loss: 0.4334, test_loss: 2.1857, test_f1: 0.6019
 epoch: 79, train_loss: 0.4070, test_loss: 2.4582, test_f1: 0.6060
 epoch: 80, train_loss: 0.3962, test_loss: 2.1484, test_f1: 0.6316
 epoch: 81, train_loss: 0.3987, test_loss: 2.3727, test_f1: 0.6173
 epoch: 82, train_loss: 0.3747, test_loss: 2.5919, test_f1: 0.6266
 epoch: 83, train_loss: 0.3738, test_loss: 2.2289, test_f1: 0.6170
 epoch: 84, train_loss: 0.3888, test_loss: 2.5875, test_f1: 0.6498
 epoch: 85, train_loss: 0.3799, test_loss: 2.6641, test_f1: 0.6104
 epoch: 86, train_loss: 0.3727, test_loss: 2.7261, test_f1: 0.6163
 epoch: 87, train_loss: 0.3865, test_loss: 2.6114, test_f1: 0.6229
 epoch: 88, train_loss: 0.3736, test_loss: 2.6412, test_f1: 0.5943
 epoch: 89, train_loss: 0.3776, test_loss: 2.6691, test_f1: 0.6206
 epoch: 90, train_loss: 0.3458, test_loss: 2.8213, test_f1: 0.5594
 epoch: 91, train_loss: 0.3662, test_loss: 2.6864, test_f1: 0.6097
 epoch: 92, train_loss: 0.3704, test_loss: 2.8742, test_f1: 0.5834
 epoch: 93, train_loss: 0.3569, test_loss: 2.8491, test_f1: 0.6057
 epoch: 94, train_loss: 0.3523, test_loss: 2.6333, test_f1: 0.5963
 epoch: 95, train_loss: 0.3612, test_loss: 2.5992, test_f1: 0.5720
 epoch: 96, train_loss: 0.3620, test_loss: 3.3073, test_f1: 0.5870
 epoch: 97, train_loss: 0.3740, test_loss: 2.6717, test_f1: 0.6084
 epoch: 98, train_loss: 0.3382, test_loss: 2.6409, test_f1: 0.6154
 epoch: 99, train_loss: 0.3787, test_loss: 2.6656, test_f1: 0.6061
##################ITERATION #6 ****************************************
 epoch: 0, train_loss: 1.2778, test_loss: 1.3833, test_f1: 0.3822
 epoch: 1, train_loss: 1.1535, test_loss: 1.3579, test_f1: 0.4817
 epoch: 2, train_loss: 1.0781, test_loss: 1.2343, test_f1: 0.4976
 epoch: 3, train_loss: 1.0414, test_loss: 1.1121, test_f1: 0.5418
 epoch: 4, train_loss: 1.0119, test_loss: 1.2074, test_f1: 0.5421
 epoch: 5, train_loss: 0.9867, test_loss: 1.2558, test_f1: 0.5043
 epoch: 6, train_loss: 0.9623, test_loss: 1.3595, test_f1: 0.4281
 epoch: 7, train_loss: 0.9359, test_loss: 1.1859, test_f1: 0.5151
 epoch: 8, train_loss: 0.9343, test_loss: 1.1222, test_f1: 0.5488
 epoch: 9, train_loss: 0.9052, test_loss: 1.1771, test_f1: 0.5724
 epoch: 10, train_loss: 0.8705, test_loss: 1.1924, test_f1: 0.5878
 epoch: 11, train_loss: 0.8679, test_loss: 1.2013, test_f1: 0.5724
 epoch: 12, train_loss: 0.8603, test_loss: 1.1552, test_f1: 0.5373
 epoch: 13, train_loss: 0.8356, test_loss: 1.1794, test_f1: 0.5722
 epoch: 14, train_loss: 0.8186, test_loss: 1.1219, test_f1: 0.5729
 epoch: 15, train_loss: 0.8299, test_loss: 1.2315, test_f1: 0.5490
 epoch: 16, train_loss: 0.8303, test_loss: 1.1696, test_f1: 0.5541
 epoch: 17, train_loss: 0.7895, test_loss: 1.1286, test_f1: 0.6520
 epoch: 18, train_loss: 0.7754, test_loss: 1.0969, test_f1: 0.6378
 epoch: 19, train_loss: 0.7772, test_loss: 1.1173, test_f1: 0.6122
 epoch: 20, train_loss: 0.7794, test_loss: 1.1813, test_f1: 0.6062
 epoch: 21, train_loss: 0.7655, test_loss: 1.1810, test_f1: 0.6165
 epoch: 22, train_loss: 0.7343, test_loss: 1.3064, test_f1: 0.5672
 epoch: 23, train_loss: 0.7121, test_loss: 1.1638, test_f1: 0.6191
 epoch: 24, train_loss: 0.7302, test_loss: 1.3264, test_f1: 0.6017
 epoch: 25, train_loss: 0.7137, test_loss: 1.2160, test_f1: 0.5923
 epoch: 26, train_loss: 0.6829, test_loss: 1.2028, test_f1: 0.6016
 epoch: 27, train_loss: 0.6815, test_loss: 1.1659, test_f1: 0.6088
 epoch: 28, train_loss: 0.6602, test_loss: 1.5252, test_f1: 0.5869
 epoch: 29, train_loss: 0.6965, test_loss: 1.3385, test_f1: 0.5862
 epoch: 30, train_loss: 0.6788, test_loss: 1.3862, test_f1: 0.5833
 epoch: 31, train_loss: 0.6593, test_loss: 1.3589, test_f1: 0.5745
 epoch: 32, train_loss: 0.6332, test_loss: 1.2816, test_f1: 0.6097
 epoch: 33, train_loss: 0.6546, test_loss: 1.4039, test_f1: 0.5607
 epoch: 34, train_loss: 0.6286, test_loss: 1.3452, test_f1: 0.5718
 epoch: 35, train_loss: 0.6217, test_loss: 1.3081, test_f1: 0.5793
 epoch: 36, train_loss: 0.6326, test_loss: 1.3218, test_f1: 0.6055
 epoch: 37, train_loss: 0.5879, test_loss: 1.4266, test_f1: 0.5871
 epoch: 38, train_loss: 0.6133, test_loss: 1.4862, test_f1: 0.5463
 epoch: 39, train_loss: 0.6297, test_loss: 1.4292, test_f1: 0.5464
 epoch: 40, train_loss: 0.6107, test_loss: 1.5284, test_f1: 0.5750
 epoch: 41, train_loss: 0.5936, test_loss: 1.3921, test_f1: 0.5789
 epoch: 42, train_loss: 0.6067, test_loss: 1.2858, test_f1: 0.6236
 epoch: 43, train_loss: 0.5919, test_loss: 1.4551, test_f1: 0.5831
 epoch: 44, train_loss: 0.5601, test_loss: 1.6955, test_f1: 0.5359
 epoch: 45, train_loss: 0.5642, test_loss: 1.6491, test_f1: 0.5753
 epoch: 46, train_loss: 0.5468, test_loss: 1.6754, test_f1: 0.5469
 epoch: 47, train_loss: 0.5620, test_loss: 1.6011, test_f1: 0.5661
 epoch: 48, train_loss: 0.5416, test_loss: 2.0662, test_f1: 0.5428
 epoch: 49, train_loss: 0.5442, test_loss: 1.5695, test_f1: 0.5901
 epoch: 50, train_loss: 0.5344, test_loss: 1.8819, test_f1: 0.5637
 epoch: 51, train_loss: 0.5029, test_loss: 1.8096, test_f1: 0.5752
 epoch: 52, train_loss: 0.4888, test_loss: 1.6500, test_f1: 0.5964
 epoch: 53, train_loss: 0.4693, test_loss: 1.5927, test_f1: 0.6406
 epoch: 54, train_loss: 0.4451, test_loss: 1.8193, test_f1: 0.5600
 epoch: 55, train_loss: 0.4714, test_loss: 1.7631, test_f1: 0.5804
 epoch: 56, train_loss: 0.4182, test_loss: 1.7184, test_f1: 0.5955
 epoch: 57, train_loss: 0.4761, test_loss: 1.6791, test_f1: 0.5944
 epoch: 58, train_loss: 0.4314, test_loss: 1.9080, test_f1: 0.5907
 epoch: 59, train_loss: 0.4249, test_loss: 1.8656, test_f1: 0.5771
 epoch: 60, train_loss: 0.4325, test_loss: 1.9328, test_f1: 0.6024
 epoch: 61, train_loss: 0.4312, test_loss: 1.9257, test_f1: 0.5833
 epoch: 62, train_loss: 0.4212, test_loss: 2.1158, test_f1: 0.5374
 epoch: 63, train_loss: 0.4342, test_loss: 2.2969, test_f1: 0.5815
 epoch: 64, train_loss: 0.4159, test_loss: 2.1680, test_f1: 0.5803
 epoch: 65, train_loss: 0.4083, test_loss: 2.3100, test_f1: 0.5589
 epoch: 66, train_loss: 0.4192, test_loss: 2.2227, test_f1: 0.5492
 epoch: 67, train_loss: 0.3976, test_loss: 1.9521, test_f1: 0.5888
 epoch: 68, train_loss: 0.3937, test_loss: 2.2287, test_f1: 0.5720
 epoch: 69, train_loss: 0.4224, test_loss: 2.0382, test_f1: 0.5783
 epoch: 70, train_loss: 0.3873, test_loss: 2.5450, test_f1: 0.5272
 epoch: 71, train_loss: 0.4116, test_loss: 1.8034, test_f1: 0.5925
 epoch: 72, train_loss: 0.3711, test_loss: 2.1987, test_f1: 0.5438
 epoch: 73, train_loss: 0.3754, test_loss: 1.9918, test_f1: 0.5888
 epoch: 74, train_loss: 0.3865, test_loss: 2.2850, test_f1: 0.5517
 epoch: 75, train_loss: 0.3939, test_loss: 2.2596, test_f1: 0.5886
 epoch: 76, train_loss: 0.3569, test_loss: 2.4451, test_f1: 0.5925
 epoch: 77, train_loss: 0.3675, test_loss: 2.1596, test_f1: 0.5803
 epoch: 78, train_loss: 0.3629, test_loss: 2.2528, test_f1: 0.6020
 epoch: 79, train_loss: 0.3271, test_loss: 2.3794, test_f1: 0.5764
 epoch: 80, train_loss: 0.3595, test_loss: 2.4518, test_f1: 0.5719
 epoch: 81, train_loss: 0.3499, test_loss: 2.7903, test_f1: 0.5567
 epoch: 82, train_loss: 0.3252, test_loss: 2.6316, test_f1: 0.5762
 epoch: 83, train_loss: 0.3772, test_loss: 2.5601, test_f1: 0.6049
 epoch: 84, train_loss: 0.3533, test_loss: 2.5322, test_f1: 0.5899
 epoch: 85, train_loss: 0.3454, test_loss: 2.6265, test_f1: 0.5848
 epoch: 86, train_loss: 0.3368, test_loss: 2.5987, test_f1: 0.5686
 epoch: 87, train_loss: 0.3337, test_loss: 2.5952, test_f1: 0.5758
 epoch: 88, train_loss: 0.3255, test_loss: 2.6151, test_f1: 0.5814
 epoch: 89, train_loss: 0.3571, test_loss: 2.4318, test_f1: 0.5962
 epoch: 90, train_loss: 0.3307, test_loss: 2.6504, test_f1: 0.5610
 epoch: 91, train_loss: 0.3419, test_loss: 2.6337, test_f1: 0.5787
 epoch: 92, train_loss: 0.3481, test_loss: 2.4336, test_f1: 0.6012
 epoch: 93, train_loss: 0.3307, test_loss: 2.5310, test_f1: 0.5637
 epoch: 94, train_loss: 0.3392, test_loss: 2.8287, test_f1: 0.6053
 epoch: 95, train_loss: 0.3244, test_loss: 2.5568, test_f1: 0.6136
 epoch: 96, train_loss: 0.2916, test_loss: 2.4015, test_f1: 0.6105
 epoch: 97, train_loss: 0.3297, test_loss: 2.4284, test_f1: 0.6135
 epoch: 98, train_loss: 0.2948, test_loss: 2.5581, test_f1: 0.5812
 epoch: 99, train_loss: 0.3239, test_loss: 2.5876, test_f1: 0.6003
##################ITERATION #7 ****************************************
 epoch: 0, train_loss: 1.3106, test_loss: 1.3423, test_f1: 0.4673
 epoch: 1, train_loss: 1.1373, test_loss: 1.2922, test_f1: 0.5356
 epoch: 2, train_loss: 1.0515, test_loss: 1.2728, test_f1: 0.5432
 epoch: 3, train_loss: 0.9982, test_loss: 1.2205, test_f1: 0.5375
 epoch: 4, train_loss: 0.9910, test_loss: 1.1699, test_f1: 0.5861
 epoch: 5, train_loss: 0.9721, test_loss: 1.1610, test_f1: 0.5623
 epoch: 6, train_loss: 0.9198, test_loss: 1.2364, test_f1: 0.5228
 epoch: 7, train_loss: 0.9229, test_loss: 1.1554, test_f1: 0.5387
 epoch: 8, train_loss: 0.8909, test_loss: 1.1041, test_f1: 0.5770
 epoch: 9, train_loss: 0.8763, test_loss: 1.1326, test_f1: 0.5895
 epoch: 10, train_loss: 0.8541, test_loss: 1.0463, test_f1: 0.6148
 epoch: 11, train_loss: 0.8288, test_loss: 1.2287, test_f1: 0.5671
 epoch: 12, train_loss: 0.8274, test_loss: 1.0815, test_f1: 0.5900
 epoch: 13, train_loss: 0.8127, test_loss: 1.0844, test_f1: 0.6128
 epoch: 14, train_loss: 0.8056, test_loss: 1.0648, test_f1: 0.5584
 epoch: 15, train_loss: 0.7886, test_loss: 1.2658, test_f1: 0.5875
 epoch: 16, train_loss: 0.7605, test_loss: 1.1344, test_f1: 0.5968
 epoch: 17, train_loss: 0.7542, test_loss: 1.0921, test_f1: 0.5957
 epoch: 18, train_loss: 0.7385, test_loss: 1.1680, test_f1: 0.6078
 epoch: 19, train_loss: 0.7442, test_loss: 1.0626, test_f1: 0.6095
 epoch: 20, train_loss: 0.7301, test_loss: 1.1914, test_f1: 0.5589
 epoch: 21, train_loss: 0.6987, test_loss: 1.1778, test_f1: 0.5624
 epoch: 22, train_loss: 0.7215, test_loss: 1.2690, test_f1: 0.5688
 epoch: 23, train_loss: 0.7089, test_loss: 1.2000, test_f1: 0.5912
 epoch: 24, train_loss: 0.6899, test_loss: 1.2132, test_f1: 0.5551
 epoch: 25, train_loss: 0.7039, test_loss: 1.2549, test_f1: 0.5735
 epoch: 26, train_loss: 0.6930, test_loss: 1.2029, test_f1: 0.5814
 epoch: 27, train_loss: 0.6777, test_loss: 1.3831, test_f1: 0.5743
 epoch: 28, train_loss: 0.6790, test_loss: 1.1881, test_f1: 0.6178
 epoch: 29, train_loss: 0.6655, test_loss: 1.2521, test_f1: 0.5200
 epoch: 30, train_loss: 0.6333, test_loss: 1.1930, test_f1: 0.5954
 epoch: 31, train_loss: 0.6231, test_loss: 1.3106, test_f1: 0.5785
 epoch: 32, train_loss: 0.6329, test_loss: 1.5417, test_f1: 0.5857
 epoch: 33, train_loss: 0.6237, test_loss: 1.4864, test_f1: 0.5771
 epoch: 34, train_loss: 0.6030, test_loss: 1.2669, test_f1: 0.6121
 epoch: 35, train_loss: 0.5895, test_loss: 1.2791, test_f1: 0.6190
 epoch: 36, train_loss: 0.5909, test_loss: 1.4704, test_f1: 0.5766
 epoch: 37, train_loss: 0.5488, test_loss: 1.2492, test_f1: 0.6279
 epoch: 38, train_loss: 0.5722, test_loss: 1.5365, test_f1: 0.5486
 epoch: 39, train_loss: 0.5717, test_loss: 1.4712, test_f1: 0.5393
 epoch: 40, train_loss: 0.5554, test_loss: 1.6627, test_f1: 0.5818
 epoch: 41, train_loss: 0.5545, test_loss: 1.4779, test_f1: 0.5851
 epoch: 42, train_loss: 0.5548, test_loss: 1.4416, test_f1: 0.5858
 epoch: 43, train_loss: 0.5489, test_loss: 1.3993, test_f1: 0.5982
 epoch: 44, train_loss: 0.5528, test_loss: 1.7484, test_f1: 0.5496
 epoch: 45, train_loss: 0.5270, test_loss: 1.4533, test_f1: 0.5791
 epoch: 46, train_loss: 0.5201, test_loss: 1.6166, test_f1: 0.5818
 epoch: 47, train_loss: 0.5490, test_loss: 1.4853, test_f1: 0.5841
 epoch: 48, train_loss: 0.5063, test_loss: 1.7968, test_f1: 0.5420
 epoch: 49, train_loss: 0.5359, test_loss: 1.6726, test_f1: 0.5555
 epoch: 50, train_loss: 0.4844, test_loss: 1.8637, test_f1: 0.5793
 epoch: 51, train_loss: 0.4561, test_loss: 1.8565, test_f1: 0.5663
 epoch: 52, train_loss: 0.4336, test_loss: 1.8478, test_f1: 0.5912
 epoch: 53, train_loss: 0.4279, test_loss: 1.6371, test_f1: 0.5684
 epoch: 54, train_loss: 0.4415, test_loss: 1.8698, test_f1: 0.5602
 epoch: 55, train_loss: 0.4035, test_loss: 1.7207, test_f1: 0.5819
 epoch: 56, train_loss: 0.4113, test_loss: 1.7556, test_f1: 0.5486
 epoch: 57, train_loss: 0.4136, test_loss: 1.9606, test_f1: 0.5529
 epoch: 58, train_loss: 0.3887, test_loss: 1.7328, test_f1: 0.5648
 epoch: 59, train_loss: 0.3853, test_loss: 1.9685, test_f1: 0.5804
 epoch: 60, train_loss: 0.3829, test_loss: 1.9928, test_f1: 0.5560
 epoch: 61, train_loss: 0.3660, test_loss: 2.2237, test_f1: 0.5485
 epoch: 62, train_loss: 0.3639, test_loss: 2.0220, test_f1: 0.5533
 epoch: 63, train_loss: 0.3796, test_loss: 1.9511, test_f1: 0.5638
 epoch: 64, train_loss: 0.3733, test_loss: 2.0904, test_f1: 0.5500
 epoch: 65, train_loss: 0.3883, test_loss: 1.8954, test_f1: 0.5589
 epoch: 66, train_loss: 0.3536, test_loss: 2.0694, test_f1: 0.5816
 epoch: 67, train_loss: 0.3867, test_loss: 2.0058, test_f1: 0.5660
 epoch: 68, train_loss: 0.3578, test_loss: 2.2784, test_f1: 0.5667
 epoch: 69, train_loss: 0.3483, test_loss: 2.0659, test_f1: 0.5737
 epoch: 70, train_loss: 0.3607, test_loss: 2.2331, test_f1: 0.5526
 epoch: 71, train_loss: 0.3329, test_loss: 2.0157, test_f1: 0.5585
 epoch: 72, train_loss: 0.3286, test_loss: 1.9453, test_f1: 0.5575
 epoch: 73, train_loss: 0.3477, test_loss: 2.0002, test_f1: 0.5503
 epoch: 74, train_loss: 0.3078, test_loss: 2.3015, test_f1: 0.5506
 epoch: 75, train_loss: 0.3424, test_loss: 2.2984, test_f1: 0.5510
 epoch: 76, train_loss: 0.3319, test_loss: 2.1538, test_f1: 0.5664
 epoch: 77, train_loss: 0.3544, test_loss: 2.4057, test_f1: 0.5547
 epoch: 78, train_loss: 0.3423, test_loss: 2.5465, test_f1: 0.5393
 epoch: 79, train_loss: 0.3219, test_loss: 2.2341, test_f1: 0.5668
 epoch: 80, train_loss: 0.3366, test_loss: 2.5385, test_f1: 0.5602
 epoch: 81, train_loss: 0.3221, test_loss: 2.3584, test_f1: 0.5868
 epoch: 82, train_loss: 0.3262, test_loss: 2.0282, test_f1: 0.5515
 epoch: 83, train_loss: 0.2838, test_loss: 2.4446, test_f1: 0.5556
 epoch: 84, train_loss: 0.3181, test_loss: 1.9851, test_f1: 0.5688
 epoch: 85, train_loss: 0.3095, test_loss: 1.9123, test_f1: 0.5813
 epoch: 86, train_loss: 0.3015, test_loss: 2.0589, test_f1: 0.5514
 epoch: 87, train_loss: 0.2992, test_loss: 2.0400, test_f1: 0.5702
 epoch: 88, train_loss: 0.2935, test_loss: 2.1333, test_f1: 0.5797
 epoch: 89, train_loss: 0.2825, test_loss: 2.0375, test_f1: 0.5823
 epoch: 90, train_loss: 0.3319, test_loss: 2.0871, test_f1: 0.5704
 epoch: 91, train_loss: 0.3149, test_loss: 2.1644, test_f1: 0.5668
 epoch: 92, train_loss: 0.3066, test_loss: 2.3402, test_f1: 0.5751
 epoch: 93, train_loss: 0.2878, test_loss: 2.2798, test_f1: 0.5859
 epoch: 94, train_loss: 0.3137, test_loss: 2.5575, test_f1: 0.5602
 epoch: 95, train_loss: 0.2852, test_loss: 2.4808, test_f1: 0.5537
 epoch: 96, train_loss: 0.2803, test_loss: 3.0085, test_f1: 0.5474
 epoch: 97, train_loss: 0.2870, test_loss: 2.4785, test_f1: 0.5715
 epoch: 98, train_loss: 0.2630, test_loss: 2.2483, test_f1: 0.5695
 epoch: 99, train_loss: 0.2695, test_loss: 2.5400, test_f1: 0.5781
##################ITERATION #8 ****************************************
 epoch: 0, train_loss: 1.2894, test_loss: 1.2843, test_f1: 0.4853
 epoch: 1, train_loss: 1.1230, test_loss: 1.5648, test_f1: 0.4886
 epoch: 2, train_loss: 1.0943, test_loss: 1.1970, test_f1: 0.5385
 epoch: 3, train_loss: 1.0377, test_loss: 1.2285, test_f1: 0.5285
 epoch: 4, train_loss: 0.9987, test_loss: 1.2325, test_f1: 0.5101
 epoch: 5, train_loss: 0.9619, test_loss: 1.1009, test_f1: 0.5485
 epoch: 6, train_loss: 0.9544, test_loss: 1.1222, test_f1: 0.5528
 epoch: 7, train_loss: 0.9430, test_loss: 1.1418, test_f1: 0.5524
 epoch: 8, train_loss: 0.9109, test_loss: 1.0980, test_f1: 0.5663
 epoch: 9, train_loss: 0.9020, test_loss: 1.1371, test_f1: 0.5802
 epoch: 10, train_loss: 0.8868, test_loss: 1.3108, test_f1: 0.5468
 epoch: 11, train_loss: 0.8516, test_loss: 1.3550, test_f1: 0.5748
 epoch: 12, train_loss: 0.8480, test_loss: 1.1854, test_f1: 0.5489
 epoch: 13, train_loss: 0.8476, test_loss: 1.2390, test_f1: 0.5489
 epoch: 14, train_loss: 0.8201, test_loss: 1.2076, test_f1: 0.5725
 epoch: 15, train_loss: 0.8030, test_loss: 1.1888, test_f1: 0.5139
 epoch: 16, train_loss: 0.8017, test_loss: 1.2028, test_f1: 0.5679
 epoch: 17, train_loss: 0.7660, test_loss: 1.2247, test_f1: 0.5965
 epoch: 18, train_loss: 0.7817, test_loss: 1.1938, test_f1: 0.5630
 epoch: 19, train_loss: 0.7683, test_loss: 1.2890, test_f1: 0.5905
 epoch: 20, train_loss: 0.7533, test_loss: 1.3379, test_f1: 0.5804
 epoch: 21, train_loss: 0.7389, test_loss: 1.2577, test_f1: 0.5815
 epoch: 22, train_loss: 0.7336, test_loss: 1.2505, test_f1: 0.5968
 epoch: 23, train_loss: 0.7205, test_loss: 1.3120, test_f1: 0.5936
 epoch: 24, train_loss: 0.7594, test_loss: 1.4630, test_f1: 0.5551
 epoch: 25, train_loss: 0.7045, test_loss: 1.3751, test_f1: 0.5671
 epoch: 26, train_loss: 0.6991, test_loss: 1.2174, test_f1: 0.6244
 epoch: 27, train_loss: 0.6934, test_loss: 1.3726, test_f1: 0.6210
 epoch: 28, train_loss: 0.6918, test_loss: 1.4902, test_f1: 0.5887
 epoch: 29, train_loss: 0.6927, test_loss: 1.4419, test_f1: 0.5728
 epoch: 30, train_loss: 0.6816, test_loss: 1.3914, test_f1: 0.6086
 epoch: 31, train_loss: 0.6542, test_loss: 1.3897, test_f1: 0.5850
 epoch: 32, train_loss: 0.6775, test_loss: 1.4561, test_f1: 0.4938
 epoch: 33, train_loss: 0.6565, test_loss: 1.4014, test_f1: 0.5621
 epoch: 34, train_loss: 0.6718, test_loss: 1.3822, test_f1: 0.5786
 epoch: 35, train_loss: 0.6315, test_loss: 1.4675, test_f1: 0.5329
 epoch: 36, train_loss: 0.6012, test_loss: 1.4781, test_f1: 0.5386
 epoch: 37, train_loss: 0.6282, test_loss: 1.3307, test_f1: 0.6298
 epoch: 38, train_loss: 0.6486, test_loss: 1.3212, test_f1: 0.5627
 epoch: 39, train_loss: 0.6243, test_loss: 1.4835, test_f1: 0.5518
 epoch: 40, train_loss: 0.6105, test_loss: 1.3416, test_f1: 0.5910
 epoch: 41, train_loss: 0.5826, test_loss: 1.3380, test_f1: 0.5849
 epoch: 42, train_loss: 0.5584, test_loss: 1.3667, test_f1: 0.5841
 epoch: 43, train_loss: 0.5943, test_loss: 1.6950, test_f1: 0.5052
 epoch: 44, train_loss: 0.6125, test_loss: 1.4520, test_f1: 0.5653
 epoch: 45, train_loss: 0.5769, test_loss: 1.5340, test_f1: 0.5516
 epoch: 46, train_loss: 0.5617, test_loss: 1.5692, test_f1: 0.5614
 epoch: 47, train_loss: 0.5564, test_loss: 1.5909, test_f1: 0.5734
 epoch: 48, train_loss: 0.5283, test_loss: 1.6102, test_f1: 0.5590
 epoch: 49, train_loss: 0.5167, test_loss: 1.7334, test_f1: 0.5466
 epoch: 50, train_loss: 0.5417, test_loss: 1.7611, test_f1: 0.5258
 epoch: 51, train_loss: 0.4717, test_loss: 1.7867, test_f1: 0.5734
 epoch: 52, train_loss: 0.4692, test_loss: 1.7871, test_f1: 0.5622
 epoch: 53, train_loss: 0.5169, test_loss: 1.7849, test_f1: 0.5781
 epoch: 54, train_loss: 0.4539, test_loss: 1.7658, test_f1: 0.5890
 epoch: 55, train_loss: 0.4656, test_loss: 1.7919, test_f1: 0.5917
 epoch: 56, train_loss: 0.4759, test_loss: 1.9141, test_f1: 0.5448
 epoch: 57, train_loss: 0.4548, test_loss: 1.8120, test_f1: 0.6006
 epoch: 58, train_loss: 0.4382, test_loss: 1.9506, test_f1: 0.5660
 epoch: 59, train_loss: 0.4350, test_loss: 1.9402, test_f1: 0.5760
 epoch: 60, train_loss: 0.4328, test_loss: 1.9038, test_f1: 0.5803
 epoch: 61, train_loss: 0.4181, test_loss: 1.8827, test_f1: 0.5847
 epoch: 62, train_loss: 0.4274, test_loss: 1.8530, test_f1: 0.5794
 epoch: 63, train_loss: 0.3832, test_loss: 1.9981, test_f1: 0.5813
 epoch: 64, train_loss: 0.3852, test_loss: 1.9054, test_f1: 0.5623
 epoch: 65, train_loss: 0.4236, test_loss: 2.3314, test_f1: 0.5994
 epoch: 66, train_loss: 0.3908, test_loss: 1.9726, test_f1: 0.5848
 epoch: 67, train_loss: 0.4351, test_loss: 2.1600, test_f1: 0.5780
 epoch: 68, train_loss: 0.4086, test_loss: 2.3320, test_f1: 0.5461
 epoch: 69, train_loss: 0.4284, test_loss: 2.0629, test_f1: 0.5976
 epoch: 70, train_loss: 0.3817, test_loss: 2.1341, test_f1: 0.5618
 epoch: 71, train_loss: 0.3821, test_loss: 2.0956, test_f1: 0.5976
 epoch: 72, train_loss: 0.4080, test_loss: 2.0885, test_f1: 0.5683
 epoch: 73, train_loss: 0.3860, test_loss: 2.1068, test_f1: 0.5882
 epoch: 74, train_loss: 0.3951, test_loss: 2.2816, test_f1: 0.5625
 epoch: 75, train_loss: 0.3731, test_loss: 2.0487, test_f1: 0.5946
 epoch: 76, train_loss: 0.3778, test_loss: 2.2271, test_f1: 0.5820
 epoch: 77, train_loss: 0.3917, test_loss: 2.3863, test_f1: 0.5919
 epoch: 78, train_loss: 0.3785, test_loss: 2.2578, test_f1: 0.5938
 epoch: 79, train_loss: 0.3526, test_loss: 2.5317, test_f1: 0.5666
 epoch: 80, train_loss: 0.3915, test_loss: 2.5375, test_f1: 0.5785
 epoch: 81, train_loss: 0.3644, test_loss: 2.3842, test_f1: 0.6086
 epoch: 82, train_loss: 0.3953, test_loss: 2.6087, test_f1: 0.5866
 epoch: 83, train_loss: 0.3574, test_loss: 2.7241, test_f1: 0.5715
 epoch: 84, train_loss: 0.3508, test_loss: 2.8094, test_f1: 0.5569
 epoch: 85, train_loss: 0.3425, test_loss: 2.5402, test_f1: 0.5790
 epoch: 86, train_loss: 0.3882, test_loss: 2.4478, test_f1: 0.5483
 epoch: 87, train_loss: 0.3726, test_loss: 2.4548, test_f1: 0.5868
 epoch: 88, train_loss: 0.3361, test_loss: 2.6345, test_f1: 0.5802
 epoch: 89, train_loss: 0.3557, test_loss: 2.4338, test_f1: 0.5607
 epoch: 90, train_loss: 0.3678, test_loss: 2.4866, test_f1: 0.5541
 epoch: 91, train_loss: 0.3492, test_loss: 2.6032, test_f1: 0.5528
 epoch: 92, train_loss: 0.3681, test_loss: 2.4646, test_f1: 0.5810
 epoch: 93, train_loss: 0.3469, test_loss: 2.3904, test_f1: 0.5941
 epoch: 94, train_loss: 0.3154, test_loss: 2.7303, test_f1: 0.5707
 epoch: 95, train_loss: 0.3572, test_loss: 2.4242, test_f1: 0.6047
 epoch: 96, train_loss: 0.3408, test_loss: 2.5418, test_f1: 0.5654
 epoch: 97, train_loss: 0.3440, test_loss: 2.6405, test_f1: 0.5744
 epoch: 98, train_loss: 0.3339, test_loss: 2.5747, test_f1: 0.5826
 epoch: 99, train_loss: 0.3293, test_loss: 2.4808, test_f1: 0.5941
##################ITERATION #9 ****************************************
 epoch: 0, train_loss: 1.3686, test_loss: 1.2823, test_f1: 0.4428
 epoch: 1, train_loss: 1.1698, test_loss: 1.2431, test_f1: 0.4434
 epoch: 2, train_loss: 1.1086, test_loss: 1.2423, test_f1: 0.5095
 epoch: 3, train_loss: 1.0562, test_loss: 1.1719, test_f1: 0.4516
 epoch: 4, train_loss: 1.0324, test_loss: 1.2087, test_f1: 0.5662
 epoch: 5, train_loss: 1.0080, test_loss: 1.1398, test_f1: 0.5402
 epoch: 6, train_loss: 0.9600, test_loss: 1.2487, test_f1: 0.5618
 epoch: 7, train_loss: 0.9477, test_loss: 1.1458, test_f1: 0.5736
 epoch: 8, train_loss: 0.9290, test_loss: 1.2214, test_f1: 0.5049
 epoch: 9, train_loss: 0.9330, test_loss: 1.2482, test_f1: 0.5743
 epoch: 10, train_loss: 0.8909, test_loss: 1.2297, test_f1: 0.5413
 epoch: 11, train_loss: 0.8977, test_loss: 1.1937, test_f1: 0.5421
 epoch: 12, train_loss: 0.8776, test_loss: 1.1112, test_f1: 0.5449
 epoch: 13, train_loss: 0.8445, test_loss: 1.2419, test_f1: 0.5843
 epoch: 14, train_loss: 0.8249, test_loss: 1.1098, test_f1: 0.5676
 epoch: 15, train_loss: 0.7908, test_loss: 1.1803, test_f1: 0.5867
 epoch: 16, train_loss: 0.7931, test_loss: 1.1638, test_f1: 0.5479
 epoch: 17, train_loss: 0.7569, test_loss: 1.2073, test_f1: 0.6090
 epoch: 18, train_loss: 0.7843, test_loss: 1.0928, test_f1: 0.6307
 epoch: 19, train_loss: 0.7497, test_loss: 1.2349, test_f1: 0.6021
 epoch: 20, train_loss: 0.7519, test_loss: 1.1799, test_f1: 0.5563
 epoch: 21, train_loss: 0.7377, test_loss: 1.2471, test_f1: 0.5822
 epoch: 22, train_loss: 0.6989, test_loss: 1.1836, test_f1: 0.6057
 epoch: 23, train_loss: 0.7139, test_loss: 1.1989, test_f1: 0.6308
 epoch: 24, train_loss: 0.7118, test_loss: 1.4915, test_f1: 0.5134
 epoch: 25, train_loss: 0.7068, test_loss: 1.1411, test_f1: 0.6211
 epoch: 26, train_loss: 0.6820, test_loss: 1.2448, test_f1: 0.6143
 epoch: 27, train_loss: 0.6718, test_loss: 1.4191, test_f1: 0.5892
 epoch: 28, train_loss: 0.6578, test_loss: 1.3348, test_f1: 0.5775
 epoch: 29, train_loss: 0.6432, test_loss: 1.4437, test_f1: 0.6177
 epoch: 30, train_loss: 0.6674, test_loss: 1.2295, test_f1: 0.6139
 epoch: 31, train_loss: 0.6205, test_loss: 1.6607, test_f1: 0.5237
 epoch: 32, train_loss: 0.6391, test_loss: 1.5022, test_f1: 0.5926
 epoch: 33, train_loss: 0.6159, test_loss: 1.4251, test_f1: 0.6214
 epoch: 34, train_loss: 0.6237, test_loss: 1.3957, test_f1: 0.6241
 epoch: 35, train_loss: 0.5764, test_loss: 1.7396, test_f1: 0.6026
 epoch: 36, train_loss: 0.5966, test_loss: 1.3692, test_f1: 0.5772
 epoch: 37, train_loss: 0.5807, test_loss: 1.7343, test_f1: 0.5938
 epoch: 38, train_loss: 0.5851, test_loss: 1.5798, test_f1: 0.5760
 epoch: 39, train_loss: 0.5703, test_loss: 1.4719, test_f1: 0.5653
 epoch: 40, train_loss: 0.5544, test_loss: 1.4066, test_f1: 0.5745
 epoch: 41, train_loss: 0.5615, test_loss: 1.5120, test_f1: 0.5696
 epoch: 42, train_loss: 0.5433, test_loss: 1.5914, test_f1: 0.5766
 epoch: 43, train_loss: 0.5510, test_loss: 1.5394, test_f1: 0.6238
 epoch: 44, train_loss: 0.5839, test_loss: 1.5212, test_f1: 0.5407
 epoch: 45, train_loss: 0.5220, test_loss: 1.5841, test_f1: 0.6232
 epoch: 46, train_loss: 0.5262, test_loss: 1.6724, test_f1: 0.5546
 epoch: 47, train_loss: 0.5183, test_loss: 1.7299, test_f1: 0.5516
 epoch: 48, train_loss: 0.5015, test_loss: 1.7505, test_f1: 0.5892
 epoch: 49, train_loss: 0.4739, test_loss: 1.6541, test_f1: 0.5884
 epoch: 50, train_loss: 0.4957, test_loss: 1.9699, test_f1: 0.5752
 epoch: 51, train_loss: 0.4510, test_loss: 1.7359, test_f1: 0.5868
 epoch: 52, train_loss: 0.4100, test_loss: 1.6737, test_f1: 0.5564
 epoch: 53, train_loss: 0.4292, test_loss: 1.7858, test_f1: 0.5749
 epoch: 54, train_loss: 0.4064, test_loss: 1.9644, test_f1: 0.6062
 epoch: 55, train_loss: 0.4146, test_loss: 1.9990, test_f1: 0.5655
 epoch: 56, train_loss: 0.3916, test_loss: 2.0683, test_f1: 0.5810
 epoch: 57, train_loss: 0.4031, test_loss: 1.9330, test_f1: 0.6080
 epoch: 58, train_loss: 0.3837, test_loss: 2.1142, test_f1: 0.5825
 epoch: 59, train_loss: 0.4105, test_loss: 1.9443, test_f1: 0.5735
 epoch: 60, train_loss: 0.3853, test_loss: 2.0080, test_f1: 0.5721
 epoch: 61, train_loss: 0.3647, test_loss: 2.2359, test_f1: 0.5613
 epoch: 62, train_loss: 0.3648, test_loss: 2.0414, test_f1: 0.5762
 epoch: 63, train_loss: 0.3702, test_loss: 2.1227, test_f1: 0.5784
 epoch: 64, train_loss: 0.3518, test_loss: 2.2031, test_f1: 0.5763
 epoch: 65, train_loss: 0.3675, test_loss: 2.1762, test_f1: 0.5822
 epoch: 66, train_loss: 0.3883, test_loss: 2.3636, test_f1: 0.5800
 epoch: 67, train_loss: 0.3362, test_loss: 2.5466, test_f1: 0.5835
 epoch: 68, train_loss: 0.3753, test_loss: 2.2028, test_f1: 0.5902
 epoch: 69, train_loss: 0.3554, test_loss: 1.9585, test_f1: 0.5604
 epoch: 70, train_loss: 0.3754, test_loss: 1.9896, test_f1: 0.5780
 epoch: 71, train_loss: 0.3488, test_loss: 2.3118, test_f1: 0.5703
 epoch: 72, train_loss: 0.3340, test_loss: 2.1110, test_f1: 0.5891
 epoch: 73, train_loss: 0.3280, test_loss: 2.1148, test_f1: 0.5440
 epoch: 74, train_loss: 0.3514, test_loss: 2.2098, test_f1: 0.5771
 epoch: 75, train_loss: 0.3442, test_loss: 2.2161, test_f1: 0.6093
 epoch: 76, train_loss: 0.3612, test_loss: 2.1947, test_f1: 0.5925
 epoch: 77, train_loss: 0.3119, test_loss: 2.4457, test_f1: 0.5839
 epoch: 78, train_loss: 0.3328, test_loss: 2.1224, test_f1: 0.6089
 epoch: 79, train_loss: 0.3484, test_loss: 2.2070, test_f1: 0.6046
 epoch: 80, train_loss: 0.3053, test_loss: 2.4494, test_f1: 0.5922
 epoch: 81, train_loss: 0.3419, test_loss: 2.2020, test_f1: 0.6009
 epoch: 82, train_loss: 0.3252, test_loss: 2.0718, test_f1: 0.5986
 epoch: 83, train_loss: 0.3172, test_loss: 1.9659, test_f1: 0.6020
 epoch: 84, train_loss: 0.3162, test_loss: 2.0002, test_f1: 0.6105
 epoch: 85, train_loss: 0.3147, test_loss: 2.2105, test_f1: 0.6116
 epoch: 86, train_loss: 0.3075, test_loss: 2.4060, test_f1: 0.5842
 epoch: 87, train_loss: 0.3357, test_loss: 2.2139, test_f1: 0.5973
 epoch: 88, train_loss: 0.3152, test_loss: 2.3763, test_f1: 0.6164
 epoch: 89, train_loss: 0.3105, test_loss: 2.0745, test_f1: 0.5610
 epoch: 90, train_loss: 0.3141, test_loss: 2.1441, test_f1: 0.5716
 epoch: 91, train_loss: 0.3216, test_loss: 2.0446, test_f1: 0.5809
 epoch: 92, train_loss: 0.2883, test_loss: 2.1000, test_f1: 0.5662
 epoch: 93, train_loss: 0.3015, test_loss: 2.2922, test_f1: 0.5649
 epoch: 94, train_loss: 0.3296, test_loss: 2.5869, test_f1: 0.5850
 epoch: 95, train_loss: 0.3016, test_loss: 2.3345, test_f1: 0.5785
 epoch: 96, train_loss: 0.2831, test_loss: 2.2258, test_f1: 0.5982
 epoch: 97, train_loss: 0.2983, test_loss: 2.3584, test_f1: 0.5914
 epoch: 98, train_loss: 0.2858, test_loss: 2.4005, test_f1: 0.5473
 epoch: 99, train_loss: 0.2976, test_loss: 2.5320, test_f1: 0.5784

Training completed in 669.43 seconds
Best F1: 0.6566 at epoch 42
Mean F1 across iterations: 0.6331  0.0139
========================FINAL RESULTS================================
FEGIN weighted F1: 0.6566  0.0139
python main.py --data ltspice_demos --representation component_component --model FEGIN --layers 4 --hiddens 64 --batch_size 32 --lr 0.001 --emb_size 128 --epochs 100 --save_appendix component_component_L4_H64_BS32_LR0.001_E128 --no_val
-----



STDERR:
  File "main.py", line 370, in <module>
    main()
  File "main.py", line 254, in main
    dataset = dataset_class(
  File "/home/philip/projects/ltspice_examples_code_repo/Circuit-Completion-Using-GNNs/component_classification_with_link_prediction_head/evaluation/FEGIN/kernel/circuit_datasets.py", line 15, in __init__
    self.data, self.slices = torch.load(self.processed_paths[0])
  File "/home/philip/.local/lib/python3.8/site-packages/torch/serialization.py", line 1040, in load
    warnings.warn(
  File "/usr/lib/python3.8/warnings.py", line 109, in _showwarnmsg
    sw(msg.message, msg.category, msg.filename, msg.lineno,
  File "main.py", line 47, in warn_with_traceback
    traceback.print_stack(file=log)
/home/philip/projects/ltspice_examples_code_repo/Circuit-Completion-Using-GNNs/component_classification_with_link_prediction_head/evaluation/FEGIN/kernel/circuit_datasets.py:15: FutureWarning: You are using `torch.load` with `weights_only=False` (the current default value), which uses the default pickle module implicitly. It is possible to construct malicious pickle data which will execute arbitrary code during unpickling (See https://github.com/pytorch/pytorch/blob/main/SECURITY.md#untrusted-models for more details). In a future release, the default value for `weights_only` will be flipped to `True`. This limits the functions that could be executed during unpickling. Arbitrary objects will no longer be allowed to be loaded via this mode unless they are explicitly allowlisted by the user via `torch.serialization.add_safe_globals`. We recommend you start setting `weights_only=True` for any use case where you don't have full control of the loaded file. Please open an issue on GitHub for any issues related to this experimental feature.
  self.data, self.slices = torch.load(self.processed_paths[0])
