STDOUT:
Results will be saved in /home/philip/projects/ltspice_examples_code_repo/Circuit-Completion-Using-GNNs/component_classification_with_link_prediction_head/evaluation/FEGIN/results/model_FEGIN_dataset_ltspice_demos
Command line input: python main.py --data ltspice_demos --representation component_pin_net --model FEGIN --layers 3 --hiddens 128 --batch_size 256 --lr 0.0001 --emb_size 128 --epochs 100 --save_appendix component_pin_net_L3_H128_BS256_LR0.0001_E128 --no_val
 is saved.
-----
ltspice_demos - FEGIN
Using 3 layers, 128 hidden units, h = 2
Loading component_pin_net representation dataset
ENTERED
Training FEGIN on component_pin_net representation
Train: 1565, Test: 383
##################ITERATION #0 ****************************************
 epoch: 0, train_loss: 1.3886, test_loss: 1.3913, test_f1: 0.0301
 epoch: 1, train_loss: 1.3787, test_loss: 1.3886, test_f1: 0.0301
 epoch: 2, train_loss: 1.3730, test_loss: 1.3855, test_f1: 0.1411
 epoch: 3, train_loss: 1.3659, test_loss: 1.3815, test_f1: 0.1365
 epoch: 4, train_loss: 1.3577, test_loss: 1.3768, test_f1: 0.1365
 epoch: 5, train_loss: 1.3492, test_loss: 1.3713, test_f1: 0.1365
 epoch: 6, train_loss: 1.3392, test_loss: 1.3640, test_f1: 0.2453
 epoch: 7, train_loss: 1.3261, test_loss: 1.3539, test_f1: 0.3420
 epoch: 8, train_loss: 1.3095, test_loss: 1.3395, test_f1: 0.3458
 epoch: 9, train_loss: 1.2932, test_loss: 1.3222, test_f1: 0.3388
 epoch: 10, train_loss: 1.2732, test_loss: 1.3038, test_f1: 0.3512
 epoch: 11, train_loss: 1.2524, test_loss: 1.2848, test_f1: 0.3441
 epoch: 12, train_loss: 1.2319, test_loss: 1.2681, test_f1: 0.3556
 epoch: 13, train_loss: 1.2119, test_loss: 1.2537, test_f1: 0.3562
 epoch: 14, train_loss: 1.1948, test_loss: 1.2413, test_f1: 0.3586
 epoch: 15, train_loss: 1.1784, test_loss: 1.2316, test_f1: 0.3636
 epoch: 16, train_loss: 1.1659, test_loss: 1.2245, test_f1: 0.3624
 epoch: 17, train_loss: 1.1536, test_loss: 1.2182, test_f1: 0.3866
 epoch: 18, train_loss: 1.1441, test_loss: 1.2132, test_f1: 0.4024
 epoch: 19, train_loss: 1.1330, test_loss: 1.2089, test_f1: 0.4233
 epoch: 20, train_loss: 1.1261, test_loss: 1.2056, test_f1: 0.4296
 epoch: 21, train_loss: 1.1202, test_loss: 1.2010, test_f1: 0.4349
 epoch: 22, train_loss: 1.1157, test_loss: 1.1996, test_f1: 0.4328
 epoch: 23, train_loss: 1.1100, test_loss: 1.1974, test_f1: 0.4323
 epoch: 24, train_loss: 1.1047, test_loss: 1.1943, test_f1: 0.4322
 epoch: 25, train_loss: 1.1037, test_loss: 1.1918, test_f1: 0.4409
 epoch: 26, train_loss: 1.0998, test_loss: 1.1887, test_f1: 0.4402
 epoch: 27, train_loss: 1.0929, test_loss: 1.1864, test_f1: 0.4397
 epoch: 28, train_loss: 1.0905, test_loss: 1.1836, test_f1: 0.4354
 epoch: 29, train_loss: 1.0824, test_loss: 1.1840, test_f1: 0.4499
 epoch: 30, train_loss: 1.0792, test_loss: 1.1790, test_f1: 0.4419
 epoch: 31, train_loss: 1.0725, test_loss: 1.1748, test_f1: 0.4453
 epoch: 32, train_loss: 1.0693, test_loss: 1.1709, test_f1: 0.4415
 epoch: 33, train_loss: 1.0676, test_loss: 1.1693, test_f1: 0.4456
 epoch: 34, train_loss: 1.0617, test_loss: 1.1672, test_f1: 0.4431
 epoch: 35, train_loss: 1.0565, test_loss: 1.1640, test_f1: 0.4423
 epoch: 36, train_loss: 1.0473, test_loss: 1.1599, test_f1: 0.4399
 epoch: 37, train_loss: 1.0456, test_loss: 1.1590, test_f1: 0.4422
 epoch: 38, train_loss: 1.0362, test_loss: 1.1569, test_f1: 0.4426
 epoch: 39, train_loss: 1.0312, test_loss: 1.1459, test_f1: 0.4447
 epoch: 40, train_loss: 1.0184, test_loss: 1.1413, test_f1: 0.4480
 epoch: 41, train_loss: 1.0144, test_loss: 1.1383, test_f1: 0.4452
 epoch: 42, train_loss: 1.0076, test_loss: 1.1310, test_f1: 0.4482
 epoch: 43, train_loss: 1.0024, test_loss: 1.1268, test_f1: 0.4625
 epoch: 44, train_loss: 0.9969, test_loss: 1.1236, test_f1: 0.4676
 epoch: 45, train_loss: 0.9902, test_loss: 1.1207, test_f1: 0.4686
 epoch: 46, train_loss: 0.9815, test_loss: 1.1120, test_f1: 0.4595
 epoch: 47, train_loss: 0.9744, test_loss: 1.1033, test_f1: 0.4680
 epoch: 48, train_loss: 0.9726, test_loss: 1.1015, test_f1: 0.4616
 epoch: 49, train_loss: 0.9599, test_loss: 1.0988, test_f1: 0.4682
 epoch: 50, train_loss: 0.9601, test_loss: 1.0953, test_f1: 0.5054
 epoch: 51, train_loss: 0.9564, test_loss: 1.0849, test_f1: 0.5076
 epoch: 52, train_loss: 0.9456, test_loss: 1.0848, test_f1: 0.5134
 epoch: 53, train_loss: 0.9485, test_loss: 1.0835, test_f1: 0.5224
 epoch: 54, train_loss: 0.9426, test_loss: 1.0792, test_f1: 0.5082
 epoch: 55, train_loss: 0.9402, test_loss: 1.0703, test_f1: 0.5101
 epoch: 56, train_loss: 0.9358, test_loss: 1.0713, test_f1: 0.4993
 epoch: 57, train_loss: 0.9325, test_loss: 1.0727, test_f1: 0.5175
 epoch: 58, train_loss: 0.9284, test_loss: 1.0673, test_f1: 0.5050
 epoch: 59, train_loss: 0.9335, test_loss: 1.0697, test_f1: 0.5081
 epoch: 60, train_loss: 0.9289, test_loss: 1.0696, test_f1: 0.5230
 epoch: 61, train_loss: 0.9255, test_loss: 1.0714, test_f1: 0.5158
 epoch: 62, train_loss: 0.9228, test_loss: 1.0687, test_f1: 0.5253
 epoch: 63, train_loss: 0.9203, test_loss: 1.0653, test_f1: 0.5230
 epoch: 64, train_loss: 0.9181, test_loss: 1.0668, test_f1: 0.5183
 epoch: 65, train_loss: 0.9182, test_loss: 1.0612, test_f1: 0.5251
 epoch: 66, train_loss: 0.9184, test_loss: 1.0587, test_f1: 0.5370
 epoch: 67, train_loss: 0.9133, test_loss: 1.0605, test_f1: 0.5371
 epoch: 68, train_loss: 0.9163, test_loss: 1.0597, test_f1: 0.5197
 epoch: 69, train_loss: 0.9119, test_loss: 1.0448, test_f1: 0.5375
 epoch: 70, train_loss: 0.9017, test_loss: 1.0436, test_f1: 0.5477
 epoch: 71, train_loss: 0.8988, test_loss: 1.0480, test_f1: 0.5348
 epoch: 72, train_loss: 0.9010, test_loss: 1.0511, test_f1: 0.5532
 epoch: 73, train_loss: 0.9005, test_loss: 1.0542, test_f1: 0.5480
 epoch: 74, train_loss: 0.9018, test_loss: 1.0450, test_f1: 0.5563
 epoch: 75, train_loss: 0.8934, test_loss: 1.0428, test_f1: 0.5490
 epoch: 76, train_loss: 0.8911, test_loss: 1.0446, test_f1: 0.5568
 epoch: 77, train_loss: 0.8909, test_loss: 1.0409, test_f1: 0.5556
 epoch: 78, train_loss: 0.8939, test_loss: 1.0431, test_f1: 0.5590
 epoch: 79, train_loss: 0.8895, test_loss: 1.0396, test_f1: 0.5575
 epoch: 80, train_loss: 0.8910, test_loss: 1.0298, test_f1: 0.5610
 epoch: 81, train_loss: 0.8824, test_loss: 1.0360, test_f1: 0.5531
 epoch: 82, train_loss: 0.8807, test_loss: 1.0407, test_f1: 0.5541
 epoch: 83, train_loss: 0.8784, test_loss: 1.0375, test_f1: 0.5519
 epoch: 84, train_loss: 0.8762, test_loss: 1.0377, test_f1: 0.5553
 epoch: 85, train_loss: 0.8769, test_loss: 1.0381, test_f1: 0.5457
 epoch: 86, train_loss: 0.8706, test_loss: 1.0351, test_f1: 0.5609
 epoch: 87, train_loss: 0.8740, test_loss: 1.0337, test_f1: 0.5556
 epoch: 88, train_loss: 0.8694, test_loss: 1.0356, test_f1: 0.5565
 epoch: 89, train_loss: 0.8662, test_loss: 1.0326, test_f1: 0.5594
 epoch: 90, train_loss: 0.8702, test_loss: 1.0295, test_f1: 0.5678
 epoch: 91, train_loss: 0.8625, test_loss: 1.0314, test_f1: 0.5607
 epoch: 92, train_loss: 0.8615, test_loss: 1.0321, test_f1: 0.5618
 epoch: 93, train_loss: 0.8516, test_loss: 1.0317, test_f1: 0.5594
 epoch: 94, train_loss: 0.8527, test_loss: 1.0287, test_f1: 0.5589
 epoch: 95, train_loss: 0.8499, test_loss: 1.0290, test_f1: 0.5679
 epoch: 96, train_loss: 0.8492, test_loss: 1.0182, test_f1: 0.5582
 epoch: 97, train_loss: 0.8499, test_loss: 1.0184, test_f1: 0.5633
 epoch: 98, train_loss: 0.8471, test_loss: 1.0157, test_f1: 0.5583
 epoch: 99, train_loss: 0.8413, test_loss: 1.0156, test_f1: 0.5539
##################ITERATION #1 ****************************************
 epoch: 0, train_loss: 1.3532, test_loss: 1.3768, test_f1: 0.1365
 epoch: 1, train_loss: 1.3156, test_loss: 1.3656, test_f1: 0.1365
 epoch: 2, train_loss: 1.2906, test_loss: 1.3500, test_f1: 0.1365
 epoch: 3, train_loss: 1.2676, test_loss: 1.3335, test_f1: 0.3322
 epoch: 4, train_loss: 1.2437, test_loss: 1.3168, test_f1: 0.3247
 epoch: 5, train_loss: 1.2208, test_loss: 1.2998, test_f1: 0.3246
 epoch: 6, train_loss: 1.1961, test_loss: 1.2823, test_f1: 0.3511
 epoch: 7, train_loss: 1.1773, test_loss: 1.2616, test_f1: 0.4151
 epoch: 8, train_loss: 1.1545, test_loss: 1.2384, test_f1: 0.4273
 epoch: 9, train_loss: 1.1403, test_loss: 1.2173, test_f1: 0.4302
 epoch: 10, train_loss: 1.1217, test_loss: 1.1970, test_f1: 0.4423
 epoch: 11, train_loss: 1.1068, test_loss: 1.1817, test_f1: 0.4515
 epoch: 12, train_loss: 1.0926, test_loss: 1.1703, test_f1: 0.4516
 epoch: 13, train_loss: 1.0845, test_loss: 1.1611, test_f1: 0.4516
 epoch: 14, train_loss: 1.0728, test_loss: 1.1529, test_f1: 0.4466
 epoch: 15, train_loss: 1.0624, test_loss: 1.1489, test_f1: 0.4443
 epoch: 16, train_loss: 1.0501, test_loss: 1.1444, test_f1: 0.4462
 epoch: 17, train_loss: 1.0428, test_loss: 1.1392, test_f1: 0.4465
 epoch: 18, train_loss: 1.0380, test_loss: 1.1319, test_f1: 0.4458
 epoch: 19, train_loss: 1.0236, test_loss: 1.1242, test_f1: 0.4458
 epoch: 20, train_loss: 1.0204, test_loss: 1.1158, test_f1: 0.4467
 epoch: 21, train_loss: 1.0139, test_loss: 1.1129, test_f1: 0.4487
 epoch: 22, train_loss: 1.0081, test_loss: 1.1109, test_f1: 0.4601
 epoch: 23, train_loss: 0.9984, test_loss: 1.1075, test_f1: 0.4609
 epoch: 24, train_loss: 0.9962, test_loss: 1.1041, test_f1: 0.4582
 epoch: 25, train_loss: 0.9916, test_loss: 1.1006, test_f1: 0.4607
 epoch: 26, train_loss: 0.9881, test_loss: 1.0971, test_f1: 0.4587
 epoch: 27, train_loss: 0.9787, test_loss: 1.0925, test_f1: 0.4641
 epoch: 28, train_loss: 0.9738, test_loss: 1.0894, test_f1: 0.4611
 epoch: 29, train_loss: 0.9739, test_loss: 1.0863, test_f1: 0.4588
 epoch: 30, train_loss: 0.9698, test_loss: 1.0881, test_f1: 0.4634
 epoch: 31, train_loss: 0.9667, test_loss: 1.0865, test_f1: 0.4586
 epoch: 32, train_loss: 0.9618, test_loss: 1.0791, test_f1: 0.4800
 epoch: 33, train_loss: 0.9596, test_loss: 1.0744, test_f1: 0.4894
 epoch: 34, train_loss: 0.9579, test_loss: 1.0716, test_f1: 0.5072
 epoch: 35, train_loss: 0.9477, test_loss: 1.0702, test_f1: 0.4927
 epoch: 36, train_loss: 0.9456, test_loss: 1.0759, test_f1: 0.5056
 epoch: 37, train_loss: 0.9392, test_loss: 1.0809, test_f1: 0.5048
 epoch: 38, train_loss: 0.9370, test_loss: 1.0806, test_f1: 0.5102
 epoch: 39, train_loss: 0.9395, test_loss: 1.0720, test_f1: 0.5099
 epoch: 40, train_loss: 0.9359, test_loss: 1.0751, test_f1: 0.5152
 epoch: 41, train_loss: 0.9310, test_loss: 1.0665, test_f1: 0.4845
 epoch: 42, train_loss: 0.9269, test_loss: 1.0637, test_f1: 0.5128
 epoch: 43, train_loss: 0.9225, test_loss: 1.0594, test_f1: 0.5349
 epoch: 44, train_loss: 0.9186, test_loss: 1.0614, test_f1: 0.5361
 epoch: 45, train_loss: 0.9158, test_loss: 1.0692, test_f1: 0.5166
 epoch: 46, train_loss: 0.9123, test_loss: 1.0582, test_f1: 0.5603
 epoch: 47, train_loss: 0.8994, test_loss: 1.0583, test_f1: 0.5604
 epoch: 48, train_loss: 0.9054, test_loss: 1.0585, test_f1: 0.5140
 epoch: 49, train_loss: 0.9039, test_loss: 1.0583, test_f1: 0.5165
 epoch: 50, train_loss: 0.8980, test_loss: 1.0637, test_f1: 0.5264
 epoch: 51, train_loss: 0.8939, test_loss: 1.0604, test_f1: 0.5214
 epoch: 52, train_loss: 0.8957, test_loss: 1.0572, test_f1: 0.5294
 epoch: 53, train_loss: 0.8919, test_loss: 1.0567, test_f1: 0.5232
 epoch: 54, train_loss: 0.8882, test_loss: 1.0568, test_f1: 0.5397
 epoch: 55, train_loss: 0.8863, test_loss: 1.0578, test_f1: 0.5325
 epoch: 56, train_loss: 0.8839, test_loss: 1.0561, test_f1: 0.5437
 epoch: 57, train_loss: 0.8792, test_loss: 1.0562, test_f1: 0.5472
 epoch: 58, train_loss: 0.8816, test_loss: 1.0527, test_f1: 0.5368
 epoch: 59, train_loss: 0.8756, test_loss: 1.0620, test_f1: 0.5402
 epoch: 60, train_loss: 0.8740, test_loss: 1.0590, test_f1: 0.5532
 epoch: 61, train_loss: 0.8751, test_loss: 1.0527, test_f1: 0.5414
 epoch: 62, train_loss: 0.8725, test_loss: 1.0528, test_f1: 0.5563
 epoch: 63, train_loss: 0.8686, test_loss: 1.0587, test_f1: 0.5306
 epoch: 64, train_loss: 0.8665, test_loss: 1.0584, test_f1: 0.5275
 epoch: 65, train_loss: 0.8687, test_loss: 1.0513, test_f1: 0.5441
 epoch: 66, train_loss: 0.8713, test_loss: 1.0485, test_f1: 0.5473
 epoch: 67, train_loss: 0.8642, test_loss: 1.0551, test_f1: 0.5520
 epoch: 68, train_loss: 0.8621, test_loss: 1.0513, test_f1: 0.5478
 epoch: 69, train_loss: 0.8571, test_loss: 1.0494, test_f1: 0.5386
 epoch: 70, train_loss: 0.8652, test_loss: 1.0469, test_f1: 0.5419
 epoch: 71, train_loss: 0.8609, test_loss: 1.0414, test_f1: 0.5371
 epoch: 72, train_loss: 0.8614, test_loss: 1.0605, test_f1: 0.5377
 epoch: 73, train_loss: 0.8562, test_loss: 1.0516, test_f1: 0.5355
 epoch: 74, train_loss: 0.8612, test_loss: 1.0380, test_f1: 0.5396
 epoch: 75, train_loss: 0.8585, test_loss: 1.0343, test_f1: 0.5448
 epoch: 76, train_loss: 0.8453, test_loss: 1.0375, test_f1: 0.5498
 epoch: 77, train_loss: 0.8485, test_loss: 1.0386, test_f1: 0.5462
 epoch: 78, train_loss: 0.8498, test_loss: 1.0399, test_f1: 0.5393
 epoch: 79, train_loss: 0.8374, test_loss: 1.0346, test_f1: 0.5434
 epoch: 80, train_loss: 0.8374, test_loss: 1.0372, test_f1: 0.5442
 epoch: 81, train_loss: 0.8361, test_loss: 1.0439, test_f1: 0.5577
 epoch: 82, train_loss: 0.8383, test_loss: 1.0366, test_f1: 0.5418
 epoch: 83, train_loss: 0.8394, test_loss: 1.0345, test_f1: 0.5327
 epoch: 84, train_loss: 0.8363, test_loss: 1.0341, test_f1: 0.5280
 epoch: 85, train_loss: 0.8317, test_loss: 1.0461, test_f1: 0.5373
 epoch: 86, train_loss: 0.8356, test_loss: 1.0429, test_f1: 0.5427
 epoch: 87, train_loss: 0.8275, test_loss: 1.0421, test_f1: 0.5492
 epoch: 88, train_loss: 0.8258, test_loss: 1.0395, test_f1: 0.5375
 epoch: 89, train_loss: 0.8219, test_loss: 1.0420, test_f1: 0.5401
 epoch: 90, train_loss: 0.8283, test_loss: 1.0396, test_f1: 0.5498
 epoch: 91, train_loss: 0.8182, test_loss: 1.0290, test_f1: 0.5439
 epoch: 92, train_loss: 0.8258, test_loss: 1.0297, test_f1: 0.5480
 epoch: 93, train_loss: 0.8176, test_loss: 1.0400, test_f1: 0.5483
 epoch: 94, train_loss: 0.8104, test_loss: 1.0349, test_f1: 0.5466
 epoch: 95, train_loss: 0.8116, test_loss: 1.0273, test_f1: 0.5298
 epoch: 96, train_loss: 0.8100, test_loss: 1.0319, test_f1: 0.5362
 epoch: 97, train_loss: 0.8064, test_loss: 1.0358, test_f1: 0.5391
 epoch: 98, train_loss: 0.8124, test_loss: 1.0353, test_f1: 0.5362
 epoch: 99, train_loss: 0.8040, test_loss: 1.0409, test_f1: 0.5496
##################ITERATION #2 ****************************************
 epoch: 0, train_loss: 1.3387, test_loss: 1.3706, test_f1: 0.1365
 epoch: 1, train_loss: 1.2798, test_loss: 1.3562, test_f1: 0.1365
 epoch: 2, train_loss: 1.2487, test_loss: 1.3380, test_f1: 0.1365
 epoch: 3, train_loss: 1.2191, test_loss: 1.3182, test_f1: 0.1998
 epoch: 4, train_loss: 1.1940, test_loss: 1.2968, test_f1: 0.3328
 epoch: 5, train_loss: 1.1707, test_loss: 1.2752, test_f1: 0.3407
 epoch: 6, train_loss: 1.1480, test_loss: 1.2536, test_f1: 0.3460
 epoch: 7, train_loss: 1.1308, test_loss: 1.2311, test_f1: 0.4135
 epoch: 8, train_loss: 1.1147, test_loss: 1.2099, test_f1: 0.4440
 epoch: 9, train_loss: 1.0993, test_loss: 1.1920, test_f1: 0.4454
 epoch: 10, train_loss: 1.0866, test_loss: 1.1778, test_f1: 0.4458
 epoch: 11, train_loss: 1.0770, test_loss: 1.1664, test_f1: 0.4518
 epoch: 12, train_loss: 1.0576, test_loss: 1.1576, test_f1: 0.4494
 epoch: 13, train_loss: 1.0520, test_loss: 1.1473, test_f1: 0.4428
 epoch: 14, train_loss: 1.0410, test_loss: 1.1408, test_f1: 0.4393
 epoch: 15, train_loss: 1.0407, test_loss: 1.1326, test_f1: 0.4439
 epoch: 16, train_loss: 1.0293, test_loss: 1.1262, test_f1: 0.4435
 epoch: 17, train_loss: 1.0228, test_loss: 1.1200, test_f1: 0.4458
 epoch: 18, train_loss: 1.0153, test_loss: 1.1104, test_f1: 0.4365
 epoch: 19, train_loss: 1.0066, test_loss: 1.1082, test_f1: 0.4463
 epoch: 20, train_loss: 0.9965, test_loss: 1.1030, test_f1: 0.4475
 epoch: 21, train_loss: 0.9987, test_loss: 1.0986, test_f1: 0.4492
 epoch: 22, train_loss: 0.9829, test_loss: 1.0960, test_f1: 0.4542
 epoch: 23, train_loss: 0.9857, test_loss: 1.0910, test_f1: 0.4531
 epoch: 24, train_loss: 0.9761, test_loss: 1.0855, test_f1: 0.4807
 epoch: 25, train_loss: 0.9662, test_loss: 1.0755, test_f1: 0.4868
 epoch: 26, train_loss: 0.9684, test_loss: 1.0717, test_f1: 0.5005
 epoch: 27, train_loss: 0.9554, test_loss: 1.0657, test_f1: 0.5095
 epoch: 28, train_loss: 0.9544, test_loss: 1.0665, test_f1: 0.5120
 epoch: 29, train_loss: 0.9500, test_loss: 1.0602, test_f1: 0.5088
 epoch: 30, train_loss: 0.9493, test_loss: 1.0616, test_f1: 0.4992
 epoch: 31, train_loss: 0.9358, test_loss: 1.0561, test_f1: 0.5099
 epoch: 32, train_loss: 0.9307, test_loss: 1.0561, test_f1: 0.5095
 epoch: 33, train_loss: 0.9291, test_loss: 1.0502, test_f1: 0.5280
 epoch: 34, train_loss: 0.9244, test_loss: 1.0517, test_f1: 0.5444
 epoch: 35, train_loss: 0.9202, test_loss: 1.0511, test_f1: 0.5335
 epoch: 36, train_loss: 0.9141, test_loss: 1.0546, test_f1: 0.5362
 epoch: 37, train_loss: 0.9099, test_loss: 1.0498, test_f1: 0.5510
 epoch: 38, train_loss: 0.9154, test_loss: 1.0404, test_f1: 0.5505
 epoch: 39, train_loss: 0.9067, test_loss: 1.0308, test_f1: 0.5504
 epoch: 40, train_loss: 0.8970, test_loss: 1.0206, test_f1: 0.5470
 epoch: 41, train_loss: 0.9026, test_loss: 1.0169, test_f1: 0.5454
 epoch: 42, train_loss: 0.8978, test_loss: 1.0125, test_f1: 0.5423
 epoch: 43, train_loss: 0.8895, test_loss: 1.0160, test_f1: 0.5456
 epoch: 44, train_loss: 0.8833, test_loss: 1.0224, test_f1: 0.5447
 epoch: 45, train_loss: 0.8845, test_loss: 1.0311, test_f1: 0.5475
 epoch: 46, train_loss: 0.8655, test_loss: 1.0179, test_f1: 0.5510
 epoch: 47, train_loss: 0.8633, test_loss: 1.0157, test_f1: 0.5480
 epoch: 48, train_loss: 0.8615, test_loss: 1.0240, test_f1: 0.5609
 epoch: 49, train_loss: 0.8640, test_loss: 1.0215, test_f1: 0.5524
 epoch: 50, train_loss: 0.8526, test_loss: 1.0185, test_f1: 0.5335
 epoch: 51, train_loss: 0.8458, test_loss: 1.0179, test_f1: 0.5333
 epoch: 52, train_loss: 0.8418, test_loss: 1.0201, test_f1: 0.5358
 epoch: 53, train_loss: 0.8488, test_loss: 1.0280, test_f1: 0.5301
 epoch: 54, train_loss: 0.8397, test_loss: 1.0195, test_f1: 0.5274
 epoch: 55, train_loss: 0.8393, test_loss: 1.0172, test_f1: 0.5341
 epoch: 56, train_loss: 0.8413, test_loss: 1.0176, test_f1: 0.5369
 epoch: 57, train_loss: 0.8350, test_loss: 1.0161, test_f1: 0.5446
 epoch: 58, train_loss: 0.8229, test_loss: 1.0148, test_f1: 0.5369
 epoch: 59, train_loss: 0.8247, test_loss: 1.0158, test_f1: 0.5349
 epoch: 60, train_loss: 0.8282, test_loss: 1.0154, test_f1: 0.5283
 epoch: 61, train_loss: 0.8220, test_loss: 1.0178, test_f1: 0.5213
 epoch: 62, train_loss: 0.8190, test_loss: 1.0170, test_f1: 0.5234
 epoch: 63, train_loss: 0.8172, test_loss: 1.0134, test_f1: 0.5187
 epoch: 64, train_loss: 0.8187, test_loss: 1.0135, test_f1: 0.5272
 epoch: 65, train_loss: 0.8096, test_loss: 1.0139, test_f1: 0.5205
 epoch: 66, train_loss: 0.8141, test_loss: 1.0091, test_f1: 0.5285
 epoch: 67, train_loss: 0.8005, test_loss: 1.0111, test_f1: 0.5284
 epoch: 68, train_loss: 0.8058, test_loss: 1.0139, test_f1: 0.5232
 epoch: 69, train_loss: 0.8097, test_loss: 1.0151, test_f1: 0.5203
 epoch: 70, train_loss: 0.8019, test_loss: 1.0140, test_f1: 0.5359
 epoch: 71, train_loss: 0.8002, test_loss: 1.0083, test_f1: 0.5305
 epoch: 72, train_loss: 0.7999, test_loss: 1.0089, test_f1: 0.5338
 epoch: 73, train_loss: 0.7990, test_loss: 1.0125, test_f1: 0.5390
 epoch: 74, train_loss: 0.7884, test_loss: 1.0121, test_f1: 0.5414
 epoch: 75, train_loss: 0.7886, test_loss: 1.0140, test_f1: 0.5302
 epoch: 76, train_loss: 0.7857, test_loss: 1.0121, test_f1: 0.5369
 epoch: 77, train_loss: 0.7903, test_loss: 1.0080, test_f1: 0.5295
 epoch: 78, train_loss: 0.7858, test_loss: 1.0092, test_f1: 0.5420
 epoch: 79, train_loss: 0.7844, test_loss: 1.0131, test_f1: 0.5343
 epoch: 80, train_loss: 0.7847, test_loss: 0.9994, test_f1: 0.5494
 epoch: 81, train_loss: 0.7814, test_loss: 1.0018, test_f1: 0.5483
 epoch: 82, train_loss: 0.7802, test_loss: 1.0086, test_f1: 0.5503
 epoch: 83, train_loss: 0.7701, test_loss: 1.0100, test_f1: 0.5480
 epoch: 84, train_loss: 0.7646, test_loss: 1.0121, test_f1: 0.5474
 epoch: 85, train_loss: 0.7711, test_loss: 1.0120, test_f1: 0.5407
 epoch: 86, train_loss: 0.7658, test_loss: 1.0100, test_f1: 0.5577
 epoch: 87, train_loss: 0.7663, test_loss: 1.0172, test_f1: 0.5513
 epoch: 88, train_loss: 0.7568, test_loss: 1.0153, test_f1: 0.5513
 epoch: 89, train_loss: 0.7623, test_loss: 1.0137, test_f1: 0.5351
 epoch: 90, train_loss: 0.7598, test_loss: 1.0151, test_f1: 0.5353
 epoch: 91, train_loss: 0.7552, test_loss: 1.0210, test_f1: 0.5401
 epoch: 92, train_loss: 0.7523, test_loss: 1.0317, test_f1: 0.5409
 epoch: 93, train_loss: 0.7548, test_loss: 1.0221, test_f1: 0.5565
 epoch: 94, train_loss: 0.7597, test_loss: 1.0212, test_f1: 0.5516
 epoch: 95, train_loss: 0.7442, test_loss: 1.0354, test_f1: 0.5415
 epoch: 96, train_loss: 0.7491, test_loss: 1.0198, test_f1: 0.5592
 epoch: 97, train_loss: 0.7411, test_loss: 1.0235, test_f1: 0.5558
 epoch: 98, train_loss: 0.7426, test_loss: 1.0245, test_f1: 0.5505
 epoch: 99, train_loss: 0.7466, test_loss: 1.0166, test_f1: 0.5496
##################ITERATION #3 ****************************************
 epoch: 0, train_loss: 1.2964, test_loss: 1.3523, test_f1: 0.1365
 epoch: 1, train_loss: 1.2302, test_loss: 1.3362, test_f1: 0.1365
 epoch: 2, train_loss: 1.1982, test_loss: 1.3210, test_f1: 0.1365
 epoch: 3, train_loss: 1.1691, test_loss: 1.3072, test_f1: 0.1365
 epoch: 4, train_loss: 1.1453, test_loss: 1.2928, test_f1: 0.1425
 epoch: 5, train_loss: 1.1240, test_loss: 1.2738, test_f1: 0.2238
 epoch: 6, train_loss: 1.1090, test_loss: 1.2445, test_f1: 0.3538
 epoch: 7, train_loss: 1.0872, test_loss: 1.2117, test_f1: 0.4212
 epoch: 8, train_loss: 1.0710, test_loss: 1.1835, test_f1: 0.4468
 epoch: 9, train_loss: 1.0594, test_loss: 1.1647, test_f1: 0.4602
 epoch: 10, train_loss: 1.0512, test_loss: 1.1501, test_f1: 0.4490
 epoch: 11, train_loss: 1.0360, test_loss: 1.1360, test_f1: 0.4318
 epoch: 12, train_loss: 1.0288, test_loss: 1.1202, test_f1: 0.4339
 epoch: 13, train_loss: 1.0225, test_loss: 1.1101, test_f1: 0.4416
 epoch: 14, train_loss: 1.0115, test_loss: 1.1024, test_f1: 0.4453
 epoch: 15, train_loss: 0.9998, test_loss: 1.0928, test_f1: 0.4633
 epoch: 16, train_loss: 0.9941, test_loss: 1.0847, test_f1: 0.4696
 epoch: 17, train_loss: 0.9915, test_loss: 1.0793, test_f1: 0.4805
 epoch: 18, train_loss: 0.9800, test_loss: 1.0744, test_f1: 0.4836
 epoch: 19, train_loss: 0.9751, test_loss: 1.0701, test_f1: 0.4881
 epoch: 20, train_loss: 0.9671, test_loss: 1.0661, test_f1: 0.4967
 epoch: 21, train_loss: 0.9642, test_loss: 1.0641, test_f1: 0.4948
 epoch: 22, train_loss: 0.9617, test_loss: 1.0609, test_f1: 0.4929
 epoch: 23, train_loss: 0.9537, test_loss: 1.0526, test_f1: 0.5008
 epoch: 24, train_loss: 0.9454, test_loss: 1.0458, test_f1: 0.5093
 epoch: 25, train_loss: 0.9370, test_loss: 1.0426, test_f1: 0.5278
 epoch: 26, train_loss: 0.9385, test_loss: 1.0433, test_f1: 0.5287
 epoch: 27, train_loss: 0.9336, test_loss: 1.0393, test_f1: 0.5354
 epoch: 28, train_loss: 0.9233, test_loss: 1.0322, test_f1: 0.5377
 epoch: 29, train_loss: 0.9190, test_loss: 1.0344, test_f1: 0.5391
 epoch: 30, train_loss: 0.9207, test_loss: 1.0398, test_f1: 0.5453
 epoch: 31, train_loss: 0.9138, test_loss: 1.0401, test_f1: 0.5330
 epoch: 32, train_loss: 0.9105, test_loss: 1.0314, test_f1: 0.5473
 epoch: 33, train_loss: 0.9011, test_loss: 1.0306, test_f1: 0.5477
 epoch: 34, train_loss: 0.8982, test_loss: 1.0204, test_f1: 0.5485
 epoch: 35, train_loss: 0.8972, test_loss: 1.0181, test_f1: 0.5597
 epoch: 36, train_loss: 0.8922, test_loss: 1.0176, test_f1: 0.5670
 epoch: 37, train_loss: 0.8906, test_loss: 1.0166, test_f1: 0.5661
 epoch: 38, train_loss: 0.8869, test_loss: 1.0182, test_f1: 0.5707
 epoch: 39, train_loss: 0.8807, test_loss: 1.0372, test_f1: 0.5505
 epoch: 40, train_loss: 0.8802, test_loss: 1.0250, test_f1: 0.5558
 epoch: 41, train_loss: 0.8774, test_loss: 1.0094, test_f1: 0.5670
 epoch: 42, train_loss: 0.8744, test_loss: 1.0102, test_f1: 0.5684
 epoch: 43, train_loss: 0.8630, test_loss: 1.0114, test_f1: 0.5409
 epoch: 44, train_loss: 0.8634, test_loss: 1.0013, test_f1: 0.5451
 epoch: 45, train_loss: 0.8564, test_loss: 1.0093, test_f1: 0.5465
 epoch: 46, train_loss: 0.8579, test_loss: 1.0067, test_f1: 0.5508
 epoch: 47, train_loss: 0.8517, test_loss: 1.0010, test_f1: 0.5138
 epoch: 48, train_loss: 0.8461, test_loss: 1.0030, test_f1: 0.4995
 epoch: 49, train_loss: 0.8449, test_loss: 0.9968, test_f1: 0.5131
 epoch: 50, train_loss: 0.8408, test_loss: 0.9934, test_f1: 0.5391
 epoch: 51, train_loss: 0.8308, test_loss: 0.9922, test_f1: 0.5339
 epoch: 52, train_loss: 0.8328, test_loss: 1.0034, test_f1: 0.5386
 epoch: 53, train_loss: 0.8275, test_loss: 1.0011, test_f1: 0.5324
 epoch: 54, train_loss: 0.8268, test_loss: 0.9989, test_f1: 0.5207
 epoch: 55, train_loss: 0.8233, test_loss: 0.9966, test_f1: 0.5165
 epoch: 56, train_loss: 0.8276, test_loss: 0.9955, test_f1: 0.5379
 epoch: 57, train_loss: 0.8246, test_loss: 0.9966, test_f1: 0.5577
 epoch: 58, train_loss: 0.8151, test_loss: 0.9968, test_f1: 0.5453
 epoch: 59, train_loss: 0.8138, test_loss: 0.9905, test_f1: 0.5310
 epoch: 60, train_loss: 0.8198, test_loss: 0.9876, test_f1: 0.5295
 epoch: 61, train_loss: 0.8114, test_loss: 0.9840, test_f1: 0.5301
 epoch: 62, train_loss: 0.8059, test_loss: 0.9890, test_f1: 0.5437
 epoch: 63, train_loss: 0.8071, test_loss: 0.9875, test_f1: 0.5284
 epoch: 64, train_loss: 0.8018, test_loss: 0.9888, test_f1: 0.5328
 epoch: 65, train_loss: 0.7984, test_loss: 1.0001, test_f1: 0.5249
 epoch: 66, train_loss: 0.7966, test_loss: 0.9964, test_f1: 0.5264
 epoch: 67, train_loss: 0.7936, test_loss: 0.9881, test_f1: 0.5348
 epoch: 68, train_loss: 0.7903, test_loss: 0.9880, test_f1: 0.5448
 epoch: 69, train_loss: 0.7928, test_loss: 0.9904, test_f1: 0.5308
 epoch: 70, train_loss: 0.7924, test_loss: 0.9840, test_f1: 0.5336
 epoch: 71, train_loss: 0.7889, test_loss: 0.9882, test_f1: 0.5258
 epoch: 72, train_loss: 0.7857, test_loss: 0.9986, test_f1: 0.5331
 epoch: 73, train_loss: 0.7941, test_loss: 0.9957, test_f1: 0.5583
 epoch: 74, train_loss: 0.7786, test_loss: 0.9933, test_f1: 0.5523
 epoch: 75, train_loss: 0.7783, test_loss: 0.9929, test_f1: 0.5383
 epoch: 76, train_loss: 0.7753, test_loss: 0.9849, test_f1: 0.5426
 epoch: 77, train_loss: 0.7734, test_loss: 0.9848, test_f1: 0.5391
 epoch: 78, train_loss: 0.7754, test_loss: 0.9887, test_f1: 0.5366
 epoch: 79, train_loss: 0.7630, test_loss: 0.9850, test_f1: 0.5413
 epoch: 80, train_loss: 0.7705, test_loss: 0.9806, test_f1: 0.5469
 epoch: 81, train_loss: 0.7644, test_loss: 0.9856, test_f1: 0.5519
 epoch: 82, train_loss: 0.7636, test_loss: 0.9906, test_f1: 0.5490
 epoch: 83, train_loss: 0.7701, test_loss: 0.9866, test_f1: 0.5531
 epoch: 84, train_loss: 0.7512, test_loss: 0.9877, test_f1: 0.5515
 epoch: 85, train_loss: 0.7608, test_loss: 0.9874, test_f1: 0.5479
 epoch: 86, train_loss: 0.7578, test_loss: 0.9920, test_f1: 0.5506
 epoch: 87, train_loss: 0.7574, test_loss: 0.9997, test_f1: 0.5455
 epoch: 88, train_loss: 0.7526, test_loss: 0.9924, test_f1: 0.5492
 epoch: 89, train_loss: 0.7545, test_loss: 0.9783, test_f1: 0.5566
 epoch: 90, train_loss: 0.7530, test_loss: 0.9849, test_f1: 0.5677
 epoch: 91, train_loss: 0.7451, test_loss: 1.0059, test_f1: 0.5615
 epoch: 92, train_loss: 0.7452, test_loss: 0.9972, test_f1: 0.5586
 epoch: 93, train_loss: 0.7384, test_loss: 0.9914, test_f1: 0.5536
 epoch: 94, train_loss: 0.7449, test_loss: 0.9869, test_f1: 0.5543
 epoch: 95, train_loss: 0.7339, test_loss: 0.9926, test_f1: 0.5496
 epoch: 96, train_loss: 0.7316, test_loss: 0.9917, test_f1: 0.5529
 epoch: 97, train_loss: 0.7332, test_loss: 0.9867, test_f1: 0.5577
 epoch: 98, train_loss: 0.7297, test_loss: 0.9937, test_f1: 0.5568
 epoch: 99, train_loss: 0.7235, test_loss: 0.9978, test_f1: 0.5528
##################ITERATION #4 ****************************************
 epoch: 0, train_loss: 1.2631, test_loss: 1.3328, test_f1: 0.1365
 epoch: 1, train_loss: 1.2083, test_loss: 1.3163, test_f1: 0.1365
 epoch: 2, train_loss: 1.1812, test_loss: 1.3030, test_f1: 0.1365
 epoch: 3, train_loss: 1.1529, test_loss: 1.2951, test_f1: 0.1616
 epoch: 4, train_loss: 1.1378, test_loss: 1.2882, test_f1: 0.3266
 epoch: 5, train_loss: 1.1210, test_loss: 1.2741, test_f1: 0.3194
 epoch: 6, train_loss: 1.1029, test_loss: 1.2482, test_f1: 0.3233
 epoch: 7, train_loss: 1.0878, test_loss: 1.2158, test_f1: 0.3803
 epoch: 8, train_loss: 1.0707, test_loss: 1.1817, test_f1: 0.4444
 epoch: 9, train_loss: 1.0550, test_loss: 1.1591, test_f1: 0.4300
 epoch: 10, train_loss: 1.0463, test_loss: 1.1454, test_f1: 0.4307
 epoch: 11, train_loss: 1.0345, test_loss: 1.1347, test_f1: 0.4279
 epoch: 12, train_loss: 1.0287, test_loss: 1.1261, test_f1: 0.4269
 epoch: 13, train_loss: 1.0181, test_loss: 1.1200, test_f1: 0.4269
 epoch: 14, train_loss: 1.0111, test_loss: 1.1120, test_f1: 0.4247
 epoch: 15, train_loss: 1.0025, test_loss: 1.1064, test_f1: 0.4313
 epoch: 16, train_loss: 0.9955, test_loss: 1.1016, test_f1: 0.4346
 epoch: 17, train_loss: 0.9880, test_loss: 1.1004, test_f1: 0.4425
 epoch: 18, train_loss: 0.9782, test_loss: 1.0906, test_f1: 0.4532
 epoch: 19, train_loss: 0.9756, test_loss: 1.0806, test_f1: 0.4713
 epoch: 20, train_loss: 0.9709, test_loss: 1.0747, test_f1: 0.4861
 epoch: 21, train_loss: 0.9666, test_loss: 1.0680, test_f1: 0.4939
 epoch: 22, train_loss: 0.9601, test_loss: 1.0727, test_f1: 0.4830
 epoch: 23, train_loss: 0.9577, test_loss: 1.0753, test_f1: 0.4804
 epoch: 24, train_loss: 0.9555, test_loss: 1.0667, test_f1: 0.4921
 epoch: 25, train_loss: 0.9453, test_loss: 1.0604, test_f1: 0.5073
 epoch: 26, train_loss: 0.9420, test_loss: 1.0548, test_f1: 0.5070
 epoch: 27, train_loss: 0.9374, test_loss: 1.0551, test_f1: 0.5107
 epoch: 28, train_loss: 0.9299, test_loss: 1.0550, test_f1: 0.5107
 epoch: 29, train_loss: 0.9269, test_loss: 1.0507, test_f1: 0.5134
 epoch: 30, train_loss: 0.9189, test_loss: 1.0444, test_f1: 0.5185
 epoch: 31, train_loss: 0.9165, test_loss: 1.0433, test_f1: 0.5125
 epoch: 32, train_loss: 0.9112, test_loss: 1.0349, test_f1: 0.5176
 epoch: 33, train_loss: 0.9078, test_loss: 1.0404, test_f1: 0.5260
 epoch: 34, train_loss: 0.9012, test_loss: 1.0390, test_f1: 0.5297
 epoch: 35, train_loss: 0.9018, test_loss: 1.0398, test_f1: 0.5242
 epoch: 36, train_loss: 0.8948, test_loss: 1.0364, test_f1: 0.5282
 epoch: 37, train_loss: 0.8859, test_loss: 1.0302, test_f1: 0.5305
 epoch: 38, train_loss: 0.8899, test_loss: 1.0326, test_f1: 0.5505
 epoch: 39, train_loss: 0.8707, test_loss: 1.0261, test_f1: 0.5631
 epoch: 40, train_loss: 0.8746, test_loss: 1.0305, test_f1: 0.5533
 epoch: 41, train_loss: 0.8719, test_loss: 1.0271, test_f1: 0.5621
 epoch: 42, train_loss: 0.8665, test_loss: 1.0223, test_f1: 0.5547
 epoch: 43, train_loss: 0.8615, test_loss: 1.0273, test_f1: 0.5588
 epoch: 44, train_loss: 0.8626, test_loss: 1.0320, test_f1: 0.5610
 epoch: 45, train_loss: 0.8535, test_loss: 1.0200, test_f1: 0.5551
 epoch: 46, train_loss: 0.8509, test_loss: 1.0081, test_f1: 0.5512
 epoch: 47, train_loss: 0.8337, test_loss: 1.0196, test_f1: 0.5374
 epoch: 48, train_loss: 0.8363, test_loss: 1.0248, test_f1: 0.5270
 epoch: 49, train_loss: 0.8279, test_loss: 1.0281, test_f1: 0.5419
 epoch: 50, train_loss: 0.8238, test_loss: 1.0326, test_f1: 0.5471
 epoch: 51, train_loss: 0.8182, test_loss: 1.0209, test_f1: 0.5461
 epoch: 52, train_loss: 0.8157, test_loss: 1.0238, test_f1: 0.5608
 epoch: 53, train_loss: 0.8092, test_loss: 1.0206, test_f1: 0.5570
 epoch: 54, train_loss: 0.8050, test_loss: 1.0226, test_f1: 0.5620
 epoch: 55, train_loss: 0.8056, test_loss: 1.0242, test_f1: 0.5573
 epoch: 56, train_loss: 0.8017, test_loss: 1.0212, test_f1: 0.5546
 epoch: 57, train_loss: 0.8003, test_loss: 1.0258, test_f1: 0.5524
 epoch: 58, train_loss: 0.8015, test_loss: 1.0324, test_f1: 0.5579
 epoch: 59, train_loss: 0.7946, test_loss: 1.0253, test_f1: 0.5547
 epoch: 60, train_loss: 0.7982, test_loss: 1.0215, test_f1: 0.5570
 epoch: 61, train_loss: 0.7952, test_loss: 1.0308, test_f1: 0.5503
 epoch: 62, train_loss: 0.7896, test_loss: 1.0343, test_f1: 0.5535
 epoch: 63, train_loss: 0.7908, test_loss: 1.0353, test_f1: 0.5456
 epoch: 64, train_loss: 0.7807, test_loss: 1.0325, test_f1: 0.5465
 epoch: 65, train_loss: 0.7871, test_loss: 1.0256, test_f1: 0.5519
 epoch: 66, train_loss: 0.7792, test_loss: 1.0196, test_f1: 0.5576
 epoch: 67, train_loss: 0.7785, test_loss: 1.0227, test_f1: 0.5530
 epoch: 68, train_loss: 0.7766, test_loss: 1.0291, test_f1: 0.5423
 epoch: 69, train_loss: 0.7747, test_loss: 1.0268, test_f1: 0.5511
 epoch: 70, train_loss: 0.7669, test_loss: 1.0352, test_f1: 0.5463
 epoch: 71, train_loss: 0.7659, test_loss: 1.0404, test_f1: 0.5469
 epoch: 72, train_loss: 0.7604, test_loss: 1.0314, test_f1: 0.5461
 epoch: 73, train_loss: 0.7638, test_loss: 1.0290, test_f1: 0.5591
 epoch: 74, train_loss: 0.7610, test_loss: 1.0376, test_f1: 0.5667
 epoch: 75, train_loss: 0.7667, test_loss: 1.0262, test_f1: 0.5664
 epoch: 76, train_loss: 0.7571, test_loss: 1.0145, test_f1: 0.5559
 epoch: 77, train_loss: 0.7532, test_loss: 1.0272, test_f1: 0.5419
 epoch: 78, train_loss: 0.7485, test_loss: 1.0338, test_f1: 0.5667
 epoch: 79, train_loss: 0.7429, test_loss: 1.0313, test_f1: 0.5607
 epoch: 80, train_loss: 0.7441, test_loss: 1.0161, test_f1: 0.5559
 epoch: 81, train_loss: 0.7385, test_loss: 1.0331, test_f1: 0.5600
 epoch: 82, train_loss: 0.7443, test_loss: 1.0361, test_f1: 0.5617
 epoch: 83, train_loss: 0.7413, test_loss: 1.0214, test_f1: 0.5611
 epoch: 84, train_loss: 0.7358, test_loss: 1.0317, test_f1: 0.5637
 epoch: 85, train_loss: 0.7317, test_loss: 1.0385, test_f1: 0.5611
 epoch: 86, train_loss: 0.7324, test_loss: 1.0265, test_f1: 0.5654
 epoch: 87, train_loss: 0.7208, test_loss: 1.0385, test_f1: 0.5766
 epoch: 88, train_loss: 0.7177, test_loss: 1.0380, test_f1: 0.5732
 epoch: 89, train_loss: 0.7219, test_loss: 1.0364, test_f1: 0.5764
 epoch: 90, train_loss: 0.7119, test_loss: 1.0359, test_f1: 0.5514
 epoch: 91, train_loss: 0.7103, test_loss: 1.0289, test_f1: 0.5647
 epoch: 92, train_loss: 0.7075, test_loss: 1.0349, test_f1: 0.5675
 epoch: 93, train_loss: 0.7087, test_loss: 1.0560, test_f1: 0.5695
 epoch: 94, train_loss: 0.7078, test_loss: 1.0544, test_f1: 0.5646
 epoch: 95, train_loss: 0.7053, test_loss: 1.0531, test_f1: 0.5608
 epoch: 96, train_loss: 0.6988, test_loss: 1.0625, test_f1: 0.5612
 epoch: 97, train_loss: 0.6974, test_loss: 1.0668, test_f1: 0.5645
 epoch: 98, train_loss: 0.7088, test_loss: 1.0726, test_f1: 0.5744
 epoch: 99, train_loss: 0.6927, test_loss: 1.0725, test_f1: 0.5692
##################ITERATION #5 ****************************************
 epoch: 0, train_loss: 1.2816, test_loss: 1.3650, test_f1: 0.1365
 epoch: 1, train_loss: 1.1801, test_loss: 1.3446, test_f1: 0.1365
 epoch: 2, train_loss: 1.1460, test_loss: 1.3205, test_f1: 0.1365
 epoch: 3, train_loss: 1.1136, test_loss: 1.3062, test_f1: 0.1365
 epoch: 4, train_loss: 1.0888, test_loss: 1.2954, test_f1: 0.1365
 epoch: 5, train_loss: 1.0702, test_loss: 1.2785, test_f1: 0.1411
 epoch: 6, train_loss: 1.0488, test_loss: 1.2521, test_f1: 0.1684
 epoch: 7, train_loss: 1.0444, test_loss: 1.2195, test_f1: 0.2875
 epoch: 8, train_loss: 1.0272, test_loss: 1.1818, test_f1: 0.3659
 epoch: 9, train_loss: 1.0183, test_loss: 1.1465, test_f1: 0.4543
 epoch: 10, train_loss: 1.0030, test_loss: 1.1172, test_f1: 0.4880
 epoch: 11, train_loss: 0.9958, test_loss: 1.0980, test_f1: 0.4661
 epoch: 12, train_loss: 0.9888, test_loss: 1.0885, test_f1: 0.4599
 epoch: 13, train_loss: 0.9799, test_loss: 1.0766, test_f1: 0.4888
 epoch: 14, train_loss: 0.9767, test_loss: 1.0674, test_f1: 0.5167
 epoch: 15, train_loss: 0.9706, test_loss: 1.0618, test_f1: 0.5232
 epoch: 16, train_loss: 0.9618, test_loss: 1.0572, test_f1: 0.5343
 epoch: 17, train_loss: 0.9522, test_loss: 1.0538, test_f1: 0.5405
 epoch: 18, train_loss: 0.9504, test_loss: 1.0470, test_f1: 0.5421
 epoch: 19, train_loss: 0.9504, test_loss: 1.0429, test_f1: 0.5590
 epoch: 20, train_loss: 0.9413, test_loss: 1.0436, test_f1: 0.5635
 epoch: 21, train_loss: 0.9383, test_loss: 1.0394, test_f1: 0.5491
 epoch: 22, train_loss: 0.9292, test_loss: 1.0394, test_f1: 0.5524
 epoch: 23, train_loss: 0.9259, test_loss: 1.0395, test_f1: 0.5527
 epoch: 24, train_loss: 0.9208, test_loss: 1.0359, test_f1: 0.5473
 epoch: 25, train_loss: 0.9254, test_loss: 1.0329, test_f1: 0.5485
 epoch: 26, train_loss: 0.9068, test_loss: 1.0326, test_f1: 0.5577
 epoch: 27, train_loss: 0.9154, test_loss: 1.0254, test_f1: 0.5595
 epoch: 28, train_loss: 0.9054, test_loss: 1.0220, test_f1: 0.5537
 epoch: 29, train_loss: 0.9010, test_loss: 1.0238, test_f1: 0.5582
 epoch: 30, train_loss: 0.8941, test_loss: 1.0259, test_f1: 0.5590
 epoch: 31, train_loss: 0.8974, test_loss: 1.0222, test_f1: 0.5570
 epoch: 32, train_loss: 0.8845, test_loss: 1.0171, test_f1: 0.5481
 epoch: 33, train_loss: 0.8847, test_loss: 1.0153, test_f1: 0.5315
 epoch: 34, train_loss: 0.8828, test_loss: 1.0187, test_f1: 0.5284
 epoch: 35, train_loss: 0.8734, test_loss: 1.0223, test_f1: 0.5241
 epoch: 36, train_loss: 0.8756, test_loss: 1.0204, test_f1: 0.5246
 epoch: 37, train_loss: 0.8615, test_loss: 1.0111, test_f1: 0.5222
 epoch: 38, train_loss: 0.8625, test_loss: 1.0088, test_f1: 0.5316
 epoch: 39, train_loss: 0.8587, test_loss: 1.0060, test_f1: 0.5629
 epoch: 40, train_loss: 0.8519, test_loss: 1.0098, test_f1: 0.5618
 epoch: 41, train_loss: 0.8520, test_loss: 1.0148, test_f1: 0.5692
 epoch: 42, train_loss: 0.8448, test_loss: 1.0129, test_f1: 0.5558
 epoch: 43, train_loss: 0.8482, test_loss: 1.0167, test_f1: 0.5721
 epoch: 44, train_loss: 0.8391, test_loss: 1.0140, test_f1: 0.5484
 epoch: 45, train_loss: 0.8351, test_loss: 1.0108, test_f1: 0.5272
 epoch: 46, train_loss: 0.8254, test_loss: 1.0107, test_f1: 0.5638
 epoch: 47, train_loss: 0.8320, test_loss: 1.0125, test_f1: 0.5630
 epoch: 48, train_loss: 0.8179, test_loss: 1.0130, test_f1: 0.5298
 epoch: 49, train_loss: 0.8157, test_loss: 1.0016, test_f1: 0.5493
 epoch: 50, train_loss: 0.8130, test_loss: 1.0014, test_f1: 0.5517
 epoch: 51, train_loss: 0.8145, test_loss: 1.0040, test_f1: 0.5477
 epoch: 52, train_loss: 0.8110, test_loss: 1.0062, test_f1: 0.5449
 epoch: 53, train_loss: 0.8060, test_loss: 1.0067, test_f1: 0.5399
 epoch: 54, train_loss: 0.7945, test_loss: 1.0017, test_f1: 0.5781
 epoch: 55, train_loss: 0.8057, test_loss: 1.0001, test_f1: 0.5739
 epoch: 56, train_loss: 0.7984, test_loss: 1.0010, test_f1: 0.5697
 epoch: 57, train_loss: 0.7946, test_loss: 0.9995, test_f1: 0.5693
 epoch: 58, train_loss: 0.7994, test_loss: 1.0049, test_f1: 0.5565
 epoch: 59, train_loss: 0.7902, test_loss: 1.0093, test_f1: 0.5351
 epoch: 60, train_loss: 0.7834, test_loss: 1.0066, test_f1: 0.5450
 epoch: 61, train_loss: 0.7829, test_loss: 1.0067, test_f1: 0.5468
 epoch: 62, train_loss: 0.7852, test_loss: 1.0071, test_f1: 0.5433
 epoch: 63, train_loss: 0.7898, test_loss: 1.0029, test_f1: 0.5469
 epoch: 64, train_loss: 0.7832, test_loss: 1.0063, test_f1: 0.5532
 epoch: 65, train_loss: 0.7751, test_loss: 1.0057, test_f1: 0.5486
 epoch: 66, train_loss: 0.7791, test_loss: 1.0084, test_f1: 0.5420
 epoch: 67, train_loss: 0.7858, test_loss: 1.0107, test_f1: 0.5430
 epoch: 68, train_loss: 0.7752, test_loss: 1.0078, test_f1: 0.5494
 epoch: 69, train_loss: 0.7645, test_loss: 1.0036, test_f1: 0.5579
 epoch: 70, train_loss: 0.7645, test_loss: 1.0066, test_f1: 0.5513
 epoch: 71, train_loss: 0.7612, test_loss: 1.0087, test_f1: 0.5570
 epoch: 72, train_loss: 0.7666, test_loss: 1.0108, test_f1: 0.5503
 epoch: 73, train_loss: 0.7649, test_loss: 1.0118, test_f1: 0.5496
 epoch: 74, train_loss: 0.7549, test_loss: 1.0098, test_f1: 0.5340
 epoch: 75, train_loss: 0.7554, test_loss: 1.0138, test_f1: 0.5438
 epoch: 76, train_loss: 0.7557, test_loss: 1.0191, test_f1: 0.5554
 epoch: 77, train_loss: 0.7497, test_loss: 1.0215, test_f1: 0.5523
 epoch: 78, train_loss: 0.7468, test_loss: 1.0231, test_f1: 0.5494
 epoch: 79, train_loss: 0.7514, test_loss: 1.0197, test_f1: 0.5503
 epoch: 80, train_loss: 0.7504, test_loss: 1.0156, test_f1: 0.5471
 epoch: 81, train_loss: 0.7372, test_loss: 1.0250, test_f1: 0.5347
 epoch: 82, train_loss: 0.7430, test_loss: 1.0297, test_f1: 0.5236
 epoch: 83, train_loss: 0.7383, test_loss: 1.0226, test_f1: 0.5377
 epoch: 84, train_loss: 0.7445, test_loss: 1.0181, test_f1: 0.5616
 epoch: 85, train_loss: 0.7364, test_loss: 1.0208, test_f1: 0.5606
 epoch: 86, train_loss: 0.7315, test_loss: 1.0241, test_f1: 0.5548
 epoch: 87, train_loss: 0.7337, test_loss: 1.0281, test_f1: 0.5581
 epoch: 88, train_loss: 0.7278, test_loss: 1.0263, test_f1: 0.5670
 epoch: 89, train_loss: 0.7258, test_loss: 1.0252, test_f1: 0.5388
 epoch: 90, train_loss: 0.7179, test_loss: 1.0226, test_f1: 0.5527
 epoch: 91, train_loss: 0.7281, test_loss: 1.0248, test_f1: 0.5626
 epoch: 92, train_loss: 0.7128, test_loss: 1.0259, test_f1: 0.5433
 epoch: 93, train_loss: 0.7201, test_loss: 1.0255, test_f1: 0.5563
 epoch: 94, train_loss: 0.7162, test_loss: 1.0306, test_f1: 0.5577
 epoch: 95, train_loss: 0.7182, test_loss: 1.0227, test_f1: 0.5543
 epoch: 96, train_loss: 0.7085, test_loss: 1.0271, test_f1: 0.5555
 epoch: 97, train_loss: 0.7129, test_loss: 1.0349, test_f1: 0.5449
 epoch: 98, train_loss: 0.7080, test_loss: 1.0342, test_f1: 0.5514
 epoch: 99, train_loss: 0.7039, test_loss: 1.0309, test_f1: 0.5643
##################ITERATION #6 ****************************************
 epoch: 0, train_loss: 1.2378, test_loss: 1.3367, test_f1: 0.2281
 epoch: 1, train_loss: 1.1630, test_loss: 1.3262, test_f1: 0.2281
 epoch: 2, train_loss: 1.1406, test_loss: 1.3177, test_f1: 0.2281
 epoch: 3, train_loss: 1.1124, test_loss: 1.3079, test_f1: 0.2281
 epoch: 4, train_loss: 1.0887, test_loss: 1.2897, test_f1: 0.2281
 epoch: 5, train_loss: 1.0762, test_loss: 1.2655, test_f1: 0.2586
 epoch: 6, train_loss: 1.0563, test_loss: 1.2333, test_f1: 0.3594
 epoch: 7, train_loss: 1.0394, test_loss: 1.1966, test_f1: 0.3854
 epoch: 8, train_loss: 1.0321, test_loss: 1.1614, test_f1: 0.3822
 epoch: 9, train_loss: 1.0147, test_loss: 1.1293, test_f1: 0.4023
 epoch: 10, train_loss: 1.0038, test_loss: 1.1028, test_f1: 0.4528
 epoch: 11, train_loss: 0.9943, test_loss: 1.0859, test_f1: 0.4540
 epoch: 12, train_loss: 0.9942, test_loss: 1.0749, test_f1: 0.4711
 epoch: 13, train_loss: 0.9807, test_loss: 1.0669, test_f1: 0.4877
 epoch: 14, train_loss: 0.9723, test_loss: 1.0630, test_f1: 0.4839
 epoch: 15, train_loss: 0.9637, test_loss: 1.0569, test_f1: 0.4888
 epoch: 16, train_loss: 0.9593, test_loss: 1.0500, test_f1: 0.4993
 epoch: 17, train_loss: 0.9552, test_loss: 1.0465, test_f1: 0.5102
 epoch: 18, train_loss: 0.9567, test_loss: 1.0412, test_f1: 0.5081
 epoch: 19, train_loss: 0.9433, test_loss: 1.0381, test_f1: 0.5085
 epoch: 20, train_loss: 0.9380, test_loss: 1.0379, test_f1: 0.5129
 epoch: 21, train_loss: 0.9386, test_loss: 1.0304, test_f1: 0.5095
 epoch: 22, train_loss: 0.9310, test_loss: 1.0269, test_f1: 0.5151
 epoch: 23, train_loss: 0.9227, test_loss: 1.0278, test_f1: 0.5335
 epoch: 24, train_loss: 0.9235, test_loss: 1.0286, test_f1: 0.5329
 epoch: 25, train_loss: 0.9093, test_loss: 1.0264, test_f1: 0.5296
 epoch: 26, train_loss: 0.9100, test_loss: 1.0245, test_f1: 0.5352
 epoch: 27, train_loss: 0.8970, test_loss: 1.0184, test_f1: 0.5392
 epoch: 28, train_loss: 0.8921, test_loss: 1.0168, test_f1: 0.5362
 epoch: 29, train_loss: 0.8885, test_loss: 1.0246, test_f1: 0.5423
 epoch: 30, train_loss: 0.8846, test_loss: 1.0249, test_f1: 0.5407
 epoch: 31, train_loss: 0.8832, test_loss: 1.0129, test_f1: 0.5498
 epoch: 32, train_loss: 0.8858, test_loss: 1.0071, test_f1: 0.5579
 epoch: 33, train_loss: 0.8765, test_loss: 1.0031, test_f1: 0.5480
 epoch: 34, train_loss: 0.8690, test_loss: 1.0075, test_f1: 0.5472
 epoch: 35, train_loss: 0.8774, test_loss: 1.0032, test_f1: 0.5544
 epoch: 36, train_loss: 0.8579, test_loss: 1.0037, test_f1: 0.5488
 epoch: 37, train_loss: 0.8590, test_loss: 1.0053, test_f1: 0.5472
 epoch: 38, train_loss: 0.8540, test_loss: 1.0054, test_f1: 0.5483
 epoch: 39, train_loss: 0.8467, test_loss: 1.0008, test_f1: 0.5697
 epoch: 40, train_loss: 0.8473, test_loss: 0.9955, test_f1: 0.5585
 epoch: 41, train_loss: 0.8405, test_loss: 1.0014, test_f1: 0.5626
 epoch: 42, train_loss: 0.8384, test_loss: 1.0003, test_f1: 0.5621
 epoch: 43, train_loss: 0.8344, test_loss: 0.9978, test_f1: 0.5602
 epoch: 44, train_loss: 0.8184, test_loss: 0.9971, test_f1: 0.5396
 epoch: 45, train_loss: 0.8160, test_loss: 0.9953, test_f1: 0.5603
 epoch: 46, train_loss: 0.8166, test_loss: 0.9990, test_f1: 0.5566
 epoch: 47, train_loss: 0.8176, test_loss: 0.9882, test_f1: 0.5482
 epoch: 48, train_loss: 0.8072, test_loss: 0.9885, test_f1: 0.5558
 epoch: 49, train_loss: 0.8021, test_loss: 0.9930, test_f1: 0.5347
 epoch: 50, train_loss: 0.7957, test_loss: 0.9874, test_f1: 0.5452
 epoch: 51, train_loss: 0.8024, test_loss: 0.9926, test_f1: 0.5497
 epoch: 52, train_loss: 0.7941, test_loss: 0.9937, test_f1: 0.5487
 epoch: 53, train_loss: 0.7818, test_loss: 0.9934, test_f1: 0.5454
 epoch: 54, train_loss: 0.7735, test_loss: 0.9894, test_f1: 0.5423
 epoch: 55, train_loss: 0.7872, test_loss: 0.9884, test_f1: 0.5424
 epoch: 56, train_loss: 0.7813, test_loss: 0.9862, test_f1: 0.5466
 epoch: 57, train_loss: 0.7827, test_loss: 0.9892, test_f1: 0.5415
 epoch: 58, train_loss: 0.7758, test_loss: 0.9953, test_f1: 0.5529
 epoch: 59, train_loss: 0.7695, test_loss: 0.9983, test_f1: 0.5481
 epoch: 60, train_loss: 0.7732, test_loss: 0.9958, test_f1: 0.5403
 epoch: 61, train_loss: 0.7749, test_loss: 0.9964, test_f1: 0.5567
 epoch: 62, train_loss: 0.7640, test_loss: 0.9967, test_f1: 0.5473
 epoch: 63, train_loss: 0.7678, test_loss: 0.9969, test_f1: 0.5492
 epoch: 64, train_loss: 0.7585, test_loss: 0.9998, test_f1: 0.5352
 epoch: 65, train_loss: 0.7501, test_loss: 1.0002, test_f1: 0.5599
 epoch: 66, train_loss: 0.7606, test_loss: 1.0044, test_f1: 0.5624
 epoch: 67, train_loss: 0.7561, test_loss: 1.0070, test_f1: 0.5513
 epoch: 68, train_loss: 0.7592, test_loss: 1.0032, test_f1: 0.5405
 epoch: 69, train_loss: 0.7435, test_loss: 1.0061, test_f1: 0.5654
 epoch: 70, train_loss: 0.7558, test_loss: 1.0046, test_f1: 0.5596
 epoch: 71, train_loss: 0.7447, test_loss: 1.0030, test_f1: 0.5680
 epoch: 72, train_loss: 0.7365, test_loss: 1.0007, test_f1: 0.5688
 epoch: 73, train_loss: 0.7382, test_loss: 1.0048, test_f1: 0.5634
 epoch: 74, train_loss: 0.7408, test_loss: 1.0017, test_f1: 0.5601
 epoch: 75, train_loss: 0.7371, test_loss: 0.9980, test_f1: 0.5596
 epoch: 76, train_loss: 0.7388, test_loss: 0.9959, test_f1: 0.5480
 epoch: 77, train_loss: 0.7292, test_loss: 0.9883, test_f1: 0.5585
 epoch: 78, train_loss: 0.7271, test_loss: 0.9996, test_f1: 0.5547
 epoch: 79, train_loss: 0.7353, test_loss: 1.0059, test_f1: 0.5473
 epoch: 80, train_loss: 0.7287, test_loss: 1.0070, test_f1: 0.5499
 epoch: 81, train_loss: 0.7191, test_loss: 0.9969, test_f1: 0.5459
 epoch: 82, train_loss: 0.7137, test_loss: 0.9989, test_f1: 0.5468
 epoch: 83, train_loss: 0.7084, test_loss: 1.0030, test_f1: 0.5459
 epoch: 84, train_loss: 0.7191, test_loss: 1.0053, test_f1: 0.5585
 epoch: 85, train_loss: 0.7055, test_loss: 0.9941, test_f1: 0.5570
 epoch: 86, train_loss: 0.7053, test_loss: 0.9937, test_f1: 0.5515
 epoch: 87, train_loss: 0.7100, test_loss: 0.9954, test_f1: 0.5680
 epoch: 88, train_loss: 0.7128, test_loss: 0.9933, test_f1: 0.5742
 epoch: 89, train_loss: 0.7043, test_loss: 0.9929, test_f1: 0.5752
 epoch: 90, train_loss: 0.7036, test_loss: 0.9940, test_f1: 0.5688
 epoch: 91, train_loss: 0.7037, test_loss: 0.9991, test_f1: 0.5549
 epoch: 92, train_loss: 0.6948, test_loss: 1.0099, test_f1: 0.5438
 epoch: 93, train_loss: 0.6982, test_loss: 1.0164, test_f1: 0.5469
 epoch: 94, train_loss: 0.6858, test_loss: 1.0204, test_f1: 0.5546
 epoch: 95, train_loss: 0.7018, test_loss: 1.0096, test_f1: 0.5633
 epoch: 96, train_loss: 0.6960, test_loss: 1.0130, test_f1: 0.5520
 epoch: 97, train_loss: 0.6922, test_loss: 1.0108, test_f1: 0.5807
 epoch: 98, train_loss: 0.6854, test_loss: 1.0173, test_f1: 0.5620
 epoch: 99, train_loss: 0.6741, test_loss: 1.0161, test_f1: 0.5584
##################ITERATION #7 ****************************************
 epoch: 0, train_loss: 1.2290, test_loss: 1.3242, test_f1: 0.2281
 epoch: 1, train_loss: 1.1305, test_loss: 1.3056, test_f1: 0.2281
 epoch: 2, train_loss: 1.1005, test_loss: 1.2969, test_f1: 0.2281
 epoch: 3, train_loss: 1.0787, test_loss: 1.3045, test_f1: 0.2281
 epoch: 4, train_loss: 1.0614, test_loss: 1.3116, test_f1: 0.2281
 epoch: 5, train_loss: 1.0399, test_loss: 1.3028, test_f1: 0.2721
 epoch: 6, train_loss: 1.0297, test_loss: 1.2664, test_f1: 0.3321
 epoch: 7, train_loss: 1.0117, test_loss: 1.2167, test_f1: 0.3594
 epoch: 8, train_loss: 1.0061, test_loss: 1.1797, test_f1: 0.4173
 epoch: 9, train_loss: 0.9981, test_loss: 1.1479, test_f1: 0.4316
 epoch: 10, train_loss: 0.9844, test_loss: 1.1224, test_f1: 0.4665
 epoch: 11, train_loss: 0.9814, test_loss: 1.1024, test_f1: 0.4703
 epoch: 12, train_loss: 0.9715, test_loss: 1.0845, test_f1: 0.4969
 epoch: 13, train_loss: 0.9631, test_loss: 1.0735, test_f1: 0.5122
 epoch: 14, train_loss: 0.9581, test_loss: 1.0664, test_f1: 0.5179
 epoch: 15, train_loss: 0.9549, test_loss: 1.0639, test_f1: 0.5147
 epoch: 16, train_loss: 0.9474, test_loss: 1.0553, test_f1: 0.5250
 epoch: 17, train_loss: 0.9346, test_loss: 1.0520, test_f1: 0.5218
 epoch: 18, train_loss: 0.9397, test_loss: 1.0564, test_f1: 0.5193
 epoch: 19, train_loss: 0.9306, test_loss: 1.0502, test_f1: 0.5209
 epoch: 20, train_loss: 0.9254, test_loss: 1.0438, test_f1: 0.5248
 epoch: 21, train_loss: 0.9188, test_loss: 1.0353, test_f1: 0.5287
 epoch: 22, train_loss: 0.9138, test_loss: 1.0311, test_f1: 0.5330
 epoch: 23, train_loss: 0.9046, test_loss: 1.0291, test_f1: 0.5305
 epoch: 24, train_loss: 0.8981, test_loss: 1.0363, test_f1: 0.5320
 epoch: 25, train_loss: 0.8929, test_loss: 1.0367, test_f1: 0.5408
 epoch: 26, train_loss: 0.8937, test_loss: 1.0312, test_f1: 0.5403
 epoch: 27, train_loss: 0.8915, test_loss: 1.0222, test_f1: 0.5443
 epoch: 28, train_loss: 0.8826, test_loss: 1.0202, test_f1: 0.5397
 epoch: 29, train_loss: 0.8728, test_loss: 1.0206, test_f1: 0.5361
 epoch: 30, train_loss: 0.8848, test_loss: 1.0254, test_f1: 0.5213
 epoch: 31, train_loss: 0.8674, test_loss: 1.0175, test_f1: 0.5250
 epoch: 32, train_loss: 0.8646, test_loss: 1.0107, test_f1: 0.5434
 epoch: 33, train_loss: 0.8573, test_loss: 1.0081, test_f1: 0.5441
 epoch: 34, train_loss: 0.8564, test_loss: 1.0101, test_f1: 0.5356
 epoch: 35, train_loss: 0.8536, test_loss: 1.0126, test_f1: 0.5382
 epoch: 36, train_loss: 0.8543, test_loss: 1.0098, test_f1: 0.5408
 epoch: 37, train_loss: 0.8397, test_loss: 1.0063, test_f1: 0.5377
 epoch: 38, train_loss: 0.8410, test_loss: 1.0132, test_f1: 0.5416
 epoch: 39, train_loss: 0.8274, test_loss: 1.0217, test_f1: 0.5487
 epoch: 40, train_loss: 0.8326, test_loss: 1.0154, test_f1: 0.5579
 epoch: 41, train_loss: 0.8238, test_loss: 1.0019, test_f1: 0.5485
 epoch: 42, train_loss: 0.8254, test_loss: 1.0100, test_f1: 0.5461
 epoch: 43, train_loss: 0.8055, test_loss: 1.0131, test_f1: 0.5468
 epoch: 44, train_loss: 0.8068, test_loss: 1.0045, test_f1: 0.5539
 epoch: 45, train_loss: 0.8033, test_loss: 1.0094, test_f1: 0.5326
 epoch: 46, train_loss: 0.8027, test_loss: 1.0149, test_f1: 0.5421
 epoch: 47, train_loss: 0.8049, test_loss: 1.0056, test_f1: 0.5669
 epoch: 48, train_loss: 0.7976, test_loss: 0.9996, test_f1: 0.5662
 epoch: 49, train_loss: 0.7934, test_loss: 1.0190, test_f1: 0.5586
 epoch: 50, train_loss: 0.7783, test_loss: 1.0174, test_f1: 0.5446
 epoch: 51, train_loss: 0.7794, test_loss: 1.0084, test_f1: 0.5479
 epoch: 52, train_loss: 0.7690, test_loss: 1.0033, test_f1: 0.5504
 epoch: 53, train_loss: 0.7696, test_loss: 0.9963, test_f1: 0.5619
 epoch: 54, train_loss: 0.7693, test_loss: 1.0044, test_f1: 0.5509
 epoch: 55, train_loss: 0.7653, test_loss: 1.0099, test_f1: 0.5533
 epoch: 56, train_loss: 0.7590, test_loss: 1.0012, test_f1: 0.5531
 epoch: 57, train_loss: 0.7675, test_loss: 0.9967, test_f1: 0.5559
 epoch: 58, train_loss: 0.7621, test_loss: 1.0021, test_f1: 0.5383
 epoch: 59, train_loss: 0.7539, test_loss: 1.0020, test_f1: 0.5375
 epoch: 60, train_loss: 0.7524, test_loss: 1.0065, test_f1: 0.5464
 epoch: 61, train_loss: 0.7546, test_loss: 1.0023, test_f1: 0.5509
 epoch: 62, train_loss: 0.7406, test_loss: 1.0060, test_f1: 0.5353
 epoch: 63, train_loss: 0.7502, test_loss: 1.0065, test_f1: 0.5513
 epoch: 64, train_loss: 0.7324, test_loss: 1.0263, test_f1: 0.5513
 epoch: 65, train_loss: 0.7409, test_loss: 1.0075, test_f1: 0.5495
 epoch: 66, train_loss: 0.7382, test_loss: 1.0084, test_f1: 0.5440
 epoch: 67, train_loss: 0.7327, test_loss: 1.0066, test_f1: 0.5551
 epoch: 68, train_loss: 0.7296, test_loss: 1.0116, test_f1: 0.5517
 epoch: 69, train_loss: 0.7407, test_loss: 1.0094, test_f1: 0.5517
 epoch: 70, train_loss: 0.7264, test_loss: 1.0070, test_f1: 0.5618
 epoch: 71, train_loss: 0.7167, test_loss: 1.0052, test_f1: 0.5655
 epoch: 72, train_loss: 0.7265, test_loss: 1.0190, test_f1: 0.5668
 epoch: 73, train_loss: 0.7185, test_loss: 1.0166, test_f1: 0.5575
 epoch: 74, train_loss: 0.7231, test_loss: 1.0092, test_f1: 0.5631
 epoch: 75, train_loss: 0.7162, test_loss: 1.0147, test_f1: 0.5682
 epoch: 76, train_loss: 0.7185, test_loss: 1.0176, test_f1: 0.5671
 epoch: 77, train_loss: 0.7100, test_loss: 1.0168, test_f1: 0.5691
 epoch: 78, train_loss: 0.7086, test_loss: 1.0120, test_f1: 0.5800
 epoch: 79, train_loss: 0.7081, test_loss: 1.0104, test_f1: 0.5707
 epoch: 80, train_loss: 0.7048, test_loss: 1.0077, test_f1: 0.5541
 epoch: 81, train_loss: 0.6964, test_loss: 1.0067, test_f1: 0.5540
 epoch: 82, train_loss: 0.6973, test_loss: 1.0095, test_f1: 0.5681
 epoch: 83, train_loss: 0.6922, test_loss: 1.0157, test_f1: 0.5739
 epoch: 84, train_loss: 0.7061, test_loss: 1.0192, test_f1: 0.5722
 epoch: 85, train_loss: 0.6870, test_loss: 1.0110, test_f1: 0.5722
 epoch: 86, train_loss: 0.6917, test_loss: 1.0027, test_f1: 0.5821
 epoch: 87, train_loss: 0.6866, test_loss: 1.0188, test_f1: 0.5572
 epoch: 88, train_loss: 0.6735, test_loss: 1.0270, test_f1: 0.5550
 epoch: 89, train_loss: 0.6886, test_loss: 1.0249, test_f1: 0.5576
 epoch: 90, train_loss: 0.6737, test_loss: 1.0301, test_f1: 0.5704
 epoch: 91, train_loss: 0.6799, test_loss: 1.0218, test_f1: 0.5538
 epoch: 92, train_loss: 0.6724, test_loss: 1.0294, test_f1: 0.5432
 epoch: 93, train_loss: 0.6679, test_loss: 1.0306, test_f1: 0.5497
 epoch: 94, train_loss: 0.6736, test_loss: 1.0281, test_f1: 0.5643
 epoch: 95, train_loss: 0.6725, test_loss: 1.0238, test_f1: 0.5557
 epoch: 96, train_loss: 0.6672, test_loss: 1.0280, test_f1: 0.5667
 epoch: 97, train_loss: 0.6615, test_loss: 1.0272, test_f1: 0.5589
 epoch: 98, train_loss: 0.6574, test_loss: 1.0281, test_f1: 0.5569
 epoch: 99, train_loss: 0.6584, test_loss: 1.0464, test_f1: 0.5538
##################ITERATION #8 ****************************************
 epoch: 0, train_loss: 1.2341, test_loss: 1.3087, test_f1: 0.1365
 epoch: 1, train_loss: 1.1388, test_loss: 1.2982, test_f1: 0.3232
 epoch: 2, train_loss: 1.1024, test_loss: 1.2847, test_f1: 0.3012
 epoch: 3, train_loss: 1.0820, test_loss: 1.2664, test_f1: 0.3234
 epoch: 4, train_loss: 1.0568, test_loss: 1.2376, test_f1: 0.3232
 epoch: 5, train_loss: 1.0382, test_loss: 1.2020, test_f1: 0.3870
 epoch: 6, train_loss: 1.0274, test_loss: 1.1685, test_f1: 0.4467
 epoch: 7, train_loss: 1.0105, test_loss: 1.1387, test_f1: 0.4444
 epoch: 8, train_loss: 0.9991, test_loss: 1.1121, test_f1: 0.4747
 epoch: 9, train_loss: 0.9906, test_loss: 1.0874, test_f1: 0.4778
 epoch: 10, train_loss: 0.9891, test_loss: 1.0727, test_f1: 0.4904
 epoch: 11, train_loss: 0.9652, test_loss: 1.0594, test_f1: 0.5030
 epoch: 12, train_loss: 0.9598, test_loss: 1.0515, test_f1: 0.5069
 epoch: 13, train_loss: 0.9536, test_loss: 1.0454, test_f1: 0.5019
 epoch: 14, train_loss: 0.9451, test_loss: 1.0400, test_f1: 0.4917
 epoch: 15, train_loss: 0.9403, test_loss: 1.0271, test_f1: 0.4999
 epoch: 16, train_loss: 0.9377, test_loss: 1.0214, test_f1: 0.5078
 epoch: 17, train_loss: 0.9317, test_loss: 1.0247, test_f1: 0.5362
 epoch: 18, train_loss: 0.9340, test_loss: 1.0184, test_f1: 0.5396
 epoch: 19, train_loss: 0.9179, test_loss: 1.0141, test_f1: 0.5380
 epoch: 20, train_loss: 0.9056, test_loss: 1.0135, test_f1: 0.5318
 epoch: 21, train_loss: 0.9070, test_loss: 1.0117, test_f1: 0.5404
 epoch: 22, train_loss: 0.9010, test_loss: 1.0146, test_f1: 0.5435
 epoch: 23, train_loss: 0.8911, test_loss: 1.0129, test_f1: 0.5314
 epoch: 24, train_loss: 0.8939, test_loss: 1.0069, test_f1: 0.5388
 epoch: 25, train_loss: 0.8922, test_loss: 1.0037, test_f1: 0.5290
 epoch: 26, train_loss: 0.8868, test_loss: 1.0041, test_f1: 0.5269
 epoch: 27, train_loss: 0.8896, test_loss: 1.0051, test_f1: 0.5289
 epoch: 28, train_loss: 0.8723, test_loss: 1.0057, test_f1: 0.5263
 epoch: 29, train_loss: 0.8649, test_loss: 1.0067, test_f1: 0.5265
 epoch: 30, train_loss: 0.8645, test_loss: 1.0009, test_f1: 0.5186
 epoch: 31, train_loss: 0.8532, test_loss: 0.9985, test_f1: 0.5298
 epoch: 32, train_loss: 0.8497, test_loss: 0.9963, test_f1: 0.5283
 epoch: 33, train_loss: 0.8572, test_loss: 0.9970, test_f1: 0.5411
 epoch: 34, train_loss: 0.8478, test_loss: 0.9934, test_f1: 0.5390
 epoch: 35, train_loss: 0.8341, test_loss: 0.9923, test_f1: 0.5328
 epoch: 36, train_loss: 0.8358, test_loss: 0.9874, test_f1: 0.5529
 epoch: 37, train_loss: 0.8302, test_loss: 0.9909, test_f1: 0.5416
 epoch: 38, train_loss: 0.8335, test_loss: 0.9884, test_f1: 0.5495
 epoch: 39, train_loss: 0.8312, test_loss: 0.9944, test_f1: 0.5402
 epoch: 40, train_loss: 0.8112, test_loss: 0.9997, test_f1: 0.5371
 epoch: 41, train_loss: 0.8168, test_loss: 1.0017, test_f1: 0.5323
 epoch: 42, train_loss: 0.8131, test_loss: 0.9982, test_f1: 0.5317
 epoch: 43, train_loss: 0.8060, test_loss: 0.9893, test_f1: 0.5457
 epoch: 44, train_loss: 0.8057, test_loss: 0.9924, test_f1: 0.5396
 epoch: 45, train_loss: 0.7945, test_loss: 0.9957, test_f1: 0.5387
 epoch: 46, train_loss: 0.7929, test_loss: 0.9867, test_f1: 0.5446
 epoch: 47, train_loss: 0.7897, test_loss: 0.9826, test_f1: 0.5589
 epoch: 48, train_loss: 0.7757, test_loss: 0.9844, test_f1: 0.5588
 epoch: 49, train_loss: 0.7775, test_loss: 0.9984, test_f1: 0.5387
 epoch: 50, train_loss: 0.7795, test_loss: 1.0079, test_f1: 0.5438
 epoch: 51, train_loss: 0.7704, test_loss: 0.9964, test_f1: 0.5517
 epoch: 52, train_loss: 0.7695, test_loss: 0.9852, test_f1: 0.5411
 epoch: 53, train_loss: 0.7658, test_loss: 0.9808, test_f1: 0.5469
 epoch: 54, train_loss: 0.7598, test_loss: 0.9823, test_f1: 0.5535
 epoch: 55, train_loss: 0.7550, test_loss: 0.9840, test_f1: 0.5582
 epoch: 56, train_loss: 0.7460, test_loss: 0.9918, test_f1: 0.5594
 epoch: 57, train_loss: 0.7546, test_loss: 0.9925, test_f1: 0.5554
 epoch: 58, train_loss: 0.7433, test_loss: 0.9875, test_f1: 0.5580
 epoch: 59, train_loss: 0.7376, test_loss: 0.9873, test_f1: 0.5613
 epoch: 60, train_loss: 0.7384, test_loss: 0.9869, test_f1: 0.5569
 epoch: 61, train_loss: 0.7465, test_loss: 0.9841, test_f1: 0.5629
 epoch: 62, train_loss: 0.7389, test_loss: 0.9814, test_f1: 0.5580
 epoch: 63, train_loss: 0.7279, test_loss: 0.9849, test_f1: 0.5611
 epoch: 64, train_loss: 0.7268, test_loss: 0.9927, test_f1: 0.5607
 epoch: 65, train_loss: 0.7263, test_loss: 0.9850, test_f1: 0.5627
 epoch: 66, train_loss: 0.7329, test_loss: 0.9821, test_f1: 0.5679
 epoch: 67, train_loss: 0.7228, test_loss: 0.9873, test_f1: 0.5667
 epoch: 68, train_loss: 0.7224, test_loss: 0.9870, test_f1: 0.5737
 epoch: 69, train_loss: 0.7299, test_loss: 0.9838, test_f1: 0.5710
 epoch: 70, train_loss: 0.7225, test_loss: 0.9888, test_f1: 0.5716
 epoch: 71, train_loss: 0.7211, test_loss: 0.9964, test_f1: 0.5653
 epoch: 72, train_loss: 0.7125, test_loss: 0.9930, test_f1: 0.5644
 epoch: 73, train_loss: 0.7050, test_loss: 0.9875, test_f1: 0.5731
 epoch: 74, train_loss: 0.7072, test_loss: 0.9940, test_f1: 0.5670
 epoch: 75, train_loss: 0.7124, test_loss: 0.9886, test_f1: 0.5674
 epoch: 76, train_loss: 0.7117, test_loss: 0.9867, test_f1: 0.5630
 epoch: 77, train_loss: 0.7087, test_loss: 0.9865, test_f1: 0.5752
 epoch: 78, train_loss: 0.7078, test_loss: 0.9993, test_f1: 0.5568
 epoch: 79, train_loss: 0.6939, test_loss: 0.9802, test_f1: 0.5818
 epoch: 80, train_loss: 0.7014, test_loss: 0.9824, test_f1: 0.5724
 epoch: 81, train_loss: 0.6911, test_loss: 0.9920, test_f1: 0.5692
 epoch: 82, train_loss: 0.6974, test_loss: 1.0073, test_f1: 0.5610
 epoch: 83, train_loss: 0.6935, test_loss: 0.9955, test_f1: 0.5787
 epoch: 84, train_loss: 0.6844, test_loss: 0.9923, test_f1: 0.5586
 epoch: 85, train_loss: 0.6802, test_loss: 0.9899, test_f1: 0.5683
 epoch: 86, train_loss: 0.6804, test_loss: 0.9905, test_f1: 0.5709
 epoch: 87, train_loss: 0.6776, test_loss: 0.9964, test_f1: 0.5694
 epoch: 88, train_loss: 0.6835, test_loss: 0.9981, test_f1: 0.5704
 epoch: 89, train_loss: 0.6784, test_loss: 1.0017, test_f1: 0.5699
 epoch: 90, train_loss: 0.6826, test_loss: 0.9954, test_f1: 0.5749
 epoch: 91, train_loss: 0.6758, test_loss: 0.9935, test_f1: 0.5889
 epoch: 92, train_loss: 0.6663, test_loss: 1.0008, test_f1: 0.5801
 epoch: 93, train_loss: 0.6617, test_loss: 1.0125, test_f1: 0.5733
 epoch: 94, train_loss: 0.6752, test_loss: 1.0023, test_f1: 0.5690
 epoch: 95, train_loss: 0.6711, test_loss: 1.0009, test_f1: 0.5685
 epoch: 96, train_loss: 0.6625, test_loss: 0.9952, test_f1: 0.5802
 epoch: 97, train_loss: 0.6560, test_loss: 0.9891, test_f1: 0.5802
 epoch: 98, train_loss: 0.6657, test_loss: 0.9993, test_f1: 0.5838
 epoch: 99, train_loss: 0.6452, test_loss: 1.0028, test_f1: 0.5766
##################ITERATION #9 ****************************************
 epoch: 0, train_loss: 1.2467, test_loss: 1.3121, test_f1: 0.2281
 epoch: 1, train_loss: 1.1077, test_loss: 1.2926, test_f1: 0.2281
 epoch: 2, train_loss: 1.0817, test_loss: 1.2828, test_f1: 0.2281
 epoch: 3, train_loss: 1.0496, test_loss: 1.2745, test_f1: 0.2281
 epoch: 4, train_loss: 1.0338, test_loss: 1.2610, test_f1: 0.2270
 epoch: 5, train_loss: 1.0139, test_loss: 1.2413, test_f1: 0.2806
 epoch: 6, train_loss: 0.9965, test_loss: 1.2112, test_f1: 0.3496
 epoch: 7, train_loss: 0.9868, test_loss: 1.1790, test_f1: 0.4351
 epoch: 8, train_loss: 0.9758, test_loss: 1.1387, test_f1: 0.4823
 epoch: 9, train_loss: 0.9634, test_loss: 1.1047, test_f1: 0.4829
 epoch: 10, train_loss: 0.9535, test_loss: 1.0721, test_f1: 0.4876
 epoch: 11, train_loss: 0.9486, test_loss: 1.0489, test_f1: 0.5031
 epoch: 12, train_loss: 0.9404, test_loss: 1.0419, test_f1: 0.5057
 epoch: 13, train_loss: 0.9364, test_loss: 1.0313, test_f1: 0.5194
 epoch: 14, train_loss: 0.9311, test_loss: 1.0279, test_f1: 0.5236
 epoch: 15, train_loss: 0.9158, test_loss: 1.0241, test_f1: 0.5247
 epoch: 16, train_loss: 0.9200, test_loss: 1.0251, test_f1: 0.5353
 epoch: 17, train_loss: 0.9199, test_loss: 1.0214, test_f1: 0.5346
 epoch: 18, train_loss: 0.9072, test_loss: 1.0143, test_f1: 0.5354
 epoch: 19, train_loss: 0.8993, test_loss: 1.0159, test_f1: 0.5239
 epoch: 20, train_loss: 0.8900, test_loss: 1.0110, test_f1: 0.5241
 epoch: 21, train_loss: 0.8839, test_loss: 1.0105, test_f1: 0.5387
 epoch: 22, train_loss: 0.8890, test_loss: 1.0066, test_f1: 0.5443
 epoch: 23, train_loss: 0.8881, test_loss: 1.0038, test_f1: 0.5494
 epoch: 24, train_loss: 0.8725, test_loss: 1.0111, test_f1: 0.5537
 epoch: 25, train_loss: 0.8694, test_loss: 1.0089, test_f1: 0.5641
 epoch: 26, train_loss: 0.8604, test_loss: 1.0132, test_f1: 0.5605
 epoch: 27, train_loss: 0.8566, test_loss: 1.0049, test_f1: 0.5664
 epoch: 28, train_loss: 0.8474, test_loss: 1.0040, test_f1: 0.5397
 epoch: 29, train_loss: 0.8495, test_loss: 0.9925, test_f1: 0.5412
 epoch: 30, train_loss: 0.8447, test_loss: 0.9891, test_f1: 0.5370
 epoch: 31, train_loss: 0.8444, test_loss: 0.9895, test_f1: 0.5420
 epoch: 32, train_loss: 0.8266, test_loss: 0.9931, test_f1: 0.5324
 epoch: 33, train_loss: 0.8337, test_loss: 0.9910, test_f1: 0.5474
 epoch: 34, train_loss: 0.8192, test_loss: 0.9849, test_f1: 0.5463
 epoch: 35, train_loss: 0.8158, test_loss: 0.9869, test_f1: 0.5329
 epoch: 36, train_loss: 0.7993, test_loss: 0.9945, test_f1: 0.5383
 epoch: 37, train_loss: 0.8060, test_loss: 0.9925, test_f1: 0.5431
 epoch: 38, train_loss: 0.8090, test_loss: 0.9968, test_f1: 0.5270
 epoch: 39, train_loss: 0.7955, test_loss: 1.0013, test_f1: 0.5293
 epoch: 40, train_loss: 0.7896, test_loss: 0.9855, test_f1: 0.5542
 epoch: 41, train_loss: 0.7896, test_loss: 0.9976, test_f1: 0.5563
 epoch: 42, train_loss: 0.7841, test_loss: 1.0127, test_f1: 0.5362
 epoch: 43, train_loss: 0.7877, test_loss: 1.0051, test_f1: 0.5424
 epoch: 44, train_loss: 0.7807, test_loss: 1.0019, test_f1: 0.5481
 epoch: 45, train_loss: 0.7684, test_loss: 0.9934, test_f1: 0.5506
 epoch: 46, train_loss: 0.7671, test_loss: 1.0042, test_f1: 0.5278
 epoch: 47, train_loss: 0.7692, test_loss: 1.0044, test_f1: 0.5309
 epoch: 48, train_loss: 0.7497, test_loss: 1.0189, test_f1: 0.5271
 epoch: 49, train_loss: 0.7508, test_loss: 1.0025, test_f1: 0.5513
 epoch: 50, train_loss: 0.7421, test_loss: 1.0104, test_f1: 0.5519
 epoch: 51, train_loss: 0.7393, test_loss: 1.0048, test_f1: 0.5586
 epoch: 52, train_loss: 0.7372, test_loss: 0.9999, test_f1: 0.5463
 epoch: 53, train_loss: 0.7378, test_loss: 1.0035, test_f1: 0.5359
 epoch: 54, train_loss: 0.7281, test_loss: 1.0040, test_f1: 0.5308
 epoch: 55, train_loss: 0.7300, test_loss: 1.0036, test_f1: 0.5391
 epoch: 56, train_loss: 0.7265, test_loss: 1.0099, test_f1: 0.5628
 epoch: 57, train_loss: 0.7221, test_loss: 1.0042, test_f1: 0.5550
 epoch: 58, train_loss: 0.7325, test_loss: 1.0115, test_f1: 0.5629
 epoch: 59, train_loss: 0.7184, test_loss: 1.0218, test_f1: 0.5622
 epoch: 60, train_loss: 0.7194, test_loss: 1.0169, test_f1: 0.5639
 epoch: 61, train_loss: 0.7155, test_loss: 1.0199, test_f1: 0.5459
 epoch: 62, train_loss: 0.7139, test_loss: 1.0140, test_f1: 0.5712
 epoch: 63, train_loss: 0.7124, test_loss: 1.0104, test_f1: 0.5477
 epoch: 64, train_loss: 0.7090, test_loss: 1.0105, test_f1: 0.5495
 epoch: 65, train_loss: 0.7065, test_loss: 1.0134, test_f1: 0.5588
 epoch: 66, train_loss: 0.7015, test_loss: 1.0102, test_f1: 0.5643
 epoch: 67, train_loss: 0.6908, test_loss: 1.0094, test_f1: 0.5695
 epoch: 68, train_loss: 0.6938, test_loss: 1.0087, test_f1: 0.5780
 epoch: 69, train_loss: 0.7034, test_loss: 1.0217, test_f1: 0.5843
 epoch: 70, train_loss: 0.6889, test_loss: 1.0050, test_f1: 0.5758
 epoch: 71, train_loss: 0.6915, test_loss: 1.0044, test_f1: 0.5732
 epoch: 72, train_loss: 0.6830, test_loss: 1.0257, test_f1: 0.5630
 epoch: 73, train_loss: 0.6839, test_loss: 1.0318, test_f1: 0.5484
 epoch: 74, train_loss: 0.6951, test_loss: 1.0142, test_f1: 0.5752
 epoch: 75, train_loss: 0.6880, test_loss: 1.0158, test_f1: 0.5619
 epoch: 76, train_loss: 0.6761, test_loss: 1.0141, test_f1: 0.5529
 epoch: 77, train_loss: 0.6673, test_loss: 1.0116, test_f1: 0.5717
 epoch: 78, train_loss: 0.6782, test_loss: 1.0358, test_f1: 0.5612
 epoch: 79, train_loss: 0.6666, test_loss: 1.0416, test_f1: 0.5709
 epoch: 80, train_loss: 0.6647, test_loss: 1.0261, test_f1: 0.5770
 epoch: 81, train_loss: 0.6622, test_loss: 1.0193, test_f1: 0.5762
 epoch: 82, train_loss: 0.6687, test_loss: 1.0217, test_f1: 0.5828
 epoch: 83, train_loss: 0.6613, test_loss: 1.0243, test_f1: 0.5873
 epoch: 84, train_loss: 0.6638, test_loss: 1.0372, test_f1: 0.5802
 epoch: 85, train_loss: 0.6656, test_loss: 1.0312, test_f1: 0.5721
 epoch: 86, train_loss: 0.6620, test_loss: 1.0124, test_f1: 0.5958
 epoch: 87, train_loss: 0.6582, test_loss: 1.0274, test_f1: 0.5928
 epoch: 88, train_loss: 0.6494, test_loss: 1.0302, test_f1: 0.5955
 epoch: 89, train_loss: 0.6517, test_loss: 1.0310, test_f1: 0.6030
 epoch: 90, train_loss: 0.6516, test_loss: 1.0317, test_f1: 0.5888
 epoch: 91, train_loss: 0.6589, test_loss: 1.0460, test_f1: 0.5646
 epoch: 92, train_loss: 0.6399, test_loss: 1.0394, test_f1: 0.5721
 epoch: 93, train_loss: 0.6453, test_loss: 1.0417, test_f1: 0.5894
 epoch: 94, train_loss: 0.6407, test_loss: 1.0381, test_f1: 0.5931
 epoch: 95, train_loss: 0.6343, test_loss: 1.0336, test_f1: 0.5843
 epoch: 96, train_loss: 0.6400, test_loss: 1.0675, test_f1: 0.5771
 epoch: 97, train_loss: 0.6313, test_loss: 1.0615, test_f1: 0.5662
 epoch: 98, train_loss: 0.6338, test_loss: 1.0429, test_f1: 0.5829
 epoch: 99, train_loss: 0.6232, test_loss: 1.0435, test_f1: 0.5876

Training completed in 341.22 seconds
Best F1: 0.6030 at epoch 89
Mean F1 across iterations: 0.5769  0.0123
========================FINAL RESULTS================================
FEGIN weighted F1: 0.6030  0.0123
python main.py --data ltspice_demos --representation component_pin_net --model FEGIN --layers 3 --hiddens 128 --batch_size 256 --lr 0.0001 --emb_size 128 --epochs 100 --save_appendix component_pin_net_L3_H128_BS256_LR0.0001_E128 --no_val
-----



STDERR:
  File "main.py", line 370, in <module>
    main()
  File "main.py", line 254, in main
    dataset = dataset_class(
  File "/home/philip/projects/ltspice_examples_code_repo/Circuit-Completion-Using-GNNs/component_classification_with_link_prediction_head/evaluation/FEGIN/kernel/circuit_datasets.py", line 15, in __init__
    self.data, self.slices = torch.load(self.processed_paths[0])
  File "/home/philip/.local/lib/python3.8/site-packages/torch/serialization.py", line 1040, in load
    warnings.warn(
  File "/usr/lib/python3.8/warnings.py", line 109, in _showwarnmsg
    sw(msg.message, msg.category, msg.filename, msg.lineno,
  File "main.py", line 47, in warn_with_traceback
    traceback.print_stack(file=log)
/home/philip/projects/ltspice_examples_code_repo/Circuit-Completion-Using-GNNs/component_classification_with_link_prediction_head/evaluation/FEGIN/kernel/circuit_datasets.py:15: FutureWarning: You are using `torch.load` with `weights_only=False` (the current default value), which uses the default pickle module implicitly. It is possible to construct malicious pickle data which will execute arbitrary code during unpickling (See https://github.com/pytorch/pytorch/blob/main/SECURITY.md#untrusted-models for more details). In a future release, the default value for `weights_only` will be flipped to `True`. This limits the functions that could be executed during unpickling. Arbitrary objects will no longer be allowed to be loaded via this mode unless they are explicitly allowlisted by the user via `torch.serialization.add_safe_globals`. We recommend you start setting `weights_only=True` for any use case where you don't have full control of the loaded file. Please open an issue on GitHub for any issues related to this experimental feature.
  self.data, self.slices = torch.load(self.processed_paths[0])
