STDOUT:
Results will be saved in /home/philip/projects/ltspice_examples_code_repo/Circuit-Completion-Using-GNNs/component_classification_with_link_prediction_head/evaluation/FEGIN/results/model_FEGIN_dataset_ltspice_examples
Command line input: python main.py --data ltspice_examples --representation component_net --model FEGIN --layers 3 --hiddens 64 --batch_size 128 --lr 0.01 --emb_size 250 --epochs 100 --save_appendix component_net_L3_H64_BS128_LR0.01_E250 --no_val
 is saved.
-----
ltspice_examples - FEGIN
Using 3 layers, 64 hidden units, h = 2
Loading component_net representation dataset
ENTERED
Training FEGIN on component_net representation
Train: 3558, Test: 846
##################ITERATION #0 ****************************************
 epoch: 0, train_loss: 1.2593, test_loss: 1.2639, test_f1: 0.2270
 epoch: 1, train_loss: 1.0819, test_loss: 1.0760, test_f1: 0.3545
 epoch: 2, train_loss: 1.0570, test_loss: 1.0755, test_f1: 0.4296
 epoch: 3, train_loss: 0.9975, test_loss: 1.0931, test_f1: 0.4245
 epoch: 4, train_loss: 0.9896, test_loss: 1.0285, test_f1: 0.3808
 epoch: 5, train_loss: 0.9768, test_loss: 1.0115, test_f1: 0.4756
 epoch: 6, train_loss: 0.9479, test_loss: 0.9628, test_f1: 0.4610
 epoch: 7, train_loss: 0.9384, test_loss: 1.0826, test_f1: 0.4288
 epoch: 8, train_loss: 0.9233, test_loss: 0.9971, test_f1: 0.5047
 epoch: 9, train_loss: 0.9101, test_loss: 0.9802, test_f1: 0.5448
 epoch: 10, train_loss: 0.8826, test_loss: 0.9217, test_f1: 0.5325
 epoch: 11, train_loss: 0.8628, test_loss: 1.0771, test_f1: 0.5117
 epoch: 12, train_loss: 0.8654, test_loss: 0.9160, test_f1: 0.5225
 epoch: 13, train_loss: 0.8583, test_loss: 0.9110, test_f1: 0.5601
 epoch: 14, train_loss: 0.8486, test_loss: 0.9800, test_f1: 0.5568
 epoch: 15, train_loss: 0.8328, test_loss: 0.9963, test_f1: 0.5784
 epoch: 16, train_loss: 0.8402, test_loss: 1.0483, test_f1: 0.5472
 epoch: 17, train_loss: 0.8143, test_loss: 1.1225, test_f1: 0.5465
 epoch: 18, train_loss: 0.8097, test_loss: 0.9569, test_f1: 0.5577
 epoch: 19, train_loss: 0.7999, test_loss: 1.1965, test_f1: 0.5316
 epoch: 20, train_loss: 0.7905, test_loss: 1.0638, test_f1: 0.5733
 epoch: 21, train_loss: 0.8075, test_loss: 1.0253, test_f1: 0.5622
 epoch: 22, train_loss: 0.8033, test_loss: 1.4851, test_f1: 0.5011
 epoch: 23, train_loss: 0.7968, test_loss: 0.9849, test_f1: 0.5484
 epoch: 24, train_loss: 0.7797, test_loss: 1.0163, test_f1: 0.5673
 epoch: 25, train_loss: 0.7766, test_loss: 1.1161, test_f1: 0.5885
 epoch: 26, train_loss: 0.7737, test_loss: 0.9764, test_f1: 0.5895
 epoch: 27, train_loss: 0.7587, test_loss: 1.1066, test_f1: 0.5668
 epoch: 28, train_loss: 0.7561, test_loss: 1.1095, test_f1: 0.5907
 epoch: 29, train_loss: 0.7471, test_loss: 1.0506, test_f1: 0.5713
 epoch: 30, train_loss: 0.7297, test_loss: 1.1390, test_f1: 0.5947
 epoch: 31, train_loss: 0.7346, test_loss: 1.0248, test_f1: 0.5714
 epoch: 32, train_loss: 0.7357, test_loss: 1.0965, test_f1: 0.5636
 epoch: 33, train_loss: 0.7364, test_loss: 1.1520, test_f1: 0.5358
 epoch: 34, train_loss: 0.7312, test_loss: 1.3013, test_f1: 0.5540
 epoch: 35, train_loss: 0.7194, test_loss: 1.2084, test_f1: 0.5707
 epoch: 36, train_loss: 0.7190, test_loss: 1.0098, test_f1: 0.5901
 epoch: 37, train_loss: 0.7148, test_loss: 1.3825, test_f1: 0.5228
 epoch: 38, train_loss: 0.7186, test_loss: 1.0904, test_f1: 0.5919
 epoch: 39, train_loss: 0.7019, test_loss: 1.1332, test_f1: 0.6132
 epoch: 40, train_loss: 0.6980, test_loss: 1.0630, test_f1: 0.5514
 epoch: 41, train_loss: 0.7128, test_loss: 1.2075, test_f1: 0.5698
 epoch: 42, train_loss: 0.6952, test_loss: 1.0631, test_f1: 0.5925
 epoch: 43, train_loss: 0.6962, test_loss: 1.2017, test_f1: 0.5969
 epoch: 44, train_loss: 0.6933, test_loss: 1.1846, test_f1: 0.6021
 epoch: 45, train_loss: 0.6798, test_loss: 1.2667, test_f1: 0.5871
 epoch: 46, train_loss: 0.6587, test_loss: 1.2295, test_f1: 0.5901
 epoch: 47, train_loss: 0.6518, test_loss: 1.2759, test_f1: 0.5879
 epoch: 48, train_loss: 0.6559, test_loss: 1.4016, test_f1: 0.6015
 epoch: 49, train_loss: 0.6416, test_loss: 1.3553, test_f1: 0.5709
 epoch: 50, train_loss: 0.6489, test_loss: 1.3033, test_f1: 0.6117
 epoch: 51, train_loss: 0.6164, test_loss: 1.5677, test_f1: 0.5659
 epoch: 52, train_loss: 0.5846, test_loss: 1.5327, test_f1: 0.6438
 epoch: 53, train_loss: 0.5911, test_loss: 1.5326, test_f1: 0.6529
 epoch: 54, train_loss: 0.5774, test_loss: 1.5415, test_f1: 0.6032
 epoch: 55, train_loss: 0.5957, test_loss: 1.5787, test_f1: 0.6149
 epoch: 56, train_loss: 0.5621, test_loss: 1.5590, test_f1: 0.6272
 epoch: 57, train_loss: 0.5769, test_loss: 1.4918, test_f1: 0.6495
 epoch: 58, train_loss: 0.5878, test_loss: 1.4155, test_f1: 0.6462
 epoch: 59, train_loss: 0.5610, test_loss: 1.4053, test_f1: 0.6400
 epoch: 60, train_loss: 0.5420, test_loss: 1.7154, test_f1: 0.6281
 epoch: 61, train_loss: 0.5533, test_loss: 1.6962, test_f1: 0.6220
 epoch: 62, train_loss: 0.5482, test_loss: 1.7301, test_f1: 0.5853
 epoch: 63, train_loss: 0.5473, test_loss: 1.6765, test_f1: 0.6265
 epoch: 64, train_loss: 0.5437, test_loss: 1.5243, test_f1: 0.6197
 epoch: 65, train_loss: 0.5503, test_loss: 1.5012, test_f1: 0.6169
 epoch: 66, train_loss: 0.5390, test_loss: 1.3941, test_f1: 0.6116
 epoch: 67, train_loss: 0.5351, test_loss: 1.7033, test_f1: 0.6398
 epoch: 68, train_loss: 0.5281, test_loss: 1.3547, test_f1: 0.6307
 epoch: 69, train_loss: 0.5205, test_loss: 1.2245, test_f1: 0.6242
 epoch: 70, train_loss: 0.5302, test_loss: 1.5067, test_f1: 0.6039
 epoch: 71, train_loss: 0.5254, test_loss: 1.6778, test_f1: 0.6497
 epoch: 72, train_loss: 0.5114, test_loss: 1.5992, test_f1: 0.6127
 epoch: 73, train_loss: 0.5146, test_loss: 1.6264, test_f1: 0.5956
 epoch: 74, train_loss: 0.5111, test_loss: 1.7088, test_f1: 0.6151
 epoch: 75, train_loss: 0.4958, test_loss: 1.5508, test_f1: 0.6076
 epoch: 76, train_loss: 0.4943, test_loss: 1.5088, test_f1: 0.6301
 epoch: 77, train_loss: 0.4877, test_loss: 1.5967, test_f1: 0.6511
 epoch: 78, train_loss: 0.5092, test_loss: 1.8173, test_f1: 0.5664
 epoch: 79, train_loss: 0.4895, test_loss: 1.8172, test_f1: 0.6325
 epoch: 80, train_loss: 0.4790, test_loss: 1.9050, test_f1: 0.6486
 epoch: 81, train_loss: 0.4955, test_loss: 1.7227, test_f1: 0.6436
 epoch: 82, train_loss: 0.4865, test_loss: 1.6375, test_f1: 0.6810
 epoch: 83, train_loss: 0.4819, test_loss: 1.9189, test_f1: 0.6232
 epoch: 84, train_loss: 0.4747, test_loss: 1.6810, test_f1: 0.6248
 epoch: 85, train_loss: 0.4748, test_loss: 1.7270, test_f1: 0.6194
 epoch: 86, train_loss: 0.4830, test_loss: 1.8646, test_f1: 0.6093
 epoch: 87, train_loss: 0.4750, test_loss: 1.7629, test_f1: 0.6593
 epoch: 88, train_loss: 0.4896, test_loss: 1.5594, test_f1: 0.6511
 epoch: 89, train_loss: 0.4668, test_loss: 1.7696, test_f1: 0.6092
 epoch: 90, train_loss: 0.4448, test_loss: 1.5728, test_f1: 0.6543
 epoch: 91, train_loss: 0.4551, test_loss: 1.7431, test_f1: 0.6523
 epoch: 92, train_loss: 0.4554, test_loss: 1.8454, test_f1: 0.6454
 epoch: 93, train_loss: 0.4573, test_loss: 1.8256, test_f1: 0.6332
 epoch: 94, train_loss: 0.4382, test_loss: 1.9639, test_f1: 0.6097
 epoch: 95, train_loss: 0.4340, test_loss: 1.8053, test_f1: 0.6237
 epoch: 96, train_loss: 0.4427, test_loss: 1.8854, test_f1: 0.6576
 epoch: 97, train_loss: 0.4529, test_loss: 1.5912, test_f1: 0.6347
 epoch: 98, train_loss: 0.4381, test_loss: 1.7807, test_f1: 0.6294
 epoch: 99, train_loss: 0.4460, test_loss: 1.8463, test_f1: 0.6658
##################ITERATION #1 ****************************************
 epoch: 0, train_loss: 1.1599, test_loss: 1.0775, test_f1: 0.3693
 epoch: 1, train_loss: 0.9867, test_loss: 1.0305, test_f1: 0.4508
 epoch: 2, train_loss: 0.9476, test_loss: 0.9673, test_f1: 0.5310
 epoch: 3, train_loss: 0.9372, test_loss: 1.0517, test_f1: 0.4901
 epoch: 4, train_loss: 0.9281, test_loss: 1.0155, test_f1: 0.4812
 epoch: 5, train_loss: 0.9105, test_loss: 1.1191, test_f1: 0.4891
 epoch: 6, train_loss: 0.9128, test_loss: 1.0654, test_f1: 0.4929
 epoch: 7, train_loss: 0.8830, test_loss: 0.9401, test_f1: 0.5619
 epoch: 8, train_loss: 0.8887, test_loss: 1.0016, test_f1: 0.5079
 epoch: 9, train_loss: 0.8654, test_loss: 0.9413, test_f1: 0.5533
 epoch: 10, train_loss: 0.8458, test_loss: 0.9220, test_f1: 0.5515
 epoch: 11, train_loss: 0.8330, test_loss: 0.9874, test_f1: 0.5589
 epoch: 12, train_loss: 0.8215, test_loss: 0.9149, test_f1: 0.5857
 epoch: 13, train_loss: 0.8172, test_loss: 1.1246, test_f1: 0.5050
 epoch: 14, train_loss: 0.7899, test_loss: 0.9694, test_f1: 0.5497
 epoch: 15, train_loss: 0.7952, test_loss: 0.9187, test_f1: 0.5973
 epoch: 16, train_loss: 0.7765, test_loss: 0.9318, test_f1: 0.5847
 epoch: 17, train_loss: 0.7739, test_loss: 0.9387, test_f1: 0.5925
 epoch: 18, train_loss: 0.7794, test_loss: 0.9369, test_f1: 0.5839
 epoch: 19, train_loss: 0.7651, test_loss: 0.9441, test_f1: 0.5671
 epoch: 20, train_loss: 0.7527, test_loss: 0.9482, test_f1: 0.5733
 epoch: 21, train_loss: 0.7457, test_loss: 0.9480, test_f1: 0.5978
 epoch: 22, train_loss: 0.7341, test_loss: 0.8711, test_f1: 0.6136
 epoch: 23, train_loss: 0.7217, test_loss: 0.8870, test_f1: 0.5804
 epoch: 24, train_loss: 0.7132, test_loss: 0.8926, test_f1: 0.6008
 epoch: 25, train_loss: 0.7051, test_loss: 0.8823, test_f1: 0.5880
 epoch: 26, train_loss: 0.7024, test_loss: 1.0199, test_f1: 0.5754
 epoch: 27, train_loss: 0.7153, test_loss: 0.8390, test_f1: 0.5760
 epoch: 28, train_loss: 0.6878, test_loss: 0.8728, test_f1: 0.6326
 epoch: 29, train_loss: 0.6836, test_loss: 0.9811, test_f1: 0.5562
 epoch: 30, train_loss: 0.6910, test_loss: 0.9719, test_f1: 0.6055
 epoch: 31, train_loss: 0.6818, test_loss: 0.9356, test_f1: 0.5954
 epoch: 32, train_loss: 0.6598, test_loss: 0.9228, test_f1: 0.6407
 epoch: 33, train_loss: 0.6644, test_loss: 0.9220, test_f1: 0.6007
 epoch: 34, train_loss: 0.6672, test_loss: 0.9526, test_f1: 0.6117
 epoch: 35, train_loss: 0.6581, test_loss: 0.9268, test_f1: 0.6089
 epoch: 36, train_loss: 0.6482, test_loss: 1.1882, test_f1: 0.5879
 epoch: 37, train_loss: 0.6254, test_loss: 0.9931, test_f1: 0.6080
 epoch: 38, train_loss: 0.6169, test_loss: 1.0502, test_f1: 0.5502
 epoch: 39, train_loss: 0.6354, test_loss: 1.1222, test_f1: 0.6089
 epoch: 40, train_loss: 0.6395, test_loss: 0.9661, test_f1: 0.6010
 epoch: 41, train_loss: 0.6261, test_loss: 1.1443, test_f1: 0.5822
 epoch: 42, train_loss: 0.6002, test_loss: 0.9991, test_f1: 0.6008
 epoch: 43, train_loss: 0.5863, test_loss: 1.0656, test_f1: 0.6414
 epoch: 44, train_loss: 0.5982, test_loss: 1.1835, test_f1: 0.5946
 epoch: 45, train_loss: 0.6029, test_loss: 1.0673, test_f1: 0.6242
 epoch: 46, train_loss: 0.6125, test_loss: 1.0443, test_f1: 0.6519
 epoch: 47, train_loss: 0.6000, test_loss: 1.0651, test_f1: 0.5937
 epoch: 48, train_loss: 0.5747, test_loss: 1.0564, test_f1: 0.6145
 epoch: 49, train_loss: 0.5680, test_loss: 1.0739, test_f1: 0.6195
 epoch: 50, train_loss: 0.5886, test_loss: 1.2106, test_f1: 0.6221
 epoch: 51, train_loss: 0.5461, test_loss: 0.9832, test_f1: 0.6484
 epoch: 52, train_loss: 0.5081, test_loss: 1.0575, test_f1: 0.6470
 epoch: 53, train_loss: 0.5105, test_loss: 1.0845, test_f1: 0.6357
 epoch: 54, train_loss: 0.4840, test_loss: 1.0349, test_f1: 0.6410
 epoch: 55, train_loss: 0.4857, test_loss: 1.1150, test_f1: 0.6408
 epoch: 56, train_loss: 0.4826, test_loss: 1.1921, test_f1: 0.6140
 epoch: 57, train_loss: 0.4942, test_loss: 1.0812, test_f1: 0.6643
 epoch: 58, train_loss: 0.4824, test_loss: 1.1481, test_f1: 0.6447
 epoch: 59, train_loss: 0.4763, test_loss: 1.2767, test_f1: 0.6513
 epoch: 60, train_loss: 0.4648, test_loss: 1.1842, test_f1: 0.6512
 epoch: 61, train_loss: 0.4701, test_loss: 1.3132, test_f1: 0.6192
 epoch: 62, train_loss: 0.4599, test_loss: 1.3528, test_f1: 0.6611
 epoch: 63, train_loss: 0.4492, test_loss: 1.0924, test_f1: 0.6451
 epoch: 64, train_loss: 0.4653, test_loss: 1.2563, test_f1: 0.6800
 epoch: 65, train_loss: 0.4500, test_loss: 1.1096, test_f1: 0.6495
 epoch: 66, train_loss: 0.4712, test_loss: 1.3332, test_f1: 0.6122
 epoch: 67, train_loss: 0.4681, test_loss: 1.2370, test_f1: 0.6564
 epoch: 68, train_loss: 0.4411, test_loss: 1.3332, test_f1: 0.6540
 epoch: 69, train_loss: 0.4533, test_loss: 1.2940, test_f1: 0.6674
 epoch: 70, train_loss: 0.4473, test_loss: 1.2355, test_f1: 0.6661
 epoch: 71, train_loss: 0.4249, test_loss: 1.1918, test_f1: 0.6539
 epoch: 72, train_loss: 0.4360, test_loss: 1.4253, test_f1: 0.6623
 epoch: 73, train_loss: 0.4285, test_loss: 1.3044, test_f1: 0.6468
 epoch: 74, train_loss: 0.4319, test_loss: 1.1535, test_f1: 0.6863
 epoch: 75, train_loss: 0.4201, test_loss: 1.1897, test_f1: 0.6642
 epoch: 76, train_loss: 0.4125, test_loss: 1.3278, test_f1: 0.6508
 epoch: 77, train_loss: 0.4278, test_loss: 1.4151, test_f1: 0.6423
 epoch: 78, train_loss: 0.4139, test_loss: 1.2641, test_f1: 0.6538
 epoch: 79, train_loss: 0.4133, test_loss: 1.4383, test_f1: 0.6600
 epoch: 80, train_loss: 0.4006, test_loss: 1.3941, test_f1: 0.6181
 epoch: 81, train_loss: 0.4136, test_loss: 1.3766, test_f1: 0.6834
 epoch: 82, train_loss: 0.4203, test_loss: 1.2803, test_f1: 0.6202
 epoch: 83, train_loss: 0.4125, test_loss: 1.3014, test_f1: 0.6493
 epoch: 84, train_loss: 0.4205, test_loss: 1.3574, test_f1: 0.6436
 epoch: 85, train_loss: 0.4247, test_loss: 1.3202, test_f1: 0.6350
 epoch: 86, train_loss: 0.3930, test_loss: 1.3114, test_f1: 0.6472
 epoch: 87, train_loss: 0.4098, test_loss: 1.3347, test_f1: 0.6447
 epoch: 88, train_loss: 0.4152, test_loss: 1.2474, test_f1: 0.6481
 epoch: 89, train_loss: 0.3790, test_loss: 1.4215, test_f1: 0.6563
 epoch: 90, train_loss: 0.3898, test_loss: 1.4203, test_f1: 0.6469
 epoch: 91, train_loss: 0.3843, test_loss: 1.4446, test_f1: 0.6337
 epoch: 92, train_loss: 0.4099, test_loss: 1.3325, test_f1: 0.6539
 epoch: 93, train_loss: 0.3896, test_loss: 1.2479, test_f1: 0.6511
 epoch: 94, train_loss: 0.3781, test_loss: 1.5117, test_f1: 0.6485
 epoch: 95, train_loss: 0.3703, test_loss: 1.3290, test_f1: 0.6662
 epoch: 96, train_loss: 0.3885, test_loss: 1.3051, test_f1: 0.6487
 epoch: 97, train_loss: 0.3931, test_loss: 1.3950, test_f1: 0.6312
 epoch: 98, train_loss: 0.3721, test_loss: 1.3845, test_f1: 0.6444
 epoch: 99, train_loss: 0.3590, test_loss: 1.4535, test_f1: 0.6719
##################ITERATION #2 ****************************************
 epoch: 0, train_loss: 1.2318, test_loss: 1.1810, test_f1: 0.3395
 epoch: 1, train_loss: 1.0106, test_loss: 1.0121, test_f1: 0.4775
 epoch: 2, train_loss: 0.9720, test_loss: 1.0227, test_f1: 0.4733
 epoch: 3, train_loss: 0.9653, test_loss: 0.9487, test_f1: 0.4849
 epoch: 4, train_loss: 0.9395, test_loss: 0.9521, test_f1: 0.4458
 epoch: 5, train_loss: 0.9321, test_loss: 0.9412, test_f1: 0.4875
 epoch: 6, train_loss: 0.9170, test_loss: 0.9388, test_f1: 0.4686
 epoch: 7, train_loss: 0.9064, test_loss: 0.9719, test_f1: 0.4935
 epoch: 8, train_loss: 0.8825, test_loss: 1.0149, test_f1: 0.5193
 epoch: 9, train_loss: 0.8790, test_loss: 0.9903, test_f1: 0.5323
 epoch: 10, train_loss: 0.8653, test_loss: 0.9505, test_f1: 0.5292
 epoch: 11, train_loss: 0.8672, test_loss: 1.0413, test_f1: 0.5371
 epoch: 12, train_loss: 0.8327, test_loss: 0.8997, test_f1: 0.5614
 epoch: 13, train_loss: 0.8205, test_loss: 0.9730, test_f1: 0.5609
 epoch: 14, train_loss: 0.8166, test_loss: 1.0289, test_f1: 0.5448
 epoch: 15, train_loss: 0.8153, test_loss: 0.9566, test_f1: 0.5712
 epoch: 16, train_loss: 0.8128, test_loss: 0.9325, test_f1: 0.5659
 epoch: 17, train_loss: 0.8026, test_loss: 0.9839, test_f1: 0.5899
 epoch: 18, train_loss: 0.7871, test_loss: 1.0014, test_f1: 0.5461
 epoch: 19, train_loss: 0.7730, test_loss: 1.0772, test_f1: 0.5593
 epoch: 20, train_loss: 0.7725, test_loss: 0.9610, test_f1: 0.4951
 epoch: 21, train_loss: 0.7721, test_loss: 1.1309, test_f1: 0.5673
 epoch: 22, train_loss: 0.7513, test_loss: 1.0971, test_f1: 0.5670
 epoch: 23, train_loss: 0.7440, test_loss: 1.0358, test_f1: 0.5999
 epoch: 24, train_loss: 0.7559, test_loss: 1.0000, test_f1: 0.6089
 epoch: 25, train_loss: 0.7282, test_loss: 1.1152, test_f1: 0.5619
 epoch: 26, train_loss: 0.7595, test_loss: 1.2456, test_f1: 0.5445
 epoch: 27, train_loss: 0.7201, test_loss: 1.0573, test_f1: 0.5957
 epoch: 28, train_loss: 0.7303, test_loss: 1.1284, test_f1: 0.6086
 epoch: 29, train_loss: 0.7024, test_loss: 1.2811, test_f1: 0.6028
 epoch: 30, train_loss: 0.7817, test_loss: 1.0197, test_f1: 0.5027
 epoch: 31, train_loss: 0.7745, test_loss: 1.1977, test_f1: 0.5636
 epoch: 32, train_loss: 0.7414, test_loss: 1.1242, test_f1: 0.6131
 epoch: 33, train_loss: 0.7264, test_loss: 1.1840, test_f1: 0.5952
 epoch: 34, train_loss: 0.6930, test_loss: 1.2428, test_f1: 0.5713
 epoch: 35, train_loss: 0.6878, test_loss: 1.1148, test_f1: 0.5854
 epoch: 36, train_loss: 0.6797, test_loss: 1.3591, test_f1: 0.5990
 epoch: 37, train_loss: 0.6956, test_loss: 1.3918, test_f1: 0.5972
 epoch: 38, train_loss: 0.6813, test_loss: 1.0411, test_f1: 0.5888
 epoch: 39, train_loss: 0.6812, test_loss: 1.2304, test_f1: 0.5969
 epoch: 40, train_loss: 0.6698, test_loss: 1.2988, test_f1: 0.5810
 epoch: 41, train_loss: 0.6655, test_loss: 1.0573, test_f1: 0.6245
 epoch: 42, train_loss: 0.6563, test_loss: 1.1966, test_f1: 0.5753
 epoch: 43, train_loss: 0.6438, test_loss: 1.1926, test_f1: 0.6257
 epoch: 44, train_loss: 0.6547, test_loss: 1.1488, test_f1: 0.6140
 epoch: 45, train_loss: 0.6661, test_loss: 1.1396, test_f1: 0.5787
 epoch: 46, train_loss: 0.6268, test_loss: 1.0963, test_f1: 0.5904
 epoch: 47, train_loss: 0.6479, test_loss: 1.2222, test_f1: 0.6147
 epoch: 48, train_loss: 0.6429, test_loss: 1.1177, test_f1: 0.5778
 epoch: 49, train_loss: 0.6280, test_loss: 1.1233, test_f1: 0.5932
 epoch: 50, train_loss: 0.6106, test_loss: 1.2716, test_f1: 0.6350
 epoch: 51, train_loss: 0.5889, test_loss: 1.2264, test_f1: 0.6235
 epoch: 52, train_loss: 0.5626, test_loss: 1.2236, test_f1: 0.6294
 epoch: 53, train_loss: 0.5592, test_loss: 1.2301, test_f1: 0.6300
 epoch: 54, train_loss: 0.5527, test_loss: 1.2617, test_f1: 0.6315
 epoch: 55, train_loss: 0.5325, test_loss: 1.3117, test_f1: 0.6409
 epoch: 56, train_loss: 0.5256, test_loss: 1.2153, test_f1: 0.6404
 epoch: 57, train_loss: 0.5146, test_loss: 1.2809, test_f1: 0.6619
 epoch: 58, train_loss: 0.5177, test_loss: 1.3500, test_f1: 0.6343
 epoch: 59, train_loss: 0.5189, test_loss: 1.4760, test_f1: 0.6421
 epoch: 60, train_loss: 0.5112, test_loss: 1.5022, test_f1: 0.6434
 epoch: 61, train_loss: 0.5147, test_loss: 1.4502, test_f1: 0.6523
 epoch: 62, train_loss: 0.5221, test_loss: 1.3025, test_f1: 0.6336
 epoch: 63, train_loss: 0.5093, test_loss: 1.3421, test_f1: 0.6379
 epoch: 64, train_loss: 0.5035, test_loss: 1.4471, test_f1: 0.6306
 epoch: 65, train_loss: 0.5141, test_loss: 1.5278, test_f1: 0.6244
 epoch: 66, train_loss: 0.4925, test_loss: 1.4717, test_f1: 0.6290
 epoch: 67, train_loss: 0.5026, test_loss: 1.3139, test_f1: 0.6405
 epoch: 68, train_loss: 0.4987, test_loss: 1.3320, test_f1: 0.6477
 epoch: 69, train_loss: 0.5072, test_loss: 1.4156, test_f1: 0.6653
 epoch: 70, train_loss: 0.4871, test_loss: 1.4101, test_f1: 0.6266
 epoch: 71, train_loss: 0.5102, test_loss: 1.5459, test_f1: 0.6366
 epoch: 72, train_loss: 0.4899, test_loss: 1.3027, test_f1: 0.6393
 epoch: 73, train_loss: 0.4760, test_loss: 1.3407, test_f1: 0.6143
 epoch: 74, train_loss: 0.4760, test_loss: 1.5031, test_f1: 0.6296
 epoch: 75, train_loss: 0.4643, test_loss: 1.3059, test_f1: 0.6365
 epoch: 76, train_loss: 0.4804, test_loss: 1.4200, test_f1: 0.6279
 epoch: 77, train_loss: 0.4650, test_loss: 1.4571, test_f1: 0.6301
 epoch: 78, train_loss: 0.4691, test_loss: 1.4181, test_f1: 0.6307
 epoch: 79, train_loss: 0.4503, test_loss: 1.4228, test_f1: 0.6232
 epoch: 80, train_loss: 0.4681, test_loss: 1.3205, test_f1: 0.6530
 epoch: 81, train_loss: 0.4720, test_loss: 1.4063, test_f1: 0.6204
 epoch: 82, train_loss: 0.4704, test_loss: 1.2636, test_f1: 0.6481
 epoch: 83, train_loss: 0.4494, test_loss: 1.3847, test_f1: 0.6458
 epoch: 84, train_loss: 0.4495, test_loss: 1.4298, test_f1: 0.6482
 epoch: 85, train_loss: 0.4716, test_loss: 1.4066, test_f1: 0.6605
 epoch: 86, train_loss: 0.4577, test_loss: 1.4361, test_f1: 0.6237
 epoch: 87, train_loss: 0.4496, test_loss: 1.4294, test_f1: 0.6162
 epoch: 88, train_loss: 0.4216, test_loss: 1.4167, test_f1: 0.6667
 epoch: 89, train_loss: 0.4383, test_loss: 1.3301, test_f1: 0.6349
 epoch: 90, train_loss: 0.4392, test_loss: 1.5586, test_f1: 0.6543
 epoch: 91, train_loss: 0.4279, test_loss: 1.5579, test_f1: 0.6488
 epoch: 92, train_loss: 0.4350, test_loss: 1.3000, test_f1: 0.6408
 epoch: 93, train_loss: 0.4173, test_loss: 1.3903, test_f1: 0.6822
 epoch: 94, train_loss: 0.4265, test_loss: 1.5070, test_f1: 0.6173
 epoch: 95, train_loss: 0.4331, test_loss: 1.5249, test_f1: 0.6621
 epoch: 96, train_loss: 0.4159, test_loss: 1.5031, test_f1: 0.6435
 epoch: 97, train_loss: 0.4276, test_loss: 1.6003, test_f1: 0.6477
 epoch: 98, train_loss: 0.4166, test_loss: 1.4427, test_f1: 0.6769
 epoch: 99, train_loss: 0.4208, test_loss: 1.5167, test_f1: 0.6538
##################ITERATION #3 ****************************************
 epoch: 0, train_loss: 1.2868, test_loss: 1.2909, test_f1: 0.3039
 epoch: 1, train_loss: 1.0091, test_loss: 1.0181, test_f1: 0.4628
 epoch: 2, train_loss: 0.9730, test_loss: 1.0363, test_f1: 0.4518
 epoch: 3, train_loss: 0.9512, test_loss: 0.9869, test_f1: 0.4937
 epoch: 4, train_loss: 0.9240, test_loss: 0.9709, test_f1: 0.5063
 epoch: 5, train_loss: 0.9030, test_loss: 0.9342, test_f1: 0.5016
 epoch: 6, train_loss: 0.8929, test_loss: 0.9498, test_f1: 0.5316
 epoch: 7, train_loss: 0.8898, test_loss: 0.9812, test_f1: 0.4966
 epoch: 8, train_loss: 0.8708, test_loss: 0.9081, test_f1: 0.5152
 epoch: 9, train_loss: 0.8610, test_loss: 0.9647, test_f1: 0.5157
 epoch: 10, train_loss: 0.8380, test_loss: 0.9370, test_f1: 0.5745
 epoch: 11, train_loss: 0.8380, test_loss: 0.8982, test_f1: 0.5387
 epoch: 12, train_loss: 0.8170, test_loss: 0.9380, test_f1: 0.5532
 epoch: 13, train_loss: 0.7983, test_loss: 0.9612, test_f1: 0.5229
 epoch: 14, train_loss: 0.7923, test_loss: 0.9560, test_f1: 0.5854
 epoch: 15, train_loss: 0.7908, test_loss: 0.9938, test_f1: 0.5201
 epoch: 16, train_loss: 0.7904, test_loss: 1.1012, test_f1: 0.5319
 epoch: 17, train_loss: 0.7809, test_loss: 0.9766, test_f1: 0.5449
 epoch: 18, train_loss: 0.7659, test_loss: 0.9814, test_f1: 0.5756
 epoch: 19, train_loss: 0.7636, test_loss: 0.9781, test_f1: 0.5982
 epoch: 20, train_loss: 0.7574, test_loss: 0.8760, test_f1: 0.6188
 epoch: 21, train_loss: 0.7347, test_loss: 1.0132, test_f1: 0.5843
 epoch: 22, train_loss: 0.7218, test_loss: 1.0241, test_f1: 0.5778
 epoch: 23, train_loss: 0.7155, test_loss: 0.9938, test_f1: 0.5911
 epoch: 24, train_loss: 0.7196, test_loss: 1.0237, test_f1: 0.5729
 epoch: 25, train_loss: 0.7160, test_loss: 0.9157, test_f1: 0.5993
 epoch: 26, train_loss: 0.7048, test_loss: 0.9811, test_f1: 0.5901
 epoch: 27, train_loss: 0.7101, test_loss: 1.0870, test_f1: 0.5527
 epoch: 28, train_loss: 0.7018, test_loss: 1.0137, test_f1: 0.6379
 epoch: 29, train_loss: 0.6984, test_loss: 1.2018, test_f1: 0.5566
 epoch: 30, train_loss: 0.7035, test_loss: 1.0515, test_f1: 0.6283
 epoch: 31, train_loss: 0.6746, test_loss: 1.0317, test_f1: 0.6146
 epoch: 32, train_loss: 0.6609, test_loss: 1.0449, test_f1: 0.6154
 epoch: 33, train_loss: 0.6691, test_loss: 1.0970, test_f1: 0.6133
 epoch: 34, train_loss: 0.6537, test_loss: 1.0427, test_f1: 0.6236
 epoch: 35, train_loss: 0.6636, test_loss: 1.1259, test_f1: 0.6190
 epoch: 36, train_loss: 0.6584, test_loss: 0.9010, test_f1: 0.6267
 epoch: 37, train_loss: 0.6429, test_loss: 1.0426, test_f1: 0.6188
 epoch: 38, train_loss: 0.6573, test_loss: 1.0611, test_f1: 0.5900
 epoch: 39, train_loss: 0.6275, test_loss: 1.2348, test_f1: 0.5909
 epoch: 40, train_loss: 0.6433, test_loss: 0.9562, test_f1: 0.6446
 epoch: 41, train_loss: 0.6408, test_loss: 0.9900, test_f1: 0.6308
 epoch: 42, train_loss: 0.6223, test_loss: 1.0563, test_f1: 0.6187
 epoch: 43, train_loss: 0.6027, test_loss: 1.2083, test_f1: 0.6562
 epoch: 44, train_loss: 0.6070, test_loss: 1.0700, test_f1: 0.5901
 epoch: 45, train_loss: 0.6009, test_loss: 1.0378, test_f1: 0.6800
 epoch: 46, train_loss: 0.6085, test_loss: 1.1247, test_f1: 0.6280
 epoch: 47, train_loss: 0.5909, test_loss: 1.1022, test_f1: 0.6050
 epoch: 48, train_loss: 0.6006, test_loss: 1.0990, test_f1: 0.6580
 epoch: 49, train_loss: 0.5982, test_loss: 1.2559, test_f1: 0.6362
 epoch: 50, train_loss: 0.5731, test_loss: 0.9246, test_f1: 0.6418
 epoch: 51, train_loss: 0.5564, test_loss: 1.0493, test_f1: 0.6438
 epoch: 52, train_loss: 0.5165, test_loss: 1.0772, test_f1: 0.6395
 epoch: 53, train_loss: 0.5292, test_loss: 1.1659, test_f1: 0.6549
 epoch: 54, train_loss: 0.4904, test_loss: 1.1617, test_f1: 0.6658
 epoch: 55, train_loss: 0.5052, test_loss: 1.2157, test_f1: 0.6255
 epoch: 56, train_loss: 0.4835, test_loss: 1.0847, test_f1: 0.6697
 epoch: 57, train_loss: 0.4799, test_loss: 1.1783, test_f1: 0.6629
 epoch: 58, train_loss: 0.4740, test_loss: 1.1734, test_f1: 0.6599
 epoch: 59, train_loss: 0.4787, test_loss: 1.1512, test_f1: 0.6579
 epoch: 60, train_loss: 0.4889, test_loss: 1.2053, test_f1: 0.6261
 epoch: 61, train_loss: 0.4715, test_loss: 1.1714, test_f1: 0.6743
 epoch: 62, train_loss: 0.4895, test_loss: 1.1749, test_f1: 0.6745
 epoch: 63, train_loss: 0.4722, test_loss: 1.2905, test_f1: 0.6365
 epoch: 64, train_loss: 0.4841, test_loss: 1.1314, test_f1: 0.6634
 epoch: 65, train_loss: 0.4673, test_loss: 1.0991, test_f1: 0.6702
 epoch: 66, train_loss: 0.4533, test_loss: 1.3875, test_f1: 0.6487
 epoch: 67, train_loss: 0.4672, test_loss: 1.2321, test_f1: 0.6164
 epoch: 68, train_loss: 0.4561, test_loss: 1.1399, test_f1: 0.6627
 epoch: 69, train_loss: 0.4530, test_loss: 1.1823, test_f1: 0.6509
 epoch: 70, train_loss: 0.4704, test_loss: 1.3029, test_f1: 0.6464
 epoch: 71, train_loss: 0.4591, test_loss: 1.2836, test_f1: 0.6405
 epoch: 72, train_loss: 0.4446, test_loss: 1.1031, test_f1: 0.6687
 epoch: 73, train_loss: 0.4447, test_loss: 1.1047, test_f1: 0.6688
 epoch: 74, train_loss: 0.4674, test_loss: 1.1529, test_f1: 0.6537
 epoch: 75, train_loss: 0.4544, test_loss: 1.2340, test_f1: 0.6695
 epoch: 76, train_loss: 0.4499, test_loss: 1.3815, test_f1: 0.6666
 epoch: 77, train_loss: 0.4402, test_loss: 1.4755, test_f1: 0.6606
 epoch: 78, train_loss: 0.4427, test_loss: 1.1740, test_f1: 0.6524
 epoch: 79, train_loss: 0.4456, test_loss: 1.4104, test_f1: 0.6809
 epoch: 80, train_loss: 0.4420, test_loss: 1.2801, test_f1: 0.6861
 epoch: 81, train_loss: 0.4234, test_loss: 1.4521, test_f1: 0.6716
 epoch: 82, train_loss: 0.4235, test_loss: 1.4560, test_f1: 0.6446
 epoch: 83, train_loss: 0.4326, test_loss: 1.2115, test_f1: 0.6832
 epoch: 84, train_loss: 0.4299, test_loss: 1.3546, test_f1: 0.6724
 epoch: 85, train_loss: 0.4091, test_loss: 1.4699, test_f1: 0.6570
 epoch: 86, train_loss: 0.4220, test_loss: 1.4705, test_f1: 0.6361
 epoch: 87, train_loss: 0.4090, test_loss: 1.2378, test_f1: 0.6804
 epoch: 88, train_loss: 0.4180, test_loss: 1.4197, test_f1: 0.6877
 epoch: 89, train_loss: 0.3890, test_loss: 1.3301, test_f1: 0.6738
 epoch: 90, train_loss: 0.4022, test_loss: 1.1719, test_f1: 0.7038
 epoch: 91, train_loss: 0.4062, test_loss: 1.3362, test_f1: 0.6632
 epoch: 92, train_loss: 0.4073, test_loss: 1.3560, test_f1: 0.6562
 epoch: 93, train_loss: 0.3960, test_loss: 1.1645, test_f1: 0.6766
 epoch: 94, train_loss: 0.3681, test_loss: 1.2081, test_f1: 0.6793
 epoch: 95, train_loss: 0.3936, test_loss: 1.3920, test_f1: 0.6552
 epoch: 96, train_loss: 0.3989, test_loss: 1.4891, test_f1: 0.6831
 epoch: 97, train_loss: 0.3963, test_loss: 1.3009, test_f1: 0.6659
 epoch: 98, train_loss: 0.3844, test_loss: 1.1793, test_f1: 0.6607
 epoch: 99, train_loss: 0.3929, test_loss: 1.5100, test_f1: 0.6466
##################ITERATION #4 ****************************************
 epoch: 0, train_loss: 1.3006, test_loss: 1.2533, test_f1: 0.3326
 epoch: 1, train_loss: 1.0370, test_loss: 0.9685, test_f1: 0.4973
 epoch: 2, train_loss: 0.9926, test_loss: 0.9324, test_f1: 0.4984
 epoch: 3, train_loss: 0.9748, test_loss: 0.9663, test_f1: 0.4800
 epoch: 4, train_loss: 0.9496, test_loss: 0.9462, test_f1: 0.4884
 epoch: 5, train_loss: 0.9317, test_loss: 0.9728, test_f1: 0.4973
 epoch: 6, train_loss: 0.9270, test_loss: 0.9545, test_f1: 0.4992
 epoch: 7, train_loss: 0.9026, test_loss: 0.9463, test_f1: 0.5333
 epoch: 8, train_loss: 0.8891, test_loss: 0.9440, test_f1: 0.5405
 epoch: 9, train_loss: 0.8678, test_loss: 0.9338, test_f1: 0.5478
 epoch: 10, train_loss: 0.8708, test_loss: 1.1359, test_f1: 0.4608
 epoch: 11, train_loss: 0.8705, test_loss: 1.0608, test_f1: 0.4674
 epoch: 12, train_loss: 0.8439, test_loss: 0.9348, test_f1: 0.5913
 epoch: 13, train_loss: 0.8403, test_loss: 0.9233, test_f1: 0.5422
 epoch: 14, train_loss: 0.8215, test_loss: 0.9358, test_f1: 0.5629
 epoch: 15, train_loss: 0.8207, test_loss: 0.9796, test_f1: 0.5750
 epoch: 16, train_loss: 0.8077, test_loss: 0.8910, test_f1: 0.5942
 epoch: 17, train_loss: 0.7980, test_loss: 0.9422, test_f1: 0.5584
 epoch: 18, train_loss: 0.7878, test_loss: 0.9312, test_f1: 0.5968
 epoch: 19, train_loss: 0.7769, test_loss: 0.9145, test_f1: 0.5590
 epoch: 20, train_loss: 0.7679, test_loss: 0.8993, test_f1: 0.6333
 epoch: 21, train_loss: 0.7632, test_loss: 0.8812, test_f1: 0.6139
 epoch: 22, train_loss: 0.7265, test_loss: 0.9210, test_f1: 0.6311
 epoch: 23, train_loss: 0.7232, test_loss: 0.9180, test_f1: 0.5767
 epoch: 24, train_loss: 0.7240, test_loss: 0.9822, test_f1: 0.5355
 epoch: 25, train_loss: 0.7320, test_loss: 0.9499, test_f1: 0.5937
 epoch: 26, train_loss: 0.7163, test_loss: 0.9086, test_f1: 0.5929
 epoch: 27, train_loss: 0.7087, test_loss: 0.9432, test_f1: 0.5849
 epoch: 28, train_loss: 0.7236, test_loss: 0.8997, test_f1: 0.5618
 epoch: 29, train_loss: 0.7176, test_loss: 0.8446, test_f1: 0.6240
 epoch: 30, train_loss: 0.7007, test_loss: 0.8781, test_f1: 0.5957
 epoch: 31, train_loss: 0.7043, test_loss: 0.9363, test_f1: 0.6088
 epoch: 32, train_loss: 0.6903, test_loss: 0.9712, test_f1: 0.5780
 epoch: 33, train_loss: 0.6657, test_loss: 0.8930, test_f1: 0.6042
 epoch: 34, train_loss: 0.6447, test_loss: 0.8551, test_f1: 0.6065
 epoch: 35, train_loss: 0.6720, test_loss: 1.0288, test_f1: 0.5652
 epoch: 36, train_loss: 0.6940, test_loss: 0.9371, test_f1: 0.5884
 epoch: 37, train_loss: 0.6819, test_loss: 0.9403, test_f1: 0.6166
 epoch: 38, train_loss: 0.6384, test_loss: 0.8880, test_f1: 0.6150
 epoch: 39, train_loss: 0.6322, test_loss: 0.9045, test_f1: 0.6334
 epoch: 40, train_loss: 0.6289, test_loss: 0.9453, test_f1: 0.6232
 epoch: 41, train_loss: 0.6423, test_loss: 0.9299, test_f1: 0.5752
 epoch: 42, train_loss: 0.6218, test_loss: 1.0035, test_f1: 0.6201
 epoch: 43, train_loss: 0.6814, test_loss: 0.9584, test_f1: 0.6425
 epoch: 44, train_loss: 0.6140, test_loss: 0.9757, test_f1: 0.6195
 epoch: 45, train_loss: 0.6127, test_loss: 0.9738, test_f1: 0.6063
 epoch: 46, train_loss: 0.6069, test_loss: 1.0230, test_f1: 0.6150
 epoch: 47, train_loss: 0.6065, test_loss: 1.0042, test_f1: 0.6126
 epoch: 48, train_loss: 0.6308, test_loss: 0.9236, test_f1: 0.5810
 epoch: 49, train_loss: 0.6028, test_loss: 0.9155, test_f1: 0.6066
 epoch: 50, train_loss: 0.6113, test_loss: 0.9849, test_f1: 0.6412
 epoch: 51, train_loss: 0.5750, test_loss: 0.9554, test_f1: 0.6226
 epoch: 52, train_loss: 0.5237, test_loss: 0.9679, test_f1: 0.6249
 epoch: 53, train_loss: 0.5428, test_loss: 1.0335, test_f1: 0.6453
 epoch: 54, train_loss: 0.5430, test_loss: 0.9555, test_f1: 0.6339
 epoch: 55, train_loss: 0.4994, test_loss: 1.0120, test_f1: 0.6380
 epoch: 56, train_loss: 0.5153, test_loss: 0.9535, test_f1: 0.6551
 epoch: 57, train_loss: 0.5045, test_loss: 1.0680, test_f1: 0.6210
 epoch: 58, train_loss: 0.4941, test_loss: 1.0253, test_f1: 0.6330
 epoch: 59, train_loss: 0.4751, test_loss: 1.0836, test_f1: 0.6301
 epoch: 60, train_loss: 0.5166, test_loss: 1.0439, test_f1: 0.6305
 epoch: 61, train_loss: 0.5038, test_loss: 1.0426, test_f1: 0.6479
 epoch: 62, train_loss: 0.4975, test_loss: 1.0996, test_f1: 0.6236
 epoch: 63, train_loss: 0.4945, test_loss: 1.0716, test_f1: 0.6337
 epoch: 64, train_loss: 0.5094, test_loss: 0.9560, test_f1: 0.6331
 epoch: 65, train_loss: 0.4976, test_loss: 1.0181, test_f1: 0.6555
 epoch: 66, train_loss: 0.4799, test_loss: 0.9759, test_f1: 0.6451
 epoch: 67, train_loss: 0.4791, test_loss: 0.9940, test_f1: 0.6568
 epoch: 68, train_loss: 0.4773, test_loss: 1.1424, test_f1: 0.6167
 epoch: 69, train_loss: 0.4762, test_loss: 0.9913, test_f1: 0.6409
 epoch: 70, train_loss: 0.4553, test_loss: 1.1003, test_f1: 0.6336
 epoch: 71, train_loss: 0.4767, test_loss: 1.0543, test_f1: 0.6342
 epoch: 72, train_loss: 0.4582, test_loss: 1.0899, test_f1: 0.6463
 epoch: 73, train_loss: 0.4719, test_loss: 1.0208, test_f1: 0.6341
 epoch: 74, train_loss: 0.4528, test_loss: 1.0053, test_f1: 0.6643
 epoch: 75, train_loss: 0.4216, test_loss: 1.0463, test_f1: 0.6494
 epoch: 76, train_loss: 0.4624, test_loss: 1.1747, test_f1: 0.6483
 epoch: 77, train_loss: 0.4651, test_loss: 1.0006, test_f1: 0.6743
 epoch: 78, train_loss: 0.4430, test_loss: 1.1028, test_f1: 0.6509
 epoch: 79, train_loss: 0.4385, test_loss: 1.0741, test_f1: 0.6389
 epoch: 80, train_loss: 0.4365, test_loss: 1.1821, test_f1: 0.6230
 epoch: 81, train_loss: 0.4365, test_loss: 1.1190, test_f1: 0.6366
 epoch: 82, train_loss: 0.4205, test_loss: 1.1485, test_f1: 0.6718
 epoch: 83, train_loss: 0.4343, test_loss: 1.1886, test_f1: 0.6185
 epoch: 84, train_loss: 0.4319, test_loss: 1.0947, test_f1: 0.6351
 epoch: 85, train_loss: 0.4432, test_loss: 1.1163, test_f1: 0.6660
 epoch: 86, train_loss: 0.4197, test_loss: 1.1326, test_f1: 0.6298
 epoch: 87, train_loss: 0.4140, test_loss: 1.1508, test_f1: 0.6296
 epoch: 88, train_loss: 0.4291, test_loss: 1.1317, test_f1: 0.6594
 epoch: 89, train_loss: 0.4199, test_loss: 1.1750, test_f1: 0.6380
 epoch: 90, train_loss: 0.4185, test_loss: 1.1060, test_f1: 0.6450
 epoch: 91, train_loss: 0.4231, test_loss: 1.2169, test_f1: 0.6191
 epoch: 92, train_loss: 0.4365, test_loss: 1.1546, test_f1: 0.6379
 epoch: 93, train_loss: 0.4097, test_loss: 1.1186, test_f1: 0.6463
 epoch: 94, train_loss: 0.4097, test_loss: 1.0953, test_f1: 0.6504
 epoch: 95, train_loss: 0.4169, test_loss: 1.1612, test_f1: 0.6039
 epoch: 96, train_loss: 0.4390, test_loss: 1.1775, test_f1: 0.6452
 epoch: 97, train_loss: 0.4149, test_loss: 1.1574, test_f1: 0.6605
 epoch: 98, train_loss: 0.4181, test_loss: 1.1608, test_f1: 0.6556
 epoch: 99, train_loss: 0.4133, test_loss: 1.1153, test_f1: 0.6422
##################ITERATION #5 ****************************************
 epoch: 0, train_loss: 1.3272, test_loss: 1.2097, test_f1: 0.3227
 epoch: 1, train_loss: 1.0277, test_loss: 1.0161, test_f1: 0.4538
 epoch: 2, train_loss: 0.9837, test_loss: 1.0086, test_f1: 0.4764
 epoch: 3, train_loss: 0.9620, test_loss: 0.9467, test_f1: 0.4978
 epoch: 4, train_loss: 0.9673, test_loss: 0.9899, test_f1: 0.4853
 epoch: 5, train_loss: 0.9293, test_loss: 1.0203, test_f1: 0.4873
 epoch: 6, train_loss: 0.9171, test_loss: 0.9487, test_f1: 0.5153
 epoch: 7, train_loss: 0.9095, test_loss: 0.9553, test_f1: 0.4904
 epoch: 8, train_loss: 0.9062, test_loss: 1.0435, test_f1: 0.4906
 epoch: 9, train_loss: 0.8894, test_loss: 0.9287, test_f1: 0.4928
 epoch: 10, train_loss: 0.9039, test_loss: 0.9003, test_f1: 0.5682
 epoch: 11, train_loss: 0.8862, test_loss: 0.9740, test_f1: 0.5349
 epoch: 12, train_loss: 0.8578, test_loss: 1.0171, test_f1: 0.5382
 epoch: 13, train_loss: 0.8564, test_loss: 0.9382, test_f1: 0.5755
 epoch: 14, train_loss: 0.8598, test_loss: 0.9151, test_f1: 0.5420
 epoch: 15, train_loss: 0.8277, test_loss: 0.9888, test_f1: 0.5472
 epoch: 16, train_loss: 0.8342, test_loss: 0.9063, test_f1: 0.5167
 epoch: 17, train_loss: 0.8060, test_loss: 0.9227, test_f1: 0.5677
 epoch: 18, train_loss: 0.8195, test_loss: 1.0034, test_f1: 0.5201
 epoch: 19, train_loss: 0.8002, test_loss: 1.0404, test_f1: 0.5635
 epoch: 20, train_loss: 0.8010, test_loss: 0.9513, test_f1: 0.5672
 epoch: 21, train_loss: 0.7921, test_loss: 0.9376, test_f1: 0.5542
 epoch: 22, train_loss: 0.7899, test_loss: 1.0829, test_f1: 0.5538
 epoch: 23, train_loss: 0.7771, test_loss: 1.0183, test_f1: 0.5068
 epoch: 24, train_loss: 0.7862, test_loss: 0.9670, test_f1: 0.5963
 epoch: 25, train_loss: 0.7715, test_loss: 0.9274, test_f1: 0.6085
 epoch: 26, train_loss: 0.7619, test_loss: 0.9022, test_f1: 0.5891
 epoch: 27, train_loss: 0.7468, test_loss: 0.9865, test_f1: 0.5654
 epoch: 28, train_loss: 0.7422, test_loss: 0.8400, test_f1: 0.5952
 epoch: 29, train_loss: 0.7513, test_loss: 1.2403, test_f1: 0.5176
 epoch: 30, train_loss: 0.7563, test_loss: 1.0214, test_f1: 0.5471
 epoch: 31, train_loss: 0.7386, test_loss: 0.9492, test_f1: 0.5238
 epoch: 32, train_loss: 0.7404, test_loss: 0.9428, test_f1: 0.5853
 epoch: 33, train_loss: 0.7363, test_loss: 0.9216, test_f1: 0.6280
 epoch: 34, train_loss: 0.7423, test_loss: 0.9778, test_f1: 0.5874
 epoch: 35, train_loss: 0.7288, test_loss: 0.9908, test_f1: 0.5914
 epoch: 36, train_loss: 0.7247, test_loss: 0.9101, test_f1: 0.5690
 epoch: 37, train_loss: 0.7126, test_loss: 0.9340, test_f1: 0.5854
 epoch: 38, train_loss: 0.7038, test_loss: 0.9540, test_f1: 0.6127
 epoch: 39, train_loss: 0.6802, test_loss: 1.0191, test_f1: 0.6228
 epoch: 40, train_loss: 0.6980, test_loss: 1.0062, test_f1: 0.6370
 epoch: 41, train_loss: 0.6936, test_loss: 0.9300, test_f1: 0.6063
 epoch: 42, train_loss: 0.7097, test_loss: 0.9275, test_f1: 0.5685
 epoch: 43, train_loss: 0.7056, test_loss: 0.9917, test_f1: 0.6028
 epoch: 44, train_loss: 0.6882, test_loss: 0.8851, test_f1: 0.6156
 epoch: 45, train_loss: 0.6772, test_loss: 0.9926, test_f1: 0.5948
 epoch: 46, train_loss: 0.6701, test_loss: 1.0494, test_f1: 0.6098
 epoch: 47, train_loss: 0.6568, test_loss: 0.9061, test_f1: 0.6255
 epoch: 48, train_loss: 0.6619, test_loss: 1.0113, test_f1: 0.6131
 epoch: 49, train_loss: 0.6638, test_loss: 1.0431, test_f1: 0.5978
 epoch: 50, train_loss: 0.6510, test_loss: 1.1191, test_f1: 0.6181
 epoch: 51, train_loss: 0.6307, test_loss: 0.9427, test_f1: 0.6188
 epoch: 52, train_loss: 0.5939, test_loss: 0.9893, test_f1: 0.6462
 epoch: 53, train_loss: 0.5812, test_loss: 1.0393, test_f1: 0.6495
 epoch: 54, train_loss: 0.5798, test_loss: 0.9536, test_f1: 0.6665
 epoch: 55, train_loss: 0.5776, test_loss: 1.0862, test_f1: 0.6391
 epoch: 56, train_loss: 0.5588, test_loss: 0.9689, test_f1: 0.6445
 epoch: 57, train_loss: 0.5650, test_loss: 1.0319, test_f1: 0.6152
 epoch: 58, train_loss: 0.5579, test_loss: 1.0721, test_f1: 0.6406
 epoch: 59, train_loss: 0.5589, test_loss: 1.0445, test_f1: 0.6432
 epoch: 60, train_loss: 0.5494, test_loss: 1.0409, test_f1: 0.6488
 epoch: 61, train_loss: 0.5407, test_loss: 1.1409, test_f1: 0.6391
 epoch: 62, train_loss: 0.5482, test_loss: 1.0782, test_f1: 0.6416
 epoch: 63, train_loss: 0.5286, test_loss: 1.0505, test_f1: 0.6106
 epoch: 64, train_loss: 0.5236, test_loss: 1.0378, test_f1: 0.6691
 epoch: 65, train_loss: 0.5155, test_loss: 1.1313, test_f1: 0.6061
 epoch: 66, train_loss: 0.5268, test_loss: 0.9257, test_f1: 0.6341
 epoch: 67, train_loss: 0.5153, test_loss: 1.1146, test_f1: 0.6706
 epoch: 68, train_loss: 0.5324, test_loss: 1.0786, test_f1: 0.6523
 epoch: 69, train_loss: 0.5269, test_loss: 1.0229, test_f1: 0.6459
 epoch: 70, train_loss: 0.5145, test_loss: 1.1438, test_f1: 0.6400
 epoch: 71, train_loss: 0.5200, test_loss: 1.0906, test_f1: 0.6702
 epoch: 72, train_loss: 0.5210, test_loss: 1.2496, test_f1: 0.6037
 epoch: 73, train_loss: 0.5182, test_loss: 1.0934, test_f1: 0.6283
 epoch: 74, train_loss: 0.5085, test_loss: 1.1220, test_f1: 0.6625
 epoch: 75, train_loss: 0.5046, test_loss: 1.1212, test_f1: 0.6630
 epoch: 76, train_loss: 0.4997, test_loss: 1.1764, test_f1: 0.6323
 epoch: 77, train_loss: 0.4908, test_loss: 1.1422, test_f1: 0.6490
 epoch: 78, train_loss: 0.4839, test_loss: 1.1815, test_f1: 0.6470
 epoch: 79, train_loss: 0.4849, test_loss: 1.2050, test_f1: 0.6371
 epoch: 80, train_loss: 0.4835, test_loss: 1.2156, test_f1: 0.6859
 epoch: 81, train_loss: 0.4778, test_loss: 1.0938, test_f1: 0.6138
 epoch: 82, train_loss: 0.4978, test_loss: 1.0305, test_f1: 0.6680
 epoch: 83, train_loss: 0.4807, test_loss: 1.2165, test_f1: 0.6577
 epoch: 84, train_loss: 0.4443, test_loss: 1.2031, test_f1: 0.6896
 epoch: 85, train_loss: 0.4700, test_loss: 1.2242, test_f1: 0.6518
 epoch: 86, train_loss: 0.4747, test_loss: 1.1139, test_f1: 0.6716
 epoch: 87, train_loss: 0.4767, test_loss: 1.3018, test_f1: 0.6437
 epoch: 88, train_loss: 0.4509, test_loss: 1.2127, test_f1: 0.6676
 epoch: 89, train_loss: 0.4329, test_loss: 1.2687, test_f1: 0.6195
 epoch: 90, train_loss: 0.4474, test_loss: 1.3251, test_f1: 0.6483
 epoch: 91, train_loss: 0.4499, test_loss: 1.2179, test_f1: 0.6681
 epoch: 92, train_loss: 0.4800, test_loss: 1.1721, test_f1: 0.6712
 epoch: 93, train_loss: 0.4724, test_loss: 1.3282, test_f1: 0.6566
 epoch: 94, train_loss: 0.4523, test_loss: 1.2178, test_f1: 0.6495
 epoch: 95, train_loss: 0.4497, test_loss: 1.1772, test_f1: 0.6466
 epoch: 96, train_loss: 0.4255, test_loss: 1.4142, test_f1: 0.6007
 epoch: 97, train_loss: 0.4448, test_loss: 1.2908, test_f1: 0.6757
 epoch: 98, train_loss: 0.4568, test_loss: 1.2105, test_f1: 0.6351
 epoch: 99, train_loss: 0.4536, test_loss: 1.2452, test_f1: 0.6302
##################ITERATION #6 ****************************************
 epoch: 0, train_loss: 1.2812, test_loss: 1.2095, test_f1: 0.3393
 epoch: 1, train_loss: 1.0307, test_loss: 1.0197, test_f1: 0.4753
 epoch: 2, train_loss: 0.9842, test_loss: 0.9711, test_f1: 0.5026
 epoch: 3, train_loss: 0.9536, test_loss: 0.9476, test_f1: 0.5059
 epoch: 4, train_loss: 0.9337, test_loss: 0.9175, test_f1: 0.5352
 epoch: 5, train_loss: 0.9396, test_loss: 0.8993, test_f1: 0.5008
 epoch: 6, train_loss: 0.9271, test_loss: 0.9293, test_f1: 0.5073
 epoch: 7, train_loss: 0.9214, test_loss: 1.0221, test_f1: 0.4750
 epoch: 8, train_loss: 0.9022, test_loss: 0.9178, test_f1: 0.5225
 epoch: 9, train_loss: 0.9066, test_loss: 1.0280, test_f1: 0.4620
 epoch: 10, train_loss: 0.8826, test_loss: 0.9400, test_f1: 0.4784
 epoch: 11, train_loss: 0.9089, test_loss: 0.8745, test_f1: 0.5649
 epoch: 12, train_loss: 0.8668, test_loss: 0.9143, test_f1: 0.5348
 epoch: 13, train_loss: 0.8585, test_loss: 0.9189, test_f1: 0.5012
 epoch: 14, train_loss: 0.8430, test_loss: 0.9229, test_f1: 0.5062
 epoch: 15, train_loss: 0.8492, test_loss: 0.9460, test_f1: 0.5599
 epoch: 16, train_loss: 0.8339, test_loss: 1.0372, test_f1: 0.5466
 epoch: 17, train_loss: 0.8040, test_loss: 0.9638, test_f1: 0.5558
 epoch: 18, train_loss: 0.8161, test_loss: 0.9239, test_f1: 0.5904
 epoch: 19, train_loss: 0.8133, test_loss: 0.8928, test_f1: 0.5677
 epoch: 20, train_loss: 0.8019, test_loss: 0.9816, test_f1: 0.5364
 epoch: 21, train_loss: 0.7940, test_loss: 0.8555, test_f1: 0.5598
 epoch: 22, train_loss: 0.7904, test_loss: 0.9094, test_f1: 0.5231
 epoch: 23, train_loss: 0.7772, test_loss: 0.9475, test_f1: 0.5458
 epoch: 24, train_loss: 0.7647, test_loss: 0.9159, test_f1: 0.5661
 epoch: 25, train_loss: 0.7557, test_loss: 0.8559, test_f1: 0.6034
 epoch: 26, train_loss: 0.7444, test_loss: 1.0071, test_f1: 0.5866
 epoch: 27, train_loss: 0.7466, test_loss: 0.9543, test_f1: 0.5682
 epoch: 28, train_loss: 0.7398, test_loss: 0.8979, test_f1: 0.5917
 epoch: 29, train_loss: 0.7368, test_loss: 1.0040, test_f1: 0.5392
 epoch: 30, train_loss: 0.7692, test_loss: 0.9447, test_f1: 0.5625
 epoch: 31, train_loss: 0.7241, test_loss: 0.9603, test_f1: 0.5397
 epoch: 32, train_loss: 0.7334, test_loss: 0.9050, test_f1: 0.5676
 epoch: 33, train_loss: 0.7047, test_loss: 0.9825, test_f1: 0.5440
 epoch: 34, train_loss: 0.7042, test_loss: 0.9506, test_f1: 0.5594
 epoch: 35, train_loss: 0.7141, test_loss: 1.0076, test_f1: 0.5743
 epoch: 36, train_loss: 0.7055, test_loss: 0.9520, test_f1: 0.6010
 epoch: 37, train_loss: 0.6822, test_loss: 0.9302, test_f1: 0.6154
 epoch: 38, train_loss: 0.6971, test_loss: 1.0122, test_f1: 0.5429
 epoch: 39, train_loss: 0.6763, test_loss: 1.0238, test_f1: 0.5987
 epoch: 40, train_loss: 0.6784, test_loss: 0.9279, test_f1: 0.6110
 epoch: 41, train_loss: 0.6807, test_loss: 0.9871, test_f1: 0.5628
 epoch: 42, train_loss: 0.6718, test_loss: 0.9739, test_f1: 0.5871
 epoch: 43, train_loss: 0.6715, test_loss: 0.9955, test_f1: 0.5787
 epoch: 44, train_loss: 0.6799, test_loss: 1.1922, test_f1: 0.5507
 epoch: 45, train_loss: 0.6697, test_loss: 1.1316, test_f1: 0.5511
 epoch: 46, train_loss: 0.6379, test_loss: 1.0321, test_f1: 0.5969
 epoch: 47, train_loss: 0.6450, test_loss: 0.9421, test_f1: 0.5963
 epoch: 48, train_loss: 0.6581, test_loss: 0.9673, test_f1: 0.6196
 epoch: 49, train_loss: 0.6357, test_loss: 0.9302, test_f1: 0.6086
 epoch: 50, train_loss: 0.6587, test_loss: 1.1864, test_f1: 0.5452
 epoch: 51, train_loss: 0.6118, test_loss: 0.9703, test_f1: 0.6012
 epoch: 52, train_loss: 0.5866, test_loss: 0.9848, test_f1: 0.6362
 epoch: 53, train_loss: 0.5790, test_loss: 0.9444, test_f1: 0.5946
 epoch: 54, train_loss: 0.5832, test_loss: 1.0258, test_f1: 0.6454
 epoch: 55, train_loss: 0.5656, test_loss: 1.0434, test_f1: 0.6203
 epoch: 56, train_loss: 0.5585, test_loss: 1.0311, test_f1: 0.6262
 epoch: 57, train_loss: 0.5674, test_loss: 0.9230, test_f1: 0.6655
 epoch: 58, train_loss: 0.5527, test_loss: 1.0093, test_f1: 0.6211
 epoch: 59, train_loss: 0.5469, test_loss: 1.1018, test_f1: 0.6266
 epoch: 60, train_loss: 0.5339, test_loss: 1.1559, test_f1: 0.6455
 epoch: 61, train_loss: 0.5412, test_loss: 1.0083, test_f1: 0.6381
 epoch: 62, train_loss: 0.5481, test_loss: 1.1359, test_f1: 0.6164
 epoch: 63, train_loss: 0.5393, test_loss: 1.0655, test_f1: 0.6367
 epoch: 64, train_loss: 0.5408, test_loss: 1.1503, test_f1: 0.6262
 epoch: 65, train_loss: 0.5464, test_loss: 1.2144, test_f1: 0.6219
 epoch: 66, train_loss: 0.5325, test_loss: 1.0069, test_f1: 0.6297
 epoch: 67, train_loss: 0.5114, test_loss: 1.2102, test_f1: 0.6269
 epoch: 68, train_loss: 0.5292, test_loss: 1.1447, test_f1: 0.5886
 epoch: 69, train_loss: 0.5136, test_loss: 1.1802, test_f1: 0.6267
 epoch: 70, train_loss: 0.5005, test_loss: 1.2979, test_f1: 0.6333
 epoch: 71, train_loss: 0.4994, test_loss: 1.1860, test_f1: 0.6485
 epoch: 72, train_loss: 0.5059, test_loss: 1.2122, test_f1: 0.6067
 epoch: 73, train_loss: 0.4991, test_loss: 1.2145, test_f1: 0.6282
 epoch: 74, train_loss: 0.5117, test_loss: 1.2710, test_f1: 0.6179
 epoch: 75, train_loss: 0.4905, test_loss: 1.2999, test_f1: 0.6162
 epoch: 76, train_loss: 0.5403, test_loss: 1.0879, test_f1: 0.6506
 epoch: 77, train_loss: 0.4899, test_loss: 1.3052, test_f1: 0.6302
 epoch: 78, train_loss: 0.4858, test_loss: 1.2312, test_f1: 0.6307
 epoch: 79, train_loss: 0.4796, test_loss: 1.1618, test_f1: 0.6143
 epoch: 80, train_loss: 0.4946, test_loss: 1.1472, test_f1: 0.6326
 epoch: 81, train_loss: 0.4896, test_loss: 1.3410, test_f1: 0.6086
 epoch: 82, train_loss: 0.4939, test_loss: 1.3762, test_f1: 0.6418
 epoch: 83, train_loss: 0.4902, test_loss: 1.2716, test_f1: 0.6341
 epoch: 84, train_loss: 0.4786, test_loss: 1.2615, test_f1: 0.6446
 epoch: 85, train_loss: 0.4683, test_loss: 1.1779, test_f1: 0.6538
 epoch: 86, train_loss: 0.4707, test_loss: 1.2306, test_f1: 0.6202
 epoch: 87, train_loss: 0.4858, test_loss: 1.2147, test_f1: 0.6640
 epoch: 88, train_loss: 0.4811, test_loss: 1.3050, test_f1: 0.6241
 epoch: 89, train_loss: 0.4788, test_loss: 1.2535, test_f1: 0.6215
 epoch: 90, train_loss: 0.4553, test_loss: 1.2586, test_f1: 0.6175
 epoch: 91, train_loss: 0.4692, test_loss: 1.1739, test_f1: 0.6172
 epoch: 92, train_loss: 0.4419, test_loss: 1.2215, test_f1: 0.6332
 epoch: 93, train_loss: 0.4546, test_loss: 1.2704, test_f1: 0.6466
 epoch: 94, train_loss: 0.4525, test_loss: 1.3603, test_f1: 0.6391
 epoch: 95, train_loss: 0.4577, test_loss: 1.3238, test_f1: 0.6438
 epoch: 96, train_loss: 0.4542, test_loss: 1.2623, test_f1: 0.6391
 epoch: 97, train_loss: 0.4405, test_loss: 1.2365, test_f1: 0.6417
 epoch: 98, train_loss: 0.4518, test_loss: 1.3285, test_f1: 0.6497
 epoch: 99, train_loss: 0.4315, test_loss: 1.3150, test_f1: 0.6578
##################ITERATION #7 ****************************************
 epoch: 0, train_loss: 1.3166, test_loss: 1.2760, test_f1: 0.3204
 epoch: 1, train_loss: 1.0548, test_loss: 0.9839, test_f1: 0.4455
 epoch: 2, train_loss: 0.9834, test_loss: 1.0060, test_f1: 0.4670
 epoch: 3, train_loss: 0.9607, test_loss: 0.9454, test_f1: 0.4691
 epoch: 4, train_loss: 0.9309, test_loss: 0.9002, test_f1: 0.4898
 epoch: 5, train_loss: 0.9160, test_loss: 1.0442, test_f1: 0.4496
 epoch: 6, train_loss: 0.9164, test_loss: 1.0215, test_f1: 0.5047
 epoch: 7, train_loss: 0.8890, test_loss: 0.9558, test_f1: 0.5382
 epoch: 8, train_loss: 0.8867, test_loss: 0.9709, test_f1: 0.5405
 epoch: 9, train_loss: 0.8812, test_loss: 0.9918, test_f1: 0.5559
 epoch: 10, train_loss: 0.8587, test_loss: 0.9275, test_f1: 0.5425
 epoch: 11, train_loss: 0.8505, test_loss: 0.9605, test_f1: 0.5557
 epoch: 12, train_loss: 0.8251, test_loss: 0.9355, test_f1: 0.5413
 epoch: 13, train_loss: 0.8194, test_loss: 0.9546, test_f1: 0.5929
 epoch: 14, train_loss: 0.8184, test_loss: 0.9257, test_f1: 0.5617
 epoch: 15, train_loss: 0.8010, test_loss: 0.9903, test_f1: 0.5368
 epoch: 16, train_loss: 0.8229, test_loss: 0.9530, test_f1: 0.5862
 epoch: 17, train_loss: 0.8182, test_loss: 1.0636, test_f1: 0.5201
 epoch: 18, train_loss: 0.8121, test_loss: 0.9368, test_f1: 0.5832
 epoch: 19, train_loss: 0.7896, test_loss: 0.9809, test_f1: 0.5716
 epoch: 20, train_loss: 0.7787, test_loss: 0.9638, test_f1: 0.6060
 epoch: 21, train_loss: 0.7665, test_loss: 0.9298, test_f1: 0.5711
 epoch: 22, train_loss: 0.7550, test_loss: 0.9551, test_f1: 0.5967
 epoch: 23, train_loss: 0.7854, test_loss: 0.9431, test_f1: 0.5507
 epoch: 24, train_loss: 0.7612, test_loss: 0.8980, test_f1: 0.5974
 epoch: 25, train_loss: 0.7439, test_loss: 1.0109, test_f1: 0.5724
 epoch: 26, train_loss: 0.7150, test_loss: 0.8907, test_f1: 0.5953
 epoch: 27, train_loss: 0.7092, test_loss: 1.0030, test_f1: 0.6003
 epoch: 28, train_loss: 0.7483, test_loss: 1.0153, test_f1: 0.6130
 epoch: 29, train_loss: 0.7267, test_loss: 0.9300, test_f1: 0.6001
 epoch: 30, train_loss: 0.7199, test_loss: 0.9230, test_f1: 0.5918
 epoch: 31, train_loss: 0.6973, test_loss: 1.0053, test_f1: 0.6119
 epoch: 32, train_loss: 0.6947, test_loss: 0.9285, test_f1: 0.6079
 epoch: 33, train_loss: 0.6876, test_loss: 0.9641, test_f1: 0.6086
 epoch: 34, train_loss: 0.6989, test_loss: 1.0461, test_f1: 0.5996
 epoch: 35, train_loss: 0.6770, test_loss: 0.9542, test_f1: 0.6076
 epoch: 36, train_loss: 0.6799, test_loss: 0.9325, test_f1: 0.6050
 epoch: 37, train_loss: 0.6796, test_loss: 0.9639, test_f1: 0.6259
 epoch: 38, train_loss: 0.6695, test_loss: 1.1714, test_f1: 0.5772
 epoch: 39, train_loss: 0.6552, test_loss: 0.9904, test_f1: 0.5866
 epoch: 40, train_loss: 0.6892, test_loss: 1.0430, test_f1: 0.5400
 epoch: 41, train_loss: 0.6392, test_loss: 1.0197, test_f1: 0.5830
 epoch: 42, train_loss: 0.6594, test_loss: 0.9815, test_f1: 0.5755
 epoch: 43, train_loss: 0.6333, test_loss: 0.9700, test_f1: 0.5908
 epoch: 44, train_loss: 0.6251, test_loss: 0.9593, test_f1: 0.6255
 epoch: 45, train_loss: 0.6337, test_loss: 1.0545, test_f1: 0.6234
 epoch: 46, train_loss: 0.6301, test_loss: 0.9697, test_f1: 0.5829
 epoch: 47, train_loss: 0.6403, test_loss: 1.1663, test_f1: 0.5730
 epoch: 48, train_loss: 0.6500, test_loss: 0.8911, test_f1: 0.6397
 epoch: 49, train_loss: 0.6418, test_loss: 1.0422, test_f1: 0.6265
 epoch: 50, train_loss: 0.6277, test_loss: 0.8469, test_f1: 0.6219
 epoch: 51, train_loss: 0.5831, test_loss: 0.9668, test_f1: 0.6433
 epoch: 52, train_loss: 0.5752, test_loss: 0.9736, test_f1: 0.6176
 epoch: 53, train_loss: 0.5512, test_loss: 0.9585, test_f1: 0.6203
 epoch: 54, train_loss: 0.5378, test_loss: 0.9652, test_f1: 0.6657
 epoch: 55, train_loss: 0.5377, test_loss: 0.9428, test_f1: 0.6528
 epoch: 56, train_loss: 0.5478, test_loss: 1.0024, test_f1: 0.6479
 epoch: 57, train_loss: 0.5247, test_loss: 1.0067, test_f1: 0.6578
 epoch: 58, train_loss: 0.5274, test_loss: 0.9623, test_f1: 0.6767
 epoch: 59, train_loss: 0.5365, test_loss: 1.0190, test_f1: 0.6571
 epoch: 60, train_loss: 0.5222, test_loss: 1.1716, test_f1: 0.6319
 epoch: 61, train_loss: 0.5244, test_loss: 0.9792, test_f1: 0.6769
 epoch: 62, train_loss: 0.5269, test_loss: 1.0094, test_f1: 0.6418
 epoch: 63, train_loss: 0.5184, test_loss: 1.0896, test_f1: 0.6736
 epoch: 64, train_loss: 0.5062, test_loss: 1.0300, test_f1: 0.6305
 epoch: 65, train_loss: 0.5057, test_loss: 1.0771, test_f1: 0.6638
 epoch: 66, train_loss: 0.4998, test_loss: 1.0049, test_f1: 0.6545
 epoch: 67, train_loss: 0.5031, test_loss: 1.0412, test_f1: 0.6662
 epoch: 68, train_loss: 0.5027, test_loss: 1.0067, test_f1: 0.6601
 epoch: 69, train_loss: 0.4933, test_loss: 1.0270, test_f1: 0.6628
 epoch: 70, train_loss: 0.4836, test_loss: 1.0577, test_f1: 0.6405
 epoch: 71, train_loss: 0.5093, test_loss: 1.1279, test_f1: 0.6445
 epoch: 72, train_loss: 0.4968, test_loss: 1.1416, test_f1: 0.6373
 epoch: 73, train_loss: 0.5048, test_loss: 1.1188, test_f1: 0.6544
 epoch: 74, train_loss: 0.4972, test_loss: 1.1070, test_f1: 0.6432
 epoch: 75, train_loss: 0.4775, test_loss: 1.1902, test_f1: 0.6294
 epoch: 76, train_loss: 0.4793, test_loss: 0.9824, test_f1: 0.6291
 epoch: 77, train_loss: 0.4877, test_loss: 0.9143, test_f1: 0.6631
 epoch: 78, train_loss: 0.4763, test_loss: 1.0028, test_f1: 0.6520
 epoch: 79, train_loss: 0.4749, test_loss: 1.1822, test_f1: 0.6456
 epoch: 80, train_loss: 0.4970, test_loss: 1.0302, test_f1: 0.6781
 epoch: 81, train_loss: 0.4523, test_loss: 0.9796, test_f1: 0.6656
 epoch: 82, train_loss: 0.4754, test_loss: 1.0780, test_f1: 0.6722
 epoch: 83, train_loss: 0.4712, test_loss: 1.2202, test_f1: 0.6327
 epoch: 84, train_loss: 0.4715, test_loss: 1.0902, test_f1: 0.6722
 epoch: 85, train_loss: 0.4720, test_loss: 1.0456, test_f1: 0.6451
 epoch: 86, train_loss: 0.4653, test_loss: 1.0879, test_f1: 0.6519
 epoch: 87, train_loss: 0.4465, test_loss: 1.0772, test_f1: 0.6703
 epoch: 88, train_loss: 0.4583, test_loss: 1.0468, test_f1: 0.6642
 epoch: 89, train_loss: 0.4405, test_loss: 1.3002, test_f1: 0.6350
 epoch: 90, train_loss: 0.4212, test_loss: 1.2699, test_f1: 0.6590
 epoch: 91, train_loss: 0.4463, test_loss: 1.2008, test_f1: 0.6405
 epoch: 92, train_loss: 0.4441, test_loss: 1.1348, test_f1: 0.6671
 epoch: 93, train_loss: 0.4456, test_loss: 1.2298, test_f1: 0.6249
 epoch: 94, train_loss: 0.4611, test_loss: 1.1398, test_f1: 0.6140
 epoch: 95, train_loss: 0.4393, test_loss: 1.1277, test_f1: 0.6410
 epoch: 96, train_loss: 0.4312, test_loss: 0.9389, test_f1: 0.6658
 epoch: 97, train_loss: 0.4357, test_loss: 1.1207, test_f1: 0.6891
 epoch: 98, train_loss: 0.4341, test_loss: 1.1740, test_f1: 0.6541
 epoch: 99, train_loss: 0.4304, test_loss: 1.2649, test_f1: 0.6534
##################ITERATION #8 ****************************************
 epoch: 0, train_loss: 1.2308, test_loss: 1.1547, test_f1: 0.4207
 epoch: 1, train_loss: 1.0349, test_loss: 1.0636, test_f1: 0.4660
 epoch: 2, train_loss: 0.9823, test_loss: 1.0512, test_f1: 0.4971
 epoch: 3, train_loss: 0.9524, test_loss: 1.0026, test_f1: 0.5120
 epoch: 4, train_loss: 0.9324, test_loss: 0.9650, test_f1: 0.5402
 epoch: 5, train_loss: 0.9297, test_loss: 1.0087, test_f1: 0.4849
 epoch: 6, train_loss: 0.9284, test_loss: 0.9419, test_f1: 0.4950
 epoch: 7, train_loss: 0.9007, test_loss: 1.0154, test_f1: 0.5029
 epoch: 8, train_loss: 0.9040, test_loss: 0.9768, test_f1: 0.5376
 epoch: 9, train_loss: 0.9028, test_loss: 0.8785, test_f1: 0.5780
 epoch: 10, train_loss: 0.8773, test_loss: 0.9322, test_f1: 0.5600
 epoch: 11, train_loss: 0.8576, test_loss: 1.0113, test_f1: 0.5600
 epoch: 12, train_loss: 0.8493, test_loss: 0.9549, test_f1: 0.5224
 epoch: 13, train_loss: 0.8408, test_loss: 1.0221, test_f1: 0.4993
 epoch: 14, train_loss: 0.8294, test_loss: 0.9271, test_f1: 0.5432
 epoch: 15, train_loss: 0.8191, test_loss: 0.9649, test_f1: 0.5675
 epoch: 16, train_loss: 0.8150, test_loss: 0.9657, test_f1: 0.5900
 epoch: 17, train_loss: 0.8037, test_loss: 0.9837, test_f1: 0.6005
 epoch: 18, train_loss: 0.8059, test_loss: 0.9254, test_f1: 0.5844
 epoch: 19, train_loss: 0.8006, test_loss: 0.9659, test_f1: 0.5848
 epoch: 20, train_loss: 0.8164, test_loss: 0.9782, test_f1: 0.5496
 epoch: 21, train_loss: 0.8051, test_loss: 0.8908, test_f1: 0.5717
 epoch: 22, train_loss: 0.7845, test_loss: 0.9071, test_f1: 0.5584
 epoch: 23, train_loss: 0.7701, test_loss: 1.0053, test_f1: 0.5572
 epoch: 24, train_loss: 0.7702, test_loss: 0.9883, test_f1: 0.5870
 epoch: 25, train_loss: 0.7491, test_loss: 0.8981, test_f1: 0.5844
 epoch: 26, train_loss: 0.7350, test_loss: 1.0076, test_f1: 0.5918
 epoch: 27, train_loss: 0.7391, test_loss: 0.9090, test_f1: 0.5865
 epoch: 28, train_loss: 0.7287, test_loss: 0.8551, test_f1: 0.6096
 epoch: 29, train_loss: 0.7227, test_loss: 1.0435, test_f1: 0.5696
 epoch: 30, train_loss: 0.7116, test_loss: 1.0474, test_f1: 0.5868
 epoch: 31, train_loss: 0.7297, test_loss: 0.9578, test_f1: 0.5574
 epoch: 32, train_loss: 0.6958, test_loss: 1.0576, test_f1: 0.5888
 epoch: 33, train_loss: 0.7277, test_loss: 1.0635, test_f1: 0.5991
 epoch: 34, train_loss: 0.7136, test_loss: 1.0627, test_f1: 0.5793
 epoch: 35, train_loss: 0.7045, test_loss: 1.0267, test_f1: 0.6042
 epoch: 36, train_loss: 0.7053, test_loss: 0.9580, test_f1: 0.6176
 epoch: 37, train_loss: 0.7218, test_loss: 1.0010, test_f1: 0.6078
 epoch: 38, train_loss: 0.6710, test_loss: 1.1077, test_f1: 0.6077
 epoch: 39, train_loss: 0.6825, test_loss: 0.9598, test_f1: 0.6054
 epoch: 40, train_loss: 0.6872, test_loss: 0.9748, test_f1: 0.6054
 epoch: 41, train_loss: 0.6632, test_loss: 1.0611, test_f1: 0.5798
 epoch: 42, train_loss: 0.6464, test_loss: 1.0441, test_f1: 0.6161
 epoch: 43, train_loss: 0.6332, test_loss: 1.0845, test_f1: 0.5925
 epoch: 44, train_loss: 0.6138, test_loss: 0.9577, test_f1: 0.6408
 epoch: 45, train_loss: 0.6251, test_loss: 1.0994, test_f1: 0.6041
 epoch: 46, train_loss: 0.6447, test_loss: 1.0981, test_f1: 0.5728
 epoch: 47, train_loss: 0.6541, test_loss: 1.0426, test_f1: 0.6100
 epoch: 48, train_loss: 0.6269, test_loss: 1.0553, test_f1: 0.6115
 epoch: 49, train_loss: 0.5972, test_loss: 1.0109, test_f1: 0.6160
 epoch: 50, train_loss: 0.6136, test_loss: 0.9432, test_f1: 0.5642
 epoch: 51, train_loss: 0.5994, test_loss: 1.0488, test_f1: 0.6380
 epoch: 52, train_loss: 0.5652, test_loss: 1.0747, test_f1: 0.6136
 epoch: 53, train_loss: 0.5437, test_loss: 1.0409, test_f1: 0.6598
 epoch: 54, train_loss: 0.5512, test_loss: 1.0779, test_f1: 0.6123
 epoch: 55, train_loss: 0.5277, test_loss: 1.1059, test_f1: 0.6374
 epoch: 56, train_loss: 0.5375, test_loss: 0.9422, test_f1: 0.6136
 epoch: 57, train_loss: 0.5414, test_loss: 1.1226, test_f1: 0.6489
 epoch: 58, train_loss: 0.5230, test_loss: 1.0036, test_f1: 0.6319
 epoch: 59, train_loss: 0.5169, test_loss: 1.1285, test_f1: 0.6157
 epoch: 60, train_loss: 0.5236, test_loss: 1.0875, test_f1: 0.6341
 epoch: 61, train_loss: 0.4992, test_loss: 1.1071, test_f1: 0.6421
 epoch: 62, train_loss: 0.5051, test_loss: 1.1094, test_f1: 0.6401
 epoch: 63, train_loss: 0.4923, test_loss: 1.1609, test_f1: 0.6336
 epoch: 64, train_loss: 0.4968, test_loss: 1.1900, test_f1: 0.6348
 epoch: 65, train_loss: 0.5103, test_loss: 1.1213, test_f1: 0.6383
 epoch: 66, train_loss: 0.5095, test_loss: 1.0950, test_f1: 0.5978
 epoch: 67, train_loss: 0.5002, test_loss: 1.0370, test_f1: 0.6451
 epoch: 68, train_loss: 0.4915, test_loss: 1.1827, test_f1: 0.6230
 epoch: 69, train_loss: 0.5129, test_loss: 1.1567, test_f1: 0.6173
 epoch: 70, train_loss: 0.4815, test_loss: 1.0935, test_f1: 0.6547
 epoch: 71, train_loss: 0.4917, test_loss: 1.1915, test_f1: 0.6361
 epoch: 72, train_loss: 0.4956, test_loss: 1.2100, test_f1: 0.6116
 epoch: 73, train_loss: 0.4938, test_loss: 1.0871, test_f1: 0.6508
 epoch: 74, train_loss: 0.4881, test_loss: 1.1922, test_f1: 0.6352
 epoch: 75, train_loss: 0.4661, test_loss: 1.2351, test_f1: 0.6128
 epoch: 76, train_loss: 0.4899, test_loss: 1.2102, test_f1: 0.6516
 epoch: 77, train_loss: 0.4633, test_loss: 1.2221, test_f1: 0.6295
 epoch: 78, train_loss: 0.4681, test_loss: 1.2292, test_f1: 0.6349
 epoch: 79, train_loss: 0.4516, test_loss: 1.2091, test_f1: 0.6627
 epoch: 80, train_loss: 0.4390, test_loss: 1.1777, test_f1: 0.6608
 epoch: 81, train_loss: 0.4400, test_loss: 1.1155, test_f1: 0.6384
 epoch: 82, train_loss: 0.4796, test_loss: 1.1797, test_f1: 0.6192
 epoch: 83, train_loss: 0.4462, test_loss: 1.1434, test_f1: 0.6278
 epoch: 84, train_loss: 0.4508, test_loss: 1.1407, test_f1: 0.6434
 epoch: 85, train_loss: 0.4277, test_loss: 1.1290, test_f1: 0.6576
 epoch: 86, train_loss: 0.4392, test_loss: 1.2901, test_f1: 0.6134
 epoch: 87, train_loss: 0.4279, test_loss: 1.2094, test_f1: 0.6744
 epoch: 88, train_loss: 0.4523, test_loss: 1.1159, test_f1: 0.6478
 epoch: 89, train_loss: 0.4426, test_loss: 1.2362, test_f1: 0.6426
 epoch: 90, train_loss: 0.4441, test_loss: 1.3807, test_f1: 0.6497
 epoch: 91, train_loss: 0.4324, test_loss: 1.2131, test_f1: 0.6579
 epoch: 92, train_loss: 0.4290, test_loss: 1.2161, test_f1: 0.6530
 epoch: 93, train_loss: 0.4232, test_loss: 1.2694, test_f1: 0.6244
 epoch: 94, train_loss: 0.4245, test_loss: 1.1809, test_f1: 0.6602
 epoch: 95, train_loss: 0.4341, test_loss: 1.1456, test_f1: 0.6405
 epoch: 96, train_loss: 0.4554, test_loss: 1.0815, test_f1: 0.6374
 epoch: 97, train_loss: 0.4351, test_loss: 1.2307, test_f1: 0.6253
 epoch: 98, train_loss: 0.4585, test_loss: 1.1676, test_f1: 0.6368
 epoch: 99, train_loss: 0.4289, test_loss: 1.0623, test_f1: 0.6162
##################ITERATION #9 ****************************************
 epoch: 0, train_loss: 1.3453, test_loss: 1.8355, test_f1: 0.2703
 epoch: 1, train_loss: 1.0657, test_loss: 1.0002, test_f1: 0.4353
 epoch: 2, train_loss: 1.0119, test_loss: 1.0097, test_f1: 0.4362
 epoch: 3, train_loss: 0.9658, test_loss: 0.9041, test_f1: 0.4983
 epoch: 4, train_loss: 0.9135, test_loss: 0.9559, test_f1: 0.5248
 epoch: 5, train_loss: 0.9138, test_loss: 0.9114, test_f1: 0.5260
 epoch: 6, train_loss: 0.8888, test_loss: 0.9922, test_f1: 0.5009
 epoch: 7, train_loss: 0.8995, test_loss: 0.9856, test_f1: 0.5325
 epoch: 8, train_loss: 0.8672, test_loss: 0.9606, test_f1: 0.5552
 epoch: 9, train_loss: 0.8685, test_loss: 1.0252, test_f1: 0.5004
 epoch: 10, train_loss: 0.8417, test_loss: 0.9039, test_f1: 0.5391
 epoch: 11, train_loss: 0.8369, test_loss: 0.8844, test_f1: 0.5843
 epoch: 12, train_loss: 0.8587, test_loss: 0.8752, test_f1: 0.5465
 epoch: 13, train_loss: 0.8240, test_loss: 0.9970, test_f1: 0.4922
 epoch: 14, train_loss: 0.8260, test_loss: 1.2868, test_f1: 0.4972
 epoch: 15, train_loss: 0.8093, test_loss: 1.0080, test_f1: 0.5845
 epoch: 16, train_loss: 0.7789, test_loss: 0.9666, test_f1: 0.5224
 epoch: 17, train_loss: 0.8197, test_loss: 1.0478, test_f1: 0.5214
 epoch: 18, train_loss: 0.7908, test_loss: 0.8672, test_f1: 0.5960
 epoch: 19, train_loss: 0.7889, test_loss: 0.9799, test_f1: 0.5810
 epoch: 20, train_loss: 0.7729, test_loss: 0.9171, test_f1: 0.5732
 epoch: 21, train_loss: 0.7682, test_loss: 0.9136, test_f1: 0.5604
 epoch: 22, train_loss: 0.7815, test_loss: 0.9596, test_f1: 0.5502
 epoch: 23, train_loss: 0.7683, test_loss: 1.1422, test_f1: 0.5219
 epoch: 24, train_loss: 0.7803, test_loss: 1.0086, test_f1: 0.5593
 epoch: 25, train_loss: 0.7649, test_loss: 0.9606, test_f1: 0.5547
 epoch: 26, train_loss: 0.7535, test_loss: 0.9977, test_f1: 0.5913
 epoch: 27, train_loss: 0.7604, test_loss: 0.8986, test_f1: 0.5947
 epoch: 28, train_loss: 0.7345, test_loss: 0.9610, test_f1: 0.5690
 epoch: 29, train_loss: 0.7166, test_loss: 0.9734, test_f1: 0.5923
 epoch: 30, train_loss: 0.7252, test_loss: 0.9773, test_f1: 0.6220
 epoch: 31, train_loss: 0.7026, test_loss: 1.0823, test_f1: 0.5400
 epoch: 32, train_loss: 0.6981, test_loss: 1.0663, test_f1: 0.6078
 epoch: 33, train_loss: 0.7101, test_loss: 1.1099, test_f1: 0.5790
 epoch: 34, train_loss: 0.7080, test_loss: 1.0303, test_f1: 0.5729
 epoch: 35, train_loss: 0.6886, test_loss: 0.8898, test_f1: 0.6096
 epoch: 36, train_loss: 0.7079, test_loss: 1.0197, test_f1: 0.5858
 epoch: 37, train_loss: 0.7090, test_loss: 1.0416, test_f1: 0.5868
 epoch: 38, train_loss: 0.6781, test_loss: 0.9491, test_f1: 0.5752
 epoch: 39, train_loss: 0.7003, test_loss: 1.0324, test_f1: 0.5886
 epoch: 40, train_loss: 0.6821, test_loss: 0.9950, test_f1: 0.6001
 epoch: 41, train_loss: 0.6952, test_loss: 1.0370, test_f1: 0.5882
 epoch: 42, train_loss: 0.6772, test_loss: 0.9347, test_f1: 0.6373
 epoch: 43, train_loss: 0.6648, test_loss: 1.1351, test_f1: 0.5628
 epoch: 44, train_loss: 0.6823, test_loss: 0.9262, test_f1: 0.6053
 epoch: 45, train_loss: 0.6389, test_loss: 0.9963, test_f1: 0.6760
 epoch: 46, train_loss: 0.6540, test_loss: 1.0402, test_f1: 0.6019
 epoch: 47, train_loss: 0.6431, test_loss: 1.0034, test_f1: 0.6567
 epoch: 48, train_loss: 0.6353, test_loss: 1.1452, test_f1: 0.6020
 epoch: 49, train_loss: 0.6430, test_loss: 1.2447, test_f1: 0.5609
 epoch: 50, train_loss: 0.6428, test_loss: 1.0878, test_f1: 0.6422
 epoch: 51, train_loss: 0.6037, test_loss: 1.1518, test_f1: 0.6626
 epoch: 52, train_loss: 0.5950, test_loss: 1.0282, test_f1: 0.6396
 epoch: 53, train_loss: 0.5587, test_loss: 1.0785, test_f1: 0.6601
 epoch: 54, train_loss: 0.5465, test_loss: 1.0724, test_f1: 0.6457
 epoch: 55, train_loss: 0.5390, test_loss: 0.9829, test_f1: 0.6727
 epoch: 56, train_loss: 0.5295, test_loss: 1.0201, test_f1: 0.6478
 epoch: 57, train_loss: 0.5297, test_loss: 1.1817, test_f1: 0.6399
 epoch: 58, train_loss: 0.5549, test_loss: 1.1375, test_f1: 0.6326
 epoch: 59, train_loss: 0.5210, test_loss: 1.1183, test_f1: 0.6591
 epoch: 60, train_loss: 0.4941, test_loss: 1.1484, test_f1: 0.6378
 epoch: 61, train_loss: 0.5101, test_loss: 1.1894, test_f1: 0.6757
 epoch: 62, train_loss: 0.5182, test_loss: 1.1912, test_f1: 0.6722
 epoch: 63, train_loss: 0.4971, test_loss: 1.2669, test_f1: 0.6471
 epoch: 64, train_loss: 0.4951, test_loss: 1.2978, test_f1: 0.6268
 epoch: 65, train_loss: 0.4950, test_loss: 1.3753, test_f1: 0.5985
 epoch: 66, train_loss: 0.4925, test_loss: 1.2865, test_f1: 0.6580
 epoch: 67, train_loss: 0.5050, test_loss: 1.0896, test_f1: 0.6441
 epoch: 68, train_loss: 0.4944, test_loss: 1.1815, test_f1: 0.6791
 epoch: 69, train_loss: 0.4730, test_loss: 1.2472, test_f1: 0.6357
 epoch: 70, train_loss: 0.4599, test_loss: 1.3531, test_f1: 0.6751
 epoch: 71, train_loss: 0.4759, test_loss: 1.3128, test_f1: 0.6553
 epoch: 72, train_loss: 0.4718, test_loss: 1.3847, test_f1: 0.6591
 epoch: 73, train_loss: 0.4572, test_loss: 1.3939, test_f1: 0.6852
 epoch: 74, train_loss: 0.4653, test_loss: 1.2326, test_f1: 0.6813
 epoch: 75, train_loss: 0.4587, test_loss: 1.2436, test_f1: 0.6986
 epoch: 76, train_loss: 0.4785, test_loss: 1.1927, test_f1: 0.6787
 epoch: 77, train_loss: 0.4538, test_loss: 1.3727, test_f1: 0.6524
 epoch: 78, train_loss: 0.4590, test_loss: 1.3370, test_f1: 0.6760
 epoch: 79, train_loss: 0.4429, test_loss: 1.2456, test_f1: 0.6841
 epoch: 80, train_loss: 0.4302, test_loss: 1.3788, test_f1: 0.6938
 epoch: 81, train_loss: 0.4527, test_loss: 1.5388, test_f1: 0.6588
 epoch: 82, train_loss: 0.4560, test_loss: 1.3325, test_f1: 0.6485
 epoch: 83, train_loss: 0.4511, test_loss: 1.3889, test_f1: 0.6467
 epoch: 84, train_loss: 0.4399, test_loss: 1.2595, test_f1: 0.6691
 epoch: 85, train_loss: 0.4177, test_loss: 1.4733, test_f1: 0.6761
 epoch: 86, train_loss: 0.4194, test_loss: 1.3941, test_f1: 0.6640
 epoch: 87, train_loss: 0.4107, test_loss: 1.5560, test_f1: 0.6715
 epoch: 88, train_loss: 0.4041, test_loss: 1.4594, test_f1: 0.6462
 epoch: 89, train_loss: 0.4128, test_loss: 1.4415, test_f1: 0.6800
 epoch: 90, train_loss: 0.3962, test_loss: 1.6029, test_f1: 0.6405
 epoch: 91, train_loss: 0.4175, test_loss: 1.3738, test_f1: 0.6463
 epoch: 92, train_loss: 0.4337, test_loss: 1.3393, test_f1: 0.6867
 epoch: 93, train_loss: 0.4211, test_loss: 1.4293, test_f1: 0.6686
 epoch: 94, train_loss: 0.4175, test_loss: 1.6672, test_f1: 0.6490
 epoch: 95, train_loss: 0.3995, test_loss: 1.4725, test_f1: 0.6480
 epoch: 96, train_loss: 0.3920, test_loss: 1.4356, test_f1: 0.6828
 epoch: 97, train_loss: 0.3992, test_loss: 1.8030, test_f1: 0.6589
 epoch: 98, train_loss: 0.3976, test_loss: 1.5766, test_f1: 0.6375
 epoch: 99, train_loss: 0.4174, test_loss: 1.5127, test_f1: 0.6564

Training completed in 458.88 seconds
Best F1: 0.7038 at epoch 90
Mean F1 across iterations: 0.6845  0.0110
========================FINAL RESULTS================================
FEGIN weighted F1: 0.7038  0.0110
python main.py --data ltspice_examples --representation component_net --model FEGIN --layers 3 --hiddens 64 --batch_size 128 --lr 0.01 --emb_size 250 --epochs 100 --save_appendix component_net_L3_H64_BS128_LR0.01_E250 --no_val
-----



STDERR:
  File "main.py", line 370, in <module>
    main()
  File "main.py", line 254, in main
    dataset = dataset_class(
  File "/home/philip/projects/ltspice_examples_code_repo/Circuit-Completion-Using-GNNs/component_classification_with_link_prediction_head/evaluation/FEGIN/kernel/circuit_datasets.py", line 15, in __init__
    self.data, self.slices = torch.load(self.processed_paths[0])
  File "/home/philip/.local/lib/python3.8/site-packages/torch/serialization.py", line 1040, in load
    warnings.warn(
  File "/usr/lib/python3.8/warnings.py", line 109, in _showwarnmsg
    sw(msg.message, msg.category, msg.filename, msg.lineno,
  File "main.py", line 47, in warn_with_traceback
    traceback.print_stack(file=log)
/home/philip/projects/ltspice_examples_code_repo/Circuit-Completion-Using-GNNs/component_classification_with_link_prediction_head/evaluation/FEGIN/kernel/circuit_datasets.py:15: FutureWarning: You are using `torch.load` with `weights_only=False` (the current default value), which uses the default pickle module implicitly. It is possible to construct malicious pickle data which will execute arbitrary code during unpickling (See https://github.com/pytorch/pytorch/blob/main/SECURITY.md#untrusted-models for more details). In a future release, the default value for `weights_only` will be flipped to `True`. This limits the functions that could be executed during unpickling. Arbitrary objects will no longer be allowed to be loaded via this mode unless they are explicitly allowlisted by the user via `torch.serialization.add_safe_globals`. We recommend you start setting `weights_only=True` for any use case where you don't have full control of the loaded file. Please open an issue on GitHub for any issues related to this experimental feature.
  self.data, self.slices = torch.load(self.processed_paths[0])
