STDOUT:
Results will be saved in /home/philip/projects/ltspice_examples_code_repo/Circuit-Completion-Using-GNNs/component_classification_with_link_prediction_head/evaluation/FEGIN/results/model_FEGIN_dataset_ltspice_examples
Command line input: python main.py --data ltspice_examples --representation component_pin --model FEGIN --layers 5 --hiddens 16 --batch_size 32 --lr 0.0001 --emb_size 128 --epochs 100 --save_appendix component_pin_L5_H16_BS32_LR0.0001_E128 --no_val
 is saved.
-----
ltspice_examples - FEGIN
Using 5 layers, 16 hidden units, h = 2
Loading component_pin representation dataset
ENTERED
Training FEGIN on component_pin representation
Train: 3560, Test: 848
##################ITERATION #0 ****************************************
 epoch: 0, train_loss: 1.4406, test_loss: 1.4269, test_f1: 0.1017
 epoch: 1, train_loss: 1.4283, test_loss: 1.4186, test_f1: 0.1017
 epoch: 2, train_loss: 1.4175, test_loss: 1.4088, test_f1: 0.1017
 epoch: 3, train_loss: 1.4062, test_loss: 1.3964, test_f1: 0.1017
 epoch: 4, train_loss: 1.3922, test_loss: 1.3827, test_f1: 0.1017
 epoch: 5, train_loss: 1.3747, test_loss: 1.3669, test_f1: 0.1039
 epoch: 6, train_loss: 1.3608, test_loss: 1.3517, test_f1: 0.2145
 epoch: 7, train_loss: 1.3448, test_loss: 1.3419, test_f1: 0.2276
 epoch: 8, train_loss: 1.3356, test_loss: 1.3316, test_f1: 0.2407
 epoch: 9, train_loss: 1.3243, test_loss: 1.3243, test_f1: 0.2385
 epoch: 10, train_loss: 1.3181, test_loss: 1.3167, test_f1: 0.2393
 epoch: 11, train_loss: 1.3111, test_loss: 1.3087, test_f1: 0.2489
 epoch: 12, train_loss: 1.3031, test_loss: 1.2995, test_f1: 0.2446
 epoch: 13, train_loss: 1.2953, test_loss: 1.2882, test_f1: 0.2529
 epoch: 14, train_loss: 1.2863, test_loss: 1.2775, test_f1: 0.2260
 epoch: 15, train_loss: 1.2793, test_loss: 1.2678, test_f1: 0.2286
 epoch: 16, train_loss: 1.2697, test_loss: 1.2566, test_f1: 0.2260
 epoch: 17, train_loss: 1.2672, test_loss: 1.2441, test_f1: 0.2260
 epoch: 18, train_loss: 1.2528, test_loss: 1.2310, test_f1: 0.2260
 epoch: 19, train_loss: 1.2365, test_loss: 1.2158, test_f1: 0.2260
 epoch: 20, train_loss: 1.2291, test_loss: 1.2013, test_f1: 0.3091
 epoch: 21, train_loss: 1.2148, test_loss: 1.1846, test_f1: 0.3510
 epoch: 22, train_loss: 1.2026, test_loss: 1.1648, test_f1: 0.3381
 epoch: 23, train_loss: 1.1816, test_loss: 1.1499, test_f1: 0.3391
 epoch: 24, train_loss: 1.1646, test_loss: 1.1334, test_f1: 0.3429
 epoch: 25, train_loss: 1.1541, test_loss: 1.1220, test_f1: 0.3438
 epoch: 26, train_loss: 1.1443, test_loss: 1.1105, test_f1: 0.3429
 epoch: 27, train_loss: 1.1345, test_loss: 1.1029, test_f1: 0.3438
 epoch: 28, train_loss: 1.1234, test_loss: 1.0967, test_f1: 0.3419
 epoch: 29, train_loss: 1.1200, test_loss: 1.0896, test_f1: 0.3438
 epoch: 30, train_loss: 1.1168, test_loss: 1.0868, test_f1: 0.3399
 epoch: 31, train_loss: 1.1062, test_loss: 1.0822, test_f1: 0.3438
 epoch: 32, train_loss: 1.1076, test_loss: 1.0818, test_f1: 0.3409
 epoch: 33, train_loss: 1.0997, test_loss: 1.0816, test_f1: 0.3399
 epoch: 34, train_loss: 1.0938, test_loss: 1.0772, test_f1: 0.3399
 epoch: 35, train_loss: 1.0852, test_loss: 1.0791, test_f1: 0.3390
 epoch: 36, train_loss: 1.0820, test_loss: 1.0745, test_f1: 0.3392
 epoch: 37, train_loss: 1.0785, test_loss: 1.0673, test_f1: 0.3387
 epoch: 38, train_loss: 1.0717, test_loss: 1.0643, test_f1: 0.3421
 epoch: 39, train_loss: 1.0701, test_loss: 1.0620, test_f1: 0.3425
 epoch: 40, train_loss: 1.0714, test_loss: 1.0611, test_f1: 0.3522
 epoch: 41, train_loss: 1.0603, test_loss: 1.0597, test_f1: 0.3445
 epoch: 42, train_loss: 1.0573, test_loss: 1.0485, test_f1: 0.3445
 epoch: 43, train_loss: 1.0534, test_loss: 1.0671, test_f1: 0.3416
 epoch: 44, train_loss: 1.0517, test_loss: 1.0448, test_f1: 0.3471
 epoch: 45, train_loss: 1.0543, test_loss: 1.0465, test_f1: 0.3533
 epoch: 46, train_loss: 1.0489, test_loss: 1.0473, test_f1: 0.3994
 epoch: 47, train_loss: 1.0462, test_loss: 1.0375, test_f1: 0.4087
 epoch: 48, train_loss: 1.0388, test_loss: 1.0490, test_f1: 0.3955
 epoch: 49, train_loss: 1.0385, test_loss: 1.0528, test_f1: 0.4195
 epoch: 50, train_loss: 1.0345, test_loss: 1.0415, test_f1: 0.4290
 epoch: 51, train_loss: 1.0391, test_loss: 1.0457, test_f1: 0.4252
 epoch: 52, train_loss: 1.0373, test_loss: 1.0483, test_f1: 0.4138
 epoch: 53, train_loss: 1.0275, test_loss: 1.0373, test_f1: 0.4373
 epoch: 54, train_loss: 1.0318, test_loss: 1.0415, test_f1: 0.4227
 epoch: 55, train_loss: 1.0280, test_loss: 1.0579, test_f1: 0.4152
 epoch: 56, train_loss: 1.0336, test_loss: 1.0431, test_f1: 0.4334
 epoch: 57, train_loss: 1.0390, test_loss: 1.0396, test_f1: 0.4266
 epoch: 58, train_loss: 1.0278, test_loss: 1.0382, test_f1: 0.4472
 epoch: 59, train_loss: 1.0245, test_loss: 1.0484, test_f1: 0.4212
 epoch: 60, train_loss: 1.0229, test_loss: 1.0356, test_f1: 0.4415
 epoch: 61, train_loss: 1.0313, test_loss: 1.0371, test_f1: 0.4243
 epoch: 62, train_loss: 1.0248, test_loss: 1.0404, test_f1: 0.4251
 epoch: 63, train_loss: 1.0221, test_loss: 1.0453, test_f1: 0.4378
 epoch: 64, train_loss: 1.0253, test_loss: 1.0449, test_f1: 0.4352
 epoch: 65, train_loss: 1.0193, test_loss: 1.0334, test_f1: 0.4380
 epoch: 66, train_loss: 1.0179, test_loss: 1.0427, test_f1: 0.4509
 epoch: 67, train_loss: 1.0223, test_loss: 1.0386, test_f1: 0.4515
 epoch: 68, train_loss: 1.0164, test_loss: 1.0452, test_f1: 0.4379
 epoch: 69, train_loss: 1.0195, test_loss: 1.0530, test_f1: 0.4164
 epoch: 70, train_loss: 1.0104, test_loss: 1.0357, test_f1: 0.4518
 epoch: 71, train_loss: 1.0126, test_loss: 1.0338, test_f1: 0.4605
 epoch: 72, train_loss: 1.0140, test_loss: 1.0309, test_f1: 0.4670
 epoch: 73, train_loss: 1.0147, test_loss: 1.0324, test_f1: 0.4547
 epoch: 74, train_loss: 1.0061, test_loss: 1.0365, test_f1: 0.4419
 epoch: 75, train_loss: 1.0194, test_loss: 1.0418, test_f1: 0.4595
 epoch: 76, train_loss: 1.0121, test_loss: 1.0348, test_f1: 0.4615
 epoch: 77, train_loss: 1.0022, test_loss: 1.0393, test_f1: 0.4457
 epoch: 78, train_loss: 1.0035, test_loss: 1.0361, test_f1: 0.4454
 epoch: 79, train_loss: 1.0072, test_loss: 1.0351, test_f1: 0.4524
 epoch: 80, train_loss: 1.0057, test_loss: 1.0405, test_f1: 0.4559
 epoch: 81, train_loss: 1.0009, test_loss: 1.0357, test_f1: 0.4692
 epoch: 82, train_loss: 1.0036, test_loss: 1.0472, test_f1: 0.4613
 epoch: 83, train_loss: 1.0029, test_loss: 1.0361, test_f1: 0.4584
 epoch: 84, train_loss: 0.9954, test_loss: 1.0366, test_f1: 0.4612
 epoch: 85, train_loss: 1.0089, test_loss: 1.0389, test_f1: 0.4572
 epoch: 86, train_loss: 0.9958, test_loss: 1.0334, test_f1: 0.4555
 epoch: 87, train_loss: 1.0052, test_loss: 1.0362, test_f1: 0.4541
 epoch: 88, train_loss: 0.9925, test_loss: 1.0384, test_f1: 0.4689
 epoch: 89, train_loss: 1.0046, test_loss: 1.0377, test_f1: 0.4679
 epoch: 90, train_loss: 1.0013, test_loss: 1.0375, test_f1: 0.4698
 epoch: 91, train_loss: 0.9874, test_loss: 1.0356, test_f1: 0.4630
 epoch: 92, train_loss: 0.9947, test_loss: 1.0392, test_f1: 0.4708
 epoch: 93, train_loss: 0.9945, test_loss: 1.0434, test_f1: 0.4652
 epoch: 94, train_loss: 0.9981, test_loss: 1.0276, test_f1: 0.4697
 epoch: 95, train_loss: 0.9917, test_loss: 1.0424, test_f1: 0.4739
 epoch: 96, train_loss: 0.9879, test_loss: 1.0265, test_f1: 0.4733
 epoch: 97, train_loss: 0.9936, test_loss: 1.0419, test_f1: 0.4717
 epoch: 98, train_loss: 0.9995, test_loss: 1.0196, test_f1: 0.4780
 epoch: 99, train_loss: 0.9910, test_loss: 1.0197, test_f1: 0.4732
##################ITERATION #1 ****************************************
 epoch: 0, train_loss: 1.3643, test_loss: 1.3456, test_f1: 0.1110
 epoch: 1, train_loss: 1.3419, test_loss: 1.3300, test_f1: 0.1377
 epoch: 2, train_loss: 1.3264, test_loss: 1.3133, test_f1: 0.2733
 epoch: 3, train_loss: 1.3069, test_loss: 1.2876, test_f1: 0.2262
 epoch: 4, train_loss: 1.2869, test_loss: 1.2623, test_f1: 0.3033
 epoch: 5, train_loss: 1.2639, test_loss: 1.2394, test_f1: 0.3323
 epoch: 6, train_loss: 1.2463, test_loss: 1.2206, test_f1: 0.3292
 epoch: 7, train_loss: 1.2250, test_loss: 1.1909, test_f1: 0.3458
 epoch: 8, train_loss: 1.2016, test_loss: 1.1712, test_f1: 0.3473
 epoch: 9, train_loss: 1.1881, test_loss: 1.1560, test_f1: 0.3381
 epoch: 10, train_loss: 1.1743, test_loss: 1.1409, test_f1: 0.3400
 epoch: 11, train_loss: 1.1541, test_loss: 1.1259, test_f1: 0.3417
 epoch: 12, train_loss: 1.1535, test_loss: 1.1230, test_f1: 0.3438
 epoch: 13, train_loss: 1.1382, test_loss: 1.1086, test_f1: 0.3400
 epoch: 14, train_loss: 1.1334, test_loss: 1.1082, test_f1: 0.3428
 epoch: 15, train_loss: 1.1204, test_loss: 1.0937, test_f1: 0.3414
 epoch: 16, train_loss: 1.1161, test_loss: 1.0900, test_f1: 0.3435
 epoch: 17, train_loss: 1.1128, test_loss: 1.0803, test_f1: 0.3433
 epoch: 18, train_loss: 1.1035, test_loss: 1.1055, test_f1: 0.3411
 epoch: 19, train_loss: 1.0998, test_loss: 1.0933, test_f1: 0.3414
 epoch: 20, train_loss: 1.0932, test_loss: 1.0909, test_f1: 0.3423
 epoch: 21, train_loss: 1.0906, test_loss: 1.0871, test_f1: 0.3423
 epoch: 22, train_loss: 1.0835, test_loss: 1.0870, test_f1: 0.3435
 epoch: 23, train_loss: 1.0923, test_loss: 1.0897, test_f1: 0.3423
 epoch: 24, train_loss: 1.0735, test_loss: 1.0831, test_f1: 0.3431
 epoch: 25, train_loss: 1.0702, test_loss: 1.0588, test_f1: 0.3433
 epoch: 26, train_loss: 1.0728, test_loss: 1.0630, test_f1: 0.3421
 epoch: 27, train_loss: 1.0689, test_loss: 1.0812, test_f1: 0.3435
 epoch: 28, train_loss: 1.0728, test_loss: 1.0600, test_f1: 0.3431
 epoch: 29, train_loss: 1.0747, test_loss: 1.0708, test_f1: 0.3447
 epoch: 30, train_loss: 1.0600, test_loss: 1.0673, test_f1: 0.3431
 epoch: 31, train_loss: 1.0627, test_loss: 1.0833, test_f1: 0.3428
 epoch: 32, train_loss: 1.0586, test_loss: 1.0612, test_f1: 0.3457
 epoch: 33, train_loss: 1.0550, test_loss: 1.0402, test_f1: 0.3433
 epoch: 34, train_loss: 1.0529, test_loss: 1.0686, test_f1: 0.3447
 epoch: 35, train_loss: 1.0555, test_loss: 1.0785, test_f1: 0.3433
 epoch: 36, train_loss: 1.0528, test_loss: 1.0556, test_f1: 0.3445
 epoch: 37, train_loss: 1.0477, test_loss: 1.0574, test_f1: 0.3445
 epoch: 38, train_loss: 1.0423, test_loss: 1.0517, test_f1: 0.3457
 epoch: 39, train_loss: 1.0449, test_loss: 1.0703, test_f1: 0.3445
 epoch: 40, train_loss: 1.0405, test_loss: 1.0476, test_f1: 0.3445
 epoch: 41, train_loss: 1.0423, test_loss: 1.0602, test_f1: 0.3435
 epoch: 42, train_loss: 1.0408, test_loss: 1.0461, test_f1: 0.3449
 epoch: 43, train_loss: 1.0393, test_loss: 1.0603, test_f1: 0.3440
 epoch: 44, train_loss: 1.0378, test_loss: 1.0331, test_f1: 0.3459
 epoch: 45, train_loss: 1.0399, test_loss: 1.0517, test_f1: 0.3442
 epoch: 46, train_loss: 1.0387, test_loss: 1.0548, test_f1: 0.3461
 epoch: 47, train_loss: 1.0345, test_loss: 1.0475, test_f1: 0.3482
 epoch: 48, train_loss: 1.0398, test_loss: 1.0558, test_f1: 0.3480
 epoch: 49, train_loss: 1.0311, test_loss: 1.0307, test_f1: 0.3492
 epoch: 50, train_loss: 1.0344, test_loss: 1.0433, test_f1: 0.3496
 epoch: 51, train_loss: 1.0263, test_loss: 1.0612, test_f1: 0.3480
 epoch: 52, train_loss: 1.0310, test_loss: 1.0512, test_f1: 0.3583
 epoch: 53, train_loss: 1.0346, test_loss: 1.0599, test_f1: 0.3555
 epoch: 54, train_loss: 1.0292, test_loss: 1.0524, test_f1: 0.3672
 epoch: 55, train_loss: 1.0281, test_loss: 1.0669, test_f1: 0.3710
 epoch: 56, train_loss: 1.0354, test_loss: 1.0566, test_f1: 0.3657
 epoch: 57, train_loss: 1.0308, test_loss: 1.0404, test_f1: 0.3675
 epoch: 58, train_loss: 1.0221, test_loss: 1.0640, test_f1: 0.3684
 epoch: 59, train_loss: 1.0213, test_loss: 1.0723, test_f1: 0.3682
 epoch: 60, train_loss: 1.0265, test_loss: 1.0633, test_f1: 0.3723
 epoch: 61, train_loss: 1.0235, test_loss: 1.0503, test_f1: 0.3729
 epoch: 62, train_loss: 1.0221, test_loss: 1.0506, test_f1: 0.3749
 epoch: 63, train_loss: 1.0226, test_loss: 1.0751, test_f1: 0.3722
 epoch: 64, train_loss: 1.0221, test_loss: 1.0551, test_f1: 0.3722
 epoch: 65, train_loss: 1.0232, test_loss: 1.0348, test_f1: 0.3737
 epoch: 66, train_loss: 1.0240, test_loss: 1.0261, test_f1: 0.3751
 epoch: 67, train_loss: 1.0233, test_loss: 1.0508, test_f1: 0.3714
 epoch: 68, train_loss: 1.0266, test_loss: 1.0674, test_f1: 0.3739
 epoch: 69, train_loss: 1.0179, test_loss: 1.0476, test_f1: 0.3788
 epoch: 70, train_loss: 1.0196, test_loss: 1.0426, test_f1: 0.3753
 epoch: 71, train_loss: 1.0201, test_loss: 1.0572, test_f1: 0.3776
 epoch: 72, train_loss: 1.0124, test_loss: 1.0381, test_f1: 0.3795
 epoch: 73, train_loss: 1.0176, test_loss: 1.0163, test_f1: 0.3820
 epoch: 74, train_loss: 1.0212, test_loss: 1.0438, test_f1: 0.3768
 epoch: 75, train_loss: 1.0140, test_loss: 1.0639, test_f1: 0.3827
 epoch: 76, train_loss: 1.0234, test_loss: 1.0692, test_f1: 0.3856
 epoch: 77, train_loss: 1.0176, test_loss: 1.0469, test_f1: 0.3833
 epoch: 78, train_loss: 1.0134, test_loss: 1.0488, test_f1: 0.3844
 epoch: 79, train_loss: 1.0179, test_loss: 1.0504, test_f1: 0.3822
 epoch: 80, train_loss: 1.0154, test_loss: 1.0287, test_f1: 0.3807
 epoch: 81, train_loss: 1.0117, test_loss: 1.0339, test_f1: 0.3826
 epoch: 82, train_loss: 1.0213, test_loss: 1.0554, test_f1: 0.3846
 epoch: 83, train_loss: 1.0188, test_loss: 1.0377, test_f1: 0.3848
 epoch: 84, train_loss: 1.0175, test_loss: 1.0266, test_f1: 0.3898
 epoch: 85, train_loss: 1.0158, test_loss: 1.0659, test_f1: 0.3869
 epoch: 86, train_loss: 1.0157, test_loss: 1.0599, test_f1: 0.3874
 epoch: 87, train_loss: 1.0120, test_loss: 1.0478, test_f1: 0.3892
 epoch: 88, train_loss: 1.0030, test_loss: 1.0531, test_f1: 0.3852
 epoch: 89, train_loss: 1.0113, test_loss: 1.0068, test_f1: 0.3923
 epoch: 90, train_loss: 1.0155, test_loss: 1.0294, test_f1: 0.3834
 epoch: 91, train_loss: 1.0157, test_loss: 1.0610, test_f1: 0.3969
 epoch: 92, train_loss: 1.0166, test_loss: 1.0502, test_f1: 0.3906
 epoch: 93, train_loss: 1.0153, test_loss: 1.0668, test_f1: 0.3897
 epoch: 94, train_loss: 1.0061, test_loss: 1.0235, test_f1: 0.3931
 epoch: 95, train_loss: 1.0087, test_loss: 1.0690, test_f1: 0.3900
 epoch: 96, train_loss: 1.0120, test_loss: 1.0404, test_f1: 0.3891
 epoch: 97, train_loss: 1.0102, test_loss: 1.0401, test_f1: 0.3964
 epoch: 98, train_loss: 1.0108, test_loss: 1.0114, test_f1: 0.3995
 epoch: 99, train_loss: 1.0112, test_loss: 1.0059, test_f1: 0.4072
##################ITERATION #2 ****************************************
 epoch: 0, train_loss: 1.3105, test_loss: 1.2805, test_f1: 0.2475
 epoch: 1, train_loss: 1.2776, test_loss: 1.2578, test_f1: 0.2543
 epoch: 2, train_loss: 1.2598, test_loss: 1.2367, test_f1: 0.2335
 epoch: 3, train_loss: 1.2413, test_loss: 1.2142, test_f1: 0.3199
 epoch: 4, train_loss: 1.2216, test_loss: 1.1998, test_f1: 0.3406
 epoch: 5, train_loss: 1.2056, test_loss: 1.1743, test_f1: 0.3494
 epoch: 6, train_loss: 1.1872, test_loss: 1.1585, test_f1: 0.3369
 epoch: 7, train_loss: 1.1703, test_loss: 1.1409, test_f1: 0.3357
 epoch: 8, train_loss: 1.1544, test_loss: 1.1291, test_f1: 0.3361
 epoch: 9, train_loss: 1.1449, test_loss: 1.1193, test_f1: 0.3328
 epoch: 10, train_loss: 1.1333, test_loss: 1.1115, test_f1: 0.3365
 epoch: 11, train_loss: 1.1211, test_loss: 1.1070, test_f1: 0.3273
 epoch: 12, train_loss: 1.1113, test_loss: 1.1006, test_f1: 0.3301
 epoch: 13, train_loss: 1.0993, test_loss: 1.0935, test_f1: 0.3347
 epoch: 14, train_loss: 1.0923, test_loss: 1.0959, test_f1: 0.3251
 epoch: 15, train_loss: 1.0897, test_loss: 1.0962, test_f1: 0.3301
 epoch: 16, train_loss: 1.0834, test_loss: 1.0946, test_f1: 0.3277
 epoch: 17, train_loss: 1.0803, test_loss: 1.0907, test_f1: 0.3254
 epoch: 18, train_loss: 1.0754, test_loss: 1.0936, test_f1: 0.3269
 epoch: 19, train_loss: 1.0602, test_loss: 1.0918, test_f1: 0.3306
 epoch: 20, train_loss: 1.0682, test_loss: 1.0919, test_f1: 0.3312
 epoch: 21, train_loss: 1.0580, test_loss: 1.0924, test_f1: 0.3347
 epoch: 22, train_loss: 1.0533, test_loss: 1.0915, test_f1: 0.3347
 epoch: 23, train_loss: 1.0544, test_loss: 1.0885, test_f1: 0.3448
 epoch: 24, train_loss: 1.0531, test_loss: 1.0965, test_f1: 0.3401
 epoch: 25, train_loss: 1.0451, test_loss: 1.0859, test_f1: 0.3462
 epoch: 26, train_loss: 1.0445, test_loss: 1.0891, test_f1: 0.3484
 epoch: 27, train_loss: 1.0392, test_loss: 1.0794, test_f1: 0.3507
 epoch: 28, train_loss: 1.0357, test_loss: 1.0811, test_f1: 0.3834
 epoch: 29, train_loss: 1.0429, test_loss: 1.0803, test_f1: 0.3782
 epoch: 30, train_loss: 1.0398, test_loss: 1.0941, test_f1: 0.3700
 epoch: 31, train_loss: 1.0299, test_loss: 1.0776, test_f1: 0.3901
 epoch: 32, train_loss: 1.0424, test_loss: 1.0799, test_f1: 0.3951
 epoch: 33, train_loss: 1.0325, test_loss: 1.0767, test_f1: 0.3903
 epoch: 34, train_loss: 1.0300, test_loss: 1.0745, test_f1: 0.3992
 epoch: 35, train_loss: 1.0211, test_loss: 1.0823, test_f1: 0.3848
 epoch: 36, train_loss: 1.0306, test_loss: 1.0772, test_f1: 0.3905
 epoch: 37, train_loss: 1.0277, test_loss: 1.0755, test_f1: 0.4023
 epoch: 38, train_loss: 1.0160, test_loss: 1.0767, test_f1: 0.4012
 epoch: 39, train_loss: 1.0190, test_loss: 1.0685, test_f1: 0.4281
 epoch: 40, train_loss: 1.0157, test_loss: 1.0782, test_f1: 0.4327
 epoch: 41, train_loss: 1.0130, test_loss: 1.0818, test_f1: 0.4036
 epoch: 42, train_loss: 1.0197, test_loss: 1.0671, test_f1: 0.4398
 epoch: 43, train_loss: 1.0109, test_loss: 1.0849, test_f1: 0.4257
 epoch: 44, train_loss: 1.0112, test_loss: 1.0820, test_f1: 0.4291
 epoch: 45, train_loss: 1.0137, test_loss: 1.0823, test_f1: 0.4229
 epoch: 46, train_loss: 1.0093, test_loss: 1.0721, test_f1: 0.4254
 epoch: 47, train_loss: 1.0121, test_loss: 1.0573, test_f1: 0.4437
 epoch: 48, train_loss: 1.0059, test_loss: 1.0559, test_f1: 0.4441
 epoch: 49, train_loss: 1.0069, test_loss: 1.0740, test_f1: 0.4334
 epoch: 50, train_loss: 0.9937, test_loss: 1.0672, test_f1: 0.4590
 epoch: 51, train_loss: 0.9993, test_loss: 1.0653, test_f1: 0.4511
 epoch: 52, train_loss: 0.9879, test_loss: 1.0635, test_f1: 0.4469
 epoch: 53, train_loss: 0.9959, test_loss: 1.0685, test_f1: 0.4414
 epoch: 54, train_loss: 0.9997, test_loss: 1.0572, test_f1: 0.4456
 epoch: 55, train_loss: 0.9933, test_loss: 1.0627, test_f1: 0.4406
 epoch: 56, train_loss: 0.9920, test_loss: 1.0536, test_f1: 0.4333
 epoch: 57, train_loss: 0.9876, test_loss: 1.0584, test_f1: 0.4486
 epoch: 58, train_loss: 0.9894, test_loss: 1.0671, test_f1: 0.4499
 epoch: 59, train_loss: 0.9928, test_loss: 1.0545, test_f1: 0.4517
 epoch: 60, train_loss: 0.9835, test_loss: 1.0579, test_f1: 0.4535
 epoch: 61, train_loss: 0.9934, test_loss: 1.0559, test_f1: 0.4527
 epoch: 62, train_loss: 0.9897, test_loss: 1.0616, test_f1: 0.4600
 epoch: 63, train_loss: 0.9875, test_loss: 1.0685, test_f1: 0.4437
 epoch: 64, train_loss: 0.9873, test_loss: 1.0556, test_f1: 0.4651
 epoch: 65, train_loss: 0.9837, test_loss: 1.0613, test_f1: 0.4546
 epoch: 66, train_loss: 0.9869, test_loss: 1.0561, test_f1: 0.4601
 epoch: 67, train_loss: 0.9838, test_loss: 1.0466, test_f1: 0.4648
 epoch: 68, train_loss: 0.9863, test_loss: 1.0487, test_f1: 0.4560
 epoch: 69, train_loss: 0.9795, test_loss: 1.0517, test_f1: 0.4588
 epoch: 70, train_loss: 0.9789, test_loss: 1.0386, test_f1: 0.4650
 epoch: 71, train_loss: 0.9890, test_loss: 1.0626, test_f1: 0.4549
 epoch: 72, train_loss: 0.9743, test_loss: 1.0518, test_f1: 0.4539
 epoch: 73, train_loss: 0.9814, test_loss: 1.0428, test_f1: 0.4719
 epoch: 74, train_loss: 0.9830, test_loss: 1.0642, test_f1: 0.4683
 epoch: 75, train_loss: 0.9714, test_loss: 1.0524, test_f1: 0.4677
 epoch: 76, train_loss: 0.9800, test_loss: 1.0518, test_f1: 0.4667
 epoch: 77, train_loss: 0.9725, test_loss: 1.0430, test_f1: 0.4755
 epoch: 78, train_loss: 0.9760, test_loss: 1.0482, test_f1: 0.4629
 epoch: 79, train_loss: 0.9751, test_loss: 1.0309, test_f1: 0.4725
 epoch: 80, train_loss: 0.9749, test_loss: 1.0442, test_f1: 0.4648
 epoch: 81, train_loss: 0.9703, test_loss: 1.0430, test_f1: 0.4580
 epoch: 82, train_loss: 0.9686, test_loss: 1.0473, test_f1: 0.4550
 epoch: 83, train_loss: 0.9647, test_loss: 1.0539, test_f1: 0.4720
 epoch: 84, train_loss: 0.9724, test_loss: 1.0617, test_f1: 0.4607
 epoch: 85, train_loss: 0.9656, test_loss: 1.0397, test_f1: 0.4644
 epoch: 86, train_loss: 0.9680, test_loss: 1.0512, test_f1: 0.4663
 epoch: 87, train_loss: 0.9655, test_loss: 1.0454, test_f1: 0.4742
 epoch: 88, train_loss: 0.9728, test_loss: 1.0469, test_f1: 0.4722
 epoch: 89, train_loss: 0.9615, test_loss: 1.0390, test_f1: 0.4533
 epoch: 90, train_loss: 0.9613, test_loss: 1.0401, test_f1: 0.4792
 epoch: 91, train_loss: 0.9736, test_loss: 1.0370, test_f1: 0.4533
 epoch: 92, train_loss: 0.9660, test_loss: 1.0382, test_f1: 0.4736
 epoch: 93, train_loss: 0.9679, test_loss: 1.0368, test_f1: 0.4759
 epoch: 94, train_loss: 0.9669, test_loss: 1.0497, test_f1: 0.4736
 epoch: 95, train_loss: 0.9672, test_loss: 1.0518, test_f1: 0.4675
 epoch: 96, train_loss: 0.9608, test_loss: 1.0295, test_f1: 0.4796
 epoch: 97, train_loss: 0.9549, test_loss: 1.0329, test_f1: 0.4704
 epoch: 98, train_loss: 0.9591, test_loss: 1.0707, test_f1: 0.4699
 epoch: 99, train_loss: 0.9654, test_loss: 1.0421, test_f1: 0.4772
##################ITERATION #3 ****************************************
 epoch: 0, train_loss: 1.2952, test_loss: 1.2808, test_f1: 0.2287
 epoch: 1, train_loss: 1.2624, test_loss: 1.2558, test_f1: 0.2260
 epoch: 2, train_loss: 1.2438, test_loss: 1.2370, test_f1: 0.2260
 epoch: 3, train_loss: 1.2286, test_loss: 1.2061, test_f1: 0.2539
 epoch: 4, train_loss: 1.2060, test_loss: 1.1786, test_f1: 0.3437
 epoch: 5, train_loss: 1.1820, test_loss: 1.1491, test_f1: 0.3420
 epoch: 6, train_loss: 1.1680, test_loss: 1.1296, test_f1: 0.3385
 epoch: 7, train_loss: 1.1544, test_loss: 1.1147, test_f1: 0.3386
 epoch: 8, train_loss: 1.1314, test_loss: 1.1085, test_f1: 0.3428
 epoch: 9, train_loss: 1.1234, test_loss: 1.0957, test_f1: 0.3416
 epoch: 10, train_loss: 1.1143, test_loss: 1.0924, test_f1: 0.3419
 epoch: 11, train_loss: 1.0941, test_loss: 1.0952, test_f1: 0.3414
 epoch: 12, train_loss: 1.0943, test_loss: 1.0873, test_f1: 0.3419
 epoch: 13, train_loss: 1.0853, test_loss: 1.0971, test_f1: 0.3419
 epoch: 14, train_loss: 1.0733, test_loss: 1.0863, test_f1: 0.3397
 epoch: 15, train_loss: 1.0771, test_loss: 1.0896, test_f1: 0.3410
 epoch: 16, train_loss: 1.0629, test_loss: 1.0821, test_f1: 0.3407
 epoch: 17, train_loss: 1.0621, test_loss: 1.1055, test_f1: 0.3502
 epoch: 18, train_loss: 1.0586, test_loss: 1.0818, test_f1: 0.3511
 epoch: 19, train_loss: 1.0539, test_loss: 1.1144, test_f1: 0.3534
 epoch: 20, train_loss: 1.0592, test_loss: 1.0930, test_f1: 0.3536
 epoch: 21, train_loss: 1.0469, test_loss: 1.0950, test_f1: 0.3577
 epoch: 22, train_loss: 1.0430, test_loss: 1.1001, test_f1: 0.3601
 epoch: 23, train_loss: 1.0427, test_loss: 1.0864, test_f1: 0.3606
 epoch: 24, train_loss: 1.0334, test_loss: 1.0922, test_f1: 0.3687
 epoch: 25, train_loss: 1.0271, test_loss: 1.0982, test_f1: 0.3699
 epoch: 26, train_loss: 1.0299, test_loss: 1.0907, test_f1: 0.3688
 epoch: 27, train_loss: 1.0296, test_loss: 1.0966, test_f1: 0.3729
 epoch: 28, train_loss: 1.0208, test_loss: 1.1211, test_f1: 0.3911
 epoch: 29, train_loss: 1.0181, test_loss: 1.0916, test_f1: 0.3964
 epoch: 30, train_loss: 1.0127, test_loss: 1.0721, test_f1: 0.4157
 epoch: 31, train_loss: 1.0125, test_loss: 1.0818, test_f1: 0.4197
 epoch: 32, train_loss: 1.0166, test_loss: 1.0933, test_f1: 0.4138
 epoch: 33, train_loss: 1.0103, test_loss: 1.0718, test_f1: 0.4396
 epoch: 34, train_loss: 1.0182, test_loss: 1.1082, test_f1: 0.4251
 epoch: 35, train_loss: 1.0113, test_loss: 1.0839, test_f1: 0.4196
 epoch: 36, train_loss: 1.0064, test_loss: 1.0856, test_f1: 0.4329
 epoch: 37, train_loss: 1.0047, test_loss: 1.0798, test_f1: 0.4432
 epoch: 38, train_loss: 1.0067, test_loss: 1.0847, test_f1: 0.4432
 epoch: 39, train_loss: 0.9999, test_loss: 1.0668, test_f1: 0.4416
 epoch: 40, train_loss: 0.9989, test_loss: 1.0765, test_f1: 0.4523
 epoch: 41, train_loss: 0.9974, test_loss: 1.0756, test_f1: 0.4469
 epoch: 42, train_loss: 0.9924, test_loss: 1.0516, test_f1: 0.4639
 epoch: 43, train_loss: 1.0013, test_loss: 1.0394, test_f1: 0.4655
 epoch: 44, train_loss: 0.9956, test_loss: 1.0657, test_f1: 0.4584
 epoch: 45, train_loss: 1.0004, test_loss: 1.0599, test_f1: 0.4637
 epoch: 46, train_loss: 0.9919, test_loss: 1.0655, test_f1: 0.4475
 epoch: 47, train_loss: 0.9896, test_loss: 1.0502, test_f1: 0.4618
 epoch: 48, train_loss: 0.9870, test_loss: 1.0572, test_f1: 0.4704
 epoch: 49, train_loss: 0.9903, test_loss: 1.0539, test_f1: 0.4556
 epoch: 50, train_loss: 0.9846, test_loss: 1.0565, test_f1: 0.4613
 epoch: 51, train_loss: 0.9796, test_loss: 1.0554, test_f1: 0.4663
 epoch: 52, train_loss: 0.9809, test_loss: 1.0509, test_f1: 0.4666
 epoch: 53, train_loss: 0.9844, test_loss: 1.0341, test_f1: 0.4569
 epoch: 54, train_loss: 0.9761, test_loss: 1.0583, test_f1: 0.4700
 epoch: 55, train_loss: 0.9854, test_loss: 1.0541, test_f1: 0.4705
 epoch: 56, train_loss: 0.9736, test_loss: 1.0525, test_f1: 0.4735
 epoch: 57, train_loss: 0.9840, test_loss: 1.0177, test_f1: 0.4629
 epoch: 58, train_loss: 0.9784, test_loss: 1.0412, test_f1: 0.4682
 epoch: 59, train_loss: 0.9775, test_loss: 1.0536, test_f1: 0.4671
 epoch: 60, train_loss: 0.9783, test_loss: 1.0440, test_f1: 0.4629
 epoch: 61, train_loss: 0.9739, test_loss: 1.0521, test_f1: 0.4679
 epoch: 62, train_loss: 0.9789, test_loss: 1.0310, test_f1: 0.4722
 epoch: 63, train_loss: 0.9724, test_loss: 1.0405, test_f1: 0.4770
 epoch: 64, train_loss: 0.9684, test_loss: 1.0445, test_f1: 0.4713
 epoch: 65, train_loss: 0.9767, test_loss: 1.0525, test_f1: 0.4805
 epoch: 66, train_loss: 0.9705, test_loss: 1.0380, test_f1: 0.4681
 epoch: 67, train_loss: 0.9771, test_loss: 1.0374, test_f1: 0.4742
 epoch: 68, train_loss: 0.9778, test_loss: 1.0405, test_f1: 0.4750
 epoch: 69, train_loss: 0.9677, test_loss: 1.0339, test_f1: 0.4770
 epoch: 70, train_loss: 0.9652, test_loss: 1.0422, test_f1: 0.4680
 epoch: 71, train_loss: 0.9679, test_loss: 1.0324, test_f1: 0.4734
 epoch: 72, train_loss: 0.9612, test_loss: 1.0312, test_f1: 0.4717
 epoch: 73, train_loss: 0.9765, test_loss: 1.0201, test_f1: 0.4729
 epoch: 74, train_loss: 0.9724, test_loss: 1.0227, test_f1: 0.4769
 epoch: 75, train_loss: 0.9725, test_loss: 1.0274, test_f1: 0.4719
 epoch: 76, train_loss: 0.9722, test_loss: 1.0168, test_f1: 0.4660
 epoch: 77, train_loss: 0.9675, test_loss: 1.0045, test_f1: 0.4701
 epoch: 78, train_loss: 0.9681, test_loss: 1.0303, test_f1: 0.4709
 epoch: 79, train_loss: 0.9665, test_loss: 1.0332, test_f1: 0.4708
 epoch: 80, train_loss: 0.9749, test_loss: 1.0298, test_f1: 0.4735
 epoch: 81, train_loss: 0.9781, test_loss: 1.0144, test_f1: 0.4614
 epoch: 82, train_loss: 0.9570, test_loss: 1.0284, test_f1: 0.4658
 epoch: 83, train_loss: 0.9719, test_loss: 1.0304, test_f1: 0.4602
 epoch: 84, train_loss: 0.9698, test_loss: 1.0224, test_f1: 0.4738
 epoch: 85, train_loss: 0.9615, test_loss: 1.0137, test_f1: 0.4681
 epoch: 86, train_loss: 0.9648, test_loss: 0.9992, test_f1: 0.4668
 epoch: 87, train_loss: 0.9617, test_loss: 1.0059, test_f1: 0.4698
 epoch: 88, train_loss: 0.9598, test_loss: 1.0192, test_f1: 0.4736
 epoch: 89, train_loss: 0.9632, test_loss: 1.0105, test_f1: 0.4716
 epoch: 90, train_loss: 0.9602, test_loss: 1.0163, test_f1: 0.4713
 epoch: 91, train_loss: 0.9691, test_loss: 1.0134, test_f1: 0.4740
 epoch: 92, train_loss: 0.9605, test_loss: 1.0181, test_f1: 0.4679
 epoch: 93, train_loss: 0.9621, test_loss: 1.0019, test_f1: 0.4751
 epoch: 94, train_loss: 0.9590, test_loss: 1.0234, test_f1: 0.4685
 epoch: 95, train_loss: 0.9592, test_loss: 0.9945, test_f1: 0.4748
 epoch: 96, train_loss: 0.9571, test_loss: 1.0019, test_f1: 0.4765
 epoch: 97, train_loss: 0.9550, test_loss: 1.0165, test_f1: 0.4705
 epoch: 98, train_loss: 0.9635, test_loss: 1.0000, test_f1: 0.4778
 epoch: 99, train_loss: 0.9576, test_loss: 1.0030, test_f1: 0.4695
##################ITERATION #4 ****************************************
 epoch: 0, train_loss: 1.3215, test_loss: 1.2563, test_f1: 0.3238
 epoch: 1, train_loss: 1.2480, test_loss: 1.2230, test_f1: 0.3510
 epoch: 2, train_loss: 1.2221, test_loss: 1.2038, test_f1: 0.3549
 epoch: 3, train_loss: 1.1987, test_loss: 1.1769, test_f1: 0.3580
 epoch: 4, train_loss: 1.1816, test_loss: 1.1620, test_f1: 0.3522
 epoch: 5, train_loss: 1.1652, test_loss: 1.1447, test_f1: 0.3412
 epoch: 6, train_loss: 1.1598, test_loss: 1.1401, test_f1: 0.3388
 epoch: 7, train_loss: 1.1482, test_loss: 1.1191, test_f1: 0.3438
 epoch: 8, train_loss: 1.1249, test_loss: 1.1115, test_f1: 0.3418
 epoch: 9, train_loss: 1.1246, test_loss: 1.1034, test_f1: 0.3416
 epoch: 10, train_loss: 1.1209, test_loss: 1.0974, test_f1: 0.3406
 epoch: 11, train_loss: 1.1073, test_loss: 1.0987, test_f1: 0.3401
 epoch: 12, train_loss: 1.1009, test_loss: 1.0881, test_f1: 0.3404
 epoch: 13, train_loss: 1.0988, test_loss: 1.0950, test_f1: 0.3435
 epoch: 14, train_loss: 1.0944, test_loss: 1.0869, test_f1: 0.3413
 epoch: 15, train_loss: 1.0882, test_loss: 1.0872, test_f1: 0.3371
 epoch: 16, train_loss: 1.0888, test_loss: 1.0804, test_f1: 0.3427
 epoch: 17, train_loss: 1.0805, test_loss: 1.0774, test_f1: 0.3390
 epoch: 18, train_loss: 1.0789, test_loss: 1.0803, test_f1: 0.3394
 epoch: 19, train_loss: 1.0774, test_loss: 1.0816, test_f1: 0.3403
 epoch: 20, train_loss: 1.0748, test_loss: 1.0815, test_f1: 0.3362
 epoch: 21, train_loss: 1.0708, test_loss: 1.0889, test_f1: 0.3341
 epoch: 22, train_loss: 1.0691, test_loss: 1.0738, test_f1: 0.3385
 epoch: 23, train_loss: 1.0606, test_loss: 1.0827, test_f1: 0.3342
 epoch: 24, train_loss: 1.0647, test_loss: 1.0660, test_f1: 0.3530
 epoch: 25, train_loss: 1.0600, test_loss: 1.0833, test_f1: 0.3522
 epoch: 26, train_loss: 1.0563, test_loss: 1.0752, test_f1: 0.3555
 epoch: 27, train_loss: 1.0599, test_loss: 1.0656, test_f1: 0.3579
 epoch: 28, train_loss: 1.0618, test_loss: 1.0760, test_f1: 0.3646
 epoch: 29, train_loss: 1.0512, test_loss: 1.0709, test_f1: 0.3597
 epoch: 30, train_loss: 1.0553, test_loss: 1.0722, test_f1: 0.3521
 epoch: 31, train_loss: 1.0483, test_loss: 1.0676, test_f1: 0.3519
 epoch: 32, train_loss: 1.0488, test_loss: 1.0566, test_f1: 0.3699
 epoch: 33, train_loss: 1.0487, test_loss: 1.0529, test_f1: 0.3642
 epoch: 34, train_loss: 1.0425, test_loss: 1.0670, test_f1: 0.3616
 epoch: 35, train_loss: 1.0429, test_loss: 1.0669, test_f1: 0.3589
 epoch: 36, train_loss: 1.0334, test_loss: 1.0673, test_f1: 0.3638
 epoch: 37, train_loss: 1.0360, test_loss: 1.0647, test_f1: 0.3793
 epoch: 38, train_loss: 1.0308, test_loss: 1.0516, test_f1: 0.3796
 epoch: 39, train_loss: 1.0258, test_loss: 1.0521, test_f1: 0.3765
 epoch: 40, train_loss: 1.0351, test_loss: 1.0606, test_f1: 0.3739
 epoch: 41, train_loss: 1.0305, test_loss: 1.0536, test_f1: 0.3834
 epoch: 42, train_loss: 1.0236, test_loss: 1.0584, test_f1: 0.3753
 epoch: 43, train_loss: 1.0297, test_loss: 1.0701, test_f1: 0.3871
 epoch: 44, train_loss: 1.0282, test_loss: 1.0701, test_f1: 0.3860
 epoch: 45, train_loss: 1.0241, test_loss: 1.0877, test_f1: 0.3780
 epoch: 46, train_loss: 1.0212, test_loss: 1.0621, test_f1: 0.3999
 epoch: 47, train_loss: 1.0206, test_loss: 1.0703, test_f1: 0.3836
 epoch: 48, train_loss: 1.0177, test_loss: 1.0655, test_f1: 0.3972
 epoch: 49, train_loss: 1.0251, test_loss: 1.0721, test_f1: 0.4066
 epoch: 50, train_loss: 1.0176, test_loss: 1.0607, test_f1: 0.3914
 epoch: 51, train_loss: 1.0174, test_loss: 1.0551, test_f1: 0.4175
 epoch: 52, train_loss: 1.0120, test_loss: 1.0742, test_f1: 0.4098
 epoch: 53, train_loss: 1.0109, test_loss: 1.0782, test_f1: 0.4104
 epoch: 54, train_loss: 1.0091, test_loss: 1.0575, test_f1: 0.4095
 epoch: 55, train_loss: 1.0116, test_loss: 1.0677, test_f1: 0.4135
 epoch: 56, train_loss: 1.0128, test_loss: 1.0798, test_f1: 0.4152
 epoch: 57, train_loss: 1.0092, test_loss: 1.0722, test_f1: 0.4182
 epoch: 58, train_loss: 1.0158, test_loss: 1.0677, test_f1: 0.4182
 epoch: 59, train_loss: 1.0117, test_loss: 1.0758, test_f1: 0.4065
 epoch: 60, train_loss: 1.0046, test_loss: 1.0848, test_f1: 0.4196
 epoch: 61, train_loss: 1.0142, test_loss: 1.0820, test_f1: 0.4205
 epoch: 62, train_loss: 1.0080, test_loss: 1.0875, test_f1: 0.4153
 epoch: 63, train_loss: 1.0180, test_loss: 1.0792, test_f1: 0.4291
 epoch: 64, train_loss: 1.0131, test_loss: 1.0769, test_f1: 0.4215
 epoch: 65, train_loss: 1.0144, test_loss: 1.0824, test_f1: 0.4219
 epoch: 66, train_loss: 1.0124, test_loss: 1.0784, test_f1: 0.4176
 epoch: 67, train_loss: 1.0119, test_loss: 1.0716, test_f1: 0.4170
 epoch: 68, train_loss: 1.0114, test_loss: 1.0604, test_f1: 0.4176
 epoch: 69, train_loss: 1.0052, test_loss: 1.0833, test_f1: 0.4191
 epoch: 70, train_loss: 1.0029, test_loss: 1.0886, test_f1: 0.4184
 epoch: 71, train_loss: 1.0055, test_loss: 1.0758, test_f1: 0.4264
 epoch: 72, train_loss: 1.0061, test_loss: 1.0736, test_f1: 0.4219
 epoch: 73, train_loss: 1.0058, test_loss: 1.0773, test_f1: 0.4180
 epoch: 74, train_loss: 1.0165, test_loss: 1.0967, test_f1: 0.4170
 epoch: 75, train_loss: 0.9957, test_loss: 1.0744, test_f1: 0.4195
 epoch: 76, train_loss: 1.0052, test_loss: 1.0692, test_f1: 0.4187
 epoch: 77, train_loss: 1.0082, test_loss: 1.0742, test_f1: 0.4241
 epoch: 78, train_loss: 0.9972, test_loss: 1.0699, test_f1: 0.4368
 epoch: 79, train_loss: 1.0047, test_loss: 1.0664, test_f1: 0.4252
 epoch: 80, train_loss: 0.9933, test_loss: 1.0942, test_f1: 0.4197
 epoch: 81, train_loss: 0.9996, test_loss: 1.0963, test_f1: 0.4089
 epoch: 82, train_loss: 1.0039, test_loss: 1.0759, test_f1: 0.4406
 epoch: 83, train_loss: 1.0062, test_loss: 1.0979, test_f1: 0.4434
 epoch: 84, train_loss: 1.0039, test_loss: 1.0796, test_f1: 0.4208
 epoch: 85, train_loss: 1.0045, test_loss: 1.0858, test_f1: 0.4242
 epoch: 86, train_loss: 0.9997, test_loss: 1.0928, test_f1: 0.4220
 epoch: 87, train_loss: 0.9972, test_loss: 1.0833, test_f1: 0.4251
 epoch: 88, train_loss: 0.9934, test_loss: 1.0819, test_f1: 0.4238
 epoch: 89, train_loss: 0.9965, test_loss: 1.0928, test_f1: 0.4191
 epoch: 90, train_loss: 1.0019, test_loss: 1.0887, test_f1: 0.4285
 epoch: 91, train_loss: 0.9952, test_loss: 1.0827, test_f1: 0.4294
 epoch: 92, train_loss: 1.0040, test_loss: 1.0908, test_f1: 0.4376
 epoch: 93, train_loss: 0.9971, test_loss: 1.0765, test_f1: 0.4294
 epoch: 94, train_loss: 0.9881, test_loss: 1.0758, test_f1: 0.4327
 epoch: 95, train_loss: 0.9988, test_loss: 1.0633, test_f1: 0.4247
 epoch: 96, train_loss: 0.9890, test_loss: 1.0794, test_f1: 0.4518
 epoch: 97, train_loss: 0.9913, test_loss: 1.0766, test_f1: 0.4299
 epoch: 98, train_loss: 0.9917, test_loss: 1.0747, test_f1: 0.4536
 epoch: 99, train_loss: 1.0006, test_loss: 1.0735, test_f1: 0.4549
##################ITERATION #5 ****************************************
 epoch: 0, train_loss: 1.3147, test_loss: 1.2583, test_f1: 0.2260
 epoch: 1, train_loss: 1.2575, test_loss: 1.2258, test_f1: 0.2260
 epoch: 2, train_loss: 1.2299, test_loss: 1.2018, test_f1: 0.2601
 epoch: 3, train_loss: 1.2226, test_loss: 1.1845, test_f1: 0.2941
 epoch: 4, train_loss: 1.2041, test_loss: 1.1610, test_f1: 0.3275
 epoch: 5, train_loss: 1.1745, test_loss: 1.1411, test_f1: 0.3378
 epoch: 6, train_loss: 1.1616, test_loss: 1.1162, test_f1: 0.3466
 epoch: 7, train_loss: 1.1482, test_loss: 1.1070, test_f1: 0.3416
 epoch: 8, train_loss: 1.1388, test_loss: 1.0784, test_f1: 0.3491
 epoch: 9, train_loss: 1.1175, test_loss: 1.0724, test_f1: 0.3563
 epoch: 10, train_loss: 1.1069, test_loss: 1.0553, test_f1: 0.3525
 epoch: 11, train_loss: 1.0949, test_loss: 1.0526, test_f1: 0.3542
 epoch: 12, train_loss: 1.0906, test_loss: 1.0359, test_f1: 0.3771
 epoch: 13, train_loss: 1.0845, test_loss: 1.0404, test_f1: 0.3690
 epoch: 14, train_loss: 1.0716, test_loss: 1.0237, test_f1: 0.3775
 epoch: 15, train_loss: 1.0675, test_loss: 1.0297, test_f1: 0.3848
 epoch: 16, train_loss: 1.0682, test_loss: 1.0319, test_f1: 0.3909
 epoch: 17, train_loss: 1.0570, test_loss: 1.0235, test_f1: 0.3971
 epoch: 18, train_loss: 1.0548, test_loss: 1.0015, test_f1: 0.3986
 epoch: 19, train_loss: 1.0519, test_loss: 1.0163, test_f1: 0.4086
 epoch: 20, train_loss: 1.0532, test_loss: 1.0048, test_f1: 0.4004
 epoch: 21, train_loss: 1.0395, test_loss: 1.0068, test_f1: 0.4111
 epoch: 22, train_loss: 1.0454, test_loss: 0.9920, test_f1: 0.4033
 epoch: 23, train_loss: 1.0496, test_loss: 1.0051, test_f1: 0.4132
 epoch: 24, train_loss: 1.0372, test_loss: 0.9907, test_f1: 0.4511
 epoch: 25, train_loss: 1.0325, test_loss: 0.9922, test_f1: 0.4257
 epoch: 26, train_loss: 1.0291, test_loss: 0.9796, test_f1: 0.4411
 epoch: 27, train_loss: 1.0221, test_loss: 0.9851, test_f1: 0.4638
 epoch: 28, train_loss: 1.0167, test_loss: 0.9656, test_f1: 0.4473
 epoch: 29, train_loss: 1.0240, test_loss: 0.9647, test_f1: 0.4582
 epoch: 30, train_loss: 1.0166, test_loss: 0.9590, test_f1: 0.4713
 epoch: 31, train_loss: 1.0161, test_loss: 0.9541, test_f1: 0.4771
 epoch: 32, train_loss: 1.0151, test_loss: 0.9640, test_f1: 0.4524
 epoch: 33, train_loss: 1.0077, test_loss: 0.9565, test_f1: 0.4843
 epoch: 34, train_loss: 1.0018, test_loss: 0.9647, test_f1: 0.4785
 epoch: 35, train_loss: 1.0082, test_loss: 0.9505, test_f1: 0.4880
 epoch: 36, train_loss: 1.0072, test_loss: 0.9575, test_f1: 0.4878
 epoch: 37, train_loss: 1.0030, test_loss: 0.9522, test_f1: 0.4907
 epoch: 38, train_loss: 1.0004, test_loss: 0.9394, test_f1: 0.4887
 epoch: 39, train_loss: 0.9942, test_loss: 0.9496, test_f1: 0.4633
 epoch: 40, train_loss: 1.0002, test_loss: 0.9544, test_f1: 0.4726
 epoch: 41, train_loss: 0.9972, test_loss: 0.9399, test_f1: 0.4777
 epoch: 42, train_loss: 0.9893, test_loss: 0.9571, test_f1: 0.4654
 epoch: 43, train_loss: 0.9864, test_loss: 0.9342, test_f1: 0.4969
 epoch: 44, train_loss: 0.9912, test_loss: 0.9355, test_f1: 0.4803
 epoch: 45, train_loss: 0.9804, test_loss: 0.9264, test_f1: 0.5009
 epoch: 46, train_loss: 0.9888, test_loss: 0.9400, test_f1: 0.4791
 epoch: 47, train_loss: 0.9749, test_loss: 0.9417, test_f1: 0.4813
 epoch: 48, train_loss: 0.9687, test_loss: 0.9242, test_f1: 0.4938
 epoch: 49, train_loss: 0.9738, test_loss: 0.9272, test_f1: 0.4769
 epoch: 50, train_loss: 0.9749, test_loss: 0.9294, test_f1: 0.4782
 epoch: 51, train_loss: 0.9831, test_loss: 0.9358, test_f1: 0.4782
 epoch: 52, train_loss: 0.9727, test_loss: 0.9257, test_f1: 0.4861
 epoch: 53, train_loss: 0.9765, test_loss: 0.9288, test_f1: 0.4805
 epoch: 54, train_loss: 0.9642, test_loss: 0.9254, test_f1: 0.4890
 epoch: 55, train_loss: 0.9670, test_loss: 0.9214, test_f1: 0.4933
 epoch: 56, train_loss: 0.9691, test_loss: 0.9188, test_f1: 0.4911
 epoch: 57, train_loss: 0.9717, test_loss: 0.9299, test_f1: 0.4811
 epoch: 58, train_loss: 0.9655, test_loss: 0.9209, test_f1: 0.4898
 epoch: 59, train_loss: 0.9749, test_loss: 0.9141, test_f1: 0.4890
 epoch: 60, train_loss: 0.9676, test_loss: 0.9208, test_f1: 0.4791
 epoch: 61, train_loss: 0.9627, test_loss: 0.9227, test_f1: 0.4684
 epoch: 62, train_loss: 0.9595, test_loss: 0.9147, test_f1: 0.4937
 epoch: 63, train_loss: 0.9646, test_loss: 0.9212, test_f1: 0.4807
 epoch: 64, train_loss: 0.9630, test_loss: 0.9199, test_f1: 0.4785
 epoch: 65, train_loss: 0.9637, test_loss: 0.9165, test_f1: 0.4913
 epoch: 66, train_loss: 0.9578, test_loss: 0.9158, test_f1: 0.4863
 epoch: 67, train_loss: 0.9615, test_loss: 0.9190, test_f1: 0.4915
 epoch: 68, train_loss: 0.9525, test_loss: 0.9156, test_f1: 0.4832
 epoch: 69, train_loss: 0.9585, test_loss: 0.9160, test_f1: 0.4760
 epoch: 70, train_loss: 0.9484, test_loss: 0.9122, test_f1: 0.4970
 epoch: 71, train_loss: 0.9587, test_loss: 0.9199, test_f1: 0.4818
 epoch: 72, train_loss: 0.9569, test_loss: 0.9180, test_f1: 0.4790
 epoch: 73, train_loss: 0.9550, test_loss: 0.9258, test_f1: 0.4749
 epoch: 74, train_loss: 0.9538, test_loss: 0.9227, test_f1: 0.4753
 epoch: 75, train_loss: 0.9533, test_loss: 0.9140, test_f1: 0.4921
 epoch: 76, train_loss: 0.9527, test_loss: 0.9198, test_f1: 0.4736
 epoch: 77, train_loss: 0.9559, test_loss: 0.9165, test_f1: 0.4831
 epoch: 78, train_loss: 0.9536, test_loss: 0.9158, test_f1: 0.4830
 epoch: 79, train_loss: 0.9581, test_loss: 0.9190, test_f1: 0.4753
 epoch: 80, train_loss: 0.9483, test_loss: 0.9114, test_f1: 0.4940
 epoch: 81, train_loss: 0.9490, test_loss: 0.9171, test_f1: 0.4880
 epoch: 82, train_loss: 0.9445, test_loss: 0.8997, test_f1: 0.4897
 epoch: 83, train_loss: 0.9528, test_loss: 0.9061, test_f1: 0.4887
 epoch: 84, train_loss: 0.9552, test_loss: 0.9031, test_f1: 0.5032
 epoch: 85, train_loss: 0.9486, test_loss: 0.9040, test_f1: 0.4892
 epoch: 86, train_loss: 0.9463, test_loss: 0.9216, test_f1: 0.4763
 epoch: 87, train_loss: 0.9531, test_loss: 0.9077, test_f1: 0.4866
 epoch: 88, train_loss: 0.9516, test_loss: 0.9082, test_f1: 0.4761
 epoch: 89, train_loss: 0.9435, test_loss: 0.9033, test_f1: 0.4838
 epoch: 90, train_loss: 0.9503, test_loss: 0.9093, test_f1: 0.4777
 epoch: 91, train_loss: 0.9434, test_loss: 0.9086, test_f1: 0.4936
 epoch: 92, train_loss: 0.9410, test_loss: 0.9043, test_f1: 0.4961
 epoch: 93, train_loss: 0.9442, test_loss: 0.9013, test_f1: 0.4995
 epoch: 94, train_loss: 0.9484, test_loss: 0.9111, test_f1: 0.4900
 epoch: 95, train_loss: 0.9342, test_loss: 0.9064, test_f1: 0.4898
 epoch: 96, train_loss: 0.9446, test_loss: 0.9046, test_f1: 0.4747
 epoch: 97, train_loss: 0.9412, test_loss: 0.9125, test_f1: 0.4960
 epoch: 98, train_loss: 0.9458, test_loss: 0.9037, test_f1: 0.4924
 epoch: 99, train_loss: 0.9457, test_loss: 0.9031, test_f1: 0.4974
##################ITERATION #6 ****************************************
 epoch: 0, train_loss: 1.3224, test_loss: 1.2882, test_f1: 0.2260
 epoch: 1, train_loss: 1.2542, test_loss: 1.2377, test_f1: 0.2260
 epoch: 2, train_loss: 1.2254, test_loss: 1.2032, test_f1: 0.2452
 epoch: 3, train_loss: 1.2087, test_loss: 1.1786, test_f1: 0.2718
 epoch: 4, train_loss: 1.1909, test_loss: 1.1469, test_f1: 0.3199
 epoch: 5, train_loss: 1.1677, test_loss: 1.1292, test_f1: 0.3259
 epoch: 6, train_loss: 1.1549, test_loss: 1.1158, test_f1: 0.3314
 epoch: 7, train_loss: 1.1425, test_loss: 1.0986, test_f1: 0.3374
 epoch: 8, train_loss: 1.1283, test_loss: 1.0983, test_f1: 0.3393
 epoch: 9, train_loss: 1.1188, test_loss: 1.0912, test_f1: 0.3393
 epoch: 10, train_loss: 1.1077, test_loss: 1.0827, test_f1: 0.3391
 epoch: 11, train_loss: 1.0987, test_loss: 1.0854, test_f1: 0.3419
 epoch: 12, train_loss: 1.0898, test_loss: 1.0847, test_f1: 0.3361
 epoch: 13, train_loss: 1.0910, test_loss: 1.0798, test_f1: 0.3378
 epoch: 14, train_loss: 1.0706, test_loss: 1.0739, test_f1: 0.3361
 epoch: 15, train_loss: 1.0877, test_loss: 1.0687, test_f1: 0.3360
 epoch: 16, train_loss: 1.0617, test_loss: 1.0870, test_f1: 0.3378
 epoch: 17, train_loss: 1.0600, test_loss: 1.0803, test_f1: 0.3400
 epoch: 18, train_loss: 1.0559, test_loss: 1.0972, test_f1: 0.3419
 epoch: 19, train_loss: 1.0555, test_loss: 1.0967, test_f1: 0.3419
 epoch: 20, train_loss: 1.0466, test_loss: 1.0885, test_f1: 0.3390
 epoch: 21, train_loss: 1.0531, test_loss: 1.0810, test_f1: 0.3400
 epoch: 22, train_loss: 1.0499, test_loss: 1.0882, test_f1: 0.3400
 epoch: 23, train_loss: 1.0404, test_loss: 1.1009, test_f1: 0.3453
 epoch: 24, train_loss: 1.0401, test_loss: 1.1158, test_f1: 0.3433
 epoch: 25, train_loss: 1.0385, test_loss: 1.1068, test_f1: 0.3429
 epoch: 26, train_loss: 1.0362, test_loss: 1.1056, test_f1: 0.3453
 epoch: 27, train_loss: 1.0358, test_loss: 1.0823, test_f1: 0.3445
 epoch: 28, train_loss: 1.0350, test_loss: 1.0878, test_f1: 0.3429
 epoch: 29, train_loss: 1.0327, test_loss: 1.1070, test_f1: 0.3555
 epoch: 30, train_loss: 1.0273, test_loss: 1.0951, test_f1: 0.3514
 epoch: 31, train_loss: 1.0288, test_loss: 1.0995, test_f1: 0.3515
 epoch: 32, train_loss: 1.0223, test_loss: 1.1020, test_f1: 0.3548
 epoch: 33, train_loss: 1.0213, test_loss: 1.1027, test_f1: 0.3580
 epoch: 34, train_loss: 1.0178, test_loss: 1.0869, test_f1: 0.3654
 epoch: 35, train_loss: 1.0215, test_loss: 1.0859, test_f1: 0.3694
 epoch: 36, train_loss: 1.0139, test_loss: 1.0751, test_f1: 0.3704
 epoch: 37, train_loss: 1.0115, test_loss: 1.1082, test_f1: 0.3610
 epoch: 38, train_loss: 1.0177, test_loss: 1.0994, test_f1: 0.3568
 epoch: 39, train_loss: 1.0205, test_loss: 1.1026, test_f1: 0.3663
 epoch: 40, train_loss: 1.0050, test_loss: 1.1107, test_f1: 0.3749
 epoch: 41, train_loss: 1.0063, test_loss: 1.1085, test_f1: 0.3851
 epoch: 42, train_loss: 1.0072, test_loss: 1.0694, test_f1: 0.3786
 epoch: 43, train_loss: 1.0022, test_loss: 1.1040, test_f1: 0.3737
 epoch: 44, train_loss: 1.0003, test_loss: 1.0964, test_f1: 0.3929
 epoch: 45, train_loss: 0.9971, test_loss: 1.0902, test_f1: 0.3851
 epoch: 46, train_loss: 0.9989, test_loss: 1.0502, test_f1: 0.3868
 epoch: 47, train_loss: 0.9980, test_loss: 1.1104, test_f1: 0.3916
 epoch: 48, train_loss: 0.9969, test_loss: 1.0752, test_f1: 0.3980
 epoch: 49, train_loss: 0.9943, test_loss: 1.0788, test_f1: 0.3931
 epoch: 50, train_loss: 0.9953, test_loss: 1.1028, test_f1: 0.3874
 epoch: 51, train_loss: 0.9951, test_loss: 1.0736, test_f1: 0.4075
 epoch: 52, train_loss: 0.9872, test_loss: 1.0737, test_f1: 0.4038
 epoch: 53, train_loss: 0.9843, test_loss: 1.0797, test_f1: 0.4301
 epoch: 54, train_loss: 0.9864, test_loss: 1.1047, test_f1: 0.4264
 epoch: 55, train_loss: 0.9826, test_loss: 1.0959, test_f1: 0.4335
 epoch: 56, train_loss: 0.9810, test_loss: 1.0899, test_f1: 0.4231
 epoch: 57, train_loss: 0.9831, test_loss: 1.0745, test_f1: 0.4348
 epoch: 58, train_loss: 0.9853, test_loss: 1.0927, test_f1: 0.4216
 epoch: 59, train_loss: 0.9908, test_loss: 1.0705, test_f1: 0.4458
 epoch: 60, train_loss: 0.9769, test_loss: 1.0633, test_f1: 0.4477
 epoch: 61, train_loss: 0.9779, test_loss: 1.0964, test_f1: 0.4281
 epoch: 62, train_loss: 0.9710, test_loss: 1.0828, test_f1: 0.4432
 epoch: 63, train_loss: 0.9720, test_loss: 1.0824, test_f1: 0.4378
 epoch: 64, train_loss: 0.9788, test_loss: 1.0841, test_f1: 0.4465
 epoch: 65, train_loss: 0.9692, test_loss: 1.0873, test_f1: 0.4531
 epoch: 66, train_loss: 0.9725, test_loss: 1.0804, test_f1: 0.4491
 epoch: 67, train_loss: 0.9694, test_loss: 1.0879, test_f1: 0.4468
 epoch: 68, train_loss: 0.9710, test_loss: 1.0878, test_f1: 0.4518
 epoch: 69, train_loss: 0.9717, test_loss: 1.0811, test_f1: 0.4589
 epoch: 70, train_loss: 0.9639, test_loss: 1.0907, test_f1: 0.4547
 epoch: 71, train_loss: 0.9615, test_loss: 1.0765, test_f1: 0.4599
 epoch: 72, train_loss: 0.9669, test_loss: 1.0767, test_f1: 0.4568
 epoch: 73, train_loss: 0.9628, test_loss: 1.0835, test_f1: 0.4546
 epoch: 74, train_loss: 0.9677, test_loss: 1.0721, test_f1: 0.4585
 epoch: 75, train_loss: 0.9584, test_loss: 1.0769, test_f1: 0.4664
 epoch: 76, train_loss: 0.9639, test_loss: 1.0674, test_f1: 0.4577
 epoch: 77, train_loss: 0.9670, test_loss: 1.0799, test_f1: 0.4684
 epoch: 78, train_loss: 0.9637, test_loss: 1.0627, test_f1: 0.4619
 epoch: 79, train_loss: 0.9561, test_loss: 1.0747, test_f1: 0.4598
 epoch: 80, train_loss: 0.9562, test_loss: 1.0510, test_f1: 0.4735
 epoch: 81, train_loss: 0.9538, test_loss: 1.0709, test_f1: 0.4622
 epoch: 82, train_loss: 0.9527, test_loss: 1.0739, test_f1: 0.4696
 epoch: 83, train_loss: 0.9572, test_loss: 1.0609, test_f1: 0.4549
 epoch: 84, train_loss: 0.9607, test_loss: 1.0632, test_f1: 0.4816
 epoch: 85, train_loss: 0.9521, test_loss: 1.0560, test_f1: 0.4745
 epoch: 86, train_loss: 0.9549, test_loss: 1.0617, test_f1: 0.4924
 epoch: 87, train_loss: 0.9630, test_loss: 1.0839, test_f1: 0.4929
 epoch: 88, train_loss: 0.9470, test_loss: 1.0670, test_f1: 0.4823
 epoch: 89, train_loss: 0.9546, test_loss: 1.0536, test_f1: 0.4843
 epoch: 90, train_loss: 0.9478, test_loss: 1.0768, test_f1: 0.4912
 epoch: 91, train_loss: 0.9482, test_loss: 1.0631, test_f1: 0.4887
 epoch: 92, train_loss: 0.9589, test_loss: 1.0672, test_f1: 0.4963
 epoch: 93, train_loss: 0.9461, test_loss: 1.0610, test_f1: 0.4921
 epoch: 94, train_loss: 0.9592, test_loss: 1.0666, test_f1: 0.4879
 epoch: 95, train_loss: 0.9498, test_loss: 1.0640, test_f1: 0.4874
 epoch: 96, train_loss: 0.9597, test_loss: 1.0488, test_f1: 0.4901
 epoch: 97, train_loss: 0.9521, test_loss: 1.0640, test_f1: 0.4914
 epoch: 98, train_loss: 0.9512, test_loss: 1.0554, test_f1: 0.4910
 epoch: 99, train_loss: 0.9422, test_loss: 1.0574, test_f1: 0.4968
##################ITERATION #7 ****************************************
 epoch: 0, train_loss: 1.3003, test_loss: 1.2666, test_f1: 0.2311
 epoch: 1, train_loss: 1.2579, test_loss: 1.2426, test_f1: 0.2359
 epoch: 2, train_loss: 1.2316, test_loss: 1.2219, test_f1: 0.2679
 epoch: 3, train_loss: 1.2124, test_loss: 1.1883, test_f1: 0.3091
 epoch: 4, train_loss: 1.1984, test_loss: 1.1749, test_f1: 0.3222
 epoch: 5, train_loss: 1.1832, test_loss: 1.1653, test_f1: 0.3247
 epoch: 6, train_loss: 1.1740, test_loss: 1.1437, test_f1: 0.3366
 epoch: 7, train_loss: 1.1600, test_loss: 1.1275, test_f1: 0.3444
 epoch: 8, train_loss: 1.1536, test_loss: 1.1159, test_f1: 0.3486
 epoch: 9, train_loss: 1.1497, test_loss: 1.1076, test_f1: 0.3507
 epoch: 10, train_loss: 1.1344, test_loss: 1.1004, test_f1: 0.3407
 epoch: 11, train_loss: 1.1274, test_loss: 1.0923, test_f1: 0.3431
 epoch: 12, train_loss: 1.1132, test_loss: 1.0829, test_f1: 0.3464
 epoch: 13, train_loss: 1.1077, test_loss: 1.0686, test_f1: 0.3454
 epoch: 14, train_loss: 1.1106, test_loss: 1.0646, test_f1: 0.3539
 epoch: 15, train_loss: 1.0864, test_loss: 1.0631, test_f1: 0.3673
 epoch: 16, train_loss: 1.0870, test_loss: 1.0628, test_f1: 0.3641
 epoch: 17, train_loss: 1.0818, test_loss: 1.0611, test_f1: 0.3640
 epoch: 18, train_loss: 1.0757, test_loss: 1.0536, test_f1: 0.3670
 epoch: 19, train_loss: 1.0768, test_loss: 1.0535, test_f1: 0.3801
 epoch: 20, train_loss: 1.0672, test_loss: 1.0543, test_f1: 0.3594
 epoch: 21, train_loss: 1.0687, test_loss: 1.0540, test_f1: 0.3668
 epoch: 22, train_loss: 1.0551, test_loss: 1.0427, test_f1: 0.3909
 epoch: 23, train_loss: 1.0613, test_loss: 1.0374, test_f1: 0.3789
 epoch: 24, train_loss: 1.0597, test_loss: 1.0438, test_f1: 0.3661
 epoch: 25, train_loss: 1.0535, test_loss: 1.0482, test_f1: 0.4083
 epoch: 26, train_loss: 1.0535, test_loss: 1.0498, test_f1: 0.3794
 epoch: 27, train_loss: 1.0434, test_loss: 1.0432, test_f1: 0.4046
 epoch: 28, train_loss: 1.0395, test_loss: 1.0601, test_f1: 0.4165
 epoch: 29, train_loss: 1.0333, test_loss: 1.0488, test_f1: 0.4262
 epoch: 30, train_loss: 1.0317, test_loss: 1.0584, test_f1: 0.4111
 epoch: 31, train_loss: 1.0326, test_loss: 1.0644, test_f1: 0.4261
 epoch: 32, train_loss: 1.0343, test_loss: 1.0466, test_f1: 0.4471
 epoch: 33, train_loss: 1.0198, test_loss: 1.0766, test_f1: 0.4243
 epoch: 34, train_loss: 1.0248, test_loss: 1.0455, test_f1: 0.4391
 epoch: 35, train_loss: 1.0276, test_loss: 1.0553, test_f1: 0.4410
 epoch: 36, train_loss: 1.0175, test_loss: 1.0649, test_f1: 0.4438
 epoch: 37, train_loss: 1.0224, test_loss: 1.0426, test_f1: 0.4542
 epoch: 38, train_loss: 1.0198, test_loss: 1.0509, test_f1: 0.4524
 epoch: 39, train_loss: 1.0170, test_loss: 1.0540, test_f1: 0.4497
 epoch: 40, train_loss: 1.0092, test_loss: 1.0461, test_f1: 0.4481
 epoch: 41, train_loss: 1.0136, test_loss: 1.0586, test_f1: 0.4552
 epoch: 42, train_loss: 1.0134, test_loss: 1.0400, test_f1: 0.4591
 epoch: 43, train_loss: 1.0021, test_loss: 1.0401, test_f1: 0.4587
 epoch: 44, train_loss: 0.9979, test_loss: 1.0344, test_f1: 0.4574
 epoch: 45, train_loss: 1.0012, test_loss: 1.0469, test_f1: 0.4503
 epoch: 46, train_loss: 1.0056, test_loss: 1.0482, test_f1: 0.4597
 epoch: 47, train_loss: 0.9993, test_loss: 1.0287, test_f1: 0.4713
 epoch: 48, train_loss: 0.9943, test_loss: 1.0386, test_f1: 0.4560
 epoch: 49, train_loss: 0.9941, test_loss: 1.0326, test_f1: 0.4687
 epoch: 50, train_loss: 0.9959, test_loss: 1.0378, test_f1: 0.4691
 epoch: 51, train_loss: 0.9923, test_loss: 1.0351, test_f1: 0.4701
 epoch: 52, train_loss: 0.9843, test_loss: 1.0336, test_f1: 0.4692
 epoch: 53, train_loss: 0.9862, test_loss: 1.0314, test_f1: 0.4766
 epoch: 54, train_loss: 0.9900, test_loss: 1.0282, test_f1: 0.4745
 epoch: 55, train_loss: 0.9744, test_loss: 1.0257, test_f1: 0.4711
 epoch: 56, train_loss: 0.9776, test_loss: 1.0186, test_f1: 0.4725
 epoch: 57, train_loss: 0.9799, test_loss: 1.0262, test_f1: 0.4723
 epoch: 58, train_loss: 0.9839, test_loss: 1.0225, test_f1: 0.4775
 epoch: 59, train_loss: 0.9836, test_loss: 1.0420, test_f1: 0.4731
 epoch: 60, train_loss: 0.9745, test_loss: 1.0162, test_f1: 0.4754
 epoch: 61, train_loss: 0.9774, test_loss: 1.0223, test_f1: 0.4833
 epoch: 62, train_loss: 0.9783, test_loss: 1.0114, test_f1: 0.4717
 epoch: 63, train_loss: 0.9773, test_loss: 1.0123, test_f1: 0.4761
 epoch: 64, train_loss: 0.9753, test_loss: 1.0241, test_f1: 0.4755
 epoch: 65, train_loss: 0.9864, test_loss: 1.0099, test_f1: 0.4773
 epoch: 66, train_loss: 0.9705, test_loss: 1.0080, test_f1: 0.4661
 epoch: 67, train_loss: 0.9749, test_loss: 1.0113, test_f1: 0.4783
 epoch: 68, train_loss: 0.9730, test_loss: 1.0099, test_f1: 0.4803
 epoch: 69, train_loss: 0.9768, test_loss: 1.0184, test_f1: 0.4816
 epoch: 70, train_loss: 0.9692, test_loss: 1.0160, test_f1: 0.4702
 epoch: 71, train_loss: 0.9631, test_loss: 1.0064, test_f1: 0.4837
 epoch: 72, train_loss: 0.9712, test_loss: 1.0099, test_f1: 0.4777
 epoch: 73, train_loss: 0.9679, test_loss: 1.0046, test_f1: 0.4707
 epoch: 74, train_loss: 0.9696, test_loss: 1.0139, test_f1: 0.4793
 epoch: 75, train_loss: 0.9681, test_loss: 1.0028, test_f1: 0.4766
 epoch: 76, train_loss: 0.9661, test_loss: 1.0076, test_f1: 0.4774
 epoch: 77, train_loss: 0.9608, test_loss: 1.0074, test_f1: 0.4853
 epoch: 78, train_loss: 0.9697, test_loss: 1.0193, test_f1: 0.4826
 epoch: 79, train_loss: 0.9576, test_loss: 1.0194, test_f1: 0.4844
 epoch: 80, train_loss: 0.9646, test_loss: 1.0092, test_f1: 0.4797
 epoch: 81, train_loss: 0.9650, test_loss: 1.0125, test_f1: 0.4828
 epoch: 82, train_loss: 0.9629, test_loss: 1.0235, test_f1: 0.4747
 epoch: 83, train_loss: 0.9562, test_loss: 1.0096, test_f1: 0.4886
 epoch: 84, train_loss: 0.9484, test_loss: 1.0201, test_f1: 0.4821
 epoch: 85, train_loss: 0.9573, test_loss: 1.0080, test_f1: 0.4746
 epoch: 86, train_loss: 0.9555, test_loss: 1.0145, test_f1: 0.4895
 epoch: 87, train_loss: 0.9525, test_loss: 1.0035, test_f1: 0.4815
 epoch: 88, train_loss: 0.9601, test_loss: 1.0130, test_f1: 0.4818
 epoch: 89, train_loss: 0.9590, test_loss: 1.0095, test_f1: 0.4992
 epoch: 90, train_loss: 0.9543, test_loss: 1.0005, test_f1: 0.4800
 epoch: 91, train_loss: 0.9539, test_loss: 1.0074, test_f1: 0.4888
 epoch: 92, train_loss: 0.9476, test_loss: 1.0019, test_f1: 0.4801
 epoch: 93, train_loss: 0.9482, test_loss: 0.9972, test_f1: 0.4798
 epoch: 94, train_loss: 0.9522, test_loss: 0.9994, test_f1: 0.4897
 epoch: 95, train_loss: 0.9452, test_loss: 1.0028, test_f1: 0.4863
 epoch: 96, train_loss: 0.9526, test_loss: 1.0030, test_f1: 0.4724
 epoch: 97, train_loss: 0.9431, test_loss: 1.0073, test_f1: 0.4967
 epoch: 98, train_loss: 0.9498, test_loss: 1.0125, test_f1: 0.4871
 epoch: 99, train_loss: 0.9505, test_loss: 1.0036, test_f1: 0.4833
##################ITERATION #8 ****************************************
 epoch: 0, train_loss: 1.3432, test_loss: 1.2260, test_f1: 0.2286
 epoch: 1, train_loss: 1.2347, test_loss: 1.1741, test_f1: 0.2829
 epoch: 2, train_loss: 1.2003, test_loss: 1.1421, test_f1: 0.3329
 epoch: 3, train_loss: 1.1753, test_loss: 1.1195, test_f1: 0.3609
 epoch: 4, train_loss: 1.1477, test_loss: 1.0984, test_f1: 0.3522
 epoch: 5, train_loss: 1.1400, test_loss: 1.0946, test_f1: 0.3886
 epoch: 6, train_loss: 1.1215, test_loss: 1.0909, test_f1: 0.4002
 epoch: 7, train_loss: 1.1219, test_loss: 1.0872, test_f1: 0.3839
 epoch: 8, train_loss: 1.1085, test_loss: 1.0743, test_f1: 0.4107
 epoch: 9, train_loss: 1.1043, test_loss: 1.0653, test_f1: 0.4166
 epoch: 10, train_loss: 1.0918, test_loss: 1.0594, test_f1: 0.4112
 epoch: 11, train_loss: 1.0867, test_loss: 1.0589, test_f1: 0.4151
 epoch: 12, train_loss: 1.0817, test_loss: 1.0495, test_f1: 0.4095
 epoch: 13, train_loss: 1.0796, test_loss: 1.0597, test_f1: 0.4155
 epoch: 14, train_loss: 1.0700, test_loss: 1.0457, test_f1: 0.4275
 epoch: 15, train_loss: 1.0596, test_loss: 1.0407, test_f1: 0.4255
 epoch: 16, train_loss: 1.0521, test_loss: 1.0524, test_f1: 0.4292
 epoch: 17, train_loss: 1.0579, test_loss: 1.0519, test_f1: 0.4210
 epoch: 18, train_loss: 1.0544, test_loss: 1.0432, test_f1: 0.4116
 epoch: 19, train_loss: 1.0473, test_loss: 1.0474, test_f1: 0.4208
 epoch: 20, train_loss: 1.0413, test_loss: 1.0378, test_f1: 0.4191
 epoch: 21, train_loss: 1.0444, test_loss: 1.0453, test_f1: 0.4300
 epoch: 22, train_loss: 1.0423, test_loss: 1.0367, test_f1: 0.4250
 epoch: 23, train_loss: 1.0329, test_loss: 1.0250, test_f1: 0.4409
 epoch: 24, train_loss: 1.0290, test_loss: 1.0293, test_f1: 0.4492
 epoch: 25, train_loss: 1.0246, test_loss: 1.0207, test_f1: 0.4526
 epoch: 26, train_loss: 1.0261, test_loss: 1.0298, test_f1: 0.4503
 epoch: 27, train_loss: 1.0229, test_loss: 0.9977, test_f1: 0.4563
 epoch: 28, train_loss: 1.0188, test_loss: 1.0128, test_f1: 0.4643
 epoch: 29, train_loss: 1.0154, test_loss: 1.0106, test_f1: 0.4458
 epoch: 30, train_loss: 1.0115, test_loss: 1.0081, test_f1: 0.4560
 epoch: 31, train_loss: 1.0075, test_loss: 0.9813, test_f1: 0.4616
 epoch: 32, train_loss: 1.0111, test_loss: 0.9956, test_f1: 0.4643
 epoch: 33, train_loss: 1.0092, test_loss: 0.9957, test_f1: 0.4629
 epoch: 34, train_loss: 1.0008, test_loss: 0.9921, test_f1: 0.4622
 epoch: 35, train_loss: 1.0096, test_loss: 0.9980, test_f1: 0.4653
 epoch: 36, train_loss: 1.0016, test_loss: 1.0080, test_f1: 0.4672
 epoch: 37, train_loss: 1.0000, test_loss: 0.9936, test_f1: 0.4759
 epoch: 38, train_loss: 0.9940, test_loss: 0.9929, test_f1: 0.4698
 epoch: 39, train_loss: 0.9961, test_loss: 0.9881, test_f1: 0.4755
 epoch: 40, train_loss: 0.9934, test_loss: 0.9902, test_f1: 0.4790
 epoch: 41, train_loss: 0.9869, test_loss: 0.9982, test_f1: 0.4761
 epoch: 42, train_loss: 0.9950, test_loss: 0.9880, test_f1: 0.4818
 epoch: 43, train_loss: 0.9875, test_loss: 0.9986, test_f1: 0.4814
 epoch: 44, train_loss: 0.9865, test_loss: 0.9859, test_f1: 0.4748
 epoch: 45, train_loss: 0.9872, test_loss: 1.0042, test_f1: 0.4671
 epoch: 46, train_loss: 0.9875, test_loss: 1.0066, test_f1: 0.4717
 epoch: 47, train_loss: 0.9826, test_loss: 0.9952, test_f1: 0.4678
 epoch: 48, train_loss: 0.9819, test_loss: 0.9992, test_f1: 0.4829
 epoch: 49, train_loss: 0.9845, test_loss: 0.9925, test_f1: 0.4731
 epoch: 50, train_loss: 0.9848, test_loss: 0.9921, test_f1: 0.4748
 epoch: 51, train_loss: 0.9841, test_loss: 0.9923, test_f1: 0.4824
 epoch: 52, train_loss: 0.9809, test_loss: 0.9900, test_f1: 0.4808
 epoch: 53, train_loss: 0.9820, test_loss: 0.9883, test_f1: 0.4817
 epoch: 54, train_loss: 0.9761, test_loss: 0.9881, test_f1: 0.4783
 epoch: 55, train_loss: 0.9751, test_loss: 0.9891, test_f1: 0.4871
 epoch: 56, train_loss: 0.9746, test_loss: 0.9892, test_f1: 0.4875
 epoch: 57, train_loss: 0.9747, test_loss: 0.9913, test_f1: 0.4862
 epoch: 58, train_loss: 0.9758, test_loss: 0.9871, test_f1: 0.4821
 epoch: 59, train_loss: 0.9702, test_loss: 0.9775, test_f1: 0.4965
 epoch: 60, train_loss: 0.9697, test_loss: 0.9775, test_f1: 0.4814
 epoch: 61, train_loss: 0.9773, test_loss: 0.9737, test_f1: 0.4872
 epoch: 62, train_loss: 0.9696, test_loss: 0.9815, test_f1: 0.4884
 epoch: 63, train_loss: 0.9590, test_loss: 0.9729, test_f1: 0.4895
 epoch: 64, train_loss: 0.9685, test_loss: 0.9919, test_f1: 0.4922
 epoch: 65, train_loss: 0.9636, test_loss: 0.9808, test_f1: 0.4884
 epoch: 66, train_loss: 0.9699, test_loss: 0.9864, test_f1: 0.4864
 epoch: 67, train_loss: 0.9781, test_loss: 0.9723, test_f1: 0.4966
 epoch: 68, train_loss: 0.9663, test_loss: 0.9566, test_f1: 0.4949
 epoch: 69, train_loss: 0.9641, test_loss: 0.9675, test_f1: 0.4874
 epoch: 70, train_loss: 0.9623, test_loss: 0.9797, test_f1: 0.4972
 epoch: 71, train_loss: 0.9640, test_loss: 0.9901, test_f1: 0.4890
 epoch: 72, train_loss: 0.9620, test_loss: 0.9617, test_f1: 0.4900
 epoch: 73, train_loss: 0.9547, test_loss: 0.9615, test_f1: 0.4986
 epoch: 74, train_loss: 0.9599, test_loss: 0.9708, test_f1: 0.4961
 epoch: 75, train_loss: 0.9664, test_loss: 0.9615, test_f1: 0.4859
 epoch: 76, train_loss: 0.9624, test_loss: 0.9561, test_f1: 0.4970
 epoch: 77, train_loss: 0.9599, test_loss: 0.9636, test_f1: 0.4953
 epoch: 78, train_loss: 0.9575, test_loss: 0.9586, test_f1: 0.4989
 epoch: 79, train_loss: 0.9573, test_loss: 0.9691, test_f1: 0.4963
 epoch: 80, train_loss: 0.9546, test_loss: 0.9683, test_f1: 0.5030
 epoch: 81, train_loss: 0.9632, test_loss: 0.9593, test_f1: 0.4907
 epoch: 82, train_loss: 0.9548, test_loss: 0.9618, test_f1: 0.4952
 epoch: 83, train_loss: 0.9583, test_loss: 0.9491, test_f1: 0.4999
 epoch: 84, train_loss: 0.9543, test_loss: 0.9439, test_f1: 0.4897
 epoch: 85, train_loss: 0.9476, test_loss: 0.9619, test_f1: 0.4922
 epoch: 86, train_loss: 0.9536, test_loss: 0.9507, test_f1: 0.4964
 epoch: 87, train_loss: 0.9560, test_loss: 0.9393, test_f1: 0.4951
 epoch: 88, train_loss: 0.9490, test_loss: 0.9738, test_f1: 0.5012
 epoch: 89, train_loss: 0.9448, test_loss: 0.9400, test_f1: 0.4936
 epoch: 90, train_loss: 0.9527, test_loss: 0.9500, test_f1: 0.5022
 epoch: 91, train_loss: 0.9559, test_loss: 0.9460, test_f1: 0.4905
 epoch: 92, train_loss: 0.9562, test_loss: 0.9544, test_f1: 0.5123
 epoch: 93, train_loss: 0.9450, test_loss: 0.9490, test_f1: 0.4924
 epoch: 94, train_loss: 0.9497, test_loss: 0.9575, test_f1: 0.4908
 epoch: 95, train_loss: 0.9478, test_loss: 0.9693, test_f1: 0.5039
 epoch: 96, train_loss: 0.9571, test_loss: 0.9665, test_f1: 0.4932
 epoch: 97, train_loss: 0.9494, test_loss: 0.9555, test_f1: 0.4945
 epoch: 98, train_loss: 0.9458, test_loss: 0.9419, test_f1: 0.4979
 epoch: 99, train_loss: 0.9517, test_loss: 0.9535, test_f1: 0.5078
##################ITERATION #9 ****************************************
 epoch: 0, train_loss: 1.3946, test_loss: 1.3580, test_f1: 0.2260
 epoch: 1, train_loss: 1.3307, test_loss: 1.3333, test_f1: 0.2260
 epoch: 2, train_loss: 1.3027, test_loss: 1.3019, test_f1: 0.2260
 epoch: 3, train_loss: 1.2827, test_loss: 1.2800, test_f1: 0.2260
 epoch: 4, train_loss: 1.2639, test_loss: 1.2605, test_f1: 0.2335
 epoch: 5, train_loss: 1.2412, test_loss: 1.2440, test_f1: 0.2518
 epoch: 6, train_loss: 1.2200, test_loss: 1.2225, test_f1: 0.2753
 epoch: 7, train_loss: 1.2144, test_loss: 1.2079, test_f1: 0.3034
 epoch: 8, train_loss: 1.1977, test_loss: 1.1803, test_f1: 0.3192
 epoch: 9, train_loss: 1.1767, test_loss: 1.1664, test_f1: 0.3244
 epoch: 10, train_loss: 1.1671, test_loss: 1.1484, test_f1: 0.3276
 epoch: 11, train_loss: 1.1594, test_loss: 1.1221, test_f1: 0.3342
 epoch: 12, train_loss: 1.1449, test_loss: 1.1103, test_f1: 0.3327
 epoch: 13, train_loss: 1.1344, test_loss: 1.0986, test_f1: 0.3323
 epoch: 14, train_loss: 1.1229, test_loss: 1.1012, test_f1: 0.3310
 epoch: 15, train_loss: 1.1288, test_loss: 1.0905, test_f1: 0.3281
 epoch: 16, train_loss: 1.1214, test_loss: 1.0844, test_f1: 0.3308
 epoch: 17, train_loss: 1.1130, test_loss: 1.0894, test_f1: 0.3247
 epoch: 18, train_loss: 1.1032, test_loss: 1.0896, test_f1: 0.3245
 epoch: 19, train_loss: 1.0921, test_loss: 1.0897, test_f1: 0.3254
 epoch: 20, train_loss: 1.0991, test_loss: 1.0718, test_f1: 0.3355
 epoch: 21, train_loss: 1.0961, test_loss: 1.0738, test_f1: 0.3322
 epoch: 22, train_loss: 1.0861, test_loss: 1.0649, test_f1: 0.3400
 epoch: 23, train_loss: 1.0808, test_loss: 1.0526, test_f1: 0.3374
 epoch: 24, train_loss: 1.0784, test_loss: 1.0607, test_f1: 0.3394
 epoch: 25, train_loss: 1.0729, test_loss: 1.0469, test_f1: 0.3394
 epoch: 26, train_loss: 1.0737, test_loss: 1.0577, test_f1: 0.3403
 epoch: 27, train_loss: 1.0595, test_loss: 1.0538, test_f1: 0.3375
 epoch: 28, train_loss: 1.0634, test_loss: 1.0542, test_f1: 0.3381
 epoch: 29, train_loss: 1.0579, test_loss: 1.0519, test_f1: 0.3394
 epoch: 30, train_loss: 1.0590, test_loss: 1.0537, test_f1: 0.3364
 epoch: 31, train_loss: 1.0535, test_loss: 1.0614, test_f1: 0.3460
 epoch: 32, train_loss: 1.0529, test_loss: 1.0527, test_f1: 0.3460
 epoch: 33, train_loss: 1.0440, test_loss: 1.0523, test_f1: 0.3555
 epoch: 34, train_loss: 1.0461, test_loss: 1.0380, test_f1: 0.3572
 epoch: 35, train_loss: 1.0425, test_loss: 1.0247, test_f1: 0.3576
 epoch: 36, train_loss: 1.0374, test_loss: 1.0390, test_f1: 0.3612
 epoch: 37, train_loss: 1.0375, test_loss: 1.0405, test_f1: 0.3789
 epoch: 38, train_loss: 1.0351, test_loss: 1.0406, test_f1: 0.3922
 epoch: 39, train_loss: 1.0318, test_loss: 1.0173, test_f1: 0.3685
 epoch: 40, train_loss: 1.0231, test_loss: 1.0430, test_f1: 0.3773
 epoch: 41, train_loss: 1.0243, test_loss: 1.0479, test_f1: 0.4068
 epoch: 42, train_loss: 1.0257, test_loss: 1.0233, test_f1: 0.3925
 epoch: 43, train_loss: 1.0163, test_loss: 1.0305, test_f1: 0.3852
 epoch: 44, train_loss: 1.0216, test_loss: 1.0237, test_f1: 0.3986
 epoch: 45, train_loss: 1.0179, test_loss: 1.0467, test_f1: 0.4247
 epoch: 46, train_loss: 1.0105, test_loss: 1.0356, test_f1: 0.4143
 epoch: 47, train_loss: 1.0089, test_loss: 1.0327, test_f1: 0.4139
 epoch: 48, train_loss: 1.0072, test_loss: 1.0229, test_f1: 0.4272
 epoch: 49, train_loss: 1.0081, test_loss: 0.9992, test_f1: 0.4272
 epoch: 50, train_loss: 1.0052, test_loss: 0.9928, test_f1: 0.3961
 epoch: 51, train_loss: 1.0005, test_loss: 1.0198, test_f1: 0.4166
 epoch: 52, train_loss: 0.9959, test_loss: 0.9953, test_f1: 0.4241
 epoch: 53, train_loss: 0.9982, test_loss: 1.0099, test_f1: 0.4245
 epoch: 54, train_loss: 0.9955, test_loss: 1.0194, test_f1: 0.4445
 epoch: 55, train_loss: 0.9911, test_loss: 1.0000, test_f1: 0.4233
 epoch: 56, train_loss: 0.9876, test_loss: 1.0014, test_f1: 0.4423
 epoch: 57, train_loss: 0.9942, test_loss: 0.9901, test_f1: 0.4395
 epoch: 58, train_loss: 0.9942, test_loss: 1.0077, test_f1: 0.4280
 epoch: 59, train_loss: 0.9983, test_loss: 0.9878, test_f1: 0.4549
 epoch: 60, train_loss: 0.9927, test_loss: 0.9964, test_f1: 0.4442
 epoch: 61, train_loss: 0.9982, test_loss: 1.0015, test_f1: 0.4401
 epoch: 62, train_loss: 0.9858, test_loss: 1.0012, test_f1: 0.4450
 epoch: 63, train_loss: 0.9916, test_loss: 1.0015, test_f1: 0.4562
 epoch: 64, train_loss: 0.9913, test_loss: 1.0047, test_f1: 0.4497
 epoch: 65, train_loss: 0.9965, test_loss: 1.0215, test_f1: 0.4333
 epoch: 66, train_loss: 0.9899, test_loss: 0.9865, test_f1: 0.4708
 epoch: 67, train_loss: 0.9843, test_loss: 0.9845, test_f1: 0.4627
 epoch: 68, train_loss: 0.9847, test_loss: 0.9955, test_f1: 0.4633
 epoch: 69, train_loss: 0.9869, test_loss: 0.9877, test_f1: 0.4527
 epoch: 70, train_loss: 0.9769, test_loss: 1.0120, test_f1: 0.4534
 epoch: 71, train_loss: 0.9738, test_loss: 0.9921, test_f1: 0.4672
 epoch: 72, train_loss: 0.9889, test_loss: 1.0028, test_f1: 0.4642
 epoch: 73, train_loss: 0.9829, test_loss: 1.0025, test_f1: 0.4614
 epoch: 74, train_loss: 0.9843, test_loss: 1.0024, test_f1: 0.4717
 epoch: 75, train_loss: 0.9843, test_loss: 0.9953, test_f1: 0.4583
 epoch: 76, train_loss: 0.9787, test_loss: 0.9998, test_f1: 0.4661
 epoch: 77, train_loss: 0.9822, test_loss: 1.0410, test_f1: 0.4336
 epoch: 78, train_loss: 0.9716, test_loss: 1.0016, test_f1: 0.4685
 epoch: 79, train_loss: 0.9786, test_loss: 0.9938, test_f1: 0.4458
 epoch: 80, train_loss: 0.9735, test_loss: 1.0088, test_f1: 0.4675
 epoch: 81, train_loss: 0.9797, test_loss: 0.9898, test_f1: 0.4695
 epoch: 82, train_loss: 0.9698, test_loss: 0.9980, test_f1: 0.4755
 epoch: 83, train_loss: 0.9841, test_loss: 1.0183, test_f1: 0.4526
 epoch: 84, train_loss: 0.9774, test_loss: 1.0428, test_f1: 0.4384
 epoch: 85, train_loss: 0.9674, test_loss: 0.9910, test_f1: 0.4660
 epoch: 86, train_loss: 0.9722, test_loss: 0.9989, test_f1: 0.4713
 epoch: 87, train_loss: 0.9660, test_loss: 0.9939, test_f1: 0.4742
 epoch: 88, train_loss: 0.9684, test_loss: 1.0287, test_f1: 0.4507
 epoch: 89, train_loss: 0.9674, test_loss: 1.0150, test_f1: 0.4688
 epoch: 90, train_loss: 0.9701, test_loss: 0.9872, test_f1: 0.4795
 epoch: 91, train_loss: 0.9598, test_loss: 0.9852, test_f1: 0.4760
 epoch: 92, train_loss: 0.9640, test_loss: 1.0047, test_f1: 0.4439
 epoch: 93, train_loss: 0.9666, test_loss: 1.0109, test_f1: 0.4645
 epoch: 94, train_loss: 0.9662, test_loss: 1.0132, test_f1: 0.4591
 epoch: 95, train_loss: 0.9622, test_loss: 0.9784, test_f1: 0.4840
 epoch: 96, train_loss: 0.9633, test_loss: 1.0269, test_f1: 0.4484
 epoch: 97, train_loss: 0.9568, test_loss: 0.9535, test_f1: 0.4833
 epoch: 98, train_loss: 0.9601, test_loss: 0.9974, test_f1: 0.4777
 epoch: 99, train_loss: 0.9544, test_loss: 1.0316, test_f1: 0.4627

Training completed in 1299.20 seconds
Best F1: 0.5123 at epoch 92
Mean F1 across iterations: 0.4796  0.0286
========================FINAL RESULTS================================
FEGIN weighted F1: 0.5123  0.0286
python main.py --data ltspice_examples --representation component_pin --model FEGIN --layers 5 --hiddens 16 --batch_size 32 --lr 0.0001 --emb_size 128 --epochs 100 --save_appendix component_pin_L5_H16_BS32_LR0.0001_E128 --no_val
-----



STDERR:
  File "main.py", line 370, in <module>
    main()
  File "main.py", line 254, in main
    dataset = dataset_class(
  File "/home/philip/projects/ltspice_examples_code_repo/Circuit-Completion-Using-GNNs/component_classification_with_link_prediction_head/evaluation/FEGIN/kernel/circuit_datasets.py", line 15, in __init__
    self.data, self.slices = torch.load(self.processed_paths[0])
  File "/home/philip/.local/lib/python3.8/site-packages/torch/serialization.py", line 1040, in load
    warnings.warn(
  File "/usr/lib/python3.8/warnings.py", line 109, in _showwarnmsg
    sw(msg.message, msg.category, msg.filename, msg.lineno,
  File "main.py", line 47, in warn_with_traceback
    traceback.print_stack(file=log)
/home/philip/projects/ltspice_examples_code_repo/Circuit-Completion-Using-GNNs/component_classification_with_link_prediction_head/evaluation/FEGIN/kernel/circuit_datasets.py:15: FutureWarning: You are using `torch.load` with `weights_only=False` (the current default value), which uses the default pickle module implicitly. It is possible to construct malicious pickle data which will execute arbitrary code during unpickling (See https://github.com/pytorch/pytorch/blob/main/SECURITY.md#untrusted-models for more details). In a future release, the default value for `weights_only` will be flipped to `True`. This limits the functions that could be executed during unpickling. Arbitrary objects will no longer be allowed to be loaded via this mode unless they are explicitly allowlisted by the user via `torch.serialization.add_safe_globals`. We recommend you start setting `weights_only=True` for any use case where you don't have full control of the loaded file. Please open an issue on GitHub for any issues related to this experimental feature.
  self.data, self.slices = torch.load(self.processed_paths[0])
