STDOUT:
Results will be saved in /home/philip/projects/ltspice_examples_code_repo/Circuit-Completion-Using-GNNs/component_classification_with_link_prediction_head/evaluation/FEGIN/results/model_FEGIN_dataset_ltspice_examples
Command line input: python main.py --data ltspice_examples --representation component_pin_net --model FEGIN --layers 2 --hiddens 128 --batch_size 64 --lr 0.001 --emb_size 128 --epochs 100 --save_appendix component_pin_net_L2_H128_BS64_LR0.001_E128 --no_val
 is saved.
-----
ltspice_examples - FEGIN
Using 2 layers, 128 hidden units, h = 2
Loading component_pin_net representation dataset
ENTERED
Training FEGIN on component_pin_net representation
Train: 3558, Test: 846
##################ITERATION #0 ****************************************
 epoch: 0, train_loss: 1.1348, test_loss: 1.0438, test_f1: 0.3892
 epoch: 1, train_loss: 0.9895, test_loss: 0.9436, test_f1: 0.5079
 epoch: 2, train_loss: 0.9544, test_loss: 0.9628, test_f1: 0.4976
 epoch: 3, train_loss: 0.9307, test_loss: 0.9183, test_f1: 0.5116
 epoch: 4, train_loss: 0.9096, test_loss: 0.8808, test_f1: 0.5426
 epoch: 5, train_loss: 0.8891, test_loss: 0.8890, test_f1: 0.5015
 epoch: 6, train_loss: 0.8644, test_loss: 0.8789, test_f1: 0.5392
 epoch: 7, train_loss: 0.8373, test_loss: 0.8680, test_f1: 0.5820
 epoch: 8, train_loss: 0.8166, test_loss: 0.8592, test_f1: 0.5520
 epoch: 9, train_loss: 0.7961, test_loss: 0.8142, test_f1: 0.6046
 epoch: 10, train_loss: 0.7778, test_loss: 0.9623, test_f1: 0.5436
 epoch: 11, train_loss: 0.7805, test_loss: 0.8300, test_f1: 0.6232
 epoch: 12, train_loss: 0.7552, test_loss: 0.8100, test_f1: 0.6230
 epoch: 13, train_loss: 0.7223, test_loss: 0.8110, test_f1: 0.5794
 epoch: 14, train_loss: 0.7263, test_loss: 0.8864, test_f1: 0.5538
 epoch: 15, train_loss: 0.7088, test_loss: 0.7954, test_f1: 0.6320
 epoch: 16, train_loss: 0.6880, test_loss: 0.7384, test_f1: 0.6306
 epoch: 17, train_loss: 0.6766, test_loss: 0.8190, test_f1: 0.6240
 epoch: 18, train_loss: 0.6675, test_loss: 0.7651, test_f1: 0.6171
 epoch: 19, train_loss: 0.6565, test_loss: 0.7501, test_f1: 0.6328
 epoch: 20, train_loss: 0.6365, test_loss: 0.7547, test_f1: 0.6529
 epoch: 21, train_loss: 0.6266, test_loss: 0.7532, test_f1: 0.6428
 epoch: 22, train_loss: 0.6246, test_loss: 0.7974, test_f1: 0.6398
 epoch: 23, train_loss: 0.6003, test_loss: 0.8111, test_f1: 0.6463
 epoch: 24, train_loss: 0.5903, test_loss: 0.8784, test_f1: 0.6293
 epoch: 25, train_loss: 0.5865, test_loss: 0.7598, test_f1: 0.6437
 epoch: 26, train_loss: 0.5818, test_loss: 0.8033, test_f1: 0.6501
 epoch: 27, train_loss: 0.5737, test_loss: 0.8083, test_f1: 0.6436
 epoch: 28, train_loss: 0.5601, test_loss: 0.8489, test_f1: 0.6437
 epoch: 29, train_loss: 0.5423, test_loss: 0.8240, test_f1: 0.6448
 epoch: 30, train_loss: 0.5208, test_loss: 0.9410, test_f1: 0.6097
 epoch: 31, train_loss: 0.5402, test_loss: 0.7893, test_f1: 0.6592
 epoch: 32, train_loss: 0.5308, test_loss: 0.9235, test_f1: 0.6558
 epoch: 33, train_loss: 0.4850, test_loss: 0.8358, test_f1: 0.6415
 epoch: 34, train_loss: 0.5149, test_loss: 0.8369, test_f1: 0.6587
 epoch: 35, train_loss: 0.4920, test_loss: 0.9075, test_f1: 0.6900
 epoch: 36, train_loss: 0.4887, test_loss: 0.9153, test_f1: 0.6458
 epoch: 37, train_loss: 0.4643, test_loss: 0.9167, test_f1: 0.6387
 epoch: 38, train_loss: 0.4588, test_loss: 0.9422, test_f1: 0.6710
 epoch: 39, train_loss: 0.4483, test_loss: 0.9135, test_f1: 0.6783
 epoch: 40, train_loss: 0.4600, test_loss: 0.9894, test_f1: 0.6406
 epoch: 41, train_loss: 0.4430, test_loss: 0.9121, test_f1: 0.6685
 epoch: 42, train_loss: 0.4514, test_loss: 0.9018, test_f1: 0.6799
 epoch: 43, train_loss: 0.4305, test_loss: 0.9619, test_f1: 0.6862
 epoch: 44, train_loss: 0.4233, test_loss: 0.8798, test_f1: 0.6735
 epoch: 45, train_loss: 0.4209, test_loss: 1.0197, test_f1: 0.6696
 epoch: 46, train_loss: 0.4153, test_loss: 0.9845, test_f1: 0.6589
 epoch: 47, train_loss: 0.4108, test_loss: 1.0220, test_f1: 0.6676
 epoch: 48, train_loss: 0.3947, test_loss: 0.9544, test_f1: 0.6668
 epoch: 49, train_loss: 0.3869, test_loss: 1.0665, test_f1: 0.6662
 epoch: 50, train_loss: 0.3793, test_loss: 1.0935, test_f1: 0.6502
 epoch: 51, train_loss: 0.3514, test_loss: 1.0262, test_f1: 0.6878
 epoch: 52, train_loss: 0.3224, test_loss: 1.1091, test_f1: 0.7024
 epoch: 53, train_loss: 0.3177, test_loss: 1.0859, test_f1: 0.6737
 epoch: 54, train_loss: 0.3013, test_loss: 1.1805, test_f1: 0.6892
 epoch: 55, train_loss: 0.3017, test_loss: 1.1792, test_f1: 0.6667
 epoch: 56, train_loss: 0.3031, test_loss: 1.2296, test_f1: 0.6726
 epoch: 57, train_loss: 0.2951, test_loss: 1.2875, test_f1: 0.6752
 epoch: 58, train_loss: 0.2854, test_loss: 1.2893, test_f1: 0.6787
 epoch: 59, train_loss: 0.2929, test_loss: 1.1912, test_f1: 0.6798
 epoch: 60, train_loss: 0.2941, test_loss: 1.3145, test_f1: 0.6905
 epoch: 61, train_loss: 0.2792, test_loss: 1.2048, test_f1: 0.6893
 epoch: 62, train_loss: 0.2800, test_loss: 1.3100, test_f1: 0.6662
 epoch: 63, train_loss: 0.2879, test_loss: 1.4297, test_f1: 0.6645
 epoch: 64, train_loss: 0.2822, test_loss: 1.2786, test_f1: 0.6965
 epoch: 65, train_loss: 0.2803, test_loss: 1.2970, test_f1: 0.6884
 epoch: 66, train_loss: 0.2707, test_loss: 1.3779, test_f1: 0.6729
 epoch: 67, train_loss: 0.2627, test_loss: 1.3030, test_f1: 0.6807
 epoch: 68, train_loss: 0.2537, test_loss: 1.4502, test_f1: 0.6659
 epoch: 69, train_loss: 0.2647, test_loss: 1.4421, test_f1: 0.6830
 epoch: 70, train_loss: 0.2753, test_loss: 1.2605, test_f1: 0.6875
 epoch: 71, train_loss: 0.2660, test_loss: 1.4129, test_f1: 0.6909
 epoch: 72, train_loss: 0.2655, test_loss: 1.4828, test_f1: 0.6894
 epoch: 73, train_loss: 0.2565, test_loss: 1.3911, test_f1: 0.6853
 epoch: 74, train_loss: 0.2331, test_loss: 1.5333, test_f1: 0.6776
 epoch: 75, train_loss: 0.2541, test_loss: 1.4491, test_f1: 0.6896
 epoch: 76, train_loss: 0.2230, test_loss: 1.4546, test_f1: 0.6838
 epoch: 77, train_loss: 0.2369, test_loss: 1.5242, test_f1: 0.7022
 epoch: 78, train_loss: 0.2416, test_loss: 1.3942, test_f1: 0.7005
 epoch: 79, train_loss: 0.2509, test_loss: 1.4884, test_f1: 0.6900
 epoch: 80, train_loss: 0.2299, test_loss: 1.4351, test_f1: 0.6801
 epoch: 81, train_loss: 0.2255, test_loss: 1.4559, test_f1: 0.6881
 epoch: 82, train_loss: 0.2238, test_loss: 1.5125, test_f1: 0.6995
 epoch: 83, train_loss: 0.2397, test_loss: 1.4730, test_f1: 0.6899
 epoch: 84, train_loss: 0.2283, test_loss: 1.4714, test_f1: 0.6815
 epoch: 85, train_loss: 0.2219, test_loss: 1.6453, test_f1: 0.6935
 epoch: 86, train_loss: 0.2278, test_loss: 1.5401, test_f1: 0.7013
 epoch: 87, train_loss: 0.2167, test_loss: 1.4890, test_f1: 0.6868
 epoch: 88, train_loss: 0.2233, test_loss: 1.6060, test_f1: 0.6993
 epoch: 89, train_loss: 0.2051, test_loss: 1.4987, test_f1: 0.7048
 epoch: 90, train_loss: 0.2063, test_loss: 1.5675, test_f1: 0.7032
 epoch: 91, train_loss: 0.2083, test_loss: 1.5568, test_f1: 0.6795
 epoch: 92, train_loss: 0.2005, test_loss: 1.5650, test_f1: 0.6815
 epoch: 93, train_loss: 0.2056, test_loss: 1.5840, test_f1: 0.6910
 epoch: 94, train_loss: 0.1957, test_loss: 1.7428, test_f1: 0.6809
 epoch: 95, train_loss: 0.1977, test_loss: 1.5947, test_f1: 0.6872
 epoch: 96, train_loss: 0.2000, test_loss: 1.6500, test_f1: 0.6803
 epoch: 97, train_loss: 0.1882, test_loss: 1.6357, test_f1: 0.6887
 epoch: 98, train_loss: 0.1958, test_loss: 1.6746, test_f1: 0.6792
 epoch: 99, train_loss: 0.1921, test_loss: 1.7481, test_f1: 0.6741
##################ITERATION #1 ****************************************
 epoch: 0, train_loss: 1.0512, test_loss: 0.9686, test_f1: 0.5260
 epoch: 1, train_loss: 0.9468, test_loss: 0.9057, test_f1: 0.5081
 epoch: 2, train_loss: 0.9034, test_loss: 0.9154, test_f1: 0.5391
 epoch: 3, train_loss: 0.8740, test_loss: 0.8651, test_f1: 0.6019
 epoch: 4, train_loss: 0.8534, test_loss: 0.8155, test_f1: 0.5904
 epoch: 5, train_loss: 0.8377, test_loss: 0.9646, test_f1: 0.5281
 epoch: 6, train_loss: 0.8041, test_loss: 0.8602, test_f1: 0.6187
 epoch: 7, train_loss: 0.7837, test_loss: 0.8276, test_f1: 0.6023
 epoch: 8, train_loss: 0.7720, test_loss: 0.8000, test_f1: 0.6070
 epoch: 9, train_loss: 0.7441, test_loss: 0.8374, test_f1: 0.6215
 epoch: 10, train_loss: 0.7236, test_loss: 0.8009, test_f1: 0.6596
 epoch: 11, train_loss: 0.7086, test_loss: 0.7397, test_f1: 0.6410
 epoch: 12, train_loss: 0.6990, test_loss: 0.8093, test_f1: 0.6238
 epoch: 13, train_loss: 0.6944, test_loss: 0.7882, test_f1: 0.6502
 epoch: 14, train_loss: 0.6771, test_loss: 0.7796, test_f1: 0.6614
 epoch: 15, train_loss: 0.6481, test_loss: 0.8033, test_f1: 0.6217
 epoch: 16, train_loss: 0.6380, test_loss: 0.7841, test_f1: 0.6525
 epoch: 17, train_loss: 0.6237, test_loss: 0.7484, test_f1: 0.6461
 epoch: 18, train_loss: 0.6194, test_loss: 0.8158, test_f1: 0.6520
 epoch: 19, train_loss: 0.5961, test_loss: 0.8338, test_f1: 0.6685
 epoch: 20, train_loss: 0.6002, test_loss: 0.8322, test_f1: 0.6681
 epoch: 21, train_loss: 0.5781, test_loss: 0.8070, test_f1: 0.6636
 epoch: 22, train_loss: 0.5657, test_loss: 0.7834, test_f1: 0.6471
 epoch: 23, train_loss: 0.5686, test_loss: 0.9025, test_f1: 0.6763
 epoch: 24, train_loss: 0.5396, test_loss: 0.9332, test_f1: 0.6635
 epoch: 25, train_loss: 0.5363, test_loss: 0.8905, test_f1: 0.6667
 epoch: 26, train_loss: 0.5306, test_loss: 0.9544, test_f1: 0.6636
 epoch: 27, train_loss: 0.5186, test_loss: 0.9840, test_f1: 0.6613
 epoch: 28, train_loss: 0.5187, test_loss: 0.9665, test_f1: 0.6699
 epoch: 29, train_loss: 0.4951, test_loss: 1.0009, test_f1: 0.6732
 epoch: 30, train_loss: 0.4993, test_loss: 0.9515, test_f1: 0.6486
 epoch: 31, train_loss: 0.4742, test_loss: 0.9469, test_f1: 0.6920
 epoch: 32, train_loss: 0.4799, test_loss: 0.9242, test_f1: 0.6642
 epoch: 33, train_loss: 0.4751, test_loss: 0.9104, test_f1: 0.6800
 epoch: 34, train_loss: 0.4539, test_loss: 0.9891, test_f1: 0.6690
 epoch: 35, train_loss: 0.4392, test_loss: 1.0453, test_f1: 0.6821
 epoch: 36, train_loss: 0.4297, test_loss: 0.9991, test_f1: 0.6880
 epoch: 37, train_loss: 0.4225, test_loss: 0.9349, test_f1: 0.6931
 epoch: 38, train_loss: 0.4335, test_loss: 0.9023, test_f1: 0.6569
 epoch: 39, train_loss: 0.4210, test_loss: 1.1520, test_f1: 0.6562
 epoch: 40, train_loss: 0.4129, test_loss: 0.9872, test_f1: 0.6924
 epoch: 41, train_loss: 0.4180, test_loss: 1.2434, test_f1: 0.6588
 epoch: 42, train_loss: 0.3920, test_loss: 1.0768, test_f1: 0.6787
 epoch: 43, train_loss: 0.3827, test_loss: 1.2114, test_f1: 0.6524
 epoch: 44, train_loss: 0.3772, test_loss: 1.0920, test_f1: 0.6711
 epoch: 45, train_loss: 0.3708, test_loss: 1.0978, test_f1: 0.6698
 epoch: 46, train_loss: 0.3655, test_loss: 1.1565, test_f1: 0.6833
 epoch: 47, train_loss: 0.3529, test_loss: 1.1631, test_f1: 0.6674
 epoch: 48, train_loss: 0.3754, test_loss: 1.0514, test_f1: 0.6728
 epoch: 49, train_loss: 0.3706, test_loss: 1.1630, test_f1: 0.6730
 epoch: 50, train_loss: 0.3471, test_loss: 1.1517, test_f1: 0.6693
 epoch: 51, train_loss: 0.3208, test_loss: 1.1388, test_f1: 0.6741
 epoch: 52, train_loss: 0.2852, test_loss: 1.1654, test_f1: 0.6825
 epoch: 53, train_loss: 0.2784, test_loss: 1.2551, test_f1: 0.6605
 epoch: 54, train_loss: 0.2618, test_loss: 1.2678, test_f1: 0.6710
 epoch: 55, train_loss: 0.2742, test_loss: 1.2452, test_f1: 0.6842
 epoch: 56, train_loss: 0.2555, test_loss: 1.2900, test_f1: 0.6803
 epoch: 57, train_loss: 0.2649, test_loss: 1.3941, test_f1: 0.6613
 epoch: 58, train_loss: 0.2496, test_loss: 1.3984, test_f1: 0.6686
 epoch: 59, train_loss: 0.2740, test_loss: 1.3961, test_f1: 0.6619
 epoch: 60, train_loss: 0.2544, test_loss: 1.4004, test_f1: 0.6833
 epoch: 61, train_loss: 0.2370, test_loss: 1.4323, test_f1: 0.6639
 epoch: 62, train_loss: 0.2308, test_loss: 1.4097, test_f1: 0.6697
 epoch: 63, train_loss: 0.2278, test_loss: 1.4812, test_f1: 0.6643
 epoch: 64, train_loss: 0.2401, test_loss: 1.3805, test_f1: 0.6706
 epoch: 65, train_loss: 0.2484, test_loss: 1.4668, test_f1: 0.6701
 epoch: 66, train_loss: 0.2348, test_loss: 1.4887, test_f1: 0.6754
 epoch: 67, train_loss: 0.2267, test_loss: 1.4855, test_f1: 0.6634
 epoch: 68, train_loss: 0.2164, test_loss: 1.5545, test_f1: 0.6653
 epoch: 69, train_loss: 0.2187, test_loss: 1.5490, test_f1: 0.6736
 epoch: 70, train_loss: 0.2215, test_loss: 1.4419, test_f1: 0.6764
 epoch: 71, train_loss: 0.2230, test_loss: 1.4447, test_f1: 0.6691
 epoch: 72, train_loss: 0.2118, test_loss: 1.4445, test_f1: 0.6779
 epoch: 73, train_loss: 0.2252, test_loss: 1.5755, test_f1: 0.6768
 epoch: 74, train_loss: 0.2169, test_loss: 1.5537, test_f1: 0.6755
 epoch: 75, train_loss: 0.2109, test_loss: 1.6660, test_f1: 0.6730
 epoch: 76, train_loss: 0.2075, test_loss: 1.4015, test_f1: 0.6884
 epoch: 77, train_loss: 0.2079, test_loss: 1.6327, test_f1: 0.6767
 epoch: 78, train_loss: 0.2064, test_loss: 1.6211, test_f1: 0.6796
 epoch: 79, train_loss: 0.2115, test_loss: 1.5927, test_f1: 0.6604
 epoch: 80, train_loss: 0.1861, test_loss: 1.7201, test_f1: 0.6727
 epoch: 81, train_loss: 0.1963, test_loss: 1.6373, test_f1: 0.6908
 epoch: 82, train_loss: 0.2049, test_loss: 1.6184, test_f1: 0.6734
 epoch: 83, train_loss: 0.1998, test_loss: 1.6908, test_f1: 0.6648
 epoch: 84, train_loss: 0.1821, test_loss: 1.7545, test_f1: 0.6832
 epoch: 85, train_loss: 0.1995, test_loss: 1.8368, test_f1: 0.6501
 epoch: 86, train_loss: 0.1818, test_loss: 1.7487, test_f1: 0.6760
 epoch: 87, train_loss: 0.2124, test_loss: 1.8545, test_f1: 0.6748
 epoch: 88, train_loss: 0.1813, test_loss: 1.7803, test_f1: 0.6705
 epoch: 89, train_loss: 0.1904, test_loss: 1.7527, test_f1: 0.6586
 epoch: 90, train_loss: 0.1800, test_loss: 1.7380, test_f1: 0.6663
 epoch: 91, train_loss: 0.1804, test_loss: 1.6802, test_f1: 0.6807
 epoch: 92, train_loss: 0.1825, test_loss: 1.6700, test_f1: 0.6630
 epoch: 93, train_loss: 0.1897, test_loss: 1.7886, test_f1: 0.6824
 epoch: 94, train_loss: 0.1817, test_loss: 1.7467, test_f1: 0.6914
 epoch: 95, train_loss: 0.1753, test_loss: 1.7412, test_f1: 0.6814
 epoch: 96, train_loss: 0.1702, test_loss: 1.7948, test_f1: 0.6668
 epoch: 97, train_loss: 0.1852, test_loss: 1.7299, test_f1: 0.6655
 epoch: 98, train_loss: 0.1722, test_loss: 1.8199, test_f1: 0.6792
 epoch: 99, train_loss: 0.1676, test_loss: 1.7758, test_f1: 0.6849
##################ITERATION #2 ****************************************
 epoch: 0, train_loss: 1.1222, test_loss: 1.0577, test_f1: 0.4857
 epoch: 1, train_loss: 0.9486, test_loss: 0.9188, test_f1: 0.5332
 epoch: 2, train_loss: 0.9022, test_loss: 0.9127, test_f1: 0.5433
 epoch: 3, train_loss: 0.8664, test_loss: 0.8922, test_f1: 0.6294
 epoch: 4, train_loss: 0.8524, test_loss: 0.8756, test_f1: 0.5832
 epoch: 5, train_loss: 0.8218, test_loss: 0.8095, test_f1: 0.6135
 epoch: 6, train_loss: 0.8022, test_loss: 0.8313, test_f1: 0.6259
 epoch: 7, train_loss: 0.8018, test_loss: 0.8013, test_f1: 0.6014
 epoch: 8, train_loss: 0.7603, test_loss: 0.8443, test_f1: 0.6022
 epoch: 9, train_loss: 0.7556, test_loss: 0.7736, test_f1: 0.6312
 epoch: 10, train_loss: 0.7417, test_loss: 0.7906, test_f1: 0.6597
 epoch: 11, train_loss: 0.7151, test_loss: 0.7836, test_f1: 0.6350
 epoch: 12, train_loss: 0.6947, test_loss: 0.7174, test_f1: 0.6446
 epoch: 13, train_loss: 0.6967, test_loss: 0.8094, test_f1: 0.6559
 epoch: 14, train_loss: 0.6856, test_loss: 0.7961, test_f1: 0.6447
 epoch: 15, train_loss: 0.6668, test_loss: 0.8269, test_f1: 0.6551
 epoch: 16, train_loss: 0.6474, test_loss: 0.8233, test_f1: 0.6561
 epoch: 17, train_loss: 0.6306, test_loss: 0.8195, test_f1: 0.5856
 epoch: 18, train_loss: 0.6294, test_loss: 0.7858, test_f1: 0.6406
 epoch: 19, train_loss: 0.6236, test_loss: 0.8387, test_f1: 0.6262
 epoch: 20, train_loss: 0.6068, test_loss: 0.7198, test_f1: 0.6619
 epoch: 21, train_loss: 0.5745, test_loss: 0.7975, test_f1: 0.6429
 epoch: 22, train_loss: 0.6071, test_loss: 0.8587, test_f1: 0.6511
 epoch: 23, train_loss: 0.5718, test_loss: 0.7473, test_f1: 0.6864
 epoch: 24, train_loss: 0.5606, test_loss: 0.8125, test_f1: 0.6792
 epoch: 25, train_loss: 0.5542, test_loss: 0.8091, test_f1: 0.6559
 epoch: 26, train_loss: 0.5317, test_loss: 0.7572, test_f1: 0.6746
 epoch: 27, train_loss: 0.5219, test_loss: 0.8750, test_f1: 0.6320
 epoch: 28, train_loss: 0.5345, test_loss: 0.8706, test_f1: 0.6809
 epoch: 29, train_loss: 0.5127, test_loss: 0.9019, test_f1: 0.6611
 epoch: 30, train_loss: 0.5165, test_loss: 0.8219, test_f1: 0.6743
 epoch: 31, train_loss: 0.4914, test_loss: 0.8504, test_f1: 0.6641
 epoch: 32, train_loss: 0.4847, test_loss: 0.8866, test_f1: 0.6902
 epoch: 33, train_loss: 0.4850, test_loss: 0.8319, test_f1: 0.6625
 epoch: 34, train_loss: 0.4497, test_loss: 0.9298, test_f1: 0.6495
 epoch: 35, train_loss: 0.4519, test_loss: 0.8421, test_f1: 0.6681
 epoch: 36, train_loss: 0.4633, test_loss: 0.9050, test_f1: 0.6675
 epoch: 37, train_loss: 0.4427, test_loss: 0.9788, test_f1: 0.6231
 epoch: 38, train_loss: 0.4699, test_loss: 0.9174, test_f1: 0.6762
 epoch: 39, train_loss: 0.4735, test_loss: 0.8884, test_f1: 0.6702
 epoch: 40, train_loss: 0.4167, test_loss: 0.9765, test_f1: 0.6817
 epoch: 41, train_loss: 0.4163, test_loss: 0.9162, test_f1: 0.6808
 epoch: 42, train_loss: 0.4246, test_loss: 1.0224, test_f1: 0.6715
 epoch: 43, train_loss: 0.4161, test_loss: 0.9664, test_f1: 0.6578
 epoch: 44, train_loss: 0.4060, test_loss: 0.9484, test_f1: 0.6693
 epoch: 45, train_loss: 0.3962, test_loss: 0.9386, test_f1: 0.6937
 epoch: 46, train_loss: 0.4010, test_loss: 0.9896, test_f1: 0.6524
 epoch: 47, train_loss: 0.3853, test_loss: 0.9222, test_f1: 0.6892
 epoch: 48, train_loss: 0.3718, test_loss: 0.9690, test_f1: 0.6871
 epoch: 49, train_loss: 0.3764, test_loss: 0.9369, test_f1: 0.6849
 epoch: 50, train_loss: 0.3610, test_loss: 1.0622, test_f1: 0.6704
 epoch: 51, train_loss: 0.3182, test_loss: 1.0812, test_f1: 0.6789
 epoch: 52, train_loss: 0.3065, test_loss: 1.0397, test_f1: 0.6857
 epoch: 53, train_loss: 0.3099, test_loss: 1.0785, test_f1: 0.6918
 epoch: 54, train_loss: 0.2822, test_loss: 1.0733, test_f1: 0.6808
 epoch: 55, train_loss: 0.2922, test_loss: 1.0698, test_f1: 0.6931
 epoch: 56, train_loss: 0.2771, test_loss: 1.2091, test_f1: 0.6788
 epoch: 57, train_loss: 0.2754, test_loss: 1.1975, test_f1: 0.6709
 epoch: 58, train_loss: 0.2799, test_loss: 1.2310, test_f1: 0.6798
 epoch: 59, train_loss: 0.2669, test_loss: 1.1963, test_f1: 0.6781
 epoch: 60, train_loss: 0.2721, test_loss: 1.2105, test_f1: 0.6841
 epoch: 61, train_loss: 0.2652, test_loss: 1.2452, test_f1: 0.6793
 epoch: 62, train_loss: 0.2534, test_loss: 1.2604, test_f1: 0.6821
 epoch: 63, train_loss: 0.2427, test_loss: 1.3011, test_f1: 0.6709
 epoch: 64, train_loss: 0.2508, test_loss: 1.2769, test_f1: 0.6761
 epoch: 65, train_loss: 0.2501, test_loss: 1.3274, test_f1: 0.6559
 epoch: 66, train_loss: 0.2442, test_loss: 1.3460, test_f1: 0.6667
 epoch: 67, train_loss: 0.2369, test_loss: 1.3944, test_f1: 0.6847
 epoch: 68, train_loss: 0.2652, test_loss: 1.2629, test_f1: 0.6840
 epoch: 69, train_loss: 0.2403, test_loss: 1.2760, test_f1: 0.6634
 epoch: 70, train_loss: 0.2473, test_loss: 1.2934, test_f1: 0.6808
 epoch: 71, train_loss: 0.2296, test_loss: 1.3506, test_f1: 0.6758
 epoch: 72, train_loss: 0.2300, test_loss: 1.3838, test_f1: 0.6768
 epoch: 73, train_loss: 0.2312, test_loss: 1.3898, test_f1: 0.6737
 epoch: 74, train_loss: 0.2327, test_loss: 1.2934, test_f1: 0.6684
 epoch: 75, train_loss: 0.2152, test_loss: 1.3586, test_f1: 0.6848
 epoch: 76, train_loss: 0.2197, test_loss: 1.3287, test_f1: 0.6638
 epoch: 77, train_loss: 0.2266, test_loss: 1.4020, test_f1: 0.6892
 epoch: 78, train_loss: 0.1960, test_loss: 1.3804, test_f1: 0.6857
 epoch: 79, train_loss: 0.2027, test_loss: 1.5084, test_f1: 0.6655
 epoch: 80, train_loss: 0.2200, test_loss: 1.4777, test_f1: 0.6681
 epoch: 81, train_loss: 0.2183, test_loss: 1.4183, test_f1: 0.6695
 epoch: 82, train_loss: 0.2152, test_loss: 1.4749, test_f1: 0.6745
 epoch: 83, train_loss: 0.2083, test_loss: 1.4055, test_f1: 0.6708
 epoch: 84, train_loss: 0.2161, test_loss: 1.4690, test_f1: 0.6668
 epoch: 85, train_loss: 0.2125, test_loss: 1.5339, test_f1: 0.6544
 epoch: 86, train_loss: 0.2190, test_loss: 1.4890, test_f1: 0.6739
 epoch: 87, train_loss: 0.2065, test_loss: 1.4733, test_f1: 0.6576
 epoch: 88, train_loss: 0.1858, test_loss: 1.4122, test_f1: 0.6707
 epoch: 89, train_loss: 0.1910, test_loss: 1.5806, test_f1: 0.6680
 epoch: 90, train_loss: 0.1978, test_loss: 1.5105, test_f1: 0.6672
 epoch: 91, train_loss: 0.1949, test_loss: 1.4861, test_f1: 0.6930
 epoch: 92, train_loss: 0.1783, test_loss: 1.5047, test_f1: 0.6746
 epoch: 93, train_loss: 0.1879, test_loss: 1.5047, test_f1: 0.6768
 epoch: 94, train_loss: 0.2016, test_loss: 1.4996, test_f1: 0.6616
 epoch: 95, train_loss: 0.1854, test_loss: 1.5779, test_f1: 0.6746
 epoch: 96, train_loss: 0.1950, test_loss: 1.4948, test_f1: 0.6798
 epoch: 97, train_loss: 0.1998, test_loss: 1.5337, test_f1: 0.6717
 epoch: 98, train_loss: 0.1876, test_loss: 1.5169, test_f1: 0.6787
 epoch: 99, train_loss: 0.1769, test_loss: 1.5311, test_f1: 0.6701
##################ITERATION #3 ****************************************
 epoch: 0, train_loss: 1.2566, test_loss: 0.9724, test_f1: 0.4639
 epoch: 1, train_loss: 0.9713, test_loss: 0.9062, test_f1: 0.5512
 epoch: 2, train_loss: 0.9285, test_loss: 0.8962, test_f1: 0.5294
 epoch: 3, train_loss: 0.8958, test_loss: 0.8886, test_f1: 0.5991
 epoch: 4, train_loss: 0.8650, test_loss: 0.8125, test_f1: 0.6070
 epoch: 5, train_loss: 0.8495, test_loss: 0.8533, test_f1: 0.5809
 epoch: 6, train_loss: 0.8133, test_loss: 0.8436, test_f1: 0.5870
 epoch: 7, train_loss: 0.8057, test_loss: 0.7930, test_f1: 0.6163
 epoch: 8, train_loss: 0.7831, test_loss: 0.8113, test_f1: 0.6147
 epoch: 9, train_loss: 0.7625, test_loss: 0.8420, test_f1: 0.6176
 epoch: 10, train_loss: 0.7396, test_loss: 0.8537, test_f1: 0.6261
 epoch: 11, train_loss: 0.7288, test_loss: 0.7723, test_f1: 0.6382
 epoch: 12, train_loss: 0.7070, test_loss: 0.8020, test_f1: 0.6648
 epoch: 13, train_loss: 0.7119, test_loss: 0.7757, test_f1: 0.6321
 epoch: 14, train_loss: 0.6964, test_loss: 0.7710, test_f1: 0.6337
 epoch: 15, train_loss: 0.6778, test_loss: 0.7326, test_f1: 0.6456
 epoch: 16, train_loss: 0.6494, test_loss: 0.7909, test_f1: 0.6151
 epoch: 17, train_loss: 0.6501, test_loss: 0.8199, test_f1: 0.6489
 epoch: 18, train_loss: 0.6356, test_loss: 0.7737, test_f1: 0.6526
 epoch: 19, train_loss: 0.6285, test_loss: 0.8259, test_f1: 0.6420
 epoch: 20, train_loss: 0.6147, test_loss: 0.8238, test_f1: 0.5976
 epoch: 21, train_loss: 0.6096, test_loss: 0.7991, test_f1: 0.6511
 epoch: 22, train_loss: 0.6171, test_loss: 0.7939, test_f1: 0.6406
 epoch: 23, train_loss: 0.5997, test_loss: 0.8536, test_f1: 0.6615
 epoch: 24, train_loss: 0.5927, test_loss: 0.7755, test_f1: 0.6685
 epoch: 25, train_loss: 0.5733, test_loss: 0.8581, test_f1: 0.6686
 epoch: 26, train_loss: 0.5649, test_loss: 0.8315, test_f1: 0.6778
 epoch: 27, train_loss: 0.5503, test_loss: 0.9284, test_f1: 0.6886
 epoch: 28, train_loss: 0.5417, test_loss: 0.8084, test_f1: 0.6540
 epoch: 29, train_loss: 0.5308, test_loss: 0.8708, test_f1: 0.6655
 epoch: 30, train_loss: 0.5126, test_loss: 0.8861, test_f1: 0.6584
 epoch: 31, train_loss: 0.5188, test_loss: 0.9201, test_f1: 0.6478
 epoch: 32, train_loss: 0.5045, test_loss: 0.9100, test_f1: 0.6633
 epoch: 33, train_loss: 0.5080, test_loss: 0.8549, test_f1: 0.6832
 epoch: 34, train_loss: 0.4918, test_loss: 0.9283, test_f1: 0.6483
 epoch: 35, train_loss: 0.4857, test_loss: 0.9294, test_f1: 0.6404
 epoch: 36, train_loss: 0.4874, test_loss: 0.8720, test_f1: 0.6787
 epoch: 37, train_loss: 0.4391, test_loss: 0.8939, test_f1: 0.6973
 epoch: 38, train_loss: 0.4491, test_loss: 0.9621, test_f1: 0.6787
 epoch: 39, train_loss: 0.4479, test_loss: 0.9531, test_f1: 0.6968
 epoch: 40, train_loss: 0.4734, test_loss: 0.9869, test_f1: 0.6638
 epoch: 41, train_loss: 0.4518, test_loss: 0.9563, test_f1: 0.6797
 epoch: 42, train_loss: 0.4172, test_loss: 1.0521, test_f1: 0.6670
 epoch: 43, train_loss: 0.3984, test_loss: 1.0132, test_f1: 0.6696
 epoch: 44, train_loss: 0.4249, test_loss: 1.0088, test_f1: 0.6633
 epoch: 45, train_loss: 0.4307, test_loss: 1.1353, test_f1: 0.6523
 epoch: 46, train_loss: 0.4052, test_loss: 1.0903, test_f1: 0.6662
 epoch: 47, train_loss: 0.3958, test_loss: 1.0306, test_f1: 0.7054
 epoch: 48, train_loss: 0.3905, test_loss: 1.0915, test_f1: 0.6766
 epoch: 49, train_loss: 0.3730, test_loss: 1.2075, test_f1: 0.6761
 epoch: 50, train_loss: 0.4141, test_loss: 1.2054, test_f1: 0.6851
 epoch: 51, train_loss: 0.3439, test_loss: 1.1667, test_f1: 0.7027
 epoch: 52, train_loss: 0.3120, test_loss: 1.2390, test_f1: 0.6764
 epoch: 53, train_loss: 0.3157, test_loss: 1.2653, test_f1: 0.6876
 epoch: 54, train_loss: 0.3037, test_loss: 1.1890, test_f1: 0.7085
 epoch: 55, train_loss: 0.2949, test_loss: 1.1957, test_f1: 0.7011
 epoch: 56, train_loss: 0.2775, test_loss: 1.2774, test_f1: 0.6816
 epoch: 57, train_loss: 0.3037, test_loss: 1.2171, test_f1: 0.6816
 epoch: 58, train_loss: 0.3025, test_loss: 1.1969, test_f1: 0.6877
 epoch: 59, train_loss: 0.2798, test_loss: 1.2476, test_f1: 0.6954
 epoch: 60, train_loss: 0.2587, test_loss: 1.1794, test_f1: 0.7030
 epoch: 61, train_loss: 0.2773, test_loss: 1.2549, test_f1: 0.6987
 epoch: 62, train_loss: 0.2717, test_loss: 1.2785, test_f1: 0.6791
 epoch: 63, train_loss: 0.2702, test_loss: 1.2321, test_f1: 0.6826
 epoch: 64, train_loss: 0.2566, test_loss: 1.2673, test_f1: 0.6870
 epoch: 65, train_loss: 0.2555, test_loss: 1.3415, test_f1: 0.6943
 epoch: 66, train_loss: 0.2509, test_loss: 1.3180, test_f1: 0.7133
 epoch: 67, train_loss: 0.2732, test_loss: 1.2886, test_f1: 0.6787
 epoch: 68, train_loss: 0.2592, test_loss: 1.3366, test_f1: 0.6782
 epoch: 69, train_loss: 0.2286, test_loss: 1.3545, test_f1: 0.6705
 epoch: 70, train_loss: 0.2459, test_loss: 1.3430, test_f1: 0.6881
 epoch: 71, train_loss: 0.2384, test_loss: 1.3560, test_f1: 0.6804
 epoch: 72, train_loss: 0.2260, test_loss: 1.3678, test_f1: 0.6880
 epoch: 73, train_loss: 0.2487, test_loss: 1.3381, test_f1: 0.6907
 epoch: 74, train_loss: 0.2416, test_loss: 1.3405, test_f1: 0.7161
 epoch: 75, train_loss: 0.2367, test_loss: 1.3985, test_f1: 0.6849
 epoch: 76, train_loss: 0.2121, test_loss: 1.4902, test_f1: 0.6576
 epoch: 77, train_loss: 0.2397, test_loss: 1.3880, test_f1: 0.6847
 epoch: 78, train_loss: 0.2324, test_loss: 1.5726, test_f1: 0.6703
 epoch: 79, train_loss: 0.2330, test_loss: 1.4789, test_f1: 0.6800
 epoch: 80, train_loss: 0.2078, test_loss: 1.5168, test_f1: 0.6738
 epoch: 81, train_loss: 0.2260, test_loss: 1.4470, test_f1: 0.6683
 epoch: 82, train_loss: 0.1976, test_loss: 1.4479, test_f1: 0.6717
 epoch: 83, train_loss: 0.2245, test_loss: 1.5160, test_f1: 0.6778
 epoch: 84, train_loss: 0.2056, test_loss: 1.4883, test_f1: 0.6836
 epoch: 85, train_loss: 0.2055, test_loss: 1.5359, test_f1: 0.6888
 epoch: 86, train_loss: 0.2104, test_loss: 1.5408, test_f1: 0.6801
 epoch: 87, train_loss: 0.2119, test_loss: 1.5745, test_f1: 0.6829
 epoch: 88, train_loss: 0.1990, test_loss: 1.6383, test_f1: 0.6654
 epoch: 89, train_loss: 0.2079, test_loss: 1.5105, test_f1: 0.6836
 epoch: 90, train_loss: 0.1740, test_loss: 1.5883, test_f1: 0.6817
 epoch: 91, train_loss: 0.1864, test_loss: 1.6838, test_f1: 0.6601
 epoch: 92, train_loss: 0.1890, test_loss: 1.6404, test_f1: 0.6873
 epoch: 93, train_loss: 0.1774, test_loss: 1.5600, test_f1: 0.6834
 epoch: 94, train_loss: 0.2002, test_loss: 1.5986, test_f1: 0.6809
 epoch: 95, train_loss: 0.1784, test_loss: 1.6829, test_f1: 0.6715
 epoch: 96, train_loss: 0.1737, test_loss: 1.6123, test_f1: 0.6924
 epoch: 97, train_loss: 0.1800, test_loss: 1.7105, test_f1: 0.6712
 epoch: 98, train_loss: 0.1750, test_loss: 1.5671, test_f1: 0.6844
 epoch: 99, train_loss: 0.1868, test_loss: 1.5698, test_f1: 0.6981
##################ITERATION #4 ****************************************
 epoch: 0, train_loss: 1.2862, test_loss: 1.0186, test_f1: 0.4830
 epoch: 1, train_loss: 0.9775, test_loss: 0.8948, test_f1: 0.5243
 epoch: 2, train_loss: 0.9332, test_loss: 0.8717, test_f1: 0.5558
 epoch: 3, train_loss: 0.9053, test_loss: 0.9015, test_f1: 0.5511
 epoch: 4, train_loss: 0.8810, test_loss: 0.8810, test_f1: 0.5301
 epoch: 5, train_loss: 0.8467, test_loss: 0.8062, test_f1: 0.6022
 epoch: 6, train_loss: 0.8178, test_loss: 0.8111, test_f1: 0.6030
 epoch: 7, train_loss: 0.8102, test_loss: 0.8015, test_f1: 0.6073
 epoch: 8, train_loss: 0.7799, test_loss: 0.9154, test_f1: 0.5695
 epoch: 9, train_loss: 0.7799, test_loss: 0.8047, test_f1: 0.6131
 epoch: 10, train_loss: 0.7610, test_loss: 0.7697, test_f1: 0.6419
 epoch: 11, train_loss: 0.7368, test_loss: 0.7387, test_f1: 0.6313
 epoch: 12, train_loss: 0.7180, test_loss: 0.8008, test_f1: 0.6172
 epoch: 13, train_loss: 0.7243, test_loss: 0.7700, test_f1: 0.6555
 epoch: 14, train_loss: 0.6849, test_loss: 0.7331, test_f1: 0.6495
 epoch: 15, train_loss: 0.6869, test_loss: 0.8183, test_f1: 0.6094
 epoch: 16, train_loss: 0.6572, test_loss: 0.7766, test_f1: 0.6394
 epoch: 17, train_loss: 0.6456, test_loss: 0.8186, test_f1: 0.6456
 epoch: 18, train_loss: 0.6301, test_loss: 0.7020, test_f1: 0.6574
 epoch: 19, train_loss: 0.6318, test_loss: 0.8740, test_f1: 0.6339
 epoch: 20, train_loss: 0.6167, test_loss: 0.7854, test_f1: 0.6290
 epoch: 21, train_loss: 0.6145, test_loss: 0.7357, test_f1: 0.6608
 epoch: 22, train_loss: 0.6034, test_loss: 0.7570, test_f1: 0.6548
 epoch: 23, train_loss: 0.5958, test_loss: 0.7852, test_f1: 0.6690
 epoch: 24, train_loss: 0.5712, test_loss: 0.7845, test_f1: 0.6547
 epoch: 25, train_loss: 0.5832, test_loss: 0.7114, test_f1: 0.6734
 epoch: 26, train_loss: 0.5527, test_loss: 0.7602, test_f1: 0.6760
 epoch: 27, train_loss: 0.5479, test_loss: 0.8163, test_f1: 0.6732
 epoch: 28, train_loss: 0.5301, test_loss: 0.7880, test_f1: 0.6823
 epoch: 29, train_loss: 0.5234, test_loss: 0.7780, test_f1: 0.7026
 epoch: 30, train_loss: 0.5207, test_loss: 0.8172, test_f1: 0.6379
 epoch: 31, train_loss: 0.4937, test_loss: 0.8287, test_f1: 0.6809
 epoch: 32, train_loss: 0.4982, test_loss: 0.7890, test_f1: 0.6760
 epoch: 33, train_loss: 0.4924, test_loss: 0.8172, test_f1: 0.6787
 epoch: 34, train_loss: 0.4960, test_loss: 0.8731, test_f1: 0.6354
 epoch: 35, train_loss: 0.4799, test_loss: 0.8700, test_f1: 0.6860
 epoch: 36, train_loss: 0.4644, test_loss: 0.8409, test_f1: 0.6810
 epoch: 37, train_loss: 0.4751, test_loss: 0.8878, test_f1: 0.6704
 epoch: 38, train_loss: 0.4722, test_loss: 0.8199, test_f1: 0.6808
 epoch: 39, train_loss: 0.4694, test_loss: 0.8072, test_f1: 0.6725
 epoch: 40, train_loss: 0.4482, test_loss: 0.9751, test_f1: 0.6719
 epoch: 41, train_loss: 0.4446, test_loss: 0.9163, test_f1: 0.6633
 epoch: 42, train_loss: 0.4347, test_loss: 0.9685, test_f1: 0.6654
 epoch: 43, train_loss: 0.4117, test_loss: 0.9593, test_f1: 0.6824
 epoch: 44, train_loss: 0.4193, test_loss: 0.9905, test_f1: 0.6617
 epoch: 45, train_loss: 0.3902, test_loss: 0.9736, test_f1: 0.6763
 epoch: 46, train_loss: 0.3935, test_loss: 1.0243, test_f1: 0.6947
 epoch: 47, train_loss: 0.4023, test_loss: 0.9019, test_f1: 0.6612
 epoch: 48, train_loss: 0.3937, test_loss: 1.0031, test_f1: 0.6694
 epoch: 49, train_loss: 0.3941, test_loss: 0.9834, test_f1: 0.6418
 epoch: 50, train_loss: 0.3772, test_loss: 1.0115, test_f1: 0.6739
 epoch: 51, train_loss: 0.3399, test_loss: 1.0116, test_f1: 0.6676
 epoch: 52, train_loss: 0.3109, test_loss: 1.0132, test_f1: 0.6925
 epoch: 53, train_loss: 0.3155, test_loss: 1.0044, test_f1: 0.6770
 epoch: 54, train_loss: 0.2991, test_loss: 1.0751, test_f1: 0.6730
 epoch: 55, train_loss: 0.3021, test_loss: 1.1419, test_f1: 0.6742
 epoch: 56, train_loss: 0.2938, test_loss: 1.1459, test_f1: 0.6664
 epoch: 57, train_loss: 0.2934, test_loss: 1.1172, test_f1: 0.6547
 epoch: 58, train_loss: 0.2888, test_loss: 1.1919, test_f1: 0.6639
 epoch: 59, train_loss: 0.2926, test_loss: 1.2878, test_f1: 0.6380
 epoch: 60, train_loss: 0.2904, test_loss: 1.1294, test_f1: 0.6681
 epoch: 61, train_loss: 0.2769, test_loss: 1.1477, test_f1: 0.6770
 epoch: 62, train_loss: 0.2918, test_loss: 1.0805, test_f1: 0.6683
 epoch: 63, train_loss: 0.2854, test_loss: 1.0777, test_f1: 0.6635
 epoch: 64, train_loss: 0.2764, test_loss: 1.2164, test_f1: 0.6662
 epoch: 65, train_loss: 0.2666, test_loss: 1.1638, test_f1: 0.6753
 epoch: 66, train_loss: 0.2595, test_loss: 1.1927, test_f1: 0.6533
 epoch: 67, train_loss: 0.2344, test_loss: 1.2481, test_f1: 0.6762
 epoch: 68, train_loss: 0.2501, test_loss: 1.2020, test_f1: 0.6828
 epoch: 69, train_loss: 0.2494, test_loss: 1.2743, test_f1: 0.6599
 epoch: 70, train_loss: 0.2455, test_loss: 1.3102, test_f1: 0.6617
 epoch: 71, train_loss: 0.2426, test_loss: 1.1570, test_f1: 0.6946
 epoch: 72, train_loss: 0.2438, test_loss: 1.3512, test_f1: 0.6514
 epoch: 73, train_loss: 0.2449, test_loss: 1.4157, test_f1: 0.6838
 epoch: 74, train_loss: 0.2566, test_loss: 1.3226, test_f1: 0.6720
 epoch: 75, train_loss: 0.2366, test_loss: 1.3885, test_f1: 0.6643
 epoch: 76, train_loss: 0.2163, test_loss: 1.3783, test_f1: 0.6579
 epoch: 77, train_loss: 0.2305, test_loss: 1.3300, test_f1: 0.6721
 epoch: 78, train_loss: 0.2176, test_loss: 1.3729, test_f1: 0.6641
 epoch: 79, train_loss: 0.2336, test_loss: 1.3265, test_f1: 0.6676
 epoch: 80, train_loss: 0.2028, test_loss: 1.3573, test_f1: 0.6864
 epoch: 81, train_loss: 0.2266, test_loss: 1.3933, test_f1: 0.6653
 epoch: 82, train_loss: 0.2241, test_loss: 1.4124, test_f1: 0.6651
 epoch: 83, train_loss: 0.2204, test_loss: 1.3305, test_f1: 0.6564
 epoch: 84, train_loss: 0.2148, test_loss: 1.3740, test_f1: 0.6609
 epoch: 85, train_loss: 0.2097, test_loss: 1.2915, test_f1: 0.7107
 epoch: 86, train_loss: 0.2145, test_loss: 1.4313, test_f1: 0.6875
 epoch: 87, train_loss: 0.2313, test_loss: 1.3072, test_f1: 0.6759
 epoch: 88, train_loss: 0.1960, test_loss: 1.4683, test_f1: 0.6546
 epoch: 89, train_loss: 0.2097, test_loss: 1.4055, test_f1: 0.6644
 epoch: 90, train_loss: 0.2025, test_loss: 1.3635, test_f1: 0.6737
 epoch: 91, train_loss: 0.2005, test_loss: 1.4040, test_f1: 0.6605
 epoch: 92, train_loss: 0.2118, test_loss: 1.3819, test_f1: 0.6622
 epoch: 93, train_loss: 0.2074, test_loss: 1.4488, test_f1: 0.6657
 epoch: 94, train_loss: 0.1905, test_loss: 1.3729, test_f1: 0.6806
 epoch: 95, train_loss: 0.1808, test_loss: 1.4072, test_f1: 0.6946
 epoch: 96, train_loss: 0.1973, test_loss: 1.3735, test_f1: 0.6796
 epoch: 97, train_loss: 0.1858, test_loss: 1.5465, test_f1: 0.6559
 epoch: 98, train_loss: 0.2213, test_loss: 1.3674, test_f1: 0.6735
 epoch: 99, train_loss: 0.1807, test_loss: 1.4523, test_f1: 0.6879
##################ITERATION #5 ****************************************
 epoch: 0, train_loss: 1.3799, test_loss: 1.0388, test_f1: 0.4543
 epoch: 1, train_loss: 0.9674, test_loss: 0.8879, test_f1: 0.5518
 epoch: 2, train_loss: 0.9262, test_loss: 0.8463, test_f1: 0.5331
 epoch: 3, train_loss: 0.8835, test_loss: 0.8480, test_f1: 0.6134
 epoch: 4, train_loss: 0.8671, test_loss: 0.8536, test_f1: 0.5738
 epoch: 5, train_loss: 0.8224, test_loss: 0.7938, test_f1: 0.6419
 epoch: 6, train_loss: 0.8126, test_loss: 0.8359, test_f1: 0.6379
 epoch: 7, train_loss: 0.7940, test_loss: 0.7722, test_f1: 0.6124
 epoch: 8, train_loss: 0.7683, test_loss: 0.7750, test_f1: 0.6327
 epoch: 9, train_loss: 0.7432, test_loss: 0.7685, test_f1: 0.6565
 epoch: 10, train_loss: 0.7307, test_loss: 0.7664, test_f1: 0.6160
 epoch: 11, train_loss: 0.7144, test_loss: 0.7320, test_f1: 0.6461
 epoch: 12, train_loss: 0.7137, test_loss: 0.7562, test_f1: 0.6378
 epoch: 13, train_loss: 0.7105, test_loss: 0.7601, test_f1: 0.6566
 epoch: 14, train_loss: 0.6772, test_loss: 0.7664, test_f1: 0.6621
 epoch: 15, train_loss: 0.6919, test_loss: 0.8075, test_f1: 0.6501
 epoch: 16, train_loss: 0.6607, test_loss: 0.7189, test_f1: 0.6613
 epoch: 17, train_loss: 0.6502, test_loss: 0.7501, test_f1: 0.6701
 epoch: 18, train_loss: 0.6328, test_loss: 0.7698, test_f1: 0.6616
 epoch: 19, train_loss: 0.6030, test_loss: 0.8276, test_f1: 0.6320
 epoch: 20, train_loss: 0.6102, test_loss: 0.7580, test_f1: 0.6680
 epoch: 21, train_loss: 0.6254, test_loss: 0.8112, test_f1: 0.6334
 epoch: 22, train_loss: 0.5920, test_loss: 0.8192, test_f1: 0.6258
 epoch: 23, train_loss: 0.5822, test_loss: 0.7667, test_f1: 0.6665
 epoch: 24, train_loss: 0.5713, test_loss: 0.7950, test_f1: 0.6587
 epoch: 25, train_loss: 0.5592, test_loss: 0.8087, test_f1: 0.6598
 epoch: 26, train_loss: 0.5616, test_loss: 0.7389, test_f1: 0.6894
 epoch: 27, train_loss: 0.5519, test_loss: 0.7532, test_f1: 0.6504
 epoch: 28, train_loss: 0.5331, test_loss: 0.8183, test_f1: 0.6662
 epoch: 29, train_loss: 0.5265, test_loss: 0.7943, test_f1: 0.6319
 epoch: 30, train_loss: 0.5101, test_loss: 0.8384, test_f1: 0.6265
 epoch: 31, train_loss: 0.5130, test_loss: 0.7566, test_f1: 0.6593
 epoch: 32, train_loss: 0.4780, test_loss: 0.7787, test_f1: 0.6721
 epoch: 33, train_loss: 0.4758, test_loss: 0.9647, test_f1: 0.6316
 epoch: 34, train_loss: 0.5030, test_loss: 0.8350, test_f1: 0.6393
 epoch: 35, train_loss: 0.4759, test_loss: 0.8472, test_f1: 0.6692
 epoch: 36, train_loss: 0.4757, test_loss: 0.8317, test_f1: 0.7102
 epoch: 37, train_loss: 0.4660, test_loss: 0.7990, test_f1: 0.6704
 epoch: 38, train_loss: 0.4464, test_loss: 0.8215, test_f1: 0.6868
 epoch: 39, train_loss: 0.4721, test_loss: 0.8970, test_f1: 0.6692
 epoch: 40, train_loss: 0.4522, test_loss: 0.8979, test_f1: 0.6652
 epoch: 41, train_loss: 0.4338, test_loss: 0.8911, test_f1: 0.6441
 epoch: 42, train_loss: 0.4206, test_loss: 1.0042, test_f1: 0.6410
 epoch: 43, train_loss: 0.4232, test_loss: 0.8520, test_f1: 0.6596
 epoch: 44, train_loss: 0.4002, test_loss: 0.8708, test_f1: 0.6572
 epoch: 45, train_loss: 0.3926, test_loss: 0.9896, test_f1: 0.6703
 epoch: 46, train_loss: 0.4050, test_loss: 0.9719, test_f1: 0.6743
 epoch: 47, train_loss: 0.3844, test_loss: 1.0256, test_f1: 0.6633
 epoch: 48, train_loss: 0.3958, test_loss: 0.9407, test_f1: 0.6839
 epoch: 49, train_loss: 0.3712, test_loss: 0.9657, test_f1: 0.6695
 epoch: 50, train_loss: 0.3700, test_loss: 1.0033, test_f1: 0.6737
 epoch: 51, train_loss: 0.3287, test_loss: 1.0334, test_f1: 0.6745
 epoch: 52, train_loss: 0.3038, test_loss: 1.1643, test_f1: 0.6644
 epoch: 53, train_loss: 0.2914, test_loss: 1.1831, test_f1: 0.6692
 epoch: 54, train_loss: 0.2869, test_loss: 1.2390, test_f1: 0.6736
 epoch: 55, train_loss: 0.2854, test_loss: 1.0939, test_f1: 0.6825
 epoch: 56, train_loss: 0.2830, test_loss: 1.1585, test_f1: 0.6818
 epoch: 57, train_loss: 0.2822, test_loss: 1.1822, test_f1: 0.6670
 epoch: 58, train_loss: 0.2927, test_loss: 1.1349, test_f1: 0.6779
 epoch: 59, train_loss: 0.2791, test_loss: 1.2284, test_f1: 0.6590
 epoch: 60, train_loss: 0.2791, test_loss: 1.2220, test_f1: 0.6393
 epoch: 61, train_loss: 0.2701, test_loss: 1.2159, test_f1: 0.6859
 epoch: 62, train_loss: 0.2706, test_loss: 1.2471, test_f1: 0.6760
 epoch: 63, train_loss: 0.2839, test_loss: 1.2122, test_f1: 0.6795
 epoch: 64, train_loss: 0.2514, test_loss: 1.3028, test_f1: 0.6661
 epoch: 65, train_loss: 0.2516, test_loss: 1.3323, test_f1: 0.6644
 epoch: 66, train_loss: 0.2497, test_loss: 1.2545, test_f1: 0.6694
 epoch: 67, train_loss: 0.2375, test_loss: 1.3464, test_f1: 0.6493
 epoch: 68, train_loss: 0.2541, test_loss: 1.3230, test_f1: 0.6501
 epoch: 69, train_loss: 0.2572, test_loss: 1.4773, test_f1: 0.6349
 epoch: 70, train_loss: 0.2332, test_loss: 1.3573, test_f1: 0.6842
 epoch: 71, train_loss: 0.2411, test_loss: 1.3206, test_f1: 0.6581
 epoch: 72, train_loss: 0.2315, test_loss: 1.4461, test_f1: 0.6662
 epoch: 73, train_loss: 0.2329, test_loss: 1.3610, test_f1: 0.6670
 epoch: 74, train_loss: 0.2025, test_loss: 1.3815, test_f1: 0.6765
 epoch: 75, train_loss: 0.2183, test_loss: 1.3822, test_f1: 0.6642
 epoch: 76, train_loss: 0.2192, test_loss: 1.4567, test_f1: 0.6678
 epoch: 77, train_loss: 0.2372, test_loss: 1.2735, test_f1: 0.6676
 epoch: 78, train_loss: 0.2376, test_loss: 1.3752, test_f1: 0.6590
 epoch: 79, train_loss: 0.2337, test_loss: 1.3979, test_f1: 0.6582
 epoch: 80, train_loss: 0.2346, test_loss: 1.3302, test_f1: 0.6731
 epoch: 81, train_loss: 0.2122, test_loss: 1.4527, test_f1: 0.6427
 epoch: 82, train_loss: 0.2285, test_loss: 1.3215, test_f1: 0.6777
 epoch: 83, train_loss: 0.1926, test_loss: 1.4712, test_f1: 0.6490
 epoch: 84, train_loss: 0.2167, test_loss: 1.4943, test_f1: 0.6708
 epoch: 85, train_loss: 0.2079, test_loss: 1.5037, test_f1: 0.6660
 epoch: 86, train_loss: 0.2027, test_loss: 1.3881, test_f1: 0.6749
 epoch: 87, train_loss: 0.2059, test_loss: 1.5095, test_f1: 0.6482
 epoch: 88, train_loss: 0.2113, test_loss: 1.3205, test_f1: 0.6662
 epoch: 89, train_loss: 0.2090, test_loss: 1.4855, test_f1: 0.6684
 epoch: 90, train_loss: 0.1879, test_loss: 1.4350, test_f1: 0.6731
 epoch: 91, train_loss: 0.1938, test_loss: 1.4256, test_f1: 0.6821
 epoch: 92, train_loss: 0.1959, test_loss: 1.3665, test_f1: 0.6836
 epoch: 93, train_loss: 0.2037, test_loss: 1.4362, test_f1: 0.6644
 epoch: 94, train_loss: 0.2065, test_loss: 1.5179, test_f1: 0.6448
 epoch: 95, train_loss: 0.2037, test_loss: 1.5708, test_f1: 0.6579
 epoch: 96, train_loss: 0.1819, test_loss: 1.5746, test_f1: 0.6749
 epoch: 97, train_loss: 0.1727, test_loss: 1.5324, test_f1: 0.6707
 epoch: 98, train_loss: 0.1791, test_loss: 1.5245, test_f1: 0.6643
 epoch: 99, train_loss: 0.1861, test_loss: 1.5640, test_f1: 0.6576
##################ITERATION #6 ****************************************
 epoch: 0, train_loss: 1.3621, test_loss: 0.9744, test_f1: 0.5115
 epoch: 1, train_loss: 0.9679, test_loss: 0.9505, test_f1: 0.5520
 epoch: 2, train_loss: 0.9307, test_loss: 0.8772, test_f1: 0.5737
 epoch: 3, train_loss: 0.9080, test_loss: 0.8859, test_f1: 0.5160
 epoch: 4, train_loss: 0.8898, test_loss: 0.8192, test_f1: 0.5553
 epoch: 5, train_loss: 0.8591, test_loss: 0.8001, test_f1: 0.5873
 epoch: 6, train_loss: 0.8315, test_loss: 0.7775, test_f1: 0.5863
 epoch: 7, train_loss: 0.8306, test_loss: 0.8114, test_f1: 0.5999
 epoch: 8, train_loss: 0.8046, test_loss: 0.8037, test_f1: 0.6205
 epoch: 9, train_loss: 0.7920, test_loss: 0.8063, test_f1: 0.6216
 epoch: 10, train_loss: 0.7632, test_loss: 0.7495, test_f1: 0.6460
 epoch: 11, train_loss: 0.7493, test_loss: 0.7789, test_f1: 0.6445
 epoch: 12, train_loss: 0.7369, test_loss: 0.8483, test_f1: 0.6301
 epoch: 13, train_loss: 0.7293, test_loss: 0.7338, test_f1: 0.6854
 epoch: 14, train_loss: 0.7140, test_loss: 0.7754, test_f1: 0.6379
 epoch: 15, train_loss: 0.6934, test_loss: 0.8074, test_f1: 0.6201
 epoch: 16, train_loss: 0.6856, test_loss: 0.7996, test_f1: 0.6579
 epoch: 17, train_loss: 0.6576, test_loss: 0.7846, test_f1: 0.6617
 epoch: 18, train_loss: 0.6623, test_loss: 0.7471, test_f1: 0.6393
 epoch: 19, train_loss: 0.6411, test_loss: 0.7467, test_f1: 0.6339
 epoch: 20, train_loss: 0.6240, test_loss: 0.7639, test_f1: 0.6759
 epoch: 21, train_loss: 0.6236, test_loss: 0.8057, test_f1: 0.6706
 epoch: 22, train_loss: 0.6193, test_loss: 0.7498, test_f1: 0.6703
 epoch: 23, train_loss: 0.6184, test_loss: 0.7900, test_f1: 0.6628
 epoch: 24, train_loss: 0.6089, test_loss: 0.8023, test_f1: 0.6809
 epoch: 25, train_loss: 0.5831, test_loss: 0.7677, test_f1: 0.6682
 epoch: 26, train_loss: 0.5687, test_loss: 0.7775, test_f1: 0.6525
 epoch: 27, train_loss: 0.5506, test_loss: 0.7589, test_f1: 0.6573
 epoch: 28, train_loss: 0.5622, test_loss: 0.9213, test_f1: 0.6290
 epoch: 29, train_loss: 0.5536, test_loss: 0.8306, test_f1: 0.6872
 epoch: 30, train_loss: 0.5486, test_loss: 0.8724, test_f1: 0.6442
 epoch: 31, train_loss: 0.5402, test_loss: 0.9004, test_f1: 0.6488
 epoch: 32, train_loss: 0.5186, test_loss: 0.8550, test_f1: 0.6471
 epoch: 33, train_loss: 0.5266, test_loss: 0.8553, test_f1: 0.6514
 epoch: 34, train_loss: 0.5184, test_loss: 0.8303, test_f1: 0.6385
 epoch: 35, train_loss: 0.5013, test_loss: 0.9185, test_f1: 0.6631
 epoch: 36, train_loss: 0.5130, test_loss: 0.7681, test_f1: 0.6516
 epoch: 37, train_loss: 0.4937, test_loss: 0.8297, test_f1: 0.6616
 epoch: 38, train_loss: 0.4730, test_loss: 0.7400, test_f1: 0.6716
 epoch: 39, train_loss: 0.4640, test_loss: 0.9433, test_f1: 0.6271
 epoch: 40, train_loss: 0.4621, test_loss: 1.0158, test_f1: 0.6489
 epoch: 41, train_loss: 0.4761, test_loss: 0.8847, test_f1: 0.6494
 epoch: 42, train_loss: 0.4741, test_loss: 0.8771, test_f1: 0.6515
 epoch: 43, train_loss: 0.4546, test_loss: 0.9308, test_f1: 0.6597
 epoch: 44, train_loss: 0.4457, test_loss: 0.8815, test_f1: 0.6841
 epoch: 45, train_loss: 0.4291, test_loss: 0.8045, test_f1: 0.6581
 epoch: 46, train_loss: 0.4311, test_loss: 0.8571, test_f1: 0.6766
 epoch: 47, train_loss: 0.4385, test_loss: 0.8518, test_f1: 0.6843
 epoch: 48, train_loss: 0.3971, test_loss: 0.9225, test_f1: 0.6609
 epoch: 49, train_loss: 0.4069, test_loss: 0.9612, test_f1: 0.6633
 epoch: 50, train_loss: 0.3863, test_loss: 0.9123, test_f1: 0.6664
 epoch: 51, train_loss: 0.3671, test_loss: 0.9085, test_f1: 0.6384
 epoch: 52, train_loss: 0.3499, test_loss: 1.0158, test_f1: 0.6632
 epoch: 53, train_loss: 0.3151, test_loss: 1.0265, test_f1: 0.6657
 epoch: 54, train_loss: 0.3337, test_loss: 1.0599, test_f1: 0.6510
 epoch: 55, train_loss: 0.3329, test_loss: 1.0211, test_f1: 0.6738
 epoch: 56, train_loss: 0.3067, test_loss: 1.1085, test_f1: 0.6758
 epoch: 57, train_loss: 0.3209, test_loss: 1.0157, test_f1: 0.6626
 epoch: 58, train_loss: 0.3207, test_loss: 1.1229, test_f1: 0.6544
 epoch: 59, train_loss: 0.2965, test_loss: 1.1022, test_f1: 0.6569
 epoch: 60, train_loss: 0.2915, test_loss: 1.1495, test_f1: 0.6354
 epoch: 61, train_loss: 0.3063, test_loss: 1.1283, test_f1: 0.6818
 epoch: 62, train_loss: 0.3038, test_loss: 1.1777, test_f1: 0.6458
 epoch: 63, train_loss: 0.2913, test_loss: 1.3256, test_f1: 0.6498
 epoch: 64, train_loss: 0.2946, test_loss: 1.1297, test_f1: 0.6708
 epoch: 65, train_loss: 0.2676, test_loss: 1.1844, test_f1: 0.6717
 epoch: 66, train_loss: 0.2697, test_loss: 1.2898, test_f1: 0.6645
 epoch: 67, train_loss: 0.2833, test_loss: 1.2451, test_f1: 0.6728
 epoch: 68, train_loss: 0.2847, test_loss: 1.1447, test_f1: 0.6685
 epoch: 69, train_loss: 0.2721, test_loss: 1.2082, test_f1: 0.6663
 epoch: 70, train_loss: 0.2788, test_loss: 1.2678, test_f1: 0.6544
 epoch: 71, train_loss: 0.2562, test_loss: 1.3281, test_f1: 0.6518
 epoch: 72, train_loss: 0.2761, test_loss: 1.3200, test_f1: 0.6400
 epoch: 73, train_loss: 0.2640, test_loss: 1.2893, test_f1: 0.6624
 epoch: 74, train_loss: 0.2568, test_loss: 1.2846, test_f1: 0.6485
 epoch: 75, train_loss: 0.2587, test_loss: 1.2660, test_f1: 0.6629
 epoch: 76, train_loss: 0.2462, test_loss: 1.2568, test_f1: 0.6614
 epoch: 77, train_loss: 0.2536, test_loss: 1.2442, test_f1: 0.6496
 epoch: 78, train_loss: 0.2563, test_loss: 1.2096, test_f1: 0.6773
 epoch: 79, train_loss: 0.2373, test_loss: 1.4534, test_f1: 0.6696
 epoch: 80, train_loss: 0.2463, test_loss: 1.5493, test_f1: 0.6474
 epoch: 81, train_loss: 0.2380, test_loss: 1.4056, test_f1: 0.6608
 epoch: 82, train_loss: 0.2419, test_loss: 1.2531, test_f1: 0.6737
 epoch: 83, train_loss: 0.2315, test_loss: 1.3938, test_f1: 0.6721
 epoch: 84, train_loss: 0.2547, test_loss: 1.4034, test_f1: 0.6568
 epoch: 85, train_loss: 0.2098, test_loss: 1.4932, test_f1: 0.6642
 epoch: 86, train_loss: 0.2246, test_loss: 1.4344, test_f1: 0.6573
 epoch: 87, train_loss: 0.2135, test_loss: 1.6019, test_f1: 0.6481
 epoch: 88, train_loss: 0.2300, test_loss: 1.5972, test_f1: 0.6629
 epoch: 89, train_loss: 0.2406, test_loss: 1.6156, test_f1: 0.6573
 epoch: 90, train_loss: 0.2268, test_loss: 1.4525, test_f1: 0.6754
 epoch: 91, train_loss: 0.2189, test_loss: 1.4178, test_f1: 0.6563
 epoch: 92, train_loss: 0.2183, test_loss: 1.5031, test_f1: 0.6679
 epoch: 93, train_loss: 0.2178, test_loss: 1.3927, test_f1: 0.6604
 epoch: 94, train_loss: 0.2032, test_loss: 1.5989, test_f1: 0.6402
 epoch: 95, train_loss: 0.2133, test_loss: 1.3840, test_f1: 0.6679
 epoch: 96, train_loss: 0.1988, test_loss: 1.5719, test_f1: 0.6529
 epoch: 97, train_loss: 0.2036, test_loss: 1.4925, test_f1: 0.6605
 epoch: 98, train_loss: 0.2275, test_loss: 1.5082, test_f1: 0.6484
 epoch: 99, train_loss: 0.1972, test_loss: 1.6478, test_f1: 0.6331
##################ITERATION #7 ****************************************
 epoch: 0, train_loss: 1.2903, test_loss: 1.0641, test_f1: 0.4151
 epoch: 1, train_loss: 0.9679, test_loss: 0.9458, test_f1: 0.5204
 epoch: 2, train_loss: 0.9361, test_loss: 0.9308, test_f1: 0.5805
 epoch: 3, train_loss: 0.8995, test_loss: 0.8955, test_f1: 0.5535
 epoch: 4, train_loss: 0.8658, test_loss: 0.8449, test_f1: 0.5871
 epoch: 5, train_loss: 0.8474, test_loss: 0.8218, test_f1: 0.5927
 epoch: 6, train_loss: 0.8338, test_loss: 0.8281, test_f1: 0.6004
 epoch: 7, train_loss: 0.8082, test_loss: 0.8248, test_f1: 0.6034
 epoch: 8, train_loss: 0.7991, test_loss: 0.7950, test_f1: 0.6235
 epoch: 9, train_loss: 0.7738, test_loss: 0.7684, test_f1: 0.6360
 epoch: 10, train_loss: 0.7610, test_loss: 0.7575, test_f1: 0.6318
 epoch: 11, train_loss: 0.7528, test_loss: 0.7952, test_f1: 0.6334
 epoch: 12, train_loss: 0.7277, test_loss: 0.7807, test_f1: 0.6583
 epoch: 13, train_loss: 0.7080, test_loss: 0.8052, test_f1: 0.6483
 epoch: 14, train_loss: 0.7231, test_loss: 0.7889, test_f1: 0.6654
 epoch: 15, train_loss: 0.6722, test_loss: 0.7923, test_f1: 0.6647
 epoch: 16, train_loss: 0.6650, test_loss: 0.8115, test_f1: 0.6261
 epoch: 17, train_loss: 0.6772, test_loss: 0.7336, test_f1: 0.6576
 epoch: 18, train_loss: 0.6666, test_loss: 0.8456, test_f1: 0.6227
 epoch: 19, train_loss: 0.6413, test_loss: 0.9372, test_f1: 0.5935
 epoch: 20, train_loss: 0.6396, test_loss: 0.7556, test_f1: 0.6585
 epoch: 21, train_loss: 0.6250, test_loss: 0.8515, test_f1: 0.6073
 epoch: 22, train_loss: 0.6043, test_loss: 0.7374, test_f1: 0.6751
 epoch: 23, train_loss: 0.5934, test_loss: 0.8492, test_f1: 0.6741
 epoch: 24, train_loss: 0.5760, test_loss: 0.7440, test_f1: 0.6774
 epoch: 25, train_loss: 0.5783, test_loss: 0.8260, test_f1: 0.6511
 epoch: 26, train_loss: 0.5725, test_loss: 0.8483, test_f1: 0.6317
 epoch: 27, train_loss: 0.5760, test_loss: 0.7577, test_f1: 0.6691
 epoch: 28, train_loss: 0.5583, test_loss: 0.8347, test_f1: 0.6552
 epoch: 29, train_loss: 0.5456, test_loss: 0.8395, test_f1: 0.6624
 epoch: 30, train_loss: 0.5176, test_loss: 0.8075, test_f1: 0.6509
 epoch: 31, train_loss: 0.5129, test_loss: 0.8377, test_f1: 0.6630
 epoch: 32, train_loss: 0.5250, test_loss: 0.8643, test_f1: 0.6294
 epoch: 33, train_loss: 0.5279, test_loss: 0.8562, test_f1: 0.6544
 epoch: 34, train_loss: 0.4966, test_loss: 0.8096, test_f1: 0.6470
 epoch: 35, train_loss: 0.4693, test_loss: 0.9183, test_f1: 0.6422
 epoch: 36, train_loss: 0.4711, test_loss: 0.8826, test_f1: 0.6647
 epoch: 37, train_loss: 0.4773, test_loss: 0.8893, test_f1: 0.6793
 epoch: 38, train_loss: 0.4619, test_loss: 0.8616, test_f1: 0.6742
 epoch: 39, train_loss: 0.4790, test_loss: 0.9569, test_f1: 0.6560
 epoch: 40, train_loss: 0.4516, test_loss: 0.9405, test_f1: 0.6412
 epoch: 41, train_loss: 0.4492, test_loss: 0.8301, test_f1: 0.6533
 epoch: 42, train_loss: 0.4213, test_loss: 1.0133, test_f1: 0.6331
 epoch: 43, train_loss: 0.4546, test_loss: 0.8632, test_f1: 0.6731
 epoch: 44, train_loss: 0.4375, test_loss: 0.9604, test_f1: 0.6689
 epoch: 45, train_loss: 0.4149, test_loss: 0.9018, test_f1: 0.6701
 epoch: 46, train_loss: 0.3942, test_loss: 0.9708, test_f1: 0.6513
 epoch: 47, train_loss: 0.3977, test_loss: 0.9764, test_f1: 0.6462
 epoch: 48, train_loss: 0.4041, test_loss: 0.8494, test_f1: 0.6848
 epoch: 49, train_loss: 0.3900, test_loss: 1.0006, test_f1: 0.6745
 epoch: 50, train_loss: 0.3913, test_loss: 0.9991, test_f1: 0.6439
 epoch: 51, train_loss: 0.3636, test_loss: 0.9573, test_f1: 0.6821
 epoch: 52, train_loss: 0.3437, test_loss: 0.9763, test_f1: 0.6794
 epoch: 53, train_loss: 0.3204, test_loss: 1.0939, test_f1: 0.6769
 epoch: 54, train_loss: 0.3181, test_loss: 1.0607, test_f1: 0.6877
 epoch: 55, train_loss: 0.3215, test_loss: 1.1691, test_f1: 0.6828
 epoch: 56, train_loss: 0.3031, test_loss: 1.1971, test_f1: 0.6631
 epoch: 57, train_loss: 0.2842, test_loss: 1.2101, test_f1: 0.6537
 epoch: 58, train_loss: 0.2937, test_loss: 1.2086, test_f1: 0.6647
 epoch: 59, train_loss: 0.2884, test_loss: 1.1545, test_f1: 0.6772
 epoch: 60, train_loss: 0.2885, test_loss: 1.1822, test_f1: 0.6722
 epoch: 61, train_loss: 0.2953, test_loss: 1.2516, test_f1: 0.6604
 epoch: 62, train_loss: 0.2907, test_loss: 1.2835, test_f1: 0.6719
 epoch: 63, train_loss: 0.2841, test_loss: 1.2141, test_f1: 0.6744
 epoch: 64, train_loss: 0.2884, test_loss: 1.2090, test_f1: 0.6778
 epoch: 65, train_loss: 0.2831, test_loss: 1.3345, test_f1: 0.6409
 epoch: 66, train_loss: 0.2524, test_loss: 1.4343, test_f1: 0.6588
 epoch: 67, train_loss: 0.2580, test_loss: 1.3809, test_f1: 0.6686
 epoch: 68, train_loss: 0.2666, test_loss: 1.3065, test_f1: 0.6570
 epoch: 69, train_loss: 0.2641, test_loss: 1.3066, test_f1: 0.6624
 epoch: 70, train_loss: 0.2511, test_loss: 1.4014, test_f1: 0.6520
 epoch: 71, train_loss: 0.2560, test_loss: 1.3000, test_f1: 0.6842
 epoch: 72, train_loss: 0.2527, test_loss: 1.3283, test_f1: 0.6725
 epoch: 73, train_loss: 0.2481, test_loss: 1.3224, test_f1: 0.6792
 epoch: 74, train_loss: 0.2588, test_loss: 1.3313, test_f1: 0.6760
 epoch: 75, train_loss: 0.2347, test_loss: 1.4451, test_f1: 0.6650
 epoch: 76, train_loss: 0.2461, test_loss: 1.4309, test_f1: 0.6684
 epoch: 77, train_loss: 0.2284, test_loss: 1.4651, test_f1: 0.6635
 epoch: 78, train_loss: 0.2469, test_loss: 1.4080, test_f1: 0.6794
 epoch: 79, train_loss: 0.2216, test_loss: 1.4238, test_f1: 0.6720
 epoch: 80, train_loss: 0.2177, test_loss: 1.4373, test_f1: 0.6705
 epoch: 81, train_loss: 0.2262, test_loss: 1.4420, test_f1: 0.6770
 epoch: 82, train_loss: 0.2285, test_loss: 1.4013, test_f1: 0.6880
 epoch: 83, train_loss: 0.2288, test_loss: 1.3754, test_f1: 0.6752
 epoch: 84, train_loss: 0.2174, test_loss: 1.4145, test_f1: 0.6610
 epoch: 85, train_loss: 0.2206, test_loss: 1.4305, test_f1: 0.6636
 epoch: 86, train_loss: 0.2171, test_loss: 1.4393, test_f1: 0.6578
 epoch: 87, train_loss: 0.2097, test_loss: 1.5089, test_f1: 0.6419
 epoch: 88, train_loss: 0.2109, test_loss: 1.5081, test_f1: 0.6610
 epoch: 89, train_loss: 0.2003, test_loss: 1.5130, test_f1: 0.6768
 epoch: 90, train_loss: 0.2191, test_loss: 1.5077, test_f1: 0.6612
 epoch: 91, train_loss: 0.2150, test_loss: 1.4405, test_f1: 0.6536
 epoch: 92, train_loss: 0.2073, test_loss: 1.5411, test_f1: 0.6604
 epoch: 93, train_loss: 0.2012, test_loss: 1.5041, test_f1: 0.6574
 epoch: 94, train_loss: 0.2053, test_loss: 1.6866, test_f1: 0.6588
 epoch: 95, train_loss: 0.1996, test_loss: 1.5884, test_f1: 0.6574
 epoch: 96, train_loss: 0.2026, test_loss: 1.4829, test_f1: 0.6703
 epoch: 97, train_loss: 0.2074, test_loss: 1.5051, test_f1: 0.6677
 epoch: 98, train_loss: 0.2015, test_loss: 1.5262, test_f1: 0.6625
 epoch: 99, train_loss: 0.1956, test_loss: 1.5105, test_f1: 0.6526
##################ITERATION #8 ****************************************
 epoch: 0, train_loss: 1.3513, test_loss: 0.9751, test_f1: 0.4278
 epoch: 1, train_loss: 0.9829, test_loss: 0.9152, test_f1: 0.5276
 epoch: 2, train_loss: 0.9400, test_loss: 0.9009, test_f1: 0.5136
 epoch: 3, train_loss: 0.9034, test_loss: 0.8433, test_f1: 0.5483
 epoch: 4, train_loss: 0.8654, test_loss: 0.8187, test_f1: 0.5848
 epoch: 5, train_loss: 0.8534, test_loss: 0.7932, test_f1: 0.6281
 epoch: 6, train_loss: 0.8337, test_loss: 0.7894, test_f1: 0.6286
 epoch: 7, train_loss: 0.8092, test_loss: 0.8364, test_f1: 0.6169
 epoch: 8, train_loss: 0.8136, test_loss: 0.8428, test_f1: 0.6373
 epoch: 9, train_loss: 0.7730, test_loss: 0.8017, test_f1: 0.6211
 epoch: 10, train_loss: 0.7510, test_loss: 0.7747, test_f1: 0.6073
 epoch: 11, train_loss: 0.7428, test_loss: 0.7386, test_f1: 0.6531
 epoch: 12, train_loss: 0.7267, test_loss: 0.7073, test_f1: 0.6483
 epoch: 13, train_loss: 0.7139, test_loss: 0.7759, test_f1: 0.6501
 epoch: 14, train_loss: 0.7042, test_loss: 0.7335, test_f1: 0.6504
 epoch: 15, train_loss: 0.6936, test_loss: 0.7070, test_f1: 0.6421
 epoch: 16, train_loss: 0.6836, test_loss: 0.7966, test_f1: 0.6607
 epoch: 17, train_loss: 0.6844, test_loss: 0.7746, test_f1: 0.6566
 epoch: 18, train_loss: 0.6396, test_loss: 0.7613, test_f1: 0.6592
 epoch: 19, train_loss: 0.6360, test_loss: 0.7457, test_f1: 0.6394
 epoch: 20, train_loss: 0.6390, test_loss: 0.8632, test_f1: 0.6387
 epoch: 21, train_loss: 0.6201, test_loss: 0.8255, test_f1: 0.6149
 epoch: 22, train_loss: 0.5920, test_loss: 0.7254, test_f1: 0.6667
 epoch: 23, train_loss: 0.5915, test_loss: 0.8215, test_f1: 0.6588
 epoch: 24, train_loss: 0.5880, test_loss: 0.7220, test_f1: 0.6657
 epoch: 25, train_loss: 0.5801, test_loss: 0.7962, test_f1: 0.6912
 epoch: 26, train_loss: 0.5423, test_loss: 0.8211, test_f1: 0.6777
 epoch: 27, train_loss: 0.5644, test_loss: 0.7140, test_f1: 0.6803
 epoch: 28, train_loss: 0.5563, test_loss: 0.7924, test_f1: 0.6584
 epoch: 29, train_loss: 0.5221, test_loss: 0.8213, test_f1: 0.6710
 epoch: 30, train_loss: 0.5388, test_loss: 0.7821, test_f1: 0.6765
 epoch: 31, train_loss: 0.5054, test_loss: 0.8079, test_f1: 0.6634
 epoch: 32, train_loss: 0.5134, test_loss: 0.8638, test_f1: 0.6718
 epoch: 33, train_loss: 0.5134, test_loss: 0.8583, test_f1: 0.6762
 epoch: 34, train_loss: 0.4950, test_loss: 0.8199, test_f1: 0.6811
 epoch: 35, train_loss: 0.4874, test_loss: 0.8280, test_f1: 0.6664
 epoch: 36, train_loss: 0.5039, test_loss: 0.8251, test_f1: 0.6664
 epoch: 37, train_loss: 0.4814, test_loss: 0.8335, test_f1: 0.6776
 epoch: 38, train_loss: 0.4443, test_loss: 0.8971, test_f1: 0.6562
 epoch: 39, train_loss: 0.4656, test_loss: 0.8729, test_f1: 0.6794
 epoch: 40, train_loss: 0.4724, test_loss: 0.9676, test_f1: 0.6440
 epoch: 41, train_loss: 0.4390, test_loss: 0.9547, test_f1: 0.6569
 epoch: 42, train_loss: 0.4280, test_loss: 0.8644, test_f1: 0.7013
 epoch: 43, train_loss: 0.4186, test_loss: 1.0169, test_f1: 0.6646
 epoch: 44, train_loss: 0.4300, test_loss: 0.9434, test_f1: 0.6956
 epoch: 45, train_loss: 0.4172, test_loss: 1.0558, test_f1: 0.6352
 epoch: 46, train_loss: 0.4124, test_loss: 0.9817, test_f1: 0.6888
 epoch: 47, train_loss: 0.4055, test_loss: 0.9175, test_f1: 0.6894
 epoch: 48, train_loss: 0.3919, test_loss: 0.9818, test_f1: 0.6783
 epoch: 49, train_loss: 0.3790, test_loss: 1.0052, test_f1: 0.6891
 epoch: 50, train_loss: 0.3819, test_loss: 0.9514, test_f1: 0.6832
 epoch: 51, train_loss: 0.3390, test_loss: 0.9648, test_f1: 0.6993
 epoch: 52, train_loss: 0.3208, test_loss: 1.0807, test_f1: 0.6830
 epoch: 53, train_loss: 0.3099, test_loss: 1.1171, test_f1: 0.6754
 epoch: 54, train_loss: 0.2988, test_loss: 1.1316, test_f1: 0.6821
 epoch: 55, train_loss: 0.3210, test_loss: 1.1396, test_f1: 0.6878
 epoch: 56, train_loss: 0.2867, test_loss: 1.2841, test_f1: 0.6799
 epoch: 57, train_loss: 0.3059, test_loss: 1.1643, test_f1: 0.6915
 epoch: 58, train_loss: 0.2789, test_loss: 1.1757, test_f1: 0.6837
 epoch: 59, train_loss: 0.2801, test_loss: 1.2495, test_f1: 0.6885
 epoch: 60, train_loss: 0.2925, test_loss: 1.0906, test_f1: 0.6891
 epoch: 61, train_loss: 0.2709, test_loss: 1.3096, test_f1: 0.6871
 epoch: 62, train_loss: 0.2752, test_loss: 1.2076, test_f1: 0.6926
 epoch: 63, train_loss: 0.2454, test_loss: 1.2851, test_f1: 0.6933
 epoch: 64, train_loss: 0.2660, test_loss: 1.2023, test_f1: 0.7024
 epoch: 65, train_loss: 0.2750, test_loss: 1.2768, test_f1: 0.6696
 epoch: 66, train_loss: 0.2495, test_loss: 1.2438, test_f1: 0.6938
 epoch: 67, train_loss: 0.2523, test_loss: 1.2898, test_f1: 0.6937
 epoch: 68, train_loss: 0.2497, test_loss: 1.2811, test_f1: 0.7018
 epoch: 69, train_loss: 0.2523, test_loss: 1.2776, test_f1: 0.7026
 epoch: 70, train_loss: 0.2441, test_loss: 1.2590, test_f1: 0.6981
 epoch: 71, train_loss: 0.2322, test_loss: 1.3629, test_f1: 0.6766
 epoch: 72, train_loss: 0.2631, test_loss: 1.3189, test_f1: 0.6979
 epoch: 73, train_loss: 0.2582, test_loss: 1.3534, test_f1: 0.6915
 epoch: 74, train_loss: 0.2248, test_loss: 1.3690, test_f1: 0.6908
 epoch: 75, train_loss: 0.2371, test_loss: 1.4311, test_f1: 0.6729
 epoch: 76, train_loss: 0.2151, test_loss: 1.4126, test_f1: 0.6934
 epoch: 77, train_loss: 0.2398, test_loss: 1.3418, test_f1: 0.7008
 epoch: 78, train_loss: 0.2428, test_loss: 1.4254, test_f1: 0.6790
 epoch: 79, train_loss: 0.2207, test_loss: 1.4074, test_f1: 0.6852
 epoch: 80, train_loss: 0.1986, test_loss: 1.4617, test_f1: 0.6797
 epoch: 81, train_loss: 0.2110, test_loss: 1.4609, test_f1: 0.6736
 epoch: 82, train_loss: 0.2193, test_loss: 1.4330, test_f1: 0.7046
 epoch: 83, train_loss: 0.1978, test_loss: 1.4995, test_f1: 0.6938
 epoch: 84, train_loss: 0.2304, test_loss: 1.3752, test_f1: 0.6925
 epoch: 85, train_loss: 0.2221, test_loss: 1.4676, test_f1: 0.6690
 epoch: 86, train_loss: 0.2165, test_loss: 1.3949, test_f1: 0.6943
 epoch: 87, train_loss: 0.1992, test_loss: 1.4665, test_f1: 0.7115
 epoch: 88, train_loss: 0.2015, test_loss: 1.4790, test_f1: 0.6992
 epoch: 89, train_loss: 0.2063, test_loss: 1.4895, test_f1: 0.6811
 epoch: 90, train_loss: 0.2120, test_loss: 1.6172, test_f1: 0.6906
 epoch: 91, train_loss: 0.1995, test_loss: 1.4881, test_f1: 0.6962
 epoch: 92, train_loss: 0.1890, test_loss: 1.5895, test_f1: 0.6853
 epoch: 93, train_loss: 0.1832, test_loss: 1.5423, test_f1: 0.6906
 epoch: 94, train_loss: 0.1922, test_loss: 1.5581, test_f1: 0.6959
 epoch: 95, train_loss: 0.1931, test_loss: 1.7167, test_f1: 0.6848
 epoch: 96, train_loss: 0.1887, test_loss: 1.7058, test_f1: 0.6827
 epoch: 97, train_loss: 0.1994, test_loss: 1.6300, test_f1: 0.6848
 epoch: 98, train_loss: 0.1872, test_loss: 1.6305, test_f1: 0.6893
 epoch: 99, train_loss: 0.1928, test_loss: 1.6414, test_f1: 0.6704
##################ITERATION #9 ****************************************
 epoch: 0, train_loss: 1.3798, test_loss: 1.0864, test_f1: 0.4419
 epoch: 1, train_loss: 0.9956, test_loss: 0.9336, test_f1: 0.5534
 epoch: 2, train_loss: 0.9375, test_loss: 0.9190, test_f1: 0.5651
 epoch: 3, train_loss: 0.9179, test_loss: 0.8686, test_f1: 0.5325
 epoch: 4, train_loss: 0.8865, test_loss: 0.8785, test_f1: 0.5546
 epoch: 5, train_loss: 0.8549, test_loss: 0.8490, test_f1: 0.5801
 epoch: 6, train_loss: 0.8480, test_loss: 0.8877, test_f1: 0.6133
 epoch: 7, train_loss: 0.8216, test_loss: 0.8668, test_f1: 0.6181
 epoch: 8, train_loss: 0.7962, test_loss: 0.7749, test_f1: 0.6343
 epoch: 9, train_loss: 0.7757, test_loss: 0.7957, test_f1: 0.6159
 epoch: 10, train_loss: 0.7661, test_loss: 0.7823, test_f1: 0.6162
 epoch: 11, train_loss: 0.7556, test_loss: 0.7988, test_f1: 0.6144
 epoch: 12, train_loss: 0.7094, test_loss: 0.7392, test_f1: 0.6589
 epoch: 13, train_loss: 0.7019, test_loss: 0.8222, test_f1: 0.6333
 epoch: 14, train_loss: 0.6940, test_loss: 0.7627, test_f1: 0.6591
 epoch: 15, train_loss: 0.6940, test_loss: 0.7787, test_f1: 0.6315
 epoch: 16, train_loss: 0.6677, test_loss: 0.7720, test_f1: 0.6427
 epoch: 17, train_loss: 0.6659, test_loss: 0.7470, test_f1: 0.6519
 epoch: 18, train_loss: 0.6364, test_loss: 0.7500, test_f1: 0.6390
 epoch: 19, train_loss: 0.6528, test_loss: 0.7066, test_f1: 0.6471
 epoch: 20, train_loss: 0.6162, test_loss: 0.7929, test_f1: 0.6627
 epoch: 21, train_loss: 0.6003, test_loss: 0.7187, test_f1: 0.6767
 epoch: 22, train_loss: 0.5854, test_loss: 0.7043, test_f1: 0.6640
 epoch: 23, train_loss: 0.5885, test_loss: 0.7289, test_f1: 0.6481
 epoch: 24, train_loss: 0.5754, test_loss: 0.8331, test_f1: 0.6590
 epoch: 25, train_loss: 0.5712, test_loss: 0.7435, test_f1: 0.6635
 epoch: 26, train_loss: 0.5461, test_loss: 0.7331, test_f1: 0.6726
 epoch: 27, train_loss: 0.5388, test_loss: 0.7235, test_f1: 0.6631
 epoch: 28, train_loss: 0.5486, test_loss: 0.7315, test_f1: 0.7059
 epoch: 29, train_loss: 0.5124, test_loss: 0.7813, test_f1: 0.6737
 epoch: 30, train_loss: 0.5229, test_loss: 0.7789, test_f1: 0.6556
 epoch: 31, train_loss: 0.5067, test_loss: 0.7905, test_f1: 0.6639
 epoch: 32, train_loss: 0.4876, test_loss: 0.8003, test_f1: 0.6666
 epoch: 33, train_loss: 0.4912, test_loss: 0.7978, test_f1: 0.6693
 epoch: 34, train_loss: 0.4825, test_loss: 0.9207, test_f1: 0.6487
 epoch: 35, train_loss: 0.4945, test_loss: 0.8096, test_f1: 0.6628
 epoch: 36, train_loss: 0.4730, test_loss: 0.8287, test_f1: 0.6627
 epoch: 37, train_loss: 0.4484, test_loss: 0.8387, test_f1: 0.6802
 epoch: 38, train_loss: 0.4630, test_loss: 0.7941, test_f1: 0.7097
 epoch: 39, train_loss: 0.4390, test_loss: 0.8495, test_f1: 0.6823
 epoch: 40, train_loss: 0.4223, test_loss: 0.8990, test_f1: 0.6810
 epoch: 41, train_loss: 0.4100, test_loss: 0.8643, test_f1: 0.6724
 epoch: 42, train_loss: 0.4110, test_loss: 0.9222, test_f1: 0.7163
 epoch: 43, train_loss: 0.4029, test_loss: 0.9631, test_f1: 0.6505
 epoch: 44, train_loss: 0.3978, test_loss: 1.0058, test_f1: 0.6464
 epoch: 45, train_loss: 0.3867, test_loss: 1.0721, test_f1: 0.6756
 epoch: 46, train_loss: 0.4041, test_loss: 0.9589, test_f1: 0.6579
 epoch: 47, train_loss: 0.3917, test_loss: 1.0129, test_f1: 0.6543
 epoch: 48, train_loss: 0.3969, test_loss: 0.9958, test_f1: 0.6403
 epoch: 49, train_loss: 0.3838, test_loss: 0.9501, test_f1: 0.6645
 epoch: 50, train_loss: 0.3664, test_loss: 0.8566, test_f1: 0.6910
 epoch: 51, train_loss: 0.3300, test_loss: 0.9713, test_f1: 0.6869
 epoch: 52, train_loss: 0.3053, test_loss: 1.0512, test_f1: 0.6743
 epoch: 53, train_loss: 0.2934, test_loss: 1.1081, test_f1: 0.6587
 epoch: 54, train_loss: 0.3154, test_loss: 1.0583, test_f1: 0.6873
 epoch: 55, train_loss: 0.2910, test_loss: 1.0704, test_f1: 0.6907
 epoch: 56, train_loss: 0.2766, test_loss: 1.1024, test_f1: 0.6669
 epoch: 57, train_loss: 0.2688, test_loss: 1.1350, test_f1: 0.6706
 epoch: 58, train_loss: 0.2757, test_loss: 1.0701, test_f1: 0.6900
 epoch: 59, train_loss: 0.2878, test_loss: 1.0339, test_f1: 0.6803
 epoch: 60, train_loss: 0.2749, test_loss: 1.0805, test_f1: 0.6767
 epoch: 61, train_loss: 0.2664, test_loss: 1.1534, test_f1: 0.6778
 epoch: 62, train_loss: 0.2667, test_loss: 1.2121, test_f1: 0.6731
 epoch: 63, train_loss: 0.2430, test_loss: 1.2320, test_f1: 0.6941
 epoch: 64, train_loss: 0.2678, test_loss: 1.2340, test_f1: 0.6729
 epoch: 65, train_loss: 0.2501, test_loss: 1.2981, test_f1: 0.6572
 epoch: 66, train_loss: 0.2699, test_loss: 1.1629, test_f1: 0.6752
 epoch: 67, train_loss: 0.2376, test_loss: 1.2218, test_f1: 0.6737
 epoch: 68, train_loss: 0.2634, test_loss: 1.2439, test_f1: 0.6655
 epoch: 69, train_loss: 0.2551, test_loss: 1.3069, test_f1: 0.6562
 epoch: 70, train_loss: 0.2529, test_loss: 1.1822, test_f1: 0.6940
 epoch: 71, train_loss: 0.2347, test_loss: 1.2144, test_f1: 0.6870
 epoch: 72, train_loss: 0.2328, test_loss: 1.2999, test_f1: 0.6685
 epoch: 73, train_loss: 0.2394, test_loss: 1.2781, test_f1: 0.6710
 epoch: 74, train_loss: 0.2332, test_loss: 1.3006, test_f1: 0.6628
 epoch: 75, train_loss: 0.2396, test_loss: 1.2770, test_f1: 0.6636
 epoch: 76, train_loss: 0.2357, test_loss: 1.3480, test_f1: 0.6691
 epoch: 77, train_loss: 0.2262, test_loss: 1.3923, test_f1: 0.6584
 epoch: 78, train_loss: 0.1975, test_loss: 1.2665, test_f1: 0.6867
 epoch: 79, train_loss: 0.2120, test_loss: 1.3773, test_f1: 0.6758
 epoch: 80, train_loss: 0.2132, test_loss: 1.3712, test_f1: 0.6637
 epoch: 81, train_loss: 0.2218, test_loss: 1.3626, test_f1: 0.6813
 epoch: 82, train_loss: 0.2114, test_loss: 1.3136, test_f1: 0.6758
 epoch: 83, train_loss: 0.2161, test_loss: 1.3465, test_f1: 0.6833
 epoch: 84, train_loss: 0.2010, test_loss: 1.4218, test_f1: 0.6842
 epoch: 85, train_loss: 0.1917, test_loss: 1.4101, test_f1: 0.6637
 epoch: 86, train_loss: 0.1988, test_loss: 1.3734, test_f1: 0.6957
 epoch: 87, train_loss: 0.1936, test_loss: 1.4677, test_f1: 0.6774
 epoch: 88, train_loss: 0.2006, test_loss: 1.4619, test_f1: 0.6562
 epoch: 89, train_loss: 0.1877, test_loss: 1.4807, test_f1: 0.6593
 epoch: 90, train_loss: 0.1897, test_loss: 1.4942, test_f1: 0.6829
 epoch: 91, train_loss: 0.1918, test_loss: 1.4468, test_f1: 0.6758
 epoch: 92, train_loss: 0.1851, test_loss: 1.4599, test_f1: 0.6904
 epoch: 93, train_loss: 0.1855, test_loss: 1.4696, test_f1: 0.6914
 epoch: 94, train_loss: 0.1799, test_loss: 1.4052, test_f1: 0.6920
 epoch: 95, train_loss: 0.1868, test_loss: 1.4352, test_f1: 0.6952
 epoch: 96, train_loss: 0.1879, test_loss: 1.4789, test_f1: 0.6674
 epoch: 97, train_loss: 0.1831, test_loss: 1.4826, test_f1: 0.6773
 epoch: 98, train_loss: 0.1944, test_loss: 1.4330, test_f1: 0.6794
 epoch: 99, train_loss: 0.1961, test_loss: 1.3963, test_f1: 0.6886

Training completed in 597.19 seconds
Best F1: 0.7163 at epoch 42
Mean F1 across iterations: 0.7032  0.0109
========================FINAL RESULTS================================
FEGIN weighted F1: 0.7163  0.0109
python main.py --data ltspice_examples --representation component_pin_net --model FEGIN --layers 2 --hiddens 128 --batch_size 64 --lr 0.001 --emb_size 128 --epochs 100 --save_appendix component_pin_net_L2_H128_BS64_LR0.001_E128 --no_val
-----



STDERR:
  File "main.py", line 370, in <module>
    main()
  File "main.py", line 254, in main
    dataset = dataset_class(
  File "/home/philip/projects/ltspice_examples_code_repo/Circuit-Completion-Using-GNNs/component_classification_with_link_prediction_head/evaluation/FEGIN/kernel/circuit_datasets.py", line 15, in __init__
    self.data, self.slices = torch.load(self.processed_paths[0])
  File "/home/philip/.local/lib/python3.8/site-packages/torch/serialization.py", line 1040, in load
    warnings.warn(
  File "/usr/lib/python3.8/warnings.py", line 109, in _showwarnmsg
    sw(msg.message, msg.category, msg.filename, msg.lineno,
  File "main.py", line 47, in warn_with_traceback
    traceback.print_stack(file=log)
/home/philip/projects/ltspice_examples_code_repo/Circuit-Completion-Using-GNNs/component_classification_with_link_prediction_head/evaluation/FEGIN/kernel/circuit_datasets.py:15: FutureWarning: You are using `torch.load` with `weights_only=False` (the current default value), which uses the default pickle module implicitly. It is possible to construct malicious pickle data which will execute arbitrary code during unpickling (See https://github.com/pytorch/pytorch/blob/main/SECURITY.md#untrusted-models for more details). In a future release, the default value for `weights_only` will be flipped to `True`. This limits the functions that could be executed during unpickling. Arbitrary objects will no longer be allowed to be loaded via this mode unless they are explicitly allowlisted by the user via `torch.serialization.add_safe_globals`. We recommend you start setting `weights_only=True` for any use case where you don't have full control of the loaded file. Please open an issue on GitHub for any issues related to this experimental feature.
  self.data, self.slices = torch.load(self.processed_paths[0])
