STDOUT:
Results will be saved in /home/philip/projects/ltspice_examples_code_repo/Circuit-Completion-Using-GNNs/component_classification_with_link_prediction_head/evaluation/FEGIN/results/model_FEGIN_dataset_ltspice_demos
Command line input: python main.py --data ltspice_demos --representation component_component --model FEGIN --layers 5 --hiddens 32 --batch_size 32 --lr 0.0001 --emb_size 512 --epochs 100 --save_appendix component_component_L5_H32_BS32_LR0.0001_E512 --no_val
 is saved.
-----
ltspice_demos - FEGIN
Using 5 layers, 32 hidden units, h = 2
Loading component_component representation dataset
ENTERED
Training FEGIN on component_component representation
Train: 1565, Test: 383
##################ITERATION #0 ****************************************
 epoch: 0, train_loss: 1.3601, test_loss: 1.3600, test_f1: 0.2281
 epoch: 1, train_loss: 1.3495, test_loss: 1.3539, test_f1: 0.2281
 epoch: 2, train_loss: 1.3409, test_loss: 1.3464, test_f1: 0.2281
 epoch: 3, train_loss: 1.3326, test_loss: 1.3399, test_f1: 0.2281
 epoch: 4, train_loss: 1.3222, test_loss: 1.3299, test_f1: 0.2281
 epoch: 5, train_loss: 1.3103, test_loss: 1.3220, test_f1: 0.2281
 epoch: 6, train_loss: 1.2999, test_loss: 1.3108, test_f1: 0.2281
 epoch: 7, train_loss: 1.2856, test_loss: 1.3032, test_f1: 0.2281
 epoch: 8, train_loss: 1.2734, test_loss: 1.2936, test_f1: 0.2281
 epoch: 9, train_loss: 1.2605, test_loss: 1.2846, test_f1: 0.2281
 epoch: 10, train_loss: 1.2450, test_loss: 1.2771, test_f1: 0.2281
 epoch: 11, train_loss: 1.2355, test_loss: 1.2705, test_f1: 0.2281
 epoch: 12, train_loss: 1.2262, test_loss: 1.2638, test_f1: 0.2281
 epoch: 13, train_loss: 1.2158, test_loss: 1.2633, test_f1: 0.2281
 epoch: 14, train_loss: 1.2069, test_loss: 1.2613, test_f1: 0.2281
 epoch: 15, train_loss: 1.2036, test_loss: 1.2581, test_f1: 0.2281
 epoch: 16, train_loss: 1.1932, test_loss: 1.2570, test_f1: 0.2281
 epoch: 17, train_loss: 1.1891, test_loss: 1.2568, test_f1: 0.2340
 epoch: 18, train_loss: 1.1827, test_loss: 1.2545, test_f1: 0.2399
 epoch: 19, train_loss: 1.1857, test_loss: 1.2487, test_f1: 0.2951
 epoch: 20, train_loss: 1.1714, test_loss: 1.2516, test_f1: 0.3229
 epoch: 21, train_loss: 1.1750, test_loss: 1.2406, test_f1: 0.3049
 epoch: 22, train_loss: 1.1750, test_loss: 1.2499, test_f1: 0.3140
 epoch: 23, train_loss: 1.1590, test_loss: 1.2494, test_f1: 0.3109
 epoch: 24, train_loss: 1.1592, test_loss: 1.2499, test_f1: 0.3143
 epoch: 25, train_loss: 1.1580, test_loss: 1.2485, test_f1: 0.3496
 epoch: 26, train_loss: 1.1589, test_loss: 1.2369, test_f1: 0.3159
 epoch: 27, train_loss: 1.1480, test_loss: 1.2323, test_f1: 0.3356
 epoch: 28, train_loss: 1.1459, test_loss: 1.2267, test_f1: 0.3436
 epoch: 29, train_loss: 1.1480, test_loss: 1.2283, test_f1: 0.3323
 epoch: 30, train_loss: 1.1382, test_loss: 1.2274, test_f1: 0.3467
 epoch: 31, train_loss: 1.1415, test_loss: 1.2162, test_f1: 0.3490
 epoch: 32, train_loss: 1.1368, test_loss: 1.2253, test_f1: 0.3516
 epoch: 33, train_loss: 1.1349, test_loss: 1.2304, test_f1: 0.3516
 epoch: 34, train_loss: 1.1274, test_loss: 1.2254, test_f1: 0.3388
 epoch: 35, train_loss: 1.1250, test_loss: 1.2168, test_f1: 0.3215
 epoch: 36, train_loss: 1.1224, test_loss: 1.2142, test_f1: 0.3415
 epoch: 37, train_loss: 1.1106, test_loss: 1.2015, test_f1: 0.3358
 epoch: 38, train_loss: 1.1218, test_loss: 1.2009, test_f1: 0.3338
 epoch: 39, train_loss: 1.1184, test_loss: 1.2326, test_f1: 0.3392
 epoch: 40, train_loss: 1.1163, test_loss: 1.2129, test_f1: 0.3451
 epoch: 41, train_loss: 1.1002, test_loss: 1.2109, test_f1: 0.3607
 epoch: 42, train_loss: 1.1117, test_loss: 1.2004, test_f1: 0.3926
 epoch: 43, train_loss: 1.1028, test_loss: 1.1907, test_f1: 0.3890
 epoch: 44, train_loss: 1.0981, test_loss: 1.2005, test_f1: 0.4106
 epoch: 45, train_loss: 1.0919, test_loss: 1.1963, test_f1: 0.4075
 epoch: 46, train_loss: 1.0981, test_loss: 1.1748, test_f1: 0.4184
 epoch: 47, train_loss: 1.0975, test_loss: 1.1892, test_f1: 0.4050
 epoch: 48, train_loss: 1.0844, test_loss: 1.2081, test_f1: 0.4194
 epoch: 49, train_loss: 1.0888, test_loss: 1.1950, test_f1: 0.4086
 epoch: 50, train_loss: 1.0739, test_loss: 1.2117, test_f1: 0.4243
 epoch: 51, train_loss: 1.0727, test_loss: 1.1922, test_f1: 0.4154
 epoch: 52, train_loss: 1.0822, test_loss: 1.1896, test_f1: 0.4112
 epoch: 53, train_loss: 1.0814, test_loss: 1.1877, test_f1: 0.4198
 epoch: 54, train_loss: 1.0668, test_loss: 1.1955, test_f1: 0.4247
 epoch: 55, train_loss: 1.0659, test_loss: 1.1855, test_f1: 0.4251
 epoch: 56, train_loss: 1.0668, test_loss: 1.1837, test_f1: 0.4254
 epoch: 57, train_loss: 1.0732, test_loss: 1.1943, test_f1: 0.4150
 epoch: 58, train_loss: 1.0673, test_loss: 1.1947, test_f1: 0.4131
 epoch: 59, train_loss: 1.0730, test_loss: 1.1820, test_f1: 0.4148
 epoch: 60, train_loss: 1.0685, test_loss: 1.1979, test_f1: 0.4111
 epoch: 61, train_loss: 1.0592, test_loss: 1.2081, test_f1: 0.4398
 epoch: 62, train_loss: 1.0589, test_loss: 1.1836, test_f1: 0.4327
 epoch: 63, train_loss: 1.0602, test_loss: 1.2235, test_f1: 0.4332
 epoch: 64, train_loss: 1.0615, test_loss: 1.1965, test_f1: 0.4247
 epoch: 65, train_loss: 1.0400, test_loss: 1.2361, test_f1: 0.4383
 epoch: 66, train_loss: 1.0651, test_loss: 1.1918, test_f1: 0.4617
 epoch: 67, train_loss: 1.0483, test_loss: 1.1989, test_f1: 0.4273
 epoch: 68, train_loss: 1.0506, test_loss: 1.1853, test_f1: 0.4532
 epoch: 69, train_loss: 1.0488, test_loss: 1.1930, test_f1: 0.4714
 epoch: 70, train_loss: 1.0436, test_loss: 1.2087, test_f1: 0.4820
 epoch: 71, train_loss: 1.0388, test_loss: 1.2230, test_f1: 0.4703
 epoch: 72, train_loss: 1.0528, test_loss: 1.1949, test_f1: 0.4653
 epoch: 73, train_loss: 1.0437, test_loss: 1.2001, test_f1: 0.4660
 epoch: 74, train_loss: 1.0425, test_loss: 1.1897, test_f1: 0.4848
 epoch: 75, train_loss: 1.0380, test_loss: 1.2100, test_f1: 0.4944
 epoch: 76, train_loss: 1.0343, test_loss: 1.1947, test_f1: 0.4960
 epoch: 77, train_loss: 1.0317, test_loss: 1.1969, test_f1: 0.4682
 epoch: 78, train_loss: 1.0374, test_loss: 1.2000, test_f1: 0.4846
 epoch: 79, train_loss: 1.0282, test_loss: 1.1870, test_f1: 0.4854
 epoch: 80, train_loss: 1.0283, test_loss: 1.1902, test_f1: 0.4741
 epoch: 81, train_loss: 1.0326, test_loss: 1.1862, test_f1: 0.5046
 epoch: 82, train_loss: 1.0196, test_loss: 1.1813, test_f1: 0.4819
 epoch: 83, train_loss: 1.0378, test_loss: 1.1954, test_f1: 0.5000
 epoch: 84, train_loss: 1.0216, test_loss: 1.1842, test_f1: 0.4965
 epoch: 85, train_loss: 1.0284, test_loss: 1.2024, test_f1: 0.4966
 epoch: 86, train_loss: 1.0271, test_loss: 1.1914, test_f1: 0.5138
 epoch: 87, train_loss: 1.0342, test_loss: 1.1972, test_f1: 0.5096
 epoch: 88, train_loss: 1.0068, test_loss: 1.1908, test_f1: 0.5211
 epoch: 89, train_loss: 1.0138, test_loss: 1.2034, test_f1: 0.5186
 epoch: 90, train_loss: 1.0074, test_loss: 1.1893, test_f1: 0.5154
 epoch: 91, train_loss: 1.0022, test_loss: 1.1918, test_f1: 0.5302
 epoch: 92, train_loss: 1.0131, test_loss: 1.2057, test_f1: 0.5053
 epoch: 93, train_loss: 1.0026, test_loss: 1.2240, test_f1: 0.5226
 epoch: 94, train_loss: 1.0079, test_loss: 1.1999, test_f1: 0.5272
 epoch: 95, train_loss: 1.0089, test_loss: 1.1732, test_f1: 0.5146
 epoch: 96, train_loss: 1.0101, test_loss: 1.1807, test_f1: 0.5331
 epoch: 97, train_loss: 1.0055, test_loss: 1.1909, test_f1: 0.5265
 epoch: 98, train_loss: 1.0071, test_loss: 1.1990, test_f1: 0.5251
 epoch: 99, train_loss: 1.0027, test_loss: 1.1744, test_f1: 0.5331
##################ITERATION #1 ****************************************
 epoch: 0, train_loss: 1.3191, test_loss: 1.3785, test_f1: 0.2281
 epoch: 1, train_loss: 1.2940, test_loss: 1.4090, test_f1: 0.2281
 epoch: 2, train_loss: 1.2788, test_loss: 1.3743, test_f1: 0.2281
 epoch: 3, train_loss: 1.2605, test_loss: 1.3590, test_f1: 0.2281
 epoch: 4, train_loss: 1.2490, test_loss: 1.3681, test_f1: 0.2281
 epoch: 5, train_loss: 1.2327, test_loss: 1.3483, test_f1: 0.2281
 epoch: 6, train_loss: 1.2247, test_loss: 1.3150, test_f1: 0.2281
 epoch: 7, train_loss: 1.2182, test_loss: 1.3076, test_f1: 0.2281
 epoch: 8, train_loss: 1.2125, test_loss: 1.3253, test_f1: 0.2281
 epoch: 9, train_loss: 1.2081, test_loss: 1.3103, test_f1: 0.2281
 epoch: 10, train_loss: 1.2028, test_loss: 1.3115, test_f1: 0.2281
 epoch: 11, train_loss: 1.1967, test_loss: 1.2997, test_f1: 0.2281
 epoch: 12, train_loss: 1.1844, test_loss: 1.2939, test_f1: 0.2557
 epoch: 13, train_loss: 1.1829, test_loss: 1.2898, test_f1: 0.2614
 epoch: 14, train_loss: 1.1830, test_loss: 1.2844, test_f1: 0.2542
 epoch: 15, train_loss: 1.1821, test_loss: 1.3004, test_f1: 0.2553
 epoch: 16, train_loss: 1.1787, test_loss: 1.2812, test_f1: 0.2325
 epoch: 17, train_loss: 1.1773, test_loss: 1.2672, test_f1: 0.2325
 epoch: 18, train_loss: 1.1732, test_loss: 1.2652, test_f1: 0.2325
 epoch: 19, train_loss: 1.1732, test_loss: 1.2525, test_f1: 0.2318
 epoch: 20, train_loss: 1.1594, test_loss: 1.2942, test_f1: 0.2566
 epoch: 21, train_loss: 1.1520, test_loss: 1.2675, test_f1: 0.2401
 epoch: 22, train_loss: 1.1625, test_loss: 1.2749, test_f1: 0.2741
 epoch: 23, train_loss: 1.1488, test_loss: 1.2728, test_f1: 0.2738
 epoch: 24, train_loss: 1.1515, test_loss: 1.2976, test_f1: 0.2910
 epoch: 25, train_loss: 1.1450, test_loss: 1.2420, test_f1: 0.2733
 epoch: 26, train_loss: 1.1532, test_loss: 1.2562, test_f1: 0.3239
 epoch: 27, train_loss: 1.1342, test_loss: 1.2338, test_f1: 0.3202
 epoch: 28, train_loss: 1.1369, test_loss: 1.2252, test_f1: 0.3232
 epoch: 29, train_loss: 1.1373, test_loss: 1.2447, test_f1: 0.3089
 epoch: 30, train_loss: 1.1370, test_loss: 1.2404, test_f1: 0.3147
 epoch: 31, train_loss: 1.1269, test_loss: 1.2603, test_f1: 0.3185
 epoch: 32, train_loss: 1.1275, test_loss: 1.2555, test_f1: 0.3221
 epoch: 33, train_loss: 1.1246, test_loss: 1.2667, test_f1: 0.3409
 epoch: 34, train_loss: 1.1268, test_loss: 1.2241, test_f1: 0.3153
 epoch: 35, train_loss: 1.1168, test_loss: 1.2238, test_f1: 0.3497
 epoch: 36, train_loss: 1.1108, test_loss: 1.2219, test_f1: 0.3279
 epoch: 37, train_loss: 1.1060, test_loss: 1.2150, test_f1: 0.3569
 epoch: 38, train_loss: 1.0980, test_loss: 1.2057, test_f1: 0.3466
 epoch: 39, train_loss: 1.0950, test_loss: 1.2014, test_f1: 0.3298
 epoch: 40, train_loss: 1.1035, test_loss: 1.2098, test_f1: 0.3270
 epoch: 41, train_loss: 1.0877, test_loss: 1.2117, test_f1: 0.3478
 epoch: 42, train_loss: 1.0895, test_loss: 1.2234, test_f1: 0.3592
 epoch: 43, train_loss: 1.0861, test_loss: 1.2318, test_f1: 0.3636
 epoch: 44, train_loss: 1.0806, test_loss: 1.2598, test_f1: 0.3612
 epoch: 45, train_loss: 1.0735, test_loss: 1.2237, test_f1: 0.3828
 epoch: 46, train_loss: 1.0697, test_loss: 1.2247, test_f1: 0.3858
 epoch: 47, train_loss: 1.0839, test_loss: 1.2634, test_f1: 0.3562
 epoch: 48, train_loss: 1.0682, test_loss: 1.2204, test_f1: 0.3549
 epoch: 49, train_loss: 1.0588, test_loss: 1.2441, test_f1: 0.3932
 epoch: 50, train_loss: 1.0519, test_loss: 1.2548, test_f1: 0.3779
 epoch: 51, train_loss: 1.0425, test_loss: 1.2215, test_f1: 0.3849
 epoch: 52, train_loss: 1.0459, test_loss: 1.2295, test_f1: 0.3901
 epoch: 53, train_loss: 1.0566, test_loss: 1.2022, test_f1: 0.3837
 epoch: 54, train_loss: 1.0608, test_loss: 1.2117, test_f1: 0.3763
 epoch: 55, train_loss: 1.0567, test_loss: 1.2051, test_f1: 0.3725
 epoch: 56, train_loss: 1.0473, test_loss: 1.2059, test_f1: 0.3927
 epoch: 57, train_loss: 1.0434, test_loss: 1.2265, test_f1: 0.3804
 epoch: 58, train_loss: 1.0460, test_loss: 1.2069, test_f1: 0.3820
 epoch: 59, train_loss: 1.0472, test_loss: 1.2769, test_f1: 0.3924
 epoch: 60, train_loss: 1.0409, test_loss: 1.2552, test_f1: 0.3826
 epoch: 61, train_loss: 1.0453, test_loss: 1.2009, test_f1: 0.3821
 epoch: 62, train_loss: 1.0299, test_loss: 1.2614, test_f1: 0.3991
 epoch: 63, train_loss: 1.0304, test_loss: 1.2410, test_f1: 0.4081
 epoch: 64, train_loss: 1.0390, test_loss: 1.2692, test_f1: 0.4101
 epoch: 65, train_loss: 1.0327, test_loss: 1.1999, test_f1: 0.3903
 epoch: 66, train_loss: 1.0202, test_loss: 1.2228, test_f1: 0.3917
 epoch: 67, train_loss: 1.0405, test_loss: 1.2102, test_f1: 0.4172
 epoch: 68, train_loss: 1.0348, test_loss: 1.2115, test_f1: 0.3904
 epoch: 69, train_loss: 1.0125, test_loss: 1.1936, test_f1: 0.3859
 epoch: 70, train_loss: 1.0254, test_loss: 1.2170, test_f1: 0.4007
 epoch: 71, train_loss: 1.0147, test_loss: 1.2391, test_f1: 0.3862
 epoch: 72, train_loss: 1.0208, test_loss: 1.2071, test_f1: 0.4032
 epoch: 73, train_loss: 1.0131, test_loss: 1.2280, test_f1: 0.4293
 epoch: 74, train_loss: 1.0170, test_loss: 1.2457, test_f1: 0.4083
 epoch: 75, train_loss: 1.0338, test_loss: 1.2067, test_f1: 0.4347
 epoch: 76, train_loss: 1.0157, test_loss: 1.2016, test_f1: 0.4131
 epoch: 77, train_loss: 1.0189, test_loss: 1.2026, test_f1: 0.4082
 epoch: 78, train_loss: 1.0127, test_loss: 1.2936, test_f1: 0.4262
 epoch: 79, train_loss: 1.0048, test_loss: 1.2264, test_f1: 0.4280
 epoch: 80, train_loss: 1.0006, test_loss: 1.2385, test_f1: 0.4389
 epoch: 81, train_loss: 1.0105, test_loss: 1.2371, test_f1: 0.4542
 epoch: 82, train_loss: 0.9998, test_loss: 1.2279, test_f1: 0.4244
 epoch: 83, train_loss: 1.0083, test_loss: 1.2375, test_f1: 0.4398
 epoch: 84, train_loss: 1.0093, test_loss: 1.1881, test_f1: 0.4608
 epoch: 85, train_loss: 0.9976, test_loss: 1.2387, test_f1: 0.4448
 epoch: 86, train_loss: 1.0106, test_loss: 1.2011, test_f1: 0.4573
 epoch: 87, train_loss: 1.0009, test_loss: 1.2486, test_f1: 0.4600
 epoch: 88, train_loss: 0.9935, test_loss: 1.2064, test_f1: 0.4793
 epoch: 89, train_loss: 0.9988, test_loss: 1.2331, test_f1: 0.4426
 epoch: 90, train_loss: 0.9926, test_loss: 1.2121, test_f1: 0.4902
 epoch: 91, train_loss: 1.0022, test_loss: 1.2479, test_f1: 0.4642
 epoch: 92, train_loss: 0.9934, test_loss: 1.1885, test_f1: 0.4595
 epoch: 93, train_loss: 0.9857, test_loss: 1.2227, test_f1: 0.4578
 epoch: 94, train_loss: 0.9910, test_loss: 1.1863, test_f1: 0.4715
 epoch: 95, train_loss: 0.9797, test_loss: 1.2380, test_f1: 0.4769
 epoch: 96, train_loss: 0.9833, test_loss: 1.2094, test_f1: 0.4751
 epoch: 97, train_loss: 0.9837, test_loss: 1.2470, test_f1: 0.4782
 epoch: 98, train_loss: 0.9934, test_loss: 1.2182, test_f1: 0.4680
 epoch: 99, train_loss: 0.9897, test_loss: 1.2445, test_f1: 0.4899
##################ITERATION #2 ****************************************
 epoch: 0, train_loss: 1.2911, test_loss: 1.3255, test_f1: 0.2281
 epoch: 1, train_loss: 1.2712, test_loss: 1.4347, test_f1: 0.2281
 epoch: 2, train_loss: 1.2600, test_loss: 1.4765, test_f1: 0.2281
 epoch: 3, train_loss: 1.2512, test_loss: 1.4411, test_f1: 0.2281
 epoch: 4, train_loss: 1.2378, test_loss: 1.4265, test_f1: 0.2281
 epoch: 5, train_loss: 1.2337, test_loss: 1.4301, test_f1: 0.2281
 epoch: 6, train_loss: 1.2250, test_loss: 1.4793, test_f1: 0.2281
 epoch: 7, train_loss: 1.2229, test_loss: 1.5041, test_f1: 0.2272
 epoch: 8, train_loss: 1.2179, test_loss: 1.4208, test_f1: 0.2261
 epoch: 9, train_loss: 1.2088, test_loss: 1.5022, test_f1: 0.2340
 epoch: 10, train_loss: 1.2113, test_loss: 1.5794, test_f1: 0.2333
 epoch: 11, train_loss: 1.2020, test_loss: 1.3912, test_f1: 0.2322
 epoch: 12, train_loss: 1.2035, test_loss: 1.4488, test_f1: 0.2325
 epoch: 13, train_loss: 1.1907, test_loss: 1.4535, test_f1: 0.2364
 epoch: 14, train_loss: 1.1869, test_loss: 1.4588, test_f1: 0.2741
 epoch: 15, train_loss: 1.1839, test_loss: 1.4137, test_f1: 0.2747
 epoch: 16, train_loss: 1.1821, test_loss: 1.4630, test_f1: 0.3060
 epoch: 17, train_loss: 1.1717, test_loss: 1.4418, test_f1: 0.3145
 epoch: 18, train_loss: 1.1796, test_loss: 1.4019, test_f1: 0.3140
 epoch: 19, train_loss: 1.1644, test_loss: 1.4324, test_f1: 0.3339
 epoch: 20, train_loss: 1.1643, test_loss: 1.4474, test_f1: 0.3297
 epoch: 21, train_loss: 1.1535, test_loss: 1.4501, test_f1: 0.3384
 epoch: 22, train_loss: 1.1537, test_loss: 1.4962, test_f1: 0.3603
 epoch: 23, train_loss: 1.1504, test_loss: 1.4380, test_f1: 0.3565
 epoch: 24, train_loss: 1.1520, test_loss: 1.5106, test_f1: 0.3873
 epoch: 25, train_loss: 1.1423, test_loss: 1.3953, test_f1: 0.3708
 epoch: 26, train_loss: 1.1406, test_loss: 1.3723, test_f1: 0.3808
 epoch: 27, train_loss: 1.1371, test_loss: 1.4526, test_f1: 0.3999
 epoch: 28, train_loss: 1.1271, test_loss: 1.3789, test_f1: 0.3986
 epoch: 29, train_loss: 1.1253, test_loss: 1.3545, test_f1: 0.4185
 epoch: 30, train_loss: 1.1136, test_loss: 1.3851, test_f1: 0.4381
 epoch: 31, train_loss: 1.1113, test_loss: 1.3661, test_f1: 0.4295
 epoch: 32, train_loss: 1.1121, test_loss: 1.3356, test_f1: 0.4159
 epoch: 33, train_loss: 1.1014, test_loss: 1.3260, test_f1: 0.4457
 epoch: 34, train_loss: 1.1045, test_loss: 1.2395, test_f1: 0.4712
 epoch: 35, train_loss: 1.0935, test_loss: 1.2080, test_f1: 0.4551
 epoch: 36, train_loss: 1.0877, test_loss: 1.2889, test_f1: 0.4453
 epoch: 37, train_loss: 1.0873, test_loss: 1.2594, test_f1: 0.4585
 epoch: 38, train_loss: 1.0850, test_loss: 1.3112, test_f1: 0.4453
 epoch: 39, train_loss: 1.0761, test_loss: 1.2670, test_f1: 0.4538
 epoch: 40, train_loss: 1.0716, test_loss: 1.2380, test_f1: 0.4587
 epoch: 41, train_loss: 1.0800, test_loss: 1.2133, test_f1: 0.4610
 epoch: 42, train_loss: 1.0610, test_loss: 1.2592, test_f1: 0.4570
 epoch: 43, train_loss: 1.0535, test_loss: 1.2156, test_f1: 0.4522
 epoch: 44, train_loss: 1.0590, test_loss: 1.2149, test_f1: 0.4518
 epoch: 45, train_loss: 1.0595, test_loss: 1.2216, test_f1: 0.4666
 epoch: 46, train_loss: 1.0417, test_loss: 1.2210, test_f1: 0.4764
 epoch: 47, train_loss: 1.0506, test_loss: 1.2125, test_f1: 0.4804
 epoch: 48, train_loss: 1.0452, test_loss: 1.2184, test_f1: 0.5008
 epoch: 49, train_loss: 1.0375, test_loss: 1.2529, test_f1: 0.4786
 epoch: 50, train_loss: 1.0309, test_loss: 1.2920, test_f1: 0.4959
 epoch: 51, train_loss: 1.0357, test_loss: 1.2397, test_f1: 0.4855
 epoch: 52, train_loss: 1.0260, test_loss: 1.1978, test_f1: 0.4924
 epoch: 53, train_loss: 1.0199, test_loss: 1.2195, test_f1: 0.5058
 epoch: 54, train_loss: 1.0471, test_loss: 1.2706, test_f1: 0.4907
 epoch: 55, train_loss: 1.0215, test_loss: 1.2258, test_f1: 0.4956
 epoch: 56, train_loss: 1.0301, test_loss: 1.2210, test_f1: 0.4999
 epoch: 57, train_loss: 1.0162, test_loss: 1.2127, test_f1: 0.4957
 epoch: 58, train_loss: 1.0220, test_loss: 1.2383, test_f1: 0.5245
 epoch: 59, train_loss: 1.0242, test_loss: 1.2197, test_f1: 0.5105
 epoch: 60, train_loss: 1.0233, test_loss: 1.2417, test_f1: 0.5289
 epoch: 61, train_loss: 1.0148, test_loss: 1.2252, test_f1: 0.5362
 epoch: 62, train_loss: 1.0125, test_loss: 1.2496, test_f1: 0.5196
 epoch: 63, train_loss: 1.0131, test_loss: 1.2466, test_f1: 0.5223
 epoch: 64, train_loss: 1.0226, test_loss: 1.3089, test_f1: 0.5275
 epoch: 65, train_loss: 1.0111, test_loss: 1.2130, test_f1: 0.5434
 epoch: 66, train_loss: 0.9990, test_loss: 1.2162, test_f1: 0.5319
 epoch: 67, train_loss: 1.0033, test_loss: 1.2235, test_f1: 0.5444
 epoch: 68, train_loss: 1.0019, test_loss: 1.2358, test_f1: 0.5320
 epoch: 69, train_loss: 1.0010, test_loss: 1.2502, test_f1: 0.5358
 epoch: 70, train_loss: 1.0079, test_loss: 1.2010, test_f1: 0.5423
 epoch: 71, train_loss: 0.9987, test_loss: 1.2662, test_f1: 0.5493
 epoch: 72, train_loss: 0.9984, test_loss: 1.2725, test_f1: 0.5515
 epoch: 73, train_loss: 0.9996, test_loss: 1.2822, test_f1: 0.5302
 epoch: 74, train_loss: 1.0153, test_loss: 1.2255, test_f1: 0.5548
 epoch: 75, train_loss: 1.0146, test_loss: 1.2846, test_f1: 0.5338
 epoch: 76, train_loss: 0.9944, test_loss: 1.2206, test_f1: 0.5417
 epoch: 77, train_loss: 0.9950, test_loss: 1.2593, test_f1: 0.5372
 epoch: 78, train_loss: 0.9901, test_loss: 1.3119, test_f1: 0.5381
 epoch: 79, train_loss: 1.0052, test_loss: 1.2589, test_f1: 0.5375
 epoch: 80, train_loss: 0.9957, test_loss: 1.2976, test_f1: 0.5317
 epoch: 81, train_loss: 0.9942, test_loss: 1.2694, test_f1: 0.5453
 epoch: 82, train_loss: 0.9959, test_loss: 1.2510, test_f1: 0.5531
 epoch: 83, train_loss: 0.9776, test_loss: 1.2306, test_f1: 0.5468
 epoch: 84, train_loss: 0.9824, test_loss: 1.2459, test_f1: 0.5428
 epoch: 85, train_loss: 0.9780, test_loss: 1.2355, test_f1: 0.5411
 epoch: 86, train_loss: 0.9772, test_loss: 1.3127, test_f1: 0.5524
 epoch: 87, train_loss: 0.9809, test_loss: 1.2929, test_f1: 0.5364
 epoch: 88, train_loss: 0.9721, test_loss: 1.2728, test_f1: 0.5389
 epoch: 89, train_loss: 0.9747, test_loss: 1.2564, test_f1: 0.5188
 epoch: 90, train_loss: 0.9757, test_loss: 1.2683, test_f1: 0.5501
 epoch: 91, train_loss: 0.9704, test_loss: 1.2536, test_f1: 0.5379
 epoch: 92, train_loss: 0.9613, test_loss: 1.2476, test_f1: 0.5423
 epoch: 93, train_loss: 0.9644, test_loss: 1.2940, test_f1: 0.5296
 epoch: 94, train_loss: 0.9669, test_loss: 1.2878, test_f1: 0.5583
 epoch: 95, train_loss: 0.9625, test_loss: 1.2396, test_f1: 0.5598
 epoch: 96, train_loss: 0.9643, test_loss: 1.2804, test_f1: 0.5506
 epoch: 97, train_loss: 0.9830, test_loss: 1.2703, test_f1: 0.5605
 epoch: 98, train_loss: 0.9638, test_loss: 1.2583, test_f1: 0.5548
 epoch: 99, train_loss: 0.9615, test_loss: 1.2839, test_f1: 0.5479
##################ITERATION #3 ****************************************
 epoch: 0, train_loss: 1.2809, test_loss: 1.3062, test_f1: 0.2337
 epoch: 1, train_loss: 1.2551, test_loss: 1.3006, test_f1: 0.2216
 epoch: 2, train_loss: 1.2469, test_loss: 1.2844, test_f1: 0.2238
 epoch: 3, train_loss: 1.2300, test_loss: 1.2852, test_f1: 0.2690
 epoch: 4, train_loss: 1.2281, test_loss: 1.2796, test_f1: 0.2618
 epoch: 5, train_loss: 1.2164, test_loss: 1.2799, test_f1: 0.2575
 epoch: 6, train_loss: 1.2146, test_loss: 1.2810, test_f1: 0.2575
 epoch: 7, train_loss: 1.2038, test_loss: 1.2599, test_f1: 0.2468
 epoch: 8, train_loss: 1.2064, test_loss: 1.2547, test_f1: 0.2751
 epoch: 9, train_loss: 1.1938, test_loss: 1.2588, test_f1: 0.2707
 epoch: 10, train_loss: 1.1918, test_loss: 1.2495, test_f1: 0.2571
 epoch: 11, train_loss: 1.1791, test_loss: 1.2474, test_f1: 0.2604
 epoch: 12, train_loss: 1.1814, test_loss: 1.2410, test_f1: 0.2920
 epoch: 13, train_loss: 1.1702, test_loss: 1.2403, test_f1: 0.3103
 epoch: 14, train_loss: 1.1688, test_loss: 1.2360, test_f1: 0.3152
 epoch: 15, train_loss: 1.1733, test_loss: 1.2344, test_f1: 0.3224
 epoch: 16, train_loss: 1.1462, test_loss: 1.2283, test_f1: 0.3366
 epoch: 17, train_loss: 1.1531, test_loss: 1.2290, test_f1: 0.3605
 epoch: 18, train_loss: 1.1469, test_loss: 1.2248, test_f1: 0.3708
 epoch: 19, train_loss: 1.1452, test_loss: 1.2156, test_f1: 0.3722
 epoch: 20, train_loss: 1.1367, test_loss: 1.2171, test_f1: 0.3842
 epoch: 21, train_loss: 1.1349, test_loss: 1.2102, test_f1: 0.3892
 epoch: 22, train_loss: 1.1336, test_loss: 1.2168, test_f1: 0.3827
 epoch: 23, train_loss: 1.1218, test_loss: 1.2179, test_f1: 0.3896
 epoch: 24, train_loss: 1.1169, test_loss: 1.2063, test_f1: 0.4063
 epoch: 25, train_loss: 1.1121, test_loss: 1.1997, test_f1: 0.4018
 epoch: 26, train_loss: 1.1068, test_loss: 1.2102, test_f1: 0.4199
 epoch: 27, train_loss: 1.1014, test_loss: 1.1985, test_f1: 0.4149
 epoch: 28, train_loss: 1.1061, test_loss: 1.1961, test_f1: 0.4131
 epoch: 29, train_loss: 1.1080, test_loss: 1.1943, test_f1: 0.4475
 epoch: 30, train_loss: 1.0942, test_loss: 1.1957, test_f1: 0.4286
 epoch: 31, train_loss: 1.0910, test_loss: 1.1907, test_f1: 0.4349
 epoch: 32, train_loss: 1.1045, test_loss: 1.1914, test_f1: 0.4195
 epoch: 33, train_loss: 1.0850, test_loss: 1.1873, test_f1: 0.4328
 epoch: 34, train_loss: 1.0865, test_loss: 1.1890, test_f1: 0.4557
 epoch: 35, train_loss: 1.0782, test_loss: 1.1880, test_f1: 0.4471
 epoch: 36, train_loss: 1.0774, test_loss: 1.1740, test_f1: 0.4383
 epoch: 37, train_loss: 1.0661, test_loss: 1.1710, test_f1: 0.4649
 epoch: 38, train_loss: 1.0626, test_loss: 1.1742, test_f1: 0.4799
 epoch: 39, train_loss: 1.0653, test_loss: 1.1767, test_f1: 0.4620
 epoch: 40, train_loss: 1.0753, test_loss: 1.1731, test_f1: 0.4941
 epoch: 41, train_loss: 1.0501, test_loss: 1.1726, test_f1: 0.5014
 epoch: 42, train_loss: 1.0563, test_loss: 1.1702, test_f1: 0.5325
 epoch: 43, train_loss: 1.0493, test_loss: 1.1631, test_f1: 0.5347
 epoch: 44, train_loss: 1.0449, test_loss: 1.1706, test_f1: 0.5242
 epoch: 45, train_loss: 1.0398, test_loss: 1.1673, test_f1: 0.5444
 epoch: 46, train_loss: 1.0285, test_loss: 1.1681, test_f1: 0.5563
 epoch: 47, train_loss: 1.0418, test_loss: 1.1546, test_f1: 0.5494
 epoch: 48, train_loss: 1.0408, test_loss: 1.1570, test_f1: 0.5564
 epoch: 49, train_loss: 1.0393, test_loss: 1.1685, test_f1: 0.5300
 epoch: 50, train_loss: 1.0379, test_loss: 1.1570, test_f1: 0.5536
 epoch: 51, train_loss: 1.0342, test_loss: 1.1594, test_f1: 0.5600
 epoch: 52, train_loss: 1.0193, test_loss: 1.1654, test_f1: 0.5443
 epoch: 53, train_loss: 1.0148, test_loss: 1.1601, test_f1: 0.5592
 epoch: 54, train_loss: 1.0247, test_loss: 1.1575, test_f1: 0.5584
 epoch: 55, train_loss: 1.0337, test_loss: 1.1569, test_f1: 0.5639
 epoch: 56, train_loss: 1.0254, test_loss: 1.1573, test_f1: 0.5675
 epoch: 57, train_loss: 1.0361, test_loss: 1.1473, test_f1: 0.5710
 epoch: 58, train_loss: 1.0250, test_loss: 1.1546, test_f1: 0.5557
 epoch: 59, train_loss: 1.0110, test_loss: 1.1572, test_f1: 0.5715
 epoch: 60, train_loss: 1.0247, test_loss: 1.1572, test_f1: 0.5768
 epoch: 61, train_loss: 1.0206, test_loss: 1.1571, test_f1: 0.5573
 epoch: 62, train_loss: 1.0089, test_loss: 1.1509, test_f1: 0.5619
 epoch: 63, train_loss: 1.0227, test_loss: 1.1528, test_f1: 0.5594
 epoch: 64, train_loss: 1.0141, test_loss: 1.1519, test_f1: 0.5684
 epoch: 65, train_loss: 1.0100, test_loss: 1.1539, test_f1: 0.5676
 epoch: 66, train_loss: 1.0072, test_loss: 1.1532, test_f1: 0.5626
 epoch: 67, train_loss: 1.0029, test_loss: 1.1536, test_f1: 0.5596
 epoch: 68, train_loss: 1.0141, test_loss: 1.1573, test_f1: 0.5798
 epoch: 69, train_loss: 1.0124, test_loss: 1.1619, test_f1: 0.5602
 epoch: 70, train_loss: 1.0042, test_loss: 1.1566, test_f1: 0.5544
 epoch: 71, train_loss: 1.0207, test_loss: 1.1535, test_f1: 0.5829
 epoch: 72, train_loss: 1.0093, test_loss: 1.1562, test_f1: 0.5735
 epoch: 73, train_loss: 1.0054, test_loss: 1.1666, test_f1: 0.5545
 epoch: 74, train_loss: 1.0026, test_loss: 1.1566, test_f1: 0.5625
 epoch: 75, train_loss: 0.9862, test_loss: 1.1567, test_f1: 0.5700
 epoch: 76, train_loss: 0.9949, test_loss: 1.1507, test_f1: 0.5840
 epoch: 77, train_loss: 0.9860, test_loss: 1.1550, test_f1: 0.5597
 epoch: 78, train_loss: 1.0013, test_loss: 1.1558, test_f1: 0.5714
 epoch: 79, train_loss: 0.9882, test_loss: 1.1525, test_f1: 0.5857
 epoch: 80, train_loss: 0.9767, test_loss: 1.1618, test_f1: 0.5672
 epoch: 81, train_loss: 0.9937, test_loss: 1.1630, test_f1: 0.5757
 epoch: 82, train_loss: 0.9939, test_loss: 1.1498, test_f1: 0.5660
 epoch: 83, train_loss: 0.9868, test_loss: 1.1536, test_f1: 0.5635
 epoch: 84, train_loss: 1.0032, test_loss: 1.1655, test_f1: 0.5538
 epoch: 85, train_loss: 0.9975, test_loss: 1.1589, test_f1: 0.5660
 epoch: 86, train_loss: 0.9835, test_loss: 1.1685, test_f1: 0.5431
 epoch: 87, train_loss: 0.9697, test_loss: 1.1557, test_f1: 0.5752
 epoch: 88, train_loss: 0.9869, test_loss: 1.1589, test_f1: 0.5683
 epoch: 89, train_loss: 0.9639, test_loss: 1.1643, test_f1: 0.5683
 epoch: 90, train_loss: 0.9872, test_loss: 1.1528, test_f1: 0.5704
 epoch: 91, train_loss: 0.9804, test_loss: 1.1616, test_f1: 0.5655
 epoch: 92, train_loss: 0.9782, test_loss: 1.1588, test_f1: 0.5702
 epoch: 93, train_loss: 0.9755, test_loss: 1.1679, test_f1: 0.5568
 epoch: 94, train_loss: 0.9760, test_loss: 1.1659, test_f1: 0.5702
 epoch: 95, train_loss: 0.9707, test_loss: 1.1610, test_f1: 0.5614
 epoch: 96, train_loss: 0.9772, test_loss: 1.1662, test_f1: 0.5722
 epoch: 97, train_loss: 0.9752, test_loss: 1.1568, test_f1: 0.5843
 epoch: 98, train_loss: 0.9651, test_loss: 1.1578, test_f1: 0.5696
 epoch: 99, train_loss: 0.9753, test_loss: 1.1666, test_f1: 0.5593
##################ITERATION #4 ****************************************
 epoch: 0, train_loss: 1.2852, test_loss: 1.3341, test_f1: 0.2281
 epoch: 1, train_loss: 1.2612, test_loss: 1.5202, test_f1: 0.2285
 epoch: 2, train_loss: 1.2439, test_loss: 1.3945, test_f1: 0.2640
 epoch: 3, train_loss: 1.2278, test_loss: 1.4154, test_f1: 0.2533
 epoch: 4, train_loss: 1.2271, test_loss: 1.4833, test_f1: 0.2458
 epoch: 5, train_loss: 1.2252, test_loss: 1.4208, test_f1: 0.2601
 epoch: 6, train_loss: 1.2094, test_loss: 1.3560, test_f1: 0.2632
 epoch: 7, train_loss: 1.2057, test_loss: 1.5255, test_f1: 0.2957
 epoch: 8, train_loss: 1.2074, test_loss: 1.3508, test_f1: 0.2995
 epoch: 9, train_loss: 1.1925, test_loss: 1.3970, test_f1: 0.2963
 epoch: 10, train_loss: 1.1854, test_loss: 1.3856, test_f1: 0.2954
 epoch: 11, train_loss: 1.1843, test_loss: 1.5549, test_f1: 0.3217
 epoch: 12, train_loss: 1.1728, test_loss: 1.4058, test_f1: 0.3115
 epoch: 13, train_loss: 1.1707, test_loss: 1.3674, test_f1: 0.3635
 epoch: 14, train_loss: 1.1686, test_loss: 1.4544, test_f1: 0.3534
 epoch: 15, train_loss: 1.1519, test_loss: 1.4366, test_f1: 0.3764
 epoch: 16, train_loss: 1.1571, test_loss: 1.4136, test_f1: 0.3919
 epoch: 17, train_loss: 1.1435, test_loss: 1.2973, test_f1: 0.4036
 epoch: 18, train_loss: 1.1390, test_loss: 1.3502, test_f1: 0.4115
 epoch: 19, train_loss: 1.1338, test_loss: 1.4188, test_f1: 0.4112
 epoch: 20, train_loss: 1.1379, test_loss: 1.3264, test_f1: 0.3761
 epoch: 21, train_loss: 1.1280, test_loss: 1.3497, test_f1: 0.4041
 epoch: 22, train_loss: 1.1167, test_loss: 1.3377, test_f1: 0.4042
 epoch: 23, train_loss: 1.1191, test_loss: 1.3516, test_f1: 0.4038
 epoch: 24, train_loss: 1.1089, test_loss: 1.3957, test_f1: 0.4034
 epoch: 25, train_loss: 1.0958, test_loss: 1.2852, test_f1: 0.4224
 epoch: 26, train_loss: 1.0847, test_loss: 1.2624, test_f1: 0.4105
 epoch: 27, train_loss: 1.0919, test_loss: 1.2840, test_f1: 0.4287
 epoch: 28, train_loss: 1.0854, test_loss: 1.4163, test_f1: 0.4259
 epoch: 29, train_loss: 1.0740, test_loss: 1.4096, test_f1: 0.4477
 epoch: 30, train_loss: 1.0842, test_loss: 1.3103, test_f1: 0.4492
 epoch: 31, train_loss: 1.0747, test_loss: 1.3377, test_f1: 0.4439
 epoch: 32, train_loss: 1.0526, test_loss: 1.2790, test_f1: 0.4678
 epoch: 33, train_loss: 1.0707, test_loss: 1.3444, test_f1: 0.4589
 epoch: 34, train_loss: 1.0528, test_loss: 1.2858, test_f1: 0.4775
 epoch: 35, train_loss: 1.0569, test_loss: 1.3399, test_f1: 0.4743
 epoch: 36, train_loss: 1.0402, test_loss: 1.3291, test_f1: 0.4689
 epoch: 37, train_loss: 1.0424, test_loss: 1.2902, test_f1: 0.4805
 epoch: 38, train_loss: 1.0443, test_loss: 1.2796, test_f1: 0.4996
 epoch: 39, train_loss: 1.0248, test_loss: 1.2868, test_f1: 0.4975
 epoch: 40, train_loss: 1.0377, test_loss: 1.3958, test_f1: 0.4991
 epoch: 41, train_loss: 1.0338, test_loss: 1.2867, test_f1: 0.4792
 epoch: 42, train_loss: 1.0284, test_loss: 1.2995, test_f1: 0.5035
 epoch: 43, train_loss: 1.0213, test_loss: 1.2923, test_f1: 0.4878
 epoch: 44, train_loss: 1.0223, test_loss: 1.2933, test_f1: 0.5150
 epoch: 45, train_loss: 1.0210, test_loss: 1.2979, test_f1: 0.5089
 epoch: 46, train_loss: 1.0167, test_loss: 1.3013, test_f1: 0.5025
 epoch: 47, train_loss: 1.0027, test_loss: 1.3022, test_f1: 0.5089
 epoch: 48, train_loss: 1.0110, test_loss: 1.3131, test_f1: 0.5068
 epoch: 49, train_loss: 1.0062, test_loss: 1.3652, test_f1: 0.5054
 epoch: 50, train_loss: 0.9983, test_loss: 1.3707, test_f1: 0.5148
 epoch: 51, train_loss: 1.0035, test_loss: 1.3564, test_f1: 0.5290
 epoch: 52, train_loss: 0.9879, test_loss: 1.2925, test_f1: 0.5123
 epoch: 53, train_loss: 1.0020, test_loss: 1.3618, test_f1: 0.5294
 epoch: 54, train_loss: 0.9920, test_loss: 1.3049, test_f1: 0.5242
 epoch: 55, train_loss: 0.9835, test_loss: 1.3510, test_f1: 0.5215
 epoch: 56, train_loss: 0.9730, test_loss: 1.3909, test_f1: 0.5183
 epoch: 57, train_loss: 0.9915, test_loss: 1.4191, test_f1: 0.5158
 epoch: 58, train_loss: 0.9900, test_loss: 1.3093, test_f1: 0.5252
 epoch: 59, train_loss: 0.9918, test_loss: 1.4474, test_f1: 0.5218
 epoch: 60, train_loss: 0.9703, test_loss: 1.3164, test_f1: 0.5428
 epoch: 61, train_loss: 0.9820, test_loss: 1.3639, test_f1: 0.5337
 epoch: 62, train_loss: 0.9720, test_loss: 1.4382, test_f1: 0.5245
 epoch: 63, train_loss: 0.9734, test_loss: 1.3736, test_f1: 0.5131
 epoch: 64, train_loss: 0.9763, test_loss: 1.3768, test_f1: 0.5277
 epoch: 65, train_loss: 0.9712, test_loss: 1.4005, test_f1: 0.5304
 epoch: 66, train_loss: 0.9854, test_loss: 1.3732, test_f1: 0.5236
 epoch: 67, train_loss: 0.9745, test_loss: 1.3638, test_f1: 0.5227
 epoch: 68, train_loss: 0.9661, test_loss: 1.3391, test_f1: 0.5140
 epoch: 69, train_loss: 0.9748, test_loss: 1.3542, test_f1: 0.5138
 epoch: 70, train_loss: 0.9709, test_loss: 1.3713, test_f1: 0.5206
 epoch: 71, train_loss: 0.9639, test_loss: 1.3921, test_f1: 0.5182
 epoch: 72, train_loss: 0.9621, test_loss: 1.3232, test_f1: 0.5110
 epoch: 73, train_loss: 0.9698, test_loss: 1.3853, test_f1: 0.5300
 epoch: 74, train_loss: 0.9649, test_loss: 1.3671, test_f1: 0.5134
 epoch: 75, train_loss: 0.9489, test_loss: 1.3813, test_f1: 0.5164
 epoch: 76, train_loss: 0.9657, test_loss: 1.3524, test_f1: 0.5193
 epoch: 77, train_loss: 0.9614, test_loss: 1.3836, test_f1: 0.5145
 epoch: 78, train_loss: 0.9389, test_loss: 1.3764, test_f1: 0.5211
 epoch: 79, train_loss: 0.9607, test_loss: 1.4531, test_f1: 0.5132
 epoch: 80, train_loss: 0.9442, test_loss: 1.5613, test_f1: 0.5125
 epoch: 81, train_loss: 0.9422, test_loss: 1.3816, test_f1: 0.5215
 epoch: 82, train_loss: 0.9518, test_loss: 1.4350, test_f1: 0.5367
 epoch: 83, train_loss: 0.9389, test_loss: 1.3875, test_f1: 0.5007
 epoch: 84, train_loss: 0.9520, test_loss: 1.4426, test_f1: 0.5091
 epoch: 85, train_loss: 0.9493, test_loss: 1.3644, test_f1: 0.5087
 epoch: 86, train_loss: 0.9579, test_loss: 1.4588, test_f1: 0.5325
 epoch: 87, train_loss: 0.9385, test_loss: 1.4482, test_f1: 0.5113
 epoch: 88, train_loss: 0.9315, test_loss: 1.4924, test_f1: 0.5260
 epoch: 89, train_loss: 0.9316, test_loss: 1.3421, test_f1: 0.5167
 epoch: 90, train_loss: 0.9465, test_loss: 1.3942, test_f1: 0.5076
 epoch: 91, train_loss: 0.9478, test_loss: 1.3777, test_f1: 0.5123
 epoch: 92, train_loss: 0.9273, test_loss: 1.4478, test_f1: 0.5211
 epoch: 93, train_loss: 0.9428, test_loss: 1.3412, test_f1: 0.5245
 epoch: 94, train_loss: 0.9274, test_loss: 1.4125, test_f1: 0.5093
 epoch: 95, train_loss: 0.9347, test_loss: 1.4130, test_f1: 0.5136
 epoch: 96, train_loss: 0.9370, test_loss: 1.3741, test_f1: 0.5164
 epoch: 97, train_loss: 0.9112, test_loss: 1.3846, test_f1: 0.5052
 epoch: 98, train_loss: 0.9404, test_loss: 1.3985, test_f1: 0.5168
 epoch: 99, train_loss: 0.9295, test_loss: 1.4232, test_f1: 0.5206
##################ITERATION #5 ****************************************
 epoch: 0, train_loss: 1.2772, test_loss: 1.3597, test_f1: 0.2357
 epoch: 1, train_loss: 1.2519, test_loss: 1.3510, test_f1: 0.2701
 epoch: 2, train_loss: 1.2425, test_loss: 1.3955, test_f1: 0.3145
 epoch: 3, train_loss: 1.2234, test_loss: 1.3513, test_f1: 0.3248
 epoch: 4, train_loss: 1.2182, test_loss: 1.3461, test_f1: 0.3302
 epoch: 5, train_loss: 1.2073, test_loss: 1.3496, test_f1: 0.3870
 epoch: 6, train_loss: 1.2009, test_loss: 1.3151, test_f1: 0.3667
 epoch: 7, train_loss: 1.1852, test_loss: 1.3241, test_f1: 0.3852
 epoch: 8, train_loss: 1.1870, test_loss: 1.3067, test_f1: 0.3913
 epoch: 9, train_loss: 1.1719, test_loss: 1.3073, test_f1: 0.4164
 epoch: 10, train_loss: 1.1635, test_loss: 1.2919, test_f1: 0.4068
 epoch: 11, train_loss: 1.1573, test_loss: 1.2936, test_f1: 0.4376
 epoch: 12, train_loss: 1.1556, test_loss: 1.2793, test_f1: 0.4339
 epoch: 13, train_loss: 1.1379, test_loss: 1.3023, test_f1: 0.4564
 epoch: 14, train_loss: 1.1410, test_loss: 1.2797, test_f1: 0.4445
 epoch: 15, train_loss: 1.1210, test_loss: 1.2692, test_f1: 0.4214
 epoch: 16, train_loss: 1.1340, test_loss: 1.2507, test_f1: 0.4336
 epoch: 17, train_loss: 1.1224, test_loss: 1.2712, test_f1: 0.4481
 epoch: 18, train_loss: 1.1270, test_loss: 1.2479, test_f1: 0.4467
 epoch: 19, train_loss: 1.1071, test_loss: 1.2304, test_f1: 0.4473
 epoch: 20, train_loss: 1.1067, test_loss: 1.2371, test_f1: 0.4609
 epoch: 21, train_loss: 1.1136, test_loss: 1.2269, test_f1: 0.4541
 epoch: 22, train_loss: 1.1000, test_loss: 1.2308, test_f1: 0.4480
 epoch: 23, train_loss: 1.0897, test_loss: 1.2246, test_f1: 0.4513
 epoch: 24, train_loss: 1.0861, test_loss: 1.2327, test_f1: 0.4603
 epoch: 25, train_loss: 1.0832, test_loss: 1.2485, test_f1: 0.4518
 epoch: 26, train_loss: 1.0775, test_loss: 1.2328, test_f1: 0.4578
 epoch: 27, train_loss: 1.0790, test_loss: 1.2457, test_f1: 0.4685
 epoch: 28, train_loss: 1.0622, test_loss: 1.2316, test_f1: 0.4840
 epoch: 29, train_loss: 1.0667, test_loss: 1.2276, test_f1: 0.4644
 epoch: 30, train_loss: 1.0585, test_loss: 1.2175, test_f1: 0.4711
 epoch: 31, train_loss: 1.0584, test_loss: 1.2008, test_f1: 0.4776
 epoch: 32, train_loss: 1.0614, test_loss: 1.2291, test_f1: 0.4879
 epoch: 33, train_loss: 1.0626, test_loss: 1.2257, test_f1: 0.4749
 epoch: 34, train_loss: 1.0565, test_loss: 1.2074, test_f1: 0.4765
 epoch: 35, train_loss: 1.0367, test_loss: 1.2204, test_f1: 0.4803
 epoch: 36, train_loss: 1.0410, test_loss: 1.2226, test_f1: 0.4993
 epoch: 37, train_loss: 1.0434, test_loss: 1.2247, test_f1: 0.4844
 epoch: 38, train_loss: 1.0326, test_loss: 1.2214, test_f1: 0.4947
 epoch: 39, train_loss: 1.0464, test_loss: 1.2186, test_f1: 0.4952
 epoch: 40, train_loss: 1.0303, test_loss: 1.2064, test_f1: 0.4981
 epoch: 41, train_loss: 1.0496, test_loss: 1.2135, test_f1: 0.5075
 epoch: 42, train_loss: 1.0324, test_loss: 1.1885, test_f1: 0.5092
 epoch: 43, train_loss: 1.0396, test_loss: 1.1997, test_f1: 0.5215
 epoch: 44, train_loss: 1.0079, test_loss: 1.2120, test_f1: 0.5120
 epoch: 45, train_loss: 1.0231, test_loss: 1.1920, test_f1: 0.5179
 epoch: 46, train_loss: 1.0081, test_loss: 1.2035, test_f1: 0.5174
 epoch: 47, train_loss: 1.0159, test_loss: 1.1978, test_f1: 0.5435
 epoch: 48, train_loss: 1.0283, test_loss: 1.2131, test_f1: 0.5459
 epoch: 49, train_loss: 1.0172, test_loss: 1.2043, test_f1: 0.5395
 epoch: 50, train_loss: 0.9926, test_loss: 1.2199, test_f1: 0.5337
 epoch: 51, train_loss: 1.0059, test_loss: 1.2078, test_f1: 0.5352
 epoch: 52, train_loss: 1.0000, test_loss: 1.2033, test_f1: 0.5409
 epoch: 53, train_loss: 1.0020, test_loss: 1.2071, test_f1: 0.5402
 epoch: 54, train_loss: 0.9927, test_loss: 1.2159, test_f1: 0.5467
 epoch: 55, train_loss: 0.9993, test_loss: 1.2335, test_f1: 0.5428
 epoch: 56, train_loss: 0.9927, test_loss: 1.2365, test_f1: 0.5425
 epoch: 57, train_loss: 0.9995, test_loss: 1.1972, test_f1: 0.5342
 epoch: 58, train_loss: 0.9851, test_loss: 1.2133, test_f1: 0.5377
 epoch: 59, train_loss: 0.9987, test_loss: 1.2096, test_f1: 0.5428
 epoch: 60, train_loss: 0.9843, test_loss: 1.2251, test_f1: 0.5399
 epoch: 61, train_loss: 0.9813, test_loss: 1.2204, test_f1: 0.5424
 epoch: 62, train_loss: 0.9971, test_loss: 1.2356, test_f1: 0.5434
 epoch: 63, train_loss: 0.9868, test_loss: 1.1950, test_f1: 0.5427
 epoch: 64, train_loss: 0.9859, test_loss: 1.1962, test_f1: 0.5490
 epoch: 65, train_loss: 0.9792, test_loss: 1.2238, test_f1: 0.5465
 epoch: 66, train_loss: 0.9894, test_loss: 1.2314, test_f1: 0.5336
 epoch: 67, train_loss: 0.9785, test_loss: 1.2129, test_f1: 0.5441
 epoch: 68, train_loss: 0.9904, test_loss: 1.2102, test_f1: 0.5447
 epoch: 69, train_loss: 0.9723, test_loss: 1.2252, test_f1: 0.5515
 epoch: 70, train_loss: 0.9804, test_loss: 1.2204, test_f1: 0.5524
 epoch: 71, train_loss: 0.9679, test_loss: 1.2329, test_f1: 0.5399
 epoch: 72, train_loss: 0.9739, test_loss: 1.2190, test_f1: 0.5468
 epoch: 73, train_loss: 0.9694, test_loss: 1.2409, test_f1: 0.5435
 epoch: 74, train_loss: 0.9854, test_loss: 1.2295, test_f1: 0.5496
 epoch: 75, train_loss: 0.9739, test_loss: 1.2359, test_f1: 0.5534
 epoch: 76, train_loss: 0.9663, test_loss: 1.2030, test_f1: 0.5457
 epoch: 77, train_loss: 0.9662, test_loss: 1.2229, test_f1: 0.5437
 epoch: 78, train_loss: 0.9585, test_loss: 1.2436, test_f1: 0.5413
 epoch: 79, train_loss: 0.9540, test_loss: 1.2207, test_f1: 0.5454
 epoch: 80, train_loss: 0.9597, test_loss: 1.2299, test_f1: 0.5444
 epoch: 81, train_loss: 0.9607, test_loss: 1.5607, test_f1: 0.5450
 epoch: 82, train_loss: 0.9639, test_loss: 1.5233, test_f1: 0.5336
 epoch: 83, train_loss: 0.9552, test_loss: 1.2725, test_f1: 0.5515
 epoch: 84, train_loss: 0.9572, test_loss: 1.3227, test_f1: 0.5497
 epoch: 85, train_loss: 0.9620, test_loss: 1.2305, test_f1: 0.5504
 epoch: 86, train_loss: 0.9489, test_loss: 1.2436, test_f1: 0.5503
 epoch: 87, train_loss: 0.9571, test_loss: 1.2522, test_f1: 0.5490
 epoch: 88, train_loss: 0.9341, test_loss: 1.2284, test_f1: 0.5540
 epoch: 89, train_loss: 0.9481, test_loss: 1.2437, test_f1: 0.5481
 epoch: 90, train_loss: 0.9558, test_loss: 1.2476, test_f1: 0.5548
 epoch: 91, train_loss: 0.9263, test_loss: 1.2415, test_f1: 0.5502
 epoch: 92, train_loss: 0.9565, test_loss: 1.2607, test_f1: 0.5520
 epoch: 93, train_loss: 0.9404, test_loss: 1.2496, test_f1: 0.5552
 epoch: 94, train_loss: 0.9497, test_loss: 1.2437, test_f1: 0.5568
 epoch: 95, train_loss: 0.9596, test_loss: 1.2346, test_f1: 0.5626
 epoch: 96, train_loss: 0.9453, test_loss: 1.2529, test_f1: 0.5546
 epoch: 97, train_loss: 0.9559, test_loss: 1.2487, test_f1: 0.5652
 epoch: 98, train_loss: 0.9267, test_loss: 1.2518, test_f1: 0.5496
 epoch: 99, train_loss: 0.9597, test_loss: 1.2581, test_f1: 0.5539
##################ITERATION #6 ****************************************
 epoch: 0, train_loss: 1.2992, test_loss: 1.3290, test_f1: 0.2528
 epoch: 1, train_loss: 1.2691, test_loss: 1.3380, test_f1: 0.2551
 epoch: 2, train_loss: 1.2504, test_loss: 1.3250, test_f1: 0.2872
 epoch: 3, train_loss: 1.2461, test_loss: 1.3148, test_f1: 0.2722
 epoch: 4, train_loss: 1.2324, test_loss: 1.3220, test_f1: 0.2659
 epoch: 5, train_loss: 1.2363, test_loss: 1.3349, test_f1: 0.2888
 epoch: 6, train_loss: 1.2143, test_loss: 1.3300, test_f1: 0.2990
 epoch: 7, train_loss: 1.2085, test_loss: 1.3223, test_f1: 0.3041
 epoch: 8, train_loss: 1.1930, test_loss: 1.3187, test_f1: 0.3134
 epoch: 9, train_loss: 1.1971, test_loss: 1.2998, test_f1: 0.2928
 epoch: 10, train_loss: 1.1881, test_loss: 1.2852, test_f1: 0.2991
 epoch: 11, train_loss: 1.1893, test_loss: 1.3019, test_f1: 0.2901
 epoch: 12, train_loss: 1.1750, test_loss: 1.2902, test_f1: 0.3423
 epoch: 13, train_loss: 1.1797, test_loss: 1.2910, test_f1: 0.3649
 epoch: 14, train_loss: 1.1766, test_loss: 1.2485, test_f1: 0.3547
 epoch: 15, train_loss: 1.1743, test_loss: 1.2570, test_f1: 0.3568
 epoch: 16, train_loss: 1.1627, test_loss: 1.2563, test_f1: 0.3251
 epoch: 17, train_loss: 1.1473, test_loss: 1.2566, test_f1: 0.3651
 epoch: 18, train_loss: 1.1468, test_loss: 1.2372, test_f1: 0.3721
 epoch: 19, train_loss: 1.1450, test_loss: 1.2346, test_f1: 0.3781
 epoch: 20, train_loss: 1.1298, test_loss: 1.2297, test_f1: 0.3874
 epoch: 21, train_loss: 1.1392, test_loss: 1.2400, test_f1: 0.3808
 epoch: 22, train_loss: 1.1199, test_loss: 1.2392, test_f1: 0.3949
 epoch: 23, train_loss: 1.1228, test_loss: 1.2315, test_f1: 0.3945
 epoch: 24, train_loss: 1.1121, test_loss: 1.2380, test_f1: 0.3870
 epoch: 25, train_loss: 1.1140, test_loss: 1.2369, test_f1: 0.4131
 epoch: 26, train_loss: 1.1165, test_loss: 1.2524, test_f1: 0.4275
 epoch: 27, train_loss: 1.1045, test_loss: 1.2579, test_f1: 0.4254
 epoch: 28, train_loss: 1.1099, test_loss: 1.2361, test_f1: 0.4235
 epoch: 29, train_loss: 1.0899, test_loss: 1.2316, test_f1: 0.4225
 epoch: 30, train_loss: 1.0845, test_loss: 1.2441, test_f1: 0.4273
 epoch: 31, train_loss: 1.0936, test_loss: 1.2292, test_f1: 0.4416
 epoch: 32, train_loss: 1.0754, test_loss: 1.2209, test_f1: 0.4233
 epoch: 33, train_loss: 1.0892, test_loss: 1.2232, test_f1: 0.4384
 epoch: 34, train_loss: 1.0898, test_loss: 1.2264, test_f1: 0.4381
 epoch: 35, train_loss: 1.0806, test_loss: 1.2354, test_f1: 0.4298
 epoch: 36, train_loss: 1.0909, test_loss: 1.1946, test_f1: 0.4377
 epoch: 37, train_loss: 1.0636, test_loss: 1.2251, test_f1: 0.4504
 epoch: 38, train_loss: 1.0726, test_loss: 1.2160, test_f1: 0.4283
 epoch: 39, train_loss: 1.0548, test_loss: 1.2389, test_f1: 0.4373
 epoch: 40, train_loss: 1.0700, test_loss: 1.2462, test_f1: 0.4389
 epoch: 41, train_loss: 1.0546, test_loss: 1.2346, test_f1: 0.4529
 epoch: 42, train_loss: 1.0720, test_loss: 1.2216, test_f1: 0.4601
 epoch: 43, train_loss: 1.0506, test_loss: 1.2239, test_f1: 0.4711
 epoch: 44, train_loss: 1.0520, test_loss: 1.2647, test_f1: 0.4673
 epoch: 45, train_loss: 1.0571, test_loss: 1.2076, test_f1: 0.4681
 epoch: 46, train_loss: 1.0297, test_loss: 1.2356, test_f1: 0.4639
 epoch: 47, train_loss: 1.0457, test_loss: 1.2229, test_f1: 0.4686
 epoch: 48, train_loss: 1.0463, test_loss: 1.2103, test_f1: 0.4740
 epoch: 49, train_loss: 1.0228, test_loss: 1.2124, test_f1: 0.4631
 epoch: 50, train_loss: 1.0266, test_loss: 1.2153, test_f1: 0.4736
 epoch: 51, train_loss: 1.0284, test_loss: 1.2414, test_f1: 0.4546
 epoch: 52, train_loss: 1.0192, test_loss: 1.1969, test_f1: 0.4565
 epoch: 53, train_loss: 1.0365, test_loss: 1.2222, test_f1: 0.4588
 epoch: 54, train_loss: 1.0147, test_loss: 1.2484, test_f1: 0.4813
 epoch: 55, train_loss: 1.0269, test_loss: 1.2167, test_f1: 0.4745
 epoch: 56, train_loss: 1.0178, test_loss: 1.2175, test_f1: 0.4641
 epoch: 57, train_loss: 1.0297, test_loss: 1.2366, test_f1: 0.4717
 epoch: 58, train_loss: 1.0201, test_loss: 1.2538, test_f1: 0.4658
 epoch: 59, train_loss: 1.0052, test_loss: 1.2271, test_f1: 0.4679
 epoch: 60, train_loss: 1.0306, test_loss: 1.2375, test_f1: 0.4624
 epoch: 61, train_loss: 1.0094, test_loss: 1.1949, test_f1: 0.4681
 epoch: 62, train_loss: 1.0159, test_loss: 1.2638, test_f1: 0.4618
 epoch: 63, train_loss: 1.0127, test_loss: 1.2275, test_f1: 0.4733
 epoch: 64, train_loss: 1.0207, test_loss: 1.2136, test_f1: 0.4870
 epoch: 65, train_loss: 1.0082, test_loss: 1.2325, test_f1: 0.4639
 epoch: 66, train_loss: 1.0067, test_loss: 1.2241, test_f1: 0.4743
 epoch: 67, train_loss: 1.0078, test_loss: 1.2063, test_f1: 0.4773
 epoch: 68, train_loss: 1.0198, test_loss: 1.2120, test_f1: 0.4705
 epoch: 69, train_loss: 1.0013, test_loss: 1.2254, test_f1: 0.4691
 epoch: 70, train_loss: 1.0017, test_loss: 1.2062, test_f1: 0.4800
 epoch: 71, train_loss: 0.9931, test_loss: 1.2386, test_f1: 0.4712
 epoch: 72, train_loss: 1.0150, test_loss: 1.2179, test_f1: 0.4657
 epoch: 73, train_loss: 1.0026, test_loss: 1.2187, test_f1: 0.4689
 epoch: 74, train_loss: 0.9948, test_loss: 1.2141, test_f1: 0.4777
 epoch: 75, train_loss: 0.9971, test_loss: 1.2340, test_f1: 0.4696
 epoch: 76, train_loss: 1.0046, test_loss: 1.2328, test_f1: 0.4830
 epoch: 77, train_loss: 0.9862, test_loss: 1.2481, test_f1: 0.4863
 epoch: 78, train_loss: 1.0014, test_loss: 1.2495, test_f1: 0.4571
 epoch: 79, train_loss: 0.9993, test_loss: 1.2486, test_f1: 0.4795
 epoch: 80, train_loss: 0.9863, test_loss: 1.2528, test_f1: 0.4800
 epoch: 81, train_loss: 1.0014, test_loss: 1.2066, test_f1: 0.4885
 epoch: 82, train_loss: 0.9955, test_loss: 1.2172, test_f1: 0.4892
 epoch: 83, train_loss: 0.9880, test_loss: 1.2336, test_f1: 0.5014
 epoch: 84, train_loss: 0.9930, test_loss: 1.2246, test_f1: 0.4734
 epoch: 85, train_loss: 0.9792, test_loss: 1.2351, test_f1: 0.4985
 epoch: 86, train_loss: 0.9910, test_loss: 1.2426, test_f1: 0.5126
 epoch: 87, train_loss: 0.9859, test_loss: 1.2409, test_f1: 0.4858
 epoch: 88, train_loss: 0.9644, test_loss: 1.2306, test_f1: 0.4942
 epoch: 89, train_loss: 0.9849, test_loss: 1.2403, test_f1: 0.5041
 epoch: 90, train_loss: 0.9919, test_loss: 1.2351, test_f1: 0.5019
 epoch: 91, train_loss: 0.9905, test_loss: 1.2601, test_f1: 0.4860
 epoch: 92, train_loss: 0.9771, test_loss: 1.2434, test_f1: 0.5058
 epoch: 93, train_loss: 0.9971, test_loss: 1.2425, test_f1: 0.5010
 epoch: 94, train_loss: 0.9743, test_loss: 1.2558, test_f1: 0.5027
 epoch: 95, train_loss: 0.9693, test_loss: 1.2376, test_f1: 0.4923
 epoch: 96, train_loss: 0.9680, test_loss: 1.2605, test_f1: 0.4907
 epoch: 97, train_loss: 0.9645, test_loss: 1.2477, test_f1: 0.4994
 epoch: 98, train_loss: 0.9698, test_loss: 1.2447, test_f1: 0.4895
 epoch: 99, train_loss: 0.9799, test_loss: 1.2603, test_f1: 0.5056
##################ITERATION #7 ****************************************
 epoch: 0, train_loss: 1.2924, test_loss: 1.3098, test_f1: 0.2281
 epoch: 1, train_loss: 1.2541, test_loss: 1.2815, test_f1: 0.2736
 epoch: 2, train_loss: 1.2531, test_loss: 1.3174, test_f1: 0.2826
 epoch: 3, train_loss: 1.2488, test_loss: 1.2963, test_f1: 0.3144
 epoch: 4, train_loss: 1.2372, test_loss: 1.3171, test_f1: 0.3147
 epoch: 5, train_loss: 1.2348, test_loss: 1.3019, test_f1: 0.3309
 epoch: 6, train_loss: 1.2193, test_loss: 1.2786, test_f1: 0.3327
 epoch: 7, train_loss: 1.2110, test_loss: 1.2742, test_f1: 0.3362
 epoch: 8, train_loss: 1.2160, test_loss: 1.2670, test_f1: 0.3439
 epoch: 9, train_loss: 1.2117, test_loss: 1.2703, test_f1: 0.3590
 epoch: 10, train_loss: 1.2070, test_loss: 1.2673, test_f1: 0.3464
 epoch: 11, train_loss: 1.2015, test_loss: 1.2864, test_f1: 0.3263
 epoch: 12, train_loss: 1.1963, test_loss: 1.2953, test_f1: 0.3450
 epoch: 13, train_loss: 1.1940, test_loss: 1.2608, test_f1: 0.3640
 epoch: 14, train_loss: 1.1921, test_loss: 1.2682, test_f1: 0.3540
 epoch: 15, train_loss: 1.1810, test_loss: 1.3153, test_f1: 0.3474
 epoch: 16, train_loss: 1.1887, test_loss: 1.2512, test_f1: 0.3619
 epoch: 17, train_loss: 1.1721, test_loss: 1.2583, test_f1: 0.3629
 epoch: 18, train_loss: 1.1728, test_loss: 1.2654, test_f1: 0.3771
 epoch: 19, train_loss: 1.1721, test_loss: 1.2762, test_f1: 0.3478
 epoch: 20, train_loss: 1.1606, test_loss: 1.2935, test_f1: 0.3672
 epoch: 21, train_loss: 1.1598, test_loss: 1.2701, test_f1: 0.3638
 epoch: 22, train_loss: 1.1532, test_loss: 1.3009, test_f1: 0.3724
 epoch: 23, train_loss: 1.1706, test_loss: 1.3113, test_f1: 0.3605
 epoch: 24, train_loss: 1.1637, test_loss: 1.2749, test_f1: 0.3471
 epoch: 25, train_loss: 1.1491, test_loss: 1.3646, test_f1: 0.3820
 epoch: 26, train_loss: 1.1625, test_loss: 1.3158, test_f1: 0.3635
 epoch: 27, train_loss: 1.1620, test_loss: 1.3361, test_f1: 0.3738
 epoch: 28, train_loss: 1.1372, test_loss: 1.2785, test_f1: 0.3940
 epoch: 29, train_loss: 1.1384, test_loss: 1.3369, test_f1: 0.3681
 epoch: 30, train_loss: 1.1326, test_loss: 1.3845, test_f1: 0.3862
 epoch: 31, train_loss: 1.1312, test_loss: 1.2525, test_f1: 0.4018
 epoch: 32, train_loss: 1.1291, test_loss: 1.2556, test_f1: 0.3939
 epoch: 33, train_loss: 1.1437, test_loss: 1.2810, test_f1: 0.3988
 epoch: 34, train_loss: 1.1194, test_loss: 1.2772, test_f1: 0.3930
 epoch: 35, train_loss: 1.1287, test_loss: 1.2635, test_f1: 0.3811
 epoch: 36, train_loss: 1.1252, test_loss: 1.2943, test_f1: 0.4051
 epoch: 37, train_loss: 1.1274, test_loss: 1.2715, test_f1: 0.4123
 epoch: 38, train_loss: 1.1253, test_loss: 1.3301, test_f1: 0.4100
 epoch: 39, train_loss: 1.1224, test_loss: 1.2652, test_f1: 0.4073
 epoch: 40, train_loss: 1.1163, test_loss: 1.3049, test_f1: 0.4005
 epoch: 41, train_loss: 1.1088, test_loss: 1.3667, test_f1: 0.4105
 epoch: 42, train_loss: 1.1081, test_loss: 1.3301, test_f1: 0.4336
 epoch: 43, train_loss: 1.1034, test_loss: 1.2401, test_f1: 0.4329
 epoch: 44, train_loss: 1.1099, test_loss: 1.2525, test_f1: 0.4160
 epoch: 45, train_loss: 1.0927, test_loss: 1.3084, test_f1: 0.4065
 epoch: 46, train_loss: 1.0966, test_loss: 1.3098, test_f1: 0.3973
 epoch: 47, train_loss: 1.0977, test_loss: 1.5293, test_f1: 0.4252
 epoch: 48, train_loss: 1.0933, test_loss: 1.3119, test_f1: 0.4305
 epoch: 49, train_loss: 1.0948, test_loss: 1.2999, test_f1: 0.4238
 epoch: 50, train_loss: 1.0813, test_loss: 1.4415, test_f1: 0.3828
 epoch: 51, train_loss: 1.0746, test_loss: 1.3820, test_f1: 0.4218
 epoch: 52, train_loss: 1.0855, test_loss: 1.2944, test_f1: 0.4222
 epoch: 53, train_loss: 1.0868, test_loss: 1.4660, test_f1: 0.4325
 epoch: 54, train_loss: 1.0759, test_loss: 1.5983, test_f1: 0.4295
 epoch: 55, train_loss: 1.0804, test_loss: 1.5358, test_f1: 0.4242
 epoch: 56, train_loss: 1.0722, test_loss: 1.3248, test_f1: 0.4281
 epoch: 57, train_loss: 1.0776, test_loss: 1.3966, test_f1: 0.4327
 epoch: 58, train_loss: 1.0820, test_loss: 1.3102, test_f1: 0.3923
 epoch: 59, train_loss: 1.0621, test_loss: 1.3420, test_f1: 0.4220
 epoch: 60, train_loss: 1.0707, test_loss: 1.5141, test_f1: 0.4128
 epoch: 61, train_loss: 1.0699, test_loss: 1.4156, test_f1: 0.4133
 epoch: 62, train_loss: 1.0697, test_loss: 1.3650, test_f1: 0.4239
 epoch: 63, train_loss: 1.0540, test_loss: 1.3063, test_f1: 0.4405
 epoch: 64, train_loss: 1.0736, test_loss: 1.3815, test_f1: 0.4173
 epoch: 65, train_loss: 1.0671, test_loss: 1.7159, test_f1: 0.4153
 epoch: 66, train_loss: 1.0613, test_loss: 1.4183, test_f1: 0.3860
 epoch: 67, train_loss: 1.0703, test_loss: 1.3912, test_f1: 0.4013
 epoch: 68, train_loss: 1.0615, test_loss: 1.9333, test_f1: 0.4442
 epoch: 69, train_loss: 1.0540, test_loss: 1.4688, test_f1: 0.4036
 epoch: 70, train_loss: 1.0681, test_loss: 1.3936, test_f1: 0.4446
 epoch: 71, train_loss: 1.0695, test_loss: 1.4179, test_f1: 0.4311
 epoch: 72, train_loss: 1.0585, test_loss: 1.5389, test_f1: 0.4399
 epoch: 73, train_loss: 1.0421, test_loss: 1.4955, test_f1: 0.4188
 epoch: 74, train_loss: 1.0669, test_loss: 1.4949, test_f1: 0.4527
 epoch: 75, train_loss: 1.0466, test_loss: 1.4479, test_f1: 0.4371
 epoch: 76, train_loss: 1.0529, test_loss: 1.3189, test_f1: 0.4376
 epoch: 77, train_loss: 1.0680, test_loss: 1.3410, test_f1: 0.4361
 epoch: 78, train_loss: 1.0494, test_loss: 1.3524, test_f1: 0.4454
 epoch: 79, train_loss: 1.0573, test_loss: 1.3143, test_f1: 0.4382
 epoch: 80, train_loss: 1.0421, test_loss: 1.6616, test_f1: 0.4486
 epoch: 81, train_loss: 1.0443, test_loss: 1.3798, test_f1: 0.4570
 epoch: 82, train_loss: 1.0504, test_loss: 1.5003, test_f1: 0.4422
 epoch: 83, train_loss: 1.0560, test_loss: 1.5753, test_f1: 0.4200
 epoch: 84, train_loss: 1.0633, test_loss: 1.3449, test_f1: 0.4361
 epoch: 85, train_loss: 1.0517, test_loss: 1.4565, test_f1: 0.4351
 epoch: 86, train_loss: 1.0443, test_loss: 1.3432, test_f1: 0.4383
 epoch: 87, train_loss: 1.0404, test_loss: 1.4242, test_f1: 0.4423
 epoch: 88, train_loss: 1.0385, test_loss: 1.7591, test_f1: 0.4517
 epoch: 89, train_loss: 1.0318, test_loss: 1.4845, test_f1: 0.4581
 epoch: 90, train_loss: 1.0379, test_loss: 1.5125, test_f1: 0.4326
 epoch: 91, train_loss: 1.0458, test_loss: 1.6664, test_f1: 0.4476
 epoch: 92, train_loss: 1.0408, test_loss: 1.3834, test_f1: 0.4660
 epoch: 93, train_loss: 1.0513, test_loss: 1.4161, test_f1: 0.4418
 epoch: 94, train_loss: 1.0326, test_loss: 1.4635, test_f1: 0.4425
 epoch: 95, train_loss: 1.0321, test_loss: 1.2859, test_f1: 0.4639
 epoch: 96, train_loss: 1.0442, test_loss: 1.5256, test_f1: 0.4424
 epoch: 97, train_loss: 1.0240, test_loss: 1.4582, test_f1: 0.4396
 epoch: 98, train_loss: 1.0361, test_loss: 1.3820, test_f1: 0.4276
 epoch: 99, train_loss: 1.0255, test_loss: 1.6785, test_f1: 0.4397
##################ITERATION #8 ****************************************
 epoch: 0, train_loss: 1.2580, test_loss: 1.3027, test_f1: 0.2219
 epoch: 1, train_loss: 1.2491, test_loss: 1.3274, test_f1: 0.2683
 epoch: 2, train_loss: 1.2296, test_loss: 1.3066, test_f1: 0.2855
 epoch: 3, train_loss: 1.2247, test_loss: 1.3140, test_f1: 0.2880
 epoch: 4, train_loss: 1.2059, test_loss: 1.3110, test_f1: 0.2964
 epoch: 5, train_loss: 1.1972, test_loss: 1.3038, test_f1: 0.3041
 epoch: 6, train_loss: 1.1973, test_loss: 1.2995, test_f1: 0.3135
 epoch: 7, train_loss: 1.1748, test_loss: 1.2752, test_f1: 0.3715
 epoch: 8, train_loss: 1.1875, test_loss: 1.2664, test_f1: 0.3889
 epoch: 9, train_loss: 1.1743, test_loss: 1.2458, test_f1: 0.3671
 epoch: 10, train_loss: 1.1688, test_loss: 1.2390, test_f1: 0.4019
 epoch: 11, train_loss: 1.1664, test_loss: 1.2330, test_f1: 0.4062
 epoch: 12, train_loss: 1.1462, test_loss: 1.2350, test_f1: 0.4107
 epoch: 13, train_loss: 1.1470, test_loss: 1.2294, test_f1: 0.4362
 epoch: 14, train_loss: 1.1422, test_loss: 1.2486, test_f1: 0.4331
 epoch: 15, train_loss: 1.1338, test_loss: 1.2415, test_f1: 0.4424
 epoch: 16, train_loss: 1.1334, test_loss: 1.2372, test_f1: 0.4540
 epoch: 17, train_loss: 1.1342, test_loss: 1.2466, test_f1: 0.4629
 epoch: 18, train_loss: 1.1318, test_loss: 1.2408, test_f1: 0.4363
 epoch: 19, train_loss: 1.1204, test_loss: 1.2303, test_f1: 0.4516
 epoch: 20, train_loss: 1.1130, test_loss: 1.2215, test_f1: 0.4400
 epoch: 21, train_loss: 1.1085, test_loss: 1.2293, test_f1: 0.4442
 epoch: 22, train_loss: 1.1009, test_loss: 1.2186, test_f1: 0.4588
 epoch: 23, train_loss: 1.1105, test_loss: 1.2119, test_f1: 0.4784
 epoch: 24, train_loss: 1.1028, test_loss: 1.2177, test_f1: 0.4645
 epoch: 25, train_loss: 1.1029, test_loss: 1.2225, test_f1: 0.4850
 epoch: 26, train_loss: 1.0937, test_loss: 1.2225, test_f1: 0.4706
 epoch: 27, train_loss: 1.0761, test_loss: 1.2267, test_f1: 0.4595
 epoch: 28, train_loss: 1.0738, test_loss: 1.2162, test_f1: 0.4524
 epoch: 29, train_loss: 1.0657, test_loss: 1.2071, test_f1: 0.4668
 epoch: 30, train_loss: 1.0627, test_loss: 1.1961, test_f1: 0.4893
 epoch: 31, train_loss: 1.0621, test_loss: 1.2520, test_f1: 0.4768
 epoch: 32, train_loss: 1.0567, test_loss: 1.2354, test_f1: 0.4651
 epoch: 33, train_loss: 1.0690, test_loss: 1.2710, test_f1: 0.4654
 epoch: 34, train_loss: 1.0511, test_loss: 1.2530, test_f1: 0.4650
 epoch: 35, train_loss: 1.0557, test_loss: 1.2085, test_f1: 0.4544
 epoch: 36, train_loss: 1.0634, test_loss: 1.2073, test_f1: 0.4618
 epoch: 37, train_loss: 1.0327, test_loss: 1.2182, test_f1: 0.4797
 epoch: 38, train_loss: 1.0453, test_loss: 1.2234, test_f1: 0.4770
 epoch: 39, train_loss: 1.0367, test_loss: 1.2381, test_f1: 0.4682
 epoch: 40, train_loss: 1.0331, test_loss: 1.2154, test_f1: 0.4797
 epoch: 41, train_loss: 1.0188, test_loss: 1.2054, test_f1: 0.4699
 epoch: 42, train_loss: 1.0125, test_loss: 1.2295, test_f1: 0.4775
 epoch: 43, train_loss: 1.0208, test_loss: 1.2280, test_f1: 0.4701
 epoch: 44, train_loss: 1.0124, test_loss: 1.2204, test_f1: 0.4864
 epoch: 45, train_loss: 1.0281, test_loss: 1.2361, test_f1: 0.4836
 epoch: 46, train_loss: 1.0137, test_loss: 1.2295, test_f1: 0.4764
 epoch: 47, train_loss: 1.0123, test_loss: 1.2510, test_f1: 0.4690
 epoch: 48, train_loss: 1.0054, test_loss: 1.2724, test_f1: 0.4690
 epoch: 49, train_loss: 1.0103, test_loss: 1.2407, test_f1: 0.4929
 epoch: 50, train_loss: 1.0063, test_loss: 1.2523, test_f1: 0.4836
 epoch: 51, train_loss: 1.0076, test_loss: 1.2428, test_f1: 0.4951
 epoch: 52, train_loss: 1.0090, test_loss: 1.2390, test_f1: 0.4813
 epoch: 53, train_loss: 0.9952, test_loss: 1.2528, test_f1: 0.4757
 epoch: 54, train_loss: 0.9821, test_loss: 1.2603, test_f1: 0.4835
 epoch: 55, train_loss: 0.9832, test_loss: 1.2591, test_f1: 0.4804
 epoch: 56, train_loss: 0.9866, test_loss: 1.2714, test_f1: 0.4769
 epoch: 57, train_loss: 0.9966, test_loss: 1.2558, test_f1: 0.4739
 epoch: 58, train_loss: 0.9750, test_loss: 1.2715, test_f1: 0.4798
 epoch: 59, train_loss: 1.0012, test_loss: 1.2649, test_f1: 0.4881
 epoch: 60, train_loss: 0.9839, test_loss: 1.2519, test_f1: 0.4897
 epoch: 61, train_loss: 0.9732, test_loss: 1.3072, test_f1: 0.4725
 epoch: 62, train_loss: 0.9815, test_loss: 1.2784, test_f1: 0.4892
 epoch: 63, train_loss: 0.9676, test_loss: 1.2711, test_f1: 0.4765
 epoch: 64, train_loss: 0.9845, test_loss: 1.2679, test_f1: 0.4924
 epoch: 65, train_loss: 0.9774, test_loss: 1.2530, test_f1: 0.4890
 epoch: 66, train_loss: 0.9641, test_loss: 1.2708, test_f1: 0.4967
 epoch: 67, train_loss: 0.9788, test_loss: 1.2984, test_f1: 0.4869
 epoch: 68, train_loss: 0.9694, test_loss: 1.2788, test_f1: 0.4963
 epoch: 69, train_loss: 0.9680, test_loss: 1.2648, test_f1: 0.5024
 epoch: 70, train_loss: 0.9768, test_loss: 1.2900, test_f1: 0.4730
 epoch: 71, train_loss: 0.9713, test_loss: 1.2820, test_f1: 0.4850
 epoch: 72, train_loss: 0.9698, test_loss: 1.2756, test_f1: 0.4985
 epoch: 73, train_loss: 0.9684, test_loss: 1.2816, test_f1: 0.5068
 epoch: 74, train_loss: 0.9730, test_loss: 1.2922, test_f1: 0.4959
 epoch: 75, train_loss: 0.9632, test_loss: 1.2865, test_f1: 0.5091
 epoch: 76, train_loss: 0.9577, test_loss: 1.2984, test_f1: 0.4740
 epoch: 77, train_loss: 0.9526, test_loss: 1.2912, test_f1: 0.5035
 epoch: 78, train_loss: 0.9527, test_loss: 1.2879, test_f1: 0.4884
 epoch: 79, train_loss: 0.9667, test_loss: 1.2467, test_f1: 0.5107
 epoch: 80, train_loss: 0.9688, test_loss: 1.3051, test_f1: 0.4784
 epoch: 81, train_loss: 0.9514, test_loss: 1.3125, test_f1: 0.4774
 epoch: 82, train_loss: 0.9493, test_loss: 1.2853, test_f1: 0.5067
 epoch: 83, train_loss: 0.9519, test_loss: 1.3101, test_f1: 0.4735
 epoch: 84, train_loss: 0.9430, test_loss: 1.2576, test_f1: 0.4972
 epoch: 85, train_loss: 0.9523, test_loss: 1.2771, test_f1: 0.4844
 epoch: 86, train_loss: 0.9448, test_loss: 1.2806, test_f1: 0.5088
 epoch: 87, train_loss: 0.9468, test_loss: 1.2579, test_f1: 0.5021
 epoch: 88, train_loss: 0.9575, test_loss: 1.2425, test_f1: 0.5251
 epoch: 89, train_loss: 0.9394, test_loss: 1.2915, test_f1: 0.4914
 epoch: 90, train_loss: 0.9506, test_loss: 1.2818, test_f1: 0.4893
 epoch: 91, train_loss: 0.9521, test_loss: 1.2585, test_f1: 0.4863
 epoch: 92, train_loss: 0.9479, test_loss: 1.2671, test_f1: 0.5022
 epoch: 93, train_loss: 0.9532, test_loss: 1.2795, test_f1: 0.4904
 epoch: 94, train_loss: 0.9365, test_loss: 1.2589, test_f1: 0.4846
 epoch: 95, train_loss: 0.9396, test_loss: 1.2422, test_f1: 0.5025
 epoch: 96, train_loss: 0.9432, test_loss: 1.2513, test_f1: 0.4945
 epoch: 97, train_loss: 0.9398, test_loss: 1.2795, test_f1: 0.4847
 epoch: 98, train_loss: 0.9325, test_loss: 1.2801, test_f1: 0.4910
 epoch: 99, train_loss: 0.9242, test_loss: 1.2709, test_f1: 0.4996
##################ITERATION #9 ****************************************
 epoch: 0, train_loss: 1.2918, test_loss: 1.3406, test_f1: 0.2972
 epoch: 1, train_loss: 1.2470, test_loss: 1.3186, test_f1: 0.2674
 epoch: 2, train_loss: 1.2385, test_loss: 1.3080, test_f1: 0.2557
 epoch: 3, train_loss: 1.2247, test_loss: 1.3265, test_f1: 0.2704
 epoch: 4, train_loss: 1.2391, test_loss: 1.2809, test_f1: 0.3097
 epoch: 5, train_loss: 1.2087, test_loss: 1.2965, test_f1: 0.2991
 epoch: 6, train_loss: 1.2164, test_loss: 1.2944, test_f1: 0.3184
 epoch: 7, train_loss: 1.1982, test_loss: 1.2851, test_f1: 0.3196
 epoch: 8, train_loss: 1.2007, test_loss: 1.2750, test_f1: 0.3529
 epoch: 9, train_loss: 1.2013, test_loss: 1.2681, test_f1: 0.3614
 epoch: 10, train_loss: 1.1749, test_loss: 1.2516, test_f1: 0.3720
 epoch: 11, train_loss: 1.1902, test_loss: 1.2611, test_f1: 0.3819
 epoch: 12, train_loss: 1.1723, test_loss: 1.2583, test_f1: 0.3804
 epoch: 13, train_loss: 1.1662, test_loss: 1.2569, test_f1: 0.3803
 epoch: 14, train_loss: 1.1594, test_loss: 1.2423, test_f1: 0.3811
 epoch: 15, train_loss: 1.1646, test_loss: 1.2652, test_f1: 0.3828
 epoch: 16, train_loss: 1.1536, test_loss: 1.2447, test_f1: 0.3830
 epoch: 17, train_loss: 1.1418, test_loss: 1.2435, test_f1: 0.3950
 epoch: 18, train_loss: 1.1443, test_loss: 1.2371, test_f1: 0.3917
 epoch: 19, train_loss: 1.1540, test_loss: 1.2420, test_f1: 0.4069
 epoch: 20, train_loss: 1.1396, test_loss: 1.2374, test_f1: 0.3853
 epoch: 21, train_loss: 1.1332, test_loss: 1.2273, test_f1: 0.4018
 epoch: 22, train_loss: 1.1394, test_loss: 1.2188, test_f1: 0.4080
 epoch: 23, train_loss: 1.1186, test_loss: 1.2176, test_f1: 0.4000
 epoch: 24, train_loss: 1.1284, test_loss: 1.2089, test_f1: 0.4197
 epoch: 25, train_loss: 1.1254, test_loss: 1.2068, test_f1: 0.4298
 epoch: 26, train_loss: 1.1228, test_loss: 1.2120, test_f1: 0.4320
 epoch: 27, train_loss: 1.1182, test_loss: 1.2079, test_f1: 0.4341
 epoch: 28, train_loss: 1.1190, test_loss: 1.2151, test_f1: 0.4334
 epoch: 29, train_loss: 1.1078, test_loss: 1.2181, test_f1: 0.4658
 epoch: 30, train_loss: 1.1124, test_loss: 1.2177, test_f1: 0.4593
 epoch: 31, train_loss: 1.1027, test_loss: 1.2084, test_f1: 0.4678
 epoch: 32, train_loss: 1.0959, test_loss: 1.1999, test_f1: 0.4717
 epoch: 33, train_loss: 1.0927, test_loss: 1.2114, test_f1: 0.4780
 epoch: 34, train_loss: 1.0948, test_loss: 1.1999, test_f1: 0.4582
 epoch: 35, train_loss: 1.0889, test_loss: 1.2000, test_f1: 0.4544
 epoch: 36, train_loss: 1.0933, test_loss: 1.1974, test_f1: 0.4619
 epoch: 37, train_loss: 1.0863, test_loss: 1.1963, test_f1: 0.4611
 epoch: 38, train_loss: 1.0789, test_loss: 1.1983, test_f1: 0.4835
 epoch: 39, train_loss: 1.0763, test_loss: 1.2012, test_f1: 0.4804
 epoch: 40, train_loss: 1.0696, test_loss: 1.1987, test_f1: 0.4680
 epoch: 41, train_loss: 1.0788, test_loss: 1.1906, test_f1: 0.4866
 epoch: 42, train_loss: 1.0772, test_loss: 1.1826, test_f1: 0.4784
 epoch: 43, train_loss: 1.0672, test_loss: 1.1967, test_f1: 0.4770
 epoch: 44, train_loss: 1.0655, test_loss: 1.1908, test_f1: 0.4682
 epoch: 45, train_loss: 1.0665, test_loss: 1.1900, test_f1: 0.4724
 epoch: 46, train_loss: 1.0629, test_loss: 1.1883, test_f1: 0.4783
 epoch: 47, train_loss: 1.0677, test_loss: 1.1802, test_f1: 0.4757
 epoch: 48, train_loss: 1.0425, test_loss: 1.1850, test_f1: 0.5020
 epoch: 49, train_loss: 1.0512, test_loss: 1.1791, test_f1: 0.4800
 epoch: 50, train_loss: 1.0487, test_loss: 1.1763, test_f1: 0.4754
 epoch: 51, train_loss: 1.0481, test_loss: 1.1860, test_f1: 0.4801
 epoch: 52, train_loss: 1.0344, test_loss: 1.1889, test_f1: 0.4867
 epoch: 53, train_loss: 1.0415, test_loss: 1.1724, test_f1: 0.4803
 epoch: 54, train_loss: 1.0424, test_loss: 1.1793, test_f1: 0.4854
 epoch: 55, train_loss: 1.0514, test_loss: 1.1777, test_f1: 0.4838
 epoch: 56, train_loss: 1.0333, test_loss: 1.1786, test_f1: 0.4863
 epoch: 57, train_loss: 1.0293, test_loss: 1.1801, test_f1: 0.4845
 epoch: 58, train_loss: 1.0460, test_loss: 1.1751, test_f1: 0.4864
 epoch: 59, train_loss: 1.0470, test_loss: 1.1693, test_f1: 0.4889
 epoch: 60, train_loss: 1.0373, test_loss: 1.1790, test_f1: 0.4706
 epoch: 61, train_loss: 1.0160, test_loss: 1.1737, test_f1: 0.4802
 epoch: 62, train_loss: 1.0374, test_loss: 1.1824, test_f1: 0.4839
 epoch: 63, train_loss: 1.0379, test_loss: 1.1786, test_f1: 0.4775
 epoch: 64, train_loss: 1.0348, test_loss: 1.1760, test_f1: 0.4970
 epoch: 65, train_loss: 1.0185, test_loss: 1.1714, test_f1: 0.5009
 epoch: 66, train_loss: 1.0332, test_loss: 1.1778, test_f1: 0.5029
 epoch: 67, train_loss: 1.0322, test_loss: 1.1803, test_f1: 0.4849
 epoch: 68, train_loss: 1.0360, test_loss: 1.1804, test_f1: 0.4864
 epoch: 69, train_loss: 1.0284, test_loss: 1.1787, test_f1: 0.4810
 epoch: 70, train_loss: 1.0322, test_loss: 1.1709, test_f1: 0.5058
 epoch: 71, train_loss: 1.0063, test_loss: 1.1773, test_f1: 0.4917
 epoch: 72, train_loss: 1.0185, test_loss: 1.1775, test_f1: 0.4908
 epoch: 73, train_loss: 1.0197, test_loss: 1.1856, test_f1: 0.4881
 epoch: 74, train_loss: 1.0324, test_loss: 1.1842, test_f1: 0.4964
 epoch: 75, train_loss: 1.0342, test_loss: 1.1789, test_f1: 0.4964
 epoch: 76, train_loss: 1.0393, test_loss: 1.1766, test_f1: 0.4857
 epoch: 77, train_loss: 1.0175, test_loss: 1.1745, test_f1: 0.5088
 epoch: 78, train_loss: 1.0029, test_loss: 1.1675, test_f1: 0.5106
 epoch: 79, train_loss: 1.0139, test_loss: 1.1740, test_f1: 0.4994
 epoch: 80, train_loss: 1.0144, test_loss: 1.1721, test_f1: 0.4980
 epoch: 81, train_loss: 1.0075, test_loss: 1.1711, test_f1: 0.5006
 epoch: 82, train_loss: 1.0086, test_loss: 1.1729, test_f1: 0.4949
 epoch: 83, train_loss: 1.0015, test_loss: 1.1732, test_f1: 0.5037
 epoch: 84, train_loss: 1.0025, test_loss: 1.1775, test_f1: 0.4927
 epoch: 85, train_loss: 1.0078, test_loss: 1.1827, test_f1: 0.5048
 epoch: 86, train_loss: 1.0027, test_loss: 1.1890, test_f1: 0.5029
 epoch: 87, train_loss: 1.0018, test_loss: 1.1838, test_f1: 0.4982
 epoch: 88, train_loss: 1.0034, test_loss: 1.1696, test_f1: 0.5123
 epoch: 89, train_loss: 0.9980, test_loss: 1.1684, test_f1: 0.4999
 epoch: 90, train_loss: 1.0031, test_loss: 1.1626, test_f1: 0.5144
 epoch: 91, train_loss: 0.9963, test_loss: 1.1746, test_f1: 0.5053
 epoch: 92, train_loss: 1.0013, test_loss: 1.1592, test_f1: 0.5081
 epoch: 93, train_loss: 1.0017, test_loss: 1.1585, test_f1: 0.5113
 epoch: 94, train_loss: 0.9981, test_loss: 1.1780, test_f1: 0.4913
 epoch: 95, train_loss: 0.9971, test_loss: 1.1648, test_f1: 0.5147
 epoch: 96, train_loss: 1.0044, test_loss: 1.1728, test_f1: 0.5248
 epoch: 97, train_loss: 0.9877, test_loss: 1.1667, test_f1: 0.5096
 epoch: 98, train_loss: 0.9940, test_loss: 1.1573, test_f1: 0.5129
 epoch: 99, train_loss: 0.9888, test_loss: 1.1629, test_f1: 0.5061

Training completed in 1061.82 seconds
Best F1: 0.5857 at epoch 79
Mean F1 across iterations: 0.5306  0.0339
========================FINAL RESULTS================================
FEGIN weighted F1: 0.5857  0.0339
python main.py --data ltspice_demos --representation component_component --model FEGIN --layers 5 --hiddens 32 --batch_size 32 --lr 0.0001 --emb_size 512 --epochs 100 --save_appendix component_component_L5_H32_BS32_LR0.0001_E512 --no_val
-----



STDERR:
  File "main.py", line 370, in <module>
    main()
  File "main.py", line 254, in main
    dataset = dataset_class(
  File "/home/philip/projects/ltspice_examples_code_repo/Circuit-Completion-Using-GNNs/component_classification_with_link_prediction_head/evaluation/FEGIN/kernel/circuit_datasets.py", line 15, in __init__
    self.data, self.slices = torch.load(self.processed_paths[0])
  File "/home/philip/.local/lib/python3.8/site-packages/torch/serialization.py", line 1040, in load
    warnings.warn(
  File "/usr/lib/python3.8/warnings.py", line 109, in _showwarnmsg
    sw(msg.message, msg.category, msg.filename, msg.lineno,
  File "main.py", line 47, in warn_with_traceback
    traceback.print_stack(file=log)
/home/philip/projects/ltspice_examples_code_repo/Circuit-Completion-Using-GNNs/component_classification_with_link_prediction_head/evaluation/FEGIN/kernel/circuit_datasets.py:15: FutureWarning: You are using `torch.load` with `weights_only=False` (the current default value), which uses the default pickle module implicitly. It is possible to construct malicious pickle data which will execute arbitrary code during unpickling (See https://github.com/pytorch/pytorch/blob/main/SECURITY.md#untrusted-models for more details). In a future release, the default value for `weights_only` will be flipped to `True`. This limits the functions that could be executed during unpickling. Arbitrary objects will no longer be allowed to be loaded via this mode unless they are explicitly allowlisted by the user via `torch.serialization.add_safe_globals`. We recommend you start setting `weights_only=True` for any use case where you don't have full control of the loaded file. Please open an issue on GitHub for any issues related to this experimental feature.
  self.data, self.slices = torch.load(self.processed_paths[0])
