STDOUT:
Results will be saved in /home/philip/projects/ltspice_examples_code_repo/Circuit-Completion-Using-GNNs/component_classification_with_link_prediction_head/evaluation/FEGIN/results/model_FEGIN_dataset_ltspice_examples
Command line input: python main.py --data ltspice_examples --representation component_pin --model FEGIN --layers 2 --hiddens 128 --batch_size 32 --lr 0.0001 --emb_size 250 --epochs 100 --save_appendix component_pin_L2_H128_BS32_LR0.0001_E250 --no_val
 is saved.
-----
ltspice_examples - FEGIN
Using 2 layers, 128 hidden units, h = 2
Loading component_pin representation dataset
ENTERED
Training FEGIN on component_pin representation
Train: 3560, Test: 848
##################ITERATION #0 ****************************************
 epoch: 0, train_loss: 1.3326, test_loss: 1.2092, test_f1: 0.3361
 epoch: 1, train_loss: 1.1558, test_loss: 1.0860, test_f1: 0.3445
 epoch: 2, train_loss: 1.0708, test_loss: 1.0616, test_f1: 0.3414
 epoch: 3, train_loss: 1.0386, test_loss: 1.0433, test_f1: 0.3683
 epoch: 4, train_loss: 1.0186, test_loss: 1.0200, test_f1: 0.4197
 epoch: 5, train_loss: 0.9941, test_loss: 1.0111, test_f1: 0.4342
 epoch: 6, train_loss: 0.9769, test_loss: 1.0080, test_f1: 0.4727
 epoch: 7, train_loss: 0.9632, test_loss: 1.0057, test_f1: 0.4811
 epoch: 8, train_loss: 0.9571, test_loss: 0.9896, test_f1: 0.4703
 epoch: 9, train_loss: 0.9346, test_loss: 0.9861, test_f1: 0.4710
 epoch: 10, train_loss: 0.9249, test_loss: 0.9652, test_f1: 0.4926
 epoch: 11, train_loss: 0.9013, test_loss: 0.9869, test_f1: 0.5099
 epoch: 12, train_loss: 0.8916, test_loss: 0.9416, test_f1: 0.5124
 epoch: 13, train_loss: 0.8757, test_loss: 0.9268, test_f1: 0.5110
 epoch: 14, train_loss: 0.8583, test_loss: 0.9204, test_f1: 0.5112
 epoch: 15, train_loss: 0.8410, test_loss: 0.9015, test_f1: 0.5213
 epoch: 16, train_loss: 0.8351, test_loss: 0.9064, test_f1: 0.5173
 epoch: 17, train_loss: 0.8211, test_loss: 0.8861, test_f1: 0.5297
 epoch: 18, train_loss: 0.8141, test_loss: 0.8896, test_f1: 0.5369
 epoch: 19, train_loss: 0.7928, test_loss: 0.8830, test_f1: 0.5367
 epoch: 20, train_loss: 0.7850, test_loss: 0.9008, test_f1: 0.5464
 epoch: 21, train_loss: 0.7771, test_loss: 0.9206, test_f1: 0.5297
 epoch: 22, train_loss: 0.7735, test_loss: 0.8967, test_f1: 0.5283
 epoch: 23, train_loss: 0.7581, test_loss: 0.9102, test_f1: 0.5397
 epoch: 24, train_loss: 0.7429, test_loss: 0.9082, test_f1: 0.5358
 epoch: 25, train_loss: 0.7440, test_loss: 0.8839, test_f1: 0.5541
 epoch: 26, train_loss: 0.7355, test_loss: 0.8802, test_f1: 0.5636
 epoch: 27, train_loss: 0.7235, test_loss: 0.8868, test_f1: 0.5474
 epoch: 28, train_loss: 0.7179, test_loss: 0.8736, test_f1: 0.5701
 epoch: 29, train_loss: 0.7082, test_loss: 0.8746, test_f1: 0.5768
 epoch: 30, train_loss: 0.7035, test_loss: 0.8937, test_f1: 0.5635
 epoch: 31, train_loss: 0.6956, test_loss: 0.8921, test_f1: 0.5755
 epoch: 32, train_loss: 0.6961, test_loss: 0.9141, test_f1: 0.5615
 epoch: 33, train_loss: 0.6840, test_loss: 0.9240, test_f1: 0.5689
 epoch: 34, train_loss: 0.6802, test_loss: 0.8876, test_f1: 0.5923
 epoch: 35, train_loss: 0.6740, test_loss: 0.8870, test_f1: 0.5962
 epoch: 36, train_loss: 0.6708, test_loss: 0.9180, test_f1: 0.5725
 epoch: 37, train_loss: 0.6724, test_loss: 0.9535, test_f1: 0.5759
 epoch: 38, train_loss: 0.6439, test_loss: 0.9314, test_f1: 0.5978
 epoch: 39, train_loss: 0.6594, test_loss: 0.9796, test_f1: 0.5671
 epoch: 40, train_loss: 0.6397, test_loss: 0.9078, test_f1: 0.5920
 epoch: 41, train_loss: 0.6383, test_loss: 0.9757, test_f1: 0.5802
 epoch: 42, train_loss: 0.6353, test_loss: 0.9121, test_f1: 0.6057
 epoch: 43, train_loss: 0.6478, test_loss: 0.9527, test_f1: 0.5777
 epoch: 44, train_loss: 0.6251, test_loss: 0.9798, test_f1: 0.6039
 epoch: 45, train_loss: 0.6200, test_loss: 0.9194, test_f1: 0.6166
 epoch: 46, train_loss: 0.6283, test_loss: 0.9751, test_f1: 0.5879
 epoch: 47, train_loss: 0.6219, test_loss: 0.9726, test_f1: 0.5925
 epoch: 48, train_loss: 0.6115, test_loss: 0.9772, test_f1: 0.6176
 epoch: 49, train_loss: 0.6069, test_loss: 0.9515, test_f1: 0.6107
 epoch: 50, train_loss: 0.6079, test_loss: 0.9899, test_f1: 0.5893
 epoch: 51, train_loss: 0.6043, test_loss: 0.9653, test_f1: 0.6191
 epoch: 52, train_loss: 0.5937, test_loss: 0.9762, test_f1: 0.6008
 epoch: 53, train_loss: 0.5832, test_loss: 0.9620, test_f1: 0.6159
 epoch: 54, train_loss: 0.5860, test_loss: 0.9652, test_f1: 0.6103
 epoch: 55, train_loss: 0.5850, test_loss: 0.9823, test_f1: 0.6088
 epoch: 56, train_loss: 0.5716, test_loss: 1.0047, test_f1: 0.6098
 epoch: 57, train_loss: 0.5636, test_loss: 0.9900, test_f1: 0.6133
 epoch: 58, train_loss: 0.5772, test_loss: 0.9619, test_f1: 0.6176
 epoch: 59, train_loss: 0.5767, test_loss: 1.0213, test_f1: 0.6146
 epoch: 60, train_loss: 0.5725, test_loss: 0.9866, test_f1: 0.6076
 epoch: 61, train_loss: 0.5637, test_loss: 0.9920, test_f1: 0.6183
 epoch: 62, train_loss: 0.5686, test_loss: 0.9877, test_f1: 0.6143
 epoch: 63, train_loss: 0.5662, test_loss: 1.0030, test_f1: 0.6245
 epoch: 64, train_loss: 0.5656, test_loss: 0.9872, test_f1: 0.6316
 epoch: 65, train_loss: 0.5584, test_loss: 1.0116, test_f1: 0.6056
 epoch: 66, train_loss: 0.5461, test_loss: 1.0298, test_f1: 0.6406
 epoch: 67, train_loss: 0.5495, test_loss: 0.9995, test_f1: 0.6244
 epoch: 68, train_loss: 0.5437, test_loss: 1.0219, test_f1: 0.6136
 epoch: 69, train_loss: 0.5359, test_loss: 1.0299, test_f1: 0.6201
 epoch: 70, train_loss: 0.5446, test_loss: 0.9815, test_f1: 0.6206
 epoch: 71, train_loss: 0.5364, test_loss: 1.0229, test_f1: 0.6266
 epoch: 72, train_loss: 0.5416, test_loss: 1.0343, test_f1: 0.6195
 epoch: 73, train_loss: 0.5448, test_loss: 1.0396, test_f1: 0.6246
 epoch: 74, train_loss: 0.5275, test_loss: 1.0683, test_f1: 0.6334
 epoch: 75, train_loss: 0.5389, test_loss: 1.0671, test_f1: 0.6331
 epoch: 76, train_loss: 0.5364, test_loss: 1.0739, test_f1: 0.6229
 epoch: 77, train_loss: 0.5271, test_loss: 1.0581, test_f1: 0.6238
 epoch: 78, train_loss: 0.5328, test_loss: 1.0799, test_f1: 0.6470
 epoch: 79, train_loss: 0.5144, test_loss: 1.0932, test_f1: 0.6227
 epoch: 80, train_loss: 0.5198, test_loss: 1.0415, test_f1: 0.6235
 epoch: 81, train_loss: 0.5173, test_loss: 1.1118, test_f1: 0.6377
 epoch: 82, train_loss: 0.5162, test_loss: 1.0851, test_f1: 0.6589
 epoch: 83, train_loss: 0.5177, test_loss: 1.0929, test_f1: 0.6332
 epoch: 84, train_loss: 0.5192, test_loss: 1.1292, test_f1: 0.6359
 epoch: 85, train_loss: 0.5155, test_loss: 1.1712, test_f1: 0.6331
 epoch: 86, train_loss: 0.5154, test_loss: 1.1077, test_f1: 0.6582
 epoch: 87, train_loss: 0.5165, test_loss: 1.0896, test_f1: 0.6460
 epoch: 88, train_loss: 0.5145, test_loss: 1.1160, test_f1: 0.6383
 epoch: 89, train_loss: 0.5090, test_loss: 1.0984, test_f1: 0.6332
 epoch: 90, train_loss: 0.5128, test_loss: 1.1330, test_f1: 0.6518
 epoch: 91, train_loss: 0.4911, test_loss: 1.1217, test_f1: 0.6569
 epoch: 92, train_loss: 0.5009, test_loss: 1.1664, test_f1: 0.6360
 epoch: 93, train_loss: 0.5103, test_loss: 1.1329, test_f1: 0.6479
 epoch: 94, train_loss: 0.4972, test_loss: 1.1606, test_f1: 0.6186
 epoch: 95, train_loss: 0.5088, test_loss: 1.1500, test_f1: 0.6333
 epoch: 96, train_loss: 0.4991, test_loss: 1.1833, test_f1: 0.6397
 epoch: 97, train_loss: 0.4953, test_loss: 1.1460, test_f1: 0.6538
 epoch: 98, train_loss: 0.4863, test_loss: 1.1954, test_f1: 0.6475
 epoch: 99, train_loss: 0.4949, test_loss: 1.1870, test_f1: 0.6208
##################ITERATION #1 ****************************************
 epoch: 0, train_loss: 1.2198, test_loss: 1.0722, test_f1: 0.4002
 epoch: 1, train_loss: 1.0549, test_loss: 0.9996, test_f1: 0.4745
 epoch: 2, train_loss: 1.0042, test_loss: 0.9830, test_f1: 0.5222
 epoch: 3, train_loss: 0.9675, test_loss: 0.9531, test_f1: 0.5022
 epoch: 4, train_loss: 0.9413, test_loss: 0.9188, test_f1: 0.5046
 epoch: 5, train_loss: 0.9078, test_loss: 0.8939, test_f1: 0.5402
 epoch: 6, train_loss: 0.8922, test_loss: 0.9141, test_f1: 0.5360
 epoch: 7, train_loss: 0.8697, test_loss: 0.8560, test_f1: 0.5356
 epoch: 8, train_loss: 0.8572, test_loss: 0.8424, test_f1: 0.5488
 epoch: 9, train_loss: 0.8435, test_loss: 0.8341, test_f1: 0.5624
 epoch: 10, train_loss: 0.8332, test_loss: 0.8770, test_f1: 0.5478
 epoch: 11, train_loss: 0.8153, test_loss: 0.8533, test_f1: 0.5576
 epoch: 12, train_loss: 0.7939, test_loss: 0.8467, test_f1: 0.5662
 epoch: 13, train_loss: 0.7940, test_loss: 0.8224, test_f1: 0.5472
 epoch: 14, train_loss: 0.7839, test_loss: 0.8191, test_f1: 0.5502
 epoch: 15, train_loss: 0.7687, test_loss: 0.8402, test_f1: 0.5522
 epoch: 16, train_loss: 0.7726, test_loss: 0.8442, test_f1: 0.5715
 epoch: 17, train_loss: 0.7646, test_loss: 0.8579, test_f1: 0.5720
 epoch: 18, train_loss: 0.7527, test_loss: 0.8747, test_f1: 0.5730
 epoch: 19, train_loss: 0.7333, test_loss: 0.8464, test_f1: 0.5636
 epoch: 20, train_loss: 0.7276, test_loss: 0.8721, test_f1: 0.5887
 epoch: 21, train_loss: 0.7275, test_loss: 0.8524, test_f1: 0.5907
 epoch: 22, train_loss: 0.7155, test_loss: 0.8509, test_f1: 0.5745
 epoch: 23, train_loss: 0.7153, test_loss: 0.8435, test_f1: 0.5890
 epoch: 24, train_loss: 0.7041, test_loss: 0.8549, test_f1: 0.6087
 epoch: 25, train_loss: 0.6953, test_loss: 0.8636, test_f1: 0.5800
 epoch: 26, train_loss: 0.6903, test_loss: 0.8961, test_f1: 0.5730
 epoch: 27, train_loss: 0.6824, test_loss: 0.8490, test_f1: 0.6162
 epoch: 28, train_loss: 0.6846, test_loss: 0.8753, test_f1: 0.5961
 epoch: 29, train_loss: 0.6890, test_loss: 0.9032, test_f1: 0.6084
 epoch: 30, train_loss: 0.6779, test_loss: 0.8357, test_f1: 0.6135
 epoch: 31, train_loss: 0.6666, test_loss: 0.8473, test_f1: 0.6169
 epoch: 32, train_loss: 0.6432, test_loss: 0.8753, test_f1: 0.6117
 epoch: 33, train_loss: 0.6574, test_loss: 0.8955, test_f1: 0.6300
 epoch: 34, train_loss: 0.6501, test_loss: 0.8814, test_f1: 0.6072
 epoch: 35, train_loss: 0.6465, test_loss: 0.8755, test_f1: 0.6095
 epoch: 36, train_loss: 0.6313, test_loss: 0.9052, test_f1: 0.6214
 epoch: 37, train_loss: 0.6278, test_loss: 0.8948, test_f1: 0.6368
 epoch: 38, train_loss: 0.6235, test_loss: 0.8829, test_f1: 0.6186
 epoch: 39, train_loss: 0.6194, test_loss: 0.9100, test_f1: 0.6152
 epoch: 40, train_loss: 0.6371, test_loss: 0.8933, test_f1: 0.6196
 epoch: 41, train_loss: 0.6121, test_loss: 0.8470, test_f1: 0.6418
 epoch: 42, train_loss: 0.6038, test_loss: 0.8737, test_f1: 0.6291
 epoch: 43, train_loss: 0.6032, test_loss: 0.8838, test_f1: 0.6393
 epoch: 44, train_loss: 0.6008, test_loss: 0.8891, test_f1: 0.6429
 epoch: 45, train_loss: 0.6014, test_loss: 0.8882, test_f1: 0.6442
 epoch: 46, train_loss: 0.5981, test_loss: 0.9494, test_f1: 0.6313
 epoch: 47, train_loss: 0.5764, test_loss: 0.9414, test_f1: 0.6495
 epoch: 48, train_loss: 0.5951, test_loss: 0.9505, test_f1: 0.6338
 epoch: 49, train_loss: 0.5894, test_loss: 0.9502, test_f1: 0.6378
 epoch: 50, train_loss: 0.5719, test_loss: 0.9218, test_f1: 0.6520
 epoch: 51, train_loss: 0.5710, test_loss: 0.9862, test_f1: 0.6315
 epoch: 52, train_loss: 0.5524, test_loss: 0.9656, test_f1: 0.6418
 epoch: 53, train_loss: 0.5561, test_loss: 0.9367, test_f1: 0.6499
 epoch: 54, train_loss: 0.5458, test_loss: 0.9571, test_f1: 0.6408
 epoch: 55, train_loss: 0.5429, test_loss: 0.9278, test_f1: 0.6628
 epoch: 56, train_loss: 0.5418, test_loss: 0.9521, test_f1: 0.6562
 epoch: 57, train_loss: 0.5348, test_loss: 0.9432, test_f1: 0.6550
 epoch: 58, train_loss: 0.5440, test_loss: 0.9187, test_f1: 0.6629
 epoch: 59, train_loss: 0.5282, test_loss: 0.9698, test_f1: 0.6564
 epoch: 60, train_loss: 0.5408, test_loss: 0.9907, test_f1: 0.6358
 epoch: 61, train_loss: 0.5352, test_loss: 0.9865, test_f1: 0.6254
 epoch: 62, train_loss: 0.5354, test_loss: 1.0015, test_f1: 0.6575
 epoch: 63, train_loss: 0.5176, test_loss: 0.9925, test_f1: 0.6473
 epoch: 64, train_loss: 0.5259, test_loss: 0.9965, test_f1: 0.6674
 epoch: 65, train_loss: 0.5225, test_loss: 0.9795, test_f1: 0.6599
 epoch: 66, train_loss: 0.5198, test_loss: 1.0096, test_f1: 0.6411
 epoch: 67, train_loss: 0.5217, test_loss: 1.0249, test_f1: 0.6413
 epoch: 68, train_loss: 0.5232, test_loss: 0.9560, test_f1: 0.6563
 epoch: 69, train_loss: 0.5194, test_loss: 0.9389, test_f1: 0.6592
 epoch: 70, train_loss: 0.5173, test_loss: 1.0036, test_f1: 0.6558
 epoch: 71, train_loss: 0.5094, test_loss: 0.9896, test_f1: 0.6442
 epoch: 72, train_loss: 0.5126, test_loss: 1.0161, test_f1: 0.6474
 epoch: 73, train_loss: 0.5076, test_loss: 0.9773, test_f1: 0.6593
 epoch: 74, train_loss: 0.4962, test_loss: 1.0015, test_f1: 0.6539
 epoch: 75, train_loss: 0.5088, test_loss: 0.9206, test_f1: 0.6798
 epoch: 76, train_loss: 0.4908, test_loss: 0.9865, test_f1: 0.6684
 epoch: 77, train_loss: 0.4962, test_loss: 0.9574, test_f1: 0.6771
 epoch: 78, train_loss: 0.4931, test_loss: 1.0685, test_f1: 0.6686
 epoch: 79, train_loss: 0.4971, test_loss: 0.9644, test_f1: 0.6709
 epoch: 80, train_loss: 0.4994, test_loss: 1.0079, test_f1: 0.6370
 epoch: 81, train_loss: 0.4759, test_loss: 0.9672, test_f1: 0.6617
 epoch: 82, train_loss: 0.4895, test_loss: 1.0350, test_f1: 0.6782
 epoch: 83, train_loss: 0.4802, test_loss: 1.0355, test_f1: 0.6754
 epoch: 84, train_loss: 0.4915, test_loss: 1.0421, test_f1: 0.6665
 epoch: 85, train_loss: 0.4683, test_loss: 1.1105, test_f1: 0.6464
 epoch: 86, train_loss: 0.4825, test_loss: 1.0664, test_f1: 0.6812
 epoch: 87, train_loss: 0.4760, test_loss: 1.0187, test_f1: 0.6655
 epoch: 88, train_loss: 0.4780, test_loss: 1.0881, test_f1: 0.6635
 epoch: 89, train_loss: 0.4760, test_loss: 1.0470, test_f1: 0.6640
 epoch: 90, train_loss: 0.4722, test_loss: 1.0192, test_f1: 0.6827
 epoch: 91, train_loss: 0.4728, test_loss: 1.1214, test_f1: 0.6606
 epoch: 92, train_loss: 0.4518, test_loss: 1.1001, test_f1: 0.6875
 epoch: 93, train_loss: 0.4708, test_loss: 1.0599, test_f1: 0.6413
 epoch: 94, train_loss: 0.4612, test_loss: 1.0256, test_f1: 0.6576
 epoch: 95, train_loss: 0.4587, test_loss: 1.1014, test_f1: 0.6430
 epoch: 96, train_loss: 0.4655, test_loss: 1.0107, test_f1: 0.6488
 epoch: 97, train_loss: 0.4530, test_loss: 1.0619, test_f1: 0.6634
 epoch: 98, train_loss: 0.4566, test_loss: 1.1396, test_f1: 0.6404
 epoch: 99, train_loss: 0.4502, test_loss: 1.0548, test_f1: 0.6609
##################ITERATION #2 ****************************************
 epoch: 0, train_loss: 1.1652, test_loss: 1.0255, test_f1: 0.4097
 epoch: 1, train_loss: 1.0250, test_loss: 0.9751, test_f1: 0.4944
 epoch: 2, train_loss: 0.9887, test_loss: 0.9688, test_f1: 0.5024
 epoch: 3, train_loss: 0.9582, test_loss: 0.9566, test_f1: 0.5388
 epoch: 4, train_loss: 0.9345, test_loss: 0.9309, test_f1: 0.5304
 epoch: 5, train_loss: 0.9157, test_loss: 0.9186, test_f1: 0.5394
 epoch: 6, train_loss: 0.8996, test_loss: 0.9220, test_f1: 0.5602
 epoch: 7, train_loss: 0.8777, test_loss: 0.9169, test_f1: 0.5363
 epoch: 8, train_loss: 0.8674, test_loss: 0.9121, test_f1: 0.5553
 epoch: 9, train_loss: 0.8517, test_loss: 0.9026, test_f1: 0.5554
 epoch: 10, train_loss: 0.8338, test_loss: 0.8756, test_f1: 0.5446
 epoch: 11, train_loss: 0.8222, test_loss: 0.8545, test_f1: 0.5759
 epoch: 12, train_loss: 0.8099, test_loss: 0.8516, test_f1: 0.5609
 epoch: 13, train_loss: 0.7987, test_loss: 0.8660, test_f1: 0.5598
 epoch: 14, train_loss: 0.7918, test_loss: 0.8362, test_f1: 0.5823
 epoch: 15, train_loss: 0.7677, test_loss: 0.8581, test_f1: 0.5532
 epoch: 16, train_loss: 0.7739, test_loss: 0.8128, test_f1: 0.5835
 epoch: 17, train_loss: 0.7680, test_loss: 0.8382, test_f1: 0.5592
 epoch: 18, train_loss: 0.7587, test_loss: 0.8257, test_f1: 0.5859
 epoch: 19, train_loss: 0.7396, test_loss: 0.8028, test_f1: 0.6094
 epoch: 20, train_loss: 0.7272, test_loss: 0.8192, test_f1: 0.5964
 epoch: 21, train_loss: 0.7291, test_loss: 0.8244, test_f1: 0.5834
 epoch: 22, train_loss: 0.7171, test_loss: 0.8125, test_f1: 0.6129
 epoch: 23, train_loss: 0.7114, test_loss: 0.8385, test_f1: 0.5906
 epoch: 24, train_loss: 0.7128, test_loss: 0.8061, test_f1: 0.6121
 epoch: 25, train_loss: 0.7054, test_loss: 0.8309, test_f1: 0.5761
 epoch: 26, train_loss: 0.7030, test_loss: 0.8272, test_f1: 0.6163
 epoch: 27, train_loss: 0.6846, test_loss: 0.7988, test_f1: 0.6167
 epoch: 28, train_loss: 0.6810, test_loss: 0.8090, test_f1: 0.5975
 epoch: 29, train_loss: 0.6731, test_loss: 0.7842, test_f1: 0.6295
 epoch: 30, train_loss: 0.6666, test_loss: 0.8211, test_f1: 0.5995
 epoch: 31, train_loss: 0.6602, test_loss: 0.8027, test_f1: 0.6126
 epoch: 32, train_loss: 0.6540, test_loss: 0.7480, test_f1: 0.6120
 epoch: 33, train_loss: 0.6582, test_loss: 0.7797, test_f1: 0.6115
 epoch: 34, train_loss: 0.6341, test_loss: 0.7413, test_f1: 0.6220
 epoch: 35, train_loss: 0.6300, test_loss: 0.7700, test_f1: 0.6202
 epoch: 36, train_loss: 0.6357, test_loss: 0.8035, test_f1: 0.6124
 epoch: 37, train_loss: 0.6188, test_loss: 0.7623, test_f1: 0.6258
 epoch: 38, train_loss: 0.6214, test_loss: 0.7589, test_f1: 0.6183
 epoch: 39, train_loss: 0.6135, test_loss: 0.7681, test_f1: 0.6209
 epoch: 40, train_loss: 0.6194, test_loss: 0.7759, test_f1: 0.6232
 epoch: 41, train_loss: 0.6057, test_loss: 0.7925, test_f1: 0.6269
 epoch: 42, train_loss: 0.5986, test_loss: 0.7941, test_f1: 0.6283
 epoch: 43, train_loss: 0.5966, test_loss: 0.8105, test_f1: 0.6102
 epoch: 44, train_loss: 0.5940, test_loss: 0.8471, test_f1: 0.6245
 epoch: 45, train_loss: 0.6003, test_loss: 0.8444, test_f1: 0.6061
 epoch: 46, train_loss: 0.5896, test_loss: 0.8403, test_f1: 0.6351
 epoch: 47, train_loss: 0.5697, test_loss: 0.8458, test_f1: 0.6377
 epoch: 48, train_loss: 0.5776, test_loss: 0.8390, test_f1: 0.6203
 epoch: 49, train_loss: 0.5686, test_loss: 0.8959, test_f1: 0.6038
 epoch: 50, train_loss: 0.5688, test_loss: 0.8836, test_f1: 0.6284
 epoch: 51, train_loss: 0.5533, test_loss: 0.8997, test_f1: 0.6182
 epoch: 52, train_loss: 0.5463, test_loss: 0.8708, test_f1: 0.6244
 epoch: 53, train_loss: 0.5396, test_loss: 0.9173, test_f1: 0.6167
 epoch: 54, train_loss: 0.5347, test_loss: 0.9000, test_f1: 0.6092
 epoch: 55, train_loss: 0.5344, test_loss: 0.8897, test_f1: 0.6270
 epoch: 56, train_loss: 0.5286, test_loss: 0.9272, test_f1: 0.6216
 epoch: 57, train_loss: 0.5285, test_loss: 0.9198, test_f1: 0.6352
 epoch: 58, train_loss: 0.5194, test_loss: 0.9146, test_f1: 0.6173
 epoch: 59, train_loss: 0.5273, test_loss: 0.9676, test_f1: 0.5940
 epoch: 60, train_loss: 0.5215, test_loss: 0.9775, test_f1: 0.6085
 epoch: 61, train_loss: 0.5294, test_loss: 0.9421, test_f1: 0.6166
 epoch: 62, train_loss: 0.5195, test_loss: 0.9522, test_f1: 0.6092
 epoch: 63, train_loss: 0.5240, test_loss: 0.9147, test_f1: 0.6393
 epoch: 64, train_loss: 0.5126, test_loss: 0.9519, test_f1: 0.6115
 epoch: 65, train_loss: 0.5127, test_loss: 0.9390, test_f1: 0.6234
 epoch: 66, train_loss: 0.5241, test_loss: 0.9471, test_f1: 0.6457
 epoch: 67, train_loss: 0.5031, test_loss: 0.9554, test_f1: 0.6290
 epoch: 68, train_loss: 0.5052, test_loss: 0.9266, test_f1: 0.6327
 epoch: 69, train_loss: 0.5001, test_loss: 0.9767, test_f1: 0.6271
 epoch: 70, train_loss: 0.5053, test_loss: 0.9262, test_f1: 0.6094
 epoch: 71, train_loss: 0.5077, test_loss: 0.9572, test_f1: 0.6213
 epoch: 72, train_loss: 0.5187, test_loss: 0.9869, test_f1: 0.6371
 epoch: 73, train_loss: 0.4939, test_loss: 0.9524, test_f1: 0.6343
 epoch: 74, train_loss: 0.4960, test_loss: 0.9739, test_f1: 0.6448
 epoch: 75, train_loss: 0.4878, test_loss: 0.9779, test_f1: 0.6343
 epoch: 76, train_loss: 0.4873, test_loss: 0.9673, test_f1: 0.6414
 epoch: 77, train_loss: 0.4866, test_loss: 0.9833, test_f1: 0.6283
 epoch: 78, train_loss: 0.4887, test_loss: 0.9856, test_f1: 0.6324
 epoch: 79, train_loss: 0.4809, test_loss: 1.0626, test_f1: 0.6261
 epoch: 80, train_loss: 0.4843, test_loss: 1.0261, test_f1: 0.6497
 epoch: 81, train_loss: 0.4848, test_loss: 1.0254, test_f1: 0.6432
 epoch: 82, train_loss: 0.4745, test_loss: 1.0084, test_f1: 0.6330
 epoch: 83, train_loss: 0.4745, test_loss: 1.0292, test_f1: 0.6526
 epoch: 84, train_loss: 0.4807, test_loss: 1.0723, test_f1: 0.6474
 epoch: 85, train_loss: 0.4594, test_loss: 1.0330, test_f1: 0.6651
 epoch: 86, train_loss: 0.4745, test_loss: 1.0301, test_f1: 0.6369
 epoch: 87, train_loss: 0.4731, test_loss: 1.0649, test_f1: 0.6628
 epoch: 88, train_loss: 0.4729, test_loss: 1.0487, test_f1: 0.6248
 epoch: 89, train_loss: 0.4592, test_loss: 1.0891, test_f1: 0.6541
 epoch: 90, train_loss: 0.4640, test_loss: 1.0082, test_f1: 0.6501
 epoch: 91, train_loss: 0.4582, test_loss: 1.1404, test_f1: 0.6448
 epoch: 92, train_loss: 0.4537, test_loss: 1.0356, test_f1: 0.6532
 epoch: 93, train_loss: 0.4488, test_loss: 1.0534, test_f1: 0.6599
 epoch: 94, train_loss: 0.4492, test_loss: 1.0171, test_f1: 0.6703
 epoch: 95, train_loss: 0.4538, test_loss: 1.0686, test_f1: 0.6650
 epoch: 96, train_loss: 0.4609, test_loss: 1.0674, test_f1: 0.6517
 epoch: 97, train_loss: 0.4598, test_loss: 1.1249, test_f1: 0.6422
 epoch: 98, train_loss: 0.4536, test_loss: 1.1532, test_f1: 0.6301
 epoch: 99, train_loss: 0.4607, test_loss: 1.1140, test_f1: 0.6722
##################ITERATION #3 ****************************************
 epoch: 0, train_loss: 1.1386, test_loss: 0.9767, test_f1: 0.4865
 epoch: 1, train_loss: 1.0256, test_loss: 0.9495, test_f1: 0.5031
 epoch: 2, train_loss: 0.9923, test_loss: 0.9382, test_f1: 0.5084
 epoch: 3, train_loss: 0.9597, test_loss: 0.9235, test_f1: 0.5551
 epoch: 4, train_loss: 0.9358, test_loss: 0.9157, test_f1: 0.5526
 epoch: 5, train_loss: 0.9288, test_loss: 0.9255, test_f1: 0.5412
 epoch: 6, train_loss: 0.9092, test_loss: 0.8950, test_f1: 0.5783
 epoch: 7, train_loss: 0.8901, test_loss: 0.8979, test_f1: 0.5684
 epoch: 8, train_loss: 0.8888, test_loss: 0.8713, test_f1: 0.5771
 epoch: 9, train_loss: 0.8763, test_loss: 0.8962, test_f1: 0.5685
 epoch: 10, train_loss: 0.8626, test_loss: 0.8823, test_f1: 0.5844
 epoch: 11, train_loss: 0.8456, test_loss: 0.8842, test_f1: 0.5714
 epoch: 12, train_loss: 0.8371, test_loss: 0.8557, test_f1: 0.5805
 epoch: 13, train_loss: 0.8150, test_loss: 0.8436, test_f1: 0.6155
 epoch: 14, train_loss: 0.8148, test_loss: 0.8766, test_f1: 0.5919
 epoch: 15, train_loss: 0.7988, test_loss: 0.8350, test_f1: 0.6141
 epoch: 16, train_loss: 0.7932, test_loss: 0.8462, test_f1: 0.5921
 epoch: 17, train_loss: 0.7780, test_loss: 0.8300, test_f1: 0.6126
 epoch: 18, train_loss: 0.7720, test_loss: 0.8194, test_f1: 0.6343
 epoch: 19, train_loss: 0.7662, test_loss: 0.8420, test_f1: 0.5988
 epoch: 20, train_loss: 0.7626, test_loss: 0.8345, test_f1: 0.6043
 epoch: 21, train_loss: 0.7455, test_loss: 0.8330, test_f1: 0.6201
 epoch: 22, train_loss: 0.7382, test_loss: 0.8260, test_f1: 0.6080
 epoch: 23, train_loss: 0.7357, test_loss: 0.8147, test_f1: 0.6258
 epoch: 24, train_loss: 0.7211, test_loss: 0.8230, test_f1: 0.6200
 epoch: 25, train_loss: 0.7219, test_loss: 0.8372, test_f1: 0.6190
 epoch: 26, train_loss: 0.6978, test_loss: 0.8258, test_f1: 0.6211
 epoch: 27, train_loss: 0.6966, test_loss: 0.8296, test_f1: 0.6219
 epoch: 28, train_loss: 0.6958, test_loss: 0.8265, test_f1: 0.6442
 epoch: 29, train_loss: 0.6938, test_loss: 0.8023, test_f1: 0.6307
 epoch: 30, train_loss: 0.6873, test_loss: 0.8087, test_f1: 0.6561
 epoch: 31, train_loss: 0.6816, test_loss: 0.8492, test_f1: 0.5954
 epoch: 32, train_loss: 0.6701, test_loss: 0.8805, test_f1: 0.6216
 epoch: 33, train_loss: 0.6599, test_loss: 0.7928, test_f1: 0.6042
 epoch: 34, train_loss: 0.6670, test_loss: 0.7945, test_f1: 0.6373
 epoch: 35, train_loss: 0.6749, test_loss: 0.7883, test_f1: 0.6380
 epoch: 36, train_loss: 0.6553, test_loss: 0.8110, test_f1: 0.6387
 epoch: 37, train_loss: 0.6555, test_loss: 0.7879, test_f1: 0.6478
 epoch: 38, train_loss: 0.6269, test_loss: 0.7977, test_f1: 0.6369
 epoch: 39, train_loss: 0.6372, test_loss: 0.8023, test_f1: 0.6201
 epoch: 40, train_loss: 0.6379, test_loss: 0.7754, test_f1: 0.6561
 epoch: 41, train_loss: 0.6358, test_loss: 0.7606, test_f1: 0.6245
 epoch: 42, train_loss: 0.6188, test_loss: 0.7384, test_f1: 0.6381
 epoch: 43, train_loss: 0.6188, test_loss: 0.9017, test_f1: 0.6461
 epoch: 44, train_loss: 0.6038, test_loss: 0.8376, test_f1: 0.6198
 epoch: 45, train_loss: 0.6185, test_loss: 0.8754, test_f1: 0.6181
 epoch: 46, train_loss: 0.5984, test_loss: 0.8430, test_f1: 0.6278
 epoch: 47, train_loss: 0.6029, test_loss: 0.7954, test_f1: 0.6498
 epoch: 48, train_loss: 0.6089, test_loss: 0.7513, test_f1: 0.6444
 epoch: 49, train_loss: 0.5874, test_loss: 0.8425, test_f1: 0.6495
 epoch: 50, train_loss: 0.5995, test_loss: 0.8522, test_f1: 0.6253
 epoch: 51, train_loss: 0.5716, test_loss: 0.8294, test_f1: 0.6431
 epoch: 52, train_loss: 0.5640, test_loss: 0.8334, test_f1: 0.6469
 epoch: 53, train_loss: 0.5478, test_loss: 0.7632, test_f1: 0.6281
 epoch: 54, train_loss: 0.5578, test_loss: 0.7880, test_f1: 0.6545
 epoch: 55, train_loss: 0.5561, test_loss: 0.8462, test_f1: 0.6274
 epoch: 56, train_loss: 0.5578, test_loss: 0.8208, test_f1: 0.6404
 epoch: 57, train_loss: 0.5505, test_loss: 0.7817, test_f1: 0.6345
 epoch: 58, train_loss: 0.5611, test_loss: 0.8452, test_f1: 0.6550
 epoch: 59, train_loss: 0.5463, test_loss: 0.8252, test_f1: 0.6436
 epoch: 60, train_loss: 0.5391, test_loss: 0.8201, test_f1: 0.6195
 epoch: 61, train_loss: 0.5447, test_loss: 0.8608, test_f1: 0.6384
 epoch: 62, train_loss: 0.5341, test_loss: 0.8355, test_f1: 0.6447
 epoch: 63, train_loss: 0.5361, test_loss: 0.8149, test_f1: 0.6436
 epoch: 64, train_loss: 0.5327, test_loss: 0.8361, test_f1: 0.6416
 epoch: 65, train_loss: 0.5321, test_loss: 0.8968, test_f1: 0.6543
 epoch: 66, train_loss: 0.5251, test_loss: 0.8457, test_f1: 0.6430
 epoch: 67, train_loss: 0.5409, test_loss: 0.7984, test_f1: 0.6491
 epoch: 68, train_loss: 0.5216, test_loss: 0.8814, test_f1: 0.6257
 epoch: 69, train_loss: 0.5205, test_loss: 0.8608, test_f1: 0.6524
 epoch: 70, train_loss: 0.5189, test_loss: 0.7873, test_f1: 0.6525
 epoch: 71, train_loss: 0.5165, test_loss: 0.8110, test_f1: 0.6481
 epoch: 72, train_loss: 0.5092, test_loss: 0.8717, test_f1: 0.6516
 epoch: 73, train_loss: 0.5023, test_loss: 0.8577, test_f1: 0.6402
 epoch: 74, train_loss: 0.5138, test_loss: 0.7967, test_f1: 0.6379
 epoch: 75, train_loss: 0.5100, test_loss: 0.8032, test_f1: 0.6431
 epoch: 76, train_loss: 0.5133, test_loss: 0.8919, test_f1: 0.6331
 epoch: 77, train_loss: 0.5094, test_loss: 0.8582, test_f1: 0.6318
 epoch: 78, train_loss: 0.4978, test_loss: 0.8120, test_f1: 0.6332
 epoch: 79, train_loss: 0.4959, test_loss: 0.9194, test_f1: 0.6486
 epoch: 80, train_loss: 0.4882, test_loss: 0.8592, test_f1: 0.6259
 epoch: 81, train_loss: 0.4950, test_loss: 0.8685, test_f1: 0.6346
 epoch: 82, train_loss: 0.4909, test_loss: 0.8874, test_f1: 0.6447
 epoch: 83, train_loss: 0.4790, test_loss: 0.8495, test_f1: 0.6409
 epoch: 84, train_loss: 0.4882, test_loss: 0.8580, test_f1: 0.6623
 epoch: 85, train_loss: 0.4879, test_loss: 0.9593, test_f1: 0.6610
 epoch: 86, train_loss: 0.4769, test_loss: 0.8427, test_f1: 0.6420
 epoch: 87, train_loss: 0.4843, test_loss: 0.8418, test_f1: 0.6518
 epoch: 88, train_loss: 0.4727, test_loss: 0.9052, test_f1: 0.6349
 epoch: 89, train_loss: 0.4791, test_loss: 0.8895, test_f1: 0.6575
 epoch: 90, train_loss: 0.4852, test_loss: 0.8750, test_f1: 0.6449
 epoch: 91, train_loss: 0.4818, test_loss: 0.8877, test_f1: 0.6503
 epoch: 92, train_loss: 0.4670, test_loss: 0.8640, test_f1: 0.6627
 epoch: 93, train_loss: 0.4703, test_loss: 0.8557, test_f1: 0.6842
 epoch: 94, train_loss: 0.4787, test_loss: 0.8277, test_f1: 0.6581
 epoch: 95, train_loss: 0.4677, test_loss: 0.8540, test_f1: 0.6696
 epoch: 96, train_loss: 0.4662, test_loss: 0.8450, test_f1: 0.6581
 epoch: 97, train_loss: 0.4675, test_loss: 0.9071, test_f1: 0.6574
 epoch: 98, train_loss: 0.4556, test_loss: 0.9170, test_f1: 0.6452
 epoch: 99, train_loss: 0.4584, test_loss: 0.9068, test_f1: 0.6537
##################ITERATION #4 ****************************************
 epoch: 0, train_loss: 1.1735, test_loss: 1.0025, test_f1: 0.5066
 epoch: 1, train_loss: 1.0385, test_loss: 0.9859, test_f1: 0.5019
 epoch: 2, train_loss: 0.9966, test_loss: 0.9602, test_f1: 0.5166
 epoch: 3, train_loss: 0.9692, test_loss: 0.9411, test_f1: 0.5099
 epoch: 4, train_loss: 0.9352, test_loss: 0.9336, test_f1: 0.5292
 epoch: 5, train_loss: 0.9372, test_loss: 0.9250, test_f1: 0.5454
 epoch: 6, train_loss: 0.9021, test_loss: 0.9231, test_f1: 0.5393
 epoch: 7, train_loss: 0.8849, test_loss: 0.9024, test_f1: 0.5571
 epoch: 8, train_loss: 0.8768, test_loss: 0.8920, test_f1: 0.5529
 epoch: 9, train_loss: 0.8667, test_loss: 0.8909, test_f1: 0.5779
 epoch: 10, train_loss: 0.8473, test_loss: 0.8852, test_f1: 0.5738
 epoch: 11, train_loss: 0.8404, test_loss: 0.8788, test_f1: 0.5610
 epoch: 12, train_loss: 0.8138, test_loss: 0.8918, test_f1: 0.5881
 epoch: 13, train_loss: 0.8112, test_loss: 0.8828, test_f1: 0.6005
 epoch: 14, train_loss: 0.8012, test_loss: 0.8569, test_f1: 0.6064
 epoch: 15, train_loss: 0.7914, test_loss: 0.8610, test_f1: 0.6018
 epoch: 16, train_loss: 0.7752, test_loss: 0.8809, test_f1: 0.6138
 epoch: 17, train_loss: 0.7752, test_loss: 0.8573, test_f1: 0.5777
 epoch: 18, train_loss: 0.7619, test_loss: 0.8695, test_f1: 0.6167
 epoch: 19, train_loss: 0.7556, test_loss: 0.8444, test_f1: 0.6237
 epoch: 20, train_loss: 0.7471, test_loss: 0.8478, test_f1: 0.6112
 epoch: 21, train_loss: 0.7403, test_loss: 0.8462, test_f1: 0.6064
 epoch: 22, train_loss: 0.7377, test_loss: 0.8417, test_f1: 0.6300
 epoch: 23, train_loss: 0.7151, test_loss: 0.8168, test_f1: 0.6246
 epoch: 24, train_loss: 0.7199, test_loss: 0.8356, test_f1: 0.6144
 epoch: 25, train_loss: 0.7007, test_loss: 0.8490, test_f1: 0.6370
 epoch: 26, train_loss: 0.7052, test_loss: 0.8302, test_f1: 0.6162
 epoch: 27, train_loss: 0.6966, test_loss: 0.8488, test_f1: 0.6150
 epoch: 28, train_loss: 0.6868, test_loss: 0.8034, test_f1: 0.6308
 epoch: 29, train_loss: 0.6764, test_loss: 0.8110, test_f1: 0.6315
 epoch: 30, train_loss: 0.6772, test_loss: 0.8288, test_f1: 0.6223
 epoch: 31, train_loss: 0.6660, test_loss: 0.8035, test_f1: 0.6389
 epoch: 32, train_loss: 0.6809, test_loss: 0.7691, test_f1: 0.6326
 epoch: 33, train_loss: 0.6602, test_loss: 0.8328, test_f1: 0.6224
 epoch: 34, train_loss: 0.6541, test_loss: 0.7983, test_f1: 0.6665
 epoch: 35, train_loss: 0.6544, test_loss: 0.8411, test_f1: 0.6611
 epoch: 36, train_loss: 0.6498, test_loss: 0.8300, test_f1: 0.6341
 epoch: 37, train_loss: 0.6412, test_loss: 0.8018, test_f1: 0.6503
 epoch: 38, train_loss: 0.6556, test_loss: 0.7855, test_f1: 0.6669
 epoch: 39, train_loss: 0.6243, test_loss: 0.7517, test_f1: 0.6305
 epoch: 40, train_loss: 0.6185, test_loss: 0.8018, test_f1: 0.6368
 epoch: 41, train_loss: 0.6262, test_loss: 0.7634, test_f1: 0.6634
 epoch: 42, train_loss: 0.6213, test_loss: 0.7882, test_f1: 0.6326
 epoch: 43, train_loss: 0.6203, test_loss: 0.8236, test_f1: 0.6470
 epoch: 44, train_loss: 0.6035, test_loss: 0.8028, test_f1: 0.6591
 epoch: 45, train_loss: 0.5968, test_loss: 0.7963, test_f1: 0.6733
 epoch: 46, train_loss: 0.5963, test_loss: 0.8228, test_f1: 0.6551
 epoch: 47, train_loss: 0.5910, test_loss: 0.8023, test_f1: 0.6706
 epoch: 48, train_loss: 0.5873, test_loss: 0.8227, test_f1: 0.6466
 epoch: 49, train_loss: 0.5939, test_loss: 0.8106, test_f1: 0.6705
 epoch: 50, train_loss: 0.5844, test_loss: 0.7872, test_f1: 0.6607
 epoch: 51, train_loss: 0.5632, test_loss: 0.7831, test_f1: 0.6637
 epoch: 52, train_loss: 0.5576, test_loss: 0.7918, test_f1: 0.6636
 epoch: 53, train_loss: 0.5466, test_loss: 0.7515, test_f1: 0.6574
 epoch: 54, train_loss: 0.5473, test_loss: 0.7964, test_f1: 0.6617
 epoch: 55, train_loss: 0.5556, test_loss: 0.7649, test_f1: 0.6848
 epoch: 56, train_loss: 0.5424, test_loss: 0.8048, test_f1: 0.6613
 epoch: 57, train_loss: 0.5364, test_loss: 0.7819, test_f1: 0.6645
 epoch: 58, train_loss: 0.5501, test_loss: 0.7995, test_f1: 0.6403
 epoch: 59, train_loss: 0.5400, test_loss: 0.7494, test_f1: 0.6663
 epoch: 60, train_loss: 0.5316, test_loss: 0.8047, test_f1: 0.6686
 epoch: 61, train_loss: 0.5446, test_loss: 0.8238, test_f1: 0.6642
 epoch: 62, train_loss: 0.5319, test_loss: 0.7939, test_f1: 0.6595
 epoch: 63, train_loss: 0.5400, test_loss: 0.7924, test_f1: 0.6700
 epoch: 64, train_loss: 0.5292, test_loss: 0.7946, test_f1: 0.6449
 epoch: 65, train_loss: 0.5350, test_loss: 0.7725, test_f1: 0.6720
 epoch: 66, train_loss: 0.5250, test_loss: 0.7895, test_f1: 0.6616
 epoch: 67, train_loss: 0.5203, test_loss: 0.8148, test_f1: 0.6409
 epoch: 68, train_loss: 0.5200, test_loss: 0.7608, test_f1: 0.6516
 epoch: 69, train_loss: 0.5007, test_loss: 0.7966, test_f1: 0.6781
 epoch: 70, train_loss: 0.5240, test_loss: 0.7174, test_f1: 0.6737
 epoch: 71, train_loss: 0.5163, test_loss: 0.7714, test_f1: 0.6572
 epoch: 72, train_loss: 0.5068, test_loss: 0.7531, test_f1: 0.6741
 epoch: 73, train_loss: 0.5148, test_loss: 0.8039, test_f1: 0.6625
 epoch: 74, train_loss: 0.5143, test_loss: 0.7952, test_f1: 0.6641
 epoch: 75, train_loss: 0.4959, test_loss: 0.8148, test_f1: 0.6647
 epoch: 76, train_loss: 0.4863, test_loss: 0.7771, test_f1: 0.6600
 epoch: 77, train_loss: 0.4980, test_loss: 0.8150, test_f1: 0.6473
 epoch: 78, train_loss: 0.4967, test_loss: 0.8057, test_f1: 0.6649
 epoch: 79, train_loss: 0.4818, test_loss: 0.8597, test_f1: 0.6542
 epoch: 80, train_loss: 0.4886, test_loss: 0.7698, test_f1: 0.6803
 epoch: 81, train_loss: 0.4924, test_loss: 0.7994, test_f1: 0.6803
 epoch: 82, train_loss: 0.4873, test_loss: 0.8037, test_f1: 0.6753
 epoch: 83, train_loss: 0.4770, test_loss: 0.7765, test_f1: 0.6741
 epoch: 84, train_loss: 0.4761, test_loss: 0.7932, test_f1: 0.6760
 epoch: 85, train_loss: 0.4733, test_loss: 0.8178, test_f1: 0.6763
 epoch: 86, train_loss: 0.4748, test_loss: 0.8231, test_f1: 0.6790
 epoch: 87, train_loss: 0.4856, test_loss: 0.8047, test_f1: 0.6877
 epoch: 88, train_loss: 0.4756, test_loss: 0.7480, test_f1: 0.6782
 epoch: 89, train_loss: 0.4579, test_loss: 0.7746, test_f1: 0.6728
 epoch: 90, train_loss: 0.4692, test_loss: 0.7573, test_f1: 0.6876
 epoch: 91, train_loss: 0.4675, test_loss: 0.8030, test_f1: 0.6737
 epoch: 92, train_loss: 0.4703, test_loss: 0.7894, test_f1: 0.6750
 epoch: 93, train_loss: 0.4635, test_loss: 0.7626, test_f1: 0.6898
 epoch: 94, train_loss: 0.4626, test_loss: 0.7921, test_f1: 0.6764
 epoch: 95, train_loss: 0.4556, test_loss: 0.8203, test_f1: 0.6814
 epoch: 96, train_loss: 0.4445, test_loss: 0.8144, test_f1: 0.6913
 epoch: 97, train_loss: 0.4571, test_loss: 0.8253, test_f1: 0.6851
 epoch: 98, train_loss: 0.4546, test_loss: 0.8160, test_f1: 0.6888
 epoch: 99, train_loss: 0.4486, test_loss: 0.8283, test_f1: 0.6792
##################ITERATION #5 ****************************************
 epoch: 0, train_loss: 1.1576, test_loss: 0.9500, test_f1: 0.4882
 epoch: 1, train_loss: 1.0198, test_loss: 0.9524, test_f1: 0.4858
 epoch: 2, train_loss: 0.9873, test_loss: 0.9392, test_f1: 0.5602
 epoch: 3, train_loss: 0.9656, test_loss: 0.9438, test_f1: 0.4958
 epoch: 4, train_loss: 0.9311, test_loss: 0.9255, test_f1: 0.5568
 epoch: 5, train_loss: 0.9268, test_loss: 0.9074, test_f1: 0.5363
 epoch: 6, train_loss: 0.8880, test_loss: 0.8866, test_f1: 0.5620
 epoch: 7, train_loss: 0.8768, test_loss: 0.8671, test_f1: 0.5651
 epoch: 8, train_loss: 0.8631, test_loss: 0.8749, test_f1: 0.5645
 epoch: 9, train_loss: 0.8408, test_loss: 0.8650, test_f1: 0.5639
 epoch: 10, train_loss: 0.8239, test_loss: 0.8387, test_f1: 0.5833
 epoch: 11, train_loss: 0.8223, test_loss: 0.8331, test_f1: 0.6009
 epoch: 12, train_loss: 0.7965, test_loss: 0.8123, test_f1: 0.6142
 epoch: 13, train_loss: 0.7930, test_loss: 0.8263, test_f1: 0.6188
 epoch: 14, train_loss: 0.7774, test_loss: 0.8310, test_f1: 0.5986
 epoch: 15, train_loss: 0.7762, test_loss: 0.8180, test_f1: 0.6239
 epoch: 16, train_loss: 0.7656, test_loss: 0.8016, test_f1: 0.6223
 epoch: 17, train_loss: 0.7500, test_loss: 0.8260, test_f1: 0.6184
 epoch: 18, train_loss: 0.7467, test_loss: 0.8293, test_f1: 0.6175
 epoch: 19, train_loss: 0.7365, test_loss: 0.8094, test_f1: 0.6131
 epoch: 20, train_loss: 0.7194, test_loss: 0.8275, test_f1: 0.6259
 epoch: 21, train_loss: 0.7245, test_loss: 0.8078, test_f1: 0.6073
 epoch: 22, train_loss: 0.7230, test_loss: 0.7998, test_f1: 0.6363
 epoch: 23, train_loss: 0.7116, test_loss: 0.8249, test_f1: 0.6326
 epoch: 24, train_loss: 0.6990, test_loss: 0.8266, test_f1: 0.6103
 epoch: 25, train_loss: 0.7013, test_loss: 0.7785, test_f1: 0.6417
 epoch: 26, train_loss: 0.6944, test_loss: 0.8321, test_f1: 0.6396
 epoch: 27, train_loss: 0.6870, test_loss: 0.8264, test_f1: 0.6219
 epoch: 28, train_loss: 0.6767, test_loss: 0.8224, test_f1: 0.6282
 epoch: 29, train_loss: 0.6694, test_loss: 0.8126, test_f1: 0.6690
 epoch: 30, train_loss: 0.6765, test_loss: 0.8239, test_f1: 0.6486
 epoch: 31, train_loss: 0.6616, test_loss: 0.8053, test_f1: 0.6412
 epoch: 32, train_loss: 0.6444, test_loss: 0.8023, test_f1: 0.6443
 epoch: 33, train_loss: 0.6566, test_loss: 0.8270, test_f1: 0.6238
 epoch: 34, train_loss: 0.6434, test_loss: 0.8179, test_f1: 0.6427
 epoch: 35, train_loss: 0.6526, test_loss: 0.8420, test_f1: 0.6424
 epoch: 36, train_loss: 0.6375, test_loss: 0.8059, test_f1: 0.6573
 epoch: 37, train_loss: 0.6355, test_loss: 0.7855, test_f1: 0.6776
 epoch: 38, train_loss: 0.6318, test_loss: 0.8173, test_f1: 0.6529
 epoch: 39, train_loss: 0.6275, test_loss: 0.8513, test_f1: 0.6461
 epoch: 40, train_loss: 0.6204, test_loss: 0.8228, test_f1: 0.6618
 epoch: 41, train_loss: 0.6134, test_loss: 0.8495, test_f1: 0.6471
 epoch: 42, train_loss: 0.6161, test_loss: 0.7694, test_f1: 0.6529
 epoch: 43, train_loss: 0.5945, test_loss: 0.8545, test_f1: 0.6491
 epoch: 44, train_loss: 0.5969, test_loss: 0.8594, test_f1: 0.6436
 epoch: 45, train_loss: 0.5947, test_loss: 0.8341, test_f1: 0.6581
 epoch: 46, train_loss: 0.5866, test_loss: 0.8276, test_f1: 0.6526
 epoch: 47, train_loss: 0.5835, test_loss: 0.8284, test_f1: 0.6438
 epoch: 48, train_loss: 0.5810, test_loss: 0.8458, test_f1: 0.6477
 epoch: 49, train_loss: 0.5795, test_loss: 0.8416, test_f1: 0.6488
 epoch: 50, train_loss: 0.5678, test_loss: 0.8085, test_f1: 0.6575
 epoch: 51, train_loss: 0.5649, test_loss: 0.8432, test_f1: 0.6377
 epoch: 52, train_loss: 0.5539, test_loss: 0.8311, test_f1: 0.6485
 epoch: 53, train_loss: 0.5437, test_loss: 0.8523, test_f1: 0.6441
 epoch: 54, train_loss: 0.5576, test_loss: 0.8436, test_f1: 0.6518
 epoch: 55, train_loss: 0.5385, test_loss: 0.8486, test_f1: 0.6359
 epoch: 56, train_loss: 0.5435, test_loss: 0.8876, test_f1: 0.6273
 epoch: 57, train_loss: 0.5324, test_loss: 0.9044, test_f1: 0.6541
 epoch: 58, train_loss: 0.5303, test_loss: 0.8824, test_f1: 0.6384
 epoch: 59, train_loss: 0.5371, test_loss: 0.8749, test_f1: 0.6330
 epoch: 60, train_loss: 0.5289, test_loss: 0.8757, test_f1: 0.6370
 epoch: 61, train_loss: 0.5230, test_loss: 0.8850, test_f1: 0.6501
 epoch: 62, train_loss: 0.5279, test_loss: 0.8689, test_f1: 0.6618
 epoch: 63, train_loss: 0.5230, test_loss: 0.8429, test_f1: 0.6548
 epoch: 64, train_loss: 0.5335, test_loss: 0.8942, test_f1: 0.6343
 epoch: 65, train_loss: 0.5269, test_loss: 0.8676, test_f1: 0.6324
 epoch: 66, train_loss: 0.5203, test_loss: 0.8575, test_f1: 0.6562
 epoch: 67, train_loss: 0.5222, test_loss: 0.9094, test_f1: 0.6351
 epoch: 68, train_loss: 0.5071, test_loss: 0.9105, test_f1: 0.6442
 epoch: 69, train_loss: 0.5030, test_loss: 0.8910, test_f1: 0.6277
 epoch: 70, train_loss: 0.5148, test_loss: 0.8975, test_f1: 0.6481
 epoch: 71, train_loss: 0.5022, test_loss: 0.8894, test_f1: 0.6523
 epoch: 72, train_loss: 0.5133, test_loss: 0.9290, test_f1: 0.6426
 epoch: 73, train_loss: 0.5160, test_loss: 0.8852, test_f1: 0.6519
 epoch: 74, train_loss: 0.5001, test_loss: 0.9078, test_f1: 0.6297
 epoch: 75, train_loss: 0.5049, test_loss: 0.9158, test_f1: 0.6351
 epoch: 76, train_loss: 0.5018, test_loss: 0.8844, test_f1: 0.6547
 epoch: 77, train_loss: 0.4975, test_loss: 0.8827, test_f1: 0.6340
 epoch: 78, train_loss: 0.4987, test_loss: 0.9181, test_f1: 0.6519
 epoch: 79, train_loss: 0.4835, test_loss: 0.8906, test_f1: 0.6589
 epoch: 80, train_loss: 0.5025, test_loss: 0.9368, test_f1: 0.6439
 epoch: 81, train_loss: 0.4797, test_loss: 0.9176, test_f1: 0.6414
 epoch: 82, train_loss: 0.4863, test_loss: 0.9034, test_f1: 0.6466
 epoch: 83, train_loss: 0.4833, test_loss: 0.8986, test_f1: 0.6421
 epoch: 84, train_loss: 0.4845, test_loss: 0.8930, test_f1: 0.6398
 epoch: 85, train_loss: 0.4726, test_loss: 0.9046, test_f1: 0.6538
 epoch: 86, train_loss: 0.4695, test_loss: 0.9455, test_f1: 0.6331
 epoch: 87, train_loss: 0.4770, test_loss: 0.9022, test_f1: 0.6627
 epoch: 88, train_loss: 0.4659, test_loss: 0.9323, test_f1: 0.6353
 epoch: 89, train_loss: 0.4746, test_loss: 0.9332, test_f1: 0.6467
 epoch: 90, train_loss: 0.4688, test_loss: 0.9411, test_f1: 0.6477
 epoch: 91, train_loss: 0.4735, test_loss: 0.9538, test_f1: 0.6382
 epoch: 92, train_loss: 0.4702, test_loss: 0.9484, test_f1: 0.6384
 epoch: 93, train_loss: 0.4659, test_loss: 0.9743, test_f1: 0.6339
 epoch: 94, train_loss: 0.4642, test_loss: 0.9971, test_f1: 0.6441
 epoch: 95, train_loss: 0.4679, test_loss: 0.9988, test_f1: 0.6337
 epoch: 96, train_loss: 0.4668, test_loss: 0.9211, test_f1: 0.6518
 epoch: 97, train_loss: 0.4547, test_loss: 0.9891, test_f1: 0.6423
 epoch: 98, train_loss: 0.4574, test_loss: 0.9394, test_f1: 0.6372
 epoch: 99, train_loss: 0.4451, test_loss: 0.9369, test_f1: 0.6401
##################ITERATION #6 ****************************************
 epoch: 0, train_loss: 1.2045, test_loss: 1.0063, test_f1: 0.5028
 epoch: 1, train_loss: 1.0680, test_loss: 0.9846, test_f1: 0.5142
 epoch: 2, train_loss: 1.0194, test_loss: 0.9689, test_f1: 0.5199
 epoch: 3, train_loss: 0.9764, test_loss: 0.9709, test_f1: 0.5039
 epoch: 4, train_loss: 0.9577, test_loss: 0.9562, test_f1: 0.5500
 epoch: 5, train_loss: 0.9420, test_loss: 0.9203, test_f1: 0.5594
 epoch: 6, train_loss: 0.9214, test_loss: 0.9065, test_f1: 0.5498
 epoch: 7, train_loss: 0.9027, test_loss: 0.9176, test_f1: 0.5477
 epoch: 8, train_loss: 0.8866, test_loss: 0.8804, test_f1: 0.5486
 epoch: 9, train_loss: 0.8790, test_loss: 0.8564, test_f1: 0.5677
 epoch: 10, train_loss: 0.8605, test_loss: 0.8578, test_f1: 0.5914
 epoch: 11, train_loss: 0.8443, test_loss: 0.8240, test_f1: 0.6127
 epoch: 12, train_loss: 0.8243, test_loss: 0.8534, test_f1: 0.6056
 epoch: 13, train_loss: 0.8214, test_loss: 0.8613, test_f1: 0.6008
 epoch: 14, train_loss: 0.8116, test_loss: 0.8339, test_f1: 0.6125
 epoch: 15, train_loss: 0.8110, test_loss: 0.8361, test_f1: 0.6136
 epoch: 16, train_loss: 0.7798, test_loss: 0.8126, test_f1: 0.6202
 epoch: 17, train_loss: 0.7837, test_loss: 0.8132, test_f1: 0.6164
 epoch: 18, train_loss: 0.7665, test_loss: 0.8029, test_f1: 0.6345
 epoch: 19, train_loss: 0.7592, test_loss: 0.7692, test_f1: 0.6207
 epoch: 20, train_loss: 0.7548, test_loss: 0.7987, test_f1: 0.6285
 epoch: 21, train_loss: 0.7464, test_loss: 0.8376, test_f1: 0.6256
 epoch: 22, train_loss: 0.7384, test_loss: 0.8043, test_f1: 0.6195
 epoch: 23, train_loss: 0.7267, test_loss: 0.7888, test_f1: 0.6287
 epoch: 24, train_loss: 0.7184, test_loss: 0.7975, test_f1: 0.6276
 epoch: 25, train_loss: 0.7099, test_loss: 0.7707, test_f1: 0.6321
 epoch: 26, train_loss: 0.7106, test_loss: 0.7574, test_f1: 0.6452
 epoch: 27, train_loss: 0.6867, test_loss: 0.8059, test_f1: 0.6285
 epoch: 28, train_loss: 0.6971, test_loss: 0.8290, test_f1: 0.6392
 epoch: 29, train_loss: 0.6748, test_loss: 0.7833, test_f1: 0.6393
 epoch: 30, train_loss: 0.6975, test_loss: 0.8175, test_f1: 0.6521
 epoch: 31, train_loss: 0.6831, test_loss: 0.8239, test_f1: 0.6354
 epoch: 32, train_loss: 0.6599, test_loss: 0.7978, test_f1: 0.6230
 epoch: 33, train_loss: 0.6574, test_loss: 0.7859, test_f1: 0.6377
 epoch: 34, train_loss: 0.6491, test_loss: 0.7915, test_f1: 0.6473
 epoch: 35, train_loss: 0.6494, test_loss: 0.8365, test_f1: 0.6487
 epoch: 36, train_loss: 0.6551, test_loss: 0.8609, test_f1: 0.6512
 epoch: 37, train_loss: 0.6362, test_loss: 0.7440, test_f1: 0.6341
 epoch: 38, train_loss: 0.6272, test_loss: 0.8038, test_f1: 0.6367
 epoch: 39, train_loss: 0.6214, test_loss: 0.7889, test_f1: 0.6552
 epoch: 40, train_loss: 0.6178, test_loss: 0.8109, test_f1: 0.6819
 epoch: 41, train_loss: 0.6116, test_loss: 0.7952, test_f1: 0.6497
 epoch: 42, train_loss: 0.6068, test_loss: 0.8160, test_f1: 0.6592
 epoch: 43, train_loss: 0.6006, test_loss: 0.8331, test_f1: 0.6560
 epoch: 44, train_loss: 0.6090, test_loss: 0.8170, test_f1: 0.6414
 epoch: 45, train_loss: 0.6016, test_loss: 0.8003, test_f1: 0.6570
 epoch: 46, train_loss: 0.5881, test_loss: 0.7798, test_f1: 0.6654
 epoch: 47, train_loss: 0.5826, test_loss: 0.8325, test_f1: 0.6624
 epoch: 48, train_loss: 0.5859, test_loss: 0.8074, test_f1: 0.6605
 epoch: 49, train_loss: 0.5949, test_loss: 0.8237, test_f1: 0.6581
 epoch: 50, train_loss: 0.5629, test_loss: 0.8201, test_f1: 0.6636
 epoch: 51, train_loss: 0.5627, test_loss: 0.8047, test_f1: 0.6571
 epoch: 52, train_loss: 0.5498, test_loss: 0.8299, test_f1: 0.6614
 epoch: 53, train_loss: 0.5593, test_loss: 0.8056, test_f1: 0.6524
 epoch: 54, train_loss: 0.5531, test_loss: 0.8199, test_f1: 0.6656
 epoch: 55, train_loss: 0.5456, test_loss: 0.8373, test_f1: 0.6433
 epoch: 56, train_loss: 0.5331, test_loss: 0.7815, test_f1: 0.6512
 epoch: 57, train_loss: 0.5423, test_loss: 0.7896, test_f1: 0.6605
 epoch: 58, train_loss: 0.5299, test_loss: 0.7803, test_f1: 0.6645
 epoch: 59, train_loss: 0.5394, test_loss: 0.8053, test_f1: 0.6710
 epoch: 60, train_loss: 0.5255, test_loss: 0.8243, test_f1: 0.6626
 epoch: 61, train_loss: 0.5293, test_loss: 0.8202, test_f1: 0.6536
 epoch: 62, train_loss: 0.5163, test_loss: 0.8214, test_f1: 0.6722
 epoch: 63, train_loss: 0.5298, test_loss: 0.8500, test_f1: 0.6578
 epoch: 64, train_loss: 0.5103, test_loss: 0.8344, test_f1: 0.6774
 epoch: 65, train_loss: 0.5162, test_loss: 0.7854, test_f1: 0.6944
 epoch: 66, train_loss: 0.5088, test_loss: 0.8263, test_f1: 0.6584
 epoch: 67, train_loss: 0.5187, test_loss: 0.8409, test_f1: 0.6698
 epoch: 68, train_loss: 0.5155, test_loss: 0.8322, test_f1: 0.6524
 epoch: 69, train_loss: 0.5008, test_loss: 0.8090, test_f1: 0.6703
 epoch: 70, train_loss: 0.5024, test_loss: 0.7742, test_f1: 0.6812
 epoch: 71, train_loss: 0.5120, test_loss: 0.8290, test_f1: 0.6840
 epoch: 72, train_loss: 0.4930, test_loss: 0.8122, test_f1: 0.6505
 epoch: 73, train_loss: 0.4997, test_loss: 0.8060, test_f1: 0.6644
 epoch: 74, train_loss: 0.4998, test_loss: 0.7968, test_f1: 0.6600
 epoch: 75, train_loss: 0.4973, test_loss: 0.8324, test_f1: 0.6566
 epoch: 76, train_loss: 0.4993, test_loss: 0.8190, test_f1: 0.6612
 epoch: 77, train_loss: 0.4813, test_loss: 0.8332, test_f1: 0.6705
 epoch: 78, train_loss: 0.4926, test_loss: 0.8196, test_f1: 0.6660
 epoch: 79, train_loss: 0.5026, test_loss: 0.8049, test_f1: 0.6623
 epoch: 80, train_loss: 0.4720, test_loss: 0.8294, test_f1: 0.6844
 epoch: 81, train_loss: 0.4708, test_loss: 0.8308, test_f1: 0.6483
 epoch: 82, train_loss: 0.4720, test_loss: 0.7705, test_f1: 0.6722
 epoch: 83, train_loss: 0.4707, test_loss: 0.8416, test_f1: 0.6578
 epoch: 84, train_loss: 0.4737, test_loss: 0.8177, test_f1: 0.6433
 epoch: 85, train_loss: 0.4782, test_loss: 0.8070, test_f1: 0.6560
 epoch: 86, train_loss: 0.4612, test_loss: 0.8362, test_f1: 0.6811
 epoch: 87, train_loss: 0.4756, test_loss: 0.8421, test_f1: 0.6506
 epoch: 88, train_loss: 0.4667, test_loss: 0.8890, test_f1: 0.6684
 epoch: 89, train_loss: 0.4595, test_loss: 0.8477, test_f1: 0.6577
 epoch: 90, train_loss: 0.4524, test_loss: 0.8430, test_f1: 0.6745
 epoch: 91, train_loss: 0.4678, test_loss: 0.8641, test_f1: 0.6490
 epoch: 92, train_loss: 0.4609, test_loss: 0.8662, test_f1: 0.6835
 epoch: 93, train_loss: 0.4690, test_loss: 0.8750, test_f1: 0.6707
 epoch: 94, train_loss: 0.4574, test_loss: 0.8578, test_f1: 0.6903
 epoch: 95, train_loss: 0.4481, test_loss: 0.8666, test_f1: 0.6908
 epoch: 96, train_loss: 0.4475, test_loss: 0.8439, test_f1: 0.6788
 epoch: 97, train_loss: 0.4523, test_loss: 0.8849, test_f1: 0.6707
 epoch: 98, train_loss: 0.4421, test_loss: 0.8377, test_f1: 0.6727
 epoch: 99, train_loss: 0.4536, test_loss: 0.8291, test_f1: 0.6788
##################ITERATION #7 ****************************************
 epoch: 0, train_loss: 1.1573, test_loss: 0.9811, test_f1: 0.4623
 epoch: 1, train_loss: 1.0357, test_loss: 0.9402, test_f1: 0.5188
 epoch: 2, train_loss: 0.9787, test_loss: 0.9518, test_f1: 0.5090
 epoch: 3, train_loss: 0.9604, test_loss: 0.9199, test_f1: 0.5439
 epoch: 4, train_loss: 0.9322, test_loss: 0.9244, test_f1: 0.5178
 epoch: 5, train_loss: 0.9133, test_loss: 0.9277, test_f1: 0.5495
 epoch: 6, train_loss: 0.9021, test_loss: 0.9065, test_f1: 0.5508
 epoch: 7, train_loss: 0.8744, test_loss: 0.8960, test_f1: 0.5421
 epoch: 8, train_loss: 0.8652, test_loss: 0.9239, test_f1: 0.5401
 epoch: 9, train_loss: 0.8500, test_loss: 0.8966, test_f1: 0.5314
 epoch: 10, train_loss: 0.8374, test_loss: 0.9066, test_f1: 0.5807
 epoch: 11, train_loss: 0.8163, test_loss: 0.8952, test_f1: 0.5670
 epoch: 12, train_loss: 0.8212, test_loss: 0.8941, test_f1: 0.5780
 epoch: 13, train_loss: 0.8102, test_loss: 0.8727, test_f1: 0.5650
 epoch: 14, train_loss: 0.8002, test_loss: 0.8938, test_f1: 0.5866
 epoch: 15, train_loss: 0.7886, test_loss: 0.8980, test_f1: 0.5979
 epoch: 16, train_loss: 0.7738, test_loss: 0.8982, test_f1: 0.5906
 epoch: 17, train_loss: 0.7628, test_loss: 0.9157, test_f1: 0.5682
 epoch: 18, train_loss: 0.7598, test_loss: 0.8564, test_f1: 0.5840
 epoch: 19, train_loss: 0.7467, test_loss: 0.8785, test_f1: 0.5704
 epoch: 20, train_loss: 0.7399, test_loss: 0.8761, test_f1: 0.5917
 epoch: 21, train_loss: 0.7359, test_loss: 0.8622, test_f1: 0.6047
 epoch: 22, train_loss: 0.7245, test_loss: 0.8696, test_f1: 0.6350
 epoch: 23, train_loss: 0.7287, test_loss: 0.8372, test_f1: 0.6308
 epoch: 24, train_loss: 0.7099, test_loss: 0.8836, test_f1: 0.6072
 epoch: 25, train_loss: 0.7041, test_loss: 0.8402, test_f1: 0.6382
 epoch: 26, train_loss: 0.6961, test_loss: 0.8605, test_f1: 0.6251
 epoch: 27, train_loss: 0.6843, test_loss: 0.8203, test_f1: 0.6350
 epoch: 28, train_loss: 0.6684, test_loss: 0.8052, test_f1: 0.6495
 epoch: 29, train_loss: 0.6613, test_loss: 0.8142, test_f1: 0.6269
 epoch: 30, train_loss: 0.6749, test_loss: 0.8996, test_f1: 0.6385
 epoch: 31, train_loss: 0.6648, test_loss: 0.8304, test_f1: 0.6514
 epoch: 32, train_loss: 0.6742, test_loss: 0.8721, test_f1: 0.6366
 epoch: 33, train_loss: 0.6421, test_loss: 0.8501, test_f1: 0.6277
 epoch: 34, train_loss: 0.6358, test_loss: 0.8280, test_f1: 0.6471
 epoch: 35, train_loss: 0.6350, test_loss: 0.8429, test_f1: 0.6440
 epoch: 36, train_loss: 0.6214, test_loss: 0.8394, test_f1: 0.6488
 epoch: 37, train_loss: 0.6304, test_loss: 0.8352, test_f1: 0.6542
 epoch: 38, train_loss: 0.6318, test_loss: 0.8336, test_f1: 0.6576
 epoch: 39, train_loss: 0.6146, test_loss: 0.7951, test_f1: 0.6604
 epoch: 40, train_loss: 0.6114, test_loss: 0.8484, test_f1: 0.6518
 epoch: 41, train_loss: 0.6203, test_loss: 0.8125, test_f1: 0.6747
 epoch: 42, train_loss: 0.6060, test_loss: 0.8526, test_f1: 0.6473
 epoch: 43, train_loss: 0.6112, test_loss: 0.8279, test_f1: 0.6668
 epoch: 44, train_loss: 0.5907, test_loss: 0.8458, test_f1: 0.6543
 epoch: 45, train_loss: 0.5789, test_loss: 0.8504, test_f1: 0.6623
 epoch: 46, train_loss: 0.5752, test_loss: 0.8190, test_f1: 0.6845
 epoch: 47, train_loss: 0.5902, test_loss: 0.8909, test_f1: 0.6600
 epoch: 48, train_loss: 0.5738, test_loss: 0.8620, test_f1: 0.6382
 epoch: 49, train_loss: 0.5768, test_loss: 0.8925, test_f1: 0.6344
 epoch: 50, train_loss: 0.5533, test_loss: 0.8701, test_f1: 0.6467
 epoch: 51, train_loss: 0.5478, test_loss: 0.8664, test_f1: 0.6500
 epoch: 52, train_loss: 0.5469, test_loss: 0.8140, test_f1: 0.6639
 epoch: 53, train_loss: 0.5401, test_loss: 0.8462, test_f1: 0.6702
 epoch: 54, train_loss: 0.5478, test_loss: 0.8270, test_f1: 0.6676
 epoch: 55, train_loss: 0.5219, test_loss: 0.8418, test_f1: 0.6533
 epoch: 56, train_loss: 0.5245, test_loss: 0.8628, test_f1: 0.6641
 epoch: 57, train_loss: 0.5374, test_loss: 0.8659, test_f1: 0.6554
 epoch: 58, train_loss: 0.5351, test_loss: 0.8791, test_f1: 0.6573
 epoch: 59, train_loss: 0.5314, test_loss: 0.8210, test_f1: 0.6865
 epoch: 60, train_loss: 0.5216, test_loss: 0.8477, test_f1: 0.6716
 epoch: 61, train_loss: 0.5100, test_loss: 0.8580, test_f1: 0.6636
 epoch: 62, train_loss: 0.5142, test_loss: 0.8864, test_f1: 0.6662
 epoch: 63, train_loss: 0.5188, test_loss: 0.8929, test_f1: 0.6655
 epoch: 64, train_loss: 0.5096, test_loss: 0.8579, test_f1: 0.6718
 epoch: 65, train_loss: 0.5121, test_loss: 0.8926, test_f1: 0.6668
 epoch: 66, train_loss: 0.4968, test_loss: 0.8804, test_f1: 0.6639
 epoch: 67, train_loss: 0.5054, test_loss: 0.9051, test_f1: 0.6534
 epoch: 68, train_loss: 0.4954, test_loss: 0.8741, test_f1: 0.6590
 epoch: 69, train_loss: 0.5002, test_loss: 0.8763, test_f1: 0.6660
 epoch: 70, train_loss: 0.5100, test_loss: 0.8746, test_f1: 0.6675
 epoch: 71, train_loss: 0.5008, test_loss: 0.8889, test_f1: 0.6612
 epoch: 72, train_loss: 0.4872, test_loss: 0.8957, test_f1: 0.6789
 epoch: 73, train_loss: 0.4908, test_loss: 0.8656, test_f1: 0.6816
 epoch: 74, train_loss: 0.4910, test_loss: 0.9006, test_f1: 0.6597
 epoch: 75, train_loss: 0.4998, test_loss: 0.8725, test_f1: 0.6634
 epoch: 76, train_loss: 0.4890, test_loss: 0.9457, test_f1: 0.6472
 epoch: 77, train_loss: 0.4883, test_loss: 0.9228, test_f1: 0.6581
 epoch: 78, train_loss: 0.4830, test_loss: 0.9453, test_f1: 0.6534
 epoch: 79, train_loss: 0.4974, test_loss: 0.8975, test_f1: 0.6866
 epoch: 80, train_loss: 0.4754, test_loss: 0.9074, test_f1: 0.6708
 epoch: 81, train_loss: 0.4932, test_loss: 0.9008, test_f1: 0.6617
 epoch: 82, train_loss: 0.4741, test_loss: 0.9437, test_f1: 0.6422
 epoch: 83, train_loss: 0.4760, test_loss: 0.9388, test_f1: 0.6573
 epoch: 84, train_loss: 0.4659, test_loss: 0.8536, test_f1: 0.6822
 epoch: 85, train_loss: 0.4670, test_loss: 0.9319, test_f1: 0.6675
 epoch: 86, train_loss: 0.4627, test_loss: 0.9493, test_f1: 0.6600
 epoch: 87, train_loss: 0.4639, test_loss: 0.9042, test_f1: 0.6684
 epoch: 88, train_loss: 0.4595, test_loss: 0.9913, test_f1: 0.6496
 epoch: 89, train_loss: 0.4633, test_loss: 0.9321, test_f1: 0.6558
 epoch: 90, train_loss: 0.4737, test_loss: 0.9103, test_f1: 0.6629
 epoch: 91, train_loss: 0.4573, test_loss: 0.9793, test_f1: 0.6866
 epoch: 92, train_loss: 0.4529, test_loss: 0.9101, test_f1: 0.7079
 epoch: 93, train_loss: 0.4602, test_loss: 0.8982, test_f1: 0.6914
 epoch: 94, train_loss: 0.4558, test_loss: 0.9466, test_f1: 0.6559
 epoch: 95, train_loss: 0.4426, test_loss: 0.9640, test_f1: 0.6587
 epoch: 96, train_loss: 0.4498, test_loss: 0.9283, test_f1: 0.6727
 epoch: 97, train_loss: 0.4525, test_loss: 0.9527, test_f1: 0.6718
 epoch: 98, train_loss: 0.4511, test_loss: 0.9399, test_f1: 0.6677
 epoch: 99, train_loss: 0.4387, test_loss: 1.0539, test_f1: 0.6528
##################ITERATION #8 ****************************************
 epoch: 0, train_loss: 1.2036, test_loss: 1.0316, test_f1: 0.4558
 epoch: 1, train_loss: 1.0652, test_loss: 0.9708, test_f1: 0.4678
 epoch: 2, train_loss: 1.0208, test_loss: 0.9519, test_f1: 0.4984
 epoch: 3, train_loss: 0.9991, test_loss: 0.9239, test_f1: 0.5353
 epoch: 4, train_loss: 0.9518, test_loss: 0.9360, test_f1: 0.5029
 epoch: 5, train_loss: 0.9491, test_loss: 0.8977, test_f1: 0.5446
 epoch: 6, train_loss: 0.9326, test_loss: 0.8992, test_f1: 0.5276
 epoch: 7, train_loss: 0.9089, test_loss: 0.8646, test_f1: 0.5578
 epoch: 8, train_loss: 0.8952, test_loss: 0.8809, test_f1: 0.5634
 epoch: 9, train_loss: 0.8761, test_loss: 0.8590, test_f1: 0.5610
 epoch: 10, train_loss: 0.8597, test_loss: 0.8718, test_f1: 0.5957
 epoch: 11, train_loss: 0.8508, test_loss: 0.8995, test_f1: 0.5582
 epoch: 12, train_loss: 0.8519, test_loss: 0.8889, test_f1: 0.5615
 epoch: 13, train_loss: 0.8307, test_loss: 0.8457, test_f1: 0.5977
 epoch: 14, train_loss: 0.8200, test_loss: 0.8699, test_f1: 0.6022
 epoch: 15, train_loss: 0.8136, test_loss: 0.8730, test_f1: 0.5953
 epoch: 16, train_loss: 0.7971, test_loss: 0.8891, test_f1: 0.5919
 epoch: 17, train_loss: 0.7963, test_loss: 0.8178, test_f1: 0.5946
 epoch: 18, train_loss: 0.7752, test_loss: 0.8068, test_f1: 0.6052
 epoch: 19, train_loss: 0.7733, test_loss: 0.8526, test_f1: 0.5864
 epoch: 20, train_loss: 0.7733, test_loss: 0.8423, test_f1: 0.5751
 epoch: 21, train_loss: 0.7616, test_loss: 0.8744, test_f1: 0.5936
 epoch: 22, train_loss: 0.7581, test_loss: 0.8055, test_f1: 0.6299
 epoch: 23, train_loss: 0.7488, test_loss: 0.8224, test_f1: 0.6268
 epoch: 24, train_loss: 0.7484, test_loss: 0.8457, test_f1: 0.6125
 epoch: 25, train_loss: 0.7369, test_loss: 0.9022, test_f1: 0.6034
 epoch: 26, train_loss: 0.7303, test_loss: 0.8003, test_f1: 0.6286
 epoch: 27, train_loss: 0.7252, test_loss: 0.8261, test_f1: 0.5928
 epoch: 28, train_loss: 0.7170, test_loss: 0.8033, test_f1: 0.6135
 epoch: 29, train_loss: 0.7033, test_loss: 0.9050, test_f1: 0.5951
 epoch: 30, train_loss: 0.7170, test_loss: 0.8310, test_f1: 0.5991
 epoch: 31, train_loss: 0.6962, test_loss: 0.8029, test_f1: 0.6118
 epoch: 32, train_loss: 0.6993, test_loss: 0.8095, test_f1: 0.6149
 epoch: 33, train_loss: 0.6858, test_loss: 0.7713, test_f1: 0.6281
 epoch: 34, train_loss: 0.6877, test_loss: 0.8245, test_f1: 0.6246
 epoch: 35, train_loss: 0.6747, test_loss: 0.8251, test_f1: 0.6083
 epoch: 36, train_loss: 0.6762, test_loss: 0.7773, test_f1: 0.6245
 epoch: 37, train_loss: 0.6722, test_loss: 0.8357, test_f1: 0.6301
 epoch: 38, train_loss: 0.6748, test_loss: 0.8540, test_f1: 0.5715
 epoch: 39, train_loss: 0.6664, test_loss: 0.8069, test_f1: 0.6223
 epoch: 40, train_loss: 0.6412, test_loss: 0.7661, test_f1: 0.6485
 epoch: 41, train_loss: 0.6485, test_loss: 0.8602, test_f1: 0.6024
 epoch: 42, train_loss: 0.6486, test_loss: 0.7956, test_f1: 0.6310
 epoch: 43, train_loss: 0.6348, test_loss: 0.8002, test_f1: 0.6392
 epoch: 44, train_loss: 0.6356, test_loss: 0.7718, test_f1: 0.6008
 epoch: 45, train_loss: 0.6200, test_loss: 0.7547, test_f1: 0.6424
 epoch: 46, train_loss: 0.6196, test_loss: 0.7684, test_f1: 0.6499
 epoch: 47, train_loss: 0.6250, test_loss: 0.8356, test_f1: 0.5991
 epoch: 48, train_loss: 0.6200, test_loss: 0.8110, test_f1: 0.6111
 epoch: 49, train_loss: 0.6133, test_loss: 0.7638, test_f1: 0.6383
 epoch: 50, train_loss: 0.6161, test_loss: 0.8744, test_f1: 0.6101
 epoch: 51, train_loss: 0.5828, test_loss: 0.7416, test_f1: 0.6509
 epoch: 52, train_loss: 0.5790, test_loss: 0.7910, test_f1: 0.6244
 epoch: 53, train_loss: 0.5868, test_loss: 0.7841, test_f1: 0.6066
 epoch: 54, train_loss: 0.5899, test_loss: 0.7710, test_f1: 0.6223
 epoch: 55, train_loss: 0.5832, test_loss: 0.7609, test_f1: 0.6405
 epoch: 56, train_loss: 0.5831, test_loss: 0.7685, test_f1: 0.6301
 epoch: 57, train_loss: 0.5674, test_loss: 0.8267, test_f1: 0.6225
 epoch: 58, train_loss: 0.5684, test_loss: 0.7939, test_f1: 0.6135
 epoch: 59, train_loss: 0.5764, test_loss: 0.7990, test_f1: 0.6590
 epoch: 60, train_loss: 0.5701, test_loss: 0.8053, test_f1: 0.6053
 epoch: 61, train_loss: 0.5722, test_loss: 0.7820, test_f1: 0.6331
 epoch: 62, train_loss: 0.5565, test_loss: 0.7543, test_f1: 0.6660
 epoch: 63, train_loss: 0.5425, test_loss: 0.7805, test_f1: 0.6124
 epoch: 64, train_loss: 0.5527, test_loss: 0.7736, test_f1: 0.6265
 epoch: 65, train_loss: 0.5546, test_loss: 0.7530, test_f1: 0.6397
 epoch: 66, train_loss: 0.5515, test_loss: 0.7865, test_f1: 0.6294
 epoch: 67, train_loss: 0.5307, test_loss: 0.7946, test_f1: 0.6397
 epoch: 68, train_loss: 0.5534, test_loss: 0.7925, test_f1: 0.6468
 epoch: 69, train_loss: 0.5300, test_loss: 0.7732, test_f1: 0.6523
 epoch: 70, train_loss: 0.5408, test_loss: 0.7553, test_f1: 0.6693
 epoch: 71, train_loss: 0.5332, test_loss: 0.8144, test_f1: 0.6544
 epoch: 72, train_loss: 0.5241, test_loss: 0.7647, test_f1: 0.6511
 epoch: 73, train_loss: 0.5229, test_loss: 0.8050, test_f1: 0.6618
 epoch: 74, train_loss: 0.5274, test_loss: 0.7967, test_f1: 0.6474
 epoch: 75, train_loss: 0.5360, test_loss: 0.8512, test_f1: 0.6256
 epoch: 76, train_loss: 0.5272, test_loss: 0.8137, test_f1: 0.6228
 epoch: 77, train_loss: 0.5202, test_loss: 0.8180, test_f1: 0.6323
 epoch: 78, train_loss: 0.5189, test_loss: 0.8036, test_f1: 0.6357
 epoch: 79, train_loss: 0.5189, test_loss: 0.8353, test_f1: 0.6381
 epoch: 80, train_loss: 0.4996, test_loss: 0.8121, test_f1: 0.6399
 epoch: 81, train_loss: 0.5178, test_loss: 0.8384, test_f1: 0.6428
 epoch: 82, train_loss: 0.5138, test_loss: 0.8390, test_f1: 0.6409
 epoch: 83, train_loss: 0.5175, test_loss: 0.8538, test_f1: 0.6156
 epoch: 84, train_loss: 0.5149, test_loss: 0.8186, test_f1: 0.6618
 epoch: 85, train_loss: 0.5037, test_loss: 0.7899, test_f1: 0.6600
 epoch: 86, train_loss: 0.5137, test_loss: 0.7873, test_f1: 0.6560
 epoch: 87, train_loss: 0.5065, test_loss: 0.8182, test_f1: 0.6301
 epoch: 88, train_loss: 0.5032, test_loss: 0.8879, test_f1: 0.6476
 epoch: 89, train_loss: 0.5105, test_loss: 0.7949, test_f1: 0.6709
 epoch: 90, train_loss: 0.4888, test_loss: 0.8150, test_f1: 0.6638
 epoch: 91, train_loss: 0.5008, test_loss: 0.8398, test_f1: 0.6374
 epoch: 92, train_loss: 0.4861, test_loss: 0.8142, test_f1: 0.6764
 epoch: 93, train_loss: 0.5029, test_loss: 0.8825, test_f1: 0.6362
 epoch: 94, train_loss: 0.4915, test_loss: 0.8766, test_f1: 0.6576
 epoch: 95, train_loss: 0.4835, test_loss: 0.8959, test_f1: 0.6400
 epoch: 96, train_loss: 0.4789, test_loss: 0.9925, test_f1: 0.6193
 epoch: 97, train_loss: 0.5014, test_loss: 0.8317, test_f1: 0.6700
 epoch: 98, train_loss: 0.4792, test_loss: 0.8570, test_f1: 0.6238
 epoch: 99, train_loss: 0.4857, test_loss: 0.8643, test_f1: 0.6527
##################ITERATION #9 ****************************************
 epoch: 0, train_loss: 1.2526, test_loss: 1.0124, test_f1: 0.4843
 epoch: 1, train_loss: 1.0774, test_loss: 0.9913, test_f1: 0.5030
 epoch: 2, train_loss: 1.0085, test_loss: 0.9416, test_f1: 0.5195
 epoch: 3, train_loss: 0.9796, test_loss: 0.9184, test_f1: 0.5335
 epoch: 4, train_loss: 0.9600, test_loss: 0.9169, test_f1: 0.5508
 epoch: 5, train_loss: 0.9565, test_loss: 0.8952, test_f1: 0.5252
 epoch: 6, train_loss: 0.9258, test_loss: 0.8754, test_f1: 0.5581
 epoch: 7, train_loss: 0.9089, test_loss: 0.8691, test_f1: 0.5217
 epoch: 8, train_loss: 0.8854, test_loss: 0.8838, test_f1: 0.5441
 epoch: 9, train_loss: 0.8743, test_loss: 0.8431, test_f1: 0.5700
 epoch: 10, train_loss: 0.8615, test_loss: 0.8359, test_f1: 0.5564
 epoch: 11, train_loss: 0.8473, test_loss: 0.8512, test_f1: 0.5645
 epoch: 12, train_loss: 0.8316, test_loss: 0.8570, test_f1: 0.5679
 epoch: 13, train_loss: 0.8221, test_loss: 0.8565, test_f1: 0.6012
 epoch: 14, train_loss: 0.8161, test_loss: 0.8547, test_f1: 0.6054
 epoch: 15, train_loss: 0.7949, test_loss: 0.8116, test_f1: 0.5946
 epoch: 16, train_loss: 0.7924, test_loss: 0.8381, test_f1: 0.5817
 epoch: 17, train_loss: 0.7915, test_loss: 0.8179, test_f1: 0.5741
 epoch: 18, train_loss: 0.7840, test_loss: 0.8029, test_f1: 0.6360
 epoch: 19, train_loss: 0.7663, test_loss: 0.8317, test_f1: 0.6234
 epoch: 20, train_loss: 0.7710, test_loss: 0.8206, test_f1: 0.6288
 epoch: 21, train_loss: 0.7495, test_loss: 0.8096, test_f1: 0.6365
 epoch: 22, train_loss: 0.7373, test_loss: 0.8697, test_f1: 0.6054
 epoch: 23, train_loss: 0.7424, test_loss: 0.8144, test_f1: 0.6355
 epoch: 24, train_loss: 0.7341, test_loss: 0.8096, test_f1: 0.6268
 epoch: 25, train_loss: 0.7317, test_loss: 0.8059, test_f1: 0.6191
 epoch: 26, train_loss: 0.7221, test_loss: 0.8243, test_f1: 0.6319
 epoch: 27, train_loss: 0.7164, test_loss: 0.8070, test_f1: 0.6419
 epoch: 28, train_loss: 0.7103, test_loss: 0.8154, test_f1: 0.6387
 epoch: 29, train_loss: 0.7124, test_loss: 0.8649, test_f1: 0.6144
 epoch: 30, train_loss: 0.6975, test_loss: 0.8147, test_f1: 0.6550
 epoch: 31, train_loss: 0.6883, test_loss: 0.8295, test_f1: 0.6221
 epoch: 32, train_loss: 0.6884, test_loss: 0.8188, test_f1: 0.6337
 epoch: 33, train_loss: 0.6904, test_loss: 0.8124, test_f1: 0.6353
 epoch: 34, train_loss: 0.6767, test_loss: 0.8567, test_f1: 0.6381
 epoch: 35, train_loss: 0.6549, test_loss: 0.8161, test_f1: 0.6511
 epoch: 36, train_loss: 0.6655, test_loss: 0.8182, test_f1: 0.6327
 epoch: 37, train_loss: 0.6670, test_loss: 0.8410, test_f1: 0.6297
 epoch: 38, train_loss: 0.6533, test_loss: 0.8492, test_f1: 0.6345
 epoch: 39, train_loss: 0.6440, test_loss: 0.8280, test_f1: 0.6629
 epoch: 40, train_loss: 0.6447, test_loss: 0.8672, test_f1: 0.6306
 epoch: 41, train_loss: 0.6327, test_loss: 0.8584, test_f1: 0.6293
 epoch: 42, train_loss: 0.6430, test_loss: 0.7927, test_f1: 0.6534
 epoch: 43, train_loss: 0.6375, test_loss: 0.8459, test_f1: 0.6321
 epoch: 44, train_loss: 0.6199, test_loss: 0.8099, test_f1: 0.6511
 epoch: 45, train_loss: 0.6096, test_loss: 0.8605, test_f1: 0.6361
 epoch: 46, train_loss: 0.6093, test_loss: 0.8710, test_f1: 0.6491
 epoch: 47, train_loss: 0.5989, test_loss: 0.8752, test_f1: 0.5942
 epoch: 48, train_loss: 0.6084, test_loss: 0.8882, test_f1: 0.6162
 epoch: 49, train_loss: 0.5960, test_loss: 0.8665, test_f1: 0.6325
 epoch: 50, train_loss: 0.5956, test_loss: 0.8633, test_f1: 0.6425
 epoch: 51, train_loss: 0.5720, test_loss: 0.8466, test_f1: 0.6505
 epoch: 52, train_loss: 0.5714, test_loss: 0.8330, test_f1: 0.6521
 epoch: 53, train_loss: 0.5573, test_loss: 0.8508, test_f1: 0.6333
 epoch: 54, train_loss: 0.5646, test_loss: 0.8843, test_f1: 0.6494
 epoch: 55, train_loss: 0.5640, test_loss: 0.8670, test_f1: 0.6406
 epoch: 56, train_loss: 0.5598, test_loss: 0.8443, test_f1: 0.6371
 epoch: 57, train_loss: 0.5543, test_loss: 0.8357, test_f1: 0.6437
 epoch: 58, train_loss: 0.5614, test_loss: 0.8561, test_f1: 0.6406
 epoch: 59, train_loss: 0.5598, test_loss: 0.8693, test_f1: 0.6457
 epoch: 60, train_loss: 0.5567, test_loss: 0.8692, test_f1: 0.6379
 epoch: 61, train_loss: 0.5460, test_loss: 0.8744, test_f1: 0.6280
 epoch: 62, train_loss: 0.5415, test_loss: 0.8756, test_f1: 0.6433
 epoch: 63, train_loss: 0.5411, test_loss: 0.8836, test_f1: 0.6203
 epoch: 64, train_loss: 0.5459, test_loss: 0.8677, test_f1: 0.6285
 epoch: 65, train_loss: 0.5427, test_loss: 0.8918, test_f1: 0.6280
 epoch: 66, train_loss: 0.5398, test_loss: 0.8590, test_f1: 0.6505
 epoch: 67, train_loss: 0.5347, test_loss: 0.8500, test_f1: 0.6404
 epoch: 68, train_loss: 0.5377, test_loss: 0.8932, test_f1: 0.6469
 epoch: 69, train_loss: 0.5255, test_loss: 0.8869, test_f1: 0.6298
 epoch: 70, train_loss: 0.5206, test_loss: 0.9032, test_f1: 0.6298
 epoch: 71, train_loss: 0.5282, test_loss: 0.9057, test_f1: 0.6329
 epoch: 72, train_loss: 0.5154, test_loss: 0.8861, test_f1: 0.6548
 epoch: 73, train_loss: 0.5197, test_loss: 0.9277, test_f1: 0.6305
 epoch: 74, train_loss: 0.5196, test_loss: 0.8890, test_f1: 0.6441
 epoch: 75, train_loss: 0.5168, test_loss: 0.8925, test_f1: 0.6480
 epoch: 76, train_loss: 0.5227, test_loss: 0.9318, test_f1: 0.6511
 epoch: 77, train_loss: 0.5086, test_loss: 0.8938, test_f1: 0.6396
 epoch: 78, train_loss: 0.5143, test_loss: 0.8740, test_f1: 0.6561
 epoch: 79, train_loss: 0.5083, test_loss: 0.8924, test_f1: 0.6393
 epoch: 80, train_loss: 0.5041, test_loss: 0.8592, test_f1: 0.6483
 epoch: 81, train_loss: 0.4972, test_loss: 0.8767, test_f1: 0.6450
 epoch: 82, train_loss: 0.4946, test_loss: 0.8615, test_f1: 0.6568
 epoch: 83, train_loss: 0.4944, test_loss: 0.8756, test_f1: 0.6473
 epoch: 84, train_loss: 0.5031, test_loss: 0.9205, test_f1: 0.6343
 epoch: 85, train_loss: 0.4936, test_loss: 0.9032, test_f1: 0.6555
 epoch: 86, train_loss: 0.5012, test_loss: 0.8862, test_f1: 0.6303
 epoch: 87, train_loss: 0.4950, test_loss: 0.9158, test_f1: 0.6369
 epoch: 88, train_loss: 0.4969, test_loss: 0.9596, test_f1: 0.6165
 epoch: 89, train_loss: 0.5040, test_loss: 0.9371, test_f1: 0.6434
 epoch: 90, train_loss: 0.4734, test_loss: 0.8991, test_f1: 0.6538
 epoch: 91, train_loss: 0.4802, test_loss: 0.8908, test_f1: 0.6369
 epoch: 92, train_loss: 0.4822, test_loss: 0.8589, test_f1: 0.6562
 epoch: 93, train_loss: 0.4914, test_loss: 0.9013, test_f1: 0.6530
 epoch: 94, train_loss: 0.4882, test_loss: 0.9330, test_f1: 0.6358
 epoch: 95, train_loss: 0.4799, test_loss: 0.9061, test_f1: 0.6507
 epoch: 96, train_loss: 0.4645, test_loss: 0.8977, test_f1: 0.6442
 epoch: 97, train_loss: 0.4593, test_loss: 0.9251, test_f1: 0.6572
 epoch: 98, train_loss: 0.4668, test_loss: 0.8880, test_f1: 0.6565
 epoch: 99, train_loss: 0.4551, test_loss: 0.9394, test_f1: 0.6329

Training completed in 831.61 seconds
Best F1: 0.7079 at epoch 92
Mean F1 across iterations: 0.6813  0.0141
========================FINAL RESULTS================================
FEGIN weighted F1: 0.7079  0.0141
python main.py --data ltspice_examples --representation component_pin --model FEGIN --layers 2 --hiddens 128 --batch_size 32 --lr 0.0001 --emb_size 250 --epochs 100 --save_appendix component_pin_L2_H128_BS32_LR0.0001_E250 --no_val
-----



STDERR:
  File "main.py", line 370, in <module>
    main()
  File "main.py", line 254, in main
    dataset = dataset_class(
  File "/home/philip/projects/ltspice_examples_code_repo/Circuit-Completion-Using-GNNs/component_classification_with_link_prediction_head/evaluation/FEGIN/kernel/circuit_datasets.py", line 15, in __init__
    self.data, self.slices = torch.load(self.processed_paths[0])
  File "/home/philip/.local/lib/python3.8/site-packages/torch/serialization.py", line 1040, in load
    warnings.warn(
  File "/usr/lib/python3.8/warnings.py", line 109, in _showwarnmsg
    sw(msg.message, msg.category, msg.filename, msg.lineno,
  File "main.py", line 47, in warn_with_traceback
    traceback.print_stack(file=log)
/home/philip/projects/ltspice_examples_code_repo/Circuit-Completion-Using-GNNs/component_classification_with_link_prediction_head/evaluation/FEGIN/kernel/circuit_datasets.py:15: FutureWarning: You are using `torch.load` with `weights_only=False` (the current default value), which uses the default pickle module implicitly. It is possible to construct malicious pickle data which will execute arbitrary code during unpickling (See https://github.com/pytorch/pytorch/blob/main/SECURITY.md#untrusted-models for more details). In a future release, the default value for `weights_only` will be flipped to `True`. This limits the functions that could be executed during unpickling. Arbitrary objects will no longer be allowed to be loaded via this mode unless they are explicitly allowlisted by the user via `torch.serialization.add_safe_globals`. We recommend you start setting `weights_only=True` for any use case where you don't have full control of the loaded file. Please open an issue on GitHub for any issues related to this experimental feature.
  self.data, self.slices = torch.load(self.processed_paths[0])
