STDOUT:
Results will be saved in /home/philip/projects/ltspice_examples_code_repo/Circuit-Completion-Using-GNNs/component_classification_with_link_prediction_head/evaluation/FEGIN/results/model_FEGIN_dataset_ltspice_examples
Command line input: python main.py --data ltspice_examples --representation component_component --model FEGIN --layers 4 --hiddens 16 --batch_size 256 --lr 0.001 --emb_size 512 --epochs 100 --save_appendix component_component_L4_H16_BS256_LR0.001_E512 --no_val
 is saved.
-----
ltspice_examples - FEGIN
Using 4 layers, 16 hidden units, h = 2
Loading component_component representation dataset
ENTERED
Training FEGIN on component_component representation
Train: 3556, Test: 845
##################ITERATION #0 ****************************************
 epoch: 0, train_loss: 1.3533, test_loss: 1.3557, test_f1: 0.2274
 epoch: 1, train_loss: 1.3410, test_loss: 1.3487, test_f1: 0.2274
 epoch: 2, train_loss: 1.3329, test_loss: 1.3405, test_f1: 0.2274
 epoch: 3, train_loss: 1.3237, test_loss: 1.3301, test_f1: 0.2274
 epoch: 4, train_loss: 1.3126, test_loss: 1.3190, test_f1: 0.2274
 epoch: 5, train_loss: 1.3012, test_loss: 1.3044, test_f1: 0.2274
 epoch: 6, train_loss: 1.2877, test_loss: 1.2913, test_f1: 0.2274
 epoch: 7, train_loss: 1.2773, test_loss: 1.2718, test_f1: 0.2274
 epoch: 8, train_loss: 1.2607, test_loss: 1.2522, test_f1: 0.2274
 epoch: 9, train_loss: 1.2474, test_loss: 1.2383, test_f1: 0.2274
 epoch: 10, train_loss: 1.2399, test_loss: 1.2299, test_f1: 0.2465
 epoch: 11, train_loss: 1.2350, test_loss: 1.2230, test_f1: 0.2350
 epoch: 12, train_loss: 1.2283, test_loss: 1.2196, test_f1: 0.2560
 epoch: 13, train_loss: 1.2246, test_loss: 1.2118, test_f1: 0.2961
 epoch: 14, train_loss: 1.2238, test_loss: 1.2083, test_f1: 0.3157
 epoch: 15, train_loss: 1.2118, test_loss: 1.2054, test_f1: 0.3291
 epoch: 16, train_loss: 1.2074, test_loss: 1.1958, test_f1: 0.3556
 epoch: 17, train_loss: 1.2050, test_loss: 1.2002, test_f1: 0.3438
 epoch: 18, train_loss: 1.2002, test_loss: 1.1913, test_f1: 0.3484
 epoch: 19, train_loss: 1.1922, test_loss: 1.1918, test_f1: 0.3584
 epoch: 20, train_loss: 1.1817, test_loss: 1.1908, test_f1: 0.3563
 epoch: 21, train_loss: 1.1880, test_loss: 1.2237, test_f1: 0.3398
 epoch: 22, train_loss: 1.1729, test_loss: 1.1605, test_f1: 0.3962
 epoch: 23, train_loss: 1.1697, test_loss: 1.1884, test_f1: 0.3661
 epoch: 24, train_loss: 1.1608, test_loss: 1.2198, test_f1: 0.3856
 epoch: 25, train_loss: 1.1574, test_loss: 1.1555, test_f1: 0.4214
 epoch: 26, train_loss: 1.1487, test_loss: 1.1824, test_f1: 0.4051
 epoch: 27, train_loss: 1.1417, test_loss: 1.2009, test_f1: 0.4123
 epoch: 28, train_loss: 1.1378, test_loss: 1.1884, test_f1: 0.4275
 epoch: 29, train_loss: 1.1258, test_loss: 1.1234, test_f1: 0.4570
 epoch: 30, train_loss: 1.1239, test_loss: 1.1182, test_f1: 0.4424
 epoch: 31, train_loss: 1.1175, test_loss: 1.1737, test_f1: 0.4239
 epoch: 32, train_loss: 1.1080, test_loss: 1.1114, test_f1: 0.4460
 epoch: 33, train_loss: 1.1067, test_loss: 1.1492, test_f1: 0.4379
 epoch: 34, train_loss: 1.0955, test_loss: 1.1547, test_f1: 0.4247
 epoch: 35, train_loss: 1.0975, test_loss: 1.1215, test_f1: 0.4387
 epoch: 36, train_loss: 1.0842, test_loss: 1.1686, test_f1: 0.4261
 epoch: 37, train_loss: 1.0772, test_loss: 1.1478, test_f1: 0.4337
 epoch: 38, train_loss: 1.0716, test_loss: 1.1371, test_f1: 0.4226
 epoch: 39, train_loss: 1.0748, test_loss: 1.0958, test_f1: 0.4494
 epoch: 40, train_loss: 1.0768, test_loss: 1.0837, test_f1: 0.4368
 epoch: 41, train_loss: 1.0704, test_loss: 1.1704, test_f1: 0.4172
 epoch: 42, train_loss: 1.0614, test_loss: 1.0955, test_f1: 0.4150
 epoch: 43, train_loss: 1.0550, test_loss: 1.0843, test_f1: 0.4546
 epoch: 44, train_loss: 1.0577, test_loss: 1.2063, test_f1: 0.4404
 epoch: 45, train_loss: 1.0493, test_loss: 1.0609, test_f1: 0.4545
 epoch: 46, train_loss: 1.0463, test_loss: 1.1190, test_f1: 0.4404
 epoch: 47, train_loss: 1.0335, test_loss: 1.0829, test_f1: 0.4411
 epoch: 48, train_loss: 1.0298, test_loss: 1.0538, test_f1: 0.4404
 epoch: 49, train_loss: 1.0437, test_loss: 1.0516, test_f1: 0.4431
 epoch: 50, train_loss: 1.0247, test_loss: 1.0473, test_f1: 0.4536
 epoch: 51, train_loss: 1.0176, test_loss: 1.0579, test_f1: 0.4396
 epoch: 52, train_loss: 1.0257, test_loss: 1.0423, test_f1: 0.4541
 epoch: 53, train_loss: 1.0114, test_loss: 1.0498, test_f1: 0.4512
 epoch: 54, train_loss: 1.0150, test_loss: 1.0317, test_f1: 0.4545
 epoch: 55, train_loss: 1.0102, test_loss: 1.0514, test_f1: 0.4352
 epoch: 56, train_loss: 1.0056, test_loss: 1.0288, test_f1: 0.4385
 epoch: 57, train_loss: 1.0069, test_loss: 1.0899, test_f1: 0.4312
 epoch: 58, train_loss: 0.9943, test_loss: 1.1053, test_f1: 0.4373
 epoch: 59, train_loss: 1.0051, test_loss: 1.0163, test_f1: 0.4582
 epoch: 60, train_loss: 0.9960, test_loss: 1.1102, test_f1: 0.4373
 epoch: 61, train_loss: 1.0006, test_loss: 1.1200, test_f1: 0.4400
 epoch: 62, train_loss: 0.9909, test_loss: 1.0966, test_f1: 0.4197
 epoch: 63, train_loss: 0.9961, test_loss: 1.0570, test_f1: 0.4288
 epoch: 64, train_loss: 0.9869, test_loss: 1.0698, test_f1: 0.4315
 epoch: 65, train_loss: 0.9929, test_loss: 1.0311, test_f1: 0.4442
 epoch: 66, train_loss: 0.9838, test_loss: 1.0822, test_f1: 0.4446
 epoch: 67, train_loss: 0.9744, test_loss: 1.0723, test_f1: 0.4284
 epoch: 68, train_loss: 0.9795, test_loss: 1.0320, test_f1: 0.4620
 epoch: 69, train_loss: 0.9799, test_loss: 1.0122, test_f1: 0.4652
 epoch: 70, train_loss: 0.9895, test_loss: 1.0868, test_f1: 0.4376
 epoch: 71, train_loss: 0.9879, test_loss: 1.0177, test_f1: 0.4488
 epoch: 72, train_loss: 0.9824, test_loss: 1.1490, test_f1: 0.4307
 epoch: 73, train_loss: 0.9656, test_loss: 1.0228, test_f1: 0.4478
 epoch: 74, train_loss: 0.9622, test_loss: 1.0681, test_f1: 0.4516
 epoch: 75, train_loss: 0.9817, test_loss: 1.1394, test_f1: 0.4406
 epoch: 76, train_loss: 0.9740, test_loss: 1.0955, test_f1: 0.4370
 epoch: 77, train_loss: 0.9690, test_loss: 1.1103, test_f1: 0.4340
 epoch: 78, train_loss: 0.9547, test_loss: 1.1489, test_f1: 0.4318
 epoch: 79, train_loss: 0.9606, test_loss: 1.0146, test_f1: 0.4847
 epoch: 80, train_loss: 0.9698, test_loss: 1.0183, test_f1: 0.4545
 epoch: 81, train_loss: 0.9725, test_loss: 1.0413, test_f1: 0.4452
 epoch: 82, train_loss: 0.9682, test_loss: 1.0845, test_f1: 0.4462
 epoch: 83, train_loss: 0.9673, test_loss: 1.0710, test_f1: 0.4429
 epoch: 84, train_loss: 0.9680, test_loss: 1.0695, test_f1: 0.4246
 epoch: 85, train_loss: 0.9586, test_loss: 1.0236, test_f1: 0.4502
 epoch: 86, train_loss: 0.9676, test_loss: 1.1979, test_f1: 0.4366
 epoch: 87, train_loss: 0.9417, test_loss: 1.1569, test_f1: 0.4491
 epoch: 88, train_loss: 0.9590, test_loss: 1.1380, test_f1: 0.4334
 epoch: 89, train_loss: 0.9477, test_loss: 1.0426, test_f1: 0.4447
 epoch: 90, train_loss: 0.9476, test_loss: 1.1021, test_f1: 0.4409
 epoch: 91, train_loss: 0.9475, test_loss: 1.0684, test_f1: 0.4441
 epoch: 92, train_loss: 0.9497, test_loss: 1.1000, test_f1: 0.4306
 epoch: 93, train_loss: 0.9437, test_loss: 1.1351, test_f1: 0.4320
 epoch: 94, train_loss: 0.9335, test_loss: 1.1100, test_f1: 0.4403
 epoch: 95, train_loss: 0.9379, test_loss: 1.0807, test_f1: 0.4353
 epoch: 96, train_loss: 0.9519, test_loss: 1.1251, test_f1: 0.4312
 epoch: 97, train_loss: 0.9314, test_loss: 1.1306, test_f1: 0.4337
 epoch: 98, train_loss: 0.9343, test_loss: 1.1702, test_f1: 0.4345
 epoch: 99, train_loss: 0.9389, test_loss: 1.1456, test_f1: 0.4474
##################ITERATION #1 ****************************************
 epoch: 0, train_loss: 1.3674, test_loss: 1.3658, test_f1: 0.2310
 epoch: 1, train_loss: 1.2967, test_loss: 1.3150, test_f1: 0.2274
 epoch: 2, train_loss: 1.2712, test_loss: 1.2768, test_f1: 0.2274
 epoch: 3, train_loss: 1.2607, test_loss: 1.2520, test_f1: 0.2274
 epoch: 4, train_loss: 1.2470, test_loss: 1.2364, test_f1: 0.2300
 epoch: 5, train_loss: 1.2337, test_loss: 1.2224, test_f1: 0.2995
 epoch: 6, train_loss: 1.2227, test_loss: 1.2101, test_f1: 0.3034
 epoch: 7, train_loss: 1.2187, test_loss: 1.1941, test_f1: 0.3348
 epoch: 8, train_loss: 1.2081, test_loss: 1.1872, test_f1: 0.3417
 epoch: 9, train_loss: 1.2018, test_loss: 1.1769, test_f1: 0.3601
 epoch: 10, train_loss: 1.1898, test_loss: 1.1613, test_f1: 0.3772
 epoch: 11, train_loss: 1.1841, test_loss: 1.1537, test_f1: 0.3861
 epoch: 12, train_loss: 1.1732, test_loss: 1.1435, test_f1: 0.4003
 epoch: 13, train_loss: 1.1644, test_loss: 1.1296, test_f1: 0.4354
 epoch: 14, train_loss: 1.1640, test_loss: 1.1256, test_f1: 0.4166
 epoch: 15, train_loss: 1.1452, test_loss: 1.1130, test_f1: 0.4166
 epoch: 16, train_loss: 1.1451, test_loss: 1.1070, test_f1: 0.4135
 epoch: 17, train_loss: 1.1343, test_loss: 1.0935, test_f1: 0.4454
 epoch: 18, train_loss: 1.1254, test_loss: 1.0989, test_f1: 0.4065
 epoch: 19, train_loss: 1.1230, test_loss: 1.0880, test_f1: 0.4293
 epoch: 20, train_loss: 1.1125, test_loss: 1.0747, test_f1: 0.4255
 epoch: 21, train_loss: 1.1045, test_loss: 1.0699, test_f1: 0.4386
 epoch: 22, train_loss: 1.1046, test_loss: 1.0675, test_f1: 0.4411
 epoch: 23, train_loss: 1.0924, test_loss: 1.0659, test_f1: 0.4260
 epoch: 24, train_loss: 1.0859, test_loss: 1.0536, test_f1: 0.4475
 epoch: 25, train_loss: 1.0785, test_loss: 1.0605, test_f1: 0.4598
 epoch: 26, train_loss: 1.0847, test_loss: 1.0592, test_f1: 0.4284
 epoch: 27, train_loss: 1.0756, test_loss: 1.0575, test_f1: 0.4348
 epoch: 28, train_loss: 1.0633, test_loss: 1.0483, test_f1: 0.4563
 epoch: 29, train_loss: 1.0558, test_loss: 1.0501, test_f1: 0.4643
 epoch: 30, train_loss: 1.0500, test_loss: 1.0625, test_f1: 0.4710
 epoch: 31, train_loss: 1.0520, test_loss: 1.0460, test_f1: 0.4458
 epoch: 32, train_loss: 1.0471, test_loss: 1.0435, test_f1: 0.4692
 epoch: 33, train_loss: 1.0453, test_loss: 1.0532, test_f1: 0.4517
 epoch: 34, train_loss: 1.0374, test_loss: 1.0604, test_f1: 0.4621
 epoch: 35, train_loss: 1.0299, test_loss: 1.0516, test_f1: 0.4691
 epoch: 36, train_loss: 1.0278, test_loss: 1.0368, test_f1: 0.4773
 epoch: 37, train_loss: 1.0159, test_loss: 1.0533, test_f1: 0.4733
 epoch: 38, train_loss: 1.0239, test_loss: 1.0202, test_f1: 0.4728
 epoch: 39, train_loss: 1.0103, test_loss: 1.0393, test_f1: 0.4611
 epoch: 40, train_loss: 1.0071, test_loss: 1.0322, test_f1: 0.4555
 epoch: 41, train_loss: 0.9939, test_loss: 1.0508, test_f1: 0.4497
 epoch: 42, train_loss: 0.9880, test_loss: 1.0593, test_f1: 0.4632
 epoch: 43, train_loss: 0.9957, test_loss: 1.0424, test_f1: 0.4809
 epoch: 44, train_loss: 0.9818, test_loss: 1.0380, test_f1: 0.4620
 epoch: 45, train_loss: 0.9790, test_loss: 1.0577, test_f1: 0.4799
 epoch: 46, train_loss: 0.9842, test_loss: 1.0292, test_f1: 0.4781
 epoch: 47, train_loss: 0.9908, test_loss: 1.0826, test_f1: 0.4456
 epoch: 48, train_loss: 0.9939, test_loss: 1.0656, test_f1: 0.4367
 epoch: 49, train_loss: 0.9856, test_loss: 1.0557, test_f1: 0.4408
 epoch: 50, train_loss: 0.9757, test_loss: 1.0496, test_f1: 0.4674
 epoch: 51, train_loss: 0.9692, test_loss: 1.0561, test_f1: 0.4536
 epoch: 52, train_loss: 0.9508, test_loss: 1.0474, test_f1: 0.4629
 epoch: 53, train_loss: 0.9671, test_loss: 1.0457, test_f1: 0.4635
 epoch: 54, train_loss: 0.9572, test_loss: 1.0407, test_f1: 0.4751
 epoch: 55, train_loss: 0.9581, test_loss: 1.0613, test_f1: 0.4654
 epoch: 56, train_loss: 0.9461, test_loss: 1.0551, test_f1: 0.4555
 epoch: 57, train_loss: 0.9459, test_loss: 1.0510, test_f1: 0.4675
 epoch: 58, train_loss: 0.9431, test_loss: 1.0606, test_f1: 0.4575
 epoch: 59, train_loss: 0.9461, test_loss: 1.0409, test_f1: 0.4631
 epoch: 60, train_loss: 0.9464, test_loss: 1.0413, test_f1: 0.4735
 epoch: 61, train_loss: 0.9311, test_loss: 1.0390, test_f1: 0.4550
 epoch: 62, train_loss: 0.9468, test_loss: 1.0513, test_f1: 0.4641
 epoch: 63, train_loss: 0.9386, test_loss: 1.0562, test_f1: 0.4617
 epoch: 64, train_loss: 0.9438, test_loss: 1.0762, test_f1: 0.4616
 epoch: 65, train_loss: 0.9369, test_loss: 1.0765, test_f1: 0.4712
 epoch: 66, train_loss: 0.9358, test_loss: 1.0647, test_f1: 0.4590
 epoch: 67, train_loss: 0.9415, test_loss: 1.0687, test_f1: 0.4678
 epoch: 68, train_loss: 0.9315, test_loss: 1.0392, test_f1: 0.4794
 epoch: 69, train_loss: 0.9321, test_loss: 1.0817, test_f1: 0.4666
 epoch: 70, train_loss: 0.9283, test_loss: 1.0536, test_f1: 0.4729
 epoch: 71, train_loss: 0.9147, test_loss: 1.0684, test_f1: 0.4744
 epoch: 72, train_loss: 0.9277, test_loss: 1.0760, test_f1: 0.4533
 epoch: 73, train_loss: 0.9312, test_loss: 1.0664, test_f1: 0.4730
 epoch: 74, train_loss: 0.9222, test_loss: 1.0667, test_f1: 0.4673
 epoch: 75, train_loss: 0.9176, test_loss: 1.0733, test_f1: 0.4654
 epoch: 76, train_loss: 0.9152, test_loss: 1.0712, test_f1: 0.4696
 epoch: 77, train_loss: 0.9065, test_loss: 1.0631, test_f1: 0.4655
 epoch: 78, train_loss: 0.9094, test_loss: 1.0733, test_f1: 0.4729
 epoch: 79, train_loss: 0.9147, test_loss: 1.0750, test_f1: 0.4605
 epoch: 80, train_loss: 0.9121, test_loss: 1.0641, test_f1: 0.4561
 epoch: 81, train_loss: 0.9033, test_loss: 1.0951, test_f1: 0.4647
 epoch: 82, train_loss: 0.9150, test_loss: 1.0743, test_f1: 0.4647
 epoch: 83, train_loss: 0.9098, test_loss: 1.0833, test_f1: 0.4691
 epoch: 84, train_loss: 0.9147, test_loss: 1.0747, test_f1: 0.4649
 epoch: 85, train_loss: 0.9054, test_loss: 1.0862, test_f1: 0.4564
 epoch: 86, train_loss: 0.9057, test_loss: 1.0797, test_f1: 0.4736
 epoch: 87, train_loss: 0.9002, test_loss: 1.0837, test_f1: 0.4726
 epoch: 88, train_loss: 0.9059, test_loss: 1.0721, test_f1: 0.4742
 epoch: 89, train_loss: 0.8916, test_loss: 1.0717, test_f1: 0.4691
 epoch: 90, train_loss: 0.8905, test_loss: 1.0784, test_f1: 0.4588
 epoch: 91, train_loss: 0.9039, test_loss: 1.0962, test_f1: 0.4661
 epoch: 92, train_loss: 0.8920, test_loss: 1.1063, test_f1: 0.4899
 epoch: 93, train_loss: 0.8988, test_loss: 1.1249, test_f1: 0.4771
 epoch: 94, train_loss: 0.8983, test_loss: 1.1082, test_f1: 0.4757
 epoch: 95, train_loss: 0.8873, test_loss: 1.0906, test_f1: 0.4798
 epoch: 96, train_loss: 0.8970, test_loss: 1.1085, test_f1: 0.4574
 epoch: 97, train_loss: 0.8876, test_loss: 1.0994, test_f1: 0.4866
 epoch: 98, train_loss: 0.8923, test_loss: 1.1059, test_f1: 0.4908
 epoch: 99, train_loss: 0.8852, test_loss: 1.1208, test_f1: 0.4900
##################ITERATION #2 ****************************************
 epoch: 0, train_loss: 1.3553, test_loss: 1.3522, test_f1: 0.2274
 epoch: 1, train_loss: 1.2986, test_loss: 1.3171, test_f1: 0.2274
 epoch: 2, train_loss: 1.2689, test_loss: 1.2827, test_f1: 0.2274
 epoch: 3, train_loss: 1.2571, test_loss: 1.2482, test_f1: 0.2274
 epoch: 4, train_loss: 1.2444, test_loss: 1.2253, test_f1: 0.2264
 epoch: 5, train_loss: 1.2334, test_loss: 1.2050, test_f1: 0.2654
 epoch: 6, train_loss: 1.2284, test_loss: 1.1867, test_f1: 0.2728
 epoch: 7, train_loss: 1.2133, test_loss: 1.1739, test_f1: 0.3300
 epoch: 8, train_loss: 1.2086, test_loss: 1.1620, test_f1: 0.3490
 epoch: 9, train_loss: 1.2044, test_loss: 1.1544, test_f1: 0.3586
 epoch: 10, train_loss: 1.1945, test_loss: 1.1485, test_f1: 0.3761
 epoch: 11, train_loss: 1.1857, test_loss: 1.1434, test_f1: 0.3889
 epoch: 12, train_loss: 1.1787, test_loss: 1.1345, test_f1: 0.4021
 epoch: 13, train_loss: 1.1690, test_loss: 1.1369, test_f1: 0.3964
 epoch: 14, train_loss: 1.1625, test_loss: 1.1360, test_f1: 0.3952
 epoch: 15, train_loss: 1.1613, test_loss: 1.1231, test_f1: 0.3987
 epoch: 16, train_loss: 1.1604, test_loss: 1.1110, test_f1: 0.4095
 epoch: 17, train_loss: 1.1576, test_loss: 1.1126, test_f1: 0.4176
 epoch: 18, train_loss: 1.1410, test_loss: 1.1058, test_f1: 0.4153
 epoch: 19, train_loss: 1.1326, test_loss: 1.1041, test_f1: 0.4121
 epoch: 20, train_loss: 1.1267, test_loss: 1.1057, test_f1: 0.4131
 epoch: 21, train_loss: 1.1262, test_loss: 1.0965, test_f1: 0.4284
 epoch: 22, train_loss: 1.1135, test_loss: 1.0944, test_f1: 0.4376
 epoch: 23, train_loss: 1.1055, test_loss: 1.0992, test_f1: 0.4097
 epoch: 24, train_loss: 1.1085, test_loss: 1.0943, test_f1: 0.4242
 epoch: 25, train_loss: 1.1014, test_loss: 1.0803, test_f1: 0.4460
 epoch: 26, train_loss: 1.0932, test_loss: 1.0905, test_f1: 0.4249
 epoch: 27, train_loss: 1.0837, test_loss: 1.0650, test_f1: 0.4559
 epoch: 28, train_loss: 1.0802, test_loss: 1.0614, test_f1: 0.4589
 epoch: 29, train_loss: 1.0758, test_loss: 1.0565, test_f1: 0.4506
 epoch: 30, train_loss: 1.0705, test_loss: 1.0564, test_f1: 0.4647
 epoch: 31, train_loss: 1.0641, test_loss: 1.0612, test_f1: 0.4562
 epoch: 32, train_loss: 1.0583, test_loss: 1.0497, test_f1: 0.4691
 epoch: 33, train_loss: 1.0601, test_loss: 1.0527, test_f1: 0.4626
 epoch: 34, train_loss: 1.0527, test_loss: 1.0708, test_f1: 0.4404
 epoch: 35, train_loss: 1.0416, test_loss: 1.0575, test_f1: 0.4672
 epoch: 36, train_loss: 1.0500, test_loss: 1.0971, test_f1: 0.4226
 epoch: 37, train_loss: 1.0289, test_loss: 1.0632, test_f1: 0.4618
 epoch: 38, train_loss: 1.0359, test_loss: 1.0429, test_f1: 0.4709
 epoch: 39, train_loss: 1.0248, test_loss: 1.0752, test_f1: 0.4478
 epoch: 40, train_loss: 1.0241, test_loss: 1.0435, test_f1: 0.4816
 epoch: 41, train_loss: 1.0201, test_loss: 1.0454, test_f1: 0.4589
 epoch: 42, train_loss: 1.0133, test_loss: 1.0447, test_f1: 0.4544
 epoch: 43, train_loss: 1.0243, test_loss: 1.0503, test_f1: 0.4712
 epoch: 44, train_loss: 1.0191, test_loss: 1.0366, test_f1: 0.4647
 epoch: 45, train_loss: 1.0045, test_loss: 1.0607, test_f1: 0.4543
 epoch: 46, train_loss: 1.0033, test_loss: 1.0431, test_f1: 0.4536
 epoch: 47, train_loss: 1.0100, test_loss: 1.0504, test_f1: 0.4534
 epoch: 48, train_loss: 0.9965, test_loss: 1.0404, test_f1: 0.4735
 epoch: 49, train_loss: 0.9862, test_loss: 1.0633, test_f1: 0.4607
 epoch: 50, train_loss: 0.9910, test_loss: 1.0457, test_f1: 0.4634
 epoch: 51, train_loss: 0.9918, test_loss: 1.0634, test_f1: 0.4612
 epoch: 52, train_loss: 0.9764, test_loss: 1.0435, test_f1: 0.4565
 epoch: 53, train_loss: 0.9735, test_loss: 1.0553, test_f1: 0.4713
 epoch: 54, train_loss: 0.9585, test_loss: 1.0459, test_f1: 0.4602
 epoch: 55, train_loss: 0.9713, test_loss: 1.0390, test_f1: 0.4723
 epoch: 56, train_loss: 0.9669, test_loss: 1.0629, test_f1: 0.4827
 epoch: 57, train_loss: 0.9649, test_loss: 1.0430, test_f1: 0.4600
 epoch: 58, train_loss: 0.9632, test_loss: 1.0652, test_f1: 0.4591
 epoch: 59, train_loss: 0.9625, test_loss: 1.0499, test_f1: 0.4670
 epoch: 60, train_loss: 0.9578, test_loss: 1.0684, test_f1: 0.4661
 epoch: 61, train_loss: 0.9601, test_loss: 1.0626, test_f1: 0.4642
 epoch: 62, train_loss: 0.9531, test_loss: 1.0674, test_f1: 0.4691
 epoch: 63, train_loss: 0.9517, test_loss: 1.0455, test_f1: 0.4725
 epoch: 64, train_loss: 0.9495, test_loss: 1.0594, test_f1: 0.4680
 epoch: 65, train_loss: 0.9360, test_loss: 1.0511, test_f1: 0.4734
 epoch: 66, train_loss: 0.9485, test_loss: 1.0628, test_f1: 0.4649
 epoch: 67, train_loss: 0.9336, test_loss: 1.0485, test_f1: 0.4752
 epoch: 68, train_loss: 0.9406, test_loss: 1.0656, test_f1: 0.4650
 epoch: 69, train_loss: 0.9297, test_loss: 1.0899, test_f1: 0.4585
 epoch: 70, train_loss: 0.9359, test_loss: 1.0626, test_f1: 0.4808
 epoch: 71, train_loss: 0.9384, test_loss: 1.0549, test_f1: 0.4582
 epoch: 72, train_loss: 0.9351, test_loss: 1.0638, test_f1: 0.4723
 epoch: 73, train_loss: 0.9291, test_loss: 1.0717, test_f1: 0.4744
 epoch: 74, train_loss: 0.9338, test_loss: 1.0708, test_f1: 0.4588
 epoch: 75, train_loss: 0.9257, test_loss: 1.0381, test_f1: 0.4815
 epoch: 76, train_loss: 0.9424, test_loss: 1.0423, test_f1: 0.4845
 epoch: 77, train_loss: 0.9374, test_loss: 1.0629, test_f1: 0.4759
 epoch: 78, train_loss: 0.9321, test_loss: 1.0637, test_f1: 0.4592
 epoch: 79, train_loss: 0.9336, test_loss: 1.0811, test_f1: 0.4700
 epoch: 80, train_loss: 0.9247, test_loss: 1.0831, test_f1: 0.4769
 epoch: 81, train_loss: 0.9283, test_loss: 1.0624, test_f1: 0.4697
 epoch: 82, train_loss: 0.9298, test_loss: 1.0908, test_f1: 0.4831
 epoch: 83, train_loss: 0.9252, test_loss: 1.0778, test_f1: 0.4815
 epoch: 84, train_loss: 0.9229, test_loss: 1.0946, test_f1: 0.4667
 epoch: 85, train_loss: 0.9178, test_loss: 1.0873, test_f1: 0.4800
 epoch: 86, train_loss: 0.9140, test_loss: 1.0742, test_f1: 0.4806
 epoch: 87, train_loss: 0.9105, test_loss: 1.0729, test_f1: 0.4799
 epoch: 88, train_loss: 0.9141, test_loss: 1.1203, test_f1: 0.4844
 epoch: 89, train_loss: 0.9084, test_loss: 1.0756, test_f1: 0.4736
 epoch: 90, train_loss: 0.9066, test_loss: 1.0739, test_f1: 0.4755
 epoch: 91, train_loss: 0.9090, test_loss: 1.0699, test_f1: 0.4889
 epoch: 92, train_loss: 0.9183, test_loss: 1.1045, test_f1: 0.4714
 epoch: 93, train_loss: 0.9095, test_loss: 1.0671, test_f1: 0.4932
 epoch: 94, train_loss: 0.9066, test_loss: 1.0884, test_f1: 0.4817
 epoch: 95, train_loss: 0.9051, test_loss: 1.0826, test_f1: 0.4677
 epoch: 96, train_loss: 0.9116, test_loss: 1.0798, test_f1: 0.4880
 epoch: 97, train_loss: 0.9023, test_loss: 1.0690, test_f1: 0.4716
 epoch: 98, train_loss: 0.9131, test_loss: 1.0772, test_f1: 0.5045
 epoch: 99, train_loss: 0.8909, test_loss: 1.0753, test_f1: 0.4796
##################ITERATION #3 ****************************************
 epoch: 0, train_loss: 1.3130, test_loss: 1.2976, test_f1: 0.2274
 epoch: 1, train_loss: 1.2680, test_loss: 1.2658, test_f1: 0.2274
 epoch: 2, train_loss: 1.2574, test_loss: 1.2421, test_f1: 0.2274
 epoch: 3, train_loss: 1.2416, test_loss: 1.2277, test_f1: 0.2369
 epoch: 4, train_loss: 1.2332, test_loss: 1.2155, test_f1: 0.2682
 epoch: 5, train_loss: 1.2277, test_loss: 1.2021, test_f1: 0.3044
 epoch: 6, train_loss: 1.2176, test_loss: 1.1971, test_f1: 0.3074
 epoch: 7, train_loss: 1.2171, test_loss: 1.1818, test_f1: 0.3204
 epoch: 8, train_loss: 1.2103, test_loss: 1.1761, test_f1: 0.3265
 epoch: 9, train_loss: 1.2000, test_loss: 1.1746, test_f1: 0.3182
 epoch: 10, train_loss: 1.1938, test_loss: 1.1654, test_f1: 0.3439
 epoch: 11, train_loss: 1.1905, test_loss: 1.1585, test_f1: 0.3733
 epoch: 12, train_loss: 1.1876, test_loss: 1.1492, test_f1: 0.3936
 epoch: 13, train_loss: 1.1844, test_loss: 1.1428, test_f1: 0.3913
 epoch: 14, train_loss: 1.1743, test_loss: 1.1381, test_f1: 0.3835
 epoch: 15, train_loss: 1.1846, test_loss: 1.1285, test_f1: 0.4061
 epoch: 16, train_loss: 1.1676, test_loss: 1.1313, test_f1: 0.4010
 epoch: 17, train_loss: 1.1627, test_loss: 1.1253, test_f1: 0.4045
 epoch: 18, train_loss: 1.1574, test_loss: 1.1098, test_f1: 0.4294
 epoch: 19, train_loss: 1.1612, test_loss: 1.1023, test_f1: 0.4337
 epoch: 20, train_loss: 1.1483, test_loss: 1.0881, test_f1: 0.4257
 epoch: 21, train_loss: 1.1471, test_loss: 1.1003, test_f1: 0.4192
 epoch: 22, train_loss: 1.1413, test_loss: 1.0899, test_f1: 0.4476
 epoch: 23, train_loss: 1.1339, test_loss: 1.0856, test_f1: 0.4595
 epoch: 24, train_loss: 1.1288, test_loss: 1.0813, test_f1: 0.4535
 epoch: 25, train_loss: 1.1247, test_loss: 1.0764, test_f1: 0.4511
 epoch: 26, train_loss: 1.1191, test_loss: 1.0575, test_f1: 0.4379
 epoch: 27, train_loss: 1.1180, test_loss: 1.0650, test_f1: 0.4667
 epoch: 28, train_loss: 1.1075, test_loss: 1.0546, test_f1: 0.4684
 epoch: 29, train_loss: 1.0944, test_loss: 1.0518, test_f1: 0.4849
 epoch: 30, train_loss: 1.0905, test_loss: 1.0383, test_f1: 0.4782
 epoch: 31, train_loss: 1.0890, test_loss: 1.0374, test_f1: 0.4705
 epoch: 32, train_loss: 1.0781, test_loss: 1.0344, test_f1: 0.4838
 epoch: 33, train_loss: 1.0817, test_loss: 1.0337, test_f1: 0.4833
 epoch: 34, train_loss: 1.0706, test_loss: 1.0199, test_f1: 0.4714
 epoch: 35, train_loss: 1.0815, test_loss: 1.0198, test_f1: 0.4773
 epoch: 36, train_loss: 1.0641, test_loss: 1.0045, test_f1: 0.5001
 epoch: 37, train_loss: 1.0597, test_loss: 1.0371, test_f1: 0.4839
 epoch: 38, train_loss: 1.0365, test_loss: 1.0000, test_f1: 0.5087
 epoch: 39, train_loss: 1.0439, test_loss: 1.0095, test_f1: 0.4718
 epoch: 40, train_loss: 1.0494, test_loss: 1.0008, test_f1: 0.4768
 epoch: 41, train_loss: 1.0388, test_loss: 0.9953, test_f1: 0.4880
 epoch: 42, train_loss: 1.0411, test_loss: 1.0078, test_f1: 0.4916
 epoch: 43, train_loss: 1.0225, test_loss: 1.0156, test_f1: 0.4742
 epoch: 44, train_loss: 1.0304, test_loss: 0.9804, test_f1: 0.4807
 epoch: 45, train_loss: 1.0289, test_loss: 1.0004, test_f1: 0.4691
 epoch: 46, train_loss: 1.0198, test_loss: 1.0002, test_f1: 0.4835
 epoch: 47, train_loss: 1.0164, test_loss: 0.9831, test_f1: 0.5043
 epoch: 48, train_loss: 1.0103, test_loss: 1.0105, test_f1: 0.4751
 epoch: 49, train_loss: 1.0112, test_loss: 0.9538, test_f1: 0.5062
 epoch: 50, train_loss: 1.0111, test_loss: 0.9954, test_f1: 0.4860
 epoch: 51, train_loss: 0.9956, test_loss: 0.9887, test_f1: 0.4925
 epoch: 52, train_loss: 0.9936, test_loss: 0.9692, test_f1: 0.4827
 epoch: 53, train_loss: 0.9971, test_loss: 0.9784, test_f1: 0.4908
 epoch: 54, train_loss: 1.0007, test_loss: 0.9705, test_f1: 0.4901
 epoch: 55, train_loss: 0.9859, test_loss: 0.9656, test_f1: 0.4875
 epoch: 56, train_loss: 0.9908, test_loss: 0.9816, test_f1: 0.5015
 epoch: 57, train_loss: 0.9773, test_loss: 0.9758, test_f1: 0.4935
 epoch: 58, train_loss: 0.9774, test_loss: 0.9672, test_f1: 0.4991
 epoch: 59, train_loss: 0.9801, test_loss: 0.9813, test_f1: 0.4842
 epoch: 60, train_loss: 0.9822, test_loss: 0.9717, test_f1: 0.5041
 epoch: 61, train_loss: 0.9765, test_loss: 0.9471, test_f1: 0.5170
 epoch: 62, train_loss: 0.9784, test_loss: 0.9703, test_f1: 0.4958
 epoch: 63, train_loss: 0.9749, test_loss: 0.9577, test_f1: 0.4961
 epoch: 64, train_loss: 0.9697, test_loss: 0.9519, test_f1: 0.5008
 epoch: 65, train_loss: 0.9773, test_loss: 0.9784, test_f1: 0.4894
 epoch: 66, train_loss: 0.9757, test_loss: 0.9624, test_f1: 0.5077
 epoch: 67, train_loss: 0.9591, test_loss: 0.9528, test_f1: 0.5120
 epoch: 68, train_loss: 0.9555, test_loss: 0.9519, test_f1: 0.5054
 epoch: 69, train_loss: 0.9542, test_loss: 0.9613, test_f1: 0.5056
 epoch: 70, train_loss: 0.9686, test_loss: 0.9662, test_f1: 0.5133
 epoch: 71, train_loss: 0.9500, test_loss: 0.9668, test_f1: 0.5100
 epoch: 72, train_loss: 0.9653, test_loss: 0.9856, test_f1: 0.5095
 epoch: 73, train_loss: 0.9508, test_loss: 0.9602, test_f1: 0.5205
 epoch: 74, train_loss: 0.9647, test_loss: 0.9685, test_f1: 0.5047
 epoch: 75, train_loss: 0.9426, test_loss: 0.9530, test_f1: 0.5148
 epoch: 76, train_loss: 0.9605, test_loss: 0.9693, test_f1: 0.5007
 epoch: 77, train_loss: 0.9516, test_loss: 0.9706, test_f1: 0.5107
 epoch: 78, train_loss: 0.9550, test_loss: 0.9663, test_f1: 0.5069
 epoch: 79, train_loss: 0.9541, test_loss: 0.9442, test_f1: 0.5223
 epoch: 80, train_loss: 0.9463, test_loss: 0.9805, test_f1: 0.5085
 epoch: 81, train_loss: 0.9644, test_loss: 0.9718, test_f1: 0.5090
 epoch: 82, train_loss: 0.9374, test_loss: 0.9606, test_f1: 0.5210
 epoch: 83, train_loss: 0.9524, test_loss: 0.9634, test_f1: 0.5050
 epoch: 84, train_loss: 0.9578, test_loss: 0.9561, test_f1: 0.5268
 epoch: 85, train_loss: 0.9558, test_loss: 0.9729, test_f1: 0.5117
 epoch: 86, train_loss: 0.9395, test_loss: 0.9705, test_f1: 0.5108
 epoch: 87, train_loss: 0.9416, test_loss: 0.9614, test_f1: 0.5097
 epoch: 88, train_loss: 0.9503, test_loss: 0.9419, test_f1: 0.5217
 epoch: 89, train_loss: 0.9373, test_loss: 0.9356, test_f1: 0.5106
 epoch: 90, train_loss: 0.9371, test_loss: 0.9552, test_f1: 0.5089
 epoch: 91, train_loss: 0.9221, test_loss: 0.9508, test_f1: 0.5005
 epoch: 92, train_loss: 0.9332, test_loss: 0.9629, test_f1: 0.5091
 epoch: 93, train_loss: 0.9391, test_loss: 0.9774, test_f1: 0.5032
 epoch: 94, train_loss: 0.9398, test_loss: 0.9504, test_f1: 0.5178
 epoch: 95, train_loss: 0.9341, test_loss: 0.9538, test_f1: 0.5259
 epoch: 96, train_loss: 0.9369, test_loss: 0.9679, test_f1: 0.5150
 epoch: 97, train_loss: 0.9310, test_loss: 0.9590, test_f1: 0.5118
 epoch: 98, train_loss: 0.9274, test_loss: 0.9776, test_f1: 0.5083
 epoch: 99, train_loss: 0.9169, test_loss: 0.9683, test_f1: 0.5004
##################ITERATION #4 ****************************************
 epoch: 0, train_loss: 1.4781, test_loss: 1.3318, test_f1: 0.2274
 epoch: 1, train_loss: 1.3211, test_loss: 1.3011, test_f1: 0.2274
 epoch: 2, train_loss: 1.2856, test_loss: 1.2798, test_f1: 0.2598
 epoch: 3, train_loss: 1.2558, test_loss: 1.2403, test_f1: 0.2867
 epoch: 4, train_loss: 1.2438, test_loss: 1.2146, test_f1: 0.3289
 epoch: 5, train_loss: 1.2253, test_loss: 1.2001, test_f1: 0.3487
 epoch: 6, train_loss: 1.2250, test_loss: 1.1863, test_f1: 0.3687
 epoch: 7, train_loss: 1.2159, test_loss: 1.1717, test_f1: 0.3777
 epoch: 8, train_loss: 1.2056, test_loss: 1.1649, test_f1: 0.3938
 epoch: 9, train_loss: 1.1970, test_loss: 1.1508, test_f1: 0.4077
 epoch: 10, train_loss: 1.1966, test_loss: 1.1381, test_f1: 0.4101
 epoch: 11, train_loss: 1.1873, test_loss: 1.1211, test_f1: 0.4287
 epoch: 12, train_loss: 1.1659, test_loss: 1.1082, test_f1: 0.4457
 epoch: 13, train_loss: 1.1561, test_loss: 1.1021, test_f1: 0.4456
 epoch: 14, train_loss: 1.1564, test_loss: 1.0926, test_f1: 0.4492
 epoch: 15, train_loss: 1.1552, test_loss: 1.0893, test_f1: 0.4232
 epoch: 16, train_loss: 1.1418, test_loss: 1.0743, test_f1: 0.4411
 epoch: 17, train_loss: 1.1319, test_loss: 1.0711, test_f1: 0.4393
 epoch: 18, train_loss: 1.1342, test_loss: 1.0671, test_f1: 0.4431
 epoch: 19, train_loss: 1.1322, test_loss: 1.0650, test_f1: 0.4362
 epoch: 20, train_loss: 1.1236, test_loss: 1.0540, test_f1: 0.4697
 epoch: 21, train_loss: 1.1175, test_loss: 1.0541, test_f1: 0.4381
 epoch: 22, train_loss: 1.1163, test_loss: 1.0378, test_f1: 0.4649
 epoch: 23, train_loss: 1.1014, test_loss: 1.0395, test_f1: 0.4633
 epoch: 24, train_loss: 1.1024, test_loss: 1.0342, test_f1: 0.4525
 epoch: 25, train_loss: 1.0969, test_loss: 1.0256, test_f1: 0.4663
 epoch: 26, train_loss: 1.0934, test_loss: 1.0200, test_f1: 0.4673
 epoch: 27, train_loss: 1.0838, test_loss: 1.0222, test_f1: 0.4581
 epoch: 28, train_loss: 1.0714, test_loss: 1.0018, test_f1: 0.4822
 epoch: 29, train_loss: 1.0765, test_loss: 1.0280, test_f1: 0.4512
 epoch: 30, train_loss: 1.0704, test_loss: 0.9947, test_f1: 0.4793
 epoch: 31, train_loss: 1.0626, test_loss: 0.9927, test_f1: 0.4748
 epoch: 32, train_loss: 1.0616, test_loss: 0.9933, test_f1: 0.4798
 epoch: 33, train_loss: 1.0529, test_loss: 0.9664, test_f1: 0.4838
 epoch: 34, train_loss: 1.0476, test_loss: 0.9767, test_f1: 0.4730
 epoch: 35, train_loss: 1.0463, test_loss: 0.9688, test_f1: 0.4809
 epoch: 36, train_loss: 1.0334, test_loss: 0.9492, test_f1: 0.4843
 epoch: 37, train_loss: 1.0291, test_loss: 0.9998, test_f1: 0.4545
 epoch: 38, train_loss: 1.0327, test_loss: 0.9713, test_f1: 0.4954
 epoch: 39, train_loss: 1.0309, test_loss: 1.0502, test_f1: 0.4331
 epoch: 40, train_loss: 1.0118, test_loss: 0.9346, test_f1: 0.5061
 epoch: 41, train_loss: 1.0252, test_loss: 0.9769, test_f1: 0.4745
 epoch: 42, train_loss: 1.0214, test_loss: 0.9461, test_f1: 0.4882
 epoch: 43, train_loss: 1.0033, test_loss: 0.9912, test_f1: 0.4772
 epoch: 44, train_loss: 1.0135, test_loss: 0.9438, test_f1: 0.4878
 epoch: 45, train_loss: 1.0156, test_loss: 0.9551, test_f1: 0.4828
 epoch: 46, train_loss: 0.9973, test_loss: 0.9429, test_f1: 0.4959
 epoch: 47, train_loss: 0.9984, test_loss: 0.9569, test_f1: 0.4911
 epoch: 48, train_loss: 0.9973, test_loss: 0.9442, test_f1: 0.4875
 epoch: 49, train_loss: 0.9939, test_loss: 0.9301, test_f1: 0.4858
 epoch: 50, train_loss: 0.9904, test_loss: 0.9309, test_f1: 0.4902
 epoch: 51, train_loss: 0.9877, test_loss: 0.9253, test_f1: 0.4998
 epoch: 52, train_loss: 0.9773, test_loss: 0.9218, test_f1: 0.4961
 epoch: 53, train_loss: 0.9814, test_loss: 0.9436, test_f1: 0.4784
 epoch: 54, train_loss: 0.9790, test_loss: 0.9385, test_f1: 0.4965
 epoch: 55, train_loss: 0.9761, test_loss: 0.9349, test_f1: 0.4896
 epoch: 56, train_loss: 0.9834, test_loss: 0.9456, test_f1: 0.4969
 epoch: 57, train_loss: 0.9733, test_loss: 0.9166, test_f1: 0.4977
 epoch: 58, train_loss: 0.9683, test_loss: 0.9435, test_f1: 0.4840
 epoch: 59, train_loss: 0.9656, test_loss: 0.9363, test_f1: 0.4900
 epoch: 60, train_loss: 0.9710, test_loss: 0.9287, test_f1: 0.4981
 epoch: 61, train_loss: 0.9627, test_loss: 0.9278, test_f1: 0.4853
 epoch: 62, train_loss: 0.9676, test_loss: 0.9616, test_f1: 0.4746
 epoch: 63, train_loss: 0.9671, test_loss: 0.9267, test_f1: 0.4939
 epoch: 64, train_loss: 0.9636, test_loss: 1.0056, test_f1: 0.4819
 epoch: 65, train_loss: 0.9552, test_loss: 0.9260, test_f1: 0.4921
 epoch: 66, train_loss: 0.9560, test_loss: 0.9471, test_f1: 0.4794
 epoch: 67, train_loss: 0.9667, test_loss: 0.9483, test_f1: 0.4820
 epoch: 68, train_loss: 0.9666, test_loss: 0.9333, test_f1: 0.4907
 epoch: 69, train_loss: 0.9569, test_loss: 1.0043, test_f1: 0.4666
 epoch: 70, train_loss: 0.9505, test_loss: 0.9403, test_f1: 0.4893
 epoch: 71, train_loss: 0.9562, test_loss: 0.9489, test_f1: 0.4978
 epoch: 72, train_loss: 0.9488, test_loss: 0.9448, test_f1: 0.4804
 epoch: 73, train_loss: 0.9462, test_loss: 0.9413, test_f1: 0.4843
 epoch: 74, train_loss: 0.9593, test_loss: 0.9196, test_f1: 0.4988
 epoch: 75, train_loss: 0.9542, test_loss: 0.9363, test_f1: 0.4902
 epoch: 76, train_loss: 0.9523, test_loss: 0.9200, test_f1: 0.4948
 epoch: 77, train_loss: 0.9568, test_loss: 0.9386, test_f1: 0.4911
 epoch: 78, train_loss: 0.9483, test_loss: 0.9258, test_f1: 0.4994
 epoch: 79, train_loss: 0.9513, test_loss: 0.9288, test_f1: 0.4963
 epoch: 80, train_loss: 0.9539, test_loss: 0.9400, test_f1: 0.4915
 epoch: 81, train_loss: 0.9496, test_loss: 0.9193, test_f1: 0.5098
 epoch: 82, train_loss: 0.9393, test_loss: 0.9314, test_f1: 0.4912
 epoch: 83, train_loss: 0.9479, test_loss: 0.9710, test_f1: 0.4826
 epoch: 84, train_loss: 0.9394, test_loss: 0.9207, test_f1: 0.5090
 epoch: 85, train_loss: 0.9464, test_loss: 0.9368, test_f1: 0.4898
 epoch: 86, train_loss: 0.9435, test_loss: 0.9215, test_f1: 0.5073
 epoch: 87, train_loss: 0.9316, test_loss: 0.9114, test_f1: 0.5022
 epoch: 88, train_loss: 0.9419, test_loss: 0.9241, test_f1: 0.4981
 epoch: 89, train_loss: 0.9341, test_loss: 0.9332, test_f1: 0.5023
 epoch: 90, train_loss: 0.9440, test_loss: 0.9450, test_f1: 0.4852
 epoch: 91, train_loss: 0.9353, test_loss: 0.9126, test_f1: 0.5164
 epoch: 92, train_loss: 0.9365, test_loss: 0.9499, test_f1: 0.4891
 epoch: 93, train_loss: 0.9379, test_loss: 0.9166, test_f1: 0.5042
 epoch: 94, train_loss: 0.9323, test_loss: 0.9293, test_f1: 0.4974
 epoch: 95, train_loss: 0.9362, test_loss: 0.9188, test_f1: 0.4996
 epoch: 96, train_loss: 0.9378, test_loss: 0.9474, test_f1: 0.4935
 epoch: 97, train_loss: 0.9353, test_loss: 0.9307, test_f1: 0.5052
 epoch: 98, train_loss: 0.9371, test_loss: 0.9695, test_f1: 0.4755
 epoch: 99, train_loss: 0.9342, test_loss: 0.9242, test_f1: 0.5022
##################ITERATION #5 ****************************************
 epoch: 0, train_loss: 1.6205, test_loss: 1.3885, test_f1: 0.1546
 epoch: 1, train_loss: 1.3643, test_loss: 1.3095, test_f1: 0.2546
 epoch: 2, train_loss: 1.3184, test_loss: 1.2722, test_f1: 0.2681
 epoch: 3, train_loss: 1.2841, test_loss: 1.2529, test_f1: 0.3097
 epoch: 4, train_loss: 1.2639, test_loss: 1.2324, test_f1: 0.3422
 epoch: 5, train_loss: 1.2429, test_loss: 1.2064, test_f1: 0.3453
 epoch: 6, train_loss: 1.2348, test_loss: 1.1915, test_f1: 0.3570
 epoch: 7, train_loss: 1.2203, test_loss: 1.1799, test_f1: 0.3743
 epoch: 8, train_loss: 1.2140, test_loss: 1.1585, test_f1: 0.3957
 epoch: 9, train_loss: 1.1913, test_loss: 1.1435, test_f1: 0.4078
 epoch: 10, train_loss: 1.1805, test_loss: 1.1231, test_f1: 0.4100
 epoch: 11, train_loss: 1.1689, test_loss: 1.1070, test_f1: 0.4233
 epoch: 12, train_loss: 1.1581, test_loss: 1.1007, test_f1: 0.4211
 epoch: 13, train_loss: 1.1469, test_loss: 1.0842, test_f1: 0.4204
 epoch: 14, train_loss: 1.1271, test_loss: 1.0804, test_f1: 0.4316
 epoch: 15, train_loss: 1.1347, test_loss: 1.0807, test_f1: 0.4208
 epoch: 16, train_loss: 1.1279, test_loss: 1.0705, test_f1: 0.4416
 epoch: 17, train_loss: 1.1119, test_loss: 1.0579, test_f1: 0.4335
 epoch: 18, train_loss: 1.1092, test_loss: 1.0699, test_f1: 0.4313
 epoch: 19, train_loss: 1.0995, test_loss: 1.0551, test_f1: 0.4448
 epoch: 20, train_loss: 1.0947, test_loss: 1.0505, test_f1: 0.4416
 epoch: 21, train_loss: 1.0884, test_loss: 1.0608, test_f1: 0.4253
 epoch: 22, train_loss: 1.0819, test_loss: 1.0472, test_f1: 0.4404
 epoch: 23, train_loss: 1.0707, test_loss: 1.0356, test_f1: 0.4582
 epoch: 24, train_loss: 1.0783, test_loss: 1.0287, test_f1: 0.4701
 epoch: 25, train_loss: 1.0698, test_loss: 1.0283, test_f1: 0.4632
 epoch: 26, train_loss: 1.0644, test_loss: 1.0359, test_f1: 0.4614
 epoch: 27, train_loss: 1.0480, test_loss: 1.0315, test_f1: 0.4628
 epoch: 28, train_loss: 1.0406, test_loss: 1.0290, test_f1: 0.4718
 epoch: 29, train_loss: 1.0372, test_loss: 1.0292, test_f1: 0.4726
 epoch: 30, train_loss: 1.0359, test_loss: 1.0186, test_f1: 0.4655
 epoch: 31, train_loss: 1.0331, test_loss: 1.0256, test_f1: 0.4672
 epoch: 32, train_loss: 1.0238, test_loss: 1.0131, test_f1: 0.4820
 epoch: 33, train_loss: 1.0216, test_loss: 1.0093, test_f1: 0.4658
 epoch: 34, train_loss: 1.0210, test_loss: 1.0159, test_f1: 0.4644
 epoch: 35, train_loss: 1.0222, test_loss: 1.0138, test_f1: 0.4647
 epoch: 36, train_loss: 1.0105, test_loss: 1.0151, test_f1: 0.4725
 epoch: 37, train_loss: 1.0090, test_loss: 1.0246, test_f1: 0.4520
 epoch: 38, train_loss: 1.0050, test_loss: 1.0144, test_f1: 0.4316
 epoch: 39, train_loss: 1.0022, test_loss: 1.0301, test_f1: 0.4504
 epoch: 40, train_loss: 0.9878, test_loss: 1.0108, test_f1: 0.4594
 epoch: 41, train_loss: 0.9976, test_loss: 1.0150, test_f1: 0.4524
 epoch: 42, train_loss: 0.9948, test_loss: 1.0332, test_f1: 0.4441
 epoch: 43, train_loss: 0.9943, test_loss: 1.0116, test_f1: 0.4672
 epoch: 44, train_loss: 0.9812, test_loss: 1.0059, test_f1: 0.4610
 epoch: 45, train_loss: 0.9792, test_loss: 1.0173, test_f1: 0.4446
 epoch: 46, train_loss: 0.9759, test_loss: 1.0249, test_f1: 0.4662
 epoch: 47, train_loss: 0.9823, test_loss: 1.0115, test_f1: 0.4546
 epoch: 48, train_loss: 0.9729, test_loss: 1.0136, test_f1: 0.4591
 epoch: 49, train_loss: 0.9603, test_loss: 1.0250, test_f1: 0.4624
 epoch: 50, train_loss: 0.9655, test_loss: 1.0209, test_f1: 0.4512
 epoch: 51, train_loss: 0.9608, test_loss: 1.0184, test_f1: 0.4592
 epoch: 52, train_loss: 0.9665, test_loss: 1.0294, test_f1: 0.4520
 epoch: 53, train_loss: 0.9512, test_loss: 1.0188, test_f1: 0.4663
 epoch: 54, train_loss: 0.9489, test_loss: 1.0167, test_f1: 0.4537
 epoch: 55, train_loss: 0.9449, test_loss: 1.0201, test_f1: 0.4732
 epoch: 56, train_loss: 0.9603, test_loss: 1.0268, test_f1: 0.4615
 epoch: 57, train_loss: 0.9461, test_loss: 1.0116, test_f1: 0.4634
 epoch: 58, train_loss: 0.9458, test_loss: 1.0154, test_f1: 0.4584
 epoch: 59, train_loss: 0.9413, test_loss: 1.0314, test_f1: 0.4454
 epoch: 60, train_loss: 0.9453, test_loss: 1.0387, test_f1: 0.4524
 epoch: 61, train_loss: 0.9476, test_loss: 1.0328, test_f1: 0.4503
 epoch: 62, train_loss: 0.9474, test_loss: 1.0341, test_f1: 0.4524
 epoch: 63, train_loss: 0.9325, test_loss: 1.0283, test_f1: 0.4549
 epoch: 64, train_loss: 0.9383, test_loss: 1.0242, test_f1: 0.4511
 epoch: 65, train_loss: 0.9289, test_loss: 1.0292, test_f1: 0.4552
 epoch: 66, train_loss: 0.9266, test_loss: 1.0323, test_f1: 0.4617
 epoch: 67, train_loss: 0.9228, test_loss: 1.0358, test_f1: 0.4524
 epoch: 68, train_loss: 0.9342, test_loss: 1.0339, test_f1: 0.4665
 epoch: 69, train_loss: 0.9279, test_loss: 1.0509, test_f1: 0.4506
 epoch: 70, train_loss: 0.9253, test_loss: 1.0446, test_f1: 0.4661
 epoch: 71, train_loss: 0.9253, test_loss: 1.0352, test_f1: 0.4596
 epoch: 72, train_loss: 0.9312, test_loss: 1.0451, test_f1: 0.4563
 epoch: 73, train_loss: 0.9205, test_loss: 1.0485, test_f1: 0.4545
 epoch: 74, train_loss: 0.9272, test_loss: 1.0550, test_f1: 0.4672
 epoch: 75, train_loss: 0.9200, test_loss: 1.0577, test_f1: 0.4515
 epoch: 76, train_loss: 0.9277, test_loss: 1.0394, test_f1: 0.4537
 epoch: 77, train_loss: 0.9192, test_loss: 1.0467, test_f1: 0.4493
 epoch: 78, train_loss: 0.9210, test_loss: 1.0596, test_f1: 0.4640
 epoch: 79, train_loss: 0.9176, test_loss: 1.0775, test_f1: 0.4444
 epoch: 80, train_loss: 0.9104, test_loss: 1.0673, test_f1: 0.4648
 epoch: 81, train_loss: 0.9101, test_loss: 1.0543, test_f1: 0.4480
 epoch: 82, train_loss: 0.9063, test_loss: 1.0713, test_f1: 0.4646
 epoch: 83, train_loss: 0.9215, test_loss: 1.0868, test_f1: 0.4605
 epoch: 84, train_loss: 0.9069, test_loss: 1.0770, test_f1: 0.4645
 epoch: 85, train_loss: 0.9060, test_loss: 1.0740, test_f1: 0.4448
 epoch: 86, train_loss: 0.9071, test_loss: 1.0633, test_f1: 0.4551
 epoch: 87, train_loss: 0.8905, test_loss: 1.0607, test_f1: 0.4606
 epoch: 88, train_loss: 0.9023, test_loss: 1.0578, test_f1: 0.4663
 epoch: 89, train_loss: 0.8950, test_loss: 1.0593, test_f1: 0.4539
 epoch: 90, train_loss: 0.8992, test_loss: 1.0602, test_f1: 0.4564
 epoch: 91, train_loss: 0.9091, test_loss: 1.0472, test_f1: 0.4816
 epoch: 92, train_loss: 0.8907, test_loss: 1.0571, test_f1: 0.4698
 epoch: 93, train_loss: 0.8922, test_loss: 1.0660, test_f1: 0.4644
 epoch: 94, train_loss: 0.8997, test_loss: 1.0979, test_f1: 0.4581
 epoch: 95, train_loss: 0.8881, test_loss: 1.0758, test_f1: 0.4540
 epoch: 96, train_loss: 0.8937, test_loss: 1.0382, test_f1: 0.4688
 epoch: 97, train_loss: 0.8939, test_loss: 1.0516, test_f1: 0.4587
 epoch: 98, train_loss: 0.8934, test_loss: 1.0433, test_f1: 0.4664
 epoch: 99, train_loss: 0.8840, test_loss: 1.0574, test_f1: 0.4591
##################ITERATION #6 ****************************************
 epoch: 0, train_loss: 1.6151, test_loss: 1.3276, test_f1: 0.2274
 epoch: 1, train_loss: 1.3740, test_loss: 1.3349, test_f1: 0.2274
 epoch: 2, train_loss: 1.3105, test_loss: 1.2992, test_f1: 0.2967
 epoch: 3, train_loss: 1.2920, test_loss: 1.2474, test_f1: 0.3273
 epoch: 4, train_loss: 1.2834, test_loss: 1.2375, test_f1: 0.3667
 epoch: 5, train_loss: 1.2469, test_loss: 1.2252, test_f1: 0.3788
 epoch: 6, train_loss: 1.2348, test_loss: 1.2061, test_f1: 0.3788
 epoch: 7, train_loss: 1.2294, test_loss: 1.1961, test_f1: 0.3848
 epoch: 8, train_loss: 1.2100, test_loss: 1.1806, test_f1: 0.3791
 epoch: 9, train_loss: 1.2161, test_loss: 1.1720, test_f1: 0.3828
 epoch: 10, train_loss: 1.1986, test_loss: 1.1606, test_f1: 0.4001
 epoch: 11, train_loss: 1.1881, test_loss: 1.1540, test_f1: 0.4070
 epoch: 12, train_loss: 1.1809, test_loss: 1.1516, test_f1: 0.4179
 epoch: 13, train_loss: 1.1774, test_loss: 1.1351, test_f1: 0.4212
 epoch: 14, train_loss: 1.1705, test_loss: 1.1333, test_f1: 0.4271
 epoch: 15, train_loss: 1.1597, test_loss: 1.1243, test_f1: 0.4235
 epoch: 16, train_loss: 1.1488, test_loss: 1.1053, test_f1: 0.4272
 epoch: 17, train_loss: 1.1452, test_loss: 1.1120, test_f1: 0.4304
 epoch: 18, train_loss: 1.1310, test_loss: 1.1025, test_f1: 0.4295
 epoch: 19, train_loss: 1.1302, test_loss: 1.0930, test_f1: 0.4333
 epoch: 20, train_loss: 1.1255, test_loss: 1.0868, test_f1: 0.4309
 epoch: 21, train_loss: 1.1084, test_loss: 1.0844, test_f1: 0.4460
 epoch: 22, train_loss: 1.1090, test_loss: 1.0777, test_f1: 0.4447
 epoch: 23, train_loss: 1.1029, test_loss: 1.0683, test_f1: 0.4606
 epoch: 24, train_loss: 1.0954, test_loss: 1.0928, test_f1: 0.4501
 epoch: 25, train_loss: 1.1025, test_loss: 1.0726, test_f1: 0.4302
 epoch: 26, train_loss: 1.0858, test_loss: 1.0604, test_f1: 0.4456
 epoch: 27, train_loss: 1.0855, test_loss: 1.0552, test_f1: 0.4700
 epoch: 28, train_loss: 1.0873, test_loss: 1.0654, test_f1: 0.4469
 epoch: 29, train_loss: 1.0733, test_loss: 1.0690, test_f1: 0.4427
 epoch: 30, train_loss: 1.0707, test_loss: 1.0502, test_f1: 0.4595
 epoch: 31, train_loss: 1.0628, test_loss: 1.0373, test_f1: 0.4782
 epoch: 32, train_loss: 1.0600, test_loss: 1.0637, test_f1: 0.4436
 epoch: 33, train_loss: 1.0593, test_loss: 1.0564, test_f1: 0.4443
 epoch: 34, train_loss: 1.0556, test_loss: 1.0337, test_f1: 0.4689
 epoch: 35, train_loss: 1.0435, test_loss: 1.0403, test_f1: 0.4680
 epoch: 36, train_loss: 1.0408, test_loss: 1.0486, test_f1: 0.4629
 epoch: 37, train_loss: 1.0422, test_loss: 1.0752, test_f1: 0.4428
 epoch: 38, train_loss: 1.0255, test_loss: 1.0711, test_f1: 0.4529
 epoch: 39, train_loss: 1.0317, test_loss: 1.0372, test_f1: 0.4681
 epoch: 40, train_loss: 1.0237, test_loss: 1.0614, test_f1: 0.4611
 epoch: 41, train_loss: 1.0303, test_loss: 1.0669, test_f1: 0.4550
 epoch: 42, train_loss: 1.0088, test_loss: 1.0915, test_f1: 0.4494
 epoch: 43, train_loss: 1.0216, test_loss: 1.1061, test_f1: 0.4434
 epoch: 44, train_loss: 1.0124, test_loss: 1.0671, test_f1: 0.4520
 epoch: 45, train_loss: 1.0056, test_loss: 1.0912, test_f1: 0.4515
 epoch: 46, train_loss: 1.0013, test_loss: 1.0561, test_f1: 0.4721
 epoch: 47, train_loss: 0.9946, test_loss: 1.0776, test_f1: 0.4617
 epoch: 48, train_loss: 0.9867, test_loss: 1.0405, test_f1: 0.4826
 epoch: 49, train_loss: 0.9902, test_loss: 1.0917, test_f1: 0.4442
 epoch: 50, train_loss: 0.9812, test_loss: 1.0849, test_f1: 0.4572
 epoch: 51, train_loss: 0.9708, test_loss: 1.1023, test_f1: 0.4399
 epoch: 52, train_loss: 0.9724, test_loss: 1.0817, test_f1: 0.4519
 epoch: 53, train_loss: 0.9583, test_loss: 1.1128, test_f1: 0.4377
 epoch: 54, train_loss: 0.9861, test_loss: 1.0910, test_f1: 0.4725
 epoch: 55, train_loss: 0.9639, test_loss: 1.0934, test_f1: 0.4465
 epoch: 56, train_loss: 0.9692, test_loss: 1.1373, test_f1: 0.4476
 epoch: 57, train_loss: 0.9706, test_loss: 1.1109, test_f1: 0.4692
 epoch: 58, train_loss: 0.9623, test_loss: 1.1202, test_f1: 0.4599
 epoch: 59, train_loss: 0.9631, test_loss: 1.1245, test_f1: 0.4496
 epoch: 60, train_loss: 0.9592, test_loss: 1.1341, test_f1: 0.4564
 epoch: 61, train_loss: 0.9567, test_loss: 1.1217, test_f1: 0.4610
 epoch: 62, train_loss: 0.9491, test_loss: 1.1307, test_f1: 0.4483
 epoch: 63, train_loss: 0.9463, test_loss: 1.1300, test_f1: 0.4362
 epoch: 64, train_loss: 0.9513, test_loss: 1.1301, test_f1: 0.4493
 epoch: 65, train_loss: 0.9537, test_loss: 1.1031, test_f1: 0.4701
 epoch: 66, train_loss: 0.9428, test_loss: 1.1692, test_f1: 0.4523
 epoch: 67, train_loss: 0.9481, test_loss: 1.1246, test_f1: 0.4659
 epoch: 68, train_loss: 0.9497, test_loss: 1.1116, test_f1: 0.4528
 epoch: 69, train_loss: 0.9340, test_loss: 1.1263, test_f1: 0.4486
 epoch: 70, train_loss: 0.9381, test_loss: 1.1344, test_f1: 0.4623
 epoch: 71, train_loss: 0.9370, test_loss: 1.1431, test_f1: 0.4528
 epoch: 72, train_loss: 0.9397, test_loss: 1.1403, test_f1: 0.4629
 epoch: 73, train_loss: 0.9378, test_loss: 1.1411, test_f1: 0.4619
 epoch: 74, train_loss: 0.9276, test_loss: 1.1637, test_f1: 0.4518
 epoch: 75, train_loss: 0.9383, test_loss: 1.1104, test_f1: 0.4722
 epoch: 76, train_loss: 0.9401, test_loss: 1.1362, test_f1: 0.4651
 epoch: 77, train_loss: 0.9253, test_loss: 1.1592, test_f1: 0.4583
 epoch: 78, train_loss: 0.9309, test_loss: 1.1488, test_f1: 0.4618
 epoch: 79, train_loss: 0.9359, test_loss: 1.1483, test_f1: 0.4517
 epoch: 80, train_loss: 0.9250, test_loss: 1.1520, test_f1: 0.4474
 epoch: 81, train_loss: 0.9278, test_loss: 1.1337, test_f1: 0.4741
 epoch: 82, train_loss: 0.9236, test_loss: 1.1807, test_f1: 0.4585
 epoch: 83, train_loss: 0.9214, test_loss: 1.1336, test_f1: 0.4539
 epoch: 84, train_loss: 0.9186, test_loss: 1.1524, test_f1: 0.4608
 epoch: 85, train_loss: 0.9216, test_loss: 1.1807, test_f1: 0.4618
 epoch: 86, train_loss: 0.9141, test_loss: 1.1188, test_f1: 0.4879
 epoch: 87, train_loss: 0.9153, test_loss: 1.1584, test_f1: 0.4526
 epoch: 88, train_loss: 0.9186, test_loss: 1.1345, test_f1: 0.4714
 epoch: 89, train_loss: 0.9099, test_loss: 1.1690, test_f1: 0.4549
 epoch: 90, train_loss: 0.9122, test_loss: 1.1574, test_f1: 0.4475
 epoch: 91, train_loss: 0.9067, test_loss: 1.1382, test_f1: 0.4623
 epoch: 92, train_loss: 0.9184, test_loss: 1.1734, test_f1: 0.4503
 epoch: 93, train_loss: 0.9053, test_loss: 1.1475, test_f1: 0.4583
 epoch: 94, train_loss: 0.9090, test_loss: 1.1565, test_f1: 0.4483
 epoch: 95, train_loss: 0.9116, test_loss: 1.1454, test_f1: 0.4871
 epoch: 96, train_loss: 0.9143, test_loss: 1.1515, test_f1: 0.4663
 epoch: 97, train_loss: 0.9011, test_loss: 1.1184, test_f1: 0.4893
 epoch: 98, train_loss: 0.9079, test_loss: 1.1665, test_f1: 0.4635
 epoch: 99, train_loss: 0.9011, test_loss: 1.1774, test_f1: 0.4555
##################ITERATION #7 ****************************************
 epoch: 0, train_loss: 1.5392, test_loss: 1.3554, test_f1: 0.2274
 epoch: 1, train_loss: 1.3225, test_loss: 1.3120, test_f1: 0.2924
 epoch: 2, train_loss: 1.2872, test_loss: 1.2686, test_f1: 0.2994
 epoch: 3, train_loss: 1.2555, test_loss: 1.2302, test_f1: 0.3571
 epoch: 4, train_loss: 1.2145, test_loss: 1.1898, test_f1: 0.3859
 epoch: 5, train_loss: 1.2025, test_loss: 1.1547, test_f1: 0.4231
 epoch: 6, train_loss: 1.1873, test_loss: 1.1381, test_f1: 0.4448
 epoch: 7, train_loss: 1.1800, test_loss: 1.1272, test_f1: 0.4476
 epoch: 8, train_loss: 1.1641, test_loss: 1.1132, test_f1: 0.4412
 epoch: 9, train_loss: 1.1488, test_loss: 1.1066, test_f1: 0.4344
 epoch: 10, train_loss: 1.1634, test_loss: 1.0999, test_f1: 0.4416
 epoch: 11, train_loss: 1.1329, test_loss: 1.0884, test_f1: 0.4525
 epoch: 12, train_loss: 1.1360, test_loss: 1.0827, test_f1: 0.4509
 epoch: 13, train_loss: 1.1282, test_loss: 1.0766, test_f1: 0.4616
 epoch: 14, train_loss: 1.1245, test_loss: 1.0767, test_f1: 0.4557
 epoch: 15, train_loss: 1.1192, test_loss: 1.0695, test_f1: 0.4490
 epoch: 16, train_loss: 1.1126, test_loss: 1.0672, test_f1: 0.4439
 epoch: 17, train_loss: 1.1074, test_loss: 1.0666, test_f1: 0.4448
 epoch: 18, train_loss: 1.0986, test_loss: 1.0582, test_f1: 0.4416
 epoch: 19, train_loss: 1.0902, test_loss: 1.0457, test_f1: 0.4327
 epoch: 20, train_loss: 1.0949, test_loss: 1.0469, test_f1: 0.4286
 epoch: 21, train_loss: 1.0848, test_loss: 1.0436, test_f1: 0.4328
 epoch: 22, train_loss: 1.0728, test_loss: 1.0361, test_f1: 0.4378
 epoch: 23, train_loss: 1.0746, test_loss: 1.0240, test_f1: 0.4399
 epoch: 24, train_loss: 1.0708, test_loss: 1.0190, test_f1: 0.4396
 epoch: 25, train_loss: 1.0670, test_loss: 1.0274, test_f1: 0.4314
 epoch: 26, train_loss: 1.0512, test_loss: 1.0207, test_f1: 0.4315
 epoch: 27, train_loss: 1.0447, test_loss: 1.0176, test_f1: 0.4299
 epoch: 28, train_loss: 1.0423, test_loss: 1.0154, test_f1: 0.4507
 epoch: 29, train_loss: 1.0409, test_loss: 1.0056, test_f1: 0.4404
 epoch: 30, train_loss: 1.0284, test_loss: 1.0130, test_f1: 0.4496
 epoch: 31, train_loss: 1.0289, test_loss: 1.0043, test_f1: 0.4536
 epoch: 32, train_loss: 1.0316, test_loss: 1.0199, test_f1: 0.4391
 epoch: 33, train_loss: 1.0204, test_loss: 1.0083, test_f1: 0.4472
 epoch: 34, train_loss: 1.0183, test_loss: 1.0084, test_f1: 0.4564
 epoch: 35, train_loss: 1.0149, test_loss: 0.9896, test_f1: 0.4693
 epoch: 36, train_loss: 1.0085, test_loss: 0.9872, test_f1: 0.4651
 epoch: 37, train_loss: 1.0062, test_loss: 0.9932, test_f1: 0.4585
 epoch: 38, train_loss: 0.9965, test_loss: 1.0298, test_f1: 0.4522
 epoch: 39, train_loss: 1.0052, test_loss: 0.9974, test_f1: 0.4568
 epoch: 40, train_loss: 0.9998, test_loss: 0.9688, test_f1: 0.4818
 epoch: 41, train_loss: 0.9934, test_loss: 1.0077, test_f1: 0.4610
 epoch: 42, train_loss: 0.9841, test_loss: 0.9879, test_f1: 0.4580
 epoch: 43, train_loss: 0.9739, test_loss: 1.0052, test_f1: 0.4563
 epoch: 44, train_loss: 0.9655, test_loss: 0.9893, test_f1: 0.4746
 epoch: 45, train_loss: 0.9787, test_loss: 0.9686, test_f1: 0.4800
 epoch: 46, train_loss: 0.9742, test_loss: 1.0100, test_f1: 0.4630
 epoch: 47, train_loss: 0.9709, test_loss: 0.9617, test_f1: 0.4865
 epoch: 48, train_loss: 0.9701, test_loss: 0.9762, test_f1: 0.4666
 epoch: 49, train_loss: 0.9639, test_loss: 1.0091, test_f1: 0.4636
 epoch: 50, train_loss: 0.9570, test_loss: 1.0060, test_f1: 0.4775
 epoch: 51, train_loss: 0.9490, test_loss: 0.9985, test_f1: 0.4741
 epoch: 52, train_loss: 0.9471, test_loss: 0.9778, test_f1: 0.4730
 epoch: 53, train_loss: 0.9469, test_loss: 1.0067, test_f1: 0.4773
 epoch: 54, train_loss: 0.9388, test_loss: 0.9894, test_f1: 0.4710
 epoch: 55, train_loss: 0.9492, test_loss: 0.9998, test_f1: 0.4753
 epoch: 56, train_loss: 0.9452, test_loss: 0.9978, test_f1: 0.4700
 epoch: 57, train_loss: 0.9487, test_loss: 0.9947, test_f1: 0.4695
 epoch: 58, train_loss: 0.9379, test_loss: 0.9968, test_f1: 0.4722
 epoch: 59, train_loss: 0.9390, test_loss: 0.9881, test_f1: 0.4740
 epoch: 60, train_loss: 0.9373, test_loss: 0.9906, test_f1: 0.4768
 epoch: 61, train_loss: 0.9331, test_loss: 0.9839, test_f1: 0.4822
 epoch: 62, train_loss: 0.9262, test_loss: 0.9825, test_f1: 0.4875
 epoch: 63, train_loss: 0.9303, test_loss: 1.0044, test_f1: 0.4815
 epoch: 64, train_loss: 0.9243, test_loss: 1.0352, test_f1: 0.4675
 epoch: 65, train_loss: 0.9339, test_loss: 0.9950, test_f1: 0.4802
 epoch: 66, train_loss: 0.9299, test_loss: 0.9806, test_f1: 0.4819
 epoch: 67, train_loss: 0.9226, test_loss: 0.9944, test_f1: 0.4639
 epoch: 68, train_loss: 0.9187, test_loss: 0.9883, test_f1: 0.4761
 epoch: 69, train_loss: 0.9336, test_loss: 0.9838, test_f1: 0.4835
 epoch: 70, train_loss: 0.9165, test_loss: 0.9993, test_f1: 0.4716
 epoch: 71, train_loss: 0.9203, test_loss: 1.0014, test_f1: 0.4735
 epoch: 72, train_loss: 0.9215, test_loss: 1.0091, test_f1: 0.4695
 epoch: 73, train_loss: 0.9150, test_loss: 1.0150, test_f1: 0.4739
 epoch: 74, train_loss: 0.9243, test_loss: 1.0169, test_f1: 0.4701
 epoch: 75, train_loss: 0.9043, test_loss: 1.0009, test_f1: 0.4838
 epoch: 76, train_loss: 0.9155, test_loss: 1.0032, test_f1: 0.4812
 epoch: 77, train_loss: 0.9051, test_loss: 1.0092, test_f1: 0.4778
 epoch: 78, train_loss: 0.9088, test_loss: 0.9970, test_f1: 0.4820
 epoch: 79, train_loss: 0.9069, test_loss: 1.0172, test_f1: 0.4776
 epoch: 80, train_loss: 0.9214, test_loss: 1.0127, test_f1: 0.4825
 epoch: 81, train_loss: 0.9112, test_loss: 1.0060, test_f1: 0.4923
 epoch: 82, train_loss: 0.9076, test_loss: 1.0118, test_f1: 0.4775
 epoch: 83, train_loss: 0.9092, test_loss: 1.0095, test_f1: 0.4698
 epoch: 84, train_loss: 0.9111, test_loss: 1.0009, test_f1: 0.4836
 epoch: 85, train_loss: 0.9033, test_loss: 1.0332, test_f1: 0.4658
 epoch: 86, train_loss: 0.8938, test_loss: 1.0280, test_f1: 0.4699
 epoch: 87, train_loss: 0.9003, test_loss: 1.0164, test_f1: 0.4819
 epoch: 88, train_loss: 0.8913, test_loss: 1.0340, test_f1: 0.4781
 epoch: 89, train_loss: 0.9048, test_loss: 1.0062, test_f1: 0.4782
 epoch: 90, train_loss: 0.8943, test_loss: 1.0031, test_f1: 0.4793
 epoch: 91, train_loss: 0.8895, test_loss: 0.9934, test_f1: 0.4766
 epoch: 92, train_loss: 0.9007, test_loss: 1.0274, test_f1: 0.4704
 epoch: 93, train_loss: 0.8891, test_loss: 1.0103, test_f1: 0.5042
 epoch: 94, train_loss: 0.9011, test_loss: 1.0186, test_f1: 0.4912
 epoch: 95, train_loss: 0.8924, test_loss: 1.0097, test_f1: 0.4831
 epoch: 96, train_loss: 0.8892, test_loss: 0.9962, test_f1: 0.4822
 epoch: 97, train_loss: 0.8909, test_loss: 1.0090, test_f1: 0.4943
 epoch: 98, train_loss: 0.8847, test_loss: 1.0280, test_f1: 0.4876
 epoch: 99, train_loss: 0.8808, test_loss: 0.9899, test_f1: 0.4810
##################ITERATION #8 ****************************************
 epoch: 0, train_loss: 1.4646, test_loss: 1.2861, test_f1: 0.2274
 epoch: 1, train_loss: 1.3104, test_loss: 1.2686, test_f1: 0.2274
 epoch: 2, train_loss: 1.2694, test_loss: 1.2331, test_f1: 0.2802
 epoch: 3, train_loss: 1.2393, test_loss: 1.2043, test_f1: 0.3793
 epoch: 4, train_loss: 1.2110, test_loss: 1.1924, test_f1: 0.3841
 epoch: 5, train_loss: 1.1964, test_loss: 1.1698, test_f1: 0.3764
 epoch: 6, train_loss: 1.1914, test_loss: 1.1599, test_f1: 0.3863
 epoch: 7, train_loss: 1.1836, test_loss: 1.1538, test_f1: 0.3920
 epoch: 8, train_loss: 1.1761, test_loss: 1.1449, test_f1: 0.3952
 epoch: 9, train_loss: 1.1705, test_loss: 1.1366, test_f1: 0.4037
 epoch: 10, train_loss: 1.1687, test_loss: 1.1243, test_f1: 0.4160
 epoch: 11, train_loss: 1.1575, test_loss: 1.1251, test_f1: 0.4038
 epoch: 12, train_loss: 1.1517, test_loss: 1.1218, test_f1: 0.4154
 epoch: 13, train_loss: 1.1470, test_loss: 1.1118, test_f1: 0.4261
 epoch: 14, train_loss: 1.1371, test_loss: 1.1081, test_f1: 0.4246
 epoch: 15, train_loss: 1.1289, test_loss: 1.0990, test_f1: 0.4313
 epoch: 16, train_loss: 1.1304, test_loss: 1.0852, test_f1: 0.4366
 epoch: 17, train_loss: 1.1121, test_loss: 1.0841, test_f1: 0.4369
 epoch: 18, train_loss: 1.1090, test_loss: 1.0809, test_f1: 0.4354
 epoch: 19, train_loss: 1.0987, test_loss: 1.0714, test_f1: 0.4369
 epoch: 20, train_loss: 1.0997, test_loss: 1.0612, test_f1: 0.4416
 epoch: 21, train_loss: 1.0910, test_loss: 1.0576, test_f1: 0.4329
 epoch: 22, train_loss: 1.0857, test_loss: 1.0535, test_f1: 0.4371
 epoch: 23, train_loss: 1.0815, test_loss: 1.0408, test_f1: 0.4481
 epoch: 24, train_loss: 1.0752, test_loss: 1.0365, test_f1: 0.4491
 epoch: 25, train_loss: 1.0621, test_loss: 1.0193, test_f1: 0.4561
 epoch: 26, train_loss: 1.0572, test_loss: 1.0198, test_f1: 0.4507
 epoch: 27, train_loss: 1.0570, test_loss: 1.0322, test_f1: 0.4377
 epoch: 28, train_loss: 1.0499, test_loss: 1.0056, test_f1: 0.4474
 epoch: 29, train_loss: 1.0400, test_loss: 1.0236, test_f1: 0.4419
 epoch: 30, train_loss: 1.0424, test_loss: 1.0122, test_f1: 0.4416
 epoch: 31, train_loss: 1.0347, test_loss: 0.9948, test_f1: 0.4509
 epoch: 32, train_loss: 1.0230, test_loss: 0.9996, test_f1: 0.4377
 epoch: 33, train_loss: 1.0165, test_loss: 0.9921, test_f1: 0.4419
 epoch: 34, train_loss: 1.0140, test_loss: 0.9852, test_f1: 0.4406
 epoch: 35, train_loss: 1.0087, test_loss: 0.9806, test_f1: 0.4523
 epoch: 36, train_loss: 0.9990, test_loss: 0.9850, test_f1: 0.4450
 epoch: 37, train_loss: 0.9845, test_loss: 0.9721, test_f1: 0.4532
 epoch: 38, train_loss: 0.9860, test_loss: 0.9862, test_f1: 0.4491
 epoch: 39, train_loss: 0.9795, test_loss: 0.9792, test_f1: 0.4516
 epoch: 40, train_loss: 0.9802, test_loss: 0.9687, test_f1: 0.4728
 epoch: 41, train_loss: 0.9741, test_loss: 0.9840, test_f1: 0.4648
 epoch: 42, train_loss: 0.9766, test_loss: 0.9816, test_f1: 0.4595
 epoch: 43, train_loss: 0.9647, test_loss: 0.9827, test_f1: 0.4593
 epoch: 44, train_loss: 0.9672, test_loss: 0.9787, test_f1: 0.4606
 epoch: 45, train_loss: 0.9659, test_loss: 0.9885, test_f1: 0.4585
 epoch: 46, train_loss: 0.9483, test_loss: 0.9684, test_f1: 0.4647
 epoch: 47, train_loss: 0.9482, test_loss: 1.0067, test_f1: 0.4517
 epoch: 48, train_loss: 0.9337, test_loss: 0.9861, test_f1: 0.4686
 epoch: 49, train_loss: 0.9371, test_loss: 0.9863, test_f1: 0.4708
 epoch: 50, train_loss: 0.9326, test_loss: 1.0212, test_f1: 0.4587
 epoch: 51, train_loss: 0.9301, test_loss: 0.9795, test_f1: 0.4616
 epoch: 52, train_loss: 0.9333, test_loss: 0.9916, test_f1: 0.4632
 epoch: 53, train_loss: 0.9217, test_loss: 0.9651, test_f1: 0.4598
 epoch: 54, train_loss: 0.9158, test_loss: 1.0002, test_f1: 0.4590
 epoch: 55, train_loss: 0.9217, test_loss: 0.9799, test_f1: 0.4563
 epoch: 56, train_loss: 0.9241, test_loss: 0.9674, test_f1: 0.4591
 epoch: 57, train_loss: 0.9128, test_loss: 0.9988, test_f1: 0.4700
 epoch: 58, train_loss: 0.9121, test_loss: 0.9841, test_f1: 0.4787
 epoch: 59, train_loss: 0.9143, test_loss: 0.9720, test_f1: 0.4807
 epoch: 60, train_loss: 0.9107, test_loss: 0.9991, test_f1: 0.4684
 epoch: 61, train_loss: 0.9114, test_loss: 0.9855, test_f1: 0.4730
 epoch: 62, train_loss: 0.9114, test_loss: 1.0378, test_f1: 0.4706
 epoch: 63, train_loss: 0.9008, test_loss: 0.9852, test_f1: 0.4754
 epoch: 64, train_loss: 0.9038, test_loss: 1.0002, test_f1: 0.4720
 epoch: 65, train_loss: 0.9081, test_loss: 0.9894, test_f1: 0.4730
 epoch: 66, train_loss: 0.9078, test_loss: 1.0036, test_f1: 0.4743
 epoch: 67, train_loss: 0.9034, test_loss: 1.0017, test_f1: 0.4775
 epoch: 68, train_loss: 0.8946, test_loss: 1.0049, test_f1: 0.4807
 epoch: 69, train_loss: 0.8930, test_loss: 1.0201, test_f1: 0.4883
 epoch: 70, train_loss: 0.8886, test_loss: 1.0174, test_f1: 0.4755
 epoch: 71, train_loss: 0.8926, test_loss: 0.9962, test_f1: 0.4859
 epoch: 72, train_loss: 0.8947, test_loss: 0.9848, test_f1: 0.4711
 epoch: 73, train_loss: 0.8901, test_loss: 1.0162, test_f1: 0.4738
 epoch: 74, train_loss: 0.8789, test_loss: 1.0098, test_f1: 0.4721
 epoch: 75, train_loss: 0.8844, test_loss: 1.0171, test_f1: 0.4801
 epoch: 76, train_loss: 0.8811, test_loss: 1.0205, test_f1: 0.4774
 epoch: 77, train_loss: 0.8837, test_loss: 1.0107, test_f1: 0.4770
 epoch: 78, train_loss: 0.8864, test_loss: 1.0206, test_f1: 0.4666
 epoch: 79, train_loss: 0.8699, test_loss: 1.0357, test_f1: 0.4814
 epoch: 80, train_loss: 0.8768, test_loss: 1.0166, test_f1: 0.4878
 epoch: 81, train_loss: 0.8810, test_loss: 1.0085, test_f1: 0.4806
 epoch: 82, train_loss: 0.8708, test_loss: 1.0176, test_f1: 0.4738
 epoch: 83, train_loss: 0.8787, test_loss: 1.0089, test_f1: 0.4789
 epoch: 84, train_loss: 0.8728, test_loss: 1.0100, test_f1: 0.4757
 epoch: 85, train_loss: 0.8677, test_loss: 0.9899, test_f1: 0.4838
 epoch: 86, train_loss: 0.8722, test_loss: 1.0250, test_f1: 0.4796
 epoch: 87, train_loss: 0.8838, test_loss: 1.0357, test_f1: 0.4758
 epoch: 88, train_loss: 0.8633, test_loss: 1.0195, test_f1: 0.4824
 epoch: 89, train_loss: 0.8678, test_loss: 1.0191, test_f1: 0.4826
 epoch: 90, train_loss: 0.8642, test_loss: 1.0445, test_f1: 0.4755
 epoch: 91, train_loss: 0.8642, test_loss: 1.0178, test_f1: 0.4843
 epoch: 92, train_loss: 0.8672, test_loss: 1.0133, test_f1: 0.4778
 epoch: 93, train_loss: 0.8678, test_loss: 1.0470, test_f1: 0.4789
 epoch: 94, train_loss: 0.8617, test_loss: 1.0719, test_f1: 0.4787
 epoch: 95, train_loss: 0.8733, test_loss: 1.0071, test_f1: 0.4981
 epoch: 96, train_loss: 0.8575, test_loss: 1.0455, test_f1: 0.4857
 epoch: 97, train_loss: 0.8629, test_loss: 1.0617, test_f1: 0.4823
 epoch: 98, train_loss: 0.8575, test_loss: 0.9928, test_f1: 0.4870
 epoch: 99, train_loss: 0.8628, test_loss: 1.0051, test_f1: 0.4823
##################ITERATION #9 ****************************************
 epoch: 0, train_loss: 1.4333, test_loss: 1.3332, test_f1: 0.2301
 epoch: 1, train_loss: 1.2903, test_loss: 1.2934, test_f1: 0.2942
 epoch: 2, train_loss: 1.2662, test_loss: 1.2409, test_f1: 0.2856
 epoch: 3, train_loss: 1.2341, test_loss: 1.2162, test_f1: 0.2938
 epoch: 4, train_loss: 1.2093, test_loss: 1.1978, test_f1: 0.3258
 epoch: 5, train_loss: 1.2189, test_loss: 1.1852, test_f1: 0.3282
 epoch: 6, train_loss: 1.2116, test_loss: 1.1717, test_f1: 0.3393
 epoch: 7, train_loss: 1.1921, test_loss: 1.1578, test_f1: 0.3651
 epoch: 8, train_loss: 1.1867, test_loss: 1.1521, test_f1: 0.3789
 epoch: 9, train_loss: 1.1957, test_loss: 1.1426, test_f1: 0.3577
 epoch: 10, train_loss: 1.1677, test_loss: 1.1318, test_f1: 0.3788
 epoch: 11, train_loss: 1.1707, test_loss: 1.1273, test_f1: 0.4107
 epoch: 12, train_loss: 1.1626, test_loss: 1.1247, test_f1: 0.4067
 epoch: 13, train_loss: 1.1540, test_loss: 1.1195, test_f1: 0.4048
 epoch: 14, train_loss: 1.1446, test_loss: 1.1093, test_f1: 0.3958
 epoch: 15, train_loss: 1.1441, test_loss: 1.1062, test_f1: 0.4008
 epoch: 16, train_loss: 1.1398, test_loss: 1.1102, test_f1: 0.4018
 epoch: 17, train_loss: 1.1375, test_loss: 1.0980, test_f1: 0.3984
 epoch: 18, train_loss: 1.1250, test_loss: 1.0942, test_f1: 0.4233
 epoch: 19, train_loss: 1.1236, test_loss: 1.0962, test_f1: 0.4272
 epoch: 20, train_loss: 1.1131, test_loss: 1.0846, test_f1: 0.4301
 epoch: 21, train_loss: 1.1101, test_loss: 1.0792, test_f1: 0.4168
 epoch: 22, train_loss: 1.0896, test_loss: 1.0751, test_f1: 0.4240
 epoch: 23, train_loss: 1.0936, test_loss: 1.0627, test_f1: 0.4122
 epoch: 24, train_loss: 1.0812, test_loss: 1.0598, test_f1: 0.4254
 epoch: 25, train_loss: 1.0791, test_loss: 1.0485, test_f1: 0.4405
 epoch: 26, train_loss: 1.0667, test_loss: 1.0441, test_f1: 0.4427
 epoch: 27, train_loss: 1.0618, test_loss: 1.0502, test_f1: 0.4321
 epoch: 28, train_loss: 1.0569, test_loss: 1.0524, test_f1: 0.4368
 epoch: 29, train_loss: 1.0571, test_loss: 1.0446, test_f1: 0.4541
 epoch: 30, train_loss: 1.0510, test_loss: 1.0549, test_f1: 0.4201
 epoch: 31, train_loss: 1.0361, test_loss: 1.0456, test_f1: 0.4246
 epoch: 32, train_loss: 1.0433, test_loss: 1.0336, test_f1: 0.4399
 epoch: 33, train_loss: 1.0315, test_loss: 1.0307, test_f1: 0.4440
 epoch: 34, train_loss: 1.0292, test_loss: 1.0337, test_f1: 0.4291
 epoch: 35, train_loss: 1.0374, test_loss: 1.0242, test_f1: 0.4449
 epoch: 36, train_loss: 1.0187, test_loss: 1.0294, test_f1: 0.4350
 epoch: 37, train_loss: 1.0152, test_loss: 1.0119, test_f1: 0.4535
 epoch: 38, train_loss: 1.0008, test_loss: 1.0262, test_f1: 0.4393
 epoch: 39, train_loss: 1.0055, test_loss: 1.0237, test_f1: 0.4416
 epoch: 40, train_loss: 1.0016, test_loss: 1.0205, test_f1: 0.4503
 epoch: 41, train_loss: 0.9953, test_loss: 1.0344, test_f1: 0.4361
 epoch: 42, train_loss: 1.0133, test_loss: 1.0324, test_f1: 0.4332
 epoch: 43, train_loss: 0.9936, test_loss: 1.0324, test_f1: 0.4293
 epoch: 44, train_loss: 0.9808, test_loss: 1.0070, test_f1: 0.4515
 epoch: 45, train_loss: 0.9941, test_loss: 1.0231, test_f1: 0.4427
 epoch: 46, train_loss: 0.9943, test_loss: 1.0094, test_f1: 0.4504
 epoch: 47, train_loss: 0.9801, test_loss: 1.0361, test_f1: 0.4629
 epoch: 48, train_loss: 0.9712, test_loss: 1.0198, test_f1: 0.4390
 epoch: 49, train_loss: 0.9775, test_loss: 1.0104, test_f1: 0.4537
 epoch: 50, train_loss: 0.9704, test_loss: 1.0032, test_f1: 0.4654
 epoch: 51, train_loss: 0.9670, test_loss: 1.0124, test_f1: 0.4607
 epoch: 52, train_loss: 0.9683, test_loss: 1.0235, test_f1: 0.4563
 epoch: 53, train_loss: 0.9590, test_loss: 1.0151, test_f1: 0.4581
 epoch: 54, train_loss: 0.9548, test_loss: 1.0180, test_f1: 0.4579
 epoch: 55, train_loss: 0.9669, test_loss: 1.0223, test_f1: 0.4525
 epoch: 56, train_loss: 0.9532, test_loss: 1.0174, test_f1: 0.4455
 epoch: 57, train_loss: 0.9544, test_loss: 1.0193, test_f1: 0.4521
 epoch: 58, train_loss: 0.9531, test_loss: 1.0148, test_f1: 0.4551
 epoch: 59, train_loss: 0.9484, test_loss: 1.0056, test_f1: 0.4582
 epoch: 60, train_loss: 0.9449, test_loss: 1.0221, test_f1: 0.4611
 epoch: 61, train_loss: 0.9561, test_loss: 1.0297, test_f1: 0.4606
 epoch: 62, train_loss: 0.9494, test_loss: 1.0137, test_f1: 0.4569
 epoch: 63, train_loss: 0.9347, test_loss: 1.0198, test_f1: 0.4458
 epoch: 64, train_loss: 0.9438, test_loss: 1.0346, test_f1: 0.4464
 epoch: 65, train_loss: 0.9344, test_loss: 1.0237, test_f1: 0.4542
 epoch: 66, train_loss: 0.9374, test_loss: 1.0109, test_f1: 0.4567
 epoch: 67, train_loss: 0.9497, test_loss: 1.0385, test_f1: 0.4514
 epoch: 68, train_loss: 0.9399, test_loss: 1.0160, test_f1: 0.4600
 epoch: 69, train_loss: 0.9277, test_loss: 1.0405, test_f1: 0.4416
 epoch: 70, train_loss: 0.9389, test_loss: 1.0202, test_f1: 0.4418
 epoch: 71, train_loss: 0.9292, test_loss: 1.0216, test_f1: 0.4614
 epoch: 72, train_loss: 0.9236, test_loss: 1.0134, test_f1: 0.4671
 epoch: 73, train_loss: 0.9239, test_loss: 1.0258, test_f1: 0.4587
 epoch: 74, train_loss: 0.9259, test_loss: 1.0381, test_f1: 0.4482
 epoch: 75, train_loss: 0.9213, test_loss: 1.0516, test_f1: 0.4546
 epoch: 76, train_loss: 0.9316, test_loss: 1.0519, test_f1: 0.4573
 epoch: 77, train_loss: 0.9356, test_loss: 1.0324, test_f1: 0.4488
 epoch: 78, train_loss: 0.9233, test_loss: 1.0217, test_f1: 0.4457
 epoch: 79, train_loss: 0.9196, test_loss: 1.0448, test_f1: 0.4390
 epoch: 80, train_loss: 0.9188, test_loss: 1.0738, test_f1: 0.4385
 epoch: 81, train_loss: 0.9116, test_loss: 1.0487, test_f1: 0.4559
 epoch: 82, train_loss: 0.9280, test_loss: 1.0513, test_f1: 0.4632
 epoch: 83, train_loss: 0.9033, test_loss: 1.0418, test_f1: 0.4665
 epoch: 84, train_loss: 0.9028, test_loss: 1.0208, test_f1: 0.4738
 epoch: 85, train_loss: 0.9188, test_loss: 1.0397, test_f1: 0.4606
 epoch: 86, train_loss: 0.9220, test_loss: 1.0408, test_f1: 0.4649
 epoch: 87, train_loss: 0.9222, test_loss: 1.0349, test_f1: 0.4615
 epoch: 88, train_loss: 0.9257, test_loss: 1.0527, test_f1: 0.4470
 epoch: 89, train_loss: 0.9128, test_loss: 1.0492, test_f1: 0.4549
 epoch: 90, train_loss: 0.9100, test_loss: 1.0329, test_f1: 0.4663
 epoch: 91, train_loss: 0.9050, test_loss: 1.0259, test_f1: 0.4613
 epoch: 92, train_loss: 0.9064, test_loss: 1.0573, test_f1: 0.4454
 epoch: 93, train_loss: 0.9035, test_loss: 1.0647, test_f1: 0.4540
 epoch: 94, train_loss: 0.8979, test_loss: 1.0233, test_f1: 0.4803
 epoch: 95, train_loss: 0.8970, test_loss: 1.0301, test_f1: 0.4699
 epoch: 96, train_loss: 0.9083, test_loss: 1.0524, test_f1: 0.4612
 epoch: 97, train_loss: 0.9029, test_loss: 1.0546, test_f1: 0.4592
 epoch: 98, train_loss: 0.8959, test_loss: 1.0439, test_f1: 0.4687
 epoch: 99, train_loss: 0.9038, test_loss: 1.0819, test_f1: 0.4471

Training completed in 410.87 seconds
Best F1: 0.5268 at epoch 84
Mean F1 across iterations: 0.4977  0.0146
========================FINAL RESULTS================================
FEGIN weighted F1: 0.5268  0.0146
python main.py --data ltspice_examples --representation component_component --model FEGIN --layers 4 --hiddens 16 --batch_size 256 --lr 0.001 --emb_size 512 --epochs 100 --save_appendix component_component_L4_H16_BS256_LR0.001_E512 --no_val
-----



STDERR:
  File "main.py", line 370, in <module>
    main()
  File "main.py", line 254, in main
    dataset = dataset_class(
  File "/home/philip/projects/ltspice_examples_code_repo/Circuit-Completion-Using-GNNs/component_classification_with_link_prediction_head/evaluation/FEGIN/kernel/circuit_datasets.py", line 15, in __init__
    self.data, self.slices = torch.load(self.processed_paths[0])
  File "/home/philip/.local/lib/python3.8/site-packages/torch/serialization.py", line 1040, in load
    warnings.warn(
  File "/usr/lib/python3.8/warnings.py", line 109, in _showwarnmsg
    sw(msg.message, msg.category, msg.filename, msg.lineno,
  File "main.py", line 47, in warn_with_traceback
    traceback.print_stack(file=log)
/home/philip/projects/ltspice_examples_code_repo/Circuit-Completion-Using-GNNs/component_classification_with_link_prediction_head/evaluation/FEGIN/kernel/circuit_datasets.py:15: FutureWarning: You are using `torch.load` with `weights_only=False` (the current default value), which uses the default pickle module implicitly. It is possible to construct malicious pickle data which will execute arbitrary code during unpickling (See https://github.com/pytorch/pytorch/blob/main/SECURITY.md#untrusted-models for more details). In a future release, the default value for `weights_only` will be flipped to `True`. This limits the functions that could be executed during unpickling. Arbitrary objects will no longer be allowed to be loaded via this mode unless they are explicitly allowlisted by the user via `torch.serialization.add_safe_globals`. We recommend you start setting `weights_only=True` for any use case where you don't have full control of the loaded file. Please open an issue on GitHub for any issues related to this experimental feature.
  self.data, self.slices = torch.load(self.processed_paths[0])
