STDOUT:
Results will be saved in /home/philip/projects/ltspice_examples_code_repo/Circuit-Completion-Using-GNNs/component_classification_with_link_prediction_head/evaluation/FEGIN/results/model_FEGIN_dataset_ltspice_demos
Command line input: python main.py --data ltspice_demos --representation component_net --model FEGIN --layers 5 --hiddens 32 --batch_size 64 --lr 0.01 --emb_size 512 --epochs 100 --save_appendix component_net_L5_H32_BS64_LR0.01_E512 --no_val
 is saved.
-----
ltspice_demos - FEGIN
Using 5 layers, 32 hidden units, h = 2
Loading component_net representation dataset
ENTERED
Training FEGIN on component_net representation
Train: 1565, Test: 383
##################ITERATION #0 ****************************************
 epoch: 0, train_loss: 1.2346, test_loss: 1.3710, test_f1: 0.1848
 epoch: 1, train_loss: 1.0974, test_loss: 1.2691, test_f1: 0.3840
 epoch: 2, train_loss: 1.0320, test_loss: 1.2038, test_f1: 0.4015
 epoch: 3, train_loss: 1.0064, test_loss: 1.1045, test_f1: 0.3742
 epoch: 4, train_loss: 0.9906, test_loss: 1.0614, test_f1: 0.5181
 epoch: 5, train_loss: 0.9523, test_loss: 1.0815, test_f1: 0.5149
 epoch: 6, train_loss: 0.9804, test_loss: 1.1130, test_f1: 0.4090
 epoch: 7, train_loss: 0.9471, test_loss: 1.0637, test_f1: 0.5214
 epoch: 8, train_loss: 0.9309, test_loss: 1.1151, test_f1: 0.4995
 epoch: 9, train_loss: 0.9224, test_loss: 1.0256, test_f1: 0.4071
 epoch: 10, train_loss: 0.9079, test_loss: 1.0021, test_f1: 0.5657
 epoch: 11, train_loss: 0.9099, test_loss: 1.1480, test_f1: 0.4752
 epoch: 12, train_loss: 0.8998, test_loss: 0.9857, test_f1: 0.5550
 epoch: 13, train_loss: 0.8802, test_loss: 1.0350, test_f1: 0.5494
 epoch: 14, train_loss: 0.8906, test_loss: 1.0152, test_f1: 0.5787
 epoch: 15, train_loss: 0.8655, test_loss: 1.1114, test_f1: 0.5525
 epoch: 16, train_loss: 0.8774, test_loss: 1.1557, test_f1: 0.4813
 epoch: 17, train_loss: 0.8577, test_loss: 0.9919, test_f1: 0.5608
 epoch: 18, train_loss: 0.8629, test_loss: 1.1971, test_f1: 0.5490
 epoch: 19, train_loss: 0.8319, test_loss: 1.1307, test_f1: 0.5356
 epoch: 20, train_loss: 0.8489, test_loss: 0.9860, test_f1: 0.5616
 epoch: 21, train_loss: 0.8446, test_loss: 1.0345, test_f1: 0.6029
 epoch: 22, train_loss: 0.8133, test_loss: 1.1133, test_f1: 0.5154
 epoch: 23, train_loss: 0.8177, test_loss: 1.0606, test_f1: 0.5405
 epoch: 24, train_loss: 0.8163, test_loss: 1.2309, test_f1: 0.5026
 epoch: 25, train_loss: 0.7898, test_loss: 1.0879, test_f1: 0.5801
 epoch: 26, train_loss: 0.7645, test_loss: 1.1758, test_f1: 0.5562
 epoch: 27, train_loss: 0.7960, test_loss: 1.2126, test_f1: 0.5308
 epoch: 28, train_loss: 0.7699, test_loss: 1.1191, test_f1: 0.5701
 epoch: 29, train_loss: 0.7719, test_loss: 1.1070, test_f1: 0.5526
 epoch: 30, train_loss: 0.7578, test_loss: 1.2278, test_f1: 0.5628
 epoch: 31, train_loss: 0.7728, test_loss: 1.1941, test_f1: 0.5819
 epoch: 32, train_loss: 0.7520, test_loss: 1.1352, test_f1: 0.5316
 epoch: 33, train_loss: 0.7515, test_loss: 1.1794, test_f1: 0.5723
 epoch: 34, train_loss: 0.7575, test_loss: 1.0798, test_f1: 0.5321
 epoch: 35, train_loss: 0.7239, test_loss: 1.3424, test_f1: 0.5533
 epoch: 36, train_loss: 0.7256, test_loss: 1.2686, test_f1: 0.5667
 epoch: 37, train_loss: 0.6849, test_loss: 1.2359, test_f1: 0.5729
 epoch: 38, train_loss: 0.7256, test_loss: 1.1682, test_f1: 0.5236
 epoch: 39, train_loss: 0.7370, test_loss: 1.1531, test_f1: 0.5373
 epoch: 40, train_loss: 0.6996, test_loss: 1.1550, test_f1: 0.5803
 epoch: 41, train_loss: 0.7260, test_loss: 1.2462, test_f1: 0.5617
 epoch: 42, train_loss: 0.6937, test_loss: 1.4245, test_f1: 0.4993
 epoch: 43, train_loss: 0.7000, test_loss: 1.3757, test_f1: 0.5373
 epoch: 44, train_loss: 0.6782, test_loss: 2.4790, test_f1: 0.4129
 epoch: 45, train_loss: 0.7093, test_loss: 1.3237, test_f1: 0.5356
 epoch: 46, train_loss: 0.6883, test_loss: 1.2250, test_f1: 0.5083
 epoch: 47, train_loss: 0.7046, test_loss: 1.3505, test_f1: 0.5627
 epoch: 48, train_loss: 0.6577, test_loss: 1.2484, test_f1: 0.5300
 epoch: 49, train_loss: 0.6665, test_loss: 1.3661, test_f1: 0.5757
 epoch: 50, train_loss: 0.6606, test_loss: 1.4954, test_f1: 0.5577
 epoch: 51, train_loss: 0.6617, test_loss: 1.1729, test_f1: 0.5954
 epoch: 52, train_loss: 0.6129, test_loss: 1.3118, test_f1: 0.5887
 epoch: 53, train_loss: 0.5841, test_loss: 1.4438, test_f1: 0.5762
 epoch: 54, train_loss: 0.5865, test_loss: 1.5288, test_f1: 0.5517
 epoch: 55, train_loss: 0.6155, test_loss: 1.4857, test_f1: 0.5511
 epoch: 56, train_loss: 0.6202, test_loss: 1.3011, test_f1: 0.5685
 epoch: 57, train_loss: 0.6281, test_loss: 1.5219, test_f1: 0.5104
 epoch: 58, train_loss: 0.5784, test_loss: 1.4928, test_f1: 0.5498
 epoch: 59, train_loss: 0.5856, test_loss: 1.6573, test_f1: 0.5555
 epoch: 60, train_loss: 0.5618, test_loss: 1.4663, test_f1: 0.5777
 epoch: 61, train_loss: 0.5859, test_loss: 1.5080, test_f1: 0.5863
 epoch: 62, train_loss: 0.5602, test_loss: 1.5069, test_f1: 0.5491
 epoch: 63, train_loss: 0.5908, test_loss: 1.5666, test_f1: 0.5658
 epoch: 64, train_loss: 0.5686, test_loss: 1.5988, test_f1: 0.5641
 epoch: 65, train_loss: 0.5651, test_loss: 1.6494, test_f1: 0.5622
 epoch: 66, train_loss: 0.5586, test_loss: 2.0578, test_f1: 0.5392
 epoch: 67, train_loss: 0.5995, test_loss: 1.4728, test_f1: 0.5476
 epoch: 68, train_loss: 0.5822, test_loss: 1.5079, test_f1: 0.5708
 epoch: 69, train_loss: 0.5432, test_loss: 1.6157, test_f1: 0.5894
 epoch: 70, train_loss: 0.5662, test_loss: 1.3328, test_f1: 0.5869
 epoch: 71, train_loss: 0.5527, test_loss: 1.5335, test_f1: 0.5898
 epoch: 72, train_loss: 0.5359, test_loss: 1.7131, test_f1: 0.5576
 epoch: 73, train_loss: 0.5253, test_loss: 1.6851, test_f1: 0.5338
 epoch: 74, train_loss: 0.5405, test_loss: 1.5468, test_f1: 0.5969
 epoch: 75, train_loss: 0.5375, test_loss: 1.7630, test_f1: 0.5700
 epoch: 76, train_loss: 0.5135, test_loss: 1.7279, test_f1: 0.5632
 epoch: 77, train_loss: 0.5494, test_loss: 1.7125, test_f1: 0.5429
 epoch: 78, train_loss: 0.5357, test_loss: 1.5493, test_f1: 0.5305
 epoch: 79, train_loss: 0.5344, test_loss: 1.9617, test_f1: 0.5416
 epoch: 80, train_loss: 0.5228, test_loss: 1.5247, test_f1: 0.5572
 epoch: 81, train_loss: 0.5046, test_loss: 1.8867, test_f1: 0.5732
 epoch: 82, train_loss: 0.5562, test_loss: 1.4971, test_f1: 0.5708
 epoch: 83, train_loss: 0.5245, test_loss: 1.6223, test_f1: 0.5530
 epoch: 84, train_loss: 0.4967, test_loss: 1.5283, test_f1: 0.5781
 epoch: 85, train_loss: 0.4960, test_loss: 1.7915, test_f1: 0.5816
 epoch: 86, train_loss: 0.5203, test_loss: 1.6892, test_f1: 0.5761
 epoch: 87, train_loss: 0.4967, test_loss: 1.5875, test_f1: 0.5625
 epoch: 88, train_loss: 0.5028, test_loss: 1.6368, test_f1: 0.5843
 epoch: 89, train_loss: 0.4894, test_loss: 1.7401, test_f1: 0.5820
 epoch: 90, train_loss: 0.4947, test_loss: 1.8437, test_f1: 0.5854
 epoch: 91, train_loss: 0.5003, test_loss: 1.7273, test_f1: 0.5305
 epoch: 92, train_loss: 0.4835, test_loss: 1.7233, test_f1: 0.5806
 epoch: 93, train_loss: 0.5054, test_loss: 1.7581, test_f1: 0.5786
 epoch: 94, train_loss: 0.5271, test_loss: 1.5552, test_f1: 0.6096
 epoch: 95, train_loss: 0.5011, test_loss: 1.7535, test_f1: 0.5824
 epoch: 96, train_loss: 0.4700, test_loss: 1.8594, test_f1: 0.6038
 epoch: 97, train_loss: 0.4755, test_loss: 1.8370, test_f1: 0.5793
 epoch: 98, train_loss: 0.4727, test_loss: 1.8035, test_f1: 0.5761
 epoch: 99, train_loss: 0.4613, test_loss: 1.6619, test_f1: 0.5720
##################ITERATION #1 ****************************************
 epoch: 0, train_loss: 1.2032, test_loss: 1.2158, test_f1: 0.2759
 epoch: 1, train_loss: 1.0641, test_loss: 1.1759, test_f1: 0.4112
 epoch: 2, train_loss: 1.0082, test_loss: 1.0940, test_f1: 0.4828
 epoch: 3, train_loss: 0.9897, test_loss: 1.1261, test_f1: 0.4625
 epoch: 4, train_loss: 0.9866, test_loss: 1.1247, test_f1: 0.5049
 epoch: 5, train_loss: 0.9752, test_loss: 1.1150, test_f1: 0.4682
 epoch: 6, train_loss: 0.9646, test_loss: 1.1063, test_f1: 0.4661
 epoch: 7, train_loss: 0.9569, test_loss: 1.0781, test_f1: 0.5425
 epoch: 8, train_loss: 0.9546, test_loss: 1.0655, test_f1: 0.5006
 epoch: 9, train_loss: 0.9609, test_loss: 1.1466, test_f1: 0.4653
 epoch: 10, train_loss: 0.9443, test_loss: 1.0599, test_f1: 0.5207
 epoch: 11, train_loss: 0.9349, test_loss: 1.1515, test_f1: 0.4512
 epoch: 12, train_loss: 0.9146, test_loss: 1.1339, test_f1: 0.5167
 epoch: 13, train_loss: 0.9248, test_loss: 1.0974, test_f1: 0.5562
 epoch: 14, train_loss: 0.9056, test_loss: 1.0807, test_f1: 0.5338
 epoch: 15, train_loss: 0.9109, test_loss: 1.0671, test_f1: 0.5428
 epoch: 16, train_loss: 0.9165, test_loss: 1.2556, test_f1: 0.5247
 epoch: 17, train_loss: 0.8962, test_loss: 1.1161, test_f1: 0.4698
 epoch: 18, train_loss: 0.8872, test_loss: 1.3227, test_f1: 0.4508
 epoch: 19, train_loss: 0.8963, test_loss: 1.1829, test_f1: 0.5306
 epoch: 20, train_loss: 0.8889, test_loss: 1.1961, test_f1: 0.5147
 epoch: 21, train_loss: 0.8881, test_loss: 1.1062, test_f1: 0.5530
 epoch: 22, train_loss: 0.8777, test_loss: 1.1502, test_f1: 0.5262
 epoch: 23, train_loss: 0.8672, test_loss: 1.0377, test_f1: 0.5361
 epoch: 24, train_loss: 0.8562, test_loss: 1.1418, test_f1: 0.4806
 epoch: 25, train_loss: 0.8464, test_loss: 1.0865, test_f1: 0.5351
 epoch: 26, train_loss: 0.8236, test_loss: 1.2121, test_f1: 0.5771
 epoch: 27, train_loss: 0.8141, test_loss: 1.2626, test_f1: 0.5434
 epoch: 28, train_loss: 0.8297, test_loss: 1.0823, test_f1: 0.4955
 epoch: 29, train_loss: 0.8172, test_loss: 1.2109, test_f1: 0.5442
 epoch: 30, train_loss: 0.8174, test_loss: 1.1399, test_f1: 0.4758
 epoch: 31, train_loss: 0.8581, test_loss: 1.0651, test_f1: 0.6134
 epoch: 32, train_loss: 0.8516, test_loss: 1.0596, test_f1: 0.5741
 epoch: 33, train_loss: 0.8277, test_loss: 1.0810, test_f1: 0.5870
 epoch: 34, train_loss: 0.8026, test_loss: 1.2143, test_f1: 0.5167
 epoch: 35, train_loss: 0.7971, test_loss: 1.3154, test_f1: 0.5441
 epoch: 36, train_loss: 0.7929, test_loss: 1.1403, test_f1: 0.6187
 epoch: 37, train_loss: 0.8280, test_loss: 1.1267, test_f1: 0.5179
 epoch: 38, train_loss: 0.7962, test_loss: 1.1117, test_f1: 0.5676
 epoch: 39, train_loss: 0.7627, test_loss: 1.1354, test_f1: 0.4660
 epoch: 40, train_loss: 0.7598, test_loss: 1.1354, test_f1: 0.5566
 epoch: 41, train_loss: 0.7775, test_loss: 1.1714, test_f1: 0.5654
 epoch: 42, train_loss: 0.7840, test_loss: 1.1777, test_f1: 0.5935
 epoch: 43, train_loss: 0.7581, test_loss: 1.2784, test_f1: 0.5754
 epoch: 44, train_loss: 0.7664, test_loss: 1.0459, test_f1: 0.5549
 epoch: 45, train_loss: 0.7451, test_loss: 1.1236, test_f1: 0.4963
 epoch: 46, train_loss: 0.7540, test_loss: 1.0905, test_f1: 0.5434
 epoch: 47, train_loss: 0.7444, test_loss: 1.1554, test_f1: 0.5364
 epoch: 48, train_loss: 0.7096, test_loss: 1.1558, test_f1: 0.5814
 epoch: 49, train_loss: 0.7282, test_loss: 1.2136, test_f1: 0.6273
 epoch: 50, train_loss: 0.7342, test_loss: 1.0827, test_f1: 0.5698
 epoch: 51, train_loss: 0.7203, test_loss: 1.2429, test_f1: 0.6098
 epoch: 52, train_loss: 0.6928, test_loss: 1.0345, test_f1: 0.5909
 epoch: 53, train_loss: 0.6726, test_loss: 1.3393, test_f1: 0.5909
 epoch: 54, train_loss: 0.6393, test_loss: 1.1763, test_f1: 0.6139
 epoch: 55, train_loss: 0.6469, test_loss: 1.2114, test_f1: 0.5806
 epoch: 56, train_loss: 0.6336, test_loss: 1.5170, test_f1: 0.5995
 epoch: 57, train_loss: 0.6306, test_loss: 1.3748, test_f1: 0.5472
 epoch: 58, train_loss: 0.6394, test_loss: 1.1978, test_f1: 0.5917
 epoch: 59, train_loss: 0.6398, test_loss: 1.3660, test_f1: 0.5829
 epoch: 60, train_loss: 0.6148, test_loss: 1.3818, test_f1: 0.5540
 epoch: 61, train_loss: 0.6391, test_loss: 1.2530, test_f1: 0.6117
 epoch: 62, train_loss: 0.6128, test_loss: 1.2648, test_f1: 0.6008
 epoch: 63, train_loss: 0.6314, test_loss: 1.3461, test_f1: 0.6215
 epoch: 64, train_loss: 0.6186, test_loss: 1.2628, test_f1: 0.5882
 epoch: 65, train_loss: 0.5981, test_loss: 1.4068, test_f1: 0.5858
 epoch: 66, train_loss: 0.6351, test_loss: 1.4099, test_f1: 0.6233
 epoch: 67, train_loss: 0.6135, test_loss: 1.4361, test_f1: 0.5851
 epoch: 68, train_loss: 0.6132, test_loss: 1.2945, test_f1: 0.5891
 epoch: 69, train_loss: 0.6083, test_loss: 1.3929, test_f1: 0.5510
 epoch: 70, train_loss: 0.5961, test_loss: 1.2765, test_f1: 0.6081
 epoch: 71, train_loss: 0.6061, test_loss: 1.4867, test_f1: 0.5863
 epoch: 72, train_loss: 0.5852, test_loss: 1.3320, test_f1: 0.6289
 epoch: 73, train_loss: 0.5556, test_loss: 1.3567, test_f1: 0.5767
 epoch: 74, train_loss: 0.5726, test_loss: 1.6668, test_f1: 0.6059
 epoch: 75, train_loss: 0.5658, test_loss: 1.5753, test_f1: 0.5908
 epoch: 76, train_loss: 0.5741, test_loss: 1.4486, test_f1: 0.6048
 epoch: 77, train_loss: 0.5820, test_loss: 1.4237, test_f1: 0.6046
 epoch: 78, train_loss: 0.5539, test_loss: 1.6916, test_f1: 0.5690
 epoch: 79, train_loss: 0.5793, test_loss: 1.7269, test_f1: 0.5843
 epoch: 80, train_loss: 0.5915, test_loss: 1.4735, test_f1: 0.5979
 epoch: 81, train_loss: 0.5530, test_loss: 1.4285, test_f1: 0.6000
 epoch: 82, train_loss: 0.5506, test_loss: 1.5702, test_f1: 0.5889
 epoch: 83, train_loss: 0.5402, test_loss: 1.3682, test_f1: 0.6062
 epoch: 84, train_loss: 0.5005, test_loss: 1.6018, test_f1: 0.5883
 epoch: 85, train_loss: 0.5345, test_loss: 1.5579, test_f1: 0.5836
 epoch: 86, train_loss: 0.5417, test_loss: 1.4733, test_f1: 0.5793
 epoch: 87, train_loss: 0.5410, test_loss: 1.6044, test_f1: 0.5757
 epoch: 88, train_loss: 0.5341, test_loss: 1.8809, test_f1: 0.5814
 epoch: 89, train_loss: 0.5209, test_loss: 1.6102, test_f1: 0.5552
 epoch: 90, train_loss: 0.5288, test_loss: 1.5656, test_f1: 0.6187
 epoch: 91, train_loss: 0.5157, test_loss: 1.7695, test_f1: 0.5947
 epoch: 92, train_loss: 0.5334, test_loss: 1.7681, test_f1: 0.5918
 epoch: 93, train_loss: 0.5153, test_loss: 1.5562, test_f1: 0.5975
 epoch: 94, train_loss: 0.4921, test_loss: 1.5828, test_f1: 0.6174
 epoch: 95, train_loss: 0.5021, test_loss: 1.6220, test_f1: 0.6093
 epoch: 96, train_loss: 0.5208, test_loss: 1.6541, test_f1: 0.5694
 epoch: 97, train_loss: 0.5053, test_loss: 1.5495, test_f1: 0.6163
 epoch: 98, train_loss: 0.4928, test_loss: 1.6237, test_f1: 0.5818
 epoch: 99, train_loss: 0.4674, test_loss: 1.7336, test_f1: 0.5991
##################ITERATION #2 ****************************************
 epoch: 0, train_loss: 1.1723, test_loss: 1.4253, test_f1: 0.3262
 epoch: 1, train_loss: 1.0542, test_loss: 1.1197, test_f1: 0.4687
 epoch: 2, train_loss: 0.9972, test_loss: 1.0654, test_f1: 0.5533
 epoch: 3, train_loss: 0.9984, test_loss: 1.1669, test_f1: 0.5101
 epoch: 4, train_loss: 0.9690, test_loss: 1.1264, test_f1: 0.5323
 epoch: 5, train_loss: 0.9734, test_loss: 1.0514, test_f1: 0.4430
 epoch: 6, train_loss: 0.9694, test_loss: 1.2052, test_f1: 0.4390
 epoch: 7, train_loss: 0.9588, test_loss: 1.0154, test_f1: 0.5350
 epoch: 8, train_loss: 0.9377, test_loss: 1.0308, test_f1: 0.5627
 epoch: 9, train_loss: 0.9267, test_loss: 1.1153, test_f1: 0.5299
 epoch: 10, train_loss: 0.9201, test_loss: 1.0610, test_f1: 0.5253
 epoch: 11, train_loss: 0.9302, test_loss: 1.0376, test_f1: 0.5505
 epoch: 12, train_loss: 0.9230, test_loss: 1.0383, test_f1: 0.5350
 epoch: 13, train_loss: 0.9166, test_loss: 1.0107, test_f1: 0.5552
 epoch: 14, train_loss: 0.8907, test_loss: 1.1539, test_f1: 0.5181
 epoch: 15, train_loss: 0.8911, test_loss: 1.0142, test_f1: 0.5360
 epoch: 16, train_loss: 0.8881, test_loss: 1.0850, test_f1: 0.5763
 epoch: 17, train_loss: 0.8770, test_loss: 1.0583, test_f1: 0.5350
 epoch: 18, train_loss: 0.8855, test_loss: 1.1261, test_f1: 0.4910
 epoch: 19, train_loss: 0.8777, test_loss: 1.2236, test_f1: 0.4840
 epoch: 20, train_loss: 0.8530, test_loss: 1.0896, test_f1: 0.5281
 epoch: 21, train_loss: 0.8849, test_loss: 1.1093, test_f1: 0.4997
 epoch: 22, train_loss: 0.8565, test_loss: 1.0880, test_f1: 0.5705
 epoch: 23, train_loss: 0.8314, test_loss: 1.0065, test_f1: 0.5915
 epoch: 24, train_loss: 0.8320, test_loss: 1.0496, test_f1: 0.5586
 epoch: 25, train_loss: 0.8027, test_loss: 1.2663, test_f1: 0.5163
 epoch: 26, train_loss: 0.8190, test_loss: 1.1107, test_f1: 0.5787
 epoch: 27, train_loss: 0.8308, test_loss: 1.0549, test_f1: 0.5585
 epoch: 28, train_loss: 0.8028, test_loss: 1.1687, test_f1: 0.5117
 epoch: 29, train_loss: 0.7955, test_loss: 1.0999, test_f1: 0.5775
 epoch: 30, train_loss: 0.7701, test_loss: 1.0567, test_f1: 0.5682
 epoch: 31, train_loss: 0.8001, test_loss: 1.3921, test_f1: 0.4888
 epoch: 32, train_loss: 0.7582, test_loss: 1.0947, test_f1: 0.6027
 epoch: 33, train_loss: 0.7798, test_loss: 1.0622, test_f1: 0.5349
 epoch: 34, train_loss: 0.7613, test_loss: 1.0852, test_f1: 0.5501
 epoch: 35, train_loss: 0.7453, test_loss: 1.3440, test_f1: 0.5763
 epoch: 36, train_loss: 0.7676, test_loss: 1.1761, test_f1: 0.5745
 epoch: 37, train_loss: 0.7553, test_loss: 1.0459, test_f1: 0.5840
 epoch: 38, train_loss: 0.7142, test_loss: 1.1914, test_f1: 0.5357
 epoch: 39, train_loss: 0.7813, test_loss: 1.0221, test_f1: 0.6171
 epoch: 40, train_loss: 0.7278, test_loss: 1.4610, test_f1: 0.5053
 epoch: 41, train_loss: 0.7619, test_loss: 1.0981, test_f1: 0.5050
 epoch: 42, train_loss: 0.7410, test_loss: 1.1070, test_f1: 0.5432
 epoch: 43, train_loss: 0.7283, test_loss: 1.3402, test_f1: 0.4768
 epoch: 44, train_loss: 0.7201, test_loss: 1.1617, test_f1: 0.5763
 epoch: 45, train_loss: 0.7097, test_loss: 1.0531, test_f1: 0.5801
 epoch: 46, train_loss: 0.7353, test_loss: 1.2766, test_f1: 0.5607
 epoch: 47, train_loss: 0.7125, test_loss: 1.4129, test_f1: 0.5760
 epoch: 48, train_loss: 0.7084, test_loss: 1.0722, test_f1: 0.5513
 epoch: 49, train_loss: 0.6965, test_loss: 1.3092, test_f1: 0.5690
 epoch: 50, train_loss: 0.7006, test_loss: 1.2086, test_f1: 0.5453
 epoch: 51, train_loss: 0.6852, test_loss: 1.2532, test_f1: 0.5772
 epoch: 52, train_loss: 0.6628, test_loss: 1.4318, test_f1: 0.5784
 epoch: 53, train_loss: 0.6374, test_loss: 1.1270, test_f1: 0.5688
 epoch: 54, train_loss: 0.6395, test_loss: 1.3438, test_f1: 0.5674
 epoch: 55, train_loss: 0.6251, test_loss: 1.5612, test_f1: 0.5892
 epoch: 56, train_loss: 0.6607, test_loss: 1.2624, test_f1: 0.5002
 epoch: 57, train_loss: 0.6126, test_loss: 1.3764, test_f1: 0.5821
 epoch: 58, train_loss: 0.5983, test_loss: 1.3408, test_f1: 0.5936
 epoch: 59, train_loss: 0.6030, test_loss: 1.9897, test_f1: 0.5788
 epoch: 60, train_loss: 0.6062, test_loss: 1.5894, test_f1: 0.6015
 epoch: 61, train_loss: 0.5992, test_loss: 1.3872, test_f1: 0.5120
 epoch: 62, train_loss: 0.5883, test_loss: 1.3820, test_f1: 0.5737
 epoch: 63, train_loss: 0.6066, test_loss: 1.5684, test_f1: 0.5724
 epoch: 64, train_loss: 0.6032, test_loss: 1.5483, test_f1: 0.5837
 epoch: 65, train_loss: 0.5859, test_loss: 1.5648, test_f1: 0.5601
 epoch: 66, train_loss: 0.5700, test_loss: 1.3284, test_f1: 0.4996
 epoch: 67, train_loss: 0.5750, test_loss: 1.8181, test_f1: 0.5557
 epoch: 68, train_loss: 0.5583, test_loss: 1.7648, test_f1: 0.5700
 epoch: 69, train_loss: 0.5751, test_loss: 1.7277, test_f1: 0.5586
 epoch: 70, train_loss: 0.5607, test_loss: 1.4764, test_f1: 0.5327
 epoch: 71, train_loss: 0.5611, test_loss: 1.5892, test_f1: 0.5662
 epoch: 72, train_loss: 0.5562, test_loss: 1.4639, test_f1: 0.5302
 epoch: 73, train_loss: 0.5555, test_loss: 1.9734, test_f1: 0.5881
 epoch: 74, train_loss: 0.5484, test_loss: 1.6489, test_f1: 0.5738
 epoch: 75, train_loss: 0.5440, test_loss: 1.5675, test_f1: 0.5647
 epoch: 76, train_loss: 0.5424, test_loss: 1.4451, test_f1: 0.5735
 epoch: 77, train_loss: 0.5391, test_loss: 1.5104, test_f1: 0.5783
 epoch: 78, train_loss: 0.5722, test_loss: 1.4017, test_f1: 0.6094
 epoch: 79, train_loss: 0.5446, test_loss: 1.4251, test_f1: 0.5448
 epoch: 80, train_loss: 0.5219, test_loss: 1.7191, test_f1: 0.5705
 epoch: 81, train_loss: 0.5582, test_loss: 1.5560, test_f1: 0.5156
 epoch: 82, train_loss: 0.5283, test_loss: 1.5112, test_f1: 0.5053
 epoch: 83, train_loss: 0.5531, test_loss: 1.6054, test_f1: 0.5751
 epoch: 84, train_loss: 0.5331, test_loss: 1.6127, test_f1: 0.5546
 epoch: 85, train_loss: 0.5213, test_loss: 1.6446, test_f1: 0.5822
 epoch: 86, train_loss: 0.5012, test_loss: 1.6828, test_f1: 0.5200
 epoch: 87, train_loss: 0.5652, test_loss: 1.6504, test_f1: 0.5499
 epoch: 88, train_loss: 0.5353, test_loss: 1.7073, test_f1: 0.5499
 epoch: 89, train_loss: 0.5219, test_loss: 1.7293, test_f1: 0.6098
 epoch: 90, train_loss: 0.5503, test_loss: 1.6640, test_f1: 0.5638
 epoch: 91, train_loss: 0.5347, test_loss: 1.8142, test_f1: 0.5799
 epoch: 92, train_loss: 0.5371, test_loss: 1.9617, test_f1: 0.5754
 epoch: 93, train_loss: 0.5215, test_loss: 1.6726, test_f1: 0.5631
 epoch: 94, train_loss: 0.5301, test_loss: 1.4442, test_f1: 0.5529
 epoch: 95, train_loss: 0.5124, test_loss: 1.6055, test_f1: 0.5724
 epoch: 96, train_loss: 0.4704, test_loss: 1.7308, test_f1: 0.5763
 epoch: 97, train_loss: 0.5042, test_loss: 1.6565, test_f1: 0.5659
 epoch: 98, train_loss: 0.4848, test_loss: 1.7466, test_f1: 0.5446
 epoch: 99, train_loss: 0.4960, test_loss: 2.0491, test_f1: 0.5933
##################ITERATION #3 ****************************************
 epoch: 0, train_loss: 1.2573, test_loss: 1.2467, test_f1: 0.2971
 epoch: 1, train_loss: 1.0957, test_loss: 1.1714, test_f1: 0.4764
 epoch: 2, train_loss: 1.0392, test_loss: 1.2432, test_f1: 0.4315
 epoch: 3, train_loss: 1.0165, test_loss: 1.1223, test_f1: 0.3964
 epoch: 4, train_loss: 0.9947, test_loss: 1.1296, test_f1: 0.5002
 epoch: 5, train_loss: 0.9574, test_loss: 1.1421, test_f1: 0.5224
 epoch: 6, train_loss: 0.9391, test_loss: 1.0395, test_f1: 0.4751
 epoch: 7, train_loss: 0.9205, test_loss: 1.3896, test_f1: 0.4259
 epoch: 8, train_loss: 0.9188, test_loss: 1.0786, test_f1: 0.4832
 epoch: 9, train_loss: 0.9241, test_loss: 1.0955, test_f1: 0.5107
 epoch: 10, train_loss: 0.9297, test_loss: 1.2152, test_f1: 0.4846
 epoch: 11, train_loss: 0.8971, test_loss: 1.1027, test_f1: 0.5450
 epoch: 12, train_loss: 0.8936, test_loss: 1.0020, test_f1: 0.5268
 epoch: 13, train_loss: 0.8778, test_loss: 1.0747, test_f1: 0.5065
 epoch: 14, train_loss: 0.8558, test_loss: 1.0320, test_f1: 0.5602
 epoch: 15, train_loss: 0.8731, test_loss: 0.9686, test_f1: 0.5664
 epoch: 16, train_loss: 0.8226, test_loss: 0.9892, test_f1: 0.5719
 epoch: 17, train_loss: 0.8270, test_loss: 1.0924, test_f1: 0.5337
 epoch: 18, train_loss: 0.8167, test_loss: 0.9880, test_f1: 0.5259
 epoch: 19, train_loss: 0.8059, test_loss: 0.9497, test_f1: 0.5511
 epoch: 20, train_loss: 0.7825, test_loss: 0.9893, test_f1: 0.5967
 epoch: 21, train_loss: 0.7766, test_loss: 1.1252, test_f1: 0.5460
 epoch: 22, train_loss: 0.7656, test_loss: 1.1725, test_f1: 0.5026
 epoch: 23, train_loss: 0.7717, test_loss: 1.0633, test_f1: 0.5317
 epoch: 24, train_loss: 0.7850, test_loss: 1.0945, test_f1: 0.5481
 epoch: 25, train_loss: 0.7584, test_loss: 0.9613, test_f1: 0.5537
 epoch: 26, train_loss: 0.7408, test_loss: 1.1866, test_f1: 0.5226
 epoch: 27, train_loss: 0.7411, test_loss: 1.0378, test_f1: 0.5733
 epoch: 28, train_loss: 0.7463, test_loss: 0.9746, test_f1: 0.6340
 epoch: 29, train_loss: 0.7175, test_loss: 1.0873, test_f1: 0.5186
 epoch: 30, train_loss: 0.7312, test_loss: 1.1417, test_f1: 0.5189
 epoch: 31, train_loss: 0.6891, test_loss: 1.2196, test_f1: 0.5614
 epoch: 32, train_loss: 0.6853, test_loss: 0.9320, test_f1: 0.6179
 epoch: 33, train_loss: 0.6769, test_loss: 1.3178, test_f1: 0.5465
 epoch: 34, train_loss: 0.6944, test_loss: 1.1790, test_f1: 0.5291
 epoch: 35, train_loss: 0.6933, test_loss: 1.1346, test_f1: 0.5875
 epoch: 36, train_loss: 0.6612, test_loss: 1.0524, test_f1: 0.5789
 epoch: 37, train_loss: 0.6723, test_loss: 1.1028, test_f1: 0.5567
 epoch: 38, train_loss: 0.6398, test_loss: 0.9426, test_f1: 0.6143
 epoch: 39, train_loss: 0.6350, test_loss: 1.1723, test_f1: 0.5658
 epoch: 40, train_loss: 0.6570, test_loss: 0.9891, test_f1: 0.5947
 epoch: 41, train_loss: 0.6572, test_loss: 1.3359, test_f1: 0.5464
 epoch: 42, train_loss: 0.6412, test_loss: 1.1401, test_f1: 0.5131
 epoch: 43, train_loss: 0.6603, test_loss: 1.1668, test_f1: 0.5254
 epoch: 44, train_loss: 0.6380, test_loss: 2.3112, test_f1: 0.3012
 epoch: 45, train_loss: 0.7178, test_loss: 1.0229, test_f1: 0.5532
 epoch: 46, train_loss: 0.7102, test_loss: 1.2267, test_f1: 0.5434
 epoch: 47, train_loss: 0.6365, test_loss: 1.4383, test_f1: 0.5433
 epoch: 48, train_loss: 0.6166, test_loss: 1.0376, test_f1: 0.5958
 epoch: 49, train_loss: 0.6122, test_loss: 1.2031, test_f1: 0.6132
 epoch: 50, train_loss: 0.6250, test_loss: 1.1184, test_f1: 0.5917
 epoch: 51, train_loss: 0.5998, test_loss: 1.2062, test_f1: 0.5461
 epoch: 52, train_loss: 0.5729, test_loss: 1.1551, test_f1: 0.5982
 epoch: 53, train_loss: 0.5266, test_loss: 1.2358, test_f1: 0.6172
 epoch: 54, train_loss: 0.5377, test_loss: 1.2047, test_f1: 0.5488
 epoch: 55, train_loss: 0.5459, test_loss: 1.4014, test_f1: 0.5680
 epoch: 56, train_loss: 0.5352, test_loss: 1.3334, test_f1: 0.5438
 epoch: 57, train_loss: 0.5177, test_loss: 1.1702, test_f1: 0.5948
 epoch: 58, train_loss: 0.5119, test_loss: 1.2586, test_f1: 0.5734
 epoch: 59, train_loss: 0.4972, test_loss: 1.3062, test_f1: 0.6097
 epoch: 60, train_loss: 0.5178, test_loss: 1.5245, test_f1: 0.6120
 epoch: 61, train_loss: 0.4741, test_loss: 1.4981, test_f1: 0.5675
 epoch: 62, train_loss: 0.4981, test_loss: 1.4726, test_f1: 0.5998
 epoch: 63, train_loss: 0.5020, test_loss: 1.4029, test_f1: 0.5694
 epoch: 64, train_loss: 0.4976, test_loss: 1.4547, test_f1: 0.5756
 epoch: 65, train_loss: 0.4909, test_loss: 1.6951, test_f1: 0.5684
 epoch: 66, train_loss: 0.4922, test_loss: 1.3000, test_f1: 0.5848
 epoch: 67, train_loss: 0.4744, test_loss: 1.4507, test_f1: 0.5804
 epoch: 68, train_loss: 0.4873, test_loss: 1.6755, test_f1: 0.5903
 epoch: 69, train_loss: 0.4678, test_loss: 1.5441, test_f1: 0.5653
 epoch: 70, train_loss: 0.4762, test_loss: 1.6507, test_f1: 0.5980
 epoch: 71, train_loss: 0.4802, test_loss: 1.7315, test_f1: 0.5752
 epoch: 72, train_loss: 0.4798, test_loss: 1.5560, test_f1: 0.5928
 epoch: 73, train_loss: 0.5034, test_loss: 1.4277, test_f1: 0.6375
 epoch: 74, train_loss: 0.4659, test_loss: 1.4535, test_f1: 0.6464
 epoch: 75, train_loss: 0.4427, test_loss: 1.5297, test_f1: 0.6139
 epoch: 76, train_loss: 0.4326, test_loss: 1.8048, test_f1: 0.6064
 epoch: 77, train_loss: 0.4356, test_loss: 1.7849, test_f1: 0.6098
 epoch: 78, train_loss: 0.4690, test_loss: 1.7729, test_f1: 0.5665
 epoch: 79, train_loss: 0.4444, test_loss: 1.5567, test_f1: 0.5845
 epoch: 80, train_loss: 0.4305, test_loss: 1.7396, test_f1: 0.6170
 epoch: 81, train_loss: 0.4221, test_loss: 1.7385, test_f1: 0.5507
 epoch: 82, train_loss: 0.4086, test_loss: 1.7997, test_f1: 0.6052
 epoch: 83, train_loss: 0.4417, test_loss: 1.6222, test_f1: 0.5950
 epoch: 84, train_loss: 0.4153, test_loss: 1.8451, test_f1: 0.5905
 epoch: 85, train_loss: 0.4219, test_loss: 2.0183, test_f1: 0.5694
 epoch: 86, train_loss: 0.4258, test_loss: 1.6411, test_f1: 0.6466
 epoch: 87, train_loss: 0.4045, test_loss: 1.7040, test_f1: 0.5833
 epoch: 88, train_loss: 0.4277, test_loss: 1.9308, test_f1: 0.5986
 epoch: 89, train_loss: 0.4036, test_loss: 2.1121, test_f1: 0.5790
 epoch: 90, train_loss: 0.3994, test_loss: 1.6831, test_f1: 0.6291
 epoch: 91, train_loss: 0.3951, test_loss: 2.0668, test_f1: 0.5605
 epoch: 92, train_loss: 0.3874, test_loss: 1.8562, test_f1: 0.5948
 epoch: 93, train_loss: 0.4019, test_loss: 1.8351, test_f1: 0.5980
 epoch: 94, train_loss: 0.3969, test_loss: 2.0849, test_f1: 0.6150
 epoch: 95, train_loss: 0.4371, test_loss: 1.7028, test_f1: 0.6104
 epoch: 96, train_loss: 0.4081, test_loss: 2.3132, test_f1: 0.5407
 epoch: 97, train_loss: 0.4066, test_loss: 2.4345, test_f1: 0.5838
 epoch: 98, train_loss: 0.3694, test_loss: 1.8545, test_f1: 0.6023
 epoch: 99, train_loss: 0.3935, test_loss: 2.2905, test_f1: 0.5915
##################ITERATION #4 ****************************************
 epoch: 0, train_loss: 1.2583, test_loss: 1.2844, test_f1: 0.3062
 epoch: 1, train_loss: 1.1232, test_loss: 1.0950, test_f1: 0.5181
 epoch: 2, train_loss: 1.0615, test_loss: 1.1125, test_f1: 0.4912
 epoch: 3, train_loss: 1.0351, test_loss: 1.1605, test_f1: 0.4712
 epoch: 4, train_loss: 1.0121, test_loss: 1.0890, test_f1: 0.5158
 epoch: 5, train_loss: 1.0012, test_loss: 1.1121, test_f1: 0.4865
 epoch: 6, train_loss: 0.9501, test_loss: 1.1319, test_f1: 0.4824
 epoch: 7, train_loss: 0.9383, test_loss: 1.0211, test_f1: 0.5476
 epoch: 8, train_loss: 0.9310, test_loss: 1.0844, test_f1: 0.5194
 epoch: 9, train_loss: 0.9394, test_loss: 1.0920, test_f1: 0.5227
 epoch: 10, train_loss: 0.9281, test_loss: 1.1262, test_f1: 0.5616
 epoch: 11, train_loss: 0.9338, test_loss: 1.1493, test_f1: 0.5560
 epoch: 12, train_loss: 0.9241, test_loss: 1.0986, test_f1: 0.5232
 epoch: 13, train_loss: 0.9130, test_loss: 1.0389, test_f1: 0.5734
 epoch: 14, train_loss: 0.9077, test_loss: 1.0977, test_f1: 0.4409
 epoch: 15, train_loss: 0.8974, test_loss: 1.1960, test_f1: 0.4701
 epoch: 16, train_loss: 0.9082, test_loss: 1.0362, test_f1: 0.5467
 epoch: 17, train_loss: 0.8863, test_loss: 1.2226, test_f1: 0.4542
 epoch: 18, train_loss: 0.9053, test_loss: 1.0349, test_f1: 0.4969
 epoch: 19, train_loss: 0.8805, test_loss: 1.1630, test_f1: 0.5186
 epoch: 20, train_loss: 0.8503, test_loss: 1.3684, test_f1: 0.4712
 epoch: 21, train_loss: 0.8668, test_loss: 1.0954, test_f1: 0.5277
 epoch: 22, train_loss: 0.8446, test_loss: 1.2314, test_f1: 0.5113
 epoch: 23, train_loss: 0.8261, test_loss: 1.1367, test_f1: 0.4926
 epoch: 24, train_loss: 0.7994, test_loss: 1.2532, test_f1: 0.5505
 epoch: 25, train_loss: 0.8011, test_loss: 1.3352, test_f1: 0.5464
 epoch: 26, train_loss: 0.7763, test_loss: 1.2015, test_f1: 0.4697
 epoch: 27, train_loss: 0.8053, test_loss: 1.2358, test_f1: 0.5192
 epoch: 28, train_loss: 0.8109, test_loss: 1.1223, test_f1: 0.5913
 epoch: 29, train_loss: 0.7655, test_loss: 1.4013, test_f1: 0.4423
 epoch: 30, train_loss: 0.7592, test_loss: 1.4083, test_f1: 0.5890
 epoch: 31, train_loss: 0.7647, test_loss: 1.1359, test_f1: 0.6214
 epoch: 32, train_loss: 0.7612, test_loss: 1.2073, test_f1: 0.5693
 epoch: 33, train_loss: 0.7697, test_loss: 1.1535, test_f1: 0.5299
 epoch: 34, train_loss: 0.7555, test_loss: 1.1976, test_f1: 0.6115
 epoch: 35, train_loss: 0.7125, test_loss: 1.2757, test_f1: 0.5837
 epoch: 36, train_loss: 0.7278, test_loss: 1.1561, test_f1: 0.5863
 epoch: 37, train_loss: 0.7462, test_loss: 1.3168, test_f1: 0.5945
 epoch: 38, train_loss: 0.7095, test_loss: 1.5241, test_f1: 0.5357
 epoch: 39, train_loss: 0.7306, test_loss: 1.2646, test_f1: 0.5698
 epoch: 40, train_loss: 0.7330, test_loss: 1.3157, test_f1: 0.5925
 epoch: 41, train_loss: 0.7019, test_loss: 1.3395, test_f1: 0.6252
 epoch: 42, train_loss: 0.6778, test_loss: 1.2970, test_f1: 0.5740
 epoch: 43, train_loss: 0.7072, test_loss: 1.2554, test_f1: 0.5379
 epoch: 44, train_loss: 0.6801, test_loss: 1.2430, test_f1: 0.6159
 epoch: 45, train_loss: 0.6636, test_loss: 1.5700, test_f1: 0.4797
 epoch: 46, train_loss: 0.6830, test_loss: 1.2547, test_f1: 0.5690
 epoch: 47, train_loss: 0.6715, test_loss: 1.3311, test_f1: 0.6098
 epoch: 48, train_loss: 0.6913, test_loss: 2.0044, test_f1: 0.5133
 epoch: 49, train_loss: 0.6611, test_loss: 1.5084, test_f1: 0.5836
 epoch: 50, train_loss: 0.6250, test_loss: 1.3889, test_f1: 0.5630
 epoch: 51, train_loss: 0.6074, test_loss: 1.4658, test_f1: 0.6058
 epoch: 52, train_loss: 0.5838, test_loss: 1.4492, test_f1: 0.5702
 epoch: 53, train_loss: 0.5822, test_loss: 1.5923, test_f1: 0.6104
 epoch: 54, train_loss: 0.5653, test_loss: 1.5328, test_f1: 0.5757
 epoch: 55, train_loss: 0.5885, test_loss: 1.4519, test_f1: 0.6282
 epoch: 56, train_loss: 0.5487, test_loss: 1.7059, test_f1: 0.5892
 epoch: 57, train_loss: 0.5223, test_loss: 1.7597, test_f1: 0.5789
 epoch: 58, train_loss: 0.5625, test_loss: 1.5087, test_f1: 0.6203
 epoch: 59, train_loss: 0.5494, test_loss: 1.6214, test_f1: 0.6069
 epoch: 60, train_loss: 0.5281, test_loss: 1.4502, test_f1: 0.5656
 epoch: 61, train_loss: 0.5182, test_loss: 1.9225, test_f1: 0.5664
 epoch: 62, train_loss: 0.5318, test_loss: 1.6210, test_f1: 0.6014
 epoch: 63, train_loss: 0.5492, test_loss: 1.7552, test_f1: 0.5799
 epoch: 64, train_loss: 0.5290, test_loss: 1.6852, test_f1: 0.6158
 epoch: 65, train_loss: 0.5254, test_loss: 1.5558, test_f1: 0.6008
 epoch: 66, train_loss: 0.5052, test_loss: 1.5974, test_f1: 0.5943
 epoch: 67, train_loss: 0.5477, test_loss: 1.8310, test_f1: 0.5686
 epoch: 68, train_loss: 0.5242, test_loss: 1.6911, test_f1: 0.5816
 epoch: 69, train_loss: 0.5043, test_loss: 1.8241, test_f1: 0.5556
 epoch: 70, train_loss: 0.4846, test_loss: 1.8919, test_f1: 0.5398
 epoch: 71, train_loss: 0.4900, test_loss: 1.7935, test_f1: 0.5542
 epoch: 72, train_loss: 0.5078, test_loss: 1.8298, test_f1: 0.5732
 epoch: 73, train_loss: 0.4926, test_loss: 2.0293, test_f1: 0.5702
 epoch: 74, train_loss: 0.4554, test_loss: 1.8063, test_f1: 0.6173
 epoch: 75, train_loss: 0.5002, test_loss: 1.5390, test_f1: 0.6477
 epoch: 76, train_loss: 0.5085, test_loss: 1.7449, test_f1: 0.6100
 epoch: 77, train_loss: 0.4667, test_loss: 1.6933, test_f1: 0.5731
 epoch: 78, train_loss: 0.4493, test_loss: 1.7104, test_f1: 0.5652
 epoch: 79, train_loss: 0.5119, test_loss: 1.6353, test_f1: 0.6259
 epoch: 80, train_loss: 0.4794, test_loss: 1.8126, test_f1: 0.6112
 epoch: 81, train_loss: 0.4687, test_loss: 2.0511, test_f1: 0.5915
 epoch: 82, train_loss: 0.5088, test_loss: 1.6687, test_f1: 0.6243
 epoch: 83, train_loss: 0.4731, test_loss: 1.7431, test_f1: 0.5918
 epoch: 84, train_loss: 0.4610, test_loss: 1.7447, test_f1: 0.5878
 epoch: 85, train_loss: 0.4782, test_loss: 1.8684, test_f1: 0.5947
 epoch: 86, train_loss: 0.4852, test_loss: 1.7774, test_f1: 0.5437
 epoch: 87, train_loss: 0.4661, test_loss: 1.6388, test_f1: 0.6378
 epoch: 88, train_loss: 0.4525, test_loss: 1.7949, test_f1: 0.6284
 epoch: 89, train_loss: 0.4543, test_loss: 2.1898, test_f1: 0.5998
 epoch: 90, train_loss: 0.4262, test_loss: 1.7327, test_f1: 0.6020
 epoch: 91, train_loss: 0.4600, test_loss: 2.1861, test_f1: 0.5938
 epoch: 92, train_loss: 0.4175, test_loss: 1.8908, test_f1: 0.6039
 epoch: 93, train_loss: 0.4721, test_loss: 1.8767, test_f1: 0.6055
 epoch: 94, train_loss: 0.4697, test_loss: 2.0107, test_f1: 0.5750
 epoch: 95, train_loss: 0.4601, test_loss: 1.7413, test_f1: 0.6030
 epoch: 96, train_loss: 0.4202, test_loss: 2.0129, test_f1: 0.6106
 epoch: 97, train_loss: 0.4196, test_loss: 2.0358, test_f1: 0.5975
 epoch: 98, train_loss: 0.3786, test_loss: 2.1856, test_f1: 0.6071
 epoch: 99, train_loss: 0.4277, test_loss: 2.0232, test_f1: 0.5746
##################ITERATION #5 ****************************************
 epoch: 0, train_loss: 1.2724, test_loss: 1.2883, test_f1: 0.2332
 epoch: 1, train_loss: 1.1044, test_loss: 1.1562, test_f1: 0.4102
 epoch: 2, train_loss: 1.0377, test_loss: 1.0997, test_f1: 0.4980
 epoch: 3, train_loss: 1.0104, test_loss: 1.0977, test_f1: 0.4941
 epoch: 4, train_loss: 0.9734, test_loss: 1.1920, test_f1: 0.4286
 epoch: 5, train_loss: 1.0017, test_loss: 1.1256, test_f1: 0.4986
 epoch: 6, train_loss: 0.9634, test_loss: 1.0893, test_f1: 0.4824
 epoch: 7, train_loss: 0.9325, test_loss: 1.1349, test_f1: 0.5316
 epoch: 8, train_loss: 0.9254, test_loss: 1.0575, test_f1: 0.5424
 epoch: 9, train_loss: 0.9147, test_loss: 1.2009, test_f1: 0.5003
 epoch: 10, train_loss: 0.9030, test_loss: 1.0492, test_f1: 0.5354
 epoch: 11, train_loss: 0.9081, test_loss: 1.4807, test_f1: 0.4181
 epoch: 12, train_loss: 0.9711, test_loss: 1.1652, test_f1: 0.4735
 epoch: 13, train_loss: 0.9298, test_loss: 1.1393, test_f1: 0.5169
 epoch: 14, train_loss: 0.9130, test_loss: 1.2021, test_f1: 0.4923
 epoch: 15, train_loss: 0.9125, test_loss: 1.1362, test_f1: 0.5558
 epoch: 16, train_loss: 0.8767, test_loss: 1.1004, test_f1: 0.5142
 epoch: 17, train_loss: 0.8582, test_loss: 1.1533, test_f1: 0.5194
 epoch: 18, train_loss: 0.8468, test_loss: 1.1898, test_f1: 0.5084
 epoch: 19, train_loss: 0.8400, test_loss: 1.0132, test_f1: 0.5624
 epoch: 20, train_loss: 0.8214, test_loss: 1.2721, test_f1: 0.4436
 epoch: 21, train_loss: 0.8246, test_loss: 1.0773, test_f1: 0.5274
 epoch: 22, train_loss: 0.8288, test_loss: 1.1902, test_f1: 0.5329
 epoch: 23, train_loss: 0.8222, test_loss: 1.0435, test_f1: 0.5833
 epoch: 24, train_loss: 0.7958, test_loss: 1.1194, test_f1: 0.5654
 epoch: 25, train_loss: 0.7651, test_loss: 1.1113, test_f1: 0.5418
 epoch: 26, train_loss: 0.7621, test_loss: 1.1838, test_f1: 0.5529
 epoch: 27, train_loss: 0.7824, test_loss: 1.1118, test_f1: 0.5890
 epoch: 28, train_loss: 0.7399, test_loss: 1.0677, test_f1: 0.6158
 epoch: 29, train_loss: 0.7627, test_loss: 1.0692, test_f1: 0.5938
 epoch: 30, train_loss: 0.7175, test_loss: 1.1062, test_f1: 0.5009
 epoch: 31, train_loss: 0.7284, test_loss: 1.2585, test_f1: 0.5182
 epoch: 32, train_loss: 0.7445, test_loss: 1.0590, test_f1: 0.5196
 epoch: 33, train_loss: 0.7413, test_loss: 1.1221, test_f1: 0.5827
 epoch: 34, train_loss: 0.7138, test_loss: 1.2683, test_f1: 0.5051
 epoch: 35, train_loss: 0.6976, test_loss: 1.1782, test_f1: 0.5558
 epoch: 36, train_loss: 0.7305, test_loss: 1.9613, test_f1: 0.3409
 epoch: 37, train_loss: 0.7096, test_loss: 1.1105, test_f1: 0.5760
 epoch: 38, train_loss: 0.6854, test_loss: 1.0681, test_f1: 0.6212
 epoch: 39, train_loss: 0.7314, test_loss: 1.0918, test_f1: 0.6207
 epoch: 40, train_loss: 0.6803, test_loss: 1.3541, test_f1: 0.6065
 epoch: 41, train_loss: 0.6700, test_loss: 1.2029, test_f1: 0.6064
 epoch: 42, train_loss: 0.6757, test_loss: 1.1405, test_f1: 0.5802
 epoch: 43, train_loss: 0.6821, test_loss: 1.1349, test_f1: 0.5798
 epoch: 44, train_loss: 0.6769, test_loss: 1.1253, test_f1: 0.5938
 epoch: 45, train_loss: 0.6578, test_loss: 1.2004, test_f1: 0.6170
 epoch: 46, train_loss: 0.6494, test_loss: 1.3536, test_f1: 0.6086
 epoch: 47, train_loss: 0.6796, test_loss: 1.1444, test_f1: 0.5199
 epoch: 48, train_loss: 0.6614, test_loss: 1.2722, test_f1: 0.6019
 epoch: 49, train_loss: 0.6554, test_loss: 1.2098, test_f1: 0.5932
 epoch: 50, train_loss: 0.6090, test_loss: 1.1822, test_f1: 0.5901
 epoch: 51, train_loss: 0.6093, test_loss: 1.2947, test_f1: 0.5783
 epoch: 52, train_loss: 0.5722, test_loss: 1.2450, test_f1: 0.6144
 epoch: 53, train_loss: 0.5771, test_loss: 1.2687, test_f1: 0.6091
 epoch: 54, train_loss: 0.5495, test_loss: 1.3340, test_f1: 0.6105
 epoch: 55, train_loss: 0.5526, test_loss: 1.3218, test_f1: 0.5823
 epoch: 56, train_loss: 0.5454, test_loss: 1.4683, test_f1: 0.6160
 epoch: 57, train_loss: 0.5452, test_loss: 1.4035, test_f1: 0.5803
 epoch: 58, train_loss: 0.5217, test_loss: 1.7765, test_f1: 0.5674
 epoch: 59, train_loss: 0.5652, test_loss: 1.4253, test_f1: 0.6009
 epoch: 60, train_loss: 0.5382, test_loss: 1.5243, test_f1: 0.5825
 epoch: 61, train_loss: 0.5135, test_loss: 1.6374, test_f1: 0.5712
 epoch: 62, train_loss: 0.5291, test_loss: 1.3898, test_f1: 0.5953
 epoch: 63, train_loss: 0.5065, test_loss: 1.4793, test_f1: 0.5828
 epoch: 64, train_loss: 0.5160, test_loss: 1.6033, test_f1: 0.5681
 epoch: 65, train_loss: 0.5031, test_loss: 1.6880, test_f1: 0.6276
 epoch: 66, train_loss: 0.5229, test_loss: 1.5693, test_f1: 0.5585
 epoch: 67, train_loss: 0.4990, test_loss: 1.6244, test_f1: 0.6086
 epoch: 68, train_loss: 0.5014, test_loss: 1.6642, test_f1: 0.5727
 epoch: 69, train_loss: 0.5080, test_loss: 1.5993, test_f1: 0.6148
 epoch: 70, train_loss: 0.5192, test_loss: 1.5587, test_f1: 0.5708
 epoch: 71, train_loss: 0.5154, test_loss: 1.6835, test_f1: 0.5405
 epoch: 72, train_loss: 0.4866, test_loss: 1.6103, test_f1: 0.6250
 epoch: 73, train_loss: 0.5247, test_loss: 1.4457, test_f1: 0.6045
 epoch: 74, train_loss: 0.4951, test_loss: 1.4604, test_f1: 0.5930
 epoch: 75, train_loss: 0.5061, test_loss: 1.5699, test_f1: 0.6080
 epoch: 76, train_loss: 0.4668, test_loss: 1.6228, test_f1: 0.5863
 epoch: 77, train_loss: 0.4534, test_loss: 1.6828, test_f1: 0.5813
 epoch: 78, train_loss: 0.4602, test_loss: 1.8463, test_f1: 0.6077
 epoch: 79, train_loss: 0.4556, test_loss: 1.7022, test_f1: 0.5539
 epoch: 80, train_loss: 0.4537, test_loss: 1.8493, test_f1: 0.6090
 epoch: 81, train_loss: 0.4735, test_loss: 1.7785, test_f1: 0.6161
 epoch: 82, train_loss: 0.4802, test_loss: 1.5727, test_f1: 0.6003
 epoch: 83, train_loss: 0.4650, test_loss: 1.9588, test_f1: 0.6090
 epoch: 84, train_loss: 0.4344, test_loss: 1.6162, test_f1: 0.5879
 epoch: 85, train_loss: 0.4905, test_loss: 1.6744, test_f1: 0.5968
 epoch: 86, train_loss: 0.4691, test_loss: 1.7345, test_f1: 0.5907
 epoch: 87, train_loss: 0.4558, test_loss: 1.9304, test_f1: 0.5548
 epoch: 88, train_loss: 0.4449, test_loss: 1.8418, test_f1: 0.6036
 epoch: 89, train_loss: 0.4315, test_loss: 1.9003, test_f1: 0.5800
 epoch: 90, train_loss: 0.4447, test_loss: 1.9835, test_f1: 0.5613
 epoch: 91, train_loss: 0.4434, test_loss: 1.7625, test_f1: 0.6121
 epoch: 92, train_loss: 0.4034, test_loss: 1.9684, test_f1: 0.6181
 epoch: 93, train_loss: 0.4545, test_loss: 2.0414, test_f1: 0.5637
 epoch: 94, train_loss: 0.4309, test_loss: 1.8507, test_f1: 0.6209
 epoch: 95, train_loss: 0.4425, test_loss: 1.6279, test_f1: 0.6039
 epoch: 96, train_loss: 0.4152, test_loss: 2.0210, test_f1: 0.5895
 epoch: 97, train_loss: 0.4547, test_loss: 2.0724, test_f1: 0.5888
 epoch: 98, train_loss: 0.4602, test_loss: 1.8632, test_f1: 0.5807
 epoch: 99, train_loss: 0.4262, test_loss: 1.9239, test_f1: 0.6021
##################ITERATION #6 ****************************************
 epoch: 0, train_loss: 1.2576, test_loss: 1.2697, test_f1: 0.3608
 epoch: 1, train_loss: 1.1118, test_loss: 1.1287, test_f1: 0.4490
 epoch: 2, train_loss: 1.0754, test_loss: 1.1082, test_f1: 0.4699
 epoch: 3, train_loss: 1.0316, test_loss: 1.0973, test_f1: 0.4873
 epoch: 4, train_loss: 1.0162, test_loss: 1.0933, test_f1: 0.4962
 epoch: 5, train_loss: 1.0119, test_loss: 1.0949, test_f1: 0.5146
 epoch: 6, train_loss: 0.9719, test_loss: 1.0550, test_f1: 0.4750
 epoch: 7, train_loss: 0.9534, test_loss: 1.0806, test_f1: 0.5346
 epoch: 8, train_loss: 0.9336, test_loss: 1.0986, test_f1: 0.5139
 epoch: 9, train_loss: 0.9396, test_loss: 1.0921, test_f1: 0.5272
 epoch: 10, train_loss: 0.9298, test_loss: 1.2264, test_f1: 0.5111
 epoch: 11, train_loss: 0.9230, test_loss: 1.1676, test_f1: 0.5553
 epoch: 12, train_loss: 0.9097, test_loss: 1.0995, test_f1: 0.5470
 epoch: 13, train_loss: 0.8919, test_loss: 1.3099, test_f1: 0.4494
 epoch: 14, train_loss: 0.9095, test_loss: 1.0777, test_f1: 0.5762
 epoch: 15, train_loss: 0.8736, test_loss: 1.1483, test_f1: 0.5299
 epoch: 16, train_loss: 0.8637, test_loss: 1.1234, test_f1: 0.5775
 epoch: 17, train_loss: 0.8576, test_loss: 1.1391, test_f1: 0.5412
 epoch: 18, train_loss: 0.8525, test_loss: 1.1627, test_f1: 0.5643
 epoch: 19, train_loss: 0.8561, test_loss: 1.1495, test_f1: 0.5419
 epoch: 20, train_loss: 0.8186, test_loss: 1.2567, test_f1: 0.5453
 epoch: 21, train_loss: 0.8010, test_loss: 1.2135, test_f1: 0.5773
 epoch: 22, train_loss: 0.8134, test_loss: 1.1813, test_f1: 0.5525
 epoch: 23, train_loss: 0.8236, test_loss: 1.1028, test_f1: 0.6036
 epoch: 24, train_loss: 0.8176, test_loss: 1.1348, test_f1: 0.5801
 epoch: 25, train_loss: 0.7596, test_loss: 1.2657, test_f1: 0.4726
 epoch: 26, train_loss: 0.7789, test_loss: 1.2760, test_f1: 0.5739
 epoch: 27, train_loss: 0.7940, test_loss: 1.1306, test_f1: 0.5101
 epoch: 28, train_loss: 0.7939, test_loss: 1.1555, test_f1: 0.5960
 epoch: 29, train_loss: 0.7800, test_loss: 1.1325, test_f1: 0.4975
 epoch: 30, train_loss: 0.7521, test_loss: 1.5508, test_f1: 0.5460
 epoch: 31, train_loss: 0.7510, test_loss: 1.1264, test_f1: 0.5846
 epoch: 32, train_loss: 0.7568, test_loss: 1.2375, test_f1: 0.5871
 epoch: 33, train_loss: 0.7439, test_loss: 1.2287, test_f1: 0.5524
 epoch: 34, train_loss: 0.7523, test_loss: 1.2524, test_f1: 0.5677
 epoch: 35, train_loss: 0.7179, test_loss: 1.2630, test_f1: 0.5681
 epoch: 36, train_loss: 0.7392, test_loss: 1.3064, test_f1: 0.5309
 epoch: 37, train_loss: 0.7097, test_loss: 1.2045, test_f1: 0.5738
 epoch: 38, train_loss: 0.6804, test_loss: 1.3262, test_f1: 0.5450
 epoch: 39, train_loss: 0.6779, test_loss: 1.2383, test_f1: 0.5992
 epoch: 40, train_loss: 0.6603, test_loss: 1.3916, test_f1: 0.5698
 epoch: 41, train_loss: 0.6632, test_loss: 1.5228, test_f1: 0.5684
 epoch: 42, train_loss: 0.6888, test_loss: 1.3663, test_f1: 0.5398
 epoch: 43, train_loss: 0.6535, test_loss: 1.3480, test_f1: 0.5615
 epoch: 44, train_loss: 0.6612, test_loss: 1.4077, test_f1: 0.5240
 epoch: 45, train_loss: 0.6917, test_loss: 1.2825, test_f1: 0.5730
 epoch: 46, train_loss: 0.6583, test_loss: 1.3578, test_f1: 0.5745
 epoch: 47, train_loss: 0.6805, test_loss: 1.2542, test_f1: 0.5642
 epoch: 48, train_loss: 0.6615, test_loss: 1.3181, test_f1: 0.5830
 epoch: 49, train_loss: 0.6531, test_loss: 1.4548, test_f1: 0.5405
 epoch: 50, train_loss: 0.6311, test_loss: 1.4463, test_f1: 0.5358
 epoch: 51, train_loss: 0.6092, test_loss: 1.2607, test_f1: 0.5961
 epoch: 52, train_loss: 0.5710, test_loss: 1.2989, test_f1: 0.5580
 epoch: 53, train_loss: 0.5755, test_loss: 1.3813, test_f1: 0.5699
 epoch: 54, train_loss: 0.5649, test_loss: 1.3201, test_f1: 0.6020
 epoch: 55, train_loss: 0.5532, test_loss: 1.3159, test_f1: 0.5870
 epoch: 56, train_loss: 0.5524, test_loss: 1.5199, test_f1: 0.5607
 epoch: 57, train_loss: 0.5432, test_loss: 1.4708, test_f1: 0.5881
 epoch: 58, train_loss: 0.5417, test_loss: 1.4777, test_f1: 0.5778
 epoch: 59, train_loss: 0.5311, test_loss: 1.4899, test_f1: 0.5706
 epoch: 60, train_loss: 0.5511, test_loss: 1.4221, test_f1: 0.5778
 epoch: 61, train_loss: 0.5433, test_loss: 1.5674, test_f1: 0.5622
 epoch: 62, train_loss: 0.5478, test_loss: 1.4188, test_f1: 0.5763
 epoch: 63, train_loss: 0.5452, test_loss: 1.5015, test_f1: 0.5974
 epoch: 64, train_loss: 0.5288, test_loss: 1.3936, test_f1: 0.5814
 epoch: 65, train_loss: 0.5321, test_loss: 1.5330, test_f1: 0.6103
 epoch: 66, train_loss: 0.5241, test_loss: 1.4702, test_f1: 0.5794
 epoch: 67, train_loss: 0.5351, test_loss: 1.5096, test_f1: 0.5855
 epoch: 68, train_loss: 0.5207, test_loss: 1.5027, test_f1: 0.5597
 epoch: 69, train_loss: 0.5157, test_loss: 1.5643, test_f1: 0.5793
 epoch: 70, train_loss: 0.4827, test_loss: 1.5734, test_f1: 0.5765
 epoch: 71, train_loss: 0.4873, test_loss: 1.7427, test_f1: 0.5627
 epoch: 72, train_loss: 0.5035, test_loss: 1.7629, test_f1: 0.5094
 epoch: 73, train_loss: 0.4978, test_loss: 1.5607, test_f1: 0.5536
 epoch: 74, train_loss: 0.4863, test_loss: 1.7269, test_f1: 0.5449
 epoch: 75, train_loss: 0.4426, test_loss: 1.5510, test_f1: 0.5914
 epoch: 76, train_loss: 0.4760, test_loss: 1.6041, test_f1: 0.5752
 epoch: 77, train_loss: 0.4968, test_loss: 1.6417, test_f1: 0.5694
 epoch: 78, train_loss: 0.4771, test_loss: 1.8090, test_f1: 0.5462
 epoch: 79, train_loss: 0.5159, test_loss: 1.3842, test_f1: 0.5874
 epoch: 80, train_loss: 0.4603, test_loss: 1.8154, test_f1: 0.5278
 epoch: 81, train_loss: 0.4936, test_loss: 1.6719, test_f1: 0.5389
 epoch: 82, train_loss: 0.5018, test_loss: 1.6875, test_f1: 0.5641
 epoch: 83, train_loss: 0.5034, test_loss: 1.6232, test_f1: 0.5815
 epoch: 84, train_loss: 0.5287, test_loss: 1.9685, test_f1: 0.5614
 epoch: 85, train_loss: 0.4986, test_loss: 1.4183, test_f1: 0.5945
 epoch: 86, train_loss: 0.4591, test_loss: 2.0836, test_f1: 0.5420
 epoch: 87, train_loss: 0.4678, test_loss: 1.7434, test_f1: 0.5927
 epoch: 88, train_loss: 0.4680, test_loss: 1.5837, test_f1: 0.5887
 epoch: 89, train_loss: 0.4792, test_loss: 1.6096, test_f1: 0.5644
 epoch: 90, train_loss: 0.4513, test_loss: 1.5746, test_f1: 0.6041
 epoch: 91, train_loss: 0.4522, test_loss: 1.6290, test_f1: 0.5861
 epoch: 92, train_loss: 0.4628, test_loss: 1.7497, test_f1: 0.5908
 epoch: 93, train_loss: 0.5072, test_loss: 1.4864, test_f1: 0.6053
 epoch: 94, train_loss: 0.4510, test_loss: 1.5686, test_f1: 0.5686
 epoch: 95, train_loss: 0.4019, test_loss: 1.9348, test_f1: 0.5387
 epoch: 96, train_loss: 0.4437, test_loss: 1.6929, test_f1: 0.6053
 epoch: 97, train_loss: 0.4377, test_loss: 1.4886, test_f1: 0.6233
 epoch: 98, train_loss: 0.4767, test_loss: 1.5900, test_f1: 0.5344
 epoch: 99, train_loss: 0.4403, test_loss: 1.7244, test_f1: 0.5904
##################ITERATION #7 ****************************************
 epoch: 0, train_loss: 1.3167, test_loss: 1.3831, test_f1: 0.3335
 epoch: 1, train_loss: 1.1015, test_loss: 1.1893, test_f1: 0.4260
 epoch: 2, train_loss: 1.1006, test_loss: 1.1415, test_f1: 0.4170
 epoch: 3, train_loss: 1.0646, test_loss: 1.1247, test_f1: 0.3679
 epoch: 4, train_loss: 1.0459, test_loss: 1.2194, test_f1: 0.4586
 epoch: 5, train_loss: 1.0379, test_loss: 1.1134, test_f1: 0.4944
 epoch: 6, train_loss: 0.9795, test_loss: 1.1150, test_f1: 0.5316
 epoch: 7, train_loss: 0.9780, test_loss: 1.2778, test_f1: 0.4323
 epoch: 8, train_loss: 0.9649, test_loss: 1.0764, test_f1: 0.5080
 epoch: 9, train_loss: 0.9467, test_loss: 1.2897, test_f1: 0.4834
 epoch: 10, train_loss: 0.9402, test_loss: 1.1906, test_f1: 0.5007
 epoch: 11, train_loss: 0.9375, test_loss: 1.0875, test_f1: 0.4938
 epoch: 12, train_loss: 0.9178, test_loss: 1.2842, test_f1: 0.4868
 epoch: 13, train_loss: 0.9196, test_loss: 1.2331, test_f1: 0.3621
 epoch: 14, train_loss: 0.9132, test_loss: 1.0188, test_f1: 0.5023
 epoch: 15, train_loss: 0.9119, test_loss: 1.1204, test_f1: 0.5061
 epoch: 16, train_loss: 0.8853, test_loss: 1.1254, test_f1: 0.5223
 epoch: 17, train_loss: 0.8825, test_loss: 1.0375, test_f1: 0.5405
 epoch: 18, train_loss: 0.9016, test_loss: 1.1338, test_f1: 0.5069
 epoch: 19, train_loss: 0.8657, test_loss: 1.0383, test_f1: 0.5778
 epoch: 20, train_loss: 0.8603, test_loss: 1.0170, test_f1: 0.5774
 epoch: 21, train_loss: 0.8584, test_loss: 1.0433, test_f1: 0.4523
 epoch: 22, train_loss: 0.8260, test_loss: 1.1791, test_f1: 0.5326
 epoch: 23, train_loss: 0.8202, test_loss: 1.2254, test_f1: 0.5237
 epoch: 24, train_loss: 0.8219, test_loss: 1.1171, test_f1: 0.5196
 epoch: 25, train_loss: 0.8325, test_loss: 1.1504, test_f1: 0.5605
 epoch: 26, train_loss: 0.7925, test_loss: 1.1098, test_f1: 0.5658
 epoch: 27, train_loss: 0.7841, test_loss: 1.0544, test_f1: 0.5381
 epoch: 28, train_loss: 0.7968, test_loss: 1.0253, test_f1: 0.5121
 epoch: 29, train_loss: 0.7509, test_loss: 1.5536, test_f1: 0.5267
 epoch: 30, train_loss: 0.7680, test_loss: 1.2416, test_f1: 0.4889
 epoch: 31, train_loss: 0.7564, test_loss: 1.6668, test_f1: 0.3993
 epoch: 32, train_loss: 0.7495, test_loss: 1.2941, test_f1: 0.5786
 epoch: 33, train_loss: 0.7509, test_loss: 1.5030, test_f1: 0.4759
 epoch: 34, train_loss: 0.7735, test_loss: 1.3126, test_f1: 0.3734
 epoch: 35, train_loss: 0.7725, test_loss: 1.2279, test_f1: 0.5257
 epoch: 36, train_loss: 0.7696, test_loss: 1.4807, test_f1: 0.5203
 epoch: 37, train_loss: 0.7550, test_loss: 1.2069, test_f1: 0.4544
 epoch: 38, train_loss: 0.7301, test_loss: 1.1272, test_f1: 0.5501
 epoch: 39, train_loss: 0.6894, test_loss: 1.3299, test_f1: 0.5625
 epoch: 40, train_loss: 0.7298, test_loss: 1.1491, test_f1: 0.5960
 epoch: 41, train_loss: 0.7519, test_loss: 1.1159, test_f1: 0.5779
 epoch: 42, train_loss: 0.7297, test_loss: 1.1527, test_f1: 0.5768
 epoch: 43, train_loss: 0.7074, test_loss: 1.0957, test_f1: 0.5911
 epoch: 44, train_loss: 0.7064, test_loss: 1.1104, test_f1: 0.5516
 epoch: 45, train_loss: 0.6585, test_loss: 1.2960, test_f1: 0.5422
 epoch: 46, train_loss: 0.6702, test_loss: 1.2083, test_f1: 0.6040
 epoch: 47, train_loss: 0.6816, test_loss: 1.1595, test_f1: 0.5868
 epoch: 48, train_loss: 0.6852, test_loss: 1.2524, test_f1: 0.5480
 epoch: 49, train_loss: 0.6915, test_loss: 1.2065, test_f1: 0.6061
 epoch: 50, train_loss: 0.6806, test_loss: 1.2386, test_f1: 0.5699
 epoch: 51, train_loss: 0.6569, test_loss: 1.1511, test_f1: 0.5807
 epoch: 52, train_loss: 0.6145, test_loss: 1.2027, test_f1: 0.5818
 epoch: 53, train_loss: 0.6094, test_loss: 1.1700, test_f1: 0.5890
 epoch: 54, train_loss: 0.5995, test_loss: 1.2188, test_f1: 0.5980
 epoch: 55, train_loss: 0.6066, test_loss: 1.2539, test_f1: 0.5345
 epoch: 56, train_loss: 0.5808, test_loss: 1.1723, test_f1: 0.6168
 epoch: 57, train_loss: 0.5733, test_loss: 1.4324, test_f1: 0.5068
 epoch: 58, train_loss: 0.5897, test_loss: 1.2453, test_f1: 0.5693
 epoch: 59, train_loss: 0.5501, test_loss: 1.2627, test_f1: 0.6102
 epoch: 60, train_loss: 0.5767, test_loss: 1.2046, test_f1: 0.6015
 epoch: 61, train_loss: 0.5956, test_loss: 1.2525, test_f1: 0.6181
 epoch: 62, train_loss: 0.5682, test_loss: 1.2853, test_f1: 0.5886
 epoch: 63, train_loss: 0.5530, test_loss: 1.2523, test_f1: 0.5924
 epoch: 64, train_loss: 0.5541, test_loss: 1.1959, test_f1: 0.5915
 epoch: 65, train_loss: 0.5533, test_loss: 1.2664, test_f1: 0.5884
 epoch: 66, train_loss: 0.5313, test_loss: 1.3462, test_f1: 0.5975
 epoch: 67, train_loss: 0.5178, test_loss: 1.2917, test_f1: 0.5979
 epoch: 68, train_loss: 0.5446, test_loss: 1.2889, test_f1: 0.5937
 epoch: 69, train_loss: 0.5645, test_loss: 1.5003, test_f1: 0.6009
 epoch: 70, train_loss: 0.5509, test_loss: 1.3066, test_f1: 0.5856
 epoch: 71, train_loss: 0.5252, test_loss: 1.3481, test_f1: 0.6000
 epoch: 72, train_loss: 0.5089, test_loss: 1.3941, test_f1: 0.5854
 epoch: 73, train_loss: 0.5199, test_loss: 1.4335, test_f1: 0.5115
 epoch: 74, train_loss: 0.5549, test_loss: 1.3521, test_f1: 0.5622
 epoch: 75, train_loss: 0.5612, test_loss: 1.3263, test_f1: 0.6132
 epoch: 76, train_loss: 0.5481, test_loss: 1.2744, test_f1: 0.6006
 epoch: 77, train_loss: 0.5248, test_loss: 1.3287, test_f1: 0.6235
 epoch: 78, train_loss: 0.5111, test_loss: 1.3411, test_f1: 0.6296
 epoch: 79, train_loss: 0.4988, test_loss: 1.2633, test_f1: 0.6205
 epoch: 80, train_loss: 0.5142, test_loss: 1.4267, test_f1: 0.5687
 epoch: 81, train_loss: 0.5067, test_loss: 1.3105, test_f1: 0.5938
 epoch: 82, train_loss: 0.5310, test_loss: 1.2978, test_f1: 0.6277
 epoch: 83, train_loss: 0.5163, test_loss: 1.4006, test_f1: 0.5909
 epoch: 84, train_loss: 0.5081, test_loss: 1.2933, test_f1: 0.6166
 epoch: 85, train_loss: 0.5122, test_loss: 1.4841, test_f1: 0.5988
 epoch: 86, train_loss: 0.4875, test_loss: 1.3361, test_f1: 0.5775
 epoch: 87, train_loss: 0.4751, test_loss: 1.5068, test_f1: 0.5766
 epoch: 88, train_loss: 0.5013, test_loss: 1.2506, test_f1: 0.6296
 epoch: 89, train_loss: 0.5167, test_loss: 1.5501, test_f1: 0.5596
 epoch: 90, train_loss: 0.5324, test_loss: 1.5082, test_f1: 0.5484
 epoch: 91, train_loss: 0.5079, test_loss: 1.4746, test_f1: 0.5985
 epoch: 92, train_loss: 0.5018, test_loss: 1.3161, test_f1: 0.5991
 epoch: 93, train_loss: 0.4662, test_loss: 1.4444, test_f1: 0.5822
 epoch: 94, train_loss: 0.4617, test_loss: 1.3030, test_f1: 0.6413
 epoch: 95, train_loss: 0.4680, test_loss: 1.6147, test_f1: 0.5903
 epoch: 96, train_loss: 0.4794, test_loss: 1.3933, test_f1: 0.5841
 epoch: 97, train_loss: 0.4788, test_loss: 1.5452, test_f1: 0.6008
 epoch: 98, train_loss: 0.4767, test_loss: 1.6271, test_f1: 0.6053
 epoch: 99, train_loss: 0.4695, test_loss: 1.4636, test_f1: 0.5776
##################ITERATION #8 ****************************************
 epoch: 0, train_loss: 1.2230, test_loss: 1.2405, test_f1: 0.3079
 epoch: 1, train_loss: 1.1079, test_loss: 1.1464, test_f1: 0.4523
 epoch: 2, train_loss: 1.0246, test_loss: 1.1839, test_f1: 0.4050
 epoch: 3, train_loss: 1.0103, test_loss: 1.2116, test_f1: 0.3845
 epoch: 4, train_loss: 0.9731, test_loss: 1.0505, test_f1: 0.4977
 epoch: 5, train_loss: 0.9655, test_loss: 1.0505, test_f1: 0.4140
 epoch: 6, train_loss: 0.9447, test_loss: 1.2702, test_f1: 0.4260
 epoch: 7, train_loss: 0.9592, test_loss: 1.1312, test_f1: 0.4531
 epoch: 8, train_loss: 0.9496, test_loss: 1.0771, test_f1: 0.5131
 epoch: 9, train_loss: 0.9413, test_loss: 1.1825, test_f1: 0.4373
 epoch: 10, train_loss: 0.9259, test_loss: 1.1745, test_f1: 0.5117
 epoch: 11, train_loss: 0.9283, test_loss: 1.1556, test_f1: 0.4938
 epoch: 12, train_loss: 0.9155, test_loss: 1.1503, test_f1: 0.5221
 epoch: 13, train_loss: 0.9114, test_loss: 1.1871, test_f1: 0.5009
 epoch: 14, train_loss: 0.9038, test_loss: 1.2500, test_f1: 0.5074
 epoch: 15, train_loss: 0.8884, test_loss: 1.2898, test_f1: 0.5386
 epoch: 16, train_loss: 0.8986, test_loss: 1.5358, test_f1: 0.4132
 epoch: 17, train_loss: 0.8891, test_loss: 1.1025, test_f1: 0.5658
 epoch: 18, train_loss: 0.8593, test_loss: 1.1978, test_f1: 0.5193
 epoch: 19, train_loss: 0.8740, test_loss: 1.2574, test_f1: 0.4242
 epoch: 20, train_loss: 0.8626, test_loss: 1.0683, test_f1: 0.5312
 epoch: 21, train_loss: 0.8363, test_loss: 1.1988, test_f1: 0.5269
 epoch: 22, train_loss: 0.8170, test_loss: 1.2030, test_f1: 0.5549
 epoch: 23, train_loss: 0.8365, test_loss: 1.1634, test_f1: 0.4799
 epoch: 24, train_loss: 0.8299, test_loss: 1.1693, test_f1: 0.5219
 epoch: 25, train_loss: 0.8168, test_loss: 1.1097, test_f1: 0.5453
 epoch: 26, train_loss: 0.8108, test_loss: 1.1414, test_f1: 0.5475
 epoch: 27, train_loss: 0.8160, test_loss: 1.5155, test_f1: 0.4723
 epoch: 28, train_loss: 0.8294, test_loss: 1.1596, test_f1: 0.4684
 epoch: 29, train_loss: 0.8085, test_loss: 1.1643, test_f1: 0.5167
 epoch: 30, train_loss: 0.7825, test_loss: 1.1166, test_f1: 0.5400
 epoch: 31, train_loss: 0.7888, test_loss: 1.1986, test_f1: 0.4932
 epoch: 32, train_loss: 0.8013, test_loss: 1.1636, test_f1: 0.5304
 epoch: 33, train_loss: 0.7582, test_loss: 1.0455, test_f1: 0.5320
 epoch: 34, train_loss: 0.8039, test_loss: 1.2309, test_f1: 0.4997
 epoch: 35, train_loss: 0.7981, test_loss: 1.2147, test_f1: 0.4457
 epoch: 36, train_loss: 0.7872, test_loss: 1.2288, test_f1: 0.5062
 epoch: 37, train_loss: 0.7345, test_loss: 1.1744, test_f1: 0.5394
 epoch: 38, train_loss: 0.7025, test_loss: 1.1936, test_f1: 0.5387
 epoch: 39, train_loss: 0.7276, test_loss: 1.4115, test_f1: 0.4996
 epoch: 40, train_loss: 0.7194, test_loss: 1.2396, test_f1: 0.5145
 epoch: 41, train_loss: 0.7171, test_loss: 1.2606, test_f1: 0.5686
 epoch: 42, train_loss: 0.7171, test_loss: 1.2511, test_f1: 0.5338
 epoch: 43, train_loss: 0.7122, test_loss: 1.3284, test_f1: 0.5143
 epoch: 44, train_loss: 0.7109, test_loss: 1.1014, test_f1: 0.5518
 epoch: 45, train_loss: 0.6854, test_loss: 1.4458, test_f1: 0.5753
 epoch: 46, train_loss: 0.7054, test_loss: 1.4300, test_f1: 0.5609
 epoch: 47, train_loss: 0.6819, test_loss: 1.2106, test_f1: 0.4788
 epoch: 48, train_loss: 0.6998, test_loss: 1.3989, test_f1: 0.5671
 epoch: 49, train_loss: 0.6902, test_loss: 1.4170, test_f1: 0.5017
 epoch: 50, train_loss: 0.6811, test_loss: 1.3866, test_f1: 0.4989
 epoch: 51, train_loss: 0.6632, test_loss: 1.4553, test_f1: 0.5259
 epoch: 52, train_loss: 0.6315, test_loss: 1.2898, test_f1: 0.5580
 epoch: 53, train_loss: 0.6229, test_loss: 1.4548, test_f1: 0.5577
 epoch: 54, train_loss: 0.6076, test_loss: 1.5103, test_f1: 0.5710
 epoch: 55, train_loss: 0.6113, test_loss: 1.5438, test_f1: 0.5633
 epoch: 56, train_loss: 0.5938, test_loss: 1.5107, test_f1: 0.5798
 epoch: 57, train_loss: 0.5806, test_loss: 1.5865, test_f1: 0.5417
 epoch: 58, train_loss: 0.6052, test_loss: 1.5338, test_f1: 0.5191
 epoch: 59, train_loss: 0.6120, test_loss: 1.6006, test_f1: 0.5879
 epoch: 60, train_loss: 0.6243, test_loss: 1.4573, test_f1: 0.5801
 epoch: 61, train_loss: 0.6024, test_loss: 1.5577, test_f1: 0.5294
 epoch: 62, train_loss: 0.6014, test_loss: 1.5132, test_f1: 0.5507
 epoch: 63, train_loss: 0.5708, test_loss: 1.5421, test_f1: 0.5806
 epoch: 64, train_loss: 0.6017, test_loss: 1.6155, test_f1: 0.5747
 epoch: 65, train_loss: 0.5877, test_loss: 1.6660, test_f1: 0.5674
 epoch: 66, train_loss: 0.6124, test_loss: 1.4498, test_f1: 0.5458
 epoch: 67, train_loss: 0.5913, test_loss: 1.4585, test_f1: 0.5571
 epoch: 68, train_loss: 0.5735, test_loss: 1.5488, test_f1: 0.5788
 epoch: 69, train_loss: 0.5528, test_loss: 1.5337, test_f1: 0.6038
 epoch: 70, train_loss: 0.6008, test_loss: 1.6322, test_f1: 0.5576
 epoch: 71, train_loss: 0.5448, test_loss: 1.6751, test_f1: 0.5995
 epoch: 72, train_loss: 0.5367, test_loss: 1.6082, test_f1: 0.5992
 epoch: 73, train_loss: 0.5416, test_loss: 1.6431, test_f1: 0.5577
 epoch: 74, train_loss: 0.5339, test_loss: 1.5737, test_f1: 0.5815
 epoch: 75, train_loss: 0.5380, test_loss: 1.6296, test_f1: 0.5602
 epoch: 76, train_loss: 0.5392, test_loss: 1.7453, test_f1: 0.5760
 epoch: 77, train_loss: 0.5286, test_loss: 1.4709, test_f1: 0.5707
 epoch: 78, train_loss: 0.5108, test_loss: 1.6779, test_f1: 0.4872
 epoch: 79, train_loss: 0.5229, test_loss: 1.6957, test_f1: 0.5421
 epoch: 80, train_loss: 0.5339, test_loss: 1.7607, test_f1: 0.5219
 epoch: 81, train_loss: 0.5112, test_loss: 1.6064, test_f1: 0.5722
 epoch: 82, train_loss: 0.4826, test_loss: 1.7899, test_f1: 0.5349
 epoch: 83, train_loss: 0.4898, test_loss: 1.7026, test_f1: 0.5686
 epoch: 84, train_loss: 0.4985, test_loss: 1.7703, test_f1: 0.5777
 epoch: 85, train_loss: 0.5286, test_loss: 1.9873, test_f1: 0.5855
 epoch: 86, train_loss: 0.5189, test_loss: 1.7257, test_f1: 0.5424
 epoch: 87, train_loss: 0.5229, test_loss: 1.5978, test_f1: 0.5593
 epoch: 88, train_loss: 0.4891, test_loss: 2.0091, test_f1: 0.5174
 epoch: 89, train_loss: 0.5219, test_loss: 1.7632, test_f1: 0.5378
 epoch: 90, train_loss: 0.4759, test_loss: 1.6813, test_f1: 0.5255
 epoch: 91, train_loss: 0.5048, test_loss: 1.6142, test_f1: 0.5361
 epoch: 92, train_loss: 0.5239, test_loss: 1.6366, test_f1: 0.5406
 epoch: 93, train_loss: 0.5036, test_loss: 1.7713, test_f1: 0.5602
 epoch: 94, train_loss: 0.5104, test_loss: 1.7705, test_f1: 0.5634
 epoch: 95, train_loss: 0.4811, test_loss: 1.7692, test_f1: 0.5544
 epoch: 96, train_loss: 0.4880, test_loss: 1.6859, test_f1: 0.5614
 epoch: 97, train_loss: 0.4692, test_loss: 1.7090, test_f1: 0.5674
 epoch: 98, train_loss: 0.4663, test_loss: 1.7253, test_f1: 0.5692
 epoch: 99, train_loss: 0.4344, test_loss: 1.8944, test_f1: 0.5362
##################ITERATION #9 ****************************************
 epoch: 0, train_loss: 1.2740, test_loss: 1.4108, test_f1: 0.3003
 epoch: 1, train_loss: 1.0874, test_loss: 1.1919, test_f1: 0.4652
 epoch: 2, train_loss: 1.0177, test_loss: 1.0537, test_f1: 0.5205
 epoch: 3, train_loss: 0.9715, test_loss: 1.0783, test_f1: 0.5092
 epoch: 4, train_loss: 0.9845, test_loss: 1.0944, test_f1: 0.5349
 epoch: 5, train_loss: 0.9550, test_loss: 1.1478, test_f1: 0.5068
 epoch: 6, train_loss: 0.9568, test_loss: 1.1421, test_f1: 0.4986
 epoch: 7, train_loss: 0.9638, test_loss: 1.1089, test_f1: 0.5459
 epoch: 8, train_loss: 0.9464, test_loss: 1.1084, test_f1: 0.5332
 epoch: 9, train_loss: 0.9221, test_loss: 1.1029, test_f1: 0.5195
 epoch: 10, train_loss: 0.9203, test_loss: 1.0347, test_f1: 0.5284
 epoch: 11, train_loss: 0.9235, test_loss: 1.0733, test_f1: 0.5242
 epoch: 12, train_loss: 0.9302, test_loss: 1.0291, test_f1: 0.5462
 epoch: 13, train_loss: 0.9166, test_loss: 1.0543, test_f1: 0.5402
 epoch: 14, train_loss: 0.8965, test_loss: 1.0461, test_f1: 0.5543
 epoch: 15, train_loss: 0.8626, test_loss: 1.0795, test_f1: 0.5476
 epoch: 16, train_loss: 0.8906, test_loss: 1.1059, test_f1: 0.5448
 epoch: 17, train_loss: 0.8752, test_loss: 1.0251, test_f1: 0.5693
 epoch: 18, train_loss: 0.8871, test_loss: 1.1078, test_f1: 0.5436
 epoch: 19, train_loss: 0.8700, test_loss: 1.1139, test_f1: 0.5433
 epoch: 20, train_loss: 0.8473, test_loss: 1.0809, test_f1: 0.5458
 epoch: 21, train_loss: 0.8442, test_loss: 1.4058, test_f1: 0.4981
 epoch: 22, train_loss: 0.8273, test_loss: 1.1809, test_f1: 0.5300
 epoch: 23, train_loss: 0.8464, test_loss: 1.1538, test_f1: 0.5081
 epoch: 24, train_loss: 0.8730, test_loss: 1.0996, test_f1: 0.5596
 epoch: 25, train_loss: 0.8732, test_loss: 1.0698, test_f1: 0.5516
 epoch: 26, train_loss: 0.8195, test_loss: 1.1084, test_f1: 0.5701
 epoch: 27, train_loss: 0.8368, test_loss: 1.1213, test_f1: 0.5815
 epoch: 28, train_loss: 0.8091, test_loss: 1.0826, test_f1: 0.6024
 epoch: 29, train_loss: 0.8104, test_loss: 1.1226, test_f1: 0.5765
 epoch: 30, train_loss: 0.7902, test_loss: 1.0575, test_f1: 0.5601
 epoch: 31, train_loss: 0.7792, test_loss: 1.0941, test_f1: 0.5718
 epoch: 32, train_loss: 0.8049, test_loss: 1.6660, test_f1: 0.4128
 epoch: 33, train_loss: 0.7821, test_loss: 1.1118, test_f1: 0.5485
 epoch: 34, train_loss: 0.7855, test_loss: 1.0950, test_f1: 0.5416
 epoch: 35, train_loss: 0.7824, test_loss: 1.2487, test_f1: 0.5146
 epoch: 36, train_loss: 0.8249, test_loss: 1.0668, test_f1: 0.5632
 epoch: 37, train_loss: 0.7683, test_loss: 1.1540, test_f1: 0.5846
 epoch: 38, train_loss: 0.7518, test_loss: 1.2004, test_f1: 0.5429
 epoch: 39, train_loss: 0.7699, test_loss: 1.0819, test_f1: 0.5502
 epoch: 40, train_loss: 0.7658, test_loss: 1.1529, test_f1: 0.5413
 epoch: 41, train_loss: 0.7596, test_loss: 1.2547, test_f1: 0.5466
 epoch: 42, train_loss: 0.7559, test_loss: 1.1310, test_f1: 0.6081
 epoch: 43, train_loss: 0.7512, test_loss: 1.1918, test_f1: 0.5426
 epoch: 44, train_loss: 0.7640, test_loss: 1.1725, test_f1: 0.5731
 epoch: 45, train_loss: 0.7465, test_loss: 1.1128, test_f1: 0.5226
 epoch: 46, train_loss: 0.7299, test_loss: 1.1245, test_f1: 0.5744
 epoch: 47, train_loss: 0.7256, test_loss: 1.2012, test_f1: 0.5548
 epoch: 48, train_loss: 0.7134, test_loss: 1.2266, test_f1: 0.5461
 epoch: 49, train_loss: 0.7174, test_loss: 1.2778, test_f1: 0.6015
 epoch: 50, train_loss: 0.7164, test_loss: 1.0836, test_f1: 0.5546
 epoch: 51, train_loss: 0.6720, test_loss: 1.1420, test_f1: 0.5977
 epoch: 52, train_loss: 0.6722, test_loss: 1.2127, test_f1: 0.5913
 epoch: 53, train_loss: 0.6581, test_loss: 1.1934, test_f1: 0.5771
 epoch: 54, train_loss: 0.6543, test_loss: 1.2656, test_f1: 0.5700
 epoch: 55, train_loss: 0.6191, test_loss: 1.2440, test_f1: 0.5645
 epoch: 56, train_loss: 0.6497, test_loss: 1.2488, test_f1: 0.5896
 epoch: 57, train_loss: 0.6460, test_loss: 1.2757, test_f1: 0.5983
 epoch: 58, train_loss: 0.6443, test_loss: 1.2955, test_f1: 0.6044
 epoch: 59, train_loss: 0.6636, test_loss: 1.1032, test_f1: 0.6199
 epoch: 60, train_loss: 0.6453, test_loss: 1.3495, test_f1: 0.5606
 epoch: 61, train_loss: 0.6082, test_loss: 1.2703, test_f1: 0.6380
 epoch: 62, train_loss: 0.5973, test_loss: 1.3115, test_f1: 0.6034
 epoch: 63, train_loss: 0.6107, test_loss: 1.3200, test_f1: 0.5755
 epoch: 64, train_loss: 0.6184, test_loss: 1.2671, test_f1: 0.5880
 epoch: 65, train_loss: 0.6033, test_loss: 1.3071, test_f1: 0.6047
 epoch: 66, train_loss: 0.6167, test_loss: 1.3933, test_f1: 0.5862
 epoch: 67, train_loss: 0.6328, test_loss: 1.2730, test_f1: 0.5996
 epoch: 68, train_loss: 0.5869, test_loss: 1.2174, test_f1: 0.6466
 epoch: 69, train_loss: 0.5562, test_loss: 1.3239, test_f1: 0.5798
 epoch: 70, train_loss: 0.5944, test_loss: 1.4061, test_f1: 0.5879
 epoch: 71, train_loss: 0.5985, test_loss: 1.3387, test_f1: 0.5902
 epoch: 72, train_loss: 0.6029, test_loss: 1.3515, test_f1: 0.6122
 epoch: 73, train_loss: 0.5882, test_loss: 1.4361, test_f1: 0.5806
 epoch: 74, train_loss: 0.6006, test_loss: 1.3744, test_f1: 0.5934
 epoch: 75, train_loss: 0.5523, test_loss: 1.4777, test_f1: 0.5907
 epoch: 76, train_loss: 0.5770, test_loss: 1.4950, test_f1: 0.6090
 epoch: 77, train_loss: 0.5469, test_loss: 1.2826, test_f1: 0.5543
 epoch: 78, train_loss: 0.5759, test_loss: 1.4346, test_f1: 0.5518
 epoch: 79, train_loss: 0.5657, test_loss: 1.3904, test_f1: 0.5834
 epoch: 80, train_loss: 0.5495, test_loss: 1.3173, test_f1: 0.5929
 epoch: 81, train_loss: 0.5849, test_loss: 1.5005, test_f1: 0.5886
 epoch: 82, train_loss: 0.5533, test_loss: 1.4384, test_f1: 0.5258
 epoch: 83, train_loss: 0.5495, test_loss: 1.5547, test_f1: 0.5739
 epoch: 84, train_loss: 0.5672, test_loss: 1.4167, test_f1: 0.6093
 epoch: 85, train_loss: 0.5397, test_loss: 1.5098, test_f1: 0.5857
 epoch: 86, train_loss: 0.5428, test_loss: 1.5166, test_f1: 0.5873
 epoch: 87, train_loss: 0.5482, test_loss: 1.3892, test_f1: 0.5985
 epoch: 88, train_loss: 0.5425, test_loss: 1.4545, test_f1: 0.5966
 epoch: 89, train_loss: 0.5326, test_loss: 1.7406, test_f1: 0.5972
 epoch: 90, train_loss: 0.5402, test_loss: 1.4817, test_f1: 0.5495
 epoch: 91, train_loss: 0.5256, test_loss: 1.5738, test_f1: 0.5662
 epoch: 92, train_loss: 0.5624, test_loss: 1.5955, test_f1: 0.6152
 epoch: 93, train_loss: 0.5483, test_loss: 1.5634, test_f1: 0.5441
 epoch: 94, train_loss: 0.5400, test_loss: 1.7417, test_f1: 0.5592
 epoch: 95, train_loss: 0.5448, test_loss: 1.5117, test_f1: 0.5845
 epoch: 96, train_loss: 0.5532, test_loss: 1.3990, test_f1: 0.5638
 epoch: 97, train_loss: 0.5224, test_loss: 1.6314, test_f1: 0.5312
 epoch: 98, train_loss: 0.4975, test_loss: 1.7293, test_f1: 0.5779
 epoch: 99, train_loss: 0.5320, test_loss: 1.7509, test_f1: 0.5562

Training completed in 487.34 seconds
Best F1: 0.6477 at epoch 75
Mean F1 across iterations: 0.6293  0.0152
========================FINAL RESULTS================================
FEGIN weighted F1: 0.6477  0.0152
python main.py --data ltspice_demos --representation component_net --model FEGIN --layers 5 --hiddens 32 --batch_size 64 --lr 0.01 --emb_size 512 --epochs 100 --save_appendix component_net_L5_H32_BS64_LR0.01_E512 --no_val
-----



STDERR:
  File "main.py", line 370, in <module>
    main()
  File "main.py", line 254, in main
    dataset = dataset_class(
  File "/home/philip/projects/ltspice_examples_code_repo/Circuit-Completion-Using-GNNs/component_classification_with_link_prediction_head/evaluation/FEGIN/kernel/circuit_datasets.py", line 15, in __init__
    self.data, self.slices = torch.load(self.processed_paths[0])
  File "/home/philip/.local/lib/python3.8/site-packages/torch/serialization.py", line 1040, in load
    warnings.warn(
  File "/usr/lib/python3.8/warnings.py", line 109, in _showwarnmsg
    sw(msg.message, msg.category, msg.filename, msg.lineno,
  File "main.py", line 47, in warn_with_traceback
    traceback.print_stack(file=log)
/home/philip/projects/ltspice_examples_code_repo/Circuit-Completion-Using-GNNs/component_classification_with_link_prediction_head/evaluation/FEGIN/kernel/circuit_datasets.py:15: FutureWarning: You are using `torch.load` with `weights_only=False` (the current default value), which uses the default pickle module implicitly. It is possible to construct malicious pickle data which will execute arbitrary code during unpickling (See https://github.com/pytorch/pytorch/blob/main/SECURITY.md#untrusted-models for more details). In a future release, the default value for `weights_only` will be flipped to `True`. This limits the functions that could be executed during unpickling. Arbitrary objects will no longer be allowed to be loaded via this mode unless they are explicitly allowlisted by the user via `torch.serialization.add_safe_globals`. We recommend you start setting `weights_only=True` for any use case where you don't have full control of the loaded file. Please open an issue on GitHub for any issues related to this experimental feature.
  self.data, self.slices = torch.load(self.processed_paths[0])
