STDOUT:
Results will be saved in /home/philip/projects/ltspice_examples_code_repo/Circuit-Completion-Using-GNNs/component_classification_with_link_prediction_head/evaluation/FEGIN/results/model_FEGIN_dataset_ltspice_examples
Command line input: python main.py --data ltspice_examples --representation component_pin_net --model FEGIN --layers 3 --hiddens 16 --batch_size 128 --lr 0.001 --emb_size 128 --epochs 100 --save_appendix component_pin_net_L3_H16_BS128_LR0.001_E128 --no_val
 is saved.
-----
ltspice_examples - FEGIN
Using 3 layers, 16 hidden units, h = 2
Loading component_pin_net representation dataset
ENTERED
Training FEGIN on component_pin_net representation
Train: 3558, Test: 846
##################ITERATION #0 ****************************************
 epoch: 0, train_loss: 1.3434, test_loss: 1.3425, test_f1: 0.2270
 epoch: 1, train_loss: 1.3179, test_loss: 1.3255, test_f1: 0.2270
 epoch: 2, train_loss: 1.2818, test_loss: 1.2476, test_f1: 0.3366
 epoch: 3, train_loss: 1.2125, test_loss: 1.1652, test_f1: 0.3422
 epoch: 4, train_loss: 1.1494, test_loss: 1.1164, test_f1: 0.3422
 epoch: 5, train_loss: 1.1002, test_loss: 1.1225, test_f1: 0.3413
 epoch: 6, train_loss: 1.0776, test_loss: 1.0716, test_f1: 0.3681
 epoch: 7, train_loss: 1.0609, test_loss: 1.0608, test_f1: 0.3442
 epoch: 8, train_loss: 1.0564, test_loss: 1.0411, test_f1: 0.3606
 epoch: 9, train_loss: 1.0462, test_loss: 1.0546, test_f1: 0.3551
 epoch: 10, train_loss: 1.0389, test_loss: 1.0353, test_f1: 0.3602
 epoch: 11, train_loss: 1.0339, test_loss: 1.0265, test_f1: 0.3447
 epoch: 12, train_loss: 1.0336, test_loss: 1.0592, test_f1: 0.3410
 epoch: 13, train_loss: 1.0247, test_loss: 1.0335, test_f1: 0.3421
 epoch: 14, train_loss: 1.0124, test_loss: 0.9878, test_f1: 0.3660
 epoch: 15, train_loss: 1.0054, test_loss: 1.0082, test_f1: 0.3811
 epoch: 16, train_loss: 0.9856, test_loss: 0.9964, test_f1: 0.4556
 epoch: 17, train_loss: 0.9753, test_loss: 1.0019, test_f1: 0.4644
 epoch: 18, train_loss: 0.9652, test_loss: 0.9730, test_f1: 0.4732
 epoch: 19, train_loss: 0.9558, test_loss: 0.9706, test_f1: 0.4740
 epoch: 20, train_loss: 0.9400, test_loss: 0.9371, test_f1: 0.4792
 epoch: 21, train_loss: 0.9445, test_loss: 0.9764, test_f1: 0.4703
 epoch: 22, train_loss: 0.9422, test_loss: 0.9814, test_f1: 0.4722
 epoch: 23, train_loss: 0.9273, test_loss: 0.9447, test_f1: 0.4783
 epoch: 24, train_loss: 0.9349, test_loss: 0.9144, test_f1: 0.4852
 epoch: 25, train_loss: 0.9184, test_loss: 1.0392, test_f1: 0.4406
 epoch: 26, train_loss: 0.9117, test_loss: 0.9100, test_f1: 0.4985
 epoch: 27, train_loss: 0.9192, test_loss: 0.9934, test_f1: 0.4386
 epoch: 28, train_loss: 0.9229, test_loss: 0.9258, test_f1: 0.4892
 epoch: 29, train_loss: 0.9204, test_loss: 0.9646, test_f1: 0.4965
 epoch: 30, train_loss: 0.9127, test_loss: 0.9196, test_f1: 0.4771
 epoch: 31, train_loss: 0.9050, test_loss: 0.8959, test_f1: 0.5205
 epoch: 32, train_loss: 0.8954, test_loss: 1.0609, test_f1: 0.4248
 epoch: 33, train_loss: 0.9006, test_loss: 0.9138, test_f1: 0.4923
 epoch: 34, train_loss: 0.8922, test_loss: 0.9611, test_f1: 0.4865
 epoch: 35, train_loss: 0.8968, test_loss: 0.8681, test_f1: 0.5238
 epoch: 36, train_loss: 0.8886, test_loss: 0.8744, test_f1: 0.5282
 epoch: 37, train_loss: 0.8806, test_loss: 0.9299, test_f1: 0.5132
 epoch: 38, train_loss: 0.8898, test_loss: 0.8921, test_f1: 0.5015
 epoch: 39, train_loss: 0.8812, test_loss: 0.8883, test_f1: 0.5376
 epoch: 40, train_loss: 0.8735, test_loss: 0.8983, test_f1: 0.5098
 epoch: 41, train_loss: 0.8730, test_loss: 0.8653, test_f1: 0.5208
 epoch: 42, train_loss: 0.8664, test_loss: 0.8597, test_f1: 0.5538
 epoch: 43, train_loss: 0.8591, test_loss: 0.9150, test_f1: 0.4921
 epoch: 44, train_loss: 0.8631, test_loss: 0.9228, test_f1: 0.5282
 epoch: 45, train_loss: 0.8632, test_loss: 0.8627, test_f1: 0.5530
 epoch: 46, train_loss: 0.8613, test_loss: 0.8687, test_f1: 0.5128
 epoch: 47, train_loss: 0.8589, test_loss: 0.8557, test_f1: 0.5570
 epoch: 48, train_loss: 0.8464, test_loss: 0.9049, test_f1: 0.5184
 epoch: 49, train_loss: 0.8594, test_loss: 0.9269, test_f1: 0.5278
 epoch: 50, train_loss: 0.8525, test_loss: 0.9674, test_f1: 0.5145
 epoch: 51, train_loss: 0.8417, test_loss: 0.8636, test_f1: 0.5297
 epoch: 52, train_loss: 0.8304, test_loss: 0.8590, test_f1: 0.5577
 epoch: 53, train_loss: 0.8428, test_loss: 0.8715, test_f1: 0.5186
 epoch: 54, train_loss: 0.8347, test_loss: 0.8778, test_f1: 0.5268
 epoch: 55, train_loss: 0.8288, test_loss: 0.8836, test_f1: 0.5381
 epoch: 56, train_loss: 0.8305, test_loss: 0.9029, test_f1: 0.5334
 epoch: 57, train_loss: 0.8301, test_loss: 0.8806, test_f1: 0.5187
 epoch: 58, train_loss: 0.8353, test_loss: 0.8909, test_f1: 0.5433
 epoch: 59, train_loss: 0.8269, test_loss: 0.9124, test_f1: 0.5215
 epoch: 60, train_loss: 0.8233, test_loss: 0.8750, test_f1: 0.5662
 epoch: 61, train_loss: 0.8252, test_loss: 0.8788, test_f1: 0.5513
 epoch: 62, train_loss: 0.8203, test_loss: 0.8743, test_f1: 0.5361
 epoch: 63, train_loss: 0.8295, test_loss: 0.8565, test_f1: 0.5585
 epoch: 64, train_loss: 0.8298, test_loss: 0.8656, test_f1: 0.5509
 epoch: 65, train_loss: 0.8240, test_loss: 0.8590, test_f1: 0.5557
 epoch: 66, train_loss: 0.8138, test_loss: 0.8950, test_f1: 0.5536
 epoch: 67, train_loss: 0.8154, test_loss: 0.9039, test_f1: 0.5322
 epoch: 68, train_loss: 0.8149, test_loss: 0.8632, test_f1: 0.5379
 epoch: 69, train_loss: 0.8127, test_loss: 0.9143, test_f1: 0.5374
 epoch: 70, train_loss: 0.8229, test_loss: 0.9294, test_f1: 0.5280
 epoch: 71, train_loss: 0.8211, test_loss: 0.9234, test_f1: 0.5397
 epoch: 72, train_loss: 0.8111, test_loss: 0.8888, test_f1: 0.5403
 epoch: 73, train_loss: 0.8105, test_loss: 0.8818, test_f1: 0.5410
 epoch: 74, train_loss: 0.8197, test_loss: 0.9044, test_f1: 0.5502
 epoch: 75, train_loss: 0.8037, test_loss: 0.8693, test_f1: 0.5430
 epoch: 76, train_loss: 0.8121, test_loss: 0.8949, test_f1: 0.5545
 epoch: 77, train_loss: 0.8120, test_loss: 0.8648, test_f1: 0.5319
 epoch: 78, train_loss: 0.8063, test_loss: 0.9147, test_f1: 0.5569
 epoch: 79, train_loss: 0.8109, test_loss: 0.8853, test_f1: 0.5390
 epoch: 80, train_loss: 0.8066, test_loss: 0.8806, test_f1: 0.5567
 epoch: 81, train_loss: 0.7992, test_loss: 0.8909, test_f1: 0.5450
 epoch: 82, train_loss: 0.8075, test_loss: 0.8997, test_f1: 0.5510
 epoch: 83, train_loss: 0.8025, test_loss: 0.8829, test_f1: 0.5633
 epoch: 84, train_loss: 0.8036, test_loss: 0.8917, test_f1: 0.5364
 epoch: 85, train_loss: 0.7989, test_loss: 0.9157, test_f1: 0.5609
 epoch: 86, train_loss: 0.8075, test_loss: 0.8924, test_f1: 0.5333
 epoch: 87, train_loss: 0.8020, test_loss: 0.8867, test_f1: 0.5568
 epoch: 88, train_loss: 0.8056, test_loss: 0.8932, test_f1: 0.5517
 epoch: 89, train_loss: 0.7955, test_loss: 0.9271, test_f1: 0.5396
 epoch: 90, train_loss: 0.7958, test_loss: 0.9149, test_f1: 0.5485
 epoch: 91, train_loss: 0.7881, test_loss: 0.8924, test_f1: 0.5438
 epoch: 92, train_loss: 0.7887, test_loss: 0.8766, test_f1: 0.5551
 epoch: 93, train_loss: 0.8005, test_loss: 0.8896, test_f1: 0.5582
 epoch: 94, train_loss: 0.7922, test_loss: 0.9002, test_f1: 0.5202
 epoch: 95, train_loss: 0.8010, test_loss: 0.8970, test_f1: 0.5664
 epoch: 96, train_loss: 0.7929, test_loss: 0.9248, test_f1: 0.5409
 epoch: 97, train_loss: 0.7969, test_loss: 0.9004, test_f1: 0.5451
 epoch: 98, train_loss: 0.7922, test_loss: 0.8876, test_f1: 0.5449
 epoch: 99, train_loss: 0.7924, test_loss: 0.8861, test_f1: 0.5533
##################ITERATION #1 ****************************************
 epoch: 0, train_loss: 1.2918, test_loss: 1.3104, test_f1: 0.2270
 epoch: 1, train_loss: 1.2142, test_loss: 1.2297, test_f1: 0.2270
 epoch: 2, train_loss: 1.1644, test_loss: 1.1317, test_f1: 0.3529
 epoch: 3, train_loss: 1.1205, test_loss: 1.0787, test_f1: 0.4055
 epoch: 4, train_loss: 1.0869, test_loss: 1.0546, test_f1: 0.4182
 epoch: 5, train_loss: 1.0587, test_loss: 1.0437, test_f1: 0.4245
 epoch: 6, train_loss: 1.0403, test_loss: 1.0136, test_f1: 0.4618
 epoch: 7, train_loss: 1.0308, test_loss: 0.9938, test_f1: 0.4565
 epoch: 8, train_loss: 1.0174, test_loss: 0.9927, test_f1: 0.4839
 epoch: 9, train_loss: 1.0120, test_loss: 0.9770, test_f1: 0.4839
 epoch: 10, train_loss: 0.9913, test_loss: 0.9579, test_f1: 0.4749
 epoch: 11, train_loss: 0.9816, test_loss: 0.9534, test_f1: 0.4865
 epoch: 12, train_loss: 0.9801, test_loss: 0.9468, test_f1: 0.5032
 epoch: 13, train_loss: 0.9747, test_loss: 0.9415, test_f1: 0.4953
 epoch: 14, train_loss: 0.9571, test_loss: 0.9560, test_f1: 0.5060
 epoch: 15, train_loss: 0.9525, test_loss: 0.9396, test_f1: 0.5232
 epoch: 16, train_loss: 0.9508, test_loss: 0.9383, test_f1: 0.4972
 epoch: 17, train_loss: 0.9362, test_loss: 0.9562, test_f1: 0.4957
 epoch: 18, train_loss: 0.9354, test_loss: 0.9225, test_f1: 0.5115
 epoch: 19, train_loss: 0.9303, test_loss: 0.9259, test_f1: 0.5019
 epoch: 20, train_loss: 0.9261, test_loss: 0.9170, test_f1: 0.5125
 epoch: 21, train_loss: 0.9266, test_loss: 0.9078, test_f1: 0.5188
 epoch: 22, train_loss: 0.9205, test_loss: 0.9025, test_f1: 0.5254
 epoch: 23, train_loss: 0.9167, test_loss: 0.9111, test_f1: 0.5406
 epoch: 24, train_loss: 0.9136, test_loss: 0.9568, test_f1: 0.5308
 epoch: 25, train_loss: 0.9010, test_loss: 0.9073, test_f1: 0.5380
 epoch: 26, train_loss: 0.9095, test_loss: 0.9361, test_f1: 0.5116
 epoch: 27, train_loss: 0.8984, test_loss: 0.9885, test_f1: 0.5229
 epoch: 28, train_loss: 0.8908, test_loss: 0.8797, test_f1: 0.5510
 epoch: 29, train_loss: 0.8858, test_loss: 0.9068, test_f1: 0.5150
 epoch: 30, train_loss: 0.9103, test_loss: 0.8705, test_f1: 0.5411
 epoch: 31, train_loss: 0.8898, test_loss: 0.8749, test_f1: 0.5399
 epoch: 32, train_loss: 0.8907, test_loss: 0.8891, test_f1: 0.5433
 epoch: 33, train_loss: 0.8833, test_loss: 0.9159, test_f1: 0.5189
 epoch: 34, train_loss: 0.8775, test_loss: 0.8827, test_f1: 0.5497
 epoch: 35, train_loss: 0.8738, test_loss: 0.8949, test_f1: 0.5372
 epoch: 36, train_loss: 0.8686, test_loss: 0.9272, test_f1: 0.5445
 epoch: 37, train_loss: 0.8652, test_loss: 0.9959, test_f1: 0.5174
 epoch: 38, train_loss: 0.8708, test_loss: 0.9758, test_f1: 0.5409
 epoch: 39, train_loss: 0.8566, test_loss: 0.8968, test_f1: 0.5511
 epoch: 40, train_loss: 0.8560, test_loss: 0.9894, test_f1: 0.5216
 epoch: 41, train_loss: 0.8704, test_loss: 0.8862, test_f1: 0.5510
 epoch: 42, train_loss: 0.8516, test_loss: 0.9577, test_f1: 0.5382
 epoch: 43, train_loss: 0.8529, test_loss: 0.9535, test_f1: 0.5329
 epoch: 44, train_loss: 0.8485, test_loss: 0.9911, test_f1: 0.5060
 epoch: 45, train_loss: 0.8548, test_loss: 0.9206, test_f1: 0.5404
 epoch: 46, train_loss: 0.8485, test_loss: 0.9103, test_f1: 0.5207
 epoch: 47, train_loss: 0.8483, test_loss: 0.9931, test_f1: 0.5348
 epoch: 48, train_loss: 0.8282, test_loss: 0.9342, test_f1: 0.5406
 epoch: 49, train_loss: 0.8398, test_loss: 0.9605, test_f1: 0.5355
 epoch: 50, train_loss: 0.8295, test_loss: 0.9320, test_f1: 0.5458
 epoch: 51, train_loss: 0.8285, test_loss: 0.9242, test_f1: 0.5630
 epoch: 52, train_loss: 0.8279, test_loss: 0.9663, test_f1: 0.5484
 epoch: 53, train_loss: 0.8162, test_loss: 0.9475, test_f1: 0.5464
 epoch: 54, train_loss: 0.8184, test_loss: 0.9237, test_f1: 0.5444
 epoch: 55, train_loss: 0.8175, test_loss: 0.9688, test_f1: 0.5518
 epoch: 56, train_loss: 0.8244, test_loss: 0.9460, test_f1: 0.5540
 epoch: 57, train_loss: 0.8157, test_loss: 0.9401, test_f1: 0.5559
 epoch: 58, train_loss: 0.8168, test_loss: 0.9645, test_f1: 0.5535
 epoch: 59, train_loss: 0.8019, test_loss: 0.9938, test_f1: 0.5455
 epoch: 60, train_loss: 0.8161, test_loss: 0.9646, test_f1: 0.5495
 epoch: 61, train_loss: 0.8107, test_loss: 0.9548, test_f1: 0.5559
 epoch: 62, train_loss: 0.8055, test_loss: 0.9535, test_f1: 0.5629
 epoch: 63, train_loss: 0.8055, test_loss: 0.9694, test_f1: 0.5520
 epoch: 64, train_loss: 0.8100, test_loss: 0.9665, test_f1: 0.5533
 epoch: 65, train_loss: 0.8096, test_loss: 0.9673, test_f1: 0.5459
 epoch: 66, train_loss: 0.7938, test_loss: 0.9354, test_f1: 0.5632
 epoch: 67, train_loss: 0.7968, test_loss: 0.9470, test_f1: 0.5551
 epoch: 68, train_loss: 0.7977, test_loss: 0.9373, test_f1: 0.5494
 epoch: 69, train_loss: 0.7970, test_loss: 0.9606, test_f1: 0.5548
 epoch: 70, train_loss: 0.8004, test_loss: 0.9704, test_f1: 0.5492
 epoch: 71, train_loss: 0.7929, test_loss: 0.9554, test_f1: 0.5565
 epoch: 72, train_loss: 0.7897, test_loss: 0.9746, test_f1: 0.5394
 epoch: 73, train_loss: 0.8026, test_loss: 0.9259, test_f1: 0.5439
 epoch: 74, train_loss: 0.7975, test_loss: 0.9659, test_f1: 0.5460
 epoch: 75, train_loss: 0.7972, test_loss: 0.9543, test_f1: 0.5459
 epoch: 76, train_loss: 0.7967, test_loss: 0.9621, test_f1: 0.5502
 epoch: 77, train_loss: 0.7834, test_loss: 0.9604, test_f1: 0.5440
 epoch: 78, train_loss: 0.7901, test_loss: 0.9735, test_f1: 0.5565
 epoch: 79, train_loss: 0.7869, test_loss: 0.9574, test_f1: 0.5515
 epoch: 80, train_loss: 0.7878, test_loss: 0.9626, test_f1: 0.5428
 epoch: 81, train_loss: 0.7842, test_loss: 0.9918, test_f1: 0.5509
 epoch: 82, train_loss: 0.7861, test_loss: 0.9568, test_f1: 0.5507
 epoch: 83, train_loss: 0.7782, test_loss: 0.9825, test_f1: 0.5523
 epoch: 84, train_loss: 0.7763, test_loss: 1.0019, test_f1: 0.5351
 epoch: 85, train_loss: 0.7810, test_loss: 0.9712, test_f1: 0.5444
 epoch: 86, train_loss: 0.7804, test_loss: 0.9731, test_f1: 0.5575
 epoch: 87, train_loss: 0.7837, test_loss: 0.9519, test_f1: 0.5481
 epoch: 88, train_loss: 0.7687, test_loss: 0.9938, test_f1: 0.5376
 epoch: 89, train_loss: 0.7765, test_loss: 0.9788, test_f1: 0.5497
 epoch: 90, train_loss: 0.7638, test_loss: 0.9753, test_f1: 0.5549
 epoch: 91, train_loss: 0.7891, test_loss: 0.9858, test_f1: 0.5519
 epoch: 92, train_loss: 0.7721, test_loss: 0.9594, test_f1: 0.5393
 epoch: 93, train_loss: 0.7721, test_loss: 0.9466, test_f1: 0.5563
 epoch: 94, train_loss: 0.7769, test_loss: 0.9645, test_f1: 0.5569
 epoch: 95, train_loss: 0.7736, test_loss: 0.9612, test_f1: 0.5470
 epoch: 96, train_loss: 0.7684, test_loss: 0.9680, test_f1: 0.5511
 epoch: 97, train_loss: 0.7738, test_loss: 0.9457, test_f1: 0.5544
 epoch: 98, train_loss: 0.7672, test_loss: 0.9955, test_f1: 0.5457
 epoch: 99, train_loss: 0.7744, test_loss: 0.9714, test_f1: 0.5331
##################ITERATION #2 ****************************************
 epoch: 0, train_loss: 1.2810, test_loss: 1.2883, test_f1: 0.2270
 epoch: 1, train_loss: 1.1411, test_loss: 1.1330, test_f1: 0.3351
 epoch: 2, train_loss: 1.1020, test_loss: 1.0700, test_f1: 0.3577
 epoch: 3, train_loss: 1.0766, test_loss: 1.0537, test_f1: 0.3647
 epoch: 4, train_loss: 1.0613, test_loss: 1.0482, test_f1: 0.3636
 epoch: 5, train_loss: 1.0489, test_loss: 1.0386, test_f1: 0.3963
 epoch: 6, train_loss: 1.0367, test_loss: 1.0391, test_f1: 0.3913
 epoch: 7, train_loss: 1.0286, test_loss: 1.0280, test_f1: 0.4136
 epoch: 8, train_loss: 1.0236, test_loss: 1.0406, test_f1: 0.3824
 epoch: 9, train_loss: 1.0080, test_loss: 1.0122, test_f1: 0.4271
 epoch: 10, train_loss: 0.9924, test_loss: 1.0020, test_f1: 0.4602
 epoch: 11, train_loss: 0.9866, test_loss: 1.0101, test_f1: 0.4398
 epoch: 12, train_loss: 0.9679, test_loss: 0.9761, test_f1: 0.4759
 epoch: 13, train_loss: 0.9622, test_loss: 0.9761, test_f1: 0.4802
 epoch: 14, train_loss: 0.9524, test_loss: 0.9912, test_f1: 0.4885
 epoch: 15, train_loss: 0.9541, test_loss: 0.9566, test_f1: 0.4832
 epoch: 16, train_loss: 0.9495, test_loss: 0.9631, test_f1: 0.4970
 epoch: 17, train_loss: 0.9491, test_loss: 1.0055, test_f1: 0.4567
 epoch: 18, train_loss: 0.9416, test_loss: 0.9533, test_f1: 0.4919
 epoch: 19, train_loss: 0.9375, test_loss: 0.9607, test_f1: 0.4629
 epoch: 20, train_loss: 0.9305, test_loss: 0.9454, test_f1: 0.5033
 epoch: 21, train_loss: 0.9289, test_loss: 0.9355, test_f1: 0.4972
 epoch: 22, train_loss: 0.9229, test_loss: 0.9353, test_f1: 0.4986
 epoch: 23, train_loss: 0.9207, test_loss: 0.9302, test_f1: 0.5022
 epoch: 24, train_loss: 0.9039, test_loss: 0.9545, test_f1: 0.4948
 epoch: 25, train_loss: 0.9129, test_loss: 0.9491, test_f1: 0.4977
 epoch: 26, train_loss: 0.9081, test_loss: 0.9652, test_f1: 0.4964
 epoch: 27, train_loss: 0.8992, test_loss: 0.9293, test_f1: 0.4985
 epoch: 28, train_loss: 0.9094, test_loss: 1.1019, test_f1: 0.3954
 epoch: 29, train_loss: 0.9012, test_loss: 0.9489, test_f1: 0.4971
 epoch: 30, train_loss: 0.8872, test_loss: 0.9885, test_f1: 0.4654
 epoch: 31, train_loss: 0.8838, test_loss: 0.9643, test_f1: 0.4768
 epoch: 32, train_loss: 0.8831, test_loss: 0.9329, test_f1: 0.5029
 epoch: 33, train_loss: 0.8863, test_loss: 0.9885, test_f1: 0.4707
 epoch: 34, train_loss: 0.8767, test_loss: 0.8999, test_f1: 0.5065
 epoch: 35, train_loss: 0.8796, test_loss: 0.9630, test_f1: 0.5066
 epoch: 36, train_loss: 0.8793, test_loss: 0.9474, test_f1: 0.5065
 epoch: 37, train_loss: 0.8763, test_loss: 0.9403, test_f1: 0.5157
 epoch: 38, train_loss: 0.8689, test_loss: 0.9196, test_f1: 0.5104
 epoch: 39, train_loss: 0.8617, test_loss: 0.9341, test_f1: 0.4922
 epoch: 40, train_loss: 0.8625, test_loss: 0.9126, test_f1: 0.5138
 epoch: 41, train_loss: 0.8589, test_loss: 0.9169, test_f1: 0.5127
 epoch: 42, train_loss: 0.8497, test_loss: 0.9969, test_f1: 0.4777
 epoch: 43, train_loss: 0.8551, test_loss: 0.9202, test_f1: 0.5272
 epoch: 44, train_loss: 0.8577, test_loss: 0.9533, test_f1: 0.5129
 epoch: 45, train_loss: 0.8529, test_loss: 1.0262, test_f1: 0.4658
 epoch: 46, train_loss: 0.8496, test_loss: 0.9540, test_f1: 0.5158
 epoch: 47, train_loss: 0.8571, test_loss: 0.8966, test_f1: 0.4936
 epoch: 48, train_loss: 0.8437, test_loss: 0.9104, test_f1: 0.5206
 epoch: 49, train_loss: 0.8394, test_loss: 0.9316, test_f1: 0.5210
 epoch: 50, train_loss: 0.8447, test_loss: 0.9045, test_f1: 0.5237
 epoch: 51, train_loss: 0.8381, test_loss: 0.9204, test_f1: 0.5239
 epoch: 52, train_loss: 0.8215, test_loss: 0.8934, test_f1: 0.5298
 epoch: 53, train_loss: 0.8264, test_loss: 0.9138, test_f1: 0.5174
 epoch: 54, train_loss: 0.8299, test_loss: 0.9010, test_f1: 0.5198
 epoch: 55, train_loss: 0.8219, test_loss: 0.8986, test_f1: 0.5176
 epoch: 56, train_loss: 0.8198, test_loss: 0.9622, test_f1: 0.5159
 epoch: 57, train_loss: 0.8112, test_loss: 0.9148, test_f1: 0.5272
 epoch: 58, train_loss: 0.8191, test_loss: 0.9096, test_f1: 0.5254
 epoch: 59, train_loss: 0.8182, test_loss: 0.8979, test_f1: 0.5236
 epoch: 60, train_loss: 0.8231, test_loss: 0.8789, test_f1: 0.5318
 epoch: 61, train_loss: 0.8095, test_loss: 0.9060, test_f1: 0.5206
 epoch: 62, train_loss: 0.8209, test_loss: 0.9169, test_f1: 0.5158
 epoch: 63, train_loss: 0.8111, test_loss: 0.9074, test_f1: 0.5248
 epoch: 64, train_loss: 0.8062, test_loss: 0.9239, test_f1: 0.5316
 epoch: 65, train_loss: 0.8212, test_loss: 0.8958, test_f1: 0.5185
 epoch: 66, train_loss: 0.8014, test_loss: 0.9185, test_f1: 0.5299
 epoch: 67, train_loss: 0.8103, test_loss: 0.9225, test_f1: 0.5305
 epoch: 68, train_loss: 0.8090, test_loss: 0.9011, test_f1: 0.5353
 epoch: 69, train_loss: 0.8046, test_loss: 0.9053, test_f1: 0.5333
 epoch: 70, train_loss: 0.8040, test_loss: 0.9162, test_f1: 0.5258
 epoch: 71, train_loss: 0.8051, test_loss: 0.9274, test_f1: 0.5117
 epoch: 72, train_loss: 0.8042, test_loss: 0.9204, test_f1: 0.5327
 epoch: 73, train_loss: 0.8061, test_loss: 0.9041, test_f1: 0.5259
 epoch: 74, train_loss: 0.7949, test_loss: 0.8856, test_f1: 0.5463
 epoch: 75, train_loss: 0.8023, test_loss: 0.9287, test_f1: 0.5387
 epoch: 76, train_loss: 0.8002, test_loss: 0.9236, test_f1: 0.5200
 epoch: 77, train_loss: 0.8050, test_loss: 0.8955, test_f1: 0.5416
 epoch: 78, train_loss: 0.8097, test_loss: 0.9021, test_f1: 0.5350
 epoch: 79, train_loss: 0.7979, test_loss: 0.9100, test_f1: 0.5343
 epoch: 80, train_loss: 0.8023, test_loss: 0.9320, test_f1: 0.5401
 epoch: 81, train_loss: 0.7948, test_loss: 0.9051, test_f1: 0.5524
 epoch: 82, train_loss: 0.8046, test_loss: 0.9559, test_f1: 0.5204
 epoch: 83, train_loss: 0.8054, test_loss: 0.9160, test_f1: 0.5306
 epoch: 84, train_loss: 0.7862, test_loss: 0.8896, test_f1: 0.5412
 epoch: 85, train_loss: 0.7890, test_loss: 0.9077, test_f1: 0.5445
 epoch: 86, train_loss: 0.7817, test_loss: 0.9028, test_f1: 0.5413
 epoch: 87, train_loss: 0.7888, test_loss: 0.9347, test_f1: 0.5416
 epoch: 88, train_loss: 0.7771, test_loss: 0.9504, test_f1: 0.5353
 epoch: 89, train_loss: 0.7811, test_loss: 0.9282, test_f1: 0.5381
 epoch: 90, train_loss: 0.7903, test_loss: 0.9239, test_f1: 0.5327
 epoch: 91, train_loss: 0.7920, test_loss: 0.9195, test_f1: 0.5431
 epoch: 92, train_loss: 0.7908, test_loss: 0.9274, test_f1: 0.5259
 epoch: 93, train_loss: 0.7980, test_loss: 0.8964, test_f1: 0.5343
 epoch: 94, train_loss: 0.7797, test_loss: 0.9248, test_f1: 0.5261
 epoch: 95, train_loss: 0.7857, test_loss: 0.9110, test_f1: 0.5312
 epoch: 96, train_loss: 0.7996, test_loss: 0.8941, test_f1: 0.5350
 epoch: 97, train_loss: 0.7901, test_loss: 0.9366, test_f1: 0.5282
 epoch: 98, train_loss: 0.7816, test_loss: 0.8889, test_f1: 0.5434
 epoch: 99, train_loss: 0.7902, test_loss: 0.9104, test_f1: 0.5264
##################ITERATION #3 ****************************************
 epoch: 0, train_loss: 1.2115, test_loss: 1.2806, test_f1: 0.2270
 epoch: 1, train_loss: 1.1084, test_loss: 1.1159, test_f1: 0.3432
 epoch: 2, train_loss: 1.0693, test_loss: 1.0417, test_f1: 0.3521
 epoch: 3, train_loss: 1.0451, test_loss: 1.0246, test_f1: 0.3658
 epoch: 4, train_loss: 1.0300, test_loss: 1.0299, test_f1: 0.3722
 epoch: 5, train_loss: 1.0218, test_loss: 1.0076, test_f1: 0.4567
 epoch: 6, train_loss: 1.0073, test_loss: 0.9993, test_f1: 0.4283
 epoch: 7, train_loss: 0.9968, test_loss: 0.9834, test_f1: 0.4237
 epoch: 8, train_loss: 0.9952, test_loss: 0.9785, test_f1: 0.4111
 epoch: 9, train_loss: 0.9828, test_loss: 0.9790, test_f1: 0.4405
 epoch: 10, train_loss: 0.9735, test_loss: 0.9759, test_f1: 0.4907
 epoch: 11, train_loss: 0.9625, test_loss: 0.9774, test_f1: 0.4929
 epoch: 12, train_loss: 0.9558, test_loss: 0.9761, test_f1: 0.5034
 epoch: 13, train_loss: 0.9499, test_loss: 0.9771, test_f1: 0.4579
 epoch: 14, train_loss: 0.9431, test_loss: 0.9497, test_f1: 0.4895
 epoch: 15, train_loss: 0.9350, test_loss: 0.9251, test_f1: 0.4965
 epoch: 16, train_loss: 0.9447, test_loss: 0.9520, test_f1: 0.4881
 epoch: 17, train_loss: 0.9249, test_loss: 0.9606, test_f1: 0.4652
 epoch: 18, train_loss: 0.9413, test_loss: 0.9562, test_f1: 0.4749
 epoch: 19, train_loss: 0.9283, test_loss: 0.9820, test_f1: 0.4896
 epoch: 20, train_loss: 0.9240, test_loss: 0.9455, test_f1: 0.4918
 epoch: 21, train_loss: 0.9198, test_loss: 0.9535, test_f1: 0.4527
 epoch: 22, train_loss: 0.9093, test_loss: 0.9793, test_f1: 0.4983
 epoch: 23, train_loss: 0.9043, test_loss: 0.9217, test_f1: 0.5066
 epoch: 24, train_loss: 0.9152, test_loss: 0.9801, test_f1: 0.4762
 epoch: 25, train_loss: 0.8959, test_loss: 0.9837, test_f1: 0.4985
 epoch: 26, train_loss: 0.8977, test_loss: 0.9608, test_f1: 0.4978
 epoch: 27, train_loss: 0.9061, test_loss: 0.9390, test_f1: 0.4981
 epoch: 28, train_loss: 0.8922, test_loss: 0.9577, test_f1: 0.4984
 epoch: 29, train_loss: 0.8883, test_loss: 0.9462, test_f1: 0.5145
 epoch: 30, train_loss: 0.8848, test_loss: 0.9874, test_f1: 0.4907
 epoch: 31, train_loss: 0.8846, test_loss: 0.9525, test_f1: 0.4734
 epoch: 32, train_loss: 0.8809, test_loss: 0.9630, test_f1: 0.4671
 epoch: 33, train_loss: 0.8772, test_loss: 0.8831, test_f1: 0.5020
 epoch: 34, train_loss: 0.8757, test_loss: 1.0190, test_f1: 0.4756
 epoch: 35, train_loss: 0.8751, test_loss: 0.9805, test_f1: 0.5149
 epoch: 36, train_loss: 0.8700, test_loss: 0.9443, test_f1: 0.4959
 epoch: 37, train_loss: 0.8721, test_loss: 0.9196, test_f1: 0.5299
 epoch: 38, train_loss: 0.8692, test_loss: 0.9607, test_f1: 0.5090
 epoch: 39, train_loss: 0.8634, test_loss: 0.9665, test_f1: 0.4938
 epoch: 40, train_loss: 0.8597, test_loss: 0.9510, test_f1: 0.5134
 epoch: 41, train_loss: 0.8627, test_loss: 0.9209, test_f1: 0.5145
 epoch: 42, train_loss: 0.8573, test_loss: 0.9107, test_f1: 0.5148
 epoch: 43, train_loss: 0.8570, test_loss: 1.0025, test_f1: 0.4849
 epoch: 44, train_loss: 0.8531, test_loss: 0.9326, test_f1: 0.5127
 epoch: 45, train_loss: 0.8552, test_loss: 0.9461, test_f1: 0.5030
 epoch: 46, train_loss: 0.8490, test_loss: 1.0336, test_f1: 0.4974
 epoch: 47, train_loss: 0.8506, test_loss: 0.9589, test_f1: 0.5120
 epoch: 48, train_loss: 0.8443, test_loss: 0.9528, test_f1: 0.5183
 epoch: 49, train_loss: 0.8420, test_loss: 0.9874, test_f1: 0.4907
 epoch: 50, train_loss: 0.8344, test_loss: 0.9634, test_f1: 0.4934
 epoch: 51, train_loss: 0.8249, test_loss: 0.9432, test_f1: 0.5176
 epoch: 52, train_loss: 0.8343, test_loss: 0.9395, test_f1: 0.5049
 epoch: 53, train_loss: 0.8324, test_loss: 0.9375, test_f1: 0.5156
 epoch: 54, train_loss: 0.8216, test_loss: 0.9640, test_f1: 0.5106
 epoch: 55, train_loss: 0.8141, test_loss: 0.9462, test_f1: 0.5199
 epoch: 56, train_loss: 0.8151, test_loss: 0.9404, test_f1: 0.5164
 epoch: 57, train_loss: 0.8098, test_loss: 0.9509, test_f1: 0.5120
 epoch: 58, train_loss: 0.8104, test_loss: 0.9552, test_f1: 0.5277
 epoch: 59, train_loss: 0.8224, test_loss: 0.9483, test_f1: 0.5181
 epoch: 60, train_loss: 0.8117, test_loss: 0.9339, test_f1: 0.5016
 epoch: 61, train_loss: 0.8045, test_loss: 0.9528, test_f1: 0.5206
 epoch: 62, train_loss: 0.8029, test_loss: 0.9253, test_f1: 0.5314
 epoch: 63, train_loss: 0.8062, test_loss: 0.9480, test_f1: 0.5359
 epoch: 64, train_loss: 0.7999, test_loss: 0.9438, test_f1: 0.5230
 epoch: 65, train_loss: 0.7971, test_loss: 0.9715, test_f1: 0.5358
 epoch: 66, train_loss: 0.8102, test_loss: 0.9966, test_f1: 0.5263
 epoch: 67, train_loss: 0.8066, test_loss: 0.9713, test_f1: 0.5213
 epoch: 68, train_loss: 0.7959, test_loss: 0.9711, test_f1: 0.5342
 epoch: 69, train_loss: 0.7981, test_loss: 0.9638, test_f1: 0.5397
 epoch: 70, train_loss: 0.8002, test_loss: 0.9608, test_f1: 0.5274
 epoch: 71, train_loss: 0.7858, test_loss: 0.9479, test_f1: 0.5279
 epoch: 72, train_loss: 0.7954, test_loss: 0.9454, test_f1: 0.5179
 epoch: 73, train_loss: 0.7994, test_loss: 1.0033, test_f1: 0.5193
 epoch: 74, train_loss: 0.7954, test_loss: 0.9534, test_f1: 0.5318
 epoch: 75, train_loss: 0.7906, test_loss: 0.9682, test_f1: 0.5300
 epoch: 76, train_loss: 0.7931, test_loss: 0.9585, test_f1: 0.5186
 epoch: 77, train_loss: 0.7855, test_loss: 0.9707, test_f1: 0.5341
 epoch: 78, train_loss: 0.7974, test_loss: 0.9635, test_f1: 0.5301
 epoch: 79, train_loss: 0.7886, test_loss: 0.9608, test_f1: 0.5265
 epoch: 80, train_loss: 0.7945, test_loss: 0.9541, test_f1: 0.5250
 epoch: 81, train_loss: 0.7890, test_loss: 0.9726, test_f1: 0.5361
 epoch: 82, train_loss: 0.7864, test_loss: 0.9378, test_f1: 0.5267
 epoch: 83, train_loss: 0.7782, test_loss: 0.9687, test_f1: 0.5267
 epoch: 84, train_loss: 0.7893, test_loss: 0.9767, test_f1: 0.5304
 epoch: 85, train_loss: 0.7820, test_loss: 0.9768, test_f1: 0.5338
 epoch: 86, train_loss: 0.7808, test_loss: 0.9501, test_f1: 0.5296
 epoch: 87, train_loss: 0.7759, test_loss: 0.9662, test_f1: 0.5414
 epoch: 88, train_loss: 0.7794, test_loss: 0.9687, test_f1: 0.5303
 epoch: 89, train_loss: 0.7777, test_loss: 0.9849, test_f1: 0.5361
 epoch: 90, train_loss: 0.7810, test_loss: 0.9786, test_f1: 0.5260
 epoch: 91, train_loss: 0.7807, test_loss: 0.9665, test_f1: 0.5284
 epoch: 92, train_loss: 0.7733, test_loss: 0.9856, test_f1: 0.5290
 epoch: 93, train_loss: 0.7715, test_loss: 0.9971, test_f1: 0.5373
 epoch: 94, train_loss: 0.7759, test_loss: 0.9646, test_f1: 0.5290
 epoch: 95, train_loss: 0.7754, test_loss: 0.9415, test_f1: 0.5347
 epoch: 96, train_loss: 0.7790, test_loss: 0.9682, test_f1: 0.5268
 epoch: 97, train_loss: 0.7709, test_loss: 0.9313, test_f1: 0.5250
 epoch: 98, train_loss: 0.7791, test_loss: 0.9815, test_f1: 0.5566
 epoch: 99, train_loss: 0.7769, test_loss: 0.9611, test_f1: 0.5417
##################ITERATION #4 ****************************************
 epoch: 0, train_loss: 1.2303, test_loss: 1.4089, test_f1: 0.2841
 epoch: 1, train_loss: 1.1022, test_loss: 1.0720, test_f1: 0.4411
 epoch: 2, train_loss: 1.0678, test_loss: 1.0189, test_f1: 0.4537
 epoch: 3, train_loss: 1.0299, test_loss: 0.9861, test_f1: 0.4483
 epoch: 4, train_loss: 1.0169, test_loss: 0.9668, test_f1: 0.4785
 epoch: 5, train_loss: 0.9972, test_loss: 0.9816, test_f1: 0.4557
 epoch: 6, train_loss: 0.9895, test_loss: 0.9669, test_f1: 0.4893
 epoch: 7, train_loss: 0.9654, test_loss: 0.9886, test_f1: 0.4966
 epoch: 8, train_loss: 0.9641, test_loss: 0.9674, test_f1: 0.5065
 epoch: 9, train_loss: 0.9528, test_loss: 0.9605, test_f1: 0.4830
 epoch: 10, train_loss: 0.9374, test_loss: 0.9505, test_f1: 0.4621
 epoch: 11, train_loss: 0.9420, test_loss: 0.8899, test_f1: 0.5064
 epoch: 12, train_loss: 0.9216, test_loss: 0.9489, test_f1: 0.4991
 epoch: 13, train_loss: 0.9258, test_loss: 0.9203, test_f1: 0.5052
 epoch: 14, train_loss: 0.9158, test_loss: 0.8899, test_f1: 0.5021
 epoch: 15, train_loss: 0.9050, test_loss: 0.9218, test_f1: 0.5172
 epoch: 16, train_loss: 0.9061, test_loss: 0.8692, test_f1: 0.5154
 epoch: 17, train_loss: 0.8876, test_loss: 0.8985, test_f1: 0.5305
 epoch: 18, train_loss: 0.8941, test_loss: 0.9227, test_f1: 0.5111
 epoch: 19, train_loss: 0.8952, test_loss: 0.8928, test_f1: 0.5253
 epoch: 20, train_loss: 0.8850, test_loss: 0.8318, test_f1: 0.5319
 epoch: 21, train_loss: 0.8701, test_loss: 0.8680, test_f1: 0.5061
 epoch: 22, train_loss: 0.8562, test_loss: 0.9131, test_f1: 0.5434
 epoch: 23, train_loss: 0.8636, test_loss: 0.8670, test_f1: 0.5109
 epoch: 24, train_loss: 0.8701, test_loss: 0.9497, test_f1: 0.5286
 epoch: 25, train_loss: 0.8514, test_loss: 0.8878, test_f1: 0.5266
 epoch: 26, train_loss: 0.8518, test_loss: 0.8830, test_f1: 0.5277
 epoch: 27, train_loss: 0.8470, test_loss: 0.8575, test_f1: 0.5306
 epoch: 28, train_loss: 0.8445, test_loss: 0.8392, test_f1: 0.5276
 epoch: 29, train_loss: 0.8447, test_loss: 0.8918, test_f1: 0.5143
 epoch: 30, train_loss: 0.8435, test_loss: 0.9099, test_f1: 0.5429
 epoch: 31, train_loss: 0.8346, test_loss: 0.8324, test_f1: 0.5418
 epoch: 32, train_loss: 0.8272, test_loss: 0.8641, test_f1: 0.5260
 epoch: 33, train_loss: 0.8298, test_loss: 0.8505, test_f1: 0.5384
 epoch: 34, train_loss: 0.8228, test_loss: 0.8728, test_f1: 0.5485
 epoch: 35, train_loss: 0.8184, test_loss: 0.8440, test_f1: 0.5686
 epoch: 36, train_loss: 0.8116, test_loss: 0.8533, test_f1: 0.5267
 epoch: 37, train_loss: 0.8207, test_loss: 0.8194, test_f1: 0.5458
 epoch: 38, train_loss: 0.8223, test_loss: 0.8569, test_f1: 0.5479
 epoch: 39, train_loss: 0.8086, test_loss: 0.8054, test_f1: 0.5616
 epoch: 40, train_loss: 0.8107, test_loss: 0.8726, test_f1: 0.5438
 epoch: 41, train_loss: 0.8047, test_loss: 0.8006, test_f1: 0.5591
 epoch: 42, train_loss: 0.7972, test_loss: 0.8265, test_f1: 0.5586
 epoch: 43, train_loss: 0.8153, test_loss: 0.9100, test_f1: 0.5295
 epoch: 44, train_loss: 0.8002, test_loss: 0.8536, test_f1: 0.5550
 epoch: 45, train_loss: 0.8006, test_loss: 0.9143, test_f1: 0.5249
 epoch: 46, train_loss: 0.8001, test_loss: 0.8860, test_f1: 0.5503
 epoch: 47, train_loss: 0.7714, test_loss: 0.8339, test_f1: 0.5649
 epoch: 48, train_loss: 0.7946, test_loss: 0.8399, test_f1: 0.5534
 epoch: 49, train_loss: 0.7752, test_loss: 0.8335, test_f1: 0.5490
 epoch: 50, train_loss: 0.7909, test_loss: 0.8101, test_f1: 0.5452
 epoch: 51, train_loss: 0.7714, test_loss: 0.8223, test_f1: 0.5634
 epoch: 52, train_loss: 0.7787, test_loss: 0.7945, test_f1: 0.5724
 epoch: 53, train_loss: 0.7745, test_loss: 0.8118, test_f1: 0.5617
 epoch: 54, train_loss: 0.7743, test_loss: 0.8612, test_f1: 0.5614
 epoch: 55, train_loss: 0.7748, test_loss: 0.8013, test_f1: 0.5645
 epoch: 56, train_loss: 0.7652, test_loss: 0.8443, test_f1: 0.5659
 epoch: 57, train_loss: 0.7580, test_loss: 0.8078, test_f1: 0.5630
 epoch: 58, train_loss: 0.7587, test_loss: 0.8432, test_f1: 0.5683
 epoch: 59, train_loss: 0.7569, test_loss: 0.8188, test_f1: 0.5534
 epoch: 60, train_loss: 0.7701, test_loss: 0.8142, test_f1: 0.5500
 epoch: 61, train_loss: 0.7576, test_loss: 0.7804, test_f1: 0.5694
 epoch: 62, train_loss: 0.7549, test_loss: 0.8651, test_f1: 0.5499
 epoch: 63, train_loss: 0.7624, test_loss: 0.7780, test_f1: 0.5624
 epoch: 64, train_loss: 0.7683, test_loss: 0.8345, test_f1: 0.5641
 epoch: 65, train_loss: 0.7597, test_loss: 0.8494, test_f1: 0.5535
 epoch: 66, train_loss: 0.7592, test_loss: 0.7723, test_f1: 0.5689
 epoch: 67, train_loss: 0.7538, test_loss: 0.8011, test_f1: 0.5616
 epoch: 68, train_loss: 0.7497, test_loss: 0.7882, test_f1: 0.5577
 epoch: 69, train_loss: 0.7495, test_loss: 0.8112, test_f1: 0.5614
 epoch: 70, train_loss: 0.7466, test_loss: 0.8567, test_f1: 0.5568
 epoch: 71, train_loss: 0.7605, test_loss: 0.8030, test_f1: 0.5533
 epoch: 72, train_loss: 0.7548, test_loss: 0.7985, test_f1: 0.5526
 epoch: 73, train_loss: 0.7438, test_loss: 0.8230, test_f1: 0.5628
 epoch: 74, train_loss: 0.7431, test_loss: 0.8287, test_f1: 0.5629
 epoch: 75, train_loss: 0.7526, test_loss: 0.8225, test_f1: 0.5645
 epoch: 76, train_loss: 0.7404, test_loss: 0.8213, test_f1: 0.5458
 epoch: 77, train_loss: 0.7401, test_loss: 0.8352, test_f1: 0.5673
 epoch: 78, train_loss: 0.7390, test_loss: 0.8666, test_f1: 0.5555
 epoch: 79, train_loss: 0.7411, test_loss: 0.8044, test_f1: 0.5456
 epoch: 80, train_loss: 0.7266, test_loss: 0.8062, test_f1: 0.5567
 epoch: 81, train_loss: 0.7384, test_loss: 0.8112, test_f1: 0.5742
 epoch: 82, train_loss: 0.7299, test_loss: 0.8543, test_f1: 0.5500
 epoch: 83, train_loss: 0.7367, test_loss: 0.8179, test_f1: 0.5488
 epoch: 84, train_loss: 0.7394, test_loss: 0.8001, test_f1: 0.5667
 epoch: 85, train_loss: 0.7273, test_loss: 0.8384, test_f1: 0.5785
 epoch: 86, train_loss: 0.7357, test_loss: 0.8061, test_f1: 0.5670
 epoch: 87, train_loss: 0.7329, test_loss: 0.8359, test_f1: 0.5448
 epoch: 88, train_loss: 0.7359, test_loss: 0.8235, test_f1: 0.5435
 epoch: 89, train_loss: 0.7244, test_loss: 0.8556, test_f1: 0.5632
 epoch: 90, train_loss: 0.7312, test_loss: 0.8329, test_f1: 0.5418
 epoch: 91, train_loss: 0.7368, test_loss: 0.8742, test_f1: 0.5543
 epoch: 92, train_loss: 0.7365, test_loss: 0.8377, test_f1: 0.5524
 epoch: 93, train_loss: 0.7154, test_loss: 0.8709, test_f1: 0.5712
 epoch: 94, train_loss: 0.7179, test_loss: 0.8404, test_f1: 0.5726
 epoch: 95, train_loss: 0.7245, test_loss: 0.8739, test_f1: 0.5701
 epoch: 96, train_loss: 0.7366, test_loss: 0.8631, test_f1: 0.5497
 epoch: 97, train_loss: 0.7194, test_loss: 0.8747, test_f1: 0.5457
 epoch: 98, train_loss: 0.7362, test_loss: 0.8416, test_f1: 0.5735
 epoch: 99, train_loss: 0.7142, test_loss: 0.8176, test_f1: 0.5563
##################ITERATION #5 ****************************************
 epoch: 0, train_loss: 1.3616, test_loss: 1.3788, test_f1: 0.2270
 epoch: 1, train_loss: 1.1482, test_loss: 1.2574, test_f1: 0.2641
 epoch: 2, train_loss: 1.0905, test_loss: 1.0607, test_f1: 0.4284
 epoch: 3, train_loss: 1.0628, test_loss: 1.0366, test_f1: 0.4754
 epoch: 4, train_loss: 1.0426, test_loss: 1.0139, test_f1: 0.4787
 epoch: 5, train_loss: 1.0307, test_loss: 1.0371, test_f1: 0.4392
 epoch: 6, train_loss: 1.0130, test_loss: 0.9951, test_f1: 0.4730
 epoch: 7, train_loss: 0.9877, test_loss: 0.9970, test_f1: 0.4724
 epoch: 8, train_loss: 0.9856, test_loss: 0.9842, test_f1: 0.4577
 epoch: 9, train_loss: 0.9759, test_loss: 1.0035, test_f1: 0.4790
 epoch: 10, train_loss: 0.9647, test_loss: 0.9364, test_f1: 0.4818
 epoch: 11, train_loss: 0.9594, test_loss: 0.9271, test_f1: 0.5234
 epoch: 12, train_loss: 0.9435, test_loss: 0.9292, test_f1: 0.5130
 epoch: 13, train_loss: 0.9212, test_loss: 0.8971, test_f1: 0.5221
 epoch: 14, train_loss: 0.9258, test_loss: 0.9341, test_f1: 0.4980
 epoch: 15, train_loss: 0.9159, test_loss: 0.9226, test_f1: 0.5289
 epoch: 16, train_loss: 0.9178, test_loss: 0.9205, test_f1: 0.5111
 epoch: 17, train_loss: 0.9088, test_loss: 0.9085, test_f1: 0.5306
 epoch: 18, train_loss: 0.8987, test_loss: 0.8933, test_f1: 0.5195
 epoch: 19, train_loss: 0.8916, test_loss: 0.9094, test_f1: 0.5345
 epoch: 20, train_loss: 0.8828, test_loss: 0.8954, test_f1: 0.5183
 epoch: 21, train_loss: 0.8792, test_loss: 0.9246, test_f1: 0.5442
 epoch: 22, train_loss: 0.8717, test_loss: 0.9430, test_f1: 0.5203
 epoch: 23, train_loss: 0.8838, test_loss: 0.8790, test_f1: 0.5389
 epoch: 24, train_loss: 0.8704, test_loss: 0.9005, test_f1: 0.5290
 epoch: 25, train_loss: 0.8525, test_loss: 0.8591, test_f1: 0.5325
 epoch: 26, train_loss: 0.8606, test_loss: 0.8996, test_f1: 0.5337
 epoch: 27, train_loss: 0.8593, test_loss: 0.9216, test_f1: 0.5418
 epoch: 28, train_loss: 0.8531, test_loss: 0.8999, test_f1: 0.5574
 epoch: 29, train_loss: 0.8571, test_loss: 0.8972, test_f1: 0.5527
 epoch: 30, train_loss: 0.8512, test_loss: 0.9171, test_f1: 0.5348
 epoch: 31, train_loss: 0.8442, test_loss: 0.8900, test_f1: 0.5528
 epoch: 32, train_loss: 0.8351, test_loss: 0.9106, test_f1: 0.5376
 epoch: 33, train_loss: 0.8305, test_loss: 0.8983, test_f1: 0.5483
 epoch: 34, train_loss: 0.8395, test_loss: 0.9134, test_f1: 0.5405
 epoch: 35, train_loss: 0.8319, test_loss: 0.9233, test_f1: 0.5391
 epoch: 36, train_loss: 0.8281, test_loss: 0.8929, test_f1: 0.5491
 epoch: 37, train_loss: 0.8142, test_loss: 0.8783, test_f1: 0.5497
 epoch: 38, train_loss: 0.8088, test_loss: 0.8958, test_f1: 0.5519
 epoch: 39, train_loss: 0.8138, test_loss: 0.9126, test_f1: 0.5357
 epoch: 40, train_loss: 0.7986, test_loss: 0.8900, test_f1: 0.5465
 epoch: 41, train_loss: 0.8072, test_loss: 0.8994, test_f1: 0.5535
 epoch: 42, train_loss: 0.7953, test_loss: 0.8851, test_f1: 0.5268
 epoch: 43, train_loss: 0.8016, test_loss: 0.9252, test_f1: 0.5283
 epoch: 44, train_loss: 0.8133, test_loss: 0.8946, test_f1: 0.5319
 epoch: 45, train_loss: 0.7927, test_loss: 0.8939, test_f1: 0.5716
 epoch: 46, train_loss: 0.7896, test_loss: 0.8752, test_f1: 0.5601
 epoch: 47, train_loss: 0.7858, test_loss: 0.9454, test_f1: 0.5183
 epoch: 48, train_loss: 0.7935, test_loss: 0.8689, test_f1: 0.5517
 epoch: 49, train_loss: 0.7961, test_loss: 0.8866, test_f1: 0.5456
 epoch: 50, train_loss: 0.7844, test_loss: 0.9061, test_f1: 0.5368
 epoch: 51, train_loss: 0.7798, test_loss: 0.8730, test_f1: 0.5812
 epoch: 52, train_loss: 0.7656, test_loss: 0.8892, test_f1: 0.5597
 epoch: 53, train_loss: 0.7796, test_loss: 0.8714, test_f1: 0.5642
 epoch: 54, train_loss: 0.7715, test_loss: 0.8847, test_f1: 0.5566
 epoch: 55, train_loss: 0.7708, test_loss: 0.8985, test_f1: 0.5552
 epoch: 56, train_loss: 0.7658, test_loss: 0.8905, test_f1: 0.5559
 epoch: 57, train_loss: 0.7709, test_loss: 0.8799, test_f1: 0.5587
 epoch: 58, train_loss: 0.7634, test_loss: 0.8968, test_f1: 0.5608
 epoch: 59, train_loss: 0.7493, test_loss: 0.8824, test_f1: 0.5631
 epoch: 60, train_loss: 0.7608, test_loss: 0.8942, test_f1: 0.5576
 epoch: 61, train_loss: 0.7609, test_loss: 0.9008, test_f1: 0.5681
 epoch: 62, train_loss: 0.7580, test_loss: 0.8977, test_f1: 0.5559
 epoch: 63, train_loss: 0.7548, test_loss: 0.8760, test_f1: 0.5604
 epoch: 64, train_loss: 0.7566, test_loss: 0.8999, test_f1: 0.5570
 epoch: 65, train_loss: 0.7590, test_loss: 0.8957, test_f1: 0.5628
 epoch: 66, train_loss: 0.7581, test_loss: 0.8771, test_f1: 0.5837
 epoch: 67, train_loss: 0.7550, test_loss: 0.8974, test_f1: 0.5774
 epoch: 68, train_loss: 0.7479, test_loss: 0.8918, test_f1: 0.5566
 epoch: 69, train_loss: 0.7575, test_loss: 0.9133, test_f1: 0.5685
 epoch: 70, train_loss: 0.7397, test_loss: 0.8886, test_f1: 0.5749
 epoch: 71, train_loss: 0.7442, test_loss: 0.8900, test_f1: 0.5662
 epoch: 72, train_loss: 0.7570, test_loss: 0.9109, test_f1: 0.5600
 epoch: 73, train_loss: 0.7623, test_loss: 0.9214, test_f1: 0.5609
 epoch: 74, train_loss: 0.7476, test_loss: 0.9113, test_f1: 0.5639
 epoch: 75, train_loss: 0.7171, test_loss: 0.8947, test_f1: 0.5770
 epoch: 76, train_loss: 0.7412, test_loss: 0.9133, test_f1: 0.5630
 epoch: 77, train_loss: 0.7337, test_loss: 0.8992, test_f1: 0.5831
 epoch: 78, train_loss: 0.7351, test_loss: 0.9295, test_f1: 0.5658
 epoch: 79, train_loss: 0.7298, test_loss: 0.9007, test_f1: 0.5682
 epoch: 80, train_loss: 0.7396, test_loss: 0.8708, test_f1: 0.5847
 epoch: 81, train_loss: 0.7337, test_loss: 0.8896, test_f1: 0.5693
 epoch: 82, train_loss: 0.7513, test_loss: 0.8973, test_f1: 0.5933
 epoch: 83, train_loss: 0.7400, test_loss: 0.8970, test_f1: 0.5677
 epoch: 84, train_loss: 0.7312, test_loss: 0.9045, test_f1: 0.5679
 epoch: 85, train_loss: 0.7331, test_loss: 0.8852, test_f1: 0.5675
 epoch: 86, train_loss: 0.7301, test_loss: 0.9108, test_f1: 0.5712
 epoch: 87, train_loss: 0.7322, test_loss: 0.8897, test_f1: 0.5762
 epoch: 88, train_loss: 0.7343, test_loss: 0.9028, test_f1: 0.5728
 epoch: 89, train_loss: 0.7285, test_loss: 0.9039, test_f1: 0.5913
 epoch: 90, train_loss: 0.7192, test_loss: 0.8759, test_f1: 0.5729
 epoch: 91, train_loss: 0.7371, test_loss: 0.8896, test_f1: 0.5730
 epoch: 92, train_loss: 0.7335, test_loss: 0.8766, test_f1: 0.5941
 epoch: 93, train_loss: 0.7189, test_loss: 0.8885, test_f1: 0.5950
 epoch: 94, train_loss: 0.7411, test_loss: 0.9151, test_f1: 0.5715
 epoch: 95, train_loss: 0.7390, test_loss: 0.8802, test_f1: 0.5864
 epoch: 96, train_loss: 0.7133, test_loss: 0.8927, test_f1: 0.5766
 epoch: 97, train_loss: 0.7175, test_loss: 0.8838, test_f1: 0.5910
 epoch: 98, train_loss: 0.7174, test_loss: 0.8744, test_f1: 0.5750
 epoch: 99, train_loss: 0.7184, test_loss: 0.8751, test_f1: 0.5926
##################ITERATION #6 ****************************************
 epoch: 0, train_loss: 1.3203, test_loss: 1.4019, test_f1: 0.2270
 epoch: 1, train_loss: 1.1149, test_loss: 1.1198, test_f1: 0.3250
 epoch: 2, train_loss: 1.0877, test_loss: 1.0623, test_f1: 0.4080
 epoch: 3, train_loss: 1.0635, test_loss: 1.0294, test_f1: 0.4247
 epoch: 4, train_loss: 1.0505, test_loss: 1.0399, test_f1: 0.4555
 epoch: 5, train_loss: 1.0366, test_loss: 1.0335, test_f1: 0.4437
 epoch: 6, train_loss: 1.0315, test_loss: 1.0173, test_f1: 0.4609
 epoch: 7, train_loss: 1.0111, test_loss: 0.9983, test_f1: 0.4584
 epoch: 8, train_loss: 1.0091, test_loss: 0.9995, test_f1: 0.4720
 epoch: 9, train_loss: 1.0025, test_loss: 1.0084, test_f1: 0.4559
 epoch: 10, train_loss: 0.9947, test_loss: 0.9917, test_f1: 0.4697
 epoch: 11, train_loss: 0.9895, test_loss: 0.9966, test_f1: 0.4989
 epoch: 12, train_loss: 0.9862, test_loss: 0.9884, test_f1: 0.4841
 epoch: 13, train_loss: 0.9737, test_loss: 0.9794, test_f1: 0.4839
 epoch: 14, train_loss: 0.9659, test_loss: 0.9573, test_f1: 0.4903
 epoch: 15, train_loss: 0.9658, test_loss: 0.9678, test_f1: 0.4951
 epoch: 16, train_loss: 0.9567, test_loss: 0.9921, test_f1: 0.4929
 epoch: 17, train_loss: 0.9522, test_loss: 0.9405, test_f1: 0.4874
 epoch: 18, train_loss: 0.9351, test_loss: 0.9437, test_f1: 0.4826
 epoch: 19, train_loss: 0.9400, test_loss: 0.9322, test_f1: 0.5089
 epoch: 20, train_loss: 0.9424, test_loss: 0.9638, test_f1: 0.4990
 epoch: 21, train_loss: 0.9350, test_loss: 0.9411, test_f1: 0.5055
 epoch: 22, train_loss: 0.9286, test_loss: 0.9524, test_f1: 0.5164
 epoch: 23, train_loss: 0.9218, test_loss: 0.8969, test_f1: 0.5219
 epoch: 24, train_loss: 0.9164, test_loss: 0.9373, test_f1: 0.5033
 epoch: 25, train_loss: 0.9210, test_loss: 0.9314, test_f1: 0.5096
 epoch: 26, train_loss: 0.9156, test_loss: 0.9003, test_f1: 0.5273
 epoch: 27, train_loss: 0.9221, test_loss: 0.9265, test_f1: 0.5230
 epoch: 28, train_loss: 0.9079, test_loss: 0.9918, test_f1: 0.4979
 epoch: 29, train_loss: 0.9008, test_loss: 0.9214, test_f1: 0.5005
 epoch: 30, train_loss: 0.9087, test_loss: 0.9073, test_f1: 0.5278
 epoch: 31, train_loss: 0.8954, test_loss: 0.8917, test_f1: 0.5151
 epoch: 32, train_loss: 0.8828, test_loss: 0.8826, test_f1: 0.5265
 epoch: 33, train_loss: 0.8853, test_loss: 0.8893, test_f1: 0.5411
 epoch: 34, train_loss: 0.8836, test_loss: 0.9317, test_f1: 0.5036
 epoch: 35, train_loss: 0.8750, test_loss: 0.8663, test_f1: 0.5466
 epoch: 36, train_loss: 0.8812, test_loss: 0.8804, test_f1: 0.5205
 epoch: 37, train_loss: 0.8670, test_loss: 0.8866, test_f1: 0.5113
 epoch: 38, train_loss: 0.8767, test_loss: 0.8674, test_f1: 0.5394
 epoch: 39, train_loss: 0.8853, test_loss: 0.8968, test_f1: 0.5204
 epoch: 40, train_loss: 0.8789, test_loss: 0.8493, test_f1: 0.5478
 epoch: 41, train_loss: 0.8773, test_loss: 0.8716, test_f1: 0.5707
 epoch: 42, train_loss: 0.8586, test_loss: 0.8551, test_f1: 0.5525
 epoch: 43, train_loss: 0.8540, test_loss: 0.8631, test_f1: 0.5633
 epoch: 44, train_loss: 0.8510, test_loss: 0.9170, test_f1: 0.5204
 epoch: 45, train_loss: 0.8535, test_loss: 0.8902, test_f1: 0.5295
 epoch: 46, train_loss: 0.8539, test_loss: 0.9307, test_f1: 0.5286
 epoch: 47, train_loss: 0.8408, test_loss: 0.8484, test_f1: 0.5585
 epoch: 48, train_loss: 0.8356, test_loss: 0.8861, test_f1: 0.5235
 epoch: 49, train_loss: 0.8422, test_loss: 0.8219, test_f1: 0.5485
 epoch: 50, train_loss: 0.8409, test_loss: 0.8406, test_f1: 0.5550
 epoch: 51, train_loss: 0.8399, test_loss: 0.8793, test_f1: 0.5511
 epoch: 52, train_loss: 0.8374, test_loss: 0.8343, test_f1: 0.5470
 epoch: 53, train_loss: 0.8167, test_loss: 0.8154, test_f1: 0.5762
 epoch: 54, train_loss: 0.8200, test_loss: 0.8160, test_f1: 0.5532
 epoch: 55, train_loss: 0.8178, test_loss: 0.8169, test_f1: 0.5525
 epoch: 56, train_loss: 0.8385, test_loss: 0.8171, test_f1: 0.5736
 epoch: 57, train_loss: 0.8206, test_loss: 0.8113, test_f1: 0.5642
 epoch: 58, train_loss: 0.8121, test_loss: 0.8643, test_f1: 0.5380
 epoch: 59, train_loss: 0.8184, test_loss: 0.8212, test_f1: 0.5355
 epoch: 60, train_loss: 0.8077, test_loss: 0.8157, test_f1: 0.5694
 epoch: 61, train_loss: 0.8072, test_loss: 0.8284, test_f1: 0.5553
 epoch: 62, train_loss: 0.8005, test_loss: 0.8215, test_f1: 0.5445
 epoch: 63, train_loss: 0.8041, test_loss: 0.8127, test_f1: 0.5785
 epoch: 64, train_loss: 0.8153, test_loss: 0.8232, test_f1: 0.5455
 epoch: 65, train_loss: 0.8099, test_loss: 0.8295, test_f1: 0.5461
 epoch: 66, train_loss: 0.8013, test_loss: 0.8430, test_f1: 0.5328
 epoch: 67, train_loss: 0.8051, test_loss: 0.8152, test_f1: 0.5801
 epoch: 68, train_loss: 0.8078, test_loss: 0.8191, test_f1: 0.5427
 epoch: 69, train_loss: 0.7981, test_loss: 0.8165, test_f1: 0.5482
 epoch: 70, train_loss: 0.8091, test_loss: 0.8232, test_f1: 0.5654
 epoch: 71, train_loss: 0.8058, test_loss: 0.7989, test_f1: 0.5650
 epoch: 72, train_loss: 0.7897, test_loss: 0.8282, test_f1: 0.5542
 epoch: 73, train_loss: 0.7973, test_loss: 0.8003, test_f1: 0.5607
 epoch: 74, train_loss: 0.8011, test_loss: 0.8659, test_f1: 0.5127
 epoch: 75, train_loss: 0.7830, test_loss: 0.8392, test_f1: 0.5577
 epoch: 76, train_loss: 0.7828, test_loss: 0.8069, test_f1: 0.5729
 epoch: 77, train_loss: 0.7906, test_loss: 0.7968, test_f1: 0.5594
 epoch: 78, train_loss: 0.7855, test_loss: 0.8440, test_f1: 0.5528
 epoch: 79, train_loss: 0.7885, test_loss: 0.8004, test_f1: 0.5586
 epoch: 80, train_loss: 0.7841, test_loss: 0.8129, test_f1: 0.5795
 epoch: 81, train_loss: 0.7874, test_loss: 0.7995, test_f1: 0.5707
 epoch: 82, train_loss: 0.7849, test_loss: 0.8380, test_f1: 0.5382
 epoch: 83, train_loss: 0.7789, test_loss: 0.8133, test_f1: 0.5745
 epoch: 84, train_loss: 0.7821, test_loss: 0.7989, test_f1: 0.5854
 epoch: 85, train_loss: 0.7864, test_loss: 0.8119, test_f1: 0.5821
 epoch: 86, train_loss: 0.7731, test_loss: 0.8314, test_f1: 0.5868
 epoch: 87, train_loss: 0.7702, test_loss: 0.8054, test_f1: 0.5700
 epoch: 88, train_loss: 0.7607, test_loss: 0.8185, test_f1: 0.5884
 epoch: 89, train_loss: 0.7700, test_loss: 0.7979, test_f1: 0.5904
 epoch: 90, train_loss: 0.7765, test_loss: 0.8171, test_f1: 0.5951
 epoch: 91, train_loss: 0.7776, test_loss: 0.8049, test_f1: 0.5685
 epoch: 92, train_loss: 0.7609, test_loss: 0.7984, test_f1: 0.5898
 epoch: 93, train_loss: 0.7631, test_loss: 0.8343, test_f1: 0.5746
 epoch: 94, train_loss: 0.7724, test_loss: 0.8336, test_f1: 0.5869
 epoch: 95, train_loss: 0.7773, test_loss: 0.8149, test_f1: 0.5948
 epoch: 96, train_loss: 0.7693, test_loss: 0.7963, test_f1: 0.5728
 epoch: 97, train_loss: 0.7704, test_loss: 0.8211, test_f1: 0.5815
 epoch: 98, train_loss: 0.7769, test_loss: 0.8070, test_f1: 0.5626
 epoch: 99, train_loss: 0.7558, test_loss: 0.8096, test_f1: 0.5959
##################ITERATION #7 ****************************************
 epoch: 0, train_loss: 1.4994, test_loss: 1.3683, test_f1: 0.2153
 epoch: 1, train_loss: 1.1690, test_loss: 1.1528, test_f1: 0.4308
 epoch: 2, train_loss: 1.1272, test_loss: 1.0839, test_f1: 0.4457
 epoch: 3, train_loss: 1.0953, test_loss: 1.0657, test_f1: 0.4079
 epoch: 4, train_loss: 1.0671, test_loss: 1.0403, test_f1: 0.4575
 epoch: 5, train_loss: 1.0502, test_loss: 1.0301, test_f1: 0.4575
 epoch: 6, train_loss: 1.0295, test_loss: 1.0201, test_f1: 0.4614
 epoch: 7, train_loss: 1.0232, test_loss: 1.0189, test_f1: 0.4823
 epoch: 8, train_loss: 1.0078, test_loss: 1.0028, test_f1: 0.4797
 epoch: 9, train_loss: 0.9989, test_loss: 1.0067, test_f1: 0.4681
 epoch: 10, train_loss: 0.9981, test_loss: 1.0141, test_f1: 0.4652
 epoch: 11, train_loss: 0.9900, test_loss: 1.0018, test_f1: 0.4912
 epoch: 12, train_loss: 0.9761, test_loss: 1.0124, test_f1: 0.4709
 epoch: 13, train_loss: 0.9638, test_loss: 1.0253, test_f1: 0.4727
 epoch: 14, train_loss: 0.9613, test_loss: 1.0074, test_f1: 0.4872
 epoch: 15, train_loss: 0.9538, test_loss: 0.9877, test_f1: 0.5165
 epoch: 16, train_loss: 0.9518, test_loss: 1.0230, test_f1: 0.4790
 epoch: 17, train_loss: 0.9430, test_loss: 1.0237, test_f1: 0.4787
 epoch: 18, train_loss: 0.9457, test_loss: 1.0042, test_f1: 0.4895
 epoch: 19, train_loss: 0.9270, test_loss: 0.9866, test_f1: 0.5025
 epoch: 20, train_loss: 0.9249, test_loss: 1.0163, test_f1: 0.4736
 epoch: 21, train_loss: 0.9086, test_loss: 0.9812, test_f1: 0.5052
 epoch: 22, train_loss: 0.9179, test_loss: 1.0033, test_f1: 0.4926
 epoch: 23, train_loss: 0.9097, test_loss: 1.0130, test_f1: 0.4989
 epoch: 24, train_loss: 0.9138, test_loss: 1.0271, test_f1: 0.4837
 epoch: 25, train_loss: 0.9103, test_loss: 1.0708, test_f1: 0.4646
 epoch: 26, train_loss: 0.9106, test_loss: 0.9735, test_f1: 0.4978
 epoch: 27, train_loss: 0.8966, test_loss: 1.0262, test_f1: 0.4777
 epoch: 28, train_loss: 0.8960, test_loss: 1.0432, test_f1: 0.4702
 epoch: 29, train_loss: 0.9015, test_loss: 0.9974, test_f1: 0.4802
 epoch: 30, train_loss: 0.8814, test_loss: 1.0045, test_f1: 0.4927
 epoch: 31, train_loss: 0.8768, test_loss: 1.0153, test_f1: 0.4888
 epoch: 32, train_loss: 0.8826, test_loss: 0.9634, test_f1: 0.5150
 epoch: 33, train_loss: 0.8740, test_loss: 1.0111, test_f1: 0.5070
 epoch: 34, train_loss: 0.8808, test_loss: 0.9866, test_f1: 0.5056
 epoch: 35, train_loss: 0.8765, test_loss: 0.9910, test_f1: 0.5009
 epoch: 36, train_loss: 0.8550, test_loss: 1.0287, test_f1: 0.5035
 epoch: 37, train_loss: 0.8566, test_loss: 0.9900, test_f1: 0.5098
 epoch: 38, train_loss: 0.8584, test_loss: 1.0498, test_f1: 0.4877
 epoch: 39, train_loss: 0.8602, test_loss: 1.0251, test_f1: 0.4869
 epoch: 40, train_loss: 0.8467, test_loss: 0.9722, test_f1: 0.5327
 epoch: 41, train_loss: 0.8480, test_loss: 1.0242, test_f1: 0.5090
 epoch: 42, train_loss: 0.8498, test_loss: 0.9720, test_f1: 0.5282
 epoch: 43, train_loss: 0.8442, test_loss: 0.9540, test_f1: 0.5139
 epoch: 44, train_loss: 0.8392, test_loss: 0.9616, test_f1: 0.5187
 epoch: 45, train_loss: 0.8376, test_loss: 0.9494, test_f1: 0.5292
 epoch: 46, train_loss: 0.8357, test_loss: 0.9316, test_f1: 0.5190
 epoch: 47, train_loss: 0.8425, test_loss: 1.0042, test_f1: 0.5148
 epoch: 48, train_loss: 0.8494, test_loss: 1.0263, test_f1: 0.5113
 epoch: 49, train_loss: 0.8304, test_loss: 0.9709, test_f1: 0.5152
 epoch: 50, train_loss: 0.8230, test_loss: 0.9928, test_f1: 0.5143
 epoch: 51, train_loss: 0.8143, test_loss: 1.0128, test_f1: 0.5107
 epoch: 52, train_loss: 0.8168, test_loss: 0.9637, test_f1: 0.5210
 epoch: 53, train_loss: 0.8162, test_loss: 0.9704, test_f1: 0.5285
 epoch: 54, train_loss: 0.8112, test_loss: 0.9631, test_f1: 0.5221
 epoch: 55, train_loss: 0.8114, test_loss: 0.9518, test_f1: 0.5392
 epoch: 56, train_loss: 0.8036, test_loss: 0.9513, test_f1: 0.5273
 epoch: 57, train_loss: 0.7994, test_loss: 0.9612, test_f1: 0.5229
 epoch: 58, train_loss: 0.8075, test_loss: 1.0250, test_f1: 0.5072
 epoch: 59, train_loss: 0.8057, test_loss: 0.9782, test_f1: 0.5191
 epoch: 60, train_loss: 0.8045, test_loss: 0.9477, test_f1: 0.5303
 epoch: 61, train_loss: 0.8083, test_loss: 0.9533, test_f1: 0.5351
 epoch: 62, train_loss: 0.8054, test_loss: 0.9402, test_f1: 0.5375
 epoch: 63, train_loss: 0.7966, test_loss: 0.9441, test_f1: 0.5364
 epoch: 64, train_loss: 0.7943, test_loss: 0.9217, test_f1: 0.5413
 epoch: 65, train_loss: 0.8016, test_loss: 0.9262, test_f1: 0.5465
 epoch: 66, train_loss: 0.7934, test_loss: 0.9455, test_f1: 0.5296
 epoch: 67, train_loss: 0.8071, test_loss: 0.9469, test_f1: 0.5382
 epoch: 68, train_loss: 0.8025, test_loss: 0.9557, test_f1: 0.5362
 epoch: 69, train_loss: 0.7980, test_loss: 0.9669, test_f1: 0.5054
 epoch: 70, train_loss: 0.7914, test_loss: 0.9496, test_f1: 0.5308
 epoch: 71, train_loss: 0.7923, test_loss: 0.9271, test_f1: 0.5404
 epoch: 72, train_loss: 0.7921, test_loss: 0.9528, test_f1: 0.5360
 epoch: 73, train_loss: 0.7876, test_loss: 0.9907, test_f1: 0.5074
 epoch: 74, train_loss: 0.7976, test_loss: 0.9847, test_f1: 0.5149
 epoch: 75, train_loss: 0.7848, test_loss: 0.9598, test_f1: 0.5243
 epoch: 76, train_loss: 0.7805, test_loss: 0.9592, test_f1: 0.5269
 epoch: 77, train_loss: 0.7821, test_loss: 0.9557, test_f1: 0.5275
 epoch: 78, train_loss: 0.7810, test_loss: 0.9434, test_f1: 0.5369
 epoch: 79, train_loss: 0.7820, test_loss: 0.9441, test_f1: 0.5378
 epoch: 80, train_loss: 0.7855, test_loss: 0.9766, test_f1: 0.5248
 epoch: 81, train_loss: 0.7783, test_loss: 0.9490, test_f1: 0.5183
 epoch: 82, train_loss: 0.7847, test_loss: 0.9338, test_f1: 0.5264
 epoch: 83, train_loss: 0.7804, test_loss: 0.9458, test_f1: 0.5403
 epoch: 84, train_loss: 0.7807, test_loss: 0.9322, test_f1: 0.5427
 epoch: 85, train_loss: 0.7794, test_loss: 0.9347, test_f1: 0.5194
 epoch: 86, train_loss: 0.7635, test_loss: 0.9267, test_f1: 0.5515
 epoch: 87, train_loss: 0.7804, test_loss: 0.9350, test_f1: 0.5290
 epoch: 88, train_loss: 0.7728, test_loss: 0.9881, test_f1: 0.5126
 epoch: 89, train_loss: 0.7788, test_loss: 0.9548, test_f1: 0.5222
 epoch: 90, train_loss: 0.7741, test_loss: 0.9855, test_f1: 0.5238
 epoch: 91, train_loss: 0.7697, test_loss: 0.9829, test_f1: 0.5238
 epoch: 92, train_loss: 0.7700, test_loss: 0.9508, test_f1: 0.5231
 epoch: 93, train_loss: 0.7690, test_loss: 0.9379, test_f1: 0.5318
 epoch: 94, train_loss: 0.7700, test_loss: 0.9477, test_f1: 0.5354
 epoch: 95, train_loss: 0.7679, test_loss: 0.9626, test_f1: 0.5356
 epoch: 96, train_loss: 0.7573, test_loss: 0.9543, test_f1: 0.5240
 epoch: 97, train_loss: 0.7763, test_loss: 0.9404, test_f1: 0.5318
 epoch: 98, train_loss: 0.7652, test_loss: 0.9474, test_f1: 0.5195
 epoch: 99, train_loss: 0.7648, test_loss: 0.9542, test_f1: 0.5518
##################ITERATION #8 ****************************************
 epoch: 0, train_loss: 1.3926, test_loss: 1.5235, test_f1: 0.2270
 epoch: 1, train_loss: 1.1472, test_loss: 1.1988, test_f1: 0.2801
 epoch: 2, train_loss: 1.0999, test_loss: 1.0264, test_f1: 0.4038
 epoch: 3, train_loss: 1.0706, test_loss: 0.9797, test_f1: 0.4640
 epoch: 4, train_loss: 1.0357, test_loss: 0.9769, test_f1: 0.4903
 epoch: 5, train_loss: 1.0243, test_loss: 0.9742, test_f1: 0.4592
 epoch: 6, train_loss: 1.0072, test_loss: 0.9663, test_f1: 0.4975
 epoch: 7, train_loss: 1.0001, test_loss: 0.9537, test_f1: 0.4942
 epoch: 8, train_loss: 0.9836, test_loss: 0.9431, test_f1: 0.4679
 epoch: 9, train_loss: 0.9696, test_loss: 0.9380, test_f1: 0.5127
 epoch: 10, train_loss: 0.9638, test_loss: 0.9172, test_f1: 0.5123
 epoch: 11, train_loss: 0.9548, test_loss: 0.9090, test_f1: 0.5241
 epoch: 12, train_loss: 0.9552, test_loss: 0.9071, test_f1: 0.4957
 epoch: 13, train_loss: 0.9355, test_loss: 0.9093, test_f1: 0.5308
 epoch: 14, train_loss: 0.9387, test_loss: 0.8859, test_f1: 0.5421
 epoch: 15, train_loss: 0.9211, test_loss: 0.8883, test_f1: 0.5372
 epoch: 16, train_loss: 0.9206, test_loss: 0.8879, test_f1: 0.5378
 epoch: 17, train_loss: 0.9167, test_loss: 0.8788, test_f1: 0.5252
 epoch: 18, train_loss: 0.9019, test_loss: 0.9109, test_f1: 0.5470
 epoch: 19, train_loss: 0.8932, test_loss: 0.8867, test_f1: 0.5492
 epoch: 20, train_loss: 0.8932, test_loss: 0.8733, test_f1: 0.5519
 epoch: 21, train_loss: 0.8890, test_loss: 0.8740, test_f1: 0.5373
 epoch: 22, train_loss: 0.8962, test_loss: 0.9013, test_f1: 0.5459
 epoch: 23, train_loss: 0.8959, test_loss: 0.8862, test_f1: 0.5166
 epoch: 24, train_loss: 0.8917, test_loss: 0.8933, test_f1: 0.5334
 epoch: 25, train_loss: 0.8870, test_loss: 0.8792, test_f1: 0.5467
 epoch: 26, train_loss: 0.8806, test_loss: 0.9196, test_f1: 0.5314
 epoch: 27, train_loss: 0.8743, test_loss: 0.8691, test_f1: 0.5519
 epoch: 28, train_loss: 0.8672, test_loss: 0.8822, test_f1: 0.5333
 epoch: 29, train_loss: 0.8715, test_loss: 0.8702, test_f1: 0.5622
 epoch: 30, train_loss: 0.8585, test_loss: 0.8690, test_f1: 0.5526
 epoch: 31, train_loss: 0.8688, test_loss: 0.8590, test_f1: 0.5529
 epoch: 32, train_loss: 0.8628, test_loss: 0.8616, test_f1: 0.5776
 epoch: 33, train_loss: 0.8553, test_loss: 0.8675, test_f1: 0.5546
 epoch: 34, train_loss: 0.8508, test_loss: 0.8634, test_f1: 0.5581
 epoch: 35, train_loss: 0.8605, test_loss: 0.8414, test_f1: 0.5470
 epoch: 36, train_loss: 0.8510, test_loss: 0.8888, test_f1: 0.5549
 epoch: 37, train_loss: 0.8487, test_loss: 0.8168, test_f1: 0.5890
 epoch: 38, train_loss: 0.8531, test_loss: 0.8711, test_f1: 0.5569
 epoch: 39, train_loss: 0.8302, test_loss: 0.8749, test_f1: 0.5550
 epoch: 40, train_loss: 0.8335, test_loss: 0.8428, test_f1: 0.5598
 epoch: 41, train_loss: 0.8336, test_loss: 0.8601, test_f1: 0.5700
 epoch: 42, train_loss: 0.8317, test_loss: 0.8545, test_f1: 0.5511
 epoch: 43, train_loss: 0.8383, test_loss: 0.8437, test_f1: 0.5457
 epoch: 44, train_loss: 0.8279, test_loss: 0.8298, test_f1: 0.5618
 epoch: 45, train_loss: 0.8230, test_loss: 0.8474, test_f1: 0.5606
 epoch: 46, train_loss: 0.8343, test_loss: 0.8518, test_f1: 0.5338
 epoch: 47, train_loss: 0.8244, test_loss: 0.8285, test_f1: 0.5618
 epoch: 48, train_loss: 0.8199, test_loss: 0.8550, test_f1: 0.5775
 epoch: 49, train_loss: 0.8142, test_loss: 0.8507, test_f1: 0.5562
 epoch: 50, train_loss: 0.8236, test_loss: 0.8126, test_f1: 0.5756
 epoch: 51, train_loss: 0.8198, test_loss: 0.8496, test_f1: 0.5517
 epoch: 52, train_loss: 0.8152, test_loss: 0.8475, test_f1: 0.5698
 epoch: 53, train_loss: 0.8064, test_loss: 0.8183, test_f1: 0.5725
 epoch: 54, train_loss: 0.7965, test_loss: 0.8301, test_f1: 0.5783
 epoch: 55, train_loss: 0.7956, test_loss: 0.8162, test_f1: 0.5681
 epoch: 56, train_loss: 0.8060, test_loss: 0.8456, test_f1: 0.5612
 epoch: 57, train_loss: 0.7997, test_loss: 0.8351, test_f1: 0.5723
 epoch: 58, train_loss: 0.8105, test_loss: 0.8242, test_f1: 0.5823
 epoch: 59, train_loss: 0.8062, test_loss: 0.8129, test_f1: 0.5738
 epoch: 60, train_loss: 0.7857, test_loss: 0.8361, test_f1: 0.5842
 epoch: 61, train_loss: 0.8015, test_loss: 0.8352, test_f1: 0.5759
 epoch: 62, train_loss: 0.7903, test_loss: 0.8211, test_f1: 0.5689
 epoch: 63, train_loss: 0.7941, test_loss: 0.8396, test_f1: 0.5845
 epoch: 64, train_loss: 0.7872, test_loss: 0.8076, test_f1: 0.5696
 epoch: 65, train_loss: 0.7811, test_loss: 0.8335, test_f1: 0.5619
 epoch: 66, train_loss: 0.7966, test_loss: 0.8500, test_f1: 0.5732
 epoch: 67, train_loss: 0.8035, test_loss: 0.8422, test_f1: 0.5689
 epoch: 68, train_loss: 0.8069, test_loss: 0.8465, test_f1: 0.5697
 epoch: 69, train_loss: 0.7828, test_loss: 0.8053, test_f1: 0.5713
 epoch: 70, train_loss: 0.7990, test_loss: 0.8052, test_f1: 0.5945
 epoch: 71, train_loss: 0.7913, test_loss: 0.8073, test_f1: 0.5745
 epoch: 72, train_loss: 0.7837, test_loss: 0.7919, test_f1: 0.5798
 epoch: 73, train_loss: 0.7714, test_loss: 0.8243, test_f1: 0.5804
 epoch: 74, train_loss: 0.7876, test_loss: 0.8112, test_f1: 0.5834
 epoch: 75, train_loss: 0.7919, test_loss: 0.8383, test_f1: 0.5582
 epoch: 76, train_loss: 0.7709, test_loss: 0.8267, test_f1: 0.5780
 epoch: 77, train_loss: 0.7699, test_loss: 0.8114, test_f1: 0.5840
 epoch: 78, train_loss: 0.7894, test_loss: 0.8118, test_f1: 0.5725
 epoch: 79, train_loss: 0.7859, test_loss: 0.8491, test_f1: 0.5838
 epoch: 80, train_loss: 0.7752, test_loss: 0.8404, test_f1: 0.5876
 epoch: 81, train_loss: 0.7740, test_loss: 0.8503, test_f1: 0.5814
 epoch: 82, train_loss: 0.7818, test_loss: 0.8535, test_f1: 0.5783
 epoch: 83, train_loss: 0.7795, test_loss: 0.8466, test_f1: 0.5692
 epoch: 84, train_loss: 0.7772, test_loss: 0.8417, test_f1: 0.5842
 epoch: 85, train_loss: 0.7645, test_loss: 0.8265, test_f1: 0.5947
 epoch: 86, train_loss: 0.7629, test_loss: 0.8488, test_f1: 0.5810
 epoch: 87, train_loss: 0.7759, test_loss: 0.8169, test_f1: 0.5721
 epoch: 88, train_loss: 0.7641, test_loss: 0.8569, test_f1: 0.5774
 epoch: 89, train_loss: 0.7609, test_loss: 0.8451, test_f1: 0.5772
 epoch: 90, train_loss: 0.7770, test_loss: 0.8381, test_f1: 0.5744
 epoch: 91, train_loss: 0.7656, test_loss: 0.8413, test_f1: 0.5698
 epoch: 92, train_loss: 0.7687, test_loss: 0.8380, test_f1: 0.5825
 epoch: 93, train_loss: 0.7647, test_loss: 0.8554, test_f1: 0.5781
 epoch: 94, train_loss: 0.7691, test_loss: 0.8654, test_f1: 0.5798
 epoch: 95, train_loss: 0.7613, test_loss: 0.8653, test_f1: 0.5903
 epoch: 96, train_loss: 0.7581, test_loss: 0.8600, test_f1: 0.5852
 epoch: 97, train_loss: 0.7590, test_loss: 0.8272, test_f1: 0.5785
 epoch: 98, train_loss: 0.7664, test_loss: 0.8225, test_f1: 0.5749
 epoch: 99, train_loss: 0.7660, test_loss: 0.8433, test_f1: 0.5883
##################ITERATION #9 ****************************************
 epoch: 0, train_loss: 1.4483, test_loss: 1.3629, test_f1: 0.2270
 epoch: 1, train_loss: 1.1536, test_loss: 1.1176, test_f1: 0.4355
 epoch: 2, train_loss: 1.0960, test_loss: 1.0349, test_f1: 0.4647
 epoch: 3, train_loss: 1.0657, test_loss: 1.0103, test_f1: 0.4624
 epoch: 4, train_loss: 1.0567, test_loss: 1.0077, test_f1: 0.4675
 epoch: 5, train_loss: 1.0375, test_loss: 0.9811, test_f1: 0.4705
 epoch: 6, train_loss: 1.0080, test_loss: 0.9715, test_f1: 0.5056
 epoch: 7, train_loss: 1.0008, test_loss: 0.9749, test_f1: 0.4877
 epoch: 8, train_loss: 0.9966, test_loss: 0.9839, test_f1: 0.4730
 epoch: 9, train_loss: 0.9783, test_loss: 0.9779, test_f1: 0.4867
 epoch: 10, train_loss: 0.9829, test_loss: 0.9491, test_f1: 0.5274
 epoch: 11, train_loss: 0.9693, test_loss: 0.9545, test_f1: 0.4744
 epoch: 12, train_loss: 0.9704, test_loss: 0.9501, test_f1: 0.4982
 epoch: 13, train_loss: 0.9641, test_loss: 0.9242, test_f1: 0.5454
 epoch: 14, train_loss: 0.9474, test_loss: 0.9422, test_f1: 0.5087
 epoch: 15, train_loss: 0.9477, test_loss: 0.9551, test_f1: 0.5223
 epoch: 16, train_loss: 0.9346, test_loss: 0.9574, test_f1: 0.5498
 epoch: 17, train_loss: 0.9360, test_loss: 0.9348, test_f1: 0.5428
 epoch: 18, train_loss: 0.9328, test_loss: 0.9279, test_f1: 0.5129
 epoch: 19, train_loss: 0.9270, test_loss: 0.9261, test_f1: 0.4921
 epoch: 20, train_loss: 0.9184, test_loss: 0.9054, test_f1: 0.5213
 epoch: 21, train_loss: 0.9170, test_loss: 0.9309, test_f1: 0.5170
 epoch: 22, train_loss: 0.9140, test_loss: 0.9207, test_f1: 0.5164
 epoch: 23, train_loss: 0.9046, test_loss: 0.9217, test_f1: 0.5137
 epoch: 24, train_loss: 0.9078, test_loss: 0.9232, test_f1: 0.5105
 epoch: 25, train_loss: 0.9049, test_loss: 0.9270, test_f1: 0.5139
 epoch: 26, train_loss: 0.9032, test_loss: 0.9101, test_f1: 0.5295
 epoch: 27, train_loss: 0.9084, test_loss: 0.9164, test_f1: 0.5036
 epoch: 28, train_loss: 0.8987, test_loss: 0.9225, test_f1: 0.4994
 epoch: 29, train_loss: 0.9035, test_loss: 0.9118, test_f1: 0.4948
 epoch: 30, train_loss: 0.8885, test_loss: 0.8983, test_f1: 0.5370
 epoch: 31, train_loss: 0.8758, test_loss: 0.8984, test_f1: 0.5345
 epoch: 32, train_loss: 0.8836, test_loss: 0.9514, test_f1: 0.5017
 epoch: 33, train_loss: 0.8831, test_loss: 0.9217, test_f1: 0.5330
 epoch: 34, train_loss: 0.8694, test_loss: 0.9335, test_f1: 0.4974
 epoch: 35, train_loss: 0.8766, test_loss: 0.8988, test_f1: 0.5117
 epoch: 36, train_loss: 0.8680, test_loss: 0.8989, test_f1: 0.5525
 epoch: 37, train_loss: 0.8549, test_loss: 0.8994, test_f1: 0.5525
 epoch: 38, train_loss: 0.8461, test_loss: 0.8606, test_f1: 0.5524
 epoch: 39, train_loss: 0.8603, test_loss: 0.9297, test_f1: 0.5247
 epoch: 40, train_loss: 0.8567, test_loss: 0.8910, test_f1: 0.5380
 epoch: 41, train_loss: 0.8529, test_loss: 0.9037, test_f1: 0.5289
 epoch: 42, train_loss: 0.8435, test_loss: 0.8666, test_f1: 0.5334
 epoch: 43, train_loss: 0.8255, test_loss: 0.8686, test_f1: 0.5299
 epoch: 44, train_loss: 0.8371, test_loss: 0.9024, test_f1: 0.5195
 epoch: 45, train_loss: 0.8424, test_loss: 0.8940, test_f1: 0.5450
 epoch: 46, train_loss: 0.8319, test_loss: 0.8837, test_f1: 0.5339
 epoch: 47, train_loss: 0.8385, test_loss: 0.8792, test_f1: 0.5477
 epoch: 48, train_loss: 0.8327, test_loss: 0.8825, test_f1: 0.5365
 epoch: 49, train_loss: 0.8162, test_loss: 0.8422, test_f1: 0.5310
 epoch: 50, train_loss: 0.8151, test_loss: 0.8633, test_f1: 0.5216
 epoch: 51, train_loss: 0.8158, test_loss: 0.8775, test_f1: 0.5462
 epoch: 52, train_loss: 0.8066, test_loss: 0.8703, test_f1: 0.5547
 epoch: 53, train_loss: 0.8070, test_loss: 0.8798, test_f1: 0.5379
 epoch: 54, train_loss: 0.8045, test_loss: 0.8695, test_f1: 0.5572
 epoch: 55, train_loss: 0.8118, test_loss: 0.8773, test_f1: 0.5570
 epoch: 56, train_loss: 0.8126, test_loss: 0.8758, test_f1: 0.5356
 epoch: 57, train_loss: 0.7942, test_loss: 0.8684, test_f1: 0.5509
 epoch: 58, train_loss: 0.8035, test_loss: 0.8685, test_f1: 0.5308
 epoch: 59, train_loss: 0.8095, test_loss: 0.8587, test_f1: 0.5413
 epoch: 60, train_loss: 0.8057, test_loss: 0.8822, test_f1: 0.5566
 epoch: 61, train_loss: 0.7970, test_loss: 0.8610, test_f1: 0.5353
 epoch: 62, train_loss: 0.7832, test_loss: 0.8642, test_f1: 0.5474
 epoch: 63, train_loss: 0.8015, test_loss: 0.8619, test_f1: 0.5503
 epoch: 64, train_loss: 0.8014, test_loss: 0.8960, test_f1: 0.5471
 epoch: 65, train_loss: 0.7967, test_loss: 0.8863, test_f1: 0.5618
 epoch: 66, train_loss: 0.7898, test_loss: 0.8934, test_f1: 0.5396
 epoch: 67, train_loss: 0.7954, test_loss: 0.8795, test_f1: 0.5433
 epoch: 68, train_loss: 0.7941, test_loss: 0.8784, test_f1: 0.5517
 epoch: 69, train_loss: 0.7954, test_loss: 0.8601, test_f1: 0.5583
 epoch: 70, train_loss: 0.7937, test_loss: 0.8668, test_f1: 0.5436
 epoch: 71, train_loss: 0.7967, test_loss: 0.8700, test_f1: 0.5394
 epoch: 72, train_loss: 0.7907, test_loss: 0.8698, test_f1: 0.5637
 epoch: 73, train_loss: 0.7795, test_loss: 0.8672, test_f1: 0.5481
 epoch: 74, train_loss: 0.7946, test_loss: 0.8860, test_f1: 0.5425
 epoch: 75, train_loss: 0.7785, test_loss: 0.8773, test_f1: 0.5513
 epoch: 76, train_loss: 0.7866, test_loss: 0.8664, test_f1: 0.5721
 epoch: 77, train_loss: 0.7727, test_loss: 0.8631, test_f1: 0.5551
 epoch: 78, train_loss: 0.7794, test_loss: 0.9146, test_f1: 0.5371
 epoch: 79, train_loss: 0.7771, test_loss: 0.8794, test_f1: 0.5394
 epoch: 80, train_loss: 0.7741, test_loss: 0.8518, test_f1: 0.5554
 epoch: 81, train_loss: 0.7827, test_loss: 0.8840, test_f1: 0.5487
 epoch: 82, train_loss: 0.7782, test_loss: 0.8618, test_f1: 0.5552
 epoch: 83, train_loss: 0.7667, test_loss: 0.8720, test_f1: 0.5603
 epoch: 84, train_loss: 0.7748, test_loss: 0.8894, test_f1: 0.5429
 epoch: 85, train_loss: 0.7651, test_loss: 0.8802, test_f1: 0.5545
 epoch: 86, train_loss: 0.7889, test_loss: 0.8581, test_f1: 0.5550
 epoch: 87, train_loss: 0.7693, test_loss: 0.8466, test_f1: 0.5598
 epoch: 88, train_loss: 0.7740, test_loss: 0.8681, test_f1: 0.5507
 epoch: 89, train_loss: 0.7708, test_loss: 0.8766, test_f1: 0.5501
 epoch: 90, train_loss: 0.7714, test_loss: 0.8690, test_f1: 0.5742
 epoch: 91, train_loss: 0.7568, test_loss: 0.8803, test_f1: 0.5495
 epoch: 92, train_loss: 0.7544, test_loss: 0.8826, test_f1: 0.5584
 epoch: 93, train_loss: 0.7575, test_loss: 0.8619, test_f1: 0.5467
 epoch: 94, train_loss: 0.7643, test_loss: 0.8669, test_f1: 0.5667
 epoch: 95, train_loss: 0.7698, test_loss: 0.8689, test_f1: 0.5568
 epoch: 96, train_loss: 0.7650, test_loss: 0.8496, test_f1: 0.5441
 epoch: 97, train_loss: 0.7683, test_loss: 0.8706, test_f1: 0.5455
 epoch: 98, train_loss: 0.7691, test_loss: 0.8497, test_f1: 0.5744
 epoch: 99, train_loss: 0.7571, test_loss: 0.8955, test_f1: 0.5502

Training completed in 499.10 seconds
Best F1: 0.5959 at epoch 99
Mean F1 across iterations: 0.5729  0.0167
========================FINAL RESULTS================================
FEGIN weighted F1: 0.5959  0.0167
python main.py --data ltspice_examples --representation component_pin_net --model FEGIN --layers 3 --hiddens 16 --batch_size 128 --lr 0.001 --emb_size 128 --epochs 100 --save_appendix component_pin_net_L3_H16_BS128_LR0.001_E128 --no_val
-----



STDERR:
  File "main.py", line 370, in <module>
    main()
  File "main.py", line 254, in main
    dataset = dataset_class(
  File "/home/philip/projects/ltspice_examples_code_repo/Circuit-Completion-Using-GNNs/component_classification_with_link_prediction_head/evaluation/FEGIN/kernel/circuit_datasets.py", line 15, in __init__
    self.data, self.slices = torch.load(self.processed_paths[0])
  File "/home/philip/.local/lib/python3.8/site-packages/torch/serialization.py", line 1040, in load
    warnings.warn(
  File "/usr/lib/python3.8/warnings.py", line 109, in _showwarnmsg
    sw(msg.message, msg.category, msg.filename, msg.lineno,
  File "main.py", line 47, in warn_with_traceback
    traceback.print_stack(file=log)
/home/philip/projects/ltspice_examples_code_repo/Circuit-Completion-Using-GNNs/component_classification_with_link_prediction_head/evaluation/FEGIN/kernel/circuit_datasets.py:15: FutureWarning: You are using `torch.load` with `weights_only=False` (the current default value), which uses the default pickle module implicitly. It is possible to construct malicious pickle data which will execute arbitrary code during unpickling (See https://github.com/pytorch/pytorch/blob/main/SECURITY.md#untrusted-models for more details). In a future release, the default value for `weights_only` will be flipped to `True`. This limits the functions that could be executed during unpickling. Arbitrary objects will no longer be allowed to be loaded via this mode unless they are explicitly allowlisted by the user via `torch.serialization.add_safe_globals`. We recommend you start setting `weights_only=True` for any use case where you don't have full control of the loaded file. Please open an issue on GitHub for any issues related to this experimental feature.
  self.data, self.slices = torch.load(self.processed_paths[0])
