STDOUT:
Results will be saved in /home/philip/projects/ltspice_examples_code_repo/Circuit-Completion-Using-GNNs/component_classification_with_link_prediction_head/evaluation/FEGIN/results/model_FEGIN_dataset_ltspice_demos
Command line input: python main.py --data ltspice_demos --representation component_component --model FEGIN --layers 4 --hiddens 32 --batch_size 32 --lr 0.0001 --emb_size 250 --epochs 100 --save_appendix component_component_L4_H32_BS32_LR0.0001_E250 --no_val
 is saved.
-----
ltspice_demos - FEGIN
Using 4 layers, 32 hidden units, h = 2
Loading component_component representation dataset
ENTERED
Training FEGIN on component_component representation
Train: 1565, Test: 383
##################ITERATION #0 ****************************************
 epoch: 0, train_loss: 1.4103, test_loss: 1.3968, test_f1: 0.0678
 epoch: 1, train_loss: 1.3983, test_loss: 1.3881, test_f1: 0.1090
 epoch: 2, train_loss: 1.3923, test_loss: 1.3816, test_f1: 0.2427
 epoch: 3, train_loss: 1.3834, test_loss: 1.3745, test_f1: 0.2598
 epoch: 4, train_loss: 1.3755, test_loss: 1.3663, test_f1: 0.2889
 epoch: 5, train_loss: 1.3619, test_loss: 1.3569, test_f1: 0.3188
 epoch: 6, train_loss: 1.3498, test_loss: 1.3441, test_f1: 0.3193
 epoch: 7, train_loss: 1.3368, test_loss: 1.3329, test_f1: 0.3161
 epoch: 8, train_loss: 1.3179, test_loss: 1.3197, test_f1: 0.3160
 epoch: 9, train_loss: 1.3012, test_loss: 1.3086, test_f1: 0.3200
 epoch: 10, train_loss: 1.2796, test_loss: 1.2985, test_f1: 0.3303
 epoch: 11, train_loss: 1.2618, test_loss: 1.2899, test_f1: 0.3180
 epoch: 12, train_loss: 1.2422, test_loss: 1.2869, test_f1: 0.3183
 epoch: 13, train_loss: 1.2239, test_loss: 1.2842, test_f1: 0.3160
 epoch: 14, train_loss: 1.2171, test_loss: 1.2670, test_f1: 0.3528
 epoch: 15, train_loss: 1.2066, test_loss: 1.2748, test_f1: 0.3214
 epoch: 16, train_loss: 1.1978, test_loss: 1.2654, test_f1: 0.3336
 epoch: 17, train_loss: 1.1871, test_loss: 1.2720, test_f1: 0.3362
 epoch: 18, train_loss: 1.1841, test_loss: 1.2636, test_f1: 0.3553
 epoch: 19, train_loss: 1.1755, test_loss: 1.2666, test_f1: 0.3583
 epoch: 20, train_loss: 1.1775, test_loss: 1.2766, test_f1: 0.3705
 epoch: 21, train_loss: 1.1662, test_loss: 1.2655, test_f1: 0.3776
 epoch: 22, train_loss: 1.1579, test_loss: 1.2713, test_f1: 0.3606
 epoch: 23, train_loss: 1.1603, test_loss: 1.2757, test_f1: 0.3651
 epoch: 24, train_loss: 1.1598, test_loss: 1.2627, test_f1: 0.3868
 epoch: 25, train_loss: 1.1587, test_loss: 1.2706, test_f1: 0.3788
 epoch: 26, train_loss: 1.1547, test_loss: 1.2625, test_f1: 0.4113
 epoch: 27, train_loss: 1.1497, test_loss: 1.2672, test_f1: 0.4120
 epoch: 28, train_loss: 1.1427, test_loss: 1.2709, test_f1: 0.4165
 epoch: 29, train_loss: 1.1370, test_loss: 1.2697, test_f1: 0.4211
 epoch: 30, train_loss: 1.1391, test_loss: 1.2756, test_f1: 0.4131
 epoch: 31, train_loss: 1.1282, test_loss: 1.2722, test_f1: 0.4255
 epoch: 32, train_loss: 1.1341, test_loss: 1.2717, test_f1: 0.4170
 epoch: 33, train_loss: 1.1302, test_loss: 1.2774, test_f1: 0.4583
 epoch: 34, train_loss: 1.1176, test_loss: 1.2671, test_f1: 0.4546
 epoch: 35, train_loss: 1.1173, test_loss: 1.2646, test_f1: 0.4673
 epoch: 36, train_loss: 1.1052, test_loss: 1.2713, test_f1: 0.4512
 epoch: 37, train_loss: 1.1143, test_loss: 1.2766, test_f1: 0.4506
 epoch: 38, train_loss: 1.1032, test_loss: 1.2666, test_f1: 0.4545
 epoch: 39, train_loss: 1.1090, test_loss: 1.2727, test_f1: 0.4473
 epoch: 40, train_loss: 1.1031, test_loss: 1.3082, test_f1: 0.4375
 epoch: 41, train_loss: 1.1020, test_loss: 1.2866, test_f1: 0.4419
 epoch: 42, train_loss: 1.0977, test_loss: 1.2937, test_f1: 0.4331
 epoch: 43, train_loss: 1.0994, test_loss: 1.2844, test_f1: 0.4310
 epoch: 44, train_loss: 1.0857, test_loss: 1.3180, test_f1: 0.4194
 epoch: 45, train_loss: 1.0926, test_loss: 1.2972, test_f1: 0.4380
 epoch: 46, train_loss: 1.0836, test_loss: 1.3081, test_f1: 0.4506
 epoch: 47, train_loss: 1.0890, test_loss: 1.3113, test_f1: 0.4586
 epoch: 48, train_loss: 1.0801, test_loss: 1.3252, test_f1: 0.4416
 epoch: 49, train_loss: 1.0810, test_loss: 1.3251, test_f1: 0.4584
 epoch: 50, train_loss: 1.0794, test_loss: 1.3071, test_f1: 0.4436
 epoch: 51, train_loss: 1.0740, test_loss: 1.3087, test_f1: 0.4584
 epoch: 52, train_loss: 1.0623, test_loss: 1.2911, test_f1: 0.4605
 epoch: 53, train_loss: 1.0740, test_loss: 1.3112, test_f1: 0.4565
 epoch: 54, train_loss: 1.0570, test_loss: 1.3093, test_f1: 0.4640
 epoch: 55, train_loss: 1.0558, test_loss: 1.2957, test_f1: 0.4723
 epoch: 56, train_loss: 1.0665, test_loss: 1.3225, test_f1: 0.4692
 epoch: 57, train_loss: 1.0518, test_loss: 1.3025, test_f1: 0.4707
 epoch: 58, train_loss: 1.0511, test_loss: 1.3227, test_f1: 0.4703
 epoch: 59, train_loss: 1.0665, test_loss: 1.3464, test_f1: 0.4516
 epoch: 60, train_loss: 1.0655, test_loss: 1.3561, test_f1: 0.4559
 epoch: 61, train_loss: 1.0600, test_loss: 1.3232, test_f1: 0.4657
 epoch: 62, train_loss: 1.0562, test_loss: 1.3393, test_f1: 0.4569
 epoch: 63, train_loss: 1.0578, test_loss: 1.3438, test_f1: 0.4717
 epoch: 64, train_loss: 1.0499, test_loss: 1.3324, test_f1: 0.4578
 epoch: 65, train_loss: 1.0516, test_loss: 1.3449, test_f1: 0.4747
 epoch: 66, train_loss: 1.0512, test_loss: 1.3610, test_f1: 0.4785
 epoch: 67, train_loss: 1.0459, test_loss: 1.3505, test_f1: 0.4744
 epoch: 68, train_loss: 1.0451, test_loss: 1.3527, test_f1: 0.4650
 epoch: 69, train_loss: 1.0530, test_loss: 1.3683, test_f1: 0.4779
 epoch: 70, train_loss: 1.0457, test_loss: 1.3602, test_f1: 0.4626
 epoch: 71, train_loss: 1.0469, test_loss: 1.3632, test_f1: 0.4534
 epoch: 72, train_loss: 1.0431, test_loss: 1.3421, test_f1: 0.4690
 epoch: 73, train_loss: 1.0309, test_loss: 1.3540, test_f1: 0.4786
 epoch: 74, train_loss: 1.0418, test_loss: 1.3806, test_f1: 0.4605
 epoch: 75, train_loss: 1.0425, test_loss: 1.3546, test_f1: 0.4516
 epoch: 76, train_loss: 1.0288, test_loss: 1.3826, test_f1: 0.4486
 epoch: 77, train_loss: 1.0215, test_loss: 1.3679, test_f1: 0.4551
 epoch: 78, train_loss: 1.0276, test_loss: 1.3557, test_f1: 0.4645
 epoch: 79, train_loss: 1.0303, test_loss: 1.3529, test_f1: 0.4722
 epoch: 80, train_loss: 1.0341, test_loss: 1.3786, test_f1: 0.4605
 epoch: 81, train_loss: 1.0317, test_loss: 1.3810, test_f1: 0.4707
 epoch: 82, train_loss: 1.0299, test_loss: 1.3792, test_f1: 0.4700
 epoch: 83, train_loss: 1.0291, test_loss: 1.3813, test_f1: 0.4605
 epoch: 84, train_loss: 1.0241, test_loss: 1.3856, test_f1: 0.4601
 epoch: 85, train_loss: 1.0227, test_loss: 1.3867, test_f1: 0.4596
 epoch: 86, train_loss: 1.0310, test_loss: 1.3633, test_f1: 0.4534
 epoch: 87, train_loss: 1.0194, test_loss: 1.3975, test_f1: 0.4649
 epoch: 88, train_loss: 1.0183, test_loss: 1.3756, test_f1: 0.4744
 epoch: 89, train_loss: 1.0149, test_loss: 1.3522, test_f1: 0.4736
 epoch: 90, train_loss: 1.0132, test_loss: 1.3734, test_f1: 0.4658
 epoch: 91, train_loss: 1.0230, test_loss: 1.3490, test_f1: 0.4839
 epoch: 92, train_loss: 1.0053, test_loss: 1.4112, test_f1: 0.4758
 epoch: 93, train_loss: 1.0043, test_loss: 1.3772, test_f1: 0.4859
 epoch: 94, train_loss: 1.0157, test_loss: 1.3840, test_f1: 0.4833
 epoch: 95, train_loss: 1.0110, test_loss: 1.3762, test_f1: 0.4721
 epoch: 96, train_loss: 1.0066, test_loss: 1.3801, test_f1: 0.4780
 epoch: 97, train_loss: 1.0121, test_loss: 1.4054, test_f1: 0.4825
 epoch: 98, train_loss: 1.0041, test_loss: 1.4107, test_f1: 0.4748
 epoch: 99, train_loss: 1.0080, test_loss: 1.4196, test_f1: 0.4683
##################ITERATION #1 ****************************************
 epoch: 0, train_loss: 1.3636, test_loss: 1.3670, test_f1: 0.3202
 epoch: 1, train_loss: 1.3275, test_loss: 1.3381, test_f1: 0.2923
 epoch: 2, train_loss: 1.3014, test_loss: 1.3217, test_f1: 0.2945
 epoch: 3, train_loss: 1.2748, test_loss: 1.3081, test_f1: 0.2680
 epoch: 4, train_loss: 1.2600, test_loss: 1.3007, test_f1: 0.2553
 epoch: 5, train_loss: 1.2404, test_loss: 1.2893, test_f1: 0.2463
 epoch: 6, train_loss: 1.2264, test_loss: 1.2816, test_f1: 0.2368
 epoch: 7, train_loss: 1.2170, test_loss: 1.2719, test_f1: 0.2368
 epoch: 8, train_loss: 1.2103, test_loss: 1.2681, test_f1: 0.2363
 epoch: 9, train_loss: 1.2018, test_loss: 1.2602, test_f1: 0.2424
 epoch: 10, train_loss: 1.1977, test_loss: 1.2586, test_f1: 0.2409
 epoch: 11, train_loss: 1.1916, test_loss: 1.2486, test_f1: 0.2503
 epoch: 12, train_loss: 1.1788, test_loss: 1.2440, test_f1: 0.2551
 epoch: 13, train_loss: 1.1837, test_loss: 1.2481, test_f1: 0.2766
 epoch: 14, train_loss: 1.1733, test_loss: 1.2366, test_f1: 0.2752
 epoch: 15, train_loss: 1.1726, test_loss: 1.2355, test_f1: 0.3015
 epoch: 16, train_loss: 1.1635, test_loss: 1.2349, test_f1: 0.3235
 epoch: 17, train_loss: 1.1724, test_loss: 1.2300, test_f1: 0.3306
 epoch: 18, train_loss: 1.1585, test_loss: 1.2234, test_f1: 0.3135
 epoch: 19, train_loss: 1.1534, test_loss: 1.2254, test_f1: 0.3349
 epoch: 20, train_loss: 1.1549, test_loss: 1.2221, test_f1: 0.3293
 epoch: 21, train_loss: 1.1509, test_loss: 1.2164, test_f1: 0.3613
 epoch: 22, train_loss: 1.1445, test_loss: 1.2106, test_f1: 0.3703
 epoch: 23, train_loss: 1.1445, test_loss: 1.2083, test_f1: 0.3477
 epoch: 24, train_loss: 1.1385, test_loss: 1.2088, test_f1: 0.3694
 epoch: 25, train_loss: 1.1296, test_loss: 1.2048, test_f1: 0.3685
 epoch: 26, train_loss: 1.1360, test_loss: 1.2091, test_f1: 0.3674
 epoch: 27, train_loss: 1.1210, test_loss: 1.2028, test_f1: 0.3792
 epoch: 28, train_loss: 1.1272, test_loss: 1.1981, test_f1: 0.3871
 epoch: 29, train_loss: 1.1256, test_loss: 1.1927, test_f1: 0.3882
 epoch: 30, train_loss: 1.1141, test_loss: 1.2018, test_f1: 0.3856
 epoch: 31, train_loss: 1.1189, test_loss: 1.1903, test_f1: 0.3869
 epoch: 32, train_loss: 1.1128, test_loss: 1.1894, test_f1: 0.3787
 epoch: 33, train_loss: 1.1098, test_loss: 1.1893, test_f1: 0.3930
 epoch: 34, train_loss: 1.1144, test_loss: 1.1855, test_f1: 0.4018
 epoch: 35, train_loss: 1.1005, test_loss: 1.1884, test_f1: 0.4036
 epoch: 36, train_loss: 1.1098, test_loss: 1.1849, test_f1: 0.3832
 epoch: 37, train_loss: 1.0991, test_loss: 1.1841, test_f1: 0.3772
 epoch: 38, train_loss: 1.0993, test_loss: 1.1799, test_f1: 0.3781
 epoch: 39, train_loss: 1.0820, test_loss: 1.1811, test_f1: 0.3728
 epoch: 40, train_loss: 1.0817, test_loss: 1.1819, test_f1: 0.3917
 epoch: 41, train_loss: 1.0972, test_loss: 1.1755, test_f1: 0.4081
 epoch: 42, train_loss: 1.0921, test_loss: 1.1773, test_f1: 0.4029
 epoch: 43, train_loss: 1.0832, test_loss: 1.1793, test_f1: 0.4025
 epoch: 44, train_loss: 1.0791, test_loss: 1.1777, test_f1: 0.4241
 epoch: 45, train_loss: 1.0688, test_loss: 1.1732, test_f1: 0.4295
 epoch: 46, train_loss: 1.0783, test_loss: 1.1686, test_f1: 0.4509
 epoch: 47, train_loss: 1.0652, test_loss: 1.1737, test_f1: 0.4345
 epoch: 48, train_loss: 1.0675, test_loss: 1.1646, test_f1: 0.4282
 epoch: 49, train_loss: 1.0580, test_loss: 1.1706, test_f1: 0.4160
 epoch: 50, train_loss: 1.0593, test_loss: 1.1575, test_f1: 0.4432
 epoch: 51, train_loss: 1.0537, test_loss: 1.1602, test_f1: 0.4285
 epoch: 52, train_loss: 1.0674, test_loss: 1.1613, test_f1: 0.4264
 epoch: 53, train_loss: 1.0569, test_loss: 1.1597, test_f1: 0.4258
 epoch: 54, train_loss: 1.0594, test_loss: 1.1572, test_f1: 0.4401
 epoch: 55, train_loss: 1.0499, test_loss: 1.1523, test_f1: 0.4511
 epoch: 56, train_loss: 1.0536, test_loss: 1.1469, test_f1: 0.4586
 epoch: 57, train_loss: 1.0465, test_loss: 1.1608, test_f1: 0.4453
 epoch: 58, train_loss: 1.0349, test_loss: 1.1516, test_f1: 0.4649
 epoch: 59, train_loss: 1.0484, test_loss: 1.1409, test_f1: 0.4695
 epoch: 60, train_loss: 1.0313, test_loss: 1.1351, test_f1: 0.4599
 epoch: 61, train_loss: 1.0404, test_loss: 1.1381, test_f1: 0.4659
 epoch: 62, train_loss: 1.0457, test_loss: 1.1375, test_f1: 0.4629
 epoch: 63, train_loss: 1.0283, test_loss: 1.1354, test_f1: 0.4812
 epoch: 64, train_loss: 1.0190, test_loss: 1.1382, test_f1: 0.4699
 epoch: 65, train_loss: 1.0437, test_loss: 1.1343, test_f1: 0.4857
 epoch: 66, train_loss: 1.0356, test_loss: 1.1373, test_f1: 0.4810
 epoch: 67, train_loss: 1.0280, test_loss: 1.1359, test_f1: 0.4790
 epoch: 68, train_loss: 1.0463, test_loss: 1.1377, test_f1: 0.4817
 epoch: 69, train_loss: 1.0314, test_loss: 1.1421, test_f1: 0.4661
 epoch: 70, train_loss: 1.0227, test_loss: 1.1406, test_f1: 0.4816
 epoch: 71, train_loss: 1.0220, test_loss: 1.1385, test_f1: 0.4740
 epoch: 72, train_loss: 1.0230, test_loss: 1.1307, test_f1: 0.4793
 epoch: 73, train_loss: 1.0306, test_loss: 1.1294, test_f1: 0.4723
 epoch: 74, train_loss: 1.0188, test_loss: 1.1254, test_f1: 0.4783
 epoch: 75, train_loss: 1.0201, test_loss: 1.1347, test_f1: 0.4794
 epoch: 76, train_loss: 1.0293, test_loss: 1.1272, test_f1: 0.4773
 epoch: 77, train_loss: 1.0097, test_loss: 1.1317, test_f1: 0.4634
 epoch: 78, train_loss: 1.0161, test_loss: 1.1364, test_f1: 0.4744
 epoch: 79, train_loss: 1.0173, test_loss: 1.1253, test_f1: 0.4834
 epoch: 80, train_loss: 1.0250, test_loss: 1.1313, test_f1: 0.4770
 epoch: 81, train_loss: 1.0220, test_loss: 1.1248, test_f1: 0.4836
 epoch: 82, train_loss: 1.0170, test_loss: 1.1245, test_f1: 0.4804
 epoch: 83, train_loss: 1.0109, test_loss: 1.1182, test_f1: 0.4828
 epoch: 84, train_loss: 1.0107, test_loss: 1.1248, test_f1: 0.4793
 epoch: 85, train_loss: 1.0022, test_loss: 1.1277, test_f1: 0.4683
 epoch: 86, train_loss: 1.0116, test_loss: 1.1222, test_f1: 0.4806
 epoch: 87, train_loss: 0.9985, test_loss: 1.1162, test_f1: 0.4787
 epoch: 88, train_loss: 1.0061, test_loss: 1.1206, test_f1: 0.4855
 epoch: 89, train_loss: 0.9999, test_loss: 1.1254, test_f1: 0.4794
 epoch: 90, train_loss: 1.0076, test_loss: 1.1236, test_f1: 0.4728
 epoch: 91, train_loss: 1.0019, test_loss: 1.1187, test_f1: 0.4693
 epoch: 92, train_loss: 0.9938, test_loss: 1.1192, test_f1: 0.4750
 epoch: 93, train_loss: 0.9925, test_loss: 1.1181, test_f1: 0.4749
 epoch: 94, train_loss: 0.9910, test_loss: 1.1231, test_f1: 0.4760
 epoch: 95, train_loss: 1.0027, test_loss: 1.1204, test_f1: 0.4782
 epoch: 96, train_loss: 0.9832, test_loss: 1.1225, test_f1: 0.4712
 epoch: 97, train_loss: 0.9858, test_loss: 1.1177, test_f1: 0.4795
 epoch: 98, train_loss: 0.9831, test_loss: 1.1279, test_f1: 0.4662
 epoch: 99, train_loss: 0.9890, test_loss: 1.1252, test_f1: 0.4631
##################ITERATION #2 ****************************************
 epoch: 0, train_loss: 1.3008, test_loss: 1.3303, test_f1: 0.2975
 epoch: 1, train_loss: 1.2724, test_loss: 1.3388, test_f1: 0.2913
 epoch: 2, train_loss: 1.2561, test_loss: 1.3240, test_f1: 0.2934
 epoch: 3, train_loss: 1.2483, test_loss: 1.3572, test_f1: 0.3060
 epoch: 4, train_loss: 1.2404, test_loss: 1.3194, test_f1: 0.3113
 epoch: 5, train_loss: 1.2290, test_loss: 1.3142, test_f1: 0.3117
 epoch: 6, train_loss: 1.2257, test_loss: 1.3130, test_f1: 0.3147
 epoch: 7, train_loss: 1.2119, test_loss: 1.3019, test_f1: 0.3195
 epoch: 8, train_loss: 1.2044, test_loss: 1.3446, test_f1: 0.3204
 epoch: 9, train_loss: 1.2002, test_loss: 1.2898, test_f1: 0.3658
 epoch: 10, train_loss: 1.1921, test_loss: 1.2854, test_f1: 0.3630
 epoch: 11, train_loss: 1.1873, test_loss: 1.2792, test_f1: 0.3732
 epoch: 12, train_loss: 1.1815, test_loss: 1.2854, test_f1: 0.3915
 epoch: 13, train_loss: 1.1667, test_loss: 1.2735, test_f1: 0.3921
 epoch: 14, train_loss: 1.1721, test_loss: 1.2720, test_f1: 0.3970
 epoch: 15, train_loss: 1.1683, test_loss: 1.2662, test_f1: 0.4061
 epoch: 16, train_loss: 1.1555, test_loss: 1.2593, test_f1: 0.4132
 epoch: 17, train_loss: 1.1494, test_loss: 1.2678, test_f1: 0.4057
 epoch: 18, train_loss: 1.1443, test_loss: 1.2440, test_f1: 0.4277
 epoch: 19, train_loss: 1.1341, test_loss: 1.2399, test_f1: 0.4256
 epoch: 20, train_loss: 1.1384, test_loss: 1.2331, test_f1: 0.4301
 epoch: 21, train_loss: 1.1255, test_loss: 1.2262, test_f1: 0.4333
 epoch: 22, train_loss: 1.1141, test_loss: 1.2336, test_f1: 0.4553
 epoch: 23, train_loss: 1.1227, test_loss: 1.2399, test_f1: 0.4385
 epoch: 24, train_loss: 1.1157, test_loss: 1.2284, test_f1: 0.4565
 epoch: 25, train_loss: 1.1102, test_loss: 1.2273, test_f1: 0.4440
 epoch: 26, train_loss: 1.1124, test_loss: 1.2259, test_f1: 0.4610
 epoch: 27, train_loss: 1.1116, test_loss: 1.2214, test_f1: 0.4308
 epoch: 28, train_loss: 1.0974, test_loss: 1.2237, test_f1: 0.4477
 epoch: 29, train_loss: 1.1079, test_loss: 1.2156, test_f1: 0.4389
 epoch: 30, train_loss: 1.0939, test_loss: 1.2191, test_f1: 0.4347
 epoch: 31, train_loss: 1.0824, test_loss: 1.2055, test_f1: 0.4505
 epoch: 32, train_loss: 1.0818, test_loss: 1.2039, test_f1: 0.4298
 epoch: 33, train_loss: 1.0785, test_loss: 1.2076, test_f1: 0.4428
 epoch: 34, train_loss: 1.0795, test_loss: 1.2020, test_f1: 0.4379
 epoch: 35, train_loss: 1.0695, test_loss: 1.2143, test_f1: 0.4448
 epoch: 36, train_loss: 1.0668, test_loss: 1.2106, test_f1: 0.4476
 epoch: 37, train_loss: 1.0651, test_loss: 1.2101, test_f1: 0.4276
 epoch: 38, train_loss: 1.0616, test_loss: 1.1970, test_f1: 0.4401
 epoch: 39, train_loss: 1.0540, test_loss: 1.2028, test_f1: 0.4445
 epoch: 40, train_loss: 1.0587, test_loss: 1.2074, test_f1: 0.4406
 epoch: 41, train_loss: 1.0434, test_loss: 1.1977, test_f1: 0.4445
 epoch: 42, train_loss: 1.0475, test_loss: 1.1945, test_f1: 0.4467
 epoch: 43, train_loss: 1.0470, test_loss: 1.1970, test_f1: 0.4581
 epoch: 44, train_loss: 1.0358, test_loss: 1.1883, test_f1: 0.4632
 epoch: 45, train_loss: 1.0427, test_loss: 1.1906, test_f1: 0.4638
 epoch: 46, train_loss: 1.0362, test_loss: 1.1947, test_f1: 0.4486
 epoch: 47, train_loss: 1.0340, test_loss: 1.1850, test_f1: 0.4703
 epoch: 48, train_loss: 1.0254, test_loss: 1.1816, test_f1: 0.4516
 epoch: 49, train_loss: 1.0347, test_loss: 1.1949, test_f1: 0.4291
 epoch: 50, train_loss: 1.0248, test_loss: 1.1845, test_f1: 0.4462
 epoch: 51, train_loss: 1.0203, test_loss: 1.1768, test_f1: 0.4643
 epoch: 52, train_loss: 1.0161, test_loss: 1.1878, test_f1: 0.4488
 epoch: 53, train_loss: 1.0233, test_loss: 1.1817, test_f1: 0.4449
 epoch: 54, train_loss: 1.0211, test_loss: 1.1928, test_f1: 0.4479
 epoch: 55, train_loss: 1.0138, test_loss: 1.1849, test_f1: 0.4761
 epoch: 56, train_loss: 1.0065, test_loss: 1.1841, test_f1: 0.4719
 epoch: 57, train_loss: 1.0127, test_loss: 1.1907, test_f1: 0.4524
 epoch: 58, train_loss: 1.0055, test_loss: 1.1895, test_f1: 0.4700
 epoch: 59, train_loss: 1.0094, test_loss: 1.1910, test_f1: 0.4724
 epoch: 60, train_loss: 1.0071, test_loss: 1.2031, test_f1: 0.4669
 epoch: 61, train_loss: 1.0079, test_loss: 1.1880, test_f1: 0.4799
 epoch: 62, train_loss: 1.0051, test_loss: 1.1915, test_f1: 0.5107
 epoch: 63, train_loss: 1.0101, test_loss: 1.1896, test_f1: 0.5048
 epoch: 64, train_loss: 1.0055, test_loss: 1.1972, test_f1: 0.4735
 epoch: 65, train_loss: 1.0145, test_loss: 1.1885, test_f1: 0.4837
 epoch: 66, train_loss: 1.0039, test_loss: 1.2004, test_f1: 0.4883
 epoch: 67, train_loss: 1.0008, test_loss: 1.1999, test_f1: 0.4789
 epoch: 68, train_loss: 1.0016, test_loss: 1.1877, test_f1: 0.4934
 epoch: 69, train_loss: 0.9823, test_loss: 1.1954, test_f1: 0.4910
 epoch: 70, train_loss: 1.0031, test_loss: 1.1931, test_f1: 0.4983
 epoch: 71, train_loss: 0.9996, test_loss: 1.1946, test_f1: 0.4631
 epoch: 72, train_loss: 0.9994, test_loss: 1.1934, test_f1: 0.4719
 epoch: 73, train_loss: 0.9819, test_loss: 1.2021, test_f1: 0.4579
 epoch: 74, train_loss: 1.0028, test_loss: 1.2046, test_f1: 0.4689
 epoch: 75, train_loss: 0.9937, test_loss: 1.2103, test_f1: 0.4584
 epoch: 76, train_loss: 0.9870, test_loss: 1.1963, test_f1: 0.4785
 epoch: 77, train_loss: 0.9949, test_loss: 1.2068, test_f1: 0.4642
 epoch: 78, train_loss: 0.9927, test_loss: 1.2224, test_f1: 0.4622
 epoch: 79, train_loss: 0.9976, test_loss: 1.1951, test_f1: 0.4761
 epoch: 80, train_loss: 0.9916, test_loss: 1.2103, test_f1: 0.4803
 epoch: 81, train_loss: 0.9929, test_loss: 1.2110, test_f1: 0.4759
 epoch: 82, train_loss: 0.9914, test_loss: 1.2124, test_f1: 0.4852
 epoch: 83, train_loss: 0.9875, test_loss: 1.2122, test_f1: 0.4804
 epoch: 84, train_loss: 0.9769, test_loss: 1.2007, test_f1: 0.4842
 epoch: 85, train_loss: 0.9851, test_loss: 1.2276, test_f1: 0.4624
 epoch: 86, train_loss: 0.9844, test_loss: 1.2183, test_f1: 0.4804
 epoch: 87, train_loss: 0.9797, test_loss: 1.2184, test_f1: 0.4758
 epoch: 88, train_loss: 0.9728, test_loss: 1.2287, test_f1: 0.4774
 epoch: 89, train_loss: 0.9831, test_loss: 1.2170, test_f1: 0.4802
 epoch: 90, train_loss: 0.9771, test_loss: 1.2142, test_f1: 0.4835
 epoch: 91, train_loss: 0.9787, test_loss: 1.2253, test_f1: 0.4813
 epoch: 92, train_loss: 0.9805, test_loss: 1.2365, test_f1: 0.4778
 epoch: 93, train_loss: 0.9786, test_loss: 1.2169, test_f1: 0.4830
 epoch: 94, train_loss: 0.9813, test_loss: 1.2341, test_f1: 0.4866
 epoch: 95, train_loss: 0.9826, test_loss: 1.2259, test_f1: 0.4893
 epoch: 96, train_loss: 0.9714, test_loss: 1.2332, test_f1: 0.4872
 epoch: 97, train_loss: 0.9671, test_loss: 1.2350, test_f1: 0.4862
 epoch: 98, train_loss: 0.9726, test_loss: 1.2164, test_f1: 0.4913
 epoch: 99, train_loss: 0.9744, test_loss: 1.2310, test_f1: 0.4921
##################ITERATION #3 ****************************************
 epoch: 0, train_loss: 1.3133, test_loss: 1.3216, test_f1: 0.2281
 epoch: 1, train_loss: 1.2788, test_loss: 1.3085, test_f1: 0.2391
 epoch: 2, train_loss: 1.2639, test_loss: 1.2996, test_f1: 0.2336
 epoch: 3, train_loss: 1.2453, test_loss: 1.2912, test_f1: 0.2439
 epoch: 4, train_loss: 1.2330, test_loss: 1.2874, test_f1: 0.2363
 epoch: 5, train_loss: 1.2272, test_loss: 1.2717, test_f1: 0.2597
 epoch: 6, train_loss: 1.2126, test_loss: 1.2655, test_f1: 0.2590
 epoch: 7, train_loss: 1.1982, test_loss: 1.2623, test_f1: 0.2630
 epoch: 8, train_loss: 1.1935, test_loss: 1.2670, test_f1: 0.2913
 epoch: 9, train_loss: 1.1915, test_loss: 1.2643, test_f1: 0.2965
 epoch: 10, train_loss: 1.1795, test_loss: 1.2527, test_f1: 0.3218
 epoch: 11, train_loss: 1.1750, test_loss: 1.2513, test_f1: 0.3053
 epoch: 12, train_loss: 1.1700, test_loss: 1.2363, test_f1: 0.2965
 epoch: 13, train_loss: 1.1647, test_loss: 1.2430, test_f1: 0.3043
 epoch: 14, train_loss: 1.1579, test_loss: 1.2413, test_f1: 0.3103
 epoch: 15, train_loss: 1.1572, test_loss: 1.2494, test_f1: 0.3250
 epoch: 16, train_loss: 1.1456, test_loss: 1.2482, test_f1: 0.3169
 epoch: 17, train_loss: 1.1443, test_loss: 1.2597, test_f1: 0.3137
 epoch: 18, train_loss: 1.1312, test_loss: 1.2627, test_f1: 0.3172
 epoch: 19, train_loss: 1.1336, test_loss: 1.2654, test_f1: 0.3390
 epoch: 20, train_loss: 1.1347, test_loss: 1.2629, test_f1: 0.3269
 epoch: 21, train_loss: 1.1229, test_loss: 1.2491, test_f1: 0.3170
 epoch: 22, train_loss: 1.1203, test_loss: 1.2653, test_f1: 0.3181
 epoch: 23, train_loss: 1.1197, test_loss: 1.2576, test_f1: 0.3207
 epoch: 24, train_loss: 1.1227, test_loss: 1.2670, test_f1: 0.3111
 epoch: 25, train_loss: 1.1113, test_loss: 1.2675, test_f1: 0.3124
 epoch: 26, train_loss: 1.1181, test_loss: 1.2585, test_f1: 0.3158
 epoch: 27, train_loss: 1.1016, test_loss: 1.2662, test_f1: 0.3098
 epoch: 28, train_loss: 1.1115, test_loss: 1.2559, test_f1: 0.3201
 epoch: 29, train_loss: 1.1002, test_loss: 1.2642, test_f1: 0.3165
 epoch: 30, train_loss: 1.0930, test_loss: 1.2541, test_f1: 0.3147
 epoch: 31, train_loss: 1.0928, test_loss: 1.2555, test_f1: 0.3197
 epoch: 32, train_loss: 1.0809, test_loss: 1.2622, test_f1: 0.3216
 epoch: 33, train_loss: 1.0824, test_loss: 1.2638, test_f1: 0.3104
 epoch: 34, train_loss: 1.0883, test_loss: 1.2577, test_f1: 0.3344
 epoch: 35, train_loss: 1.0825, test_loss: 1.2487, test_f1: 0.3218
 epoch: 36, train_loss: 1.0769, test_loss: 1.2559, test_f1: 0.3287
 epoch: 37, train_loss: 1.0782, test_loss: 1.2566, test_f1: 0.3244
 epoch: 38, train_loss: 1.0761, test_loss: 1.2653, test_f1: 0.3642
 epoch: 39, train_loss: 1.0785, test_loss: 1.2633, test_f1: 0.3374
 epoch: 40, train_loss: 1.0609, test_loss: 1.2392, test_f1: 0.3461
 epoch: 41, train_loss: 1.0641, test_loss: 1.2576, test_f1: 0.3368
 epoch: 42, train_loss: 1.0546, test_loss: 1.2605, test_f1: 0.3509
 epoch: 43, train_loss: 1.0662, test_loss: 1.2915, test_f1: 0.3356
 epoch: 44, train_loss: 1.0511, test_loss: 1.2550, test_f1: 0.3483
 epoch: 45, train_loss: 1.0493, test_loss: 1.2490, test_f1: 0.3576
 epoch: 46, train_loss: 1.0585, test_loss: 1.2409, test_f1: 0.3393
 epoch: 47, train_loss: 1.0578, test_loss: 1.2556, test_f1: 0.3354
 epoch: 48, train_loss: 1.0547, test_loss: 1.2660, test_f1: 0.3406
 epoch: 49, train_loss: 1.0539, test_loss: 1.2365, test_f1: 0.3437
 epoch: 50, train_loss: 1.0568, test_loss: 1.2408, test_f1: 0.3484
 epoch: 51, train_loss: 1.0553, test_loss: 1.2693, test_f1: 0.3305
 epoch: 52, train_loss: 1.0439, test_loss: 1.2638, test_f1: 0.3247
 epoch: 53, train_loss: 1.0312, test_loss: 1.2486, test_f1: 0.3407
 epoch: 54, train_loss: 1.0425, test_loss: 1.2369, test_f1: 0.3538
 epoch: 55, train_loss: 1.0316, test_loss: 1.2521, test_f1: 0.3343
 epoch: 56, train_loss: 1.0261, test_loss: 1.2440, test_f1: 0.3397
 epoch: 57, train_loss: 1.0515, test_loss: 1.2224, test_f1: 0.3372
 epoch: 58, train_loss: 1.0485, test_loss: 1.2438, test_f1: 0.3482
 epoch: 59, train_loss: 1.0367, test_loss: 1.2723, test_f1: 0.3357
 epoch: 60, train_loss: 1.0250, test_loss: 1.2456, test_f1: 0.3463
 epoch: 61, train_loss: 1.0366, test_loss: 1.2522, test_f1: 0.3433
 epoch: 62, train_loss: 1.0347, test_loss: 1.2592, test_f1: 0.3366
 epoch: 63, train_loss: 1.0281, test_loss: 1.2562, test_f1: 0.3466
 epoch: 64, train_loss: 1.0298, test_loss: 1.2572, test_f1: 0.3486
 epoch: 65, train_loss: 1.0257, test_loss: 1.2584, test_f1: 0.3464
 epoch: 66, train_loss: 1.0257, test_loss: 1.2504, test_f1: 0.3455
 epoch: 67, train_loss: 1.0266, test_loss: 1.2632, test_f1: 0.3655
 epoch: 68, train_loss: 1.0323, test_loss: 1.2701, test_f1: 0.3448
 epoch: 69, train_loss: 1.0194, test_loss: 1.2519, test_f1: 0.3538
 epoch: 70, train_loss: 1.0194, test_loss: 1.2387, test_f1: 0.3640
 epoch: 71, train_loss: 1.0079, test_loss: 1.2844, test_f1: 0.3482
 epoch: 72, train_loss: 1.0136, test_loss: 1.2496, test_f1: 0.3579
 epoch: 73, train_loss: 1.0234, test_loss: 1.2796, test_f1: 0.3588
 epoch: 74, train_loss: 1.0272, test_loss: 1.2536, test_f1: 0.3603
 epoch: 75, train_loss: 1.0179, test_loss: 1.2572, test_f1: 0.3603
 epoch: 76, train_loss: 1.0229, test_loss: 1.2679, test_f1: 0.3483
 epoch: 77, train_loss: 1.0128, test_loss: 1.2570, test_f1: 0.3555
 epoch: 78, train_loss: 1.0066, test_loss: 1.2705, test_f1: 0.3646
 epoch: 79, train_loss: 1.0083, test_loss: 1.2704, test_f1: 0.3560
 epoch: 80, train_loss: 1.0092, test_loss: 1.2891, test_f1: 0.3868
 epoch: 81, train_loss: 1.0123, test_loss: 1.2699, test_f1: 0.3655
 epoch: 82, train_loss: 1.0042, test_loss: 1.2840, test_f1: 0.3808
 epoch: 83, train_loss: 1.0184, test_loss: 1.2592, test_f1: 0.3749
 epoch: 84, train_loss: 1.0198, test_loss: 1.2864, test_f1: 0.3890
 epoch: 85, train_loss: 1.0043, test_loss: 1.2856, test_f1: 0.3895
 epoch: 86, train_loss: 1.0145, test_loss: 1.3097, test_f1: 0.3880
 epoch: 87, train_loss: 1.0053, test_loss: 1.2995, test_f1: 0.4000
 epoch: 88, train_loss: 0.9904, test_loss: 1.2909, test_f1: 0.3986
 epoch: 89, train_loss: 0.9831, test_loss: 1.2728, test_f1: 0.4231
 epoch: 90, train_loss: 0.9952, test_loss: 1.2787, test_f1: 0.4005
 epoch: 91, train_loss: 0.9964, test_loss: 1.2807, test_f1: 0.4250
 epoch: 92, train_loss: 1.0098, test_loss: 1.2822, test_f1: 0.4448
 epoch: 93, train_loss: 1.0097, test_loss: 1.2901, test_f1: 0.4358
 epoch: 94, train_loss: 0.9891, test_loss: 1.2707, test_f1: 0.4182
 epoch: 95, train_loss: 0.9906, test_loss: 1.2522, test_f1: 0.4002
 epoch: 96, train_loss: 1.0065, test_loss: 1.2888, test_f1: 0.4504
 epoch: 97, train_loss: 0.9888, test_loss: 1.3141, test_f1: 0.4399
 epoch: 98, train_loss: 0.9858, test_loss: 1.2985, test_f1: 0.4445
 epoch: 99, train_loss: 0.9791, test_loss: 1.3117, test_f1: 0.4403
##################ITERATION #4 ****************************************
 epoch: 0, train_loss: 1.2887, test_loss: 1.3373, test_f1: 0.2401
 epoch: 1, train_loss: 1.2625, test_loss: 1.3301, test_f1: 0.2570
 epoch: 2, train_loss: 1.2365, test_loss: 1.3228, test_f1: 0.2563
 epoch: 3, train_loss: 1.2237, test_loss: 1.3395, test_f1: 0.2767
 epoch: 4, train_loss: 1.2223, test_loss: 1.3234, test_f1: 0.2740
 epoch: 5, train_loss: 1.2094, test_loss: 1.3171, test_f1: 0.2915
 epoch: 6, train_loss: 1.2001, test_loss: 1.3088, test_f1: 0.3014
 epoch: 7, train_loss: 1.1881, test_loss: 1.3256, test_f1: 0.3015
 epoch: 8, train_loss: 1.1845, test_loss: 1.3201, test_f1: 0.3179
 epoch: 9, train_loss: 1.1662, test_loss: 1.3157, test_f1: 0.3345
 epoch: 10, train_loss: 1.1734, test_loss: 1.3214, test_f1: 0.3691
 epoch: 11, train_loss: 1.1573, test_loss: 1.2947, test_f1: 0.3995
 epoch: 12, train_loss: 1.1559, test_loss: 1.2960, test_f1: 0.3829
 epoch: 13, train_loss: 1.1428, test_loss: 1.2926, test_f1: 0.3939
 epoch: 14, train_loss: 1.1377, test_loss: 1.2835, test_f1: 0.3859
 epoch: 15, train_loss: 1.1366, test_loss: 1.3082, test_f1: 0.3902
 epoch: 16, train_loss: 1.1233, test_loss: 1.3040, test_f1: 0.3903
 epoch: 17, train_loss: 1.1296, test_loss: 1.2949, test_f1: 0.3929
 epoch: 18, train_loss: 1.1185, test_loss: 1.3005, test_f1: 0.3945
 epoch: 19, train_loss: 1.1109, test_loss: 1.3199, test_f1: 0.3974
 epoch: 20, train_loss: 1.1078, test_loss: 1.2749, test_f1: 0.3915
 epoch: 21, train_loss: 1.1086, test_loss: 1.2817, test_f1: 0.4000
 epoch: 22, train_loss: 1.1141, test_loss: 1.2738, test_f1: 0.3973
 epoch: 23, train_loss: 1.1118, test_loss: 1.2797, test_f1: 0.4070
 epoch: 24, train_loss: 1.1076, test_loss: 1.2846, test_f1: 0.4014
 epoch: 25, train_loss: 1.0856, test_loss: 1.2664, test_f1: 0.4042
 epoch: 26, train_loss: 1.0876, test_loss: 1.2801, test_f1: 0.4106
 epoch: 27, train_loss: 1.1003, test_loss: 1.2540, test_f1: 0.4138
 epoch: 28, train_loss: 1.0860, test_loss: 1.2825, test_f1: 0.4116
 epoch: 29, train_loss: 1.0887, test_loss: 1.2596, test_f1: 0.4191
 epoch: 30, train_loss: 1.0850, test_loss: 1.2610, test_f1: 0.4191
 epoch: 31, train_loss: 1.0756, test_loss: 1.2982, test_f1: 0.4227
 epoch: 32, train_loss: 1.0743, test_loss: 1.2728, test_f1: 0.4164
 epoch: 33, train_loss: 1.0848, test_loss: 1.2545, test_f1: 0.4171
 epoch: 34, train_loss: 1.0743, test_loss: 1.2702, test_f1: 0.4236
 epoch: 35, train_loss: 1.0718, test_loss: 1.2764, test_f1: 0.4151
 epoch: 36, train_loss: 1.0759, test_loss: 1.2519, test_f1: 0.4181
 epoch: 37, train_loss: 1.0588, test_loss: 1.2440, test_f1: 0.4155
 epoch: 38, train_loss: 1.0591, test_loss: 1.2819, test_f1: 0.4177
 epoch: 39, train_loss: 1.0553, test_loss: 1.2433, test_f1: 0.4039
 epoch: 40, train_loss: 1.0515, test_loss: 1.2897, test_f1: 0.4238
 epoch: 41, train_loss: 1.0426, test_loss: 1.2657, test_f1: 0.4240
 epoch: 42, train_loss: 1.0549, test_loss: 1.2772, test_f1: 0.4230
 epoch: 43, train_loss: 1.0542, test_loss: 1.2585, test_f1: 0.4391
 epoch: 44, train_loss: 1.0436, test_loss: 1.2356, test_f1: 0.4323
 epoch: 45, train_loss: 1.0354, test_loss: 1.2400, test_f1: 0.4474
 epoch: 46, train_loss: 1.0386, test_loss: 1.2586, test_f1: 0.4532
 epoch: 47, train_loss: 1.0322, test_loss: 1.2358, test_f1: 0.4482
 epoch: 48, train_loss: 1.0288, test_loss: 1.2235, test_f1: 0.4758
 epoch: 49, train_loss: 1.0306, test_loss: 1.2587, test_f1: 0.4662
 epoch: 50, train_loss: 1.0338, test_loss: 1.2705, test_f1: 0.4481
 epoch: 51, train_loss: 1.0194, test_loss: 1.2842, test_f1: 0.4599
 epoch: 52, train_loss: 1.0274, test_loss: 1.2386, test_f1: 0.4727
 epoch: 53, train_loss: 1.0302, test_loss: 1.2561, test_f1: 0.4711
 epoch: 54, train_loss: 1.0299, test_loss: 1.2511, test_f1: 0.4834
 epoch: 55, train_loss: 1.0259, test_loss: 1.2356, test_f1: 0.4742
 epoch: 56, train_loss: 1.0226, test_loss: 1.2435, test_f1: 0.4740
 epoch: 57, train_loss: 1.0231, test_loss: 1.2282, test_f1: 0.4888
 epoch: 58, train_loss: 1.0230, test_loss: 1.2231, test_f1: 0.4741
 epoch: 59, train_loss: 1.0199, test_loss: 1.2377, test_f1: 0.4834
 epoch: 60, train_loss: 1.0189, test_loss: 1.2431, test_f1: 0.4783
 epoch: 61, train_loss: 1.0021, test_loss: 1.2237, test_f1: 0.4806
 epoch: 62, train_loss: 1.0121, test_loss: 1.2304, test_f1: 0.4790
 epoch: 63, train_loss: 1.0002, test_loss: 1.2550, test_f1: 0.4881
 epoch: 64, train_loss: 1.0135, test_loss: 1.2351, test_f1: 0.4799
 epoch: 65, train_loss: 1.0043, test_loss: 1.2474, test_f1: 0.4820
 epoch: 66, train_loss: 1.0115, test_loss: 1.2452, test_f1: 0.4844
 epoch: 67, train_loss: 1.0007, test_loss: 1.2469, test_f1: 0.4959
 epoch: 68, train_loss: 1.0166, test_loss: 1.2131, test_f1: 0.4891
 epoch: 69, train_loss: 1.0153, test_loss: 1.2329, test_f1: 0.4928
 epoch: 70, train_loss: 1.0007, test_loss: 1.2379, test_f1: 0.4933
 epoch: 71, train_loss: 1.0075, test_loss: 1.2320, test_f1: 0.4943
 epoch: 72, train_loss: 1.0053, test_loss: 1.2438, test_f1: 0.4858
 epoch: 73, train_loss: 1.0013, test_loss: 1.2401, test_f1: 0.5044
 epoch: 74, train_loss: 1.0026, test_loss: 1.2285, test_f1: 0.4952
 epoch: 75, train_loss: 1.0025, test_loss: 1.2394, test_f1: 0.4957
 epoch: 76, train_loss: 0.9890, test_loss: 1.2406, test_f1: 0.4904
 epoch: 77, train_loss: 0.9911, test_loss: 1.2310, test_f1: 0.4914
 epoch: 78, train_loss: 0.9937, test_loss: 1.2148, test_f1: 0.5055
 epoch: 79, train_loss: 1.0003, test_loss: 1.2329, test_f1: 0.5075
 epoch: 80, train_loss: 1.0012, test_loss: 1.2341, test_f1: 0.5238
 epoch: 81, train_loss: 0.9938, test_loss: 1.2262, test_f1: 0.5217
 epoch: 82, train_loss: 0.9852, test_loss: 1.2372, test_f1: 0.5163
 epoch: 83, train_loss: 0.9894, test_loss: 1.2434, test_f1: 0.5060
 epoch: 84, train_loss: 0.9868, test_loss: 1.2376, test_f1: 0.5016
 epoch: 85, train_loss: 0.9882, test_loss: 1.2607, test_f1: 0.4883
 epoch: 86, train_loss: 0.9786, test_loss: 1.2526, test_f1: 0.4954
 epoch: 87, train_loss: 0.9783, test_loss: 1.2146, test_f1: 0.5323
 epoch: 88, train_loss: 0.9881, test_loss: 1.2338, test_f1: 0.5161
 epoch: 89, train_loss: 0.9720, test_loss: 1.2525, test_f1: 0.5201
 epoch: 90, train_loss: 1.0006, test_loss: 1.2347, test_f1: 0.5004
 epoch: 91, train_loss: 0.9799, test_loss: 1.2546, test_f1: 0.4892
 epoch: 92, train_loss: 0.9756, test_loss: 1.2372, test_f1: 0.5126
 epoch: 93, train_loss: 0.9840, test_loss: 1.2305, test_f1: 0.5217
 epoch: 94, train_loss: 0.9911, test_loss: 1.2398, test_f1: 0.5320
 epoch: 95, train_loss: 0.9643, test_loss: 1.2434, test_f1: 0.4867
 epoch: 96, train_loss: 0.9696, test_loss: 1.2230, test_f1: 0.5421
 epoch: 97, train_loss: 0.9780, test_loss: 1.2178, test_f1: 0.4918
 epoch: 98, train_loss: 0.9724, test_loss: 1.2478, test_f1: 0.4769
 epoch: 99, train_loss: 0.9779, test_loss: 1.2135, test_f1: 0.5121
##################ITERATION #5 ****************************************
 epoch: 0, train_loss: 1.3058, test_loss: 1.3586, test_f1: 0.2563
 epoch: 1, train_loss: 1.2736, test_loss: 1.3302, test_f1: 0.2706
 epoch: 2, train_loss: 1.2471, test_loss: 1.3348, test_f1: 0.3296
 epoch: 3, train_loss: 1.2330, test_loss: 1.3378, test_f1: 0.3356
 epoch: 4, train_loss: 1.2426, test_loss: 1.3212, test_f1: 0.3270
 epoch: 5, train_loss: 1.2331, test_loss: 1.3350, test_f1: 0.3379
 epoch: 6, train_loss: 1.2069, test_loss: 1.3329, test_f1: 0.3362
 epoch: 7, train_loss: 1.2054, test_loss: 1.3226, test_f1: 0.3403
 epoch: 8, train_loss: 1.2003, test_loss: 1.3105, test_f1: 0.3393
 epoch: 9, train_loss: 1.1947, test_loss: 1.3116, test_f1: 0.3424
 epoch: 10, train_loss: 1.1868, test_loss: 1.3054, test_f1: 0.3684
 epoch: 11, train_loss: 1.1836, test_loss: 1.3000, test_f1: 0.3767
 epoch: 12, train_loss: 1.1783, test_loss: 1.3042, test_f1: 0.3865
 epoch: 13, train_loss: 1.1482, test_loss: 1.2840, test_f1: 0.4094
 epoch: 14, train_loss: 1.1484, test_loss: 1.2873, test_f1: 0.4099
 epoch: 15, train_loss: 1.1474, test_loss: 1.2664, test_f1: 0.4156
 epoch: 16, train_loss: 1.1426, test_loss: 1.2665, test_f1: 0.4287
 epoch: 17, train_loss: 1.1455, test_loss: 1.2562, test_f1: 0.4202
 epoch: 18, train_loss: 1.1303, test_loss: 1.2492, test_f1: 0.4247
 epoch: 19, train_loss: 1.1297, test_loss: 1.2373, test_f1: 0.4315
 epoch: 20, train_loss: 1.1216, test_loss: 1.2432, test_f1: 0.4217
 epoch: 21, train_loss: 1.1080, test_loss: 1.2418, test_f1: 0.4030
 epoch: 22, train_loss: 1.1024, test_loss: 1.2294, test_f1: 0.4192
 epoch: 23, train_loss: 1.0969, test_loss: 1.2493, test_f1: 0.4290
 epoch: 24, train_loss: 1.0976, test_loss: 1.2327, test_f1: 0.4287
 epoch: 25, train_loss: 1.0888, test_loss: 1.2297, test_f1: 0.4493
 epoch: 26, train_loss: 1.0875, test_loss: 1.2405, test_f1: 0.4504
 epoch: 27, train_loss: 1.0812, test_loss: 1.2589, test_f1: 0.4250
 epoch: 28, train_loss: 1.0728, test_loss: 1.2243, test_f1: 0.4231
 epoch: 29, train_loss: 1.0833, test_loss: 1.2201, test_f1: 0.4435
 epoch: 30, train_loss: 1.0658, test_loss: 1.2439, test_f1: 0.4421
 epoch: 31, train_loss: 1.0564, test_loss: 1.2408, test_f1: 0.4509
 epoch: 32, train_loss: 1.0550, test_loss: 1.2241, test_f1: 0.4648
 epoch: 33, train_loss: 1.0659, test_loss: 1.2262, test_f1: 0.4345
 epoch: 34, train_loss: 1.0740, test_loss: 1.2314, test_f1: 0.4424
 epoch: 35, train_loss: 1.0526, test_loss: 1.2317, test_f1: 0.4702
 epoch: 36, train_loss: 1.0461, test_loss: 1.2341, test_f1: 0.4713
 epoch: 37, train_loss: 1.0449, test_loss: 1.2304, test_f1: 0.4549
 epoch: 38, train_loss: 1.0505, test_loss: 1.2331, test_f1: 0.4642
 epoch: 39, train_loss: 1.0496, test_loss: 1.2361, test_f1: 0.4628
 epoch: 40, train_loss: 1.0381, test_loss: 1.2407, test_f1: 0.4708
 epoch: 41, train_loss: 1.0287, test_loss: 1.2477, test_f1: 0.4679
 epoch: 42, train_loss: 1.0303, test_loss: 1.2444, test_f1: 0.4680
 epoch: 43, train_loss: 1.0359, test_loss: 1.2590, test_f1: 0.4426
 epoch: 44, train_loss: 1.0323, test_loss: 1.2335, test_f1: 0.4670
 epoch: 45, train_loss: 1.0231, test_loss: 1.2651, test_f1: 0.4296
 epoch: 46, train_loss: 1.0215, test_loss: 1.2561, test_f1: 0.4451
 epoch: 47, train_loss: 1.0273, test_loss: 1.2396, test_f1: 0.4609
 epoch: 48, train_loss: 1.0158, test_loss: 1.2682, test_f1: 0.4248
 epoch: 49, train_loss: 1.0038, test_loss: 1.2288, test_f1: 0.4630
 epoch: 50, train_loss: 1.0122, test_loss: 1.3065, test_f1: 0.4458
 epoch: 51, train_loss: 1.0095, test_loss: 1.2650, test_f1: 0.4528
 epoch: 52, train_loss: 1.0029, test_loss: 1.2397, test_f1: 0.4722
 epoch: 53, train_loss: 1.0228, test_loss: 1.2463, test_f1: 0.4199
 epoch: 54, train_loss: 1.0046, test_loss: 1.2723, test_f1: 0.4438
 epoch: 55, train_loss: 1.0069, test_loss: 1.3550, test_f1: 0.4448
 epoch: 56, train_loss: 1.0112, test_loss: 1.3548, test_f1: 0.4587
 epoch: 57, train_loss: 0.9853, test_loss: 1.2982, test_f1: 0.4762
 epoch: 58, train_loss: 0.9954, test_loss: 1.2889, test_f1: 0.4855
 epoch: 59, train_loss: 1.0077, test_loss: 1.2879, test_f1: 0.4589
 epoch: 60, train_loss: 1.0063, test_loss: 1.2823, test_f1: 0.4404
 epoch: 61, train_loss: 0.9888, test_loss: 1.2805, test_f1: 0.4762
 epoch: 62, train_loss: 0.9908, test_loss: 1.2984, test_f1: 0.4880
 epoch: 63, train_loss: 0.9957, test_loss: 1.2610, test_f1: 0.4835
 epoch: 64, train_loss: 0.9849, test_loss: 1.2569, test_f1: 0.4822
 epoch: 65, train_loss: 1.0078, test_loss: 1.2746, test_f1: 0.4944
 epoch: 66, train_loss: 0.9949, test_loss: 1.2727, test_f1: 0.4918
 epoch: 67, train_loss: 0.9895, test_loss: 1.2712, test_f1: 0.4957
 epoch: 68, train_loss: 0.9749, test_loss: 1.2798, test_f1: 0.4623
 epoch: 69, train_loss: 1.0037, test_loss: 1.2577, test_f1: 0.4849
 epoch: 70, train_loss: 0.9786, test_loss: 1.3156, test_f1: 0.4818
 epoch: 71, train_loss: 0.9807, test_loss: 1.2838, test_f1: 0.5053
 epoch: 72, train_loss: 0.9875, test_loss: 1.3097, test_f1: 0.4737
 epoch: 73, train_loss: 0.9855, test_loss: 1.3256, test_f1: 0.4741
 epoch: 74, train_loss: 0.9861, test_loss: 1.3406, test_f1: 0.4905
 epoch: 75, train_loss: 0.9762, test_loss: 1.3089, test_f1: 0.4775
 epoch: 76, train_loss: 0.9833, test_loss: 1.3146, test_f1: 0.4854
 epoch: 77, train_loss: 0.9793, test_loss: 1.2874, test_f1: 0.4951
 epoch: 78, train_loss: 0.9947, test_loss: 1.2693, test_f1: 0.5045
 epoch: 79, train_loss: 0.9860, test_loss: 1.2992, test_f1: 0.5093
 epoch: 80, train_loss: 0.9822, test_loss: 1.2894, test_f1: 0.5012
 epoch: 81, train_loss: 0.9811, test_loss: 1.3189, test_f1: 0.5054
 epoch: 82, train_loss: 0.9760, test_loss: 1.2794, test_f1: 0.5093
 epoch: 83, train_loss: 0.9814, test_loss: 1.2734, test_f1: 0.4938
 epoch: 84, train_loss: 0.9831, test_loss: 1.2809, test_f1: 0.5027
 epoch: 85, train_loss: 0.9732, test_loss: 1.3089, test_f1: 0.5136
 epoch: 86, train_loss: 0.9777, test_loss: 1.3070, test_f1: 0.5055
 epoch: 87, train_loss: 0.9690, test_loss: 1.3072, test_f1: 0.5017
 epoch: 88, train_loss: 0.9757, test_loss: 1.3138, test_f1: 0.4925
 epoch: 89, train_loss: 0.9710, test_loss: 1.2782, test_f1: 0.4946
 epoch: 90, train_loss: 0.9784, test_loss: 1.2997, test_f1: 0.4949
 epoch: 91, train_loss: 0.9649, test_loss: 1.3130, test_f1: 0.4928
 epoch: 92, train_loss: 0.9852, test_loss: 1.3152, test_f1: 0.4894
 epoch: 93, train_loss: 0.9602, test_loss: 1.3315, test_f1: 0.5064
 epoch: 94, train_loss: 0.9561, test_loss: 1.3292, test_f1: 0.4996
 epoch: 95, train_loss: 0.9604, test_loss: 1.2830, test_f1: 0.5164
 epoch: 96, train_loss: 0.9606, test_loss: 1.3427, test_f1: 0.4980
 epoch: 97, train_loss: 0.9495, test_loss: 1.2752, test_f1: 0.4847
 epoch: 98, train_loss: 0.9542, test_loss: 1.3406, test_f1: 0.4945
 epoch: 99, train_loss: 0.9649, test_loss: 1.2993, test_f1: 0.4794
##################ITERATION #6 ****************************************
 epoch: 0, train_loss: 1.2605, test_loss: 1.3039, test_f1: 0.2463
 epoch: 1, train_loss: 1.2298, test_loss: 1.3372, test_f1: 0.3125
 epoch: 2, train_loss: 1.2252, test_loss: 1.3298, test_f1: 0.3208
 epoch: 3, train_loss: 1.2112, test_loss: 1.3349, test_f1: 0.3286
 epoch: 4, train_loss: 1.2065, test_loss: 1.3467, test_f1: 0.3553
 epoch: 5, train_loss: 1.1975, test_loss: 1.3067, test_f1: 0.3562
 epoch: 6, train_loss: 1.1874, test_loss: 1.3279, test_f1: 0.3673
 epoch: 7, train_loss: 1.1863, test_loss: 1.3390, test_f1: 0.3687
 epoch: 8, train_loss: 1.1800, test_loss: 1.2737, test_f1: 0.3817
 epoch: 9, train_loss: 1.1652, test_loss: 1.2713, test_f1: 0.3626
 epoch: 10, train_loss: 1.1645, test_loss: 1.2933, test_f1: 0.3642
 epoch: 11, train_loss: 1.1529, test_loss: 1.2725, test_f1: 0.3918
 epoch: 12, train_loss: 1.1564, test_loss: 1.2729, test_f1: 0.3744
 epoch: 13, train_loss: 1.1464, test_loss: 1.2611, test_f1: 0.3708
 epoch: 14, train_loss: 1.1378, test_loss: 1.2760, test_f1: 0.3943
 epoch: 15, train_loss: 1.1349, test_loss: 1.2603, test_f1: 0.3724
 epoch: 16, train_loss: 1.1231, test_loss: 1.2715, test_f1: 0.3949
 epoch: 17, train_loss: 1.1333, test_loss: 1.2783, test_f1: 0.3978
 epoch: 18, train_loss: 1.1153, test_loss: 1.2706, test_f1: 0.4092
 epoch: 19, train_loss: 1.1110, test_loss: 1.2591, test_f1: 0.4080
 epoch: 20, train_loss: 1.1208, test_loss: 1.2537, test_f1: 0.4011
 epoch: 21, train_loss: 1.1069, test_loss: 1.2263, test_f1: 0.3785
 epoch: 22, train_loss: 1.1188, test_loss: 1.2309, test_f1: 0.3792
 epoch: 23, train_loss: 1.1077, test_loss: 1.2303, test_f1: 0.3835
 epoch: 24, train_loss: 1.1096, test_loss: 1.2359, test_f1: 0.4006
 epoch: 25, train_loss: 1.1021, test_loss: 1.2148, test_f1: 0.4056
 epoch: 26, train_loss: 1.1045, test_loss: 1.2212, test_f1: 0.3963
 epoch: 27, train_loss: 1.0844, test_loss: 1.2034, test_f1: 0.3877
 epoch: 28, train_loss: 1.0832, test_loss: 1.2057, test_f1: 0.4269
 epoch: 29, train_loss: 1.0819, test_loss: 1.2104, test_f1: 0.4037
 epoch: 30, train_loss: 1.0790, test_loss: 1.1954, test_f1: 0.4173
 epoch: 31, train_loss: 1.0810, test_loss: 1.2082, test_f1: 0.4205
 epoch: 32, train_loss: 1.0829, test_loss: 1.1962, test_f1: 0.4247
 epoch: 33, train_loss: 1.0739, test_loss: 1.1849, test_f1: 0.4203
 epoch: 34, train_loss: 1.0734, test_loss: 1.2087, test_f1: 0.4114
 epoch: 35, train_loss: 1.0750, test_loss: 1.1921, test_f1: 0.4247
 epoch: 36, train_loss: 1.0780, test_loss: 1.1893, test_f1: 0.4342
 epoch: 37, train_loss: 1.0684, test_loss: 1.1916, test_f1: 0.4270
 epoch: 38, train_loss: 1.0743, test_loss: 1.1968, test_f1: 0.4165
 epoch: 39, train_loss: 1.0724, test_loss: 1.1942, test_f1: 0.4261
 epoch: 40, train_loss: 1.0545, test_loss: 1.1882, test_f1: 0.4278
 epoch: 41, train_loss: 1.0678, test_loss: 1.1831, test_f1: 0.4265
 epoch: 42, train_loss: 1.0474, test_loss: 1.1760, test_f1: 0.4175
 epoch: 43, train_loss: 1.0690, test_loss: 1.1896, test_f1: 0.4222
 epoch: 44, train_loss: 1.0635, test_loss: 1.1845, test_f1: 0.4173
 epoch: 45, train_loss: 1.0534, test_loss: 1.1808, test_f1: 0.4376
 epoch: 46, train_loss: 1.0451, test_loss: 1.1904, test_f1: 0.4372
 epoch: 47, train_loss: 1.0377, test_loss: 1.1871, test_f1: 0.4310
 epoch: 48, train_loss: 1.0500, test_loss: 1.1905, test_f1: 0.4296
 epoch: 49, train_loss: 1.0394, test_loss: 1.1964, test_f1: 0.4229
 epoch: 50, train_loss: 1.0256, test_loss: 1.1962, test_f1: 0.4357
 epoch: 51, train_loss: 1.0260, test_loss: 1.1860, test_f1: 0.4273
 epoch: 52, train_loss: 1.0278, test_loss: 1.2028, test_f1: 0.4175
 epoch: 53, train_loss: 1.0384, test_loss: 1.2067, test_f1: 0.4213
 epoch: 54, train_loss: 1.0434, test_loss: 1.1910, test_f1: 0.4257
 epoch: 55, train_loss: 1.0310, test_loss: 1.2092, test_f1: 0.4349
 epoch: 56, train_loss: 1.0268, test_loss: 1.1905, test_f1: 0.4329
 epoch: 57, train_loss: 1.0264, test_loss: 1.1996, test_f1: 0.4327
 epoch: 58, train_loss: 1.0181, test_loss: 1.1965, test_f1: 0.4317
 epoch: 59, train_loss: 1.0189, test_loss: 1.1958, test_f1: 0.4382
 epoch: 60, train_loss: 1.0207, test_loss: 1.1875, test_f1: 0.4422
 epoch: 61, train_loss: 1.0211, test_loss: 1.1955, test_f1: 0.4371
 epoch: 62, train_loss: 1.0267, test_loss: 1.1923, test_f1: 0.4342
 epoch: 63, train_loss: 1.0248, test_loss: 1.1971, test_f1: 0.4317
 epoch: 64, train_loss: 1.0225, test_loss: 1.1906, test_f1: 0.4360
 epoch: 65, train_loss: 1.0199, test_loss: 1.1889, test_f1: 0.4417
 epoch: 66, train_loss: 1.0352, test_loss: 1.1922, test_f1: 0.4338
 epoch: 67, train_loss: 1.0210, test_loss: 1.1954, test_f1: 0.4404
 epoch: 68, train_loss: 1.0112, test_loss: 1.2058, test_f1: 0.4251
 epoch: 69, train_loss: 1.0246, test_loss: 1.2016, test_f1: 0.4202
 epoch: 70, train_loss: 1.0116, test_loss: 1.1959, test_f1: 0.4381
 epoch: 71, train_loss: 1.0160, test_loss: 1.2054, test_f1: 0.4297
 epoch: 72, train_loss: 1.0056, test_loss: 1.2220, test_f1: 0.4317
 epoch: 73, train_loss: 1.0054, test_loss: 1.2041, test_f1: 0.4343
 epoch: 74, train_loss: 1.0175, test_loss: 1.1981, test_f1: 0.4504
 epoch: 75, train_loss: 1.0109, test_loss: 1.1940, test_f1: 0.4363
 epoch: 76, train_loss: 1.0161, test_loss: 1.1882, test_f1: 0.4440
 epoch: 77, train_loss: 1.0045, test_loss: 1.1883, test_f1: 0.4438
 epoch: 78, train_loss: 1.0083, test_loss: 1.1873, test_f1: 0.4452
 epoch: 79, train_loss: 0.9940, test_loss: 1.1960, test_f1: 0.4602
 epoch: 80, train_loss: 1.0208, test_loss: 1.2173, test_f1: 0.4437
 epoch: 81, train_loss: 1.0041, test_loss: 1.1822, test_f1: 0.4531
 epoch: 82, train_loss: 1.0093, test_loss: 1.1758, test_f1: 0.4602
 epoch: 83, train_loss: 0.9949, test_loss: 1.2005, test_f1: 0.4556
 epoch: 84, train_loss: 1.0255, test_loss: 1.2023, test_f1: 0.4566
 epoch: 85, train_loss: 1.0081, test_loss: 1.1956, test_f1: 0.4513
 epoch: 86, train_loss: 1.0023, test_loss: 1.1803, test_f1: 0.4532
 epoch: 87, train_loss: 0.9959, test_loss: 1.1840, test_f1: 0.4557
 epoch: 88, train_loss: 0.9878, test_loss: 1.1730, test_f1: 0.4463
 epoch: 89, train_loss: 0.9890, test_loss: 1.1852, test_f1: 0.4442
 epoch: 90, train_loss: 0.9834, test_loss: 1.2036, test_f1: 0.4505
 epoch: 91, train_loss: 0.9903, test_loss: 1.1851, test_f1: 0.4522
 epoch: 92, train_loss: 1.0034, test_loss: 1.2017, test_f1: 0.4538
 epoch: 93, train_loss: 0.9912, test_loss: 1.2035, test_f1: 0.4583
 epoch: 94, train_loss: 0.9960, test_loss: 1.1905, test_f1: 0.4432
 epoch: 95, train_loss: 0.9998, test_loss: 1.2051, test_f1: 0.4429
 epoch: 96, train_loss: 0.9945, test_loss: 1.2167, test_f1: 0.4524
 epoch: 97, train_loss: 0.9895, test_loss: 1.2231, test_f1: 0.4447
 epoch: 98, train_loss: 0.9823, test_loss: 1.2178, test_f1: 0.4444
 epoch: 99, train_loss: 0.9961, test_loss: 1.2197, test_f1: 0.4456
##################ITERATION #7 ****************************************
 epoch: 0, train_loss: 1.2824, test_loss: 1.3889, test_f1: 0.2404
 epoch: 1, train_loss: 1.2454, test_loss: 1.4023, test_f1: 0.2684
 epoch: 2, train_loss: 1.2360, test_loss: 1.3929, test_f1: 0.2631
 epoch: 3, train_loss: 1.2205, test_loss: 1.3850, test_f1: 0.2651
 epoch: 4, train_loss: 1.2051, test_loss: 1.3753, test_f1: 0.2771
 epoch: 5, train_loss: 1.2019, test_loss: 1.3694, test_f1: 0.3010
 epoch: 6, train_loss: 1.1907, test_loss: 1.3629, test_f1: 0.3371
 epoch: 7, train_loss: 1.1821, test_loss: 1.3451, test_f1: 0.3481
 epoch: 8, train_loss: 1.1676, test_loss: 1.3504, test_f1: 0.3598
 epoch: 9, train_loss: 1.1591, test_loss: 1.3126, test_f1: 0.3642
 epoch: 10, train_loss: 1.1542, test_loss: 1.3049, test_f1: 0.3739
 epoch: 11, train_loss: 1.1460, test_loss: 1.3388, test_f1: 0.3892
 epoch: 12, train_loss: 1.1426, test_loss: 1.3102, test_f1: 0.3834
 epoch: 13, train_loss: 1.1448, test_loss: 1.3280, test_f1: 0.3825
 epoch: 14, train_loss: 1.1413, test_loss: 1.3315, test_f1: 0.3813
 epoch: 15, train_loss: 1.1289, test_loss: 1.3206, test_f1: 0.4007
 epoch: 16, train_loss: 1.1339, test_loss: 1.3278, test_f1: 0.3967
 epoch: 17, train_loss: 1.1310, test_loss: 1.3265, test_f1: 0.3890
 epoch: 18, train_loss: 1.1263, test_loss: 1.3182, test_f1: 0.3972
 epoch: 19, train_loss: 1.1131, test_loss: 1.3966, test_f1: 0.4023
 epoch: 20, train_loss: 1.1143, test_loss: 1.3343, test_f1: 0.4037
 epoch: 21, train_loss: 1.1087, test_loss: 1.3588, test_f1: 0.4106
 epoch: 22, train_loss: 1.1115, test_loss: 1.3387, test_f1: 0.3982
 epoch: 23, train_loss: 1.1012, test_loss: 1.3432, test_f1: 0.4090
 epoch: 24, train_loss: 1.0971, test_loss: 1.3358, test_f1: 0.3998
 epoch: 25, train_loss: 1.0999, test_loss: 1.3286, test_f1: 0.4235
 epoch: 26, train_loss: 1.0865, test_loss: 1.2964, test_f1: 0.4228
 epoch: 27, train_loss: 1.0802, test_loss: 1.3203, test_f1: 0.4242
 epoch: 28, train_loss: 1.0835, test_loss: 1.3169, test_f1: 0.4242
 epoch: 29, train_loss: 1.0758, test_loss: 1.3510, test_f1: 0.4372
 epoch: 30, train_loss: 1.0680, test_loss: 1.3231, test_f1: 0.4367
 epoch: 31, train_loss: 1.0833, test_loss: 1.3431, test_f1: 0.4302
 epoch: 32, train_loss: 1.0722, test_loss: 1.3038, test_f1: 0.4304
 epoch: 33, train_loss: 1.0619, test_loss: 1.3036, test_f1: 0.4344
 epoch: 34, train_loss: 1.0582, test_loss: 1.3205, test_f1: 0.4323
 epoch: 35, train_loss: 1.0538, test_loss: 1.3020, test_f1: 0.4238
 epoch: 36, train_loss: 1.0504, test_loss: 1.3470, test_f1: 0.4282
 epoch: 37, train_loss: 1.0588, test_loss: 1.3636, test_f1: 0.4270
 epoch: 38, train_loss: 1.0512, test_loss: 1.3343, test_f1: 0.4328
 epoch: 39, train_loss: 1.0454, test_loss: 1.3043, test_f1: 0.4240
 epoch: 40, train_loss: 1.0458, test_loss: 1.3170, test_f1: 0.4341
 epoch: 41, train_loss: 1.0444, test_loss: 1.2954, test_f1: 0.4290
 epoch: 42, train_loss: 1.0297, test_loss: 1.2695, test_f1: 0.4278
 epoch: 43, train_loss: 1.0275, test_loss: 1.2568, test_f1: 0.4297
 epoch: 44, train_loss: 1.0292, test_loss: 1.2750, test_f1: 0.4365
 epoch: 45, train_loss: 1.0288, test_loss: 1.2618, test_f1: 0.4277
 epoch: 46, train_loss: 1.0324, test_loss: 1.2745, test_f1: 0.4472
 epoch: 47, train_loss: 1.0170, test_loss: 1.2763, test_f1: 0.4597
 epoch: 48, train_loss: 1.0287, test_loss: 1.2753, test_f1: 0.4367
 epoch: 49, train_loss: 1.0058, test_loss: 1.2724, test_f1: 0.4580
 epoch: 50, train_loss: 1.0243, test_loss: 1.2732, test_f1: 0.4640
 epoch: 51, train_loss: 1.0133, test_loss: 1.3172, test_f1: 0.4685
 epoch: 52, train_loss: 1.0283, test_loss: 1.2472, test_f1: 0.4533
 epoch: 53, train_loss: 1.0053, test_loss: 1.2830, test_f1: 0.4606
 epoch: 54, train_loss: 1.0151, test_loss: 1.2403, test_f1: 0.4622
 epoch: 55, train_loss: 1.0137, test_loss: 1.2568, test_f1: 0.4574
 epoch: 56, train_loss: 1.0183, test_loss: 1.2594, test_f1: 0.4594
 epoch: 57, train_loss: 1.0087, test_loss: 1.2658, test_f1: 0.4621
 epoch: 58, train_loss: 1.0120, test_loss: 1.2655, test_f1: 0.4604
 epoch: 59, train_loss: 1.0042, test_loss: 1.2967, test_f1: 0.4697
 epoch: 60, train_loss: 1.0162, test_loss: 1.2849, test_f1: 0.4729
 epoch: 61, train_loss: 0.9894, test_loss: 1.2378, test_f1: 0.4433
 epoch: 62, train_loss: 1.0161, test_loss: 1.2286, test_f1: 0.4983
 epoch: 63, train_loss: 1.0017, test_loss: 1.2306, test_f1: 0.4648
 epoch: 64, train_loss: 1.0087, test_loss: 1.2490, test_f1: 0.4794
 epoch: 65, train_loss: 0.9957, test_loss: 1.2384, test_f1: 0.4650
 epoch: 66, train_loss: 0.9931, test_loss: 1.2519, test_f1: 0.4883
 epoch: 67, train_loss: 0.9866, test_loss: 1.2294, test_f1: 0.4829
 epoch: 68, train_loss: 0.9898, test_loss: 1.2542, test_f1: 0.4808
 epoch: 69, train_loss: 0.9895, test_loss: 1.2645, test_f1: 0.4942
 epoch: 70, train_loss: 1.0001, test_loss: 1.2503, test_f1: 0.5029
 epoch: 71, train_loss: 0.9964, test_loss: 1.2407, test_f1: 0.4895
 epoch: 72, train_loss: 0.9927, test_loss: 1.2416, test_f1: 0.5001
 epoch: 73, train_loss: 0.9808, test_loss: 1.2476, test_f1: 0.5106
 epoch: 74, train_loss: 0.9722, test_loss: 1.2834, test_f1: 0.5029
 epoch: 75, train_loss: 0.9911, test_loss: 1.2562, test_f1: 0.4934
 epoch: 76, train_loss: 0.9805, test_loss: 1.2400, test_f1: 0.5019
 epoch: 77, train_loss: 0.9862, test_loss: 1.2394, test_f1: 0.5176
 epoch: 78, train_loss: 0.9879, test_loss: 1.2649, test_f1: 0.4794
 epoch: 79, train_loss: 0.9685, test_loss: 1.2565, test_f1: 0.4823
 epoch: 80, train_loss: 0.9817, test_loss: 1.2485, test_f1: 0.4993
 epoch: 81, train_loss: 0.9813, test_loss: 1.2955, test_f1: 0.4851
 epoch: 82, train_loss: 0.9955, test_loss: 1.2617, test_f1: 0.4934
 epoch: 83, train_loss: 0.9767, test_loss: 1.2557, test_f1: 0.5154
 epoch: 84, train_loss: 0.9709, test_loss: 1.2601, test_f1: 0.5022
 epoch: 85, train_loss: 0.9861, test_loss: 1.2516, test_f1: 0.5121
 epoch: 86, train_loss: 0.9662, test_loss: 1.2382, test_f1: 0.5094
 epoch: 87, train_loss: 0.9766, test_loss: 1.2721, test_f1: 0.5120
 epoch: 88, train_loss: 0.9635, test_loss: 1.2393, test_f1: 0.5209
 epoch: 89, train_loss: 0.9699, test_loss: 1.2640, test_f1: 0.4999
 epoch: 90, train_loss: 0.9617, test_loss: 1.2379, test_f1: 0.5098
 epoch: 91, train_loss: 0.9744, test_loss: 1.2558, test_f1: 0.4842
 epoch: 92, train_loss: 0.9794, test_loss: 1.2545, test_f1: 0.5009
 epoch: 93, train_loss: 0.9596, test_loss: 1.2380, test_f1: 0.5100
 epoch: 94, train_loss: 0.9570, test_loss: 1.2348, test_f1: 0.4966
 epoch: 95, train_loss: 0.9653, test_loss: 1.2212, test_f1: 0.5233
 epoch: 96, train_loss: 0.9550, test_loss: 1.2534, test_f1: 0.5103
 epoch: 97, train_loss: 0.9665, test_loss: 1.2392, test_f1: 0.5108
 epoch: 98, train_loss: 0.9563, test_loss: 1.2210, test_f1: 0.5057
 epoch: 99, train_loss: 0.9642, test_loss: 1.4705, test_f1: 0.5054
##################ITERATION #8 ****************************************
 epoch: 0, train_loss: 1.2822, test_loss: 1.3075, test_f1: 0.2281
 epoch: 1, train_loss: 1.2469, test_loss: 1.3097, test_f1: 0.2650
 epoch: 2, train_loss: 1.2327, test_loss: 1.3176, test_f1: 0.2750
 epoch: 3, train_loss: 1.2208, test_loss: 1.3054, test_f1: 0.3345
 epoch: 4, train_loss: 1.2146, test_loss: 1.3048, test_f1: 0.3255
 epoch: 5, train_loss: 1.2014, test_loss: 1.3122, test_f1: 0.3658
 epoch: 6, train_loss: 1.1933, test_loss: 1.3083, test_f1: 0.3796
 epoch: 7, train_loss: 1.1812, test_loss: 1.3101, test_f1: 0.3842
 epoch: 8, train_loss: 1.1885, test_loss: 1.3006, test_f1: 0.4012
 epoch: 9, train_loss: 1.1745, test_loss: 1.3023, test_f1: 0.3854
 epoch: 10, train_loss: 1.1753, test_loss: 1.2942, test_f1: 0.3976
 epoch: 11, train_loss: 1.1578, test_loss: 1.2825, test_f1: 0.4012
 epoch: 12, train_loss: 1.1675, test_loss: 1.2901, test_f1: 0.4017
 epoch: 13, train_loss: 1.1589, test_loss: 1.2980, test_f1: 0.4099
 epoch: 14, train_loss: 1.1559, test_loss: 1.3009, test_f1: 0.4171
 epoch: 15, train_loss: 1.1552, test_loss: 1.2811, test_f1: 0.4130
 epoch: 16, train_loss: 1.1459, test_loss: 1.3018, test_f1: 0.4187
 epoch: 17, train_loss: 1.1355, test_loss: 1.2927, test_f1: 0.4091
 epoch: 18, train_loss: 1.1298, test_loss: 1.2984, test_f1: 0.4047
 epoch: 19, train_loss: 1.1244, test_loss: 1.2980, test_f1: 0.4023
 epoch: 20, train_loss: 1.1199, test_loss: 1.2888, test_f1: 0.4297
 epoch: 21, train_loss: 1.1235, test_loss: 1.2958, test_f1: 0.4215
 epoch: 22, train_loss: 1.1138, test_loss: 1.3065, test_f1: 0.4152
 epoch: 23, train_loss: 1.1186, test_loss: 1.2945, test_f1: 0.4403
 epoch: 24, train_loss: 1.1167, test_loss: 1.2980, test_f1: 0.4395
 epoch: 25, train_loss: 1.1076, test_loss: 1.3125, test_f1: 0.4447
 epoch: 26, train_loss: 1.1039, test_loss: 1.2773, test_f1: 0.4432
 epoch: 27, train_loss: 1.1071, test_loss: 1.2891, test_f1: 0.4473
 epoch: 28, train_loss: 1.1040, test_loss: 1.2926, test_f1: 0.4321
 epoch: 29, train_loss: 1.0951, test_loss: 1.2689, test_f1: 0.4633
 epoch: 30, train_loss: 1.0826, test_loss: 1.2764, test_f1: 0.4495
 epoch: 31, train_loss: 1.0962, test_loss: 1.2604, test_f1: 0.4484
 epoch: 32, train_loss: 1.0986, test_loss: 1.2628, test_f1: 0.4610
 epoch: 33, train_loss: 1.0966, test_loss: 1.2717, test_f1: 0.4700
 epoch: 34, train_loss: 1.0838, test_loss: 1.2757, test_f1: 0.4531
 epoch: 35, train_loss: 1.0639, test_loss: 1.2613, test_f1: 0.4711
 epoch: 36, train_loss: 1.0607, test_loss: 1.2692, test_f1: 0.4735
 epoch: 37, train_loss: 1.0730, test_loss: 1.2811, test_f1: 0.4544
 epoch: 38, train_loss: 1.0686, test_loss: 1.2717, test_f1: 0.4797
 epoch: 39, train_loss: 1.0645, test_loss: 1.2722, test_f1: 0.4804
 epoch: 40, train_loss: 1.0631, test_loss: 1.2778, test_f1: 0.4847
 epoch: 41, train_loss: 1.0576, test_loss: 1.2859, test_f1: 0.5102
 epoch: 42, train_loss: 1.0734, test_loss: 1.2684, test_f1: 0.4907
 epoch: 43, train_loss: 1.0606, test_loss: 1.2721, test_f1: 0.4894
 epoch: 44, train_loss: 1.0627, test_loss: 1.2803, test_f1: 0.4959
 epoch: 45, train_loss: 1.0383, test_loss: 1.2741, test_f1: 0.5154
 epoch: 46, train_loss: 1.0429, test_loss: 1.2733, test_f1: 0.5015
 epoch: 47, train_loss: 1.0319, test_loss: 1.2750, test_f1: 0.4934
 epoch: 48, train_loss: 1.0420, test_loss: 1.2845, test_f1: 0.5117
 epoch: 49, train_loss: 1.0409, test_loss: 1.2791, test_f1: 0.4942
 epoch: 50, train_loss: 1.0398, test_loss: 1.2845, test_f1: 0.4873
 epoch: 51, train_loss: 1.0361, test_loss: 1.2672, test_f1: 0.5124
 epoch: 52, train_loss: 1.0323, test_loss: 1.2832, test_f1: 0.5086
 epoch: 53, train_loss: 1.0216, test_loss: 1.2948, test_f1: 0.5006
 epoch: 54, train_loss: 1.0316, test_loss: 1.2773, test_f1: 0.5061
 epoch: 55, train_loss: 1.0309, test_loss: 1.2844, test_f1: 0.5094
 epoch: 56, train_loss: 1.0313, test_loss: 1.2809, test_f1: 0.5017
 epoch: 57, train_loss: 1.0382, test_loss: 1.2797, test_f1: 0.4938
 epoch: 58, train_loss: 1.0221, test_loss: 1.2803, test_f1: 0.5011
 epoch: 59, train_loss: 1.0258, test_loss: 1.2819, test_f1: 0.5153
 epoch: 60, train_loss: 1.0147, test_loss: 1.2757, test_f1: 0.5005
 epoch: 61, train_loss: 1.0439, test_loss: 1.2864, test_f1: 0.5148
 epoch: 62, train_loss: 1.0193, test_loss: 1.2835, test_f1: 0.5184
 epoch: 63, train_loss: 1.0133, test_loss: 1.3003, test_f1: 0.4993
 epoch: 64, train_loss: 1.0269, test_loss: 1.3031, test_f1: 0.4992
 epoch: 65, train_loss: 1.0049, test_loss: 1.2928, test_f1: 0.4909
 epoch: 66, train_loss: 1.0139, test_loss: 1.2883, test_f1: 0.5216
 epoch: 67, train_loss: 1.0167, test_loss: 1.2854, test_f1: 0.5250
 epoch: 68, train_loss: 1.0227, test_loss: 1.2808, test_f1: 0.5198
 epoch: 69, train_loss: 1.0080, test_loss: 1.2908, test_f1: 0.5256
 epoch: 70, train_loss: 1.0121, test_loss: 1.2800, test_f1: 0.5200
 epoch: 71, train_loss: 1.0134, test_loss: 1.2846, test_f1: 0.5250
 epoch: 72, train_loss: 1.0207, test_loss: 1.2801, test_f1: 0.5121
 epoch: 73, train_loss: 1.0151, test_loss: 1.2879, test_f1: 0.5054
 epoch: 74, train_loss: 0.9991, test_loss: 1.2822, test_f1: 0.5174
 epoch: 75, train_loss: 1.0132, test_loss: 1.2862, test_f1: 0.5146
 epoch: 76, train_loss: 0.9869, test_loss: 1.2995, test_f1: 0.5097
 epoch: 77, train_loss: 1.0056, test_loss: 1.2713, test_f1: 0.5219
 epoch: 78, train_loss: 1.0108, test_loss: 1.2955, test_f1: 0.5081
 epoch: 79, train_loss: 0.9975, test_loss: 1.2736, test_f1: 0.5208
 epoch: 80, train_loss: 0.9969, test_loss: 1.2850, test_f1: 0.5265
 epoch: 81, train_loss: 0.9957, test_loss: 1.2826, test_f1: 0.5329
 epoch: 82, train_loss: 1.0026, test_loss: 1.2811, test_f1: 0.5147
 epoch: 83, train_loss: 0.9989, test_loss: 1.2843, test_f1: 0.5139
 epoch: 84, train_loss: 0.9899, test_loss: 1.2718, test_f1: 0.5286
 epoch: 85, train_loss: 1.0072, test_loss: 1.2908, test_f1: 0.5117
 epoch: 86, train_loss: 0.9804, test_loss: 1.2779, test_f1: 0.5262
 epoch: 87, train_loss: 0.9847, test_loss: 1.2897, test_f1: 0.5086
 epoch: 88, train_loss: 0.9881, test_loss: 1.2904, test_f1: 0.5201
 epoch: 89, train_loss: 0.9753, test_loss: 1.2886, test_f1: 0.5250
 epoch: 90, train_loss: 0.9889, test_loss: 1.2903, test_f1: 0.5142
 epoch: 91, train_loss: 0.9962, test_loss: 1.2807, test_f1: 0.5400
 epoch: 92, train_loss: 0.9846, test_loss: 1.2655, test_f1: 0.5214
 epoch: 93, train_loss: 0.9840, test_loss: 1.2803, test_f1: 0.5251
 epoch: 94, train_loss: 0.9987, test_loss: 1.2798, test_f1: 0.5376
 epoch: 95, train_loss: 0.9891, test_loss: 1.2785, test_f1: 0.5344
 epoch: 96, train_loss: 0.9637, test_loss: 1.2803, test_f1: 0.5323
 epoch: 97, train_loss: 0.9877, test_loss: 1.2792, test_f1: 0.5320
 epoch: 98, train_loss: 0.9890, test_loss: 1.2894, test_f1: 0.5205
 epoch: 99, train_loss: 0.9836, test_loss: 1.2931, test_f1: 0.5393
##################ITERATION #9 ****************************************
 epoch: 0, train_loss: 1.3214, test_loss: 1.3432, test_f1: 0.2391
 epoch: 1, train_loss: 1.2770, test_loss: 1.3004, test_f1: 0.2259
 epoch: 2, train_loss: 1.2702, test_loss: 1.2895, test_f1: 0.2321
 epoch: 3, train_loss: 1.2433, test_loss: 1.2930, test_f1: 0.2360
 epoch: 4, train_loss: 1.2161, test_loss: 1.2773, test_f1: 0.2544
 epoch: 5, train_loss: 1.2227, test_loss: 1.2704, test_f1: 0.2556
 epoch: 6, train_loss: 1.2175, test_loss: 1.2666, test_f1: 0.2723
 epoch: 7, train_loss: 1.2120, test_loss: 1.2533, test_f1: 0.2799
 epoch: 8, train_loss: 1.2053, test_loss: 1.2360, test_f1: 0.2993
 epoch: 9, train_loss: 1.1849, test_loss: 1.2624, test_f1: 0.3395
 epoch: 10, train_loss: 1.1880, test_loss: 1.2257, test_f1: 0.3394
 epoch: 11, train_loss: 1.1833, test_loss: 1.2274, test_f1: 0.4190
 epoch: 12, train_loss: 1.1799, test_loss: 1.2098, test_f1: 0.4151
 epoch: 13, train_loss: 1.1725, test_loss: 1.2119, test_f1: 0.4279
 epoch: 14, train_loss: 1.1664, test_loss: 1.2192, test_f1: 0.4341
 epoch: 15, train_loss: 1.1610, test_loss: 1.1958, test_f1: 0.4406
 epoch: 16, train_loss: 1.1595, test_loss: 1.2096, test_f1: 0.4341
 epoch: 17, train_loss: 1.1469, test_loss: 1.1977, test_f1: 0.4281
 epoch: 18, train_loss: 1.1398, test_loss: 1.1908, test_f1: 0.4277
 epoch: 19, train_loss: 1.1358, test_loss: 1.2019, test_f1: 0.4305
 epoch: 20, train_loss: 1.1302, test_loss: 1.1983, test_f1: 0.4270
 epoch: 21, train_loss: 1.1311, test_loss: 1.1909, test_f1: 0.4236
 epoch: 22, train_loss: 1.1181, test_loss: 1.1846, test_f1: 0.4498
 epoch: 23, train_loss: 1.1242, test_loss: 1.1916, test_f1: 0.4424
 epoch: 24, train_loss: 1.1085, test_loss: 1.1748, test_f1: 0.4529
 epoch: 25, train_loss: 1.1083, test_loss: 1.1780, test_f1: 0.4530
 epoch: 26, train_loss: 1.1073, test_loss: 1.1775, test_f1: 0.4627
 epoch: 27, train_loss: 1.1022, test_loss: 1.1864, test_f1: 0.4681
 epoch: 28, train_loss: 1.0993, test_loss: 1.1869, test_f1: 0.4697
 epoch: 29, train_loss: 1.0898, test_loss: 1.1795, test_f1: 0.4811
 epoch: 30, train_loss: 1.0839, test_loss: 1.1806, test_f1: 0.4853
 epoch: 31, train_loss: 1.0748, test_loss: 1.1751, test_f1: 0.4857
 epoch: 32, train_loss: 1.0803, test_loss: 1.1819, test_f1: 0.4881
 epoch: 33, train_loss: 1.0731, test_loss: 1.1748, test_f1: 0.4891
 epoch: 34, train_loss: 1.0668, test_loss: 1.1708, test_f1: 0.4838
 epoch: 35, train_loss: 1.0733, test_loss: 1.1769, test_f1: 0.5013
 epoch: 36, train_loss: 1.0600, test_loss: 1.1833, test_f1: 0.4826
 epoch: 37, train_loss: 1.0694, test_loss: 1.1796, test_f1: 0.4972
 epoch: 38, train_loss: 1.0632, test_loss: 1.1765, test_f1: 0.5084
 epoch: 39, train_loss: 1.0523, test_loss: 1.1819, test_f1: 0.5010
 epoch: 40, train_loss: 1.0557, test_loss: 1.1768, test_f1: 0.5075
 epoch: 41, train_loss: 1.0423, test_loss: 1.1837, test_f1: 0.4707
 epoch: 42, train_loss: 1.0359, test_loss: 1.1723, test_f1: 0.5157
 epoch: 43, train_loss: 1.0480, test_loss: 1.1746, test_f1: 0.5017
 epoch: 44, train_loss: 1.0275, test_loss: 1.2022, test_f1: 0.4895
 epoch: 45, train_loss: 1.0344, test_loss: 1.1868, test_f1: 0.4777
 epoch: 46, train_loss: 1.0573, test_loss: 1.1862, test_f1: 0.4837
 epoch: 47, train_loss: 1.0396, test_loss: 1.1775, test_f1: 0.4978
 epoch: 48, train_loss: 1.0331, test_loss: 1.1855, test_f1: 0.4807
 epoch: 49, train_loss: 1.0231, test_loss: 1.1781, test_f1: 0.5009
 epoch: 50, train_loss: 1.0307, test_loss: 1.1818, test_f1: 0.4942
 epoch: 51, train_loss: 1.0295, test_loss: 1.2114, test_f1: 0.4771
 epoch: 52, train_loss: 1.0216, test_loss: 1.2361, test_f1: 0.4792
 epoch: 53, train_loss: 1.0037, test_loss: 1.1984, test_f1: 0.4931
 epoch: 54, train_loss: 1.0147, test_loss: 1.1932, test_f1: 0.5023
 epoch: 55, train_loss: 1.0131, test_loss: 1.1769, test_f1: 0.4742
 epoch: 56, train_loss: 1.0213, test_loss: 1.1887, test_f1: 0.4858
 epoch: 57, train_loss: 1.0014, test_loss: 1.1824, test_f1: 0.4745
 epoch: 58, train_loss: 0.9905, test_loss: 1.1742, test_f1: 0.5012
 epoch: 59, train_loss: 0.9916, test_loss: 1.1743, test_f1: 0.5076
 epoch: 60, train_loss: 1.0009, test_loss: 1.2067, test_f1: 0.4836
 epoch: 61, train_loss: 0.9929, test_loss: 1.1768, test_f1: 0.5030
 epoch: 62, train_loss: 1.0043, test_loss: 1.1814, test_f1: 0.4926
 epoch: 63, train_loss: 0.9981, test_loss: 1.1963, test_f1: 0.4946
 epoch: 64, train_loss: 1.0010, test_loss: 1.2021, test_f1: 0.4657
 epoch: 65, train_loss: 1.0028, test_loss: 1.1698, test_f1: 0.4996
 epoch: 66, train_loss: 0.9856, test_loss: 1.1795, test_f1: 0.4798
 epoch: 67, train_loss: 0.9795, test_loss: 1.1902, test_f1: 0.4746
 epoch: 68, train_loss: 0.9670, test_loss: 1.1834, test_f1: 0.4869
 epoch: 69, train_loss: 0.9998, test_loss: 1.1903, test_f1: 0.4730
 epoch: 70, train_loss: 0.9943, test_loss: 1.1975, test_f1: 0.4640
 epoch: 71, train_loss: 0.9929, test_loss: 1.1785, test_f1: 0.5113
 epoch: 72, train_loss: 0.9940, test_loss: 1.1994, test_f1: 0.4593
 epoch: 73, train_loss: 0.9807, test_loss: 1.1821, test_f1: 0.5113
 epoch: 74, train_loss: 0.9785, test_loss: 1.2008, test_f1: 0.4867
 epoch: 75, train_loss: 0.9750, test_loss: 1.1933, test_f1: 0.4784
 epoch: 76, train_loss: 0.9757, test_loss: 1.1919, test_f1: 0.4693
 epoch: 77, train_loss: 0.9740, test_loss: 1.1905, test_f1: 0.4719
 epoch: 78, train_loss: 0.9977, test_loss: 1.1837, test_f1: 0.4845
 epoch: 79, train_loss: 0.9910, test_loss: 1.1946, test_f1: 0.5025
 epoch: 80, train_loss: 0.9775, test_loss: 1.1811, test_f1: 0.4756
 epoch: 81, train_loss: 0.9708, test_loss: 1.1975, test_f1: 0.4739
 epoch: 82, train_loss: 0.9683, test_loss: 1.1931, test_f1: 0.4525
 epoch: 83, train_loss: 0.9585, test_loss: 1.1840, test_f1: 0.4705
 epoch: 84, train_loss: 0.9725, test_loss: 1.1990, test_f1: 0.4746
 epoch: 85, train_loss: 0.9769, test_loss: 1.2043, test_f1: 0.4549
 epoch: 86, train_loss: 0.9717, test_loss: 1.2112, test_f1: 0.4379
 epoch: 87, train_loss: 0.9487, test_loss: 1.2028, test_f1: 0.4766
 epoch: 88, train_loss: 0.9651, test_loss: 1.1981, test_f1: 0.4857
 epoch: 89, train_loss: 0.9546, test_loss: 1.1972, test_f1: 0.4546
 epoch: 90, train_loss: 0.9560, test_loss: 1.1964, test_f1: 0.4551
 epoch: 91, train_loss: 0.9596, test_loss: 1.2136, test_f1: 0.4557
 epoch: 92, train_loss: 0.9514, test_loss: 1.2057, test_f1: 0.4570
 epoch: 93, train_loss: 0.9417, test_loss: 1.2003, test_f1: 0.4839
 epoch: 94, train_loss: 0.9652, test_loss: 1.1876, test_f1: 0.4515
 epoch: 95, train_loss: 0.9560, test_loss: 1.1920, test_f1: 0.4517
 epoch: 96, train_loss: 0.9457, test_loss: 1.1980, test_f1: 0.4691
 epoch: 97, train_loss: 0.9330, test_loss: 1.1979, test_f1: 0.4904
 epoch: 98, train_loss: 0.9517, test_loss: 1.2007, test_f1: 0.4878
 epoch: 99, train_loss: 0.9416, test_loss: 1.2389, test_f1: 0.4447

Training completed in 927.57 seconds
Best F1: 0.5421 at epoch 96
Mean F1 across iterations: 0.5031  0.0298
========================FINAL RESULTS================================
FEGIN weighted F1: 0.5421  0.0298
python main.py --data ltspice_demos --representation component_component --model FEGIN --layers 4 --hiddens 32 --batch_size 32 --lr 0.0001 --emb_size 250 --epochs 100 --save_appendix component_component_L4_H32_BS32_LR0.0001_E250 --no_val
-----



STDERR:
  File "main.py", line 370, in <module>
    main()
  File "main.py", line 254, in main
    dataset = dataset_class(
  File "/home/philip/projects/ltspice_examples_code_repo/Circuit-Completion-Using-GNNs/component_classification_with_link_prediction_head/evaluation/FEGIN/kernel/circuit_datasets.py", line 15, in __init__
    self.data, self.slices = torch.load(self.processed_paths[0])
  File "/home/philip/.local/lib/python3.8/site-packages/torch/serialization.py", line 1040, in load
    warnings.warn(
  File "/usr/lib/python3.8/warnings.py", line 109, in _showwarnmsg
    sw(msg.message, msg.category, msg.filename, msg.lineno,
  File "main.py", line 47, in warn_with_traceback
    traceback.print_stack(file=log)
/home/philip/projects/ltspice_examples_code_repo/Circuit-Completion-Using-GNNs/component_classification_with_link_prediction_head/evaluation/FEGIN/kernel/circuit_datasets.py:15: FutureWarning: You are using `torch.load` with `weights_only=False` (the current default value), which uses the default pickle module implicitly. It is possible to construct malicious pickle data which will execute arbitrary code during unpickling (See https://github.com/pytorch/pytorch/blob/main/SECURITY.md#untrusted-models for more details). In a future release, the default value for `weights_only` will be flipped to `True`. This limits the functions that could be executed during unpickling. Arbitrary objects will no longer be allowed to be loaded via this mode unless they are explicitly allowlisted by the user via `torch.serialization.add_safe_globals`. We recommend you start setting `weights_only=True` for any use case where you don't have full control of the loaded file. Please open an issue on GitHub for any issues related to this experimental feature.
  self.data, self.slices = torch.load(self.processed_paths[0])
