STDOUT:
Results will be saved in /home/philip/projects/ltspice_examples_code_repo/Circuit-Completion-Using-GNNs/component_classification_with_link_prediction_head/evaluation/FEGIN/results/model_FEGIN_dataset_ltspice_demos
Command line input: python main.py --data ltspice_demos --representation component_pin --model FEGIN --layers 5 --hiddens 16 --batch_size 32 --lr 0.0001 --emb_size 128 --epochs 100 --save_appendix component_pin_L5_H16_BS32_LR0.0001_E128 --no_val
 is saved.
-----
ltspice_demos - FEGIN
Using 5 layers, 16 hidden units, h = 2
Loading component_pin representation dataset
ENTERED
Training FEGIN on component_pin representation
Train: 1565, Test: 383
##################ITERATION #0 ****************************************
 epoch: 0, train_loss: 1.4783, test_loss: 1.4624, test_f1: 0.0507
 epoch: 1, train_loss: 1.4709, test_loss: 1.4578, test_f1: 0.0507
 epoch: 2, train_loss: 1.4670, test_loss: 1.4542, test_f1: 0.0507
 epoch: 3, train_loss: 1.4629, test_loss: 1.4506, test_f1: 0.0507
 epoch: 4, train_loss: 1.4587, test_loss: 1.4469, test_f1: 0.0507
 epoch: 5, train_loss: 1.4540, test_loss: 1.4429, test_f1: 0.0507
 epoch: 6, train_loss: 1.4505, test_loss: 1.4387, test_f1: 0.0507
 epoch: 7, train_loss: 1.4448, test_loss: 1.4343, test_f1: 0.0507
 epoch: 8, train_loss: 1.4392, test_loss: 1.4296, test_f1: 0.0507
 epoch: 9, train_loss: 1.4341, test_loss: 1.4235, test_f1: 0.0507
 epoch: 10, train_loss: 1.4263, test_loss: 1.4179, test_f1: 0.0507
 epoch: 11, train_loss: 1.4194, test_loss: 1.4097, test_f1: 0.0507
 epoch: 12, train_loss: 1.4085, test_loss: 1.4004, test_f1: 0.0507
 epoch: 13, train_loss: 1.3988, test_loss: 1.3913, test_f1: 0.0507
 epoch: 14, train_loss: 1.3881, test_loss: 1.3801, test_f1: 0.0509
 epoch: 15, train_loss: 1.3754, test_loss: 1.3677, test_f1: 0.1833
 epoch: 16, train_loss: 1.3617, test_loss: 1.3554, test_f1: 0.2255
 epoch: 17, train_loss: 1.3512, test_loss: 1.3444, test_f1: 0.3069
 epoch: 18, train_loss: 1.3362, test_loss: 1.3339, test_f1: 0.3366
 epoch: 19, train_loss: 1.3213, test_loss: 1.3217, test_f1: 0.3242
 epoch: 20, train_loss: 1.3095, test_loss: 1.3156, test_f1: 0.3181
 epoch: 21, train_loss: 1.3010, test_loss: 1.3090, test_f1: 0.3424
 epoch: 22, train_loss: 1.2853, test_loss: 1.2992, test_f1: 0.3175
 epoch: 23, train_loss: 1.2776, test_loss: 1.2943, test_f1: 0.3270
 epoch: 24, train_loss: 1.2627, test_loss: 1.2883, test_f1: 0.3205
 epoch: 25, train_loss: 1.2597, test_loss: 1.2829, test_f1: 0.3446
 epoch: 26, train_loss: 1.2473, test_loss: 1.2785, test_f1: 0.3402
 epoch: 27, train_loss: 1.2425, test_loss: 1.2720, test_f1: 0.3398
 epoch: 28, train_loss: 1.2379, test_loss: 1.2684, test_f1: 0.3421
 epoch: 29, train_loss: 1.2352, test_loss: 1.2645, test_f1: 0.3451
 epoch: 30, train_loss: 1.2298, test_loss: 1.2623, test_f1: 0.3366
 epoch: 31, train_loss: 1.2251, test_loss: 1.2583, test_f1: 0.3504
 epoch: 32, train_loss: 1.2156, test_loss: 1.2543, test_f1: 0.3485
 epoch: 33, train_loss: 1.2114, test_loss: 1.2525, test_f1: 0.3303
 epoch: 34, train_loss: 1.2154, test_loss: 1.2493, test_f1: 0.3190
 epoch: 35, train_loss: 1.2084, test_loss: 1.2462, test_f1: 0.3464
 epoch: 36, train_loss: 1.2070, test_loss: 1.2426, test_f1: 0.3155
 epoch: 37, train_loss: 1.1916, test_loss: 1.2411, test_f1: 0.3471
 epoch: 38, train_loss: 1.1899, test_loss: 1.2340, test_f1: 0.3438
 epoch: 39, train_loss: 1.1990, test_loss: 1.2309, test_f1: 0.3034
 epoch: 40, train_loss: 1.1872, test_loss: 1.2285, test_f1: 0.3034
 epoch: 41, train_loss: 1.1818, test_loss: 1.2254, test_f1: 0.3188
 epoch: 42, train_loss: 1.1757, test_loss: 1.2228, test_f1: 0.3035
 epoch: 43, train_loss: 1.1787, test_loss: 1.2180, test_f1: 0.3001
 epoch: 44, train_loss: 1.1695, test_loss: 1.2177, test_f1: 0.2968
 epoch: 45, train_loss: 1.1634, test_loss: 1.2115, test_f1: 0.3172
 epoch: 46, train_loss: 1.1662, test_loss: 1.2073, test_f1: 0.2968
 epoch: 47, train_loss: 1.1604, test_loss: 1.2039, test_f1: 0.3089
 epoch: 48, train_loss: 1.1538, test_loss: 1.2009, test_f1: 0.3253
 epoch: 49, train_loss: 1.1500, test_loss: 1.1957, test_f1: 0.2983
 epoch: 50, train_loss: 1.1454, test_loss: 1.1921, test_f1: 0.3020
 epoch: 51, train_loss: 1.1394, test_loss: 1.1891, test_f1: 0.2966
 epoch: 52, train_loss: 1.1432, test_loss: 1.1867, test_f1: 0.3001
 epoch: 53, train_loss: 1.1410, test_loss: 1.1851, test_f1: 0.2945
 epoch: 54, train_loss: 1.1409, test_loss: 1.1830, test_f1: 0.3128
 epoch: 55, train_loss: 1.1228, test_loss: 1.1809, test_f1: 0.3384
 epoch: 56, train_loss: 1.1382, test_loss: 1.1797, test_f1: 0.3456
 epoch: 57, train_loss: 1.1300, test_loss: 1.1758, test_f1: 0.3566
 epoch: 58, train_loss: 1.1318, test_loss: 1.1757, test_f1: 0.3585
 epoch: 59, train_loss: 1.1325, test_loss: 1.1711, test_f1: 0.3540
 epoch: 60, train_loss: 1.1248, test_loss: 1.1707, test_f1: 0.3636
 epoch: 61, train_loss: 1.1212, test_loss: 1.1683, test_f1: 0.3753
 epoch: 62, train_loss: 1.1277, test_loss: 1.1675, test_f1: 0.3830
 epoch: 63, train_loss: 1.1123, test_loss: 1.1661, test_f1: 0.3903
 epoch: 64, train_loss: 1.1083, test_loss: 1.1647, test_f1: 0.3931
 epoch: 65, train_loss: 1.1146, test_loss: 1.1611, test_f1: 0.3941
 epoch: 66, train_loss: 1.1105, test_loss: 1.1593, test_f1: 0.3963
 epoch: 67, train_loss: 1.1137, test_loss: 1.1564, test_f1: 0.4027
 epoch: 68, train_loss: 1.1010, test_loss: 1.1538, test_f1: 0.4211
 epoch: 69, train_loss: 1.0918, test_loss: 1.1519, test_f1: 0.4215
 epoch: 70, train_loss: 1.1017, test_loss: 1.1465, test_f1: 0.3917
 epoch: 71, train_loss: 1.1021, test_loss: 1.1467, test_f1: 0.4034
 epoch: 72, train_loss: 1.0984, test_loss: 1.1457, test_f1: 0.4291
 epoch: 73, train_loss: 1.0935, test_loss: 1.1399, test_f1: 0.3909
 epoch: 74, train_loss: 1.0961, test_loss: 1.1394, test_f1: 0.4053
 epoch: 75, train_loss: 1.0900, test_loss: 1.1372, test_f1: 0.4064
 epoch: 76, train_loss: 1.0878, test_loss: 1.1372, test_f1: 0.3904
 epoch: 77, train_loss: 1.0868, test_loss: 1.1354, test_f1: 0.3949
 epoch: 78, train_loss: 1.0842, test_loss: 1.1347, test_f1: 0.4197
 epoch: 79, train_loss: 1.0807, test_loss: 1.1302, test_f1: 0.4099
 epoch: 80, train_loss: 1.0781, test_loss: 1.1273, test_f1: 0.4306
 epoch: 81, train_loss: 1.0760, test_loss: 1.1259, test_f1: 0.4376
 epoch: 82, train_loss: 1.0798, test_loss: 1.1269, test_f1: 0.4140
 epoch: 83, train_loss: 1.0746, test_loss: 1.1227, test_f1: 0.4398
 epoch: 84, train_loss: 1.0653, test_loss: 1.1196, test_f1: 0.4229
 epoch: 85, train_loss: 1.0747, test_loss: 1.1177, test_f1: 0.4265
 epoch: 86, train_loss: 1.0565, test_loss: 1.1129, test_f1: 0.4164
 epoch: 87, train_loss: 1.0670, test_loss: 1.1120, test_f1: 0.4699
 epoch: 88, train_loss: 1.0680, test_loss: 1.1116, test_f1: 0.4454
 epoch: 89, train_loss: 1.0546, test_loss: 1.1089, test_f1: 0.4538
 epoch: 90, train_loss: 1.0583, test_loss: 1.1059, test_f1: 0.4492
 epoch: 91, train_loss: 1.0598, test_loss: 1.1053, test_f1: 0.4343
 epoch: 92, train_loss: 1.0582, test_loss: 1.1014, test_f1: 0.4551
 epoch: 93, train_loss: 1.0551, test_loss: 1.1013, test_f1: 0.4610
 epoch: 94, train_loss: 1.0579, test_loss: 1.0975, test_f1: 0.4411
 epoch: 95, train_loss: 1.0413, test_loss: 1.0941, test_f1: 0.4604
 epoch: 96, train_loss: 1.0417, test_loss: 1.0907, test_f1: 0.4495
 epoch: 97, train_loss: 1.0531, test_loss: 1.0933, test_f1: 0.4184
 epoch: 98, train_loss: 1.0369, test_loss: 1.0895, test_f1: 0.4318
 epoch: 99, train_loss: 1.0404, test_loss: 1.0872, test_f1: 0.4024
##################ITERATION #1 ****************************************
 epoch: 0, train_loss: 1.3834, test_loss: 1.3824, test_f1: 0.1365
 epoch: 1, train_loss: 1.3708, test_loss: 1.3767, test_f1: 0.1365
 epoch: 2, train_loss: 1.3637, test_loss: 1.3701, test_f1: 0.1365
 epoch: 3, train_loss: 1.3546, test_loss: 1.3625, test_f1: 0.1365
 epoch: 4, train_loss: 1.3472, test_loss: 1.3556, test_f1: 0.1365
 epoch: 5, train_loss: 1.3376, test_loss: 1.3483, test_f1: 0.1365
 epoch: 6, train_loss: 1.3265, test_loss: 1.3402, test_f1: 0.1365
 epoch: 7, train_loss: 1.3211, test_loss: 1.3320, test_f1: 0.1365
 epoch: 8, train_loss: 1.3076, test_loss: 1.3233, test_f1: 0.1365
 epoch: 9, train_loss: 1.2967, test_loss: 1.3162, test_f1: 0.1365
 epoch: 10, train_loss: 1.2829, test_loss: 1.3065, test_f1: 0.1975
 epoch: 11, train_loss: 1.2699, test_loss: 1.2975, test_f1: 0.2849
 epoch: 12, train_loss: 1.2596, test_loss: 1.2876, test_f1: 0.3253
 epoch: 13, train_loss: 1.2534, test_loss: 1.2792, test_f1: 0.3245
 epoch: 14, train_loss: 1.2480, test_loss: 1.2710, test_f1: 0.3330
 epoch: 15, train_loss: 1.2330, test_loss: 1.2664, test_f1: 0.3379
 epoch: 16, train_loss: 1.2187, test_loss: 1.2584, test_f1: 0.3383
 epoch: 17, train_loss: 1.2188, test_loss: 1.2518, test_f1: 0.2951
 epoch: 18, train_loss: 1.2018, test_loss: 1.2467, test_f1: 0.2903
 epoch: 19, train_loss: 1.1900, test_loss: 1.2390, test_f1: 0.3049
 epoch: 20, train_loss: 1.1879, test_loss: 1.2347, test_f1: 0.3206
 epoch: 21, train_loss: 1.1804, test_loss: 1.2249, test_f1: 0.3457
 epoch: 22, train_loss: 1.1704, test_loss: 1.2210, test_f1: 0.3301
 epoch: 23, train_loss: 1.1640, test_loss: 1.2125, test_f1: 0.3455
 epoch: 24, train_loss: 1.1591, test_loss: 1.2048, test_f1: 0.3506
 epoch: 25, train_loss: 1.1512, test_loss: 1.1998, test_f1: 0.3509
 epoch: 26, train_loss: 1.1418, test_loss: 1.1906, test_f1: 0.3740
 epoch: 27, train_loss: 1.1345, test_loss: 1.1885, test_f1: 0.3559
 epoch: 28, train_loss: 1.1325, test_loss: 1.1792, test_f1: 0.3695
 epoch: 29, train_loss: 1.1257, test_loss: 1.1746, test_f1: 0.3584
 epoch: 30, train_loss: 1.1141, test_loss: 1.1738, test_f1: 0.3591
 epoch: 31, train_loss: 1.1068, test_loss: 1.1674, test_f1: 0.3462
 epoch: 32, train_loss: 1.1033, test_loss: 1.1529, test_f1: 0.3860
 epoch: 33, train_loss: 1.0992, test_loss: 1.1526, test_f1: 0.3547
 epoch: 34, train_loss: 1.0858, test_loss: 1.1463, test_f1: 0.3653
 epoch: 35, train_loss: 1.0927, test_loss: 1.1445, test_f1: 0.3736
 epoch: 36, train_loss: 1.0851, test_loss: 1.1358, test_f1: 0.3710
 epoch: 37, train_loss: 1.0742, test_loss: 1.1298, test_f1: 0.3828
 epoch: 38, train_loss: 1.0731, test_loss: 1.1297, test_f1: 0.3537
 epoch: 39, train_loss: 1.0638, test_loss: 1.1227, test_f1: 0.3833
 epoch: 40, train_loss: 1.0735, test_loss: 1.1194, test_f1: 0.3844
 epoch: 41, train_loss: 1.0552, test_loss: 1.1119, test_f1: 0.3903
 epoch: 42, train_loss: 1.0459, test_loss: 1.1071, test_f1: 0.4021
 epoch: 43, train_loss: 1.0502, test_loss: 1.1118, test_f1: 0.3867
 epoch: 44, train_loss: 1.0491, test_loss: 1.1073, test_f1: 0.3940
 epoch: 45, train_loss: 1.0412, test_loss: 1.1029, test_f1: 0.3869
 epoch: 46, train_loss: 1.0355, test_loss: 1.1033, test_f1: 0.3853
 epoch: 47, train_loss: 1.0305, test_loss: 1.0983, test_f1: 0.3915
 epoch: 48, train_loss: 1.0253, test_loss: 1.0943, test_f1: 0.3892
 epoch: 49, train_loss: 1.0275, test_loss: 1.0934, test_f1: 0.3833
 epoch: 50, train_loss: 1.0221, test_loss: 1.0949, test_f1: 0.3843
 epoch: 51, train_loss: 1.0179, test_loss: 1.0840, test_f1: 0.4052
 epoch: 52, train_loss: 1.0231, test_loss: 1.0895, test_f1: 0.3868
 epoch: 53, train_loss: 1.0249, test_loss: 1.0879, test_f1: 0.3920
 epoch: 54, train_loss: 1.0167, test_loss: 1.0848, test_f1: 0.3968
 epoch: 55, train_loss: 1.0184, test_loss: 1.0841, test_f1: 0.3972
 epoch: 56, train_loss: 1.0293, test_loss: 1.0852, test_f1: 0.3965
 epoch: 57, train_loss: 1.0188, test_loss: 1.0849, test_f1: 0.3935
 epoch: 58, train_loss: 1.0093, test_loss: 1.0859, test_f1: 0.3752
 epoch: 59, train_loss: 1.0127, test_loss: 1.0786, test_f1: 0.4022
 epoch: 60, train_loss: 0.9995, test_loss: 1.0785, test_f1: 0.4036
 epoch: 61, train_loss: 1.0082, test_loss: 1.0782, test_f1: 0.4075
 epoch: 62, train_loss: 1.0180, test_loss: 1.0781, test_f1: 0.3929
 epoch: 63, train_loss: 1.0050, test_loss: 1.0769, test_f1: 0.3987
 epoch: 64, train_loss: 1.0122, test_loss: 1.0793, test_f1: 0.3850
 epoch: 65, train_loss: 1.0044, test_loss: 1.0754, test_f1: 0.3997
 epoch: 66, train_loss: 1.0014, test_loss: 1.0759, test_f1: 0.3865
 epoch: 67, train_loss: 1.0039, test_loss: 1.0757, test_f1: 0.4033
 epoch: 68, train_loss: 1.0030, test_loss: 1.0711, test_f1: 0.4020
 epoch: 69, train_loss: 1.0031, test_loss: 1.0711, test_f1: 0.4108
 epoch: 70, train_loss: 0.9984, test_loss: 1.0768, test_f1: 0.3883
 epoch: 71, train_loss: 0.9979, test_loss: 1.0665, test_f1: 0.4085
 epoch: 72, train_loss: 0.9976, test_loss: 1.0738, test_f1: 0.3966
 epoch: 73, train_loss: 0.9865, test_loss: 1.0730, test_f1: 0.3990
 epoch: 74, train_loss: 0.9935, test_loss: 1.0706, test_f1: 0.4114
 epoch: 75, train_loss: 0.9973, test_loss: 1.0729, test_f1: 0.3873
 epoch: 76, train_loss: 0.9923, test_loss: 1.0701, test_f1: 0.3891
 epoch: 77, train_loss: 0.9874, test_loss: 1.0626, test_f1: 0.4054
 epoch: 78, train_loss: 0.9968, test_loss: 1.0697, test_f1: 0.4000
 epoch: 79, train_loss: 0.9792, test_loss: 1.0621, test_f1: 0.4080
 epoch: 80, train_loss: 0.9880, test_loss: 1.0669, test_f1: 0.3890
 epoch: 81, train_loss: 0.9890, test_loss: 1.0636, test_f1: 0.4027
 epoch: 82, train_loss: 0.9884, test_loss: 1.0645, test_f1: 0.4071
 epoch: 83, train_loss: 0.9749, test_loss: 1.0643, test_f1: 0.3985
 epoch: 84, train_loss: 0.9862, test_loss: 1.0681, test_f1: 0.3860
 epoch: 85, train_loss: 0.9853, test_loss: 1.0712, test_f1: 0.3821
 epoch: 86, train_loss: 0.9884, test_loss: 1.0721, test_f1: 0.3880
 epoch: 87, train_loss: 0.9814, test_loss: 1.0683, test_f1: 0.3888
 epoch: 88, train_loss: 0.9824, test_loss: 1.0621, test_f1: 0.4053
 epoch: 89, train_loss: 0.9842, test_loss: 1.0677, test_f1: 0.3839
 epoch: 90, train_loss: 0.9768, test_loss: 1.0662, test_f1: 0.3827
 epoch: 91, train_loss: 0.9844, test_loss: 1.0644, test_f1: 0.3931
 epoch: 92, train_loss: 0.9764, test_loss: 1.0612, test_f1: 0.4031
 epoch: 93, train_loss: 0.9783, test_loss: 1.0693, test_f1: 0.3821
 epoch: 94, train_loss: 0.9811, test_loss: 1.0620, test_f1: 0.3947
 epoch: 95, train_loss: 0.9789, test_loss: 1.0574, test_f1: 0.4000
 epoch: 96, train_loss: 0.9689, test_loss: 1.0601, test_f1: 0.3922
 epoch: 97, train_loss: 0.9723, test_loss: 1.0722, test_f1: 0.3897
 epoch: 98, train_loss: 0.9743, test_loss: 1.0629, test_f1: 0.3863
 epoch: 99, train_loss: 0.9787, test_loss: 1.0642, test_f1: 0.3859
##################ITERATION #2 ****************************************
 epoch: 0, train_loss: 1.3263, test_loss: 1.3409, test_f1: 0.1365
 epoch: 1, train_loss: 1.3107, test_loss: 1.3283, test_f1: 0.1365
 epoch: 2, train_loss: 1.3020, test_loss: 1.3203, test_f1: 0.1527
 epoch: 3, train_loss: 1.2934, test_loss: 1.3137, test_f1: 0.1474
 epoch: 4, train_loss: 1.2837, test_loss: 1.3057, test_f1: 0.1835
 epoch: 5, train_loss: 1.2759, test_loss: 1.2994, test_f1: 0.1957
 epoch: 6, train_loss: 1.2653, test_loss: 1.2920, test_f1: 0.3044
 epoch: 7, train_loss: 1.2593, test_loss: 1.2849, test_f1: 0.3054
 epoch: 8, train_loss: 1.2486, test_loss: 1.2791, test_f1: 0.2978
 epoch: 9, train_loss: 1.2410, test_loss: 1.2714, test_f1: 0.2577
 epoch: 10, train_loss: 1.2294, test_loss: 1.2653, test_f1: 0.2582
 epoch: 11, train_loss: 1.2262, test_loss: 1.2591, test_f1: 0.2446
 epoch: 12, train_loss: 1.2146, test_loss: 1.2524, test_f1: 0.2281
 epoch: 13, train_loss: 1.2129, test_loss: 1.2448, test_f1: 0.2281
 epoch: 14, train_loss: 1.1948, test_loss: 1.2386, test_f1: 0.2281
 epoch: 15, train_loss: 1.1915, test_loss: 1.2274, test_f1: 0.2281
 epoch: 16, train_loss: 1.1797, test_loss: 1.2170, test_f1: 0.2586
 epoch: 17, train_loss: 1.1587, test_loss: 1.2112, test_f1: 0.3051
 epoch: 18, train_loss: 1.1599, test_loss: 1.2053, test_f1: 0.3234
 epoch: 19, train_loss: 1.1574, test_loss: 1.2029, test_f1: 0.3226
 epoch: 20, train_loss: 1.1442, test_loss: 1.1967, test_f1: 0.3120
 epoch: 21, train_loss: 1.1272, test_loss: 1.1902, test_f1: 0.3164
 epoch: 22, train_loss: 1.1349, test_loss: 1.1934, test_f1: 0.3157
 epoch: 23, train_loss: 1.1194, test_loss: 1.1870, test_f1: 0.3157
 epoch: 24, train_loss: 1.1116, test_loss: 1.1908, test_f1: 0.3221
 epoch: 25, train_loss: 1.1031, test_loss: 1.1944, test_f1: 0.3224
 epoch: 26, train_loss: 1.1066, test_loss: 1.1848, test_f1: 0.3242
 epoch: 27, train_loss: 1.0977, test_loss: 1.1833, test_f1: 0.3180
 epoch: 28, train_loss: 1.0912, test_loss: 1.1966, test_f1: 0.3177
 epoch: 29, train_loss: 1.0937, test_loss: 1.2060, test_f1: 0.3199
 epoch: 30, train_loss: 1.0909, test_loss: 1.1929, test_f1: 0.3204
 epoch: 31, train_loss: 1.0911, test_loss: 1.1900, test_f1: 0.3207
 epoch: 32, train_loss: 1.0754, test_loss: 1.2176, test_f1: 0.3181
 epoch: 33, train_loss: 1.0666, test_loss: 1.2178, test_f1: 0.3211
 epoch: 34, train_loss: 1.0758, test_loss: 1.2337, test_f1: 0.3213
 epoch: 35, train_loss: 1.0629, test_loss: 1.2249, test_f1: 0.3266
 epoch: 36, train_loss: 1.0575, test_loss: 1.2400, test_f1: 0.3250
 epoch: 37, train_loss: 1.0555, test_loss: 1.2160, test_f1: 0.3268
 epoch: 38, train_loss: 1.0519, test_loss: 1.2093, test_f1: 0.3270
 epoch: 39, train_loss: 1.0502, test_loss: 1.2568, test_f1: 0.3272
 epoch: 40, train_loss: 1.0666, test_loss: 1.2362, test_f1: 0.3279
 epoch: 41, train_loss: 1.0497, test_loss: 1.2362, test_f1: 0.3389
 epoch: 42, train_loss: 1.0492, test_loss: 1.2370, test_f1: 0.3298
 epoch: 43, train_loss: 1.0308, test_loss: 1.2733, test_f1: 0.3306
 epoch: 44, train_loss: 1.0291, test_loss: 1.2741, test_f1: 0.3366
 epoch: 45, train_loss: 1.0346, test_loss: 1.2457, test_f1: 0.3475
 epoch: 46, train_loss: 1.0319, test_loss: 1.2894, test_f1: 0.3611
 epoch: 47, train_loss: 1.0337, test_loss: 1.3162, test_f1: 0.3500
 epoch: 48, train_loss: 1.0305, test_loss: 1.2996, test_f1: 0.3489
 epoch: 49, train_loss: 1.0328, test_loss: 1.3078, test_f1: 0.3743
 epoch: 50, train_loss: 1.0247, test_loss: 1.2698, test_f1: 0.3651
 epoch: 51, train_loss: 1.0153, test_loss: 1.2678, test_f1: 0.3606
 epoch: 52, train_loss: 1.0171, test_loss: 1.2842, test_f1: 0.3474
 epoch: 53, train_loss: 1.0155, test_loss: 1.3071, test_f1: 0.3656
 epoch: 54, train_loss: 1.0174, test_loss: 1.3191, test_f1: 0.3902
 epoch: 55, train_loss: 1.0133, test_loss: 1.3311, test_f1: 0.3631
 epoch: 56, train_loss: 1.0085, test_loss: 1.3242, test_f1: 0.3631
 epoch: 57, train_loss: 1.0187, test_loss: 1.3556, test_f1: 0.3212
 epoch: 58, train_loss: 1.0174, test_loss: 1.2955, test_f1: 0.3455
 epoch: 59, train_loss: 1.0169, test_loss: 1.3148, test_f1: 0.3575
 epoch: 60, train_loss: 1.0066, test_loss: 1.3162, test_f1: 0.3783
 epoch: 61, train_loss: 1.0128, test_loss: 1.3236, test_f1: 0.3862
 epoch: 62, train_loss: 1.0062, test_loss: 1.3318, test_f1: 0.3894
 epoch: 63, train_loss: 1.0119, test_loss: 1.3493, test_f1: 0.3741
 epoch: 64, train_loss: 1.0001, test_loss: 1.3222, test_f1: 0.3779
 epoch: 65, train_loss: 1.0091, test_loss: 1.3219, test_f1: 0.3727
 epoch: 66, train_loss: 1.0028, test_loss: 1.3383, test_f1: 0.3886
 epoch: 67, train_loss: 0.9992, test_loss: 1.3127, test_f1: 0.3786
 epoch: 68, train_loss: 0.9977, test_loss: 1.3218, test_f1: 0.3766
 epoch: 69, train_loss: 0.9909, test_loss: 1.3394, test_f1: 0.3672
 epoch: 70, train_loss: 0.9984, test_loss: 1.3557, test_f1: 0.3684
 epoch: 71, train_loss: 0.9919, test_loss: 1.3668, test_f1: 0.3873
 epoch: 72, train_loss: 1.0052, test_loss: 1.3534, test_f1: 0.3816
 epoch: 73, train_loss: 0.9979, test_loss: 1.3391, test_f1: 0.3740
 epoch: 74, train_loss: 1.0049, test_loss: 1.3874, test_f1: 0.3862
 epoch: 75, train_loss: 0.9926, test_loss: 1.4263, test_f1: 0.4006
 epoch: 76, train_loss: 0.9886, test_loss: 1.3593, test_f1: 0.3822
 epoch: 77, train_loss: 0.9865, test_loss: 1.3837, test_f1: 0.3937
 epoch: 78, train_loss: 0.9858, test_loss: 1.4097, test_f1: 0.3830
 epoch: 79, train_loss: 0.9902, test_loss: 1.3894, test_f1: 0.3799
 epoch: 80, train_loss: 0.9988, test_loss: 1.4049, test_f1: 0.3822
 epoch: 81, train_loss: 0.9876, test_loss: 1.3712, test_f1: 0.3712
 epoch: 82, train_loss: 0.9902, test_loss: 1.3466, test_f1: 0.3854
 epoch: 83, train_loss: 0.9920, test_loss: 1.4721, test_f1: 0.3996
 epoch: 84, train_loss: 0.9857, test_loss: 1.3855, test_f1: 0.4052
 epoch: 85, train_loss: 0.9941, test_loss: 1.3762, test_f1: 0.3957
 epoch: 86, train_loss: 0.9873, test_loss: 1.3903, test_f1: 0.3925
 epoch: 87, train_loss: 0.9769, test_loss: 1.3944, test_f1: 0.3780
 epoch: 88, train_loss: 0.9851, test_loss: 1.4480, test_f1: 0.3764
 epoch: 89, train_loss: 0.9786, test_loss: 1.3888, test_f1: 0.3869
 epoch: 90, train_loss: 0.9776, test_loss: 1.4420, test_f1: 0.3867
 epoch: 91, train_loss: 0.9838, test_loss: 1.4197, test_f1: 0.3837
 epoch: 92, train_loss: 0.9811, test_loss: 1.4636, test_f1: 0.3873
 epoch: 93, train_loss: 0.9747, test_loss: 1.4347, test_f1: 0.4020
 epoch: 94, train_loss: 0.9807, test_loss: 1.4509, test_f1: 0.3833
 epoch: 95, train_loss: 0.9798, test_loss: 1.4482, test_f1: 0.4029
 epoch: 96, train_loss: 0.9742, test_loss: 1.4558, test_f1: 0.3966
 epoch: 97, train_loss: 0.9781, test_loss: 1.4694, test_f1: 0.3857
 epoch: 98, train_loss: 0.9757, test_loss: 1.5564, test_f1: 0.3858
 epoch: 99, train_loss: 0.9774, test_loss: 1.4198, test_f1: 0.3988
##################ITERATION #3 ****************************************
 epoch: 0, train_loss: 1.2695, test_loss: 1.3174, test_f1: 0.1365
 epoch: 1, train_loss: 1.2599, test_loss: 1.3396, test_f1: 0.1526
 epoch: 2, train_loss: 1.2504, test_loss: 1.6750, test_f1: 0.1918
 epoch: 3, train_loss: 1.2454, test_loss: 1.3717, test_f1: 0.2021
 epoch: 4, train_loss: 1.2396, test_loss: 1.4714, test_f1: 0.2177
 epoch: 5, train_loss: 1.2324, test_loss: 1.3297, test_f1: 0.2393
 epoch: 6, train_loss: 1.2208, test_loss: 1.3125, test_f1: 0.2991
 epoch: 7, train_loss: 1.2157, test_loss: 1.2737, test_f1: 0.2944
 epoch: 8, train_loss: 1.2012, test_loss: 1.2959, test_f1: 0.2818
 epoch: 9, train_loss: 1.2019, test_loss: 1.2636, test_f1: 0.2481
 epoch: 10, train_loss: 1.1845, test_loss: 1.2540, test_f1: 0.2725
 epoch: 11, train_loss: 1.1785, test_loss: 1.2822, test_f1: 0.2744
 epoch: 12, train_loss: 1.1752, test_loss: 1.5007, test_f1: 0.2920
 epoch: 13, train_loss: 1.1670, test_loss: 1.2930, test_f1: 0.2988
 epoch: 14, train_loss: 1.1622, test_loss: 1.2534, test_f1: 0.3133
 epoch: 15, train_loss: 1.1573, test_loss: 1.2241, test_f1: 0.3417
 epoch: 16, train_loss: 1.1556, test_loss: 1.2213, test_f1: 0.3439
 epoch: 17, train_loss: 1.1432, test_loss: 1.2418, test_f1: 0.3387
 epoch: 18, train_loss: 1.1409, test_loss: 1.2118, test_f1: 0.3538
 epoch: 19, train_loss: 1.1358, test_loss: 1.2483, test_f1: 0.3460
 epoch: 20, train_loss: 1.1288, test_loss: 1.1920, test_f1: 0.3539
 epoch: 21, train_loss: 1.1200, test_loss: 1.1887, test_f1: 0.3531
 epoch: 22, train_loss: 1.1140, test_loss: 1.1891, test_f1: 0.3608
 epoch: 23, train_loss: 1.1054, test_loss: 1.1849, test_f1: 0.3629
 epoch: 24, train_loss: 1.1151, test_loss: 1.1830, test_f1: 0.3537
 epoch: 25, train_loss: 1.0971, test_loss: 1.1733, test_f1: 0.3730
 epoch: 26, train_loss: 1.0944, test_loss: 1.1743, test_f1: 0.3676
 epoch: 27, train_loss: 1.0864, test_loss: 1.1616, test_f1: 0.3650
 epoch: 28, train_loss: 1.0779, test_loss: 1.1574, test_f1: 0.3669
 epoch: 29, train_loss: 1.0847, test_loss: 1.1541, test_f1: 0.3658
 epoch: 30, train_loss: 1.0672, test_loss: 1.1503, test_f1: 0.3658
 epoch: 31, train_loss: 1.0793, test_loss: 1.1417, test_f1: 0.3674
 epoch: 32, train_loss: 1.0614, test_loss: 1.1557, test_f1: 0.3652
 epoch: 33, train_loss: 1.0629, test_loss: 1.1453, test_f1: 0.3770
 epoch: 34, train_loss: 1.0604, test_loss: 1.1405, test_f1: 0.3781
 epoch: 35, train_loss: 1.0481, test_loss: 1.1374, test_f1: 0.3698
 epoch: 36, train_loss: 1.0423, test_loss: 1.1281, test_f1: 0.4080
 epoch: 37, train_loss: 1.0425, test_loss: 1.1396, test_f1: 0.3791
 epoch: 38, train_loss: 1.0318, test_loss: 1.1390, test_f1: 0.3584
 epoch: 39, train_loss: 1.0355, test_loss: 1.1461, test_f1: 0.3800
 epoch: 40, train_loss: 1.0370, test_loss: 1.1414, test_f1: 0.3859
 epoch: 41, train_loss: 1.0305, test_loss: 1.1303, test_f1: 0.3783
 epoch: 42, train_loss: 1.0320, test_loss: 1.1343, test_f1: 0.3816
 epoch: 43, train_loss: 1.0218, test_loss: 1.1237, test_f1: 0.3796
 epoch: 44, train_loss: 1.0220, test_loss: 1.1093, test_f1: 0.4101
 epoch: 45, train_loss: 1.0175, test_loss: 1.1187, test_f1: 0.3942
 epoch: 46, train_loss: 1.0222, test_loss: 1.1182, test_f1: 0.3751
 epoch: 47, train_loss: 1.0185, test_loss: 1.1093, test_f1: 0.3826
 epoch: 48, train_loss: 1.0157, test_loss: 1.1029, test_f1: 0.3938
 epoch: 49, train_loss: 1.0124, test_loss: 1.1280, test_f1: 0.3905
 epoch: 50, train_loss: 1.0086, test_loss: 1.1154, test_f1: 0.4024
 epoch: 51, train_loss: 1.0094, test_loss: 1.1044, test_f1: 0.3944
 epoch: 52, train_loss: 1.0031, test_loss: 1.1124, test_f1: 0.3951
 epoch: 53, train_loss: 1.0046, test_loss: 1.1194, test_f1: 0.3968
 epoch: 54, train_loss: 1.0108, test_loss: 1.1134, test_f1: 0.3911
 epoch: 55, train_loss: 0.9927, test_loss: 1.1164, test_f1: 0.3994
 epoch: 56, train_loss: 0.9964, test_loss: 1.1139, test_f1: 0.3903
 epoch: 57, train_loss: 0.9952, test_loss: 1.0940, test_f1: 0.3928
 epoch: 58, train_loss: 0.9961, test_loss: 1.1213, test_f1: 0.3895
 epoch: 59, train_loss: 1.0034, test_loss: 1.1072, test_f1: 0.4029
 epoch: 60, train_loss: 0.9922, test_loss: 1.1357, test_f1: 0.3871
 epoch: 61, train_loss: 0.9944, test_loss: 1.1065, test_f1: 0.3821
 epoch: 62, train_loss: 0.9923, test_loss: 1.1280, test_f1: 0.3877
 epoch: 63, train_loss: 0.9852, test_loss: 1.1145, test_f1: 0.3886
 epoch: 64, train_loss: 1.0002, test_loss: 1.0970, test_f1: 0.4107
 epoch: 65, train_loss: 0.9903, test_loss: 1.1267, test_f1: 0.3901
 epoch: 66, train_loss: 0.9877, test_loss: 1.1035, test_f1: 0.3929
 epoch: 67, train_loss: 0.9866, test_loss: 1.0976, test_f1: 0.3877
 epoch: 68, train_loss: 0.9865, test_loss: 1.1155, test_f1: 0.3843
 epoch: 69, train_loss: 0.9863, test_loss: 1.1149, test_f1: 0.3922
 epoch: 70, train_loss: 0.9847, test_loss: 1.1086, test_f1: 0.3884
 epoch: 71, train_loss: 0.9813, test_loss: 1.1177, test_f1: 0.3813
 epoch: 72, train_loss: 0.9801, test_loss: 1.1109, test_f1: 0.3857
 epoch: 73, train_loss: 0.9808, test_loss: 1.1121, test_f1: 0.3847
 epoch: 74, train_loss: 0.9862, test_loss: 1.0928, test_f1: 0.4007
 epoch: 75, train_loss: 0.9771, test_loss: 1.1083, test_f1: 0.3884
 epoch: 76, train_loss: 0.9842, test_loss: 1.1333, test_f1: 0.4002
 epoch: 77, train_loss: 0.9800, test_loss: 1.1087, test_f1: 0.3854
 epoch: 78, train_loss: 0.9798, test_loss: 1.0939, test_f1: 0.3922
 epoch: 79, train_loss: 0.9826, test_loss: 1.0977, test_f1: 0.3943
 epoch: 80, train_loss: 0.9737, test_loss: 1.1183, test_f1: 0.3973
 epoch: 81, train_loss: 0.9829, test_loss: 1.1040, test_f1: 0.4026
 epoch: 82, train_loss: 0.9776, test_loss: 1.1049, test_f1: 0.4027
 epoch: 83, train_loss: 0.9562, test_loss: 1.0920, test_f1: 0.4001
 epoch: 84, train_loss: 0.9641, test_loss: 1.1029, test_f1: 0.4027
 epoch: 85, train_loss: 0.9791, test_loss: 1.1156, test_f1: 0.4038
 epoch: 86, train_loss: 0.9727, test_loss: 1.0956, test_f1: 0.4031
 epoch: 87, train_loss: 0.9620, test_loss: 1.0904, test_f1: 0.4175
 epoch: 88, train_loss: 0.9698, test_loss: 1.0969, test_f1: 0.4107
 epoch: 89, train_loss: 0.9687, test_loss: 1.1166, test_f1: 0.4198
 epoch: 90, train_loss: 0.9607, test_loss: 1.1305, test_f1: 0.4084
 epoch: 91, train_loss: 0.9660, test_loss: 1.1233, test_f1: 0.3988
 epoch: 92, train_loss: 0.9618, test_loss: 1.1119, test_f1: 0.4121
 epoch: 93, train_loss: 0.9680, test_loss: 1.1196, test_f1: 0.4067
 epoch: 94, train_loss: 0.9664, test_loss: 1.1297, test_f1: 0.4124
 epoch: 95, train_loss: 0.9568, test_loss: 1.0926, test_f1: 0.4162
 epoch: 96, train_loss: 0.9669, test_loss: 1.1144, test_f1: 0.4055
 epoch: 97, train_loss: 0.9616, test_loss: 1.1117, test_f1: 0.4035
 epoch: 98, train_loss: 0.9697, test_loss: 1.0748, test_f1: 0.4330
 epoch: 99, train_loss: 0.9590, test_loss: 1.0997, test_f1: 0.4119
##################ITERATION #4 ****************************************
 epoch: 0, train_loss: 1.2754, test_loss: 1.3066, test_f1: 0.3431
 epoch: 1, train_loss: 1.2601, test_loss: 1.2944, test_f1: 0.2935
 epoch: 2, train_loss: 1.2500, test_loss: 1.2929, test_f1: 0.2654
 epoch: 3, train_loss: 1.2472, test_loss: 1.2874, test_f1: 0.2557
 epoch: 4, train_loss: 1.2363, test_loss: 1.2843, test_f1: 0.2325
 epoch: 5, train_loss: 1.2351, test_loss: 1.2796, test_f1: 0.2281
 epoch: 6, train_loss: 1.2231, test_loss: 1.2768, test_f1: 0.2281
 epoch: 7, train_loss: 1.2194, test_loss: 1.2723, test_f1: 0.2281
 epoch: 8, train_loss: 1.2142, test_loss: 1.2707, test_f1: 0.2281
 epoch: 9, train_loss: 1.2083, test_loss: 1.2672, test_f1: 0.2281
 epoch: 10, train_loss: 1.2084, test_loss: 1.2633, test_f1: 0.2259
 epoch: 11, train_loss: 1.1992, test_loss: 1.2603, test_f1: 0.2259
 epoch: 12, train_loss: 1.2046, test_loss: 1.2550, test_f1: 0.2259
 epoch: 13, train_loss: 1.1857, test_loss: 1.2509, test_f1: 0.2259
 epoch: 14, train_loss: 1.1807, test_loss: 1.2479, test_f1: 0.2368
 epoch: 15, train_loss: 1.1766, test_loss: 1.2431, test_f1: 0.2514
 epoch: 16, train_loss: 1.1739, test_loss: 1.2386, test_f1: 0.2696
 epoch: 17, train_loss: 1.1684, test_loss: 1.2334, test_f1: 0.3035
 epoch: 18, train_loss: 1.1629, test_loss: 1.2276, test_f1: 0.3188
 epoch: 19, train_loss: 1.1587, test_loss: 1.2241, test_f1: 0.3237
 epoch: 20, train_loss: 1.1463, test_loss: 1.2185, test_f1: 0.3199
 epoch: 21, train_loss: 1.1482, test_loss: 1.2192, test_f1: 0.3204
 epoch: 22, train_loss: 1.1425, test_loss: 1.2139, test_f1: 0.3269
 epoch: 23, train_loss: 1.1340, test_loss: 1.2103, test_f1: 0.3200
 epoch: 24, train_loss: 1.1239, test_loss: 1.2017, test_f1: 0.3324
 epoch: 25, train_loss: 1.1307, test_loss: 1.1988, test_f1: 0.3427
 epoch: 26, train_loss: 1.1185, test_loss: 1.1953, test_f1: 0.3484
 epoch: 27, train_loss: 1.1044, test_loss: 1.1901, test_f1: 0.3658
 epoch: 28, train_loss: 1.1099, test_loss: 1.1810, test_f1: 0.3527
 epoch: 29, train_loss: 1.1105, test_loss: 1.1813, test_f1: 0.3470
 epoch: 30, train_loss: 1.1011, test_loss: 1.1679, test_f1: 0.3564
 epoch: 31, train_loss: 1.0939, test_loss: 1.1705, test_f1: 0.3659
 epoch: 32, train_loss: 1.0934, test_loss: 1.1696, test_f1: 0.3507
 epoch: 33, train_loss: 1.0835, test_loss: 1.1631, test_f1: 0.3642
 epoch: 34, train_loss: 1.0769, test_loss: 1.1558, test_f1: 0.3527
 epoch: 35, train_loss: 1.0795, test_loss: 1.1472, test_f1: 0.3548
 epoch: 36, train_loss: 1.0776, test_loss: 1.1513, test_f1: 0.3486
 epoch: 37, train_loss: 1.0648, test_loss: 1.1457, test_f1: 0.3480
 epoch: 38, train_loss: 1.0686, test_loss: 1.1447, test_f1: 0.3807
 epoch: 39, train_loss: 1.0613, test_loss: 1.1415, test_f1: 0.3524
 epoch: 40, train_loss: 1.0532, test_loss: 1.1336, test_f1: 0.3537
 epoch: 41, train_loss: 1.0524, test_loss: 1.1397, test_f1: 0.3617
 epoch: 42, train_loss: 1.0593, test_loss: 1.1353, test_f1: 0.3826
 epoch: 43, train_loss: 1.0480, test_loss: 1.1349, test_f1: 0.3577
 epoch: 44, train_loss: 1.0445, test_loss: 1.1309, test_f1: 0.3571
 epoch: 45, train_loss: 1.0429, test_loss: 1.1280, test_f1: 0.3498
 epoch: 46, train_loss: 1.0392, test_loss: 1.1220, test_f1: 0.3859
 epoch: 47, train_loss: 1.0355, test_loss: 1.1122, test_f1: 0.3769
 epoch: 48, train_loss: 1.0355, test_loss: 1.1229, test_f1: 0.3557
 epoch: 49, train_loss: 1.0336, test_loss: 1.1110, test_f1: 0.3662
 epoch: 50, train_loss: 1.0283, test_loss: 1.1118, test_f1: 0.3671
 epoch: 51, train_loss: 1.0253, test_loss: 1.1192, test_f1: 0.3775
 epoch: 52, train_loss: 1.0239, test_loss: 1.1062, test_f1: 0.3807
 epoch: 53, train_loss: 1.0319, test_loss: 1.1106, test_f1: 0.3797
 epoch: 54, train_loss: 1.0209, test_loss: 1.1184, test_f1: 0.3838
 epoch: 55, train_loss: 1.0212, test_loss: 1.1184, test_f1: 0.3696
 epoch: 56, train_loss: 1.0160, test_loss: 1.1195, test_f1: 0.3760
 epoch: 57, train_loss: 1.0170, test_loss: 1.0960, test_f1: 0.3681
 epoch: 58, train_loss: 1.0267, test_loss: 1.1082, test_f1: 0.3614
 epoch: 59, train_loss: 1.0117, test_loss: 1.1083, test_f1: 0.3983
 epoch: 60, train_loss: 1.0136, test_loss: 1.1080, test_f1: 0.3827
 epoch: 61, train_loss: 1.0157, test_loss: 1.1064, test_f1: 0.3739
 epoch: 62, train_loss: 1.0190, test_loss: 1.1076, test_f1: 0.3760
 epoch: 63, train_loss: 1.0043, test_loss: 1.1049, test_f1: 0.3860
 epoch: 64, train_loss: 1.0086, test_loss: 1.1075, test_f1: 0.3877
 epoch: 65, train_loss: 1.0137, test_loss: 1.0956, test_f1: 0.3887
 epoch: 66, train_loss: 1.0231, test_loss: 1.1122, test_f1: 0.3769
 epoch: 67, train_loss: 1.0032, test_loss: 1.1023, test_f1: 0.3806
 epoch: 68, train_loss: 1.0042, test_loss: 1.1016, test_f1: 0.3989
 epoch: 69, train_loss: 1.0064, test_loss: 1.1074, test_f1: 0.3802
 epoch: 70, train_loss: 1.0163, test_loss: 1.1090, test_f1: 0.4014
 epoch: 71, train_loss: 0.9996, test_loss: 1.1162, test_f1: 0.3734
 epoch: 72, train_loss: 0.9988, test_loss: 1.1102, test_f1: 0.3752
 epoch: 73, train_loss: 1.0079, test_loss: 1.1022, test_f1: 0.3800
 epoch: 74, train_loss: 1.0078, test_loss: 1.1025, test_f1: 0.3825
 epoch: 75, train_loss: 0.9894, test_loss: 1.1109, test_f1: 0.3844
 epoch: 76, train_loss: 0.9987, test_loss: 1.1121, test_f1: 0.3784
 epoch: 77, train_loss: 0.9964, test_loss: 1.1028, test_f1: 0.3862
 epoch: 78, train_loss: 1.0044, test_loss: 1.0966, test_f1: 0.3992
 epoch: 79, train_loss: 0.9998, test_loss: 1.1099, test_f1: 0.3813
 epoch: 80, train_loss: 1.0029, test_loss: 1.1122, test_f1: 0.3753
 epoch: 81, train_loss: 1.0000, test_loss: 1.0986, test_f1: 0.3913
 epoch: 82, train_loss: 0.9979, test_loss: 1.1093, test_f1: 0.3842
 epoch: 83, train_loss: 0.9828, test_loss: 1.1112, test_f1: 0.3752
 epoch: 84, train_loss: 0.9913, test_loss: 1.0966, test_f1: 0.3859
 epoch: 85, train_loss: 0.9934, test_loss: 1.1043, test_f1: 0.3923
 epoch: 86, train_loss: 0.9900, test_loss: 1.0943, test_f1: 0.3989
 epoch: 87, train_loss: 0.9840, test_loss: 1.1011, test_f1: 0.3782
 epoch: 88, train_loss: 0.9870, test_loss: 1.1064, test_f1: 0.3807
 epoch: 89, train_loss: 0.9864, test_loss: 1.0976, test_f1: 0.3782
 epoch: 90, train_loss: 0.9842, test_loss: 1.0952, test_f1: 0.4006
 epoch: 91, train_loss: 0.9827, test_loss: 1.1010, test_f1: 0.4051
 epoch: 92, train_loss: 0.9903, test_loss: 1.1077, test_f1: 0.3903
 epoch: 93, train_loss: 0.9853, test_loss: 1.0945, test_f1: 0.3765
 epoch: 94, train_loss: 0.9810, test_loss: 1.1126, test_f1: 0.3786
 epoch: 95, train_loss: 0.9806, test_loss: 1.1039, test_f1: 0.3926
 epoch: 96, train_loss: 0.9820, test_loss: 1.0974, test_f1: 0.3799
 epoch: 97, train_loss: 0.9777, test_loss: 1.0887, test_f1: 0.3845
 epoch: 98, train_loss: 0.9821, test_loss: 1.1009, test_f1: 0.3943
 epoch: 99, train_loss: 0.9781, test_loss: 1.1038, test_f1: 0.3778
##################ITERATION #5 ****************************************
 epoch: 0, train_loss: 1.2976, test_loss: 1.3238, test_f1: 0.2281
 epoch: 1, train_loss: 1.2826, test_loss: 1.3318, test_f1: 0.2281
 epoch: 2, train_loss: 1.2632, test_loss: 1.3220, test_f1: 0.2281
 epoch: 3, train_loss: 1.2520, test_loss: 1.3042, test_f1: 0.2281
 epoch: 4, train_loss: 1.2486, test_loss: 1.3131, test_f1: 0.2281
 epoch: 5, train_loss: 1.2378, test_loss: 1.2864, test_f1: 0.2270
 epoch: 6, train_loss: 1.2307, test_loss: 1.2848, test_f1: 0.2246
 epoch: 7, train_loss: 1.2218, test_loss: 1.2831, test_f1: 0.2293
 epoch: 8, train_loss: 1.2059, test_loss: 1.2723, test_f1: 0.2272
 epoch: 9, train_loss: 1.1995, test_loss: 1.2639, test_f1: 0.2259
 epoch: 10, train_loss: 1.2058, test_loss: 1.2645, test_f1: 0.2336
 epoch: 11, train_loss: 1.2005, test_loss: 1.2494, test_f1: 0.2390
 epoch: 12, train_loss: 1.1895, test_loss: 1.2565, test_f1: 0.2631
 epoch: 13, train_loss: 1.1795, test_loss: 1.2508, test_f1: 0.2631
 epoch: 14, train_loss: 1.1682, test_loss: 1.2449, test_f1: 0.2759
 epoch: 15, train_loss: 1.1596, test_loss: 1.2365, test_f1: 0.2759
 epoch: 16, train_loss: 1.1661, test_loss: 1.2253, test_f1: 0.2984
 epoch: 17, train_loss: 1.1676, test_loss: 1.2206, test_f1: 0.3040
 epoch: 18, train_loss: 1.1545, test_loss: 1.2189, test_f1: 0.3083
 epoch: 19, train_loss: 1.1447, test_loss: 1.2075, test_f1: 0.3083
 epoch: 20, train_loss: 1.1357, test_loss: 1.2064, test_f1: 0.3239
 epoch: 21, train_loss: 1.1291, test_loss: 1.2036, test_f1: 0.3243
 epoch: 22, train_loss: 1.1265, test_loss: 1.1949, test_f1: 0.3256
 epoch: 23, train_loss: 1.1259, test_loss: 1.1894, test_f1: 0.3262
 epoch: 24, train_loss: 1.1184, test_loss: 1.1856, test_f1: 0.3290
 epoch: 25, train_loss: 1.1183, test_loss: 1.1818, test_f1: 0.3255
 epoch: 26, train_loss: 1.1144, test_loss: 1.1801, test_f1: 0.3180
 epoch: 27, train_loss: 1.1042, test_loss: 1.1730, test_f1: 0.3243
 epoch: 28, train_loss: 1.1027, test_loss: 1.1706, test_f1: 0.3255
 epoch: 29, train_loss: 1.0999, test_loss: 1.1735, test_f1: 0.3195
 epoch: 30, train_loss: 1.1001, test_loss: 1.1757, test_f1: 0.3164
 epoch: 31, train_loss: 1.0857, test_loss: 1.1777, test_f1: 0.3180
 epoch: 32, train_loss: 1.0694, test_loss: 1.1720, test_f1: 0.3169
 epoch: 33, train_loss: 1.0830, test_loss: 1.1638, test_f1: 0.3287
 epoch: 34, train_loss: 1.0843, test_loss: 1.1750, test_f1: 0.3149
 epoch: 35, train_loss: 1.0739, test_loss: 1.1560, test_f1: 0.3423
 epoch: 36, train_loss: 1.0705, test_loss: 1.1585, test_f1: 0.3532
 epoch: 37, train_loss: 1.0635, test_loss: 1.1569, test_f1: 0.3530
 epoch: 38, train_loss: 1.0625, test_loss: 1.1501, test_f1: 0.3517
 epoch: 39, train_loss: 1.0534, test_loss: 1.1542, test_f1: 0.3457
 epoch: 40, train_loss: 1.0571, test_loss: 1.1473, test_f1: 0.3470
 epoch: 41, train_loss: 1.0531, test_loss: 1.1590, test_f1: 0.3469
 epoch: 42, train_loss: 1.0444, test_loss: 1.1463, test_f1: 0.3504
 epoch: 43, train_loss: 1.0279, test_loss: 1.1715, test_f1: 0.3426
 epoch: 44, train_loss: 1.0370, test_loss: 1.1455, test_f1: 0.3604
 epoch: 45, train_loss: 1.0302, test_loss: 1.1348, test_f1: 0.3493
 epoch: 46, train_loss: 1.0342, test_loss: 1.1323, test_f1: 0.3443
 epoch: 47, train_loss: 1.0300, test_loss: 1.1493, test_f1: 0.3387
 epoch: 48, train_loss: 1.0308, test_loss: 1.1387, test_f1: 0.3406
 epoch: 49, train_loss: 1.0263, test_loss: 1.1374, test_f1: 0.3440
 epoch: 50, train_loss: 1.0138, test_loss: 1.1956, test_f1: 0.3393
 epoch: 51, train_loss: 1.0099, test_loss: 1.1484, test_f1: 0.3430
 epoch: 52, train_loss: 1.0144, test_loss: 1.1533, test_f1: 0.3418
 epoch: 53, train_loss: 1.0175, test_loss: 1.1651, test_f1: 0.3472
 epoch: 54, train_loss: 1.0114, test_loss: 1.1516, test_f1: 0.3428
 epoch: 55, train_loss: 1.0045, test_loss: 1.1505, test_f1: 0.3459
 epoch: 56, train_loss: 1.0187, test_loss: 1.1623, test_f1: 0.3468
 epoch: 57, train_loss: 1.0108, test_loss: 1.1537, test_f1: 0.3470
 epoch: 58, train_loss: 0.9996, test_loss: 1.1597, test_f1: 0.3452
 epoch: 59, train_loss: 1.0012, test_loss: 1.1449, test_f1: 0.3509
 epoch: 60, train_loss: 0.9997, test_loss: 1.1265, test_f1: 0.3461
 epoch: 61, train_loss: 0.9996, test_loss: 1.2110, test_f1: 0.3429
 epoch: 62, train_loss: 1.0030, test_loss: 1.1506, test_f1: 0.3499
 epoch: 63, train_loss: 0.9968, test_loss: 1.3085, test_f1: 0.3494
 epoch: 64, train_loss: 0.9990, test_loss: 1.1314, test_f1: 0.3506
 epoch: 65, train_loss: 0.9963, test_loss: 1.1428, test_f1: 0.3533
 epoch: 66, train_loss: 0.9882, test_loss: 1.1267, test_f1: 0.3509
 epoch: 67, train_loss: 0.9948, test_loss: 1.1316, test_f1: 0.3470
 epoch: 68, train_loss: 0.9801, test_loss: 1.1799, test_f1: 0.3428
 epoch: 69, train_loss: 0.9935, test_loss: 1.1178, test_f1: 0.3511
 epoch: 70, train_loss: 0.9853, test_loss: 1.1433, test_f1: 0.3479
 epoch: 71, train_loss: 0.9906, test_loss: 1.1242, test_f1: 0.3628
 epoch: 72, train_loss: 0.9888, test_loss: 1.1935, test_f1: 0.3455
 epoch: 73, train_loss: 0.9794, test_loss: 1.3366, test_f1: 0.3489
 epoch: 74, train_loss: 0.9809, test_loss: 1.1032, test_f1: 0.3578
 epoch: 75, train_loss: 0.9933, test_loss: 1.1396, test_f1: 0.3581
 epoch: 76, train_loss: 0.9869, test_loss: 1.1191, test_f1: 0.3559
 epoch: 77, train_loss: 0.9808, test_loss: 1.1155, test_f1: 0.3551
 epoch: 78, train_loss: 0.9883, test_loss: 1.1581, test_f1: 0.3472
 epoch: 79, train_loss: 0.9768, test_loss: 1.1188, test_f1: 0.3476
 epoch: 80, train_loss: 0.9760, test_loss: 1.1641, test_f1: 0.3453
 epoch: 81, train_loss: 0.9753, test_loss: 1.1947, test_f1: 0.3453
 epoch: 82, train_loss: 0.9678, test_loss: 1.2668, test_f1: 0.3447
 epoch: 83, train_loss: 0.9680, test_loss: 1.2123, test_f1: 0.3480
 epoch: 84, train_loss: 0.9724, test_loss: 1.1221, test_f1: 0.3522
 epoch: 85, train_loss: 0.9740, test_loss: 1.1405, test_f1: 0.3390
 epoch: 86, train_loss: 0.9747, test_loss: 1.2347, test_f1: 0.3438
 epoch: 87, train_loss: 0.9779, test_loss: 1.1258, test_f1: 0.3500
 epoch: 88, train_loss: 0.9662, test_loss: 1.1551, test_f1: 0.3386
 epoch: 89, train_loss: 0.9680, test_loss: 1.1104, test_f1: 0.3655
 epoch: 90, train_loss: 0.9666, test_loss: 1.1535, test_f1: 0.3538
 epoch: 91, train_loss: 0.9732, test_loss: 1.1267, test_f1: 0.3509
 epoch: 92, train_loss: 0.9627, test_loss: 1.1166, test_f1: 0.3491
 epoch: 93, train_loss: 0.9661, test_loss: 1.1265, test_f1: 0.3516
 epoch: 94, train_loss: 0.9722, test_loss: 1.1182, test_f1: 0.3462
 epoch: 95, train_loss: 0.9674, test_loss: 1.1112, test_f1: 0.3422
 epoch: 96, train_loss: 0.9572, test_loss: 1.1207, test_f1: 0.3619
 epoch: 97, train_loss: 0.9648, test_loss: 1.1056, test_f1: 0.3521
 epoch: 98, train_loss: 0.9633, test_loss: 1.1662, test_f1: 0.3452
 epoch: 99, train_loss: 0.9574, test_loss: 1.1951, test_f1: 0.3426
##################ITERATION #6 ****************************************
 epoch: 0, train_loss: 1.2787, test_loss: 1.3186, test_f1: 0.2283
 epoch: 1, train_loss: 1.2626, test_loss: 1.3219, test_f1: 0.2642
 epoch: 2, train_loss: 1.2549, test_loss: 1.3181, test_f1: 0.2618
 epoch: 3, train_loss: 1.2490, test_loss: 1.3109, test_f1: 0.2585
 epoch: 4, train_loss: 1.2345, test_loss: 1.3106, test_f1: 0.2585
 epoch: 5, train_loss: 1.2322, test_loss: 1.3074, test_f1: 0.2617
 epoch: 6, train_loss: 1.2356, test_loss: 1.3055, test_f1: 0.2582
 epoch: 7, train_loss: 1.2331, test_loss: 1.3039, test_f1: 0.2583
 epoch: 8, train_loss: 1.2274, test_loss: 1.3021, test_f1: 0.2582
 epoch: 9, train_loss: 1.2178, test_loss: 1.2995, test_f1: 0.2582
 epoch: 10, train_loss: 1.2158, test_loss: 1.2960, test_f1: 0.2615
 epoch: 11, train_loss: 1.2197, test_loss: 1.2894, test_f1: 0.2583
 epoch: 12, train_loss: 1.2000, test_loss: 1.2866, test_f1: 0.2587
 epoch: 13, train_loss: 1.2049, test_loss: 1.2866, test_f1: 0.2587
 epoch: 14, train_loss: 1.1832, test_loss: 1.2797, test_f1: 0.2587
 epoch: 15, train_loss: 1.1861, test_loss: 1.2763, test_f1: 0.2696
 epoch: 16, train_loss: 1.1802, test_loss: 1.2692, test_f1: 0.2696
 epoch: 17, train_loss: 1.1789, test_loss: 1.2679, test_f1: 0.2798
 epoch: 18, train_loss: 1.1795, test_loss: 1.2624, test_f1: 0.2982
 epoch: 19, train_loss: 1.1621, test_loss: 1.2591, test_f1: 0.3064
 epoch: 20, train_loss: 1.1627, test_loss: 1.2537, test_f1: 0.3320
 epoch: 21, train_loss: 1.1538, test_loss: 1.2450, test_f1: 0.3320
 epoch: 22, train_loss: 1.1592, test_loss: 1.2433, test_f1: 0.3536
 epoch: 23, train_loss: 1.1537, test_loss: 1.2376, test_f1: 0.3536
 epoch: 24, train_loss: 1.1441, test_loss: 1.2419, test_f1: 0.3571
 epoch: 25, train_loss: 1.1350, test_loss: 1.2336, test_f1: 0.3594
 epoch: 26, train_loss: 1.1302, test_loss: 1.2228, test_f1: 0.3576
 epoch: 27, train_loss: 1.1322, test_loss: 1.2344, test_f1: 0.3527
 epoch: 28, train_loss: 1.1312, test_loss: 1.2333, test_f1: 0.3469
 epoch: 29, train_loss: 1.1168, test_loss: 1.2257, test_f1: 0.3510
 epoch: 30, train_loss: 1.1268, test_loss: 1.2423, test_f1: 0.3557
 epoch: 31, train_loss: 1.1052, test_loss: 1.2196, test_f1: 0.3474
 epoch: 32, train_loss: 1.1122, test_loss: 1.2172, test_f1: 0.3466
 epoch: 33, train_loss: 1.1025, test_loss: 1.2066, test_f1: 0.3458
 epoch: 34, train_loss: 1.0962, test_loss: 1.2338, test_f1: 0.3478
 epoch: 35, train_loss: 1.0961, test_loss: 1.2189, test_f1: 0.3436
 epoch: 36, train_loss: 1.0943, test_loss: 1.2030, test_f1: 0.3417
 epoch: 37, train_loss: 1.0941, test_loss: 1.2130, test_f1: 0.3460
 epoch: 38, train_loss: 1.0766, test_loss: 1.2016, test_f1: 0.3438
 epoch: 39, train_loss: 1.0761, test_loss: 1.2107, test_f1: 0.3441
 epoch: 40, train_loss: 1.0802, test_loss: 1.2091, test_f1: 0.3458
 epoch: 41, train_loss: 1.0826, test_loss: 1.1895, test_f1: 0.3401
 epoch: 42, train_loss: 1.0814, test_loss: 1.2087, test_f1: 0.3438
 epoch: 43, train_loss: 1.0607, test_loss: 1.2387, test_f1: 0.3458
 epoch: 44, train_loss: 1.0576, test_loss: 1.2240, test_f1: 0.3458
 epoch: 45, train_loss: 1.0660, test_loss: 1.1962, test_f1: 0.3460
 epoch: 46, train_loss: 1.0675, test_loss: 1.1874, test_f1: 0.3462
 epoch: 47, train_loss: 1.0564, test_loss: 1.2089, test_f1: 0.3595
 epoch: 48, train_loss: 1.0584, test_loss: 1.1975, test_f1: 0.3458
 epoch: 49, train_loss: 1.0571, test_loss: 1.1781, test_f1: 0.3514
 epoch: 50, train_loss: 1.0479, test_loss: 1.1993, test_f1: 0.3458
 epoch: 51, train_loss: 1.0485, test_loss: 1.1956, test_f1: 0.3458
 epoch: 52, train_loss: 1.0521, test_loss: 1.1908, test_f1: 0.3460
 epoch: 53, train_loss: 1.0534, test_loss: 1.1943, test_f1: 0.3458
 epoch: 54, train_loss: 1.0434, test_loss: 1.2019, test_f1: 0.3456
 epoch: 55, train_loss: 1.0416, test_loss: 1.1970, test_f1: 0.3504
 epoch: 56, train_loss: 1.0573, test_loss: 1.1833, test_f1: 0.3460
 epoch: 57, train_loss: 1.0477, test_loss: 1.2110, test_f1: 0.3460
 epoch: 58, train_loss: 1.0376, test_loss: 1.2137, test_f1: 0.3430
 epoch: 59, train_loss: 1.0316, test_loss: 1.1801, test_f1: 0.3460
 epoch: 60, train_loss: 1.0394, test_loss: 1.2274, test_f1: 0.3428
 epoch: 61, train_loss: 1.0387, test_loss: 1.2069, test_f1: 0.3458
 epoch: 62, train_loss: 1.0318, test_loss: 1.2030, test_f1: 0.3458
 epoch: 63, train_loss: 1.0320, test_loss: 1.1602, test_f1: 0.3626
 epoch: 64, train_loss: 1.0316, test_loss: 1.2327, test_f1: 0.3475
 epoch: 65, train_loss: 1.0372, test_loss: 1.1842, test_f1: 0.3460
 epoch: 66, train_loss: 1.0292, test_loss: 1.2554, test_f1: 0.3458
 epoch: 67, train_loss: 1.0306, test_loss: 1.2058, test_f1: 0.3430
 epoch: 68, train_loss: 1.0261, test_loss: 1.2319, test_f1: 0.3473
 epoch: 69, train_loss: 1.0284, test_loss: 1.2824, test_f1: 0.3474
 epoch: 70, train_loss: 1.0128, test_loss: 1.1802, test_f1: 0.3462
 epoch: 71, train_loss: 1.0279, test_loss: 1.1890, test_f1: 0.3499
 epoch: 72, train_loss: 1.0221, test_loss: 1.2081, test_f1: 0.3551
 epoch: 73, train_loss: 1.0223, test_loss: 1.2955, test_f1: 0.3588
 epoch: 74, train_loss: 1.0230, test_loss: 1.1636, test_f1: 0.3577
 epoch: 75, train_loss: 1.0252, test_loss: 1.2101, test_f1: 0.3584
 epoch: 76, train_loss: 1.0225, test_loss: 1.1795, test_f1: 0.3476
 epoch: 77, train_loss: 1.0227, test_loss: 1.1880, test_f1: 0.3473
 epoch: 78, train_loss: 1.0234, test_loss: 1.1886, test_f1: 0.3497
 epoch: 79, train_loss: 1.0121, test_loss: 1.2197, test_f1: 0.3634
 epoch: 80, train_loss: 1.0207, test_loss: 1.2202, test_f1: 0.3678
 epoch: 81, train_loss: 1.0136, test_loss: 1.1883, test_f1: 0.3594
 epoch: 82, train_loss: 1.0237, test_loss: 1.2367, test_f1: 0.3430
 epoch: 83, train_loss: 1.0196, test_loss: 1.1869, test_f1: 0.3482
 epoch: 84, train_loss: 1.0185, test_loss: 1.2009, test_f1: 0.3586
 epoch: 85, train_loss: 1.0120, test_loss: 1.1924, test_f1: 0.3499
 epoch: 86, train_loss: 1.0070, test_loss: 1.2365, test_f1: 0.3482
 epoch: 87, train_loss: 1.0063, test_loss: 1.1702, test_f1: 0.3483
 epoch: 88, train_loss: 1.0081, test_loss: 1.1676, test_f1: 0.3576
 epoch: 89, train_loss: 1.0038, test_loss: 1.1863, test_f1: 0.3458
 epoch: 90, train_loss: 1.0113, test_loss: 1.1669, test_f1: 0.3620
 epoch: 91, train_loss: 1.0075, test_loss: 1.2315, test_f1: 0.3428
 epoch: 92, train_loss: 1.0073, test_loss: 1.1924, test_f1: 0.3593
 epoch: 93, train_loss: 1.0090, test_loss: 1.2123, test_f1: 0.3481
 epoch: 94, train_loss: 1.0048, test_loss: 1.4278, test_f1: 0.3541
 epoch: 95, train_loss: 0.9993, test_loss: 1.1728, test_f1: 0.3578
 epoch: 96, train_loss: 1.0131, test_loss: 1.1670, test_f1: 0.3467
 epoch: 97, train_loss: 1.0096, test_loss: 1.1833, test_f1: 0.3451
 epoch: 98, train_loss: 1.0046, test_loss: 1.1469, test_f1: 0.3470
 epoch: 99, train_loss: 1.0008, test_loss: 1.1852, test_f1: 0.3451
##################ITERATION #7 ****************************************
 epoch: 0, train_loss: 1.2855, test_loss: 1.2987, test_f1: 0.2281
 epoch: 1, train_loss: 1.2582, test_loss: 1.2894, test_f1: 0.2281
 epoch: 2, train_loss: 1.2429, test_loss: 1.2854, test_f1: 0.2281
 epoch: 3, train_loss: 1.2318, test_loss: 1.2816, test_f1: 0.2281
 epoch: 4, train_loss: 1.2233, test_loss: 1.2719, test_f1: 0.2281
 epoch: 5, train_loss: 1.2142, test_loss: 1.2682, test_f1: 0.2281
 epoch: 6, train_loss: 1.2050, test_loss: 1.2566, test_f1: 0.2281
 epoch: 7, train_loss: 1.1899, test_loss: 1.2512, test_f1: 0.2281
 epoch: 8, train_loss: 1.1910, test_loss: 1.2457, test_f1: 0.2281
 epoch: 9, train_loss: 1.1840, test_loss: 1.2387, test_f1: 0.2281
 epoch: 10, train_loss: 1.1713, test_loss: 1.2328, test_f1: 0.2281
 epoch: 11, train_loss: 1.1620, test_loss: 1.2258, test_f1: 0.2357
 epoch: 12, train_loss: 1.1596, test_loss: 1.2192, test_f1: 0.2689
 epoch: 13, train_loss: 1.1428, test_loss: 1.2155, test_f1: 0.2888
 epoch: 14, train_loss: 1.1451, test_loss: 1.2118, test_f1: 0.2841
 epoch: 15, train_loss: 1.1365, test_loss: 1.2070, test_f1: 0.3385
 epoch: 16, train_loss: 1.1231, test_loss: 1.2063, test_f1: 0.3320
 epoch: 17, train_loss: 1.1153, test_loss: 1.1932, test_f1: 0.3510
 epoch: 18, train_loss: 1.1135, test_loss: 1.1874, test_f1: 0.3565
 epoch: 19, train_loss: 1.1065, test_loss: 1.1833, test_f1: 0.3583
 epoch: 20, train_loss: 1.0971, test_loss: 1.1783, test_f1: 0.3555
 epoch: 21, train_loss: 1.1053, test_loss: 1.1742, test_f1: 0.3658
 epoch: 22, train_loss: 1.0920, test_loss: 1.1704, test_f1: 0.3693
 epoch: 23, train_loss: 1.0880, test_loss: 1.1631, test_f1: 0.3747
 epoch: 24, train_loss: 1.0886, test_loss: 1.1583, test_f1: 0.3748
 epoch: 25, train_loss: 1.0757, test_loss: 1.1544, test_f1: 0.3791
 epoch: 26, train_loss: 1.0675, test_loss: 1.1514, test_f1: 0.3791
 epoch: 27, train_loss: 1.0699, test_loss: 1.1442, test_f1: 0.3775
 epoch: 28, train_loss: 1.0716, test_loss: 1.1412, test_f1: 0.3876
 epoch: 29, train_loss: 1.0760, test_loss: 1.1398, test_f1: 0.3859
 epoch: 30, train_loss: 1.0718, test_loss: 1.1362, test_f1: 0.3925
 epoch: 31, train_loss: 1.0596, test_loss: 1.1346, test_f1: 0.3884
 epoch: 32, train_loss: 1.0552, test_loss: 1.1291, test_f1: 0.4028
 epoch: 33, train_loss: 1.0470, test_loss: 1.1279, test_f1: 0.4028
 epoch: 34, train_loss: 1.0547, test_loss: 1.1236, test_f1: 0.3963
 epoch: 35, train_loss: 1.0443, test_loss: 1.1260, test_f1: 0.3995
 epoch: 36, train_loss: 1.0429, test_loss: 1.1178, test_f1: 0.3994
 epoch: 37, train_loss: 1.0413, test_loss: 1.1178, test_f1: 0.4008
 epoch: 38, train_loss: 1.0447, test_loss: 1.1127, test_f1: 0.4030
 epoch: 39, train_loss: 1.0286, test_loss: 1.1097, test_f1: 0.4028
 epoch: 40, train_loss: 1.0339, test_loss: 1.1042, test_f1: 0.4004
 epoch: 41, train_loss: 1.0280, test_loss: 1.1004, test_f1: 0.3801
 epoch: 42, train_loss: 1.0269, test_loss: 1.0991, test_f1: 0.3830
 epoch: 43, train_loss: 1.0182, test_loss: 1.0950, test_f1: 0.4056
 epoch: 44, train_loss: 1.0212, test_loss: 1.0966, test_f1: 0.4080
 epoch: 45, train_loss: 1.0036, test_loss: 1.0953, test_f1: 0.4055
 epoch: 46, train_loss: 1.0235, test_loss: 1.0962, test_f1: 0.3925
 epoch: 47, train_loss: 1.0134, test_loss: 1.0940, test_f1: 0.4088
 epoch: 48, train_loss: 1.0144, test_loss: 1.0899, test_f1: 0.4088
 epoch: 49, train_loss: 1.0117, test_loss: 1.0904, test_f1: 0.4073
 epoch: 50, train_loss: 1.0071, test_loss: 1.0962, test_f1: 0.4066
 epoch: 51, train_loss: 1.0026, test_loss: 1.0896, test_f1: 0.4056
 epoch: 52, train_loss: 0.9866, test_loss: 1.0890, test_f1: 0.4073
 epoch: 53, train_loss: 1.0011, test_loss: 1.0952, test_f1: 0.4093
 epoch: 54, train_loss: 0.9989, test_loss: 1.0890, test_f1: 0.4057
 epoch: 55, train_loss: 0.9889, test_loss: 1.0893, test_f1: 0.4105
 epoch: 56, train_loss: 0.9976, test_loss: 1.0901, test_f1: 0.4036
 epoch: 57, train_loss: 0.9903, test_loss: 1.0790, test_f1: 0.4032
 epoch: 58, train_loss: 1.0002, test_loss: 1.0796, test_f1: 0.4040
 epoch: 59, train_loss: 0.9946, test_loss: 1.0814, test_f1: 0.3915
 epoch: 60, train_loss: 0.9928, test_loss: 1.0771, test_f1: 0.3961
 epoch: 61, train_loss: 0.9963, test_loss: 1.0811, test_f1: 0.3982
 epoch: 62, train_loss: 0.9887, test_loss: 1.0912, test_f1: 0.4013
 epoch: 63, train_loss: 0.9983, test_loss: 1.0798, test_f1: 0.4046
 epoch: 64, train_loss: 0.9906, test_loss: 1.0778, test_f1: 0.4112
 epoch: 65, train_loss: 0.9956, test_loss: 1.0669, test_f1: 0.3969
 epoch: 66, train_loss: 0.9850, test_loss: 1.0800, test_f1: 0.4007
 epoch: 67, train_loss: 0.9928, test_loss: 1.0801, test_f1: 0.4039
 epoch: 68, train_loss: 0.9949, test_loss: 1.0824, test_f1: 0.4186
 epoch: 69, train_loss: 0.9784, test_loss: 1.0841, test_f1: 0.3874
 epoch: 70, train_loss: 0.9718, test_loss: 1.0800, test_f1: 0.4266
 epoch: 71, train_loss: 0.9804, test_loss: 1.0816, test_f1: 0.4221
 epoch: 72, train_loss: 0.9767, test_loss: 1.0816, test_f1: 0.4057
 epoch: 73, train_loss: 0.9902, test_loss: 1.0807, test_f1: 0.4290
 epoch: 74, train_loss: 0.9713, test_loss: 1.0883, test_f1: 0.4262
 epoch: 75, train_loss: 0.9689, test_loss: 1.0767, test_f1: 0.4133
 epoch: 76, train_loss: 0.9840, test_loss: 1.0743, test_f1: 0.4189
 epoch: 77, train_loss: 0.9822, test_loss: 1.0692, test_f1: 0.4189
 epoch: 78, train_loss: 0.9721, test_loss: 1.0834, test_f1: 0.4310
 epoch: 79, train_loss: 0.9841, test_loss: 1.0817, test_f1: 0.4166
 epoch: 80, train_loss: 0.9851, test_loss: 1.0738, test_f1: 0.4175
 epoch: 81, train_loss: 0.9711, test_loss: 1.0724, test_f1: 0.4319
 epoch: 82, train_loss: 0.9649, test_loss: 1.0727, test_f1: 0.4151
 epoch: 83, train_loss: 0.9811, test_loss: 1.0724, test_f1: 0.3989
 epoch: 84, train_loss: 0.9631, test_loss: 1.0777, test_f1: 0.4350
 epoch: 85, train_loss: 0.9681, test_loss: 1.0734, test_f1: 0.4308
 epoch: 86, train_loss: 0.9637, test_loss: 1.0782, test_f1: 0.4295
 epoch: 87, train_loss: 0.9701, test_loss: 1.0770, test_f1: 0.4266
 epoch: 88, train_loss: 0.9688, test_loss: 1.0717, test_f1: 0.4405
 epoch: 89, train_loss: 0.9772, test_loss: 1.0739, test_f1: 0.4381
 epoch: 90, train_loss: 0.9600, test_loss: 1.0750, test_f1: 0.4426
 epoch: 91, train_loss: 0.9591, test_loss: 1.0770, test_f1: 0.4617
 epoch: 92, train_loss: 0.9789, test_loss: 1.0889, test_f1: 0.4530
 epoch: 93, train_loss: 0.9664, test_loss: 1.0818, test_f1: 0.4602
 epoch: 94, train_loss: 0.9644, test_loss: 1.0750, test_f1: 0.4525
 epoch: 95, train_loss: 0.9680, test_loss: 1.0772, test_f1: 0.4606
 epoch: 96, train_loss: 0.9701, test_loss: 1.0750, test_f1: 0.4460
 epoch: 97, train_loss: 0.9729, test_loss: 1.0736, test_f1: 0.4641
 epoch: 98, train_loss: 0.9494, test_loss: 1.0730, test_f1: 0.4642
 epoch: 99, train_loss: 0.9630, test_loss: 1.0788, test_f1: 0.4659
##################ITERATION #8 ****************************************
 epoch: 0, train_loss: 1.2329, test_loss: 1.2965, test_f1: 0.2281
 epoch: 1, train_loss: 1.2079, test_loss: 1.2648, test_f1: 0.2336
 epoch: 2, train_loss: 1.2077, test_loss: 1.2509, test_f1: 0.2390
 epoch: 3, train_loss: 1.2022, test_loss: 1.2385, test_f1: 0.2441
 epoch: 4, train_loss: 1.1800, test_loss: 1.2296, test_f1: 0.2491
 epoch: 5, train_loss: 1.1779, test_loss: 1.2211, test_f1: 0.2631
 epoch: 6, train_loss: 1.1675, test_loss: 1.2119, test_f1: 0.2718
 epoch: 7, train_loss: 1.1600, test_loss: 1.2033, test_f1: 0.2876
 epoch: 8, train_loss: 1.1419, test_loss: 1.1963, test_f1: 0.3018
 epoch: 9, train_loss: 1.1414, test_loss: 1.1978, test_f1: 0.3018
 epoch: 10, train_loss: 1.1382, test_loss: 1.1897, test_f1: 0.3246
 epoch: 11, train_loss: 1.1269, test_loss: 1.1826, test_f1: 0.3401
 epoch: 12, train_loss: 1.1295, test_loss: 1.1759, test_f1: 0.3492
 epoch: 13, train_loss: 1.1203, test_loss: 1.1712, test_f1: 0.3499
 epoch: 14, train_loss: 1.1063, test_loss: 1.1671, test_f1: 0.3514
 epoch: 15, train_loss: 1.1109, test_loss: 1.1536, test_f1: 0.3516
 epoch: 16, train_loss: 1.1047, test_loss: 1.1496, test_f1: 0.3518
 epoch: 17, train_loss: 1.0934, test_loss: 1.1552, test_f1: 0.3443
 epoch: 18, train_loss: 1.0852, test_loss: 1.1504, test_f1: 0.3631
 epoch: 19, train_loss: 1.0828, test_loss: 1.1435, test_f1: 0.3679
 epoch: 20, train_loss: 1.0841, test_loss: 1.1385, test_f1: 0.3532
 epoch: 21, train_loss: 1.0824, test_loss: 1.1311, test_f1: 0.3606
 epoch: 22, train_loss: 1.0746, test_loss: 1.1306, test_f1: 0.3679
 epoch: 23, train_loss: 1.0677, test_loss: 1.1291, test_f1: 0.3771
 epoch: 24, train_loss: 1.0632, test_loss: 1.1218, test_f1: 0.3581
 epoch: 25, train_loss: 1.0489, test_loss: 1.1285, test_f1: 0.3647
 epoch: 26, train_loss: 1.0473, test_loss: 1.1178, test_f1: 0.3840
 epoch: 27, train_loss: 1.0463, test_loss: 1.1157, test_f1: 0.3818
 epoch: 28, train_loss: 1.0462, test_loss: 1.1096, test_f1: 0.3842
 epoch: 29, train_loss: 1.0400, test_loss: 1.1178, test_f1: 0.3666
 epoch: 30, train_loss: 1.0379, test_loss: 1.1059, test_f1: 0.4049
 epoch: 31, train_loss: 1.0388, test_loss: 1.1038, test_f1: 0.3838
 epoch: 32, train_loss: 1.0324, test_loss: 1.1048, test_f1: 0.3817
 epoch: 33, train_loss: 1.0307, test_loss: 1.1047, test_f1: 0.3716
 epoch: 34, train_loss: 1.0284, test_loss: 1.1006, test_f1: 0.3857
 epoch: 35, train_loss: 1.0169, test_loss: 1.1032, test_f1: 0.3779
 epoch: 36, train_loss: 1.0286, test_loss: 1.1041, test_f1: 0.3887
 epoch: 37, train_loss: 1.0140, test_loss: 1.1044, test_f1: 0.3801
 epoch: 38, train_loss: 1.0077, test_loss: 1.0990, test_f1: 0.3838
 epoch: 39, train_loss: 1.0065, test_loss: 1.1150, test_f1: 0.3829
 epoch: 40, train_loss: 1.0134, test_loss: 1.1113, test_f1: 0.3652
 epoch: 41, train_loss: 1.0023, test_loss: 1.1122, test_f1: 0.3685
 epoch: 42, train_loss: 1.0068, test_loss: 1.1043, test_f1: 0.3750
 epoch: 43, train_loss: 1.0050, test_loss: 1.1091, test_f1: 0.3707
 epoch: 44, train_loss: 1.0018, test_loss: 1.0941, test_f1: 0.3734
 epoch: 45, train_loss: 0.9987, test_loss: 1.0827, test_f1: 0.3953
 epoch: 46, train_loss: 0.9924, test_loss: 1.1083, test_f1: 0.3811
 epoch: 47, train_loss: 0.9877, test_loss: 1.1223, test_f1: 0.3870
 epoch: 48, train_loss: 0.9986, test_loss: 1.1075, test_f1: 0.3831
 epoch: 49, train_loss: 0.9894, test_loss: 1.1065, test_f1: 0.3909
 epoch: 50, train_loss: 0.9896, test_loss: 1.0937, test_f1: 0.3939
 epoch: 51, train_loss: 0.9807, test_loss: 1.1257, test_f1: 0.3947
 epoch: 52, train_loss: 0.9817, test_loss: 1.1417, test_f1: 0.3888
 epoch: 53, train_loss: 0.9866, test_loss: 1.1372, test_f1: 0.4000
 epoch: 54, train_loss: 0.9838, test_loss: 1.1080, test_f1: 0.4008
 epoch: 55, train_loss: 0.9794, test_loss: 1.0857, test_f1: 0.3902
 epoch: 56, train_loss: 0.9837, test_loss: 1.1273, test_f1: 0.3945
 epoch: 57, train_loss: 0.9682, test_loss: 1.1102, test_f1: 0.3869
 epoch: 58, train_loss: 0.9704, test_loss: 1.1072, test_f1: 0.3908
 epoch: 59, train_loss: 0.9704, test_loss: 1.1548, test_f1: 0.3853
 epoch: 60, train_loss: 0.9698, test_loss: 1.0919, test_f1: 0.3910
 epoch: 61, train_loss: 0.9674, test_loss: 1.1053, test_f1: 0.3942
 epoch: 62, train_loss: 0.9689, test_loss: 1.1106, test_f1: 0.3923
 epoch: 63, train_loss: 0.9710, test_loss: 1.1391, test_f1: 0.3946
 epoch: 64, train_loss: 0.9655, test_loss: 1.1271, test_f1: 0.3997
 epoch: 65, train_loss: 0.9635, test_loss: 1.0953, test_f1: 0.3890
 epoch: 66, train_loss: 0.9690, test_loss: 1.0870, test_f1: 0.3893
 epoch: 67, train_loss: 0.9633, test_loss: 1.0837, test_f1: 0.3912
 epoch: 68, train_loss: 0.9534, test_loss: 1.1478, test_f1: 0.3908
 epoch: 69, train_loss: 0.9641, test_loss: 1.0856, test_f1: 0.3857
 epoch: 70, train_loss: 0.9605, test_loss: 1.1342, test_f1: 0.3921
 epoch: 71, train_loss: 0.9561, test_loss: 1.1190, test_f1: 0.3867
 epoch: 72, train_loss: 0.9620, test_loss: 1.1060, test_f1: 0.3927
 epoch: 73, train_loss: 0.9564, test_loss: 1.1235, test_f1: 0.3889
 epoch: 74, train_loss: 0.9542, test_loss: 1.1376, test_f1: 0.3995
 epoch: 75, train_loss: 0.9392, test_loss: 1.1055, test_f1: 0.3910
 epoch: 76, train_loss: 0.9607, test_loss: 1.1201, test_f1: 0.3861
 epoch: 77, train_loss: 0.9474, test_loss: 1.1375, test_f1: 0.3886
 epoch: 78, train_loss: 0.9565, test_loss: 1.1461, test_f1: 0.3929
 epoch: 79, train_loss: 0.9531, test_loss: 1.0952, test_f1: 0.3908
 epoch: 80, train_loss: 0.9387, test_loss: 1.1253, test_f1: 0.3865
 epoch: 81, train_loss: 0.9534, test_loss: 1.1852, test_f1: 0.3885
 epoch: 82, train_loss: 0.9358, test_loss: 1.1530, test_f1: 0.3971
 epoch: 83, train_loss: 0.9467, test_loss: 1.1297, test_f1: 0.3885
 epoch: 84, train_loss: 0.9404, test_loss: 1.1258, test_f1: 0.3885
 epoch: 85, train_loss: 0.9468, test_loss: 1.1427, test_f1: 0.3885
 epoch: 86, train_loss: 0.9421, test_loss: 1.2119, test_f1: 0.3903
 epoch: 87, train_loss: 0.9410, test_loss: 1.1411, test_f1: 0.3885
 epoch: 88, train_loss: 0.9350, test_loss: 1.1407, test_f1: 0.3906
 epoch: 89, train_loss: 0.9382, test_loss: 1.1790, test_f1: 0.4042
 epoch: 90, train_loss: 0.9377, test_loss: 1.1701, test_f1: 0.3882
 epoch: 91, train_loss: 0.9376, test_loss: 1.1272, test_f1: 0.3979
 epoch: 92, train_loss: 0.9354, test_loss: 1.1792, test_f1: 0.3897
 epoch: 93, train_loss: 0.9379, test_loss: 1.1022, test_f1: 0.3885
 epoch: 94, train_loss: 0.9287, test_loss: 1.1807, test_f1: 0.3977
 epoch: 95, train_loss: 0.9282, test_loss: 1.1372, test_f1: 0.3922
 epoch: 96, train_loss: 0.9384, test_loss: 1.1600, test_f1: 0.3977
 epoch: 97, train_loss: 0.9251, test_loss: 1.1691, test_f1: 0.3978
 epoch: 98, train_loss: 0.9267, test_loss: 1.1313, test_f1: 0.3977
 epoch: 99, train_loss: 0.9258, test_loss: 1.1592, test_f1: 0.3912
##################ITERATION #9 ****************************************
 epoch: 0, train_loss: 1.2563, test_loss: 1.2882, test_f1: 0.2281
 epoch: 1, train_loss: 1.2463, test_loss: 1.2884, test_f1: 0.2281
 epoch: 2, train_loss: 1.2323, test_loss: 1.2829, test_f1: 0.2248
 epoch: 3, train_loss: 1.2313, test_loss: 1.2701, test_f1: 0.2281
 epoch: 4, train_loss: 1.2185, test_loss: 1.2665, test_f1: 0.2281
 epoch: 5, train_loss: 1.1976, test_loss: 1.2481, test_f1: 0.2336
 epoch: 6, train_loss: 1.1993, test_loss: 1.2446, test_f1: 0.2390
 epoch: 7, train_loss: 1.1815, test_loss: 1.2323, test_f1: 0.2491
 epoch: 8, train_loss: 1.1799, test_loss: 1.2320, test_f1: 0.2599
 epoch: 9, train_loss: 1.1702, test_loss: 1.2303, test_f1: 0.2759
 epoch: 10, train_loss: 1.1639, test_loss: 1.2231, test_f1: 0.2876
 epoch: 11, train_loss: 1.1498, test_loss: 1.2175, test_f1: 0.2913
 epoch: 12, train_loss: 1.1430, test_loss: 1.2163, test_f1: 0.2956
 epoch: 13, train_loss: 1.1206, test_loss: 1.2020, test_f1: 0.3029
 epoch: 14, train_loss: 1.1255, test_loss: 1.1903, test_f1: 0.3332
 epoch: 15, train_loss: 1.1225, test_loss: 1.1839, test_f1: 0.3374
 epoch: 16, train_loss: 1.1115, test_loss: 1.1805, test_f1: 0.3787
 epoch: 17, train_loss: 1.1223, test_loss: 1.1816, test_f1: 0.3956
 epoch: 18, train_loss: 1.0959, test_loss: 1.1768, test_f1: 0.3955
 epoch: 19, train_loss: 1.0885, test_loss: 1.1690, test_f1: 0.3802
 epoch: 20, train_loss: 1.1001, test_loss: 1.1683, test_f1: 0.3724
 epoch: 21, train_loss: 1.0905, test_loss: 1.1744, test_f1: 0.3722
 epoch: 22, train_loss: 1.0924, test_loss: 1.1615, test_f1: 0.3883
 epoch: 23, train_loss: 1.0800, test_loss: 1.1591, test_f1: 0.3900
 epoch: 24, train_loss: 1.0701, test_loss: 1.1505, test_f1: 0.4110
 epoch: 25, train_loss: 1.0658, test_loss: 1.1469, test_f1: 0.4012
 epoch: 26, train_loss: 1.0683, test_loss: 1.1358, test_f1: 0.3886
 epoch: 27, train_loss: 1.0482, test_loss: 1.1340, test_f1: 0.4040
 epoch: 28, train_loss: 1.0639, test_loss: 1.1333, test_f1: 0.3842
 epoch: 29, train_loss: 1.0599, test_loss: 1.1296, test_f1: 0.4160
 epoch: 30, train_loss: 1.0525, test_loss: 1.1322, test_f1: 0.3932
 epoch: 31, train_loss: 1.0370, test_loss: 1.1381, test_f1: 0.4091
 epoch: 32, train_loss: 1.0407, test_loss: 1.1304, test_f1: 0.4150
 epoch: 33, train_loss: 1.0292, test_loss: 1.1174, test_f1: 0.4269
 epoch: 34, train_loss: 1.0322, test_loss: 1.1226, test_f1: 0.4172
 epoch: 35, train_loss: 1.0424, test_loss: 1.1262, test_f1: 0.4134
 epoch: 36, train_loss: 1.0298, test_loss: 1.1252, test_f1: 0.4273
 epoch: 37, train_loss: 1.0325, test_loss: 1.1267, test_f1: 0.4198
 epoch: 38, train_loss: 1.0188, test_loss: 1.1127, test_f1: 0.4156
 epoch: 39, train_loss: 1.0138, test_loss: 1.1104, test_f1: 0.4178
 epoch: 40, train_loss: 1.0195, test_loss: 1.1228, test_f1: 0.4285
 epoch: 41, train_loss: 1.0195, test_loss: 1.1139, test_f1: 0.4153
 epoch: 42, train_loss: 1.0112, test_loss: 1.1210, test_f1: 0.4254
 epoch: 43, train_loss: 1.0204, test_loss: 1.1107, test_f1: 0.4328
 epoch: 44, train_loss: 1.0061, test_loss: 1.1092, test_f1: 0.4186
 epoch: 45, train_loss: 1.0045, test_loss: 1.1088, test_f1: 0.4283
 epoch: 46, train_loss: 1.0054, test_loss: 1.1045, test_f1: 0.4270
 epoch: 47, train_loss: 1.0067, test_loss: 1.1081, test_f1: 0.4212
 epoch: 48, train_loss: 0.9973, test_loss: 1.1078, test_f1: 0.4346
 epoch: 49, train_loss: 0.9844, test_loss: 1.1065, test_f1: 0.4341
 epoch: 50, train_loss: 0.9889, test_loss: 1.0942, test_f1: 0.4311
 epoch: 51, train_loss: 0.9928, test_loss: 1.0975, test_f1: 0.4174
 epoch: 52, train_loss: 0.9879, test_loss: 1.1046, test_f1: 0.4277
 epoch: 53, train_loss: 0.9905, test_loss: 1.0939, test_f1: 0.4236
 epoch: 54, train_loss: 0.9715, test_loss: 1.0973, test_f1: 0.4282
 epoch: 55, train_loss: 0.9888, test_loss: 1.0886, test_f1: 0.4345
 epoch: 56, train_loss: 0.9835, test_loss: 1.0916, test_f1: 0.4373
 epoch: 57, train_loss: 0.9787, test_loss: 1.0916, test_f1: 0.4261
 epoch: 58, train_loss: 0.9849, test_loss: 1.0981, test_f1: 0.4303
 epoch: 59, train_loss: 0.9818, test_loss: 1.0934, test_f1: 0.4383
 epoch: 60, train_loss: 0.9767, test_loss: 1.0867, test_f1: 0.4359
 epoch: 61, train_loss: 0.9670, test_loss: 1.0972, test_f1: 0.4233
 epoch: 62, train_loss: 0.9916, test_loss: 1.0813, test_f1: 0.4229
 epoch: 63, train_loss: 0.9773, test_loss: 1.0873, test_f1: 0.4307
 epoch: 64, train_loss: 0.9687, test_loss: 1.0775, test_f1: 0.4472
 epoch: 65, train_loss: 0.9737, test_loss: 1.0749, test_f1: 0.4394
 epoch: 66, train_loss: 0.9717, test_loss: 1.0824, test_f1: 0.4416
 epoch: 67, train_loss: 0.9813, test_loss: 1.0810, test_f1: 0.4356
 epoch: 68, train_loss: 0.9614, test_loss: 1.0846, test_f1: 0.4256
 epoch: 69, train_loss: 0.9631, test_loss: 1.0762, test_f1: 0.4441
 epoch: 70, train_loss: 0.9685, test_loss: 1.0771, test_f1: 0.4582
 epoch: 71, train_loss: 0.9661, test_loss: 1.0808, test_f1: 0.4443
 epoch: 72, train_loss: 0.9712, test_loss: 1.0737, test_f1: 0.4488
 epoch: 73, train_loss: 0.9569, test_loss: 1.0810, test_f1: 0.4471
 epoch: 74, train_loss: 0.9678, test_loss: 1.0767, test_f1: 0.4543
 epoch: 75, train_loss: 0.9720, test_loss: 1.0790, test_f1: 0.4518
 epoch: 76, train_loss: 0.9598, test_loss: 1.0765, test_f1: 0.4423
 epoch: 77, train_loss: 0.9526, test_loss: 1.0782, test_f1: 0.4539
 epoch: 78, train_loss: 0.9697, test_loss: 1.0742, test_f1: 0.4521
 epoch: 79, train_loss: 0.9499, test_loss: 1.0742, test_f1: 0.4692
 epoch: 80, train_loss: 0.9549, test_loss: 1.0738, test_f1: 0.4633
 epoch: 81, train_loss: 0.9523, test_loss: 1.0773, test_f1: 0.4709
 epoch: 82, train_loss: 0.9579, test_loss: 1.0713, test_f1: 0.4821
 epoch: 83, train_loss: 0.9643, test_loss: 1.0711, test_f1: 0.4851
 epoch: 84, train_loss: 0.9549, test_loss: 1.0620, test_f1: 0.4764
 epoch: 85, train_loss: 0.9524, test_loss: 1.0702, test_f1: 0.4724
 epoch: 86, train_loss: 0.9732, test_loss: 1.0671, test_f1: 0.4738
 epoch: 87, train_loss: 0.9562, test_loss: 1.0661, test_f1: 0.4753
 epoch: 88, train_loss: 0.9545, test_loss: 1.0726, test_f1: 0.4966
 epoch: 89, train_loss: 0.9592, test_loss: 1.0614, test_f1: 0.4664
 epoch: 90, train_loss: 0.9457, test_loss: 1.0653, test_f1: 0.4828
 epoch: 91, train_loss: 0.9468, test_loss: 1.0704, test_f1: 0.5004
 epoch: 92, train_loss: 0.9619, test_loss: 1.0713, test_f1: 0.4999
 epoch: 93, train_loss: 0.9442, test_loss: 1.0581, test_f1: 0.4853
 epoch: 94, train_loss: 0.9451, test_loss: 1.0679, test_f1: 0.5055
 epoch: 95, train_loss: 0.9396, test_loss: 1.0712, test_f1: 0.4933
 epoch: 96, train_loss: 0.9438, test_loss: 1.0611, test_f1: 0.4989
 epoch: 97, train_loss: 0.9516, test_loss: 1.0681, test_f1: 0.4934
 epoch: 98, train_loss: 0.9452, test_loss: 1.0760, test_f1: 0.5037
 epoch: 99, train_loss: 0.9419, test_loss: 1.0733, test_f1: 0.4988

Training completed in 730.75 seconds
Best F1: 0.5055 at epoch 94
Mean F1 across iterations: 0.4234  0.0429
========================FINAL RESULTS================================
FEGIN weighted F1: 0.5055  0.0429
python main.py --data ltspice_demos --representation component_pin --model FEGIN --layers 5 --hiddens 16 --batch_size 32 --lr 0.0001 --emb_size 128 --epochs 100 --save_appendix component_pin_L5_H16_BS32_LR0.0001_E128 --no_val
-----



STDERR:
  File "main.py", line 370, in <module>
    main()
  File "main.py", line 254, in main
    dataset = dataset_class(
  File "/home/philip/projects/ltspice_examples_code_repo/Circuit-Completion-Using-GNNs/component_classification_with_link_prediction_head/evaluation/FEGIN/kernel/circuit_datasets.py", line 15, in __init__
    self.data, self.slices = torch.load(self.processed_paths[0])
  File "/home/philip/.local/lib/python3.8/site-packages/torch/serialization.py", line 1040, in load
    warnings.warn(
  File "/usr/lib/python3.8/warnings.py", line 109, in _showwarnmsg
    sw(msg.message, msg.category, msg.filename, msg.lineno,
  File "main.py", line 47, in warn_with_traceback
    traceback.print_stack(file=log)
/home/philip/projects/ltspice_examples_code_repo/Circuit-Completion-Using-GNNs/component_classification_with_link_prediction_head/evaluation/FEGIN/kernel/circuit_datasets.py:15: FutureWarning: You are using `torch.load` with `weights_only=False` (the current default value), which uses the default pickle module implicitly. It is possible to construct malicious pickle data which will execute arbitrary code during unpickling (See https://github.com/pytorch/pytorch/blob/main/SECURITY.md#untrusted-models for more details). In a future release, the default value for `weights_only` will be flipped to `True`. This limits the functions that could be executed during unpickling. Arbitrary objects will no longer be allowed to be loaded via this mode unless they are explicitly allowlisted by the user via `torch.serialization.add_safe_globals`. We recommend you start setting `weights_only=True` for any use case where you don't have full control of the loaded file. Please open an issue on GitHub for any issues related to this experimental feature.
  self.data, self.slices = torch.load(self.processed_paths[0])
