STDOUT:
Results will be saved in /home/philip/projects/ltspice_examples_code_repo/Circuit-Completion-Using-GNNs/component_classification_with_link_prediction_head/evaluation/FEGIN/results/model_FEGIN_dataset_ltspice_examples
Command line input: python main.py --data ltspice_examples --representation component_net --model FEGIN --layers 4 --hiddens 128 --batch_size 256 --lr 0.001 --emb_size 128 --epochs 100 --save_appendix component_net_L4_H128_BS256_LR0.001_E128 --no_val
 is saved.
-----
ltspice_examples - FEGIN
Using 4 layers, 128 hidden units, h = 2
Loading component_net representation dataset
ENTERED
Training FEGIN on component_net representation
Train: 3558, Test: 846
##################ITERATION #0 ****************************************
 epoch: 0, train_loss: 1.2780, test_loss: 1.3308, test_f1: 0.2270
 epoch: 1, train_loss: 1.1489, test_loss: 1.2783, test_f1: 0.3407
 epoch: 2, train_loss: 1.0661, test_loss: 1.1444, test_f1: 0.4297
 epoch: 3, train_loss: 0.9781, test_loss: 1.0455, test_f1: 0.4523
 epoch: 4, train_loss: 0.9348, test_loss: 1.0331, test_f1: 0.4623
 epoch: 5, train_loss: 0.9079, test_loss: 1.0313, test_f1: 0.4519
 epoch: 6, train_loss: 0.8891, test_loss: 0.9359, test_f1: 0.5089
 epoch: 7, train_loss: 0.8572, test_loss: 0.9197, test_f1: 0.5436
 epoch: 8, train_loss: 0.8277, test_loss: 0.9425, test_f1: 0.5486
 epoch: 9, train_loss: 0.8129, test_loss: 0.8875, test_f1: 0.5501
 epoch: 10, train_loss: 0.7929, test_loss: 0.9324, test_f1: 0.5653
 epoch: 11, train_loss: 0.7867, test_loss: 0.9399, test_f1: 0.5880
 epoch: 12, train_loss: 0.7696, test_loss: 0.9091, test_f1: 0.5612
 epoch: 13, train_loss: 0.7392, test_loss: 0.9141, test_f1: 0.5827
 epoch: 14, train_loss: 0.7251, test_loss: 0.9733, test_f1: 0.5427
 epoch: 15, train_loss: 0.7328, test_loss: 0.9469, test_f1: 0.6151
 epoch: 16, train_loss: 0.7156, test_loss: 0.9353, test_f1: 0.5377
 epoch: 17, train_loss: 0.6885, test_loss: 0.9526, test_f1: 0.6015
 epoch: 18, train_loss: 0.6728, test_loss: 0.9279, test_f1: 0.6196
 epoch: 19, train_loss: 0.6623, test_loss: 0.9704, test_f1: 0.6034
 epoch: 20, train_loss: 0.6691, test_loss: 0.9186, test_f1: 0.6285
 epoch: 21, train_loss: 0.6290, test_loss: 0.9621, test_f1: 0.6033
 epoch: 22, train_loss: 0.6389, test_loss: 0.9718, test_f1: 0.5888
 epoch: 23, train_loss: 0.6254, test_loss: 0.8655, test_f1: 0.6475
 epoch: 24, train_loss: 0.5922, test_loss: 0.9755, test_f1: 0.6679
 epoch: 25, train_loss: 0.5844, test_loss: 0.9339, test_f1: 0.6330
 epoch: 26, train_loss: 0.5895, test_loss: 0.9566, test_f1: 0.6247
 epoch: 27, train_loss: 0.5767, test_loss: 0.9784, test_f1: 0.6413
 epoch: 28, train_loss: 0.5307, test_loss: 0.9679, test_f1: 0.6172
 epoch: 29, train_loss: 0.5322, test_loss: 0.9249, test_f1: 0.6456
 epoch: 30, train_loss: 0.5035, test_loss: 1.1041, test_f1: 0.5991
 epoch: 31, train_loss: 0.5029, test_loss: 1.0428, test_f1: 0.6465
 epoch: 32, train_loss: 0.4621, test_loss: 1.1500, test_f1: 0.5931
 epoch: 33, train_loss: 0.4581, test_loss: 1.1365, test_f1: 0.6120
 epoch: 34, train_loss: 0.4545, test_loss: 1.1540, test_f1: 0.6240
 epoch: 35, train_loss: 0.4533, test_loss: 1.1211, test_f1: 0.6316
 epoch: 36, train_loss: 0.4421, test_loss: 1.1851, test_f1: 0.6457
 epoch: 37, train_loss: 0.4406, test_loss: 1.1226, test_f1: 0.6448
 epoch: 38, train_loss: 0.4100, test_loss: 1.1297, test_f1: 0.6170
 epoch: 39, train_loss: 0.4105, test_loss: 1.1317, test_f1: 0.6417
 epoch: 40, train_loss: 0.3943, test_loss: 1.3309, test_f1: 0.6164
 epoch: 41, train_loss: 0.3966, test_loss: 1.1554, test_f1: 0.6459
 epoch: 42, train_loss: 0.3853, test_loss: 1.2465, test_f1: 0.6271
 epoch: 43, train_loss: 0.3848, test_loss: 1.3408, test_f1: 0.6261
 epoch: 44, train_loss: 0.3539, test_loss: 1.2382, test_f1: 0.6241
 epoch: 45, train_loss: 0.3289, test_loss: 1.4605, test_f1: 0.5842
 epoch: 46, train_loss: 0.3550, test_loss: 1.4716, test_f1: 0.6075
 epoch: 47, train_loss: 0.3599, test_loss: 1.2770, test_f1: 0.6218
 epoch: 48, train_loss: 0.3411, test_loss: 1.2331, test_f1: 0.6167
 epoch: 49, train_loss: 0.3175, test_loss: 1.5117, test_f1: 0.6136
 epoch: 50, train_loss: 0.3304, test_loss: 1.3337, test_f1: 0.6186
 epoch: 51, train_loss: 0.2737, test_loss: 1.4489, test_f1: 0.6233
 epoch: 52, train_loss: 0.2692, test_loss: 1.4365, test_f1: 0.6303
 epoch: 53, train_loss: 0.2500, test_loss: 1.5526, test_f1: 0.6480
 epoch: 54, train_loss: 0.2340, test_loss: 1.5524, test_f1: 0.6333
 epoch: 55, train_loss: 0.2142, test_loss: 1.5863, test_f1: 0.6313
 epoch: 56, train_loss: 0.2040, test_loss: 1.5950, test_f1: 0.6444
 epoch: 57, train_loss: 0.1948, test_loss: 1.7005, test_f1: 0.6163
 epoch: 58, train_loss: 0.1953, test_loss: 1.7439, test_f1: 0.6088
 epoch: 59, train_loss: 0.2174, test_loss: 1.8390, test_f1: 0.6244
 epoch: 60, train_loss: 0.2129, test_loss: 1.8724, test_f1: 0.6379
 epoch: 61, train_loss: 0.1985, test_loss: 1.8212, test_f1: 0.6237
 epoch: 62, train_loss: 0.2054, test_loss: 1.8889, test_f1: 0.6364
 epoch: 63, train_loss: 0.2127, test_loss: 1.9214, test_f1: 0.6151
 epoch: 64, train_loss: 0.2193, test_loss: 1.9125, test_f1: 0.6110
 epoch: 65, train_loss: 0.1954, test_loss: 1.9644, test_f1: 0.6223
 epoch: 66, train_loss: 0.1760, test_loss: 1.8735, test_f1: 0.6180
 epoch: 67, train_loss: 0.1781, test_loss: 1.9957, test_f1: 0.6325
 epoch: 68, train_loss: 0.1729, test_loss: 2.0043, test_f1: 0.6275
 epoch: 69, train_loss: 0.1589, test_loss: 2.1551, test_f1: 0.6196
 epoch: 70, train_loss: 0.1714, test_loss: 2.0714, test_f1: 0.6223
 epoch: 71, train_loss: 0.1687, test_loss: 2.2043, test_f1: 0.6160
 epoch: 72, train_loss: 0.1797, test_loss: 2.2668, test_f1: 0.6099
 epoch: 73, train_loss: 0.1846, test_loss: 2.0723, test_f1: 0.6429
 epoch: 74, train_loss: 0.1572, test_loss: 2.0613, test_f1: 0.6270
 epoch: 75, train_loss: 0.1563, test_loss: 2.1336, test_f1: 0.6284
 epoch: 76, train_loss: 0.1550, test_loss: 2.1617, test_f1: 0.6177
 epoch: 77, train_loss: 0.1697, test_loss: 2.1800, test_f1: 0.6140
 epoch: 78, train_loss: 0.1594, test_loss: 2.1051, test_f1: 0.6103
 epoch: 79, train_loss: 0.1553, test_loss: 2.3018, test_f1: 0.6276
 epoch: 80, train_loss: 0.1596, test_loss: 2.2931, test_f1: 0.6068
 epoch: 81, train_loss: 0.1454, test_loss: 2.2541, test_f1: 0.6439
 epoch: 82, train_loss: 0.1565, test_loss: 2.3496, test_f1: 0.6318
 epoch: 83, train_loss: 0.1515, test_loss: 2.3361, test_f1: 0.6306
 epoch: 84, train_loss: 0.1489, test_loss: 2.2768, test_f1: 0.6235
 epoch: 85, train_loss: 0.1431, test_loss: 2.4941, test_f1: 0.6246
 epoch: 86, train_loss: 0.1475, test_loss: 2.3853, test_f1: 0.6132
 epoch: 87, train_loss: 0.1330, test_loss: 2.4289, test_f1: 0.6334
 epoch: 88, train_loss: 0.1363, test_loss: 2.6145, test_f1: 0.6218
 epoch: 89, train_loss: 0.1305, test_loss: 2.4892, test_f1: 0.6039
 epoch: 90, train_loss: 0.1389, test_loss: 2.6858, test_f1: 0.5633
 epoch: 91, train_loss: 0.1448, test_loss: 2.4921, test_f1: 0.6120
 epoch: 92, train_loss: 0.1462, test_loss: 2.3937, test_f1: 0.6363
 epoch: 93, train_loss: 0.1318, test_loss: 2.3575, test_f1: 0.6197
 epoch: 94, train_loss: 0.1249, test_loss: 2.4822, test_f1: 0.6413
 epoch: 95, train_loss: 0.1266, test_loss: 2.4594, test_f1: 0.6333
 epoch: 96, train_loss: 0.1180, test_loss: 2.7402, test_f1: 0.6097
 epoch: 97, train_loss: 0.1249, test_loss: 2.5222, test_f1: 0.6261
 epoch: 98, train_loss: 0.1287, test_loss: 2.7827, test_f1: 0.6151
 epoch: 99, train_loss: 0.1245, test_loss: 2.6490, test_f1: 0.6067
##################ITERATION #1 ****************************************
 epoch: 0, train_loss: 1.1638, test_loss: 1.2402, test_f1: 0.2344
 epoch: 1, train_loss: 0.9954, test_loss: 1.1371, test_f1: 0.3288
 epoch: 2, train_loss: 0.9359, test_loss: 1.0105, test_f1: 0.4477
 epoch: 3, train_loss: 0.8911, test_loss: 0.9884, test_f1: 0.4467
 epoch: 4, train_loss: 0.8591, test_loss: 0.9585, test_f1: 0.4802
 epoch: 5, train_loss: 0.8625, test_loss: 0.9154, test_f1: 0.5463
 epoch: 6, train_loss: 0.8403, test_loss: 0.8987, test_f1: 0.6193
 epoch: 7, train_loss: 0.8072, test_loss: 0.9488, test_f1: 0.5903
 epoch: 8, train_loss: 0.7763, test_loss: 0.9277, test_f1: 0.5706
 epoch: 9, train_loss: 0.7661, test_loss: 0.9031, test_f1: 0.6025
 epoch: 10, train_loss: 0.7482, test_loss: 0.9428, test_f1: 0.5889
 epoch: 11, train_loss: 0.7371, test_loss: 0.9243, test_f1: 0.5862
 epoch: 12, train_loss: 0.7160, test_loss: 0.9501, test_f1: 0.5815
 epoch: 13, train_loss: 0.7025, test_loss: 0.9013, test_f1: 0.6133
 epoch: 14, train_loss: 0.7086, test_loss: 0.9980, test_f1: 0.5669
 epoch: 15, train_loss: 0.6842, test_loss: 0.9670, test_f1: 0.5927
 epoch: 16, train_loss: 0.6670, test_loss: 0.9367, test_f1: 0.6182
 epoch: 17, train_loss: 0.6512, test_loss: 0.9856, test_f1: 0.6033
 epoch: 18, train_loss: 0.6376, test_loss: 1.0057, test_f1: 0.5696
 epoch: 19, train_loss: 0.6362, test_loss: 1.0210, test_f1: 0.6000
 epoch: 20, train_loss: 0.6119, test_loss: 1.0119, test_f1: 0.5856
 epoch: 21, train_loss: 0.5905, test_loss: 1.0394, test_f1: 0.5890
 epoch: 22, train_loss: 0.5745, test_loss: 1.0982, test_f1: 0.5669
 epoch: 23, train_loss: 0.5843, test_loss: 1.0919, test_f1: 0.5946
 epoch: 24, train_loss: 0.5677, test_loss: 1.1466, test_f1: 0.5501
 epoch: 25, train_loss: 0.5392, test_loss: 1.0141, test_f1: 0.6144
 epoch: 26, train_loss: 0.5101, test_loss: 1.0557, test_f1: 0.6074
 epoch: 27, train_loss: 0.5278, test_loss: 1.0517, test_f1: 0.6507
 epoch: 28, train_loss: 0.5257, test_loss: 1.0010, test_f1: 0.6544
 epoch: 29, train_loss: 0.5109, test_loss: 1.0748, test_f1: 0.5919
 epoch: 30, train_loss: 0.4921, test_loss: 1.0977, test_f1: 0.6026
 epoch: 31, train_loss: 0.4722, test_loss: 1.1570, test_f1: 0.6043
 epoch: 32, train_loss: 0.4907, test_loss: 1.2078, test_f1: 0.6319
 epoch: 33, train_loss: 0.4729, test_loss: 1.0901, test_f1: 0.6367
 epoch: 34, train_loss: 0.4538, test_loss: 1.0795, test_f1: 0.6430
 epoch: 35, train_loss: 0.4457, test_loss: 1.0544, test_f1: 0.6851
 epoch: 36, train_loss: 0.4193, test_loss: 1.2719, test_f1: 0.6172
 epoch: 37, train_loss: 0.3786, test_loss: 1.2732, test_f1: 0.6686
 epoch: 38, train_loss: 0.3749, test_loss: 1.4082, test_f1: 0.6093
 epoch: 39, train_loss: 0.3862, test_loss: 1.2615, test_f1: 0.6179
 epoch: 40, train_loss: 0.3686, test_loss: 1.3015, test_f1: 0.6321
 epoch: 41, train_loss: 0.3653, test_loss: 1.4282, test_f1: 0.5818
 epoch: 42, train_loss: 0.3742, test_loss: 1.3679, test_f1: 0.6074
 epoch: 43, train_loss: 0.3520, test_loss: 1.5145, test_f1: 0.6126
 epoch: 44, train_loss: 0.3785, test_loss: 1.4870, test_f1: 0.6142
 epoch: 45, train_loss: 0.3762, test_loss: 1.3114, test_f1: 0.6382
 epoch: 46, train_loss: 0.3800, test_loss: 1.3990, test_f1: 0.6090
 epoch: 47, train_loss: 0.3551, test_loss: 1.4403, test_f1: 0.5990
 epoch: 48, train_loss: 0.3170, test_loss: 1.3623, test_f1: 0.6367
 epoch: 49, train_loss: 0.2950, test_loss: 1.5803, test_f1: 0.6004
 epoch: 50, train_loss: 0.2974, test_loss: 1.6763, test_f1: 0.5865
 epoch: 51, train_loss: 0.2627, test_loss: 1.4677, test_f1: 0.6329
 epoch: 52, train_loss: 0.2314, test_loss: 1.6346, test_f1: 0.6435
 epoch: 53, train_loss: 0.2343, test_loss: 1.7172, test_f1: 0.6181
 epoch: 54, train_loss: 0.2184, test_loss: 1.7144, test_f1: 0.6434
 epoch: 55, train_loss: 0.2245, test_loss: 1.8212, test_f1: 0.6412
 epoch: 56, train_loss: 0.2167, test_loss: 1.7530, test_f1: 0.6302
 epoch: 57, train_loss: 0.1997, test_loss: 1.8601, test_f1: 0.6327
 epoch: 58, train_loss: 0.1974, test_loss: 1.8186, test_f1: 0.6141
 epoch: 59, train_loss: 0.1852, test_loss: 1.9159, test_f1: 0.6468
 epoch: 60, train_loss: 0.1885, test_loss: 1.9301, test_f1: 0.6011
 epoch: 61, train_loss: 0.1886, test_loss: 2.1145, test_f1: 0.6179
 epoch: 62, train_loss: 0.1872, test_loss: 1.8685, test_f1: 0.6364
 epoch: 63, train_loss: 0.1937, test_loss: 2.2039, test_f1: 0.6190
 epoch: 64, train_loss: 0.2032, test_loss: 2.0325, test_f1: 0.6268
 epoch: 65, train_loss: 0.1993, test_loss: 2.1386, test_f1: 0.6026
 epoch: 66, train_loss: 0.1902, test_loss: 1.9617, test_f1: 0.6328
 epoch: 67, train_loss: 0.1717, test_loss: 1.9690, test_f1: 0.6122
 epoch: 68, train_loss: 0.1790, test_loss: 2.1824, test_f1: 0.6385
 epoch: 69, train_loss: 0.1695, test_loss: 2.2510, test_f1: 0.6270
 epoch: 70, train_loss: 0.1720, test_loss: 2.2225, test_f1: 0.6230
 epoch: 71, train_loss: 0.1673, test_loss: 2.2572, test_f1: 0.6179
 epoch: 72, train_loss: 0.1649, test_loss: 2.1895, test_f1: 0.6212
 epoch: 73, train_loss: 0.1729, test_loss: 2.2736, test_f1: 0.6178
 epoch: 74, train_loss: 0.1699, test_loss: 2.3303, test_f1: 0.6223
 epoch: 75, train_loss: 0.1734, test_loss: 2.3236, test_f1: 0.6202
 epoch: 76, train_loss: 0.1504, test_loss: 2.2704, test_f1: 0.6059
 epoch: 77, train_loss: 0.1448, test_loss: 2.2894, test_f1: 0.6457
 epoch: 78, train_loss: 0.1547, test_loss: 2.3639, test_f1: 0.6291
 epoch: 79, train_loss: 0.1555, test_loss: 2.5914, test_f1: 0.6203
 epoch: 80, train_loss: 0.1526, test_loss: 2.3447, test_f1: 0.6401
 epoch: 81, train_loss: 0.1445, test_loss: 2.2891, test_f1: 0.6319
 epoch: 82, train_loss: 0.1522, test_loss: 2.7845, test_f1: 0.5600
 epoch: 83, train_loss: 0.1781, test_loss: 2.6002, test_f1: 0.6211
 epoch: 84, train_loss: 0.1773, test_loss: 2.4643, test_f1: 0.6451
 epoch: 85, train_loss: 0.1521, test_loss: 2.4271, test_f1: 0.6328
 epoch: 86, train_loss: 0.1556, test_loss: 2.4851, test_f1: 0.6275
 epoch: 87, train_loss: 0.1422, test_loss: 2.4721, test_f1: 0.6102
 epoch: 88, train_loss: 0.1371, test_loss: 2.3277, test_f1: 0.6275
 epoch: 89, train_loss: 0.1286, test_loss: 2.4232, test_f1: 0.6190
 epoch: 90, train_loss: 0.1405, test_loss: 2.6119, test_f1: 0.6270
 epoch: 91, train_loss: 0.1316, test_loss: 2.4317, test_f1: 0.6079
 epoch: 92, train_loss: 0.1385, test_loss: 2.6605, test_f1: 0.6238
 epoch: 93, train_loss: 0.1350, test_loss: 2.8271, test_f1: 0.5992
 epoch: 94, train_loss: 0.1371, test_loss: 2.5098, test_f1: 0.6548
 epoch: 95, train_loss: 0.1324, test_loss: 2.6426, test_f1: 0.5991
 epoch: 96, train_loss: 0.1281, test_loss: 2.7839, test_f1: 0.6036
 epoch: 97, train_loss: 0.1386, test_loss: 2.5995, test_f1: 0.6220
 epoch: 98, train_loss: 0.1264, test_loss: 2.5245, test_f1: 0.6233
 epoch: 99, train_loss: 0.1356, test_loss: 2.7558, test_f1: 0.6193
##################ITERATION #2 ****************************************
 epoch: 0, train_loss: 1.2038, test_loss: 1.2249, test_f1: 0.3116
 epoch: 1, train_loss: 1.0306, test_loss: 1.1403, test_f1: 0.3358
 epoch: 2, train_loss: 0.9650, test_loss: 1.0529, test_f1: 0.3783
 epoch: 3, train_loss: 0.9320, test_loss: 0.9752, test_f1: 0.4676
 epoch: 4, train_loss: 0.9063, test_loss: 0.9442, test_f1: 0.5056
 epoch: 5, train_loss: 0.8662, test_loss: 0.9186, test_f1: 0.5174
 epoch: 6, train_loss: 0.8468, test_loss: 0.9528, test_f1: 0.5421
 epoch: 7, train_loss: 0.8440, test_loss: 0.8919, test_f1: 0.5507
 epoch: 8, train_loss: 0.8139, test_loss: 0.9284, test_f1: 0.5434
 epoch: 9, train_loss: 0.8073, test_loss: 0.9147, test_f1: 0.5637
 epoch: 10, train_loss: 0.7999, test_loss: 0.9240, test_f1: 0.5704
 epoch: 11, train_loss: 0.7803, test_loss: 0.8974, test_f1: 0.5985
 epoch: 12, train_loss: 0.7551, test_loss: 0.9737, test_f1: 0.5625
 epoch: 13, train_loss: 0.7585, test_loss: 0.9126, test_f1: 0.5678
 epoch: 14, train_loss: 0.7432, test_loss: 0.9046, test_f1: 0.6052
 epoch: 15, train_loss: 0.7207, test_loss: 0.9713, test_f1: 0.5973
 epoch: 16, train_loss: 0.7167, test_loss: 0.9198, test_f1: 0.5681
 epoch: 17, train_loss: 0.7010, test_loss: 0.9311, test_f1: 0.6216
 epoch: 18, train_loss: 0.7184, test_loss: 0.9969, test_f1: 0.5726
 epoch: 19, train_loss: 0.6909, test_loss: 1.0476, test_f1: 0.5642
 epoch: 20, train_loss: 0.6615, test_loss: 0.9249, test_f1: 0.6317
 epoch: 21, train_loss: 0.6527, test_loss: 0.9418, test_f1: 0.5817
 epoch: 22, train_loss: 0.6527, test_loss: 0.9867, test_f1: 0.5759
 epoch: 23, train_loss: 0.6366, test_loss: 0.9327, test_f1: 0.6156
 epoch: 24, train_loss: 0.6346, test_loss: 0.9039, test_f1: 0.6349
 epoch: 25, train_loss: 0.6212, test_loss: 0.9192, test_f1: 0.6544
 epoch: 26, train_loss: 0.6074, test_loss: 1.0060, test_f1: 0.6067
 epoch: 27, train_loss: 0.5892, test_loss: 0.9135, test_f1: 0.6528
 epoch: 28, train_loss: 0.5981, test_loss: 1.0366, test_f1: 0.6254
 epoch: 29, train_loss: 0.5788, test_loss: 1.0397, test_f1: 0.6103
 epoch: 30, train_loss: 0.5503, test_loss: 0.9525, test_f1: 0.6331
 epoch: 31, train_loss: 0.5365, test_loss: 0.9666, test_f1: 0.6318
 epoch: 32, train_loss: 0.5282, test_loss: 1.0257, test_f1: 0.6230
 epoch: 33, train_loss: 0.5271, test_loss: 1.0991, test_f1: 0.6171
 epoch: 34, train_loss: 0.5117, test_loss: 1.0218, test_f1: 0.6416
 epoch: 35, train_loss: 0.5240, test_loss: 1.1375, test_f1: 0.6230
 epoch: 36, train_loss: 0.5083, test_loss: 1.0461, test_f1: 0.6316
 epoch: 37, train_loss: 0.4869, test_loss: 1.0434, test_f1: 0.6326
 epoch: 38, train_loss: 0.4729, test_loss: 1.1263, test_f1: 0.6397
 epoch: 39, train_loss: 0.4779, test_loss: 1.1772, test_f1: 0.6034
 epoch: 40, train_loss: 0.4602, test_loss: 1.0477, test_f1: 0.6797
 epoch: 41, train_loss: 0.4605, test_loss: 1.1649, test_f1: 0.6132
 epoch: 42, train_loss: 0.4354, test_loss: 1.0746, test_f1: 0.6721
 epoch: 43, train_loss: 0.4335, test_loss: 1.1851, test_f1: 0.6341
 epoch: 44, train_loss: 0.4408, test_loss: 1.1105, test_f1: 0.6365
 epoch: 45, train_loss: 0.4180, test_loss: 1.1854, test_f1: 0.6646
 epoch: 46, train_loss: 0.4240, test_loss: 1.1886, test_f1: 0.6341
 epoch: 47, train_loss: 0.3957, test_loss: 1.2418, test_f1: 0.6502
 epoch: 48, train_loss: 0.3815, test_loss: 1.2076, test_f1: 0.6512
 epoch: 49, train_loss: 0.3806, test_loss: 1.3171, test_f1: 0.6043
 epoch: 50, train_loss: 0.3843, test_loss: 1.4313, test_f1: 0.6195
 epoch: 51, train_loss: 0.3422, test_loss: 1.1669, test_f1: 0.6839
 epoch: 52, train_loss: 0.3136, test_loss: 1.2008, test_f1: 0.6523
 epoch: 53, train_loss: 0.2887, test_loss: 1.2116, test_f1: 0.6640
 epoch: 54, train_loss: 0.2788, test_loss: 1.2421, test_f1: 0.6405
 epoch: 55, train_loss: 0.2743, test_loss: 1.3681, test_f1: 0.6368
 epoch: 56, train_loss: 0.2611, test_loss: 1.3243, test_f1: 0.6429
 epoch: 57, train_loss: 0.2475, test_loss: 1.3267, test_f1: 0.6774
 epoch: 58, train_loss: 0.2436, test_loss: 1.4292, test_f1: 0.6475
 epoch: 59, train_loss: 0.2507, test_loss: 1.5638, test_f1: 0.6341
 epoch: 60, train_loss: 0.2545, test_loss: 1.3272, test_f1: 0.6720
 epoch: 61, train_loss: 0.2417, test_loss: 1.6299, test_f1: 0.6384
 epoch: 62, train_loss: 0.2335, test_loss: 1.4223, test_f1: 0.6779
 epoch: 63, train_loss: 0.2368, test_loss: 1.5501, test_f1: 0.6652
 epoch: 64, train_loss: 0.2449, test_loss: 1.5705, test_f1: 0.6342
 epoch: 65, train_loss: 0.2447, test_loss: 1.4626, test_f1: 0.6443
 epoch: 66, train_loss: 0.2147, test_loss: 1.3987, test_f1: 0.6534
 epoch: 67, train_loss: 0.2158, test_loss: 1.5447, test_f1: 0.6436
 epoch: 68, train_loss: 0.2188, test_loss: 1.6246, test_f1: 0.6405
 epoch: 69, train_loss: 0.2167, test_loss: 1.6943, test_f1: 0.6330
 epoch: 70, train_loss: 0.2213, test_loss: 1.6593, test_f1: 0.6462
 epoch: 71, train_loss: 0.2288, test_loss: 1.6489, test_f1: 0.6066
 epoch: 72, train_loss: 0.2106, test_loss: 1.8035, test_f1: 0.6277
 epoch: 73, train_loss: 0.2018, test_loss: 1.7416, test_f1: 0.6495
 epoch: 74, train_loss: 0.1981, test_loss: 1.6218, test_f1: 0.6528
 epoch: 75, train_loss: 0.1903, test_loss: 1.6670, test_f1: 0.6311
 epoch: 76, train_loss: 0.1808, test_loss: 1.6797, test_f1: 0.6301
 epoch: 77, train_loss: 0.1727, test_loss: 1.9029, test_f1: 0.6132
 epoch: 78, train_loss: 0.1817, test_loss: 1.7008, test_f1: 0.6240
 epoch: 79, train_loss: 0.1711, test_loss: 1.8391, test_f1: 0.6348
 epoch: 80, train_loss: 0.1852, test_loss: 1.7142, test_f1: 0.6391
 epoch: 81, train_loss: 0.1722, test_loss: 1.8497, test_f1: 0.6383
 epoch: 82, train_loss: 0.1638, test_loss: 1.8983, test_f1: 0.6274
 epoch: 83, train_loss: 0.1719, test_loss: 2.1317, test_f1: 0.6045
 epoch: 84, train_loss: 0.1705, test_loss: 1.9925, test_f1: 0.6423
 epoch: 85, train_loss: 0.1627, test_loss: 1.9485, test_f1: 0.6572
 epoch: 86, train_loss: 0.1630, test_loss: 2.0304, test_f1: 0.6286
 epoch: 87, train_loss: 0.1655, test_loss: 1.9581, test_f1: 0.6360
 epoch: 88, train_loss: 0.1782, test_loss: 1.9818, test_f1: 0.6175
 epoch: 89, train_loss: 0.1673, test_loss: 1.9616, test_f1: 0.6355
 epoch: 90, train_loss: 0.1759, test_loss: 1.8853, test_f1: 0.6501
 epoch: 91, train_loss: 0.1683, test_loss: 2.2193, test_f1: 0.6093
 epoch: 92, train_loss: 0.1696, test_loss: 1.9135, test_f1: 0.6499
 epoch: 93, train_loss: 0.1554, test_loss: 2.2521, test_f1: 0.6051
 epoch: 94, train_loss: 0.1534, test_loss: 2.1542, test_f1: 0.6258
 epoch: 95, train_loss: 0.1573, test_loss: 2.1159, test_f1: 0.6178
 epoch: 96, train_loss: 0.1584, test_loss: 2.3683, test_f1: 0.6072
 epoch: 97, train_loss: 0.1478, test_loss: 2.0983, test_f1: 0.6521
 epoch: 98, train_loss: 0.1429, test_loss: 2.2092, test_f1: 0.6240
 epoch: 99, train_loss: 0.1538, test_loss: 2.1120, test_f1: 0.6462
##################ITERATION #3 ****************************************
 epoch: 0, train_loss: 1.2656, test_loss: 1.2498, test_f1: 0.2392
 epoch: 1, train_loss: 1.0119, test_loss: 1.1699, test_f1: 0.3328
 epoch: 2, train_loss: 0.9474, test_loss: 1.0261, test_f1: 0.4276
 epoch: 3, train_loss: 0.9212, test_loss: 0.9301, test_f1: 0.4868
 epoch: 4, train_loss: 0.8802, test_loss: 0.9480, test_f1: 0.5020
 epoch: 5, train_loss: 0.8572, test_loss: 0.8866, test_f1: 0.5627
 epoch: 6, train_loss: 0.8389, test_loss: 0.9233, test_f1: 0.5375
 epoch: 7, train_loss: 0.8251, test_loss: 0.8833, test_f1: 0.5450
 epoch: 8, train_loss: 0.8153, test_loss: 0.8864, test_f1: 0.5553
 epoch: 9, train_loss: 0.8099, test_loss: 0.9493, test_f1: 0.5366
 epoch: 10, train_loss: 0.7762, test_loss: 0.9101, test_f1: 0.5573
 epoch: 11, train_loss: 0.7731, test_loss: 0.9163, test_f1: 0.6118
 epoch: 12, train_loss: 0.7662, test_loss: 0.9527, test_f1: 0.5630
 epoch: 13, train_loss: 0.7513, test_loss: 0.9017, test_f1: 0.5833
 epoch: 14, train_loss: 0.7378, test_loss: 0.9413, test_f1: 0.5968
 epoch: 15, train_loss: 0.7280, test_loss: 0.9522, test_f1: 0.6106
 epoch: 16, train_loss: 0.7123, test_loss: 0.9738, test_f1: 0.6109
 epoch: 17, train_loss: 0.7091, test_loss: 0.9652, test_f1: 0.5957
 epoch: 18, train_loss: 0.6801, test_loss: 0.9214, test_f1: 0.5900
 epoch: 19, train_loss: 0.6754, test_loss: 0.9567, test_f1: 0.6322
 epoch: 20, train_loss: 0.6788, test_loss: 0.9364, test_f1: 0.5963
 epoch: 21, train_loss: 0.6733, test_loss: 0.9752, test_f1: 0.5852
 epoch: 22, train_loss: 0.6399, test_loss: 1.0496, test_f1: 0.5868
 epoch: 23, train_loss: 0.6415, test_loss: 1.0444, test_f1: 0.6004
 epoch: 24, train_loss: 0.6131, test_loss: 0.9860, test_f1: 0.6215
 epoch: 25, train_loss: 0.6032, test_loss: 1.0103, test_f1: 0.6032
 epoch: 26, train_loss: 0.6083, test_loss: 1.0321, test_f1: 0.5744
 epoch: 27, train_loss: 0.5916, test_loss: 1.0972, test_f1: 0.6088
 epoch: 28, train_loss: 0.5903, test_loss: 0.9572, test_f1: 0.6070
 epoch: 29, train_loss: 0.5642, test_loss: 1.0893, test_f1: 0.5993
 epoch: 30, train_loss: 0.5524, test_loss: 1.1744, test_f1: 0.5712
 epoch: 31, train_loss: 0.5211, test_loss: 1.1700, test_f1: 0.6071
 epoch: 32, train_loss: 0.5371, test_loss: 1.1446, test_f1: 0.6159
 epoch: 33, train_loss: 0.5064, test_loss: 1.0710, test_f1: 0.6053
 epoch: 34, train_loss: 0.5338, test_loss: 1.2297, test_f1: 0.5811
 epoch: 35, train_loss: 0.5307, test_loss: 1.1687, test_f1: 0.6145
 epoch: 36, train_loss: 0.4889, test_loss: 1.2331, test_f1: 0.5745
 epoch: 37, train_loss: 0.4955, test_loss: 1.2183, test_f1: 0.6290
 epoch: 38, train_loss: 0.4831, test_loss: 1.3349, test_f1: 0.5977
 epoch: 39, train_loss: 0.4615, test_loss: 1.2078, test_f1: 0.6214
 epoch: 40, train_loss: 0.4406, test_loss: 1.2981, test_f1: 0.6083
 epoch: 41, train_loss: 0.4503, test_loss: 1.1901, test_f1: 0.6516
 epoch: 42, train_loss: 0.4244, test_loss: 1.3610, test_f1: 0.5924
 epoch: 43, train_loss: 0.4032, test_loss: 1.3469, test_f1: 0.6433
 epoch: 44, train_loss: 0.4189, test_loss: 1.3607, test_f1: 0.6193
 epoch: 45, train_loss: 0.4268, test_loss: 1.3221, test_f1: 0.6381
 epoch: 46, train_loss: 0.4105, test_loss: 1.4046, test_f1: 0.6400
 epoch: 47, train_loss: 0.4125, test_loss: 1.4261, test_f1: 0.6202
 epoch: 48, train_loss: 0.4045, test_loss: 1.3704, test_f1: 0.6236
 epoch: 49, train_loss: 0.3969, test_loss: 1.4221, test_f1: 0.6069
 epoch: 50, train_loss: 0.3879, test_loss: 1.3512, test_f1: 0.6219
 epoch: 51, train_loss: 0.3419, test_loss: 1.4720, test_f1: 0.6438
 epoch: 52, train_loss: 0.3175, test_loss: 1.5056, test_f1: 0.6177
 epoch: 53, train_loss: 0.3058, test_loss: 1.5363, test_f1: 0.6171
 epoch: 54, train_loss: 0.2831, test_loss: 1.5203, test_f1: 0.6141
 epoch: 55, train_loss: 0.2872, test_loss: 1.5998, test_f1: 0.6139
 epoch: 56, train_loss: 0.2767, test_loss: 1.6467, test_f1: 0.6187
 epoch: 57, train_loss: 0.2671, test_loss: 1.6550, test_f1: 0.6139
 epoch: 58, train_loss: 0.2655, test_loss: 1.7090, test_f1: 0.6168
 epoch: 59, train_loss: 0.2580, test_loss: 1.7504, test_f1: 0.6140
 epoch: 60, train_loss: 0.2463, test_loss: 1.7402, test_f1: 0.6180
 epoch: 61, train_loss: 0.2579, test_loss: 1.7340, test_f1: 0.6100
 epoch: 62, train_loss: 0.2549, test_loss: 1.8832, test_f1: 0.5858
 epoch: 63, train_loss: 0.2749, test_loss: 1.6841, test_f1: 0.6100
 epoch: 64, train_loss: 0.2566, test_loss: 1.6787, test_f1: 0.6180
 epoch: 65, train_loss: 0.2362, test_loss: 1.7806, test_f1: 0.6108
 epoch: 66, train_loss: 0.2321, test_loss: 1.9441, test_f1: 0.6123
 epoch: 67, train_loss: 0.2392, test_loss: 1.7841, test_f1: 0.6111
 epoch: 68, train_loss: 0.2573, test_loss: 1.8545, test_f1: 0.6131
 epoch: 69, train_loss: 0.2202, test_loss: 1.8069, test_f1: 0.6203
 epoch: 70, train_loss: 0.2332, test_loss: 1.9388, test_f1: 0.6130
 epoch: 71, train_loss: 0.2126, test_loss: 1.8426, test_f1: 0.6061
 epoch: 72, train_loss: 0.2128, test_loss: 1.9173, test_f1: 0.6249
 epoch: 73, train_loss: 0.2062, test_loss: 1.9994, test_f1: 0.6187
 epoch: 74, train_loss: 0.2125, test_loss: 2.0121, test_f1: 0.6061
 epoch: 75, train_loss: 0.2047, test_loss: 2.0414, test_f1: 0.6132
 epoch: 76, train_loss: 0.2145, test_loss: 2.0732, test_f1: 0.6089
 epoch: 77, train_loss: 0.2063, test_loss: 2.0551, test_f1: 0.6107
 epoch: 78, train_loss: 0.1976, test_loss: 2.0720, test_f1: 0.6299
 epoch: 79, train_loss: 0.2112, test_loss: 2.0456, test_f1: 0.6212
 epoch: 80, train_loss: 0.2079, test_loss: 2.0640, test_f1: 0.5996
 epoch: 81, train_loss: 0.1959, test_loss: 2.1962, test_f1: 0.6254
 epoch: 82, train_loss: 0.1991, test_loss: 2.3093, test_f1: 0.6116
 epoch: 83, train_loss: 0.1848, test_loss: 2.2040, test_f1: 0.6231
 epoch: 84, train_loss: 0.1836, test_loss: 2.1150, test_f1: 0.6306
 epoch: 85, train_loss: 0.1842, test_loss: 2.3597, test_f1: 0.5993
 epoch: 86, train_loss: 0.1837, test_loss: 2.2182, test_f1: 0.6376
 epoch: 87, train_loss: 0.1855, test_loss: 2.2789, test_f1: 0.6112
 epoch: 88, train_loss: 0.1857, test_loss: 2.3555, test_f1: 0.5867
 epoch: 89, train_loss: 0.1938, test_loss: 2.1551, test_f1: 0.6285
 epoch: 90, train_loss: 0.1763, test_loss: 2.3441, test_f1: 0.5979
 epoch: 91, train_loss: 0.1773, test_loss: 2.2110, test_f1: 0.6022
 epoch: 92, train_loss: 0.1737, test_loss: 2.3132, test_f1: 0.6034
 epoch: 93, train_loss: 0.1777, test_loss: 2.3864, test_f1: 0.6096
 epoch: 94, train_loss: 0.1949, test_loss: 2.3919, test_f1: 0.6005
 epoch: 95, train_loss: 0.1784, test_loss: 2.4061, test_f1: 0.6113
 epoch: 96, train_loss: 0.1772, test_loss: 2.3396, test_f1: 0.6156
 epoch: 97, train_loss: 0.1599, test_loss: 2.3946, test_f1: 0.6129
 epoch: 98, train_loss: 0.1572, test_loss: 2.3319, test_f1: 0.6129
 epoch: 99, train_loss: 0.1874, test_loss: 2.3685, test_f1: 0.6274
##################ITERATION #4 ****************************************
 epoch: 0, train_loss: 1.3556, test_loss: 1.2469, test_f1: 0.2270
 epoch: 1, train_loss: 1.0374, test_loss: 1.1974, test_f1: 0.3523
 epoch: 2, train_loss: 0.9647, test_loss: 1.0938, test_f1: 0.4113
 epoch: 3, train_loss: 0.9304, test_loss: 0.9622, test_f1: 0.4956
 epoch: 4, train_loss: 0.8925, test_loss: 0.9071, test_f1: 0.4998
 epoch: 5, train_loss: 0.8710, test_loss: 0.9184, test_f1: 0.5325
 epoch: 6, train_loss: 0.8418, test_loss: 0.9215, test_f1: 0.5260
 epoch: 7, train_loss: 0.8383, test_loss: 0.9234, test_f1: 0.5695
 epoch: 8, train_loss: 0.8181, test_loss: 0.9312, test_f1: 0.5592
 epoch: 9, train_loss: 0.8027, test_loss: 0.8780, test_f1: 0.5576
 epoch: 10, train_loss: 0.7825, test_loss: 0.8955, test_f1: 0.5697
 epoch: 11, train_loss: 0.7721, test_loss: 0.9043, test_f1: 0.5957
 epoch: 12, train_loss: 0.7600, test_loss: 0.9398, test_f1: 0.5409
 epoch: 13, train_loss: 0.7288, test_loss: 0.9247, test_f1: 0.5547
 epoch: 14, train_loss: 0.7260, test_loss: 0.9582, test_f1: 0.5779
 epoch: 15, train_loss: 0.7075, test_loss: 0.8881, test_f1: 0.5726
 epoch: 16, train_loss: 0.6926, test_loss: 0.9339, test_f1: 0.5954
 epoch: 17, train_loss: 0.6781, test_loss: 0.8856, test_f1: 0.6339
 epoch: 18, train_loss: 0.6759, test_loss: 1.0149, test_f1: 0.6023
 epoch: 19, train_loss: 0.6746, test_loss: 0.9890, test_f1: 0.6160
 epoch: 20, train_loss: 0.6523, test_loss: 0.9535, test_f1: 0.6647
 epoch: 21, train_loss: 0.6530, test_loss: 0.8786, test_f1: 0.6018
 epoch: 22, train_loss: 0.6058, test_loss: 0.9391, test_f1: 0.6328
 epoch: 23, train_loss: 0.6166, test_loss: 1.0145, test_f1: 0.6093
 epoch: 24, train_loss: 0.6056, test_loss: 1.0329, test_f1: 0.5974
 epoch: 25, train_loss: 0.5795, test_loss: 1.0625, test_f1: 0.5935
 epoch: 26, train_loss: 0.5830, test_loss: 0.9424, test_f1: 0.6369
 epoch: 27, train_loss: 0.5628, test_loss: 0.9671, test_f1: 0.6085
 epoch: 28, train_loss: 0.5491, test_loss: 1.0106, test_f1: 0.5951
 epoch: 29, train_loss: 0.5224, test_loss: 1.0988, test_f1: 0.5945
 epoch: 30, train_loss: 0.5326, test_loss: 1.1865, test_f1: 0.6125
 epoch: 31, train_loss: 0.5251, test_loss: 1.1018, test_f1: 0.6043
 epoch: 32, train_loss: 0.5153, test_loss: 1.1596, test_f1: 0.6146
 epoch: 33, train_loss: 0.5233, test_loss: 1.0788, test_f1: 0.6457
 epoch: 34, train_loss: 0.4897, test_loss: 1.1744, test_f1: 0.6149
 epoch: 35, train_loss: 0.4978, test_loss: 1.1077, test_f1: 0.6134
 epoch: 36, train_loss: 0.4869, test_loss: 1.1492, test_f1: 0.6113
 epoch: 37, train_loss: 0.4838, test_loss: 1.1763, test_f1: 0.5881
 epoch: 38, train_loss: 0.4562, test_loss: 1.2658, test_f1: 0.6041
 epoch: 39, train_loss: 0.4715, test_loss: 1.2506, test_f1: 0.5920
 epoch: 40, train_loss: 0.4571, test_loss: 1.2596, test_f1: 0.6139
 epoch: 41, train_loss: 0.4425, test_loss: 1.2818, test_f1: 0.6154
 epoch: 42, train_loss: 0.4435, test_loss: 1.2021, test_f1: 0.6448
 epoch: 43, train_loss: 0.4196, test_loss: 1.2014, test_f1: 0.6154
 epoch: 44, train_loss: 0.4127, test_loss: 1.3814, test_f1: 0.6082
 epoch: 45, train_loss: 0.3932, test_loss: 1.3606, test_f1: 0.6235
 epoch: 46, train_loss: 0.3883, test_loss: 1.3193, test_f1: 0.6031
 epoch: 47, train_loss: 0.3988, test_loss: 1.2357, test_f1: 0.6642
 epoch: 48, train_loss: 0.3795, test_loss: 1.2545, test_f1: 0.5945
 epoch: 49, train_loss: 0.3786, test_loss: 1.2938, test_f1: 0.6230
 epoch: 50, train_loss: 0.3659, test_loss: 1.4527, test_f1: 0.6309
 epoch: 51, train_loss: 0.3350, test_loss: 1.4810, test_f1: 0.6053
 epoch: 52, train_loss: 0.2938, test_loss: 1.4653, test_f1: 0.6301
 epoch: 53, train_loss: 0.2931, test_loss: 1.4084, test_f1: 0.6342
 epoch: 54, train_loss: 0.2820, test_loss: 1.4703, test_f1: 0.6272
 epoch: 55, train_loss: 0.2679, test_loss: 1.5739, test_f1: 0.6575
 epoch: 56, train_loss: 0.2714, test_loss: 1.5576, test_f1: 0.6262
 epoch: 57, train_loss: 0.2621, test_loss: 1.6729, test_f1: 0.6303
 epoch: 58, train_loss: 0.2548, test_loss: 1.7396, test_f1: 0.6223
 epoch: 59, train_loss: 0.2615, test_loss: 1.6631, test_f1: 0.6514
 epoch: 60, train_loss: 0.2499, test_loss: 1.6603, test_f1: 0.6524
 epoch: 61, train_loss: 0.2592, test_loss: 1.6523, test_f1: 0.6376
 epoch: 62, train_loss: 0.2488, test_loss: 1.7477, test_f1: 0.6558
 epoch: 63, train_loss: 0.2392, test_loss: 1.6564, test_f1: 0.6630
 epoch: 64, train_loss: 0.2273, test_loss: 1.7247, test_f1: 0.6661
 epoch: 65, train_loss: 0.2431, test_loss: 1.6976, test_f1: 0.6338
 epoch: 66, train_loss: 0.2247, test_loss: 1.8401, test_f1: 0.6486
 epoch: 67, train_loss: 0.2095, test_loss: 1.8802, test_f1: 0.6435
 epoch: 68, train_loss: 0.2140, test_loss: 1.8253, test_f1: 0.6182
 epoch: 69, train_loss: 0.2077, test_loss: 1.9171, test_f1: 0.6262
 epoch: 70, train_loss: 0.2187, test_loss: 1.8433, test_f1: 0.6427
 epoch: 71, train_loss: 0.2150, test_loss: 1.8586, test_f1: 0.6295
 epoch: 72, train_loss: 0.2069, test_loss: 1.9975, test_f1: 0.6422
 epoch: 73, train_loss: 0.2157, test_loss: 1.8045, test_f1: 0.6455
 epoch: 74, train_loss: 0.2084, test_loss: 1.9095, test_f1: 0.6419
 epoch: 75, train_loss: 0.2157, test_loss: 1.9280, test_f1: 0.6533
 epoch: 76, train_loss: 0.2090, test_loss: 1.8366, test_f1: 0.6333
 epoch: 77, train_loss: 0.2218, test_loss: 1.9971, test_f1: 0.6345
 epoch: 78, train_loss: 0.2134, test_loss: 1.9473, test_f1: 0.6347
 epoch: 79, train_loss: 0.2064, test_loss: 2.0993, test_f1: 0.6049
 epoch: 80, train_loss: 0.2040, test_loss: 2.0266, test_f1: 0.6273
 epoch: 81, train_loss: 0.1987, test_loss: 2.1821, test_f1: 0.6307
 epoch: 82, train_loss: 0.1989, test_loss: 1.9473, test_f1: 0.6292
 epoch: 83, train_loss: 0.1842, test_loss: 1.9931, test_f1: 0.6332
 epoch: 84, train_loss: 0.1830, test_loss: 1.9103, test_f1: 0.6507
 epoch: 85, train_loss: 0.1854, test_loss: 1.8467, test_f1: 0.6146
 epoch: 86, train_loss: 0.1827, test_loss: 1.9614, test_f1: 0.6201
 epoch: 87, train_loss: 0.1889, test_loss: 2.1151, test_f1: 0.6310
 epoch: 88, train_loss: 0.1822, test_loss: 2.0663, test_f1: 0.6491
 epoch: 89, train_loss: 0.2044, test_loss: 1.9431, test_f1: 0.6413
 epoch: 90, train_loss: 0.1787, test_loss: 1.9935, test_f1: 0.6351
 epoch: 91, train_loss: 0.1895, test_loss: 1.9947, test_f1: 0.6344
 epoch: 92, train_loss: 0.1761, test_loss: 2.1615, test_f1: 0.6503
 epoch: 93, train_loss: 0.1735, test_loss: 2.1361, test_f1: 0.6395
 epoch: 94, train_loss: 0.1859, test_loss: 2.1901, test_f1: 0.6351
 epoch: 95, train_loss: 0.1748, test_loss: 2.2256, test_f1: 0.6428
 epoch: 96, train_loss: 0.1583, test_loss: 2.2755, test_f1: 0.6362
 epoch: 97, train_loss: 0.1560, test_loss: 2.2820, test_f1: 0.6397
 epoch: 98, train_loss: 0.1733, test_loss: 2.0678, test_f1: 0.6366
 epoch: 99, train_loss: 0.1756, test_loss: 2.0428, test_f1: 0.6311
##################ITERATION #5 ****************************************
 epoch: 0, train_loss: 1.5126, test_loss: 1.3225, test_f1: 0.2270
 epoch: 1, train_loss: 1.0885, test_loss: 1.1740, test_f1: 0.3073
 epoch: 2, train_loss: 0.9855, test_loss: 1.0670, test_f1: 0.3826
 epoch: 3, train_loss: 0.9390, test_loss: 0.9492, test_f1: 0.4686
 epoch: 4, train_loss: 0.9279, test_loss: 0.9098, test_f1: 0.4985
 epoch: 5, train_loss: 0.9022, test_loss: 0.9088, test_f1: 0.5035
 epoch: 6, train_loss: 0.8749, test_loss: 0.9336, test_f1: 0.5043
 epoch: 7, train_loss: 0.8617, test_loss: 0.9418, test_f1: 0.5366
 epoch: 8, train_loss: 0.8321, test_loss: 0.9142, test_f1: 0.5226
 epoch: 9, train_loss: 0.8390, test_loss: 0.8857, test_f1: 0.5403
 epoch: 10, train_loss: 0.8100, test_loss: 0.9305, test_f1: 0.5270
 epoch: 11, train_loss: 0.7934, test_loss: 0.9149, test_f1: 0.5527
 epoch: 12, train_loss: 0.7786, test_loss: 0.9372, test_f1: 0.5564
 epoch: 13, train_loss: 0.7760, test_loss: 0.9335, test_f1: 0.5519
 epoch: 14, train_loss: 0.7672, test_loss: 0.9429, test_f1: 0.5659
 epoch: 15, train_loss: 0.7546, test_loss: 0.9865, test_f1: 0.5395
 epoch: 16, train_loss: 0.7366, test_loss: 0.9326, test_f1: 0.5526
 epoch: 17, train_loss: 0.7237, test_loss: 0.9752, test_f1: 0.6063
 epoch: 18, train_loss: 0.7018, test_loss: 1.0464, test_f1: 0.5504
 epoch: 19, train_loss: 0.7183, test_loss: 0.9697, test_f1: 0.5799
 epoch: 20, train_loss: 0.7078, test_loss: 0.9373, test_f1: 0.5941
 epoch: 21, train_loss: 0.6945, test_loss: 0.9741, test_f1: 0.5777
 epoch: 22, train_loss: 0.6670, test_loss: 0.9874, test_f1: 0.6088
 epoch: 23, train_loss: 0.6802, test_loss: 1.0037, test_f1: 0.5742
 epoch: 24, train_loss: 0.6728, test_loss: 0.9407, test_f1: 0.6305
 epoch: 25, train_loss: 0.6456, test_loss: 0.9926, test_f1: 0.6012
 epoch: 26, train_loss: 0.6439, test_loss: 1.0146, test_f1: 0.6381
 epoch: 27, train_loss: 0.6458, test_loss: 0.9893, test_f1: 0.5814
 epoch: 28, train_loss: 0.6180, test_loss: 1.0441, test_f1: 0.6090
 epoch: 29, train_loss: 0.6183, test_loss: 0.9709, test_f1: 0.5732
 epoch: 30, train_loss: 0.6224, test_loss: 1.0047, test_f1: 0.5910
 epoch: 31, train_loss: 0.6156, test_loss: 1.1397, test_f1: 0.5956
 epoch: 32, train_loss: 0.6025, test_loss: 0.9774, test_f1: 0.5829
 epoch: 33, train_loss: 0.5766, test_loss: 0.9470, test_f1: 0.6589
 epoch: 34, train_loss: 0.5597, test_loss: 1.0525, test_f1: 0.6003
 epoch: 35, train_loss: 0.5415, test_loss: 1.0113, test_f1: 0.6599
 epoch: 36, train_loss: 0.5505, test_loss: 1.0222, test_f1: 0.6302
 epoch: 37, train_loss: 0.5430, test_loss: 1.0597, test_f1: 0.6283
 epoch: 38, train_loss: 0.5335, test_loss: 1.1099, test_f1: 0.6289
 epoch: 39, train_loss: 0.5307, test_loss: 1.1028, test_f1: 0.6026
 epoch: 40, train_loss: 0.5082, test_loss: 1.1590, test_f1: 0.6247
 epoch: 41, train_loss: 0.5212, test_loss: 1.1473, test_f1: 0.6095
 epoch: 42, train_loss: 0.5044, test_loss: 1.2248, test_f1: 0.5811
 epoch: 43, train_loss: 0.4824, test_loss: 1.2031, test_f1: 0.5995
 epoch: 44, train_loss: 0.4748, test_loss: 1.1228, test_f1: 0.5961
 epoch: 45, train_loss: 0.4638, test_loss: 1.1607, test_f1: 0.6197
 epoch: 46, train_loss: 0.4476, test_loss: 1.1659, test_f1: 0.6343
 epoch: 47, train_loss: 0.4430, test_loss: 1.2009, test_f1: 0.5799
 epoch: 48, train_loss: 0.4351, test_loss: 1.2359, test_f1: 0.6201
 epoch: 49, train_loss: 0.4432, test_loss: 1.2309, test_f1: 0.5973
 epoch: 50, train_loss: 0.4589, test_loss: 1.2790, test_f1: 0.5946
 epoch: 51, train_loss: 0.4155, test_loss: 1.1729, test_f1: 0.6292
 epoch: 52, train_loss: 0.3832, test_loss: 1.2714, test_f1: 0.5994
 epoch: 53, train_loss: 0.3730, test_loss: 1.1935, test_f1: 0.6363
 epoch: 54, train_loss: 0.3646, test_loss: 1.2562, test_f1: 0.6419
 epoch: 55, train_loss: 0.3477, test_loss: 1.2891, test_f1: 0.6122
 epoch: 56, train_loss: 0.3340, test_loss: 1.3160, test_f1: 0.6251
 epoch: 57, train_loss: 0.3290, test_loss: 1.3973, test_f1: 0.6086
 epoch: 58, train_loss: 0.3145, test_loss: 1.3619, test_f1: 0.6372
 epoch: 59, train_loss: 0.3212, test_loss: 1.3615, test_f1: 0.6295
 epoch: 60, train_loss: 0.3113, test_loss: 1.3756, test_f1: 0.6165
 epoch: 61, train_loss: 0.2902, test_loss: 1.5189, test_f1: 0.6414
 epoch: 62, train_loss: 0.3045, test_loss: 1.4486, test_f1: 0.6512
 epoch: 63, train_loss: 0.2995, test_loss: 1.4423, test_f1: 0.6230
 epoch: 64, train_loss: 0.2964, test_loss: 1.5049, test_f1: 0.6405
 epoch: 65, train_loss: 0.2997, test_loss: 1.4238, test_f1: 0.6401
 epoch: 66, train_loss: 0.2858, test_loss: 1.4074, test_f1: 0.6437
 epoch: 67, train_loss: 0.3098, test_loss: 1.4172, test_f1: 0.6182
 epoch: 68, train_loss: 0.2874, test_loss: 1.5224, test_f1: 0.6226
 epoch: 69, train_loss: 0.2806, test_loss: 1.5643, test_f1: 0.6299
 epoch: 70, train_loss: 0.3120, test_loss: 1.5222, test_f1: 0.6157
 epoch: 71, train_loss: 0.2919, test_loss: 1.6050, test_f1: 0.6137
 epoch: 72, train_loss: 0.2615, test_loss: 1.6808, test_f1: 0.6267
 epoch: 73, train_loss: 0.2720, test_loss: 1.6121, test_f1: 0.6186
 epoch: 74, train_loss: 0.2577, test_loss: 1.5292, test_f1: 0.6389
 epoch: 75, train_loss: 0.2528, test_loss: 1.5730, test_f1: 0.6447
 epoch: 76, train_loss: 0.2622, test_loss: 1.5407, test_f1: 0.6618
 epoch: 77, train_loss: 0.2428, test_loss: 1.5503, test_f1: 0.6461
 epoch: 78, train_loss: 0.2654, test_loss: 1.6372, test_f1: 0.6343
 epoch: 79, train_loss: 0.2561, test_loss: 1.6081, test_f1: 0.6147
 epoch: 80, train_loss: 0.2475, test_loss: 1.6547, test_f1: 0.6516
 epoch: 81, train_loss: 0.2281, test_loss: 1.6865, test_f1: 0.6326
 epoch: 82, train_loss: 0.2120, test_loss: 1.7734, test_f1: 0.6342
 epoch: 83, train_loss: 0.2180, test_loss: 1.7924, test_f1: 0.6376
 epoch: 84, train_loss: 0.2316, test_loss: 1.7404, test_f1: 0.6418
 epoch: 85, train_loss: 0.2159, test_loss: 1.7787, test_f1: 0.6262
 epoch: 86, train_loss: 0.2230, test_loss: 1.8249, test_f1: 0.6404
 epoch: 87, train_loss: 0.2207, test_loss: 1.7539, test_f1: 0.6297
 epoch: 88, train_loss: 0.2314, test_loss: 1.8414, test_f1: 0.6480
 epoch: 89, train_loss: 0.2346, test_loss: 1.7132, test_f1: 0.6366
 epoch: 90, train_loss: 0.2145, test_loss: 1.7954, test_f1: 0.6352
 epoch: 91, train_loss: 0.1976, test_loss: 1.7854, test_f1: 0.6381
 epoch: 92, train_loss: 0.1990, test_loss: 1.9625, test_f1: 0.6249
 epoch: 93, train_loss: 0.2052, test_loss: 1.8809, test_f1: 0.6629
 epoch: 94, train_loss: 0.2127, test_loss: 1.9092, test_f1: 0.6345
 epoch: 95, train_loss: 0.2219, test_loss: 1.8960, test_f1: 0.6235
 epoch: 96, train_loss: 0.2014, test_loss: 1.8460, test_f1: 0.6411
 epoch: 97, train_loss: 0.2049, test_loss: 1.9106, test_f1: 0.6336
 epoch: 98, train_loss: 0.1977, test_loss: 1.8624, test_f1: 0.6410
 epoch: 99, train_loss: 0.2096, test_loss: 1.9675, test_f1: 0.6267
##################ITERATION #6 ****************************************
 epoch: 0, train_loss: 1.6071, test_loss: 1.4318, test_f1: 0.2270
 epoch: 1, train_loss: 1.1042, test_loss: 1.2122, test_f1: 0.2651
 epoch: 2, train_loss: 1.0050, test_loss: 1.0441, test_f1: 0.3649
 epoch: 3, train_loss: 0.9479, test_loss: 0.9726, test_f1: 0.4608
 epoch: 4, train_loss: 0.9007, test_loss: 0.9399, test_f1: 0.4875
 epoch: 5, train_loss: 0.8663, test_loss: 0.9065, test_f1: 0.5109
 epoch: 6, train_loss: 0.8515, test_loss: 0.8829, test_f1: 0.5321
 epoch: 7, train_loss: 0.8392, test_loss: 0.9069, test_f1: 0.5044
 epoch: 8, train_loss: 0.8200, test_loss: 0.8830, test_f1: 0.5874
 epoch: 9, train_loss: 0.8070, test_loss: 0.8589, test_f1: 0.5600
 epoch: 10, train_loss: 0.7925, test_loss: 0.9182, test_f1: 0.5491
 epoch: 11, train_loss: 0.7840, test_loss: 0.8967, test_f1: 0.5669
 epoch: 12, train_loss: 0.7646, test_loss: 0.9068, test_f1: 0.5857
 epoch: 13, train_loss: 0.7675, test_loss: 0.9305, test_f1: 0.5666
 epoch: 14, train_loss: 0.7616, test_loss: 0.9200, test_f1: 0.5741
 epoch: 15, train_loss: 0.7383, test_loss: 0.8994, test_f1: 0.5729
 epoch: 16, train_loss: 0.7228, test_loss: 0.8609, test_f1: 0.5748
 epoch: 17, train_loss: 0.7288, test_loss: 0.8409, test_f1: 0.5604
 epoch: 18, train_loss: 0.7194, test_loss: 0.9363, test_f1: 0.5535
 epoch: 19, train_loss: 0.7023, test_loss: 0.9234, test_f1: 0.6261
 epoch: 20, train_loss: 0.6898, test_loss: 0.9365, test_f1: 0.5960
 epoch: 21, train_loss: 0.6996, test_loss: 0.9980, test_f1: 0.5617
 epoch: 22, train_loss: 0.7000, test_loss: 0.9395, test_f1: 0.5808
 epoch: 23, train_loss: 0.6743, test_loss: 0.9740, test_f1: 0.5598
 epoch: 24, train_loss: 0.6545, test_loss: 0.9299, test_f1: 0.6001
 epoch: 25, train_loss: 0.6503, test_loss: 0.9076, test_f1: 0.5999
 epoch: 26, train_loss: 0.6369, test_loss: 1.1023, test_f1: 0.4971
 epoch: 27, train_loss: 0.6062, test_loss: 0.9401, test_f1: 0.5962
 epoch: 28, train_loss: 0.5947, test_loss: 0.9549, test_f1: 0.5733
 epoch: 29, train_loss: 0.6232, test_loss: 0.9421, test_f1: 0.5716
 epoch: 30, train_loss: 0.6207, test_loss: 0.9167, test_f1: 0.5932
 epoch: 31, train_loss: 0.5845, test_loss: 0.9547, test_f1: 0.6111
 epoch: 32, train_loss: 0.5717, test_loss: 1.0175, test_f1: 0.5770
 epoch: 33, train_loss: 0.5523, test_loss: 0.9870, test_f1: 0.6255
 epoch: 34, train_loss: 0.5484, test_loss: 1.0065, test_f1: 0.5862
 epoch: 35, train_loss: 0.5458, test_loss: 0.9413, test_f1: 0.6407
 epoch: 36, train_loss: 0.5257, test_loss: 0.9909, test_f1: 0.6068
 epoch: 37, train_loss: 0.5005, test_loss: 0.9787, test_f1: 0.6354
 epoch: 38, train_loss: 0.5111, test_loss: 0.9431, test_f1: 0.6373
 epoch: 39, train_loss: 0.5143, test_loss: 0.9523, test_f1: 0.6463
 epoch: 40, train_loss: 0.5033, test_loss: 0.9731, test_f1: 0.6049
 epoch: 41, train_loss: 0.4653, test_loss: 0.9316, test_f1: 0.6024
 epoch: 42, train_loss: 0.4396, test_loss: 1.0646, test_f1: 0.6340
 epoch: 43, train_loss: 0.4820, test_loss: 1.2443, test_f1: 0.5735
 epoch: 44, train_loss: 0.4741, test_loss: 0.9929, test_f1: 0.6336
 epoch: 45, train_loss: 0.4625, test_loss: 1.1001, test_f1: 0.5909
 epoch: 46, train_loss: 0.4368, test_loss: 1.1693, test_f1: 0.6053
 epoch: 47, train_loss: 0.4423, test_loss: 1.1334, test_f1: 0.6034
 epoch: 48, train_loss: 0.4461, test_loss: 1.1095, test_f1: 0.6424
 epoch: 49, train_loss: 0.4047, test_loss: 1.0829, test_f1: 0.6202
 epoch: 50, train_loss: 0.4159, test_loss: 1.2151, test_f1: 0.5957
 epoch: 51, train_loss: 0.3822, test_loss: 1.1219, test_f1: 0.6223
 epoch: 52, train_loss: 0.3500, test_loss: 1.2525, test_f1: 0.6082
 epoch: 53, train_loss: 0.3318, test_loss: 1.1125, test_f1: 0.6206
 epoch: 54, train_loss: 0.3065, test_loss: 1.2638, test_f1: 0.6195
 epoch: 55, train_loss: 0.3037, test_loss: 1.3341, test_f1: 0.5902
 epoch: 56, train_loss: 0.3055, test_loss: 1.2321, test_f1: 0.6345
 epoch: 57, train_loss: 0.3154, test_loss: 1.3232, test_f1: 0.6302
 epoch: 58, train_loss: 0.2939, test_loss: 1.3000, test_f1: 0.6257
 epoch: 59, train_loss: 0.2939, test_loss: 1.2558, test_f1: 0.6352
 epoch: 60, train_loss: 0.2952, test_loss: 1.2949, test_f1: 0.6220
 epoch: 61, train_loss: 0.2626, test_loss: 1.3213, test_f1: 0.6297
 epoch: 62, train_loss: 0.2624, test_loss: 1.4152, test_f1: 0.6220
 epoch: 63, train_loss: 0.2664, test_loss: 1.3753, test_f1: 0.6450
 epoch: 64, train_loss: 0.2522, test_loss: 1.4720, test_f1: 0.6147
 epoch: 65, train_loss: 0.2672, test_loss: 1.5062, test_f1: 0.6235
 epoch: 66, train_loss: 0.2688, test_loss: 1.4001, test_f1: 0.6280
 epoch: 67, train_loss: 0.2476, test_loss: 1.4386, test_f1: 0.6149
 epoch: 68, train_loss: 0.2529, test_loss: 1.4340, test_f1: 0.6019
 epoch: 69, train_loss: 0.2393, test_loss: 1.4268, test_f1: 0.6240
 epoch: 70, train_loss: 0.2473, test_loss: 1.4927, test_f1: 0.6406
 epoch: 71, train_loss: 0.2430, test_loss: 1.4392, test_f1: 0.6311
 epoch: 72, train_loss: 0.2479, test_loss: 1.4992, test_f1: 0.6299
 epoch: 73, train_loss: 0.2219, test_loss: 1.6043, test_f1: 0.6049
 epoch: 74, train_loss: 0.2347, test_loss: 1.6373, test_f1: 0.6356
 epoch: 75, train_loss: 0.2324, test_loss: 1.6562, test_f1: 0.6011
 epoch: 76, train_loss: 0.2232, test_loss: 1.4963, test_f1: 0.6338
 epoch: 77, train_loss: 0.2321, test_loss: 1.5322, test_f1: 0.6293
 epoch: 78, train_loss: 0.2237, test_loss: 1.5780, test_f1: 0.5996
 epoch: 79, train_loss: 0.2314, test_loss: 1.6344, test_f1: 0.6158
 epoch: 80, train_loss: 0.2271, test_loss: 1.5130, test_f1: 0.6331
 epoch: 81, train_loss: 0.2186, test_loss: 1.5632, test_f1: 0.6177
 epoch: 82, train_loss: 0.2278, test_loss: 1.6032, test_f1: 0.6234
 epoch: 83, train_loss: 0.2130, test_loss: 1.6278, test_f1: 0.6223
 epoch: 84, train_loss: 0.2067, test_loss: 1.6422, test_f1: 0.6178
 epoch: 85, train_loss: 0.2176, test_loss: 1.6778, test_f1: 0.6369
 epoch: 86, train_loss: 0.2027, test_loss: 1.7063, test_f1: 0.6147
 epoch: 87, train_loss: 0.1943, test_loss: 1.7351, test_f1: 0.6260
 epoch: 88, train_loss: 0.1877, test_loss: 1.7817, test_f1: 0.6027
 epoch: 89, train_loss: 0.1919, test_loss: 1.7346, test_f1: 0.6102
 epoch: 90, train_loss: 0.1961, test_loss: 1.7838, test_f1: 0.6195
 epoch: 91, train_loss: 0.2004, test_loss: 1.7934, test_f1: 0.6078
 epoch: 92, train_loss: 0.1903, test_loss: 1.7194, test_f1: 0.6176
 epoch: 93, train_loss: 0.1849, test_loss: 1.7639, test_f1: 0.6209
 epoch: 94, train_loss: 0.1797, test_loss: 1.7537, test_f1: 0.6246
 epoch: 95, train_loss: 0.1755, test_loss: 1.7062, test_f1: 0.6279
 epoch: 96, train_loss: 0.1687, test_loss: 1.8066, test_f1: 0.6438
 epoch: 97, train_loss: 0.1732, test_loss: 1.8392, test_f1: 0.6105
 epoch: 98, train_loss: 0.1777, test_loss: 1.9597, test_f1: 0.6116
 epoch: 99, train_loss: 0.1731, test_loss: 1.9137, test_f1: 0.6086
##################ITERATION #7 ****************************************
 epoch: 0, train_loss: 1.6805, test_loss: 1.2624, test_f1: 0.2441
 epoch: 1, train_loss: 1.0725, test_loss: 1.1458, test_f1: 0.3318
 epoch: 2, train_loss: 0.9978, test_loss: 1.0904, test_f1: 0.4004
 epoch: 3, train_loss: 0.9349, test_loss: 1.0174, test_f1: 0.4723
 epoch: 4, train_loss: 0.9053, test_loss: 0.9525, test_f1: 0.5191
 epoch: 5, train_loss: 0.8967, test_loss: 0.9853, test_f1: 0.4765
 epoch: 6, train_loss: 0.8741, test_loss: 0.9102, test_f1: 0.5102
 epoch: 7, train_loss: 0.8485, test_loss: 0.9600, test_f1: 0.5134
 epoch: 8, train_loss: 0.8425, test_loss: 0.9026, test_f1: 0.5381
 epoch: 9, train_loss: 0.8202, test_loss: 0.9223, test_f1: 0.5205
 epoch: 10, train_loss: 0.8086, test_loss: 0.9637, test_f1: 0.5233
 epoch: 11, train_loss: 0.7916, test_loss: 0.9331, test_f1: 0.5500
 epoch: 12, train_loss: 0.7979, test_loss: 0.9468, test_f1: 0.5183
 epoch: 13, train_loss: 0.7794, test_loss: 0.9657, test_f1: 0.5744
 epoch: 14, train_loss: 0.7633, test_loss: 0.9440, test_f1: 0.5364
 epoch: 15, train_loss: 0.7568, test_loss: 0.9489, test_f1: 0.5811
 epoch: 16, train_loss: 0.7328, test_loss: 0.9553, test_f1: 0.5478
 epoch: 17, train_loss: 0.7270, test_loss: 0.9377, test_f1: 0.5442
 epoch: 18, train_loss: 0.7210, test_loss: 0.8964, test_f1: 0.5803
 epoch: 19, train_loss: 0.7205, test_loss: 1.0214, test_f1: 0.5359
 epoch: 20, train_loss: 0.7088, test_loss: 0.9590, test_f1: 0.5562
 epoch: 21, train_loss: 0.7071, test_loss: 1.0268, test_f1: 0.5018
 epoch: 22, train_loss: 0.6922, test_loss: 1.0019, test_f1: 0.5365
 epoch: 23, train_loss: 0.6693, test_loss: 0.9668, test_f1: 0.5832
 epoch: 24, train_loss: 0.6790, test_loss: 0.9380, test_f1: 0.5555
 epoch: 25, train_loss: 0.6652, test_loss: 1.0211, test_f1: 0.5691
 epoch: 26, train_loss: 0.6565, test_loss: 0.9278, test_f1: 0.5704
 epoch: 27, train_loss: 0.6385, test_loss: 0.9609, test_f1: 0.5841
 epoch: 28, train_loss: 0.6389, test_loss: 1.0322, test_f1: 0.6112
 epoch: 29, train_loss: 0.6433, test_loss: 1.0614, test_f1: 0.5889
 epoch: 30, train_loss: 0.6090, test_loss: 0.9558, test_f1: 0.6109
 epoch: 31, train_loss: 0.6188, test_loss: 1.0678, test_f1: 0.5699
 epoch: 32, train_loss: 0.5863, test_loss: 1.0137, test_f1: 0.5767
 epoch: 33, train_loss: 0.5731, test_loss: 1.0098, test_f1: 0.6377
 epoch: 34, train_loss: 0.5638, test_loss: 1.0367, test_f1: 0.6077
 epoch: 35, train_loss: 0.5511, test_loss: 0.9539, test_f1: 0.6103
 epoch: 36, train_loss: 0.5592, test_loss: 1.0549, test_f1: 0.6602
 epoch: 37, train_loss: 0.5568, test_loss: 1.0465, test_f1: 0.5922
 epoch: 38, train_loss: 0.5728, test_loss: 1.0396, test_f1: 0.6356
 epoch: 39, train_loss: 0.5355, test_loss: 1.0397, test_f1: 0.6023
 epoch: 40, train_loss: 0.5297, test_loss: 0.9795, test_f1: 0.6376
 epoch: 41, train_loss: 0.5108, test_loss: 1.1024, test_f1: 0.6319
 epoch: 42, train_loss: 0.5061, test_loss: 1.1066, test_f1: 0.6301
 epoch: 43, train_loss: 0.4839, test_loss: 1.2148, test_f1: 0.5979
 epoch: 44, train_loss: 0.4783, test_loss: 1.2422, test_f1: 0.6358
 epoch: 45, train_loss: 0.4793, test_loss: 1.1356, test_f1: 0.6245
 epoch: 46, train_loss: 0.4683, test_loss: 1.2566, test_f1: 0.5881
 epoch: 47, train_loss: 0.4727, test_loss: 1.1719, test_f1: 0.6182
 epoch: 48, train_loss: 0.4703, test_loss: 1.2077, test_f1: 0.6306
 epoch: 49, train_loss: 0.4619, test_loss: 1.2018, test_f1: 0.6270
 epoch: 50, train_loss: 0.4406, test_loss: 1.1745, test_f1: 0.6205
 epoch: 51, train_loss: 0.4140, test_loss: 1.1562, test_f1: 0.6443
 epoch: 52, train_loss: 0.3913, test_loss: 1.1442, test_f1: 0.6152
 epoch: 53, train_loss: 0.3694, test_loss: 1.1284, test_f1: 0.6557
 epoch: 54, train_loss: 0.3576, test_loss: 1.2401, test_f1: 0.6356
 epoch: 55, train_loss: 0.3455, test_loss: 1.2163, test_f1: 0.6429
 epoch: 56, train_loss: 0.3369, test_loss: 1.3835, test_f1: 0.6061
 epoch: 57, train_loss: 0.3360, test_loss: 1.2892, test_f1: 0.6370
 epoch: 58, train_loss: 0.3446, test_loss: 1.2513, test_f1: 0.6583
 epoch: 59, train_loss: 0.3266, test_loss: 1.3606, test_f1: 0.6027
 epoch: 60, train_loss: 0.3067, test_loss: 1.2860, test_f1: 0.6564
 epoch: 61, train_loss: 0.3165, test_loss: 1.3440, test_f1: 0.6333
 epoch: 62, train_loss: 0.2950, test_loss: 1.3773, test_f1: 0.6335
 epoch: 63, train_loss: 0.2852, test_loss: 1.4467, test_f1: 0.6413
 epoch: 64, train_loss: 0.3113, test_loss: 1.3458, test_f1: 0.6432
 epoch: 65, train_loss: 0.3069, test_loss: 1.3206, test_f1: 0.6360
 epoch: 66, train_loss: 0.2972, test_loss: 1.3136, test_f1: 0.6353
 epoch: 67, train_loss: 0.3006, test_loss: 1.3215, test_f1: 0.6642
 epoch: 68, train_loss: 0.2844, test_loss: 1.4871, test_f1: 0.6329
 epoch: 69, train_loss: 0.2931, test_loss: 1.5343, test_f1: 0.6161
 epoch: 70, train_loss: 0.2934, test_loss: 1.3972, test_f1: 0.6502
 epoch: 71, train_loss: 0.2662, test_loss: 1.4201, test_f1: 0.6317
 epoch: 72, train_loss: 0.2942, test_loss: 1.4175, test_f1: 0.6457
 epoch: 73, train_loss: 0.2840, test_loss: 1.5252, test_f1: 0.6424
 epoch: 74, train_loss: 0.2756, test_loss: 1.5610, test_f1: 0.6347
 epoch: 75, train_loss: 0.2730, test_loss: 1.4952, test_f1: 0.6098
 epoch: 76, train_loss: 0.2651, test_loss: 1.5388, test_f1: 0.6360
 epoch: 77, train_loss: 0.2562, test_loss: 1.6044, test_f1: 0.6269
 epoch: 78, train_loss: 0.2422, test_loss: 1.5884, test_f1: 0.6405
 epoch: 79, train_loss: 0.2400, test_loss: 1.6960, test_f1: 0.6392
 epoch: 80, train_loss: 0.2424, test_loss: 1.6505, test_f1: 0.6383
 epoch: 81, train_loss: 0.2459, test_loss: 1.6133, test_f1: 0.6357
 epoch: 82, train_loss: 0.2417, test_loss: 1.6764, test_f1: 0.6339
 epoch: 83, train_loss: 0.2447, test_loss: 1.6204, test_f1: 0.6425
 epoch: 84, train_loss: 0.2279, test_loss: 1.6963, test_f1: 0.6253
 epoch: 85, train_loss: 0.2276, test_loss: 1.7951, test_f1: 0.6314
 epoch: 86, train_loss: 0.2368, test_loss: 1.4928, test_f1: 0.6627
 epoch: 87, train_loss: 0.2401, test_loss: 1.5830, test_f1: 0.6512
 epoch: 88, train_loss: 0.2135, test_loss: 1.6723, test_f1: 0.6434
 epoch: 89, train_loss: 0.2260, test_loss: 1.8002, test_f1: 0.6307
 epoch: 90, train_loss: 0.2325, test_loss: 1.7030, test_f1: 0.6281
 epoch: 91, train_loss: 0.2278, test_loss: 1.7626, test_f1: 0.6243
 epoch: 92, train_loss: 0.2133, test_loss: 1.9535, test_f1: 0.6070
 epoch: 93, train_loss: 0.2232, test_loss: 1.6805, test_f1: 0.6371
 epoch: 94, train_loss: 0.2119, test_loss: 1.6648, test_f1: 0.6380
 epoch: 95, train_loss: 0.2140, test_loss: 1.8363, test_f1: 0.6165
 epoch: 96, train_loss: 0.2071, test_loss: 1.9311, test_f1: 0.6211
 epoch: 97, train_loss: 0.2093, test_loss: 1.8230, test_f1: 0.6298
 epoch: 98, train_loss: 0.2086, test_loss: 1.8159, test_f1: 0.6433
 epoch: 99, train_loss: 0.2172, test_loss: 1.8768, test_f1: 0.6100
##################ITERATION #8 ****************************************
 epoch: 0, train_loss: 1.8044, test_loss: 1.3587, test_f1: 0.2270
 epoch: 1, train_loss: 1.0764, test_loss: 1.2235, test_f1: 0.2461
 epoch: 2, train_loss: 0.9860, test_loss: 1.0995, test_f1: 0.3469
 epoch: 3, train_loss: 0.9373, test_loss: 1.0567, test_f1: 0.4179
 epoch: 4, train_loss: 0.9137, test_loss: 1.0247, test_f1: 0.4570
 epoch: 5, train_loss: 0.8832, test_loss: 0.9329, test_f1: 0.5190
 epoch: 6, train_loss: 0.8766, test_loss: 0.9458, test_f1: 0.4933
 epoch: 7, train_loss: 0.8328, test_loss: 0.9215, test_f1: 0.5195
 epoch: 8, train_loss: 0.8180, test_loss: 0.9483, test_f1: 0.5720
 epoch: 9, train_loss: 0.8008, test_loss: 0.8704, test_f1: 0.5600
 epoch: 10, train_loss: 0.7949, test_loss: 0.9300, test_f1: 0.5686
 epoch: 11, train_loss: 0.7758, test_loss: 0.9411, test_f1: 0.5479
 epoch: 12, train_loss: 0.7475, test_loss: 0.9312, test_f1: 0.5734
 epoch: 13, train_loss: 0.7424, test_loss: 0.9174, test_f1: 0.5999
 epoch: 14, train_loss: 0.7540, test_loss: 0.9219, test_f1: 0.5745
 epoch: 15, train_loss: 0.7301, test_loss: 0.9388, test_f1: 0.5696
 epoch: 16, train_loss: 0.7145, test_loss: 1.0054, test_f1: 0.5658
 epoch: 17, train_loss: 0.7153, test_loss: 0.9029, test_f1: 0.5578
 epoch: 18, train_loss: 0.6981, test_loss: 0.8996, test_f1: 0.5912
 epoch: 19, train_loss: 0.6810, test_loss: 0.9331, test_f1: 0.6005
 epoch: 20, train_loss: 0.6889, test_loss: 0.9362, test_f1: 0.5937
 epoch: 21, train_loss: 0.6638, test_loss: 1.0127, test_f1: 0.5699
 epoch: 22, train_loss: 0.6679, test_loss: 1.0457, test_f1: 0.5819
 epoch: 23, train_loss: 0.6501, test_loss: 0.8750, test_f1: 0.6029
 epoch: 24, train_loss: 0.6320, test_loss: 1.0025, test_f1: 0.5808
 epoch: 25, train_loss: 0.6266, test_loss: 1.0369, test_f1: 0.5940
 epoch: 26, train_loss: 0.6293, test_loss: 0.9328, test_f1: 0.6066
 epoch: 27, train_loss: 0.6076, test_loss: 0.9677, test_f1: 0.6040
 epoch: 28, train_loss: 0.5951, test_loss: 0.9542, test_f1: 0.6256
 epoch: 29, train_loss: 0.5793, test_loss: 1.0199, test_f1: 0.5689
 epoch: 30, train_loss: 0.5796, test_loss: 0.9573, test_f1: 0.5790
 epoch: 31, train_loss: 0.5573, test_loss: 1.0525, test_f1: 0.6128
 epoch: 32, train_loss: 0.5528, test_loss: 1.0269, test_f1: 0.6147
 epoch: 33, train_loss: 0.5508, test_loss: 0.9803, test_f1: 0.6012
 epoch: 34, train_loss: 0.5553, test_loss: 1.0508, test_f1: 0.5979
 epoch: 35, train_loss: 0.5293, test_loss: 1.0221, test_f1: 0.6269
 epoch: 36, train_loss: 0.5133, test_loss: 1.0265, test_f1: 0.6307
 epoch: 37, train_loss: 0.5058, test_loss: 0.9934, test_f1: 0.6550
 epoch: 38, train_loss: 0.5066, test_loss: 1.0810, test_f1: 0.6129
 epoch: 39, train_loss: 0.4950, test_loss: 1.0905, test_f1: 0.6245
 epoch: 40, train_loss: 0.4891, test_loss: 1.0944, test_f1: 0.6141
 epoch: 41, train_loss: 0.4957, test_loss: 1.0426, test_f1: 0.6259
 epoch: 42, train_loss: 0.4557, test_loss: 1.0684, test_f1: 0.6479
 epoch: 43, train_loss: 0.4585, test_loss: 1.0893, test_f1: 0.6153
 epoch: 44, train_loss: 0.4446, test_loss: 1.1226, test_f1: 0.6275
 epoch: 45, train_loss: 0.4463, test_loss: 1.1089, test_f1: 0.5990
 epoch: 46, train_loss: 0.4411, test_loss: 1.1108, test_f1: 0.6176
 epoch: 47, train_loss: 0.4206, test_loss: 1.3581, test_f1: 0.5975
 epoch: 48, train_loss: 0.4172, test_loss: 1.2094, test_f1: 0.6198
 epoch: 49, train_loss: 0.4087, test_loss: 1.1846, test_f1: 0.6198
 epoch: 50, train_loss: 0.4105, test_loss: 1.1537, test_f1: 0.6100
 epoch: 51, train_loss: 0.3601, test_loss: 1.1276, test_f1: 0.6450
 epoch: 52, train_loss: 0.3421, test_loss: 1.3380, test_f1: 0.6173
 epoch: 53, train_loss: 0.3240, test_loss: 1.2567, test_f1: 0.6165
 epoch: 54, train_loss: 0.3129, test_loss: 1.3626, test_f1: 0.6177
 epoch: 55, train_loss: 0.3131, test_loss: 1.2560, test_f1: 0.6510
 epoch: 56, train_loss: 0.2933, test_loss: 1.3496, test_f1: 0.6292
 epoch: 57, train_loss: 0.3040, test_loss: 1.2920, test_f1: 0.6435
 epoch: 58, train_loss: 0.2738, test_loss: 1.3584, test_f1: 0.6353
 epoch: 59, train_loss: 0.2852, test_loss: 1.3995, test_f1: 0.6376
 epoch: 60, train_loss: 0.2847, test_loss: 1.4612, test_f1: 0.6021
 epoch: 61, train_loss: 0.2766, test_loss: 1.4408, test_f1: 0.6177
 epoch: 62, train_loss: 0.2676, test_loss: 1.4376, test_f1: 0.6411
 epoch: 63, train_loss: 0.2607, test_loss: 1.5286, test_f1: 0.6105
 epoch: 64, train_loss: 0.2785, test_loss: 1.3805, test_f1: 0.6325
 epoch: 65, train_loss: 0.2615, test_loss: 1.5496, test_f1: 0.6310
 epoch: 66, train_loss: 0.2810, test_loss: 1.4780, test_f1: 0.6330
 epoch: 67, train_loss: 0.2656, test_loss: 1.4455, test_f1: 0.6428
 epoch: 68, train_loss: 0.2572, test_loss: 1.4813, test_f1: 0.6392
 epoch: 69, train_loss: 0.2489, test_loss: 1.4502, test_f1: 0.6347
 epoch: 70, train_loss: 0.2545, test_loss: 1.5403, test_f1: 0.6464
 epoch: 71, train_loss: 0.2429, test_loss: 1.5912, test_f1: 0.6211
 epoch: 72, train_loss: 0.2370, test_loss: 1.4666, test_f1: 0.6279
 epoch: 73, train_loss: 0.2201, test_loss: 1.5136, test_f1: 0.6211
 epoch: 74, train_loss: 0.2243, test_loss: 1.5512, test_f1: 0.6101
 epoch: 75, train_loss: 0.2250, test_loss: 1.5614, test_f1: 0.6392
 epoch: 76, train_loss: 0.2402, test_loss: 1.5204, test_f1: 0.6550
 epoch: 77, train_loss: 0.2452, test_loss: 1.6167, test_f1: 0.6366
 epoch: 78, train_loss: 0.2266, test_loss: 1.6062, test_f1: 0.6387
 epoch: 79, train_loss: 0.2359, test_loss: 1.5899, test_f1: 0.6337
 epoch: 80, train_loss: 0.2162, test_loss: 1.5370, test_f1: 0.6564
 epoch: 81, train_loss: 0.2110, test_loss: 1.7318, test_f1: 0.6302
 epoch: 82, train_loss: 0.2117, test_loss: 1.5919, test_f1: 0.6340
 epoch: 83, train_loss: 0.2045, test_loss: 1.6490, test_f1: 0.6277
 epoch: 84, train_loss: 0.2030, test_loss: 1.7751, test_f1: 0.6112
 epoch: 85, train_loss: 0.1940, test_loss: 1.7158, test_f1: 0.6555
 epoch: 86, train_loss: 0.2003, test_loss: 1.8741, test_f1: 0.6096
 epoch: 87, train_loss: 0.2053, test_loss: 1.6656, test_f1: 0.6367
 epoch: 88, train_loss: 0.2043, test_loss: 1.7952, test_f1: 0.6227
 epoch: 89, train_loss: 0.2139, test_loss: 1.8242, test_f1: 0.6357
 epoch: 90, train_loss: 0.1997, test_loss: 1.8543, test_f1: 0.6377
 epoch: 91, train_loss: 0.2018, test_loss: 1.7429, test_f1: 0.6300
 epoch: 92, train_loss: 0.2026, test_loss: 1.7368, test_f1: 0.6422
 epoch: 93, train_loss: 0.1900, test_loss: 2.0113, test_f1: 0.6192
 epoch: 94, train_loss: 0.2051, test_loss: 1.7493, test_f1: 0.6546
 epoch: 95, train_loss: 0.1875, test_loss: 1.6957, test_f1: 0.6263
 epoch: 96, train_loss: 0.1940, test_loss: 1.8597, test_f1: 0.6342
 epoch: 97, train_loss: 0.1855, test_loss: 1.7758, test_f1: 0.6321
 epoch: 98, train_loss: 0.1937, test_loss: 1.9077, test_f1: 0.6285
 epoch: 99, train_loss: 0.1897, test_loss: 1.8781, test_f1: 0.6383
##################ITERATION #9 ****************************************
 epoch: 0, train_loss: 1.7161, test_loss: 1.5011, test_f1: 0.2270
 epoch: 1, train_loss: 1.0900, test_loss: 1.1672, test_f1: 0.3189
 epoch: 2, train_loss: 0.9903, test_loss: 1.0382, test_f1: 0.3889
 epoch: 3, train_loss: 0.9473, test_loss: 0.9702, test_f1: 0.3886
 epoch: 4, train_loss: 0.9226, test_loss: 0.9655, test_f1: 0.4756
 epoch: 5, train_loss: 0.8865, test_loss: 0.9183, test_f1: 0.4812
 epoch: 6, train_loss: 0.8666, test_loss: 0.9166, test_f1: 0.5199
 epoch: 7, train_loss: 0.8613, test_loss: 0.9346, test_f1: 0.5096
 epoch: 8, train_loss: 0.8359, test_loss: 0.9221, test_f1: 0.5359
 epoch: 9, train_loss: 0.8187, test_loss: 0.9431, test_f1: 0.5059
 epoch: 10, train_loss: 0.7997, test_loss: 0.9613, test_f1: 0.4976
 epoch: 11, train_loss: 0.7958, test_loss: 0.8932, test_f1: 0.5398
 epoch: 12, train_loss: 0.7812, test_loss: 0.8872, test_f1: 0.5615
 epoch: 13, train_loss: 0.7845, test_loss: 0.9587, test_f1: 0.4964
 epoch: 14, train_loss: 0.7644, test_loss: 0.9805, test_f1: 0.5184
 epoch: 15, train_loss: 0.7581, test_loss: 0.9266, test_f1: 0.5608
 epoch: 16, train_loss: 0.7387, test_loss: 0.9049, test_f1: 0.5505
 epoch: 17, train_loss: 0.7198, test_loss: 0.9792, test_f1: 0.5786
 epoch: 18, train_loss: 0.7062, test_loss: 0.9336, test_f1: 0.5769
 epoch: 19, train_loss: 0.7062, test_loss: 0.9365, test_f1: 0.5607
 epoch: 20, train_loss: 0.7019, test_loss: 0.9522, test_f1: 0.5552
 epoch: 21, train_loss: 0.6920, test_loss: 0.9185, test_f1: 0.5675
 epoch: 22, train_loss: 0.7078, test_loss: 0.9419, test_f1: 0.5652
 epoch: 23, train_loss: 0.6861, test_loss: 1.0161, test_f1: 0.5258
 epoch: 24, train_loss: 0.6715, test_loss: 0.9386, test_f1: 0.5794
 epoch: 25, train_loss: 0.6694, test_loss: 0.9547, test_f1: 0.5933
 epoch: 26, train_loss: 0.6395, test_loss: 0.9463, test_f1: 0.5650
 epoch: 27, train_loss: 0.6396, test_loss: 0.9297, test_f1: 0.6004
 epoch: 28, train_loss: 0.6238, test_loss: 0.9253, test_f1: 0.6235
 epoch: 29, train_loss: 0.6198, test_loss: 1.0470, test_f1: 0.5996
 epoch: 30, train_loss: 0.6275, test_loss: 0.9405, test_f1: 0.6261
 epoch: 31, train_loss: 0.6169, test_loss: 0.9941, test_f1: 0.6253
 epoch: 32, train_loss: 0.6009, test_loss: 1.0493, test_f1: 0.5757
 epoch: 33, train_loss: 0.5932, test_loss: 0.9830, test_f1: 0.6206
 epoch: 34, train_loss: 0.5894, test_loss: 1.0002, test_f1: 0.5943
 epoch: 35, train_loss: 0.5829, test_loss: 0.9899, test_f1: 0.6139
 epoch: 36, train_loss: 0.5815, test_loss: 1.0564, test_f1: 0.6217
 epoch: 37, train_loss: 0.5661, test_loss: 0.9450, test_f1: 0.6068
 epoch: 38, train_loss: 0.5614, test_loss: 1.0554, test_f1: 0.6112
 epoch: 39, train_loss: 0.5322, test_loss: 1.0425, test_f1: 0.6352
 epoch: 40, train_loss: 0.5214, test_loss: 1.0742, test_f1: 0.6097
 epoch: 41, train_loss: 0.5316, test_loss: 0.9896, test_f1: 0.6527
 epoch: 42, train_loss: 0.5024, test_loss: 0.9798, test_f1: 0.6087
 epoch: 43, train_loss: 0.4989, test_loss: 1.0529, test_f1: 0.6232
 epoch: 44, train_loss: 0.4958, test_loss: 1.0916, test_f1: 0.5876
 epoch: 45, train_loss: 0.4795, test_loss: 1.0883, test_f1: 0.6003
 epoch: 46, train_loss: 0.4819, test_loss: 1.0016, test_f1: 0.6373
 epoch: 47, train_loss: 0.4811, test_loss: 0.9141, test_f1: 0.6547
 epoch: 48, train_loss: 0.4558, test_loss: 1.1110, test_f1: 0.6357
 epoch: 49, train_loss: 0.4845, test_loss: 1.1622, test_f1: 0.6059
 epoch: 50, train_loss: 0.4709, test_loss: 1.0899, test_f1: 0.6098
 epoch: 51, train_loss: 0.4215, test_loss: 1.0543, test_f1: 0.6497
 epoch: 52, train_loss: 0.3934, test_loss: 1.0981, test_f1: 0.6692
 epoch: 53, train_loss: 0.3750, test_loss: 1.2014, test_f1: 0.6124
 epoch: 54, train_loss: 0.3653, test_loss: 1.1759, test_f1: 0.6391
 epoch: 55, train_loss: 0.3711, test_loss: 1.1943, test_f1: 0.6615
 epoch: 56, train_loss: 0.3546, test_loss: 1.2466, test_f1: 0.6560
 epoch: 57, train_loss: 0.3266, test_loss: 1.2127, test_f1: 0.6421
 epoch: 58, train_loss: 0.3291, test_loss: 1.2769, test_f1: 0.6481
 epoch: 59, train_loss: 0.3368, test_loss: 1.3222, test_f1: 0.6145
 epoch: 60, train_loss: 0.3269, test_loss: 1.3428, test_f1: 0.6277
 epoch: 61, train_loss: 0.3307, test_loss: 1.2959, test_f1: 0.6678
 epoch: 62, train_loss: 0.3170, test_loss: 1.2901, test_f1: 0.6491
 epoch: 63, train_loss: 0.3034, test_loss: 1.2843, test_f1: 0.6691
 epoch: 64, train_loss: 0.3114, test_loss: 1.3536, test_f1: 0.6238
 epoch: 65, train_loss: 0.3157, test_loss: 1.2074, test_f1: 0.6623
 epoch: 66, train_loss: 0.3043, test_loss: 1.3227, test_f1: 0.6379
 epoch: 67, train_loss: 0.3138, test_loss: 1.3181, test_f1: 0.6439
 epoch: 68, train_loss: 0.3049, test_loss: 1.3758, test_f1: 0.6314
 epoch: 69, train_loss: 0.2896, test_loss: 1.2587, test_f1: 0.6982
 epoch: 70, train_loss: 0.2775, test_loss: 1.3806, test_f1: 0.6620
 epoch: 71, train_loss: 0.2803, test_loss: 1.4187, test_f1: 0.6439
 epoch: 72, train_loss: 0.2549, test_loss: 1.3473, test_f1: 0.6541
 epoch: 73, train_loss: 0.2699, test_loss: 1.3448, test_f1: 0.6623
 epoch: 74, train_loss: 0.2709, test_loss: 1.3357, test_f1: 0.6762
 epoch: 75, train_loss: 0.2641, test_loss: 1.5350, test_f1: 0.6326
 epoch: 76, train_loss: 0.2836, test_loss: 1.4846, test_f1: 0.6516
 epoch: 77, train_loss: 0.2693, test_loss: 1.4434, test_f1: 0.6438
 epoch: 78, train_loss: 0.2814, test_loss: 1.4748, test_f1: 0.6292
 epoch: 79, train_loss: 0.2771, test_loss: 1.3744, test_f1: 0.6498
 epoch: 80, train_loss: 0.2716, test_loss: 1.4576, test_f1: 0.6291
 epoch: 81, train_loss: 0.2458, test_loss: 1.3279, test_f1: 0.6801
 epoch: 82, train_loss: 0.2414, test_loss: 1.5137, test_f1: 0.6569
 epoch: 83, train_loss: 0.2491, test_loss: 1.5374, test_f1: 0.6588
 epoch: 84, train_loss: 0.2509, test_loss: 1.5110, test_f1: 0.6670
 epoch: 85, train_loss: 0.2380, test_loss: 1.4360, test_f1: 0.6699
 epoch: 86, train_loss: 0.2430, test_loss: 1.4769, test_f1: 0.6528
 epoch: 87, train_loss: 0.2103, test_loss: 1.7079, test_f1: 0.6234
 epoch: 88, train_loss: 0.2356, test_loss: 1.5061, test_f1: 0.6596
 epoch: 89, train_loss: 0.2278, test_loss: 1.4748, test_f1: 0.6310
 epoch: 90, train_loss: 0.2255, test_loss: 1.5825, test_f1: 0.6631
 epoch: 91, train_loss: 0.2282, test_loss: 1.4647, test_f1: 0.6675
 epoch: 92, train_loss: 0.2129, test_loss: 1.5842, test_f1: 0.6558
 epoch: 93, train_loss: 0.2267, test_loss: 1.6008, test_f1: 0.6553
 epoch: 94, train_loss: 0.2165, test_loss: 1.8031, test_f1: 0.6129
 epoch: 95, train_loss: 0.2120, test_loss: 1.6135, test_f1: 0.6518
 epoch: 96, train_loss: 0.2197, test_loss: 1.7522, test_f1: 0.6435
 epoch: 97, train_loss: 0.2124, test_loss: 1.5701, test_f1: 0.6605
 epoch: 98, train_loss: 0.2083, test_loss: 1.6004, test_f1: 0.6609
 epoch: 99, train_loss: 0.1912, test_loss: 1.7810, test_f1: 0.6239

Training completed in 419.31 seconds
Best F1: 0.6982 at epoch 69
Mean F1 across iterations: 0.6683  0.0154
========================FINAL RESULTS================================
FEGIN weighted F1: 0.6982  0.0154
python main.py --data ltspice_examples --representation component_net --model FEGIN --layers 4 --hiddens 128 --batch_size 256 --lr 0.001 --emb_size 128 --epochs 100 --save_appendix component_net_L4_H128_BS256_LR0.001_E128 --no_val
-----



STDERR:
  File "main.py", line 370, in <module>
    main()
  File "main.py", line 254, in main
    dataset = dataset_class(
  File "/home/philip/projects/ltspice_examples_code_repo/Circuit-Completion-Using-GNNs/component_classification_with_link_prediction_head/evaluation/FEGIN/kernel/circuit_datasets.py", line 15, in __init__
    self.data, self.slices = torch.load(self.processed_paths[0])
  File "/home/philip/.local/lib/python3.8/site-packages/torch/serialization.py", line 1040, in load
    warnings.warn(
  File "/usr/lib/python3.8/warnings.py", line 109, in _showwarnmsg
    sw(msg.message, msg.category, msg.filename, msg.lineno,
  File "main.py", line 47, in warn_with_traceback
    traceback.print_stack(file=log)
/home/philip/projects/ltspice_examples_code_repo/Circuit-Completion-Using-GNNs/component_classification_with_link_prediction_head/evaluation/FEGIN/kernel/circuit_datasets.py:15: FutureWarning: You are using `torch.load` with `weights_only=False` (the current default value), which uses the default pickle module implicitly. It is possible to construct malicious pickle data which will execute arbitrary code during unpickling (See https://github.com/pytorch/pytorch/blob/main/SECURITY.md#untrusted-models for more details). In a future release, the default value for `weights_only` will be flipped to `True`. This limits the functions that could be executed during unpickling. Arbitrary objects will no longer be allowed to be loaded via this mode unless they are explicitly allowlisted by the user via `torch.serialization.add_safe_globals`. We recommend you start setting `weights_only=True` for any use case where you don't have full control of the loaded file. Please open an issue on GitHub for any issues related to this experimental feature.
  self.data, self.slices = torch.load(self.processed_paths[0])
