STDOUT:
Results will be saved in /home/philip/projects/ltspice_examples_code_repo/Circuit-Completion-Using-GNNs/component_classification_with_link_prediction_head/evaluation/FEGIN/results/model_FEGIN_dataset_ltspice_demos
Command line input: python main.py --data ltspice_demos --representation component_net --model FEGIN --layers 6 --hiddens 128 --batch_size 128 --lr 0.001 --emb_size 128 --epochs 100 --save_appendix component_net_L6_H128_BS128_LR0.001_E128 --no_val
 is saved.
-----
ltspice_demos - FEGIN
Using 6 layers, 128 hidden units, h = 2
Loading component_net representation dataset
ENTERED
Training FEGIN on component_net representation
Train: 1565, Test: 383
##################ITERATION #0 ****************************************
 epoch: 0, train_loss: 1.2544, test_loss: 1.3340, test_f1: 0.2281
 epoch: 1, train_loss: 1.1305, test_loss: 1.3152, test_f1: 0.2281
 epoch: 2, train_loss: 1.0971, test_loss: 1.2701, test_f1: 0.3436
 epoch: 3, train_loss: 1.0597, test_loss: 1.1456, test_f1: 0.3857
 epoch: 4, train_loss: 1.0081, test_loss: 1.1308, test_f1: 0.4823
 epoch: 5, train_loss: 0.9704, test_loss: 1.0356, test_f1: 0.5295
 epoch: 6, train_loss: 0.9372, test_loss: 0.9959, test_f1: 0.5490
 epoch: 7, train_loss: 0.8877, test_loss: 1.1032, test_f1: 0.5613
 epoch: 8, train_loss: 0.8892, test_loss: 1.1222, test_f1: 0.5514
 epoch: 9, train_loss: 0.8483, test_loss: 1.1032, test_f1: 0.5330
 epoch: 10, train_loss: 0.8371, test_loss: 1.0751, test_f1: 0.5123
 epoch: 11, train_loss: 0.8146, test_loss: 1.2429, test_f1: 0.5469
 epoch: 12, train_loss: 0.8042, test_loss: 1.1089, test_f1: 0.5724
 epoch: 13, train_loss: 0.7872, test_loss: 1.0985, test_f1: 0.5954
 epoch: 14, train_loss: 0.7761, test_loss: 1.1991, test_f1: 0.5654
 epoch: 15, train_loss: 0.7751, test_loss: 1.1395, test_f1: 0.6254
 epoch: 16, train_loss: 0.7470, test_loss: 1.1266, test_f1: 0.5877
 epoch: 17, train_loss: 0.7307, test_loss: 1.1662, test_f1: 0.6232
 epoch: 18, train_loss: 0.7389, test_loss: 1.2577, test_f1: 0.5439
 epoch: 19, train_loss: 0.7140, test_loss: 1.1867, test_f1: 0.5617
 epoch: 20, train_loss: 0.7212, test_loss: 1.2383, test_f1: 0.5830
 epoch: 21, train_loss: 0.7222, test_loss: 1.1565, test_f1: 0.6145
 epoch: 22, train_loss: 0.6892, test_loss: 1.4088, test_f1: 0.5509
 epoch: 23, train_loss: 0.6710, test_loss: 1.3328, test_f1: 0.5472
 epoch: 24, train_loss: 0.6375, test_loss: 1.3387, test_f1: 0.5791
 epoch: 25, train_loss: 0.6239, test_loss: 1.3559, test_f1: 0.5776
 epoch: 26, train_loss: 0.6079, test_loss: 1.5929, test_f1: 0.5892
 epoch: 27, train_loss: 0.5727, test_loss: 1.4828, test_f1: 0.5775
 epoch: 28, train_loss: 0.5644, test_loss: 1.6156, test_f1: 0.5408
 epoch: 29, train_loss: 0.5468, test_loss: 1.5676, test_f1: 0.6085
 epoch: 30, train_loss: 0.5522, test_loss: 1.4653, test_f1: 0.5606
 epoch: 31, train_loss: 0.5477, test_loss: 1.8236, test_f1: 0.5596
 epoch: 32, train_loss: 0.5457, test_loss: 1.5790, test_f1: 0.5838
 epoch: 33, train_loss: 0.5145, test_loss: 1.5417, test_f1: 0.6049
 epoch: 34, train_loss: 0.5016, test_loss: 1.7937, test_f1: 0.5677
 epoch: 35, train_loss: 0.4994, test_loss: 1.6344, test_f1: 0.5754
 epoch: 36, train_loss: 0.4821, test_loss: 1.5440, test_f1: 0.6038
 epoch: 37, train_loss: 0.5048, test_loss: 1.7166, test_f1: 0.6204
 epoch: 38, train_loss: 0.5006, test_loss: 1.7300, test_f1: 0.5657
 epoch: 39, train_loss: 0.4615, test_loss: 1.7100, test_f1: 0.5723
 epoch: 40, train_loss: 0.4437, test_loss: 1.7936, test_f1: 0.5737
 epoch: 41, train_loss: 0.4219, test_loss: 2.1844, test_f1: 0.5603
 epoch: 42, train_loss: 0.4353, test_loss: 1.9477, test_f1: 0.5746
 epoch: 43, train_loss: 0.4407, test_loss: 1.8832, test_f1: 0.5743
 epoch: 44, train_loss: 0.4280, test_loss: 2.5941, test_f1: 0.5494
 epoch: 45, train_loss: 0.4239, test_loss: 1.7979, test_f1: 0.6217
 epoch: 46, train_loss: 0.4445, test_loss: 2.1942, test_f1: 0.5685
 epoch: 47, train_loss: 0.4314, test_loss: 1.8540, test_f1: 0.5963
 epoch: 48, train_loss: 0.4743, test_loss: 2.0479, test_f1: 0.5453
 epoch: 49, train_loss: 0.4405, test_loss: 2.1593, test_f1: 0.5976
 epoch: 50, train_loss: 0.4440, test_loss: 1.8854, test_f1: 0.5957
 epoch: 51, train_loss: 0.3971, test_loss: 1.9313, test_f1: 0.5928
 epoch: 52, train_loss: 0.3519, test_loss: 1.9272, test_f1: 0.5804
 epoch: 53, train_loss: 0.3060, test_loss: 2.0534, test_f1: 0.5836
 epoch: 54, train_loss: 0.2936, test_loss: 2.1081, test_f1: 0.5660
 epoch: 55, train_loss: 0.2701, test_loss: 2.1101, test_f1: 0.6222
 epoch: 56, train_loss: 0.2691, test_loss: 2.2789, test_f1: 0.5790
 epoch: 57, train_loss: 0.2954, test_loss: 2.3041, test_f1: 0.5966
 epoch: 58, train_loss: 0.2641, test_loss: 2.6360, test_f1: 0.5949
 epoch: 59, train_loss: 0.2699, test_loss: 2.5969, test_f1: 0.5990
 epoch: 60, train_loss: 0.2946, test_loss: 2.4903, test_f1: 0.5788
 epoch: 61, train_loss: 0.2497, test_loss: 2.6801, test_f1: 0.5827
 epoch: 62, train_loss: 0.2522, test_loss: 2.6125, test_f1: 0.5949
 epoch: 63, train_loss: 0.2359, test_loss: 2.5539, test_f1: 0.6153
 epoch: 64, train_loss: 0.2447, test_loss: 2.6598, test_f1: 0.5915
 epoch: 65, train_loss: 0.2597, test_loss: 2.6488, test_f1: 0.5915
 epoch: 66, train_loss: 0.2403, test_loss: 2.7019, test_f1: 0.5884
 epoch: 67, train_loss: 0.2519, test_loss: 2.6435, test_f1: 0.5659
 epoch: 68, train_loss: 0.2208, test_loss: 2.6927, test_f1: 0.6016
 epoch: 69, train_loss: 0.2368, test_loss: 2.6781, test_f1: 0.5775
 epoch: 70, train_loss: 0.2290, test_loss: 2.6794, test_f1: 0.6049
 epoch: 71, train_loss: 0.2121, test_loss: 2.7162, test_f1: 0.5965
 epoch: 72, train_loss: 0.2042, test_loss: 2.6906, test_f1: 0.6155
 epoch: 73, train_loss: 0.1998, test_loss: 2.7807, test_f1: 0.6014
 epoch: 74, train_loss: 0.2049, test_loss: 2.8677, test_f1: 0.5900
 epoch: 75, train_loss: 0.2093, test_loss: 2.9328, test_f1: 0.5907
 epoch: 76, train_loss: 0.2183, test_loss: 2.9263, test_f1: 0.6102
 epoch: 77, train_loss: 0.2234, test_loss: 2.9280, test_f1: 0.5912
 epoch: 78, train_loss: 0.2570, test_loss: 3.1515, test_f1: 0.5970
 epoch: 79, train_loss: 0.2108, test_loss: 3.1009, test_f1: 0.5829
 epoch: 80, train_loss: 0.2149, test_loss: 3.1126, test_f1: 0.6116
 epoch: 81, train_loss: 0.1966, test_loss: 3.1099, test_f1: 0.5715
 epoch: 82, train_loss: 0.2191, test_loss: 2.8300, test_f1: 0.5903
 epoch: 83, train_loss: 0.2291, test_loss: 3.2311, test_f1: 0.5452
 epoch: 84, train_loss: 0.2343, test_loss: 3.1234, test_f1: 0.6075
 epoch: 85, train_loss: 0.2132, test_loss: 3.1335, test_f1: 0.6074
 epoch: 86, train_loss: 0.2119, test_loss: 2.9983, test_f1: 0.5906
 epoch: 87, train_loss: 0.1876, test_loss: 2.9060, test_f1: 0.5907
 epoch: 88, train_loss: 0.2045, test_loss: 3.1453, test_f1: 0.5803
 epoch: 89, train_loss: 0.2328, test_loss: 3.2488, test_f1: 0.6197
 epoch: 90, train_loss: 0.2094, test_loss: 3.2561, test_f1: 0.5888
 epoch: 91, train_loss: 0.1983, test_loss: 3.2249, test_f1: 0.6136
 epoch: 92, train_loss: 0.1606, test_loss: 3.1603, test_f1: 0.6257
 epoch: 93, train_loss: 0.1786, test_loss: 3.6161, test_f1: 0.5779
 epoch: 94, train_loss: 0.1861, test_loss: 3.1116, test_f1: 0.6298
 epoch: 95, train_loss: 0.1766, test_loss: 3.4457, test_f1: 0.6208
 epoch: 96, train_loss: 0.1795, test_loss: 3.4492, test_f1: 0.6127
 epoch: 97, train_loss: 0.1515, test_loss: 3.2482, test_f1: 0.6096
 epoch: 98, train_loss: 0.1830, test_loss: 3.3316, test_f1: 0.6175
 epoch: 99, train_loss: 0.1618, test_loss: 3.6527, test_f1: 0.5802
##################ITERATION #1 ****************************************
 epoch: 0, train_loss: 1.1716, test_loss: 1.3118, test_f1: 0.2281
 epoch: 1, train_loss: 1.0468, test_loss: 1.2535, test_f1: 0.3944
 epoch: 2, train_loss: 1.0069, test_loss: 1.1468, test_f1: 0.3977
 epoch: 3, train_loss: 0.9549, test_loss: 1.1167, test_f1: 0.3758
 epoch: 4, train_loss: 0.9407, test_loss: 1.0619, test_f1: 0.5350
 epoch: 5, train_loss: 0.9036, test_loss: 1.0613, test_f1: 0.4768
 epoch: 6, train_loss: 0.9145, test_loss: 1.0399, test_f1: 0.5366
 epoch: 7, train_loss: 0.8741, test_loss: 1.0375, test_f1: 0.5148
 epoch: 8, train_loss: 0.8532, test_loss: 1.0248, test_f1: 0.5172
 epoch: 9, train_loss: 0.8413, test_loss: 1.0762, test_f1: 0.5293
 epoch: 10, train_loss: 0.8313, test_loss: 1.0597, test_f1: 0.5884
 epoch: 11, train_loss: 0.8175, test_loss: 1.1422, test_f1: 0.5545
 epoch: 12, train_loss: 0.8060, test_loss: 1.1366, test_f1: 0.5675
 epoch: 13, train_loss: 0.7918, test_loss: 1.1903, test_f1: 0.5970
 epoch: 14, train_loss: 0.7822, test_loss: 1.2537, test_f1: 0.5489
 epoch: 15, train_loss: 0.7446, test_loss: 1.1194, test_f1: 0.5859
 epoch: 16, train_loss: 0.7396, test_loss: 1.1858, test_f1: 0.5629
 epoch: 17, train_loss: 0.7100, test_loss: 1.2305, test_f1: 0.5518
 epoch: 18, train_loss: 0.6943, test_loss: 1.3753, test_f1: 0.4821
 epoch: 19, train_loss: 0.6811, test_loss: 1.3108, test_f1: 0.5814
 epoch: 20, train_loss: 0.6915, test_loss: 1.3636, test_f1: 0.5764
 epoch: 21, train_loss: 0.6505, test_loss: 1.2594, test_f1: 0.6102
 epoch: 22, train_loss: 0.6558, test_loss: 1.3364, test_f1: 0.6042
 epoch: 23, train_loss: 0.6335, test_loss: 1.4109, test_f1: 0.5352
 epoch: 24, train_loss: 0.6451, test_loss: 1.3050, test_f1: 0.5677
 epoch: 25, train_loss: 0.6352, test_loss: 1.6693, test_f1: 0.5587
 epoch: 26, train_loss: 0.6223, test_loss: 1.3983, test_f1: 0.6010
 epoch: 27, train_loss: 0.5858, test_loss: 1.4626, test_f1: 0.6020
 epoch: 28, train_loss: 0.5747, test_loss: 1.3188, test_f1: 0.6259
 epoch: 29, train_loss: 0.5680, test_loss: 1.5184, test_f1: 0.6098
 epoch: 30, train_loss: 0.5434, test_loss: 1.6049, test_f1: 0.5908
 epoch: 31, train_loss: 0.5443, test_loss: 1.5022, test_f1: 0.5961
 epoch: 32, train_loss: 0.5640, test_loss: 1.9357, test_f1: 0.5779
 epoch: 33, train_loss: 0.5636, test_loss: 1.3319, test_f1: 0.6189
 epoch: 34, train_loss: 0.5545, test_loss: 1.5481, test_f1: 0.5498
 epoch: 35, train_loss: 0.5146, test_loss: 1.4588, test_f1: 0.6135
 epoch: 36, train_loss: 0.4864, test_loss: 1.7270, test_f1: 0.5801
 epoch: 37, train_loss: 0.5147, test_loss: 1.4124, test_f1: 0.5884
 epoch: 38, train_loss: 0.4968, test_loss: 1.5687, test_f1: 0.5919
 epoch: 39, train_loss: 0.5139, test_loss: 1.6570, test_f1: 0.5650
 epoch: 40, train_loss: 0.4832, test_loss: 1.5763, test_f1: 0.5879
 epoch: 41, train_loss: 0.4415, test_loss: 1.7645, test_f1: 0.5798
 epoch: 42, train_loss: 0.4555, test_loss: 1.6850, test_f1: 0.6078
 epoch: 43, train_loss: 0.4664, test_loss: 1.4130, test_f1: 0.6163
 epoch: 44, train_loss: 0.4416, test_loss: 1.7136, test_f1: 0.6246
 epoch: 45, train_loss: 0.4293, test_loss: 2.1799, test_f1: 0.5633
 epoch: 46, train_loss: 0.4061, test_loss: 1.7823, test_f1: 0.5950
 epoch: 47, train_loss: 0.4305, test_loss: 1.8368, test_f1: 0.5771
 epoch: 48, train_loss: 0.3997, test_loss: 1.9172, test_f1: 0.5551
 epoch: 49, train_loss: 0.3930, test_loss: 2.0705, test_f1: 0.5626
 epoch: 50, train_loss: 0.4098, test_loss: 1.8164, test_f1: 0.6087
 epoch: 51, train_loss: 0.3689, test_loss: 1.8678, test_f1: 0.6326
 epoch: 52, train_loss: 0.3349, test_loss: 2.0476, test_f1: 0.5967
 epoch: 53, train_loss: 0.3203, test_loss: 2.1924, test_f1: 0.6010
 epoch: 54, train_loss: 0.3144, test_loss: 2.0303, test_f1: 0.6203
 epoch: 55, train_loss: 0.3135, test_loss: 2.2249, test_f1: 0.5936
 epoch: 56, train_loss: 0.3078, test_loss: 2.2719, test_f1: 0.6176
 epoch: 57, train_loss: 0.2997, test_loss: 2.1621, test_f1: 0.5931
 epoch: 58, train_loss: 0.3047, test_loss: 2.3219, test_f1: 0.6034
 epoch: 59, train_loss: 0.2738, test_loss: 2.4854, test_f1: 0.5884
 epoch: 60, train_loss: 0.2634, test_loss: 2.1448, test_f1: 0.6370
 epoch: 61, train_loss: 0.2710, test_loss: 2.4027, test_f1: 0.5815
 epoch: 62, train_loss: 0.2543, test_loss: 2.3354, test_f1: 0.5949
 epoch: 63, train_loss: 0.2557, test_loss: 2.3518, test_f1: 0.6000
 epoch: 64, train_loss: 0.2622, test_loss: 2.3302, test_f1: 0.6319
 epoch: 65, train_loss: 0.2687, test_loss: 2.3696, test_f1: 0.6255
 epoch: 66, train_loss: 0.2557, test_loss: 2.5856, test_f1: 0.6065
 epoch: 67, train_loss: 0.2440, test_loss: 2.3866, test_f1: 0.6200
 epoch: 68, train_loss: 0.2377, test_loss: 2.6062, test_f1: 0.5882
 epoch: 69, train_loss: 0.2672, test_loss: 2.6351, test_f1: 0.5863
 epoch: 70, train_loss: 0.2795, test_loss: 2.7590, test_f1: 0.5877
 epoch: 71, train_loss: 0.2544, test_loss: 2.4802, test_f1: 0.6066
 epoch: 72, train_loss: 0.2306, test_loss: 2.6665, test_f1: 0.5855
 epoch: 73, train_loss: 0.2280, test_loss: 2.5072, test_f1: 0.5840
 epoch: 74, train_loss: 0.2335, test_loss: 2.6400, test_f1: 0.5955
 epoch: 75, train_loss: 0.2425, test_loss: 2.8655, test_f1: 0.5912
 epoch: 76, train_loss: 0.2302, test_loss: 2.7991, test_f1: 0.6056
 epoch: 77, train_loss: 0.2275, test_loss: 2.8218, test_f1: 0.5891
 epoch: 78, train_loss: 0.2083, test_loss: 3.0465, test_f1: 0.5693
 epoch: 79, train_loss: 0.1734, test_loss: 3.0493, test_f1: 0.5672
 epoch: 80, train_loss: 0.1890, test_loss: 2.8167, test_f1: 0.6018
 epoch: 81, train_loss: 0.1999, test_loss: 2.9401, test_f1: 0.5650
 epoch: 82, train_loss: 0.2030, test_loss: 2.7457, test_f1: 0.6067
 epoch: 83, train_loss: 0.2068, test_loss: 3.0468, test_f1: 0.5920
 epoch: 84, train_loss: 0.2351, test_loss: 3.2502, test_f1: 0.5782
 epoch: 85, train_loss: 0.2547, test_loss: 3.1178, test_f1: 0.5827
 epoch: 86, train_loss: 0.2136, test_loss: 3.2518, test_f1: 0.5964
 epoch: 87, train_loss: 0.2349, test_loss: 3.1482, test_f1: 0.5879
 epoch: 88, train_loss: 0.2155, test_loss: 2.9040, test_f1: 0.6104
 epoch: 89, train_loss: 0.2282, test_loss: 2.8128, test_f1: 0.6008
 epoch: 90, train_loss: 0.1876, test_loss: 3.0317, test_f1: 0.5848
 epoch: 91, train_loss: 0.1945, test_loss: 2.9595, test_f1: 0.6027
 epoch: 92, train_loss: 0.1999, test_loss: 3.1062, test_f1: 0.5759
 epoch: 93, train_loss: 0.1867, test_loss: 3.1032, test_f1: 0.6056
 epoch: 94, train_loss: 0.1621, test_loss: 3.2463, test_f1: 0.5872
 epoch: 95, train_loss: 0.1871, test_loss: 3.2036, test_f1: 0.5817
 epoch: 96, train_loss: 0.1828, test_loss: 3.2461, test_f1: 0.6039
 epoch: 97, train_loss: 0.1957, test_loss: 3.3492, test_f1: 0.6098
 epoch: 98, train_loss: 0.2113, test_loss: 3.2113, test_f1: 0.6014
 epoch: 99, train_loss: 0.1846, test_loss: 3.0307, test_f1: 0.5963
##################ITERATION #2 ****************************************
 epoch: 0, train_loss: 1.1304, test_loss: 1.3581, test_f1: 0.1661
 epoch: 1, train_loss: 1.0561, test_loss: 1.2717, test_f1: 0.2961
 epoch: 2, train_loss: 0.9635, test_loss: 1.1890, test_f1: 0.3951
 epoch: 3, train_loss: 0.9533, test_loss: 1.0981, test_f1: 0.4261
 epoch: 4, train_loss: 0.9179, test_loss: 1.0793, test_f1: 0.5189
 epoch: 5, train_loss: 0.9042, test_loss: 1.1011, test_f1: 0.5405
 epoch: 6, train_loss: 0.8545, test_loss: 1.0405, test_f1: 0.5915
 epoch: 7, train_loss: 0.8328, test_loss: 1.0215, test_f1: 0.5896
 epoch: 8, train_loss: 0.8364, test_loss: 1.1722, test_f1: 0.5345
 epoch: 9, train_loss: 0.8384, test_loss: 1.0772, test_f1: 0.5542
 epoch: 10, train_loss: 0.8076, test_loss: 1.1430, test_f1: 0.5638
 epoch: 11, train_loss: 0.7834, test_loss: 1.0974, test_f1: 0.5928
 epoch: 12, train_loss: 0.7560, test_loss: 1.0887, test_f1: 0.5937
 epoch: 13, train_loss: 0.7641, test_loss: 1.1875, test_f1: 0.5753
 epoch: 14, train_loss: 0.7318, test_loss: 1.1734, test_f1: 0.5743
 epoch: 15, train_loss: 0.7399, test_loss: 1.3246, test_f1: 0.5470
 epoch: 16, train_loss: 0.7194, test_loss: 1.3067, test_f1: 0.4960
 epoch: 17, train_loss: 0.7132, test_loss: 1.2055, test_f1: 0.5989
 epoch: 18, train_loss: 0.7054, test_loss: 1.2798, test_f1: 0.5795
 epoch: 19, train_loss: 0.7067, test_loss: 1.2048, test_f1: 0.5677
 epoch: 20, train_loss: 0.6770, test_loss: 1.4595, test_f1: 0.5804
 epoch: 21, train_loss: 0.6605, test_loss: 1.3383, test_f1: 0.5492
 epoch: 22, train_loss: 0.6707, test_loss: 1.3673, test_f1: 0.5763
 epoch: 23, train_loss: 0.6424, test_loss: 1.3513, test_f1: 0.5747
 epoch: 24, train_loss: 0.6413, test_loss: 1.4461, test_f1: 0.5663
 epoch: 25, train_loss: 0.5958, test_loss: 1.2863, test_f1: 0.6070
 epoch: 26, train_loss: 0.6128, test_loss: 1.4922, test_f1: 0.5627
 epoch: 27, train_loss: 0.6280, test_loss: 1.5291, test_f1: 0.5482
 epoch: 28, train_loss: 0.6039, test_loss: 1.5764, test_f1: 0.5456
 epoch: 29, train_loss: 0.5998, test_loss: 1.5510, test_f1: 0.5630
 epoch: 30, train_loss: 0.5952, test_loss: 1.3104, test_f1: 0.5806
 epoch: 31, train_loss: 0.5611, test_loss: 1.7758, test_f1: 0.5834
 epoch: 32, train_loss: 0.5354, test_loss: 1.7171, test_f1: 0.6061
 epoch: 33, train_loss: 0.5080, test_loss: 1.7218, test_f1: 0.5935
 epoch: 34, train_loss: 0.5192, test_loss: 1.8520, test_f1: 0.5444
 epoch: 35, train_loss: 0.5132, test_loss: 1.8386, test_f1: 0.5438
 epoch: 36, train_loss: 0.5263, test_loss: 1.5494, test_f1: 0.5953
 epoch: 37, train_loss: 0.4787, test_loss: 1.7232, test_f1: 0.5851
 epoch: 38, train_loss: 0.5202, test_loss: 1.8307, test_f1: 0.5348
 epoch: 39, train_loss: 0.5207, test_loss: 1.8518, test_f1: 0.5669
 epoch: 40, train_loss: 0.4908, test_loss: 1.9047, test_f1: 0.5732
 epoch: 41, train_loss: 0.4405, test_loss: 2.0090, test_f1: 0.6001
 epoch: 42, train_loss: 0.4379, test_loss: 1.9185, test_f1: 0.5874
 epoch: 43, train_loss: 0.4948, test_loss: 1.8456, test_f1: 0.5715
 epoch: 44, train_loss: 0.4391, test_loss: 1.8097, test_f1: 0.5798
 epoch: 45, train_loss: 0.4166, test_loss: 2.1101, test_f1: 0.5674
 epoch: 46, train_loss: 0.4487, test_loss: 2.1049, test_f1: 0.5389
 epoch: 47, train_loss: 0.4319, test_loss: 2.1655, test_f1: 0.5345
 epoch: 48, train_loss: 0.4078, test_loss: 2.0478, test_f1: 0.5521
 epoch: 49, train_loss: 0.4005, test_loss: 2.0940, test_f1: 0.5839
 epoch: 50, train_loss: 0.4067, test_loss: 2.2365, test_f1: 0.5678
 epoch: 51, train_loss: 0.3708, test_loss: 2.2800, test_f1: 0.5727
 epoch: 52, train_loss: 0.3240, test_loss: 2.2945, test_f1: 0.5691
 epoch: 53, train_loss: 0.3027, test_loss: 2.3208, test_f1: 0.5845
 epoch: 54, train_loss: 0.2902, test_loss: 2.4915, test_f1: 0.5688
 epoch: 55, train_loss: 0.2802, test_loss: 2.5868, test_f1: 0.5632
 epoch: 56, train_loss: 0.2812, test_loss: 2.5586, test_f1: 0.5735
 epoch: 57, train_loss: 0.2845, test_loss: 2.6952, test_f1: 0.5965
 epoch: 58, train_loss: 0.3119, test_loss: 2.6970, test_f1: 0.5589
 epoch: 59, train_loss: 0.2917, test_loss: 2.7326, test_f1: 0.5805
 epoch: 60, train_loss: 0.2803, test_loss: 2.8107, test_f1: 0.5723
 epoch: 61, train_loss: 0.2523, test_loss: 2.9039, test_f1: 0.5578
 epoch: 62, train_loss: 0.2482, test_loss: 3.0269, test_f1: 0.5671
 epoch: 63, train_loss: 0.2929, test_loss: 3.2137, test_f1: 0.5574
 epoch: 64, train_loss: 0.3008, test_loss: 2.8825, test_f1: 0.5731
 epoch: 65, train_loss: 0.2852, test_loss: 3.0178, test_f1: 0.5719
 epoch: 66, train_loss: 0.3148, test_loss: 3.0152, test_f1: 0.5857
 epoch: 67, train_loss: 0.2710, test_loss: 2.5983, test_f1: 0.5731
 epoch: 68, train_loss: 0.2525, test_loss: 2.7399, test_f1: 0.5917
 epoch: 69, train_loss: 0.2525, test_loss: 2.7380, test_f1: 0.5976
 epoch: 70, train_loss: 0.2417, test_loss: 3.0023, test_f1: 0.5809
 epoch: 71, train_loss: 0.2531, test_loss: 2.9464, test_f1: 0.6013
 epoch: 72, train_loss: 0.2549, test_loss: 2.8344, test_f1: 0.6076
 epoch: 73, train_loss: 0.2462, test_loss: 3.1312, test_f1: 0.6130
 epoch: 74, train_loss: 0.2511, test_loss: 3.1292, test_f1: 0.5957
 epoch: 75, train_loss: 0.2660, test_loss: 2.8784, test_f1: 0.5509
 epoch: 76, train_loss: 0.2529, test_loss: 3.0918, test_f1: 0.5796
 epoch: 77, train_loss: 0.2318, test_loss: 2.9008, test_f1: 0.5672
 epoch: 78, train_loss: 0.2137, test_loss: 3.0278, test_f1: 0.5601
 epoch: 79, train_loss: 0.2089, test_loss: 3.3075, test_f1: 0.5896
 epoch: 80, train_loss: 0.2043, test_loss: 3.1564, test_f1: 0.5753
 epoch: 81, train_loss: 0.2037, test_loss: 3.2414, test_f1: 0.5716
 epoch: 82, train_loss: 0.2331, test_loss: 3.5820, test_f1: 0.5796
 epoch: 83, train_loss: 0.2293, test_loss: 3.1376, test_f1: 0.5955
 epoch: 84, train_loss: 0.1979, test_loss: 3.2392, test_f1: 0.5923
 epoch: 85, train_loss: 0.1829, test_loss: 3.2625, test_f1: 0.5859
 epoch: 86, train_loss: 0.2068, test_loss: 3.3829, test_f1: 0.5822
 epoch: 87, train_loss: 0.2070, test_loss: 3.3347, test_f1: 0.5758
 epoch: 88, train_loss: 0.1932, test_loss: 3.3705, test_f1: 0.5760
 epoch: 89, train_loss: 0.1946, test_loss: 3.4212, test_f1: 0.5812
 epoch: 90, train_loss: 0.1872, test_loss: 3.1896, test_f1: 0.5709
 epoch: 91, train_loss: 0.1683, test_loss: 3.7280, test_f1: 0.5830
 epoch: 92, train_loss: 0.1900, test_loss: 3.5801, test_f1: 0.5756
 epoch: 93, train_loss: 0.2112, test_loss: 3.2385, test_f1: 0.5963
 epoch: 94, train_loss: 0.2003, test_loss: 3.2410, test_f1: 0.5708
 epoch: 95, train_loss: 0.1878, test_loss: 3.7207, test_f1: 0.5823
 epoch: 96, train_loss: 0.1815, test_loss: 3.7051, test_f1: 0.5734
 epoch: 97, train_loss: 0.1788, test_loss: 3.7634, test_f1: 0.5747
 epoch: 98, train_loss: 0.1689, test_loss: 3.4641, test_f1: 0.5590
 epoch: 99, train_loss: 0.1837, test_loss: 3.8167, test_f1: 0.5926
##################ITERATION #3 ****************************************
 epoch: 0, train_loss: 1.2064, test_loss: 1.2963, test_f1: 0.4308
 epoch: 1, train_loss: 1.0291, test_loss: 1.2397, test_f1: 0.3452
 epoch: 2, train_loss: 0.9805, test_loss: 1.1718, test_f1: 0.3589
 epoch: 3, train_loss: 0.9514, test_loss: 1.2067, test_f1: 0.3415
 epoch: 4, train_loss: 0.9217, test_loss: 1.0781, test_f1: 0.5347
 epoch: 5, train_loss: 0.9153, test_loss: 1.1570, test_f1: 0.5199
 epoch: 6, train_loss: 0.8910, test_loss: 1.0802, test_f1: 0.5272
 epoch: 7, train_loss: 0.8957, test_loss: 1.0148, test_f1: 0.5903
 epoch: 8, train_loss: 0.8534, test_loss: 1.0505, test_f1: 0.5477
 epoch: 9, train_loss: 0.8334, test_loss: 1.1067, test_f1: 0.5343
 epoch: 10, train_loss: 0.8349, test_loss: 1.0880, test_f1: 0.5653
 epoch: 11, train_loss: 0.8112, test_loss: 1.0216, test_f1: 0.6085
 epoch: 12, train_loss: 0.7887, test_loss: 1.0527, test_f1: 0.5957
 epoch: 13, train_loss: 0.8195, test_loss: 1.0820, test_f1: 0.5969
 epoch: 14, train_loss: 0.7570, test_loss: 1.0934, test_f1: 0.5691
 epoch: 15, train_loss: 0.7744, test_loss: 1.2673, test_f1: 0.5435
 epoch: 16, train_loss: 0.7654, test_loss: 1.1672, test_f1: 0.5539
 epoch: 17, train_loss: 0.7482, test_loss: 1.1561, test_f1: 0.5934
 epoch: 18, train_loss: 0.7247, test_loss: 1.1120, test_f1: 0.5558
 epoch: 19, train_loss: 0.7093, test_loss: 1.0856, test_f1: 0.6214
 epoch: 20, train_loss: 0.6998, test_loss: 1.1004, test_f1: 0.6144
 epoch: 21, train_loss: 0.6795, test_loss: 1.2476, test_f1: 0.5720
 epoch: 22, train_loss: 0.6726, test_loss: 1.2862, test_f1: 0.6244
 epoch: 23, train_loss: 0.6794, test_loss: 1.3756, test_f1: 0.5553
 epoch: 24, train_loss: 0.6871, test_loss: 1.2452, test_f1: 0.6141
 epoch: 25, train_loss: 0.6553, test_loss: 1.4054, test_f1: 0.5847
 epoch: 26, train_loss: 0.6399, test_loss: 1.3947, test_f1: 0.5746
 epoch: 27, train_loss: 0.6381, test_loss: 1.4938, test_f1: 0.5438
 epoch: 28, train_loss: 0.6070, test_loss: 1.5175, test_f1: 0.5671
 epoch: 29, train_loss: 0.6307, test_loss: 1.2850, test_f1: 0.6012
 epoch: 30, train_loss: 0.6279, test_loss: 1.2597, test_f1: 0.6028
 epoch: 31, train_loss: 0.5976, test_loss: 1.3402, test_f1: 0.6121
 epoch: 32, train_loss: 0.5864, test_loss: 1.3810, test_f1: 0.6209
 epoch: 33, train_loss: 0.5464, test_loss: 1.5678, test_f1: 0.6003
 epoch: 34, train_loss: 0.5482, test_loss: 1.7467, test_f1: 0.6004
 epoch: 35, train_loss: 0.5382, test_loss: 1.7404, test_f1: 0.6138
 epoch: 36, train_loss: 0.5677, test_loss: 1.4209, test_f1: 0.6211
 epoch: 37, train_loss: 0.5324, test_loss: 1.3362, test_f1: 0.6002
 epoch: 38, train_loss: 0.5249, test_loss: 1.6314, test_f1: 0.5624
 epoch: 39, train_loss: 0.4863, test_loss: 1.6417, test_f1: 0.5715
 epoch: 40, train_loss: 0.4980, test_loss: 1.7201, test_f1: 0.5711
 epoch: 41, train_loss: 0.5011, test_loss: 1.8328, test_f1: 0.5620
 epoch: 42, train_loss: 0.5182, test_loss: 1.5248, test_f1: 0.6458
 epoch: 43, train_loss: 0.4949, test_loss: 2.0385, test_f1: 0.6017
 epoch: 44, train_loss: 0.4774, test_loss: 1.7920, test_f1: 0.5977
 epoch: 45, train_loss: 0.4528, test_loss: 1.6146, test_f1: 0.6344
 epoch: 46, train_loss: 0.4445, test_loss: 1.7672, test_f1: 0.6174
 epoch: 47, train_loss: 0.4581, test_loss: 1.6379, test_f1: 0.6143
 epoch: 48, train_loss: 0.4386, test_loss: 1.6527, test_f1: 0.6673
 epoch: 49, train_loss: 0.4311, test_loss: 2.0032, test_f1: 0.5973
 epoch: 50, train_loss: 0.4441, test_loss: 1.8238, test_f1: 0.5996
 epoch: 51, train_loss: 0.4071, test_loss: 1.8806, test_f1: 0.6317
 epoch: 52, train_loss: 0.3509, test_loss: 1.8516, test_f1: 0.6111
 epoch: 53, train_loss: 0.3546, test_loss: 2.1714, test_f1: 0.5996
 epoch: 54, train_loss: 0.3363, test_loss: 2.2440, test_f1: 0.6217
 epoch: 55, train_loss: 0.3204, test_loss: 2.3417, test_f1: 0.6176
 epoch: 56, train_loss: 0.3285, test_loss: 2.3226, test_f1: 0.5933
 epoch: 57, train_loss: 0.3110, test_loss: 2.2521, test_f1: 0.6026
 epoch: 58, train_loss: 0.2959, test_loss: 2.4596, test_f1: 0.5817
 epoch: 59, train_loss: 0.2880, test_loss: 2.3322, test_f1: 0.6191
 epoch: 60, train_loss: 0.3062, test_loss: 2.5453, test_f1: 0.5941
 epoch: 61, train_loss: 0.2746, test_loss: 2.5180, test_f1: 0.6031
 epoch: 62, train_loss: 0.2681, test_loss: 2.4752, test_f1: 0.6251
 epoch: 63, train_loss: 0.2831, test_loss: 2.3894, test_f1: 0.6052
 epoch: 64, train_loss: 0.2940, test_loss: 2.5995, test_f1: 0.5926
 epoch: 65, train_loss: 0.2941, test_loss: 2.7730, test_f1: 0.5784
 epoch: 66, train_loss: 0.2681, test_loss: 2.3455, test_f1: 0.6241
 epoch: 67, train_loss: 0.2856, test_loss: 2.4359, test_f1: 0.5810
 epoch: 68, train_loss: 0.2630, test_loss: 2.4462, test_f1: 0.6256
 epoch: 69, train_loss: 0.2706, test_loss: 2.3730, test_f1: 0.5814
 epoch: 70, train_loss: 0.2532, test_loss: 2.5248, test_f1: 0.5976
 epoch: 71, train_loss: 0.2594, test_loss: 2.7118, test_f1: 0.6040
 epoch: 72, train_loss: 0.2405, test_loss: 3.0789, test_f1: 0.5829
 epoch: 73, train_loss: 0.3185, test_loss: 2.7550, test_f1: 0.5861
 epoch: 74, train_loss: 0.2781, test_loss: 2.2868, test_f1: 0.6187
 epoch: 75, train_loss: 0.2808, test_loss: 2.4290, test_f1: 0.6080
 epoch: 76, train_loss: 0.2378, test_loss: 2.3351, test_f1: 0.6061
 epoch: 77, train_loss: 0.2253, test_loss: 2.3775, test_f1: 0.6300
 epoch: 78, train_loss: 0.2155, test_loss: 2.7675, test_f1: 0.5963
 epoch: 79, train_loss: 0.2326, test_loss: 2.5756, test_f1: 0.6063
 epoch: 80, train_loss: 0.2501, test_loss: 2.6357, test_f1: 0.5942
 epoch: 81, train_loss: 0.2132, test_loss: 2.7170, test_f1: 0.5959
 epoch: 82, train_loss: 0.2275, test_loss: 2.7777, test_f1: 0.6136
 epoch: 83, train_loss: 0.3159, test_loss: 2.8570, test_f1: 0.5664
 epoch: 84, train_loss: 0.3137, test_loss: 2.3707, test_f1: 0.5898
 epoch: 85, train_loss: 0.2548, test_loss: 2.7270, test_f1: 0.6042
 epoch: 86, train_loss: 0.2529, test_loss: 2.5687, test_f1: 0.6175
 epoch: 87, train_loss: 0.2063, test_loss: 2.8324, test_f1: 0.5878
 epoch: 88, train_loss: 0.2057, test_loss: 2.5121, test_f1: 0.6059
 epoch: 89, train_loss: 0.2184, test_loss: 2.4989, test_f1: 0.5945
 epoch: 90, train_loss: 0.2128, test_loss: 2.5635, test_f1: 0.6107
 epoch: 91, train_loss: 0.2450, test_loss: 2.6547, test_f1: 0.5948
 epoch: 92, train_loss: 0.1871, test_loss: 2.7699, test_f1: 0.5924
 epoch: 93, train_loss: 0.1926, test_loss: 2.9564, test_f1: 0.5838
 epoch: 94, train_loss: 0.1997, test_loss: 2.8623, test_f1: 0.5921
 epoch: 95, train_loss: 0.1991, test_loss: 2.8147, test_f1: 0.5965
 epoch: 96, train_loss: 0.1964, test_loss: 2.9076, test_f1: 0.5810
 epoch: 97, train_loss: 0.3006, test_loss: 2.8986, test_f1: 0.5689
 epoch: 98, train_loss: 0.3117, test_loss: 3.2457, test_f1: 0.6061
 epoch: 99, train_loss: 0.2595, test_loss: 3.1482, test_f1: 0.5960
##################ITERATION #4 ****************************************
 epoch: 0, train_loss: 1.2021, test_loss: 1.3044, test_f1: 0.2497
 epoch: 1, train_loss: 1.0608, test_loss: 1.2333, test_f1: 0.3204
 epoch: 2, train_loss: 0.9892, test_loss: 1.1988, test_f1: 0.3376
 epoch: 3, train_loss: 0.9582, test_loss: 1.1591, test_f1: 0.4248
 epoch: 4, train_loss: 0.9262, test_loss: 1.0716, test_f1: 0.5312
 epoch: 5, train_loss: 0.9026, test_loss: 1.1893, test_f1: 0.5409
 epoch: 6, train_loss: 0.8911, test_loss: 1.0156, test_f1: 0.5727
 epoch: 7, train_loss: 0.8580, test_loss: 1.1224, test_f1: 0.5625
 epoch: 8, train_loss: 0.8545, test_loss: 1.0532, test_f1: 0.5931
 epoch: 9, train_loss: 0.8326, test_loss: 1.1215, test_f1: 0.5753
 epoch: 10, train_loss: 0.8078, test_loss: 1.1015, test_f1: 0.5841
 epoch: 11, train_loss: 0.7906, test_loss: 1.0604, test_f1: 0.5521
 epoch: 12, train_loss: 0.8269, test_loss: 1.1551, test_f1: 0.5063
 epoch: 13, train_loss: 0.8417, test_loss: 1.1446, test_f1: 0.5635
 epoch: 14, train_loss: 0.8004, test_loss: 1.1246, test_f1: 0.5702
 epoch: 15, train_loss: 0.7496, test_loss: 1.2214, test_f1: 0.5963
 epoch: 16, train_loss: 0.7404, test_loss: 1.2084, test_f1: 0.5638
 epoch: 17, train_loss: 0.7281, test_loss: 1.3207, test_f1: 0.5387
 epoch: 18, train_loss: 0.7479, test_loss: 1.2158, test_f1: 0.5317
 epoch: 19, train_loss: 0.7328, test_loss: 1.0456, test_f1: 0.6500
 epoch: 20, train_loss: 0.7219, test_loss: 1.2736, test_f1: 0.5923
 epoch: 21, train_loss: 0.6998, test_loss: 1.3268, test_f1: 0.5914
 epoch: 22, train_loss: 0.6842, test_loss: 1.2017, test_f1: 0.6158
 epoch: 23, train_loss: 0.6937, test_loss: 1.1777, test_f1: 0.5749
 epoch: 24, train_loss: 0.6805, test_loss: 1.4228, test_f1: 0.5212
 epoch: 25, train_loss: 0.6814, test_loss: 1.0959, test_f1: 0.6412
 epoch: 26, train_loss: 0.6521, test_loss: 1.2265, test_f1: 0.6099
 epoch: 27, train_loss: 0.6386, test_loss: 1.2888, test_f1: 0.6344
 epoch: 28, train_loss: 0.6472, test_loss: 1.2515, test_f1: 0.6171
 epoch: 29, train_loss: 0.6173, test_loss: 1.3014, test_f1: 0.6247
 epoch: 30, train_loss: 0.5976, test_loss: 1.3281, test_f1: 0.5941
 epoch: 31, train_loss: 0.5942, test_loss: 1.6104, test_f1: 0.5929
 epoch: 32, train_loss: 0.6133, test_loss: 1.2815, test_f1: 0.6430
 epoch: 33, train_loss: 0.6041, test_loss: 1.3977, test_f1: 0.6212
 epoch: 34, train_loss: 0.5977, test_loss: 1.3716, test_f1: 0.5957
 epoch: 35, train_loss: 0.5707, test_loss: 1.3528, test_f1: 0.6149
 epoch: 36, train_loss: 0.5536, test_loss: 1.5286, test_f1: 0.5886
 epoch: 37, train_loss: 0.5626, test_loss: 1.3717, test_f1: 0.6082
 epoch: 38, train_loss: 0.5380, test_loss: 1.3422, test_f1: 0.6242
 epoch: 39, train_loss: 0.5321, test_loss: 1.1838, test_f1: 0.6444
 epoch: 40, train_loss: 0.5231, test_loss: 1.4026, test_f1: 0.6331
 epoch: 41, train_loss: 0.5181, test_loss: 1.2339, test_f1: 0.6317
 epoch: 42, train_loss: 0.4960, test_loss: 1.4387, test_f1: 0.6114
 epoch: 43, train_loss: 0.4865, test_loss: 1.4167, test_f1: 0.6142
 epoch: 44, train_loss: 0.4804, test_loss: 1.3178, test_f1: 0.6577
 epoch: 45, train_loss: 0.5105, test_loss: 1.4548, test_f1: 0.5837
 epoch: 46, train_loss: 0.4879, test_loss: 1.4389, test_f1: 0.5971
 epoch: 47, train_loss: 0.4443, test_loss: 1.5413, test_f1: 0.6153
 epoch: 48, train_loss: 0.4958, test_loss: 1.5565, test_f1: 0.6157
 epoch: 49, train_loss: 0.5001, test_loss: 1.4651, test_f1: 0.6074
 epoch: 50, train_loss: 0.4526, test_loss: 1.6606, test_f1: 0.5857
 epoch: 51, train_loss: 0.4086, test_loss: 1.4750, test_f1: 0.6221
 epoch: 52, train_loss: 0.3936, test_loss: 1.6483, test_f1: 0.6176
 epoch: 53, train_loss: 0.3515, test_loss: 1.6894, test_f1: 0.6364
 epoch: 54, train_loss: 0.3640, test_loss: 1.5788, test_f1: 0.6300
 epoch: 55, train_loss: 0.3580, test_loss: 1.5778, test_f1: 0.6280
 epoch: 56, train_loss: 0.3588, test_loss: 1.6369, test_f1: 0.6054
 epoch: 57, train_loss: 0.3628, test_loss: 1.7719, test_f1: 0.6137
 epoch: 58, train_loss: 0.3479, test_loss: 1.5791, test_f1: 0.6156
 epoch: 59, train_loss: 0.3126, test_loss: 1.8005, test_f1: 0.6222
 epoch: 60, train_loss: 0.3227, test_loss: 1.7623, test_f1: 0.6240
 epoch: 61, train_loss: 0.3192, test_loss: 1.7693, test_f1: 0.5923
 epoch: 62, train_loss: 0.3235, test_loss: 1.9108, test_f1: 0.6222
 epoch: 63, train_loss: 0.3244, test_loss: 1.6796, test_f1: 0.6465
 epoch: 64, train_loss: 0.3422, test_loss: 1.7982, test_f1: 0.6153
 epoch: 65, train_loss: 0.3460, test_loss: 1.8303, test_f1: 0.6242
 epoch: 66, train_loss: 0.3156, test_loss: 1.9351, test_f1: 0.6216
 epoch: 67, train_loss: 0.2935, test_loss: 1.9653, test_f1: 0.6125
 epoch: 68, train_loss: 0.2940, test_loss: 1.8469, test_f1: 0.6439
 epoch: 69, train_loss: 0.2602, test_loss: 1.9955, test_f1: 0.6365
 epoch: 70, train_loss: 0.2698, test_loss: 2.1832, test_f1: 0.6306
 epoch: 71, train_loss: 0.2542, test_loss: 2.1765, test_f1: 0.6087
 epoch: 72, train_loss: 0.2716, test_loss: 2.2487, test_f1: 0.6102
 epoch: 73, train_loss: 0.2884, test_loss: 2.2467, test_f1: 0.6326
 epoch: 74, train_loss: 0.2380, test_loss: 2.3855, test_f1: 0.6308
 epoch: 75, train_loss: 0.2491, test_loss: 2.4652, test_f1: 0.6174
 epoch: 76, train_loss: 0.2308, test_loss: 2.2693, test_f1: 0.6160
 epoch: 77, train_loss: 0.2342, test_loss: 2.3453, test_f1: 0.6033
 epoch: 78, train_loss: 0.2138, test_loss: 2.7501, test_f1: 0.6051
 epoch: 79, train_loss: 0.2548, test_loss: 2.7224, test_f1: 0.5925
 epoch: 80, train_loss: 0.2323, test_loss: 2.3703, test_f1: 0.6022
 epoch: 81, train_loss: 0.2242, test_loss: 2.3894, test_f1: 0.6357
 epoch: 82, train_loss: 0.2473, test_loss: 2.6133, test_f1: 0.6218
 epoch: 83, train_loss: 0.2184, test_loss: 2.4743, test_f1: 0.6022
 epoch: 84, train_loss: 0.2249, test_loss: 2.5234, test_f1: 0.6047
 epoch: 85, train_loss: 0.2213, test_loss: 2.6593, test_f1: 0.6148
 epoch: 86, train_loss: 0.2012, test_loss: 2.7185, test_f1: 0.5789
 epoch: 87, train_loss: 0.2151, test_loss: 2.8116, test_f1: 0.5941
 epoch: 88, train_loss: 0.2193, test_loss: 2.5579, test_f1: 0.5945
 epoch: 89, train_loss: 0.2297, test_loss: 2.7272, test_f1: 0.6188
 epoch: 90, train_loss: 0.2340, test_loss: 2.4436, test_f1: 0.6490
 epoch: 91, train_loss: 0.2178, test_loss: 2.4692, test_f1: 0.6351
 epoch: 92, train_loss: 0.2532, test_loss: 2.7563, test_f1: 0.6158
 epoch: 93, train_loss: 0.2298, test_loss: 2.7632, test_f1: 0.6000
 epoch: 94, train_loss: 0.2175, test_loss: 2.6403, test_f1: 0.6185
 epoch: 95, train_loss: 0.2208, test_loss: 2.6770, test_f1: 0.6127
 epoch: 96, train_loss: 0.1854, test_loss: 2.8209, test_f1: 0.6018
 epoch: 97, train_loss: 0.1853, test_loss: 2.8712, test_f1: 0.6110
 epoch: 98, train_loss: 0.2635, test_loss: 2.6725, test_f1: 0.6296
 epoch: 99, train_loss: 0.2170, test_loss: 2.7062, test_f1: 0.6129
##################ITERATION #5 ****************************************
 epoch: 0, train_loss: 1.2027, test_loss: 1.2998, test_f1: 0.3987
 epoch: 1, train_loss: 1.0273, test_loss: 1.2233, test_f1: 0.2233
 epoch: 2, train_loss: 0.9674, test_loss: 1.2224, test_f1: 0.2310
 epoch: 3, train_loss: 0.9344, test_loss: 1.1762, test_f1: 0.3349
 epoch: 4, train_loss: 0.9144, test_loss: 1.0824, test_f1: 0.5009
 epoch: 5, train_loss: 0.8798, test_loss: 1.0787, test_f1: 0.5341
 epoch: 6, train_loss: 0.8296, test_loss: 1.0623, test_f1: 0.5469
 epoch: 7, train_loss: 0.8429, test_loss: 1.0713, test_f1: 0.5681
 epoch: 8, train_loss: 0.8579, test_loss: 1.0313, test_f1: 0.5451
 epoch: 9, train_loss: 0.8289, test_loss: 1.1223, test_f1: 0.5521
 epoch: 10, train_loss: 0.7995, test_loss: 1.0180, test_f1: 0.5810
 epoch: 11, train_loss: 0.7954, test_loss: 1.1064, test_f1: 0.5572
 epoch: 12, train_loss: 0.7598, test_loss: 1.0922, test_f1: 0.5727
 epoch: 13, train_loss: 0.7584, test_loss: 1.0933, test_f1: 0.5960
 epoch: 14, train_loss: 0.7388, test_loss: 1.1613, test_f1: 0.5954
 epoch: 15, train_loss: 0.7074, test_loss: 1.1367, test_f1: 0.6067
 epoch: 16, train_loss: 0.7025, test_loss: 1.1724, test_f1: 0.5802
 epoch: 17, train_loss: 0.7108, test_loss: 1.2224, test_f1: 0.5891
 epoch: 18, train_loss: 0.6958, test_loss: 1.2462, test_f1: 0.5733
 epoch: 19, train_loss: 0.7108, test_loss: 1.2920, test_f1: 0.5961
 epoch: 20, train_loss: 0.6865, test_loss: 1.1949, test_f1: 0.6209
 epoch: 21, train_loss: 0.6647, test_loss: 1.2981, test_f1: 0.5920
 epoch: 22, train_loss: 0.6463, test_loss: 1.2474, test_f1: 0.5580
 epoch: 23, train_loss: 0.6343, test_loss: 1.3733, test_f1: 0.5506
 epoch: 24, train_loss: 0.6364, test_loss: 1.3224, test_f1: 0.6195
 epoch: 25, train_loss: 0.6245, test_loss: 1.4329, test_f1: 0.5152
 epoch: 26, train_loss: 0.6530, test_loss: 1.3196, test_f1: 0.5951
 epoch: 27, train_loss: 0.5850, test_loss: 1.3326, test_f1: 0.6271
 epoch: 28, train_loss: 0.5925, test_loss: 1.3412, test_f1: 0.5930
 epoch: 29, train_loss: 0.5662, test_loss: 1.3441, test_f1: 0.5990
 epoch: 30, train_loss: 0.5632, test_loss: 1.4096, test_f1: 0.5953
 epoch: 31, train_loss: 0.5484, test_loss: 1.4706, test_f1: 0.5910
 epoch: 32, train_loss: 0.5436, test_loss: 1.6226, test_f1: 0.5832
 epoch: 33, train_loss: 0.5316, test_loss: 1.5522, test_f1: 0.6161
 epoch: 34, train_loss: 0.5079, test_loss: 1.4838, test_f1: 0.5786
 epoch: 35, train_loss: 0.5225, test_loss: 1.6944, test_f1: 0.5911
 epoch: 36, train_loss: 0.5358, test_loss: 1.4155, test_f1: 0.6086
 epoch: 37, train_loss: 0.5264, test_loss: 1.4967, test_f1: 0.5990
 epoch: 38, train_loss: 0.5316, test_loss: 1.2043, test_f1: 0.5903
 epoch: 39, train_loss: 0.4767, test_loss: 1.4052, test_f1: 0.6053
 epoch: 40, train_loss: 0.4904, test_loss: 1.5313, test_f1: 0.6271
 epoch: 41, train_loss: 0.4927, test_loss: 2.0277, test_f1: 0.4967
 epoch: 42, train_loss: 0.4627, test_loss: 1.6959, test_f1: 0.5770
 epoch: 43, train_loss: 0.4602, test_loss: 1.6524, test_f1: 0.5712
 epoch: 44, train_loss: 0.4645, test_loss: 1.4969, test_f1: 0.5696
 epoch: 45, train_loss: 0.4633, test_loss: 1.7619, test_f1: 0.5860
 epoch: 46, train_loss: 0.4758, test_loss: 1.8786, test_f1: 0.6013
 epoch: 47, train_loss: 0.4708, test_loss: 1.9147, test_f1: 0.5416
 epoch: 48, train_loss: 0.4041, test_loss: 1.7980, test_f1: 0.5587
 epoch: 49, train_loss: 0.4139, test_loss: 1.8616, test_f1: 0.5847
 epoch: 50, train_loss: 0.4093, test_loss: 1.7036, test_f1: 0.5957
 epoch: 51, train_loss: 0.3716, test_loss: 1.8598, test_f1: 0.5848
 epoch: 52, train_loss: 0.3413, test_loss: 1.8736, test_f1: 0.6179
 epoch: 53, train_loss: 0.2997, test_loss: 1.7783, test_f1: 0.6184
 epoch: 54, train_loss: 0.3192, test_loss: 1.9943, test_f1: 0.6354
 epoch: 55, train_loss: 0.2975, test_loss: 2.0603, test_f1: 0.5935
 epoch: 56, train_loss: 0.3149, test_loss: 2.2897, test_f1: 0.5762
 epoch: 57, train_loss: 0.3195, test_loss: 2.0290, test_f1: 0.5842
 epoch: 58, train_loss: 0.2800, test_loss: 2.2066, test_f1: 0.5919
 epoch: 59, train_loss: 0.2990, test_loss: 2.2457, test_f1: 0.5971
 epoch: 60, train_loss: 0.2723, test_loss: 2.3131, test_f1: 0.5893
 epoch: 61, train_loss: 0.2488, test_loss: 2.3065, test_f1: 0.5974
 epoch: 62, train_loss: 0.2837, test_loss: 2.4094, test_f1: 0.5856
 epoch: 63, train_loss: 0.2600, test_loss: 2.4836, test_f1: 0.5720
 epoch: 64, train_loss: 0.2619, test_loss: 2.3109, test_f1: 0.5957
 epoch: 65, train_loss: 0.2436, test_loss: 2.1866, test_f1: 0.6280
 epoch: 66, train_loss: 0.2433, test_loss: 2.4297, test_f1: 0.5754
 epoch: 67, train_loss: 0.2633, test_loss: 2.6197, test_f1: 0.5855
 epoch: 68, train_loss: 0.2582, test_loss: 2.5736, test_f1: 0.6165
 epoch: 69, train_loss: 0.2457, test_loss: 2.3329, test_f1: 0.5942
 epoch: 70, train_loss: 0.2356, test_loss: 2.4220, test_f1: 0.5980
 epoch: 71, train_loss: 0.2390, test_loss: 2.9448, test_f1: 0.5747
 epoch: 72, train_loss: 0.2388, test_loss: 2.5146, test_f1: 0.5784
 epoch: 73, train_loss: 0.2351, test_loss: 2.4442, test_f1: 0.5956
 epoch: 74, train_loss: 0.2235, test_loss: 2.5447, test_f1: 0.6130
 epoch: 75, train_loss: 0.2112, test_loss: 2.5022, test_f1: 0.6140
 epoch: 76, train_loss: 0.2333, test_loss: 2.5736, test_f1: 0.5822
 epoch: 77, train_loss: 0.2364, test_loss: 2.6149, test_f1: 0.5977
 epoch: 78, train_loss: 0.2353, test_loss: 2.6775, test_f1: 0.6085
 epoch: 79, train_loss: 0.2272, test_loss: 2.6769, test_f1: 0.5890
 epoch: 80, train_loss: 0.2288, test_loss: 3.0013, test_f1: 0.5819
 epoch: 81, train_loss: 0.2422, test_loss: 3.1229, test_f1: 0.5594
 epoch: 82, train_loss: 0.2384, test_loss: 3.0940, test_f1: 0.5632
 epoch: 83, train_loss: 0.2178, test_loss: 3.1369, test_f1: 0.5951
 epoch: 84, train_loss: 0.2041, test_loss: 3.0451, test_f1: 0.5807
 epoch: 85, train_loss: 0.1939, test_loss: 3.2121, test_f1: 0.5879
 epoch: 86, train_loss: 0.1948, test_loss: 2.9827, test_f1: 0.5834
 epoch: 87, train_loss: 0.1948, test_loss: 3.0486, test_f1: 0.5898
 epoch: 88, train_loss: 0.2448, test_loss: 2.7465, test_f1: 0.6146
 epoch: 89, train_loss: 0.2156, test_loss: 2.6608, test_f1: 0.6074
 epoch: 90, train_loss: 0.1990, test_loss: 2.8293, test_f1: 0.6099
 epoch: 91, train_loss: 0.1731, test_loss: 2.6955, test_f1: 0.5977
 epoch: 92, train_loss: 0.1562, test_loss: 3.0190, test_f1: 0.5992
 epoch: 93, train_loss: 0.1509, test_loss: 3.1077, test_f1: 0.5867
 epoch: 94, train_loss: 0.1419, test_loss: 3.2437, test_f1: 0.5867
 epoch: 95, train_loss: 0.1344, test_loss: 3.1253, test_f1: 0.5963
 epoch: 96, train_loss: 0.1449, test_loss: 3.3041, test_f1: 0.5781
 epoch: 97, train_loss: 0.1731, test_loss: 3.1421, test_f1: 0.5876
 epoch: 98, train_loss: 0.1789, test_loss: 3.2420, test_f1: 0.5646
 epoch: 99, train_loss: 0.1954, test_loss: 3.3539, test_f1: 0.5506
##################ITERATION #6 ****************************************
 epoch: 0, train_loss: 1.2240, test_loss: 1.3208, test_f1: 0.3486
 epoch: 1, train_loss: 1.0710, test_loss: 1.5439, test_f1: 0.1514
 epoch: 2, train_loss: 1.0111, test_loss: 1.2512, test_f1: 0.3867
 epoch: 3, train_loss: 0.9413, test_loss: 1.0609, test_f1: 0.4988
 epoch: 4, train_loss: 0.9301, test_loss: 1.0081, test_f1: 0.5296
 epoch: 5, train_loss: 0.8916, test_loss: 1.0177, test_f1: 0.5259
 epoch: 6, train_loss: 0.8901, test_loss: 1.1556, test_f1: 0.5044
 epoch: 7, train_loss: 0.8895, test_loss: 1.0506, test_f1: 0.5455
 epoch: 8, train_loss: 0.8440, test_loss: 1.0752, test_f1: 0.5460
 epoch: 9, train_loss: 0.8295, test_loss: 1.1350, test_f1: 0.5231
 epoch: 10, train_loss: 0.8480, test_loss: 1.0554, test_f1: 0.5647
 epoch: 11, train_loss: 0.8219, test_loss: 0.9976, test_f1: 0.5771
 epoch: 12, train_loss: 0.8039, test_loss: 1.0880, test_f1: 0.5661
 epoch: 13, train_loss: 0.7743, test_loss: 1.0852, test_f1: 0.5627
 epoch: 14, train_loss: 0.7662, test_loss: 1.1296, test_f1: 0.5540
 epoch: 15, train_loss: 0.7643, test_loss: 1.1506, test_f1: 0.5374
 epoch: 16, train_loss: 0.7768, test_loss: 1.1034, test_f1: 0.5882
 epoch: 17, train_loss: 0.7653, test_loss: 1.3090, test_f1: 0.5002
 epoch: 18, train_loss: 0.7381, test_loss: 1.1309, test_f1: 0.5800
 epoch: 19, train_loss: 0.7504, test_loss: 1.1813, test_f1: 0.6003
 epoch: 20, train_loss: 0.7408, test_loss: 1.2204, test_f1: 0.5178
 epoch: 21, train_loss: 0.7282, test_loss: 1.1697, test_f1: 0.5703
 epoch: 22, train_loss: 0.6897, test_loss: 1.2352, test_f1: 0.5683
 epoch: 23, train_loss: 0.6783, test_loss: 1.2447, test_f1: 0.5765
 epoch: 24, train_loss: 0.6852, test_loss: 1.1606, test_f1: 0.5929
 epoch: 25, train_loss: 0.6669, test_loss: 1.3137, test_f1: 0.5788
 epoch: 26, train_loss: 0.6464, test_loss: 1.3779, test_f1: 0.5547
 epoch: 27, train_loss: 0.6276, test_loss: 1.5768, test_f1: 0.5489
 epoch: 28, train_loss: 0.6135, test_loss: 1.5611, test_f1: 0.5178
 epoch: 29, train_loss: 0.5988, test_loss: 1.5164, test_f1: 0.5564
 epoch: 30, train_loss: 0.6359, test_loss: 1.4188, test_f1: 0.5672
 epoch: 31, train_loss: 0.6714, test_loss: 1.4421, test_f1: 0.5300
 epoch: 32, train_loss: 0.6778, test_loss: 1.4305, test_f1: 0.5625
 epoch: 33, train_loss: 0.6189, test_loss: 1.4813, test_f1: 0.5200
 epoch: 34, train_loss: 0.5841, test_loss: 1.3319, test_f1: 0.5692
 epoch: 35, train_loss: 0.6091, test_loss: 1.6578, test_f1: 0.5643
 epoch: 36, train_loss: 0.5883, test_loss: 1.6366, test_f1: 0.5408
 epoch: 37, train_loss: 0.5878, test_loss: 1.6038, test_f1: 0.5487
 epoch: 38, train_loss: 0.5827, test_loss: 1.6666, test_f1: 0.5917
 epoch: 39, train_loss: 0.5357, test_loss: 1.6069, test_f1: 0.5856
 epoch: 40, train_loss: 0.5560, test_loss: 1.4371, test_f1: 0.5756
 epoch: 41, train_loss: 0.5695, test_loss: 1.6272, test_f1: 0.5949
 epoch: 42, train_loss: 0.5761, test_loss: 1.6303, test_f1: 0.5502
 epoch: 43, train_loss: 0.5378, test_loss: 1.8531, test_f1: 0.5787
 epoch: 44, train_loss: 0.5306, test_loss: 1.8394, test_f1: 0.5099
 epoch: 45, train_loss: 0.5099, test_loss: 1.8432, test_f1: 0.5737
 epoch: 46, train_loss: 0.5156, test_loss: 1.9277, test_f1: 0.5761
 epoch: 47, train_loss: 0.4907, test_loss: 2.1034, test_f1: 0.5514
 epoch: 48, train_loss: 0.4828, test_loss: 1.7872, test_f1: 0.5479
 epoch: 49, train_loss: 0.4471, test_loss: 1.7129, test_f1: 0.5453
 epoch: 50, train_loss: 0.4660, test_loss: 1.8609, test_f1: 0.5806
 epoch: 51, train_loss: 0.4283, test_loss: 1.8909, test_f1: 0.5643
 epoch: 52, train_loss: 0.4056, test_loss: 1.8095, test_f1: 0.6087
 epoch: 53, train_loss: 0.3942, test_loss: 2.1556, test_f1: 0.5740
 epoch: 54, train_loss: 0.3876, test_loss: 2.1410, test_f1: 0.5710
 epoch: 55, train_loss: 0.3977, test_loss: 2.3043, test_f1: 0.5662
 epoch: 56, train_loss: 0.4152, test_loss: 2.1480, test_f1: 0.5652
 epoch: 57, train_loss: 0.3869, test_loss: 2.0695, test_f1: 0.5729
 epoch: 58, train_loss: 0.3364, test_loss: 2.3081, test_f1: 0.5696
 epoch: 59, train_loss: 0.3240, test_loss: 2.2800, test_f1: 0.5894
 epoch: 60, train_loss: 0.3213, test_loss: 2.6019, test_f1: 0.5650
 epoch: 61, train_loss: 0.3339, test_loss: 2.3961, test_f1: 0.5659
 epoch: 62, train_loss: 0.3101, test_loss: 2.4076, test_f1: 0.5852
 epoch: 63, train_loss: 0.3054, test_loss: 2.4538, test_f1: 0.5739
 epoch: 64, train_loss: 0.3169, test_loss: 2.4497, test_f1: 0.5798
 epoch: 65, train_loss: 0.3051, test_loss: 2.6260, test_f1: 0.5711
 epoch: 66, train_loss: 0.3480, test_loss: 2.5299, test_f1: 0.5746
 epoch: 67, train_loss: 0.3032, test_loss: 2.3017, test_f1: 0.5936
 epoch: 68, train_loss: 0.2937, test_loss: 2.4524, test_f1: 0.5794
 epoch: 69, train_loss: 0.2828, test_loss: 2.3944, test_f1: 0.6038
 epoch: 70, train_loss: 0.3034, test_loss: 2.4490, test_f1: 0.5664
 epoch: 71, train_loss: 0.3067, test_loss: 2.5036, test_f1: 0.5714
 epoch: 72, train_loss: 0.2755, test_loss: 2.5138, test_f1: 0.5965
 epoch: 73, train_loss: 0.2744, test_loss: 2.5959, test_f1: 0.5854
 epoch: 74, train_loss: 0.2738, test_loss: 2.7703, test_f1: 0.5632
 epoch: 75, train_loss: 0.3166, test_loss: 2.6417, test_f1: 0.5684
 epoch: 76, train_loss: 0.3031, test_loss: 2.5678, test_f1: 0.5874
 epoch: 77, train_loss: 0.2736, test_loss: 2.6212, test_f1: 0.5908
 epoch: 78, train_loss: 0.2546, test_loss: 2.7761, test_f1: 0.5550
 epoch: 79, train_loss: 0.2389, test_loss: 2.8330, test_f1: 0.5621
 epoch: 80, train_loss: 0.2899, test_loss: 3.2715, test_f1: 0.5521
 epoch: 81, train_loss: 0.3091, test_loss: 2.4375, test_f1: 0.5701
 epoch: 82, train_loss: 0.2646, test_loss: 2.9082, test_f1: 0.5512
 epoch: 83, train_loss: 0.2646, test_loss: 2.7154, test_f1: 0.5849
 epoch: 84, train_loss: 0.2482, test_loss: 2.7715, test_f1: 0.5885
 epoch: 85, train_loss: 0.2680, test_loss: 2.9222, test_f1: 0.5819
 epoch: 86, train_loss: 0.2458, test_loss: 2.9820, test_f1: 0.5662
 epoch: 87, train_loss: 0.2326, test_loss: 2.8383, test_f1: 0.5602
 epoch: 88, train_loss: 0.2909, test_loss: 3.0396, test_f1: 0.5683
 epoch: 89, train_loss: 0.3258, test_loss: 3.0808, test_f1: 0.5813
 epoch: 90, train_loss: 0.2879, test_loss: 2.8050, test_f1: 0.5947
 epoch: 91, train_loss: 0.3155, test_loss: 2.8092, test_f1: 0.5480
 epoch: 92, train_loss: 0.2996, test_loss: 2.6337, test_f1: 0.5589
 epoch: 93, train_loss: 0.2606, test_loss: 3.0808, test_f1: 0.5510
 epoch: 94, train_loss: 0.2476, test_loss: 2.6694, test_f1: 0.5820
 epoch: 95, train_loss: 0.3009, test_loss: 2.6925, test_f1: 0.5837
 epoch: 96, train_loss: 0.3317, test_loss: 2.4063, test_f1: 0.5841
 epoch: 97, train_loss: 0.2980, test_loss: 2.7536, test_f1: 0.5487
 epoch: 98, train_loss: 0.2519, test_loss: 2.6549, test_f1: 0.5801
 epoch: 99, train_loss: 0.2392, test_loss: 2.5987, test_f1: 0.5801
##################ITERATION #7 ****************************************
 epoch: 0, train_loss: 1.2646, test_loss: 1.3701, test_f1: 0.1579
 epoch: 1, train_loss: 1.0512, test_loss: 1.2863, test_f1: 0.4027
 epoch: 2, train_loss: 0.9965, test_loss: 1.2273, test_f1: 0.4162
 epoch: 3, train_loss: 0.9635, test_loss: 1.1777, test_f1: 0.4485
 epoch: 4, train_loss: 0.9441, test_loss: 1.0322, test_f1: 0.4924
 epoch: 5, train_loss: 0.9073, test_loss: 1.0250, test_f1: 0.5043
 epoch: 6, train_loss: 0.8852, test_loss: 1.1245, test_f1: 0.4991
 epoch: 7, train_loss: 0.8566, test_loss: 1.0489, test_f1: 0.5094
 epoch: 8, train_loss: 0.8456, test_loss: 0.9961, test_f1: 0.5548
 epoch: 9, train_loss: 0.8485, test_loss: 1.1039, test_f1: 0.5531
 epoch: 10, train_loss: 0.8225, test_loss: 1.0226, test_f1: 0.5771
 epoch: 11, train_loss: 0.7958, test_loss: 1.1448, test_f1: 0.5678
 epoch: 12, train_loss: 0.8100, test_loss: 1.1272, test_f1: 0.5550
 epoch: 13, train_loss: 0.7830, test_loss: 1.2254, test_f1: 0.5187
 epoch: 14, train_loss: 0.7613, test_loss: 1.1176, test_f1: 0.5826
 epoch: 15, train_loss: 0.7368, test_loss: 1.1481, test_f1: 0.5668
 epoch: 16, train_loss: 0.7499, test_loss: 1.1514, test_f1: 0.5514
 epoch: 17, train_loss: 0.7254, test_loss: 1.2331, test_f1: 0.5802
 epoch: 18, train_loss: 0.7127, test_loss: 1.2117, test_f1: 0.5869
 epoch: 19, train_loss: 0.7009, test_loss: 1.1838, test_f1: 0.5932
 epoch: 20, train_loss: 0.7055, test_loss: 1.1601, test_f1: 0.5553
 epoch: 21, train_loss: 0.6891, test_loss: 1.4162, test_f1: 0.6078
 epoch: 22, train_loss: 0.6881, test_loss: 1.1935, test_f1: 0.5725
 epoch: 23, train_loss: 0.7135, test_loss: 1.3242, test_f1: 0.5882
 epoch: 24, train_loss: 0.6503, test_loss: 1.1995, test_f1: 0.6204
 epoch: 25, train_loss: 0.6805, test_loss: 1.1842, test_f1: 0.6180
 epoch: 26, train_loss: 0.6582, test_loss: 1.1767, test_f1: 0.6198
 epoch: 27, train_loss: 0.6295, test_loss: 1.2417, test_f1: 0.6480
 epoch: 28, train_loss: 0.6413, test_loss: 1.3901, test_f1: 0.5931
 epoch: 29, train_loss: 0.6216, test_loss: 1.3422, test_f1: 0.6034
 epoch: 30, train_loss: 0.5842, test_loss: 1.3536, test_f1: 0.6070
 epoch: 31, train_loss: 0.5918, test_loss: 1.2732, test_f1: 0.6189
 epoch: 32, train_loss: 0.5657, test_loss: 1.3321, test_f1: 0.6071
 epoch: 33, train_loss: 0.5589, test_loss: 1.4057, test_f1: 0.6196
 epoch: 34, train_loss: 0.6031, test_loss: 1.4288, test_f1: 0.5941
 epoch: 35, train_loss: 0.5761, test_loss: 1.4802, test_f1: 0.6256
 epoch: 36, train_loss: 0.5173, test_loss: 1.4598, test_f1: 0.5966
 epoch: 37, train_loss: 0.5223, test_loss: 1.5833, test_f1: 0.5854
 epoch: 38, train_loss: 0.5180, test_loss: 1.6473, test_f1: 0.5915
 epoch: 39, train_loss: 0.5145, test_loss: 1.5370, test_f1: 0.6131
 epoch: 40, train_loss: 0.4993, test_loss: 1.5665, test_f1: 0.6136
 epoch: 41, train_loss: 0.4990, test_loss: 1.6871, test_f1: 0.6156
 epoch: 42, train_loss: 0.4819, test_loss: 1.5358, test_f1: 0.6258
 epoch: 43, train_loss: 0.5006, test_loss: 1.4664, test_f1: 0.6397
 epoch: 44, train_loss: 0.5065, test_loss: 1.5351, test_f1: 0.6025
 epoch: 45, train_loss: 0.5106, test_loss: 1.4292, test_f1: 0.6384
 epoch: 46, train_loss: 0.4785, test_loss: 1.5754, test_f1: 0.5832
 epoch: 47, train_loss: 0.4625, test_loss: 1.9519, test_f1: 0.6279
 epoch: 48, train_loss: 0.5114, test_loss: 1.7441, test_f1: 0.6151
 epoch: 49, train_loss: 0.4866, test_loss: 2.0543, test_f1: 0.6001
 epoch: 50, train_loss: 0.4971, test_loss: 1.7021, test_f1: 0.6150
 epoch: 51, train_loss: 0.4707, test_loss: 1.9160, test_f1: 0.6003
 epoch: 52, train_loss: 0.3981, test_loss: 1.8672, test_f1: 0.6127
 epoch: 53, train_loss: 0.3920, test_loss: 1.9708, test_f1: 0.6158
 epoch: 54, train_loss: 0.3482, test_loss: 1.8782, test_f1: 0.6113
 epoch: 55, train_loss: 0.3468, test_loss: 2.0259, test_f1: 0.6272
 epoch: 56, train_loss: 0.3573, test_loss: 2.0102, test_f1: 0.6136
 epoch: 57, train_loss: 0.3370, test_loss: 2.1879, test_f1: 0.6175
 epoch: 58, train_loss: 0.3293, test_loss: 2.1394, test_f1: 0.6216
 epoch: 59, train_loss: 0.3178, test_loss: 2.2437, test_f1: 0.6254
 epoch: 60, train_loss: 0.3456, test_loss: 2.4813, test_f1: 0.6115
 epoch: 61, train_loss: 0.3189, test_loss: 2.4089, test_f1: 0.6215
 epoch: 62, train_loss: 0.3211, test_loss: 2.3629, test_f1: 0.6191
 epoch: 63, train_loss: 0.3032, test_loss: 2.2303, test_f1: 0.5975
 epoch: 64, train_loss: 0.2983, test_loss: 2.2524, test_f1: 0.6088
 epoch: 65, train_loss: 0.3279, test_loss: 2.3141, test_f1: 0.5920
 epoch: 66, train_loss: 0.3083, test_loss: 2.1719, test_f1: 0.5902
 epoch: 67, train_loss: 0.2965, test_loss: 2.3497, test_f1: 0.5944
 epoch: 68, train_loss: 0.2895, test_loss: 2.4565, test_f1: 0.6023
 epoch: 69, train_loss: 0.3037, test_loss: 2.3494, test_f1: 0.6123
 epoch: 70, train_loss: 0.2749, test_loss: 2.2553, test_f1: 0.6373
 epoch: 71, train_loss: 0.2598, test_loss: 2.2497, test_f1: 0.6276
 epoch: 72, train_loss: 0.2566, test_loss: 2.2558, test_f1: 0.6500
 epoch: 73, train_loss: 0.2816, test_loss: 2.3864, test_f1: 0.6062
 epoch: 74, train_loss: 0.2747, test_loss: 2.3984, test_f1: 0.6292
 epoch: 75, train_loss: 0.2507, test_loss: 2.3862, test_f1: 0.6159
 epoch: 76, train_loss: 0.2407, test_loss: 2.6064, test_f1: 0.6231
 epoch: 77, train_loss: 0.2304, test_loss: 2.6671, test_f1: 0.6340
 epoch: 78, train_loss: 0.2564, test_loss: 2.4848, test_f1: 0.6015
 epoch: 79, train_loss: 0.2476, test_loss: 2.5612, test_f1: 0.5928
 epoch: 80, train_loss: 0.2349, test_loss: 2.5466, test_f1: 0.6269
 epoch: 81, train_loss: 0.2270, test_loss: 2.9721, test_f1: 0.5799
 epoch: 82, train_loss: 0.2192, test_loss: 2.8987, test_f1: 0.5942
 epoch: 83, train_loss: 0.2293, test_loss: 3.0387, test_f1: 0.6085
 epoch: 84, train_loss: 0.2500, test_loss: 3.0142, test_f1: 0.5986
 epoch: 85, train_loss: 0.2702, test_loss: 2.6449, test_f1: 0.6147
 epoch: 86, train_loss: 0.3185, test_loss: 2.9914, test_f1: 0.5855
 epoch: 87, train_loss: 0.2421, test_loss: 2.5364, test_f1: 0.6231
 epoch: 88, train_loss: 0.2585, test_loss: 2.9384, test_f1: 0.6024
 epoch: 89, train_loss: 0.2552, test_loss: 2.7542, test_f1: 0.6168
 epoch: 90, train_loss: 0.2498, test_loss: 2.9033, test_f1: 0.6045
 epoch: 91, train_loss: 0.2514, test_loss: 2.8391, test_f1: 0.5997
 epoch: 92, train_loss: 0.2358, test_loss: 2.9471, test_f1: 0.6222
 epoch: 93, train_loss: 0.2065, test_loss: 2.8787, test_f1: 0.5931
 epoch: 94, train_loss: 0.2235, test_loss: 2.8582, test_f1: 0.5907
 epoch: 95, train_loss: 0.2184, test_loss: 2.9584, test_f1: 0.5998
 epoch: 96, train_loss: 0.2179, test_loss: 3.0246, test_f1: 0.5958
 epoch: 97, train_loss: 0.1957, test_loss: 3.1144, test_f1: 0.5641
 epoch: 98, train_loss: 0.2254, test_loss: 3.0011, test_f1: 0.5821
 epoch: 99, train_loss: 0.2213, test_loss: 3.0551, test_f1: 0.5867
##################ITERATION #8 ****************************************
 epoch: 0, train_loss: 1.2603, test_loss: 1.3098, test_f1: 0.1365
 epoch: 1, train_loss: 1.0648, test_loss: 1.3260, test_f1: 0.1914
 epoch: 2, train_loss: 1.0118, test_loss: 1.1946, test_f1: 0.4195
 epoch: 3, train_loss: 0.9479, test_loss: 1.1409, test_f1: 0.4815
 epoch: 4, train_loss: 0.9305, test_loss: 1.1561, test_f1: 0.5236
 epoch: 5, train_loss: 0.8973, test_loss: 1.0739, test_f1: 0.5433
 epoch: 6, train_loss: 0.8957, test_loss: 1.0956, test_f1: 0.5026
 epoch: 7, train_loss: 0.8794, test_loss: 1.0641, test_f1: 0.5553
 epoch: 8, train_loss: 0.8573, test_loss: 1.1030, test_f1: 0.5399
 epoch: 9, train_loss: 0.8589, test_loss: 1.0283, test_f1: 0.5759
 epoch: 10, train_loss: 0.8421, test_loss: 1.1416, test_f1: 0.5511
 epoch: 11, train_loss: 0.8043, test_loss: 1.0261, test_f1: 0.5662
 epoch: 12, train_loss: 0.8317, test_loss: 1.0062, test_f1: 0.5593
 epoch: 13, train_loss: 0.7740, test_loss: 1.1652, test_f1: 0.5771
 epoch: 14, train_loss: 0.7844, test_loss: 1.0446, test_f1: 0.5641
 epoch: 15, train_loss: 0.7779, test_loss: 1.1290, test_f1: 0.5600
 epoch: 16, train_loss: 0.7537, test_loss: 1.2161, test_f1: 0.5532
 epoch: 17, train_loss: 0.7715, test_loss: 1.2008, test_f1: 0.6005
 epoch: 18, train_loss: 0.7666, test_loss: 1.2259, test_f1: 0.5401
 epoch: 19, train_loss: 0.7482, test_loss: 1.1849, test_f1: 0.5628
 epoch: 20, train_loss: 0.7267, test_loss: 1.1240, test_f1: 0.5703
 epoch: 21, train_loss: 0.7096, test_loss: 1.2222, test_f1: 0.5685
 epoch: 22, train_loss: 0.7035, test_loss: 1.1770, test_f1: 0.5998
 epoch: 23, train_loss: 0.6775, test_loss: 1.2252, test_f1: 0.5942
 epoch: 24, train_loss: 0.6648, test_loss: 1.2176, test_f1: 0.6196
 epoch: 25, train_loss: 0.6551, test_loss: 1.3589, test_f1: 0.5397
 epoch: 26, train_loss: 0.6524, test_loss: 1.3823, test_f1: 0.5558
 epoch: 27, train_loss: 0.6600, test_loss: 1.3270, test_f1: 0.5881
 epoch: 28, train_loss: 0.6262, test_loss: 1.2270, test_f1: 0.6357
 epoch: 29, train_loss: 0.6020, test_loss: 1.3159, test_f1: 0.5816
 epoch: 30, train_loss: 0.6152, test_loss: 1.5282, test_f1: 0.5655
 epoch: 31, train_loss: 0.5942, test_loss: 1.4871, test_f1: 0.5812
 epoch: 32, train_loss: 0.5750, test_loss: 1.4066, test_f1: 0.5831
 epoch: 33, train_loss: 0.5605, test_loss: 1.7662, test_f1: 0.5705
 epoch: 34, train_loss: 0.6165, test_loss: 1.4167, test_f1: 0.6005
 epoch: 35, train_loss: 0.5897, test_loss: 1.4555, test_f1: 0.6056
 epoch: 36, train_loss: 0.5851, test_loss: 1.4643, test_f1: 0.6200
 epoch: 37, train_loss: 0.5623, test_loss: 1.6116, test_f1: 0.6032
 epoch: 38, train_loss: 0.5183, test_loss: 1.4384, test_f1: 0.5924
 epoch: 39, train_loss: 0.5125, test_loss: 1.5692, test_f1: 0.6276
 epoch: 40, train_loss: 0.5015, test_loss: 1.5999, test_f1: 0.5760
 epoch: 41, train_loss: 0.5321, test_loss: 1.9658, test_f1: 0.5868
 epoch: 42, train_loss: 0.5294, test_loss: 1.5279, test_f1: 0.5948
 epoch: 43, train_loss: 0.4834, test_loss: 1.6691, test_f1: 0.5805
 epoch: 44, train_loss: 0.4968, test_loss: 1.3824, test_f1: 0.6622
 epoch: 45, train_loss: 0.4847, test_loss: 1.5901, test_f1: 0.5966
 epoch: 46, train_loss: 0.4762, test_loss: 1.6399, test_f1: 0.6163
 epoch: 47, train_loss: 0.4817, test_loss: 1.6187, test_f1: 0.5949
 epoch: 48, train_loss: 0.4491, test_loss: 1.7677, test_f1: 0.6111
 epoch: 49, train_loss: 0.4550, test_loss: 1.8164, test_f1: 0.5954
 epoch: 50, train_loss: 0.4429, test_loss: 1.9037, test_f1: 0.5912
 epoch: 51, train_loss: 0.4154, test_loss: 1.7179, test_f1: 0.6027
 epoch: 52, train_loss: 0.3690, test_loss: 1.8076, test_f1: 0.6096
 epoch: 53, train_loss: 0.3613, test_loss: 1.9199, test_f1: 0.6338
 epoch: 54, train_loss: 0.3323, test_loss: 1.8644, test_f1: 0.6156
 epoch: 55, train_loss: 0.3455, test_loss: 2.0612, test_f1: 0.6010
 epoch: 56, train_loss: 0.3491, test_loss: 2.1079, test_f1: 0.6050
 epoch: 57, train_loss: 0.3290, test_loss: 1.9786, test_f1: 0.6127
 epoch: 58, train_loss: 0.3234, test_loss: 2.1083, test_f1: 0.5968
 epoch: 59, train_loss: 0.3124, test_loss: 1.9235, test_f1: 0.6215
 epoch: 60, train_loss: 0.3435, test_loss: 2.3305, test_f1: 0.5771
 epoch: 61, train_loss: 0.3155, test_loss: 2.1588, test_f1: 0.5972
 epoch: 62, train_loss: 0.3111, test_loss: 2.2482, test_f1: 0.6121
 epoch: 63, train_loss: 0.3139, test_loss: 2.2498, test_f1: 0.5957
 epoch: 64, train_loss: 0.3170, test_loss: 2.1367, test_f1: 0.6093
 epoch: 65, train_loss: 0.3174, test_loss: 2.2983, test_f1: 0.6011
 epoch: 66, train_loss: 0.3054, test_loss: 2.2643, test_f1: 0.6001
 epoch: 67, train_loss: 0.2813, test_loss: 2.4102, test_f1: 0.6060
 epoch: 68, train_loss: 0.2886, test_loss: 2.4294, test_f1: 0.6101
 epoch: 69, train_loss: 0.2733, test_loss: 2.7997, test_f1: 0.5858
 epoch: 70, train_loss: 0.2712, test_loss: 2.4419, test_f1: 0.5961
 epoch: 71, train_loss: 0.3201, test_loss: 2.4338, test_f1: 0.5947
 epoch: 72, train_loss: 0.2716, test_loss: 2.3232, test_f1: 0.6067
 epoch: 73, train_loss: 0.2851, test_loss: 2.4345, test_f1: 0.5954
 epoch: 74, train_loss: 0.2671, test_loss: 2.7164, test_f1: 0.5836
 epoch: 75, train_loss: 0.2552, test_loss: 2.6680, test_f1: 0.5823
 epoch: 76, train_loss: 0.2354, test_loss: 2.6826, test_f1: 0.5874
 epoch: 77, train_loss: 0.2502, test_loss: 2.5912, test_f1: 0.5977
 epoch: 78, train_loss: 0.2588, test_loss: 2.4773, test_f1: 0.5970
 epoch: 79, train_loss: 0.2543, test_loss: 2.7047, test_f1: 0.5794
 epoch: 80, train_loss: 0.2460, test_loss: 2.6216, test_f1: 0.5817
 epoch: 81, train_loss: 0.2734, test_loss: 2.8926, test_f1: 0.5904
 epoch: 82, train_loss: 0.2632, test_loss: 2.6873, test_f1: 0.6129
 epoch: 83, train_loss: 0.2441, test_loss: 2.4313, test_f1: 0.6119
 epoch: 84, train_loss: 0.2637, test_loss: 2.5668, test_f1: 0.6133
 epoch: 85, train_loss: 0.3113, test_loss: 2.4001, test_f1: 0.5870
 epoch: 86, train_loss: 0.3077, test_loss: 2.3322, test_f1: 0.6012
 epoch: 87, train_loss: 0.3119, test_loss: 2.1101, test_f1: 0.6052
 epoch: 88, train_loss: 0.2703, test_loss: 2.2537, test_f1: 0.6025
 epoch: 89, train_loss: 0.2585, test_loss: 2.2331, test_f1: 0.6067
 epoch: 90, train_loss: 0.2399, test_loss: 2.4682, test_f1: 0.6233
 epoch: 91, train_loss: 0.2500, test_loss: 2.2876, test_f1: 0.6107
 epoch: 92, train_loss: 0.2335, test_loss: 2.4327, test_f1: 0.6199
 epoch: 93, train_loss: 0.2390, test_loss: 2.4882, test_f1: 0.5877
 epoch: 94, train_loss: 0.2421, test_loss: 2.6479, test_f1: 0.5903
 epoch: 95, train_loss: 0.2550, test_loss: 2.6198, test_f1: 0.6129
 epoch: 96, train_loss: 0.2211, test_loss: 2.6356, test_f1: 0.6007
 epoch: 97, train_loss: 0.2154, test_loss: 2.7489, test_f1: 0.5902
 epoch: 98, train_loss: 0.2745, test_loss: 2.8464, test_f1: 0.5681
 epoch: 99, train_loss: 0.2485, test_loss: 2.5579, test_f1: 0.5974
##################ITERATION #9 ****************************************
 epoch: 0, train_loss: 1.2523, test_loss: 1.3809, test_f1: 0.1365
 epoch: 1, train_loss: 1.0602, test_loss: 1.3462, test_f1: 0.1365
 epoch: 2, train_loss: 0.9924, test_loss: 1.2885, test_f1: 0.1658
 epoch: 3, train_loss: 0.9449, test_loss: 1.2406, test_f1: 0.2633
 epoch: 4, train_loss: 0.9154, test_loss: 1.1498, test_f1: 0.4487
 epoch: 5, train_loss: 0.8934, test_loss: 1.1859, test_f1: 0.4910
 epoch: 6, train_loss: 0.8654, test_loss: 1.1970, test_f1: 0.5349
 epoch: 7, train_loss: 0.8768, test_loss: 1.1323, test_f1: 0.5207
 epoch: 8, train_loss: 0.8698, test_loss: 1.0710, test_f1: 0.5548
 epoch: 9, train_loss: 0.8480, test_loss: 1.0666, test_f1: 0.5692
 epoch: 10, train_loss: 0.8318, test_loss: 1.1319, test_f1: 0.5413
 epoch: 11, train_loss: 0.8348, test_loss: 1.1601, test_f1: 0.5598
 epoch: 12, train_loss: 0.8172, test_loss: 0.9913, test_f1: 0.5821
 epoch: 13, train_loss: 0.8088, test_loss: 1.1208, test_f1: 0.5672
 epoch: 14, train_loss: 0.7774, test_loss: 1.0183, test_f1: 0.5682
 epoch: 15, train_loss: 0.7816, test_loss: 1.0902, test_f1: 0.5881
 epoch: 16, train_loss: 0.7500, test_loss: 1.0932, test_f1: 0.5317
 epoch: 17, train_loss: 0.7409, test_loss: 1.0839, test_f1: 0.5993
 epoch: 18, train_loss: 0.7167, test_loss: 1.1154, test_f1: 0.6328
 epoch: 19, train_loss: 0.6978, test_loss: 1.1563, test_f1: 0.6026
 epoch: 20, train_loss: 0.6948, test_loss: 1.2768, test_f1: 0.5738
 epoch: 21, train_loss: 0.7050, test_loss: 1.1997, test_f1: 0.5726
 epoch: 22, train_loss: 0.6901, test_loss: 1.1234, test_f1: 0.6127
 epoch: 23, train_loss: 0.6658, test_loss: 1.2004, test_f1: 0.6211
 epoch: 24, train_loss: 0.6812, test_loss: 1.2538, test_f1: 0.5530
 epoch: 25, train_loss: 0.6484, test_loss: 1.3139, test_f1: 0.6002
 epoch: 26, train_loss: 0.6288, test_loss: 1.3336, test_f1: 0.5728
 epoch: 27, train_loss: 0.6427, test_loss: 1.2924, test_f1: 0.5803
 epoch: 28, train_loss: 0.6745, test_loss: 1.4009, test_f1: 0.5518
 epoch: 29, train_loss: 0.6544, test_loss: 1.4205, test_f1: 0.5433
 epoch: 30, train_loss: 0.6672, test_loss: 1.3670, test_f1: 0.5630
 epoch: 31, train_loss: 0.6275, test_loss: 1.2551, test_f1: 0.5843
 epoch: 32, train_loss: 0.6147, test_loss: 1.3631, test_f1: 0.5373
 epoch: 33, train_loss: 0.5991, test_loss: 1.3880, test_f1: 0.5866
 epoch: 34, train_loss: 0.5938, test_loss: 1.3789, test_f1: 0.5819
 epoch: 35, train_loss: 0.5938, test_loss: 1.4694, test_f1: 0.5325
 epoch: 36, train_loss: 0.5606, test_loss: 1.4920, test_f1: 0.5836
 epoch: 37, train_loss: 0.5558, test_loss: 1.5821, test_f1: 0.5862
 epoch: 38, train_loss: 0.5489, test_loss: 1.6056, test_f1: 0.5694
 epoch: 39, train_loss: 0.5054, test_loss: 1.7668, test_f1: 0.5692
 epoch: 40, train_loss: 0.5108, test_loss: 1.8129, test_f1: 0.5599
 epoch: 41, train_loss: 0.5260, test_loss: 1.5997, test_f1: 0.5800
 epoch: 42, train_loss: 0.5146, test_loss: 1.7332, test_f1: 0.5749
 epoch: 43, train_loss: 0.4819, test_loss: 1.6565, test_f1: 0.5630
 epoch: 44, train_loss: 0.4588, test_loss: 1.9350, test_f1: 0.5627
 epoch: 45, train_loss: 0.4654, test_loss: 1.5952, test_f1: 0.5783
 epoch: 46, train_loss: 0.5289, test_loss: 1.7398, test_f1: 0.5736
 epoch: 47, train_loss: 0.5312, test_loss: 1.7434, test_f1: 0.5873
 epoch: 48, train_loss: 0.5187, test_loss: 1.6584, test_f1: 0.5811
 epoch: 49, train_loss: 0.5016, test_loss: 1.5488, test_f1: 0.5397
 epoch: 50, train_loss: 0.4763, test_loss: 1.5837, test_f1: 0.5902
 epoch: 51, train_loss: 0.4311, test_loss: 1.8216, test_f1: 0.5714
 epoch: 52, train_loss: 0.3999, test_loss: 1.7386, test_f1: 0.5953
 epoch: 53, train_loss: 0.3688, test_loss: 1.8517, test_f1: 0.5958
 epoch: 54, train_loss: 0.3596, test_loss: 1.7534, test_f1: 0.6120
 epoch: 55, train_loss: 0.3497, test_loss: 1.9633, test_f1: 0.5810
 epoch: 56, train_loss: 0.3382, test_loss: 1.9911, test_f1: 0.6020
 epoch: 57, train_loss: 0.3288, test_loss: 1.9366, test_f1: 0.5866
 epoch: 58, train_loss: 0.3333, test_loss: 2.0400, test_f1: 0.5883
 epoch: 59, train_loss: 0.3435, test_loss: 2.0809, test_f1: 0.5901
 epoch: 60, train_loss: 0.3726, test_loss: 2.1950, test_f1: 0.5729
 epoch: 61, train_loss: 0.3266, test_loss: 2.0214, test_f1: 0.5909
 epoch: 62, train_loss: 0.3506, test_loss: 1.9718, test_f1: 0.6016
 epoch: 63, train_loss: 0.3037, test_loss: 1.9527, test_f1: 0.6075
 epoch: 64, train_loss: 0.2924, test_loss: 2.2080, test_f1: 0.6053
 epoch: 65, train_loss: 0.3181, test_loss: 2.1755, test_f1: 0.5855
 epoch: 66, train_loss: 0.3235, test_loss: 2.0813, test_f1: 0.5995
 epoch: 67, train_loss: 0.3142, test_loss: 2.0746, test_f1: 0.5847
 epoch: 68, train_loss: 0.2850, test_loss: 2.2070, test_f1: 0.5876
 epoch: 69, train_loss: 0.2795, test_loss: 2.1967, test_f1: 0.6131
 epoch: 70, train_loss: 0.3041, test_loss: 2.2099, test_f1: 0.6087
 epoch: 71, train_loss: 0.2915, test_loss: 2.2306, test_f1: 0.5953
 epoch: 72, train_loss: 0.2819, test_loss: 2.3199, test_f1: 0.5904
 epoch: 73, train_loss: 0.2711, test_loss: 2.2551, test_f1: 0.6005
 epoch: 74, train_loss: 0.2972, test_loss: 2.4251, test_f1: 0.5838
 epoch: 75, train_loss: 0.2849, test_loss: 2.2092, test_f1: 0.6112
 epoch: 76, train_loss: 0.3158, test_loss: 2.5957, test_f1: 0.5688
 epoch: 77, train_loss: 0.3194, test_loss: 2.3699, test_f1: 0.5826
 epoch: 78, train_loss: 0.3098, test_loss: 2.3250, test_f1: 0.6052
 epoch: 79, train_loss: 0.2804, test_loss: 2.2604, test_f1: 0.5974
 epoch: 80, train_loss: 0.2645, test_loss: 2.3320, test_f1: 0.5524
 epoch: 81, train_loss: 0.2596, test_loss: 2.3085, test_f1: 0.5870
 epoch: 82, train_loss: 0.2455, test_loss: 2.4505, test_f1: 0.5874
 epoch: 83, train_loss: 0.2716, test_loss: 2.5811, test_f1: 0.5996
 epoch: 84, train_loss: 0.2879, test_loss: 2.2708, test_f1: 0.6184
 epoch: 85, train_loss: 0.2463, test_loss: 2.4448, test_f1: 0.6000
 epoch: 86, train_loss: 0.2483, test_loss: 2.6026, test_f1: 0.5844
 epoch: 87, train_loss: 0.2437, test_loss: 2.5381, test_f1: 0.5919
 epoch: 88, train_loss: 0.2324, test_loss: 2.6568, test_f1: 0.5886
 epoch: 89, train_loss: 0.2394, test_loss: 2.7089, test_f1: 0.6127
 epoch: 90, train_loss: 0.2243, test_loss: 2.5103, test_f1: 0.5833
 epoch: 91, train_loss: 0.2103, test_loss: 2.5627, test_f1: 0.6066
 epoch: 92, train_loss: 0.1964, test_loss: 2.5444, test_f1: 0.6030
 epoch: 93, train_loss: 0.1959, test_loss: 2.9987, test_f1: 0.5954
 epoch: 94, train_loss: 0.2192, test_loss: 2.8142, test_f1: 0.5781
 epoch: 95, train_loss: 0.2167, test_loss: 2.7584, test_f1: 0.5948
 epoch: 96, train_loss: 0.2520, test_loss: 2.8171, test_f1: 0.5990
 epoch: 97, train_loss: 0.2449, test_loss: 2.6521, test_f1: 0.5734
 epoch: 98, train_loss: 0.2255, test_loss: 2.7347, test_f1: 0.5936
 epoch: 99, train_loss: 0.2112, test_loss: 2.9667, test_f1: 0.5699

Training completed in 394.11 seconds
Best F1: 0.6673 at epoch 48
Mean F1 across iterations: 0.6394  0.0188
========================FINAL RESULTS================================
FEGIN weighted F1: 0.6673  0.0188
python main.py --data ltspice_demos --representation component_net --model FEGIN --layers 6 --hiddens 128 --batch_size 128 --lr 0.001 --emb_size 128 --epochs 100 --save_appendix component_net_L6_H128_BS128_LR0.001_E128 --no_val
-----



STDERR:
  File "main.py", line 370, in <module>
    main()
  File "main.py", line 254, in main
    dataset = dataset_class(
  File "/home/philip/projects/ltspice_examples_code_repo/Circuit-Completion-Using-GNNs/component_classification_with_link_prediction_head/evaluation/FEGIN/kernel/circuit_datasets.py", line 15, in __init__
    self.data, self.slices = torch.load(self.processed_paths[0])
  File "/home/philip/.local/lib/python3.8/site-packages/torch/serialization.py", line 1040, in load
    warnings.warn(
  File "/usr/lib/python3.8/warnings.py", line 109, in _showwarnmsg
    sw(msg.message, msg.category, msg.filename, msg.lineno,
  File "main.py", line 47, in warn_with_traceback
    traceback.print_stack(file=log)
/home/philip/projects/ltspice_examples_code_repo/Circuit-Completion-Using-GNNs/component_classification_with_link_prediction_head/evaluation/FEGIN/kernel/circuit_datasets.py:15: FutureWarning: You are using `torch.load` with `weights_only=False` (the current default value), which uses the default pickle module implicitly. It is possible to construct malicious pickle data which will execute arbitrary code during unpickling (See https://github.com/pytorch/pytorch/blob/main/SECURITY.md#untrusted-models for more details). In a future release, the default value for `weights_only` will be flipped to `True`. This limits the functions that could be executed during unpickling. Arbitrary objects will no longer be allowed to be loaded via this mode unless they are explicitly allowlisted by the user via `torch.serialization.add_safe_globals`. We recommend you start setting `weights_only=True` for any use case where you don't have full control of the loaded file. Please open an issue on GitHub for any issues related to this experimental feature.
  self.data, self.slices = torch.load(self.processed_paths[0])
