STDOUT:
Results will be saved in /home/philip/projects/llm_inference_code_repo/Circuit-Completion-Using-GNNs/component_classification_with_link_prediction_head/evaluation/FEGIN/results/model_FEGIN_dataset_ltspice_examples
Command line input: python main.py --data ltspice_examples --representation component_pin --model FEGIN --layers 3 --hiddens 16 --batch_size 128 --lr 0.01 --emb_size 250 --epochs 100 --save_appendix component_pin_L3_H16_BS128_LR0.01_E250 --no_val
 is saved.
-----
ltspice_examples - FEGIN
Using 3 layers, 16 hidden units, h = 2
Loading component_pin representation dataset
ENTERED
Training FEGIN on component_pin representation
Train: 3560, Test: 848
##################ITERATION #0 ****************************************
 epoch: 0, train_loss: 1.2545, test_loss: 1.1246, test_f1: 0.3740
 epoch: 1, train_loss: 1.0531, test_loss: 1.0085, test_f1: 0.3495
 epoch: 2, train_loss: 1.0114, test_loss: 0.9850, test_f1: 0.3668
 epoch: 3, train_loss: 1.0178, test_loss: 1.0204, test_f1: 0.3600
 epoch: 4, train_loss: 1.0053, test_loss: 0.9723, test_f1: 0.4508
 epoch: 5, train_loss: 0.9870, test_loss: 1.0266, test_f1: 0.4498
 epoch: 6, train_loss: 0.9794, test_loss: 1.1526, test_f1: 0.3943
 epoch: 7, train_loss: 0.9712, test_loss: 1.1215, test_f1: 0.3735
 epoch: 8, train_loss: 0.9698, test_loss: 1.0235, test_f1: 0.4684
 epoch: 9, train_loss: 0.9375, test_loss: 1.0924, test_f1: 0.3558
 epoch: 10, train_loss: 0.9280, test_loss: 0.9344, test_f1: 0.4735
 epoch: 11, train_loss: 0.9080, test_loss: 1.0595, test_f1: 0.4600
 epoch: 12, train_loss: 0.8975, test_loss: 0.8883, test_f1: 0.4988
 epoch: 13, train_loss: 0.8983, test_loss: 0.9407, test_f1: 0.5059
 epoch: 14, train_loss: 0.8722, test_loss: 0.8239, test_f1: 0.5060
 epoch: 15, train_loss: 0.8678, test_loss: 0.8768, test_f1: 0.5277
 epoch: 16, train_loss: 0.8841, test_loss: 0.8803, test_f1: 0.4845
 epoch: 17, train_loss: 0.8883, test_loss: 0.9391, test_f1: 0.5081
 epoch: 18, train_loss: 0.8671, test_loss: 0.8931, test_f1: 0.4873
 epoch: 19, train_loss: 0.8551, test_loss: 0.8668, test_f1: 0.5068
 epoch: 20, train_loss: 0.8405, test_loss: 1.0712, test_f1: 0.4742
 epoch: 21, train_loss: 0.8625, test_loss: 0.8670, test_f1: 0.5058
 epoch: 22, train_loss: 0.8498, test_loss: 0.9243, test_f1: 0.5193
 epoch: 23, train_loss: 0.8320, test_loss: 0.8398, test_f1: 0.5079
 epoch: 24, train_loss: 0.8620, test_loss: 0.8575, test_f1: 0.5149
 epoch: 25, train_loss: 0.8405, test_loss: 0.9532, test_f1: 0.4651
 epoch: 26, train_loss: 0.8465, test_loss: 1.0288, test_f1: 0.4272
 epoch: 27, train_loss: 0.8198, test_loss: 0.9310, test_f1: 0.5162
 epoch: 28, train_loss: 0.8111, test_loss: 0.8151, test_f1: 0.5292
 epoch: 29, train_loss: 0.8217, test_loss: 0.9662, test_f1: 0.5042
 epoch: 30, train_loss: 0.8193, test_loss: 0.8503, test_f1: 0.5164
 epoch: 31, train_loss: 0.7880, test_loss: 0.8952, test_f1: 0.5258
 epoch: 32, train_loss: 0.8141, test_loss: 0.9590, test_f1: 0.5253
 epoch: 33, train_loss: 0.8090, test_loss: 0.8166, test_f1: 0.5199
 epoch: 34, train_loss: 0.8091, test_loss: 0.9576, test_f1: 0.5122
 epoch: 35, train_loss: 0.7966, test_loss: 0.8218, test_f1: 0.5222
 epoch: 36, train_loss: 0.7871, test_loss: 0.8634, test_f1: 0.5272
 epoch: 37, train_loss: 0.7954, test_loss: 1.0450, test_f1: 0.4574
 epoch: 38, train_loss: 0.8077, test_loss: 0.9061, test_f1: 0.5162
 epoch: 39, train_loss: 0.7883, test_loss: 0.8817, test_f1: 0.5246
 epoch: 40, train_loss: 0.7938, test_loss: 0.8091, test_f1: 0.5500
 epoch: 41, train_loss: 0.7847, test_loss: 0.8072, test_f1: 0.5429
 epoch: 42, train_loss: 0.7711, test_loss: 0.8431, test_f1: 0.5189
 epoch: 43, train_loss: 0.7744, test_loss: 0.8673, test_f1: 0.5326
 epoch: 44, train_loss: 0.7713, test_loss: 0.9522, test_f1: 0.5187
 epoch: 45, train_loss: 0.7776, test_loss: 0.9101, test_f1: 0.5397
 epoch: 46, train_loss: 0.7835, test_loss: 0.9324, test_f1: 0.5296
 epoch: 47, train_loss: 0.7814, test_loss: 0.8787, test_f1: 0.5757
 epoch: 48, train_loss: 0.7764, test_loss: 0.9650, test_f1: 0.5221
 epoch: 49, train_loss: 0.7682, test_loss: 0.9718, test_f1: 0.5377
 epoch: 50, train_loss: 0.7625, test_loss: 0.9898, test_f1: 0.5407
 epoch: 51, train_loss: 0.7327, test_loss: 0.9140, test_f1: 0.5454
 epoch: 52, train_loss: 0.7364, test_loss: 0.9091, test_f1: 0.5357
 epoch: 53, train_loss: 0.7213, test_loss: 0.8337, test_f1: 0.5777
 epoch: 54, train_loss: 0.7214, test_loss: 0.8691, test_f1: 0.5462
 epoch: 55, train_loss: 0.7293, test_loss: 0.8702, test_f1: 0.5464
 epoch: 56, train_loss: 0.7128, test_loss: 0.8386, test_f1: 0.5556
 epoch: 57, train_loss: 0.7191, test_loss: 0.8320, test_f1: 0.5583
 epoch: 58, train_loss: 0.7088, test_loss: 0.8682, test_f1: 0.5229
 epoch: 59, train_loss: 0.7139, test_loss: 0.8518, test_f1: 0.5446
 epoch: 60, train_loss: 0.7067, test_loss: 0.8522, test_f1: 0.5486
 epoch: 61, train_loss: 0.7077, test_loss: 0.9115, test_f1: 0.5385
 epoch: 62, train_loss: 0.7032, test_loss: 0.8104, test_f1: 0.5506
 epoch: 63, train_loss: 0.7000, test_loss: 0.8654, test_f1: 0.5398
 epoch: 64, train_loss: 0.7220, test_loss: 0.7711, test_f1: 0.5417
 epoch: 65, train_loss: 0.7139, test_loss: 0.8398, test_f1: 0.5595
 epoch: 66, train_loss: 0.6961, test_loss: 0.8441, test_f1: 0.5560
 epoch: 67, train_loss: 0.6880, test_loss: 0.8242, test_f1: 0.5470
 epoch: 68, train_loss: 0.6868, test_loss: 0.9336, test_f1: 0.5083
 epoch: 69, train_loss: 0.7113, test_loss: 0.8966, test_f1: 0.5362
 epoch: 70, train_loss: 0.6848, test_loss: 0.7914, test_f1: 0.5511
 epoch: 71, train_loss: 0.6873, test_loss: 0.7978, test_f1: 0.5538
 epoch: 72, train_loss: 0.6837, test_loss: 0.8485, test_f1: 0.5537
 epoch: 73, train_loss: 0.6825, test_loss: 0.8454, test_f1: 0.5403
 epoch: 74, train_loss: 0.6918, test_loss: 0.9631, test_f1: 0.5322
 epoch: 75, train_loss: 0.6862, test_loss: 0.8395, test_f1: 0.5540
 epoch: 76, train_loss: 0.6812, test_loss: 0.9024, test_f1: 0.5410
 epoch: 77, train_loss: 0.6656, test_loss: 0.8132, test_f1: 0.5608
 epoch: 78, train_loss: 0.6809, test_loss: 0.8576, test_f1: 0.5434
 epoch: 79, train_loss: 0.6810, test_loss: 0.9640, test_f1: 0.5405
 epoch: 80, train_loss: 0.6811, test_loss: 0.7860, test_f1: 0.5485
 epoch: 81, train_loss: 0.6870, test_loss: 0.9569, test_f1: 0.5509
 epoch: 82, train_loss: 0.6760, test_loss: 0.8671, test_f1: 0.5526
 epoch: 83, train_loss: 0.6719, test_loss: 0.7766, test_f1: 0.5660
 epoch: 84, train_loss: 0.6686, test_loss: 0.9149, test_f1: 0.5457
 epoch: 85, train_loss: 0.6772, test_loss: 0.8522, test_f1: 0.5526
 epoch: 86, train_loss: 0.6665, test_loss: 0.8859, test_f1: 0.5610
 epoch: 87, train_loss: 0.6656, test_loss: 0.9406, test_f1: 0.5832
 epoch: 88, train_loss: 0.6746, test_loss: 0.9420, test_f1: 0.5357
 epoch: 89, train_loss: 0.6714, test_loss: 0.8092, test_f1: 0.5529
 epoch: 90, train_loss: 0.6736, test_loss: 0.9479, test_f1: 0.5397
 epoch: 91, train_loss: 0.6774, test_loss: 0.8856, test_f1: 0.5740
 epoch: 92, train_loss: 0.6669, test_loss: 0.9102, test_f1: 0.5620
 epoch: 93, train_loss: 0.6777, test_loss: 0.8506, test_f1: 0.5828
 epoch: 94, train_loss: 0.6736, test_loss: 0.8384, test_f1: 0.5590
 epoch: 95, train_loss: 0.6749, test_loss: 0.8456, test_f1: 0.5570
 epoch: 96, train_loss: 0.6598, test_loss: 0.8329, test_f1: 0.5492
 epoch: 97, train_loss: 0.6613, test_loss: 0.7859, test_f1: 0.5630
 epoch: 98, train_loss: 0.6645, test_loss: 0.8265, test_f1: 0.5645
 epoch: 99, train_loss: 0.6607, test_loss: 0.8189, test_f1: 0.5474
##################ITERATION #1 ****************************************
 epoch: 0, train_loss: 1.1535, test_loss: 1.2463, test_f1: 0.2643
 epoch: 1, train_loss: 1.0426, test_loss: 1.0281, test_f1: 0.3901
 epoch: 2, train_loss: 1.0038, test_loss: 0.9943, test_f1: 0.4581
 epoch: 3, train_loss: 0.9724, test_loss: 0.9395, test_f1: 0.4778
 epoch: 4, train_loss: 0.9490, test_loss: 0.9538, test_f1: 0.4931
 epoch: 5, train_loss: 0.9356, test_loss: 0.8883, test_f1: 0.5103
 epoch: 6, train_loss: 0.9139, test_loss: 0.9123, test_f1: 0.5216
 epoch: 7, train_loss: 0.9039, test_loss: 0.9534, test_f1: 0.5023
 epoch: 8, train_loss: 0.9085, test_loss: 1.0416, test_f1: 0.4193
 epoch: 9, train_loss: 0.8961, test_loss: 0.8536, test_f1: 0.5733
 epoch: 10, train_loss: 0.8835, test_loss: 0.8502, test_f1: 0.5355
 epoch: 11, train_loss: 0.8722, test_loss: 0.8068, test_f1: 0.5630
 epoch: 12, train_loss: 0.8645, test_loss: 0.8135, test_f1: 0.5730
 epoch: 13, train_loss: 0.8696, test_loss: 0.8896, test_f1: 0.5357
 epoch: 14, train_loss: 0.8498, test_loss: 0.8182, test_f1: 0.5330
 epoch: 15, train_loss: 0.8368, test_loss: 0.8865, test_f1: 0.5116
 epoch: 16, train_loss: 0.8282, test_loss: 0.8190, test_f1: 0.5277
 epoch: 17, train_loss: 0.8047, test_loss: 0.8080, test_f1: 0.5353
 epoch: 18, train_loss: 0.8228, test_loss: 0.7849, test_f1: 0.5497
 epoch: 19, train_loss: 0.8253, test_loss: 0.8567, test_f1: 0.5326
 epoch: 20, train_loss: 0.8079, test_loss: 0.8163, test_f1: 0.5847
 epoch: 21, train_loss: 0.8118, test_loss: 0.9249, test_f1: 0.5124
 epoch: 22, train_loss: 0.8148, test_loss: 0.8574, test_f1: 0.5198
 epoch: 23, train_loss: 0.8012, test_loss: 0.8833, test_f1: 0.5812
 epoch: 24, train_loss: 0.7927, test_loss: 0.8532, test_f1: 0.5419
 epoch: 25, train_loss: 0.8092, test_loss: 0.9174, test_f1: 0.5381
 epoch: 26, train_loss: 0.7893, test_loss: 0.7874, test_f1: 0.5601
 epoch: 27, train_loss: 0.7709, test_loss: 1.0068, test_f1: 0.5401
 epoch: 28, train_loss: 0.8013, test_loss: 0.8487, test_f1: 0.5705
 epoch: 29, train_loss: 0.7741, test_loss: 1.2047, test_f1: 0.4622
 epoch: 30, train_loss: 0.8027, test_loss: 0.8767, test_f1: 0.5395
 epoch: 31, train_loss: 0.7723, test_loss: 0.8526, test_f1: 0.5805
 epoch: 32, train_loss: 0.7578, test_loss: 0.9104, test_f1: 0.5456
 epoch: 33, train_loss: 0.7613, test_loss: 0.8495, test_f1: 0.5819
 epoch: 34, train_loss: 0.7710, test_loss: 0.8945, test_f1: 0.5675
 epoch: 35, train_loss: 0.7754, test_loss: 0.9401, test_f1: 0.5251
 epoch: 36, train_loss: 0.7575, test_loss: 0.9040, test_f1: 0.5580
 epoch: 37, train_loss: 0.7595, test_loss: 0.8614, test_f1: 0.5437
 epoch: 38, train_loss: 0.7573, test_loss: 0.8250, test_f1: 0.5826
 epoch: 39, train_loss: 0.7470, test_loss: 0.8744, test_f1: 0.5746
 epoch: 40, train_loss: 0.7477, test_loss: 0.8424, test_f1: 0.5841
 epoch: 41, train_loss: 0.7540, test_loss: 0.8873, test_f1: 0.5563
 epoch: 42, train_loss: 0.7404, test_loss: 0.8796, test_f1: 0.5730
 epoch: 43, train_loss: 0.7567, test_loss: 0.9039, test_f1: 0.5588
 epoch: 44, train_loss: 0.7307, test_loss: 0.8516, test_f1: 0.5774
 epoch: 45, train_loss: 0.7357, test_loss: 0.9106, test_f1: 0.5140
 epoch: 46, train_loss: 0.7595, test_loss: 0.9416, test_f1: 0.5392
 epoch: 47, train_loss: 0.7500, test_loss: 0.8414, test_f1: 0.5773
 epoch: 48, train_loss: 0.7385, test_loss: 0.8469, test_f1: 0.5961
 epoch: 49, train_loss: 0.7254, test_loss: 0.8736, test_f1: 0.5687
 epoch: 50, train_loss: 0.7393, test_loss: 1.2579, test_f1: 0.5226
 epoch: 51, train_loss: 0.7117, test_loss: 0.8759, test_f1: 0.5759
 epoch: 52, train_loss: 0.7107, test_loss: 0.8226, test_f1: 0.5792
 epoch: 53, train_loss: 0.6911, test_loss: 0.8411, test_f1: 0.5914
 epoch: 54, train_loss: 0.6851, test_loss: 0.8267, test_f1: 0.6064
 epoch: 55, train_loss: 0.6912, test_loss: 0.9072, test_f1: 0.5835
 epoch: 56, train_loss: 0.7019, test_loss: 0.8247, test_f1: 0.5942
 epoch: 57, train_loss: 0.6926, test_loss: 0.8634, test_f1: 0.5717
 epoch: 58, train_loss: 0.6774, test_loss: 0.8998, test_f1: 0.6087
 epoch: 59, train_loss: 0.6766, test_loss: 0.7958, test_f1: 0.6135
 epoch: 60, train_loss: 0.6673, test_loss: 0.9132, test_f1: 0.5930
 epoch: 61, train_loss: 0.6817, test_loss: 0.8650, test_f1: 0.5706
 epoch: 62, train_loss: 0.6772, test_loss: 0.8590, test_f1: 0.5971
 epoch: 63, train_loss: 0.6839, test_loss: 0.8273, test_f1: 0.5875
 epoch: 64, train_loss: 0.6681, test_loss: 0.8330, test_f1: 0.5821
 epoch: 65, train_loss: 0.6790, test_loss: 0.8320, test_f1: 0.5901
 epoch: 66, train_loss: 0.6787, test_loss: 0.8215, test_f1: 0.5887
 epoch: 67, train_loss: 0.6705, test_loss: 0.9150, test_f1: 0.5749
 epoch: 68, train_loss: 0.6706, test_loss: 0.7840, test_f1: 0.6097
 epoch: 69, train_loss: 0.6598, test_loss: 0.8193, test_f1: 0.5900
 epoch: 70, train_loss: 0.6688, test_loss: 0.8483, test_f1: 0.5892
 epoch: 71, train_loss: 0.6520, test_loss: 0.8215, test_f1: 0.6067
 epoch: 72, train_loss: 0.6677, test_loss: 0.8142, test_f1: 0.5814
 epoch: 73, train_loss: 0.6611, test_loss: 0.9019, test_f1: 0.5723
 epoch: 74, train_loss: 0.6480, test_loss: 0.7965, test_f1: 0.5953
 epoch: 75, train_loss: 0.6797, test_loss: 0.8041, test_f1: 0.6004
 epoch: 76, train_loss: 0.6679, test_loss: 0.8373, test_f1: 0.5895
 epoch: 77, train_loss: 0.6548, test_loss: 0.8096, test_f1: 0.6172
 epoch: 78, train_loss: 0.6515, test_loss: 0.8308, test_f1: 0.5981
 epoch: 79, train_loss: 0.6550, test_loss: 0.8085, test_f1: 0.5917
 epoch: 80, train_loss: 0.6603, test_loss: 0.7989, test_f1: 0.6112
 epoch: 81, train_loss: 0.6542, test_loss: 0.7886, test_f1: 0.5971
 epoch: 82, train_loss: 0.6496, test_loss: 0.8095, test_f1: 0.5902
 epoch: 83, train_loss: 0.6417, test_loss: 0.7951, test_f1: 0.6182
 epoch: 84, train_loss: 0.6397, test_loss: 0.8086, test_f1: 0.5920
 epoch: 85, train_loss: 0.6401, test_loss: 0.8167, test_f1: 0.6041
 epoch: 86, train_loss: 0.6528, test_loss: 0.8184, test_f1: 0.6058
 epoch: 87, train_loss: 0.6381, test_loss: 0.7994, test_f1: 0.6225
 epoch: 88, train_loss: 0.6530, test_loss: 0.8634, test_f1: 0.6119
 epoch: 89, train_loss: 0.6513, test_loss: 0.7935, test_f1: 0.6183
 epoch: 90, train_loss: 0.6519, test_loss: 0.8314, test_f1: 0.5905
 epoch: 91, train_loss: 0.6489, test_loss: 0.7450, test_f1: 0.6417
 epoch: 92, train_loss: 0.6462, test_loss: 0.9751, test_f1: 0.5778
 epoch: 93, train_loss: 0.6450, test_loss: 0.9010, test_f1: 0.5723
 epoch: 94, train_loss: 0.6299, test_loss: 0.8149, test_f1: 0.5997
 epoch: 95, train_loss: 0.6434, test_loss: 0.8209, test_f1: 0.6023
 epoch: 96, train_loss: 0.6384, test_loss: 0.8389, test_f1: 0.6093
 epoch: 97, train_loss: 0.6336, test_loss: 0.8608, test_f1: 0.5838
 epoch: 98, train_loss: 0.6381, test_loss: 0.7785, test_f1: 0.6204
 epoch: 99, train_loss: 0.6384, test_loss: 0.8710, test_f1: 0.5877
##################ITERATION #2 ****************************************
 epoch: 0, train_loss: 1.1965, test_loss: 1.2912, test_f1: 0.2567
 epoch: 1, train_loss: 1.0277, test_loss: 1.0654, test_f1: 0.3669
 epoch: 2, train_loss: 0.9984, test_loss: 1.0203, test_f1: 0.4675
 epoch: 3, train_loss: 0.9704, test_loss: 0.9477, test_f1: 0.4632
 epoch: 4, train_loss: 0.9474, test_loss: 0.9142, test_f1: 0.5160
 epoch: 5, train_loss: 0.9358, test_loss: 1.1213, test_f1: 0.4277
 epoch: 6, train_loss: 0.9084, test_loss: 0.9159, test_f1: 0.5066
 epoch: 7, train_loss: 0.9107, test_loss: 0.9628, test_f1: 0.5119
 epoch: 8, train_loss: 0.9024, test_loss: 0.8806, test_f1: 0.4982
 epoch: 9, train_loss: 0.9125, test_loss: 0.8936, test_f1: 0.5307
 epoch: 10, train_loss: 0.8822, test_loss: 0.9509, test_f1: 0.5149
 epoch: 11, train_loss: 0.8802, test_loss: 0.8538, test_f1: 0.5425
 epoch: 12, train_loss: 0.8664, test_loss: 0.9340, test_f1: 0.4876
 epoch: 13, train_loss: 0.8686, test_loss: 0.8776, test_f1: 0.5299
 epoch: 14, train_loss: 0.8855, test_loss: 0.8665, test_f1: 0.5348
 epoch: 15, train_loss: 0.8635, test_loss: 1.4299, test_f1: 0.3435
 epoch: 16, train_loss: 0.8411, test_loss: 0.8662, test_f1: 0.5051
 epoch: 17, train_loss: 0.8442, test_loss: 0.9534, test_f1: 0.5078
 epoch: 18, train_loss: 0.8272, test_loss: 1.0124, test_f1: 0.4748
 epoch: 19, train_loss: 0.8478, test_loss: 0.8641, test_f1: 0.5427
 epoch: 20, train_loss: 0.8365, test_loss: 0.9496, test_f1: 0.5283
 epoch: 21, train_loss: 0.8337, test_loss: 0.9630, test_f1: 0.5174
 epoch: 22, train_loss: 0.8305, test_loss: 0.8333, test_f1: 0.5495
 epoch: 23, train_loss: 0.8076, test_loss: 0.8663, test_f1: 0.5479
 epoch: 24, train_loss: 0.8017, test_loss: 1.0205, test_f1: 0.4960
 epoch: 25, train_loss: 0.8233, test_loss: 0.8653, test_f1: 0.5417
 epoch: 26, train_loss: 0.8093, test_loss: 1.0269, test_f1: 0.4668
 epoch: 27, train_loss: 0.8091, test_loss: 0.8562, test_f1: 0.5321
 epoch: 28, train_loss: 0.8016, test_loss: 0.8584, test_f1: 0.5275
 epoch: 29, train_loss: 0.7904, test_loss: 0.9741, test_f1: 0.5407
 epoch: 30, train_loss: 0.7860, test_loss: 0.8433, test_f1: 0.5652
 epoch: 31, train_loss: 0.7829, test_loss: 0.8616, test_f1: 0.5086
 epoch: 32, train_loss: 0.8073, test_loss: 0.8153, test_f1: 0.5522
 epoch: 33, train_loss: 0.7793, test_loss: 0.9266, test_f1: 0.5413
 epoch: 34, train_loss: 0.7975, test_loss: 0.9722, test_f1: 0.5376
 epoch: 35, train_loss: 0.7884, test_loss: 0.8477, test_f1: 0.5269
 epoch: 36, train_loss: 0.7960, test_loss: 0.8940, test_f1: 0.5174
 epoch: 37, train_loss: 0.7738, test_loss: 0.9474, test_f1: 0.5337
 epoch: 38, train_loss: 0.7784, test_loss: 0.8707, test_f1: 0.5313
 epoch: 39, train_loss: 0.7873, test_loss: 0.9143, test_f1: 0.5217
 epoch: 40, train_loss: 0.7635, test_loss: 1.0478, test_f1: 0.5425
 epoch: 41, train_loss: 0.7740, test_loss: 0.8231, test_f1: 0.5587
 epoch: 42, train_loss: 0.7652, test_loss: 0.9033, test_f1: 0.5677
 epoch: 43, train_loss: 0.7563, test_loss: 0.8297, test_f1: 0.5273
 epoch: 44, train_loss: 0.7408, test_loss: 0.7720, test_f1: 0.5631
 epoch: 45, train_loss: 0.7647, test_loss: 0.8552, test_f1: 0.5536
 epoch: 46, train_loss: 0.7401, test_loss: 0.8843, test_f1: 0.5621
 epoch: 47, train_loss: 0.7363, test_loss: 0.9726, test_f1: 0.5000
 epoch: 48, train_loss: 0.7475, test_loss: 0.8003, test_f1: 0.5654
 epoch: 49, train_loss: 0.7404, test_loss: 0.9389, test_f1: 0.5369
 epoch: 50, train_loss: 0.7498, test_loss: 1.0460, test_f1: 0.5139
 epoch: 51, train_loss: 0.7363, test_loss: 0.7339, test_f1: 0.5833
 epoch: 52, train_loss: 0.7327, test_loss: 0.9714, test_f1: 0.5361
 epoch: 53, train_loss: 0.7113, test_loss: 0.8176, test_f1: 0.5586
 epoch: 54, train_loss: 0.7091, test_loss: 0.7460, test_f1: 0.5753
 epoch: 55, train_loss: 0.7232, test_loss: 0.8575, test_f1: 0.5315
 epoch: 56, train_loss: 0.7125, test_loss: 0.8739, test_f1: 0.5799
 epoch: 57, train_loss: 0.7064, test_loss: 0.9354, test_f1: 0.5560
 epoch: 58, train_loss: 0.6991, test_loss: 0.8513, test_f1: 0.5569
 epoch: 59, train_loss: 0.7054, test_loss: 0.8956, test_f1: 0.5530
 epoch: 60, train_loss: 0.7058, test_loss: 0.8674, test_f1: 0.5620
 epoch: 61, train_loss: 0.6986, test_loss: 0.9135, test_f1: 0.5611
 epoch: 62, train_loss: 0.7071, test_loss: 0.8603, test_f1: 0.5671
 epoch: 63, train_loss: 0.7038, test_loss: 0.9328, test_f1: 0.5576
 epoch: 64, train_loss: 0.7084, test_loss: 0.8297, test_f1: 0.5469
 epoch: 65, train_loss: 0.7085, test_loss: 0.9611, test_f1: 0.5385
 epoch: 66, train_loss: 0.7019, test_loss: 0.9742, test_f1: 0.5566
 epoch: 67, train_loss: 0.6985, test_loss: 0.8286, test_f1: 0.5704
 epoch: 68, train_loss: 0.6811, test_loss: 0.8347, test_f1: 0.5819
 epoch: 69, train_loss: 0.6817, test_loss: 0.8688, test_f1: 0.5749
 epoch: 70, train_loss: 0.6879, test_loss: 0.9369, test_f1: 0.5636
 epoch: 71, train_loss: 0.6953, test_loss: 0.9159, test_f1: 0.5640
 epoch: 72, train_loss: 0.6957, test_loss: 0.8201, test_f1: 0.5623
 epoch: 73, train_loss: 0.6647, test_loss: 0.8312, test_f1: 0.5601
 epoch: 74, train_loss: 0.6824, test_loss: 0.8852, test_f1: 0.5451
 epoch: 75, train_loss: 0.6825, test_loss: 0.8512, test_f1: 0.5692
 epoch: 76, train_loss: 0.6976, test_loss: 0.9317, test_f1: 0.5505
 epoch: 77, train_loss: 0.6922, test_loss: 0.8841, test_f1: 0.5737
 epoch: 78, train_loss: 0.6722, test_loss: 0.8909, test_f1: 0.5383
 epoch: 79, train_loss: 0.6951, test_loss: 0.7814, test_f1: 0.5836
 epoch: 80, train_loss: 0.6810, test_loss: 0.8332, test_f1: 0.5863
 epoch: 81, train_loss: 0.6798, test_loss: 0.9187, test_f1: 0.5560
 epoch: 82, train_loss: 0.6699, test_loss: 0.8066, test_f1: 0.5614
 epoch: 83, train_loss: 0.6782, test_loss: 0.8839, test_f1: 0.5737
 epoch: 84, train_loss: 0.6694, test_loss: 0.8247, test_f1: 0.5677
 epoch: 85, train_loss: 0.6790, test_loss: 0.8550, test_f1: 0.5585
 epoch: 86, train_loss: 0.6623, test_loss: 0.9608, test_f1: 0.5524
 epoch: 87, train_loss: 0.6841, test_loss: 0.7592, test_f1: 0.5682
 epoch: 88, train_loss: 0.6800, test_loss: 0.8388, test_f1: 0.5755
 epoch: 89, train_loss: 0.6691, test_loss: 0.8832, test_f1: 0.5687
 epoch: 90, train_loss: 0.6799, test_loss: 0.8458, test_f1: 0.5828
 epoch: 91, train_loss: 0.6943, test_loss: 0.9751, test_f1: 0.6070
 epoch: 92, train_loss: 0.6680, test_loss: 0.8549, test_f1: 0.5756
 epoch: 93, train_loss: 0.6790, test_loss: 0.9624, test_f1: 0.5545
 epoch: 94, train_loss: 0.6805, test_loss: 0.7934, test_f1: 0.5824
 epoch: 95, train_loss: 0.6649, test_loss: 0.9406, test_f1: 0.5499
 epoch: 96, train_loss: 0.6664, test_loss: 0.8835, test_f1: 0.5735
 epoch: 97, train_loss: 0.6656, test_loss: 0.8724, test_f1: 0.5591
 epoch: 98, train_loss: 0.6692, test_loss: 0.8993, test_f1: 0.5667
 epoch: 99, train_loss: 0.6500, test_loss: 0.8176, test_f1: 0.5720
##################ITERATION #3 ****************************************
 epoch: 0, train_loss: 1.1474, test_loss: 1.0630, test_f1: 0.3675
 epoch: 1, train_loss: 1.0031, test_loss: 1.0128, test_f1: 0.4425
 epoch: 2, train_loss: 0.9895, test_loss: 1.1544, test_f1: 0.4188
 epoch: 3, train_loss: 0.9704, test_loss: 1.0044, test_f1: 0.4730
 epoch: 4, train_loss: 0.9519, test_loss: 0.9688, test_f1: 0.4959
 epoch: 5, train_loss: 0.9473, test_loss: 1.0614, test_f1: 0.4380
 epoch: 6, train_loss: 0.9536, test_loss: 0.9584, test_f1: 0.4731
 epoch: 7, train_loss: 0.9244, test_loss: 1.0227, test_f1: 0.4811
 epoch: 8, train_loss: 0.9104, test_loss: 0.9112, test_f1: 0.5009
 epoch: 9, train_loss: 0.9013, test_loss: 0.9289, test_f1: 0.4906
 epoch: 10, train_loss: 0.8969, test_loss: 0.9121, test_f1: 0.4951
 epoch: 11, train_loss: 0.9053, test_loss: 0.9130, test_f1: 0.4982
 epoch: 12, train_loss: 0.8918, test_loss: 0.8768, test_f1: 0.5245
 epoch: 13, train_loss: 0.8803, test_loss: 1.0863, test_f1: 0.4600
 epoch: 14, train_loss: 0.8703, test_loss: 0.9968, test_f1: 0.4681
 epoch: 15, train_loss: 0.8690, test_loss: 0.9357, test_f1: 0.5008
 epoch: 16, train_loss: 0.8572, test_loss: 0.8811, test_f1: 0.5298
 epoch: 17, train_loss: 0.8424, test_loss: 0.8696, test_f1: 0.5437
 epoch: 18, train_loss: 0.8630, test_loss: 0.8675, test_f1: 0.5514
 epoch: 19, train_loss: 0.8335, test_loss: 0.8694, test_f1: 0.5620
 epoch: 20, train_loss: 0.8381, test_loss: 1.1299, test_f1: 0.4243
 epoch: 21, train_loss: 0.8406, test_loss: 0.8911, test_f1: 0.5131
 epoch: 22, train_loss: 0.8383, test_loss: 0.8936, test_f1: 0.5356
 epoch: 23, train_loss: 0.8349, test_loss: 1.0252, test_f1: 0.5324
 epoch: 24, train_loss: 0.8269, test_loss: 0.9156, test_f1: 0.5642
 epoch: 25, train_loss: 0.8251, test_loss: 0.8923, test_f1: 0.5184
 epoch: 26, train_loss: 0.8126, test_loss: 0.8279, test_f1: 0.5347
 epoch: 27, train_loss: 0.8071, test_loss: 0.8436, test_f1: 0.5308
 epoch: 28, train_loss: 0.8154, test_loss: 0.8493, test_f1: 0.5497
 epoch: 29, train_loss: 0.8205, test_loss: 0.8426, test_f1: 0.5430
 epoch: 30, train_loss: 0.8021, test_loss: 0.8331, test_f1: 0.5362
 epoch: 31, train_loss: 0.7910, test_loss: 0.8937, test_f1: 0.5688
 epoch: 32, train_loss: 0.7771, test_loss: 0.8971, test_f1: 0.5215
 epoch: 33, train_loss: 0.7807, test_loss: 0.9323, test_f1: 0.5248
 epoch: 34, train_loss: 0.7927, test_loss: 0.8455, test_f1: 0.5437
 epoch: 35, train_loss: 0.7778, test_loss: 0.8786, test_f1: 0.5492
 epoch: 36, train_loss: 0.7617, test_loss: 0.8388, test_f1: 0.5582
 epoch: 37, train_loss: 0.7701, test_loss: 0.8593, test_f1: 0.5577
 epoch: 38, train_loss: 0.7795, test_loss: 0.8740, test_f1: 0.5804
 epoch: 39, train_loss: 0.7606, test_loss: 0.8746, test_f1: 0.5375
 epoch: 40, train_loss: 0.7521, test_loss: 0.8488, test_f1: 0.5587
 epoch: 41, train_loss: 0.7783, test_loss: 0.8882, test_f1: 0.5690
 epoch: 42, train_loss: 0.7728, test_loss: 0.8430, test_f1: 0.5486
 epoch: 43, train_loss: 0.7556, test_loss: 0.8699, test_f1: 0.5547
 epoch: 44, train_loss: 0.7481, test_loss: 0.9361, test_f1: 0.5127
 epoch: 45, train_loss: 0.7583, test_loss: 0.8630, test_f1: 0.5530
 epoch: 46, train_loss: 0.7639, test_loss: 0.8621, test_f1: 0.5959
 epoch: 47, train_loss: 0.7468, test_loss: 0.9197, test_f1: 0.5786
 epoch: 48, train_loss: 0.7426, test_loss: 0.8181, test_f1: 0.5818
 epoch: 49, train_loss: 0.7597, test_loss: 0.9023, test_f1: 0.5657
 epoch: 50, train_loss: 0.7450, test_loss: 0.9350, test_f1: 0.5224
 epoch: 51, train_loss: 0.7270, test_loss: 0.8058, test_f1: 0.5670
 epoch: 52, train_loss: 0.7124, test_loss: 0.8461, test_f1: 0.5523
 epoch: 53, train_loss: 0.7196, test_loss: 0.8139, test_f1: 0.5709
 epoch: 54, train_loss: 0.7188, test_loss: 0.8415, test_f1: 0.5544
 epoch: 55, train_loss: 0.7039, test_loss: 0.9537, test_f1: 0.5722
 epoch: 56, train_loss: 0.6922, test_loss: 0.8513, test_f1: 0.5814
 epoch: 57, train_loss: 0.7013, test_loss: 0.9940, test_f1: 0.5437
 epoch: 58, train_loss: 0.7113, test_loss: 0.8499, test_f1: 0.5703
 epoch: 59, train_loss: 0.6996, test_loss: 0.8197, test_f1: 0.5906
 epoch: 60, train_loss: 0.6864, test_loss: 0.8365, test_f1: 0.6117
 epoch: 61, train_loss: 0.6812, test_loss: 0.7939, test_f1: 0.6063
 epoch: 62, train_loss: 0.6832, test_loss: 0.8348, test_f1: 0.6155
 epoch: 63, train_loss: 0.6862, test_loss: 0.8643, test_f1: 0.5765
 epoch: 64, train_loss: 0.6966, test_loss: 0.8486, test_f1: 0.5965
 epoch: 65, train_loss: 0.7015, test_loss: 0.8407, test_f1: 0.5925
 epoch: 66, train_loss: 0.6865, test_loss: 0.8561, test_f1: 0.6020
 epoch: 67, train_loss: 0.6745, test_loss: 0.8567, test_f1: 0.6228
 epoch: 68, train_loss: 0.6874, test_loss: 0.8529, test_f1: 0.6056
 epoch: 69, train_loss: 0.6945, test_loss: 0.8496, test_f1: 0.6066
 epoch: 70, train_loss: 0.6783, test_loss: 0.8293, test_f1: 0.5939
 epoch: 71, train_loss: 0.6653, test_loss: 0.8799, test_f1: 0.5642
 epoch: 72, train_loss: 0.6831, test_loss: 0.8434, test_f1: 0.5998
 epoch: 73, train_loss: 0.6744, test_loss: 0.8509, test_f1: 0.5985
 epoch: 74, train_loss: 0.6552, test_loss: 0.9005, test_f1: 0.6278
 epoch: 75, train_loss: 0.6967, test_loss: 0.8554, test_f1: 0.6054
 epoch: 76, train_loss: 0.6905, test_loss: 0.9988, test_f1: 0.5837
 epoch: 77, train_loss: 0.6678, test_loss: 0.9008, test_f1: 0.6158
 epoch: 78, train_loss: 0.6754, test_loss: 0.8143, test_f1: 0.6136
 epoch: 79, train_loss: 0.6672, test_loss: 0.8728, test_f1: 0.6261
 epoch: 80, train_loss: 0.6677, test_loss: 0.7999, test_f1: 0.6285
 epoch: 81, train_loss: 0.6496, test_loss: 0.9594, test_f1: 0.5589
 epoch: 82, train_loss: 0.6589, test_loss: 0.8735, test_f1: 0.5967
 epoch: 83, train_loss: 0.6477, test_loss: 0.8164, test_f1: 0.6358
 epoch: 84, train_loss: 0.6687, test_loss: 0.8487, test_f1: 0.6057
 epoch: 85, train_loss: 0.6688, test_loss: 0.8132, test_f1: 0.6290
 epoch: 86, train_loss: 0.6557, test_loss: 0.8537, test_f1: 0.6297
 epoch: 87, train_loss: 0.6642, test_loss: 0.8334, test_f1: 0.6292
 epoch: 88, train_loss: 0.6371, test_loss: 0.8398, test_f1: 0.6137
 epoch: 89, train_loss: 0.6559, test_loss: 0.9866, test_f1: 0.5731
 epoch: 90, train_loss: 0.6582, test_loss: 0.9121, test_f1: 0.6091
 epoch: 91, train_loss: 0.6513, test_loss: 0.8807, test_f1: 0.5844
 epoch: 92, train_loss: 0.6348, test_loss: 0.8370, test_f1: 0.6309
 epoch: 93, train_loss: 0.6540, test_loss: 0.7962, test_f1: 0.6525
 epoch: 94, train_loss: 0.6638, test_loss: 0.8485, test_f1: 0.6142
 epoch: 95, train_loss: 0.6328, test_loss: 0.8315, test_f1: 0.6073
 epoch: 96, train_loss: 0.6473, test_loss: 0.8393, test_f1: 0.5987
 epoch: 97, train_loss: 0.6433, test_loss: 0.7752, test_f1: 0.6415
 epoch: 98, train_loss: 0.6417, test_loss: 0.9342, test_f1: 0.5948
 epoch: 99, train_loss: 0.6538, test_loss: 0.8367, test_f1: 0.6082
##################ITERATION #4 ****************************************
 epoch: 0, train_loss: 1.1630, test_loss: 1.2609, test_f1: 0.2700
 epoch: 1, train_loss: 1.0517, test_loss: 1.0612, test_f1: 0.4848
 epoch: 2, train_loss: 1.0120, test_loss: 1.0734, test_f1: 0.4731
 epoch: 3, train_loss: 0.9974, test_loss: 1.0548, test_f1: 0.4709
 epoch: 4, train_loss: 0.9931, test_loss: 1.0139, test_f1: 0.4794
 epoch: 5, train_loss: 0.9864, test_loss: 0.9800, test_f1: 0.5061
 epoch: 6, train_loss: 0.9673, test_loss: 0.9629, test_f1: 0.4662
 epoch: 7, train_loss: 0.9435, test_loss: 1.0212, test_f1: 0.4533
 epoch: 8, train_loss: 0.9310, test_loss: 0.9956, test_f1: 0.4697
 epoch: 9, train_loss: 0.9197, test_loss: 1.1578, test_f1: 0.4074
 epoch: 10, train_loss: 0.9232, test_loss: 0.9392, test_f1: 0.5109
 epoch: 11, train_loss: 0.9099, test_loss: 1.2178, test_f1: 0.4371
 epoch: 12, train_loss: 0.9036, test_loss: 1.0414, test_f1: 0.5022
 epoch: 13, train_loss: 0.8763, test_loss: 0.9078, test_f1: 0.5415
 epoch: 14, train_loss: 0.8688, test_loss: 1.0381, test_f1: 0.4655
 epoch: 15, train_loss: 0.9042, test_loss: 0.9633, test_f1: 0.5073
 epoch: 16, train_loss: 0.8767, test_loss: 0.9440, test_f1: 0.4819
 epoch: 17, train_loss: 0.8867, test_loss: 0.9469, test_f1: 0.5238
 epoch: 18, train_loss: 0.8795, test_loss: 0.9542, test_f1: 0.5272
 epoch: 19, train_loss: 0.8595, test_loss: 1.2031, test_f1: 0.4258
 epoch: 20, train_loss: 0.8530, test_loss: 0.8839, test_f1: 0.5518
 epoch: 21, train_loss: 0.8704, test_loss: 0.9336, test_f1: 0.5123
 epoch: 22, train_loss: 0.8479, test_loss: 0.8962, test_f1: 0.5598
 epoch: 23, train_loss: 0.8355, test_loss: 0.8998, test_f1: 0.5578
 epoch: 24, train_loss: 0.8353, test_loss: 0.8816, test_f1: 0.5456
 epoch: 25, train_loss: 0.8438, test_loss: 0.9343, test_f1: 0.5078
 epoch: 26, train_loss: 0.8304, test_loss: 0.9293, test_f1: 0.5795
 epoch: 27, train_loss: 0.8352, test_loss: 0.8749, test_f1: 0.5309
 epoch: 28, train_loss: 0.8216, test_loss: 0.8294, test_f1: 0.5693
 epoch: 29, train_loss: 0.8291, test_loss: 0.9097, test_f1: 0.5404
 epoch: 30, train_loss: 0.8200, test_loss: 0.9124, test_f1: 0.5381
 epoch: 31, train_loss: 0.8091, test_loss: 0.8785, test_f1: 0.5380
 epoch: 32, train_loss: 0.7966, test_loss: 0.8824, test_f1: 0.5619
 epoch: 33, train_loss: 0.8042, test_loss: 0.8798, test_f1: 0.5375
 epoch: 34, train_loss: 0.8042, test_loss: 0.9510, test_f1: 0.5443
 epoch: 35, train_loss: 0.8048, test_loss: 0.8967, test_f1: 0.5569
 epoch: 36, train_loss: 0.8084, test_loss: 1.0288, test_f1: 0.4776
 epoch: 37, train_loss: 0.7848, test_loss: 0.9054, test_f1: 0.5477
 epoch: 38, train_loss: 0.7827, test_loss: 0.8635, test_f1: 0.5427
 epoch: 39, train_loss: 0.7789, test_loss: 0.8768, test_f1: 0.5288
 epoch: 40, train_loss: 0.7785, test_loss: 0.9823, test_f1: 0.5532
 epoch: 41, train_loss: 0.7957, test_loss: 0.9229, test_f1: 0.5579
 epoch: 42, train_loss: 0.7808, test_loss: 0.9003, test_f1: 0.6116
 epoch: 43, train_loss: 0.7814, test_loss: 0.8950, test_f1: 0.5181
 epoch: 44, train_loss: 0.7794, test_loss: 0.9551, test_f1: 0.5293
 epoch: 45, train_loss: 0.7790, test_loss: 0.8884, test_f1: 0.5621
 epoch: 46, train_loss: 0.7579, test_loss: 0.8895, test_f1: 0.5536
 epoch: 47, train_loss: 0.7750, test_loss: 0.9279, test_f1: 0.5442
 epoch: 48, train_loss: 0.7768, test_loss: 0.9389, test_f1: 0.5453
 epoch: 49, train_loss: 0.7656, test_loss: 0.8961, test_f1: 0.5633
 epoch: 50, train_loss: 0.7601, test_loss: 0.9722, test_f1: 0.5737
 epoch: 51, train_loss: 0.7394, test_loss: 0.9141, test_f1: 0.5528
 epoch: 52, train_loss: 0.7364, test_loss: 0.9083, test_f1: 0.5579
 epoch: 53, train_loss: 0.7328, test_loss: 0.9303, test_f1: 0.5578
 epoch: 54, train_loss: 0.7290, test_loss: 0.9124, test_f1: 0.5843
 epoch: 55, train_loss: 0.7516, test_loss: 0.9174, test_f1: 0.5747
 epoch: 56, train_loss: 0.7305, test_loss: 0.9078, test_f1: 0.5724
 epoch: 57, train_loss: 0.7205, test_loss: 0.8784, test_f1: 0.5883
 epoch: 58, train_loss: 0.7290, test_loss: 0.9022, test_f1: 0.5684
 epoch: 59, train_loss: 0.7252, test_loss: 0.9250, test_f1: 0.5860
 epoch: 60, train_loss: 0.7254, test_loss: 0.9030, test_f1: 0.5610
 epoch: 61, train_loss: 0.7086, test_loss: 0.9215, test_f1: 0.5590
 epoch: 62, train_loss: 0.7269, test_loss: 0.9425, test_f1: 0.5898
 epoch: 63, train_loss: 0.7282, test_loss: 0.9446, test_f1: 0.6175
 epoch: 64, train_loss: 0.7196, test_loss: 0.9433, test_f1: 0.5567
 epoch: 65, train_loss: 0.7235, test_loss: 0.9250, test_f1: 0.5926
 epoch: 66, train_loss: 0.7177, test_loss: 0.9520, test_f1: 0.5554
 epoch: 67, train_loss: 0.7160, test_loss: 0.9056, test_f1: 0.5629
 epoch: 68, train_loss: 0.7076, test_loss: 0.9508, test_f1: 0.5779
 epoch: 69, train_loss: 0.7089, test_loss: 0.9231, test_f1: 0.5927
 epoch: 70, train_loss: 0.7074, test_loss: 0.9005, test_f1: 0.5873
 epoch: 71, train_loss: 0.7108, test_loss: 0.9160, test_f1: 0.5852
 epoch: 72, train_loss: 0.6948, test_loss: 0.9043, test_f1: 0.5895
 epoch: 73, train_loss: 0.6978, test_loss: 0.9936, test_f1: 0.5709
 epoch: 74, train_loss: 0.6862, test_loss: 0.9146, test_f1: 0.6033
 epoch: 75, train_loss: 0.6842, test_loss: 0.9523, test_f1: 0.5840
 epoch: 76, train_loss: 0.7028, test_loss: 1.0267, test_f1: 0.5325
 epoch: 77, train_loss: 0.7104, test_loss: 0.9326, test_f1: 0.6075
 epoch: 78, train_loss: 0.6987, test_loss: 0.9486, test_f1: 0.5883
 epoch: 79, train_loss: 0.6847, test_loss: 0.9740, test_f1: 0.5560
 epoch: 80, train_loss: 0.6871, test_loss: 0.9216, test_f1: 0.5830
 epoch: 81, train_loss: 0.6841, test_loss: 0.9671, test_f1: 0.5657
 epoch: 82, train_loss: 0.6819, test_loss: 0.9754, test_f1: 0.5741
 epoch: 83, train_loss: 0.6857, test_loss: 0.9533, test_f1: 0.5694
 epoch: 84, train_loss: 0.6990, test_loss: 0.9465, test_f1: 0.5950
 epoch: 85, train_loss: 0.6891, test_loss: 0.9043, test_f1: 0.5518
 epoch: 86, train_loss: 0.6891, test_loss: 0.9556, test_f1: 0.5752
 epoch: 87, train_loss: 0.6823, test_loss: 0.9228, test_f1: 0.5927
 epoch: 88, train_loss: 0.6873, test_loss: 0.9540, test_f1: 0.5689
 epoch: 89, train_loss: 0.6946, test_loss: 0.9303, test_f1: 0.5830
 epoch: 90, train_loss: 0.6931, test_loss: 0.9103, test_f1: 0.6027
 epoch: 91, train_loss: 0.6887, test_loss: 0.9306, test_f1: 0.5922
 epoch: 92, train_loss: 0.6767, test_loss: 0.9199, test_f1: 0.5864
 epoch: 93, train_loss: 0.6714, test_loss: 0.9861, test_f1: 0.5254
 epoch: 94, train_loss: 0.6666, test_loss: 0.9263, test_f1: 0.6146
 epoch: 95, train_loss: 0.6587, test_loss: 0.9472, test_f1: 0.5790
 epoch: 96, train_loss: 0.6656, test_loss: 0.9800, test_f1: 0.5766
 epoch: 97, train_loss: 0.6736, test_loss: 0.9745, test_f1: 0.6180
 epoch: 98, train_loss: 0.6676, test_loss: 0.9089, test_f1: 0.6230
 epoch: 99, train_loss: 0.6758, test_loss: 0.9604, test_f1: 0.5871
##################ITERATION #5 ****************************************
 epoch: 0, train_loss: 1.1937, test_loss: 1.0971, test_f1: 0.4865
 epoch: 1, train_loss: 1.0583, test_loss: 1.0620, test_f1: 0.3790
 epoch: 2, train_loss: 1.0055, test_loss: 0.9933, test_f1: 0.5062
 epoch: 3, train_loss: 0.9932, test_loss: 1.0540, test_f1: 0.4306
 epoch: 4, train_loss: 0.9775, test_loss: 1.2635, test_f1: 0.4566
 epoch: 5, train_loss: 0.9683, test_loss: 1.0334, test_f1: 0.5248
 epoch: 6, train_loss: 0.9630, test_loss: 1.0564, test_f1: 0.4947
 epoch: 7, train_loss: 0.9381, test_loss: 1.0564, test_f1: 0.4960
 epoch: 8, train_loss: 0.9454, test_loss: 1.2531, test_f1: 0.3770
 epoch: 9, train_loss: 0.9541, test_loss: 1.1413, test_f1: 0.4552
 epoch: 10, train_loss: 0.9184, test_loss: 1.0233, test_f1: 0.4354
 epoch: 11, train_loss: 0.9200, test_loss: 1.0373, test_f1: 0.5253
 epoch: 12, train_loss: 0.8995, test_loss: 1.1734, test_f1: 0.4741
 epoch: 13, train_loss: 0.9072, test_loss: 0.9643, test_f1: 0.4953
 epoch: 14, train_loss: 0.8886, test_loss: 1.0407, test_f1: 0.4974
 epoch: 15, train_loss: 0.8614, test_loss: 0.9959, test_f1: 0.5015
 epoch: 16, train_loss: 0.8737, test_loss: 0.9854, test_f1: 0.5026
 epoch: 17, train_loss: 0.8691, test_loss: 1.0664, test_f1: 0.4504
 epoch: 18, train_loss: 0.8593, test_loss: 0.9677, test_f1: 0.5402
 epoch: 19, train_loss: 0.8761, test_loss: 1.4265, test_f1: 0.3950
 epoch: 20, train_loss: 0.8413, test_loss: 0.9858, test_f1: 0.5207
 epoch: 21, train_loss: 0.8382, test_loss: 1.0158, test_f1: 0.4988
 epoch: 22, train_loss: 0.8369, test_loss: 0.8757, test_f1: 0.5899
 epoch: 23, train_loss: 0.8476, test_loss: 1.0152, test_f1: 0.4913
 epoch: 24, train_loss: 0.8406, test_loss: 1.0109, test_f1: 0.4923
 epoch: 25, train_loss: 0.8388, test_loss: 0.9421, test_f1: 0.5134
 epoch: 26, train_loss: 0.8545, test_loss: 0.9398, test_f1: 0.5362
 epoch: 27, train_loss: 0.8252, test_loss: 0.9266, test_f1: 0.5186
 epoch: 28, train_loss: 0.8094, test_loss: 0.9587, test_f1: 0.5136
 epoch: 29, train_loss: 0.8221, test_loss: 0.9171, test_f1: 0.5418
 epoch: 30, train_loss: 0.8250, test_loss: 0.9641, test_f1: 0.5036
 epoch: 31, train_loss: 0.8357, test_loss: 0.9042, test_f1: 0.5817
 epoch: 32, train_loss: 0.8076, test_loss: 0.9874, test_f1: 0.5082
 epoch: 33, train_loss: 0.8103, test_loss: 0.9124, test_f1: 0.5528
 epoch: 34, train_loss: 0.7999, test_loss: 0.9944, test_f1: 0.4641
 epoch: 35, train_loss: 0.8065, test_loss: 0.9481, test_f1: 0.5438
 epoch: 36, train_loss: 0.8015, test_loss: 0.8912, test_f1: 0.5250
 epoch: 37, train_loss: 0.7781, test_loss: 0.9046, test_f1: 0.6005
 epoch: 38, train_loss: 0.7872, test_loss: 0.8996, test_f1: 0.5642
 epoch: 39, train_loss: 0.7771, test_loss: 1.2109, test_f1: 0.4508
 epoch: 40, train_loss: 0.7981, test_loss: 0.8758, test_f1: 0.5641
 epoch: 41, train_loss: 0.7862, test_loss: 0.9824, test_f1: 0.5317
 epoch: 42, train_loss: 0.7888, test_loss: 0.9059, test_f1: 0.6032
 epoch: 43, train_loss: 0.7801, test_loss: 0.8755, test_f1: 0.5432
 epoch: 44, train_loss: 0.7975, test_loss: 0.9940, test_f1: 0.5251
 epoch: 45, train_loss: 0.7652, test_loss: 0.8646, test_f1: 0.5906
 epoch: 46, train_loss: 0.7679, test_loss: 0.8768, test_f1: 0.6143
 epoch: 47, train_loss: 0.7879, test_loss: 0.9096, test_f1: 0.5528
 epoch: 48, train_loss: 0.7941, test_loss: 0.7939, test_f1: 0.6226
 epoch: 49, train_loss: 0.7589, test_loss: 0.9018, test_f1: 0.5668
 epoch: 50, train_loss: 0.7717, test_loss: 0.8862, test_f1: 0.5372
 epoch: 51, train_loss: 0.7523, test_loss: 0.8966, test_f1: 0.5761
 epoch: 52, train_loss: 0.7396, test_loss: 0.8367, test_f1: 0.5611
 epoch: 53, train_loss: 0.7282, test_loss: 0.8161, test_f1: 0.5974
 epoch: 54, train_loss: 0.7318, test_loss: 1.0489, test_f1: 0.5130
 epoch: 55, train_loss: 0.7352, test_loss: 0.8748, test_f1: 0.5602
 epoch: 56, train_loss: 0.7045, test_loss: 0.9060, test_f1: 0.6112
 epoch: 57, train_loss: 0.7133, test_loss: 0.9244, test_f1: 0.5610
 epoch: 58, train_loss: 0.7244, test_loss: 0.9098, test_f1: 0.6084
 epoch: 59, train_loss: 0.7168, test_loss: 0.8778, test_f1: 0.6268
 epoch: 60, train_loss: 0.7094, test_loss: 0.8913, test_f1: 0.5795
 epoch: 61, train_loss: 0.7164, test_loss: 0.9159, test_f1: 0.5886
 epoch: 62, train_loss: 0.7163, test_loss: 0.8518, test_f1: 0.5917
 epoch: 63, train_loss: 0.7061, test_loss: 0.8553, test_f1: 0.6212
 epoch: 64, train_loss: 0.7022, test_loss: 0.9143, test_f1: 0.6115
 epoch: 65, train_loss: 0.6903, test_loss: 0.8948, test_f1: 0.6272
 epoch: 66, train_loss: 0.6974, test_loss: 0.9056, test_f1: 0.5750
 epoch: 67, train_loss: 0.7077, test_loss: 0.9843, test_f1: 0.5615
 epoch: 68, train_loss: 0.7032, test_loss: 0.8610, test_f1: 0.6219
 epoch: 69, train_loss: 0.6905, test_loss: 0.8875, test_f1: 0.6269
 epoch: 70, train_loss: 0.6999, test_loss: 0.9640, test_f1: 0.5488
 epoch: 71, train_loss: 0.6924, test_loss: 0.8819, test_f1: 0.6160
 epoch: 72, train_loss: 0.6880, test_loss: 0.9121, test_f1: 0.6284
 epoch: 73, train_loss: 0.6887, test_loss: 0.8624, test_f1: 0.6284
 epoch: 74, train_loss: 0.6925, test_loss: 0.9031, test_f1: 0.6249
 epoch: 75, train_loss: 0.6941, test_loss: 0.8819, test_f1: 0.6202
 epoch: 76, train_loss: 0.7022, test_loss: 0.9317, test_f1: 0.6119
 epoch: 77, train_loss: 0.6880, test_loss: 0.9016, test_f1: 0.6245
 epoch: 78, train_loss: 0.6931, test_loss: 0.8958, test_f1: 0.5814
 epoch: 79, train_loss: 0.6878, test_loss: 0.9046, test_f1: 0.5726
 epoch: 80, train_loss: 0.6836, test_loss: 0.9630, test_f1: 0.5667
 epoch: 81, train_loss: 0.6746, test_loss: 0.8894, test_f1: 0.6097
 epoch: 82, train_loss: 0.6795, test_loss: 0.9281, test_f1: 0.6148
 epoch: 83, train_loss: 0.6790, test_loss: 0.9229, test_f1: 0.6221
 epoch: 84, train_loss: 0.6866, test_loss: 0.9247, test_f1: 0.6143
 epoch: 85, train_loss: 0.6727, test_loss: 0.7981, test_f1: 0.6325
 epoch: 86, train_loss: 0.6748, test_loss: 1.0093, test_f1: 0.5606
 epoch: 87, train_loss: 0.6816, test_loss: 0.9472, test_f1: 0.5663
 epoch: 88, train_loss: 0.6808, test_loss: 0.9989, test_f1: 0.5594
 epoch: 89, train_loss: 0.6815, test_loss: 0.8829, test_f1: 0.6308
 epoch: 90, train_loss: 0.6827, test_loss: 0.8751, test_f1: 0.6094
 epoch: 91, train_loss: 0.6777, test_loss: 0.9082, test_f1: 0.5960
 epoch: 92, train_loss: 0.6877, test_loss: 0.8871, test_f1: 0.6053
 epoch: 93, train_loss: 0.6684, test_loss: 0.8998, test_f1: 0.6013
 epoch: 94, train_loss: 0.6841, test_loss: 0.9141, test_f1: 0.5960
 epoch: 95, train_loss: 0.6625, test_loss: 0.9196, test_f1: 0.6115
 epoch: 96, train_loss: 0.6630, test_loss: 1.0325, test_f1: 0.5543
 epoch: 97, train_loss: 0.6814, test_loss: 0.8919, test_f1: 0.6236
 epoch: 98, train_loss: 0.6720, test_loss: 0.8796, test_f1: 0.6192
 epoch: 99, train_loss: 0.6677, test_loss: 0.9214, test_f1: 0.6195
##################ITERATION #6 ****************************************
 epoch: 0, train_loss: 1.2364, test_loss: 1.1101, test_f1: 0.3521
 epoch: 1, train_loss: 1.0535, test_loss: 1.0287, test_f1: 0.3400
 epoch: 2, train_loss: 1.0343, test_loss: 1.1290, test_f1: 0.4051
 epoch: 3, train_loss: 1.0066, test_loss: 1.0523, test_f1: 0.4087
 epoch: 4, train_loss: 0.9922, test_loss: 1.2338, test_f1: 0.3490
 epoch: 5, train_loss: 0.9764, test_loss: 1.1086, test_f1: 0.4138
 epoch: 6, train_loss: 0.9691, test_loss: 1.0269, test_f1: 0.5237
 epoch: 7, train_loss: 0.9593, test_loss: 1.0157, test_f1: 0.4339
 epoch: 8, train_loss: 0.9625, test_loss: 0.9904, test_f1: 0.4833
 epoch: 9, train_loss: 0.9429, test_loss: 0.9878, test_f1: 0.5207
 epoch: 10, train_loss: 0.9392, test_loss: 0.9220, test_f1: 0.5440
 epoch: 11, train_loss: 0.9118, test_loss: 1.0426, test_f1: 0.4695
 epoch: 12, train_loss: 0.9035, test_loss: 1.0338, test_f1: 0.4628
 epoch: 13, train_loss: 0.8879, test_loss: 1.1077, test_f1: 0.4721
 epoch: 14, train_loss: 0.9075, test_loss: 0.9152, test_f1: 0.5106
 epoch: 15, train_loss: 0.8877, test_loss: 0.9533, test_f1: 0.5028
 epoch: 16, train_loss: 0.8778, test_loss: 0.9433, test_f1: 0.5232
 epoch: 17, train_loss: 0.8718, test_loss: 0.9535, test_f1: 0.5047
 epoch: 18, train_loss: 0.8803, test_loss: 0.9734, test_f1: 0.5360
 epoch: 19, train_loss: 0.8545, test_loss: 0.9576, test_f1: 0.5003
 epoch: 20, train_loss: 0.8710, test_loss: 0.9574, test_f1: 0.5083
 epoch: 21, train_loss: 0.8793, test_loss: 0.9345, test_f1: 0.5181
 epoch: 22, train_loss: 0.8359, test_loss: 0.9264, test_f1: 0.5169
 epoch: 23, train_loss: 0.8269, test_loss: 0.9212, test_f1: 0.5243
 epoch: 24, train_loss: 0.8505, test_loss: 0.9804, test_f1: 0.5772
 epoch: 25, train_loss: 0.8342, test_loss: 0.8923, test_f1: 0.5522
 epoch: 26, train_loss: 0.8422, test_loss: 0.9610, test_f1: 0.5028
 epoch: 27, train_loss: 0.8288, test_loss: 0.9926, test_f1: 0.5040
 epoch: 28, train_loss: 0.8112, test_loss: 0.9203, test_f1: 0.5426
 epoch: 29, train_loss: 0.8251, test_loss: 1.0057, test_f1: 0.4747
 epoch: 30, train_loss: 0.8507, test_loss: 1.0622, test_f1: 0.4993
 epoch: 31, train_loss: 0.8145, test_loss: 0.9289, test_f1: 0.5215
 epoch: 32, train_loss: 0.8048, test_loss: 0.8971, test_f1: 0.5422
 epoch: 33, train_loss: 0.8044, test_loss: 1.0466, test_f1: 0.4876
 epoch: 34, train_loss: 0.7942, test_loss: 1.1392, test_f1: 0.4723
 epoch: 35, train_loss: 0.8001, test_loss: 0.9320, test_f1: 0.5470
 epoch: 36, train_loss: 0.8040, test_loss: 0.9917, test_f1: 0.5212
 epoch: 37, train_loss: 0.8006, test_loss: 0.8907, test_f1: 0.5245
 epoch: 38, train_loss: 0.7852, test_loss: 0.9295, test_f1: 0.5285
 epoch: 39, train_loss: 0.7906, test_loss: 0.9669, test_f1: 0.5106
 epoch: 40, train_loss: 0.8127, test_loss: 0.9522, test_f1: 0.5146
 epoch: 41, train_loss: 0.7965, test_loss: 0.9604, test_f1: 0.5076
 epoch: 42, train_loss: 0.8120, test_loss: 0.9380, test_f1: 0.5461
 epoch: 43, train_loss: 0.7917, test_loss: 0.9112, test_f1: 0.5386
 epoch: 44, train_loss: 0.7926, test_loss: 0.9304, test_f1: 0.5132
 epoch: 45, train_loss: 0.7903, test_loss: 0.9555, test_f1: 0.5151
 epoch: 46, train_loss: 0.7910, test_loss: 0.9896, test_f1: 0.5366
 epoch: 47, train_loss: 0.7884, test_loss: 0.9193, test_f1: 0.5670
 epoch: 48, train_loss: 0.7640, test_loss: 1.1779, test_f1: 0.4540
 epoch: 49, train_loss: 0.7732, test_loss: 0.9057, test_f1: 0.5773
 epoch: 50, train_loss: 0.7837, test_loss: 1.0000, test_f1: 0.5220
 epoch: 51, train_loss: 0.7609, test_loss: 0.9144, test_f1: 0.5439
 epoch: 52, train_loss: 0.7589, test_loss: 0.8957, test_f1: 0.5310
 epoch: 53, train_loss: 0.7383, test_loss: 0.8796, test_f1: 0.5567
 epoch: 54, train_loss: 0.7425, test_loss: 0.9261, test_f1: 0.5305
 epoch: 55, train_loss: 0.7338, test_loss: 0.8618, test_f1: 0.5579
 epoch: 56, train_loss: 0.7374, test_loss: 0.9163, test_f1: 0.5418
 epoch: 57, train_loss: 0.7274, test_loss: 0.9736, test_f1: 0.5284
 epoch: 58, train_loss: 0.7502, test_loss: 0.9392, test_f1: 0.5370
 epoch: 59, train_loss: 0.7304, test_loss: 0.8867, test_f1: 0.5555
 epoch: 60, train_loss: 0.7207, test_loss: 0.8832, test_f1: 0.5720
 epoch: 61, train_loss: 0.7334, test_loss: 0.9226, test_f1: 0.5380
 epoch: 62, train_loss: 0.7221, test_loss: 0.9187, test_f1: 0.5545
 epoch: 63, train_loss: 0.7080, test_loss: 0.8887, test_f1: 0.5567
 epoch: 64, train_loss: 0.7398, test_loss: 0.9039, test_f1: 0.5499
 epoch: 65, train_loss: 0.7255, test_loss: 1.0154, test_f1: 0.5042
 epoch: 66, train_loss: 0.7399, test_loss: 0.9183, test_f1: 0.5586
 epoch: 67, train_loss: 0.7164, test_loss: 1.0037, test_f1: 0.5059
 epoch: 68, train_loss: 0.7160, test_loss: 0.8936, test_f1: 0.5494
 epoch: 69, train_loss: 0.7260, test_loss: 0.9022, test_f1: 0.5587
 epoch: 70, train_loss: 0.7078, test_loss: 0.9602, test_f1: 0.5392
 epoch: 71, train_loss: 0.7051, test_loss: 0.9331, test_f1: 0.5247
 epoch: 72, train_loss: 0.7214, test_loss: 0.9178, test_f1: 0.5572
 epoch: 73, train_loss: 0.7069, test_loss: 0.8910, test_f1: 0.5414
 epoch: 74, train_loss: 0.7166, test_loss: 1.0148, test_f1: 0.5522
 epoch: 75, train_loss: 0.6984, test_loss: 0.8812, test_f1: 0.5583
 epoch: 76, train_loss: 0.7158, test_loss: 0.8964, test_f1: 0.5533
 epoch: 77, train_loss: 0.6974, test_loss: 0.9471, test_f1: 0.5548
 epoch: 78, train_loss: 0.7096, test_loss: 0.9168, test_f1: 0.5591
 epoch: 79, train_loss: 0.7029, test_loss: 0.9161, test_f1: 0.5601
 epoch: 80, train_loss: 0.6979, test_loss: 0.9349, test_f1: 0.5472
 epoch: 81, train_loss: 0.6979, test_loss: 0.8935, test_f1: 0.5356
 epoch: 82, train_loss: 0.6995, test_loss: 0.9219, test_f1: 0.5693
 epoch: 83, train_loss: 0.6996, test_loss: 0.9038, test_f1: 0.5857
 epoch: 84, train_loss: 0.7172, test_loss: 0.9569, test_f1: 0.5447
 epoch: 85, train_loss: 0.6936, test_loss: 0.9015, test_f1: 0.5582
 epoch: 86, train_loss: 0.7011, test_loss: 0.9487, test_f1: 0.5778
 epoch: 87, train_loss: 0.7134, test_loss: 0.9514, test_f1: 0.5935
 epoch: 88, train_loss: 0.7008, test_loss: 0.9459, test_f1: 0.5699
 epoch: 89, train_loss: 0.6796, test_loss: 0.9088, test_f1: 0.5877
 epoch: 90, train_loss: 0.6954, test_loss: 0.9454, test_f1: 0.5616
 epoch: 91, train_loss: 0.6998, test_loss: 0.8740, test_f1: 0.5763
 epoch: 92, train_loss: 0.6808, test_loss: 0.8971, test_f1: 0.5885
 epoch: 93, train_loss: 0.6877, test_loss: 0.9344, test_f1: 0.5856
 epoch: 94, train_loss: 0.6948, test_loss: 0.9050, test_f1: 0.5775
 epoch: 95, train_loss: 0.6861, test_loss: 0.9480, test_f1: 0.5937
 epoch: 96, train_loss: 0.7025, test_loss: 0.9021, test_f1: 0.5745
 epoch: 97, train_loss: 0.6893, test_loss: 0.8650, test_f1: 0.6070
 epoch: 98, train_loss: 0.6754, test_loss: 1.0014, test_f1: 0.5596
 epoch: 99, train_loss: 0.6881, test_loss: 0.9487, test_f1: 0.5630
##################ITERATION #7 ****************************************
 epoch: 0, train_loss: 1.2037, test_loss: 1.2001, test_f1: 0.3792
 epoch: 1, train_loss: 1.0618, test_loss: 1.0602, test_f1: 0.4174
 epoch: 2, train_loss: 1.0281, test_loss: 1.0151, test_f1: 0.4675
 epoch: 3, train_loss: 1.0187, test_loss: 1.0696, test_f1: 0.4237
 epoch: 4, train_loss: 0.9885, test_loss: 1.1758, test_f1: 0.4510
 epoch: 5, train_loss: 0.9811, test_loss: 0.9909, test_f1: 0.4872
 epoch: 6, train_loss: 0.9662, test_loss: 0.9965, test_f1: 0.5316
 epoch: 7, train_loss: 0.9329, test_loss: 1.0519, test_f1: 0.4633
 epoch: 8, train_loss: 0.9161, test_loss: 1.0020, test_f1: 0.4770
 epoch: 9, train_loss: 0.9090, test_loss: 1.2709, test_f1: 0.3914
 epoch: 10, train_loss: 0.9179, test_loss: 0.9832, test_f1: 0.4962
 epoch: 11, train_loss: 0.9114, test_loss: 0.9787, test_f1: 0.4490
 epoch: 12, train_loss: 0.8887, test_loss: 0.9359, test_f1: 0.5612
 epoch: 13, train_loss: 0.8937, test_loss: 0.9510, test_f1: 0.5403
 epoch: 14, train_loss: 0.8913, test_loss: 0.9749, test_f1: 0.5073
 epoch: 15, train_loss: 0.8824, test_loss: 0.9678, test_f1: 0.4970
 epoch: 16, train_loss: 0.8816, test_loss: 0.9335, test_f1: 0.5153
 epoch: 17, train_loss: 0.8757, test_loss: 0.9385, test_f1: 0.5006
 epoch: 18, train_loss: 0.8593, test_loss: 0.9266, test_f1: 0.5267
 epoch: 19, train_loss: 0.8522, test_loss: 0.9033, test_f1: 0.5317
 epoch: 20, train_loss: 0.8579, test_loss: 1.0390, test_f1: 0.4853
 epoch: 21, train_loss: 0.8536, test_loss: 0.9906, test_f1: 0.5121
 epoch: 22, train_loss: 0.8270, test_loss: 0.9171, test_f1: 0.5317
 epoch: 23, train_loss: 0.8300, test_loss: 0.9714, test_f1: 0.5170
 epoch: 24, train_loss: 0.8361, test_loss: 0.9135, test_f1: 0.5294
 epoch: 25, train_loss: 0.8266, test_loss: 0.9190, test_f1: 0.5194
 epoch: 26, train_loss: 0.8165, test_loss: 0.9579, test_f1: 0.5177
 epoch: 27, train_loss: 0.8368, test_loss: 0.9456, test_f1: 0.5216
 epoch: 28, train_loss: 0.8211, test_loss: 1.0595, test_f1: 0.5047
 epoch: 29, train_loss: 0.8092, test_loss: 0.9761, test_f1: 0.5135
 epoch: 30, train_loss: 0.8111, test_loss: 1.0186, test_f1: 0.5440
 epoch: 31, train_loss: 0.8331, test_loss: 0.9826, test_f1: 0.5113
 epoch: 32, train_loss: 0.8362, test_loss: 0.9516, test_f1: 0.5211
 epoch: 33, train_loss: 0.8086, test_loss: 0.9420, test_f1: 0.5221
 epoch: 34, train_loss: 0.7957, test_loss: 0.9297, test_f1: 0.5416
 epoch: 35, train_loss: 0.7745, test_loss: 0.9451, test_f1: 0.5543
 epoch: 36, train_loss: 0.7776, test_loss: 0.9459, test_f1: 0.5415
 epoch: 37, train_loss: 0.7848, test_loss: 0.9505, test_f1: 0.5405
 epoch: 38, train_loss: 0.7811, test_loss: 0.9450, test_f1: 0.5094
 epoch: 39, train_loss: 0.7753, test_loss: 0.8849, test_f1: 0.5677
 epoch: 40, train_loss: 0.7733, test_loss: 0.9345, test_f1: 0.5480
 epoch: 41, train_loss: 0.7609, test_loss: 0.8851, test_f1: 0.5441
 epoch: 42, train_loss: 0.7798, test_loss: 0.9195, test_f1: 0.5646
 epoch: 43, train_loss: 0.7727, test_loss: 0.9016, test_f1: 0.5624
 epoch: 44, train_loss: 0.7706, test_loss: 0.9407, test_f1: 0.5541
 epoch: 45, train_loss: 0.7402, test_loss: 0.9887, test_f1: 0.5313
 epoch: 46, train_loss: 0.7552, test_loss: 0.8917, test_f1: 0.5978
 epoch: 47, train_loss: 0.7409, test_loss: 0.9497, test_f1: 0.5563
 epoch: 48, train_loss: 0.7464, test_loss: 0.8839, test_f1: 0.5672
 epoch: 49, train_loss: 0.7734, test_loss: 1.0176, test_f1: 0.5470
 epoch: 50, train_loss: 0.7630, test_loss: 1.0338, test_f1: 0.5516
 epoch: 51, train_loss: 0.7526, test_loss: 0.9374, test_f1: 0.5677
 epoch: 52, train_loss: 0.7145, test_loss: 0.9104, test_f1: 0.5934
 epoch: 53, train_loss: 0.7096, test_loss: 0.9353, test_f1: 0.5778
 epoch: 54, train_loss: 0.7243, test_loss: 0.9435, test_f1: 0.5633
 epoch: 55, train_loss: 0.7166, test_loss: 0.9106, test_f1: 0.5835
 epoch: 56, train_loss: 0.7041, test_loss: 0.9171, test_f1: 0.6068
 epoch: 57, train_loss: 0.6991, test_loss: 0.9210, test_f1: 0.5937
 epoch: 58, train_loss: 0.7170, test_loss: 0.9191, test_f1: 0.5759
 epoch: 59, train_loss: 0.7051, test_loss: 0.9008, test_f1: 0.5912
 epoch: 60, train_loss: 0.6967, test_loss: 0.9299, test_f1: 0.5838
 epoch: 61, train_loss: 0.7058, test_loss: 0.9394, test_f1: 0.5909
 epoch: 62, train_loss: 0.6895, test_loss: 0.9630, test_f1: 0.5832
 epoch: 63, train_loss: 0.6872, test_loss: 0.9072, test_f1: 0.6083
 epoch: 64, train_loss: 0.7052, test_loss: 0.9459, test_f1: 0.6058
 epoch: 65, train_loss: 0.7042, test_loss: 0.9497, test_f1: 0.5946
 epoch: 66, train_loss: 0.7178, test_loss: 0.9612, test_f1: 0.5928
 epoch: 67, train_loss: 0.6983, test_loss: 0.9126, test_f1: 0.5860
 epoch: 68, train_loss: 0.6843, test_loss: 0.9369, test_f1: 0.5992
 epoch: 69, train_loss: 0.6869, test_loss: 0.9274, test_f1: 0.5918
 epoch: 70, train_loss: 0.6840, test_loss: 0.9513, test_f1: 0.5918
 epoch: 71, train_loss: 0.6854, test_loss: 0.9377, test_f1: 0.6064
 epoch: 72, train_loss: 0.6724, test_loss: 0.9459, test_f1: 0.6003
 epoch: 73, train_loss: 0.6741, test_loss: 0.9049, test_f1: 0.6014
 epoch: 74, train_loss: 0.6720, test_loss: 0.9332, test_f1: 0.6181
 epoch: 75, train_loss: 0.6715, test_loss: 0.9924, test_f1: 0.5626
 epoch: 76, train_loss: 0.7002, test_loss: 0.8967, test_f1: 0.6101
 epoch: 77, train_loss: 0.6765, test_loss: 1.0139, test_f1: 0.6017
 epoch: 78, train_loss: 0.6783, test_loss: 0.9337, test_f1: 0.6012
 epoch: 79, train_loss: 0.6714, test_loss: 0.9241, test_f1: 0.5719
 epoch: 80, train_loss: 0.6771, test_loss: 1.0074, test_f1: 0.5858
 epoch: 81, train_loss: 0.6698, test_loss: 0.8995, test_f1: 0.5811
 epoch: 82, train_loss: 0.6806, test_loss: 0.8983, test_f1: 0.5796
 epoch: 83, train_loss: 0.6703, test_loss: 0.9163, test_f1: 0.6139
 epoch: 84, train_loss: 0.6755, test_loss: 0.9895, test_f1: 0.5952
 epoch: 85, train_loss: 0.6746, test_loss: 0.9897, test_f1: 0.5443
 epoch: 86, train_loss: 0.6782, test_loss: 1.0368, test_f1: 0.5839
 epoch: 87, train_loss: 0.6668, test_loss: 0.9375, test_f1: 0.6011
 epoch: 88, train_loss: 0.6595, test_loss: 0.8982, test_f1: 0.6106
 epoch: 89, train_loss: 0.6646, test_loss: 0.9911, test_f1: 0.5703
 epoch: 90, train_loss: 0.6628, test_loss: 0.9253, test_f1: 0.5853
 epoch: 91, train_loss: 0.6875, test_loss: 0.9293, test_f1: 0.6000
 epoch: 92, train_loss: 0.6832, test_loss: 1.0637, test_f1: 0.5870
 epoch: 93, train_loss: 0.6744, test_loss: 0.9429, test_f1: 0.5967
 epoch: 94, train_loss: 0.6646, test_loss: 0.9177, test_f1: 0.6155
 epoch: 95, train_loss: 0.6608, test_loss: 0.8553, test_f1: 0.6154
 epoch: 96, train_loss: 0.6467, test_loss: 0.9717, test_f1: 0.6086
 epoch: 97, train_loss: 0.6523, test_loss: 1.0018, test_f1: 0.5856
 epoch: 98, train_loss: 0.6593, test_loss: 0.9258, test_f1: 0.6119
 epoch: 99, train_loss: 0.6625, test_loss: 0.9186, test_f1: 0.6179
##################ITERATION #8 ****************************************
 epoch: 0, train_loss: 1.2186, test_loss: 1.1544, test_f1: 0.4732
 epoch: 1, train_loss: 1.0685, test_loss: 1.0128, test_f1: 0.4806
 epoch: 2, train_loss: 1.0246, test_loss: 0.9866, test_f1: 0.5092
 epoch: 3, train_loss: 1.0146, test_loss: 1.0580, test_f1: 0.4140
 epoch: 4, train_loss: 1.0021, test_loss: 1.0468, test_f1: 0.5065
 epoch: 5, train_loss: 1.0135, test_loss: 1.0417, test_f1: 0.4481
 epoch: 6, train_loss: 0.9941, test_loss: 0.9846, test_f1: 0.4703
 epoch: 7, train_loss: 0.9785, test_loss: 0.9834, test_f1: 0.4980
 epoch: 8, train_loss: 0.9638, test_loss: 1.0539, test_f1: 0.4835
 epoch: 9, train_loss: 0.9625, test_loss: 1.0365, test_f1: 0.4577
 epoch: 10, train_loss: 0.9635, test_loss: 1.0540, test_f1: 0.4929
 epoch: 11, train_loss: 0.9502, test_loss: 1.0335, test_f1: 0.4906
 epoch: 12, train_loss: 0.9310, test_loss: 1.0065, test_f1: 0.5193
 epoch: 13, train_loss: 0.9255, test_loss: 0.9932, test_f1: 0.4923
 epoch: 14, train_loss: 0.9296, test_loss: 1.0470, test_f1: 0.4429
 epoch: 15, train_loss: 0.9249, test_loss: 1.0058, test_f1: 0.4766
 epoch: 16, train_loss: 0.9051, test_loss: 0.9599, test_f1: 0.4963
 epoch: 17, train_loss: 0.9020, test_loss: 0.9174, test_f1: 0.5592
 epoch: 18, train_loss: 0.8826, test_loss: 0.9693, test_f1: 0.5050
 epoch: 19, train_loss: 0.8908, test_loss: 0.9729, test_f1: 0.4922
 epoch: 20, train_loss: 0.8783, test_loss: 0.8929, test_f1: 0.5276
 epoch: 21, train_loss: 0.8706, test_loss: 1.0201, test_f1: 0.5075
 epoch: 22, train_loss: 0.8633, test_loss: 1.0130, test_f1: 0.4961
 epoch: 23, train_loss: 0.8868, test_loss: 0.9800, test_f1: 0.4906
 epoch: 24, train_loss: 0.8679, test_loss: 0.9351, test_f1: 0.5433
 epoch: 25, train_loss: 0.8808, test_loss: 0.9645, test_f1: 0.5127
 epoch: 26, train_loss: 0.8695, test_loss: 0.8956, test_f1: 0.5195
 epoch: 27, train_loss: 0.8453, test_loss: 0.9342, test_f1: 0.5154
 epoch: 28, train_loss: 0.8590, test_loss: 0.9872, test_f1: 0.4976
 epoch: 29, train_loss: 0.8524, test_loss: 0.9371, test_f1: 0.5174
 epoch: 30, train_loss: 0.8497, test_loss: 0.9862, test_f1: 0.5147
 epoch: 31, train_loss: 0.8284, test_loss: 0.8899, test_f1: 0.5530
 epoch: 32, train_loss: 0.8304, test_loss: 0.8950, test_f1: 0.5275
 epoch: 33, train_loss: 0.8307, test_loss: 0.8618, test_f1: 0.5660
 epoch: 34, train_loss: 0.8098, test_loss: 0.8626, test_f1: 0.5528
 epoch: 35, train_loss: 0.8123, test_loss: 0.8735, test_f1: 0.5481
 epoch: 36, train_loss: 0.8146, test_loss: 0.8756, test_f1: 0.5651
 epoch: 37, train_loss: 0.8173, test_loss: 0.8421, test_f1: 0.5566
 epoch: 38, train_loss: 0.8437, test_loss: 0.9264, test_f1: 0.5256
 epoch: 39, train_loss: 0.8154, test_loss: 0.8954, test_f1: 0.5462
 epoch: 40, train_loss: 0.8441, test_loss: 0.8393, test_f1: 0.5561
 epoch: 41, train_loss: 0.8139, test_loss: 1.0677, test_f1: 0.5141
 epoch: 42, train_loss: 0.8105, test_loss: 0.9054, test_f1: 0.5240
 epoch: 43, train_loss: 0.7957, test_loss: 0.8675, test_f1: 0.5452
 epoch: 44, train_loss: 0.7952, test_loss: 0.8407, test_f1: 0.5505
 epoch: 45, train_loss: 0.7948, test_loss: 0.8874, test_f1: 0.5381
 epoch: 46, train_loss: 0.7932, test_loss: 0.8598, test_f1: 0.5479
 epoch: 47, train_loss: 0.7768, test_loss: 0.8915, test_f1: 0.5428
 epoch: 48, train_loss: 0.7936, test_loss: 0.8527, test_f1: 0.5497
 epoch: 49, train_loss: 0.7839, test_loss: 0.8810, test_f1: 0.5621
 epoch: 50, train_loss: 0.7853, test_loss: 0.8229, test_f1: 0.5477
 epoch: 51, train_loss: 0.7722, test_loss: 0.8524, test_f1: 0.5400
 epoch: 52, train_loss: 0.7596, test_loss: 0.8334, test_f1: 0.5619
 epoch: 53, train_loss: 0.7539, test_loss: 0.8307, test_f1: 0.5517
 epoch: 54, train_loss: 0.7523, test_loss: 0.9326, test_f1: 0.5113
 epoch: 55, train_loss: 0.7537, test_loss: 0.8235, test_f1: 0.5563
 epoch: 56, train_loss: 0.7315, test_loss: 0.8362, test_f1: 0.5618
 epoch: 57, train_loss: 0.7583, test_loss: 0.8333, test_f1: 0.5756
 epoch: 58, train_loss: 0.7343, test_loss: 0.8481, test_f1: 0.5724
 epoch: 59, train_loss: 0.7409, test_loss: 0.8095, test_f1: 0.5696
 epoch: 60, train_loss: 0.7386, test_loss: 0.8376, test_f1: 0.5474
 epoch: 61, train_loss: 0.7345, test_loss: 0.8537, test_f1: 0.5558
 epoch: 62, train_loss: 0.7354, test_loss: 0.8423, test_f1: 0.5659
 epoch: 63, train_loss: 0.7280, test_loss: 0.8176, test_f1: 0.6138
 epoch: 64, train_loss: 0.7351, test_loss: 0.8378, test_f1: 0.5680
 epoch: 65, train_loss: 0.7379, test_loss: 0.9371, test_f1: 0.5237
 epoch: 66, train_loss: 0.7261, test_loss: 0.8328, test_f1: 0.5679
 epoch: 67, train_loss: 0.7062, test_loss: 0.8663, test_f1: 0.5617
 epoch: 68, train_loss: 0.7103, test_loss: 0.8575, test_f1: 0.5715
 epoch: 69, train_loss: 0.7046, test_loss: 0.8751, test_f1: 0.5368
 epoch: 70, train_loss: 0.7189, test_loss: 0.8359, test_f1: 0.6106
 epoch: 71, train_loss: 0.7374, test_loss: 0.8261, test_f1: 0.5651
 epoch: 72, train_loss: 0.7230, test_loss: 0.8787, test_f1: 0.5683
 epoch: 73, train_loss: 0.7302, test_loss: 0.8641, test_f1: 0.5642
 epoch: 74, train_loss: 0.7160, test_loss: 0.8519, test_f1: 0.5904
 epoch: 75, train_loss: 0.7143, test_loss: 0.8443, test_f1: 0.5845
 epoch: 76, train_loss: 0.7166, test_loss: 0.8767, test_f1: 0.5811
 epoch: 77, train_loss: 0.7144, test_loss: 0.8365, test_f1: 0.5761
 epoch: 78, train_loss: 0.7142, test_loss: 0.8463, test_f1: 0.5720
 epoch: 79, train_loss: 0.6984, test_loss: 0.9031, test_f1: 0.5462
 epoch: 80, train_loss: 0.7168, test_loss: 0.8328, test_f1: 0.5781
 epoch: 81, train_loss: 0.7139, test_loss: 0.8648, test_f1: 0.5812
 epoch: 82, train_loss: 0.7053, test_loss: 0.8302, test_f1: 0.6180
 epoch: 83, train_loss: 0.7007, test_loss: 0.9148, test_f1: 0.5498
 epoch: 84, train_loss: 0.6971, test_loss: 0.8545, test_f1: 0.5820
 epoch: 85, train_loss: 0.6999, test_loss: 0.8314, test_f1: 0.5699
 epoch: 86, train_loss: 0.7144, test_loss: 0.8356, test_f1: 0.5482
 epoch: 87, train_loss: 0.7205, test_loss: 0.8624, test_f1: 0.5674
 epoch: 88, train_loss: 0.7033, test_loss: 0.8350, test_f1: 0.6056
 epoch: 89, train_loss: 0.7092, test_loss: 0.8540, test_f1: 0.6001
 epoch: 90, train_loss: 0.7054, test_loss: 0.9130, test_f1: 0.5409
 epoch: 91, train_loss: 0.6958, test_loss: 0.9236, test_f1: 0.5757
 epoch: 92, train_loss: 0.7143, test_loss: 0.8904, test_f1: 0.5937
 epoch: 93, train_loss: 0.6877, test_loss: 0.8795, test_f1: 0.5938
 epoch: 94, train_loss: 0.6944, test_loss: 0.9092, test_f1: 0.5532
 epoch: 95, train_loss: 0.6962, test_loss: 0.8426, test_f1: 0.5888
 epoch: 96, train_loss: 0.7013, test_loss: 0.8575, test_f1: 0.5829
 epoch: 97, train_loss: 0.6862, test_loss: 0.9218, test_f1: 0.5494
 epoch: 98, train_loss: 0.6888, test_loss: 0.8411, test_f1: 0.5843
 epoch: 99, train_loss: 0.7017, test_loss: 0.9159, test_f1: 0.5789
##################ITERATION #9 ****************************************
 epoch: 0, train_loss: 1.2153, test_loss: 1.1292, test_f1: 0.3514
 epoch: 1, train_loss: 1.0554, test_loss: 1.0504, test_f1: 0.3628
 epoch: 2, train_loss: 1.0220, test_loss: 0.9950, test_f1: 0.4503
 epoch: 3, train_loss: 0.9930, test_loss: 1.0014, test_f1: 0.4643
 epoch: 4, train_loss: 0.9928, test_loss: 1.0698, test_f1: 0.4086
 epoch: 5, train_loss: 0.9731, test_loss: 1.1342, test_f1: 0.4243
 epoch: 6, train_loss: 0.9698, test_loss: 1.0748, test_f1: 0.4211
 epoch: 7, train_loss: 0.9522, test_loss: 1.1433, test_f1: 0.4288
 epoch: 8, train_loss: 0.9593, test_loss: 1.0318, test_f1: 0.4971
 epoch: 9, train_loss: 0.9403, test_loss: 0.9941, test_f1: 0.5102
 epoch: 10, train_loss: 0.9353, test_loss: 0.9476, test_f1: 0.5136
 epoch: 11, train_loss: 0.9342, test_loss: 0.9561, test_f1: 0.5108
 epoch: 12, train_loss: 0.9027, test_loss: 0.9175, test_f1: 0.5221
 epoch: 13, train_loss: 0.8917, test_loss: 0.9321, test_f1: 0.5272
 epoch: 14, train_loss: 0.8920, test_loss: 0.9501, test_f1: 0.5121
 epoch: 15, train_loss: 0.8820, test_loss: 0.9173, test_f1: 0.5000
 epoch: 16, train_loss: 0.8867, test_loss: 0.9545, test_f1: 0.4980
 epoch: 17, train_loss: 0.8825, test_loss: 0.9916, test_f1: 0.5038
 epoch: 18, train_loss: 0.8666, test_loss: 0.9023, test_f1: 0.5247
 epoch: 19, train_loss: 0.8596, test_loss: 0.9796, test_f1: 0.5029
 epoch: 20, train_loss: 0.8530, test_loss: 0.9651, test_f1: 0.5098
 epoch: 21, train_loss: 0.8362, test_loss: 0.9688, test_f1: 0.5209
 epoch: 22, train_loss: 0.8450, test_loss: 0.9198, test_f1: 0.5109
 epoch: 23, train_loss: 0.8318, test_loss: 0.9106, test_f1: 0.5487
 epoch: 24, train_loss: 0.8305, test_loss: 0.8889, test_f1: 0.5220
 epoch: 25, train_loss: 0.8334, test_loss: 0.8922, test_f1: 0.5453
 epoch: 26, train_loss: 0.8241, test_loss: 0.8799, test_f1: 0.5570
 epoch: 27, train_loss: 0.8131, test_loss: 0.8828, test_f1: 0.5439
 epoch: 28, train_loss: 0.8178, test_loss: 0.9052, test_f1: 0.5416
 epoch: 29, train_loss: 0.8129, test_loss: 0.9634, test_f1: 0.5257
 epoch: 30, train_loss: 0.8007, test_loss: 0.8635, test_f1: 0.5538
 epoch: 31, train_loss: 0.7994, test_loss: 0.9166, test_f1: 0.5428
 epoch: 32, train_loss: 0.8087, test_loss: 0.8917, test_f1: 0.5453
 epoch: 33, train_loss: 0.7913, test_loss: 0.9874, test_f1: 0.4600
 epoch: 34, train_loss: 0.7991, test_loss: 0.8922, test_f1: 0.5742
 epoch: 35, train_loss: 0.8003, test_loss: 0.9243, test_f1: 0.5155
 epoch: 36, train_loss: 0.7893, test_loss: 0.8798, test_f1: 0.5738
 epoch: 37, train_loss: 0.7929, test_loss: 0.9019, test_f1: 0.5298
 epoch: 38, train_loss: 0.7948, test_loss: 0.8594, test_f1: 0.5738
 epoch: 39, train_loss: 0.7944, test_loss: 0.9120, test_f1: 0.5069
 epoch: 40, train_loss: 0.7784, test_loss: 0.8531, test_f1: 0.5823
 epoch: 41, train_loss: 0.7761, test_loss: 0.8449, test_f1: 0.5285
 epoch: 42, train_loss: 0.7739, test_loss: 0.8222, test_f1: 0.5566
 epoch: 43, train_loss: 0.7770, test_loss: 0.8626, test_f1: 0.5812
 epoch: 44, train_loss: 0.7636, test_loss: 0.8732, test_f1: 0.5362
 epoch: 45, train_loss: 0.7776, test_loss: 0.8921, test_f1: 0.5566
 epoch: 46, train_loss: 0.7698, test_loss: 0.9005, test_f1: 0.5654
 epoch: 47, train_loss: 0.7848, test_loss: 0.8427, test_f1: 0.5595
 epoch: 48, train_loss: 0.7727, test_loss: 0.8648, test_f1: 0.5244
 epoch: 49, train_loss: 0.7898, test_loss: 0.8330, test_f1: 0.5644
 epoch: 50, train_loss: 0.7767, test_loss: 0.8577, test_f1: 0.5442
 epoch: 51, train_loss: 0.7381, test_loss: 0.8560, test_f1: 0.5548
 epoch: 52, train_loss: 0.7326, test_loss: 0.8547, test_f1: 0.5487
 epoch: 53, train_loss: 0.7344, test_loss: 0.8595, test_f1: 0.5717
 epoch: 54, train_loss: 0.7344, test_loss: 0.8247, test_f1: 0.5574
 epoch: 55, train_loss: 0.7325, test_loss: 0.8609, test_f1: 0.5722
 epoch: 56, train_loss: 0.7189, test_loss: 0.8442, test_f1: 0.5980
 epoch: 57, train_loss: 0.7278, test_loss: 0.8824, test_f1: 0.5625
 epoch: 58, train_loss: 0.7319, test_loss: 0.8322, test_f1: 0.5656
 epoch: 59, train_loss: 0.7206, test_loss: 0.8349, test_f1: 0.6020
 epoch: 60, train_loss: 0.7317, test_loss: 0.8363, test_f1: 0.5576
 epoch: 61, train_loss: 0.7144, test_loss: 0.8490, test_f1: 0.5751
 epoch: 62, train_loss: 0.7171, test_loss: 0.8642, test_f1: 0.5934
 epoch: 63, train_loss: 0.7165, test_loss: 0.8386, test_f1: 0.5886
 epoch: 64, train_loss: 0.7159, test_loss: 0.8694, test_f1: 0.5851
 epoch: 65, train_loss: 0.7299, test_loss: 0.8603, test_f1: 0.6032
 epoch: 66, train_loss: 0.7091, test_loss: 0.8913, test_f1: 0.5610
 epoch: 67, train_loss: 0.7160, test_loss: 0.8541, test_f1: 0.5894
 epoch: 68, train_loss: 0.7128, test_loss: 0.8456, test_f1: 0.5816
 epoch: 69, train_loss: 0.7175, test_loss: 0.8466, test_f1: 0.5826
 epoch: 70, train_loss: 0.7164, test_loss: 0.8537, test_f1: 0.5527
 epoch: 71, train_loss: 0.7112, test_loss: 0.8769, test_f1: 0.5691
 epoch: 72, train_loss: 0.7032, test_loss: 0.8850, test_f1: 0.5694
 epoch: 73, train_loss: 0.7266, test_loss: 0.8578, test_f1: 0.5825
 epoch: 74, train_loss: 0.7116, test_loss: 0.8614, test_f1: 0.6082
 epoch: 75, train_loss: 0.6962, test_loss: 0.8958, test_f1: 0.5999
 epoch: 76, train_loss: 0.6994, test_loss: 0.8729, test_f1: 0.5737
 epoch: 77, train_loss: 0.6928, test_loss: 0.8979, test_f1: 0.5696
 epoch: 78, train_loss: 0.7045, test_loss: 0.8898, test_f1: 0.5678
 epoch: 79, train_loss: 0.7048, test_loss: 0.9124, test_f1: 0.5592
 epoch: 80, train_loss: 0.6861, test_loss: 0.8821, test_f1: 0.5989
 epoch: 81, train_loss: 0.7200, test_loss: 0.8793, test_f1: 0.5945
 epoch: 82, train_loss: 0.7100, test_loss: 0.8608, test_f1: 0.5525
 epoch: 83, train_loss: 0.7109, test_loss: 0.9580, test_f1: 0.5237
 epoch: 84, train_loss: 0.6937, test_loss: 0.8741, test_f1: 0.6132
 epoch: 85, train_loss: 0.6935, test_loss: 0.8849, test_f1: 0.5710
 epoch: 86, train_loss: 0.7004, test_loss: 0.8857, test_f1: 0.5520
 epoch: 87, train_loss: 0.6956, test_loss: 0.8904, test_f1: 0.5597
 epoch: 88, train_loss: 0.6873, test_loss: 0.8505, test_f1: 0.6350
 epoch: 89, train_loss: 0.6971, test_loss: 0.8555, test_f1: 0.6002
 epoch: 90, train_loss: 0.6880, test_loss: 0.9556, test_f1: 0.5850
 epoch: 91, train_loss: 0.7142, test_loss: 0.9136, test_f1: 0.5612
 epoch: 92, train_loss: 0.6903, test_loss: 0.8579, test_f1: 0.5931
 epoch: 93, train_loss: 0.6886, test_loss: 0.8477, test_f1: 0.5710
 epoch: 94, train_loss: 0.6912, test_loss: 0.8729, test_f1: 0.5741
 epoch: 95, train_loss: 0.6965, test_loss: 0.8609, test_f1: 0.5809
 epoch: 96, train_loss: 0.6849, test_loss: 0.9201, test_f1: 0.5721
 epoch: 97, train_loss: 0.6915, test_loss: 0.8574, test_f1: 0.5780
 epoch: 98, train_loss: 0.6824, test_loss: 0.8829, test_f1: 0.5824
 epoch: 99, train_loss: 0.6868, test_loss: 0.8957, test_f1: 0.6092

Training completed in 620.09 seconds
Best F1: 0.6525 at epoch 93
Mean F1 across iterations: 0.6218  0.0189
========================FINAL RESULTS================================
FEGIN weighted F1: 0.6525  0.0189
python main.py --data ltspice_examples --representation component_pin --model FEGIN --layers 3 --hiddens 16 --batch_size 128 --lr 0.01 --emb_size 250 --epochs 100 --save_appendix component_pin_L3_H16_BS128_LR0.01_E250 --no_val
-----



STDERR:
  File "main.py", line 370, in <module>
    main()
  File "main.py", line 254, in main
    dataset = dataset_class(
  File "/home/philip/projects/llm_inference_code_repo/Circuit-Completion-Using-GNNs/component_classification_with_link_prediction_head/evaluation/FEGIN/kernel/circuit_datasets.py", line 15, in __init__
    self.data, self.slices = torch.load(self.processed_paths[0])
  File "/home/philip/.local/lib/python3.8/site-packages/torch/serialization.py", line 1040, in load
    warnings.warn(
  File "/usr/lib/python3.8/warnings.py", line 109, in _showwarnmsg
    sw(msg.message, msg.category, msg.filename, msg.lineno,
  File "main.py", line 47, in warn_with_traceback
    traceback.print_stack(file=log)
/home/philip/projects/llm_inference_code_repo/Circuit-Completion-Using-GNNs/component_classification_with_link_prediction_head/evaluation/FEGIN/kernel/circuit_datasets.py:15: FutureWarning: You are using `torch.load` with `weights_only=False` (the current default value), which uses the default pickle module implicitly. It is possible to construct malicious pickle data which will execute arbitrary code during unpickling (See https://github.com/pytorch/pytorch/blob/main/SECURITY.md#untrusted-models for more details). In a future release, the default value for `weights_only` will be flipped to `True`. This limits the functions that could be executed during unpickling. Arbitrary objects will no longer be allowed to be loaded via this mode unless they are explicitly allowlisted by the user via `torch.serialization.add_safe_globals`. We recommend you start setting `weights_only=True` for any use case where you don't have full control of the loaded file. Please open an issue on GitHub for any issues related to this experimental feature.
  self.data, self.slices = torch.load(self.processed_paths[0])
