STDOUT:
Results will be saved in /home/philip/projects/ltspice_examples_code_repo/Circuit-Completion-Using-GNNs/component_classification_with_link_prediction_head/evaluation/FEGIN/results/model_FEGIN_dataset_ltspice_demos
Command line input: python main.py --data ltspice_demos --representation component_pin_net --model FEGIN --layers 4 --hiddens 32 --batch_size 64 --lr 0.001 --emb_size 512 --epochs 100 --save_appendix component_pin_net_L4_H32_BS64_LR0.001_E512 --no_val
 is saved.
-----
ltspice_demos - FEGIN
Using 4 layers, 32 hidden units, h = 2
Loading component_pin_net representation dataset
ENTERED
Training FEGIN on component_pin_net representation
Train: 1565, Test: 383
##################ITERATION #0 ****************************************
 epoch: 0, train_loss: 1.2858, test_loss: 1.3101, test_f1: 0.2281
 epoch: 1, train_loss: 1.1972, test_loss: 1.2515, test_f1: 0.3350
 epoch: 2, train_loss: 1.1322, test_loss: 1.1928, test_f1: 0.4313
 epoch: 3, train_loss: 1.0725, test_loss: 1.1519, test_f1: 0.4485
 epoch: 4, train_loss: 1.0425, test_loss: 1.1300, test_f1: 0.4462
 epoch: 5, train_loss: 1.0181, test_loss: 1.1034, test_f1: 0.4535
 epoch: 6, train_loss: 1.0034, test_loss: 1.1183, test_f1: 0.4473
 epoch: 7, train_loss: 0.9950, test_loss: 1.1027, test_f1: 0.4457
 epoch: 8, train_loss: 0.9778, test_loss: 1.1126, test_f1: 0.4462
 epoch: 9, train_loss: 0.9761, test_loss: 1.0890, test_f1: 0.4564
 epoch: 10, train_loss: 0.9644, test_loss: 1.0975, test_f1: 0.4535
 epoch: 11, train_loss: 0.9478, test_loss: 1.0702, test_f1: 0.4749
 epoch: 12, train_loss: 0.9383, test_loss: 1.0579, test_f1: 0.4974
 epoch: 13, train_loss: 0.9423, test_loss: 1.0780, test_f1: 0.4893
 epoch: 14, train_loss: 0.9335, test_loss: 1.0450, test_f1: 0.5167
 epoch: 15, train_loss: 0.9216, test_loss: 1.0823, test_f1: 0.5244
 epoch: 16, train_loss: 0.9206, test_loss: 1.0652, test_f1: 0.5393
 epoch: 17, train_loss: 0.9095, test_loss: 1.0711, test_f1: 0.5150
 epoch: 18, train_loss: 0.8977, test_loss: 1.0671, test_f1: 0.5409
 epoch: 19, train_loss: 0.8852, test_loss: 1.0428, test_f1: 0.5470
 epoch: 20, train_loss: 0.8958, test_loss: 1.0587, test_f1: 0.5302
 epoch: 21, train_loss: 0.8717, test_loss: 1.0381, test_f1: 0.5771
 epoch: 22, train_loss: 0.8626, test_loss: 1.0580, test_f1: 0.5599
 epoch: 23, train_loss: 0.8365, test_loss: 1.0266, test_f1: 0.5940
 epoch: 24, train_loss: 0.8417, test_loss: 1.0684, test_f1: 0.5871
 epoch: 25, train_loss: 0.8262, test_loss: 1.0747, test_f1: 0.5981
 epoch: 26, train_loss: 0.8188, test_loss: 1.0574, test_f1: 0.5781
 epoch: 27, train_loss: 0.8199, test_loss: 1.0109, test_f1: 0.5769
 epoch: 28, train_loss: 0.8374, test_loss: 1.0666, test_f1: 0.6059
 epoch: 29, train_loss: 0.8191, test_loss: 1.0355, test_f1: 0.5986
 epoch: 30, train_loss: 0.8060, test_loss: 1.0435, test_f1: 0.5929
 epoch: 31, train_loss: 0.7978, test_loss: 1.0390, test_f1: 0.5529
 epoch: 32, train_loss: 0.7797, test_loss: 0.9784, test_f1: 0.5854
 epoch: 33, train_loss: 0.7455, test_loss: 0.9844, test_f1: 0.6390
 epoch: 34, train_loss: 0.7408, test_loss: 0.9710, test_f1: 0.5628
 epoch: 35, train_loss: 0.7505, test_loss: 1.0026, test_f1: 0.5994
 epoch: 36, train_loss: 0.7587, test_loss: 1.0041, test_f1: 0.6113
 epoch: 37, train_loss: 0.7393, test_loss: 1.0658, test_f1: 0.5709
 epoch: 38, train_loss: 0.7185, test_loss: 1.1063, test_f1: 0.5996
 epoch: 39, train_loss: 0.7060, test_loss: 0.9711, test_f1: 0.6242
 epoch: 40, train_loss: 0.6936, test_loss: 0.9512, test_f1: 0.6556
 epoch: 41, train_loss: 0.6673, test_loss: 1.0073, test_f1: 0.5938
 epoch: 42, train_loss: 0.6754, test_loss: 1.0892, test_f1: 0.6335
 epoch: 43, train_loss: 0.6664, test_loss: 1.1000, test_f1: 0.6055
 epoch: 44, train_loss: 0.6573, test_loss: 1.0118, test_f1: 0.6409
 epoch: 45, train_loss: 0.6628, test_loss: 1.0611, test_f1: 0.6165
 epoch: 46, train_loss: 0.6177, test_loss: 1.0242, test_f1: 0.5862
 epoch: 47, train_loss: 0.6296, test_loss: 1.1408, test_f1: 0.5593
 epoch: 48, train_loss: 0.6386, test_loss: 1.2925, test_f1: 0.5498
 epoch: 49, train_loss: 0.6426, test_loss: 1.0866, test_f1: 0.5949
 epoch: 50, train_loss: 0.6064, test_loss: 1.0865, test_f1: 0.6476
 epoch: 51, train_loss: 0.5761, test_loss: 1.0575, test_f1: 0.6243
 epoch: 52, train_loss: 0.5715, test_loss: 1.0404, test_f1: 0.6330
 epoch: 53, train_loss: 0.5526, test_loss: 1.0480, test_f1: 0.6566
 epoch: 54, train_loss: 0.5470, test_loss: 1.0788, test_f1: 0.6347
 epoch: 55, train_loss: 0.5302, test_loss: 1.1000, test_f1: 0.5924
 epoch: 56, train_loss: 0.5166, test_loss: 1.1368, test_f1: 0.6543
 epoch: 57, train_loss: 0.5233, test_loss: 1.0988, test_f1: 0.6305
 epoch: 58, train_loss: 0.5349, test_loss: 1.1307, test_f1: 0.6103
 epoch: 59, train_loss: 0.5235, test_loss: 1.1208, test_f1: 0.6169
 epoch: 60, train_loss: 0.5153, test_loss: 1.1291, test_f1: 0.6322
 epoch: 61, train_loss: 0.5021, test_loss: 1.1921, test_f1: 0.6069
 epoch: 62, train_loss: 0.4843, test_loss: 1.1488, test_f1: 0.6412
 epoch: 63, train_loss: 0.5116, test_loss: 1.1982, test_f1: 0.6174
 epoch: 64, train_loss: 0.5093, test_loss: 1.2034, test_f1: 0.6290
 epoch: 65, train_loss: 0.5008, test_loss: 1.1820, test_f1: 0.6227
 epoch: 66, train_loss: 0.4854, test_loss: 1.1847, test_f1: 0.6326
 epoch: 67, train_loss: 0.4755, test_loss: 1.2862, test_f1: 0.5469
 epoch: 68, train_loss: 0.4534, test_loss: 1.2272, test_f1: 0.5818
 epoch: 69, train_loss: 0.4660, test_loss: 1.3337, test_f1: 0.5947
 epoch: 70, train_loss: 0.4624, test_loss: 1.1617, test_f1: 0.6218
 epoch: 71, train_loss: 0.4483, test_loss: 1.3572, test_f1: 0.5944
 epoch: 72, train_loss: 0.4369, test_loss: 1.4695, test_f1: 0.5625
 epoch: 73, train_loss: 0.4544, test_loss: 1.2746, test_f1: 0.6209
 epoch: 74, train_loss: 0.4480, test_loss: 1.2951, test_f1: 0.5624
 epoch: 75, train_loss: 0.4339, test_loss: 1.3320, test_f1: 0.5936
 epoch: 76, train_loss: 0.4240, test_loss: 1.3444, test_f1: 0.6004
 epoch: 77, train_loss: 0.4468, test_loss: 1.3487, test_f1: 0.5806
 epoch: 78, train_loss: 0.4179, test_loss: 1.4624, test_f1: 0.5744
 epoch: 79, train_loss: 0.4137, test_loss: 1.3559, test_f1: 0.6200
 epoch: 80, train_loss: 0.4353, test_loss: 1.4740, test_f1: 0.5354
 epoch: 81, train_loss: 0.4231, test_loss: 1.5304, test_f1: 0.5888
 epoch: 82, train_loss: 0.4077, test_loss: 1.4066, test_f1: 0.5728
 epoch: 83, train_loss: 0.4079, test_loss: 1.3353, test_f1: 0.6345
 epoch: 84, train_loss: 0.4071, test_loss: 1.4380, test_f1: 0.5558
 epoch: 85, train_loss: 0.3856, test_loss: 1.6215, test_f1: 0.5704
 epoch: 86, train_loss: 0.3816, test_loss: 1.6158, test_f1: 0.5338
 epoch: 87, train_loss: 0.3906, test_loss: 1.6085, test_f1: 0.5848
 epoch: 88, train_loss: 0.4002, test_loss: 1.5425, test_f1: 0.5875
 epoch: 89, train_loss: 0.3736, test_loss: 1.5364, test_f1: 0.5931
 epoch: 90, train_loss: 0.3846, test_loss: 1.5873, test_f1: 0.5839
 epoch: 91, train_loss: 0.3602, test_loss: 1.5686, test_f1: 0.5835
 epoch: 92, train_loss: 0.3605, test_loss: 1.6231, test_f1: 0.5760
 epoch: 93, train_loss: 0.3723, test_loss: 1.5516, test_f1: 0.5872
 epoch: 94, train_loss: 0.3530, test_loss: 1.6292, test_f1: 0.5941
 epoch: 95, train_loss: 0.3592, test_loss: 1.8171, test_f1: 0.6001
 epoch: 96, train_loss: 0.3643, test_loss: 1.6781, test_f1: 0.6065
 epoch: 97, train_loss: 0.3441, test_loss: 1.8035, test_f1: 0.5879
 epoch: 98, train_loss: 0.3685, test_loss: 1.7508, test_f1: 0.5752
 epoch: 99, train_loss: 0.3389, test_loss: 1.5897, test_f1: 0.5864
##################ITERATION #1 ****************************************
 epoch: 0, train_loss: 1.1755, test_loss: 1.3172, test_f1: 0.2799
 epoch: 1, train_loss: 1.0712, test_loss: 1.1905, test_f1: 0.3967
 epoch: 2, train_loss: 1.0227, test_loss: 1.0940, test_f1: 0.4819
 epoch: 3, train_loss: 0.9997, test_loss: 1.0832, test_f1: 0.4945
 epoch: 4, train_loss: 0.9725, test_loss: 1.0601, test_f1: 0.5282
 epoch: 5, train_loss: 0.9626, test_loss: 1.0371, test_f1: 0.5206
 epoch: 6, train_loss: 0.9362, test_loss: 1.0727, test_f1: 0.5296
 epoch: 7, train_loss: 0.9274, test_loss: 1.0433, test_f1: 0.5153
 epoch: 8, train_loss: 0.9160, test_loss: 1.0336, test_f1: 0.5543
 epoch: 9, train_loss: 0.8951, test_loss: 1.0319, test_f1: 0.5436
 epoch: 10, train_loss: 0.8910, test_loss: 1.0251, test_f1: 0.5409
 epoch: 11, train_loss: 0.8762, test_loss: 0.9940, test_f1: 0.5612
 epoch: 12, train_loss: 0.8605, test_loss: 1.0691, test_f1: 0.5102
 epoch: 13, train_loss: 0.8606, test_loss: 1.0108, test_f1: 0.5599
 epoch: 14, train_loss: 0.8230, test_loss: 1.0370, test_f1: 0.5560
 epoch: 15, train_loss: 0.8235, test_loss: 1.0676, test_f1: 0.5446
 epoch: 16, train_loss: 0.8350, test_loss: 1.0166, test_f1: 0.5880
 epoch: 17, train_loss: 0.7906, test_loss: 1.0220, test_f1: 0.6089
 epoch: 18, train_loss: 0.7998, test_loss: 1.0413, test_f1: 0.5511
 epoch: 19, train_loss: 0.7826, test_loss: 1.0196, test_f1: 0.5464
 epoch: 20, train_loss: 0.7756, test_loss: 1.0507, test_f1: 0.5604
 epoch: 21, train_loss: 0.7558, test_loss: 1.0428, test_f1: 0.5634
 epoch: 22, train_loss: 0.7528, test_loss: 1.0418, test_f1: 0.5767
 epoch: 23, train_loss: 0.7373, test_loss: 1.0252, test_f1: 0.5859
 epoch: 24, train_loss: 0.7232, test_loss: 1.0067, test_f1: 0.6133
 epoch: 25, train_loss: 0.7240, test_loss: 1.0734, test_f1: 0.5820
 epoch: 26, train_loss: 0.6983, test_loss: 1.0737, test_f1: 0.5701
 epoch: 27, train_loss: 0.6812, test_loss: 1.1101, test_f1: 0.5656
 epoch: 28, train_loss: 0.6683, test_loss: 1.0698, test_f1: 0.5972
 epoch: 29, train_loss: 0.6721, test_loss: 1.0748, test_f1: 0.5717
 epoch: 30, train_loss: 0.6980, test_loss: 1.1517, test_f1: 0.5772
 epoch: 31, train_loss: 0.6628, test_loss: 1.0488, test_f1: 0.6017
 epoch: 32, train_loss: 0.6680, test_loss: 1.1172, test_f1: 0.5587
 epoch: 33, train_loss: 0.6700, test_loss: 1.1038, test_f1: 0.5767
 epoch: 34, train_loss: 0.6518, test_loss: 1.1542, test_f1: 0.5792
 epoch: 35, train_loss: 0.6441, test_loss: 1.2381, test_f1: 0.5673
 epoch: 36, train_loss: 0.6329, test_loss: 1.1368, test_f1: 0.5933
 epoch: 37, train_loss: 0.6320, test_loss: 1.1576, test_f1: 0.6111
 epoch: 38, train_loss: 0.6342, test_loss: 1.1659, test_f1: 0.6112
 epoch: 39, train_loss: 0.5923, test_loss: 1.2023, test_f1: 0.5872
 epoch: 40, train_loss: 0.6001, test_loss: 1.2260, test_f1: 0.5993
 epoch: 41, train_loss: 0.6150, test_loss: 1.1584, test_f1: 0.5961
 epoch: 42, train_loss: 0.5935, test_loss: 1.2461, test_f1: 0.6033
 epoch: 43, train_loss: 0.5818, test_loss: 1.2202, test_f1: 0.5829
 epoch: 44, train_loss: 0.5760, test_loss: 1.2446, test_f1: 0.5700
 epoch: 45, train_loss: 0.5762, test_loss: 1.3593, test_f1: 0.5709
 epoch: 46, train_loss: 0.6202, test_loss: 1.3578, test_f1: 0.5850
 epoch: 47, train_loss: 0.5919, test_loss: 1.2495, test_f1: 0.5533
 epoch: 48, train_loss: 0.5797, test_loss: 1.2239, test_f1: 0.5873
 epoch: 49, train_loss: 0.5494, test_loss: 1.3350, test_f1: 0.5488
 epoch: 50, train_loss: 0.5498, test_loss: 1.2867, test_f1: 0.5902
 epoch: 51, train_loss: 0.5260, test_loss: 1.2176, test_f1: 0.5996
 epoch: 52, train_loss: 0.5179, test_loss: 1.3139, test_f1: 0.5994
 epoch: 53, train_loss: 0.4987, test_loss: 1.3173, test_f1: 0.5835
 epoch: 54, train_loss: 0.4964, test_loss: 1.2671, test_f1: 0.6094
 epoch: 55, train_loss: 0.4754, test_loss: 1.3663, test_f1: 0.5975
 epoch: 56, train_loss: 0.4842, test_loss: 1.4138, test_f1: 0.5599
 epoch: 57, train_loss: 0.4637, test_loss: 1.3711, test_f1: 0.5902
 epoch: 58, train_loss: 0.4759, test_loss: 1.3529, test_f1: 0.5885
 epoch: 59, train_loss: 0.4587, test_loss: 1.3377, test_f1: 0.5725
 epoch: 60, train_loss: 0.4686, test_loss: 1.3890, test_f1: 0.5993
 epoch: 61, train_loss: 0.4637, test_loss: 1.4644, test_f1: 0.5765
 epoch: 62, train_loss: 0.4689, test_loss: 1.4145, test_f1: 0.5604
 epoch: 63, train_loss: 0.4467, test_loss: 1.4848, test_f1: 0.5686
 epoch: 64, train_loss: 0.4407, test_loss: 1.4723, test_f1: 0.5942
 epoch: 65, train_loss: 0.4592, test_loss: 1.4534, test_f1: 0.5629
 epoch: 66, train_loss: 0.4245, test_loss: 1.5152, test_f1: 0.5751
 epoch: 67, train_loss: 0.4501, test_loss: 1.4881, test_f1: 0.5686
 epoch: 68, train_loss: 0.4274, test_loss: 1.4709, test_f1: 0.5677
 epoch: 69, train_loss: 0.4241, test_loss: 1.5239, test_f1: 0.5497
 epoch: 70, train_loss: 0.4332, test_loss: 1.5016, test_f1: 0.5827
 epoch: 71, train_loss: 0.4114, test_loss: 1.5766, test_f1: 0.5805
 epoch: 72, train_loss: 0.4233, test_loss: 1.5125, test_f1: 0.5655
 epoch: 73, train_loss: 0.4176, test_loss: 1.7586, test_f1: 0.5433
 epoch: 74, train_loss: 0.4019, test_loss: 1.6130, test_f1: 0.5604
 epoch: 75, train_loss: 0.3917, test_loss: 1.6181, test_f1: 0.5998
 epoch: 76, train_loss: 0.4276, test_loss: 1.6046, test_f1: 0.6076
 epoch: 77, train_loss: 0.3908, test_loss: 1.5752, test_f1: 0.5366
 epoch: 78, train_loss: 0.3939, test_loss: 1.5932, test_f1: 0.5642
 epoch: 79, train_loss: 0.3960, test_loss: 1.6568, test_f1: 0.5435
 epoch: 80, train_loss: 0.4093, test_loss: 1.5732, test_f1: 0.5886
 epoch: 81, train_loss: 0.3823, test_loss: 1.7429, test_f1: 0.5553
 epoch: 82, train_loss: 0.4224, test_loss: 1.6073, test_f1: 0.5530
 epoch: 83, train_loss: 0.3812, test_loss: 1.5827, test_f1: 0.5750
 epoch: 84, train_loss: 0.3805, test_loss: 1.6244, test_f1: 0.5849
 epoch: 85, train_loss: 0.3769, test_loss: 1.6131, test_f1: 0.5629
 epoch: 86, train_loss: 0.3756, test_loss: 1.7120, test_f1: 0.5645
 epoch: 87, train_loss: 0.3621, test_loss: 1.7688, test_f1: 0.5721
 epoch: 88, train_loss: 0.3618, test_loss: 1.7799, test_f1: 0.5531
 epoch: 89, train_loss: 0.3760, test_loss: 1.6618, test_f1: 0.5585
 epoch: 90, train_loss: 0.3694, test_loss: 1.6749, test_f1: 0.5567
 epoch: 91, train_loss: 0.3762, test_loss: 1.7931, test_f1: 0.5771
 epoch: 92, train_loss: 0.3455, test_loss: 1.7245, test_f1: 0.5857
 epoch: 93, train_loss: 0.3587, test_loss: 1.8530, test_f1: 0.5549
 epoch: 94, train_loss: 0.3471, test_loss: 1.7413, test_f1: 0.5520
 epoch: 95, train_loss: 0.3505, test_loss: 1.7523, test_f1: 0.5538
 epoch: 96, train_loss: 0.3464, test_loss: 1.7943, test_f1: 0.5719
 epoch: 97, train_loss: 0.3362, test_loss: 1.7748, test_f1: 0.5814
 epoch: 98, train_loss: 0.3529, test_loss: 1.7985, test_f1: 0.5555
 epoch: 99, train_loss: 0.3625, test_loss: 1.8897, test_f1: 0.5681
##################ITERATION #2 ****************************************
 epoch: 0, train_loss: 1.1644, test_loss: 1.2743, test_f1: 0.2281
 epoch: 1, train_loss: 1.0329, test_loss: 1.1884, test_f1: 0.4667
 epoch: 2, train_loss: 0.9919, test_loss: 1.0449, test_f1: 0.5033
 epoch: 3, train_loss: 0.9496, test_loss: 1.0487, test_f1: 0.5504
 epoch: 4, train_loss: 0.9289, test_loss: 1.0249, test_f1: 0.5092
 epoch: 5, train_loss: 0.8959, test_loss: 1.0303, test_f1: 0.5493
 epoch: 6, train_loss: 0.8899, test_loss: 1.0198, test_f1: 0.5345
 epoch: 7, train_loss: 0.8678, test_loss: 1.0237, test_f1: 0.5686
 epoch: 8, train_loss: 0.8508, test_loss: 1.0442, test_f1: 0.5600
 epoch: 9, train_loss: 0.8191, test_loss: 1.0294, test_f1: 0.6100
 epoch: 10, train_loss: 0.8230, test_loss: 1.0270, test_f1: 0.5970
 epoch: 11, train_loss: 0.7981, test_loss: 1.0537, test_f1: 0.5752
 epoch: 12, train_loss: 0.8018, test_loss: 1.0601, test_f1: 0.5443
 epoch: 13, train_loss: 0.7654, test_loss: 1.0430, test_f1: 0.5562
 epoch: 14, train_loss: 0.7613, test_loss: 1.0496, test_f1: 0.6111
 epoch: 15, train_loss: 0.7433, test_loss: 1.0689, test_f1: 0.5986
 epoch: 16, train_loss: 0.7200, test_loss: 1.0623, test_f1: 0.5854
 epoch: 17, train_loss: 0.7115, test_loss: 1.0053, test_f1: 0.5983
 epoch: 18, train_loss: 0.6930, test_loss: 1.0503, test_f1: 0.6169
 epoch: 19, train_loss: 0.7009, test_loss: 1.0121, test_f1: 0.6044
 epoch: 20, train_loss: 0.6981, test_loss: 1.0880, test_f1: 0.5925
 epoch: 21, train_loss: 0.6752, test_loss: 1.0699, test_f1: 0.6397
 epoch: 22, train_loss: 0.6753, test_loss: 1.0363, test_f1: 0.6136
 epoch: 23, train_loss: 0.6519, test_loss: 1.0939, test_f1: 0.5968
 epoch: 24, train_loss: 0.6437, test_loss: 1.0720, test_f1: 0.5916
 epoch: 25, train_loss: 0.6375, test_loss: 1.0060, test_f1: 0.6166
 epoch: 26, train_loss: 0.6214, test_loss: 1.0359, test_f1: 0.6373
 epoch: 27, train_loss: 0.6298, test_loss: 1.0875, test_f1: 0.6167
 epoch: 28, train_loss: 0.6278, test_loss: 1.0951, test_f1: 0.6205
 epoch: 29, train_loss: 0.6448, test_loss: 1.0686, test_f1: 0.6083
 epoch: 30, train_loss: 0.6051, test_loss: 1.0711, test_f1: 0.6263
 epoch: 31, train_loss: 0.6036, test_loss: 1.0263, test_f1: 0.6238
 epoch: 32, train_loss: 0.5926, test_loss: 1.0724, test_f1: 0.6309
 epoch: 33, train_loss: 0.5928, test_loss: 1.0779, test_f1: 0.6305
 epoch: 34, train_loss: 0.5706, test_loss: 1.1785, test_f1: 0.5860
 epoch: 35, train_loss: 0.5937, test_loss: 1.1296, test_f1: 0.5920
 epoch: 36, train_loss: 0.5806, test_loss: 1.0643, test_f1: 0.6712
 epoch: 37, train_loss: 0.5594, test_loss: 1.0930, test_f1: 0.6333
 epoch: 38, train_loss: 0.5600, test_loss: 1.1041, test_f1: 0.6126
 epoch: 39, train_loss: 0.5305, test_loss: 1.0879, test_f1: 0.6368
 epoch: 40, train_loss: 0.5104, test_loss: 1.2242, test_f1: 0.6055
 epoch: 41, train_loss: 0.5098, test_loss: 1.1430, test_f1: 0.6596
 epoch: 42, train_loss: 0.5126, test_loss: 1.2535, test_f1: 0.5919
 epoch: 43, train_loss: 0.5046, test_loss: 1.2238, test_f1: 0.6410
 epoch: 44, train_loss: 0.5224, test_loss: 1.2249, test_f1: 0.6360
 epoch: 45, train_loss: 0.4951, test_loss: 1.2656, test_f1: 0.6276
 epoch: 46, train_loss: 0.4766, test_loss: 1.2196, test_f1: 0.6335
 epoch: 47, train_loss: 0.4900, test_loss: 1.3022, test_f1: 0.6293
 epoch: 48, train_loss: 0.4858, test_loss: 1.2231, test_f1: 0.6385
 epoch: 49, train_loss: 0.4777, test_loss: 1.2472, test_f1: 0.6172
 epoch: 50, train_loss: 0.4850, test_loss: 1.2780, test_f1: 0.6036
 epoch: 51, train_loss: 0.4409, test_loss: 1.2638, test_f1: 0.6207
 epoch: 52, train_loss: 0.4201, test_loss: 1.2658, test_f1: 0.6336
 epoch: 53, train_loss: 0.4105, test_loss: 1.3145, test_f1: 0.6326
 epoch: 54, train_loss: 0.4221, test_loss: 1.3681, test_f1: 0.6083
 epoch: 55, train_loss: 0.4064, test_loss: 1.3316, test_f1: 0.6055
 epoch: 56, train_loss: 0.4098, test_loss: 1.3992, test_f1: 0.6332
 epoch: 57, train_loss: 0.3938, test_loss: 1.3404, test_f1: 0.6260
 epoch: 58, train_loss: 0.3904, test_loss: 1.4173, test_f1: 0.6192
 epoch: 59, train_loss: 0.4001, test_loss: 1.4147, test_f1: 0.6134
 epoch: 60, train_loss: 0.3997, test_loss: 1.4989, test_f1: 0.6377
 epoch: 61, train_loss: 0.3815, test_loss: 1.3933, test_f1: 0.6292
 epoch: 62, train_loss: 0.3899, test_loss: 1.4145, test_f1: 0.6440
 epoch: 63, train_loss: 0.3747, test_loss: 1.4615, test_f1: 0.6287
 epoch: 64, train_loss: 0.3569, test_loss: 1.5601, test_f1: 0.6155
 epoch: 65, train_loss: 0.3758, test_loss: 1.5515, test_f1: 0.6258
 epoch: 66, train_loss: 0.3519, test_loss: 1.5172, test_f1: 0.6154
 epoch: 67, train_loss: 0.3472, test_loss: 1.5830, test_f1: 0.6149
 epoch: 68, train_loss: 0.3503, test_loss: 1.5965, test_f1: 0.6171
 epoch: 69, train_loss: 0.3540, test_loss: 1.5706, test_f1: 0.6242
 epoch: 70, train_loss: 0.3703, test_loss: 1.6132, test_f1: 0.6032
 epoch: 71, train_loss: 0.3738, test_loss: 1.6380, test_f1: 0.6153
 epoch: 72, train_loss: 0.3769, test_loss: 1.5576, test_f1: 0.5960
 epoch: 73, train_loss: 0.3791, test_loss: 1.5463, test_f1: 0.6217
 epoch: 74, train_loss: 0.3344, test_loss: 1.6076, test_f1: 0.6165
 epoch: 75, train_loss: 0.3400, test_loss: 1.6182, test_f1: 0.6174
 epoch: 76, train_loss: 0.3131, test_loss: 1.7296, test_f1: 0.5947
 epoch: 77, train_loss: 0.3218, test_loss: 1.6672, test_f1: 0.6286
 epoch: 78, train_loss: 0.3301, test_loss: 1.6738, test_f1: 0.6157
 epoch: 79, train_loss: 0.3313, test_loss: 1.6730, test_f1: 0.6020
 epoch: 80, train_loss: 0.3104, test_loss: 1.6644, test_f1: 0.6053
 epoch: 81, train_loss: 0.3186, test_loss: 1.7069, test_f1: 0.6126
 epoch: 82, train_loss: 0.3148, test_loss: 1.7012, test_f1: 0.6249
 epoch: 83, train_loss: 0.3541, test_loss: 1.7294, test_f1: 0.6164
 epoch: 84, train_loss: 0.3301, test_loss: 1.7485, test_f1: 0.6282
 epoch: 85, train_loss: 0.3391, test_loss: 1.8280, test_f1: 0.5797
 epoch: 86, train_loss: 0.3289, test_loss: 1.7256, test_f1: 0.6010
 epoch: 87, train_loss: 0.3210, test_loss: 1.7616, test_f1: 0.6107
 epoch: 88, train_loss: 0.3100, test_loss: 1.8427, test_f1: 0.5925
 epoch: 89, train_loss: 0.2982, test_loss: 1.8056, test_f1: 0.6165
 epoch: 90, train_loss: 0.2971, test_loss: 1.7705, test_f1: 0.5840
 epoch: 91, train_loss: 0.2969, test_loss: 1.8410, test_f1: 0.5950
 epoch: 92, train_loss: 0.2912, test_loss: 1.8147, test_f1: 0.6198
 epoch: 93, train_loss: 0.2792, test_loss: 1.8461, test_f1: 0.6278
 epoch: 94, train_loss: 0.2920, test_loss: 1.8506, test_f1: 0.6253
 epoch: 95, train_loss: 0.3103, test_loss: 1.8503, test_f1: 0.6044
 epoch: 96, train_loss: 0.2904, test_loss: 1.9661, test_f1: 0.6138
 epoch: 97, train_loss: 0.2983, test_loss: 1.8323, test_f1: 0.6193
 epoch: 98, train_loss: 0.2693, test_loss: 2.0274, test_f1: 0.5895
 epoch: 99, train_loss: 0.2644, test_loss: 1.9902, test_f1: 0.6080
##################ITERATION #3 ****************************************
 epoch: 0, train_loss: 1.1159, test_loss: 1.4037, test_f1: 0.2281
 epoch: 1, train_loss: 1.0185, test_loss: 1.6311, test_f1: 0.1681
 epoch: 2, train_loss: 0.9944, test_loss: 1.1293, test_f1: 0.4540
 epoch: 3, train_loss: 0.9585, test_loss: 1.0555, test_f1: 0.5170
 epoch: 4, train_loss: 0.9482, test_loss: 1.0281, test_f1: 0.5384
 epoch: 5, train_loss: 0.9427, test_loss: 1.0190, test_f1: 0.5580
 epoch: 6, train_loss: 0.9244, test_loss: 1.0221, test_f1: 0.5687
 epoch: 7, train_loss: 0.9174, test_loss: 1.0242, test_f1: 0.5498
 epoch: 8, train_loss: 0.8983, test_loss: 1.0281, test_f1: 0.5706
 epoch: 9, train_loss: 0.8822, test_loss: 1.0045, test_f1: 0.5855
 epoch: 10, train_loss: 0.8893, test_loss: 1.0101, test_f1: 0.5871
 epoch: 11, train_loss: 0.8693, test_loss: 1.0801, test_f1: 0.5310
 epoch: 12, train_loss: 0.8618, test_loss: 0.9939, test_f1: 0.5615
 epoch: 13, train_loss: 0.8467, test_loss: 1.0470, test_f1: 0.5491
 epoch: 14, train_loss: 0.8430, test_loss: 1.0056, test_f1: 0.5818
 epoch: 15, train_loss: 0.8396, test_loss: 1.0130, test_f1: 0.6177
 epoch: 16, train_loss: 0.8253, test_loss: 1.0222, test_f1: 0.5921
 epoch: 17, train_loss: 0.8206, test_loss: 1.0316, test_f1: 0.5521
 epoch: 18, train_loss: 0.8045, test_loss: 1.0235, test_f1: 0.5756
 epoch: 19, train_loss: 0.7982, test_loss: 1.1029, test_f1: 0.5155
 epoch: 20, train_loss: 0.7852, test_loss: 1.0517, test_f1: 0.5875
 epoch: 21, train_loss: 0.7592, test_loss: 0.9912, test_f1: 0.5704
 epoch: 22, train_loss: 0.7545, test_loss: 0.9991, test_f1: 0.5762
 epoch: 23, train_loss: 0.7419, test_loss: 1.0307, test_f1: 0.5920
 epoch: 24, train_loss: 0.7205, test_loss: 0.9972, test_f1: 0.5953
 epoch: 25, train_loss: 0.7167, test_loss: 1.0539, test_f1: 0.5838
 epoch: 26, train_loss: 0.7291, test_loss: 1.0327, test_f1: 0.6015
 epoch: 27, train_loss: 0.7110, test_loss: 1.0650, test_f1: 0.5960
 epoch: 28, train_loss: 0.6759, test_loss: 1.1665, test_f1: 0.5561
 epoch: 29, train_loss: 0.6726, test_loss: 1.1722, test_f1: 0.5540
 epoch: 30, train_loss: 0.6804, test_loss: 1.1070, test_f1: 0.6205
 epoch: 31, train_loss: 0.6870, test_loss: 1.1031, test_f1: 0.5653
 epoch: 32, train_loss: 0.6643, test_loss: 1.0911, test_f1: 0.6161
 epoch: 33, train_loss: 0.6437, test_loss: 1.1367, test_f1: 0.5968
 epoch: 34, train_loss: 0.6460, test_loss: 1.2178, test_f1: 0.5689
 epoch: 35, train_loss: 0.6635, test_loss: 1.1984, test_f1: 0.6046
 epoch: 36, train_loss: 0.6483, test_loss: 1.1083, test_f1: 0.6165
 epoch: 37, train_loss: 0.6465, test_loss: 1.2115, test_f1: 0.6010
 epoch: 38, train_loss: 0.5957, test_loss: 1.2887, test_f1: 0.5775
 epoch: 39, train_loss: 0.6069, test_loss: 1.1779, test_f1: 0.5386
 epoch: 40, train_loss: 0.6242, test_loss: 1.2417, test_f1: 0.5793
 epoch: 41, train_loss: 0.6039, test_loss: 1.2837, test_f1: 0.5716
 epoch: 42, train_loss: 0.5879, test_loss: 1.2821, test_f1: 0.5925
 epoch: 43, train_loss: 0.5926, test_loss: 1.2171, test_f1: 0.6091
 epoch: 44, train_loss: 0.5562, test_loss: 1.2508, test_f1: 0.5518
 epoch: 45, train_loss: 0.5575, test_loss: 1.2610, test_f1: 0.5830
 epoch: 46, train_loss: 0.5741, test_loss: 1.2844, test_f1: 0.5807
 epoch: 47, train_loss: 0.5386, test_loss: 1.3966, test_f1: 0.5809
 epoch: 48, train_loss: 0.5581, test_loss: 1.2604, test_f1: 0.5865
 epoch: 49, train_loss: 0.5273, test_loss: 1.4230, test_f1: 0.6233
 epoch: 50, train_loss: 0.5325, test_loss: 1.3339, test_f1: 0.6045
 epoch: 51, train_loss: 0.5255, test_loss: 1.3963, test_f1: 0.5625
 epoch: 52, train_loss: 0.4816, test_loss: 1.4076, test_f1: 0.5789
 epoch: 53, train_loss: 0.4731, test_loss: 1.3684, test_f1: 0.5631
 epoch: 54, train_loss: 0.4514, test_loss: 1.4665, test_f1: 0.5730
 epoch: 55, train_loss: 0.4622, test_loss: 1.5288, test_f1: 0.5349
 epoch: 56, train_loss: 0.4665, test_loss: 1.5155, test_f1: 0.5833
 epoch: 57, train_loss: 0.4326, test_loss: 1.5039, test_f1: 0.5531
 epoch: 58, train_loss: 0.4536, test_loss: 1.5300, test_f1: 0.5681
 epoch: 59, train_loss: 0.4523, test_loss: 1.5940, test_f1: 0.5195
 epoch: 60, train_loss: 0.4529, test_loss: 1.5718, test_f1: 0.5912
 epoch: 61, train_loss: 0.4333, test_loss: 1.6080, test_f1: 0.5560
 epoch: 62, train_loss: 0.4327, test_loss: 1.5775, test_f1: 0.5606
 epoch: 63, train_loss: 0.4352, test_loss: 1.6019, test_f1: 0.5682
 epoch: 64, train_loss: 0.4376, test_loss: 1.7139, test_f1: 0.5413
 epoch: 65, train_loss: 0.4138, test_loss: 1.7417, test_f1: 0.5728
 epoch: 66, train_loss: 0.4466, test_loss: 1.6129, test_f1: 0.5804
 epoch: 67, train_loss: 0.4062, test_loss: 1.6796, test_f1: 0.5876
 epoch: 68, train_loss: 0.4304, test_loss: 1.6709, test_f1: 0.5775
 epoch: 69, train_loss: 0.4163, test_loss: 1.6107, test_f1: 0.5764
 epoch: 70, train_loss: 0.4268, test_loss: 1.7824, test_f1: 0.5268
 epoch: 71, train_loss: 0.4058, test_loss: 1.7529, test_f1: 0.5570
 epoch: 72, train_loss: 0.3819, test_loss: 1.7754, test_f1: 0.5273
 epoch: 73, train_loss: 0.4211, test_loss: 1.7364, test_f1: 0.5417
 epoch: 74, train_loss: 0.4039, test_loss: 1.6583, test_f1: 0.5925
 epoch: 75, train_loss: 0.3728, test_loss: 1.8070, test_f1: 0.5191
 epoch: 76, train_loss: 0.3837, test_loss: 1.8865, test_f1: 0.5500
 epoch: 77, train_loss: 0.4019, test_loss: 1.7626, test_f1: 0.5585
 epoch: 78, train_loss: 0.3999, test_loss: 1.8025, test_f1: 0.5516
 epoch: 79, train_loss: 0.3658, test_loss: 1.7244, test_f1: 0.5450
 epoch: 80, train_loss: 0.3734, test_loss: 1.7480, test_f1: 0.5734
 epoch: 81, train_loss: 0.3927, test_loss: 1.8861, test_f1: 0.5769
 epoch: 82, train_loss: 0.3646, test_loss: 1.9604, test_f1: 0.5527
 epoch: 83, train_loss: 0.3585, test_loss: 1.7671, test_f1: 0.5950
 epoch: 84, train_loss: 0.3527, test_loss: 2.0108, test_f1: 0.5143
 epoch: 85, train_loss: 0.3676, test_loss: 1.8693, test_f1: 0.5730
 epoch: 86, train_loss: 0.3574, test_loss: 1.9296, test_f1: 0.5407
 epoch: 87, train_loss: 0.3417, test_loss: 1.9930, test_f1: 0.5243
 epoch: 88, train_loss: 0.3742, test_loss: 2.0273, test_f1: 0.5410
 epoch: 89, train_loss: 0.3489, test_loss: 1.9492, test_f1: 0.5239
 epoch: 90, train_loss: 0.3502, test_loss: 1.9948, test_f1: 0.5274
 epoch: 91, train_loss: 0.3349, test_loss: 1.9134, test_f1: 0.5788
 epoch: 92, train_loss: 0.3457, test_loss: 2.0186, test_f1: 0.5387
 epoch: 93, train_loss: 0.3341, test_loss: 2.0662, test_f1: 0.5449
 epoch: 94, train_loss: 0.3427, test_loss: 2.0181, test_f1: 0.5771
 epoch: 95, train_loss: 0.3424, test_loss: 1.9987, test_f1: 0.5761
 epoch: 96, train_loss: 0.3310, test_loss: 2.0353, test_f1: 0.5533
 epoch: 97, train_loss: 0.3682, test_loss: 2.1310, test_f1: 0.5125
 epoch: 98, train_loss: 0.3467, test_loss: 2.1251, test_f1: 0.4984
 epoch: 99, train_loss: 0.3374, test_loss: 2.2069, test_f1: 0.4974
##################ITERATION #4 ****************************************
 epoch: 0, train_loss: 1.3077, test_loss: 1.3149, test_f1: 0.2281
 epoch: 1, train_loss: 1.0930, test_loss: 1.1594, test_f1: 0.3344
 epoch: 2, train_loss: 1.0378, test_loss: 1.0797, test_f1: 0.4934
 epoch: 3, train_loss: 1.0032, test_loss: 1.0446, test_f1: 0.5115
 epoch: 4, train_loss: 0.9823, test_loss: 1.0524, test_f1: 0.5080
 epoch: 5, train_loss: 0.9568, test_loss: 1.0324, test_f1: 0.5363
 epoch: 6, train_loss: 0.9365, test_loss: 1.0278, test_f1: 0.5162
 epoch: 7, train_loss: 0.9201, test_loss: 1.0140, test_f1: 0.5437
 epoch: 8, train_loss: 0.8990, test_loss: 1.0188, test_f1: 0.5679
 epoch: 9, train_loss: 0.8974, test_loss: 1.0419, test_f1: 0.5378
 epoch: 10, train_loss: 0.8949, test_loss: 1.0293, test_f1: 0.5591
 epoch: 11, train_loss: 0.8600, test_loss: 1.0191, test_f1: 0.5575
 epoch: 12, train_loss: 0.8561, test_loss: 1.0511, test_f1: 0.5389
 epoch: 13, train_loss: 0.8385, test_loss: 1.0258, test_f1: 0.5456
 epoch: 14, train_loss: 0.8340, test_loss: 1.0295, test_f1: 0.5550
 epoch: 15, train_loss: 0.8127, test_loss: 1.0061, test_f1: 0.5524
 epoch: 16, train_loss: 0.8279, test_loss: 1.0816, test_f1: 0.5342
 epoch: 17, train_loss: 0.8052, test_loss: 1.0355, test_f1: 0.5438
 epoch: 18, train_loss: 0.7661, test_loss: 1.0419, test_f1: 0.5176
 epoch: 19, train_loss: 0.7815, test_loss: 1.0625, test_f1: 0.5588
 epoch: 20, train_loss: 0.7504, test_loss: 1.0721, test_f1: 0.5576
 epoch: 21, train_loss: 0.7435, test_loss: 1.0660, test_f1: 0.5717
 epoch: 22, train_loss: 0.7436, test_loss: 1.0710, test_f1: 0.5309
 epoch: 23, train_loss: 0.7315, test_loss: 1.0709, test_f1: 0.5588
 epoch: 24, train_loss: 0.7195, test_loss: 1.0724, test_f1: 0.5490
 epoch: 25, train_loss: 0.7078, test_loss: 1.0868, test_f1: 0.5208
 epoch: 26, train_loss: 0.7103, test_loss: 1.0629, test_f1: 0.5599
 epoch: 27, train_loss: 0.7098, test_loss: 1.1744, test_f1: 0.5010
 epoch: 28, train_loss: 0.6868, test_loss: 1.1128, test_f1: 0.5209
 epoch: 29, train_loss: 0.6867, test_loss: 1.0930, test_f1: 0.5806
 epoch: 30, train_loss: 0.6708, test_loss: 1.1343, test_f1: 0.5677
 epoch: 31, train_loss: 0.6547, test_loss: 1.1101, test_f1: 0.5481
 epoch: 32, train_loss: 0.6678, test_loss: 1.1058, test_f1: 0.5613
 epoch: 33, train_loss: 0.6573, test_loss: 1.0737, test_f1: 0.5858
 epoch: 34, train_loss: 0.6452, test_loss: 1.1159, test_f1: 0.5803
 epoch: 35, train_loss: 0.6473, test_loss: 1.1115, test_f1: 0.5611
 epoch: 36, train_loss: 0.6170, test_loss: 1.1720, test_f1: 0.5662
 epoch: 37, train_loss: 0.6316, test_loss: 1.1926, test_f1: 0.5662
 epoch: 38, train_loss: 0.6274, test_loss: 1.2325, test_f1: 0.5628
 epoch: 39, train_loss: 0.6210, test_loss: 1.2114, test_f1: 0.5654
 epoch: 40, train_loss: 0.6270, test_loss: 1.1867, test_f1: 0.5298
 epoch: 41, train_loss: 0.5921, test_loss: 1.1772, test_f1: 0.6109
 epoch: 42, train_loss: 0.6062, test_loss: 1.1712, test_f1: 0.5652
 epoch: 43, train_loss: 0.6058, test_loss: 1.2971, test_f1: 0.5472
 epoch: 44, train_loss: 0.5794, test_loss: 1.2333, test_f1: 0.5784
 epoch: 45, train_loss: 0.6039, test_loss: 1.3249, test_f1: 0.5585
 epoch: 46, train_loss: 0.5871, test_loss: 1.3607, test_f1: 0.5492
 epoch: 47, train_loss: 0.5914, test_loss: 1.3149, test_f1: 0.5494
 epoch: 48, train_loss: 0.5545, test_loss: 1.3546, test_f1: 0.5477
 epoch: 49, train_loss: 0.5516, test_loss: 1.3713, test_f1: 0.5509
 epoch: 50, train_loss: 0.5310, test_loss: 1.6331, test_f1: 0.5044
 epoch: 51, train_loss: 0.5113, test_loss: 1.4811, test_f1: 0.5547
 epoch: 52, train_loss: 0.4907, test_loss: 1.3829, test_f1: 0.5881
 epoch: 53, train_loss: 0.4970, test_loss: 1.4813, test_f1: 0.5471
 epoch: 54, train_loss: 0.4778, test_loss: 1.5145, test_f1: 0.5318
 epoch: 55, train_loss: 0.4928, test_loss: 1.4525, test_f1: 0.5600
 epoch: 56, train_loss: 0.4715, test_loss: 1.5159, test_f1: 0.5367
 epoch: 57, train_loss: 0.5014, test_loss: 1.5749, test_f1: 0.5369
 epoch: 58, train_loss: 0.4833, test_loss: 1.5735, test_f1: 0.5359
 epoch: 59, train_loss: 0.4697, test_loss: 1.6121, test_f1: 0.5278
 epoch: 60, train_loss: 0.4392, test_loss: 1.5859, test_f1: 0.5703
 epoch: 61, train_loss: 0.4657, test_loss: 1.6243, test_f1: 0.5746
 epoch: 62, train_loss: 0.4263, test_loss: 1.5651, test_f1: 0.5786
 epoch: 63, train_loss: 0.4358, test_loss: 1.5882, test_f1: 0.5652
 epoch: 64, train_loss: 0.4604, test_loss: 1.6004, test_f1: 0.5693
 epoch: 65, train_loss: 0.4372, test_loss: 1.6326, test_f1: 0.5718
 epoch: 66, train_loss: 0.4174, test_loss: 1.7179, test_f1: 0.5637
 epoch: 67, train_loss: 0.4389, test_loss: 1.6082, test_f1: 0.5837
 epoch: 68, train_loss: 0.4148, test_loss: 1.7623, test_f1: 0.5571
 epoch: 69, train_loss: 0.4243, test_loss: 1.6633, test_f1: 0.5962
 epoch: 70, train_loss: 0.4106, test_loss: 1.7484, test_f1: 0.5672
 epoch: 71, train_loss: 0.4146, test_loss: 1.7409, test_f1: 0.5544
 epoch: 72, train_loss: 0.4035, test_loss: 1.6989, test_f1: 0.5530
 epoch: 73, train_loss: 0.4032, test_loss: 1.7882, test_f1: 0.5823
 epoch: 74, train_loss: 0.3883, test_loss: 1.8438, test_f1: 0.5495
 epoch: 75, train_loss: 0.4027, test_loss: 1.7302, test_f1: 0.5812
 epoch: 76, train_loss: 0.4075, test_loss: 1.6567, test_f1: 0.5987
 epoch: 77, train_loss: 0.3899, test_loss: 1.7363, test_f1: 0.5591
 epoch: 78, train_loss: 0.3973, test_loss: 1.8575, test_f1: 0.5422
 epoch: 79, train_loss: 0.3763, test_loss: 1.7690, test_f1: 0.5514
 epoch: 80, train_loss: 0.4174, test_loss: 1.8450, test_f1: 0.5672
 epoch: 81, train_loss: 0.3960, test_loss: 1.7103, test_f1: 0.5784
 epoch: 82, train_loss: 0.3921, test_loss: 1.9224, test_f1: 0.5606
 epoch: 83, train_loss: 0.4100, test_loss: 2.0121, test_f1: 0.5412
 epoch: 84, train_loss: 0.3644, test_loss: 2.0272, test_f1: 0.5401
 epoch: 85, train_loss: 0.3702, test_loss: 1.9050, test_f1: 0.5558
 epoch: 86, train_loss: 0.3832, test_loss: 2.0589, test_f1: 0.5563
 epoch: 87, train_loss: 0.3769, test_loss: 1.9232, test_f1: 0.5714
 epoch: 88, train_loss: 0.3557, test_loss: 1.9468, test_f1: 0.5544
 epoch: 89, train_loss: 0.3364, test_loss: 1.9861, test_f1: 0.5761
 epoch: 90, train_loss: 0.3245, test_loss: 2.0079, test_f1: 0.5694
 epoch: 91, train_loss: 0.3487, test_loss: 1.9690, test_f1: 0.5622
 epoch: 92, train_loss: 0.3358, test_loss: 1.9828, test_f1: 0.5620
 epoch: 93, train_loss: 0.3329, test_loss: 2.1574, test_f1: 0.5611
 epoch: 94, train_loss: 0.3610, test_loss: 2.1655, test_f1: 0.5444
 epoch: 95, train_loss: 0.3431, test_loss: 2.2194, test_f1: 0.5643
 epoch: 96, train_loss: 0.3561, test_loss: 2.0767, test_f1: 0.5703
 epoch: 97, train_loss: 0.3502, test_loss: 2.1691, test_f1: 0.5571
 epoch: 98, train_loss: 0.3297, test_loss: 2.1393, test_f1: 0.5461
 epoch: 99, train_loss: 0.3403, test_loss: 2.1662, test_f1: 0.5324
##################ITERATION #5 ****************************************
 epoch: 0, train_loss: 1.2459, test_loss: 1.4915, test_f1: 0.1365
 epoch: 1, train_loss: 1.0329, test_loss: 1.1450, test_f1: 0.4138
 epoch: 2, train_loss: 0.9867, test_loss: 1.0862, test_f1: 0.4665
 epoch: 3, train_loss: 0.9441, test_loss: 1.0543, test_f1: 0.5115
 epoch: 4, train_loss: 0.9444, test_loss: 1.0594, test_f1: 0.4731
 epoch: 5, train_loss: 0.9005, test_loss: 1.0681, test_f1: 0.4685
 epoch: 6, train_loss: 0.9020, test_loss: 0.9981, test_f1: 0.5560
 epoch: 7, train_loss: 0.8835, test_loss: 1.0283, test_f1: 0.5799
 epoch: 8, train_loss: 0.8429, test_loss: 1.0057, test_f1: 0.5449
 epoch: 9, train_loss: 0.8392, test_loss: 1.0322, test_f1: 0.5584
 epoch: 10, train_loss: 0.8300, test_loss: 1.0242, test_f1: 0.5423
 epoch: 11, train_loss: 0.8124, test_loss: 1.0075, test_f1: 0.5505
 epoch: 12, train_loss: 0.8007, test_loss: 0.9970, test_f1: 0.5716
 epoch: 13, train_loss: 0.7852, test_loss: 1.0248, test_f1: 0.5825
 epoch: 14, train_loss: 0.8134, test_loss: 1.0086, test_f1: 0.5589
 epoch: 15, train_loss: 0.7640, test_loss: 1.0466, test_f1: 0.5024
 epoch: 16, train_loss: 0.7503, test_loss: 1.0211, test_f1: 0.5821
 epoch: 17, train_loss: 0.7503, test_loss: 1.0315, test_f1: 0.5745
 epoch: 18, train_loss: 0.7554, test_loss: 1.0261, test_f1: 0.5784
 epoch: 19, train_loss: 0.7013, test_loss: 1.0567, test_f1: 0.5751
 epoch: 20, train_loss: 0.7113, test_loss: 1.0385, test_f1: 0.5768
 epoch: 21, train_loss: 0.6948, test_loss: 1.0436, test_f1: 0.5980
 epoch: 22, train_loss: 0.6881, test_loss: 1.0589, test_f1: 0.5670
 epoch: 23, train_loss: 0.6726, test_loss: 1.0580, test_f1: 0.5962
 epoch: 24, train_loss: 0.6572, test_loss: 1.0896, test_f1: 0.5622
 epoch: 25, train_loss: 0.6334, test_loss: 1.1014, test_f1: 0.6014
 epoch: 26, train_loss: 0.6480, test_loss: 1.0313, test_f1: 0.6445
 epoch: 27, train_loss: 0.6559, test_loss: 1.0785, test_f1: 0.6014
 epoch: 28, train_loss: 0.6198, test_loss: 1.1200, test_f1: 0.6392
 epoch: 29, train_loss: 0.6249, test_loss: 1.0941, test_f1: 0.6001
 epoch: 30, train_loss: 0.6041, test_loss: 1.1103, test_f1: 0.6431
 epoch: 31, train_loss: 0.5844, test_loss: 1.1437, test_f1: 0.5933
 epoch: 32, train_loss: 0.5789, test_loss: 1.1454, test_f1: 0.6422
 epoch: 33, train_loss: 0.5862, test_loss: 1.1095, test_f1: 0.6325
 epoch: 34, train_loss: 0.5836, test_loss: 1.1092, test_f1: 0.6176
 epoch: 35, train_loss: 0.5644, test_loss: 1.0930, test_f1: 0.6623
 epoch: 36, train_loss: 0.5259, test_loss: 1.1638, test_f1: 0.6433
 epoch: 37, train_loss: 0.5399, test_loss: 1.2115, test_f1: 0.6215
 epoch: 38, train_loss: 0.5521, test_loss: 1.1422, test_f1: 0.6581
 epoch: 39, train_loss: 0.5024, test_loss: 1.3176, test_f1: 0.5624
 epoch: 40, train_loss: 0.5474, test_loss: 1.1802, test_f1: 0.6281
 epoch: 41, train_loss: 0.5309, test_loss: 1.1985, test_f1: 0.6466
 epoch: 42, train_loss: 0.5101, test_loss: 1.2320, test_f1: 0.6152
 epoch: 43, train_loss: 0.5156, test_loss: 1.1914, test_f1: 0.6100
 epoch: 44, train_loss: 0.5036, test_loss: 1.2210, test_f1: 0.6303
 epoch: 45, train_loss: 0.5313, test_loss: 1.2655, test_f1: 0.6288
 epoch: 46, train_loss: 0.5317, test_loss: 1.2521, test_f1: 0.6241
 epoch: 47, train_loss: 0.4937, test_loss: 1.1606, test_f1: 0.6605
 epoch: 48, train_loss: 0.4772, test_loss: 1.2501, test_f1: 0.6647
 epoch: 49, train_loss: 0.4727, test_loss: 1.2312, test_f1: 0.6379
 epoch: 50, train_loss: 0.4666, test_loss: 1.2337, test_f1: 0.6320
 epoch: 51, train_loss: 0.4292, test_loss: 1.1757, test_f1: 0.6606
 epoch: 52, train_loss: 0.4319, test_loss: 1.2302, test_f1: 0.6331
 epoch: 53, train_loss: 0.4282, test_loss: 1.2592, test_f1: 0.6053
 epoch: 54, train_loss: 0.4054, test_loss: 1.2543, test_f1: 0.6423
 epoch: 55, train_loss: 0.4127, test_loss: 1.2511, test_f1: 0.6480
 epoch: 56, train_loss: 0.4157, test_loss: 1.3435, test_f1: 0.6103
 epoch: 57, train_loss: 0.4218, test_loss: 1.2885, test_f1: 0.6435
 epoch: 58, train_loss: 0.4186, test_loss: 1.3333, test_f1: 0.6290
 epoch: 59, train_loss: 0.4069, test_loss: 1.3756, test_f1: 0.6405
 epoch: 60, train_loss: 0.4139, test_loss: 1.3320, test_f1: 0.6371
 epoch: 61, train_loss: 0.4014, test_loss: 1.3308, test_f1: 0.6161
 epoch: 62, train_loss: 0.3641, test_loss: 1.3407, test_f1: 0.6309
 epoch: 63, train_loss: 0.3745, test_loss: 1.3193, test_f1: 0.6524
 epoch: 64, train_loss: 0.3672, test_loss: 1.3435, test_f1: 0.6408
 epoch: 65, train_loss: 0.3750, test_loss: 1.3673, test_f1: 0.6280
 epoch: 66, train_loss: 0.3804, test_loss: 1.3448, test_f1: 0.6509
 epoch: 67, train_loss: 0.3686, test_loss: 1.4031, test_f1: 0.6269
 epoch: 68, train_loss: 0.3389, test_loss: 1.4108, test_f1: 0.6370
 epoch: 69, train_loss: 0.3613, test_loss: 1.3745, test_f1: 0.6348
 epoch: 70, train_loss: 0.3651, test_loss: 1.4697, test_f1: 0.6302
 epoch: 71, train_loss: 0.3681, test_loss: 1.4453, test_f1: 0.6165
 epoch: 72, train_loss: 0.3524, test_loss: 1.3853, test_f1: 0.6434
 epoch: 73, train_loss: 0.3330, test_loss: 1.4488, test_f1: 0.6074
 epoch: 74, train_loss: 0.3358, test_loss: 1.4780, test_f1: 0.6276
 epoch: 75, train_loss: 0.3341, test_loss: 1.4968, test_f1: 0.6259
 epoch: 76, train_loss: 0.3343, test_loss: 1.4778, test_f1: 0.6192
 epoch: 77, train_loss: 0.3335, test_loss: 1.6201, test_f1: 0.6278
 epoch: 78, train_loss: 0.3511, test_loss: 1.5152, test_f1: 0.5998
 epoch: 79, train_loss: 0.3473, test_loss: 1.5382, test_f1: 0.6216
 epoch: 80, train_loss: 0.3439, test_loss: 1.5324, test_f1: 0.6145
 epoch: 81, train_loss: 0.3261, test_loss: 1.5420, test_f1: 0.6320
 epoch: 82, train_loss: 0.3238, test_loss: 1.4928, test_f1: 0.6194
 epoch: 83, train_loss: 0.3135, test_loss: 1.4980, test_f1: 0.6336
 epoch: 84, train_loss: 0.3169, test_loss: 1.5820, test_f1: 0.6145
 epoch: 85, train_loss: 0.3285, test_loss: 1.4821, test_f1: 0.6145
 epoch: 86, train_loss: 0.3670, test_loss: 1.4945, test_f1: 0.6553
 epoch: 87, train_loss: 0.3102, test_loss: 1.5360, test_f1: 0.6282
 epoch: 88, train_loss: 0.2974, test_loss: 1.4846, test_f1: 0.6325
 epoch: 89, train_loss: 0.3039, test_loss: 1.5640, test_f1: 0.6252
 epoch: 90, train_loss: 0.2908, test_loss: 1.5395, test_f1: 0.6373
 epoch: 91, train_loss: 0.3010, test_loss: 1.6836, test_f1: 0.6025
 epoch: 92, train_loss: 0.2998, test_loss: 1.6541, test_f1: 0.6504
 epoch: 93, train_loss: 0.2899, test_loss: 1.5823, test_f1: 0.6290
 epoch: 94, train_loss: 0.3047, test_loss: 1.6624, test_f1: 0.6189
 epoch: 95, train_loss: 0.3146, test_loss: 1.6453, test_f1: 0.5872
 epoch: 96, train_loss: 0.3054, test_loss: 1.6718, test_f1: 0.6159
 epoch: 97, train_loss: 0.2821, test_loss: 1.7195, test_f1: 0.6082
 epoch: 98, train_loss: 0.3098, test_loss: 1.7444, test_f1: 0.6288
 epoch: 99, train_loss: 0.2757, test_loss: 1.7379, test_f1: 0.5856
##################ITERATION #6 ****************************************
 epoch: 0, train_loss: 1.3121, test_loss: 1.4233, test_f1: 0.2298
 epoch: 1, train_loss: 1.0749, test_loss: 1.2483, test_f1: 0.3662
 epoch: 2, train_loss: 1.0317, test_loss: 1.1325, test_f1: 0.4383
 epoch: 3, train_loss: 0.9879, test_loss: 1.0649, test_f1: 0.5299
 epoch: 4, train_loss: 0.9504, test_loss: 1.0551, test_f1: 0.5431
 epoch: 5, train_loss: 0.9082, test_loss: 1.0840, test_f1: 0.5237
 epoch: 6, train_loss: 0.9142, test_loss: 1.0288, test_f1: 0.5800
 epoch: 7, train_loss: 0.8894, test_loss: 1.0465, test_f1: 0.5101
 epoch: 8, train_loss: 0.8856, test_loss: 0.9858, test_f1: 0.5664
 epoch: 9, train_loss: 0.8687, test_loss: 1.0348, test_f1: 0.5766
 epoch: 10, train_loss: 0.8283, test_loss: 1.0383, test_f1: 0.5897
 epoch: 11, train_loss: 0.8162, test_loss: 1.0129, test_f1: 0.5856
 epoch: 12, train_loss: 0.7899, test_loss: 1.0475, test_f1: 0.5683
 epoch: 13, train_loss: 0.7891, test_loss: 1.0508, test_f1: 0.5678
 epoch: 14, train_loss: 0.7688, test_loss: 1.0285, test_f1: 0.5867
 epoch: 15, train_loss: 0.7516, test_loss: 1.0534, test_f1: 0.5707
 epoch: 16, train_loss: 0.7636, test_loss: 1.0453, test_f1: 0.5404
 epoch: 17, train_loss: 0.7520, test_loss: 1.0052, test_f1: 0.6039
 epoch: 18, train_loss: 0.7100, test_loss: 1.0282, test_f1: 0.5855
 epoch: 19, train_loss: 0.7394, test_loss: 1.0623, test_f1: 0.5935
 epoch: 20, train_loss: 0.7037, test_loss: 1.0471, test_f1: 0.5906
 epoch: 21, train_loss: 0.7182, test_loss: 1.0523, test_f1: 0.5782
 epoch: 22, train_loss: 0.6665, test_loss: 1.0467, test_f1: 0.5801
 epoch: 23, train_loss: 0.6613, test_loss: 1.1129, test_f1: 0.5663
 epoch: 24, train_loss: 0.6780, test_loss: 1.0789, test_f1: 0.5909
 epoch: 25, train_loss: 0.6362, test_loss: 1.1727, test_f1: 0.5581
 epoch: 26, train_loss: 0.6343, test_loss: 1.1295, test_f1: 0.6099
 epoch: 27, train_loss: 0.6315, test_loss: 1.0805, test_f1: 0.6050
 epoch: 28, train_loss: 0.6124, test_loss: 1.1321, test_f1: 0.6041
 epoch: 29, train_loss: 0.6230, test_loss: 1.1486, test_f1: 0.5746
 epoch: 30, train_loss: 0.5804, test_loss: 1.1526, test_f1: 0.6002
 epoch: 31, train_loss: 0.5844, test_loss: 1.2372, test_f1: 0.5751
 epoch: 32, train_loss: 0.5847, test_loss: 1.1731, test_f1: 0.6334
 epoch: 33, train_loss: 0.5717, test_loss: 1.1815, test_f1: 0.6321
 epoch: 34, train_loss: 0.5577, test_loss: 1.1792, test_f1: 0.6307
 epoch: 35, train_loss: 0.5490, test_loss: 1.2440, test_f1: 0.6077
 epoch: 36, train_loss: 0.5616, test_loss: 1.2464, test_f1: 0.5799
 epoch: 37, train_loss: 0.5201, test_loss: 1.1983, test_f1: 0.6094
 epoch: 38, train_loss: 0.5530, test_loss: 1.2730, test_f1: 0.5856
 epoch: 39, train_loss: 0.5199, test_loss: 1.2246, test_f1: 0.6219
 epoch: 40, train_loss: 0.5042, test_loss: 1.2995, test_f1: 0.6065
 epoch: 41, train_loss: 0.5422, test_loss: 1.3207, test_f1: 0.5924
 epoch: 42, train_loss: 0.4960, test_loss: 1.4253, test_f1: 0.5709
 epoch: 43, train_loss: 0.5099, test_loss: 1.3624, test_f1: 0.5852
 epoch: 44, train_loss: 0.5196, test_loss: 1.3673, test_f1: 0.6080
 epoch: 45, train_loss: 0.4900, test_loss: 1.4015, test_f1: 0.5998
 epoch: 46, train_loss: 0.4627, test_loss: 1.4027, test_f1: 0.5969
 epoch: 47, train_loss: 0.4696, test_loss: 1.5293, test_f1: 0.5690
 epoch: 48, train_loss: 0.4810, test_loss: 1.4549, test_f1: 0.5818
 epoch: 49, train_loss: 0.4398, test_loss: 1.5321, test_f1: 0.5849
 epoch: 50, train_loss: 0.4426, test_loss: 1.4535, test_f1: 0.5823
 epoch: 51, train_loss: 0.4274, test_loss: 1.5045, test_f1: 0.5881
 epoch: 52, train_loss: 0.3802, test_loss: 1.4762, test_f1: 0.6247
 epoch: 53, train_loss: 0.4062, test_loss: 1.5171, test_f1: 0.6031
 epoch: 54, train_loss: 0.3777, test_loss: 1.5182, test_f1: 0.6215
 epoch: 55, train_loss: 0.3685, test_loss: 1.5244, test_f1: 0.6210
 epoch: 56, train_loss: 0.3674, test_loss: 1.6099, test_f1: 0.6004
 epoch: 57, train_loss: 0.3617, test_loss: 1.6825, test_f1: 0.5662
 epoch: 58, train_loss: 0.3587, test_loss: 1.5998, test_f1: 0.6010
 epoch: 59, train_loss: 0.3515, test_loss: 1.6469, test_f1: 0.5978
 epoch: 60, train_loss: 0.3512, test_loss: 1.7112, test_f1: 0.5967
 epoch: 61, train_loss: 0.3500, test_loss: 1.6134, test_f1: 0.5946
 epoch: 62, train_loss: 0.3360, test_loss: 1.7207, test_f1: 0.6237
 epoch: 63, train_loss: 0.3429, test_loss: 1.6920, test_f1: 0.5865
 epoch: 64, train_loss: 0.3340, test_loss: 1.7292, test_f1: 0.6345
 epoch: 65, train_loss: 0.3508, test_loss: 1.7569, test_f1: 0.5980
 epoch: 66, train_loss: 0.3322, test_loss: 1.7954, test_f1: 0.5730
 epoch: 67, train_loss: 0.3321, test_loss: 1.6978, test_f1: 0.5833
 epoch: 68, train_loss: 0.3439, test_loss: 1.7285, test_f1: 0.6259
 epoch: 69, train_loss: 0.3235, test_loss: 1.8083, test_f1: 0.6001
 epoch: 70, train_loss: 0.3227, test_loss: 1.8498, test_f1: 0.5882
 epoch: 71, train_loss: 0.3176, test_loss: 1.7598, test_f1: 0.5918
 epoch: 72, train_loss: 0.3005, test_loss: 1.7856, test_f1: 0.5930
 epoch: 73, train_loss: 0.3009, test_loss: 1.9370, test_f1: 0.5720
 epoch: 74, train_loss: 0.3194, test_loss: 1.8689, test_f1: 0.5974
 epoch: 75, train_loss: 0.2932, test_loss: 1.8803, test_f1: 0.6012
 epoch: 76, train_loss: 0.2927, test_loss: 1.8517, test_f1: 0.6041
 epoch: 77, train_loss: 0.2996, test_loss: 1.8353, test_f1: 0.6037
 epoch: 78, train_loss: 0.2934, test_loss: 1.9483, test_f1: 0.5866
 epoch: 79, train_loss: 0.2904, test_loss: 1.9032, test_f1: 0.6030
 epoch: 80, train_loss: 0.3065, test_loss: 1.9638, test_f1: 0.6177
 epoch: 81, train_loss: 0.2738, test_loss: 1.9162, test_f1: 0.5871
 epoch: 82, train_loss: 0.2862, test_loss: 1.9637, test_f1: 0.6058
 epoch: 83, train_loss: 0.2887, test_loss: 1.8993, test_f1: 0.5812
 epoch: 84, train_loss: 0.2348, test_loss: 1.9064, test_f1: 0.6132
 epoch: 85, train_loss: 0.2603, test_loss: 1.9877, test_f1: 0.5942
 epoch: 86, train_loss: 0.2600, test_loss: 1.8620, test_f1: 0.5944
 epoch: 87, train_loss: 0.2673, test_loss: 1.9864, test_f1: 0.5958
 epoch: 88, train_loss: 0.2857, test_loss: 1.9665, test_f1: 0.6066
 epoch: 89, train_loss: 0.2652, test_loss: 2.0252, test_f1: 0.5829
 epoch: 90, train_loss: 0.2600, test_loss: 2.0869, test_f1: 0.5967
 epoch: 91, train_loss: 0.2613, test_loss: 1.9647, test_f1: 0.5947
 epoch: 92, train_loss: 0.2552, test_loss: 1.9551, test_f1: 0.6190
 epoch: 93, train_loss: 0.2496, test_loss: 2.0734, test_f1: 0.5957
 epoch: 94, train_loss: 0.2555, test_loss: 2.0528, test_f1: 0.6185
 epoch: 95, train_loss: 0.2772, test_loss: 2.1326, test_f1: 0.6095
 epoch: 96, train_loss: 0.2498, test_loss: 1.9591, test_f1: 0.6079
 epoch: 97, train_loss: 0.2490, test_loss: 2.1176, test_f1: 0.5804
 epoch: 98, train_loss: 0.2651, test_loss: 2.1029, test_f1: 0.6090
 epoch: 99, train_loss: 0.2682, test_loss: 2.0632, test_f1: 0.6132
##################ITERATION #7 ****************************************
 epoch: 0, train_loss: 1.4702, test_loss: 1.4689, test_f1: 0.2281
 epoch: 1, train_loss: 1.1261, test_loss: 1.2866, test_f1: 0.2942
 epoch: 2, train_loss: 1.0533, test_loss: 1.0765, test_f1: 0.4861
 epoch: 3, train_loss: 0.9838, test_loss: 1.0529, test_f1: 0.5298
 epoch: 4, train_loss: 0.9664, test_loss: 1.0730, test_f1: 0.5337
 epoch: 5, train_loss: 0.9422, test_loss: 1.0740, test_f1: 0.5257
 epoch: 6, train_loss: 0.9229, test_loss: 1.0426, test_f1: 0.5664
 epoch: 7, train_loss: 0.9067, test_loss: 1.0172, test_f1: 0.5740
 epoch: 8, train_loss: 0.8971, test_loss: 1.0119, test_f1: 0.5758
 epoch: 9, train_loss: 0.8719, test_loss: 1.0401, test_f1: 0.5491
 epoch: 10, train_loss: 0.8653, test_loss: 1.0426, test_f1: 0.5532
 epoch: 11, train_loss: 0.8546, test_loss: 1.0046, test_f1: 0.5836
 epoch: 12, train_loss: 0.8376, test_loss: 0.9861, test_f1: 0.5839
 epoch: 13, train_loss: 0.8110, test_loss: 1.0425, test_f1: 0.5713
 epoch: 14, train_loss: 0.8142, test_loss: 1.0207, test_f1: 0.6082
 epoch: 15, train_loss: 0.8062, test_loss: 0.9975, test_f1: 0.5900
 epoch: 16, train_loss: 0.7749, test_loss: 1.0268, test_f1: 0.5822
 epoch: 17, train_loss: 0.7759, test_loss: 1.0185, test_f1: 0.6014
 epoch: 18, train_loss: 0.7545, test_loss: 0.9723, test_f1: 0.5989
 epoch: 19, train_loss: 0.7725, test_loss: 0.9806, test_f1: 0.5737
 epoch: 20, train_loss: 0.7498, test_loss: 1.0572, test_f1: 0.5810
 epoch: 21, train_loss: 0.7240, test_loss: 0.9675, test_f1: 0.5913
 epoch: 22, train_loss: 0.7239, test_loss: 1.2490, test_f1: 0.4753
 epoch: 23, train_loss: 0.7453, test_loss: 1.0274, test_f1: 0.6252
 epoch: 24, train_loss: 0.7157, test_loss: 1.0162, test_f1: 0.5866
 epoch: 25, train_loss: 0.6949, test_loss: 1.0315, test_f1: 0.6464
 epoch: 26, train_loss: 0.7203, test_loss: 1.0421, test_f1: 0.6311
 epoch: 27, train_loss: 0.7185, test_loss: 1.0642, test_f1: 0.6046
 epoch: 28, train_loss: 0.6970, test_loss: 1.0594, test_f1: 0.5918
 epoch: 29, train_loss: 0.6629, test_loss: 1.0282, test_f1: 0.6122
 epoch: 30, train_loss: 0.6640, test_loss: 1.1203, test_f1: 0.5913
 epoch: 31, train_loss: 0.6414, test_loss: 1.0723, test_f1: 0.6093
 epoch: 32, train_loss: 0.6264, test_loss: 1.0855, test_f1: 0.6237
 epoch: 33, train_loss: 0.6313, test_loss: 1.2078, test_f1: 0.5727
 epoch: 34, train_loss: 0.6415, test_loss: 1.1047, test_f1: 0.6164
 epoch: 35, train_loss: 0.6146, test_loss: 1.1839, test_f1: 0.5793
 epoch: 36, train_loss: 0.6069, test_loss: 1.0796, test_f1: 0.5991
 epoch: 37, train_loss: 0.6201, test_loss: 1.1636, test_f1: 0.5878
 epoch: 38, train_loss: 0.5940, test_loss: 1.0754, test_f1: 0.6069
 epoch: 39, train_loss: 0.5837, test_loss: 1.1845, test_f1: 0.6070
 epoch: 40, train_loss: 0.6022, test_loss: 1.2032, test_f1: 0.6068
 epoch: 41, train_loss: 0.5776, test_loss: 1.2450, test_f1: 0.6137
 epoch: 42, train_loss: 0.5790, test_loss: 1.1397, test_f1: 0.6252
 epoch: 43, train_loss: 0.5749, test_loss: 1.2508, test_f1: 0.5864
 epoch: 44, train_loss: 0.5788, test_loss: 1.2331, test_f1: 0.5471
 epoch: 45, train_loss: 0.5691, test_loss: 1.1930, test_f1: 0.5734
 epoch: 46, train_loss: 0.5421, test_loss: 1.2832, test_f1: 0.5976
 epoch: 47, train_loss: 0.5463, test_loss: 1.2887, test_f1: 0.6249
 epoch: 48, train_loss: 0.5365, test_loss: 1.3039, test_f1: 0.5584
 epoch: 49, train_loss: 0.5227, test_loss: 1.2816, test_f1: 0.5870
 epoch: 50, train_loss: 0.5228, test_loss: 1.3673, test_f1: 0.6111
 epoch: 51, train_loss: 0.4724, test_loss: 1.2861, test_f1: 0.5932
 epoch: 52, train_loss: 0.4906, test_loss: 1.3439, test_f1: 0.6059
 epoch: 53, train_loss: 0.4807, test_loss: 1.2866, test_f1: 0.6533
 epoch: 54, train_loss: 0.4632, test_loss: 1.3013, test_f1: 0.6068
 epoch: 55, train_loss: 0.4359, test_loss: 1.3665, test_f1: 0.6103
 epoch: 56, train_loss: 0.4791, test_loss: 1.3543, test_f1: 0.6369
 epoch: 57, train_loss: 0.4723, test_loss: 1.3016, test_f1: 0.6154
 epoch: 58, train_loss: 0.4274, test_loss: 1.3631, test_f1: 0.6101
 epoch: 59, train_loss: 0.4462, test_loss: 1.3933, test_f1: 0.6118
 epoch: 60, train_loss: 0.4381, test_loss: 1.3938, test_f1: 0.5780
 epoch: 61, train_loss: 0.4324, test_loss: 1.4210, test_f1: 0.6298
 epoch: 62, train_loss: 0.4483, test_loss: 1.3767, test_f1: 0.6085
 epoch: 63, train_loss: 0.4155, test_loss: 1.5212, test_f1: 0.5833
 epoch: 64, train_loss: 0.4118, test_loss: 1.4949, test_f1: 0.5964
 epoch: 65, train_loss: 0.3965, test_loss: 1.4856, test_f1: 0.6269
 epoch: 66, train_loss: 0.4331, test_loss: 1.5927, test_f1: 0.5783
 epoch: 67, train_loss: 0.4358, test_loss: 1.5015, test_f1: 0.6033
 epoch: 68, train_loss: 0.4133, test_loss: 1.4858, test_f1: 0.6232
 epoch: 69, train_loss: 0.4079, test_loss: 1.5256, test_f1: 0.6220
 epoch: 70, train_loss: 0.3877, test_loss: 1.4848, test_f1: 0.6308
 epoch: 71, train_loss: 0.4032, test_loss: 1.5741, test_f1: 0.6074
 epoch: 72, train_loss: 0.3860, test_loss: 1.6351, test_f1: 0.5753
 epoch: 73, train_loss: 0.3892, test_loss: 1.5421, test_f1: 0.6296
 epoch: 74, train_loss: 0.4024, test_loss: 1.6466, test_f1: 0.5619
 epoch: 75, train_loss: 0.3959, test_loss: 1.6261, test_f1: 0.6111
 epoch: 76, train_loss: 0.3953, test_loss: 1.7734, test_f1: 0.5787
 epoch: 77, train_loss: 0.3727, test_loss: 1.8181, test_f1: 0.5690
 epoch: 78, train_loss: 0.3745, test_loss: 1.5519, test_f1: 0.5992
 epoch: 79, train_loss: 0.3940, test_loss: 1.6564, test_f1: 0.6086
 epoch: 80, train_loss: 0.3740, test_loss: 1.5476, test_f1: 0.6458
 epoch: 81, train_loss: 0.3813, test_loss: 1.7901, test_f1: 0.5654
 epoch: 82, train_loss: 0.3574, test_loss: 1.6189, test_f1: 0.6182
 epoch: 83, train_loss: 0.3769, test_loss: 1.7560, test_f1: 0.6099
 epoch: 84, train_loss: 0.3399, test_loss: 1.7118, test_f1: 0.5944
 epoch: 85, train_loss: 0.3576, test_loss: 1.6913, test_f1: 0.6043
 epoch: 86, train_loss: 0.3544, test_loss: 1.7284, test_f1: 0.6185
 epoch: 87, train_loss: 0.3964, test_loss: 1.7395, test_f1: 0.5951
 epoch: 88, train_loss: 0.3780, test_loss: 1.6783, test_f1: 0.6403
 epoch: 89, train_loss: 0.3563, test_loss: 1.8856, test_f1: 0.5750
 epoch: 90, train_loss: 0.3492, test_loss: 1.8302, test_f1: 0.5927
 epoch: 91, train_loss: 0.3438, test_loss: 1.7342, test_f1: 0.6307
 epoch: 92, train_loss: 0.3530, test_loss: 1.8144, test_f1: 0.5823
 epoch: 93, train_loss: 0.3544, test_loss: 1.7271, test_f1: 0.5845
 epoch: 94, train_loss: 0.3389, test_loss: 1.8958, test_f1: 0.5885
 epoch: 95, train_loss: 0.3369, test_loss: 1.8121, test_f1: 0.5943
 epoch: 96, train_loss: 0.3303, test_loss: 1.7675, test_f1: 0.6397
 epoch: 97, train_loss: 0.3282, test_loss: 1.7688, test_f1: 0.6253
 epoch: 98, train_loss: 0.3358, test_loss: 1.7968, test_f1: 0.6108
 epoch: 99, train_loss: 0.3314, test_loss: 1.6943, test_f1: 0.6249
##################ITERATION #8 ****************************************
 epoch: 0, train_loss: 1.6291, test_loss: 1.3366, test_f1: 0.1497
 epoch: 1, train_loss: 1.1385, test_loss: 1.2741, test_f1: 0.2180
 epoch: 2, train_loss: 1.0637, test_loss: 1.2013, test_f1: 0.3960
 epoch: 3, train_loss: 1.0097, test_loss: 1.0754, test_f1: 0.5376
 epoch: 4, train_loss: 0.9622, test_loss: 1.0818, test_f1: 0.5372
 epoch: 5, train_loss: 0.9315, test_loss: 1.0703, test_f1: 0.5479
 epoch: 6, train_loss: 0.9179, test_loss: 1.0065, test_f1: 0.5750
 epoch: 7, train_loss: 0.8952, test_loss: 1.0757, test_f1: 0.5312
 epoch: 8, train_loss: 0.8651, test_loss: 1.0507, test_f1: 0.5478
 epoch: 9, train_loss: 0.8361, test_loss: 1.0134, test_f1: 0.5285
 epoch: 10, train_loss: 0.8289, test_loss: 0.9933, test_f1: 0.6195
 epoch: 11, train_loss: 0.8104, test_loss: 1.0421, test_f1: 0.5850
 epoch: 12, train_loss: 0.7990, test_loss: 1.0231, test_f1: 0.5680
 epoch: 13, train_loss: 0.7736, test_loss: 0.9934, test_f1: 0.6253
 epoch: 14, train_loss: 0.7693, test_loss: 1.0313, test_f1: 0.5944
 epoch: 15, train_loss: 0.7707, test_loss: 0.9794, test_f1: 0.6015
 epoch: 16, train_loss: 0.7392, test_loss: 1.0711, test_f1: 0.5465
 epoch: 17, train_loss: 0.7396, test_loss: 1.0359, test_f1: 0.5906
 epoch: 18, train_loss: 0.7219, test_loss: 0.9847, test_f1: 0.6148
 epoch: 19, train_loss: 0.7241, test_loss: 0.9854, test_f1: 0.6288
 epoch: 20, train_loss: 0.6879, test_loss: 1.0413, test_f1: 0.5693
 epoch: 21, train_loss: 0.6871, test_loss: 1.0358, test_f1: 0.5812
 epoch: 22, train_loss: 0.6735, test_loss: 1.0408, test_f1: 0.6123
 epoch: 23, train_loss: 0.6606, test_loss: 1.0228, test_f1: 0.6192
 epoch: 24, train_loss: 0.6550, test_loss: 1.0887, test_f1: 0.5735
 epoch: 25, train_loss: 0.6306, test_loss: 1.0787, test_f1: 0.6108
 epoch: 26, train_loss: 0.6021, test_loss: 1.0314, test_f1: 0.5870
 epoch: 27, train_loss: 0.6442, test_loss: 1.0504, test_f1: 0.5801
 epoch: 28, train_loss: 0.6076, test_loss: 1.1130, test_f1: 0.5964
 epoch: 29, train_loss: 0.5865, test_loss: 1.0834, test_f1: 0.6102
 epoch: 30, train_loss: 0.5726, test_loss: 1.0623, test_f1: 0.6007
 epoch: 31, train_loss: 0.5842, test_loss: 1.1459, test_f1: 0.6029
 epoch: 32, train_loss: 0.5599, test_loss: 1.1949, test_f1: 0.5724
 epoch: 33, train_loss: 0.5788, test_loss: 1.1617, test_f1: 0.6031
 epoch: 34, train_loss: 0.5578, test_loss: 1.2796, test_f1: 0.5724
 epoch: 35, train_loss: 0.5537, test_loss: 1.3312, test_f1: 0.5707
 epoch: 36, train_loss: 0.5155, test_loss: 1.2067, test_f1: 0.5979
 epoch: 37, train_loss: 0.5262, test_loss: 1.2018, test_f1: 0.5450
 epoch: 38, train_loss: 0.5265, test_loss: 1.3668, test_f1: 0.6067
 epoch: 39, train_loss: 0.5590, test_loss: 1.2654, test_f1: 0.6137
 epoch: 40, train_loss: 0.5271, test_loss: 1.2035, test_f1: 0.6072
 epoch: 41, train_loss: 0.4973, test_loss: 1.2628, test_f1: 0.5993
 epoch: 42, train_loss: 0.5117, test_loss: 1.2820, test_f1: 0.5549
 epoch: 43, train_loss: 0.4765, test_loss: 1.2580, test_f1: 0.5709
 epoch: 44, train_loss: 0.4641, test_loss: 1.2855, test_f1: 0.6052
 epoch: 45, train_loss: 0.4851, test_loss: 1.4357, test_f1: 0.5914
 epoch: 46, train_loss: 0.4335, test_loss: 1.4524, test_f1: 0.5542
 epoch: 47, train_loss: 0.4524, test_loss: 1.4773, test_f1: 0.5518
 epoch: 48, train_loss: 0.4474, test_loss: 1.4345, test_f1: 0.5696
 epoch: 49, train_loss: 0.4367, test_loss: 1.4323, test_f1: 0.5778
 epoch: 50, train_loss: 0.4218, test_loss: 1.5120, test_f1: 0.5484
 epoch: 51, train_loss: 0.4215, test_loss: 1.4624, test_f1: 0.5849
 epoch: 52, train_loss: 0.3745, test_loss: 1.4665, test_f1: 0.5705
 epoch: 53, train_loss: 0.3759, test_loss: 1.5002, test_f1: 0.5844
 epoch: 54, train_loss: 0.3751, test_loss: 1.4961, test_f1: 0.5827
 epoch: 55, train_loss: 0.3708, test_loss: 1.5430, test_f1: 0.5937
 epoch: 56, train_loss: 0.3727, test_loss: 1.5242, test_f1: 0.5837
 epoch: 57, train_loss: 0.3436, test_loss: 1.5095, test_f1: 0.5889
 epoch: 58, train_loss: 0.3226, test_loss: 1.5986, test_f1: 0.5953
 epoch: 59, train_loss: 0.3665, test_loss: 1.6448, test_f1: 0.5667
 epoch: 60, train_loss: 0.3379, test_loss: 1.6752, test_f1: 0.5692
 epoch: 61, train_loss: 0.3469, test_loss: 1.6445, test_f1: 0.5839
 epoch: 62, train_loss: 0.3378, test_loss: 1.6525, test_f1: 0.5652
 epoch: 63, train_loss: 0.3662, test_loss: 1.6319, test_f1: 0.5656
 epoch: 64, train_loss: 0.3144, test_loss: 1.6104, test_f1: 0.5602
 epoch: 65, train_loss: 0.3027, test_loss: 1.7374, test_f1: 0.5832
 epoch: 66, train_loss: 0.3096, test_loss: 1.6588, test_f1: 0.5978
 epoch: 67, train_loss: 0.3215, test_loss: 1.6660, test_f1: 0.5851
 epoch: 68, train_loss: 0.3035, test_loss: 1.6997, test_f1: 0.5886
 epoch: 69, train_loss: 0.3024, test_loss: 1.7056, test_f1: 0.5781
 epoch: 70, train_loss: 0.3168, test_loss: 1.8198, test_f1: 0.5715
 epoch: 71, train_loss: 0.3252, test_loss: 1.7365, test_f1: 0.5957
 epoch: 72, train_loss: 0.3042, test_loss: 1.6958, test_f1: 0.5680
 epoch: 73, train_loss: 0.3010, test_loss: 1.8061, test_f1: 0.5954
 epoch: 74, train_loss: 0.2998, test_loss: 1.8227, test_f1: 0.5591
 epoch: 75, train_loss: 0.3000, test_loss: 1.7285, test_f1: 0.5871
 epoch: 76, train_loss: 0.2801, test_loss: 1.7617, test_f1: 0.5766
 epoch: 77, train_loss: 0.2820, test_loss: 1.7430, test_f1: 0.5803
 epoch: 78, train_loss: 0.2698, test_loss: 1.8171, test_f1: 0.5711
 epoch: 79, train_loss: 0.3072, test_loss: 1.9142, test_f1: 0.5782
 epoch: 80, train_loss: 0.3067, test_loss: 1.7647, test_f1: 0.5708
 epoch: 81, train_loss: 0.2893, test_loss: 1.7674, test_f1: 0.5857
 epoch: 82, train_loss: 0.2415, test_loss: 1.8098, test_f1: 0.6025
 epoch: 83, train_loss: 0.2756, test_loss: 1.9054, test_f1: 0.5839
 epoch: 84, train_loss: 0.2633, test_loss: 1.9600, test_f1: 0.5787
 epoch: 85, train_loss: 0.2753, test_loss: 1.8783, test_f1: 0.5767
 epoch: 86, train_loss: 0.2840, test_loss: 1.9072, test_f1: 0.5714
 epoch: 87, train_loss: 0.2648, test_loss: 1.9246, test_f1: 0.5804
 epoch: 88, train_loss: 0.2510, test_loss: 1.9251, test_f1: 0.5726
 epoch: 89, train_loss: 0.2671, test_loss: 1.7583, test_f1: 0.6133
 epoch: 90, train_loss: 0.2582, test_loss: 1.9820, test_f1: 0.5873
 epoch: 91, train_loss: 0.2781, test_loss: 1.9757, test_f1: 0.5509
 epoch: 92, train_loss: 0.2450, test_loss: 2.0067, test_f1: 0.5514
 epoch: 93, train_loss: 0.2598, test_loss: 2.0388, test_f1: 0.5710
 epoch: 94, train_loss: 0.2666, test_loss: 1.9750, test_f1: 0.5929
 epoch: 95, train_loss: 0.2489, test_loss: 2.0211, test_f1: 0.5819
 epoch: 96, train_loss: 0.2689, test_loss: 1.8996, test_f1: 0.5724
 epoch: 97, train_loss: 0.2742, test_loss: 2.0064, test_f1: 0.5733
 epoch: 98, train_loss: 0.2376, test_loss: 1.9114, test_f1: 0.5717
 epoch: 99, train_loss: 0.2459, test_loss: 1.9899, test_f1: 0.5984
##################ITERATION #9 ****************************************
 epoch: 0, train_loss: 1.4289, test_loss: 1.8070, test_f1: 0.2583
 epoch: 1, train_loss: 1.1257, test_loss: 1.3464, test_f1: 0.3361
 epoch: 2, train_loss: 1.0335, test_loss: 1.0765, test_f1: 0.5059
 epoch: 3, train_loss: 1.0043, test_loss: 1.0648, test_f1: 0.5599
 epoch: 4, train_loss: 0.9603, test_loss: 1.0573, test_f1: 0.5679
 epoch: 5, train_loss: 0.9235, test_loss: 1.0292, test_f1: 0.5964
 epoch: 6, train_loss: 0.9150, test_loss: 1.0196, test_f1: 0.5891
 epoch: 7, train_loss: 0.8660, test_loss: 0.9970, test_f1: 0.6219
 epoch: 8, train_loss: 0.8693, test_loss: 1.0136, test_f1: 0.6057
 epoch: 9, train_loss: 0.8557, test_loss: 1.0101, test_f1: 0.6302
 epoch: 10, train_loss: 0.8295, test_loss: 0.9856, test_f1: 0.6150
 epoch: 11, train_loss: 0.8061, test_loss: 0.9724, test_f1: 0.6142
 epoch: 12, train_loss: 0.7951, test_loss: 0.9790, test_f1: 0.5594
 epoch: 13, train_loss: 0.8011, test_loss: 1.0056, test_f1: 0.5955
 epoch: 14, train_loss: 0.7826, test_loss: 1.0264, test_f1: 0.5749
 epoch: 15, train_loss: 0.7694, test_loss: 1.0023, test_f1: 0.6126
 epoch: 16, train_loss: 0.7489, test_loss: 0.9620, test_f1: 0.6085
 epoch: 17, train_loss: 0.7312, test_loss: 1.0133, test_f1: 0.5979
 epoch: 18, train_loss: 0.7396, test_loss: 1.0127, test_f1: 0.6165
 epoch: 19, train_loss: 0.7225, test_loss: 1.0711, test_f1: 0.5657
 epoch: 20, train_loss: 0.7036, test_loss: 1.1221, test_f1: 0.5730
 epoch: 21, train_loss: 0.6981, test_loss: 1.0749, test_f1: 0.5706
 epoch: 22, train_loss: 0.6948, test_loss: 0.9473, test_f1: 0.6303
 epoch: 23, train_loss: 0.6898, test_loss: 1.0185, test_f1: 0.6131
 epoch: 24, train_loss: 0.6852, test_loss: 1.1208, test_f1: 0.5831
 epoch: 25, train_loss: 0.6942, test_loss: 0.9981, test_f1: 0.6086
 epoch: 26, train_loss: 0.6434, test_loss: 1.0627, test_f1: 0.6100
 epoch: 27, train_loss: 0.6538, test_loss: 1.1411, test_f1: 0.5862
 epoch: 28, train_loss: 0.6315, test_loss: 1.0649, test_f1: 0.6214
 epoch: 29, train_loss: 0.6186, test_loss: 1.0938, test_f1: 0.5883
 epoch: 30, train_loss: 0.6217, test_loss: 1.1241, test_f1: 0.6272
 epoch: 31, train_loss: 0.5962, test_loss: 1.1772, test_f1: 0.5864
 epoch: 32, train_loss: 0.6138, test_loss: 1.2163, test_f1: 0.5427
 epoch: 33, train_loss: 0.6207, test_loss: 1.1054, test_f1: 0.5795
 epoch: 34, train_loss: 0.5872, test_loss: 1.1952, test_f1: 0.5847
 epoch: 35, train_loss: 0.5867, test_loss: 1.2952, test_f1: 0.5675
 epoch: 36, train_loss: 0.5565, test_loss: 1.1277, test_f1: 0.6164
 epoch: 37, train_loss: 0.5487, test_loss: 1.1155, test_f1: 0.6406
 epoch: 38, train_loss: 0.5642, test_loss: 1.1174, test_f1: 0.6313
 epoch: 39, train_loss: 0.5508, test_loss: 1.1646, test_f1: 0.6238
 epoch: 40, train_loss: 0.5308, test_loss: 1.2590, test_f1: 0.5556
 epoch: 41, train_loss: 0.5749, test_loss: 1.2242, test_f1: 0.6044
 epoch: 42, train_loss: 0.5472, test_loss: 1.2102, test_f1: 0.6105
 epoch: 43, train_loss: 0.5165, test_loss: 1.1468, test_f1: 0.6083
 epoch: 44, train_loss: 0.5251, test_loss: 1.2309, test_f1: 0.6310
 epoch: 45, train_loss: 0.5188, test_loss: 1.2606, test_f1: 0.6365
 epoch: 46, train_loss: 0.5187, test_loss: 1.2575, test_f1: 0.6141
 epoch: 47, train_loss: 0.5078, test_loss: 1.3251, test_f1: 0.6001
 epoch: 48, train_loss: 0.5027, test_loss: 1.2598, test_f1: 0.5934
 epoch: 49, train_loss: 0.4948, test_loss: 1.1929, test_f1: 0.6230
 epoch: 50, train_loss: 0.4923, test_loss: 1.2749, test_f1: 0.5929
 epoch: 51, train_loss: 0.4866, test_loss: 1.3201, test_f1: 0.5870
 epoch: 52, train_loss: 0.4698, test_loss: 1.2853, test_f1: 0.6006
 epoch: 53, train_loss: 0.4586, test_loss: 1.2760, test_f1: 0.5980
 epoch: 54, train_loss: 0.4474, test_loss: 1.3823, test_f1: 0.5800
 epoch: 55, train_loss: 0.4535, test_loss: 1.3275, test_f1: 0.6138
 epoch: 56, train_loss: 0.4202, test_loss: 1.2811, test_f1: 0.6313
 epoch: 57, train_loss: 0.4173, test_loss: 1.3334, test_f1: 0.6409
 epoch: 58, train_loss: 0.4078, test_loss: 1.3117, test_f1: 0.6369
 epoch: 59, train_loss: 0.4065, test_loss: 1.3085, test_f1: 0.6224
 epoch: 60, train_loss: 0.4300, test_loss: 1.4581, test_f1: 0.5792
 epoch: 61, train_loss: 0.4107, test_loss: 1.3302, test_f1: 0.6185
 epoch: 62, train_loss: 0.3969, test_loss: 1.4151, test_f1: 0.6173
 epoch: 63, train_loss: 0.4098, test_loss: 1.3398, test_f1: 0.6223
 epoch: 64, train_loss: 0.3861, test_loss: 1.3454, test_f1: 0.6086
 epoch: 65, train_loss: 0.3840, test_loss: 1.3361, test_f1: 0.6306
 epoch: 66, train_loss: 0.3981, test_loss: 1.4094, test_f1: 0.5549
 epoch: 67, train_loss: 0.3588, test_loss: 1.5349, test_f1: 0.5763
 epoch: 68, train_loss: 0.3887, test_loss: 1.4773, test_f1: 0.5733
 epoch: 69, train_loss: 0.3769, test_loss: 1.4404, test_f1: 0.5989
 epoch: 70, train_loss: 0.3731, test_loss: 1.4622, test_f1: 0.5758
 epoch: 71, train_loss: 0.3643, test_loss: 1.4455, test_f1: 0.5711
 epoch: 72, train_loss: 0.3606, test_loss: 1.6223, test_f1: 0.5742
 epoch: 73, train_loss: 0.3670, test_loss: 1.4575, test_f1: 0.5902
 epoch: 74, train_loss: 0.3500, test_loss: 1.5973, test_f1: 0.5947
 epoch: 75, train_loss: 0.3546, test_loss: 1.5524, test_f1: 0.6066
 epoch: 76, train_loss: 0.3461, test_loss: 1.5478, test_f1: 0.5872
 epoch: 77, train_loss: 0.3574, test_loss: 1.4835, test_f1: 0.5822
 epoch: 78, train_loss: 0.3650, test_loss: 1.5562, test_f1: 0.5972
 epoch: 79, train_loss: 0.3434, test_loss: 1.5524, test_f1: 0.5975
 epoch: 80, train_loss: 0.3644, test_loss: 1.5749, test_f1: 0.5771
 epoch: 81, train_loss: 0.3872, test_loss: 1.5538, test_f1: 0.5877
 epoch: 82, train_loss: 0.3273, test_loss: 1.5439, test_f1: 0.5887
 epoch: 83, train_loss: 0.3259, test_loss: 1.5507, test_f1: 0.6020
 epoch: 84, train_loss: 0.3307, test_loss: 1.5873, test_f1: 0.5882
 epoch: 85, train_loss: 0.3121, test_loss: 1.6620, test_f1: 0.5837
 epoch: 86, train_loss: 0.3266, test_loss: 1.6498, test_f1: 0.5809
 epoch: 87, train_loss: 0.3477, test_loss: 1.6275, test_f1: 0.6156
 epoch: 88, train_loss: 0.3347, test_loss: 1.6558, test_f1: 0.5689
 epoch: 89, train_loss: 0.3258, test_loss: 1.7251, test_f1: 0.6177
 epoch: 90, train_loss: 0.3619, test_loss: 1.6820, test_f1: 0.5835
 epoch: 91, train_loss: 0.3554, test_loss: 1.6083, test_f1: 0.6068
 epoch: 92, train_loss: 0.3282, test_loss: 1.6467, test_f1: 0.6034
 epoch: 93, train_loss: 0.3374, test_loss: 1.6470, test_f1: 0.6172
 epoch: 94, train_loss: 0.3002, test_loss: 1.6298, test_f1: 0.6093
 epoch: 95, train_loss: 0.3129, test_loss: 1.8225, test_f1: 0.5728
 epoch: 96, train_loss: 0.3005, test_loss: 1.8004, test_f1: 0.6078
 epoch: 97, train_loss: 0.3051, test_loss: 1.6066, test_f1: 0.6067
 epoch: 98, train_loss: 0.3164, test_loss: 1.6215, test_f1: 0.6456
 epoch: 99, train_loss: 0.3167, test_loss: 1.7311, test_f1: 0.6123

Training completed in 468.69 seconds
Best F1: 0.6712 at epoch 36
Mean F1 across iterations: 0.6402  0.0201
========================FINAL RESULTS================================
FEGIN weighted F1: 0.6712  0.0201
python main.py --data ltspice_demos --representation component_pin_net --model FEGIN --layers 4 --hiddens 32 --batch_size 64 --lr 0.001 --emb_size 512 --epochs 100 --save_appendix component_pin_net_L4_H32_BS64_LR0.001_E512 --no_val
-----



STDERR:
  File "main.py", line 370, in <module>
    main()
  File "main.py", line 254, in main
    dataset = dataset_class(
  File "/home/philip/projects/ltspice_examples_code_repo/Circuit-Completion-Using-GNNs/component_classification_with_link_prediction_head/evaluation/FEGIN/kernel/circuit_datasets.py", line 15, in __init__
    self.data, self.slices = torch.load(self.processed_paths[0])
  File "/home/philip/.local/lib/python3.8/site-packages/torch/serialization.py", line 1040, in load
    warnings.warn(
  File "/usr/lib/python3.8/warnings.py", line 109, in _showwarnmsg
    sw(msg.message, msg.category, msg.filename, msg.lineno,
  File "main.py", line 47, in warn_with_traceback
    traceback.print_stack(file=log)
/home/philip/projects/ltspice_examples_code_repo/Circuit-Completion-Using-GNNs/component_classification_with_link_prediction_head/evaluation/FEGIN/kernel/circuit_datasets.py:15: FutureWarning: You are using `torch.load` with `weights_only=False` (the current default value), which uses the default pickle module implicitly. It is possible to construct malicious pickle data which will execute arbitrary code during unpickling (See https://github.com/pytorch/pytorch/blob/main/SECURITY.md#untrusted-models for more details). In a future release, the default value for `weights_only` will be flipped to `True`. This limits the functions that could be executed during unpickling. Arbitrary objects will no longer be allowed to be loaded via this mode unless they are explicitly allowlisted by the user via `torch.serialization.add_safe_globals`. We recommend you start setting `weights_only=True` for any use case where you don't have full control of the loaded file. Please open an issue on GitHub for any issues related to this experimental feature.
  self.data, self.slices = torch.load(self.processed_paths[0])
