STDOUT:
Results will be saved in /home/philip/projects/llm_inference_code_repo/Circuit-Completion-Using-GNNs/component_classification_with_link_prediction_head/evaluation/FEGIN/results/model_FEGIN_dataset_ltspice_examples
Command line input: python main.py --data ltspice_examples --representation component_pin_net --model FEGIN --layers 3 --hiddens 128 --batch_size 32 --lr 0.0001 --emb_size 128 --epochs 100 --save_appendix component_pin_net_L3_H128_BS32_LR0.0001_E128 --no_val
 is saved.
-----
ltspice_examples - FEGIN
Using 3 layers, 128 hidden units, h = 2
Loading component_pin_net representation dataset
ENTERED
Training FEGIN on component_pin_net representation
Train: 3558, Test: 846
##################ITERATION #0 ****************************************
 epoch: 0, train_loss: 1.3103, test_loss: 1.1856, test_f1: 0.3038
 epoch: 1, train_loss: 1.1820, test_loss: 1.1322, test_f1: 0.3460
 epoch: 2, train_loss: 1.1227, test_loss: 1.0541, test_f1: 0.3964
 epoch: 3, train_loss: 1.0462, test_loss: 1.0017, test_f1: 0.4385
 epoch: 4, train_loss: 1.0152, test_loss: 0.9834, test_f1: 0.4776
 epoch: 5, train_loss: 0.9787, test_loss: 0.9599, test_f1: 0.5051
 epoch: 6, train_loss: 0.9533, test_loss: 0.9346, test_f1: 0.5222
 epoch: 7, train_loss: 0.9376, test_loss: 0.9289, test_f1: 0.5192
 epoch: 8, train_loss: 0.9206, test_loss: 0.9368, test_f1: 0.5241
 epoch: 9, train_loss: 0.9105, test_loss: 0.9055, test_f1: 0.5255
 epoch: 10, train_loss: 0.9071, test_loss: 0.9118, test_f1: 0.5482
 epoch: 11, train_loss: 0.8911, test_loss: 0.8983, test_f1: 0.5604
 epoch: 12, train_loss: 0.8778, test_loss: 0.8944, test_f1: 0.5353
 epoch: 13, train_loss: 0.8658, test_loss: 0.8717, test_f1: 0.5514
 epoch: 14, train_loss: 0.8631, test_loss: 0.8701, test_f1: 0.5626
 epoch: 15, train_loss: 0.8398, test_loss: 0.9027, test_f1: 0.5377
 epoch: 16, train_loss: 0.8338, test_loss: 0.8709, test_f1: 0.5442
 epoch: 17, train_loss: 0.8315, test_loss: 0.8688, test_f1: 0.5579
 epoch: 18, train_loss: 0.8286, test_loss: 0.8629, test_f1: 0.5615
 epoch: 19, train_loss: 0.8067, test_loss: 0.8735, test_f1: 0.5317
 epoch: 20, train_loss: 0.8101, test_loss: 0.9225, test_f1: 0.5481
 epoch: 21, train_loss: 0.7980, test_loss: 0.8560, test_f1: 0.5452
 epoch: 22, train_loss: 0.7825, test_loss: 0.8925, test_f1: 0.5415
 epoch: 23, train_loss: 0.7768, test_loss: 0.8606, test_f1: 0.5543
 epoch: 24, train_loss: 0.7767, test_loss: 0.8635, test_f1: 0.5526
 epoch: 25, train_loss: 0.7706, test_loss: 0.8662, test_f1: 0.5373
 epoch: 26, train_loss: 0.7576, test_loss: 0.8772, test_f1: 0.5631
 epoch: 27, train_loss: 0.7520, test_loss: 0.8822, test_f1: 0.5603
 epoch: 28, train_loss: 0.7345, test_loss: 0.8130, test_f1: 0.5750
 epoch: 29, train_loss: 0.7450, test_loss: 0.8585, test_f1: 0.6046
 epoch: 30, train_loss: 0.7316, test_loss: 0.8384, test_f1: 0.5710
 epoch: 31, train_loss: 0.7254, test_loss: 0.8053, test_f1: 0.6089
 epoch: 32, train_loss: 0.7138, test_loss: 0.8388, test_f1: 0.6037
 epoch: 33, train_loss: 0.7217, test_loss: 0.8393, test_f1: 0.5781
 epoch: 34, train_loss: 0.7206, test_loss: 0.8540, test_f1: 0.5829
 epoch: 35, train_loss: 0.6856, test_loss: 0.8221, test_f1: 0.5829
 epoch: 36, train_loss: 0.7065, test_loss: 0.8353, test_f1: 0.5852
 epoch: 37, train_loss: 0.6837, test_loss: 0.8516, test_f1: 0.6205
 epoch: 38, train_loss: 0.6855, test_loss: 0.8428, test_f1: 0.5960
 epoch: 39, train_loss: 0.6929, test_loss: 0.8133, test_f1: 0.6150
 epoch: 40, train_loss: 0.6795, test_loss: 0.8522, test_f1: 0.5960
 epoch: 41, train_loss: 0.6649, test_loss: 0.8013, test_f1: 0.5953
 epoch: 42, train_loss: 0.6717, test_loss: 0.8379, test_f1: 0.6080
 epoch: 43, train_loss: 0.6684, test_loss: 0.8435, test_f1: 0.6316
 epoch: 44, train_loss: 0.6567, test_loss: 0.7879, test_f1: 0.6205
 epoch: 45, train_loss: 0.6575, test_loss: 0.8229, test_f1: 0.6223
 epoch: 46, train_loss: 0.6467, test_loss: 0.8771, test_f1: 0.6035
 epoch: 47, train_loss: 0.6381, test_loss: 0.8505, test_f1: 0.5981
 epoch: 48, train_loss: 0.6430, test_loss: 0.9162, test_f1: 0.6186
 epoch: 49, train_loss: 0.6368, test_loss: 0.8576, test_f1: 0.6258
 epoch: 50, train_loss: 0.6289, test_loss: 0.8312, test_f1: 0.6292
 epoch: 51, train_loss: 0.6166, test_loss: 0.8502, test_f1: 0.6292
 epoch: 52, train_loss: 0.6095, test_loss: 0.8183, test_f1: 0.6340
 epoch: 53, train_loss: 0.6052, test_loss: 0.8627, test_f1: 0.6159
 epoch: 54, train_loss: 0.5929, test_loss: 0.8460, test_f1: 0.6496
 epoch: 55, train_loss: 0.5806, test_loss: 0.9011, test_f1: 0.6155
 epoch: 56, train_loss: 0.5825, test_loss: 0.8670, test_f1: 0.6411
 epoch: 57, train_loss: 0.5814, test_loss: 0.9325, test_f1: 0.6391
 epoch: 58, train_loss: 0.5826, test_loss: 0.9071, test_f1: 0.6350
 epoch: 59, train_loss: 0.5739, test_loss: 0.9323, test_f1: 0.6091
 epoch: 60, train_loss: 0.5782, test_loss: 0.9073, test_f1: 0.6306
 epoch: 61, train_loss: 0.5763, test_loss: 0.9020, test_f1: 0.6244
 epoch: 62, train_loss: 0.5707, test_loss: 0.9090, test_f1: 0.6305
 epoch: 63, train_loss: 0.5704, test_loss: 0.9147, test_f1: 0.6434
 epoch: 64, train_loss: 0.5606, test_loss: 0.9189, test_f1: 0.6313
 epoch: 65, train_loss: 0.5698, test_loss: 0.9045, test_f1: 0.6360
 epoch: 66, train_loss: 0.5613, test_loss: 0.8863, test_f1: 0.6373
 epoch: 67, train_loss: 0.5615, test_loss: 0.9042, test_f1: 0.6356
 epoch: 68, train_loss: 0.5590, test_loss: 0.9127, test_f1: 0.6213
 epoch: 69, train_loss: 0.5561, test_loss: 0.8778, test_f1: 0.6502
 epoch: 70, train_loss: 0.5481, test_loss: 0.8581, test_f1: 0.6256
 epoch: 71, train_loss: 0.5464, test_loss: 0.9588, test_f1: 0.6266
 epoch: 72, train_loss: 0.5512, test_loss: 0.9424, test_f1: 0.6322
 epoch: 73, train_loss: 0.5423, test_loss: 0.9674, test_f1: 0.6312
 epoch: 74, train_loss: 0.5511, test_loss: 1.0081, test_f1: 0.6364
 epoch: 75, train_loss: 0.5394, test_loss: 0.9686, test_f1: 0.6300
 epoch: 76, train_loss: 0.5354, test_loss: 0.9287, test_f1: 0.6467
 epoch: 77, train_loss: 0.5337, test_loss: 0.8821, test_f1: 0.6427
 epoch: 78, train_loss: 0.5360, test_loss: 0.9816, test_f1: 0.6472
 epoch: 79, train_loss: 0.5211, test_loss: 1.0165, test_f1: 0.6554
 epoch: 80, train_loss: 0.5294, test_loss: 0.9385, test_f1: 0.6333
 epoch: 81, train_loss: 0.5195, test_loss: 0.9960, test_f1: 0.6380
 epoch: 82, train_loss: 0.5275, test_loss: 0.9781, test_f1: 0.6284
 epoch: 83, train_loss: 0.5321, test_loss: 0.9511, test_f1: 0.6366
 epoch: 84, train_loss: 0.5164, test_loss: 1.0228, test_f1: 0.6444
 epoch: 85, train_loss: 0.5089, test_loss: 1.0262, test_f1: 0.6444
 epoch: 86, train_loss: 0.5169, test_loss: 0.9729, test_f1: 0.6437
 epoch: 87, train_loss: 0.5033, test_loss: 0.9668, test_f1: 0.6488
 epoch: 88, train_loss: 0.5177, test_loss: 1.0211, test_f1: 0.6546
 epoch: 89, train_loss: 0.4978, test_loss: 0.9602, test_f1: 0.6441
 epoch: 90, train_loss: 0.5009, test_loss: 1.0543, test_f1: 0.6433
 epoch: 91, train_loss: 0.5054, test_loss: 1.0403, test_f1: 0.6377
 epoch: 92, train_loss: 0.4980, test_loss: 1.0180, test_f1: 0.6455
 epoch: 93, train_loss: 0.4952, test_loss: 0.9777, test_f1: 0.6555
 epoch: 94, train_loss: 0.4928, test_loss: 1.0511, test_f1: 0.6411
 epoch: 95, train_loss: 0.4870, test_loss: 1.0034, test_f1: 0.6374
 epoch: 96, train_loss: 0.4856, test_loss: 1.0708, test_f1: 0.6271
 epoch: 97, train_loss: 0.5008, test_loss: 1.0442, test_f1: 0.6459
 epoch: 98, train_loss: 0.4885, test_loss: 1.0287, test_f1: 0.6419
 epoch: 99, train_loss: 0.4836, test_loss: 1.0501, test_f1: 0.6338
##################ITERATION #1 ****************************************
 epoch: 0, train_loss: 1.1635, test_loss: 1.0195, test_f1: 0.4662
 epoch: 1, train_loss: 1.0220, test_loss: 0.9859, test_f1: 0.5061
 epoch: 2, train_loss: 0.9865, test_loss: 0.9590, test_f1: 0.4989
 epoch: 3, train_loss: 0.9612, test_loss: 0.9522, test_f1: 0.5193
 epoch: 4, train_loss: 0.9499, test_loss: 0.9087, test_f1: 0.5047
 epoch: 5, train_loss: 0.9220, test_loss: 0.8930, test_f1: 0.5502
 epoch: 6, train_loss: 0.9045, test_loss: 0.8728, test_f1: 0.5229
 epoch: 7, train_loss: 0.8878, test_loss: 0.8777, test_f1: 0.5325
 epoch: 8, train_loss: 0.8671, test_loss: 0.8585, test_f1: 0.5566
 epoch: 9, train_loss: 0.8626, test_loss: 0.8400, test_f1: 0.5922
 epoch: 10, train_loss: 0.8463, test_loss: 0.8163, test_f1: 0.5641
 epoch: 11, train_loss: 0.8315, test_loss: 0.8448, test_f1: 0.5688
 epoch: 12, train_loss: 0.8187, test_loss: 0.8115, test_f1: 0.5960
 epoch: 13, train_loss: 0.8161, test_loss: 0.8246, test_f1: 0.5633
 epoch: 14, train_loss: 0.8064, test_loss: 0.7900, test_f1: 0.5996
 epoch: 15, train_loss: 0.8000, test_loss: 0.7859, test_f1: 0.5888
 epoch: 16, train_loss: 0.7812, test_loss: 0.8002, test_f1: 0.5829
 epoch: 17, train_loss: 0.7757, test_loss: 0.7680, test_f1: 0.5914
 epoch: 18, train_loss: 0.7694, test_loss: 0.7705, test_f1: 0.5758
 epoch: 19, train_loss: 0.7544, test_loss: 0.7951, test_f1: 0.6206
 epoch: 20, train_loss: 0.7505, test_loss: 0.7833, test_f1: 0.5968
 epoch: 21, train_loss: 0.7437, test_loss: 0.7848, test_f1: 0.6081
 epoch: 22, train_loss: 0.7306, test_loss: 0.7731, test_f1: 0.6231
 epoch: 23, train_loss: 0.7189, test_loss: 0.7978, test_f1: 0.6399
 epoch: 24, train_loss: 0.7167, test_loss: 0.7753, test_f1: 0.6212
 epoch: 25, train_loss: 0.7152, test_loss: 0.7699, test_f1: 0.6028
 epoch: 26, train_loss: 0.7107, test_loss: 0.7639, test_f1: 0.6400
 epoch: 27, train_loss: 0.6853, test_loss: 0.7973, test_f1: 0.6234
 epoch: 28, train_loss: 0.6923, test_loss: 0.7971, test_f1: 0.5993
 epoch: 29, train_loss: 0.6846, test_loss: 0.7875, test_f1: 0.6154
 epoch: 30, train_loss: 0.6792, test_loss: 0.7605, test_f1: 0.6313
 epoch: 31, train_loss: 0.6695, test_loss: 0.8123, test_f1: 0.6153
 epoch: 32, train_loss: 0.6599, test_loss: 0.7883, test_f1: 0.6272
 epoch: 33, train_loss: 0.6686, test_loss: 0.7673, test_f1: 0.6587
 epoch: 34, train_loss: 0.6627, test_loss: 0.7821, test_f1: 0.6264
 epoch: 35, train_loss: 0.6518, test_loss: 0.8040, test_f1: 0.6340
 epoch: 36, train_loss: 0.6343, test_loss: 0.7704, test_f1: 0.6390
 epoch: 37, train_loss: 0.6476, test_loss: 0.8510, test_f1: 0.6041
 epoch: 38, train_loss: 0.6331, test_loss: 0.7491, test_f1: 0.6536
 epoch: 39, train_loss: 0.6272, test_loss: 0.7700, test_f1: 0.6497
 epoch: 40, train_loss: 0.6230, test_loss: 0.7665, test_f1: 0.6330
 epoch: 41, train_loss: 0.6193, test_loss: 0.8399, test_f1: 0.6328
 epoch: 42, train_loss: 0.6149, test_loss: 0.7595, test_f1: 0.6716
 epoch: 43, train_loss: 0.6056, test_loss: 0.8064, test_f1: 0.6272
 epoch: 44, train_loss: 0.6058, test_loss: 0.8015, test_f1: 0.6452
 epoch: 45, train_loss: 0.5882, test_loss: 0.7928, test_f1: 0.6351
 epoch: 46, train_loss: 0.5897, test_loss: 0.8005, test_f1: 0.6302
 epoch: 47, train_loss: 0.5856, test_loss: 0.8608, test_f1: 0.6373
 epoch: 48, train_loss: 0.5770, test_loss: 0.8533, test_f1: 0.6638
 epoch: 49, train_loss: 0.5703, test_loss: 0.8493, test_f1: 0.6528
 epoch: 50, train_loss: 0.5770, test_loss: 0.8529, test_f1: 0.6613
 epoch: 51, train_loss: 0.5508, test_loss: 0.8615, test_f1: 0.6385
 epoch: 52, train_loss: 0.5406, test_loss: 0.8720, test_f1: 0.6545
 epoch: 53, train_loss: 0.5441, test_loss: 0.8668, test_f1: 0.6487
 epoch: 54, train_loss: 0.5485, test_loss: 0.8830, test_f1: 0.6371
 epoch: 55, train_loss: 0.5283, test_loss: 0.9016, test_f1: 0.6278
 epoch: 56, train_loss: 0.5214, test_loss: 0.8443, test_f1: 0.6323
 epoch: 57, train_loss: 0.5360, test_loss: 0.9212, test_f1: 0.6552
 epoch: 58, train_loss: 0.5294, test_loss: 0.8611, test_f1: 0.6382
 epoch: 59, train_loss: 0.5198, test_loss: 0.8339, test_f1: 0.6205
 epoch: 60, train_loss: 0.5247, test_loss: 0.8250, test_f1: 0.6506
 epoch: 61, train_loss: 0.5183, test_loss: 0.8982, test_f1: 0.6310
 epoch: 62, train_loss: 0.5161, test_loss: 0.8851, test_f1: 0.6573
 epoch: 63, train_loss: 0.5094, test_loss: 0.9347, test_f1: 0.6335
 epoch: 64, train_loss: 0.5084, test_loss: 0.8720, test_f1: 0.6352
 epoch: 65, train_loss: 0.5092, test_loss: 0.8870, test_f1: 0.6357
 epoch: 66, train_loss: 0.4977, test_loss: 0.9431, test_f1: 0.6280
 epoch: 67, train_loss: 0.5008, test_loss: 0.9162, test_f1: 0.6288
 epoch: 68, train_loss: 0.4842, test_loss: 0.9414, test_f1: 0.6302
 epoch: 69, train_loss: 0.4962, test_loss: 0.9344, test_f1: 0.6380
 epoch: 70, train_loss: 0.4866, test_loss: 0.8814, test_f1: 0.6389
 epoch: 71, train_loss: 0.4950, test_loss: 0.9500, test_f1: 0.6310
 epoch: 72, train_loss: 0.4923, test_loss: 1.0410, test_f1: 0.6475
 epoch: 73, train_loss: 0.4961, test_loss: 0.9443, test_f1: 0.6521
 epoch: 74, train_loss: 0.4905, test_loss: 0.9310, test_f1: 0.6281
 epoch: 75, train_loss: 0.4800, test_loss: 0.9475, test_f1: 0.6341
 epoch: 76, train_loss: 0.4756, test_loss: 0.9489, test_f1: 0.6300
 epoch: 77, train_loss: 0.4691, test_loss: 0.9673, test_f1: 0.6370
 epoch: 78, train_loss: 0.4909, test_loss: 1.0043, test_f1: 0.6387
 epoch: 79, train_loss: 0.4790, test_loss: 1.0168, test_f1: 0.6297
 epoch: 80, train_loss: 0.4750, test_loss: 0.9967, test_f1: 0.6324
 epoch: 81, train_loss: 0.4637, test_loss: 1.0679, test_f1: 0.6346
 epoch: 82, train_loss: 0.4690, test_loss: 0.9748, test_f1: 0.6440
 epoch: 83, train_loss: 0.4699, test_loss: 1.0187, test_f1: 0.6354
 epoch: 84, train_loss: 0.4799, test_loss: 0.9976, test_f1: 0.6369
 epoch: 85, train_loss: 0.4502, test_loss: 1.0419, test_f1: 0.6545
 epoch: 86, train_loss: 0.4582, test_loss: 1.0219, test_f1: 0.6404
 epoch: 87, train_loss: 0.4506, test_loss: 0.9681, test_f1: 0.6396
 epoch: 88, train_loss: 0.4561, test_loss: 1.0161, test_f1: 0.6308
 epoch: 89, train_loss: 0.4395, test_loss: 1.1079, test_f1: 0.6340
 epoch: 90, train_loss: 0.4360, test_loss: 1.0530, test_f1: 0.6306
 epoch: 91, train_loss: 0.4485, test_loss: 1.1382, test_f1: 0.6411
 epoch: 92, train_loss: 0.4526, test_loss: 1.1470, test_f1: 0.6490
 epoch: 93, train_loss: 0.4352, test_loss: 1.0741, test_f1: 0.6421
 epoch: 94, train_loss: 0.4412, test_loss: 1.0834, test_f1: 0.6448
 epoch: 95, train_loss: 0.4287, test_loss: 1.1355, test_f1: 0.6436
 epoch: 96, train_loss: 0.4333, test_loss: 1.1308, test_f1: 0.6387
 epoch: 97, train_loss: 0.4326, test_loss: 1.1261, test_f1: 0.6445
 epoch: 98, train_loss: 0.4395, test_loss: 1.0757, test_f1: 0.6390
 epoch: 99, train_loss: 0.4246, test_loss: 1.1096, test_f1: 0.6447
##################ITERATION #2 ****************************************
 epoch: 0, train_loss: 1.1200, test_loss: 0.9883, test_f1: 0.4920
 epoch: 1, train_loss: 0.9944, test_loss: 0.9657, test_f1: 0.5174
 epoch: 2, train_loss: 0.9682, test_loss: 0.9273, test_f1: 0.5378
 epoch: 3, train_loss: 0.9422, test_loss: 0.9050, test_f1: 0.5418
 epoch: 4, train_loss: 0.9177, test_loss: 0.8876, test_f1: 0.5700
 epoch: 5, train_loss: 0.8964, test_loss: 0.8788, test_f1: 0.5642
 epoch: 6, train_loss: 0.8858, test_loss: 0.8572, test_f1: 0.5392
 epoch: 7, train_loss: 0.8678, test_loss: 0.8363, test_f1: 0.5731
 epoch: 8, train_loss: 0.8677, test_loss: 0.8260, test_f1: 0.5671
 epoch: 9, train_loss: 0.8361, test_loss: 0.8768, test_f1: 0.5611
 epoch: 10, train_loss: 0.8286, test_loss: 0.8100, test_f1: 0.5723
 epoch: 11, train_loss: 0.8211, test_loss: 0.8133, test_f1: 0.5788
 epoch: 12, train_loss: 0.8051, test_loss: 0.7958, test_f1: 0.5958
 epoch: 13, train_loss: 0.7982, test_loss: 0.7900, test_f1: 0.6046
 epoch: 14, train_loss: 0.7907, test_loss: 0.7579, test_f1: 0.5959
 epoch: 15, train_loss: 0.7791, test_loss: 0.7667, test_f1: 0.6024
 epoch: 16, train_loss: 0.7795, test_loss: 0.7586, test_f1: 0.6073
 epoch: 17, train_loss: 0.7593, test_loss: 0.7983, test_f1: 0.5960
 epoch: 18, train_loss: 0.7494, test_loss: 0.7536, test_f1: 0.6268
 epoch: 19, train_loss: 0.7408, test_loss: 0.7651, test_f1: 0.6512
 epoch: 20, train_loss: 0.7430, test_loss: 0.7449, test_f1: 0.6278
 epoch: 21, train_loss: 0.7237, test_loss: 0.7895, test_f1: 0.6366
 epoch: 22, train_loss: 0.7195, test_loss: 0.7648, test_f1: 0.6385
 epoch: 23, train_loss: 0.7095, test_loss: 0.7053, test_f1: 0.6642
 epoch: 24, train_loss: 0.7158, test_loss: 0.7637, test_f1: 0.6106
 epoch: 25, train_loss: 0.6982, test_loss: 0.7353, test_f1: 0.6374
 epoch: 26, train_loss: 0.6926, test_loss: 0.7392, test_f1: 0.6287
 epoch: 27, train_loss: 0.6835, test_loss: 0.7672, test_f1: 0.6741
 epoch: 28, train_loss: 0.6854, test_loss: 0.7549, test_f1: 0.6455
 epoch: 29, train_loss: 0.6686, test_loss: 0.7462, test_f1: 0.6402
 epoch: 30, train_loss: 0.6705, test_loss: 0.7715, test_f1: 0.6558
 epoch: 31, train_loss: 0.6636, test_loss: 0.7593, test_f1: 0.6339
 epoch: 32, train_loss: 0.6541, test_loss: 0.7227, test_f1: 0.6478
 epoch: 33, train_loss: 0.6568, test_loss: 0.7820, test_f1: 0.6529
 epoch: 34, train_loss: 0.6315, test_loss: 0.7565, test_f1: 0.6398
 epoch: 35, train_loss: 0.6315, test_loss: 0.7631, test_f1: 0.6443
 epoch: 36, train_loss: 0.6310, test_loss: 0.7411, test_f1: 0.6406
 epoch: 37, train_loss: 0.6314, test_loss: 0.7668, test_f1: 0.6473
 epoch: 38, train_loss: 0.6198, test_loss: 0.7670, test_f1: 0.6493
 epoch: 39, train_loss: 0.6031, test_loss: 0.7119, test_f1: 0.6423
 epoch: 40, train_loss: 0.6003, test_loss: 0.7780, test_f1: 0.6475
 epoch: 41, train_loss: 0.6097, test_loss: 0.8293, test_f1: 0.6486
 epoch: 42, train_loss: 0.5957, test_loss: 0.8269, test_f1: 0.6233
 epoch: 43, train_loss: 0.5936, test_loss: 0.7876, test_f1: 0.6522
 epoch: 44, train_loss: 0.5867, test_loss: 0.7918, test_f1: 0.6145
 epoch: 45, train_loss: 0.5837, test_loss: 0.8588, test_f1: 0.6236
 epoch: 46, train_loss: 0.5755, test_loss: 0.7914, test_f1: 0.6334
 epoch: 47, train_loss: 0.5743, test_loss: 0.8996, test_f1: 0.6465
 epoch: 48, train_loss: 0.5794, test_loss: 0.8419, test_f1: 0.6384
 epoch: 49, train_loss: 0.5683, test_loss: 0.9114, test_f1: 0.6322
 epoch: 50, train_loss: 0.5533, test_loss: 0.8520, test_f1: 0.6535
 epoch: 51, train_loss: 0.5357, test_loss: 0.8682, test_f1: 0.6616
 epoch: 52, train_loss: 0.5366, test_loss: 0.8535, test_f1: 0.6586
 epoch: 53, train_loss: 0.5310, test_loss: 0.8736, test_f1: 0.6365
 epoch: 54, train_loss: 0.5254, test_loss: 0.8563, test_f1: 0.6452
 epoch: 55, train_loss: 0.5307, test_loss: 0.8969, test_f1: 0.6689
 epoch: 56, train_loss: 0.5255, test_loss: 0.8645, test_f1: 0.6470
 epoch: 57, train_loss: 0.5131, test_loss: 0.9271, test_f1: 0.6552
 epoch: 58, train_loss: 0.5108, test_loss: 0.8514, test_f1: 0.6768
 epoch: 59, train_loss: 0.5085, test_loss: 0.9188, test_f1: 0.6400
 epoch: 60, train_loss: 0.5153, test_loss: 0.9203, test_f1: 0.6635
 epoch: 61, train_loss: 0.5040, test_loss: 0.9363, test_f1: 0.6463
 epoch: 62, train_loss: 0.4934, test_loss: 0.8710, test_f1: 0.6559
 epoch: 63, train_loss: 0.4999, test_loss: 0.8849, test_f1: 0.6447
 epoch: 64, train_loss: 0.4997, test_loss: 0.9824, test_f1: 0.6606
 epoch: 65, train_loss: 0.5024, test_loss: 0.9695, test_f1: 0.6546
 epoch: 66, train_loss: 0.4975, test_loss: 0.9284, test_f1: 0.6473
 epoch: 67, train_loss: 0.4894, test_loss: 0.9116, test_f1: 0.6513
 epoch: 68, train_loss: 0.4943, test_loss: 0.9259, test_f1: 0.6320
 epoch: 69, train_loss: 0.5029, test_loss: 0.9450, test_f1: 0.6392
 epoch: 70, train_loss: 0.4793, test_loss: 0.9289, test_f1: 0.6462
 epoch: 71, train_loss: 0.4778, test_loss: 0.8960, test_f1: 0.6431
 epoch: 72, train_loss: 0.4689, test_loss: 0.9240, test_f1: 0.6460
 epoch: 73, train_loss: 0.4768, test_loss: 0.8961, test_f1: 0.6526
 epoch: 74, train_loss: 0.4622, test_loss: 1.0453, test_f1: 0.6414
 epoch: 75, train_loss: 0.4582, test_loss: 1.0290, test_f1: 0.6545
 epoch: 76, train_loss: 0.4686, test_loss: 1.0033, test_f1: 0.6426
 epoch: 77, train_loss: 0.4692, test_loss: 1.0211, test_f1: 0.6431
 epoch: 78, train_loss: 0.4582, test_loss: 0.9996, test_f1: 0.6431
 epoch: 79, train_loss: 0.4569, test_loss: 1.0341, test_f1: 0.6462
 epoch: 80, train_loss: 0.4578, test_loss: 1.0245, test_f1: 0.6569
 epoch: 81, train_loss: 0.4557, test_loss: 1.0613, test_f1: 0.6408
 epoch: 82, train_loss: 0.4498, test_loss: 1.0709, test_f1: 0.6354
 epoch: 83, train_loss: 0.4534, test_loss: 1.0420, test_f1: 0.6532
 epoch: 84, train_loss: 0.4586, test_loss: 1.1087, test_f1: 0.6564
 epoch: 85, train_loss: 0.4460, test_loss: 1.0925, test_f1: 0.6509
 epoch: 86, train_loss: 0.4474, test_loss: 1.0639, test_f1: 0.6596
 epoch: 87, train_loss: 0.4416, test_loss: 1.0418, test_f1: 0.6489
 epoch: 88, train_loss: 0.4370, test_loss: 1.0666, test_f1: 0.6512
 epoch: 89, train_loss: 0.4433, test_loss: 1.1202, test_f1: 0.6452
 epoch: 90, train_loss: 0.4468, test_loss: 1.0667, test_f1: 0.6553
 epoch: 91, train_loss: 0.4203, test_loss: 1.0864, test_f1: 0.6635
 epoch: 92, train_loss: 0.4356, test_loss: 1.1429, test_f1: 0.6371
 epoch: 93, train_loss: 0.4276, test_loss: 1.1327, test_f1: 0.6591
 epoch: 94, train_loss: 0.4476, test_loss: 1.1646, test_f1: 0.6489
 epoch: 95, train_loss: 0.4236, test_loss: 1.1457, test_f1: 0.6386
 epoch: 96, train_loss: 0.4247, test_loss: 1.1622, test_f1: 0.6495
 epoch: 97, train_loss: 0.4125, test_loss: 1.1406, test_f1: 0.6437
 epoch: 98, train_loss: 0.4175, test_loss: 1.1406, test_f1: 0.6520
 epoch: 99, train_loss: 0.4119, test_loss: 1.2222, test_f1: 0.6443
##################ITERATION #3 ****************************************
 epoch: 0, train_loss: 1.1145, test_loss: 0.9794, test_f1: 0.5055
 epoch: 1, train_loss: 0.9817, test_loss: 0.9364, test_f1: 0.5185
 epoch: 2, train_loss: 0.9643, test_loss: 0.9287, test_f1: 0.5387
 epoch: 3, train_loss: 0.9370, test_loss: 0.8959, test_f1: 0.5395
 epoch: 4, train_loss: 0.9223, test_loss: 0.8985, test_f1: 0.5357
 epoch: 5, train_loss: 0.9050, test_loss: 0.8883, test_f1: 0.5574
 epoch: 6, train_loss: 0.8859, test_loss: 0.8541, test_f1: 0.5685
 epoch: 7, train_loss: 0.8658, test_loss: 0.8234, test_f1: 0.5756
 epoch: 8, train_loss: 0.8536, test_loss: 0.8562, test_f1: 0.5692
 epoch: 9, train_loss: 0.8396, test_loss: 0.7822, test_f1: 0.5889
 epoch: 10, train_loss: 0.8190, test_loss: 0.7722, test_f1: 0.5723
 epoch: 11, train_loss: 0.8009, test_loss: 0.7811, test_f1: 0.5572
 epoch: 12, train_loss: 0.8011, test_loss: 0.7600, test_f1: 0.6108
 epoch: 13, train_loss: 0.7924, test_loss: 0.7723, test_f1: 0.5828
 epoch: 14, train_loss: 0.7719, test_loss: 0.7462, test_f1: 0.6157
 epoch: 15, train_loss: 0.7742, test_loss: 0.7804, test_f1: 0.6211
 epoch: 16, train_loss: 0.7524, test_loss: 0.7367, test_f1: 0.6563
 epoch: 17, train_loss: 0.7403, test_loss: 0.7530, test_f1: 0.6112
 epoch: 18, train_loss: 0.7405, test_loss: 0.7394, test_f1: 0.6380
 epoch: 19, train_loss: 0.7365, test_loss: 0.7481, test_f1: 0.6415
 epoch: 20, train_loss: 0.7226, test_loss: 0.7186, test_f1: 0.6579
 epoch: 21, train_loss: 0.7064, test_loss: 0.7222, test_f1: 0.6089
 epoch: 22, train_loss: 0.6968, test_loss: 0.7162, test_f1: 0.6782
 epoch: 23, train_loss: 0.6935, test_loss: 0.7210, test_f1: 0.6664
 epoch: 24, train_loss: 0.6891, test_loss: 0.6938, test_f1: 0.6642
 epoch: 25, train_loss: 0.6798, test_loss: 0.7737, test_f1: 0.6291
 epoch: 26, train_loss: 0.6721, test_loss: 0.7494, test_f1: 0.6483
 epoch: 27, train_loss: 0.6662, test_loss: 0.7398, test_f1: 0.6221
 epoch: 28, train_loss: 0.6532, test_loss: 0.7331, test_f1: 0.6451
 epoch: 29, train_loss: 0.6580, test_loss: 0.7732, test_f1: 0.6701
 epoch: 30, train_loss: 0.6463, test_loss: 0.7551, test_f1: 0.6367
 epoch: 31, train_loss: 0.6280, test_loss: 0.7441, test_f1: 0.6552
 epoch: 32, train_loss: 0.6495, test_loss: 0.7426, test_f1: 0.6466
 epoch: 33, train_loss: 0.6273, test_loss: 0.7786, test_f1: 0.6314
 epoch: 34, train_loss: 0.6146, test_loss: 0.7940, test_f1: 0.6285
 epoch: 35, train_loss: 0.6232, test_loss: 0.7287, test_f1: 0.6441
 epoch: 36, train_loss: 0.6132, test_loss: 0.8173, test_f1: 0.6326
 epoch: 37, train_loss: 0.6003, test_loss: 0.7893, test_f1: 0.6457
 epoch: 38, train_loss: 0.5902, test_loss: 0.8301, test_f1: 0.6343
 epoch: 39, train_loss: 0.5926, test_loss: 0.8510, test_f1: 0.6400
 epoch: 40, train_loss: 0.5866, test_loss: 0.7997, test_f1: 0.6469
 epoch: 41, train_loss: 0.5802, test_loss: 0.7750, test_f1: 0.6435
 epoch: 42, train_loss: 0.5736, test_loss: 0.8011, test_f1: 0.6242
 epoch: 43, train_loss: 0.5748, test_loss: 0.8476, test_f1: 0.6408
 epoch: 44, train_loss: 0.5639, test_loss: 0.8510, test_f1: 0.6542
 epoch: 45, train_loss: 0.5697, test_loss: 0.8479, test_f1: 0.6421
 epoch: 46, train_loss: 0.5598, test_loss: 0.7686, test_f1: 0.6582
 epoch: 47, train_loss: 0.5555, test_loss: 0.8135, test_f1: 0.6495
 epoch: 48, train_loss: 0.5612, test_loss: 0.8421, test_f1: 0.6572
 epoch: 49, train_loss: 0.5378, test_loss: 0.8509, test_f1: 0.6368
 epoch: 50, train_loss: 0.5411, test_loss: 0.8667, test_f1: 0.6419
 epoch: 51, train_loss: 0.5118, test_loss: 0.8445, test_f1: 0.6408
 epoch: 52, train_loss: 0.5136, test_loss: 0.8870, test_f1: 0.6254
 epoch: 53, train_loss: 0.5104, test_loss: 0.8317, test_f1: 0.6447
 epoch: 54, train_loss: 0.4916, test_loss: 0.8450, test_f1: 0.6427
 epoch: 55, train_loss: 0.5061, test_loss: 0.8664, test_f1: 0.6340
 epoch: 56, train_loss: 0.5026, test_loss: 0.8616, test_f1: 0.6368
 epoch: 57, train_loss: 0.5021, test_loss: 0.8821, test_f1: 0.6283
 epoch: 58, train_loss: 0.5005, test_loss: 0.9486, test_f1: 0.6240
 epoch: 59, train_loss: 0.4863, test_loss: 0.8948, test_f1: 0.6410
 epoch: 60, train_loss: 0.4707, test_loss: 0.8706, test_f1: 0.6466
 epoch: 61, train_loss: 0.4830, test_loss: 0.8644, test_f1: 0.6542
 epoch: 62, train_loss: 0.4761, test_loss: 0.9895, test_f1: 0.6384
 epoch: 63, train_loss: 0.4810, test_loss: 0.9070, test_f1: 0.6542
 epoch: 64, train_loss: 0.4747, test_loss: 0.9567, test_f1: 0.6323
 epoch: 65, train_loss: 0.4833, test_loss: 0.9413, test_f1: 0.6146
 epoch: 66, train_loss: 0.4563, test_loss: 0.8601, test_f1: 0.6516
 epoch: 67, train_loss: 0.4733, test_loss: 0.9749, test_f1: 0.6410
 epoch: 68, train_loss: 0.4590, test_loss: 0.9585, test_f1: 0.6353
 epoch: 69, train_loss: 0.4623, test_loss: 0.9869, test_f1: 0.6393
 epoch: 70, train_loss: 0.4646, test_loss: 0.9756, test_f1: 0.6352
 epoch: 71, train_loss: 0.4560, test_loss: 0.9445, test_f1: 0.6478
 epoch: 72, train_loss: 0.4484, test_loss: 0.9087, test_f1: 0.6405
 epoch: 73, train_loss: 0.4610, test_loss: 1.0007, test_f1: 0.6270
 epoch: 74, train_loss: 0.4467, test_loss: 0.9169, test_f1: 0.6574
 epoch: 75, train_loss: 0.4406, test_loss: 0.9260, test_f1: 0.6440
 epoch: 76, train_loss: 0.4554, test_loss: 0.9330, test_f1: 0.6493
 epoch: 77, train_loss: 0.4342, test_loss: 1.0007, test_f1: 0.6421
 epoch: 78, train_loss: 0.4395, test_loss: 1.0382, test_f1: 0.6372
 epoch: 79, train_loss: 0.4331, test_loss: 0.9642, test_f1: 0.6501
 epoch: 80, train_loss: 0.4273, test_loss: 1.0899, test_f1: 0.6281
 epoch: 81, train_loss: 0.4237, test_loss: 1.0356, test_f1: 0.6575
 epoch: 82, train_loss: 0.4365, test_loss: 1.0453, test_f1: 0.6424
 epoch: 83, train_loss: 0.4333, test_loss: 0.9988, test_f1: 0.6492
 epoch: 84, train_loss: 0.4284, test_loss: 1.0715, test_f1: 0.6354
 epoch: 85, train_loss: 0.4300, test_loss: 1.0991, test_f1: 0.6388
 epoch: 86, train_loss: 0.4089, test_loss: 1.0451, test_f1: 0.6475
 epoch: 87, train_loss: 0.4114, test_loss: 1.0264, test_f1: 0.6608
 epoch: 88, train_loss: 0.4089, test_loss: 1.0949, test_f1: 0.6299
 epoch: 89, train_loss: 0.4114, test_loss: 1.0097, test_f1: 0.6482
 epoch: 90, train_loss: 0.4041, test_loss: 1.0165, test_f1: 0.6382
 epoch: 91, train_loss: 0.4110, test_loss: 1.0919, test_f1: 0.6298
 epoch: 92, train_loss: 0.4145, test_loss: 1.1364, test_f1: 0.6357
 epoch: 93, train_loss: 0.3968, test_loss: 1.0619, test_f1: 0.6688
 epoch: 94, train_loss: 0.4062, test_loss: 1.0703, test_f1: 0.6423
 epoch: 95, train_loss: 0.3956, test_loss: 1.0732, test_f1: 0.6463
 epoch: 96, train_loss: 0.3916, test_loss: 1.0489, test_f1: 0.6392
 epoch: 97, train_loss: 0.3794, test_loss: 1.1598, test_f1: 0.6314
 epoch: 98, train_loss: 0.3977, test_loss: 1.1275, test_f1: 0.6306
 epoch: 99, train_loss: 0.3919, test_loss: 1.0781, test_f1: 0.6515
##################ITERATION #4 ****************************************
 epoch: 0, train_loss: 1.1288, test_loss: 0.9860, test_f1: 0.5123
 epoch: 1, train_loss: 1.0064, test_loss: 0.9519, test_f1: 0.4857
 epoch: 2, train_loss: 0.9751, test_loss: 0.9330, test_f1: 0.5198
 epoch: 3, train_loss: 0.9518, test_loss: 0.9118, test_f1: 0.5283
 epoch: 4, train_loss: 0.9288, test_loss: 0.8939, test_f1: 0.5332
 epoch: 5, train_loss: 0.9096, test_loss: 0.8965, test_f1: 0.5666
 epoch: 6, train_loss: 0.8969, test_loss: 0.8698, test_f1: 0.5921
 epoch: 7, train_loss: 0.8812, test_loss: 0.8613, test_f1: 0.5719
 epoch: 8, train_loss: 0.8692, test_loss: 0.8579, test_f1: 0.5710
 epoch: 9, train_loss: 0.8559, test_loss: 0.8374, test_f1: 0.5927
 epoch: 10, train_loss: 0.8440, test_loss: 0.8652, test_f1: 0.5623
 epoch: 11, train_loss: 0.8377, test_loss: 0.8533, test_f1: 0.5917
 epoch: 12, train_loss: 0.8259, test_loss: 0.8050, test_f1: 0.5912
 epoch: 13, train_loss: 0.8046, test_loss: 0.8292, test_f1: 0.6100
 epoch: 14, train_loss: 0.8158, test_loss: 0.8043, test_f1: 0.6115
 epoch: 15, train_loss: 0.7929, test_loss: 0.7969, test_f1: 0.5972
 epoch: 16, train_loss: 0.7800, test_loss: 0.7810, test_f1: 0.5976
 epoch: 17, train_loss: 0.7697, test_loss: 0.8052, test_f1: 0.5996
 epoch: 18, train_loss: 0.7550, test_loss: 0.7788, test_f1: 0.6117
 epoch: 19, train_loss: 0.7594, test_loss: 0.7976, test_f1: 0.6224
 epoch: 20, train_loss: 0.7498, test_loss: 0.7618, test_f1: 0.6279
 epoch: 21, train_loss: 0.7462, test_loss: 0.7684, test_f1: 0.6364
 epoch: 22, train_loss: 0.7352, test_loss: 0.7735, test_f1: 0.6358
 epoch: 23, train_loss: 0.7258, test_loss: 0.7528, test_f1: 0.6283
 epoch: 24, train_loss: 0.7205, test_loss: 0.7458, test_f1: 0.6316
 epoch: 25, train_loss: 0.7182, test_loss: 0.7435, test_f1: 0.6225
 epoch: 26, train_loss: 0.7043, test_loss: 0.7522, test_f1: 0.6197
 epoch: 27, train_loss: 0.6987, test_loss: 0.7374, test_f1: 0.6442
 epoch: 28, train_loss: 0.6981, test_loss: 0.7175, test_f1: 0.6542
 epoch: 29, train_loss: 0.6788, test_loss: 0.7338, test_f1: 0.6596
 epoch: 30, train_loss: 0.6663, test_loss: 0.7840, test_f1: 0.6466
 epoch: 31, train_loss: 0.6775, test_loss: 0.7198, test_f1: 0.6542
 epoch: 32, train_loss: 0.6613, test_loss: 0.7470, test_f1: 0.6591
 epoch: 33, train_loss: 0.6489, test_loss: 0.7396, test_f1: 0.6549
 epoch: 34, train_loss: 0.6552, test_loss: 0.7094, test_f1: 0.6523
 epoch: 35, train_loss: 0.6364, test_loss: 0.7308, test_f1: 0.6486
 epoch: 36, train_loss: 0.6404, test_loss: 0.7199, test_f1: 0.6472
 epoch: 37, train_loss: 0.6337, test_loss: 0.7298, test_f1: 0.6529
 epoch: 38, train_loss: 0.6340, test_loss: 0.7421, test_f1: 0.6499
 epoch: 39, train_loss: 0.6315, test_loss: 0.7303, test_f1: 0.6483
 epoch: 40, train_loss: 0.6185, test_loss: 0.7537, test_f1: 0.6552
 epoch: 41, train_loss: 0.6092, test_loss: 0.7402, test_f1: 0.6324
 epoch: 42, train_loss: 0.6077, test_loss: 0.7315, test_f1: 0.6572
 epoch: 43, train_loss: 0.5915, test_loss: 0.7583, test_f1: 0.6423
 epoch: 44, train_loss: 0.5931, test_loss: 0.7610, test_f1: 0.6676
 epoch: 45, train_loss: 0.5916, test_loss: 0.7443, test_f1: 0.6530
 epoch: 46, train_loss: 0.5771, test_loss: 0.7658, test_f1: 0.6270
 epoch: 47, train_loss: 0.5711, test_loss: 0.7534, test_f1: 0.6686
 epoch: 48, train_loss: 0.5658, test_loss: 0.7903, test_f1: 0.6468
 epoch: 49, train_loss: 0.5706, test_loss: 0.7534, test_f1: 0.6693
 epoch: 50, train_loss: 0.5716, test_loss: 0.7631, test_f1: 0.6559
 epoch: 51, train_loss: 0.5513, test_loss: 0.7488, test_f1: 0.6590
 epoch: 52, train_loss: 0.5477, test_loss: 0.7910, test_f1: 0.6563
 epoch: 53, train_loss: 0.5375, test_loss: 0.7730, test_f1: 0.6571
 epoch: 54, train_loss: 0.5279, test_loss: 0.8081, test_f1: 0.6347
 epoch: 55, train_loss: 0.5241, test_loss: 0.7501, test_f1: 0.6674
 epoch: 56, train_loss: 0.5267, test_loss: 0.7760, test_f1: 0.6555
 epoch: 57, train_loss: 0.5128, test_loss: 0.7810, test_f1: 0.6525
 epoch: 58, train_loss: 0.5071, test_loss: 0.7897, test_f1: 0.6526
 epoch: 59, train_loss: 0.5192, test_loss: 0.7868, test_f1: 0.6454
 epoch: 60, train_loss: 0.5112, test_loss: 0.8087, test_f1: 0.6591
 epoch: 61, train_loss: 0.5100, test_loss: 0.7759, test_f1: 0.6655
 epoch: 62, train_loss: 0.5039, test_loss: 0.8444, test_f1: 0.6489
 epoch: 63, train_loss: 0.5136, test_loss: 0.8191, test_f1: 0.6492
 epoch: 64, train_loss: 0.5039, test_loss: 0.8422, test_f1: 0.6632
 epoch: 65, train_loss: 0.4956, test_loss: 0.8191, test_f1: 0.6598
 epoch: 66, train_loss: 0.4990, test_loss: 0.8097, test_f1: 0.6583
 epoch: 67, train_loss: 0.4935, test_loss: 0.8253, test_f1: 0.6650
 epoch: 68, train_loss: 0.4847, test_loss: 0.8852, test_f1: 0.6589
 epoch: 69, train_loss: 0.4845, test_loss: 0.8377, test_f1: 0.6606
 epoch: 70, train_loss: 0.4911, test_loss: 0.8543, test_f1: 0.6532
 epoch: 71, train_loss: 0.4860, test_loss: 0.8341, test_f1: 0.6707
 epoch: 72, train_loss: 0.4712, test_loss: 0.9034, test_f1: 0.6579
 epoch: 73, train_loss: 0.4775, test_loss: 0.8609, test_f1: 0.6650
 epoch: 74, train_loss: 0.4779, test_loss: 0.9823, test_f1: 0.6505
 epoch: 75, train_loss: 0.4624, test_loss: 0.8878, test_f1: 0.6607
 epoch: 76, train_loss: 0.4741, test_loss: 0.9086, test_f1: 0.6631
 epoch: 77, train_loss: 0.4641, test_loss: 0.8800, test_f1: 0.6693
 epoch: 78, train_loss: 0.4549, test_loss: 0.9212, test_f1: 0.6570
 epoch: 79, train_loss: 0.4673, test_loss: 0.9476, test_f1: 0.6651
 epoch: 80, train_loss: 0.4536, test_loss: 0.8816, test_f1: 0.6542
 epoch: 81, train_loss: 0.4697, test_loss: 0.8921, test_f1: 0.6614
 epoch: 82, train_loss: 0.4546, test_loss: 0.9020, test_f1: 0.6698
 epoch: 83, train_loss: 0.4700, test_loss: 0.9373, test_f1: 0.6682
 epoch: 84, train_loss: 0.4473, test_loss: 0.8969, test_f1: 0.6598
 epoch: 85, train_loss: 0.4536, test_loss: 0.9322, test_f1: 0.6555
 epoch: 86, train_loss: 0.4354, test_loss: 0.9479, test_f1: 0.6634
 epoch: 87, train_loss: 0.4518, test_loss: 0.9439, test_f1: 0.6519
 epoch: 88, train_loss: 0.4524, test_loss: 0.9430, test_f1: 0.6580
 epoch: 89, train_loss: 0.4580, test_loss: 1.0423, test_f1: 0.6502
 epoch: 90, train_loss: 0.4458, test_loss: 0.9415, test_f1: 0.6594
 epoch: 91, train_loss: 0.4333, test_loss: 0.9722, test_f1: 0.6582
 epoch: 92, train_loss: 0.4306, test_loss: 1.0432, test_f1: 0.6684
 epoch: 93, train_loss: 0.4236, test_loss: 0.9690, test_f1: 0.6619
 epoch: 94, train_loss: 0.4265, test_loss: 0.9464, test_f1: 0.6573
 epoch: 95, train_loss: 0.4317, test_loss: 0.9318, test_f1: 0.6624
 epoch: 96, train_loss: 0.4169, test_loss: 1.0281, test_f1: 0.6652
 epoch: 97, train_loss: 0.4255, test_loss: 1.0120, test_f1: 0.6590
 epoch: 98, train_loss: 0.4378, test_loss: 0.9873, test_f1: 0.6699
 epoch: 99, train_loss: 0.4220, test_loss: 1.0053, test_f1: 0.6591
##################ITERATION #5 ****************************************
 epoch: 0, train_loss: 1.1410, test_loss: 0.9691, test_f1: 0.5270
 epoch: 1, train_loss: 1.0027, test_loss: 0.9296, test_f1: 0.5540
 epoch: 2, train_loss: 0.9679, test_loss: 0.9048, test_f1: 0.5618
 epoch: 3, train_loss: 0.9405, test_loss: 0.8727, test_f1: 0.5302
 epoch: 4, train_loss: 0.9168, test_loss: 0.8750, test_f1: 0.5108
 epoch: 5, train_loss: 0.8928, test_loss: 0.8680, test_f1: 0.5510
 epoch: 6, train_loss: 0.8845, test_loss: 0.8613, test_f1: 0.5431
 epoch: 7, train_loss: 0.8704, test_loss: 0.8738, test_f1: 0.5443
 epoch: 8, train_loss: 0.8673, test_loss: 0.8545, test_f1: 0.5600
 epoch: 9, train_loss: 0.8454, test_loss: 0.8371, test_f1: 0.5750
 epoch: 10, train_loss: 0.8283, test_loss: 0.8176, test_f1: 0.5917
 epoch: 11, train_loss: 0.8229, test_loss: 0.8353, test_f1: 0.5870
 epoch: 12, train_loss: 0.8007, test_loss: 0.8436, test_f1: 0.5839
 epoch: 13, train_loss: 0.8088, test_loss: 0.8260, test_f1: 0.6046
 epoch: 14, train_loss: 0.7872, test_loss: 0.8188, test_f1: 0.6041
 epoch: 15, train_loss: 0.7921, test_loss: 0.7770, test_f1: 0.6209
 epoch: 16, train_loss: 0.7680, test_loss: 0.8276, test_f1: 0.5897
 epoch: 17, train_loss: 0.7578, test_loss: 0.7889, test_f1: 0.6072
 epoch: 18, train_loss: 0.7500, test_loss: 0.8405, test_f1: 0.6310
 epoch: 19, train_loss: 0.7326, test_loss: 0.7747, test_f1: 0.6059
 epoch: 20, train_loss: 0.7380, test_loss: 0.8052, test_f1: 0.6217
 epoch: 21, train_loss: 0.7281, test_loss: 0.7645, test_f1: 0.6099
 epoch: 22, train_loss: 0.7218, test_loss: 0.7521, test_f1: 0.6438
 epoch: 23, train_loss: 0.7142, test_loss: 0.8006, test_f1: 0.5957
 epoch: 24, train_loss: 0.7044, test_loss: 0.7499, test_f1: 0.6363
 epoch: 25, train_loss: 0.6988, test_loss: 0.7669, test_f1: 0.5956
 epoch: 26, train_loss: 0.6989, test_loss: 0.7748, test_f1: 0.5991
 epoch: 27, train_loss: 0.6912, test_loss: 0.7609, test_f1: 0.6271
 epoch: 28, train_loss: 0.6714, test_loss: 0.7361, test_f1: 0.6413
 epoch: 29, train_loss: 0.6743, test_loss: 0.8100, test_f1: 0.5999
 epoch: 30, train_loss: 0.6626, test_loss: 0.7516, test_f1: 0.6157
 epoch: 31, train_loss: 0.6528, test_loss: 0.7686, test_f1: 0.6564
 epoch: 32, train_loss: 0.6447, test_loss: 0.7927, test_f1: 0.6378
 epoch: 33, train_loss: 0.6405, test_loss: 0.8072, test_f1: 0.6368
 epoch: 34, train_loss: 0.6343, test_loss: 0.7424, test_f1: 0.6344
 epoch: 35, train_loss: 0.6338, test_loss: 0.7933, test_f1: 0.6153
 epoch: 36, train_loss: 0.6395, test_loss: 0.8016, test_f1: 0.6431
 epoch: 37, train_loss: 0.6131, test_loss: 0.7765, test_f1: 0.6277
 epoch: 38, train_loss: 0.6159, test_loss: 0.8444, test_f1: 0.6439
 epoch: 39, train_loss: 0.6118, test_loss: 0.7588, test_f1: 0.6641
 epoch: 40, train_loss: 0.5977, test_loss: 0.7463, test_f1: 0.6691
 epoch: 41, train_loss: 0.5989, test_loss: 0.7419, test_f1: 0.6388
 epoch: 42, train_loss: 0.5879, test_loss: 0.7371, test_f1: 0.6721
 epoch: 43, train_loss: 0.5887, test_loss: 0.8199, test_f1: 0.6507
 epoch: 44, train_loss: 0.5815, test_loss: 0.9309, test_f1: 0.6428
 epoch: 45, train_loss: 0.5725, test_loss: 0.7263, test_f1: 0.6520
 epoch: 46, train_loss: 0.5537, test_loss: 0.8194, test_f1: 0.6560
 epoch: 47, train_loss: 0.5648, test_loss: 0.8654, test_f1: 0.6533
 epoch: 48, train_loss: 0.5650, test_loss: 0.8396, test_f1: 0.6401
 epoch: 49, train_loss: 0.5565, test_loss: 0.8167, test_f1: 0.6422
 epoch: 50, train_loss: 0.5464, test_loss: 0.7725, test_f1: 0.6418
 epoch: 51, train_loss: 0.5270, test_loss: 0.8154, test_f1: 0.6549
 epoch: 52, train_loss: 0.5112, test_loss: 0.7833, test_f1: 0.6554
 epoch: 53, train_loss: 0.5243, test_loss: 0.8645, test_f1: 0.6427
 epoch: 54, train_loss: 0.5108, test_loss: 0.8758, test_f1: 0.6394
 epoch: 55, train_loss: 0.5040, test_loss: 0.7688, test_f1: 0.6516
 epoch: 56, train_loss: 0.5105, test_loss: 0.8275, test_f1: 0.6497
 epoch: 57, train_loss: 0.4939, test_loss: 0.8227, test_f1: 0.6463
 epoch: 58, train_loss: 0.4967, test_loss: 0.8380, test_f1: 0.6473
 epoch: 59, train_loss: 0.4939, test_loss: 0.9472, test_f1: 0.6412
 epoch: 60, train_loss: 0.4854, test_loss: 0.8791, test_f1: 0.6439
 epoch: 61, train_loss: 0.4942, test_loss: 0.9305, test_f1: 0.6422
 epoch: 62, train_loss: 0.4806, test_loss: 0.8889, test_f1: 0.6569
 epoch: 63, train_loss: 0.4814, test_loss: 0.9909, test_f1: 0.6402
 epoch: 64, train_loss: 0.4739, test_loss: 0.8805, test_f1: 0.6671
 epoch: 65, train_loss: 0.4737, test_loss: 0.9101, test_f1: 0.6588
 epoch: 66, train_loss: 0.4760, test_loss: 0.8636, test_f1: 0.6665
 epoch: 67, train_loss: 0.4781, test_loss: 0.8753, test_f1: 0.6529
 epoch: 68, train_loss: 0.4699, test_loss: 0.8103, test_f1: 0.6604
 epoch: 69, train_loss: 0.4681, test_loss: 0.8466, test_f1: 0.6592
 epoch: 70, train_loss: 0.4633, test_loss: 0.8370, test_f1: 0.6521
 epoch: 71, train_loss: 0.4693, test_loss: 0.9176, test_f1: 0.6361
 epoch: 72, train_loss: 0.4545, test_loss: 0.8728, test_f1: 0.6643
 epoch: 73, train_loss: 0.4728, test_loss: 0.9016, test_f1: 0.6467
 epoch: 74, train_loss: 0.4611, test_loss: 0.8964, test_f1: 0.6434
 epoch: 75, train_loss: 0.4554, test_loss: 0.9442, test_f1: 0.6503
 epoch: 76, train_loss: 0.4406, test_loss: 0.8694, test_f1: 0.6556
 epoch: 77, train_loss: 0.4537, test_loss: 0.9220, test_f1: 0.6495
 epoch: 78, train_loss: 0.4428, test_loss: 0.9591, test_f1: 0.6393
 epoch: 79, train_loss: 0.4340, test_loss: 0.9238, test_f1: 0.6472
 epoch: 80, train_loss: 0.4296, test_loss: 0.9748, test_f1: 0.6415
 epoch: 81, train_loss: 0.4401, test_loss: 0.9555, test_f1: 0.6378
 epoch: 82, train_loss: 0.4238, test_loss: 0.8828, test_f1: 0.6629
 epoch: 83, train_loss: 0.4379, test_loss: 0.9748, test_f1: 0.6552
 epoch: 84, train_loss: 0.4410, test_loss: 0.8980, test_f1: 0.6493
 epoch: 85, train_loss: 0.4340, test_loss: 0.9349, test_f1: 0.6670
 epoch: 86, train_loss: 0.4233, test_loss: 0.9007, test_f1: 0.6547
 epoch: 87, train_loss: 0.4236, test_loss: 0.9627, test_f1: 0.6376
 epoch: 88, train_loss: 0.4103, test_loss: 0.9425, test_f1: 0.6465
 epoch: 89, train_loss: 0.4176, test_loss: 1.0426, test_f1: 0.6431
 epoch: 90, train_loss: 0.4176, test_loss: 1.0791, test_f1: 0.6258
 epoch: 91, train_loss: 0.4068, test_loss: 1.0473, test_f1: 0.6479
 epoch: 92, train_loss: 0.4163, test_loss: 0.9960, test_f1: 0.6504
 epoch: 93, train_loss: 0.4105, test_loss: 1.1162, test_f1: 0.6359
 epoch: 94, train_loss: 0.4065, test_loss: 1.0005, test_f1: 0.6367
 epoch: 95, train_loss: 0.4020, test_loss: 1.0110, test_f1: 0.6418
 epoch: 96, train_loss: 0.4005, test_loss: 0.9939, test_f1: 0.6451
 epoch: 97, train_loss: 0.3936, test_loss: 1.0249, test_f1: 0.6402
 epoch: 98, train_loss: 0.3954, test_loss: 1.1606, test_f1: 0.6426
 epoch: 99, train_loss: 0.3911, test_loss: 1.0325, test_f1: 0.6422
##################ITERATION #6 ****************************************
 epoch: 0, train_loss: 1.1679, test_loss: 0.9684, test_f1: 0.5100
 epoch: 1, train_loss: 1.0092, test_loss: 0.9242, test_f1: 0.5130
 epoch: 2, train_loss: 0.9713, test_loss: 0.8976, test_f1: 0.5373
 epoch: 3, train_loss: 0.9528, test_loss: 0.9082, test_f1: 0.5228
 epoch: 4, train_loss: 0.9315, test_loss: 0.8719, test_f1: 0.5470
 epoch: 5, train_loss: 0.9131, test_loss: 0.8949, test_f1: 0.5297
 epoch: 6, train_loss: 0.8925, test_loss: 0.8525, test_f1: 0.5500
 epoch: 7, train_loss: 0.8777, test_loss: 0.8401, test_f1: 0.5643
 epoch: 8, train_loss: 0.8666, test_loss: 0.8323, test_f1: 0.5623
 epoch: 9, train_loss: 0.8466, test_loss: 0.8201, test_f1: 0.5721
 epoch: 10, train_loss: 0.8294, test_loss: 0.8209, test_f1: 0.5602
 epoch: 11, train_loss: 0.8237, test_loss: 0.8266, test_f1: 0.6115
 epoch: 12, train_loss: 0.8076, test_loss: 0.8290, test_f1: 0.5762
 epoch: 13, train_loss: 0.7998, test_loss: 0.8059, test_f1: 0.5900
 epoch: 14, train_loss: 0.7773, test_loss: 0.8232, test_f1: 0.5857
 epoch: 15, train_loss: 0.7792, test_loss: 0.8140, test_f1: 0.6041
 epoch: 16, train_loss: 0.7644, test_loss: 0.7791, test_f1: 0.6026
 epoch: 17, train_loss: 0.7474, test_loss: 0.8055, test_f1: 0.5866
 epoch: 18, train_loss: 0.7387, test_loss: 0.7766, test_f1: 0.6347
 epoch: 19, train_loss: 0.7356, test_loss: 0.7783, test_f1: 0.6087
 epoch: 20, train_loss: 0.7205, test_loss: 0.7584, test_f1: 0.6220
 epoch: 21, train_loss: 0.7320, test_loss: 0.7471, test_f1: 0.6291
 epoch: 22, train_loss: 0.7083, test_loss: 0.7857, test_f1: 0.6304
 epoch: 23, train_loss: 0.6843, test_loss: 0.7491, test_f1: 0.6390
 epoch: 24, train_loss: 0.6869, test_loss: 0.7304, test_f1: 0.6515
 epoch: 25, train_loss: 0.6856, test_loss: 0.7408, test_f1: 0.6658
 epoch: 26, train_loss: 0.6796, test_loss: 0.7263, test_f1: 0.6556
 epoch: 27, train_loss: 0.6795, test_loss: 0.7596, test_f1: 0.6328
 epoch: 28, train_loss: 0.6626, test_loss: 0.7424, test_f1: 0.6287
 epoch: 29, train_loss: 0.6617, test_loss: 0.7781, test_f1: 0.6612
 epoch: 30, train_loss: 0.6558, test_loss: 0.7721, test_f1: 0.6497
 epoch: 31, train_loss: 0.6499, test_loss: 0.7259, test_f1: 0.6648
 epoch: 32, train_loss: 0.6402, test_loss: 0.7515, test_f1: 0.6573
 epoch: 33, train_loss: 0.6217, test_loss: 0.7783, test_f1: 0.6449
 epoch: 34, train_loss: 0.6340, test_loss: 0.7547, test_f1: 0.6534
 epoch: 35, train_loss: 0.6255, test_loss: 0.7631, test_f1: 0.6729
 epoch: 36, train_loss: 0.6228, test_loss: 0.7832, test_f1: 0.6727
 epoch: 37, train_loss: 0.6136, test_loss: 0.7713, test_f1: 0.6675
 epoch: 38, train_loss: 0.6176, test_loss: 0.7929, test_f1: 0.6457
 epoch: 39, train_loss: 0.6079, test_loss: 0.7517, test_f1: 0.6511
 epoch: 40, train_loss: 0.5991, test_loss: 0.7663, test_f1: 0.6516
 epoch: 41, train_loss: 0.5886, test_loss: 0.7593, test_f1: 0.6606
 epoch: 42, train_loss: 0.5724, test_loss: 0.8354, test_f1: 0.6372
 epoch: 43, train_loss: 0.5832, test_loss: 0.8475, test_f1: 0.6356
 epoch: 44, train_loss: 0.5790, test_loss: 0.7911, test_f1: 0.6788
 epoch: 45, train_loss: 0.5765, test_loss: 0.7873, test_f1: 0.6513
 epoch: 46, train_loss: 0.5559, test_loss: 0.8349, test_f1: 0.6700
 epoch: 47, train_loss: 0.5477, test_loss: 0.8342, test_f1: 0.6320
 epoch: 48, train_loss: 0.5624, test_loss: 0.7675, test_f1: 0.6547
 epoch: 49, train_loss: 0.5491, test_loss: 0.7844, test_f1: 0.6310
 epoch: 50, train_loss: 0.5430, test_loss: 0.7986, test_f1: 0.6515
 epoch: 51, train_loss: 0.5263, test_loss: 0.8461, test_f1: 0.6508
 epoch: 52, train_loss: 0.5138, test_loss: 0.8099, test_f1: 0.6483
 epoch: 53, train_loss: 0.5029, test_loss: 0.8014, test_f1: 0.6642
 epoch: 54, train_loss: 0.5114, test_loss: 0.8088, test_f1: 0.6790
 epoch: 55, train_loss: 0.5085, test_loss: 0.8212, test_f1: 0.6684
 epoch: 56, train_loss: 0.4909, test_loss: 0.8183, test_f1: 0.6547
 epoch: 57, train_loss: 0.4895, test_loss: 0.8367, test_f1: 0.6527
 epoch: 58, train_loss: 0.5012, test_loss: 0.8658, test_f1: 0.6495
 epoch: 59, train_loss: 0.4903, test_loss: 0.8414, test_f1: 0.6592
 epoch: 60, train_loss: 0.4886, test_loss: 0.8230, test_f1: 0.6717
 epoch: 61, train_loss: 0.4874, test_loss: 0.8677, test_f1: 0.6545
 epoch: 62, train_loss: 0.4851, test_loss: 0.9328, test_f1: 0.6651
 epoch: 63, train_loss: 0.4768, test_loss: 0.8983, test_f1: 0.6512
 epoch: 64, train_loss: 0.4840, test_loss: 0.9442, test_f1: 0.6628
 epoch: 65, train_loss: 0.4729, test_loss: 0.8848, test_f1: 0.6462
 epoch: 66, train_loss: 0.4669, test_loss: 0.9148, test_f1: 0.6577
 epoch: 67, train_loss: 0.4738, test_loss: 0.8686, test_f1: 0.6575
 epoch: 68, train_loss: 0.4592, test_loss: 0.9634, test_f1: 0.6487
 epoch: 69, train_loss: 0.4679, test_loss: 0.8977, test_f1: 0.6598
 epoch: 70, train_loss: 0.4516, test_loss: 0.9811, test_f1: 0.6571
 epoch: 71, train_loss: 0.4551, test_loss: 0.9407, test_f1: 0.6563
 epoch: 72, train_loss: 0.4440, test_loss: 0.9839, test_f1: 0.6488
 epoch: 73, train_loss: 0.4642, test_loss: 0.9682, test_f1: 0.6499
 epoch: 74, train_loss: 0.4540, test_loss: 1.0055, test_f1: 0.6599
 epoch: 75, train_loss: 0.4398, test_loss: 0.9746, test_f1: 0.6638
 epoch: 76, train_loss: 0.4403, test_loss: 0.9776, test_f1: 0.6577
 epoch: 77, train_loss: 0.4488, test_loss: 1.0170, test_f1: 0.6695
 epoch: 78, train_loss: 0.4411, test_loss: 0.9342, test_f1: 0.6507
 epoch: 79, train_loss: 0.4306, test_loss: 1.0349, test_f1: 0.6622
 epoch: 80, train_loss: 0.4311, test_loss: 1.0322, test_f1: 0.6628
 epoch: 81, train_loss: 0.4186, test_loss: 1.0532, test_f1: 0.6647
 epoch: 82, train_loss: 0.4320, test_loss: 1.0567, test_f1: 0.6689
 epoch: 83, train_loss: 0.4365, test_loss: 1.0791, test_f1: 0.6533
 epoch: 84, train_loss: 0.4264, test_loss: 1.1121, test_f1: 0.6616
 epoch: 85, train_loss: 0.4400, test_loss: 1.0989, test_f1: 0.6449
 epoch: 86, train_loss: 0.4271, test_loss: 1.0224, test_f1: 0.6579
 epoch: 87, train_loss: 0.4218, test_loss: 1.0285, test_f1: 0.6528
 epoch: 88, train_loss: 0.4131, test_loss: 1.0982, test_f1: 0.6601
 epoch: 89, train_loss: 0.4126, test_loss: 1.1017, test_f1: 0.6559
 epoch: 90, train_loss: 0.4162, test_loss: 1.0915, test_f1: 0.6661
 epoch: 91, train_loss: 0.4107, test_loss: 1.0815, test_f1: 0.6575
 epoch: 92, train_loss: 0.4276, test_loss: 1.0781, test_f1: 0.6501
 epoch: 93, train_loss: 0.4081, test_loss: 1.1409, test_f1: 0.6443
 epoch: 94, train_loss: 0.4190, test_loss: 1.0861, test_f1: 0.6669
 epoch: 95, train_loss: 0.3981, test_loss: 1.1222, test_f1: 0.6780
 epoch: 96, train_loss: 0.4111, test_loss: 1.0842, test_f1: 0.6667
 epoch: 97, train_loss: 0.3884, test_loss: 1.1183, test_f1: 0.6621
 epoch: 98, train_loss: 0.3953, test_loss: 1.1330, test_f1: 0.6614
 epoch: 99, train_loss: 0.3859, test_loss: 1.1470, test_f1: 0.6500
##################ITERATION #7 ****************************************
 epoch: 0, train_loss: 1.1873, test_loss: 0.9906, test_f1: 0.5020
 epoch: 1, train_loss: 1.0219, test_loss: 0.9275, test_f1: 0.5285
 epoch: 2, train_loss: 0.9774, test_loss: 0.9278, test_f1: 0.5294
 epoch: 3, train_loss: 0.9462, test_loss: 0.9008, test_f1: 0.5459
 epoch: 4, train_loss: 0.9210, test_loss: 0.8813, test_f1: 0.5599
 epoch: 5, train_loss: 0.9038, test_loss: 0.8726, test_f1: 0.5572
 epoch: 6, train_loss: 0.8858, test_loss: 0.8646, test_f1: 0.5575
 epoch: 7, train_loss: 0.8869, test_loss: 0.8708, test_f1: 0.5483
 epoch: 8, train_loss: 0.8694, test_loss: 0.8356, test_f1: 0.5510
 epoch: 9, train_loss: 0.8505, test_loss: 0.8507, test_f1: 0.5688
 epoch: 10, train_loss: 0.8309, test_loss: 0.8703, test_f1: 0.5718
 epoch: 11, train_loss: 0.8237, test_loss: 0.8150, test_f1: 0.5909
 epoch: 12, train_loss: 0.8163, test_loss: 0.8398, test_f1: 0.5715
 epoch: 13, train_loss: 0.8106, test_loss: 0.8129, test_f1: 0.6291
 epoch: 14, train_loss: 0.7905, test_loss: 0.8121, test_f1: 0.5931
 epoch: 15, train_loss: 0.7936, test_loss: 0.8113, test_f1: 0.5895
 epoch: 16, train_loss: 0.7678, test_loss: 0.8116, test_f1: 0.6066
 epoch: 17, train_loss: 0.7728, test_loss: 0.7891, test_f1: 0.6209
 epoch: 18, train_loss: 0.7621, test_loss: 0.7599, test_f1: 0.6258
 epoch: 19, train_loss: 0.7465, test_loss: 0.7534, test_f1: 0.6018
 epoch: 20, train_loss: 0.7480, test_loss: 0.7525, test_f1: 0.6655
 epoch: 21, train_loss: 0.7468, test_loss: 0.7393, test_f1: 0.6395
 epoch: 22, train_loss: 0.7145, test_loss: 0.7529, test_f1: 0.6402
 epoch: 23, train_loss: 0.7220, test_loss: 0.7550, test_f1: 0.6452
 epoch: 24, train_loss: 0.7158, test_loss: 0.7604, test_f1: 0.6148
 epoch: 25, train_loss: 0.7001, test_loss: 0.7428, test_f1: 0.6377
 epoch: 26, train_loss: 0.6966, test_loss: 0.7422, test_f1: 0.6362
 epoch: 27, train_loss: 0.6941, test_loss: 0.7598, test_f1: 0.6457
 epoch: 28, train_loss: 0.6884, test_loss: 0.8043, test_f1: 0.6476
 epoch: 29, train_loss: 0.6739, test_loss: 0.7384, test_f1: 0.6538
 epoch: 30, train_loss: 0.6742, test_loss: 0.7135, test_f1: 0.6751
 epoch: 31, train_loss: 0.6660, test_loss: 0.7127, test_f1: 0.6742
 epoch: 32, train_loss: 0.6597, test_loss: 0.7219, test_f1: 0.6735
 epoch: 33, train_loss: 0.6516, test_loss: 0.7376, test_f1: 0.6381
 epoch: 34, train_loss: 0.6603, test_loss: 0.7191, test_f1: 0.6742
 epoch: 35, train_loss: 0.6493, test_loss: 0.7258, test_f1: 0.6841
 epoch: 36, train_loss: 0.6414, test_loss: 0.7276, test_f1: 0.6581
 epoch: 37, train_loss: 0.6265, test_loss: 0.7338, test_f1: 0.6599
 epoch: 38, train_loss: 0.6239, test_loss: 0.7087, test_f1: 0.6920
 epoch: 39, train_loss: 0.6246, test_loss: 0.7007, test_f1: 0.6838
 epoch: 40, train_loss: 0.6129, test_loss: 0.6646, test_f1: 0.7040
 epoch: 41, train_loss: 0.6068, test_loss: 0.7067, test_f1: 0.6745
 epoch: 42, train_loss: 0.6044, test_loss: 0.7211, test_f1: 0.6630
 epoch: 43, train_loss: 0.5943, test_loss: 0.7932, test_f1: 0.6688
 epoch: 44, train_loss: 0.5971, test_loss: 0.7494, test_f1: 0.6847
 epoch: 45, train_loss: 0.5810, test_loss: 0.8329, test_f1: 0.6477
 epoch: 46, train_loss: 0.5980, test_loss: 0.7760, test_f1: 0.6516
 epoch: 47, train_loss: 0.5919, test_loss: 0.7339, test_f1: 0.6900
 epoch: 48, train_loss: 0.5643, test_loss: 0.7928, test_f1: 0.6690
 epoch: 49, train_loss: 0.5703, test_loss: 0.7928, test_f1: 0.6451
 epoch: 50, train_loss: 0.5616, test_loss: 0.8287, test_f1: 0.6548
 epoch: 51, train_loss: 0.5432, test_loss: 0.8118, test_f1: 0.6563
 epoch: 52, train_loss: 0.5219, test_loss: 0.8066, test_f1: 0.6504
 epoch: 53, train_loss: 0.5273, test_loss: 0.8277, test_f1: 0.6538
 epoch: 54, train_loss: 0.5162, test_loss: 0.8007, test_f1: 0.6683
 epoch: 55, train_loss: 0.5333, test_loss: 0.8030, test_f1: 0.6522
 epoch: 56, train_loss: 0.5159, test_loss: 0.7947, test_f1: 0.6814
 epoch: 57, train_loss: 0.5216, test_loss: 0.8944, test_f1: 0.6581
 epoch: 58, train_loss: 0.5087, test_loss: 0.7873, test_f1: 0.6630
 epoch: 59, train_loss: 0.4977, test_loss: 0.8071, test_f1: 0.6599
 epoch: 60, train_loss: 0.5113, test_loss: 0.8040, test_f1: 0.6594
 epoch: 61, train_loss: 0.5076, test_loss: 0.8243, test_f1: 0.6791
 epoch: 62, train_loss: 0.5028, test_loss: 0.8226, test_f1: 0.6814
 epoch: 63, train_loss: 0.5064, test_loss: 0.9013, test_f1: 0.6718
 epoch: 64, train_loss: 0.4983, test_loss: 0.8064, test_f1: 0.6615
 epoch: 65, train_loss: 0.4908, test_loss: 0.9043, test_f1: 0.6694
 epoch: 66, train_loss: 0.4879, test_loss: 0.8907, test_f1: 0.6719
 epoch: 67, train_loss: 0.4940, test_loss: 0.8666, test_f1: 0.6581
 epoch: 68, train_loss: 0.4817, test_loss: 0.8910, test_f1: 0.6656
 epoch: 69, train_loss: 0.4805, test_loss: 0.9210, test_f1: 0.6766
 epoch: 70, train_loss: 0.4792, test_loss: 0.9475, test_f1: 0.6510
 epoch: 71, train_loss: 0.4760, test_loss: 0.8848, test_f1: 0.6667
 epoch: 72, train_loss: 0.4708, test_loss: 0.9360, test_f1: 0.6479
 epoch: 73, train_loss: 0.4583, test_loss: 0.9366, test_f1: 0.6527
 epoch: 74, train_loss: 0.4684, test_loss: 0.8803, test_f1: 0.6618
 epoch: 75, train_loss: 0.4537, test_loss: 0.9015, test_f1: 0.6674
 epoch: 76, train_loss: 0.4606, test_loss: 0.9172, test_f1: 0.6567
 epoch: 77, train_loss: 0.4623, test_loss: 0.9408, test_f1: 0.6728
 epoch: 78, train_loss: 0.4504, test_loss: 0.9266, test_f1: 0.6669
 epoch: 79, train_loss: 0.4486, test_loss: 0.9599, test_f1: 0.6848
 epoch: 80, train_loss: 0.4625, test_loss: 1.0020, test_f1: 0.6658
 epoch: 81, train_loss: 0.4477, test_loss: 0.9742, test_f1: 0.6842
 epoch: 82, train_loss: 0.4425, test_loss: 1.0274, test_f1: 0.6533
 epoch: 83, train_loss: 0.4471, test_loss: 0.9815, test_f1: 0.6508
 epoch: 84, train_loss: 0.4465, test_loss: 0.9703, test_f1: 0.6725
 epoch: 85, train_loss: 0.4388, test_loss: 1.0014, test_f1: 0.6752
 epoch: 86, train_loss: 0.4346, test_loss: 0.9247, test_f1: 0.6605
 epoch: 87, train_loss: 0.4327, test_loss: 1.0298, test_f1: 0.6665
 epoch: 88, train_loss: 0.4391, test_loss: 1.0736, test_f1: 0.6416
 epoch: 89, train_loss: 0.4450, test_loss: 1.0793, test_f1: 0.6564
 epoch: 90, train_loss: 0.4308, test_loss: 1.0076, test_f1: 0.6719
 epoch: 91, train_loss: 0.4228, test_loss: 1.0529, test_f1: 0.6570
 epoch: 92, train_loss: 0.4340, test_loss: 1.0390, test_f1: 0.6587
 epoch: 93, train_loss: 0.4185, test_loss: 1.0900, test_f1: 0.6636
 epoch: 94, train_loss: 0.4093, test_loss: 1.0001, test_f1: 0.6660
 epoch: 95, train_loss: 0.4047, test_loss: 1.0742, test_f1: 0.6600
 epoch: 96, train_loss: 0.4109, test_loss: 1.0409, test_f1: 0.6469
 epoch: 97, train_loss: 0.4141, test_loss: 1.1176, test_f1: 0.6577
 epoch: 98, train_loss: 0.3900, test_loss: 1.0711, test_f1: 0.6697
 epoch: 99, train_loss: 0.3998, test_loss: 1.1945, test_f1: 0.6688
##################ITERATION #8 ****************************************
 epoch: 0, train_loss: 1.2420, test_loss: 1.0128, test_f1: 0.4633
 epoch: 1, train_loss: 1.0396, test_loss: 0.9616, test_f1: 0.5369
 epoch: 2, train_loss: 0.9970, test_loss: 0.9379, test_f1: 0.4967
 epoch: 3, train_loss: 0.9743, test_loss: 0.9328, test_f1: 0.5433
 epoch: 4, train_loss: 0.9458, test_loss: 0.9274, test_f1: 0.5212
 epoch: 5, train_loss: 0.9203, test_loss: 0.8813, test_f1: 0.5190
 epoch: 6, train_loss: 0.8999, test_loss: 0.8820, test_f1: 0.5315
 epoch: 7, train_loss: 0.8886, test_loss: 0.8764, test_f1: 0.5376
 epoch: 8, train_loss: 0.8662, test_loss: 0.8797, test_f1: 0.5566
 epoch: 9, train_loss: 0.8635, test_loss: 0.8430, test_f1: 0.5509
 epoch: 10, train_loss: 0.8479, test_loss: 0.8419, test_f1: 0.5613
 epoch: 11, train_loss: 0.8426, test_loss: 0.8306, test_f1: 0.5508
 epoch: 12, train_loss: 0.8338, test_loss: 0.8691, test_f1: 0.5947
 epoch: 13, train_loss: 0.8115, test_loss: 0.8216, test_f1: 0.5814
 epoch: 14, train_loss: 0.8020, test_loss: 0.8272, test_f1: 0.5757
 epoch: 15, train_loss: 0.7943, test_loss: 0.8169, test_f1: 0.5710
 epoch: 16, train_loss: 0.7724, test_loss: 0.7913, test_f1: 0.5927
 epoch: 17, train_loss: 0.7700, test_loss: 0.8289, test_f1: 0.5835
 epoch: 18, train_loss: 0.7657, test_loss: 0.8331, test_f1: 0.5779
 epoch: 19, train_loss: 0.7454, test_loss: 0.8219, test_f1: 0.6375
 epoch: 20, train_loss: 0.7311, test_loss: 0.8171, test_f1: 0.6413
 epoch: 21, train_loss: 0.7401, test_loss: 0.8025, test_f1: 0.6058
 epoch: 22, train_loss: 0.7183, test_loss: 0.7842, test_f1: 0.6128
 epoch: 23, train_loss: 0.7146, test_loss: 0.8254, test_f1: 0.6410
 epoch: 24, train_loss: 0.7141, test_loss: 0.8221, test_f1: 0.6215
 epoch: 25, train_loss: 0.7020, test_loss: 0.7843, test_f1: 0.6561
 epoch: 26, train_loss: 0.7004, test_loss: 0.8535, test_f1: 0.6561
 epoch: 27, train_loss: 0.6838, test_loss: 0.8458, test_f1: 0.6243
 epoch: 28, train_loss: 0.6846, test_loss: 0.7957, test_f1: 0.6412
 epoch: 29, train_loss: 0.6737, test_loss: 0.8051, test_f1: 0.6509
 epoch: 30, train_loss: 0.6663, test_loss: 0.7732, test_f1: 0.6803
 epoch: 31, train_loss: 0.6564, test_loss: 0.7559, test_f1: 0.6726
 epoch: 32, train_loss: 0.6488, test_loss: 0.8314, test_f1: 0.6372
 epoch: 33, train_loss: 0.6415, test_loss: 0.7910, test_f1: 0.6519
 epoch: 34, train_loss: 0.6387, test_loss: 0.8247, test_f1: 0.6634
 epoch: 35, train_loss: 0.6261, test_loss: 0.7521, test_f1: 0.6616
 epoch: 36, train_loss: 0.6254, test_loss: 0.8425, test_f1: 0.6347
 epoch: 37, train_loss: 0.6199, test_loss: 0.8428, test_f1: 0.6607
 epoch: 38, train_loss: 0.6310, test_loss: 0.8415, test_f1: 0.6942
 epoch: 39, train_loss: 0.6003, test_loss: 0.8344, test_f1: 0.6843
 epoch: 40, train_loss: 0.6120, test_loss: 0.8824, test_f1: 0.6472
 epoch: 41, train_loss: 0.5984, test_loss: 0.8702, test_f1: 0.6532
 epoch: 42, train_loss: 0.5945, test_loss: 0.8949, test_f1: 0.6487
 epoch: 43, train_loss: 0.5851, test_loss: 0.8736, test_f1: 0.6451
 epoch: 44, train_loss: 0.5883, test_loss: 0.8396, test_f1: 0.6785
 epoch: 45, train_loss: 0.5765, test_loss: 0.8763, test_f1: 0.6518
 epoch: 46, train_loss: 0.5878, test_loss: 0.8614, test_f1: 0.6806
 epoch: 47, train_loss: 0.5832, test_loss: 0.9065, test_f1: 0.6430
 epoch: 48, train_loss: 0.5749, test_loss: 0.8824, test_f1: 0.6509
 epoch: 49, train_loss: 0.5534, test_loss: 0.8509, test_f1: 0.6838
 epoch: 50, train_loss: 0.5700, test_loss: 0.9250, test_f1: 0.6660
 epoch: 51, train_loss: 0.5386, test_loss: 0.8996, test_f1: 0.6687
 epoch: 52, train_loss: 0.5388, test_loss: 0.9284, test_f1: 0.6589
 epoch: 53, train_loss: 0.5312, test_loss: 0.9199, test_f1: 0.6706
 epoch: 54, train_loss: 0.5159, test_loss: 0.9139, test_f1: 0.6623
 epoch: 55, train_loss: 0.5164, test_loss: 0.9112, test_f1: 0.6523
 epoch: 56, train_loss: 0.5030, test_loss: 0.9025, test_f1: 0.6613
 epoch: 57, train_loss: 0.5025, test_loss: 0.9322, test_f1: 0.6618
 epoch: 58, train_loss: 0.5140, test_loss: 0.9571, test_f1: 0.6527
 epoch: 59, train_loss: 0.5065, test_loss: 0.9775, test_f1: 0.6559
 epoch: 60, train_loss: 0.5051, test_loss: 0.9480, test_f1: 0.6597
 epoch: 61, train_loss: 0.4946, test_loss: 0.9437, test_f1: 0.6601
 epoch: 62, train_loss: 0.4929, test_loss: 0.9675, test_f1: 0.6800
 epoch: 63, train_loss: 0.4992, test_loss: 0.9448, test_f1: 0.6616
 epoch: 64, train_loss: 0.4933, test_loss: 0.9450, test_f1: 0.6645
 epoch: 65, train_loss: 0.4740, test_loss: 0.9755, test_f1: 0.6652
 epoch: 66, train_loss: 0.4750, test_loss: 0.9525, test_f1: 0.6707
 epoch: 67, train_loss: 0.4726, test_loss: 1.0077, test_f1: 0.6694
 epoch: 68, train_loss: 0.4748, test_loss: 0.9649, test_f1: 0.6796
 epoch: 69, train_loss: 0.4866, test_loss: 0.9661, test_f1: 0.6595
 epoch: 70, train_loss: 0.4707, test_loss: 0.9769, test_f1: 0.6593
 epoch: 71, train_loss: 0.4777, test_loss: 0.9921, test_f1: 0.6709
 epoch: 72, train_loss: 0.4617, test_loss: 1.0458, test_f1: 0.6481
 epoch: 73, train_loss: 0.4588, test_loss: 1.0620, test_f1: 0.6670
 epoch: 74, train_loss: 0.4695, test_loss: 1.0209, test_f1: 0.6595
 epoch: 75, train_loss: 0.4698, test_loss: 1.0192, test_f1: 0.6527
 epoch: 76, train_loss: 0.4560, test_loss: 1.0422, test_f1: 0.6522
 epoch: 77, train_loss: 0.4436, test_loss: 1.0788, test_f1: 0.6796
 epoch: 78, train_loss: 0.4484, test_loss: 1.0459, test_f1: 0.6597
 epoch: 79, train_loss: 0.4439, test_loss: 1.0790, test_f1: 0.6657
 epoch: 80, train_loss: 0.4374, test_loss: 1.0680, test_f1: 0.6573
 epoch: 81, train_loss: 0.4517, test_loss: 1.0447, test_f1: 0.6641
 epoch: 82, train_loss: 0.4540, test_loss: 1.0851, test_f1: 0.6599
 epoch: 83, train_loss: 0.4426, test_loss: 1.0876, test_f1: 0.6636
 epoch: 84, train_loss: 0.4296, test_loss: 1.1145, test_f1: 0.6582
 epoch: 85, train_loss: 0.4459, test_loss: 1.0754, test_f1: 0.6703
 epoch: 86, train_loss: 0.4313, test_loss: 1.1140, test_f1: 0.6734
 epoch: 87, train_loss: 0.4447, test_loss: 1.0716, test_f1: 0.6779
 epoch: 88, train_loss: 0.4295, test_loss: 1.0894, test_f1: 0.6819
 epoch: 89, train_loss: 0.4279, test_loss: 1.1532, test_f1: 0.6586
 epoch: 90, train_loss: 0.4240, test_loss: 1.0648, test_f1: 0.6471
 epoch: 91, train_loss: 0.4197, test_loss: 1.1173, test_f1: 0.6559
 epoch: 92, train_loss: 0.4236, test_loss: 1.1496, test_f1: 0.6565
 epoch: 93, train_loss: 0.4195, test_loss: 1.1550, test_f1: 0.6537
 epoch: 94, train_loss: 0.4149, test_loss: 1.1065, test_f1: 0.6664
 epoch: 95, train_loss: 0.4112, test_loss: 1.1121, test_f1: 0.6707
 epoch: 96, train_loss: 0.4006, test_loss: 1.1352, test_f1: 0.6675
 epoch: 97, train_loss: 0.4065, test_loss: 1.1600, test_f1: 0.6704
 epoch: 98, train_loss: 0.4054, test_loss: 1.1775, test_f1: 0.6688
 epoch: 99, train_loss: 0.3965, test_loss: 1.1125, test_f1: 0.6734
##################ITERATION #9 ****************************************
 epoch: 0, train_loss: 1.2639, test_loss: 1.0491, test_f1: 0.4748
 epoch: 1, train_loss: 1.0701, test_loss: 0.9890, test_f1: 0.5036
 epoch: 2, train_loss: 1.0176, test_loss: 0.9471, test_f1: 0.4910
 epoch: 3, train_loss: 0.9856, test_loss: 0.9046, test_f1: 0.5178
 epoch: 4, train_loss: 0.9698, test_loss: 0.9158, test_f1: 0.5034
 epoch: 5, train_loss: 0.9327, test_loss: 0.8760, test_f1: 0.5282
 epoch: 6, train_loss: 0.9099, test_loss: 0.8672, test_f1: 0.5287
 epoch: 7, train_loss: 0.8974, test_loss: 0.8505, test_f1: 0.5324
 epoch: 8, train_loss: 0.8980, test_loss: 0.8604, test_f1: 0.5310
 epoch: 9, train_loss: 0.8654, test_loss: 0.8313, test_f1: 0.5536
 epoch: 10, train_loss: 0.8530, test_loss: 0.8344, test_f1: 0.5577
 epoch: 11, train_loss: 0.8453, test_loss: 0.8117, test_f1: 0.5812
 epoch: 12, train_loss: 0.8290, test_loss: 0.8194, test_f1: 0.5664
 epoch: 13, train_loss: 0.8215, test_loss: 0.7873, test_f1: 0.5763
 epoch: 14, train_loss: 0.8062, test_loss: 0.7944, test_f1: 0.5782
 epoch: 15, train_loss: 0.7896, test_loss: 0.7769, test_f1: 0.5841
 epoch: 16, train_loss: 0.7812, test_loss: 0.7617, test_f1: 0.6141
 epoch: 17, train_loss: 0.7765, test_loss: 0.7670, test_f1: 0.6156
 epoch: 18, train_loss: 0.7631, test_loss: 0.7786, test_f1: 0.5861
 epoch: 19, train_loss: 0.7600, test_loss: 0.7969, test_f1: 0.5792
 epoch: 20, train_loss: 0.7406, test_loss: 0.7605, test_f1: 0.6631
 epoch: 21, train_loss: 0.7251, test_loss: 0.7505, test_f1: 0.6120
 epoch: 22, train_loss: 0.7283, test_loss: 0.7549, test_f1: 0.6074
 epoch: 23, train_loss: 0.7258, test_loss: 0.7469, test_f1: 0.6250
 epoch: 24, train_loss: 0.7247, test_loss: 0.7693, test_f1: 0.5890
 epoch: 25, train_loss: 0.7207, test_loss: 0.8017, test_f1: 0.5945
 epoch: 26, train_loss: 0.7169, test_loss: 0.7505, test_f1: 0.6361
 epoch: 27, train_loss: 0.6923, test_loss: 0.7388, test_f1: 0.6415
 epoch: 28, train_loss: 0.6854, test_loss: 0.7435, test_f1: 0.6392
 epoch: 29, train_loss: 0.6953, test_loss: 0.7446, test_f1: 0.6474
 epoch: 30, train_loss: 0.6901, test_loss: 0.7756, test_f1: 0.6325
 epoch: 31, train_loss: 0.6647, test_loss: 0.7580, test_f1: 0.6486
 epoch: 32, train_loss: 0.6493, test_loss: 0.7522, test_f1: 0.6378
 epoch: 33, train_loss: 0.6618, test_loss: 0.7339, test_f1: 0.6586
 epoch: 34, train_loss: 0.6583, test_loss: 0.7780, test_f1: 0.6312
 epoch: 35, train_loss: 0.6348, test_loss: 0.7415, test_f1: 0.6322
 epoch: 36, train_loss: 0.6471, test_loss: 0.7617, test_f1: 0.6396
 epoch: 37, train_loss: 0.6320, test_loss: 0.7612, test_f1: 0.6451
 epoch: 38, train_loss: 0.6266, test_loss: 0.7593, test_f1: 0.6363
 epoch: 39, train_loss: 0.6249, test_loss: 0.7973, test_f1: 0.6420
 epoch: 40, train_loss: 0.6206, test_loss: 0.7547, test_f1: 0.6734
 epoch: 41, train_loss: 0.5983, test_loss: 0.7599, test_f1: 0.6289
 epoch: 42, train_loss: 0.6059, test_loss: 0.7647, test_f1: 0.6698
 epoch: 43, train_loss: 0.6141, test_loss: 0.7763, test_f1: 0.6522
 epoch: 44, train_loss: 0.5922, test_loss: 0.7866, test_f1: 0.6691
 epoch: 45, train_loss: 0.5970, test_loss: 0.7721, test_f1: 0.6649
 epoch: 46, train_loss: 0.5801, test_loss: 0.8213, test_f1: 0.6365
 epoch: 47, train_loss: 0.5723, test_loss: 0.7991, test_f1: 0.6273
 epoch: 48, train_loss: 0.5750, test_loss: 0.8140, test_f1: 0.6340
 epoch: 49, train_loss: 0.5733, test_loss: 0.8487, test_f1: 0.6301
 epoch: 50, train_loss: 0.5728, test_loss: 0.7593, test_f1: 0.6761
 epoch: 51, train_loss: 0.5609, test_loss: 0.8648, test_f1: 0.6458
 epoch: 52, train_loss: 0.5634, test_loss: 0.8216, test_f1: 0.6646
 epoch: 53, train_loss: 0.5338, test_loss: 0.8093, test_f1: 0.6616
 epoch: 54, train_loss: 0.5349, test_loss: 0.8066, test_f1: 0.6520
 epoch: 55, train_loss: 0.5200, test_loss: 0.8205, test_f1: 0.6537
 epoch: 56, train_loss: 0.5310, test_loss: 0.8333, test_f1: 0.6566
 epoch: 57, train_loss: 0.5209, test_loss: 0.8451, test_f1: 0.6483
 epoch: 58, train_loss: 0.5214, test_loss: 0.8507, test_f1: 0.6579
 epoch: 59, train_loss: 0.5176, test_loss: 0.8274, test_f1: 0.6451
 epoch: 60, train_loss: 0.5141, test_loss: 0.9013, test_f1: 0.6204
 epoch: 61, train_loss: 0.5158, test_loss: 0.8489, test_f1: 0.6478
 epoch: 62, train_loss: 0.5058, test_loss: 0.8949, test_f1: 0.6363
 epoch: 63, train_loss: 0.5070, test_loss: 0.8721, test_f1: 0.6485
 epoch: 64, train_loss: 0.4931, test_loss: 0.8636, test_f1: 0.6331
 epoch: 65, train_loss: 0.4975, test_loss: 0.8175, test_f1: 0.6656
 epoch: 66, train_loss: 0.4924, test_loss: 0.9183, test_f1: 0.6475
 epoch: 67, train_loss: 0.4987, test_loss: 0.8810, test_f1: 0.6428
 epoch: 68, train_loss: 0.4947, test_loss: 0.9247, test_f1: 0.6471
 epoch: 69, train_loss: 0.4949, test_loss: 0.9250, test_f1: 0.6394
 epoch: 70, train_loss: 0.4928, test_loss: 0.9802, test_f1: 0.6371
 epoch: 71, train_loss: 0.4703, test_loss: 0.9303, test_f1: 0.6511
 epoch: 72, train_loss: 0.4635, test_loss: 0.8885, test_f1: 0.6554
 epoch: 73, train_loss: 0.4876, test_loss: 0.8671, test_f1: 0.6534
 epoch: 74, train_loss: 0.4775, test_loss: 0.8640, test_f1: 0.6395
 epoch: 75, train_loss: 0.4619, test_loss: 0.9425, test_f1: 0.6523
 epoch: 76, train_loss: 0.4779, test_loss: 0.8228, test_f1: 0.6485
 epoch: 77, train_loss: 0.4715, test_loss: 0.9345, test_f1: 0.6404
 epoch: 78, train_loss: 0.4673, test_loss: 0.9458, test_f1: 0.6401
 epoch: 79, train_loss: 0.4699, test_loss: 1.0013, test_f1: 0.6509
 epoch: 80, train_loss: 0.4626, test_loss: 1.0127, test_f1: 0.6520
 epoch: 81, train_loss: 0.4658, test_loss: 0.9617, test_f1: 0.6295
 epoch: 82, train_loss: 0.4668, test_loss: 1.0279, test_f1: 0.6459
 epoch: 83, train_loss: 0.4562, test_loss: 0.9836, test_f1: 0.6369
 epoch: 84, train_loss: 0.4430, test_loss: 0.9525, test_f1: 0.6447
 epoch: 85, train_loss: 0.4458, test_loss: 0.9540, test_f1: 0.6529
 epoch: 86, train_loss: 0.4463, test_loss: 0.9945, test_f1: 0.6579
 epoch: 87, train_loss: 0.4520, test_loss: 0.9217, test_f1: 0.6499
 epoch: 88, train_loss: 0.4248, test_loss: 0.9547, test_f1: 0.6584
 epoch: 89, train_loss: 0.4362, test_loss: 0.8927, test_f1: 0.6564
 epoch: 90, train_loss: 0.4402, test_loss: 0.9627, test_f1: 0.6506
 epoch: 91, train_loss: 0.4265, test_loss: 0.9721, test_f1: 0.6396
 epoch: 92, train_loss: 0.4251, test_loss: 0.9798, test_f1: 0.6525
 epoch: 93, train_loss: 0.4293, test_loss: 1.0047, test_f1: 0.6533
 epoch: 94, train_loss: 0.4253, test_loss: 1.0416, test_f1: 0.6489
 epoch: 95, train_loss: 0.4408, test_loss: 0.9784, test_f1: 0.6442
 epoch: 96, train_loss: 0.4232, test_loss: 1.1118, test_f1: 0.6377
 epoch: 97, train_loss: 0.4157, test_loss: 1.0357, test_f1: 0.6385
 epoch: 98, train_loss: 0.4226, test_loss: 1.0301, test_f1: 0.6458
 epoch: 99, train_loss: 0.4196, test_loss: 1.0101, test_f1: 0.6438

Training completed in 1721.91 seconds
Best F1: 0.7040 at epoch 40
Mean F1 across iterations: 0.6778  0.0126
========================FINAL RESULTS================================
FEGIN weighted F1: 0.7040  0.0126
python main.py --data ltspice_examples --representation component_pin_net --model FEGIN --layers 3 --hiddens 128 --batch_size 32 --lr 0.0001 --emb_size 128 --epochs 100 --save_appendix component_pin_net_L3_H128_BS32_LR0.0001_E128 --no_val
-----



STDERR:
  File "main.py", line 370, in <module>
    main()
  File "main.py", line 254, in main
    dataset = dataset_class(
  File "/home/philip/projects/llm_inference_code_repo/Circuit-Completion-Using-GNNs/component_classification_with_link_prediction_head/evaluation/FEGIN/kernel/circuit_datasets.py", line 15, in __init__
    self.data, self.slices = torch.load(self.processed_paths[0])
  File "/home/philip/.local/lib/python3.8/site-packages/torch/serialization.py", line 1040, in load
    warnings.warn(
  File "/usr/lib/python3.8/warnings.py", line 109, in _showwarnmsg
    sw(msg.message, msg.category, msg.filename, msg.lineno,
  File "main.py", line 47, in warn_with_traceback
    traceback.print_stack(file=log)
/home/philip/projects/llm_inference_code_repo/Circuit-Completion-Using-GNNs/component_classification_with_link_prediction_head/evaluation/FEGIN/kernel/circuit_datasets.py:15: FutureWarning: You are using `torch.load` with `weights_only=False` (the current default value), which uses the default pickle module implicitly. It is possible to construct malicious pickle data which will execute arbitrary code during unpickling (See https://github.com/pytorch/pytorch/blob/main/SECURITY.md#untrusted-models for more details). In a future release, the default value for `weights_only` will be flipped to `True`. This limits the functions that could be executed during unpickling. Arbitrary objects will no longer be allowed to be loaded via this mode unless they are explicitly allowlisted by the user via `torch.serialization.add_safe_globals`. We recommend you start setting `weights_only=True` for any use case where you don't have full control of the loaded file. Please open an issue on GitHub for any issues related to this experimental feature.
  self.data, self.slices = torch.load(self.processed_paths[0])
