STDOUT:
Results will be saved in /home/philip/projects/ltspice_examples_code_repo/Circuit-Completion-Using-GNNs/component_classification_with_link_prediction_head/evaluation/FEGIN/results/model_FEGIN_dataset_ltspice_examples
Command line input: python main.py --data ltspice_examples --representation component_pin_net --model FEGIN --layers 2 --hiddens 64 --batch_size 256 --lr 0.0001 --emb_size 250 --epochs 100 --save_appendix component_pin_net_L2_H64_BS256_LR0.0001_E250 --no_val
 is saved.
-----
ltspice_examples - FEGIN
Using 2 layers, 64 hidden units, h = 2
Loading component_pin_net representation dataset
ENTERED
Training FEGIN on component_pin_net representation
Train: 3558, Test: 846
##################ITERATION #0 ****************************************
 epoch: 0, train_loss: 1.3938, test_loss: 1.3924, test_f1: 0.1004
 epoch: 1, train_loss: 1.3854, test_loss: 1.3878, test_f1: 0.1004
 epoch: 2, train_loss: 1.3799, test_loss: 1.3824, test_f1: 0.1004
 epoch: 3, train_loss: 1.3731, test_loss: 1.3739, test_f1: 0.1162
 epoch: 4, train_loss: 1.3657, test_loss: 1.3633, test_f1: 0.1264
 epoch: 5, train_loss: 1.3557, test_loss: 1.3520, test_f1: 0.1436
 epoch: 6, train_loss: 1.3466, test_loss: 1.3395, test_f1: 0.2655
 epoch: 7, train_loss: 1.3338, test_loss: 1.3259, test_f1: 0.2825
 epoch: 8, train_loss: 1.3191, test_loss: 1.3113, test_f1: 0.2586
 epoch: 9, train_loss: 1.3049, test_loss: 1.2959, test_f1: 0.2555
 epoch: 10, train_loss: 1.2914, test_loss: 1.2800, test_f1: 0.2304
 epoch: 11, train_loss: 1.2741, test_loss: 1.2644, test_f1: 0.2302
 epoch: 12, train_loss: 1.2608, test_loss: 1.2503, test_f1: 0.2295
 epoch: 13, train_loss: 1.2504, test_loss: 1.2367, test_f1: 0.2270
 epoch: 14, train_loss: 1.2345, test_loss: 1.2237, test_f1: 0.2270
 epoch: 15, train_loss: 1.2271, test_loss: 1.2116, test_f1: 0.2270
 epoch: 16, train_loss: 1.2158, test_loss: 1.1998, test_f1: 0.2270
 epoch: 17, train_loss: 1.2086, test_loss: 1.1894, test_f1: 0.2679
 epoch: 18, train_loss: 1.1966, test_loss: 1.1791, test_f1: 0.2979
 epoch: 19, train_loss: 1.1889, test_loss: 1.1689, test_f1: 0.3169
 epoch: 20, train_loss: 1.1786, test_loss: 1.1590, test_f1: 0.3485
 epoch: 21, train_loss: 1.1733, test_loss: 1.1489, test_f1: 0.3684
 epoch: 22, train_loss: 1.1623, test_loss: 1.1386, test_f1: 0.3881
 epoch: 23, train_loss: 1.1538, test_loss: 1.1294, test_f1: 0.3989
 epoch: 24, train_loss: 1.1431, test_loss: 1.1191, test_f1: 0.4155
 epoch: 25, train_loss: 1.1345, test_loss: 1.1078, test_f1: 0.4218
 epoch: 26, train_loss: 1.1258, test_loss: 1.0974, test_f1: 0.4592
 epoch: 27, train_loss: 1.1123, test_loss: 1.0850, test_f1: 0.4577
 epoch: 28, train_loss: 1.1036, test_loss: 1.0736, test_f1: 0.4674
 epoch: 29, train_loss: 1.0921, test_loss: 1.0632, test_f1: 0.4750
 epoch: 30, train_loss: 1.0802, test_loss: 1.0528, test_f1: 0.4816
 epoch: 31, train_loss: 1.0726, test_loss: 1.0442, test_f1: 0.4773
 epoch: 32, train_loss: 1.0593, test_loss: 1.0341, test_f1: 0.4816
 epoch: 33, train_loss: 1.0568, test_loss: 1.0262, test_f1: 0.4800
 epoch: 34, train_loss: 1.0398, test_loss: 1.0197, test_f1: 0.4859
 epoch: 35, train_loss: 1.0378, test_loss: 1.0142, test_f1: 0.4838
 epoch: 36, train_loss: 1.0271, test_loss: 1.0070, test_f1: 0.4905
 epoch: 37, train_loss: 1.0180, test_loss: 1.0007, test_f1: 0.4950
 epoch: 38, train_loss: 1.0170, test_loss: 0.9980, test_f1: 0.4969
 epoch: 39, train_loss: 1.0049, test_loss: 0.9925, test_f1: 0.4933
 epoch: 40, train_loss: 1.0049, test_loss: 0.9913, test_f1: 0.5001
 epoch: 41, train_loss: 0.9966, test_loss: 0.9852, test_f1: 0.5049
 epoch: 42, train_loss: 0.9934, test_loss: 0.9821, test_f1: 0.5036
 epoch: 43, train_loss: 0.9904, test_loss: 0.9783, test_f1: 0.4953
 epoch: 44, train_loss: 0.9890, test_loss: 0.9775, test_f1: 0.5011
 epoch: 45, train_loss: 0.9861, test_loss: 0.9763, test_f1: 0.5051
 epoch: 46, train_loss: 0.9767, test_loss: 0.9700, test_f1: 0.5126
 epoch: 47, train_loss: 0.9775, test_loss: 0.9672, test_f1: 0.4991
 epoch: 48, train_loss: 0.9733, test_loss: 0.9647, test_f1: 0.5053
 epoch: 49, train_loss: 0.9759, test_loss: 0.9627, test_f1: 0.5004
 epoch: 50, train_loss: 0.9660, test_loss: 0.9684, test_f1: 0.5064
 epoch: 51, train_loss: 0.9625, test_loss: 0.9608, test_f1: 0.5082
 epoch: 52, train_loss: 0.9676, test_loss: 0.9596, test_f1: 0.5102
 epoch: 53, train_loss: 0.9643, test_loss: 0.9586, test_f1: 0.5064
 epoch: 54, train_loss: 0.9587, test_loss: 0.9578, test_f1: 0.5151
 epoch: 55, train_loss: 0.9584, test_loss: 0.9560, test_f1: 0.5131
 epoch: 56, train_loss: 0.9611, test_loss: 0.9560, test_f1: 0.5159
 epoch: 57, train_loss: 0.9564, test_loss: 0.9553, test_f1: 0.5097
 epoch: 58, train_loss: 0.9540, test_loss: 0.9536, test_f1: 0.5104
 epoch: 59, train_loss: 0.9549, test_loss: 0.9556, test_f1: 0.5066
 epoch: 60, train_loss: 0.9569, test_loss: 0.9525, test_f1: 0.5056
 epoch: 61, train_loss: 0.9530, test_loss: 0.9503, test_f1: 0.5126
 epoch: 62, train_loss: 0.9572, test_loss: 0.9522, test_f1: 0.5091
 epoch: 63, train_loss: 0.9509, test_loss: 0.9488, test_f1: 0.5147
 epoch: 64, train_loss: 0.9497, test_loss: 0.9479, test_f1: 0.5095
 epoch: 65, train_loss: 0.9487, test_loss: 0.9481, test_f1: 0.5176
 epoch: 66, train_loss: 0.9482, test_loss: 0.9496, test_f1: 0.5137
 epoch: 67, train_loss: 0.9489, test_loss: 0.9446, test_f1: 0.5175
 epoch: 68, train_loss: 0.9428, test_loss: 0.9447, test_f1: 0.5049
 epoch: 69, train_loss: 0.9459, test_loss: 0.9432, test_f1: 0.5048
 epoch: 70, train_loss: 0.9474, test_loss: 0.9430, test_f1: 0.5193
 epoch: 71, train_loss: 0.9382, test_loss: 0.9445, test_f1: 0.5134
 epoch: 72, train_loss: 0.9403, test_loss: 0.9431, test_f1: 0.5182
 epoch: 73, train_loss: 0.9394, test_loss: 0.9385, test_f1: 0.5135
 epoch: 74, train_loss: 0.9460, test_loss: 0.9372, test_f1: 0.5146
 epoch: 75, train_loss: 0.9334, test_loss: 0.9370, test_f1: 0.5074
 epoch: 76, train_loss: 0.9384, test_loss: 0.9356, test_f1: 0.5159
 epoch: 77, train_loss: 0.9345, test_loss: 0.9362, test_f1: 0.5151
 epoch: 78, train_loss: 0.9391, test_loss: 0.9332, test_f1: 0.5229
 epoch: 79, train_loss: 0.9328, test_loss: 0.9359, test_f1: 0.5169
 epoch: 80, train_loss: 0.9337, test_loss: 0.9356, test_f1: 0.5231
 epoch: 81, train_loss: 0.9276, test_loss: 0.9325, test_f1: 0.5158
 epoch: 82, train_loss: 0.9268, test_loss: 0.9321, test_f1: 0.5188
 epoch: 83, train_loss: 0.9282, test_loss: 0.9297, test_f1: 0.5143
 epoch: 84, train_loss: 0.9331, test_loss: 0.9312, test_f1: 0.5191
 epoch: 85, train_loss: 0.9309, test_loss: 0.9342, test_f1: 0.5269
 epoch: 86, train_loss: 0.9282, test_loss: 0.9309, test_f1: 0.5203
 epoch: 87, train_loss: 0.9298, test_loss: 0.9310, test_f1: 0.5213
 epoch: 88, train_loss: 0.9264, test_loss: 0.9319, test_f1: 0.5172
 epoch: 89, train_loss: 0.9222, test_loss: 0.9289, test_f1: 0.5332
 epoch: 90, train_loss: 0.9212, test_loss: 0.9307, test_f1: 0.5174
 epoch: 91, train_loss: 0.9262, test_loss: 0.9263, test_f1: 0.5200
 epoch: 92, train_loss: 0.9209, test_loss: 0.9307, test_f1: 0.5170
 epoch: 93, train_loss: 0.9148, test_loss: 0.9275, test_f1: 0.5183
 epoch: 94, train_loss: 0.9178, test_loss: 0.9248, test_f1: 0.5227
 epoch: 95, train_loss: 0.9189, test_loss: 0.9266, test_f1: 0.5213
 epoch: 96, train_loss: 0.9225, test_loss: 0.9243, test_f1: 0.5259
 epoch: 97, train_loss: 0.9135, test_loss: 0.9259, test_f1: 0.5409
 epoch: 98, train_loss: 0.9078, test_loss: 0.9219, test_f1: 0.5246
 epoch: 99, train_loss: 0.9144, test_loss: 0.9234, test_f1: 0.5277
##################ITERATION #1 ****************************************
 epoch: 0, train_loss: 1.3556, test_loss: 1.3668, test_f1: 0.1004
 epoch: 1, train_loss: 1.3351, test_loss: 1.3581, test_f1: 0.1004
 epoch: 2, train_loss: 1.3219, test_loss: 1.3466, test_f1: 0.2111
 epoch: 3, train_loss: 1.3072, test_loss: 1.3254, test_f1: 0.2578
 epoch: 4, train_loss: 1.2900, test_loss: 1.2909, test_f1: 0.2404
 epoch: 5, train_loss: 1.2743, test_loss: 1.2613, test_f1: 0.3144
 epoch: 6, train_loss: 1.2556, test_loss: 1.2367, test_f1: 0.3478
 epoch: 7, train_loss: 1.2352, test_loss: 1.2147, test_f1: 0.3403
 epoch: 8, train_loss: 1.2176, test_loss: 1.1937, test_f1: 0.3422
 epoch: 9, train_loss: 1.1999, test_loss: 1.1734, test_f1: 0.3460
 epoch: 10, train_loss: 1.1818, test_loss: 1.1540, test_f1: 0.3460
 epoch: 11, train_loss: 1.1640, test_loss: 1.1361, test_f1: 0.3460
 epoch: 12, train_loss: 1.1473, test_loss: 1.1202, test_f1: 0.3448
 epoch: 13, train_loss: 1.1315, test_loss: 1.1044, test_f1: 0.3438
 epoch: 14, train_loss: 1.1155, test_loss: 1.0902, test_f1: 0.3429
 epoch: 15, train_loss: 1.1056, test_loss: 1.0789, test_f1: 0.3428
 epoch: 16, train_loss: 1.0894, test_loss: 1.0694, test_f1: 0.3451
 epoch: 17, train_loss: 1.0831, test_loss: 1.0604, test_f1: 0.3502
 epoch: 18, train_loss: 1.0765, test_loss: 1.0521, test_f1: 0.3596
 epoch: 19, train_loss: 1.0661, test_loss: 1.0456, test_f1: 0.3637
 epoch: 20, train_loss: 1.0601, test_loss: 1.0399, test_f1: 0.3786
 epoch: 21, train_loss: 1.0534, test_loss: 1.0341, test_f1: 0.3861
 epoch: 22, train_loss: 1.0481, test_loss: 1.0288, test_f1: 0.3899
 epoch: 23, train_loss: 1.0391, test_loss: 1.0246, test_f1: 0.3994
 epoch: 24, train_loss: 1.0327, test_loss: 1.0191, test_f1: 0.4071
 epoch: 25, train_loss: 1.0296, test_loss: 1.0137, test_f1: 0.4112
 epoch: 26, train_loss: 1.0225, test_loss: 1.0098, test_f1: 0.4126
 epoch: 27, train_loss: 1.0235, test_loss: 1.0049, test_f1: 0.4121
 epoch: 28, train_loss: 1.0130, test_loss: 1.0010, test_f1: 0.4246
 epoch: 29, train_loss: 1.0075, test_loss: 0.9944, test_f1: 0.4320
 epoch: 30, train_loss: 1.0050, test_loss: 0.9913, test_f1: 0.4489
 epoch: 31, train_loss: 1.0053, test_loss: 0.9885, test_f1: 0.4462
 epoch: 32, train_loss: 1.0033, test_loss: 0.9878, test_f1: 0.4633
 epoch: 33, train_loss: 0.9932, test_loss: 0.9816, test_f1: 0.4698
 epoch: 34, train_loss: 0.9934, test_loss: 0.9801, test_f1: 0.4715
 epoch: 35, train_loss: 0.9824, test_loss: 0.9728, test_f1: 0.4786
 epoch: 36, train_loss: 0.9840, test_loss: 0.9680, test_f1: 0.4842
 epoch: 37, train_loss: 0.9821, test_loss: 0.9648, test_f1: 0.4742
 epoch: 38, train_loss: 0.9722, test_loss: 0.9607, test_f1: 0.4838
 epoch: 39, train_loss: 0.9746, test_loss: 0.9598, test_f1: 0.4859
 epoch: 40, train_loss: 0.9686, test_loss: 0.9553, test_f1: 0.4863
 epoch: 41, train_loss: 0.9649, test_loss: 0.9533, test_f1: 0.4947
 epoch: 42, train_loss: 0.9643, test_loss: 0.9517, test_f1: 0.4902
 epoch: 43, train_loss: 0.9590, test_loss: 0.9490, test_f1: 0.4913
 epoch: 44, train_loss: 0.9624, test_loss: 0.9458, test_f1: 0.4999
 epoch: 45, train_loss: 0.9561, test_loss: 0.9414, test_f1: 0.5010
 epoch: 46, train_loss: 0.9523, test_loss: 0.9372, test_f1: 0.4976
 epoch: 47, train_loss: 0.9497, test_loss: 0.9342, test_f1: 0.4994
 epoch: 48, train_loss: 0.9512, test_loss: 0.9379, test_f1: 0.5057
 epoch: 49, train_loss: 0.9465, test_loss: 0.9303, test_f1: 0.5054
 epoch: 50, train_loss: 0.9430, test_loss: 0.9291, test_f1: 0.5064
 epoch: 51, train_loss: 0.9335, test_loss: 0.9279, test_f1: 0.5096
 epoch: 52, train_loss: 0.9386, test_loss: 0.9238, test_f1: 0.5157
 epoch: 53, train_loss: 0.9340, test_loss: 0.9239, test_f1: 0.5082
 epoch: 54, train_loss: 0.9320, test_loss: 0.9248, test_f1: 0.5111
 epoch: 55, train_loss: 0.9346, test_loss: 0.9226, test_f1: 0.5090
 epoch: 56, train_loss: 0.9342, test_loss: 0.9204, test_f1: 0.5137
 epoch: 57, train_loss: 0.9279, test_loss: 0.9213, test_f1: 0.5124
 epoch: 58, train_loss: 0.9255, test_loss: 0.9215, test_f1: 0.5101
 epoch: 59, train_loss: 0.9229, test_loss: 0.9194, test_f1: 0.5117
 epoch: 60, train_loss: 0.9319, test_loss: 0.9167, test_f1: 0.5187
 epoch: 61, train_loss: 0.9285, test_loss: 0.9153, test_f1: 0.5159
 epoch: 62, train_loss: 0.9284, test_loss: 0.9128, test_f1: 0.5193
 epoch: 63, train_loss: 0.9251, test_loss: 0.9136, test_f1: 0.5122
 epoch: 64, train_loss: 0.9257, test_loss: 0.9120, test_f1: 0.5158
 epoch: 65, train_loss: 0.9219, test_loss: 0.9111, test_f1: 0.5210
 epoch: 66, train_loss: 0.9207, test_loss: 0.9112, test_f1: 0.5178
 epoch: 67, train_loss: 0.9201, test_loss: 0.9110, test_f1: 0.5171
 epoch: 68, train_loss: 0.9184, test_loss: 0.9096, test_f1: 0.5128
 epoch: 69, train_loss: 0.9146, test_loss: 0.9050, test_f1: 0.5255
 epoch: 70, train_loss: 0.9136, test_loss: 0.9054, test_f1: 0.5224
 epoch: 71, train_loss: 0.9169, test_loss: 0.9053, test_f1: 0.5254
 epoch: 72, train_loss: 0.9150, test_loss: 0.9051, test_f1: 0.5264
 epoch: 73, train_loss: 0.9081, test_loss: 0.8999, test_f1: 0.5291
 epoch: 74, train_loss: 0.9063, test_loss: 0.9025, test_f1: 0.5254
 epoch: 75, train_loss: 0.9109, test_loss: 0.9036, test_f1: 0.5240
 epoch: 76, train_loss: 0.9035, test_loss: 0.8997, test_f1: 0.5280
 epoch: 77, train_loss: 0.9083, test_loss: 0.8997, test_f1: 0.5306
 epoch: 78, train_loss: 0.8980, test_loss: 0.8983, test_f1: 0.5303
 epoch: 79, train_loss: 0.9059, test_loss: 0.8972, test_f1: 0.5267
 epoch: 80, train_loss: 0.9025, test_loss: 0.8955, test_f1: 0.5304
 epoch: 81, train_loss: 0.9005, test_loss: 0.8934, test_f1: 0.5367
 epoch: 82, train_loss: 0.8968, test_loss: 0.8914, test_f1: 0.5361
 epoch: 83, train_loss: 0.8951, test_loss: 0.8910, test_f1: 0.5368
 epoch: 84, train_loss: 0.8899, test_loss: 0.8924, test_f1: 0.5335
 epoch: 85, train_loss: 0.8938, test_loss: 0.8920, test_f1: 0.5339
 epoch: 86, train_loss: 0.8912, test_loss: 0.8905, test_f1: 0.5322
 epoch: 87, train_loss: 0.8985, test_loss: 0.8888, test_f1: 0.5355
 epoch: 88, train_loss: 0.8938, test_loss: 0.8881, test_f1: 0.5360
 epoch: 89, train_loss: 0.8849, test_loss: 0.8873, test_f1: 0.5400
 epoch: 90, train_loss: 0.8885, test_loss: 0.8857, test_f1: 0.5397
 epoch: 91, train_loss: 0.8849, test_loss: 0.8865, test_f1: 0.5371
 epoch: 92, train_loss: 0.8876, test_loss: 0.8871, test_f1: 0.5401
 epoch: 93, train_loss: 0.8826, test_loss: 0.8881, test_f1: 0.5336
 epoch: 94, train_loss: 0.8794, test_loss: 0.8839, test_f1: 0.5395
 epoch: 95, train_loss: 0.8782, test_loss: 0.8790, test_f1: 0.5428
 epoch: 96, train_loss: 0.8807, test_loss: 0.8810, test_f1: 0.5425
 epoch: 97, train_loss: 0.8767, test_loss: 0.8808, test_f1: 0.5414
 epoch: 98, train_loss: 0.8832, test_loss: 0.8799, test_f1: 0.5420
 epoch: 99, train_loss: 0.8754, test_loss: 0.8795, test_f1: 0.5430
##################ITERATION #2 ****************************************
 epoch: 0, train_loss: 1.3505, test_loss: 1.3593, test_f1: 0.2270
 epoch: 1, train_loss: 1.3227, test_loss: 1.3509, test_f1: 0.2270
 epoch: 2, train_loss: 1.3024, test_loss: 1.3339, test_f1: 0.2270
 epoch: 3, train_loss: 1.2857, test_loss: 1.3046, test_f1: 0.2527
 epoch: 4, train_loss: 1.2666, test_loss: 1.2667, test_f1: 0.3299
 epoch: 5, train_loss: 1.2448, test_loss: 1.2306, test_f1: 0.3467
 epoch: 6, train_loss: 1.2255, test_loss: 1.1992, test_f1: 0.3536
 epoch: 7, train_loss: 1.2055, test_loss: 1.1723, test_f1: 0.3441
 epoch: 8, train_loss: 1.1826, test_loss: 1.1470, test_f1: 0.3441
 epoch: 9, train_loss: 1.1653, test_loss: 1.1261, test_f1: 0.3451
 epoch: 10, train_loss: 1.1442, test_loss: 1.1079, test_f1: 0.3460
 epoch: 11, train_loss: 1.1305, test_loss: 1.0913, test_f1: 0.3460
 epoch: 12, train_loss: 1.1150, test_loss: 1.0779, test_f1: 0.3429
 epoch: 13, train_loss: 1.0985, test_loss: 1.0664, test_f1: 0.3448
 epoch: 14, train_loss: 1.0877, test_loss: 1.0582, test_f1: 0.3438
 epoch: 15, train_loss: 1.0780, test_loss: 1.0481, test_f1: 0.3547
 epoch: 16, train_loss: 1.0703, test_loss: 1.0428, test_f1: 0.3591
 epoch: 17, train_loss: 1.0594, test_loss: 1.0339, test_f1: 0.3741
 epoch: 18, train_loss: 1.0503, test_loss: 1.0306, test_f1: 0.4003
 epoch: 19, train_loss: 1.0439, test_loss: 1.0243, test_f1: 0.4029
 epoch: 20, train_loss: 1.0377, test_loss: 1.0187, test_f1: 0.4105
 epoch: 21, train_loss: 1.0331, test_loss: 1.0132, test_f1: 0.4144
 epoch: 22, train_loss: 1.0253, test_loss: 1.0100, test_f1: 0.4227
 epoch: 23, train_loss: 1.0208, test_loss: 1.0060, test_f1: 0.4263
 epoch: 24, train_loss: 1.0166, test_loss: 1.0019, test_f1: 0.4252
 epoch: 25, train_loss: 1.0103, test_loss: 0.9949, test_f1: 0.4335
 epoch: 26, train_loss: 1.0101, test_loss: 0.9906, test_f1: 0.4393
 epoch: 27, train_loss: 1.0036, test_loss: 0.9878, test_f1: 0.4397
 epoch: 28, train_loss: 0.9930, test_loss: 0.9833, test_f1: 0.4615
 epoch: 29, train_loss: 0.9908, test_loss: 0.9754, test_f1: 0.4487
 epoch: 30, train_loss: 0.9891, test_loss: 0.9722, test_f1: 0.4749
 epoch: 31, train_loss: 0.9866, test_loss: 0.9718, test_f1: 0.4806
 epoch: 32, train_loss: 0.9844, test_loss: 0.9667, test_f1: 0.4825
 epoch: 33, train_loss: 0.9725, test_loss: 0.9639, test_f1: 0.4850
 epoch: 34, train_loss: 0.9754, test_loss: 0.9554, test_f1: 0.4859
 epoch: 35, train_loss: 0.9727, test_loss: 0.9543, test_f1: 0.4870
 epoch: 36, train_loss: 0.9702, test_loss: 0.9548, test_f1: 0.4929
 epoch: 37, train_loss: 0.9671, test_loss: 0.9514, test_f1: 0.4932
 epoch: 38, train_loss: 0.9637, test_loss: 0.9521, test_f1: 0.4965
 epoch: 39, train_loss: 0.9580, test_loss: 0.9437, test_f1: 0.4946
 epoch: 40, train_loss: 0.9537, test_loss: 0.9419, test_f1: 0.5022
 epoch: 41, train_loss: 0.9498, test_loss: 0.9368, test_f1: 0.4973
 epoch: 42, train_loss: 0.9526, test_loss: 0.9377, test_f1: 0.5021
 epoch: 43, train_loss: 0.9419, test_loss: 0.9279, test_f1: 0.4978
 epoch: 44, train_loss: 0.9443, test_loss: 0.9298, test_f1: 0.4950
 epoch: 45, train_loss: 0.9385, test_loss: 0.9344, test_f1: 0.4935
 epoch: 46, train_loss: 0.9347, test_loss: 0.9242, test_f1: 0.5049
 epoch: 47, train_loss: 0.9324, test_loss: 0.9194, test_f1: 0.5130
 epoch: 48, train_loss: 0.9299, test_loss: 0.9260, test_f1: 0.5079
 epoch: 49, train_loss: 0.9287, test_loss: 0.9133, test_f1: 0.5153
 epoch: 50, train_loss: 0.9239, test_loss: 0.9141, test_f1: 0.5138
 epoch: 51, train_loss: 0.9186, test_loss: 0.9118, test_f1: 0.5125
 epoch: 52, train_loss: 0.9183, test_loss: 0.9127, test_f1: 0.5137
 epoch: 53, train_loss: 0.9165, test_loss: 0.9104, test_f1: 0.5173
 epoch: 54, train_loss: 0.9204, test_loss: 0.9097, test_f1: 0.5155
 epoch: 55, train_loss: 0.9133, test_loss: 0.9098, test_f1: 0.5164
 epoch: 56, train_loss: 0.9142, test_loss: 0.9085, test_f1: 0.5125
 epoch: 57, train_loss: 0.9104, test_loss: 0.9062, test_f1: 0.5110
 epoch: 58, train_loss: 0.9107, test_loss: 0.9016, test_f1: 0.5182
 epoch: 59, train_loss: 0.9088, test_loss: 0.9021, test_f1: 0.5226
 epoch: 60, train_loss: 0.9121, test_loss: 0.9003, test_f1: 0.5192
 epoch: 61, train_loss: 0.9097, test_loss: 0.9005, test_f1: 0.5200
 epoch: 62, train_loss: 0.8981, test_loss: 0.9011, test_f1: 0.5247
 epoch: 63, train_loss: 0.9047, test_loss: 0.8994, test_f1: 0.5195
 epoch: 64, train_loss: 0.9002, test_loss: 0.9016, test_f1: 0.5251
 epoch: 65, train_loss: 0.9029, test_loss: 0.8978, test_f1: 0.5245
 epoch: 66, train_loss: 0.8962, test_loss: 0.8977, test_f1: 0.5283
 epoch: 67, train_loss: 0.8969, test_loss: 0.8969, test_f1: 0.5261
 epoch: 68, train_loss: 0.8905, test_loss: 0.8927, test_f1: 0.5212
 epoch: 69, train_loss: 0.8995, test_loss: 0.8941, test_f1: 0.5285
 epoch: 70, train_loss: 0.8930, test_loss: 0.8893, test_f1: 0.5246
 epoch: 71, train_loss: 0.8906, test_loss: 0.8888, test_f1: 0.5352
 epoch: 72, train_loss: 0.8882, test_loss: 0.8867, test_f1: 0.5248
 epoch: 73, train_loss: 0.8867, test_loss: 0.8919, test_f1: 0.5268
 epoch: 74, train_loss: 0.8920, test_loss: 0.8850, test_f1: 0.5366
 epoch: 75, train_loss: 0.8885, test_loss: 0.8905, test_f1: 0.5214
 epoch: 76, train_loss: 0.8882, test_loss: 0.8863, test_f1: 0.5225
 epoch: 77, train_loss: 0.8844, test_loss: 0.8867, test_f1: 0.5331
 epoch: 78, train_loss: 0.8775, test_loss: 0.8885, test_f1: 0.5299
 epoch: 79, train_loss: 0.8790, test_loss: 0.8854, test_f1: 0.5320
 epoch: 80, train_loss: 0.8768, test_loss: 0.8815, test_f1: 0.5317
 epoch: 81, train_loss: 0.8757, test_loss: 0.8839, test_f1: 0.5288
 epoch: 82, train_loss: 0.8768, test_loss: 0.8883, test_f1: 0.5260
 epoch: 83, train_loss: 0.8788, test_loss: 0.8746, test_f1: 0.5299
 epoch: 84, train_loss: 0.8792, test_loss: 0.8781, test_f1: 0.5299
 epoch: 85, train_loss: 0.8730, test_loss: 0.8788, test_f1: 0.5251
 epoch: 86, train_loss: 0.8726, test_loss: 0.8768, test_f1: 0.5277
 epoch: 87, train_loss: 0.8640, test_loss: 0.8741, test_f1: 0.5298
 epoch: 88, train_loss: 0.8753, test_loss: 0.8773, test_f1: 0.5302
 epoch: 89, train_loss: 0.8680, test_loss: 0.8795, test_f1: 0.5272
 epoch: 90, train_loss: 0.8668, test_loss: 0.8724, test_f1: 0.5420
 epoch: 91, train_loss: 0.8649, test_loss: 0.8749, test_f1: 0.5284
 epoch: 92, train_loss: 0.8675, test_loss: 0.8787, test_f1: 0.5274
 epoch: 93, train_loss: 0.8632, test_loss: 0.8838, test_f1: 0.5279
 epoch: 94, train_loss: 0.8588, test_loss: 0.8776, test_f1: 0.5340
 epoch: 95, train_loss: 0.8628, test_loss: 0.8706, test_f1: 0.5267
 epoch: 96, train_loss: 0.8597, test_loss: 0.8795, test_f1: 0.5274
 epoch: 97, train_loss: 0.8597, test_loss: 0.8704, test_f1: 0.5380
 epoch: 98, train_loss: 0.8529, test_loss: 0.8736, test_f1: 0.5316
 epoch: 99, train_loss: 0.8604, test_loss: 0.8733, test_f1: 0.5441
##################ITERATION #3 ****************************************
 epoch: 0, train_loss: 1.3078, test_loss: 1.3172, test_f1: 0.2270
 epoch: 1, train_loss: 1.2741, test_loss: 1.2996, test_f1: 0.2270
 epoch: 2, train_loss: 1.2540, test_loss: 1.2725, test_f1: 0.2270
 epoch: 3, train_loss: 1.2377, test_loss: 1.2345, test_f1: 0.2270
 epoch: 4, train_loss: 1.2187, test_loss: 1.1996, test_f1: 0.3300
 epoch: 5, train_loss: 1.1970, test_loss: 1.1679, test_f1: 0.3548
 epoch: 6, train_loss: 1.1776, test_loss: 1.1411, test_f1: 0.3499
 epoch: 7, train_loss: 1.1577, test_loss: 1.1172, test_f1: 0.3478
 epoch: 8, train_loss: 1.1373, test_loss: 1.0964, test_f1: 0.3636
 epoch: 9, train_loss: 1.1147, test_loss: 1.0793, test_f1: 0.3887
 epoch: 10, train_loss: 1.0995, test_loss: 1.0638, test_f1: 0.4010
 epoch: 11, train_loss: 1.0854, test_loss: 1.0500, test_f1: 0.4130
 epoch: 12, train_loss: 1.0725, test_loss: 1.0391, test_f1: 0.4226
 epoch: 13, train_loss: 1.0579, test_loss: 1.0303, test_f1: 0.4249
 epoch: 14, train_loss: 1.0511, test_loss: 1.0209, test_f1: 0.4349
 epoch: 15, train_loss: 1.0454, test_loss: 1.0142, test_f1: 0.4369
 epoch: 16, train_loss: 1.0399, test_loss: 1.0069, test_f1: 0.4428
 epoch: 17, train_loss: 1.0280, test_loss: 1.0010, test_f1: 0.4397
 epoch: 18, train_loss: 1.0223, test_loss: 0.9953, test_f1: 0.4587
 epoch: 19, train_loss: 1.0146, test_loss: 0.9889, test_f1: 0.4641
 epoch: 20, train_loss: 1.0077, test_loss: 0.9829, test_f1: 0.4644
 epoch: 21, train_loss: 1.0048, test_loss: 0.9813, test_f1: 0.4735
 epoch: 22, train_loss: 0.9994, test_loss: 0.9765, test_f1: 0.4751
 epoch: 23, train_loss: 0.9933, test_loss: 0.9751, test_f1: 0.4796
 epoch: 24, train_loss: 0.9859, test_loss: 0.9714, test_f1: 0.4886
 epoch: 25, train_loss: 0.9853, test_loss: 0.9628, test_f1: 0.4888
 epoch: 26, train_loss: 0.9790, test_loss: 0.9592, test_f1: 0.4942
 epoch: 27, train_loss: 0.9747, test_loss: 0.9563, test_f1: 0.4922
 epoch: 28, train_loss: 0.9683, test_loss: 0.9535, test_f1: 0.4926
 epoch: 29, train_loss: 0.9670, test_loss: 0.9498, test_f1: 0.4954
 epoch: 30, train_loss: 0.9626, test_loss: 0.9455, test_f1: 0.4988
 epoch: 31, train_loss: 0.9613, test_loss: 0.9435, test_f1: 0.4910
 epoch: 32, train_loss: 0.9616, test_loss: 0.9422, test_f1: 0.4948
 epoch: 33, train_loss: 0.9482, test_loss: 0.9404, test_f1: 0.4950
 epoch: 34, train_loss: 0.9465, test_loss: 0.9339, test_f1: 0.5020
 epoch: 35, train_loss: 0.9425, test_loss: 0.9346, test_f1: 0.5084
 epoch: 36, train_loss: 0.9413, test_loss: 0.9293, test_f1: 0.5015
 epoch: 37, train_loss: 0.9401, test_loss: 0.9237, test_f1: 0.5149
 epoch: 38, train_loss: 0.9358, test_loss: 0.9238, test_f1: 0.5168
 epoch: 39, train_loss: 0.9343, test_loss: 0.9232, test_f1: 0.5126
 epoch: 40, train_loss: 0.9219, test_loss: 0.9154, test_f1: 0.5130
 epoch: 41, train_loss: 0.9239, test_loss: 0.9175, test_f1: 0.5214
 epoch: 42, train_loss: 0.9178, test_loss: 0.9096, test_f1: 0.5222
 epoch: 43, train_loss: 0.9154, test_loss: 0.9095, test_f1: 0.5198
 epoch: 44, train_loss: 0.9136, test_loss: 0.9050, test_f1: 0.5157
 epoch: 45, train_loss: 0.9189, test_loss: 0.9031, test_f1: 0.5240
 epoch: 46, train_loss: 0.9072, test_loss: 0.8986, test_f1: 0.5256
 epoch: 47, train_loss: 0.9072, test_loss: 0.9003, test_f1: 0.5119
 epoch: 48, train_loss: 0.9013, test_loss: 0.8936, test_f1: 0.5307
 epoch: 49, train_loss: 0.9028, test_loss: 0.8883, test_f1: 0.5196
 epoch: 50, train_loss: 0.9019, test_loss: 0.8817, test_f1: 0.5363
 epoch: 51, train_loss: 0.8892, test_loss: 0.8844, test_f1: 0.5194
 epoch: 52, train_loss: 0.8939, test_loss: 0.8832, test_f1: 0.5171
 epoch: 53, train_loss: 0.8875, test_loss: 0.8796, test_f1: 0.5279
 epoch: 54, train_loss: 0.8865, test_loss: 0.8774, test_f1: 0.5220
 epoch: 55, train_loss: 0.8881, test_loss: 0.8766, test_f1: 0.5328
 epoch: 56, train_loss: 0.8842, test_loss: 0.8764, test_f1: 0.5326
 epoch: 57, train_loss: 0.8864, test_loss: 0.8772, test_f1: 0.5256
 epoch: 58, train_loss: 0.8786, test_loss: 0.8765, test_f1: 0.5288
 epoch: 59, train_loss: 0.8829, test_loss: 0.8754, test_f1: 0.5301
 epoch: 60, train_loss: 0.8808, test_loss: 0.8742, test_f1: 0.5250
 epoch: 61, train_loss: 0.8788, test_loss: 0.8725, test_f1: 0.5303
 epoch: 62, train_loss: 0.8740, test_loss: 0.8732, test_f1: 0.5314
 epoch: 63, train_loss: 0.8748, test_loss: 0.8704, test_f1: 0.5360
 epoch: 64, train_loss: 0.8731, test_loss: 0.8685, test_f1: 0.5351
 epoch: 65, train_loss: 0.8681, test_loss: 0.8667, test_f1: 0.5276
 epoch: 66, train_loss: 0.8696, test_loss: 0.8661, test_f1: 0.5282
 epoch: 67, train_loss: 0.8672, test_loss: 0.8643, test_f1: 0.5254
 epoch: 68, train_loss: 0.8672, test_loss: 0.8643, test_f1: 0.5308
 epoch: 69, train_loss: 0.8694, test_loss: 0.8656, test_f1: 0.5272
 epoch: 70, train_loss: 0.8635, test_loss: 0.8635, test_f1: 0.5351
 epoch: 71, train_loss: 0.8631, test_loss: 0.8610, test_f1: 0.5232
 epoch: 72, train_loss: 0.8649, test_loss: 0.8597, test_f1: 0.5287
 epoch: 73, train_loss: 0.8607, test_loss: 0.8583, test_f1: 0.5357
 epoch: 74, train_loss: 0.8609, test_loss: 0.8605, test_f1: 0.5341
 epoch: 75, train_loss: 0.8562, test_loss: 0.8583, test_f1: 0.5343
 epoch: 76, train_loss: 0.8580, test_loss: 0.8565, test_f1: 0.5415
 epoch: 77, train_loss: 0.8592, test_loss: 0.8582, test_f1: 0.5348
 epoch: 78, train_loss: 0.8593, test_loss: 0.8566, test_f1: 0.5350
 epoch: 79, train_loss: 0.8538, test_loss: 0.8533, test_f1: 0.5383
 epoch: 80, train_loss: 0.8518, test_loss: 0.8562, test_f1: 0.5322
 epoch: 81, train_loss: 0.8515, test_loss: 0.8531, test_f1: 0.5401
 epoch: 82, train_loss: 0.8416, test_loss: 0.8526, test_f1: 0.5304
 epoch: 83, train_loss: 0.8444, test_loss: 0.8527, test_f1: 0.5312
 epoch: 84, train_loss: 0.8507, test_loss: 0.8502, test_f1: 0.5310
 epoch: 85, train_loss: 0.8450, test_loss: 0.8490, test_f1: 0.5324
 epoch: 86, train_loss: 0.8486, test_loss: 0.8505, test_f1: 0.5425
 epoch: 87, train_loss: 0.8491, test_loss: 0.8507, test_f1: 0.5454
 epoch: 88, train_loss: 0.8435, test_loss: 0.8522, test_f1: 0.5317
 epoch: 89, train_loss: 0.8481, test_loss: 0.8475, test_f1: 0.5330
 epoch: 90, train_loss: 0.8433, test_loss: 0.8449, test_f1: 0.5413
 epoch: 91, train_loss: 0.8452, test_loss: 0.8473, test_f1: 0.5368
 epoch: 92, train_loss: 0.8391, test_loss: 0.8458, test_f1: 0.5318
 epoch: 93, train_loss: 0.8343, test_loss: 0.8448, test_f1: 0.5332
 epoch: 94, train_loss: 0.8334, test_loss: 0.8425, test_f1: 0.5318
 epoch: 95, train_loss: 0.8320, test_loss: 0.8416, test_f1: 0.5413
 epoch: 96, train_loss: 0.8362, test_loss: 0.8368, test_f1: 0.5516
 epoch: 97, train_loss: 0.8351, test_loss: 0.8382, test_f1: 0.5380
 epoch: 98, train_loss: 0.8320, test_loss: 0.8366, test_f1: 0.5371
 epoch: 99, train_loss: 0.8289, test_loss: 0.8350, test_f1: 0.5437
##################ITERATION #4 ****************************************
 epoch: 0, train_loss: 1.3166, test_loss: 1.3351, test_f1: 0.2270
 epoch: 1, train_loss: 1.2814, test_loss: 1.3237, test_f1: 0.2270
 epoch: 2, train_loss: 1.2558, test_loss: 1.3015, test_f1: 0.2270
 epoch: 3, train_loss: 1.2363, test_loss: 1.2631, test_f1: 0.2320
 epoch: 4, train_loss: 1.2154, test_loss: 1.2201, test_f1: 0.3219
 epoch: 5, train_loss: 1.1986, test_loss: 1.1788, test_f1: 0.4277
 epoch: 6, train_loss: 1.1698, test_loss: 1.1445, test_f1: 0.4264
 epoch: 7, train_loss: 1.1522, test_loss: 1.1185, test_f1: 0.4307
 epoch: 8, train_loss: 1.1371, test_loss: 1.0971, test_f1: 0.4327
 epoch: 9, train_loss: 1.1172, test_loss: 1.0795, test_f1: 0.4292
 epoch: 10, train_loss: 1.1002, test_loss: 1.0649, test_f1: 0.4326
 epoch: 11, train_loss: 1.0892, test_loss: 1.0523, test_f1: 0.4301
 epoch: 12, train_loss: 1.0745, test_loss: 1.0424, test_f1: 0.4320
 epoch: 13, train_loss: 1.0678, test_loss: 1.0335, test_f1: 0.4409
 epoch: 14, train_loss: 1.0615, test_loss: 1.0268, test_f1: 0.4449
 epoch: 15, train_loss: 1.0452, test_loss: 1.0210, test_f1: 0.4402
 epoch: 16, train_loss: 1.0423, test_loss: 1.0152, test_f1: 0.4343
 epoch: 17, train_loss: 1.0291, test_loss: 1.0085, test_f1: 0.4382
 epoch: 18, train_loss: 1.0268, test_loss: 1.0045, test_f1: 0.4444
 epoch: 19, train_loss: 1.0205, test_loss: 0.9990, test_f1: 0.4511
 epoch: 20, train_loss: 1.0166, test_loss: 0.9931, test_f1: 0.4718
 epoch: 21, train_loss: 1.0119, test_loss: 0.9886, test_f1: 0.4658
 epoch: 22, train_loss: 1.0033, test_loss: 0.9842, test_f1: 0.4692
 epoch: 23, train_loss: 1.0015, test_loss: 0.9818, test_f1: 0.4743
 epoch: 24, train_loss: 1.0003, test_loss: 0.9771, test_f1: 0.4728
 epoch: 25, train_loss: 0.9888, test_loss: 0.9742, test_f1: 0.4771
 epoch: 26, train_loss: 0.9848, test_loss: 0.9694, test_f1: 0.4851
 epoch: 27, train_loss: 0.9843, test_loss: 0.9655, test_f1: 0.4757
 epoch: 28, train_loss: 0.9825, test_loss: 0.9647, test_f1: 0.4769
 epoch: 29, train_loss: 0.9771, test_loss: 0.9606, test_f1: 0.4800
 epoch: 30, train_loss: 0.9697, test_loss: 0.9594, test_f1: 0.4829
 epoch: 31, train_loss: 0.9642, test_loss: 0.9544, test_f1: 0.4890
 epoch: 32, train_loss: 0.9575, test_loss: 0.9487, test_f1: 0.4829
 epoch: 33, train_loss: 0.9611, test_loss: 0.9491, test_f1: 0.4847
 epoch: 34, train_loss: 0.9563, test_loss: 0.9467, test_f1: 0.4906
 epoch: 35, train_loss: 0.9535, test_loss: 0.9411, test_f1: 0.4846
 epoch: 36, train_loss: 0.9492, test_loss: 0.9387, test_f1: 0.4921
 epoch: 37, train_loss: 0.9479, test_loss: 0.9352, test_f1: 0.5009
 epoch: 38, train_loss: 0.9419, test_loss: 0.9342, test_f1: 0.5032
 epoch: 39, train_loss: 0.9421, test_loss: 0.9322, test_f1: 0.4963
 epoch: 40, train_loss: 0.9348, test_loss: 0.9243, test_f1: 0.5015
 epoch: 41, train_loss: 0.9307, test_loss: 0.9255, test_f1: 0.4994
 epoch: 42, train_loss: 0.9337, test_loss: 0.9215, test_f1: 0.5065
 epoch: 43, train_loss: 0.9213, test_loss: 0.9161, test_f1: 0.5029
 epoch: 44, train_loss: 0.9261, test_loss: 0.9182, test_f1: 0.5045
 epoch: 45, train_loss: 0.9208, test_loss: 0.9114, test_f1: 0.5020
 epoch: 46, train_loss: 0.9210, test_loss: 0.9113, test_f1: 0.5125
 epoch: 47, train_loss: 0.9157, test_loss: 0.9066, test_f1: 0.5115
 epoch: 48, train_loss: 0.9083, test_loss: 0.9010, test_f1: 0.5204
 epoch: 49, train_loss: 0.9109, test_loss: 0.8975, test_f1: 0.5193
 epoch: 50, train_loss: 0.9083, test_loss: 0.9079, test_f1: 0.5120
 epoch: 51, train_loss: 0.9076, test_loss: 0.8958, test_f1: 0.5140
 epoch: 52, train_loss: 0.8983, test_loss: 0.8923, test_f1: 0.5113
 epoch: 53, train_loss: 0.8953, test_loss: 0.8928, test_f1: 0.5189
 epoch: 54, train_loss: 0.9013, test_loss: 0.8893, test_f1: 0.5182
 epoch: 55, train_loss: 0.8996, test_loss: 0.8913, test_f1: 0.5122
 epoch: 56, train_loss: 0.8954, test_loss: 0.8894, test_f1: 0.5190
 epoch: 57, train_loss: 0.8924, test_loss: 0.8883, test_f1: 0.5184
 epoch: 58, train_loss: 0.8908, test_loss: 0.8868, test_f1: 0.5258
 epoch: 59, train_loss: 0.8843, test_loss: 0.8838, test_f1: 0.5187
 epoch: 60, train_loss: 0.8899, test_loss: 0.8850, test_f1: 0.5166
 epoch: 61, train_loss: 0.8864, test_loss: 0.8829, test_f1: 0.5268
 epoch: 62, train_loss: 0.8834, test_loss: 0.8774, test_f1: 0.5223
 epoch: 63, train_loss: 0.8852, test_loss: 0.8793, test_f1: 0.5277
 epoch: 64, train_loss: 0.8819, test_loss: 0.8802, test_f1: 0.5257
 epoch: 65, train_loss: 0.8865, test_loss: 0.8807, test_f1: 0.5378
 epoch: 66, train_loss: 0.8770, test_loss: 0.8808, test_f1: 0.5262
 epoch: 67, train_loss: 0.8797, test_loss: 0.8793, test_f1: 0.5222
 epoch: 68, train_loss: 0.8748, test_loss: 0.8737, test_f1: 0.5286
 epoch: 69, train_loss: 0.8766, test_loss: 0.8762, test_f1: 0.5302
 epoch: 70, train_loss: 0.8749, test_loss: 0.8737, test_f1: 0.5317
 epoch: 71, train_loss: 0.8740, test_loss: 0.8746, test_f1: 0.5266
 epoch: 72, train_loss: 0.8719, test_loss: 0.8718, test_f1: 0.5328
 epoch: 73, train_loss: 0.8680, test_loss: 0.8711, test_f1: 0.5325
 epoch: 74, train_loss: 0.8647, test_loss: 0.8673, test_f1: 0.5264
 epoch: 75, train_loss: 0.8739, test_loss: 0.8664, test_f1: 0.5341
 epoch: 76, train_loss: 0.8655, test_loss: 0.8688, test_f1: 0.5410
 epoch: 77, train_loss: 0.8641, test_loss: 0.8691, test_f1: 0.5332
 epoch: 78, train_loss: 0.8601, test_loss: 0.8649, test_f1: 0.5350
 epoch: 79, train_loss: 0.8537, test_loss: 0.8627, test_f1: 0.5366
 epoch: 80, train_loss: 0.8569, test_loss: 0.8623, test_f1: 0.5361
 epoch: 81, train_loss: 0.8539, test_loss: 0.8609, test_f1: 0.5421
 epoch: 82, train_loss: 0.8587, test_loss: 0.8621, test_f1: 0.5433
 epoch: 83, train_loss: 0.8624, test_loss: 0.8633, test_f1: 0.5431
 epoch: 84, train_loss: 0.8543, test_loss: 0.8622, test_f1: 0.5437
 epoch: 85, train_loss: 0.8537, test_loss: 0.8578, test_f1: 0.5566
 epoch: 86, train_loss: 0.8514, test_loss: 0.8621, test_f1: 0.5461
 epoch: 87, train_loss: 0.8506, test_loss: 0.8625, test_f1: 0.5422
 epoch: 88, train_loss: 0.8509, test_loss: 0.8588, test_f1: 0.5514
 epoch: 89, train_loss: 0.8571, test_loss: 0.8650, test_f1: 0.5375
 epoch: 90, train_loss: 0.8434, test_loss: 0.8569, test_f1: 0.5514
 epoch: 91, train_loss: 0.8463, test_loss: 0.8594, test_f1: 0.5520
 epoch: 92, train_loss: 0.8497, test_loss: 0.8576, test_f1: 0.5533
 epoch: 93, train_loss: 0.8466, test_loss: 0.8550, test_f1: 0.5585
 epoch: 94, train_loss: 0.8462, test_loss: 0.8548, test_f1: 0.5633
 epoch: 95, train_loss: 0.8438, test_loss: 0.8581, test_f1: 0.5580
 epoch: 96, train_loss: 0.8374, test_loss: 0.8520, test_f1: 0.5557
 epoch: 97, train_loss: 0.8419, test_loss: 0.8544, test_f1: 0.5539
 epoch: 98, train_loss: 0.8447, test_loss: 0.8596, test_f1: 0.5524
 epoch: 99, train_loss: 0.8443, test_loss: 0.8510, test_f1: 0.5609
##################ITERATION #5 ****************************************
 epoch: 0, train_loss: 1.3115, test_loss: 1.3171, test_f1: 0.2270
 epoch: 1, train_loss: 1.2514, test_loss: 1.2993, test_f1: 0.2270
 epoch: 2, train_loss: 1.2193, test_loss: 1.2636, test_f1: 0.2270
 epoch: 3, train_loss: 1.1949, test_loss: 1.2080, test_f1: 0.3068
 epoch: 4, train_loss: 1.1671, test_loss: 1.1462, test_f1: 0.3497
 epoch: 5, train_loss: 1.1376, test_loss: 1.1045, test_f1: 0.3833
 epoch: 6, train_loss: 1.1182, test_loss: 1.0807, test_f1: 0.4123
 epoch: 7, train_loss: 1.1048, test_loss: 1.0622, test_f1: 0.4265
 epoch: 8, train_loss: 1.0871, test_loss: 1.0494, test_f1: 0.4374
 epoch: 9, train_loss: 1.0761, test_loss: 1.0394, test_f1: 0.4509
 epoch: 10, train_loss: 1.0575, test_loss: 1.0297, test_f1: 0.4473
 epoch: 11, train_loss: 1.0547, test_loss: 1.0212, test_f1: 0.4423
 epoch: 12, train_loss: 1.0428, test_loss: 1.0154, test_f1: 0.4408
 epoch: 13, train_loss: 1.0286, test_loss: 1.0064, test_f1: 0.4547
 epoch: 14, train_loss: 1.0279, test_loss: 0.9997, test_f1: 0.4675
 epoch: 15, train_loss: 1.0176, test_loss: 0.9920, test_f1: 0.4710
 epoch: 16, train_loss: 1.0115, test_loss: 0.9868, test_f1: 0.4772
 epoch: 17, train_loss: 0.9989, test_loss: 0.9845, test_f1: 0.4815
 epoch: 18, train_loss: 1.0039, test_loss: 0.9804, test_f1: 0.4805
 epoch: 19, train_loss: 0.9953, test_loss: 0.9808, test_f1: 0.4819
 epoch: 20, train_loss: 0.9935, test_loss: 0.9753, test_f1: 0.4862
 epoch: 21, train_loss: 0.9848, test_loss: 0.9691, test_f1: 0.4840
 epoch: 22, train_loss: 0.9793, test_loss: 0.9666, test_f1: 0.4861
 epoch: 23, train_loss: 0.9713, test_loss: 0.9624, test_f1: 0.4872
 epoch: 24, train_loss: 0.9674, test_loss: 0.9605, test_f1: 0.4878
 epoch: 25, train_loss: 0.9658, test_loss: 0.9551, test_f1: 0.4786
 epoch: 26, train_loss: 0.9709, test_loss: 0.9498, test_f1: 0.4905
 epoch: 27, train_loss: 0.9618, test_loss: 0.9484, test_f1: 0.4793
 epoch: 28, train_loss: 0.9567, test_loss: 0.9469, test_f1: 0.4761
 epoch: 29, train_loss: 0.9484, test_loss: 0.9483, test_f1: 0.4998
 epoch: 30, train_loss: 0.9524, test_loss: 0.9443, test_f1: 0.4909
 epoch: 31, train_loss: 0.9501, test_loss: 0.9424, test_f1: 0.5057
 epoch: 32, train_loss: 0.9446, test_loss: 0.9364, test_f1: 0.5137
 epoch: 33, train_loss: 0.9407, test_loss: 0.9366, test_f1: 0.5020
 epoch: 34, train_loss: 0.9303, test_loss: 0.9345, test_f1: 0.5078
 epoch: 35, train_loss: 0.9259, test_loss: 0.9322, test_f1: 0.5210
 epoch: 36, train_loss: 0.9314, test_loss: 0.9279, test_f1: 0.5111
 epoch: 37, train_loss: 0.9277, test_loss: 0.9200, test_f1: 0.5161
 epoch: 38, train_loss: 0.9225, test_loss: 0.9190, test_f1: 0.5180
 epoch: 39, train_loss: 0.9214, test_loss: 0.9156, test_f1: 0.5196
 epoch: 40, train_loss: 0.9226, test_loss: 0.9169, test_f1: 0.5177
 epoch: 41, train_loss: 0.9098, test_loss: 0.9123, test_f1: 0.5264
 epoch: 42, train_loss: 0.9117, test_loss: 0.9061, test_f1: 0.5305
 epoch: 43, train_loss: 0.9096, test_loss: 0.9067, test_f1: 0.5301
 epoch: 44, train_loss: 0.9102, test_loss: 0.9063, test_f1: 0.5250
 epoch: 45, train_loss: 0.9037, test_loss: 0.9078, test_f1: 0.5325
 epoch: 46, train_loss: 0.8970, test_loss: 0.9070, test_f1: 0.5291
 epoch: 47, train_loss: 0.8956, test_loss: 0.9007, test_f1: 0.5241
 epoch: 48, train_loss: 0.8942, test_loss: 0.8986, test_f1: 0.5410
 epoch: 49, train_loss: 0.8990, test_loss: 0.8984, test_f1: 0.5352
 epoch: 50, train_loss: 0.8954, test_loss: 0.8956, test_f1: 0.5324
 epoch: 51, train_loss: 0.8891, test_loss: 0.8992, test_f1: 0.5277
 epoch: 52, train_loss: 0.8827, test_loss: 0.8890, test_f1: 0.5376
 epoch: 53, train_loss: 0.8800, test_loss: 0.8894, test_f1: 0.5355
 epoch: 54, train_loss: 0.8823, test_loss: 0.8933, test_f1: 0.5378
 epoch: 55, train_loss: 0.8857, test_loss: 0.8914, test_f1: 0.5341
 epoch: 56, train_loss: 0.8841, test_loss: 0.8905, test_f1: 0.5358
 epoch: 57, train_loss: 0.8841, test_loss: 0.8913, test_f1: 0.5320
 epoch: 58, train_loss: 0.8724, test_loss: 0.8923, test_f1: 0.5377
 epoch: 59, train_loss: 0.8830, test_loss: 0.8904, test_f1: 0.5364
 epoch: 60, train_loss: 0.8827, test_loss: 0.8895, test_f1: 0.5349
 epoch: 61, train_loss: 0.8761, test_loss: 0.8867, test_f1: 0.5342
 epoch: 62, train_loss: 0.8760, test_loss: 0.8829, test_f1: 0.5362
 epoch: 63, train_loss: 0.8645, test_loss: 0.8826, test_f1: 0.5338
 epoch: 64, train_loss: 0.8702, test_loss: 0.8832, test_f1: 0.5398
 epoch: 65, train_loss: 0.8744, test_loss: 0.8822, test_f1: 0.5410
 epoch: 66, train_loss: 0.8733, test_loss: 0.8814, test_f1: 0.5393
 epoch: 67, train_loss: 0.8735, test_loss: 0.8810, test_f1: 0.5489
 epoch: 68, train_loss: 0.8681, test_loss: 0.8773, test_f1: 0.5290
 epoch: 69, train_loss: 0.8694, test_loss: 0.8762, test_f1: 0.5399
 epoch: 70, train_loss: 0.8692, test_loss: 0.8750, test_f1: 0.5397
 epoch: 71, train_loss: 0.8633, test_loss: 0.8833, test_f1: 0.5360
 epoch: 72, train_loss: 0.8656, test_loss: 0.8781, test_f1: 0.5350
 epoch: 73, train_loss: 0.8605, test_loss: 0.8760, test_f1: 0.5396
 epoch: 74, train_loss: 0.8584, test_loss: 0.8741, test_f1: 0.5376
 epoch: 75, train_loss: 0.8539, test_loss: 0.8722, test_f1: 0.5373
 epoch: 76, train_loss: 0.8546, test_loss: 0.8760, test_f1: 0.5335
 epoch: 77, train_loss: 0.8593, test_loss: 0.8707, test_f1: 0.5396
 epoch: 78, train_loss: 0.8537, test_loss: 0.8722, test_f1: 0.5403
 epoch: 79, train_loss: 0.8558, test_loss: 0.8707, test_f1: 0.5406
 epoch: 80, train_loss: 0.8549, test_loss: 0.8689, test_f1: 0.5393
 epoch: 81, train_loss: 0.8588, test_loss: 0.8685, test_f1: 0.5422
 epoch: 82, train_loss: 0.8522, test_loss: 0.8713, test_f1: 0.5408
 epoch: 83, train_loss: 0.8538, test_loss: 0.8698, test_f1: 0.5386
 epoch: 84, train_loss: 0.8492, test_loss: 0.8694, test_f1: 0.5359
 epoch: 85, train_loss: 0.8491, test_loss: 0.8664, test_f1: 0.5383
 epoch: 86, train_loss: 0.8492, test_loss: 0.8681, test_f1: 0.5442
 epoch: 87, train_loss: 0.8503, test_loss: 0.8639, test_f1: 0.5425
 epoch: 88, train_loss: 0.8525, test_loss: 0.8630, test_f1: 0.5425
 epoch: 89, train_loss: 0.8420, test_loss: 0.8646, test_f1: 0.5453
 epoch: 90, train_loss: 0.8557, test_loss: 0.8648, test_f1: 0.5431
 epoch: 91, train_loss: 0.8443, test_loss: 0.8639, test_f1: 0.5461
 epoch: 92, train_loss: 0.8411, test_loss: 0.8654, test_f1: 0.5430
 epoch: 93, train_loss: 0.8357, test_loss: 0.8614, test_f1: 0.5379
 epoch: 94, train_loss: 0.8336, test_loss: 0.8546, test_f1: 0.5444
 epoch: 95, train_loss: 0.8442, test_loss: 0.8576, test_f1: 0.5435
 epoch: 96, train_loss: 0.8395, test_loss: 0.8620, test_f1: 0.5471
 epoch: 97, train_loss: 0.8321, test_loss: 0.8605, test_f1: 0.5429
 epoch: 98, train_loss: 0.8287, test_loss: 0.8580, test_f1: 0.5451
 epoch: 99, train_loss: 0.8363, test_loss: 0.8561, test_f1: 0.5478
##################ITERATION #6 ****************************************
 epoch: 0, train_loss: 1.3044, test_loss: 1.3149, test_f1: 0.2270
 epoch: 1, train_loss: 1.2319, test_loss: 1.2938, test_f1: 0.2270
 epoch: 2, train_loss: 1.2057, test_loss: 1.2299, test_f1: 0.2251
 epoch: 3, train_loss: 1.1758, test_loss: 1.1588, test_f1: 0.3358
 epoch: 4, train_loss: 1.1535, test_loss: 1.1139, test_f1: 0.4033
 epoch: 5, train_loss: 1.1274, test_loss: 1.0854, test_f1: 0.4235
 epoch: 6, train_loss: 1.1116, test_loss: 1.0624, test_f1: 0.4311
 epoch: 7, train_loss: 1.0902, test_loss: 1.0449, test_f1: 0.4271
 epoch: 8, train_loss: 1.0810, test_loss: 1.0329, test_f1: 0.4546
 epoch: 9, train_loss: 1.0665, test_loss: 1.0242, test_f1: 0.4554
 epoch: 10, train_loss: 1.0543, test_loss: 1.0170, test_f1: 0.4531
 epoch: 11, train_loss: 1.0488, test_loss: 1.0107, test_f1: 0.4605
 epoch: 12, train_loss: 1.0380, test_loss: 1.0049, test_f1: 0.4616
 epoch: 13, train_loss: 1.0326, test_loss: 0.9991, test_f1: 0.4547
 epoch: 14, train_loss: 1.0233, test_loss: 0.9969, test_f1: 0.4627
 epoch: 15, train_loss: 1.0171, test_loss: 0.9945, test_f1: 0.4701
 epoch: 16, train_loss: 1.0109, test_loss: 0.9888, test_f1: 0.4691
 epoch: 17, train_loss: 1.0110, test_loss: 0.9832, test_f1: 0.4703
 epoch: 18, train_loss: 1.0036, test_loss: 0.9823, test_f1: 0.4730
 epoch: 19, train_loss: 0.9965, test_loss: 0.9779, test_f1: 0.4796
 epoch: 20, train_loss: 0.9991, test_loss: 0.9744, test_f1: 0.4770
 epoch: 21, train_loss: 0.9989, test_loss: 0.9715, test_f1: 0.4817
 epoch: 22, train_loss: 0.9855, test_loss: 0.9676, test_f1: 0.4839
 epoch: 23, train_loss: 0.9832, test_loss: 0.9668, test_f1: 0.4819
 epoch: 24, train_loss: 0.9790, test_loss: 0.9693, test_f1: 0.4882
 epoch: 25, train_loss: 0.9741, test_loss: 0.9665, test_f1: 0.4873
 epoch: 26, train_loss: 0.9688, test_loss: 0.9588, test_f1: 0.4858
 epoch: 27, train_loss: 0.9706, test_loss: 0.9583, test_f1: 0.4882
 epoch: 28, train_loss: 0.9692, test_loss: 0.9567, test_f1: 0.4913
 epoch: 29, train_loss: 0.9676, test_loss: 0.9568, test_f1: 0.4918
 epoch: 30, train_loss: 0.9643, test_loss: 0.9542, test_f1: 0.4868
 epoch: 31, train_loss: 0.9622, test_loss: 0.9519, test_f1: 0.4897
 epoch: 32, train_loss: 0.9495, test_loss: 0.9492, test_f1: 0.4903
 epoch: 33, train_loss: 0.9481, test_loss: 0.9490, test_f1: 0.4894
 epoch: 34, train_loss: 0.9474, test_loss: 0.9426, test_f1: 0.5053
 epoch: 35, train_loss: 0.9410, test_loss: 0.9440, test_f1: 0.5025
 epoch: 36, train_loss: 0.9435, test_loss: 0.9406, test_f1: 0.4971
 epoch: 37, train_loss: 0.9368, test_loss: 0.9386, test_f1: 0.5026
 epoch: 38, train_loss: 0.9376, test_loss: 0.9317, test_f1: 0.5061
 epoch: 39, train_loss: 0.9380, test_loss: 0.9376, test_f1: 0.5063
 epoch: 40, train_loss: 0.9327, test_loss: 0.9269, test_f1: 0.5144
 epoch: 41, train_loss: 0.9248, test_loss: 0.9331, test_f1: 0.5195
 epoch: 42, train_loss: 0.9280, test_loss: 0.9262, test_f1: 0.5125
 epoch: 43, train_loss: 0.9200, test_loss: 0.9180, test_f1: 0.5134
 epoch: 44, train_loss: 0.9164, test_loss: 0.9165, test_f1: 0.5076
 epoch: 45, train_loss: 0.9187, test_loss: 0.9195, test_f1: 0.5111
 epoch: 46, train_loss: 0.9139, test_loss: 0.9119, test_f1: 0.5278
 epoch: 47, train_loss: 0.9103, test_loss: 0.9176, test_f1: 0.5372
 epoch: 48, train_loss: 0.9066, test_loss: 0.9089, test_f1: 0.5107
 epoch: 49, train_loss: 0.9129, test_loss: 0.9094, test_f1: 0.5232
 epoch: 50, train_loss: 0.9044, test_loss: 0.9195, test_f1: 0.5312
 epoch: 51, train_loss: 0.8987, test_loss: 0.9154, test_f1: 0.5407
 epoch: 52, train_loss: 0.8943, test_loss: 0.9071, test_f1: 0.5242
 epoch: 53, train_loss: 0.8971, test_loss: 0.9042, test_f1: 0.5360
 epoch: 54, train_loss: 0.8922, test_loss: 0.9001, test_f1: 0.5417
 epoch: 55, train_loss: 0.8913, test_loss: 0.9061, test_f1: 0.5363
 epoch: 56, train_loss: 0.8919, test_loss: 0.8960, test_f1: 0.5437
 epoch: 57, train_loss: 0.8964, test_loss: 0.8924, test_f1: 0.5394
 epoch: 58, train_loss: 0.8878, test_loss: 0.8955, test_f1: 0.5413
 epoch: 59, train_loss: 0.8930, test_loss: 0.9015, test_f1: 0.5326
 epoch: 60, train_loss: 0.8870, test_loss: 0.9013, test_f1: 0.5347
 epoch: 61, train_loss: 0.8871, test_loss: 0.8992, test_f1: 0.5259
 epoch: 62, train_loss: 0.8873, test_loss: 0.8960, test_f1: 0.5294
 epoch: 63, train_loss: 0.8749, test_loss: 0.8926, test_f1: 0.5409
 epoch: 64, train_loss: 0.8796, test_loss: 0.8909, test_f1: 0.5476
 epoch: 65, train_loss: 0.8752, test_loss: 0.8928, test_f1: 0.5493
 epoch: 66, train_loss: 0.8769, test_loss: 0.8903, test_f1: 0.5403
 epoch: 67, train_loss: 0.8740, test_loss: 0.8917, test_f1: 0.5473
 epoch: 68, train_loss: 0.8771, test_loss: 0.8885, test_f1: 0.5368
 epoch: 69, train_loss: 0.8776, test_loss: 0.8979, test_f1: 0.5333
 epoch: 70, train_loss: 0.8698, test_loss: 0.8876, test_f1: 0.5333
 epoch: 71, train_loss: 0.8700, test_loss: 0.8925, test_f1: 0.5367
 epoch: 72, train_loss: 0.8762, test_loss: 0.8831, test_f1: 0.5437
 epoch: 73, train_loss: 0.8714, test_loss: 0.8808, test_f1: 0.5489
 epoch: 74, train_loss: 0.8743, test_loss: 0.8910, test_f1: 0.5426
 epoch: 75, train_loss: 0.8702, test_loss: 0.8811, test_f1: 0.5315
 epoch: 76, train_loss: 0.8658, test_loss: 0.8879, test_f1: 0.5421
 epoch: 77, train_loss: 0.8658, test_loss: 0.8761, test_f1: 0.5338
 epoch: 78, train_loss: 0.8633, test_loss: 0.8831, test_f1: 0.5340
 epoch: 79, train_loss: 0.8578, test_loss: 0.8773, test_f1: 0.5439
 epoch: 80, train_loss: 0.8535, test_loss: 0.8794, test_f1: 0.5368
 epoch: 81, train_loss: 0.8575, test_loss: 0.8739, test_f1: 0.5459
 epoch: 82, train_loss: 0.8589, test_loss: 0.8765, test_f1: 0.5453
 epoch: 83, train_loss: 0.8521, test_loss: 0.8786, test_f1: 0.5405
 epoch: 84, train_loss: 0.8429, test_loss: 0.8754, test_f1: 0.5401
 epoch: 85, train_loss: 0.8535, test_loss: 0.8713, test_f1: 0.5422
 epoch: 86, train_loss: 0.8542, test_loss: 0.8753, test_f1: 0.5491
 epoch: 87, train_loss: 0.8527, test_loss: 0.8777, test_f1: 0.5432
 epoch: 88, train_loss: 0.8500, test_loss: 0.8709, test_f1: 0.5416
 epoch: 89, train_loss: 0.8489, test_loss: 0.8708, test_f1: 0.5380
 epoch: 90, train_loss: 0.8480, test_loss: 0.8694, test_f1: 0.5414
 epoch: 91, train_loss: 0.8440, test_loss: 0.8750, test_f1: 0.5498
 epoch: 92, train_loss: 0.8479, test_loss: 0.8649, test_f1: 0.5423
 epoch: 93, train_loss: 0.8423, test_loss: 0.8597, test_f1: 0.5494
 epoch: 94, train_loss: 0.8437, test_loss: 0.8712, test_f1: 0.5562
 epoch: 95, train_loss: 0.8416, test_loss: 0.8750, test_f1: 0.5558
 epoch: 96, train_loss: 0.8394, test_loss: 0.8687, test_f1: 0.5544
 epoch: 97, train_loss: 0.8383, test_loss: 0.8695, test_f1: 0.5488
 epoch: 98, train_loss: 0.8437, test_loss: 0.8737, test_f1: 0.5459
 epoch: 99, train_loss: 0.8399, test_loss: 0.8659, test_f1: 0.5586
##################ITERATION #7 ****************************************
 epoch: 0, train_loss: 1.2879, test_loss: 1.3065, test_f1: 0.2270
 epoch: 1, train_loss: 1.2225, test_loss: 1.2804, test_f1: 0.2270
 epoch: 2, train_loss: 1.1843, test_loss: 1.2380, test_f1: 0.2270
 epoch: 3, train_loss: 1.1590, test_loss: 1.1741, test_f1: 0.2319
 epoch: 4, train_loss: 1.1234, test_loss: 1.1134, test_f1: 0.4218
 epoch: 5, train_loss: 1.1042, test_loss: 1.0769, test_f1: 0.4395
 epoch: 6, train_loss: 1.0884, test_loss: 1.0550, test_f1: 0.4627
 epoch: 7, train_loss: 1.0805, test_loss: 1.0403, test_f1: 0.4723
 epoch: 8, train_loss: 1.0652, test_loss: 1.0337, test_f1: 0.4697
 epoch: 9, train_loss: 1.0486, test_loss: 1.0213, test_f1: 0.4702
 epoch: 10, train_loss: 1.0363, test_loss: 1.0168, test_f1: 0.4695
 epoch: 11, train_loss: 1.0291, test_loss: 1.0081, test_f1: 0.4757
 epoch: 12, train_loss: 1.0225, test_loss: 1.0024, test_f1: 0.4774
 epoch: 13, train_loss: 1.0143, test_loss: 0.9975, test_f1: 0.4750
 epoch: 14, train_loss: 1.0140, test_loss: 0.9921, test_f1: 0.4812
 epoch: 15, train_loss: 1.0019, test_loss: 0.9805, test_f1: 0.4827
 epoch: 16, train_loss: 0.9952, test_loss: 0.9778, test_f1: 0.4881
 epoch: 17, train_loss: 0.9901, test_loss: 0.9737, test_f1: 0.4917
 epoch: 18, train_loss: 0.9807, test_loss: 0.9668, test_f1: 0.4944
 epoch: 19, train_loss: 0.9771, test_loss: 0.9623, test_f1: 0.4898
 epoch: 20, train_loss: 0.9673, test_loss: 0.9579, test_f1: 0.5114
 epoch: 21, train_loss: 0.9668, test_loss: 0.9533, test_f1: 0.5110
 epoch: 22, train_loss: 0.9618, test_loss: 0.9499, test_f1: 0.5084
 epoch: 23, train_loss: 0.9515, test_loss: 0.9488, test_f1: 0.5194
 epoch: 24, train_loss: 0.9459, test_loss: 0.9386, test_f1: 0.5230
 epoch: 25, train_loss: 0.9437, test_loss: 0.9366, test_f1: 0.5235
 epoch: 26, train_loss: 0.9343, test_loss: 0.9333, test_f1: 0.5159
 epoch: 27, train_loss: 0.9321, test_loss: 0.9295, test_f1: 0.5261
 epoch: 28, train_loss: 0.9310, test_loss: 0.9312, test_f1: 0.5312
 epoch: 29, train_loss: 0.9266, test_loss: 0.9300, test_f1: 0.5299
 epoch: 30, train_loss: 0.9245, test_loss: 0.9295, test_f1: 0.5039
 epoch: 31, train_loss: 0.9182, test_loss: 0.9216, test_f1: 0.5223
 epoch: 32, train_loss: 0.9140, test_loss: 0.9245, test_f1: 0.5221
 epoch: 33, train_loss: 0.9060, test_loss: 0.9203, test_f1: 0.5201
 epoch: 34, train_loss: 0.9026, test_loss: 0.9152, test_f1: 0.5243
 epoch: 35, train_loss: 0.9043, test_loss: 0.9135, test_f1: 0.5260
 epoch: 36, train_loss: 0.9008, test_loss: 0.9125, test_f1: 0.5217
 epoch: 37, train_loss: 0.8946, test_loss: 0.9146, test_f1: 0.5287
 epoch: 38, train_loss: 0.8940, test_loss: 0.9079, test_f1: 0.5211
 epoch: 39, train_loss: 0.8944, test_loss: 0.9049, test_f1: 0.5296
 epoch: 40, train_loss: 0.8812, test_loss: 0.9031, test_f1: 0.5276
 epoch: 41, train_loss: 0.8832, test_loss: 0.9101, test_f1: 0.5361
 epoch: 42, train_loss: 0.8803, test_loss: 0.9037, test_f1: 0.5337
 epoch: 43, train_loss: 0.8726, test_loss: 0.9035, test_f1: 0.5334
 epoch: 44, train_loss: 0.8737, test_loss: 0.8993, test_f1: 0.5397
 epoch: 45, train_loss: 0.8632, test_loss: 0.9064, test_f1: 0.5310
 epoch: 46, train_loss: 0.8665, test_loss: 0.8975, test_f1: 0.5474
 epoch: 47, train_loss: 0.8697, test_loss: 0.8980, test_f1: 0.5509
 epoch: 48, train_loss: 0.8544, test_loss: 0.8931, test_f1: 0.5445
 epoch: 49, train_loss: 0.8591, test_loss: 0.8919, test_f1: 0.5502
 epoch: 50, train_loss: 0.8501, test_loss: 0.8957, test_f1: 0.5495
 epoch: 51, train_loss: 0.8552, test_loss: 0.8870, test_f1: 0.5493
 epoch: 52, train_loss: 0.8494, test_loss: 0.8843, test_f1: 0.5581
 epoch: 53, train_loss: 0.8529, test_loss: 0.8872, test_f1: 0.5589
 epoch: 54, train_loss: 0.8437, test_loss: 0.8902, test_f1: 0.5562
 epoch: 55, train_loss: 0.8413, test_loss: 0.8868, test_f1: 0.5516
 epoch: 56, train_loss: 0.8428, test_loss: 0.8844, test_f1: 0.5516
 epoch: 57, train_loss: 0.8389, test_loss: 0.8854, test_f1: 0.5588
 epoch: 58, train_loss: 0.8388, test_loss: 0.8799, test_f1: 0.5588
 epoch: 59, train_loss: 0.8363, test_loss: 0.8820, test_f1: 0.5516
 epoch: 60, train_loss: 0.8414, test_loss: 0.8845, test_f1: 0.5543
 epoch: 61, train_loss: 0.8372, test_loss: 0.8800, test_f1: 0.5610
 epoch: 62, train_loss: 0.8337, test_loss: 0.8771, test_f1: 0.5612
 epoch: 63, train_loss: 0.8412, test_loss: 0.8787, test_f1: 0.5598
 epoch: 64, train_loss: 0.8336, test_loss: 0.8754, test_f1: 0.5579
 epoch: 65, train_loss: 0.8303, test_loss: 0.8744, test_f1: 0.5583
 epoch: 66, train_loss: 0.8314, test_loss: 0.8737, test_f1: 0.5556
 epoch: 67, train_loss: 0.8328, test_loss: 0.8756, test_f1: 0.5550
 epoch: 68, train_loss: 0.8319, test_loss: 0.8782, test_f1: 0.5557
 epoch: 69, train_loss: 0.8258, test_loss: 0.8780, test_f1: 0.5588
 epoch: 70, train_loss: 0.8154, test_loss: 0.8736, test_f1: 0.5613
 epoch: 71, train_loss: 0.8178, test_loss: 0.8759, test_f1: 0.5573
 epoch: 72, train_loss: 0.8242, test_loss: 0.8735, test_f1: 0.5567
 epoch: 73, train_loss: 0.8176, test_loss: 0.8731, test_f1: 0.5570
 epoch: 74, train_loss: 0.8186, test_loss: 0.8786, test_f1: 0.5619
 epoch: 75, train_loss: 0.8187, test_loss: 0.8746, test_f1: 0.5668
 epoch: 76, train_loss: 0.8171, test_loss: 0.8710, test_f1: 0.5592
 epoch: 77, train_loss: 0.8144, test_loss: 0.8706, test_f1: 0.5585
 epoch: 78, train_loss: 0.8090, test_loss: 0.8710, test_f1: 0.5647
 epoch: 79, train_loss: 0.8084, test_loss: 0.8717, test_f1: 0.5628
 epoch: 80, train_loss: 0.8072, test_loss: 0.8698, test_f1: 0.5637
 epoch: 81, train_loss: 0.8069, test_loss: 0.8704, test_f1: 0.5617
 epoch: 82, train_loss: 0.8101, test_loss: 0.8670, test_f1: 0.5627
 epoch: 83, train_loss: 0.8055, test_loss: 0.8655, test_f1: 0.5561
 epoch: 84, train_loss: 0.7998, test_loss: 0.8659, test_f1: 0.5628
 epoch: 85, train_loss: 0.8025, test_loss: 0.8652, test_f1: 0.5580
 epoch: 86, train_loss: 0.8095, test_loss: 0.8673, test_f1: 0.5680
 epoch: 87, train_loss: 0.8021, test_loss: 0.8673, test_f1: 0.5686
 epoch: 88, train_loss: 0.7943, test_loss: 0.8640, test_f1: 0.5605
 epoch: 89, train_loss: 0.7943, test_loss: 0.8641, test_f1: 0.5672
 epoch: 90, train_loss: 0.8014, test_loss: 0.8625, test_f1: 0.5601
 epoch: 91, train_loss: 0.7926, test_loss: 0.8636, test_f1: 0.5656
 epoch: 92, train_loss: 0.8024, test_loss: 0.8626, test_f1: 0.5654
 epoch: 93, train_loss: 0.7936, test_loss: 0.8641, test_f1: 0.5663
 epoch: 94, train_loss: 0.7929, test_loss: 0.8612, test_f1: 0.5705
 epoch: 95, train_loss: 0.7923, test_loss: 0.8644, test_f1: 0.5683
 epoch: 96, train_loss: 0.7933, test_loss: 0.8613, test_f1: 0.5674
 epoch: 97, train_loss: 0.7912, test_loss: 0.8631, test_f1: 0.5673
 epoch: 98, train_loss: 0.7838, test_loss: 0.8633, test_f1: 0.5723
 epoch: 99, train_loss: 0.7793, test_loss: 0.8630, test_f1: 0.5662
##################ITERATION #8 ****************************************
 epoch: 0, train_loss: 1.3149, test_loss: 1.3448, test_f1: 0.2270
 epoch: 1, train_loss: 1.1948, test_loss: 1.3160, test_f1: 0.2270
 epoch: 2, train_loss: 1.1522, test_loss: 1.2433, test_f1: 0.2270
 epoch: 3, train_loss: 1.1208, test_loss: 1.1431, test_f1: 0.3102
 epoch: 4, train_loss: 1.0958, test_loss: 1.0696, test_f1: 0.3820
 epoch: 5, train_loss: 1.0818, test_loss: 1.0409, test_f1: 0.4258
 epoch: 6, train_loss: 1.0611, test_loss: 1.0291, test_f1: 0.4383
 epoch: 7, train_loss: 1.0480, test_loss: 1.0235, test_f1: 0.4496
 epoch: 8, train_loss: 1.0425, test_loss: 1.0168, test_f1: 0.4610
 epoch: 9, train_loss: 1.0374, test_loss: 1.0137, test_f1: 0.4554
 epoch: 10, train_loss: 1.0336, test_loss: 1.0078, test_f1: 0.4645
 epoch: 11, train_loss: 1.0231, test_loss: 1.0044, test_f1: 0.4677
 epoch: 12, train_loss: 1.0110, test_loss: 0.9993, test_f1: 0.4787
 epoch: 13, train_loss: 1.0105, test_loss: 0.9909, test_f1: 0.4976
 epoch: 14, train_loss: 1.0018, test_loss: 0.9859, test_f1: 0.4976
 epoch: 15, train_loss: 0.9977, test_loss: 0.9845, test_f1: 0.4959
 epoch: 16, train_loss: 0.9924, test_loss: 0.9803, test_f1: 0.5123
 epoch: 17, train_loss: 0.9882, test_loss: 0.9723, test_f1: 0.5205
 epoch: 18, train_loss: 0.9846, test_loss: 0.9686, test_f1: 0.5144
 epoch: 19, train_loss: 0.9752, test_loss: 0.9729, test_f1: 0.5175
 epoch: 20, train_loss: 0.9743, test_loss: 0.9622, test_f1: 0.5151
 epoch: 21, train_loss: 0.9757, test_loss: 0.9569, test_f1: 0.5109
 epoch: 22, train_loss: 0.9698, test_loss: 0.9558, test_f1: 0.5135
 epoch: 23, train_loss: 0.9662, test_loss: 0.9529, test_f1: 0.5198
 epoch: 24, train_loss: 0.9604, test_loss: 0.9513, test_f1: 0.5135
 epoch: 25, train_loss: 0.9503, test_loss: 0.9483, test_f1: 0.5143
 epoch: 26, train_loss: 0.9555, test_loss: 0.9514, test_f1: 0.5209
 epoch: 27, train_loss: 0.9426, test_loss: 0.9454, test_f1: 0.5183
 epoch: 28, train_loss: 0.9495, test_loss: 0.9402, test_f1: 0.5246
 epoch: 29, train_loss: 0.9449, test_loss: 0.9404, test_f1: 0.5234
 epoch: 30, train_loss: 0.9441, test_loss: 0.9365, test_f1: 0.5242
 epoch: 31, train_loss: 0.9343, test_loss: 0.9358, test_f1: 0.5415
 epoch: 32, train_loss: 0.9359, test_loss: 0.9372, test_f1: 0.5257
 epoch: 33, train_loss: 0.9316, test_loss: 0.9289, test_f1: 0.5290
 epoch: 34, train_loss: 0.9299, test_loss: 0.9298, test_f1: 0.5276
 epoch: 35, train_loss: 0.9271, test_loss: 0.9278, test_f1: 0.5253
 epoch: 36, train_loss: 0.9240, test_loss: 0.9284, test_f1: 0.5263
 epoch: 37, train_loss: 0.9146, test_loss: 0.9180, test_f1: 0.5288
 epoch: 38, train_loss: 0.9186, test_loss: 0.9170, test_f1: 0.5341
 epoch: 39, train_loss: 0.9165, test_loss: 0.9115, test_f1: 0.5378
 epoch: 40, train_loss: 0.9129, test_loss: 0.9205, test_f1: 0.5354
 epoch: 41, train_loss: 0.9055, test_loss: 0.9085, test_f1: 0.5306
 epoch: 42, train_loss: 0.9020, test_loss: 0.9110, test_f1: 0.5446
 epoch: 43, train_loss: 0.8988, test_loss: 0.9081, test_f1: 0.5453
 epoch: 44, train_loss: 0.9011, test_loss: 0.9070, test_f1: 0.5469
 epoch: 45, train_loss: 0.8953, test_loss: 0.8996, test_f1: 0.5382
 epoch: 46, train_loss: 0.8932, test_loss: 0.9023, test_f1: 0.5417
 epoch: 47, train_loss: 0.8956, test_loss: 0.8950, test_f1: 0.5427
 epoch: 48, train_loss: 0.8846, test_loss: 0.9009, test_f1: 0.5366
 epoch: 49, train_loss: 0.8811, test_loss: 0.8967, test_f1: 0.5367
 epoch: 50, train_loss: 0.8876, test_loss: 0.8974, test_f1: 0.5499
 epoch: 51, train_loss: 0.8723, test_loss: 0.8958, test_f1: 0.5370
 epoch: 52, train_loss: 0.8710, test_loss: 0.8965, test_f1: 0.5536
 epoch: 53, train_loss: 0.8737, test_loss: 0.8915, test_f1: 0.5518
 epoch: 54, train_loss: 0.8748, test_loss: 0.8897, test_f1: 0.5490
 epoch: 55, train_loss: 0.8716, test_loss: 0.8926, test_f1: 0.5393
 epoch: 56, train_loss: 0.8728, test_loss: 0.8899, test_f1: 0.5537
 epoch: 57, train_loss: 0.8738, test_loss: 0.8841, test_f1: 0.5466
 epoch: 58, train_loss: 0.8701, test_loss: 0.8905, test_f1: 0.5490
 epoch: 59, train_loss: 0.8707, test_loss: 0.8940, test_f1: 0.5549
 epoch: 60, train_loss: 0.8730, test_loss: 0.8891, test_f1: 0.5579
 epoch: 61, train_loss: 0.8657, test_loss: 0.8867, test_f1: 0.5516
 epoch: 62, train_loss: 0.8601, test_loss: 0.8843, test_f1: 0.5576
 epoch: 63, train_loss: 0.8635, test_loss: 0.8846, test_f1: 0.5586
 epoch: 64, train_loss: 0.8559, test_loss: 0.8821, test_f1: 0.5560
 epoch: 65, train_loss: 0.8659, test_loss: 0.8825, test_f1: 0.5633
 epoch: 66, train_loss: 0.8637, test_loss: 0.8863, test_f1: 0.5668
 epoch: 67, train_loss: 0.8604, test_loss: 0.8793, test_f1: 0.5602
 epoch: 68, train_loss: 0.8571, test_loss: 0.8812, test_f1: 0.5574
 epoch: 69, train_loss: 0.8552, test_loss: 0.8761, test_f1: 0.5647
 epoch: 70, train_loss: 0.8589, test_loss: 0.8772, test_f1: 0.5724
 epoch: 71, train_loss: 0.8576, test_loss: 0.8747, test_f1: 0.5671
 epoch: 72, train_loss: 0.8504, test_loss: 0.8768, test_f1: 0.5664
 epoch: 73, train_loss: 0.8470, test_loss: 0.8697, test_f1: 0.5713
 epoch: 74, train_loss: 0.8524, test_loss: 0.8756, test_f1: 0.5720
 epoch: 75, train_loss: 0.8528, test_loss: 0.8753, test_f1: 0.5565
 epoch: 76, train_loss: 0.8480, test_loss: 0.8714, test_f1: 0.5673
 epoch: 77, train_loss: 0.8455, test_loss: 0.8706, test_f1: 0.5657
 epoch: 78, train_loss: 0.8468, test_loss: 0.8727, test_f1: 0.5691
 epoch: 79, train_loss: 0.8460, test_loss: 0.8706, test_f1: 0.5714
 epoch: 80, train_loss: 0.8406, test_loss: 0.8700, test_f1: 0.5720
 epoch: 81, train_loss: 0.8402, test_loss: 0.8694, test_f1: 0.5678
 epoch: 82, train_loss: 0.8424, test_loss: 0.8680, test_f1: 0.5693
 epoch: 83, train_loss: 0.8379, test_loss: 0.8729, test_f1: 0.5739
 epoch: 84, train_loss: 0.8347, test_loss: 0.8698, test_f1: 0.5722
 epoch: 85, train_loss: 0.8351, test_loss: 0.8738, test_f1: 0.5695
 epoch: 86, train_loss: 0.8374, test_loss: 0.8686, test_f1: 0.5679
 epoch: 87, train_loss: 0.8293, test_loss: 0.8721, test_f1: 0.5694
 epoch: 88, train_loss: 0.8336, test_loss: 0.8719, test_f1: 0.5719
 epoch: 89, train_loss: 0.8286, test_loss: 0.8736, test_f1: 0.5632
 epoch: 90, train_loss: 0.8332, test_loss: 0.8681, test_f1: 0.5693
 epoch: 91, train_loss: 0.8338, test_loss: 0.8710, test_f1: 0.5732
 epoch: 92, train_loss: 0.8370, test_loss: 0.8738, test_f1: 0.5669
 epoch: 93, train_loss: 0.8347, test_loss: 0.8687, test_f1: 0.5700
 epoch: 94, train_loss: 0.8334, test_loss: 0.8709, test_f1: 0.5767
 epoch: 95, train_loss: 0.8274, test_loss: 0.8624, test_f1: 0.5773
 epoch: 96, train_loss: 0.8234, test_loss: 0.8701, test_f1: 0.5728
 epoch: 97, train_loss: 0.8217, test_loss: 0.8659, test_f1: 0.5731
 epoch: 98, train_loss: 0.8240, test_loss: 0.8648, test_f1: 0.5684
 epoch: 99, train_loss: 0.8226, test_loss: 0.8622, test_f1: 0.5759
##################ITERATION #9 ****************************************
 epoch: 0, train_loss: 1.3330, test_loss: 1.3181, test_f1: 0.2270
 epoch: 1, train_loss: 1.2239, test_loss: 1.2844, test_f1: 0.2270
 epoch: 2, train_loss: 1.1844, test_loss: 1.2402, test_f1: 0.2273
 epoch: 3, train_loss: 1.1489, test_loss: 1.1715, test_f1: 0.2812
 epoch: 4, train_loss: 1.1230, test_loss: 1.0978, test_f1: 0.3857
 epoch: 5, train_loss: 1.1063, test_loss: 1.0570, test_f1: 0.4352
 epoch: 6, train_loss: 1.0829, test_loss: 1.0352, test_f1: 0.4364
 epoch: 7, train_loss: 1.0742, test_loss: 1.0205, test_f1: 0.4291
 epoch: 8, train_loss: 1.0596, test_loss: 1.0097, test_f1: 0.4358
 epoch: 9, train_loss: 1.0555, test_loss: 1.0016, test_f1: 0.4440
 epoch: 10, train_loss: 1.0450, test_loss: 0.9942, test_f1: 0.4532
 epoch: 11, train_loss: 1.0329, test_loss: 0.9862, test_f1: 0.4586
 epoch: 12, train_loss: 1.0270, test_loss: 0.9811, test_f1: 0.4605
 epoch: 13, train_loss: 1.0181, test_loss: 0.9763, test_f1: 0.4646
 epoch: 14, train_loss: 1.0133, test_loss: 0.9731, test_f1: 0.4611
 epoch: 15, train_loss: 0.9971, test_loss: 0.9656, test_f1: 0.4789
 epoch: 16, train_loss: 1.0015, test_loss: 0.9608, test_f1: 0.4787
 epoch: 17, train_loss: 0.9929, test_loss: 0.9587, test_f1: 0.4778
 epoch: 18, train_loss: 0.9846, test_loss: 0.9536, test_f1: 0.4798
 epoch: 19, train_loss: 0.9793, test_loss: 0.9496, test_f1: 0.4823
 epoch: 20, train_loss: 0.9752, test_loss: 0.9483, test_f1: 0.4816
 epoch: 21, train_loss: 0.9671, test_loss: 0.9434, test_f1: 0.4779
 epoch: 22, train_loss: 0.9643, test_loss: 0.9411, test_f1: 0.4814
 epoch: 23, train_loss: 0.9669, test_loss: 0.9368, test_f1: 0.4816
 epoch: 24, train_loss: 0.9605, test_loss: 0.9328, test_f1: 0.4894
 epoch: 25, train_loss: 0.9530, test_loss: 0.9336, test_f1: 0.4974
 epoch: 26, train_loss: 0.9493, test_loss: 0.9279, test_f1: 0.4992
 epoch: 27, train_loss: 0.9497, test_loss: 0.9262, test_f1: 0.5091
 epoch: 28, train_loss: 0.9441, test_loss: 0.9240, test_f1: 0.4977
 epoch: 29, train_loss: 0.9427, test_loss: 0.9215, test_f1: 0.5042
 epoch: 30, train_loss: 0.9362, test_loss: 0.9171, test_f1: 0.5124
 epoch: 31, train_loss: 0.9343, test_loss: 0.9166, test_f1: 0.5164
 epoch: 32, train_loss: 0.9380, test_loss: 0.9146, test_f1: 0.5139
 epoch: 33, train_loss: 0.9274, test_loss: 0.9127, test_f1: 0.5159
 epoch: 34, train_loss: 0.9212, test_loss: 0.9078, test_f1: 0.5176
 epoch: 35, train_loss: 0.9285, test_loss: 0.9042, test_f1: 0.5184
 epoch: 36, train_loss: 0.9223, test_loss: 0.9057, test_f1: 0.5255
 epoch: 37, train_loss: 0.9199, test_loss: 0.9007, test_f1: 0.5244
 epoch: 38, train_loss: 0.9140, test_loss: 0.9036, test_f1: 0.5253
 epoch: 39, train_loss: 0.9069, test_loss: 0.9013, test_f1: 0.5324
 epoch: 40, train_loss: 0.9093, test_loss: 0.8996, test_f1: 0.5331
 epoch: 41, train_loss: 0.9068, test_loss: 0.8949, test_f1: 0.5322
 epoch: 42, train_loss: 0.9080, test_loss: 0.8916, test_f1: 0.5313
 epoch: 43, train_loss: 0.8961, test_loss: 0.8918, test_f1: 0.5361
 epoch: 44, train_loss: 0.8985, test_loss: 0.8894, test_f1: 0.5467
 epoch: 45, train_loss: 0.8938, test_loss: 0.8879, test_f1: 0.5395
 epoch: 46, train_loss: 0.8879, test_loss: 0.8860, test_f1: 0.5374
 epoch: 47, train_loss: 0.8879, test_loss: 0.8855, test_f1: 0.5375
 epoch: 48, train_loss: 0.8915, test_loss: 0.8850, test_f1: 0.5357
 epoch: 49, train_loss: 0.8801, test_loss: 0.8825, test_f1: 0.5436
 epoch: 50, train_loss: 0.8807, test_loss: 0.8779, test_f1: 0.5450
 epoch: 51, train_loss: 0.8719, test_loss: 0.8764, test_f1: 0.5417
 epoch: 52, train_loss: 0.8769, test_loss: 0.8775, test_f1: 0.5442
 epoch: 53, train_loss: 0.8749, test_loss: 0.8771, test_f1: 0.5450
 epoch: 54, train_loss: 0.8669, test_loss: 0.8742, test_f1: 0.5453
 epoch: 55, train_loss: 0.8712, test_loss: 0.8744, test_f1: 0.5508
 epoch: 56, train_loss: 0.8695, test_loss: 0.8739, test_f1: 0.5489
 epoch: 57, train_loss: 0.8755, test_loss: 0.8726, test_f1: 0.5477
 epoch: 58, train_loss: 0.8671, test_loss: 0.8738, test_f1: 0.5484
 epoch: 59, train_loss: 0.8681, test_loss: 0.8713, test_f1: 0.5497
 epoch: 60, train_loss: 0.8657, test_loss: 0.8691, test_f1: 0.5509
 epoch: 61, train_loss: 0.8621, test_loss: 0.8690, test_f1: 0.5509
 epoch: 62, train_loss: 0.8550, test_loss: 0.8696, test_f1: 0.5521
 epoch: 63, train_loss: 0.8548, test_loss: 0.8686, test_f1: 0.5533
 epoch: 64, train_loss: 0.8674, test_loss: 0.8693, test_f1: 0.5568
 epoch: 65, train_loss: 0.8516, test_loss: 0.8676, test_f1: 0.5543
 epoch: 66, train_loss: 0.8574, test_loss: 0.8664, test_f1: 0.5522
 epoch: 67, train_loss: 0.8546, test_loss: 0.8635, test_f1: 0.5584
 epoch: 68, train_loss: 0.8618, test_loss: 0.8655, test_f1: 0.5627
 epoch: 69, train_loss: 0.8557, test_loss: 0.8618, test_f1: 0.5533
 epoch: 70, train_loss: 0.8511, test_loss: 0.8652, test_f1: 0.5638
 epoch: 71, train_loss: 0.8544, test_loss: 0.8662, test_f1: 0.5637
 epoch: 72, train_loss: 0.8474, test_loss: 0.8635, test_f1: 0.5635
 epoch: 73, train_loss: 0.8429, test_loss: 0.8624, test_f1: 0.5627
 epoch: 74, train_loss: 0.8448, test_loss: 0.8616, test_f1: 0.5612
 epoch: 75, train_loss: 0.8570, test_loss: 0.8580, test_f1: 0.5674
 epoch: 76, train_loss: 0.8489, test_loss: 0.8595, test_f1: 0.5614
 epoch: 77, train_loss: 0.8450, test_loss: 0.8602, test_f1: 0.5648
 epoch: 78, train_loss: 0.8437, test_loss: 0.8606, test_f1: 0.5642
 epoch: 79, train_loss: 0.8416, test_loss: 0.8607, test_f1: 0.5645
 epoch: 80, train_loss: 0.8441, test_loss: 0.8604, test_f1: 0.5699
 epoch: 81, train_loss: 0.8424, test_loss: 0.8596, test_f1: 0.5676
 epoch: 82, train_loss: 0.8375, test_loss: 0.8614, test_f1: 0.5654
 epoch: 83, train_loss: 0.8323, test_loss: 0.8600, test_f1: 0.5692
 epoch: 84, train_loss: 0.8371, test_loss: 0.8614, test_f1: 0.5661
 epoch: 85, train_loss: 0.8362, test_loss: 0.8594, test_f1: 0.5637
 epoch: 86, train_loss: 0.8354, test_loss: 0.8591, test_f1: 0.5674
 epoch: 87, train_loss: 0.8275, test_loss: 0.8589, test_f1: 0.5689
 epoch: 88, train_loss: 0.8331, test_loss: 0.8577, test_f1: 0.5662
 epoch: 89, train_loss: 0.8312, test_loss: 0.8528, test_f1: 0.5694
 epoch: 90, train_loss: 0.8297, test_loss: 0.8542, test_f1: 0.5656
 epoch: 91, train_loss: 0.8317, test_loss: 0.8569, test_f1: 0.5713
 epoch: 92, train_loss: 0.8313, test_loss: 0.8548, test_f1: 0.5674
 epoch: 93, train_loss: 0.8268, test_loss: 0.8545, test_f1: 0.5661
 epoch: 94, train_loss: 0.8217, test_loss: 0.8536, test_f1: 0.5665
 epoch: 95, train_loss: 0.8220, test_loss: 0.8548, test_f1: 0.5666
 epoch: 96, train_loss: 0.8256, test_loss: 0.8527, test_f1: 0.5697
 epoch: 97, train_loss: 0.8303, test_loss: 0.8538, test_f1: 0.5680
 epoch: 98, train_loss: 0.8222, test_loss: 0.8588, test_f1: 0.5661
 epoch: 99, train_loss: 0.8200, test_loss: 0.8554, test_f1: 0.5742

Training completed in 407.11 seconds
Best F1: 0.5773 at epoch 95
Mean F1 across iterations: 0.5574  0.0130
========================FINAL RESULTS================================
FEGIN weighted F1: 0.5773  0.0130
python main.py --data ltspice_examples --representation component_pin_net --model FEGIN --layers 2 --hiddens 64 --batch_size 256 --lr 0.0001 --emb_size 250 --epochs 100 --save_appendix component_pin_net_L2_H64_BS256_LR0.0001_E250 --no_val
-----



STDERR:
  File "main.py", line 370, in <module>
    main()
  File "main.py", line 254, in main
    dataset = dataset_class(
  File "/home/philip/projects/ltspice_examples_code_repo/Circuit-Completion-Using-GNNs/component_classification_with_link_prediction_head/evaluation/FEGIN/kernel/circuit_datasets.py", line 15, in __init__
    self.data, self.slices = torch.load(self.processed_paths[0])
  File "/home/philip/.local/lib/python3.8/site-packages/torch/serialization.py", line 1040, in load
    warnings.warn(
  File "/usr/lib/python3.8/warnings.py", line 109, in _showwarnmsg
    sw(msg.message, msg.category, msg.filename, msg.lineno,
  File "main.py", line 47, in warn_with_traceback
    traceback.print_stack(file=log)
/home/philip/projects/ltspice_examples_code_repo/Circuit-Completion-Using-GNNs/component_classification_with_link_prediction_head/evaluation/FEGIN/kernel/circuit_datasets.py:15: FutureWarning: You are using `torch.load` with `weights_only=False` (the current default value), which uses the default pickle module implicitly. It is possible to construct malicious pickle data which will execute arbitrary code during unpickling (See https://github.com/pytorch/pytorch/blob/main/SECURITY.md#untrusted-models for more details). In a future release, the default value for `weights_only` will be flipped to `True`. This limits the functions that could be executed during unpickling. Arbitrary objects will no longer be allowed to be loaded via this mode unless they are explicitly allowlisted by the user via `torch.serialization.add_safe_globals`. We recommend you start setting `weights_only=True` for any use case where you don't have full control of the loaded file. Please open an issue on GitHub for any issues related to this experimental feature.
  self.data, self.slices = torch.load(self.processed_paths[0])
