STDOUT:
Results will be saved in /home/philip/projects/ltspice_examples_code_repo/Circuit-Completion-Using-GNNs/component_classification_with_link_prediction_head/evaluation/FEGIN/results/model_FEGIN_dataset_ltspice_examples
Command line input: python main.py --data ltspice_examples --representation component_net --model FEGIN --layers 6 --hiddens 64 --batch_size 64 --lr 0.0001 --emb_size 512 --epochs 100 --save_appendix component_net_L6_H64_BS64_LR0.0001_E512 --no_val
 is saved.
-----
ltspice_examples - FEGIN
Using 6 layers, 64 hidden units, h = 2
Loading component_net representation dataset
ENTERED
Training FEGIN on component_net representation
Train: 3558, Test: 846
##################ITERATION #0 ****************************************
 epoch: 0, train_loss: 1.3850, test_loss: 1.3687, test_f1: 0.1197
 epoch: 1, train_loss: 1.3423, test_loss: 1.3146, test_f1: 0.2603
 epoch: 2, train_loss: 1.3075, test_loss: 1.2774, test_f1: 0.2800
 epoch: 3, train_loss: 1.2732, test_loss: 1.2436, test_f1: 0.2523
 epoch: 4, train_loss: 1.2460, test_loss: 1.2184, test_f1: 0.2498
 epoch: 5, train_loss: 1.2250, test_loss: 1.2002, test_f1: 0.2743
 epoch: 6, train_loss: 1.2033, test_loss: 1.1746, test_f1: 0.2995
 epoch: 7, train_loss: 1.1891, test_loss: 1.1502, test_f1: 0.3413
 epoch: 8, train_loss: 1.1697, test_loss: 1.1349, test_f1: 0.3936
 epoch: 9, train_loss: 1.1480, test_loss: 1.1151, test_f1: 0.4340
 epoch: 10, train_loss: 1.1279, test_loss: 1.0917, test_f1: 0.4852
 epoch: 11, train_loss: 1.1039, test_loss: 1.0654, test_f1: 0.4992
 epoch: 12, train_loss: 1.0889, test_loss: 1.0439, test_f1: 0.4909
 epoch: 13, train_loss: 1.0664, test_loss: 1.0195, test_f1: 0.4963
 epoch: 14, train_loss: 1.0439, test_loss: 1.0075, test_f1: 0.4936
 epoch: 15, train_loss: 1.0190, test_loss: 0.9920, test_f1: 0.5158
 epoch: 16, train_loss: 1.0028, test_loss: 0.9800, test_f1: 0.4981
 epoch: 17, train_loss: 0.9818, test_loss: 0.9622, test_f1: 0.5077
 epoch: 18, train_loss: 0.9703, test_loss: 0.9409, test_f1: 0.5111
 epoch: 19, train_loss: 0.9559, test_loss: 0.9447, test_f1: 0.4946
 epoch: 20, train_loss: 0.9437, test_loss: 0.9425, test_f1: 0.4980
 epoch: 21, train_loss: 0.9279, test_loss: 0.9347, test_f1: 0.5198
 epoch: 22, train_loss: 0.9186, test_loss: 0.9345, test_f1: 0.5100
 epoch: 23, train_loss: 0.9170, test_loss: 0.9292, test_f1: 0.5392
 epoch: 24, train_loss: 0.9018, test_loss: 0.9365, test_f1: 0.5359
 epoch: 25, train_loss: 0.8919, test_loss: 0.9289, test_f1: 0.5093
 epoch: 26, train_loss: 0.8944, test_loss: 0.9243, test_f1: 0.5420
 epoch: 27, train_loss: 0.8826, test_loss: 0.9265, test_f1: 0.5344
 epoch: 28, train_loss: 0.8727, test_loss: 0.9464, test_f1: 0.5305
 epoch: 29, train_loss: 0.8723, test_loss: 0.9409, test_f1: 0.5283
 epoch: 30, train_loss: 0.8682, test_loss: 0.9423, test_f1: 0.5238
 epoch: 31, train_loss: 0.8600, test_loss: 0.9155, test_f1: 0.5413
 epoch: 32, train_loss: 0.8549, test_loss: 0.9229, test_f1: 0.5365
 epoch: 33, train_loss: 0.8538, test_loss: 0.9202, test_f1: 0.5465
 epoch: 34, train_loss: 0.8293, test_loss: 0.9405, test_f1: 0.5404
 epoch: 35, train_loss: 0.8411, test_loss: 0.9255, test_f1: 0.5481
 epoch: 36, train_loss: 0.8369, test_loss: 0.9356, test_f1: 0.5588
 epoch: 37, train_loss: 0.8354, test_loss: 0.9206, test_f1: 0.5468
 epoch: 38, train_loss: 0.8253, test_loss: 0.9280, test_f1: 0.5641
 epoch: 39, train_loss: 0.8226, test_loss: 0.9271, test_f1: 0.5696
 epoch: 40, train_loss: 0.8311, test_loss: 0.9199, test_f1: 0.5708
 epoch: 41, train_loss: 0.8223, test_loss: 0.9373, test_f1: 0.5721
 epoch: 42, train_loss: 0.8263, test_loss: 0.9387, test_f1: 0.5583
 epoch: 43, train_loss: 0.8090, test_loss: 0.9529, test_f1: 0.5343
 epoch: 44, train_loss: 0.8007, test_loss: 0.9700, test_f1: 0.5238
 epoch: 45, train_loss: 0.8079, test_loss: 0.9380, test_f1: 0.5529
 epoch: 46, train_loss: 0.8023, test_loss: 0.9241, test_f1: 0.5693
 epoch: 47, train_loss: 0.8056, test_loss: 0.9259, test_f1: 0.5774
 epoch: 48, train_loss: 0.7985, test_loss: 0.9667, test_f1: 0.5436
 epoch: 49, train_loss: 0.7982, test_loss: 0.9629, test_f1: 0.5276
 epoch: 50, train_loss: 0.8007, test_loss: 0.9627, test_f1: 0.5646
 epoch: 51, train_loss: 0.7942, test_loss: 0.9550, test_f1: 0.5479
 epoch: 52, train_loss: 0.7779, test_loss: 0.9427, test_f1: 0.5574
 epoch: 53, train_loss: 0.7793, test_loss: 0.9426, test_f1: 0.5718
 epoch: 54, train_loss: 0.7613, test_loss: 0.9541, test_f1: 0.5738
 epoch: 55, train_loss: 0.7779, test_loss: 0.9466, test_f1: 0.5562
 epoch: 56, train_loss: 0.7714, test_loss: 0.9468, test_f1: 0.5677
 epoch: 57, train_loss: 0.7668, test_loss: 0.9491, test_f1: 0.5731
 epoch: 58, train_loss: 0.7763, test_loss: 0.9533, test_f1: 0.5708
 epoch: 59, train_loss: 0.7695, test_loss: 0.9493, test_f1: 0.5772
 epoch: 60, train_loss: 0.7666, test_loss: 0.9733, test_f1: 0.5501
 epoch: 61, train_loss: 0.7624, test_loss: 0.9630, test_f1: 0.5870
 epoch: 62, train_loss: 0.7652, test_loss: 0.9535, test_f1: 0.5855
 epoch: 63, train_loss: 0.7705, test_loss: 0.9597, test_f1: 0.5623
 epoch: 64, train_loss: 0.7514, test_loss: 0.9608, test_f1: 0.5719
 epoch: 65, train_loss: 0.7648, test_loss: 0.9677, test_f1: 0.5755
 epoch: 66, train_loss: 0.7697, test_loss: 0.9615, test_f1: 0.5674
 epoch: 67, train_loss: 0.7542, test_loss: 0.9726, test_f1: 0.5626
 epoch: 68, train_loss: 0.7573, test_loss: 0.9776, test_f1: 0.5771
 epoch: 69, train_loss: 0.7517, test_loss: 0.9812, test_f1: 0.5718
 epoch: 70, train_loss: 0.7476, test_loss: 0.9618, test_f1: 0.5715
 epoch: 71, train_loss: 0.7412, test_loss: 0.9623, test_f1: 0.5673
 epoch: 72, train_loss: 0.7561, test_loss: 0.9641, test_f1: 0.5778
 epoch: 73, train_loss: 0.7577, test_loss: 0.9568, test_f1: 0.5849
 epoch: 74, train_loss: 0.7466, test_loss: 0.9639, test_f1: 0.5888
 epoch: 75, train_loss: 0.7486, test_loss: 0.9632, test_f1: 0.5886
 epoch: 76, train_loss: 0.7452, test_loss: 0.9834, test_f1: 0.5852
 epoch: 77, train_loss: 0.7467, test_loss: 0.9705, test_f1: 0.5975
 epoch: 78, train_loss: 0.7411, test_loss: 0.9460, test_f1: 0.5675
 epoch: 79, train_loss: 0.7395, test_loss: 0.9717, test_f1: 0.5712
 epoch: 80, train_loss: 0.7461, test_loss: 0.9789, test_f1: 0.5809
 epoch: 81, train_loss: 0.7370, test_loss: 0.9560, test_f1: 0.5742
 epoch: 82, train_loss: 0.7500, test_loss: 0.9724, test_f1: 0.5754
 epoch: 83, train_loss: 0.7375, test_loss: 0.9814, test_f1: 0.5784
 epoch: 84, train_loss: 0.7315, test_loss: 0.9628, test_f1: 0.5673
 epoch: 85, train_loss: 0.7274, test_loss: 0.9595, test_f1: 0.5736
 epoch: 86, train_loss: 0.7425, test_loss: 0.9799, test_f1: 0.5804
 epoch: 87, train_loss: 0.7217, test_loss: 0.9862, test_f1: 0.5846
 epoch: 88, train_loss: 0.7233, test_loss: 0.9671, test_f1: 0.5873
 epoch: 89, train_loss: 0.7317, test_loss: 0.9833, test_f1: 0.5842
 epoch: 90, train_loss: 0.7444, test_loss: 0.9709, test_f1: 0.5889
 epoch: 91, train_loss: 0.7270, test_loss: 1.0030, test_f1: 0.5728
 epoch: 92, train_loss: 0.7235, test_loss: 0.9642, test_f1: 0.5932
 epoch: 93, train_loss: 0.7346, test_loss: 0.9628, test_f1: 0.5997
 epoch: 94, train_loss: 0.7354, test_loss: 0.9739, test_f1: 0.5841
 epoch: 95, train_loss: 0.7311, test_loss: 0.9721, test_f1: 0.6033
 epoch: 96, train_loss: 0.7323, test_loss: 0.9947, test_f1: 0.5899
 epoch: 97, train_loss: 0.7178, test_loss: 0.9896, test_f1: 0.5929
 epoch: 98, train_loss: 0.7214, test_loss: 0.9546, test_f1: 0.5897
 epoch: 99, train_loss: 0.7181, test_loss: 0.9592, test_f1: 0.5906
##################ITERATION #1 ****************************************
 epoch: 0, train_loss: 1.3099, test_loss: 1.2961, test_f1: 0.2270
 epoch: 1, train_loss: 1.2442, test_loss: 1.2102, test_f1: 0.3821
 epoch: 2, train_loss: 1.2089, test_loss: 1.1641, test_f1: 0.3984
 epoch: 3, train_loss: 1.1729, test_loss: 1.1178, test_f1: 0.4324
 epoch: 4, train_loss: 1.1326, test_loss: 1.0785, test_f1: 0.4456
 epoch: 5, train_loss: 1.0952, test_loss: 1.0451, test_f1: 0.4539
 epoch: 6, train_loss: 1.0694, test_loss: 1.0177, test_f1: 0.4538
 epoch: 7, train_loss: 1.0451, test_loss: 0.9959, test_f1: 0.4763
 epoch: 8, train_loss: 1.0258, test_loss: 0.9818, test_f1: 0.4831
 epoch: 9, train_loss: 1.0078, test_loss: 0.9758, test_f1: 0.4847
 epoch: 10, train_loss: 0.9870, test_loss: 0.9560, test_f1: 0.4903
 epoch: 11, train_loss: 0.9749, test_loss: 0.9540, test_f1: 0.5018
 epoch: 12, train_loss: 0.9587, test_loss: 0.9359, test_f1: 0.5052
 epoch: 13, train_loss: 0.9493, test_loss: 0.9378, test_f1: 0.4979
 epoch: 14, train_loss: 0.9407, test_loss: 0.9161, test_f1: 0.5186
 epoch: 15, train_loss: 0.9287, test_loss: 0.9395, test_f1: 0.5265
 epoch: 16, train_loss: 0.9298, test_loss: 0.9220, test_f1: 0.5278
 epoch: 17, train_loss: 0.9228, test_loss: 0.9169, test_f1: 0.5286
 epoch: 18, train_loss: 0.9071, test_loss: 0.9216, test_f1: 0.5330
 epoch: 19, train_loss: 0.9055, test_loss: 0.9263, test_f1: 0.5431
 epoch: 20, train_loss: 0.9040, test_loss: 0.9237, test_f1: 0.5515
 epoch: 21, train_loss: 0.8815, test_loss: 0.9209, test_f1: 0.5346
 epoch: 22, train_loss: 0.8821, test_loss: 0.9165, test_f1: 0.5411
 epoch: 23, train_loss: 0.8659, test_loss: 0.9209, test_f1: 0.5471
 epoch: 24, train_loss: 0.8688, test_loss: 0.9104, test_f1: 0.5399
 epoch: 25, train_loss: 0.8663, test_loss: 0.9370, test_f1: 0.5495
 epoch: 26, train_loss: 0.8669, test_loss: 0.9006, test_f1: 0.5521
 epoch: 27, train_loss: 0.8534, test_loss: 0.9271, test_f1: 0.5487
 epoch: 28, train_loss: 0.8523, test_loss: 0.9072, test_f1: 0.5625
 epoch: 29, train_loss: 0.8439, test_loss: 0.9250, test_f1: 0.5487
 epoch: 30, train_loss: 0.8358, test_loss: 0.9230, test_f1: 0.5557
 epoch: 31, train_loss: 0.8300, test_loss: 0.9283, test_f1: 0.5553
 epoch: 32, train_loss: 0.8323, test_loss: 0.9146, test_f1: 0.5525
 epoch: 33, train_loss: 0.8310, test_loss: 0.9102, test_f1: 0.5775
 epoch: 34, train_loss: 0.8323, test_loss: 0.9234, test_f1: 0.5566
 epoch: 35, train_loss: 0.8149, test_loss: 0.9031, test_f1: 0.5688
 epoch: 36, train_loss: 0.8093, test_loss: 0.9372, test_f1: 0.5621
 epoch: 37, train_loss: 0.8021, test_loss: 0.9304, test_f1: 0.5486
 epoch: 38, train_loss: 0.7972, test_loss: 0.9217, test_f1: 0.5553
 epoch: 39, train_loss: 0.8082, test_loss: 0.9345, test_f1: 0.5581
 epoch: 40, train_loss: 0.8017, test_loss: 0.9062, test_f1: 0.5619
 epoch: 41, train_loss: 0.8017, test_loss: 0.9292, test_f1: 0.5723
 epoch: 42, train_loss: 0.7936, test_loss: 0.9215, test_f1: 0.5652
 epoch: 43, train_loss: 0.7814, test_loss: 0.9210, test_f1: 0.5585
 epoch: 44, train_loss: 0.7838, test_loss: 0.9252, test_f1: 0.5655
 epoch: 45, train_loss: 0.7786, test_loss: 0.9322, test_f1: 0.5664
 epoch: 46, train_loss: 0.7891, test_loss: 0.9416, test_f1: 0.5689
 epoch: 47, train_loss: 0.7888, test_loss: 0.9251, test_f1: 0.5844
 epoch: 48, train_loss: 0.7758, test_loss: 0.9456, test_f1: 0.5783
 epoch: 49, train_loss: 0.7646, test_loss: 0.9380, test_f1: 0.5834
 epoch: 50, train_loss: 0.7659, test_loss: 0.9257, test_f1: 0.5918
 epoch: 51, train_loss: 0.7601, test_loss: 0.9371, test_f1: 0.5822
 epoch: 52, train_loss: 0.7544, test_loss: 0.9294, test_f1: 0.5869
 epoch: 53, train_loss: 0.7602, test_loss: 0.9329, test_f1: 0.5847
 epoch: 54, train_loss: 0.7425, test_loss: 0.9316, test_f1: 0.5943
 epoch: 55, train_loss: 0.7484, test_loss: 0.9369, test_f1: 0.5963
 epoch: 56, train_loss: 0.7416, test_loss: 0.9311, test_f1: 0.5913
 epoch: 57, train_loss: 0.7408, test_loss: 0.9248, test_f1: 0.5898
 epoch: 58, train_loss: 0.7483, test_loss: 0.9312, test_f1: 0.6019
 epoch: 59, train_loss: 0.7508, test_loss: 0.9324, test_f1: 0.5812
 epoch: 60, train_loss: 0.7417, test_loss: 0.9269, test_f1: 0.6009
 epoch: 61, train_loss: 0.7498, test_loss: 0.9390, test_f1: 0.5978
 epoch: 62, train_loss: 0.7450, test_loss: 0.9305, test_f1: 0.5890
 epoch: 63, train_loss: 0.7416, test_loss: 0.9479, test_f1: 0.6023
 epoch: 64, train_loss: 0.7309, test_loss: 0.9434, test_f1: 0.5889
 epoch: 65, train_loss: 0.7306, test_loss: 0.9351, test_f1: 0.5950
 epoch: 66, train_loss: 0.7297, test_loss: 0.9264, test_f1: 0.6041
 epoch: 67, train_loss: 0.7312, test_loss: 0.9377, test_f1: 0.6051
 epoch: 68, train_loss: 0.7407, test_loss: 0.9269, test_f1: 0.6093
 epoch: 69, train_loss: 0.7330, test_loss: 0.9365, test_f1: 0.6070
 epoch: 70, train_loss: 0.7322, test_loss: 0.9231, test_f1: 0.6058
 epoch: 71, train_loss: 0.7276, test_loss: 0.9289, test_f1: 0.6126
 epoch: 72, train_loss: 0.7261, test_loss: 0.9427, test_f1: 0.6038
 epoch: 73, train_loss: 0.7175, test_loss: 0.9445, test_f1: 0.5996
 epoch: 74, train_loss: 0.7215, test_loss: 0.9306, test_f1: 0.6038
 epoch: 75, train_loss: 0.7281, test_loss: 0.9169, test_f1: 0.6123
 epoch: 76, train_loss: 0.7237, test_loss: 0.9326, test_f1: 0.6023
 epoch: 77, train_loss: 0.7148, test_loss: 0.9414, test_f1: 0.6067
 epoch: 78, train_loss: 0.7121, test_loss: 0.9325, test_f1: 0.6221
 epoch: 79, train_loss: 0.7082, test_loss: 0.9430, test_f1: 0.6137
 epoch: 80, train_loss: 0.7215, test_loss: 0.9417, test_f1: 0.6101
 epoch: 81, train_loss: 0.7188, test_loss: 0.9434, test_f1: 0.6138
 epoch: 82, train_loss: 0.7114, test_loss: 0.9576, test_f1: 0.6134
 epoch: 83, train_loss: 0.7014, test_loss: 0.9424, test_f1: 0.6123
 epoch: 84, train_loss: 0.7027, test_loss: 0.9406, test_f1: 0.6076
 epoch: 85, train_loss: 0.6929, test_loss: 0.9358, test_f1: 0.6156
 epoch: 86, train_loss: 0.7065, test_loss: 0.9415, test_f1: 0.6118
 epoch: 87, train_loss: 0.7129, test_loss: 0.9513, test_f1: 0.5953
 epoch: 88, train_loss: 0.7029, test_loss: 0.9405, test_f1: 0.6126
 epoch: 89, train_loss: 0.6972, test_loss: 0.9375, test_f1: 0.6119
 epoch: 90, train_loss: 0.7122, test_loss: 0.9376, test_f1: 0.6266
 epoch: 91, train_loss: 0.6888, test_loss: 0.9453, test_f1: 0.6148
 epoch: 92, train_loss: 0.7008, test_loss: 0.9404, test_f1: 0.6173
 epoch: 93, train_loss: 0.6928, test_loss: 0.9682, test_f1: 0.6052
 epoch: 94, train_loss: 0.6979, test_loss: 0.9410, test_f1: 0.6269
 epoch: 95, train_loss: 0.6976, test_loss: 0.9551, test_f1: 0.6068
 epoch: 96, train_loss: 0.6870, test_loss: 0.9519, test_f1: 0.6083
 epoch: 97, train_loss: 0.6961, test_loss: 0.9305, test_f1: 0.6172
 epoch: 98, train_loss: 0.6918, test_loss: 0.9488, test_f1: 0.6249
 epoch: 99, train_loss: 0.6910, test_loss: 0.9437, test_f1: 0.6091
##################ITERATION #2 ****************************************
 epoch: 0, train_loss: 1.2691, test_loss: 1.2396, test_f1: 0.2570
 epoch: 1, train_loss: 1.1832, test_loss: 1.1235, test_f1: 0.4042
 epoch: 2, train_loss: 1.1436, test_loss: 1.0803, test_f1: 0.4321
 epoch: 3, train_loss: 1.1107, test_loss: 1.0458, test_f1: 0.4510
 epoch: 4, train_loss: 1.0793, test_loss: 1.0123, test_f1: 0.4476
 epoch: 5, train_loss: 1.0601, test_loss: 0.9875, test_f1: 0.4884
 epoch: 6, train_loss: 1.0350, test_loss: 0.9752, test_f1: 0.4890
 epoch: 7, train_loss: 1.0189, test_loss: 0.9590, test_f1: 0.5062
 epoch: 8, train_loss: 1.0039, test_loss: 0.9563, test_f1: 0.4946
 epoch: 9, train_loss: 0.9803, test_loss: 0.9410, test_f1: 0.5064
 epoch: 10, train_loss: 0.9823, test_loss: 0.9472, test_f1: 0.5076
 epoch: 11, train_loss: 0.9652, test_loss: 0.9203, test_f1: 0.5046
 epoch: 12, train_loss: 0.9562, test_loss: 0.9326, test_f1: 0.5082
 epoch: 13, train_loss: 0.9543, test_loss: 0.9258, test_f1: 0.5216
 epoch: 14, train_loss: 0.9445, test_loss: 0.9136, test_f1: 0.5172
 epoch: 15, train_loss: 0.9279, test_loss: 0.9122, test_f1: 0.5079
 epoch: 16, train_loss: 0.9247, test_loss: 0.9046, test_f1: 0.5042
 epoch: 17, train_loss: 0.9226, test_loss: 0.9081, test_f1: 0.5076
 epoch: 18, train_loss: 0.9115, test_loss: 0.8893, test_f1: 0.5316
 epoch: 19, train_loss: 0.9057, test_loss: 0.8939, test_f1: 0.5170
 epoch: 20, train_loss: 0.9023, test_loss: 0.9095, test_f1: 0.5213
 epoch: 21, train_loss: 0.8880, test_loss: 0.8909, test_f1: 0.5438
 epoch: 22, train_loss: 0.8863, test_loss: 0.9136, test_f1: 0.5221
 epoch: 23, train_loss: 0.8831, test_loss: 0.8903, test_f1: 0.5474
 epoch: 24, train_loss: 0.8819, test_loss: 0.9013, test_f1: 0.5349
 epoch: 25, train_loss: 0.8790, test_loss: 0.9089, test_f1: 0.5344
 epoch: 26, train_loss: 0.8763, test_loss: 0.8955, test_f1: 0.5388
 epoch: 27, train_loss: 0.8619, test_loss: 0.9044, test_f1: 0.5604
 epoch: 28, train_loss: 0.8513, test_loss: 0.8808, test_f1: 0.5587
 epoch: 29, train_loss: 0.8599, test_loss: 0.9063, test_f1: 0.5560
 epoch: 30, train_loss: 0.8420, test_loss: 0.8803, test_f1: 0.5585
 epoch: 31, train_loss: 0.8624, test_loss: 0.9018, test_f1: 0.5410
 epoch: 32, train_loss: 0.8390, test_loss: 0.9085, test_f1: 0.5632
 epoch: 33, train_loss: 0.8457, test_loss: 0.9110, test_f1: 0.5578
 epoch: 34, train_loss: 0.8395, test_loss: 0.9303, test_f1: 0.5656
 epoch: 35, train_loss: 0.8408, test_loss: 0.9059, test_f1: 0.5667
 epoch: 36, train_loss: 0.8288, test_loss: 0.8943, test_f1: 0.5581
 epoch: 37, train_loss: 0.8234, test_loss: 0.8944, test_f1: 0.5545
 epoch: 38, train_loss: 0.8250, test_loss: 0.9227, test_f1: 0.5427
 epoch: 39, train_loss: 0.8223, test_loss: 0.9190, test_f1: 0.5540
 epoch: 40, train_loss: 0.8086, test_loss: 0.9073, test_f1: 0.5750
 epoch: 41, train_loss: 0.8158, test_loss: 0.8987, test_f1: 0.5568
 epoch: 42, train_loss: 0.8059, test_loss: 0.8979, test_f1: 0.5834
 epoch: 43, train_loss: 0.7973, test_loss: 0.9183, test_f1: 0.5632
 epoch: 44, train_loss: 0.7997, test_loss: 0.9223, test_f1: 0.5559
 epoch: 45, train_loss: 0.8003, test_loss: 0.9299, test_f1: 0.5647
 epoch: 46, train_loss: 0.8067, test_loss: 0.9153, test_f1: 0.5906
 epoch: 47, train_loss: 0.8020, test_loss: 0.8936, test_f1: 0.5812
 epoch: 48, train_loss: 0.7821, test_loss: 0.9132, test_f1: 0.5816
 epoch: 49, train_loss: 0.7826, test_loss: 0.9011, test_f1: 0.5789
 epoch: 50, train_loss: 0.7760, test_loss: 0.9140, test_f1: 0.5865
 epoch: 51, train_loss: 0.7806, test_loss: 0.9003, test_f1: 0.5759
 epoch: 52, train_loss: 0.7729, test_loss: 0.9011, test_f1: 0.5948
 epoch: 53, train_loss: 0.7738, test_loss: 0.8947, test_f1: 0.5943
 epoch: 54, train_loss: 0.7598, test_loss: 0.9006, test_f1: 0.5927
 epoch: 55, train_loss: 0.7663, test_loss: 0.9056, test_f1: 0.5984
 epoch: 56, train_loss: 0.7770, test_loss: 0.9249, test_f1: 0.5850
 epoch: 57, train_loss: 0.7601, test_loss: 0.9261, test_f1: 0.5824
 epoch: 58, train_loss: 0.7643, test_loss: 0.9151, test_f1: 0.6084
 epoch: 59, train_loss: 0.7484, test_loss: 0.9250, test_f1: 0.5869
 epoch: 60, train_loss: 0.7592, test_loss: 0.8954, test_f1: 0.5999
 epoch: 61, train_loss: 0.7654, test_loss: 0.8960, test_f1: 0.6154
 epoch: 62, train_loss: 0.7623, test_loss: 0.9104, test_f1: 0.6030
 epoch: 63, train_loss: 0.7587, test_loss: 0.9049, test_f1: 0.6033
 epoch: 64, train_loss: 0.7522, test_loss: 0.9114, test_f1: 0.5989
 epoch: 65, train_loss: 0.7489, test_loss: 0.9219, test_f1: 0.5880
 epoch: 66, train_loss: 0.7501, test_loss: 0.8988, test_f1: 0.6060
 epoch: 67, train_loss: 0.7542, test_loss: 0.9126, test_f1: 0.6038
 epoch: 68, train_loss: 0.7382, test_loss: 0.8978, test_f1: 0.6162
 epoch: 69, train_loss: 0.7429, test_loss: 0.9107, test_f1: 0.5975
 epoch: 70, train_loss: 0.7441, test_loss: 0.9376, test_f1: 0.5940
 epoch: 71, train_loss: 0.7263, test_loss: 0.9251, test_f1: 0.5978
 epoch: 72, train_loss: 0.7435, test_loss: 0.9194, test_f1: 0.6129
 epoch: 73, train_loss: 0.7406, test_loss: 0.9299, test_f1: 0.5877
 epoch: 74, train_loss: 0.7488, test_loss: 0.8976, test_f1: 0.6100
 epoch: 75, train_loss: 0.7387, test_loss: 0.9103, test_f1: 0.6008
 epoch: 76, train_loss: 0.7402, test_loss: 0.9122, test_f1: 0.6040
 epoch: 77, train_loss: 0.7237, test_loss: 0.9015, test_f1: 0.5959
 epoch: 78, train_loss: 0.7260, test_loss: 0.9050, test_f1: 0.6030
 epoch: 79, train_loss: 0.7386, test_loss: 0.9112, test_f1: 0.6109
 epoch: 80, train_loss: 0.7223, test_loss: 0.9165, test_f1: 0.6048
 epoch: 81, train_loss: 0.7404, test_loss: 0.9308, test_f1: 0.6014
 epoch: 82, train_loss: 0.7270, test_loss: 0.9269, test_f1: 0.6151
 epoch: 83, train_loss: 0.7305, test_loss: 0.9035, test_f1: 0.6128
 epoch: 84, train_loss: 0.7368, test_loss: 0.9131, test_f1: 0.6017
 epoch: 85, train_loss: 0.7211, test_loss: 0.9092, test_f1: 0.6222
 epoch: 86, train_loss: 0.7225, test_loss: 0.9047, test_f1: 0.6243
 epoch: 87, train_loss: 0.7239, test_loss: 0.9164, test_f1: 0.6207
 epoch: 88, train_loss: 0.7203, test_loss: 0.9094, test_f1: 0.6210
 epoch: 89, train_loss: 0.7237, test_loss: 0.9055, test_f1: 0.6218
 epoch: 90, train_loss: 0.7214, test_loss: 0.9035, test_f1: 0.6157
 epoch: 91, train_loss: 0.7218, test_loss: 0.9393, test_f1: 0.6150
 epoch: 92, train_loss: 0.7083, test_loss: 0.9179, test_f1: 0.6156
 epoch: 93, train_loss: 0.7183, test_loss: 0.9314, test_f1: 0.5933
 epoch: 94, train_loss: 0.7073, test_loss: 0.9132, test_f1: 0.6197
 epoch: 95, train_loss: 0.7110, test_loss: 0.9209, test_f1: 0.6016
 epoch: 96, train_loss: 0.7120, test_loss: 0.9281, test_f1: 0.6101
 epoch: 97, train_loss: 0.7102, test_loss: 0.9156, test_f1: 0.6146
 epoch: 98, train_loss: 0.6982, test_loss: 0.9288, test_f1: 0.6091
 epoch: 99, train_loss: 0.7222, test_loss: 0.9376, test_f1: 0.6122
##################ITERATION #3 ****************************************
 epoch: 0, train_loss: 1.2652, test_loss: 1.2306, test_f1: 0.3626
 epoch: 1, train_loss: 1.1797, test_loss: 1.1295, test_f1: 0.4431
 epoch: 2, train_loss: 1.1474, test_loss: 1.0838, test_f1: 0.4613
 epoch: 3, train_loss: 1.1154, test_loss: 1.0603, test_f1: 0.4618
 epoch: 4, train_loss: 1.0939, test_loss: 1.0249, test_f1: 0.4525
 epoch: 5, train_loss: 1.0702, test_loss: 1.0080, test_f1: 0.4685
 epoch: 6, train_loss: 1.0441, test_loss: 0.9860, test_f1: 0.4873
 epoch: 7, train_loss: 1.0385, test_loss: 0.9761, test_f1: 0.4686
 epoch: 8, train_loss: 1.0097, test_loss: 0.9608, test_f1: 0.5103
 epoch: 9, train_loss: 1.0062, test_loss: 0.9513, test_f1: 0.5219
 epoch: 10, train_loss: 0.9864, test_loss: 0.9420, test_f1: 0.5390
 epoch: 11, train_loss: 0.9673, test_loss: 0.9239, test_f1: 0.5278
 epoch: 12, train_loss: 0.9609, test_loss: 0.9441, test_f1: 0.5248
 epoch: 13, train_loss: 0.9452, test_loss: 0.9485, test_f1: 0.5218
 epoch: 14, train_loss: 0.9384, test_loss: 0.9182, test_f1: 0.5313
 epoch: 15, train_loss: 0.9337, test_loss: 0.9288, test_f1: 0.5176
 epoch: 16, train_loss: 0.9279, test_loss: 0.9391, test_f1: 0.5471
 epoch: 17, train_loss: 0.9210, test_loss: 0.9185, test_f1: 0.5442
 epoch: 18, train_loss: 0.9121, test_loss: 0.9304, test_f1: 0.5397
 epoch: 19, train_loss: 0.9052, test_loss: 0.9149, test_f1: 0.5549
 epoch: 20, train_loss: 0.8918, test_loss: 0.9196, test_f1: 0.5463
 epoch: 21, train_loss: 0.8949, test_loss: 0.9456, test_f1: 0.5309
 epoch: 22, train_loss: 0.8845, test_loss: 0.9350, test_f1: 0.5409
 epoch: 23, train_loss: 0.8853, test_loss: 0.9395, test_f1: 0.5397
 epoch: 24, train_loss: 0.8749, test_loss: 0.9290, test_f1: 0.5497
 epoch: 25, train_loss: 0.8765, test_loss: 0.9473, test_f1: 0.5559
 epoch: 26, train_loss: 0.8618, test_loss: 0.9343, test_f1: 0.5334
 epoch: 27, train_loss: 0.8640, test_loss: 0.9555, test_f1: 0.5600
 epoch: 28, train_loss: 0.8538, test_loss: 0.9474, test_f1: 0.5529
 epoch: 29, train_loss: 0.8564, test_loss: 0.9253, test_f1: 0.5505
 epoch: 30, train_loss: 0.8476, test_loss: 0.9345, test_f1: 0.5607
 epoch: 31, train_loss: 0.8352, test_loss: 0.9226, test_f1: 0.5554
 epoch: 32, train_loss: 0.8428, test_loss: 0.9527, test_f1: 0.5557
 epoch: 33, train_loss: 0.8316, test_loss: 0.9405, test_f1: 0.5664
 epoch: 34, train_loss: 0.8310, test_loss: 0.9550, test_f1: 0.5650
 epoch: 35, train_loss: 0.8189, test_loss: 0.9437, test_f1: 0.5642
 epoch: 36, train_loss: 0.8202, test_loss: 0.9212, test_f1: 0.5812
 epoch: 37, train_loss: 0.8234, test_loss: 0.9661, test_f1: 0.5590
 epoch: 38, train_loss: 0.8138, test_loss: 0.9552, test_f1: 0.5670
 epoch: 39, train_loss: 0.8158, test_loss: 0.9387, test_f1: 0.5730
 epoch: 40, train_loss: 0.8076, test_loss: 0.9671, test_f1: 0.5655
 epoch: 41, train_loss: 0.8105, test_loss: 0.9667, test_f1: 0.5768
 epoch: 42, train_loss: 0.7966, test_loss: 0.9592, test_f1: 0.5774
 epoch: 43, train_loss: 0.8041, test_loss: 0.9819, test_f1: 0.5745
 epoch: 44, train_loss: 0.8002, test_loss: 0.9696, test_f1: 0.5725
 epoch: 45, train_loss: 0.8015, test_loss: 0.9640, test_f1: 0.5770
 epoch: 46, train_loss: 0.7839, test_loss: 0.9828, test_f1: 0.5831
 epoch: 47, train_loss: 0.7966, test_loss: 0.9910, test_f1: 0.5750
 epoch: 48, train_loss: 0.7924, test_loss: 0.9674, test_f1: 0.5931
 epoch: 49, train_loss: 0.7883, test_loss: 0.9942, test_f1: 0.5845
 epoch: 50, train_loss: 0.7740, test_loss: 0.9815, test_f1: 0.5897
 epoch: 51, train_loss: 0.7665, test_loss: 0.9815, test_f1: 0.5843
 epoch: 52, train_loss: 0.7691, test_loss: 0.9851, test_f1: 0.5808
 epoch: 53, train_loss: 0.7594, test_loss: 0.9841, test_f1: 0.5964
 epoch: 54, train_loss: 0.7626, test_loss: 0.9910, test_f1: 0.5858
 epoch: 55, train_loss: 0.7580, test_loss: 0.9866, test_f1: 0.5822
 epoch: 56, train_loss: 0.7586, test_loss: 0.9905, test_f1: 0.5965
 epoch: 57, train_loss: 0.7661, test_loss: 0.9877, test_f1: 0.5693
 epoch: 58, train_loss: 0.7545, test_loss: 0.9958, test_f1: 0.5993
 epoch: 59, train_loss: 0.7483, test_loss: 0.9994, test_f1: 0.5833
 epoch: 60, train_loss: 0.7656, test_loss: 0.9915, test_f1: 0.5876
 epoch: 61, train_loss: 0.7551, test_loss: 1.0006, test_f1: 0.5813
 epoch: 62, train_loss: 0.7484, test_loss: 0.9992, test_f1: 0.5736
 epoch: 63, train_loss: 0.7525, test_loss: 1.0043, test_f1: 0.5874
 epoch: 64, train_loss: 0.7373, test_loss: 1.0054, test_f1: 0.5770
 epoch: 65, train_loss: 0.7420, test_loss: 0.9975, test_f1: 0.5824
 epoch: 66, train_loss: 0.7384, test_loss: 1.0048, test_f1: 0.5769
 epoch: 67, train_loss: 0.7462, test_loss: 1.0021, test_f1: 0.5737
 epoch: 68, train_loss: 0.7511, test_loss: 0.9975, test_f1: 0.5820
 epoch: 69, train_loss: 0.7366, test_loss: 1.0122, test_f1: 0.5880
 epoch: 70, train_loss: 0.7327, test_loss: 0.9990, test_f1: 0.5879
 epoch: 71, train_loss: 0.7348, test_loss: 1.0037, test_f1: 0.5870
 epoch: 72, train_loss: 0.7240, test_loss: 0.9939, test_f1: 0.5762
 epoch: 73, train_loss: 0.7377, test_loss: 1.0058, test_f1: 0.5796
 epoch: 74, train_loss: 0.7332, test_loss: 1.0098, test_f1: 0.5947
 epoch: 75, train_loss: 0.7273, test_loss: 1.0106, test_f1: 0.5818
 epoch: 76, train_loss: 0.7333, test_loss: 1.0205, test_f1: 0.5821
 epoch: 77, train_loss: 0.7299, test_loss: 1.0124, test_f1: 0.5848
 epoch: 78, train_loss: 0.7229, test_loss: 1.0193, test_f1: 0.5884
 epoch: 79, train_loss: 0.7165, test_loss: 1.0112, test_f1: 0.5915
 epoch: 80, train_loss: 0.7219, test_loss: 1.0200, test_f1: 0.5845
 epoch: 81, train_loss: 0.7195, test_loss: 1.0060, test_f1: 0.6008
 epoch: 82, train_loss: 0.7240, test_loss: 1.0112, test_f1: 0.5913
 epoch: 83, train_loss: 0.7200, test_loss: 1.0111, test_f1: 0.5913
 epoch: 84, train_loss: 0.7154, test_loss: 1.0192, test_f1: 0.5941
 epoch: 85, train_loss: 0.7084, test_loss: 1.0350, test_f1: 0.5796
 epoch: 86, train_loss: 0.7113, test_loss: 1.0176, test_f1: 0.5921
 epoch: 87, train_loss: 0.7174, test_loss: 1.0104, test_f1: 0.5793
 epoch: 88, train_loss: 0.7139, test_loss: 1.0319, test_f1: 0.5939
 epoch: 89, train_loss: 0.7061, test_loss: 1.0271, test_f1: 0.5964
 epoch: 90, train_loss: 0.7098, test_loss: 1.0264, test_f1: 0.5964
 epoch: 91, train_loss: 0.7089, test_loss: 1.0366, test_f1: 0.5889
 epoch: 92, train_loss: 0.6913, test_loss: 1.0466, test_f1: 0.5828
 epoch: 93, train_loss: 0.7086, test_loss: 1.0178, test_f1: 0.5782
 epoch: 94, train_loss: 0.6969, test_loss: 0.9897, test_f1: 0.5999
 epoch: 95, train_loss: 0.7020, test_loss: 1.0103, test_f1: 0.5956
 epoch: 96, train_loss: 0.7021, test_loss: 1.0206, test_f1: 0.5873
 epoch: 97, train_loss: 0.7090, test_loss: 1.0083, test_f1: 0.5818
 epoch: 98, train_loss: 0.6979, test_loss: 1.0189, test_f1: 0.5711
 epoch: 99, train_loss: 0.7075, test_loss: 1.0284, test_f1: 0.5849
##################ITERATION #4 ****************************************
 epoch: 0, train_loss: 1.2585, test_loss: 1.2852, test_f1: 0.2861
 epoch: 1, train_loss: 1.1715, test_loss: 1.1089, test_f1: 0.4219
 epoch: 2, train_loss: 1.1398, test_loss: 1.0750, test_f1: 0.4427
 epoch: 3, train_loss: 1.1164, test_loss: 1.0494, test_f1: 0.4474
 epoch: 4, train_loss: 1.0911, test_loss: 1.0400, test_f1: 0.4520
 epoch: 5, train_loss: 1.0703, test_loss: 0.9994, test_f1: 0.4850
 epoch: 6, train_loss: 1.0531, test_loss: 0.9779, test_f1: 0.4955
 epoch: 7, train_loss: 1.0356, test_loss: 0.9719, test_f1: 0.5038
 epoch: 8, train_loss: 1.0197, test_loss: 0.9671, test_f1: 0.4933
 epoch: 9, train_loss: 0.9994, test_loss: 0.9635, test_f1: 0.5012
 epoch: 10, train_loss: 0.9901, test_loss: 0.9594, test_f1: 0.5043
 epoch: 11, train_loss: 0.9806, test_loss: 0.9433, test_f1: 0.5107
 epoch: 12, train_loss: 0.9653, test_loss: 0.9352, test_f1: 0.5303
 epoch: 13, train_loss: 0.9524, test_loss: 0.9501, test_f1: 0.5190
 epoch: 14, train_loss: 0.9550, test_loss: 0.9462, test_f1: 0.5192
 epoch: 15, train_loss: 0.9496, test_loss: 0.9349, test_f1: 0.5350
 epoch: 16, train_loss: 0.9481, test_loss: 0.9410, test_f1: 0.5268
 epoch: 17, train_loss: 0.9265, test_loss: 0.9505, test_f1: 0.5262
 epoch: 18, train_loss: 0.9275, test_loss: 0.9387, test_f1: 0.5296
 epoch: 19, train_loss: 0.9187, test_loss: 0.9569, test_f1: 0.5429
 epoch: 20, train_loss: 0.9163, test_loss: 0.9387, test_f1: 0.5364
 epoch: 21, train_loss: 0.9127, test_loss: 0.9574, test_f1: 0.5052
 epoch: 22, train_loss: 0.9009, test_loss: 0.9476, test_f1: 0.5415
 epoch: 23, train_loss: 0.8992, test_loss: 0.9503, test_f1: 0.5226
 epoch: 24, train_loss: 0.9006, test_loss: 0.9436, test_f1: 0.5186
 epoch: 25, train_loss: 0.8853, test_loss: 0.9425, test_f1: 0.5157
 epoch: 26, train_loss: 0.8875, test_loss: 0.9393, test_f1: 0.5468
 epoch: 27, train_loss: 0.8850, test_loss: 0.9547, test_f1: 0.5450
 epoch: 28, train_loss: 0.8705, test_loss: 0.9526, test_f1: 0.5440
 epoch: 29, train_loss: 0.8663, test_loss: 0.9306, test_f1: 0.5521
 epoch: 30, train_loss: 0.8669, test_loss: 0.9574, test_f1: 0.5305
 epoch: 31, train_loss: 0.8689, test_loss: 0.9574, test_f1: 0.5271
 epoch: 32, train_loss: 0.8583, test_loss: 0.9484, test_f1: 0.5292
 epoch: 33, train_loss: 0.8566, test_loss: 0.9602, test_f1: 0.5516
 epoch: 34, train_loss: 0.8477, test_loss: 0.9705, test_f1: 0.5283
 epoch: 35, train_loss: 0.8442, test_loss: 0.9418, test_f1: 0.5613
 epoch: 36, train_loss: 0.8358, test_loss: 0.9651, test_f1: 0.5569
 epoch: 37, train_loss: 0.8304, test_loss: 0.9720, test_f1: 0.5258
 epoch: 38, train_loss: 0.8311, test_loss: 0.9801, test_f1: 0.5538
 epoch: 39, train_loss: 0.8257, test_loss: 0.9968, test_f1: 0.5399
 epoch: 40, train_loss: 0.8184, test_loss: 0.9902, test_f1: 0.5370
 epoch: 41, train_loss: 0.8200, test_loss: 0.9679, test_f1: 0.5750
 epoch: 42, train_loss: 0.8191, test_loss: 0.9712, test_f1: 0.5552
 epoch: 43, train_loss: 0.8130, test_loss: 0.9482, test_f1: 0.5441
 epoch: 44, train_loss: 0.8124, test_loss: 0.9829, test_f1: 0.5630
 epoch: 45, train_loss: 0.8037, test_loss: 0.9738, test_f1: 0.5576
 epoch: 46, train_loss: 0.7978, test_loss: 0.9505, test_f1: 0.5757
 epoch: 47, train_loss: 0.8016, test_loss: 0.9813, test_f1: 0.5864
 epoch: 48, train_loss: 0.7934, test_loss: 0.9769, test_f1: 0.5873
 epoch: 49, train_loss: 0.7900, test_loss: 0.9889, test_f1: 0.5746
 epoch: 50, train_loss: 0.7919, test_loss: 0.9750, test_f1: 0.5537
 epoch: 51, train_loss: 0.7843, test_loss: 0.9810, test_f1: 0.5773
 epoch: 52, train_loss: 0.7792, test_loss: 0.9833, test_f1: 0.5883
 epoch: 53, train_loss: 0.7745, test_loss: 0.9594, test_f1: 0.5596
 epoch: 54, train_loss: 0.7732, test_loss: 0.9666, test_f1: 0.6068
 epoch: 55, train_loss: 0.7756, test_loss: 0.9670, test_f1: 0.5799
 epoch: 56, train_loss: 0.7639, test_loss: 0.9560, test_f1: 0.5797
 epoch: 57, train_loss: 0.7662, test_loss: 0.9714, test_f1: 0.5784
 epoch: 58, train_loss: 0.7707, test_loss: 0.9632, test_f1: 0.5985
 epoch: 59, train_loss: 0.7600, test_loss: 0.9664, test_f1: 0.6002
 epoch: 60, train_loss: 0.7684, test_loss: 0.9778, test_f1: 0.5690
 epoch: 61, train_loss: 0.7620, test_loss: 0.9886, test_f1: 0.5710
 epoch: 62, train_loss: 0.7556, test_loss: 0.9636, test_f1: 0.5659
 epoch: 63, train_loss: 0.7573, test_loss: 0.9844, test_f1: 0.5671
 epoch: 64, train_loss: 0.7512, test_loss: 0.9836, test_f1: 0.5713
 epoch: 65, train_loss: 0.7484, test_loss: 0.9840, test_f1: 0.5750
 epoch: 66, train_loss: 0.7396, test_loss: 0.9822, test_f1: 0.5788
 epoch: 67, train_loss: 0.7473, test_loss: 0.9790, test_f1: 0.5669
 epoch: 68, train_loss: 0.7517, test_loss: 0.9774, test_f1: 0.5839
 epoch: 69, train_loss: 0.7465, test_loss: 1.0040, test_f1: 0.5720
 epoch: 70, train_loss: 0.7419, test_loss: 0.9987, test_f1: 0.5768
 epoch: 71, train_loss: 0.7438, test_loss: 1.0010, test_f1: 0.5673
 epoch: 72, train_loss: 0.7391, test_loss: 0.9829, test_f1: 0.5681
 epoch: 73, train_loss: 0.7470, test_loss: 1.0126, test_f1: 0.5571
 epoch: 74, train_loss: 0.7320, test_loss: 1.0147, test_f1: 0.5657
 epoch: 75, train_loss: 0.7399, test_loss: 1.0198, test_f1: 0.5626
 epoch: 76, train_loss: 0.7327, test_loss: 0.9932, test_f1: 0.5908
 epoch: 77, train_loss: 0.7436, test_loss: 0.9912, test_f1: 0.5620
 epoch: 78, train_loss: 0.7367, test_loss: 0.9960, test_f1: 0.5747
 epoch: 79, train_loss: 0.7382, test_loss: 1.0018, test_f1: 0.5716
 epoch: 80, train_loss: 0.7404, test_loss: 1.0000, test_f1: 0.5874
 epoch: 81, train_loss: 0.7339, test_loss: 0.9977, test_f1: 0.5646
 epoch: 82, train_loss: 0.7301, test_loss: 1.0161, test_f1: 0.5863
 epoch: 83, train_loss: 0.7269, test_loss: 1.0176, test_f1: 0.5658
 epoch: 84, train_loss: 0.7212, test_loss: 1.0115, test_f1: 0.5710
 epoch: 85, train_loss: 0.7323, test_loss: 1.0051, test_f1: 0.5783
 epoch: 86, train_loss: 0.7171, test_loss: 1.0110, test_f1: 0.5951
 epoch: 87, train_loss: 0.7252, test_loss: 1.0125, test_f1: 0.5856
 epoch: 88, train_loss: 0.7016, test_loss: 1.0214, test_f1: 0.5816
 epoch: 89, train_loss: 0.7129, test_loss: 1.0073, test_f1: 0.5800
 epoch: 90, train_loss: 0.7203, test_loss: 1.0193, test_f1: 0.5760
 epoch: 91, train_loss: 0.7086, test_loss: 1.0042, test_f1: 0.5923
 epoch: 92, train_loss: 0.7131, test_loss: 1.0143, test_f1: 0.5816
 epoch: 93, train_loss: 0.7142, test_loss: 1.0321, test_f1: 0.5899
 epoch: 94, train_loss: 0.7211, test_loss: 0.9993, test_f1: 0.5865
 epoch: 95, train_loss: 0.7273, test_loss: 1.0197, test_f1: 0.5878
 epoch: 96, train_loss: 0.7080, test_loss: 1.0154, test_f1: 0.5876
 epoch: 97, train_loss: 0.6997, test_loss: 1.0034, test_f1: 0.5845
 epoch: 98, train_loss: 0.7090, test_loss: 1.0223, test_f1: 0.5901
 epoch: 99, train_loss: 0.7093, test_loss: 1.0354, test_f1: 0.5872
##################ITERATION #5 ****************************************
 epoch: 0, train_loss: 1.2513, test_loss: 1.2093, test_f1: 0.3945
 epoch: 1, train_loss: 1.1518, test_loss: 1.0857, test_f1: 0.4419
 epoch: 2, train_loss: 1.1177, test_loss: 1.0309, test_f1: 0.5000
 epoch: 3, train_loss: 1.0933, test_loss: 1.0094, test_f1: 0.4784
 epoch: 4, train_loss: 1.0579, test_loss: 0.9955, test_f1: 0.4878
 epoch: 5, train_loss: 1.0430, test_loss: 0.9742, test_f1: 0.5138
 epoch: 6, train_loss: 1.0178, test_loss: 0.9609, test_f1: 0.4922
 epoch: 7, train_loss: 1.0180, test_loss: 0.9509, test_f1: 0.5077
 epoch: 8, train_loss: 0.9988, test_loss: 0.9466, test_f1: 0.5301
 epoch: 9, train_loss: 0.9896, test_loss: 0.9333, test_f1: 0.5253
 epoch: 10, train_loss: 0.9792, test_loss: 0.9357, test_f1: 0.5280
 epoch: 11, train_loss: 0.9775, test_loss: 0.9229, test_f1: 0.5205
 epoch: 12, train_loss: 0.9512, test_loss: 0.9271, test_f1: 0.5353
 epoch: 13, train_loss: 0.9470, test_loss: 0.9336, test_f1: 0.5337
 epoch: 14, train_loss: 0.9319, test_loss: 0.9357, test_f1: 0.5350
 epoch: 15, train_loss: 0.9318, test_loss: 0.9168, test_f1: 0.5430
 epoch: 16, train_loss: 0.9225, test_loss: 0.9153, test_f1: 0.5287
 epoch: 17, train_loss: 0.9201, test_loss: 0.9195, test_f1: 0.5393
 epoch: 18, train_loss: 0.9060, test_loss: 0.9206, test_f1: 0.5391
 epoch: 19, train_loss: 0.9066, test_loss: 0.9285, test_f1: 0.5377
 epoch: 20, train_loss: 0.8949, test_loss: 0.9273, test_f1: 0.5469
 epoch: 21, train_loss: 0.8957, test_loss: 0.9327, test_f1: 0.5429
 epoch: 22, train_loss: 0.8898, test_loss: 0.9371, test_f1: 0.5316
 epoch: 23, train_loss: 0.8951, test_loss: 0.9228, test_f1: 0.5456
 epoch: 24, train_loss: 0.8854, test_loss: 0.9301, test_f1: 0.5400
 epoch: 25, train_loss: 0.8816, test_loss: 0.9310, test_f1: 0.5507
 epoch: 26, train_loss: 0.8792, test_loss: 0.9354, test_f1: 0.5556
 epoch: 27, train_loss: 0.8752, test_loss: 0.9488, test_f1: 0.5382
 epoch: 28, train_loss: 0.8627, test_loss: 0.9352, test_f1: 0.5619
 epoch: 29, train_loss: 0.8531, test_loss: 0.9282, test_f1: 0.5514
 epoch: 30, train_loss: 0.8569, test_loss: 0.9347, test_f1: 0.5511
 epoch: 31, train_loss: 0.8517, test_loss: 0.9365, test_f1: 0.5646
 epoch: 32, train_loss: 0.8478, test_loss: 0.9352, test_f1: 0.5705
 epoch: 33, train_loss: 0.8403, test_loss: 0.9301, test_f1: 0.5749
 epoch: 34, train_loss: 0.8412, test_loss: 0.9347, test_f1: 0.5639
 epoch: 35, train_loss: 0.8329, test_loss: 0.9291, test_f1: 0.5656
 epoch: 36, train_loss: 0.8381, test_loss: 0.9327, test_f1: 0.5694
 epoch: 37, train_loss: 0.8299, test_loss: 0.9227, test_f1: 0.5714
 epoch: 38, train_loss: 0.8202, test_loss: 0.9169, test_f1: 0.5848
 epoch: 39, train_loss: 0.8211, test_loss: 0.9308, test_f1: 0.5870
 epoch: 40, train_loss: 0.8179, test_loss: 0.9485, test_f1: 0.5760
 epoch: 41, train_loss: 0.8138, test_loss: 0.9242, test_f1: 0.5746
 epoch: 42, train_loss: 0.8045, test_loss: 0.9484, test_f1: 0.5647
 epoch: 43, train_loss: 0.7959, test_loss: 0.9234, test_f1: 0.5839
 epoch: 44, train_loss: 0.7981, test_loss: 0.9142, test_f1: 0.5757
 epoch: 45, train_loss: 0.7980, test_loss: 0.9264, test_f1: 0.5727
 epoch: 46, train_loss: 0.7951, test_loss: 0.9473, test_f1: 0.5658
 epoch: 47, train_loss: 0.7920, test_loss: 0.9390, test_f1: 0.5642
 epoch: 48, train_loss: 0.7885, test_loss: 0.9467, test_f1: 0.5869
 epoch: 49, train_loss: 0.7943, test_loss: 0.9442, test_f1: 0.5749
 epoch: 50, train_loss: 0.7802, test_loss: 0.9468, test_f1: 0.5810
 epoch: 51, train_loss: 0.7791, test_loss: 0.9409, test_f1: 0.5796
 epoch: 52, train_loss: 0.7700, test_loss: 0.9206, test_f1: 0.5810
 epoch: 53, train_loss: 0.7684, test_loss: 0.9306, test_f1: 0.5773
 epoch: 54, train_loss: 0.7628, test_loss: 0.9400, test_f1: 0.5862
 epoch: 55, train_loss: 0.7552, test_loss: 0.9354, test_f1: 0.5813
 epoch: 56, train_loss: 0.7513, test_loss: 0.9468, test_f1: 0.5841
 epoch: 57, train_loss: 0.7735, test_loss: 0.9417, test_f1: 0.5714
 epoch: 58, train_loss: 0.7575, test_loss: 0.9244, test_f1: 0.5777
 epoch: 59, train_loss: 0.7561, test_loss: 0.9290, test_f1: 0.5784
 epoch: 60, train_loss: 0.7450, test_loss: 0.9352, test_f1: 0.5726
 epoch: 61, train_loss: 0.7425, test_loss: 0.9409, test_f1: 0.5749
 epoch: 62, train_loss: 0.7452, test_loss: 0.9304, test_f1: 0.5817
 epoch: 63, train_loss: 0.7582, test_loss: 0.9419, test_f1: 0.5857
 epoch: 64, train_loss: 0.7429, test_loss: 0.9501, test_f1: 0.5992
 epoch: 65, train_loss: 0.7430, test_loss: 0.9164, test_f1: 0.6020
 epoch: 66, train_loss: 0.7411, test_loss: 0.9467, test_f1: 0.5782
 epoch: 67, train_loss: 0.7461, test_loss: 0.9195, test_f1: 0.5883
 epoch: 68, train_loss: 0.7398, test_loss: 0.9258, test_f1: 0.5822
 epoch: 69, train_loss: 0.7396, test_loss: 0.9306, test_f1: 0.5867
 epoch: 70, train_loss: 0.7299, test_loss: 0.9473, test_f1: 0.5792
 epoch: 71, train_loss: 0.7202, test_loss: 0.9557, test_f1: 0.5749
 epoch: 72, train_loss: 0.7285, test_loss: 0.9415, test_f1: 0.5793
 epoch: 73, train_loss: 0.7283, test_loss: 0.9296, test_f1: 0.5837
 epoch: 74, train_loss: 0.7317, test_loss: 0.9497, test_f1: 0.5829
 epoch: 75, train_loss: 0.7179, test_loss: 0.9344, test_f1: 0.6005
 epoch: 76, train_loss: 0.7267, test_loss: 0.9404, test_f1: 0.5861
 epoch: 77, train_loss: 0.7293, test_loss: 0.9456, test_f1: 0.5831
 epoch: 78, train_loss: 0.7249, test_loss: 0.9499, test_f1: 0.5936
 epoch: 79, train_loss: 0.7184, test_loss: 0.9325, test_f1: 0.6129
 epoch: 80, train_loss: 0.7108, test_loss: 0.9469, test_f1: 0.6013
 epoch: 81, train_loss: 0.7246, test_loss: 0.9209, test_f1: 0.6036
 epoch: 82, train_loss: 0.7070, test_loss: 0.9341, test_f1: 0.6172
 epoch: 83, train_loss: 0.7208, test_loss: 0.9446, test_f1: 0.5981
 epoch: 84, train_loss: 0.7216, test_loss: 0.9558, test_f1: 0.6115
 epoch: 85, train_loss: 0.7021, test_loss: 0.9582, test_f1: 0.5809
 epoch: 86, train_loss: 0.7028, test_loss: 0.9422, test_f1: 0.5981
 epoch: 87, train_loss: 0.7025, test_loss: 0.9353, test_f1: 0.6043
 epoch: 88, train_loss: 0.7093, test_loss: 0.9529, test_f1: 0.5737
 epoch: 89, train_loss: 0.6951, test_loss: 0.9581, test_f1: 0.5994
 epoch: 90, train_loss: 0.7053, test_loss: 0.9623, test_f1: 0.5873
 epoch: 91, train_loss: 0.7036, test_loss: 0.9529, test_f1: 0.5890
 epoch: 92, train_loss: 0.7111, test_loss: 0.9435, test_f1: 0.5797
 epoch: 93, train_loss: 0.7081, test_loss: 0.9669, test_f1: 0.6022
 epoch: 94, train_loss: 0.7009, test_loss: 0.9764, test_f1: 0.5806
 epoch: 95, train_loss: 0.6935, test_loss: 0.9609, test_f1: 0.5893
 epoch: 96, train_loss: 0.6971, test_loss: 0.9637, test_f1: 0.6010
 epoch: 97, train_loss: 0.6882, test_loss: 0.9577, test_f1: 0.5918
 epoch: 98, train_loss: 0.6833, test_loss: 0.9644, test_f1: 0.5977
 epoch: 99, train_loss: 0.6982, test_loss: 0.9560, test_f1: 0.6032
##################ITERATION #6 ****************************************
 epoch: 0, train_loss: 1.2478, test_loss: 1.1936, test_f1: 0.3476
 epoch: 1, train_loss: 1.1631, test_loss: 1.0986, test_f1: 0.4120
 epoch: 2, train_loss: 1.1330, test_loss: 1.0747, test_f1: 0.4145
 epoch: 3, train_loss: 1.1115, test_loss: 1.0591, test_f1: 0.4179
 epoch: 4, train_loss: 1.0917, test_loss: 1.0386, test_f1: 0.4072
 epoch: 5, train_loss: 1.0804, test_loss: 1.0145, test_f1: 0.4444
 epoch: 6, train_loss: 1.0622, test_loss: 0.9785, test_f1: 0.4705
 epoch: 7, train_loss: 1.0435, test_loss: 0.9887, test_f1: 0.4633
 epoch: 8, train_loss: 1.0347, test_loss: 0.9692, test_f1: 0.4886
 epoch: 9, train_loss: 1.0182, test_loss: 0.9572, test_f1: 0.4813
 epoch: 10, train_loss: 0.9986, test_loss: 0.9601, test_f1: 0.4985
 epoch: 11, train_loss: 0.9969, test_loss: 0.9521, test_f1: 0.5098
 epoch: 12, train_loss: 0.9853, test_loss: 0.9513, test_f1: 0.5162
 epoch: 13, train_loss: 0.9902, test_loss: 0.9507, test_f1: 0.5032
 epoch: 14, train_loss: 0.9797, test_loss: 0.9490, test_f1: 0.5061
 epoch: 15, train_loss: 0.9670, test_loss: 0.9450, test_f1: 0.4978
 epoch: 16, train_loss: 0.9581, test_loss: 0.9272, test_f1: 0.4958
 epoch: 17, train_loss: 0.9488, test_loss: 0.9324, test_f1: 0.5030
 epoch: 18, train_loss: 0.9435, test_loss: 0.9283, test_f1: 0.5001
 epoch: 19, train_loss: 0.9339, test_loss: 0.9334, test_f1: 0.5339
 epoch: 20, train_loss: 0.9283, test_loss: 0.9391, test_f1: 0.5016
 epoch: 21, train_loss: 0.9298, test_loss: 0.9382, test_f1: 0.5318
 epoch: 22, train_loss: 0.9183, test_loss: 0.9450, test_f1: 0.5205
 epoch: 23, train_loss: 0.9104, test_loss: 0.9292, test_f1: 0.5172
 epoch: 24, train_loss: 0.9183, test_loss: 0.9195, test_f1: 0.5290
 epoch: 25, train_loss: 0.9044, test_loss: 0.9361, test_f1: 0.5443
 epoch: 26, train_loss: 0.8997, test_loss: 0.9418, test_f1: 0.5432
 epoch: 27, train_loss: 0.8904, test_loss: 0.9392, test_f1: 0.5456
 epoch: 28, train_loss: 0.8909, test_loss: 0.9395, test_f1: 0.5454
 epoch: 29, train_loss: 0.8803, test_loss: 0.9313, test_f1: 0.5181
 epoch: 30, train_loss: 0.8848, test_loss: 0.9245, test_f1: 0.5214
 epoch: 31, train_loss: 0.8711, test_loss: 0.9361, test_f1: 0.5181
 epoch: 32, train_loss: 0.8743, test_loss: 0.9131, test_f1: 0.5642
 epoch: 33, train_loss: 0.8606, test_loss: 0.9276, test_f1: 0.5562
 epoch: 34, train_loss: 0.8665, test_loss: 0.9359, test_f1: 0.5479
 epoch: 35, train_loss: 0.8588, test_loss: 0.9394, test_f1: 0.5642
 epoch: 36, train_loss: 0.8538, test_loss: 0.9288, test_f1: 0.5441
 epoch: 37, train_loss: 0.8542, test_loss: 0.9352, test_f1: 0.5764
 epoch: 38, train_loss: 0.8574, test_loss: 0.9305, test_f1: 0.5837
 epoch: 39, train_loss: 0.8467, test_loss: 0.9275, test_f1: 0.5864
 epoch: 40, train_loss: 0.8400, test_loss: 0.9374, test_f1: 0.5696
 epoch: 41, train_loss: 0.8363, test_loss: 0.9286, test_f1: 0.5721
 epoch: 42, train_loss: 0.8299, test_loss: 0.9188, test_f1: 0.5689
 epoch: 43, train_loss: 0.8258, test_loss: 0.9189, test_f1: 0.5801
 epoch: 44, train_loss: 0.8343, test_loss: 0.9350, test_f1: 0.5783
 epoch: 45, train_loss: 0.8278, test_loss: 0.9370, test_f1: 0.5767
 epoch: 46, train_loss: 0.8229, test_loss: 0.9305, test_f1: 0.5816
 epoch: 47, train_loss: 0.8006, test_loss: 0.9418, test_f1: 0.5656
 epoch: 48, train_loss: 0.8214, test_loss: 0.9347, test_f1: 0.5953
 epoch: 49, train_loss: 0.8118, test_loss: 0.9289, test_f1: 0.5741
 epoch: 50, train_loss: 0.8071, test_loss: 0.9073, test_f1: 0.6085
 epoch: 51, train_loss: 0.7926, test_loss: 0.9118, test_f1: 0.6055
 epoch: 52, train_loss: 0.7998, test_loss: 0.9214, test_f1: 0.5949
 epoch: 53, train_loss: 0.7820, test_loss: 0.9259, test_f1: 0.5895
 epoch: 54, train_loss: 0.7948, test_loss: 0.9152, test_f1: 0.6006
 epoch: 55, train_loss: 0.7818, test_loss: 0.9191, test_f1: 0.5928
 epoch: 56, train_loss: 0.7861, test_loss: 0.9421, test_f1: 0.5894
 epoch: 57, train_loss: 0.7923, test_loss: 0.9451, test_f1: 0.5856
 epoch: 58, train_loss: 0.7683, test_loss: 0.9325, test_f1: 0.5895
 epoch: 59, train_loss: 0.7822, test_loss: 0.9204, test_f1: 0.5835
 epoch: 60, train_loss: 0.7698, test_loss: 0.9287, test_f1: 0.5982
 epoch: 61, train_loss: 0.7656, test_loss: 0.9280, test_f1: 0.6011
 epoch: 62, train_loss: 0.7729, test_loss: 0.9358, test_f1: 0.6034
 epoch: 63, train_loss: 0.7838, test_loss: 0.9202, test_f1: 0.6080
 epoch: 64, train_loss: 0.7751, test_loss: 0.9254, test_f1: 0.6099
 epoch: 65, train_loss: 0.7657, test_loss: 0.9251, test_f1: 0.6107
 epoch: 66, train_loss: 0.7620, test_loss: 0.9174, test_f1: 0.6122
 epoch: 67, train_loss: 0.7734, test_loss: 0.9385, test_f1: 0.6107
 epoch: 68, train_loss: 0.7762, test_loss: 0.9214, test_f1: 0.6260
 epoch: 69, train_loss: 0.7558, test_loss: 0.9263, test_f1: 0.6198
 epoch: 70, train_loss: 0.7576, test_loss: 0.9263, test_f1: 0.6059
 epoch: 71, train_loss: 0.7591, test_loss: 0.9305, test_f1: 0.6125
 epoch: 72, train_loss: 0.7602, test_loss: 0.9386, test_f1: 0.6021
 epoch: 73, train_loss: 0.7560, test_loss: 0.9304, test_f1: 0.6110
 epoch: 74, train_loss: 0.7466, test_loss: 0.9257, test_f1: 0.6384
 epoch: 75, train_loss: 0.7552, test_loss: 0.9102, test_f1: 0.5969
 epoch: 76, train_loss: 0.7537, test_loss: 0.9200, test_f1: 0.6265
 epoch: 77, train_loss: 0.7513, test_loss: 0.9275, test_f1: 0.6261
 epoch: 78, train_loss: 0.7532, test_loss: 0.9198, test_f1: 0.6199
 epoch: 79, train_loss: 0.7412, test_loss: 0.9164, test_f1: 0.6301
 epoch: 80, train_loss: 0.7415, test_loss: 0.9224, test_f1: 0.6167
 epoch: 81, train_loss: 0.7423, test_loss: 0.9232, test_f1: 0.6294
 epoch: 82, train_loss: 0.7469, test_loss: 0.9108, test_f1: 0.6367
 epoch: 83, train_loss: 0.7343, test_loss: 0.9144, test_f1: 0.6275
 epoch: 84, train_loss: 0.7342, test_loss: 0.9256, test_f1: 0.6147
 epoch: 85, train_loss: 0.7335, test_loss: 0.9262, test_f1: 0.6342
 epoch: 86, train_loss: 0.7291, test_loss: 0.9275, test_f1: 0.6144
 epoch: 87, train_loss: 0.7268, test_loss: 0.9167, test_f1: 0.6118
 epoch: 88, train_loss: 0.7279, test_loss: 0.9237, test_f1: 0.6211
 epoch: 89, train_loss: 0.7300, test_loss: 0.9237, test_f1: 0.6271
 epoch: 90, train_loss: 0.7273, test_loss: 0.9505, test_f1: 0.6267
 epoch: 91, train_loss: 0.7365, test_loss: 0.9260, test_f1: 0.6116
 epoch: 92, train_loss: 0.7304, test_loss: 0.9365, test_f1: 0.6133
 epoch: 93, train_loss: 0.7330, test_loss: 0.9374, test_f1: 0.6351
 epoch: 94, train_loss: 0.7328, test_loss: 0.9420, test_f1: 0.6218
 epoch: 95, train_loss: 0.7185, test_loss: 0.9532, test_f1: 0.5999
 epoch: 96, train_loss: 0.7065, test_loss: 0.9302, test_f1: 0.6128
 epoch: 97, train_loss: 0.7234, test_loss: 0.9408, test_f1: 0.6333
 epoch: 98, train_loss: 0.7115, test_loss: 0.9297, test_f1: 0.6089
 epoch: 99, train_loss: 0.7047, test_loss: 0.9279, test_f1: 0.6317
##################ITERATION #7 ****************************************
 epoch: 0, train_loss: 1.2993, test_loss: 1.1592, test_f1: 0.3795
 epoch: 1, train_loss: 1.1718, test_loss: 1.0762, test_f1: 0.4616
 epoch: 2, train_loss: 1.1479, test_loss: 1.0406, test_f1: 0.4797
 epoch: 3, train_loss: 1.1209, test_loss: 1.0251, test_f1: 0.4909
 epoch: 4, train_loss: 1.0863, test_loss: 0.9910, test_f1: 0.4852
 epoch: 5, train_loss: 1.0587, test_loss: 0.9970, test_f1: 0.4967
 epoch: 6, train_loss: 1.0386, test_loss: 0.9614, test_f1: 0.5144
 epoch: 7, train_loss: 1.0260, test_loss: 0.9684, test_f1: 0.4988
 epoch: 8, train_loss: 1.0092, test_loss: 0.9400, test_f1: 0.5116
 epoch: 9, train_loss: 0.9985, test_loss: 0.9483, test_f1: 0.5111
 epoch: 10, train_loss: 0.9885, test_loss: 0.9571, test_f1: 0.5094
 epoch: 11, train_loss: 0.9776, test_loss: 0.9379, test_f1: 0.5105
 epoch: 12, train_loss: 0.9731, test_loss: 0.9395, test_f1: 0.5076
 epoch: 13, train_loss: 0.9580, test_loss: 0.9472, test_f1: 0.5127
 epoch: 14, train_loss: 0.9544, test_loss: 0.9395, test_f1: 0.5172
 epoch: 15, train_loss: 0.9331, test_loss: 0.9383, test_f1: 0.5164
 epoch: 16, train_loss: 0.9338, test_loss: 0.9419, test_f1: 0.5159
 epoch: 17, train_loss: 0.9226, test_loss: 0.9338, test_f1: 0.5312
 epoch: 18, train_loss: 0.9189, test_loss: 0.9456, test_f1: 0.5238
 epoch: 19, train_loss: 0.9151, test_loss: 0.9324, test_f1: 0.5094
 epoch: 20, train_loss: 0.9083, test_loss: 0.9336, test_f1: 0.5105
 epoch: 21, train_loss: 0.9066, test_loss: 0.9316, test_f1: 0.5400
 epoch: 22, train_loss: 0.9010, test_loss: 0.9336, test_f1: 0.5301
 epoch: 23, train_loss: 0.8887, test_loss: 0.9411, test_f1: 0.5444
 epoch: 24, train_loss: 0.8802, test_loss: 0.9287, test_f1: 0.5423
 epoch: 25, train_loss: 0.8760, test_loss: 0.9660, test_f1: 0.5584
 epoch: 26, train_loss: 0.8822, test_loss: 0.9474, test_f1: 0.5295
 epoch: 27, train_loss: 0.8709, test_loss: 0.9576, test_f1: 0.5569
 epoch: 28, train_loss: 0.8756, test_loss: 0.9449, test_f1: 0.5490
 epoch: 29, train_loss: 0.8586, test_loss: 0.9463, test_f1: 0.5556
 epoch: 30, train_loss: 0.8536, test_loss: 0.9437, test_f1: 0.5602
 epoch: 31, train_loss: 0.8561, test_loss: 0.9564, test_f1: 0.5404
 epoch: 32, train_loss: 0.8530, test_loss: 0.9581, test_f1: 0.5477
 epoch: 33, train_loss: 0.8547, test_loss: 0.9456, test_f1: 0.5375
 epoch: 34, train_loss: 0.8530, test_loss: 0.9374, test_f1: 0.5350
 epoch: 35, train_loss: 0.8344, test_loss: 0.9362, test_f1: 0.5407
 epoch: 36, train_loss: 0.8400, test_loss: 0.9528, test_f1: 0.5608
 epoch: 37, train_loss: 0.8375, test_loss: 0.9455, test_f1: 0.5602
 epoch: 38, train_loss: 0.8361, test_loss: 0.9589, test_f1: 0.5500
 epoch: 39, train_loss: 0.8357, test_loss: 0.9406, test_f1: 0.5439
 epoch: 40, train_loss: 0.8250, test_loss: 0.9566, test_f1: 0.5507
 epoch: 41, train_loss: 0.8161, test_loss: 0.9446, test_f1: 0.5553
 epoch: 42, train_loss: 0.8231, test_loss: 0.9600, test_f1: 0.5522
 epoch: 43, train_loss: 0.8141, test_loss: 0.9469, test_f1: 0.5685
 epoch: 44, train_loss: 0.8104, test_loss: 0.9555, test_f1: 0.5492
 epoch: 45, train_loss: 0.8074, test_loss: 0.9431, test_f1: 0.5611
 epoch: 46, train_loss: 0.7970, test_loss: 0.9455, test_f1: 0.5500
 epoch: 47, train_loss: 0.8044, test_loss: 0.9335, test_f1: 0.5634
 epoch: 48, train_loss: 0.8031, test_loss: 0.9617, test_f1: 0.5525
 epoch: 49, train_loss: 0.7998, test_loss: 0.9516, test_f1: 0.5824
 epoch: 50, train_loss: 0.7984, test_loss: 0.9476, test_f1: 0.5518
 epoch: 51, train_loss: 0.7858, test_loss: 0.9648, test_f1: 0.5681
 epoch: 52, train_loss: 0.7795, test_loss: 0.9379, test_f1: 0.5606
 epoch: 53, train_loss: 0.7881, test_loss: 0.9500, test_f1: 0.5490
 epoch: 54, train_loss: 0.7726, test_loss: 0.9387, test_f1: 0.5563
 epoch: 55, train_loss: 0.7742, test_loss: 0.9367, test_f1: 0.5660
 epoch: 56, train_loss: 0.7738, test_loss: 0.9535, test_f1: 0.5672
 epoch: 57, train_loss: 0.7771, test_loss: 0.9572, test_f1: 0.5624
 epoch: 58, train_loss: 0.7743, test_loss: 0.9431, test_f1: 0.5669
 epoch: 59, train_loss: 0.7725, test_loss: 0.9485, test_f1: 0.5753
 epoch: 60, train_loss: 0.7681, test_loss: 0.9678, test_f1: 0.5691
 epoch: 61, train_loss: 0.7683, test_loss: 0.9602, test_f1: 0.5672
 epoch: 62, train_loss: 0.7619, test_loss: 0.9386, test_f1: 0.5681
 epoch: 63, train_loss: 0.7610, test_loss: 0.9515, test_f1: 0.5601
 epoch: 64, train_loss: 0.7706, test_loss: 0.9340, test_f1: 0.5686
 epoch: 65, train_loss: 0.7613, test_loss: 0.9541, test_f1: 0.5557
 epoch: 66, train_loss: 0.7423, test_loss: 0.9403, test_f1: 0.5736
 epoch: 67, train_loss: 0.7544, test_loss: 0.9331, test_f1: 0.5673
 epoch: 68, train_loss: 0.7554, test_loss: 0.9341, test_f1: 0.5572
 epoch: 69, train_loss: 0.7564, test_loss: 0.9448, test_f1: 0.5767
 epoch: 70, train_loss: 0.7556, test_loss: 0.9442, test_f1: 0.5643
 epoch: 71, train_loss: 0.7472, test_loss: 0.9385, test_f1: 0.5611
 epoch: 72, train_loss: 0.7550, test_loss: 0.9343, test_f1: 0.5987
 epoch: 73, train_loss: 0.7533, test_loss: 0.9432, test_f1: 0.5701
 epoch: 74, train_loss: 0.7555, test_loss: 0.9453, test_f1: 0.5763
 epoch: 75, train_loss: 0.7506, test_loss: 0.9408, test_f1: 0.5729
 epoch: 76, train_loss: 0.7457, test_loss: 0.9360, test_f1: 0.5831
 epoch: 77, train_loss: 0.7377, test_loss: 0.9327, test_f1: 0.5712
 epoch: 78, train_loss: 0.7410, test_loss: 0.9618, test_f1: 0.5592
 epoch: 79, train_loss: 0.7534, test_loss: 0.9471, test_f1: 0.5720
 epoch: 80, train_loss: 0.7482, test_loss: 0.9518, test_f1: 0.5894
 epoch: 81, train_loss: 0.7319, test_loss: 0.9460, test_f1: 0.5685
 epoch: 82, train_loss: 0.7314, test_loss: 0.9476, test_f1: 0.5616
 epoch: 83, train_loss: 0.7355, test_loss: 0.9484, test_f1: 0.5755
 epoch: 84, train_loss: 0.7315, test_loss: 0.9463, test_f1: 0.5997
 epoch: 85, train_loss: 0.7397, test_loss: 0.9417, test_f1: 0.5838
 epoch: 86, train_loss: 0.7278, test_loss: 0.9370, test_f1: 0.5793
 epoch: 87, train_loss: 0.7292, test_loss: 0.9449, test_f1: 0.5990
 epoch: 88, train_loss: 0.7159, test_loss: 0.9535, test_f1: 0.5802
 epoch: 89, train_loss: 0.7340, test_loss: 0.9492, test_f1: 0.5753
 epoch: 90, train_loss: 0.7227, test_loss: 0.9599, test_f1: 0.5770
 epoch: 91, train_loss: 0.7222, test_loss: 0.9398, test_f1: 0.5971
 epoch: 92, train_loss: 0.7259, test_loss: 0.9525, test_f1: 0.5765
 epoch: 93, train_loss: 0.7159, test_loss: 0.9248, test_f1: 0.5781
 epoch: 94, train_loss: 0.7274, test_loss: 0.9386, test_f1: 0.5774
 epoch: 95, train_loss: 0.7167, test_loss: 0.9485, test_f1: 0.6007
 epoch: 96, train_loss: 0.7286, test_loss: 0.9413, test_f1: 0.5636
 epoch: 97, train_loss: 0.7193, test_loss: 0.9549, test_f1: 0.5778
 epoch: 98, train_loss: 0.7320, test_loss: 0.9563, test_f1: 0.5839
 epoch: 99, train_loss: 0.7087, test_loss: 0.9548, test_f1: 0.5941
##################ITERATION #8 ****************************************
 epoch: 0, train_loss: 1.2317, test_loss: 1.2227, test_f1: 0.3075
 epoch: 1, train_loss: 1.1340, test_loss: 1.0768, test_f1: 0.4200
 epoch: 2, train_loss: 1.1018, test_loss: 1.0441, test_f1: 0.4347
 epoch: 3, train_loss: 1.0749, test_loss: 1.0204, test_f1: 0.4698
 epoch: 4, train_loss: 1.0533, test_loss: 0.9831, test_f1: 0.4774
 epoch: 5, train_loss: 1.0343, test_loss: 1.0001, test_f1: 0.4680
 epoch: 6, train_loss: 1.0225, test_loss: 0.9827, test_f1: 0.4566
 epoch: 7, train_loss: 1.0020, test_loss: 0.9736, test_f1: 0.4664
 epoch: 8, train_loss: 0.9876, test_loss: 0.9758, test_f1: 0.4862
 epoch: 9, train_loss: 0.9815, test_loss: 0.9732, test_f1: 0.4750
 epoch: 10, train_loss: 0.9703, test_loss: 0.9657, test_f1: 0.4856
 epoch: 11, train_loss: 0.9690, test_loss: 0.9736, test_f1: 0.4854
 epoch: 12, train_loss: 0.9609, test_loss: 0.9762, test_f1: 0.4805
 epoch: 13, train_loss: 0.9547, test_loss: 0.9632, test_f1: 0.4937
 epoch: 14, train_loss: 0.9430, test_loss: 0.9660, test_f1: 0.4936
 epoch: 15, train_loss: 0.9325, test_loss: 0.9760, test_f1: 0.4905
 epoch: 16, train_loss: 0.9190, test_loss: 0.9679, test_f1: 0.4826
 epoch: 17, train_loss: 0.9167, test_loss: 0.9890, test_f1: 0.4872
 epoch: 18, train_loss: 0.9052, test_loss: 0.9827, test_f1: 0.4968
 epoch: 19, train_loss: 0.9021, test_loss: 0.9811, test_f1: 0.5094
 epoch: 20, train_loss: 0.8996, test_loss: 0.9809, test_f1: 0.4892
 epoch: 21, train_loss: 0.8889, test_loss: 0.9944, test_f1: 0.5167
 epoch: 22, train_loss: 0.8875, test_loss: 0.9826, test_f1: 0.5020
 epoch: 23, train_loss: 0.8835, test_loss: 0.9891, test_f1: 0.5018
 epoch: 24, train_loss: 0.8711, test_loss: 0.9864, test_f1: 0.5081
 epoch: 25, train_loss: 0.8862, test_loss: 0.9865, test_f1: 0.5159
 epoch: 26, train_loss: 0.8709, test_loss: 0.9880, test_f1: 0.5148
 epoch: 27, train_loss: 0.8578, test_loss: 0.9957, test_f1: 0.5076
 epoch: 28, train_loss: 0.8727, test_loss: 1.0031, test_f1: 0.4961
 epoch: 29, train_loss: 0.8560, test_loss: 0.9886, test_f1: 0.5249
 epoch: 30, train_loss: 0.8715, test_loss: 0.9977, test_f1: 0.5090
 epoch: 31, train_loss: 0.8485, test_loss: 1.0031, test_f1: 0.5173
 epoch: 32, train_loss: 0.8493, test_loss: 1.0050, test_f1: 0.5121
 epoch: 33, train_loss: 0.8289, test_loss: 1.0019, test_f1: 0.5120
 epoch: 34, train_loss: 0.8428, test_loss: 1.0075, test_f1: 0.5199
 epoch: 35, train_loss: 0.8408, test_loss: 0.9997, test_f1: 0.5310
 epoch: 36, train_loss: 0.8258, test_loss: 0.9810, test_f1: 0.5552
 epoch: 37, train_loss: 0.8215, test_loss: 0.9810, test_f1: 0.5494
 epoch: 38, train_loss: 0.8190, test_loss: 0.9827, test_f1: 0.5304
 epoch: 39, train_loss: 0.8238, test_loss: 1.0045, test_f1: 0.5186
 epoch: 40, train_loss: 0.8265, test_loss: 0.9886, test_f1: 0.5455
 epoch: 41, train_loss: 0.8182, test_loss: 0.9940, test_f1: 0.5439
 epoch: 42, train_loss: 0.8264, test_loss: 0.9832, test_f1: 0.5430
 epoch: 43, train_loss: 0.8035, test_loss: 1.0009, test_f1: 0.5324
 epoch: 44, train_loss: 0.8072, test_loss: 1.0064, test_f1: 0.5439
 epoch: 45, train_loss: 0.8012, test_loss: 0.9872, test_f1: 0.5566
 epoch: 46, train_loss: 0.8037, test_loss: 0.9839, test_f1: 0.5624
 epoch: 47, train_loss: 0.8040, test_loss: 0.9752, test_f1: 0.5763
 epoch: 48, train_loss: 0.7944, test_loss: 0.9768, test_f1: 0.5625
 epoch: 49, train_loss: 0.8019, test_loss: 0.9746, test_f1: 0.5741
 epoch: 50, train_loss: 0.7852, test_loss: 0.9879, test_f1: 0.5735
 epoch: 51, train_loss: 0.7724, test_loss: 0.9890, test_f1: 0.5855
 epoch: 52, train_loss: 0.7686, test_loss: 0.9945, test_f1: 0.5858
 epoch: 53, train_loss: 0.7757, test_loss: 1.0001, test_f1: 0.5690
 epoch: 54, train_loss: 0.7700, test_loss: 0.9962, test_f1: 0.5704
 epoch: 55, train_loss: 0.7739, test_loss: 0.9971, test_f1: 0.5633
 epoch: 56, train_loss: 0.7607, test_loss: 0.9992, test_f1: 0.5661
 epoch: 57, train_loss: 0.7711, test_loss: 0.9906, test_f1: 0.5925
 epoch: 58, train_loss: 0.7600, test_loss: 0.9893, test_f1: 0.5643
 epoch: 59, train_loss: 0.7634, test_loss: 0.9928, test_f1: 0.5831
 epoch: 60, train_loss: 0.7558, test_loss: 0.9945, test_f1: 0.5845
 epoch: 61, train_loss: 0.7651, test_loss: 0.9959, test_f1: 0.5699
 epoch: 62, train_loss: 0.7566, test_loss: 0.9982, test_f1: 0.5618
 epoch: 63, train_loss: 0.7587, test_loss: 0.9966, test_f1: 0.5689
 epoch: 64, train_loss: 0.7693, test_loss: 1.0001, test_f1: 0.5765
 epoch: 65, train_loss: 0.7547, test_loss: 1.0051, test_f1: 0.5598
 epoch: 66, train_loss: 0.7665, test_loss: 0.9823, test_f1: 0.6059
 epoch: 67, train_loss: 0.7526, test_loss: 0.9889, test_f1: 0.5770
 epoch: 68, train_loss: 0.7515, test_loss: 1.0015, test_f1: 0.5754
 epoch: 69, train_loss: 0.7518, test_loss: 0.9802, test_f1: 0.5849
 epoch: 70, train_loss: 0.7508, test_loss: 0.9954, test_f1: 0.5746
 epoch: 71, train_loss: 0.7495, test_loss: 0.9952, test_f1: 0.5851
 epoch: 72, train_loss: 0.7510, test_loss: 0.9802, test_f1: 0.5771
 epoch: 73, train_loss: 0.7485, test_loss: 0.9903, test_f1: 0.6075
 epoch: 74, train_loss: 0.7367, test_loss: 1.0074, test_f1: 0.5856
 epoch: 75, train_loss: 0.7427, test_loss: 0.9889, test_f1: 0.6013
 epoch: 76, train_loss: 0.7387, test_loss: 0.9935, test_f1: 0.5957
 epoch: 77, train_loss: 0.7287, test_loss: 0.9921, test_f1: 0.5936
 epoch: 78, train_loss: 0.7358, test_loss: 0.9865, test_f1: 0.5924
 epoch: 79, train_loss: 0.7265, test_loss: 0.9943, test_f1: 0.6076
 epoch: 80, train_loss: 0.7375, test_loss: 1.0058, test_f1: 0.5917
 epoch: 81, train_loss: 0.7341, test_loss: 0.9986, test_f1: 0.5906
 epoch: 82, train_loss: 0.7345, test_loss: 1.0026, test_f1: 0.6056
 epoch: 83, train_loss: 0.7236, test_loss: 1.0102, test_f1: 0.5956
 epoch: 84, train_loss: 0.7399, test_loss: 0.9956, test_f1: 0.6035
 epoch: 85, train_loss: 0.7119, test_loss: 1.0111, test_f1: 0.5926
 epoch: 86, train_loss: 0.7283, test_loss: 1.0094, test_f1: 0.5816
 epoch: 87, train_loss: 0.7334, test_loss: 1.0030, test_f1: 0.5821
 epoch: 88, train_loss: 0.7215, test_loss: 1.0056, test_f1: 0.5754
 epoch: 89, train_loss: 0.7324, test_loss: 1.0005, test_f1: 0.5795
 epoch: 90, train_loss: 0.7249, test_loss: 1.0093, test_f1: 0.5736
 epoch: 91, train_loss: 0.7159, test_loss: 1.0032, test_f1: 0.5854
 epoch: 92, train_loss: 0.7223, test_loss: 0.9972, test_f1: 0.5745
 epoch: 93, train_loss: 0.7160, test_loss: 1.0048, test_f1: 0.5752
 epoch: 94, train_loss: 0.7152, test_loss: 1.0269, test_f1: 0.5703
 epoch: 95, train_loss: 0.7104, test_loss: 1.0115, test_f1: 0.5862
 epoch: 96, train_loss: 0.7101, test_loss: 1.0178, test_f1: 0.5612
 epoch: 97, train_loss: 0.7190, test_loss: 1.0276, test_f1: 0.5827
 epoch: 98, train_loss: 0.6992, test_loss: 1.0237, test_f1: 0.6059
 epoch: 99, train_loss: 0.7108, test_loss: 1.0233, test_f1: 0.5776
##################ITERATION #9 ****************************************
 epoch: 0, train_loss: 1.3136, test_loss: 1.2023, test_f1: 0.3622
 epoch: 1, train_loss: 1.1800, test_loss: 1.0775, test_f1: 0.4294
 epoch: 2, train_loss: 1.1449, test_loss: 1.0445, test_f1: 0.4647
 epoch: 3, train_loss: 1.1111, test_loss: 1.0310, test_f1: 0.4666
 epoch: 4, train_loss: 1.0931, test_loss: 1.0141, test_f1: 0.4752
 epoch: 5, train_loss: 1.0650, test_loss: 0.9827, test_f1: 0.4950
 epoch: 6, train_loss: 1.0456, test_loss: 0.9795, test_f1: 0.4640
 epoch: 7, train_loss: 1.0280, test_loss: 0.9720, test_f1: 0.4928
 epoch: 8, train_loss: 1.0171, test_loss: 0.9645, test_f1: 0.4847
 epoch: 9, train_loss: 1.0040, test_loss: 0.9795, test_f1: 0.4982
 epoch: 10, train_loss: 0.9930, test_loss: 0.9668, test_f1: 0.5093
 epoch: 11, train_loss: 0.9886, test_loss: 0.9579, test_f1: 0.4994
 epoch: 12, train_loss: 0.9807, test_loss: 0.9545, test_f1: 0.4845
 epoch: 13, train_loss: 0.9715, test_loss: 0.9383, test_f1: 0.5122
 epoch: 14, train_loss: 0.9545, test_loss: 0.9513, test_f1: 0.5054
 epoch: 15, train_loss: 0.9660, test_loss: 0.9454, test_f1: 0.5025
 epoch: 16, train_loss: 0.9534, test_loss: 0.9714, test_f1: 0.4980
 epoch: 17, train_loss: 0.9444, test_loss: 0.9357, test_f1: 0.5272
 epoch: 18, train_loss: 0.9249, test_loss: 0.9537, test_f1: 0.5012
 epoch: 19, train_loss: 0.9176, test_loss: 0.9355, test_f1: 0.5238
 epoch: 20, train_loss: 0.9153, test_loss: 0.9453, test_f1: 0.5294
 epoch: 21, train_loss: 0.9121, test_loss: 0.9221, test_f1: 0.5303
 epoch: 22, train_loss: 0.9112, test_loss: 0.9209, test_f1: 0.5186
 epoch: 23, train_loss: 0.9022, test_loss: 0.9272, test_f1: 0.5268
 epoch: 24, train_loss: 0.8941, test_loss: 0.9306, test_f1: 0.5230
 epoch: 25, train_loss: 0.8987, test_loss: 0.9340, test_f1: 0.5163
 epoch: 26, train_loss: 0.8873, test_loss: 0.9131, test_f1: 0.5435
 epoch: 27, train_loss: 0.8910, test_loss: 0.9363, test_f1: 0.5319
 epoch: 28, train_loss: 0.8818, test_loss: 0.9318, test_f1: 0.5253
 epoch: 29, train_loss: 0.8695, test_loss: 0.9505, test_f1: 0.5136
 epoch: 30, train_loss: 0.8659, test_loss: 0.9468, test_f1: 0.5305
 epoch: 31, train_loss: 0.8653, test_loss: 0.9295, test_f1: 0.5438
 epoch: 32, train_loss: 0.8703, test_loss: 0.9325, test_f1: 0.5359
 epoch: 33, train_loss: 0.8593, test_loss: 0.9292, test_f1: 0.5275
 epoch: 34, train_loss: 0.8510, test_loss: 0.9466, test_f1: 0.5353
 epoch: 35, train_loss: 0.8491, test_loss: 0.9224, test_f1: 0.5366
 epoch: 36, train_loss: 0.8370, test_loss: 0.9322, test_f1: 0.5364
 epoch: 37, train_loss: 0.8400, test_loss: 0.9428, test_f1: 0.5301
 epoch: 38, train_loss: 0.8525, test_loss: 0.9327, test_f1: 0.5321
 epoch: 39, train_loss: 0.8355, test_loss: 0.9425, test_f1: 0.5311
 epoch: 40, train_loss: 0.8180, test_loss: 0.9243, test_f1: 0.5332
 epoch: 41, train_loss: 0.8296, test_loss: 0.9326, test_f1: 0.5313
 epoch: 42, train_loss: 0.8270, test_loss: 0.9420, test_f1: 0.5398
 epoch: 43, train_loss: 0.8215, test_loss: 0.9314, test_f1: 0.5332
 epoch: 44, train_loss: 0.8192, test_loss: 0.9275, test_f1: 0.5249
 epoch: 45, train_loss: 0.8115, test_loss: 0.9449, test_f1: 0.5284
 epoch: 46, train_loss: 0.8072, test_loss: 0.9221, test_f1: 0.5251
 epoch: 47, train_loss: 0.8031, test_loss: 0.9266, test_f1: 0.5368
 epoch: 48, train_loss: 0.8115, test_loss: 0.9304, test_f1: 0.5446
 epoch: 49, train_loss: 0.8128, test_loss: 0.9407, test_f1: 0.5371
 epoch: 50, train_loss: 0.7973, test_loss: 0.9470, test_f1: 0.5360
 epoch: 51, train_loss: 0.8044, test_loss: 0.9350, test_f1: 0.5371
 epoch: 52, train_loss: 0.7900, test_loss: 0.9332, test_f1: 0.5448
 epoch: 53, train_loss: 0.7953, test_loss: 0.9427, test_f1: 0.5482
 epoch: 54, train_loss: 0.7847, test_loss: 0.9331, test_f1: 0.5415
 epoch: 55, train_loss: 0.7772, test_loss: 0.9452, test_f1: 0.5519
 epoch: 56, train_loss: 0.7829, test_loss: 0.9244, test_f1: 0.5471
 epoch: 57, train_loss: 0.7780, test_loss: 0.9356, test_f1: 0.5500
 epoch: 58, train_loss: 0.7787, test_loss: 0.9453, test_f1: 0.5440
 epoch: 59, train_loss: 0.7738, test_loss: 0.9279, test_f1: 0.5473
 epoch: 60, train_loss: 0.7763, test_loss: 0.9344, test_f1: 0.5509
 epoch: 61, train_loss: 0.7732, test_loss: 0.9355, test_f1: 0.5595
 epoch: 62, train_loss: 0.7736, test_loss: 0.9324, test_f1: 0.5585
 epoch: 63, train_loss: 0.7672, test_loss: 0.9504, test_f1: 0.5528
 epoch: 64, train_loss: 0.7636, test_loss: 0.9412, test_f1: 0.5605
 epoch: 65, train_loss: 0.7733, test_loss: 0.9433, test_f1: 0.5543
 epoch: 66, train_loss: 0.7584, test_loss: 0.9390, test_f1: 0.5633
 epoch: 67, train_loss: 0.7642, test_loss: 0.9384, test_f1: 0.5551
 epoch: 68, train_loss: 0.7690, test_loss: 0.9462, test_f1: 0.5506
 epoch: 69, train_loss: 0.7594, test_loss: 0.9319, test_f1: 0.5536
 epoch: 70, train_loss: 0.7637, test_loss: 0.9420, test_f1: 0.5488
 epoch: 71, train_loss: 0.7583, test_loss: 0.9470, test_f1: 0.5532
 epoch: 72, train_loss: 0.7538, test_loss: 0.9554, test_f1: 0.5494
 epoch: 73, train_loss: 0.7603, test_loss: 0.9442, test_f1: 0.5480
 epoch: 74, train_loss: 0.7474, test_loss: 0.9413, test_f1: 0.5550
 epoch: 75, train_loss: 0.7460, test_loss: 0.9380, test_f1: 0.5548
 epoch: 76, train_loss: 0.7580, test_loss: 0.9431, test_f1: 0.5630
 epoch: 77, train_loss: 0.7493, test_loss: 0.9495, test_f1: 0.5523
 epoch: 78, train_loss: 0.7441, test_loss: 0.9496, test_f1: 0.5715
 epoch: 79, train_loss: 0.7436, test_loss: 0.9387, test_f1: 0.5623
 epoch: 80, train_loss: 0.7403, test_loss: 0.9461, test_f1: 0.5604
 epoch: 81, train_loss: 0.7314, test_loss: 0.9492, test_f1: 0.5688
 epoch: 82, train_loss: 0.7434, test_loss: 0.9609, test_f1: 0.5525
 epoch: 83, train_loss: 0.7360, test_loss: 0.9652, test_f1: 0.5538
 epoch: 84, train_loss: 0.7344, test_loss: 0.9593, test_f1: 0.5611
 epoch: 85, train_loss: 0.7368, test_loss: 0.9539, test_f1: 0.5656
 epoch: 86, train_loss: 0.7340, test_loss: 0.9473, test_f1: 0.5926
 epoch: 87, train_loss: 0.7397, test_loss: 0.9589, test_f1: 0.5799
 epoch: 88, train_loss: 0.7327, test_loss: 0.9661, test_f1: 0.5776
 epoch: 89, train_loss: 0.7237, test_loss: 0.9634, test_f1: 0.5786
 epoch: 90, train_loss: 0.7275, test_loss: 0.9581, test_f1: 0.5559
 epoch: 91, train_loss: 0.7249, test_loss: 0.9565, test_f1: 0.5779
 epoch: 92, train_loss: 0.7204, test_loss: 0.9613, test_f1: 0.5867
 epoch: 93, train_loss: 0.7306, test_loss: 0.9742, test_f1: 0.5768
 epoch: 94, train_loss: 0.7267, test_loss: 0.9680, test_f1: 0.5766
 epoch: 95, train_loss: 0.7388, test_loss: 0.9618, test_f1: 0.5826
 epoch: 96, train_loss: 0.7163, test_loss: 0.9478, test_f1: 0.6027
 epoch: 97, train_loss: 0.7249, test_loss: 0.9607, test_f1: 0.5776
 epoch: 98, train_loss: 0.7146, test_loss: 0.9619, test_f1: 0.5957
 epoch: 99, train_loss: 0.7177, test_loss: 0.9595, test_f1: 0.5805

Training completed in 872.24 seconds
Best F1: 0.6384 at epoch 74
Mean F1 across iterations: 0.6129  0.0125
========================FINAL RESULTS================================
FEGIN weighted F1: 0.6384  0.0125
python main.py --data ltspice_examples --representation component_net --model FEGIN --layers 6 --hiddens 64 --batch_size 64 --lr 0.0001 --emb_size 512 --epochs 100 --save_appendix component_net_L6_H64_BS64_LR0.0001_E512 --no_val
-----



STDERR:
  File "main.py", line 370, in <module>
    main()
  File "main.py", line 254, in main
    dataset = dataset_class(
  File "/home/philip/projects/ltspice_examples_code_repo/Circuit-Completion-Using-GNNs/component_classification_with_link_prediction_head/evaluation/FEGIN/kernel/circuit_datasets.py", line 15, in __init__
    self.data, self.slices = torch.load(self.processed_paths[0])
  File "/home/philip/.local/lib/python3.8/site-packages/torch/serialization.py", line 1040, in load
    warnings.warn(
  File "/usr/lib/python3.8/warnings.py", line 109, in _showwarnmsg
    sw(msg.message, msg.category, msg.filename, msg.lineno,
  File "main.py", line 47, in warn_with_traceback
    traceback.print_stack(file=log)
/home/philip/projects/ltspice_examples_code_repo/Circuit-Completion-Using-GNNs/component_classification_with_link_prediction_head/evaluation/FEGIN/kernel/circuit_datasets.py:15: FutureWarning: You are using `torch.load` with `weights_only=False` (the current default value), which uses the default pickle module implicitly. It is possible to construct malicious pickle data which will execute arbitrary code during unpickling (See https://github.com/pytorch/pytorch/blob/main/SECURITY.md#untrusted-models for more details). In a future release, the default value for `weights_only` will be flipped to `True`. This limits the functions that could be executed during unpickling. Arbitrary objects will no longer be allowed to be loaded via this mode unless they are explicitly allowlisted by the user via `torch.serialization.add_safe_globals`. We recommend you start setting `weights_only=True` for any use case where you don't have full control of the loaded file. Please open an issue on GitHub for any issues related to this experimental feature.
  self.data, self.slices = torch.load(self.processed_paths[0])
