STDOUT:
Results will be saved in /home/philip/projects/ltspice_examples_code_repo/Circuit-Completion-Using-GNNs/component_classification_with_link_prediction_head/evaluation/FEGIN/results/model_FEGIN_dataset_ltspice_demos
Command line input: python main.py --data ltspice_demos --representation component_pin_net --model FEGIN --layers 2 --hiddens 128 --batch_size 64 --lr 0.001 --emb_size 128 --epochs 100 --save_appendix component_pin_net_L2_H128_BS64_LR0.001_E128 --no_val
 is saved.
-----
ltspice_demos - FEGIN
Using 2 layers, 128 hidden units, h = 2
Loading component_pin_net representation dataset
ENTERED
Training FEGIN on component_pin_net representation
Train: 1565, Test: 383
##################ITERATION #0 ****************************************
 epoch: 0, train_loss: 1.2124, test_loss: 1.3812, test_f1: 0.1365
 epoch: 1, train_loss: 1.0394, test_loss: 1.1179, test_f1: 0.4280
 epoch: 2, train_loss: 0.9918, test_loss: 1.0564, test_f1: 0.4538
 epoch: 3, train_loss: 0.9539, test_loss: 1.0286, test_f1: 0.5193
 epoch: 4, train_loss: 0.9340, test_loss: 1.0148, test_f1: 0.5411
 epoch: 5, train_loss: 0.9105, test_loss: 0.9746, test_f1: 0.5692
 epoch: 6, train_loss: 0.8753, test_loss: 1.0083, test_f1: 0.5557
 epoch: 7, train_loss: 0.8502, test_loss: 0.9425, test_f1: 0.5765
 epoch: 8, train_loss: 0.8181, test_loss: 0.9296, test_f1: 0.5840
 epoch: 9, train_loss: 0.8230, test_loss: 0.9395, test_f1: 0.5962
 epoch: 10, train_loss: 0.7750, test_loss: 0.9163, test_f1: 0.6189
 epoch: 11, train_loss: 0.7624, test_loss: 0.8904, test_f1: 0.5925
 epoch: 12, train_loss: 0.7311, test_loss: 1.0578, test_f1: 0.5836
 epoch: 13, train_loss: 0.7126, test_loss: 0.9398, test_f1: 0.5913
 epoch: 14, train_loss: 0.6991, test_loss: 0.9205, test_f1: 0.5980
 epoch: 15, train_loss: 0.6800, test_loss: 0.9550, test_f1: 0.6160
 epoch: 16, train_loss: 0.6805, test_loss: 1.0118, test_f1: 0.6186
 epoch: 17, train_loss: 0.6518, test_loss: 0.9719, test_f1: 0.6074
 epoch: 18, train_loss: 0.6457, test_loss: 1.0656, test_f1: 0.6141
 epoch: 19, train_loss: 0.6096, test_loss: 0.9819, test_f1: 0.6390
 epoch: 20, train_loss: 0.5871, test_loss: 1.0286, test_f1: 0.6197
 epoch: 21, train_loss: 0.5656, test_loss: 0.9667, test_f1: 0.6602
 epoch: 22, train_loss: 0.5645, test_loss: 1.0255, test_f1: 0.6341
 epoch: 23, train_loss: 0.5484, test_loss: 1.0746, test_f1: 0.6200
 epoch: 24, train_loss: 0.5395, test_loss: 1.0547, test_f1: 0.6639
 epoch: 25, train_loss: 0.5114, test_loss: 1.1770, test_f1: 0.6208
 epoch: 26, train_loss: 0.5350, test_loss: 1.1108, test_f1: 0.6847
 epoch: 27, train_loss: 0.4873, test_loss: 1.1440, test_f1: 0.6424
 epoch: 28, train_loss: 0.5030, test_loss: 1.1127, test_f1: 0.6416
 epoch: 29, train_loss: 0.4849, test_loss: 1.1634, test_f1: 0.6638
 epoch: 30, train_loss: 0.4641, test_loss: 1.2486, test_f1: 0.6482
 epoch: 31, train_loss: 0.4517, test_loss: 1.1594, test_f1: 0.6271
 epoch: 32, train_loss: 0.4181, test_loss: 1.3183, test_f1: 0.5796
 epoch: 33, train_loss: 0.4712, test_loss: 1.4278, test_f1: 0.5791
 epoch: 34, train_loss: 0.4779, test_loss: 1.1755, test_f1: 0.6732
 epoch: 35, train_loss: 0.4007, test_loss: 1.4208, test_f1: 0.5891
 epoch: 36, train_loss: 0.4384, test_loss: 1.4972, test_f1: 0.6045
 epoch: 37, train_loss: 0.4229, test_loss: 1.2186, test_f1: 0.6976
 epoch: 38, train_loss: 0.3865, test_loss: 1.3504, test_f1: 0.6570
 epoch: 39, train_loss: 0.3817, test_loss: 1.3850, test_f1: 0.6355
 epoch: 40, train_loss: 0.3822, test_loss: 1.3477, test_f1: 0.6577
 epoch: 41, train_loss: 0.3447, test_loss: 1.4054, test_f1: 0.6242
 epoch: 42, train_loss: 0.3271, test_loss: 1.6127, test_f1: 0.6084
 epoch: 43, train_loss: 0.3839, test_loss: 1.3742, test_f1: 0.6425
 epoch: 44, train_loss: 0.3434, test_loss: 1.5966, test_f1: 0.6523
 epoch: 45, train_loss: 0.3364, test_loss: 1.4374, test_f1: 0.6523
 epoch: 46, train_loss: 0.3368, test_loss: 1.7458, test_f1: 0.5947
 epoch: 47, train_loss: 0.3602, test_loss: 1.4041, test_f1: 0.6497
 epoch: 48, train_loss: 0.3378, test_loss: 1.6492, test_f1: 0.5938
 epoch: 49, train_loss: 0.3382, test_loss: 1.6900, test_f1: 0.6505
 epoch: 50, train_loss: 0.3338, test_loss: 1.6393, test_f1: 0.6660
 epoch: 51, train_loss: 0.2748, test_loss: 1.6243, test_f1: 0.6899
 epoch: 52, train_loss: 0.2469, test_loss: 1.6831, test_f1: 0.6707
 epoch: 53, train_loss: 0.2466, test_loss: 1.7571, test_f1: 0.6593
 epoch: 54, train_loss: 0.2410, test_loss: 1.7936, test_f1: 0.6570
 epoch: 55, train_loss: 0.2262, test_loss: 1.8880, test_f1: 0.6837
 epoch: 56, train_loss: 0.2030, test_loss: 1.9627, test_f1: 0.6427
 epoch: 57, train_loss: 0.2032, test_loss: 1.8695, test_f1: 0.6654
 epoch: 58, train_loss: 0.2026, test_loss: 2.0491, test_f1: 0.6472
 epoch: 59, train_loss: 0.2551, test_loss: 2.0312, test_f1: 0.6249
 epoch: 60, train_loss: 0.2349, test_loss: 1.9299, test_f1: 0.6453
 epoch: 61, train_loss: 0.2123, test_loss: 2.0688, test_f1: 0.6496
 epoch: 62, train_loss: 0.1873, test_loss: 2.0430, test_f1: 0.6562
 epoch: 63, train_loss: 0.1848, test_loss: 2.0120, test_f1: 0.6721
 epoch: 64, train_loss: 0.1869, test_loss: 2.1568, test_f1: 0.6650
 epoch: 65, train_loss: 0.1931, test_loss: 2.1948, test_f1: 0.6659
 epoch: 66, train_loss: 0.1756, test_loss: 2.2504, test_f1: 0.6499
 epoch: 67, train_loss: 0.1810, test_loss: 2.2743, test_f1: 0.6426
 epoch: 68, train_loss: 0.1629, test_loss: 2.2093, test_f1: 0.6601
 epoch: 69, train_loss: 0.1694, test_loss: 2.2706, test_f1: 0.6550
 epoch: 70, train_loss: 0.1650, test_loss: 2.2930, test_f1: 0.6377
 epoch: 71, train_loss: 0.1724, test_loss: 2.3423, test_f1: 0.6231
 epoch: 72, train_loss: 0.1776, test_loss: 2.2365, test_f1: 0.6807
 epoch: 73, train_loss: 0.1778, test_loss: 2.2871, test_f1: 0.6601
 epoch: 74, train_loss: 0.1462, test_loss: 2.4679, test_f1: 0.6275
 epoch: 75, train_loss: 0.1635, test_loss: 2.4409, test_f1: 0.6522
 epoch: 76, train_loss: 0.1280, test_loss: 2.3750, test_f1: 0.6588
 epoch: 77, train_loss: 0.1632, test_loss: 2.4477, test_f1: 0.6373
 epoch: 78, train_loss: 0.1440, test_loss: 2.5473, test_f1: 0.6546
 epoch: 79, train_loss: 0.1549, test_loss: 2.5586, test_f1: 0.6606
 epoch: 80, train_loss: 0.1586, test_loss: 2.5465, test_f1: 0.6452
 epoch: 81, train_loss: 0.1465, test_loss: 2.4382, test_f1: 0.6711
 epoch: 82, train_loss: 0.1384, test_loss: 2.5723, test_f1: 0.6505
 epoch: 83, train_loss: 0.1504, test_loss: 2.5053, test_f1: 0.6415
 epoch: 84, train_loss: 0.1592, test_loss: 2.5666, test_f1: 0.6373
 epoch: 85, train_loss: 0.1417, test_loss: 2.7195, test_f1: 0.6362
 epoch: 86, train_loss: 0.1290, test_loss: 2.8924, test_f1: 0.6271
 epoch: 87, train_loss: 0.1412, test_loss: 2.5921, test_f1: 0.6393
 epoch: 88, train_loss: 0.1517, test_loss: 2.7411, test_f1: 0.6518
 epoch: 89, train_loss: 0.1617, test_loss: 2.5212, test_f1: 0.6538
 epoch: 90, train_loss: 0.1394, test_loss: 2.7092, test_f1: 0.6535
 epoch: 91, train_loss: 0.1381, test_loss: 2.8962, test_f1: 0.6327
 epoch: 92, train_loss: 0.1643, test_loss: 2.7124, test_f1: 0.6390
 epoch: 93, train_loss: 0.1345, test_loss: 2.6981, test_f1: 0.6499
 epoch: 94, train_loss: 0.1234, test_loss: 2.7585, test_f1: 0.6426
 epoch: 95, train_loss: 0.1120, test_loss: 2.7913, test_f1: 0.6714
 epoch: 96, train_loss: 0.1349, test_loss: 3.1138, test_f1: 0.6275
 epoch: 97, train_loss: 0.1404, test_loss: 2.7140, test_f1: 0.6563
 epoch: 98, train_loss: 0.1450, test_loss: 2.6628, test_f1: 0.6696
 epoch: 99, train_loss: 0.1145, test_loss: 2.6846, test_f1: 0.6627
##################ITERATION #1 ****************************************
 epoch: 0, train_loss: 1.0772, test_loss: 1.4535, test_f1: 0.2281
 epoch: 1, train_loss: 0.9389, test_loss: 1.2144, test_f1: 0.3957
 epoch: 2, train_loss: 0.8913, test_loss: 1.0044, test_f1: 0.5282
 epoch: 3, train_loss: 0.8529, test_loss: 1.0018, test_f1: 0.5549
 epoch: 4, train_loss: 0.8126, test_loss: 1.0065, test_f1: 0.5584
 epoch: 5, train_loss: 0.7827, test_loss: 1.0252, test_f1: 0.5820
 epoch: 6, train_loss: 0.7512, test_loss: 1.0336, test_f1: 0.5894
 epoch: 7, train_loss: 0.7047, test_loss: 1.0741, test_f1: 0.5902
 epoch: 8, train_loss: 0.7185, test_loss: 1.0414, test_f1: 0.5698
 epoch: 9, train_loss: 0.6941, test_loss: 1.0391, test_f1: 0.5346
 epoch: 10, train_loss: 0.6765, test_loss: 1.0227, test_f1: 0.6210
 epoch: 11, train_loss: 0.6559, test_loss: 1.1485, test_f1: 0.5759
 epoch: 12, train_loss: 0.6302, test_loss: 1.0941, test_f1: 0.6160
 epoch: 13, train_loss: 0.6150, test_loss: 1.1440, test_f1: 0.6281
 epoch: 14, train_loss: 0.6153, test_loss: 1.0785, test_f1: 0.6449
 epoch: 15, train_loss: 0.5963, test_loss: 1.1524, test_f1: 0.5576
 epoch: 16, train_loss: 0.5604, test_loss: 1.2172, test_f1: 0.6033
 epoch: 17, train_loss: 0.5577, test_loss: 1.0857, test_f1: 0.6004
 epoch: 18, train_loss: 0.5633, test_loss: 1.1146, test_f1: 0.6138
 epoch: 19, train_loss: 0.5237, test_loss: 1.2334, test_f1: 0.5888
 epoch: 20, train_loss: 0.4982, test_loss: 1.3380, test_f1: 0.6256
 epoch: 21, train_loss: 0.5254, test_loss: 1.1936, test_f1: 0.6154
 epoch: 22, train_loss: 0.4829, test_loss: 1.1090, test_f1: 0.6506
 epoch: 23, train_loss: 0.4787, test_loss: 1.2814, test_f1: 0.5914
 epoch: 24, train_loss: 0.4770, test_loss: 1.3594, test_f1: 0.6085
 epoch: 25, train_loss: 0.4463, test_loss: 1.4607, test_f1: 0.6349
 epoch: 26, train_loss: 0.4556, test_loss: 1.3361, test_f1: 0.6260
 epoch: 27, train_loss: 0.4467, test_loss: 1.3293, test_f1: 0.6372
 epoch: 28, train_loss: 0.4484, test_loss: 1.4351, test_f1: 0.6357
 epoch: 29, train_loss: 0.4455, test_loss: 1.4739, test_f1: 0.5942
 epoch: 30, train_loss: 0.4251, test_loss: 1.5636, test_f1: 0.6093
 epoch: 31, train_loss: 0.4105, test_loss: 1.6084, test_f1: 0.5369
 epoch: 32, train_loss: 0.3851, test_loss: 1.7374, test_f1: 0.5615
 epoch: 33, train_loss: 0.3998, test_loss: 1.6400, test_f1: 0.5465
 epoch: 34, train_loss: 0.4268, test_loss: 1.4633, test_f1: 0.5931
 epoch: 35, train_loss: 0.3568, test_loss: 1.5168, test_f1: 0.6416
 epoch: 36, train_loss: 0.3572, test_loss: 1.5691, test_f1: 0.5809
 epoch: 37, train_loss: 0.3862, test_loss: 1.5772, test_f1: 0.6221
 epoch: 38, train_loss: 0.3173, test_loss: 1.5852, test_f1: 0.6163
 epoch: 39, train_loss: 0.3238, test_loss: 1.6876, test_f1: 0.6148
 epoch: 40, train_loss: 0.3061, test_loss: 1.7828, test_f1: 0.6230
 epoch: 41, train_loss: 0.3172, test_loss: 1.8278, test_f1: 0.5991
 epoch: 42, train_loss: 0.3113, test_loss: 1.6271, test_f1: 0.6203
 epoch: 43, train_loss: 0.3121, test_loss: 1.7897, test_f1: 0.6193
 epoch: 44, train_loss: 0.3078, test_loss: 1.9057, test_f1: 0.6147
 epoch: 45, train_loss: 0.3122, test_loss: 2.0956, test_f1: 0.5793
 epoch: 46, train_loss: 0.2986, test_loss: 1.9749, test_f1: 0.6311
 epoch: 47, train_loss: 0.2919, test_loss: 2.0677, test_f1: 0.6254
 epoch: 48, train_loss: 0.2596, test_loss: 1.9690, test_f1: 0.6070
 epoch: 49, train_loss: 0.2691, test_loss: 2.1164, test_f1: 0.6413
 epoch: 50, train_loss: 0.2414, test_loss: 1.9089, test_f1: 0.6350
 epoch: 51, train_loss: 0.2190, test_loss: 2.0115, test_f1: 0.6353
 epoch: 52, train_loss: 0.2037, test_loss: 2.0324, test_f1: 0.6233
 epoch: 53, train_loss: 0.1994, test_loss: 2.0592, test_f1: 0.6357
 epoch: 54, train_loss: 0.1919, test_loss: 2.2231, test_f1: 0.6313
 epoch: 55, train_loss: 0.2008, test_loss: 2.1339, test_f1: 0.6314
 epoch: 56, train_loss: 0.1712, test_loss: 2.1600, test_f1: 0.6015
 epoch: 57, train_loss: 0.1910, test_loss: 2.1564, test_f1: 0.6291
 epoch: 58, train_loss: 0.1792, test_loss: 2.2611, test_f1: 0.6096
 epoch: 59, train_loss: 0.1572, test_loss: 2.3021, test_f1: 0.6011
 epoch: 60, train_loss: 0.1623, test_loss: 2.2248, test_f1: 0.6141
 epoch: 61, train_loss: 0.1756, test_loss: 2.3345, test_f1: 0.6127
 epoch: 62, train_loss: 0.1563, test_loss: 2.4568, test_f1: 0.6263
 epoch: 63, train_loss: 0.1732, test_loss: 2.3240, test_f1: 0.6336
 epoch: 64, train_loss: 0.1505, test_loss: 2.4121, test_f1: 0.6033
 epoch: 65, train_loss: 0.1474, test_loss: 2.5045, test_f1: 0.6278
 epoch: 66, train_loss: 0.1249, test_loss: 2.4934, test_f1: 0.6410
 epoch: 67, train_loss: 0.1715, test_loss: 2.4479, test_f1: 0.6226
 epoch: 68, train_loss: 0.1457, test_loss: 2.4718, test_f1: 0.6405
 epoch: 69, train_loss: 0.1569, test_loss: 2.6065, test_f1: 0.6369
 epoch: 70, train_loss: 0.1495, test_loss: 2.6183, test_f1: 0.6338
 epoch: 71, train_loss: 0.1351, test_loss: 2.5531, test_f1: 0.6197
 epoch: 72, train_loss: 0.1441, test_loss: 2.7863, test_f1: 0.6099
 epoch: 73, train_loss: 0.1227, test_loss: 2.6612, test_f1: 0.6202
 epoch: 74, train_loss: 0.1394, test_loss: 2.5675, test_f1: 0.6385
 epoch: 75, train_loss: 0.1344, test_loss: 2.7896, test_f1: 0.6338
 epoch: 76, train_loss: 0.1240, test_loss: 2.6482, test_f1: 0.6414
 epoch: 77, train_loss: 0.1215, test_loss: 2.8631, test_f1: 0.6090
 epoch: 78, train_loss: 0.1511, test_loss: 2.6896, test_f1: 0.6296
 epoch: 79, train_loss: 0.1572, test_loss: 2.9392, test_f1: 0.6079
 epoch: 80, train_loss: 0.1356, test_loss: 2.8304, test_f1: 0.6027
 epoch: 81, train_loss: 0.1396, test_loss: 2.7839, test_f1: 0.6018
 epoch: 82, train_loss: 0.1155, test_loss: 3.0006, test_f1: 0.6079
 epoch: 83, train_loss: 0.1311, test_loss: 2.6879, test_f1: 0.6078
 epoch: 84, train_loss: 0.1254, test_loss: 2.7103, test_f1: 0.6268
 epoch: 85, train_loss: 0.1308, test_loss: 3.0326, test_f1: 0.5965
 epoch: 86, train_loss: 0.1236, test_loss: 2.8293, test_f1: 0.6138
 epoch: 87, train_loss: 0.1150, test_loss: 2.9189, test_f1: 0.6194
 epoch: 88, train_loss: 0.1007, test_loss: 3.0317, test_f1: 0.6305
 epoch: 89, train_loss: 0.1091, test_loss: 3.0597, test_f1: 0.6133
 epoch: 90, train_loss: 0.0875, test_loss: 2.9208, test_f1: 0.5989
 epoch: 91, train_loss: 0.1197, test_loss: 2.9331, test_f1: 0.6194
 epoch: 92, train_loss: 0.1008, test_loss: 3.1319, test_f1: 0.6246
 epoch: 93, train_loss: 0.0986, test_loss: 3.0820, test_f1: 0.6407
 epoch: 94, train_loss: 0.0905, test_loss: 3.4448, test_f1: 0.6159
 epoch: 95, train_loss: 0.0998, test_loss: 3.0402, test_f1: 0.6287
 epoch: 96, train_loss: 0.1083, test_loss: 3.1254, test_f1: 0.6253
 epoch: 97, train_loss: 0.0896, test_loss: 3.1633, test_f1: 0.6304
 epoch: 98, train_loss: 0.0896, test_loss: 2.9400, test_f1: 0.6451
 epoch: 99, train_loss: 0.1068, test_loss: 3.3689, test_f1: 0.5905
##################ITERATION #2 ****************************************
 epoch: 0, train_loss: 1.1089, test_loss: 1.6689, test_f1: 0.1365
 epoch: 1, train_loss: 0.9838, test_loss: 1.3597, test_f1: 0.3529
 epoch: 2, train_loss: 0.8981, test_loss: 1.0647, test_f1: 0.5522
 epoch: 3, train_loss: 0.8425, test_loss: 1.0118, test_f1: 0.5559
 epoch: 4, train_loss: 0.8213, test_loss: 1.0382, test_f1: 0.5418
 epoch: 5, train_loss: 0.8076, test_loss: 1.0375, test_f1: 0.5232
 epoch: 6, train_loss: 0.7512, test_loss: 1.0524, test_f1: 0.5297
 epoch: 7, train_loss: 0.7486, test_loss: 1.0802, test_f1: 0.5272
 epoch: 8, train_loss: 0.7426, test_loss: 1.0818, test_f1: 0.5465
 epoch: 9, train_loss: 0.7316, test_loss: 1.0603, test_f1: 0.5631
 epoch: 10, train_loss: 0.6836, test_loss: 1.0886, test_f1: 0.5748
 epoch: 11, train_loss: 0.6899, test_loss: 1.0918, test_f1: 0.5692
 epoch: 12, train_loss: 0.6559, test_loss: 1.1412, test_f1: 0.5515
 epoch: 13, train_loss: 0.6362, test_loss: 1.0516, test_f1: 0.6123
 epoch: 14, train_loss: 0.6324, test_loss: 1.0644, test_f1: 0.5691
 epoch: 15, train_loss: 0.5780, test_loss: 1.0908, test_f1: 0.5983
 epoch: 16, train_loss: 0.6153, test_loss: 1.1430, test_f1: 0.5338
 epoch: 17, train_loss: 0.5886, test_loss: 1.1554, test_f1: 0.5473
 epoch: 18, train_loss: 0.5521, test_loss: 1.1712, test_f1: 0.5813
 epoch: 19, train_loss: 0.5701, test_loss: 1.3663, test_f1: 0.5475
 epoch: 20, train_loss: 0.5653, test_loss: 1.2232, test_f1: 0.5468
 epoch: 21, train_loss: 0.5226, test_loss: 1.3893, test_f1: 0.5806
 epoch: 22, train_loss: 0.5237, test_loss: 1.2860, test_f1: 0.5793
 epoch: 23, train_loss: 0.4868, test_loss: 1.3433, test_f1: 0.6226
 epoch: 24, train_loss: 0.4921, test_loss: 1.5563, test_f1: 0.5266
 epoch: 25, train_loss: 0.5248, test_loss: 1.3728, test_f1: 0.5893
 epoch: 26, train_loss: 0.4855, test_loss: 1.3279, test_f1: 0.5396
 epoch: 27, train_loss: 0.4573, test_loss: 1.4393, test_f1: 0.5762
 epoch: 28, train_loss: 0.4451, test_loss: 1.4059, test_f1: 0.6182
 epoch: 29, train_loss: 0.4677, test_loss: 1.2593, test_f1: 0.6049
 epoch: 30, train_loss: 0.4358, test_loss: 1.4403, test_f1: 0.5888
 epoch: 31, train_loss: 0.4318, test_loss: 1.3734, test_f1: 0.6055
 epoch: 32, train_loss: 0.4151, test_loss: 1.6122, test_f1: 0.5820
 epoch: 33, train_loss: 0.4059, test_loss: 1.4679, test_f1: 0.5858
 epoch: 34, train_loss: 0.3964, test_loss: 1.3852, test_f1: 0.5970
 epoch: 35, train_loss: 0.4069, test_loss: 1.4705, test_f1: 0.6134
 epoch: 36, train_loss: 0.3824, test_loss: 1.4871, test_f1: 0.5982
 epoch: 37, train_loss: 0.3595, test_loss: 1.3794, test_f1: 0.6159
 epoch: 38, train_loss: 0.3753, test_loss: 1.6513, test_f1: 0.5925
 epoch: 39, train_loss: 0.3519, test_loss: 1.5477, test_f1: 0.5894
 epoch: 40, train_loss: 0.3275, test_loss: 1.5951, test_f1: 0.6105
 epoch: 41, train_loss: 0.3572, test_loss: 1.6336, test_f1: 0.6193
 epoch: 42, train_loss: 0.3205, test_loss: 1.4914, test_f1: 0.6470
 epoch: 43, train_loss: 0.3187, test_loss: 1.6043, test_f1: 0.6240
 epoch: 44, train_loss: 0.3523, test_loss: 1.6130, test_f1: 0.6502
 epoch: 45, train_loss: 0.3305, test_loss: 1.6512, test_f1: 0.6105
 epoch: 46, train_loss: 0.2858, test_loss: 1.6853, test_f1: 0.6258
 epoch: 47, train_loss: 0.2718, test_loss: 1.7512, test_f1: 0.5902
 epoch: 48, train_loss: 0.3200, test_loss: 1.6640, test_f1: 0.5953
 epoch: 49, train_loss: 0.2827, test_loss: 1.7424, test_f1: 0.5677
 epoch: 50, train_loss: 0.2667, test_loss: 1.8663, test_f1: 0.6053
 epoch: 51, train_loss: 0.2632, test_loss: 1.8420, test_f1: 0.6279
 epoch: 52, train_loss: 0.2139, test_loss: 1.9269, test_f1: 0.6245
 epoch: 53, train_loss: 0.2098, test_loss: 1.8959, test_f1: 0.5924
 epoch: 54, train_loss: 0.2096, test_loss: 1.8420, test_f1: 0.6271
 epoch: 55, train_loss: 0.1946, test_loss: 1.7671, test_f1: 0.6449
 epoch: 56, train_loss: 0.2001, test_loss: 2.0710, test_f1: 0.5944
 epoch: 57, train_loss: 0.1877, test_loss: 1.9928, test_f1: 0.6200
 epoch: 58, train_loss: 0.1941, test_loss: 1.9004, test_f1: 0.6410
 epoch: 59, train_loss: 0.1891, test_loss: 2.1187, test_f1: 0.5807
 epoch: 60, train_loss: 0.1715, test_loss: 2.0181, test_f1: 0.6425
 epoch: 61, train_loss: 0.1693, test_loss: 2.1819, test_f1: 0.5817
 epoch: 62, train_loss: 0.1934, test_loss: 1.8854, test_f1: 0.6269
 epoch: 63, train_loss: 0.1878, test_loss: 2.0851, test_f1: 0.6103
 epoch: 64, train_loss: 0.1524, test_loss: 2.1531, test_f1: 0.6242
 epoch: 65, train_loss: 0.1568, test_loss: 2.1405, test_f1: 0.6086
 epoch: 66, train_loss: 0.1563, test_loss: 2.1426, test_f1: 0.6241
 epoch: 67, train_loss: 0.1812, test_loss: 2.2875, test_f1: 0.5664
 epoch: 68, train_loss: 0.1434, test_loss: 2.3442, test_f1: 0.5965
 epoch: 69, train_loss: 0.1465, test_loss: 2.1789, test_f1: 0.6138
 epoch: 70, train_loss: 0.1497, test_loss: 2.3572, test_f1: 0.5876
 epoch: 71, train_loss: 0.1603, test_loss: 2.2052, test_f1: 0.6203
 epoch: 72, train_loss: 0.1694, test_loss: 2.1813, test_f1: 0.6241
 epoch: 73, train_loss: 0.1606, test_loss: 2.2271, test_f1: 0.6307
 epoch: 74, train_loss: 0.1450, test_loss: 2.4474, test_f1: 0.5957
 epoch: 75, train_loss: 0.1541, test_loss: 2.2867, test_f1: 0.6181
 epoch: 76, train_loss: 0.1381, test_loss: 2.2732, test_f1: 0.6410
 epoch: 77, train_loss: 0.1413, test_loss: 2.6135, test_f1: 0.5754
 epoch: 78, train_loss: 0.1725, test_loss: 2.2729, test_f1: 0.6112
 epoch: 79, train_loss: 0.1332, test_loss: 2.3403, test_f1: 0.6126
 epoch: 80, train_loss: 0.1604, test_loss: 2.4857, test_f1: 0.5998
 epoch: 81, train_loss: 0.1371, test_loss: 2.4226, test_f1: 0.6272
 epoch: 82, train_loss: 0.1350, test_loss: 2.5511, test_f1: 0.5808
 epoch: 83, train_loss: 0.1440, test_loss: 2.4385, test_f1: 0.6227
 epoch: 84, train_loss: 0.1184, test_loss: 2.4621, test_f1: 0.6193
 epoch: 85, train_loss: 0.1327, test_loss: 2.5207, test_f1: 0.6099
 epoch: 86, train_loss: 0.1385, test_loss: 2.5655, test_f1: 0.5975
 epoch: 87, train_loss: 0.1305, test_loss: 2.4531, test_f1: 0.6336
 epoch: 88, train_loss: 0.1144, test_loss: 2.5794, test_f1: 0.5973
 epoch: 89, train_loss: 0.1193, test_loss: 2.6053, test_f1: 0.6346
 epoch: 90, train_loss: 0.1269, test_loss: 2.4996, test_f1: 0.6397
 epoch: 91, train_loss: 0.1177, test_loss: 2.6207, test_f1: 0.6105
 epoch: 92, train_loss: 0.1151, test_loss: 2.6849, test_f1: 0.6315
 epoch: 93, train_loss: 0.1031, test_loss: 2.6338, test_f1: 0.6147
 epoch: 94, train_loss: 0.1077, test_loss: 2.6556, test_f1: 0.6391
 epoch: 95, train_loss: 0.1345, test_loss: 2.7819, test_f1: 0.6078
 epoch: 96, train_loss: 0.1289, test_loss: 2.4680, test_f1: 0.6324
 epoch: 97, train_loss: 0.1252, test_loss: 2.5504, test_f1: 0.6291
 epoch: 98, train_loss: 0.1165, test_loss: 2.6860, test_f1: 0.6301
 epoch: 99, train_loss: 0.1142, test_loss: 2.5975, test_f1: 0.6216
##################ITERATION #3 ****************************************
 epoch: 0, train_loss: 1.1884, test_loss: 1.4890, test_f1: 0.2281
 epoch: 1, train_loss: 0.9452, test_loss: 1.1623, test_f1: 0.4577
 epoch: 2, train_loss: 0.8950, test_loss: 1.0524, test_f1: 0.5413
 epoch: 3, train_loss: 0.8755, test_loss: 1.0270, test_f1: 0.5462
 epoch: 4, train_loss: 0.8238, test_loss: 1.0081, test_f1: 0.5120
 epoch: 5, train_loss: 0.7895, test_loss: 1.0316, test_f1: 0.5629
 epoch: 6, train_loss: 0.7481, test_loss: 0.9772, test_f1: 0.5779
 epoch: 7, train_loss: 0.7204, test_loss: 1.0263, test_f1: 0.5952
 epoch: 8, train_loss: 0.7270, test_loss: 1.1140, test_f1: 0.5497
 epoch: 9, train_loss: 0.6938, test_loss: 1.0167, test_f1: 0.5787
 epoch: 10, train_loss: 0.6491, test_loss: 1.0473, test_f1: 0.6265
 epoch: 11, train_loss: 0.6467, test_loss: 1.0444, test_f1: 0.5692
 epoch: 12, train_loss: 0.6093, test_loss: 1.0741, test_f1: 0.5743
 epoch: 13, train_loss: 0.6112, test_loss: 1.0988, test_f1: 0.5693
 epoch: 14, train_loss: 0.5810, test_loss: 1.2054, test_f1: 0.5760
 epoch: 15, train_loss: 0.5676, test_loss: 1.0595, test_f1: 0.6665
 epoch: 16, train_loss: 0.5745, test_loss: 1.2508, test_f1: 0.5842
 epoch: 17, train_loss: 0.5691, test_loss: 1.0742, test_f1: 0.6490
 epoch: 18, train_loss: 0.5258, test_loss: 1.1161, test_f1: 0.6080
 epoch: 19, train_loss: 0.5397, test_loss: 1.0672, test_f1: 0.6373
 epoch: 20, train_loss: 0.5107, test_loss: 1.1548, test_f1: 0.6135
 epoch: 21, train_loss: 0.5004, test_loss: 1.1360, test_f1: 0.6160
 epoch: 22, train_loss: 0.4821, test_loss: 1.2443, test_f1: 0.6016
 epoch: 23, train_loss: 0.4530, test_loss: 1.2226, test_f1: 0.6231
 epoch: 24, train_loss: 0.4494, test_loss: 1.2456, test_f1: 0.6198
 epoch: 25, train_loss: 0.4654, test_loss: 1.2542, test_f1: 0.6418
 epoch: 26, train_loss: 0.4608, test_loss: 1.2441, test_f1: 0.6198
 epoch: 27, train_loss: 0.4204, test_loss: 1.2691, test_f1: 0.6393
 epoch: 28, train_loss: 0.4013, test_loss: 1.4337, test_f1: 0.5877
 epoch: 29, train_loss: 0.3903, test_loss: 1.3063, test_f1: 0.6388
 epoch: 30, train_loss: 0.3855, test_loss: 1.4603, test_f1: 0.5923
 epoch: 31, train_loss: 0.4053, test_loss: 1.5866, test_f1: 0.6146
 epoch: 32, train_loss: 0.3816, test_loss: 1.3509, test_f1: 0.6475
 epoch: 33, train_loss: 0.3501, test_loss: 1.3061, test_f1: 0.6309
 epoch: 34, train_loss: 0.3447, test_loss: 1.5750, test_f1: 0.6098
 epoch: 35, train_loss: 0.3271, test_loss: 1.4682, test_f1: 0.6346
 epoch: 36, train_loss: 0.3513, test_loss: 1.3543, test_f1: 0.6358
 epoch: 37, train_loss: 0.3510, test_loss: 1.4482, test_f1: 0.6781
 epoch: 38, train_loss: 0.3671, test_loss: 1.9122, test_f1: 0.5605
 epoch: 39, train_loss: 0.3167, test_loss: 1.8918, test_f1: 0.5930
 epoch: 40, train_loss: 0.3132, test_loss: 1.8721, test_f1: 0.5914
 epoch: 41, train_loss: 0.2850, test_loss: 1.8056, test_f1: 0.5943
 epoch: 42, train_loss: 0.2872, test_loss: 1.8289, test_f1: 0.5991
 epoch: 43, train_loss: 0.2637, test_loss: 1.8013, test_f1: 0.5694
 epoch: 44, train_loss: 0.2598, test_loss: 2.1381, test_f1: 0.6333
 epoch: 45, train_loss: 0.2657, test_loss: 1.9391, test_f1: 0.6209
 epoch: 46, train_loss: 0.2601, test_loss: 2.1912, test_f1: 0.6013
 epoch: 47, train_loss: 0.2820, test_loss: 2.0439, test_f1: 0.6223
 epoch: 48, train_loss: 0.2509, test_loss: 1.9538, test_f1: 0.6094
 epoch: 49, train_loss: 0.2596, test_loss: 1.6996, test_f1: 0.6526
 epoch: 50, train_loss: 0.2554, test_loss: 1.8002, test_f1: 0.6469
 epoch: 51, train_loss: 0.2297, test_loss: 1.7107, test_f1: 0.6526
 epoch: 52, train_loss: 0.1769, test_loss: 1.7849, test_f1: 0.6408
 epoch: 53, train_loss: 0.2141, test_loss: 1.7636, test_f1: 0.6781
 epoch: 54, train_loss: 0.1712, test_loss: 1.7871, test_f1: 0.6462
 epoch: 55, train_loss: 0.1821, test_loss: 2.1480, test_f1: 0.6228
 epoch: 56, train_loss: 0.1946, test_loss: 2.1130, test_f1: 0.6293
 epoch: 57, train_loss: 0.1808, test_loss: 2.1503, test_f1: 0.6141
 epoch: 58, train_loss: 0.1735, test_loss: 2.0539, test_f1: 0.5985
 epoch: 59, train_loss: 0.1794, test_loss: 2.0275, test_f1: 0.6211
 epoch: 60, train_loss: 0.1588, test_loss: 1.9330, test_f1: 0.6457
 epoch: 61, train_loss: 0.1400, test_loss: 2.0203, test_f1: 0.6063
 epoch: 62, train_loss: 0.1487, test_loss: 2.0182, test_f1: 0.6139
 epoch: 63, train_loss: 0.1354, test_loss: 2.1582, test_f1: 0.6217
 epoch: 64, train_loss: 0.1527, test_loss: 1.9705, test_f1: 0.6254
 epoch: 65, train_loss: 0.1497, test_loss: 2.1945, test_f1: 0.5920
 epoch: 66, train_loss: 0.1496, test_loss: 2.2623, test_f1: 0.6092
 epoch: 67, train_loss: 0.1371, test_loss: 2.2684, test_f1: 0.6154
 epoch: 68, train_loss: 0.1447, test_loss: 2.1593, test_f1: 0.6399
 epoch: 69, train_loss: 0.1384, test_loss: 2.1197, test_f1: 0.6569
 epoch: 70, train_loss: 0.1309, test_loss: 2.2147, test_f1: 0.6628
 epoch: 71, train_loss: 0.1219, test_loss: 2.3731, test_f1: 0.6187
 epoch: 72, train_loss: 0.1366, test_loss: 2.3935, test_f1: 0.6148
 epoch: 73, train_loss: 0.1437, test_loss: 2.4016, test_f1: 0.6005
 epoch: 74, train_loss: 0.1207, test_loss: 2.4746, test_f1: 0.5993
 epoch: 75, train_loss: 0.1230, test_loss: 2.3455, test_f1: 0.6189
 epoch: 76, train_loss: 0.1298, test_loss: 2.4482, test_f1: 0.5948
 epoch: 77, train_loss: 0.1217, test_loss: 2.5218, test_f1: 0.5978
 epoch: 78, train_loss: 0.1226, test_loss: 2.3581, test_f1: 0.6194
 epoch: 79, train_loss: 0.1200, test_loss: 2.6063, test_f1: 0.5991
 epoch: 80, train_loss: 0.1386, test_loss: 2.4360, test_f1: 0.6186
 epoch: 81, train_loss: 0.1409, test_loss: 2.3957, test_f1: 0.6305
 epoch: 82, train_loss: 0.1143, test_loss: 2.5855, test_f1: 0.6162
 epoch: 83, train_loss: 0.1368, test_loss: 2.7142, test_f1: 0.5774
 epoch: 84, train_loss: 0.1133, test_loss: 2.5385, test_f1: 0.6174
 epoch: 85, train_loss: 0.1106, test_loss: 2.5286, test_f1: 0.6120
 epoch: 86, train_loss: 0.0936, test_loss: 2.5998, test_f1: 0.6170
 epoch: 87, train_loss: 0.1033, test_loss: 2.5536, test_f1: 0.6334
 epoch: 88, train_loss: 0.1186, test_loss: 2.6103, test_f1: 0.6043
 epoch: 89, train_loss: 0.1041, test_loss: 2.6814, test_f1: 0.6012
 epoch: 90, train_loss: 0.1060, test_loss: 2.5699, test_f1: 0.6163
 epoch: 91, train_loss: 0.0986, test_loss: 2.8050, test_f1: 0.6263
 epoch: 92, train_loss: 0.0985, test_loss: 2.6799, test_f1: 0.6236
 epoch: 93, train_loss: 0.0932, test_loss: 2.6700, test_f1: 0.6056
 epoch: 94, train_loss: 0.0973, test_loss: 2.6032, test_f1: 0.6263
 epoch: 95, train_loss: 0.0963, test_loss: 2.8287, test_f1: 0.6026
 epoch: 96, train_loss: 0.1162, test_loss: 2.6692, test_f1: 0.6232
 epoch: 97, train_loss: 0.1159, test_loss: 2.8048, test_f1: 0.6313
 epoch: 98, train_loss: 0.1053, test_loss: 2.8303, test_f1: 0.6260
 epoch: 99, train_loss: 0.0999, test_loss: 2.5408, test_f1: 0.6226
##################ITERATION #4 ****************************************
 epoch: 0, train_loss: 1.3452, test_loss: 1.5380, test_f1: 0.3124
 epoch: 1, train_loss: 1.0391, test_loss: 1.3062, test_f1: 0.3521
 epoch: 2, train_loss: 0.8960, test_loss: 1.0671, test_f1: 0.5213
 epoch: 3, train_loss: 0.8550, test_loss: 1.1259, test_f1: 0.5132
 epoch: 4, train_loss: 0.8291, test_loss: 1.1346, test_f1: 0.5358
 epoch: 5, train_loss: 0.7938, test_loss: 1.1594, test_f1: 0.5304
 epoch: 6, train_loss: 0.7667, test_loss: 1.1284, test_f1: 0.5784
 epoch: 7, train_loss: 0.7367, test_loss: 1.2702, test_f1: 0.5022
 epoch: 8, train_loss: 0.7390, test_loss: 1.2239, test_f1: 0.5255
 epoch: 9, train_loss: 0.7182, test_loss: 1.1526, test_f1: 0.5474
 epoch: 10, train_loss: 0.7035, test_loss: 1.2373, test_f1: 0.5087
 epoch: 11, train_loss: 0.6693, test_loss: 1.2450, test_f1: 0.5520
 epoch: 12, train_loss: 0.6348, test_loss: 1.2352, test_f1: 0.5378
 epoch: 13, train_loss: 0.6171, test_loss: 1.3248, test_f1: 0.5677
 epoch: 14, train_loss: 0.6151, test_loss: 1.2219, test_f1: 0.5726
 epoch: 15, train_loss: 0.5962, test_loss: 1.2725, test_f1: 0.6008
 epoch: 16, train_loss: 0.5760, test_loss: 1.2264, test_f1: 0.6155
 epoch: 17, train_loss: 0.5989, test_loss: 1.7994, test_f1: 0.5338
 epoch: 18, train_loss: 0.5770, test_loss: 1.3608, test_f1: 0.5898
 epoch: 19, train_loss: 0.5566, test_loss: 1.4205, test_f1: 0.5828
 epoch: 20, train_loss: 0.5319, test_loss: 1.3527, test_f1: 0.5817
 epoch: 21, train_loss: 0.5210, test_loss: 1.2811, test_f1: 0.6158
 epoch: 22, train_loss: 0.5144, test_loss: 1.4350, test_f1: 0.6175
 epoch: 23, train_loss: 0.4911, test_loss: 1.4621, test_f1: 0.5690
 epoch: 24, train_loss: 0.4818, test_loss: 1.3639, test_f1: 0.5844
 epoch: 25, train_loss: 0.4537, test_loss: 1.9212, test_f1: 0.5109
 epoch: 26, train_loss: 0.4271, test_loss: 1.4762, test_f1: 0.6085
 epoch: 27, train_loss: 0.4681, test_loss: 1.8028, test_f1: 0.4974
 epoch: 28, train_loss: 0.4502, test_loss: 1.7016, test_f1: 0.5779
 epoch: 29, train_loss: 0.4540, test_loss: 1.6381, test_f1: 0.6022
 epoch: 30, train_loss: 0.4247, test_loss: 1.7223, test_f1: 0.5284
 epoch: 31, train_loss: 0.4445, test_loss: 1.8483, test_f1: 0.5365
 epoch: 32, train_loss: 0.4064, test_loss: 1.7140, test_f1: 0.6040
 epoch: 33, train_loss: 0.3893, test_loss: 1.9355, test_f1: 0.5598
 epoch: 34, train_loss: 0.3811, test_loss: 1.7576, test_f1: 0.5953
 epoch: 35, train_loss: 0.3817, test_loss: 1.6022, test_f1: 0.5971
 epoch: 36, train_loss: 0.3940, test_loss: 2.0008, test_f1: 0.5514
 epoch: 37, train_loss: 0.3317, test_loss: 1.8501, test_f1: 0.6038
 epoch: 38, train_loss: 0.3666, test_loss: 1.8508, test_f1: 0.6090
 epoch: 39, train_loss: 0.3522, test_loss: 2.1012, test_f1: 0.5478
 epoch: 40, train_loss: 0.3280, test_loss: 2.1474, test_f1: 0.5850
 epoch: 41, train_loss: 0.3470, test_loss: 2.0345, test_f1: 0.6214
 epoch: 42, train_loss: 0.3415, test_loss: 1.7035, test_f1: 0.6059
 epoch: 43, train_loss: 0.3119, test_loss: 1.9764, test_f1: 0.5716
 epoch: 44, train_loss: 0.2922, test_loss: 2.6703, test_f1: 0.4867
 epoch: 45, train_loss: 0.2919, test_loss: 1.9655, test_f1: 0.5721
 epoch: 46, train_loss: 0.3314, test_loss: 2.1268, test_f1: 0.5872
 epoch: 47, train_loss: 0.3025, test_loss: 2.1719, test_f1: 0.6012
 epoch: 48, train_loss: 0.3177, test_loss: 2.2938, test_f1: 0.5999
 epoch: 49, train_loss: 0.2807, test_loss: 2.2038, test_f1: 0.6003
 epoch: 50, train_loss: 0.2779, test_loss: 2.2046, test_f1: 0.5466
 epoch: 51, train_loss: 0.2473, test_loss: 1.9971, test_f1: 0.6065
 epoch: 52, train_loss: 0.1979, test_loss: 2.4434, test_f1: 0.5948
 epoch: 53, train_loss: 0.1894, test_loss: 2.5222, test_f1: 0.5662
 epoch: 54, train_loss: 0.2177, test_loss: 2.4560, test_f1: 0.6155
 epoch: 55, train_loss: 0.2070, test_loss: 2.4376, test_f1: 0.6070
 epoch: 56, train_loss: 0.1776, test_loss: 2.2728, test_f1: 0.6016
 epoch: 57, train_loss: 0.1835, test_loss: 2.5044, test_f1: 0.5974
 epoch: 58, train_loss: 0.1700, test_loss: 2.6640, test_f1: 0.5403
 epoch: 59, train_loss: 0.1612, test_loss: 2.3997, test_f1: 0.5951
 epoch: 60, train_loss: 0.1721, test_loss: 2.5703, test_f1: 0.5841
 epoch: 61, train_loss: 0.1603, test_loss: 2.4825, test_f1: 0.6079
 epoch: 62, train_loss: 0.1869, test_loss: 2.7591, test_f1: 0.5668
 epoch: 63, train_loss: 0.1830, test_loss: 2.4674, test_f1: 0.5792
 epoch: 64, train_loss: 0.1727, test_loss: 2.4240, test_f1: 0.5976
 epoch: 65, train_loss: 0.1561, test_loss: 2.5818, test_f1: 0.6160
 epoch: 66, train_loss: 0.1747, test_loss: 2.7620, test_f1: 0.5875
 epoch: 67, train_loss: 0.1559, test_loss: 2.6181, test_f1: 0.5870
 epoch: 68, train_loss: 0.1769, test_loss: 2.5653, test_f1: 0.6245
 epoch: 69, train_loss: 0.1454, test_loss: 2.7481, test_f1: 0.5726
 epoch: 70, train_loss: 0.1529, test_loss: 2.7922, test_f1: 0.5937
 epoch: 71, train_loss: 0.1498, test_loss: 2.6347, test_f1: 0.6036
 epoch: 72, train_loss: 0.1435, test_loss: 2.8196, test_f1: 0.6036
 epoch: 73, train_loss: 0.1394, test_loss: 2.6876, test_f1: 0.6000
 epoch: 74, train_loss: 0.1352, test_loss: 2.6764, test_f1: 0.6191
 epoch: 75, train_loss: 0.1389, test_loss: 3.1101, test_f1: 0.5685
 epoch: 76, train_loss: 0.1429, test_loss: 2.7872, test_f1: 0.6030
 epoch: 77, train_loss: 0.1383, test_loss: 3.0043, test_f1: 0.5710
 epoch: 78, train_loss: 0.1736, test_loss: 2.5362, test_f1: 0.6229
 epoch: 79, train_loss: 0.1432, test_loss: 3.0304, test_f1: 0.5703
 epoch: 80, train_loss: 0.1400, test_loss: 2.8218, test_f1: 0.5934
 epoch: 81, train_loss: 0.1903, test_loss: 3.0675, test_f1: 0.5888
 epoch: 82, train_loss: 0.1440, test_loss: 2.7983, test_f1: 0.5922
 epoch: 83, train_loss: 0.1460, test_loss: 3.0078, test_f1: 0.6270
 epoch: 84, train_loss: 0.1147, test_loss: 2.8967, test_f1: 0.6017
 epoch: 85, train_loss: 0.1297, test_loss: 3.0171, test_f1: 0.5638
 epoch: 86, train_loss: 0.0963, test_loss: 2.7509, test_f1: 0.5895
 epoch: 87, train_loss: 0.1220, test_loss: 2.7160, test_f1: 0.6031
 epoch: 88, train_loss: 0.1003, test_loss: 2.9283, test_f1: 0.6025
 epoch: 89, train_loss: 0.1115, test_loss: 3.2003, test_f1: 0.5504
 epoch: 90, train_loss: 0.1149, test_loss: 2.8771, test_f1: 0.5873
 epoch: 91, train_loss: 0.1121, test_loss: 2.9699, test_f1: 0.5930
 epoch: 92, train_loss: 0.1613, test_loss: 2.9521, test_f1: 0.6283
 epoch: 93, train_loss: 0.1130, test_loss: 3.0048, test_f1: 0.5920
 epoch: 94, train_loss: 0.1274, test_loss: 2.9368, test_f1: 0.6110
 epoch: 95, train_loss: 0.1468, test_loss: 2.8716, test_f1: 0.6330
 epoch: 96, train_loss: 0.1254, test_loss: 2.8561, test_f1: 0.5923
 epoch: 97, train_loss: 0.1115, test_loss: 2.8469, test_f1: 0.5956
 epoch: 98, train_loss: 0.1159, test_loss: 3.0401, test_f1: 0.5975
 epoch: 99, train_loss: 0.1201, test_loss: 3.3476, test_f1: 0.5666
##################ITERATION #5 ****************************************
 epoch: 0, train_loss: 1.4608, test_loss: 1.4877, test_f1: 0.2285
 epoch: 1, train_loss: 1.0359, test_loss: 1.1124, test_f1: 0.4470
 epoch: 2, train_loss: 0.9244, test_loss: 1.0695, test_f1: 0.4783
 epoch: 3, train_loss: 0.8707, test_loss: 1.1301, test_f1: 0.5475
 epoch: 4, train_loss: 0.8333, test_loss: 1.0991, test_f1: 0.5417
 epoch: 5, train_loss: 0.8051, test_loss: 1.0365, test_f1: 0.5931
 epoch: 6, train_loss: 0.7619, test_loss: 1.1183, test_f1: 0.5344
 epoch: 7, train_loss: 0.7331, test_loss: 1.1185, test_f1: 0.6023
 epoch: 8, train_loss: 0.7001, test_loss: 1.1106, test_f1: 0.5768
 epoch: 9, train_loss: 0.7152, test_loss: 1.1783, test_f1: 0.5870
 epoch: 10, train_loss: 0.6925, test_loss: 1.1827, test_f1: 0.5805
 epoch: 11, train_loss: 0.6507, test_loss: 1.1646, test_f1: 0.6169
 epoch: 12, train_loss: 0.6327, test_loss: 1.2122, test_f1: 0.5322
 epoch: 13, train_loss: 0.6468, test_loss: 1.1984, test_f1: 0.5447
 epoch: 14, train_loss: 0.6277, test_loss: 1.1340, test_f1: 0.6192
 epoch: 15, train_loss: 0.6302, test_loss: 1.3153, test_f1: 0.5592
 epoch: 16, train_loss: 0.6207, test_loss: 1.2777, test_f1: 0.5929
 epoch: 17, train_loss: 0.5944, test_loss: 1.2199, test_f1: 0.5748
 epoch: 18, train_loss: 0.5670, test_loss: 1.2097, test_f1: 0.5684
 epoch: 19, train_loss: 0.5425, test_loss: 1.2398, test_f1: 0.6423
 epoch: 20, train_loss: 0.5231, test_loss: 1.2750, test_f1: 0.5964
 epoch: 21, train_loss: 0.5016, test_loss: 1.3149, test_f1: 0.5817
 epoch: 22, train_loss: 0.4978, test_loss: 1.3504, test_f1: 0.5959
 epoch: 23, train_loss: 0.4887, test_loss: 1.3617, test_f1: 0.5995
 epoch: 24, train_loss: 0.5104, test_loss: 1.3289, test_f1: 0.6085
 epoch: 25, train_loss: 0.5106, test_loss: 1.3461, test_f1: 0.6079
 epoch: 26, train_loss: 0.5044, test_loss: 1.4050, test_f1: 0.5912
 epoch: 27, train_loss: 0.4736, test_loss: 1.3387, test_f1: 0.5922
 epoch: 28, train_loss: 0.4405, test_loss: 1.4291, test_f1: 0.6232
 epoch: 29, train_loss: 0.4427, test_loss: 1.3516, test_f1: 0.6270
 epoch: 30, train_loss: 0.4215, test_loss: 1.3939, test_f1: 0.6209
 epoch: 31, train_loss: 0.3976, test_loss: 1.3991, test_f1: 0.6226
 epoch: 32, train_loss: 0.4052, test_loss: 1.6401, test_f1: 0.5539
 epoch: 33, train_loss: 0.4155, test_loss: 1.5890, test_f1: 0.6223
 epoch: 34, train_loss: 0.3795, test_loss: 1.5177, test_f1: 0.6352
 epoch: 35, train_loss: 0.3900, test_loss: 1.5708, test_f1: 0.6157
 epoch: 36, train_loss: 0.3871, test_loss: 1.4944, test_f1: 0.6014
 epoch: 37, train_loss: 0.3668, test_loss: 1.4920, test_f1: 0.6087
 epoch: 38, train_loss: 0.3625, test_loss: 1.8427, test_f1: 0.5408
 epoch: 39, train_loss: 0.3463, test_loss: 1.6722, test_f1: 0.6508
 epoch: 40, train_loss: 0.3583, test_loss: 1.7724, test_f1: 0.6108
 epoch: 41, train_loss: 0.3563, test_loss: 1.7179, test_f1: 0.5927
 epoch: 42, train_loss: 0.3126, test_loss: 1.9075, test_f1: 0.5742
 epoch: 43, train_loss: 0.3089, test_loss: 1.6485, test_f1: 0.6513
 epoch: 44, train_loss: 0.3251, test_loss: 1.9461, test_f1: 0.5228
 epoch: 45, train_loss: 0.3586, test_loss: 1.7702, test_f1: 0.5850
 epoch: 46, train_loss: 0.3543, test_loss: 1.7905, test_f1: 0.5739
 epoch: 47, train_loss: 0.3385, test_loss: 1.8242, test_f1: 0.5637
 epoch: 48, train_loss: 0.2921, test_loss: 1.9720, test_f1: 0.5553
 epoch: 49, train_loss: 0.2931, test_loss: 1.7356, test_f1: 0.5771
 epoch: 50, train_loss: 0.2952, test_loss: 1.9162, test_f1: 0.6249
 epoch: 51, train_loss: 0.2949, test_loss: 1.8678, test_f1: 0.5713
 epoch: 52, train_loss: 0.2508, test_loss: 1.9089, test_f1: 0.6183
 epoch: 53, train_loss: 0.2359, test_loss: 1.9085, test_f1: 0.5901
 epoch: 54, train_loss: 0.2114, test_loss: 2.0859, test_f1: 0.5808
 epoch: 55, train_loss: 0.2121, test_loss: 2.1012, test_f1: 0.5773
 epoch: 56, train_loss: 0.2037, test_loss: 2.3176, test_f1: 0.5711
 epoch: 57, train_loss: 0.1789, test_loss: 2.1831, test_f1: 0.5854
 epoch: 58, train_loss: 0.2078, test_loss: 2.0234, test_f1: 0.6349
 epoch: 59, train_loss: 0.1966, test_loss: 2.2944, test_f1: 0.5647
 epoch: 60, train_loss: 0.1813, test_loss: 2.1511, test_f1: 0.6012
 epoch: 61, train_loss: 0.1935, test_loss: 2.1338, test_f1: 0.6071
 epoch: 62, train_loss: 0.1752, test_loss: 2.1462, test_f1: 0.6072
 epoch: 63, train_loss: 0.1908, test_loss: 2.2943, test_f1: 0.5673
 epoch: 64, train_loss: 0.1845, test_loss: 2.0367, test_f1: 0.5942
 epoch: 65, train_loss: 0.1807, test_loss: 2.1904, test_f1: 0.5698
 epoch: 66, train_loss: 0.1937, test_loss: 2.2417, test_f1: 0.6045
 epoch: 67, train_loss: 0.1868, test_loss: 2.3854, test_f1: 0.5796
 epoch: 68, train_loss: 0.1747, test_loss: 2.2803, test_f1: 0.5911
 epoch: 69, train_loss: 0.1723, test_loss: 2.2268, test_f1: 0.5988
 epoch: 70, train_loss: 0.1706, test_loss: 2.3151, test_f1: 0.5837
 epoch: 71, train_loss: 0.1598, test_loss: 2.2116, test_f1: 0.5518
 epoch: 72, train_loss: 0.1623, test_loss: 2.2972, test_f1: 0.6063
 epoch: 73, train_loss: 0.1635, test_loss: 2.4574, test_f1: 0.5707
 epoch: 74, train_loss: 0.1602, test_loss: 2.2725, test_f1: 0.5881
 epoch: 75, train_loss: 0.1606, test_loss: 2.3994, test_f1: 0.5724
 epoch: 76, train_loss: 0.1497, test_loss: 2.4015, test_f1: 0.5792
 epoch: 77, train_loss: 0.1533, test_loss: 2.4924, test_f1: 0.5667
 epoch: 78, train_loss: 0.1515, test_loss: 2.2038, test_f1: 0.6258
 epoch: 79, train_loss: 0.1489, test_loss: 2.4326, test_f1: 0.5878
 epoch: 80, train_loss: 0.1603, test_loss: 2.3006, test_f1: 0.5957
 epoch: 81, train_loss: 0.1583, test_loss: 2.5222, test_f1: 0.6069
 epoch: 82, train_loss: 0.1714, test_loss: 2.6505, test_f1: 0.5721
 epoch: 83, train_loss: 0.1610, test_loss: 2.4972, test_f1: 0.5907
 epoch: 84, train_loss: 0.1561, test_loss: 2.6160, test_f1: 0.5837
 epoch: 85, train_loss: 0.1524, test_loss: 2.6169, test_f1: 0.5865
 epoch: 86, train_loss: 0.1470, test_loss: 2.4601, test_f1: 0.5805
 epoch: 87, train_loss: 0.1309, test_loss: 2.6084, test_f1: 0.5867
 epoch: 88, train_loss: 0.1221, test_loss: 2.6556, test_f1: 0.5865
 epoch: 89, train_loss: 0.1081, test_loss: 2.4064, test_f1: 0.6413
 epoch: 90, train_loss: 0.1724, test_loss: 2.6997, test_f1: 0.5680
 epoch: 91, train_loss: 0.1577, test_loss: 2.5892, test_f1: 0.6141
 epoch: 92, train_loss: 0.1291, test_loss: 2.7966, test_f1: 0.5837
 epoch: 93, train_loss: 0.1297, test_loss: 2.6150, test_f1: 0.5862
 epoch: 94, train_loss: 0.1315, test_loss: 2.7243, test_f1: 0.5990
 epoch: 95, train_loss: 0.1137, test_loss: 2.6538, test_f1: 0.5891
 epoch: 96, train_loss: 0.1456, test_loss: 2.6179, test_f1: 0.5635
 epoch: 97, train_loss: 0.1349, test_loss: 2.6377, test_f1: 0.6142
 epoch: 98, train_loss: 0.1473, test_loss: 2.6087, test_f1: 0.6222
 epoch: 99, train_loss: 0.1435, test_loss: 2.6495, test_f1: 0.5816
##################ITERATION #6 ****************************************
 epoch: 0, train_loss: 1.5242, test_loss: 1.5667, test_f1: 0.3245
 epoch: 1, train_loss: 1.0346, test_loss: 1.2043, test_f1: 0.4609
 epoch: 2, train_loss: 0.9277, test_loss: 1.1123, test_f1: 0.5150
 epoch: 3, train_loss: 0.8518, test_loss: 1.1390, test_f1: 0.5253
 epoch: 4, train_loss: 0.8349, test_loss: 1.1326, test_f1: 0.5479
 epoch: 5, train_loss: 0.7752, test_loss: 1.0904, test_f1: 0.5749
 epoch: 6, train_loss: 0.7387, test_loss: 1.1459, test_f1: 0.5949
 epoch: 7, train_loss: 0.7210, test_loss: 1.1056, test_f1: 0.6253
 epoch: 8, train_loss: 0.7374, test_loss: 1.1818, test_f1: 0.5948
 epoch: 9, train_loss: 0.6855, test_loss: 1.1600, test_f1: 0.5348
 epoch: 10, train_loss: 0.6686, test_loss: 1.1728, test_f1: 0.5765
 epoch: 11, train_loss: 0.6509, test_loss: 1.2235, test_f1: 0.5501
 epoch: 12, train_loss: 0.6350, test_loss: 1.3524, test_f1: 0.5368
 epoch: 13, train_loss: 0.6304, test_loss: 1.1845, test_f1: 0.6272
 epoch: 14, train_loss: 0.6043, test_loss: 1.1519, test_f1: 0.6128
 epoch: 15, train_loss: 0.5680, test_loss: 1.2790, test_f1: 0.6110
 epoch: 16, train_loss: 0.5684, test_loss: 1.2702, test_f1: 0.5653
 epoch: 17, train_loss: 0.5573, test_loss: 1.2853, test_f1: 0.6222
 epoch: 18, train_loss: 0.5798, test_loss: 1.3920, test_f1: 0.5358
 epoch: 19, train_loss: 0.5551, test_loss: 1.3764, test_f1: 0.5719
 epoch: 20, train_loss: 0.5235, test_loss: 1.3301, test_f1: 0.6353
 epoch: 21, train_loss: 0.4842, test_loss: 1.4069, test_f1: 0.5896
 epoch: 22, train_loss: 0.5113, test_loss: 1.4045, test_f1: 0.6183
 epoch: 23, train_loss: 0.5158, test_loss: 1.2532, test_f1: 0.6325
 epoch: 24, train_loss: 0.4823, test_loss: 1.4491, test_f1: 0.6263
 epoch: 25, train_loss: 0.4362, test_loss: 1.4035, test_f1: 0.5984
 epoch: 26, train_loss: 0.4554, test_loss: 1.3507, test_f1: 0.6168
 epoch: 27, train_loss: 0.4641, test_loss: 1.4917, test_f1: 0.6361
 epoch: 28, train_loss: 0.4245, test_loss: 1.5801, test_f1: 0.5641
 epoch: 29, train_loss: 0.4018, test_loss: 1.5117, test_f1: 0.6227
 epoch: 30, train_loss: 0.4089, test_loss: 1.7147, test_f1: 0.5738
 epoch: 31, train_loss: 0.4223, test_loss: 1.5623, test_f1: 0.5978
 epoch: 32, train_loss: 0.3892, test_loss: 1.6373, test_f1: 0.5908
 epoch: 33, train_loss: 0.3783, test_loss: 1.7744, test_f1: 0.5918
 epoch: 34, train_loss: 0.3811, test_loss: 1.5495, test_f1: 0.5984
 epoch: 35, train_loss: 0.4054, test_loss: 1.6210, test_f1: 0.5918
 epoch: 36, train_loss: 0.3800, test_loss: 1.6730, test_f1: 0.6181
 epoch: 37, train_loss: 0.3527, test_loss: 1.6326, test_f1: 0.6026
 epoch: 38, train_loss: 0.3451, test_loss: 1.8357, test_f1: 0.5932
 epoch: 39, train_loss: 0.3372, test_loss: 1.9597, test_f1: 0.5332
 epoch: 40, train_loss: 0.3420, test_loss: 1.7071, test_f1: 0.5981
 epoch: 41, train_loss: 0.3280, test_loss: 2.0092, test_f1: 0.5937
 epoch: 42, train_loss: 0.3114, test_loss: 1.8756, test_f1: 0.6270
 epoch: 43, train_loss: 0.3248, test_loss: 1.7068, test_f1: 0.5950
 epoch: 44, train_loss: 0.3251, test_loss: 1.8244, test_f1: 0.5627
 epoch: 45, train_loss: 0.3135, test_loss: 1.9585, test_f1: 0.5978
 epoch: 46, train_loss: 0.2791, test_loss: 1.8460, test_f1: 0.5889
 epoch: 47, train_loss: 0.3012, test_loss: 2.0627, test_f1: 0.5924
 epoch: 48, train_loss: 0.2893, test_loss: 1.8776, test_f1: 0.6222
 epoch: 49, train_loss: 0.3042, test_loss: 1.9216, test_f1: 0.6233
 epoch: 50, train_loss: 0.2863, test_loss: 2.0496, test_f1: 0.6147
 epoch: 51, train_loss: 0.2744, test_loss: 1.9306, test_f1: 0.6232
 epoch: 52, train_loss: 0.2304, test_loss: 1.9961, test_f1: 0.6071
 epoch: 53, train_loss: 0.2057, test_loss: 2.1677, test_f1: 0.5996
 epoch: 54, train_loss: 0.2422, test_loss: 2.0615, test_f1: 0.6121
 epoch: 55, train_loss: 0.2315, test_loss: 1.9962, test_f1: 0.6193
 epoch: 56, train_loss: 0.2005, test_loss: 2.0728, test_f1: 0.6181
 epoch: 57, train_loss: 0.1822, test_loss: 2.1379, test_f1: 0.6260
 epoch: 58, train_loss: 0.1945, test_loss: 2.1649, test_f1: 0.6044
 epoch: 59, train_loss: 0.1981, test_loss: 2.0811, test_f1: 0.5989
 epoch: 60, train_loss: 0.2011, test_loss: 1.9656, test_f1: 0.6045
 epoch: 61, train_loss: 0.1784, test_loss: 2.0928, test_f1: 0.6270
 epoch: 62, train_loss: 0.1837, test_loss: 2.2923, test_f1: 0.5929
 epoch: 63, train_loss: 0.1927, test_loss: 2.1642, test_f1: 0.6191
 epoch: 64, train_loss: 0.1902, test_loss: 2.2333, test_f1: 0.5807
 epoch: 65, train_loss: 0.1895, test_loss: 2.1747, test_f1: 0.5869
 epoch: 66, train_loss: 0.1928, test_loss: 2.1251, test_f1: 0.5965
 epoch: 67, train_loss: 0.1673, test_loss: 2.2266, test_f1: 0.6093
 epoch: 68, train_loss: 0.1789, test_loss: 2.5163, test_f1: 0.5706
 epoch: 69, train_loss: 0.1599, test_loss: 2.2527, test_f1: 0.6306
 epoch: 70, train_loss: 0.1861, test_loss: 2.2135, test_f1: 0.6170
 epoch: 71, train_loss: 0.1592, test_loss: 2.2586, test_f1: 0.6174
 epoch: 72, train_loss: 0.1750, test_loss: 2.4436, test_f1: 0.5907
 epoch: 73, train_loss: 0.1892, test_loss: 2.4284, test_f1: 0.6110
 epoch: 74, train_loss: 0.1649, test_loss: 2.4210, test_f1: 0.5864
 epoch: 75, train_loss: 0.1743, test_loss: 2.3416, test_f1: 0.5907
 epoch: 76, train_loss: 0.1555, test_loss: 2.4838, test_f1: 0.5653
 epoch: 77, train_loss: 0.1566, test_loss: 2.3683, test_f1: 0.6104
 epoch: 78, train_loss: 0.1672, test_loss: 2.3742, test_f1: 0.6279
 epoch: 79, train_loss: 0.1412, test_loss: 2.3812, test_f1: 0.6091
 epoch: 80, train_loss: 0.1819, test_loss: 2.3890, test_f1: 0.5766
 epoch: 81, train_loss: 0.2140, test_loss: 2.4095, test_f1: 0.6105
 epoch: 82, train_loss: 0.1767, test_loss: 2.5872, test_f1: 0.5893
 epoch: 83, train_loss: 0.1622, test_loss: 2.5889, test_f1: 0.5896
 epoch: 84, train_loss: 0.1739, test_loss: 2.5928, test_f1: 0.5927
 epoch: 85, train_loss: 0.1589, test_loss: 2.4959, test_f1: 0.5981
 epoch: 86, train_loss: 0.1460, test_loss: 2.4869, test_f1: 0.6010
 epoch: 87, train_loss: 0.1239, test_loss: 2.4007, test_f1: 0.5909
 epoch: 88, train_loss: 0.1311, test_loss: 2.5943, test_f1: 0.6081
 epoch: 89, train_loss: 0.1305, test_loss: 2.4846, test_f1: 0.6048
 epoch: 90, train_loss: 0.1342, test_loss: 2.5184, test_f1: 0.6045
 epoch: 91, train_loss: 0.1486, test_loss: 2.3035, test_f1: 0.6146
 epoch: 92, train_loss: 0.1464, test_loss: 2.4678, test_f1: 0.5958
 epoch: 93, train_loss: 0.1500, test_loss: 2.4551, test_f1: 0.6069
 epoch: 94, train_loss: 0.1266, test_loss: 2.4802, test_f1: 0.6086
 epoch: 95, train_loss: 0.1135, test_loss: 2.4108, test_f1: 0.6187
 epoch: 96, train_loss: 0.1199, test_loss: 2.5716, test_f1: 0.5913
 epoch: 97, train_loss: 0.1320, test_loss: 2.5824, test_f1: 0.6058
 epoch: 98, train_loss: 0.1190, test_loss: 2.6600, test_f1: 0.6026
 epoch: 99, train_loss: 0.1164, test_loss: 2.5947, test_f1: 0.5998
##################ITERATION #7 ****************************************
 epoch: 0, train_loss: 1.6224, test_loss: 1.8386, test_f1: 0.1969
 epoch: 1, train_loss: 1.0713, test_loss: 1.2432, test_f1: 0.3642
 epoch: 2, train_loss: 0.9320, test_loss: 1.1144, test_f1: 0.5241
 epoch: 3, train_loss: 0.8681, test_loss: 1.1380, test_f1: 0.5424
 epoch: 4, train_loss: 0.8257, test_loss: 1.1501, test_f1: 0.5257
 epoch: 5, train_loss: 0.8078, test_loss: 1.1403, test_f1: 0.5757
 epoch: 6, train_loss: 0.7982, test_loss: 1.1600, test_f1: 0.5378
 epoch: 7, train_loss: 0.7692, test_loss: 1.1534, test_f1: 0.5104
 epoch: 8, train_loss: 0.7336, test_loss: 1.2067, test_f1: 0.5661
 epoch: 9, train_loss: 0.7178, test_loss: 1.3789, test_f1: 0.5607
 epoch: 10, train_loss: 0.7167, test_loss: 1.1534, test_f1: 0.6074
 epoch: 11, train_loss: 0.6922, test_loss: 1.3462, test_f1: 0.5295
 epoch: 12, train_loss: 0.6797, test_loss: 1.2316, test_f1: 0.5564
 epoch: 13, train_loss: 0.6619, test_loss: 1.3026, test_f1: 0.5515
 epoch: 14, train_loss: 0.6366, test_loss: 1.3546, test_f1: 0.5517
 epoch: 15, train_loss: 0.6071, test_loss: 1.2322, test_f1: 0.5840
 epoch: 16, train_loss: 0.5920, test_loss: 1.2654, test_f1: 0.6138
 epoch: 17, train_loss: 0.5773, test_loss: 1.3006, test_f1: 0.5904
 epoch: 18, train_loss: 0.5772, test_loss: 1.3320, test_f1: 0.6071
 epoch: 19, train_loss: 0.5619, test_loss: 1.3633, test_f1: 0.6156
 epoch: 20, train_loss: 0.5481, test_loss: 1.4349, test_f1: 0.5838
 epoch: 21, train_loss: 0.5044, test_loss: 1.4563, test_f1: 0.5565
 epoch: 22, train_loss: 0.5315, test_loss: 1.4865, test_f1: 0.5481
 epoch: 23, train_loss: 0.5126, test_loss: 1.4573, test_f1: 0.6389
 epoch: 24, train_loss: 0.5182, test_loss: 1.2935, test_f1: 0.6109
 epoch: 25, train_loss: 0.4957, test_loss: 1.5372, test_f1: 0.6240
 epoch: 26, train_loss: 0.4700, test_loss: 1.4920, test_f1: 0.5780
 epoch: 27, train_loss: 0.4705, test_loss: 1.4577, test_f1: 0.6090
 epoch: 28, train_loss: 0.4695, test_loss: 1.3944, test_f1: 0.6154
 epoch: 29, train_loss: 0.4662, test_loss: 1.6577, test_f1: 0.5958
 epoch: 30, train_loss: 0.4510, test_loss: 1.6454, test_f1: 0.5985
 epoch: 31, train_loss: 0.4250, test_loss: 1.6538, test_f1: 0.5951
 epoch: 32, train_loss: 0.4163, test_loss: 1.7183, test_f1: 0.5937
 epoch: 33, train_loss: 0.3957, test_loss: 1.6729, test_f1: 0.6016
 epoch: 34, train_loss: 0.4125, test_loss: 2.0553, test_f1: 0.5970
 epoch: 35, train_loss: 0.3975, test_loss: 1.6107, test_f1: 0.6181
 epoch: 36, train_loss: 0.3749, test_loss: 1.8715, test_f1: 0.5481
 epoch: 37, train_loss: 0.3888, test_loss: 1.6199, test_f1: 0.6513
 epoch: 38, train_loss: 0.3418, test_loss: 2.0774, test_f1: 0.5430
 epoch: 39, train_loss: 0.3861, test_loss: 1.8117, test_f1: 0.6087
 epoch: 40, train_loss: 0.3392, test_loss: 1.8021, test_f1: 0.5767
 epoch: 41, train_loss: 0.3195, test_loss: 1.8368, test_f1: 0.5966
 epoch: 42, train_loss: 0.3434, test_loss: 2.1656, test_f1: 0.5577
 epoch: 43, train_loss: 0.3131, test_loss: 2.0429, test_f1: 0.6027
 epoch: 44, train_loss: 0.2877, test_loss: 2.1413, test_f1: 0.5981
 epoch: 45, train_loss: 0.3065, test_loss: 2.1236, test_f1: 0.5835
 epoch: 46, train_loss: 0.3203, test_loss: 2.2267, test_f1: 0.5802
 epoch: 47, train_loss: 0.3277, test_loss: 1.9196, test_f1: 0.6100
 epoch: 48, train_loss: 0.3214, test_loss: 2.3899, test_f1: 0.6129
 epoch: 49, train_loss: 0.3176, test_loss: 2.0675, test_f1: 0.5803
 epoch: 50, train_loss: 0.3043, test_loss: 2.0331, test_f1: 0.6172
 epoch: 51, train_loss: 0.2722, test_loss: 2.1664, test_f1: 0.5797
 epoch: 52, train_loss: 0.2295, test_loss: 2.1046, test_f1: 0.6275
 epoch: 53, train_loss: 0.1980, test_loss: 2.2710, test_f1: 0.5824
 epoch: 54, train_loss: 0.2015, test_loss: 2.3352, test_f1: 0.5932
 epoch: 55, train_loss: 0.1813, test_loss: 2.3044, test_f1: 0.5935
 epoch: 56, train_loss: 0.1873, test_loss: 2.5309, test_f1: 0.5570
 epoch: 57, train_loss: 0.2176, test_loss: 2.3633, test_f1: 0.5844
 epoch: 58, train_loss: 0.1966, test_loss: 2.2610, test_f1: 0.5981
 epoch: 59, train_loss: 0.1830, test_loss: 2.3141, test_f1: 0.6084
 epoch: 60, train_loss: 0.1639, test_loss: 2.3801, test_f1: 0.6009
 epoch: 61, train_loss: 0.1853, test_loss: 2.6847, test_f1: 0.5628
 epoch: 62, train_loss: 0.1875, test_loss: 2.5189, test_f1: 0.5590
 epoch: 63, train_loss: 0.1901, test_loss: 2.2519, test_f1: 0.6352
 epoch: 64, train_loss: 0.1655, test_loss: 2.7134, test_f1: 0.5630
 epoch: 65, train_loss: 0.1617, test_loss: 2.4655, test_f1: 0.6193
 epoch: 66, train_loss: 0.1472, test_loss: 2.5008, test_f1: 0.5933
 epoch: 67, train_loss: 0.1698, test_loss: 2.6127, test_f1: 0.5789
 epoch: 68, train_loss: 0.1611, test_loss: 2.7569, test_f1: 0.5947
 epoch: 69, train_loss: 0.1709, test_loss: 2.5814, test_f1: 0.5798
 epoch: 70, train_loss: 0.1603, test_loss: 2.4825, test_f1: 0.6004
 epoch: 71, train_loss: 0.1517, test_loss: 2.4403, test_f1: 0.6045
 epoch: 72, train_loss: 0.1750, test_loss: 2.4356, test_f1: 0.6183
 epoch: 73, train_loss: 0.1636, test_loss: 2.4058, test_f1: 0.6290
 epoch: 74, train_loss: 0.1531, test_loss: 2.4697, test_f1: 0.6117
 epoch: 75, train_loss: 0.1507, test_loss: 2.4734, test_f1: 0.6024
 epoch: 76, train_loss: 0.1540, test_loss: 2.4921, test_f1: 0.6122
 epoch: 77, train_loss: 0.1381, test_loss: 2.4585, test_f1: 0.6155
 epoch: 78, train_loss: 0.1330, test_loss: 2.6294, test_f1: 0.6127
 epoch: 79, train_loss: 0.1415, test_loss: 2.4143, test_f1: 0.6335
 epoch: 80, train_loss: 0.1322, test_loss: 2.7795, test_f1: 0.5947
 epoch: 81, train_loss: 0.1260, test_loss: 2.9399, test_f1: 0.5923
 epoch: 82, train_loss: 0.1140, test_loss: 3.0298, test_f1: 0.6043
 epoch: 83, train_loss: 0.1552, test_loss: 2.6867, test_f1: 0.6054
 epoch: 84, train_loss: 0.1618, test_loss: 2.7246, test_f1: 0.6086
 epoch: 85, train_loss: 0.1675, test_loss: 2.5414, test_f1: 0.6352
 epoch: 86, train_loss: 0.1739, test_loss: 2.8489, test_f1: 0.6133
 epoch: 87, train_loss: 0.1337, test_loss: 2.9294, test_f1: 0.6096
 epoch: 88, train_loss: 0.1289, test_loss: 3.0313, test_f1: 0.5803
 epoch: 89, train_loss: 0.1141, test_loss: 2.7830, test_f1: 0.6142
 epoch: 90, train_loss: 0.1385, test_loss: 3.0007, test_f1: 0.5757
 epoch: 91, train_loss: 0.1363, test_loss: 2.9555, test_f1: 0.5789
 epoch: 92, train_loss: 0.1230, test_loss: 2.7551, test_f1: 0.6249
 epoch: 93, train_loss: 0.1128, test_loss: 2.9994, test_f1: 0.6321
 epoch: 94, train_loss: 0.1458, test_loss: 2.8301, test_f1: 0.6303
 epoch: 95, train_loss: 0.1279, test_loss: 2.9101, test_f1: 0.6149
 epoch: 96, train_loss: 0.1189, test_loss: 3.0049, test_f1: 0.6357
 epoch: 97, train_loss: 0.1241, test_loss: 2.8748, test_f1: 0.6225
 epoch: 98, train_loss: 0.0989, test_loss: 2.9093, test_f1: 0.5977
 epoch: 99, train_loss: 0.1352, test_loss: 2.6300, test_f1: 0.6330
##################ITERATION #8 ****************************************
 epoch: 0, train_loss: 1.7118, test_loss: 1.8822, test_f1: 0.2289
 epoch: 1, train_loss: 1.1683, test_loss: 1.2947, test_f1: 0.4195
 epoch: 2, train_loss: 0.9744, test_loss: 1.2190, test_f1: 0.5127
 epoch: 3, train_loss: 0.9220, test_loss: 1.1006, test_f1: 0.5503
 epoch: 4, train_loss: 0.8503, test_loss: 1.1049, test_f1: 0.5786
 epoch: 5, train_loss: 0.8362, test_loss: 1.0795, test_f1: 0.5979
 epoch: 6, train_loss: 0.7915, test_loss: 1.0587, test_f1: 0.5623
 epoch: 7, train_loss: 0.7874, test_loss: 1.1506, test_f1: 0.5512
 epoch: 8, train_loss: 0.7680, test_loss: 1.1398, test_f1: 0.5362
 epoch: 9, train_loss: 0.7073, test_loss: 1.1115, test_f1: 0.6009
 epoch: 10, train_loss: 0.7362, test_loss: 1.0906, test_f1: 0.5966
 epoch: 11, train_loss: 0.6889, test_loss: 1.1463, test_f1: 0.5603
 epoch: 12, train_loss: 0.6615, test_loss: 1.1786, test_f1: 0.5701
 epoch: 13, train_loss: 0.6576, test_loss: 1.1841, test_f1: 0.5915
 epoch: 14, train_loss: 0.6266, test_loss: 1.1791, test_f1: 0.6326
 epoch: 15, train_loss: 0.6250, test_loss: 1.2171, test_f1: 0.6023
 epoch: 16, train_loss: 0.6079, test_loss: 1.2748, test_f1: 0.5767
 epoch: 17, train_loss: 0.6139, test_loss: 1.2810, test_f1: 0.6074
 epoch: 18, train_loss: 0.6009, test_loss: 1.2959, test_f1: 0.5079
 epoch: 19, train_loss: 0.5825, test_loss: 1.2907, test_f1: 0.6036
 epoch: 20, train_loss: 0.5864, test_loss: 1.6325, test_f1: 0.5480
 epoch: 21, train_loss: 0.5510, test_loss: 1.3332, test_f1: 0.5980
 epoch: 22, train_loss: 0.5285, test_loss: 1.3810, test_f1: 0.5973
 epoch: 23, train_loss: 0.5159, test_loss: 1.3775, test_f1: 0.5937
 epoch: 24, train_loss: 0.5061, test_loss: 1.3844, test_f1: 0.5586
 epoch: 25, train_loss: 0.5129, test_loss: 1.4819, test_f1: 0.5631
 epoch: 26, train_loss: 0.4947, test_loss: 1.3858, test_f1: 0.6187
 epoch: 27, train_loss: 0.4902, test_loss: 1.5069, test_f1: 0.6535
 epoch: 28, train_loss: 0.4814, test_loss: 1.5753, test_f1: 0.5868
 epoch: 29, train_loss: 0.4910, test_loss: 1.3982, test_f1: 0.5971
 epoch: 30, train_loss: 0.4568, test_loss: 1.4972, test_f1: 0.5812
 epoch: 31, train_loss: 0.4302, test_loss: 1.6361, test_f1: 0.6373
 epoch: 32, train_loss: 0.4564, test_loss: 1.5452, test_f1: 0.6034
 epoch: 33, train_loss: 0.4107, test_loss: 1.7406, test_f1: 0.5799
 epoch: 34, train_loss: 0.3996, test_loss: 1.5211, test_f1: 0.6216
 epoch: 35, train_loss: 0.3796, test_loss: 1.7819, test_f1: 0.6276
 epoch: 36, train_loss: 0.4066, test_loss: 1.5684, test_f1: 0.6179
 epoch: 37, train_loss: 0.3995, test_loss: 1.5794, test_f1: 0.6275
 epoch: 38, train_loss: 0.4036, test_loss: 1.6613, test_f1: 0.6397
 epoch: 39, train_loss: 0.3673, test_loss: 1.6626, test_f1: 0.5725
 epoch: 40, train_loss: 0.3454, test_loss: 1.7852, test_f1: 0.6265
 epoch: 41, train_loss: 0.4216, test_loss: 1.4674, test_f1: 0.6234
 epoch: 42, train_loss: 0.3501, test_loss: 1.8844, test_f1: 0.6227
 epoch: 43, train_loss: 0.3781, test_loss: 1.7287, test_f1: 0.6050
 epoch: 44, train_loss: 0.3398, test_loss: 1.8008, test_f1: 0.6252
 epoch: 45, train_loss: 0.3480, test_loss: 1.6846, test_f1: 0.5721
 epoch: 46, train_loss: 0.3531, test_loss: 1.9820, test_f1: 0.5911
 epoch: 47, train_loss: 0.3461, test_loss: 1.7337, test_f1: 0.6236
 epoch: 48, train_loss: 0.3042, test_loss: 1.7452, test_f1: 0.5986
 epoch: 49, train_loss: 0.3271, test_loss: 1.9350, test_f1: 0.6026
 epoch: 50, train_loss: 0.3128, test_loss: 1.9434, test_f1: 0.6370
 epoch: 51, train_loss: 0.2915, test_loss: 1.8747, test_f1: 0.6376
 epoch: 52, train_loss: 0.2446, test_loss: 1.9556, test_f1: 0.6457
 epoch: 53, train_loss: 0.2576, test_loss: 1.9285, test_f1: 0.6351
 epoch: 54, train_loss: 0.2292, test_loss: 1.9429, test_f1: 0.6375
 epoch: 55, train_loss: 0.2328, test_loss: 1.9534, test_f1: 0.6139
 epoch: 56, train_loss: 0.2429, test_loss: 1.9905, test_f1: 0.6160
 epoch: 57, train_loss: 0.1975, test_loss: 2.0285, test_f1: 0.6210
 epoch: 58, train_loss: 0.2386, test_loss: 1.9812, test_f1: 0.6401
 epoch: 59, train_loss: 0.2251, test_loss: 2.1142, test_f1: 0.6244
 epoch: 60, train_loss: 0.2184, test_loss: 2.2387, test_f1: 0.5897
 epoch: 61, train_loss: 0.1985, test_loss: 2.1443, test_f1: 0.6192
 epoch: 62, train_loss: 0.1969, test_loss: 2.0752, test_f1: 0.5815
 epoch: 63, train_loss: 0.2167, test_loss: 2.1457, test_f1: 0.6241
 epoch: 64, train_loss: 0.1912, test_loss: 2.0792, test_f1: 0.5958
 epoch: 65, train_loss: 0.2137, test_loss: 2.2227, test_f1: 0.6535
 epoch: 66, train_loss: 0.1996, test_loss: 2.2725, test_f1: 0.5837
 epoch: 67, train_loss: 0.1938, test_loss: 2.1547, test_f1: 0.6371
 epoch: 68, train_loss: 0.1821, test_loss: 2.3748, test_f1: 0.5998
 epoch: 69, train_loss: 0.1549, test_loss: 2.1965, test_f1: 0.6510
 epoch: 70, train_loss: 0.1815, test_loss: 2.2445, test_f1: 0.5974
 epoch: 71, train_loss: 0.1805, test_loss: 2.1476, test_f1: 0.5952
 epoch: 72, train_loss: 0.1973, test_loss: 2.0958, test_f1: 0.5929
 epoch: 73, train_loss: 0.1789, test_loss: 2.2292, test_f1: 0.6034
 epoch: 74, train_loss: 0.1420, test_loss: 2.2467, test_f1: 0.6322
 epoch: 75, train_loss: 0.1594, test_loss: 2.2449, test_f1: 0.6201
 epoch: 76, train_loss: 0.1527, test_loss: 2.3102, test_f1: 0.6042
 epoch: 77, train_loss: 0.1483, test_loss: 2.2831, test_f1: 0.6374
 epoch: 78, train_loss: 0.1620, test_loss: 2.3392, test_f1: 0.6140
 epoch: 79, train_loss: 0.1495, test_loss: 2.3679, test_f1: 0.5906
 epoch: 80, train_loss: 0.1579, test_loss: 2.3230, test_f1: 0.5843
 epoch: 81, train_loss: 0.1528, test_loss: 2.2581, test_f1: 0.6007
 epoch: 82, train_loss: 0.1495, test_loss: 2.2823, test_f1: 0.6239
 epoch: 83, train_loss: 0.1471, test_loss: 2.4225, test_f1: 0.6090
 epoch: 84, train_loss: 0.1528, test_loss: 2.4115, test_f1: 0.6089
 epoch: 85, train_loss: 0.1278, test_loss: 2.3885, test_f1: 0.6192
 epoch: 86, train_loss: 0.1577, test_loss: 2.3891, test_f1: 0.5983
 epoch: 87, train_loss: 0.1664, test_loss: 2.3874, test_f1: 0.6187
 epoch: 88, train_loss: 0.1646, test_loss: 2.2738, test_f1: 0.6475
 epoch: 89, train_loss: 0.1634, test_loss: 2.4617, test_f1: 0.6218
 epoch: 90, train_loss: 0.1905, test_loss: 2.3397, test_f1: 0.6120
 epoch: 91, train_loss: 0.1731, test_loss: 2.1361, test_f1: 0.6272
 epoch: 92, train_loss: 0.1456, test_loss: 2.3233, test_f1: 0.5948
 epoch: 93, train_loss: 0.1507, test_loss: 2.5143, test_f1: 0.5624
 epoch: 94, train_loss: 0.1359, test_loss: 2.2725, test_f1: 0.6003
 epoch: 95, train_loss: 0.1255, test_loss: 2.3588, test_f1: 0.6042
 epoch: 96, train_loss: 0.1360, test_loss: 2.6205, test_f1: 0.5879
 epoch: 97, train_loss: 0.1581, test_loss: 2.5309, test_f1: 0.6082
 epoch: 98, train_loss: 0.1151, test_loss: 2.4195, test_f1: 0.6069
 epoch: 99, train_loss: 0.1296, test_loss: 2.4565, test_f1: 0.6252
##################ITERATION #9 ****************************************
 epoch: 0, train_loss: 1.8637, test_loss: 1.8059, test_f1: 0.3167
 epoch: 1, train_loss: 1.0932, test_loss: 1.3536, test_f1: 0.3473
 epoch: 2, train_loss: 0.9555, test_loss: 1.1874, test_f1: 0.5056
 epoch: 3, train_loss: 0.9154, test_loss: 1.1904, test_f1: 0.5545
 epoch: 4, train_loss: 0.8423, test_loss: 1.1500, test_f1: 0.5708
 epoch: 5, train_loss: 0.8076, test_loss: 1.0936, test_f1: 0.5921
 epoch: 6, train_loss: 0.7840, test_loss: 1.1239, test_f1: 0.5969
 epoch: 7, train_loss: 0.7431, test_loss: 1.1625, test_f1: 0.5738
 epoch: 8, train_loss: 0.7251, test_loss: 1.1734, test_f1: 0.5548
 epoch: 9, train_loss: 0.6980, test_loss: 1.1208, test_f1: 0.6274
 epoch: 10, train_loss: 0.6920, test_loss: 1.2831, test_f1: 0.5926
 epoch: 11, train_loss: 0.6539, test_loss: 1.2674, test_f1: 0.5688
 epoch: 12, train_loss: 0.6732, test_loss: 1.2650, test_f1: 0.6243
 epoch: 13, train_loss: 0.6585, test_loss: 1.3106, test_f1: 0.5531
 epoch: 14, train_loss: 0.6191, test_loss: 1.2571, test_f1: 0.5693
 epoch: 15, train_loss: 0.6142, test_loss: 1.2913, test_f1: 0.6527
 epoch: 16, train_loss: 0.5789, test_loss: 1.2606, test_f1: 0.6241
 epoch: 17, train_loss: 0.5801, test_loss: 1.3800, test_f1: 0.6391
 epoch: 18, train_loss: 0.5687, test_loss: 1.4118, test_f1: 0.6149
 epoch: 19, train_loss: 0.5678, test_loss: 1.2979, test_f1: 0.5993
 epoch: 20, train_loss: 0.5472, test_loss: 1.3702, test_f1: 0.6070
 epoch: 21, train_loss: 0.5312, test_loss: 1.3965, test_f1: 0.5803
 epoch: 22, train_loss: 0.5005, test_loss: 1.4980, test_f1: 0.5591
 epoch: 23, train_loss: 0.4626, test_loss: 1.3561, test_f1: 0.6226
 epoch: 24, train_loss: 0.4891, test_loss: 1.5164, test_f1: 0.5488
 epoch: 25, train_loss: 0.4599, test_loss: 1.5100, test_f1: 0.6172
 epoch: 26, train_loss: 0.4778, test_loss: 1.5682, test_f1: 0.5602
 epoch: 27, train_loss: 0.4861, test_loss: 1.6001, test_f1: 0.5651
 epoch: 28, train_loss: 0.4577, test_loss: 1.5168, test_f1: 0.6230
 epoch: 29, train_loss: 0.4637, test_loss: 1.7182, test_f1: 0.5643
 epoch: 30, train_loss: 0.4369, test_loss: 1.5049, test_f1: 0.6445
 epoch: 31, train_loss: 0.4241, test_loss: 1.7343, test_f1: 0.5742
 epoch: 32, train_loss: 0.3965, test_loss: 1.6798, test_f1: 0.6491
 epoch: 33, train_loss: 0.4130, test_loss: 1.6547, test_f1: 0.6371
 epoch: 34, train_loss: 0.4270, test_loss: 1.6850, test_f1: 0.5471
 epoch: 35, train_loss: 0.3865, test_loss: 1.8203, test_f1: 0.6218
 epoch: 36, train_loss: 0.3755, test_loss: 1.7904, test_f1: 0.6263
 epoch: 37, train_loss: 0.3677, test_loss: 1.7253, test_f1: 0.6399
 epoch: 38, train_loss: 0.3684, test_loss: 1.8877, test_f1: 0.5665
 epoch: 39, train_loss: 0.3459, test_loss: 1.7312, test_f1: 0.5618
 epoch: 40, train_loss: 0.3375, test_loss: 1.7900, test_f1: 0.6126
 epoch: 41, train_loss: 0.3286, test_loss: 1.8959, test_f1: 0.6211
 epoch: 42, train_loss: 0.3102, test_loss: 2.0292, test_f1: 0.6078
 epoch: 43, train_loss: 0.3461, test_loss: 1.8888, test_f1: 0.6163
 epoch: 44, train_loss: 0.3725, test_loss: 2.0876, test_f1: 0.5561
 epoch: 45, train_loss: 0.3098, test_loss: 2.0540, test_f1: 0.5768
 epoch: 46, train_loss: 0.3081, test_loss: 2.0199, test_f1: 0.5878
 epoch: 47, train_loss: 0.3116, test_loss: 2.1877, test_f1: 0.5209
 epoch: 48, train_loss: 0.2978, test_loss: 2.2071, test_f1: 0.5964
 epoch: 49, train_loss: 0.3089, test_loss: 2.1158, test_f1: 0.5925
 epoch: 50, train_loss: 0.2684, test_loss: 1.9784, test_f1: 0.6225
 epoch: 51, train_loss: 0.2939, test_loss: 2.1468, test_f1: 0.6152
 epoch: 52, train_loss: 0.2304, test_loss: 2.2225, test_f1: 0.5846
 epoch: 53, train_loss: 0.2072, test_loss: 2.4829, test_f1: 0.5734
 epoch: 54, train_loss: 0.2194, test_loss: 2.1982, test_f1: 0.5764
 epoch: 55, train_loss: 0.2122, test_loss: 2.3140, test_f1: 0.5499
 epoch: 56, train_loss: 0.2231, test_loss: 2.2986, test_f1: 0.5751
 epoch: 57, train_loss: 0.2097, test_loss: 2.3693, test_f1: 0.5992
 epoch: 58, train_loss: 0.1902, test_loss: 2.3720, test_f1: 0.6088
 epoch: 59, train_loss: 0.1923, test_loss: 2.3456, test_f1: 0.5884
 epoch: 60, train_loss: 0.1933, test_loss: 2.2368, test_f1: 0.6036
 epoch: 61, train_loss: 0.1745, test_loss: 2.3758, test_f1: 0.6212
 epoch: 62, train_loss: 0.1912, test_loss: 2.4174, test_f1: 0.6011
 epoch: 63, train_loss: 0.1927, test_loss: 2.5871, test_f1: 0.5883
 epoch: 64, train_loss: 0.1868, test_loss: 2.5254, test_f1: 0.5851
 epoch: 65, train_loss: 0.1861, test_loss: 2.5741, test_f1: 0.5839
 epoch: 66, train_loss: 0.1741, test_loss: 2.4543, test_f1: 0.5994
 epoch: 67, train_loss: 0.1855, test_loss: 2.5423, test_f1: 0.5839
 epoch: 68, train_loss: 0.1580, test_loss: 2.7794, test_f1: 0.5949
 epoch: 69, train_loss: 0.2014, test_loss: 2.4567, test_f1: 0.5892
 epoch: 70, train_loss: 0.1652, test_loss: 2.5870, test_f1: 0.5677
 epoch: 71, train_loss: 0.1640, test_loss: 2.6812, test_f1: 0.5945
 epoch: 72, train_loss: 0.1498, test_loss: 2.4297, test_f1: 0.6057
 epoch: 73, train_loss: 0.1633, test_loss: 2.7554, test_f1: 0.5797
 epoch: 74, train_loss: 0.1792, test_loss: 2.6204, test_f1: 0.5789
 epoch: 75, train_loss: 0.1404, test_loss: 2.7483, test_f1: 0.5913
 epoch: 76, train_loss: 0.1523, test_loss: 2.6937, test_f1: 0.5929
 epoch: 77, train_loss: 0.1759, test_loss: 2.7321, test_f1: 0.5828
 epoch: 78, train_loss: 0.1635, test_loss: 2.6230, test_f1: 0.6100
 epoch: 79, train_loss: 0.1472, test_loss: 2.6953, test_f1: 0.5976
 epoch: 80, train_loss: 0.1385, test_loss: 3.0121, test_f1: 0.5780
 epoch: 81, train_loss: 0.1409, test_loss: 2.7579, test_f1: 0.5698
 epoch: 82, train_loss: 0.1476, test_loss: 2.8412, test_f1: 0.5596
 epoch: 83, train_loss: 0.1698, test_loss: 2.6875, test_f1: 0.5833
 epoch: 84, train_loss: 0.1512, test_loss: 2.9081, test_f1: 0.5617
 epoch: 85, train_loss: 0.1546, test_loss: 2.6520, test_f1: 0.5941
 epoch: 86, train_loss: 0.1563, test_loss: 2.7122, test_f1: 0.5728
 epoch: 87, train_loss: 0.1277, test_loss: 2.6698, test_f1: 0.5835
 epoch: 88, train_loss: 0.1158, test_loss: 2.7142, test_f1: 0.5980
 epoch: 89, train_loss: 0.1320, test_loss: 2.7839, test_f1: 0.5779
 epoch: 90, train_loss: 0.1598, test_loss: 2.7710, test_f1: 0.6138
 epoch: 91, train_loss: 0.1764, test_loss: 2.6885, test_f1: 0.5879
 epoch: 92, train_loss: 0.1610, test_loss: 2.8224, test_f1: 0.6087
 epoch: 93, train_loss: 0.1684, test_loss: 2.6461, test_f1: 0.5902
 epoch: 94, train_loss: 0.1384, test_loss: 2.7376, test_f1: 0.5965
 epoch: 95, train_loss: 0.1415, test_loss: 2.7242, test_f1: 0.5808
 epoch: 96, train_loss: 0.1149, test_loss: 2.9180, test_f1: 0.5946
 epoch: 97, train_loss: 0.1289, test_loss: 2.8618, test_f1: 0.5880
 epoch: 98, train_loss: 0.1301, test_loss: 3.1853, test_f1: 0.5578
 epoch: 99, train_loss: 0.1422, test_loss: 2.8942, test_f1: 0.5788

Training completed in 390.09 seconds
Best F1: 0.6976 at epoch 37
Mean F1 across iterations: 0.6555  0.0181
========================FINAL RESULTS================================
FEGIN weighted F1: 0.6976  0.0181
python main.py --data ltspice_demos --representation component_pin_net --model FEGIN --layers 2 --hiddens 128 --batch_size 64 --lr 0.001 --emb_size 128 --epochs 100 --save_appendix component_pin_net_L2_H128_BS64_LR0.001_E128 --no_val
-----



STDERR:
  File "main.py", line 370, in <module>
    main()
  File "main.py", line 254, in main
    dataset = dataset_class(
  File "/home/philip/projects/ltspice_examples_code_repo/Circuit-Completion-Using-GNNs/component_classification_with_link_prediction_head/evaluation/FEGIN/kernel/circuit_datasets.py", line 15, in __init__
    self.data, self.slices = torch.load(self.processed_paths[0])
  File "/home/philip/.local/lib/python3.8/site-packages/torch/serialization.py", line 1040, in load
    warnings.warn(
  File "/usr/lib/python3.8/warnings.py", line 109, in _showwarnmsg
    sw(msg.message, msg.category, msg.filename, msg.lineno,
  File "main.py", line 47, in warn_with_traceback
    traceback.print_stack(file=log)
/home/philip/projects/ltspice_examples_code_repo/Circuit-Completion-Using-GNNs/component_classification_with_link_prediction_head/evaluation/FEGIN/kernel/circuit_datasets.py:15: FutureWarning: You are using `torch.load` with `weights_only=False` (the current default value), which uses the default pickle module implicitly. It is possible to construct malicious pickle data which will execute arbitrary code during unpickling (See https://github.com/pytorch/pytorch/blob/main/SECURITY.md#untrusted-models for more details). In a future release, the default value for `weights_only` will be flipped to `True`. This limits the functions that could be executed during unpickling. Arbitrary objects will no longer be allowed to be loaded via this mode unless they are explicitly allowlisted by the user via `torch.serialization.add_safe_globals`. We recommend you start setting `weights_only=True` for any use case where you don't have full control of the loaded file. Please open an issue on GitHub for any issues related to this experimental feature.
  self.data, self.slices = torch.load(self.processed_paths[0])
