STDOUT:
Results will be saved in /home/philip/projects/ltspice_examples_code_repo/Circuit-Completion-Using-GNNs/component_classification_with_link_prediction_head/evaluation/FEGIN/results/model_FEGIN_dataset_ltspice_demos
Command line input: python main.py --data ltspice_demos --representation component_pin_net --model FEGIN --layers 4 --hiddens 128 --batch_size 32 --lr 0.0001 --emb_size 512 --epochs 100 --save_appendix component_pin_net_L4_H128_BS32_LR0.0001_E512 --no_val
 is saved.
-----
ltspice_demos - FEGIN
Using 4 layers, 128 hidden units, h = 2
Loading component_pin_net representation dataset
ENTERED
Training FEGIN on component_pin_net representation
Train: 1565, Test: 383
##################ITERATION #0 ****************************************
 epoch: 0, train_loss: 1.3514, test_loss: 1.3433, test_f1: 0.1382
 epoch: 1, train_loss: 1.2673, test_loss: 1.2652, test_f1: 0.3351
 epoch: 2, train_loss: 1.1845, test_loss: 1.2083, test_f1: 0.3586
 epoch: 3, train_loss: 1.1300, test_loss: 1.1885, test_f1: 0.4386
 epoch: 4, train_loss: 1.0984, test_loss: 1.1611, test_f1: 0.4400
 epoch: 5, train_loss: 1.0601, test_loss: 1.1306, test_f1: 0.4441
 epoch: 6, train_loss: 1.0290, test_loss: 1.1002, test_f1: 0.4467
 epoch: 7, train_loss: 1.0013, test_loss: 1.0921, test_f1: 0.4605
 epoch: 8, train_loss: 0.9836, test_loss: 1.0842, test_f1: 0.4625
 epoch: 9, train_loss: 0.9761, test_loss: 1.0751, test_f1: 0.4763
 epoch: 10, train_loss: 0.9664, test_loss: 1.0775, test_f1: 0.4570
 epoch: 11, train_loss: 0.9533, test_loss: 1.0608, test_f1: 0.5085
 epoch: 12, train_loss: 0.9490, test_loss: 1.0611, test_f1: 0.5218
 epoch: 13, train_loss: 0.9404, test_loss: 1.0623, test_f1: 0.5232
 epoch: 14, train_loss: 0.9331, test_loss: 1.0643, test_f1: 0.5455
 epoch: 15, train_loss: 0.9247, test_loss: 1.0550, test_f1: 0.5439
 epoch: 16, train_loss: 0.9153, test_loss: 1.0279, test_f1: 0.5337
 epoch: 17, train_loss: 0.9062, test_loss: 1.0428, test_f1: 0.5496
 epoch: 18, train_loss: 0.8983, test_loss: 1.0515, test_f1: 0.5480
 epoch: 19, train_loss: 0.8865, test_loss: 1.0314, test_f1: 0.5435
 epoch: 20, train_loss: 0.8763, test_loss: 1.0310, test_f1: 0.5422
 epoch: 21, train_loss: 0.8670, test_loss: 1.0257, test_f1: 0.5187
 epoch: 22, train_loss: 0.8562, test_loss: 1.0460, test_f1: 0.5229
 epoch: 23, train_loss: 0.8388, test_loss: 1.0499, test_f1: 0.5373
 epoch: 24, train_loss: 0.8319, test_loss: 1.0172, test_f1: 0.5180
 epoch: 25, train_loss: 0.8320, test_loss: 0.9981, test_f1: 0.5665
 epoch: 26, train_loss: 0.8101, test_loss: 0.9869, test_f1: 0.5650
 epoch: 27, train_loss: 0.8078, test_loss: 1.0104, test_f1: 0.5558
 epoch: 28, train_loss: 0.7958, test_loss: 0.9694, test_f1: 0.5596
 epoch: 29, train_loss: 0.7693, test_loss: 0.9798, test_f1: 0.5520
 epoch: 30, train_loss: 0.7453, test_loss: 1.0028, test_f1: 0.5978
 epoch: 31, train_loss: 0.7327, test_loss: 1.0164, test_f1: 0.5710
 epoch: 32, train_loss: 0.7239, test_loss: 1.0319, test_f1: 0.5658
 epoch: 33, train_loss: 0.7320, test_loss: 1.0453, test_f1: 0.5810
 epoch: 34, train_loss: 0.7049, test_loss: 0.9791, test_f1: 0.5997
 epoch: 35, train_loss: 0.6868, test_loss: 1.0037, test_f1: 0.5938
 epoch: 36, train_loss: 0.6910, test_loss: 1.0065, test_f1: 0.5879
 epoch: 37, train_loss: 0.6683, test_loss: 0.9431, test_f1: 0.5972
 epoch: 38, train_loss: 0.6660, test_loss: 1.0381, test_f1: 0.5993
 epoch: 39, train_loss: 0.6346, test_loss: 1.0521, test_f1: 0.5876
 epoch: 40, train_loss: 0.6446, test_loss: 1.0306, test_f1: 0.5915
 epoch: 41, train_loss: 0.6353, test_loss: 1.0721, test_f1: 0.5640
 epoch: 42, train_loss: 0.6116, test_loss: 1.0255, test_f1: 0.6073
 epoch: 43, train_loss: 0.6006, test_loss: 1.0415, test_f1: 0.5982
 epoch: 44, train_loss: 0.6065, test_loss: 1.0366, test_f1: 0.6172
 epoch: 45, train_loss: 0.5848, test_loss: 1.0794, test_f1: 0.6114
 epoch: 46, train_loss: 0.5778, test_loss: 1.0257, test_f1: 0.6245
 epoch: 47, train_loss: 0.5718, test_loss: 1.0531, test_f1: 0.6124
 epoch: 48, train_loss: 0.5810, test_loss: 1.0562, test_f1: 0.6139
 epoch: 49, train_loss: 0.5550, test_loss: 1.1367, test_f1: 0.6133
 epoch: 50, train_loss: 0.5434, test_loss: 1.0819, test_f1: 0.6389
 epoch: 51, train_loss: 0.5168, test_loss: 1.0972, test_f1: 0.6320
 epoch: 52, train_loss: 0.5106, test_loss: 1.1250, test_f1: 0.6243
 epoch: 53, train_loss: 0.5204, test_loss: 1.1076, test_f1: 0.6215
 epoch: 54, train_loss: 0.5260, test_loss: 1.1161, test_f1: 0.6306
 epoch: 55, train_loss: 0.4986, test_loss: 1.1632, test_f1: 0.6355
 epoch: 56, train_loss: 0.5009, test_loss: 1.1199, test_f1: 0.6257
 epoch: 57, train_loss: 0.4950, test_loss: 1.1564, test_f1: 0.6262
 epoch: 58, train_loss: 0.4873, test_loss: 1.1553, test_f1: 0.6261
 epoch: 59, train_loss: 0.4831, test_loss: 1.1440, test_f1: 0.6428
 epoch: 60, train_loss: 0.4710, test_loss: 1.1735, test_f1: 0.5996
 epoch: 61, train_loss: 0.4603, test_loss: 1.2031, test_f1: 0.6271
 epoch: 62, train_loss: 0.4712, test_loss: 1.1625, test_f1: 0.6150
 epoch: 63, train_loss: 0.4426, test_loss: 1.2226, test_f1: 0.6317
 epoch: 64, train_loss: 0.4487, test_loss: 1.2139, test_f1: 0.6482
 epoch: 65, train_loss: 0.4471, test_loss: 1.2682, test_f1: 0.6377
 epoch: 66, train_loss: 0.4568, test_loss: 1.2190, test_f1: 0.6184
 epoch: 67, train_loss: 0.4393, test_loss: 1.1998, test_f1: 0.6406
 epoch: 68, train_loss: 0.4393, test_loss: 1.2544, test_f1: 0.6095
 epoch: 69, train_loss: 0.4262, test_loss: 1.2247, test_f1: 0.6250
 epoch: 70, train_loss: 0.4406, test_loss: 1.3099, test_f1: 0.6262
 epoch: 71, train_loss: 0.4382, test_loss: 1.2631, test_f1: 0.6143
 epoch: 72, train_loss: 0.4088, test_loss: 1.3046, test_f1: 0.6333
 epoch: 73, train_loss: 0.4135, test_loss: 1.2886, test_f1: 0.6037
 epoch: 74, train_loss: 0.4147, test_loss: 1.2802, test_f1: 0.6114
 epoch: 75, train_loss: 0.4324, test_loss: 1.3244, test_f1: 0.6049
 epoch: 76, train_loss: 0.4166, test_loss: 1.3235, test_f1: 0.6183
 epoch: 77, train_loss: 0.3869, test_loss: 1.3825, test_f1: 0.6038
 epoch: 78, train_loss: 0.3988, test_loss: 1.3068, test_f1: 0.6237
 epoch: 79, train_loss: 0.3904, test_loss: 1.3232, test_f1: 0.6173
 epoch: 80, train_loss: 0.3849, test_loss: 1.3328, test_f1: 0.6116
 epoch: 81, train_loss: 0.3940, test_loss: 1.3508, test_f1: 0.6189
 epoch: 82, train_loss: 0.3896, test_loss: 1.3822, test_f1: 0.6185
 epoch: 83, train_loss: 0.3813, test_loss: 1.4086, test_f1: 0.5948
 epoch: 84, train_loss: 0.3659, test_loss: 1.3630, test_f1: 0.6199
 epoch: 85, train_loss: 0.3712, test_loss: 1.3682, test_f1: 0.6246
 epoch: 86, train_loss: 0.3641, test_loss: 1.4348, test_f1: 0.5876
 epoch: 87, train_loss: 0.3646, test_loss: 1.4078, test_f1: 0.6220
 epoch: 88, train_loss: 0.3562, test_loss: 1.4182, test_f1: 0.6078
 epoch: 89, train_loss: 0.3408, test_loss: 1.3999, test_f1: 0.6209
 epoch: 90, train_loss: 0.3375, test_loss: 1.4563, test_f1: 0.6074
 epoch: 91, train_loss: 0.3519, test_loss: 1.4767, test_f1: 0.5909
 epoch: 92, train_loss: 0.3489, test_loss: 1.4801, test_f1: 0.6163
 epoch: 93, train_loss: 0.3491, test_loss: 1.4680, test_f1: 0.6272
 epoch: 94, train_loss: 0.3417, test_loss: 1.5483, test_f1: 0.5977
 epoch: 95, train_loss: 0.3091, test_loss: 1.4744, test_f1: 0.6073
 epoch: 96, train_loss: 0.3170, test_loss: 1.5288, test_f1: 0.6078
 epoch: 97, train_loss: 0.3054, test_loss: 1.5703, test_f1: 0.5945
 epoch: 98, train_loss: 0.3264, test_loss: 1.4879, test_f1: 0.6219
 epoch: 99, train_loss: 0.3202, test_loss: 1.5667, test_f1: 0.6021
##################ITERATION #1 ****************************************
 epoch: 0, train_loss: 1.2402, test_loss: 1.2771, test_f1: 0.3107
 epoch: 1, train_loss: 1.1043, test_loss: 1.1487, test_f1: 0.4635
 epoch: 2, train_loss: 1.0480, test_loss: 1.0992, test_f1: 0.4666
 epoch: 3, train_loss: 1.0086, test_loss: 1.0758, test_f1: 0.4843
 epoch: 4, train_loss: 0.9841, test_loss: 1.0562, test_f1: 0.5178
 epoch: 5, train_loss: 0.9695, test_loss: 1.0406, test_f1: 0.5109
 epoch: 6, train_loss: 0.9420, test_loss: 1.0354, test_f1: 0.5407
 epoch: 7, train_loss: 0.9256, test_loss: 1.0370, test_f1: 0.5315
 epoch: 8, train_loss: 0.9059, test_loss: 1.0155, test_f1: 0.5339
 epoch: 9, train_loss: 0.8944, test_loss: 1.0224, test_f1: 0.5275
 epoch: 10, train_loss: 0.8870, test_loss: 1.0068, test_f1: 0.5548
 epoch: 11, train_loss: 0.8746, test_loss: 1.0110, test_f1: 0.5298
 epoch: 12, train_loss: 0.8591, test_loss: 1.0087, test_f1: 0.5700
 epoch: 13, train_loss: 0.8441, test_loss: 1.0120, test_f1: 0.5616
 epoch: 14, train_loss: 0.8357, test_loss: 1.0237, test_f1: 0.5128
 epoch: 15, train_loss: 0.8235, test_loss: 0.9947, test_f1: 0.5518
 epoch: 16, train_loss: 0.8021, test_loss: 1.0142, test_f1: 0.5607
 epoch: 17, train_loss: 0.7896, test_loss: 1.0220, test_f1: 0.5746
 epoch: 18, train_loss: 0.7774, test_loss: 1.0137, test_f1: 0.5956
 epoch: 19, train_loss: 0.7722, test_loss: 0.9855, test_f1: 0.5803
 epoch: 20, train_loss: 0.7555, test_loss: 1.0063, test_f1: 0.5784
 epoch: 21, train_loss: 0.7427, test_loss: 1.0128, test_f1: 0.5932
 epoch: 22, train_loss: 0.7269, test_loss: 1.0436, test_f1: 0.5747
 epoch: 23, train_loss: 0.7036, test_loss: 1.0580, test_f1: 0.5773
 epoch: 24, train_loss: 0.7098, test_loss: 1.0451, test_f1: 0.5762
 epoch: 25, train_loss: 0.6826, test_loss: 1.0510, test_f1: 0.5808
 epoch: 26, train_loss: 0.6650, test_loss: 1.0919, test_f1: 0.5880
 epoch: 27, train_loss: 0.6777, test_loss: 1.0619, test_f1: 0.6140
 epoch: 28, train_loss: 0.6583, test_loss: 1.1045, test_f1: 0.5858
 epoch: 29, train_loss: 0.6380, test_loss: 1.1573, test_f1: 0.5890
 epoch: 30, train_loss: 0.6431, test_loss: 1.0468, test_f1: 0.6046
 epoch: 31, train_loss: 0.6230, test_loss: 1.0667, test_f1: 0.6082
 epoch: 32, train_loss: 0.6075, test_loss: 1.0731, test_f1: 0.6304
 epoch: 33, train_loss: 0.5991, test_loss: 1.1415, test_f1: 0.6014
 epoch: 34, train_loss: 0.5851, test_loss: 1.1026, test_f1: 0.6249
 epoch: 35, train_loss: 0.5725, test_loss: 1.0477, test_f1: 0.6122
 epoch: 36, train_loss: 0.5716, test_loss: 1.0857, test_f1: 0.6337
 epoch: 37, train_loss: 0.5692, test_loss: 1.0696, test_f1: 0.6288
 epoch: 38, train_loss: 0.5504, test_loss: 1.1952, test_f1: 0.6060
 epoch: 39, train_loss: 0.5438, test_loss: 1.0757, test_f1: 0.6556
 epoch: 40, train_loss: 0.5393, test_loss: 1.1614, test_f1: 0.6372
 epoch: 41, train_loss: 0.5343, test_loss: 1.2023, test_f1: 0.6101
 epoch: 42, train_loss: 0.5098, test_loss: 1.1634, test_f1: 0.6389
 epoch: 43, train_loss: 0.5090, test_loss: 1.1481, test_f1: 0.6353
 epoch: 44, train_loss: 0.4746, test_loss: 1.3321, test_f1: 0.6008
 epoch: 45, train_loss: 0.4957, test_loss: 1.2845, test_f1: 0.5928
 epoch: 46, train_loss: 0.4646, test_loss: 1.2756, test_f1: 0.6081
 epoch: 47, train_loss: 0.4667, test_loss: 1.2289, test_f1: 0.6492
 epoch: 48, train_loss: 0.4516, test_loss: 1.2715, test_f1: 0.6407
 epoch: 49, train_loss: 0.4661, test_loss: 1.2750, test_f1: 0.6524
 epoch: 50, train_loss: 0.4523, test_loss: 1.2679, test_f1: 0.5980
 epoch: 51, train_loss: 0.4370, test_loss: 1.3344, test_f1: 0.6284
 epoch: 52, train_loss: 0.4137, test_loss: 1.2608, test_f1: 0.6137
 epoch: 53, train_loss: 0.3949, test_loss: 1.3920, test_f1: 0.6088
 epoch: 54, train_loss: 0.3869, test_loss: 1.3887, test_f1: 0.6317
 epoch: 55, train_loss: 0.3960, test_loss: 1.3578, test_f1: 0.6223
 epoch: 56, train_loss: 0.3863, test_loss: 1.3370, test_f1: 0.6308
 epoch: 57, train_loss: 0.3978, test_loss: 1.4054, test_f1: 0.6248
 epoch: 58, train_loss: 0.3872, test_loss: 1.4366, test_f1: 0.6211
 epoch: 59, train_loss: 0.3697, test_loss: 1.5241, test_f1: 0.6141
 epoch: 60, train_loss: 0.3677, test_loss: 1.4216, test_f1: 0.6309
 epoch: 61, train_loss: 0.3587, test_loss: 1.5343, test_f1: 0.6106
 epoch: 62, train_loss: 0.3575, test_loss: 1.4681, test_f1: 0.6330
 epoch: 63, train_loss: 0.3647, test_loss: 1.5317, test_f1: 0.6094
 epoch: 64, train_loss: 0.3316, test_loss: 1.5254, test_f1: 0.6267
 epoch: 65, train_loss: 0.3492, test_loss: 1.5853, test_f1: 0.6313
 epoch: 66, train_loss: 0.3392, test_loss: 1.5157, test_f1: 0.6277
 epoch: 67, train_loss: 0.3282, test_loss: 1.5963, test_f1: 0.5970
 epoch: 68, train_loss: 0.3259, test_loss: 1.5899, test_f1: 0.6471
 epoch: 69, train_loss: 0.3242, test_loss: 1.5312, test_f1: 0.6236
 epoch: 70, train_loss: 0.3169, test_loss: 1.5586, test_f1: 0.6368
 epoch: 71, train_loss: 0.3218, test_loss: 1.6198, test_f1: 0.6202
 epoch: 72, train_loss: 0.3201, test_loss: 1.5608, test_f1: 0.6354
 epoch: 73, train_loss: 0.3115, test_loss: 1.6464, test_f1: 0.6191
 epoch: 74, train_loss: 0.3071, test_loss: 1.6521, test_f1: 0.6144
 epoch: 75, train_loss: 0.2967, test_loss: 1.7215, test_f1: 0.6142
 epoch: 76, train_loss: 0.3106, test_loss: 1.6826, test_f1: 0.6114
 epoch: 77, train_loss: 0.3084, test_loss: 1.6882, test_f1: 0.6226
 epoch: 78, train_loss: 0.2986, test_loss: 1.7542, test_f1: 0.6216
 epoch: 79, train_loss: 0.2848, test_loss: 1.7105, test_f1: 0.6174
 epoch: 80, train_loss: 0.3029, test_loss: 1.7787, test_f1: 0.6068
 epoch: 81, train_loss: 0.3052, test_loss: 1.6869, test_f1: 0.6184
 epoch: 82, train_loss: 0.2768, test_loss: 1.7702, test_f1: 0.6145
 epoch: 83, train_loss: 0.2732, test_loss: 1.7897, test_f1: 0.6303
 epoch: 84, train_loss: 0.3013, test_loss: 1.6866, test_f1: 0.6392
 epoch: 85, train_loss: 0.2709, test_loss: 1.7361, test_f1: 0.6353
 epoch: 86, train_loss: 0.2823, test_loss: 1.8077, test_f1: 0.6183
 epoch: 87, train_loss: 0.2912, test_loss: 1.8517, test_f1: 0.6242
 epoch: 88, train_loss: 0.2592, test_loss: 1.8804, test_f1: 0.6306
 epoch: 89, train_loss: 0.2479, test_loss: 1.8092, test_f1: 0.6264
 epoch: 90, train_loss: 0.2629, test_loss: 1.9051, test_f1: 0.6168
 epoch: 91, train_loss: 0.2448, test_loss: 1.9101, test_f1: 0.6202
 epoch: 92, train_loss: 0.2526, test_loss: 1.9589, test_f1: 0.5925
 epoch: 93, train_loss: 0.2524, test_loss: 1.9847, test_f1: 0.6096
 epoch: 94, train_loss: 0.2537, test_loss: 2.0679, test_f1: 0.6174
 epoch: 95, train_loss: 0.2509, test_loss: 1.9032, test_f1: 0.6392
 epoch: 96, train_loss: 0.2278, test_loss: 1.9724, test_f1: 0.6333
 epoch: 97, train_loss: 0.2451, test_loss: 2.1244, test_f1: 0.6206
 epoch: 98, train_loss: 0.2331, test_loss: 2.1027, test_f1: 0.5986
 epoch: 99, train_loss: 0.2390, test_loss: 1.9883, test_f1: 0.6208
##################ITERATION #2 ****************************************
 epoch: 0, train_loss: 1.1706, test_loss: 1.2076, test_f1: 0.4435
 epoch: 1, train_loss: 1.0405, test_loss: 1.0808, test_f1: 0.4810
 epoch: 2, train_loss: 0.9962, test_loss: 1.0582, test_f1: 0.5148
 epoch: 3, train_loss: 0.9678, test_loss: 1.0379, test_f1: 0.5297
 epoch: 4, train_loss: 0.9484, test_loss: 1.0239, test_f1: 0.5043
 epoch: 5, train_loss: 0.9300, test_loss: 1.0194, test_f1: 0.5413
 epoch: 6, train_loss: 0.9128, test_loss: 1.0087, test_f1: 0.5434
 epoch: 7, train_loss: 0.8976, test_loss: 1.0114, test_f1: 0.5567
 epoch: 8, train_loss: 0.8719, test_loss: 1.0146, test_f1: 0.5419
 epoch: 9, train_loss: 0.8598, test_loss: 1.0021, test_f1: 0.5506
 epoch: 10, train_loss: 0.8474, test_loss: 1.0118, test_f1: 0.5484
 epoch: 11, train_loss: 0.8459, test_loss: 1.0018, test_f1: 0.5881
 epoch: 12, train_loss: 0.8193, test_loss: 0.9981, test_f1: 0.5909
 epoch: 13, train_loss: 0.8015, test_loss: 1.0027, test_f1: 0.5848
 epoch: 14, train_loss: 0.7895, test_loss: 0.9873, test_f1: 0.6131
 epoch: 15, train_loss: 0.7822, test_loss: 0.9998, test_f1: 0.6076
 epoch: 16, train_loss: 0.7679, test_loss: 0.9975, test_f1: 0.6078
 epoch: 17, train_loss: 0.7466, test_loss: 1.0088, test_f1: 0.6024
 epoch: 18, train_loss: 0.7353, test_loss: 1.0120, test_f1: 0.6114
 epoch: 19, train_loss: 0.7099, test_loss: 1.0254, test_f1: 0.6047
 epoch: 20, train_loss: 0.7134, test_loss: 1.0106, test_f1: 0.5994
 epoch: 21, train_loss: 0.6972, test_loss: 1.0533, test_f1: 0.5932
 epoch: 22, train_loss: 0.6800, test_loss: 1.0251, test_f1: 0.5647
 epoch: 23, train_loss: 0.6755, test_loss: 1.0425, test_f1: 0.6159
 epoch: 24, train_loss: 0.6535, test_loss: 1.0451, test_f1: 0.6135
 epoch: 25, train_loss: 0.6556, test_loss: 1.0264, test_f1: 0.6192
 epoch: 26, train_loss: 0.6339, test_loss: 1.0473, test_f1: 0.6274
 epoch: 27, train_loss: 0.6293, test_loss: 1.0577, test_f1: 0.6068
 epoch: 28, train_loss: 0.6059, test_loss: 1.0532, test_f1: 0.6144
 epoch: 29, train_loss: 0.5972, test_loss: 1.0904, test_f1: 0.6222
 epoch: 30, train_loss: 0.5914, test_loss: 1.0838, test_f1: 0.6211
 epoch: 31, train_loss: 0.5870, test_loss: 1.1249, test_f1: 0.5901
 epoch: 32, train_loss: 0.5752, test_loss: 1.1156, test_f1: 0.6081
 epoch: 33, train_loss: 0.5674, test_loss: 1.1049, test_f1: 0.6251
 epoch: 34, train_loss: 0.5500, test_loss: 1.1043, test_f1: 0.6188
 epoch: 35, train_loss: 0.5220, test_loss: 1.1356, test_f1: 0.6331
 epoch: 36, train_loss: 0.5331, test_loss: 1.1442, test_f1: 0.6071
 epoch: 37, train_loss: 0.5191, test_loss: 1.1942, test_f1: 0.6330
 epoch: 38, train_loss: 0.5039, test_loss: 1.1976, test_f1: 0.6219
 epoch: 39, train_loss: 0.5017, test_loss: 1.1995, test_f1: 0.6232
 epoch: 40, train_loss: 0.4962, test_loss: 1.1971, test_f1: 0.6220
 epoch: 41, train_loss: 0.4828, test_loss: 1.2791, test_f1: 0.6127
 epoch: 42, train_loss: 0.5020, test_loss: 1.2196, test_f1: 0.6348
 epoch: 43, train_loss: 0.4657, test_loss: 1.2047, test_f1: 0.6278
 epoch: 44, train_loss: 0.4570, test_loss: 1.3044, test_f1: 0.6431
 epoch: 45, train_loss: 0.4379, test_loss: 1.2940, test_f1: 0.6406
 epoch: 46, train_loss: 0.4402, test_loss: 1.2781, test_f1: 0.6185
 epoch: 47, train_loss: 0.4295, test_loss: 1.3098, test_f1: 0.6322
 epoch: 48, train_loss: 0.4376, test_loss: 1.2971, test_f1: 0.6321
 epoch: 49, train_loss: 0.4168, test_loss: 1.3437, test_f1: 0.6130
 epoch: 50, train_loss: 0.4157, test_loss: 1.3640, test_f1: 0.6333
 epoch: 51, train_loss: 0.3986, test_loss: 1.3607, test_f1: 0.6393
 epoch: 52, train_loss: 0.3656, test_loss: 1.3975, test_f1: 0.6215
 epoch: 53, train_loss: 0.3601, test_loss: 1.3970, test_f1: 0.6363
 epoch: 54, train_loss: 0.3648, test_loss: 1.4200, test_f1: 0.6366
 epoch: 55, train_loss: 0.3493, test_loss: 1.4759, test_f1: 0.6374
 epoch: 56, train_loss: 0.3404, test_loss: 1.4821, test_f1: 0.6306
 epoch: 57, train_loss: 0.3714, test_loss: 1.4399, test_f1: 0.6477
 epoch: 58, train_loss: 0.3467, test_loss: 1.4626, test_f1: 0.6426
 epoch: 59, train_loss: 0.3312, test_loss: 1.4296, test_f1: 0.6542
 epoch: 60, train_loss: 0.3382, test_loss: 1.4643, test_f1: 0.6405
 epoch: 61, train_loss: 0.3279, test_loss: 1.5307, test_f1: 0.6470
 epoch: 62, train_loss: 0.3349, test_loss: 1.5275, test_f1: 0.6326
 epoch: 63, train_loss: 0.3328, test_loss: 1.5327, test_f1: 0.6166
 epoch: 64, train_loss: 0.3171, test_loss: 1.6160, test_f1: 0.6359
 epoch: 65, train_loss: 0.3273, test_loss: 1.5595, test_f1: 0.6201
 epoch: 66, train_loss: 0.3105, test_loss: 1.5844, test_f1: 0.6208
 epoch: 67, train_loss: 0.3229, test_loss: 1.5499, test_f1: 0.6312
 epoch: 68, train_loss: 0.3039, test_loss: 1.6050, test_f1: 0.6286
 epoch: 69, train_loss: 0.3056, test_loss: 1.6201, test_f1: 0.6307
 epoch: 70, train_loss: 0.3016, test_loss: 1.6203, test_f1: 0.6055
 epoch: 71, train_loss: 0.2878, test_loss: 1.6138, test_f1: 0.6283
 epoch: 72, train_loss: 0.2968, test_loss: 1.5910, test_f1: 0.6339
 epoch: 73, train_loss: 0.3079, test_loss: 1.6412, test_f1: 0.6038
 epoch: 74, train_loss: 0.2883, test_loss: 1.6962, test_f1: 0.6230
 epoch: 75, train_loss: 0.2879, test_loss: 1.6452, test_f1: 0.6225
 epoch: 76, train_loss: 0.2914, test_loss: 1.6371, test_f1: 0.6191
 epoch: 77, train_loss: 0.2654, test_loss: 1.6033, test_f1: 0.6222
 epoch: 78, train_loss: 0.2700, test_loss: 1.6463, test_f1: 0.6383
 epoch: 79, train_loss: 0.2851, test_loss: 1.6814, test_f1: 0.6244
 epoch: 80, train_loss: 0.2687, test_loss: 1.6945, test_f1: 0.6198
 epoch: 81, train_loss: 0.2549, test_loss: 1.7054, test_f1: 0.6228
 epoch: 82, train_loss: 0.2720, test_loss: 1.7682, test_f1: 0.6413
 epoch: 83, train_loss: 0.2590, test_loss: 1.7596, test_f1: 0.6231
 epoch: 84, train_loss: 0.2595, test_loss: 1.7774, test_f1: 0.6208
 epoch: 85, train_loss: 0.2602, test_loss: 1.7423, test_f1: 0.6324
 epoch: 86, train_loss: 0.2408, test_loss: 1.8103, test_f1: 0.6157
 epoch: 87, train_loss: 0.2438, test_loss: 1.7875, test_f1: 0.6413
 epoch: 88, train_loss: 0.2482, test_loss: 1.7558, test_f1: 0.6424
 epoch: 89, train_loss: 0.2475, test_loss: 1.8515, test_f1: 0.6237
 epoch: 90, train_loss: 0.2416, test_loss: 1.8921, test_f1: 0.6093
 epoch: 91, train_loss: 0.2625, test_loss: 1.8712, test_f1: 0.6321
 epoch: 92, train_loss: 0.2346, test_loss: 1.8894, test_f1: 0.6154
 epoch: 93, train_loss: 0.2475, test_loss: 1.8865, test_f1: 0.6249
 epoch: 94, train_loss: 0.2254, test_loss: 1.9192, test_f1: 0.6359
 epoch: 95, train_loss: 0.2264, test_loss: 1.8755, test_f1: 0.6342
 epoch: 96, train_loss: 0.2424, test_loss: 1.8808, test_f1: 0.6280
 epoch: 97, train_loss: 0.2262, test_loss: 1.8556, test_f1: 0.6352
 epoch: 98, train_loss: 0.2315, test_loss: 1.9113, test_f1: 0.6427
 epoch: 99, train_loss: 0.2082, test_loss: 1.9059, test_f1: 0.6447
##################ITERATION #3 ****************************************
 epoch: 0, train_loss: 1.1608, test_loss: 1.2429, test_f1: 0.3291
 epoch: 1, train_loss: 1.0285, test_loss: 1.0684, test_f1: 0.5144
 epoch: 2, train_loss: 0.9925, test_loss: 1.0544, test_f1: 0.5299
 epoch: 3, train_loss: 0.9822, test_loss: 1.0405, test_f1: 0.5340
 epoch: 4, train_loss: 0.9555, test_loss: 1.0303, test_f1: 0.5543
 epoch: 5, train_loss: 0.9180, test_loss: 1.0269, test_f1: 0.5423
 epoch: 6, train_loss: 0.9173, test_loss: 1.0159, test_f1: 0.5452
 epoch: 7, train_loss: 0.8980, test_loss: 0.9960, test_f1: 0.5300
 epoch: 8, train_loss: 0.8800, test_loss: 1.0038, test_f1: 0.5585
 epoch: 9, train_loss: 0.8847, test_loss: 0.9822, test_f1: 0.5518
 epoch: 10, train_loss: 0.8572, test_loss: 0.9882, test_f1: 0.5943
 epoch: 11, train_loss: 0.8490, test_loss: 0.9854, test_f1: 0.5864
 epoch: 12, train_loss: 0.8263, test_loss: 1.0040, test_f1: 0.5542
 epoch: 13, train_loss: 0.8108, test_loss: 1.0093, test_f1: 0.5845
 epoch: 14, train_loss: 0.8008, test_loss: 1.0170, test_f1: 0.5561
 epoch: 15, train_loss: 0.7956, test_loss: 0.9865, test_f1: 0.5949
 epoch: 16, train_loss: 0.7740, test_loss: 1.0251, test_f1: 0.5473
 epoch: 17, train_loss: 0.7530, test_loss: 1.0097, test_f1: 0.5666
 epoch: 18, train_loss: 0.7479, test_loss: 1.0388, test_f1: 0.5645
 epoch: 19, train_loss: 0.7353, test_loss: 1.0275, test_f1: 0.5983
 epoch: 20, train_loss: 0.7113, test_loss: 1.0400, test_f1: 0.5774
 epoch: 21, train_loss: 0.7124, test_loss: 1.0261, test_f1: 0.5736
 epoch: 22, train_loss: 0.6804, test_loss: 1.0340, test_f1: 0.5878
 epoch: 23, train_loss: 0.6731, test_loss: 1.0366, test_f1: 0.6237
 epoch: 24, train_loss: 0.6754, test_loss: 1.0790, test_f1: 0.5588
 epoch: 25, train_loss: 0.6716, test_loss: 1.0529, test_f1: 0.6090
 epoch: 26, train_loss: 0.6468, test_loss: 1.0754, test_f1: 0.5823
 epoch: 27, train_loss: 0.6540, test_loss: 1.0676, test_f1: 0.6124
 epoch: 28, train_loss: 0.6148, test_loss: 1.0890, test_f1: 0.5576
 epoch: 29, train_loss: 0.6163, test_loss: 1.1382, test_f1: 0.5799
 epoch: 30, train_loss: 0.6111, test_loss: 1.1175, test_f1: 0.5790
 epoch: 31, train_loss: 0.5964, test_loss: 1.1277, test_f1: 0.5672
 epoch: 32, train_loss: 0.5789, test_loss: 1.1318, test_f1: 0.6079
 epoch: 33, train_loss: 0.5686, test_loss: 1.1867, test_f1: 0.5998
 epoch: 34, train_loss: 0.5573, test_loss: 1.1711, test_f1: 0.5921
 epoch: 35, train_loss: 0.5411, test_loss: 1.1818, test_f1: 0.5958
 epoch: 36, train_loss: 0.5396, test_loss: 1.2152, test_f1: 0.6062
 epoch: 37, train_loss: 0.5304, test_loss: 1.1720, test_f1: 0.5772
 epoch: 38, train_loss: 0.5504, test_loss: 1.1967, test_f1: 0.6251
 epoch: 39, train_loss: 0.5171, test_loss: 1.2293, test_f1: 0.5771
 epoch: 40, train_loss: 0.5027, test_loss: 1.2582, test_f1: 0.5768
 epoch: 41, train_loss: 0.4874, test_loss: 1.2961, test_f1: 0.6071
 epoch: 42, train_loss: 0.4976, test_loss: 1.2415, test_f1: 0.6222
 epoch: 43, train_loss: 0.4976, test_loss: 1.2938, test_f1: 0.6292
 epoch: 44, train_loss: 0.4825, test_loss: 1.2874, test_f1: 0.6422
 epoch: 45, train_loss: 0.4614, test_loss: 1.3610, test_f1: 0.6038
 epoch: 46, train_loss: 0.4588, test_loss: 1.2886, test_f1: 0.6135
 epoch: 47, train_loss: 0.4494, test_loss: 1.3058, test_f1: 0.6218
 epoch: 48, train_loss: 0.4521, test_loss: 1.3847, test_f1: 0.5922
 epoch: 49, train_loss: 0.4429, test_loss: 1.4036, test_f1: 0.6102
 epoch: 50, train_loss: 0.4137, test_loss: 1.5163, test_f1: 0.5912
 epoch: 51, train_loss: 0.4052, test_loss: 1.4340, test_f1: 0.5998
 epoch: 52, train_loss: 0.4059, test_loss: 1.4352, test_f1: 0.6030
 epoch: 53, train_loss: 0.3782, test_loss: 1.4568, test_f1: 0.6130
 epoch: 54, train_loss: 0.3736, test_loss: 1.4727, test_f1: 0.6095
 epoch: 55, train_loss: 0.3516, test_loss: 1.4556, test_f1: 0.6202
 epoch: 56, train_loss: 0.3732, test_loss: 1.4621, test_f1: 0.6080
 epoch: 57, train_loss: 0.3508, test_loss: 1.4857, test_f1: 0.6001
 epoch: 58, train_loss: 0.3606, test_loss: 1.4869, test_f1: 0.6275
 epoch: 59, train_loss: 0.3567, test_loss: 1.5012, test_f1: 0.6063
 epoch: 60, train_loss: 0.3531, test_loss: 1.5570, test_f1: 0.6035
 epoch: 61, train_loss: 0.3384, test_loss: 1.5645, test_f1: 0.5907
 epoch: 62, train_loss: 0.3386, test_loss: 1.5522, test_f1: 0.6200
 epoch: 63, train_loss: 0.3340, test_loss: 1.5213, test_f1: 0.6000
 epoch: 64, train_loss: 0.3351, test_loss: 1.6019, test_f1: 0.6161
 epoch: 65, train_loss: 0.3242, test_loss: 1.5983, test_f1: 0.5951
 epoch: 66, train_loss: 0.3210, test_loss: 1.6624, test_f1: 0.6166
 epoch: 67, train_loss: 0.3281, test_loss: 1.6950, test_f1: 0.5953
 epoch: 68, train_loss: 0.3051, test_loss: 1.6969, test_f1: 0.5976
 epoch: 69, train_loss: 0.3045, test_loss: 1.7111, test_f1: 0.5988
 epoch: 70, train_loss: 0.2932, test_loss: 1.6774, test_f1: 0.6275
 epoch: 71, train_loss: 0.2826, test_loss: 1.7273, test_f1: 0.5853
 epoch: 72, train_loss: 0.2902, test_loss: 1.7648, test_f1: 0.5920
 epoch: 73, train_loss: 0.2933, test_loss: 1.7460, test_f1: 0.5947
 epoch: 74, train_loss: 0.2889, test_loss: 1.7577, test_f1: 0.5918
 epoch: 75, train_loss: 0.2833, test_loss: 1.7488, test_f1: 0.6025
 epoch: 76, train_loss: 0.3076, test_loss: 1.8058, test_f1: 0.5822
 epoch: 77, train_loss: 0.3012, test_loss: 1.8046, test_f1: 0.5891
 epoch: 78, train_loss: 0.2824, test_loss: 1.7379, test_f1: 0.6248
 epoch: 79, train_loss: 0.2849, test_loss: 1.8407, test_f1: 0.5993
 epoch: 80, train_loss: 0.2744, test_loss: 1.8131, test_f1: 0.5847
 epoch: 81, train_loss: 0.2560, test_loss: 1.8224, test_f1: 0.5808
 epoch: 82, train_loss: 0.2574, test_loss: 1.8926, test_f1: 0.6074
 epoch: 83, train_loss: 0.2643, test_loss: 1.8706, test_f1: 0.5926
 epoch: 84, train_loss: 0.2794, test_loss: 1.9570, test_f1: 0.5710
 epoch: 85, train_loss: 0.2517, test_loss: 1.9312, test_f1: 0.5762
 epoch: 86, train_loss: 0.2636, test_loss: 1.9014, test_f1: 0.5976
 epoch: 87, train_loss: 0.2496, test_loss: 1.9725, test_f1: 0.5992
 epoch: 88, train_loss: 0.2581, test_loss: 1.8985, test_f1: 0.6114
 epoch: 89, train_loss: 0.2514, test_loss: 1.9118, test_f1: 0.5870
 epoch: 90, train_loss: 0.2655, test_loss: 1.9990, test_f1: 0.6146
 epoch: 91, train_loss: 0.2310, test_loss: 1.9444, test_f1: 0.6193
 epoch: 92, train_loss: 0.2392, test_loss: 2.0510, test_f1: 0.6035
 epoch: 93, train_loss: 0.2243, test_loss: 2.0052, test_f1: 0.6044
 epoch: 94, train_loss: 0.2190, test_loss: 1.9837, test_f1: 0.6069
 epoch: 95, train_loss: 0.2400, test_loss: 2.0121, test_f1: 0.5994
 epoch: 96, train_loss: 0.2185, test_loss: 2.0662, test_f1: 0.5762
 epoch: 97, train_loss: 0.2288, test_loss: 2.0388, test_f1: 0.5961
 epoch: 98, train_loss: 0.2311, test_loss: 2.0484, test_f1: 0.5814
 epoch: 99, train_loss: 0.2189, test_loss: 2.0445, test_f1: 0.6043
##################ITERATION #4 ****************************************
 epoch: 0, train_loss: 1.1488, test_loss: 1.3157, test_f1: 0.3011
 epoch: 1, train_loss: 1.0110, test_loss: 1.0509, test_f1: 0.4820
 epoch: 2, train_loss: 0.9647, test_loss: 1.0386, test_f1: 0.5244
 epoch: 3, train_loss: 0.9424, test_loss: 1.0173, test_f1: 0.5444
 epoch: 4, train_loss: 0.9241, test_loss: 1.0177, test_f1: 0.5773
 epoch: 5, train_loss: 0.9154, test_loss: 1.0103, test_f1: 0.5437
 epoch: 6, train_loss: 0.8979, test_loss: 1.0078, test_f1: 0.5682
 epoch: 7, train_loss: 0.8930, test_loss: 1.0070, test_f1: 0.5496
 epoch: 8, train_loss: 0.8685, test_loss: 0.9996, test_f1: 0.5930
 epoch: 9, train_loss: 0.8483, test_loss: 0.9949, test_f1: 0.5700
 epoch: 10, train_loss: 0.8360, test_loss: 1.0200, test_f1: 0.5517
 epoch: 11, train_loss: 0.8232, test_loss: 1.0021, test_f1: 0.5412
 epoch: 12, train_loss: 0.8048, test_loss: 1.0195, test_f1: 0.5815
 epoch: 13, train_loss: 0.7906, test_loss: 1.0629, test_f1: 0.5710
 epoch: 14, train_loss: 0.7678, test_loss: 1.0239, test_f1: 0.5581
 epoch: 15, train_loss: 0.7700, test_loss: 1.0425, test_f1: 0.5635
 epoch: 16, train_loss: 0.7620, test_loss: 1.0714, test_f1: 0.5629
 epoch: 17, train_loss: 0.7566, test_loss: 1.0336, test_f1: 0.6159
 epoch: 18, train_loss: 0.7323, test_loss: 1.0624, test_f1: 0.6036
 epoch: 19, train_loss: 0.7320, test_loss: 1.0504, test_f1: 0.6013
 epoch: 20, train_loss: 0.7081, test_loss: 1.0742, test_f1: 0.5809
 epoch: 21, train_loss: 0.6941, test_loss: 1.0728, test_f1: 0.6009
 epoch: 22, train_loss: 0.6875, test_loss: 1.0927, test_f1: 0.5788
 epoch: 23, train_loss: 0.6690, test_loss: 1.1173, test_f1: 0.5690
 epoch: 24, train_loss: 0.6779, test_loss: 1.0965, test_f1: 0.6179
 epoch: 25, train_loss: 0.6431, test_loss: 1.1401, test_f1: 0.5896
 epoch: 26, train_loss: 0.6387, test_loss: 1.1194, test_f1: 0.6060
 epoch: 27, train_loss: 0.6468, test_loss: 1.1087, test_f1: 0.6093
 epoch: 28, train_loss: 0.6107, test_loss: 1.1178, test_f1: 0.6207
 epoch: 29, train_loss: 0.6091, test_loss: 1.1139, test_f1: 0.6697
 epoch: 30, train_loss: 0.6017, test_loss: 1.1671, test_f1: 0.6132
 epoch: 31, train_loss: 0.5969, test_loss: 1.1533, test_f1: 0.6235
 epoch: 32, train_loss: 0.5849, test_loss: 1.1607, test_f1: 0.6055
 epoch: 33, train_loss: 0.5713, test_loss: 1.1495, test_f1: 0.5992
 epoch: 34, train_loss: 0.5555, test_loss: 1.1401, test_f1: 0.6493
 epoch: 35, train_loss: 0.5541, test_loss: 1.1688, test_f1: 0.6240
 epoch: 36, train_loss: 0.5505, test_loss: 1.1843, test_f1: 0.5973
 epoch: 37, train_loss: 0.5330, test_loss: 1.1920, test_f1: 0.6328
 epoch: 38, train_loss: 0.5248, test_loss: 1.1954, test_f1: 0.6293
 epoch: 39, train_loss: 0.5337, test_loss: 1.2227, test_f1: 0.6037
 epoch: 40, train_loss: 0.5048, test_loss: 1.2547, test_f1: 0.6177
 epoch: 41, train_loss: 0.5202, test_loss: 1.3160, test_f1: 0.6372
 epoch: 42, train_loss: 0.5160, test_loss: 1.2434, test_f1: 0.6519
 epoch: 43, train_loss: 0.5026, test_loss: 1.2804, test_f1: 0.6433
 epoch: 44, train_loss: 0.4989, test_loss: 1.2975, test_f1: 0.6193
 epoch: 45, train_loss: 0.4734, test_loss: 1.2944, test_f1: 0.6401
 epoch: 46, train_loss: 0.4767, test_loss: 1.2899, test_f1: 0.6227
 epoch: 47, train_loss: 0.4619, test_loss: 1.2916, test_f1: 0.6468
 epoch: 48, train_loss: 0.4593, test_loss: 1.3688, test_f1: 0.6345
 epoch: 49, train_loss: 0.4660, test_loss: 1.2560, test_f1: 0.6184
 epoch: 50, train_loss: 0.4558, test_loss: 1.3307, test_f1: 0.6456
 epoch: 51, train_loss: 0.4278, test_loss: 1.3217, test_f1: 0.6493
 epoch: 52, train_loss: 0.4098, test_loss: 1.3880, test_f1: 0.6359
 epoch: 53, train_loss: 0.3873, test_loss: 1.3593, test_f1: 0.6491
 epoch: 54, train_loss: 0.3936, test_loss: 1.3644, test_f1: 0.6492
 epoch: 55, train_loss: 0.3990, test_loss: 1.3999, test_f1: 0.6405
 epoch: 56, train_loss: 0.3897, test_loss: 1.4421, test_f1: 0.6470
 epoch: 57, train_loss: 0.3793, test_loss: 1.4439, test_f1: 0.6546
 epoch: 58, train_loss: 0.3870, test_loss: 1.4539, test_f1: 0.6405
 epoch: 59, train_loss: 0.3592, test_loss: 1.4371, test_f1: 0.6306
 epoch: 60, train_loss: 0.3739, test_loss: 1.4453, test_f1: 0.6528
 epoch: 61, train_loss: 0.3917, test_loss: 1.4516, test_f1: 0.6449
 epoch: 62, train_loss: 0.3711, test_loss: 1.4655, test_f1: 0.6538
 epoch: 63, train_loss: 0.3700, test_loss: 1.4577, test_f1: 0.6306
 epoch: 64, train_loss: 0.3341, test_loss: 1.5145, test_f1: 0.6488
 epoch: 65, train_loss: 0.3523, test_loss: 1.5682, test_f1: 0.6156
 epoch: 66, train_loss: 0.3480, test_loss: 1.5041, test_f1: 0.6522
 epoch: 67, train_loss: 0.3492, test_loss: 1.5760, test_f1: 0.6455
 epoch: 68, train_loss: 0.3542, test_loss: 1.5470, test_f1: 0.6252
 epoch: 69, train_loss: 0.3352, test_loss: 1.5702, test_f1: 0.6541
 epoch: 70, train_loss: 0.3395, test_loss: 1.6435, test_f1: 0.6390
 epoch: 71, train_loss: 0.3425, test_loss: 1.6060, test_f1: 0.6491
 epoch: 72, train_loss: 0.3257, test_loss: 1.5767, test_f1: 0.6486
 epoch: 73, train_loss: 0.3039, test_loss: 1.6316, test_f1: 0.6392
 epoch: 74, train_loss: 0.3102, test_loss: 1.6406, test_f1: 0.6484
 epoch: 75, train_loss: 0.3139, test_loss: 1.6756, test_f1: 0.6382
 epoch: 76, train_loss: 0.3080, test_loss: 1.7213, test_f1: 0.6448
 epoch: 77, train_loss: 0.3160, test_loss: 1.6706, test_f1: 0.6443
 epoch: 78, train_loss: 0.2876, test_loss: 1.6914, test_f1: 0.6345
 epoch: 79, train_loss: 0.3146, test_loss: 1.6909, test_f1: 0.6322
 epoch: 80, train_loss: 0.2985, test_loss: 1.7047, test_f1: 0.6289
 epoch: 81, train_loss: 0.2791, test_loss: 1.7142, test_f1: 0.6516
 epoch: 82, train_loss: 0.2680, test_loss: 1.7352, test_f1: 0.6457
 epoch: 83, train_loss: 0.2866, test_loss: 1.8551, test_f1: 0.6446
 epoch: 84, train_loss: 0.2833, test_loss: 1.8584, test_f1: 0.6057
 epoch: 85, train_loss: 0.2888, test_loss: 1.8276, test_f1: 0.6376
 epoch: 86, train_loss: 0.2754, test_loss: 1.8191, test_f1: 0.6277
 epoch: 87, train_loss: 0.2531, test_loss: 1.8202, test_f1: 0.6352
 epoch: 88, train_loss: 0.2733, test_loss: 1.8791, test_f1: 0.6400
 epoch: 89, train_loss: 0.2728, test_loss: 1.9038, test_f1: 0.6099
 epoch: 90, train_loss: 0.2737, test_loss: 1.8149, test_f1: 0.6356
 epoch: 91, train_loss: 0.2719, test_loss: 1.9401, test_f1: 0.6279
 epoch: 92, train_loss: 0.2694, test_loss: 1.9253, test_f1: 0.6397
 epoch: 93, train_loss: 0.2566, test_loss: 1.8996, test_f1: 0.6097
 epoch: 94, train_loss: 0.2558, test_loss: 1.9562, test_f1: 0.6309
 epoch: 95, train_loss: 0.2558, test_loss: 2.0319, test_f1: 0.6235
 epoch: 96, train_loss: 0.2500, test_loss: 1.9946, test_f1: 0.6333
 epoch: 97, train_loss: 0.2388, test_loss: 2.0065, test_f1: 0.6136
 epoch: 98, train_loss: 0.2461, test_loss: 1.9730, test_f1: 0.6282
 epoch: 99, train_loss: 0.2605, test_loss: 2.0279, test_f1: 0.6280
##################ITERATION #5 ****************************************
 epoch: 0, train_loss: 1.1808, test_loss: 1.2692, test_f1: 0.3246
 epoch: 1, train_loss: 1.0019, test_loss: 1.0803, test_f1: 0.4819
 epoch: 2, train_loss: 0.9902, test_loss: 1.0598, test_f1: 0.5202
 epoch: 3, train_loss: 0.9462, test_loss: 1.0284, test_f1: 0.5132
 epoch: 4, train_loss: 0.9139, test_loss: 1.0458, test_f1: 0.5554
 epoch: 5, train_loss: 0.9004, test_loss: 1.0333, test_f1: 0.5549
 epoch: 6, train_loss: 0.8888, test_loss: 1.0454, test_f1: 0.5461
 epoch: 7, train_loss: 0.8791, test_loss: 1.0187, test_f1: 0.5558
 epoch: 8, train_loss: 0.8556, test_loss: 1.0190, test_f1: 0.5457
 epoch: 9, train_loss: 0.8536, test_loss: 1.0112, test_f1: 0.5596
 epoch: 10, train_loss: 0.8169, test_loss: 1.0150, test_f1: 0.5948
 epoch: 11, train_loss: 0.8164, test_loss: 1.0085, test_f1: 0.6054
 epoch: 12, train_loss: 0.8125, test_loss: 1.0018, test_f1: 0.6061
 epoch: 13, train_loss: 0.7787, test_loss: 1.0056, test_f1: 0.5976
 epoch: 14, train_loss: 0.7636, test_loss: 1.0025, test_f1: 0.5911
 epoch: 15, train_loss: 0.7539, test_loss: 1.0136, test_f1: 0.5440
 epoch: 16, train_loss: 0.7316, test_loss: 1.0571, test_f1: 0.5592
 epoch: 17, train_loss: 0.7318, test_loss: 1.0396, test_f1: 0.5957
 epoch: 18, train_loss: 0.7086, test_loss: 1.0257, test_f1: 0.6058
 epoch: 19, train_loss: 0.6850, test_loss: 1.0043, test_f1: 0.5953
 epoch: 20, train_loss: 0.6899, test_loss: 1.0473, test_f1: 0.6095
 epoch: 21, train_loss: 0.6885, test_loss: 1.0517, test_f1: 0.6055
 epoch: 22, train_loss: 0.6711, test_loss: 1.0359, test_f1: 0.6230
 epoch: 23, train_loss: 0.6566, test_loss: 1.0667, test_f1: 0.6430
 epoch: 24, train_loss: 0.6390, test_loss: 1.0504, test_f1: 0.6207
 epoch: 25, train_loss: 0.6215, test_loss: 1.0535, test_f1: 0.6105
 epoch: 26, train_loss: 0.6354, test_loss: 1.0730, test_f1: 0.6417
 epoch: 27, train_loss: 0.6009, test_loss: 1.0514, test_f1: 0.6080
 epoch: 28, train_loss: 0.5959, test_loss: 1.0896, test_f1: 0.5988
 epoch: 29, train_loss: 0.5758, test_loss: 1.0965, test_f1: 0.6218
 epoch: 30, train_loss: 0.5616, test_loss: 1.1277, test_f1: 0.5975
 epoch: 31, train_loss: 0.5683, test_loss: 1.1080, test_f1: 0.6295
 epoch: 32, train_loss: 0.5683, test_loss: 1.0735, test_f1: 0.6546
 epoch: 33, train_loss: 0.5425, test_loss: 1.1323, test_f1: 0.6289
 epoch: 34, train_loss: 0.5351, test_loss: 1.1716, test_f1: 0.6253
 epoch: 35, train_loss: 0.5257, test_loss: 1.1959, test_f1: 0.6236
 epoch: 36, train_loss: 0.5232, test_loss: 1.2083, test_f1: 0.6494
 epoch: 37, train_loss: 0.5378, test_loss: 1.1716, test_f1: 0.6563
 epoch: 38, train_loss: 0.5060, test_loss: 1.1834, test_f1: 0.6178
 epoch: 39, train_loss: 0.5044, test_loss: 1.2442, test_f1: 0.6131
 epoch: 40, train_loss: 0.4803, test_loss: 1.2942, test_f1: 0.6231
 epoch: 41, train_loss: 0.5004, test_loss: 1.2419, test_f1: 0.6322
 epoch: 42, train_loss: 0.4668, test_loss: 1.2984, test_f1: 0.6270
 epoch: 43, train_loss: 0.4683, test_loss: 1.3655, test_f1: 0.5966
 epoch: 44, train_loss: 0.4647, test_loss: 1.3057, test_f1: 0.6267
 epoch: 45, train_loss: 0.4425, test_loss: 1.2967, test_f1: 0.6317
 epoch: 46, train_loss: 0.4523, test_loss: 1.3089, test_f1: 0.6281
 epoch: 47, train_loss: 0.4193, test_loss: 1.3838, test_f1: 0.6304
 epoch: 48, train_loss: 0.4146, test_loss: 1.3366, test_f1: 0.6331
 epoch: 49, train_loss: 0.4041, test_loss: 1.3905, test_f1: 0.6311
 epoch: 50, train_loss: 0.4148, test_loss: 1.4645, test_f1: 0.6351
 epoch: 51, train_loss: 0.4017, test_loss: 1.3806, test_f1: 0.6420
 epoch: 52, train_loss: 0.3835, test_loss: 1.3785, test_f1: 0.6451
 epoch: 53, train_loss: 0.3732, test_loss: 1.4146, test_f1: 0.6459
 epoch: 54, train_loss: 0.3763, test_loss: 1.4143, test_f1: 0.6481
 epoch: 55, train_loss: 0.3795, test_loss: 1.4234, test_f1: 0.6394
 epoch: 56, train_loss: 0.3529, test_loss: 1.4800, test_f1: 0.6482
 epoch: 57, train_loss: 0.3631, test_loss: 1.5062, test_f1: 0.6384
 epoch: 58, train_loss: 0.3386, test_loss: 1.4539, test_f1: 0.6363
 epoch: 59, train_loss: 0.3258, test_loss: 1.5379, test_f1: 0.6331
 epoch: 60, train_loss: 0.3316, test_loss: 1.4699, test_f1: 0.6479
 epoch: 61, train_loss: 0.3272, test_loss: 1.5583, test_f1: 0.6253
 epoch: 62, train_loss: 0.3280, test_loss: 1.5488, test_f1: 0.6355
 epoch: 63, train_loss: 0.3213, test_loss: 1.5447, test_f1: 0.6559
 epoch: 64, train_loss: 0.3320, test_loss: 1.5505, test_f1: 0.6329
 epoch: 65, train_loss: 0.3317, test_loss: 1.5908, test_f1: 0.6428
 epoch: 66, train_loss: 0.3004, test_loss: 1.5567, test_f1: 0.6481
 epoch: 67, train_loss: 0.3238, test_loss: 1.6579, test_f1: 0.6259
 epoch: 68, train_loss: 0.2992, test_loss: 1.6626, test_f1: 0.6355
 epoch: 69, train_loss: 0.3175, test_loss: 1.6168, test_f1: 0.6330
 epoch: 70, train_loss: 0.3039, test_loss: 1.6589, test_f1: 0.6221
 epoch: 71, train_loss: 0.2892, test_loss: 1.6541, test_f1: 0.6303
 epoch: 72, train_loss: 0.2875, test_loss: 1.6660, test_f1: 0.6382
 epoch: 73, train_loss: 0.2851, test_loss: 1.6848, test_f1: 0.6332
 epoch: 74, train_loss: 0.2716, test_loss: 1.6758, test_f1: 0.6397
 epoch: 75, train_loss: 0.2898, test_loss: 1.6992, test_f1: 0.6367
 epoch: 76, train_loss: 0.2853, test_loss: 1.7266, test_f1: 0.6289
 epoch: 77, train_loss: 0.2640, test_loss: 1.7687, test_f1: 0.6220
 epoch: 78, train_loss: 0.2796, test_loss: 1.7642, test_f1: 0.6303
 epoch: 79, train_loss: 0.2706, test_loss: 1.8011, test_f1: 0.6352
 epoch: 80, train_loss: 0.2847, test_loss: 1.8058, test_f1: 0.6276
 epoch: 81, train_loss: 0.2555, test_loss: 1.7690, test_f1: 0.6278
 epoch: 82, train_loss: 0.2677, test_loss: 1.8084, test_f1: 0.6282
 epoch: 83, train_loss: 0.2526, test_loss: 1.8289, test_f1: 0.6326
 epoch: 84, train_loss: 0.2596, test_loss: 1.7977, test_f1: 0.6219
 epoch: 85, train_loss: 0.2792, test_loss: 1.8638, test_f1: 0.6144
 epoch: 86, train_loss: 0.2617, test_loss: 1.9026, test_f1: 0.6265
 epoch: 87, train_loss: 0.2450, test_loss: 1.9016, test_f1: 0.6211
 epoch: 88, train_loss: 0.2377, test_loss: 1.8789, test_f1: 0.6236
 epoch: 89, train_loss: 0.2477, test_loss: 1.9523, test_f1: 0.6265
 epoch: 90, train_loss: 0.2339, test_loss: 1.9120, test_f1: 0.6253
 epoch: 91, train_loss: 0.2424, test_loss: 1.9260, test_f1: 0.6403
 epoch: 92, train_loss: 0.2458, test_loss: 1.9453, test_f1: 0.6206
 epoch: 93, train_loss: 0.2378, test_loss: 1.9659, test_f1: 0.6096
 epoch: 94, train_loss: 0.2431, test_loss: 2.0400, test_f1: 0.6262
 epoch: 95, train_loss: 0.2441, test_loss: 1.9772, test_f1: 0.6345
 epoch: 96, train_loss: 0.2369, test_loss: 1.9720, test_f1: 0.6334
 epoch: 97, train_loss: 0.2131, test_loss: 2.0281, test_f1: 0.6276
 epoch: 98, train_loss: 0.2078, test_loss: 1.9934, test_f1: 0.6326
 epoch: 99, train_loss: 0.2153, test_loss: 2.1437, test_f1: 0.6234
##################ITERATION #6 ****************************************
 epoch: 0, train_loss: 1.1769, test_loss: 1.3823, test_f1: 0.2987
 epoch: 1, train_loss: 1.0207, test_loss: 1.0582, test_f1: 0.5282
 epoch: 2, train_loss: 0.9925, test_loss: 1.0375, test_f1: 0.5542
 epoch: 3, train_loss: 0.9397, test_loss: 1.0341, test_f1: 0.5467
 epoch: 4, train_loss: 0.9307, test_loss: 1.0388, test_f1: 0.5201
 epoch: 5, train_loss: 0.8974, test_loss: 1.0325, test_f1: 0.5539
 epoch: 6, train_loss: 0.8739, test_loss: 1.0174, test_f1: 0.5354
 epoch: 7, train_loss: 0.8606, test_loss: 1.0093, test_f1: 0.5542
 epoch: 8, train_loss: 0.8443, test_loss: 1.0051, test_f1: 0.5496
 epoch: 9, train_loss: 0.8235, test_loss: 1.0354, test_f1: 0.5576
 epoch: 10, train_loss: 0.8009, test_loss: 1.0019, test_f1: 0.5689
 epoch: 11, train_loss: 0.7855, test_loss: 1.0135, test_f1: 0.5607
 epoch: 12, train_loss: 0.7739, test_loss: 1.0352, test_f1: 0.5627
 epoch: 13, train_loss: 0.7465, test_loss: 1.0178, test_f1: 0.5667
 epoch: 14, train_loss: 0.7355, test_loss: 1.0237, test_f1: 0.5800
 epoch: 15, train_loss: 0.7252, test_loss: 1.0266, test_f1: 0.5858
 epoch: 16, train_loss: 0.7290, test_loss: 1.0071, test_f1: 0.6131
 epoch: 17, train_loss: 0.7045, test_loss: 1.0360, test_f1: 0.5906
 epoch: 18, train_loss: 0.6942, test_loss: 1.0390, test_f1: 0.5790
 epoch: 19, train_loss: 0.6700, test_loss: 1.0463, test_f1: 0.6050
 epoch: 20, train_loss: 0.6400, test_loss: 1.0451, test_f1: 0.6130
 epoch: 21, train_loss: 0.6391, test_loss: 1.0438, test_f1: 0.5895
 epoch: 22, train_loss: 0.6290, test_loss: 1.0540, test_f1: 0.5958
 epoch: 23, train_loss: 0.6349, test_loss: 1.0547, test_f1: 0.6254
 epoch: 24, train_loss: 0.6129, test_loss: 1.1176, test_f1: 0.5907
 epoch: 25, train_loss: 0.6134, test_loss: 1.0632, test_f1: 0.6412
 epoch: 26, train_loss: 0.5851, test_loss: 1.0890, test_f1: 0.6175
 epoch: 27, train_loss: 0.5980, test_loss: 1.1347, test_f1: 0.6058
 epoch: 28, train_loss: 0.5606, test_loss: 1.1486, test_f1: 0.6046
 epoch: 29, train_loss: 0.5866, test_loss: 1.1641, test_f1: 0.5739
 epoch: 30, train_loss: 0.5577, test_loss: 1.1120, test_f1: 0.6183
 epoch: 31, train_loss: 0.5344, test_loss: 1.1621, test_f1: 0.6189
 epoch: 32, train_loss: 0.5290, test_loss: 1.1380, test_f1: 0.5975
 epoch: 33, train_loss: 0.5334, test_loss: 1.1962, test_f1: 0.6208
 epoch: 34, train_loss: 0.5016, test_loss: 1.2280, test_f1: 0.6171
 epoch: 35, train_loss: 0.5156, test_loss: 1.2544, test_f1: 0.5908
 epoch: 36, train_loss: 0.4847, test_loss: 1.2310, test_f1: 0.6323
 epoch: 37, train_loss: 0.4797, test_loss: 1.2852, test_f1: 0.5774
 epoch: 38, train_loss: 0.4895, test_loss: 1.2064, test_f1: 0.6034
 epoch: 39, train_loss: 0.4637, test_loss: 1.3042, test_f1: 0.6242
 epoch: 40, train_loss: 0.4499, test_loss: 1.2700, test_f1: 0.6404
 epoch: 41, train_loss: 0.4736, test_loss: 1.2986, test_f1: 0.6000
 epoch: 42, train_loss: 0.4734, test_loss: 1.3037, test_f1: 0.6267
 epoch: 43, train_loss: 0.4512, test_loss: 1.3453, test_f1: 0.6190
 epoch: 44, train_loss: 0.4319, test_loss: 1.3240, test_f1: 0.6150
 epoch: 45, train_loss: 0.4273, test_loss: 1.3370, test_f1: 0.6270
 epoch: 46, train_loss: 0.4345, test_loss: 1.3359, test_f1: 0.6165
 epoch: 47, train_loss: 0.4096, test_loss: 1.3929, test_f1: 0.6139
 epoch: 48, train_loss: 0.4110, test_loss: 1.4353, test_f1: 0.6220
 epoch: 49, train_loss: 0.4206, test_loss: 1.4250, test_f1: 0.6059
 epoch: 50, train_loss: 0.3941, test_loss: 1.4109, test_f1: 0.6122
 epoch: 51, train_loss: 0.3970, test_loss: 1.3739, test_f1: 0.6247
 epoch: 52, train_loss: 0.3593, test_loss: 1.4646, test_f1: 0.5952
 epoch: 53, train_loss: 0.3709, test_loss: 1.4836, test_f1: 0.6161
 epoch: 54, train_loss: 0.3438, test_loss: 1.4807, test_f1: 0.6128
 epoch: 55, train_loss: 0.3367, test_loss: 1.5100, test_f1: 0.5929
 epoch: 56, train_loss: 0.3225, test_loss: 1.5770, test_f1: 0.5899
 epoch: 57, train_loss: 0.3279, test_loss: 1.5742, test_f1: 0.5988
 epoch: 58, train_loss: 0.3383, test_loss: 1.5642, test_f1: 0.5954
 epoch: 59, train_loss: 0.3387, test_loss: 1.5246, test_f1: 0.6080
 epoch: 60, train_loss: 0.3314, test_loss: 1.5693, test_f1: 0.5850
 epoch: 61, train_loss: 0.3347, test_loss: 1.5949, test_f1: 0.6010
 epoch: 62, train_loss: 0.3005, test_loss: 1.5731, test_f1: 0.6011
 epoch: 63, train_loss: 0.3253, test_loss: 1.5373, test_f1: 0.5998
 epoch: 64, train_loss: 0.2955, test_loss: 1.6317, test_f1: 0.5956
 epoch: 65, train_loss: 0.3076, test_loss: 1.6594, test_f1: 0.5852
 epoch: 66, train_loss: 0.3072, test_loss: 1.6606, test_f1: 0.5749
 epoch: 67, train_loss: 0.2946, test_loss: 1.5894, test_f1: 0.5876
 epoch: 68, train_loss: 0.2856, test_loss: 1.6424, test_f1: 0.5945
 epoch: 69, train_loss: 0.3073, test_loss: 1.6595, test_f1: 0.5894
 epoch: 70, train_loss: 0.2937, test_loss: 1.6977, test_f1: 0.5848
 epoch: 71, train_loss: 0.2846, test_loss: 1.6695, test_f1: 0.5870
 epoch: 72, train_loss: 0.2717, test_loss: 1.6953, test_f1: 0.5893
 epoch: 73, train_loss: 0.2787, test_loss: 1.6913, test_f1: 0.5830
 epoch: 74, train_loss: 0.2826, test_loss: 1.7781, test_f1: 0.5901
 epoch: 75, train_loss: 0.2820, test_loss: 1.7532, test_f1: 0.5751
 epoch: 76, train_loss: 0.2707, test_loss: 1.7794, test_f1: 0.5838
 epoch: 77, train_loss: 0.2732, test_loss: 1.9092, test_f1: 0.5790
 epoch: 78, train_loss: 0.2499, test_loss: 1.8639, test_f1: 0.5850
 epoch: 79, train_loss: 0.2699, test_loss: 1.7966, test_f1: 0.5757
 epoch: 80, train_loss: 0.2695, test_loss: 1.9114, test_f1: 0.5861
 epoch: 81, train_loss: 0.2444, test_loss: 1.8922, test_f1: 0.5926
 epoch: 82, train_loss: 0.2506, test_loss: 1.8508, test_f1: 0.5927
 epoch: 83, train_loss: 0.2616, test_loss: 1.9266, test_f1: 0.5729
 epoch: 84, train_loss: 0.2588, test_loss: 1.9239, test_f1: 0.5768
 epoch: 85, train_loss: 0.2463, test_loss: 1.8815, test_f1: 0.5809
 epoch: 86, train_loss: 0.2458, test_loss: 1.8974, test_f1: 0.5830
 epoch: 87, train_loss: 0.2229, test_loss: 1.8931, test_f1: 0.5875
 epoch: 88, train_loss: 0.2608, test_loss: 1.9520, test_f1: 0.5857
 epoch: 89, train_loss: 0.2375, test_loss: 1.9248, test_f1: 0.5849
 epoch: 90, train_loss: 0.2469, test_loss: 2.0421, test_f1: 0.5833
 epoch: 91, train_loss: 0.2347, test_loss: 2.0230, test_f1: 0.5857
 epoch: 92, train_loss: 0.2403, test_loss: 1.9875, test_f1: 0.5793
 epoch: 93, train_loss: 0.2393, test_loss: 2.0045, test_f1: 0.5788
 epoch: 94, train_loss: 0.2172, test_loss: 1.9788, test_f1: 0.5868
 epoch: 95, train_loss: 0.2212, test_loss: 2.0562, test_f1: 0.5754
 epoch: 96, train_loss: 0.2213, test_loss: 2.1610, test_f1: 0.5694
 epoch: 97, train_loss: 0.2030, test_loss: 1.9824, test_f1: 0.6002
 epoch: 98, train_loss: 0.2188, test_loss: 2.1002, test_f1: 0.5817
 epoch: 99, train_loss: 0.2209, test_loss: 2.0640, test_f1: 0.5783
##################ITERATION #7 ****************************************
 epoch: 0, train_loss: 1.1825, test_loss: 1.2429, test_f1: 0.4135
 epoch: 1, train_loss: 1.0507, test_loss: 1.0798, test_f1: 0.4927
 epoch: 2, train_loss: 1.0096, test_loss: 1.0591, test_f1: 0.5081
 epoch: 3, train_loss: 0.9692, test_loss: 1.0583, test_f1: 0.5324
 epoch: 4, train_loss: 0.9271, test_loss: 1.0160, test_f1: 0.5331
 epoch: 5, train_loss: 0.9214, test_loss: 1.0154, test_f1: 0.5344
 epoch: 6, train_loss: 0.8846, test_loss: 1.0208, test_f1: 0.5290
 epoch: 7, train_loss: 0.8673, test_loss: 0.9971, test_f1: 0.5521
 epoch: 8, train_loss: 0.8452, test_loss: 1.0228, test_f1: 0.5758
 epoch: 9, train_loss: 0.8522, test_loss: 1.0139, test_f1: 0.5740
 epoch: 10, train_loss: 0.8040, test_loss: 1.0216, test_f1: 0.5464
 epoch: 11, train_loss: 0.8064, test_loss: 1.0251, test_f1: 0.5694
 epoch: 12, train_loss: 0.7922, test_loss: 1.0248, test_f1: 0.5712
 epoch: 13, train_loss: 0.7480, test_loss: 1.0202, test_f1: 0.5678
 epoch: 14, train_loss: 0.7515, test_loss: 1.0282, test_f1: 0.6237
 epoch: 15, train_loss: 0.7474, test_loss: 1.0138, test_f1: 0.5707
 epoch: 16, train_loss: 0.7282, test_loss: 1.0324, test_f1: 0.6004
 epoch: 17, train_loss: 0.7055, test_loss: 1.0585, test_f1: 0.5809
 epoch: 18, train_loss: 0.7162, test_loss: 1.0149, test_f1: 0.5943
 epoch: 19, train_loss: 0.6853, test_loss: 1.0687, test_f1: 0.5787
 epoch: 20, train_loss: 0.6692, test_loss: 1.0839, test_f1: 0.5826
 epoch: 21, train_loss: 0.6596, test_loss: 1.1134, test_f1: 0.5819
 epoch: 22, train_loss: 0.6648, test_loss: 1.1305, test_f1: 0.6077
 epoch: 23, train_loss: 0.6390, test_loss: 1.1387, test_f1: 0.5971
 epoch: 24, train_loss: 0.6149, test_loss: 1.1261, test_f1: 0.6105
 epoch: 25, train_loss: 0.6291, test_loss: 1.1249, test_f1: 0.5995
 epoch: 26, train_loss: 0.5937, test_loss: 1.1462, test_f1: 0.6126
 epoch: 27, train_loss: 0.5982, test_loss: 1.1080, test_f1: 0.6126
 epoch: 28, train_loss: 0.5796, test_loss: 1.1459, test_f1: 0.6053
 epoch: 29, train_loss: 0.5717, test_loss: 1.1947, test_f1: 0.5923
 epoch: 30, train_loss: 0.5499, test_loss: 1.1839, test_f1: 0.6132
 epoch: 31, train_loss: 0.5614, test_loss: 1.2034, test_f1: 0.6196
 epoch: 32, train_loss: 0.5479, test_loss: 1.1895, test_f1: 0.6482
 epoch: 33, train_loss: 0.5304, test_loss: 1.2447, test_f1: 0.6096
 epoch: 34, train_loss: 0.5160, test_loss: 1.1955, test_f1: 0.6018
 epoch: 35, train_loss: 0.5173, test_loss: 1.2259, test_f1: 0.6244
 epoch: 36, train_loss: 0.5040, test_loss: 1.3078, test_f1: 0.6051
 epoch: 37, train_loss: 0.5053, test_loss: 1.2842, test_f1: 0.6267
 epoch: 38, train_loss: 0.4848, test_loss: 1.3040, test_f1: 0.5928
 epoch: 39, train_loss: 0.4656, test_loss: 1.3321, test_f1: 0.5994
 epoch: 40, train_loss: 0.4504, test_loss: 1.3653, test_f1: 0.6204
 epoch: 41, train_loss: 0.4374, test_loss: 1.3591, test_f1: 0.6140
 epoch: 42, train_loss: 0.4545, test_loss: 1.3783, test_f1: 0.6092
 epoch: 43, train_loss: 0.4622, test_loss: 1.3814, test_f1: 0.6184
 epoch: 44, train_loss: 0.4352, test_loss: 1.3606, test_f1: 0.5950
 epoch: 45, train_loss: 0.4400, test_loss: 1.4037, test_f1: 0.6315
 epoch: 46, train_loss: 0.4480, test_loss: 1.4236, test_f1: 0.6078
 epoch: 47, train_loss: 0.4145, test_loss: 1.3990, test_f1: 0.6239
 epoch: 48, train_loss: 0.4065, test_loss: 1.4477, test_f1: 0.6231
 epoch: 49, train_loss: 0.4041, test_loss: 1.4515, test_f1: 0.6259
 epoch: 50, train_loss: 0.3722, test_loss: 1.5019, test_f1: 0.6255
 epoch: 51, train_loss: 0.3603, test_loss: 1.4770, test_f1: 0.6212
 epoch: 52, train_loss: 0.3567, test_loss: 1.5739, test_f1: 0.6345
 epoch: 53, train_loss: 0.3426, test_loss: 1.4943, test_f1: 0.6252
 epoch: 54, train_loss: 0.3429, test_loss: 1.5327, test_f1: 0.6212
 epoch: 55, train_loss: 0.3345, test_loss: 1.5150, test_f1: 0.6095
 epoch: 56, train_loss: 0.3347, test_loss: 1.5519, test_f1: 0.6114
 epoch: 57, train_loss: 0.3234, test_loss: 1.6201, test_f1: 0.6193
 epoch: 58, train_loss: 0.3383, test_loss: 1.5782, test_f1: 0.6019
 epoch: 59, train_loss: 0.3042, test_loss: 1.5943, test_f1: 0.6105
 epoch: 60, train_loss: 0.2962, test_loss: 1.5934, test_f1: 0.6273
 epoch: 61, train_loss: 0.3064, test_loss: 1.6437, test_f1: 0.6291
 epoch: 62, train_loss: 0.3012, test_loss: 1.6783, test_f1: 0.6315
 epoch: 63, train_loss: 0.2929, test_loss: 1.6865, test_f1: 0.6283
 epoch: 64, train_loss: 0.2922, test_loss: 1.7060, test_f1: 0.6300
 epoch: 65, train_loss: 0.2888, test_loss: 1.7259, test_f1: 0.6148
 epoch: 66, train_loss: 0.2805, test_loss: 1.7407, test_f1: 0.6301
 epoch: 67, train_loss: 0.2859, test_loss: 1.7263, test_f1: 0.6288
 epoch: 68, train_loss: 0.2914, test_loss: 1.7565, test_f1: 0.6076
 epoch: 69, train_loss: 0.2965, test_loss: 1.8470, test_f1: 0.6357
 epoch: 70, train_loss: 0.2955, test_loss: 1.7874, test_f1: 0.6165
 epoch: 71, train_loss: 0.2641, test_loss: 1.8377, test_f1: 0.6214
 epoch: 72, train_loss: 0.2888, test_loss: 1.8598, test_f1: 0.6129
 epoch: 73, train_loss: 0.2764, test_loss: 1.8691, test_f1: 0.6189
 epoch: 74, train_loss: 0.2824, test_loss: 1.8833, test_f1: 0.6168
 epoch: 75, train_loss: 0.2574, test_loss: 1.8386, test_f1: 0.6214
 epoch: 76, train_loss: 0.2693, test_loss: 1.9586, test_f1: 0.6271
 epoch: 77, train_loss: 0.2461, test_loss: 1.8486, test_f1: 0.6123
 epoch: 78, train_loss: 0.2568, test_loss: 1.9501, test_f1: 0.6287
 epoch: 79, train_loss: 0.2588, test_loss: 1.9599, test_f1: 0.6145
 epoch: 80, train_loss: 0.2462, test_loss: 1.9948, test_f1: 0.6117
 epoch: 81, train_loss: 0.2520, test_loss: 1.9885, test_f1: 0.6209
 epoch: 82, train_loss: 0.2482, test_loss: 1.9415, test_f1: 0.6162
 epoch: 83, train_loss: 0.2343, test_loss: 1.9881, test_f1: 0.6324
 epoch: 84, train_loss: 0.2595, test_loss: 1.9853, test_f1: 0.6243
 epoch: 85, train_loss: 0.2559, test_loss: 2.0482, test_f1: 0.6143
 epoch: 86, train_loss: 0.2488, test_loss: 1.9848, test_f1: 0.6178
 epoch: 87, train_loss: 0.2272, test_loss: 2.0926, test_f1: 0.6262
 epoch: 88, train_loss: 0.2158, test_loss: 2.0375, test_f1: 0.6263
 epoch: 89, train_loss: 0.1970, test_loss: 2.0502, test_f1: 0.6199
 epoch: 90, train_loss: 0.2142, test_loss: 2.1098, test_f1: 0.6180
 epoch: 91, train_loss: 0.2286, test_loss: 2.0827, test_f1: 0.6099
 epoch: 92, train_loss: 0.2162, test_loss: 2.1399, test_f1: 0.6126
 epoch: 93, train_loss: 0.1984, test_loss: 2.1664, test_f1: 0.6222
 epoch: 94, train_loss: 0.2050, test_loss: 2.1307, test_f1: 0.6103
 epoch: 95, train_loss: 0.2128, test_loss: 2.2509, test_f1: 0.6176
 epoch: 96, train_loss: 0.2344, test_loss: 2.1967, test_f1: 0.6211
 epoch: 97, train_loss: 0.2157, test_loss: 2.2007, test_f1: 0.6229
 epoch: 98, train_loss: 0.2135, test_loss: 2.1670, test_f1: 0.6119
 epoch: 99, train_loss: 0.1960, test_loss: 2.2710, test_f1: 0.6069
##################ITERATION #8 ****************************************
 epoch: 0, train_loss: 1.2251, test_loss: 1.3668, test_f1: 0.3320
 epoch: 1, train_loss: 1.0517, test_loss: 1.0709, test_f1: 0.4964
 epoch: 2, train_loss: 0.9969, test_loss: 1.0235, test_f1: 0.5179
 epoch: 3, train_loss: 0.9578, test_loss: 1.0306, test_f1: 0.5122
 epoch: 4, train_loss: 0.9190, test_loss: 1.0191, test_f1: 0.5417
 epoch: 5, train_loss: 0.9095, test_loss: 1.0206, test_f1: 0.5394
 epoch: 6, train_loss: 0.8914, test_loss: 1.0157, test_f1: 0.5422
 epoch: 7, train_loss: 0.8650, test_loss: 1.0102, test_f1: 0.5631
 epoch: 8, train_loss: 0.8442, test_loss: 1.0468, test_f1: 0.5263
 epoch: 9, train_loss: 0.8186, test_loss: 1.0179, test_f1: 0.5626
 epoch: 10, train_loss: 0.8151, test_loss: 1.0108, test_f1: 0.5644
 epoch: 11, train_loss: 0.7927, test_loss: 1.0307, test_f1: 0.5761
 epoch: 12, train_loss: 0.7783, test_loss: 1.0258, test_f1: 0.5989
 epoch: 13, train_loss: 0.7815, test_loss: 1.0182, test_f1: 0.5906
 epoch: 14, train_loss: 0.7464, test_loss: 1.0516, test_f1: 0.5999
 epoch: 15, train_loss: 0.7431, test_loss: 1.0337, test_f1: 0.6081
 epoch: 16, train_loss: 0.7346, test_loss: 1.0310, test_f1: 0.5998
 epoch: 17, train_loss: 0.7258, test_loss: 1.0304, test_f1: 0.6045
 epoch: 18, train_loss: 0.6948, test_loss: 1.0408, test_f1: 0.6340
 epoch: 19, train_loss: 0.7137, test_loss: 1.0727, test_f1: 0.5990
 epoch: 20, train_loss: 0.6700, test_loss: 1.0703, test_f1: 0.6074
 epoch: 21, train_loss: 0.6654, test_loss: 1.0482, test_f1: 0.6160
 epoch: 22, train_loss: 0.6801, test_loss: 1.0845, test_f1: 0.5955
 epoch: 23, train_loss: 0.6446, test_loss: 1.0599, test_f1: 0.6173
 epoch: 24, train_loss: 0.6447, test_loss: 1.0697, test_f1: 0.6517
 epoch: 25, train_loss: 0.6301, test_loss: 1.0728, test_f1: 0.6395
 epoch: 26, train_loss: 0.6272, test_loss: 1.0708, test_f1: 0.6173
 epoch: 27, train_loss: 0.6060, test_loss: 1.1086, test_f1: 0.6212
 epoch: 28, train_loss: 0.6038, test_loss: 1.1225, test_f1: 0.6207
 epoch: 29, train_loss: 0.5838, test_loss: 1.1123, test_f1: 0.6367
 epoch: 30, train_loss: 0.5754, test_loss: 1.1215, test_f1: 0.6271
 epoch: 31, train_loss: 0.5640, test_loss: 1.1210, test_f1: 0.6153
 epoch: 32, train_loss: 0.5452, test_loss: 1.1626, test_f1: 0.6374
 epoch: 33, train_loss: 0.5232, test_loss: 1.1335, test_f1: 0.6577
 epoch: 34, train_loss: 0.5663, test_loss: 1.1472, test_f1: 0.6189
 epoch: 35, train_loss: 0.5342, test_loss: 1.1543, test_f1: 0.6283
 epoch: 36, train_loss: 0.5230, test_loss: 1.2072, test_f1: 0.6312
 epoch: 37, train_loss: 0.5224, test_loss: 1.2364, test_f1: 0.6347
 epoch: 38, train_loss: 0.5030, test_loss: 1.2067, test_f1: 0.6290
 epoch: 39, train_loss: 0.4863, test_loss: 1.1856, test_f1: 0.6302
 epoch: 40, train_loss: 0.4881, test_loss: 1.2298, test_f1: 0.6484
 epoch: 41, train_loss: 0.4750, test_loss: 1.2150, test_f1: 0.6240
 epoch: 42, train_loss: 0.4624, test_loss: 1.2037, test_f1: 0.6512
 epoch: 43, train_loss: 0.4380, test_loss: 1.2785, test_f1: 0.6294
 epoch: 44, train_loss: 0.4702, test_loss: 1.2837, test_f1: 0.6475
 epoch: 45, train_loss: 0.4271, test_loss: 1.2893, test_f1: 0.6393
 epoch: 46, train_loss: 0.4305, test_loss: 1.3783, test_f1: 0.6460
 epoch: 47, train_loss: 0.4135, test_loss: 1.3876, test_f1: 0.6339
 epoch: 48, train_loss: 0.4594, test_loss: 1.3970, test_f1: 0.6420
 epoch: 49, train_loss: 0.4416, test_loss: 1.3888, test_f1: 0.6293
 epoch: 50, train_loss: 0.4317, test_loss: 1.3342, test_f1: 0.6326
 epoch: 51, train_loss: 0.3966, test_loss: 1.3765, test_f1: 0.6299
 epoch: 52, train_loss: 0.3651, test_loss: 1.3678, test_f1: 0.6366
 epoch: 53, train_loss: 0.3608, test_loss: 1.4386, test_f1: 0.6441
 epoch: 54, train_loss: 0.3772, test_loss: 1.3954, test_f1: 0.6528
 epoch: 55, train_loss: 0.3615, test_loss: 1.4887, test_f1: 0.6402
 epoch: 56, train_loss: 0.3719, test_loss: 1.4326, test_f1: 0.6146
 epoch: 57, train_loss: 0.3809, test_loss: 1.4744, test_f1: 0.6409
 epoch: 58, train_loss: 0.3417, test_loss: 1.5310, test_f1: 0.6248
 epoch: 59, train_loss: 0.3549, test_loss: 1.5216, test_f1: 0.6178
 epoch: 60, train_loss: 0.3476, test_loss: 1.5561, test_f1: 0.6337
 epoch: 61, train_loss: 0.3263, test_loss: 1.5007, test_f1: 0.6341
 epoch: 62, train_loss: 0.3190, test_loss: 1.5621, test_f1: 0.6269
 epoch: 63, train_loss: 0.3183, test_loss: 1.5200, test_f1: 0.6361
 epoch: 64, train_loss: 0.3224, test_loss: 1.5760, test_f1: 0.6398
 epoch: 65, train_loss: 0.3249, test_loss: 1.5541, test_f1: 0.6293
 epoch: 66, train_loss: 0.3003, test_loss: 1.6608, test_f1: 0.5978
 epoch: 67, train_loss: 0.2969, test_loss: 1.5856, test_f1: 0.6197
 epoch: 68, train_loss: 0.3146, test_loss: 1.6196, test_f1: 0.6387
 epoch: 69, train_loss: 0.2887, test_loss: 1.6123, test_f1: 0.6441
 epoch: 70, train_loss: 0.2918, test_loss: 1.6956, test_f1: 0.6231
 epoch: 71, train_loss: 0.3038, test_loss: 1.6452, test_f1: 0.6105
 epoch: 72, train_loss: 0.2894, test_loss: 1.6525, test_f1: 0.6428
 epoch: 73, train_loss: 0.2920, test_loss: 1.7684, test_f1: 0.6083
 epoch: 74, train_loss: 0.2908, test_loss: 1.7169, test_f1: 0.6174
 epoch: 75, train_loss: 0.2840, test_loss: 1.7584, test_f1: 0.6171
 epoch: 76, train_loss: 0.2957, test_loss: 1.7017, test_f1: 0.6223
 epoch: 77, train_loss: 0.2773, test_loss: 1.7849, test_f1: 0.6265
 epoch: 78, train_loss: 0.2780, test_loss: 1.7700, test_f1: 0.6097
 epoch: 79, train_loss: 0.2681, test_loss: 1.6982, test_f1: 0.6288
 epoch: 80, train_loss: 0.2692, test_loss: 1.8022, test_f1: 0.6186
 epoch: 81, train_loss: 0.2605, test_loss: 1.8211, test_f1: 0.6277
 epoch: 82, train_loss: 0.2630, test_loss: 1.8287, test_f1: 0.6337
 epoch: 83, train_loss: 0.2599, test_loss: 1.7619, test_f1: 0.6241
 epoch: 84, train_loss: 0.2529, test_loss: 1.8622, test_f1: 0.6206
 epoch: 85, train_loss: 0.2694, test_loss: 1.8929, test_f1: 0.6205
 epoch: 86, train_loss: 0.2388, test_loss: 1.8157, test_f1: 0.6415
 epoch: 87, train_loss: 0.2619, test_loss: 1.8717, test_f1: 0.6367
 epoch: 88, train_loss: 0.2441, test_loss: 1.8397, test_f1: 0.6136
 epoch: 89, train_loss: 0.2269, test_loss: 1.8660, test_f1: 0.6299
 epoch: 90, train_loss: 0.2450, test_loss: 1.8905, test_f1: 0.6142
 epoch: 91, train_loss: 0.2442, test_loss: 1.9704, test_f1: 0.6196
 epoch: 92, train_loss: 0.2287, test_loss: 1.9670, test_f1: 0.6337
 epoch: 93, train_loss: 0.2226, test_loss: 2.0162, test_f1: 0.6138
 epoch: 94, train_loss: 0.2167, test_loss: 1.9565, test_f1: 0.6143
 epoch: 95, train_loss: 0.2325, test_loss: 2.0046, test_f1: 0.6160
 epoch: 96, train_loss: 0.2174, test_loss: 1.9911, test_f1: 0.6143
 epoch: 97, train_loss: 0.2463, test_loss: 2.0782, test_f1: 0.6213
 epoch: 98, train_loss: 0.2095, test_loss: 2.0400, test_f1: 0.6134
 epoch: 99, train_loss: 0.2245, test_loss: 2.0048, test_f1: 0.6111
##################ITERATION #9 ****************************************
 epoch: 0, train_loss: 1.2568, test_loss: 1.3508, test_f1: 0.2689
 epoch: 1, train_loss: 1.0433, test_loss: 1.0627, test_f1: 0.5140
 epoch: 2, train_loss: 1.0259, test_loss: 1.0357, test_f1: 0.5131
 epoch: 3, train_loss: 0.9396, test_loss: 1.0224, test_f1: 0.5694
 epoch: 4, train_loss: 0.9386, test_loss: 1.0039, test_f1: 0.5378
 epoch: 5, train_loss: 0.9164, test_loss: 0.9921, test_f1: 0.5545
 epoch: 6, train_loss: 0.8913, test_loss: 1.0169, test_f1: 0.4827
 epoch: 7, train_loss: 0.8436, test_loss: 1.0088, test_f1: 0.5384
 epoch: 8, train_loss: 0.8536, test_loss: 1.0003, test_f1: 0.5360
 epoch: 9, train_loss: 0.8343, test_loss: 0.9882, test_f1: 0.5365
 epoch: 10, train_loss: 0.8129, test_loss: 0.9957, test_f1: 0.5503
 epoch: 11, train_loss: 0.7860, test_loss: 1.0046, test_f1: 0.5450
 epoch: 12, train_loss: 0.7708, test_loss: 0.9733, test_f1: 0.5851
 epoch: 13, train_loss: 0.7542, test_loss: 1.0258, test_f1: 0.5635
 epoch: 14, train_loss: 0.7540, test_loss: 1.0093, test_f1: 0.5854
 epoch: 15, train_loss: 0.7342, test_loss: 0.9772, test_f1: 0.5947
 epoch: 16, train_loss: 0.7203, test_loss: 0.9744, test_f1: 0.5828
 epoch: 17, train_loss: 0.7293, test_loss: 1.0097, test_f1: 0.5960
 epoch: 18, train_loss: 0.7016, test_loss: 0.9874, test_f1: 0.6398
 epoch: 19, train_loss: 0.6934, test_loss: 1.0072, test_f1: 0.6105
 epoch: 20, train_loss: 0.6866, test_loss: 1.0036, test_f1: 0.5962
 epoch: 21, train_loss: 0.6705, test_loss: 1.0350, test_f1: 0.6236
 epoch: 22, train_loss: 0.6396, test_loss: 1.0537, test_f1: 0.6187
 epoch: 23, train_loss: 0.6360, test_loss: 1.0229, test_f1: 0.6056
 epoch: 24, train_loss: 0.6434, test_loss: 1.0508, test_f1: 0.6162
 epoch: 25, train_loss: 0.6286, test_loss: 1.0723, test_f1: 0.6179
 epoch: 26, train_loss: 0.6562, test_loss: 1.0500, test_f1: 0.6145
 epoch: 27, train_loss: 0.6188, test_loss: 1.0821, test_f1: 0.6405
 epoch: 28, train_loss: 0.6181, test_loss: 1.0984, test_f1: 0.6278
 epoch: 29, train_loss: 0.5939, test_loss: 1.1039, test_f1: 0.6274
 epoch: 30, train_loss: 0.5949, test_loss: 1.0774, test_f1: 0.6144
 epoch: 31, train_loss: 0.5557, test_loss: 1.0949, test_f1: 0.6438
 epoch: 32, train_loss: 0.5827, test_loss: 1.1082, test_f1: 0.6297
 epoch: 33, train_loss: 0.5368, test_loss: 1.1299, test_f1: 0.6249
 epoch: 34, train_loss: 0.5446, test_loss: 1.1934, test_f1: 0.6271
 epoch: 35, train_loss: 0.5448, test_loss: 1.1365, test_f1: 0.6382
 epoch: 36, train_loss: 0.5216, test_loss: 1.1584, test_f1: 0.6368
 epoch: 37, train_loss: 0.5065, test_loss: 1.1918, test_f1: 0.6373
 epoch: 38, train_loss: 0.5195, test_loss: 1.1465, test_f1: 0.6329
 epoch: 39, train_loss: 0.5160, test_loss: 1.2052, test_f1: 0.6421
 epoch: 40, train_loss: 0.4990, test_loss: 1.2040, test_f1: 0.6200
 epoch: 41, train_loss: 0.4915, test_loss: 1.2123, test_f1: 0.6401
 epoch: 42, train_loss: 0.4982, test_loss: 1.2103, test_f1: 0.6621
 epoch: 43, train_loss: 0.4739, test_loss: 1.2149, test_f1: 0.6288
 epoch: 44, train_loss: 0.4654, test_loss: 1.2235, test_f1: 0.6541
 epoch: 45, train_loss: 0.4445, test_loss: 1.2619, test_f1: 0.6494
 epoch: 46, train_loss: 0.4446, test_loss: 1.2646, test_f1: 0.6432
 epoch: 47, train_loss: 0.4530, test_loss: 1.2832, test_f1: 0.6526
 epoch: 48, train_loss: 0.4356, test_loss: 1.3240, test_f1: 0.6545
 epoch: 49, train_loss: 0.4350, test_loss: 1.3463, test_f1: 0.6246
 epoch: 50, train_loss: 0.4331, test_loss: 1.2848, test_f1: 0.6304
 epoch: 51, train_loss: 0.4002, test_loss: 1.3165, test_f1: 0.6439
 epoch: 52, train_loss: 0.3906, test_loss: 1.3051, test_f1: 0.6575
 epoch: 53, train_loss: 0.4025, test_loss: 1.3233, test_f1: 0.6467
 epoch: 54, train_loss: 0.3853, test_loss: 1.3461, test_f1: 0.6430
 epoch: 55, train_loss: 0.3767, test_loss: 1.3532, test_f1: 0.6594
 epoch: 56, train_loss: 0.3635, test_loss: 1.3688, test_f1: 0.6476
 epoch: 57, train_loss: 0.3737, test_loss: 1.4116, test_f1: 0.6321
 epoch: 58, train_loss: 0.3604, test_loss: 1.3905, test_f1: 0.6469
 epoch: 59, train_loss: 0.3555, test_loss: 1.4254, test_f1: 0.6485
 epoch: 60, train_loss: 0.3387, test_loss: 1.4245, test_f1: 0.6488
 epoch: 61, train_loss: 0.3336, test_loss: 1.3910, test_f1: 0.6627
 epoch: 62, train_loss: 0.3372, test_loss: 1.4492, test_f1: 0.6543
 epoch: 63, train_loss: 0.3443, test_loss: 1.4352, test_f1: 0.6360
 epoch: 64, train_loss: 0.3359, test_loss: 1.4425, test_f1: 0.6390
 epoch: 65, train_loss: 0.3281, test_loss: 1.4999, test_f1: 0.6422
 epoch: 66, train_loss: 0.3313, test_loss: 1.5219, test_f1: 0.6439
 epoch: 67, train_loss: 0.3085, test_loss: 1.5091, test_f1: 0.6406
 epoch: 68, train_loss: 0.3296, test_loss: 1.5052, test_f1: 0.6443
 epoch: 69, train_loss: 0.3125, test_loss: 1.4768, test_f1: 0.6398
 epoch: 70, train_loss: 0.3054, test_loss: 1.5101, test_f1: 0.6461
 epoch: 71, train_loss: 0.3125, test_loss: 1.5618, test_f1: 0.6304
 epoch: 72, train_loss: 0.3106, test_loss: 1.5827, test_f1: 0.6322
 epoch: 73, train_loss: 0.3079, test_loss: 1.5517, test_f1: 0.6490
 epoch: 74, train_loss: 0.2981, test_loss: 1.5581, test_f1: 0.6384
 epoch: 75, train_loss: 0.3096, test_loss: 1.6151, test_f1: 0.6249
 epoch: 76, train_loss: 0.3131, test_loss: 1.5814, test_f1: 0.6292
 epoch: 77, train_loss: 0.2640, test_loss: 1.5984, test_f1: 0.6430
 epoch: 78, train_loss: 0.2791, test_loss: 1.6475, test_f1: 0.6253
 epoch: 79, train_loss: 0.2907, test_loss: 1.6655, test_f1: 0.6464
 epoch: 80, train_loss: 0.2766, test_loss: 1.6572, test_f1: 0.6386
 epoch: 81, train_loss: 0.2854, test_loss: 1.7124, test_f1: 0.6315
 epoch: 82, train_loss: 0.2953, test_loss: 1.6912, test_f1: 0.6377
 epoch: 83, train_loss: 0.2718, test_loss: 1.7238, test_f1: 0.6334
 epoch: 84, train_loss: 0.2772, test_loss: 1.7250, test_f1: 0.6468
 epoch: 85, train_loss: 0.2738, test_loss: 1.7334, test_f1: 0.6518
 epoch: 86, train_loss: 0.2659, test_loss: 1.7473, test_f1: 0.6392
 epoch: 87, train_loss: 0.2620, test_loss: 1.7704, test_f1: 0.6274
 epoch: 88, train_loss: 0.2694, test_loss: 1.7519, test_f1: 0.6431
 epoch: 89, train_loss: 0.2494, test_loss: 1.7825, test_f1: 0.6424
 epoch: 90, train_loss: 0.2677, test_loss: 1.7747, test_f1: 0.6599
 epoch: 91, train_loss: 0.2468, test_loss: 1.7951, test_f1: 0.6427
 epoch: 92, train_loss: 0.2530, test_loss: 1.7984, test_f1: 0.6353
 epoch: 93, train_loss: 0.2358, test_loss: 1.7965, test_f1: 0.6468
 epoch: 94, train_loss: 0.2431, test_loss: 1.8901, test_f1: 0.6319
 epoch: 95, train_loss: 0.2301, test_loss: 1.8601, test_f1: 0.6228
 epoch: 96, train_loss: 0.2262, test_loss: 1.8025, test_f1: 0.6362
 epoch: 97, train_loss: 0.2292, test_loss: 1.8151, test_f1: 0.6372
 epoch: 98, train_loss: 0.2258, test_loss: 1.8639, test_f1: 0.6311
 epoch: 99, train_loss: 0.2490, test_loss: 1.8786, test_f1: 0.6296

Training completed in 690.99 seconds
Best F1: 0.6697 at epoch 29
Mean F1 across iterations: 0.6536  0.0084
========================FINAL RESULTS================================
FEGIN weighted F1: 0.6697  0.0084
python main.py --data ltspice_demos --representation component_pin_net --model FEGIN --layers 4 --hiddens 128 --batch_size 32 --lr 0.0001 --emb_size 512 --epochs 100 --save_appendix component_pin_net_L4_H128_BS32_LR0.0001_E512 --no_val
-----



STDERR:
  File "main.py", line 370, in <module>
    main()
  File "main.py", line 254, in main
    dataset = dataset_class(
  File "/home/philip/projects/ltspice_examples_code_repo/Circuit-Completion-Using-GNNs/component_classification_with_link_prediction_head/evaluation/FEGIN/kernel/circuit_datasets.py", line 15, in __init__
    self.data, self.slices = torch.load(self.processed_paths[0])
  File "/home/philip/.local/lib/python3.8/site-packages/torch/serialization.py", line 1040, in load
    warnings.warn(
  File "/usr/lib/python3.8/warnings.py", line 109, in _showwarnmsg
    sw(msg.message, msg.category, msg.filename, msg.lineno,
  File "main.py", line 47, in warn_with_traceback
    traceback.print_stack(file=log)
/home/philip/projects/ltspice_examples_code_repo/Circuit-Completion-Using-GNNs/component_classification_with_link_prediction_head/evaluation/FEGIN/kernel/circuit_datasets.py:15: FutureWarning: You are using `torch.load` with `weights_only=False` (the current default value), which uses the default pickle module implicitly. It is possible to construct malicious pickle data which will execute arbitrary code during unpickling (See https://github.com/pytorch/pytorch/blob/main/SECURITY.md#untrusted-models for more details). In a future release, the default value for `weights_only` will be flipped to `True`. This limits the functions that could be executed during unpickling. Arbitrary objects will no longer be allowed to be loaded via this mode unless they are explicitly allowlisted by the user via `torch.serialization.add_safe_globals`. We recommend you start setting `weights_only=True` for any use case where you don't have full control of the loaded file. Please open an issue on GitHub for any issues related to this experimental feature.
  self.data, self.slices = torch.load(self.processed_paths[0])
