STDOUT:
Results will be saved in /home/philip/projects/ltspice_examples_code_repo/Circuit-Completion-Using-GNNs/component_classification_with_link_prediction_head/evaluation/FEGIN/results/model_FEGIN_dataset_ltspice_examples
Command line input: python main.py --data ltspice_examples --representation component_pin_net --model FEGIN --layers 4 --hiddens 32 --batch_size 64 --lr 0.001 --emb_size 512 --epochs 100 --save_appendix component_pin_net_L4_H32_BS64_LR0.001_E512 --no_val
 is saved.
-----
ltspice_examples - FEGIN
Using 4 layers, 32 hidden units, h = 2
Loading component_pin_net representation dataset
ENTERED
Training FEGIN on component_pin_net representation
Train: 3558, Test: 846
##################ITERATION #0 ****************************************
 epoch: 0, train_loss: 1.2576, test_loss: 1.0948, test_f1: 0.3705
 epoch: 1, train_loss: 1.0641, test_loss: 1.0542, test_f1: 0.3570
 epoch: 2, train_loss: 1.0360, test_loss: 1.0261, test_f1: 0.4283
 epoch: 3, train_loss: 1.0204, test_loss: 1.0267, test_f1: 0.4218
 epoch: 4, train_loss: 1.0056, test_loss: 1.0367, test_f1: 0.4002
 epoch: 5, train_loss: 0.9896, test_loss: 1.0031, test_f1: 0.4789
 epoch: 6, train_loss: 0.9689, test_loss: 0.9796, test_f1: 0.4854
 epoch: 7, train_loss: 0.9533, test_loss: 0.9843, test_f1: 0.4924
 epoch: 8, train_loss: 0.9428, test_loss: 0.9620, test_f1: 0.5091
 epoch: 9, train_loss: 0.9338, test_loss: 0.9302, test_f1: 0.5259
 epoch: 10, train_loss: 0.9264, test_loss: 0.9349, test_f1: 0.5080
 epoch: 11, train_loss: 0.9108, test_loss: 0.9171, test_f1: 0.5285
 epoch: 12, train_loss: 0.8999, test_loss: 0.9133, test_f1: 0.5210
 epoch: 13, train_loss: 0.8778, test_loss: 0.9763, test_f1: 0.5330
 epoch: 14, train_loss: 0.8838, test_loss: 0.9323, test_f1: 0.5396
 epoch: 15, train_loss: 0.8666, test_loss: 0.9046, test_f1: 0.5432
 epoch: 16, train_loss: 0.8594, test_loss: 0.9227, test_f1: 0.5519
 epoch: 17, train_loss: 0.8520, test_loss: 0.8883, test_f1: 0.5317
 epoch: 18, train_loss: 0.8431, test_loss: 0.8715, test_f1: 0.5256
 epoch: 19, train_loss: 0.8312, test_loss: 0.9065, test_f1: 0.5204
 epoch: 20, train_loss: 0.8242, test_loss: 0.9517, test_f1: 0.5586
 epoch: 21, train_loss: 0.8317, test_loss: 0.8933, test_f1: 0.5294
 epoch: 22, train_loss: 0.8201, test_loss: 0.9372, test_f1: 0.4941
 epoch: 23, train_loss: 0.8041, test_loss: 0.8871, test_f1: 0.5374
 epoch: 24, train_loss: 0.8068, test_loss: 0.9538, test_f1: 0.5394
 epoch: 25, train_loss: 0.7946, test_loss: 0.9015, test_f1: 0.5412
 epoch: 26, train_loss: 0.8030, test_loss: 0.9354, test_f1: 0.5674
 epoch: 27, train_loss: 0.8056, test_loss: 0.8922, test_f1: 0.5543
 epoch: 28, train_loss: 0.7832, test_loss: 0.9324, test_f1: 0.5226
 epoch: 29, train_loss: 0.7758, test_loss: 0.9161, test_f1: 0.5648
 epoch: 30, train_loss: 0.7666, test_loss: 0.8912, test_f1: 0.5418
 epoch: 31, train_loss: 0.7732, test_loss: 0.9029, test_f1: 0.5560
 epoch: 32, train_loss: 0.7681, test_loss: 0.9029, test_f1: 0.5970
 epoch: 33, train_loss: 0.7524, test_loss: 0.8975, test_f1: 0.5513
 epoch: 34, train_loss: 0.7544, test_loss: 0.9662, test_f1: 0.5794
 epoch: 35, train_loss: 0.7606, test_loss: 0.9699, test_f1: 0.5372
 epoch: 36, train_loss: 0.7534, test_loss: 0.9532, test_f1: 0.5508
 epoch: 37, train_loss: 0.7346, test_loss: 0.8840, test_f1: 0.5680
 epoch: 38, train_loss: 0.7356, test_loss: 0.9729, test_f1: 0.5914
 epoch: 39, train_loss: 0.7290, test_loss: 0.9964, test_f1: 0.6040
 epoch: 40, train_loss: 0.7357, test_loss: 0.9164, test_f1: 0.5923
 epoch: 41, train_loss: 0.7208, test_loss: 0.9279, test_f1: 0.6055
 epoch: 42, train_loss: 0.7242, test_loss: 0.9345, test_f1: 0.5935
 epoch: 43, train_loss: 0.7264, test_loss: 1.0151, test_f1: 0.5731
 epoch: 44, train_loss: 0.7287, test_loss: 0.9558, test_f1: 0.5681
 epoch: 45, train_loss: 0.7087, test_loss: 0.9021, test_f1: 0.5996
 epoch: 46, train_loss: 0.7018, test_loss: 0.9717, test_f1: 0.5881
 epoch: 47, train_loss: 0.6889, test_loss: 0.9050, test_f1: 0.6241
 epoch: 48, train_loss: 0.7054, test_loss: 1.0742, test_f1: 0.5356
 epoch: 49, train_loss: 0.7058, test_loss: 0.9869, test_f1: 0.5844
 epoch: 50, train_loss: 0.6894, test_loss: 0.8756, test_f1: 0.6449
 epoch: 51, train_loss: 0.6786, test_loss: 0.9092, test_f1: 0.6055
 epoch: 52, train_loss: 0.6538, test_loss: 0.9741, test_f1: 0.6130
 epoch: 53, train_loss: 0.6505, test_loss: 0.9577, test_f1: 0.6146
 epoch: 54, train_loss: 0.6323, test_loss: 0.9334, test_f1: 0.5882
 epoch: 55, train_loss: 0.6378, test_loss: 0.9326, test_f1: 0.5977
 epoch: 56, train_loss: 0.6343, test_loss: 0.9526, test_f1: 0.6402
 epoch: 57, train_loss: 0.6344, test_loss: 1.0078, test_f1: 0.6101
 epoch: 58, train_loss: 0.6265, test_loss: 0.9472, test_f1: 0.6290
 epoch: 59, train_loss: 0.6323, test_loss: 0.9278, test_f1: 0.6198
 epoch: 60, train_loss: 0.6194, test_loss: 0.9719, test_f1: 0.5961
 epoch: 61, train_loss: 0.6156, test_loss: 0.9469, test_f1: 0.6395
 epoch: 62, train_loss: 0.6127, test_loss: 0.9142, test_f1: 0.6300
 epoch: 63, train_loss: 0.6046, test_loss: 0.9513, test_f1: 0.6310
 epoch: 64, train_loss: 0.6217, test_loss: 1.0185, test_f1: 0.6211
 epoch: 65, train_loss: 0.6286, test_loss: 0.9220, test_f1: 0.6163
 epoch: 66, train_loss: 0.6064, test_loss: 0.9916, test_f1: 0.6321
 epoch: 67, train_loss: 0.6080, test_loss: 0.9951, test_f1: 0.6206
 epoch: 68, train_loss: 0.6080, test_loss: 1.0881, test_f1: 0.5981
 epoch: 69, train_loss: 0.5974, test_loss: 1.0085, test_f1: 0.6102
 epoch: 70, train_loss: 0.5989, test_loss: 0.9476, test_f1: 0.5901
 epoch: 71, train_loss: 0.5864, test_loss: 1.0915, test_f1: 0.6344
 epoch: 72, train_loss: 0.6028, test_loss: 0.9980, test_f1: 0.6079
 epoch: 73, train_loss: 0.5851, test_loss: 0.9931, test_f1: 0.6316
 epoch: 74, train_loss: 0.5858, test_loss: 0.9637, test_f1: 0.6498
 epoch: 75, train_loss: 0.5895, test_loss: 1.0119, test_f1: 0.6201
 epoch: 76, train_loss: 0.5820, test_loss: 0.9387, test_f1: 0.6390
 epoch: 77, train_loss: 0.5717, test_loss: 1.0359, test_f1: 0.6227
 epoch: 78, train_loss: 0.5938, test_loss: 1.0547, test_f1: 0.6279
 epoch: 79, train_loss: 0.5640, test_loss: 1.0536, test_f1: 0.6246
 epoch: 80, train_loss: 0.5738, test_loss: 1.0364, test_f1: 0.6210
 epoch: 81, train_loss: 0.5878, test_loss: 1.0022, test_f1: 0.6338
 epoch: 82, train_loss: 0.5685, test_loss: 1.0318, test_f1: 0.6355
 epoch: 83, train_loss: 0.5473, test_loss: 0.9867, test_f1: 0.6317
 epoch: 84, train_loss: 0.5677, test_loss: 1.0210, test_f1: 0.6206
 epoch: 85, train_loss: 0.5586, test_loss: 0.9880, test_f1: 0.6206
 epoch: 86, train_loss: 0.5565, test_loss: 1.0345, test_f1: 0.6254
 epoch: 87, train_loss: 0.5554, test_loss: 1.0942, test_f1: 0.6081
 epoch: 88, train_loss: 0.5580, test_loss: 1.0575, test_f1: 0.6169
 epoch: 89, train_loss: 0.5495, test_loss: 1.1282, test_f1: 0.6128
 epoch: 90, train_loss: 0.5557, test_loss: 1.0641, test_f1: 0.6451
 epoch: 91, train_loss: 0.5695, test_loss: 1.0761, test_f1: 0.6379
 epoch: 92, train_loss: 0.5573, test_loss: 1.0647, test_f1: 0.6254
 epoch: 93, train_loss: 0.5321, test_loss: 1.0776, test_f1: 0.6292
 epoch: 94, train_loss: 0.5474, test_loss: 1.0477, test_f1: 0.6358
 epoch: 95, train_loss: 0.5504, test_loss: 1.1019, test_f1: 0.6394
 epoch: 96, train_loss: 0.5344, test_loss: 1.0528, test_f1: 0.6247
 epoch: 97, train_loss: 0.5439, test_loss: 1.0939, test_f1: 0.6379
 epoch: 98, train_loss: 0.5317, test_loss: 1.1239, test_f1: 0.6316
 epoch: 99, train_loss: 0.5228, test_loss: 1.1558, test_f1: 0.6242
##################ITERATION #1 ****************************************
 epoch: 0, train_loss: 1.1150, test_loss: 1.1503, test_f1: 0.3542
 epoch: 1, train_loss: 0.9923, test_loss: 0.9640, test_f1: 0.4920
 epoch: 2, train_loss: 0.9551, test_loss: 0.9094, test_f1: 0.5301
 epoch: 3, train_loss: 0.9360, test_loss: 0.9036, test_f1: 0.4820
 epoch: 4, train_loss: 0.9161, test_loss: 0.8761, test_f1: 0.5128
 epoch: 5, train_loss: 0.9061, test_loss: 0.8826, test_f1: 0.5412
 epoch: 6, train_loss: 0.8942, test_loss: 0.8658, test_f1: 0.4917
 epoch: 7, train_loss: 0.8784, test_loss: 0.8230, test_f1: 0.5646
 epoch: 8, train_loss: 0.8679, test_loss: 0.8255, test_f1: 0.5684
 epoch: 9, train_loss: 0.8510, test_loss: 0.8498, test_f1: 0.5512
 epoch: 10, train_loss: 0.8410, test_loss: 0.8478, test_f1: 0.5429
 epoch: 11, train_loss: 0.8333, test_loss: 0.8155, test_f1: 0.5557
 epoch: 12, train_loss: 0.8143, test_loss: 0.8231, test_f1: 0.5363
 epoch: 13, train_loss: 0.8037, test_loss: 0.7936, test_f1: 0.5701
 epoch: 14, train_loss: 0.7903, test_loss: 0.7789, test_f1: 0.5933
 epoch: 15, train_loss: 0.7741, test_loss: 0.7514, test_f1: 0.5850
 epoch: 16, train_loss: 0.7778, test_loss: 0.7402, test_f1: 0.5864
 epoch: 17, train_loss: 0.7701, test_loss: 0.8468, test_f1: 0.5231
 epoch: 18, train_loss: 0.7676, test_loss: 0.8264, test_f1: 0.5428
 epoch: 19, train_loss: 0.7521, test_loss: 0.7336, test_f1: 0.5933
 epoch: 20, train_loss: 0.7444, test_loss: 0.6969, test_f1: 0.6188
 epoch: 21, train_loss: 0.7364, test_loss: 0.8131, test_f1: 0.5785
 epoch: 22, train_loss: 0.7190, test_loss: 0.7181, test_f1: 0.6284
 epoch: 23, train_loss: 0.7281, test_loss: 0.7815, test_f1: 0.5907
 epoch: 24, train_loss: 0.7334, test_loss: 0.7490, test_f1: 0.6073
 epoch: 25, train_loss: 0.7279, test_loss: 0.7356, test_f1: 0.5797
 epoch: 26, train_loss: 0.7062, test_loss: 0.6824, test_f1: 0.6595
 epoch: 27, train_loss: 0.6870, test_loss: 0.7218, test_f1: 0.6004
 epoch: 28, train_loss: 0.6978, test_loss: 0.6789, test_f1: 0.6432
 epoch: 29, train_loss: 0.6884, test_loss: 0.6868, test_f1: 0.6319
 epoch: 30, train_loss: 0.6800, test_loss: 0.6874, test_f1: 0.6229
 epoch: 31, train_loss: 0.6637, test_loss: 0.7717, test_f1: 0.5984
 epoch: 32, train_loss: 0.6655, test_loss: 0.6987, test_f1: 0.6149
 epoch: 33, train_loss: 0.6494, test_loss: 0.6632, test_f1: 0.6522
 epoch: 34, train_loss: 0.6588, test_loss: 0.6794, test_f1: 0.6541
 epoch: 35, train_loss: 0.6538, test_loss: 0.6505, test_f1: 0.6479
 epoch: 36, train_loss: 0.6372, test_loss: 0.6952, test_f1: 0.6792
 epoch: 37, train_loss: 0.6364, test_loss: 0.6802, test_f1: 0.6474
 epoch: 38, train_loss: 0.6393, test_loss: 0.6996, test_f1: 0.6185
 epoch: 39, train_loss: 0.6533, test_loss: 0.6704, test_f1: 0.6577
 epoch: 40, train_loss: 0.6328, test_loss: 0.7307, test_f1: 0.6352
 epoch: 41, train_loss: 0.6365, test_loss: 0.6929, test_f1: 0.6662
 epoch: 42, train_loss: 0.6194, test_loss: 0.6688, test_f1: 0.6606
 epoch: 43, train_loss: 0.6214, test_loss: 0.6821, test_f1: 0.6472
 epoch: 44, train_loss: 0.6067, test_loss: 0.6593, test_f1: 0.6679
 epoch: 45, train_loss: 0.5969, test_loss: 0.6759, test_f1: 0.6610
 epoch: 46, train_loss: 0.6039, test_loss: 0.6862, test_f1: 0.6545
 epoch: 47, train_loss: 0.5829, test_loss: 0.6689, test_f1: 0.6803
 epoch: 48, train_loss: 0.5973, test_loss: 0.6888, test_f1: 0.6631
 epoch: 49, train_loss: 0.5970, test_loss: 0.6782, test_f1: 0.6973
 epoch: 50, train_loss: 0.5751, test_loss: 0.7162, test_f1: 0.6502
 epoch: 51, train_loss: 0.5619, test_loss: 0.6790, test_f1: 0.6700
 epoch: 52, train_loss: 0.5655, test_loss: 0.6769, test_f1: 0.6801
 epoch: 53, train_loss: 0.5322, test_loss: 0.6868, test_f1: 0.6822
 epoch: 54, train_loss: 0.5405, test_loss: 0.7176, test_f1: 0.6798
 epoch: 55, train_loss: 0.5347, test_loss: 0.6978, test_f1: 0.6812
 epoch: 56, train_loss: 0.5445, test_loss: 0.6817, test_f1: 0.6681
 epoch: 57, train_loss: 0.5213, test_loss: 0.7065, test_f1: 0.6831
 epoch: 58, train_loss: 0.5238, test_loss: 0.7501, test_f1: 0.6546
 epoch: 59, train_loss: 0.5322, test_loss: 0.7491, test_f1: 0.6551
 epoch: 60, train_loss: 0.5278, test_loss: 0.6968, test_f1: 0.6750
 epoch: 61, train_loss: 0.5187, test_loss: 0.7029, test_f1: 0.6713
 epoch: 62, train_loss: 0.5078, test_loss: 0.7124, test_f1: 0.6834
 epoch: 63, train_loss: 0.5218, test_loss: 0.7355, test_f1: 0.6704
 epoch: 64, train_loss: 0.5261, test_loss: 0.7362, test_f1: 0.6853
 epoch: 65, train_loss: 0.5159, test_loss: 0.6931, test_f1: 0.6791
 epoch: 66, train_loss: 0.5045, test_loss: 0.7119, test_f1: 0.6889
 epoch: 67, train_loss: 0.5028, test_loss: 0.7302, test_f1: 0.6894
 epoch: 68, train_loss: 0.5109, test_loss: 0.7365, test_f1: 0.6858
 epoch: 69, train_loss: 0.5145, test_loss: 0.7022, test_f1: 0.6657
 epoch: 70, train_loss: 0.5040, test_loss: 0.8210, test_f1: 0.6599
 epoch: 71, train_loss: 0.5131, test_loss: 0.7321, test_f1: 0.6731
 epoch: 72, train_loss: 0.4939, test_loss: 0.7468, test_f1: 0.6499
 epoch: 73, train_loss: 0.4831, test_loss: 0.7719, test_f1: 0.6667
 epoch: 74, train_loss: 0.5121, test_loss: 0.7393, test_f1: 0.6781
 epoch: 75, train_loss: 0.4979, test_loss: 0.7860, test_f1: 0.6818
 epoch: 76, train_loss: 0.4901, test_loss: 0.7557, test_f1: 0.6683
 epoch: 77, train_loss: 0.4972, test_loss: 0.7673, test_f1: 0.6639
 epoch: 78, train_loss: 0.4832, test_loss: 0.7419, test_f1: 0.6744
 epoch: 79, train_loss: 0.4715, test_loss: 0.7851, test_f1: 0.6841
 epoch: 80, train_loss: 0.4764, test_loss: 0.8020, test_f1: 0.6420
 epoch: 81, train_loss: 0.4802, test_loss: 0.7597, test_f1: 0.6808
 epoch: 82, train_loss: 0.4780, test_loss: 0.8320, test_f1: 0.6643
 epoch: 83, train_loss: 0.4875, test_loss: 0.8550, test_f1: 0.6414
 epoch: 84, train_loss: 0.4665, test_loss: 0.7975, test_f1: 0.6707
 epoch: 85, train_loss: 0.4643, test_loss: 0.7929, test_f1: 0.6674
 epoch: 86, train_loss: 0.4664, test_loss: 0.7601, test_f1: 0.6724
 epoch: 87, train_loss: 0.4818, test_loss: 0.8316, test_f1: 0.6824
 epoch: 88, train_loss: 0.4783, test_loss: 0.8810, test_f1: 0.6585
 epoch: 89, train_loss: 0.4652, test_loss: 0.8418, test_f1: 0.6724
 epoch: 90, train_loss: 0.4652, test_loss: 0.8743, test_f1: 0.6792
 epoch: 91, train_loss: 0.4576, test_loss: 0.8196, test_f1: 0.6622
 epoch: 92, train_loss: 0.4578, test_loss: 0.8219, test_f1: 0.6941
 epoch: 93, train_loss: 0.4628, test_loss: 0.8194, test_f1: 0.6779
 epoch: 94, train_loss: 0.4515, test_loss: 0.8312, test_f1: 0.6832
 epoch: 95, train_loss: 0.4736, test_loss: 0.9821, test_f1: 0.6652
 epoch: 96, train_loss: 0.4516, test_loss: 0.8470, test_f1: 0.6638
 epoch: 97, train_loss: 0.4786, test_loss: 0.7980, test_f1: 0.6774
 epoch: 98, train_loss: 0.4640, test_loss: 0.8971, test_f1: 0.6464
 epoch: 99, train_loss: 0.4596, test_loss: 0.8419, test_f1: 0.6705
##################ITERATION #2 ****************************************
 epoch: 0, train_loss: 1.1328, test_loss: 1.0525, test_f1: 0.3676
 epoch: 1, train_loss: 1.0033, test_loss: 0.9620, test_f1: 0.4773
 epoch: 2, train_loss: 0.9737, test_loss: 0.9407, test_f1: 0.4768
 epoch: 3, train_loss: 0.9556, test_loss: 0.9461, test_f1: 0.5436
 epoch: 4, train_loss: 0.9350, test_loss: 0.9118, test_f1: 0.5386
 epoch: 5, train_loss: 0.9195, test_loss: 0.9159, test_f1: 0.5176
 epoch: 6, train_loss: 0.9086, test_loss: 0.8663, test_f1: 0.5294
 epoch: 7, train_loss: 0.8962, test_loss: 0.9228, test_f1: 0.5279
 epoch: 8, train_loss: 0.8781, test_loss: 0.9040, test_f1: 0.5220
 epoch: 9, train_loss: 0.8711, test_loss: 0.8887, test_f1: 0.5513
 epoch: 10, train_loss: 0.8561, test_loss: 0.8593, test_f1: 0.5427
 epoch: 11, train_loss: 0.8397, test_loss: 0.8948, test_f1: 0.5047
 epoch: 12, train_loss: 0.8417, test_loss: 0.8357, test_f1: 0.5726
 epoch: 13, train_loss: 0.8400, test_loss: 0.8693, test_f1: 0.5514
 epoch: 14, train_loss: 0.8270, test_loss: 0.9221, test_f1: 0.5850
 epoch: 15, train_loss: 0.8103, test_loss: 0.8270, test_f1: 0.5568
 epoch: 16, train_loss: 0.8011, test_loss: 0.8567, test_f1: 0.6018
 epoch: 17, train_loss: 0.7892, test_loss: 0.8980, test_f1: 0.5569
 epoch: 18, train_loss: 0.7707, test_loss: 0.8413, test_f1: 0.5971
 epoch: 19, train_loss: 0.7622, test_loss: 0.8673, test_f1: 0.5666
 epoch: 20, train_loss: 0.7657, test_loss: 0.7641, test_f1: 0.5998
 epoch: 21, train_loss: 0.7634, test_loss: 0.7983, test_f1: 0.6066
 epoch: 22, train_loss: 0.7580, test_loss: 0.8695, test_f1: 0.5868
 epoch: 23, train_loss: 0.7374, test_loss: 0.8991, test_f1: 0.5761
 epoch: 24, train_loss: 0.7397, test_loss: 0.8396, test_f1: 0.5994
 epoch: 25, train_loss: 0.7219, test_loss: 0.8088, test_f1: 0.6336
 epoch: 26, train_loss: 0.7201, test_loss: 0.8919, test_f1: 0.5796
 epoch: 27, train_loss: 0.7232, test_loss: 0.8379, test_f1: 0.5970
 epoch: 28, train_loss: 0.7038, test_loss: 0.8158, test_f1: 0.6066
 epoch: 29, train_loss: 0.6979, test_loss: 0.7721, test_f1: 0.6344
 epoch: 30, train_loss: 0.6878, test_loss: 0.7410, test_f1: 0.6503
 epoch: 31, train_loss: 0.6903, test_loss: 0.6990, test_f1: 0.6409
 epoch: 32, train_loss: 0.6977, test_loss: 0.7881, test_f1: 0.6259
 epoch: 33, train_loss: 0.6876, test_loss: 0.7689, test_f1: 0.6233
 epoch: 34, train_loss: 0.6739, test_loss: 0.8214, test_f1: 0.6260
 epoch: 35, train_loss: 0.6763, test_loss: 0.8119, test_f1: 0.6340
 epoch: 36, train_loss: 0.6762, test_loss: 0.7428, test_f1: 0.6444
 epoch: 37, train_loss: 0.6752, test_loss: 0.7669, test_f1: 0.6374
 epoch: 38, train_loss: 0.6621, test_loss: 0.7690, test_f1: 0.6440
 epoch: 39, train_loss: 0.6522, test_loss: 0.8009, test_f1: 0.6501
 epoch: 40, train_loss: 0.6395, test_loss: 0.7528, test_f1: 0.6319
 epoch: 41, train_loss: 0.6475, test_loss: 0.7052, test_f1: 0.6764
 epoch: 42, train_loss: 0.6322, test_loss: 0.7376, test_f1: 0.6590
 epoch: 43, train_loss: 0.6338, test_loss: 0.8349, test_f1: 0.6392
 epoch: 44, train_loss: 0.6247, test_loss: 0.7762, test_f1: 0.6226
 epoch: 45, train_loss: 0.6190, test_loss: 0.7712, test_f1: 0.6388
 epoch: 46, train_loss: 0.6237, test_loss: 0.7800, test_f1: 0.6418
 epoch: 47, train_loss: 0.6066, test_loss: 0.8114, test_f1: 0.6224
 epoch: 48, train_loss: 0.6137, test_loss: 0.9022, test_f1: 0.6301
 epoch: 49, train_loss: 0.6225, test_loss: 0.8310, test_f1: 0.6233
 epoch: 50, train_loss: 0.6071, test_loss: 0.8987, test_f1: 0.6283
 epoch: 51, train_loss: 0.5640, test_loss: 0.7940, test_f1: 0.6514
 epoch: 52, train_loss: 0.5568, test_loss: 0.7291, test_f1: 0.6529
 epoch: 53, train_loss: 0.5613, test_loss: 0.8580, test_f1: 0.6564
 epoch: 54, train_loss: 0.5603, test_loss: 0.8762, test_f1: 0.6498
 epoch: 55, train_loss: 0.5543, test_loss: 0.8011, test_f1: 0.6588
 epoch: 56, train_loss: 0.5494, test_loss: 0.7791, test_f1: 0.6498
 epoch: 57, train_loss: 0.5507, test_loss: 0.8217, test_f1: 0.6522
 epoch: 58, train_loss: 0.5499, test_loss: 0.8443, test_f1: 0.6534
 epoch: 59, train_loss: 0.5535, test_loss: 0.8605, test_f1: 0.6356
 epoch: 60, train_loss: 0.5428, test_loss: 0.8477, test_f1: 0.6531
 epoch: 61, train_loss: 0.5222, test_loss: 0.9456, test_f1: 0.6294
 epoch: 62, train_loss: 0.5481, test_loss: 0.8136, test_f1: 0.6329
 epoch: 63, train_loss: 0.5386, test_loss: 0.9439, test_f1: 0.6490
 epoch: 64, train_loss: 0.5296, test_loss: 0.8284, test_f1: 0.6371
 epoch: 65, train_loss: 0.5333, test_loss: 0.9305, test_f1: 0.6489
 epoch: 66, train_loss: 0.5294, test_loss: 0.8694, test_f1: 0.6419
 epoch: 67, train_loss: 0.5189, test_loss: 0.8902, test_f1: 0.6585
 epoch: 68, train_loss: 0.5158, test_loss: 0.8117, test_f1: 0.6472
 epoch: 69, train_loss: 0.5287, test_loss: 0.9680, test_f1: 0.6433
 epoch: 70, train_loss: 0.5298, test_loss: 0.8380, test_f1: 0.6422
 epoch: 71, train_loss: 0.5216, test_loss: 0.8809, test_f1: 0.6420
 epoch: 72, train_loss: 0.5155, test_loss: 0.8697, test_f1: 0.6503
 epoch: 73, train_loss: 0.5177, test_loss: 0.9038, test_f1: 0.6545
 epoch: 74, train_loss: 0.5129, test_loss: 0.9796, test_f1: 0.6389
 epoch: 75, train_loss: 0.4927, test_loss: 0.9160, test_f1: 0.6318
 epoch: 76, train_loss: 0.5086, test_loss: 0.8827, test_f1: 0.6533
 epoch: 77, train_loss: 0.5153, test_loss: 0.9218, test_f1: 0.6674
 epoch: 78, train_loss: 0.5078, test_loss: 0.9008, test_f1: 0.6379
 epoch: 79, train_loss: 0.5061, test_loss: 1.0479, test_f1: 0.6308
 epoch: 80, train_loss: 0.5004, test_loss: 0.8600, test_f1: 0.6549
 epoch: 81, train_loss: 0.4918, test_loss: 0.9122, test_f1: 0.6490
 epoch: 82, train_loss: 0.4814, test_loss: 0.9255, test_f1: 0.6595
 epoch: 83, train_loss: 0.4742, test_loss: 1.0129, test_f1: 0.6528
 epoch: 84, train_loss: 0.4637, test_loss: 0.9242, test_f1: 0.6538
 epoch: 85, train_loss: 0.4953, test_loss: 0.9323, test_f1: 0.6505
 epoch: 86, train_loss: 0.4897, test_loss: 0.9521, test_f1: 0.6428
 epoch: 87, train_loss: 0.4878, test_loss: 0.9645, test_f1: 0.6368
 epoch: 88, train_loss: 0.4873, test_loss: 0.9688, test_f1: 0.6580
 epoch: 89, train_loss: 0.4749, test_loss: 0.9798, test_f1: 0.6346
 epoch: 90, train_loss: 0.4843, test_loss: 1.0566, test_f1: 0.6271
 epoch: 91, train_loss: 0.4891, test_loss: 1.0398, test_f1: 0.6346
 epoch: 92, train_loss: 0.4456, test_loss: 1.0419, test_f1: 0.6535
 epoch: 93, train_loss: 0.4722, test_loss: 1.0507, test_f1: 0.6448
 epoch: 94, train_loss: 0.4786, test_loss: 0.9994, test_f1: 0.6589
 epoch: 95, train_loss: 0.4644, test_loss: 1.0336, test_f1: 0.6404
 epoch: 96, train_loss: 0.4628, test_loss: 1.0929, test_f1: 0.6408
 epoch: 97, train_loss: 0.4766, test_loss: 0.9779, test_f1: 0.6325
 epoch: 98, train_loss: 0.4701, test_loss: 1.0711, test_f1: 0.6541
 epoch: 99, train_loss: 0.4534, test_loss: 1.0550, test_f1: 0.6375
##################ITERATION #3 ****************************************
 epoch: 0, train_loss: 1.1604, test_loss: 1.3825, test_f1: 0.2175
 epoch: 1, train_loss: 1.0236, test_loss: 0.9800, test_f1: 0.4630
 epoch: 2, train_loss: 0.9766, test_loss: 0.9502, test_f1: 0.4880
 epoch: 3, train_loss: 0.9588, test_loss: 0.9607, test_f1: 0.5050
 epoch: 4, train_loss: 0.9452, test_loss: 0.9626, test_f1: 0.4710
 epoch: 5, train_loss: 0.9256, test_loss: 0.9209, test_f1: 0.5033
 epoch: 6, train_loss: 0.9133, test_loss: 0.9306, test_f1: 0.5125
 epoch: 7, train_loss: 0.8862, test_loss: 0.9031, test_f1: 0.5042
 epoch: 8, train_loss: 0.8759, test_loss: 0.8562, test_f1: 0.5869
 epoch: 9, train_loss: 0.8698, test_loss: 0.8279, test_f1: 0.5242
 epoch: 10, train_loss: 0.8547, test_loss: 0.8691, test_f1: 0.5645
 epoch: 11, train_loss: 0.8423, test_loss: 0.8052, test_f1: 0.5567
 epoch: 12, train_loss: 0.8138, test_loss: 0.8059, test_f1: 0.5590
 epoch: 13, train_loss: 0.8275, test_loss: 0.8617, test_f1: 0.5524
 epoch: 14, train_loss: 0.7970, test_loss: 0.8081, test_f1: 0.6097
 epoch: 15, train_loss: 0.7820, test_loss: 0.7882, test_f1: 0.6161
 epoch: 16, train_loss: 0.7806, test_loss: 0.8438, test_f1: 0.5730
 epoch: 17, train_loss: 0.7824, test_loss: 0.7847, test_f1: 0.6094
 epoch: 18, train_loss: 0.7731, test_loss: 0.7912, test_f1: 0.6122
 epoch: 19, train_loss: 0.7476, test_loss: 0.7494, test_f1: 0.6371
 epoch: 20, train_loss: 0.7474, test_loss: 0.7617, test_f1: 0.6193
 epoch: 21, train_loss: 0.7435, test_loss: 0.7852, test_f1: 0.6354
 epoch: 22, train_loss: 0.7401, test_loss: 0.7734, test_f1: 0.5843
 epoch: 23, train_loss: 0.7274, test_loss: 0.7403, test_f1: 0.6461
 epoch: 24, train_loss: 0.7212, test_loss: 0.7708, test_f1: 0.6347
 epoch: 25, train_loss: 0.7135, test_loss: 0.7492, test_f1: 0.6330
 epoch: 26, train_loss: 0.7301, test_loss: 0.7972, test_f1: 0.6185
 epoch: 27, train_loss: 0.6926, test_loss: 0.8338, test_f1: 0.6232
 epoch: 28, train_loss: 0.6799, test_loss: 0.7277, test_f1: 0.6631
 epoch: 29, train_loss: 0.6897, test_loss: 0.7662, test_f1: 0.6062
 epoch: 30, train_loss: 0.6871, test_loss: 0.8167, test_f1: 0.6109
 epoch: 31, train_loss: 0.6803, test_loss: 0.7644, test_f1: 0.6514
 epoch: 32, train_loss: 0.6706, test_loss: 0.7712, test_f1: 0.6383
 epoch: 33, train_loss: 0.6736, test_loss: 0.7560, test_f1: 0.6392
 epoch: 34, train_loss: 0.6665, test_loss: 0.8754, test_f1: 0.6204
 epoch: 35, train_loss: 0.6583, test_loss: 0.7216, test_f1: 0.6646
 epoch: 36, train_loss: 0.6559, test_loss: 0.7099, test_f1: 0.6756
 epoch: 37, train_loss: 0.6351, test_loss: 0.7544, test_f1: 0.6653
 epoch: 38, train_loss: 0.6345, test_loss: 0.7583, test_f1: 0.6424
 epoch: 39, train_loss: 0.6205, test_loss: 0.7545, test_f1: 0.6499
 epoch: 40, train_loss: 0.6206, test_loss: 0.7564, test_f1: 0.6679
 epoch: 41, train_loss: 0.6326, test_loss: 0.8921, test_f1: 0.6146
 epoch: 42, train_loss: 0.6133, test_loss: 0.8157, test_f1: 0.6499
 epoch: 43, train_loss: 0.6185, test_loss: 0.9053, test_f1: 0.6282
 epoch: 44, train_loss: 0.6097, test_loss: 0.8969, test_f1: 0.6440
 epoch: 45, train_loss: 0.5989, test_loss: 0.8403, test_f1: 0.6526
 epoch: 46, train_loss: 0.6131, test_loss: 0.9566, test_f1: 0.6275
 epoch: 47, train_loss: 0.6099, test_loss: 0.7600, test_f1: 0.6493
 epoch: 48, train_loss: 0.5955, test_loss: 0.7701, test_f1: 0.6483
 epoch: 49, train_loss: 0.6025, test_loss: 0.8677, test_f1: 0.6348
 epoch: 50, train_loss: 0.5880, test_loss: 0.8262, test_f1: 0.6670
 epoch: 51, train_loss: 0.5577, test_loss: 0.7623, test_f1: 0.6545
 epoch: 52, train_loss: 0.5574, test_loss: 0.9066, test_f1: 0.6330
 epoch: 53, train_loss: 0.5453, test_loss: 0.8636, test_f1: 0.6455
 epoch: 54, train_loss: 0.5230, test_loss: 0.9208, test_f1: 0.6502
 epoch: 55, train_loss: 0.5487, test_loss: 0.8716, test_f1: 0.6612
 epoch: 56, train_loss: 0.5341, test_loss: 0.8468, test_f1: 0.6632
 epoch: 57, train_loss: 0.5411, test_loss: 0.9373, test_f1: 0.6379
 epoch: 58, train_loss: 0.5204, test_loss: 0.9262, test_f1: 0.6640
 epoch: 59, train_loss: 0.5159, test_loss: 0.8794, test_f1: 0.6692
 epoch: 60, train_loss: 0.5244, test_loss: 0.9634, test_f1: 0.6574
 epoch: 61, train_loss: 0.5152, test_loss: 0.9339, test_f1: 0.6749
 epoch: 62, train_loss: 0.5254, test_loss: 0.9057, test_f1: 0.6456
 epoch: 63, train_loss: 0.5149, test_loss: 0.9286, test_f1: 0.6555
 epoch: 64, train_loss: 0.5075, test_loss: 0.8280, test_f1: 0.6509
 epoch: 65, train_loss: 0.5115, test_loss: 0.9005, test_f1: 0.6636
 epoch: 66, train_loss: 0.5122, test_loss: 0.8424, test_f1: 0.6689
 epoch: 67, train_loss: 0.4979, test_loss: 0.9107, test_f1: 0.6611
 epoch: 68, train_loss: 0.4890, test_loss: 1.0013, test_f1: 0.6585
 epoch: 69, train_loss: 0.4940, test_loss: 0.9237, test_f1: 0.6572
 epoch: 70, train_loss: 0.5132, test_loss: 0.9942, test_f1: 0.6567
 epoch: 71, train_loss: 0.4993, test_loss: 0.9990, test_f1: 0.6650
 epoch: 72, train_loss: 0.4937, test_loss: 0.9489, test_f1: 0.6528
 epoch: 73, train_loss: 0.4948, test_loss: 0.8619, test_f1: 0.6663
 epoch: 74, train_loss: 0.4943, test_loss: 0.9916, test_f1: 0.6527
 epoch: 75, train_loss: 0.4975, test_loss: 0.9033, test_f1: 0.6576
 epoch: 76, train_loss: 0.4792, test_loss: 0.8889, test_f1: 0.6709
 epoch: 77, train_loss: 0.4653, test_loss: 1.1070, test_f1: 0.6464
 epoch: 78, train_loss: 0.4745, test_loss: 0.9740, test_f1: 0.6494
 epoch: 79, train_loss: 0.4832, test_loss: 1.0277, test_f1: 0.6594
 epoch: 80, train_loss: 0.4848, test_loss: 1.0679, test_f1: 0.6402
 epoch: 81, train_loss: 0.4722, test_loss: 0.9592, test_f1: 0.6721
 epoch: 82, train_loss: 0.4979, test_loss: 1.0833, test_f1: 0.6461
 epoch: 83, train_loss: 0.4864, test_loss: 1.1426, test_f1: 0.6698
 epoch: 84, train_loss: 0.4714, test_loss: 1.1129, test_f1: 0.6552
 epoch: 85, train_loss: 0.4766, test_loss: 1.1026, test_f1: 0.6626
 epoch: 86, train_loss: 0.4657, test_loss: 1.0908, test_f1: 0.6714
 epoch: 87, train_loss: 0.4545, test_loss: 1.1967, test_f1: 0.6599
 epoch: 88, train_loss: 0.4726, test_loss: 0.9986, test_f1: 0.6516
 epoch: 89, train_loss: 0.4642, test_loss: 1.0585, test_f1: 0.6586
 epoch: 90, train_loss: 0.4714, test_loss: 1.0380, test_f1: 0.6624
 epoch: 91, train_loss: 0.4666, test_loss: 1.1578, test_f1: 0.6578
 epoch: 92, train_loss: 0.4496, test_loss: 1.1058, test_f1: 0.6570
 epoch: 93, train_loss: 0.4600, test_loss: 1.1864, test_f1: 0.6606
 epoch: 94, train_loss: 0.4436, test_loss: 1.1821, test_f1: 0.6370
 epoch: 95, train_loss: 0.4828, test_loss: 1.0731, test_f1: 0.6477
 epoch: 96, train_loss: 0.4637, test_loss: 1.0708, test_f1: 0.6777
 epoch: 97, train_loss: 0.4592, test_loss: 1.1157, test_f1: 0.6581
 epoch: 98, train_loss: 0.4406, test_loss: 1.1407, test_f1: 0.6683
 epoch: 99, train_loss: 0.4432, test_loss: 1.1980, test_f1: 0.6627
##################ITERATION #4 ****************************************
 epoch: 0, train_loss: 1.2224, test_loss: 1.1359, test_f1: 0.3528
 epoch: 1, train_loss: 1.0223, test_loss: 0.9942, test_f1: 0.4734
 epoch: 2, train_loss: 1.0000, test_loss: 0.9757, test_f1: 0.4966
 epoch: 3, train_loss: 0.9650, test_loss: 0.9565, test_f1: 0.5020
 epoch: 4, train_loss: 0.9449, test_loss: 0.9242, test_f1: 0.4803
 epoch: 5, train_loss: 0.9271, test_loss: 0.9108, test_f1: 0.5176
 epoch: 6, train_loss: 0.9089, test_loss: 0.9227, test_f1: 0.5067
 epoch: 7, train_loss: 0.8981, test_loss: 0.8904, test_f1: 0.5175
 epoch: 8, train_loss: 0.8779, test_loss: 0.8816, test_f1: 0.5399
 epoch: 9, train_loss: 0.8617, test_loss: 0.9040, test_f1: 0.5384
 epoch: 10, train_loss: 0.8544, test_loss: 0.8735, test_f1: 0.5337
 epoch: 11, train_loss: 0.8387, test_loss: 0.8906, test_f1: 0.5578
 epoch: 12, train_loss: 0.8384, test_loss: 0.8466, test_f1: 0.5231
 epoch: 13, train_loss: 0.8205, test_loss: 0.8382, test_f1: 0.5804
 epoch: 14, train_loss: 0.8113, test_loss: 0.8606, test_f1: 0.6073
 epoch: 15, train_loss: 0.8217, test_loss: 0.8707, test_f1: 0.5819
 epoch: 16, train_loss: 0.7940, test_loss: 0.8784, test_f1: 0.5451
 epoch: 17, train_loss: 0.7954, test_loss: 0.8662, test_f1: 0.5519
 epoch: 18, train_loss: 0.7716, test_loss: 0.7826, test_f1: 0.6104
 epoch: 19, train_loss: 0.7590, test_loss: 0.8454, test_f1: 0.5964
 epoch: 20, train_loss: 0.7698, test_loss: 0.8198, test_f1: 0.6010
 epoch: 21, train_loss: 0.7552, test_loss: 0.8317, test_f1: 0.6100
 epoch: 22, train_loss: 0.7505, test_loss: 0.8010, test_f1: 0.5909
 epoch: 23, train_loss: 0.7315, test_loss: 0.8450, test_f1: 0.5864
 epoch: 24, train_loss: 0.7211, test_loss: 0.8648, test_f1: 0.6333
 epoch: 25, train_loss: 0.7023, test_loss: 0.8560, test_f1: 0.6205
 epoch: 26, train_loss: 0.7176, test_loss: 0.8006, test_f1: 0.6139
 epoch: 27, train_loss: 0.6950, test_loss: 0.8425, test_f1: 0.6062
 epoch: 28, train_loss: 0.6995, test_loss: 0.8778, test_f1: 0.6212
 epoch: 29, train_loss: 0.6962, test_loss: 0.8922, test_f1: 0.5900
 epoch: 30, train_loss: 0.6843, test_loss: 0.8679, test_f1: 0.6076
 epoch: 31, train_loss: 0.6710, test_loss: 0.8873, test_f1: 0.6086
 epoch: 32, train_loss: 0.6884, test_loss: 0.8739, test_f1: 0.6101
 epoch: 33, train_loss: 0.6717, test_loss: 0.8205, test_f1: 0.6134
 epoch: 34, train_loss: 0.6633, test_loss: 0.8638, test_f1: 0.5911
 epoch: 35, train_loss: 0.6548, test_loss: 0.7958, test_f1: 0.6353
 epoch: 36, train_loss: 0.6702, test_loss: 0.8918, test_f1: 0.6105
 epoch: 37, train_loss: 0.6380, test_loss: 0.9341, test_f1: 0.6062
 epoch: 38, train_loss: 0.6496, test_loss: 0.9282, test_f1: 0.6167
 epoch: 39, train_loss: 0.6426, test_loss: 0.8823, test_f1: 0.6308
 epoch: 40, train_loss: 0.6140, test_loss: 0.8611, test_f1: 0.6211
 epoch: 41, train_loss: 0.6520, test_loss: 0.8947, test_f1: 0.6257
 epoch: 42, train_loss: 0.6225, test_loss: 0.8425, test_f1: 0.6407
 epoch: 43, train_loss: 0.6289, test_loss: 0.8249, test_f1: 0.6228
 epoch: 44, train_loss: 0.6226, test_loss: 0.8409, test_f1: 0.6252
 epoch: 45, train_loss: 0.6149, test_loss: 0.8689, test_f1: 0.6494
 epoch: 46, train_loss: 0.6109, test_loss: 0.8711, test_f1: 0.6101
 epoch: 47, train_loss: 0.6139, test_loss: 0.9197, test_f1: 0.6493
 epoch: 48, train_loss: 0.5836, test_loss: 0.9226, test_f1: 0.6141
 epoch: 49, train_loss: 0.6071, test_loss: 0.8277, test_f1: 0.6389
 epoch: 50, train_loss: 0.5963, test_loss: 0.8572, test_f1: 0.6289
 epoch: 51, train_loss: 0.5576, test_loss: 0.9439, test_f1: 0.6228
 epoch: 52, train_loss: 0.5431, test_loss: 0.9084, test_f1: 0.6421
 epoch: 53, train_loss: 0.5503, test_loss: 0.9379, test_f1: 0.6279
 epoch: 54, train_loss: 0.5381, test_loss: 0.9037, test_f1: 0.6477
 epoch: 55, train_loss: 0.5292, test_loss: 0.9625, test_f1: 0.6499
 epoch: 56, train_loss: 0.5309, test_loss: 0.9062, test_f1: 0.6375
 epoch: 57, train_loss: 0.5309, test_loss: 0.9908, test_f1: 0.6326
 epoch: 58, train_loss: 0.5311, test_loss: 0.9552, test_f1: 0.6308
 epoch: 59, train_loss: 0.5281, test_loss: 0.9568, test_f1: 0.6404
 epoch: 60, train_loss: 0.5229, test_loss: 0.9926, test_f1: 0.6187
 epoch: 61, train_loss: 0.5258, test_loss: 0.9624, test_f1: 0.6327
 epoch: 62, train_loss: 0.5142, test_loss: 1.0014, test_f1: 0.6560
 epoch: 63, train_loss: 0.5278, test_loss: 0.9747, test_f1: 0.6504
 epoch: 64, train_loss: 0.5249, test_loss: 0.9393, test_f1: 0.6319
 epoch: 65, train_loss: 0.5087, test_loss: 0.9926, test_f1: 0.6435
 epoch: 66, train_loss: 0.5214, test_loss: 0.9935, test_f1: 0.5962
 epoch: 67, train_loss: 0.5125, test_loss: 0.9947, test_f1: 0.6289
 epoch: 68, train_loss: 0.5093, test_loss: 0.9746, test_f1: 0.6280
 epoch: 69, train_loss: 0.4864, test_loss: 0.9763, test_f1: 0.6364
 epoch: 70, train_loss: 0.4982, test_loss: 0.9677, test_f1: 0.6253
 epoch: 71, train_loss: 0.4994, test_loss: 0.9582, test_f1: 0.6415
 epoch: 72, train_loss: 0.4849, test_loss: 1.0234, test_f1: 0.6284
 epoch: 73, train_loss: 0.4952, test_loss: 0.9274, test_f1: 0.6410
 epoch: 74, train_loss: 0.4805, test_loss: 1.0326, test_f1: 0.6258
 epoch: 75, train_loss: 0.4870, test_loss: 1.0593, test_f1: 0.6309
 epoch: 76, train_loss: 0.4769, test_loss: 1.0645, test_f1: 0.6379
 epoch: 77, train_loss: 0.4740, test_loss: 1.0415, test_f1: 0.6457
 epoch: 78, train_loss: 0.4700, test_loss: 1.0855, test_f1: 0.6330
 epoch: 79, train_loss: 0.4972, test_loss: 1.0143, test_f1: 0.6464
 epoch: 80, train_loss: 0.4803, test_loss: 1.0979, test_f1: 0.6357
 epoch: 81, train_loss: 0.4860, test_loss: 1.0316, test_f1: 0.6620
 epoch: 82, train_loss: 0.4733, test_loss: 1.1064, test_f1: 0.6459
 epoch: 83, train_loss: 0.4629, test_loss: 1.0255, test_f1: 0.6277
 epoch: 84, train_loss: 0.4673, test_loss: 1.0617, test_f1: 0.6449
 epoch: 85, train_loss: 0.4659, test_loss: 1.0215, test_f1: 0.6605
 epoch: 86, train_loss: 0.4736, test_loss: 1.0778, test_f1: 0.6487
 epoch: 87, train_loss: 0.4610, test_loss: 1.0872, test_f1: 0.6389
 epoch: 88, train_loss: 0.4589, test_loss: 1.0869, test_f1: 0.6431
 epoch: 89, train_loss: 0.4405, test_loss: 1.1666, test_f1: 0.6381
 epoch: 90, train_loss: 0.4508, test_loss: 1.0928, test_f1: 0.6523
 epoch: 91, train_loss: 0.4479, test_loss: 1.1337, test_f1: 0.6645
 epoch: 92, train_loss: 0.4567, test_loss: 1.0576, test_f1: 0.6461
 epoch: 93, train_loss: 0.4660, test_loss: 1.1223, test_f1: 0.6484
 epoch: 94, train_loss: 0.4457, test_loss: 1.1622, test_f1: 0.6476
 epoch: 95, train_loss: 0.4449, test_loss: 1.0458, test_f1: 0.6597
 epoch: 96, train_loss: 0.4341, test_loss: 1.1142, test_f1: 0.6488
 epoch: 97, train_loss: 0.4293, test_loss: 1.1096, test_f1: 0.6489
 epoch: 98, train_loss: 0.4355, test_loss: 1.2009, test_f1: 0.6412
 epoch: 99, train_loss: 0.4253, test_loss: 1.2369, test_f1: 0.6145
##################ITERATION #5 ****************************************
 epoch: 0, train_loss: 1.3296, test_loss: 1.2104, test_f1: 0.3179
 epoch: 1, train_loss: 1.0465, test_loss: 1.0046, test_f1: 0.4733
 epoch: 2, train_loss: 1.0146, test_loss: 0.9347, test_f1: 0.5043
 epoch: 3, train_loss: 0.9650, test_loss: 0.9503, test_f1: 0.5209
 epoch: 4, train_loss: 0.9642, test_loss: 0.9181, test_f1: 0.5328
 epoch: 5, train_loss: 0.9471, test_loss: 0.8985, test_f1: 0.4976
 epoch: 6, train_loss: 0.9288, test_loss: 0.8906, test_f1: 0.4735
 epoch: 7, train_loss: 0.9123, test_loss: 0.8578, test_f1: 0.5233
 epoch: 8, train_loss: 0.8906, test_loss: 0.8428, test_f1: 0.5581
 epoch: 9, train_loss: 0.8802, test_loss: 0.8616, test_f1: 0.5394
 epoch: 10, train_loss: 0.8663, test_loss: 0.8425, test_f1: 0.5320
 epoch: 11, train_loss: 0.8666, test_loss: 0.8384, test_f1: 0.5399
 epoch: 12, train_loss: 0.8423, test_loss: 0.8063, test_f1: 0.5621
 epoch: 13, train_loss: 0.8533, test_loss: 0.8551, test_f1: 0.5251
 epoch: 14, train_loss: 0.8276, test_loss: 0.7919, test_f1: 0.5708
 epoch: 15, train_loss: 0.8245, test_loss: 0.8108, test_f1: 0.5606
 epoch: 16, train_loss: 0.8061, test_loss: 0.7978, test_f1: 0.5900
 epoch: 17, train_loss: 0.8027, test_loss: 0.7697, test_f1: 0.5932
 epoch: 18, train_loss: 0.7860, test_loss: 0.7545, test_f1: 0.5970
 epoch: 19, train_loss: 0.7786, test_loss: 0.7928, test_f1: 0.5722
 epoch: 20, train_loss: 0.7714, test_loss: 0.7802, test_f1: 0.5851
 epoch: 21, train_loss: 0.7590, test_loss: 0.7387, test_f1: 0.6247
 epoch: 22, train_loss: 0.7499, test_loss: 0.7733, test_f1: 0.6112
 epoch: 23, train_loss: 0.7547, test_loss: 0.7671, test_f1: 0.6357
 epoch: 24, train_loss: 0.7433, test_loss: 0.7478, test_f1: 0.6357
 epoch: 25, train_loss: 0.7303, test_loss: 0.7658, test_f1: 0.6280
 epoch: 26, train_loss: 0.7367, test_loss: 0.7712, test_f1: 0.6188
 epoch: 27, train_loss: 0.7194, test_loss: 0.7472, test_f1: 0.6379
 epoch: 28, train_loss: 0.7060, test_loss: 0.7666, test_f1: 0.6286
 epoch: 29, train_loss: 0.7033, test_loss: 0.7742, test_f1: 0.6226
 epoch: 30, train_loss: 0.6951, test_loss: 0.7398, test_f1: 0.6492
 epoch: 31, train_loss: 0.7020, test_loss: 0.7203, test_f1: 0.6624
 epoch: 32, train_loss: 0.6825, test_loss: 0.7055, test_f1: 0.6722
 epoch: 33, train_loss: 0.6795, test_loss: 0.7078, test_f1: 0.6789
 epoch: 34, train_loss: 0.6890, test_loss: 0.7123, test_f1: 0.6700
 epoch: 35, train_loss: 0.6658, test_loss: 0.7259, test_f1: 0.6689
 epoch: 36, train_loss: 0.6638, test_loss: 0.6917, test_f1: 0.6928
 epoch: 37, train_loss: 0.6618, test_loss: 0.7265, test_f1: 0.6670
 epoch: 38, train_loss: 0.6647, test_loss: 0.7198, test_f1: 0.6565
 epoch: 39, train_loss: 0.6420, test_loss: 0.7372, test_f1: 0.6824
 epoch: 40, train_loss: 0.6339, test_loss: 0.7497, test_f1: 0.6334
 epoch: 41, train_loss: 0.6376, test_loss: 0.7150, test_f1: 0.6844
 epoch: 42, train_loss: 0.6357, test_loss: 0.7729, test_f1: 0.6373
 epoch: 43, train_loss: 0.6273, test_loss: 0.7172, test_f1: 0.6853
 epoch: 44, train_loss: 0.6268, test_loss: 0.7336, test_f1: 0.6767
 epoch: 45, train_loss: 0.6330, test_loss: 0.7400, test_f1: 0.6644
 epoch: 46, train_loss: 0.6300, test_loss: 0.7199, test_f1: 0.6679
 epoch: 47, train_loss: 0.6308, test_loss: 0.7591, test_f1: 0.6695
 epoch: 48, train_loss: 0.6179, test_loss: 0.7816, test_f1: 0.6524
 epoch: 49, train_loss: 0.6183, test_loss: 0.7398, test_f1: 0.6733
 epoch: 50, train_loss: 0.5960, test_loss: 0.7104, test_f1: 0.6767
 epoch: 51, train_loss: 0.5838, test_loss: 0.6852, test_f1: 0.6972
 epoch: 52, train_loss: 0.5668, test_loss: 0.7109, test_f1: 0.6841
 epoch: 53, train_loss: 0.5697, test_loss: 0.7052, test_f1: 0.6836
 epoch: 54, train_loss: 0.5644, test_loss: 0.7128, test_f1: 0.6734
 epoch: 55, train_loss: 0.5671, test_loss: 0.6982, test_f1: 0.6957
 epoch: 56, train_loss: 0.5374, test_loss: 0.7153, test_f1: 0.6810
 epoch: 57, train_loss: 0.5771, test_loss: 0.7318, test_f1: 0.6671
 epoch: 58, train_loss: 0.5443, test_loss: 0.7632, test_f1: 0.6715
 epoch: 59, train_loss: 0.5470, test_loss: 0.7788, test_f1: 0.6738
 epoch: 60, train_loss: 0.5378, test_loss: 0.7405, test_f1: 0.6934
 epoch: 61, train_loss: 0.5520, test_loss: 0.7776, test_f1: 0.6590
 epoch: 62, train_loss: 0.5446, test_loss: 0.7893, test_f1: 0.6583
 epoch: 63, train_loss: 0.5541, test_loss: 0.7351, test_f1: 0.6696
 epoch: 64, train_loss: 0.5462, test_loss: 0.7569, test_f1: 0.6764
 epoch: 65, train_loss: 0.5506, test_loss: 0.7450, test_f1: 0.6814
 epoch: 66, train_loss: 0.5235, test_loss: 0.7427, test_f1: 0.6735
 epoch: 67, train_loss: 0.5394, test_loss: 0.7650, test_f1: 0.6793
 epoch: 68, train_loss: 0.5302, test_loss: 0.7646, test_f1: 0.6519
 epoch: 69, train_loss: 0.5316, test_loss: 0.8101, test_f1: 0.6900
 epoch: 70, train_loss: 0.5266, test_loss: 0.7976, test_f1: 0.6640
 epoch: 71, train_loss: 0.5300, test_loss: 0.7868, test_f1: 0.6733
 epoch: 72, train_loss: 0.5228, test_loss: 0.7591, test_f1: 0.6879
 epoch: 73, train_loss: 0.5149, test_loss: 0.7676, test_f1: 0.6780
 epoch: 74, train_loss: 0.5119, test_loss: 0.7846, test_f1: 0.6711
 epoch: 75, train_loss: 0.5196, test_loss: 0.7992, test_f1: 0.7048
 epoch: 76, train_loss: 0.4918, test_loss: 0.7756, test_f1: 0.6931
 epoch: 77, train_loss: 0.5032, test_loss: 0.7932, test_f1: 0.6874
 epoch: 78, train_loss: 0.4949, test_loss: 0.8134, test_f1: 0.6758
 epoch: 79, train_loss: 0.5122, test_loss: 0.8252, test_f1: 0.6849
 epoch: 80, train_loss: 0.5007, test_loss: 0.7852, test_f1: 0.6903
 epoch: 81, train_loss: 0.4974, test_loss: 0.8106, test_f1: 0.6902
 epoch: 82, train_loss: 0.5021, test_loss: 0.8902, test_f1: 0.6622
 epoch: 83, train_loss: 0.4819, test_loss: 0.8370, test_f1: 0.6710
 epoch: 84, train_loss: 0.4985, test_loss: 0.8498, test_f1: 0.6964
 epoch: 85, train_loss: 0.4853, test_loss: 0.8461, test_f1: 0.6865
 epoch: 86, train_loss: 0.4772, test_loss: 0.8662, test_f1: 0.6706
 epoch: 87, train_loss: 0.4819, test_loss: 0.8669, test_f1: 0.6803
 epoch: 88, train_loss: 0.4843, test_loss: 0.8306, test_f1: 0.6764
 epoch: 89, train_loss: 0.4828, test_loss: 0.8596, test_f1: 0.6653
 epoch: 90, train_loss: 0.4821, test_loss: 0.8664, test_f1: 0.6816
 epoch: 91, train_loss: 0.4761, test_loss: 0.8744, test_f1: 0.6659
 epoch: 92, train_loss: 0.4807, test_loss: 0.8973, test_f1: 0.6725
 epoch: 93, train_loss: 0.4769, test_loss: 0.8436, test_f1: 0.6793
 epoch: 94, train_loss: 0.4746, test_loss: 0.9088, test_f1: 0.6696
 epoch: 95, train_loss: 0.4729, test_loss: 0.8911, test_f1: 0.6904
 epoch: 96, train_loss: 0.4805, test_loss: 0.9611, test_f1: 0.6765
 epoch: 97, train_loss: 0.4621, test_loss: 0.8637, test_f1: 0.6788
 epoch: 98, train_loss: 0.4558, test_loss: 0.8719, test_f1: 0.6721
 epoch: 99, train_loss: 0.4620, test_loss: 0.8811, test_f1: 0.6894
##################ITERATION #6 ****************************************
 epoch: 0, train_loss: 1.3407, test_loss: 1.2436, test_f1: 0.3902
 epoch: 1, train_loss: 1.0671, test_loss: 0.9524, test_f1: 0.5104
 epoch: 2, train_loss: 1.0120, test_loss: 0.9541, test_f1: 0.5075
 epoch: 3, train_loss: 0.9853, test_loss: 0.9392, test_f1: 0.5200
 epoch: 4, train_loss: 0.9560, test_loss: 0.9347, test_f1: 0.5051
 epoch: 5, train_loss: 0.9434, test_loss: 0.9364, test_f1: 0.5137
 epoch: 6, train_loss: 0.9350, test_loss: 0.9175, test_f1: 0.5326
 epoch: 7, train_loss: 0.9253, test_loss: 0.8937, test_f1: 0.5383
 epoch: 8, train_loss: 0.9094, test_loss: 0.8959, test_f1: 0.5239
 epoch: 9, train_loss: 0.8924, test_loss: 0.8615, test_f1: 0.5324
 epoch: 10, train_loss: 0.8662, test_loss: 0.8712, test_f1: 0.5671
 epoch: 11, train_loss: 0.8501, test_loss: 0.8251, test_f1: 0.5790
 epoch: 12, train_loss: 0.8472, test_loss: 0.8169, test_f1: 0.5685
 epoch: 13, train_loss: 0.8327, test_loss: 0.8273, test_f1: 0.5714
 epoch: 14, train_loss: 0.8388, test_loss: 0.8351, test_f1: 0.5682
 epoch: 15, train_loss: 0.8206, test_loss: 0.8466, test_f1: 0.5653
 epoch: 16, train_loss: 0.8104, test_loss: 0.8032, test_f1: 0.5893
 epoch: 17, train_loss: 0.8072, test_loss: 0.8259, test_f1: 0.5715
 epoch: 18, train_loss: 0.7935, test_loss: 0.7930, test_f1: 0.6259
 epoch: 19, train_loss: 0.7740, test_loss: 0.8288, test_f1: 0.6022
 epoch: 20, train_loss: 0.7764, test_loss: 0.8261, test_f1: 0.5762
 epoch: 21, train_loss: 0.7617, test_loss: 0.7800, test_f1: 0.5787
 epoch: 22, train_loss: 0.7536, test_loss: 0.8010, test_f1: 0.5939
 epoch: 23, train_loss: 0.7714, test_loss: 0.8084, test_f1: 0.5767
 epoch: 24, train_loss: 0.7440, test_loss: 0.8249, test_f1: 0.6121
 epoch: 25, train_loss: 0.7463, test_loss: 0.7818, test_f1: 0.6440
 epoch: 26, train_loss: 0.7422, test_loss: 0.7230, test_f1: 0.5954
 epoch: 27, train_loss: 0.7158, test_loss: 0.7750, test_f1: 0.6053
 epoch: 28, train_loss: 0.7212, test_loss: 0.7770, test_f1: 0.6704
 epoch: 29, train_loss: 0.7128, test_loss: 0.7728, test_f1: 0.6072
 epoch: 30, train_loss: 0.7037, test_loss: 0.7271, test_f1: 0.6387
 epoch: 31, train_loss: 0.7089, test_loss: 0.7965, test_f1: 0.6149
 epoch: 32, train_loss: 0.7081, test_loss: 0.7633, test_f1: 0.6387
 epoch: 33, train_loss: 0.6963, test_loss: 0.7346, test_f1: 0.6202
 epoch: 34, train_loss: 0.6918, test_loss: 0.7605, test_f1: 0.6164
 epoch: 35, train_loss: 0.6798, test_loss: 0.7383, test_f1: 0.6386
 epoch: 36, train_loss: 0.6893, test_loss: 0.8086, test_f1: 0.6433
 epoch: 37, train_loss: 0.6825, test_loss: 0.7401, test_f1: 0.6230
 epoch: 38, train_loss: 0.6775, test_loss: 0.7784, test_f1: 0.6391
 epoch: 39, train_loss: 0.6658, test_loss: 0.7797, test_f1: 0.6451
 epoch: 40, train_loss: 0.6612, test_loss: 0.8533, test_f1: 0.6286
 epoch: 41, train_loss: 0.6714, test_loss: 0.7635, test_f1: 0.6506
 epoch: 42, train_loss: 0.6501, test_loss: 0.7358, test_f1: 0.6295
 epoch: 43, train_loss: 0.6513, test_loss: 0.7740, test_f1: 0.6764
 epoch: 44, train_loss: 0.6364, test_loss: 0.7141, test_f1: 0.6309
 epoch: 45, train_loss: 0.6474, test_loss: 0.7108, test_f1: 0.6690
 epoch: 46, train_loss: 0.6345, test_loss: 0.8147, test_f1: 0.6391
 epoch: 47, train_loss: 0.6415, test_loss: 0.6927, test_f1: 0.6521
 epoch: 48, train_loss: 0.6380, test_loss: 0.8096, test_f1: 0.6367
 epoch: 49, train_loss: 0.6299, test_loss: 0.7610, test_f1: 0.6351
 epoch: 50, train_loss: 0.6291, test_loss: 0.7784, test_f1: 0.6435
 epoch: 51, train_loss: 0.6007, test_loss: 0.7596, test_f1: 0.6771
 epoch: 52, train_loss: 0.5867, test_loss: 0.6787, test_f1: 0.7088
 epoch: 53, train_loss: 0.5851, test_loss: 0.7741, test_f1: 0.6506
 epoch: 54, train_loss: 0.5884, test_loss: 0.7389, test_f1: 0.6699
 epoch: 55, train_loss: 0.5819, test_loss: 0.7864, test_f1: 0.6486
 epoch: 56, train_loss: 0.5806, test_loss: 0.7079, test_f1: 0.6812
 epoch: 57, train_loss: 0.5657, test_loss: 0.7943, test_f1: 0.6609
 epoch: 58, train_loss: 0.5665, test_loss: 0.7414, test_f1: 0.6582
 epoch: 59, train_loss: 0.5763, test_loss: 0.8144, test_f1: 0.6598
 epoch: 60, train_loss: 0.5746, test_loss: 0.7300, test_f1: 0.6856
 epoch: 61, train_loss: 0.5659, test_loss: 0.7999, test_f1: 0.6352
 epoch: 62, train_loss: 0.5518, test_loss: 0.8108, test_f1: 0.6688
 epoch: 63, train_loss: 0.5533, test_loss: 0.7773, test_f1: 0.6835
 epoch: 64, train_loss: 0.5507, test_loss: 0.7092, test_f1: 0.6962
 epoch: 65, train_loss: 0.5489, test_loss: 0.8234, test_f1: 0.6751
 epoch: 66, train_loss: 0.5440, test_loss: 0.8263, test_f1: 0.6614
 epoch: 67, train_loss: 0.5537, test_loss: 0.7777, test_f1: 0.6596
 epoch: 68, train_loss: 0.5424, test_loss: 0.8340, test_f1: 0.6554
 epoch: 69, train_loss: 0.5462, test_loss: 0.8270, test_f1: 0.6841
 epoch: 70, train_loss: 0.5433, test_loss: 0.7847, test_f1: 0.6829
 epoch: 71, train_loss: 0.5467, test_loss: 0.8180, test_f1: 0.6522
 epoch: 72, train_loss: 0.5289, test_loss: 0.9068, test_f1: 0.6713
 epoch: 73, train_loss: 0.5392, test_loss: 0.8990, test_f1: 0.6471
 epoch: 74, train_loss: 0.5383, test_loss: 0.8208, test_f1: 0.6733
 epoch: 75, train_loss: 0.5198, test_loss: 0.8631, test_f1: 0.6708
 epoch: 76, train_loss: 0.5203, test_loss: 0.8700, test_f1: 0.6578
 epoch: 77, train_loss: 0.5359, test_loss: 0.8176, test_f1: 0.6319
 epoch: 78, train_loss: 0.5337, test_loss: 0.8262, test_f1: 0.6619
 epoch: 79, train_loss: 0.5156, test_loss: 0.8653, test_f1: 0.6694
 epoch: 80, train_loss: 0.5286, test_loss: 0.8435, test_f1: 0.6571
 epoch: 81, train_loss: 0.5254, test_loss: 0.8550, test_f1: 0.6610
 epoch: 82, train_loss: 0.5019, test_loss: 0.8736, test_f1: 0.6552
 epoch: 83, train_loss: 0.5097, test_loss: 0.8862, test_f1: 0.6413
 epoch: 84, train_loss: 0.5151, test_loss: 0.8893, test_f1: 0.6585
 epoch: 85, train_loss: 0.5161, test_loss: 0.9045, test_f1: 0.6612
 epoch: 86, train_loss: 0.5142, test_loss: 0.8602, test_f1: 0.6525
 epoch: 87, train_loss: 0.5261, test_loss: 0.8972, test_f1: 0.6550
 epoch: 88, train_loss: 0.5131, test_loss: 0.9266, test_f1: 0.6516
 epoch: 89, train_loss: 0.4883, test_loss: 0.8917, test_f1: 0.6728
 epoch: 90, train_loss: 0.4992, test_loss: 0.9364, test_f1: 0.6589
 epoch: 91, train_loss: 0.4842, test_loss: 0.9112, test_f1: 0.6540
 epoch: 92, train_loss: 0.5202, test_loss: 0.9018, test_f1: 0.6715
 epoch: 93, train_loss: 0.4905, test_loss: 0.9251, test_f1: 0.6764
 epoch: 94, train_loss: 0.5089, test_loss: 0.9665, test_f1: 0.6393
 epoch: 95, train_loss: 0.4918, test_loss: 1.0018, test_f1: 0.6396
 epoch: 96, train_loss: 0.4735, test_loss: 0.8617, test_f1: 0.6587
 epoch: 97, train_loss: 0.4863, test_loss: 0.9332, test_f1: 0.6484
 epoch: 98, train_loss: 0.4852, test_loss: 1.0402, test_f1: 0.6364
 epoch: 99, train_loss: 0.4847, test_loss: 0.8796, test_f1: 0.6501
##################ITERATION #7 ****************************************
 epoch: 0, train_loss: 1.2458, test_loss: 1.1863, test_f1: 0.4110
 epoch: 1, train_loss: 1.0214, test_loss: 0.9789, test_f1: 0.4790
 epoch: 2, train_loss: 0.9796, test_loss: 0.9522, test_f1: 0.5053
 epoch: 3, train_loss: 0.9483, test_loss: 0.9086, test_f1: 0.5104
 epoch: 4, train_loss: 0.9407, test_loss: 0.9428, test_f1: 0.4951
 epoch: 5, train_loss: 0.9077, test_loss: 0.8969, test_f1: 0.5072
 epoch: 6, train_loss: 0.8973, test_loss: 0.8532, test_f1: 0.5448
 epoch: 7, train_loss: 0.8808, test_loss: 0.8454, test_f1: 0.5571
 epoch: 8, train_loss: 0.8867, test_loss: 0.8795, test_f1: 0.5244
 epoch: 9, train_loss: 0.8664, test_loss: 0.9470, test_f1: 0.5156
 epoch: 10, train_loss: 0.8343, test_loss: 0.8788, test_f1: 0.6010
 epoch: 11, train_loss: 0.8454, test_loss: 0.8735, test_f1: 0.5868
 epoch: 12, train_loss: 0.8318, test_loss: 0.9561, test_f1: 0.5854
 epoch: 13, train_loss: 0.8101, test_loss: 0.8951, test_f1: 0.5713
 epoch: 14, train_loss: 0.7921, test_loss: 0.8681, test_f1: 0.5703
 epoch: 15, train_loss: 0.7956, test_loss: 0.9160, test_f1: 0.5902
 epoch: 16, train_loss: 0.7872, test_loss: 0.8996, test_f1: 0.6010
 epoch: 17, train_loss: 0.7771, test_loss: 0.8729, test_f1: 0.6195
 epoch: 18, train_loss: 0.7765, test_loss: 0.8871, test_f1: 0.6110
 epoch: 19, train_loss: 0.7527, test_loss: 0.8894, test_f1: 0.6077
 epoch: 20, train_loss: 0.7421, test_loss: 0.8897, test_f1: 0.6133
 epoch: 21, train_loss: 0.7543, test_loss: 0.8945, test_f1: 0.6223
 epoch: 22, train_loss: 0.7418, test_loss: 0.8678, test_f1: 0.6177
 epoch: 23, train_loss: 0.7327, test_loss: 0.9276, test_f1: 0.5997
 epoch: 24, train_loss: 0.7294, test_loss: 0.9053, test_f1: 0.6322
 epoch: 25, train_loss: 0.7188, test_loss: 0.9509, test_f1: 0.6340
 epoch: 26, train_loss: 0.7189, test_loss: 0.9426, test_f1: 0.6292
 epoch: 27, train_loss: 0.7103, test_loss: 0.9054, test_f1: 0.6265
 epoch: 28, train_loss: 0.6973, test_loss: 1.0321, test_f1: 0.5871
 epoch: 29, train_loss: 0.7049, test_loss: 0.9787, test_f1: 0.5982
 epoch: 30, train_loss: 0.6976, test_loss: 0.9192, test_f1: 0.6270
 epoch: 31, train_loss: 0.6892, test_loss: 0.9715, test_f1: 0.6302
 epoch: 32, train_loss: 0.6751, test_loss: 0.9096, test_f1: 0.6291
 epoch: 33, train_loss: 0.6780, test_loss: 0.9154, test_f1: 0.6319
 epoch: 34, train_loss: 0.6858, test_loss: 0.9479, test_f1: 0.5914
 epoch: 35, train_loss: 0.6746, test_loss: 1.0177, test_f1: 0.6169
 epoch: 36, train_loss: 0.6522, test_loss: 0.9107, test_f1: 0.6291
 epoch: 37, train_loss: 0.6444, test_loss: 0.9151, test_f1: 0.6375
 epoch: 38, train_loss: 0.6306, test_loss: 0.9422, test_f1: 0.6300
 epoch: 39, train_loss: 0.6456, test_loss: 0.9301, test_f1: 0.6445
 epoch: 40, train_loss: 0.6599, test_loss: 0.9295, test_f1: 0.6360
 epoch: 41, train_loss: 0.6547, test_loss: 0.9456, test_f1: 0.6266
 epoch: 42, train_loss: 0.6331, test_loss: 0.9018, test_f1: 0.6148
 epoch: 43, train_loss: 0.6417, test_loss: 0.9216, test_f1: 0.6463
 epoch: 44, train_loss: 0.6389, test_loss: 0.9024, test_f1: 0.6412
 epoch: 45, train_loss: 0.6295, test_loss: 0.9808, test_f1: 0.6322
 epoch: 46, train_loss: 0.6257, test_loss: 0.9288, test_f1: 0.6498
 epoch: 47, train_loss: 0.6319, test_loss: 0.9839, test_f1: 0.6609
 epoch: 48, train_loss: 0.6017, test_loss: 0.9131, test_f1: 0.6500
 epoch: 49, train_loss: 0.6261, test_loss: 0.9301, test_f1: 0.6715
 epoch: 50, train_loss: 0.5948, test_loss: 0.9604, test_f1: 0.6583
 epoch: 51, train_loss: 0.5690, test_loss: 0.9047, test_f1: 0.6584
 epoch: 52, train_loss: 0.5690, test_loss: 0.9680, test_f1: 0.6453
 epoch: 53, train_loss: 0.5571, test_loss: 0.9902, test_f1: 0.6359
 epoch: 54, train_loss: 0.5660, test_loss: 0.9482, test_f1: 0.6539
 epoch: 55, train_loss: 0.5561, test_loss: 0.9595, test_f1: 0.6580
 epoch: 56, train_loss: 0.5650, test_loss: 0.9786, test_f1: 0.6399
 epoch: 57, train_loss: 0.5491, test_loss: 0.9601, test_f1: 0.6708
 epoch: 58, train_loss: 0.5325, test_loss: 0.9766, test_f1: 0.6529
 epoch: 59, train_loss: 0.5386, test_loss: 1.0371, test_f1: 0.6366
 epoch: 60, train_loss: 0.5307, test_loss: 1.1039, test_f1: 0.6179
 epoch: 61, train_loss: 0.5397, test_loss: 0.9628, test_f1: 0.6378
 epoch: 62, train_loss: 0.5333, test_loss: 1.0278, test_f1: 0.6325
 epoch: 63, train_loss: 0.5592, test_loss: 0.9252, test_f1: 0.6715
 epoch: 64, train_loss: 0.5356, test_loss: 0.9669, test_f1: 0.6462
 epoch: 65, train_loss: 0.5320, test_loss: 1.0431, test_f1: 0.6485
 epoch: 66, train_loss: 0.5304, test_loss: 0.9813, test_f1: 0.6752
 epoch: 67, train_loss: 0.5214, test_loss: 1.0072, test_f1: 0.6514
 epoch: 68, train_loss: 0.5396, test_loss: 1.0026, test_f1: 0.6458
 epoch: 69, train_loss: 0.5275, test_loss: 0.9906, test_f1: 0.6464
 epoch: 70, train_loss: 0.5201, test_loss: 1.1523, test_f1: 0.6113
 epoch: 71, train_loss: 0.5112, test_loss: 1.0541, test_f1: 0.6553
 epoch: 72, train_loss: 0.5156, test_loss: 0.9775, test_f1: 0.6481
 epoch: 73, train_loss: 0.5058, test_loss: 1.0297, test_f1: 0.6416
 epoch: 74, train_loss: 0.5112, test_loss: 1.0808, test_f1: 0.6474
 epoch: 75, train_loss: 0.5072, test_loss: 1.0801, test_f1: 0.6402
 epoch: 76, train_loss: 0.5079, test_loss: 1.0500, test_f1: 0.6512
 epoch: 77, train_loss: 0.4995, test_loss: 1.0704, test_f1: 0.6408
 epoch: 78, train_loss: 0.5078, test_loss: 1.0396, test_f1: 0.6527
 epoch: 79, train_loss: 0.4887, test_loss: 1.1445, test_f1: 0.6386
 epoch: 80, train_loss: 0.5055, test_loss: 1.0092, test_f1: 0.6587
 epoch: 81, train_loss: 0.5134, test_loss: 1.1081, test_f1: 0.6510
 epoch: 82, train_loss: 0.4849, test_loss: 1.1061, test_f1: 0.6479
 epoch: 83, train_loss: 0.5000, test_loss: 1.1204, test_f1: 0.6643
 epoch: 84, train_loss: 0.4915, test_loss: 1.1972, test_f1: 0.6424
 epoch: 85, train_loss: 0.4875, test_loss: 1.1492, test_f1: 0.6683
 epoch: 86, train_loss: 0.5012, test_loss: 1.1082, test_f1: 0.6467
 epoch: 87, train_loss: 0.5065, test_loss: 1.1098, test_f1: 0.6547
 epoch: 88, train_loss: 0.4794, test_loss: 1.1244, test_f1: 0.6548
 epoch: 89, train_loss: 0.4657, test_loss: 1.2072, test_f1: 0.6343
 epoch: 90, train_loss: 0.4833, test_loss: 1.0895, test_f1: 0.6471
 epoch: 91, train_loss: 0.4846, test_loss: 1.1347, test_f1: 0.6299
 epoch: 92, train_loss: 0.4815, test_loss: 1.1202, test_f1: 0.6656
 epoch: 93, train_loss: 0.4762, test_loss: 1.1501, test_f1: 0.6445
 epoch: 94, train_loss: 0.4710, test_loss: 1.1509, test_f1: 0.6443
 epoch: 95, train_loss: 0.4842, test_loss: 1.2077, test_f1: 0.6472
 epoch: 96, train_loss: 0.4760, test_loss: 1.2412, test_f1: 0.6297
 epoch: 97, train_loss: 0.4748, test_loss: 1.1869, test_f1: 0.6255
 epoch: 98, train_loss: 0.4666, test_loss: 1.2512, test_f1: 0.6322
 epoch: 99, train_loss: 0.4838, test_loss: 1.2331, test_f1: 0.6128
##################ITERATION #8 ****************************************
 epoch: 0, train_loss: 1.3855, test_loss: 1.0940, test_f1: 0.4747
 epoch: 1, train_loss: 1.0460, test_loss: 1.0257, test_f1: 0.4694
 epoch: 2, train_loss: 1.0202, test_loss: 0.9964, test_f1: 0.4802
 epoch: 3, train_loss: 0.9763, test_loss: 0.9965, test_f1: 0.4906
 epoch: 4, train_loss: 0.9608, test_loss: 0.9457, test_f1: 0.4926
 epoch: 5, train_loss: 0.9440, test_loss: 0.9680, test_f1: 0.5161
 epoch: 6, train_loss: 0.9298, test_loss: 0.9121, test_f1: 0.5379
 epoch: 7, train_loss: 0.9071, test_loss: 0.9241, test_f1: 0.5336
 epoch: 8, train_loss: 0.9096, test_loss: 0.8936, test_f1: 0.5415
 epoch: 9, train_loss: 0.8931, test_loss: 0.8877, test_f1: 0.5476
 epoch: 10, train_loss: 0.8877, test_loss: 0.9293, test_f1: 0.5246
 epoch: 11, train_loss: 0.8775, test_loss: 0.8931, test_f1: 0.5397
 epoch: 12, train_loss: 0.8631, test_loss: 0.9030, test_f1: 0.5509
 epoch: 13, train_loss: 0.8551, test_loss: 0.9112, test_f1: 0.5610
 epoch: 14, train_loss: 0.8406, test_loss: 0.9385, test_f1: 0.5379
 epoch: 15, train_loss: 0.8372, test_loss: 0.8503, test_f1: 0.6071
 epoch: 16, train_loss: 0.8311, test_loss: 0.8467, test_f1: 0.5933
 epoch: 17, train_loss: 0.8242, test_loss: 0.7979, test_f1: 0.5605
 epoch: 18, train_loss: 0.8121, test_loss: 0.8568, test_f1: 0.5564
 epoch: 19, train_loss: 0.7999, test_loss: 0.8258, test_f1: 0.5672
 epoch: 20, train_loss: 0.8068, test_loss: 0.8457, test_f1: 0.5793
 epoch: 21, train_loss: 0.7912, test_loss: 0.8116, test_f1: 0.6130
 epoch: 22, train_loss: 0.7798, test_loss: 0.8628, test_f1: 0.5669
 epoch: 23, train_loss: 0.7832, test_loss: 0.9117, test_f1: 0.5780
 epoch: 24, train_loss: 0.7664, test_loss: 0.8169, test_f1: 0.6013
 epoch: 25, train_loss: 0.7532, test_loss: 0.8244, test_f1: 0.6392
 epoch: 26, train_loss: 0.7513, test_loss: 0.8443, test_f1: 0.6104
 epoch: 27, train_loss: 0.7553, test_loss: 0.8474, test_f1: 0.6237
 epoch: 28, train_loss: 0.7526, test_loss: 0.8763, test_f1: 0.5620
 epoch: 29, train_loss: 0.7415, test_loss: 0.8099, test_f1: 0.5911
 epoch: 30, train_loss: 0.7319, test_loss: 0.7937, test_f1: 0.5963
 epoch: 31, train_loss: 0.7179, test_loss: 0.7886, test_f1: 0.5709
 epoch: 32, train_loss: 0.7326, test_loss: 0.7700, test_f1: 0.6093
 epoch: 33, train_loss: 0.7130, test_loss: 0.7632, test_f1: 0.6616
 epoch: 34, train_loss: 0.7128, test_loss: 0.8233, test_f1: 0.6093
 epoch: 35, train_loss: 0.7105, test_loss: 0.8311, test_f1: 0.6018
 epoch: 36, train_loss: 0.7155, test_loss: 0.7232, test_f1: 0.6201
 epoch: 37, train_loss: 0.6955, test_loss: 0.7727, test_f1: 0.6156
 epoch: 38, train_loss: 0.7045, test_loss: 0.7828, test_f1: 0.6295
 epoch: 39, train_loss: 0.7075, test_loss: 0.8491, test_f1: 0.6068
 epoch: 40, train_loss: 0.6942, test_loss: 0.7476, test_f1: 0.6264
 epoch: 41, train_loss: 0.6761, test_loss: 0.8069, test_f1: 0.6584
 epoch: 42, train_loss: 0.6806, test_loss: 0.7436, test_f1: 0.6255
 epoch: 43, train_loss: 0.6742, test_loss: 0.7831, test_f1: 0.6417
 epoch: 44, train_loss: 0.6602, test_loss: 0.8866, test_f1: 0.6231
 epoch: 45, train_loss: 0.6745, test_loss: 0.7016, test_f1: 0.6474
 epoch: 46, train_loss: 0.6649, test_loss: 0.8319, test_f1: 0.6045
 epoch: 47, train_loss: 0.6743, test_loss: 0.9165, test_f1: 0.6105
 epoch: 48, train_loss: 0.6577, test_loss: 0.8104, test_f1: 0.6115
 epoch: 49, train_loss: 0.6563, test_loss: 0.7611, test_f1: 0.6211
 epoch: 50, train_loss: 0.6458, test_loss: 0.6995, test_f1: 0.6444
 epoch: 51, train_loss: 0.6344, test_loss: 0.7621, test_f1: 0.6371
 epoch: 52, train_loss: 0.6250, test_loss: 0.7451, test_f1: 0.6542
 epoch: 53, train_loss: 0.6149, test_loss: 0.7943, test_f1: 0.6512
 epoch: 54, train_loss: 0.6197, test_loss: 0.7356, test_f1: 0.6590
 epoch: 55, train_loss: 0.5888, test_loss: 0.7663, test_f1: 0.6533
 epoch: 56, train_loss: 0.5969, test_loss: 0.8369, test_f1: 0.6391
 epoch: 57, train_loss: 0.5968, test_loss: 0.8055, test_f1: 0.6339
 epoch: 58, train_loss: 0.5821, test_loss: 0.7555, test_f1: 0.6727
 epoch: 59, train_loss: 0.5924, test_loss: 0.7963, test_f1: 0.6599
 epoch: 60, train_loss: 0.5881, test_loss: 0.8364, test_f1: 0.6442
 epoch: 61, train_loss: 0.5762, test_loss: 0.7942, test_f1: 0.6723
 epoch: 62, train_loss: 0.5801, test_loss: 0.8374, test_f1: 0.6563
 epoch: 63, train_loss: 0.5838, test_loss: 0.8758, test_f1: 0.6440
 epoch: 64, train_loss: 0.5804, test_loss: 0.8521, test_f1: 0.6625
 epoch: 65, train_loss: 0.5704, test_loss: 0.8851, test_f1: 0.6556
 epoch: 66, train_loss: 0.5776, test_loss: 0.8828, test_f1: 0.6305
 epoch: 67, train_loss: 0.5690, test_loss: 0.8816, test_f1: 0.6453
 epoch: 68, train_loss: 0.5734, test_loss: 0.7711, test_f1: 0.6496
 epoch: 69, train_loss: 0.5666, test_loss: 0.7730, test_f1: 0.6625
 epoch: 70, train_loss: 0.5543, test_loss: 0.8551, test_f1: 0.6354
 epoch: 71, train_loss: 0.5646, test_loss: 0.8788, test_f1: 0.6446
 epoch: 72, train_loss: 0.5582, test_loss: 0.8122, test_f1: 0.6504
 epoch: 73, train_loss: 0.5572, test_loss: 0.8592, test_f1: 0.6506
 epoch: 74, train_loss: 0.5528, test_loss: 0.8589, test_f1: 0.6775
 epoch: 75, train_loss: 0.5550, test_loss: 0.8036, test_f1: 0.6781
 epoch: 76, train_loss: 0.5656, test_loss: 0.8191, test_f1: 0.6639
 epoch: 77, train_loss: 0.5307, test_loss: 0.8632, test_f1: 0.6701
 epoch: 78, train_loss: 0.5486, test_loss: 0.8407, test_f1: 0.6519
 epoch: 79, train_loss: 0.5473, test_loss: 0.9040, test_f1: 0.6499
 epoch: 80, train_loss: 0.5370, test_loss: 0.8717, test_f1: 0.6396
 epoch: 81, train_loss: 0.5515, test_loss: 0.8288, test_f1: 0.6710
 epoch: 82, train_loss: 0.5445, test_loss: 0.8706, test_f1: 0.6439
 epoch: 83, train_loss: 0.5596, test_loss: 0.8034, test_f1: 0.6532
 epoch: 84, train_loss: 0.5349, test_loss: 0.8770, test_f1: 0.6671
 epoch: 85, train_loss: 0.5337, test_loss: 0.8271, test_f1: 0.6550
 epoch: 86, train_loss: 0.5443, test_loss: 0.9429, test_f1: 0.6601
 epoch: 87, train_loss: 0.5301, test_loss: 0.7947, test_f1: 0.6709
 epoch: 88, train_loss: 0.5384, test_loss: 0.8534, test_f1: 0.6719
 epoch: 89, train_loss: 0.5424, test_loss: 0.9428, test_f1: 0.6878
 epoch: 90, train_loss: 0.5294, test_loss: 0.9567, test_f1: 0.6792
 epoch: 91, train_loss: 0.5311, test_loss: 0.8110, test_f1: 0.6847
 epoch: 92, train_loss: 0.5300, test_loss: 0.8829, test_f1: 0.6517
 epoch: 93, train_loss: 0.5120, test_loss: 0.9109, test_f1: 0.6451
 epoch: 94, train_loss: 0.5244, test_loss: 0.9365, test_f1: 0.6764
 epoch: 95, train_loss: 0.5197, test_loss: 0.9122, test_f1: 0.6565
 epoch: 96, train_loss: 0.5225, test_loss: 0.9631, test_f1: 0.6637
 epoch: 97, train_loss: 0.5158, test_loss: 0.9210, test_f1: 0.6719
 epoch: 98, train_loss: 0.5182, test_loss: 0.8711, test_f1: 0.6581
 epoch: 99, train_loss: 0.5134, test_loss: 0.9801, test_f1: 0.6391
##################ITERATION #9 ****************************************
 epoch: 0, train_loss: 1.4018, test_loss: 1.2461, test_f1: 0.3074
 epoch: 1, train_loss: 1.0612, test_loss: 0.9779, test_f1: 0.4894
 epoch: 2, train_loss: 1.0024, test_loss: 0.9789, test_f1: 0.5048
 epoch: 3, train_loss: 0.9830, test_loss: 0.9712, test_f1: 0.5117
 epoch: 4, train_loss: 0.9484, test_loss: 0.9575, test_f1: 0.5252
 epoch: 5, train_loss: 0.9308, test_loss: 0.9495, test_f1: 0.5112
 epoch: 6, train_loss: 0.9205, test_loss: 0.9400, test_f1: 0.5243
 epoch: 7, train_loss: 0.9213, test_loss: 0.9233, test_f1: 0.5502
 epoch: 8, train_loss: 0.9023, test_loss: 0.9376, test_f1: 0.5430
 epoch: 9, train_loss: 0.8822, test_loss: 0.9096, test_f1: 0.5585
 epoch: 10, train_loss: 0.8673, test_loss: 0.8992, test_f1: 0.5846
 epoch: 11, train_loss: 0.8676, test_loss: 0.8921, test_f1: 0.5740
 epoch: 12, train_loss: 0.8484, test_loss: 0.8929, test_f1: 0.5873
 epoch: 13, train_loss: 0.8409, test_loss: 0.8729, test_f1: 0.5795
 epoch: 14, train_loss: 0.8285, test_loss: 0.8837, test_f1: 0.5552
 epoch: 15, train_loss: 0.8286, test_loss: 0.8463, test_f1: 0.5896
 epoch: 16, train_loss: 0.8148, test_loss: 0.8668, test_f1: 0.6133
 epoch: 17, train_loss: 0.8033, test_loss: 0.8753, test_f1: 0.5952
 epoch: 18, train_loss: 0.7893, test_loss: 0.8636, test_f1: 0.5743
 epoch: 19, train_loss: 0.8054, test_loss: 0.8521, test_f1: 0.5977
 epoch: 20, train_loss: 0.7833, test_loss: 0.8333, test_f1: 0.5630
 epoch: 21, train_loss: 0.7662, test_loss: 0.8808, test_f1: 0.5658
 epoch: 22, train_loss: 0.7640, test_loss: 0.8380, test_f1: 0.6040
 epoch: 23, train_loss: 0.7648, test_loss: 0.8143, test_f1: 0.6231
 epoch: 24, train_loss: 0.7494, test_loss: 0.8498, test_f1: 0.6109
 epoch: 25, train_loss: 0.7399, test_loss: 0.8187, test_f1: 0.5955
 epoch: 26, train_loss: 0.7525, test_loss: 0.8363, test_f1: 0.6036
 epoch: 27, train_loss: 0.7378, test_loss: 0.8291, test_f1: 0.6044
 epoch: 28, train_loss: 0.7210, test_loss: 0.8116, test_f1: 0.6181
 epoch: 29, train_loss: 0.7373, test_loss: 0.8509, test_f1: 0.5897
 epoch: 30, train_loss: 0.7046, test_loss: 0.8329, test_f1: 0.6396
 epoch: 31, train_loss: 0.7038, test_loss: 0.7925, test_f1: 0.6431
 epoch: 32, train_loss: 0.7139, test_loss: 0.7943, test_f1: 0.6514
 epoch: 33, train_loss: 0.6914, test_loss: 0.7601, test_f1: 0.6328
 epoch: 34, train_loss: 0.7023, test_loss: 0.8057, test_f1: 0.6563
 epoch: 35, train_loss: 0.6730, test_loss: 0.8352, test_f1: 0.6301
 epoch: 36, train_loss: 0.6736, test_loss: 0.8461, test_f1: 0.6179
 epoch: 37, train_loss: 0.6714, test_loss: 0.8190, test_f1: 0.6627
 epoch: 38, train_loss: 0.6676, test_loss: 0.8338, test_f1: 0.6324
 epoch: 39, train_loss: 0.6415, test_loss: 0.8328, test_f1: 0.6320
 epoch: 40, train_loss: 0.6632, test_loss: 0.8687, test_f1: 0.6270
 epoch: 41, train_loss: 0.6674, test_loss: 0.9160, test_f1: 0.6331
 epoch: 42, train_loss: 0.6671, test_loss: 0.8797, test_f1: 0.6107
 epoch: 43, train_loss: 0.6540, test_loss: 0.8339, test_f1: 0.6548
 epoch: 44, train_loss: 0.6415, test_loss: 0.8270, test_f1: 0.6240
 epoch: 45, train_loss: 0.6461, test_loss: 0.8714, test_f1: 0.5930
 epoch: 46, train_loss: 0.6406, test_loss: 0.8717, test_f1: 0.6481
 epoch: 47, train_loss: 0.6204, test_loss: 0.8000, test_f1: 0.6549
 epoch: 48, train_loss: 0.6029, test_loss: 0.8715, test_f1: 0.6460
 epoch: 49, train_loss: 0.6208, test_loss: 0.8420, test_f1: 0.6655
 epoch: 50, train_loss: 0.6180, test_loss: 0.8788, test_f1: 0.6163
 epoch: 51, train_loss: 0.5846, test_loss: 0.8370, test_f1: 0.6341
 epoch: 52, train_loss: 0.5758, test_loss: 0.8212, test_f1: 0.6903
 epoch: 53, train_loss: 0.5679, test_loss: 0.8089, test_f1: 0.6717
 epoch: 54, train_loss: 0.5743, test_loss: 0.8446, test_f1: 0.6703
 epoch: 55, train_loss: 0.5759, test_loss: 0.8527, test_f1: 0.6701
 epoch: 56, train_loss: 0.5483, test_loss: 0.8279, test_f1: 0.6800
 epoch: 57, train_loss: 0.5686, test_loss: 0.8729, test_f1: 0.6520
 epoch: 58, train_loss: 0.5604, test_loss: 0.9448, test_f1: 0.6315
 epoch: 59, train_loss: 0.5391, test_loss: 0.8909, test_f1: 0.6439
 epoch: 60, train_loss: 0.5520, test_loss: 0.8917, test_f1: 0.6502
 epoch: 61, train_loss: 0.5406, test_loss: 0.8860, test_f1: 0.6516
 epoch: 62, train_loss: 0.5455, test_loss: 1.0057, test_f1: 0.6410
 epoch: 63, train_loss: 0.5382, test_loss: 0.8964, test_f1: 0.6540
 epoch: 64, train_loss: 0.5182, test_loss: 0.9148, test_f1: 0.6547
 epoch: 65, train_loss: 0.5478, test_loss: 0.8728, test_f1: 0.6646
 epoch: 66, train_loss: 0.5383, test_loss: 0.9230, test_f1: 0.6514
 epoch: 67, train_loss: 0.5306, test_loss: 0.9166, test_f1: 0.6424
 epoch: 68, train_loss: 0.5267, test_loss: 0.8808, test_f1: 0.6876
 epoch: 69, train_loss: 0.5130, test_loss: 0.8985, test_f1: 0.6593
 epoch: 70, train_loss: 0.5222, test_loss: 0.9257, test_f1: 0.6456
 epoch: 71, train_loss: 0.5220, test_loss: 0.9472, test_f1: 0.6446
 epoch: 72, train_loss: 0.5149, test_loss: 0.9890, test_f1: 0.6391
 epoch: 73, train_loss: 0.5226, test_loss: 1.0171, test_f1: 0.6152
 epoch: 74, train_loss: 0.5023, test_loss: 0.9346, test_f1: 0.6510
 epoch: 75, train_loss: 0.5164, test_loss: 0.9257, test_f1: 0.6425
 epoch: 76, train_loss: 0.5193, test_loss: 0.9428, test_f1: 0.6650
 epoch: 77, train_loss: 0.5061, test_loss: 1.0199, test_f1: 0.6283
 epoch: 78, train_loss: 0.4986, test_loss: 1.0469, test_f1: 0.6119
 epoch: 79, train_loss: 0.5250, test_loss: 1.0136, test_f1: 0.6079
 epoch: 80, train_loss: 0.4887, test_loss: 0.9442, test_f1: 0.6251
 epoch: 81, train_loss: 0.4942, test_loss: 1.0279, test_f1: 0.6212
 epoch: 82, train_loss: 0.5106, test_loss: 0.9136, test_f1: 0.6416
 epoch: 83, train_loss: 0.4898, test_loss: 0.9430, test_f1: 0.6503
 epoch: 84, train_loss: 0.5028, test_loss: 1.0038, test_f1: 0.6182
 epoch: 85, train_loss: 0.4941, test_loss: 1.0221, test_f1: 0.6538
 epoch: 86, train_loss: 0.4939, test_loss: 0.9122, test_f1: 0.6429
 epoch: 87, train_loss: 0.4969, test_loss: 0.9509, test_f1: 0.6441
 epoch: 88, train_loss: 0.4927, test_loss: 0.9354, test_f1: 0.6645
 epoch: 89, train_loss: 0.4813, test_loss: 0.9393, test_f1: 0.6605
 epoch: 90, train_loss: 0.4824, test_loss: 1.0025, test_f1: 0.6578
 epoch: 91, train_loss: 0.4868, test_loss: 1.1044, test_f1: 0.6324
 epoch: 92, train_loss: 0.4738, test_loss: 1.0002, test_f1: 0.6534
 epoch: 93, train_loss: 0.4892, test_loss: 0.8791, test_f1: 0.6530
 epoch: 94, train_loss: 0.4665, test_loss: 1.0787, test_f1: 0.6329
 epoch: 95, train_loss: 0.4843, test_loss: 0.9632, test_f1: 0.6408
 epoch: 96, train_loss: 0.4681, test_loss: 1.0348, test_f1: 0.6238
 epoch: 97, train_loss: 0.4794, test_loss: 0.9620, test_f1: 0.6421
 epoch: 98, train_loss: 0.4534, test_loss: 0.9671, test_f1: 0.6395
 epoch: 99, train_loss: 0.4628, test_loss: 1.0817, test_f1: 0.6210

Training completed in 694.08 seconds
Best F1: 0.7088 at epoch 52
Mean F1 across iterations: 0.6832  0.0173
========================FINAL RESULTS================================
FEGIN weighted F1: 0.7088  0.0173
python main.py --data ltspice_examples --representation component_pin_net --model FEGIN --layers 4 --hiddens 32 --batch_size 64 --lr 0.001 --emb_size 512 --epochs 100 --save_appendix component_pin_net_L4_H32_BS64_LR0.001_E512 --no_val
-----



STDERR:
  File "main.py", line 370, in <module>
    main()
  File "main.py", line 254, in main
    dataset = dataset_class(
  File "/home/philip/projects/ltspice_examples_code_repo/Circuit-Completion-Using-GNNs/component_classification_with_link_prediction_head/evaluation/FEGIN/kernel/circuit_datasets.py", line 15, in __init__
    self.data, self.slices = torch.load(self.processed_paths[0])
  File "/home/philip/.local/lib/python3.8/site-packages/torch/serialization.py", line 1040, in load
    warnings.warn(
  File "/usr/lib/python3.8/warnings.py", line 109, in _showwarnmsg
    sw(msg.message, msg.category, msg.filename, msg.lineno,
  File "main.py", line 47, in warn_with_traceback
    traceback.print_stack(file=log)
/home/philip/projects/ltspice_examples_code_repo/Circuit-Completion-Using-GNNs/component_classification_with_link_prediction_head/evaluation/FEGIN/kernel/circuit_datasets.py:15: FutureWarning: You are using `torch.load` with `weights_only=False` (the current default value), which uses the default pickle module implicitly. It is possible to construct malicious pickle data which will execute arbitrary code during unpickling (See https://github.com/pytorch/pytorch/blob/main/SECURITY.md#untrusted-models for more details). In a future release, the default value for `weights_only` will be flipped to `True`. This limits the functions that could be executed during unpickling. Arbitrary objects will no longer be allowed to be loaded via this mode unless they are explicitly allowlisted by the user via `torch.serialization.add_safe_globals`. We recommend you start setting `weights_only=True` for any use case where you don't have full control of the loaded file. Please open an issue on GitHub for any issues related to this experimental feature.
  self.data, self.slices = torch.load(self.processed_paths[0])
