STDOUT:
Results will be saved in /home/philip/projects/ltspice_examples_code_repo/Circuit-Completion-Using-GNNs/component_classification_with_link_prediction_head/evaluation/FEGIN/results/model_FEGIN_dataset_ltspice_examples
Command line input: python main.py --data ltspice_examples --representation component_pin --model FEGIN --layers 6 --hiddens 16 --batch_size 256 --lr 0.0001 --emb_size 512 --epochs 100 --save_appendix component_pin_L6_H16_BS256_LR0.0001_E512 --no_val
 is saved.
-----
ltspice_examples - FEGIN
Using 6 layers, 16 hidden units, h = 2
Loading component_pin representation dataset
ENTERED
Training FEGIN on component_pin representation
Train: 3560, Test: 848
##################ITERATION #0 ****************************************
 epoch: 0, train_loss: 1.4665, test_loss: 1.4547, test_f1: 0.0789
 epoch: 1, train_loss: 1.4638, test_loss: 1.4529, test_f1: 0.0789
 epoch: 2, train_loss: 1.4622, test_loss: 1.4514, test_f1: 0.0789
 epoch: 3, train_loss: 1.4605, test_loss: 1.4498, test_f1: 0.0789
 epoch: 4, train_loss: 1.4590, test_loss: 1.4484, test_f1: 0.0789
 epoch: 5, train_loss: 1.4575, test_loss: 1.4469, test_f1: 0.0789
 epoch: 6, train_loss: 1.4557, test_loss: 1.4452, test_f1: 0.0789
 epoch: 7, train_loss: 1.4541, test_loss: 1.4437, test_f1: 0.0789
 epoch: 8, train_loss: 1.4527, test_loss: 1.4422, test_f1: 0.0789
 epoch: 9, train_loss: 1.4508, test_loss: 1.4409, test_f1: 0.0789
 epoch: 10, train_loss: 1.4493, test_loss: 1.4395, test_f1: 0.0789
 epoch: 11, train_loss: 1.4478, test_loss: 1.4381, test_f1: 0.0789
 epoch: 12, train_loss: 1.4466, test_loss: 1.4366, test_f1: 0.0789
 epoch: 13, train_loss: 1.4450, test_loss: 1.4354, test_f1: 0.0789
 epoch: 14, train_loss: 1.4431, test_loss: 1.4338, test_f1: 0.0789
 epoch: 15, train_loss: 1.4414, test_loss: 1.4322, test_f1: 0.0789
 epoch: 16, train_loss: 1.4400, test_loss: 1.4307, test_f1: 0.0789
 epoch: 17, train_loss: 1.4382, test_loss: 1.4291, test_f1: 0.0789
 epoch: 18, train_loss: 1.4367, test_loss: 1.4277, test_f1: 0.0789
 epoch: 19, train_loss: 1.4350, test_loss: 1.4261, test_f1: 0.0789
 epoch: 20, train_loss: 1.4330, test_loss: 1.4246, test_f1: 0.0789
 epoch: 21, train_loss: 1.4316, test_loss: 1.4231, test_f1: 0.0791
 epoch: 22, train_loss: 1.4297, test_loss: 1.4215, test_f1: 0.0791
 epoch: 23, train_loss: 1.4284, test_loss: 1.4197, test_f1: 0.0794
 epoch: 24, train_loss: 1.4269, test_loss: 1.4183, test_f1: 0.0815
 epoch: 25, train_loss: 1.4248, test_loss: 1.4164, test_f1: 0.0960
 epoch: 26, train_loss: 1.4237, test_loss: 1.4149, test_f1: 0.1057
 epoch: 27, train_loss: 1.4213, test_loss: 1.4130, test_f1: 0.1197
 epoch: 28, train_loss: 1.4192, test_loss: 1.4112, test_f1: 0.1520
 epoch: 29, train_loss: 1.4170, test_loss: 1.4090, test_f1: 0.1649
 epoch: 30, train_loss: 1.4151, test_loss: 1.4067, test_f1: 0.1679
 epoch: 31, train_loss: 1.4124, test_loss: 1.4042, test_f1: 0.1691
 epoch: 32, train_loss: 1.4102, test_loss: 1.4015, test_f1: 0.1756
 epoch: 33, train_loss: 1.4071, test_loss: 1.3987, test_f1: 0.1892
 epoch: 34, train_loss: 1.4050, test_loss: 1.3956, test_f1: 0.1943
 epoch: 35, train_loss: 1.3999, test_loss: 1.3920, test_f1: 0.2020
 epoch: 36, train_loss: 1.3969, test_loss: 1.3884, test_f1: 0.2006
 epoch: 37, train_loss: 1.3918, test_loss: 1.3843, test_f1: 0.2019
 epoch: 38, train_loss: 1.3898, test_loss: 1.3802, test_f1: 0.1987
 epoch: 39, train_loss: 1.3844, test_loss: 1.3758, test_f1: 0.1984
 epoch: 40, train_loss: 1.3809, test_loss: 1.3712, test_f1: 0.2054
 epoch: 41, train_loss: 1.3754, test_loss: 1.3660, test_f1: 0.2036
 epoch: 42, train_loss: 1.3697, test_loss: 1.3608, test_f1: 0.2010
 epoch: 43, train_loss: 1.3635, test_loss: 1.3551, test_f1: 0.2006
 epoch: 44, train_loss: 1.3599, test_loss: 1.3492, test_f1: 0.2240
 epoch: 45, train_loss: 1.3522, test_loss: 1.3434, test_f1: 0.2662
 epoch: 46, train_loss: 1.3472, test_loss: 1.3368, test_f1: 0.2928
 epoch: 47, train_loss: 1.3419, test_loss: 1.3297, test_f1: 0.2996
 epoch: 48, train_loss: 1.3333, test_loss: 1.3228, test_f1: 0.3041
 epoch: 49, train_loss: 1.3308, test_loss: 1.3162, test_f1: 0.3159
 epoch: 50, train_loss: 1.3212, test_loss: 1.3097, test_f1: 0.3114
 epoch: 51, train_loss: 1.3175, test_loss: 1.3060, test_f1: 0.3126
 epoch: 52, train_loss: 1.3114, test_loss: 1.3037, test_f1: 0.3122
 epoch: 53, train_loss: 1.3151, test_loss: 1.3001, test_f1: 0.3051
 epoch: 54, train_loss: 1.3117, test_loss: 1.2970, test_f1: 0.3032
 epoch: 55, train_loss: 1.3104, test_loss: 1.2937, test_f1: 0.3008
 epoch: 56, train_loss: 1.3058, test_loss: 1.2909, test_f1: 0.3006
 epoch: 57, train_loss: 1.3012, test_loss: 1.2882, test_f1: 0.2902
 epoch: 58, train_loss: 1.3016, test_loss: 1.2862, test_f1: 0.2839
 epoch: 59, train_loss: 1.2984, test_loss: 1.2839, test_f1: 0.2847
 epoch: 60, train_loss: 1.2952, test_loss: 1.2820, test_f1: 0.2823
 epoch: 61, train_loss: 1.2933, test_loss: 1.2796, test_f1: 0.2845
 epoch: 62, train_loss: 1.2939, test_loss: 1.2777, test_f1: 0.2811
 epoch: 63, train_loss: 1.2928, test_loss: 1.2752, test_f1: 0.2739
 epoch: 64, train_loss: 1.2869, test_loss: 1.2729, test_f1: 0.2785
 epoch: 65, train_loss: 1.2850, test_loss: 1.2706, test_f1: 0.2764
 epoch: 66, train_loss: 1.2852, test_loss: 1.2689, test_f1: 0.2733
 epoch: 67, train_loss: 1.2802, test_loss: 1.2664, test_f1: 0.2579
 epoch: 68, train_loss: 1.2822, test_loss: 1.2644, test_f1: 0.2583
 epoch: 69, train_loss: 1.2805, test_loss: 1.2628, test_f1: 0.2457
 epoch: 70, train_loss: 1.2784, test_loss: 1.2607, test_f1: 0.2415
 epoch: 71, train_loss: 1.2767, test_loss: 1.2593, test_f1: 0.2410
 epoch: 72, train_loss: 1.2718, test_loss: 1.2578, test_f1: 0.2378
 epoch: 73, train_loss: 1.2728, test_loss: 1.2564, test_f1: 0.2434
 epoch: 74, train_loss: 1.2688, test_loss: 1.2543, test_f1: 0.2379
 epoch: 75, train_loss: 1.2704, test_loss: 1.2531, test_f1: 0.2383
 epoch: 76, train_loss: 1.2711, test_loss: 1.2521, test_f1: 0.2387
 epoch: 77, train_loss: 1.2665, test_loss: 1.2498, test_f1: 0.2441
 epoch: 78, train_loss: 1.2652, test_loss: 1.2478, test_f1: 0.2387
 epoch: 79, train_loss: 1.2642, test_loss: 1.2464, test_f1: 0.2392
 epoch: 80, train_loss: 1.2624, test_loss: 1.2455, test_f1: 0.2389
 epoch: 81, train_loss: 1.2551, test_loss: 1.2436, test_f1: 0.2375
 epoch: 82, train_loss: 1.2632, test_loss: 1.2425, test_f1: 0.2376
 epoch: 83, train_loss: 1.2616, test_loss: 1.2407, test_f1: 0.2381
 epoch: 84, train_loss: 1.2589, test_loss: 1.2393, test_f1: 0.2383
 epoch: 85, train_loss: 1.2597, test_loss: 1.2378, test_f1: 0.2387
 epoch: 86, train_loss: 1.2529, test_loss: 1.2364, test_f1: 0.2389
 epoch: 87, train_loss: 1.2539, test_loss: 1.2351, test_f1: 0.2389
 epoch: 88, train_loss: 1.2518, test_loss: 1.2342, test_f1: 0.2394
 epoch: 89, train_loss: 1.2470, test_loss: 1.2329, test_f1: 0.2392
 epoch: 90, train_loss: 1.2536, test_loss: 1.2322, test_f1: 0.2442
 epoch: 91, train_loss: 1.2483, test_loss: 1.2311, test_f1: 0.2467
 epoch: 92, train_loss: 1.2455, test_loss: 1.2304, test_f1: 0.2489
 epoch: 93, train_loss: 1.2488, test_loss: 1.2295, test_f1: 0.2491
 epoch: 94, train_loss: 1.2491, test_loss: 1.2286, test_f1: 0.2558
 epoch: 95, train_loss: 1.2467, test_loss: 1.2266, test_f1: 0.2645
 epoch: 96, train_loss: 1.2443, test_loss: 1.2253, test_f1: 0.2625
 epoch: 97, train_loss: 1.2374, test_loss: 1.2239, test_f1: 0.2664
 epoch: 98, train_loss: 1.2432, test_loss: 1.2226, test_f1: 0.2727
 epoch: 99, train_loss: 1.2411, test_loss: 1.2215, test_f1: 0.2765
##################ITERATION #1 ****************************************
 epoch: 0, train_loss: 1.4190, test_loss: 1.4122, test_f1: 0.0789
 epoch: 1, train_loss: 1.4164, test_loss: 1.4104, test_f1: 0.0789
 epoch: 2, train_loss: 1.4146, test_loss: 1.4083, test_f1: 0.0789
 epoch: 3, train_loss: 1.4129, test_loss: 1.4067, test_f1: 0.0789
 epoch: 4, train_loss: 1.4110, test_loss: 1.4049, test_f1: 0.0789
 epoch: 5, train_loss: 1.4087, test_loss: 1.4032, test_f1: 0.0789
 epoch: 6, train_loss: 1.4062, test_loss: 1.4015, test_f1: 0.0789
 epoch: 7, train_loss: 1.4024, test_loss: 1.3989, test_f1: 0.0789
 epoch: 8, train_loss: 1.3990, test_loss: 1.3961, test_f1: 0.0789
 epoch: 9, train_loss: 1.3958, test_loss: 1.3932, test_f1: 0.0789
 epoch: 10, train_loss: 1.3913, test_loss: 1.3893, test_f1: 0.0789
 epoch: 11, train_loss: 1.3883, test_loss: 1.3847, test_f1: 0.0789
 epoch: 12, train_loss: 1.3836, test_loss: 1.3803, test_f1: 0.0789
 epoch: 13, train_loss: 1.3782, test_loss: 1.3756, test_f1: 0.1316
 epoch: 14, train_loss: 1.3746, test_loss: 1.3714, test_f1: 0.1919
 epoch: 15, train_loss: 1.3677, test_loss: 1.3672, test_f1: 0.2541
 epoch: 16, train_loss: 1.3646, test_loss: 1.3630, test_f1: 0.2636
 epoch: 17, train_loss: 1.3601, test_loss: 1.3588, test_f1: 0.2723
 epoch: 18, train_loss: 1.3560, test_loss: 1.3543, test_f1: 0.2740
 epoch: 19, train_loss: 1.3512, test_loss: 1.3502, test_f1: 0.2665
 epoch: 20, train_loss: 1.3428, test_loss: 1.3456, test_f1: 0.2692
 epoch: 21, train_loss: 1.3377, test_loss: 1.3414, test_f1: 0.2715
 epoch: 22, train_loss: 1.3339, test_loss: 1.3372, test_f1: 0.2732
 epoch: 23, train_loss: 1.3309, test_loss: 1.3328, test_f1: 0.2718
 epoch: 24, train_loss: 1.3279, test_loss: 1.3282, test_f1: 0.2751
 epoch: 25, train_loss: 1.3219, test_loss: 1.3237, test_f1: 0.2775
 epoch: 26, train_loss: 1.3165, test_loss: 1.3191, test_f1: 0.2702
 epoch: 27, train_loss: 1.3086, test_loss: 1.3142, test_f1: 0.2668
 epoch: 28, train_loss: 1.3059, test_loss: 1.3100, test_f1: 0.2661
 epoch: 29, train_loss: 1.3041, test_loss: 1.3062, test_f1: 0.2648
 epoch: 30, train_loss: 1.2991, test_loss: 1.3025, test_f1: 0.2563
 epoch: 31, train_loss: 1.2946, test_loss: 1.2989, test_f1: 0.2526
 epoch: 32, train_loss: 1.2925, test_loss: 1.2959, test_f1: 0.2494
 epoch: 33, train_loss: 1.2893, test_loss: 1.2927, test_f1: 0.2469
 epoch: 34, train_loss: 1.2856, test_loss: 1.2902, test_f1: 0.2560
 epoch: 35, train_loss: 1.2816, test_loss: 1.2873, test_f1: 0.2506
 epoch: 36, train_loss: 1.2785, test_loss: 1.2843, test_f1: 0.2484
 epoch: 37, train_loss: 1.2758, test_loss: 1.2814, test_f1: 0.2448
 epoch: 38, train_loss: 1.2747, test_loss: 1.2783, test_f1: 0.2419
 epoch: 39, train_loss: 1.2692, test_loss: 1.2747, test_f1: 0.2503
 epoch: 40, train_loss: 1.2688, test_loss: 1.2718, test_f1: 0.2453
 epoch: 41, train_loss: 1.2685, test_loss: 1.2694, test_f1: 0.2413
 epoch: 42, train_loss: 1.2646, test_loss: 1.2668, test_f1: 0.2475
 epoch: 43, train_loss: 1.2627, test_loss: 1.2638, test_f1: 0.2495
 epoch: 44, train_loss: 1.2605, test_loss: 1.2611, test_f1: 0.2495
 epoch: 45, train_loss: 1.2539, test_loss: 1.2582, test_f1: 0.2455
 epoch: 46, train_loss: 1.2575, test_loss: 1.2550, test_f1: 0.2656
 epoch: 47, train_loss: 1.2541, test_loss: 1.2520, test_f1: 0.2595
 epoch: 48, train_loss: 1.2495, test_loss: 1.2504, test_f1: 0.2647
 epoch: 49, train_loss: 1.2506, test_loss: 1.2472, test_f1: 0.2577
 epoch: 50, train_loss: 1.2497, test_loss: 1.2438, test_f1: 0.2639
 epoch: 51, train_loss: 1.2476, test_loss: 1.2438, test_f1: 0.2647
 epoch: 52, train_loss: 1.2472, test_loss: 1.2435, test_f1: 0.2651
 epoch: 53, train_loss: 1.2419, test_loss: 1.2426, test_f1: 0.2651
 epoch: 54, train_loss: 1.2421, test_loss: 1.2414, test_f1: 0.2638
 epoch: 55, train_loss: 1.2417, test_loss: 1.2400, test_f1: 0.2646
 epoch: 56, train_loss: 1.2407, test_loss: 1.2401, test_f1: 0.2655
 epoch: 57, train_loss: 1.2399, test_loss: 1.2392, test_f1: 0.2660
 epoch: 58, train_loss: 1.2429, test_loss: 1.2375, test_f1: 0.2660
 epoch: 59, train_loss: 1.2389, test_loss: 1.2376, test_f1: 0.2656
 epoch: 60, train_loss: 1.2342, test_loss: 1.2355, test_f1: 0.2653
 epoch: 61, train_loss: 1.2360, test_loss: 1.2346, test_f1: 0.2639
 epoch: 62, train_loss: 1.2375, test_loss: 1.2347, test_f1: 0.2647
 epoch: 63, train_loss: 1.2356, test_loss: 1.2317, test_f1: 0.2668
 epoch: 64, train_loss: 1.2355, test_loss: 1.2317, test_f1: 0.2667
 epoch: 65, train_loss: 1.2329, test_loss: 1.2299, test_f1: 0.2668
 epoch: 66, train_loss: 1.2336, test_loss: 1.2294, test_f1: 0.2677
 epoch: 67, train_loss: 1.2339, test_loss: 1.2283, test_f1: 0.2670
 epoch: 68, train_loss: 1.2391, test_loss: 1.2273, test_f1: 0.2668
 epoch: 69, train_loss: 1.2271, test_loss: 1.2261, test_f1: 0.2671
 epoch: 70, train_loss: 1.2338, test_loss: 1.2254, test_f1: 0.2673
 epoch: 71, train_loss: 1.2319, test_loss: 1.2245, test_f1: 0.2666
 epoch: 72, train_loss: 1.2326, test_loss: 1.2238, test_f1: 0.2677
 epoch: 73, train_loss: 1.2309, test_loss: 1.2233, test_f1: 0.2673
 epoch: 74, train_loss: 1.2319, test_loss: 1.2228, test_f1: 0.2698
 epoch: 75, train_loss: 1.2287, test_loss: 1.2211, test_f1: 0.2668
 epoch: 76, train_loss: 1.2291, test_loss: 1.2198, test_f1: 0.2668
 epoch: 77, train_loss: 1.2226, test_loss: 1.2194, test_f1: 0.2687
 epoch: 78, train_loss: 1.2230, test_loss: 1.2196, test_f1: 0.2668
 epoch: 79, train_loss: 1.2284, test_loss: 1.2192, test_f1: 0.2713
 epoch: 80, train_loss: 1.2236, test_loss: 1.2185, test_f1: 0.2703
 epoch: 81, train_loss: 1.2218, test_loss: 1.2175, test_f1: 0.2756
 epoch: 82, train_loss: 1.2230, test_loss: 1.2169, test_f1: 0.2761
 epoch: 83, train_loss: 1.2228, test_loss: 1.2156, test_f1: 0.2752
 epoch: 84, train_loss: 1.2218, test_loss: 1.2159, test_f1: 0.2765
 epoch: 85, train_loss: 1.2221, test_loss: 1.2159, test_f1: 0.2753
 epoch: 86, train_loss: 1.2200, test_loss: 1.2140, test_f1: 0.2751
 epoch: 87, train_loss: 1.2225, test_loss: 1.2130, test_f1: 0.2765
 epoch: 88, train_loss: 1.2211, test_loss: 1.2128, test_f1: 0.2762
 epoch: 89, train_loss: 1.2210, test_loss: 1.2133, test_f1: 0.2764
 epoch: 90, train_loss: 1.2193, test_loss: 1.2112, test_f1: 0.2775
 epoch: 91, train_loss: 1.2193, test_loss: 1.2117, test_f1: 0.2781
 epoch: 92, train_loss: 1.2174, test_loss: 1.2120, test_f1: 0.2786
 epoch: 93, train_loss: 1.2185, test_loss: 1.2118, test_f1: 0.2803
 epoch: 94, train_loss: 1.2210, test_loss: 1.2101, test_f1: 0.2799
 epoch: 95, train_loss: 1.2174, test_loss: 1.2082, test_f1: 0.2810
 epoch: 96, train_loss: 1.2148, test_loss: 1.2088, test_f1: 0.2824
 epoch: 97, train_loss: 1.2129, test_loss: 1.2082, test_f1: 0.2763
 epoch: 98, train_loss: 1.2182, test_loss: 1.2088, test_f1: 0.2840
 epoch: 99, train_loss: 1.2089, test_loss: 1.2074, test_f1: 0.2840
##################ITERATION #2 ****************************************
 epoch: 0, train_loss: 1.3780, test_loss: 1.3783, test_f1: 0.0789
 epoch: 1, train_loss: 1.3743, test_loss: 1.3760, test_f1: 0.0789
 epoch: 2, train_loss: 1.3706, test_loss: 1.3728, test_f1: 0.1280
 epoch: 3, train_loss: 1.3683, test_loss: 1.3727, test_f1: 0.1542
 epoch: 4, train_loss: 1.3656, test_loss: 1.3695, test_f1: 0.2710
 epoch: 5, train_loss: 1.3632, test_loss: 1.3654, test_f1: 0.2652
 epoch: 6, train_loss: 1.3598, test_loss: 1.3602, test_f1: 0.2439
 epoch: 7, train_loss: 1.3561, test_loss: 1.3564, test_f1: 0.2295
 epoch: 8, train_loss: 1.3528, test_loss: 1.3534, test_f1: 0.2264
 epoch: 9, train_loss: 1.3495, test_loss: 1.3505, test_f1: 0.2262
 epoch: 10, train_loss: 1.3474, test_loss: 1.3477, test_f1: 0.2262
 epoch: 11, train_loss: 1.3447, test_loss: 1.3440, test_f1: 0.2262
 epoch: 12, train_loss: 1.3411, test_loss: 1.3410, test_f1: 0.2262
 epoch: 13, train_loss: 1.3371, test_loss: 1.3377, test_f1: 0.2260
 epoch: 14, train_loss: 1.3327, test_loss: 1.3347, test_f1: 0.2260
 epoch: 15, train_loss: 1.3313, test_loss: 1.3310, test_f1: 0.2260
 epoch: 16, train_loss: 1.3251, test_loss: 1.3273, test_f1: 0.2260
 epoch: 17, train_loss: 1.3208, test_loss: 1.3241, test_f1: 0.2260
 epoch: 18, train_loss: 1.3185, test_loss: 1.3200, test_f1: 0.2260
 epoch: 19, train_loss: 1.3133, test_loss: 1.3150, test_f1: 0.2260
 epoch: 20, train_loss: 1.3095, test_loss: 1.3104, test_f1: 0.2260
 epoch: 21, train_loss: 1.3045, test_loss: 1.3061, test_f1: 0.2260
 epoch: 22, train_loss: 1.2986, test_loss: 1.3018, test_f1: 0.2260
 epoch: 23, train_loss: 1.2926, test_loss: 1.2970, test_f1: 0.2260
 epoch: 24, train_loss: 1.2887, test_loss: 1.2902, test_f1: 0.2260
 epoch: 25, train_loss: 1.2827, test_loss: 1.2871, test_f1: 0.2260
 epoch: 26, train_loss: 1.2778, test_loss: 1.2819, test_f1: 0.2260
 epoch: 27, train_loss: 1.2734, test_loss: 1.2760, test_f1: 0.2260
 epoch: 28, train_loss: 1.2709, test_loss: 1.2725, test_f1: 0.2260
 epoch: 29, train_loss: 1.2655, test_loss: 1.2682, test_f1: 0.2260
 epoch: 30, train_loss: 1.2616, test_loss: 1.2641, test_f1: 0.2260
 epoch: 31, train_loss: 1.2596, test_loss: 1.2591, test_f1: 0.2260
 epoch: 32, train_loss: 1.2585, test_loss: 1.2560, test_f1: 0.2260
 epoch: 33, train_loss: 1.2528, test_loss: 1.2533, test_f1: 0.2260
 epoch: 34, train_loss: 1.2528, test_loss: 1.2499, test_f1: 0.2260
 epoch: 35, train_loss: 1.2487, test_loss: 1.2477, test_f1: 0.2260
 epoch: 36, train_loss: 1.2452, test_loss: 1.2448, test_f1: 0.2260
 epoch: 37, train_loss: 1.2417, test_loss: 1.2427, test_f1: 0.2260
 epoch: 38, train_loss: 1.2402, test_loss: 1.2392, test_f1: 0.2262
 epoch: 39, train_loss: 1.2391, test_loss: 1.2359, test_f1: 0.2264
 epoch: 40, train_loss: 1.2343, test_loss: 1.2335, test_f1: 0.2266
 epoch: 41, train_loss: 1.2322, test_loss: 1.2315, test_f1: 0.2278
 epoch: 42, train_loss: 1.2284, test_loss: 1.2300, test_f1: 0.2285
 epoch: 43, train_loss: 1.2266, test_loss: 1.2282, test_f1: 0.2285
 epoch: 44, train_loss: 1.2221, test_loss: 1.2270, test_f1: 0.2307
 epoch: 45, train_loss: 1.2193, test_loss: 1.2230, test_f1: 0.2317
 epoch: 46, train_loss: 1.2203, test_loss: 1.2222, test_f1: 0.2325
 epoch: 47, train_loss: 1.2193, test_loss: 1.2183, test_f1: 0.2317
 epoch: 48, train_loss: 1.2157, test_loss: 1.2160, test_f1: 0.2329
 epoch: 49, train_loss: 1.2130, test_loss: 1.2161, test_f1: 0.2350
 epoch: 50, train_loss: 1.2139, test_loss: 1.2134, test_f1: 0.2317
 epoch: 51, train_loss: 1.2103, test_loss: 1.2104, test_f1: 0.2337
 epoch: 52, train_loss: 1.2120, test_loss: 1.2103, test_f1: 0.2352
 epoch: 53, train_loss: 1.2069, test_loss: 1.2080, test_f1: 0.2343
 epoch: 54, train_loss: 1.2071, test_loss: 1.2073, test_f1: 0.2343
 epoch: 55, train_loss: 1.2097, test_loss: 1.2070, test_f1: 0.2335
 epoch: 56, train_loss: 1.2053, test_loss: 1.2052, test_f1: 0.2350
 epoch: 57, train_loss: 1.2030, test_loss: 1.2040, test_f1: 0.2356
 epoch: 58, train_loss: 1.2018, test_loss: 1.2035, test_f1: 0.2356
 epoch: 59, train_loss: 1.2068, test_loss: 1.2021, test_f1: 0.2348
 epoch: 60, train_loss: 1.2037, test_loss: 1.2015, test_f1: 0.2352
 epoch: 61, train_loss: 1.1999, test_loss: 1.2009, test_f1: 0.2364
 epoch: 62, train_loss: 1.2015, test_loss: 1.2001, test_f1: 0.2379
 epoch: 63, train_loss: 1.2018, test_loss: 1.1990, test_f1: 0.2364
 epoch: 64, train_loss: 1.1982, test_loss: 1.1984, test_f1: 0.2368
 epoch: 65, train_loss: 1.1978, test_loss: 1.1979, test_f1: 0.2358
 epoch: 66, train_loss: 1.1966, test_loss: 1.1960, test_f1: 0.2368
 epoch: 67, train_loss: 1.1970, test_loss: 1.1956, test_f1: 0.2379
 epoch: 68, train_loss: 1.1923, test_loss: 1.1942, test_f1: 0.2379
 epoch: 69, train_loss: 1.1914, test_loss: 1.1956, test_f1: 0.2362
 epoch: 70, train_loss: 1.2020, test_loss: 1.1948, test_f1: 0.2407
 epoch: 71, train_loss: 1.1916, test_loss: 1.1941, test_f1: 0.2372
 epoch: 72, train_loss: 1.1951, test_loss: 1.1925, test_f1: 0.2362
 epoch: 73, train_loss: 1.1935, test_loss: 1.1912, test_f1: 0.2372
 epoch: 74, train_loss: 1.1868, test_loss: 1.1914, test_f1: 0.2440
 epoch: 75, train_loss: 1.1875, test_loss: 1.1905, test_f1: 0.2484
 epoch: 76, train_loss: 1.1898, test_loss: 1.1897, test_f1: 0.2523
 epoch: 77, train_loss: 1.1886, test_loss: 1.1897, test_f1: 0.2484
 epoch: 78, train_loss: 1.1891, test_loss: 1.1862, test_f1: 0.2601
 epoch: 79, train_loss: 1.1841, test_loss: 1.1879, test_f1: 0.2586
 epoch: 80, train_loss: 1.1883, test_loss: 1.1870, test_f1: 0.2596
 epoch: 81, train_loss: 1.1850, test_loss: 1.1843, test_f1: 0.2588
 epoch: 82, train_loss: 1.1851, test_loss: 1.1841, test_f1: 0.2567
 epoch: 83, train_loss: 1.1816, test_loss: 1.1840, test_f1: 0.2544
 epoch: 84, train_loss: 1.1830, test_loss: 1.1813, test_f1: 0.2508
 epoch: 85, train_loss: 1.1824, test_loss: 1.1831, test_f1: 0.2547
 epoch: 86, train_loss: 1.1829, test_loss: 1.1801, test_f1: 0.2614
 epoch: 87, train_loss: 1.1836, test_loss: 1.1809, test_f1: 0.2563
 epoch: 88, train_loss: 1.1794, test_loss: 1.1802, test_f1: 0.2606
 epoch: 89, train_loss: 1.1783, test_loss: 1.1808, test_f1: 0.2561
 epoch: 90, train_loss: 1.1745, test_loss: 1.1800, test_f1: 0.2649
 epoch: 91, train_loss: 1.1793, test_loss: 1.1784, test_f1: 0.2679
 epoch: 92, train_loss: 1.1735, test_loss: 1.1798, test_f1: 0.2818
 epoch: 93, train_loss: 1.1762, test_loss: 1.1776, test_f1: 0.2626
 epoch: 94, train_loss: 1.1718, test_loss: 1.1769, test_f1: 0.2906
 epoch: 95, train_loss: 1.1760, test_loss: 1.1781, test_f1: 0.2937
 epoch: 96, train_loss: 1.1734, test_loss: 1.1763, test_f1: 0.3004
 epoch: 97, train_loss: 1.1736, test_loss: 1.1765, test_f1: 0.2874
 epoch: 98, train_loss: 1.1754, test_loss: 1.1750, test_f1: 0.3000
 epoch: 99, train_loss: 1.1734, test_loss: 1.1771, test_f1: 0.3084
##################ITERATION #3 ****************************************
 epoch: 0, train_loss: 1.3695, test_loss: 1.3707, test_f1: 0.2260
 epoch: 1, train_loss: 1.3654, test_loss: 1.3679, test_f1: 0.2260
 epoch: 2, train_loss: 1.3619, test_loss: 1.3658, test_f1: 0.2260
 epoch: 3, train_loss: 1.3593, test_loss: 1.3610, test_f1: 0.2260
 epoch: 4, train_loss: 1.3568, test_loss: 1.3592, test_f1: 0.2260
 epoch: 5, train_loss: 1.3539, test_loss: 1.3566, test_f1: 0.2260
 epoch: 6, train_loss: 1.3491, test_loss: 1.3520, test_f1: 0.2260
 epoch: 7, train_loss: 1.3458, test_loss: 1.3473, test_f1: 0.2260
 epoch: 8, train_loss: 1.3423, test_loss: 1.3433, test_f1: 0.2260
 epoch: 9, train_loss: 1.3385, test_loss: 1.3392, test_f1: 0.2260
 epoch: 10, train_loss: 1.3352, test_loss: 1.3348, test_f1: 0.2260
 epoch: 11, train_loss: 1.3302, test_loss: 1.3307, test_f1: 0.2260
 epoch: 12, train_loss: 1.3273, test_loss: 1.3259, test_f1: 0.2260
 epoch: 13, train_loss: 1.3212, test_loss: 1.3216, test_f1: 0.2260
 epoch: 14, train_loss: 1.3166, test_loss: 1.3175, test_f1: 0.2260
 epoch: 15, train_loss: 1.3126, test_loss: 1.3121, test_f1: 0.2260
 epoch: 16, train_loss: 1.3085, test_loss: 1.3077, test_f1: 0.2260
 epoch: 17, train_loss: 1.3035, test_loss: 1.3036, test_f1: 0.2260
 epoch: 18, train_loss: 1.3005, test_loss: 1.2985, test_f1: 0.2260
 epoch: 19, train_loss: 1.2945, test_loss: 1.2945, test_f1: 0.2260
 epoch: 20, train_loss: 1.2906, test_loss: 1.2901, test_f1: 0.2260
 epoch: 21, train_loss: 1.2864, test_loss: 1.2856, test_f1: 0.2260
 epoch: 22, train_loss: 1.2821, test_loss: 1.2812, test_f1: 0.2260
 epoch: 23, train_loss: 1.2809, test_loss: 1.2764, test_f1: 0.2260
 epoch: 24, train_loss: 1.2766, test_loss: 1.2728, test_f1: 0.2260
 epoch: 25, train_loss: 1.2744, test_loss: 1.2683, test_f1: 0.2260
 epoch: 26, train_loss: 1.2700, test_loss: 1.2637, test_f1: 0.2260
 epoch: 27, train_loss: 1.2679, test_loss: 1.2602, test_f1: 0.2260
 epoch: 28, train_loss: 1.2627, test_loss: 1.2567, test_f1: 0.2260
 epoch: 29, train_loss: 1.2629, test_loss: 1.2524, test_f1: 0.2260
 epoch: 30, train_loss: 1.2562, test_loss: 1.2495, test_f1: 0.2260
 epoch: 31, train_loss: 1.2548, test_loss: 1.2461, test_f1: 0.2260
 epoch: 32, train_loss: 1.2536, test_loss: 1.2439, test_f1: 0.2260
 epoch: 33, train_loss: 1.2540, test_loss: 1.2409, test_f1: 0.2260
 epoch: 34, train_loss: 1.2483, test_loss: 1.2382, test_f1: 0.2260
 epoch: 35, train_loss: 1.2452, test_loss: 1.2354, test_f1: 0.2260
 epoch: 36, train_loss: 1.2471, test_loss: 1.2328, test_f1: 0.2260
 epoch: 37, train_loss: 1.2432, test_loss: 1.2301, test_f1: 0.2260
 epoch: 38, train_loss: 1.2457, test_loss: 1.2291, test_f1: 0.2260
 epoch: 39, train_loss: 1.2374, test_loss: 1.2258, test_f1: 0.2260
 epoch: 40, train_loss: 1.2387, test_loss: 1.2236, test_f1: 0.2260
 epoch: 41, train_loss: 1.2366, test_loss: 1.2211, test_f1: 0.2260
 epoch: 42, train_loss: 1.2331, test_loss: 1.2199, test_f1: 0.2260
 epoch: 43, train_loss: 1.2350, test_loss: 1.2181, test_f1: 0.2260
 epoch: 44, train_loss: 1.2348, test_loss: 1.2156, test_f1: 0.2260
 epoch: 45, train_loss: 1.2334, test_loss: 1.2139, test_f1: 0.2260
 epoch: 46, train_loss: 1.2281, test_loss: 1.2121, test_f1: 0.2260
 epoch: 47, train_loss: 1.2315, test_loss: 1.2110, test_f1: 0.2260
 epoch: 48, train_loss: 1.2283, test_loss: 1.2093, test_f1: 0.2260
 epoch: 49, train_loss: 1.2259, test_loss: 1.2061, test_f1: 0.2260
 epoch: 50, train_loss: 1.2258, test_loss: 1.2041, test_f1: 0.2260
 epoch: 51, train_loss: 1.2255, test_loss: 1.2041, test_f1: 0.2260
 epoch: 52, train_loss: 1.2231, test_loss: 1.2035, test_f1: 0.2260
 epoch: 53, train_loss: 1.2208, test_loss: 1.2014, test_f1: 0.2260
 epoch: 54, train_loss: 1.2174, test_loss: 1.2009, test_f1: 0.2260
 epoch: 55, train_loss: 1.2197, test_loss: 1.2014, test_f1: 0.2260
 epoch: 56, train_loss: 1.2185, test_loss: 1.1995, test_f1: 0.2260
 epoch: 57, train_loss: 1.2172, test_loss: 1.1987, test_f1: 0.2260
 epoch: 58, train_loss: 1.2181, test_loss: 1.1981, test_f1: 0.2260
 epoch: 59, train_loss: 1.2143, test_loss: 1.1973, test_f1: 0.2260
 epoch: 60, train_loss: 1.2190, test_loss: 1.1963, test_f1: 0.2260
 epoch: 61, train_loss: 1.2176, test_loss: 1.1955, test_f1: 0.2260
 epoch: 62, train_loss: 1.2144, test_loss: 1.1952, test_f1: 0.2260
 epoch: 63, train_loss: 1.2167, test_loss: 1.1938, test_f1: 0.2260
 epoch: 64, train_loss: 1.2153, test_loss: 1.1927, test_f1: 0.2260
 epoch: 65, train_loss: 1.2119, test_loss: 1.1922, test_f1: 0.2260
 epoch: 66, train_loss: 1.2137, test_loss: 1.1922, test_f1: 0.2260
 epoch: 67, train_loss: 1.2130, test_loss: 1.1907, test_f1: 0.2260
 epoch: 68, train_loss: 1.2138, test_loss: 1.1894, test_f1: 0.2260
 epoch: 69, train_loss: 1.2113, test_loss: 1.1890, test_f1: 0.2260
 epoch: 70, train_loss: 1.2101, test_loss: 1.1881, test_f1: 0.2260
 epoch: 71, train_loss: 1.2109, test_loss: 1.1882, test_f1: 0.2260
 epoch: 72, train_loss: 1.2098, test_loss: 1.1872, test_f1: 0.2260
 epoch: 73, train_loss: 1.2112, test_loss: 1.1859, test_f1: 0.2260
 epoch: 74, train_loss: 1.2080, test_loss: 1.1864, test_f1: 0.2260
 epoch: 75, train_loss: 1.2066, test_loss: 1.1859, test_f1: 0.2260
 epoch: 76, train_loss: 1.2064, test_loss: 1.1850, test_f1: 0.2286
 epoch: 77, train_loss: 1.2070, test_loss: 1.1832, test_f1: 0.2286
 epoch: 78, train_loss: 1.2055, test_loss: 1.1820, test_f1: 0.2286
 epoch: 79, train_loss: 1.2053, test_loss: 1.1817, test_f1: 0.2311
 epoch: 80, train_loss: 1.2048, test_loss: 1.1816, test_f1: 0.2359
 epoch: 81, train_loss: 1.2029, test_loss: 1.1808, test_f1: 0.2429
 epoch: 82, train_loss: 1.1979, test_loss: 1.1796, test_f1: 0.2474
 epoch: 83, train_loss: 1.2000, test_loss: 1.1791, test_f1: 0.2539
 epoch: 84, train_loss: 1.2002, test_loss: 1.1778, test_f1: 0.2581
 epoch: 85, train_loss: 1.2020, test_loss: 1.1774, test_f1: 0.2661
 epoch: 86, train_loss: 1.1999, test_loss: 1.1773, test_f1: 0.2772
 epoch: 87, train_loss: 1.2015, test_loss: 1.1768, test_f1: 0.2772
 epoch: 88, train_loss: 1.1988, test_loss: 1.1764, test_f1: 0.2842
 epoch: 89, train_loss: 1.1955, test_loss: 1.1750, test_f1: 0.2925
 epoch: 90, train_loss: 1.2027, test_loss: 1.1739, test_f1: 0.2988
 epoch: 91, train_loss: 1.1972, test_loss: 1.1736, test_f1: 0.3018
 epoch: 92, train_loss: 1.1990, test_loss: 1.1737, test_f1: 0.3048
 epoch: 93, train_loss: 1.1978, test_loss: 1.1731, test_f1: 0.3048
 epoch: 94, train_loss: 1.1975, test_loss: 1.1727, test_f1: 0.3146
 epoch: 95, train_loss: 1.1951, test_loss: 1.1712, test_f1: 0.3160
 epoch: 96, train_loss: 1.1935, test_loss: 1.1712, test_f1: 0.3186
 epoch: 97, train_loss: 1.1936, test_loss: 1.1705, test_f1: 0.3186
 epoch: 98, train_loss: 1.1934, test_loss: 1.1697, test_f1: 0.3186
 epoch: 99, train_loss: 1.1903, test_loss: 1.1689, test_f1: 0.3199
##################ITERATION #4 ****************************************
 epoch: 0, train_loss: 1.3476, test_loss: 1.3612, test_f1: 0.2260
 epoch: 1, train_loss: 1.3418, test_loss: 1.3597, test_f1: 0.2260
 epoch: 2, train_loss: 1.3398, test_loss: 1.3563, test_f1: 0.2260
 epoch: 3, train_loss: 1.3348, test_loss: 1.3444, test_f1: 0.2260
 epoch: 4, train_loss: 1.3299, test_loss: 1.3343, test_f1: 0.2260
 epoch: 5, train_loss: 1.3271, test_loss: 1.3278, test_f1: 0.2260
 epoch: 6, train_loss: 1.3245, test_loss: 1.3243, test_f1: 0.2260
 epoch: 7, train_loss: 1.3200, test_loss: 1.3190, test_f1: 0.2260
 epoch: 8, train_loss: 1.3162, test_loss: 1.3142, test_f1: 0.2260
 epoch: 9, train_loss: 1.3114, test_loss: 1.3094, test_f1: 0.2260
 epoch: 10, train_loss: 1.3068, test_loss: 1.3048, test_f1: 0.2260
 epoch: 11, train_loss: 1.3037, test_loss: 1.3007, test_f1: 0.2260
 epoch: 12, train_loss: 1.2986, test_loss: 1.2969, test_f1: 0.2260
 epoch: 13, train_loss: 1.2959, test_loss: 1.2935, test_f1: 0.2260
 epoch: 14, train_loss: 1.2913, test_loss: 1.2888, test_f1: 0.2260
 epoch: 15, train_loss: 1.2871, test_loss: 1.2854, test_f1: 0.2260
 epoch: 16, train_loss: 1.2847, test_loss: 1.2808, test_f1: 0.2260
 epoch: 17, train_loss: 1.2806, test_loss: 1.2766, test_f1: 0.2260
 epoch: 18, train_loss: 1.2779, test_loss: 1.2723, test_f1: 0.2260
 epoch: 19, train_loss: 1.2753, test_loss: 1.2687, test_f1: 0.2260
 epoch: 20, train_loss: 1.2707, test_loss: 1.2647, test_f1: 0.2260
 epoch: 21, train_loss: 1.2671, test_loss: 1.2601, test_f1: 0.2260
 epoch: 22, train_loss: 1.2630, test_loss: 1.2557, test_f1: 0.2260
 epoch: 23, train_loss: 1.2555, test_loss: 1.2528, test_f1: 0.2260
 epoch: 24, train_loss: 1.2522, test_loss: 1.2471, test_f1: 0.2260
 epoch: 25, train_loss: 1.2520, test_loss: 1.2421, test_f1: 0.2260
 epoch: 26, train_loss: 1.2444, test_loss: 1.2370, test_f1: 0.2260
 epoch: 27, train_loss: 1.2427, test_loss: 1.2328, test_f1: 0.2260
 epoch: 28, train_loss: 1.2396, test_loss: 1.2282, test_f1: 0.2260
 epoch: 29, train_loss: 1.2359, test_loss: 1.2253, test_f1: 0.2260
 epoch: 30, train_loss: 1.2305, test_loss: 1.2208, test_f1: 0.2260
 epoch: 31, train_loss: 1.2311, test_loss: 1.2171, test_f1: 0.2260
 epoch: 32, train_loss: 1.2265, test_loss: 1.2151, test_f1: 0.2260
 epoch: 33, train_loss: 1.2223, test_loss: 1.2112, test_f1: 0.2260
 epoch: 34, train_loss: 1.2195, test_loss: 1.2076, test_f1: 0.2260
 epoch: 35, train_loss: 1.2222, test_loss: 1.2065, test_f1: 0.2260
 epoch: 36, train_loss: 1.2169, test_loss: 1.2040, test_f1: 0.2260
 epoch: 37, train_loss: 1.2152, test_loss: 1.2025, test_f1: 0.2260
 epoch: 38, train_loss: 1.2154, test_loss: 1.1991, test_f1: 0.2260
 epoch: 39, train_loss: 1.2128, test_loss: 1.1977, test_f1: 0.2260
 epoch: 40, train_loss: 1.2120, test_loss: 1.1958, test_f1: 0.2260
 epoch: 41, train_loss: 1.2094, test_loss: 1.1946, test_f1: 0.2260
 epoch: 42, train_loss: 1.2095, test_loss: 1.1926, test_f1: 0.2260
 epoch: 43, train_loss: 1.2081, test_loss: 1.1918, test_f1: 0.2260
 epoch: 44, train_loss: 1.2054, test_loss: 1.1900, test_f1: 0.2260
 epoch: 45, train_loss: 1.2024, test_loss: 1.1892, test_f1: 0.2260
 epoch: 46, train_loss: 1.2062, test_loss: 1.1873, test_f1: 0.2260
 epoch: 47, train_loss: 1.2045, test_loss: 1.1862, test_f1: 0.2260
 epoch: 48, train_loss: 1.2014, test_loss: 1.1836, test_f1: 0.2260
 epoch: 49, train_loss: 1.1971, test_loss: 1.1826, test_f1: 0.2260
 epoch: 50, train_loss: 1.1995, test_loss: 1.1821, test_f1: 0.2260
 epoch: 51, train_loss: 1.1977, test_loss: 1.1813, test_f1: 0.2260
 epoch: 52, train_loss: 1.1949, test_loss: 1.1806, test_f1: 0.2260
 epoch: 53, train_loss: 1.1952, test_loss: 1.1797, test_f1: 0.2260
 epoch: 54, train_loss: 1.1981, test_loss: 1.1798, test_f1: 0.2260
 epoch: 55, train_loss: 1.1940, test_loss: 1.1792, test_f1: 0.2260
 epoch: 56, train_loss: 1.1937, test_loss: 1.1782, test_f1: 0.2260
 epoch: 57, train_loss: 1.1931, test_loss: 1.1776, test_f1: 0.2260
 epoch: 58, train_loss: 1.1927, test_loss: 1.1769, test_f1: 0.2260
 epoch: 59, train_loss: 1.1901, test_loss: 1.1762, test_f1: 0.2260
 epoch: 60, train_loss: 1.1945, test_loss: 1.1761, test_f1: 0.2260
 epoch: 61, train_loss: 1.1895, test_loss: 1.1755, test_f1: 0.2260
 epoch: 62, train_loss: 1.1931, test_loss: 1.1750, test_f1: 0.2260
 epoch: 63, train_loss: 1.1943, test_loss: 1.1742, test_f1: 0.2260
 epoch: 64, train_loss: 1.1912, test_loss: 1.1736, test_f1: 0.2260
 epoch: 65, train_loss: 1.1888, test_loss: 1.1731, test_f1: 0.2260
 epoch: 66, train_loss: 1.1860, test_loss: 1.1729, test_f1: 0.2260
 epoch: 67, train_loss: 1.1895, test_loss: 1.1717, test_f1: 0.2260
 epoch: 68, train_loss: 1.1857, test_loss: 1.1713, test_f1: 0.2260
 epoch: 69, train_loss: 1.1868, test_loss: 1.1710, test_f1: 0.2260
 epoch: 70, train_loss: 1.1891, test_loss: 1.1703, test_f1: 0.2260
 epoch: 71, train_loss: 1.1854, test_loss: 1.1702, test_f1: 0.2260
 epoch: 72, train_loss: 1.1863, test_loss: 1.1689, test_f1: 0.2260
 epoch: 73, train_loss: 1.1881, test_loss: 1.1686, test_f1: 0.2260
 epoch: 74, train_loss: 1.1873, test_loss: 1.1683, test_f1: 0.2260
 epoch: 75, train_loss: 1.1862, test_loss: 1.1683, test_f1: 0.2260
 epoch: 76, train_loss: 1.1901, test_loss: 1.1687, test_f1: 0.2260
 epoch: 77, train_loss: 1.1885, test_loss: 1.1673, test_f1: 0.2260
 epoch: 78, train_loss: 1.1855, test_loss: 1.1671, test_f1: 0.2260
 epoch: 79, train_loss: 1.1860, test_loss: 1.1661, test_f1: 0.2260
 epoch: 80, train_loss: 1.1827, test_loss: 1.1657, test_f1: 0.2260
 epoch: 81, train_loss: 1.1879, test_loss: 1.1661, test_f1: 0.2260
 epoch: 82, train_loss: 1.1801, test_loss: 1.1655, test_f1: 0.2260
 epoch: 83, train_loss: 1.1820, test_loss: 1.1641, test_f1: 0.2260
 epoch: 84, train_loss: 1.1799, test_loss: 1.1639, test_f1: 0.2260
 epoch: 85, train_loss: 1.1851, test_loss: 1.1636, test_f1: 0.2260
 epoch: 86, train_loss: 1.1798, test_loss: 1.1632, test_f1: 0.2260
 epoch: 87, train_loss: 1.1778, test_loss: 1.1629, test_f1: 0.2311
 epoch: 88, train_loss: 1.1797, test_loss: 1.1617, test_f1: 0.2452
 epoch: 89, train_loss: 1.1768, test_loss: 1.1614, test_f1: 0.2790
 epoch: 90, train_loss: 1.1790, test_loss: 1.1616, test_f1: 0.3076
 epoch: 91, train_loss: 1.1756, test_loss: 1.1613, test_f1: 0.3212
 epoch: 92, train_loss: 1.1801, test_loss: 1.1612, test_f1: 0.3287
 epoch: 93, train_loss: 1.1779, test_loss: 1.1607, test_f1: 0.3347
 epoch: 94, train_loss: 1.1754, test_loss: 1.1593, test_f1: 0.3392
 epoch: 95, train_loss: 1.1767, test_loss: 1.1590, test_f1: 0.3392
 epoch: 96, train_loss: 1.1764, test_loss: 1.1585, test_f1: 0.3437
 epoch: 97, train_loss: 1.1752, test_loss: 1.1587, test_f1: 0.3458
 epoch: 98, train_loss: 1.1716, test_loss: 1.1580, test_f1: 0.3458
 epoch: 99, train_loss: 1.1732, test_loss: 1.1578, test_f1: 0.3458
##################ITERATION #5 ****************************************
 epoch: 0, train_loss: 1.3147, test_loss: 1.3326, test_f1: 0.2260
 epoch: 1, train_loss: 1.3105, test_loss: 1.3282, test_f1: 0.2260
 epoch: 2, train_loss: 1.3050, test_loss: 1.3235, test_f1: 0.2260
 epoch: 3, train_loss: 1.2996, test_loss: 1.3160, test_f1: 0.2260
 epoch: 4, train_loss: 1.2958, test_loss: 1.3072, test_f1: 0.2260
 epoch: 5, train_loss: 1.2913, test_loss: 1.2992, test_f1: 0.2260
 epoch: 6, train_loss: 1.2886, test_loss: 1.2927, test_f1: 0.2260
 epoch: 7, train_loss: 1.2843, test_loss: 1.2872, test_f1: 0.2260
 epoch: 8, train_loss: 1.2811, test_loss: 1.2829, test_f1: 0.2260
 epoch: 9, train_loss: 1.2780, test_loss: 1.2782, test_f1: 0.2260
 epoch: 10, train_loss: 1.2738, test_loss: 1.2730, test_f1: 0.2260
 epoch: 11, train_loss: 1.2708, test_loss: 1.2682, test_f1: 0.2260
 epoch: 12, train_loss: 1.2681, test_loss: 1.2643, test_f1: 0.2260
 epoch: 13, train_loss: 1.2611, test_loss: 1.2594, test_f1: 0.2260
 epoch: 14, train_loss: 1.2601, test_loss: 1.2537, test_f1: 0.2260
 epoch: 15, train_loss: 1.2547, test_loss: 1.2485, test_f1: 0.2260
 epoch: 16, train_loss: 1.2541, test_loss: 1.2447, test_f1: 0.2260
 epoch: 17, train_loss: 1.2473, test_loss: 1.2397, test_f1: 0.2260
 epoch: 18, train_loss: 1.2497, test_loss: 1.2354, test_f1: 0.2260
 epoch: 19, train_loss: 1.2437, test_loss: 1.2316, test_f1: 0.2260
 epoch: 20, train_loss: 1.2399, test_loss: 1.2282, test_f1: 0.2260
 epoch: 21, train_loss: 1.2335, test_loss: 1.2245, test_f1: 0.2260
 epoch: 22, train_loss: 1.2360, test_loss: 1.2208, test_f1: 0.2260
 epoch: 23, train_loss: 1.2365, test_loss: 1.2183, test_f1: 0.2260
 epoch: 24, train_loss: 1.2323, test_loss: 1.2160, test_f1: 0.2260
 epoch: 25, train_loss: 1.2271, test_loss: 1.2123, test_f1: 0.2260
 epoch: 26, train_loss: 1.2304, test_loss: 1.2097, test_f1: 0.2260
 epoch: 27, train_loss: 1.2219, test_loss: 1.2078, test_f1: 0.2260
 epoch: 28, train_loss: 1.2195, test_loss: 1.2049, test_f1: 0.2260
 epoch: 29, train_loss: 1.2228, test_loss: 1.2011, test_f1: 0.2260
 epoch: 30, train_loss: 1.2166, test_loss: 1.1990, test_f1: 0.2260
 epoch: 31, train_loss: 1.2125, test_loss: 1.1961, test_f1: 0.2260
 epoch: 32, train_loss: 1.2162, test_loss: 1.1934, test_f1: 0.2260
 epoch: 33, train_loss: 1.2133, test_loss: 1.1911, test_f1: 0.2260
 epoch: 34, train_loss: 1.2105, test_loss: 1.1893, test_f1: 0.2260
 epoch: 35, train_loss: 1.2085, test_loss: 1.1873, test_f1: 0.2260
 epoch: 36, train_loss: 1.2073, test_loss: 1.1851, test_f1: 0.2260
 epoch: 37, train_loss: 1.2010, test_loss: 1.1829, test_f1: 0.2260
 epoch: 38, train_loss: 1.1976, test_loss: 1.1801, test_f1: 0.2260
 epoch: 39, train_loss: 1.2015, test_loss: 1.1778, test_f1: 0.2260
 epoch: 40, train_loss: 1.1981, test_loss: 1.1761, test_f1: 0.2260
 epoch: 41, train_loss: 1.1986, test_loss: 1.1743, test_f1: 0.2359
 epoch: 42, train_loss: 1.1969, test_loss: 1.1719, test_f1: 0.2539
 epoch: 43, train_loss: 1.1905, test_loss: 1.1703, test_f1: 0.2808
 epoch: 44, train_loss: 1.1859, test_loss: 1.1687, test_f1: 0.2957
 epoch: 45, train_loss: 1.1899, test_loss: 1.1669, test_f1: 0.3146
 epoch: 46, train_loss: 1.1841, test_loss: 1.1640, test_f1: 0.3347
 epoch: 47, train_loss: 1.1855, test_loss: 1.1635, test_f1: 0.3392
 epoch: 48, train_loss: 1.1837, test_loss: 1.1612, test_f1: 0.3404
 epoch: 49, train_loss: 1.1804, test_loss: 1.1592, test_f1: 0.3404
 epoch: 50, train_loss: 1.1764, test_loss: 1.1579, test_f1: 0.3458
 epoch: 51, train_loss: 1.1793, test_loss: 1.1567, test_f1: 0.3490
 epoch: 52, train_loss: 1.1829, test_loss: 1.1558, test_f1: 0.3479
 epoch: 53, train_loss: 1.1756, test_loss: 1.1556, test_f1: 0.3500
 epoch: 54, train_loss: 1.1761, test_loss: 1.1546, test_f1: 0.3500
 epoch: 55, train_loss: 1.1727, test_loss: 1.1542, test_f1: 0.3510
 epoch: 56, train_loss: 1.1782, test_loss: 1.1533, test_f1: 0.3441
 epoch: 57, train_loss: 1.1702, test_loss: 1.1520, test_f1: 0.3521
 epoch: 58, train_loss: 1.1699, test_loss: 1.1508, test_f1: 0.3510
 epoch: 59, train_loss: 1.1683, test_loss: 1.1505, test_f1: 0.3516
 epoch: 60, train_loss: 1.1703, test_loss: 1.1494, test_f1: 0.3521
 epoch: 61, train_loss: 1.1719, test_loss: 1.1494, test_f1: 0.3475
 epoch: 62, train_loss: 1.1671, test_loss: 1.1480, test_f1: 0.3455
 epoch: 63, train_loss: 1.1674, test_loss: 1.1476, test_f1: 0.3391
 epoch: 64, train_loss: 1.1665, test_loss: 1.1461, test_f1: 0.3444
 epoch: 65, train_loss: 1.1711, test_loss: 1.1454, test_f1: 0.3381
 epoch: 66, train_loss: 1.1645, test_loss: 1.1443, test_f1: 0.3411
 epoch: 67, train_loss: 1.1656, test_loss: 1.1436, test_f1: 0.3381
 epoch: 68, train_loss: 1.1628, test_loss: 1.1428, test_f1: 0.3401
 epoch: 69, train_loss: 1.1674, test_loss: 1.1418, test_f1: 0.3381
 epoch: 70, train_loss: 1.1637, test_loss: 1.1413, test_f1: 0.3381
 epoch: 71, train_loss: 1.1601, test_loss: 1.1410, test_f1: 0.3381
 epoch: 72, train_loss: 1.1586, test_loss: 1.1400, test_f1: 0.3381
 epoch: 73, train_loss: 1.1592, test_loss: 1.1389, test_f1: 0.3381
 epoch: 74, train_loss: 1.1633, test_loss: 1.1393, test_f1: 0.3381
 epoch: 75, train_loss: 1.1544, test_loss: 1.1379, test_f1: 0.3381
 epoch: 76, train_loss: 1.1579, test_loss: 1.1374, test_f1: 0.3381
 epoch: 77, train_loss: 1.1538, test_loss: 1.1368, test_f1: 0.3381
 epoch: 78, train_loss: 1.1577, test_loss: 1.1357, test_f1: 0.3381
 epoch: 79, train_loss: 1.1572, test_loss: 1.1354, test_f1: 0.3381
 epoch: 80, train_loss: 1.1559, test_loss: 1.1348, test_f1: 0.3381
 epoch: 81, train_loss: 1.1526, test_loss: 1.1329, test_f1: 0.3381
 epoch: 82, train_loss: 1.1536, test_loss: 1.1322, test_f1: 0.3381
 epoch: 83, train_loss: 1.1502, test_loss: 1.1319, test_f1: 0.3381
 epoch: 84, train_loss: 1.1592, test_loss: 1.1315, test_f1: 0.3391
 epoch: 85, train_loss: 1.1499, test_loss: 1.1304, test_f1: 0.3381
 epoch: 86, train_loss: 1.1521, test_loss: 1.1297, test_f1: 0.3391
 epoch: 87, train_loss: 1.1480, test_loss: 1.1284, test_f1: 0.3381
 epoch: 88, train_loss: 1.1441, test_loss: 1.1284, test_f1: 0.3400
 epoch: 89, train_loss: 1.1483, test_loss: 1.1286, test_f1: 0.3410
 epoch: 90, train_loss: 1.1449, test_loss: 1.1276, test_f1: 0.3410
 epoch: 91, train_loss: 1.1469, test_loss: 1.1268, test_f1: 0.3400
 epoch: 92, train_loss: 1.1483, test_loss: 1.1263, test_f1: 0.3410
 epoch: 93, train_loss: 1.1455, test_loss: 1.1261, test_f1: 0.3419
 epoch: 94, train_loss: 1.1477, test_loss: 1.1240, test_f1: 0.3419
 epoch: 95, train_loss: 1.1405, test_loss: 1.1237, test_f1: 0.3419
 epoch: 96, train_loss: 1.1421, test_loss: 1.1238, test_f1: 0.3419
 epoch: 97, train_loss: 1.1387, test_loss: 1.1229, test_f1: 0.3419
 epoch: 98, train_loss: 1.1433, test_loss: 1.1229, test_f1: 0.3419
 epoch: 99, train_loss: 1.1400, test_loss: 1.1224, test_f1: 0.3419
##################ITERATION #6 ****************************************
 epoch: 0, train_loss: 1.3229, test_loss: 1.3274, test_f1: 0.2260
 epoch: 1, train_loss: 1.3171, test_loss: 1.3254, test_f1: 0.2260
 epoch: 2, train_loss: 1.3127, test_loss: 1.3266, test_f1: 0.2260
 epoch: 3, train_loss: 1.3096, test_loss: 1.3201, test_f1: 0.2260
 epoch: 4, train_loss: 1.3045, test_loss: 1.3122, test_f1: 0.2260
 epoch: 5, train_loss: 1.3013, test_loss: 1.3074, test_f1: 0.2260
 epoch: 6, train_loss: 1.2978, test_loss: 1.3042, test_f1: 0.2260
 epoch: 7, train_loss: 1.2945, test_loss: 1.3006, test_f1: 0.2260
 epoch: 8, train_loss: 1.2894, test_loss: 1.2970, test_f1: 0.2260
 epoch: 9, train_loss: 1.2879, test_loss: 1.2945, test_f1: 0.2260
 epoch: 10, train_loss: 1.2852, test_loss: 1.2915, test_f1: 0.2260
 epoch: 11, train_loss: 1.2835, test_loss: 1.2888, test_f1: 0.2260
 epoch: 12, train_loss: 1.2785, test_loss: 1.2856, test_f1: 0.2260
 epoch: 13, train_loss: 1.2756, test_loss: 1.2825, test_f1: 0.2260
 epoch: 14, train_loss: 1.2710, test_loss: 1.2796, test_f1: 0.2260
 epoch: 15, train_loss: 1.2685, test_loss: 1.2761, test_f1: 0.2260
 epoch: 16, train_loss: 1.2669, test_loss: 1.2726, test_f1: 0.2260
 epoch: 17, train_loss: 1.2626, test_loss: 1.2685, test_f1: 0.2260
 epoch: 18, train_loss: 1.2611, test_loss: 1.2648, test_f1: 0.2260
 epoch: 19, train_loss: 1.2571, test_loss: 1.2611, test_f1: 0.2260
 epoch: 20, train_loss: 1.2547, test_loss: 1.2575, test_f1: 0.2260
 epoch: 21, train_loss: 1.2507, test_loss: 1.2539, test_f1: 0.2260
 epoch: 22, train_loss: 1.2466, test_loss: 1.2502, test_f1: 0.2260
 epoch: 23, train_loss: 1.2465, test_loss: 1.2473, test_f1: 0.2260
 epoch: 24, train_loss: 1.2418, test_loss: 1.2431, test_f1: 0.2260
 epoch: 25, train_loss: 1.2418, test_loss: 1.2394, test_f1: 0.2260
 epoch: 26, train_loss: 1.2369, test_loss: 1.2369, test_f1: 0.2260
 epoch: 27, train_loss: 1.2386, test_loss: 1.2333, test_f1: 0.2260
 epoch: 28, train_loss: 1.2324, test_loss: 1.2288, test_f1: 0.2260
 epoch: 29, train_loss: 1.2296, test_loss: 1.2258, test_f1: 0.2260
 epoch: 30, train_loss: 1.2287, test_loss: 1.2222, test_f1: 0.2260
 epoch: 31, train_loss: 1.2263, test_loss: 1.2200, test_f1: 0.2260
 epoch: 32, train_loss: 1.2234, test_loss: 1.2180, test_f1: 0.2260
 epoch: 33, train_loss: 1.2248, test_loss: 1.2140, test_f1: 0.2260
 epoch: 34, train_loss: 1.2183, test_loss: 1.2118, test_f1: 0.2260
 epoch: 35, train_loss: 1.2175, test_loss: 1.2097, test_f1: 0.2260
 epoch: 36, train_loss: 1.2145, test_loss: 1.2069, test_f1: 0.2260
 epoch: 37, train_loss: 1.2149, test_loss: 1.2038, test_f1: 0.2260
 epoch: 38, train_loss: 1.2134, test_loss: 1.2015, test_f1: 0.2260
 epoch: 39, train_loss: 1.2100, test_loss: 1.1989, test_f1: 0.2260
 epoch: 40, train_loss: 1.2091, test_loss: 1.1970, test_f1: 0.2260
 epoch: 41, train_loss: 1.2088, test_loss: 1.1947, test_f1: 0.2260
 epoch: 42, train_loss: 1.2056, test_loss: 1.1929, test_f1: 0.2260
 epoch: 43, train_loss: 1.1993, test_loss: 1.1901, test_f1: 0.2286
 epoch: 44, train_loss: 1.1975, test_loss: 1.1879, test_f1: 0.2311
 epoch: 45, train_loss: 1.1989, test_loss: 1.1867, test_f1: 0.2335
 epoch: 46, train_loss: 1.1969, test_loss: 1.1840, test_f1: 0.2452
 epoch: 47, train_loss: 1.1959, test_loss: 1.1817, test_f1: 0.2581
 epoch: 48, train_loss: 1.1973, test_loss: 1.1805, test_f1: 0.2601
 epoch: 49, train_loss: 1.1906, test_loss: 1.1797, test_f1: 0.2699
 epoch: 50, train_loss: 1.1872, test_loss: 1.1758, test_f1: 0.2808
 epoch: 51, train_loss: 1.1852, test_loss: 1.1747, test_f1: 0.2893
 epoch: 52, train_loss: 1.1836, test_loss: 1.1735, test_f1: 0.2941
 epoch: 53, train_loss: 1.1846, test_loss: 1.1740, test_f1: 0.2941
 epoch: 54, train_loss: 1.1815, test_loss: 1.1728, test_f1: 0.3033
 epoch: 55, train_loss: 1.1816, test_loss: 1.1712, test_f1: 0.3033
 epoch: 56, train_loss: 1.1806, test_loss: 1.1702, test_f1: 0.3076
 epoch: 57, train_loss: 1.1842, test_loss: 1.1693, test_f1: 0.3132
 epoch: 58, train_loss: 1.1873, test_loss: 1.1687, test_f1: 0.3186
 epoch: 59, train_loss: 1.1805, test_loss: 1.1678, test_f1: 0.3238
 epoch: 60, train_loss: 1.1797, test_loss: 1.1663, test_f1: 0.3263
 epoch: 61, train_loss: 1.1773, test_loss: 1.1657, test_f1: 0.3275
 epoch: 62, train_loss: 1.1739, test_loss: 1.1634, test_f1: 0.3250
 epoch: 63, train_loss: 1.1765, test_loss: 1.1630, test_f1: 0.3299
 epoch: 64, train_loss: 1.1764, test_loss: 1.1626, test_f1: 0.3311
 epoch: 65, train_loss: 1.1739, test_loss: 1.1622, test_f1: 0.3311
 epoch: 66, train_loss: 1.1753, test_loss: 1.1607, test_f1: 0.3335
 epoch: 67, train_loss: 1.1724, test_loss: 1.1609, test_f1: 0.3335
 epoch: 68, train_loss: 1.1718, test_loss: 1.1597, test_f1: 0.3335
 epoch: 69, train_loss: 1.1688, test_loss: 1.1579, test_f1: 0.3335
 epoch: 70, train_loss: 1.1743, test_loss: 1.1563, test_f1: 0.3323
 epoch: 71, train_loss: 1.1683, test_loss: 1.1548, test_f1: 0.3335
 epoch: 72, train_loss: 1.1699, test_loss: 1.1550, test_f1: 0.3358
 epoch: 73, train_loss: 1.1664, test_loss: 1.1542, test_f1: 0.3381
 epoch: 74, train_loss: 1.1646, test_loss: 1.1528, test_f1: 0.3381
 epoch: 75, train_loss: 1.1685, test_loss: 1.1525, test_f1: 0.3392
 epoch: 76, train_loss: 1.1695, test_loss: 1.1524, test_f1: 0.3404
 epoch: 77, train_loss: 1.1665, test_loss: 1.1508, test_f1: 0.3392
 epoch: 78, train_loss: 1.1625, test_loss: 1.1502, test_f1: 0.3426
 epoch: 79, train_loss: 1.1606, test_loss: 1.1490, test_f1: 0.3415
 epoch: 80, train_loss: 1.1594, test_loss: 1.1476, test_f1: 0.3404
 epoch: 81, train_loss: 1.1608, test_loss: 1.1485, test_f1: 0.3447
 epoch: 82, train_loss: 1.1593, test_loss: 1.1479, test_f1: 0.3458
 epoch: 83, train_loss: 1.1586, test_loss: 1.1468, test_f1: 0.3447
 epoch: 84, train_loss: 1.1626, test_loss: 1.1441, test_f1: 0.3447
 epoch: 85, train_loss: 1.1567, test_loss: 1.1443, test_f1: 0.3458
 epoch: 86, train_loss: 1.1578, test_loss: 1.1427, test_f1: 0.3458
 epoch: 87, train_loss: 1.1505, test_loss: 1.1433, test_f1: 0.3479
 epoch: 88, train_loss: 1.1545, test_loss: 1.1412, test_f1: 0.3469
 epoch: 89, train_loss: 1.1554, test_loss: 1.1407, test_f1: 0.3469
 epoch: 90, train_loss: 1.1529, test_loss: 1.1410, test_f1: 0.3479
 epoch: 91, train_loss: 1.1555, test_loss: 1.1389, test_f1: 0.3458
 epoch: 92, train_loss: 1.1491, test_loss: 1.1388, test_f1: 0.3458
 epoch: 93, train_loss: 1.1479, test_loss: 1.1368, test_f1: 0.3479
 epoch: 94, train_loss: 1.1480, test_loss: 1.1359, test_f1: 0.3479
 epoch: 95, train_loss: 1.1510, test_loss: 1.1343, test_f1: 0.3505
 epoch: 96, train_loss: 1.1470, test_loss: 1.1348, test_f1: 0.3515
 epoch: 97, train_loss: 1.1493, test_loss: 1.1356, test_f1: 0.3515
 epoch: 98, train_loss: 1.1452, test_loss: 1.1353, test_f1: 0.3505
 epoch: 99, train_loss: 1.1444, test_loss: 1.1325, test_f1: 0.3515
##################ITERATION #7 ****************************************
 epoch: 0, train_loss: 1.3813, test_loss: 1.4140, test_f1: 0.0303
 epoch: 1, train_loss: 1.3712, test_loss: 1.4135, test_f1: 0.0303
 epoch: 2, train_loss: 1.3635, test_loss: 1.4110, test_f1: 0.0299
 epoch: 3, train_loss: 1.3573, test_loss: 1.4028, test_f1: 0.1434
 epoch: 4, train_loss: 1.3487, test_loss: 1.3892, test_f1: 0.1907
 epoch: 5, train_loss: 1.3425, test_loss: 1.3748, test_f1: 0.2007
 epoch: 6, train_loss: 1.3329, test_loss: 1.3622, test_f1: 0.2255
 epoch: 7, train_loss: 1.3278, test_loss: 1.3523, test_f1: 0.2337
 epoch: 8, train_loss: 1.3187, test_loss: 1.3400, test_f1: 0.2347
 epoch: 9, train_loss: 1.3074, test_loss: 1.3298, test_f1: 0.2294
 epoch: 10, train_loss: 1.3009, test_loss: 1.3164, test_f1: 0.2287
 epoch: 11, train_loss: 1.2922, test_loss: 1.3061, test_f1: 0.2260
 epoch: 12, train_loss: 1.2832, test_loss: 1.2961, test_f1: 0.2260
 epoch: 13, train_loss: 1.2817, test_loss: 1.2889, test_f1: 0.2260
 epoch: 14, train_loss: 1.2706, test_loss: 1.2791, test_f1: 0.2286
 epoch: 15, train_loss: 1.2642, test_loss: 1.2702, test_f1: 0.2286
 epoch: 16, train_loss: 1.2655, test_loss: 1.2632, test_f1: 0.2311
 epoch: 17, train_loss: 1.2582, test_loss: 1.2592, test_f1: 0.2359
 epoch: 18, train_loss: 1.2527, test_loss: 1.2506, test_f1: 0.2383
 epoch: 19, train_loss: 1.2424, test_loss: 1.2417, test_f1: 0.2383
 epoch: 20, train_loss: 1.2434, test_loss: 1.2378, test_f1: 0.2539
 epoch: 21, train_loss: 1.2390, test_loss: 1.2326, test_f1: 0.2699
 epoch: 22, train_loss: 1.2299, test_loss: 1.2212, test_f1: 0.2699
 epoch: 23, train_loss: 1.2271, test_loss: 1.2242, test_f1: 0.2988
 epoch: 24, train_loss: 1.2197, test_loss: 1.2089, test_f1: 0.2893
 epoch: 25, train_loss: 1.2158, test_loss: 1.2028, test_f1: 0.2893
 epoch: 26, train_loss: 1.2139, test_loss: 1.1988, test_f1: 0.3062
 epoch: 27, train_loss: 1.2100, test_loss: 1.1946, test_f1: 0.3132
 epoch: 28, train_loss: 1.2057, test_loss: 1.1967, test_f1: 0.3146
 epoch: 29, train_loss: 1.2056, test_loss: 1.1842, test_f1: 0.3160
 epoch: 30, train_loss: 1.2005, test_loss: 1.1835, test_f1: 0.3212
 epoch: 31, train_loss: 1.1944, test_loss: 1.1757, test_f1: 0.3173
 epoch: 32, train_loss: 1.1906, test_loss: 1.1757, test_f1: 0.3275
 epoch: 33, train_loss: 1.1872, test_loss: 1.1631, test_f1: 0.3212
 epoch: 34, train_loss: 1.1885, test_loss: 1.1630, test_f1: 0.3275
 epoch: 35, train_loss: 1.1853, test_loss: 1.1613, test_f1: 0.3335
 epoch: 36, train_loss: 1.1804, test_loss: 1.1591, test_f1: 0.3358
 epoch: 37, train_loss: 1.1783, test_loss: 1.1602, test_f1: 0.3392
 epoch: 38, train_loss: 1.1709, test_loss: 1.1466, test_f1: 0.3358
 epoch: 39, train_loss: 1.1715, test_loss: 1.1434, test_f1: 0.3370
 epoch: 40, train_loss: 1.1730, test_loss: 1.1461, test_f1: 0.3426
 epoch: 41, train_loss: 1.1658, test_loss: 1.1419, test_f1: 0.3426
 epoch: 42, train_loss: 1.1637, test_loss: 1.1396, test_f1: 0.3275
 epoch: 43, train_loss: 1.1637, test_loss: 1.1385, test_f1: 0.3458
 epoch: 44, train_loss: 1.1596, test_loss: 1.1311, test_f1: 0.3415
 epoch: 45, train_loss: 1.1619, test_loss: 1.1270, test_f1: 0.3415
 epoch: 46, train_loss: 1.1535, test_loss: 1.1256, test_f1: 0.3447
 epoch: 47, train_loss: 1.1501, test_loss: 1.1250, test_f1: 0.3498
 epoch: 48, train_loss: 1.1527, test_loss: 1.1190, test_f1: 0.3498
 epoch: 49, train_loss: 1.1414, test_loss: 1.1165, test_f1: 0.3551
 epoch: 50, train_loss: 1.1459, test_loss: 1.1172, test_f1: 0.3545
 epoch: 51, train_loss: 1.1411, test_loss: 1.1142, test_f1: 0.3591
 epoch: 52, train_loss: 1.1444, test_loss: 1.1109, test_f1: 0.3584
 epoch: 53, train_loss: 1.1435, test_loss: 1.1110, test_f1: 0.3575
 epoch: 54, train_loss: 1.1400, test_loss: 1.1097, test_f1: 0.3628
 epoch: 55, train_loss: 1.1337, test_loss: 1.1089, test_f1: 0.3640
 epoch: 56, train_loss: 1.1357, test_loss: 1.1070, test_f1: 0.3638
 epoch: 57, train_loss: 1.1430, test_loss: 1.1075, test_f1: 0.3650
 epoch: 58, train_loss: 1.1328, test_loss: 1.1049, test_f1: 0.3630
 epoch: 59, train_loss: 1.1368, test_loss: 1.1043, test_f1: 0.3664
 epoch: 60, train_loss: 1.1326, test_loss: 1.1028, test_f1: 0.3630
 epoch: 61, train_loss: 1.1310, test_loss: 1.1028, test_f1: 0.3640
 epoch: 62, train_loss: 1.1335, test_loss: 1.1008, test_f1: 0.3640
 epoch: 63, train_loss: 1.1273, test_loss: 1.0993, test_f1: 0.3699
 epoch: 64, train_loss: 1.1328, test_loss: 1.0988, test_f1: 0.3700
 epoch: 65, train_loss: 1.1324, test_loss: 1.1014, test_f1: 0.3734
 epoch: 66, train_loss: 1.1291, test_loss: 1.0991, test_f1: 0.3714
 epoch: 67, train_loss: 1.1289, test_loss: 1.1000, test_f1: 0.3711
 epoch: 68, train_loss: 1.1289, test_loss: 1.0982, test_f1: 0.3734
 epoch: 69, train_loss: 1.1258, test_loss: 1.0949, test_f1: 0.3745
 epoch: 70, train_loss: 1.1235, test_loss: 1.0954, test_f1: 0.3743
 epoch: 71, train_loss: 1.1281, test_loss: 1.0940, test_f1: 0.3737
 epoch: 72, train_loss: 1.1219, test_loss: 1.0941, test_f1: 0.3727
 epoch: 73, train_loss: 1.1213, test_loss: 1.0926, test_f1: 0.3747
 epoch: 74, train_loss: 1.1223, test_loss: 1.0908, test_f1: 0.3747
 epoch: 75, train_loss: 1.1217, test_loss: 1.0899, test_f1: 0.3730
 epoch: 76, train_loss: 1.1187, test_loss: 1.0890, test_f1: 0.3737
 epoch: 77, train_loss: 1.1183, test_loss: 1.0891, test_f1: 0.3747
 epoch: 78, train_loss: 1.1158, test_loss: 1.0897, test_f1: 0.3767
 epoch: 79, train_loss: 1.1121, test_loss: 1.0877, test_f1: 0.3747
 epoch: 80, train_loss: 1.1194, test_loss: 1.0873, test_f1: 0.3761
 epoch: 81, train_loss: 1.1144, test_loss: 1.0865, test_f1: 0.3761
 epoch: 82, train_loss: 1.1135, test_loss: 1.0858, test_f1: 0.3757
 epoch: 83, train_loss: 1.1167, test_loss: 1.0859, test_f1: 0.3796
 epoch: 84, train_loss: 1.1114, test_loss: 1.0835, test_f1: 0.3776
 epoch: 85, train_loss: 1.1090, test_loss: 1.0821, test_f1: 0.3747
 epoch: 86, train_loss: 1.1127, test_loss: 1.0808, test_f1: 0.3767
 epoch: 87, train_loss: 1.1114, test_loss: 1.0819, test_f1: 0.3741
 epoch: 88, train_loss: 1.1127, test_loss: 1.0825, test_f1: 0.3767
 epoch: 89, train_loss: 1.1091, test_loss: 1.0804, test_f1: 0.3776
 epoch: 90, train_loss: 1.1152, test_loss: 1.0772, test_f1: 0.3790
 epoch: 91, train_loss: 1.1081, test_loss: 1.0788, test_f1: 0.3790
 epoch: 92, train_loss: 1.1056, test_loss: 1.0798, test_f1: 0.3790
 epoch: 93, train_loss: 1.1034, test_loss: 1.0770, test_f1: 0.3780
 epoch: 94, train_loss: 1.1052, test_loss: 1.0770, test_f1: 0.3751
 epoch: 95, train_loss: 1.1053, test_loss: 1.0759, test_f1: 0.3794
 epoch: 96, train_loss: 1.1050, test_loss: 1.0761, test_f1: 0.3807
 epoch: 97, train_loss: 1.1074, test_loss: 1.0755, test_f1: 0.3836
 epoch: 98, train_loss: 1.1026, test_loss: 1.0748, test_f1: 0.3817
 epoch: 99, train_loss: 1.1031, test_loss: 1.0714, test_f1: 0.3800
##################ITERATION #8 ****************************************
 epoch: 0, train_loss: 1.3134, test_loss: 1.3258, test_f1: 0.2260
 epoch: 1, train_loss: 1.3036, test_loss: 1.3219, test_f1: 0.2260
 epoch: 2, train_loss: 1.2982, test_loss: 1.3165, test_f1: 0.2260
 epoch: 3, train_loss: 1.2917, test_loss: 1.3060, test_f1: 0.2260
 epoch: 4, train_loss: 1.2889, test_loss: 1.2981, test_f1: 0.2260
 epoch: 5, train_loss: 1.2840, test_loss: 1.2914, test_f1: 0.2260
 epoch: 6, train_loss: 1.2798, test_loss: 1.2864, test_f1: 0.2260
 epoch: 7, train_loss: 1.2761, test_loss: 1.2811, test_f1: 0.2260
 epoch: 8, train_loss: 1.2714, test_loss: 1.2746, test_f1: 0.2260
 epoch: 9, train_loss: 1.2668, test_loss: 1.2715, test_f1: 0.2260
 epoch: 10, train_loss: 1.2632, test_loss: 1.2661, test_f1: 0.2260
 epoch: 11, train_loss: 1.2601, test_loss: 1.2607, test_f1: 0.2260
 epoch: 12, train_loss: 1.2534, test_loss: 1.2570, test_f1: 0.2260
 epoch: 13, train_loss: 1.2483, test_loss: 1.2521, test_f1: 0.2260
 epoch: 14, train_loss: 1.2494, test_loss: 1.2467, test_f1: 0.2260
 epoch: 15, train_loss: 1.2467, test_loss: 1.2436, test_f1: 0.2260
 epoch: 16, train_loss: 1.2455, test_loss: 1.2399, test_f1: 0.2260
 epoch: 17, train_loss: 1.2372, test_loss: 1.2345, test_f1: 0.2260
 epoch: 18, train_loss: 1.2345, test_loss: 1.2316, test_f1: 0.2260
 epoch: 19, train_loss: 1.2314, test_loss: 1.2296, test_f1: 0.2260
 epoch: 20, train_loss: 1.2321, test_loss: 1.2216, test_f1: 0.2260
 epoch: 21, train_loss: 1.2256, test_loss: 1.2182, test_f1: 0.2260
 epoch: 22, train_loss: 1.2198, test_loss: 1.2146, test_f1: 0.2260
 epoch: 23, train_loss: 1.2175, test_loss: 1.2109, test_f1: 0.2311
 epoch: 24, train_loss: 1.2133, test_loss: 1.2056, test_f1: 0.2359
 epoch: 25, train_loss: 1.2128, test_loss: 1.2024, test_f1: 0.2383
 epoch: 26, train_loss: 1.2098, test_loss: 1.1992, test_f1: 0.2560
 epoch: 27, train_loss: 1.2041, test_loss: 1.1933, test_f1: 0.2699
 epoch: 28, train_loss: 1.2050, test_loss: 1.1905, test_f1: 0.2988
 epoch: 29, train_loss: 1.2058, test_loss: 1.1872, test_f1: 0.3186
 epoch: 30, train_loss: 1.1926, test_loss: 1.1824, test_f1: 0.3238
 epoch: 31, train_loss: 1.1955, test_loss: 1.1800, test_f1: 0.3323
 epoch: 32, train_loss: 1.1929, test_loss: 1.1764, test_f1: 0.3347
 epoch: 33, train_loss: 1.1898, test_loss: 1.1729, test_f1: 0.3381
 epoch: 34, train_loss: 1.1836, test_loss: 1.1703, test_f1: 0.3415
 epoch: 35, train_loss: 1.1820, test_loss: 1.1653, test_f1: 0.3426
 epoch: 36, train_loss: 1.1796, test_loss: 1.1615, test_f1: 0.3447
 epoch: 37, train_loss: 1.1765, test_loss: 1.1606, test_f1: 0.3462
 epoch: 38, train_loss: 1.1731, test_loss: 1.1557, test_f1: 0.3455
 epoch: 39, train_loss: 1.1751, test_loss: 1.1528, test_f1: 0.3417
 epoch: 40, train_loss: 1.1678, test_loss: 1.1489, test_f1: 0.3472
 epoch: 41, train_loss: 1.1689, test_loss: 1.1483, test_f1: 0.3411
 epoch: 42, train_loss: 1.1664, test_loss: 1.1462, test_f1: 0.3401
 epoch: 43, train_loss: 1.1632, test_loss: 1.1458, test_f1: 0.3400
 epoch: 44, train_loss: 1.1640, test_loss: 1.1459, test_f1: 0.3410
 epoch: 45, train_loss: 1.1581, test_loss: 1.1411, test_f1: 0.3429
 epoch: 46, train_loss: 1.1617, test_loss: 1.1420, test_f1: 0.3419
 epoch: 47, train_loss: 1.1553, test_loss: 1.1407, test_f1: 0.3390
 epoch: 48, train_loss: 1.1483, test_loss: 1.1342, test_f1: 0.3419
 epoch: 49, train_loss: 1.1482, test_loss: 1.1350, test_f1: 0.3419
 epoch: 50, train_loss: 1.1479, test_loss: 1.1339, test_f1: 0.3410
 epoch: 51, train_loss: 1.1429, test_loss: 1.1325, test_f1: 0.3410
 epoch: 52, train_loss: 1.1511, test_loss: 1.1316, test_f1: 0.3419
 epoch: 53, train_loss: 1.1426, test_loss: 1.1316, test_f1: 0.3400
 epoch: 54, train_loss: 1.1442, test_loss: 1.1291, test_f1: 0.3419
 epoch: 55, train_loss: 1.1401, test_loss: 1.1265, test_f1: 0.3429
 epoch: 56, train_loss: 1.1417, test_loss: 1.1258, test_f1: 0.3419
 epoch: 57, train_loss: 1.1448, test_loss: 1.1260, test_f1: 0.3419
 epoch: 58, train_loss: 1.1407, test_loss: 1.1234, test_f1: 0.3419
 epoch: 59, train_loss: 1.1395, test_loss: 1.1232, test_f1: 0.3400
 epoch: 60, train_loss: 1.1369, test_loss: 1.1207, test_f1: 0.3400
 epoch: 61, train_loss: 1.1360, test_loss: 1.1197, test_f1: 0.3419
 epoch: 62, train_loss: 1.1369, test_loss: 1.1192, test_f1: 0.3429
 epoch: 63, train_loss: 1.1356, test_loss: 1.1174, test_f1: 0.3429
 epoch: 64, train_loss: 1.1313, test_loss: 1.1158, test_f1: 0.3419
 epoch: 65, train_loss: 1.1357, test_loss: 1.1159, test_f1: 0.3429
 epoch: 66, train_loss: 1.1346, test_loss: 1.1154, test_f1: 0.3400
 epoch: 67, train_loss: 1.1310, test_loss: 1.1137, test_f1: 0.3429
 epoch: 68, train_loss: 1.1305, test_loss: 1.1135, test_f1: 0.3405
 epoch: 69, train_loss: 1.1287, test_loss: 1.1106, test_f1: 0.3417
 epoch: 70, train_loss: 1.1271, test_loss: 1.1113, test_f1: 0.3397
 epoch: 71, train_loss: 1.1294, test_loss: 1.1140, test_f1: 0.3393
 epoch: 72, train_loss: 1.1236, test_loss: 1.1108, test_f1: 0.3407
 epoch: 73, train_loss: 1.1239, test_loss: 1.1107, test_f1: 0.3409
 epoch: 74, train_loss: 1.1237, test_loss: 1.1099, test_f1: 0.3495
 epoch: 75, train_loss: 1.1279, test_loss: 1.1087, test_f1: 0.3454
 epoch: 76, train_loss: 1.1243, test_loss: 1.1073, test_f1: 0.3515
 epoch: 77, train_loss: 1.1242, test_loss: 1.1074, test_f1: 0.3524
 epoch: 78, train_loss: 1.1172, test_loss: 1.1065, test_f1: 0.3524
 epoch: 79, train_loss: 1.1197, test_loss: 1.1068, test_f1: 0.3481
 epoch: 80, train_loss: 1.1195, test_loss: 1.1071, test_f1: 0.3529
 epoch: 81, train_loss: 1.1160, test_loss: 1.1038, test_f1: 0.3574
 epoch: 82, train_loss: 1.1175, test_loss: 1.1011, test_f1: 0.3549
 epoch: 83, train_loss: 1.1217, test_loss: 1.1023, test_f1: 0.3564
 epoch: 84, train_loss: 1.1168, test_loss: 1.1027, test_f1: 0.3545
 epoch: 85, train_loss: 1.1173, test_loss: 1.1047, test_f1: 0.3543
 epoch: 86, train_loss: 1.1125, test_loss: 1.0997, test_f1: 0.3564
 epoch: 87, train_loss: 1.1125, test_loss: 1.1009, test_f1: 0.3543
 epoch: 88, train_loss: 1.1092, test_loss: 1.0978, test_f1: 0.3564
 epoch: 89, train_loss: 1.1109, test_loss: 1.0969, test_f1: 0.3564
 epoch: 90, train_loss: 1.1147, test_loss: 1.0978, test_f1: 0.3543
 epoch: 91, train_loss: 1.1068, test_loss: 1.0968, test_f1: 0.3540
 epoch: 92, train_loss: 1.1118, test_loss: 1.0948, test_f1: 0.3543
 epoch: 93, train_loss: 1.1146, test_loss: 1.0936, test_f1: 0.3564
 epoch: 94, train_loss: 1.1079, test_loss: 1.0937, test_f1: 0.3564
 epoch: 95, train_loss: 1.1074, test_loss: 1.0955, test_f1: 0.3543
 epoch: 96, train_loss: 1.1094, test_loss: 1.0941, test_f1: 0.3545
 epoch: 97, train_loss: 1.1082, test_loss: 1.0940, test_f1: 0.3540
 epoch: 98, train_loss: 1.1125, test_loss: 1.0964, test_f1: 0.3515
 epoch: 99, train_loss: 1.1021, test_loss: 1.0929, test_f1: 0.3543
##################ITERATION #9 ****************************************
 epoch: 0, train_loss: 1.3325, test_loss: 1.3500, test_f1: 0.2260
 epoch: 1, train_loss: 1.3182, test_loss: 1.3515, test_f1: 0.2260
 epoch: 2, train_loss: 1.3102, test_loss: 1.3568, test_f1: 0.2260
 epoch: 3, train_loss: 1.3008, test_loss: 1.3530, test_f1: 0.2260
 epoch: 4, train_loss: 1.2951, test_loss: 1.3344, test_f1: 0.2260
 epoch: 5, train_loss: 1.2879, test_loss: 1.3037, test_f1: 0.2260
 epoch: 6, train_loss: 1.2776, test_loss: 1.2893, test_f1: 0.2260
 epoch: 7, train_loss: 1.2737, test_loss: 1.2804, test_f1: 0.2260
 epoch: 8, train_loss: 1.2703, test_loss: 1.2728, test_f1: 0.2260
 epoch: 9, train_loss: 1.2632, test_loss: 1.2665, test_f1: 0.2260
 epoch: 10, train_loss: 1.2561, test_loss: 1.2586, test_f1: 0.2260
 epoch: 11, train_loss: 1.2535, test_loss: 1.2535, test_f1: 0.2260
 epoch: 12, train_loss: 1.2485, test_loss: 1.2484, test_f1: 0.2260
 epoch: 13, train_loss: 1.2421, test_loss: 1.2428, test_f1: 0.2260
 epoch: 14, train_loss: 1.2363, test_loss: 1.2371, test_f1: 0.2260
 epoch: 15, train_loss: 1.2348, test_loss: 1.2315, test_f1: 0.2260
 epoch: 16, train_loss: 1.2313, test_loss: 1.2270, test_f1: 0.2260
 epoch: 17, train_loss: 1.2295, test_loss: 1.2227, test_f1: 0.2260
 epoch: 18, train_loss: 1.2231, test_loss: 1.2178, test_f1: 0.2260
 epoch: 19, train_loss: 1.2237, test_loss: 1.2135, test_f1: 0.2260
 epoch: 20, train_loss: 1.2160, test_loss: 1.2081, test_f1: 0.2260
 epoch: 21, train_loss: 1.2149, test_loss: 1.2044, test_f1: 0.2260
 epoch: 22, train_loss: 1.2127, test_loss: 1.1999, test_f1: 0.2260
 epoch: 23, train_loss: 1.2115, test_loss: 1.1956, test_f1: 0.2311
 epoch: 24, train_loss: 1.2055, test_loss: 1.1927, test_f1: 0.2496
 epoch: 25, train_loss: 1.2035, test_loss: 1.1895, test_f1: 0.2825
 epoch: 26, train_loss: 1.1984, test_loss: 1.1852, test_f1: 0.3048
 epoch: 27, train_loss: 1.1957, test_loss: 1.1816, test_f1: 0.3287
 epoch: 28, train_loss: 1.1927, test_loss: 1.1794, test_f1: 0.3381
 epoch: 29, train_loss: 1.1917, test_loss: 1.1747, test_f1: 0.3462
 epoch: 30, train_loss: 1.1899, test_loss: 1.1710, test_f1: 0.3484
 epoch: 31, train_loss: 1.1869, test_loss: 1.1673, test_f1: 0.3494
 epoch: 32, train_loss: 1.1810, test_loss: 1.1634, test_f1: 0.3494
 epoch: 33, train_loss: 1.1785, test_loss: 1.1604, test_f1: 0.3494
 epoch: 34, train_loss: 1.1775, test_loss: 1.1569, test_f1: 0.3501
 epoch: 35, train_loss: 1.1732, test_loss: 1.1518, test_f1: 0.3498
 epoch: 36, train_loss: 1.1705, test_loss: 1.1481, test_f1: 0.3526
 epoch: 37, train_loss: 1.1692, test_loss: 1.1466, test_f1: 0.3484
 epoch: 38, train_loss: 1.1683, test_loss: 1.1450, test_f1: 0.3504
 epoch: 39, train_loss: 1.1655, test_loss: 1.1418, test_f1: 0.3514
 epoch: 40, train_loss: 1.1640, test_loss: 1.1388, test_f1: 0.3622
 epoch: 41, train_loss: 1.1603, test_loss: 1.1352, test_f1: 0.3632
 epoch: 42, train_loss: 1.1540, test_loss: 1.1323, test_f1: 0.3635
 epoch: 43, train_loss: 1.1533, test_loss: 1.1295, test_f1: 0.3632
 epoch: 44, train_loss: 1.1498, test_loss: 1.1265, test_f1: 0.3656
 epoch: 45, train_loss: 1.1503, test_loss: 1.1241, test_f1: 0.3646
 epoch: 46, train_loss: 1.1474, test_loss: 1.1217, test_f1: 0.3646
 epoch: 47, train_loss: 1.1443, test_loss: 1.1193, test_f1: 0.3690
 epoch: 48, train_loss: 1.1396, test_loss: 1.1199, test_f1: 0.3709
 epoch: 49, train_loss: 1.1419, test_loss: 1.1195, test_f1: 0.3699
 epoch: 50, train_loss: 1.1415, test_loss: 1.1150, test_f1: 0.3699
 epoch: 51, train_loss: 1.1341, test_loss: 1.1137, test_f1: 0.3725
 epoch: 52, train_loss: 1.1332, test_loss: 1.1109, test_f1: 0.3725
 epoch: 53, train_loss: 1.1283, test_loss: 1.1097, test_f1: 0.3726
 epoch: 54, train_loss: 1.1296, test_loss: 1.1084, test_f1: 0.3745
 epoch: 55, train_loss: 1.1313, test_loss: 1.1083, test_f1: 0.3694
 epoch: 56, train_loss: 1.1268, test_loss: 1.1060, test_f1: 0.3691
 epoch: 57, train_loss: 1.1261, test_loss: 1.1057, test_f1: 0.3657
 epoch: 58, train_loss: 1.1282, test_loss: 1.1049, test_f1: 0.3715
 epoch: 59, train_loss: 1.1296, test_loss: 1.1027, test_f1: 0.3691
 epoch: 60, train_loss: 1.1262, test_loss: 1.1027, test_f1: 0.3681
 epoch: 61, train_loss: 1.1247, test_loss: 1.1038, test_f1: 0.3651
 epoch: 62, train_loss: 1.1175, test_loss: 1.1037, test_f1: 0.3752
 epoch: 63, train_loss: 1.1233, test_loss: 1.1016, test_f1: 0.3651
 epoch: 64, train_loss: 1.1169, test_loss: 1.0998, test_f1: 0.3711
 epoch: 65, train_loss: 1.1168, test_loss: 1.1013, test_f1: 0.3661
 epoch: 66, train_loss: 1.1164, test_loss: 1.1007, test_f1: 0.3641
 epoch: 67, train_loss: 1.1190, test_loss: 1.0994, test_f1: 0.3665
 epoch: 68, train_loss: 1.1226, test_loss: 1.0990, test_f1: 0.3665
 epoch: 69, train_loss: 1.1134, test_loss: 1.0987, test_f1: 0.3658
 epoch: 70, train_loss: 1.1152, test_loss: 1.0976, test_f1: 0.3658
 epoch: 71, train_loss: 1.1135, test_loss: 1.0964, test_f1: 0.3653
 epoch: 72, train_loss: 1.1155, test_loss: 1.0940, test_f1: 0.3690
 epoch: 73, train_loss: 1.1106, test_loss: 1.0934, test_f1: 0.3691
 epoch: 74, train_loss: 1.1110, test_loss: 1.0932, test_f1: 0.3784
 epoch: 75, train_loss: 1.1089, test_loss: 1.0925, test_f1: 0.3672
 epoch: 76, train_loss: 1.1083, test_loss: 1.0924, test_f1: 0.3670
 epoch: 77, train_loss: 1.1152, test_loss: 1.0898, test_f1: 0.3696
 epoch: 78, train_loss: 1.1052, test_loss: 1.0912, test_f1: 0.3696
 epoch: 79, train_loss: 1.1022, test_loss: 1.0889, test_f1: 0.3764
 epoch: 80, train_loss: 1.1078, test_loss: 1.0891, test_f1: 0.3784
 epoch: 81, train_loss: 1.1062, test_loss: 1.0875, test_f1: 0.3797
 epoch: 82, train_loss: 1.1033, test_loss: 1.0871, test_f1: 0.3768
 epoch: 83, train_loss: 1.1012, test_loss: 1.0882, test_f1: 0.3739
 epoch: 84, train_loss: 1.0997, test_loss: 1.0862, test_f1: 0.3777
 epoch: 85, train_loss: 1.1029, test_loss: 1.0873, test_f1: 0.3819
 epoch: 86, train_loss: 1.1011, test_loss: 1.0853, test_f1: 0.3869
 epoch: 87, train_loss: 1.1020, test_loss: 1.0849, test_f1: 0.3922
 epoch: 88, train_loss: 1.0959, test_loss: 1.0847, test_f1: 0.4016
 epoch: 89, train_loss: 1.0940, test_loss: 1.0832, test_f1: 0.4045
 epoch: 90, train_loss: 1.0904, test_loss: 1.0827, test_f1: 0.4059
 epoch: 91, train_loss: 1.0926, test_loss: 1.0825, test_f1: 0.3878
 epoch: 92, train_loss: 1.0975, test_loss: 1.0823, test_f1: 0.3899
 epoch: 93, train_loss: 1.0939, test_loss: 1.0811, test_f1: 0.3906
 epoch: 94, train_loss: 1.0929, test_loss: 1.0798, test_f1: 0.3909
 epoch: 95, train_loss: 1.0919, test_loss: 1.0785, test_f1: 0.3985
 epoch: 96, train_loss: 1.0806, test_loss: 1.0786, test_f1: 0.4050
 epoch: 97, train_loss: 1.0937, test_loss: 1.0774, test_f1: 0.4081
 epoch: 98, train_loss: 1.0909, test_loss: 1.0768, test_f1: 0.4151
 epoch: 99, train_loss: 1.0915, test_loss: 1.0762, test_f1: 0.4190

Training completed in 447.57 seconds
Best F1: 0.4190 at epoch 99
Mean F1 across iterations: 0.3438  0.0371
========================FINAL RESULTS================================
FEGIN weighted F1: 0.4190  0.0371
python main.py --data ltspice_examples --representation component_pin --model FEGIN --layers 6 --hiddens 16 --batch_size 256 --lr 0.0001 --emb_size 512 --epochs 100 --save_appendix component_pin_L6_H16_BS256_LR0.0001_E512 --no_val
-----



STDERR:
  File "main.py", line 370, in <module>
    main()
  File "main.py", line 254, in main
    dataset = dataset_class(
  File "/home/philip/projects/ltspice_examples_code_repo/Circuit-Completion-Using-GNNs/component_classification_with_link_prediction_head/evaluation/FEGIN/kernel/circuit_datasets.py", line 15, in __init__
    self.data, self.slices = torch.load(self.processed_paths[0])
  File "/home/philip/.local/lib/python3.8/site-packages/torch/serialization.py", line 1040, in load
    warnings.warn(
  File "/usr/lib/python3.8/warnings.py", line 109, in _showwarnmsg
    sw(msg.message, msg.category, msg.filename, msg.lineno,
  File "main.py", line 47, in warn_with_traceback
    traceback.print_stack(file=log)
/home/philip/projects/ltspice_examples_code_repo/Circuit-Completion-Using-GNNs/component_classification_with_link_prediction_head/evaluation/FEGIN/kernel/circuit_datasets.py:15: FutureWarning: You are using `torch.load` with `weights_only=False` (the current default value), which uses the default pickle module implicitly. It is possible to construct malicious pickle data which will execute arbitrary code during unpickling (See https://github.com/pytorch/pytorch/blob/main/SECURITY.md#untrusted-models for more details). In a future release, the default value for `weights_only` will be flipped to `True`. This limits the functions that could be executed during unpickling. Arbitrary objects will no longer be allowed to be loaded via this mode unless they are explicitly allowlisted by the user via `torch.serialization.add_safe_globals`. We recommend you start setting `weights_only=True` for any use case where you don't have full control of the loaded file. Please open an issue on GitHub for any issues related to this experimental feature.
  self.data, self.slices = torch.load(self.processed_paths[0])
