STDOUT:
Results will be saved in /home/philip/projects/ltspice_examples_code_repo/Circuit-Completion-Using-GNNs/component_classification_with_link_prediction_head/evaluation/FEGIN/results/model_FEGIN_dataset_ltspice_demos
Command line input: python main.py --data ltspice_demos --representation component_pin --model FEGIN --layers 3 --hiddens 128 --batch_size 32 --lr 0.001 --emb_size 128 --epochs 100 --save_appendix component_pin_L3_H128_BS32_LR0.001_E128 --no_val
 is saved.
-----
ltspice_demos - FEGIN
Using 3 layers, 128 hidden units, h = 2
Loading component_pin representation dataset
ENTERED
Training FEGIN on component_pin representation
Train: 1565, Test: 383
##################ITERATION #0 ****************************************
 epoch: 0, train_loss: 1.2033, test_loss: 1.2584, test_f1: 0.3523
 epoch: 1, train_loss: 0.9908, test_loss: 1.0947, test_f1: 0.4153
 epoch: 2, train_loss: 0.9168, test_loss: 1.1000, test_f1: 0.4549
 epoch: 3, train_loss: 0.8665, test_loss: 1.2944, test_f1: 0.4898
 epoch: 4, train_loss: 0.8116, test_loss: 1.0714, test_f1: 0.4431
 epoch: 5, train_loss: 0.7750, test_loss: 0.9078, test_f1: 0.6046
 epoch: 6, train_loss: 0.7543, test_loss: 0.9943, test_f1: 0.5798
 epoch: 7, train_loss: 0.7383, test_loss: 0.9746, test_f1: 0.5967
 epoch: 8, train_loss: 0.6911, test_loss: 1.0202, test_f1: 0.6008
 epoch: 9, train_loss: 0.7023, test_loss: 1.0748, test_f1: 0.5613
 epoch: 10, train_loss: 0.6761, test_loss: 1.0224, test_f1: 0.6496
 epoch: 11, train_loss: 0.6741, test_loss: 1.0416, test_f1: 0.5958
 epoch: 12, train_loss: 0.6294, test_loss: 0.9781, test_f1: 0.6474
 epoch: 13, train_loss: 0.6409, test_loss: 1.1821, test_f1: 0.6133
 epoch: 14, train_loss: 0.6075, test_loss: 1.0752, test_f1: 0.6178
 epoch: 15, train_loss: 0.5850, test_loss: 1.0604, test_f1: 0.6346
 epoch: 16, train_loss: 0.5656, test_loss: 1.1678, test_f1: 0.5649
 epoch: 17, train_loss: 0.5650, test_loss: 1.2405, test_f1: 0.5367
 epoch: 18, train_loss: 0.5494, test_loss: 1.0938, test_f1: 0.6402
 epoch: 19, train_loss: 0.5346, test_loss: 1.2343, test_f1: 0.6366
 epoch: 20, train_loss: 0.5274, test_loss: 1.2827, test_f1: 0.5331
 epoch: 21, train_loss: 0.5027, test_loss: 1.2653, test_f1: 0.6376
 epoch: 22, train_loss: 0.5358, test_loss: 1.2431, test_f1: 0.6349
 epoch: 23, train_loss: 0.4662, test_loss: 1.3656, test_f1: 0.6415
 epoch: 24, train_loss: 0.4651, test_loss: 1.4831, test_f1: 0.5602
 epoch: 25, train_loss: 0.4549, test_loss: 1.2740, test_f1: 0.6747
 epoch: 26, train_loss: 0.4922, test_loss: 1.3075, test_f1: 0.6556
 epoch: 27, train_loss: 0.4488, test_loss: 1.3648, test_f1: 0.6418
 epoch: 28, train_loss: 0.4258, test_loss: 1.2820, test_f1: 0.6922
 epoch: 29, train_loss: 0.3952, test_loss: 1.2705, test_f1: 0.6436
 epoch: 30, train_loss: 0.4529, test_loss: 1.3231, test_f1: 0.6207
 epoch: 31, train_loss: 0.3669, test_loss: 1.6215, test_f1: 0.5968
 epoch: 32, train_loss: 0.4025, test_loss: 1.5334, test_f1: 0.6027
 epoch: 33, train_loss: 0.3756, test_loss: 1.5143, test_f1: 0.6540
 epoch: 34, train_loss: 0.3691, test_loss: 1.4033, test_f1: 0.6803
 epoch: 35, train_loss: 0.3428, test_loss: 1.4987, test_f1: 0.6566
 epoch: 36, train_loss: 0.3362, test_loss: 1.4112, test_f1: 0.6658
 epoch: 37, train_loss: 0.3210, test_loss: 1.5543, test_f1: 0.6501
 epoch: 38, train_loss: 0.3357, test_loss: 1.6621, test_f1: 0.6427
 epoch: 39, train_loss: 0.3066, test_loss: 1.7537, test_f1: 0.6689
 epoch: 40, train_loss: 0.3028, test_loss: 1.5282, test_f1: 0.6745
 epoch: 41, train_loss: 0.3475, test_loss: 1.5528, test_f1: 0.6466
 epoch: 42, train_loss: 0.2925, test_loss: 1.7025, test_f1: 0.6594
 epoch: 43, train_loss: 0.2655, test_loss: 1.5798, test_f1: 0.6598
 epoch: 44, train_loss: 0.3139, test_loss: 1.6298, test_f1: 0.6670
 epoch: 45, train_loss: 0.3106, test_loss: 1.5216, test_f1: 0.6542
 epoch: 46, train_loss: 0.3358, test_loss: 1.6359, test_f1: 0.6459
 epoch: 47, train_loss: 0.2643, test_loss: 1.7378, test_f1: 0.6305
 epoch: 48, train_loss: 0.2632, test_loss: 2.0296, test_f1: 0.6448
 epoch: 49, train_loss: 0.2455, test_loss: 1.9420, test_f1: 0.6634
 epoch: 50, train_loss: 0.2724, test_loss: 1.6852, test_f1: 0.6571
 epoch: 51, train_loss: 0.1998, test_loss: 2.0172, test_f1: 0.6480
 epoch: 52, train_loss: 0.1849, test_loss: 1.9255, test_f1: 0.6571
 epoch: 53, train_loss: 0.1832, test_loss: 2.1100, test_f1: 0.6444
 epoch: 54, train_loss: 0.1668, test_loss: 2.0356, test_f1: 0.6582
 epoch: 55, train_loss: 0.1443, test_loss: 2.0816, test_f1: 0.6773
 epoch: 56, train_loss: 0.1671, test_loss: 2.0037, test_f1: 0.6604
 epoch: 57, train_loss: 0.1621, test_loss: 2.1528, test_f1: 0.6391
 epoch: 58, train_loss: 0.1277, test_loss: 2.2172, test_f1: 0.6424
 epoch: 59, train_loss: 0.1503, test_loss: 2.3064, test_f1: 0.6480
 epoch: 60, train_loss: 0.1494, test_loss: 2.2443, test_f1: 0.6674
 epoch: 61, train_loss: 0.1374, test_loss: 2.3283, test_f1: 0.6631
 epoch: 62, train_loss: 0.1490, test_loss: 2.5925, test_f1: 0.6124
 epoch: 63, train_loss: 0.1522, test_loss: 2.5249, test_f1: 0.6272
 epoch: 64, train_loss: 0.1342, test_loss: 2.6608, test_f1: 0.5999
 epoch: 65, train_loss: 0.1306, test_loss: 2.3758, test_f1: 0.6341
 epoch: 66, train_loss: 0.1254, test_loss: 2.3872, test_f1: 0.6425
 epoch: 67, train_loss: 0.1295, test_loss: 2.3745, test_f1: 0.6292
 epoch: 68, train_loss: 0.1466, test_loss: 2.6110, test_f1: 0.6357
 epoch: 69, train_loss: 0.1253, test_loss: 2.6836, test_f1: 0.6333
 epoch: 70, train_loss: 0.1125, test_loss: 2.8181, test_f1: 0.6202
 epoch: 71, train_loss: 0.1302, test_loss: 2.5810, test_f1: 0.6331
 epoch: 72, train_loss: 0.1248, test_loss: 2.7580, test_f1: 0.6436
 epoch: 73, train_loss: 0.1321, test_loss: 2.6594, test_f1: 0.6183
 epoch: 74, train_loss: 0.1207, test_loss: 2.4308, test_f1: 0.6325
 epoch: 75, train_loss: 0.1242, test_loss: 2.3728, test_f1: 0.6470
 epoch: 76, train_loss: 0.1317, test_loss: 2.6381, test_f1: 0.6307
 epoch: 77, train_loss: 0.1455, test_loss: 2.5975, test_f1: 0.6335
 epoch: 78, train_loss: 0.1076, test_loss: 2.6902, test_f1: 0.6408
 epoch: 79, train_loss: 0.1201, test_loss: 2.7484, test_f1: 0.6193
 epoch: 80, train_loss: 0.1135, test_loss: 2.3843, test_f1: 0.6319
 epoch: 81, train_loss: 0.0968, test_loss: 2.8160, test_f1: 0.6190
 epoch: 82, train_loss: 0.0788, test_loss: 2.8682, test_f1: 0.6364
 epoch: 83, train_loss: 0.0845, test_loss: 2.9323, test_f1: 0.6430
 epoch: 84, train_loss: 0.1117, test_loss: 2.9371, test_f1: 0.6232
 epoch: 85, train_loss: 0.1207, test_loss: 2.5318, test_f1: 0.6464
 epoch: 86, train_loss: 0.0983, test_loss: 3.0521, test_f1: 0.6297
 epoch: 87, train_loss: 0.1313, test_loss: 2.9438, test_f1: 0.6198
 epoch: 88, train_loss: 0.1227, test_loss: 2.6930, test_f1: 0.6276
 epoch: 89, train_loss: 0.0941, test_loss: 2.8804, test_f1: 0.6300
 epoch: 90, train_loss: 0.0958, test_loss: 2.9944, test_f1: 0.6529
 epoch: 91, train_loss: 0.0931, test_loss: 2.7762, test_f1: 0.6398
 epoch: 92, train_loss: 0.1062, test_loss: 2.9100, test_f1: 0.5944
 epoch: 93, train_loss: 0.0809, test_loss: 2.9488, test_f1: 0.6207
 epoch: 94, train_loss: 0.0763, test_loss: 2.7993, test_f1: 0.6530
 epoch: 95, train_loss: 0.0952, test_loss: 3.2394, test_f1: 0.6116
 epoch: 96, train_loss: 0.1222, test_loss: 2.9745, test_f1: 0.6342
 epoch: 97, train_loss: 0.1113, test_loss: 2.9808, test_f1: 0.6267
 epoch: 98, train_loss: 0.0785, test_loss: 2.9024, test_f1: 0.6257
 epoch: 99, train_loss: 0.0713, test_loss: 2.9885, test_f1: 0.6365
##################ITERATION #1 ****************************************
 epoch: 0, train_loss: 1.1054, test_loss: 1.1722, test_f1: 0.4661
 epoch: 1, train_loss: 0.9314, test_loss: 1.0088, test_f1: 0.5745
 epoch: 2, train_loss: 0.8441, test_loss: 1.0570, test_f1: 0.5441
 epoch: 3, train_loss: 0.8006, test_loss: 0.9564, test_f1: 0.6311
 epoch: 4, train_loss: 0.7760, test_loss: 1.0907, test_f1: 0.5913
 epoch: 5, train_loss: 0.7560, test_loss: 0.9865, test_f1: 0.6557
 epoch: 6, train_loss: 0.7224, test_loss: 1.0576, test_f1: 0.5684
 epoch: 7, train_loss: 0.7078, test_loss: 1.1154, test_f1: 0.5619
 epoch: 8, train_loss: 0.6798, test_loss: 0.9899, test_f1: 0.5942
 epoch: 9, train_loss: 0.6628, test_loss: 0.9969, test_f1: 0.5627
 epoch: 10, train_loss: 0.6551, test_loss: 1.1178, test_f1: 0.6264
 epoch: 11, train_loss: 0.6372, test_loss: 1.1343, test_f1: 0.5921
 epoch: 12, train_loss: 0.6319, test_loss: 1.0608, test_f1: 0.6544
 epoch: 13, train_loss: 0.5910, test_loss: 1.0318, test_f1: 0.6150
 epoch: 14, train_loss: 0.5749, test_loss: 1.2106, test_f1: 0.6279
 epoch: 15, train_loss: 0.5249, test_loss: 1.1833, test_f1: 0.6809
 epoch: 16, train_loss: 0.5594, test_loss: 1.0599, test_f1: 0.6393
 epoch: 17, train_loss: 0.5326, test_loss: 0.9974, test_f1: 0.6447
 epoch: 18, train_loss: 0.5189, test_loss: 0.9928, test_f1: 0.6533
 epoch: 19, train_loss: 0.4830, test_loss: 1.3128, test_f1: 0.5508
 epoch: 20, train_loss: 0.4791, test_loss: 1.2067, test_f1: 0.6457
 epoch: 21, train_loss: 0.4715, test_loss: 1.2238, test_f1: 0.6069
 epoch: 22, train_loss: 0.4481, test_loss: 1.3001, test_f1: 0.6249
 epoch: 23, train_loss: 0.4225, test_loss: 1.3605, test_f1: 0.6000
 epoch: 24, train_loss: 0.4325, test_loss: 1.3253, test_f1: 0.5948
 epoch: 25, train_loss: 0.4476, test_loss: 1.1907, test_f1: 0.6195
 epoch: 26, train_loss: 0.4012, test_loss: 1.3043, test_f1: 0.6533
 epoch: 27, train_loss: 0.3712, test_loss: 1.4159, test_f1: 0.6125
 epoch: 28, train_loss: 0.3909, test_loss: 1.2526, test_f1: 0.6540
 epoch: 29, train_loss: 0.3902, test_loss: 1.7094, test_f1: 0.6134
 epoch: 30, train_loss: 0.4015, test_loss: 1.1657, test_f1: 0.6472
 epoch: 31, train_loss: 0.3639, test_loss: 1.3704, test_f1: 0.6339
 epoch: 32, train_loss: 0.3670, test_loss: 1.2060, test_f1: 0.6777
 epoch: 33, train_loss: 0.3214, test_loss: 1.7270, test_f1: 0.6278
 epoch: 34, train_loss: 0.3154, test_loss: 1.4368, test_f1: 0.6229
 epoch: 35, train_loss: 0.3021, test_loss: 1.4661, test_f1: 0.6221
 epoch: 36, train_loss: 0.3083, test_loss: 1.7787, test_f1: 0.6106
 epoch: 37, train_loss: 0.3000, test_loss: 1.6889, test_f1: 0.6176
 epoch: 38, train_loss: 0.3020, test_loss: 1.8471, test_f1: 0.6259
 epoch: 39, train_loss: 0.3329, test_loss: 1.5112, test_f1: 0.6668
 epoch: 40, train_loss: 0.2845, test_loss: 1.4930, test_f1: 0.6584
 epoch: 41, train_loss: 0.2553, test_loss: 1.8066, test_f1: 0.6328
 epoch: 42, train_loss: 0.2813, test_loss: 1.5907, test_f1: 0.6226
 epoch: 43, train_loss: 0.2776, test_loss: 1.8475, test_f1: 0.5920
 epoch: 44, train_loss: 0.2480, test_loss: 1.5503, test_f1: 0.6500
 epoch: 45, train_loss: 0.2603, test_loss: 1.8086, test_f1: 0.6309
 epoch: 46, train_loss: 0.2795, test_loss: 1.3621, test_f1: 0.6233
 epoch: 47, train_loss: 0.2506, test_loss: 1.8497, test_f1: 0.6240
 epoch: 48, train_loss: 0.2175, test_loss: 2.0210, test_f1: 0.6023
 epoch: 49, train_loss: 0.2721, test_loss: 1.9504, test_f1: 0.6049
 epoch: 50, train_loss: 0.2404, test_loss: 1.7894, test_f1: 0.6377
 epoch: 51, train_loss: 0.1741, test_loss: 1.6668, test_f1: 0.6523
 epoch: 52, train_loss: 0.1417, test_loss: 2.0950, test_f1: 0.6208
 epoch: 53, train_loss: 0.1374, test_loss: 2.2068, test_f1: 0.6493
 epoch: 54, train_loss: 0.1326, test_loss: 2.2844, test_f1: 0.6245
 epoch: 55, train_loss: 0.1313, test_loss: 2.4833, test_f1: 0.6275
 epoch: 56, train_loss: 0.1326, test_loss: 2.5909, test_f1: 0.5958
 epoch: 57, train_loss: 0.1430, test_loss: 2.3177, test_f1: 0.6212
 epoch: 58, train_loss: 0.1351, test_loss: 2.4094, test_f1: 0.6036
 epoch: 59, train_loss: 0.1465, test_loss: 2.2603, test_f1: 0.6259
 epoch: 60, train_loss: 0.1230, test_loss: 2.2334, test_f1: 0.6405
 epoch: 61, train_loss: 0.1214, test_loss: 2.2531, test_f1: 0.6370
 epoch: 62, train_loss: 0.1331, test_loss: 2.5896, test_f1: 0.6270
 epoch: 63, train_loss: 0.1204, test_loss: 2.4163, test_f1: 0.6540
 epoch: 64, train_loss: 0.1008, test_loss: 2.6330, test_f1: 0.6293
 epoch: 65, train_loss: 0.1101, test_loss: 2.2503, test_f1: 0.6612
 epoch: 66, train_loss: 0.1090, test_loss: 2.5086, test_f1: 0.6559
 epoch: 67, train_loss: 0.1125, test_loss: 2.3928, test_f1: 0.6703
 epoch: 68, train_loss: 0.1197, test_loss: 2.3292, test_f1: 0.6305
 epoch: 69, train_loss: 0.1096, test_loss: 2.7895, test_f1: 0.6160
 epoch: 70, train_loss: 0.1350, test_loss: 2.7621, test_f1: 0.6051
 epoch: 71, train_loss: 0.1240, test_loss: 2.6284, test_f1: 0.6288
 epoch: 72, train_loss: 0.0964, test_loss: 3.0141, test_f1: 0.6189
 epoch: 73, train_loss: 0.1036, test_loss: 2.3291, test_f1: 0.6465
 epoch: 74, train_loss: 0.1611, test_loss: 2.7085, test_f1: 0.6193
 epoch: 75, train_loss: 0.1427, test_loss: 2.6866, test_f1: 0.6068
 epoch: 76, train_loss: 0.1028, test_loss: 2.5108, test_f1: 0.6419
 epoch: 77, train_loss: 0.0847, test_loss: 2.8144, test_f1: 0.5986
 epoch: 78, train_loss: 0.0801, test_loss: 2.8808, test_f1: 0.6080
 epoch: 79, train_loss: 0.0828, test_loss: 3.0094, test_f1: 0.6119
 epoch: 80, train_loss: 0.1093, test_loss: 2.6272, test_f1: 0.6331
 epoch: 81, train_loss: 0.1163, test_loss: 2.7904, test_f1: 0.6023
 epoch: 82, train_loss: 0.0841, test_loss: 2.7934, test_f1: 0.6251
 epoch: 83, train_loss: 0.1273, test_loss: 2.7445, test_f1: 0.6367
 epoch: 84, train_loss: 0.1050, test_loss: 3.2385, test_f1: 0.6073
 epoch: 85, train_loss: 0.0989, test_loss: 2.8564, test_f1: 0.5899
 epoch: 86, train_loss: 0.0734, test_loss: 2.7546, test_f1: 0.6085
 epoch: 87, train_loss: 0.0850, test_loss: 3.2179, test_f1: 0.6248
 epoch: 88, train_loss: 0.0951, test_loss: 2.8915, test_f1: 0.6379
 epoch: 89, train_loss: 0.0835, test_loss: 2.9681, test_f1: 0.6107
 epoch: 90, train_loss: 0.0806, test_loss: 2.7320, test_f1: 0.6275
 epoch: 91, train_loss: 0.0720, test_loss: 2.5503, test_f1: 0.6409
 epoch: 92, train_loss: 0.0997, test_loss: 2.9510, test_f1: 0.6178
 epoch: 93, train_loss: 0.0624, test_loss: 2.9713, test_f1: 0.6323
 epoch: 94, train_loss: 0.1001, test_loss: 3.4451, test_f1: 0.6188
 epoch: 95, train_loss: 0.0846, test_loss: 3.2849, test_f1: 0.5911
 epoch: 96, train_loss: 0.0916, test_loss: 3.6371, test_f1: 0.5895
 epoch: 97, train_loss: 0.1029, test_loss: 3.1965, test_f1: 0.6014
 epoch: 98, train_loss: 0.0950, test_loss: 3.1314, test_f1: 0.6523
 epoch: 99, train_loss: 0.0860, test_loss: 3.3441, test_f1: 0.6308
##################ITERATION #2 ****************************************
 epoch: 0, train_loss: 1.0891, test_loss: 1.2761, test_f1: 0.3880
 epoch: 1, train_loss: 0.8892, test_loss: 0.9733, test_f1: 0.6334
 epoch: 2, train_loss: 0.8225, test_loss: 1.0214, test_f1: 0.5841
 epoch: 3, train_loss: 0.7782, test_loss: 0.9567, test_f1: 0.6126
 epoch: 4, train_loss: 0.7474, test_loss: 1.1609, test_f1: 0.5032
 epoch: 5, train_loss: 0.7183, test_loss: 0.9791, test_f1: 0.6487
 epoch: 6, train_loss: 0.6796, test_loss: 1.1968, test_f1: 0.5170
 epoch: 7, train_loss: 0.6621, test_loss: 1.0340, test_f1: 0.6236
 epoch: 8, train_loss: 0.6162, test_loss: 1.1285, test_f1: 0.6128
 epoch: 9, train_loss: 0.6255, test_loss: 1.1188, test_f1: 0.6302
 epoch: 10, train_loss: 0.6100, test_loss: 1.0237, test_f1: 0.6561
 epoch: 11, train_loss: 0.5725, test_loss: 1.0793, test_f1: 0.6055
 epoch: 12, train_loss: 0.5902, test_loss: 1.0557, test_f1: 0.6061
 epoch: 13, train_loss: 0.5542, test_loss: 1.0815, test_f1: 0.5848
 epoch: 14, train_loss: 0.5584, test_loss: 1.1324, test_f1: 0.6253
 epoch: 15, train_loss: 0.5685, test_loss: 1.0657, test_f1: 0.5412
 epoch: 16, train_loss: 0.5196, test_loss: 1.1313, test_f1: 0.5775
 epoch: 17, train_loss: 0.5257, test_loss: 1.1539, test_f1: 0.6150
 epoch: 18, train_loss: 0.4851, test_loss: 1.2440, test_f1: 0.6129
 epoch: 19, train_loss: 0.5310, test_loss: 1.2203, test_f1: 0.5862
 epoch: 20, train_loss: 0.4800, test_loss: 1.1550, test_f1: 0.6364
 epoch: 21, train_loss: 0.4182, test_loss: 1.2931, test_f1: 0.6120
 epoch: 22, train_loss: 0.4114, test_loss: 1.3412, test_f1: 0.6181
 epoch: 23, train_loss: 0.4484, test_loss: 1.3687, test_f1: 0.5637
 epoch: 24, train_loss: 0.4310, test_loss: 1.3179, test_f1: 0.5843
 epoch: 25, train_loss: 0.4143, test_loss: 1.3535, test_f1: 0.6279
 epoch: 26, train_loss: 0.3898, test_loss: 1.5044, test_f1: 0.6013
 epoch: 27, train_loss: 0.3911, test_loss: 1.3821, test_f1: 0.6544
 epoch: 28, train_loss: 0.3685, test_loss: 1.3779, test_f1: 0.6019
 epoch: 29, train_loss: 0.3822, test_loss: 1.5761, test_f1: 0.5995
 epoch: 30, train_loss: 0.3550, test_loss: 1.4488, test_f1: 0.5939
 epoch: 31, train_loss: 0.3520, test_loss: 1.5022, test_f1: 0.5970
 epoch: 32, train_loss: 0.3499, test_loss: 1.3384, test_f1: 0.6226
 epoch: 33, train_loss: 0.3165, test_loss: 1.6926, test_f1: 0.5630
 epoch: 34, train_loss: 0.3241, test_loss: 1.7137, test_f1: 0.6048
 epoch: 35, train_loss: 0.3597, test_loss: 1.4079, test_f1: 0.6568
 epoch: 36, train_loss: 0.3317, test_loss: 1.4116, test_f1: 0.6499
 epoch: 37, train_loss: 0.2920, test_loss: 1.6363, test_f1: 0.5967
 epoch: 38, train_loss: 0.3217, test_loss: 1.8302, test_f1: 0.5810
 epoch: 39, train_loss: 0.2775, test_loss: 1.6691, test_f1: 0.6224
 epoch: 40, train_loss: 0.2586, test_loss: 1.5605, test_f1: 0.6230
 epoch: 41, train_loss: 0.3111, test_loss: 1.7631, test_f1: 0.6075
 epoch: 42, train_loss: 0.2568, test_loss: 1.7340, test_f1: 0.6270
 epoch: 43, train_loss: 0.2569, test_loss: 1.8310, test_f1: 0.6196
 epoch: 44, train_loss: 0.2503, test_loss: 2.0310, test_f1: 0.6279
 epoch: 45, train_loss: 0.2817, test_loss: 1.8763, test_f1: 0.6221
 epoch: 46, train_loss: 0.2651, test_loss: 1.6449, test_f1: 0.6165
 epoch: 47, train_loss: 0.2391, test_loss: 1.9464, test_f1: 0.6124
 epoch: 48, train_loss: 0.2316, test_loss: 1.7598, test_f1: 0.6515
 epoch: 49, train_loss: 0.2652, test_loss: 1.5858, test_f1: 0.6808
 epoch: 50, train_loss: 0.2393, test_loss: 2.0444, test_f1: 0.6213
 epoch: 51, train_loss: 0.1985, test_loss: 1.9456, test_f1: 0.6227
 epoch: 52, train_loss: 0.1414, test_loss: 2.0736, test_f1: 0.6229
 epoch: 53, train_loss: 0.1575, test_loss: 2.2443, test_f1: 0.6443
 epoch: 54, train_loss: 0.1531, test_loss: 2.2368, test_f1: 0.6205
 epoch: 55, train_loss: 0.1245, test_loss: 2.2232, test_f1: 0.6554
 epoch: 56, train_loss: 0.1549, test_loss: 2.2695, test_f1: 0.6303
 epoch: 57, train_loss: 0.1368, test_loss: 2.2806, test_f1: 0.6408
 epoch: 58, train_loss: 0.1088, test_loss: 2.3384, test_f1: 0.6241
 epoch: 59, train_loss: 0.1316, test_loss: 2.3830, test_f1: 0.6774
 epoch: 60, train_loss: 0.1287, test_loss: 2.4396, test_f1: 0.6307
 epoch: 61, train_loss: 0.1152, test_loss: 2.6034, test_f1: 0.6022
 epoch: 62, train_loss: 0.1395, test_loss: 2.8488, test_f1: 0.5973
 epoch: 63, train_loss: 0.1147, test_loss: 2.7217, test_f1: 0.6372
 epoch: 64, train_loss: 0.1286, test_loss: 2.6428, test_f1: 0.6676
 epoch: 65, train_loss: 0.1303, test_loss: 2.3330, test_f1: 0.6456
 epoch: 66, train_loss: 0.1120, test_loss: 2.7288, test_f1: 0.6140
 epoch: 67, train_loss: 0.0973, test_loss: 2.7275, test_f1: 0.6257
 epoch: 68, train_loss: 0.0922, test_loss: 2.7175, test_f1: 0.6413
 epoch: 69, train_loss: 0.0890, test_loss: 2.7893, test_f1: 0.6307
 epoch: 70, train_loss: 0.0930, test_loss: 2.7976, test_f1: 0.6348
 epoch: 71, train_loss: 0.1244, test_loss: 2.7087, test_f1: 0.6731
 epoch: 72, train_loss: 0.1218, test_loss: 2.5152, test_f1: 0.6849
 epoch: 73, train_loss: 0.1074, test_loss: 2.8384, test_f1: 0.6363
 epoch: 74, train_loss: 0.0911, test_loss: 2.7548, test_f1: 0.6386
 epoch: 75, train_loss: 0.1294, test_loss: 2.6961, test_f1: 0.6075
 epoch: 76, train_loss: 0.1402, test_loss: 2.4476, test_f1: 0.6396
 epoch: 77, train_loss: 0.1115, test_loss: 2.5372, test_f1: 0.6609
 epoch: 78, train_loss: 0.1053, test_loss: 2.7144, test_f1: 0.6115
 epoch: 79, train_loss: 0.1207, test_loss: 2.5317, test_f1: 0.6551
 epoch: 80, train_loss: 0.0964, test_loss: 2.7345, test_f1: 0.5987
 epoch: 81, train_loss: 0.0950, test_loss: 2.7358, test_f1: 0.6294
 epoch: 82, train_loss: 0.0788, test_loss: 2.9985, test_f1: 0.6126
 epoch: 83, train_loss: 0.1203, test_loss: 2.7911, test_f1: 0.6222
 epoch: 84, train_loss: 0.1037, test_loss: 2.8191, test_f1: 0.6148
 epoch: 85, train_loss: 0.0794, test_loss: 2.7771, test_f1: 0.6418
 epoch: 86, train_loss: 0.0996, test_loss: 2.8867, test_f1: 0.6152
 epoch: 87, train_loss: 0.0834, test_loss: 2.9763, test_f1: 0.6563
 epoch: 88, train_loss: 0.0916, test_loss: 2.8134, test_f1: 0.6245
 epoch: 89, train_loss: 0.0868, test_loss: 3.1403, test_f1: 0.6328
 epoch: 90, train_loss: 0.0791, test_loss: 2.8784, test_f1: 0.6104
 epoch: 91, train_loss: 0.0837, test_loss: 2.9994, test_f1: 0.6277
 epoch: 92, train_loss: 0.0860, test_loss: 2.7844, test_f1: 0.6544
 epoch: 93, train_loss: 0.0877, test_loss: 2.9353, test_f1: 0.6446
 epoch: 94, train_loss: 0.0683, test_loss: 2.8588, test_f1: 0.6452
 epoch: 95, train_loss: 0.0622, test_loss: 2.9808, test_f1: 0.6366
 epoch: 96, train_loss: 0.0933, test_loss: 3.2991, test_f1: 0.6355
 epoch: 97, train_loss: 0.0873, test_loss: 2.9817, test_f1: 0.6193
 epoch: 98, train_loss: 0.0783, test_loss: 3.2535, test_f1: 0.6139
 epoch: 99, train_loss: 0.0815, test_loss: 3.0961, test_f1: 0.6507
##################ITERATION #3 ****************************************
 epoch: 0, train_loss: 1.1750, test_loss: 1.4051, test_f1: 0.3430
 epoch: 1, train_loss: 0.9403, test_loss: 1.0419, test_f1: 0.5697
 epoch: 2, train_loss: 0.8641, test_loss: 1.0807, test_f1: 0.5389
 epoch: 3, train_loss: 0.8199, test_loss: 1.3441, test_f1: 0.4957
 epoch: 4, train_loss: 0.7955, test_loss: 0.9412, test_f1: 0.6367
 epoch: 5, train_loss: 0.7598, test_loss: 1.0449, test_f1: 0.5595
 epoch: 6, train_loss: 0.7444, test_loss: 1.1588, test_f1: 0.5090
 epoch: 7, train_loss: 0.7297, test_loss: 1.0342, test_f1: 0.6348
 epoch: 8, train_loss: 0.6791, test_loss: 0.9751, test_f1: 0.6631
 epoch: 9, train_loss: 0.6820, test_loss: 1.1232, test_f1: 0.5937
 epoch: 10, train_loss: 0.6923, test_loss: 1.0445, test_f1: 0.6587
 epoch: 11, train_loss: 0.6743, test_loss: 1.2132, test_f1: 0.5838
 epoch: 12, train_loss: 0.6475, test_loss: 1.1418, test_f1: 0.5501
 epoch: 13, train_loss: 0.6139, test_loss: 0.9986, test_f1: 0.5878
 epoch: 14, train_loss: 0.5907, test_loss: 1.0968, test_f1: 0.6076
 epoch: 15, train_loss: 0.5991, test_loss: 1.0032, test_f1: 0.6420
 epoch: 16, train_loss: 0.6089, test_loss: 1.1962, test_f1: 0.6095
 epoch: 17, train_loss: 0.5896, test_loss: 1.3612, test_f1: 0.5352
 epoch: 18, train_loss: 0.5724, test_loss: 1.0740, test_f1: 0.5587
 epoch: 19, train_loss: 0.5432, test_loss: 1.1477, test_f1: 0.6361
 epoch: 20, train_loss: 0.5402, test_loss: 1.1087, test_f1: 0.6138
 epoch: 21, train_loss: 0.5281, test_loss: 1.2609, test_f1: 0.5758
 epoch: 22, train_loss: 0.5061, test_loss: 1.1595, test_f1: 0.6159
 epoch: 23, train_loss: 0.4742, test_loss: 1.1703, test_f1: 0.6749
 epoch: 24, train_loss: 0.4657, test_loss: 1.3312, test_f1: 0.6165
 epoch: 25, train_loss: 0.4871, test_loss: 1.1457, test_f1: 0.6644
 epoch: 26, train_loss: 0.4387, test_loss: 1.5285, test_f1: 0.5849
 epoch: 27, train_loss: 0.4492, test_loss: 1.4998, test_f1: 0.5963
 epoch: 28, train_loss: 0.4642, test_loss: 1.4804, test_f1: 0.5598
 epoch: 29, train_loss: 0.4275, test_loss: 1.4094, test_f1: 0.5871
 epoch: 30, train_loss: 0.4022, test_loss: 1.4856, test_f1: 0.6202
 epoch: 31, train_loss: 0.4090, test_loss: 1.6373, test_f1: 0.5744
 epoch: 32, train_loss: 0.3897, test_loss: 1.5238, test_f1: 0.6299
 epoch: 33, train_loss: 0.3758, test_loss: 1.2620, test_f1: 0.6712
 epoch: 34, train_loss: 0.4148, test_loss: 1.5264, test_f1: 0.5760
 epoch: 35, train_loss: 0.4073, test_loss: 1.2118, test_f1: 0.6641
 epoch: 36, train_loss: 0.3703, test_loss: 1.3678, test_f1: 0.6309
 epoch: 37, train_loss: 0.3710, test_loss: 1.6730, test_f1: 0.6167
 epoch: 38, train_loss: 0.3518, test_loss: 1.4374, test_f1: 0.6576
 epoch: 39, train_loss: 0.3144, test_loss: 1.3069, test_f1: 0.6509
 epoch: 40, train_loss: 0.3245, test_loss: 1.3139, test_f1: 0.6542
 epoch: 41, train_loss: 0.3265, test_loss: 1.4160, test_f1: 0.6590
 epoch: 42, train_loss: 0.3241, test_loss: 1.5829, test_f1: 0.6292
 epoch: 43, train_loss: 0.2703, test_loss: 1.5178, test_f1: 0.6806
 epoch: 44, train_loss: 0.3087, test_loss: 1.5120, test_f1: 0.6567
 epoch: 45, train_loss: 0.3143, test_loss: 1.6052, test_f1: 0.6234
 epoch: 46, train_loss: 0.2785, test_loss: 1.8912, test_f1: 0.6108
 epoch: 47, train_loss: 0.2681, test_loss: 1.9522, test_f1: 0.6158
 epoch: 48, train_loss: 0.3004, test_loss: 1.7957, test_f1: 0.5684
 epoch: 49, train_loss: 0.2889, test_loss: 1.8512, test_f1: 0.6411
 epoch: 50, train_loss: 0.2934, test_loss: 1.4360, test_f1: 0.6146
 epoch: 51, train_loss: 0.2246, test_loss: 1.8995, test_f1: 0.6556
 epoch: 52, train_loss: 0.2034, test_loss: 1.7212, test_f1: 0.6506
 epoch: 53, train_loss: 0.1798, test_loss: 1.8924, test_f1: 0.6288
 epoch: 54, train_loss: 0.1769, test_loss: 1.9027, test_f1: 0.6409
 epoch: 55, train_loss: 0.1751, test_loss: 2.1151, test_f1: 0.6357
 epoch: 56, train_loss: 0.1518, test_loss: 1.8796, test_f1: 0.6533
 epoch: 57, train_loss: 0.1847, test_loss: 1.8955, test_f1: 0.6274
 epoch: 58, train_loss: 0.1798, test_loss: 2.0322, test_f1: 0.6222
 epoch: 59, train_loss: 0.1699, test_loss: 2.0139, test_f1: 0.6157
 epoch: 60, train_loss: 0.1702, test_loss: 2.2277, test_f1: 0.6092
 epoch: 61, train_loss: 0.1792, test_loss: 2.0407, test_f1: 0.6114
 epoch: 62, train_loss: 0.1517, test_loss: 2.1932, test_f1: 0.6316
 epoch: 63, train_loss: 0.1396, test_loss: 2.0009, test_f1: 0.6372
 epoch: 64, train_loss: 0.1309, test_loss: 2.1735, test_f1: 0.6388
 epoch: 65, train_loss: 0.1360, test_loss: 2.2428, test_f1: 0.6163
 epoch: 66, train_loss: 0.1498, test_loss: 2.2723, test_f1: 0.6513
 epoch: 67, train_loss: 0.1238, test_loss: 2.2613, test_f1: 0.6645
 epoch: 68, train_loss: 0.1700, test_loss: 2.2707, test_f1: 0.6417
 epoch: 69, train_loss: 0.1716, test_loss: 2.3478, test_f1: 0.6179
 epoch: 70, train_loss: 0.1691, test_loss: 2.1532, test_f1: 0.6599
 epoch: 71, train_loss: 0.1136, test_loss: 2.2180, test_f1: 0.6527
 epoch: 72, train_loss: 0.1244, test_loss: 2.4127, test_f1: 0.6386
 epoch: 73, train_loss: 0.1272, test_loss: 2.3311, test_f1: 0.6435
 epoch: 74, train_loss: 0.1245, test_loss: 2.2728, test_f1: 0.6428
 epoch: 75, train_loss: 0.1390, test_loss: 2.2510, test_f1: 0.6452
 epoch: 76, train_loss: 0.1659, test_loss: 2.2368, test_f1: 0.6232
 epoch: 77, train_loss: 0.1163, test_loss: 2.4780, test_f1: 0.6251
 epoch: 78, train_loss: 0.0995, test_loss: 2.3298, test_f1: 0.6446
 epoch: 79, train_loss: 0.1279, test_loss: 2.2655, test_f1: 0.6474
 epoch: 80, train_loss: 0.0953, test_loss: 2.4460, test_f1: 0.6392
 epoch: 81, train_loss: 0.1093, test_loss: 2.4134, test_f1: 0.6781
 epoch: 82, train_loss: 0.1017, test_loss: 2.4192, test_f1: 0.6622
 epoch: 83, train_loss: 0.1228, test_loss: 2.6449, test_f1: 0.6160
 epoch: 84, train_loss: 0.1159, test_loss: 2.6422, test_f1: 0.6125
 epoch: 85, train_loss: 0.1380, test_loss: 2.3385, test_f1: 0.6458
 epoch: 86, train_loss: 0.1325, test_loss: 2.3758, test_f1: 0.6909
 epoch: 87, train_loss: 0.1157, test_loss: 2.5446, test_f1: 0.6627
 epoch: 88, train_loss: 0.0843, test_loss: 2.6646, test_f1: 0.6121
 epoch: 89, train_loss: 0.1301, test_loss: 2.4468, test_f1: 0.6252
 epoch: 90, train_loss: 0.1136, test_loss: 2.6271, test_f1: 0.6242
 epoch: 91, train_loss: 0.1000, test_loss: 2.6355, test_f1: 0.6268
 epoch: 92, train_loss: 0.1020, test_loss: 2.6713, test_f1: 0.6304
 epoch: 93, train_loss: 0.1307, test_loss: 2.5951, test_f1: 0.6084
 epoch: 94, train_loss: 0.1014, test_loss: 2.6126, test_f1: 0.6143
 epoch: 95, train_loss: 0.1269, test_loss: 2.4179, test_f1: 0.5865
 epoch: 96, train_loss: 0.1321, test_loss: 2.6184, test_f1: 0.6217
 epoch: 97, train_loss: 0.1148, test_loss: 2.4019, test_f1: 0.6558
 epoch: 98, train_loss: 0.1398, test_loss: 2.4645, test_f1: 0.6412
 epoch: 99, train_loss: 0.1196, test_loss: 2.4127, test_f1: 0.6446
##################ITERATION #4 ****************************************
 epoch: 0, train_loss: 1.1365, test_loss: 1.2540, test_f1: 0.4275
 epoch: 1, train_loss: 0.9324, test_loss: 0.9894, test_f1: 0.6097
 epoch: 2, train_loss: 0.8525, test_loss: 0.9826, test_f1: 0.6265
 epoch: 3, train_loss: 0.8123, test_loss: 1.0970, test_f1: 0.5303
 epoch: 4, train_loss: 0.7899, test_loss: 0.9647, test_f1: 0.6076
 epoch: 5, train_loss: 0.7723, test_loss: 0.9965, test_f1: 0.6029
 epoch: 6, train_loss: 0.7462, test_loss: 0.9235, test_f1: 0.5955
 epoch: 7, train_loss: 0.7296, test_loss: 0.9884, test_f1: 0.5902
 epoch: 8, train_loss: 0.7048, test_loss: 1.1099, test_f1: 0.6020
 epoch: 9, train_loss: 0.7139, test_loss: 1.1725, test_f1: 0.4953
 epoch: 10, train_loss: 0.6826, test_loss: 1.0158, test_f1: 0.6109
 epoch: 11, train_loss: 0.6486, test_loss: 0.9752, test_f1: 0.6602
 epoch: 12, train_loss: 0.6198, test_loss: 0.9587, test_f1: 0.6279
 epoch: 13, train_loss: 0.6886, test_loss: 0.9438, test_f1: 0.5844
 epoch: 14, train_loss: 0.6073, test_loss: 1.0672, test_f1: 0.6057
 epoch: 15, train_loss: 0.5992, test_loss: 1.0908, test_f1: 0.5949
 epoch: 16, train_loss: 0.5789, test_loss: 1.1391, test_f1: 0.5936
 epoch: 17, train_loss: 0.5805, test_loss: 1.1873, test_f1: 0.5453
 epoch: 18, train_loss: 0.5598, test_loss: 1.3451, test_f1: 0.5227
 epoch: 19, train_loss: 0.5436, test_loss: 1.1829, test_f1: 0.6519
 epoch: 20, train_loss: 0.4971, test_loss: 1.1226, test_f1: 0.6190
 epoch: 21, train_loss: 0.4939, test_loss: 1.5333, test_f1: 0.5460
 epoch: 22, train_loss: 0.4897, test_loss: 1.2385, test_f1: 0.6116
 epoch: 23, train_loss: 0.5074, test_loss: 1.2024, test_f1: 0.6585
 epoch: 24, train_loss: 0.4920, test_loss: 1.4716, test_f1: 0.5628
 epoch: 25, train_loss: 0.4646, test_loss: 1.4221, test_f1: 0.5655
 epoch: 26, train_loss: 0.4638, test_loss: 1.2448, test_f1: 0.5754
 epoch: 27, train_loss: 0.4529, test_loss: 1.1973, test_f1: 0.6609
 epoch: 28, train_loss: 0.4126, test_loss: 1.4465, test_f1: 0.5914
 epoch: 29, train_loss: 0.4181, test_loss: 1.5256, test_f1: 0.5822
 epoch: 30, train_loss: 0.3934, test_loss: 1.2545, test_f1: 0.6457
 epoch: 31, train_loss: 0.3654, test_loss: 1.6885, test_f1: 0.5744
 epoch: 32, train_loss: 0.4194, test_loss: 1.6540, test_f1: 0.5997
 epoch: 33, train_loss: 0.4080, test_loss: 1.5697, test_f1: 0.6126
 epoch: 34, train_loss: 0.4076, test_loss: 1.4384, test_f1: 0.5982
 epoch: 35, train_loss: 0.3878, test_loss: 1.4189, test_f1: 0.6489
 epoch: 36, train_loss: 0.3395, test_loss: 1.7255, test_f1: 0.6188
 epoch: 37, train_loss: 0.3445, test_loss: 1.7189, test_f1: 0.6051
 epoch: 38, train_loss: 0.3135, test_loss: 1.4760, test_f1: 0.5990
 epoch: 39, train_loss: 0.3452, test_loss: 1.7503, test_f1: 0.5720
 epoch: 40, train_loss: 0.3170, test_loss: 1.3730, test_f1: 0.6069
 epoch: 41, train_loss: 0.3423, test_loss: 1.4436, test_f1: 0.5782
 epoch: 42, train_loss: 0.2962, test_loss: 1.6087, test_f1: 0.6126
 epoch: 43, train_loss: 0.3104, test_loss: 1.6630, test_f1: 0.6070
 epoch: 44, train_loss: 0.2897, test_loss: 1.7966, test_f1: 0.5892
 epoch: 45, train_loss: 0.3093, test_loss: 1.9592, test_f1: 0.5456
 epoch: 46, train_loss: 0.2719, test_loss: 1.8565, test_f1: 0.6288
 epoch: 47, train_loss: 0.2654, test_loss: 2.2459, test_f1: 0.5669
 epoch: 48, train_loss: 0.2546, test_loss: 1.8128, test_f1: 0.6191
 epoch: 49, train_loss: 0.2507, test_loss: 1.9167, test_f1: 0.6404
 epoch: 50, train_loss: 0.2295, test_loss: 2.2773, test_f1: 0.5736
 epoch: 51, train_loss: 0.2210, test_loss: 2.1972, test_f1: 0.5867
 epoch: 52, train_loss: 0.1863, test_loss: 2.0089, test_f1: 0.6391
 epoch: 53, train_loss: 0.1880, test_loss: 2.1467, test_f1: 0.6162
 epoch: 54, train_loss: 0.1742, test_loss: 2.2099, test_f1: 0.6071
 epoch: 55, train_loss: 0.1613, test_loss: 2.2297, test_f1: 0.6149
 epoch: 56, train_loss: 0.1498, test_loss: 2.2466, test_f1: 0.6476
 epoch: 57, train_loss: 0.1839, test_loss: 2.1193, test_f1: 0.6155
 epoch: 58, train_loss: 0.1530, test_loss: 2.4652, test_f1: 0.6210
 epoch: 59, train_loss: 0.1599, test_loss: 2.2740, test_f1: 0.6232
 epoch: 60, train_loss: 0.1421, test_loss: 2.6022, test_f1: 0.5730
 epoch: 61, train_loss: 0.1424, test_loss: 2.3226, test_f1: 0.6463
 epoch: 62, train_loss: 0.1367, test_loss: 2.4842, test_f1: 0.5995
 epoch: 63, train_loss: 0.1336, test_loss: 2.8932, test_f1: 0.5678
 epoch: 64, train_loss: 0.1252, test_loss: 2.4980, test_f1: 0.6402
 epoch: 65, train_loss: 0.1494, test_loss: 2.6262, test_f1: 0.5886
 epoch: 66, train_loss: 0.1419, test_loss: 2.6130, test_f1: 0.6129
 epoch: 67, train_loss: 0.1259, test_loss: 2.6948, test_f1: 0.5908
 epoch: 68, train_loss: 0.1447, test_loss: 2.6549, test_f1: 0.6074
 epoch: 69, train_loss: 0.1295, test_loss: 2.6387, test_f1: 0.5857
 epoch: 70, train_loss: 0.1272, test_loss: 2.4762, test_f1: 0.6220
 epoch: 71, train_loss: 0.1484, test_loss: 2.8145, test_f1: 0.6237
 epoch: 72, train_loss: 0.1352, test_loss: 2.4957, test_f1: 0.6150
 epoch: 73, train_loss: 0.1444, test_loss: 2.7396, test_f1: 0.6003
 epoch: 74, train_loss: 0.1309, test_loss: 2.8090, test_f1: 0.5740
 epoch: 75, train_loss: 0.1076, test_loss: 2.7011, test_f1: 0.6103
 epoch: 76, train_loss: 0.1078, test_loss: 2.9532, test_f1: 0.5825
 epoch: 77, train_loss: 0.1106, test_loss: 2.5625, test_f1: 0.6231
 epoch: 78, train_loss: 0.1202, test_loss: 2.5308, test_f1: 0.6078
 epoch: 79, train_loss: 0.1121, test_loss: 2.6031, test_f1: 0.6176
 epoch: 80, train_loss: 0.1160, test_loss: 2.8080, test_f1: 0.6048
 epoch: 81, train_loss: 0.1200, test_loss: 3.0170, test_f1: 0.5802
 epoch: 82, train_loss: 0.1140, test_loss: 2.8498, test_f1: 0.6330
 epoch: 83, train_loss: 0.1402, test_loss: 3.1085, test_f1: 0.6212
 epoch: 84, train_loss: 0.1219, test_loss: 2.8277, test_f1: 0.6153
 epoch: 85, train_loss: 0.1143, test_loss: 2.8971, test_f1: 0.5824
 epoch: 86, train_loss: 0.0927, test_loss: 2.8438, test_f1: 0.6078
 epoch: 87, train_loss: 0.0863, test_loss: 2.6332, test_f1: 0.6124
 epoch: 88, train_loss: 0.0817, test_loss: 2.9042, test_f1: 0.6166
 epoch: 89, train_loss: 0.0939, test_loss: 2.8808, test_f1: 0.6261
 epoch: 90, train_loss: 0.0953, test_loss: 2.9829, test_f1: 0.6030
 epoch: 91, train_loss: 0.1094, test_loss: 3.0854, test_f1: 0.6188
 epoch: 92, train_loss: 0.1268, test_loss: 2.7885, test_f1: 0.5984
 epoch: 93, train_loss: 0.1194, test_loss: 2.8362, test_f1: 0.6271
 epoch: 94, train_loss: 0.1221, test_loss: 2.8369, test_f1: 0.6760
 epoch: 95, train_loss: 0.0988, test_loss: 2.9996, test_f1: 0.6383
 epoch: 96, train_loss: 0.1391, test_loss: 2.7321, test_f1: 0.6258
 epoch: 97, train_loss: 0.1033, test_loss: 2.8269, test_f1: 0.6121
 epoch: 98, train_loss: 0.0818, test_loss: 2.9614, test_f1: 0.6138
 epoch: 99, train_loss: 0.1077, test_loss: 2.8367, test_f1: 0.6118
##################ITERATION #5 ****************************************
 epoch: 0, train_loss: 1.2177, test_loss: 1.2528, test_f1: 0.4611
 epoch: 1, train_loss: 0.9415, test_loss: 1.0411, test_f1: 0.5550
 epoch: 2, train_loss: 0.8743, test_loss: 1.0012, test_f1: 0.6000
 epoch: 3, train_loss: 0.8301, test_loss: 0.9879, test_f1: 0.5442
 epoch: 4, train_loss: 0.8052, test_loss: 1.0202, test_f1: 0.6150
 epoch: 5, train_loss: 0.7877, test_loss: 0.9361, test_f1: 0.5897
 epoch: 6, train_loss: 0.7455, test_loss: 0.9504, test_f1: 0.5920
 epoch: 7, train_loss: 0.7511, test_loss: 1.2594, test_f1: 0.4982
 epoch: 8, train_loss: 0.6954, test_loss: 0.9335, test_f1: 0.6098
 epoch: 9, train_loss: 0.7149, test_loss: 1.0035, test_f1: 0.5547
 epoch: 10, train_loss: 0.7152, test_loss: 1.0305, test_f1: 0.6285
 epoch: 11, train_loss: 0.6603, test_loss: 0.9342, test_f1: 0.6605
 epoch: 12, train_loss: 0.6664, test_loss: 0.8916, test_f1: 0.6504
 epoch: 13, train_loss: 0.6553, test_loss: 1.2926, test_f1: 0.6495
 epoch: 14, train_loss: 0.6202, test_loss: 0.9428, test_f1: 0.6531
 epoch: 15, train_loss: 0.6332, test_loss: 1.1094, test_f1: 0.5284
 epoch: 16, train_loss: 0.5982, test_loss: 1.1610, test_f1: 0.6300
 epoch: 17, train_loss: 0.5729, test_loss: 0.9834, test_f1: 0.6701
 epoch: 18, train_loss: 0.5894, test_loss: 1.1757, test_f1: 0.5654
 epoch: 19, train_loss: 0.5735, test_loss: 0.8884, test_f1: 0.6702
 epoch: 20, train_loss: 0.5718, test_loss: 1.0106, test_f1: 0.6066
 epoch: 21, train_loss: 0.5647, test_loss: 1.2202, test_f1: 0.6059
 epoch: 22, train_loss: 0.5426, test_loss: 0.9404, test_f1: 0.6898
 epoch: 23, train_loss: 0.5565, test_loss: 1.2128, test_f1: 0.5946
 epoch: 24, train_loss: 0.5321, test_loss: 1.0197, test_f1: 0.6260
 epoch: 25, train_loss: 0.5075, test_loss: 1.0850, test_f1: 0.6474
 epoch: 26, train_loss: 0.4838, test_loss: 1.3328, test_f1: 0.6043
 epoch: 27, train_loss: 0.4930, test_loss: 1.1383, test_f1: 0.6542
 epoch: 28, train_loss: 0.4908, test_loss: 1.3806, test_f1: 0.6481
 epoch: 29, train_loss: 0.4913, test_loss: 1.3322, test_f1: 0.6490
 epoch: 30, train_loss: 0.4390, test_loss: 1.3024, test_f1: 0.6043
 epoch: 31, train_loss: 0.4524, test_loss: 1.1737, test_f1: 0.5976
 epoch: 32, train_loss: 0.4530, test_loss: 1.5949, test_f1: 0.6030
 epoch: 33, train_loss: 0.4016, test_loss: 1.2401, test_f1: 0.6414
 epoch: 34, train_loss: 0.4017, test_loss: 1.3939, test_f1: 0.6190
 epoch: 35, train_loss: 0.4226, test_loss: 1.2358, test_f1: 0.6541
 epoch: 36, train_loss: 0.4157, test_loss: 1.4198, test_f1: 0.6129
 epoch: 37, train_loss: 0.3935, test_loss: 1.6283, test_f1: 0.6147
 epoch: 38, train_loss: 0.3931, test_loss: 1.4097, test_f1: 0.6393
 epoch: 39, train_loss: 0.3686, test_loss: 1.4091, test_f1: 0.5990
 epoch: 40, train_loss: 0.3861, test_loss: 1.2951, test_f1: 0.6287
 epoch: 41, train_loss: 0.3496, test_loss: 1.3005, test_f1: 0.6415
 epoch: 42, train_loss: 0.3780, test_loss: 1.6646, test_f1: 0.6362
 epoch: 43, train_loss: 0.3594, test_loss: 1.5220, test_f1: 0.5776
 epoch: 44, train_loss: 0.3210, test_loss: 1.4405, test_f1: 0.6425
 epoch: 45, train_loss: 0.3291, test_loss: 1.5820, test_f1: 0.6386
 epoch: 46, train_loss: 0.2980, test_loss: 1.4051, test_f1: 0.6387
 epoch: 47, train_loss: 0.2926, test_loss: 1.5995, test_f1: 0.6212
 epoch: 48, train_loss: 0.2853, test_loss: 1.7250, test_f1: 0.6242
 epoch: 49, train_loss: 0.2738, test_loss: 1.7147, test_f1: 0.6361
 epoch: 50, train_loss: 0.2750, test_loss: 1.7319, test_f1: 0.5998
 epoch: 51, train_loss: 0.2160, test_loss: 1.8362, test_f1: 0.6226
 epoch: 52, train_loss: 0.2333, test_loss: 1.8700, test_f1: 0.6093
 epoch: 53, train_loss: 0.2008, test_loss: 1.8908, test_f1: 0.6251
 epoch: 54, train_loss: 0.1792, test_loss: 1.7951, test_f1: 0.6341
 epoch: 55, train_loss: 0.1889, test_loss: 1.8681, test_f1: 0.6575
 epoch: 56, train_loss: 0.1838, test_loss: 1.8363, test_f1: 0.6523
 epoch: 57, train_loss: 0.1678, test_loss: 2.1429, test_f1: 0.6330
 epoch: 58, train_loss: 0.1517, test_loss: 2.0370, test_f1: 0.6461
 epoch: 59, train_loss: 0.1936, test_loss: 1.9331, test_f1: 0.6236
 epoch: 60, train_loss: 0.1977, test_loss: 1.9143, test_f1: 0.6389
 epoch: 61, train_loss: 0.1667, test_loss: 2.1274, test_f1: 0.6138
 epoch: 62, train_loss: 0.1662, test_loss: 1.8687, test_f1: 0.6624
 epoch: 63, train_loss: 0.1816, test_loss: 2.1208, test_f1: 0.6231
 epoch: 64, train_loss: 0.1655, test_loss: 2.1877, test_f1: 0.6361
 epoch: 65, train_loss: 0.1606, test_loss: 2.1737, test_f1: 0.6247
 epoch: 66, train_loss: 0.1492, test_loss: 2.1675, test_f1: 0.6248
 epoch: 67, train_loss: 0.1647, test_loss: 2.2937, test_f1: 0.6124
 epoch: 68, train_loss: 0.1447, test_loss: 2.2839, test_f1: 0.6281
 epoch: 69, train_loss: 0.1596, test_loss: 2.1847, test_f1: 0.6303
 epoch: 70, train_loss: 0.1565, test_loss: 2.0433, test_f1: 0.6462
 epoch: 71, train_loss: 0.1619, test_loss: 2.4988, test_f1: 0.6030
 epoch: 72, train_loss: 0.1607, test_loss: 2.3889, test_f1: 0.6178
 epoch: 73, train_loss: 0.1447, test_loss: 2.5123, test_f1: 0.6434
 epoch: 74, train_loss: 0.1525, test_loss: 2.5963, test_f1: 0.6247
 epoch: 75, train_loss: 0.1174, test_loss: 2.5620, test_f1: 0.6015
 epoch: 76, train_loss: 0.1203, test_loss: 2.7714, test_f1: 0.6236
 epoch: 77, train_loss: 0.1268, test_loss: 2.7535, test_f1: 0.6113
 epoch: 78, train_loss: 0.1137, test_loss: 2.6776, test_f1: 0.6256
 epoch: 79, train_loss: 0.1029, test_loss: 2.5886, test_f1: 0.6198
 epoch: 80, train_loss: 0.1420, test_loss: 2.2666, test_f1: 0.6441
 epoch: 81, train_loss: 0.1145, test_loss: 2.4450, test_f1: 0.6304
 epoch: 82, train_loss: 0.1210, test_loss: 2.7982, test_f1: 0.6010
 epoch: 83, train_loss: 0.1126, test_loss: 2.6692, test_f1: 0.6277
 epoch: 84, train_loss: 0.1182, test_loss: 2.7689, test_f1: 0.6068
 epoch: 85, train_loss: 0.1038, test_loss: 2.7722, test_f1: 0.6206
 epoch: 86, train_loss: 0.1192, test_loss: 2.6696, test_f1: 0.6192
 epoch: 87, train_loss: 0.1090, test_loss: 2.7889, test_f1: 0.6058
 epoch: 88, train_loss: 0.0989, test_loss: 2.6419, test_f1: 0.6405
 epoch: 89, train_loss: 0.1301, test_loss: 2.6407, test_f1: 0.6225
 epoch: 90, train_loss: 0.1058, test_loss: 2.5934, test_f1: 0.6492
 epoch: 91, train_loss: 0.1012, test_loss: 2.7027, test_f1: 0.6458
 epoch: 92, train_loss: 0.0996, test_loss: 2.6143, test_f1: 0.6124
 epoch: 93, train_loss: 0.1131, test_loss: 2.9828, test_f1: 0.6197
 epoch: 94, train_loss: 0.1131, test_loss: 2.9070, test_f1: 0.6225
 epoch: 95, train_loss: 0.1201, test_loss: 2.6905, test_f1: 0.6350
 epoch: 96, train_loss: 0.1289, test_loss: 2.7441, test_f1: 0.6165
 epoch: 97, train_loss: 0.1015, test_loss: 2.7011, test_f1: 0.6280
 epoch: 98, train_loss: 0.1090, test_loss: 2.6103, test_f1: 0.6292
 epoch: 99, train_loss: 0.1030, test_loss: 2.8899, test_f1: 0.6043
##################ITERATION #6 ****************************************
 epoch: 0, train_loss: 1.2026, test_loss: 1.2766, test_f1: 0.5558
 epoch: 1, train_loss: 0.9722, test_loss: 1.1046, test_f1: 0.5240
 epoch: 2, train_loss: 0.8652, test_loss: 1.0478, test_f1: 0.5506
 epoch: 3, train_loss: 0.8061, test_loss: 1.0480, test_f1: 0.5659
 epoch: 4, train_loss: 0.8162, test_loss: 1.6445, test_f1: 0.4431
 epoch: 5, train_loss: 0.7692, test_loss: 0.9562, test_f1: 0.5839
 epoch: 6, train_loss: 0.7699, test_loss: 1.0751, test_f1: 0.4674
 epoch: 7, train_loss: 0.7343, test_loss: 1.0405, test_f1: 0.6189
 epoch: 8, train_loss: 0.7063, test_loss: 0.9744, test_f1: 0.6063
 epoch: 9, train_loss: 0.6942, test_loss: 0.9806, test_f1: 0.6053
 epoch: 10, train_loss: 0.6718, test_loss: 1.0246, test_f1: 0.6006
 epoch: 11, train_loss: 0.6586, test_loss: 1.1362, test_f1: 0.5296
 epoch: 12, train_loss: 0.6441, test_loss: 1.2079, test_f1: 0.4852
 epoch: 13, train_loss: 0.6199, test_loss: 0.9992, test_f1: 0.6109
 epoch: 14, train_loss: 0.6222, test_loss: 0.9974, test_f1: 0.5930
 epoch: 15, train_loss: 0.6134, test_loss: 1.0932, test_f1: 0.5456
 epoch: 16, train_loss: 0.5965, test_loss: 1.0425, test_f1: 0.6019
 epoch: 17, train_loss: 0.6075, test_loss: 1.2650, test_f1: 0.5805
 epoch: 18, train_loss: 0.5798, test_loss: 1.3517, test_f1: 0.5859
 epoch: 19, train_loss: 0.5847, test_loss: 1.4197, test_f1: 0.5025
 epoch: 20, train_loss: 0.5609, test_loss: 1.0863, test_f1: 0.5856
 epoch: 21, train_loss: 0.5293, test_loss: 1.2933, test_f1: 0.5760
 epoch: 22, train_loss: 0.5318, test_loss: 1.1515, test_f1: 0.5801
 epoch: 23, train_loss: 0.5495, test_loss: 1.5615, test_f1: 0.5554
 epoch: 24, train_loss: 0.5222, test_loss: 1.1859, test_f1: 0.5550
 epoch: 25, train_loss: 0.5193, test_loss: 1.1891, test_f1: 0.5443
 epoch: 26, train_loss: 0.4962, test_loss: 1.2073, test_f1: 0.5842
 epoch: 27, train_loss: 0.4584, test_loss: 1.1378, test_f1: 0.6331
 epoch: 28, train_loss: 0.4639, test_loss: 1.2667, test_f1: 0.6232
 epoch: 29, train_loss: 0.4996, test_loss: 1.3739, test_f1: 0.5610
 epoch: 30, train_loss: 0.4592, test_loss: 1.2761, test_f1: 0.6152
 epoch: 31, train_loss: 0.4240, test_loss: 1.2197, test_f1: 0.6436
 epoch: 32, train_loss: 0.4478, test_loss: 1.2297, test_f1: 0.6311
 epoch: 33, train_loss: 0.4271, test_loss: 1.3340, test_f1: 0.5616
 epoch: 34, train_loss: 0.3997, test_loss: 1.2619, test_f1: 0.6059
 epoch: 35, train_loss: 0.3892, test_loss: 1.3189, test_f1: 0.6198
 epoch: 36, train_loss: 0.3541, test_loss: 1.4571, test_f1: 0.5840
 epoch: 37, train_loss: 0.3980, test_loss: 1.6744, test_f1: 0.5500
 epoch: 38, train_loss: 0.3783, test_loss: 1.6645, test_f1: 0.5818
 epoch: 39, train_loss: 0.3657, test_loss: 1.5386, test_f1: 0.5863
 epoch: 40, train_loss: 0.3607, test_loss: 1.2907, test_f1: 0.6382
 epoch: 41, train_loss: 0.3689, test_loss: 1.6341, test_f1: 0.6128
 epoch: 42, train_loss: 0.3295, test_loss: 1.5306, test_f1: 0.6215
 epoch: 43, train_loss: 0.3307, test_loss: 1.4773, test_f1: 0.6336
 epoch: 44, train_loss: 0.3302, test_loss: 1.3196, test_f1: 0.6376
 epoch: 45, train_loss: 0.3022, test_loss: 1.4379, test_f1: 0.6244
 epoch: 46, train_loss: 0.2754, test_loss: 1.7341, test_f1: 0.5950
 epoch: 47, train_loss: 0.3054, test_loss: 1.6734, test_f1: 0.6115
 epoch: 48, train_loss: 0.3024, test_loss: 1.5478, test_f1: 0.6351
 epoch: 49, train_loss: 0.2982, test_loss: 1.5981, test_f1: 0.6248
 epoch: 50, train_loss: 0.2897, test_loss: 1.6638, test_f1: 0.6102
 epoch: 51, train_loss: 0.2240, test_loss: 1.7252, test_f1: 0.6104
 epoch: 52, train_loss: 0.2104, test_loss: 1.9351, test_f1: 0.6213
 epoch: 53, train_loss: 0.1935, test_loss: 1.7602, test_f1: 0.6280
 epoch: 54, train_loss: 0.1756, test_loss: 1.9177, test_f1: 0.6090
 epoch: 55, train_loss: 0.1924, test_loss: 2.0697, test_f1: 0.6263
 epoch: 56, train_loss: 0.1646, test_loss: 2.0585, test_f1: 0.6389
 epoch: 57, train_loss: 0.1977, test_loss: 1.9954, test_f1: 0.6286
 epoch: 58, train_loss: 0.1893, test_loss: 2.0007, test_f1: 0.6098
 epoch: 59, train_loss: 0.1635, test_loss: 1.9197, test_f1: 0.5972
 epoch: 60, train_loss: 0.1520, test_loss: 1.8806, test_f1: 0.6279
 epoch: 61, train_loss: 0.1658, test_loss: 2.1847, test_f1: 0.6122
 epoch: 62, train_loss: 0.1434, test_loss: 2.2831, test_f1: 0.6104
 epoch: 63, train_loss: 0.1617, test_loss: 2.1260, test_f1: 0.6295
 epoch: 64, train_loss: 0.1980, test_loss: 2.0253, test_f1: 0.6348
 epoch: 65, train_loss: 0.1591, test_loss: 2.1277, test_f1: 0.5919
 epoch: 66, train_loss: 0.1787, test_loss: 2.1156, test_f1: 0.6217
 epoch: 67, train_loss: 0.1726, test_loss: 1.9707, test_f1: 0.6038
 epoch: 68, train_loss: 0.1357, test_loss: 2.4046, test_f1: 0.6127
 epoch: 69, train_loss: 0.1618, test_loss: 2.1841, test_f1: 0.6125
 epoch: 70, train_loss: 0.1661, test_loss: 2.0330, test_f1: 0.6281
 epoch: 71, train_loss: 0.1321, test_loss: 2.3835, test_f1: 0.6267
 epoch: 72, train_loss: 0.1675, test_loss: 1.9985, test_f1: 0.6429
 epoch: 73, train_loss: 0.1233, test_loss: 2.2697, test_f1: 0.6285
 epoch: 74, train_loss: 0.1495, test_loss: 2.1786, test_f1: 0.6308
 epoch: 75, train_loss: 0.1436, test_loss: 2.1922, test_f1: 0.6366
 epoch: 76, train_loss: 0.1271, test_loss: 2.3922, test_f1: 0.6105
 epoch: 77, train_loss: 0.1193, test_loss: 2.3418, test_f1: 0.6223
 epoch: 78, train_loss: 0.1167, test_loss: 2.2767, test_f1: 0.6081
 epoch: 79, train_loss: 0.1201, test_loss: 2.2962, test_f1: 0.6149
 epoch: 80, train_loss: 0.1240, test_loss: 2.1251, test_f1: 0.6581
 epoch: 81, train_loss: 0.1302, test_loss: 2.3010, test_f1: 0.6060
 epoch: 82, train_loss: 0.1133, test_loss: 2.1971, test_f1: 0.6383
 epoch: 83, train_loss: 0.0948, test_loss: 2.3774, test_f1: 0.6045
 epoch: 84, train_loss: 0.1280, test_loss: 2.3960, test_f1: 0.6328
 epoch: 85, train_loss: 0.1257, test_loss: 2.2179, test_f1: 0.6423
 epoch: 86, train_loss: 0.1395, test_loss: 2.4402, test_f1: 0.5930
 epoch: 87, train_loss: 0.1094, test_loss: 2.3467, test_f1: 0.5949
 epoch: 88, train_loss: 0.1022, test_loss: 2.7149, test_f1: 0.5805
 epoch: 89, train_loss: 0.1121, test_loss: 2.5381, test_f1: 0.6130
 epoch: 90, train_loss: 0.0953, test_loss: 2.4236, test_f1: 0.6329
 epoch: 91, train_loss: 0.1143, test_loss: 2.3010, test_f1: 0.6218
 epoch: 92, train_loss: 0.0973, test_loss: 2.5759, test_f1: 0.6205
 epoch: 93, train_loss: 0.0949, test_loss: 2.7546, test_f1: 0.5929
 epoch: 94, train_loss: 0.1197, test_loss: 2.1825, test_f1: 0.6282
 epoch: 95, train_loss: 0.1061, test_loss: 2.3901, test_f1: 0.6306
 epoch: 96, train_loss: 0.1175, test_loss: 2.4052, test_f1: 0.6115
 epoch: 97, train_loss: 0.1035, test_loss: 2.5322, test_f1: 0.6245
 epoch: 98, train_loss: 0.1306, test_loss: 2.1989, test_f1: 0.6773
 epoch: 99, train_loss: 0.1297, test_loss: 2.5429, test_f1: 0.6097
##################ITERATION #7 ****************************************
 epoch: 0, train_loss: 1.1972, test_loss: 1.3236, test_f1: 0.3987
 epoch: 1, train_loss: 0.9120, test_loss: 1.0289, test_f1: 0.5791
 epoch: 2, train_loss: 0.8368, test_loss: 0.9473, test_f1: 0.5950
 epoch: 3, train_loss: 0.7866, test_loss: 1.0098, test_f1: 0.6000
 epoch: 4, train_loss: 0.7824, test_loss: 0.8959, test_f1: 0.6479
 epoch: 5, train_loss: 0.7413, test_loss: 1.0562, test_f1: 0.5330
 epoch: 6, train_loss: 0.7335, test_loss: 0.9620, test_f1: 0.5604
 epoch: 7, train_loss: 0.7024, test_loss: 1.1903, test_f1: 0.5907
 epoch: 8, train_loss: 0.6933, test_loss: 1.0945, test_f1: 0.5582
 epoch: 9, train_loss: 0.6505, test_loss: 1.1342, test_f1: 0.6162
 epoch: 10, train_loss: 0.6495, test_loss: 1.0368, test_f1: 0.5853
 epoch: 11, train_loss: 0.6395, test_loss: 0.9979, test_f1: 0.5872
 epoch: 12, train_loss: 0.6271, test_loss: 1.0818, test_f1: 0.5945
 epoch: 13, train_loss: 0.5976, test_loss: 1.2733, test_f1: 0.5483
 epoch: 14, train_loss: 0.5570, test_loss: 1.1604, test_f1: 0.6204
 epoch: 15, train_loss: 0.5765, test_loss: 1.3048, test_f1: 0.5761
 epoch: 16, train_loss: 0.5553, test_loss: 1.1039, test_f1: 0.6483
 epoch: 17, train_loss: 0.5458, test_loss: 1.0733, test_f1: 0.6137
 epoch: 18, train_loss: 0.5331, test_loss: 1.2374, test_f1: 0.5778
 epoch: 19, train_loss: 0.5044, test_loss: 1.3155, test_f1: 0.5666
 epoch: 20, train_loss: 0.5099, test_loss: 1.3969, test_f1: 0.5401
 epoch: 21, train_loss: 0.4811, test_loss: 1.2056, test_f1: 0.5820
 epoch: 22, train_loss: 0.4420, test_loss: 1.4040, test_f1: 0.5819
 epoch: 23, train_loss: 0.4880, test_loss: 1.2508, test_f1: 0.6198
 epoch: 24, train_loss: 0.4302, test_loss: 1.6533, test_f1: 0.5664
 epoch: 25, train_loss: 0.4362, test_loss: 1.5102, test_f1: 0.6014
 epoch: 26, train_loss: 0.4333, test_loss: 1.5294, test_f1: 0.5883
 epoch: 27, train_loss: 0.4638, test_loss: 1.5996, test_f1: 0.5904
 epoch: 28, train_loss: 0.4498, test_loss: 1.4992, test_f1: 0.5870
 epoch: 29, train_loss: 0.3850, test_loss: 1.5492, test_f1: 0.6135
 epoch: 30, train_loss: 0.3859, test_loss: 1.4260, test_f1: 0.6357
 epoch: 31, train_loss: 0.4317, test_loss: 1.3926, test_f1: 0.6073
 epoch: 32, train_loss: 0.3907, test_loss: 1.4950, test_f1: 0.6548
 epoch: 33, train_loss: 0.3932, test_loss: 1.5022, test_f1: 0.6408
 epoch: 34, train_loss: 0.3523, test_loss: 1.4894, test_f1: 0.6128
 epoch: 35, train_loss: 0.3228, test_loss: 1.5201, test_f1: 0.6466
 epoch: 36, train_loss: 0.3117, test_loss: 1.5580, test_f1: 0.6643
 epoch: 37, train_loss: 0.3476, test_loss: 1.5811, test_f1: 0.6193
 epoch: 38, train_loss: 0.3341, test_loss: 1.7785, test_f1: 0.6176
 epoch: 39, train_loss: 0.2961, test_loss: 1.8080, test_f1: 0.6288
 epoch: 40, train_loss: 0.3423, test_loss: 1.5090, test_f1: 0.6562
 epoch: 41, train_loss: 0.3259, test_loss: 1.6325, test_f1: 0.6713
 epoch: 42, train_loss: 0.3028, test_loss: 1.6318, test_f1: 0.6471
 epoch: 43, train_loss: 0.3066, test_loss: 1.6590, test_f1: 0.6211
 epoch: 44, train_loss: 0.2915, test_loss: 1.6847, test_f1: 0.6376
 epoch: 45, train_loss: 0.3035, test_loss: 1.7058, test_f1: 0.5896
 epoch: 46, train_loss: 0.2976, test_loss: 1.8329, test_f1: 0.6273
 epoch: 47, train_loss: 0.2927, test_loss: 2.0660, test_f1: 0.6189
 epoch: 48, train_loss: 0.3097, test_loss: 1.8746, test_f1: 0.5843
 epoch: 49, train_loss: 0.2513, test_loss: 2.0722, test_f1: 0.5784
 epoch: 50, train_loss: 0.2493, test_loss: 2.0408, test_f1: 0.6254
 epoch: 51, train_loss: 0.2229, test_loss: 2.1808, test_f1: 0.6356
 epoch: 52, train_loss: 0.1675, test_loss: 2.1915, test_f1: 0.6158
 epoch: 53, train_loss: 0.1882, test_loss: 2.0927, test_f1: 0.6294
 epoch: 54, train_loss: 0.1601, test_loss: 2.1343, test_f1: 0.6277
 epoch: 55, train_loss: 0.1471, test_loss: 2.3061, test_f1: 0.6312
 epoch: 56, train_loss: 0.1467, test_loss: 2.4614, test_f1: 0.6208
 epoch: 57, train_loss: 0.1378, test_loss: 2.2841, test_f1: 0.6415
 epoch: 58, train_loss: 0.1542, test_loss: 2.3830, test_f1: 0.6380
 epoch: 59, train_loss: 0.1293, test_loss: 2.5339, test_f1: 0.6018
 epoch: 60, train_loss: 0.1475, test_loss: 2.4269, test_f1: 0.6433
 epoch: 61, train_loss: 0.1200, test_loss: 2.4358, test_f1: 0.6458
 epoch: 62, train_loss: 0.1251, test_loss: 2.4528, test_f1: 0.6358
 epoch: 63, train_loss: 0.1542, test_loss: 2.3212, test_f1: 0.6343
 epoch: 64, train_loss: 0.1381, test_loss: 2.4254, test_f1: 0.6248
 epoch: 65, train_loss: 0.1642, test_loss: 2.2842, test_f1: 0.6294
 epoch: 66, train_loss: 0.1406, test_loss: 2.3260, test_f1: 0.6167
 epoch: 67, train_loss: 0.1464, test_loss: 2.2019, test_f1: 0.6356
 epoch: 68, train_loss: 0.1110, test_loss: 2.4166, test_f1: 0.6379
 epoch: 69, train_loss: 0.1278, test_loss: 2.4181, test_f1: 0.6085
 epoch: 70, train_loss: 0.1164, test_loss: 2.6337, test_f1: 0.6217
 epoch: 71, train_loss: 0.1364, test_loss: 2.6455, test_f1: 0.6434
 epoch: 72, train_loss: 0.1130, test_loss: 2.4277, test_f1: 0.6291
 epoch: 73, train_loss: 0.1373, test_loss: 2.3082, test_f1: 0.6548
 epoch: 74, train_loss: 0.1126, test_loss: 2.3659, test_f1: 0.6299
 epoch: 75, train_loss: 0.1324, test_loss: 2.5397, test_f1: 0.6536
 epoch: 76, train_loss: 0.1058, test_loss: 2.6169, test_f1: 0.6470
 epoch: 77, train_loss: 0.1167, test_loss: 2.8108, test_f1: 0.6465
 epoch: 78, train_loss: 0.1157, test_loss: 2.7030, test_f1: 0.6189
 epoch: 79, train_loss: 0.1253, test_loss: 2.5869, test_f1: 0.6298
 epoch: 80, train_loss: 0.1150, test_loss: 2.5922, test_f1: 0.6252
 epoch: 81, train_loss: 0.1233, test_loss: 2.6806, test_f1: 0.6215
 epoch: 82, train_loss: 0.1159, test_loss: 2.7521, test_f1: 0.6356
 epoch: 83, train_loss: 0.1159, test_loss: 2.5351, test_f1: 0.6445
 epoch: 84, train_loss: 0.0959, test_loss: 2.6379, test_f1: 0.6367
 epoch: 85, train_loss: 0.1141, test_loss: 2.4409, test_f1: 0.6172
 epoch: 86, train_loss: 0.1042, test_loss: 2.5617, test_f1: 0.6162
 epoch: 87, train_loss: 0.1199, test_loss: 2.6467, test_f1: 0.5895
 epoch: 88, train_loss: 0.0949, test_loss: 2.6457, test_f1: 0.6318
 epoch: 89, train_loss: 0.0891, test_loss: 3.0607, test_f1: 0.6272
 epoch: 90, train_loss: 0.1155, test_loss: 2.7832, test_f1: 0.6297
 epoch: 91, train_loss: 0.1079, test_loss: 2.6209, test_f1: 0.6269
 epoch: 92, train_loss: 0.1220, test_loss: 2.6902, test_f1: 0.6268
 epoch: 93, train_loss: 0.1023, test_loss: 2.4366, test_f1: 0.6443
 epoch: 94, train_loss: 0.0986, test_loss: 2.5842, test_f1: 0.6416
 epoch: 95, train_loss: 0.0845, test_loss: 2.9473, test_f1: 0.5974
 epoch: 96, train_loss: 0.0906, test_loss: 2.7214, test_f1: 0.6325
 epoch: 97, train_loss: 0.1022, test_loss: 2.8379, test_f1: 0.6348
 epoch: 98, train_loss: 0.0878, test_loss: 2.7303, test_f1: 0.6415
 epoch: 99, train_loss: 0.1155, test_loss: 3.1039, test_f1: 0.5678
##################ITERATION #8 ****************************************
 epoch: 0, train_loss: 1.1927, test_loss: 1.1139, test_f1: 0.5399
 epoch: 1, train_loss: 0.9334, test_loss: 1.0110, test_f1: 0.5702
 epoch: 2, train_loss: 0.8481, test_loss: 0.9916, test_f1: 0.5672
 epoch: 3, train_loss: 0.7857, test_loss: 0.9948, test_f1: 0.5822
 epoch: 4, train_loss: 0.8029, test_loss: 0.9602, test_f1: 0.6236
 epoch: 5, train_loss: 0.7294, test_loss: 1.0100, test_f1: 0.5620
 epoch: 6, train_loss: 0.7138, test_loss: 1.3461, test_f1: 0.5593
 epoch: 7, train_loss: 0.7119, test_loss: 1.0205, test_f1: 0.5659
 epoch: 8, train_loss: 0.6924, test_loss: 1.1137, test_f1: 0.5240
 epoch: 9, train_loss: 0.6535, test_loss: 1.1047, test_f1: 0.6247
 epoch: 10, train_loss: 0.6686, test_loss: 1.0031, test_f1: 0.6076
 epoch: 11, train_loss: 0.6391, test_loss: 1.1421, test_f1: 0.5763
 epoch: 12, train_loss: 0.6154, test_loss: 1.2538, test_f1: 0.5744
 epoch: 13, train_loss: 0.5811, test_loss: 1.1731, test_f1: 0.5634
 epoch: 14, train_loss: 0.6134, test_loss: 1.2073, test_f1: 0.5810
 epoch: 15, train_loss: 0.5568, test_loss: 1.1992, test_f1: 0.5512
 epoch: 16, train_loss: 0.5589, test_loss: 1.1928, test_f1: 0.6020
 epoch: 17, train_loss: 0.5365, test_loss: 1.2220, test_f1: 0.5880
 epoch: 18, train_loss: 0.5109, test_loss: 1.1374, test_f1: 0.6091
 epoch: 19, train_loss: 0.5092, test_loss: 1.4132, test_f1: 0.5570
 epoch: 20, train_loss: 0.5143, test_loss: 1.3931, test_f1: 0.6383
 epoch: 21, train_loss: 0.4663, test_loss: 1.5093, test_f1: 0.5340
 epoch: 22, train_loss: 0.4801, test_loss: 1.4009, test_f1: 0.6298
 epoch: 23, train_loss: 0.4729, test_loss: 1.5552, test_f1: 0.5572
 epoch: 24, train_loss: 0.4864, test_loss: 1.4801, test_f1: 0.6172
 epoch: 25, train_loss: 0.4607, test_loss: 1.3632, test_f1: 0.6270
 epoch: 26, train_loss: 0.4306, test_loss: 1.4983, test_f1: 0.5845
 epoch: 27, train_loss: 0.4277, test_loss: 1.6464, test_f1: 0.6234
 epoch: 28, train_loss: 0.4244, test_loss: 1.4924, test_f1: 0.5885
 epoch: 29, train_loss: 0.3926, test_loss: 1.4503, test_f1: 0.6419
 epoch: 30, train_loss: 0.3915, test_loss: 1.3820, test_f1: 0.5838
 epoch: 31, train_loss: 0.3947, test_loss: 1.4240, test_f1: 0.6033
 epoch: 32, train_loss: 0.3632, test_loss: 1.6896, test_f1: 0.5966
 epoch: 33, train_loss: 0.3403, test_loss: 1.5407, test_f1: 0.5858
 epoch: 34, train_loss: 0.3525, test_loss: 1.7456, test_f1: 0.5920
 epoch: 35, train_loss: 0.4211, test_loss: 1.6330, test_f1: 0.6285
 epoch: 36, train_loss: 0.3388, test_loss: 1.3922, test_f1: 0.6763
 epoch: 37, train_loss: 0.3493, test_loss: 1.8479, test_f1: 0.5614
 epoch: 38, train_loss: 0.3661, test_loss: 1.6788, test_f1: 0.6112
 epoch: 39, train_loss: 0.2916, test_loss: 1.8465, test_f1: 0.6319
 epoch: 40, train_loss: 0.3065, test_loss: 1.8329, test_f1: 0.5848
 epoch: 41, train_loss: 0.2973, test_loss: 2.0964, test_f1: 0.5997
 epoch: 42, train_loss: 0.2924, test_loss: 1.7106, test_f1: 0.6120
 epoch: 43, train_loss: 0.2981, test_loss: 1.7921, test_f1: 0.6105
 epoch: 44, train_loss: 0.2731, test_loss: 1.9677, test_f1: 0.5815
 epoch: 45, train_loss: 0.2503, test_loss: 1.9880, test_f1: 0.6122
 epoch: 46, train_loss: 0.2518, test_loss: 2.0303, test_f1: 0.5992
 epoch: 47, train_loss: 0.2775, test_loss: 2.3500, test_f1: 0.5440
 epoch: 48, train_loss: 0.2877, test_loss: 2.1578, test_f1: 0.5876
 epoch: 49, train_loss: 0.2377, test_loss: 2.2822, test_f1: 0.5860
 epoch: 50, train_loss: 0.2571, test_loss: 2.2463, test_f1: 0.6212
 epoch: 51, train_loss: 0.2086, test_loss: 2.3299, test_f1: 0.6134
 epoch: 52, train_loss: 0.1661, test_loss: 2.2881, test_f1: 0.6405
 epoch: 53, train_loss: 0.1495, test_loss: 2.3973, test_f1: 0.5969
 epoch: 54, train_loss: 0.1615, test_loss: 2.6354, test_f1: 0.5642
 epoch: 55, train_loss: 0.1474, test_loss: 2.3852, test_f1: 0.6256
 epoch: 56, train_loss: 0.1550, test_loss: 2.7458, test_f1: 0.5814
 epoch: 57, train_loss: 0.1423, test_loss: 2.5800, test_f1: 0.6345
 epoch: 58, train_loss: 0.1503, test_loss: 2.5009, test_f1: 0.6063
 epoch: 59, train_loss: 0.1524, test_loss: 2.6731, test_f1: 0.6042
 epoch: 60, train_loss: 0.1380, test_loss: 2.7481, test_f1: 0.6007
 epoch: 61, train_loss: 0.1551, test_loss: 2.9473, test_f1: 0.5997
 epoch: 62, train_loss: 0.1494, test_loss: 2.6314, test_f1: 0.5913
 epoch: 63, train_loss: 0.1283, test_loss: 2.6916, test_f1: 0.6172
 epoch: 64, train_loss: 0.1198, test_loss: 2.7120, test_f1: 0.5939
 epoch: 65, train_loss: 0.1231, test_loss: 2.7198, test_f1: 0.6105
 epoch: 66, train_loss: 0.1027, test_loss: 2.8727, test_f1: 0.6032
 epoch: 67, train_loss: 0.1310, test_loss: 2.8520, test_f1: 0.6061
 epoch: 68, train_loss: 0.1279, test_loss: 2.8104, test_f1: 0.6276
 epoch: 69, train_loss: 0.1380, test_loss: 2.8352, test_f1: 0.6000
 epoch: 70, train_loss: 0.1277, test_loss: 2.5236, test_f1: 0.6618
 epoch: 71, train_loss: 0.1392, test_loss: 2.7712, test_f1: 0.6244
 epoch: 72, train_loss: 0.1325, test_loss: 2.7863, test_f1: 0.6172
 epoch: 73, train_loss: 0.1145, test_loss: 2.5967, test_f1: 0.6299
 epoch: 74, train_loss: 0.1327, test_loss: 2.9085, test_f1: 0.5858
 epoch: 75, train_loss: 0.1230, test_loss: 2.8681, test_f1: 0.5753
 epoch: 76, train_loss: 0.1443, test_loss: 3.2110, test_f1: 0.6050
 epoch: 77, train_loss: 0.1330, test_loss: 2.9389, test_f1: 0.5775
 epoch: 78, train_loss: 0.1128, test_loss: 2.7784, test_f1: 0.5918
 epoch: 79, train_loss: 0.0975, test_loss: 3.0060, test_f1: 0.5837
 epoch: 80, train_loss: 0.1211, test_loss: 2.6188, test_f1: 0.5917
 epoch: 81, train_loss: 0.1076, test_loss: 2.9965, test_f1: 0.5906
 epoch: 82, train_loss: 0.0908, test_loss: 2.9413, test_f1: 0.6067
 epoch: 83, train_loss: 0.0771, test_loss: 3.4466, test_f1: 0.5516
 epoch: 84, train_loss: 0.0991, test_loss: 3.0248, test_f1: 0.5964
 epoch: 85, train_loss: 0.0879, test_loss: 3.0911, test_f1: 0.6533
 epoch: 86, train_loss: 0.1024, test_loss: 3.2045, test_f1: 0.6173
 epoch: 87, train_loss: 0.0964, test_loss: 3.2745, test_f1: 0.5985
 epoch: 88, train_loss: 0.0885, test_loss: 3.3339, test_f1: 0.6233
 epoch: 89, train_loss: 0.0903, test_loss: 3.1933, test_f1: 0.6140
 epoch: 90, train_loss: 0.1029, test_loss: 3.1289, test_f1: 0.6028
 epoch: 91, train_loss: 0.1242, test_loss: 2.8648, test_f1: 0.6206
 epoch: 92, train_loss: 0.0980, test_loss: 2.9602, test_f1: 0.5876
 epoch: 93, train_loss: 0.1022, test_loss: 2.9402, test_f1: 0.6308
 epoch: 94, train_loss: 0.0898, test_loss: 2.8499, test_f1: 0.6443
 epoch: 95, train_loss: 0.0866, test_loss: 2.8740, test_f1: 0.6492
 epoch: 96, train_loss: 0.0846, test_loss: 3.1141, test_f1: 0.6134
 epoch: 97, train_loss: 0.0864, test_loss: 3.1202, test_f1: 0.5923
 epoch: 98, train_loss: 0.1213, test_loss: 3.0222, test_f1: 0.6060
 epoch: 99, train_loss: 0.1081, test_loss: 3.0529, test_f1: 0.5750
##################ITERATION #9 ****************************************
 epoch: 0, train_loss: 1.2372, test_loss: 1.1892, test_f1: 0.4300
 epoch: 1, train_loss: 0.9412, test_loss: 0.9974, test_f1: 0.5812
 epoch: 2, train_loss: 0.8729, test_loss: 0.9808, test_f1: 0.5436
 epoch: 3, train_loss: 0.8132, test_loss: 1.1225, test_f1: 0.5159
 epoch: 4, train_loss: 0.7698, test_loss: 1.0190, test_f1: 0.5836
 epoch: 5, train_loss: 0.7581, test_loss: 1.0610, test_f1: 0.5936
 epoch: 6, train_loss: 0.7305, test_loss: 1.0518, test_f1: 0.6341
 epoch: 7, train_loss: 0.7135, test_loss: 1.0601, test_f1: 0.5819
 epoch: 8, train_loss: 0.6896, test_loss: 0.9941, test_f1: 0.5788
 epoch: 9, train_loss: 0.6675, test_loss: 1.2051, test_f1: 0.5590
 epoch: 10, train_loss: 0.6520, test_loss: 0.9212, test_f1: 0.6195
 epoch: 11, train_loss: 0.6382, test_loss: 1.0782, test_f1: 0.5652
 epoch: 12, train_loss: 0.6469, test_loss: 0.9668, test_f1: 0.6456
 epoch: 13, train_loss: 0.6295, test_loss: 1.0400, test_f1: 0.6201
 epoch: 14, train_loss: 0.6253, test_loss: 0.9147, test_f1: 0.6871
 epoch: 15, train_loss: 0.5691, test_loss: 1.3289, test_f1: 0.5496
 epoch: 16, train_loss: 0.5683, test_loss: 1.3783, test_f1: 0.5626
 epoch: 17, train_loss: 0.5906, test_loss: 1.0644, test_f1: 0.6140
 epoch: 18, train_loss: 0.5908, test_loss: 1.0924, test_f1: 0.5482
 epoch: 19, train_loss: 0.5758, test_loss: 1.0472, test_f1: 0.6521
 epoch: 20, train_loss: 0.5551, test_loss: 1.1548, test_f1: 0.5807
 epoch: 21, train_loss: 0.5295, test_loss: 1.1439, test_f1: 0.6481
 epoch: 22, train_loss: 0.5355, test_loss: 1.1394, test_f1: 0.5602
 epoch: 23, train_loss: 0.5091, test_loss: 1.3078, test_f1: 0.5866
 epoch: 24, train_loss: 0.4979, test_loss: 1.2004, test_f1: 0.6110
 epoch: 25, train_loss: 0.4856, test_loss: 1.2519, test_f1: 0.5595
 epoch: 26, train_loss: 0.4920, test_loss: 1.0852, test_f1: 0.6143
 epoch: 27, train_loss: 0.4497, test_loss: 1.1594, test_f1: 0.5957
 epoch: 28, train_loss: 0.4488, test_loss: 1.2774, test_f1: 0.5967
 epoch: 29, train_loss: 0.4625, test_loss: 1.2695, test_f1: 0.6131
 epoch: 30, train_loss: 0.4041, test_loss: 1.6461, test_f1: 0.5715
 epoch: 31, train_loss: 0.4118, test_loss: 1.4896, test_f1: 0.5539
 epoch: 32, train_loss: 0.3889, test_loss: 1.5018, test_f1: 0.5927
 epoch: 33, train_loss: 0.3952, test_loss: 1.5513, test_f1: 0.6062
 epoch: 34, train_loss: 0.3914, test_loss: 1.4445, test_f1: 0.5734
 epoch: 35, train_loss: 0.4078, test_loss: 1.4300, test_f1: 0.6014
 epoch: 36, train_loss: 0.3715, test_loss: 1.4962, test_f1: 0.5622
 epoch: 37, train_loss: 0.3856, test_loss: 1.3605, test_f1: 0.6487
 epoch: 38, train_loss: 0.3937, test_loss: 1.4708, test_f1: 0.6102
 epoch: 39, train_loss: 0.3439, test_loss: 1.3676, test_f1: 0.6504
 epoch: 40, train_loss: 0.3427, test_loss: 1.4551, test_f1: 0.6294
 epoch: 41, train_loss: 0.3449, test_loss: 1.5204, test_f1: 0.5872
 epoch: 42, train_loss: 0.3149, test_loss: 1.5703, test_f1: 0.6366
 epoch: 43, train_loss: 0.2966, test_loss: 1.7681, test_f1: 0.5672
 epoch: 44, train_loss: 0.3299, test_loss: 1.6511, test_f1: 0.5967
 epoch: 45, train_loss: 0.3167, test_loss: 1.6603, test_f1: 0.6031
 epoch: 46, train_loss: 0.3124, test_loss: 1.5665, test_f1: 0.6533
 epoch: 47, train_loss: 0.2968, test_loss: 1.5610, test_f1: 0.6514
 epoch: 48, train_loss: 0.2846, test_loss: 1.5047, test_f1: 0.6329
 epoch: 49, train_loss: 0.2830, test_loss: 1.8503, test_f1: 0.5829
 epoch: 50, train_loss: 0.2857, test_loss: 1.5358, test_f1: 0.6299
 epoch: 51, train_loss: 0.2539, test_loss: 1.8538, test_f1: 0.6011
 epoch: 52, train_loss: 0.1853, test_loss: 1.7878, test_f1: 0.6056
 epoch: 53, train_loss: 0.2044, test_loss: 1.8190, test_f1: 0.6277
 epoch: 54, train_loss: 0.1889, test_loss: 1.9301, test_f1: 0.6282
 epoch: 55, train_loss: 0.2156, test_loss: 1.8858, test_f1: 0.6296
 epoch: 56, train_loss: 0.1932, test_loss: 2.0767, test_f1: 0.6119
 epoch: 57, train_loss: 0.1566, test_loss: 2.0202, test_f1: 0.6036
 epoch: 58, train_loss: 0.1750, test_loss: 2.0905, test_f1: 0.6311
 epoch: 59, train_loss: 0.1710, test_loss: 1.9793, test_f1: 0.6089
 epoch: 60, train_loss: 0.1634, test_loss: 2.0670, test_f1: 0.6166
 epoch: 61, train_loss: 0.1883, test_loss: 2.0490, test_f1: 0.6184
 epoch: 62, train_loss: 0.1584, test_loss: 2.1127, test_f1: 0.6252
 epoch: 63, train_loss: 0.1373, test_loss: 2.2765, test_f1: 0.6205
 epoch: 64, train_loss: 0.1482, test_loss: 2.2470, test_f1: 0.6081
 epoch: 65, train_loss: 0.1453, test_loss: 2.4416, test_f1: 0.6152
 epoch: 66, train_loss: 0.1505, test_loss: 2.2375, test_f1: 0.6266
 epoch: 67, train_loss: 0.1420, test_loss: 2.3170, test_f1: 0.6055
 epoch: 68, train_loss: 0.1361, test_loss: 2.2923, test_f1: 0.6027
 epoch: 69, train_loss: 0.1617, test_loss: 2.2231, test_f1: 0.6091
 epoch: 70, train_loss: 0.1598, test_loss: 2.3320, test_f1: 0.5953
 epoch: 71, train_loss: 0.1301, test_loss: 2.4262, test_f1: 0.6082
 epoch: 72, train_loss: 0.1324, test_loss: 2.3781, test_f1: 0.6281
 epoch: 73, train_loss: 0.1459, test_loss: 2.3659, test_f1: 0.5999
 epoch: 74, train_loss: 0.1261, test_loss: 2.5846, test_f1: 0.6135
 epoch: 75, train_loss: 0.1219, test_loss: 2.5544, test_f1: 0.5862
 epoch: 76, train_loss: 0.1354, test_loss: 2.8034, test_f1: 0.5820
 epoch: 77, train_loss: 0.1275, test_loss: 2.3530, test_f1: 0.6155
 epoch: 78, train_loss: 0.1155, test_loss: 2.5039, test_f1: 0.5964
 epoch: 79, train_loss: 0.1320, test_loss: 2.5937, test_f1: 0.6005
 epoch: 80, train_loss: 0.1305, test_loss: 2.3192, test_f1: 0.6235
 epoch: 81, train_loss: 0.1407, test_loss: 2.3942, test_f1: 0.6020
 epoch: 82, train_loss: 0.1387, test_loss: 2.3375, test_f1: 0.5854
 epoch: 83, train_loss: 0.1368, test_loss: 2.3058, test_f1: 0.6273
 epoch: 84, train_loss: 0.1187, test_loss: 2.4945, test_f1: 0.5971
 epoch: 85, train_loss: 0.0956, test_loss: 2.8299, test_f1: 0.5900
 epoch: 86, train_loss: 0.1119, test_loss: 2.6290, test_f1: 0.5645
 epoch: 87, train_loss: 0.1277, test_loss: 2.8039, test_f1: 0.5983
 epoch: 88, train_loss: 0.1471, test_loss: 2.4897, test_f1: 0.5900
 epoch: 89, train_loss: 0.1310, test_loss: 2.9351, test_f1: 0.5902
 epoch: 90, train_loss: 0.1087, test_loss: 2.8768, test_f1: 0.5943
 epoch: 91, train_loss: 0.1210, test_loss: 2.7420, test_f1: 0.5976
 epoch: 92, train_loss: 0.1130, test_loss: 2.8561, test_f1: 0.5965
 epoch: 93, train_loss: 0.1109, test_loss: 2.7594, test_f1: 0.6047
 epoch: 94, train_loss: 0.1116, test_loss: 2.6802, test_f1: 0.5852
 epoch: 95, train_loss: 0.1000, test_loss: 2.5479, test_f1: 0.6135
 epoch: 96, train_loss: 0.1336, test_loss: 2.8510, test_f1: 0.6077
 epoch: 97, train_loss: 0.1000, test_loss: 2.8827, test_f1: 0.5982
 epoch: 98, train_loss: 0.0921, test_loss: 2.6583, test_f1: 0.6088
 epoch: 99, train_loss: 0.0876, test_loss: 2.7248, test_f1: 0.5785

Training completed in 886.61 seconds
Best F1: 0.6922 at epoch 28
Mean F1 across iterations: 0.6827  0.0069
========================FINAL RESULTS================================
FEGIN weighted F1: 0.6922  0.0069
python main.py --data ltspice_demos --representation component_pin --model FEGIN --layers 3 --hiddens 128 --batch_size 32 --lr 0.001 --emb_size 128 --epochs 100 --save_appendix component_pin_L3_H128_BS32_LR0.001_E128 --no_val
-----



STDERR:
  File "main.py", line 370, in <module>
    main()
  File "main.py", line 254, in main
    dataset = dataset_class(
  File "/home/philip/projects/ltspice_examples_code_repo/Circuit-Completion-Using-GNNs/component_classification_with_link_prediction_head/evaluation/FEGIN/kernel/circuit_datasets.py", line 15, in __init__
    self.data, self.slices = torch.load(self.processed_paths[0])
  File "/home/philip/.local/lib/python3.8/site-packages/torch/serialization.py", line 1040, in load
    warnings.warn(
  File "/usr/lib/python3.8/warnings.py", line 109, in _showwarnmsg
    sw(msg.message, msg.category, msg.filename, msg.lineno,
  File "main.py", line 47, in warn_with_traceback
    traceback.print_stack(file=log)
/home/philip/projects/ltspice_examples_code_repo/Circuit-Completion-Using-GNNs/component_classification_with_link_prediction_head/evaluation/FEGIN/kernel/circuit_datasets.py:15: FutureWarning: You are using `torch.load` with `weights_only=False` (the current default value), which uses the default pickle module implicitly. It is possible to construct malicious pickle data which will execute arbitrary code during unpickling (See https://github.com/pytorch/pytorch/blob/main/SECURITY.md#untrusted-models for more details). In a future release, the default value for `weights_only` will be flipped to `True`. This limits the functions that could be executed during unpickling. Arbitrary objects will no longer be allowed to be loaded via this mode unless they are explicitly allowlisted by the user via `torch.serialization.add_safe_globals`. We recommend you start setting `weights_only=True` for any use case where you don't have full control of the loaded file. Please open an issue on GitHub for any issues related to this experimental feature.
  self.data, self.slices = torch.load(self.processed_paths[0])
