STDOUT:
Results will be saved in /home/philip/projects/llm_inference_code_repo/Circuit-Completion-Using-GNNs/component_classification_with_link_prediction_head/evaluation/FEGIN/results/model_FEGIN_dataset_ltspice_examples
Command line input: python main.py --data ltspice_examples --representation component_net --model FEGIN --layers 6 --hiddens 128 --batch_size 256 --lr 0.0001 --emb_size 512 --epochs 100 --save_appendix component_net_L6_H128_BS256_LR0.0001_E512 --no_val
 is saved.
-----
ltspice_examples - FEGIN
Using 6 layers, 128 hidden units, h = 2
Loading component_net representation dataset
ENTERED
Training FEGIN on component_net representation
Train: 3558, Test: 846
##################ITERATION #0 ****************************************
 epoch: 0, train_loss: 1.3510, test_loss: 1.3605, test_f1: 0.2270
 epoch: 1, train_loss: 1.3287, test_loss: 1.3568, test_f1: 0.2270
 epoch: 2, train_loss: 1.3081, test_loss: 1.3448, test_f1: 0.2443
 epoch: 3, train_loss: 1.2848, test_loss: 1.3135, test_f1: 0.3373
 epoch: 4, train_loss: 1.2578, test_loss: 1.2656, test_f1: 0.3307
 epoch: 5, train_loss: 1.2321, test_loss: 1.2223, test_f1: 0.3286
 epoch: 6, train_loss: 1.2004, test_loss: 1.1849, test_f1: 0.3320
 epoch: 7, train_loss: 1.1739, test_loss: 1.1495, test_f1: 0.3428
 epoch: 8, train_loss: 1.1439, test_loss: 1.1265, test_f1: 0.3368
 epoch: 9, train_loss: 1.1203, test_loss: 1.0972, test_f1: 0.4186
 epoch: 10, train_loss: 1.1002, test_loss: 1.0727, test_f1: 0.4624
 epoch: 11, train_loss: 1.0815, test_loss: 1.0534, test_f1: 0.4956
 epoch: 12, train_loss: 1.0617, test_loss: 1.0267, test_f1: 0.5203
 epoch: 13, train_loss: 1.0400, test_loss: 1.0146, test_f1: 0.4977
 epoch: 14, train_loss: 1.0157, test_loss: 0.9892, test_f1: 0.5317
 epoch: 15, train_loss: 0.9845, test_loss: 0.9573, test_f1: 0.5538
 epoch: 16, train_loss: 0.9673, test_loss: 0.9585, test_f1: 0.5071
 epoch: 17, train_loss: 0.9457, test_loss: 0.9394, test_f1: 0.5146
 epoch: 18, train_loss: 0.9279, test_loss: 0.9265, test_f1: 0.5304
 epoch: 19, train_loss: 0.9028, test_loss: 0.9299, test_f1: 0.5311
 epoch: 20, train_loss: 0.8934, test_loss: 0.9163, test_f1: 0.5577
 epoch: 21, train_loss: 0.8762, test_loss: 0.9118, test_f1: 0.5302
 epoch: 22, train_loss: 0.8671, test_loss: 0.8988, test_f1: 0.5502
 epoch: 23, train_loss: 0.8481, test_loss: 0.8932, test_f1: 0.5576
 epoch: 24, train_loss: 0.8427, test_loss: 0.9045, test_f1: 0.5507
 epoch: 25, train_loss: 0.8267, test_loss: 0.9087, test_f1: 0.5489
 epoch: 26, train_loss: 0.8245, test_loss: 0.8876, test_f1: 0.5606
 epoch: 27, train_loss: 0.8156, test_loss: 0.9032, test_f1: 0.5555
 epoch: 28, train_loss: 0.8018, test_loss: 0.8976, test_f1: 0.5681
 epoch: 29, train_loss: 0.7867, test_loss: 0.9229, test_f1: 0.5727
 epoch: 30, train_loss: 0.7755, test_loss: 0.9065, test_f1: 0.5604
 epoch: 31, train_loss: 0.7790, test_loss: 0.9248, test_f1: 0.5601
 epoch: 32, train_loss: 0.7676, test_loss: 0.9187, test_f1: 0.5570
 epoch: 33, train_loss: 0.7559, test_loss: 0.9118, test_f1: 0.5822
 epoch: 34, train_loss: 0.7516, test_loss: 0.9265, test_f1: 0.5513
 epoch: 35, train_loss: 0.7502, test_loss: 0.9162, test_f1: 0.5410
 epoch: 36, train_loss: 0.7558, test_loss: 0.9329, test_f1: 0.5775
 epoch: 37, train_loss: 0.7319, test_loss: 0.9297, test_f1: 0.5661
 epoch: 38, train_loss: 0.7340, test_loss: 0.9163, test_f1: 0.5558
 epoch: 39, train_loss: 0.7337, test_loss: 0.8994, test_f1: 0.5825
 epoch: 40, train_loss: 0.7248, test_loss: 0.9274, test_f1: 0.5878
 epoch: 41, train_loss: 0.7139, test_loss: 0.9314, test_f1: 0.5652
 epoch: 42, train_loss: 0.7023, test_loss: 0.9313, test_f1: 0.5670
 epoch: 43, train_loss: 0.6977, test_loss: 0.8975, test_f1: 0.5834
 epoch: 44, train_loss: 0.6896, test_loss: 0.9573, test_f1: 0.5663
 epoch: 45, train_loss: 0.6837, test_loss: 0.9385, test_f1: 0.5895
 epoch: 46, train_loss: 0.6713, test_loss: 0.9599, test_f1: 0.5864
 epoch: 47, train_loss: 0.6693, test_loss: 0.9256, test_f1: 0.5696
 epoch: 48, train_loss: 0.6741, test_loss: 0.9462, test_f1: 0.5939
 epoch: 49, train_loss: 0.6667, test_loss: 0.9466, test_f1: 0.5844
 epoch: 50, train_loss: 0.6568, test_loss: 0.9557, test_f1: 0.5647
 epoch: 51, train_loss: 0.6490, test_loss: 0.9515, test_f1: 0.5760
 epoch: 52, train_loss: 0.6453, test_loss: 0.9299, test_f1: 0.5809
 epoch: 53, train_loss: 0.6234, test_loss: 0.9326, test_f1: 0.5828
 epoch: 54, train_loss: 0.6183, test_loss: 0.9281, test_f1: 0.5840
 epoch: 55, train_loss: 0.6202, test_loss: 0.9706, test_f1: 0.5800
 epoch: 56, train_loss: 0.6089, test_loss: 0.9339, test_f1: 0.5788
 epoch: 57, train_loss: 0.6083, test_loss: 0.9717, test_f1: 0.5954
 epoch: 58, train_loss: 0.6123, test_loss: 0.9278, test_f1: 0.5981
 epoch: 59, train_loss: 0.6007, test_loss: 0.9526, test_f1: 0.6141
 epoch: 60, train_loss: 0.6015, test_loss: 0.9280, test_f1: 0.5863
 epoch: 61, train_loss: 0.6013, test_loss: 0.9695, test_f1: 0.5983
 epoch: 62, train_loss: 0.5885, test_loss: 0.9559, test_f1: 0.6001
 epoch: 63, train_loss: 0.5988, test_loss: 0.9500, test_f1: 0.6060
 epoch: 64, train_loss: 0.5941, test_loss: 1.0083, test_f1: 0.5935
 epoch: 65, train_loss: 0.5984, test_loss: 0.9717, test_f1: 0.6043
 epoch: 66, train_loss: 0.5887, test_loss: 0.9661, test_f1: 0.5967
 epoch: 67, train_loss: 0.5806, test_loss: 1.0075, test_f1: 0.6007
 epoch: 68, train_loss: 0.5802, test_loss: 0.9823, test_f1: 0.5969
 epoch: 69, train_loss: 0.5800, test_loss: 0.9878, test_f1: 0.5975
 epoch: 70, train_loss: 0.5709, test_loss: 0.9896, test_f1: 0.6002
 epoch: 71, train_loss: 0.5657, test_loss: 0.9812, test_f1: 0.6060
 epoch: 72, train_loss: 0.5723, test_loss: 0.9917, test_f1: 0.6184
 epoch: 73, train_loss: 0.5671, test_loss: 1.0389, test_f1: 0.6027
 epoch: 74, train_loss: 0.5544, test_loss: 0.9939, test_f1: 0.5991
 epoch: 75, train_loss: 0.5630, test_loss: 0.9827, test_f1: 0.6045
 epoch: 76, train_loss: 0.5583, test_loss: 0.9886, test_f1: 0.6044
 epoch: 77, train_loss: 0.5543, test_loss: 0.9801, test_f1: 0.6112
 epoch: 78, train_loss: 0.5452, test_loss: 0.9776, test_f1: 0.6070
 epoch: 79, train_loss: 0.5547, test_loss: 1.0108, test_f1: 0.6211
 epoch: 80, train_loss: 0.5495, test_loss: 1.0251, test_f1: 0.6099
 epoch: 81, train_loss: 0.5437, test_loss: 1.0000, test_f1: 0.6096
 epoch: 82, train_loss: 0.5409, test_loss: 1.1019, test_f1: 0.6032
 epoch: 83, train_loss: 0.5321, test_loss: 1.0360, test_f1: 0.6063
 epoch: 84, train_loss: 0.5309, test_loss: 1.0197, test_f1: 0.6049
 epoch: 85, train_loss: 0.5376, test_loss: 1.0281, test_f1: 0.6069
 epoch: 86, train_loss: 0.5365, test_loss: 1.0480, test_f1: 0.5940
 epoch: 87, train_loss: 0.5305, test_loss: 1.0331, test_f1: 0.5980
 epoch: 88, train_loss: 0.5288, test_loss: 1.0221, test_f1: 0.6056
 epoch: 89, train_loss: 0.5150, test_loss: 1.0548, test_f1: 0.6051
 epoch: 90, train_loss: 0.5218, test_loss: 1.0593, test_f1: 0.6151
 epoch: 91, train_loss: 0.5135, test_loss: 1.0668, test_f1: 0.6097
 epoch: 92, train_loss: 0.5233, test_loss: 1.0553, test_f1: 0.6171
 epoch: 93, train_loss: 0.5070, test_loss: 1.0795, test_f1: 0.5916
 epoch: 94, train_loss: 0.5095, test_loss: 1.0357, test_f1: 0.6075
 epoch: 95, train_loss: 0.5165, test_loss: 1.0513, test_f1: 0.6000
 epoch: 96, train_loss: 0.5104, test_loss: 1.0698, test_f1: 0.6127
 epoch: 97, train_loss: 0.5139, test_loss: 1.0751, test_f1: 0.6068
 epoch: 98, train_loss: 0.4928, test_loss: 1.1092, test_f1: 0.5996
 epoch: 99, train_loss: 0.4960, test_loss: 1.0872, test_f1: 0.6089
##################ITERATION #1 ****************************************
 epoch: 0, train_loss: 1.2945, test_loss: 1.3511, test_f1: 0.2270
 epoch: 1, train_loss: 1.2349, test_loss: 1.3265, test_f1: 0.2270
 epoch: 2, train_loss: 1.1970, test_loss: 1.2679, test_f1: 0.3131
 epoch: 3, train_loss: 1.1661, test_loss: 1.2042, test_f1: 0.4222
 epoch: 4, train_loss: 1.1350, test_loss: 1.1553, test_f1: 0.4404
 epoch: 5, train_loss: 1.1058, test_loss: 1.0978, test_f1: 0.4444
 epoch: 6, train_loss: 1.0806, test_loss: 1.0508, test_f1: 0.4690
 epoch: 7, train_loss: 1.0571, test_loss: 1.0192, test_f1: 0.4813
 epoch: 8, train_loss: 1.0294, test_loss: 1.0008, test_f1: 0.4840
 epoch: 9, train_loss: 1.0093, test_loss: 0.9765, test_f1: 0.5034
 epoch: 10, train_loss: 0.9858, test_loss: 0.9649, test_f1: 0.5002
 epoch: 11, train_loss: 0.9643, test_loss: 0.9536, test_f1: 0.5149
 epoch: 12, train_loss: 0.9456, test_loss: 0.9445, test_f1: 0.5110
 epoch: 13, train_loss: 0.9239, test_loss: 0.9407, test_f1: 0.5355
 epoch: 14, train_loss: 0.9156, test_loss: 0.9290, test_f1: 0.5123
 epoch: 15, train_loss: 0.9002, test_loss: 0.9354, test_f1: 0.5315
 epoch: 16, train_loss: 0.8790, test_loss: 0.9088, test_f1: 0.5211
 epoch: 17, train_loss: 0.8752, test_loss: 0.9165, test_f1: 0.5178
 epoch: 18, train_loss: 0.8627, test_loss: 0.9363, test_f1: 0.5284
 epoch: 19, train_loss: 0.8419, test_loss: 0.9192, test_f1: 0.5200
 epoch: 20, train_loss: 0.8343, test_loss: 0.9214, test_f1: 0.5183
 epoch: 21, train_loss: 0.8297, test_loss: 0.9063, test_f1: 0.5331
 epoch: 22, train_loss: 0.8149, test_loss: 0.9266, test_f1: 0.5370
 epoch: 23, train_loss: 0.8031, test_loss: 0.9623, test_f1: 0.5094
 epoch: 24, train_loss: 0.8032, test_loss: 0.9416, test_f1: 0.5581
 epoch: 25, train_loss: 0.7917, test_loss: 0.9302, test_f1: 0.5600
 epoch: 26, train_loss: 0.7811, test_loss: 0.9208, test_f1: 0.5388
 epoch: 27, train_loss: 0.7773, test_loss: 0.9168, test_f1: 0.5398
 epoch: 28, train_loss: 0.7740, test_loss: 0.9331, test_f1: 0.5629
 epoch: 29, train_loss: 0.7494, test_loss: 0.9372, test_f1: 0.5523
 epoch: 30, train_loss: 0.7369, test_loss: 0.9413, test_f1: 0.5561
 epoch: 31, train_loss: 0.7360, test_loss: 0.9372, test_f1: 0.5932
 epoch: 32, train_loss: 0.7324, test_loss: 0.9240, test_f1: 0.5769
 epoch: 33, train_loss: 0.7314, test_loss: 0.9570, test_f1: 0.5940
 epoch: 34, train_loss: 0.7324, test_loss: 0.9483, test_f1: 0.5825
 epoch: 35, train_loss: 0.7165, test_loss: 0.9524, test_f1: 0.5828
 epoch: 36, train_loss: 0.6994, test_loss: 0.9623, test_f1: 0.5971
 epoch: 37, train_loss: 0.6968, test_loss: 0.9706, test_f1: 0.5755
 epoch: 38, train_loss: 0.6911, test_loss: 0.9740, test_f1: 0.5779
 epoch: 39, train_loss: 0.6856, test_loss: 0.9424, test_f1: 0.6050
 epoch: 40, train_loss: 0.6762, test_loss: 0.9792, test_f1: 0.5798
 epoch: 41, train_loss: 0.6609, test_loss: 0.9582, test_f1: 0.5951
 epoch: 42, train_loss: 0.6637, test_loss: 0.9701, test_f1: 0.5895
 epoch: 43, train_loss: 0.6505, test_loss: 0.9618, test_f1: 0.6147
 epoch: 44, train_loss: 0.6440, test_loss: 1.0174, test_f1: 0.5849
 epoch: 45, train_loss: 0.6490, test_loss: 0.9678, test_f1: 0.5926
 epoch: 46, train_loss: 0.6364, test_loss: 1.0400, test_f1: 0.5939
 epoch: 47, train_loss: 0.6254, test_loss: 1.0341, test_f1: 0.6030
 epoch: 48, train_loss: 0.6109, test_loss: 0.9861, test_f1: 0.5956
 epoch: 49, train_loss: 0.6118, test_loss: 1.0054, test_f1: 0.5891
 epoch: 50, train_loss: 0.6089, test_loss: 0.9764, test_f1: 0.6196
 epoch: 51, train_loss: 0.5919, test_loss: 1.0084, test_f1: 0.5943
 epoch: 52, train_loss: 0.5820, test_loss: 0.9861, test_f1: 0.5980
 epoch: 53, train_loss: 0.5756, test_loss: 0.9937, test_f1: 0.5932
 epoch: 54, train_loss: 0.5684, test_loss: 1.0148, test_f1: 0.5944
 epoch: 55, train_loss: 0.5710, test_loss: 1.0118, test_f1: 0.5897
 epoch: 56, train_loss: 0.5512, test_loss: 1.0247, test_f1: 0.5975
 epoch: 57, train_loss: 0.5647, test_loss: 0.9959, test_f1: 0.6130
 epoch: 58, train_loss: 0.5528, test_loss: 0.9888, test_f1: 0.6262
 epoch: 59, train_loss: 0.5456, test_loss: 1.0010, test_f1: 0.6238
 epoch: 60, train_loss: 0.5501, test_loss: 1.0269, test_f1: 0.6041
 epoch: 61, train_loss: 0.5435, test_loss: 1.0393, test_f1: 0.6063
 epoch: 62, train_loss: 0.5434, test_loss: 1.0095, test_f1: 0.6142
 epoch: 63, train_loss: 0.5474, test_loss: 1.0185, test_f1: 0.6162
 epoch: 64, train_loss: 0.5390, test_loss: 1.0426, test_f1: 0.6064
 epoch: 65, train_loss: 0.5364, test_loss: 1.0991, test_f1: 0.5989
 epoch: 66, train_loss: 0.5382, test_loss: 1.0328, test_f1: 0.6138
 epoch: 67, train_loss: 0.5337, test_loss: 1.0684, test_f1: 0.6090
 epoch: 68, train_loss: 0.5247, test_loss: 1.0620, test_f1: 0.6150
 epoch: 69, train_loss: 0.5253, test_loss: 1.1104, test_f1: 0.5975
 epoch: 70, train_loss: 0.5149, test_loss: 1.0737, test_f1: 0.6038
 epoch: 71, train_loss: 0.5190, test_loss: 1.0664, test_f1: 0.5959
 epoch: 72, train_loss: 0.5150, test_loss: 1.0353, test_f1: 0.6169
 epoch: 73, train_loss: 0.5168, test_loss: 1.0680, test_f1: 0.6056
 epoch: 74, train_loss: 0.5052, test_loss: 1.0517, test_f1: 0.6092
 epoch: 75, train_loss: 0.5040, test_loss: 1.0481, test_f1: 0.5999
 epoch: 76, train_loss: 0.5249, test_loss: 1.0637, test_f1: 0.6132
 epoch: 77, train_loss: 0.5118, test_loss: 1.0869, test_f1: 0.6084
 epoch: 78, train_loss: 0.4877, test_loss: 1.1088, test_f1: 0.6123
 epoch: 79, train_loss: 0.4993, test_loss: 1.1254, test_f1: 0.5955
 epoch: 80, train_loss: 0.4775, test_loss: 1.0956, test_f1: 0.6000
 epoch: 81, train_loss: 0.4985, test_loss: 1.0751, test_f1: 0.6121
 epoch: 82, train_loss: 0.4796, test_loss: 1.0947, test_f1: 0.6162
 epoch: 83, train_loss: 0.4935, test_loss: 1.0804, test_f1: 0.6090
 epoch: 84, train_loss: 0.4854, test_loss: 1.0868, test_f1: 0.6090
 epoch: 85, train_loss: 0.4782, test_loss: 1.0985, test_f1: 0.6090
 epoch: 86, train_loss: 0.4716, test_loss: 1.0624, test_f1: 0.6278
 epoch: 87, train_loss: 0.4643, test_loss: 1.1157, test_f1: 0.6121
 epoch: 88, train_loss: 0.4638, test_loss: 1.1677, test_f1: 0.6166
 epoch: 89, train_loss: 0.4707, test_loss: 1.1459, test_f1: 0.6164
 epoch: 90, train_loss: 0.4666, test_loss: 1.1626, test_f1: 0.6070
 epoch: 91, train_loss: 0.4540, test_loss: 1.1746, test_f1: 0.6118
 epoch: 92, train_loss: 0.4608, test_loss: 1.0932, test_f1: 0.6102
 epoch: 93, train_loss: 0.4622, test_loss: 1.1032, test_f1: 0.6180
 epoch: 94, train_loss: 0.4600, test_loss: 1.1231, test_f1: 0.6096
 epoch: 95, train_loss: 0.4619, test_loss: 1.1213, test_f1: 0.6157
 epoch: 96, train_loss: 0.4530, test_loss: 1.1837, test_f1: 0.6087
 epoch: 97, train_loss: 0.4588, test_loss: 1.0880, test_f1: 0.6309
 epoch: 98, train_loss: 0.4422, test_loss: 1.1243, test_f1: 0.6269
 epoch: 99, train_loss: 0.4496, test_loss: 1.1370, test_f1: 0.6097
##################ITERATION #2 ****************************************
 epoch: 0, train_loss: 1.2619, test_loss: 1.3336, test_f1: 0.2270
 epoch: 1, train_loss: 1.1821, test_loss: 1.3140, test_f1: 0.2270
 epoch: 2, train_loss: 1.1430, test_loss: 1.2754, test_f1: 0.3249
 epoch: 3, train_loss: 1.1115, test_loss: 1.2067, test_f1: 0.4055
 epoch: 4, train_loss: 1.0772, test_loss: 1.1290, test_f1: 0.4390
 epoch: 5, train_loss: 1.0506, test_loss: 1.0715, test_f1: 0.4437
 epoch: 6, train_loss: 1.0235, test_loss: 1.0196, test_f1: 0.4617
 epoch: 7, train_loss: 1.0066, test_loss: 0.9735, test_f1: 0.4816
 epoch: 8, train_loss: 0.9806, test_loss: 0.9621, test_f1: 0.4865
 epoch: 9, train_loss: 0.9618, test_loss: 0.9431, test_f1: 0.5024
 epoch: 10, train_loss: 0.9349, test_loss: 0.9265, test_f1: 0.5107
 epoch: 11, train_loss: 0.9173, test_loss: 0.9181, test_f1: 0.5316
 epoch: 12, train_loss: 0.9000, test_loss: 0.9132, test_f1: 0.5076
 epoch: 13, train_loss: 0.8839, test_loss: 0.8937, test_f1: 0.5430
 epoch: 14, train_loss: 0.8737, test_loss: 0.8971, test_f1: 0.5437
 epoch: 15, train_loss: 0.8615, test_loss: 0.8942, test_f1: 0.5422
 epoch: 16, train_loss: 0.8397, test_loss: 0.8762, test_f1: 0.5818
 epoch: 17, train_loss: 0.8285, test_loss: 0.8933, test_f1: 0.5574
 epoch: 18, train_loss: 0.8329, test_loss: 0.8718, test_f1: 0.5613
 epoch: 19, train_loss: 0.8113, test_loss: 0.8933, test_f1: 0.5752
 epoch: 20, train_loss: 0.8037, test_loss: 0.8656, test_f1: 0.5666
 epoch: 21, train_loss: 0.7920, test_loss: 0.8680, test_f1: 0.5656
 epoch: 22, train_loss: 0.7883, test_loss: 0.8737, test_f1: 0.5982
 epoch: 23, train_loss: 0.7742, test_loss: 0.8651, test_f1: 0.5690
 epoch: 24, train_loss: 0.7715, test_loss: 0.8621, test_f1: 0.5864
 epoch: 25, train_loss: 0.7644, test_loss: 0.8879, test_f1: 0.5652
 epoch: 26, train_loss: 0.7532, test_loss: 0.8556, test_f1: 0.5956
 epoch: 27, train_loss: 0.7358, test_loss: 0.8886, test_f1: 0.5788
 epoch: 28, train_loss: 0.7296, test_loss: 0.8750, test_f1: 0.6017
 epoch: 29, train_loss: 0.7325, test_loss: 0.8756, test_f1: 0.5743
 epoch: 30, train_loss: 0.7243, test_loss: 0.8465, test_f1: 0.5949
 epoch: 31, train_loss: 0.7193, test_loss: 0.8568, test_f1: 0.5889
 epoch: 32, train_loss: 0.6998, test_loss: 0.8803, test_f1: 0.5888
 epoch: 33, train_loss: 0.7110, test_loss: 0.8457, test_f1: 0.6054
 epoch: 34, train_loss: 0.6950, test_loss: 0.8575, test_f1: 0.5922
 epoch: 35, train_loss: 0.6816, test_loss: 0.8634, test_f1: 0.6082
 epoch: 36, train_loss: 0.6789, test_loss: 0.8910, test_f1: 0.6053
 epoch: 37, train_loss: 0.6800, test_loss: 0.8868, test_f1: 0.5994
 epoch: 38, train_loss: 0.6630, test_loss: 0.8790, test_f1: 0.6041
 epoch: 39, train_loss: 0.6528, test_loss: 0.8884, test_f1: 0.6011
 epoch: 40, train_loss: 0.6564, test_loss: 0.9154, test_f1: 0.5962
 epoch: 41, train_loss: 0.6446, test_loss: 0.8849, test_f1: 0.6047
 epoch: 42, train_loss: 0.6426, test_loss: 0.8729, test_f1: 0.6030
 epoch: 43, train_loss: 0.6331, test_loss: 0.9158, test_f1: 0.5875
 epoch: 44, train_loss: 0.6221, test_loss: 0.9159, test_f1: 0.5976
 epoch: 45, train_loss: 0.6133, test_loss: 0.8806, test_f1: 0.6091
 epoch: 46, train_loss: 0.6028, test_loss: 0.8874, test_f1: 0.6199
 epoch: 47, train_loss: 0.6208, test_loss: 0.9483, test_f1: 0.5908
 epoch: 48, train_loss: 0.6003, test_loss: 0.8942, test_f1: 0.6196
 epoch: 49, train_loss: 0.5881, test_loss: 0.8926, test_f1: 0.6287
 epoch: 50, train_loss: 0.6027, test_loss: 0.9341, test_f1: 0.6297
 epoch: 51, train_loss: 0.5823, test_loss: 0.9007, test_f1: 0.6132
 epoch: 52, train_loss: 0.5644, test_loss: 0.8968, test_f1: 0.6194
 epoch: 53, train_loss: 0.5607, test_loss: 0.9022, test_f1: 0.6034
 epoch: 54, train_loss: 0.5465, test_loss: 0.9193, test_f1: 0.5980
 epoch: 55, train_loss: 0.5534, test_loss: 0.9335, test_f1: 0.6332
 epoch: 56, train_loss: 0.5488, test_loss: 0.9084, test_f1: 0.6313
 epoch: 57, train_loss: 0.5478, test_loss: 0.9111, test_f1: 0.6260
 epoch: 58, train_loss: 0.5526, test_loss: 0.9213, test_f1: 0.6260
 epoch: 59, train_loss: 0.5443, test_loss: 0.9459, test_f1: 0.6143
 epoch: 60, train_loss: 0.5389, test_loss: 0.9319, test_f1: 0.6299
 epoch: 61, train_loss: 0.5284, test_loss: 0.9620, test_f1: 0.6087
 epoch: 62, train_loss: 0.5272, test_loss: 0.9586, test_f1: 0.6172
 epoch: 63, train_loss: 0.5267, test_loss: 0.9485, test_f1: 0.6127
 epoch: 64, train_loss: 0.5239, test_loss: 0.9349, test_f1: 0.6261
 epoch: 65, train_loss: 0.5191, test_loss: 0.9738, test_f1: 0.6151
 epoch: 66, train_loss: 0.5196, test_loss: 0.9814, test_f1: 0.6118
 epoch: 67, train_loss: 0.5262, test_loss: 0.9852, test_f1: 0.6370
 epoch: 68, train_loss: 0.5118, test_loss: 0.9893, test_f1: 0.6251
 epoch: 69, train_loss: 0.5051, test_loss: 0.9568, test_f1: 0.6393
 epoch: 70, train_loss: 0.5043, test_loss: 0.9420, test_f1: 0.6424
 epoch: 71, train_loss: 0.5105, test_loss: 0.9493, test_f1: 0.6290
 epoch: 72, train_loss: 0.5141, test_loss: 0.9417, test_f1: 0.6292
 epoch: 73, train_loss: 0.5168, test_loss: 0.9884, test_f1: 0.6364
 epoch: 74, train_loss: 0.4914, test_loss: 0.9815, test_f1: 0.6268
 epoch: 75, train_loss: 0.4889, test_loss: 0.9774, test_f1: 0.6347
 epoch: 76, train_loss: 0.4864, test_loss: 0.9948, test_f1: 0.6363
 epoch: 77, train_loss: 0.4829, test_loss: 0.9870, test_f1: 0.6327
 epoch: 78, train_loss: 0.4802, test_loss: 0.9915, test_f1: 0.6324
 epoch: 79, train_loss: 0.4782, test_loss: 0.9794, test_f1: 0.6405
 epoch: 80, train_loss: 0.4765, test_loss: 1.0029, test_f1: 0.6366
 epoch: 81, train_loss: 0.4796, test_loss: 0.9939, test_f1: 0.6376
 epoch: 82, train_loss: 0.4712, test_loss: 1.0371, test_f1: 0.6349
 epoch: 83, train_loss: 0.4715, test_loss: 1.0415, test_f1: 0.6277
 epoch: 84, train_loss: 0.4619, test_loss: 1.0277, test_f1: 0.6128
 epoch: 85, train_loss: 0.4566, test_loss: 1.0108, test_f1: 0.6060
 epoch: 86, train_loss: 0.4567, test_loss: 1.0062, test_f1: 0.6400
 epoch: 87, train_loss: 0.4597, test_loss: 1.0317, test_f1: 0.6319
 epoch: 88, train_loss: 0.4599, test_loss: 1.0009, test_f1: 0.6395
 epoch: 89, train_loss: 0.4476, test_loss: 1.0511, test_f1: 0.6393
 epoch: 90, train_loss: 0.4569, test_loss: 1.0377, test_f1: 0.6543
 epoch: 91, train_loss: 0.4492, test_loss: 1.0247, test_f1: 0.6324
 epoch: 92, train_loss: 0.4536, test_loss: 1.0221, test_f1: 0.6394
 epoch: 93, train_loss: 0.4364, test_loss: 1.0300, test_f1: 0.6176
 epoch: 94, train_loss: 0.4475, test_loss: 1.0390, test_f1: 0.6278
 epoch: 95, train_loss: 0.4453, test_loss: 1.0108, test_f1: 0.6539
 epoch: 96, train_loss: 0.4479, test_loss: 1.0235, test_f1: 0.6410
 epoch: 97, train_loss: 0.4261, test_loss: 1.0321, test_f1: 0.6525
 epoch: 98, train_loss: 0.4384, test_loss: 1.0313, test_f1: 0.6505
 epoch: 99, train_loss: 0.4163, test_loss: 1.0628, test_f1: 0.6473
##################ITERATION #3 ****************************************
 epoch: 0, train_loss: 1.2472, test_loss: 1.3442, test_f1: 0.2270
 epoch: 1, train_loss: 1.1592, test_loss: 1.3310, test_f1: 0.2392
 epoch: 2, train_loss: 1.1208, test_loss: 1.2755, test_f1: 0.3100
 epoch: 3, train_loss: 1.0831, test_loss: 1.1921, test_f1: 0.3516
 epoch: 4, train_loss: 1.0622, test_loss: 1.0738, test_f1: 0.4539
 epoch: 5, train_loss: 1.0435, test_loss: 1.0120, test_f1: 0.4729
 epoch: 6, train_loss: 1.0113, test_loss: 0.9782, test_f1: 0.5029
 epoch: 7, train_loss: 0.9923, test_loss: 0.9643, test_f1: 0.5200
 epoch: 8, train_loss: 0.9696, test_loss: 0.9432, test_f1: 0.5116
 epoch: 9, train_loss: 0.9540, test_loss: 0.9325, test_f1: 0.5197
 epoch: 10, train_loss: 0.9327, test_loss: 0.9187, test_f1: 0.5246
 epoch: 11, train_loss: 0.9091, test_loss: 0.9138, test_f1: 0.5437
 epoch: 12, train_loss: 0.9030, test_loss: 0.9037, test_f1: 0.5491
 epoch: 13, train_loss: 0.8902, test_loss: 0.9138, test_f1: 0.5562
 epoch: 14, train_loss: 0.8766, test_loss: 0.8927, test_f1: 0.5452
 epoch: 15, train_loss: 0.8635, test_loss: 0.9019, test_f1: 0.5692
 epoch: 16, train_loss: 0.8459, test_loss: 0.8865, test_f1: 0.5685
 epoch: 17, train_loss: 0.8388, test_loss: 0.8827, test_f1: 0.5724
 epoch: 18, train_loss: 0.8241, test_loss: 0.8810, test_f1: 0.5839
 epoch: 19, train_loss: 0.8246, test_loss: 0.8922, test_f1: 0.5865
 epoch: 20, train_loss: 0.7992, test_loss: 0.9079, test_f1: 0.5816
 epoch: 21, train_loss: 0.7939, test_loss: 0.8621, test_f1: 0.5997
 epoch: 22, train_loss: 0.7893, test_loss: 0.9117, test_f1: 0.5768
 epoch: 23, train_loss: 0.7800, test_loss: 0.8856, test_f1: 0.5946
 epoch: 24, train_loss: 0.7678, test_loss: 0.8789, test_f1: 0.6048
 epoch: 25, train_loss: 0.7605, test_loss: 0.9208, test_f1: 0.5764
 epoch: 26, train_loss: 0.7578, test_loss: 0.9036, test_f1: 0.5957
 epoch: 27, train_loss: 0.7312, test_loss: 0.8878, test_f1: 0.6014
 epoch: 28, train_loss: 0.7258, test_loss: 0.8906, test_f1: 0.5991
 epoch: 29, train_loss: 0.7244, test_loss: 0.9211, test_f1: 0.5933
 epoch: 30, train_loss: 0.7181, test_loss: 0.8929, test_f1: 0.5954
 epoch: 31, train_loss: 0.7118, test_loss: 0.9132, test_f1: 0.5903
 epoch: 32, train_loss: 0.7008, test_loss: 0.8988, test_f1: 0.6062
 epoch: 33, train_loss: 0.6979, test_loss: 0.8969, test_f1: 0.6225
 epoch: 34, train_loss: 0.6874, test_loss: 0.8706, test_f1: 0.6206
 epoch: 35, train_loss: 0.6770, test_loss: 0.9217, test_f1: 0.5724
 epoch: 36, train_loss: 0.6802, test_loss: 0.8897, test_f1: 0.5912
 epoch: 37, train_loss: 0.6729, test_loss: 0.9080, test_f1: 0.6041
 epoch: 38, train_loss: 0.6573, test_loss: 0.9179, test_f1: 0.5842
 epoch: 39, train_loss: 0.6546, test_loss: 0.8991, test_f1: 0.6070
 epoch: 40, train_loss: 0.6540, test_loss: 0.8863, test_f1: 0.6008
 epoch: 41, train_loss: 0.6540, test_loss: 0.8920, test_f1: 0.6303
 epoch: 42, train_loss: 0.6273, test_loss: 0.9079, test_f1: 0.6087
 epoch: 43, train_loss: 0.6307, test_loss: 0.9724, test_f1: 0.6081
 epoch: 44, train_loss: 0.6142, test_loss: 0.9222, test_f1: 0.6195
 epoch: 45, train_loss: 0.6091, test_loss: 0.9393, test_f1: 0.6226
 epoch: 46, train_loss: 0.6024, test_loss: 0.9518, test_f1: 0.6026
 epoch: 47, train_loss: 0.5994, test_loss: 0.9601, test_f1: 0.6265
 epoch: 48, train_loss: 0.5961, test_loss: 0.9484, test_f1: 0.6155
 epoch: 49, train_loss: 0.5866, test_loss: 0.9589, test_f1: 0.5960
 epoch: 50, train_loss: 0.5826, test_loss: 0.9713, test_f1: 0.6184
 epoch: 51, train_loss: 0.5713, test_loss: 0.8963, test_f1: 0.6171
 epoch: 52, train_loss: 0.5509, test_loss: 0.9462, test_f1: 0.6164
 epoch: 53, train_loss: 0.5549, test_loss: 0.9741, test_f1: 0.6110
 epoch: 54, train_loss: 0.5485, test_loss: 0.9456, test_f1: 0.6348
 epoch: 55, train_loss: 0.5568, test_loss: 0.9359, test_f1: 0.6188
 epoch: 56, train_loss: 0.5425, test_loss: 0.9620, test_f1: 0.6040
 epoch: 57, train_loss: 0.5382, test_loss: 0.9467, test_f1: 0.6067
 epoch: 58, train_loss: 0.5401, test_loss: 0.9674, test_f1: 0.6115
 epoch: 59, train_loss: 0.5306, test_loss: 1.0000, test_f1: 0.6121
 epoch: 60, train_loss: 0.5245, test_loss: 0.9974, test_f1: 0.6082
 epoch: 61, train_loss: 0.5233, test_loss: 0.9927, test_f1: 0.6265
 epoch: 62, train_loss: 0.5116, test_loss: 0.9680, test_f1: 0.6152
 epoch: 63, train_loss: 0.5302, test_loss: 1.0037, test_f1: 0.6076
 epoch: 64, train_loss: 0.5157, test_loss: 0.9949, test_f1: 0.6037
 epoch: 65, train_loss: 0.5157, test_loss: 1.0054, test_f1: 0.5998
 epoch: 66, train_loss: 0.5201, test_loss: 0.9711, test_f1: 0.6237
 epoch: 67, train_loss: 0.5184, test_loss: 1.0060, test_f1: 0.6125
 epoch: 68, train_loss: 0.5049, test_loss: 0.9650, test_f1: 0.6307
 epoch: 69, train_loss: 0.4921, test_loss: 1.0118, test_f1: 0.6188
 epoch: 70, train_loss: 0.4900, test_loss: 0.9956, test_f1: 0.6039
 epoch: 71, train_loss: 0.4944, test_loss: 1.0092, test_f1: 0.6183
 epoch: 72, train_loss: 0.5006, test_loss: 1.0337, test_f1: 0.6044
 epoch: 73, train_loss: 0.4869, test_loss: 1.0170, test_f1: 0.6240
 epoch: 74, train_loss: 0.4967, test_loss: 1.0395, test_f1: 0.6220
 epoch: 75, train_loss: 0.4945, test_loss: 1.0593, test_f1: 0.6121
 epoch: 76, train_loss: 0.4802, test_loss: 1.0407, test_f1: 0.6178
 epoch: 77, train_loss: 0.4750, test_loss: 1.0403, test_f1: 0.6197
 epoch: 78, train_loss: 0.4750, test_loss: 1.0215, test_f1: 0.6192
 epoch: 79, train_loss: 0.4709, test_loss: 1.0645, test_f1: 0.6103
 epoch: 80, train_loss: 0.4727, test_loss: 1.0713, test_f1: 0.6240
 epoch: 81, train_loss: 0.4743, test_loss: 1.0563, test_f1: 0.6124
 epoch: 82, train_loss: 0.4661, test_loss: 1.0598, test_f1: 0.6189
 epoch: 83, train_loss: 0.4616, test_loss: 1.0752, test_f1: 0.6190
 epoch: 84, train_loss: 0.4576, test_loss: 1.0623, test_f1: 0.6053
 epoch: 85, train_loss: 0.4577, test_loss: 1.0872, test_f1: 0.6304
 epoch: 86, train_loss: 0.4629, test_loss: 1.1116, test_f1: 0.6056
 epoch: 87, train_loss: 0.4560, test_loss: 1.1018, test_f1: 0.6115
 epoch: 88, train_loss: 0.4603, test_loss: 1.1181, test_f1: 0.6156
 epoch: 89, train_loss: 0.4553, test_loss: 1.1020, test_f1: 0.6089
 epoch: 90, train_loss: 0.4450, test_loss: 1.1082, test_f1: 0.6183
 epoch: 91, train_loss: 0.4317, test_loss: 1.1134, test_f1: 0.6170
 epoch: 92, train_loss: 0.4458, test_loss: 1.1481, test_f1: 0.6241
 epoch: 93, train_loss: 0.4443, test_loss: 1.1008, test_f1: 0.6161
 epoch: 94, train_loss: 0.4262, test_loss: 1.1387, test_f1: 0.6092
 epoch: 95, train_loss: 0.4310, test_loss: 1.0900, test_f1: 0.6139
 epoch: 96, train_loss: 0.4343, test_loss: 1.0796, test_f1: 0.6185
 epoch: 97, train_loss: 0.4278, test_loss: 1.1007, test_f1: 0.6245
 epoch: 98, train_loss: 0.4253, test_loss: 1.1393, test_f1: 0.6216
 epoch: 99, train_loss: 0.4226, test_loss: 1.1276, test_f1: 0.6241
##################ITERATION #4 ****************************************
 epoch: 0, train_loss: 1.2299, test_loss: 1.3271, test_f1: 0.2270
 epoch: 1, train_loss: 1.1301, test_loss: 1.2946, test_f1: 0.3379
 epoch: 2, train_loss: 1.0936, test_loss: 1.2344, test_f1: 0.3280
 epoch: 3, train_loss: 1.0581, test_loss: 1.1231, test_f1: 0.4312
 epoch: 4, train_loss: 1.0457, test_loss: 1.0261, test_f1: 0.5072
 epoch: 5, train_loss: 1.0152, test_loss: 0.9849, test_f1: 0.4868
 epoch: 6, train_loss: 0.9993, test_loss: 0.9534, test_f1: 0.4935
 epoch: 7, train_loss: 0.9716, test_loss: 0.9365, test_f1: 0.5062
 epoch: 8, train_loss: 0.9535, test_loss: 0.9307, test_f1: 0.5138
 epoch: 9, train_loss: 0.9436, test_loss: 0.9202, test_f1: 0.5150
 epoch: 10, train_loss: 0.9232, test_loss: 0.9162, test_f1: 0.5073
 epoch: 11, train_loss: 0.9065, test_loss: 0.9003, test_f1: 0.5387
 epoch: 12, train_loss: 0.8935, test_loss: 0.9113, test_f1: 0.5170
 epoch: 13, train_loss: 0.8880, test_loss: 0.8929, test_f1: 0.5335
 epoch: 14, train_loss: 0.8660, test_loss: 0.8962, test_f1: 0.5456
 epoch: 15, train_loss: 0.8606, test_loss: 0.8947, test_f1: 0.5629
 epoch: 16, train_loss: 0.8486, test_loss: 0.8946, test_f1: 0.5718
 epoch: 17, train_loss: 0.8384, test_loss: 0.8991, test_f1: 0.5365
 epoch: 18, train_loss: 0.8273, test_loss: 0.8919, test_f1: 0.5566
 epoch: 19, train_loss: 0.8260, test_loss: 0.8971, test_f1: 0.5815
 epoch: 20, train_loss: 0.8095, test_loss: 0.9162, test_f1: 0.5503
 epoch: 21, train_loss: 0.8060, test_loss: 0.8905, test_f1: 0.5832
 epoch: 22, train_loss: 0.7963, test_loss: 0.8876, test_f1: 0.5789
 epoch: 23, train_loss: 0.7911, test_loss: 0.8873, test_f1: 0.5923
 epoch: 24, train_loss: 0.7909, test_loss: 0.9031, test_f1: 0.5826
 epoch: 25, train_loss: 0.7768, test_loss: 0.9320, test_f1: 0.5657
 epoch: 26, train_loss: 0.7656, test_loss: 0.9017, test_f1: 0.5905
 epoch: 27, train_loss: 0.7580, test_loss: 0.8812, test_f1: 0.5919
 epoch: 28, train_loss: 0.7519, test_loss: 0.8903, test_f1: 0.5874
 epoch: 29, train_loss: 0.7385, test_loss: 0.8976, test_f1: 0.6106
 epoch: 30, train_loss: 0.7438, test_loss: 0.8989, test_f1: 0.6015
 epoch: 31, train_loss: 0.7422, test_loss: 0.8868, test_f1: 0.5787
 epoch: 32, train_loss: 0.7342, test_loss: 0.9157, test_f1: 0.5906
 epoch: 33, train_loss: 0.7211, test_loss: 0.9022, test_f1: 0.6037
 epoch: 34, train_loss: 0.7050, test_loss: 0.9319, test_f1: 0.5744
 epoch: 35, train_loss: 0.7093, test_loss: 0.9131, test_f1: 0.5932
 epoch: 36, train_loss: 0.6981, test_loss: 0.9065, test_f1: 0.6157
 epoch: 37, train_loss: 0.6887, test_loss: 0.9126, test_f1: 0.6045
 epoch: 38, train_loss: 0.6761, test_loss: 0.9230, test_f1: 0.6010
 epoch: 39, train_loss: 0.6860, test_loss: 0.9052, test_f1: 0.5974
 epoch: 40, train_loss: 0.6647, test_loss: 0.9146, test_f1: 0.5875
 epoch: 41, train_loss: 0.6770, test_loss: 0.9277, test_f1: 0.6100
 epoch: 42, train_loss: 0.6769, test_loss: 0.9157, test_f1: 0.6291
 epoch: 43, train_loss: 0.6713, test_loss: 0.9311, test_f1: 0.6248
 epoch: 44, train_loss: 0.6531, test_loss: 0.9176, test_f1: 0.6210
 epoch: 45, train_loss: 0.6578, test_loss: 0.9220, test_f1: 0.6269
 epoch: 46, train_loss: 0.6342, test_loss: 0.9203, test_f1: 0.6285
 epoch: 47, train_loss: 0.6295, test_loss: 0.9436, test_f1: 0.5969
 epoch: 48, train_loss: 0.6356, test_loss: 0.9219, test_f1: 0.6320
 epoch: 49, train_loss: 0.6220, test_loss: 0.9453, test_f1: 0.6073
 epoch: 50, train_loss: 0.6255, test_loss: 0.9715, test_f1: 0.6272
 epoch: 51, train_loss: 0.6098, test_loss: 0.9602, test_f1: 0.6124
 epoch: 52, train_loss: 0.5998, test_loss: 0.9677, test_f1: 0.6267
 epoch: 53, train_loss: 0.5866, test_loss: 0.9553, test_f1: 0.6251
 epoch: 54, train_loss: 0.5890, test_loss: 0.9705, test_f1: 0.6274
 epoch: 55, train_loss: 0.5820, test_loss: 0.9556, test_f1: 0.6265
 epoch: 56, train_loss: 0.5847, test_loss: 0.9642, test_f1: 0.6340
 epoch: 57, train_loss: 0.5823, test_loss: 0.9643, test_f1: 0.6182
 epoch: 58, train_loss: 0.5705, test_loss: 0.9741, test_f1: 0.6305
 epoch: 59, train_loss: 0.5653, test_loss: 0.9810, test_f1: 0.6265
 epoch: 60, train_loss: 0.5718, test_loss: 0.9879, test_f1: 0.6208
 epoch: 61, train_loss: 0.5623, test_loss: 0.9806, test_f1: 0.6289
 epoch: 62, train_loss: 0.5670, test_loss: 1.0079, test_f1: 0.6193
 epoch: 63, train_loss: 0.5644, test_loss: 0.9654, test_f1: 0.6341
 epoch: 64, train_loss: 0.5521, test_loss: 0.9987, test_f1: 0.6264
 epoch: 65, train_loss: 0.5546, test_loss: 0.9865, test_f1: 0.6269
 epoch: 66, train_loss: 0.5503, test_loss: 0.9870, test_f1: 0.6274
 epoch: 67, train_loss: 0.5531, test_loss: 1.0040, test_f1: 0.6264
 epoch: 68, train_loss: 0.5456, test_loss: 1.0035, test_f1: 0.6327
 epoch: 69, train_loss: 0.5513, test_loss: 1.0286, test_f1: 0.6274
 epoch: 70, train_loss: 0.5435, test_loss: 1.0182, test_f1: 0.6246
 epoch: 71, train_loss: 0.5394, test_loss: 1.0097, test_f1: 0.6268
 epoch: 72, train_loss: 0.5277, test_loss: 1.0207, test_f1: 0.6283
 epoch: 73, train_loss: 0.5218, test_loss: 1.0204, test_f1: 0.6244
 epoch: 74, train_loss: 0.5326, test_loss: 1.0097, test_f1: 0.6210
 epoch: 75, train_loss: 0.5172, test_loss: 1.0142, test_f1: 0.6265
 epoch: 76, train_loss: 0.5217, test_loss: 1.0224, test_f1: 0.6390
 epoch: 77, train_loss: 0.5213, test_loss: 1.0173, test_f1: 0.6321
 epoch: 78, train_loss: 0.5302, test_loss: 1.0683, test_f1: 0.6268
 epoch: 79, train_loss: 0.5187, test_loss: 1.0748, test_f1: 0.6287
 epoch: 80, train_loss: 0.5241, test_loss: 1.0170, test_f1: 0.6207
 epoch: 81, train_loss: 0.5197, test_loss: 1.0509, test_f1: 0.6268
 epoch: 82, train_loss: 0.5074, test_loss: 1.0249, test_f1: 0.6339
 epoch: 83, train_loss: 0.5165, test_loss: 1.0351, test_f1: 0.6353
 epoch: 84, train_loss: 0.5022, test_loss: 1.0305, test_f1: 0.6207
 epoch: 85, train_loss: 0.4973, test_loss: 1.0538, test_f1: 0.6198
 epoch: 86, train_loss: 0.5031, test_loss: 1.0273, test_f1: 0.6376
 epoch: 87, train_loss: 0.4987, test_loss: 1.0364, test_f1: 0.6348
 epoch: 88, train_loss: 0.5012, test_loss: 1.0336, test_f1: 0.6482
 epoch: 89, train_loss: 0.4909, test_loss: 1.0299, test_f1: 0.6132
 epoch: 90, train_loss: 0.4821, test_loss: 1.0367, test_f1: 0.6307
 epoch: 91, train_loss: 0.4867, test_loss: 1.0903, test_f1: 0.6220
 epoch: 92, train_loss: 0.4885, test_loss: 1.0396, test_f1: 0.6396
 epoch: 93, train_loss: 0.4934, test_loss: 1.1208, test_f1: 0.6150
 epoch: 94, train_loss: 0.4824, test_loss: 1.0373, test_f1: 0.6324
 epoch: 95, train_loss: 0.4935, test_loss: 1.0573, test_f1: 0.6375
 epoch: 96, train_loss: 0.4688, test_loss: 1.0799, test_f1: 0.6215
 epoch: 97, train_loss: 0.4766, test_loss: 1.1132, test_f1: 0.6268
 epoch: 98, train_loss: 0.4758, test_loss: 1.0522, test_f1: 0.6391
 epoch: 99, train_loss: 0.4526, test_loss: 1.0794, test_f1: 0.6350
##################ITERATION #5 ****************************************
 epoch: 0, train_loss: 1.2280, test_loss: 1.3535, test_f1: 0.2270
 epoch: 1, train_loss: 1.1140, test_loss: 1.4148, test_f1: 0.0879
 epoch: 2, train_loss: 1.0780, test_loss: 1.3319, test_f1: 0.1854
 epoch: 3, train_loss: 1.0455, test_loss: 1.1922, test_f1: 0.3297
 epoch: 4, train_loss: 1.0241, test_loss: 1.0939, test_f1: 0.4273
 epoch: 5, train_loss: 1.0031, test_loss: 0.9958, test_f1: 0.4843
 epoch: 6, train_loss: 0.9814, test_loss: 0.9475, test_f1: 0.5111
 epoch: 7, train_loss: 0.9677, test_loss: 0.9344, test_f1: 0.5059
 epoch: 8, train_loss: 0.9505, test_loss: 0.9165, test_f1: 0.5070
 epoch: 9, train_loss: 0.9281, test_loss: 0.9113, test_f1: 0.5343
 epoch: 10, train_loss: 0.9240, test_loss: 0.9119, test_f1: 0.5242
 epoch: 11, train_loss: 0.9074, test_loss: 0.9096, test_f1: 0.5143
 epoch: 12, train_loss: 0.8948, test_loss: 0.8971, test_f1: 0.5336
 epoch: 13, train_loss: 0.8756, test_loss: 0.8953, test_f1: 0.5252
 epoch: 14, train_loss: 0.8726, test_loss: 0.8993, test_f1: 0.5382
 epoch: 15, train_loss: 0.8633, test_loss: 0.8882, test_f1: 0.5461
 epoch: 16, train_loss: 0.8477, test_loss: 0.8862, test_f1: 0.5634
 epoch: 17, train_loss: 0.8384, test_loss: 0.9046, test_f1: 0.5564
 epoch: 18, train_loss: 0.8345, test_loss: 0.8823, test_f1: 0.5610
 epoch: 19, train_loss: 0.8182, test_loss: 0.8751, test_f1: 0.5634
 epoch: 20, train_loss: 0.8152, test_loss: 0.8788, test_f1: 0.5800
 epoch: 21, train_loss: 0.8032, test_loss: 0.9131, test_f1: 0.5810
 epoch: 22, train_loss: 0.7851, test_loss: 0.8917, test_f1: 0.5688
 epoch: 23, train_loss: 0.7802, test_loss: 0.8947, test_f1: 0.5696
 epoch: 24, train_loss: 0.7791, test_loss: 0.8936, test_f1: 0.5719
 epoch: 25, train_loss: 0.7665, test_loss: 0.8986, test_f1: 0.5601
 epoch: 26, train_loss: 0.7568, test_loss: 0.9250, test_f1: 0.5577
 epoch: 27, train_loss: 0.7617, test_loss: 0.9183, test_f1: 0.5955
 epoch: 28, train_loss: 0.7376, test_loss: 0.9155, test_f1: 0.5785
 epoch: 29, train_loss: 0.7360, test_loss: 0.9356, test_f1: 0.5773
 epoch: 30, train_loss: 0.7284, test_loss: 0.9018, test_f1: 0.5836
 epoch: 31, train_loss: 0.7178, test_loss: 0.9078, test_f1: 0.5856
 epoch: 32, train_loss: 0.7212, test_loss: 0.9213, test_f1: 0.6022
 epoch: 33, train_loss: 0.7046, test_loss: 0.9097, test_f1: 0.5991
 epoch: 34, train_loss: 0.7112, test_loss: 0.9366, test_f1: 0.5752
 epoch: 35, train_loss: 0.6907, test_loss: 0.9244, test_f1: 0.5841
 epoch: 36, train_loss: 0.6797, test_loss: 0.9389, test_f1: 0.5842
 epoch: 37, train_loss: 0.6852, test_loss: 0.9397, test_f1: 0.5812
 epoch: 38, train_loss: 0.6753, test_loss: 0.9477, test_f1: 0.5797
 epoch: 39, train_loss: 0.6774, test_loss: 0.9610, test_f1: 0.6045
 epoch: 40, train_loss: 0.6641, test_loss: 0.9439, test_f1: 0.6095
 epoch: 41, train_loss: 0.6625, test_loss: 0.9834, test_f1: 0.5905
 epoch: 42, train_loss: 0.6471, test_loss: 1.0087, test_f1: 0.5940
 epoch: 43, train_loss: 0.6488, test_loss: 0.9504, test_f1: 0.6065
 epoch: 44, train_loss: 0.6374, test_loss: 0.9742, test_f1: 0.5918
 epoch: 45, train_loss: 0.6432, test_loss: 0.9501, test_f1: 0.6084
 epoch: 46, train_loss: 0.6257, test_loss: 0.9655, test_f1: 0.6041
 epoch: 47, train_loss: 0.6322, test_loss: 0.9901, test_f1: 0.5985
 epoch: 48, train_loss: 0.6329, test_loss: 0.9643, test_f1: 0.6029
 epoch: 49, train_loss: 0.6055, test_loss: 0.9796, test_f1: 0.6120
 epoch: 50, train_loss: 0.5998, test_loss: 1.0115, test_f1: 0.5997
 epoch: 51, train_loss: 0.5886, test_loss: 0.9981, test_f1: 0.6149
 epoch: 52, train_loss: 0.5879, test_loss: 1.0187, test_f1: 0.5971
 epoch: 53, train_loss: 0.5815, test_loss: 0.9954, test_f1: 0.6114
 epoch: 54, train_loss: 0.5792, test_loss: 1.0057, test_f1: 0.6212
 epoch: 55, train_loss: 0.5732, test_loss: 1.0072, test_f1: 0.6249
 epoch: 56, train_loss: 0.5640, test_loss: 1.0098, test_f1: 0.6139
 epoch: 57, train_loss: 0.5648, test_loss: 1.0190, test_f1: 0.5969
 epoch: 58, train_loss: 0.5636, test_loss: 1.0204, test_f1: 0.6131
 epoch: 59, train_loss: 0.5653, test_loss: 1.0259, test_f1: 0.6028
 epoch: 60, train_loss: 0.5685, test_loss: 1.0400, test_f1: 0.5996
 epoch: 61, train_loss: 0.5552, test_loss: 1.0245, test_f1: 0.6117
 epoch: 62, train_loss: 0.5510, test_loss: 1.0342, test_f1: 0.5934
 epoch: 63, train_loss: 0.5503, test_loss: 1.0651, test_f1: 0.6104
 epoch: 64, train_loss: 0.5406, test_loss: 1.0627, test_f1: 0.6090
 epoch: 65, train_loss: 0.5507, test_loss: 1.0575, test_f1: 0.6123
 epoch: 66, train_loss: 0.5520, test_loss: 1.0451, test_f1: 0.6098
 epoch: 67, train_loss: 0.5378, test_loss: 1.0518, test_f1: 0.6129
 epoch: 68, train_loss: 0.5396, test_loss: 1.0639, test_f1: 0.6146
 epoch: 69, train_loss: 0.5461, test_loss: 1.0524, test_f1: 0.6104
 epoch: 70, train_loss: 0.5363, test_loss: 1.0880, test_f1: 0.6142
 epoch: 71, train_loss: 0.5324, test_loss: 1.0520, test_f1: 0.6195
 epoch: 72, train_loss: 0.5226, test_loss: 1.0783, test_f1: 0.6151
 epoch: 73, train_loss: 0.5214, test_loss: 1.1047, test_f1: 0.6192
 epoch: 74, train_loss: 0.5303, test_loss: 1.1213, test_f1: 0.6190
 epoch: 75, train_loss: 0.5249, test_loss: 1.0755, test_f1: 0.6285
 epoch: 76, train_loss: 0.5226, test_loss: 1.0762, test_f1: 0.6195
 epoch: 77, train_loss: 0.5094, test_loss: 1.0674, test_f1: 0.6272
 epoch: 78, train_loss: 0.5079, test_loss: 1.0855, test_f1: 0.6147
 epoch: 79, train_loss: 0.5162, test_loss: 1.1057, test_f1: 0.6223
 epoch: 80, train_loss: 0.5053, test_loss: 1.1071, test_f1: 0.6241
 epoch: 81, train_loss: 0.4973, test_loss: 1.0977, test_f1: 0.6135
 epoch: 82, train_loss: 0.4990, test_loss: 1.1047, test_f1: 0.6176
 epoch: 83, train_loss: 0.5152, test_loss: 1.1074, test_f1: 0.6252
 epoch: 84, train_loss: 0.4943, test_loss: 1.0971, test_f1: 0.6283
 epoch: 85, train_loss: 0.4923, test_loss: 1.1317, test_f1: 0.6121
 epoch: 86, train_loss: 0.5010, test_loss: 1.1313, test_f1: 0.6207
 epoch: 87, train_loss: 0.4952, test_loss: 1.1336, test_f1: 0.6167
 epoch: 88, train_loss: 0.4841, test_loss: 1.1272, test_f1: 0.6244
 epoch: 89, train_loss: 0.4783, test_loss: 1.1328, test_f1: 0.6370
 epoch: 90, train_loss: 0.4667, test_loss: 1.1219, test_f1: 0.6355
 epoch: 91, train_loss: 0.4815, test_loss: 1.1573, test_f1: 0.6108
 epoch: 92, train_loss: 0.4767, test_loss: 1.1657, test_f1: 0.6031
 epoch: 93, train_loss: 0.4814, test_loss: 1.1409, test_f1: 0.6119
 epoch: 94, train_loss: 0.4668, test_loss: 1.1518, test_f1: 0.6173
 epoch: 95, train_loss: 0.4852, test_loss: 1.1594, test_f1: 0.6274
 epoch: 96, train_loss: 0.4761, test_loss: 1.1795, test_f1: 0.6184
 epoch: 97, train_loss: 0.4681, test_loss: 1.1857, test_f1: 0.6172
 epoch: 98, train_loss: 0.4654, test_loss: 1.1724, test_f1: 0.6078
 epoch: 99, train_loss: 0.4755, test_loss: 1.1715, test_f1: 0.6294
##################ITERATION #6 ****************************************
 epoch: 0, train_loss: 1.2529, test_loss: 1.3615, test_f1: 0.2549
 epoch: 1, train_loss: 1.1346, test_loss: 1.3712, test_f1: 0.2454
 epoch: 2, train_loss: 1.0885, test_loss: 1.3359, test_f1: 0.2399
 epoch: 3, train_loss: 1.0543, test_loss: 1.2156, test_f1: 0.3462
 epoch: 4, train_loss: 1.0329, test_loss: 1.0799, test_f1: 0.4191
 epoch: 5, train_loss: 1.0137, test_loss: 1.0006, test_f1: 0.5095
 epoch: 6, train_loss: 0.9902, test_loss: 0.9670, test_f1: 0.5049
 epoch: 7, train_loss: 0.9595, test_loss: 0.9299, test_f1: 0.5238
 epoch: 8, train_loss: 0.9576, test_loss: 0.9217, test_f1: 0.5454
 epoch: 9, train_loss: 0.9317, test_loss: 0.9243, test_f1: 0.5477
 epoch: 10, train_loss: 0.9278, test_loss: 0.9214, test_f1: 0.5444
 epoch: 11, train_loss: 0.9158, test_loss: 0.8995, test_f1: 0.5472
 epoch: 12, train_loss: 0.8921, test_loss: 0.9017, test_f1: 0.5381
 epoch: 13, train_loss: 0.8846, test_loss: 0.9010, test_f1: 0.5559
 epoch: 14, train_loss: 0.8749, test_loss: 0.8907, test_f1: 0.5739
 epoch: 15, train_loss: 0.8626, test_loss: 0.8989, test_f1: 0.5822
 epoch: 16, train_loss: 0.8577, test_loss: 0.8975, test_f1: 0.5886
 epoch: 17, train_loss: 0.8434, test_loss: 0.8982, test_f1: 0.5928
 epoch: 18, train_loss: 0.8346, test_loss: 0.8760, test_f1: 0.5875
 epoch: 19, train_loss: 0.8247, test_loss: 0.8934, test_f1: 0.5810
 epoch: 20, train_loss: 0.8231, test_loss: 0.8923, test_f1: 0.5992
 epoch: 21, train_loss: 0.8077, test_loss: 0.8851, test_f1: 0.5733
 epoch: 22, train_loss: 0.8030, test_loss: 0.8839, test_f1: 0.5677
 epoch: 23, train_loss: 0.7971, test_loss: 0.9089, test_f1: 0.5758
 epoch: 24, train_loss: 0.7857, test_loss: 0.8981, test_f1: 0.5898
 epoch: 25, train_loss: 0.7721, test_loss: 0.9103, test_f1: 0.5797
 epoch: 26, train_loss: 0.7697, test_loss: 0.9090, test_f1: 0.5955
 epoch: 27, train_loss: 0.7515, test_loss: 0.9092, test_f1: 0.5970
 epoch: 28, train_loss: 0.7564, test_loss: 0.8740, test_f1: 0.6161
 epoch: 29, train_loss: 0.7522, test_loss: 0.9109, test_f1: 0.5823
 epoch: 30, train_loss: 0.7429, test_loss: 0.9020, test_f1: 0.5846
 epoch: 31, train_loss: 0.7342, test_loss: 0.9248, test_f1: 0.5748
 epoch: 32, train_loss: 0.7244, test_loss: 0.9078, test_f1: 0.6156
 epoch: 33, train_loss: 0.7200, test_loss: 0.9128, test_f1: 0.5933
 epoch: 34, train_loss: 0.7175, test_loss: 0.9312, test_f1: 0.5862
 epoch: 35, train_loss: 0.7013, test_loss: 0.9166, test_f1: 0.6007
 epoch: 36, train_loss: 0.7084, test_loss: 0.9362, test_f1: 0.5794
 epoch: 37, train_loss: 0.6965, test_loss: 0.8983, test_f1: 0.6239
 epoch: 38, train_loss: 0.7111, test_loss: 0.9477, test_f1: 0.6056
 epoch: 39, train_loss: 0.6907, test_loss: 0.9351, test_f1: 0.5991
 epoch: 40, train_loss: 0.6902, test_loss: 0.9383, test_f1: 0.6236
 epoch: 41, train_loss: 0.6675, test_loss: 0.9104, test_f1: 0.5985
 epoch: 42, train_loss: 0.6637, test_loss: 0.9396, test_f1: 0.5924
 epoch: 43, train_loss: 0.6648, test_loss: 0.9428, test_f1: 0.5902
 epoch: 44, train_loss: 0.6678, test_loss: 0.9603, test_f1: 0.6172
 epoch: 45, train_loss: 0.6471, test_loss: 0.9349, test_f1: 0.6121
 epoch: 46, train_loss: 0.6410, test_loss: 0.9535, test_f1: 0.5884
 epoch: 47, train_loss: 0.6492, test_loss: 0.9505, test_f1: 0.5999
 epoch: 48, train_loss: 0.6224, test_loss: 0.9356, test_f1: 0.6189
 epoch: 49, train_loss: 0.6385, test_loss: 0.9492, test_f1: 0.6053
 epoch: 50, train_loss: 0.6344, test_loss: 0.9442, test_f1: 0.6138
 epoch: 51, train_loss: 0.6239, test_loss: 0.9401, test_f1: 0.6112
 epoch: 52, train_loss: 0.6103, test_loss: 0.9372, test_f1: 0.6153
 epoch: 53, train_loss: 0.6061, test_loss: 0.9477, test_f1: 0.6122
 epoch: 54, train_loss: 0.5969, test_loss: 0.9711, test_f1: 0.6001
 epoch: 55, train_loss: 0.5956, test_loss: 0.9611, test_f1: 0.6094
 epoch: 56, train_loss: 0.5935, test_loss: 0.9704, test_f1: 0.6231
 epoch: 57, train_loss: 0.5828, test_loss: 1.0017, test_f1: 0.6045
 epoch: 58, train_loss: 0.5867, test_loss: 0.9734, test_f1: 0.6054
 epoch: 59, train_loss: 0.5916, test_loss: 0.9853, test_f1: 0.6074
 epoch: 60, train_loss: 0.5904, test_loss: 0.9796, test_f1: 0.6117
 epoch: 61, train_loss: 0.5884, test_loss: 1.0080, test_f1: 0.6065
 epoch: 62, train_loss: 0.5778, test_loss: 1.0038, test_f1: 0.6055
 epoch: 63, train_loss: 0.5821, test_loss: 0.9983, test_f1: 0.6009
 epoch: 64, train_loss: 0.5705, test_loss: 1.0109, test_f1: 0.5932
 epoch: 65, train_loss: 0.5757, test_loss: 1.0070, test_f1: 0.6088
 epoch: 66, train_loss: 0.5588, test_loss: 0.9982, test_f1: 0.6267
 epoch: 67, train_loss: 0.5571, test_loss: 0.9970, test_f1: 0.6303
 epoch: 68, train_loss: 0.5626, test_loss: 1.0012, test_f1: 0.6239
 epoch: 69, train_loss: 0.5497, test_loss: 1.0298, test_f1: 0.6305
 epoch: 70, train_loss: 0.5414, test_loss: 1.0089, test_f1: 0.6275
 epoch: 71, train_loss: 0.5499, test_loss: 1.0277, test_f1: 0.6228
 epoch: 72, train_loss: 0.5540, test_loss: 1.0356, test_f1: 0.6080
 epoch: 73, train_loss: 0.5407, test_loss: 1.0152, test_f1: 0.6246
 epoch: 74, train_loss: 0.5405, test_loss: 1.0243, test_f1: 0.6213
 epoch: 75, train_loss: 0.5505, test_loss: 1.0408, test_f1: 0.6140
 epoch: 76, train_loss: 0.5395, test_loss: 1.0471, test_f1: 0.6258
 epoch: 77, train_loss: 0.5381, test_loss: 1.0274, test_f1: 0.6101
 epoch: 78, train_loss: 0.5398, test_loss: 1.0250, test_f1: 0.6048
 epoch: 79, train_loss: 0.5254, test_loss: 1.0616, test_f1: 0.6105
 epoch: 80, train_loss: 0.5439, test_loss: 1.0560, test_f1: 0.6070
 epoch: 81, train_loss: 0.5223, test_loss: 1.0776, test_f1: 0.6374
 epoch: 82, train_loss: 0.5321, test_loss: 1.0304, test_f1: 0.6324
 epoch: 83, train_loss: 0.5194, test_loss: 1.0413, test_f1: 0.6288
 epoch: 84, train_loss: 0.5201, test_loss: 1.0677, test_f1: 0.6129
 epoch: 85, train_loss: 0.5306, test_loss: 1.0898, test_f1: 0.6038
 epoch: 86, train_loss: 0.5151, test_loss: 1.0769, test_f1: 0.6196
 epoch: 87, train_loss: 0.5080, test_loss: 1.0742, test_f1: 0.6186
 epoch: 88, train_loss: 0.5071, test_loss: 1.0894, test_f1: 0.6091
 epoch: 89, train_loss: 0.5172, test_loss: 1.0898, test_f1: 0.5999
 epoch: 90, train_loss: 0.5078, test_loss: 1.0998, test_f1: 0.6049
 epoch: 91, train_loss: 0.5095, test_loss: 1.1096, test_f1: 0.6040
 epoch: 92, train_loss: 0.5090, test_loss: 1.1104, test_f1: 0.6181
 epoch: 93, train_loss: 0.4939, test_loss: 1.1320, test_f1: 0.6101
 epoch: 94, train_loss: 0.4876, test_loss: 1.1360, test_f1: 0.6003
 epoch: 95, train_loss: 0.4864, test_loss: 1.1013, test_f1: 0.5998
 epoch: 96, train_loss: 0.4892, test_loss: 1.1125, test_f1: 0.6033
 epoch: 97, train_loss: 0.4893, test_loss: 1.0952, test_f1: 0.6096
 epoch: 98, train_loss: 0.4885, test_loss: 1.1305, test_f1: 0.6043
 epoch: 99, train_loss: 0.4913, test_loss: 1.1157, test_f1: 0.6152
##################ITERATION #7 ****************************************
 epoch: 0, train_loss: 1.2753, test_loss: 1.3533, test_f1: 0.2650
 epoch: 1, train_loss: 1.1408, test_loss: 1.3326, test_f1: 0.2468
 epoch: 2, train_loss: 1.0964, test_loss: 1.2050, test_f1: 0.3899
 epoch: 3, train_loss: 1.0632, test_loss: 1.1402, test_f1: 0.4376
 epoch: 4, train_loss: 1.0323, test_loss: 1.0542, test_f1: 0.4963
 epoch: 5, train_loss: 0.9992, test_loss: 0.9687, test_f1: 0.5379
 epoch: 6, train_loss: 0.9850, test_loss: 0.9536, test_f1: 0.4949
 epoch: 7, train_loss: 0.9722, test_loss: 0.9350, test_f1: 0.4899
 epoch: 8, train_loss: 0.9522, test_loss: 0.9375, test_f1: 0.5014
 epoch: 9, train_loss: 0.9422, test_loss: 0.9256, test_f1: 0.5033
 epoch: 10, train_loss: 0.9273, test_loss: 0.9511, test_f1: 0.5009
 epoch: 11, train_loss: 0.9099, test_loss: 0.8984, test_f1: 0.5222
 epoch: 12, train_loss: 0.8981, test_loss: 0.9354, test_f1: 0.5105
 epoch: 13, train_loss: 0.8805, test_loss: 0.9046, test_f1: 0.5105
 epoch: 14, train_loss: 0.8790, test_loss: 0.9160, test_f1: 0.5202
 epoch: 15, train_loss: 0.8592, test_loss: 0.9086, test_f1: 0.5508
 epoch: 16, train_loss: 0.8622, test_loss: 0.9200, test_f1: 0.5562
 epoch: 17, train_loss: 0.8419, test_loss: 0.9065, test_f1: 0.5751
 epoch: 18, train_loss: 0.8267, test_loss: 0.8839, test_f1: 0.5582
 epoch: 19, train_loss: 0.8221, test_loss: 0.9136, test_f1: 0.5674
 epoch: 20, train_loss: 0.8149, test_loss: 0.9132, test_f1: 0.5694
 epoch: 21, train_loss: 0.8155, test_loss: 0.9282, test_f1: 0.5345
 epoch: 22, train_loss: 0.7995, test_loss: 0.9280, test_f1: 0.5549
 epoch: 23, train_loss: 0.7948, test_loss: 0.9169, test_f1: 0.5725
 epoch: 24, train_loss: 0.7784, test_loss: 0.9329, test_f1: 0.5589
 epoch: 25, train_loss: 0.7773, test_loss: 0.9317, test_f1: 0.5612
 epoch: 26, train_loss: 0.7769, test_loss: 0.9251, test_f1: 0.5819
 epoch: 27, train_loss: 0.7643, test_loss: 0.9290, test_f1: 0.5854
 epoch: 28, train_loss: 0.7477, test_loss: 0.8829, test_f1: 0.5847
 epoch: 29, train_loss: 0.7395, test_loss: 0.9241, test_f1: 0.5865
 epoch: 30, train_loss: 0.7478, test_loss: 0.9694, test_f1: 0.5968
 epoch: 31, train_loss: 0.7366, test_loss: 0.9101, test_f1: 0.5835
 epoch: 32, train_loss: 0.7326, test_loss: 0.9273, test_f1: 0.5853
 epoch: 33, train_loss: 0.7359, test_loss: 0.9345, test_f1: 0.5887
 epoch: 34, train_loss: 0.7170, test_loss: 0.9010, test_f1: 0.6092
 epoch: 35, train_loss: 0.7152, test_loss: 0.9378, test_f1: 0.5979
 epoch: 36, train_loss: 0.6961, test_loss: 0.9390, test_f1: 0.6134
 epoch: 37, train_loss: 0.6979, test_loss: 0.9288, test_f1: 0.5868
 epoch: 38, train_loss: 0.6984, test_loss: 0.9219, test_f1: 0.6022
 epoch: 39, train_loss: 0.6816, test_loss: 0.9432, test_f1: 0.5948
 epoch: 40, train_loss: 0.6727, test_loss: 0.9173, test_f1: 0.5889
 epoch: 41, train_loss: 0.6679, test_loss: 0.9380, test_f1: 0.5988
 epoch: 42, train_loss: 0.6713, test_loss: 0.9209, test_f1: 0.5994
 epoch: 43, train_loss: 0.6625, test_loss: 0.9546, test_f1: 0.6116
 epoch: 44, train_loss: 0.6458, test_loss: 0.9623, test_f1: 0.6060
 epoch: 45, train_loss: 0.6441, test_loss: 0.9693, test_f1: 0.5944
 epoch: 46, train_loss: 0.6393, test_loss: 0.9738, test_f1: 0.6005
 epoch: 47, train_loss: 0.6373, test_loss: 0.9809, test_f1: 0.5933
 epoch: 48, train_loss: 0.6462, test_loss: 1.0016, test_f1: 0.6062
 epoch: 49, train_loss: 0.6324, test_loss: 0.9729, test_f1: 0.6156
 epoch: 50, train_loss: 0.6468, test_loss: 0.9427, test_f1: 0.6179
 epoch: 51, train_loss: 0.6128, test_loss: 0.9603, test_f1: 0.5958
 epoch: 52, train_loss: 0.6076, test_loss: 0.9601, test_f1: 0.6071
 epoch: 53, train_loss: 0.6119, test_loss: 0.9742, test_f1: 0.6114
 epoch: 54, train_loss: 0.5987, test_loss: 0.9929, test_f1: 0.6022
 epoch: 55, train_loss: 0.5984, test_loss: 1.0127, test_f1: 0.6072
 epoch: 56, train_loss: 0.5931, test_loss: 0.9853, test_f1: 0.6080
 epoch: 57, train_loss: 0.5833, test_loss: 0.9794, test_f1: 0.6044
 epoch: 58, train_loss: 0.5805, test_loss: 0.9872, test_f1: 0.6048
 epoch: 59, train_loss: 0.5805, test_loss: 0.9963, test_f1: 0.6105
 epoch: 60, train_loss: 0.5844, test_loss: 0.9988, test_f1: 0.6068
 epoch: 61, train_loss: 0.5890, test_loss: 0.9959, test_f1: 0.6050
 epoch: 62, train_loss: 0.5937, test_loss: 1.0053, test_f1: 0.6145
 epoch: 63, train_loss: 0.5706, test_loss: 1.0103, test_f1: 0.6097
 epoch: 64, train_loss: 0.5726, test_loss: 0.9856, test_f1: 0.6144
 epoch: 65, train_loss: 0.5754, test_loss: 1.0078, test_f1: 0.6050
 epoch: 66, train_loss: 0.5638, test_loss: 0.9942, test_f1: 0.6167
 epoch: 67, train_loss: 0.5583, test_loss: 0.9989, test_f1: 0.6213
 epoch: 68, train_loss: 0.5686, test_loss: 1.0298, test_f1: 0.6239
 epoch: 69, train_loss: 0.5584, test_loss: 1.0069, test_f1: 0.5986
 epoch: 70, train_loss: 0.5665, test_loss: 1.0352, test_f1: 0.6115
 epoch: 71, train_loss: 0.5534, test_loss: 1.0026, test_f1: 0.6072
 epoch: 72, train_loss: 0.5578, test_loss: 1.0398, test_f1: 0.6025
 epoch: 73, train_loss: 0.5404, test_loss: 1.0303, test_f1: 0.6116
 epoch: 74, train_loss: 0.5413, test_loss: 1.0202, test_f1: 0.6136
 epoch: 75, train_loss: 0.5514, test_loss: 1.0043, test_f1: 0.6202
 epoch: 76, train_loss: 0.5297, test_loss: 1.0348, test_f1: 0.6113
 epoch: 77, train_loss: 0.5414, test_loss: 1.0392, test_f1: 0.6217
 epoch: 78, train_loss: 0.5356, test_loss: 1.0277, test_f1: 0.6135
 epoch: 79, train_loss: 0.5248, test_loss: 1.0509, test_f1: 0.6056
 epoch: 80, train_loss: 0.5204, test_loss: 1.0676, test_f1: 0.6095
 epoch: 81, train_loss: 0.5109, test_loss: 1.0445, test_f1: 0.6138
 epoch: 82, train_loss: 0.5068, test_loss: 1.0285, test_f1: 0.6184
 epoch: 83, train_loss: 0.5167, test_loss: 1.0790, test_f1: 0.6160
 epoch: 84, train_loss: 0.5205, test_loss: 1.0345, test_f1: 0.6206
 epoch: 85, train_loss: 0.5065, test_loss: 1.0609, test_f1: 0.6246
 epoch: 86, train_loss: 0.5233, test_loss: 1.0323, test_f1: 0.6093
 epoch: 87, train_loss: 0.5158, test_loss: 1.0612, test_f1: 0.6051
 epoch: 88, train_loss: 0.4935, test_loss: 1.0493, test_f1: 0.6076
 epoch: 89, train_loss: 0.4939, test_loss: 1.1206, test_f1: 0.6127
 epoch: 90, train_loss: 0.4947, test_loss: 1.0580, test_f1: 0.6171
 epoch: 91, train_loss: 0.5244, test_loss: 1.1117, test_f1: 0.6089
 epoch: 92, train_loss: 0.4938, test_loss: 1.1118, test_f1: 0.6073
 epoch: 93, train_loss: 0.5041, test_loss: 1.0777, test_f1: 0.6150
 epoch: 94, train_loss: 0.5015, test_loss: 1.0887, test_f1: 0.6252
 epoch: 95, train_loss: 0.4971, test_loss: 1.0605, test_f1: 0.6179
 epoch: 96, train_loss: 0.4922, test_loss: 1.0897, test_f1: 0.6209
 epoch: 97, train_loss: 0.5015, test_loss: 1.0982, test_f1: 0.6128
 epoch: 98, train_loss: 0.4833, test_loss: 1.0950, test_f1: 0.6204
 epoch: 99, train_loss: 0.4841, test_loss: 1.0974, test_f1: 0.6201
##################ITERATION #8 ****************************************
 epoch: 0, train_loss: 1.2843, test_loss: 1.3248, test_f1: 0.2270
 epoch: 1, train_loss: 1.1404, test_loss: 1.3757, test_f1: 0.1702
 epoch: 2, train_loss: 1.0916, test_loss: 1.2923, test_f1: 0.2905
 epoch: 3, train_loss: 1.0592, test_loss: 1.1610, test_f1: 0.4090
 epoch: 4, train_loss: 1.0318, test_loss: 1.0599, test_f1: 0.4289
 epoch: 5, train_loss: 1.0048, test_loss: 0.9868, test_f1: 0.4946
 epoch: 6, train_loss: 0.9754, test_loss: 0.9529, test_f1: 0.4826
 epoch: 7, train_loss: 0.9701, test_loss: 0.9298, test_f1: 0.4811
 epoch: 8, train_loss: 0.9496, test_loss: 0.9275, test_f1: 0.4786
 epoch: 9, train_loss: 0.9356, test_loss: 0.9005, test_f1: 0.4843
 epoch: 10, train_loss: 0.9173, test_loss: 0.9038, test_f1: 0.5010
 epoch: 11, train_loss: 0.9174, test_loss: 0.9031, test_f1: 0.5028
 epoch: 12, train_loss: 0.9004, test_loss: 0.8889, test_f1: 0.5087
 epoch: 13, train_loss: 0.8813, test_loss: 0.8911, test_f1: 0.5106
 epoch: 14, train_loss: 0.8752, test_loss: 0.8977, test_f1: 0.5152
 epoch: 15, train_loss: 0.8770, test_loss: 0.8877, test_f1: 0.5173
 epoch: 16, train_loss: 0.8582, test_loss: 0.8852, test_f1: 0.5253
 epoch: 17, train_loss: 0.8441, test_loss: 0.8817, test_f1: 0.5254
 epoch: 18, train_loss: 0.8352, test_loss: 0.8819, test_f1: 0.5405
 epoch: 19, train_loss: 0.8294, test_loss: 0.8625, test_f1: 0.5480
 epoch: 20, train_loss: 0.8124, test_loss: 0.8865, test_f1: 0.5375
 epoch: 21, train_loss: 0.8118, test_loss: 0.8839, test_f1: 0.5420
 epoch: 22, train_loss: 0.8168, test_loss: 0.8775, test_f1: 0.5481
 epoch: 23, train_loss: 0.8023, test_loss: 0.8671, test_f1: 0.5456
 epoch: 24, train_loss: 0.8011, test_loss: 0.8842, test_f1: 0.5616
 epoch: 25, train_loss: 0.7961, test_loss: 0.8963, test_f1: 0.5524
 epoch: 26, train_loss: 0.7897, test_loss: 0.8879, test_f1: 0.5703
 epoch: 27, train_loss: 0.7655, test_loss: 0.8844, test_f1: 0.5513
 epoch: 28, train_loss: 0.7617, test_loss: 0.8672, test_f1: 0.5760
 epoch: 29, train_loss: 0.7520, test_loss: 0.9001, test_f1: 0.5678
 epoch: 30, train_loss: 0.7542, test_loss: 0.9075, test_f1: 0.5577
 epoch: 31, train_loss: 0.7542, test_loss: 0.8882, test_f1: 0.5729
 epoch: 32, train_loss: 0.7518, test_loss: 0.9040, test_f1: 0.5599
 epoch: 33, train_loss: 0.7314, test_loss: 0.9234, test_f1: 0.5701
 epoch: 34, train_loss: 0.7255, test_loss: 0.9006, test_f1: 0.5732
 epoch: 35, train_loss: 0.7203, test_loss: 0.8920, test_f1: 0.5756
 epoch: 36, train_loss: 0.7107, test_loss: 0.8909, test_f1: 0.5858
 epoch: 37, train_loss: 0.7002, test_loss: 0.9177, test_f1: 0.5755
 epoch: 38, train_loss: 0.6943, test_loss: 0.9066, test_f1: 0.5841
 epoch: 39, train_loss: 0.7155, test_loss: 0.9054, test_f1: 0.5904
 epoch: 40, train_loss: 0.6967, test_loss: 0.8882, test_f1: 0.5892
 epoch: 41, train_loss: 0.6859, test_loss: 0.8971, test_f1: 0.5836
 epoch: 42, train_loss: 0.6858, test_loss: 0.9112, test_f1: 0.5822
 epoch: 43, train_loss: 0.6730, test_loss: 0.9321, test_f1: 0.5642
 epoch: 44, train_loss: 0.6622, test_loss: 0.9308, test_f1: 0.5851
 epoch: 45, train_loss: 0.6637, test_loss: 0.8969, test_f1: 0.6292
 epoch: 46, train_loss: 0.6544, test_loss: 0.9159, test_f1: 0.5922
 epoch: 47, train_loss: 0.6581, test_loss: 0.9064, test_f1: 0.5870
 epoch: 48, train_loss: 0.6546, test_loss: 0.9205, test_f1: 0.5965
 epoch: 49, train_loss: 0.6432, test_loss: 0.9494, test_f1: 0.5980
 epoch: 50, train_loss: 0.6359, test_loss: 0.9391, test_f1: 0.6027
 epoch: 51, train_loss: 0.6235, test_loss: 0.9317, test_f1: 0.6082
 epoch: 52, train_loss: 0.6103, test_loss: 0.9289, test_f1: 0.6121
 epoch: 53, train_loss: 0.6115, test_loss: 0.9392, test_f1: 0.5987
 epoch: 54, train_loss: 0.6157, test_loss: 0.9416, test_f1: 0.6126
 epoch: 55, train_loss: 0.6031, test_loss: 0.9298, test_f1: 0.6132
 epoch: 56, train_loss: 0.5999, test_loss: 0.9358, test_f1: 0.6112
 epoch: 57, train_loss: 0.6022, test_loss: 0.9633, test_f1: 0.6169
 epoch: 58, train_loss: 0.5921, test_loss: 0.9586, test_f1: 0.6136
 epoch: 59, train_loss: 0.5925, test_loss: 0.9573, test_f1: 0.6238
 epoch: 60, train_loss: 0.5839, test_loss: 0.9525, test_f1: 0.6147
 epoch: 61, train_loss: 0.5909, test_loss: 0.9437, test_f1: 0.6143
 epoch: 62, train_loss: 0.5846, test_loss: 0.9437, test_f1: 0.6086
 epoch: 63, train_loss: 0.5735, test_loss: 0.9745, test_f1: 0.5966
 epoch: 64, train_loss: 0.5698, test_loss: 0.9862, test_f1: 0.6100
 epoch: 65, train_loss: 0.5642, test_loss: 0.9794, test_f1: 0.6140
 epoch: 66, train_loss: 0.5638, test_loss: 0.9854, test_f1: 0.6230
 epoch: 67, train_loss: 0.5661, test_loss: 0.9905, test_f1: 0.6171
 epoch: 68, train_loss: 0.5630, test_loss: 0.9772, test_f1: 0.6146
 epoch: 69, train_loss: 0.5595, test_loss: 0.9962, test_f1: 0.6115
 epoch: 70, train_loss: 0.5663, test_loss: 0.9815, test_f1: 0.6299
 epoch: 71, train_loss: 0.5542, test_loss: 0.9827, test_f1: 0.6120
 epoch: 72, train_loss: 0.5564, test_loss: 1.0066, test_f1: 0.6101
 epoch: 73, train_loss: 0.5503, test_loss: 0.9892, test_f1: 0.6108
 epoch: 74, train_loss: 0.5541, test_loss: 0.9842, test_f1: 0.6249
 epoch: 75, train_loss: 0.5503, test_loss: 0.9667, test_f1: 0.6338
 epoch: 76, train_loss: 0.5432, test_loss: 1.0208, test_f1: 0.6218
 epoch: 77, train_loss: 0.5441, test_loss: 0.9804, test_f1: 0.6212
 epoch: 78, train_loss: 0.5329, test_loss: 1.0102, test_f1: 0.6154
 epoch: 79, train_loss: 0.5299, test_loss: 1.0259, test_f1: 0.6148
 epoch: 80, train_loss: 0.5376, test_loss: 1.0403, test_f1: 0.6188
 epoch: 81, train_loss: 0.5342, test_loss: 1.0374, test_f1: 0.6209
 epoch: 82, train_loss: 0.5298, test_loss: 1.0312, test_f1: 0.6202
 epoch: 83, train_loss: 0.5366, test_loss: 1.0430, test_f1: 0.6272
 epoch: 84, train_loss: 0.5221, test_loss: 1.0349, test_f1: 0.6115
 epoch: 85, train_loss: 0.5183, test_loss: 1.0152, test_f1: 0.6205
 epoch: 86, train_loss: 0.5288, test_loss: 1.0283, test_f1: 0.6197
 epoch: 87, train_loss: 0.5291, test_loss: 1.0193, test_f1: 0.6131
 epoch: 88, train_loss: 0.5115, test_loss: 1.0840, test_f1: 0.6235
 epoch: 89, train_loss: 0.5203, test_loss: 1.0873, test_f1: 0.6207
 epoch: 90, train_loss: 0.5227, test_loss: 1.1004, test_f1: 0.6129
 epoch: 91, train_loss: 0.5265, test_loss: 1.0894, test_f1: 0.6212
 epoch: 92, train_loss: 0.5126, test_loss: 1.0734, test_f1: 0.6182
 epoch: 93, train_loss: 0.5074, test_loss: 1.0654, test_f1: 0.6252
 epoch: 94, train_loss: 0.4980, test_loss: 1.0717, test_f1: 0.6245
 epoch: 95, train_loss: 0.4984, test_loss: 1.0815, test_f1: 0.6254
 epoch: 96, train_loss: 0.4989, test_loss: 1.0885, test_f1: 0.6208
 epoch: 97, train_loss: 0.4890, test_loss: 1.0636, test_f1: 0.6269
 epoch: 98, train_loss: 0.4928, test_loss: 1.0664, test_f1: 0.6270
 epoch: 99, train_loss: 0.4991, test_loss: 1.0983, test_f1: 0.6300
##################ITERATION #9 ****************************************
 epoch: 0, train_loss: 1.2679, test_loss: 1.2979, test_f1: 0.2270
 epoch: 1, train_loss: 1.1394, test_loss: 1.2592, test_f1: 0.3149
 epoch: 2, train_loss: 1.0865, test_loss: 1.1422, test_f1: 0.4007
 epoch: 3, train_loss: 1.0509, test_loss: 1.0960, test_f1: 0.4662
 epoch: 4, train_loss: 1.0287, test_loss: 1.0062, test_f1: 0.4984
 epoch: 5, train_loss: 1.0100, test_loss: 0.9464, test_f1: 0.5244
 epoch: 6, train_loss: 0.9833, test_loss: 0.9137, test_f1: 0.5009
 epoch: 7, train_loss: 0.9735, test_loss: 0.8876, test_f1: 0.5214
 epoch: 8, train_loss: 0.9531, test_loss: 0.8706, test_f1: 0.5238
 epoch: 9, train_loss: 0.9357, test_loss: 0.8667, test_f1: 0.5327
 epoch: 10, train_loss: 0.9251, test_loss: 0.8795, test_f1: 0.5357
 epoch: 11, train_loss: 0.9211, test_loss: 0.8645, test_f1: 0.5177
 epoch: 12, train_loss: 0.9138, test_loss: 0.8563, test_f1: 0.5281
 epoch: 13, train_loss: 0.8946, test_loss: 0.8712, test_f1: 0.5346
 epoch: 14, train_loss: 0.8850, test_loss: 0.8761, test_f1: 0.5534
 epoch: 15, train_loss: 0.8790, test_loss: 0.8785, test_f1: 0.5595
 epoch: 16, train_loss: 0.8634, test_loss: 0.8563, test_f1: 0.5437
 epoch: 17, train_loss: 0.8555, test_loss: 0.8735, test_f1: 0.5176
 epoch: 18, train_loss: 0.8525, test_loss: 0.8384, test_f1: 0.5761
 epoch: 19, train_loss: 0.8395, test_loss: 0.8712, test_f1: 0.5512
 epoch: 20, train_loss: 0.8300, test_loss: 0.8644, test_f1: 0.5653
 epoch: 21, train_loss: 0.8233, test_loss: 0.8380, test_f1: 0.5680
 epoch: 22, train_loss: 0.8213, test_loss: 0.8521, test_f1: 0.5573
 epoch: 23, train_loss: 0.8115, test_loss: 0.8833, test_f1: 0.5321
 epoch: 24, train_loss: 0.8062, test_loss: 0.8685, test_f1: 0.5681
 epoch: 25, train_loss: 0.8102, test_loss: 0.8857, test_f1: 0.5678
 epoch: 26, train_loss: 0.7798, test_loss: 0.8598, test_f1: 0.5801
 epoch: 27, train_loss: 0.7753, test_loss: 0.8637, test_f1: 0.5762
 epoch: 28, train_loss: 0.7861, test_loss: 0.8555, test_f1: 0.6057
 epoch: 29, train_loss: 0.7805, test_loss: 0.8538, test_f1: 0.6043
 epoch: 30, train_loss: 0.7655, test_loss: 0.8511, test_f1: 0.5904
 epoch: 31, train_loss: 0.7602, test_loss: 0.8960, test_f1: 0.5724
 epoch: 32, train_loss: 0.7621, test_loss: 0.8657, test_f1: 0.5855
 epoch: 33, train_loss: 0.7578, test_loss: 0.8925, test_f1: 0.5853
 epoch: 34, train_loss: 0.7455, test_loss: 0.8494, test_f1: 0.5943
 epoch: 35, train_loss: 0.7307, test_loss: 0.8621, test_f1: 0.5864
 epoch: 36, train_loss: 0.7314, test_loss: 0.8725, test_f1: 0.5928
 epoch: 37, train_loss: 0.7316, test_loss: 0.8952, test_f1: 0.5727
 epoch: 38, train_loss: 0.7208, test_loss: 0.8819, test_f1: 0.5919
 epoch: 39, train_loss: 0.7285, test_loss: 0.8926, test_f1: 0.5972
 epoch: 40, train_loss: 0.7289, test_loss: 0.9116, test_f1: 0.5718
 epoch: 41, train_loss: 0.7084, test_loss: 0.8669, test_f1: 0.6040
 epoch: 42, train_loss: 0.7099, test_loss: 0.8753, test_f1: 0.5935
 epoch: 43, train_loss: 0.7057, test_loss: 0.8656, test_f1: 0.6029
 epoch: 44, train_loss: 0.6941, test_loss: 0.8951, test_f1: 0.5794
 epoch: 45, train_loss: 0.6966, test_loss: 0.8676, test_f1: 0.5950
 epoch: 46, train_loss: 0.6826, test_loss: 0.9329, test_f1: 0.5891
 epoch: 47, train_loss: 0.6808, test_loss: 0.9205, test_f1: 0.5948
 epoch: 48, train_loss: 0.6726, test_loss: 0.9200, test_f1: 0.6055
 epoch: 49, train_loss: 0.6840, test_loss: 0.9113, test_f1: 0.6041
 epoch: 50, train_loss: 0.6632, test_loss: 0.9186, test_f1: 0.6139
 epoch: 51, train_loss: 0.6638, test_loss: 0.9321, test_f1: 0.5902
 epoch: 52, train_loss: 0.6572, test_loss: 0.9303, test_f1: 0.5898
 epoch: 53, train_loss: 0.6476, test_loss: 0.9326, test_f1: 0.5909
 epoch: 54, train_loss: 0.6541, test_loss: 0.9443, test_f1: 0.5902
 epoch: 55, train_loss: 0.6402, test_loss: 0.9173, test_f1: 0.5862
 epoch: 56, train_loss: 0.6387, test_loss: 0.9277, test_f1: 0.6043
 epoch: 57, train_loss: 0.6357, test_loss: 0.9505, test_f1: 0.5948
 epoch: 58, train_loss: 0.6337, test_loss: 0.9368, test_f1: 0.5966
 epoch: 59, train_loss: 0.6299, test_loss: 0.9522, test_f1: 0.5947
 epoch: 60, train_loss: 0.6160, test_loss: 0.9518, test_f1: 0.5998
 epoch: 61, train_loss: 0.6149, test_loss: 0.9411, test_f1: 0.5998
 epoch: 62, train_loss: 0.6201, test_loss: 0.9310, test_f1: 0.5869
 epoch: 63, train_loss: 0.6163, test_loss: 0.9556, test_f1: 0.6068
 epoch: 64, train_loss: 0.6141, test_loss: 0.9376, test_f1: 0.5946
 epoch: 65, train_loss: 0.6231, test_loss: 0.9444, test_f1: 0.6098
 epoch: 66, train_loss: 0.6104, test_loss: 0.9495, test_f1: 0.6067
 epoch: 67, train_loss: 0.5994, test_loss: 0.9465, test_f1: 0.6066
 epoch: 68, train_loss: 0.6080, test_loss: 0.9426, test_f1: 0.6094
 epoch: 69, train_loss: 0.6118, test_loss: 0.9710, test_f1: 0.5961
 epoch: 70, train_loss: 0.5914, test_loss: 0.9427, test_f1: 0.6083
 epoch: 71, train_loss: 0.5905, test_loss: 0.9587, test_f1: 0.6044
 epoch: 72, train_loss: 0.5996, test_loss: 0.9792, test_f1: 0.5922
 epoch: 73, train_loss: 0.5923, test_loss: 0.9744, test_f1: 0.5999
 epoch: 74, train_loss: 0.5914, test_loss: 0.9791, test_f1: 0.5929
 epoch: 75, train_loss: 0.5934, test_loss: 0.9522, test_f1: 0.6098
 epoch: 76, train_loss: 0.5792, test_loss: 0.9722, test_f1: 0.6155
 epoch: 77, train_loss: 0.5713, test_loss: 0.9678, test_f1: 0.5984
 epoch: 78, train_loss: 0.5671, test_loss: 0.9908, test_f1: 0.5972
 epoch: 79, train_loss: 0.5744, test_loss: 0.9841, test_f1: 0.6000
 epoch: 80, train_loss: 0.5753, test_loss: 0.9865, test_f1: 0.6117
 epoch: 81, train_loss: 0.5643, test_loss: 1.0113, test_f1: 0.6079
 epoch: 82, train_loss: 0.5738, test_loss: 1.0058, test_f1: 0.5939
 epoch: 83, train_loss: 0.5690, test_loss: 0.9956, test_f1: 0.6013
 epoch: 84, train_loss: 0.5639, test_loss: 0.9715, test_f1: 0.6146
 epoch: 85, train_loss: 0.5638, test_loss: 1.0037, test_f1: 0.6009
 epoch: 86, train_loss: 0.5544, test_loss: 1.0231, test_f1: 0.6041
 epoch: 87, train_loss: 0.5538, test_loss: 0.9906, test_f1: 0.6005
 epoch: 88, train_loss: 0.5536, test_loss: 1.0004, test_f1: 0.6018
 epoch: 89, train_loss: 0.5458, test_loss: 1.0125, test_f1: 0.6068
 epoch: 90, train_loss: 0.5454, test_loss: 1.0005, test_f1: 0.6143
 epoch: 91, train_loss: 0.5429, test_loss: 0.9916, test_f1: 0.6151
 epoch: 92, train_loss: 0.5461, test_loss: 1.0238, test_f1: 0.6133
 epoch: 93, train_loss: 0.5393, test_loss: 1.0554, test_f1: 0.6064
 epoch: 94, train_loss: 0.5331, test_loss: 1.0594, test_f1: 0.6146
 epoch: 95, train_loss: 0.5281, test_loss: 1.0358, test_f1: 0.6014
 epoch: 96, train_loss: 0.5472, test_loss: 1.0582, test_f1: 0.6013
 epoch: 97, train_loss: 0.5390, test_loss: 1.0362, test_f1: 0.6194
 epoch: 98, train_loss: 0.5274, test_loss: 1.0495, test_f1: 0.5986
 epoch: 99, train_loss: 0.5530, test_loss: 1.0223, test_f1: 0.6217

Training completed in 1105.42 seconds
Best F1: 0.6543 at epoch 90
Mean F1 across iterations: 0.6344  0.0102
========================FINAL RESULTS================================
FEGIN weighted F1: 0.6543  0.0102
python main.py --data ltspice_examples --representation component_net --model FEGIN --layers 6 --hiddens 128 --batch_size 256 --lr 0.0001 --emb_size 512 --epochs 100 --save_appendix component_net_L6_H128_BS256_LR0.0001_E512 --no_val
-----



STDERR:
  File "main.py", line 370, in <module>
    main()
  File "main.py", line 254, in main
    dataset = dataset_class(
  File "/home/philip/projects/llm_inference_code_repo/Circuit-Completion-Using-GNNs/component_classification_with_link_prediction_head/evaluation/FEGIN/kernel/circuit_datasets.py", line 15, in __init__
    self.data, self.slices = torch.load(self.processed_paths[0])
  File "/home/philip/.local/lib/python3.8/site-packages/torch/serialization.py", line 1040, in load
    warnings.warn(
  File "/usr/lib/python3.8/warnings.py", line 109, in _showwarnmsg
    sw(msg.message, msg.category, msg.filename, msg.lineno,
  File "main.py", line 47, in warn_with_traceback
    traceback.print_stack(file=log)
/home/philip/projects/llm_inference_code_repo/Circuit-Completion-Using-GNNs/component_classification_with_link_prediction_head/evaluation/FEGIN/kernel/circuit_datasets.py:15: FutureWarning: You are using `torch.load` with `weights_only=False` (the current default value), which uses the default pickle module implicitly. It is possible to construct malicious pickle data which will execute arbitrary code during unpickling (See https://github.com/pytorch/pytorch/blob/main/SECURITY.md#untrusted-models for more details). In a future release, the default value for `weights_only` will be flipped to `True`. This limits the functions that could be executed during unpickling. Arbitrary objects will no longer be allowed to be loaded via this mode unless they are explicitly allowlisted by the user via `torch.serialization.add_safe_globals`. We recommend you start setting `weights_only=True` for any use case where you don't have full control of the loaded file. Please open an issue on GitHub for any issues related to this experimental feature.
  self.data, self.slices = torch.load(self.processed_paths[0])
