STDOUT:
Results will be saved in /home/philip/projects/ltspice_examples_code_repo/Circuit-Completion-Using-GNNs/component_classification_with_link_prediction_head/evaluation/FEGIN/results/model_FEGIN_dataset_ltspice_demos
Command line input: python main.py --data ltspice_demos --representation component_component --model FEGIN --layers 4 --hiddens 128 --batch_size 128 --lr 0.0001 --emb_size 128 --epochs 100 --save_appendix component_component_L4_H128_BS128_LR0.0001_E128 --no_val
 is saved.
-----
ltspice_demos - FEGIN
Using 4 layers, 128 hidden units, h = 2
Loading component_component representation dataset
ENTERED
Training FEGIN on component_component representation
Train: 1565, Test: 383
##################ITERATION #0 ****************************************
 epoch: 0, train_loss: 1.3693, test_loss: 1.3646, test_f1: 0.2281
 epoch: 1, train_loss: 1.3527, test_loss: 1.3587, test_f1: 0.2281
 epoch: 2, train_loss: 1.3425, test_loss: 1.3507, test_f1: 0.2281
 epoch: 3, train_loss: 1.3301, test_loss: 1.3398, test_f1: 0.2281
 epoch: 4, train_loss: 1.3166, test_loss: 1.3268, test_f1: 0.2281
 epoch: 5, train_loss: 1.3009, test_loss: 1.3139, test_f1: 0.2281
 epoch: 6, train_loss: 1.2794, test_loss: 1.2967, test_f1: 0.2281
 epoch: 7, train_loss: 1.2581, test_loss: 1.2815, test_f1: 0.2281
 epoch: 8, train_loss: 1.2346, test_loss: 1.2645, test_f1: 0.2281
 epoch: 9, train_loss: 1.2070, test_loss: 1.2530, test_f1: 0.2270
 epoch: 10, train_loss: 1.1864, test_loss: 1.2428, test_f1: 0.2194
 epoch: 11, train_loss: 1.1690, test_loss: 1.2359, test_f1: 0.3109
 epoch: 12, train_loss: 1.1522, test_loss: 1.2318, test_f1: 0.3294
 epoch: 13, train_loss: 1.1359, test_loss: 1.2243, test_f1: 0.3199
 epoch: 14, train_loss: 1.1213, test_loss: 1.2113, test_f1: 0.4214
 epoch: 15, train_loss: 1.1075, test_loss: 1.2093, test_f1: 0.4227
 epoch: 16, train_loss: 1.0923, test_loss: 1.2058, test_f1: 0.4265
 epoch: 17, train_loss: 1.0769, test_loss: 1.2028, test_f1: 0.4484
 epoch: 18, train_loss: 1.0672, test_loss: 1.1888, test_f1: 0.4570
 epoch: 19, train_loss: 1.0563, test_loss: 1.1970, test_f1: 0.4714
 epoch: 20, train_loss: 1.0372, test_loss: 1.1950, test_f1: 0.4604
 epoch: 21, train_loss: 1.0243, test_loss: 1.1863, test_f1: 0.4571
 epoch: 22, train_loss: 1.0124, test_loss: 1.1832, test_f1: 0.4622
 epoch: 23, train_loss: 0.9975, test_loss: 1.1926, test_f1: 0.4712
 epoch: 24, train_loss: 0.9856, test_loss: 1.1911, test_f1: 0.4720
 epoch: 25, train_loss: 0.9717, test_loss: 1.1869, test_f1: 0.4596
 epoch: 26, train_loss: 0.9566, test_loss: 1.1885, test_f1: 0.4669
 epoch: 27, train_loss: 0.9469, test_loss: 1.1904, test_f1: 0.4789
 epoch: 28, train_loss: 0.9382, test_loss: 1.1972, test_f1: 0.4742
 epoch: 29, train_loss: 0.9257, test_loss: 1.2109, test_f1: 0.4734
 epoch: 30, train_loss: 0.9182, test_loss: 1.2253, test_f1: 0.4729
 epoch: 31, train_loss: 0.9073, test_loss: 1.2028, test_f1: 0.4737
 epoch: 32, train_loss: 0.8791, test_loss: 1.2173, test_f1: 0.4803
 epoch: 33, train_loss: 0.8874, test_loss: 1.2130, test_f1: 0.4890
 epoch: 34, train_loss: 0.8727, test_loss: 1.2308, test_f1: 0.4765
 epoch: 35, train_loss: 0.8551, test_loss: 1.2708, test_f1: 0.4798
 epoch: 36, train_loss: 0.8360, test_loss: 1.3263, test_f1: 0.4919
 epoch: 37, train_loss: 0.8303, test_loss: 1.2687, test_f1: 0.4817
 epoch: 38, train_loss: 0.8097, test_loss: 1.3078, test_f1: 0.4863
 epoch: 39, train_loss: 0.8070, test_loss: 1.2819, test_f1: 0.5009
 epoch: 40, train_loss: 0.8031, test_loss: 1.3004, test_f1: 0.4975
 epoch: 41, train_loss: 0.7825, test_loss: 1.3127, test_f1: 0.5100
 epoch: 42, train_loss: 0.7717, test_loss: 1.3282, test_f1: 0.4864
 epoch: 43, train_loss: 0.7578, test_loss: 1.3298, test_f1: 0.5193
 epoch: 44, train_loss: 0.7562, test_loss: 1.3603, test_f1: 0.5159
 epoch: 45, train_loss: 0.7379, test_loss: 1.3464, test_f1: 0.5222
 epoch: 46, train_loss: 0.7331, test_loss: 1.4163, test_f1: 0.5280
 epoch: 47, train_loss: 0.7123, test_loss: 1.4619, test_f1: 0.5222
 epoch: 48, train_loss: 0.7122, test_loss: 1.3996, test_f1: 0.5429
 epoch: 49, train_loss: 0.7044, test_loss: 1.3588, test_f1: 0.5682
 epoch: 50, train_loss: 0.6814, test_loss: 1.4245, test_f1: 0.5479
 epoch: 51, train_loss: 0.6684, test_loss: 1.4143, test_f1: 0.5796
 epoch: 52, train_loss: 0.6589, test_loss: 1.4868, test_f1: 0.5617
 epoch: 53, train_loss: 0.6637, test_loss: 1.4649, test_f1: 0.5829
 epoch: 54, train_loss: 0.6724, test_loss: 1.4157, test_f1: 0.5822
 epoch: 55, train_loss: 0.6640, test_loss: 1.4219, test_f1: 0.5845
 epoch: 56, train_loss: 0.6446, test_loss: 1.4793, test_f1: 0.6002
 epoch: 57, train_loss: 0.6331, test_loss: 1.5155, test_f1: 0.5897
 epoch: 58, train_loss: 0.6295, test_loss: 1.5298, test_f1: 0.5797
 epoch: 59, train_loss: 0.6270, test_loss: 1.5112, test_f1: 0.5712
 epoch: 60, train_loss: 0.6193, test_loss: 1.4658, test_f1: 0.5709
 epoch: 61, train_loss: 0.6106, test_loss: 1.5136, test_f1: 0.5791
 epoch: 62, train_loss: 0.6130, test_loss: 1.5118, test_f1: 0.5752
 epoch: 63, train_loss: 0.6133, test_loss: 1.5233, test_f1: 0.5730
 epoch: 64, train_loss: 0.5851, test_loss: 1.5327, test_f1: 0.5686
 epoch: 65, train_loss: 0.5930, test_loss: 1.5546, test_f1: 0.5800
 epoch: 66, train_loss: 0.5843, test_loss: 1.5384, test_f1: 0.5631
 epoch: 67, train_loss: 0.5997, test_loss: 1.5466, test_f1: 0.5754
 epoch: 68, train_loss: 0.5904, test_loss: 1.5614, test_f1: 0.5765
 epoch: 69, train_loss: 0.5784, test_loss: 1.6167, test_f1: 0.5868
 epoch: 70, train_loss: 0.5838, test_loss: 1.5747, test_f1: 0.5827
 epoch: 71, train_loss: 0.5766, test_loss: 1.5577, test_f1: 0.5554
 epoch: 72, train_loss: 0.5678, test_loss: 1.6036, test_f1: 0.5521
 epoch: 73, train_loss: 0.5604, test_loss: 1.5817, test_f1: 0.5870
 epoch: 74, train_loss: 0.5523, test_loss: 1.6686, test_f1: 0.5606
 epoch: 75, train_loss: 0.5558, test_loss: 1.6655, test_f1: 0.5796
 epoch: 76, train_loss: 0.5633, test_loss: 1.5434, test_f1: 0.5776
 epoch: 77, train_loss: 0.5581, test_loss: 1.5619, test_f1: 0.5651
 epoch: 78, train_loss: 0.5554, test_loss: 1.5204, test_f1: 0.5608
 epoch: 79, train_loss: 0.5403, test_loss: 1.5630, test_f1: 0.5670
 epoch: 80, train_loss: 0.5353, test_loss: 1.5451, test_f1: 0.5649
 epoch: 81, train_loss: 0.5273, test_loss: 1.5809, test_f1: 0.5691
 epoch: 82, train_loss: 0.5238, test_loss: 1.6067, test_f1: 0.5553
 epoch: 83, train_loss: 0.5503, test_loss: 1.6143, test_f1: 0.5447
 epoch: 84, train_loss: 0.5443, test_loss: 1.6177, test_f1: 0.5718
 epoch: 85, train_loss: 0.5352, test_loss: 1.5777, test_f1: 0.5726
 epoch: 86, train_loss: 0.5145, test_loss: 1.6242, test_f1: 0.5573
 epoch: 87, train_loss: 0.5175, test_loss: 1.6522, test_f1: 0.5626
 epoch: 88, train_loss: 0.4904, test_loss: 1.6398, test_f1: 0.5750
 epoch: 89, train_loss: 0.5223, test_loss: 1.6919, test_f1: 0.5634
 epoch: 90, train_loss: 0.5094, test_loss: 1.7224, test_f1: 0.5634
 epoch: 91, train_loss: 0.4911, test_loss: 1.6682, test_f1: 0.5709
 epoch: 92, train_loss: 0.4937, test_loss: 1.6915, test_f1: 0.5474
 epoch: 93, train_loss: 0.4902, test_loss: 1.7237, test_f1: 0.5674
 epoch: 94, train_loss: 0.4903, test_loss: 1.7154, test_f1: 0.5577
 epoch: 95, train_loss: 0.4903, test_loss: 1.7041, test_f1: 0.5566
 epoch: 96, train_loss: 0.4852, test_loss: 1.7341, test_f1: 0.5670
 epoch: 97, train_loss: 0.4681, test_loss: 1.7943, test_f1: 0.5504
 epoch: 98, train_loss: 0.4712, test_loss: 1.7565, test_f1: 0.5554
 epoch: 99, train_loss: 0.4806, test_loss: 1.7674, test_f1: 0.5357
##################ITERATION #1 ****************************************
 epoch: 0, train_loss: 1.3301, test_loss: 1.3477, test_f1: 0.2281
 epoch: 1, train_loss: 1.2771, test_loss: 1.3272, test_f1: 0.2404
 epoch: 2, train_loss: 1.2462, test_loss: 1.3079, test_f1: 0.2659
 epoch: 3, train_loss: 1.2204, test_loss: 1.2874, test_f1: 0.2630
 epoch: 4, train_loss: 1.2000, test_loss: 1.2739, test_f1: 0.2708
 epoch: 5, train_loss: 1.1793, test_loss: 1.2492, test_f1: 0.3703
 epoch: 6, train_loss: 1.1612, test_loss: 1.2405, test_f1: 0.3991
 epoch: 7, train_loss: 1.1464, test_loss: 1.2309, test_f1: 0.4268
 epoch: 8, train_loss: 1.1317, test_loss: 1.2219, test_f1: 0.4220
 epoch: 9, train_loss: 1.1150, test_loss: 1.2030, test_f1: 0.4259
 epoch: 10, train_loss: 1.0990, test_loss: 1.2017, test_f1: 0.4217
 epoch: 11, train_loss: 1.0831, test_loss: 1.1909, test_f1: 0.4407
 epoch: 12, train_loss: 1.0648, test_loss: 1.1875, test_f1: 0.4405
 epoch: 13, train_loss: 1.0507, test_loss: 1.1823, test_f1: 0.4410
 epoch: 14, train_loss: 1.0297, test_loss: 1.1761, test_f1: 0.4511
 epoch: 15, train_loss: 1.0222, test_loss: 1.1835, test_f1: 0.4680
 epoch: 16, train_loss: 1.0058, test_loss: 1.1843, test_f1: 0.4835
 epoch: 17, train_loss: 0.9878, test_loss: 1.1982, test_f1: 0.4807
 epoch: 18, train_loss: 0.9757, test_loss: 1.1768, test_f1: 0.4931
 epoch: 19, train_loss: 0.9571, test_loss: 1.1764, test_f1: 0.5210
 epoch: 20, train_loss: 0.9437, test_loss: 1.1949, test_f1: 0.5075
 epoch: 21, train_loss: 0.9214, test_loss: 1.2033, test_f1: 0.5015
 epoch: 22, train_loss: 0.9081, test_loss: 1.1939, test_f1: 0.4955
 epoch: 23, train_loss: 0.8955, test_loss: 1.2059, test_f1: 0.5194
 epoch: 24, train_loss: 0.8857, test_loss: 1.2169, test_f1: 0.5006
 epoch: 25, train_loss: 0.8800, test_loss: 1.2342, test_f1: 0.5070
 epoch: 26, train_loss: 0.8453, test_loss: 1.2661, test_f1: 0.5321
 epoch: 27, train_loss: 0.8298, test_loss: 1.2833, test_f1: 0.5385
 epoch: 28, train_loss: 0.8390, test_loss: 1.2768, test_f1: 0.5340
 epoch: 29, train_loss: 0.8143, test_loss: 1.2878, test_f1: 0.5543
 epoch: 30, train_loss: 0.7998, test_loss: 1.3095, test_f1: 0.5400
 epoch: 31, train_loss: 0.7984, test_loss: 1.2843, test_f1: 0.5225
 epoch: 32, train_loss: 0.7763, test_loss: 1.3847, test_f1: 0.5489
 epoch: 33, train_loss: 0.7628, test_loss: 1.3386, test_f1: 0.5321
 epoch: 34, train_loss: 0.7544, test_loss: 1.3599, test_f1: 0.5456
 epoch: 35, train_loss: 0.7325, test_loss: 1.3981, test_f1: 0.5531
 epoch: 36, train_loss: 0.7480, test_loss: 1.4407, test_f1: 0.5416
 epoch: 37, train_loss: 0.7074, test_loss: 1.4237, test_f1: 0.5276
 epoch: 38, train_loss: 0.7107, test_loss: 1.4933, test_f1: 0.5257
 epoch: 39, train_loss: 0.6963, test_loss: 1.5237, test_f1: 0.5296
 epoch: 40, train_loss: 0.6933, test_loss: 1.5200, test_f1: 0.5522
 epoch: 41, train_loss: 0.6757, test_loss: 1.5150, test_f1: 0.5640
 epoch: 42, train_loss: 0.6754, test_loss: 1.5831, test_f1: 0.5156
 epoch: 43, train_loss: 0.6713, test_loss: 1.5611, test_f1: 0.5654
 epoch: 44, train_loss: 0.6579, test_loss: 1.5806, test_f1: 0.5593
 epoch: 45, train_loss: 0.6350, test_loss: 1.5904, test_f1: 0.5688
 epoch: 46, train_loss: 0.6337, test_loss: 1.6401, test_f1: 0.5411
 epoch: 47, train_loss: 0.6127, test_loss: 1.5789, test_f1: 0.5365
 epoch: 48, train_loss: 0.6193, test_loss: 1.7050, test_f1: 0.5550
 epoch: 49, train_loss: 0.6167, test_loss: 1.6429, test_f1: 0.5714
 epoch: 50, train_loss: 0.6114, test_loss: 1.6895, test_f1: 0.5848
 epoch: 51, train_loss: 0.5933, test_loss: 1.7483, test_f1: 0.5415
 epoch: 52, train_loss: 0.5931, test_loss: 1.7123, test_f1: 0.5446
 epoch: 53, train_loss: 0.5756, test_loss: 1.7240, test_f1: 0.5723
 epoch: 54, train_loss: 0.5675, test_loss: 1.6975, test_f1: 0.5732
 epoch: 55, train_loss: 0.5816, test_loss: 1.7886, test_f1: 0.5580
 epoch: 56, train_loss: 0.5753, test_loss: 1.7813, test_f1: 0.5652
 epoch: 57, train_loss: 0.5607, test_loss: 1.7727, test_f1: 0.5625
 epoch: 58, train_loss: 0.5528, test_loss: 1.7423, test_f1: 0.5447
 epoch: 59, train_loss: 0.5437, test_loss: 1.7877, test_f1: 0.5474
 epoch: 60, train_loss: 0.5414, test_loss: 1.7833, test_f1: 0.5632
 epoch: 61, train_loss: 0.5411, test_loss: 1.8110, test_f1: 0.5558
 epoch: 62, train_loss: 0.5415, test_loss: 1.7586, test_f1: 0.5723
 epoch: 63, train_loss: 0.5285, test_loss: 1.8246, test_f1: 0.5600
 epoch: 64, train_loss: 0.5194, test_loss: 1.9092, test_f1: 0.5484
 epoch: 65, train_loss: 0.5300, test_loss: 1.8641, test_f1: 0.5611
 epoch: 66, train_loss: 0.5329, test_loss: 1.9022, test_f1: 0.5584
 epoch: 67, train_loss: 0.5195, test_loss: 1.9188, test_f1: 0.5237
 epoch: 68, train_loss: 0.5096, test_loss: 1.9362, test_f1: 0.5128
 epoch: 69, train_loss: 0.5107, test_loss: 1.9242, test_f1: 0.5258
 epoch: 70, train_loss: 0.5224, test_loss: 1.9144, test_f1: 0.5289
 epoch: 71, train_loss: 0.5040, test_loss: 1.9247, test_f1: 0.5444
 epoch: 72, train_loss: 0.4896, test_loss: 1.9123, test_f1: 0.5639
 epoch: 73, train_loss: 0.5041, test_loss: 1.9002, test_f1: 0.5438
 epoch: 74, train_loss: 0.4881, test_loss: 1.9304, test_f1: 0.5511
 epoch: 75, train_loss: 0.5036, test_loss: 1.9507, test_f1: 0.5453
 epoch: 76, train_loss: 0.4996, test_loss: 1.9721, test_f1: 0.5536
 epoch: 77, train_loss: 0.4955, test_loss: 1.9884, test_f1: 0.5339
 epoch: 78, train_loss: 0.4787, test_loss: 2.0388, test_f1: 0.5261
 epoch: 79, train_loss: 0.4672, test_loss: 2.0807, test_f1: 0.5256
 epoch: 80, train_loss: 0.4829, test_loss: 2.0917, test_f1: 0.5352
 epoch: 81, train_loss: 0.4706, test_loss: 2.0330, test_f1: 0.5391
 epoch: 82, train_loss: 0.4545, test_loss: 2.0842, test_f1: 0.5241
 epoch: 83, train_loss: 0.4766, test_loss: 2.0432, test_f1: 0.5340
 epoch: 84, train_loss: 0.4687, test_loss: 2.0361, test_f1: 0.5096
 epoch: 85, train_loss: 0.4627, test_loss: 2.0434, test_f1: 0.5363
 epoch: 86, train_loss: 0.4437, test_loss: 1.9996, test_f1: 0.5465
 epoch: 87, train_loss: 0.4460, test_loss: 2.1096, test_f1: 0.5325
 epoch: 88, train_loss: 0.4601, test_loss: 2.0846, test_f1: 0.5279
 epoch: 89, train_loss: 0.4553, test_loss: 2.0654, test_f1: 0.5361
 epoch: 90, train_loss: 0.4564, test_loss: 2.1091, test_f1: 0.5464
 epoch: 91, train_loss: 0.4649, test_loss: 2.0895, test_f1: 0.5180
 epoch: 92, train_loss: 0.4677, test_loss: 2.1557, test_f1: 0.5291
 epoch: 93, train_loss: 0.4567, test_loss: 2.1206, test_f1: 0.5182
 epoch: 94, train_loss: 0.4433, test_loss: 2.1661, test_f1: 0.5304
 epoch: 95, train_loss: 0.4471, test_loss: 2.0949, test_f1: 0.5442
 epoch: 96, train_loss: 0.4557, test_loss: 2.1211, test_f1: 0.5275
 epoch: 97, train_loss: 0.4412, test_loss: 2.1880, test_f1: 0.5529
 epoch: 98, train_loss: 0.4215, test_loss: 2.2375, test_f1: 0.5369
 epoch: 99, train_loss: 0.4332, test_loss: 2.1852, test_f1: 0.5175
##################ITERATION #2 ****************************************
 epoch: 0, train_loss: 1.2814, test_loss: 1.3336, test_f1: 0.2404
 epoch: 1, train_loss: 1.2273, test_loss: 1.3215, test_f1: 0.2628
 epoch: 2, train_loss: 1.1874, test_loss: 1.3049, test_f1: 0.2630
 epoch: 3, train_loss: 1.1834, test_loss: 1.2849, test_f1: 0.2753
 epoch: 4, train_loss: 1.1575, test_loss: 1.2524, test_f1: 0.3013
 epoch: 5, train_loss: 1.1353, test_loss: 1.2366, test_f1: 0.3656
 epoch: 6, train_loss: 1.1194, test_loss: 1.2140, test_f1: 0.3637
 epoch: 7, train_loss: 1.1045, test_loss: 1.2022, test_f1: 0.3689
 epoch: 8, train_loss: 1.0821, test_loss: 1.1869, test_f1: 0.4203
 epoch: 9, train_loss: 1.0701, test_loss: 1.1794, test_f1: 0.4493
 epoch: 10, train_loss: 1.0541, test_loss: 1.1689, test_f1: 0.4404
 epoch: 11, train_loss: 1.0231, test_loss: 1.1624, test_f1: 0.4567
 epoch: 12, train_loss: 1.0107, test_loss: 1.1503, test_f1: 0.4746
 epoch: 13, train_loss: 1.0156, test_loss: 1.1518, test_f1: 0.4923
 epoch: 14, train_loss: 0.9928, test_loss: 1.1300, test_f1: 0.5181
 epoch: 15, train_loss: 0.9728, test_loss: 1.1271, test_f1: 0.5155
 epoch: 16, train_loss: 0.9654, test_loss: 1.1241, test_f1: 0.5182
 epoch: 17, train_loss: 0.9511, test_loss: 1.1185, test_f1: 0.5007
 epoch: 18, train_loss: 0.9360, test_loss: 1.1088, test_f1: 0.5348
 epoch: 19, train_loss: 0.9178, test_loss: 1.1203, test_f1: 0.5285
 epoch: 20, train_loss: 0.9030, test_loss: 1.1281, test_f1: 0.5538
 epoch: 21, train_loss: 0.8959, test_loss: 1.1068, test_f1: 0.5439
 epoch: 22, train_loss: 0.9008, test_loss: 1.1026, test_f1: 0.5369
 epoch: 23, train_loss: 0.8729, test_loss: 1.1212, test_f1: 0.5162
 epoch: 24, train_loss: 0.8604, test_loss: 1.1059, test_f1: 0.5464
 epoch: 25, train_loss: 0.8505, test_loss: 1.1086, test_f1: 0.5510
 epoch: 26, train_loss: 0.8362, test_loss: 1.1061, test_f1: 0.5691
 epoch: 27, train_loss: 0.8319, test_loss: 1.1092, test_f1: 0.5732
 epoch: 28, train_loss: 0.8242, test_loss: 1.1353, test_f1: 0.5223
 epoch: 29, train_loss: 0.8107, test_loss: 1.1459, test_f1: 0.5149
 epoch: 30, train_loss: 0.7916, test_loss: 1.1289, test_f1: 0.5446
 epoch: 31, train_loss: 0.7895, test_loss: 1.1374, test_f1: 0.5180
 epoch: 32, train_loss: 0.7726, test_loss: 1.1437, test_f1: 0.5481
 epoch: 33, train_loss: 0.7680, test_loss: 1.1412, test_f1: 0.5073
 epoch: 34, train_loss: 0.7657, test_loss: 1.1225, test_f1: 0.5690
 epoch: 35, train_loss: 0.7515, test_loss: 1.1531, test_f1: 0.5403
 epoch: 36, train_loss: 0.7485, test_loss: 1.1962, test_f1: 0.5275
 epoch: 37, train_loss: 0.7454, test_loss: 1.1980, test_f1: 0.5309
 epoch: 38, train_loss: 0.7304, test_loss: 1.1564, test_f1: 0.5687
 epoch: 39, train_loss: 0.7155, test_loss: 1.1919, test_f1: 0.5616
 epoch: 40, train_loss: 0.7092, test_loss: 1.1754, test_f1: 0.5452
 epoch: 41, train_loss: 0.6936, test_loss: 1.1271, test_f1: 0.5601
 epoch: 42, train_loss: 0.6946, test_loss: 1.1409, test_f1: 0.5800
 epoch: 43, train_loss: 0.6911, test_loss: 1.2457, test_f1: 0.5435
 epoch: 44, train_loss: 0.6822, test_loss: 1.1935, test_f1: 0.5737
 epoch: 45, train_loss: 0.6540, test_loss: 1.2058, test_f1: 0.5819
 epoch: 46, train_loss: 0.6613, test_loss: 1.2178, test_f1: 0.5612
 epoch: 47, train_loss: 0.6462, test_loss: 1.2070, test_f1: 0.5820
 epoch: 48, train_loss: 0.6425, test_loss: 1.2095, test_f1: 0.5659
 epoch: 49, train_loss: 0.6358, test_loss: 1.2295, test_f1: 0.5754
 epoch: 50, train_loss: 0.6365, test_loss: 1.2894, test_f1: 0.5504
 epoch: 51, train_loss: 0.6140, test_loss: 1.2409, test_f1: 0.5740
 epoch: 52, train_loss: 0.6126, test_loss: 1.2490, test_f1: 0.5803
 epoch: 53, train_loss: 0.6146, test_loss: 1.2816, test_f1: 0.5646
 epoch: 54, train_loss: 0.6045, test_loss: 1.3107, test_f1: 0.5434
 epoch: 55, train_loss: 0.5865, test_loss: 1.3208, test_f1: 0.5650
 epoch: 56, train_loss: 0.5914, test_loss: 1.3048, test_f1: 0.5739
 epoch: 57, train_loss: 0.5919, test_loss: 1.2994, test_f1: 0.5722
 epoch: 58, train_loss: 0.5854, test_loss: 1.2939, test_f1: 0.5812
 epoch: 59, train_loss: 0.5857, test_loss: 1.3163, test_f1: 0.5721
 epoch: 60, train_loss: 0.5684, test_loss: 1.3267, test_f1: 0.5702
 epoch: 61, train_loss: 0.5934, test_loss: 1.3277, test_f1: 0.5798
 epoch: 62, train_loss: 0.5818, test_loss: 1.3155, test_f1: 0.5787
 epoch: 63, train_loss: 0.5675, test_loss: 1.3147, test_f1: 0.5709
 epoch: 64, train_loss: 0.5534, test_loss: 1.3248, test_f1: 0.5706
 epoch: 65, train_loss: 0.5429, test_loss: 1.3534, test_f1: 0.5721
 epoch: 66, train_loss: 0.5428, test_loss: 1.3538, test_f1: 0.5714
 epoch: 67, train_loss: 0.5485, test_loss: 1.3648, test_f1: 0.5501
 epoch: 68, train_loss: 0.5459, test_loss: 1.3537, test_f1: 0.5715
 epoch: 69, train_loss: 0.5517, test_loss: 1.3636, test_f1: 0.5672
 epoch: 70, train_loss: 0.5299, test_loss: 1.4102, test_f1: 0.5714
 epoch: 71, train_loss: 0.5279, test_loss: 1.4119, test_f1: 0.5498
 epoch: 72, train_loss: 0.5296, test_loss: 1.4169, test_f1: 0.5593
 epoch: 73, train_loss: 0.5164, test_loss: 1.4002, test_f1: 0.5670
 epoch: 74, train_loss: 0.5210, test_loss: 1.4257, test_f1: 0.5635
 epoch: 75, train_loss: 0.5116, test_loss: 1.4012, test_f1: 0.5708
 epoch: 76, train_loss: 0.5012, test_loss: 1.4568, test_f1: 0.5664
 epoch: 77, train_loss: 0.5181, test_loss: 1.4274, test_f1: 0.5675
 epoch: 78, train_loss: 0.5232, test_loss: 1.4413, test_f1: 0.5568
 epoch: 79, train_loss: 0.5124, test_loss: 1.4604, test_f1: 0.5582
 epoch: 80, train_loss: 0.5144, test_loss: 1.4678, test_f1: 0.5726
 epoch: 81, train_loss: 0.5023, test_loss: 1.5207, test_f1: 0.5470
 epoch: 82, train_loss: 0.4998, test_loss: 1.4897, test_f1: 0.5608
 epoch: 83, train_loss: 0.4903, test_loss: 1.4704, test_f1: 0.5602
 epoch: 84, train_loss: 0.4888, test_loss: 1.4407, test_f1: 0.5806
 epoch: 85, train_loss: 0.4777, test_loss: 1.4692, test_f1: 0.5412
 epoch: 86, train_loss: 0.4981, test_loss: 1.4795, test_f1: 0.5516
 epoch: 87, train_loss: 0.4883, test_loss: 1.4459, test_f1: 0.5729
 epoch: 88, train_loss: 0.4776, test_loss: 1.4633, test_f1: 0.5696
 epoch: 89, train_loss: 0.4851, test_loss: 1.5308, test_f1: 0.5671
 epoch: 90, train_loss: 0.4895, test_loss: 1.4983, test_f1: 0.5647
 epoch: 91, train_loss: 0.4727, test_loss: 1.5135, test_f1: 0.5597
 epoch: 92, train_loss: 0.4784, test_loss: 1.5078, test_f1: 0.5699
 epoch: 93, train_loss: 0.4963, test_loss: 1.4941, test_f1: 0.5668
 epoch: 94, train_loss: 0.4696, test_loss: 1.5090, test_f1: 0.5633
 epoch: 95, train_loss: 0.4581, test_loss: 1.5262, test_f1: 0.5676
 epoch: 96, train_loss: 0.4761, test_loss: 1.5161, test_f1: 0.5581
 epoch: 97, train_loss: 0.4573, test_loss: 1.5314, test_f1: 0.5551
 epoch: 98, train_loss: 0.4453, test_loss: 1.5030, test_f1: 0.5734
 epoch: 99, train_loss: 0.4514, test_loss: 1.5516, test_f1: 0.5610
##################ITERATION #3 ****************************************
 epoch: 0, train_loss: 1.2542, test_loss: 1.3375, test_f1: 0.2600
 epoch: 1, train_loss: 1.1813, test_loss: 1.3154, test_f1: 0.2549
 epoch: 2, train_loss: 1.1760, test_loss: 1.2726, test_f1: 0.2791
 epoch: 3, train_loss: 1.1494, test_loss: 1.2439, test_f1: 0.3627
 epoch: 4, train_loss: 1.1254, test_loss: 1.2242, test_f1: 0.3819
 epoch: 5, train_loss: 1.1038, test_loss: 1.2068, test_f1: 0.4139
 epoch: 6, train_loss: 1.0847, test_loss: 1.1905, test_f1: 0.4288
 epoch: 7, train_loss: 1.0654, test_loss: 1.1729, test_f1: 0.4345
 epoch: 8, train_loss: 1.0502, test_loss: 1.1749, test_f1: 0.4277
 epoch: 9, train_loss: 1.0368, test_loss: 1.1821, test_f1: 0.4287
 epoch: 10, train_loss: 1.0264, test_loss: 1.1796, test_f1: 0.4507
 epoch: 11, train_loss: 1.0097, test_loss: 1.1775, test_f1: 0.5005
 epoch: 12, train_loss: 0.9984, test_loss: 1.1782, test_f1: 0.4979
 epoch: 13, train_loss: 0.9822, test_loss: 1.1681, test_f1: 0.4675
 epoch: 14, train_loss: 0.9702, test_loss: 1.1794, test_f1: 0.4845
 epoch: 15, train_loss: 0.9501, test_loss: 1.1637, test_f1: 0.5059
 epoch: 16, train_loss: 0.9321, test_loss: 1.1358, test_f1: 0.4991
 epoch: 17, train_loss: 0.9193, test_loss: 1.1594, test_f1: 0.4951
 epoch: 18, train_loss: 0.9230, test_loss: 1.1735, test_f1: 0.5028
 epoch: 19, train_loss: 0.9040, test_loss: 1.1674, test_f1: 0.5103
 epoch: 20, train_loss: 0.8873, test_loss: 1.1634, test_f1: 0.5151
 epoch: 21, train_loss: 0.8862, test_loss: 1.1887, test_f1: 0.5169
 epoch: 22, train_loss: 0.8670, test_loss: 1.1685, test_f1: 0.5192
 epoch: 23, train_loss: 0.8632, test_loss: 1.1583, test_f1: 0.5521
 epoch: 24, train_loss: 0.8611, test_loss: 1.1583, test_f1: 0.5390
 epoch: 25, train_loss: 0.8287, test_loss: 1.1941, test_f1: 0.5390
 epoch: 26, train_loss: 0.8266, test_loss: 1.2002, test_f1: 0.5462
 epoch: 27, train_loss: 0.8200, test_loss: 1.1991, test_f1: 0.5494
 epoch: 28, train_loss: 0.8160, test_loss: 1.1997, test_f1: 0.5703
 epoch: 29, train_loss: 0.7969, test_loss: 1.1996, test_f1: 0.5704
 epoch: 30, train_loss: 0.7857, test_loss: 1.1778, test_f1: 0.5719
 epoch: 31, train_loss: 0.7694, test_loss: 1.2044, test_f1: 0.5472
 epoch: 32, train_loss: 0.7646, test_loss: 1.1886, test_f1: 0.5580
 epoch: 33, train_loss: 0.7310, test_loss: 1.1948, test_f1: 0.5941
 epoch: 34, train_loss: 0.7526, test_loss: 1.1807, test_f1: 0.5686
 epoch: 35, train_loss: 0.7513, test_loss: 1.2033, test_f1: 0.5790
 epoch: 36, train_loss: 0.7332, test_loss: 1.2587, test_f1: 0.6111
 epoch: 37, train_loss: 0.7178, test_loss: 1.2389, test_f1: 0.5894
 epoch: 38, train_loss: 0.7183, test_loss: 1.2248, test_f1: 0.5723
 epoch: 39, train_loss: 0.7054, test_loss: 1.2536, test_f1: 0.5853
 epoch: 40, train_loss: 0.6829, test_loss: 1.2563, test_f1: 0.5523
 epoch: 41, train_loss: 0.6777, test_loss: 1.2553, test_f1: 0.5600
 epoch: 42, train_loss: 0.6848, test_loss: 1.2557, test_f1: 0.5738
 epoch: 43, train_loss: 0.6624, test_loss: 1.2788, test_f1: 0.5685
 epoch: 44, train_loss: 0.6678, test_loss: 1.2868, test_f1: 0.5741
 epoch: 45, train_loss: 0.6807, test_loss: 1.3172, test_f1: 0.5579
 epoch: 46, train_loss: 0.6474, test_loss: 1.2784, test_f1: 0.6050
 epoch: 47, train_loss: 0.6411, test_loss: 1.3074, test_f1: 0.5655
 epoch: 48, train_loss: 0.6178, test_loss: 1.3287, test_f1: 0.5427
 epoch: 49, train_loss: 0.6210, test_loss: 1.3511, test_f1: 0.5900
 epoch: 50, train_loss: 0.6185, test_loss: 1.3762, test_f1: 0.5982
 epoch: 51, train_loss: 0.5995, test_loss: 1.3660, test_f1: 0.5931
 epoch: 52, train_loss: 0.5919, test_loss: 1.3775, test_f1: 0.5758
 epoch: 53, train_loss: 0.6016, test_loss: 1.3604, test_f1: 0.5793
 epoch: 54, train_loss: 0.5891, test_loss: 1.3594, test_f1: 0.5783
 epoch: 55, train_loss: 0.5861, test_loss: 1.3911, test_f1: 0.5436
 epoch: 56, train_loss: 0.5767, test_loss: 1.4250, test_f1: 0.5523
 epoch: 57, train_loss: 0.5837, test_loss: 1.3871, test_f1: 0.5778
 epoch: 58, train_loss: 0.5588, test_loss: 1.3899, test_f1: 0.5830
 epoch: 59, train_loss: 0.5776, test_loss: 1.3876, test_f1: 0.5658
 epoch: 60, train_loss: 0.5829, test_loss: 1.4032, test_f1: 0.6100
 epoch: 61, train_loss: 0.5640, test_loss: 1.4064, test_f1: 0.5871
 epoch: 62, train_loss: 0.5472, test_loss: 1.4057, test_f1: 0.5817
 epoch: 63, train_loss: 0.5468, test_loss: 1.4140, test_f1: 0.5927
 epoch: 64, train_loss: 0.5409, test_loss: 1.4493, test_f1: 0.5781
 epoch: 65, train_loss: 0.5411, test_loss: 1.4680, test_f1: 0.5716
 epoch: 66, train_loss: 0.5512, test_loss: 1.4910, test_f1: 0.5640
 epoch: 67, train_loss: 0.5300, test_loss: 1.4638, test_f1: 0.5775
 epoch: 68, train_loss: 0.5376, test_loss: 1.4555, test_f1: 0.5572
 epoch: 69, train_loss: 0.5218, test_loss: 1.4470, test_f1: 0.5846
 epoch: 70, train_loss: 0.5345, test_loss: 1.4717, test_f1: 0.5684
 epoch: 71, train_loss: 0.5214, test_loss: 1.4565, test_f1: 0.5703
 epoch: 72, train_loss: 0.5165, test_loss: 1.5062, test_f1: 0.5449
 epoch: 73, train_loss: 0.5330, test_loss: 1.4856, test_f1: 0.5812
 epoch: 74, train_loss: 0.5178, test_loss: 1.5338, test_f1: 0.5379
 epoch: 75, train_loss: 0.5217, test_loss: 1.4839, test_f1: 0.5679
 epoch: 76, train_loss: 0.5162, test_loss: 1.4905, test_f1: 0.5484
 epoch: 77, train_loss: 0.5064, test_loss: 1.4644, test_f1: 0.5472
 epoch: 78, train_loss: 0.5158, test_loss: 1.4940, test_f1: 0.5537
 epoch: 79, train_loss: 0.5065, test_loss: 1.4953, test_f1: 0.5550
 epoch: 80, train_loss: 0.5200, test_loss: 1.5141, test_f1: 0.5574
 epoch: 81, train_loss: 0.4982, test_loss: 1.5195, test_f1: 0.5590
 epoch: 82, train_loss: 0.5030, test_loss: 1.5174, test_f1: 0.5714
 epoch: 83, train_loss: 0.4988, test_loss: 1.5543, test_f1: 0.5524
 epoch: 84, train_loss: 0.4942, test_loss: 1.5468, test_f1: 0.5983
 epoch: 85, train_loss: 0.4858, test_loss: 1.5537, test_f1: 0.5502
 epoch: 86, train_loss: 0.4879, test_loss: 1.5617, test_f1: 0.5520
 epoch: 87, train_loss: 0.4876, test_loss: 1.5616, test_f1: 0.5542
 epoch: 88, train_loss: 0.4873, test_loss: 1.5303, test_f1: 0.5679
 epoch: 89, train_loss: 0.4698, test_loss: 1.5509, test_f1: 0.5416
 epoch: 90, train_loss: 0.4742, test_loss: 1.5559, test_f1: 0.5652
 epoch: 91, train_loss: 0.4910, test_loss: 1.5218, test_f1: 0.5494
 epoch: 92, train_loss: 0.4706, test_loss: 1.5661, test_f1: 0.5729
 epoch: 93, train_loss: 0.4804, test_loss: 1.5887, test_f1: 0.5700
 epoch: 94, train_loss: 0.4718, test_loss: 1.5912, test_f1: 0.5513
 epoch: 95, train_loss: 0.4792, test_loss: 1.6095, test_f1: 0.5605
 epoch: 96, train_loss: 0.4684, test_loss: 1.6158, test_f1: 0.5601
 epoch: 97, train_loss: 0.4459, test_loss: 1.5583, test_f1: 0.5912
 epoch: 98, train_loss: 0.4484, test_loss: 1.5676, test_f1: 0.5838
 epoch: 99, train_loss: 0.4515, test_loss: 1.6192, test_f1: 0.5852
##################ITERATION #4 ****************************************
 epoch: 0, train_loss: 1.2802, test_loss: 1.3186, test_f1: 0.2281
 epoch: 1, train_loss: 1.1941, test_loss: 1.3040, test_f1: 0.2281
 epoch: 2, train_loss: 1.1508, test_loss: 1.2873, test_f1: 0.2477
 epoch: 3, train_loss: 1.1405, test_loss: 1.2279, test_f1: 0.3550
 epoch: 4, train_loss: 1.1096, test_loss: 1.1969, test_f1: 0.3864
 epoch: 5, train_loss: 1.0850, test_loss: 1.1709, test_f1: 0.4145
 epoch: 6, train_loss: 1.0762, test_loss: 1.1651, test_f1: 0.4176
 epoch: 7, train_loss: 1.0615, test_loss: 1.1671, test_f1: 0.4271
 epoch: 8, train_loss: 1.0381, test_loss: 1.1621, test_f1: 0.4622
 epoch: 9, train_loss: 1.0165, test_loss: 1.1558, test_f1: 0.4699
 epoch: 10, train_loss: 0.9952, test_loss: 1.1425, test_f1: 0.4991
 epoch: 11, train_loss: 0.9828, test_loss: 1.1511, test_f1: 0.5081
 epoch: 12, train_loss: 0.9886, test_loss: 1.1449, test_f1: 0.5011
 epoch: 13, train_loss: 0.9492, test_loss: 1.1310, test_f1: 0.5064
 epoch: 14, train_loss: 0.9425, test_loss: 1.1190, test_f1: 0.5267
 epoch: 15, train_loss: 0.9323, test_loss: 1.1300, test_f1: 0.5260
 epoch: 16, train_loss: 0.9084, test_loss: 1.1457, test_f1: 0.5251
 epoch: 17, train_loss: 0.8965, test_loss: 1.1487, test_f1: 0.5476
 epoch: 18, train_loss: 0.8844, test_loss: 1.1396, test_f1: 0.5474
 epoch: 19, train_loss: 0.8700, test_loss: 1.1523, test_f1: 0.5326
 epoch: 20, train_loss: 0.8710, test_loss: 1.1691, test_f1: 0.5647
 epoch: 21, train_loss: 0.8494, test_loss: 1.1893, test_f1: 0.5515
 epoch: 22, train_loss: 0.8306, test_loss: 1.1636, test_f1: 0.5511
 epoch: 23, train_loss: 0.8222, test_loss: 1.1425, test_f1: 0.5438
 epoch: 24, train_loss: 0.8008, test_loss: 1.1343, test_f1: 0.5379
 epoch: 25, train_loss: 0.8031, test_loss: 1.1446, test_f1: 0.5358
 epoch: 26, train_loss: 0.7869, test_loss: 1.1786, test_f1: 0.5150
 epoch: 27, train_loss: 0.7714, test_loss: 1.1470, test_f1: 0.5640
 epoch: 28, train_loss: 0.7659, test_loss: 1.1890, test_f1: 0.5659
 epoch: 29, train_loss: 0.7574, test_loss: 1.1688, test_f1: 0.5721
 epoch: 30, train_loss: 0.7246, test_loss: 1.1888, test_f1: 0.5805
 epoch: 31, train_loss: 0.7361, test_loss: 1.2011, test_f1: 0.5706
 epoch: 32, train_loss: 0.7213, test_loss: 1.2497, test_f1: 0.5807
 epoch: 33, train_loss: 0.7168, test_loss: 1.2761, test_f1: 0.5568
 epoch: 34, train_loss: 0.7044, test_loss: 1.2427, test_f1: 0.5672
 epoch: 35, train_loss: 0.6914, test_loss: 1.2475, test_f1: 0.5764
 epoch: 36, train_loss: 0.6710, test_loss: 1.2524, test_f1: 0.5579
 epoch: 37, train_loss: 0.6843, test_loss: 1.2916, test_f1: 0.5450
 epoch: 38, train_loss: 0.6508, test_loss: 1.2414, test_f1: 0.5522
 epoch: 39, train_loss: 0.6308, test_loss: 1.2766, test_f1: 0.5692
 epoch: 40, train_loss: 0.6260, test_loss: 1.2782, test_f1: 0.5928
 epoch: 41, train_loss: 0.6218, test_loss: 1.3181, test_f1: 0.5846
 epoch: 42, train_loss: 0.6444, test_loss: 1.3609, test_f1: 0.5919
 epoch: 43, train_loss: 0.6208, test_loss: 1.3740, test_f1: 0.5656
 epoch: 44, train_loss: 0.6145, test_loss: 1.4716, test_f1: 0.5666
 epoch: 45, train_loss: 0.5977, test_loss: 1.4834, test_f1: 0.5481
 epoch: 46, train_loss: 0.5894, test_loss: 1.4682, test_f1: 0.5171
 epoch: 47, train_loss: 0.5901, test_loss: 1.5084, test_f1: 0.5510
 epoch: 48, train_loss: 0.5818, test_loss: 1.5625, test_f1: 0.5777
 epoch: 49, train_loss: 0.5719, test_loss: 1.5135, test_f1: 0.5786
 epoch: 50, train_loss: 0.5583, test_loss: 1.7027, test_f1: 0.5735
 epoch: 51, train_loss: 0.5398, test_loss: 1.7907, test_f1: 0.5705
 epoch: 52, train_loss: 0.5527, test_loss: 1.8096, test_f1: 0.5775
 epoch: 53, train_loss: 0.5222, test_loss: 1.7898, test_f1: 0.5590
 epoch: 54, train_loss: 0.5172, test_loss: 1.7802, test_f1: 0.5660
 epoch: 55, train_loss: 0.5177, test_loss: 1.8778, test_f1: 0.5622
 epoch: 56, train_loss: 0.5081, test_loss: 1.9943, test_f1: 0.5651
 epoch: 57, train_loss: 0.5185, test_loss: 1.9287, test_f1: 0.5607
 epoch: 58, train_loss: 0.5240, test_loss: 1.9377, test_f1: 0.5418
 epoch: 59, train_loss: 0.5118, test_loss: 1.6777, test_f1: 0.5532
 epoch: 60, train_loss: 0.4981, test_loss: 1.6998, test_f1: 0.5481
 epoch: 61, train_loss: 0.4973, test_loss: 1.7958, test_f1: 0.5632
 epoch: 62, train_loss: 0.4898, test_loss: 1.8100, test_f1: 0.5530
 epoch: 63, train_loss: 0.4864, test_loss: 1.9160, test_f1: 0.5411
 epoch: 64, train_loss: 0.4878, test_loss: 1.7791, test_f1: 0.5696
 epoch: 65, train_loss: 0.4988, test_loss: 1.7900, test_f1: 0.5559
 epoch: 66, train_loss: 0.4804, test_loss: 1.7352, test_f1: 0.5516
 epoch: 67, train_loss: 0.4627, test_loss: 1.6454, test_f1: 0.5484
 epoch: 68, train_loss: 0.4927, test_loss: 1.7728, test_f1: 0.5374
 epoch: 69, train_loss: 0.4862, test_loss: 1.8801, test_f1: 0.5342
 epoch: 70, train_loss: 0.4689, test_loss: 1.9503, test_f1: 0.5176
 epoch: 71, train_loss: 0.4828, test_loss: 1.7275, test_f1: 0.5530
 epoch: 72, train_loss: 0.4899, test_loss: 1.7926, test_f1: 0.5631
 epoch: 73, train_loss: 0.4851, test_loss: 1.7576, test_f1: 0.5503
 epoch: 74, train_loss: 0.4647, test_loss: 1.9068, test_f1: 0.5363
 epoch: 75, train_loss: 0.4741, test_loss: 1.8315, test_f1: 0.5376
 epoch: 76, train_loss: 0.4566, test_loss: 1.8691, test_f1: 0.5320
 epoch: 77, train_loss: 0.4606, test_loss: 1.7545, test_f1: 0.5648
 epoch: 78, train_loss: 0.4258, test_loss: 1.7350, test_f1: 0.5408
 epoch: 79, train_loss: 0.4673, test_loss: 1.6564, test_f1: 0.5738
 epoch: 80, train_loss: 0.4414, test_loss: 1.7118, test_f1: 0.5542
 epoch: 81, train_loss: 0.4499, test_loss: 1.7408, test_f1: 0.5525
 epoch: 82, train_loss: 0.4617, test_loss: 1.7794, test_f1: 0.5578
 epoch: 83, train_loss: 0.4262, test_loss: 1.7985, test_f1: 0.5481
 epoch: 84, train_loss: 0.4385, test_loss: 1.9354, test_f1: 0.5547
 epoch: 85, train_loss: 0.4044, test_loss: 1.9001, test_f1: 0.5559
 epoch: 86, train_loss: 0.4234, test_loss: 1.9356, test_f1: 0.5675
 epoch: 87, train_loss: 0.4049, test_loss: 1.9213, test_f1: 0.5526
 epoch: 88, train_loss: 0.4611, test_loss: 2.0382, test_f1: 0.5574
 epoch: 89, train_loss: 0.4179, test_loss: 2.0088, test_f1: 0.5355
 epoch: 90, train_loss: 0.4173, test_loss: 1.9442, test_f1: 0.5418
 epoch: 91, train_loss: 0.4310, test_loss: 2.0791, test_f1: 0.5581
 epoch: 92, train_loss: 0.4146, test_loss: 2.1649, test_f1: 0.5465
 epoch: 93, train_loss: 0.4209, test_loss: 1.8861, test_f1: 0.5451
 epoch: 94, train_loss: 0.4086, test_loss: 1.8252, test_f1: 0.5554
 epoch: 95, train_loss: 0.3945, test_loss: 1.8772, test_f1: 0.5427
 epoch: 96, train_loss: 0.4244, test_loss: 1.9409, test_f1: 0.5478
 epoch: 97, train_loss: 0.3854, test_loss: 1.8223, test_f1: 0.5305
 epoch: 98, train_loss: 0.3820, test_loss: 1.9326, test_f1: 0.5126
 epoch: 99, train_loss: 0.4341, test_loss: 1.9317, test_f1: 0.5503
##################ITERATION #5 ****************************************
 epoch: 0, train_loss: 1.2858, test_loss: 1.3183, test_f1: 0.2659
 epoch: 1, train_loss: 1.2170, test_loss: 1.3021, test_f1: 0.2717
 epoch: 2, train_loss: 1.1817, test_loss: 1.2833, test_f1: 0.2928
 epoch: 3, train_loss: 1.1503, test_loss: 1.2453, test_f1: 0.3928
 epoch: 4, train_loss: 1.1317, test_loss: 1.2279, test_f1: 0.3777
 epoch: 5, train_loss: 1.1118, test_loss: 1.2152, test_f1: 0.4394
 epoch: 6, train_loss: 1.0910, test_loss: 1.1951, test_f1: 0.4615
 epoch: 7, train_loss: 1.0602, test_loss: 1.1906, test_f1: 0.4514
 epoch: 8, train_loss: 1.0473, test_loss: 1.2380, test_f1: 0.4579
 epoch: 9, train_loss: 1.0206, test_loss: 1.2028, test_f1: 0.4913
 epoch: 10, train_loss: 1.0132, test_loss: 1.2160, test_f1: 0.5256
 epoch: 11, train_loss: 1.0012, test_loss: 1.1744, test_f1: 0.5112
 epoch: 12, train_loss: 0.9794, test_loss: 1.1728, test_f1: 0.5047
 epoch: 13, train_loss: 0.9586, test_loss: 1.1517, test_f1: 0.5311
 epoch: 14, train_loss: 0.9484, test_loss: 1.1530, test_f1: 0.5638
 epoch: 15, train_loss: 0.9392, test_loss: 1.1447, test_f1: 0.5596
 epoch: 16, train_loss: 0.9468, test_loss: 1.1613, test_f1: 0.5743
 epoch: 17, train_loss: 0.9298, test_loss: 1.1386, test_f1: 0.5793
 epoch: 18, train_loss: 0.9150, test_loss: 1.1407, test_f1: 0.5793
 epoch: 19, train_loss: 0.8959, test_loss: 1.1697, test_f1: 0.5932
 epoch: 20, train_loss: 0.8836, test_loss: 1.1236, test_f1: 0.5951
 epoch: 21, train_loss: 0.8877, test_loss: 1.1226, test_f1: 0.5694
 epoch: 22, train_loss: 0.8676, test_loss: 1.1258, test_f1: 0.5719
 epoch: 23, train_loss: 0.8679, test_loss: 1.1217, test_f1: 0.5850
 epoch: 24, train_loss: 0.8558, test_loss: 1.1130, test_f1: 0.5814
 epoch: 25, train_loss: 0.8403, test_loss: 1.1229, test_f1: 0.5885
 epoch: 26, train_loss: 0.8270, test_loss: 1.1284, test_f1: 0.5915
 epoch: 27, train_loss: 0.8053, test_loss: 1.1490, test_f1: 0.5869
 epoch: 28, train_loss: 0.8011, test_loss: 1.1950, test_f1: 0.5685
 epoch: 29, train_loss: 0.7834, test_loss: 1.1646, test_f1: 0.5884
 epoch: 30, train_loss: 0.7898, test_loss: 1.1658, test_f1: 0.5852
 epoch: 31, train_loss: 0.7895, test_loss: 1.1217, test_f1: 0.6008
 epoch: 32, train_loss: 0.7568, test_loss: 1.1842, test_f1: 0.5853
 epoch: 33, train_loss: 0.7514, test_loss: 1.1811, test_f1: 0.6080
 epoch: 34, train_loss: 0.7464, test_loss: 1.2430, test_f1: 0.6094
 epoch: 35, train_loss: 0.7516, test_loss: 1.2723, test_f1: 0.6052
 epoch: 36, train_loss: 0.7403, test_loss: 1.2077, test_f1: 0.6126
 epoch: 37, train_loss: 0.7159, test_loss: 1.1908, test_f1: 0.6075
 epoch: 38, train_loss: 0.7129, test_loss: 1.1783, test_f1: 0.5911
 epoch: 39, train_loss: 0.6897, test_loss: 1.1332, test_f1: 0.5918
 epoch: 40, train_loss: 0.7068, test_loss: 1.2229, test_f1: 0.5970
 epoch: 41, train_loss: 0.6836, test_loss: 1.2270, test_f1: 0.5720
 epoch: 42, train_loss: 0.6686, test_loss: 1.2694, test_f1: 0.6046
 epoch: 43, train_loss: 0.6648, test_loss: 1.3360, test_f1: 0.5948
 epoch: 44, train_loss: 0.6717, test_loss: 1.4612, test_f1: 0.5918
 epoch: 45, train_loss: 0.6486, test_loss: 1.3285, test_f1: 0.5919
 epoch: 46, train_loss: 0.6505, test_loss: 1.2551, test_f1: 0.6140
 epoch: 47, train_loss: 0.6440, test_loss: 1.2733, test_f1: 0.6031
 epoch: 48, train_loss: 0.6248, test_loss: 1.3025, test_f1: 0.5847
 epoch: 49, train_loss: 0.6202, test_loss: 1.2676, test_f1: 0.5899
 epoch: 50, train_loss: 0.6372, test_loss: 1.2213, test_f1: 0.6097
 epoch: 51, train_loss: 0.6118, test_loss: 1.2409, test_f1: 0.5977
 epoch: 52, train_loss: 0.6231, test_loss: 1.3017, test_f1: 0.5942
 epoch: 53, train_loss: 0.6016, test_loss: 1.2680, test_f1: 0.6022
 epoch: 54, train_loss: 0.5943, test_loss: 1.2622, test_f1: 0.5868
 epoch: 55, train_loss: 0.6006, test_loss: 1.3020, test_f1: 0.5913
 epoch: 56, train_loss: 0.5830, test_loss: 1.3085, test_f1: 0.6033
 epoch: 57, train_loss: 0.5759, test_loss: 1.3159, test_f1: 0.5816
 epoch: 58, train_loss: 0.5712, test_loss: 1.2818, test_f1: 0.6030
 epoch: 59, train_loss: 0.5816, test_loss: 1.3149, test_f1: 0.5900
 epoch: 60, train_loss: 0.5689, test_loss: 1.2896, test_f1: 0.5818
 epoch: 61, train_loss: 0.5689, test_loss: 1.3164, test_f1: 0.5967
 epoch: 62, train_loss: 0.5697, test_loss: 1.3269, test_f1: 0.6076
 epoch: 63, train_loss: 0.5685, test_loss: 1.3825, test_f1: 0.5737
 epoch: 64, train_loss: 0.5581, test_loss: 1.4003, test_f1: 0.5639
 epoch: 65, train_loss: 0.5743, test_loss: 1.3522, test_f1: 0.5903
 epoch: 66, train_loss: 0.5637, test_loss: 1.3037, test_f1: 0.5893
 epoch: 67, train_loss: 0.5638, test_loss: 1.3559, test_f1: 0.5618
 epoch: 68, train_loss: 0.5657, test_loss: 1.3101, test_f1: 0.5867
 epoch: 69, train_loss: 0.5481, test_loss: 1.4340, test_f1: 0.5988
 epoch: 70, train_loss: 0.5229, test_loss: 1.4044, test_f1: 0.5909
 epoch: 71, train_loss: 0.5286, test_loss: 1.3538, test_f1: 0.5916
 epoch: 72, train_loss: 0.5204, test_loss: 1.3495, test_f1: 0.5828
 epoch: 73, train_loss: 0.5310, test_loss: 1.4097, test_f1: 0.5747
 epoch: 74, train_loss: 0.5274, test_loss: 1.4771, test_f1: 0.5722
 epoch: 75, train_loss: 0.5234, test_loss: 1.5456, test_f1: 0.5810
 epoch: 76, train_loss: 0.5153, test_loss: 1.6233, test_f1: 0.5642
 epoch: 77, train_loss: 0.5064, test_loss: 1.4207, test_f1: 0.5741
 epoch: 78, train_loss: 0.5229, test_loss: 1.4183, test_f1: 0.5790
 epoch: 79, train_loss: 0.5021, test_loss: 1.3911, test_f1: 0.6043
 epoch: 80, train_loss: 0.5095, test_loss: 1.3351, test_f1: 0.5756
 epoch: 81, train_loss: 0.5116, test_loss: 1.3459, test_f1: 0.5879
 epoch: 82, train_loss: 0.5122, test_loss: 1.3823, test_f1: 0.5730
 epoch: 83, train_loss: 0.5019, test_loss: 1.3737, test_f1: 0.6023
 epoch: 84, train_loss: 0.5061, test_loss: 1.3798, test_f1: 0.5660
 epoch: 85, train_loss: 0.4988, test_loss: 1.5227, test_f1: 0.5881
 epoch: 86, train_loss: 0.4785, test_loss: 1.4565, test_f1: 0.5825
 epoch: 87, train_loss: 0.5069, test_loss: 1.6321, test_f1: 0.5892
 epoch: 88, train_loss: 0.4875, test_loss: 1.6445, test_f1: 0.6015
 epoch: 89, train_loss: 0.4907, test_loss: 1.4892, test_f1: 0.5952
 epoch: 90, train_loss: 0.4972, test_loss: 1.6909, test_f1: 0.5879
 epoch: 91, train_loss: 0.4801, test_loss: 1.4967, test_f1: 0.5931
 epoch: 92, train_loss: 0.4509, test_loss: 1.4848, test_f1: 0.5969
 epoch: 93, train_loss: 0.4898, test_loss: 1.4322, test_f1: 0.5958
 epoch: 94, train_loss: 0.4754, test_loss: 1.4984, test_f1: 0.5917
 epoch: 95, train_loss: 0.4592, test_loss: 1.4958, test_f1: 0.5850
 epoch: 96, train_loss: 0.4598, test_loss: 1.5872, test_f1: 0.5680
 epoch: 97, train_loss: 0.4622, test_loss: 1.4782, test_f1: 0.5877
 epoch: 98, train_loss: 0.4730, test_loss: 1.5307, test_f1: 0.5777
 epoch: 99, train_loss: 0.4621, test_loss: 1.5537, test_f1: 0.5865
##################ITERATION #6 ****************************************
 epoch: 0, train_loss: 1.3031, test_loss: 1.3318, test_f1: 0.2227
 epoch: 1, train_loss: 1.2164, test_loss: 1.3152, test_f1: 0.2428
 epoch: 2, train_loss: 1.1698, test_loss: 1.2736, test_f1: 0.3000
 epoch: 3, train_loss: 1.1521, test_loss: 1.2369, test_f1: 0.3358
 epoch: 4, train_loss: 1.1442, test_loss: 1.2264, test_f1: 0.3327
 epoch: 5, train_loss: 1.1153, test_loss: 1.2200, test_f1: 0.3912
 epoch: 6, train_loss: 1.0986, test_loss: 1.2200, test_f1: 0.4377
 epoch: 7, train_loss: 1.0735, test_loss: 1.2406, test_f1: 0.4617
 epoch: 8, train_loss: 1.0574, test_loss: 1.2005, test_f1: 0.4655
 epoch: 9, train_loss: 1.0423, test_loss: 1.1914, test_f1: 0.4649
 epoch: 10, train_loss: 1.0203, test_loss: 1.1870, test_f1: 0.4892
 epoch: 11, train_loss: 1.0054, test_loss: 1.1789, test_f1: 0.5150
 epoch: 12, train_loss: 0.9890, test_loss: 1.1631, test_f1: 0.4916
 epoch: 13, train_loss: 0.9806, test_loss: 1.1530, test_f1: 0.5006
 epoch: 14, train_loss: 0.9418, test_loss: 1.1633, test_f1: 0.4975
 epoch: 15, train_loss: 0.9461, test_loss: 1.1566, test_f1: 0.5205
 epoch: 16, train_loss: 0.9448, test_loss: 1.1375, test_f1: 0.5243
 epoch: 17, train_loss: 0.9266, test_loss: 1.1363, test_f1: 0.5340
 epoch: 18, train_loss: 0.9103, test_loss: 1.1278, test_f1: 0.5380
 epoch: 19, train_loss: 0.8995, test_loss: 1.1380, test_f1: 0.5343
 epoch: 20, train_loss: 0.8810, test_loss: 1.1338, test_f1: 0.5245
 epoch: 21, train_loss: 0.8851, test_loss: 1.1201, test_f1: 0.5408
 epoch: 22, train_loss: 0.8674, test_loss: 1.1170, test_f1: 0.5689
 epoch: 23, train_loss: 0.8609, test_loss: 1.1277, test_f1: 0.5504
 epoch: 24, train_loss: 0.8539, test_loss: 1.1257, test_f1: 0.5481
 epoch: 25, train_loss: 0.8290, test_loss: 1.1492, test_f1: 0.5426
 epoch: 26, train_loss: 0.8017, test_loss: 1.1671, test_f1: 0.5531
 epoch: 27, train_loss: 0.8227, test_loss: 1.1791, test_f1: 0.5501
 epoch: 28, train_loss: 0.8094, test_loss: 1.1766, test_f1: 0.5452
 epoch: 29, train_loss: 0.7936, test_loss: 1.1861, test_f1: 0.5377
 epoch: 30, train_loss: 0.7815, test_loss: 1.2036, test_f1: 0.5308
 epoch: 31, train_loss: 0.7807, test_loss: 1.1878, test_f1: 0.5443
 epoch: 32, train_loss: 0.7659, test_loss: 1.2158, test_f1: 0.5377
 epoch: 33, train_loss: 0.7432, test_loss: 1.2602, test_f1: 0.5572
 epoch: 34, train_loss: 0.7459, test_loss: 1.2768, test_f1: 0.5475
 epoch: 35, train_loss: 0.7163, test_loss: 1.2487, test_f1: 0.5354
 epoch: 36, train_loss: 0.7424, test_loss: 1.3123, test_f1: 0.5323
 epoch: 37, train_loss: 0.7078, test_loss: 1.3363, test_f1: 0.5318
 epoch: 38, train_loss: 0.7092, test_loss: 1.3679, test_f1: 0.5330
 epoch: 39, train_loss: 0.6933, test_loss: 1.3399, test_f1: 0.5147
 epoch: 40, train_loss: 0.6762, test_loss: 1.3395, test_f1: 0.5221
 epoch: 41, train_loss: 0.6793, test_loss: 1.3344, test_f1: 0.5474
 epoch: 42, train_loss: 0.6758, test_loss: 1.3324, test_f1: 0.5620
 epoch: 43, train_loss: 0.6629, test_loss: 1.3272, test_f1: 0.5281
 epoch: 44, train_loss: 0.6480, test_loss: 1.3254, test_f1: 0.5423
 epoch: 45, train_loss: 0.6649, test_loss: 1.3360, test_f1: 0.5393
 epoch: 46, train_loss: 0.6293, test_loss: 1.4006, test_f1: 0.5300
 epoch: 47, train_loss: 0.6272, test_loss: 1.4392, test_f1: 0.5313
 epoch: 48, train_loss: 0.6276, test_loss: 1.4329, test_f1: 0.5315
 epoch: 49, train_loss: 0.6119, test_loss: 1.4753, test_f1: 0.5495
 epoch: 50, train_loss: 0.6132, test_loss: 1.4239, test_f1: 0.5634
 epoch: 51, train_loss: 0.5848, test_loss: 1.4828, test_f1: 0.5510
 epoch: 52, train_loss: 0.5888, test_loss: 1.5179, test_f1: 0.5558
 epoch: 53, train_loss: 0.5962, test_loss: 1.5514, test_f1: 0.5307
 epoch: 54, train_loss: 0.5814, test_loss: 1.5222, test_f1: 0.5418
 epoch: 55, train_loss: 0.5890, test_loss: 1.5661, test_f1: 0.5367
 epoch: 56, train_loss: 0.5705, test_loss: 1.5387, test_f1: 0.5468
 epoch: 57, train_loss: 0.5529, test_loss: 1.5525, test_f1: 0.5511
 epoch: 58, train_loss: 0.5756, test_loss: 1.5521, test_f1: 0.5399
 epoch: 59, train_loss: 0.5704, test_loss: 1.5997, test_f1: 0.5442
 epoch: 60, train_loss: 0.5550, test_loss: 1.5770, test_f1: 0.5427
 epoch: 61, train_loss: 0.5452, test_loss: 1.6068, test_f1: 0.5511
 epoch: 62, train_loss: 0.5547, test_loss: 1.6737, test_f1: 0.5537
 epoch: 63, train_loss: 0.5375, test_loss: 1.6762, test_f1: 0.5478
 epoch: 64, train_loss: 0.5491, test_loss: 1.6557, test_f1: 0.5410
 epoch: 65, train_loss: 0.5507, test_loss: 1.6723, test_f1: 0.5497
 epoch: 66, train_loss: 0.5337, test_loss: 1.6134, test_f1: 0.5539
 epoch: 67, train_loss: 0.5210, test_loss: 1.6304, test_f1: 0.5394
 epoch: 68, train_loss: 0.5302, test_loss: 1.6613, test_f1: 0.5485
 epoch: 69, train_loss: 0.5193, test_loss: 1.7001, test_f1: 0.5428
 epoch: 70, train_loss: 0.5329, test_loss: 1.6932, test_f1: 0.5387
 epoch: 71, train_loss: 0.5139, test_loss: 1.7026, test_f1: 0.5495
 epoch: 72, train_loss: 0.5267, test_loss: 1.6688, test_f1: 0.5418
 epoch: 73, train_loss: 0.5219, test_loss: 1.6740, test_f1: 0.5355
 epoch: 74, train_loss: 0.5154, test_loss: 1.6976, test_f1: 0.5378
 epoch: 75, train_loss: 0.5168, test_loss: 1.6387, test_f1: 0.5608
 epoch: 76, train_loss: 0.5062, test_loss: 1.6852, test_f1: 0.5495
 epoch: 77, train_loss: 0.5186, test_loss: 1.7463, test_f1: 0.5566
 epoch: 78, train_loss: 0.4909, test_loss: 1.6805, test_f1: 0.5407
 epoch: 79, train_loss: 0.5212, test_loss: 1.6372, test_f1: 0.5429
 epoch: 80, train_loss: 0.4832, test_loss: 1.6472, test_f1: 0.5564
 epoch: 81, train_loss: 0.5128, test_loss: 1.7353, test_f1: 0.5227
 epoch: 82, train_loss: 0.4875, test_loss: 1.7338, test_f1: 0.5483
 epoch: 83, train_loss: 0.4915, test_loss: 1.7249, test_f1: 0.5480
 epoch: 84, train_loss: 0.4896, test_loss: 1.7507, test_f1: 0.5504
 epoch: 85, train_loss: 0.4718, test_loss: 1.7456, test_f1: 0.5582
 epoch: 86, train_loss: 0.4749, test_loss: 1.7842, test_f1: 0.5390
 epoch: 87, train_loss: 0.4912, test_loss: 1.7999, test_f1: 0.5644
 epoch: 88, train_loss: 0.4636, test_loss: 1.7976, test_f1: 0.5523
 epoch: 89, train_loss: 0.4581, test_loss: 1.8418, test_f1: 0.5426
 epoch: 90, train_loss: 0.4642, test_loss: 1.8189, test_f1: 0.5481
 epoch: 91, train_loss: 0.4541, test_loss: 1.8677, test_f1: 0.5568
 epoch: 92, train_loss: 0.4734, test_loss: 1.8903, test_f1: 0.5612
 epoch: 93, train_loss: 0.4714, test_loss: 1.9182, test_f1: 0.5384
 epoch: 94, train_loss: 0.4712, test_loss: 1.8879, test_f1: 0.5437
 epoch: 95, train_loss: 0.4379, test_loss: 1.8755, test_f1: 0.5400
 epoch: 96, train_loss: 0.4608, test_loss: 1.9491, test_f1: 0.5464
 epoch: 97, train_loss: 0.4462, test_loss: 1.9467, test_f1: 0.5500
 epoch: 98, train_loss: 0.4502, test_loss: 1.9484, test_f1: 0.5507
 epoch: 99, train_loss: 0.4373, test_loss: 1.9071, test_f1: 0.5377
##################ITERATION #7 ****************************************
 epoch: 0, train_loss: 1.2805, test_loss: 1.3462, test_f1: 0.3151
 epoch: 1, train_loss: 1.1838, test_loss: 1.3005, test_f1: 0.3232
 epoch: 2, train_loss: 1.1428, test_loss: 1.2653, test_f1: 0.3325
 epoch: 3, train_loss: 1.1082, test_loss: 1.2526, test_f1: 0.4684
 epoch: 4, train_loss: 1.0974, test_loss: 1.2433, test_f1: 0.4886
 epoch: 5, train_loss: 1.0758, test_loss: 1.2747, test_f1: 0.5213
 epoch: 6, train_loss: 1.0515, test_loss: 1.3262, test_f1: 0.5439
 epoch: 7, train_loss: 1.0296, test_loss: 1.3011, test_f1: 0.5128
 epoch: 8, train_loss: 1.0175, test_loss: 1.3065, test_f1: 0.4847
 epoch: 9, train_loss: 0.9898, test_loss: 1.2684, test_f1: 0.5287
 epoch: 10, train_loss: 0.9828, test_loss: 1.2711, test_f1: 0.5328
 epoch: 11, train_loss: 0.9717, test_loss: 1.2833, test_f1: 0.5517
 epoch: 12, train_loss: 0.9705, test_loss: 1.2703, test_f1: 0.5369
 epoch: 13, train_loss: 0.9444, test_loss: 1.2781, test_f1: 0.5078
 epoch: 14, train_loss: 0.9376, test_loss: 1.3348, test_f1: 0.5114
 epoch: 15, train_loss: 0.9204, test_loss: 1.2771, test_f1: 0.5271
 epoch: 16, train_loss: 0.8954, test_loss: 1.2348, test_f1: 0.5361
 epoch: 17, train_loss: 0.9075, test_loss: 1.2141, test_f1: 0.5236
 epoch: 18, train_loss: 0.8669, test_loss: 1.1893, test_f1: 0.5151
 epoch: 19, train_loss: 0.8817, test_loss: 1.2897, test_f1: 0.5171
 epoch: 20, train_loss: 0.8549, test_loss: 1.2510, test_f1: 0.5207
 epoch: 21, train_loss: 0.8544, test_loss: 1.2319, test_f1: 0.5359
 epoch: 22, train_loss: 0.8524, test_loss: 1.2292, test_f1: 0.5333
 epoch: 23, train_loss: 0.8378, test_loss: 1.2651, test_f1: 0.5129
 epoch: 24, train_loss: 0.8082, test_loss: 1.3076, test_f1: 0.5300
 epoch: 25, train_loss: 0.8142, test_loss: 1.2755, test_f1: 0.5337
 epoch: 26, train_loss: 0.7913, test_loss: 1.2767, test_f1: 0.5505
 epoch: 27, train_loss: 0.8034, test_loss: 1.2990, test_f1: 0.4942
 epoch: 28, train_loss: 0.8032, test_loss: 1.3322, test_f1: 0.5475
 epoch: 29, train_loss: 0.7864, test_loss: 1.4589, test_f1: 0.5346
 epoch: 30, train_loss: 0.7814, test_loss: 1.3611, test_f1: 0.5570
 epoch: 31, train_loss: 0.7698, test_loss: 1.3240, test_f1: 0.5520
 epoch: 32, train_loss: 0.7480, test_loss: 1.4610, test_f1: 0.5378
 epoch: 33, train_loss: 0.7514, test_loss: 1.4109, test_f1: 0.5347
 epoch: 34, train_loss: 0.7598, test_loss: 1.3752, test_f1: 0.5464
 epoch: 35, train_loss: 0.7404, test_loss: 1.3240, test_f1: 0.5533
 epoch: 36, train_loss: 0.7326, test_loss: 1.4526, test_f1: 0.5184
 epoch: 37, train_loss: 0.7124, test_loss: 1.3923, test_f1: 0.5534
 epoch: 38, train_loss: 0.7316, test_loss: 1.5049, test_f1: 0.5464
 epoch: 39, train_loss: 0.6953, test_loss: 1.5427, test_f1: 0.5382
 epoch: 40, train_loss: 0.6925, test_loss: 1.4058, test_f1: 0.5709
 epoch: 41, train_loss: 0.6936, test_loss: 1.3649, test_f1: 0.5516
 epoch: 42, train_loss: 0.6759, test_loss: 1.3892, test_f1: 0.5589
 epoch: 43, train_loss: 0.6772, test_loss: 1.5179, test_f1: 0.5684
 epoch: 44, train_loss: 0.6573, test_loss: 1.5281, test_f1: 0.5576
 epoch: 45, train_loss: 0.6627, test_loss: 1.5430, test_f1: 0.5588
 epoch: 46, train_loss: 0.6654, test_loss: 1.4779, test_f1: 0.5500
 epoch: 47, train_loss: 0.6476, test_loss: 1.4549, test_f1: 0.5390
 epoch: 48, train_loss: 0.6678, test_loss: 1.4705, test_f1: 0.5747
 epoch: 49, train_loss: 0.6500, test_loss: 1.4685, test_f1: 0.5471
 epoch: 50, train_loss: 0.6552, test_loss: 1.5446, test_f1: 0.5592
 epoch: 51, train_loss: 0.6388, test_loss: 1.7421, test_f1: 0.5648
 epoch: 52, train_loss: 0.6181, test_loss: 1.5821, test_f1: 0.5691
 epoch: 53, train_loss: 0.6138, test_loss: 1.5963, test_f1: 0.5461
 epoch: 54, train_loss: 0.6141, test_loss: 1.5540, test_f1: 0.5460
 epoch: 55, train_loss: 0.6193, test_loss: 1.4808, test_f1: 0.5548
 epoch: 56, train_loss: 0.6214, test_loss: 1.5802, test_f1: 0.5573
 epoch: 57, train_loss: 0.6006, test_loss: 1.5905, test_f1: 0.5353
 epoch: 58, train_loss: 0.5939, test_loss: 1.7057, test_f1: 0.5377
 epoch: 59, train_loss: 0.5918, test_loss: 1.7070, test_f1: 0.5362
 epoch: 60, train_loss: 0.5785, test_loss: 1.6316, test_f1: 0.5525
 epoch: 61, train_loss: 0.5939, test_loss: 1.6499, test_f1: 0.5620
 epoch: 62, train_loss: 0.5771, test_loss: 1.6876, test_f1: 0.5525
 epoch: 63, train_loss: 0.5938, test_loss: 1.6371, test_f1: 0.5656
 epoch: 64, train_loss: 0.5898, test_loss: 1.6651, test_f1: 0.5388
 epoch: 65, train_loss: 0.5769, test_loss: 1.7215, test_f1: 0.5440
 epoch: 66, train_loss: 0.5927, test_loss: 1.7188, test_f1: 0.5319
 epoch: 67, train_loss: 0.5628, test_loss: 1.6873, test_f1: 0.5469
 epoch: 68, train_loss: 0.5702, test_loss: 1.6457, test_f1: 0.5577
 epoch: 69, train_loss: 0.5665, test_loss: 1.7815, test_f1: 0.5435
 epoch: 70, train_loss: 0.5643, test_loss: 1.8449, test_f1: 0.5516
 epoch: 71, train_loss: 0.5599, test_loss: 1.7577, test_f1: 0.5410
 epoch: 72, train_loss: 0.5774, test_loss: 1.7092, test_f1: 0.5677
 epoch: 73, train_loss: 0.5459, test_loss: 1.8046, test_f1: 0.5557
 epoch: 74, train_loss: 0.5621, test_loss: 1.8052, test_f1: 0.5469
 epoch: 75, train_loss: 0.5539, test_loss: 1.7998, test_f1: 0.5715
 epoch: 76, train_loss: 0.5564, test_loss: 1.9552, test_f1: 0.5520
 epoch: 77, train_loss: 0.5473, test_loss: 1.9171, test_f1: 0.5549
 epoch: 78, train_loss: 0.5229, test_loss: 1.8282, test_f1: 0.5581
 epoch: 79, train_loss: 0.5463, test_loss: 1.7870, test_f1: 0.5283
 epoch: 80, train_loss: 0.5420, test_loss: 1.7426, test_f1: 0.5361
 epoch: 81, train_loss: 0.5121, test_loss: 1.7356, test_f1: 0.5455
 epoch: 82, train_loss: 0.5369, test_loss: 1.8987, test_f1: 0.5509
 epoch: 83, train_loss: 0.5285, test_loss: 1.9402, test_f1: 0.5457
 epoch: 84, train_loss: 0.5311, test_loss: 2.1240, test_f1: 0.5562
 epoch: 85, train_loss: 0.5315, test_loss: 1.9595, test_f1: 0.5445
 epoch: 86, train_loss: 0.5022, test_loss: 1.8959, test_f1: 0.5606
 epoch: 87, train_loss: 0.5130, test_loss: 1.8537, test_f1: 0.5503
 epoch: 88, train_loss: 0.5069, test_loss: 1.9884, test_f1: 0.5371
 epoch: 89, train_loss: 0.5148, test_loss: 2.0079, test_f1: 0.5437
 epoch: 90, train_loss: 0.5091, test_loss: 1.8427, test_f1: 0.5562
 epoch: 91, train_loss: 0.5077, test_loss: 1.8187, test_f1: 0.5497
 epoch: 92, train_loss: 0.5109, test_loss: 1.8236, test_f1: 0.5519
 epoch: 93, train_loss: 0.5239, test_loss: 1.8466, test_f1: 0.5556
 epoch: 94, train_loss: 0.5247, test_loss: 1.9181, test_f1: 0.5433
 epoch: 95, train_loss: 0.4839, test_loss: 1.9364, test_f1: 0.5529
 epoch: 96, train_loss: 0.4911, test_loss: 1.9347, test_f1: 0.5507
 epoch: 97, train_loss: 0.4939, test_loss: 1.9328, test_f1: 0.5615
 epoch: 98, train_loss: 0.4933, test_loss: 2.0113, test_f1: 0.5711
 epoch: 99, train_loss: 0.5046, test_loss: 1.9350, test_f1: 0.5638
##################ITERATION #8 ****************************************
 epoch: 0, train_loss: 1.3092, test_loss: 1.3356, test_f1: 0.2285
 epoch: 1, train_loss: 1.2085, test_loss: 1.3409, test_f1: 0.3030
 epoch: 2, train_loss: 1.1623, test_loss: 1.3397, test_f1: 0.3894
 epoch: 3, train_loss: 1.1323, test_loss: 1.2918, test_f1: 0.4220
 epoch: 4, train_loss: 1.1121, test_loss: 1.2518, test_f1: 0.4853
 epoch: 5, train_loss: 1.0695, test_loss: 1.2311, test_f1: 0.4884
 epoch: 6, train_loss: 1.0566, test_loss: 1.2124, test_f1: 0.5067
 epoch: 7, train_loss: 1.0471, test_loss: 1.2175, test_f1: 0.5263
 epoch: 8, train_loss: 1.0248, test_loss: 1.2344, test_f1: 0.5513
 epoch: 9, train_loss: 1.0133, test_loss: 1.2415, test_f1: 0.5463
 epoch: 10, train_loss: 0.9979, test_loss: 1.2215, test_f1: 0.5543
 epoch: 11, train_loss: 0.9773, test_loss: 1.2045, test_f1: 0.5618
 epoch: 12, train_loss: 0.9508, test_loss: 1.2050, test_f1: 0.5490
 epoch: 13, train_loss: 0.9599, test_loss: 1.2065, test_f1: 0.5467
 epoch: 14, train_loss: 0.9652, test_loss: 1.2256, test_f1: 0.5414
 epoch: 15, train_loss: 0.9434, test_loss: 1.2423, test_f1: 0.5191
 epoch: 16, train_loss: 0.9082, test_loss: 1.2021, test_f1: 0.5404
 epoch: 17, train_loss: 0.8804, test_loss: 1.2198, test_f1: 0.5382
 epoch: 18, train_loss: 0.9130, test_loss: 1.2334, test_f1: 0.5604
 epoch: 19, train_loss: 0.8726, test_loss: 1.2562, test_f1: 0.5688
 epoch: 20, train_loss: 0.8908, test_loss: 1.2922, test_f1: 0.5637
 epoch: 21, train_loss: 0.8632, test_loss: 1.2863, test_f1: 0.5434
 epoch: 22, train_loss: 0.8487, test_loss: 1.2444, test_f1: 0.5511
 epoch: 23, train_loss: 0.8317, test_loss: 1.2619, test_f1: 0.5502
 epoch: 24, train_loss: 0.8395, test_loss: 1.2670, test_f1: 0.5659
 epoch: 25, train_loss: 0.8142, test_loss: 1.3141, test_f1: 0.5239
 epoch: 26, train_loss: 0.8192, test_loss: 1.3080, test_f1: 0.5517
 epoch: 27, train_loss: 0.8030, test_loss: 1.2701, test_f1: 0.5457
 epoch: 28, train_loss: 0.7817, test_loss: 1.2613, test_f1: 0.5427
 epoch: 29, train_loss: 0.7908, test_loss: 1.2801, test_f1: 0.5506
 epoch: 30, train_loss: 0.7990, test_loss: 1.2941, test_f1: 0.5499
 epoch: 31, train_loss: 0.7676, test_loss: 1.2752, test_f1: 0.5481
 epoch: 32, train_loss: 0.7605, test_loss: 1.2806, test_f1: 0.5589
 epoch: 33, train_loss: 0.7508, test_loss: 1.2773, test_f1: 0.5308
 epoch: 34, train_loss: 0.7351, test_loss: 1.2805, test_f1: 0.5460
 epoch: 35, train_loss: 0.7265, test_loss: 1.3258, test_f1: 0.5338
 epoch: 36, train_loss: 0.7171, test_loss: 1.3227, test_f1: 0.5439
 epoch: 37, train_loss: 0.7051, test_loss: 1.3508, test_f1: 0.5567
 epoch: 38, train_loss: 0.7216, test_loss: 1.3421, test_f1: 0.5522
 epoch: 39, train_loss: 0.7164, test_loss: 1.3237, test_f1: 0.5391
 epoch: 40, train_loss: 0.7017, test_loss: 1.3147, test_f1: 0.5456
 epoch: 41, train_loss: 0.6968, test_loss: 1.2743, test_f1: 0.5442
 epoch: 42, train_loss: 0.6796, test_loss: 1.3757, test_f1: 0.5473
 epoch: 43, train_loss: 0.6760, test_loss: 1.3790, test_f1: 0.5637
 epoch: 44, train_loss: 0.6701, test_loss: 1.3452, test_f1: 0.5459
 epoch: 45, train_loss: 0.6469, test_loss: 1.4191, test_f1: 0.5243
 epoch: 46, train_loss: 0.6671, test_loss: 1.4343, test_f1: 0.5486
 epoch: 47, train_loss: 0.6436, test_loss: 1.3781, test_f1: 0.5323
 epoch: 48, train_loss: 0.6382, test_loss: 1.4217, test_f1: 0.5465
 epoch: 49, train_loss: 0.6454, test_loss: 1.4331, test_f1: 0.5424
 epoch: 50, train_loss: 0.6362, test_loss: 1.4589, test_f1: 0.5481
 epoch: 51, train_loss: 0.6059, test_loss: 1.4832, test_f1: 0.5386
 epoch: 52, train_loss: 0.6258, test_loss: 1.4818, test_f1: 0.5441
 epoch: 53, train_loss: 0.6051, test_loss: 1.4280, test_f1: 0.5497
 epoch: 54, train_loss: 0.6117, test_loss: 1.4033, test_f1: 0.5484
 epoch: 55, train_loss: 0.6029, test_loss: 1.3732, test_f1: 0.5490
 epoch: 56, train_loss: 0.6102, test_loss: 1.3845, test_f1: 0.5553
 epoch: 57, train_loss: 0.5882, test_loss: 1.4209, test_f1: 0.5371
 epoch: 58, train_loss: 0.5684, test_loss: 1.4497, test_f1: 0.5274
 epoch: 59, train_loss: 0.5800, test_loss: 1.4121, test_f1: 0.5320
 epoch: 60, train_loss: 0.5763, test_loss: 1.4461, test_f1: 0.5372
 epoch: 61, train_loss: 0.5905, test_loss: 1.4592, test_f1: 0.5433
 epoch: 62, train_loss: 0.5724, test_loss: 1.4633, test_f1: 0.5471
 epoch: 63, train_loss: 0.5704, test_loss: 1.5429, test_f1: 0.5093
 epoch: 64, train_loss: 0.5741, test_loss: 1.6164, test_f1: 0.5092
 epoch: 65, train_loss: 0.5602, test_loss: 1.5456, test_f1: 0.5317
 epoch: 66, train_loss: 0.5607, test_loss: 1.5282, test_f1: 0.5451
 epoch: 67, train_loss: 0.5476, test_loss: 1.5748, test_f1: 0.5349
 epoch: 68, train_loss: 0.5531, test_loss: 1.5932, test_f1: 0.5286
 epoch: 69, train_loss: 0.5354, test_loss: 1.6028, test_f1: 0.5212
 epoch: 70, train_loss: 0.5580, test_loss: 1.6064, test_f1: 0.5353
 epoch: 71, train_loss: 0.5473, test_loss: 1.5937, test_f1: 0.5180
 epoch: 72, train_loss: 0.5404, test_loss: 1.6042, test_f1: 0.5164
 epoch: 73, train_loss: 0.5402, test_loss: 1.5310, test_f1: 0.5238
 epoch: 74, train_loss: 0.5258, test_loss: 1.5412, test_f1: 0.5255
 epoch: 75, train_loss: 0.5160, test_loss: 1.5844, test_f1: 0.5313
 epoch: 76, train_loss: 0.5344, test_loss: 1.5144, test_f1: 0.5285
 epoch: 77, train_loss: 0.5325, test_loss: 1.5368, test_f1: 0.5295
 epoch: 78, train_loss: 0.5319, test_loss: 1.5942, test_f1: 0.5149
 epoch: 79, train_loss: 0.5194, test_loss: 1.5490, test_f1: 0.5245
 epoch: 80, train_loss: 0.5028, test_loss: 1.5605, test_f1: 0.5206
 epoch: 81, train_loss: 0.5057, test_loss: 1.5703, test_f1: 0.5288
 epoch: 82, train_loss: 0.5023, test_loss: 1.6223, test_f1: 0.5087
 epoch: 83, train_loss: 0.5299, test_loss: 1.5415, test_f1: 0.5166
 epoch: 84, train_loss: 0.5173, test_loss: 1.5937, test_f1: 0.5155
 epoch: 85, train_loss: 0.4903, test_loss: 1.7063, test_f1: 0.5107
 epoch: 86, train_loss: 0.4941, test_loss: 1.6270, test_f1: 0.5115
 epoch: 87, train_loss: 0.5229, test_loss: 1.6119, test_f1: 0.5079
 epoch: 88, train_loss: 0.4869, test_loss: 1.6381, test_f1: 0.5300
 epoch: 89, train_loss: 0.5093, test_loss: 1.5980, test_f1: 0.5122
 epoch: 90, train_loss: 0.4874, test_loss: 1.5932, test_f1: 0.5186
 epoch: 91, train_loss: 0.4793, test_loss: 1.6142, test_f1: 0.5086
 epoch: 92, train_loss: 0.4982, test_loss: 1.6049, test_f1: 0.5030
 epoch: 93, train_loss: 0.4795, test_loss: 1.6751, test_f1: 0.5187
 epoch: 94, train_loss: 0.4761, test_loss: 1.7482, test_f1: 0.5171
 epoch: 95, train_loss: 0.4603, test_loss: 1.7217, test_f1: 0.5079
 epoch: 96, train_loss: 0.4717, test_loss: 1.7491, test_f1: 0.5057
 epoch: 97, train_loss: 0.4661, test_loss: 1.7091, test_f1: 0.5198
 epoch: 98, train_loss: 0.4502, test_loss: 1.7141, test_f1: 0.5120
 epoch: 99, train_loss: 0.4606, test_loss: 1.7828, test_f1: 0.5151
##################ITERATION #9 ****************************************
 epoch: 0, train_loss: 1.3664, test_loss: 1.3208, test_f1: 0.3091
 epoch: 1, train_loss: 1.2038, test_loss: 1.2925, test_f1: 0.3030
 epoch: 2, train_loss: 1.1858, test_loss: 1.3130, test_f1: 0.4014
 epoch: 3, train_loss: 1.1270, test_loss: 1.2560, test_f1: 0.4590
 epoch: 4, train_loss: 1.1204, test_loss: 1.2286, test_f1: 0.4696
 epoch: 5, train_loss: 1.1054, test_loss: 1.2292, test_f1: 0.4990
 epoch: 6, train_loss: 1.0695, test_loss: 1.2104, test_f1: 0.5256
 epoch: 7, train_loss: 1.0574, test_loss: 1.2007, test_f1: 0.5250
 epoch: 8, train_loss: 1.0446, test_loss: 1.1532, test_f1: 0.5282
 epoch: 9, train_loss: 1.0272, test_loss: 1.1504, test_f1: 0.5145
 epoch: 10, train_loss: 1.0035, test_loss: 1.1381, test_f1: 0.5149
 epoch: 11, train_loss: 0.9885, test_loss: 1.1454, test_f1: 0.5063
 epoch: 12, train_loss: 0.9926, test_loss: 1.1455, test_f1: 0.5092
 epoch: 13, train_loss: 0.9608, test_loss: 1.1593, test_f1: 0.5617
 epoch: 14, train_loss: 0.9481, test_loss: 1.1552, test_f1: 0.5439
 epoch: 15, train_loss: 0.9601, test_loss: 1.1671, test_f1: 0.5243
 epoch: 16, train_loss: 0.9362, test_loss: 1.2167, test_f1: 0.5176
 epoch: 17, train_loss: 0.9233, test_loss: 1.2279, test_f1: 0.4958
 epoch: 18, train_loss: 0.8977, test_loss: 1.2138, test_f1: 0.5112
 epoch: 19, train_loss: 0.8970, test_loss: 1.2098, test_f1: 0.5160
 epoch: 20, train_loss: 0.8972, test_loss: 1.1865, test_f1: 0.5130
 epoch: 21, train_loss: 0.8683, test_loss: 1.1488, test_f1: 0.5506
 epoch: 22, train_loss: 0.8544, test_loss: 1.1287, test_f1: 0.5501
 epoch: 23, train_loss: 0.8555, test_loss: 1.1473, test_f1: 0.5455
 epoch: 24, train_loss: 0.8354, test_loss: 1.1328, test_f1: 0.5628
 epoch: 25, train_loss: 0.8270, test_loss: 1.1561, test_f1: 0.5723
 epoch: 26, train_loss: 0.8299, test_loss: 1.1622, test_f1: 0.5452
 epoch: 27, train_loss: 0.8156, test_loss: 1.1837, test_f1: 0.5440
 epoch: 28, train_loss: 0.8113, test_loss: 1.1627, test_f1: 0.5470
 epoch: 29, train_loss: 0.7847, test_loss: 1.2117, test_f1: 0.5375
 epoch: 30, train_loss: 0.7905, test_loss: 1.1895, test_f1: 0.5632
 epoch: 31, train_loss: 0.7843, test_loss: 1.1846, test_f1: 0.5476
 epoch: 32, train_loss: 0.7821, test_loss: 1.2104, test_f1: 0.5366
 epoch: 33, train_loss: 0.7618, test_loss: 1.1887, test_f1: 0.5591
 epoch: 34, train_loss: 0.7653, test_loss: 1.1783, test_f1: 0.5646
 epoch: 35, train_loss: 0.7565, test_loss: 1.1928, test_f1: 0.5418
 epoch: 36, train_loss: 0.7521, test_loss: 1.2282, test_f1: 0.5282
 epoch: 37, train_loss: 0.7428, test_loss: 1.2426, test_f1: 0.5594
 epoch: 38, train_loss: 0.7231, test_loss: 1.2334, test_f1: 0.5674
 epoch: 39, train_loss: 0.7270, test_loss: 1.2225, test_f1: 0.5702
 epoch: 40, train_loss: 0.7234, test_loss: 1.2505, test_f1: 0.5499
 epoch: 41, train_loss: 0.7119, test_loss: 1.3082, test_f1: 0.5342
 epoch: 42, train_loss: 0.6871, test_loss: 1.2756, test_f1: 0.5469
 epoch: 43, train_loss: 0.6946, test_loss: 1.2582, test_f1: 0.5608
 epoch: 44, train_loss: 0.6864, test_loss: 1.3101, test_f1: 0.5439
 epoch: 45, train_loss: 0.6684, test_loss: 1.2669, test_f1: 0.5502
 epoch: 46, train_loss: 0.6801, test_loss: 1.2583, test_f1: 0.5694
 epoch: 47, train_loss: 0.6578, test_loss: 1.2148, test_f1: 0.5629
 epoch: 48, train_loss: 0.6730, test_loss: 1.2598, test_f1: 0.5623
 epoch: 49, train_loss: 0.6614, test_loss: 1.2558, test_f1: 0.5536
 epoch: 50, train_loss: 0.6445, test_loss: 1.3311, test_f1: 0.5638
 epoch: 51, train_loss: 0.6357, test_loss: 1.2818, test_f1: 0.5593
 epoch: 52, train_loss: 0.6425, test_loss: 1.3104, test_f1: 0.5433
 epoch: 53, train_loss: 0.6284, test_loss: 1.3131, test_f1: 0.5512
 epoch: 54, train_loss: 0.6290, test_loss: 1.3065, test_f1: 0.5551
 epoch: 55, train_loss: 0.6105, test_loss: 1.3341, test_f1: 0.5453
 epoch: 56, train_loss: 0.6079, test_loss: 1.3208, test_f1: 0.5410
 epoch: 57, train_loss: 0.6125, test_loss: 1.3367, test_f1: 0.5605
 epoch: 58, train_loss: 0.5946, test_loss: 1.3186, test_f1: 0.5541
 epoch: 59, train_loss: 0.5937, test_loss: 1.3931, test_f1: 0.5836
 epoch: 60, train_loss: 0.6179, test_loss: 1.3383, test_f1: 0.5468
 epoch: 61, train_loss: 0.6018, test_loss: 1.3472, test_f1: 0.5693
 epoch: 62, train_loss: 0.5834, test_loss: 1.3862, test_f1: 0.5645
 epoch: 63, train_loss: 0.5981, test_loss: 1.4148, test_f1: 0.5518
 epoch: 64, train_loss: 0.5841, test_loss: 1.3898, test_f1: 0.5652
 epoch: 65, train_loss: 0.6018, test_loss: 1.4188, test_f1: 0.5243
 epoch: 66, train_loss: 0.6018, test_loss: 1.3276, test_f1: 0.5413
 epoch: 67, train_loss: 0.5975, test_loss: 1.3833, test_f1: 0.5486
 epoch: 68, train_loss: 0.5810, test_loss: 1.3614, test_f1: 0.5515
 epoch: 69, train_loss: 0.5938, test_loss: 1.4300, test_f1: 0.5366
 epoch: 70, train_loss: 0.5914, test_loss: 1.4001, test_f1: 0.5347
 epoch: 71, train_loss: 0.5453, test_loss: 1.3796, test_f1: 0.5424
 epoch: 72, train_loss: 0.5640, test_loss: 1.3543, test_f1: 0.5540
 epoch: 73, train_loss: 0.5662, test_loss: 1.3673, test_f1: 0.5498
 epoch: 74, train_loss: 0.5370, test_loss: 1.3577, test_f1: 0.5675
 epoch: 75, train_loss: 0.5480, test_loss: 1.3439, test_f1: 0.5519
 epoch: 76, train_loss: 0.5377, test_loss: 1.4109, test_f1: 0.5506
 epoch: 77, train_loss: 0.5530, test_loss: 1.4070, test_f1: 0.5381
 epoch: 78, train_loss: 0.5709, test_loss: 1.4028, test_f1: 0.5397
 epoch: 79, train_loss: 0.5627, test_loss: 1.4239, test_f1: 0.5397
 epoch: 80, train_loss: 0.5344, test_loss: 1.4619, test_f1: 0.5446
 epoch: 81, train_loss: 0.5314, test_loss: 1.4974, test_f1: 0.5500
 epoch: 82, train_loss: 0.5282, test_loss: 1.4918, test_f1: 0.5565
 epoch: 83, train_loss: 0.5425, test_loss: 1.5268, test_f1: 0.5446
 epoch: 84, train_loss: 0.5411, test_loss: 1.5720, test_f1: 0.5414
 epoch: 85, train_loss: 0.5405, test_loss: 1.5899, test_f1: 0.5294
 epoch: 86, train_loss: 0.5332, test_loss: 1.5775, test_f1: 0.5469
 epoch: 87, train_loss: 0.5197, test_loss: 1.4832, test_f1: 0.5626
 epoch: 88, train_loss: 0.5155, test_loss: 1.4446, test_f1: 0.5592
 epoch: 89, train_loss: 0.5061, test_loss: 1.4871, test_f1: 0.5440
 epoch: 90, train_loss: 0.5083, test_loss: 1.4945, test_f1: 0.5533
 epoch: 91, train_loss: 0.5227, test_loss: 1.4949, test_f1: 0.5559
 epoch: 92, train_loss: 0.5096, test_loss: 1.5741, test_f1: 0.5565
 epoch: 93, train_loss: 0.5120, test_loss: 1.5873, test_f1: 0.5340
 epoch: 94, train_loss: 0.4824, test_loss: 1.5534, test_f1: 0.5445
 epoch: 95, train_loss: 0.4913, test_loss: 1.5869, test_f1: 0.5604
 epoch: 96, train_loss: 0.4880, test_loss: 1.5926, test_f1: 0.5560
 epoch: 97, train_loss: 0.4985, test_loss: 1.6330, test_f1: 0.5448
 epoch: 98, train_loss: 0.4929, test_loss: 1.5985, test_f1: 0.5495
 epoch: 99, train_loss: 0.5029, test_loss: 1.5779, test_f1: 0.5521

Training completed in 348.44 seconds
Best F1: 0.6140 at epoch 46
Mean F1 across iterations: 0.5881  0.0154
========================FINAL RESULTS================================
FEGIN weighted F1: 0.6140  0.0154
python main.py --data ltspice_demos --representation component_component --model FEGIN --layers 4 --hiddens 128 --batch_size 128 --lr 0.0001 --emb_size 128 --epochs 100 --save_appendix component_component_L4_H128_BS128_LR0.0001_E128 --no_val
-----



STDERR:
  File "main.py", line 370, in <module>
    main()
  File "main.py", line 254, in main
    dataset = dataset_class(
  File "/home/philip/projects/ltspice_examples_code_repo/Circuit-Completion-Using-GNNs/component_classification_with_link_prediction_head/evaluation/FEGIN/kernel/circuit_datasets.py", line 15, in __init__
    self.data, self.slices = torch.load(self.processed_paths[0])
  File "/home/philip/.local/lib/python3.8/site-packages/torch/serialization.py", line 1040, in load
    warnings.warn(
  File "/usr/lib/python3.8/warnings.py", line 109, in _showwarnmsg
    sw(msg.message, msg.category, msg.filename, msg.lineno,
  File "main.py", line 47, in warn_with_traceback
    traceback.print_stack(file=log)
/home/philip/projects/ltspice_examples_code_repo/Circuit-Completion-Using-GNNs/component_classification_with_link_prediction_head/evaluation/FEGIN/kernel/circuit_datasets.py:15: FutureWarning: You are using `torch.load` with `weights_only=False` (the current default value), which uses the default pickle module implicitly. It is possible to construct malicious pickle data which will execute arbitrary code during unpickling (See https://github.com/pytorch/pytorch/blob/main/SECURITY.md#untrusted-models for more details). In a future release, the default value for `weights_only` will be flipped to `True`. This limits the functions that could be executed during unpickling. Arbitrary objects will no longer be allowed to be loaded via this mode unless they are explicitly allowlisted by the user via `torch.serialization.add_safe_globals`. We recommend you start setting `weights_only=True` for any use case where you don't have full control of the loaded file. Please open an issue on GitHub for any issues related to this experimental feature.
  self.data, self.slices = torch.load(self.processed_paths[0])
