STDOUT:
Results will be saved in /home/philip/projects/llm_inference_code_repo/Circuit-Completion-Using-GNNs/component_classification_with_link_prediction_head/evaluation/FEGIN/results/model_FEGIN_dataset_ltspice_examples
Command line input: python main.py --data ltspice_examples --representation component_pin --model FEGIN --layers 6 --hiddens 128 --batch_size 64 --lr 0.0001 --emb_size 512 --epochs 100 --save_appendix component_pin_L6_H128_BS64_LR0.0001_E512 --no_val
 is saved.
-----
ltspice_examples - FEGIN
Using 6 layers, 128 hidden units, h = 2
Loading component_pin representation dataset
ENTERED
Training FEGIN on component_pin representation
Train: 3560, Test: 848
##################ITERATION #0 ****************************************
 epoch: 0, train_loss: 1.3516, test_loss: 1.3276, test_f1: 0.2260
 epoch: 1, train_loss: 1.2794, test_loss: 1.2478, test_f1: 0.2260
 epoch: 2, train_loss: 1.2216, test_loss: 1.1785, test_f1: 0.3275
 epoch: 3, train_loss: 1.1448, test_loss: 1.0938, test_f1: 0.3410
 epoch: 4, train_loss: 1.0668, test_loss: 1.0416, test_f1: 0.3435
 epoch: 5, train_loss: 1.0174, test_loss: 1.0287, test_f1: 0.3575
 epoch: 6, train_loss: 0.9940, test_loss: 0.9983, test_f1: 0.3651
 epoch: 7, train_loss: 0.9732, test_loss: 0.9945, test_f1: 0.4180
 epoch: 8, train_loss: 0.9540, test_loss: 0.9799, test_f1: 0.4565
 epoch: 9, train_loss: 0.9386, test_loss: 0.9709, test_f1: 0.4919
 epoch: 10, train_loss: 0.9247, test_loss: 0.9634, test_f1: 0.5100
 epoch: 11, train_loss: 0.9112, test_loss: 0.9799, test_f1: 0.5039
 epoch: 12, train_loss: 0.8843, test_loss: 0.9226, test_f1: 0.5346
 epoch: 13, train_loss: 0.8733, test_loss: 0.9488, test_f1: 0.5136
 epoch: 14, train_loss: 0.8596, test_loss: 0.9269, test_f1: 0.5168
 epoch: 15, train_loss: 0.8477, test_loss: 0.9091, test_f1: 0.5275
 epoch: 16, train_loss: 0.8300, test_loss: 0.9040, test_f1: 0.5258
 epoch: 17, train_loss: 0.8223, test_loss: 0.9005, test_f1: 0.5447
 epoch: 18, train_loss: 0.7980, test_loss: 0.8838, test_f1: 0.5433
 epoch: 19, train_loss: 0.7842, test_loss: 0.8853, test_f1: 0.5548
 epoch: 20, train_loss: 0.7936, test_loss: 0.8889, test_f1: 0.5475
 epoch: 21, train_loss: 0.7742, test_loss: 0.8877, test_f1: 0.5621
 epoch: 22, train_loss: 0.7580, test_loss: 0.8841, test_f1: 0.5868
 epoch: 23, train_loss: 0.7432, test_loss: 0.8870, test_f1: 0.5661
 epoch: 24, train_loss: 0.7391, test_loss: 0.9040, test_f1: 0.5839
 epoch: 25, train_loss: 0.7236, test_loss: 0.9201, test_f1: 0.5628
 epoch: 26, train_loss: 0.7181, test_loss: 0.9031, test_f1: 0.5619
 epoch: 27, train_loss: 0.7183, test_loss: 0.9123, test_f1: 0.5760
 epoch: 28, train_loss: 0.6919, test_loss: 0.9161, test_f1: 0.5688
 epoch: 29, train_loss: 0.6913, test_loss: 0.9184, test_f1: 0.5799
 epoch: 30, train_loss: 0.6793, test_loss: 0.9633, test_f1: 0.5542
 epoch: 31, train_loss: 0.6734, test_loss: 0.9204, test_f1: 0.5892
 epoch: 32, train_loss: 0.6744, test_loss: 0.9042, test_f1: 0.5837
 epoch: 33, train_loss: 0.6585, test_loss: 0.9240, test_f1: 0.5722
 epoch: 34, train_loss: 0.6511, test_loss: 0.9021, test_f1: 0.5976
 epoch: 35, train_loss: 0.6416, test_loss: 0.8958, test_f1: 0.6132
 epoch: 36, train_loss: 0.6208, test_loss: 0.9251, test_f1: 0.6154
 epoch: 37, train_loss: 0.6279, test_loss: 0.9338, test_f1: 0.5966
 epoch: 38, train_loss: 0.6244, test_loss: 0.9284, test_f1: 0.5976
 epoch: 39, train_loss: 0.6254, test_loss: 0.8897, test_f1: 0.6196
 epoch: 40, train_loss: 0.6010, test_loss: 0.9256, test_f1: 0.5994
 epoch: 41, train_loss: 0.6120, test_loss: 0.9362, test_f1: 0.5871
 epoch: 42, train_loss: 0.5891, test_loss: 0.9601, test_f1: 0.5863
 epoch: 43, train_loss: 0.5857, test_loss: 0.9164, test_f1: 0.5897
 epoch: 44, train_loss: 0.5732, test_loss: 0.9436, test_f1: 0.6180
 epoch: 45, train_loss: 0.5786, test_loss: 0.9713, test_f1: 0.5813
 epoch: 46, train_loss: 0.5593, test_loss: 1.0125, test_f1: 0.5946
 epoch: 47, train_loss: 0.5740, test_loss: 0.9887, test_f1: 0.6032
 epoch: 48, train_loss: 0.5614, test_loss: 0.9483, test_f1: 0.5952
 epoch: 49, train_loss: 0.5831, test_loss: 0.9277, test_f1: 0.6178
 epoch: 50, train_loss: 0.5454, test_loss: 0.9802, test_f1: 0.6090
 epoch: 51, train_loss: 0.5217, test_loss: 0.9529, test_f1: 0.6265
 epoch: 52, train_loss: 0.5062, test_loss: 0.9845, test_f1: 0.6263
 epoch: 53, train_loss: 0.5086, test_loss: 0.9877, test_f1: 0.6016
 epoch: 54, train_loss: 0.5122, test_loss: 0.9366, test_f1: 0.6078
 epoch: 55, train_loss: 0.4977, test_loss: 0.9680, test_f1: 0.6092
 epoch: 56, train_loss: 0.5120, test_loss: 0.9188, test_f1: 0.6084
 epoch: 57, train_loss: 0.4865, test_loss: 0.9850, test_f1: 0.5973
 epoch: 58, train_loss: 0.4867, test_loss: 1.0018, test_f1: 0.5964
 epoch: 59, train_loss: 0.5009, test_loss: 1.0083, test_f1: 0.6056
 epoch: 60, train_loss: 0.4906, test_loss: 0.9978, test_f1: 0.6139
 epoch: 61, train_loss: 0.4860, test_loss: 0.9961, test_f1: 0.6108
 epoch: 62, train_loss: 0.4793, test_loss: 0.9714, test_f1: 0.6169
 epoch: 63, train_loss: 0.4793, test_loss: 0.9939, test_f1: 0.6139
 epoch: 64, train_loss: 0.4662, test_loss: 0.9770, test_f1: 0.6062
 epoch: 65, train_loss: 0.4691, test_loss: 0.9940, test_f1: 0.6175
 epoch: 66, train_loss: 0.4800, test_loss: 1.0285, test_f1: 0.6063
 epoch: 67, train_loss: 0.4754, test_loss: 1.0385, test_f1: 0.6146
 epoch: 68, train_loss: 0.4606, test_loss: 1.0555, test_f1: 0.6344
 epoch: 69, train_loss: 0.4590, test_loss: 1.0141, test_f1: 0.6053
 epoch: 70, train_loss: 0.4701, test_loss: 1.0186, test_f1: 0.6181
 epoch: 71, train_loss: 0.4617, test_loss: 1.0743, test_f1: 0.6017
 epoch: 72, train_loss: 0.4708, test_loss: 1.0564, test_f1: 0.6097
 epoch: 73, train_loss: 0.4582, test_loss: 1.0764, test_f1: 0.6247
 epoch: 74, train_loss: 0.4473, test_loss: 1.0447, test_f1: 0.6215
 epoch: 75, train_loss: 0.4574, test_loss: 1.0172, test_f1: 0.6319
 epoch: 76, train_loss: 0.4372, test_loss: 1.0789, test_f1: 0.6053
 epoch: 77, train_loss: 0.4537, test_loss: 1.0798, test_f1: 0.6259
 epoch: 78, train_loss: 0.4575, test_loss: 1.1041, test_f1: 0.6205
 epoch: 79, train_loss: 0.4454, test_loss: 1.1300, test_f1: 0.6123
 epoch: 80, train_loss: 0.4360, test_loss: 1.0796, test_f1: 0.6086
 epoch: 81, train_loss: 0.4372, test_loss: 1.1307, test_f1: 0.6135
 epoch: 82, train_loss: 0.4381, test_loss: 1.0774, test_f1: 0.6225
 epoch: 83, train_loss: 0.4264, test_loss: 1.1501, test_f1: 0.6196
 epoch: 84, train_loss: 0.4300, test_loss: 1.1458, test_f1: 0.6091
 epoch: 85, train_loss: 0.4328, test_loss: 1.1074, test_f1: 0.6214
 epoch: 86, train_loss: 0.4277, test_loss: 1.1359, test_f1: 0.6269
 epoch: 87, train_loss: 0.4155, test_loss: 1.2275, test_f1: 0.6026
 epoch: 88, train_loss: 0.4093, test_loss: 1.1811, test_f1: 0.6074
 epoch: 89, train_loss: 0.4139, test_loss: 1.1484, test_f1: 0.6225
 epoch: 90, train_loss: 0.4238, test_loss: 1.2073, test_f1: 0.6165
 epoch: 91, train_loss: 0.4238, test_loss: 1.1309, test_f1: 0.6270
 epoch: 92, train_loss: 0.4124, test_loss: 1.1657, test_f1: 0.6346
 epoch: 93, train_loss: 0.4137, test_loss: 1.1416, test_f1: 0.6190
 epoch: 94, train_loss: 0.4117, test_loss: 1.1350, test_f1: 0.6150
 epoch: 95, train_loss: 0.3959, test_loss: 1.1615, test_f1: 0.6341
 epoch: 96, train_loss: 0.3924, test_loss: 1.1605, test_f1: 0.6328
 epoch: 97, train_loss: 0.3945, test_loss: 1.1547, test_f1: 0.6349
 epoch: 98, train_loss: 0.4011, test_loss: 1.2057, test_f1: 0.6269
 epoch: 99, train_loss: 0.4175, test_loss: 1.1727, test_f1: 0.6285
##################ITERATION #1 ****************************************
 epoch: 0, train_loss: 1.2650, test_loss: 1.1870, test_f1: 0.3395
 epoch: 1, train_loss: 1.1289, test_loss: 1.0689, test_f1: 0.4058
 epoch: 2, train_loss: 1.0640, test_loss: 1.0520, test_f1: 0.4513
 epoch: 3, train_loss: 1.0234, test_loss: 1.0383, test_f1: 0.4580
 epoch: 4, train_loss: 0.9908, test_loss: 1.0229, test_f1: 0.4936
 epoch: 5, train_loss: 0.9722, test_loss: 1.0094, test_f1: 0.5172
 epoch: 6, train_loss: 0.9486, test_loss: 1.0266, test_f1: 0.4876
 epoch: 7, train_loss: 0.9305, test_loss: 0.9834, test_f1: 0.5110
 epoch: 8, train_loss: 0.9128, test_loss: 0.9655, test_f1: 0.5163
 epoch: 9, train_loss: 0.8937, test_loss: 0.9587, test_f1: 0.5148
 epoch: 10, train_loss: 0.8664, test_loss: 0.9478, test_f1: 0.5160
 epoch: 11, train_loss: 0.8528, test_loss: 0.9233, test_f1: 0.5111
 epoch: 12, train_loss: 0.8360, test_loss: 0.9366, test_f1: 0.5476
 epoch: 13, train_loss: 0.8188, test_loss: 0.9160, test_f1: 0.5356
 epoch: 14, train_loss: 0.7992, test_loss: 0.8938, test_f1: 0.5449
 epoch: 15, train_loss: 0.7875, test_loss: 0.9196, test_f1: 0.5438
 epoch: 16, train_loss: 0.7673, test_loss: 0.9351, test_f1: 0.5510
 epoch: 17, train_loss: 0.7636, test_loss: 0.9793, test_f1: 0.5354
 epoch: 18, train_loss: 0.7504, test_loss: 0.8751, test_f1: 0.5665
 epoch: 19, train_loss: 0.7309, test_loss: 0.9096, test_f1: 0.5696
 epoch: 20, train_loss: 0.7207, test_loss: 0.9287, test_f1: 0.5566
 epoch: 21, train_loss: 0.7141, test_loss: 0.9322, test_f1: 0.5539
 epoch: 22, train_loss: 0.7113, test_loss: 0.8906, test_f1: 0.5647
 epoch: 23, train_loss: 0.7032, test_loss: 0.9889, test_f1: 0.5650
 epoch: 24, train_loss: 0.6827, test_loss: 0.9084, test_f1: 0.5847
 epoch: 25, train_loss: 0.6701, test_loss: 0.9255, test_f1: 0.5669
 epoch: 26, train_loss: 0.6636, test_loss: 0.8963, test_f1: 0.5623
 epoch: 27, train_loss: 0.6606, test_loss: 0.8975, test_f1: 0.6167
 epoch: 28, train_loss: 0.6527, test_loss: 0.9467, test_f1: 0.5675
 epoch: 29, train_loss: 0.6354, test_loss: 0.8671, test_f1: 0.5916
 epoch: 30, train_loss: 0.6277, test_loss: 0.9489, test_f1: 0.5857
 epoch: 31, train_loss: 0.6252, test_loss: 0.9145, test_f1: 0.5770
 epoch: 32, train_loss: 0.6210, test_loss: 0.8990, test_f1: 0.6185
 epoch: 33, train_loss: 0.6050, test_loss: 0.9165, test_f1: 0.6329
 epoch: 34, train_loss: 0.5906, test_loss: 0.8999, test_f1: 0.6042
 epoch: 35, train_loss: 0.5855, test_loss: 0.9879, test_f1: 0.5882
 epoch: 36, train_loss: 0.6059, test_loss: 0.8320, test_f1: 0.6251
 epoch: 37, train_loss: 0.5910, test_loss: 0.9078, test_f1: 0.6087
 epoch: 38, train_loss: 0.5729, test_loss: 0.9861, test_f1: 0.6059
 epoch: 39, train_loss: 0.5706, test_loss: 1.0802, test_f1: 0.5867
 epoch: 40, train_loss: 0.5719, test_loss: 0.9667, test_f1: 0.6166
 epoch: 41, train_loss: 0.5608, test_loss: 1.0057, test_f1: 0.5918
 epoch: 42, train_loss: 0.5562, test_loss: 0.9519, test_f1: 0.6213
 epoch: 43, train_loss: 0.5355, test_loss: 0.9451, test_f1: 0.6196
 epoch: 44, train_loss: 0.5396, test_loss: 0.9714, test_f1: 0.6052
 epoch: 45, train_loss: 0.5435, test_loss: 1.0278, test_f1: 0.6204
 epoch: 46, train_loss: 0.5292, test_loss: 1.0235, test_f1: 0.6117
 epoch: 47, train_loss: 0.5160, test_loss: 0.9940, test_f1: 0.6239
 epoch: 48, train_loss: 0.5240, test_loss: 1.0294, test_f1: 0.6068
 epoch: 49, train_loss: 0.5190, test_loss: 0.9761, test_f1: 0.6011
 epoch: 50, train_loss: 0.5087, test_loss: 0.9551, test_f1: 0.6478
 epoch: 51, train_loss: 0.4859, test_loss: 1.0523, test_f1: 0.6319
 epoch: 52, train_loss: 0.4700, test_loss: 1.0361, test_f1: 0.6130
 epoch: 53, train_loss: 0.4613, test_loss: 1.0481, test_f1: 0.6215
 epoch: 54, train_loss: 0.4675, test_loss: 1.0386, test_f1: 0.6228
 epoch: 55, train_loss: 0.4634, test_loss: 1.0343, test_f1: 0.6253
 epoch: 56, train_loss: 0.4646, test_loss: 1.0649, test_f1: 0.6226
 epoch: 57, train_loss: 0.4636, test_loss: 1.0445, test_f1: 0.6277
 epoch: 58, train_loss: 0.4482, test_loss: 1.1414, test_f1: 0.6311
 epoch: 59, train_loss: 0.4577, test_loss: 1.0879, test_f1: 0.6196
 epoch: 60, train_loss: 0.4526, test_loss: 1.0997, test_f1: 0.6347
 epoch: 61, train_loss: 0.4482, test_loss: 1.0764, test_f1: 0.6128
 epoch: 62, train_loss: 0.4484, test_loss: 1.0767, test_f1: 0.6369
 epoch: 63, train_loss: 0.4419, test_loss: 1.1244, test_f1: 0.6176
 epoch: 64, train_loss: 0.4346, test_loss: 1.0564, test_f1: 0.6197
 epoch: 65, train_loss: 0.4325, test_loss: 1.1314, test_f1: 0.6141
 epoch: 66, train_loss: 0.4072, test_loss: 1.1035, test_f1: 0.6146
 epoch: 67, train_loss: 0.4232, test_loss: 1.1444, test_f1: 0.6323
 epoch: 68, train_loss: 0.4319, test_loss: 1.1172, test_f1: 0.6245
 epoch: 69, train_loss: 0.4297, test_loss: 1.1037, test_f1: 0.6400
 epoch: 70, train_loss: 0.4170, test_loss: 1.1314, test_f1: 0.6301
 epoch: 71, train_loss: 0.4159, test_loss: 1.1506, test_f1: 0.6203
 epoch: 72, train_loss: 0.4018, test_loss: 1.0984, test_f1: 0.6300
 epoch: 73, train_loss: 0.4102, test_loss: 1.2096, test_f1: 0.6195
 epoch: 74, train_loss: 0.3966, test_loss: 1.1798, test_f1: 0.6239
 epoch: 75, train_loss: 0.4034, test_loss: 1.1771, test_f1: 0.6220
 epoch: 76, train_loss: 0.4018, test_loss: 1.1273, test_f1: 0.6292
 epoch: 77, train_loss: 0.4038, test_loss: 1.1879, test_f1: 0.6319
 epoch: 78, train_loss: 0.3969, test_loss: 1.1949, test_f1: 0.6268
 epoch: 79, train_loss: 0.3973, test_loss: 1.2469, test_f1: 0.6288
 epoch: 80, train_loss: 0.3900, test_loss: 1.2077, test_f1: 0.6527
 epoch: 81, train_loss: 0.3953, test_loss: 1.2031, test_f1: 0.6385
 epoch: 82, train_loss: 0.3909, test_loss: 1.2392, test_f1: 0.6506
 epoch: 83, train_loss: 0.3971, test_loss: 1.2237, test_f1: 0.6437
 epoch: 84, train_loss: 0.3821, test_loss: 1.1972, test_f1: 0.6533
 epoch: 85, train_loss: 0.3816, test_loss: 1.2404, test_f1: 0.6346
 epoch: 86, train_loss: 0.3743, test_loss: 1.2873, test_f1: 0.6470
 epoch: 87, train_loss: 0.3759, test_loss: 1.2461, test_f1: 0.6386
 epoch: 88, train_loss: 0.3830, test_loss: 1.3099, test_f1: 0.6261
 epoch: 89, train_loss: 0.3658, test_loss: 1.2943, test_f1: 0.6342
 epoch: 90, train_loss: 0.3577, test_loss: 1.2797, test_f1: 0.6318
 epoch: 91, train_loss: 0.3607, test_loss: 1.3049, test_f1: 0.6444
 epoch: 92, train_loss: 0.3778, test_loss: 1.2619, test_f1: 0.6462
 epoch: 93, train_loss: 0.3710, test_loss: 1.3201, test_f1: 0.6463
 epoch: 94, train_loss: 0.3617, test_loss: 1.3306, test_f1: 0.6462
 epoch: 95, train_loss: 0.3610, test_loss: 1.3941, test_f1: 0.6416
 epoch: 96, train_loss: 0.3662, test_loss: 1.3661, test_f1: 0.6237
 epoch: 97, train_loss: 0.3411, test_loss: 1.2865, test_f1: 0.6535
 epoch: 98, train_loss: 0.3477, test_loss: 1.3710, test_f1: 0.6418
 epoch: 99, train_loss: 0.3371, test_loss: 1.3117, test_f1: 0.6584
##################ITERATION #2 ****************************************
 epoch: 0, train_loss: 1.2135, test_loss: 1.2496, test_f1: 0.3172
 epoch: 1, train_loss: 1.0721, test_loss: 1.0674, test_f1: 0.4530
 epoch: 2, train_loss: 1.0214, test_loss: 1.0345, test_f1: 0.5040
 epoch: 3, train_loss: 0.9845, test_loss: 1.0045, test_f1: 0.5085
 epoch: 4, train_loss: 0.9627, test_loss: 0.9959, test_f1: 0.5050
 epoch: 5, train_loss: 0.9278, test_loss: 0.9682, test_f1: 0.5052
 epoch: 6, train_loss: 0.9112, test_loss: 0.9440, test_f1: 0.5258
 epoch: 7, train_loss: 0.8817, test_loss: 0.9288, test_f1: 0.5398
 epoch: 8, train_loss: 0.8625, test_loss: 0.9601, test_f1: 0.5216
 epoch: 9, train_loss: 0.8510, test_loss: 0.9235, test_f1: 0.5486
 epoch: 10, train_loss: 0.8340, test_loss: 0.9119, test_f1: 0.5778
 epoch: 11, train_loss: 0.8130, test_loss: 0.9291, test_f1: 0.5590
 epoch: 12, train_loss: 0.7983, test_loss: 0.9417, test_f1: 0.5678
 epoch: 13, train_loss: 0.7803, test_loss: 0.9163, test_f1: 0.5522
 epoch: 14, train_loss: 0.7736, test_loss: 0.9018, test_f1: 0.5757
 epoch: 15, train_loss: 0.7768, test_loss: 0.8903, test_f1: 0.5805
 epoch: 16, train_loss: 0.7546, test_loss: 0.9269, test_f1: 0.5726
 epoch: 17, train_loss: 0.7410, test_loss: 0.9298, test_f1: 0.5523
 epoch: 18, train_loss: 0.7310, test_loss: 0.9091, test_f1: 0.5929
 epoch: 19, train_loss: 0.7107, test_loss: 0.9012, test_f1: 0.5977
 epoch: 20, train_loss: 0.7117, test_loss: 0.9464, test_f1: 0.5915
 epoch: 21, train_loss: 0.6953, test_loss: 0.9276, test_f1: 0.5986
 epoch: 22, train_loss: 0.6728, test_loss: 0.9373, test_f1: 0.5871
 epoch: 23, train_loss: 0.6762, test_loss: 0.9134, test_f1: 0.6062
 epoch: 24, train_loss: 0.6732, test_loss: 0.8926, test_f1: 0.6054
 epoch: 25, train_loss: 0.6582, test_loss: 0.8864, test_f1: 0.6199
 epoch: 26, train_loss: 0.6605, test_loss: 0.9530, test_f1: 0.5739
 epoch: 27, train_loss: 0.6501, test_loss: 1.0073, test_f1: 0.5529
 epoch: 28, train_loss: 0.6345, test_loss: 0.9431, test_f1: 0.5872
 epoch: 29, train_loss: 0.6334, test_loss: 0.9475, test_f1: 0.6056
 epoch: 30, train_loss: 0.6200, test_loss: 1.0084, test_f1: 0.5884
 epoch: 31, train_loss: 0.6167, test_loss: 1.0162, test_f1: 0.5874
 epoch: 32, train_loss: 0.6025, test_loss: 0.9600, test_f1: 0.5751
 epoch: 33, train_loss: 0.6092, test_loss: 0.9496, test_f1: 0.5948
 epoch: 34, train_loss: 0.5875, test_loss: 0.9462, test_f1: 0.6059
 epoch: 35, train_loss: 0.5897, test_loss: 0.9772, test_f1: 0.5922
 epoch: 36, train_loss: 0.5769, test_loss: 0.9805, test_f1: 0.6028
 epoch: 37, train_loss: 0.5689, test_loss: 0.9911, test_f1: 0.6221
 epoch: 38, train_loss: 0.5598, test_loss: 0.9827, test_f1: 0.6051
 epoch: 39, train_loss: 0.5607, test_loss: 0.9928, test_f1: 0.6111
 epoch: 40, train_loss: 0.5584, test_loss: 0.9893, test_f1: 0.5843
 epoch: 41, train_loss: 0.5419, test_loss: 1.0092, test_f1: 0.5952
 epoch: 42, train_loss: 0.5360, test_loss: 1.0362, test_f1: 0.5684
 epoch: 43, train_loss: 0.5350, test_loss: 0.9802, test_f1: 0.6209
 epoch: 44, train_loss: 0.5424, test_loss: 0.9789, test_f1: 0.6157
 epoch: 45, train_loss: 0.5142, test_loss: 1.0161, test_f1: 0.6281
 epoch: 46, train_loss: 0.5129, test_loss: 1.0150, test_f1: 0.6313
 epoch: 47, train_loss: 0.5261, test_loss: 1.0148, test_f1: 0.6569
 epoch: 48, train_loss: 0.5047, test_loss: 1.0381, test_f1: 0.6270
 epoch: 49, train_loss: 0.4952, test_loss: 1.1011, test_f1: 0.6117
 epoch: 50, train_loss: 0.5045, test_loss: 1.1018, test_f1: 0.6124
 epoch: 51, train_loss: 0.4818, test_loss: 1.0278, test_f1: 0.6310
 epoch: 52, train_loss: 0.4633, test_loss: 1.0365, test_f1: 0.6385
 epoch: 53, train_loss: 0.4577, test_loss: 1.0266, test_f1: 0.6400
 epoch: 54, train_loss: 0.4649, test_loss: 1.0599, test_f1: 0.6371
 epoch: 55, train_loss: 0.4628, test_loss: 1.1034, test_f1: 0.6436
 epoch: 56, train_loss: 0.4484, test_loss: 1.1030, test_f1: 0.6320
 epoch: 57, train_loss: 0.4528, test_loss: 1.0199, test_f1: 0.6551
 epoch: 58, train_loss: 0.4485, test_loss: 1.0881, test_f1: 0.6471
 epoch: 59, train_loss: 0.4503, test_loss: 1.0966, test_f1: 0.6530
 epoch: 60, train_loss: 0.4425, test_loss: 1.1175, test_f1: 0.6357
 epoch: 61, train_loss: 0.4277, test_loss: 1.1825, test_f1: 0.6416
 epoch: 62, train_loss: 0.4358, test_loss: 1.1247, test_f1: 0.6364
 epoch: 63, train_loss: 0.4172, test_loss: 1.1327, test_f1: 0.6718
 epoch: 64, train_loss: 0.4226, test_loss: 1.1796, test_f1: 0.6580
 epoch: 65, train_loss: 0.4237, test_loss: 1.2036, test_f1: 0.6260
 epoch: 66, train_loss: 0.4175, test_loss: 1.1583, test_f1: 0.6395
 epoch: 67, train_loss: 0.4177, test_loss: 1.2139, test_f1: 0.6349
 epoch: 68, train_loss: 0.4247, test_loss: 1.2172, test_f1: 0.6402
 epoch: 69, train_loss: 0.4279, test_loss: 1.2886, test_f1: 0.6571
 epoch: 70, train_loss: 0.4146, test_loss: 1.2922, test_f1: 0.6429
 epoch: 71, train_loss: 0.4026, test_loss: 1.2898, test_f1: 0.6319
 epoch: 72, train_loss: 0.4067, test_loss: 1.2479, test_f1: 0.6457
 epoch: 73, train_loss: 0.3949, test_loss: 1.2457, test_f1: 0.6531
 epoch: 74, train_loss: 0.3948, test_loss: 1.2138, test_f1: 0.6544
 epoch: 75, train_loss: 0.3880, test_loss: 1.2054, test_f1: 0.6487
 epoch: 76, train_loss: 0.3920, test_loss: 1.2305, test_f1: 0.6315
 epoch: 77, train_loss: 0.3865, test_loss: 1.1999, test_f1: 0.6624
 epoch: 78, train_loss: 0.3954, test_loss: 1.2118, test_f1: 0.6495
 epoch: 79, train_loss: 0.3692, test_loss: 1.2311, test_f1: 0.6632
 epoch: 80, train_loss: 0.3845, test_loss: 1.1892, test_f1: 0.6467
 epoch: 81, train_loss: 0.3908, test_loss: 1.2151, test_f1: 0.6254
 epoch: 82, train_loss: 0.3714, test_loss: 1.2693, test_f1: 0.6258
 epoch: 83, train_loss: 0.3668, test_loss: 1.3363, test_f1: 0.6424
 epoch: 84, train_loss: 0.3753, test_loss: 1.2402, test_f1: 0.6626
 epoch: 85, train_loss: 0.3765, test_loss: 1.2867, test_f1: 0.6460
 epoch: 86, train_loss: 0.3696, test_loss: 1.3052, test_f1: 0.6421
 epoch: 87, train_loss: 0.3668, test_loss: 1.3467, test_f1: 0.6464
 epoch: 88, train_loss: 0.3508, test_loss: 1.3145, test_f1: 0.6500
 epoch: 89, train_loss: 0.3579, test_loss: 1.3100, test_f1: 0.6576
 epoch: 90, train_loss: 0.3538, test_loss: 1.3954, test_f1: 0.6496
 epoch: 91, train_loss: 0.3652, test_loss: 1.3504, test_f1: 0.6353
 epoch: 92, train_loss: 0.3484, test_loss: 1.3173, test_f1: 0.6372
 epoch: 93, train_loss: 0.3542, test_loss: 1.3373, test_f1: 0.6478
 epoch: 94, train_loss: 0.3515, test_loss: 1.3825, test_f1: 0.6561
 epoch: 95, train_loss: 0.3568, test_loss: 1.3727, test_f1: 0.6582
 epoch: 96, train_loss: 0.3437, test_loss: 1.3480, test_f1: 0.6647
 epoch: 97, train_loss: 0.3414, test_loss: 1.4389, test_f1: 0.6373
 epoch: 98, train_loss: 0.3645, test_loss: 1.4470, test_f1: 0.6456
 epoch: 99, train_loss: 0.3446, test_loss: 1.3411, test_f1: 0.6452
##################ITERATION #3 ****************************************
 epoch: 0, train_loss: 1.2178, test_loss: 1.1823, test_f1: 0.3412
 epoch: 1, train_loss: 1.0894, test_loss: 1.0299, test_f1: 0.5247
 epoch: 2, train_loss: 1.0389, test_loss: 1.0098, test_f1: 0.5010
 epoch: 3, train_loss: 0.9992, test_loss: 0.9822, test_f1: 0.5033
 epoch: 4, train_loss: 0.9735, test_loss: 0.9687, test_f1: 0.5232
 epoch: 5, train_loss: 0.9492, test_loss: 0.9649, test_f1: 0.5308
 epoch: 6, train_loss: 0.9227, test_loss: 0.9640, test_f1: 0.5388
 epoch: 7, train_loss: 0.9104, test_loss: 0.9571, test_f1: 0.5259
 epoch: 8, train_loss: 0.8964, test_loss: 0.9340, test_f1: 0.5499
 epoch: 9, train_loss: 0.8715, test_loss: 0.9339, test_f1: 0.5279
 epoch: 10, train_loss: 0.8592, test_loss: 0.9113, test_f1: 0.5506
 epoch: 11, train_loss: 0.8568, test_loss: 0.9304, test_f1: 0.5578
 epoch: 12, train_loss: 0.8289, test_loss: 0.9177, test_f1: 0.5465
 epoch: 13, train_loss: 0.8122, test_loss: 0.9345, test_f1: 0.5529
 epoch: 14, train_loss: 0.7976, test_loss: 0.9206, test_f1: 0.5742
 epoch: 15, train_loss: 0.7930, test_loss: 0.9241, test_f1: 0.5679
 epoch: 16, train_loss: 0.7822, test_loss: 0.9220, test_f1: 0.5849
 epoch: 17, train_loss: 0.7591, test_loss: 0.9105, test_f1: 0.5856
 epoch: 18, train_loss: 0.7587, test_loss: 0.9184, test_f1: 0.5709
 epoch: 19, train_loss: 0.7307, test_loss: 0.9422, test_f1: 0.5871
 epoch: 20, train_loss: 0.7218, test_loss: 0.9492, test_f1: 0.5924
 epoch: 21, train_loss: 0.7249, test_loss: 0.9117, test_f1: 0.5903
 epoch: 22, train_loss: 0.7071, test_loss: 0.9436, test_f1: 0.5688
 epoch: 23, train_loss: 0.7089, test_loss: 0.9701, test_f1: 0.5773
 epoch: 24, train_loss: 0.6970, test_loss: 0.9276, test_f1: 0.5913
 epoch: 25, train_loss: 0.6762, test_loss: 0.9051, test_f1: 0.5746
 epoch: 26, train_loss: 0.6751, test_loss: 0.9114, test_f1: 0.5927
 epoch: 27, train_loss: 0.6570, test_loss: 0.9719, test_f1: 0.5855
 epoch: 28, train_loss: 0.6571, test_loss: 0.9327, test_f1: 0.6042
 epoch: 29, train_loss: 0.6442, test_loss: 0.9131, test_f1: 0.6224
 epoch: 30, train_loss: 0.6300, test_loss: 0.9321, test_f1: 0.6035
 epoch: 31, train_loss: 0.6410, test_loss: 0.9078, test_f1: 0.6089
 epoch: 32, train_loss: 0.6208, test_loss: 0.8627, test_f1: 0.6207
 epoch: 33, train_loss: 0.6143, test_loss: 0.9209, test_f1: 0.6247
 epoch: 34, train_loss: 0.5996, test_loss: 0.9004, test_f1: 0.6239
 epoch: 35, train_loss: 0.6023, test_loss: 0.9624, test_f1: 0.6100
 epoch: 36, train_loss: 0.6012, test_loss: 0.9437, test_f1: 0.6059
 epoch: 37, train_loss: 0.5875, test_loss: 0.9556, test_f1: 0.6062
 epoch: 38, train_loss: 0.5921, test_loss: 0.9460, test_f1: 0.6119
 epoch: 39, train_loss: 0.5907, test_loss: 0.9482, test_f1: 0.6007
 epoch: 40, train_loss: 0.5592, test_loss: 0.9754, test_f1: 0.6089
 epoch: 41, train_loss: 0.5646, test_loss: 0.8972, test_f1: 0.6203
 epoch: 42, train_loss: 0.5566, test_loss: 0.9619, test_f1: 0.6060
 epoch: 43, train_loss: 0.5372, test_loss: 1.0593, test_f1: 0.5975
 epoch: 44, train_loss: 0.5342, test_loss: 0.9835, test_f1: 0.5950
 epoch: 45, train_loss: 0.5255, test_loss: 0.9978, test_f1: 0.6088
 epoch: 46, train_loss: 0.5394, test_loss: 0.9807, test_f1: 0.6246
 epoch: 47, train_loss: 0.5296, test_loss: 1.0282, test_f1: 0.6109
 epoch: 48, train_loss: 0.5226, test_loss: 0.9834, test_f1: 0.5990
 epoch: 49, train_loss: 0.4988, test_loss: 1.0419, test_f1: 0.6135
 epoch: 50, train_loss: 0.5248, test_loss: 0.9502, test_f1: 0.6176
 epoch: 51, train_loss: 0.4726, test_loss: 0.9890, test_f1: 0.6048
 epoch: 52, train_loss: 0.4834, test_loss: 1.0024, test_f1: 0.6113
 epoch: 53, train_loss: 0.4694, test_loss: 1.0134, test_f1: 0.6275
 epoch: 54, train_loss: 0.4637, test_loss: 1.0312, test_f1: 0.6099
 epoch: 55, train_loss: 0.4589, test_loss: 1.0578, test_f1: 0.6192
 epoch: 56, train_loss: 0.4522, test_loss: 1.0438, test_f1: 0.6106
 epoch: 57, train_loss: 0.4588, test_loss: 0.9606, test_f1: 0.6365
 epoch: 58, train_loss: 0.4503, test_loss: 1.0699, test_f1: 0.6281
 epoch: 59, train_loss: 0.4450, test_loss: 1.0625, test_f1: 0.6433
 epoch: 60, train_loss: 0.4350, test_loss: 1.0236, test_f1: 0.6457
 epoch: 61, train_loss: 0.4367, test_loss: 1.0398, test_f1: 0.6209
 epoch: 62, train_loss: 0.4232, test_loss: 1.0710, test_f1: 0.6231
 epoch: 63, train_loss: 0.4316, test_loss: 1.0383, test_f1: 0.6365
 epoch: 64, train_loss: 0.4231, test_loss: 1.0332, test_f1: 0.6310
 epoch: 65, train_loss: 0.4177, test_loss: 1.0752, test_f1: 0.6211
 epoch: 66, train_loss: 0.4098, test_loss: 1.0285, test_f1: 0.6663
 epoch: 67, train_loss: 0.4183, test_loss: 1.0782, test_f1: 0.6337
 epoch: 68, train_loss: 0.4125, test_loss: 1.0817, test_f1: 0.6300
 epoch: 69, train_loss: 0.4219, test_loss: 1.1653, test_f1: 0.6083
 epoch: 70, train_loss: 0.4120, test_loss: 1.0467, test_f1: 0.6413
 epoch: 71, train_loss: 0.3998, test_loss: 1.1129, test_f1: 0.6305
 epoch: 72, train_loss: 0.4019, test_loss: 1.0379, test_f1: 0.6407
 epoch: 73, train_loss: 0.3916, test_loss: 1.0945, test_f1: 0.6266
 epoch: 74, train_loss: 0.4001, test_loss: 1.1069, test_f1: 0.6611
 epoch: 75, train_loss: 0.4030, test_loss: 1.1679, test_f1: 0.6348
 epoch: 76, train_loss: 0.3866, test_loss: 1.1459, test_f1: 0.6192
 epoch: 77, train_loss: 0.3952, test_loss: 1.1413, test_f1: 0.6299
 epoch: 78, train_loss: 0.3914, test_loss: 1.0998, test_f1: 0.6381
 epoch: 79, train_loss: 0.3828, test_loss: 1.1342, test_f1: 0.6303
 epoch: 80, train_loss: 0.3823, test_loss: 1.1741, test_f1: 0.6315
 epoch: 81, train_loss: 0.3891, test_loss: 1.1383, test_f1: 0.6330
 epoch: 82, train_loss: 0.3764, test_loss: 1.1242, test_f1: 0.6543
 epoch: 83, train_loss: 0.3844, test_loss: 1.1556, test_f1: 0.6346
 epoch: 84, train_loss: 0.3610, test_loss: 1.2257, test_f1: 0.6130
 epoch: 85, train_loss: 0.3619, test_loss: 1.1560, test_f1: 0.6369
 epoch: 86, train_loss: 0.3634, test_loss: 1.1713, test_f1: 0.6215
 epoch: 87, train_loss: 0.3520, test_loss: 1.1437, test_f1: 0.6326
 epoch: 88, train_loss: 0.3615, test_loss: 1.1028, test_f1: 0.6265
 epoch: 89, train_loss: 0.3519, test_loss: 1.1629, test_f1: 0.6183
 epoch: 90, train_loss: 0.3337, test_loss: 1.2404, test_f1: 0.6247
 epoch: 91, train_loss: 0.3340, test_loss: 1.2180, test_f1: 0.6343
 epoch: 92, train_loss: 0.3486, test_loss: 1.1554, test_f1: 0.6419
 epoch: 93, train_loss: 0.3555, test_loss: 1.2215, test_f1: 0.6267
 epoch: 94, train_loss: 0.3572, test_loss: 1.2279, test_f1: 0.6504
 epoch: 95, train_loss: 0.3296, test_loss: 1.1349, test_f1: 0.6557
 epoch: 96, train_loss: 0.3426, test_loss: 1.1630, test_f1: 0.6438
 epoch: 97, train_loss: 0.3331, test_loss: 1.1813, test_f1: 0.6427
 epoch: 98, train_loss: 0.3319, test_loss: 1.2310, test_f1: 0.6248
 epoch: 99, train_loss: 0.3335, test_loss: 1.1302, test_f1: 0.6444
##################ITERATION #4 ****************************************
 epoch: 0, train_loss: 1.2004, test_loss: 1.1229, test_f1: 0.3785
 epoch: 1, train_loss: 1.0731, test_loss: 1.0320, test_f1: 0.4837
 epoch: 2, train_loss: 1.0348, test_loss: 1.0133, test_f1: 0.4961
 epoch: 3, train_loss: 0.9854, test_loss: 0.9953, test_f1: 0.4950
 epoch: 4, train_loss: 0.9716, test_loss: 0.9820, test_f1: 0.5082
 epoch: 5, train_loss: 0.9522, test_loss: 0.9912, test_f1: 0.5212
 epoch: 6, train_loss: 0.9293, test_loss: 0.9524, test_f1: 0.5124
 epoch: 7, train_loss: 0.9083, test_loss: 0.9597, test_f1: 0.5214
 epoch: 8, train_loss: 0.8877, test_loss: 0.9562, test_f1: 0.5460
 epoch: 9, train_loss: 0.8727, test_loss: 0.9367, test_f1: 0.5410
 epoch: 10, train_loss: 0.8614, test_loss: 0.9281, test_f1: 0.5617
 epoch: 11, train_loss: 0.8451, test_loss: 0.9313, test_f1: 0.5649
 epoch: 12, train_loss: 0.8439, test_loss: 0.9357, test_f1: 0.5565
 epoch: 13, train_loss: 0.8257, test_loss: 0.9167, test_f1: 0.5694
 epoch: 14, train_loss: 0.8146, test_loss: 0.8998, test_f1: 0.5838
 epoch: 15, train_loss: 0.7901, test_loss: 0.9294, test_f1: 0.5685
 epoch: 16, train_loss: 0.7913, test_loss: 0.9136, test_f1: 0.5940
 epoch: 17, train_loss: 0.7788, test_loss: 0.9145, test_f1: 0.5792
 epoch: 18, train_loss: 0.7739, test_loss: 0.9407, test_f1: 0.5750
 epoch: 19, train_loss: 0.7772, test_loss: 0.8736, test_f1: 0.5954
 epoch: 20, train_loss: 0.7471, test_loss: 0.9099, test_f1: 0.5591
 epoch: 21, train_loss: 0.7496, test_loss: 0.9008, test_f1: 0.5794
 epoch: 22, train_loss: 0.7272, test_loss: 0.8856, test_f1: 0.6002
 epoch: 23, train_loss: 0.7306, test_loss: 0.8666, test_f1: 0.5897
 epoch: 24, train_loss: 0.7204, test_loss: 0.8812, test_f1: 0.5968
 epoch: 25, train_loss: 0.7089, test_loss: 0.8592, test_f1: 0.5931
 epoch: 26, train_loss: 0.6974, test_loss: 0.8788, test_f1: 0.5945
 epoch: 27, train_loss: 0.6968, test_loss: 0.8616, test_f1: 0.6068
 epoch: 28, train_loss: 0.6854, test_loss: 0.8649, test_f1: 0.6057
 epoch: 29, train_loss: 0.6884, test_loss: 0.8831, test_f1: 0.6013
 epoch: 30, train_loss: 0.6919, test_loss: 0.8627, test_f1: 0.6114
 epoch: 31, train_loss: 0.6634, test_loss: 0.8554, test_f1: 0.6176
 epoch: 32, train_loss: 0.6460, test_loss: 0.8581, test_f1: 0.6100
 epoch: 33, train_loss: 0.6627, test_loss: 0.8238, test_f1: 0.6193
 epoch: 34, train_loss: 0.6481, test_loss: 0.8491, test_f1: 0.6153
 epoch: 35, train_loss: 0.6408, test_loss: 0.8528, test_f1: 0.6349
 epoch: 36, train_loss: 0.6379, test_loss: 0.8370, test_f1: 0.6294
 epoch: 37, train_loss: 0.6255, test_loss: 0.8540, test_f1: 0.6312
 epoch: 38, train_loss: 0.6140, test_loss: 0.8899, test_f1: 0.6317
 epoch: 39, train_loss: 0.6082, test_loss: 0.8496, test_f1: 0.6640
 epoch: 40, train_loss: 0.6083, test_loss: 0.8754, test_f1: 0.6324
 epoch: 41, train_loss: 0.5992, test_loss: 0.8704, test_f1: 0.6288
 epoch: 42, train_loss: 0.5846, test_loss: 0.8544, test_f1: 0.6416
 epoch: 43, train_loss: 0.5773, test_loss: 0.8637, test_f1: 0.6456
 epoch: 44, train_loss: 0.5975, test_loss: 0.9254, test_f1: 0.6355
 epoch: 45, train_loss: 0.5713, test_loss: 0.9358, test_f1: 0.6239
 epoch: 46, train_loss: 0.5677, test_loss: 0.8733, test_f1: 0.6476
 epoch: 47, train_loss: 0.5590, test_loss: 0.9248, test_f1: 0.6438
 epoch: 48, train_loss: 0.5554, test_loss: 0.8725, test_f1: 0.6569
 epoch: 49, train_loss: 0.5501, test_loss: 0.9061, test_f1: 0.6470
 epoch: 50, train_loss: 0.5486, test_loss: 0.9249, test_f1: 0.6373
 epoch: 51, train_loss: 0.5313, test_loss: 0.9120, test_f1: 0.6400
 epoch: 52, train_loss: 0.5163, test_loss: 0.9066, test_f1: 0.6646
 epoch: 53, train_loss: 0.5154, test_loss: 0.9320, test_f1: 0.6537
 epoch: 54, train_loss: 0.5022, test_loss: 0.9384, test_f1: 0.6307
 epoch: 55, train_loss: 0.5075, test_loss: 0.9503, test_f1: 0.6550
 epoch: 56, train_loss: 0.4999, test_loss: 0.9663, test_f1: 0.6428
 epoch: 57, train_loss: 0.4899, test_loss: 0.9190, test_f1: 0.6477
 epoch: 58, train_loss: 0.4960, test_loss: 0.8829, test_f1: 0.6594
 epoch: 59, train_loss: 0.4824, test_loss: 0.9426, test_f1: 0.6527
 epoch: 60, train_loss: 0.4728, test_loss: 0.9480, test_f1: 0.6366
 epoch: 61, train_loss: 0.4903, test_loss: 0.9689, test_f1: 0.6291
 epoch: 62, train_loss: 0.4815, test_loss: 0.9439, test_f1: 0.6474
 epoch: 63, train_loss: 0.4690, test_loss: 0.9467, test_f1: 0.6635
 epoch: 64, train_loss: 0.4697, test_loss: 0.9742, test_f1: 0.6422
 epoch: 65, train_loss: 0.4644, test_loss: 0.9483, test_f1: 0.6430
 epoch: 66, train_loss: 0.4590, test_loss: 0.9744, test_f1: 0.6554
 epoch: 67, train_loss: 0.4501, test_loss: 0.9403, test_f1: 0.6455
 epoch: 68, train_loss: 0.4525, test_loss: 0.9843, test_f1: 0.6536
 epoch: 69, train_loss: 0.4686, test_loss: 0.9785, test_f1: 0.6467
 epoch: 70, train_loss: 0.4476, test_loss: 1.0014, test_f1: 0.6298
 epoch: 71, train_loss: 0.4476, test_loss: 0.9641, test_f1: 0.6436
 epoch: 72, train_loss: 0.4367, test_loss: 0.9879, test_f1: 0.6536
 epoch: 73, train_loss: 0.4433, test_loss: 0.9832, test_f1: 0.6489
 epoch: 74, train_loss: 0.4296, test_loss: 0.9855, test_f1: 0.6472
 epoch: 75, train_loss: 0.4495, test_loss: 0.9817, test_f1: 0.6542
 epoch: 76, train_loss: 0.4405, test_loss: 0.9972, test_f1: 0.6479
 epoch: 77, train_loss: 0.4320, test_loss: 0.9694, test_f1: 0.6550
 epoch: 78, train_loss: 0.4316, test_loss: 0.9873, test_f1: 0.6550
 epoch: 79, train_loss: 0.4232, test_loss: 1.0234, test_f1: 0.6487
 epoch: 80, train_loss: 0.4198, test_loss: 0.9574, test_f1: 0.6553
 epoch: 81, train_loss: 0.4197, test_loss: 0.9785, test_f1: 0.6499
 epoch: 82, train_loss: 0.4223, test_loss: 0.9760, test_f1: 0.6670
 epoch: 83, train_loss: 0.4085, test_loss: 1.0337, test_f1: 0.6481
 epoch: 84, train_loss: 0.4184, test_loss: 1.0201, test_f1: 0.6547
 epoch: 85, train_loss: 0.4122, test_loss: 1.0250, test_f1: 0.6509
 epoch: 86, train_loss: 0.4016, test_loss: 1.0198, test_f1: 0.6622
 epoch: 87, train_loss: 0.4059, test_loss: 1.0833, test_f1: 0.6415
 epoch: 88, train_loss: 0.3949, test_loss: 1.1354, test_f1: 0.6420
 epoch: 89, train_loss: 0.3866, test_loss: 1.0664, test_f1: 0.6513
 epoch: 90, train_loss: 0.3995, test_loss: 1.0907, test_f1: 0.6490
 epoch: 91, train_loss: 0.3975, test_loss: 1.0845, test_f1: 0.6444
 epoch: 92, train_loss: 0.3913, test_loss: 1.0357, test_f1: 0.6623
 epoch: 93, train_loss: 0.3824, test_loss: 1.0445, test_f1: 0.6444
 epoch: 94, train_loss: 0.3796, test_loss: 1.1163, test_f1: 0.6362
 epoch: 95, train_loss: 0.3795, test_loss: 1.0939, test_f1: 0.6460
 epoch: 96, train_loss: 0.3854, test_loss: 1.0706, test_f1: 0.6592
 epoch: 97, train_loss: 0.3748, test_loss: 1.0765, test_f1: 0.6730
 epoch: 98, train_loss: 0.3787, test_loss: 1.1198, test_f1: 0.6525
 epoch: 99, train_loss: 0.3802, test_loss: 1.0809, test_f1: 0.6512
##################ITERATION #5 ****************************************
 epoch: 0, train_loss: 1.1839, test_loss: 1.0980, test_f1: 0.4368
 epoch: 1, train_loss: 1.0585, test_loss: 1.0224, test_f1: 0.5083
 epoch: 2, train_loss: 1.0181, test_loss: 0.9868, test_f1: 0.5043
 epoch: 3, train_loss: 0.9860, test_loss: 0.9898, test_f1: 0.5061
 epoch: 4, train_loss: 0.9552, test_loss: 0.9572, test_f1: 0.5376
 epoch: 5, train_loss: 0.9402, test_loss: 0.9597, test_f1: 0.5291
 epoch: 6, train_loss: 0.9248, test_loss: 0.9375, test_f1: 0.5499
 epoch: 7, train_loss: 0.8949, test_loss: 0.9441, test_f1: 0.5655
 epoch: 8, train_loss: 0.8835, test_loss: 0.9501, test_f1: 0.5434
 epoch: 9, train_loss: 0.8724, test_loss: 0.9369, test_f1: 0.5512
 epoch: 10, train_loss: 0.8541, test_loss: 0.9287, test_f1: 0.5708
 epoch: 11, train_loss: 0.8377, test_loss: 0.9125, test_f1: 0.5869
 epoch: 12, train_loss: 0.8224, test_loss: 0.9059, test_f1: 0.5869
 epoch: 13, train_loss: 0.8201, test_loss: 0.8912, test_f1: 0.5708
 epoch: 14, train_loss: 0.8025, test_loss: 0.9102, test_f1: 0.5850
 epoch: 15, train_loss: 0.7717, test_loss: 0.8973, test_f1: 0.5949
 epoch: 16, train_loss: 0.7709, test_loss: 0.9278, test_f1: 0.5889
 epoch: 17, train_loss: 0.7627, test_loss: 0.8852, test_f1: 0.6045
 epoch: 18, train_loss: 0.7615, test_loss: 0.8773, test_f1: 0.6037
 epoch: 19, train_loss: 0.7420, test_loss: 0.8861, test_f1: 0.6080
 epoch: 20, train_loss: 0.7274, test_loss: 0.8759, test_f1: 0.5992
 epoch: 21, train_loss: 0.7241, test_loss: 0.8887, test_f1: 0.5918
 epoch: 22, train_loss: 0.7255, test_loss: 0.8731, test_f1: 0.6329
 epoch: 23, train_loss: 0.7056, test_loss: 0.9065, test_f1: 0.6038
 epoch: 24, train_loss: 0.6992, test_loss: 0.9017, test_f1: 0.6191
 epoch: 25, train_loss: 0.6860, test_loss: 0.8773, test_f1: 0.6298
 epoch: 26, train_loss: 0.6739, test_loss: 0.8981, test_f1: 0.6185
 epoch: 27, train_loss: 0.6598, test_loss: 0.8839, test_f1: 0.6127
 epoch: 28, train_loss: 0.6483, test_loss: 0.8882, test_f1: 0.6406
 epoch: 29, train_loss: 0.6472, test_loss: 0.8915, test_f1: 0.5896
 epoch: 30, train_loss: 0.6372, test_loss: 0.8845, test_f1: 0.6038
 epoch: 31, train_loss: 0.6271, test_loss: 0.8673, test_f1: 0.6145
 epoch: 32, train_loss: 0.6112, test_loss: 0.8512, test_f1: 0.6289
 epoch: 33, train_loss: 0.6144, test_loss: 0.8675, test_f1: 0.6100
 epoch: 34, train_loss: 0.5998, test_loss: 0.9071, test_f1: 0.6273
 epoch: 35, train_loss: 0.6063, test_loss: 0.9164, test_f1: 0.6052
 epoch: 36, train_loss: 0.5889, test_loss: 0.8997, test_f1: 0.5917
 epoch: 37, train_loss: 0.5767, test_loss: 0.9257, test_f1: 0.6122
 epoch: 38, train_loss: 0.5755, test_loss: 0.9010, test_f1: 0.6110
 epoch: 39, train_loss: 0.5581, test_loss: 0.8833, test_f1: 0.6133
 epoch: 40, train_loss: 0.5688, test_loss: 0.8931, test_f1: 0.6022
 epoch: 41, train_loss: 0.5562, test_loss: 0.9188, test_f1: 0.6085
 epoch: 42, train_loss: 0.5404, test_loss: 0.8848, test_f1: 0.6513
 epoch: 43, train_loss: 0.5342, test_loss: 0.9054, test_f1: 0.6559
 epoch: 44, train_loss: 0.5346, test_loss: 0.8900, test_f1: 0.6411
 epoch: 45, train_loss: 0.5335, test_loss: 0.8995, test_f1: 0.6452
 epoch: 46, train_loss: 0.5167, test_loss: 0.9301, test_f1: 0.6414
 epoch: 47, train_loss: 0.5091, test_loss: 0.9475, test_f1: 0.6406
 epoch: 48, train_loss: 0.4893, test_loss: 0.8979, test_f1: 0.6422
 epoch: 49, train_loss: 0.4916, test_loss: 0.9314, test_f1: 0.6311
 epoch: 50, train_loss: 0.4747, test_loss: 0.9260, test_f1: 0.6353
 epoch: 51, train_loss: 0.4681, test_loss: 0.9118, test_f1: 0.6408
 epoch: 52, train_loss: 0.4562, test_loss: 0.9100, test_f1: 0.6496
 epoch: 53, train_loss: 0.4574, test_loss: 0.9807, test_f1: 0.6553
 epoch: 54, train_loss: 0.4516, test_loss: 0.9394, test_f1: 0.6601
 epoch: 55, train_loss: 0.4319, test_loss: 0.9364, test_f1: 0.6455
 epoch: 56, train_loss: 0.4322, test_loss: 0.9432, test_f1: 0.6388
 epoch: 57, train_loss: 0.4346, test_loss: 1.0329, test_f1: 0.6344
 epoch: 58, train_loss: 0.4279, test_loss: 0.9556, test_f1: 0.6524
 epoch: 59, train_loss: 0.4305, test_loss: 0.9824, test_f1: 0.6423
 epoch: 60, train_loss: 0.4203, test_loss: 0.9441, test_f1: 0.6500
 epoch: 61, train_loss: 0.4226, test_loss: 0.9879, test_f1: 0.6532
 epoch: 62, train_loss: 0.4108, test_loss: 0.9987, test_f1: 0.6568
 epoch: 63, train_loss: 0.4188, test_loss: 0.9484, test_f1: 0.6644
 epoch: 64, train_loss: 0.4038, test_loss: 0.9393, test_f1: 0.6709
 epoch: 65, train_loss: 0.3858, test_loss: 1.0391, test_f1: 0.6318
 epoch: 66, train_loss: 0.4027, test_loss: 1.0667, test_f1: 0.6328
 epoch: 67, train_loss: 0.3936, test_loss: 0.9690, test_f1: 0.6745
 epoch: 68, train_loss: 0.3952, test_loss: 0.9840, test_f1: 0.6558
 epoch: 69, train_loss: 0.3916, test_loss: 1.0333, test_f1: 0.6650
 epoch: 70, train_loss: 0.3717, test_loss: 1.0149, test_f1: 0.6534
 epoch: 71, train_loss: 0.3838, test_loss: 1.0247, test_f1: 0.6445
 epoch: 72, train_loss: 0.3813, test_loss: 1.0210, test_f1: 0.6540
 epoch: 73, train_loss: 0.3806, test_loss: 1.0269, test_f1: 0.6532
 epoch: 74, train_loss: 0.3675, test_loss: 1.0395, test_f1: 0.6414
 epoch: 75, train_loss: 0.3728, test_loss: 1.0606, test_f1: 0.6425
 epoch: 76, train_loss: 0.3754, test_loss: 1.0161, test_f1: 0.6481
 epoch: 77, train_loss: 0.3634, test_loss: 1.0398, test_f1: 0.6482
 epoch: 78, train_loss: 0.3750, test_loss: 1.0328, test_f1: 0.6355
 epoch: 79, train_loss: 0.3731, test_loss: 1.0881, test_f1: 0.6385
 epoch: 80, train_loss: 0.3656, test_loss: 1.0704, test_f1: 0.6317
 epoch: 81, train_loss: 0.3653, test_loss: 1.0313, test_f1: 0.6511
 epoch: 82, train_loss: 0.3448, test_loss: 1.0341, test_f1: 0.6623
 epoch: 83, train_loss: 0.3524, test_loss: 1.0924, test_f1: 0.6437
 epoch: 84, train_loss: 0.3503, test_loss: 1.0404, test_f1: 0.6552
 epoch: 85, train_loss: 0.3471, test_loss: 1.1251, test_f1: 0.6436
 epoch: 86, train_loss: 0.3404, test_loss: 1.0472, test_f1: 0.6518
 epoch: 87, train_loss: 0.3309, test_loss: 1.1309, test_f1: 0.6508
 epoch: 88, train_loss: 0.3479, test_loss: 1.1082, test_f1: 0.6666
 epoch: 89, train_loss: 0.3542, test_loss: 1.1542, test_f1: 0.6639
 epoch: 90, train_loss: 0.3401, test_loss: 1.1261, test_f1: 0.6421
 epoch: 91, train_loss: 0.3298, test_loss: 1.0814, test_f1: 0.6593
 epoch: 92, train_loss: 0.3251, test_loss: 1.0598, test_f1: 0.6528
 epoch: 93, train_loss: 0.3210, test_loss: 1.1502, test_f1: 0.6378
 epoch: 94, train_loss: 0.3306, test_loss: 1.1495, test_f1: 0.6415
 epoch: 95, train_loss: 0.3292, test_loss: 1.1655, test_f1: 0.6449
 epoch: 96, train_loss: 0.3225, test_loss: 1.1175, test_f1: 0.6525
 epoch: 97, train_loss: 0.3144, test_loss: 1.0891, test_f1: 0.6762
 epoch: 98, train_loss: 0.3099, test_loss: 1.0584, test_f1: 0.6773
 epoch: 99, train_loss: 0.3179, test_loss: 1.0627, test_f1: 0.6559
##################ITERATION #6 ****************************************
 epoch: 0, train_loss: 1.2027, test_loss: 1.1216, test_f1: 0.3479
 epoch: 1, train_loss: 1.0796, test_loss: 0.9844, test_f1: 0.4964
 epoch: 2, train_loss: 1.0342, test_loss: 0.9816, test_f1: 0.4858
 epoch: 3, train_loss: 1.0019, test_loss: 0.9606, test_f1: 0.5060
 epoch: 4, train_loss: 0.9910, test_loss: 0.9395, test_f1: 0.5254
 epoch: 5, train_loss: 0.9553, test_loss: 0.9152, test_f1: 0.5085
 epoch: 6, train_loss: 0.9474, test_loss: 0.9114, test_f1: 0.5142
 epoch: 7, train_loss: 0.9243, test_loss: 0.8816, test_f1: 0.5175
 epoch: 8, train_loss: 0.9074, test_loss: 0.9070, test_f1: 0.5504
 epoch: 9, train_loss: 0.8873, test_loss: 0.8703, test_f1: 0.5405
 epoch: 10, train_loss: 0.8855, test_loss: 0.8778, test_f1: 0.5402
 epoch: 11, train_loss: 0.8691, test_loss: 0.8943, test_f1: 0.5230
 epoch: 12, train_loss: 0.8472, test_loss: 0.8610, test_f1: 0.5432
 epoch: 13, train_loss: 0.8506, test_loss: 0.8563, test_f1: 0.5634
 epoch: 14, train_loss: 0.8300, test_loss: 0.8410, test_f1: 0.5612
 epoch: 15, train_loss: 0.8091, test_loss: 0.8469, test_f1: 0.5549
 epoch: 16, train_loss: 0.8159, test_loss: 0.8616, test_f1: 0.5672
 epoch: 17, train_loss: 0.7912, test_loss: 0.8662, test_f1: 0.5534
 epoch: 18, train_loss: 0.7775, test_loss: 0.8600, test_f1: 0.5528
 epoch: 19, train_loss: 0.7780, test_loss: 0.8859, test_f1: 0.5665
 epoch: 20, train_loss: 0.7602, test_loss: 0.8613, test_f1: 0.5837
 epoch: 21, train_loss: 0.7557, test_loss: 0.8971, test_f1: 0.5701
 epoch: 22, train_loss: 0.7699, test_loss: 0.8526, test_f1: 0.5780
 epoch: 23, train_loss: 0.7446, test_loss: 0.8465, test_f1: 0.5756
 epoch: 24, train_loss: 0.7247, test_loss: 0.8794, test_f1: 0.5768
 epoch: 25, train_loss: 0.7338, test_loss: 0.8842, test_f1: 0.5757
 epoch: 26, train_loss: 0.7153, test_loss: 0.8544, test_f1: 0.5833
 epoch: 27, train_loss: 0.6985, test_loss: 0.8877, test_f1: 0.5972
 epoch: 28, train_loss: 0.7155, test_loss: 0.8447, test_f1: 0.5959
 epoch: 29, train_loss: 0.6979, test_loss: 0.8545, test_f1: 0.5900
 epoch: 30, train_loss: 0.6865, test_loss: 0.8315, test_f1: 0.6006
 epoch: 31, train_loss: 0.6684, test_loss: 0.8807, test_f1: 0.5630
 epoch: 32, train_loss: 0.6726, test_loss: 0.8668, test_f1: 0.5971
 epoch: 33, train_loss: 0.6721, test_loss: 0.8351, test_f1: 0.6128
 epoch: 34, train_loss: 0.6624, test_loss: 0.8546, test_f1: 0.5749
 epoch: 35, train_loss: 0.6585, test_loss: 0.9088, test_f1: 0.5722
 epoch: 36, train_loss: 0.6596, test_loss: 0.8412, test_f1: 0.6131
 epoch: 37, train_loss: 0.6349, test_loss: 0.8265, test_f1: 0.6126
 epoch: 38, train_loss: 0.6250, test_loss: 0.8369, test_f1: 0.6228
 epoch: 39, train_loss: 0.6353, test_loss: 0.8594, test_f1: 0.6285
 epoch: 40, train_loss: 0.6236, test_loss: 0.9150, test_f1: 0.6072
 epoch: 41, train_loss: 0.6062, test_loss: 0.8535, test_f1: 0.6113
 epoch: 42, train_loss: 0.6110, test_loss: 0.9322, test_f1: 0.5960
 epoch: 43, train_loss: 0.5899, test_loss: 0.8584, test_f1: 0.6129
 epoch: 44, train_loss: 0.6053, test_loss: 0.8749, test_f1: 0.6393
 epoch: 45, train_loss: 0.5839, test_loss: 0.8858, test_f1: 0.5865
 epoch: 46, train_loss: 0.5971, test_loss: 0.8939, test_f1: 0.6161
 epoch: 47, train_loss: 0.5794, test_loss: 0.9116, test_f1: 0.6109
 epoch: 48, train_loss: 0.5624, test_loss: 0.8821, test_f1: 0.6164
 epoch: 49, train_loss: 0.5626, test_loss: 0.8169, test_f1: 0.6223
 epoch: 50, train_loss: 0.5601, test_loss: 0.8558, test_f1: 0.6267
 epoch: 51, train_loss: 0.5579, test_loss: 0.8963, test_f1: 0.6230
 epoch: 52, train_loss: 0.5313, test_loss: 0.8816, test_f1: 0.6391
 epoch: 53, train_loss: 0.5280, test_loss: 0.9043, test_f1: 0.6059
 epoch: 54, train_loss: 0.5002, test_loss: 0.9034, test_f1: 0.6123
 epoch: 55, train_loss: 0.5134, test_loss: 0.9161, test_f1: 0.6126
 epoch: 56, train_loss: 0.5099, test_loss: 0.9437, test_f1: 0.6097
 epoch: 57, train_loss: 0.5118, test_loss: 0.9352, test_f1: 0.6040
 epoch: 58, train_loss: 0.5087, test_loss: 0.9629, test_f1: 0.6073
 epoch: 59, train_loss: 0.4984, test_loss: 0.9489, test_f1: 0.6124
 epoch: 60, train_loss: 0.4942, test_loss: 0.9010, test_f1: 0.6250
 epoch: 61, train_loss: 0.4889, test_loss: 0.9111, test_f1: 0.6202
 epoch: 62, train_loss: 0.4890, test_loss: 0.9220, test_f1: 0.6290
 epoch: 63, train_loss: 0.4806, test_loss: 0.8855, test_f1: 0.6443
 epoch: 64, train_loss: 0.4716, test_loss: 0.9191, test_f1: 0.6496
 epoch: 65, train_loss: 0.4779, test_loss: 0.9484, test_f1: 0.6233
 epoch: 66, train_loss: 0.4604, test_loss: 0.8942, test_f1: 0.6518
 epoch: 67, train_loss: 0.4660, test_loss: 0.8819, test_f1: 0.6237
 epoch: 68, train_loss: 0.4723, test_loss: 0.8930, test_f1: 0.6470
 epoch: 69, train_loss: 0.4557, test_loss: 0.9496, test_f1: 0.6227
 epoch: 70, train_loss: 0.4567, test_loss: 0.9753, test_f1: 0.6344
 epoch: 71, train_loss: 0.4736, test_loss: 0.9667, test_f1: 0.6328
 epoch: 72, train_loss: 0.4505, test_loss: 0.9443, test_f1: 0.6218
 epoch: 73, train_loss: 0.4480, test_loss: 0.9563, test_f1: 0.6259
 epoch: 74, train_loss: 0.4456, test_loss: 0.9221, test_f1: 0.6366
 epoch: 75, train_loss: 0.4455, test_loss: 1.0629, test_f1: 0.6168
 epoch: 76, train_loss: 0.4526, test_loss: 1.0179, test_f1: 0.6234
 epoch: 77, train_loss: 0.4485, test_loss: 0.9533, test_f1: 0.6269
 epoch: 78, train_loss: 0.4360, test_loss: 1.0644, test_f1: 0.6349
 epoch: 79, train_loss: 0.4333, test_loss: 0.9898, test_f1: 0.6470
 epoch: 80, train_loss: 0.4073, test_loss: 0.9808, test_f1: 0.6339
 epoch: 81, train_loss: 0.4273, test_loss: 1.0058, test_f1: 0.6349
 epoch: 82, train_loss: 0.4272, test_loss: 0.9987, test_f1: 0.6389
 epoch: 83, train_loss: 0.4239, test_loss: 1.0142, test_f1: 0.6415
 epoch: 84, train_loss: 0.4258, test_loss: 1.0332, test_f1: 0.6491
 epoch: 85, train_loss: 0.4243, test_loss: 1.0492, test_f1: 0.6238
 epoch: 86, train_loss: 0.4182, test_loss: 1.0045, test_f1: 0.6522
 epoch: 87, train_loss: 0.4067, test_loss: 1.0410, test_f1: 0.6441
 epoch: 88, train_loss: 0.4209, test_loss: 1.0606, test_f1: 0.6348
 epoch: 89, train_loss: 0.4068, test_loss: 1.0311, test_f1: 0.6358
 epoch: 90, train_loss: 0.4070, test_loss: 0.9462, test_f1: 0.6467
 epoch: 91, train_loss: 0.4166, test_loss: 0.9938, test_f1: 0.6616
 epoch: 92, train_loss: 0.3839, test_loss: 1.0823, test_f1: 0.6323
 epoch: 93, train_loss: 0.3956, test_loss: 1.0155, test_f1: 0.6545
 epoch: 94, train_loss: 0.4049, test_loss: 1.1249, test_f1: 0.6346
 epoch: 95, train_loss: 0.4152, test_loss: 1.1453, test_f1: 0.6457
 epoch: 96, train_loss: 0.3993, test_loss: 1.1117, test_f1: 0.6297
 epoch: 97, train_loss: 0.3719, test_loss: 1.0737, test_f1: 0.6524
 epoch: 98, train_loss: 0.3811, test_loss: 1.1340, test_f1: 0.6296
 epoch: 99, train_loss: 0.3832, test_loss: 1.1333, test_f1: 0.6386
##################ITERATION #7 ****************************************
 epoch: 0, train_loss: 1.2076, test_loss: 1.1106, test_f1: 0.4583
 epoch: 1, train_loss: 1.0548, test_loss: 0.9963, test_f1: 0.4736
 epoch: 2, train_loss: 1.0310, test_loss: 0.9706, test_f1: 0.4653
 epoch: 3, train_loss: 0.9953, test_loss: 0.9789, test_f1: 0.4949
 epoch: 4, train_loss: 0.9736, test_loss: 0.9849, test_f1: 0.5035
 epoch: 5, train_loss: 0.9692, test_loss: 0.9737, test_f1: 0.5162
 epoch: 6, train_loss: 0.9378, test_loss: 0.9620, test_f1: 0.5302
 epoch: 7, train_loss: 0.9200, test_loss: 0.9963, test_f1: 0.5216
 epoch: 8, train_loss: 0.9013, test_loss: 0.9708, test_f1: 0.5293
 epoch: 9, train_loss: 0.8978, test_loss: 1.0007, test_f1: 0.5227
 epoch: 10, train_loss: 0.8697, test_loss: 0.9438, test_f1: 0.5580
 epoch: 11, train_loss: 0.8650, test_loss: 0.9942, test_f1: 0.5425
 epoch: 12, train_loss: 0.8560, test_loss: 0.9861, test_f1: 0.5443
 epoch: 13, train_loss: 0.8408, test_loss: 0.9882, test_f1: 0.5387
 epoch: 14, train_loss: 0.8264, test_loss: 0.9337, test_f1: 0.5609
 epoch: 15, train_loss: 0.8149, test_loss: 0.9919, test_f1: 0.5545
 epoch: 16, train_loss: 0.8027, test_loss: 0.9771, test_f1: 0.5396
 epoch: 17, train_loss: 0.8085, test_loss: 0.9557, test_f1: 0.5678
 epoch: 18, train_loss: 0.8035, test_loss: 0.8649, test_f1: 0.5618
 epoch: 19, train_loss: 0.7902, test_loss: 0.9488, test_f1: 0.5684
 epoch: 20, train_loss: 0.7710, test_loss: 0.9536, test_f1: 0.5605
 epoch: 21, train_loss: 0.7557, test_loss: 0.9184, test_f1: 0.5530
 epoch: 22, train_loss: 0.7439, test_loss: 0.9215, test_f1: 0.5658
 epoch: 23, train_loss: 0.7335, test_loss: 0.9054, test_f1: 0.5628
 epoch: 24, train_loss: 0.7358, test_loss: 0.9678, test_f1: 0.5552
 epoch: 25, train_loss: 0.7145, test_loss: 0.9851, test_f1: 0.5633
 epoch: 26, train_loss: 0.7066, test_loss: 1.0061, test_f1: 0.5714
 epoch: 27, train_loss: 0.7025, test_loss: 0.9515, test_f1: 0.5651
 epoch: 28, train_loss: 0.6942, test_loss: 0.9699, test_f1: 0.5725
 epoch: 29, train_loss: 0.6867, test_loss: 0.9835, test_f1: 0.5945
 epoch: 30, train_loss: 0.6707, test_loss: 0.9156, test_f1: 0.6014
 epoch: 31, train_loss: 0.6624, test_loss: 0.9697, test_f1: 0.5684
 epoch: 32, train_loss: 0.6725, test_loss: 0.9967, test_f1: 0.5852
 epoch: 33, train_loss: 0.6611, test_loss: 1.0233, test_f1: 0.5682
 epoch: 34, train_loss: 0.6429, test_loss: 1.0256, test_f1: 0.5966
 epoch: 35, train_loss: 0.6395, test_loss: 0.8978, test_f1: 0.6297
 epoch: 36, train_loss: 0.6318, test_loss: 0.9521, test_f1: 0.6095
 epoch: 37, train_loss: 0.6383, test_loss: 1.0197, test_f1: 0.5949
 epoch: 38, train_loss: 0.6203, test_loss: 0.9403, test_f1: 0.5891
 epoch: 39, train_loss: 0.6103, test_loss: 1.0424, test_f1: 0.5786
 epoch: 40, train_loss: 0.5984, test_loss: 0.9087, test_f1: 0.6376
 epoch: 41, train_loss: 0.5897, test_loss: 1.0243, test_f1: 0.5956
 epoch: 42, train_loss: 0.5792, test_loss: 0.9770, test_f1: 0.6289
 epoch: 43, train_loss: 0.5818, test_loss: 0.9622, test_f1: 0.6206
 epoch: 44, train_loss: 0.5737, test_loss: 0.9607, test_f1: 0.6341
 epoch: 45, train_loss: 0.5642, test_loss: 1.0149, test_f1: 0.6211
 epoch: 46, train_loss: 0.5530, test_loss: 1.0453, test_f1: 0.6071
 epoch: 47, train_loss: 0.5681, test_loss: 1.0381, test_f1: 0.6085
 epoch: 48, train_loss: 0.5562, test_loss: 0.9666, test_f1: 0.6091
 epoch: 49, train_loss: 0.5342, test_loss: 0.9983, test_f1: 0.6187
 epoch: 50, train_loss: 0.5500, test_loss: 0.9109, test_f1: 0.6454
 epoch: 51, train_loss: 0.5053, test_loss: 1.0168, test_f1: 0.6429
 epoch: 52, train_loss: 0.4981, test_loss: 1.0004, test_f1: 0.6189
 epoch: 53, train_loss: 0.5033, test_loss: 1.0161, test_f1: 0.6509
 epoch: 54, train_loss: 0.4851, test_loss: 1.0182, test_f1: 0.6551
 epoch: 55, train_loss: 0.4832, test_loss: 0.9581, test_f1: 0.6470
 epoch: 56, train_loss: 0.5033, test_loss: 1.0093, test_f1: 0.6504
 epoch: 57, train_loss: 0.4960, test_loss: 1.0001, test_f1: 0.6464
 epoch: 58, train_loss: 0.4903, test_loss: 0.9734, test_f1: 0.6417
 epoch: 59, train_loss: 0.4908, test_loss: 1.0804, test_f1: 0.6570
 epoch: 60, train_loss: 0.4757, test_loss: 1.0368, test_f1: 0.6466
 epoch: 61, train_loss: 0.4582, test_loss: 1.1190, test_f1: 0.6621
 epoch: 62, train_loss: 0.4866, test_loss: 1.1472, test_f1: 0.6459
 epoch: 63, train_loss: 0.4711, test_loss: 1.0353, test_f1: 0.6411
 epoch: 64, train_loss: 0.4554, test_loss: 1.0498, test_f1: 0.6412
 epoch: 65, train_loss: 0.4496, test_loss: 1.0425, test_f1: 0.6392
 epoch: 66, train_loss: 0.4634, test_loss: 0.9924, test_f1: 0.6604
 epoch: 67, train_loss: 0.4477, test_loss: 0.9595, test_f1: 0.6480
 epoch: 68, train_loss: 0.4417, test_loss: 1.0170, test_f1: 0.6547
 epoch: 69, train_loss: 0.4438, test_loss: 1.0208, test_f1: 0.6506
 epoch: 70, train_loss: 0.4393, test_loss: 1.0055, test_f1: 0.6579
 epoch: 71, train_loss: 0.4400, test_loss: 1.0087, test_f1: 0.6484
 epoch: 72, train_loss: 0.4455, test_loss: 1.0371, test_f1: 0.6572
 epoch: 73, train_loss: 0.4214, test_loss: 1.1353, test_f1: 0.6410
 epoch: 74, train_loss: 0.4220, test_loss: 1.1305, test_f1: 0.6578
 epoch: 75, train_loss: 0.4193, test_loss: 1.0229, test_f1: 0.6666
 epoch: 76, train_loss: 0.4239, test_loss: 0.9288, test_f1: 0.6659
 epoch: 77, train_loss: 0.4128, test_loss: 1.0308, test_f1: 0.6517
 epoch: 78, train_loss: 0.4392, test_loss: 1.0930, test_f1: 0.6497
 epoch: 79, train_loss: 0.4275, test_loss: 1.1552, test_f1: 0.6628
 epoch: 80, train_loss: 0.4379, test_loss: 1.1403, test_f1: 0.6378
 epoch: 81, train_loss: 0.4205, test_loss: 1.1554, test_f1: 0.6444
 epoch: 82, train_loss: 0.4126, test_loss: 1.1375, test_f1: 0.6421
 epoch: 83, train_loss: 0.4138, test_loss: 1.0744, test_f1: 0.6452
 epoch: 84, train_loss: 0.4098, test_loss: 1.1449, test_f1: 0.6413
 epoch: 85, train_loss: 0.3953, test_loss: 1.0144, test_f1: 0.6688
 epoch: 86, train_loss: 0.3933, test_loss: 1.0734, test_f1: 0.6556
 epoch: 87, train_loss: 0.3910, test_loss: 1.1084, test_f1: 0.6445
 epoch: 88, train_loss: 0.3965, test_loss: 1.1615, test_f1: 0.6362
 epoch: 89, train_loss: 0.3888, test_loss: 1.0826, test_f1: 0.6405
 epoch: 90, train_loss: 0.3878, test_loss: 1.1839, test_f1: 0.6275
 epoch: 91, train_loss: 0.3847, test_loss: 1.1226, test_f1: 0.6433
 epoch: 92, train_loss: 0.3758, test_loss: 1.1405, test_f1: 0.6479
 epoch: 93, train_loss: 0.3752, test_loss: 1.1821, test_f1: 0.6605
 epoch: 94, train_loss: 0.3774, test_loss: 1.1922, test_f1: 0.6480
 epoch: 95, train_loss: 0.3564, test_loss: 1.1653, test_f1: 0.6490
 epoch: 96, train_loss: 0.3872, test_loss: 1.2511, test_f1: 0.6390
 epoch: 97, train_loss: 0.3596, test_loss: 1.1640, test_f1: 0.6491
 epoch: 98, train_loss: 0.3689, test_loss: 1.1437, test_f1: 0.6367
 epoch: 99, train_loss: 0.3640, test_loss: 1.2214, test_f1: 0.6401
##################ITERATION #8 ****************************************
 epoch: 0, train_loss: 1.2129, test_loss: 1.1578, test_f1: 0.3791
 epoch: 1, train_loss: 1.0687, test_loss: 1.0309, test_f1: 0.4559
 epoch: 2, train_loss: 1.0308, test_loss: 0.9849, test_f1: 0.4613
 epoch: 3, train_loss: 0.9938, test_loss: 0.9716, test_f1: 0.5032
 epoch: 4, train_loss: 0.9746, test_loss: 0.9576, test_f1: 0.5125
 epoch: 5, train_loss: 0.9412, test_loss: 0.9492, test_f1: 0.5184
 epoch: 6, train_loss: 0.9352, test_loss: 0.9434, test_f1: 0.5263
 epoch: 7, train_loss: 0.9200, test_loss: 0.9129, test_f1: 0.5455
 epoch: 8, train_loss: 0.9041, test_loss: 0.9082, test_f1: 0.5554
 epoch: 9, train_loss: 0.8847, test_loss: 0.9149, test_f1: 0.5544
 epoch: 10, train_loss: 0.8600, test_loss: 0.8772, test_f1: 0.5648
 epoch: 11, train_loss: 0.8615, test_loss: 0.8873, test_f1: 0.5717
 epoch: 12, train_loss: 0.8514, test_loss: 0.8646, test_f1: 0.6057
 epoch: 13, train_loss: 0.8368, test_loss: 0.8846, test_f1: 0.5710
 epoch: 14, train_loss: 0.8155, test_loss: 0.8916, test_f1: 0.5763
 epoch: 15, train_loss: 0.8152, test_loss: 0.8654, test_f1: 0.5917
 epoch: 16, train_loss: 0.7918, test_loss: 0.8609, test_f1: 0.6083
 epoch: 17, train_loss: 0.7858, test_loss: 0.8362, test_f1: 0.6094
 epoch: 18, train_loss: 0.7748, test_loss: 0.8591, test_f1: 0.6001
 epoch: 19, train_loss: 0.7567, test_loss: 0.8474, test_f1: 0.5800
 epoch: 20, train_loss: 0.7519, test_loss: 0.8303, test_f1: 0.6130
 epoch: 21, train_loss: 0.7367, test_loss: 0.8241, test_f1: 0.6023
 epoch: 22, train_loss: 0.7344, test_loss: 0.8366, test_f1: 0.6113
 epoch: 23, train_loss: 0.7293, test_loss: 0.8103, test_f1: 0.6201
 epoch: 24, train_loss: 0.7099, test_loss: 0.8174, test_f1: 0.6238
 epoch: 25, train_loss: 0.7000, test_loss: 0.8365, test_f1: 0.5960
 epoch: 26, train_loss: 0.6970, test_loss: 0.8427, test_f1: 0.6003
 epoch: 27, train_loss: 0.6869, test_loss: 0.7915, test_f1: 0.6373
 epoch: 28, train_loss: 0.6783, test_loss: 0.7944, test_f1: 0.6289
 epoch: 29, train_loss: 0.6639, test_loss: 0.8124, test_f1: 0.6147
 epoch: 30, train_loss: 0.6649, test_loss: 0.8159, test_f1: 0.6162
 epoch: 31, train_loss: 0.6698, test_loss: 0.8201, test_f1: 0.6059
 epoch: 32, train_loss: 0.6424, test_loss: 0.7924, test_f1: 0.6152
 epoch: 33, train_loss: 0.6254, test_loss: 0.7787, test_f1: 0.6317
 epoch: 34, train_loss: 0.6029, test_loss: 0.7607, test_f1: 0.6389
 epoch: 35, train_loss: 0.6132, test_loss: 0.7670, test_f1: 0.6289
 epoch: 36, train_loss: 0.6275, test_loss: 0.8141, test_f1: 0.6400
 epoch: 37, train_loss: 0.6068, test_loss: 0.7474, test_f1: 0.6366
 epoch: 38, train_loss: 0.6017, test_loss: 0.7885, test_f1: 0.6472
 epoch: 39, train_loss: 0.5980, test_loss: 0.7835, test_f1: 0.6404
 epoch: 40, train_loss: 0.5799, test_loss: 0.7658, test_f1: 0.6380
 epoch: 41, train_loss: 0.5806, test_loss: 0.7410, test_f1: 0.6529
 epoch: 42, train_loss: 0.5642, test_loss: 0.7609, test_f1: 0.6458
 epoch: 43, train_loss: 0.5566, test_loss: 0.8057, test_f1: 0.6302
 epoch: 44, train_loss: 0.5530, test_loss: 0.8537, test_f1: 0.6350
 epoch: 45, train_loss: 0.5533, test_loss: 0.7936, test_f1: 0.6491
 epoch: 46, train_loss: 0.5262, test_loss: 0.7930, test_f1: 0.6380
 epoch: 47, train_loss: 0.5350, test_loss: 0.9197, test_f1: 0.6388
 epoch: 48, train_loss: 0.5195, test_loss: 1.1146, test_f1: 0.6402
 epoch: 49, train_loss: 0.5176, test_loss: 0.8026, test_f1: 0.6615
 epoch: 50, train_loss: 0.5125, test_loss: 0.9949, test_f1: 0.6385
 epoch: 51, train_loss: 0.4940, test_loss: 0.8034, test_f1: 0.6585
 epoch: 52, train_loss: 0.4863, test_loss: 0.8147, test_f1: 0.6581
 epoch: 53, train_loss: 0.4781, test_loss: 0.8232, test_f1: 0.6530
 epoch: 54, train_loss: 0.4747, test_loss: 0.7906, test_f1: 0.6737
 epoch: 55, train_loss: 0.4638, test_loss: 0.7919, test_f1: 0.6731
 epoch: 56, train_loss: 0.4649, test_loss: 0.7825, test_f1: 0.6509
 epoch: 57, train_loss: 0.4575, test_loss: 0.8017, test_f1: 0.6628
 epoch: 58, train_loss: 0.4675, test_loss: 0.8054, test_f1: 0.6769
 epoch: 59, train_loss: 0.4604, test_loss: 0.8364, test_f1: 0.6438
 epoch: 60, train_loss: 0.4513, test_loss: 0.7910, test_f1: 0.6774
 epoch: 61, train_loss: 0.4582, test_loss: 0.8324, test_f1: 0.6785
 epoch: 62, train_loss: 0.4434, test_loss: 0.8490, test_f1: 0.6509
 epoch: 63, train_loss: 0.4389, test_loss: 0.8197, test_f1: 0.6783
 epoch: 64, train_loss: 0.4264, test_loss: 0.8198, test_f1: 0.6715
 epoch: 65, train_loss: 0.4525, test_loss: 0.8184, test_f1: 0.6685
 epoch: 66, train_loss: 0.4334, test_loss: 0.8076, test_f1: 0.6929
 epoch: 67, train_loss: 0.4385, test_loss: 0.8469, test_f1: 0.6737
 epoch: 68, train_loss: 0.4415, test_loss: 0.8256, test_f1: 0.6740
 epoch: 69, train_loss: 0.4233, test_loss: 0.8482, test_f1: 0.6661
 epoch: 70, train_loss: 0.4154, test_loss: 0.8308, test_f1: 0.6880
 epoch: 71, train_loss: 0.4339, test_loss: 0.8532, test_f1: 0.6773
 epoch: 72, train_loss: 0.4220, test_loss: 0.8536, test_f1: 0.6625
 epoch: 73, train_loss: 0.4176, test_loss: 0.8513, test_f1: 0.6593
 epoch: 74, train_loss: 0.4231, test_loss: 0.8244, test_f1: 0.6695
 epoch: 75, train_loss: 0.3959, test_loss: 0.8041, test_f1: 0.6836
 epoch: 76, train_loss: 0.3937, test_loss: 0.8346, test_f1: 0.6712
 epoch: 77, train_loss: 0.4121, test_loss: 0.8816, test_f1: 0.6578
 epoch: 78, train_loss: 0.4034, test_loss: 0.9021, test_f1: 0.6503
 epoch: 79, train_loss: 0.4003, test_loss: 0.8805, test_f1: 0.6711
 epoch: 80, train_loss: 0.3939, test_loss: 0.8671, test_f1: 0.6627
 epoch: 81, train_loss: 0.4018, test_loss: 0.8216, test_f1: 0.6833
 epoch: 82, train_loss: 0.4007, test_loss: 0.8794, test_f1: 0.6692
 epoch: 83, train_loss: 0.3933, test_loss: 0.8735, test_f1: 0.6703
 epoch: 84, train_loss: 0.3854, test_loss: 0.8737, test_f1: 0.6775
 epoch: 85, train_loss: 0.3825, test_loss: 0.9010, test_f1: 0.6871
 epoch: 86, train_loss: 0.3862, test_loss: 0.8735, test_f1: 0.6846
 epoch: 87, train_loss: 0.3904, test_loss: 0.8857, test_f1: 0.6829
 epoch: 88, train_loss: 0.3695, test_loss: 0.9516, test_f1: 0.6582
 epoch: 89, train_loss: 0.3840, test_loss: 0.9150, test_f1: 0.6593
 epoch: 90, train_loss: 0.3812, test_loss: 0.8766, test_f1: 0.6743
 epoch: 91, train_loss: 0.3650, test_loss: 0.9206, test_f1: 0.6532
 epoch: 92, train_loss: 0.3626, test_loss: 0.9269, test_f1: 0.6736
 epoch: 93, train_loss: 0.3612, test_loss: 0.9380, test_f1: 0.6776
 epoch: 94, train_loss: 0.3801, test_loss: 0.8822, test_f1: 0.6818
 epoch: 95, train_loss: 0.3587, test_loss: 0.9429, test_f1: 0.6775
 epoch: 96, train_loss: 0.3562, test_loss: 0.9421, test_f1: 0.6664
 epoch: 97, train_loss: 0.3391, test_loss: 0.9866, test_f1: 0.6768
 epoch: 98, train_loss: 0.3646, test_loss: 1.0097, test_f1: 0.6727
 epoch: 99, train_loss: 0.3500, test_loss: 0.8954, test_f1: 0.6898
##################ITERATION #9 ****************************************
 epoch: 0, train_loss: 1.2437, test_loss: 1.1572, test_f1: 0.3391
 epoch: 1, train_loss: 1.0899, test_loss: 1.0045, test_f1: 0.5077
 epoch: 2, train_loss: 1.0433, test_loss: 1.0059, test_f1: 0.4613
 epoch: 3, train_loss: 1.0219, test_loss: 0.9872, test_f1: 0.4983
 epoch: 4, train_loss: 1.0035, test_loss: 0.9634, test_f1: 0.5168
 epoch: 5, train_loss: 0.9892, test_loss: 0.9547, test_f1: 0.5221
 epoch: 6, train_loss: 0.9610, test_loss: 0.9554, test_f1: 0.5112
 epoch: 7, train_loss: 0.9451, test_loss: 0.9433, test_f1: 0.5269
 epoch: 8, train_loss: 0.9199, test_loss: 0.9397, test_f1: 0.5197
 epoch: 9, train_loss: 0.9165, test_loss: 0.9096, test_f1: 0.5616
 epoch: 10, train_loss: 0.8977, test_loss: 0.9343, test_f1: 0.5490
 epoch: 11, train_loss: 0.8903, test_loss: 0.9248, test_f1: 0.5579
 epoch: 12, train_loss: 0.8760, test_loss: 0.8923, test_f1: 0.5522
 epoch: 13, train_loss: 0.8545, test_loss: 0.9037, test_f1: 0.5749
 epoch: 14, train_loss: 0.8435, test_loss: 0.9052, test_f1: 0.5761
 epoch: 15, train_loss: 0.8300, test_loss: 0.8739, test_f1: 0.5824
 epoch: 16, train_loss: 0.8247, test_loss: 0.8856, test_f1: 0.5515
 epoch: 17, train_loss: 0.8031, test_loss: 0.8800, test_f1: 0.5568
 epoch: 18, train_loss: 0.8074, test_loss: 0.8887, test_f1: 0.5853
 epoch: 19, train_loss: 0.7831, test_loss: 0.9000, test_f1: 0.5755
 epoch: 20, train_loss: 0.7771, test_loss: 0.8955, test_f1: 0.5717
 epoch: 21, train_loss: 0.7754, test_loss: 0.8964, test_f1: 0.5798
 epoch: 22, train_loss: 0.7539, test_loss: 0.8702, test_f1: 0.5952
 epoch: 23, train_loss: 0.7411, test_loss: 0.9235, test_f1: 0.5589
 epoch: 24, train_loss: 0.7503, test_loss: 0.8897, test_f1: 0.5767
 epoch: 25, train_loss: 0.7318, test_loss: 0.8706, test_f1: 0.5902
 epoch: 26, train_loss: 0.7263, test_loss: 0.8769, test_f1: 0.5839
 epoch: 27, train_loss: 0.7145, test_loss: 0.8650, test_f1: 0.6014
 epoch: 28, train_loss: 0.7063, test_loss: 0.8642, test_f1: 0.6055
 epoch: 29, train_loss: 0.7010, test_loss: 0.8762, test_f1: 0.5909
 epoch: 30, train_loss: 0.6967, test_loss: 0.8815, test_f1: 0.6186
 epoch: 31, train_loss: 0.6700, test_loss: 0.8881, test_f1: 0.5992
 epoch: 32, train_loss: 0.6808, test_loss: 0.8722, test_f1: 0.5977
 epoch: 33, train_loss: 0.6761, test_loss: 0.8354, test_f1: 0.5856
 epoch: 34, train_loss: 0.6623, test_loss: 0.8247, test_f1: 0.5984
 epoch: 35, train_loss: 0.6641, test_loss: 0.8434, test_f1: 0.6061
 epoch: 36, train_loss: 0.6521, test_loss: 0.8364, test_f1: 0.5959
 epoch: 37, train_loss: 0.6416, test_loss: 0.8756, test_f1: 0.5905
 epoch: 38, train_loss: 0.6281, test_loss: 0.8563, test_f1: 0.5981
 epoch: 39, train_loss: 0.6280, test_loss: 0.9060, test_f1: 0.6001
 epoch: 40, train_loss: 0.6206, test_loss: 0.8845, test_f1: 0.5937
 epoch: 41, train_loss: 0.6078, test_loss: 0.8258, test_f1: 0.6086
 epoch: 42, train_loss: 0.5900, test_loss: 0.8777, test_f1: 0.6133
 epoch: 43, train_loss: 0.6037, test_loss: 0.8488, test_f1: 0.6267
 epoch: 44, train_loss: 0.5903, test_loss: 0.9110, test_f1: 0.6069
 epoch: 45, train_loss: 0.5748, test_loss: 0.8687, test_f1: 0.6122
 epoch: 46, train_loss: 0.5685, test_loss: 0.8181, test_f1: 0.6262
 epoch: 47, train_loss: 0.5633, test_loss: 0.8951, test_f1: 0.6329
 epoch: 48, train_loss: 0.5697, test_loss: 0.9606, test_f1: 0.5968
 epoch: 49, train_loss: 0.5546, test_loss: 0.9109, test_f1: 0.6043
 epoch: 50, train_loss: 0.5603, test_loss: 0.9414, test_f1: 0.6037
 epoch: 51, train_loss: 0.5384, test_loss: 0.8820, test_f1: 0.6115
 epoch: 52, train_loss: 0.5067, test_loss: 0.8967, test_f1: 0.6144
 epoch: 53, train_loss: 0.5078, test_loss: 0.8835, test_f1: 0.6183
 epoch: 54, train_loss: 0.5137, test_loss: 0.9573, test_f1: 0.6047
 epoch: 55, train_loss: 0.5155, test_loss: 0.9095, test_f1: 0.6186
 epoch: 56, train_loss: 0.4899, test_loss: 0.9919, test_f1: 0.6256
 epoch: 57, train_loss: 0.5038, test_loss: 0.9990, test_f1: 0.5971
 epoch: 58, train_loss: 0.4959, test_loss: 0.9882, test_f1: 0.6049
 epoch: 59, train_loss: 0.5031, test_loss: 0.9221, test_f1: 0.6180
 epoch: 60, train_loss: 0.4911, test_loss: 0.9111, test_f1: 0.6240
 epoch: 61, train_loss: 0.4776, test_loss: 0.9917, test_f1: 0.6097
 epoch: 62, train_loss: 0.4803, test_loss: 0.9442, test_f1: 0.6129
 epoch: 63, train_loss: 0.4994, test_loss: 0.9410, test_f1: 0.6167
 epoch: 64, train_loss: 0.4734, test_loss: 0.9871, test_f1: 0.6167
 epoch: 65, train_loss: 0.4588, test_loss: 0.9187, test_f1: 0.6327
 epoch: 66, train_loss: 0.4660, test_loss: 0.9400, test_f1: 0.6120
 epoch: 67, train_loss: 0.4470, test_loss: 0.9720, test_f1: 0.6200
 epoch: 68, train_loss: 0.4439, test_loss: 0.9409, test_f1: 0.6228
 epoch: 69, train_loss: 0.4746, test_loss: 1.0199, test_f1: 0.6045
 epoch: 70, train_loss: 0.4530, test_loss: 1.0224, test_f1: 0.6149
 epoch: 71, train_loss: 0.4656, test_loss: 1.0069, test_f1: 0.6007
 epoch: 72, train_loss: 0.4484, test_loss: 0.9778, test_f1: 0.6163
 epoch: 73, train_loss: 0.4421, test_loss: 1.0194, test_f1: 0.6157
 epoch: 74, train_loss: 0.4355, test_loss: 1.0099, test_f1: 0.6215
 epoch: 75, train_loss: 0.4507, test_loss: 0.9613, test_f1: 0.6280
 epoch: 76, train_loss: 0.4406, test_loss: 1.0131, test_f1: 0.6270
 epoch: 77, train_loss: 0.4261, test_loss: 1.0022, test_f1: 0.6287
 epoch: 78, train_loss: 0.4237, test_loss: 1.1126, test_f1: 0.6219
 epoch: 79, train_loss: 0.4225, test_loss: 1.0357, test_f1: 0.6266
 epoch: 80, train_loss: 0.4404, test_loss: 1.0202, test_f1: 0.6311
 epoch: 81, train_loss: 0.4076, test_loss: 1.1408, test_f1: 0.6052
 epoch: 82, train_loss: 0.4145, test_loss: 1.0139, test_f1: 0.6395
 epoch: 83, train_loss: 0.4185, test_loss: 1.0309, test_f1: 0.6296
 epoch: 84, train_loss: 0.3974, test_loss: 1.0116, test_f1: 0.6286
 epoch: 85, train_loss: 0.4166, test_loss: 1.0545, test_f1: 0.6308
 epoch: 86, train_loss: 0.3947, test_loss: 1.0554, test_f1: 0.6332
 epoch: 87, train_loss: 0.4035, test_loss: 1.0137, test_f1: 0.6370
 epoch: 88, train_loss: 0.3909, test_loss: 1.0908, test_f1: 0.6239
 epoch: 89, train_loss: 0.3900, test_loss: 1.0622, test_f1: 0.6361
 epoch: 90, train_loss: 0.3923, test_loss: 1.0132, test_f1: 0.6368
 epoch: 91, train_loss: 0.3961, test_loss: 0.9960, test_f1: 0.6381
 epoch: 92, train_loss: 0.3832, test_loss: 1.0635, test_f1: 0.6355
 epoch: 93, train_loss: 0.3779, test_loss: 1.0496, test_f1: 0.6280
 epoch: 94, train_loss: 0.3796, test_loss: 1.0496, test_f1: 0.6276
 epoch: 95, train_loss: 0.3809, test_loss: 1.1183, test_f1: 0.6376
 epoch: 96, train_loss: 0.3766, test_loss: 1.0903, test_f1: 0.6374
 epoch: 97, train_loss: 0.3706, test_loss: 1.0888, test_f1: 0.6355
 epoch: 98, train_loss: 0.3530, test_loss: 1.1113, test_f1: 0.6421
 epoch: 99, train_loss: 0.3648, test_loss: 1.1347, test_f1: 0.6248

Training completed in 1938.77 seconds
Best F1: 0.6929 at epoch 66
Mean F1 across iterations: 0.6647  0.0159
========================FINAL RESULTS================================
FEGIN weighted F1: 0.6929  0.0159
python main.py --data ltspice_examples --representation component_pin --model FEGIN --layers 6 --hiddens 128 --batch_size 64 --lr 0.0001 --emb_size 512 --epochs 100 --save_appendix component_pin_L6_H128_BS64_LR0.0001_E512 --no_val
-----



STDERR:
  File "main.py", line 370, in <module>
    main()
  File "main.py", line 254, in main
    dataset = dataset_class(
  File "/home/philip/projects/llm_inference_code_repo/Circuit-Completion-Using-GNNs/component_classification_with_link_prediction_head/evaluation/FEGIN/kernel/circuit_datasets.py", line 15, in __init__
    self.data, self.slices = torch.load(self.processed_paths[0])
  File "/home/philip/.local/lib/python3.8/site-packages/torch/serialization.py", line 1040, in load
    warnings.warn(
  File "/usr/lib/python3.8/warnings.py", line 109, in _showwarnmsg
    sw(msg.message, msg.category, msg.filename, msg.lineno,
  File "main.py", line 47, in warn_with_traceback
    traceback.print_stack(file=log)
/home/philip/projects/llm_inference_code_repo/Circuit-Completion-Using-GNNs/component_classification_with_link_prediction_head/evaluation/FEGIN/kernel/circuit_datasets.py:15: FutureWarning: You are using `torch.load` with `weights_only=False` (the current default value), which uses the default pickle module implicitly. It is possible to construct malicious pickle data which will execute arbitrary code during unpickling (See https://github.com/pytorch/pytorch/blob/main/SECURITY.md#untrusted-models for more details). In a future release, the default value for `weights_only` will be flipped to `True`. This limits the functions that could be executed during unpickling. Arbitrary objects will no longer be allowed to be loaded via this mode unless they are explicitly allowlisted by the user via `torch.serialization.add_safe_globals`. We recommend you start setting `weights_only=True` for any use case where you don't have full control of the loaded file. Please open an issue on GitHub for any issues related to this experimental feature.
  self.data, self.slices = torch.load(self.processed_paths[0])
