STDOUT:
Results will be saved in /home/philip/projects/ltspice_examples_code_repo/Circuit-Completion-Using-GNNs/component_classification_with_link_prediction_head/evaluation/FEGIN/results/model_FEGIN_dataset_ltspice_demos
Command line input: python main.py --data ltspice_demos --representation component_pin_net --model FEGIN --layers 3 --hiddens 32 --batch_size 64 --lr 0.01 --emb_size 512 --epochs 100 --save_appendix component_pin_net_L3_H32_BS64_LR0.01_E512 --no_val
 is saved.
-----
ltspice_demos - FEGIN
Using 3 layers, 32 hidden units, h = 2
Loading component_pin_net representation dataset
ENTERED
Training FEGIN on component_pin_net representation
Train: 1565, Test: 383
##################ITERATION #0 ****************************************
 epoch: 0, train_loss: 1.2302, test_loss: 1.2907, test_f1: 0.2281
 epoch: 1, train_loss: 1.1031, test_loss: 1.2698, test_f1: 0.2429
 epoch: 2, train_loss: 1.0455, test_loss: 1.1184, test_f1: 0.4019
 epoch: 3, train_loss: 0.9858, test_loss: 1.0698, test_f1: 0.4920
 epoch: 4, train_loss: 0.9745, test_loss: 1.0312, test_f1: 0.5320
 epoch: 5, train_loss: 0.9459, test_loss: 1.1291, test_f1: 0.3740
 epoch: 6, train_loss: 0.9375, test_loss: 1.0757, test_f1: 0.4396
 epoch: 7, train_loss: 0.9051, test_loss: 1.1873, test_f1: 0.4248
 epoch: 8, train_loss: 0.8879, test_loss: 1.0647, test_f1: 0.5728
 epoch: 9, train_loss: 0.8849, test_loss: 1.1767, test_f1: 0.4724
 epoch: 10, train_loss: 0.8807, test_loss: 1.1072, test_f1: 0.4917
 epoch: 11, train_loss: 0.8360, test_loss: 0.9332, test_f1: 0.5404
 epoch: 12, train_loss: 0.8541, test_loss: 1.1586, test_f1: 0.5311
 epoch: 13, train_loss: 0.8201, test_loss: 1.8170, test_f1: 0.3741
 epoch: 14, train_loss: 0.8032, test_loss: 1.0301, test_f1: 0.5324
 epoch: 15, train_loss: 0.7956, test_loss: 0.9441, test_f1: 0.5717
 epoch: 16, train_loss: 0.7681, test_loss: 1.0447, test_f1: 0.5757
 epoch: 17, train_loss: 0.7945, test_loss: 1.3201, test_f1: 0.4757
 epoch: 18, train_loss: 0.7729, test_loss: 0.9512, test_f1: 0.5871
 epoch: 19, train_loss: 0.7574, test_loss: 0.9805, test_f1: 0.5830
 epoch: 20, train_loss: 0.7589, test_loss: 0.9461, test_f1: 0.5705
 epoch: 21, train_loss: 0.7467, test_loss: 1.1541, test_f1: 0.4586
 epoch: 22, train_loss: 0.7387, test_loss: 1.2106, test_f1: 0.4856
 epoch: 23, train_loss: 0.7294, test_loss: 0.9782, test_f1: 0.6102
 epoch: 24, train_loss: 0.7087, test_loss: 1.0733, test_f1: 0.5678
 epoch: 25, train_loss: 0.6959, test_loss: 1.0482, test_f1: 0.5927
 epoch: 26, train_loss: 0.6891, test_loss: 1.0882, test_f1: 0.5629
 epoch: 27, train_loss: 0.7124, test_loss: 2.0311, test_f1: 0.3715
 epoch: 28, train_loss: 0.7099, test_loss: 1.0678, test_f1: 0.5949
 epoch: 29, train_loss: 0.6907, test_loss: 1.1315, test_f1: 0.5293
 epoch: 30, train_loss: 0.7057, test_loss: 1.0261, test_f1: 0.5891
 epoch: 31, train_loss: 0.6903, test_loss: 0.9896, test_f1: 0.5699
 epoch: 32, train_loss: 0.6783, test_loss: 1.0309, test_f1: 0.6250
 epoch: 33, train_loss: 0.6891, test_loss: 0.9769, test_f1: 0.5396
 epoch: 34, train_loss: 0.6525, test_loss: 0.9181, test_f1: 0.6623
 epoch: 35, train_loss: 0.6471, test_loss: 1.3694, test_f1: 0.5697
 epoch: 36, train_loss: 0.6550, test_loss: 0.9294, test_f1: 0.6479
 epoch: 37, train_loss: 0.6352, test_loss: 1.0092, test_f1: 0.5343
 epoch: 38, train_loss: 0.6390, test_loss: 1.2856, test_f1: 0.5450
 epoch: 39, train_loss: 0.6166, test_loss: 1.0080, test_f1: 0.5970
 epoch: 40, train_loss: 0.6327, test_loss: 1.0545, test_f1: 0.6095
 epoch: 41, train_loss: 0.6486, test_loss: 0.9152, test_f1: 0.6196
 epoch: 42, train_loss: 0.6214, test_loss: 1.1590, test_f1: 0.5632
 epoch: 43, train_loss: 0.6380, test_loss: 1.0464, test_f1: 0.5924
 epoch: 44, train_loss: 0.6045, test_loss: 1.2098, test_f1: 0.5623
 epoch: 45, train_loss: 0.6002, test_loss: 1.0752, test_f1: 0.5698
 epoch: 46, train_loss: 0.5756, test_loss: 1.2975, test_f1: 0.6160
 epoch: 47, train_loss: 0.5637, test_loss: 1.1783, test_f1: 0.6421
 epoch: 48, train_loss: 0.6124, test_loss: 1.2763, test_f1: 0.4989
 epoch: 49, train_loss: 0.5811, test_loss: 1.5573, test_f1: 0.4841
 epoch: 50, train_loss: 0.5964, test_loss: 1.0925, test_f1: 0.5775
 epoch: 51, train_loss: 0.6181, test_loss: 1.0882, test_f1: 0.5443
 epoch: 52, train_loss: 0.5427, test_loss: 1.0996, test_f1: 0.6242
 epoch: 53, train_loss: 0.5047, test_loss: 1.1539, test_f1: 0.6350
 epoch: 54, train_loss: 0.5290, test_loss: 1.2749, test_f1: 0.6048
 epoch: 55, train_loss: 0.5302, test_loss: 1.1450, test_f1: 0.6237
 epoch: 56, train_loss: 0.5093, test_loss: 1.1464, test_f1: 0.6257
 epoch: 57, train_loss: 0.5425, test_loss: 1.2317, test_f1: 0.6237
 epoch: 58, train_loss: 0.4888, test_loss: 1.3864, test_f1: 0.5462
 epoch: 59, train_loss: 0.4785, test_loss: 1.2309, test_f1: 0.6191
 epoch: 60, train_loss: 0.4837, test_loss: 1.3176, test_f1: 0.6199
 epoch: 61, train_loss: 0.4575, test_loss: 1.4827, test_f1: 0.6118
 epoch: 62, train_loss: 0.4604, test_loss: 1.5216, test_f1: 0.6013
 epoch: 63, train_loss: 0.4552, test_loss: 1.7053, test_f1: 0.5844
 epoch: 64, train_loss: 0.4382, test_loss: 1.3507, test_f1: 0.5945
 epoch: 65, train_loss: 0.4797, test_loss: 1.9700, test_f1: 0.5118
 epoch: 66, train_loss: 0.4859, test_loss: 1.3768, test_f1: 0.6369
 epoch: 67, train_loss: 0.4742, test_loss: 1.4220, test_f1: 0.5828
 epoch: 68, train_loss: 0.4878, test_loss: 1.3226, test_f1: 0.6276
 epoch: 69, train_loss: 0.4425, test_loss: 1.4731, test_f1: 0.6028
 epoch: 70, train_loss: 0.4297, test_loss: 1.5712, test_f1: 0.5957
 epoch: 71, train_loss: 0.4625, test_loss: 1.4930, test_f1: 0.6281
 epoch: 72, train_loss: 0.4276, test_loss: 1.5323, test_f1: 0.6118
 epoch: 73, train_loss: 0.4634, test_loss: 1.3693, test_f1: 0.5972
 epoch: 74, train_loss: 0.4542, test_loss: 1.5682, test_f1: 0.5803
 epoch: 75, train_loss: 0.4493, test_loss: 1.7336, test_f1: 0.6066
 epoch: 76, train_loss: 0.4332, test_loss: 1.7360, test_f1: 0.6024
 epoch: 77, train_loss: 0.4425, test_loss: 1.5768, test_f1: 0.5779
 epoch: 78, train_loss: 0.4513, test_loss: 1.4879, test_f1: 0.5934
 epoch: 79, train_loss: 0.4531, test_loss: 1.5207, test_f1: 0.6304
 epoch: 80, train_loss: 0.4218, test_loss: 1.4904, test_f1: 0.6131
 epoch: 81, train_loss: 0.4187, test_loss: 1.5544, test_f1: 0.5955
 epoch: 82, train_loss: 0.4158, test_loss: 1.5787, test_f1: 0.6063
 epoch: 83, train_loss: 0.4384, test_loss: 1.4124, test_f1: 0.6083
 epoch: 84, train_loss: 0.4082, test_loss: 2.1139, test_f1: 0.5561
 epoch: 85, train_loss: 0.3815, test_loss: 1.7926, test_f1: 0.6166
 epoch: 86, train_loss: 0.4173, test_loss: 1.9387, test_f1: 0.5797
 epoch: 87, train_loss: 0.4214, test_loss: 1.5394, test_f1: 0.6250
 epoch: 88, train_loss: 0.4051, test_loss: 1.9479, test_f1: 0.5780
 epoch: 89, train_loss: 0.4132, test_loss: 1.6047, test_f1: 0.6111
 epoch: 90, train_loss: 0.4067, test_loss: 1.9023, test_f1: 0.5930
 epoch: 91, train_loss: 0.4189, test_loss: 1.5151, test_f1: 0.6174
 epoch: 92, train_loss: 0.4108, test_loss: 1.8652, test_f1: 0.5687
 epoch: 93, train_loss: 0.4094, test_loss: 1.6313, test_f1: 0.6102
 epoch: 94, train_loss: 0.4395, test_loss: 1.8234, test_f1: 0.6124
 epoch: 95, train_loss: 0.4182, test_loss: 1.6556, test_f1: 0.5974
 epoch: 96, train_loss: 0.3844, test_loss: 1.9087, test_f1: 0.5872
 epoch: 97, train_loss: 0.3742, test_loss: 1.7483, test_f1: 0.6310
 epoch: 98, train_loss: 0.3754, test_loss: 1.7778, test_f1: 0.5937
 epoch: 99, train_loss: 0.3885, test_loss: 1.8397, test_f1: 0.6119
##################ITERATION #1 ****************************************
 epoch: 0, train_loss: 1.0708, test_loss: 1.4044, test_f1: 0.2281
 epoch: 1, train_loss: 0.9727, test_loss: 1.0517, test_f1: 0.4310
 epoch: 2, train_loss: 0.9321, test_loss: 1.0987, test_f1: 0.5318
 epoch: 3, train_loss: 0.9055, test_loss: 0.9975, test_f1: 0.5003
 epoch: 4, train_loss: 0.8863, test_loss: 1.8307, test_f1: 0.2078
 epoch: 5, train_loss: 0.8657, test_loss: 1.0183, test_f1: 0.5429
 epoch: 6, train_loss: 0.8330, test_loss: 1.2246, test_f1: 0.3807
 epoch: 7, train_loss: 0.8187, test_loss: 0.9627, test_f1: 0.6063
 epoch: 8, train_loss: 0.7976, test_loss: 1.0117, test_f1: 0.5798
 epoch: 9, train_loss: 0.7771, test_loss: 1.1566, test_f1: 0.4909
 epoch: 10, train_loss: 0.7909, test_loss: 1.1284, test_f1: 0.5516
 epoch: 11, train_loss: 0.7686, test_loss: 1.0009, test_f1: 0.5466
 epoch: 12, train_loss: 0.7773, test_loss: 0.9727, test_f1: 0.5630
 epoch: 13, train_loss: 0.7748, test_loss: 1.3702, test_f1: 0.3523
 epoch: 14, train_loss: 0.7821, test_loss: 1.0620, test_f1: 0.5762
 epoch: 15, train_loss: 0.7535, test_loss: 0.9948, test_f1: 0.5796
 epoch: 16, train_loss: 0.7307, test_loss: 1.0300, test_f1: 0.5627
 epoch: 17, train_loss: 0.7414, test_loss: 0.9819, test_f1: 0.5152
 epoch: 18, train_loss: 0.7075, test_loss: 1.0895, test_f1: 0.5365
 epoch: 19, train_loss: 0.6971, test_loss: 1.1117, test_f1: 0.5434
 epoch: 20, train_loss: 0.7188, test_loss: 1.4283, test_f1: 0.5118
 epoch: 21, train_loss: 0.7083, test_loss: 1.0480, test_f1: 0.5818
 epoch: 22, train_loss: 0.6877, test_loss: 1.2023, test_f1: 0.5086
 epoch: 23, train_loss: 0.6966, test_loss: 1.2808, test_f1: 0.5203
 epoch: 24, train_loss: 0.6969, test_loss: 0.9916, test_f1: 0.5921
 epoch: 25, train_loss: 0.6956, test_loss: 1.1624, test_f1: 0.4970
 epoch: 26, train_loss: 0.6525, test_loss: 1.4935, test_f1: 0.5096
 epoch: 27, train_loss: 0.6753, test_loss: 1.0335, test_f1: 0.5847
 epoch: 28, train_loss: 0.6557, test_loss: 1.1742, test_f1: 0.5764
 epoch: 29, train_loss: 0.6477, test_loss: 0.9896, test_f1: 0.5762
 epoch: 30, train_loss: 0.6748, test_loss: 1.1306, test_f1: 0.5616
 epoch: 31, train_loss: 0.6345, test_loss: 1.1687, test_f1: 0.5912
 epoch: 32, train_loss: 0.6553, test_loss: 0.9899, test_f1: 0.5945
 epoch: 33, train_loss: 0.6376, test_loss: 1.2208, test_f1: 0.5400
 epoch: 34, train_loss: 0.6262, test_loss: 1.0835, test_f1: 0.5972
 epoch: 35, train_loss: 0.6340, test_loss: 1.1631, test_f1: 0.5890
 epoch: 36, train_loss: 0.6158, test_loss: 1.0516, test_f1: 0.6172
 epoch: 37, train_loss: 0.6291, test_loss: 1.1267, test_f1: 0.5771
 epoch: 38, train_loss: 0.6240, test_loss: 1.2603, test_f1: 0.5139
 epoch: 39, train_loss: 0.6092, test_loss: 1.0823, test_f1: 0.5923
 epoch: 40, train_loss: 0.6054, test_loss: 1.0256, test_f1: 0.5992
 epoch: 41, train_loss: 0.5871, test_loss: 1.0029, test_f1: 0.6629
 epoch: 42, train_loss: 0.5849, test_loss: 1.4453, test_f1: 0.5424
 epoch: 43, train_loss: 0.6195, test_loss: 1.2142, test_f1: 0.5954
 epoch: 44, train_loss: 0.6467, test_loss: 1.2363, test_f1: 0.5512
 epoch: 45, train_loss: 0.6168, test_loss: 1.6392, test_f1: 0.4590
 epoch: 46, train_loss: 0.5909, test_loss: 1.3033, test_f1: 0.6032
 epoch: 47, train_loss: 0.5890, test_loss: 1.1060, test_f1: 0.6208
 epoch: 48, train_loss: 0.6198, test_loss: 1.3454, test_f1: 0.5296
 epoch: 49, train_loss: 0.6700, test_loss: 1.1919, test_f1: 0.5693
 epoch: 50, train_loss: 0.5929, test_loss: 1.1995, test_f1: 0.5909
 epoch: 51, train_loss: 0.5606, test_loss: 1.0633, test_f1: 0.6501
 epoch: 52, train_loss: 0.5276, test_loss: 1.1638, test_f1: 0.6431
 epoch: 53, train_loss: 0.5491, test_loss: 1.1070, test_f1: 0.6532
 epoch: 54, train_loss: 0.5388, test_loss: 1.1073, test_f1: 0.6408
 epoch: 55, train_loss: 0.5088, test_loss: 1.3459, test_f1: 0.6222
 epoch: 56, train_loss: 0.5151, test_loss: 1.1819, test_f1: 0.6343
 epoch: 57, train_loss: 0.5238, test_loss: 1.5167, test_f1: 0.6112
 epoch: 58, train_loss: 0.4949, test_loss: 1.4822, test_f1: 0.5903
 epoch: 59, train_loss: 0.5331, test_loss: 1.1439, test_f1: 0.6786
 epoch: 60, train_loss: 0.4921, test_loss: 1.1787, test_f1: 0.6412
 epoch: 61, train_loss: 0.4808, test_loss: 1.2242, test_f1: 0.6178
 epoch: 62, train_loss: 0.4838, test_loss: 1.1642, test_f1: 0.6712
 epoch: 63, train_loss: 0.4771, test_loss: 1.1739, test_f1: 0.6584
 epoch: 64, train_loss: 0.4729, test_loss: 1.1866, test_f1: 0.6571
 epoch: 65, train_loss: 0.4878, test_loss: 1.4096, test_f1: 0.6093
 epoch: 66, train_loss: 0.4766, test_loss: 1.4800, test_f1: 0.6363
 epoch: 67, train_loss: 0.5190, test_loss: 1.2880, test_f1: 0.6095
 epoch: 68, train_loss: 0.4886, test_loss: 1.2848, test_f1: 0.6107
 epoch: 69, train_loss: 0.4570, test_loss: 2.0101, test_f1: 0.5502
 epoch: 70, train_loss: 0.4333, test_loss: 1.4304, test_f1: 0.6099
 epoch: 71, train_loss: 0.4733, test_loss: 1.3234, test_f1: 0.6377
 epoch: 72, train_loss: 0.4502, test_loss: 1.9076, test_f1: 0.6050
 epoch: 73, train_loss: 0.4542, test_loss: 1.4078, test_f1: 0.6129
 epoch: 74, train_loss: 0.4282, test_loss: 1.3180, test_f1: 0.6440
 epoch: 75, train_loss: 0.4586, test_loss: 1.4354, test_f1: 0.6574
 epoch: 76, train_loss: 0.4611, test_loss: 1.2743, test_f1: 0.6457
 epoch: 77, train_loss: 0.4338, test_loss: 1.4355, test_f1: 0.6269
 epoch: 78, train_loss: 0.4139, test_loss: 1.4660, test_f1: 0.6482
 epoch: 79, train_loss: 0.4201, test_loss: 1.4083, test_f1: 0.6599
 epoch: 80, train_loss: 0.4493, test_loss: 1.4199, test_f1: 0.6203
 epoch: 81, train_loss: 0.4435, test_loss: 1.3381, test_f1: 0.6779
 epoch: 82, train_loss: 0.4630, test_loss: 1.4773, test_f1: 0.6537
 epoch: 83, train_loss: 0.4382, test_loss: 1.5096, test_f1: 0.5746
 epoch: 84, train_loss: 0.4139, test_loss: 1.2354, test_f1: 0.6486
 epoch: 85, train_loss: 0.4263, test_loss: 1.6309, test_f1: 0.6372
 epoch: 86, train_loss: 0.4263, test_loss: 1.4137, test_f1: 0.6376
 epoch: 87, train_loss: 0.4325, test_loss: 1.5486, test_f1: 0.6191
 epoch: 88, train_loss: 0.4088, test_loss: 1.4601, test_f1: 0.6398
 epoch: 89, train_loss: 0.4268, test_loss: 1.5507, test_f1: 0.6061
 epoch: 90, train_loss: 0.4392, test_loss: 1.4902, test_f1: 0.6359
 epoch: 91, train_loss: 0.4039, test_loss: 1.4374, test_f1: 0.6689
 epoch: 92, train_loss: 0.3768, test_loss: 1.5070, test_f1: 0.6837
 epoch: 93, train_loss: 0.4031, test_loss: 1.5414, test_f1: 0.6468
 epoch: 94, train_loss: 0.3860, test_loss: 1.5044, test_f1: 0.6548
 epoch: 95, train_loss: 0.3774, test_loss: 1.4943, test_f1: 0.6629
 epoch: 96, train_loss: 0.4391, test_loss: 1.5865, test_f1: 0.5735
 epoch: 97, train_loss: 0.4041, test_loss: 1.4072, test_f1: 0.6550
 epoch: 98, train_loss: 0.4181, test_loss: 1.5833, test_f1: 0.6578
 epoch: 99, train_loss: 0.4279, test_loss: 1.9327, test_f1: 0.6186
##################ITERATION #2 ****************************************
 epoch: 0, train_loss: 1.1385, test_loss: 1.4079, test_f1: 0.1500
 epoch: 1, train_loss: 0.9886, test_loss: 1.1175, test_f1: 0.4460
 epoch: 2, train_loss: 0.9440, test_loss: 1.0672, test_f1: 0.4960
 epoch: 3, train_loss: 0.9178, test_loss: 1.0591, test_f1: 0.4841
 epoch: 4, train_loss: 0.9237, test_loss: 1.1291, test_f1: 0.4704
 epoch: 5, train_loss: 0.9026, test_loss: 1.0225, test_f1: 0.5119
 epoch: 6, train_loss: 0.8754, test_loss: 1.2288, test_f1: 0.4290
 epoch: 7, train_loss: 0.8712, test_loss: 1.0537, test_f1: 0.4562
 epoch: 8, train_loss: 0.8413, test_loss: 1.0214, test_f1: 0.4555
 epoch: 9, train_loss: 0.8464, test_loss: 1.0847, test_f1: 0.5074
 epoch: 10, train_loss: 0.8104, test_loss: 1.8170, test_f1: 0.2959
 epoch: 11, train_loss: 0.7782, test_loss: 0.9767, test_f1: 0.5836
 epoch: 12, train_loss: 0.7631, test_loss: 1.1123, test_f1: 0.5489
 epoch: 13, train_loss: 0.7904, test_loss: 1.0549, test_f1: 0.4788
 epoch: 14, train_loss: 0.7641, test_loss: 1.3166, test_f1: 0.4771
 epoch: 15, train_loss: 0.7524, test_loss: 1.0723, test_f1: 0.5591
 epoch: 16, train_loss: 0.7478, test_loss: 1.0944, test_f1: 0.5141
 epoch: 17, train_loss: 0.7897, test_loss: 1.0534, test_f1: 0.4841
 epoch: 18, train_loss: 0.7282, test_loss: 1.1212, test_f1: 0.4937
 epoch: 19, train_loss: 0.7307, test_loss: 0.9774, test_f1: 0.5984
 epoch: 20, train_loss: 0.6996, test_loss: 1.3961, test_f1: 0.4657
 epoch: 21, train_loss: 0.7154, test_loss: 1.0790, test_f1: 0.5702
 epoch: 22, train_loss: 0.7347, test_loss: 0.9929, test_f1: 0.5566
 epoch: 23, train_loss: 0.7095, test_loss: 1.0679, test_f1: 0.5628
 epoch: 24, train_loss: 0.6663, test_loss: 1.0185, test_f1: 0.6297
 epoch: 25, train_loss: 0.6703, test_loss: 1.1081, test_f1: 0.5135
 epoch: 26, train_loss: 0.6700, test_loss: 0.9626, test_f1: 0.6086
 epoch: 27, train_loss: 0.6590, test_loss: 0.9958, test_f1: 0.5569
 epoch: 28, train_loss: 0.6480, test_loss: 1.1569, test_f1: 0.5416
 epoch: 29, train_loss: 0.6442, test_loss: 1.2779, test_f1: 0.5419
 epoch: 30, train_loss: 0.6713, test_loss: 1.2290, test_f1: 0.4929
 epoch: 31, train_loss: 0.6324, test_loss: 1.0892, test_f1: 0.5392
 epoch: 32, train_loss: 0.6702, test_loss: 1.3916, test_f1: 0.5293
 epoch: 33, train_loss: 0.6764, test_loss: 1.1409, test_f1: 0.5204
 epoch: 34, train_loss: 0.6784, test_loss: 1.2968, test_f1: 0.4758
 epoch: 35, train_loss: 0.6447, test_loss: 1.2266, test_f1: 0.5451
 epoch: 36, train_loss: 0.6209, test_loss: 1.0139, test_f1: 0.6298
 epoch: 37, train_loss: 0.6343, test_loss: 1.1836, test_f1: 0.5627
 epoch: 38, train_loss: 0.6455, test_loss: 1.0850, test_f1: 0.5560
 epoch: 39, train_loss: 0.6128, test_loss: 1.2022, test_f1: 0.5922
 epoch: 40, train_loss: 0.6155, test_loss: 1.1174, test_f1: 0.6350
 epoch: 41, train_loss: 0.5855, test_loss: 1.0660, test_f1: 0.6109
 epoch: 42, train_loss: 0.5899, test_loss: 1.1693, test_f1: 0.5440
 epoch: 43, train_loss: 0.5671, test_loss: 1.6342, test_f1: 0.4080
 epoch: 44, train_loss: 0.5615, test_loss: 1.0403, test_f1: 0.6457
 epoch: 45, train_loss: 0.5769, test_loss: 1.1643, test_f1: 0.5942
 epoch: 46, train_loss: 0.5547, test_loss: 1.1165, test_f1: 0.6292
 epoch: 47, train_loss: 0.5816, test_loss: 1.4766, test_f1: 0.5618
 epoch: 48, train_loss: 0.5800, test_loss: 1.2434, test_f1: 0.5985
 epoch: 49, train_loss: 0.5437, test_loss: 1.2190, test_f1: 0.5580
 epoch: 50, train_loss: 0.5523, test_loss: 1.3587, test_f1: 0.5788
 epoch: 51, train_loss: 0.5414, test_loss: 1.4306, test_f1: 0.5401
 epoch: 52, train_loss: 0.5177, test_loss: 1.1762, test_f1: 0.6277
 epoch: 53, train_loss: 0.4981, test_loss: 1.0772, test_f1: 0.6141
 epoch: 54, train_loss: 0.4746, test_loss: 1.1843, test_f1: 0.6515
 epoch: 55, train_loss: 0.4632, test_loss: 1.2230, test_f1: 0.6350
 epoch: 56, train_loss: 0.4707, test_loss: 1.3635, test_f1: 0.6140
 epoch: 57, train_loss: 0.4972, test_loss: 1.6058, test_f1: 0.5653
 epoch: 58, train_loss: 0.4778, test_loss: 1.9768, test_f1: 0.5821
 epoch: 59, train_loss: 0.4575, test_loss: 1.3635, test_f1: 0.5911
 epoch: 60, train_loss: 0.4656, test_loss: 1.3602, test_f1: 0.6127
 epoch: 61, train_loss: 0.4839, test_loss: 1.3673, test_f1: 0.6303
 epoch: 62, train_loss: 0.4419, test_loss: 1.3173, test_f1: 0.6161
 epoch: 63, train_loss: 0.4636, test_loss: 1.6739, test_f1: 0.5774
 epoch: 64, train_loss: 0.4908, test_loss: 1.3045, test_f1: 0.6086
 epoch: 65, train_loss: 0.4314, test_loss: 1.5121, test_f1: 0.5663
 epoch: 66, train_loss: 0.4566, test_loss: 1.3289, test_f1: 0.6283
 epoch: 67, train_loss: 0.4562, test_loss: 1.4665, test_f1: 0.6272
 epoch: 68, train_loss: 0.4670, test_loss: 1.2669, test_f1: 0.5960
 epoch: 69, train_loss: 0.4045, test_loss: 1.2561, test_f1: 0.6499
 epoch: 70, train_loss: 0.4011, test_loss: 1.6393, test_f1: 0.5709
 epoch: 71, train_loss: 0.4399, test_loss: 1.2548, test_f1: 0.6695
 epoch: 72, train_loss: 0.4822, test_loss: 1.8596, test_f1: 0.5386
 epoch: 73, train_loss: 0.5277, test_loss: 1.4196, test_f1: 0.6199
 epoch: 74, train_loss: 0.4629, test_loss: 1.3142, test_f1: 0.6160
 epoch: 75, train_loss: 0.4274, test_loss: 1.5207, test_f1: 0.6017
 epoch: 76, train_loss: 0.4629, test_loss: 1.4878, test_f1: 0.6383
 epoch: 77, train_loss: 0.4376, test_loss: 1.4916, test_f1: 0.6359
 epoch: 78, train_loss: 0.4348, test_loss: 1.4225, test_f1: 0.5850
 epoch: 79, train_loss: 0.4015, test_loss: 1.5561, test_f1: 0.6255
 epoch: 80, train_loss: 0.4186, test_loss: 1.7030, test_f1: 0.6139
 epoch: 81, train_loss: 0.4526, test_loss: 1.8554, test_f1: 0.5885
 epoch: 82, train_loss: 0.4358, test_loss: 1.4476, test_f1: 0.6252
 epoch: 83, train_loss: 0.4021, test_loss: 1.4514, test_f1: 0.6067
 epoch: 84, train_loss: 0.4042, test_loss: 1.8825, test_f1: 0.5970
 epoch: 85, train_loss: 0.4270, test_loss: 2.1740, test_f1: 0.5299
 epoch: 86, train_loss: 0.4515, test_loss: 1.3771, test_f1: 0.6782
 epoch: 87, train_loss: 0.4074, test_loss: 1.6299, test_f1: 0.6219
 epoch: 88, train_loss: 0.3872, test_loss: 2.0013, test_f1: 0.5044
 epoch: 89, train_loss: 0.3759, test_loss: 1.5548, test_f1: 0.6176
 epoch: 90, train_loss: 0.3765, test_loss: 1.4011, test_f1: 0.6854
 epoch: 91, train_loss: 0.4046, test_loss: 1.6568, test_f1: 0.6597
 epoch: 92, train_loss: 0.3809, test_loss: 1.5060, test_f1: 0.6267
 epoch: 93, train_loss: 0.3707, test_loss: 1.5205, test_f1: 0.6563
 epoch: 94, train_loss: 0.4096, test_loss: 2.1098, test_f1: 0.5963
 epoch: 95, train_loss: 0.3768, test_loss: 1.8582, test_f1: 0.6447
 epoch: 96, train_loss: 0.3611, test_loss: 1.4438, test_f1: 0.6553
 epoch: 97, train_loss: 0.3909, test_loss: 1.7897, test_f1: 0.6538
 epoch: 98, train_loss: 0.3736, test_loss: 2.0362, test_f1: 0.5827
 epoch: 99, train_loss: 0.3743, test_loss: 1.7950, test_f1: 0.6123
##################ITERATION #3 ****************************************
 epoch: 0, train_loss: 1.1353, test_loss: 1.2593, test_f1: 0.4270
 epoch: 1, train_loss: 0.9767, test_loss: 1.0255, test_f1: 0.5596
 epoch: 2, train_loss: 0.9200, test_loss: 1.0583, test_f1: 0.5444
 epoch: 3, train_loss: 0.9016, test_loss: 1.0282, test_f1: 0.5284
 epoch: 4, train_loss: 0.8552, test_loss: 1.0401, test_f1: 0.5284
 epoch: 5, train_loss: 0.8532, test_loss: 1.1224, test_f1: 0.5034
 epoch: 6, train_loss: 0.8243, test_loss: 1.0604, test_f1: 0.5300
 epoch: 7, train_loss: 0.7997, test_loss: 1.0586, test_f1: 0.5677
 epoch: 8, train_loss: 0.8058, test_loss: 1.1090, test_f1: 0.4904
 epoch: 9, train_loss: 0.7869, test_loss: 1.1511, test_f1: 0.5934
 epoch: 10, train_loss: 0.7683, test_loss: 1.0751, test_f1: 0.6171
 epoch: 11, train_loss: 0.7782, test_loss: 1.2112, test_f1: 0.5345
 epoch: 12, train_loss: 0.7639, test_loss: 1.3359, test_f1: 0.5002
 epoch: 13, train_loss: 0.7709, test_loss: 1.2625, test_f1: 0.5223
 epoch: 14, train_loss: 0.7583, test_loss: 1.0758, test_f1: 0.5443
 epoch: 15, train_loss: 0.7584, test_loss: 1.0565, test_f1: 0.5549
 epoch: 16, train_loss: 0.7267, test_loss: 1.1996, test_f1: 0.4533
 epoch: 17, train_loss: 0.7279, test_loss: 1.5169, test_f1: 0.5354
 epoch: 18, train_loss: 0.7117, test_loss: 2.0111, test_f1: 0.5052
 epoch: 19, train_loss: 0.7384, test_loss: 1.1249, test_f1: 0.4451
 epoch: 20, train_loss: 0.7490, test_loss: 1.7168, test_f1: 0.3944
 epoch: 21, train_loss: 0.7147, test_loss: 1.1559, test_f1: 0.5001
 epoch: 22, train_loss: 0.6613, test_loss: 1.3699, test_f1: 0.5310
 epoch: 23, train_loss: 0.6857, test_loss: 1.1779, test_f1: 0.5025
 epoch: 24, train_loss: 0.6954, test_loss: 1.9531, test_f1: 0.4986
 epoch: 25, train_loss: 0.7165, test_loss: 1.5738, test_f1: 0.5867
 epoch: 26, train_loss: 0.6865, test_loss: 1.2989, test_f1: 0.5648
 epoch: 27, train_loss: 0.6800, test_loss: 1.2744, test_f1: 0.5513
 epoch: 28, train_loss: 0.6541, test_loss: 1.1978, test_f1: 0.5696
 epoch: 29, train_loss: 0.6840, test_loss: 1.1154, test_f1: 0.5199
 epoch: 30, train_loss: 0.6747, test_loss: 1.1551, test_f1: 0.4809
 epoch: 31, train_loss: 0.6713, test_loss: 1.2550, test_f1: 0.4852
 epoch: 32, train_loss: 0.6724, test_loss: 1.8341, test_f1: 0.4646
 epoch: 33, train_loss: 0.6709, test_loss: 1.1534, test_f1: 0.5433
 epoch: 34, train_loss: 0.6602, test_loss: 1.6473, test_f1: 0.5217
 epoch: 35, train_loss: 0.6490, test_loss: 1.6088, test_f1: 0.4806
 epoch: 36, train_loss: 0.6552, test_loss: 1.2360, test_f1: 0.6127
 epoch: 37, train_loss: 0.6434, test_loss: 1.6462, test_f1: 0.5431
 epoch: 38, train_loss: 0.6514, test_loss: 1.3502, test_f1: 0.5490
 epoch: 39, train_loss: 0.6502, test_loss: 1.4230, test_f1: 0.5917
 epoch: 40, train_loss: 0.5980, test_loss: 1.6890, test_f1: 0.4775
 epoch: 41, train_loss: 0.5943, test_loss: 1.5915, test_f1: 0.4839
 epoch: 42, train_loss: 0.6289, test_loss: 1.3025, test_f1: 0.5800
 epoch: 43, train_loss: 0.6284, test_loss: 1.4657, test_f1: 0.5540
 epoch: 44, train_loss: 0.6201, test_loss: 1.6108, test_f1: 0.4899
 epoch: 45, train_loss: 0.6168, test_loss: 1.6819, test_f1: 0.5582
 epoch: 46, train_loss: 0.6300, test_loss: 1.4726, test_f1: 0.5850
 epoch: 47, train_loss: 0.6412, test_loss: 1.2461, test_f1: 0.5540
 epoch: 48, train_loss: 0.6572, test_loss: 1.4121, test_f1: 0.5600
 epoch: 49, train_loss: 0.5992, test_loss: 1.2639, test_f1: 0.4979
 epoch: 50, train_loss: 0.5867, test_loss: 1.1240, test_f1: 0.6370
 epoch: 51, train_loss: 0.5600, test_loss: 1.1991, test_f1: 0.6404
 epoch: 52, train_loss: 0.5220, test_loss: 1.2624, test_f1: 0.5853
 epoch: 53, train_loss: 0.5260, test_loss: 1.9419, test_f1: 0.5548
 epoch: 54, train_loss: 0.5074, test_loss: 1.4668, test_f1: 0.6159
 epoch: 55, train_loss: 0.5274, test_loss: 1.5251, test_f1: 0.6250
 epoch: 56, train_loss: 0.4898, test_loss: 1.5065, test_f1: 0.6079
 epoch: 57, train_loss: 0.4994, test_loss: 1.6368, test_f1: 0.5577
 epoch: 58, train_loss: 0.5018, test_loss: 1.3770, test_f1: 0.6046
 epoch: 59, train_loss: 0.4844, test_loss: 1.5008, test_f1: 0.6223
 epoch: 60, train_loss: 0.4876, test_loss: 1.2087, test_f1: 0.6477
 epoch: 61, train_loss: 0.4753, test_loss: 1.5607, test_f1: 0.5958
 epoch: 62, train_loss: 0.4880, test_loss: 2.0015, test_f1: 0.6080
 epoch: 63, train_loss: 0.4913, test_loss: 1.4609, test_f1: 0.5876
 epoch: 64, train_loss: 0.5026, test_loss: 1.5208, test_f1: 0.5977
 epoch: 65, train_loss: 0.4853, test_loss: 1.5327, test_f1: 0.6287
 epoch: 66, train_loss: 0.4840, test_loss: 1.6800, test_f1: 0.5717
 epoch: 67, train_loss: 0.5025, test_loss: 1.6507, test_f1: 0.5968
 epoch: 68, train_loss: 0.4977, test_loss: 1.7028, test_f1: 0.6059
 epoch: 69, train_loss: 0.4669, test_loss: 1.4892, test_f1: 0.6326
 epoch: 70, train_loss: 0.4517, test_loss: 1.4951, test_f1: 0.6291
 epoch: 71, train_loss: 0.4526, test_loss: 1.8324, test_f1: 0.5948
 epoch: 72, train_loss: 0.4507, test_loss: 1.4464, test_f1: 0.6471
 epoch: 73, train_loss: 0.4322, test_loss: 1.4061, test_f1: 0.6240
 epoch: 74, train_loss: 0.4691, test_loss: 1.7795, test_f1: 0.5500
 epoch: 75, train_loss: 0.4735, test_loss: 1.4212, test_f1: 0.6166
 epoch: 76, train_loss: 0.4804, test_loss: 1.6365, test_f1: 0.5536
 epoch: 77, train_loss: 0.4527, test_loss: 1.8680, test_f1: 0.6257
 epoch: 78, train_loss: 0.4408, test_loss: 2.1176, test_f1: 0.6113
 epoch: 79, train_loss: 0.4497, test_loss: 1.6720, test_f1: 0.6149
 epoch: 80, train_loss: 0.4722, test_loss: 1.5448, test_f1: 0.6216
 epoch: 81, train_loss: 0.4751, test_loss: 1.6965, test_f1: 0.6171
 epoch: 82, train_loss: 0.4585, test_loss: 1.7448, test_f1: 0.5787
 epoch: 83, train_loss: 0.4514, test_loss: 1.4855, test_f1: 0.6688
 epoch: 84, train_loss: 0.4589, test_loss: 1.6670, test_f1: 0.6172
 epoch: 85, train_loss: 0.4715, test_loss: 1.4356, test_f1: 0.6432
 epoch: 86, train_loss: 0.4501, test_loss: 1.5782, test_f1: 0.6332
 epoch: 87, train_loss: 0.4360, test_loss: 1.6038, test_f1: 0.6181
 epoch: 88, train_loss: 0.4584, test_loss: 1.3624, test_f1: 0.6438
 epoch: 89, train_loss: 0.4630, test_loss: 1.5847, test_f1: 0.6065
 epoch: 90, train_loss: 0.4151, test_loss: 1.6411, test_f1: 0.6353
 epoch: 91, train_loss: 0.4357, test_loss: 1.7265, test_f1: 0.6256
 epoch: 92, train_loss: 0.4201, test_loss: 1.5972, test_f1: 0.6575
 epoch: 93, train_loss: 0.4237, test_loss: 1.6348, test_f1: 0.6278
 epoch: 94, train_loss: 0.4137, test_loss: 1.6262, test_f1: 0.6238
 epoch: 95, train_loss: 0.4052, test_loss: 1.9388, test_f1: 0.6620
 epoch: 96, train_loss: 0.4122, test_loss: 1.7131, test_f1: 0.6206
 epoch: 97, train_loss: 0.4312, test_loss: 2.0640, test_f1: 0.6145
 epoch: 98, train_loss: 0.4736, test_loss: 1.4904, test_f1: 0.6576
 epoch: 99, train_loss: 0.4163, test_loss: 1.4245, test_f1: 0.6493
##################ITERATION #4 ****************************************
 epoch: 0, train_loss: 1.1349, test_loss: 1.3466, test_f1: 0.3763
 epoch: 1, train_loss: 0.9823, test_loss: 1.1609, test_f1: 0.3868
 epoch: 2, train_loss: 0.9381, test_loss: 1.0516, test_f1: 0.4937
 epoch: 3, train_loss: 0.9039, test_loss: 0.9873, test_f1: 0.4781
 epoch: 4, train_loss: 0.9057, test_loss: 0.9571, test_f1: 0.4856
 epoch: 5, train_loss: 0.8679, test_loss: 1.1284, test_f1: 0.5311
 epoch: 6, train_loss: 0.8617, test_loss: 0.9676, test_f1: 0.5833
 epoch: 7, train_loss: 0.8347, test_loss: 0.9780, test_f1: 0.5509
 epoch: 8, train_loss: 0.8034, test_loss: 1.2572, test_f1: 0.5361
 epoch: 9, train_loss: 0.8234, test_loss: 0.9507, test_f1: 0.4419
 epoch: 10, train_loss: 0.8174, test_loss: 1.0439, test_f1: 0.5457
 epoch: 11, train_loss: 0.7978, test_loss: 1.0579, test_f1: 0.4703
 epoch: 12, train_loss: 0.7918, test_loss: 1.5147, test_f1: 0.4606
 epoch: 13, train_loss: 0.7665, test_loss: 1.5290, test_f1: 0.4895
 epoch: 14, train_loss: 0.7641, test_loss: 1.1676, test_f1: 0.5049
 epoch: 15, train_loss: 0.7522, test_loss: 1.0117, test_f1: 0.5990
 epoch: 16, train_loss: 0.7904, test_loss: 1.3273, test_f1: 0.5095
 epoch: 17, train_loss: 0.7661, test_loss: 1.0556, test_f1: 0.5541
 epoch: 18, train_loss: 0.7685, test_loss: 1.0605, test_f1: 0.5552
 epoch: 19, train_loss: 0.7567, test_loss: 1.0828, test_f1: 0.4751
 epoch: 20, train_loss: 0.7508, test_loss: 1.0411, test_f1: 0.5763
 epoch: 21, train_loss: 0.7126, test_loss: 1.0367, test_f1: 0.5986
 epoch: 22, train_loss: 0.7084, test_loss: 1.1444, test_f1: 0.5817
 epoch: 23, train_loss: 0.7065, test_loss: 1.0466, test_f1: 0.5707
 epoch: 24, train_loss: 0.7160, test_loss: 1.2331, test_f1: 0.4988
 epoch: 25, train_loss: 0.7321, test_loss: 1.1863, test_f1: 0.4670
 epoch: 26, train_loss: 0.7307, test_loss: 1.0855, test_f1: 0.5901
 epoch: 27, train_loss: 0.7061, test_loss: 1.2236, test_f1: 0.5955
 epoch: 28, train_loss: 0.6896, test_loss: 1.1468, test_f1: 0.6179
 epoch: 29, train_loss: 0.6741, test_loss: 1.6065, test_f1: 0.5890
 epoch: 30, train_loss: 0.6538, test_loss: 1.5312, test_f1: 0.5805
 epoch: 31, train_loss: 0.6814, test_loss: 1.4089, test_f1: 0.4898
 epoch: 32, train_loss: 0.6841, test_loss: 1.0473, test_f1: 0.5549
 epoch: 33, train_loss: 0.6657, test_loss: 1.0773, test_f1: 0.5717
 epoch: 34, train_loss: 0.6712, test_loss: 1.2082, test_f1: 0.5298
 epoch: 35, train_loss: 0.6614, test_loss: 1.3705, test_f1: 0.5220
 epoch: 36, train_loss: 0.6491, test_loss: 2.1304, test_f1: 0.4134
 epoch: 37, train_loss: 0.7226, test_loss: 1.6135, test_f1: 0.4496
 epoch: 38, train_loss: 0.8131, test_loss: 1.1127, test_f1: 0.5239
 epoch: 39, train_loss: 0.7140, test_loss: 1.2366, test_f1: 0.5601
 epoch: 40, train_loss: 0.6778, test_loss: 1.1237, test_f1: 0.5572
 epoch: 41, train_loss: 0.6491, test_loss: 1.8619, test_f1: 0.4707
 epoch: 42, train_loss: 0.6564, test_loss: 1.2595, test_f1: 0.5177
 epoch: 43, train_loss: 0.6660, test_loss: 1.3009, test_f1: 0.5398
 epoch: 44, train_loss: 0.6630, test_loss: 1.3568, test_f1: 0.5150
 epoch: 45, train_loss: 0.6620, test_loss: 1.5655, test_f1: 0.5146
 epoch: 46, train_loss: 0.6782, test_loss: 1.3047, test_f1: 0.5729
 epoch: 47, train_loss: 0.6562, test_loss: 1.4977, test_f1: 0.4338
 epoch: 48, train_loss: 0.6112, test_loss: 1.2417, test_f1: 0.6241
 epoch: 49, train_loss: 0.6466, test_loss: 1.2778, test_f1: 0.5887
 epoch: 50, train_loss: 0.6175, test_loss: 1.2908, test_f1: 0.5711
 epoch: 51, train_loss: 0.5862, test_loss: 1.2371, test_f1: 0.6573
 epoch: 52, train_loss: 0.5498, test_loss: 1.4512, test_f1: 0.6179
 epoch: 53, train_loss: 0.5674, test_loss: 1.4290, test_f1: 0.5959
 epoch: 54, train_loss: 0.5324, test_loss: 1.5225, test_f1: 0.6098
 epoch: 55, train_loss: 0.5542, test_loss: 1.7924, test_f1: 0.5704
 epoch: 56, train_loss: 0.5513, test_loss: 1.8721, test_f1: 0.5638
 epoch: 57, train_loss: 0.5385, test_loss: 1.7575, test_f1: 0.5907
 epoch: 58, train_loss: 0.5300, test_loss: 1.5708, test_f1: 0.6238
 epoch: 59, train_loss: 0.5163, test_loss: 1.6297, test_f1: 0.5975
 epoch: 60, train_loss: 0.5177, test_loss: 1.6299, test_f1: 0.5902
 epoch: 61, train_loss: 0.5247, test_loss: 2.0839, test_f1: 0.6192
 epoch: 62, train_loss: 0.5387, test_loss: 1.6330, test_f1: 0.6176
 epoch: 63, train_loss: 0.5498, test_loss: 1.9138, test_f1: 0.6390
 epoch: 64, train_loss: 0.5210, test_loss: 1.4745, test_f1: 0.6111
 epoch: 65, train_loss: 0.4916, test_loss: 1.6095, test_f1: 0.6390
 epoch: 66, train_loss: 0.4875, test_loss: 1.8562, test_f1: 0.6220
 epoch: 67, train_loss: 0.4977, test_loss: 1.5862, test_f1: 0.6273
 epoch: 68, train_loss: 0.4887, test_loss: 2.0083, test_f1: 0.6288
 epoch: 69, train_loss: 0.4760, test_loss: 1.9358, test_f1: 0.5880
 epoch: 70, train_loss: 0.4706, test_loss: 2.1236, test_f1: 0.6035
 epoch: 71, train_loss: 0.4950, test_loss: 2.2332, test_f1: 0.6054
 epoch: 72, train_loss: 0.4795, test_loss: 2.0603, test_f1: 0.5837
 epoch: 73, train_loss: 0.4748, test_loss: 1.9343, test_f1: 0.5840
 epoch: 74, train_loss: 0.4904, test_loss: 2.2147, test_f1: 0.6000
 epoch: 75, train_loss: 0.4532, test_loss: 1.7612, test_f1: 0.6532
 epoch: 76, train_loss: 0.4645, test_loss: 1.9737, test_f1: 0.6135
 epoch: 77, train_loss: 0.4626, test_loss: 1.7505, test_f1: 0.6512
 epoch: 78, train_loss: 0.4807, test_loss: 1.6706, test_f1: 0.6122
 epoch: 79, train_loss: 0.5095, test_loss: 1.6498, test_f1: 0.6180
 epoch: 80, train_loss: 0.4840, test_loss: 1.8258, test_f1: 0.6256
 epoch: 81, train_loss: 0.4203, test_loss: 2.3464, test_f1: 0.6181
 epoch: 82, train_loss: 0.4593, test_loss: 2.2285, test_f1: 0.6244
 epoch: 83, train_loss: 0.4620, test_loss: 2.2939, test_f1: 0.6055
 epoch: 84, train_loss: 0.4630, test_loss: 1.6853, test_f1: 0.6316
 epoch: 85, train_loss: 0.4460, test_loss: 2.0771, test_f1: 0.6139
 epoch: 86, train_loss: 0.4601, test_loss: 1.8275, test_f1: 0.6280
 epoch: 87, train_loss: 0.4707, test_loss: 2.0422, test_f1: 0.6462
 epoch: 88, train_loss: 0.4958, test_loss: 2.0253, test_f1: 0.6306
 epoch: 89, train_loss: 0.4350, test_loss: 1.6705, test_f1: 0.6388
 epoch: 90, train_loss: 0.4034, test_loss: 1.8091, test_f1: 0.5998
 epoch: 91, train_loss: 0.4487, test_loss: 1.9976, test_f1: 0.6531
 epoch: 92, train_loss: 0.4153, test_loss: 1.7290, test_f1: 0.6372
 epoch: 93, train_loss: 0.4711, test_loss: 1.9513, test_f1: 0.5871
 epoch: 94, train_loss: 0.4335, test_loss: 1.8446, test_f1: 0.6271
 epoch: 95, train_loss: 0.4274, test_loss: 1.6745, test_f1: 0.5843
 epoch: 96, train_loss: 0.4399, test_loss: 2.2177, test_f1: 0.6089
 epoch: 97, train_loss: 0.4386, test_loss: 2.2922, test_f1: 0.5923
 epoch: 98, train_loss: 0.4154, test_loss: 1.7209, test_f1: 0.6157
 epoch: 99, train_loss: 0.4144, test_loss: 2.1727, test_f1: 0.6221
##################ITERATION #5 ****************************************
 epoch: 0, train_loss: 1.1630, test_loss: 1.5829, test_f1: 0.1453
 epoch: 1, train_loss: 1.0190, test_loss: 1.1412, test_f1: 0.3842
 epoch: 2, train_loss: 0.9573, test_loss: 1.0888, test_f1: 0.4715
 epoch: 3, train_loss: 0.9238, test_loss: 1.0703, test_f1: 0.4975
 epoch: 4, train_loss: 0.9025, test_loss: 1.0418, test_f1: 0.5342
 epoch: 5, train_loss: 0.8904, test_loss: 0.9987, test_f1: 0.5570
 epoch: 6, train_loss: 0.8765, test_loss: 1.0005, test_f1: 0.5619
 epoch: 7, train_loss: 0.8528, test_loss: 1.0427, test_f1: 0.4869
 epoch: 8, train_loss: 0.8716, test_loss: 1.1032, test_f1: 0.4764
 epoch: 9, train_loss: 0.8663, test_loss: 0.9766, test_f1: 0.5338
 epoch: 10, train_loss: 0.7980, test_loss: 1.1303, test_f1: 0.4642
 epoch: 11, train_loss: 0.7909, test_loss: 1.2931, test_f1: 0.4527
 epoch: 12, train_loss: 0.7993, test_loss: 1.1179, test_f1: 0.4712
 epoch: 13, train_loss: 0.7732, test_loss: 1.1882, test_f1: 0.5012
 epoch: 14, train_loss: 0.7593, test_loss: 1.0244, test_f1: 0.6104
 epoch: 15, train_loss: 0.7463, test_loss: 1.0494, test_f1: 0.5588
 epoch: 16, train_loss: 0.7550, test_loss: 1.1608, test_f1: 0.5005
 epoch: 17, train_loss: 0.7212, test_loss: 1.4374, test_f1: 0.4873
 epoch: 18, train_loss: 0.7237, test_loss: 1.2070, test_f1: 0.4764
 epoch: 19, train_loss: 0.7073, test_loss: 1.1227, test_f1: 0.5855
 epoch: 20, train_loss: 0.7244, test_loss: 1.1773, test_f1: 0.5099
 epoch: 21, train_loss: 0.7228, test_loss: 1.1615, test_f1: 0.5144
 epoch: 22, train_loss: 0.6972, test_loss: 1.0309, test_f1: 0.5892
 epoch: 23, train_loss: 0.6880, test_loss: 1.0800, test_f1: 0.5670
 epoch: 24, train_loss: 0.6657, test_loss: 1.2498, test_f1: 0.5516
 epoch: 25, train_loss: 0.6917, test_loss: 1.1450, test_f1: 0.5987
 epoch: 26, train_loss: 0.6598, test_loss: 1.4402, test_f1: 0.4901
 epoch: 27, train_loss: 0.6754, test_loss: 1.3030, test_f1: 0.5296
 epoch: 28, train_loss: 0.6734, test_loss: 1.1531, test_f1: 0.5753
 epoch: 29, train_loss: 0.6123, test_loss: 1.2919, test_f1: 0.5209
 epoch: 30, train_loss: 0.6543, test_loss: 1.0710, test_f1: 0.5798
 epoch: 31, train_loss: 0.6205, test_loss: 1.1966, test_f1: 0.5680
 epoch: 32, train_loss: 0.6521, test_loss: 1.2795, test_f1: 0.5590
 epoch: 33, train_loss: 0.6589, test_loss: 1.0307, test_f1: 0.5957
 epoch: 34, train_loss: 0.6012, test_loss: 1.3229, test_f1: 0.5389
 epoch: 35, train_loss: 0.6278, test_loss: 1.3800, test_f1: 0.5273
 epoch: 36, train_loss: 0.6343, test_loss: 1.4544, test_f1: 0.5378
 epoch: 37, train_loss: 0.6423, test_loss: 1.2646, test_f1: 0.5418
 epoch: 38, train_loss: 0.6304, test_loss: 1.4619, test_f1: 0.5429
 epoch: 39, train_loss: 0.6118, test_loss: 1.4519, test_f1: 0.5468
 epoch: 40, train_loss: 0.5988, test_loss: 1.5902, test_f1: 0.5389
 epoch: 41, train_loss: 0.6020, test_loss: 1.4274, test_f1: 0.5788
 epoch: 42, train_loss: 0.5799, test_loss: 1.2332, test_f1: 0.5810
 epoch: 43, train_loss: 0.5794, test_loss: 1.1599, test_f1: 0.5843
 epoch: 44, train_loss: 0.5678, test_loss: 1.6060, test_f1: 0.5059
 epoch: 45, train_loss: 0.6042, test_loss: 1.8053, test_f1: 0.4533
 epoch: 46, train_loss: 0.6106, test_loss: 1.4676, test_f1: 0.5250
 epoch: 47, train_loss: 0.5867, test_loss: 1.7084, test_f1: 0.4494
 epoch: 48, train_loss: 0.5862, test_loss: 1.2328, test_f1: 0.5883
 epoch: 49, train_loss: 0.5390, test_loss: 1.3033, test_f1: 0.6022
 epoch: 50, train_loss: 0.5738, test_loss: 1.2498, test_f1: 0.6000
 epoch: 51, train_loss: 0.5280, test_loss: 1.5182, test_f1: 0.5685
 epoch: 52, train_loss: 0.5099, test_loss: 1.5276, test_f1: 0.5930
 epoch: 53, train_loss: 0.4970, test_loss: 1.3397, test_f1: 0.5766
 epoch: 54, train_loss: 0.4953, test_loss: 1.4571, test_f1: 0.5740
 epoch: 55, train_loss: 0.4569, test_loss: 1.3789, test_f1: 0.5855
 epoch: 56, train_loss: 0.4922, test_loss: 1.4856, test_f1: 0.5888
 epoch: 57, train_loss: 0.4626, test_loss: 1.5967, test_f1: 0.5727
 epoch: 58, train_loss: 0.4423, test_loss: 1.5230, test_f1: 0.6154
 epoch: 59, train_loss: 0.4799, test_loss: 1.3553, test_f1: 0.6388
 epoch: 60, train_loss: 0.4681, test_loss: 1.4123, test_f1: 0.6263
 epoch: 61, train_loss: 0.4666, test_loss: 1.5416, test_f1: 0.6060
 epoch: 62, train_loss: 0.4409, test_loss: 1.6231, test_f1: 0.6205
 epoch: 63, train_loss: 0.4606, test_loss: 1.3774, test_f1: 0.6211
 epoch: 64, train_loss: 0.4572, test_loss: 1.6726, test_f1: 0.5953
 epoch: 65, train_loss: 0.4587, test_loss: 1.4602, test_f1: 0.6302
 epoch: 66, train_loss: 0.4480, test_loss: 1.5393, test_f1: 0.6106
 epoch: 67, train_loss: 0.4447, test_loss: 1.6455, test_f1: 0.5500
 epoch: 68, train_loss: 0.4160, test_loss: 1.5900, test_f1: 0.6380
 epoch: 69, train_loss: 0.4245, test_loss: 1.5557, test_f1: 0.6179
 epoch: 70, train_loss: 0.4239, test_loss: 1.6293, test_f1: 0.6115
 epoch: 71, train_loss: 0.4075, test_loss: 1.6388, test_f1: 0.6003
 epoch: 72, train_loss: 0.4213, test_loss: 1.7586, test_f1: 0.6158
 epoch: 73, train_loss: 0.3898, test_loss: 1.5645, test_f1: 0.5713
 epoch: 74, train_loss: 0.3998, test_loss: 1.7843, test_f1: 0.5906
 epoch: 75, train_loss: 0.4487, test_loss: 2.3617, test_f1: 0.5551
 epoch: 76, train_loss: 0.4321, test_loss: 1.5876, test_f1: 0.6236
 epoch: 77, train_loss: 0.4227, test_loss: 1.7554, test_f1: 0.5706
 epoch: 78, train_loss: 0.3956, test_loss: 1.7054, test_f1: 0.6018
 epoch: 79, train_loss: 0.3990, test_loss: 1.5383, test_f1: 0.6443
 epoch: 80, train_loss: 0.4017, test_loss: 1.7190, test_f1: 0.5996
 epoch: 81, train_loss: 0.4253, test_loss: 1.5609, test_f1: 0.6138
 epoch: 82, train_loss: 0.3960, test_loss: 1.7900, test_f1: 0.5933
 epoch: 83, train_loss: 0.3860, test_loss: 1.5793, test_f1: 0.6297
 epoch: 84, train_loss: 0.4030, test_loss: 1.6785, test_f1: 0.5580
 epoch: 85, train_loss: 0.4199, test_loss: 1.5994, test_f1: 0.6301
 epoch: 86, train_loss: 0.4202, test_loss: 1.6602, test_f1: 0.5561
 epoch: 87, train_loss: 0.3833, test_loss: 1.7298, test_f1: 0.6213
 epoch: 88, train_loss: 0.3706, test_loss: 1.8273, test_f1: 0.6032
 epoch: 89, train_loss: 0.3902, test_loss: 1.7050, test_f1: 0.6089
 epoch: 90, train_loss: 0.4150, test_loss: 1.6427, test_f1: 0.6021
 epoch: 91, train_loss: 0.3788, test_loss: 1.7244, test_f1: 0.6567
 epoch: 92, train_loss: 0.4044, test_loss: 1.7223, test_f1: 0.6191
 epoch: 93, train_loss: 0.4065, test_loss: 1.5857, test_f1: 0.6269
 epoch: 94, train_loss: 0.3595, test_loss: 1.6076, test_f1: 0.6484
 epoch: 95, train_loss: 0.3923, test_loss: 2.1372, test_f1: 0.5715
 epoch: 96, train_loss: 0.3912, test_loss: 1.6197, test_f1: 0.6550
 epoch: 97, train_loss: 0.3797, test_loss: 1.6551, test_f1: 0.6239
 epoch: 98, train_loss: 0.3921, test_loss: 1.7068, test_f1: 0.6397
 epoch: 99, train_loss: 0.3901, test_loss: 1.7531, test_f1: 0.6419
##################ITERATION #6 ****************************************
 epoch: 0, train_loss: 1.1848, test_loss: 1.2002, test_f1: 0.4665
 epoch: 1, train_loss: 1.0102, test_loss: 1.3383, test_f1: 0.3340
 epoch: 2, train_loss: 0.9311, test_loss: 0.9879, test_f1: 0.5232
 epoch: 3, train_loss: 0.9024, test_loss: 1.0268, test_f1: 0.5354
 epoch: 4, train_loss: 0.8833, test_loss: 1.2529, test_f1: 0.4510
 epoch: 5, train_loss: 0.8742, test_loss: 1.0011, test_f1: 0.5347
 epoch: 6, train_loss: 0.8466, test_loss: 0.9783, test_f1: 0.5450
 epoch: 7, train_loss: 0.8233, test_loss: 1.1252, test_f1: 0.5175
 epoch: 8, train_loss: 0.8407, test_loss: 0.9864, test_f1: 0.5131
 epoch: 9, train_loss: 0.8272, test_loss: 1.0269, test_f1: 0.5377
 epoch: 10, train_loss: 0.8220, test_loss: 1.0479, test_f1: 0.5275
 epoch: 11, train_loss: 0.7812, test_loss: 2.1586, test_f1: 0.3736
 epoch: 12, train_loss: 0.8190, test_loss: 1.0159, test_f1: 0.5888
 epoch: 13, train_loss: 0.7708, test_loss: 1.0248, test_f1: 0.5606
 epoch: 14, train_loss: 0.7832, test_loss: 0.9848, test_f1: 0.5878
 epoch: 15, train_loss: 0.8123, test_loss: 1.0311, test_f1: 0.5652
 epoch: 16, train_loss: 0.7701, test_loss: 0.9498, test_f1: 0.5919
 epoch: 17, train_loss: 0.7741, test_loss: 0.9925, test_f1: 0.5943
 epoch: 18, train_loss: 0.7452, test_loss: 1.0493, test_f1: 0.5321
 epoch: 19, train_loss: 0.7373, test_loss: 1.1218, test_f1: 0.5269
 epoch: 20, train_loss: 0.7663, test_loss: 1.0022, test_f1: 0.5663
 epoch: 21, train_loss: 0.7503, test_loss: 1.0428, test_f1: 0.5743
 epoch: 22, train_loss: 0.7371, test_loss: 1.0275, test_f1: 0.4622
 epoch: 23, train_loss: 0.7321, test_loss: 1.0652, test_f1: 0.5718
 epoch: 24, train_loss: 0.7325, test_loss: 0.9795, test_f1: 0.5951
 epoch: 25, train_loss: 0.7363, test_loss: 1.0729, test_f1: 0.5181
 epoch: 26, train_loss: 0.7290, test_loss: 1.1170, test_f1: 0.4938
 epoch: 27, train_loss: 0.7070, test_loss: 1.2543, test_f1: 0.4914
 epoch: 28, train_loss: 0.7433, test_loss: 1.0438, test_f1: 0.5520
 epoch: 29, train_loss: 0.7095, test_loss: 1.2388, test_f1: 0.5027
 epoch: 30, train_loss: 0.7324, test_loss: 1.6151, test_f1: 0.4822
 epoch: 31, train_loss: 0.6841, test_loss: 1.0351, test_f1: 0.5214
 epoch: 32, train_loss: 0.6784, test_loss: 1.0364, test_f1: 0.5577
 epoch: 33, train_loss: 0.6759, test_loss: 1.2339, test_f1: 0.4991
 epoch: 34, train_loss: 0.6903, test_loss: 1.1729, test_f1: 0.5381
 epoch: 35, train_loss: 0.6698, test_loss: 1.1469, test_f1: 0.5477
 epoch: 36, train_loss: 0.6967, test_loss: 1.0464, test_f1: 0.5590
 epoch: 37, train_loss: 0.6892, test_loss: 1.3246, test_f1: 0.4938
 epoch: 38, train_loss: 0.6981, test_loss: 1.0636, test_f1: 0.5788
 epoch: 39, train_loss: 0.6842, test_loss: 1.2509, test_f1: 0.6075
 epoch: 40, train_loss: 0.6765, test_loss: 1.1546, test_f1: 0.5600
 epoch: 41, train_loss: 0.6449, test_loss: 1.0415, test_f1: 0.6067
 epoch: 42, train_loss: 0.6548, test_loss: 1.5435, test_f1: 0.5468
 epoch: 43, train_loss: 0.6652, test_loss: 1.0468, test_f1: 0.5785
 epoch: 44, train_loss: 0.6531, test_loss: 1.5244, test_f1: 0.5761
 epoch: 45, train_loss: 0.6417, test_loss: 1.2975, test_f1: 0.4793
 epoch: 46, train_loss: 0.6759, test_loss: 1.4246, test_f1: 0.5155
 epoch: 47, train_loss: 0.6837, test_loss: 1.0326, test_f1: 0.6174
 epoch: 48, train_loss: 0.6417, test_loss: 1.0926, test_f1: 0.6034
 epoch: 49, train_loss: 0.6380, test_loss: 1.1160, test_f1: 0.5787
 epoch: 50, train_loss: 0.6357, test_loss: 1.4572, test_f1: 0.5579
 epoch: 51, train_loss: 0.6260, test_loss: 1.0984, test_f1: 0.5852
 epoch: 52, train_loss: 0.5959, test_loss: 1.1813, test_f1: 0.6033
 epoch: 53, train_loss: 0.5495, test_loss: 1.0767, test_f1: 0.5876
 epoch: 54, train_loss: 0.5904, test_loss: 1.1373, test_f1: 0.5705
 epoch: 55, train_loss: 0.5860, test_loss: 1.2474, test_f1: 0.6374
 epoch: 56, train_loss: 0.5849, test_loss: 0.9861, test_f1: 0.6576
 epoch: 57, train_loss: 0.5468, test_loss: 1.0533, test_f1: 0.6342
 epoch: 58, train_loss: 0.5602, test_loss: 1.4207, test_f1: 0.6006
 epoch: 59, train_loss: 0.5531, test_loss: 1.2110, test_f1: 0.6059
 epoch: 60, train_loss: 0.5392, test_loss: 1.2686, test_f1: 0.5294
 epoch: 61, train_loss: 0.5409, test_loss: 1.1661, test_f1: 0.6331
 epoch: 62, train_loss: 0.5525, test_loss: 1.1345, test_f1: 0.6426
 epoch: 63, train_loss: 0.5351, test_loss: 1.2313, test_f1: 0.6060
 epoch: 64, train_loss: 0.5064, test_loss: 1.2547, test_f1: 0.6111
 epoch: 65, train_loss: 0.5470, test_loss: 1.4524, test_f1: 0.6197
 epoch: 66, train_loss: 0.5821, test_loss: 1.3696, test_f1: 0.6128
 epoch: 67, train_loss: 0.5241, test_loss: 1.2309, test_f1: 0.6293
 epoch: 68, train_loss: 0.5447, test_loss: 1.1329, test_f1: 0.6114
 epoch: 69, train_loss: 0.5351, test_loss: 1.4192, test_f1: 0.6051
 epoch: 70, train_loss: 0.5359, test_loss: 1.2609, test_f1: 0.6117
 epoch: 71, train_loss: 0.5212, test_loss: 1.2573, test_f1: 0.6285
 epoch: 72, train_loss: 0.5126, test_loss: 1.2141, test_f1: 0.6478
 epoch: 73, train_loss: 0.5176, test_loss: 1.3069, test_f1: 0.6300
 epoch: 74, train_loss: 0.5359, test_loss: 1.2707, test_f1: 0.6350
 epoch: 75, train_loss: 0.5146, test_loss: 1.1913, test_f1: 0.6147
 epoch: 76, train_loss: 0.5045, test_loss: 1.2970, test_f1: 0.5901
 epoch: 77, train_loss: 0.4943, test_loss: 1.3730, test_f1: 0.5887
 epoch: 78, train_loss: 0.5527, test_loss: 1.4783, test_f1: 0.6076
 epoch: 79, train_loss: 0.5204, test_loss: 1.1442, test_f1: 0.6589
 epoch: 80, train_loss: 0.4821, test_loss: 1.1515, test_f1: 0.6656
 epoch: 81, train_loss: 0.4767, test_loss: 1.4093, test_f1: 0.6199
 epoch: 82, train_loss: 0.4845, test_loss: 1.3228, test_f1: 0.6112
 epoch: 83, train_loss: 0.4876, test_loss: 1.2083, test_f1: 0.6226
 epoch: 84, train_loss: 0.5048, test_loss: 1.3129, test_f1: 0.6443
 epoch: 85, train_loss: 0.4698, test_loss: 1.1739, test_f1: 0.6534
 epoch: 86, train_loss: 0.4997, test_loss: 1.1227, test_f1: 0.6478
 epoch: 87, train_loss: 0.4749, test_loss: 1.3011, test_f1: 0.6148
 epoch: 88, train_loss: 0.4814, test_loss: 1.3765, test_f1: 0.6280
 epoch: 89, train_loss: 0.4451, test_loss: 1.3998, test_f1: 0.5858
 epoch: 90, train_loss: 0.4545, test_loss: 1.1430, test_f1: 0.6447
 epoch: 91, train_loss: 0.4774, test_loss: 1.3915, test_f1: 0.6077
 epoch: 92, train_loss: 0.4911, test_loss: 1.4347, test_f1: 0.6237
 epoch: 93, train_loss: 0.4648, test_loss: 1.2678, test_f1: 0.6479
 epoch: 94, train_loss: 0.4696, test_loss: 1.3006, test_f1: 0.6794
 epoch: 95, train_loss: 0.4823, test_loss: 1.1166, test_f1: 0.6690
 epoch: 96, train_loss: 0.4537, test_loss: 1.3406, test_f1: 0.6233
 epoch: 97, train_loss: 0.4437, test_loss: 1.3199, test_f1: 0.6520
 epoch: 98, train_loss: 0.4556, test_loss: 1.3948, test_f1: 0.5583
 epoch: 99, train_loss: 0.5235, test_loss: 1.6645, test_f1: 0.6277
##################ITERATION #7 ****************************************
 epoch: 0, train_loss: 1.1916, test_loss: 1.4728, test_f1: 0.1444
 epoch: 1, train_loss: 0.9980, test_loss: 1.1121, test_f1: 0.4828
 epoch: 2, train_loss: 0.9706, test_loss: 1.1724, test_f1: 0.4463
 epoch: 3, train_loss: 0.9549, test_loss: 1.0299, test_f1: 0.5384
 epoch: 4, train_loss: 0.8919, test_loss: 1.2302, test_f1: 0.4371
 epoch: 5, train_loss: 0.9035, test_loss: 1.2931, test_f1: 0.4216
 epoch: 6, train_loss: 0.8670, test_loss: 1.0410, test_f1: 0.5161
 epoch: 7, train_loss: 0.8434, test_loss: 1.1475, test_f1: 0.4896
 epoch: 8, train_loss: 0.8525, test_loss: 1.2282, test_f1: 0.5003
 epoch: 9, train_loss: 0.8360, test_loss: 0.9742, test_f1: 0.5298
 epoch: 10, train_loss: 0.8135, test_loss: 1.0342, test_f1: 0.5773
 epoch: 11, train_loss: 0.8158, test_loss: 1.4667, test_f1: 0.4726
 epoch: 12, train_loss: 0.8182, test_loss: 0.9835, test_f1: 0.5804
 epoch: 13, train_loss: 0.7991, test_loss: 1.1075, test_f1: 0.4542
 epoch: 14, train_loss: 0.7785, test_loss: 0.9801, test_f1: 0.5704
 epoch: 15, train_loss: 0.8043, test_loss: 1.3343, test_f1: 0.5393
 epoch: 16, train_loss: 0.8214, test_loss: 1.0637, test_f1: 0.5875
 epoch: 17, train_loss: 0.8094, test_loss: 0.9898, test_f1: 0.5874
 epoch: 18, train_loss: 0.7988, test_loss: 1.0505, test_f1: 0.4900
 epoch: 19, train_loss: 0.7771, test_loss: 1.1822, test_f1: 0.5541
 epoch: 20, train_loss: 0.7672, test_loss: 1.3667, test_f1: 0.5644
 epoch: 21, train_loss: 0.7651, test_loss: 0.9823, test_f1: 0.5437
 epoch: 22, train_loss: 0.7751, test_loss: 1.7611, test_f1: 0.4437
 epoch: 23, train_loss: 0.7710, test_loss: 0.9877, test_f1: 0.5505
 epoch: 24, train_loss: 0.7866, test_loss: 1.2217, test_f1: 0.5703
 epoch: 25, train_loss: 0.7554, test_loss: 1.1852, test_f1: 0.5406
 epoch: 26, train_loss: 0.7873, test_loss: 1.1480, test_f1: 0.5020
 epoch: 27, train_loss: 0.7389, test_loss: 1.2423, test_f1: 0.5702
 epoch: 28, train_loss: 0.7208, test_loss: 1.0630, test_f1: 0.6154
 epoch: 29, train_loss: 0.7176, test_loss: 1.2539, test_f1: 0.5631
 epoch: 30, train_loss: 0.7423, test_loss: 2.1166, test_f1: 0.4573
 epoch: 31, train_loss: 0.7233, test_loss: 1.1080, test_f1: 0.4909
 epoch: 32, train_loss: 0.7286, test_loss: 1.5088, test_f1: 0.5090
 epoch: 33, train_loss: 0.7282, test_loss: 1.0688, test_f1: 0.5581
 epoch: 34, train_loss: 0.7106, test_loss: 0.9985, test_f1: 0.6463
 epoch: 35, train_loss: 0.7290, test_loss: 1.1981, test_f1: 0.6066
 epoch: 36, train_loss: 0.7001, test_loss: 1.2940, test_f1: 0.5283
 epoch: 37, train_loss: 0.7380, test_loss: 1.3595, test_f1: 0.5651
 epoch: 38, train_loss: 0.7090, test_loss: 1.0005, test_f1: 0.6005
 epoch: 39, train_loss: 0.6819, test_loss: 1.2641, test_f1: 0.5639
 epoch: 40, train_loss: 0.7248, test_loss: 1.4573, test_f1: 0.4159
 epoch: 41, train_loss: 0.6667, test_loss: 1.2202, test_f1: 0.6127
 epoch: 42, train_loss: 0.6550, test_loss: 1.0149, test_f1: 0.6524
 epoch: 43, train_loss: 0.6698, test_loss: 1.1884, test_f1: 0.5825
 epoch: 44, train_loss: 0.6668, test_loss: 1.1237, test_f1: 0.5721
 epoch: 45, train_loss: 0.6907, test_loss: 1.3475, test_f1: 0.5338
 epoch: 46, train_loss: 0.6482, test_loss: 1.0235, test_f1: 0.6332
 epoch: 47, train_loss: 0.6677, test_loss: 1.0313, test_f1: 0.6384
 epoch: 48, train_loss: 0.6516, test_loss: 1.3643, test_f1: 0.5875
 epoch: 49, train_loss: 0.6243, test_loss: 1.1957, test_f1: 0.6373
 epoch: 50, train_loss: 0.6361, test_loss: 1.2289, test_f1: 0.5971
 epoch: 51, train_loss: 0.6329, test_loss: 1.2629, test_f1: 0.6059
 epoch: 52, train_loss: 0.5880, test_loss: 1.2071, test_f1: 0.6153
 epoch: 53, train_loss: 0.5756, test_loss: 1.1276, test_f1: 0.5966
 epoch: 54, train_loss: 0.5644, test_loss: 1.4509, test_f1: 0.5655
 epoch: 55, train_loss: 0.5740, test_loss: 1.2287, test_f1: 0.6107
 epoch: 56, train_loss: 0.5631, test_loss: 1.2599, test_f1: 0.5833
 epoch: 57, train_loss: 0.5645, test_loss: 1.4054, test_f1: 0.5775
 epoch: 58, train_loss: 0.5530, test_loss: 1.3729, test_f1: 0.6125
 epoch: 59, train_loss: 0.5759, test_loss: 1.2901, test_f1: 0.5810
 epoch: 60, train_loss: 0.5803, test_loss: 1.1246, test_f1: 0.6428
 epoch: 61, train_loss: 0.5860, test_loss: 1.4800, test_f1: 0.5804
 epoch: 62, train_loss: 0.5500, test_loss: 1.1761, test_f1: 0.6370
 epoch: 63, train_loss: 0.5688, test_loss: 1.1949, test_f1: 0.6398
 epoch: 64, train_loss: 0.5407, test_loss: 1.7953, test_f1: 0.6017
 epoch: 65, train_loss: 0.5650, test_loss: 1.2600, test_f1: 0.6076
 epoch: 66, train_loss: 0.5149, test_loss: 1.2689, test_f1: 0.6481
 epoch: 67, train_loss: 0.5221, test_loss: 2.0675, test_f1: 0.5648
 epoch: 68, train_loss: 0.5252, test_loss: 1.7184, test_f1: 0.6029
 epoch: 69, train_loss: 0.5419, test_loss: 1.5192, test_f1: 0.5787
 epoch: 70, train_loss: 0.5483, test_loss: 1.2370, test_f1: 0.6342
 epoch: 71, train_loss: 0.5555, test_loss: 1.1492, test_f1: 0.6708
 epoch: 72, train_loss: 0.5112, test_loss: 1.2157, test_f1: 0.6366
 epoch: 73, train_loss: 0.5177, test_loss: 1.5542, test_f1: 0.6097
 epoch: 74, train_loss: 0.5257, test_loss: 1.5627, test_f1: 0.5652
 epoch: 75, train_loss: 0.5095, test_loss: 1.4190, test_f1: 0.6236
 epoch: 76, train_loss: 0.5223, test_loss: 2.3631, test_f1: 0.5944
 epoch: 77, train_loss: 0.5067, test_loss: 1.7607, test_f1: 0.5857
 epoch: 78, train_loss: 0.5086, test_loss: 1.3643, test_f1: 0.6244
 epoch: 79, train_loss: 0.5179, test_loss: 2.3138, test_f1: 0.5881
 epoch: 80, train_loss: 0.5111, test_loss: 2.4709, test_f1: 0.5971
 epoch: 81, train_loss: 0.4970, test_loss: 1.4576, test_f1: 0.5656
 epoch: 82, train_loss: 0.5055, test_loss: 1.9074, test_f1: 0.5926
 epoch: 83, train_loss: 0.4934, test_loss: 1.4516, test_f1: 0.6024
 epoch: 84, train_loss: 0.5045, test_loss: 1.3325, test_f1: 0.6382
 epoch: 85, train_loss: 0.4926, test_loss: 2.5983, test_f1: 0.5576
 epoch: 86, train_loss: 0.5119, test_loss: 2.3556, test_f1: 0.5951
 epoch: 87, train_loss: 0.5045, test_loss: 1.6164, test_f1: 0.5874
 epoch: 88, train_loss: 0.4831, test_loss: 1.6379, test_f1: 0.5766
 epoch: 89, train_loss: 0.4927, test_loss: 2.1983, test_f1: 0.5448
 epoch: 90, train_loss: 0.4647, test_loss: 1.6700, test_f1: 0.6448
 epoch: 91, train_loss: 0.4944, test_loss: 2.2821, test_f1: 0.5855
 epoch: 92, train_loss: 0.4589, test_loss: 1.3745, test_f1: 0.6350
 epoch: 93, train_loss: 0.4909, test_loss: 2.3976, test_f1: 0.5615
 epoch: 94, train_loss: 0.4772, test_loss: 2.2083, test_f1: 0.5688
 epoch: 95, train_loss: 0.4567, test_loss: 1.6641, test_f1: 0.6020
 epoch: 96, train_loss: 0.4756, test_loss: 1.7250, test_f1: 0.6028
 epoch: 97, train_loss: 0.4830, test_loss: 1.8473, test_f1: 0.6058
 epoch: 98, train_loss: 0.4585, test_loss: 1.6644, test_f1: 0.6208
 epoch: 99, train_loss: 0.4737, test_loss: 1.9097, test_f1: 0.6070
##################ITERATION #8 ****************************************
 epoch: 0, train_loss: 1.1223, test_loss: 1.4880, test_f1: 0.2965
 epoch: 1, train_loss: 0.9434, test_loss: 1.0629, test_f1: 0.5185
 epoch: 2, train_loss: 0.9098, test_loss: 0.9731, test_f1: 0.5427
 epoch: 3, train_loss: 0.8634, test_loss: 1.0647, test_f1: 0.5094
 epoch: 4, train_loss: 0.8449, test_loss: 1.0380, test_f1: 0.5027
 epoch: 5, train_loss: 0.8290, test_loss: 1.1085, test_f1: 0.4789
 epoch: 6, train_loss: 0.8190, test_loss: 1.3159, test_f1: 0.4128
 epoch: 7, train_loss: 0.8100, test_loss: 1.4969, test_f1: 0.4534
 epoch: 8, train_loss: 0.7762, test_loss: 1.3080, test_f1: 0.4747
 epoch: 9, train_loss: 0.8017, test_loss: 1.1760, test_f1: 0.5746
 epoch: 10, train_loss: 0.7730, test_loss: 1.0488, test_f1: 0.5737
 epoch: 11, train_loss: 0.7924, test_loss: 1.7646, test_f1: 0.4803
 epoch: 12, train_loss: 0.7796, test_loss: 1.0704, test_f1: 0.5928
 epoch: 13, train_loss: 0.7672, test_loss: 1.0217, test_f1: 0.5856
 epoch: 14, train_loss: 0.7129, test_loss: 1.0680, test_f1: 0.5855
 epoch: 15, train_loss: 0.7199, test_loss: 1.7528, test_f1: 0.4593
 epoch: 16, train_loss: 0.7362, test_loss: 1.0167, test_f1: 0.5855
 epoch: 17, train_loss: 0.7298, test_loss: 1.2821, test_f1: 0.4578
 epoch: 18, train_loss: 0.7092, test_loss: 1.1518, test_f1: 0.5199
 epoch: 19, train_loss: 0.7526, test_loss: 1.0403, test_f1: 0.5997
 epoch: 20, train_loss: 0.7252, test_loss: 1.2146, test_f1: 0.5463
 epoch: 21, train_loss: 0.7103, test_loss: 1.1470, test_f1: 0.5359
 epoch: 22, train_loss: 0.7076, test_loss: 1.2135, test_f1: 0.5788
 epoch: 23, train_loss: 0.7015, test_loss: 1.0784, test_f1: 0.6034
 epoch: 24, train_loss: 0.6966, test_loss: 1.1729, test_f1: 0.4981
 epoch: 25, train_loss: 0.7270, test_loss: 1.4375, test_f1: 0.4764
 epoch: 26, train_loss: 0.6842, test_loss: 1.2657, test_f1: 0.5333
 epoch: 27, train_loss: 0.6552, test_loss: 1.1401, test_f1: 0.5773
 epoch: 28, train_loss: 0.6466, test_loss: 1.1227, test_f1: 0.5191
 epoch: 29, train_loss: 0.6653, test_loss: 1.2134, test_f1: 0.5895
 epoch: 30, train_loss: 0.6506, test_loss: 1.2276, test_f1: 0.5747
 epoch: 31, train_loss: 0.6524, test_loss: 1.1965, test_f1: 0.5713
 epoch: 32, train_loss: 0.6291, test_loss: 1.2631, test_f1: 0.5571
 epoch: 33, train_loss: 0.6259, test_loss: 1.5066, test_f1: 0.5254
 epoch: 34, train_loss: 0.6518, test_loss: 1.3066, test_f1: 0.5399
 epoch: 35, train_loss: 0.6475, test_loss: 1.3278, test_f1: 0.6024
 epoch: 36, train_loss: 0.6413, test_loss: 1.5409, test_f1: 0.5399
 epoch: 37, train_loss: 0.6431, test_loss: 1.6135, test_f1: 0.5487
 epoch: 38, train_loss: 0.6368, test_loss: 0.9958, test_f1: 0.6021
 epoch: 39, train_loss: 0.5985, test_loss: 1.2490, test_f1: 0.6086
 epoch: 40, train_loss: 0.6212, test_loss: 1.2245, test_f1: 0.5414
 epoch: 41, train_loss: 0.6106, test_loss: 1.2370, test_f1: 0.6020
 epoch: 42, train_loss: 0.6047, test_loss: 1.2765, test_f1: 0.5365
 epoch: 43, train_loss: 0.5990, test_loss: 1.3182, test_f1: 0.5857
 epoch: 44, train_loss: 0.5933, test_loss: 1.1690, test_f1: 0.5729
 epoch: 45, train_loss: 0.6073, test_loss: 1.1716, test_f1: 0.5832
 epoch: 46, train_loss: 0.6295, test_loss: 1.5092, test_f1: 0.5709
 epoch: 47, train_loss: 0.6417, test_loss: 1.1224, test_f1: 0.6230
 epoch: 48, train_loss: 0.5863, test_loss: 1.1866, test_f1: 0.5725
 epoch: 49, train_loss: 0.6000, test_loss: 1.0933, test_f1: 0.6144
 epoch: 50, train_loss: 0.5677, test_loss: 1.2177, test_f1: 0.5385
 epoch: 51, train_loss: 0.5567, test_loss: 1.2204, test_f1: 0.6122
 epoch: 52, train_loss: 0.5083, test_loss: 1.3152, test_f1: 0.5952
 epoch: 53, train_loss: 0.5255, test_loss: 1.3658, test_f1: 0.5978
 epoch: 54, train_loss: 0.4792, test_loss: 1.3129, test_f1: 0.5568
 epoch: 55, train_loss: 0.5018, test_loss: 1.3661, test_f1: 0.5719
 epoch: 56, train_loss: 0.4977, test_loss: 1.2258, test_f1: 0.5917
 epoch: 57, train_loss: 0.4897, test_loss: 1.3900, test_f1: 0.5771
 epoch: 58, train_loss: 0.5049, test_loss: 1.3701, test_f1: 0.5773
 epoch: 59, train_loss: 0.4779, test_loss: 1.2293, test_f1: 0.6228
 epoch: 60, train_loss: 0.5023, test_loss: 1.3839, test_f1: 0.6145
 epoch: 61, train_loss: 0.4573, test_loss: 1.2671, test_f1: 0.5934
 epoch: 62, train_loss: 0.4707, test_loss: 1.2356, test_f1: 0.6344
 epoch: 63, train_loss: 0.4846, test_loss: 1.4507, test_f1: 0.5894
 epoch: 64, train_loss: 0.4569, test_loss: 1.5006, test_f1: 0.6084
 epoch: 65, train_loss: 0.4554, test_loss: 1.3674, test_f1: 0.6102
 epoch: 66, train_loss: 0.4301, test_loss: 1.4139, test_f1: 0.6126
 epoch: 67, train_loss: 0.4995, test_loss: 1.3883, test_f1: 0.5553
 epoch: 68, train_loss: 0.4506, test_loss: 1.5915, test_f1: 0.5781
 epoch: 69, train_loss: 0.4353, test_loss: 1.5699, test_f1: 0.5998
 epoch: 70, train_loss: 0.4564, test_loss: 1.4433, test_f1: 0.5950
 epoch: 71, train_loss: 0.4558, test_loss: 1.2015, test_f1: 0.6311
 epoch: 72, train_loss: 0.4345, test_loss: 1.4830, test_f1: 0.5645
 epoch: 73, train_loss: 0.4512, test_loss: 1.3893, test_f1: 0.6397
 epoch: 74, train_loss: 0.4444, test_loss: 1.4100, test_f1: 0.6234
 epoch: 75, train_loss: 0.4370, test_loss: 1.3191, test_f1: 0.6313
 epoch: 76, train_loss: 0.4375, test_loss: 1.5627, test_f1: 0.6010
 epoch: 77, train_loss: 0.4208, test_loss: 1.6265, test_f1: 0.5762
 epoch: 78, train_loss: 0.4388, test_loss: 1.4315, test_f1: 0.5743
 epoch: 79, train_loss: 0.4472, test_loss: 1.2964, test_f1: 0.6077
 epoch: 80, train_loss: 0.4335, test_loss: 1.7513, test_f1: 0.5392
 epoch: 81, train_loss: 0.4138, test_loss: 1.4150, test_f1: 0.5793
 epoch: 82, train_loss: 0.4317, test_loss: 1.5873, test_f1: 0.5967
 epoch: 83, train_loss: 0.4562, test_loss: 1.4774, test_f1: 0.5855
 epoch: 84, train_loss: 0.4289, test_loss: 1.5397, test_f1: 0.6157
 epoch: 85, train_loss: 0.4196, test_loss: 1.5261, test_f1: 0.6084
 epoch: 86, train_loss: 0.3939, test_loss: 1.3955, test_f1: 0.6175
 epoch: 87, train_loss: 0.4410, test_loss: 1.5959, test_f1: 0.6079
 epoch: 88, train_loss: 0.4409, test_loss: 1.6270, test_f1: 0.5991
 epoch: 89, train_loss: 0.4127, test_loss: 1.5823, test_f1: 0.6097
 epoch: 90, train_loss: 0.4218, test_loss: 1.5076, test_f1: 0.6106
 epoch: 91, train_loss: 0.4105, test_loss: 1.5959, test_f1: 0.5995
 epoch: 92, train_loss: 0.4078, test_loss: 1.4502, test_f1: 0.6020
 epoch: 93, train_loss: 0.4359, test_loss: 1.4367, test_f1: 0.5971
 epoch: 94, train_loss: 0.4162, test_loss: 1.5003, test_f1: 0.6072
 epoch: 95, train_loss: 0.3845, test_loss: 1.5604, test_f1: 0.6170
 epoch: 96, train_loss: 0.3997, test_loss: 1.7231, test_f1: 0.5570
 epoch: 97, train_loss: 0.3918, test_loss: 1.6807, test_f1: 0.5826
 epoch: 98, train_loss: 0.3976, test_loss: 1.6125, test_f1: 0.5923
 epoch: 99, train_loss: 0.3609, test_loss: 1.5864, test_f1: 0.6248
##################ITERATION #9 ****************************************
 epoch: 0, train_loss: 1.1616, test_loss: 1.3025, test_f1: 0.2281
 epoch: 1, train_loss: 0.9792, test_loss: 1.4311, test_f1: 0.2387
 epoch: 2, train_loss: 0.9161, test_loss: 0.9885, test_f1: 0.4724
 epoch: 3, train_loss: 0.9123, test_loss: 0.9826, test_f1: 0.5283
 epoch: 4, train_loss: 0.8574, test_loss: 1.1718, test_f1: 0.3955
 epoch: 5, train_loss: 0.8635, test_loss: 1.0860, test_f1: 0.4882
 epoch: 6, train_loss: 0.8674, test_loss: 0.9503, test_f1: 0.5481
 epoch: 7, train_loss: 0.8507, test_loss: 1.0892, test_f1: 0.4840
 epoch: 8, train_loss: 0.8430, test_loss: 1.0632, test_f1: 0.5540
 epoch: 9, train_loss: 0.8184, test_loss: 1.1046, test_f1: 0.5119
 epoch: 10, train_loss: 0.8162, test_loss: 1.4036, test_f1: 0.4079
 epoch: 11, train_loss: 0.8202, test_loss: 1.0538, test_f1: 0.5153
 epoch: 12, train_loss: 0.7889, test_loss: 1.1697, test_f1: 0.4570
 epoch: 13, train_loss: 0.8040, test_loss: 1.0935, test_f1: 0.5451
 epoch: 14, train_loss: 0.7942, test_loss: 1.2868, test_f1: 0.4894
 epoch: 15, train_loss: 0.7805, test_loss: 1.3789, test_f1: 0.5247
 epoch: 16, train_loss: 0.7510, test_loss: 1.0571, test_f1: 0.5728
 epoch: 17, train_loss: 0.7704, test_loss: 1.1058, test_f1: 0.5933
 epoch: 18, train_loss: 0.7591, test_loss: 1.1169, test_f1: 0.5245
 epoch: 19, train_loss: 0.7665, test_loss: 1.1971, test_f1: 0.5267
 epoch: 20, train_loss: 0.7936, test_loss: 1.2978, test_f1: 0.4947
 epoch: 21, train_loss: 0.7581, test_loss: 1.1589, test_f1: 0.5415
 epoch: 22, train_loss: 0.7615, test_loss: 1.2425, test_f1: 0.5610
 epoch: 23, train_loss: 0.7292, test_loss: 1.1925, test_f1: 0.5528
 epoch: 24, train_loss: 0.7057, test_loss: 1.6429, test_f1: 0.5646
 epoch: 25, train_loss: 0.7671, test_loss: 1.5696, test_f1: 0.5009
 epoch: 26, train_loss: 0.7600, test_loss: 1.2997, test_f1: 0.4602
 epoch: 27, train_loss: 0.7611, test_loss: 1.2574, test_f1: 0.5081
 epoch: 28, train_loss: 0.7438, test_loss: 1.2814, test_f1: 0.5551
 epoch: 29, train_loss: 0.7308, test_loss: 1.1169, test_f1: 0.5663
 epoch: 30, train_loss: 0.7375, test_loss: 1.2530, test_f1: 0.5623
 epoch: 31, train_loss: 0.6838, test_loss: 1.4256, test_f1: 0.5904
 epoch: 32, train_loss: 0.6893, test_loss: 1.1992, test_f1: 0.5496
 epoch: 33, train_loss: 0.6967, test_loss: 1.2016, test_f1: 0.5632
 epoch: 34, train_loss: 0.6934, test_loss: 1.2876, test_f1: 0.5563
 epoch: 35, train_loss: 0.6800, test_loss: 1.3870, test_f1: 0.5292
 epoch: 36, train_loss: 0.6848, test_loss: 1.1116, test_f1: 0.5500
 epoch: 37, train_loss: 0.6603, test_loss: 1.2994, test_f1: 0.5721
 epoch: 38, train_loss: 0.6358, test_loss: 1.2428, test_f1: 0.5211
 epoch: 39, train_loss: 0.6461, test_loss: 1.5491, test_f1: 0.5505
 epoch: 40, train_loss: 0.6352, test_loss: 1.3079, test_f1: 0.5548
 epoch: 41, train_loss: 0.6656, test_loss: 1.1628, test_f1: 0.5328
 epoch: 42, train_loss: 0.6610, test_loss: 1.2212, test_f1: 0.5726
 epoch: 43, train_loss: 0.6351, test_loss: 1.1498, test_f1: 0.5475
 epoch: 44, train_loss: 0.6463, test_loss: 1.9078, test_f1: 0.5097
 epoch: 45, train_loss: 0.6755, test_loss: 1.0469, test_f1: 0.6163
 epoch: 46, train_loss: 0.6705, test_loss: 1.2676, test_f1: 0.5042
 epoch: 47, train_loss: 0.6187, test_loss: 1.0705, test_f1: 0.6033
 epoch: 48, train_loss: 0.5938, test_loss: 1.1511, test_f1: 0.6098
 epoch: 49, train_loss: 0.6307, test_loss: 1.2481, test_f1: 0.5707
 epoch: 50, train_loss: 0.6500, test_loss: 1.1843, test_f1: 0.5753
 epoch: 51, train_loss: 0.5847, test_loss: 1.3274, test_f1: 0.5731
 epoch: 52, train_loss: 0.5607, test_loss: 1.2337, test_f1: 0.5563
 epoch: 53, train_loss: 0.5419, test_loss: 1.7228, test_f1: 0.5696
 epoch: 54, train_loss: 0.5651, test_loss: 1.4270, test_f1: 0.5737
 epoch: 55, train_loss: 0.5398, test_loss: 1.6374, test_f1: 0.5898
 epoch: 56, train_loss: 0.5485, test_loss: 1.5534, test_f1: 0.5087
 epoch: 57, train_loss: 0.5595, test_loss: 1.5906, test_f1: 0.5602
 epoch: 58, train_loss: 0.5390, test_loss: 1.4876, test_f1: 0.5713
 epoch: 59, train_loss: 0.5421, test_loss: 1.9063, test_f1: 0.5696
 epoch: 60, train_loss: 0.5348, test_loss: 1.4825, test_f1: 0.5574
 epoch: 61, train_loss: 0.5193, test_loss: 1.7732, test_f1: 0.5849
 epoch: 62, train_loss: 0.5473, test_loss: 1.5721, test_f1: 0.5759
 epoch: 63, train_loss: 0.5445, test_loss: 2.3291, test_f1: 0.5377
 epoch: 64, train_loss: 0.5211, test_loss: 1.4295, test_f1: 0.5243
 epoch: 65, train_loss: 0.5325, test_loss: 1.7010, test_f1: 0.6051
 epoch: 66, train_loss: 0.5053, test_loss: 1.4545, test_f1: 0.5592
 epoch: 67, train_loss: 0.5215, test_loss: 2.1551, test_f1: 0.5855
 epoch: 68, train_loss: 0.5032, test_loss: 2.0677, test_f1: 0.5703
 epoch: 69, train_loss: 0.5134, test_loss: 2.0405, test_f1: 0.5545
 epoch: 70, train_loss: 0.5092, test_loss: 1.7172, test_f1: 0.5691
 epoch: 71, train_loss: 0.5053, test_loss: 1.5543, test_f1: 0.6082
 epoch: 72, train_loss: 0.4750, test_loss: 1.6762, test_f1: 0.6244
 epoch: 73, train_loss: 0.4919, test_loss: 1.3722, test_f1: 0.5655
 epoch: 74, train_loss: 0.5140, test_loss: 1.8260, test_f1: 0.5986
 epoch: 75, train_loss: 0.5039, test_loss: 1.6023, test_f1: 0.5013
 epoch: 76, train_loss: 0.4782, test_loss: 1.5268, test_f1: 0.5567
 epoch: 77, train_loss: 0.4593, test_loss: 1.6511, test_f1: 0.5688
 epoch: 78, train_loss: 0.4858, test_loss: 1.4574, test_f1: 0.6261
 epoch: 79, train_loss: 0.4929, test_loss: 1.8802, test_f1: 0.5471
 epoch: 80, train_loss: 0.5072, test_loss: 1.6042, test_f1: 0.5805
 epoch: 81, train_loss: 0.4755, test_loss: 1.4716, test_f1: 0.5571
 epoch: 82, train_loss: 0.5072, test_loss: 1.4440, test_f1: 0.5898
 epoch: 83, train_loss: 0.4677, test_loss: 1.5216, test_f1: 0.5919
 epoch: 84, train_loss: 0.4821, test_loss: 1.7962, test_f1: 0.5767
 epoch: 85, train_loss: 0.4681, test_loss: 1.4167, test_f1: 0.6042
 epoch: 86, train_loss: 0.5187, test_loss: 1.7568, test_f1: 0.5393
 epoch: 87, train_loss: 0.4653, test_loss: 1.4610, test_f1: 0.5992
 epoch: 88, train_loss: 0.4711, test_loss: 1.4745, test_f1: 0.5805
 epoch: 89, train_loss: 0.4915, test_loss: 1.4385, test_f1: 0.5999
 epoch: 90, train_loss: 0.4517, test_loss: 1.5335, test_f1: 0.6043
 epoch: 91, train_loss: 0.4437, test_loss: 1.3217, test_f1: 0.6043
 epoch: 92, train_loss: 0.4903, test_loss: 1.6698, test_f1: 0.5694
 epoch: 93, train_loss: 0.4662, test_loss: 1.9527, test_f1: 0.5742
 epoch: 94, train_loss: 0.4714, test_loss: 1.6028, test_f1: 0.5788
 epoch: 95, train_loss: 0.4818, test_loss: 1.6327, test_f1: 0.5995
 epoch: 96, train_loss: 0.4462, test_loss: 1.5970, test_f1: 0.5922
 epoch: 97, train_loss: 0.4517, test_loss: 1.5096, test_f1: 0.5344
 epoch: 98, train_loss: 0.4794, test_loss: 1.7799, test_f1: 0.6351
 epoch: 99, train_loss: 0.4930, test_loss: 1.4913, test_f1: 0.5359

Training completed in 598.29 seconds
Best F1: 0.6854 at epoch 90
Mean F1 across iterations: 0.6639  0.0164
========================FINAL RESULTS================================
FEGIN weighted F1: 0.6854  0.0164
python main.py --data ltspice_demos --representation component_pin_net --model FEGIN --layers 3 --hiddens 32 --batch_size 64 --lr 0.01 --emb_size 512 --epochs 100 --save_appendix component_pin_net_L3_H32_BS64_LR0.01_E512 --no_val
-----



STDERR:
  File "main.py", line 370, in <module>
    main()
  File "main.py", line 254, in main
    dataset = dataset_class(
  File "/home/philip/projects/ltspice_examples_code_repo/Circuit-Completion-Using-GNNs/component_classification_with_link_prediction_head/evaluation/FEGIN/kernel/circuit_datasets.py", line 15, in __init__
    self.data, self.slices = torch.load(self.processed_paths[0])
  File "/home/philip/.local/lib/python3.8/site-packages/torch/serialization.py", line 1040, in load
    warnings.warn(
  File "/usr/lib/python3.8/warnings.py", line 109, in _showwarnmsg
    sw(msg.message, msg.category, msg.filename, msg.lineno,
  File "main.py", line 47, in warn_with_traceback
    traceback.print_stack(file=log)
/home/philip/projects/ltspice_examples_code_repo/Circuit-Completion-Using-GNNs/component_classification_with_link_prediction_head/evaluation/FEGIN/kernel/circuit_datasets.py:15: FutureWarning: You are using `torch.load` with `weights_only=False` (the current default value), which uses the default pickle module implicitly. It is possible to construct malicious pickle data which will execute arbitrary code during unpickling (See https://github.com/pytorch/pytorch/blob/main/SECURITY.md#untrusted-models for more details). In a future release, the default value for `weights_only` will be flipped to `True`. This limits the functions that could be executed during unpickling. Arbitrary objects will no longer be allowed to be loaded via this mode unless they are explicitly allowlisted by the user via `torch.serialization.add_safe_globals`. We recommend you start setting `weights_only=True` for any use case where you don't have full control of the loaded file. Please open an issue on GitHub for any issues related to this experimental feature.
  self.data, self.slices = torch.load(self.processed_paths[0])
