STDOUT:
Results will be saved in /home/philip/projects/ltspice_examples_code_repo/Circuit-Completion-Using-GNNs/component_classification_with_link_prediction_head/evaluation/FEGIN/results/model_FEGIN_dataset_ltspice_examples
Command line input: python main.py --data ltspice_examples --representation component_component --model FEGIN --layers 5 --hiddens 16 --batch_size 64 --lr 0.0001 --emb_size 128 --epochs 100 --save_appendix component_component_L5_H16_BS64_LR0.0001_E128 --no_val
 is saved.
-----
ltspice_examples - FEGIN
Using 5 layers, 16 hidden units, h = 2
Loading component_component representation dataset
ENTERED
Training FEGIN on component_component representation
Train: 3556, Test: 845
##################ITERATION #0 ****************************************
 epoch: 0, train_loss: 1.4169, test_loss: 1.4148, test_f1: 0.0295
 epoch: 1, train_loss: 1.4097, test_loss: 1.4094, test_f1: 0.0295
 epoch: 2, train_loss: 1.4043, test_loss: 1.4048, test_f1: 0.0295
 epoch: 3, train_loss: 1.3991, test_loss: 1.3990, test_f1: 0.0295
 epoch: 4, train_loss: 1.3931, test_loss: 1.3930, test_f1: 0.0455
 epoch: 5, train_loss: 1.3860, test_loss: 1.3860, test_f1: 0.2320
 epoch: 6, train_loss: 1.3781, test_loss: 1.3791, test_f1: 0.2269
 epoch: 7, train_loss: 1.3697, test_loss: 1.3711, test_f1: 0.2227
 epoch: 8, train_loss: 1.3621, test_loss: 1.3639, test_f1: 0.2252
 epoch: 9, train_loss: 1.3505, test_loss: 1.3526, test_f1: 0.2253
 epoch: 10, train_loss: 1.3419, test_loss: 1.3454, test_f1: 0.2266
 epoch: 11, train_loss: 1.3338, test_loss: 1.3372, test_f1: 0.2274
 epoch: 12, train_loss: 1.3290, test_loss: 1.3294, test_f1: 0.2274
 epoch: 13, train_loss: 1.3204, test_loss: 1.3242, test_f1: 0.2274
 epoch: 14, train_loss: 1.3173, test_loss: 1.3189, test_f1: 0.2274
 epoch: 15, train_loss: 1.3103, test_loss: 1.3137, test_f1: 0.2274
 epoch: 16, train_loss: 1.3059, test_loss: 1.3087, test_f1: 0.2274
 epoch: 17, train_loss: 1.3022, test_loss: 1.3043, test_f1: 0.2274
 epoch: 18, train_loss: 1.3001, test_loss: 1.3005, test_f1: 0.2274
 epoch: 19, train_loss: 1.2959, test_loss: 1.2973, test_f1: 0.2274
 epoch: 20, train_loss: 1.2948, test_loss: 1.2934, test_f1: 0.2274
 epoch: 21, train_loss: 1.2910, test_loss: 1.2890, test_f1: 0.2274
 epoch: 22, train_loss: 1.2875, test_loss: 1.2841, test_f1: 0.2274
 epoch: 23, train_loss: 1.2855, test_loss: 1.2840, test_f1: 0.2274
 epoch: 24, train_loss: 1.2816, test_loss: 1.2808, test_f1: 0.2274
 epoch: 25, train_loss: 1.2821, test_loss: 1.2787, test_f1: 0.2274
 epoch: 26, train_loss: 1.2781, test_loss: 1.2754, test_f1: 0.2274
 epoch: 27, train_loss: 1.2750, test_loss: 1.2728, test_f1: 0.2274
 epoch: 28, train_loss: 1.2751, test_loss: 1.2692, test_f1: 0.2274
 epoch: 29, train_loss: 1.2714, test_loss: 1.2695, test_f1: 0.2274
 epoch: 30, train_loss: 1.2691, test_loss: 1.2649, test_f1: 0.2274
 epoch: 31, train_loss: 1.2679, test_loss: 1.2646, test_f1: 0.2274
 epoch: 32, train_loss: 1.2678, test_loss: 1.2594, test_f1: 0.2274
 epoch: 33, train_loss: 1.2630, test_loss: 1.2560, test_f1: 0.2274
 epoch: 34, train_loss: 1.2608, test_loss: 1.2575, test_f1: 0.2274
 epoch: 35, train_loss: 1.2597, test_loss: 1.2525, test_f1: 0.2274
 epoch: 36, train_loss: 1.2584, test_loss: 1.2485, test_f1: 0.2274
 epoch: 37, train_loss: 1.2557, test_loss: 1.2453, test_f1: 0.2274
 epoch: 38, train_loss: 1.2588, test_loss: 1.2446, test_f1: 0.2274
 epoch: 39, train_loss: 1.2467, test_loss: 1.2414, test_f1: 0.2274
 epoch: 40, train_loss: 1.2476, test_loss: 1.2393, test_f1: 0.2274
 epoch: 41, train_loss: 1.2481, test_loss: 1.2374, test_f1: 0.2274
 epoch: 42, train_loss: 1.2441, test_loss: 1.2322, test_f1: 0.2274
 epoch: 43, train_loss: 1.2426, test_loss: 1.2305, test_f1: 0.2274
 epoch: 44, train_loss: 1.2431, test_loss: 1.2286, test_f1: 0.2274
 epoch: 45, train_loss: 1.2405, test_loss: 1.2255, test_f1: 0.2274
 epoch: 46, train_loss: 1.2378, test_loss: 1.2234, test_f1: 0.2274
 epoch: 47, train_loss: 1.2376, test_loss: 1.2192, test_f1: 0.2274
 epoch: 48, train_loss: 1.2402, test_loss: 1.2170, test_f1: 0.2274
 epoch: 49, train_loss: 1.2335, test_loss: 1.2147, test_f1: 0.2300
 epoch: 50, train_loss: 1.2292, test_loss: 1.2127, test_f1: 0.2401
 epoch: 51, train_loss: 1.2295, test_loss: 1.2137, test_f1: 0.2497
 epoch: 52, train_loss: 1.2282, test_loss: 1.2110, test_f1: 0.2544
 epoch: 53, train_loss: 1.2304, test_loss: 1.2090, test_f1: 0.2497
 epoch: 54, train_loss: 1.2276, test_loss: 1.2076, test_f1: 0.2545
 epoch: 55, train_loss: 1.2256, test_loss: 1.2090, test_f1: 0.2614
 epoch: 56, train_loss: 1.2244, test_loss: 1.2068, test_f1: 0.2703
 epoch: 57, train_loss: 1.2296, test_loss: 1.2083, test_f1: 0.2613
 epoch: 58, train_loss: 1.2219, test_loss: 1.2024, test_f1: 0.2681
 epoch: 59, train_loss: 1.2184, test_loss: 1.2027, test_f1: 0.2857
 epoch: 60, train_loss: 1.2165, test_loss: 1.2023, test_f1: 0.2882
 epoch: 61, train_loss: 1.2184, test_loss: 1.1994, test_f1: 0.2882
 epoch: 62, train_loss: 1.2198, test_loss: 1.1985, test_f1: 0.3121
 epoch: 63, train_loss: 1.2159, test_loss: 1.1961, test_f1: 0.3133
 epoch: 64, train_loss: 1.2160, test_loss: 1.1974, test_f1: 0.3114
 epoch: 65, train_loss: 1.2215, test_loss: 1.1959, test_f1: 0.3322
 epoch: 66, train_loss: 1.2160, test_loss: 1.1959, test_f1: 0.3692
 epoch: 67, train_loss: 1.2145, test_loss: 1.1960, test_f1: 0.3687
 epoch: 68, train_loss: 1.2129, test_loss: 1.1924, test_f1: 0.3876
 epoch: 69, train_loss: 1.2105, test_loss: 1.1912, test_f1: 0.3823
 epoch: 70, train_loss: 1.2122, test_loss: 1.1926, test_f1: 0.3936
 epoch: 71, train_loss: 1.2171, test_loss: 1.1896, test_f1: 0.3888
 epoch: 72, train_loss: 1.2174, test_loss: 1.1917, test_f1: 0.3964
 epoch: 73, train_loss: 1.2095, test_loss: 1.1885, test_f1: 0.4098
 epoch: 74, train_loss: 1.2151, test_loss: 1.1899, test_f1: 0.4037
 epoch: 75, train_loss: 1.2112, test_loss: 1.1863, test_f1: 0.4126
 epoch: 76, train_loss: 1.2079, test_loss: 1.1849, test_f1: 0.4031
 epoch: 77, train_loss: 1.2140, test_loss: 1.1863, test_f1: 0.4128
 epoch: 78, train_loss: 1.2117, test_loss: 1.1852, test_f1: 0.4110
 epoch: 79, train_loss: 1.2061, test_loss: 1.1854, test_f1: 0.4181
 epoch: 80, train_loss: 1.2073, test_loss: 1.1821, test_f1: 0.4184
 epoch: 81, train_loss: 1.2111, test_loss: 1.1829, test_f1: 0.4200
 epoch: 82, train_loss: 1.2086, test_loss: 1.1845, test_f1: 0.4224
 epoch: 83, train_loss: 1.2068, test_loss: 1.1824, test_f1: 0.4166
 epoch: 84, train_loss: 1.2083, test_loss: 1.1804, test_f1: 0.4196
 epoch: 85, train_loss: 1.2039, test_loss: 1.1781, test_f1: 0.4263
 epoch: 86, train_loss: 1.2052, test_loss: 1.1777, test_f1: 0.4196
 epoch: 87, train_loss: 1.1964, test_loss: 1.1741, test_f1: 0.4190
 epoch: 88, train_loss: 1.2005, test_loss: 1.1806, test_f1: 0.4261
 epoch: 89, train_loss: 1.2000, test_loss: 1.1772, test_f1: 0.4231
 epoch: 90, train_loss: 1.1964, test_loss: 1.1751, test_f1: 0.4266
 epoch: 91, train_loss: 1.1979, test_loss: 1.1763, test_f1: 0.4228
 epoch: 92, train_loss: 1.1931, test_loss: 1.1770, test_f1: 0.4258
 epoch: 93, train_loss: 1.1940, test_loss: 1.1717, test_f1: 0.4193
 epoch: 94, train_loss: 1.1987, test_loss: 1.1706, test_f1: 0.4251
 epoch: 95, train_loss: 1.1941, test_loss: 1.1717, test_f1: 0.4293
 epoch: 96, train_loss: 1.1933, test_loss: 1.1694, test_f1: 0.4224
 epoch: 97, train_loss: 1.1917, test_loss: 1.1717, test_f1: 0.4385
 epoch: 98, train_loss: 1.1910, test_loss: 1.1725, test_f1: 0.4255
 epoch: 99, train_loss: 1.1884, test_loss: 1.1684, test_f1: 0.4338
##################ITERATION #1 ****************************************
 epoch: 0, train_loss: 1.3490, test_loss: 1.3406, test_f1: 0.2274
 epoch: 1, train_loss: 1.3379, test_loss: 1.3313, test_f1: 0.2274
 epoch: 2, train_loss: 1.3319, test_loss: 1.3253, test_f1: 0.2274
 epoch: 3, train_loss: 1.3251, test_loss: 1.3179, test_f1: 0.2274
 epoch: 4, train_loss: 1.3178, test_loss: 1.3113, test_f1: 0.2274
 epoch: 5, train_loss: 1.3114, test_loss: 1.3048, test_f1: 0.2274
 epoch: 6, train_loss: 1.3044, test_loss: 1.3018, test_f1: 0.2274
 epoch: 7, train_loss: 1.2991, test_loss: 1.2929, test_f1: 0.2274
 epoch: 8, train_loss: 1.2950, test_loss: 1.2899, test_f1: 0.2274
 epoch: 9, train_loss: 1.2917, test_loss: 1.2836, test_f1: 0.2274
 epoch: 10, train_loss: 1.2875, test_loss: 1.2786, test_f1: 0.2274
 epoch: 11, train_loss: 1.2824, test_loss: 1.2760, test_f1: 0.2274
 epoch: 12, train_loss: 1.2801, test_loss: 1.2738, test_f1: 0.2274
 epoch: 13, train_loss: 1.2743, test_loss: 1.2682, test_f1: 0.2274
 epoch: 14, train_loss: 1.2747, test_loss: 1.2665, test_f1: 0.2274
 epoch: 15, train_loss: 1.2741, test_loss: 1.2654, test_f1: 0.2274
 epoch: 16, train_loss: 1.2719, test_loss: 1.2649, test_f1: 0.2274
 epoch: 17, train_loss: 1.2710, test_loss: 1.2651, test_f1: 0.2274
 epoch: 18, train_loss: 1.2707, test_loss: 1.2604, test_f1: 0.2274
 epoch: 19, train_loss: 1.2661, test_loss: 1.2567, test_f1: 0.2274
 epoch: 20, train_loss: 1.2650, test_loss: 1.2565, test_f1: 0.2274
 epoch: 21, train_loss: 1.2642, test_loss: 1.2549, test_f1: 0.2274
 epoch: 22, train_loss: 1.2608, test_loss: 1.2496, test_f1: 0.2274
 epoch: 23, train_loss: 1.2638, test_loss: 1.2502, test_f1: 0.2274
 epoch: 24, train_loss: 1.2606, test_loss: 1.2500, test_f1: 0.2274
 epoch: 25, train_loss: 1.2626, test_loss: 1.2478, test_f1: 0.2274
 epoch: 26, train_loss: 1.2538, test_loss: 1.2443, test_f1: 0.2274
 epoch: 27, train_loss: 1.2568, test_loss: 1.2416, test_f1: 0.2274
 epoch: 28, train_loss: 1.2565, test_loss: 1.2400, test_f1: 0.2274
 epoch: 29, train_loss: 1.2524, test_loss: 1.2396, test_f1: 0.2274
 epoch: 30, train_loss: 1.2515, test_loss: 1.2380, test_f1: 0.2274
 epoch: 31, train_loss: 1.2497, test_loss: 1.2369, test_f1: 0.2276
 epoch: 32, train_loss: 1.2463, test_loss: 1.2350, test_f1: 0.2274
 epoch: 33, train_loss: 1.2480, test_loss: 1.2316, test_f1: 0.2555
 epoch: 34, train_loss: 1.2487, test_loss: 1.2276, test_f1: 0.2555
 epoch: 35, train_loss: 1.2446, test_loss: 1.2295, test_f1: 0.2555
 epoch: 36, train_loss: 1.2435, test_loss: 1.2289, test_f1: 0.2555
 epoch: 37, train_loss: 1.2421, test_loss: 1.2269, test_f1: 0.2555
 epoch: 38, train_loss: 1.2375, test_loss: 1.2228, test_f1: 0.2556
 epoch: 39, train_loss: 1.2416, test_loss: 1.2216, test_f1: 0.2669
 epoch: 40, train_loss: 1.2371, test_loss: 1.2205, test_f1: 0.2664
 epoch: 41, train_loss: 1.2408, test_loss: 1.2220, test_f1: 0.2664
 epoch: 42, train_loss: 1.2345, test_loss: 1.2191, test_f1: 0.2688
 epoch: 43, train_loss: 1.2402, test_loss: 1.2184, test_f1: 0.2731
 epoch: 44, train_loss: 1.2343, test_loss: 1.2138, test_f1: 0.2829
 epoch: 45, train_loss: 1.2343, test_loss: 1.2158, test_f1: 0.2870
 epoch: 46, train_loss: 1.2326, test_loss: 1.2138, test_f1: 0.2913
 epoch: 47, train_loss: 1.2328, test_loss: 1.2141, test_f1: 0.2970
 epoch: 48, train_loss: 1.2333, test_loss: 1.2085, test_f1: 0.3197
 epoch: 49, train_loss: 1.2314, test_loss: 1.2068, test_f1: 0.3324
 epoch: 50, train_loss: 1.2250, test_loss: 1.2087, test_f1: 0.3401
 epoch: 51, train_loss: 1.2258, test_loss: 1.2068, test_f1: 0.3452
 epoch: 52, train_loss: 1.2273, test_loss: 1.2058, test_f1: 0.3369
 epoch: 53, train_loss: 1.2286, test_loss: 1.2048, test_f1: 0.3470
 epoch: 54, train_loss: 1.2265, test_loss: 1.2074, test_f1: 0.3459
 epoch: 55, train_loss: 1.2217, test_loss: 1.2046, test_f1: 0.3472
 epoch: 56, train_loss: 1.2248, test_loss: 1.2030, test_f1: 0.3538
 epoch: 57, train_loss: 1.2236, test_loss: 1.2005, test_f1: 0.3534
 epoch: 58, train_loss: 1.2222, test_loss: 1.2029, test_f1: 0.3592
 epoch: 59, train_loss: 1.2205, test_loss: 1.2049, test_f1: 0.3586
 epoch: 60, train_loss: 1.2222, test_loss: 1.2023, test_f1: 0.3574
 epoch: 61, train_loss: 1.2215, test_loss: 1.2020, test_f1: 0.3581
 epoch: 62, train_loss: 1.2222, test_loss: 1.2013, test_f1: 0.3607
 epoch: 63, train_loss: 1.2246, test_loss: 1.2011, test_f1: 0.3611
 epoch: 64, train_loss: 1.2170, test_loss: 1.1968, test_f1: 0.3472
 epoch: 65, train_loss: 1.2214, test_loss: 1.1990, test_f1: 0.3567
 epoch: 66, train_loss: 1.2187, test_loss: 1.1987, test_f1: 0.3585
 epoch: 67, train_loss: 1.2203, test_loss: 1.1985, test_f1: 0.3502
 epoch: 68, train_loss: 1.2210, test_loss: 1.1957, test_f1: 0.3545
 epoch: 69, train_loss: 1.2168, test_loss: 1.1936, test_f1: 0.3510
 epoch: 70, train_loss: 1.2200, test_loss: 1.1943, test_f1: 0.3450
 epoch: 71, train_loss: 1.2125, test_loss: 1.1948, test_f1: 0.3500
 epoch: 72, train_loss: 1.2150, test_loss: 1.1969, test_f1: 0.3463
 epoch: 73, train_loss: 1.2175, test_loss: 1.1948, test_f1: 0.3485
 epoch: 74, train_loss: 1.2134, test_loss: 1.1902, test_f1: 0.3475
 epoch: 75, train_loss: 1.2120, test_loss: 1.1931, test_f1: 0.3468
 epoch: 76, train_loss: 1.2103, test_loss: 1.1901, test_f1: 0.3460
 epoch: 77, train_loss: 1.2120, test_loss: 1.1908, test_f1: 0.3469
 epoch: 78, train_loss: 1.2108, test_loss: 1.1921, test_f1: 0.3440
 epoch: 79, train_loss: 1.2104, test_loss: 1.1889, test_f1: 0.3425
 epoch: 80, train_loss: 1.2089, test_loss: 1.1890, test_f1: 0.3427
 epoch: 81, train_loss: 1.2109, test_loss: 1.1882, test_f1: 0.3457
 epoch: 82, train_loss: 1.2062, test_loss: 1.1890, test_f1: 0.3405
 epoch: 83, train_loss: 1.2071, test_loss: 1.1853, test_f1: 0.3407
 epoch: 84, train_loss: 1.2097, test_loss: 1.1854, test_f1: 0.3408
 epoch: 85, train_loss: 1.2084, test_loss: 1.1864, test_f1: 0.3470
 epoch: 86, train_loss: 1.2105, test_loss: 1.1875, test_f1: 0.3491
 epoch: 87, train_loss: 1.2019, test_loss: 1.1854, test_f1: 0.3472
 epoch: 88, train_loss: 1.2057, test_loss: 1.1817, test_f1: 0.3413
 epoch: 89, train_loss: 1.2035, test_loss: 1.1828, test_f1: 0.3394
 epoch: 90, train_loss: 1.2055, test_loss: 1.1824, test_f1: 0.3441
 epoch: 91, train_loss: 1.1988, test_loss: 1.1823, test_f1: 0.3437
 epoch: 92, train_loss: 1.2085, test_loss: 1.1819, test_f1: 0.3408
 epoch: 93, train_loss: 1.2050, test_loss: 1.1850, test_f1: 0.3469
 epoch: 94, train_loss: 1.2033, test_loss: 1.1818, test_f1: 0.3442
 epoch: 95, train_loss: 1.2055, test_loss: 1.1815, test_f1: 0.3484
 epoch: 96, train_loss: 1.2065, test_loss: 1.1789, test_f1: 0.3437
 epoch: 97, train_loss: 1.2013, test_loss: 1.1793, test_f1: 0.3482
 epoch: 98, train_loss: 1.1916, test_loss: 1.1806, test_f1: 0.3481
 epoch: 99, train_loss: 1.1998, test_loss: 1.1790, test_f1: 0.3461
##################ITERATION #2 ****************************************
 epoch: 0, train_loss: 1.3202, test_loss: 1.3261, test_f1: 0.2274
 epoch: 1, train_loss: 1.3121, test_loss: 1.3213, test_f1: 0.2274
 epoch: 2, train_loss: 1.3091, test_loss: 1.3183, test_f1: 0.2274
 epoch: 3, train_loss: 1.3021, test_loss: 1.3128, test_f1: 0.2274
 epoch: 4, train_loss: 1.2970, test_loss: 1.3073, test_f1: 0.2274
 epoch: 5, train_loss: 1.2926, test_loss: 1.3050, test_f1: 0.2274
 epoch: 6, train_loss: 1.2909, test_loss: 1.2995, test_f1: 0.2274
 epoch: 7, train_loss: 1.2854, test_loss: 1.2925, test_f1: 0.2274
 epoch: 8, train_loss: 1.2829, test_loss: 1.2903, test_f1: 0.2274
 epoch: 9, train_loss: 1.2791, test_loss: 1.2845, test_f1: 0.2274
 epoch: 10, train_loss: 1.2745, test_loss: 1.2842, test_f1: 0.2274
 epoch: 11, train_loss: 1.2718, test_loss: 1.2779, test_f1: 0.2274
 epoch: 12, train_loss: 1.2723, test_loss: 1.2763, test_f1: 0.2274
 epoch: 13, train_loss: 1.2692, test_loss: 1.2731, test_f1: 0.2274
 epoch: 14, train_loss: 1.2642, test_loss: 1.2700, test_f1: 0.2274
 epoch: 15, train_loss: 1.2626, test_loss: 1.2681, test_f1: 0.2274
 epoch: 16, train_loss: 1.2595, test_loss: 1.2655, test_f1: 0.2274
 epoch: 17, train_loss: 1.2585, test_loss: 1.2628, test_f1: 0.2274
 epoch: 18, train_loss: 1.2518, test_loss: 1.2595, test_f1: 0.2274
 epoch: 19, train_loss: 1.2533, test_loss: 1.2571, test_f1: 0.2274
 epoch: 20, train_loss: 1.2506, test_loss: 1.2519, test_f1: 0.2274
 epoch: 21, train_loss: 1.2486, test_loss: 1.2515, test_f1: 0.2274
 epoch: 22, train_loss: 1.2484, test_loss: 1.2552, test_f1: 0.2274
 epoch: 23, train_loss: 1.2478, test_loss: 1.2590, test_f1: 0.2401
 epoch: 24, train_loss: 1.2455, test_loss: 1.2489, test_f1: 0.2401
 epoch: 25, train_loss: 1.2442, test_loss: 1.2428, test_f1: 0.2401
 epoch: 26, train_loss: 1.2433, test_loss: 1.2422, test_f1: 0.2397
 epoch: 27, train_loss: 1.2438, test_loss: 1.2374, test_f1: 0.2397
 epoch: 28, train_loss: 1.2384, test_loss: 1.2348, test_f1: 0.2401
 epoch: 29, train_loss: 1.2378, test_loss: 1.2347, test_f1: 0.2397
 epoch: 30, train_loss: 1.2275, test_loss: 1.2333, test_f1: 0.2395
 epoch: 31, train_loss: 1.2317, test_loss: 1.2255, test_f1: 0.2397
 epoch: 32, train_loss: 1.2289, test_loss: 1.2293, test_f1: 0.2398
 epoch: 33, train_loss: 1.2280, test_loss: 1.2250, test_f1: 0.2397
 epoch: 34, train_loss: 1.2293, test_loss: 1.2214, test_f1: 0.2397
 epoch: 35, train_loss: 1.2276, test_loss: 1.2187, test_f1: 0.2388
 epoch: 36, train_loss: 1.2264, test_loss: 1.2211, test_f1: 0.2391
 epoch: 37, train_loss: 1.2174, test_loss: 1.2183, test_f1: 0.2398
 epoch: 38, train_loss: 1.2209, test_loss: 1.2158, test_f1: 0.2453
 epoch: 39, train_loss: 1.2205, test_loss: 1.2108, test_f1: 0.2474
 epoch: 40, train_loss: 1.2159, test_loss: 1.2109, test_f1: 0.2674
 epoch: 41, train_loss: 1.2141, test_loss: 1.2152, test_f1: 0.2810
 epoch: 42, train_loss: 1.2144, test_loss: 1.2149, test_f1: 0.2912
 epoch: 43, train_loss: 1.2155, test_loss: 1.2027, test_f1: 0.2909
 epoch: 44, train_loss: 1.2106, test_loss: 1.2253, test_f1: 0.3053
 epoch: 45, train_loss: 1.2062, test_loss: 1.2235, test_f1: 0.2994
 epoch: 46, train_loss: 1.2076, test_loss: 1.2354, test_f1: 0.3327
 epoch: 47, train_loss: 1.2050, test_loss: 1.2186, test_f1: 0.3197
 epoch: 48, train_loss: 1.2071, test_loss: 1.1979, test_f1: 0.3297
 epoch: 49, train_loss: 1.2025, test_loss: 1.2239, test_f1: 0.3283
 epoch: 50, train_loss: 1.2011, test_loss: 1.2088, test_f1: 0.3299
 epoch: 51, train_loss: 1.2052, test_loss: 1.2074, test_f1: 0.3338
 epoch: 52, train_loss: 1.2005, test_loss: 1.1960, test_f1: 0.3573
 epoch: 53, train_loss: 1.1973, test_loss: 1.2273, test_f1: 0.3365
 epoch: 54, train_loss: 1.2006, test_loss: 1.2451, test_f1: 0.3375
 epoch: 55, train_loss: 1.1948, test_loss: 1.2448, test_f1: 0.3513
 epoch: 56, train_loss: 1.1935, test_loss: 1.1819, test_f1: 0.3369
 epoch: 57, train_loss: 1.2021, test_loss: 1.2129, test_f1: 0.3334
 epoch: 58, train_loss: 1.1979, test_loss: 1.1884, test_f1: 0.3582
 epoch: 59, train_loss: 1.1953, test_loss: 1.1941, test_f1: 0.3435
 epoch: 60, train_loss: 1.1927, test_loss: 1.1908, test_f1: 0.3656
 epoch: 61, train_loss: 1.1913, test_loss: 1.2266, test_f1: 0.3513
 epoch: 62, train_loss: 1.1951, test_loss: 1.1931, test_f1: 0.3496
 epoch: 63, train_loss: 1.1877, test_loss: 1.1883, test_f1: 0.3420
 epoch: 64, train_loss: 1.1870, test_loss: 1.1823, test_f1: 0.3530
 epoch: 65, train_loss: 1.1906, test_loss: 1.2122, test_f1: 0.3561
 epoch: 66, train_loss: 1.1938, test_loss: 1.2628, test_f1: 0.3453
 epoch: 67, train_loss: 1.1880, test_loss: 1.2075, test_f1: 0.3540
 epoch: 68, train_loss: 1.1911, test_loss: 1.2027, test_f1: 0.3659
 epoch: 69, train_loss: 1.1872, test_loss: 1.1717, test_f1: 0.3574
 epoch: 70, train_loss: 1.1870, test_loss: 1.1856, test_f1: 0.3626
 epoch: 71, train_loss: 1.1849, test_loss: 1.1858, test_f1: 0.3600
 epoch: 72, train_loss: 1.1860, test_loss: 1.1996, test_f1: 0.3651
 epoch: 73, train_loss: 1.1848, test_loss: 1.1825, test_f1: 0.3511
 epoch: 74, train_loss: 1.1813, test_loss: 1.2033, test_f1: 0.3595
 epoch: 75, train_loss: 1.1896, test_loss: 1.2078, test_f1: 0.3566
 epoch: 76, train_loss: 1.1853, test_loss: 1.1874, test_f1: 0.3782
 epoch: 77, train_loss: 1.1767, test_loss: 1.2202, test_f1: 0.3539
 epoch: 78, train_loss: 1.1864, test_loss: 1.1789, test_f1: 0.3605
 epoch: 79, train_loss: 1.1783, test_loss: 1.1920, test_f1: 0.3587
 epoch: 80, train_loss: 1.1826, test_loss: 1.1714, test_f1: 0.3510
 epoch: 81, train_loss: 1.1776, test_loss: 1.1843, test_f1: 0.3612
 epoch: 82, train_loss: 1.1783, test_loss: 1.1881, test_f1: 0.3551
 epoch: 83, train_loss: 1.1740, test_loss: 1.2012, test_f1: 0.3588
 epoch: 84, train_loss: 1.1853, test_loss: 1.1872, test_f1: 0.3730
 epoch: 85, train_loss: 1.1772, test_loss: 1.1799, test_f1: 0.3780
 epoch: 86, train_loss: 1.1777, test_loss: 1.1811, test_f1: 0.3623
 epoch: 87, train_loss: 1.1779, test_loss: 1.1849, test_f1: 0.3722
 epoch: 88, train_loss: 1.1809, test_loss: 1.1798, test_f1: 0.3622
 epoch: 89, train_loss: 1.1730, test_loss: 1.1850, test_f1: 0.3640
 epoch: 90, train_loss: 1.1795, test_loss: 1.1777, test_f1: 0.3669
 epoch: 91, train_loss: 1.1739, test_loss: 1.1722, test_f1: 0.3631
 epoch: 92, train_loss: 1.1765, test_loss: 1.1922, test_f1: 0.3588
 epoch: 93, train_loss: 1.1800, test_loss: 1.1687, test_f1: 0.3655
 epoch: 94, train_loss: 1.1773, test_loss: 1.1921, test_f1: 0.3799
 epoch: 95, train_loss: 1.1762, test_loss: 1.1920, test_f1: 0.3664
 epoch: 96, train_loss: 1.1680, test_loss: 1.1929, test_f1: 0.3730
 epoch: 97, train_loss: 1.1846, test_loss: 1.1939, test_f1: 0.3857
 epoch: 98, train_loss: 1.1690, test_loss: 1.1872, test_f1: 0.3760
 epoch: 99, train_loss: 1.1744, test_loss: 1.1853, test_f1: 0.3649
##################ITERATION #3 ****************************************
 epoch: 0, train_loss: 1.3131, test_loss: 1.3120, test_f1: 0.2555
 epoch: 1, train_loss: 1.3028, test_loss: 1.3028, test_f1: 0.2264
 epoch: 2, train_loss: 1.2985, test_loss: 1.2931, test_f1: 0.2555
 epoch: 3, train_loss: 1.2943, test_loss: 1.2837, test_f1: 0.2762
 epoch: 4, train_loss: 1.2906, test_loss: 1.2811, test_f1: 0.2783
 epoch: 5, train_loss: 1.2870, test_loss: 1.2760, test_f1: 0.2606
 epoch: 6, train_loss: 1.2824, test_loss: 1.2740, test_f1: 0.2790
 epoch: 7, train_loss: 1.2754, test_loss: 1.2717, test_f1: 0.2581
 epoch: 8, train_loss: 1.2729, test_loss: 1.2647, test_f1: 0.2581
 epoch: 9, train_loss: 1.2689, test_loss: 1.2624, test_f1: 0.2557
 epoch: 10, train_loss: 1.2653, test_loss: 1.2555, test_f1: 0.2555
 epoch: 11, train_loss: 1.2617, test_loss: 1.2517, test_f1: 0.2555
 epoch: 12, train_loss: 1.2582, test_loss: 1.2482, test_f1: 0.2555
 epoch: 13, train_loss: 1.2599, test_loss: 1.2414, test_f1: 0.2656
 epoch: 14, train_loss: 1.2540, test_loss: 1.2407, test_f1: 0.2551
 epoch: 15, train_loss: 1.2528, test_loss: 1.2365, test_f1: 0.2540
 epoch: 16, train_loss: 1.2496, test_loss: 1.2327, test_f1: 0.2550
 epoch: 17, train_loss: 1.2463, test_loss: 1.2260, test_f1: 0.2549
 epoch: 18, train_loss: 1.2445, test_loss: 1.2252, test_f1: 0.2517
 epoch: 19, train_loss: 1.2422, test_loss: 1.2170, test_f1: 0.2686
 epoch: 20, train_loss: 1.2330, test_loss: 1.2156, test_f1: 0.2686
 epoch: 21, train_loss: 1.2357, test_loss: 1.2117, test_f1: 0.2709
 epoch: 22, train_loss: 1.2322, test_loss: 1.2065, test_f1: 0.2809
 epoch: 23, train_loss: 1.2263, test_loss: 1.2029, test_f1: 0.2876
 epoch: 24, train_loss: 1.2258, test_loss: 1.1971, test_f1: 0.3112
 epoch: 25, train_loss: 1.2276, test_loss: 1.1984, test_f1: 0.3187
 epoch: 26, train_loss: 1.2178, test_loss: 1.1921, test_f1: 0.3267
 epoch: 27, train_loss: 1.2192, test_loss: 1.1905, test_f1: 0.3399
 epoch: 28, train_loss: 1.2182, test_loss: 1.1885, test_f1: 0.3505
 epoch: 29, train_loss: 1.2150, test_loss: 1.1842, test_f1: 0.3476
 epoch: 30, train_loss: 1.2112, test_loss: 1.1810, test_f1: 0.3563
 epoch: 31, train_loss: 1.2091, test_loss: 1.1796, test_f1: 0.3752
 epoch: 32, train_loss: 1.2063, test_loss: 1.1754, test_f1: 0.3884
 epoch: 33, train_loss: 1.2066, test_loss: 1.1734, test_f1: 0.4074
 epoch: 34, train_loss: 1.2038, test_loss: 1.1692, test_f1: 0.4043
 epoch: 35, train_loss: 1.2063, test_loss: 1.1654, test_f1: 0.3991
 epoch: 36, train_loss: 1.1943, test_loss: 1.1640, test_f1: 0.4001
 epoch: 37, train_loss: 1.1957, test_loss: 1.1629, test_f1: 0.4286
 epoch: 38, train_loss: 1.1923, test_loss: 1.1588, test_f1: 0.4283
 epoch: 39, train_loss: 1.1916, test_loss: 1.1578, test_f1: 0.4304
 epoch: 40, train_loss: 1.1916, test_loss: 1.1538, test_f1: 0.4289
 epoch: 41, train_loss: 1.1934, test_loss: 1.1531, test_f1: 0.4441
 epoch: 42, train_loss: 1.1865, test_loss: 1.1509, test_f1: 0.4385
 epoch: 43, train_loss: 1.1837, test_loss: 1.1459, test_f1: 0.4494
 epoch: 44, train_loss: 1.1881, test_loss: 1.1481, test_f1: 0.4441
 epoch: 45, train_loss: 1.1790, test_loss: 1.1428, test_f1: 0.4490
 epoch: 46, train_loss: 1.1825, test_loss: 1.1420, test_f1: 0.4409
 epoch: 47, train_loss: 1.1729, test_loss: 1.1411, test_f1: 0.4346
 epoch: 48, train_loss: 1.1733, test_loss: 1.1358, test_f1: 0.4437
 epoch: 49, train_loss: 1.1714, test_loss: 1.1363, test_f1: 0.4461
 epoch: 50, train_loss: 1.1688, test_loss: 1.1318, test_f1: 0.4457
 epoch: 51, train_loss: 1.1713, test_loss: 1.1315, test_f1: 0.4502
 epoch: 52, train_loss: 1.1645, test_loss: 1.1279, test_f1: 0.4527
 epoch: 53, train_loss: 1.1651, test_loss: 1.1274, test_f1: 0.4557
 epoch: 54, train_loss: 1.1590, test_loss: 1.1269, test_f1: 0.4508
 epoch: 55, train_loss: 1.1602, test_loss: 1.1258, test_f1: 0.4521
 epoch: 56, train_loss: 1.1660, test_loss: 1.1242, test_f1: 0.4564
 epoch: 57, train_loss: 1.1631, test_loss: 1.1272, test_f1: 0.4594
 epoch: 58, train_loss: 1.1632, test_loss: 1.1272, test_f1: 0.4506
 epoch: 59, train_loss: 1.1626, test_loss: 1.1245, test_f1: 0.4625
 epoch: 60, train_loss: 1.1539, test_loss: 1.1255, test_f1: 0.4546
 epoch: 61, train_loss: 1.1590, test_loss: 1.1244, test_f1: 0.4406
 epoch: 62, train_loss: 1.1665, test_loss: 1.1215, test_f1: 0.4441
 epoch: 63, train_loss: 1.1605, test_loss: 1.1209, test_f1: 0.4514
 epoch: 64, train_loss: 1.1589, test_loss: 1.1166, test_f1: 0.4591
 epoch: 65, train_loss: 1.1528, test_loss: 1.1178, test_f1: 0.4599
 epoch: 66, train_loss: 1.1537, test_loss: 1.1185, test_f1: 0.4557
 epoch: 67, train_loss: 1.1604, test_loss: 1.1142, test_f1: 0.4555
 epoch: 68, train_loss: 1.1532, test_loss: 1.1191, test_f1: 0.4618
 epoch: 69, train_loss: 1.1489, test_loss: 1.1136, test_f1: 0.4529
 epoch: 70, train_loss: 1.1529, test_loss: 1.1160, test_f1: 0.4584
 epoch: 71, train_loss: 1.1524, test_loss: 1.1144, test_f1: 0.4460
 epoch: 72, train_loss: 1.1522, test_loss: 1.1173, test_f1: 0.4390
 epoch: 73, train_loss: 1.1511, test_loss: 1.1102, test_f1: 0.4623
 epoch: 74, train_loss: 1.1501, test_loss: 1.1118, test_f1: 0.4532
 epoch: 75, train_loss: 1.1504, test_loss: 1.1125, test_f1: 0.4485
 epoch: 76, train_loss: 1.1440, test_loss: 1.1107, test_f1: 0.4467
 epoch: 77, train_loss: 1.1449, test_loss: 1.1097, test_f1: 0.4450
 epoch: 78, train_loss: 1.1441, test_loss: 1.1049, test_f1: 0.4554
 epoch: 79, train_loss: 1.1450, test_loss: 1.1059, test_f1: 0.4454
 epoch: 80, train_loss: 1.1413, test_loss: 1.1029, test_f1: 0.4528
 epoch: 81, train_loss: 1.1464, test_loss: 1.1045, test_f1: 0.4512
 epoch: 82, train_loss: 1.1400, test_loss: 1.1044, test_f1: 0.4510
 epoch: 83, train_loss: 1.1331, test_loss: 1.1049, test_f1: 0.4481
 epoch: 84, train_loss: 1.1336, test_loss: 1.1036, test_f1: 0.4506
 epoch: 85, train_loss: 1.1453, test_loss: 1.0994, test_f1: 0.4584
 epoch: 86, train_loss: 1.1402, test_loss: 1.1007, test_f1: 0.4483
 epoch: 87, train_loss: 1.1384, test_loss: 1.1058, test_f1: 0.4391
 epoch: 88, train_loss: 1.1412, test_loss: 1.0974, test_f1: 0.4506
 epoch: 89, train_loss: 1.1411, test_loss: 1.1010, test_f1: 0.4489
 epoch: 90, train_loss: 1.1341, test_loss: 1.0970, test_f1: 0.4470
 epoch: 91, train_loss: 1.1327, test_loss: 1.0953, test_f1: 0.4430
 epoch: 92, train_loss: 1.1354, test_loss: 1.0950, test_f1: 0.4510
 epoch: 93, train_loss: 1.1357, test_loss: 1.0950, test_f1: 0.4578
 epoch: 94, train_loss: 1.1325, test_loss: 1.0970, test_f1: 0.4412
 epoch: 95, train_loss: 1.1347, test_loss: 1.0935, test_f1: 0.4449
 epoch: 96, train_loss: 1.1308, test_loss: 1.0919, test_f1: 0.4536
 epoch: 97, train_loss: 1.1319, test_loss: 1.0896, test_f1: 0.4539
 epoch: 98, train_loss: 1.1308, test_loss: 1.0897, test_f1: 0.4528
 epoch: 99, train_loss: 1.1365, test_loss: 1.0904, test_f1: 0.4523
##################ITERATION #4 ****************************************
 epoch: 0, train_loss: 1.3132, test_loss: 1.3117, test_f1: 0.2274
 epoch: 1, train_loss: 1.3036, test_loss: 1.3099, test_f1: 0.2274
 epoch: 2, train_loss: 1.3000, test_loss: 1.3084, test_f1: 0.2274
 epoch: 3, train_loss: 1.2970, test_loss: 1.2994, test_f1: 0.2274
 epoch: 4, train_loss: 1.2959, test_loss: 1.3006, test_f1: 0.2274
 epoch: 5, train_loss: 1.2900, test_loss: 1.2975, test_f1: 0.2274
 epoch: 6, train_loss: 1.2873, test_loss: 1.2929, test_f1: 0.2274
 epoch: 7, train_loss: 1.2828, test_loss: 1.2890, test_f1: 0.2274
 epoch: 8, train_loss: 1.2776, test_loss: 1.2839, test_f1: 0.2274
 epoch: 9, train_loss: 1.2744, test_loss: 1.2807, test_f1: 0.2274
 epoch: 10, train_loss: 1.2707, test_loss: 1.2731, test_f1: 0.2274
 epoch: 11, train_loss: 1.2665, test_loss: 1.2705, test_f1: 0.2274
 epoch: 12, train_loss: 1.2637, test_loss: 1.2652, test_f1: 0.2274
 epoch: 13, train_loss: 1.2605, test_loss: 1.2557, test_f1: 0.2274
 epoch: 14, train_loss: 1.2573, test_loss: 1.2526, test_f1: 0.2274
 epoch: 15, train_loss: 1.2516, test_loss: 1.2463, test_f1: 0.2352
 epoch: 16, train_loss: 1.2540, test_loss: 1.2442, test_f1: 0.2345
 epoch: 17, train_loss: 1.2463, test_loss: 1.2381, test_f1: 0.2408
 epoch: 18, train_loss: 1.2422, test_loss: 1.2340, test_f1: 0.2636
 epoch: 19, train_loss: 1.2408, test_loss: 1.2308, test_f1: 0.2733
 epoch: 20, train_loss: 1.2399, test_loss: 1.2263, test_f1: 0.3196
 epoch: 21, train_loss: 1.2367, test_loss: 1.2198, test_f1: 0.3195
 epoch: 22, train_loss: 1.2328, test_loss: 1.2187, test_f1: 0.3168
 epoch: 23, train_loss: 1.2332, test_loss: 1.2153, test_f1: 0.3333
 epoch: 24, train_loss: 1.2255, test_loss: 1.2170, test_f1: 0.3178
 epoch: 25, train_loss: 1.2261, test_loss: 1.2123, test_f1: 0.3288
 epoch: 26, train_loss: 1.2254, test_loss: 1.2102, test_f1: 0.3340
 epoch: 27, train_loss: 1.2153, test_loss: 1.2064, test_f1: 0.3418
 epoch: 28, train_loss: 1.2185, test_loss: 1.2052, test_f1: 0.3427
 epoch: 29, train_loss: 1.2170, test_loss: 1.1987, test_f1: 0.3466
 epoch: 30, train_loss: 1.2162, test_loss: 1.2008, test_f1: 0.3434
 epoch: 31, train_loss: 1.2163, test_loss: 1.1986, test_f1: 0.3358
 epoch: 32, train_loss: 1.2097, test_loss: 1.1997, test_f1: 0.3392
 epoch: 33, train_loss: 1.2082, test_loss: 1.1954, test_f1: 0.3390
 epoch: 34, train_loss: 1.2118, test_loss: 1.1928, test_f1: 0.3456
 epoch: 35, train_loss: 1.2081, test_loss: 1.1930, test_f1: 0.3381
 epoch: 36, train_loss: 1.2081, test_loss: 1.1878, test_f1: 0.3414
 epoch: 37, train_loss: 1.2059, test_loss: 1.1893, test_f1: 0.3441
 epoch: 38, train_loss: 1.2065, test_loss: 1.1840, test_f1: 0.3467
 epoch: 39, train_loss: 1.1976, test_loss: 1.1856, test_f1: 0.3429
 epoch: 40, train_loss: 1.1966, test_loss: 1.1839, test_f1: 0.3392
 epoch: 41, train_loss: 1.1999, test_loss: 1.1834, test_f1: 0.3431
 epoch: 42, train_loss: 1.1974, test_loss: 1.1768, test_f1: 0.3322
 epoch: 43, train_loss: 1.1961, test_loss: 1.1772, test_f1: 0.3434
 epoch: 44, train_loss: 1.1938, test_loss: 1.1783, test_f1: 0.3413
 epoch: 45, train_loss: 1.1938, test_loss: 1.1739, test_f1: 0.3487
 epoch: 46, train_loss: 1.1928, test_loss: 1.1757, test_f1: 0.3379
 epoch: 47, train_loss: 1.1934, test_loss: 1.1762, test_f1: 0.3378
 epoch: 48, train_loss: 1.1860, test_loss: 1.1711, test_f1: 0.3419
 epoch: 49, train_loss: 1.1858, test_loss: 1.1699, test_f1: 0.3492
 epoch: 50, train_loss: 1.1865, test_loss: 1.1664, test_f1: 0.3620
 epoch: 51, train_loss: 1.1789, test_loss: 1.1662, test_f1: 0.3494
 epoch: 52, train_loss: 1.1845, test_loss: 1.1643, test_f1: 0.3582
 epoch: 53, train_loss: 1.1874, test_loss: 1.1635, test_f1: 0.3543
 epoch: 54, train_loss: 1.1884, test_loss: 1.1629, test_f1: 0.3523
 epoch: 55, train_loss: 1.1810, test_loss: 1.1626, test_f1: 0.3691
 epoch: 56, train_loss: 1.1854, test_loss: 1.1619, test_f1: 0.3644
 epoch: 57, train_loss: 1.1829, test_loss: 1.1606, test_f1: 0.3603
 epoch: 58, train_loss: 1.1834, test_loss: 1.1587, test_f1: 0.3705
 epoch: 59, train_loss: 1.1844, test_loss: 1.1606, test_f1: 0.3656
 epoch: 60, train_loss: 1.1794, test_loss: 1.1612, test_f1: 0.3592
 epoch: 61, train_loss: 1.1785, test_loss: 1.1571, test_f1: 0.3799
 epoch: 62, train_loss: 1.1825, test_loss: 1.1547, test_f1: 0.3853
 epoch: 63, train_loss: 1.1830, test_loss: 1.1560, test_f1: 0.3811
 epoch: 64, train_loss: 1.1715, test_loss: 1.1556, test_f1: 0.3961
 epoch: 65, train_loss: 1.1789, test_loss: 1.1543, test_f1: 0.3921
 epoch: 66, train_loss: 1.1766, test_loss: 1.1542, test_f1: 0.3891
 epoch: 67, train_loss: 1.1692, test_loss: 1.1524, test_f1: 0.3968
 epoch: 68, train_loss: 1.1768, test_loss: 1.1531, test_f1: 0.3933
 epoch: 69, train_loss: 1.1758, test_loss: 1.1508, test_f1: 0.4086
 epoch: 70, train_loss: 1.1679, test_loss: 1.1508, test_f1: 0.4015
 epoch: 71, train_loss: 1.1709, test_loss: 1.1498, test_f1: 0.4041
 epoch: 72, train_loss: 1.1724, test_loss: 1.1483, test_f1: 0.4094
 epoch: 73, train_loss: 1.1697, test_loss: 1.1494, test_f1: 0.3922
 epoch: 74, train_loss: 1.1665, test_loss: 1.1453, test_f1: 0.4020
 epoch: 75, train_loss: 1.1666, test_loss: 1.1447, test_f1: 0.4048
 epoch: 76, train_loss: 1.1716, test_loss: 1.1447, test_f1: 0.3922
 epoch: 77, train_loss: 1.1743, test_loss: 1.1455, test_f1: 0.3946
 epoch: 78, train_loss: 1.1656, test_loss: 1.1432, test_f1: 0.3981
 epoch: 79, train_loss: 1.1734, test_loss: 1.1477, test_f1: 0.4037
 epoch: 80, train_loss: 1.1699, test_loss: 1.1452, test_f1: 0.4025
 epoch: 81, train_loss: 1.1734, test_loss: 1.1459, test_f1: 0.4162
 epoch: 82, train_loss: 1.1593, test_loss: 1.1449, test_f1: 0.4054
 epoch: 83, train_loss: 1.1671, test_loss: 1.1403, test_f1: 0.4152
 epoch: 84, train_loss: 1.1647, test_loss: 1.1418, test_f1: 0.4154
 epoch: 85, train_loss: 1.1634, test_loss: 1.1423, test_f1: 0.4107
 epoch: 86, train_loss: 1.1583, test_loss: 1.1400, test_f1: 0.4095
 epoch: 87, train_loss: 1.1650, test_loss: 1.1381, test_f1: 0.4164
 epoch: 88, train_loss: 1.1697, test_loss: 1.1407, test_f1: 0.4243
 epoch: 89, train_loss: 1.1608, test_loss: 1.1383, test_f1: 0.4188
 epoch: 90, train_loss: 1.1634, test_loss: 1.1382, test_f1: 0.4237
 epoch: 91, train_loss: 1.1619, test_loss: 1.1401, test_f1: 0.4118
 epoch: 92, train_loss: 1.1627, test_loss: 1.1365, test_f1: 0.4224
 epoch: 93, train_loss: 1.1569, test_loss: 1.1342, test_f1: 0.4171
 epoch: 94, train_loss: 1.1561, test_loss: 1.1353, test_f1: 0.4113
 epoch: 95, train_loss: 1.1508, test_loss: 1.1317, test_f1: 0.4215
 epoch: 96, train_loss: 1.1568, test_loss: 1.1322, test_f1: 0.4166
 epoch: 97, train_loss: 1.1604, test_loss: 1.1301, test_f1: 0.4168
 epoch: 98, train_loss: 1.1545, test_loss: 1.1324, test_f1: 0.4133
 epoch: 99, train_loss: 1.1473, test_loss: 1.1287, test_f1: 0.4195
##################ITERATION #5 ****************************************
 epoch: 0, train_loss: 1.3077, test_loss: 1.2903, test_f1: 0.2271
 epoch: 1, train_loss: 1.2929, test_loss: 1.2731, test_f1: 0.2414
 epoch: 2, train_loss: 1.2855, test_loss: 1.2649, test_f1: 0.2292
 epoch: 3, train_loss: 1.2831, test_loss: 1.2584, test_f1: 0.2578
 epoch: 4, train_loss: 1.2752, test_loss: 1.2526, test_f1: 0.2600
 epoch: 5, train_loss: 1.2746, test_loss: 1.2515, test_f1: 0.2578
 epoch: 6, train_loss: 1.2680, test_loss: 1.2426, test_f1: 0.2617
 epoch: 7, train_loss: 1.2653, test_loss: 1.2377, test_f1: 0.2663
 epoch: 8, train_loss: 1.2641, test_loss: 1.2359, test_f1: 0.2735
 epoch: 9, train_loss: 1.2643, test_loss: 1.2282, test_f1: 0.2823
 epoch: 10, train_loss: 1.2623, test_loss: 1.2293, test_f1: 0.2783
 epoch: 11, train_loss: 1.2559, test_loss: 1.2237, test_f1: 0.2916
 epoch: 12, train_loss: 1.2509, test_loss: 1.2224, test_f1: 0.2920
 epoch: 13, train_loss: 1.2565, test_loss: 1.2182, test_f1: 0.2970
 epoch: 14, train_loss: 1.2559, test_loss: 1.2177, test_f1: 0.2977
 epoch: 15, train_loss: 1.2475, test_loss: 1.2142, test_f1: 0.3083
 epoch: 16, train_loss: 1.2427, test_loss: 1.2088, test_f1: 0.3101
 epoch: 17, train_loss: 1.2490, test_loss: 1.2062, test_f1: 0.3135
 epoch: 18, train_loss: 1.2462, test_loss: 1.2080, test_f1: 0.3127
 epoch: 19, train_loss: 1.2402, test_loss: 1.2043, test_f1: 0.3117
 epoch: 20, train_loss: 1.2379, test_loss: 1.2015, test_f1: 0.3133
 epoch: 21, train_loss: 1.2378, test_loss: 1.2028, test_f1: 0.3165
 epoch: 22, train_loss: 1.2350, test_loss: 1.2009, test_f1: 0.3142
 epoch: 23, train_loss: 1.2328, test_loss: 1.1954, test_f1: 0.3253
 epoch: 24, train_loss: 1.2339, test_loss: 1.1952, test_f1: 0.3293
 epoch: 25, train_loss: 1.2325, test_loss: 1.1939, test_f1: 0.3222
 epoch: 26, train_loss: 1.2252, test_loss: 1.1921, test_f1: 0.3332
 epoch: 27, train_loss: 1.2235, test_loss: 1.1882, test_f1: 0.3278
 epoch: 28, train_loss: 1.2199, test_loss: 1.1844, test_f1: 0.3310
 epoch: 29, train_loss: 1.2179, test_loss: 1.1841, test_f1: 0.3374
 epoch: 30, train_loss: 1.2187, test_loss: 1.1812, test_f1: 0.3318
 epoch: 31, train_loss: 1.2230, test_loss: 1.1806, test_f1: 0.3393
 epoch: 32, train_loss: 1.2221, test_loss: 1.1794, test_f1: 0.3406
 epoch: 33, train_loss: 1.2193, test_loss: 1.1822, test_f1: 0.3333
 epoch: 34, train_loss: 1.2253, test_loss: 1.1801, test_f1: 0.3405
 epoch: 35, train_loss: 1.2208, test_loss: 1.1766, test_f1: 0.3405
 epoch: 36, train_loss: 1.2243, test_loss: 1.1773, test_f1: 0.3337
 epoch: 37, train_loss: 1.2167, test_loss: 1.1757, test_f1: 0.3365
 epoch: 38, train_loss: 1.2091, test_loss: 1.1731, test_f1: 0.3367
 epoch: 39, train_loss: 1.2105, test_loss: 1.1736, test_f1: 0.3385
 epoch: 40, train_loss: 1.2093, test_loss: 1.1698, test_f1: 0.3444
 epoch: 41, train_loss: 1.2102, test_loss: 1.1694, test_f1: 0.3433
 epoch: 42, train_loss: 1.2040, test_loss: 1.1651, test_f1: 0.3551
 epoch: 43, train_loss: 1.2045, test_loss: 1.1657, test_f1: 0.3606
 epoch: 44, train_loss: 1.2032, test_loss: 1.1631, test_f1: 0.3640
 epoch: 45, train_loss: 1.2088, test_loss: 1.1635, test_f1: 0.3680
 epoch: 46, train_loss: 1.1941, test_loss: 1.1610, test_f1: 0.3635
 epoch: 47, train_loss: 1.1971, test_loss: 1.1577, test_f1: 0.3830
 epoch: 48, train_loss: 1.2065, test_loss: 1.1595, test_f1: 0.3701
 epoch: 49, train_loss: 1.1965, test_loss: 1.1549, test_f1: 0.3820
 epoch: 50, train_loss: 1.1948, test_loss: 1.1546, test_f1: 0.3880
 epoch: 51, train_loss: 1.1930, test_loss: 1.1515, test_f1: 0.3939
 epoch: 52, train_loss: 1.1914, test_loss: 1.1517, test_f1: 0.3961
 epoch: 53, train_loss: 1.1923, test_loss: 1.1517, test_f1: 0.3920
 epoch: 54, train_loss: 1.1965, test_loss: 1.1506, test_f1: 0.4006
 epoch: 55, train_loss: 1.1915, test_loss: 1.1514, test_f1: 0.3953
 epoch: 56, train_loss: 1.1953, test_loss: 1.1505, test_f1: 0.4013
 epoch: 57, train_loss: 1.1879, test_loss: 1.1523, test_f1: 0.3843
 epoch: 58, train_loss: 1.1966, test_loss: 1.1493, test_f1: 0.3914
 epoch: 59, train_loss: 1.1895, test_loss: 1.1485, test_f1: 0.4007
 epoch: 60, train_loss: 1.1920, test_loss: 1.1482, test_f1: 0.3934
 epoch: 61, train_loss: 1.1894, test_loss: 1.1477, test_f1: 0.4083
 epoch: 62, train_loss: 1.1915, test_loss: 1.1472, test_f1: 0.4065
 epoch: 63, train_loss: 1.1879, test_loss: 1.1473, test_f1: 0.4016
 epoch: 64, train_loss: 1.1877, test_loss: 1.1462, test_f1: 0.3989
 epoch: 65, train_loss: 1.1835, test_loss: 1.1451, test_f1: 0.4091
 epoch: 66, train_loss: 1.1815, test_loss: 1.1456, test_f1: 0.3958
 epoch: 67, train_loss: 1.1860, test_loss: 1.1449, test_f1: 0.4164
 epoch: 68, train_loss: 1.1896, test_loss: 1.1474, test_f1: 0.4152
 epoch: 69, train_loss: 1.1844, test_loss: 1.1440, test_f1: 0.4120
 epoch: 70, train_loss: 1.1830, test_loss: 1.1440, test_f1: 0.4286
 epoch: 71, train_loss: 1.1812, test_loss: 1.1432, test_f1: 0.4200
 epoch: 72, train_loss: 1.1832, test_loss: 1.1441, test_f1: 0.4312
 epoch: 73, train_loss: 1.1853, test_loss: 1.1412, test_f1: 0.4160
 epoch: 74, train_loss: 1.1803, test_loss: 1.1389, test_f1: 0.4121
 epoch: 75, train_loss: 1.1789, test_loss: 1.1396, test_f1: 0.4206
 epoch: 76, train_loss: 1.1836, test_loss: 1.1409, test_f1: 0.4181
 epoch: 77, train_loss: 1.1818, test_loss: 1.1441, test_f1: 0.4162
 epoch: 78, train_loss: 1.1837, test_loss: 1.1399, test_f1: 0.4306
 epoch: 79, train_loss: 1.1840, test_loss: 1.1423, test_f1: 0.4245
 epoch: 80, train_loss: 1.1767, test_loss: 1.1396, test_f1: 0.4154
 epoch: 81, train_loss: 1.1791, test_loss: 1.1404, test_f1: 0.4130
 epoch: 82, train_loss: 1.1794, test_loss: 1.1383, test_f1: 0.4121
 epoch: 83, train_loss: 1.1699, test_loss: 1.1385, test_f1: 0.4262
 epoch: 84, train_loss: 1.1754, test_loss: 1.1372, test_f1: 0.4194
 epoch: 85, train_loss: 1.1724, test_loss: 1.1382, test_f1: 0.4210
 epoch: 86, train_loss: 1.1655, test_loss: 1.1380, test_f1: 0.4233
 epoch: 87, train_loss: 1.1701, test_loss: 1.1384, test_f1: 0.4265
 epoch: 88, train_loss: 1.1715, test_loss: 1.1368, test_f1: 0.4337
 epoch: 89, train_loss: 1.1730, test_loss: 1.1383, test_f1: 0.4222
 epoch: 90, train_loss: 1.1718, test_loss: 1.1358, test_f1: 0.4292
 epoch: 91, train_loss: 1.1699, test_loss: 1.1337, test_f1: 0.4279
 epoch: 92, train_loss: 1.1713, test_loss: 1.1347, test_f1: 0.4194
 epoch: 93, train_loss: 1.1594, test_loss: 1.1320, test_f1: 0.4255
 epoch: 94, train_loss: 1.1737, test_loss: 1.1344, test_f1: 0.4230
 epoch: 95, train_loss: 1.1735, test_loss: 1.1331, test_f1: 0.4203
 epoch: 96, train_loss: 1.1653, test_loss: 1.1328, test_f1: 0.4178
 epoch: 97, train_loss: 1.1684, test_loss: 1.1316, test_f1: 0.4278
 epoch: 98, train_loss: 1.1701, test_loss: 1.1295, test_f1: 0.4373
 epoch: 99, train_loss: 1.1689, test_loss: 1.1303, test_f1: 0.4255
##################ITERATION #6 ****************************************
 epoch: 0, train_loss: 1.3345, test_loss: 1.3443, test_f1: 0.2558
 epoch: 1, train_loss: 1.3129, test_loss: 1.3205, test_f1: 0.2659
 epoch: 2, train_loss: 1.3071, test_loss: 1.3053, test_f1: 0.2747
 epoch: 3, train_loss: 1.2967, test_loss: 1.2911, test_f1: 0.2747
 epoch: 4, train_loss: 1.2828, test_loss: 1.2751, test_f1: 0.2803
 epoch: 5, train_loss: 1.2795, test_loss: 1.2705, test_f1: 0.2926
 epoch: 6, train_loss: 1.2742, test_loss: 1.2627, test_f1: 0.2803
 epoch: 7, train_loss: 1.2754, test_loss: 1.2532, test_f1: 0.3057
 epoch: 8, train_loss: 1.2659, test_loss: 1.2491, test_f1: 0.3129
 epoch: 9, train_loss: 1.2621, test_loss: 1.2453, test_f1: 0.3137
 epoch: 10, train_loss: 1.2638, test_loss: 1.2357, test_f1: 0.3120
 epoch: 11, train_loss: 1.2609, test_loss: 1.2332, test_f1: 0.3121
 epoch: 12, train_loss: 1.2531, test_loss: 1.2288, test_f1: 0.3143
 epoch: 13, train_loss: 1.2547, test_loss: 1.2273, test_f1: 0.3141
 epoch: 14, train_loss: 1.2451, test_loss: 1.2244, test_f1: 0.3146
 epoch: 15, train_loss: 1.2483, test_loss: 1.2164, test_f1: 0.3238
 epoch: 16, train_loss: 1.2440, test_loss: 1.2174, test_f1: 0.3188
 epoch: 17, train_loss: 1.2440, test_loss: 1.2144, test_f1: 0.3278
 epoch: 18, train_loss: 1.2409, test_loss: 1.2114, test_f1: 0.3311
 epoch: 19, train_loss: 1.2297, test_loss: 1.2101, test_f1: 0.3273
 epoch: 20, train_loss: 1.2335, test_loss: 1.2043, test_f1: 0.3198
 epoch: 21, train_loss: 1.2283, test_loss: 1.2043, test_f1: 0.3356
 epoch: 22, train_loss: 1.2348, test_loss: 1.2033, test_f1: 0.3414
 epoch: 23, train_loss: 1.2294, test_loss: 1.2052, test_f1: 0.3312
 epoch: 24, train_loss: 1.2296, test_loss: 1.2003, test_f1: 0.3463
 epoch: 25, train_loss: 1.2258, test_loss: 1.1983, test_f1: 0.3509
 epoch: 26, train_loss: 1.2216, test_loss: 1.1953, test_f1: 0.3482
 epoch: 27, train_loss: 1.2202, test_loss: 1.1953, test_f1: 0.3528
 epoch: 28, train_loss: 1.2104, test_loss: 1.1942, test_f1: 0.3539
 epoch: 29, train_loss: 1.2183, test_loss: 1.1876, test_f1: 0.3471
 epoch: 30, train_loss: 1.2143, test_loss: 1.1827, test_f1: 0.3610
 epoch: 31, train_loss: 1.2163, test_loss: 1.1855, test_f1: 0.3630
 epoch: 32, train_loss: 1.2202, test_loss: 1.1808, test_f1: 0.3731
 epoch: 33, train_loss: 1.2063, test_loss: 1.1769, test_f1: 0.3796
 epoch: 34, train_loss: 1.2055, test_loss: 1.1768, test_f1: 0.3788
 epoch: 35, train_loss: 1.2050, test_loss: 1.1721, test_f1: 0.3800
 epoch: 36, train_loss: 1.2046, test_loss: 1.1754, test_f1: 0.3901
 epoch: 37, train_loss: 1.2043, test_loss: 1.1693, test_f1: 0.3940
 epoch: 38, train_loss: 1.2043, test_loss: 1.1706, test_f1: 0.3821
 epoch: 39, train_loss: 1.2035, test_loss: 1.1718, test_f1: 0.3802
 epoch: 40, train_loss: 1.1968, test_loss: 1.1710, test_f1: 0.3772
 epoch: 41, train_loss: 1.1981, test_loss: 1.1685, test_f1: 0.3746
 epoch: 42, train_loss: 1.2039, test_loss: 1.1709, test_f1: 0.3761
 epoch: 43, train_loss: 1.1929, test_loss: 1.1672, test_f1: 0.3827
 epoch: 44, train_loss: 1.1909, test_loss: 1.1655, test_f1: 0.3856
 epoch: 45, train_loss: 1.1933, test_loss: 1.1640, test_f1: 0.3825
 epoch: 46, train_loss: 1.1896, test_loss: 1.1620, test_f1: 0.3745
 epoch: 47, train_loss: 1.1916, test_loss: 1.1635, test_f1: 0.3693
 epoch: 48, train_loss: 1.1915, test_loss: 1.1604, test_f1: 0.3848
 epoch: 49, train_loss: 1.1910, test_loss: 1.1548, test_f1: 0.3890
 epoch: 50, train_loss: 1.1889, test_loss: 1.1562, test_f1: 0.3881
 epoch: 51, train_loss: 1.1829, test_loss: 1.1547, test_f1: 0.3816
 epoch: 52, train_loss: 1.1903, test_loss: 1.1556, test_f1: 0.3881
 epoch: 53, train_loss: 1.1812, test_loss: 1.1539, test_f1: 0.3776
 epoch: 54, train_loss: 1.1820, test_loss: 1.1535, test_f1: 0.3956
 epoch: 55, train_loss: 1.1780, test_loss: 1.1484, test_f1: 0.3944
 epoch: 56, train_loss: 1.1739, test_loss: 1.1478, test_f1: 0.3933
 epoch: 57, train_loss: 1.1856, test_loss: 1.1512, test_f1: 0.4041
 epoch: 58, train_loss: 1.1842, test_loss: 1.1500, test_f1: 0.4022
 epoch: 59, train_loss: 1.1785, test_loss: 1.1495, test_f1: 0.3924
 epoch: 60, train_loss: 1.1785, test_loss: 1.1487, test_f1: 0.4038
 epoch: 61, train_loss: 1.1742, test_loss: 1.1481, test_f1: 0.3826
 epoch: 62, train_loss: 1.1791, test_loss: 1.1472, test_f1: 0.3799
 epoch: 63, train_loss: 1.1808, test_loss: 1.1509, test_f1: 0.3829
 epoch: 64, train_loss: 1.1739, test_loss: 1.1454, test_f1: 0.3931
 epoch: 65, train_loss: 1.1695, test_loss: 1.1500, test_f1: 0.3885
 epoch: 66, train_loss: 1.1686, test_loss: 1.1483, test_f1: 0.4010
 epoch: 67, train_loss: 1.1695, test_loss: 1.1471, test_f1: 0.3850
 epoch: 68, train_loss: 1.1718, test_loss: 1.1493, test_f1: 0.3957
 epoch: 69, train_loss: 1.1715, test_loss: 1.1451, test_f1: 0.3823
 epoch: 70, train_loss: 1.1623, test_loss: 1.1478, test_f1: 0.3749
 epoch: 71, train_loss: 1.1707, test_loss: 1.1457, test_f1: 0.3931
 epoch: 72, train_loss: 1.1707, test_loss: 1.1437, test_f1: 0.4118
 epoch: 73, train_loss: 1.1623, test_loss: 1.1407, test_f1: 0.4137
 epoch: 74, train_loss: 1.1644, test_loss: 1.1434, test_f1: 0.4050
 epoch: 75, train_loss: 1.1671, test_loss: 1.1452, test_f1: 0.3922
 epoch: 76, train_loss: 1.1725, test_loss: 1.1450, test_f1: 0.3860
 epoch: 77, train_loss: 1.1636, test_loss: 1.1451, test_f1: 0.4084
 epoch: 78, train_loss: 1.1698, test_loss: 1.1474, test_f1: 0.4003
 epoch: 79, train_loss: 1.1624, test_loss: 1.1464, test_f1: 0.4024
 epoch: 80, train_loss: 1.1695, test_loss: 1.1425, test_f1: 0.3971
 epoch: 81, train_loss: 1.1638, test_loss: 1.1419, test_f1: 0.4037
 epoch: 82, train_loss: 1.1560, test_loss: 1.1420, test_f1: 0.4031
 epoch: 83, train_loss: 1.1655, test_loss: 1.1382, test_f1: 0.3990
 epoch: 84, train_loss: 1.1592, test_loss: 1.1400, test_f1: 0.3887
 epoch: 85, train_loss: 1.1567, test_loss: 1.1469, test_f1: 0.4017
 epoch: 86, train_loss: 1.1599, test_loss: 1.1382, test_f1: 0.4128
 epoch: 87, train_loss: 1.1632, test_loss: 1.1391, test_f1: 0.3959
 epoch: 88, train_loss: 1.1588, test_loss: 1.1391, test_f1: 0.3990
 epoch: 89, train_loss: 1.1534, test_loss: 1.1358, test_f1: 0.4057
 epoch: 90, train_loss: 1.1493, test_loss: 1.1358, test_f1: 0.4159
 epoch: 91, train_loss: 1.1562, test_loss: 1.1398, test_f1: 0.4011
 epoch: 92, train_loss: 1.1571, test_loss: 1.1417, test_f1: 0.4126
 epoch: 93, train_loss: 1.1535, test_loss: 1.1323, test_f1: 0.4041
 epoch: 94, train_loss: 1.1599, test_loss: 1.1360, test_f1: 0.4022
 epoch: 95, train_loss: 1.1541, test_loss: 1.1368, test_f1: 0.4002
 epoch: 96, train_loss: 1.1513, test_loss: 1.1336, test_f1: 0.4166
 epoch: 97, train_loss: 1.1519, test_loss: 1.1376, test_f1: 0.4091
 epoch: 98, train_loss: 1.1495, test_loss: 1.1365, test_f1: 0.4012
 epoch: 99, train_loss: 1.1544, test_loss: 1.1362, test_f1: 0.4083
##################ITERATION #7 ****************************************
 epoch: 0, train_loss: 1.3403, test_loss: 1.3279, test_f1: 0.2274
 epoch: 1, train_loss: 1.3171, test_loss: 1.3243, test_f1: 0.2274
 epoch: 2, train_loss: 1.3097, test_loss: 1.3132, test_f1: 0.2274
 epoch: 3, train_loss: 1.3010, test_loss: 1.3052, test_f1: 0.2274
 epoch: 4, train_loss: 1.2934, test_loss: 1.2947, test_f1: 0.2274
 epoch: 5, train_loss: 1.2868, test_loss: 1.2909, test_f1: 0.2274
 epoch: 6, train_loss: 1.2822, test_loss: 1.2830, test_f1: 0.2274
 epoch: 7, train_loss: 1.2703, test_loss: 1.2713, test_f1: 0.2274
 epoch: 8, train_loss: 1.2707, test_loss: 1.2704, test_f1: 0.2274
 epoch: 9, train_loss: 1.2623, test_loss: 1.2653, test_f1: 0.2274
 epoch: 10, train_loss: 1.2624, test_loss: 1.2551, test_f1: 0.2274
 epoch: 11, train_loss: 1.2557, test_loss: 1.2523, test_f1: 0.2274
 epoch: 12, train_loss: 1.2540, test_loss: 1.2470, test_f1: 0.2274
 epoch: 13, train_loss: 1.2561, test_loss: 1.2397, test_f1: 0.2417
 epoch: 14, train_loss: 1.2491, test_loss: 1.2387, test_f1: 0.2303
 epoch: 15, train_loss: 1.2489, test_loss: 1.2363, test_f1: 0.2415
 epoch: 16, train_loss: 1.2478, test_loss: 1.2321, test_f1: 0.2303
 epoch: 17, train_loss: 1.2467, test_loss: 1.2285, test_f1: 0.2603
 epoch: 18, train_loss: 1.2496, test_loss: 1.2254, test_f1: 0.2582
 epoch: 19, train_loss: 1.2434, test_loss: 1.2263, test_f1: 0.2445
 epoch: 20, train_loss: 1.2348, test_loss: 1.2186, test_f1: 0.2609
 epoch: 21, train_loss: 1.2447, test_loss: 1.2188, test_f1: 0.2609
 epoch: 22, train_loss: 1.2345, test_loss: 1.2143, test_f1: 0.2609
 epoch: 23, train_loss: 1.2346, test_loss: 1.2123, test_f1: 0.2609
 epoch: 24, train_loss: 1.2344, test_loss: 1.2130, test_f1: 0.2704
 epoch: 25, train_loss: 1.2289, test_loss: 1.2061, test_f1: 0.2682
 epoch: 26, train_loss: 1.2325, test_loss: 1.2068, test_f1: 0.2684
 epoch: 27, train_loss: 1.2270, test_loss: 1.2066, test_f1: 0.2772
 epoch: 28, train_loss: 1.2280, test_loss: 1.2003, test_f1: 0.2931
 epoch: 29, train_loss: 1.2242, test_loss: 1.2005, test_f1: 0.3148
 epoch: 30, train_loss: 1.2195, test_loss: 1.1982, test_f1: 0.3074
 epoch: 31, train_loss: 1.2180, test_loss: 1.1943, test_f1: 0.3161
 epoch: 32, train_loss: 1.2188, test_loss: 1.1956, test_f1: 0.3259
 epoch: 33, train_loss: 1.2194, test_loss: 1.1916, test_f1: 0.3313
 epoch: 34, train_loss: 1.2180, test_loss: 1.1934, test_f1: 0.3335
 epoch: 35, train_loss: 1.2141, test_loss: 1.1877, test_f1: 0.3314
 epoch: 36, train_loss: 1.2170, test_loss: 1.1869, test_f1: 0.3373
 epoch: 37, train_loss: 1.2072, test_loss: 1.1843, test_f1: 0.3489
 epoch: 38, train_loss: 1.2144, test_loss: 1.1833, test_f1: 0.3421
 epoch: 39, train_loss: 1.2046, test_loss: 1.1820, test_f1: 0.3637
 epoch: 40, train_loss: 1.2108, test_loss: 1.1768, test_f1: 0.3515
 epoch: 41, train_loss: 1.2062, test_loss: 1.1773, test_f1: 0.3636
 epoch: 42, train_loss: 1.2047, test_loss: 1.1730, test_f1: 0.3683
 epoch: 43, train_loss: 1.2078, test_loss: 1.1738, test_f1: 0.3690
 epoch: 44, train_loss: 1.1988, test_loss: 1.1713, test_f1: 0.3714
 epoch: 45, train_loss: 1.2039, test_loss: 1.1734, test_f1: 0.3692
 epoch: 46, train_loss: 1.1983, test_loss: 1.1686, test_f1: 0.3717
 epoch: 47, train_loss: 1.1989, test_loss: 1.1677, test_f1: 0.3776
 epoch: 48, train_loss: 1.1965, test_loss: 1.1623, test_f1: 0.3755
 epoch: 49, train_loss: 1.1891, test_loss: 1.1625, test_f1: 0.3845
 epoch: 50, train_loss: 1.1935, test_loss: 1.1566, test_f1: 0.3777
 epoch: 51, train_loss: 1.1929, test_loss: 1.1629, test_f1: 0.3824
 epoch: 52, train_loss: 1.1884, test_loss: 1.1597, test_f1: 0.3865
 epoch: 53, train_loss: 1.1869, test_loss: 1.1591, test_f1: 0.3809
 epoch: 54, train_loss: 1.1871, test_loss: 1.1601, test_f1: 0.3871
 epoch: 55, train_loss: 1.1817, test_loss: 1.1573, test_f1: 0.3868
 epoch: 56, train_loss: 1.1821, test_loss: 1.1564, test_f1: 0.3945
 epoch: 57, train_loss: 1.1870, test_loss: 1.1566, test_f1: 0.3939
 epoch: 58, train_loss: 1.1862, test_loss: 1.1569, test_f1: 0.3930
 epoch: 59, train_loss: 1.1907, test_loss: 1.1534, test_f1: 0.3957
 epoch: 60, train_loss: 1.1866, test_loss: 1.1566, test_f1: 0.3924
 epoch: 61, train_loss: 1.1784, test_loss: 1.1559, test_f1: 0.3956
 epoch: 62, train_loss: 1.1832, test_loss: 1.1546, test_f1: 0.3954
 epoch: 63, train_loss: 1.1826, test_loss: 1.1556, test_f1: 0.3903
 epoch: 64, train_loss: 1.1774, test_loss: 1.1521, test_f1: 0.3904
 epoch: 65, train_loss: 1.1842, test_loss: 1.1528, test_f1: 0.3909
 epoch: 66, train_loss: 1.1757, test_loss: 1.1502, test_f1: 0.3912
 epoch: 67, train_loss: 1.1786, test_loss: 1.1520, test_f1: 0.3937
 epoch: 68, train_loss: 1.1758, test_loss: 1.1500, test_f1: 0.3910
 epoch: 69, train_loss: 1.1793, test_loss: 1.1508, test_f1: 0.3954
 epoch: 70, train_loss: 1.1797, test_loss: 1.1474, test_f1: 0.3986
 epoch: 71, train_loss: 1.1727, test_loss: 1.1464, test_f1: 0.3914
 epoch: 72, train_loss: 1.1742, test_loss: 1.1456, test_f1: 0.3970
 epoch: 73, train_loss: 1.1722, test_loss: 1.1482, test_f1: 0.3938
 epoch: 74, train_loss: 1.1814, test_loss: 1.1460, test_f1: 0.4006
 epoch: 75, train_loss: 1.1709, test_loss: 1.1437, test_f1: 0.3990
 epoch: 76, train_loss: 1.1705, test_loss: 1.1451, test_f1: 0.4014
 epoch: 77, train_loss: 1.1685, test_loss: 1.1442, test_f1: 0.4046
 epoch: 78, train_loss: 1.1694, test_loss: 1.1418, test_f1: 0.4038
 epoch: 79, train_loss: 1.1746, test_loss: 1.1409, test_f1: 0.4052
 epoch: 80, train_loss: 1.1700, test_loss: 1.1465, test_f1: 0.4037
 epoch: 81, train_loss: 1.1667, test_loss: 1.1417, test_f1: 0.4074
 epoch: 82, train_loss: 1.1648, test_loss: 1.1417, test_f1: 0.4101
 epoch: 83, train_loss: 1.1705, test_loss: 1.1428, test_f1: 0.4081
 epoch: 84, train_loss: 1.1691, test_loss: 1.1407, test_f1: 0.3938
 epoch: 85, train_loss: 1.1723, test_loss: 1.1353, test_f1: 0.4097
 epoch: 86, train_loss: 1.1566, test_loss: 1.1364, test_f1: 0.3983
 epoch: 87, train_loss: 1.1702, test_loss: 1.1389, test_f1: 0.4000
 epoch: 88, train_loss: 1.1678, test_loss: 1.1355, test_f1: 0.4120
 epoch: 89, train_loss: 1.1721, test_loss: 1.1390, test_f1: 0.4020
 epoch: 90, train_loss: 1.1680, test_loss: 1.1351, test_f1: 0.4084
 epoch: 91, train_loss: 1.1665, test_loss: 1.1340, test_f1: 0.4127
 epoch: 92, train_loss: 1.1651, test_loss: 1.1344, test_f1: 0.4043
 epoch: 93, train_loss: 1.1594, test_loss: 1.1338, test_f1: 0.4089
 epoch: 94, train_loss: 1.1696, test_loss: 1.1337, test_f1: 0.4107
 epoch: 95, train_loss: 1.1623, test_loss: 1.1332, test_f1: 0.4093
 epoch: 96, train_loss: 1.1520, test_loss: 1.1308, test_f1: 0.4092
 epoch: 97, train_loss: 1.1505, test_loss: 1.1300, test_f1: 0.4099
 epoch: 98, train_loss: 1.1608, test_loss: 1.1302, test_f1: 0.4126
 epoch: 99, train_loss: 1.1538, test_loss: 1.1315, test_f1: 0.4068
##################ITERATION #8 ****************************************
 epoch: 0, train_loss: 1.3534, test_loss: 1.3522, test_f1: 0.2260
 epoch: 1, train_loss: 1.3283, test_loss: 1.3183, test_f1: 0.2230
 epoch: 2, train_loss: 1.3224, test_loss: 1.2948, test_f1: 0.2322
 epoch: 3, train_loss: 1.2994, test_loss: 1.2888, test_f1: 0.2303
 epoch: 4, train_loss: 1.2930, test_loss: 1.2764, test_f1: 0.2369
 epoch: 5, train_loss: 1.2881, test_loss: 1.2738, test_f1: 0.2413
 epoch: 6, train_loss: 1.2782, test_loss: 1.2651, test_f1: 0.2424
 epoch: 7, train_loss: 1.2760, test_loss: 1.2535, test_f1: 0.2801
 epoch: 8, train_loss: 1.2685, test_loss: 1.2556, test_f1: 0.2752
 epoch: 9, train_loss: 1.2675, test_loss: 1.2469, test_f1: 0.2798
 epoch: 10, train_loss: 1.2603, test_loss: 1.2481, test_f1: 0.2804
 epoch: 11, train_loss: 1.2532, test_loss: 1.2408, test_f1: 0.2846
 epoch: 12, train_loss: 1.2567, test_loss: 1.2387, test_f1: 0.2847
 epoch: 13, train_loss: 1.2524, test_loss: 1.2343, test_f1: 0.2842
 epoch: 14, train_loss: 1.2496, test_loss: 1.2285, test_f1: 0.2896
 epoch: 15, train_loss: 1.2426, test_loss: 1.2271, test_f1: 0.2895
 epoch: 16, train_loss: 1.2409, test_loss: 1.2246, test_f1: 0.2895
 epoch: 17, train_loss: 1.2417, test_loss: 1.2212, test_f1: 0.2936
 epoch: 18, train_loss: 1.2385, test_loss: 1.2220, test_f1: 0.2951
 epoch: 19, train_loss: 1.2416, test_loss: 1.2217, test_f1: 0.2929
 epoch: 20, train_loss: 1.2309, test_loss: 1.2166, test_f1: 0.3175
 epoch: 21, train_loss: 1.2387, test_loss: 1.2147, test_f1: 0.3004
 epoch: 22, train_loss: 1.2395, test_loss: 1.2107, test_f1: 0.3027
 epoch: 23, train_loss: 1.2352, test_loss: 1.2053, test_f1: 0.3236
 epoch: 24, train_loss: 1.2250, test_loss: 1.2054, test_f1: 0.3280
 epoch: 25, train_loss: 1.2237, test_loss: 1.2037, test_f1: 0.3289
 epoch: 26, train_loss: 1.2235, test_loss: 1.2010, test_f1: 0.3441
 epoch: 27, train_loss: 1.2264, test_loss: 1.2013, test_f1: 0.3442
 epoch: 28, train_loss: 1.2206, test_loss: 1.1950, test_f1: 0.3559
 epoch: 29, train_loss: 1.2263, test_loss: 1.1971, test_f1: 0.3591
 epoch: 30, train_loss: 1.2174, test_loss: 1.1977, test_f1: 0.3546
 epoch: 31, train_loss: 1.2175, test_loss: 1.1919, test_f1: 0.3525
 epoch: 32, train_loss: 1.2123, test_loss: 1.1877, test_f1: 0.3639
 epoch: 33, train_loss: 1.2173, test_loss: 1.1878, test_f1: 0.3617
 epoch: 34, train_loss: 1.2148, test_loss: 1.1893, test_f1: 0.3559
 epoch: 35, train_loss: 1.2126, test_loss: 1.1845, test_f1: 0.3672
 epoch: 36, train_loss: 1.2109, test_loss: 1.1820, test_f1: 0.3588
 epoch: 37, train_loss: 1.2085, test_loss: 1.1796, test_f1: 0.3646
 epoch: 38, train_loss: 1.2014, test_loss: 1.1823, test_f1: 0.3579
 epoch: 39, train_loss: 1.1993, test_loss: 1.1791, test_f1: 0.3574
 epoch: 40, train_loss: 1.2055, test_loss: 1.1774, test_f1: 0.3615
 epoch: 41, train_loss: 1.2047, test_loss: 1.1723, test_f1: 0.3699
 epoch: 42, train_loss: 1.1974, test_loss: 1.1681, test_f1: 0.3681
 epoch: 43, train_loss: 1.2018, test_loss: 1.1747, test_f1: 0.3652
 epoch: 44, train_loss: 1.2047, test_loss: 1.1683, test_f1: 0.3613
 epoch: 45, train_loss: 1.2016, test_loss: 1.1678, test_f1: 0.3669
 epoch: 46, train_loss: 1.1967, test_loss: 1.1708, test_f1: 0.3774
 epoch: 47, train_loss: 1.1973, test_loss: 1.1649, test_f1: 0.3657
 epoch: 48, train_loss: 1.1944, test_loss: 1.1656, test_f1: 0.3670
 epoch: 49, train_loss: 1.1916, test_loss: 1.1646, test_f1: 0.3674
 epoch: 50, train_loss: 1.1897, test_loss: 1.1562, test_f1: 0.3716
 epoch: 51, train_loss: 1.1877, test_loss: 1.1578, test_f1: 0.3723
 epoch: 52, train_loss: 1.1905, test_loss: 1.1607, test_f1: 0.3700
 epoch: 53, train_loss: 1.1871, test_loss: 1.1612, test_f1: 0.3702
 epoch: 54, train_loss: 1.1853, test_loss: 1.1599, test_f1: 0.3707
 epoch: 55, train_loss: 1.1883, test_loss: 1.1570, test_f1: 0.3684
 epoch: 56, train_loss: 1.1866, test_loss: 1.1529, test_f1: 0.3678
 epoch: 57, train_loss: 1.1879, test_loss: 1.1556, test_f1: 0.3629
 epoch: 58, train_loss: 1.1804, test_loss: 1.1536, test_f1: 0.3701
 epoch: 59, train_loss: 1.1863, test_loss: 1.1537, test_f1: 0.3707
 epoch: 60, train_loss: 1.1818, test_loss: 1.1511, test_f1: 0.3750
 epoch: 61, train_loss: 1.1861, test_loss: 1.1512, test_f1: 0.3764
 epoch: 62, train_loss: 1.1892, test_loss: 1.1525, test_f1: 0.3625
 epoch: 63, train_loss: 1.1811, test_loss: 1.1514, test_f1: 0.3617
 epoch: 64, train_loss: 1.1779, test_loss: 1.1498, test_f1: 0.3702
 epoch: 65, train_loss: 1.1770, test_loss: 1.1475, test_f1: 0.3769
 epoch: 66, train_loss: 1.1701, test_loss: 1.1475, test_f1: 0.3733
 epoch: 67, train_loss: 1.1855, test_loss: 1.1491, test_f1: 0.3751
 epoch: 68, train_loss: 1.1735, test_loss: 1.1477, test_f1: 0.3763
 epoch: 69, train_loss: 1.1737, test_loss: 1.1497, test_f1: 0.3808
 epoch: 70, train_loss: 1.1706, test_loss: 1.1493, test_f1: 0.3748
 epoch: 71, train_loss: 1.1768, test_loss: 1.1442, test_f1: 0.3782
 epoch: 72, train_loss: 1.1791, test_loss: 1.1434, test_f1: 0.3782
 epoch: 73, train_loss: 1.1787, test_loss: 1.1472, test_f1: 0.3773
 epoch: 74, train_loss: 1.1757, test_loss: 1.1476, test_f1: 0.3737
 epoch: 75, train_loss: 1.1761, test_loss: 1.1415, test_f1: 0.3798
 epoch: 76, train_loss: 1.1760, test_loss: 1.1420, test_f1: 0.3813
 epoch: 77, train_loss: 1.1731, test_loss: 1.1412, test_f1: 0.3752
 epoch: 78, train_loss: 1.1710, test_loss: 1.1410, test_f1: 0.3731
 epoch: 79, train_loss: 1.1653, test_loss: 1.1373, test_f1: 0.3889
 epoch: 80, train_loss: 1.1676, test_loss: 1.1448, test_f1: 0.3879
 epoch: 81, train_loss: 1.1679, test_loss: 1.1376, test_f1: 0.3814
 epoch: 82, train_loss: 1.1691, test_loss: 1.1397, test_f1: 0.3780
 epoch: 83, train_loss: 1.1723, test_loss: 1.1407, test_f1: 0.3874
 epoch: 84, train_loss: 1.1714, test_loss: 1.1399, test_f1: 0.3845
 epoch: 85, train_loss: 1.1686, test_loss: 1.1385, test_f1: 0.3747
 epoch: 86, train_loss: 1.1672, test_loss: 1.1383, test_f1: 0.3783
 epoch: 87, train_loss: 1.1652, test_loss: 1.1441, test_f1: 0.3792
 epoch: 88, train_loss: 1.1657, test_loss: 1.1360, test_f1: 0.3825
 epoch: 89, train_loss: 1.1609, test_loss: 1.1355, test_f1: 0.3854
 epoch: 90, train_loss: 1.1664, test_loss: 1.1344, test_f1: 0.3823
 epoch: 91, train_loss: 1.1516, test_loss: 1.1332, test_f1: 0.3823
 epoch: 92, train_loss: 1.1594, test_loss: 1.1299, test_f1: 0.3790
 epoch: 93, train_loss: 1.1659, test_loss: 1.1312, test_f1: 0.3814
 epoch: 94, train_loss: 1.1582, test_loss: 1.1301, test_f1: 0.3910
 epoch: 95, train_loss: 1.1617, test_loss: 1.1286, test_f1: 0.3918
 epoch: 96, train_loss: 1.1577, test_loss: 1.1308, test_f1: 0.3878
 epoch: 97, train_loss: 1.1588, test_loss: 1.1289, test_f1: 0.3887
 epoch: 98, train_loss: 1.1650, test_loss: 1.1308, test_f1: 0.3868
 epoch: 99, train_loss: 1.1656, test_loss: 1.1275, test_f1: 0.3911
##################ITERATION #9 ****************************************
 epoch: 0, train_loss: 1.3308, test_loss: 1.3116, test_f1: 0.2274
 epoch: 1, train_loss: 1.3143, test_loss: 1.3045, test_f1: 0.2274
 epoch: 2, train_loss: 1.3075, test_loss: 1.2962, test_f1: 0.2274
 epoch: 3, train_loss: 1.3004, test_loss: 1.2966, test_f1: 0.2274
 epoch: 4, train_loss: 1.2971, test_loss: 1.2921, test_f1: 0.2274
 epoch: 5, train_loss: 1.2920, test_loss: 1.2856, test_f1: 0.2274
 epoch: 6, train_loss: 1.2874, test_loss: 1.2824, test_f1: 0.2274
 epoch: 7, train_loss: 1.2809, test_loss: 1.2747, test_f1: 0.2325
 epoch: 8, train_loss: 1.2778, test_loss: 1.2720, test_f1: 0.2274
 epoch: 9, train_loss: 1.2701, test_loss: 1.2683, test_f1: 0.2300
 epoch: 10, train_loss: 1.2722, test_loss: 1.2574, test_f1: 0.2449
 epoch: 11, train_loss: 1.2659, test_loss: 1.2517, test_f1: 0.2443
 epoch: 12, train_loss: 1.2634, test_loss: 1.2476, test_f1: 0.2491
 epoch: 13, train_loss: 1.2622, test_loss: 1.2428, test_f1: 0.2536
 epoch: 14, train_loss: 1.2544, test_loss: 1.2441, test_f1: 0.2478
 epoch: 15, train_loss: 1.2586, test_loss: 1.2392, test_f1: 0.2495
 epoch: 16, train_loss: 1.2614, test_loss: 1.2338, test_f1: 0.2678
 epoch: 17, train_loss: 1.2511, test_loss: 1.2346, test_f1: 0.2496
 epoch: 18, train_loss: 1.2490, test_loss: 1.2284, test_f1: 0.2726
 epoch: 19, train_loss: 1.2465, test_loss: 1.2270, test_f1: 0.2721
 epoch: 20, train_loss: 1.2484, test_loss: 1.2256, test_f1: 0.2818
 epoch: 21, train_loss: 1.2395, test_loss: 1.2233, test_f1: 0.3028
 epoch: 22, train_loss: 1.2369, test_loss: 1.2198, test_f1: 0.2964
 epoch: 23, train_loss: 1.2386, test_loss: 1.2175, test_f1: 0.3028
 epoch: 24, train_loss: 1.2399, test_loss: 1.2210, test_f1: 0.2932
 epoch: 25, train_loss: 1.2341, test_loss: 1.2156, test_f1: 0.3039
 epoch: 26, train_loss: 1.2391, test_loss: 1.2141, test_f1: 0.3228
 epoch: 27, train_loss: 1.2334, test_loss: 1.2100, test_f1: 0.3243
 epoch: 28, train_loss: 1.2307, test_loss: 1.2060, test_f1: 0.3168
 epoch: 29, train_loss: 1.2297, test_loss: 1.2035, test_f1: 0.3495
 epoch: 30, train_loss: 1.2244, test_loss: 1.2031, test_f1: 0.3479
 epoch: 31, train_loss: 1.2262, test_loss: 1.2026, test_f1: 0.3471
 epoch: 32, train_loss: 1.2255, test_loss: 1.1991, test_f1: 0.3443
 epoch: 33, train_loss: 1.2251, test_loss: 1.1929, test_f1: 0.3552
 epoch: 34, train_loss: 1.2226, test_loss: 1.1948, test_f1: 0.3562
 epoch: 35, train_loss: 1.2339, test_loss: 1.1945, test_f1: 0.3552
 epoch: 36, train_loss: 1.2172, test_loss: 1.1926, test_f1: 0.3532
 epoch: 37, train_loss: 1.2231, test_loss: 1.1916, test_f1: 0.3584
 epoch: 38, train_loss: 1.2186, test_loss: 1.1955, test_f1: 0.3579
 epoch: 39, train_loss: 1.2167, test_loss: 1.1918, test_f1: 0.3700
 epoch: 40, train_loss: 1.2241, test_loss: 1.1901, test_f1: 0.3595
 epoch: 41, train_loss: 1.2138, test_loss: 1.1891, test_f1: 0.3619
 epoch: 42, train_loss: 1.2137, test_loss: 1.1884, test_f1: 0.3683
 epoch: 43, train_loss: 1.2025, test_loss: 1.1857, test_f1: 0.3719
 epoch: 44, train_loss: 1.2182, test_loss: 1.1852, test_f1: 0.3635
 epoch: 45, train_loss: 1.2047, test_loss: 1.1859, test_f1: 0.3697
 epoch: 46, train_loss: 1.2082, test_loss: 1.1864, test_f1: 0.3613
 epoch: 47, train_loss: 1.2095, test_loss: 1.1842, test_f1: 0.3686
 epoch: 48, train_loss: 1.2122, test_loss: 1.1848, test_f1: 0.3815
 epoch: 49, train_loss: 1.2033, test_loss: 1.1809, test_f1: 0.3847
 epoch: 50, train_loss: 1.2095, test_loss: 1.1782, test_f1: 0.3652
 epoch: 51, train_loss: 1.2054, test_loss: 1.1805, test_f1: 0.3707
 epoch: 52, train_loss: 1.2059, test_loss: 1.1785, test_f1: 0.3774
 epoch: 53, train_loss: 1.2077, test_loss: 1.1806, test_f1: 0.3746
 epoch: 54, train_loss: 1.2003, test_loss: 1.1791, test_f1: 0.3768
 epoch: 55, train_loss: 1.2007, test_loss: 1.1792, test_f1: 0.3774
 epoch: 56, train_loss: 1.2080, test_loss: 1.1790, test_f1: 0.3694
 epoch: 57, train_loss: 1.1940, test_loss: 1.1783, test_f1: 0.3645
 epoch: 58, train_loss: 1.1993, test_loss: 1.1758, test_f1: 0.3685
 epoch: 59, train_loss: 1.2042, test_loss: 1.1749, test_f1: 0.3726
 epoch: 60, train_loss: 1.2024, test_loss: 1.1743, test_f1: 0.3821
 epoch: 61, train_loss: 1.2075, test_loss: 1.1760, test_f1: 0.3683
 epoch: 62, train_loss: 1.1962, test_loss: 1.1780, test_f1: 0.3704
 epoch: 63, train_loss: 1.1954, test_loss: 1.1757, test_f1: 0.3732
 epoch: 64, train_loss: 1.1998, test_loss: 1.1743, test_f1: 0.3769
 epoch: 65, train_loss: 1.1986, test_loss: 1.1713, test_f1: 0.3780
 epoch: 66, train_loss: 1.1974, test_loss: 1.1710, test_f1: 0.3797
 epoch: 67, train_loss: 1.1968, test_loss: 1.1736, test_f1: 0.3715
 epoch: 68, train_loss: 1.1933, test_loss: 1.1712, test_f1: 0.3820
 epoch: 69, train_loss: 1.1987, test_loss: 1.1717, test_f1: 0.3762
 epoch: 70, train_loss: 1.2002, test_loss: 1.1717, test_f1: 0.3814
 epoch: 71, train_loss: 1.2016, test_loss: 1.1722, test_f1: 0.3729
 epoch: 72, train_loss: 1.1955, test_loss: 1.1708, test_f1: 0.3744
 epoch: 73, train_loss: 1.1983, test_loss: 1.1704, test_f1: 0.3703
 epoch: 74, train_loss: 1.1969, test_loss: 1.1694, test_f1: 0.3805
 epoch: 75, train_loss: 1.1976, test_loss: 1.1684, test_f1: 0.3741
 epoch: 76, train_loss: 1.1996, test_loss: 1.1691, test_f1: 0.3816
 epoch: 77, train_loss: 1.1890, test_loss: 1.1674, test_f1: 0.3734
 epoch: 78, train_loss: 1.1925, test_loss: 1.1691, test_f1: 0.3793
 epoch: 79, train_loss: 1.1962, test_loss: 1.1686, test_f1: 0.3855
 epoch: 80, train_loss: 1.1982, test_loss: 1.1671, test_f1: 0.3863
 epoch: 81, train_loss: 1.1910, test_loss: 1.1647, test_f1: 0.3800
 epoch: 82, train_loss: 1.1939, test_loss: 1.1656, test_f1: 0.3773
 epoch: 83, train_loss: 1.1987, test_loss: 1.1653, test_f1: 0.3797
 epoch: 84, train_loss: 1.1939, test_loss: 1.1652, test_f1: 0.3771
 epoch: 85, train_loss: 1.1946, test_loss: 1.1668, test_f1: 0.3787
 epoch: 86, train_loss: 1.1890, test_loss: 1.1669, test_f1: 0.3714
 epoch: 87, train_loss: 1.1881, test_loss: 1.1666, test_f1: 0.3778
 epoch: 88, train_loss: 1.1902, test_loss: 1.1648, test_f1: 0.3796
 epoch: 89, train_loss: 1.1848, test_loss: 1.1624, test_f1: 0.3760
 epoch: 90, train_loss: 1.1895, test_loss: 1.1635, test_f1: 0.3764
 epoch: 91, train_loss: 1.1940, test_loss: 1.1636, test_f1: 0.3787
 epoch: 92, train_loss: 1.1851, test_loss: 1.1644, test_f1: 0.3931
 epoch: 93, train_loss: 1.1863, test_loss: 1.1611, test_f1: 0.3838
 epoch: 94, train_loss: 1.1967, test_loss: 1.1614, test_f1: 0.3792
 epoch: 95, train_loss: 1.1909, test_loss: 1.1629, test_f1: 0.3803
 epoch: 96, train_loss: 1.1845, test_loss: 1.1596, test_f1: 0.3801
 epoch: 97, train_loss: 1.1782, test_loss: 1.1612, test_f1: 0.3810
 epoch: 98, train_loss: 1.1875, test_loss: 1.1608, test_f1: 0.3837
 epoch: 99, train_loss: 1.1774, test_loss: 1.1590, test_f1: 0.3841

Training completed in 733.90 seconds
Best F1: 0.4625 at epoch 59
Mean F1 across iterations: 0.4124  0.0285
========================FINAL RESULTS================================
FEGIN weighted F1: 0.4625  0.0285
python main.py --data ltspice_examples --representation component_component --model FEGIN --layers 5 --hiddens 16 --batch_size 64 --lr 0.0001 --emb_size 128 --epochs 100 --save_appendix component_component_L5_H16_BS64_LR0.0001_E128 --no_val
-----



STDERR:
  File "main.py", line 370, in <module>
    main()
  File "main.py", line 254, in main
    dataset = dataset_class(
  File "/home/philip/projects/ltspice_examples_code_repo/Circuit-Completion-Using-GNNs/component_classification_with_link_prediction_head/evaluation/FEGIN/kernel/circuit_datasets.py", line 15, in __init__
    self.data, self.slices = torch.load(self.processed_paths[0])
  File "/home/philip/.local/lib/python3.8/site-packages/torch/serialization.py", line 1040, in load
    warnings.warn(
  File "/usr/lib/python3.8/warnings.py", line 109, in _showwarnmsg
    sw(msg.message, msg.category, msg.filename, msg.lineno,
  File "main.py", line 47, in warn_with_traceback
    traceback.print_stack(file=log)
/home/philip/projects/ltspice_examples_code_repo/Circuit-Completion-Using-GNNs/component_classification_with_link_prediction_head/evaluation/FEGIN/kernel/circuit_datasets.py:15: FutureWarning: You are using `torch.load` with `weights_only=False` (the current default value), which uses the default pickle module implicitly. It is possible to construct malicious pickle data which will execute arbitrary code during unpickling (See https://github.com/pytorch/pytorch/blob/main/SECURITY.md#untrusted-models for more details). In a future release, the default value for `weights_only` will be flipped to `True`. This limits the functions that could be executed during unpickling. Arbitrary objects will no longer be allowed to be loaded via this mode unless they are explicitly allowlisted by the user via `torch.serialization.add_safe_globals`. We recommend you start setting `weights_only=True` for any use case where you don't have full control of the loaded file. Please open an issue on GitHub for any issues related to this experimental feature.
  self.data, self.slices = torch.load(self.processed_paths[0])
