STDOUT:
Results will be saved in /home/philip/projects/ltspice_examples_code_repo/Circuit-Completion-Using-GNNs/component_classification_with_link_prediction_head/evaluation/FEGIN/results/model_FEGIN_dataset_ltspice_examples
Command line input: python main.py --data ltspice_examples --representation component_pin --model FEGIN --layers 6 --hiddens 32 --batch_size 32 --lr 0.01 --emb_size 512 --epochs 100 --save_appendix component_pin_L6_H32_BS32_LR0.01_E512 --no_val
 is saved.
-----
ltspice_examples - FEGIN
Using 6 layers, 32 hidden units, h = 2
Loading component_pin representation dataset
ENTERED
Training FEGIN on component_pin representation
Train: 3560, Test: 848
##################ITERATION #0 ****************************************
 epoch: 0, train_loss: 1.1948, test_loss: 1.1749, test_f1: 0.3853
 epoch: 1, train_loss: 1.0775, test_loss: 1.0666, test_f1: 0.3414
 epoch: 2, train_loss: 1.0460, test_loss: 1.1266, test_f1: 0.3960
 epoch: 3, train_loss: 1.0269, test_loss: 1.0593, test_f1: 0.4700
 epoch: 4, train_loss: 1.0207, test_loss: 1.1241, test_f1: 0.3595
 epoch: 5, train_loss: 0.9999, test_loss: 1.0132, test_f1: 0.4085
 epoch: 6, train_loss: 0.9735, test_loss: 1.1207, test_f1: 0.4335
 epoch: 7, train_loss: 0.9608, test_loss: 0.9635, test_f1: 0.4228
 epoch: 8, train_loss: 0.9581, test_loss: 0.9589, test_f1: 0.4470
 epoch: 9, train_loss: 0.9419, test_loss: 1.0449, test_f1: 0.4757
 epoch: 10, train_loss: 0.9371, test_loss: 0.9233, test_f1: 0.5104
 epoch: 11, train_loss: 0.9380, test_loss: 0.9159, test_f1: 0.4605
 epoch: 12, train_loss: 0.9212, test_loss: 0.9566, test_f1: 0.5215
 epoch: 13, train_loss: 0.8993, test_loss: 0.9051, test_f1: 0.5843
 epoch: 14, train_loss: 0.8783, test_loss: 0.9039, test_f1: 0.5246
 epoch: 15, train_loss: 0.8783, test_loss: 0.9151, test_f1: 0.5709
 epoch: 16, train_loss: 0.8690, test_loss: 0.8646, test_f1: 0.5203
 epoch: 17, train_loss: 0.8601, test_loss: 0.8389, test_f1: 0.5641
 epoch: 18, train_loss: 0.8615, test_loss: 0.9976, test_f1: 0.4588
 epoch: 19, train_loss: 0.8567, test_loss: 0.8918, test_f1: 0.5091
 epoch: 20, train_loss: 0.8605, test_loss: 0.8900, test_f1: 0.5131
 epoch: 21, train_loss: 0.8535, test_loss: 0.8467, test_f1: 0.5202
 epoch: 22, train_loss: 0.8465, test_loss: 0.8342, test_f1: 0.5401
 epoch: 23, train_loss: 0.8420, test_loss: 0.8759, test_f1: 0.5551
 epoch: 24, train_loss: 0.8455, test_loss: 0.8871, test_f1: 0.5045
 epoch: 25, train_loss: 0.8371, test_loss: 0.8597, test_f1: 0.5132
 epoch: 26, train_loss: 0.8403, test_loss: 0.8348, test_f1: 0.5385
 epoch: 27, train_loss: 0.8290, test_loss: 0.8648, test_f1: 0.5485
 epoch: 28, train_loss: 0.8168, test_loss: 0.8213, test_f1: 0.5397
 epoch: 29, train_loss: 0.8224, test_loss: 0.8570, test_f1: 0.5397
 epoch: 30, train_loss: 0.8358, test_loss: 0.8356, test_f1: 0.5225
 epoch: 31, train_loss: 0.8244, test_loss: 0.8323, test_f1: 0.5555
 epoch: 32, train_loss: 0.8144, test_loss: 0.8052, test_f1: 0.5489
 epoch: 33, train_loss: 0.8051, test_loss: 0.7893, test_f1: 0.5484
 epoch: 34, train_loss: 0.7936, test_loss: 0.9039, test_f1: 0.5473
 epoch: 35, train_loss: 0.8055, test_loss: 0.8605, test_f1: 0.5668
 epoch: 36, train_loss: 0.7923, test_loss: 0.8897, test_f1: 0.5648
 epoch: 37, train_loss: 0.7846, test_loss: 0.8008, test_f1: 0.5666
 epoch: 38, train_loss: 0.7744, test_loss: 0.8510, test_f1: 0.5686
 epoch: 39, train_loss: 0.7885, test_loss: 0.8539, test_f1: 0.5229
 epoch: 40, train_loss: 0.7789, test_loss: 0.8442, test_f1: 0.5641
 epoch: 41, train_loss: 0.7833, test_loss: 0.7815, test_f1: 0.5341
 epoch: 42, train_loss: 0.7857, test_loss: 0.8687, test_f1: 0.5377
 epoch: 43, train_loss: 0.7704, test_loss: 0.8090, test_f1: 0.5909
 epoch: 44, train_loss: 0.7626, test_loss: 0.8473, test_f1: 0.5437
 epoch: 45, train_loss: 0.7634, test_loss: 0.8194, test_f1: 0.5700
 epoch: 46, train_loss: 0.7493, test_loss: 0.9472, test_f1: 0.5604
 epoch: 47, train_loss: 0.7549, test_loss: 0.7945, test_f1: 0.5644
 epoch: 48, train_loss: 0.7667, test_loss: 0.8275, test_f1: 0.5471
 epoch: 49, train_loss: 0.7550, test_loss: 0.9796, test_f1: 0.5187
 epoch: 50, train_loss: 0.7501, test_loss: 0.8900, test_f1: 0.5551
 epoch: 51, train_loss: 0.7262, test_loss: 0.9283, test_f1: 0.5698
 epoch: 52, train_loss: 0.7122, test_loss: 0.8547, test_f1: 0.6090
 epoch: 53, train_loss: 0.7196, test_loss: 0.8201, test_f1: 0.5947
 epoch: 54, train_loss: 0.7138, test_loss: 0.8352, test_f1: 0.5881
 epoch: 55, train_loss: 0.7083, test_loss: 0.8390, test_f1: 0.5820
 epoch: 56, train_loss: 0.7076, test_loss: 0.8580, test_f1: 0.5815
 epoch: 57, train_loss: 0.6951, test_loss: 0.7891, test_f1: 0.5787
 epoch: 58, train_loss: 0.7079, test_loss: 0.8333, test_f1: 0.5859
 epoch: 59, train_loss: 0.7063, test_loss: 0.8845, test_f1: 0.5678
 epoch: 60, train_loss: 0.7071, test_loss: 0.8760, test_f1: 0.5979
 epoch: 61, train_loss: 0.6885, test_loss: 0.8306, test_f1: 0.6268
 epoch: 62, train_loss: 0.6879, test_loss: 0.8546, test_f1: 0.6036
 epoch: 63, train_loss: 0.6757, test_loss: 0.8392, test_f1: 0.6385
 epoch: 64, train_loss: 0.6985, test_loss: 0.9049, test_f1: 0.6081
 epoch: 65, train_loss: 0.6947, test_loss: 0.8247, test_f1: 0.6258
 epoch: 66, train_loss: 0.6762, test_loss: 0.8392, test_f1: 0.5851
 epoch: 67, train_loss: 0.6848, test_loss: 0.9297, test_f1: 0.5853
 epoch: 68, train_loss: 0.6915, test_loss: 0.7790, test_f1: 0.6192
 epoch: 69, train_loss: 0.6768, test_loss: 0.8470, test_f1: 0.6338
 epoch: 70, train_loss: 0.6729, test_loss: 0.8493, test_f1: 0.6283
 epoch: 71, train_loss: 0.6746, test_loss: 0.8525, test_f1: 0.5666
 epoch: 72, train_loss: 0.6700, test_loss: 0.8028, test_f1: 0.6112
 epoch: 73, train_loss: 0.6802, test_loss: 0.8849, test_f1: 0.5736
 epoch: 74, train_loss: 0.6764, test_loss: 0.8179, test_f1: 0.6321
 epoch: 75, train_loss: 0.6885, test_loss: 0.7876, test_f1: 0.5852
 epoch: 76, train_loss: 0.6643, test_loss: 0.8572, test_f1: 0.5868
 epoch: 77, train_loss: 0.6685, test_loss: 0.8394, test_f1: 0.5973
 epoch: 78, train_loss: 0.6625, test_loss: 0.8632, test_f1: 0.6452
 epoch: 79, train_loss: 0.6702, test_loss: 0.8206, test_f1: 0.6094
 epoch: 80, train_loss: 0.6607, test_loss: 0.9160, test_f1: 0.6254
 epoch: 81, train_loss: 0.6643, test_loss: 0.8422, test_f1: 0.6254
 epoch: 82, train_loss: 0.6626, test_loss: 0.8241, test_f1: 0.6163
 epoch: 83, train_loss: 0.6660, test_loss: 0.8164, test_f1: 0.6434
 epoch: 84, train_loss: 0.6576, test_loss: 0.7684, test_f1: 0.6040
 epoch: 85, train_loss: 0.6591, test_loss: 0.7761, test_f1: 0.6313
 epoch: 86, train_loss: 0.6696, test_loss: 0.8111, test_f1: 0.6549
 epoch: 87, train_loss: 0.6601, test_loss: 0.8829, test_f1: 0.6327
 epoch: 88, train_loss: 0.6524, test_loss: 0.8900, test_f1: 0.5903
 epoch: 89, train_loss: 0.6546, test_loss: 0.8440, test_f1: 0.6207
 epoch: 90, train_loss: 0.6547, test_loss: 0.8571, test_f1: 0.6378
 epoch: 91, train_loss: 0.6582, test_loss: 0.8741, test_f1: 0.6069
 epoch: 92, train_loss: 0.6525, test_loss: 0.9060, test_f1: 0.6283
 epoch: 93, train_loss: 0.6486, test_loss: 0.9687, test_f1: 0.6084
 epoch: 94, train_loss: 0.6475, test_loss: 0.9273, test_f1: 0.6115
 epoch: 95, train_loss: 0.6554, test_loss: 0.8399, test_f1: 0.6209
 epoch: 96, train_loss: 0.6604, test_loss: 0.8170, test_f1: 0.6368
 epoch: 97, train_loss: 0.6481, test_loss: 0.7884, test_f1: 0.6468
 epoch: 98, train_loss: 0.6371, test_loss: 0.7715, test_f1: 0.6594
 epoch: 99, train_loss: 0.6458, test_loss: 0.8765, test_f1: 0.5992
##################ITERATION #1 ****************************************
 epoch: 0, train_loss: 1.1352, test_loss: 1.0917, test_f1: 0.3418
 epoch: 1, train_loss: 1.0603, test_loss: 1.1289, test_f1: 0.4447
 epoch: 2, train_loss: 1.0308, test_loss: 1.0829, test_f1: 0.4459
 epoch: 3, train_loss: 1.0172, test_loss: 1.1489, test_f1: 0.4436
 epoch: 4, train_loss: 1.0076, test_loss: 1.1337, test_f1: 0.4634
 epoch: 5, train_loss: 0.9957, test_loss: 1.0100, test_f1: 0.4931
 epoch: 6, train_loss: 0.9825, test_loss: 1.0376, test_f1: 0.4793
 epoch: 7, train_loss: 0.9589, test_loss: 0.9844, test_f1: 0.5399
 epoch: 8, train_loss: 0.9440, test_loss: 0.9744, test_f1: 0.5304
 epoch: 9, train_loss: 0.9254, test_loss: 1.0230, test_f1: 0.5321
 epoch: 10, train_loss: 0.9207, test_loss: 0.9152, test_f1: 0.4863
 epoch: 11, train_loss: 0.9163, test_loss: 0.9864, test_f1: 0.4742
 epoch: 12, train_loss: 0.9067, test_loss: 0.9436, test_f1: 0.4853
 epoch: 13, train_loss: 0.8951, test_loss: 1.0365, test_f1: 0.5341
 epoch: 14, train_loss: 0.8910, test_loss: 0.9689, test_f1: 0.5650
 epoch: 15, train_loss: 0.9019, test_loss: 0.9468, test_f1: 0.5231
 epoch: 16, train_loss: 0.8744, test_loss: 0.9897, test_f1: 0.5142
 epoch: 17, train_loss: 0.8675, test_loss: 0.9654, test_f1: 0.4845
 epoch: 18, train_loss: 0.8696, test_loss: 0.8341, test_f1: 0.5676
 epoch: 19, train_loss: 0.8509, test_loss: 0.9357, test_f1: 0.5513
 epoch: 20, train_loss: 0.9057, test_loss: 0.9264, test_f1: 0.5407
 epoch: 21, train_loss: 0.8708, test_loss: 0.9350, test_f1: 0.5233
 epoch: 22, train_loss: 0.8585, test_loss: 0.9008, test_f1: 0.5107
 epoch: 23, train_loss: 0.8409, test_loss: 0.9420, test_f1: 0.5826
 epoch: 24, train_loss: 0.8268, test_loss: 0.8875, test_f1: 0.5108
 epoch: 25, train_loss: 0.8244, test_loss: 0.8962, test_f1: 0.5292
 epoch: 26, train_loss: 0.8392, test_loss: 0.9586, test_f1: 0.5546
 epoch: 27, train_loss: 0.8378, test_loss: 0.9132, test_f1: 0.5363
 epoch: 28, train_loss: 0.8109, test_loss: 0.8501, test_f1: 0.5362
 epoch: 29, train_loss: 0.8277, test_loss: 0.8912, test_f1: 0.5437
 epoch: 30, train_loss: 0.8248, test_loss: 0.9402, test_f1: 0.5348
 epoch: 31, train_loss: 0.8040, test_loss: 1.1174, test_f1: 0.4950
 epoch: 32, train_loss: 0.8228, test_loss: 1.0492, test_f1: 0.5759
 epoch: 33, train_loss: 0.8117, test_loss: 0.9951, test_f1: 0.6025
 epoch: 34, train_loss: 0.7941, test_loss: 0.8562, test_f1: 0.5580
 epoch: 35, train_loss: 0.8007, test_loss: 0.8972, test_f1: 0.5535
 epoch: 36, train_loss: 0.7732, test_loss: 0.9269, test_f1: 0.5477
 epoch: 37, train_loss: 0.8108, test_loss: 0.9068, test_f1: 0.6285
 epoch: 38, train_loss: 0.8047, test_loss: 0.9011, test_f1: 0.6273
 epoch: 39, train_loss: 0.7834, test_loss: 0.8963, test_f1: 0.5850
 epoch: 40, train_loss: 0.7863, test_loss: 0.9024, test_f1: 0.5827
 epoch: 41, train_loss: 0.7853, test_loss: 0.9355, test_f1: 0.5520
 epoch: 42, train_loss: 0.7763, test_loss: 0.9620, test_f1: 0.5438
 epoch: 43, train_loss: 0.7807, test_loss: 0.8632, test_f1: 0.6289
 epoch: 44, train_loss: 0.7863, test_loss: 0.8145, test_f1: 0.6193
 epoch: 45, train_loss: 0.7740, test_loss: 0.8742, test_f1: 0.6427
 epoch: 46, train_loss: 0.7704, test_loss: 0.9209, test_f1: 0.5496
 epoch: 47, train_loss: 0.7560, test_loss: 0.9613, test_f1: 0.5383
 epoch: 48, train_loss: 0.7701, test_loss: 0.9447, test_f1: 0.6189
 epoch: 49, train_loss: 0.7408, test_loss: 0.9776, test_f1: 0.5898
 epoch: 50, train_loss: 0.7685, test_loss: 0.9053, test_f1: 0.5189
 epoch: 51, train_loss: 0.7306, test_loss: 0.8873, test_f1: 0.5808
 epoch: 52, train_loss: 0.7079, test_loss: 1.0023, test_f1: 0.5920
 epoch: 53, train_loss: 0.7126, test_loss: 0.8741, test_f1: 0.6262
 epoch: 54, train_loss: 0.6992, test_loss: 0.8684, test_f1: 0.5692
 epoch: 55, train_loss: 0.7026, test_loss: 0.9154, test_f1: 0.6361
 epoch: 56, train_loss: 0.6933, test_loss: 0.8825, test_f1: 0.5783
 epoch: 57, train_loss: 0.7120, test_loss: 0.8647, test_f1: 0.6369
 epoch: 58, train_loss: 0.6867, test_loss: 0.8647, test_f1: 0.6686
 epoch: 59, train_loss: 0.6795, test_loss: 1.0347, test_f1: 0.6277
 epoch: 60, train_loss: 0.6766, test_loss: 0.9178, test_f1: 0.6307
 epoch: 61, train_loss: 0.6819, test_loss: 0.8457, test_f1: 0.6557
 epoch: 62, train_loss: 0.6792, test_loss: 0.9738, test_f1: 0.5533
 epoch: 63, train_loss: 0.6884, test_loss: 0.9646, test_f1: 0.6551
 epoch: 64, train_loss: 0.6845, test_loss: 0.9492, test_f1: 0.6404
 epoch: 65, train_loss: 0.6879, test_loss: 0.8687, test_f1: 0.6446
 epoch: 66, train_loss: 0.6933, test_loss: 0.9293, test_f1: 0.6507
 epoch: 67, train_loss: 0.6745, test_loss: 0.9692, test_f1: 0.6066
 epoch: 68, train_loss: 0.6733, test_loss: 0.8715, test_f1: 0.6264
 epoch: 69, train_loss: 0.6782, test_loss: 0.9816, test_f1: 0.6117
 epoch: 70, train_loss: 0.6705, test_loss: 0.9260, test_f1: 0.5991
 epoch: 71, train_loss: 0.6795, test_loss: 1.0000, test_f1: 0.6467
 epoch: 72, train_loss: 0.6678, test_loss: 0.8704, test_f1: 0.6339
 epoch: 73, train_loss: 0.6623, test_loss: 0.9758, test_f1: 0.6736
 epoch: 74, train_loss: 0.6613, test_loss: 0.9561, test_f1: 0.6377
 epoch: 75, train_loss: 0.6517, test_loss: 1.0692, test_f1: 0.6666
 epoch: 76, train_loss: 0.6563, test_loss: 0.9555, test_f1: 0.5926
 epoch: 77, train_loss: 0.6606, test_loss: 0.9344, test_f1: 0.6503
 epoch: 78, train_loss: 0.6536, test_loss: 0.9504, test_f1: 0.6425
 epoch: 79, train_loss: 0.6600, test_loss: 0.9348, test_f1: 0.6476
 epoch: 80, train_loss: 0.6450, test_loss: 0.9129, test_f1: 0.6571
 epoch: 81, train_loss: 0.6639, test_loss: 0.9454, test_f1: 0.6441
 epoch: 82, train_loss: 0.6679, test_loss: 0.8995, test_f1: 0.6642
 epoch: 83, train_loss: 0.6607, test_loss: 0.9965, test_f1: 0.6220
 epoch: 84, train_loss: 0.6572, test_loss: 1.0052, test_f1: 0.6386
 epoch: 85, train_loss: 0.6281, test_loss: 1.0170, test_f1: 0.6338
 epoch: 86, train_loss: 0.6396, test_loss: 0.9538, test_f1: 0.6339
 epoch: 87, train_loss: 0.6431, test_loss: 0.8705, test_f1: 0.6607
 epoch: 88, train_loss: 0.6404, test_loss: 0.9683, test_f1: 0.6511
 epoch: 89, train_loss: 0.6380, test_loss: 0.9882, test_f1: 0.6471
 epoch: 90, train_loss: 0.6416, test_loss: 0.9292, test_f1: 0.6541
 epoch: 91, train_loss: 0.6389, test_loss: 0.9557, test_f1: 0.6596
 epoch: 92, train_loss: 0.6314, test_loss: 0.9170, test_f1: 0.6410
 epoch: 93, train_loss: 0.6285, test_loss: 0.9005, test_f1: 0.6306
 epoch: 94, train_loss: 0.6168, test_loss: 0.9125, test_f1: 0.6477
 epoch: 95, train_loss: 0.6281, test_loss: 0.8629, test_f1: 0.6406
 epoch: 96, train_loss: 0.6335, test_loss: 0.8889, test_f1: 0.6614
 epoch: 97, train_loss: 0.6292, test_loss: 0.9478, test_f1: 0.6406
 epoch: 98, train_loss: 0.6318, test_loss: 0.8935, test_f1: 0.6563
 epoch: 99, train_loss: 0.6165, test_loss: 1.0329, test_f1: 0.6708
##################ITERATION #2 ****************************************
 epoch: 0, train_loss: 1.1345, test_loss: 1.4140, test_f1: 0.3231
 epoch: 1, train_loss: 1.0537, test_loss: 1.0614, test_f1: 0.4511
 epoch: 2, train_loss: 1.0194, test_loss: 1.0104, test_f1: 0.5053
 epoch: 3, train_loss: 0.9812, test_loss: 0.9672, test_f1: 0.5152
 epoch: 4, train_loss: 0.9629, test_loss: 0.9634, test_f1: 0.5245
 epoch: 5, train_loss: 0.9346, test_loss: 1.1862, test_f1: 0.4198
 epoch: 6, train_loss: 0.9189, test_loss: 0.9767, test_f1: 0.4974
 epoch: 7, train_loss: 0.9157, test_loss: 0.9823, test_f1: 0.5076
 epoch: 8, train_loss: 0.9074, test_loss: 1.8409, test_f1: 0.3348
 epoch: 9, train_loss: 0.9098, test_loss: 1.1541, test_f1: 0.3973
 epoch: 10, train_loss: 0.8988, test_loss: 1.3856, test_f1: 0.4041
 epoch: 11, train_loss: 0.8998, test_loss: 0.9945, test_f1: 0.4975
 epoch: 12, train_loss: 0.8878, test_loss: 0.9206, test_f1: 0.5001
 epoch: 13, train_loss: 0.8784, test_loss: 0.9106, test_f1: 0.5098
 epoch: 14, train_loss: 0.8658, test_loss: 0.9663, test_f1: 0.4935
 epoch: 15, train_loss: 0.8623, test_loss: 0.8918, test_f1: 0.5135
 epoch: 16, train_loss: 0.8582, test_loss: 1.0189, test_f1: 0.4898
 epoch: 17, train_loss: 0.8682, test_loss: 0.9924, test_f1: 0.4997
 epoch: 18, train_loss: 0.8554, test_loss: 0.8902, test_f1: 0.5530
 epoch: 19, train_loss: 0.8374, test_loss: 1.0346, test_f1: 0.4414
 epoch: 20, train_loss: 0.8360, test_loss: 0.8328, test_f1: 0.5483
 epoch: 21, train_loss: 0.8214, test_loss: 0.8755, test_f1: 0.5491
 epoch: 22, train_loss: 0.8243, test_loss: 0.8842, test_f1: 0.5287
 epoch: 23, train_loss: 0.8188, test_loss: 0.8982, test_f1: 0.5196
 epoch: 24, train_loss: 0.8185, test_loss: 1.0590, test_f1: 0.4714
 epoch: 25, train_loss: 0.8350, test_loss: 1.0258, test_f1: 0.4639
 epoch: 26, train_loss: 0.8180, test_loss: 0.8937, test_f1: 0.5319
 epoch: 27, train_loss: 0.8167, test_loss: 0.9799, test_f1: 0.4838
 epoch: 28, train_loss: 0.8159, test_loss: 0.8414, test_f1: 0.5405
 epoch: 29, train_loss: 0.8216, test_loss: 0.8756, test_f1: 0.5085
 epoch: 30, train_loss: 0.8064, test_loss: 0.8188, test_f1: 0.5517
 epoch: 31, train_loss: 0.8061, test_loss: 0.8250, test_f1: 0.5346
 epoch: 32, train_loss: 0.7956, test_loss: 0.8949, test_f1: 0.5053
 epoch: 33, train_loss: 0.8296, test_loss: 0.9049, test_f1: 0.4709
 epoch: 34, train_loss: 0.7914, test_loss: 0.8579, test_f1: 0.5409
 epoch: 35, train_loss: 0.7956, test_loss: 0.9425, test_f1: 0.5365
 epoch: 36, train_loss: 0.7889, test_loss: 0.8694, test_f1: 0.5482
 epoch: 37, train_loss: 0.8069, test_loss: 1.0635, test_f1: 0.4778
 epoch: 38, train_loss: 0.7948, test_loss: 0.8331, test_f1: 0.5315
 epoch: 39, train_loss: 0.7863, test_loss: 0.8497, test_f1: 0.5546
 epoch: 40, train_loss: 0.7973, test_loss: 0.9073, test_f1: 0.5675
 epoch: 41, train_loss: 0.7912, test_loss: 0.8629, test_f1: 0.5467
 epoch: 42, train_loss: 0.7781, test_loss: 0.8289, test_f1: 0.5051
 epoch: 43, train_loss: 0.7721, test_loss: 0.8592, test_f1: 0.5541
 epoch: 44, train_loss: 0.7794, test_loss: 0.8640, test_f1: 0.5383
 epoch: 45, train_loss: 0.7724, test_loss: 0.8240, test_f1: 0.5722
 epoch: 46, train_loss: 0.7650, test_loss: 0.8846, test_f1: 0.4870
 epoch: 47, train_loss: 0.7742, test_loss: 0.9262, test_f1: 0.5118
 epoch: 48, train_loss: 0.7785, test_loss: 0.9229, test_f1: 0.4979
 epoch: 49, train_loss: 0.7731, test_loss: 0.8467, test_f1: 0.5424
 epoch: 50, train_loss: 0.7592, test_loss: 0.8138, test_f1: 0.5836
 epoch: 51, train_loss: 0.7381, test_loss: 0.7959, test_f1: 0.5715
 epoch: 52, train_loss: 0.7312, test_loss: 0.8237, test_f1: 0.6095
 epoch: 53, train_loss: 0.7133, test_loss: 0.8238, test_f1: 0.5816
 epoch: 54, train_loss: 0.7173, test_loss: 0.7805, test_f1: 0.6130
 epoch: 55, train_loss: 0.7185, test_loss: 0.8709, test_f1: 0.5352
 epoch: 56, train_loss: 0.7281, test_loss: 0.8410, test_f1: 0.5743
 epoch: 57, train_loss: 0.7291, test_loss: 0.8463, test_f1: 0.5477
 epoch: 58, train_loss: 0.7050, test_loss: 0.8584, test_f1: 0.6010
 epoch: 59, train_loss: 0.7308, test_loss: 0.8312, test_f1: 0.5714
 epoch: 60, train_loss: 0.7109, test_loss: 0.8811, test_f1: 0.5871
 epoch: 61, train_loss: 0.7008, test_loss: 0.8002, test_f1: 0.5604
 epoch: 62, train_loss: 0.7067, test_loss: 0.7903, test_f1: 0.5694
 epoch: 63, train_loss: 0.7025, test_loss: 0.8382, test_f1: 0.6125
 epoch: 64, train_loss: 0.7030, test_loss: 0.8377, test_f1: 0.5973
 epoch: 65, train_loss: 0.7064, test_loss: 0.8056, test_f1: 0.5949
 epoch: 66, train_loss: 0.6877, test_loss: 0.8487, test_f1: 0.6264
 epoch: 67, train_loss: 0.7048, test_loss: 0.8432, test_f1: 0.5845
 epoch: 68, train_loss: 0.6925, test_loss: 0.8606, test_f1: 0.5961
 epoch: 69, train_loss: 0.6886, test_loss: 0.8427, test_f1: 0.6374
 epoch: 70, train_loss: 0.6987, test_loss: 0.7848, test_f1: 0.6386
 epoch: 71, train_loss: 0.6899, test_loss: 0.7894, test_f1: 0.6314
 epoch: 72, train_loss: 0.7003, test_loss: 0.7956, test_f1: 0.6104
 epoch: 73, train_loss: 0.6791, test_loss: 0.8353, test_f1: 0.6604
 epoch: 74, train_loss: 0.6832, test_loss: 0.8092, test_f1: 0.6525
 epoch: 75, train_loss: 0.6828, test_loss: 0.8541, test_f1: 0.6463
 epoch: 76, train_loss: 0.6873, test_loss: 0.8734, test_f1: 0.6138
 epoch: 77, train_loss: 0.6753, test_loss: 0.7966, test_f1: 0.6636
 epoch: 78, train_loss: 0.6816, test_loss: 0.8548, test_f1: 0.6449
 epoch: 79, train_loss: 0.6685, test_loss: 0.8330, test_f1: 0.6346
 epoch: 80, train_loss: 0.6732, test_loss: 0.9265, test_f1: 0.5264
 epoch: 81, train_loss: 0.6976, test_loss: 0.7875, test_f1: 0.6435
 epoch: 82, train_loss: 0.6567, test_loss: 0.8866, test_f1: 0.6359
 epoch: 83, train_loss: 0.6667, test_loss: 0.8508, test_f1: 0.6365
 epoch: 84, train_loss: 0.6492, test_loss: 0.8629, test_f1: 0.6132
 epoch: 85, train_loss: 0.6655, test_loss: 0.8203, test_f1: 0.6571
 epoch: 86, train_loss: 0.6570, test_loss: 0.8898, test_f1: 0.6267
 epoch: 87, train_loss: 0.6551, test_loss: 0.9145, test_f1: 0.6362
 epoch: 88, train_loss: 0.6584, test_loss: 0.8550, test_f1: 0.6163
 epoch: 89, train_loss: 0.6462, test_loss: 0.8904, test_f1: 0.6227
 epoch: 90, train_loss: 0.6749, test_loss: 0.8521, test_f1: 0.6506
 epoch: 91, train_loss: 0.6574, test_loss: 0.8777, test_f1: 0.6307
 epoch: 92, train_loss: 0.6349, test_loss: 0.8501, test_f1: 0.6374
 epoch: 93, train_loss: 0.6715, test_loss: 0.8001, test_f1: 0.6474
 epoch: 94, train_loss: 0.6675, test_loss: 0.8878, test_f1: 0.5984
 epoch: 95, train_loss: 0.6705, test_loss: 0.8301, test_f1: 0.6335
 epoch: 96, train_loss: 0.6764, test_loss: 0.8404, test_f1: 0.6403
 epoch: 97, train_loss: 0.6553, test_loss: 0.8855, test_f1: 0.6185
 epoch: 98, train_loss: 0.6332, test_loss: 0.9367, test_f1: 0.6086
 epoch: 99, train_loss: 0.6415, test_loss: 0.8596, test_f1: 0.6203
##################ITERATION #3 ****************************************
 epoch: 0, train_loss: 1.1309, test_loss: 1.1008, test_f1: 0.4368
 epoch: 1, train_loss: 1.0444, test_loss: 1.0433, test_f1: 0.4065
 epoch: 2, train_loss: 1.0237, test_loss: 1.0745, test_f1: 0.4762
 epoch: 3, train_loss: 1.0013, test_loss: 0.9925, test_f1: 0.4867
 epoch: 4, train_loss: 0.9924, test_loss: 1.0125, test_f1: 0.4911
 epoch: 5, train_loss: 0.9858, test_loss: 1.2837, test_f1: 0.3741
 epoch: 6, train_loss: 0.9708, test_loss: 0.9978, test_f1: 0.4951
 epoch: 7, train_loss: 0.9528, test_loss: 0.8952, test_f1: 0.5320
 epoch: 8, train_loss: 0.9460, test_loss: 0.9552, test_f1: 0.4491
 epoch: 9, train_loss: 0.9410, test_loss: 0.9421, test_f1: 0.4513
 epoch: 10, train_loss: 0.9196, test_loss: 0.9556, test_f1: 0.5064
 epoch: 11, train_loss: 0.8958, test_loss: 0.9341, test_f1: 0.5190
 epoch: 12, train_loss: 0.9062, test_loss: 1.0511, test_f1: 0.4587
 epoch: 13, train_loss: 0.9024, test_loss: 0.9451, test_f1: 0.4963
 epoch: 14, train_loss: 0.9039, test_loss: 0.9928, test_f1: 0.4838
 epoch: 15, train_loss: 0.8690, test_loss: 0.8594, test_f1: 0.5316
 epoch: 16, train_loss: 0.8729, test_loss: 0.9135, test_f1: 0.5339
 epoch: 17, train_loss: 0.8593, test_loss: 0.8408, test_f1: 0.5694
 epoch: 18, train_loss: 0.8512, test_loss: 1.0043, test_f1: 0.5043
 epoch: 19, train_loss: 0.8554, test_loss: 0.8959, test_f1: 0.5255
 epoch: 20, train_loss: 0.8295, test_loss: 0.9295, test_f1: 0.5133
 epoch: 21, train_loss: 0.8598, test_loss: 1.0707, test_f1: 0.4904
 epoch: 22, train_loss: 0.8461, test_loss: 0.9328, test_f1: 0.5324
 epoch: 23, train_loss: 0.8303, test_loss: 1.0135, test_f1: 0.4982
 epoch: 24, train_loss: 0.8239, test_loss: 0.9645, test_f1: 0.4848
 epoch: 25, train_loss: 0.8038, test_loss: 0.9597, test_f1: 0.5928
 epoch: 26, train_loss: 0.8582, test_loss: 0.9080, test_f1: 0.5131
 epoch: 27, train_loss: 0.8135, test_loss: 0.8727, test_f1: 0.5742
 epoch: 28, train_loss: 0.8070, test_loss: 0.8986, test_f1: 0.5047
 epoch: 29, train_loss: 0.8362, test_loss: 0.9709, test_f1: 0.5289
 epoch: 30, train_loss: 0.8096, test_loss: 0.8856, test_f1: 0.5372
 epoch: 31, train_loss: 0.8015, test_loss: 0.9061, test_f1: 0.5573
 epoch: 32, train_loss: 0.7892, test_loss: 1.0146, test_f1: 0.5381
 epoch: 33, train_loss: 0.8007, test_loss: 1.0281, test_f1: 0.4710
 epoch: 34, train_loss: 0.7755, test_loss: 0.9161, test_f1: 0.5345
 epoch: 35, train_loss: 0.7762, test_loss: 0.8984, test_f1: 0.5810
 epoch: 36, train_loss: 0.7739, test_loss: 0.9419, test_f1: 0.5441
 epoch: 37, train_loss: 0.7800, test_loss: 0.8680, test_f1: 0.5181
 epoch: 38, train_loss: 0.7756, test_loss: 0.8669, test_f1: 0.5422
 epoch: 39, train_loss: 0.7776, test_loss: 1.0601, test_f1: 0.4938
 epoch: 40, train_loss: 0.7832, test_loss: 0.8656, test_f1: 0.5452
 epoch: 41, train_loss: 0.7644, test_loss: 0.9304, test_f1: 0.5740
 epoch: 42, train_loss: 0.7622, test_loss: 0.8598, test_f1: 0.6041
 epoch: 43, train_loss: 0.7644, test_loss: 0.8707, test_f1: 0.5490
 epoch: 44, train_loss: 0.7576, test_loss: 0.8773, test_f1: 0.5251
 epoch: 45, train_loss: 0.7629, test_loss: 0.8021, test_f1: 0.5636
 epoch: 46, train_loss: 0.7399, test_loss: 0.8870, test_f1: 0.6294
 epoch: 47, train_loss: 0.7438, test_loss: 0.8504, test_f1: 0.5552
 epoch: 48, train_loss: 0.7369, test_loss: 0.9082, test_f1: 0.5635
 epoch: 49, train_loss: 0.7420, test_loss: 0.8763, test_f1: 0.6162
 epoch: 50, train_loss: 0.7438, test_loss: 1.0157, test_f1: 0.5900
 epoch: 51, train_loss: 0.7217, test_loss: 0.9324, test_f1: 0.6098
 epoch: 52, train_loss: 0.6932, test_loss: 0.9326, test_f1: 0.5991
 epoch: 53, train_loss: 0.6884, test_loss: 0.8650, test_f1: 0.6030
 epoch: 54, train_loss: 0.6957, test_loss: 0.8729, test_f1: 0.5868
 epoch: 55, train_loss: 0.6879, test_loss: 0.8963, test_f1: 0.6346
 epoch: 56, train_loss: 0.6735, test_loss: 0.9090, test_f1: 0.6106
 epoch: 57, train_loss: 0.6861, test_loss: 0.8628, test_f1: 0.5998
 epoch: 58, train_loss: 0.6766, test_loss: 0.9192, test_f1: 0.5533
 epoch: 59, train_loss: 0.6656, test_loss: 0.8993, test_f1: 0.5927
 epoch: 60, train_loss: 0.6670, test_loss: 0.9699, test_f1: 0.5800
 epoch: 61, train_loss: 0.6808, test_loss: 0.9686, test_f1: 0.6065
 epoch: 62, train_loss: 0.6744, test_loss: 0.9178, test_f1: 0.6224
 epoch: 63, train_loss: 0.6682, test_loss: 0.8884, test_f1: 0.6299
 epoch: 64, train_loss: 0.6778, test_loss: 1.0281, test_f1: 0.5942
 epoch: 65, train_loss: 0.6693, test_loss: 0.8730, test_f1: 0.6348
 epoch: 66, train_loss: 0.6606, test_loss: 0.8747, test_f1: 0.6040
 epoch: 67, train_loss: 0.6653, test_loss: 0.9185, test_f1: 0.6188
 epoch: 68, train_loss: 0.6758, test_loss: 0.8493, test_f1: 0.6058
 epoch: 69, train_loss: 0.6590, test_loss: 0.9026, test_f1: 0.6010
 epoch: 70, train_loss: 0.6602, test_loss: 0.8827, test_f1: 0.5975
 epoch: 71, train_loss: 0.6501, test_loss: 0.8699, test_f1: 0.6296
 epoch: 72, train_loss: 0.6486, test_loss: 0.9294, test_f1: 0.5841
 epoch: 73, train_loss: 0.6436, test_loss: 0.9488, test_f1: 0.6029
 epoch: 74, train_loss: 0.6591, test_loss: 0.8659, test_f1: 0.6310
 epoch: 75, train_loss: 0.6458, test_loss: 0.9458, test_f1: 0.6203
 epoch: 76, train_loss: 0.6359, test_loss: 0.9937, test_f1: 0.6312
 epoch: 77, train_loss: 0.6477, test_loss: 0.9310, test_f1: 0.5846
 epoch: 78, train_loss: 0.6410, test_loss: 0.9395, test_f1: 0.6226
 epoch: 79, train_loss: 0.6405, test_loss: 0.9047, test_f1: 0.6207
 epoch: 80, train_loss: 0.6489, test_loss: 0.9051, test_f1: 0.6368
 epoch: 81, train_loss: 0.6420, test_loss: 0.9399, test_f1: 0.6192
 epoch: 82, train_loss: 0.6287, test_loss: 0.8724, test_f1: 0.5960
 epoch: 83, train_loss: 0.6412, test_loss: 0.9219, test_f1: 0.6004
 epoch: 84, train_loss: 0.6248, test_loss: 0.9532, test_f1: 0.6162
 epoch: 85, train_loss: 0.6398, test_loss: 0.9288, test_f1: 0.6186
 epoch: 86, train_loss: 0.6195, test_loss: 0.9542, test_f1: 0.6339
 epoch: 87, train_loss: 0.6367, test_loss: 0.9188, test_f1: 0.6070
 epoch: 88, train_loss: 0.6205, test_loss: 0.9172, test_f1: 0.6337
 epoch: 89, train_loss: 0.6082, test_loss: 0.9363, test_f1: 0.6113
 epoch: 90, train_loss: 0.6043, test_loss: 1.0525, test_f1: 0.5892
 epoch: 91, train_loss: 0.6099, test_loss: 0.9064, test_f1: 0.6210
 epoch: 92, train_loss: 0.6220, test_loss: 0.9617, test_f1: 0.5778
 epoch: 93, train_loss: 0.6086, test_loss: 0.9572, test_f1: 0.6132
 epoch: 94, train_loss: 0.6077, test_loss: 1.0468, test_f1: 0.6360
 epoch: 95, train_loss: 0.6384, test_loss: 0.8665, test_f1: 0.6386
 epoch: 96, train_loss: 0.6167, test_loss: 0.8486, test_f1: 0.6432
 epoch: 97, train_loss: 0.6080, test_loss: 0.8511, test_f1: 0.6518
 epoch: 98, train_loss: 0.6169, test_loss: 0.9120, test_f1: 0.6459
 epoch: 99, train_loss: 0.6093, test_loss: 0.8883, test_f1: 0.6435
##################ITERATION #4 ****************************************
 epoch: 0, train_loss: 1.1643, test_loss: 1.0802, test_f1: 0.3577
 epoch: 1, train_loss: 1.0527, test_loss: 1.0328, test_f1: 0.3813
 epoch: 2, train_loss: 1.0338, test_loss: 1.0851, test_f1: 0.4232
 epoch: 3, train_loss: 1.0323, test_loss: 1.0365, test_f1: 0.4439
 epoch: 4, train_loss: 0.9968, test_loss: 0.9854, test_f1: 0.4696
 epoch: 5, train_loss: 0.9873, test_loss: 1.0355, test_f1: 0.4436
 epoch: 6, train_loss: 0.9730, test_loss: 1.0000, test_f1: 0.4812
 epoch: 7, train_loss: 0.9616, test_loss: 1.0033, test_f1: 0.5046
 epoch: 8, train_loss: 0.9575, test_loss: 1.0183, test_f1: 0.4496
 epoch: 9, train_loss: 0.9324, test_loss: 0.9758, test_f1: 0.5012
 epoch: 10, train_loss: 0.9303, test_loss: 1.0076, test_f1: 0.5026
 epoch: 11, train_loss: 0.9284, test_loss: 0.9064, test_f1: 0.5064
 epoch: 12, train_loss: 0.9186, test_loss: 0.9462, test_f1: 0.5138
 epoch: 13, train_loss: 0.9179, test_loss: 0.9697, test_f1: 0.5000
 epoch: 14, train_loss: 0.9067, test_loss: 0.8767, test_f1: 0.5650
 epoch: 15, train_loss: 0.8989, test_loss: 1.0014, test_f1: 0.5085
 epoch: 16, train_loss: 0.9040, test_loss: 0.9273, test_f1: 0.4984
 epoch: 17, train_loss: 0.8847, test_loss: 0.8719, test_f1: 0.5172
 epoch: 18, train_loss: 0.8728, test_loss: 3.4260, test_f1: 0.4899
 epoch: 19, train_loss: 0.8769, test_loss: 1.0017, test_f1: 0.4869
 epoch: 20, train_loss: 0.8485, test_loss: 0.9991, test_f1: 0.5349
 epoch: 21, train_loss: 0.8576, test_loss: 0.8142, test_f1: 0.5559
 epoch: 22, train_loss: 0.8605, test_loss: 0.8271, test_f1: 0.5867
 epoch: 23, train_loss: 0.8487, test_loss: 0.9113, test_f1: 0.4811
 epoch: 24, train_loss: 0.8580, test_loss: 0.9569, test_f1: 0.5106
 epoch: 25, train_loss: 0.8447, test_loss: 0.8617, test_f1: 0.5369
 epoch: 26, train_loss: 0.8579, test_loss: 0.8786, test_f1: 0.5297
 epoch: 27, train_loss: 0.8383, test_loss: 0.8567, test_f1: 0.5555
 epoch: 28, train_loss: 0.8253, test_loss: 0.8090, test_f1: 0.5680
 epoch: 29, train_loss: 0.8334, test_loss: 0.8444, test_f1: 0.5516
 epoch: 30, train_loss: 0.8375, test_loss: 0.9143, test_f1: 0.5106
 epoch: 31, train_loss: 0.8475, test_loss: 0.8067, test_f1: 0.5395
 epoch: 32, train_loss: 0.8250, test_loss: 0.7846, test_f1: 0.5580
 epoch: 33, train_loss: 0.8205, test_loss: 0.8843, test_f1: 0.5725
 epoch: 34, train_loss: 0.8225, test_loss: 0.8121, test_f1: 0.5248
 epoch: 35, train_loss: 0.8062, test_loss: 0.8164, test_f1: 0.5643
 epoch: 36, train_loss: 0.8181, test_loss: 1.8302, test_f1: 0.5554
 epoch: 37, train_loss: 0.8056, test_loss: 0.8204, test_f1: 0.5679
 epoch: 38, train_loss: 0.7990, test_loss: 0.8176, test_f1: 0.5782
 epoch: 39, train_loss: 0.7892, test_loss: 0.8895, test_f1: 0.6012
 epoch: 40, train_loss: 0.7988, test_loss: 0.8316, test_f1: 0.5478
 epoch: 41, train_loss: 0.7916, test_loss: 1.3577, test_f1: 0.5671
 epoch: 42, train_loss: 0.8084, test_loss: 0.8371, test_f1: 0.6066
 epoch: 43, train_loss: 0.7883, test_loss: 0.8454, test_f1: 0.5561
 epoch: 44, train_loss: 0.8051, test_loss: 0.8204, test_f1: 0.5630
 epoch: 45, train_loss: 0.7778, test_loss: 0.8395, test_f1: 0.5444
 epoch: 46, train_loss: 0.7794, test_loss: 0.8080, test_f1: 0.5643
 epoch: 47, train_loss: 0.7794, test_loss: 0.7321, test_f1: 0.6416
 epoch: 48, train_loss: 0.7632, test_loss: 0.8053, test_f1: 0.5562
 epoch: 49, train_loss: 0.7733, test_loss: 0.7525, test_f1: 0.5748
 epoch: 50, train_loss: 0.7794, test_loss: 0.7417, test_f1: 0.6266
 epoch: 51, train_loss: 0.7366, test_loss: 0.7425, test_f1: 0.6178
 epoch: 52, train_loss: 0.7322, test_loss: 0.7691, test_f1: 0.6317
 epoch: 53, train_loss: 0.7249, test_loss: 0.7290, test_f1: 0.5984
 epoch: 54, train_loss: 0.7171, test_loss: 0.7362, test_f1: 0.6015
 epoch: 55, train_loss: 0.7173, test_loss: 0.7209, test_f1: 0.6304
 epoch: 56, train_loss: 0.7251, test_loss: 0.7546, test_f1: 0.5873
 epoch: 57, train_loss: 0.7248, test_loss: 0.7136, test_f1: 0.6435
 epoch: 58, train_loss: 0.7276, test_loss: 0.7401, test_f1: 0.5866
 epoch: 59, train_loss: 0.7081, test_loss: 0.7312, test_f1: 0.6028
 epoch: 60, train_loss: 0.7127, test_loss: 0.7544, test_f1: 0.5936
 epoch: 61, train_loss: 0.6982, test_loss: 0.7849, test_f1: 0.5730
 epoch: 62, train_loss: 0.7004, test_loss: 0.7563, test_f1: 0.6191
 epoch: 63, train_loss: 0.7064, test_loss: 0.7731, test_f1: 0.5971
 epoch: 64, train_loss: 0.6950, test_loss: 0.7236, test_f1: 0.6079
 epoch: 65, train_loss: 0.6978, test_loss: 0.7447, test_f1: 0.6088
 epoch: 66, train_loss: 0.6866, test_loss: 0.7621, test_f1: 0.6355
 epoch: 67, train_loss: 0.6806, test_loss: 0.7594, test_f1: 0.6405
 epoch: 68, train_loss: 0.6877, test_loss: 0.6940, test_f1: 0.6753
 epoch: 69, train_loss: 0.6971, test_loss: 0.7561, test_f1: 0.6081
 epoch: 70, train_loss: 0.6867, test_loss: 0.7712, test_f1: 0.6273
 epoch: 71, train_loss: 0.6847, test_loss: 0.7273, test_f1: 0.6022
 epoch: 72, train_loss: 0.6847, test_loss: 0.7944, test_f1: 0.6050
 epoch: 73, train_loss: 0.6723, test_loss: 0.8279, test_f1: 0.6232
 epoch: 74, train_loss: 0.6918, test_loss: 0.7746, test_f1: 0.6469
 epoch: 75, train_loss: 0.6794, test_loss: 0.7290, test_f1: 0.6088
 epoch: 76, train_loss: 0.6756, test_loss: 0.7982, test_f1: 0.5821
 epoch: 77, train_loss: 0.6765, test_loss: 0.7355, test_f1: 0.6380
 epoch: 78, train_loss: 0.7064, test_loss: 0.8122, test_f1: 0.6053
 epoch: 79, train_loss: 0.7009, test_loss: 0.7399, test_f1: 0.6305
 epoch: 80, train_loss: 0.6598, test_loss: 0.7527, test_f1: 0.5860
 epoch: 81, train_loss: 0.6659, test_loss: 0.7675, test_f1: 0.6370
 epoch: 82, train_loss: 0.6698, test_loss: 0.8107, test_f1: 0.6075
 epoch: 83, train_loss: 0.6871, test_loss: 0.7437, test_f1: 0.6248
 epoch: 84, train_loss: 0.6665, test_loss: 0.7982, test_f1: 0.6041
 epoch: 85, train_loss: 0.6638, test_loss: 0.8025, test_f1: 0.6303
 epoch: 86, train_loss: 0.6743, test_loss: 0.8306, test_f1: 0.6366
 epoch: 87, train_loss: 0.6649, test_loss: 0.7935, test_f1: 0.6112
 epoch: 88, train_loss: 0.6638, test_loss: 0.7835, test_f1: 0.6276
 epoch: 89, train_loss: 0.6616, test_loss: 0.8101, test_f1: 0.6594
 epoch: 90, train_loss: 0.6503, test_loss: 0.8129, test_f1: 0.6268
 epoch: 91, train_loss: 0.6298, test_loss: 0.7795, test_f1: 0.6500
 epoch: 92, train_loss: 0.6465, test_loss: 0.9343, test_f1: 0.6079
 epoch: 93, train_loss: 0.6618, test_loss: 0.8452, test_f1: 0.6152
 epoch: 94, train_loss: 0.6439, test_loss: 0.8191, test_f1: 0.6377
 epoch: 95, train_loss: 0.6703, test_loss: 0.8607, test_f1: 0.5811
 epoch: 96, train_loss: 0.6461, test_loss: 0.8067, test_f1: 0.6346
 epoch: 97, train_loss: 0.6522, test_loss: 0.7566, test_f1: 0.6210
 epoch: 98, train_loss: 0.6574, test_loss: 0.7934, test_f1: 0.5994
 epoch: 99, train_loss: 0.6369, test_loss: 0.7859, test_f1: 0.5895
##################ITERATION #5 ****************************************
 epoch: 0, train_loss: 1.1329, test_loss: 1.4626, test_f1: 0.2978
 epoch: 1, train_loss: 1.0624, test_loss: 1.0310, test_f1: 0.4404
 epoch: 2, train_loss: 1.0162, test_loss: 1.0104, test_f1: 0.4673
 epoch: 3, train_loss: 1.0044, test_loss: 0.9603, test_f1: 0.5067
 epoch: 4, train_loss: 0.9762, test_loss: 0.9728, test_f1: 0.4647
 epoch: 5, train_loss: 0.9804, test_loss: 1.0259, test_f1: 0.4448
 epoch: 6, train_loss: 0.9562, test_loss: 0.9531, test_f1: 0.4907
 epoch: 7, train_loss: 0.9458, test_loss: 1.5000, test_f1: 0.3700
 epoch: 8, train_loss: 0.9381, test_loss: 0.8920, test_f1: 0.5229
 epoch: 9, train_loss: 0.9370, test_loss: 0.9720, test_f1: 0.4725
 epoch: 10, train_loss: 0.9085, test_loss: 0.9143, test_f1: 0.5288
 epoch: 11, train_loss: 0.8902, test_loss: 0.9492, test_f1: 0.5091
 epoch: 12, train_loss: 0.8922, test_loss: 0.8982, test_f1: 0.5036
 epoch: 13, train_loss: 0.8888, test_loss: 0.8899, test_f1: 0.5442
 epoch: 14, train_loss: 0.8790, test_loss: 0.8120, test_f1: 0.5287
 epoch: 15, train_loss: 0.8713, test_loss: 0.9006, test_f1: 0.5069
 epoch: 16, train_loss: 0.8664, test_loss: 0.8552, test_f1: 0.5326
 epoch: 17, train_loss: 0.8614, test_loss: 0.8618, test_f1: 0.5698
 epoch: 18, train_loss: 0.8453, test_loss: 0.9121, test_f1: 0.4934
 epoch: 19, train_loss: 0.8305, test_loss: 0.8907, test_f1: 0.5241
 epoch: 20, train_loss: 0.8523, test_loss: 0.8391, test_f1: 0.5467
 epoch: 21, train_loss: 0.8466, test_loss: 0.8343, test_f1: 0.5561
 epoch: 22, train_loss: 0.8215, test_loss: 1.6121, test_f1: 0.5430
 epoch: 23, train_loss: 0.8151, test_loss: 0.9213, test_f1: 0.5527
 epoch: 24, train_loss: 0.8247, test_loss: 0.9336, test_f1: 0.4710
 epoch: 25, train_loss: 0.8082, test_loss: 0.8474, test_f1: 0.5505
 epoch: 26, train_loss: 0.8017, test_loss: 0.8893, test_f1: 0.5882
 epoch: 27, train_loss: 0.8004, test_loss: 0.9810, test_f1: 0.5261
 epoch: 28, train_loss: 0.7979, test_loss: 0.8224, test_f1: 0.5621
 epoch: 29, train_loss: 0.8071, test_loss: 0.8199, test_f1: 0.5636
 epoch: 30, train_loss: 0.7889, test_loss: 0.7923, test_f1: 0.5601
 epoch: 31, train_loss: 0.7896, test_loss: 0.8825, test_f1: 0.5580
 epoch: 32, train_loss: 0.8011, test_loss: 0.8773, test_f1: 0.5434
 epoch: 33, train_loss: 0.7901, test_loss: 0.8363, test_f1: 0.5594
 epoch: 34, train_loss: 0.7771, test_loss: 0.7545, test_f1: 0.5495
 epoch: 35, train_loss: 0.7685, test_loss: 0.8070, test_f1: 0.5546
 epoch: 36, train_loss: 0.7965, test_loss: 1.0344, test_f1: 0.5130
 epoch: 37, train_loss: 0.7656, test_loss: 0.7933, test_f1: 0.5607
 epoch: 38, train_loss: 0.7768, test_loss: 0.8106, test_f1: 0.5571
 epoch: 39, train_loss: 0.7736, test_loss: 0.7653, test_f1: 0.5436
 epoch: 40, train_loss: 0.7774, test_loss: 0.8282, test_f1: 0.5561
 epoch: 41, train_loss: 0.7549, test_loss: 0.9773, test_f1: 0.5425
 epoch: 42, train_loss: 0.7505, test_loss: 0.8025, test_f1: 0.5677
 epoch: 43, train_loss: 0.7391, test_loss: 0.8124, test_f1: 0.6090
 epoch: 44, train_loss: 0.7707, test_loss: 0.7738, test_f1: 0.5728
 epoch: 45, train_loss: 0.7606, test_loss: 0.7821, test_f1: 0.6044
 epoch: 46, train_loss: 0.7503, test_loss: 0.7799, test_f1: 0.5925
 epoch: 47, train_loss: 0.7590, test_loss: 0.7587, test_f1: 0.5791
 epoch: 48, train_loss: 0.7396, test_loss: 0.8247, test_f1: 0.5745
 epoch: 49, train_loss: 0.7390, test_loss: 0.8115, test_f1: 0.5485
 epoch: 50, train_loss: 0.7320, test_loss: 0.8921, test_f1: 0.5466
 epoch: 51, train_loss: 0.7078, test_loss: 0.7716, test_f1: 0.5893
 epoch: 52, train_loss: 0.6943, test_loss: 0.7226, test_f1: 0.5939
 epoch: 53, train_loss: 0.6829, test_loss: 0.7716, test_f1: 0.5852
 epoch: 54, train_loss: 0.6911, test_loss: 0.7606, test_f1: 0.5985
 epoch: 55, train_loss: 0.7017, test_loss: 0.7652, test_f1: 0.5805
 epoch: 56, train_loss: 0.6826, test_loss: 0.7089, test_f1: 0.5971
 epoch: 57, train_loss: 0.6739, test_loss: 0.7616, test_f1: 0.5874
 epoch: 58, train_loss: 0.6731, test_loss: 0.7941, test_f1: 0.5916
 epoch: 59, train_loss: 0.6681, test_loss: 0.7848, test_f1: 0.5828
 epoch: 60, train_loss: 0.6648, test_loss: 0.8119, test_f1: 0.5787
 epoch: 61, train_loss: 0.6882, test_loss: 0.8249, test_f1: 0.5739
 epoch: 62, train_loss: 0.6537, test_loss: 0.7427, test_f1: 0.6423
 epoch: 63, train_loss: 0.6781, test_loss: 0.7205, test_f1: 0.6526
 epoch: 64, train_loss: 0.6727, test_loss: 0.7329, test_f1: 0.6239
 epoch: 65, train_loss: 0.6636, test_loss: 0.7268, test_f1: 0.6011
 epoch: 66, train_loss: 0.6407, test_loss: 0.8024, test_f1: 0.6141
 epoch: 67, train_loss: 0.6434, test_loss: 0.7421, test_f1: 0.6247
 epoch: 68, train_loss: 0.6626, test_loss: 0.7310, test_f1: 0.6450
 epoch: 69, train_loss: 0.6577, test_loss: 0.7612, test_f1: 0.6427
 epoch: 70, train_loss: 0.6585, test_loss: 0.7180, test_f1: 0.6175
 epoch: 71, train_loss: 0.6570, test_loss: 0.7391, test_f1: 0.6325
 epoch: 72, train_loss: 0.6407, test_loss: 0.7431, test_f1: 0.6439
 epoch: 73, train_loss: 0.6501, test_loss: 0.7514, test_f1: 0.6764
 epoch: 74, train_loss: 0.6421, test_loss: 0.7282, test_f1: 0.6270
 epoch: 75, train_loss: 0.6407, test_loss: 0.7884, test_f1: 0.5899
 epoch: 76, train_loss: 0.6390, test_loss: 0.7861, test_f1: 0.6052
 epoch: 77, train_loss: 0.6422, test_loss: 0.7960, test_f1: 0.6319
 epoch: 78, train_loss: 0.6474, test_loss: 0.8073, test_f1: 0.6404
 epoch: 79, train_loss: 0.6351, test_loss: 0.8346, test_f1: 0.5906
 epoch: 80, train_loss: 0.6284, test_loss: 0.7288, test_f1: 0.6247
 epoch: 81, train_loss: 0.6161, test_loss: 0.7041, test_f1: 0.7044
 epoch: 82, train_loss: 0.6507, test_loss: 0.7223, test_f1: 0.6660
 epoch: 83, train_loss: 0.6377, test_loss: 0.7579, test_f1: 0.6478
 epoch: 84, train_loss: 0.6230, test_loss: 0.7431, test_f1: 0.6639
 epoch: 85, train_loss: 0.6127, test_loss: 0.7428, test_f1: 0.6478
 epoch: 86, train_loss: 0.6268, test_loss: 0.7124, test_f1: 0.6595
 epoch: 87, train_loss: 0.6118, test_loss: 0.7246, test_f1: 0.6601
 epoch: 88, train_loss: 0.6287, test_loss: 0.8296, test_f1: 0.5984
 epoch: 89, train_loss: 0.6235, test_loss: 0.7682, test_f1: 0.6573
 epoch: 90, train_loss: 0.6286, test_loss: 0.7197, test_f1: 0.6573
 epoch: 91, train_loss: 0.6139, test_loss: 0.7154, test_f1: 0.6501
 epoch: 92, train_loss: 0.6202, test_loss: 0.8418, test_f1: 0.6377
 epoch: 93, train_loss: 0.6334, test_loss: 0.8961, test_f1: 0.6234
 epoch: 94, train_loss: 0.6135, test_loss: 0.7919, test_f1: 0.6307
 epoch: 95, train_loss: 0.6124, test_loss: 0.7777, test_f1: 0.6409
 epoch: 96, train_loss: 0.6358, test_loss: 0.7915, test_f1: 0.6590
 epoch: 97, train_loss: 0.6197, test_loss: 0.7820, test_f1: 0.6346
 epoch: 98, train_loss: 0.6100, test_loss: 0.8224, test_f1: 0.6306
 epoch: 99, train_loss: 0.6270, test_loss: 0.7654, test_f1: 0.6234
##################ITERATION #6 ****************************************
 epoch: 0, train_loss: 1.1851, test_loss: 1.0951, test_f1: 0.3415
 epoch: 1, train_loss: 1.0629, test_loss: 1.0436, test_f1: 0.4106
 epoch: 2, train_loss: 1.0361, test_loss: 1.0957, test_f1: 0.3892
 epoch: 3, train_loss: 1.0280, test_loss: 1.0589, test_f1: 0.4465
 epoch: 4, train_loss: 0.9994, test_loss: 1.7409, test_f1: 0.2772
 epoch: 5, train_loss: 1.0018, test_loss: 1.0054, test_f1: 0.4539
 epoch: 6, train_loss: 0.9557, test_loss: 0.9765, test_f1: 0.4329
 epoch: 7, train_loss: 0.9707, test_loss: 1.1158, test_f1: 0.4593
 epoch: 8, train_loss: 0.9645, test_loss: 1.0619, test_f1: 0.4568
 epoch: 9, train_loss: 0.9425, test_loss: 1.2399, test_f1: 0.3948
 epoch: 10, train_loss: 0.9653, test_loss: 0.9744, test_f1: 0.4714
 epoch: 11, train_loss: 0.9355, test_loss: 0.9439, test_f1: 0.4607
 epoch: 12, train_loss: 0.9205, test_loss: 0.9247, test_f1: 0.5262
 epoch: 13, train_loss: 0.9222, test_loss: 0.8920, test_f1: 0.5224
 epoch: 14, train_loss: 0.8959, test_loss: 0.8271, test_f1: 0.4933
 epoch: 15, train_loss: 0.9057, test_loss: 0.8780, test_f1: 0.5330
 epoch: 16, train_loss: 0.8910, test_loss: 0.8668, test_f1: 0.5061
 epoch: 17, train_loss: 0.8715, test_loss: 0.8469, test_f1: 0.5220
 epoch: 18, train_loss: 0.8820, test_loss: 1.0576, test_f1: 0.4479
 epoch: 19, train_loss: 0.8769, test_loss: 0.8720, test_f1: 0.5088
 epoch: 20, train_loss: 0.8749, test_loss: 0.8451, test_f1: 0.5065
 epoch: 21, train_loss: 0.8624, test_loss: 0.9072, test_f1: 0.4669
 epoch: 22, train_loss: 0.8528, test_loss: 0.8242, test_f1: 0.5329
 epoch: 23, train_loss: 0.8698, test_loss: 0.7993, test_f1: 0.6047
 epoch: 24, train_loss: 0.8721, test_loss: 0.8705, test_f1: 0.5713
 epoch: 25, train_loss: 0.8549, test_loss: 0.8147, test_f1: 0.5761
 epoch: 26, train_loss: 0.8633, test_loss: 0.8500, test_f1: 0.5120
 epoch: 27, train_loss: 0.8623, test_loss: 0.9076, test_f1: 0.4810
 epoch: 28, train_loss: 0.8599, test_loss: 0.8137, test_f1: 0.5842
 epoch: 29, train_loss: 0.8540, test_loss: 0.8895, test_f1: 0.4924
 epoch: 30, train_loss: 0.8403, test_loss: 0.8722, test_f1: 0.5194
 epoch: 31, train_loss: 0.8519, test_loss: 0.9230, test_f1: 0.5042
 epoch: 32, train_loss: 0.8568, test_loss: 0.8253, test_f1: 0.5969
 epoch: 33, train_loss: 0.8451, test_loss: 0.7871, test_f1: 0.5029
 epoch: 34, train_loss: 0.8327, test_loss: 0.8350, test_f1: 0.5186
 epoch: 35, train_loss: 0.8157, test_loss: 0.8089, test_f1: 0.5458
 epoch: 36, train_loss: 0.8208, test_loss: 0.9374, test_f1: 0.5481
 epoch: 37, train_loss: 0.8181, test_loss: 0.8379, test_f1: 0.4958
 epoch: 38, train_loss: 0.8105, test_loss: 0.9918, test_f1: 0.4935
 epoch: 39, train_loss: 0.8326, test_loss: 0.8501, test_f1: 0.5036
 epoch: 40, train_loss: 0.8330, test_loss: 0.8963, test_f1: 0.5228
 epoch: 41, train_loss: 0.8172, test_loss: 0.8381, test_f1: 0.5198
 epoch: 42, train_loss: 0.8201, test_loss: 0.8268, test_f1: 0.5937
 epoch: 43, train_loss: 0.7966, test_loss: 0.8412, test_f1: 0.5368
 epoch: 44, train_loss: 0.8012, test_loss: 0.7836, test_f1: 0.5431
 epoch: 45, train_loss: 0.7986, test_loss: 0.7951, test_f1: 0.5370
 epoch: 46, train_loss: 0.7975, test_loss: 0.8171, test_f1: 0.5857
 epoch: 47, train_loss: 0.7981, test_loss: 0.7685, test_f1: 0.5922
 epoch: 48, train_loss: 0.7881, test_loss: 0.7820, test_f1: 0.5357
 epoch: 49, train_loss: 0.7789, test_loss: 0.9050, test_f1: 0.5275
 epoch: 50, train_loss: 0.7956, test_loss: 0.8359, test_f1: 0.5202
 epoch: 51, train_loss: 0.7571, test_loss: 0.7858, test_f1: 0.5552
 epoch: 52, train_loss: 0.7372, test_loss: 0.8393, test_f1: 0.5311
 epoch: 53, train_loss: 0.7381, test_loss: 0.8020, test_f1: 0.5528
 epoch: 54, train_loss: 0.7314, test_loss: 0.8198, test_f1: 0.5803
 epoch: 55, train_loss: 0.7294, test_loss: 0.7996, test_f1: 0.5550
 epoch: 56, train_loss: 0.7350, test_loss: 0.7710, test_f1: 0.5669
 epoch: 57, train_loss: 0.7268, test_loss: 0.7656, test_f1: 0.5695
 epoch: 58, train_loss: 0.7151, test_loss: 0.7494, test_f1: 0.6012
 epoch: 59, train_loss: 0.7159, test_loss: 0.7811, test_f1: 0.6094
 epoch: 60, train_loss: 0.7066, test_loss: 0.7933, test_f1: 0.6091
 epoch: 61, train_loss: 0.7205, test_loss: 0.7769, test_f1: 0.5729
 epoch: 62, train_loss: 0.7042, test_loss: 0.7918, test_f1: 0.5937
 epoch: 63, train_loss: 0.7039, test_loss: 0.8234, test_f1: 0.5636
 epoch: 64, train_loss: 0.6993, test_loss: 0.7832, test_f1: 0.5670
 epoch: 65, train_loss: 0.7087, test_loss: 0.8176, test_f1: 0.6109
 epoch: 66, train_loss: 0.6889, test_loss: 0.7778, test_f1: 0.6002
 epoch: 67, train_loss: 0.6923, test_loss: 0.7694, test_f1: 0.5956
 epoch: 68, train_loss: 0.6883, test_loss: 0.8198, test_f1: 0.5551
 epoch: 69, train_loss: 0.6985, test_loss: 0.7902, test_f1: 0.6364
 epoch: 70, train_loss: 0.7039, test_loss: 0.7908, test_f1: 0.5496
 epoch: 71, train_loss: 0.6908, test_loss: 0.8920, test_f1: 0.5472
 epoch: 72, train_loss: 0.6978, test_loss: 0.8616, test_f1: 0.5271
 epoch: 73, train_loss: 0.6970, test_loss: 0.7411, test_f1: 0.6324
 epoch: 74, train_loss: 0.6847, test_loss: 0.7520, test_f1: 0.5909
 epoch: 75, train_loss: 0.6859, test_loss: 0.7812, test_f1: 0.6155
 epoch: 76, train_loss: 0.6791, test_loss: 0.8054, test_f1: 0.6160
 epoch: 77, train_loss: 0.6991, test_loss: 0.7676, test_f1: 0.6200
 epoch: 78, train_loss: 0.6840, test_loss: 0.7609, test_f1: 0.6312
 epoch: 79, train_loss: 0.6798, test_loss: 0.7662, test_f1: 0.5967
 epoch: 80, train_loss: 0.6694, test_loss: 0.7723, test_f1: 0.6112
 epoch: 81, train_loss: 0.6710, test_loss: 0.7805, test_f1: 0.6040
 epoch: 82, train_loss: 0.6846, test_loss: 0.7907, test_f1: 0.5595
 epoch: 83, train_loss: 0.6687, test_loss: 0.7929, test_f1: 0.5623
 epoch: 84, train_loss: 0.6796, test_loss: 0.7487, test_f1: 0.6094
 epoch: 85, train_loss: 0.6675, test_loss: 0.7376, test_f1: 0.6448
 epoch: 86, train_loss: 0.6621, test_loss: 0.7762, test_f1: 0.5818
 epoch: 87, train_loss: 0.6705, test_loss: 0.8024, test_f1: 0.6057
 epoch: 88, train_loss: 0.6456, test_loss: 0.7528, test_f1: 0.6051
 epoch: 89, train_loss: 0.6567, test_loss: 0.7769, test_f1: 0.6209
 epoch: 90, train_loss: 0.6578, test_loss: 0.8711, test_f1: 0.6214
 epoch: 91, train_loss: 0.6644, test_loss: 0.7801, test_f1: 0.6210
 epoch: 92, train_loss: 0.6556, test_loss: 0.7914, test_f1: 0.6161
 epoch: 93, train_loss: 0.6558, test_loss: 0.7924, test_f1: 0.6375
 epoch: 94, train_loss: 0.6588, test_loss: 0.7878, test_f1: 0.5958
 epoch: 95, train_loss: 0.6527, test_loss: 0.8106, test_f1: 0.6163
 epoch: 96, train_loss: 0.6497, test_loss: 0.7803, test_f1: 0.6377
 epoch: 97, train_loss: 0.6524, test_loss: 0.7732, test_f1: 0.6384
 epoch: 98, train_loss: 0.6393, test_loss: 0.8657, test_f1: 0.5997
 epoch: 99, train_loss: 0.6653, test_loss: 0.7902, test_f1: 0.6268
##################ITERATION #7 ****************************************
 epoch: 0, train_loss: 1.2144, test_loss: 1.1298, test_f1: 0.4600
 epoch: 1, train_loss: 1.0559, test_loss: 1.4265, test_f1: 0.3207
 epoch: 2, train_loss: 1.0270, test_loss: 1.0295, test_f1: 0.4362
 epoch: 3, train_loss: 0.9977, test_loss: 1.0702, test_f1: 0.4624
 epoch: 4, train_loss: 0.9859, test_loss: 0.9655, test_f1: 0.5386
 epoch: 5, train_loss: 0.9581, test_loss: 0.9229, test_f1: 0.4895
 epoch: 6, train_loss: 0.9503, test_loss: 0.9547, test_f1: 0.5114
 epoch: 7, train_loss: 0.9299, test_loss: 0.9114, test_f1: 0.5037
 epoch: 8, train_loss: 0.9251, test_loss: 0.9041, test_f1: 0.4817
 epoch: 9, train_loss: 0.9243, test_loss: 0.9540, test_f1: 0.4885
 epoch: 10, train_loss: 0.9190, test_loss: 1.0903, test_f1: 0.4619
 epoch: 11, train_loss: 0.9218, test_loss: 0.9258, test_f1: 0.4797
 epoch: 12, train_loss: 0.8925, test_loss: 0.9426, test_f1: 0.5173
 epoch: 13, train_loss: 0.8882, test_loss: 0.9322, test_f1: 0.5092
 epoch: 14, train_loss: 0.9002, test_loss: 0.8900, test_f1: 0.5536
 epoch: 15, train_loss: 0.8729, test_loss: 0.8874, test_f1: 0.5219
 epoch: 16, train_loss: 0.8931, test_loss: 0.8292, test_f1: 0.5372
 epoch: 17, train_loss: 0.8860, test_loss: 0.9086, test_f1: 0.4806
 epoch: 18, train_loss: 0.8650, test_loss: 0.8416, test_f1: 0.5260
 epoch: 19, train_loss: 0.8749, test_loss: 0.9001, test_f1: 0.5388
 epoch: 20, train_loss: 0.8582, test_loss: 1.2914, test_f1: 0.4096
 epoch: 21, train_loss: 0.8694, test_loss: 0.8981, test_f1: 0.5367
 epoch: 22, train_loss: 0.8538, test_loss: 0.8600, test_f1: 0.5475
 epoch: 23, train_loss: 0.8450, test_loss: 0.8687, test_f1: 0.5384
 epoch: 24, train_loss: 0.8537, test_loss: 0.8120, test_f1: 0.5402
 epoch: 25, train_loss: 0.8473, test_loss: 0.7694, test_f1: 0.5507
 epoch: 26, train_loss: 0.8502, test_loss: 0.8975, test_f1: 0.5233
 epoch: 27, train_loss: 0.8486, test_loss: 0.9352, test_f1: 0.4976
 epoch: 28, train_loss: 0.8451, test_loss: 0.7919, test_f1: 0.5543
 epoch: 29, train_loss: 0.8400, test_loss: 0.8126, test_f1: 0.5520
 epoch: 30, train_loss: 0.8322, test_loss: 0.9020, test_f1: 0.5227
 epoch: 31, train_loss: 0.8122, test_loss: 0.7987, test_f1: 0.5792
 epoch: 32, train_loss: 0.8262, test_loss: 0.8493, test_f1: 0.5823
 epoch: 33, train_loss: 0.8276, test_loss: 0.9505, test_f1: 0.5257
 epoch: 34, train_loss: 0.8224, test_loss: 0.9007, test_f1: 0.5892
 epoch: 35, train_loss: 0.8097, test_loss: 0.8274, test_f1: 0.5647
 epoch: 36, train_loss: 0.8140, test_loss: 0.7885, test_f1: 0.5449
 epoch: 37, train_loss: 0.8122, test_loss: 0.8066, test_f1: 0.5154
 epoch: 38, train_loss: 0.8130, test_loss: 0.7873, test_f1: 0.5872
 epoch: 39, train_loss: 0.7956, test_loss: 0.9054, test_f1: 0.5465
 epoch: 40, train_loss: 0.8157, test_loss: 0.9036, test_f1: 0.5392
 epoch: 41, train_loss: 0.8101, test_loss: 0.8673, test_f1: 0.6035
 epoch: 42, train_loss: 0.7922, test_loss: 0.8086, test_f1: 0.5310
 epoch: 43, train_loss: 0.7984, test_loss: 0.8145, test_f1: 0.5360
 epoch: 44, train_loss: 0.7862, test_loss: 0.8350, test_f1: 0.6026
 epoch: 45, train_loss: 0.7945, test_loss: 1.0099, test_f1: 0.4935
 epoch: 46, train_loss: 0.7979, test_loss: 0.8512, test_f1: 0.5807
 epoch: 47, train_loss: 0.7976, test_loss: 0.8633, test_f1: 0.5526
 epoch: 48, train_loss: 0.7636, test_loss: 0.7543, test_f1: 0.5837
 epoch: 49, train_loss: 0.7769, test_loss: 0.8578, test_f1: 0.6051
 epoch: 50, train_loss: 0.7751, test_loss: 0.8370, test_f1: 0.5641
 epoch: 51, train_loss: 0.7346, test_loss: 0.7748, test_f1: 0.5976
 epoch: 52, train_loss: 0.7310, test_loss: 0.8347, test_f1: 0.6108
 epoch: 53, train_loss: 0.7274, test_loss: 0.8253, test_f1: 0.6337
 epoch: 54, train_loss: 0.7075, test_loss: 0.7733, test_f1: 0.5956
 epoch: 55, train_loss: 0.7205, test_loss: 0.7850, test_f1: 0.5973
 epoch: 56, train_loss: 0.7137, test_loss: 0.8043, test_f1: 0.6138
 epoch: 57, train_loss: 0.7323, test_loss: 0.7929, test_f1: 0.5768
 epoch: 58, train_loss: 0.7200, test_loss: 0.8190, test_f1: 0.6540
 epoch: 59, train_loss: 0.6878, test_loss: 0.7991, test_f1: 0.6572
 epoch: 60, train_loss: 0.7019, test_loss: 0.7751, test_f1: 0.6207
 epoch: 61, train_loss: 0.6954, test_loss: 0.8094, test_f1: 0.5725
 epoch: 62, train_loss: 0.6984, test_loss: 0.7621, test_f1: 0.6123
 epoch: 63, train_loss: 0.7135, test_loss: 0.8625, test_f1: 0.5758
 epoch: 64, train_loss: 0.7107, test_loss: 0.9274, test_f1: 0.5667
 epoch: 65, train_loss: 0.7022, test_loss: 0.8844, test_f1: 0.6061
 epoch: 66, train_loss: 0.6850, test_loss: 0.8321, test_f1: 0.6193
 epoch: 67, train_loss: 0.6963, test_loss: 0.8278, test_f1: 0.6313
 epoch: 68, train_loss: 0.6776, test_loss: 0.8174, test_f1: 0.6228
 epoch: 69, train_loss: 0.6979, test_loss: 0.8730, test_f1: 0.6457
 epoch: 70, train_loss: 0.6878, test_loss: 0.8175, test_f1: 0.6416
 epoch: 71, train_loss: 0.6925, test_loss: 0.8299, test_f1: 0.6453
 epoch: 72, train_loss: 0.6957, test_loss: 0.8688, test_f1: 0.6667
 epoch: 73, train_loss: 0.6929, test_loss: 0.9772, test_f1: 0.5832
 epoch: 74, train_loss: 0.6915, test_loss: 0.7949, test_f1: 0.6740
 epoch: 75, train_loss: 0.6755, test_loss: 0.8664, test_f1: 0.6462
 epoch: 76, train_loss: 0.6935, test_loss: 0.8731, test_f1: 0.6086
 epoch: 77, train_loss: 0.6819, test_loss: 0.8859, test_f1: 0.6085
 epoch: 78, train_loss: 0.6732, test_loss: 0.8171, test_f1: 0.6369
 epoch: 79, train_loss: 0.6595, test_loss: 0.7972, test_f1: 0.6093
 epoch: 80, train_loss: 0.6715, test_loss: 0.8871, test_f1: 0.6478
 epoch: 81, train_loss: 0.6636, test_loss: 0.8116, test_f1: 0.6546
 epoch: 82, train_loss: 0.6676, test_loss: 0.9457, test_f1: 0.5688
 epoch: 83, train_loss: 0.6629, test_loss: 0.9090, test_f1: 0.5907
 epoch: 84, train_loss: 0.6693, test_loss: 0.8842, test_f1: 0.6388
 epoch: 85, train_loss: 0.6782, test_loss: 0.8047, test_f1: 0.6525
 epoch: 86, train_loss: 0.6631, test_loss: 0.7517, test_f1: 0.6547
 epoch: 87, train_loss: 0.6704, test_loss: 0.8897, test_f1: 0.6534
 epoch: 88, train_loss: 0.6693, test_loss: 0.8941, test_f1: 0.6364
 epoch: 89, train_loss: 0.6594, test_loss: 0.8584, test_f1: 0.6323
 epoch: 90, train_loss: 0.6357, test_loss: 0.8849, test_f1: 0.6380
 epoch: 91, train_loss: 0.6640, test_loss: 0.8015, test_f1: 0.6315
 epoch: 92, train_loss: 0.6382, test_loss: 0.7748, test_f1: 0.6394
 epoch: 93, train_loss: 0.6417, test_loss: 0.9835, test_f1: 0.5681
 epoch: 94, train_loss: 0.6317, test_loss: 0.9579, test_f1: 0.5948
 epoch: 95, train_loss: 0.6273, test_loss: 0.8036, test_f1: 0.6527
 epoch: 96, train_loss: 0.6541, test_loss: 0.8653, test_f1: 0.6791
 epoch: 97, train_loss: 0.6428, test_loss: 0.8888, test_f1: 0.6317
 epoch: 98, train_loss: 0.6364, test_loss: 0.8811, test_f1: 0.6268
 epoch: 99, train_loss: 0.6336, test_loss: 0.9241, test_f1: 0.5917
##################ITERATION #8 ****************************************
 epoch: 0, train_loss: 1.2496, test_loss: 1.1497, test_f1: 0.3729
 epoch: 1, train_loss: 1.0898, test_loss: 1.0747, test_f1: 0.4754
 epoch: 2, train_loss: 1.0545, test_loss: 1.0543, test_f1: 0.4462
 epoch: 3, train_loss: 1.0067, test_loss: 1.3901, test_f1: 0.3796
 epoch: 4, train_loss: 1.0002, test_loss: 1.0352, test_f1: 0.5069
 epoch: 5, train_loss: 0.9787, test_loss: 0.9491, test_f1: 0.4594
 epoch: 6, train_loss: 0.9604, test_loss: 1.2212, test_f1: 0.4260
 epoch: 7, train_loss: 0.9509, test_loss: 0.9817, test_f1: 0.4660
 epoch: 8, train_loss: 0.9310, test_loss: 0.9531, test_f1: 0.4759
 epoch: 9, train_loss: 0.9219, test_loss: 0.9305, test_f1: 0.5124
 epoch: 10, train_loss: 0.9173, test_loss: 1.0103, test_f1: 0.4980
 epoch: 11, train_loss: 0.9263, test_loss: 0.8817, test_f1: 0.5433
 epoch: 12, train_loss: 0.9064, test_loss: 0.8817, test_f1: 0.5181
 epoch: 13, train_loss: 0.8965, test_loss: 0.8730, test_f1: 0.5274
 epoch: 14, train_loss: 0.8754, test_loss: 1.0770, test_f1: 0.4786
 epoch: 15, train_loss: 0.8824, test_loss: 0.9418, test_f1: 0.5177
 epoch: 16, train_loss: 0.8722, test_loss: 1.1920, test_f1: 0.4434
 epoch: 17, train_loss: 0.8873, test_loss: 0.9022, test_f1: 0.5348
 epoch: 18, train_loss: 0.8972, test_loss: 0.8521, test_f1: 0.5469
 epoch: 19, train_loss: 0.8629, test_loss: 0.8624, test_f1: 0.5638
 epoch: 20, train_loss: 0.8675, test_loss: 0.8090, test_f1: 0.5521
 epoch: 21, train_loss: 0.8713, test_loss: 0.8855, test_f1: 0.5368
 epoch: 22, train_loss: 0.8745, test_loss: 0.8342, test_f1: 0.5379
 epoch: 23, train_loss: 0.8458, test_loss: 0.9572, test_f1: 0.4902
 epoch: 24, train_loss: 0.8575, test_loss: 0.8416, test_f1: 0.5331
 epoch: 25, train_loss: 0.8484, test_loss: 0.9546, test_f1: 0.5278
 epoch: 26, train_loss: 0.8473, test_loss: 0.8422, test_f1: 0.5274
 epoch: 27, train_loss: 0.8379, test_loss: 0.8728, test_f1: 0.6103
 epoch: 28, train_loss: 0.8343, test_loss: 0.8903, test_f1: 0.5281
 epoch: 29, train_loss: 0.8473, test_loss: 0.8398, test_f1: 0.5492
 epoch: 30, train_loss: 0.8143, test_loss: 0.8640, test_f1: 0.5928
 epoch: 31, train_loss: 0.8271, test_loss: 0.9212, test_f1: 0.5138
 epoch: 32, train_loss: 0.8215, test_loss: 0.8647, test_f1: 0.5592
 epoch: 33, train_loss: 0.8379, test_loss: 0.9212, test_f1: 0.5429
 epoch: 34, train_loss: 0.8102, test_loss: 0.8383, test_f1: 0.6064
 epoch: 35, train_loss: 0.8054, test_loss: 0.8926, test_f1: 0.5434
 epoch: 36, train_loss: 0.8129, test_loss: 0.8133, test_f1: 0.6047
 epoch: 37, train_loss: 0.8158, test_loss: 0.9574, test_f1: 0.4845
 epoch: 38, train_loss: 0.8135, test_loss: 0.8362, test_f1: 0.5569
 epoch: 39, train_loss: 0.8018, test_loss: 0.9293, test_f1: 0.5170
 epoch: 40, train_loss: 0.7994, test_loss: 0.8791, test_f1: 0.5402
 epoch: 41, train_loss: 0.7922, test_loss: 0.8760, test_f1: 0.6093
 epoch: 42, train_loss: 0.8028, test_loss: 0.8838, test_f1: 0.5804
 epoch: 43, train_loss: 0.7954, test_loss: 0.8273, test_f1: 0.5645
 epoch: 44, train_loss: 0.7842, test_loss: 0.8511, test_f1: 0.5520
 epoch: 45, train_loss: 0.7744, test_loss: 0.8195, test_f1: 0.5603
 epoch: 46, train_loss: 0.7990, test_loss: 0.9198, test_f1: 0.5176
 epoch: 47, train_loss: 0.7966, test_loss: 0.8040, test_f1: 0.6217
 epoch: 48, train_loss: 0.7774, test_loss: 0.8557, test_f1: 0.5748
 epoch: 49, train_loss: 0.7710, test_loss: 0.8722, test_f1: 0.5541
 epoch: 50, train_loss: 0.7561, test_loss: 0.8830, test_f1: 0.5733
 epoch: 51, train_loss: 0.7398, test_loss: 0.8108, test_f1: 0.5663
 epoch: 52, train_loss: 0.7330, test_loss: 0.8492, test_f1: 0.5891
 epoch: 53, train_loss: 0.7281, test_loss: 0.8503, test_f1: 0.5887
 epoch: 54, train_loss: 0.7419, test_loss: 0.8753, test_f1: 0.5769
 epoch: 55, train_loss: 0.7405, test_loss: 0.8255, test_f1: 0.6131
 epoch: 56, train_loss: 0.7418, test_loss: 0.8288, test_f1: 0.5802
 epoch: 57, train_loss: 0.7261, test_loss: 0.8248, test_f1: 0.6033
 epoch: 58, train_loss: 0.7204, test_loss: 0.9174, test_f1: 0.5938
 epoch: 59, train_loss: 0.7234, test_loss: 0.8354, test_f1: 0.5959
 epoch: 60, train_loss: 0.7268, test_loss: 0.8477, test_f1: 0.5731
 epoch: 61, train_loss: 0.7293, test_loss: 0.8169, test_f1: 0.6446
 epoch: 62, train_loss: 0.7129, test_loss: 0.8381, test_f1: 0.6001
 epoch: 63, train_loss: 0.7032, test_loss: 0.8308, test_f1: 0.5755
 epoch: 64, train_loss: 0.7067, test_loss: 0.9161, test_f1: 0.6430
 epoch: 65, train_loss: 0.7077, test_loss: 0.8710, test_f1: 0.5597
 epoch: 66, train_loss: 0.7172, test_loss: 0.8785, test_f1: 0.5782
 epoch: 67, train_loss: 0.6974, test_loss: 0.8736, test_f1: 0.5906
 epoch: 68, train_loss: 0.7004, test_loss: 0.8742, test_f1: 0.5778
 epoch: 69, train_loss: 0.6924, test_loss: 0.9334, test_f1: 0.5806
 epoch: 70, train_loss: 0.6881, test_loss: 0.8928, test_f1: 0.5792
 epoch: 71, train_loss: 0.6985, test_loss: 0.9278, test_f1: 0.5581
 epoch: 72, train_loss: 0.6837, test_loss: 0.9074, test_f1: 0.6480
 epoch: 73, train_loss: 0.7167, test_loss: 0.8628, test_f1: 0.6054
 epoch: 74, train_loss: 0.6937, test_loss: 0.9206, test_f1: 0.5689
 epoch: 75, train_loss: 0.6857, test_loss: 0.8825, test_f1: 0.6171
 epoch: 76, train_loss: 0.6813, test_loss: 0.9234, test_f1: 0.5973
 epoch: 77, train_loss: 0.6845, test_loss: 0.8787, test_f1: 0.5782
 epoch: 78, train_loss: 0.6730, test_loss: 0.8621, test_f1: 0.6362
 epoch: 79, train_loss: 0.6763, test_loss: 0.8453, test_f1: 0.6550
 epoch: 80, train_loss: 0.6768, test_loss: 0.8824, test_f1: 0.5770
 epoch: 81, train_loss: 0.6783, test_loss: 0.8325, test_f1: 0.6243
 epoch: 82, train_loss: 0.6751, test_loss: 0.8539, test_f1: 0.5773
 epoch: 83, train_loss: 0.6699, test_loss: 0.8407, test_f1: 0.6406
 epoch: 84, train_loss: 0.6496, test_loss: 0.9109, test_f1: 0.6464
 epoch: 85, train_loss: 0.6720, test_loss: 0.9021, test_f1: 0.6377
 epoch: 86, train_loss: 0.6634, test_loss: 0.9066, test_f1: 0.6433
 epoch: 87, train_loss: 0.6573, test_loss: 0.9777, test_f1: 0.5806
 epoch: 88, train_loss: 0.6586, test_loss: 0.9220, test_f1: 0.6581
 epoch: 89, train_loss: 0.6445, test_loss: 1.0084, test_f1: 0.6084
 epoch: 90, train_loss: 0.6624, test_loss: 1.0067, test_f1: 0.6287
 epoch: 91, train_loss: 0.6596, test_loss: 0.9309, test_f1: 0.6002
 epoch: 92, train_loss: 0.6529, test_loss: 0.9147, test_f1: 0.6135
 epoch: 93, train_loss: 0.6575, test_loss: 0.8784, test_f1: 0.6204
 epoch: 94, train_loss: 0.6443, test_loss: 0.8577, test_f1: 0.6094
 epoch: 95, train_loss: 0.6385, test_loss: 0.8641, test_f1: 0.6285
 epoch: 96, train_loss: 0.6439, test_loss: 0.9431, test_f1: 0.6138
 epoch: 97, train_loss: 0.6557, test_loss: 0.8544, test_f1: 0.6614
 epoch: 98, train_loss: 0.6457, test_loss: 0.9147, test_f1: 0.6175
 epoch: 99, train_loss: 0.6506, test_loss: 0.9353, test_f1: 0.6070
##################ITERATION #9 ****************************************
 epoch: 0, train_loss: 1.1545, test_loss: 1.0582, test_f1: 0.4921
 epoch: 1, train_loss: 1.0193, test_loss: 1.0177, test_f1: 0.4225
 epoch: 2, train_loss: 0.9873, test_loss: 0.9716, test_f1: 0.4832
 epoch: 3, train_loss: 0.9808, test_loss: 1.0160, test_f1: 0.5053
 epoch: 4, train_loss: 0.9701, test_loss: 1.0161, test_f1: 0.4942
 epoch: 5, train_loss: 0.9520, test_loss: 1.0503, test_f1: 0.4076
 epoch: 6, train_loss: 0.9385, test_loss: 1.1042, test_f1: 0.4265
 epoch: 7, train_loss: 0.9356, test_loss: 1.0563, test_f1: 0.5191
 epoch: 8, train_loss: 0.9218, test_loss: 0.8995, test_f1: 0.5153
 epoch: 9, train_loss: 0.9140, test_loss: 0.9813, test_f1: 0.4564
 epoch: 10, train_loss: 0.9122, test_loss: 0.9603, test_f1: 0.4827
 epoch: 11, train_loss: 0.8894, test_loss: 0.8999, test_f1: 0.5188
 epoch: 12, train_loss: 0.8875, test_loss: 0.8850, test_f1: 0.5932
 epoch: 13, train_loss: 0.8829, test_loss: 0.9779, test_f1: 0.5093
 epoch: 14, train_loss: 0.8664, test_loss: 1.0335, test_f1: 0.5161
 epoch: 15, train_loss: 0.8810, test_loss: 0.8935, test_f1: 0.5205
 epoch: 16, train_loss: 0.8691, test_loss: 0.8631, test_f1: 0.5332
 epoch: 17, train_loss: 0.8802, test_loss: 0.8372, test_f1: 0.5444
 epoch: 18, train_loss: 0.9221, test_loss: 0.9802, test_f1: 0.5115
 epoch: 19, train_loss: 0.8731, test_loss: 1.0302, test_f1: 0.4796
 epoch: 20, train_loss: 0.8800, test_loss: 0.9250, test_f1: 0.5077
 epoch: 21, train_loss: 0.8555, test_loss: 0.9013, test_f1: 0.5270
 epoch: 22, train_loss: 0.8435, test_loss: 0.9733, test_f1: 0.5316
 epoch: 23, train_loss: 0.8376, test_loss: 1.0996, test_f1: 0.5015
 epoch: 24, train_loss: 0.8537, test_loss: 1.0079, test_f1: 0.5100
 epoch: 25, train_loss: 0.8464, test_loss: 0.7822, test_f1: 0.5555
 epoch: 26, train_loss: 0.8385, test_loss: 0.9791, test_f1: 0.5172
 epoch: 27, train_loss: 0.8418, test_loss: 0.9132, test_f1: 0.5437
 epoch: 28, train_loss: 0.8203, test_loss: 0.9198, test_f1: 0.5791
 epoch: 29, train_loss: 0.8042, test_loss: 0.9024, test_f1: 0.6110
 epoch: 30, train_loss: 0.8136, test_loss: 1.2424, test_f1: 0.4701
 epoch: 31, train_loss: 0.8385, test_loss: 0.8837, test_f1: 0.5503
 epoch: 32, train_loss: 0.7993, test_loss: 0.8376, test_f1: 0.5274
 epoch: 33, train_loss: 0.8303, test_loss: 0.8378, test_f1: 0.5559
 epoch: 34, train_loss: 0.8375, test_loss: 0.8712, test_f1: 0.5970
 epoch: 35, train_loss: 0.8015, test_loss: 0.8556, test_f1: 0.5530
 epoch: 36, train_loss: 0.7903, test_loss: 0.8726, test_f1: 0.5203
 epoch: 37, train_loss: 0.7986, test_loss: 0.8923, test_f1: 0.5332
 epoch: 38, train_loss: 0.8068, test_loss: 0.8773, test_f1: 0.5673
 epoch: 39, train_loss: 0.7792, test_loss: 0.9070, test_f1: 0.6096
 epoch: 40, train_loss: 0.7890, test_loss: 0.9095, test_f1: 0.6162
 epoch: 41, train_loss: 0.7781, test_loss: 0.8879, test_f1: 0.5587
 epoch: 42, train_loss: 0.7708, test_loss: 0.9048, test_f1: 0.5556
 epoch: 43, train_loss: 0.7885, test_loss: 0.9122, test_f1: 0.5850
 epoch: 44, train_loss: 0.7905, test_loss: 0.9358, test_f1: 0.5032
 epoch: 45, train_loss: 0.8102, test_loss: 0.8247, test_f1: 0.6116
 epoch: 46, train_loss: 0.7846, test_loss: 0.8440, test_f1: 0.6086
 epoch: 47, train_loss: 0.7542, test_loss: 0.9128, test_f1: 0.6219
 epoch: 48, train_loss: 0.7637, test_loss: 0.9741, test_f1: 0.5783
 epoch: 49, train_loss: 0.7811, test_loss: 0.8854, test_f1: 0.5863
 epoch: 50, train_loss: 0.7769, test_loss: 0.9480, test_f1: 0.5343
 epoch: 51, train_loss: 0.7504, test_loss: 0.8625, test_f1: 0.6166
 epoch: 52, train_loss: 0.7430, test_loss: 0.8335, test_f1: 0.6172
 epoch: 53, train_loss: 0.7260, test_loss: 0.8228, test_f1: 0.6437
 epoch: 54, train_loss: 0.7201, test_loss: 0.8391, test_f1: 0.5879
 epoch: 55, train_loss: 0.7139, test_loss: 0.8769, test_f1: 0.6280
 epoch: 56, train_loss: 0.7014, test_loss: 0.8790, test_f1: 0.5740
 epoch: 57, train_loss: 0.7342, test_loss: 0.8723, test_f1: 0.6357
 epoch: 58, train_loss: 0.7247, test_loss: 0.8401, test_f1: 0.6359
 epoch: 59, train_loss: 0.7121, test_loss: 0.9044, test_f1: 0.6040
 epoch: 60, train_loss: 0.7132, test_loss: 0.8986, test_f1: 0.6104
 epoch: 61, train_loss: 0.7061, test_loss: 0.9178, test_f1: 0.6396
 epoch: 62, train_loss: 0.6985, test_loss: 0.9685, test_f1: 0.6002
 epoch: 63, train_loss: 0.6815, test_loss: 0.8870, test_f1: 0.6106
 epoch: 64, train_loss: 0.7102, test_loss: 0.8347, test_f1: 0.5922
 epoch: 65, train_loss: 0.7169, test_loss: 0.8991, test_f1: 0.5855
 epoch: 66, train_loss: 0.7186, test_loss: 0.8942, test_f1: 0.6381
 epoch: 67, train_loss: 0.6970, test_loss: 0.9149, test_f1: 0.5490
 epoch: 68, train_loss: 0.7029, test_loss: 0.9613, test_f1: 0.6472
 epoch: 69, train_loss: 0.7028, test_loss: 0.9425, test_f1: 0.6244
 epoch: 70, train_loss: 0.6865, test_loss: 0.9160, test_f1: 0.6205
 epoch: 71, train_loss: 0.6866, test_loss: 0.7981, test_f1: 0.6111
 epoch: 72, train_loss: 0.6957, test_loss: 0.9291, test_f1: 0.6257
 epoch: 73, train_loss: 0.6714, test_loss: 0.8744, test_f1: 0.5979
 epoch: 74, train_loss: 0.6710, test_loss: 0.9055, test_f1: 0.6306
 epoch: 75, train_loss: 0.6789, test_loss: 0.9103, test_f1: 0.6308
 epoch: 76, train_loss: 0.6762, test_loss: 0.9975, test_f1: 0.6281
 epoch: 77, train_loss: 0.6653, test_loss: 0.9653, test_f1: 0.6208
 epoch: 78, train_loss: 0.6658, test_loss: 1.0344, test_f1: 0.6241
 epoch: 79, train_loss: 0.6689, test_loss: 1.0119, test_f1: 0.5874
 epoch: 80, train_loss: 0.6724, test_loss: 0.9573, test_f1: 0.6347
 epoch: 81, train_loss: 0.6879, test_loss: 0.9773, test_f1: 0.6315
 epoch: 82, train_loss: 0.6678, test_loss: 0.9437, test_f1: 0.6764
 epoch: 83, train_loss: 0.6583, test_loss: 0.9324, test_f1: 0.6562
 epoch: 84, train_loss: 0.6538, test_loss: 0.9163, test_f1: 0.6329
 epoch: 85, train_loss: 0.6625, test_loss: 0.9405, test_f1: 0.6554
 epoch: 86, train_loss: 0.6593, test_loss: 0.9889, test_f1: 0.6075
 epoch: 87, train_loss: 0.6557, test_loss: 0.9659, test_f1: 0.6365
 epoch: 88, train_loss: 0.6407, test_loss: 0.8869, test_f1: 0.6519
 epoch: 89, train_loss: 0.6245, test_loss: 1.0210, test_f1: 0.6218
 epoch: 90, train_loss: 0.6479, test_loss: 0.9901, test_f1: 0.6433
 epoch: 91, train_loss: 0.6628, test_loss: 1.0344, test_f1: 0.6288
 epoch: 92, train_loss: 0.6569, test_loss: 0.9127, test_f1: 0.6465
 epoch: 93, train_loss: 0.6560, test_loss: 0.9384, test_f1: 0.6376
 epoch: 94, train_loss: 0.6379, test_loss: 0.9734, test_f1: 0.6616
 epoch: 95, train_loss: 0.6396, test_loss: 0.9194, test_f1: 0.6495
 epoch: 96, train_loss: 0.6399, test_loss: 0.9378, test_f1: 0.6411
 epoch: 97, train_loss: 0.6294, test_loss: 0.8738, test_f1: 0.6489
 epoch: 98, train_loss: 0.6438, test_loss: 0.9749, test_f1: 0.6106
 epoch: 99, train_loss: 0.6625, test_loss: 0.9312, test_f1: 0.6214

Training completed in 1421.97 seconds
Best F1: 0.7044 at epoch 81
Mean F1 across iterations: 0.6690  0.0159
========================FINAL RESULTS================================
FEGIN weighted F1: 0.7044  0.0159
python main.py --data ltspice_examples --representation component_pin --model FEGIN --layers 6 --hiddens 32 --batch_size 32 --lr 0.01 --emb_size 512 --epochs 100 --save_appendix component_pin_L6_H32_BS32_LR0.01_E512 --no_val
-----



STDERR:
  File "main.py", line 370, in <module>
    main()
  File "main.py", line 254, in main
    dataset = dataset_class(
  File "/home/philip/projects/ltspice_examples_code_repo/Circuit-Completion-Using-GNNs/component_classification_with_link_prediction_head/evaluation/FEGIN/kernel/circuit_datasets.py", line 15, in __init__
    self.data, self.slices = torch.load(self.processed_paths[0])
  File "/home/philip/.local/lib/python3.8/site-packages/torch/serialization.py", line 1040, in load
    warnings.warn(
  File "/usr/lib/python3.8/warnings.py", line 109, in _showwarnmsg
    sw(msg.message, msg.category, msg.filename, msg.lineno,
  File "main.py", line 47, in warn_with_traceback
    traceback.print_stack(file=log)
/home/philip/projects/ltspice_examples_code_repo/Circuit-Completion-Using-GNNs/component_classification_with_link_prediction_head/evaluation/FEGIN/kernel/circuit_datasets.py:15: FutureWarning: You are using `torch.load` with `weights_only=False` (the current default value), which uses the default pickle module implicitly. It is possible to construct malicious pickle data which will execute arbitrary code during unpickling (See https://github.com/pytorch/pytorch/blob/main/SECURITY.md#untrusted-models for more details). In a future release, the default value for `weights_only` will be flipped to `True`. This limits the functions that could be executed during unpickling. Arbitrary objects will no longer be allowed to be loaded via this mode unless they are explicitly allowlisted by the user via `torch.serialization.add_safe_globals`. We recommend you start setting `weights_only=True` for any use case where you don't have full control of the loaded file. Please open an issue on GitHub for any issues related to this experimental feature.
  self.data, self.slices = torch.load(self.processed_paths[0])
