STDOUT:
Results will be saved in /home/philip/projects/ltspice_examples_code_repo/Circuit-Completion-Using-GNNs/component_classification_with_link_prediction_head/evaluation/FEGIN/results/model_FEGIN_dataset_ltspice_demos
Command line input: python main.py --data ltspice_demos --representation component_pin_net --model FEGIN --layers 6 --hiddens 128 --batch_size 128 --lr 0.01 --emb_size 250 --epochs 100 --save_appendix component_pin_net_L6_H128_BS128_LR0.01_E250 --no_val
 is saved.
-----
ltspice_demos - FEGIN
Using 6 layers, 128 hidden units, h = 2
Loading component_pin_net representation dataset
ENTERED
Training FEGIN on component_pin_net representation
Train: 1565, Test: 383
##################ITERATION #0 ****************************************
 epoch: 0, train_loss: 1.3759, test_loss: 1.3000, test_f1: 0.1533
 epoch: 1, train_loss: 1.1136, test_loss: 1.1942, test_f1: 0.3837
 epoch: 2, train_loss: 1.0135, test_loss: 1.1074, test_f1: 0.4518
 epoch: 3, train_loss: 0.9878, test_loss: 1.0948, test_f1: 0.4144
 epoch: 4, train_loss: 0.9500, test_loss: 1.0733, test_f1: 0.4965
 epoch: 5, train_loss: 0.9445, test_loss: 1.1635, test_f1: 0.4945
 epoch: 6, train_loss: 0.9281, test_loss: 1.1532, test_f1: 0.4397
 epoch: 7, train_loss: 0.8953, test_loss: 1.0636, test_f1: 0.5289
 epoch: 8, train_loss: 0.8854, test_loss: 1.2423, test_f1: 0.4328
 epoch: 9, train_loss: 0.8984, test_loss: 0.9682, test_f1: 0.5408
 epoch: 10, train_loss: 0.8606, test_loss: 1.4035, test_f1: 0.4885
 epoch: 11, train_loss: 0.8875, test_loss: 0.9795, test_f1: 0.5542
 epoch: 12, train_loss: 0.8411, test_loss: 1.0038, test_f1: 0.5726
 epoch: 13, train_loss: 0.8231, test_loss: 1.3760, test_f1: 0.4222
 epoch: 14, train_loss: 0.8011, test_loss: 0.9749, test_f1: 0.5609
 epoch: 15, train_loss: 0.7941, test_loss: 1.0569, test_f1: 0.5417
 epoch: 16, train_loss: 0.7728, test_loss: 1.3528, test_f1: 0.4432
 epoch: 17, train_loss: 0.7778, test_loss: 1.0561, test_f1: 0.5676
 epoch: 18, train_loss: 0.7677, test_loss: 1.1416, test_f1: 0.5412
 epoch: 19, train_loss: 0.7548, test_loss: 1.0791, test_f1: 0.5446
 epoch: 20, train_loss: 0.7414, test_loss: 1.1745, test_f1: 0.5552
 epoch: 21, train_loss: 0.7142, test_loss: 1.0577, test_f1: 0.5782
 epoch: 22, train_loss: 0.6766, test_loss: 1.1851, test_f1: 0.5509
 epoch: 23, train_loss: 0.6800, test_loss: 1.1407, test_f1: 0.5710
 epoch: 24, train_loss: 0.6428, test_loss: 1.2137, test_f1: 0.5760
 epoch: 25, train_loss: 0.6669, test_loss: 1.2051, test_f1: 0.5404
 epoch: 26, train_loss: 0.6513, test_loss: 1.1671, test_f1: 0.5767
 epoch: 27, train_loss: 0.6485, test_loss: 1.1292, test_f1: 0.6148
 epoch: 28, train_loss: 0.6552, test_loss: 1.6058, test_f1: 0.4830
 epoch: 29, train_loss: 0.6636, test_loss: 1.3363, test_f1: 0.5455
 epoch: 30, train_loss: 0.6605, test_loss: 1.1127, test_f1: 0.5980
 epoch: 31, train_loss: 0.5934, test_loss: 1.3542, test_f1: 0.5416
 epoch: 32, train_loss: 0.6480, test_loss: 1.3365, test_f1: 0.5647
 epoch: 33, train_loss: 0.6046, test_loss: 1.8689, test_f1: 0.4780
 epoch: 34, train_loss: 0.6159, test_loss: 1.1974, test_f1: 0.5654
 epoch: 35, train_loss: 0.6041, test_loss: 1.0655, test_f1: 0.5840
 epoch: 36, train_loss: 0.6412, test_loss: 1.1495, test_f1: 0.6313
 epoch: 37, train_loss: 0.5902, test_loss: 1.1948, test_f1: 0.6324
 epoch: 38, train_loss: 0.5845, test_loss: 1.1569, test_f1: 0.6338
 epoch: 39, train_loss: 0.5777, test_loss: 1.1895, test_f1: 0.5622
 epoch: 40, train_loss: 0.5828, test_loss: 1.4104, test_f1: 0.5162
 epoch: 41, train_loss: 0.5879, test_loss: 1.1832, test_f1: 0.5594
 epoch: 42, train_loss: 0.5656, test_loss: 1.2834, test_f1: 0.4698
 epoch: 43, train_loss: 0.5835, test_loss: 1.3262, test_f1: 0.5562
 epoch: 44, train_loss: 0.5325, test_loss: 1.4589, test_f1: 0.6083
 epoch: 45, train_loss: 0.5114, test_loss: 1.6609, test_f1: 0.5130
 epoch: 46, train_loss: 0.5959, test_loss: 1.2343, test_f1: 0.5599
 epoch: 47, train_loss: 0.5843, test_loss: 1.2192, test_f1: 0.5812
 epoch: 48, train_loss: 0.6017, test_loss: 1.3559, test_f1: 0.5315
 epoch: 49, train_loss: 0.5406, test_loss: 1.5091, test_f1: 0.6020
 epoch: 50, train_loss: 0.5466, test_loss: 1.6607, test_f1: 0.5426
 epoch: 51, train_loss: 0.5002, test_loss: 1.1692, test_f1: 0.6625
 epoch: 52, train_loss: 0.4738, test_loss: 1.5909, test_f1: 0.5589
 epoch: 53, train_loss: 0.4466, test_loss: 1.5235, test_f1: 0.6014
 epoch: 54, train_loss: 0.4359, test_loss: 1.5600, test_f1: 0.6052
 epoch: 55, train_loss: 0.4220, test_loss: 1.6197, test_f1: 0.5732
 epoch: 56, train_loss: 0.4487, test_loss: 2.1018, test_f1: 0.6164
 epoch: 57, train_loss: 0.4031, test_loss: 1.8981, test_f1: 0.5680
 epoch: 58, train_loss: 0.4195, test_loss: 1.6054, test_f1: 0.5922
 epoch: 59, train_loss: 0.4025, test_loss: 1.8480, test_f1: 0.5330
 epoch: 60, train_loss: 0.4409, test_loss: 1.7086, test_f1: 0.5755
 epoch: 61, train_loss: 0.4129, test_loss: 1.6761, test_f1: 0.6277
 epoch: 62, train_loss: 0.3980, test_loss: 1.7247, test_f1: 0.6697
 epoch: 63, train_loss: 0.4111, test_loss: 2.2349, test_f1: 0.5449
 epoch: 64, train_loss: 0.4540, test_loss: 1.5162, test_f1: 0.5984
 epoch: 65, train_loss: 0.3965, test_loss: 1.5503, test_f1: 0.5553
 epoch: 66, train_loss: 0.3969, test_loss: 1.5595, test_f1: 0.5872
 epoch: 67, train_loss: 0.3602, test_loss: 1.7288, test_f1: 0.5668
 epoch: 68, train_loss: 0.3615, test_loss: 1.8668, test_f1: 0.6129
 epoch: 69, train_loss: 0.3475, test_loss: 2.1132, test_f1: 0.5858
 epoch: 70, train_loss: 0.3594, test_loss: 1.8901, test_f1: 0.6456
 epoch: 71, train_loss: 0.3581, test_loss: 1.7715, test_f1: 0.5757
 epoch: 72, train_loss: 0.3663, test_loss: 2.0280, test_f1: 0.5784
 epoch: 73, train_loss: 0.3542, test_loss: 2.1328, test_f1: 0.6145
 epoch: 74, train_loss: 0.3240, test_loss: 1.9616, test_f1: 0.6379
 epoch: 75, train_loss: 0.3832, test_loss: 1.8118, test_f1: 0.6357
 epoch: 76, train_loss: 0.3866, test_loss: 1.8944, test_f1: 0.5922
 epoch: 77, train_loss: 0.3717, test_loss: 1.8390, test_f1: 0.5529
 epoch: 78, train_loss: 0.3581, test_loss: 1.8682, test_f1: 0.6089
 epoch: 79, train_loss: 0.3362, test_loss: 1.7700, test_f1: 0.6173
 epoch: 80, train_loss: 0.2994, test_loss: 1.9957, test_f1: 0.6305
 epoch: 81, train_loss: 0.3248, test_loss: 1.6095, test_f1: 0.6539
 epoch: 82, train_loss: 0.3059, test_loss: 1.9423, test_f1: 0.6107
 epoch: 83, train_loss: 0.3483, test_loss: 1.7904, test_f1: 0.6271
 epoch: 84, train_loss: 0.3077, test_loss: 2.0182, test_f1: 0.6335
 epoch: 85, train_loss: 0.3586, test_loss: 2.1350, test_f1: 0.5858
 epoch: 86, train_loss: 0.3371, test_loss: 1.6347, test_f1: 0.6064
 epoch: 87, train_loss: 0.2934, test_loss: 1.8701, test_f1: 0.5884
 epoch: 88, train_loss: 0.2575, test_loss: 1.9460, test_f1: 0.6773
 epoch: 89, train_loss: 0.2746, test_loss: 1.9057, test_f1: 0.6712
 epoch: 90, train_loss: 0.3329, test_loss: 1.7741, test_f1: 0.5827
 epoch: 91, train_loss: 0.3045, test_loss: 1.9506, test_f1: 0.6115
 epoch: 92, train_loss: 0.2898, test_loss: 2.2031, test_f1: 0.6158
 epoch: 93, train_loss: 0.2621, test_loss: 2.0027, test_f1: 0.6305
 epoch: 94, train_loss: 0.2710, test_loss: 2.6188, test_f1: 0.5729
 epoch: 95, train_loss: 0.3016, test_loss: 2.0491, test_f1: 0.6099
 epoch: 96, train_loss: 0.2739, test_loss: 2.1757, test_f1: 0.5950
 epoch: 97, train_loss: 0.2675, test_loss: 1.9074, test_f1: 0.6459
 epoch: 98, train_loss: 0.2915, test_loss: 2.3409, test_f1: 0.6070
 epoch: 99, train_loss: 0.2833, test_loss: 2.0998, test_f1: 0.6199
##################ITERATION #1 ****************************************
 epoch: 0, train_loss: 1.2654, test_loss: 1.7799, test_f1: 0.3117
 epoch: 1, train_loss: 1.0363, test_loss: 1.3660, test_f1: 0.3439
 epoch: 2, train_loss: 1.0011, test_loss: 1.1258, test_f1: 0.4309
 epoch: 3, train_loss: 0.9780, test_loss: 1.6110, test_f1: 0.4626
 epoch: 4, train_loss: 0.9421, test_loss: 1.3506, test_f1: 0.4521
 epoch: 5, train_loss: 0.9070, test_loss: 1.3345, test_f1: 0.3818
 epoch: 6, train_loss: 0.8977, test_loss: 1.0731, test_f1: 0.4742
 epoch: 7, train_loss: 0.8631, test_loss: 1.2613, test_f1: 0.5553
 epoch: 8, train_loss: 0.8514, test_loss: 1.1861, test_f1: 0.4864
 epoch: 9, train_loss: 0.8068, test_loss: 1.2183, test_f1: 0.4518
 epoch: 10, train_loss: 0.7797, test_loss: 1.4619, test_f1: 0.4158
 epoch: 11, train_loss: 0.8355, test_loss: 1.0749, test_f1: 0.5737
 epoch: 12, train_loss: 0.8248, test_loss: 1.0712, test_f1: 0.4784
 epoch: 13, train_loss: 0.7785, test_loss: 1.3091, test_f1: 0.4589
 epoch: 14, train_loss: 0.7522, test_loss: 1.3286, test_f1: 0.4659
 epoch: 15, train_loss: 0.7217, test_loss: 1.2806, test_f1: 0.4080
 epoch: 16, train_loss: 0.7188, test_loss: 1.1890, test_f1: 0.4555
 epoch: 17, train_loss: 0.7410, test_loss: 1.4898, test_f1: 0.4390
 epoch: 18, train_loss: 0.7311, test_loss: 1.2788, test_f1: 0.5411
 epoch: 19, train_loss: 0.7246, test_loss: 1.6967, test_f1: 0.4104
 epoch: 20, train_loss: 0.6806, test_loss: 2.2318, test_f1: 0.4153
 epoch: 21, train_loss: 0.6805, test_loss: 1.4630, test_f1: 0.5371
 epoch: 22, train_loss: 0.6922, test_loss: 1.1659, test_f1: 0.5185
 epoch: 23, train_loss: 0.6604, test_loss: 1.4077, test_f1: 0.5212
 epoch: 24, train_loss: 0.6419, test_loss: 1.4283, test_f1: 0.5358
 epoch: 25, train_loss: 0.6789, test_loss: 1.6160, test_f1: 0.5070
 epoch: 26, train_loss: 0.6355, test_loss: 1.8423, test_f1: 0.4965
 epoch: 27, train_loss: 0.6282, test_loss: 1.6214, test_f1: 0.5578
 epoch: 28, train_loss: 0.6461, test_loss: 1.5206, test_f1: 0.4771
 epoch: 29, train_loss: 0.6504, test_loss: 1.6395, test_f1: 0.4921
 epoch: 30, train_loss: 0.6276, test_loss: 1.6127, test_f1: 0.5088
 epoch: 31, train_loss: 0.5909, test_loss: 1.4693, test_f1: 0.6002
 epoch: 32, train_loss: 0.5883, test_loss: 1.3315, test_f1: 0.5154
 epoch: 33, train_loss: 0.5744, test_loss: 2.3313, test_f1: 0.4119
 epoch: 34, train_loss: 0.5991, test_loss: 1.7032, test_f1: 0.5278
 epoch: 35, train_loss: 0.6589, test_loss: 2.5251, test_f1: 0.3952
 epoch: 36, train_loss: 0.6538, test_loss: 1.5269, test_f1: 0.5160
 epoch: 37, train_loss: 0.6084, test_loss: 1.5220, test_f1: 0.5451
 epoch: 38, train_loss: 0.5649, test_loss: 1.4397, test_f1: 0.5590
 epoch: 39, train_loss: 0.5826, test_loss: 1.8768, test_f1: 0.4996
 epoch: 40, train_loss: 0.5698, test_loss: 1.8296, test_f1: 0.5439
 epoch: 41, train_loss: 0.5665, test_loss: 1.8191, test_f1: 0.5047
 epoch: 42, train_loss: 0.5683, test_loss: 1.4143, test_f1: 0.5850
 epoch: 43, train_loss: 0.5898, test_loss: 1.5006, test_f1: 0.6490
 epoch: 44, train_loss: 0.5276, test_loss: 1.5667, test_f1: 0.5614
 epoch: 45, train_loss: 0.5343, test_loss: 1.9030, test_f1: 0.5533
 epoch: 46, train_loss: 0.5476, test_loss: 1.8657, test_f1: 0.5145
 epoch: 47, train_loss: 0.5366, test_loss: 1.8717, test_f1: 0.5326
 epoch: 48, train_loss: 0.5525, test_loss: 1.9203, test_f1: 0.5293
 epoch: 49, train_loss: 0.5224, test_loss: 2.1386, test_f1: 0.4541
 epoch: 50, train_loss: 0.5423, test_loss: 1.8977, test_f1: 0.5331
 epoch: 51, train_loss: 0.5015, test_loss: 1.5633, test_f1: 0.5924
 epoch: 52, train_loss: 0.4571, test_loss: 1.6901, test_f1: 0.5876
 epoch: 53, train_loss: 0.4224, test_loss: 1.8767, test_f1: 0.5659
 epoch: 54, train_loss: 0.4086, test_loss: 1.8532, test_f1: 0.5812
 epoch: 55, train_loss: 0.3906, test_loss: 1.7290, test_f1: 0.6192
 epoch: 56, train_loss: 0.4070, test_loss: 2.1128, test_f1: 0.5640
 epoch: 57, train_loss: 0.4001, test_loss: 2.1689, test_f1: 0.5617
 epoch: 58, train_loss: 0.3920, test_loss: 2.1950, test_f1: 0.5543
 epoch: 59, train_loss: 0.4200, test_loss: 1.9841, test_f1: 0.5614
 epoch: 60, train_loss: 0.4029, test_loss: 1.8700, test_f1: 0.5476
 epoch: 61, train_loss: 0.4119, test_loss: 2.0306, test_f1: 0.5617
 epoch: 62, train_loss: 0.3762, test_loss: 1.8469, test_f1: 0.5788
 epoch: 63, train_loss: 0.3693, test_loss: 2.2453, test_f1: 0.5290
 epoch: 64, train_loss: 0.3726, test_loss: 1.9634, test_f1: 0.5840
 epoch: 65, train_loss: 0.3249, test_loss: 2.0709, test_f1: 0.5715
 epoch: 66, train_loss: 0.3388, test_loss: 2.0906, test_f1: 0.6016
 epoch: 67, train_loss: 0.3122, test_loss: 2.3854, test_f1: 0.5452
 epoch: 68, train_loss: 0.3410, test_loss: 2.2676, test_f1: 0.5654
 epoch: 69, train_loss: 0.3157, test_loss: 2.2576, test_f1: 0.5898
 epoch: 70, train_loss: 0.3428, test_loss: 2.3140, test_f1: 0.5871
 epoch: 71, train_loss: 0.2967, test_loss: 2.4406, test_f1: 0.5695
 epoch: 72, train_loss: 0.3202, test_loss: 2.2559, test_f1: 0.5696
 epoch: 73, train_loss: 0.3162, test_loss: 2.1088, test_f1: 0.6092
 epoch: 74, train_loss: 0.3497, test_loss: 2.0342, test_f1: 0.5565
 epoch: 75, train_loss: 0.3292, test_loss: 1.9784, test_f1: 0.6016
 epoch: 76, train_loss: 0.3154, test_loss: 2.3173, test_f1: 0.5334
 epoch: 77, train_loss: 0.2993, test_loss: 2.5183, test_f1: 0.6131
 epoch: 78, train_loss: 0.3037, test_loss: 2.1712, test_f1: 0.6109
 epoch: 79, train_loss: 0.2843, test_loss: 2.2317, test_f1: 0.5826
 epoch: 80, train_loss: 0.3101, test_loss: 2.1743, test_f1: 0.5624
 epoch: 81, train_loss: 0.3194, test_loss: 2.3805, test_f1: 0.5383
 epoch: 82, train_loss: 0.2885, test_loss: 2.3514, test_f1: 0.5628
 epoch: 83, train_loss: 0.3078, test_loss: 2.0937, test_f1: 0.6230
 epoch: 84, train_loss: 0.3490, test_loss: 1.8974, test_f1: 0.6092
 epoch: 85, train_loss: 0.2715, test_loss: 2.3824, test_f1: 0.5679
 epoch: 86, train_loss: 0.2822, test_loss: 2.0907, test_f1: 0.5763
 epoch: 87, train_loss: 0.3070, test_loss: 2.2963, test_f1: 0.5764
 epoch: 88, train_loss: 0.2841, test_loss: 2.1119, test_f1: 0.6031
 epoch: 89, train_loss: 0.2879, test_loss: 2.4549, test_f1: 0.5492
 epoch: 90, train_loss: 0.2772, test_loss: 2.2605, test_f1: 0.5977
 epoch: 91, train_loss: 0.2667, test_loss: 2.3054, test_f1: 0.5677
 epoch: 92, train_loss: 0.2593, test_loss: 2.1431, test_f1: 0.5631
 epoch: 93, train_loss: 0.2823, test_loss: 2.6160, test_f1: 0.5690
 epoch: 94, train_loss: 0.2592, test_loss: 2.1932, test_f1: 0.5906
 epoch: 95, train_loss: 0.2665, test_loss: 2.4401, test_f1: 0.5685
 epoch: 96, train_loss: 0.2941, test_loss: 2.4188, test_f1: 0.5594
 epoch: 97, train_loss: 0.2843, test_loss: 2.3630, test_f1: 0.5933
 epoch: 98, train_loss: 0.2329, test_loss: 2.2417, test_f1: 0.5704
 epoch: 99, train_loss: 0.2365, test_loss: 2.3021, test_f1: 0.6126
##################ITERATION #2 ****************************************
 epoch: 0, train_loss: 1.2067, test_loss: 3.1203, test_f1: 0.2281
 epoch: 1, train_loss: 1.0308, test_loss: 1.5710, test_f1: 0.3013
 epoch: 2, train_loss: 1.0128, test_loss: 1.3302, test_f1: 0.4119
 epoch: 3, train_loss: 0.9573, test_loss: 1.1069, test_f1: 0.4160
 epoch: 4, train_loss: 0.9490, test_loss: 1.1515, test_f1: 0.5156
 epoch: 5, train_loss: 0.9585, test_loss: 1.0071, test_f1: 0.5150
 epoch: 6, train_loss: 0.9496, test_loss: 1.0563, test_f1: 0.5165
 epoch: 7, train_loss: 0.9094, test_loss: 1.0122, test_f1: 0.5512
 epoch: 8, train_loss: 0.8834, test_loss: 1.4112, test_f1: 0.3803
 epoch: 9, train_loss: 0.8551, test_loss: 0.9898, test_f1: 0.5628
 epoch: 10, train_loss: 0.8473, test_loss: 1.0473, test_f1: 0.4775
 epoch: 11, train_loss: 0.8357, test_loss: 1.3678, test_f1: 0.4500
 epoch: 12, train_loss: 0.8453, test_loss: 1.1124, test_f1: 0.4793
 epoch: 13, train_loss: 0.8586, test_loss: 0.9815, test_f1: 0.5001
 epoch: 14, train_loss: 0.8312, test_loss: 1.0694, test_f1: 0.5612
 epoch: 15, train_loss: 0.7928, test_loss: 1.0044, test_f1: 0.5797
 epoch: 16, train_loss: 0.7557, test_loss: 1.1225, test_f1: 0.4895
 epoch: 17, train_loss: 0.8273, test_loss: 1.1058, test_f1: 0.5632
 epoch: 18, train_loss: 0.7988, test_loss: 0.9853, test_f1: 0.5953
 epoch: 19, train_loss: 0.7470, test_loss: 1.1167, test_f1: 0.6090
 epoch: 20, train_loss: 0.7112, test_loss: 1.0427, test_f1: 0.5469
 epoch: 21, train_loss: 0.7230, test_loss: 1.3156, test_f1: 0.5472
 epoch: 22, train_loss: 0.7187, test_loss: 1.0775, test_f1: 0.5817
 epoch: 23, train_loss: 0.7487, test_loss: 1.4316, test_f1: 0.3968
 epoch: 24, train_loss: 0.7710, test_loss: 1.0674, test_f1: 0.5557
 epoch: 25, train_loss: 0.7403, test_loss: 1.1127, test_f1: 0.5404
 epoch: 26, train_loss: 0.6911, test_loss: 1.1536, test_f1: 0.5301
 epoch: 27, train_loss: 0.6640, test_loss: 1.3952, test_f1: 0.4758
 epoch: 28, train_loss: 0.7544, test_loss: 1.3233, test_f1: 0.4897
 epoch: 29, train_loss: 0.7038, test_loss: 1.0417, test_f1: 0.6169
 epoch: 30, train_loss: 0.6697, test_loss: 2.2338, test_f1: 0.4606
 epoch: 31, train_loss: 0.6656, test_loss: 1.0666, test_f1: 0.5314
 epoch: 32, train_loss: 0.6653, test_loss: 1.5931, test_f1: 0.5263
 epoch: 33, train_loss: 0.6597, test_loss: 1.3883, test_f1: 0.5515
 epoch: 34, train_loss: 0.6837, test_loss: 1.6865, test_f1: 0.5389
 epoch: 35, train_loss: 0.7457, test_loss: 3.5272, test_f1: 0.3508
 epoch: 36, train_loss: 0.7651, test_loss: 1.2889, test_f1: 0.5169
 epoch: 37, train_loss: 0.7173, test_loss: 1.2985, test_f1: 0.4910
 epoch: 38, train_loss: 0.6618, test_loss: 1.2516, test_f1: 0.5168
 epoch: 39, train_loss: 0.6164, test_loss: 1.4546, test_f1: 0.5317
 epoch: 40, train_loss: 0.6019, test_loss: 1.1819, test_f1: 0.5980
 epoch: 41, train_loss: 0.5989, test_loss: 1.1355, test_f1: 0.6023
 epoch: 42, train_loss: 0.6019, test_loss: 1.3850, test_f1: 0.5623
 epoch: 43, train_loss: 0.5935, test_loss: 1.4780, test_f1: 0.5674
 epoch: 44, train_loss: 0.6040, test_loss: 1.4261, test_f1: 0.6065
 epoch: 45, train_loss: 0.5944, test_loss: 1.7839, test_f1: 0.5334
 epoch: 46, train_loss: 0.5843, test_loss: 1.2917, test_f1: 0.5975
 epoch: 47, train_loss: 0.6044, test_loss: 1.3024, test_f1: 0.5633
 epoch: 48, train_loss: 0.5568, test_loss: 1.4638, test_f1: 0.5974
 epoch: 49, train_loss: 0.5570, test_loss: 1.4974, test_f1: 0.5646
 epoch: 50, train_loss: 0.5821, test_loss: 1.7223, test_f1: 0.5013
 epoch: 51, train_loss: 0.5547, test_loss: 1.3682, test_f1: 0.5647
 epoch: 52, train_loss: 0.4858, test_loss: 1.5826, test_f1: 0.5938
 epoch: 53, train_loss: 0.4602, test_loss: 1.5259, test_f1: 0.5830
 epoch: 54, train_loss: 0.4449, test_loss: 1.7981, test_f1: 0.5879
 epoch: 55, train_loss: 0.4641, test_loss: 1.5895, test_f1: 0.5811
 epoch: 56, train_loss: 0.4270, test_loss: 1.7052, test_f1: 0.5936
 epoch: 57, train_loss: 0.4259, test_loss: 1.6361, test_f1: 0.6269
 epoch: 58, train_loss: 0.4399, test_loss: 1.7715, test_f1: 0.5852
 epoch: 59, train_loss: 0.4331, test_loss: 1.9773, test_f1: 0.5812
 epoch: 60, train_loss: 0.4252, test_loss: 1.8591, test_f1: 0.6009
 epoch: 61, train_loss: 0.4500, test_loss: 1.6913, test_f1: 0.6077
 epoch: 62, train_loss: 0.4337, test_loss: 1.6157, test_f1: 0.5896
 epoch: 63, train_loss: 0.3988, test_loss: 1.7682, test_f1: 0.5792
 epoch: 64, train_loss: 0.3862, test_loss: 1.8290, test_f1: 0.5936
 epoch: 65, train_loss: 0.3860, test_loss: 1.9059, test_f1: 0.5654
 epoch: 66, train_loss: 0.3907, test_loss: 2.4417, test_f1: 0.5796
 epoch: 67, train_loss: 0.4042, test_loss: 2.4313, test_f1: 0.5797
 epoch: 68, train_loss: 0.3719, test_loss: 1.8529, test_f1: 0.6033
 epoch: 69, train_loss: 0.4040, test_loss: 1.9925, test_f1: 0.5511
 epoch: 70, train_loss: 0.3688, test_loss: 1.7439, test_f1: 0.6086
 epoch: 71, train_loss: 0.3452, test_loss: 2.6046, test_f1: 0.5667
 epoch: 72, train_loss: 0.3283, test_loss: 2.1530, test_f1: 0.6139
 epoch: 73, train_loss: 0.3674, test_loss: 2.3340, test_f1: 0.5365
 epoch: 74, train_loss: 0.3698, test_loss: 2.3046, test_f1: 0.5963
 epoch: 75, train_loss: 0.3520, test_loss: 1.8108, test_f1: 0.5589
 epoch: 76, train_loss: 0.3211, test_loss: 2.0763, test_f1: 0.5694
 epoch: 77, train_loss: 0.2981, test_loss: 2.2758, test_f1: 0.5961
 epoch: 78, train_loss: 0.3243, test_loss: 2.1055, test_f1: 0.5679
 epoch: 79, train_loss: 0.2977, test_loss: 2.3414, test_f1: 0.5832
 epoch: 80, train_loss: 0.3831, test_loss: 2.8885, test_f1: 0.5478
 epoch: 81, train_loss: 0.3656, test_loss: 2.1995, test_f1: 0.5648
 epoch: 82, train_loss: 0.3314, test_loss: 1.8243, test_f1: 0.5918
 epoch: 83, train_loss: 0.2931, test_loss: 2.0765, test_f1: 0.5961
 epoch: 84, train_loss: 0.3243, test_loss: 2.2040, test_f1: 0.5463
 epoch: 85, train_loss: 0.2966, test_loss: 2.2510, test_f1: 0.5448
 epoch: 86, train_loss: 0.3520, test_loss: 2.0331, test_f1: 0.5953
 epoch: 87, train_loss: 0.2932, test_loss: 2.5818, test_f1: 0.5645
 epoch: 88, train_loss: 0.2755, test_loss: 2.4888, test_f1: 0.5853
 epoch: 89, train_loss: 0.3026, test_loss: 2.4202, test_f1: 0.5582
 epoch: 90, train_loss: 0.2542, test_loss: 2.3681, test_f1: 0.5589
 epoch: 91, train_loss: 0.2866, test_loss: 2.7874, test_f1: 0.5884
 epoch: 92, train_loss: 0.2742, test_loss: 2.6391, test_f1: 0.5168
 epoch: 93, train_loss: 0.2383, test_loss: 2.9787, test_f1: 0.5401
 epoch: 94, train_loss: 0.3256, test_loss: 2.3539, test_f1: 0.5572
 epoch: 95, train_loss: 0.3000, test_loss: 1.9090, test_f1: 0.6034
 epoch: 96, train_loss: 0.2844, test_loss: 2.3955, test_f1: 0.5643
 epoch: 97, train_loss: 0.2525, test_loss: 2.7414, test_f1: 0.5435
 epoch: 98, train_loss: 0.2739, test_loss: 2.5129, test_f1: 0.5788
 epoch: 99, train_loss: 0.2515, test_loss: 2.4796, test_f1: 0.6119
##################ITERATION #3 ****************************************
 epoch: 0, train_loss: 1.2142, test_loss: 1.3606, test_f1: 0.2281
 epoch: 1, train_loss: 1.0625, test_loss: 1.1620, test_f1: 0.4452
 epoch: 2, train_loss: 1.0101, test_loss: 1.1459, test_f1: 0.4162
 epoch: 3, train_loss: 0.9709, test_loss: 1.0891, test_f1: 0.5099
 epoch: 4, train_loss: 0.9455, test_loss: 1.1059, test_f1: 0.4932
 epoch: 5, train_loss: 0.9600, test_loss: 1.0568, test_f1: 0.4131
 epoch: 6, train_loss: 0.9174, test_loss: 1.0181, test_f1: 0.3737
 epoch: 7, train_loss: 0.8942, test_loss: 1.0630, test_f1: 0.5089
 epoch: 8, train_loss: 0.8772, test_loss: 0.9668, test_f1: 0.5334
 epoch: 9, train_loss: 0.9037, test_loss: 1.0672, test_f1: 0.4103
 epoch: 10, train_loss: 0.9165, test_loss: 0.9638, test_f1: 0.5426
 epoch: 11, train_loss: 0.8923, test_loss: 1.0064, test_f1: 0.4984
 epoch: 12, train_loss: 0.8933, test_loss: 0.9654, test_f1: 0.4706
 epoch: 13, train_loss: 0.8696, test_loss: 0.9996, test_f1: 0.5272
 epoch: 14, train_loss: 0.8304, test_loss: 1.0221, test_f1: 0.4919
 epoch: 15, train_loss: 0.8203, test_loss: 0.9768, test_f1: 0.5575
 epoch: 16, train_loss: 0.8241, test_loss: 1.0289, test_f1: 0.4635
 epoch: 17, train_loss: 0.8412, test_loss: 0.9883, test_f1: 0.5715
 epoch: 18, train_loss: 0.8130, test_loss: 0.9692, test_f1: 0.4931
 epoch: 19, train_loss: 0.7766, test_loss: 1.0466, test_f1: 0.5439
 epoch: 20, train_loss: 0.7826, test_loss: 1.1436, test_f1: 0.5006
 epoch: 21, train_loss: 0.7907, test_loss: 0.9721, test_f1: 0.5720
 epoch: 22, train_loss: 0.7654, test_loss: 1.1190, test_f1: 0.4865
 epoch: 23, train_loss: 0.7413, test_loss: 1.1598, test_f1: 0.4992
 epoch: 24, train_loss: 0.7122, test_loss: 1.2420, test_f1: 0.4955
 epoch: 25, train_loss: 0.7347, test_loss: 1.1589, test_f1: 0.5196
 epoch: 26, train_loss: 0.7350, test_loss: 1.0505, test_f1: 0.5533
 epoch: 27, train_loss: 0.7304, test_loss: 1.1232, test_f1: 0.5230
 epoch: 28, train_loss: 0.7094, test_loss: 1.1037, test_f1: 0.5480
 epoch: 29, train_loss: 0.7158, test_loss: 0.9553, test_f1: 0.6145
 epoch: 30, train_loss: 0.7329, test_loss: 1.5075, test_f1: 0.5037
 epoch: 31, train_loss: 0.7095, test_loss: 1.1936, test_f1: 0.5459
 epoch: 32, train_loss: 0.6640, test_loss: 1.2068, test_f1: 0.4979
 epoch: 33, train_loss: 0.6586, test_loss: 1.2225, test_f1: 0.5281
 epoch: 34, train_loss: 0.6815, test_loss: 1.4507, test_f1: 0.5490
 epoch: 35, train_loss: 0.6632, test_loss: 1.1864, test_f1: 0.5349
 epoch: 36, train_loss: 0.6538, test_loss: 1.1721, test_f1: 0.5595
 epoch: 37, train_loss: 0.6559, test_loss: 1.4155, test_f1: 0.4999
 epoch: 38, train_loss: 0.6413, test_loss: 1.5765, test_f1: 0.5843
 epoch: 39, train_loss: 0.6270, test_loss: 1.4127, test_f1: 0.5135
 epoch: 40, train_loss: 0.6448, test_loss: 1.4208, test_f1: 0.5032
 epoch: 41, train_loss: 0.6493, test_loss: 1.5483, test_f1: 0.4748
 epoch: 42, train_loss: 0.6161, test_loss: 1.1891, test_f1: 0.5530
 epoch: 43, train_loss: 0.6006, test_loss: 2.0465, test_f1: 0.4697
 epoch: 44, train_loss: 0.6157, test_loss: 1.4098, test_f1: 0.5016
 epoch: 45, train_loss: 0.5817, test_loss: 1.1235, test_f1: 0.6434
 epoch: 46, train_loss: 0.5830, test_loss: 15.6153, test_f1: 0.4012
 epoch: 47, train_loss: 0.6579, test_loss: 1.8182, test_f1: 0.4474
 epoch: 48, train_loss: 0.6618, test_loss: 1.5122, test_f1: 0.4767
 epoch: 49, train_loss: 0.6197, test_loss: 1.3401, test_f1: 0.5251
 epoch: 50, train_loss: 0.5932, test_loss: 1.3882, test_f1: 0.4616
 epoch: 51, train_loss: 0.5807, test_loss: 1.2628, test_f1: 0.5434
 epoch: 52, train_loss: 0.5070, test_loss: 1.2794, test_f1: 0.5581
 epoch: 53, train_loss: 0.4845, test_loss: 1.3928, test_f1: 0.6148
 epoch: 54, train_loss: 0.4903, test_loss: 1.4131, test_f1: 0.5803
 epoch: 55, train_loss: 0.4870, test_loss: 1.5168, test_f1: 0.5703
 epoch: 56, train_loss: 0.5473, test_loss: 1.7044, test_f1: 0.4896
 epoch: 57, train_loss: 0.4845, test_loss: 1.3789, test_f1: 0.5971
 epoch: 58, train_loss: 0.4599, test_loss: 1.5339, test_f1: 0.5827
 epoch: 59, train_loss: 0.4545, test_loss: 1.9867, test_f1: 0.5567
 epoch: 60, train_loss: 0.4331, test_loss: 1.6930, test_f1: 0.5667
 epoch: 61, train_loss: 0.4123, test_loss: 1.7844, test_f1: 0.5762
 epoch: 62, train_loss: 0.4055, test_loss: 1.7222, test_f1: 0.5967
 epoch: 63, train_loss: 0.4474, test_loss: 1.9159, test_f1: 0.5332
 epoch: 64, train_loss: 0.4336, test_loss: 1.7726, test_f1: 0.6086
 epoch: 65, train_loss: 0.3880, test_loss: 1.9653, test_f1: 0.5663
 epoch: 66, train_loss: 0.3812, test_loss: 1.7834, test_f1: 0.5594
 epoch: 67, train_loss: 0.4195, test_loss: 1.7057, test_f1: 0.5605
 epoch: 68, train_loss: 0.3808, test_loss: 1.6447, test_f1: 0.5708
 epoch: 69, train_loss: 0.3813, test_loss: 1.5621, test_f1: 0.6118
 epoch: 70, train_loss: 0.3695, test_loss: 2.0814, test_f1: 0.5653
 epoch: 71, train_loss: 0.3665, test_loss: 1.7735, test_f1: 0.5777
 epoch: 72, train_loss: 0.3611, test_loss: 1.9776, test_f1: 0.5912
 epoch: 73, train_loss: 0.3349, test_loss: 2.0179, test_f1: 0.5345
 epoch: 74, train_loss: 0.3478, test_loss: 2.1305, test_f1: 0.6018
 epoch: 75, train_loss: 0.3410, test_loss: 2.0595, test_f1: 0.5909
 epoch: 76, train_loss: 0.2958, test_loss: 1.8480, test_f1: 0.6112
 epoch: 77, train_loss: 0.2882, test_loss: 2.1235, test_f1: 0.5378
 epoch: 78, train_loss: 0.3953, test_loss: 2.1593, test_f1: 0.6005
 epoch: 79, train_loss: 0.3767, test_loss: 1.8971, test_f1: 0.5337
 epoch: 80, train_loss: 0.3822, test_loss: 1.8954, test_f1: 0.5443
 epoch: 81, train_loss: 0.3581, test_loss: 1.7548, test_f1: 0.6088
 epoch: 82, train_loss: 0.3076, test_loss: 2.0431, test_f1: 0.6180
 epoch: 83, train_loss: 0.2737, test_loss: 2.1269, test_f1: 0.6115
 epoch: 84, train_loss: 0.2991, test_loss: 2.0857, test_f1: 0.6085
 epoch: 85, train_loss: 0.2401, test_loss: 2.7523, test_f1: 0.5079
 epoch: 86, train_loss: 0.2726, test_loss: 2.6658, test_f1: 0.5891
 epoch: 87, train_loss: 0.3423, test_loss: 2.8343, test_f1: 0.5576
 epoch: 88, train_loss: 0.4959, test_loss: 2.6786, test_f1: 0.5126
 epoch: 89, train_loss: 0.4362, test_loss: 2.3682, test_f1: 0.6063
 epoch: 90, train_loss: 0.3403, test_loss: 2.1157, test_f1: 0.5919
 epoch: 91, train_loss: 0.3070, test_loss: 2.1012, test_f1: 0.5817
 epoch: 92, train_loss: 0.2846, test_loss: 2.0395, test_f1: 0.5953
 epoch: 93, train_loss: 0.3193, test_loss: 1.9816, test_f1: 0.5668
 epoch: 94, train_loss: 0.2637, test_loss: 2.0738, test_f1: 0.5996
 epoch: 95, train_loss: 0.2725, test_loss: 2.4415, test_f1: 0.5585
 epoch: 96, train_loss: 0.2439, test_loss: 2.2189, test_f1: 0.6285
 epoch: 97, train_loss: 0.2817, test_loss: 2.4436, test_f1: 0.5825
 epoch: 98, train_loss: 0.2752, test_loss: 2.3636, test_f1: 0.5998
 epoch: 99, train_loss: 0.2612, test_loss: 2.5215, test_f1: 0.5754
##################ITERATION #4 ****************************************
 epoch: 0, train_loss: 1.3301, test_loss: 1.3149, test_f1: 0.2281
 epoch: 1, train_loss: 1.0979, test_loss: 1.1690, test_f1: 0.3641
 epoch: 2, train_loss: 1.0219, test_loss: 1.1139, test_f1: 0.3867
 epoch: 3, train_loss: 0.9799, test_loss: 1.2126, test_f1: 0.4440
 epoch: 4, train_loss: 0.9639, test_loss: 1.0361, test_f1: 0.5180
 epoch: 5, train_loss: 0.9445, test_loss: 1.1731, test_f1: 0.5103
 epoch: 6, train_loss: 0.9442, test_loss: 1.0977, test_f1: 0.5056
 epoch: 7, train_loss: 0.9144, test_loss: 1.3893, test_f1: 0.4667
 epoch: 8, train_loss: 0.9091, test_loss: 1.1528, test_f1: 0.4947
 epoch: 9, train_loss: 0.9138, test_loss: 1.1256, test_f1: 0.4917
 epoch: 10, train_loss: 0.9030, test_loss: 1.0686, test_f1: 0.5017
 epoch: 11, train_loss: 0.8856, test_loss: 1.4526, test_f1: 0.3767
 epoch: 12, train_loss: 0.8840, test_loss: 1.1034, test_f1: 0.4769
 epoch: 13, train_loss: 0.8949, test_loss: 1.2546, test_f1: 0.4440
 epoch: 14, train_loss: 0.8774, test_loss: 0.9711, test_f1: 0.4740
 epoch: 15, train_loss: 0.8794, test_loss: 1.0342, test_f1: 0.5321
 epoch: 16, train_loss: 0.8732, test_loss: 0.9983, test_f1: 0.5176
 epoch: 17, train_loss: 0.8430, test_loss: 1.0117, test_f1: 0.5168
 epoch: 18, train_loss: 0.8415, test_loss: 1.0390, test_f1: 0.5431
 epoch: 19, train_loss: 0.8064, test_loss: 0.9923, test_f1: 0.5472
 epoch: 20, train_loss: 0.8224, test_loss: 1.0349, test_f1: 0.5693
 epoch: 21, train_loss: 0.8104, test_loss: 1.1131, test_f1: 0.5166
 epoch: 22, train_loss: 0.7951, test_loss: 1.2243, test_f1: 0.4270
 epoch: 23, train_loss: 0.8126, test_loss: 1.0172, test_f1: 0.5323
 epoch: 24, train_loss: 0.7747, test_loss: 1.1926, test_f1: 0.5154
 epoch: 25, train_loss: 0.7799, test_loss: 1.1138, test_f1: 0.4760
 epoch: 26, train_loss: 0.7972, test_loss: 0.9360, test_f1: 0.5755
 epoch: 27, train_loss: 0.7757, test_loss: 1.1907, test_f1: 0.4456
 epoch: 28, train_loss: 0.7685, test_loss: 1.2592, test_f1: 0.5184
 epoch: 29, train_loss: 0.7568, test_loss: 1.1083, test_f1: 0.5764
 epoch: 30, train_loss: 0.7822, test_loss: 1.0403, test_f1: 0.5307
 epoch: 31, train_loss: 0.7754, test_loss: 1.5834, test_f1: 0.4559
 epoch: 32, train_loss: 0.7588, test_loss: 0.9372, test_f1: 0.5266
 epoch: 33, train_loss: 0.7382, test_loss: 1.1154, test_f1: 0.5123
 epoch: 34, train_loss: 0.7289, test_loss: 1.1959, test_f1: 0.4800
 epoch: 35, train_loss: 0.7224, test_loss: 1.0726, test_f1: 0.5136
 epoch: 36, train_loss: 0.6901, test_loss: 1.1796, test_f1: 0.5469
 epoch: 37, train_loss: 0.7040, test_loss: 1.0567, test_f1: 0.5598
 epoch: 38, train_loss: 0.6872, test_loss: 1.3947, test_f1: 0.5222
 epoch: 39, train_loss: 0.6584, test_loss: 1.2666, test_f1: 0.5297
 epoch: 40, train_loss: 0.6668, test_loss: 1.0152, test_f1: 0.5448
 epoch: 41, train_loss: 0.6732, test_loss: 1.1742, test_f1: 0.5642
 epoch: 42, train_loss: 0.6987, test_loss: 1.1183, test_f1: 0.5044
 epoch: 43, train_loss: 0.6797, test_loss: 1.8258, test_f1: 0.4963
 epoch: 44, train_loss: 0.6792, test_loss: 0.9887, test_f1: 0.5496
 epoch: 45, train_loss: 0.6587, test_loss: 1.0417, test_f1: 0.5863
 epoch: 46, train_loss: 0.6500, test_loss: 0.9963, test_f1: 0.6127
 epoch: 47, train_loss: 0.6424, test_loss: 1.4213, test_f1: 0.4653
 epoch: 48, train_loss: 0.6594, test_loss: 1.3253, test_f1: 0.5278
 epoch: 49, train_loss: 0.7004, test_loss: 1.0376, test_f1: 0.6173
 epoch: 50, train_loss: 0.6616, test_loss: 1.2552, test_f1: 0.4614
 epoch: 51, train_loss: 0.6175, test_loss: 1.2218, test_f1: 0.5497
 epoch: 52, train_loss: 0.5906, test_loss: 1.2260, test_f1: 0.5865
 epoch: 53, train_loss: 0.5703, test_loss: 1.0511, test_f1: 0.6348
 epoch: 54, train_loss: 0.5516, test_loss: 1.0436, test_f1: 0.6569
 epoch: 55, train_loss: 0.5596, test_loss: 1.0850, test_f1: 0.6151
 epoch: 56, train_loss: 0.5715, test_loss: 1.1128, test_f1: 0.5399
 epoch: 57, train_loss: 0.5522, test_loss: 1.5045, test_f1: 0.5757
 epoch: 58, train_loss: 0.5758, test_loss: 1.3276, test_f1: 0.5556
 epoch: 59, train_loss: 0.5550, test_loss: 1.2921, test_f1: 0.5825
 epoch: 60, train_loss: 0.5088, test_loss: 1.4053, test_f1: 0.5255
 epoch: 61, train_loss: 0.5091, test_loss: 1.4473, test_f1: 0.5976
 epoch: 62, train_loss: 0.5083, test_loss: 1.2467, test_f1: 0.6015
 epoch: 63, train_loss: 0.4754, test_loss: 1.3816, test_f1: 0.5986
 epoch: 64, train_loss: 0.4559, test_loss: 1.2822, test_f1: 0.6229
 epoch: 65, train_loss: 0.4652, test_loss: 1.3001, test_f1: 0.6335
 epoch: 66, train_loss: 0.4582, test_loss: 1.6171, test_f1: 0.5199
 epoch: 67, train_loss: 0.4533, test_loss: 1.2907, test_f1: 0.6226
 epoch: 68, train_loss: 0.4173, test_loss: 1.5886, test_f1: 0.5959
 epoch: 69, train_loss: 0.4190, test_loss: 1.5134, test_f1: 0.6197
 epoch: 70, train_loss: 0.4427, test_loss: 1.4173, test_f1: 0.5671
 epoch: 71, train_loss: 0.4140, test_loss: 1.6068, test_f1: 0.6035
 epoch: 72, train_loss: 0.3935, test_loss: 1.7137, test_f1: 0.5839
 epoch: 73, train_loss: 0.4539, test_loss: 1.4651, test_f1: 0.6012
 epoch: 74, train_loss: 0.4136, test_loss: 1.9466, test_f1: 0.6326
 epoch: 75, train_loss: 0.4123, test_loss: 1.5740, test_f1: 0.5786
 epoch: 76, train_loss: 0.4455, test_loss: 1.7887, test_f1: 0.5672
 epoch: 77, train_loss: 0.4297, test_loss: 1.6727, test_f1: 0.6161
 epoch: 78, train_loss: 0.4062, test_loss: 1.5445, test_f1: 0.5928
 epoch: 79, train_loss: 0.3568, test_loss: 1.4788, test_f1: 0.6187
 epoch: 80, train_loss: 0.3664, test_loss: 1.9000, test_f1: 0.6232
 epoch: 81, train_loss: 0.3743, test_loss: 1.7577, test_f1: 0.5937
 epoch: 82, train_loss: 0.3423, test_loss: 1.9684, test_f1: 0.5901
 epoch: 83, train_loss: 0.4242, test_loss: 1.6483, test_f1: 0.6420
 epoch: 84, train_loss: 0.4441, test_loss: 1.8399, test_f1: 0.5960
 epoch: 85, train_loss: 0.3890, test_loss: 2.0785, test_f1: 0.5795
 epoch: 86, train_loss: 0.4091, test_loss: 1.8219, test_f1: 0.5642
 epoch: 87, train_loss: 0.3402, test_loss: 2.0468, test_f1: 0.6115
 epoch: 88, train_loss: 0.3419, test_loss: 2.0443, test_f1: 0.6255
 epoch: 89, train_loss: 0.3544, test_loss: 1.7678, test_f1: 0.5992
 epoch: 90, train_loss: 0.3892, test_loss: 1.8289, test_f1: 0.6119
 epoch: 91, train_loss: 0.3376, test_loss: 1.8639, test_f1: 0.5932
 epoch: 92, train_loss: 0.3106, test_loss: 2.0562, test_f1: 0.6329
 epoch: 93, train_loss: 0.3871, test_loss: 1.6343, test_f1: 0.5530
 epoch: 94, train_loss: 0.3924, test_loss: 2.0042, test_f1: 0.5554
 epoch: 95, train_loss: 0.3679, test_loss: 1.7792, test_f1: 0.5848
 epoch: 96, train_loss: 0.5093, test_loss: 2.9432, test_f1: 0.5054
 epoch: 97, train_loss: 0.4377, test_loss: 1.3952, test_f1: 0.6521
 epoch: 98, train_loss: 0.3585, test_loss: 1.5787, test_f1: 0.6186
 epoch: 99, train_loss: 0.3128, test_loss: 1.8907, test_f1: 0.6051
##################ITERATION #5 ****************************************
 epoch: 0, train_loss: 1.2415, test_loss: 1.5588, test_f1: 0.3032
 epoch: 1, train_loss: 1.0505, test_loss: 1.1444, test_f1: 0.4335
 epoch: 2, train_loss: 0.9985, test_loss: 1.0771, test_f1: 0.4166
 epoch: 3, train_loss: 0.9588, test_loss: 1.1094, test_f1: 0.5065
 epoch: 4, train_loss: 0.9478, test_loss: 0.9778, test_f1: 0.4896
 epoch: 5, train_loss: 0.9465, test_loss: 1.0569, test_f1: 0.4683
 epoch: 6, train_loss: 0.9241, test_loss: 1.0187, test_f1: 0.5394
 epoch: 7, train_loss: 0.9031, test_loss: 0.9863, test_f1: 0.5400
 epoch: 8, train_loss: 0.8773, test_loss: 0.9838, test_f1: 0.5400
 epoch: 9, train_loss: 0.8702, test_loss: 1.0084, test_f1: 0.4566
 epoch: 10, train_loss: 0.8587, test_loss: 1.0805, test_f1: 0.5295
 epoch: 11, train_loss: 0.8642, test_loss: 0.9885, test_f1: 0.5533
 epoch: 12, train_loss: 0.8414, test_loss: 1.1727, test_f1: 0.4887
 epoch: 13, train_loss: 0.8392, test_loss: 1.0349, test_f1: 0.4436
 epoch: 14, train_loss: 0.8519, test_loss: 1.2076, test_f1: 0.4738
 epoch: 15, train_loss: 0.8222, test_loss: 1.1413, test_f1: 0.4772
 epoch: 16, train_loss: 0.7895, test_loss: 1.0817, test_f1: 0.5097
 epoch: 17, train_loss: 0.7756, test_loss: 1.1378, test_f1: 0.5524
 epoch: 18, train_loss: 0.7692, test_loss: 0.9744, test_f1: 0.5457
 epoch: 19, train_loss: 0.7978, test_loss: 1.0934, test_f1: 0.4905
 epoch: 20, train_loss: 0.7885, test_loss: 1.0635, test_f1: 0.5346
 epoch: 21, train_loss: 0.7545, test_loss: 1.0964, test_f1: 0.5483
 epoch: 22, train_loss: 0.8155, test_loss: 1.2865, test_f1: 0.4417
 epoch: 23, train_loss: 0.8621, test_loss: 1.2428, test_f1: 0.3476
 epoch: 24, train_loss: 0.8022, test_loss: 1.0180, test_f1: 0.4734
 epoch: 25, train_loss: 0.7726, test_loss: 0.9633, test_f1: 0.5615
 epoch: 26, train_loss: 0.7632, test_loss: 1.1949, test_f1: 0.4959
 epoch: 27, train_loss: 0.7426, test_loss: 0.9579, test_f1: 0.5692
 epoch: 28, train_loss: 0.7313, test_loss: 1.4114, test_f1: 0.4164
 epoch: 29, train_loss: 0.7429, test_loss: 1.0573, test_f1: 0.5195
 epoch: 30, train_loss: 0.7241, test_loss: 1.0921, test_f1: 0.5132
 epoch: 31, train_loss: 0.7175, test_loss: 1.0234, test_f1: 0.5786
 epoch: 32, train_loss: 0.6998, test_loss: 1.0871, test_f1: 0.5608
 epoch: 33, train_loss: 0.6921, test_loss: 1.3897, test_f1: 0.5125
 epoch: 34, train_loss: 0.6774, test_loss: 1.0271, test_f1: 0.5226
 epoch: 35, train_loss: 0.6919, test_loss: 1.4969, test_f1: 0.5541
 epoch: 36, train_loss: 0.6715, test_loss: 1.0251, test_f1: 0.5811
 epoch: 37, train_loss: 0.6530, test_loss: 1.3260, test_f1: 0.5478
 epoch: 38, train_loss: 0.6582, test_loss: 1.1791, test_f1: 0.5261
 epoch: 39, train_loss: 0.6660, test_loss: 1.1971, test_f1: 0.6351
 epoch: 40, train_loss: 0.6780, test_loss: 1.0636, test_f1: 0.5451
 epoch: 41, train_loss: 0.6616, test_loss: 1.3441, test_f1: 0.5835
 epoch: 42, train_loss: 0.6493, test_loss: 1.6396, test_f1: 0.5317
 epoch: 43, train_loss: 0.6376, test_loss: 1.6861, test_f1: 0.4445
 epoch: 44, train_loss: 0.6528, test_loss: 1.6357, test_f1: 0.5035
 epoch: 45, train_loss: 0.6279, test_loss: 2.3159, test_f1: 0.3987
 epoch: 46, train_loss: 0.6342, test_loss: 1.0957, test_f1: 0.6040
 epoch: 47, train_loss: 0.5862, test_loss: 1.3845, test_f1: 0.5438
 epoch: 48, train_loss: 0.6200, test_loss: 1.2252, test_f1: 0.5911
 epoch: 49, train_loss: 0.5910, test_loss: 1.3292, test_f1: 0.5673
 epoch: 50, train_loss: 0.5536, test_loss: 1.8098, test_f1: 0.4808
 epoch: 51, train_loss: 0.5483, test_loss: 1.3495, test_f1: 0.5740
 epoch: 52, train_loss: 0.5281, test_loss: 1.3283, test_f1: 0.5900
 epoch: 53, train_loss: 0.5091, test_loss: 1.3028, test_f1: 0.5714
 epoch: 54, train_loss: 0.4864, test_loss: 1.7947, test_f1: 0.5217
 epoch: 55, train_loss: 0.4961, test_loss: 1.4291, test_f1: 0.5940
 epoch: 56, train_loss: 0.4699, test_loss: 1.6782, test_f1: 0.5575
 epoch: 57, train_loss: 0.4661, test_loss: 1.7174, test_f1: 0.5542
 epoch: 58, train_loss: 0.4447, test_loss: 1.4931, test_f1: 0.5319
 epoch: 59, train_loss: 0.4484, test_loss: 1.6880, test_f1: 0.5524
 epoch: 60, train_loss: 0.4417, test_loss: 1.9876, test_f1: 0.5908
 epoch: 61, train_loss: 0.4407, test_loss: 1.5767, test_f1: 0.5831
 epoch: 62, train_loss: 0.4700, test_loss: 1.3737, test_f1: 0.5889
 epoch: 63, train_loss: 0.4721, test_loss: 1.6044, test_f1: 0.5933
 epoch: 64, train_loss: 0.5194, test_loss: 2.0127, test_f1: 0.4990
 epoch: 65, train_loss: 0.4573, test_loss: 1.6907, test_f1: 0.5725
 epoch: 66, train_loss: 0.4324, test_loss: 1.7048, test_f1: 0.6044
 epoch: 67, train_loss: 0.4258, test_loss: 1.5875, test_f1: 0.6234
 epoch: 68, train_loss: 0.4333, test_loss: 1.6594, test_f1: 0.5863
 epoch: 69, train_loss: 0.4275, test_loss: 1.6596, test_f1: 0.5852
 epoch: 70, train_loss: 0.4001, test_loss: 2.0453, test_f1: 0.5565
 epoch: 71, train_loss: 0.3778, test_loss: 2.1232, test_f1: 0.5932
 epoch: 72, train_loss: 0.4119, test_loss: 2.1163, test_f1: 0.5475
 epoch: 73, train_loss: 0.4157, test_loss: 1.5840, test_f1: 0.6037
 epoch: 74, train_loss: 0.5192, test_loss: 1.6408, test_f1: 0.5618
 epoch: 75, train_loss: 0.4512, test_loss: 1.7809, test_f1: 0.5690
 epoch: 76, train_loss: 0.4151, test_loss: 2.1511, test_f1: 0.5996
 epoch: 77, train_loss: 0.3924, test_loss: 2.2322, test_f1: 0.5386
 epoch: 78, train_loss: 0.3843, test_loss: 2.3161, test_f1: 0.5642
 epoch: 79, train_loss: 0.3780, test_loss: 1.7754, test_f1: 0.5686
 epoch: 80, train_loss: 0.4179, test_loss: 1.7412, test_f1: 0.5818
 epoch: 81, train_loss: 0.3974, test_loss: 1.7883, test_f1: 0.5798
 epoch: 82, train_loss: 0.3847, test_loss: 2.1191, test_f1: 0.5973
 epoch: 83, train_loss: 0.3634, test_loss: 2.1339, test_f1: 0.5854
 epoch: 84, train_loss: 0.3856, test_loss: 3.0916, test_f1: 0.5039
 epoch: 85, train_loss: 0.3641, test_loss: 1.9401, test_f1: 0.6277
 epoch: 86, train_loss: 0.3361, test_loss: 2.2107, test_f1: 0.5944
 epoch: 87, train_loss: 0.3547, test_loss: 2.0992, test_f1: 0.5989
 epoch: 88, train_loss: 0.4009, test_loss: 1.7530, test_f1: 0.5920
 epoch: 89, train_loss: 0.3634, test_loss: 1.8744, test_f1: 0.5669
 epoch: 90, train_loss: 0.3687, test_loss: 1.5810, test_f1: 0.6159
 epoch: 91, train_loss: 0.3836, test_loss: 1.8281, test_f1: 0.5948
 epoch: 92, train_loss: 0.3540, test_loss: 1.9374, test_f1: 0.5334
 epoch: 93, train_loss: 0.2961, test_loss: 2.2283, test_f1: 0.5550
 epoch: 94, train_loss: 0.2965, test_loss: 2.0222, test_f1: 0.6080
 epoch: 95, train_loss: 0.3091, test_loss: 1.9036, test_f1: 0.5915
 epoch: 96, train_loss: 0.3053, test_loss: 1.9288, test_f1: 0.5864
 epoch: 97, train_loss: 0.2797, test_loss: 1.9931, test_f1: 0.6227
 epoch: 98, train_loss: 0.2747, test_loss: 2.5505, test_f1: 0.6011
 epoch: 99, train_loss: 0.2952, test_loss: 3.0310, test_f1: 0.5488
##################ITERATION #6 ****************************************
 epoch: 0, train_loss: 1.6774, test_loss: 2.5262, test_f1: 0.1374
 epoch: 1, train_loss: 1.1296, test_loss: 1.2281, test_f1: 0.3398
 epoch: 2, train_loss: 0.9750, test_loss: 1.0851, test_f1: 0.4743
 epoch: 3, train_loss: 0.9332, test_loss: 1.0547, test_f1: 0.4952
 epoch: 4, train_loss: 0.9128, test_loss: 1.0581, test_f1: 0.5546
 epoch: 5, train_loss: 0.8920, test_loss: 1.0687, test_f1: 0.5305
 epoch: 6, train_loss: 0.8558, test_loss: 2.8303, test_f1: 0.4110
 epoch: 7, train_loss: 0.8599, test_loss: 1.1035, test_f1: 0.4141
 epoch: 8, train_loss: 0.8389, test_loss: 1.1071, test_f1: 0.5085
 epoch: 9, train_loss: 0.8158, test_loss: 1.1348, test_f1: 0.4446
 epoch: 10, train_loss: 0.8123, test_loss: 1.1675, test_f1: 0.5523
 epoch: 11, train_loss: 0.7879, test_loss: 1.1222, test_f1: 0.5722
 epoch: 12, train_loss: 0.7866, test_loss: 1.3162, test_f1: 0.4843
 epoch: 13, train_loss: 0.8052, test_loss: 1.1098, test_f1: 0.5077
 epoch: 14, train_loss: 0.7779, test_loss: 3.4115, test_f1: 0.5475
 epoch: 15, train_loss: 0.7808, test_loss: 1.2153, test_f1: 0.5453
 epoch: 16, train_loss: 0.7480, test_loss: 1.6443, test_f1: 0.5012
 epoch: 17, train_loss: 0.7491, test_loss: 1.5284, test_f1: 0.4470
 epoch: 18, train_loss: 0.7660, test_loss: 1.4172, test_f1: 0.3858
 epoch: 19, train_loss: 0.7565, test_loss: 1.1950, test_f1: 0.4983
 epoch: 20, train_loss: 0.7754, test_loss: 1.1518, test_f1: 0.4617
 epoch: 21, train_loss: 0.7581, test_loss: 1.2627, test_f1: 0.4227
 epoch: 22, train_loss: 0.7889, test_loss: 1.1704, test_f1: 0.5082
 epoch: 23, train_loss: 0.7399, test_loss: 1.2370, test_f1: 0.4856
 epoch: 24, train_loss: 0.7581, test_loss: 1.1165, test_f1: 0.4507
 epoch: 25, train_loss: 0.7208, test_loss: 1.1586, test_f1: 0.5623
 epoch: 26, train_loss: 0.7326, test_loss: 1.4115, test_f1: 0.5644
 epoch: 27, train_loss: 0.6771, test_loss: 1.3670, test_f1: 0.5846
 epoch: 28, train_loss: 0.7071, test_loss: 1.2218, test_f1: 0.5554
 epoch: 29, train_loss: 0.6920, test_loss: 1.4459, test_f1: 0.4961
 epoch: 30, train_loss: 0.6970, test_loss: 1.2234, test_f1: 0.5249
 epoch: 31, train_loss: 0.6698, test_loss: 2.0581, test_f1: 0.4385
 epoch: 32, train_loss: 0.7164, test_loss: 1.3924, test_f1: 0.4832
 epoch: 33, train_loss: 0.6809, test_loss: 1.4602, test_f1: 0.6293
 epoch: 34, train_loss: 0.6784, test_loss: 1.3595, test_f1: 0.5231
 epoch: 35, train_loss: 0.6558, test_loss: 1.6454, test_f1: 0.4869
 epoch: 36, train_loss: 0.6463, test_loss: 1.2169, test_f1: 0.5578
 epoch: 37, train_loss: 0.6209, test_loss: 1.4188, test_f1: 0.5069
 epoch: 38, train_loss: 0.6767, test_loss: 2.3128, test_f1: 0.3770
 epoch: 39, train_loss: 0.6732, test_loss: 1.5889, test_f1: 0.5777
 epoch: 40, train_loss: 0.6264, test_loss: 1.6886, test_f1: 0.5106
 epoch: 41, train_loss: 0.6147, test_loss: 1.4119, test_f1: 0.5271
 epoch: 42, train_loss: 0.6207, test_loss: 1.4576, test_f1: 0.5364
 epoch: 43, train_loss: 0.6040, test_loss: 1.4480, test_f1: 0.5141
 epoch: 44, train_loss: 0.5932, test_loss: 1.2465, test_f1: 0.6395
 epoch: 45, train_loss: 0.5819, test_loss: 1.4724, test_f1: 0.5731
 epoch: 46, train_loss: 0.5609, test_loss: 1.4339, test_f1: 0.5285
 epoch: 47, train_loss: 0.5538, test_loss: 1.8406, test_f1: 0.5391
 epoch: 48, train_loss: 0.5500, test_loss: 1.8666, test_f1: 0.5208
 epoch: 49, train_loss: 0.5257, test_loss: 1.8615, test_f1: 0.5865
 epoch: 50, train_loss: 0.5183, test_loss: 2.4640, test_f1: 0.5831
 epoch: 51, train_loss: 0.5287, test_loss: 1.4240, test_f1: 0.6481
 epoch: 52, train_loss: 0.4895, test_loss: 1.7469, test_f1: 0.5983
 epoch: 53, train_loss: 0.4619, test_loss: 1.6675, test_f1: 0.5849
 epoch: 54, train_loss: 0.4609, test_loss: 1.5612, test_f1: 0.5988
 epoch: 55, train_loss: 0.4773, test_loss: 1.3222, test_f1: 0.5558
 epoch: 56, train_loss: 0.4630, test_loss: 2.0610, test_f1: 0.5874
 epoch: 57, train_loss: 0.4437, test_loss: 1.6877, test_f1: 0.5323
 epoch: 58, train_loss: 0.4136, test_loss: 1.8500, test_f1: 0.5899
 epoch: 59, train_loss: 0.4354, test_loss: 1.4983, test_f1: 0.5548
 epoch: 60, train_loss: 0.4165, test_loss: 2.3486, test_f1: 0.5643
 epoch: 61, train_loss: 0.3974, test_loss: 1.2421, test_f1: 0.6390
 epoch: 62, train_loss: 0.4088, test_loss: 1.9915, test_f1: 0.5841
 epoch: 63, train_loss: 0.4020, test_loss: 2.3703, test_f1: 0.5156
 epoch: 64, train_loss: 0.3770, test_loss: 2.3997, test_f1: 0.5823
 epoch: 65, train_loss: 0.3717, test_loss: 2.0232, test_f1: 0.5375
 epoch: 66, train_loss: 0.4093, test_loss: 1.8938, test_f1: 0.5962
 epoch: 67, train_loss: 0.4019, test_loss: 2.9168, test_f1: 0.5552
 epoch: 68, train_loss: 0.4310, test_loss: 1.9303, test_f1: 0.5864
 epoch: 69, train_loss: 0.3925, test_loss: 2.0909, test_f1: 0.6121
 epoch: 70, train_loss: 0.4001, test_loss: 1.8097, test_f1: 0.5900
 epoch: 71, train_loss: 0.4166, test_loss: 2.4211, test_f1: 0.5695
 epoch: 72, train_loss: 0.3806, test_loss: 1.5333, test_f1: 0.6087
 epoch: 73, train_loss: 0.3853, test_loss: 2.2456, test_f1: 0.6014
 epoch: 74, train_loss: 0.3275, test_loss: 1.8171, test_f1: 0.6010
 epoch: 75, train_loss: 0.3321, test_loss: 2.1085, test_f1: 0.6119
 epoch: 76, train_loss: 0.3080, test_loss: 2.0392, test_f1: 0.6051
 epoch: 77, train_loss: 0.3065, test_loss: 2.4465, test_f1: 0.5640
 epoch: 78, train_loss: 0.4062, test_loss: 1.8347, test_f1: 0.5959
 epoch: 79, train_loss: 0.4311, test_loss: 1.9424, test_f1: 0.5700
 epoch: 80, train_loss: 0.3589, test_loss: 2.1309, test_f1: 0.5707
 epoch: 81, train_loss: 0.3414, test_loss: 2.1045, test_f1: 0.5918
 epoch: 82, train_loss: 0.3474, test_loss: 1.8628, test_f1: 0.5780
 epoch: 83, train_loss: 0.3601, test_loss: 1.8145, test_f1: 0.5674
 epoch: 84, train_loss: 0.3283, test_loss: 2.2271, test_f1: 0.5824
 epoch: 85, train_loss: 0.3580, test_loss: 1.7192, test_f1: 0.5980
 epoch: 86, train_loss: 0.3260, test_loss: 2.0969, test_f1: 0.5817
 epoch: 87, train_loss: 0.3457, test_loss: 1.7252, test_f1: 0.5635
 epoch: 88, train_loss: 0.3553, test_loss: 2.5601, test_f1: 0.5611
 epoch: 89, train_loss: 0.3042, test_loss: 1.7011, test_f1: 0.6140
 epoch: 90, train_loss: 0.3146, test_loss: 1.8533, test_f1: 0.5697
 epoch: 91, train_loss: 0.2917, test_loss: 2.1913, test_f1: 0.5788
 epoch: 92, train_loss: 0.2746, test_loss: 1.9356, test_f1: 0.5900
 epoch: 93, train_loss: 0.2779, test_loss: 2.0510, test_f1: 0.5873
 epoch: 94, train_loss: 0.3051, test_loss: 1.9510, test_f1: 0.5775
 epoch: 95, train_loss: 0.2613, test_loss: 2.4126, test_f1: 0.5779
 epoch: 96, train_loss: 0.2796, test_loss: 2.1121, test_f1: 0.5775
 epoch: 97, train_loss: 0.3064, test_loss: 2.0409, test_f1: 0.6011
 epoch: 98, train_loss: 0.3008, test_loss: 2.0200, test_f1: 0.6122
 epoch: 99, train_loss: 0.2648, test_loss: 3.0773, test_f1: 0.5494
##################ITERATION #7 ****************************************
 epoch: 0, train_loss: 1.3468, test_loss: 1.2569, test_f1: 0.2647
 epoch: 1, train_loss: 1.0164, test_loss: 1.1445, test_f1: 0.3916
 epoch: 2, train_loss: 0.9561, test_loss: 1.0913, test_f1: 0.4090
 epoch: 3, train_loss: 0.9395, test_loss: 1.0362, test_f1: 0.5182
 epoch: 4, train_loss: 0.8959, test_loss: 1.0477, test_f1: 0.4723
 epoch: 5, train_loss: 0.8676, test_loss: 1.1269, test_f1: 0.4107
 epoch: 6, train_loss: 0.8431, test_loss: 1.0040, test_f1: 0.5025
 epoch: 7, train_loss: 0.8281, test_loss: 1.2460, test_f1: 0.4477
 epoch: 8, train_loss: 0.7859, test_loss: 0.9339, test_f1: 0.5704
 epoch: 9, train_loss: 0.7672, test_loss: 0.9851, test_f1: 0.5281
 epoch: 10, train_loss: 0.7626, test_loss: 1.0826, test_f1: 0.5460
 epoch: 11, train_loss: 0.7398, test_loss: 1.1939, test_f1: 0.4692
 epoch: 12, train_loss: 0.7296, test_loss: 1.1686, test_f1: 0.5236
 epoch: 13, train_loss: 0.7736, test_loss: 1.0800, test_f1: 0.5477
 epoch: 14, train_loss: 0.7432, test_loss: 1.2065, test_f1: 0.5229
 epoch: 15, train_loss: 0.7424, test_loss: 1.2548, test_f1: 0.5643
 epoch: 16, train_loss: 0.7256, test_loss: 1.0198, test_f1: 0.5799
 epoch: 17, train_loss: 0.7068, test_loss: 1.4813, test_f1: 0.4757
 epoch: 18, train_loss: 0.7009, test_loss: 0.9706, test_f1: 0.5917
 epoch: 19, train_loss: 0.6925, test_loss: 1.2392, test_f1: 0.5289
 epoch: 20, train_loss: 0.7347, test_loss: 1.2666, test_f1: 0.4896
 epoch: 21, train_loss: 0.6961, test_loss: 1.2358, test_f1: 0.5142
 epoch: 22, train_loss: 0.6705, test_loss: 1.1363, test_f1: 0.5570
 epoch: 23, train_loss: 0.6409, test_loss: 1.2735, test_f1: 0.5307
 epoch: 24, train_loss: 0.6672, test_loss: 1.2823, test_f1: 0.5251
 epoch: 25, train_loss: 0.6170, test_loss: 1.1513, test_f1: 0.5736
 epoch: 26, train_loss: 0.6244, test_loss: 1.0827, test_f1: 0.5675
 epoch: 27, train_loss: 0.6204, test_loss: 1.4292, test_f1: 0.5625
 epoch: 28, train_loss: 0.6083, test_loss: 1.4754, test_f1: 0.5734
 epoch: 29, train_loss: 0.5737, test_loss: 1.2188, test_f1: 0.5628
 epoch: 30, train_loss: 0.6257, test_loss: 1.8434, test_f1: 0.4787
 epoch: 31, train_loss: 0.6137, test_loss: 1.6728, test_f1: 0.4326
 epoch: 32, train_loss: 0.6058, test_loss: 1.3912, test_f1: 0.5098
 epoch: 33, train_loss: 0.5865, test_loss: 1.4361, test_f1: 0.5673
 epoch: 34, train_loss: 0.6035, test_loss: 1.4012, test_f1: 0.5234
 epoch: 35, train_loss: 0.5977, test_loss: 1.5929, test_f1: 0.5724
 epoch: 36, train_loss: 0.5420, test_loss: 1.3019, test_f1: 0.6268
 epoch: 37, train_loss: 0.5312, test_loss: 1.2700, test_f1: 0.6396
 epoch: 38, train_loss: 0.5771, test_loss: 1.4105, test_f1: 0.6003
 epoch: 39, train_loss: 0.5369, test_loss: 2.3687, test_f1: 0.5025
 epoch: 40, train_loss: 0.5639, test_loss: 1.4803, test_f1: 0.5663
 epoch: 41, train_loss: 0.5400, test_loss: 1.1798, test_f1: 0.5412
 epoch: 42, train_loss: 0.5907, test_loss: 1.7539, test_f1: 0.5499
 epoch: 43, train_loss: 0.5809, test_loss: 1.2763, test_f1: 0.6093
 epoch: 44, train_loss: 0.5710, test_loss: 2.1503, test_f1: 0.5600
 epoch: 45, train_loss: 0.4812, test_loss: 1.7386, test_f1: 0.5629
 epoch: 46, train_loss: 0.5491, test_loss: 2.5336, test_f1: 0.4811
 epoch: 47, train_loss: 0.5016, test_loss: 1.7275, test_f1: 0.5977
 epoch: 48, train_loss: 0.4899, test_loss: 2.0333, test_f1: 0.5340
 epoch: 49, train_loss: 0.4602, test_loss: 2.2503, test_f1: 0.5785
 epoch: 50, train_loss: 0.5050, test_loss: 1.7830, test_f1: 0.5806
 epoch: 51, train_loss: 0.4520, test_loss: 2.0737, test_f1: 0.5795
 epoch: 52, train_loss: 0.4032, test_loss: 1.9962, test_f1: 0.5822
 epoch: 53, train_loss: 0.3816, test_loss: 2.0571, test_f1: 0.5816
 epoch: 54, train_loss: 0.3767, test_loss: 1.9649, test_f1: 0.5997
 epoch: 55, train_loss: 0.3393, test_loss: 2.1301, test_f1: 0.5855
 epoch: 56, train_loss: 0.3616, test_loss: 2.1118, test_f1: 0.5688
 epoch: 57, train_loss: 0.3933, test_loss: 2.1909, test_f1: 0.5944
 epoch: 58, train_loss: 0.3466, test_loss: 2.1380, test_f1: 0.5925
 epoch: 59, train_loss: 0.3250, test_loss: 2.1861, test_f1: 0.5535
 epoch: 60, train_loss: 0.3439, test_loss: 2.3645, test_f1: 0.5874
 epoch: 61, train_loss: 0.3242, test_loss: 2.1105, test_f1: 0.5932
 epoch: 62, train_loss: 0.3348, test_loss: 1.9401, test_f1: 0.5961
 epoch: 63, train_loss: 0.3359, test_loss: 2.6902, test_f1: 0.6137
 epoch: 64, train_loss: 0.3045, test_loss: 2.3002, test_f1: 0.5778
 epoch: 65, train_loss: 0.3302, test_loss: 2.1873, test_f1: 0.5888
 epoch: 66, train_loss: 0.3220, test_loss: 2.1232, test_f1: 0.5896
 epoch: 67, train_loss: 0.3236, test_loss: 2.1251, test_f1: 0.5992
 epoch: 68, train_loss: 0.3204, test_loss: 2.1050, test_f1: 0.6156
 epoch: 69, train_loss: 0.3108, test_loss: 2.5836, test_f1: 0.5944
 epoch: 70, train_loss: 0.3418, test_loss: 2.4946, test_f1: 0.5728
 epoch: 71, train_loss: 0.2850, test_loss: 2.2261, test_f1: 0.5877
 epoch: 72, train_loss: 0.3068, test_loss: 2.3132, test_f1: 0.5919
 epoch: 73, train_loss: 0.3342, test_loss: 2.5898, test_f1: 0.5825
 epoch: 74, train_loss: 0.3359, test_loss: 3.1924, test_f1: 0.5141
 epoch: 75, train_loss: 0.3039, test_loss: 2.0303, test_f1: 0.6022
 epoch: 76, train_loss: 0.2632, test_loss: 2.1762, test_f1: 0.5703
 epoch: 77, train_loss: 0.2519, test_loss: 2.1605, test_f1: 0.5685
 epoch: 78, train_loss: 0.2647, test_loss: 2.4560, test_f1: 0.6087
 epoch: 79, train_loss: 0.2556, test_loss: 2.6517, test_f1: 0.5641
 epoch: 80, train_loss: 0.2721, test_loss: 3.1203, test_f1: 0.5872
 epoch: 81, train_loss: 0.2900, test_loss: 1.9783, test_f1: 0.5802
 epoch: 82, train_loss: 0.2488, test_loss: 2.2266, test_f1: 0.5955
 epoch: 83, train_loss: 0.3109, test_loss: 1.8101, test_f1: 0.6178
 epoch: 84, train_loss: 0.2722, test_loss: 2.1830, test_f1: 0.5776
 epoch: 85, train_loss: 0.3020, test_loss: 2.7746, test_f1: 0.5683
 epoch: 86, train_loss: 0.2538, test_loss: 2.3586, test_f1: 0.5863
 epoch: 87, train_loss: 0.2563, test_loss: 2.3593, test_f1: 0.5844
 epoch: 88, train_loss: 0.2398, test_loss: 2.6639, test_f1: 0.6137
 epoch: 89, train_loss: 0.2028, test_loss: 2.4517, test_f1: 0.5930
 epoch: 90, train_loss: 0.2161, test_loss: 2.7323, test_f1: 0.5802
 epoch: 91, train_loss: 0.2228, test_loss: 2.9899, test_f1: 0.5863
 epoch: 92, train_loss: 0.2698, test_loss: 2.5773, test_f1: 0.5463
 epoch: 93, train_loss: 0.2528, test_loss: 3.0783, test_f1: 0.5689
 epoch: 94, train_loss: 0.2516, test_loss: 2.3877, test_f1: 0.5913
 epoch: 95, train_loss: 0.2702, test_loss: 2.1732, test_f1: 0.6159
 epoch: 96, train_loss: 0.2333, test_loss: 2.4940, test_f1: 0.5781
 epoch: 97, train_loss: 0.2647, test_loss: 2.4490, test_f1: 0.5646
 epoch: 98, train_loss: 0.2275, test_loss: 2.8661, test_f1: 0.6161
 epoch: 99, train_loss: 0.2016, test_loss: 2.5877, test_f1: 0.5900
##################ITERATION #8 ****************************************
 epoch: 0, train_loss: 1.3876, test_loss: 1.7421, test_f1: 0.2281
 epoch: 1, train_loss: 1.0861, test_loss: 1.2947, test_f1: 0.3487
 epoch: 2, train_loss: 0.9983, test_loss: 1.1196, test_f1: 0.4266
 epoch: 3, train_loss: 0.9562, test_loss: 1.0551, test_f1: 0.5194
 epoch: 4, train_loss: 0.9320, test_loss: 1.0133, test_f1: 0.5243
 epoch: 5, train_loss: 0.8909, test_loss: 0.9980, test_f1: 0.5756
 epoch: 6, train_loss: 0.8448, test_loss: 1.1245, test_f1: 0.4359
 epoch: 7, train_loss: 0.8290, test_loss: 0.9655, test_f1: 0.5792
 epoch: 8, train_loss: 0.8248, test_loss: 1.0430, test_f1: 0.4956
 epoch: 9, train_loss: 0.8178, test_loss: 1.3194, test_f1: 0.4216
 epoch: 10, train_loss: 0.8205, test_loss: 1.0011, test_f1: 0.4853
 epoch: 11, train_loss: 0.7686, test_loss: 1.0948, test_f1: 0.5151
 epoch: 12, train_loss: 0.7678, test_loss: 0.9942, test_f1: 0.5610
 epoch: 13, train_loss: 0.7434, test_loss: 1.2095, test_f1: 0.4824
 epoch: 14, train_loss: 0.7253, test_loss: 1.0932, test_f1: 0.4806
 epoch: 15, train_loss: 0.7150, test_loss: 1.0627, test_f1: 0.5748
 epoch: 16, train_loss: 0.7413, test_loss: 2.0831, test_f1: 0.4723
 epoch: 17, train_loss: 0.7565, test_loss: 1.2620, test_f1: 0.5523
 epoch: 18, train_loss: 0.7948, test_loss: 1.1442, test_f1: 0.5210
 epoch: 19, train_loss: 0.7753, test_loss: 1.1062, test_f1: 0.5019
 epoch: 20, train_loss: 0.7221, test_loss: 0.9990, test_f1: 0.5991
 epoch: 21, train_loss: 0.6810, test_loss: 1.4715, test_f1: 0.5345
 epoch: 22, train_loss: 0.6988, test_loss: 1.1480, test_f1: 0.5621
 epoch: 23, train_loss: 0.7304, test_loss: 1.5109, test_f1: 0.5231
 epoch: 24, train_loss: 0.6986, test_loss: 1.0875, test_f1: 0.5836
 epoch: 25, train_loss: 0.7033, test_loss: 1.1410, test_f1: 0.5476
 epoch: 26, train_loss: 0.7035, test_loss: 1.4503, test_f1: 0.3782
 epoch: 27, train_loss: 0.7094, test_loss: 1.2483, test_f1: 0.5127
 epoch: 28, train_loss: 0.6770, test_loss: 1.1999, test_f1: 0.5501
 epoch: 29, train_loss: 0.6365, test_loss: 1.2468, test_f1: 0.5752
 epoch: 30, train_loss: 0.6153, test_loss: 1.9967, test_f1: 0.4824
 epoch: 31, train_loss: 0.6338, test_loss: 1.1776, test_f1: 0.5927
 epoch: 32, train_loss: 0.6261, test_loss: 1.1042, test_f1: 0.6103
 epoch: 33, train_loss: 0.5886, test_loss: 1.3800, test_f1: 0.5899
 epoch: 34, train_loss: 0.6141, test_loss: 1.4056, test_f1: 0.5684
 epoch: 35, train_loss: 0.5989, test_loss: 1.1118, test_f1: 0.6129
 epoch: 36, train_loss: 0.5951, test_loss: 1.6616, test_f1: 0.5543
 epoch: 37, train_loss: 0.6015, test_loss: 1.6334, test_f1: 0.5598
 epoch: 38, train_loss: 0.5995, test_loss: 1.6425, test_f1: 0.4789
 epoch: 39, train_loss: 0.5880, test_loss: 1.2353, test_f1: 0.5913
 epoch: 40, train_loss: 0.5777, test_loss: 1.1536, test_f1: 0.5751
 epoch: 41, train_loss: 0.5993, test_loss: 1.4593, test_f1: 0.5479
 epoch: 42, train_loss: 0.6651, test_loss: 1.1572, test_f1: 0.5247
 epoch: 43, train_loss: 0.6321, test_loss: 1.2965, test_f1: 0.6241
 epoch: 44, train_loss: 0.5718, test_loss: 1.9422, test_f1: 0.5252
 epoch: 45, train_loss: 0.5670, test_loss: 1.6413, test_f1: 0.5483
 epoch: 46, train_loss: 0.6281, test_loss: 1.6117, test_f1: 0.5308
 epoch: 47, train_loss: 0.5870, test_loss: 1.3137, test_f1: 0.5644
 epoch: 48, train_loss: 0.5424, test_loss: 1.2853, test_f1: 0.6115
 epoch: 49, train_loss: 0.5699, test_loss: 1.2122, test_f1: 0.6261
 epoch: 50, train_loss: 0.5627, test_loss: 1.5244, test_f1: 0.6193
 epoch: 51, train_loss: 0.5519, test_loss: 1.2704, test_f1: 0.6035
 epoch: 52, train_loss: 0.4739, test_loss: 1.3095, test_f1: 0.6503
 epoch: 53, train_loss: 0.4558, test_loss: 1.4227, test_f1: 0.6107
 epoch: 54, train_loss: 0.4564, test_loss: 1.3155, test_f1: 0.6092
 epoch: 55, train_loss: 0.4445, test_loss: 1.5806, test_f1: 0.6159
 epoch: 56, train_loss: 0.4336, test_loss: 1.6310, test_f1: 0.5926
 epoch: 57, train_loss: 0.4011, test_loss: 1.5095, test_f1: 0.6245
 epoch: 58, train_loss: 0.3643, test_loss: 1.6588, test_f1: 0.6219
 epoch: 59, train_loss: 0.3566, test_loss: 1.8118, test_f1: 0.5963
 epoch: 60, train_loss: 0.4050, test_loss: 1.6183, test_f1: 0.6192
 epoch: 61, train_loss: 0.3594, test_loss: 1.6609, test_f1: 0.6299
 epoch: 62, train_loss: 0.3768, test_loss: 1.7877, test_f1: 0.5696
 epoch: 63, train_loss: 0.3529, test_loss: 1.6570, test_f1: 0.6419
 epoch: 64, train_loss: 0.3977, test_loss: 1.8123, test_f1: 0.5881
 epoch: 65, train_loss: 0.3900, test_loss: 1.7262, test_f1: 0.6082
 epoch: 66, train_loss: 0.3837, test_loss: 1.7171, test_f1: 0.6122
 epoch: 67, train_loss: 0.3909, test_loss: 1.9776, test_f1: 0.5821
 epoch: 68, train_loss: 0.3528, test_loss: 1.7510, test_f1: 0.6123
 epoch: 69, train_loss: 0.3394, test_loss: 2.2157, test_f1: 0.5894
 epoch: 70, train_loss: 0.3523, test_loss: 1.8184, test_f1: 0.6229
 epoch: 71, train_loss: 0.3762, test_loss: 1.6693, test_f1: 0.5780
 epoch: 72, train_loss: 0.3469, test_loss: 1.6829, test_f1: 0.6249
 epoch: 73, train_loss: 0.3444, test_loss: 1.6268, test_f1: 0.6587
 epoch: 74, train_loss: 0.4078, test_loss: 2.2424, test_f1: 0.5630
 epoch: 75, train_loss: 0.4085, test_loss: 1.9027, test_f1: 0.5739
 epoch: 76, train_loss: 0.3832, test_loss: 1.5489, test_f1: 0.6393
 epoch: 77, train_loss: 0.3602, test_loss: 2.0419, test_f1: 0.6046
 epoch: 78, train_loss: 0.3420, test_loss: 1.7798, test_f1: 0.6098
 epoch: 79, train_loss: 0.3558, test_loss: 1.7926, test_f1: 0.6354
 epoch: 80, train_loss: 0.3179, test_loss: 1.5518, test_f1: 0.6273
 epoch: 81, train_loss: 0.3245, test_loss: 1.3676, test_f1: 0.6615
 epoch: 82, train_loss: 0.2993, test_loss: 1.6824, test_f1: 0.6462
 epoch: 83, train_loss: 0.3120, test_loss: 1.7101, test_f1: 0.5947
 epoch: 84, train_loss: 0.3134, test_loss: 1.6371, test_f1: 0.6412
 epoch: 85, train_loss: 0.3160, test_loss: 1.6748, test_f1: 0.6328
 epoch: 86, train_loss: 0.2767, test_loss: 1.9046, test_f1: 0.6247
 epoch: 87, train_loss: 0.2850, test_loss: 2.0454, test_f1: 0.5991
 epoch: 88, train_loss: 0.3453, test_loss: 2.2000, test_f1: 0.5902
 epoch: 89, train_loss: 0.3171, test_loss: 1.8979, test_f1: 0.6303
 epoch: 90, train_loss: 0.2934, test_loss: 2.1971, test_f1: 0.5584
 epoch: 91, train_loss: 0.3224, test_loss: 2.1274, test_f1: 0.6003
 epoch: 92, train_loss: 0.2871, test_loss: 1.9609, test_f1: 0.6030
 epoch: 93, train_loss: 0.3021, test_loss: 2.2133, test_f1: 0.6220
 epoch: 94, train_loss: 0.3018, test_loss: 1.7904, test_f1: 0.5835
 epoch: 95, train_loss: 0.2887, test_loss: 1.8193, test_f1: 0.6422
 epoch: 96, train_loss: 0.2486, test_loss: 2.3705, test_f1: 0.5813
 epoch: 97, train_loss: 0.2557, test_loss: 2.1456, test_f1: 0.6059
 epoch: 98, train_loss: 0.2072, test_loss: 2.1233, test_f1: 0.6196
 epoch: 99, train_loss: 0.2279, test_loss: 2.0177, test_f1: 0.6180
##################ITERATION #9 ****************************************
 epoch: 0, train_loss: 1.4176, test_loss: 1.7833, test_f1: 0.3232
 epoch: 1, train_loss: 1.0347, test_loss: 1.2559, test_f1: 0.2838
 epoch: 2, train_loss: 0.9839, test_loss: 1.1124, test_f1: 0.4897
 epoch: 3, train_loss: 0.9189, test_loss: 1.0577, test_f1: 0.5285
 epoch: 4, train_loss: 0.8933, test_loss: 1.0569, test_f1: 0.4632
 epoch: 5, train_loss: 0.8630, test_loss: 1.1229, test_f1: 0.4470
 epoch: 6, train_loss: 0.8280, test_loss: 0.9705, test_f1: 0.5810
 epoch: 7, train_loss: 0.7969, test_loss: 1.4892, test_f1: 0.4214
 epoch: 8, train_loss: 0.8127, test_loss: 1.4421, test_f1: 0.4614
 epoch: 9, train_loss: 0.7812, test_loss: 1.0378, test_f1: 0.5250
 epoch: 10, train_loss: 0.7950, test_loss: 1.0852, test_f1: 0.5526
 epoch: 11, train_loss: 0.7411, test_loss: 1.5134, test_f1: 0.4069
 epoch: 12, train_loss: 0.7541, test_loss: 1.1677, test_f1: 0.5386
 epoch: 13, train_loss: 0.7485, test_loss: 0.9328, test_f1: 0.5832
 epoch: 14, train_loss: 0.7160, test_loss: 1.0549, test_f1: 0.5286
 epoch: 15, train_loss: 0.7147, test_loss: 2.0869, test_f1: 0.4051
 epoch: 16, train_loss: 0.7560, test_loss: 1.5085, test_f1: 0.4364
 epoch: 17, train_loss: 0.7003, test_loss: 1.1000, test_f1: 0.5881
 epoch: 18, train_loss: 0.7299, test_loss: 2.3691, test_f1: 0.4936
 epoch: 19, train_loss: 0.7334, test_loss: 1.1689, test_f1: 0.5081
 epoch: 20, train_loss: 0.7438, test_loss: 1.4054, test_f1: 0.5568
 epoch: 21, train_loss: 0.6868, test_loss: 1.3348, test_f1: 0.5638
 epoch: 22, train_loss: 0.7043, test_loss: 1.1175, test_f1: 0.5565
 epoch: 23, train_loss: 0.6584, test_loss: 1.2150, test_f1: 0.5231
 epoch: 24, train_loss: 0.6407, test_loss: 1.4873, test_f1: 0.5752
 epoch: 25, train_loss: 0.6222, test_loss: 1.0647, test_f1: 0.5975
 epoch: 26, train_loss: 0.6089, test_loss: 1.1735, test_f1: 0.5825
 epoch: 27, train_loss: 0.6291, test_loss: 1.3220, test_f1: 0.5409
 epoch: 28, train_loss: 0.6115, test_loss: 1.2105, test_f1: 0.5854
 epoch: 29, train_loss: 0.6313, test_loss: 1.3299, test_f1: 0.4952
 epoch: 30, train_loss: 0.6326, test_loss: 1.6963, test_f1: 0.5296
 epoch: 31, train_loss: 0.6569, test_loss: 1.5598, test_f1: 0.4860
 epoch: 32, train_loss: 0.6391, test_loss: 1.4465, test_f1: 0.5047
 epoch: 33, train_loss: 0.6258, test_loss: 1.3897, test_f1: 0.5369
 epoch: 34, train_loss: 0.6275, test_loss: 1.9976, test_f1: 0.4877
 epoch: 35, train_loss: 0.5956, test_loss: 1.6963, test_f1: 0.5394
 epoch: 36, train_loss: 0.5808, test_loss: 1.3383, test_f1: 0.5788
 epoch: 37, train_loss: 0.5789, test_loss: 1.4286, test_f1: 0.5543
 epoch: 38, train_loss: 0.5795, test_loss: 1.3775, test_f1: 0.5827
 epoch: 39, train_loss: 0.5666, test_loss: 2.3881, test_f1: 0.4708
 epoch: 40, train_loss: 0.5635, test_loss: 1.5682, test_f1: 0.4757
 epoch: 41, train_loss: 0.5446, test_loss: 1.5403, test_f1: 0.5838
 epoch: 42, train_loss: 0.4969, test_loss: 1.3424, test_f1: 0.5949
 epoch: 43, train_loss: 0.6270, test_loss: 1.9509, test_f1: 0.4489
 epoch: 44, train_loss: 0.6203, test_loss: 1.4557, test_f1: 0.4263
 epoch: 45, train_loss: 0.5397, test_loss: 1.3437, test_f1: 0.5815
 epoch: 46, train_loss: 0.5090, test_loss: 1.3914, test_f1: 0.5793
 epoch: 47, train_loss: 0.5302, test_loss: 1.6551, test_f1: 0.5618
 epoch: 48, train_loss: 0.5090, test_loss: 1.8471, test_f1: 0.5209
 epoch: 49, train_loss: 0.5799, test_loss: 2.0649, test_f1: 0.5417
 epoch: 50, train_loss: 0.5128, test_loss: 1.5215, test_f1: 0.5893
 epoch: 51, train_loss: 0.4692, test_loss: 1.6580, test_f1: 0.6149
 epoch: 52, train_loss: 0.4563, test_loss: 2.0513, test_f1: 0.5976
 epoch: 53, train_loss: 0.4393, test_loss: 1.6540, test_f1: 0.6045
 epoch: 54, train_loss: 0.5167, test_loss: 1.7852, test_f1: 0.5834
 epoch: 55, train_loss: 0.4486, test_loss: 1.9901, test_f1: 0.6091
 epoch: 56, train_loss: 0.4568, test_loss: 2.0061, test_f1: 0.5839
 epoch: 57, train_loss: 0.4278, test_loss: 1.9740, test_f1: 0.6108
 epoch: 58, train_loss: 0.3921, test_loss: 1.8084, test_f1: 0.6074
 epoch: 59, train_loss: 0.4142, test_loss: 1.8957, test_f1: 0.6156
 epoch: 60, train_loss: 0.3966, test_loss: 2.0920, test_f1: 0.6088
 epoch: 61, train_loss: 0.4043, test_loss: 2.1765, test_f1: 0.5724
 epoch: 62, train_loss: 0.3674, test_loss: 1.5752, test_f1: 0.6076
 epoch: 63, train_loss: 0.3641, test_loss: 1.8533, test_f1: 0.6459
 epoch: 64, train_loss: 0.3616, test_loss: 1.8293, test_f1: 0.6265
 epoch: 65, train_loss: 0.3491, test_loss: 2.1370, test_f1: 0.5615
 epoch: 66, train_loss: 0.3601, test_loss: 2.0843, test_f1: 0.6041
 epoch: 67, train_loss: 0.3227, test_loss: 2.2402, test_f1: 0.6159
 epoch: 68, train_loss: 0.3099, test_loss: 2.2923, test_f1: 0.5862
 epoch: 69, train_loss: 0.3263, test_loss: 2.0239, test_f1: 0.5872
 epoch: 70, train_loss: 0.3655, test_loss: 2.0184, test_f1: 0.6150
 epoch: 71, train_loss: 0.3398, test_loss: 2.1862, test_f1: 0.6118
 epoch: 72, train_loss: 0.3349, test_loss: 1.9310, test_f1: 0.6238
 epoch: 73, train_loss: 0.3058, test_loss: 1.8999, test_f1: 0.6062
 epoch: 74, train_loss: 0.3399, test_loss: 2.0626, test_f1: 0.6175
 epoch: 75, train_loss: 0.3287, test_loss: 2.2520, test_f1: 0.5781
 epoch: 76, train_loss: 0.3003, test_loss: 2.0727, test_f1: 0.6190
 epoch: 77, train_loss: 0.2907, test_loss: 2.0494, test_f1: 0.6127
 epoch: 78, train_loss: 0.3344, test_loss: 2.2670, test_f1: 0.6069
 epoch: 79, train_loss: 0.2763, test_loss: 2.9506, test_f1: 0.5846
 epoch: 80, train_loss: 0.2740, test_loss: 2.5636, test_f1: 0.6014
 epoch: 81, train_loss: 0.2692, test_loss: 3.0510, test_f1: 0.5828
 epoch: 82, train_loss: 0.3050, test_loss: 1.8820, test_f1: 0.6130
 epoch: 83, train_loss: 0.2592, test_loss: 2.6993, test_f1: 0.5471
 epoch: 84, train_loss: 0.2861, test_loss: 2.1934, test_f1: 0.5775
 epoch: 85, train_loss: 0.2969, test_loss: 1.6560, test_f1: 0.6600
 epoch: 86, train_loss: 0.2703, test_loss: 2.2335, test_f1: 0.5820
 epoch: 87, train_loss: 0.2731, test_loss: 2.1308, test_f1: 0.5935
 epoch: 88, train_loss: 0.2656, test_loss: 2.6416, test_f1: 0.5751
 epoch: 89, train_loss: 0.2630, test_loss: 2.6587, test_f1: 0.5806
 epoch: 90, train_loss: 0.2425, test_loss: 2.7174, test_f1: 0.6016
 epoch: 91, train_loss: 0.2945, test_loss: 2.1929, test_f1: 0.6300
 epoch: 92, train_loss: 0.2946, test_loss: 2.4444, test_f1: 0.5909
 epoch: 93, train_loss: 0.2670, test_loss: 2.4031, test_f1: 0.5976
 epoch: 94, train_loss: 0.2917, test_loss: 2.1867, test_f1: 0.6442
 epoch: 95, train_loss: 0.2607, test_loss: 2.0793, test_f1: 0.6029
 epoch: 96, train_loss: 0.2850, test_loss: 2.4055, test_f1: 0.5937
 epoch: 97, train_loss: 0.2742, test_loss: 2.3320, test_f1: 0.5675
 epoch: 98, train_loss: 0.2509, test_loss: 2.5733, test_f1: 0.5606
 epoch: 99, train_loss: 0.2421, test_loss: 2.7441, test_f1: 0.5839

Training completed in 406.44 seconds
Best F1: 0.6773 at epoch 88
Mean F1 across iterations: 0.6498  0.0139
========================FINAL RESULTS================================
FEGIN weighted F1: 0.6773  0.0139
python main.py --data ltspice_demos --representation component_pin_net --model FEGIN --layers 6 --hiddens 128 --batch_size 128 --lr 0.01 --emb_size 250 --epochs 100 --save_appendix component_pin_net_L6_H128_BS128_LR0.01_E250 --no_val
-----



STDERR:
  File "main.py", line 370, in <module>
    main()
  File "main.py", line 254, in main
    dataset = dataset_class(
  File "/home/philip/projects/ltspice_examples_code_repo/Circuit-Completion-Using-GNNs/component_classification_with_link_prediction_head/evaluation/FEGIN/kernel/circuit_datasets.py", line 15, in __init__
    self.data, self.slices = torch.load(self.processed_paths[0])
  File "/home/philip/.local/lib/python3.8/site-packages/torch/serialization.py", line 1040, in load
    warnings.warn(
  File "/usr/lib/python3.8/warnings.py", line 109, in _showwarnmsg
    sw(msg.message, msg.category, msg.filename, msg.lineno,
  File "main.py", line 47, in warn_with_traceback
    traceback.print_stack(file=log)
/home/philip/projects/ltspice_examples_code_repo/Circuit-Completion-Using-GNNs/component_classification_with_link_prediction_head/evaluation/FEGIN/kernel/circuit_datasets.py:15: FutureWarning: You are using `torch.load` with `weights_only=False` (the current default value), which uses the default pickle module implicitly. It is possible to construct malicious pickle data which will execute arbitrary code during unpickling (See https://github.com/pytorch/pytorch/blob/main/SECURITY.md#untrusted-models for more details). In a future release, the default value for `weights_only` will be flipped to `True`. This limits the functions that could be executed during unpickling. Arbitrary objects will no longer be allowed to be loaded via this mode unless they are explicitly allowlisted by the user via `torch.serialization.add_safe_globals`. We recommend you start setting `weights_only=True` for any use case where you don't have full control of the loaded file. Please open an issue on GitHub for any issues related to this experimental feature.
  self.data, self.slices = torch.load(self.processed_paths[0])
