STDOUT:
Results will be saved in /home/philip/projects/ltspice_examples_code_repo/Circuit-Completion-Using-GNNs/component_classification_with_link_prediction_head/evaluation/FEGIN/results/model_FEGIN_dataset_ltspice_examples
Command line input: python main.py --data ltspice_examples --representation component_pin_net --model FEGIN --layers 2 --hiddens 64 --batch_size 32 --lr 0.01 --emb_size 128 --epochs 100 --save_appendix component_pin_net_L2_H64_BS32_LR0.01_E128 --no_val
 is saved.
-----
ltspice_examples - FEGIN
Using 2 layers, 64 hidden units, h = 2
Loading component_pin_net representation dataset
ENTERED
Training FEGIN on component_pin_net representation
Train: 3558, Test: 846
##################ITERATION #0 ****************************************
 epoch: 0, train_loss: 1.1154, test_loss: 1.0726, test_f1: 0.4184
 epoch: 1, train_loss: 1.0033, test_loss: 1.1141, test_f1: 0.4727
 epoch: 2, train_loss: 1.0001, test_loss: 1.0582, test_f1: 0.4737
 epoch: 3, train_loss: 0.9720, test_loss: 0.9598, test_f1: 0.4639
 epoch: 4, train_loss: 0.9613, test_loss: 0.9697, test_f1: 0.4964
 epoch: 5, train_loss: 0.9419, test_loss: 1.0034, test_f1: 0.4485
 epoch: 6, train_loss: 0.9592, test_loss: 0.9504, test_f1: 0.5059
 epoch: 7, train_loss: 0.9480, test_loss: 0.9189, test_f1: 0.4885
 epoch: 8, train_loss: 0.9370, test_loss: 0.9090, test_f1: 0.4992
 epoch: 9, train_loss: 0.9169, test_loss: 0.9341, test_f1: 0.4992
 epoch: 10, train_loss: 0.8930, test_loss: 0.9211, test_f1: 0.4982
 epoch: 11, train_loss: 0.8926, test_loss: 0.8778, test_f1: 0.5526
 epoch: 12, train_loss: 0.8724, test_loss: 0.8684, test_f1: 0.5321
 epoch: 13, train_loss: 0.8656, test_loss: 0.8758, test_f1: 0.5733
 epoch: 14, train_loss: 0.8761, test_loss: 0.9268, test_f1: 0.5198
 epoch: 15, train_loss: 0.8471, test_loss: 0.8351, test_f1: 0.5880
 epoch: 16, train_loss: 0.8510, test_loss: 0.8644, test_f1: 0.5502
 epoch: 17, train_loss: 0.8412, test_loss: 0.8945, test_f1: 0.5828
 epoch: 18, train_loss: 0.8357, test_loss: 0.8519, test_f1: 0.5501
 epoch: 19, train_loss: 0.8250, test_loss: 0.8117, test_f1: 0.5490
 epoch: 20, train_loss: 0.8288, test_loss: 0.9686, test_f1: 0.5254
 epoch: 21, train_loss: 0.8214, test_loss: 0.8246, test_f1: 0.5532
 epoch: 22, train_loss: 0.8251, test_loss: 0.9142, test_f1: 0.5585
 epoch: 23, train_loss: 0.8062, test_loss: 0.9159, test_f1: 0.5918
 epoch: 24, train_loss: 0.8069, test_loss: 0.8267, test_f1: 0.5467
 epoch: 25, train_loss: 0.7948, test_loss: 0.8252, test_f1: 0.5901
 epoch: 26, train_loss: 0.8096, test_loss: 0.8762, test_f1: 0.5528
 epoch: 27, train_loss: 0.7801, test_loss: 0.9049, test_f1: 0.5355
 epoch: 28, train_loss: 0.7887, test_loss: 0.8204, test_f1: 0.5648
 epoch: 29, train_loss: 0.7926, test_loss: 0.8037, test_f1: 0.5760
 epoch: 30, train_loss: 0.7927, test_loss: 0.8360, test_f1: 0.6008
 epoch: 31, train_loss: 0.7711, test_loss: 0.8948, test_f1: 0.6241
 epoch: 32, train_loss: 0.7801, test_loss: 0.8466, test_f1: 0.5619
 epoch: 33, train_loss: 0.7573, test_loss: 0.8861, test_f1: 0.6424
 epoch: 34, train_loss: 0.7563, test_loss: 0.8880, test_f1: 0.6511
 epoch: 35, train_loss: 0.7568, test_loss: 0.8317, test_f1: 0.6243
 epoch: 36, train_loss: 0.7496, test_loss: 0.9247, test_f1: 0.5891
 epoch: 37, train_loss: 0.7770, test_loss: 0.9099, test_f1: 0.6098
 epoch: 38, train_loss: 0.7443, test_loss: 0.8736, test_f1: 0.6294
 epoch: 39, train_loss: 0.7402, test_loss: 0.9520, test_f1: 0.6245
 epoch: 40, train_loss: 0.7438, test_loss: 0.9451, test_f1: 0.6441
 epoch: 41, train_loss: 0.7532, test_loss: 0.8618, test_f1: 0.5930
 epoch: 42, train_loss: 0.7333, test_loss: 0.9396, test_f1: 0.5579
 epoch: 43, train_loss: 0.7244, test_loss: 0.8951, test_f1: 0.6411
 epoch: 44, train_loss: 0.7386, test_loss: 0.8977, test_f1: 0.6454
 epoch: 45, train_loss: 0.7283, test_loss: 0.8614, test_f1: 0.6042
 epoch: 46, train_loss: 0.7297, test_loss: 1.0321, test_f1: 0.6216
 epoch: 47, train_loss: 0.7312, test_loss: 1.0862, test_f1: 0.5924
 epoch: 48, train_loss: 0.7201, test_loss: 0.9359, test_f1: 0.5859
 epoch: 49, train_loss: 0.7231, test_loss: 1.0448, test_f1: 0.5938
 epoch: 50, train_loss: 0.7506, test_loss: 0.8816, test_f1: 0.6113
 epoch: 51, train_loss: 0.7043, test_loss: 0.8921, test_f1: 0.6228
 epoch: 52, train_loss: 0.6649, test_loss: 1.0471, test_f1: 0.6141
 epoch: 53, train_loss: 0.6651, test_loss: 1.0418, test_f1: 0.6373
 epoch: 54, train_loss: 0.6599, test_loss: 1.0875, test_f1: 0.6489
 epoch: 55, train_loss: 0.6628, test_loss: 1.0667, test_f1: 0.6236
 epoch: 56, train_loss: 0.6653, test_loss: 0.9788, test_f1: 0.6325
 epoch: 57, train_loss: 0.6714, test_loss: 0.9371, test_f1: 0.6428
 epoch: 58, train_loss: 0.6537, test_loss: 1.0358, test_f1: 0.6562
 epoch: 59, train_loss: 0.6374, test_loss: 1.1668, test_f1: 0.6376
 epoch: 60, train_loss: 0.6377, test_loss: 1.0468, test_f1: 0.6319
 epoch: 61, train_loss: 0.6360, test_loss: 1.0554, test_f1: 0.6237
 epoch: 62, train_loss: 0.6342, test_loss: 1.1248, test_f1: 0.6431
 epoch: 63, train_loss: 0.6327, test_loss: 1.0717, test_f1: 0.6418
 epoch: 64, train_loss: 0.6356, test_loss: 1.0292, test_f1: 0.6420
 epoch: 65, train_loss: 0.6383, test_loss: 1.2239, test_f1: 0.6295
 epoch: 66, train_loss: 0.6245, test_loss: 0.9721, test_f1: 0.6374
 epoch: 67, train_loss: 0.6134, test_loss: 1.0180, test_f1: 0.6388
 epoch: 68, train_loss: 0.6190, test_loss: 1.1707, test_f1: 0.6289
 epoch: 69, train_loss: 0.6093, test_loss: 1.0621, test_f1: 0.6509
 epoch: 70, train_loss: 0.6189, test_loss: 1.0190, test_f1: 0.6323
 epoch: 71, train_loss: 0.6162, test_loss: 1.0627, test_f1: 0.6415
 epoch: 72, train_loss: 0.6177, test_loss: 1.1270, test_f1: 0.6508
 epoch: 73, train_loss: 0.6010, test_loss: 1.1102, test_f1: 0.6517
 epoch: 74, train_loss: 0.6051, test_loss: 1.0219, test_f1: 0.6500
 epoch: 75, train_loss: 0.5907, test_loss: 1.1261, test_f1: 0.6460
 epoch: 76, train_loss: 0.6108, test_loss: 1.0041, test_f1: 0.6395
 epoch: 77, train_loss: 0.6143, test_loss: 0.9967, test_f1: 0.6345
 epoch: 78, train_loss: 0.6021, test_loss: 1.0914, test_f1: 0.6622
 epoch: 79, train_loss: 0.5936, test_loss: 1.2191, test_f1: 0.6510
 epoch: 80, train_loss: 0.6015, test_loss: 1.2652, test_f1: 0.6426
 epoch: 81, train_loss: 0.5899, test_loss: 1.0645, test_f1: 0.6683
 epoch: 82, train_loss: 0.5889, test_loss: 1.0676, test_f1: 0.6472
 epoch: 83, train_loss: 0.5730, test_loss: 1.0376, test_f1: 0.6406
 epoch: 84, train_loss: 0.5703, test_loss: 1.0450, test_f1: 0.6586
 epoch: 85, train_loss: 0.5930, test_loss: 0.9895, test_f1: 0.6501
 epoch: 86, train_loss: 0.5652, test_loss: 1.0644, test_f1: 0.6786
 epoch: 87, train_loss: 0.5832, test_loss: 0.9916, test_f1: 0.6554
 epoch: 88, train_loss: 0.5728, test_loss: 1.0864, test_f1: 0.6494
 epoch: 89, train_loss: 0.5793, test_loss: 1.1121, test_f1: 0.6452
 epoch: 90, train_loss: 0.5653, test_loss: 1.1713, test_f1: 0.6424
 epoch: 91, train_loss: 0.5706, test_loss: 1.0933, test_f1: 0.6755
 epoch: 92, train_loss: 0.5718, test_loss: 1.0526, test_f1: 0.6007
 epoch: 93, train_loss: 0.5532, test_loss: 1.2282, test_f1: 0.6510
 epoch: 94, train_loss: 0.5682, test_loss: 1.1316, test_f1: 0.6660
 epoch: 95, train_loss: 0.5524, test_loss: 1.0512, test_f1: 0.6545
 epoch: 96, train_loss: 0.5647, test_loss: 1.2020, test_f1: 0.6625
 epoch: 97, train_loss: 0.5389, test_loss: 1.1588, test_f1: 0.6440
 epoch: 98, train_loss: 0.5538, test_loss: 1.1796, test_f1: 0.6450
 epoch: 99, train_loss: 0.5471, test_loss: 1.1647, test_f1: 0.6736
##################ITERATION #1 ****************************************
 epoch: 0, train_loss: 1.0910, test_loss: 1.4175, test_f1: 0.4368
 epoch: 1, train_loss: 1.0055, test_loss: 1.0698, test_f1: 0.5250
 epoch: 2, train_loss: 0.9743, test_loss: 1.0817, test_f1: 0.4869
 epoch: 3, train_loss: 0.9654, test_loss: 1.0302, test_f1: 0.5070
 epoch: 4, train_loss: 0.9535, test_loss: 0.9264, test_f1: 0.5564
 epoch: 5, train_loss: 0.9434, test_loss: 0.9615, test_f1: 0.4981
 epoch: 6, train_loss: 0.9352, test_loss: 0.9209, test_f1: 0.5483
 epoch: 7, train_loss: 0.9138, test_loss: 0.9390, test_f1: 0.5581
 epoch: 8, train_loss: 0.9099, test_loss: 0.8723, test_f1: 0.5727
 epoch: 9, train_loss: 0.9236, test_loss: 0.9987, test_f1: 0.5119
 epoch: 10, train_loss: 0.8968, test_loss: 0.8987, test_f1: 0.5213
 epoch: 11, train_loss: 0.8823, test_loss: 0.9387, test_f1: 0.5384
 epoch: 12, train_loss: 0.8722, test_loss: 0.9437, test_f1: 0.5529
 epoch: 13, train_loss: 0.8641, test_loss: 0.9109, test_f1: 0.5967
 epoch: 14, train_loss: 0.8676, test_loss: 0.8736, test_f1: 0.5637
 epoch: 15, train_loss: 0.8503, test_loss: 0.9606, test_f1: 0.5296
 epoch: 16, train_loss: 0.8605, test_loss: 0.9061, test_f1: 0.5509
 epoch: 17, train_loss: 0.8348, test_loss: 0.8697, test_f1: 0.5870
 epoch: 18, train_loss: 0.8245, test_loss: 0.9001, test_f1: 0.5428
 epoch: 19, train_loss: 0.8332, test_loss: 0.8378, test_f1: 0.6201
 epoch: 20, train_loss: 0.8290, test_loss: 0.8684, test_f1: 0.6017
 epoch: 21, train_loss: 0.8150, test_loss: 0.7977, test_f1: 0.5754
 epoch: 22, train_loss: 0.8141, test_loss: 0.8304, test_f1: 0.6245
 epoch: 23, train_loss: 0.8188, test_loss: 0.8337, test_f1: 0.5877
 epoch: 24, train_loss: 0.8005, test_loss: 0.8447, test_f1: 0.5755
 epoch: 25, train_loss: 0.7950, test_loss: 0.8839, test_f1: 0.6330
 epoch: 26, train_loss: 0.7910, test_loss: 0.9274, test_f1: 0.6409
 epoch: 27, train_loss: 0.7586, test_loss: 1.0739, test_f1: 0.5595
 epoch: 28, train_loss: 0.7824, test_loss: 0.8612, test_f1: 0.6285
 epoch: 29, train_loss: 0.7655, test_loss: 0.9824, test_f1: 0.6520
 epoch: 30, train_loss: 0.7669, test_loss: 0.9019, test_f1: 0.5842
 epoch: 31, train_loss: 0.7635, test_loss: 0.9148, test_f1: 0.6313
 epoch: 32, train_loss: 0.7386, test_loss: 1.0219, test_f1: 0.6052
 epoch: 33, train_loss: 0.7585, test_loss: 0.9260, test_f1: 0.6085
 epoch: 34, train_loss: 0.7305, test_loss: 1.0835, test_f1: 0.6244
 epoch: 35, train_loss: 0.7286, test_loss: 1.0719, test_f1: 0.6363
 epoch: 36, train_loss: 0.7164, test_loss: 0.9393, test_f1: 0.6440
 epoch: 37, train_loss: 0.7198, test_loss: 0.9783, test_f1: 0.6027
 epoch: 38, train_loss: 0.7153, test_loss: 1.0318, test_f1: 0.5765
 epoch: 39, train_loss: 0.7148, test_loss: 1.1370, test_f1: 0.6048
 epoch: 40, train_loss: 0.7090, test_loss: 0.9278, test_f1: 0.6165
 epoch: 41, train_loss: 0.7131, test_loss: 1.0707, test_f1: 0.5831
 epoch: 42, train_loss: 0.7096, test_loss: 0.8829, test_f1: 0.6573
 epoch: 43, train_loss: 0.7225, test_loss: 0.9254, test_f1: 0.6481
 epoch: 44, train_loss: 0.6937, test_loss: 0.9546, test_f1: 0.6337
 epoch: 45, train_loss: 0.7054, test_loss: 0.9982, test_f1: 0.5854
 epoch: 46, train_loss: 0.6836, test_loss: 0.9566, test_f1: 0.5819
 epoch: 47, train_loss: 0.6781, test_loss: 1.0986, test_f1: 0.6514
 epoch: 48, train_loss: 0.7540, test_loss: 0.8506, test_f1: 0.6122
 epoch: 49, train_loss: 0.7209, test_loss: 0.8321, test_f1: 0.6615
 epoch: 50, train_loss: 0.6963, test_loss: 0.8190, test_f1: 0.6136
 epoch: 51, train_loss: 0.6586, test_loss: 0.9468, test_f1: 0.6464
 epoch: 52, train_loss: 0.6482, test_loss: 0.8735, test_f1: 0.6303
 epoch: 53, train_loss: 0.6371, test_loss: 0.8799, test_f1: 0.6412
 epoch: 54, train_loss: 0.6464, test_loss: 0.9393, test_f1: 0.6567
 epoch: 55, train_loss: 0.6194, test_loss: 0.9491, test_f1: 0.6360
 epoch: 56, train_loss: 0.6268, test_loss: 0.9214, test_f1: 0.6373
 epoch: 57, train_loss: 0.6136, test_loss: 0.9331, test_f1: 0.6360
 epoch: 58, train_loss: 0.6026, test_loss: 0.9270, test_f1: 0.6328
 epoch: 59, train_loss: 0.6095, test_loss: 0.9844, test_f1: 0.6406
 epoch: 60, train_loss: 0.6016, test_loss: 1.0443, test_f1: 0.6833
 epoch: 61, train_loss: 0.6027, test_loss: 0.8625, test_f1: 0.6609
 epoch: 62, train_loss: 0.6105, test_loss: 0.9795, test_f1: 0.6578
 epoch: 63, train_loss: 0.6060, test_loss: 0.9017, test_f1: 0.6617
 epoch: 64, train_loss: 0.5981, test_loss: 0.8803, test_f1: 0.6541
 epoch: 65, train_loss: 0.5861, test_loss: 0.9491, test_f1: 0.6477
 epoch: 66, train_loss: 0.5872, test_loss: 1.0229, test_f1: 0.6709
 epoch: 67, train_loss: 0.5683, test_loss: 0.9070, test_f1: 0.6587
 epoch: 68, train_loss: 0.5810, test_loss: 0.9908, test_f1: 0.6528
 epoch: 69, train_loss: 0.5802, test_loss: 0.9315, test_f1: 0.6667
 epoch: 70, train_loss: 0.5598, test_loss: 1.0707, test_f1: 0.6438
 epoch: 71, train_loss: 0.5762, test_loss: 1.0302, test_f1: 0.6217
 epoch: 72, train_loss: 0.5921, test_loss: 0.9809, test_f1: 0.6581
 epoch: 73, train_loss: 0.5564, test_loss: 1.1137, test_f1: 0.6525
 epoch: 74, train_loss: 0.5547, test_loss: 1.0806, test_f1: 0.6474
 epoch: 75, train_loss: 0.5682, test_loss: 1.1738, test_f1: 0.6568
 epoch: 76, train_loss: 0.5831, test_loss: 1.2012, test_f1: 0.6530
 epoch: 77, train_loss: 0.5642, test_loss: 1.2550, test_f1: 0.6374
 epoch: 78, train_loss: 0.5653, test_loss: 1.1783, test_f1: 0.6829
 epoch: 79, train_loss: 0.5623, test_loss: 1.3544, test_f1: 0.6355
 epoch: 80, train_loss: 0.5538, test_loss: 1.2007, test_f1: 0.6668
 epoch: 81, train_loss: 0.5401, test_loss: 1.2038, test_f1: 0.6822
 epoch: 82, train_loss: 0.5356, test_loss: 1.1757, test_f1: 0.6723
 epoch: 83, train_loss: 0.5490, test_loss: 1.2041, test_f1: 0.6620
 epoch: 84, train_loss: 0.5363, test_loss: 1.2126, test_f1: 0.6950
 epoch: 85, train_loss: 0.5308, test_loss: 0.9474, test_f1: 0.6880
 epoch: 86, train_loss: 0.5449, test_loss: 1.3854, test_f1: 0.6561
 epoch: 87, train_loss: 0.5461, test_loss: 1.2083, test_f1: 0.6695
 epoch: 88, train_loss: 0.5361, test_loss: 1.1352, test_f1: 0.6617
 epoch: 89, train_loss: 0.5267, test_loss: 1.2283, test_f1: 0.6647
 epoch: 90, train_loss: 0.5296, test_loss: 1.2587, test_f1: 0.6496
 epoch: 91, train_loss: 0.5307, test_loss: 1.3309, test_f1: 0.6673
 epoch: 92, train_loss: 0.5196, test_loss: 1.4927, test_f1: 0.6635
 epoch: 93, train_loss: 0.5050, test_loss: 1.2106, test_f1: 0.6716
 epoch: 94, train_loss: 0.5275, test_loss: 1.1622, test_f1: 0.6791
 epoch: 95, train_loss: 0.5045, test_loss: 1.3154, test_f1: 0.6629
 epoch: 96, train_loss: 0.5244, test_loss: 1.0764, test_f1: 0.6687
 epoch: 97, train_loss: 0.5397, test_loss: 1.1134, test_f1: 0.6535
 epoch: 98, train_loss: 0.5216, test_loss: 1.2211, test_f1: 0.6922
 epoch: 99, train_loss: 0.5160, test_loss: 1.2710, test_f1: 0.6747
##################ITERATION #2 ****************************************
 epoch: 0, train_loss: 1.1330, test_loss: 0.9985, test_f1: 0.4630
 epoch: 1, train_loss: 1.0274, test_loss: 1.0578, test_f1: 0.3970
 epoch: 2, train_loss: 0.9887, test_loss: 1.0176, test_f1: 0.4990
 epoch: 3, train_loss: 0.9777, test_loss: 0.9915, test_f1: 0.4929
 epoch: 4, train_loss: 0.9573, test_loss: 1.0615, test_f1: 0.4486
 epoch: 5, train_loss: 0.9633, test_loss: 0.9823, test_f1: 0.5219
 epoch: 6, train_loss: 0.9537, test_loss: 0.9479, test_f1: 0.4929
 epoch: 7, train_loss: 0.9194, test_loss: 0.8878, test_f1: 0.5348
 epoch: 8, train_loss: 0.9180, test_loss: 0.9744, test_f1: 0.5361
 epoch: 9, train_loss: 0.9053, test_loss: 0.9839, test_f1: 0.5538
 epoch: 10, train_loss: 0.8860, test_loss: 0.9731, test_f1: 0.5075
 epoch: 11, train_loss: 0.8846, test_loss: 0.9000, test_f1: 0.5529
 epoch: 12, train_loss: 0.8670, test_loss: 0.9182, test_f1: 0.5534
 epoch: 13, train_loss: 0.8518, test_loss: 0.8169, test_f1: 0.5474
 epoch: 14, train_loss: 0.8429, test_loss: 0.8403, test_f1: 0.5763
 epoch: 15, train_loss: 0.8287, test_loss: 0.8763, test_f1: 0.5643
 epoch: 16, train_loss: 0.8327, test_loss: 0.9183, test_f1: 0.5337
 epoch: 17, train_loss: 0.8081, test_loss: 0.8890, test_f1: 0.5511
 epoch: 18, train_loss: 0.8263, test_loss: 0.8147, test_f1: 0.6190
 epoch: 19, train_loss: 0.8100, test_loss: 0.9685, test_f1: 0.5654
 epoch: 20, train_loss: 0.7741, test_loss: 1.0394, test_f1: 0.4201
 epoch: 21, train_loss: 0.7993, test_loss: 0.8726, test_f1: 0.6062
 epoch: 22, train_loss: 0.7779, test_loss: 0.8232, test_f1: 0.6273
 epoch: 23, train_loss: 0.7845, test_loss: 0.9754, test_f1: 0.5532
 epoch: 24, train_loss: 0.8071, test_loss: 0.9807, test_f1: 0.5594
 epoch: 25, train_loss: 0.7621, test_loss: 0.8188, test_f1: 0.5863
 epoch: 26, train_loss: 0.7980, test_loss: 0.8527, test_f1: 0.6025
 epoch: 27, train_loss: 0.7803, test_loss: 0.8084, test_f1: 0.6457
 epoch: 28, train_loss: 0.7761, test_loss: 0.8269, test_f1: 0.6369
 epoch: 29, train_loss: 0.7465, test_loss: 0.8552, test_f1: 0.5946
 epoch: 30, train_loss: 0.7514, test_loss: 0.7728, test_f1: 0.6532
 epoch: 31, train_loss: 0.7521, test_loss: 0.8656, test_f1: 0.6292
 epoch: 32, train_loss: 0.7375, test_loss: 0.8651, test_f1: 0.6118
 epoch: 33, train_loss: 0.7470, test_loss: 0.8213, test_f1: 0.6087
 epoch: 34, train_loss: 0.7353, test_loss: 0.7896, test_f1: 0.6727
 epoch: 35, train_loss: 0.7334, test_loss: 1.0673, test_f1: 0.5624
 epoch: 36, train_loss: 0.7370, test_loss: 0.8182, test_f1: 0.6190
 epoch: 37, train_loss: 0.7099, test_loss: 0.7595, test_f1: 0.6688
 epoch: 38, train_loss: 0.7168, test_loss: 0.8169, test_f1: 0.6022
 epoch: 39, train_loss: 0.7071, test_loss: 0.7550, test_f1: 0.6526
 epoch: 40, train_loss: 0.7175, test_loss: 0.8349, test_f1: 0.6137
 epoch: 41, train_loss: 0.6904, test_loss: 0.9034, test_f1: 0.6389
 epoch: 42, train_loss: 0.6976, test_loss: 0.8111, test_f1: 0.6177
 epoch: 43, train_loss: 0.6923, test_loss: 0.8256, test_f1: 0.6324
 epoch: 44, train_loss: 0.7013, test_loss: 0.7583, test_f1: 0.6775
 epoch: 45, train_loss: 0.7125, test_loss: 0.8093, test_f1: 0.6590
 epoch: 46, train_loss: 0.6873, test_loss: 0.7419, test_f1: 0.6539
 epoch: 47, train_loss: 0.6912, test_loss: 0.8446, test_f1: 0.6551
 epoch: 48, train_loss: 0.6671, test_loss: 0.8216, test_f1: 0.6415
 epoch: 49, train_loss: 0.6654, test_loss: 0.8672, test_f1: 0.6366
 epoch: 50, train_loss: 0.6782, test_loss: 0.7667, test_f1: 0.6550
 epoch: 51, train_loss: 0.6471, test_loss: 0.8034, test_f1: 0.6554
 epoch: 52, train_loss: 0.6214, test_loss: 0.8320, test_f1: 0.6537
 epoch: 53, train_loss: 0.6045, test_loss: 0.7653, test_f1: 0.6681
 epoch: 54, train_loss: 0.5974, test_loss: 0.7321, test_f1: 0.6653
 epoch: 55, train_loss: 0.6149, test_loss: 0.7487, test_f1: 0.6819
 epoch: 56, train_loss: 0.5937, test_loss: 0.7653, test_f1: 0.6520
 epoch: 57, train_loss: 0.5904, test_loss: 0.7583, test_f1: 0.6561
 epoch: 58, train_loss: 0.6037, test_loss: 0.7430, test_f1: 0.6520
 epoch: 59, train_loss: 0.6043, test_loss: 0.7402, test_f1: 0.6539
 epoch: 60, train_loss: 0.5902, test_loss: 0.8160, test_f1: 0.6681
 epoch: 61, train_loss: 0.6113, test_loss: 0.9311, test_f1: 0.6406
 epoch: 62, train_loss: 0.5792, test_loss: 0.7294, test_f1: 0.6634
 epoch: 63, train_loss: 0.5644, test_loss: 0.8087, test_f1: 0.6291
 epoch: 64, train_loss: 0.5741, test_loss: 0.7961, test_f1: 0.6642
 epoch: 65, train_loss: 0.5810, test_loss: 0.8844, test_f1: 0.6493
 epoch: 66, train_loss: 0.5622, test_loss: 0.8040, test_f1: 0.6568
 epoch: 67, train_loss: 0.5599, test_loss: 0.7360, test_f1: 0.6646
 epoch: 68, train_loss: 0.5620, test_loss: 0.8287, test_f1: 0.6410
 epoch: 69, train_loss: 0.5720, test_loss: 0.8721, test_f1: 0.6374
 epoch: 70, train_loss: 0.5528, test_loss: 0.7789, test_f1: 0.6603
 epoch: 71, train_loss: 0.5727, test_loss: 0.8538, test_f1: 0.6527
 epoch: 72, train_loss: 0.5503, test_loss: 0.7354, test_f1: 0.6624
 epoch: 73, train_loss: 0.5468, test_loss: 0.8017, test_f1: 0.6581
 epoch: 74, train_loss: 0.5543, test_loss: 0.7718, test_f1: 0.6790
 epoch: 75, train_loss: 0.5424, test_loss: 0.7988, test_f1: 0.6498
 epoch: 76, train_loss: 0.5273, test_loss: 0.8013, test_f1: 0.6719
 epoch: 77, train_loss: 0.5403, test_loss: 0.8298, test_f1: 0.6531
 epoch: 78, train_loss: 0.5347, test_loss: 0.8733, test_f1: 0.6757
 epoch: 79, train_loss: 0.5014, test_loss: 0.8086, test_f1: 0.6640
 epoch: 80, train_loss: 0.5208, test_loss: 0.7834, test_f1: 0.6573
 epoch: 81, train_loss: 0.5402, test_loss: 0.8259, test_f1: 0.6509
 epoch: 82, train_loss: 0.5215, test_loss: 0.7576, test_f1: 0.6560
 epoch: 83, train_loss: 0.5113, test_loss: 0.8213, test_f1: 0.6625
 epoch: 84, train_loss: 0.5297, test_loss: 0.7851, test_f1: 0.6521
 epoch: 85, train_loss: 0.5246, test_loss: 0.7806, test_f1: 0.6760
 epoch: 86, train_loss: 0.5107, test_loss: 0.7759, test_f1: 0.6647
 epoch: 87, train_loss: 0.4999, test_loss: 0.8377, test_f1: 0.6878
 epoch: 88, train_loss: 0.5170, test_loss: 0.9314, test_f1: 0.6648
 epoch: 89, train_loss: 0.5113, test_loss: 0.8826, test_f1: 0.6662
 epoch: 90, train_loss: 0.5119, test_loss: 0.7843, test_f1: 0.6763
 epoch: 91, train_loss: 0.5000, test_loss: 0.8713, test_f1: 0.6753
 epoch: 92, train_loss: 0.5105, test_loss: 0.7205, test_f1: 0.6750
 epoch: 93, train_loss: 0.5268, test_loss: 0.8023, test_f1: 0.6690
 epoch: 94, train_loss: 0.4927, test_loss: 0.7802, test_f1: 0.6829
 epoch: 95, train_loss: 0.4969, test_loss: 0.7950, test_f1: 0.6566
 epoch: 96, train_loss: 0.4907, test_loss: 0.8333, test_f1: 0.6814
 epoch: 97, train_loss: 0.4888, test_loss: 0.7638, test_f1: 0.6649
 epoch: 98, train_loss: 0.4870, test_loss: 0.9103, test_f1: 0.6781
 epoch: 99, train_loss: 0.4905, test_loss: 0.7512, test_f1: 0.6847
##################ITERATION #3 ****************************************
 epoch: 0, train_loss: 1.1207, test_loss: 1.1630, test_f1: 0.3672
 epoch: 1, train_loss: 1.0298, test_loss: 1.0941, test_f1: 0.4835
 epoch: 2, train_loss: 1.0206, test_loss: 1.0213, test_f1: 0.4758
 epoch: 3, train_loss: 0.9862, test_loss: 1.0014, test_f1: 0.4773
 epoch: 4, train_loss: 0.9843, test_loss: 1.0036, test_f1: 0.4814
 epoch: 5, train_loss: 0.9639, test_loss: 0.9449, test_f1: 0.4760
 epoch: 6, train_loss: 0.9436, test_loss: 0.9953, test_f1: 0.4335
 epoch: 7, train_loss: 0.9467, test_loss: 0.9163, test_f1: 0.5088
 epoch: 8, train_loss: 0.9298, test_loss: 1.0018, test_f1: 0.5688
 epoch: 9, train_loss: 0.9168, test_loss: 0.9735, test_f1: 0.5066
 epoch: 10, train_loss: 0.9041, test_loss: 0.9073, test_f1: 0.5483
 epoch: 11, train_loss: 0.8857, test_loss: 0.9045, test_f1: 0.4898
 epoch: 12, train_loss: 0.8655, test_loss: 0.9688, test_f1: 0.5168
 epoch: 13, train_loss: 0.8752, test_loss: 0.9035, test_f1: 0.5390
 epoch: 14, train_loss: 0.8597, test_loss: 0.9556, test_f1: 0.4510
 epoch: 15, train_loss: 0.8533, test_loss: 0.9265, test_f1: 0.5277
 epoch: 16, train_loss: 0.8546, test_loss: 0.8416, test_f1: 0.5278
 epoch: 17, train_loss: 0.8367, test_loss: 0.8678, test_f1: 0.5600
 epoch: 18, train_loss: 0.8369, test_loss: 0.8651, test_f1: 0.5109
 epoch: 19, train_loss: 0.8183, test_loss: 0.8164, test_f1: 0.5716
 epoch: 20, train_loss: 0.8331, test_loss: 0.9003, test_f1: 0.5449
 epoch: 21, train_loss: 0.8088, test_loss: 0.8116, test_f1: 0.5970
 epoch: 22, train_loss: 0.8120, test_loss: 0.9130, test_f1: 0.5180
 epoch: 23, train_loss: 0.7982, test_loss: 0.8015, test_f1: 0.5609
 epoch: 24, train_loss: 0.7874, test_loss: 0.8148, test_f1: 0.5875
 epoch: 25, train_loss: 0.7845, test_loss: 0.8353, test_f1: 0.5782
 epoch: 26, train_loss: 0.8430, test_loss: 0.8586, test_f1: 0.5318
 epoch: 27, train_loss: 0.8339, test_loss: 0.7965, test_f1: 0.5431
 epoch: 28, train_loss: 0.8107, test_loss: 0.8035, test_f1: 0.5417
 epoch: 29, train_loss: 0.7975, test_loss: 1.3940, test_f1: 0.5304
 epoch: 30, train_loss: 0.8025, test_loss: 0.8042, test_f1: 0.5427
 epoch: 31, train_loss: 0.7853, test_loss: 0.7965, test_f1: 0.5837
 epoch: 32, train_loss: 0.7801, test_loss: 0.8228, test_f1: 0.5623
 epoch: 33, train_loss: 0.7733, test_loss: 0.8150, test_f1: 0.5966
 epoch: 34, train_loss: 0.7706, test_loss: 0.8692, test_f1: 0.5695
 epoch: 35, train_loss: 0.7650, test_loss: 0.7744, test_f1: 0.5518
 epoch: 36, train_loss: 0.7556, test_loss: 0.8303, test_f1: 0.6194
 epoch: 37, train_loss: 0.7480, test_loss: 0.7589, test_f1: 0.5967
 epoch: 38, train_loss: 0.7629, test_loss: 0.8118, test_f1: 0.5793
 epoch: 39, train_loss: 0.7539, test_loss: 0.7698, test_f1: 0.5729
 epoch: 40, train_loss: 0.7599, test_loss: 0.7812, test_f1: 0.5673
 epoch: 41, train_loss: 0.7477, test_loss: 0.8239, test_f1: 0.5788
 epoch: 42, train_loss: 0.7352, test_loss: 0.8542, test_f1: 0.5720
 epoch: 43, train_loss: 0.7309, test_loss: 0.7592, test_f1: 0.6133
 epoch: 44, train_loss: 0.7482, test_loss: 0.7408, test_f1: 0.6465
 epoch: 45, train_loss: 0.7315, test_loss: 0.7603, test_f1: 0.6012
 epoch: 46, train_loss: 0.7439, test_loss: 0.7548, test_f1: 0.6372
 epoch: 47, train_loss: 0.7169, test_loss: 0.7689, test_f1: 0.5898
 epoch: 48, train_loss: 0.7289, test_loss: 0.8149, test_f1: 0.6491
 epoch: 49, train_loss: 0.7137, test_loss: 0.8880, test_f1: 0.6345
 epoch: 50, train_loss: 0.7112, test_loss: 0.7629, test_f1: 0.6396
 epoch: 51, train_loss: 0.6885, test_loss: 0.7478, test_f1: 0.6224
 epoch: 52, train_loss: 0.6670, test_loss: 0.7496, test_f1: 0.6523
 epoch: 53, train_loss: 0.6643, test_loss: 0.8172, test_f1: 0.6219
 epoch: 54, train_loss: 0.6540, test_loss: 0.7748, test_f1: 0.6329
 epoch: 55, train_loss: 0.6519, test_loss: 0.8000, test_f1: 0.6309
 epoch: 56, train_loss: 0.6695, test_loss: 0.8933, test_f1: 0.6526
 epoch: 57, train_loss: 0.6516, test_loss: 0.8158, test_f1: 0.6680
 epoch: 58, train_loss: 0.6525, test_loss: 0.7533, test_f1: 0.6740
 epoch: 59, train_loss: 0.6499, test_loss: 0.8542, test_f1: 0.6580
 epoch: 60, train_loss: 0.6172, test_loss: 0.8238, test_f1: 0.6345
 epoch: 61, train_loss: 0.6456, test_loss: 0.9634, test_f1: 0.6662
 epoch: 62, train_loss: 0.6382, test_loss: 0.9280, test_f1: 0.6434
 epoch: 63, train_loss: 0.6338, test_loss: 0.9361, test_f1: 0.6377
 epoch: 64, train_loss: 0.6293, test_loss: 0.9567, test_f1: 0.6521
 epoch: 65, train_loss: 0.6374, test_loss: 0.9052, test_f1: 0.6379
 epoch: 66, train_loss: 0.6259, test_loss: 0.8596, test_f1: 0.6664
 epoch: 67, train_loss: 0.6232, test_loss: 0.9609, test_f1: 0.6380
 epoch: 68, train_loss: 0.6169, test_loss: 0.9566, test_f1: 0.6758
 epoch: 69, train_loss: 0.6240, test_loss: 0.8409, test_f1: 0.6473
 epoch: 70, train_loss: 0.6201, test_loss: 0.9546, test_f1: 0.6421
 epoch: 71, train_loss: 0.6085, test_loss: 1.0316, test_f1: 0.6529
 epoch: 72, train_loss: 0.5999, test_loss: 1.1375, test_f1: 0.6704
 epoch: 73, train_loss: 0.6292, test_loss: 1.0148, test_f1: 0.6811
 epoch: 74, train_loss: 0.6184, test_loss: 0.8368, test_f1: 0.6879
 epoch: 75, train_loss: 0.6133, test_loss: 0.9349, test_f1: 0.6589
 epoch: 76, train_loss: 0.5985, test_loss: 0.9938, test_f1: 0.6798
 epoch: 77, train_loss: 0.6106, test_loss: 1.0941, test_f1: 0.6995
 epoch: 78, train_loss: 0.6100, test_loss: 1.0342, test_f1: 0.6825
 epoch: 79, train_loss: 0.6046, test_loss: 1.1023, test_f1: 0.6605
 epoch: 80, train_loss: 0.5912, test_loss: 1.0795, test_f1: 0.6859
 epoch: 81, train_loss: 0.6012, test_loss: 0.9135, test_f1: 0.6688
 epoch: 82, train_loss: 0.5840, test_loss: 1.1152, test_f1: 0.6260
 epoch: 83, train_loss: 0.6031, test_loss: 0.9483, test_f1: 0.6314
 epoch: 84, train_loss: 0.6061, test_loss: 0.9633, test_f1: 0.6736
 epoch: 85, train_loss: 0.5764, test_loss: 0.9947, test_f1: 0.6827
 epoch: 86, train_loss: 0.5985, test_loss: 1.1255, test_f1: 0.6327
 epoch: 87, train_loss: 0.5983, test_loss: 1.1670, test_f1: 0.6804
 epoch: 88, train_loss: 0.5848, test_loss: 1.1031, test_f1: 0.6650
 epoch: 89, train_loss: 0.5800, test_loss: 1.0343, test_f1: 0.6599
 epoch: 90, train_loss: 0.5539, test_loss: 1.1819, test_f1: 0.6701
 epoch: 91, train_loss: 0.5901, test_loss: 0.8613, test_f1: 0.6622
 epoch: 92, train_loss: 0.5825, test_loss: 1.2418, test_f1: 0.6858
 epoch: 93, train_loss: 0.5669, test_loss: 1.2334, test_f1: 0.6970
 epoch: 94, train_loss: 0.5862, test_loss: 1.2983, test_f1: 0.6790
 epoch: 95, train_loss: 0.5604, test_loss: 0.7946, test_f1: 0.6780
 epoch: 96, train_loss: 0.5662, test_loss: 0.9353, test_f1: 0.6684
 epoch: 97, train_loss: 0.5744, test_loss: 0.9894, test_f1: 0.6809
 epoch: 98, train_loss: 0.5524, test_loss: 1.0452, test_f1: 0.6662
 epoch: 99, train_loss: 0.5630, test_loss: 1.1058, test_f1: 0.6196
##################ITERATION #4 ****************************************
 epoch: 0, train_loss: 1.1449, test_loss: 1.2112, test_f1: 0.3668
 epoch: 1, train_loss: 1.0644, test_loss: 1.1131, test_f1: 0.4135
 epoch: 2, train_loss: 1.0046, test_loss: 1.0316, test_f1: 0.4015
 epoch: 3, train_loss: 0.9829, test_loss: 1.0976, test_f1: 0.4453
 epoch: 4, train_loss: 0.9735, test_loss: 0.9708, test_f1: 0.4842
 epoch: 5, train_loss: 0.9498, test_loss: 0.9675, test_f1: 0.4843
 epoch: 6, train_loss: 0.9389, test_loss: 1.0523, test_f1: 0.5084
 epoch: 7, train_loss: 0.9361, test_loss: 0.9344, test_f1: 0.4794
 epoch: 8, train_loss: 0.9099, test_loss: 0.9726, test_f1: 0.4709
 epoch: 9, train_loss: 0.8999, test_loss: 0.9154, test_f1: 0.4970
 epoch: 10, train_loss: 0.8992, test_loss: 0.9831, test_f1: 0.5515
 epoch: 11, train_loss: 0.8966, test_loss: 0.8720, test_f1: 0.5458
 epoch: 12, train_loss: 0.8805, test_loss: 0.8628, test_f1: 0.5737
 epoch: 13, train_loss: 0.8734, test_loss: 0.8920, test_f1: 0.5722
 epoch: 14, train_loss: 0.9265, test_loss: 1.0189, test_f1: 0.5480
 epoch: 15, train_loss: 0.8938, test_loss: 0.8762, test_f1: 0.5767
 epoch: 16, train_loss: 0.8834, test_loss: 0.8542, test_f1: 0.5385
 epoch: 17, train_loss: 0.8685, test_loss: 0.9918, test_f1: 0.5780
 epoch: 18, train_loss: 0.8790, test_loss: 0.9322, test_f1: 0.5511
 epoch: 19, train_loss: 0.8552, test_loss: 0.9567, test_f1: 0.6066
 epoch: 20, train_loss: 0.8533, test_loss: 0.8919, test_f1: 0.5394
 epoch: 21, train_loss: 0.8466, test_loss: 0.9996, test_f1: 0.5380
 epoch: 22, train_loss: 0.8425, test_loss: 0.8576, test_f1: 0.5583
 epoch: 23, train_loss: 0.8434, test_loss: 0.8962, test_f1: 0.5484
 epoch: 24, train_loss: 0.8375, test_loss: 0.9307, test_f1: 0.5623
 epoch: 25, train_loss: 0.8361, test_loss: 0.9482, test_f1: 0.5157
 epoch: 26, train_loss: 0.8281, test_loss: 0.8817, test_f1: 0.5880
 epoch: 27, train_loss: 0.8566, test_loss: 0.9173, test_f1: 0.6103
 epoch: 28, train_loss: 0.8234, test_loss: 0.9408, test_f1: 0.5365
 epoch: 29, train_loss: 0.8126, test_loss: 1.0484, test_f1: 0.5494
 epoch: 30, train_loss: 0.7987, test_loss: 0.9678, test_f1: 0.5902
 epoch: 31, train_loss: 0.7951, test_loss: 0.9768, test_f1: 0.5292
 epoch: 32, train_loss: 0.8069, test_loss: 0.8954, test_f1: 0.6046
 epoch: 33, train_loss: 0.8013, test_loss: 0.8777, test_f1: 0.5581
 epoch: 34, train_loss: 0.7845, test_loss: 0.8205, test_f1: 0.6177
 epoch: 35, train_loss: 0.8037, test_loss: 0.9265, test_f1: 0.5708
 epoch: 36, train_loss: 0.8007, test_loss: 0.7891, test_f1: 0.5964
 epoch: 37, train_loss: 0.7828, test_loss: 1.0026, test_f1: 0.6215
 epoch: 38, train_loss: 0.7823, test_loss: 0.8463, test_f1: 0.6305
 epoch: 39, train_loss: 0.7779, test_loss: 0.8425, test_f1: 0.6243
 epoch: 40, train_loss: 0.7686, test_loss: 0.8478, test_f1: 0.6029
 epoch: 41, train_loss: 0.7842, test_loss: 0.8024, test_f1: 0.6071
 epoch: 42, train_loss: 0.7584, test_loss: 0.8766, test_f1: 0.5778
 epoch: 43, train_loss: 0.7567, test_loss: 0.9092, test_f1: 0.5811
 epoch: 44, train_loss: 0.7515, test_loss: 0.8568, test_f1: 0.5863
 epoch: 45, train_loss: 0.7669, test_loss: 0.8030, test_f1: 0.6426
 epoch: 46, train_loss: 0.7586, test_loss: 0.9624, test_f1: 0.6321
 epoch: 47, train_loss: 0.8042, test_loss: 0.8914, test_f1: 0.5897
 epoch: 48, train_loss: 0.7544, test_loss: 0.8946, test_f1: 0.6186
 epoch: 49, train_loss: 0.7766, test_loss: 0.8486, test_f1: 0.6109
 epoch: 50, train_loss: 0.7595, test_loss: 0.9418, test_f1: 0.6429
 epoch: 51, train_loss: 0.7043, test_loss: 0.8758, test_f1: 0.6107
 epoch: 52, train_loss: 0.7143, test_loss: 0.8925, test_f1: 0.6315
 epoch: 53, train_loss: 0.7149, test_loss: 0.9115, test_f1: 0.6320
 epoch: 54, train_loss: 0.6903, test_loss: 0.9204, test_f1: 0.6607
 epoch: 55, train_loss: 0.6827, test_loss: 0.9673, test_f1: 0.6681
 epoch: 56, train_loss: 0.6972, test_loss: 0.9461, test_f1: 0.6614
 epoch: 57, train_loss: 0.6718, test_loss: 0.9782, test_f1: 0.6319
 epoch: 58, train_loss: 0.6818, test_loss: 1.0200, test_f1: 0.6458
 epoch: 59, train_loss: 0.6773, test_loss: 0.9062, test_f1: 0.6450
 epoch: 60, train_loss: 0.6685, test_loss: 0.9273, test_f1: 0.6540
 epoch: 61, train_loss: 0.6656, test_loss: 0.9115, test_f1: 0.6618
 epoch: 62, train_loss: 0.6892, test_loss: 0.9480, test_f1: 0.6504
 epoch: 63, train_loss: 0.6603, test_loss: 0.9858, test_f1: 0.6305
 epoch: 64, train_loss: 0.6821, test_loss: 0.8520, test_f1: 0.6614
 epoch: 65, train_loss: 0.6798, test_loss: 0.9175, test_f1: 0.6829
 epoch: 66, train_loss: 0.6671, test_loss: 0.9077, test_f1: 0.6272
 epoch: 67, train_loss: 0.6658, test_loss: 0.8976, test_f1: 0.6328
 epoch: 68, train_loss: 0.6559, test_loss: 0.8940, test_f1: 0.6622
 epoch: 69, train_loss: 0.6563, test_loss: 0.9232, test_f1: 0.6575
 epoch: 70, train_loss: 0.6327, test_loss: 0.8491, test_f1: 0.6448
 epoch: 71, train_loss: 0.6322, test_loss: 0.9567, test_f1: 0.6604
 epoch: 72, train_loss: 0.6443, test_loss: 0.8984, test_f1: 0.6541
 epoch: 73, train_loss: 0.6467, test_loss: 0.9093, test_f1: 0.6557
 epoch: 74, train_loss: 0.6378, test_loss: 0.9701, test_f1: 0.5815
 epoch: 75, train_loss: 0.6319, test_loss: 0.9330, test_f1: 0.6714
 epoch: 76, train_loss: 0.6272, test_loss: 0.8553, test_f1: 0.6668
 epoch: 77, train_loss: 0.6345, test_loss: 0.8493, test_f1: 0.6428
 epoch: 78, train_loss: 0.6414, test_loss: 0.8793, test_f1: 0.6532
 epoch: 79, train_loss: 0.6187, test_loss: 0.9616, test_f1: 0.6565
 epoch: 80, train_loss: 0.6159, test_loss: 0.9687, test_f1: 0.6817
 epoch: 81, train_loss: 0.6264, test_loss: 0.8877, test_f1: 0.6679
 epoch: 82, train_loss: 0.6231, test_loss: 1.0255, test_f1: 0.6341
 epoch: 83, train_loss: 0.6190, test_loss: 0.9168, test_f1: 0.6721
 epoch: 84, train_loss: 0.5951, test_loss: 0.9550, test_f1: 0.7033
 epoch: 85, train_loss: 0.6085, test_loss: 0.9971, test_f1: 0.6638
 epoch: 86, train_loss: 0.6113, test_loss: 0.8816, test_f1: 0.6522
 epoch: 87, train_loss: 0.6171, test_loss: 0.8681, test_f1: 0.6453
 epoch: 88, train_loss: 0.6086, test_loss: 0.8826, test_f1: 0.6565
 epoch: 89, train_loss: 0.5912, test_loss: 0.8528, test_f1: 0.6654
 epoch: 90, train_loss: 0.5972, test_loss: 1.0664, test_f1: 0.6738
 epoch: 91, train_loss: 0.5962, test_loss: 1.0491, test_f1: 0.6733
 epoch: 92, train_loss: 0.5980, test_loss: 0.8667, test_f1: 0.6666
 epoch: 93, train_loss: 0.6112, test_loss: 1.1074, test_f1: 0.6394
 epoch: 94, train_loss: 0.6179, test_loss: 1.0276, test_f1: 0.6641
 epoch: 95, train_loss: 0.6005, test_loss: 1.1230, test_f1: 0.6555
 epoch: 96, train_loss: 0.5862, test_loss: 1.1206, test_f1: 0.6651
 epoch: 97, train_loss: 0.6156, test_loss: 1.1348, test_f1: 0.6539
 epoch: 98, train_loss: 0.5822, test_loss: 1.1105, test_f1: 0.6727
 epoch: 99, train_loss: 0.5799, test_loss: 1.1363, test_f1: 0.6741
##################ITERATION #5 ****************************************
 epoch: 0, train_loss: 1.0851, test_loss: 1.2047, test_f1: 0.3953
 epoch: 1, train_loss: 0.9924, test_loss: 1.0341, test_f1: 0.4456
 epoch: 2, train_loss: 0.9801, test_loss: 1.0728, test_f1: 0.4424
 epoch: 3, train_loss: 0.9444, test_loss: 0.9506, test_f1: 0.4966
 epoch: 4, train_loss: 0.9389, test_loss: 1.0188, test_f1: 0.4816
 epoch: 5, train_loss: 0.9255, test_loss: 0.9455, test_f1: 0.5333
 epoch: 6, train_loss: 0.9120, test_loss: 0.9503, test_f1: 0.5188
 epoch: 7, train_loss: 0.9101, test_loss: 1.0203, test_f1: 0.5066
 epoch: 8, train_loss: 0.8870, test_loss: 0.9873, test_f1: 0.5085
 epoch: 9, train_loss: 0.8973, test_loss: 1.0144, test_f1: 0.4817
 epoch: 10, train_loss: 0.8791, test_loss: 0.9794, test_f1: 0.5070
 epoch: 11, train_loss: 0.8790, test_loss: 0.9560, test_f1: 0.5587
 epoch: 12, train_loss: 0.8684, test_loss: 1.0366, test_f1: 0.5000
 epoch: 13, train_loss: 0.8629, test_loss: 0.8467, test_f1: 0.5375
 epoch: 14, train_loss: 0.8570, test_loss: 1.0184, test_f1: 0.5516
 epoch: 15, train_loss: 0.8563, test_loss: 0.8506, test_f1: 0.5560
 epoch: 16, train_loss: 0.8583, test_loss: 0.9591, test_f1: 0.5405
 epoch: 17, train_loss: 0.8416, test_loss: 0.9669, test_f1: 0.5307
 epoch: 18, train_loss: 0.8372, test_loss: 0.8980, test_f1: 0.5384
 epoch: 19, train_loss: 0.8539, test_loss: 0.8230, test_f1: 0.5412
 epoch: 20, train_loss: 0.8309, test_loss: 0.8836, test_f1: 0.5806
 epoch: 21, train_loss: 0.8160, test_loss: 0.8955, test_f1: 0.5720
 epoch: 22, train_loss: 0.7945, test_loss: 0.8508, test_f1: 0.6141
 epoch: 23, train_loss: 0.7972, test_loss: 0.9082, test_f1: 0.5636
 epoch: 24, train_loss: 0.8209, test_loss: 0.8653, test_f1: 0.5918
 epoch: 25, train_loss: 0.7953, test_loss: 0.9018, test_f1: 0.5908
 epoch: 26, train_loss: 0.7901, test_loss: 0.9075, test_f1: 0.5683
 epoch: 27, train_loss: 0.7920, test_loss: 0.8495, test_f1: 0.5868
 epoch: 28, train_loss: 0.7866, test_loss: 0.8710, test_f1: 0.6299
 epoch: 29, train_loss: 0.7731, test_loss: 0.9021, test_f1: 0.5925
 epoch: 30, train_loss: 0.7670, test_loss: 0.9523, test_f1: 0.5655
 epoch: 31, train_loss: 0.7537, test_loss: 0.9310, test_f1: 0.6246
 epoch: 32, train_loss: 0.7695, test_loss: 0.9036, test_f1: 0.6261
 epoch: 33, train_loss: 0.7575, test_loss: 0.8441, test_f1: 0.6025
 epoch: 34, train_loss: 0.7588, test_loss: 0.9969, test_f1: 0.5389
 epoch: 35, train_loss: 0.7492, test_loss: 0.8440, test_f1: 0.6045
 epoch: 36, train_loss: 0.7352, test_loss: 0.8135, test_f1: 0.6387
 epoch: 37, train_loss: 0.7272, test_loss: 0.8870, test_f1: 0.6159
 epoch: 38, train_loss: 0.7311, test_loss: 0.8323, test_f1: 0.6153
 epoch: 39, train_loss: 0.7123, test_loss: 0.8512, test_f1: 0.6414
 epoch: 40, train_loss: 0.7588, test_loss: 0.8551, test_f1: 0.6433
 epoch: 41, train_loss: 0.7362, test_loss: 0.8159, test_f1: 0.6116
 epoch: 42, train_loss: 0.7651, test_loss: 1.0365, test_f1: 0.6174
 epoch: 43, train_loss: 0.7377, test_loss: 0.9061, test_f1: 0.5469
 epoch: 44, train_loss: 0.7160, test_loss: 5.1834, test_f1: 0.3344
 epoch: 45, train_loss: 0.7119, test_loss: 0.9881, test_f1: 0.6030
 epoch: 46, train_loss: 0.7004, test_loss: 0.9263, test_f1: 0.6131
 epoch: 47, train_loss: 0.7142, test_loss: 0.8695, test_f1: 0.6518
 epoch: 48, train_loss: 0.6858, test_loss: 0.9208, test_f1: 0.6160
 epoch: 49, train_loss: 0.6840, test_loss: 0.9596, test_f1: 0.6720
 epoch: 50, train_loss: 0.6946, test_loss: 0.8762, test_f1: 0.5957
 epoch: 51, train_loss: 0.6436, test_loss: 0.7940, test_f1: 0.6694
 epoch: 52, train_loss: 0.6380, test_loss: 0.8400, test_f1: 0.6419
 epoch: 53, train_loss: 0.6349, test_loss: 0.8538, test_f1: 0.6632
 epoch: 54, train_loss: 0.6348, test_loss: 0.8796, test_f1: 0.6655
 epoch: 55, train_loss: 0.6326, test_loss: 0.9489, test_f1: 0.6162
 epoch: 56, train_loss: 0.6336, test_loss: 0.9465, test_f1: 0.6596
 epoch: 57, train_loss: 0.6012, test_loss: 0.9113, test_f1: 0.6500
 epoch: 58, train_loss: 0.6062, test_loss: 0.9222, test_f1: 0.6358
 epoch: 59, train_loss: 0.6205, test_loss: 0.9266, test_f1: 0.6661
 epoch: 60, train_loss: 0.6090, test_loss: 0.8433, test_f1: 0.6861
 epoch: 61, train_loss: 0.5931, test_loss: 0.9033, test_f1: 0.6651
 epoch: 62, train_loss: 0.5801, test_loss: 0.8990, test_f1: 0.6561
 epoch: 63, train_loss: 0.5813, test_loss: 0.8675, test_f1: 0.6813
 epoch: 64, train_loss: 0.6023, test_loss: 0.9352, test_f1: 0.6707
 epoch: 65, train_loss: 0.5911, test_loss: 0.9337, test_f1: 0.6642
 epoch: 66, train_loss: 0.5856, test_loss: 0.9173, test_f1: 0.6709
 epoch: 67, train_loss: 0.5884, test_loss: 0.9292, test_f1: 0.6585
 epoch: 68, train_loss: 0.6054, test_loss: 0.8407, test_f1: 0.6510
 epoch: 69, train_loss: 0.5905, test_loss: 0.8682, test_f1: 0.6666
 epoch: 70, train_loss: 0.5585, test_loss: 0.8857, test_f1: 0.6687
 epoch: 71, train_loss: 0.5673, test_loss: 0.8578, test_f1: 0.6943
 epoch: 72, train_loss: 0.5803, test_loss: 0.9676, test_f1: 0.6884
 epoch: 73, train_loss: 0.5883, test_loss: 0.8756, test_f1: 0.6908
 epoch: 74, train_loss: 0.5596, test_loss: 0.9764, test_f1: 0.6640
 epoch: 75, train_loss: 0.5565, test_loss: 0.9418, test_f1: 0.6621
 epoch: 76, train_loss: 0.5646, test_loss: 0.9828, test_f1: 0.6805
 epoch: 77, train_loss: 0.5561, test_loss: 0.9588, test_f1: 0.6706
 epoch: 78, train_loss: 0.5661, test_loss: 1.0488, test_f1: 0.6468
 epoch: 79, train_loss: 0.5455, test_loss: 0.9072, test_f1: 0.7114
 epoch: 80, train_loss: 0.5536, test_loss: 0.9029, test_f1: 0.7039
 epoch: 81, train_loss: 0.5617, test_loss: 0.9389, test_f1: 0.6625
 epoch: 82, train_loss: 0.5481, test_loss: 0.9524, test_f1: 0.6619
 epoch: 83, train_loss: 0.5368, test_loss: 1.0136, test_f1: 0.6665
 epoch: 84, train_loss: 0.5275, test_loss: 1.0226, test_f1: 0.6776
 epoch: 85, train_loss: 0.5261, test_loss: 1.0444, test_f1: 0.6860
 epoch: 86, train_loss: 0.5547, test_loss: 0.9705, test_f1: 0.6901
 epoch: 87, train_loss: 0.5333, test_loss: 1.0323, test_f1: 0.6792
 epoch: 88, train_loss: 0.5256, test_loss: 1.0231, test_f1: 0.6913
 epoch: 89, train_loss: 0.5439, test_loss: 1.0001, test_f1: 0.6569
 epoch: 90, train_loss: 0.5361, test_loss: 0.9992, test_f1: 0.6817
 epoch: 91, train_loss: 0.5275, test_loss: 1.0042, test_f1: 0.6811
 epoch: 92, train_loss: 0.5092, test_loss: 1.1012, test_f1: 0.6740
 epoch: 93, train_loss: 0.5232, test_loss: 0.9260, test_f1: 0.6726
 epoch: 94, train_loss: 0.5329, test_loss: 0.9441, test_f1: 0.7043
 epoch: 95, train_loss: 0.5419, test_loss: 0.9626, test_f1: 0.6876
 epoch: 96, train_loss: 0.5337, test_loss: 1.0286, test_f1: 0.6874
 epoch: 97, train_loss: 0.5155, test_loss: 0.9868, test_f1: 0.6732
 epoch: 98, train_loss: 0.5100, test_loss: 1.1434, test_f1: 0.6706
 epoch: 99, train_loss: 0.5159, test_loss: 0.9418, test_f1: 0.6877
##################ITERATION #6 ****************************************
 epoch: 0, train_loss: 1.1137, test_loss: 1.1143, test_f1: 0.4066
 epoch: 1, train_loss: 1.0069, test_loss: 0.9945, test_f1: 0.4567
 epoch: 2, train_loss: 0.9833, test_loss: 0.9297, test_f1: 0.5110
 epoch: 3, train_loss: 0.9529, test_loss: 0.9255, test_f1: 0.4949
 epoch: 4, train_loss: 0.9338, test_loss: 0.9810, test_f1: 0.5299
 epoch: 5, train_loss: 0.9395, test_loss: 0.9547, test_f1: 0.4830
 epoch: 6, train_loss: 0.9096, test_loss: 0.9389, test_f1: 0.5325
 epoch: 7, train_loss: 0.8843, test_loss: 0.8847, test_f1: 0.5626
 epoch: 8, train_loss: 0.8857, test_loss: 1.2231, test_f1: 0.4317
 epoch: 9, train_loss: 0.8763, test_loss: 0.8467, test_f1: 0.5886
 epoch: 10, train_loss: 0.9224, test_loss: 0.9744, test_f1: 0.5195
 epoch: 11, train_loss: 0.8692, test_loss: 0.8703, test_f1: 0.5935
 epoch: 12, train_loss: 0.8601, test_loss: 1.2816, test_f1: 0.4028
 epoch: 13, train_loss: 0.8653, test_loss: 0.8846, test_f1: 0.5967
 epoch: 14, train_loss: 0.8490, test_loss: 0.8143, test_f1: 0.6053
 epoch: 15, train_loss: 0.8611, test_loss: 0.8688, test_f1: 0.6023
 epoch: 16, train_loss: 0.8328, test_loss: 0.8372, test_f1: 0.6222
 epoch: 17, train_loss: 0.8295, test_loss: 0.8239, test_f1: 0.6228
 epoch: 18, train_loss: 0.8693, test_loss: 0.9877, test_f1: 0.5796
 epoch: 19, train_loss: 0.8529, test_loss: 0.8382, test_f1: 0.5390
 epoch: 20, train_loss: 0.8355, test_loss: 0.8754, test_f1: 0.5813
 epoch: 21, train_loss: 0.8136, test_loss: 0.8633, test_f1: 0.5478
 epoch: 22, train_loss: 0.8168, test_loss: 0.8497, test_f1: 0.5627
 epoch: 23, train_loss: 0.8100, test_loss: 0.8207, test_f1: 0.6181
 epoch: 24, train_loss: 0.7807, test_loss: 0.9114, test_f1: 0.6082
 epoch: 25, train_loss: 0.7864, test_loss: 0.9715, test_f1: 0.5897
 epoch: 26, train_loss: 0.7858, test_loss: 0.8442, test_f1: 0.6168
 epoch: 27, train_loss: 0.8007, test_loss: 0.8304, test_f1: 0.6310
 epoch: 28, train_loss: 0.7757, test_loss: 0.9344, test_f1: 0.5991
 epoch: 29, train_loss: 0.7800, test_loss: 0.8750, test_f1: 0.6002
 epoch: 30, train_loss: 0.7791, test_loss: 0.8579, test_f1: 0.6242
 epoch: 31, train_loss: 0.7651, test_loss: 0.9513, test_f1: 0.5981
 epoch: 32, train_loss: 0.7831, test_loss: 0.9617, test_f1: 0.6032
 epoch: 33, train_loss: 0.7464, test_loss: 0.8788, test_f1: 0.6088
 epoch: 34, train_loss: 0.7526, test_loss: 0.8461, test_f1: 0.6091
 epoch: 35, train_loss: 0.7563, test_loss: 0.9548, test_f1: 0.5881
 epoch: 36, train_loss: 0.7363, test_loss: 0.8301, test_f1: 0.6135
 epoch: 37, train_loss: 0.7368, test_loss: 0.8146, test_f1: 0.5933
 epoch: 38, train_loss: 0.7481, test_loss: 0.8638, test_f1: 0.5849
 epoch: 39, train_loss: 0.7391, test_loss: 0.9459, test_f1: 0.6192
 epoch: 40, train_loss: 0.7503, test_loss: 0.9587, test_f1: 0.6298
 epoch: 41, train_loss: 0.7440, test_loss: 0.9038, test_f1: 0.5915
 epoch: 42, train_loss: 0.7401, test_loss: 0.9498, test_f1: 0.6204
 epoch: 43, train_loss: 0.7327, test_loss: 0.9067, test_f1: 0.5979
 epoch: 44, train_loss: 0.7359, test_loss: 0.9498, test_f1: 0.5997
 epoch: 45, train_loss: 0.7127, test_loss: 0.9410, test_f1: 0.5858
 epoch: 46, train_loss: 0.7362, test_loss: 0.9474, test_f1: 0.6491
 epoch: 47, train_loss: 0.7171, test_loss: 0.8345, test_f1: 0.6245
 epoch: 48, train_loss: 0.6916, test_loss: 1.1013, test_f1: 0.6090
 epoch: 49, train_loss: 0.7190, test_loss: 0.8715, test_f1: 0.6287
 epoch: 50, train_loss: 0.6926, test_loss: 0.8519, test_f1: 0.6687
 epoch: 51, train_loss: 0.6628, test_loss: 0.8379, test_f1: 0.6232
 epoch: 52, train_loss: 0.6363, test_loss: 0.8228, test_f1: 0.6580
 epoch: 53, train_loss: 0.6550, test_loss: 0.8418, test_f1: 0.6488
 epoch: 54, train_loss: 0.6367, test_loss: 0.8426, test_f1: 0.6523
 epoch: 55, train_loss: 0.6380, test_loss: 0.8865, test_f1: 0.6703
 epoch: 56, train_loss: 0.6417, test_loss: 0.9664, test_f1: 0.6388
 epoch: 57, train_loss: 0.6545, test_loss: 0.8771, test_f1: 0.6364
 epoch: 58, train_loss: 0.6292, test_loss: 0.9503, test_f1: 0.6760
 epoch: 59, train_loss: 0.6275, test_loss: 1.0466, test_f1: 0.6281
 epoch: 60, train_loss: 0.6172, test_loss: 1.1613, test_f1: 0.6415
 epoch: 61, train_loss: 0.6163, test_loss: 1.0446, test_f1: 0.6778
 epoch: 62, train_loss: 0.6095, test_loss: 0.8373, test_f1: 0.6666
 epoch: 63, train_loss: 0.6286, test_loss: 1.0068, test_f1: 0.6521
 epoch: 64, train_loss: 0.5956, test_loss: 0.8457, test_f1: 0.6505
 epoch: 65, train_loss: 0.5856, test_loss: 0.8744, test_f1: 0.6615
 epoch: 66, train_loss: 0.6083, test_loss: 1.0464, test_f1: 0.6615
 epoch: 67, train_loss: 0.5928, test_loss: 0.8833, test_f1: 0.6495
 epoch: 68, train_loss: 0.6129, test_loss: 0.9771, test_f1: 0.6509
 epoch: 69, train_loss: 0.5938, test_loss: 0.8941, test_f1: 0.6529
 epoch: 70, train_loss: 0.6080, test_loss: 0.8205, test_f1: 0.6661
 epoch: 71, train_loss: 0.5881, test_loss: 0.8135, test_f1: 0.6548
 epoch: 72, train_loss: 0.5964, test_loss: 0.9984, test_f1: 0.6476
 epoch: 73, train_loss: 0.6035, test_loss: 1.1301, test_f1: 0.6594
 epoch: 74, train_loss: 0.5886, test_loss: 1.2154, test_f1: 0.6488
 epoch: 75, train_loss: 0.5896, test_loss: 1.0586, test_f1: 0.6198
 epoch: 76, train_loss: 0.5881, test_loss: 0.9525, test_f1: 0.6606
 epoch: 77, train_loss: 0.5728, test_loss: 1.0162, test_f1: 0.6381
 epoch: 78, train_loss: 0.5727, test_loss: 1.0867, test_f1: 0.6566
 epoch: 79, train_loss: 0.5860, test_loss: 0.8970, test_f1: 0.6552
 epoch: 80, train_loss: 0.5572, test_loss: 1.0068, test_f1: 0.6534
 epoch: 81, train_loss: 0.5593, test_loss: 1.0822, test_f1: 0.6769
 epoch: 82, train_loss: 0.5501, test_loss: 1.1520, test_f1: 0.6715
 epoch: 83, train_loss: 0.5522, test_loss: 1.0847, test_f1: 0.6427
 epoch: 84, train_loss: 0.5639, test_loss: 1.0675, test_f1: 0.6741
 epoch: 85, train_loss: 0.5651, test_loss: 0.9496, test_f1: 0.6572
 epoch: 86, train_loss: 0.5462, test_loss: 0.9849, test_f1: 0.6568
 epoch: 87, train_loss: 0.5434, test_loss: 1.0761, test_f1: 0.6709
 epoch: 88, train_loss: 0.5451, test_loss: 0.8650, test_f1: 0.6468
 epoch: 89, train_loss: 0.5302, test_loss: 1.0754, test_f1: 0.6652
 epoch: 90, train_loss: 0.5395, test_loss: 1.1120, test_f1: 0.6541
 epoch: 91, train_loss: 0.5373, test_loss: 1.0865, test_f1: 0.6458
 epoch: 92, train_loss: 0.5403, test_loss: 1.1431, test_f1: 0.6642
 epoch: 93, train_loss: 0.5604, test_loss: 1.0803, test_f1: 0.6805
 epoch: 94, train_loss: 0.5681, test_loss: 0.9371, test_f1: 0.6626
 epoch: 95, train_loss: 0.5360, test_loss: 1.1136, test_f1: 0.6441
 epoch: 96, train_loss: 0.5284, test_loss: 0.9506, test_f1: 0.6521
 epoch: 97, train_loss: 0.5200, test_loss: 0.9758, test_f1: 0.6359
 epoch: 98, train_loss: 0.5469, test_loss: 1.1325, test_f1: 0.6649
 epoch: 99, train_loss: 0.5430, test_loss: 0.9876, test_f1: 0.6522
##################ITERATION #7 ****************************************
 epoch: 0, train_loss: 1.0885, test_loss: 1.1314, test_f1: 0.4375
 epoch: 1, train_loss: 0.9881, test_loss: 0.9526, test_f1: 0.4832
 epoch: 2, train_loss: 0.9565, test_loss: 0.9569, test_f1: 0.5147
 epoch: 3, train_loss: 0.9387, test_loss: 0.9863, test_f1: 0.5098
 epoch: 4, train_loss: 0.9198, test_loss: 0.9178, test_f1: 0.5161
 epoch: 5, train_loss: 0.9245, test_loss: 0.9663, test_f1: 0.5231
 epoch: 6, train_loss: 0.8849, test_loss: 0.8669, test_f1: 0.6086
 epoch: 7, train_loss: 0.8866, test_loss: 0.9297, test_f1: 0.5696
 epoch: 8, train_loss: 0.8683, test_loss: 0.8532, test_f1: 0.5283
 epoch: 9, train_loss: 0.8566, test_loss: 0.8734, test_f1: 0.5553
 epoch: 10, train_loss: 0.8423, test_loss: 0.8519, test_f1: 0.5864
 epoch: 11, train_loss: 0.8652, test_loss: 0.8176, test_f1: 0.5559
 epoch: 12, train_loss: 0.8450, test_loss: 1.0663, test_f1: 0.4755
 epoch: 13, train_loss: 0.8447, test_loss: 0.8860, test_f1: 0.5633
 epoch: 14, train_loss: 0.8204, test_loss: 0.7950, test_f1: 0.6175
 epoch: 15, train_loss: 0.8148, test_loss: 0.8974, test_f1: 0.6128
 epoch: 16, train_loss: 0.8048, test_loss: 0.8966, test_f1: 0.6472
 epoch: 17, train_loss: 0.8148, test_loss: 0.8149, test_f1: 0.6349
 epoch: 18, train_loss: 0.8026, test_loss: 0.8842, test_f1: 0.5876
 epoch: 19, train_loss: 0.7842, test_loss: 0.8637, test_f1: 0.6105
 epoch: 20, train_loss: 0.7892, test_loss: 0.7968, test_f1: 0.6253
 epoch: 21, train_loss: 0.7787, test_loss: 0.7659, test_f1: 0.6426
 epoch: 22, train_loss: 0.7748, test_loss: 0.7562, test_f1: 0.6192
 epoch: 23, train_loss: 0.7597, test_loss: 0.8479, test_f1: 0.6283
 epoch: 24, train_loss: 0.7456, test_loss: 1.0752, test_f1: 0.5840
 epoch: 25, train_loss: 0.8420, test_loss: 0.8770, test_f1: 0.5881
 epoch: 26, train_loss: 0.7820, test_loss: 0.9753, test_f1: 0.6073
 epoch: 27, train_loss: 0.7930, test_loss: 0.8096, test_f1: 0.6013
 epoch: 28, train_loss: 0.7699, test_loss: 0.9053, test_f1: 0.6291
 epoch: 29, train_loss: 0.7548, test_loss: 0.8458, test_f1: 0.6468
 epoch: 30, train_loss: 0.7582, test_loss: 0.8469, test_f1: 0.6721
 epoch: 31, train_loss: 0.7458, test_loss: 0.8726, test_f1: 0.6183
 epoch: 32, train_loss: 0.7309, test_loss: 0.9536, test_f1: 0.6218
 epoch: 33, train_loss: 0.7276, test_loss: 0.7893, test_f1: 0.6529
 epoch: 34, train_loss: 0.7397, test_loss: 0.9013, test_f1: 0.6062
 epoch: 35, train_loss: 0.7441, test_loss: 0.9252, test_f1: 0.6192
 epoch: 36, train_loss: 0.7065, test_loss: 0.9932, test_f1: 0.6168
 epoch: 37, train_loss: 0.7114, test_loss: 0.7917, test_f1: 0.6249
 epoch: 38, train_loss: 0.7183, test_loss: 0.9950, test_f1: 0.5241
 epoch: 39, train_loss: 0.7237, test_loss: 0.9884, test_f1: 0.6254
 epoch: 40, train_loss: 0.7149, test_loss: 0.8423, test_f1: 0.6402
 epoch: 41, train_loss: 0.6991, test_loss: 0.9179, test_f1: 0.6523
 epoch: 42, train_loss: 0.6947, test_loss: 0.8226, test_f1: 0.6654
 epoch: 43, train_loss: 0.7406, test_loss: 1.0789, test_f1: 0.5597
 epoch: 44, train_loss: 0.7560, test_loss: 0.9127, test_f1: 0.6330
 epoch: 45, train_loss: 0.7012, test_loss: 0.9333, test_f1: 0.6556
 epoch: 46, train_loss: 0.7140, test_loss: 1.1201, test_f1: 0.6244
 epoch: 47, train_loss: 0.6748, test_loss: 0.9976, test_f1: 0.6592
 epoch: 48, train_loss: 0.6910, test_loss: 1.0655, test_f1: 0.6568
 epoch: 49, train_loss: 0.6422, test_loss: 1.0789, test_f1: 0.6297
 epoch: 50, train_loss: 0.6522, test_loss: 0.8384, test_f1: 0.6668
 epoch: 51, train_loss: 0.6448, test_loss: 0.9670, test_f1: 0.6651
 epoch: 52, train_loss: 0.6379, test_loss: 0.9836, test_f1: 0.6752
 epoch: 53, train_loss: 0.6235, test_loss: 0.9998, test_f1: 0.6670
 epoch: 54, train_loss: 0.6114, test_loss: 1.0754, test_f1: 0.6545
 epoch: 55, train_loss: 0.6200, test_loss: 0.9356, test_f1: 0.6698
 epoch: 56, train_loss: 0.6140, test_loss: 1.0569, test_f1: 0.6605
 epoch: 57, train_loss: 0.6129, test_loss: 1.0584, test_f1: 0.6453
 epoch: 58, train_loss: 0.6069, test_loss: 1.0051, test_f1: 0.6355
 epoch: 59, train_loss: 0.6059, test_loss: 1.0155, test_f1: 0.6621
 epoch: 60, train_loss: 0.5998, test_loss: 0.9774, test_f1: 0.6706
 epoch: 61, train_loss: 0.5975, test_loss: 0.9219, test_f1: 0.6891
 epoch: 62, train_loss: 0.5871, test_loss: 1.0483, test_f1: 0.6883
 epoch: 63, train_loss: 0.5827, test_loss: 0.9441, test_f1: 0.6919
 epoch: 64, train_loss: 0.5928, test_loss: 1.0400, test_f1: 0.6664
 epoch: 65, train_loss: 0.5672, test_loss: 0.9665, test_f1: 0.6730
 epoch: 66, train_loss: 0.5820, test_loss: 1.0207, test_f1: 0.6663
 epoch: 67, train_loss: 0.5819, test_loss: 1.0018, test_f1: 0.6675
 epoch: 68, train_loss: 0.5674, test_loss: 1.0257, test_f1: 0.6675
 epoch: 69, train_loss: 0.5668, test_loss: 0.9725, test_f1: 0.6701
 epoch: 70, train_loss: 0.5637, test_loss: 1.0067, test_f1: 0.6881
 epoch: 71, train_loss: 0.5723, test_loss: 1.0739, test_f1: 0.6689
 epoch: 72, train_loss: 0.5663, test_loss: 1.0997, test_f1: 0.6544
 epoch: 73, train_loss: 0.5637, test_loss: 1.1797, test_f1: 0.6689
 epoch: 74, train_loss: 0.5772, test_loss: 1.0042, test_f1: 0.6819
 epoch: 75, train_loss: 0.5483, test_loss: 0.9265, test_f1: 0.6993
 epoch: 76, train_loss: 0.5530, test_loss: 1.0626, test_f1: 0.6987
 epoch: 77, train_loss: 0.5399, test_loss: 0.9409, test_f1: 0.6611
 epoch: 78, train_loss: 0.5572, test_loss: 0.9753, test_f1: 0.6871
 epoch: 79, train_loss: 0.5504, test_loss: 0.9830, test_f1: 0.6539
 epoch: 80, train_loss: 0.5397, test_loss: 1.0137, test_f1: 0.6634
 epoch: 81, train_loss: 0.5363, test_loss: 1.0768, test_f1: 0.6855
 epoch: 82, train_loss: 0.5438, test_loss: 1.0301, test_f1: 0.6499
 epoch: 83, train_loss: 0.5793, test_loss: 1.0862, test_f1: 0.6588
 epoch: 84, train_loss: 0.5454, test_loss: 1.1085, test_f1: 0.6638
 epoch: 85, train_loss: 0.5425, test_loss: 1.0576, test_f1: 0.6680
 epoch: 86, train_loss: 0.5239, test_loss: 1.0178, test_f1: 0.6792
 epoch: 87, train_loss: 0.6043, test_loss: 1.0538, test_f1: 0.6693
 epoch: 88, train_loss: 0.5372, test_loss: 1.0890, test_f1: 0.6815
 epoch: 89, train_loss: 0.5454, test_loss: 1.1621, test_f1: 0.6943
 epoch: 90, train_loss: 0.5332, test_loss: 1.0956, test_f1: 0.7026
 epoch: 91, train_loss: 0.5203, test_loss: 1.0980, test_f1: 0.6782
 epoch: 92, train_loss: 0.5280, test_loss: 1.0532, test_f1: 0.6544
 epoch: 93, train_loss: 0.5068, test_loss: 1.1607, test_f1: 0.7027
 epoch: 94, train_loss: 0.5151, test_loss: 1.1947, test_f1: 0.6601
 epoch: 95, train_loss: 0.4956, test_loss: 1.1666, test_f1: 0.6991
 epoch: 96, train_loss: 0.5200, test_loss: 1.2410, test_f1: 0.6838
 epoch: 97, train_loss: 0.4974, test_loss: 1.3115, test_f1: 0.6840
 epoch: 98, train_loss: 0.5284, test_loss: 1.0865, test_f1: 0.6571
 epoch: 99, train_loss: 0.4964, test_loss: 1.2086, test_f1: 0.6585
##################ITERATION #8 ****************************************
 epoch: 0, train_loss: 1.1219, test_loss: 1.0583, test_f1: 0.4522
 epoch: 1, train_loss: 1.0046, test_loss: 1.0170, test_f1: 0.4239
 epoch: 2, train_loss: 0.9737, test_loss: 1.0937, test_f1: 0.4571
 epoch: 3, train_loss: 0.9537, test_loss: 0.9478, test_f1: 0.5035
 epoch: 4, train_loss: 0.9472, test_loss: 0.9418, test_f1: 0.4674
 epoch: 5, train_loss: 0.9475, test_loss: 0.9125, test_f1: 0.5099
 epoch: 6, train_loss: 0.9148, test_loss: 0.9943, test_f1: 0.5050
 epoch: 7, train_loss: 0.9359, test_loss: 0.9287, test_f1: 0.5246
 epoch: 8, train_loss: 0.9216, test_loss: 0.9108, test_f1: 0.5092
 epoch: 9, train_loss: 0.9044, test_loss: 0.8744, test_f1: 0.6039
 epoch: 10, train_loss: 0.8953, test_loss: 0.8867, test_f1: 0.5274
 epoch: 11, train_loss: 0.8866, test_loss: 0.9141, test_f1: 0.5533
 epoch: 12, train_loss: 0.8792, test_loss: 0.8650, test_f1: 0.5533
 epoch: 13, train_loss: 0.8708, test_loss: 0.8732, test_f1: 0.5955
 epoch: 14, train_loss: 0.8573, test_loss: 0.9172, test_f1: 0.5360
 epoch: 15, train_loss: 0.8549, test_loss: 0.9279, test_f1: 0.5883
 epoch: 16, train_loss: 0.8450, test_loss: 0.8912, test_f1: 0.5916
 epoch: 17, train_loss: 0.8513, test_loss: 0.9248, test_f1: 0.5195
 epoch: 18, train_loss: 0.8414, test_loss: 0.9002, test_f1: 0.5974
 epoch: 19, train_loss: 0.8166, test_loss: 0.9372, test_f1: 0.5877
 epoch: 20, train_loss: 0.8240, test_loss: 0.9232, test_f1: 0.5945
 epoch: 21, train_loss: 0.8209, test_loss: 0.8515, test_f1: 0.5601
 epoch: 22, train_loss: 0.8048, test_loss: 0.9356, test_f1: 0.6268
 epoch: 23, train_loss: 0.7964, test_loss: 0.8550, test_f1: 0.6046
 epoch: 24, train_loss: 0.7937, test_loss: 0.8892, test_f1: 0.6097
 epoch: 25, train_loss: 0.7849, test_loss: 0.9822, test_f1: 0.5893
 epoch: 26, train_loss: 0.7984, test_loss: 0.9115, test_f1: 0.6393
 epoch: 27, train_loss: 0.7829, test_loss: 0.9716, test_f1: 0.5711
 epoch: 28, train_loss: 0.7767, test_loss: 0.9196, test_f1: 0.6157
 epoch: 29, train_loss: 0.7672, test_loss: 0.8677, test_f1: 0.5989
 epoch: 30, train_loss: 0.7765, test_loss: 0.9030, test_f1: 0.6171
 epoch: 31, train_loss: 0.7684, test_loss: 0.8978, test_f1: 0.6077
 epoch: 32, train_loss: 0.7469, test_loss: 0.8350, test_f1: 0.5896
 epoch: 33, train_loss: 0.7449, test_loss: 0.8067, test_f1: 0.6093
 epoch: 34, train_loss: 0.7455, test_loss: 0.9026, test_f1: 0.6496
 epoch: 35, train_loss: 0.7539, test_loss: 0.8270, test_f1: 0.6143
 epoch: 36, train_loss: 0.7560, test_loss: 0.8013, test_f1: 0.6097
 epoch: 37, train_loss: 0.7725, test_loss: 0.9373, test_f1: 0.6153
 epoch: 38, train_loss: 0.7559, test_loss: 0.8377, test_f1: 0.5983
 epoch: 39, train_loss: 0.7334, test_loss: 0.8655, test_f1: 0.6235
 epoch: 40, train_loss: 0.7333, test_loss: 0.9033, test_f1: 0.6117
 epoch: 41, train_loss: 0.7729, test_loss: 0.7875, test_f1: 0.5925
 epoch: 42, train_loss: 0.7647, test_loss: 0.8106, test_f1: 0.6185
 epoch: 43, train_loss: 0.7335, test_loss: 0.8571, test_f1: 0.5840
 epoch: 44, train_loss: 0.7224, test_loss: 0.8577, test_f1: 0.5987
 epoch: 45, train_loss: 0.7150, test_loss: 0.9086, test_f1: 0.6377
 epoch: 46, train_loss: 0.7178, test_loss: 0.8996, test_f1: 0.6147
 epoch: 47, train_loss: 0.7139, test_loss: 0.8721, test_f1: 0.6267
 epoch: 48, train_loss: 0.7082, test_loss: 0.8803, test_f1: 0.6291
 epoch: 49, train_loss: 0.7106, test_loss: 0.9586, test_f1: 0.6037
 epoch: 50, train_loss: 0.6991, test_loss: 0.9131, test_f1: 0.5776
 epoch: 51, train_loss: 0.6911, test_loss: 0.9752, test_f1: 0.6083
 epoch: 52, train_loss: 0.6614, test_loss: 0.9826, test_f1: 0.6103
 epoch: 53, train_loss: 0.6451, test_loss: 0.9717, test_f1: 0.6496
 epoch: 54, train_loss: 0.6446, test_loss: 0.9744, test_f1: 0.6613
 epoch: 55, train_loss: 0.6361, test_loss: 1.0034, test_f1: 0.6483
 epoch: 56, train_loss: 0.6338, test_loss: 1.0522, test_f1: 0.6426
 epoch: 57, train_loss: 0.6289, test_loss: 1.0164, test_f1: 0.6411
 epoch: 58, train_loss: 0.6392, test_loss: 1.0589, test_f1: 0.6305
 epoch: 59, train_loss: 0.6303, test_loss: 1.0094, test_f1: 0.6176
 epoch: 60, train_loss: 0.6328, test_loss: 1.0422, test_f1: 0.6425
 epoch: 61, train_loss: 0.6465, test_loss: 0.9615, test_f1: 0.6396
 epoch: 62, train_loss: 0.6120, test_loss: 1.0807, test_f1: 0.6410
 epoch: 63, train_loss: 0.6212, test_loss: 0.9468, test_f1: 0.6416
 epoch: 64, train_loss: 0.6103, test_loss: 1.0543, test_f1: 0.6375
 epoch: 65, train_loss: 0.6209, test_loss: 1.0016, test_f1: 0.6555
 epoch: 66, train_loss: 0.6113, test_loss: 1.0118, test_f1: 0.6499
 epoch: 67, train_loss: 0.6025, test_loss: 1.0732, test_f1: 0.6348
 epoch: 68, train_loss: 0.6039, test_loss: 1.0427, test_f1: 0.6470
 epoch: 69, train_loss: 0.6028, test_loss: 1.0635, test_f1: 0.6197
 epoch: 70, train_loss: 0.5977, test_loss: 1.0083, test_f1: 0.6545
 epoch: 71, train_loss: 0.5921, test_loss: 1.0539, test_f1: 0.6185
 epoch: 72, train_loss: 0.6044, test_loss: 1.0144, test_f1: 0.6709
 epoch: 73, train_loss: 0.5963, test_loss: 0.9670, test_f1: 0.6420
 epoch: 74, train_loss: 0.5858, test_loss: 1.0397, test_f1: 0.6461
 epoch: 75, train_loss: 0.5734, test_loss: 1.0891, test_f1: 0.6340
 epoch: 76, train_loss: 0.5749, test_loss: 1.0892, test_f1: 0.6441
 epoch: 77, train_loss: 0.6040, test_loss: 1.1059, test_f1: 0.6644
 epoch: 78, train_loss: 0.5931, test_loss: 1.0798, test_f1: 0.6707
 epoch: 79, train_loss: 0.5835, test_loss: 1.1793, test_f1: 0.6512
 epoch: 80, train_loss: 0.5762, test_loss: 1.2247, test_f1: 0.6357
 epoch: 81, train_loss: 0.5934, test_loss: 1.0952, test_f1: 0.6700
 epoch: 82, train_loss: 0.5765, test_loss: 1.2635, test_f1: 0.6590
 epoch: 83, train_loss: 0.5804, test_loss: 1.1848, test_f1: 0.6598
 epoch: 84, train_loss: 0.5849, test_loss: 1.1324, test_f1: 0.6539
 epoch: 85, train_loss: 0.5724, test_loss: 1.0302, test_f1: 0.6315
 epoch: 86, train_loss: 0.5791, test_loss: 1.1118, test_f1: 0.6626
 epoch: 87, train_loss: 0.5821, test_loss: 1.0941, test_f1: 0.6587
 epoch: 88, train_loss: 0.5478, test_loss: 1.2303, test_f1: 0.6821
 epoch: 89, train_loss: 0.5508, test_loss: 1.1654, test_f1: 0.6758
 epoch: 90, train_loss: 0.5561, test_loss: 1.1142, test_f1: 0.6661
 epoch: 91, train_loss: 0.5625, test_loss: 1.0279, test_f1: 0.6518
 epoch: 92, train_loss: 0.5537, test_loss: 1.1272, test_f1: 0.6550
 epoch: 93, train_loss: 0.5438, test_loss: 1.1679, test_f1: 0.6751
 epoch: 94, train_loss: 0.5781, test_loss: 1.1022, test_f1: 0.6660
 epoch: 95, train_loss: 0.5570, test_loss: 1.1785, test_f1: 0.6643
 epoch: 96, train_loss: 0.5651, test_loss: 1.1586, test_f1: 0.6711
 epoch: 97, train_loss: 0.5352, test_loss: 1.1261, test_f1: 0.6772
 epoch: 98, train_loss: 0.5347, test_loss: 1.1985, test_f1: 0.6527
 epoch: 99, train_loss: 0.5339, test_loss: 1.1953, test_f1: 0.6422
##################ITERATION #9 ****************************************
 epoch: 0, train_loss: 1.0813, test_loss: 0.9929, test_f1: 0.4120
 epoch: 1, train_loss: 0.9768, test_loss: 1.0015, test_f1: 0.4998
 epoch: 2, train_loss: 0.9513, test_loss: 0.9453, test_f1: 0.4621
 epoch: 3, train_loss: 0.9479, test_loss: 1.0058, test_f1: 0.4879
 epoch: 4, train_loss: 0.9262, test_loss: 0.8752, test_f1: 0.5099
 epoch: 5, train_loss: 0.9119, test_loss: 0.9573, test_f1: 0.5334
 epoch: 6, train_loss: 0.9093, test_loss: 1.0107, test_f1: 0.4904
 epoch: 7, train_loss: 0.9016, test_loss: 0.8991, test_f1: 0.5232
 epoch: 8, train_loss: 0.8840, test_loss: 0.9003, test_f1: 0.5553
 epoch: 9, train_loss: 0.8809, test_loss: 0.9269, test_f1: 0.5256
 epoch: 10, train_loss: 0.8921, test_loss: 0.8978, test_f1: 0.5819
 epoch: 11, train_loss: 0.8681, test_loss: 0.8665, test_f1: 0.5470
 epoch: 12, train_loss: 0.8456, test_loss: 0.9710, test_f1: 0.5843
 epoch: 13, train_loss: 0.8552, test_loss: 0.8791, test_f1: 0.5921
 epoch: 14, train_loss: 0.8424, test_loss: 0.8707, test_f1: 0.5863
 epoch: 15, train_loss: 0.8331, test_loss: 0.8759, test_f1: 0.5905
 epoch: 16, train_loss: 0.8328, test_loss: 0.9946, test_f1: 0.5665
 epoch: 17, train_loss: 0.8260, test_loss: 0.9319, test_f1: 0.5292
 epoch: 18, train_loss: 0.8295, test_loss: 0.8633, test_f1: 0.6188
 epoch: 19, train_loss: 0.7985, test_loss: 0.8854, test_f1: 0.5539
 epoch: 20, train_loss: 0.7886, test_loss: 0.8676, test_f1: 0.5993
 epoch: 21, train_loss: 0.8007, test_loss: 0.8051, test_f1: 0.6477
 epoch: 22, train_loss: 0.7766, test_loss: 0.8340, test_f1: 0.6277
 epoch: 23, train_loss: 0.7853, test_loss: 0.8778, test_f1: 0.5413
 epoch: 24, train_loss: 0.7655, test_loss: 0.9606, test_f1: 0.5454
 epoch: 25, train_loss: 0.7815, test_loss: 0.7813, test_f1: 0.6342
 epoch: 26, train_loss: 0.7680, test_loss: 0.8487, test_f1: 0.6234
 epoch: 27, train_loss: 0.7669, test_loss: 0.8564, test_f1: 0.6337
 epoch: 28, train_loss: 0.7590, test_loss: 0.9953, test_f1: 0.5463
 epoch: 29, train_loss: 0.7444, test_loss: 0.8341, test_f1: 0.5993
 epoch: 30, train_loss: 0.7422, test_loss: 0.8463, test_f1: 0.6296
 epoch: 31, train_loss: 0.7334, test_loss: 0.9395, test_f1: 0.5968
 epoch: 32, train_loss: 0.7513, test_loss: 0.8818, test_f1: 0.5835
 epoch: 33, train_loss: 0.7536, test_loss: 0.8056, test_f1: 0.6392
 epoch: 34, train_loss: 0.7310, test_loss: 0.8343, test_f1: 0.6279
 epoch: 35, train_loss: 0.7526, test_loss: 0.8950, test_f1: 0.6390
 epoch: 36, train_loss: 0.7193, test_loss: 0.8683, test_f1: 0.6127
 epoch: 37, train_loss: 0.7122, test_loss: 0.8903, test_f1: 0.6409
 epoch: 38, train_loss: 0.6989, test_loss: 0.8466, test_f1: 0.6093
 epoch: 39, train_loss: 0.7154, test_loss: 1.0203, test_f1: 0.5931
 epoch: 40, train_loss: 0.6985, test_loss: 0.8783, test_f1: 0.6045
 epoch: 41, train_loss: 0.7143, test_loss: 0.8713, test_f1: 0.6258
 epoch: 42, train_loss: 0.6840, test_loss: 1.0093, test_f1: 0.5606
 epoch: 43, train_loss: 0.6812, test_loss: 0.8166, test_f1: 0.6245
 epoch: 44, train_loss: 0.6662, test_loss: 0.8363, test_f1: 0.6057
 epoch: 45, train_loss: 0.6786, test_loss: 0.9114, test_f1: 0.5564
 epoch: 46, train_loss: 0.6886, test_loss: 0.9244, test_f1: 0.5949
 epoch: 47, train_loss: 0.6810, test_loss: 0.9239, test_f1: 0.6521
 epoch: 48, train_loss: 0.6687, test_loss: 0.8246, test_f1: 0.6430
 epoch: 49, train_loss: 0.6820, test_loss: 1.0368, test_f1: 0.6131
 epoch: 50, train_loss: 0.6443, test_loss: 1.0001, test_f1: 0.6216
 epoch: 51, train_loss: 0.6343, test_loss: 0.9464, test_f1: 0.6450
 epoch: 52, train_loss: 0.5924, test_loss: 0.8094, test_f1: 0.6553
 epoch: 53, train_loss: 0.6090, test_loss: 0.9120, test_f1: 0.6527
 epoch: 54, train_loss: 0.6116, test_loss: 0.8772, test_f1: 0.6472
 epoch: 55, train_loss: 0.5861, test_loss: 0.8683, test_f1: 0.6641
 epoch: 56, train_loss: 0.5958, test_loss: 0.8988, test_f1: 0.6608
 epoch: 57, train_loss: 0.5963, test_loss: 0.8884, test_f1: 0.6350
 epoch: 58, train_loss: 0.5911, test_loss: 0.8145, test_f1: 0.6538
 epoch: 59, train_loss: 0.5871, test_loss: 0.8744, test_f1: 0.6473
 epoch: 60, train_loss: 0.5930, test_loss: 0.9087, test_f1: 0.6541
 epoch: 61, train_loss: 0.5801, test_loss: 0.8957, test_f1: 0.6380
 epoch: 62, train_loss: 0.5539, test_loss: 0.9769, test_f1: 0.6523
 epoch: 63, train_loss: 0.5738, test_loss: 0.9750, test_f1: 0.6861
 epoch: 64, train_loss: 0.5856, test_loss: 0.9670, test_f1: 0.6409
 epoch: 65, train_loss: 0.5648, test_loss: 0.9300, test_f1: 0.6372
 epoch: 66, train_loss: 0.5754, test_loss: 1.0350, test_f1: 0.6340
 epoch: 67, train_loss: 0.5553, test_loss: 0.9026, test_f1: 0.6482
 epoch: 68, train_loss: 0.5638, test_loss: 0.9953, test_f1: 0.6671
 epoch: 69, train_loss: 0.5616, test_loss: 0.9098, test_f1: 0.6849
 epoch: 70, train_loss: 0.5584, test_loss: 0.9630, test_f1: 0.6808
 epoch: 71, train_loss: 0.5525, test_loss: 0.9967, test_f1: 0.6324
 epoch: 72, train_loss: 0.5644, test_loss: 0.9904, test_f1: 0.6669
 epoch: 73, train_loss: 0.5517, test_loss: 1.0812, test_f1: 0.6371
 epoch: 74, train_loss: 0.5540, test_loss: 0.9941, test_f1: 0.6791
 epoch: 75, train_loss: 0.5689, test_loss: 0.9876, test_f1: 0.6555
 epoch: 76, train_loss: 0.5482, test_loss: 1.0026, test_f1: 0.6591
 epoch: 77, train_loss: 0.5513, test_loss: 1.0066, test_f1: 0.6742
 epoch: 78, train_loss: 0.5508, test_loss: 0.9066, test_f1: 0.6390
 epoch: 79, train_loss: 0.5463, test_loss: 1.0984, test_f1: 0.6594
 epoch: 80, train_loss: 0.5300, test_loss: 0.9984, test_f1: 0.6643
 epoch: 81, train_loss: 0.5149, test_loss: 1.0425, test_f1: 0.6388
 epoch: 82, train_loss: 0.5165, test_loss: 1.0150, test_f1: 0.6377
 epoch: 83, train_loss: 0.5342, test_loss: 0.9506, test_f1: 0.6711
 epoch: 84, train_loss: 0.5407, test_loss: 1.0656, test_f1: 0.6661
 epoch: 85, train_loss: 0.5270, test_loss: 0.9134, test_f1: 0.6594
 epoch: 86, train_loss: 0.5190, test_loss: 0.9666, test_f1: 0.6805
 epoch: 87, train_loss: 0.5140, test_loss: 0.9390, test_f1: 0.6439
 epoch: 88, train_loss: 0.5266, test_loss: 0.9956, test_f1: 0.6463
 epoch: 89, train_loss: 0.5058, test_loss: 1.0655, test_f1: 0.6532
 epoch: 90, train_loss: 0.5094, test_loss: 0.9932, test_f1: 0.6376
 epoch: 91, train_loss: 0.5492, test_loss: 1.0607, test_f1: 0.6514
 epoch: 92, train_loss: 0.5097, test_loss: 1.1093, test_f1: 0.6363
 epoch: 93, train_loss: 0.5171, test_loss: 1.0307, test_f1: 0.6545
 epoch: 94, train_loss: 0.5077, test_loss: 0.9947, test_f1: 0.6520
 epoch: 95, train_loss: 0.5068, test_loss: 1.0955, test_f1: 0.6591
 epoch: 96, train_loss: 0.5047, test_loss: 1.0552, test_f1: 0.6517
 epoch: 97, train_loss: 0.5042, test_loss: 1.0623, test_f1: 0.6405
 epoch: 98, train_loss: 0.5040, test_loss: 1.1287, test_f1: 0.6102
 epoch: 99, train_loss: 0.5241, test_loss: 0.9697, test_f1: 0.6567

Training completed in 821.48 seconds
Best F1: 0.7114 at epoch 79
Mean F1 across iterations: 0.6927  0.0107
========================FINAL RESULTS================================
FEGIN weighted F1: 0.7114  0.0107
python main.py --data ltspice_examples --representation component_pin_net --model FEGIN --layers 2 --hiddens 64 --batch_size 32 --lr 0.01 --emb_size 128 --epochs 100 --save_appendix component_pin_net_L2_H64_BS32_LR0.01_E128 --no_val
-----



STDERR:
  File "main.py", line 370, in <module>
    main()
  File "main.py", line 254, in main
    dataset = dataset_class(
  File "/home/philip/projects/ltspice_examples_code_repo/Circuit-Completion-Using-GNNs/component_classification_with_link_prediction_head/evaluation/FEGIN/kernel/circuit_datasets.py", line 15, in __init__
    self.data, self.slices = torch.load(self.processed_paths[0])
  File "/home/philip/.local/lib/python3.8/site-packages/torch/serialization.py", line 1040, in load
    warnings.warn(
  File "/usr/lib/python3.8/warnings.py", line 109, in _showwarnmsg
    sw(msg.message, msg.category, msg.filename, msg.lineno,
  File "main.py", line 47, in warn_with_traceback
    traceback.print_stack(file=log)
/home/philip/projects/ltspice_examples_code_repo/Circuit-Completion-Using-GNNs/component_classification_with_link_prediction_head/evaluation/FEGIN/kernel/circuit_datasets.py:15: FutureWarning: You are using `torch.load` with `weights_only=False` (the current default value), which uses the default pickle module implicitly. It is possible to construct malicious pickle data which will execute arbitrary code during unpickling (See https://github.com/pytorch/pytorch/blob/main/SECURITY.md#untrusted-models for more details). In a future release, the default value for `weights_only` will be flipped to `True`. This limits the functions that could be executed during unpickling. Arbitrary objects will no longer be allowed to be loaded via this mode unless they are explicitly allowlisted by the user via `torch.serialization.add_safe_globals`. We recommend you start setting `weights_only=True` for any use case where you don't have full control of the loaded file. Please open an issue on GitHub for any issues related to this experimental feature.
  self.data, self.slices = torch.load(self.processed_paths[0])
