STDOUT:
Results will be saved in /home/philip/projects/ltspice_examples_code_repo/Circuit-Completion-Using-GNNs/component_classification_with_link_prediction_head/evaluation/FEGIN/results/model_FEGIN_dataset_ltspice_examples
Command line input: python main.py --data ltspice_examples --representation component_component --model FEGIN --layers 5 --hiddens 32 --batch_size 64 --lr 0.01 --emb_size 128 --epochs 100 --save_appendix component_component_L5_H32_BS64_LR0.01_E128 --no_val
 is saved.
-----
ltspice_examples - FEGIN
Using 5 layers, 32 hidden units, h = 2
Loading component_component representation dataset
ENTERED
Training FEGIN on component_component representation
Train: 3556, Test: 845
##################ITERATION #0 ****************************************
 epoch: 0, train_loss: 1.2651, test_loss: 1.4128, test_f1: 0.2552
 epoch: 1, train_loss: 1.1929, test_loss: 1.1182, test_f1: 0.4071
 epoch: 2, train_loss: 1.1372, test_loss: 1.0415, test_f1: 0.4355
 epoch: 3, train_loss: 1.1175, test_loss: 1.0619, test_f1: 0.3571
 epoch: 4, train_loss: 1.0984, test_loss: 1.0764, test_f1: 0.4534
 epoch: 5, train_loss: 1.0622, test_loss: 1.0034, test_f1: 0.4736
 epoch: 6, train_loss: 1.0366, test_loss: 1.0627, test_f1: 0.4652
 epoch: 7, train_loss: 1.0170, test_loss: 1.0185, test_f1: 0.4842
 epoch: 8, train_loss: 0.9854, test_loss: 1.0051, test_f1: 0.5159
 epoch: 9, train_loss: 0.9774, test_loss: 0.9958, test_f1: 0.4993
 epoch: 10, train_loss: 0.9761, test_loss: 0.9249, test_f1: 0.5360
 epoch: 11, train_loss: 0.9655, test_loss: 1.0016, test_f1: 0.4869
 epoch: 12, train_loss: 0.9422, test_loss: 1.0119, test_f1: 0.5089
 epoch: 13, train_loss: 0.9521, test_loss: 1.0014, test_f1: 0.5124
 epoch: 14, train_loss: 0.9275, test_loss: 1.0149, test_f1: 0.4626
 epoch: 15, train_loss: 0.9204, test_loss: 0.9861, test_f1: 0.5213
 epoch: 16, train_loss: 0.9155, test_loss: 1.0386, test_f1: 0.5120
 epoch: 17, train_loss: 0.9016, test_loss: 0.9600, test_f1: 0.5485
 epoch: 18, train_loss: 0.9132, test_loss: 1.0552, test_f1: 0.4859
 epoch: 19, train_loss: 0.8958, test_loss: 0.9942, test_f1: 0.4987
 epoch: 20, train_loss: 0.8843, test_loss: 1.0675, test_f1: 0.5301
 epoch: 21, train_loss: 0.8887, test_loss: 1.0179, test_f1: 0.5001
 epoch: 22, train_loss: 0.8668, test_loss: 1.0067, test_f1: 0.5090
 epoch: 23, train_loss: 0.8745, test_loss: 0.9712, test_f1: 0.5106
 epoch: 24, train_loss: 0.8730, test_loss: 1.0389, test_f1: 0.5225
 epoch: 25, train_loss: 0.8601, test_loss: 1.0091, test_f1: 0.5112
 epoch: 26, train_loss: 0.8752, test_loss: 1.0288, test_f1: 0.5103
 epoch: 27, train_loss: 0.8756, test_loss: 1.5448, test_f1: 0.4788
 epoch: 28, train_loss: 0.8543, test_loss: 0.9954, test_f1: 0.5462
 epoch: 29, train_loss: 0.8422, test_loss: 0.9983, test_f1: 0.5258
 epoch: 30, train_loss: 0.8696, test_loss: 0.9710, test_f1: 0.5010
 epoch: 31, train_loss: 0.8611, test_loss: 0.9297, test_f1: 0.5228
 epoch: 32, train_loss: 0.8395, test_loss: 0.9919, test_f1: 0.4761
 epoch: 33, train_loss: 0.8389, test_loss: 1.1805, test_f1: 0.4862
 epoch: 34, train_loss: 0.8271, test_loss: 1.0198, test_f1: 0.4974
 epoch: 35, train_loss: 0.8338, test_loss: 1.0694, test_f1: 0.4801
 epoch: 36, train_loss: 0.8327, test_loss: 1.0711, test_f1: 0.4975
 epoch: 37, train_loss: 0.8377, test_loss: 0.9834, test_f1: 0.5677
 epoch: 38, train_loss: 0.9696, test_loss: 0.8644, test_f1: 0.5275
 epoch: 39, train_loss: 0.8873, test_loss: 0.9900, test_f1: 0.5164
 epoch: 40, train_loss: 0.8695, test_loss: 0.9535, test_f1: 0.5069
 epoch: 41, train_loss: 0.8542, test_loss: 0.9507, test_f1: 0.5069
 epoch: 42, train_loss: 0.8329, test_loss: 0.9877, test_f1: 0.5402
 epoch: 43, train_loss: 0.8381, test_loss: 0.9599, test_f1: 0.5207
 epoch: 44, train_loss: 0.8355, test_loss: 0.9908, test_f1: 0.5267
 epoch: 45, train_loss: 0.8246, test_loss: 1.0009, test_f1: 0.5105
 epoch: 46, train_loss: 0.8314, test_loss: 1.0297, test_f1: 0.5145
 epoch: 47, train_loss: 0.8231, test_loss: 1.0673, test_f1: 0.4924
 epoch: 48, train_loss: 0.8286, test_loss: 1.0116, test_f1: 0.5230
 epoch: 49, train_loss: 0.8117, test_loss: 0.9186, test_f1: 0.5666
 epoch: 50, train_loss: 0.8147, test_loss: 1.0840, test_f1: 0.5128
 epoch: 51, train_loss: 0.7949, test_loss: 1.1347, test_f1: 0.5155
 epoch: 52, train_loss: 0.7742, test_loss: 1.0733, test_f1: 0.5254
 epoch: 53, train_loss: 0.7736, test_loss: 0.9881, test_f1: 0.5403
 epoch: 54, train_loss: 0.7753, test_loss: 1.1060, test_f1: 0.5283
 epoch: 55, train_loss: 0.7562, test_loss: 1.0495, test_f1: 0.5278
 epoch: 56, train_loss: 0.7518, test_loss: 1.0478, test_f1: 0.5107
 epoch: 57, train_loss: 0.7634, test_loss: 1.0374, test_f1: 0.5261
 epoch: 58, train_loss: 0.7528, test_loss: 1.0132, test_f1: 0.5370
 epoch: 59, train_loss: 0.7528, test_loss: 1.1765, test_f1: 0.5452
 epoch: 60, train_loss: 0.7551, test_loss: 1.0443, test_f1: 0.5348
 epoch: 61, train_loss: 0.7397, test_loss: 0.9532, test_f1: 0.5745
 epoch: 62, train_loss: 0.7414, test_loss: 1.1426, test_f1: 0.5089
 epoch: 63, train_loss: 0.7452, test_loss: 0.9794, test_f1: 0.5494
 epoch: 64, train_loss: 0.7449, test_loss: 1.0276, test_f1: 0.5287
 epoch: 65, train_loss: 0.7352, test_loss: 1.1006, test_f1: 0.5481
 epoch: 66, train_loss: 0.7276, test_loss: 1.0079, test_f1: 0.5343
 epoch: 67, train_loss: 0.7298, test_loss: 1.1827, test_f1: 0.5727
 epoch: 68, train_loss: 0.7313, test_loss: 1.0480, test_f1: 0.5661
 epoch: 69, train_loss: 0.7234, test_loss: 0.9353, test_f1: 0.5955
 epoch: 70, train_loss: 0.7181, test_loss: 1.0940, test_f1: 0.5518
 epoch: 71, train_loss: 0.7004, test_loss: 1.0556, test_f1: 0.5778
 epoch: 72, train_loss: 0.7161, test_loss: 1.0252, test_f1: 0.5596
 epoch: 73, train_loss: 0.7238, test_loss: 0.9718, test_f1: 0.5628
 epoch: 74, train_loss: 0.7323, test_loss: 1.0180, test_f1: 0.5331
 epoch: 75, train_loss: 0.7252, test_loss: 1.0516, test_f1: 0.5503
 epoch: 76, train_loss: 0.7100, test_loss: 0.9624, test_f1: 0.5521
 epoch: 77, train_loss: 0.6996, test_loss: 1.0638, test_f1: 0.5365
 epoch: 78, train_loss: 0.7123, test_loss: 1.0800, test_f1: 0.5527
 epoch: 79, train_loss: 0.7354, test_loss: 1.1457, test_f1: 0.5344
 epoch: 80, train_loss: 0.7119, test_loss: 1.0659, test_f1: 0.5296
 epoch: 81, train_loss: 0.7161, test_loss: 0.9635, test_f1: 0.5653
 epoch: 82, train_loss: 0.7122, test_loss: 1.0842, test_f1: 0.5417
 epoch: 83, train_loss: 0.6995, test_loss: 1.2094, test_f1: 0.5370
 epoch: 84, train_loss: 0.7043, test_loss: 1.1957, test_f1: 0.5620
 epoch: 85, train_loss: 0.6921, test_loss: 1.0694, test_f1: 0.5578
 epoch: 86, train_loss: 0.6901, test_loss: 1.0428, test_f1: 0.5438
 epoch: 87, train_loss: 0.7048, test_loss: 1.0826, test_f1: 0.5540
 epoch: 88, train_loss: 0.6892, test_loss: 1.1726, test_f1: 0.5664
 epoch: 89, train_loss: 0.6782, test_loss: 1.2555, test_f1: 0.5518
 epoch: 90, train_loss: 0.6820, test_loss: 1.2449, test_f1: 0.5299
 epoch: 91, train_loss: 0.6754, test_loss: 1.0896, test_f1: 0.5572
 epoch: 92, train_loss: 0.6859, test_loss: 1.2808, test_f1: 0.5437
 epoch: 93, train_loss: 0.6739, test_loss: 1.1099, test_f1: 0.5755
 epoch: 94, train_loss: 0.7048, test_loss: 1.0446, test_f1: 0.5720
 epoch: 95, train_loss: 0.6965, test_loss: 1.3194, test_f1: 0.5585
 epoch: 96, train_loss: 0.6707, test_loss: 1.1889, test_f1: 0.5436
 epoch: 97, train_loss: 0.6785, test_loss: 1.0879, test_f1: 0.5515
 epoch: 98, train_loss: 0.6616, test_loss: 1.3451, test_f1: 0.5299
 epoch: 99, train_loss: 0.6664, test_loss: 1.0542, test_f1: 0.5741
##################ITERATION #1 ****************************************
 epoch: 0, train_loss: 1.2570, test_loss: 1.1865, test_f1: 0.4147
 epoch: 1, train_loss: 1.1843, test_loss: 1.0782, test_f1: 0.4372
 epoch: 2, train_loss: 1.1254, test_loss: 1.0372, test_f1: 0.4577
 epoch: 3, train_loss: 1.0892, test_loss: 1.0250, test_f1: 0.4765
 epoch: 4, train_loss: 1.0533, test_loss: 0.9424, test_f1: 0.4766
 epoch: 5, train_loss: 1.0329, test_loss: 0.9523, test_f1: 0.4732
 epoch: 6, train_loss: 1.0232, test_loss: 0.9631, test_f1: 0.4997
 epoch: 7, train_loss: 1.0025, test_loss: 0.9816, test_f1: 0.4558
 epoch: 8, train_loss: 0.9978, test_loss: 0.9582, test_f1: 0.4986
 epoch: 9, train_loss: 0.9810, test_loss: 0.9549, test_f1: 0.5098
 epoch: 10, train_loss: 0.9628, test_loss: 1.0291, test_f1: 0.4767
 epoch: 11, train_loss: 0.9567, test_loss: 0.9661, test_f1: 0.5231
 epoch: 12, train_loss: 0.9483, test_loss: 0.9907, test_f1: 0.4861
 epoch: 13, train_loss: 0.9485, test_loss: 0.9892, test_f1: 0.4971
 epoch: 14, train_loss: 0.9279, test_loss: 1.0815, test_f1: 0.4783
 epoch: 15, train_loss: 0.9450, test_loss: 1.0403, test_f1: 0.4891
 epoch: 16, train_loss: 0.9239, test_loss: 0.9777, test_f1: 0.5093
 epoch: 17, train_loss: 0.9194, test_loss: 1.0261, test_f1: 0.4801
 epoch: 18, train_loss: 0.8949, test_loss: 1.0305, test_f1: 0.5117
 epoch: 19, train_loss: 0.8882, test_loss: 1.1270, test_f1: 0.4814
 epoch: 20, train_loss: 0.9007, test_loss: 1.0781, test_f1: 0.4831
 epoch: 21, train_loss: 0.8778, test_loss: 1.2426, test_f1: 0.4981
 epoch: 22, train_loss: 0.8680, test_loss: 1.2050, test_f1: 0.4825
 epoch: 23, train_loss: 0.8659, test_loss: 1.3430, test_f1: 0.4799
 epoch: 24, train_loss: 0.8675, test_loss: 1.1811, test_f1: 0.5014
 epoch: 25, train_loss: 0.8657, test_loss: 1.0050, test_f1: 0.5170
 epoch: 26, train_loss: 0.8573, test_loss: 1.0139, test_f1: 0.5065
 epoch: 27, train_loss: 0.8621, test_loss: 0.9507, test_f1: 0.5289
 epoch: 28, train_loss: 0.8589, test_loss: 1.1079, test_f1: 0.5154
 epoch: 29, train_loss: 0.8489, test_loss: 1.1152, test_f1: 0.4795
 epoch: 30, train_loss: 0.8597, test_loss: 0.9981, test_f1: 0.5214
 epoch: 31, train_loss: 0.8391, test_loss: 0.9739, test_f1: 0.5360
 epoch: 32, train_loss: 0.8449, test_loss: 0.9392, test_f1: 0.5149
 epoch: 33, train_loss: 0.8430, test_loss: 1.1089, test_f1: 0.4937
 epoch: 34, train_loss: 0.8420, test_loss: 1.0973, test_f1: 0.4934
 epoch: 35, train_loss: 0.8332, test_loss: 1.1661, test_f1: 0.4794
 epoch: 36, train_loss: 0.8447, test_loss: 1.0226, test_f1: 0.5343
 epoch: 37, train_loss: 0.8218, test_loss: 0.8963, test_f1: 0.5549
 epoch: 38, train_loss: 0.8202, test_loss: 1.0381, test_f1: 0.5405
 epoch: 39, train_loss: 0.8205, test_loss: 1.0365, test_f1: 0.5114
 epoch: 40, train_loss: 0.8178, test_loss: 1.4060, test_f1: 0.4979
 epoch: 41, train_loss: 0.8131, test_loss: 1.0053, test_f1: 0.5197
 epoch: 42, train_loss: 0.8140, test_loss: 1.0097, test_f1: 0.5742
 epoch: 43, train_loss: 0.8286, test_loss: 1.0389, test_f1: 0.5457
 epoch: 44, train_loss: 0.7948, test_loss: 0.9973, test_f1: 0.5401
 epoch: 45, train_loss: 0.8077, test_loss: 1.1484, test_f1: 0.5141
 epoch: 46, train_loss: 0.8013, test_loss: 0.9976, test_f1: 0.5067
 epoch: 47, train_loss: 0.7973, test_loss: 1.1364, test_f1: 0.5006
 epoch: 48, train_loss: 0.8014, test_loss: 1.0339, test_f1: 0.5434
 epoch: 49, train_loss: 0.8129, test_loss: 1.0143, test_f1: 0.5176
 epoch: 50, train_loss: 0.7866, test_loss: 1.2572, test_f1: 0.5356
 epoch: 51, train_loss: 0.7571, test_loss: 1.2814, test_f1: 0.5150
 epoch: 52, train_loss: 0.7376, test_loss: 1.0672, test_f1: 0.5417
 epoch: 53, train_loss: 0.7483, test_loss: 1.3250, test_f1: 0.5570
 epoch: 54, train_loss: 0.7372, test_loss: 1.0311, test_f1: 0.5538
 epoch: 55, train_loss: 0.7371, test_loss: 0.9907, test_f1: 0.5663
 epoch: 56, train_loss: 0.7359, test_loss: 0.9175, test_f1: 0.6073
 epoch: 57, train_loss: 0.7326, test_loss: 1.3787, test_f1: 0.5199
 epoch: 58, train_loss: 0.7347, test_loss: 0.9735, test_f1: 0.5601
 epoch: 59, train_loss: 0.7216, test_loss: 0.9988, test_f1: 0.5686
 epoch: 60, train_loss: 0.7059, test_loss: 1.1632, test_f1: 0.5546
 epoch: 61, train_loss: 0.7267, test_loss: 1.0365, test_f1: 0.5563
 epoch: 62, train_loss: 0.7265, test_loss: 1.1384, test_f1: 0.5416
 epoch: 63, train_loss: 0.7161, test_loss: 1.0208, test_f1: 0.5388
 epoch: 64, train_loss: 0.7066, test_loss: 1.0071, test_f1: 0.5614
 epoch: 65, train_loss: 0.7125, test_loss: 1.4652, test_f1: 0.5127
 epoch: 66, train_loss: 0.7358, test_loss: 1.1965, test_f1: 0.5319
 epoch: 67, train_loss: 0.7197, test_loss: 1.0053, test_f1: 0.5757
 epoch: 68, train_loss: 0.7111, test_loss: 1.0747, test_f1: 0.5527
 epoch: 69, train_loss: 0.7010, test_loss: 1.0109, test_f1: 0.5732
 epoch: 70, train_loss: 0.6896, test_loss: 0.9998, test_f1: 0.5825
 epoch: 71, train_loss: 0.6877, test_loss: 1.0453, test_f1: 0.5782
 epoch: 72, train_loss: 0.6979, test_loss: 0.9813, test_f1: 0.5655
 epoch: 73, train_loss: 0.6821, test_loss: 0.9796, test_f1: 0.5711
 epoch: 74, train_loss: 0.6801, test_loss: 0.9748, test_f1: 0.5801
 epoch: 75, train_loss: 0.6651, test_loss: 1.0219, test_f1: 0.5836
 epoch: 76, train_loss: 0.6870, test_loss: 1.0445, test_f1: 0.5420
 epoch: 77, train_loss: 0.6727, test_loss: 1.0388, test_f1: 0.5796
 epoch: 78, train_loss: 0.6848, test_loss: 1.0420, test_f1: 0.5447
 epoch: 79, train_loss: 0.6916, test_loss: 1.0307, test_f1: 0.5326
 epoch: 80, train_loss: 0.6600, test_loss: 0.9542, test_f1: 0.5769
 epoch: 81, train_loss: 0.6548, test_loss: 1.2199, test_f1: 0.5527
 epoch: 82, train_loss: 0.6551, test_loss: 0.9972, test_f1: 0.5828
 epoch: 83, train_loss: 0.6716, test_loss: 1.1497, test_f1: 0.5744
 epoch: 84, train_loss: 0.6518, test_loss: 1.0498, test_f1: 0.5612
 epoch: 85, train_loss: 0.6517, test_loss: 1.0481, test_f1: 0.5514
 epoch: 86, train_loss: 0.6501, test_loss: 0.9869, test_f1: 0.5821
 epoch: 87, train_loss: 0.6313, test_loss: 1.0542, test_f1: 0.5624
 epoch: 88, train_loss: 0.6520, test_loss: 0.9435, test_f1: 0.5272
 epoch: 89, train_loss: 0.6568, test_loss: 1.0381, test_f1: 0.5537
 epoch: 90, train_loss: 0.6538, test_loss: 1.1009, test_f1: 0.5533
 epoch: 91, train_loss: 0.6730, test_loss: 1.2848, test_f1: 0.5340
 epoch: 92, train_loss: 0.6458, test_loss: 1.0782, test_f1: 0.5505
 epoch: 93, train_loss: 0.6331, test_loss: 1.0478, test_f1: 0.5589
 epoch: 94, train_loss: 0.6314, test_loss: 1.1085, test_f1: 0.5617
 epoch: 95, train_loss: 0.6290, test_loss: 1.0338, test_f1: 0.5911
 epoch: 96, train_loss: 0.6199, test_loss: 1.1331, test_f1: 0.5475
 epoch: 97, train_loss: 0.6171, test_loss: 1.1799, test_f1: 0.5739
 epoch: 98, train_loss: 0.6354, test_loss: 0.9708, test_f1: 0.5740
 epoch: 99, train_loss: 0.6380, test_loss: 1.2510, test_f1: 0.5395
##################ITERATION #2 ****************************************
 epoch: 0, train_loss: 1.3237, test_loss: 1.2866, test_f1: 0.2288
 epoch: 1, train_loss: 1.2591, test_loss: 1.2159, test_f1: 0.2708
 epoch: 2, train_loss: 1.2235, test_loss: 1.1758, test_f1: 0.3398
 epoch: 3, train_loss: 1.1811, test_loss: 1.1496, test_f1: 0.4229
 epoch: 4, train_loss: 1.1201, test_loss: 1.0597, test_f1: 0.4102
 epoch: 5, train_loss: 1.0815, test_loss: 1.0097, test_f1: 0.4641
 epoch: 6, train_loss: 1.0433, test_loss: 0.9962, test_f1: 0.4523
 epoch: 7, train_loss: 1.0510, test_loss: 1.0897, test_f1: 0.3845
 epoch: 8, train_loss: 1.0330, test_loss: 0.9471, test_f1: 0.4753
 epoch: 9, train_loss: 1.0231, test_loss: 1.0180, test_f1: 0.4526
 epoch: 10, train_loss: 1.0007, test_loss: 0.9470, test_f1: 0.4473
 epoch: 11, train_loss: 0.9707, test_loss: 1.0213, test_f1: 0.4679
 epoch: 12, train_loss: 0.9698, test_loss: 0.9452, test_f1: 0.4777
 epoch: 13, train_loss: 0.9620, test_loss: 1.1328, test_f1: 0.4061
 epoch: 14, train_loss: 0.9666, test_loss: 1.0484, test_f1: 0.5040
 epoch: 15, train_loss: 0.9508, test_loss: 1.0292, test_f1: 0.4544
 epoch: 16, train_loss: 0.9379, test_loss: 1.0472, test_f1: 0.4777
 epoch: 17, train_loss: 0.9597, test_loss: 0.9066, test_f1: 0.5088
 epoch: 18, train_loss: 0.9391, test_loss: 1.0127, test_f1: 0.4853
 epoch: 19, train_loss: 0.9355, test_loss: 0.9539, test_f1: 0.4855
 epoch: 20, train_loss: 0.9371, test_loss: 1.0000, test_f1: 0.5142
 epoch: 21, train_loss: 0.9204, test_loss: 1.0735, test_f1: 0.4541
 epoch: 22, train_loss: 0.9188, test_loss: 1.0698, test_f1: 0.4548
 epoch: 23, train_loss: 0.9051, test_loss: 1.0002, test_f1: 0.4611
 epoch: 24, train_loss: 0.9108, test_loss: 0.9801, test_f1: 0.4969
 epoch: 25, train_loss: 0.9040, test_loss: 1.2048, test_f1: 0.4333
 epoch: 26, train_loss: 0.8951, test_loss: 1.1456, test_f1: 0.4940
 epoch: 27, train_loss: 0.8882, test_loss: 1.1055, test_f1: 0.4593
 epoch: 28, train_loss: 0.8928, test_loss: 1.0810, test_f1: 0.4956
 epoch: 29, train_loss: 0.8792, test_loss: 1.0577, test_f1: 0.4906
 epoch: 30, train_loss: 0.8641, test_loss: 1.0452, test_f1: 0.4727
 epoch: 31, train_loss: 0.8956, test_loss: 1.0108, test_f1: 0.4601
 epoch: 32, train_loss: 0.8799, test_loss: 1.0470, test_f1: 0.5166
 epoch: 33, train_loss: 0.8755, test_loss: 1.0180, test_f1: 0.5210
 epoch: 34, train_loss: 0.8637, test_loss: 1.0571, test_f1: 0.5019
 epoch: 35, train_loss: 0.8746, test_loss: 1.0498, test_f1: 0.4940
 epoch: 36, train_loss: 0.8604, test_loss: 1.0678, test_f1: 0.4880
 epoch: 37, train_loss: 0.8429, test_loss: 1.0604, test_f1: 0.4856
 epoch: 38, train_loss: 0.8687, test_loss: 1.0541, test_f1: 0.4821
 epoch: 39, train_loss: 0.8401, test_loss: 1.0386, test_f1: 0.5143
 epoch: 40, train_loss: 0.8427, test_loss: 1.0600, test_f1: 0.4920
 epoch: 41, train_loss: 0.8561, test_loss: 1.1688, test_f1: 0.4628
 epoch: 42, train_loss: 0.8682, test_loss: 1.0715, test_f1: 0.4996
 epoch: 43, train_loss: 0.8571, test_loss: 1.0240, test_f1: 0.4830
 epoch: 44, train_loss: 0.8482, test_loss: 1.0725, test_f1: 0.4844
 epoch: 45, train_loss: 0.8470, test_loss: 1.0915, test_f1: 0.4795
 epoch: 46, train_loss: 0.8262, test_loss: 1.0529, test_f1: 0.5090
 epoch: 47, train_loss: 0.8120, test_loss: 1.0962, test_f1: 0.5123
 epoch: 48, train_loss: 0.8310, test_loss: 1.1080, test_f1: 0.4788
 epoch: 49, train_loss: 0.8447, test_loss: 1.0701, test_f1: 0.4909
 epoch: 50, train_loss: 0.8388, test_loss: 1.0926, test_f1: 0.5153
 epoch: 51, train_loss: 0.8074, test_loss: 1.0803, test_f1: 0.5209
 epoch: 52, train_loss: 0.8067, test_loss: 1.0724, test_f1: 0.5380
 epoch: 53, train_loss: 0.7827, test_loss: 1.1067, test_f1: 0.5024
 epoch: 54, train_loss: 0.7951, test_loss: 1.1155, test_f1: 0.5198
 epoch: 55, train_loss: 0.7743, test_loss: 1.1414, test_f1: 0.4907
 epoch: 56, train_loss: 0.7779, test_loss: 1.0763, test_f1: 0.5657
 epoch: 57, train_loss: 0.7757, test_loss: 1.2229, test_f1: 0.4954
 epoch: 58, train_loss: 0.7778, test_loss: 1.0823, test_f1: 0.5250
 epoch: 59, train_loss: 0.7791, test_loss: 1.0827, test_f1: 0.5521
 epoch: 60, train_loss: 0.7640, test_loss: 1.0582, test_f1: 0.5077
 epoch: 61, train_loss: 0.7735, test_loss: 0.9820, test_f1: 0.5343
 epoch: 62, train_loss: 0.7694, test_loss: 1.0260, test_f1: 0.5271
 epoch: 63, train_loss: 0.7513, test_loss: 1.0321, test_f1: 0.5626
 epoch: 64, train_loss: 0.7592, test_loss: 1.1284, test_f1: 0.5293
 epoch: 65, train_loss: 0.7541, test_loss: 1.0462, test_f1: 0.5637
 epoch: 66, train_loss: 0.7526, test_loss: 1.0104, test_f1: 0.5620
 epoch: 67, train_loss: 0.7573, test_loss: 1.1489, test_f1: 0.5515
 epoch: 68, train_loss: 0.7532, test_loss: 1.1016, test_f1: 0.5141
 epoch: 69, train_loss: 0.7547, test_loss: 1.1069, test_f1: 0.5472
 epoch: 70, train_loss: 0.7591, test_loss: 1.0785, test_f1: 0.5303
 epoch: 71, train_loss: 0.7586, test_loss: 1.0793, test_f1: 0.5252
 epoch: 72, train_loss: 0.7297, test_loss: 1.2340, test_f1: 0.5096
 epoch: 73, train_loss: 0.7412, test_loss: 1.1630, test_f1: 0.5101
 epoch: 74, train_loss: 0.7380, test_loss: 1.0477, test_f1: 0.5747
 epoch: 75, train_loss: 0.7516, test_loss: 1.2146, test_f1: 0.5292
 epoch: 76, train_loss: 0.7397, test_loss: 1.1300, test_f1: 0.5349
 epoch: 77, train_loss: 0.7291, test_loss: 1.1284, test_f1: 0.5427
 epoch: 78, train_loss: 0.7267, test_loss: 1.0944, test_f1: 0.5467
 epoch: 79, train_loss: 0.7310, test_loss: 1.0335, test_f1: 0.5449
 epoch: 80, train_loss: 0.7272, test_loss: 1.2740, test_f1: 0.5376
 epoch: 81, train_loss: 0.7336, test_loss: 1.0452, test_f1: 0.5514
 epoch: 82, train_loss: 0.7177, test_loss: 1.1676, test_f1: 0.5168
 epoch: 83, train_loss: 0.7183, test_loss: 1.0491, test_f1: 0.5642
 epoch: 84, train_loss: 0.7235, test_loss: 0.9910, test_f1: 0.5582
 epoch: 85, train_loss: 0.7090, test_loss: 1.0890, test_f1: 0.5799
 epoch: 86, train_loss: 0.7112, test_loss: 1.2496, test_f1: 0.5264
 epoch: 87, train_loss: 0.7206, test_loss: 1.1068, test_f1: 0.5593
 epoch: 88, train_loss: 0.7039, test_loss: 1.1846, test_f1: 0.5449
 epoch: 89, train_loss: 0.7019, test_loss: 1.1765, test_f1: 0.5521
 epoch: 90, train_loss: 0.7116, test_loss: 1.1109, test_f1: 0.5549
 epoch: 91, train_loss: 0.7135, test_loss: 1.0720, test_f1: 0.5559
 epoch: 92, train_loss: 0.6936, test_loss: 1.2195, test_f1: 0.5303
 epoch: 93, train_loss: 0.7066, test_loss: 1.2056, test_f1: 0.5312
 epoch: 94, train_loss: 0.7006, test_loss: 1.2630, test_f1: 0.5304
 epoch: 95, train_loss: 0.6959, test_loss: 1.1340, test_f1: 0.5588
 epoch: 96, train_loss: 0.6876, test_loss: 1.0871, test_f1: 0.5810
 epoch: 97, train_loss: 0.6928, test_loss: 1.1941, test_f1: 0.5636
 epoch: 98, train_loss: 0.6861, test_loss: 1.2951, test_f1: 0.4988
 epoch: 99, train_loss: 0.6945, test_loss: 1.1008, test_f1: 0.5671
##################ITERATION #3 ****************************************
 epoch: 0, train_loss: 1.2725, test_loss: 1.2518, test_f1: 0.3167
 epoch: 1, train_loss: 1.1687, test_loss: 1.0520, test_f1: 0.4834
 epoch: 2, train_loss: 1.1121, test_loss: 1.0353, test_f1: 0.4722
 epoch: 3, train_loss: 1.0674, test_loss: 0.9953, test_f1: 0.4960
 epoch: 4, train_loss: 1.0523, test_loss: 1.0218, test_f1: 0.4439
 epoch: 5, train_loss: 1.0228, test_loss: 0.9880, test_f1: 0.5041
 epoch: 6, train_loss: 1.0171, test_loss: 0.9521, test_f1: 0.4970
 epoch: 7, train_loss: 0.9874, test_loss: 0.9683, test_f1: 0.5008
 epoch: 8, train_loss: 0.9815, test_loss: 0.9933, test_f1: 0.4841
 epoch: 9, train_loss: 0.9656, test_loss: 1.0098, test_f1: 0.5363
 epoch: 10, train_loss: 0.9472, test_loss: 0.9918, test_f1: 0.5040
 epoch: 11, train_loss: 0.9405, test_loss: 0.9965, test_f1: 0.5167
 epoch: 12, train_loss: 0.9333, test_loss: 1.0105, test_f1: 0.5024
 epoch: 13, train_loss: 0.9263, test_loss: 0.9980, test_f1: 0.5074
 epoch: 14, train_loss: 0.9132, test_loss: 1.0187, test_f1: 0.4770
 epoch: 15, train_loss: 0.9285, test_loss: 0.9492, test_f1: 0.5032
 epoch: 16, train_loss: 0.9214, test_loss: 1.0694, test_f1: 0.5478
 epoch: 17, train_loss: 0.8998, test_loss: 0.9852, test_f1: 0.5676
 epoch: 18, train_loss: 0.9091, test_loss: 1.0246, test_f1: 0.5093
 epoch: 19, train_loss: 0.9235, test_loss: 0.9831, test_f1: 0.5110
 epoch: 20, train_loss: 0.8900, test_loss: 0.9489, test_f1: 0.5500
 epoch: 21, train_loss: 0.8968, test_loss: 1.0962, test_f1: 0.5192
 epoch: 22, train_loss: 0.8712, test_loss: 0.9995, test_f1: 0.5335
 epoch: 23, train_loss: 0.8667, test_loss: 1.0248, test_f1: 0.5470
 epoch: 24, train_loss: 0.8831, test_loss: 0.9758, test_f1: 0.5400
 epoch: 25, train_loss: 0.8641, test_loss: 1.0669, test_f1: 0.5385
 epoch: 26, train_loss: 0.8608, test_loss: 0.9467, test_f1: 0.5237
 epoch: 27, train_loss: 0.8609, test_loss: 1.0588, test_f1: 0.5286
 epoch: 28, train_loss: 0.8413, test_loss: 0.9450, test_f1: 0.5248
 epoch: 29, train_loss: 0.8597, test_loss: 1.0273, test_f1: 0.5045
 epoch: 30, train_loss: 0.8452, test_loss: 1.2508, test_f1: 0.5197
 epoch: 31, train_loss: 0.8356, test_loss: 1.0539, test_f1: 0.5303
 epoch: 32, train_loss: 0.8477, test_loss: 0.9748, test_f1: 0.5396
 epoch: 33, train_loss: 0.8594, test_loss: 1.0980, test_f1: 0.4855
 epoch: 34, train_loss: 0.8372, test_loss: 0.9468, test_f1: 0.5340
 epoch: 35, train_loss: 0.8404, test_loss: 1.0187, test_f1: 0.5361
 epoch: 36, train_loss: 0.8337, test_loss: 0.9790, test_f1: 0.5454
 epoch: 37, train_loss: 0.8220, test_loss: 0.9706, test_f1: 0.5186
 epoch: 38, train_loss: 0.8370, test_loss: 1.1522, test_f1: 0.5306
 epoch: 39, train_loss: 0.8190, test_loss: 1.2536, test_f1: 0.5248
 epoch: 40, train_loss: 0.8182, test_loss: 1.0008, test_f1: 0.5399
 epoch: 41, train_loss: 0.8077, test_loss: 0.9908, test_f1: 0.5553
 epoch: 42, train_loss: 0.8146, test_loss: 1.3355, test_f1: 0.5392
 epoch: 43, train_loss: 0.8256, test_loss: 1.0008, test_f1: 0.5513
 epoch: 44, train_loss: 0.7879, test_loss: 1.0552, test_f1: 0.5168
 epoch: 45, train_loss: 0.8038, test_loss: 1.0175, test_f1: 0.5519
 epoch: 46, train_loss: 0.8087, test_loss: 0.9642, test_f1: 0.5715
 epoch: 47, train_loss: 0.8208, test_loss: 0.9472, test_f1: 0.5607
 epoch: 48, train_loss: 0.7959, test_loss: 0.9885, test_f1: 0.5316
 epoch: 49, train_loss: 0.8017, test_loss: 1.0241, test_f1: 0.5429
 epoch: 50, train_loss: 0.7927, test_loss: 0.9870, test_f1: 0.5776
 epoch: 51, train_loss: 0.7620, test_loss: 1.0124, test_f1: 0.5716
 epoch: 52, train_loss: 0.7567, test_loss: 1.0200, test_f1: 0.5610
 epoch: 53, train_loss: 0.7401, test_loss: 1.0130, test_f1: 0.5723
 epoch: 54, train_loss: 0.7458, test_loss: 1.0227, test_f1: 0.5643
 epoch: 55, train_loss: 0.7470, test_loss: 1.0441, test_f1: 0.5472
 epoch: 56, train_loss: 0.7400, test_loss: 0.9605, test_f1: 0.5696
 epoch: 57, train_loss: 0.7255, test_loss: 0.9917, test_f1: 0.5737
 epoch: 58, train_loss: 0.7447, test_loss: 1.0190, test_f1: 0.5627
 epoch: 59, train_loss: 0.7336, test_loss: 0.9791, test_f1: 0.5685
 epoch: 60, train_loss: 0.7263, test_loss: 0.9788, test_f1: 0.5676
 epoch: 61, train_loss: 0.7144, test_loss: 1.0371, test_f1: 0.5641
 epoch: 62, train_loss: 0.7312, test_loss: 1.0750, test_f1: 0.5657
 epoch: 63, train_loss: 0.7263, test_loss: 0.9935, test_f1: 0.5629
 epoch: 64, train_loss: 0.7275, test_loss: 0.9957, test_f1: 0.5582
 epoch: 65, train_loss: 0.7047, test_loss: 1.0907, test_f1: 0.5432
 epoch: 66, train_loss: 0.7112, test_loss: 1.0056, test_f1: 0.5681
 epoch: 67, train_loss: 0.7228, test_loss: 1.0362, test_f1: 0.5504
 epoch: 68, train_loss: 0.7165, test_loss: 1.0130, test_f1: 0.5706
 epoch: 69, train_loss: 0.7030, test_loss: 1.0468, test_f1: 0.5603
 epoch: 70, train_loss: 0.7278, test_loss: 0.9968, test_f1: 0.5699
 epoch: 71, train_loss: 0.6960, test_loss: 0.9911, test_f1: 0.5613
 epoch: 72, train_loss: 0.7053, test_loss: 1.0510, test_f1: 0.5680
 epoch: 73, train_loss: 0.7007, test_loss: 0.9999, test_f1: 0.5773
 epoch: 74, train_loss: 0.6943, test_loss: 0.9837, test_f1: 0.6006
 epoch: 75, train_loss: 0.6953, test_loss: 1.0517, test_f1: 0.5804
 epoch: 76, train_loss: 0.7020, test_loss: 0.9984, test_f1: 0.5618
 epoch: 77, train_loss: 0.7118, test_loss: 1.0621, test_f1: 0.5653
 epoch: 78, train_loss: 0.6991, test_loss: 1.2314, test_f1: 0.5268
 epoch: 79, train_loss: 0.6946, test_loss: 0.9922, test_f1: 0.5660
 epoch: 80, train_loss: 0.7083, test_loss: 1.1148, test_f1: 0.5342
 epoch: 81, train_loss: 0.7300, test_loss: 1.0478, test_f1: 0.5729
 epoch: 82, train_loss: 0.7296, test_loss: 1.0524, test_f1: 0.5645
 epoch: 83, train_loss: 0.6980, test_loss: 1.0261, test_f1: 0.5706
 epoch: 84, train_loss: 0.6857, test_loss: 1.1106, test_f1: 0.5595
 epoch: 85, train_loss: 0.6734, test_loss: 1.0369, test_f1: 0.5660
 epoch: 86, train_loss: 0.6880, test_loss: 1.0595, test_f1: 0.5796
 epoch: 87, train_loss: 0.6974, test_loss: 1.1601, test_f1: 0.5688
 epoch: 88, train_loss: 0.7017, test_loss: 1.0909, test_f1: 0.5795
 epoch: 89, train_loss: 0.6868, test_loss: 0.9758, test_f1: 0.5500
 epoch: 90, train_loss: 0.6776, test_loss: 1.0823, test_f1: 0.5888
 epoch: 91, train_loss: 0.6928, test_loss: 1.0941, test_f1: 0.5435
 epoch: 92, train_loss: 0.6966, test_loss: 0.9842, test_f1: 0.5586
 epoch: 93, train_loss: 0.6925, test_loss: 1.0538, test_f1: 0.5529
 epoch: 94, train_loss: 0.6850, test_loss: 1.0502, test_f1: 0.5680
 epoch: 95, train_loss: 0.6757, test_loss: 1.0550, test_f1: 0.5874
 epoch: 96, train_loss: 0.6541, test_loss: 1.0568, test_f1: 0.5750
 epoch: 97, train_loss: 0.6580, test_loss: 1.0316, test_f1: 0.5709
 epoch: 98, train_loss: 0.6766, test_loss: 0.9948, test_f1: 0.5767
 epoch: 99, train_loss: 0.6735, test_loss: 1.0449, test_f1: 0.5783
##################ITERATION #4 ****************************************
 epoch: 0, train_loss: 1.3079, test_loss: 1.1939, test_f1: 0.3815
 epoch: 1, train_loss: 1.2054, test_loss: 1.0963, test_f1: 0.4187
 epoch: 2, train_loss: 1.1415, test_loss: 1.0486, test_f1: 0.4603
 epoch: 3, train_loss: 1.0982, test_loss: 1.0384, test_f1: 0.4583
 epoch: 4, train_loss: 1.0738, test_loss: 0.9985, test_f1: 0.4680
 epoch: 5, train_loss: 1.0447, test_loss: 1.4211, test_f1: 0.4185
 epoch: 6, train_loss: 1.0366, test_loss: 0.9837, test_f1: 0.4584
 epoch: 7, train_loss: 1.0043, test_loss: 0.9594, test_f1: 0.4753
 epoch: 8, train_loss: 1.0007, test_loss: 0.9257, test_f1: 0.5256
 epoch: 9, train_loss: 0.9947, test_loss: 0.9519, test_f1: 0.4765
 epoch: 10, train_loss: 0.9684, test_loss: 1.0008, test_f1: 0.4734
 epoch: 11, train_loss: 0.9559, test_loss: 0.9484, test_f1: 0.5016
 epoch: 12, train_loss: 0.9380, test_loss: 0.9339, test_f1: 0.5455
 epoch: 13, train_loss: 0.9383, test_loss: 0.9143, test_f1: 0.5290
 epoch: 14, train_loss: 0.9308, test_loss: 0.9421, test_f1: 0.4813
 epoch: 15, train_loss: 0.9415, test_loss: 1.0305, test_f1: 0.4884
 epoch: 16, train_loss: 0.9030, test_loss: 0.9402, test_f1: 0.4984
 epoch: 17, train_loss: 0.9221, test_loss: 0.9600, test_f1: 0.5304
 epoch: 18, train_loss: 0.8947, test_loss: 0.9596, test_f1: 0.5069
 epoch: 19, train_loss: 0.8885, test_loss: 1.0098, test_f1: 0.4775
 epoch: 20, train_loss: 0.8954, test_loss: 1.0117, test_f1: 0.5188
 epoch: 21, train_loss: 0.8854, test_loss: 0.9929, test_f1: 0.5408
 epoch: 22, train_loss: 0.8879, test_loss: 1.0154, test_f1: 0.5022
 epoch: 23, train_loss: 0.8779, test_loss: 1.0470, test_f1: 0.4662
 epoch: 24, train_loss: 0.8825, test_loss: 1.0049, test_f1: 0.5580
 epoch: 25, train_loss: 0.8569, test_loss: 1.0523, test_f1: 0.4929
 epoch: 26, train_loss: 0.8634, test_loss: 1.0401, test_f1: 0.5200
 epoch: 27, train_loss: 0.8739, test_loss: 1.1304, test_f1: 0.5230
 epoch: 28, train_loss: 0.8659, test_loss: 0.9741, test_f1: 0.5500
 epoch: 29, train_loss: 0.8417, test_loss: 1.0115, test_f1: 0.5483
 epoch: 30, train_loss: 0.8483, test_loss: 0.9872, test_f1: 0.5489
 epoch: 31, train_loss: 0.8441, test_loss: 0.9680, test_f1: 0.5326
 epoch: 32, train_loss: 0.8491, test_loss: 0.9571, test_f1: 0.5596
 epoch: 33, train_loss: 0.8298, test_loss: 1.0536, test_f1: 0.5223
 epoch: 34, train_loss: 0.8409, test_loss: 1.0806, test_f1: 0.5396
 epoch: 35, train_loss: 0.8331, test_loss: 1.0648, test_f1: 0.5525
 epoch: 36, train_loss: 0.8318, test_loss: 1.0004, test_f1: 0.5786
 epoch: 37, train_loss: 0.8192, test_loss: 0.9437, test_f1: 0.5485
 epoch: 38, train_loss: 0.8234, test_loss: 0.9892, test_f1: 0.5597
 epoch: 39, train_loss: 0.8179, test_loss: 0.9933, test_f1: 0.5366
 epoch: 40, train_loss: 0.8015, test_loss: 0.9805, test_f1: 0.5501
 epoch: 41, train_loss: 0.7928, test_loss: 0.9041, test_f1: 0.5786
 epoch: 42, train_loss: 0.8142, test_loss: 1.0236, test_f1: 0.5374
 epoch: 43, train_loss: 0.7887, test_loss: 0.9590, test_f1: 0.5389
 epoch: 44, train_loss: 0.8183, test_loss: 0.9711, test_f1: 0.5140
 epoch: 45, train_loss: 0.7974, test_loss: 1.1076, test_f1: 0.4934
 epoch: 46, train_loss: 0.8081, test_loss: 0.8902, test_f1: 0.5512
 epoch: 47, train_loss: 0.8065, test_loss: 1.0080, test_f1: 0.5583
 epoch: 48, train_loss: 0.8060, test_loss: 1.1190, test_f1: 0.5521
 epoch: 49, train_loss: 0.7968, test_loss: 0.9811, test_f1: 0.5257
 epoch: 50, train_loss: 0.7825, test_loss: 0.9623, test_f1: 0.5597
 epoch: 51, train_loss: 0.7717, test_loss: 1.0328, test_f1: 0.5388
 epoch: 52, train_loss: 0.7341, test_loss: 1.0486, test_f1: 0.5481
 epoch: 53, train_loss: 0.7350, test_loss: 0.9639, test_f1: 0.5886
 epoch: 54, train_loss: 0.7389, test_loss: 1.1445, test_f1: 0.4916
 epoch: 55, train_loss: 0.7416, test_loss: 1.0478, test_f1: 0.5358
 epoch: 56, train_loss: 0.7199, test_loss: 1.1027, test_f1: 0.5335
 epoch: 57, train_loss: 0.7291, test_loss: 1.0679, test_f1: 0.5489
 epoch: 58, train_loss: 0.7171, test_loss: 1.1008, test_f1: 0.5397
 epoch: 59, train_loss: 0.7122, test_loss: 1.1797, test_f1: 0.5691
 epoch: 60, train_loss: 0.7131, test_loss: 1.2208, test_f1: 0.5453
 epoch: 61, train_loss: 0.6996, test_loss: 1.0236, test_f1: 0.5645
 epoch: 62, train_loss: 0.6929, test_loss: 1.0365, test_f1: 0.5544
 epoch: 63, train_loss: 0.7005, test_loss: 1.2280, test_f1: 0.5747
 epoch: 64, train_loss: 0.6986, test_loss: 0.9862, test_f1: 0.5892
 epoch: 65, train_loss: 0.7092, test_loss: 1.0373, test_f1: 0.5529
 epoch: 66, train_loss: 0.6816, test_loss: 1.1332, test_f1: 0.5321
 epoch: 67, train_loss: 0.6861, test_loss: 1.1676, test_f1: 0.5485
 epoch: 68, train_loss: 0.6925, test_loss: 1.0155, test_f1: 0.5893
 epoch: 69, train_loss: 0.6942, test_loss: 1.0260, test_f1: 0.5648
 epoch: 70, train_loss: 0.6765, test_loss: 1.0502, test_f1: 0.5736
 epoch: 71, train_loss: 0.6904, test_loss: 1.0549, test_f1: 0.5947
 epoch: 72, train_loss: 0.7055, test_loss: 1.0678, test_f1: 0.5618
 epoch: 73, train_loss: 0.6918, test_loss: 1.0816, test_f1: 0.5853
 epoch: 74, train_loss: 0.6789, test_loss: 1.0751, test_f1: 0.5500
 epoch: 75, train_loss: 0.6815, test_loss: 1.2016, test_f1: 0.5541
 epoch: 76, train_loss: 0.6713, test_loss: 1.1730, test_f1: 0.5170
 epoch: 77, train_loss: 0.6770, test_loss: 0.9957, test_f1: 0.6000
 epoch: 78, train_loss: 0.6873, test_loss: 1.0736, test_f1: 0.5633
 epoch: 79, train_loss: 0.6948, test_loss: 1.0126, test_f1: 0.5784
 epoch: 80, train_loss: 0.6772, test_loss: 1.0687, test_f1: 0.5645
 epoch: 81, train_loss: 0.6730, test_loss: 0.9910, test_f1: 0.5646
 epoch: 82, train_loss: 0.6778, test_loss: 1.0473, test_f1: 0.5827
 epoch: 83, train_loss: 0.6508, test_loss: 1.2043, test_f1: 0.5475
 epoch: 84, train_loss: 0.6677, test_loss: 1.1175, test_f1: 0.5787
 epoch: 85, train_loss: 0.6534, test_loss: 1.0660, test_f1: 0.5481
 epoch: 86, train_loss: 0.6583, test_loss: 1.0379, test_f1: 0.5811
 epoch: 87, train_loss: 0.6507, test_loss: 1.0139, test_f1: 0.5664
 epoch: 88, train_loss: 0.6231, test_loss: 1.1789, test_f1: 0.5376
 epoch: 89, train_loss: 0.6359, test_loss: 1.0492, test_f1: 0.5632
 epoch: 90, train_loss: 0.6331, test_loss: 1.1108, test_f1: 0.5770
 epoch: 91, train_loss: 0.6543, test_loss: 1.0972, test_f1: 0.5304
 epoch: 92, train_loss: 0.6420, test_loss: 1.0962, test_f1: 0.5585
 epoch: 93, train_loss: 0.6347, test_loss: 1.2485, test_f1: 0.5157
 epoch: 94, train_loss: 0.6351, test_loss: 1.2528, test_f1: 0.5546
 epoch: 95, train_loss: 0.6487, test_loss: 1.0340, test_f1: 0.5982
 epoch: 96, train_loss: 0.6394, test_loss: 1.2205, test_f1: 0.5279
 epoch: 97, train_loss: 0.6423, test_loss: 1.1855, test_f1: 0.5553
 epoch: 98, train_loss: 0.6325, test_loss: 1.0844, test_f1: 0.5561
 epoch: 99, train_loss: 0.6125, test_loss: 1.1100, test_f1: 0.5995
##################ITERATION #5 ****************************************
 epoch: 0, train_loss: 1.3244, test_loss: 1.2307, test_f1: 0.4102
 epoch: 1, train_loss: 1.2170, test_loss: 1.1430, test_f1: 0.4521
 epoch: 2, train_loss: 1.1763, test_loss: 1.0628, test_f1: 0.4923
 epoch: 3, train_loss: 1.1252, test_loss: 1.0217, test_f1: 0.5025
 epoch: 4, train_loss: 1.0995, test_loss: 1.0204, test_f1: 0.4832
 epoch: 5, train_loss: 1.0608, test_loss: 0.9987, test_f1: 0.4768
 epoch: 6, train_loss: 1.0265, test_loss: 0.9314, test_f1: 0.5007
 epoch: 7, train_loss: 1.0189, test_loss: 0.9783, test_f1: 0.5043
 epoch: 8, train_loss: 1.0096, test_loss: 1.1332, test_f1: 0.4426
 epoch: 9, train_loss: 0.9935, test_loss: 1.0361, test_f1: 0.5045
 epoch: 10, train_loss: 1.0022, test_loss: 0.9909, test_f1: 0.5096
 epoch: 11, train_loss: 0.9827, test_loss: 1.0031, test_f1: 0.4915
 epoch: 12, train_loss: 0.9508, test_loss: 1.0227, test_f1: 0.4910
 epoch: 13, train_loss: 0.9550, test_loss: 1.0589, test_f1: 0.4740
 epoch: 14, train_loss: 0.9536, test_loss: 1.0054, test_f1: 0.5093
 epoch: 15, train_loss: 0.9456, test_loss: 0.9331, test_f1: 0.4631
 epoch: 16, train_loss: 0.9553, test_loss: 1.1017, test_f1: 0.4751
 epoch: 17, train_loss: 0.9469, test_loss: 1.0418, test_f1: 0.4775
 epoch: 18, train_loss: 0.9259, test_loss: 0.9944, test_f1: 0.4586
 epoch: 19, train_loss: 0.9064, test_loss: 1.1220, test_f1: 0.4637
 epoch: 20, train_loss: 0.8978, test_loss: 0.9403, test_f1: 0.5168
 epoch: 21, train_loss: 0.8960, test_loss: 1.0462, test_f1: 0.5153
 epoch: 22, train_loss: 0.8991, test_loss: 1.0713, test_f1: 0.5237
 epoch: 23, train_loss: 0.9048, test_loss: 1.1600, test_f1: 0.4868
 epoch: 24, train_loss: 0.9049, test_loss: 1.0506, test_f1: 0.4899
 epoch: 25, train_loss: 0.8984, test_loss: 1.1843, test_f1: 0.4586
 epoch: 26, train_loss: 0.8847, test_loss: 1.0816, test_f1: 0.5226
 epoch: 27, train_loss: 0.8480, test_loss: 1.0604, test_f1: 0.5102
 epoch: 28, train_loss: 0.8842, test_loss: 1.0549, test_f1: 0.5323
 epoch: 29, train_loss: 0.8665, test_loss: 1.1165, test_f1: 0.5214
 epoch: 30, train_loss: 0.8598, test_loss: 1.0810, test_f1: 0.5020
 epoch: 31, train_loss: 0.8664, test_loss: 1.0109, test_f1: 0.5327
 epoch: 32, train_loss: 0.8624, test_loss: 1.0918, test_f1: 0.5016
 epoch: 33, train_loss: 0.8501, test_loss: 1.1041, test_f1: 0.4931
 epoch: 34, train_loss: 0.8413, test_loss: 1.1178, test_f1: 0.5235
 epoch: 35, train_loss: 0.8404, test_loss: 1.1495, test_f1: 0.5213
 epoch: 36, train_loss: 0.8411, test_loss: 1.0348, test_f1: 0.5172
 epoch: 37, train_loss: 0.8277, test_loss: 1.2154, test_f1: 0.5103
 epoch: 38, train_loss: 0.8280, test_loss: 1.1732, test_f1: 0.4995
 epoch: 39, train_loss: 0.8317, test_loss: 1.1657, test_f1: 0.5180
 epoch: 40, train_loss: 0.8190, test_loss: 1.1079, test_f1: 0.5452
 epoch: 41, train_loss: 0.8134, test_loss: 1.0791, test_f1: 0.5287
 epoch: 42, train_loss: 0.8263, test_loss: 1.1386, test_f1: 0.5209
 epoch: 43, train_loss: 0.8181, test_loss: 1.1237, test_f1: 0.5476
 epoch: 44, train_loss: 0.8189, test_loss: 1.0781, test_f1: 0.5084
 epoch: 45, train_loss: 0.8352, test_loss: 1.1120, test_f1: 0.5135
 epoch: 46, train_loss: 0.8114, test_loss: 1.0068, test_f1: 0.5287
 epoch: 47, train_loss: 0.7994, test_loss: 1.1546, test_f1: 0.5180
 epoch: 48, train_loss: 0.8246, test_loss: 1.3259, test_f1: 0.4871
 epoch: 49, train_loss: 0.8031, test_loss: 1.0622, test_f1: 0.5542
 epoch: 50, train_loss: 0.8083, test_loss: 1.0746, test_f1: 0.5721
 epoch: 51, train_loss: 0.7852, test_loss: 1.1052, test_f1: 0.5497
 epoch: 52, train_loss: 0.7667, test_loss: 1.0870, test_f1: 0.5675
 epoch: 53, train_loss: 0.7504, test_loss: 1.1288, test_f1: 0.5504
 epoch: 54, train_loss: 0.7644, test_loss: 1.1293, test_f1: 0.5498
 epoch: 55, train_loss: 0.7516, test_loss: 1.1406, test_f1: 0.5738
 epoch: 56, train_loss: 0.7475, test_loss: 1.1234, test_f1: 0.5485
 epoch: 57, train_loss: 0.7493, test_loss: 1.1313, test_f1: 0.5561
 epoch: 58, train_loss: 0.7482, test_loss: 1.1480, test_f1: 0.5589
 epoch: 59, train_loss: 0.7402, test_loss: 1.1108, test_f1: 0.5540
 epoch: 60, train_loss: 0.7464, test_loss: 1.1412, test_f1: 0.5461
 epoch: 61, train_loss: 0.7433, test_loss: 1.1386, test_f1: 0.5595
 epoch: 62, train_loss: 0.7304, test_loss: 1.1943, test_f1: 0.5533
 epoch: 63, train_loss: 0.7255, test_loss: 1.1554, test_f1: 0.5585
 epoch: 64, train_loss: 0.7347, test_loss: 1.1308, test_f1: 0.5303
 epoch: 65, train_loss: 0.7291, test_loss: 1.1033, test_f1: 0.5629
 epoch: 66, train_loss: 0.7366, test_loss: 1.1040, test_f1: 0.5625
 epoch: 67, train_loss: 0.7265, test_loss: 1.1552, test_f1: 0.5480
 epoch: 68, train_loss: 0.7277, test_loss: 1.2315, test_f1: 0.5853
 epoch: 69, train_loss: 0.7034, test_loss: 1.2418, test_f1: 0.5590
 epoch: 70, train_loss: 0.7228, test_loss: 1.1319, test_f1: 0.5821
 epoch: 71, train_loss: 0.7234, test_loss: 1.1082, test_f1: 0.5729
 epoch: 72, train_loss: 0.7118, test_loss: 1.2219, test_f1: 0.5300
 epoch: 73, train_loss: 0.7131, test_loss: 1.1597, test_f1: 0.5675
 epoch: 74, train_loss: 0.7051, test_loss: 1.1249, test_f1: 0.5854
 epoch: 75, train_loss: 0.7040, test_loss: 1.3157, test_f1: 0.5294
 epoch: 76, train_loss: 0.7117, test_loss: 1.2110, test_f1: 0.5458
 epoch: 77, train_loss: 0.7184, test_loss: 1.2253, test_f1: 0.5618
 epoch: 78, train_loss: 0.7156, test_loss: 1.1799, test_f1: 0.5452
 epoch: 79, train_loss: 0.7150, test_loss: 1.1236, test_f1: 0.5537
 epoch: 80, train_loss: 0.6979, test_loss: 1.2336, test_f1: 0.5578
 epoch: 81, train_loss: 0.7031, test_loss: 1.1649, test_f1: 0.5613
 epoch: 82, train_loss: 0.7015, test_loss: 1.1803, test_f1: 0.5863
 epoch: 83, train_loss: 0.6885, test_loss: 1.1783, test_f1: 0.5377
 epoch: 84, train_loss: 0.6846, test_loss: 1.2403, test_f1: 0.5752
 epoch: 85, train_loss: 0.6771, test_loss: 1.2642, test_f1: 0.5368
 epoch: 86, train_loss: 0.6901, test_loss: 1.2223, test_f1: 0.5361
 epoch: 87, train_loss: 0.6897, test_loss: 1.1661, test_f1: 0.5925
 epoch: 88, train_loss: 0.6863, test_loss: 1.0894, test_f1: 0.5728
 epoch: 89, train_loss: 0.6850, test_loss: 1.2541, test_f1: 0.5697
 epoch: 90, train_loss: 0.6936, test_loss: 1.1347, test_f1: 0.5788
 epoch: 91, train_loss: 0.6763, test_loss: 1.1986, test_f1: 0.5887
 epoch: 92, train_loss: 0.6882, test_loss: 1.2151, test_f1: 0.5722
 epoch: 93, train_loss: 0.6831, test_loss: 1.2184, test_f1: 0.5801
 epoch: 94, train_loss: 0.7032, test_loss: 1.2294, test_f1: 0.5675
 epoch: 95, train_loss: 0.6827, test_loss: 1.2366, test_f1: 0.5610
 epoch: 96, train_loss: 0.6729, test_loss: 1.3212, test_f1: 0.5552
 epoch: 97, train_loss: 0.6811, test_loss: 1.4107, test_f1: 0.5470
 epoch: 98, train_loss: 0.6855, test_loss: 1.3730, test_f1: 0.5383
 epoch: 99, train_loss: 0.6782, test_loss: 1.2939, test_f1: 0.5713
##################ITERATION #6 ****************************************
 epoch: 0, train_loss: 1.3007, test_loss: 1.2136, test_f1: 0.4114
 epoch: 1, train_loss: 1.2114, test_loss: 1.1509, test_f1: 0.4481
 epoch: 2, train_loss: 1.1414, test_loss: 1.0690, test_f1: 0.4655
 epoch: 3, train_loss: 1.1007, test_loss: 1.1251, test_f1: 0.3959
 epoch: 4, train_loss: 1.0988, test_loss: 1.0562, test_f1: 0.4480
 epoch: 5, train_loss: 1.0625, test_loss: 0.9453, test_f1: 0.5172
 epoch: 6, train_loss: 1.0452, test_loss: 0.9455, test_f1: 0.4935
 epoch: 7, train_loss: 1.0337, test_loss: 0.9383, test_f1: 0.5208
 epoch: 8, train_loss: 1.0113, test_loss: 0.9244, test_f1: 0.5214
 epoch: 9, train_loss: 0.9988, test_loss: 0.9238, test_f1: 0.5276
 epoch: 10, train_loss: 0.9762, test_loss: 0.9386, test_f1: 0.5268
 epoch: 11, train_loss: 0.9744, test_loss: 0.9762, test_f1: 0.4991
 epoch: 12, train_loss: 0.9573, test_loss: 0.9802, test_f1: 0.4675
 epoch: 13, train_loss: 0.9455, test_loss: 0.9159, test_f1: 0.5132
 epoch: 14, train_loss: 0.9255, test_loss: 0.9994, test_f1: 0.5194
 epoch: 15, train_loss: 0.9424, test_loss: 0.9814, test_f1: 0.5048
 epoch: 16, train_loss: 0.9229, test_loss: 0.9125, test_f1: 0.5167
 epoch: 17, train_loss: 0.9200, test_loss: 0.9877, test_f1: 0.4906
 epoch: 18, train_loss: 0.9170, test_loss: 0.9539, test_f1: 0.4733
 epoch: 19, train_loss: 0.9242, test_loss: 1.0619, test_f1: 0.4690
 epoch: 20, train_loss: 0.9154, test_loss: 0.9505, test_f1: 0.5056
 epoch: 21, train_loss: 0.8979, test_loss: 1.0087, test_f1: 0.4838
 epoch: 22, train_loss: 0.8952, test_loss: 0.9600, test_f1: 0.5167
 epoch: 23, train_loss: 0.8881, test_loss: 1.0225, test_f1: 0.5202
 epoch: 24, train_loss: 0.8737, test_loss: 0.9518, test_f1: 0.5116
 epoch: 25, train_loss: 0.8843, test_loss: 1.0009, test_f1: 0.4725
 epoch: 26, train_loss: 0.8903, test_loss: 0.9881, test_f1: 0.5138
 epoch: 27, train_loss: 0.8751, test_loss: 0.9567, test_f1: 0.5242
 epoch: 28, train_loss: 0.8701, test_loss: 0.9953, test_f1: 0.5247
 epoch: 29, train_loss: 0.8642, test_loss: 0.9901, test_f1: 0.5386
 epoch: 30, train_loss: 0.8564, test_loss: 0.9599, test_f1: 0.5359
 epoch: 31, train_loss: 0.8609, test_loss: 0.9688, test_f1: 0.5665
 epoch: 32, train_loss: 0.8554, test_loss: 1.0244, test_f1: 0.5271
 epoch: 33, train_loss: 0.8395, test_loss: 0.9402, test_f1: 0.5239
 epoch: 34, train_loss: 0.8348, test_loss: 0.9824, test_f1: 0.5559
 epoch: 35, train_loss: 0.8538, test_loss: 0.9840, test_f1: 0.5282
 epoch: 36, train_loss: 0.8605, test_loss: 0.9364, test_f1: 0.5588
 epoch: 37, train_loss: 0.8389, test_loss: 0.8780, test_f1: 0.5487
 epoch: 38, train_loss: 0.8588, test_loss: 1.0346, test_f1: 0.5383
 epoch: 39, train_loss: 0.8419, test_loss: 0.9973, test_f1: 0.5313
 epoch: 40, train_loss: 0.8376, test_loss: 0.9806, test_f1: 0.5491
 epoch: 41, train_loss: 0.8414, test_loss: 1.0117, test_f1: 0.5565
 epoch: 42, train_loss: 0.8406, test_loss: 1.1128, test_f1: 0.4804
 epoch: 43, train_loss: 0.8383, test_loss: 0.9159, test_f1: 0.5605
 epoch: 44, train_loss: 0.8228, test_loss: 0.9975, test_f1: 0.5425
 epoch: 45, train_loss: 0.8193, test_loss: 1.0453, test_f1: 0.5111
 epoch: 46, train_loss: 0.8340, test_loss: 1.0417, test_f1: 0.5083
 epoch: 47, train_loss: 0.8083, test_loss: 0.9388, test_f1: 0.5409
 epoch: 48, train_loss: 0.7986, test_loss: 0.9449, test_f1: 0.5646
 epoch: 49, train_loss: 0.7977, test_loss: 1.1296, test_f1: 0.5129
 epoch: 50, train_loss: 0.8085, test_loss: 0.9506, test_f1: 0.5341
 epoch: 51, train_loss: 0.7616, test_loss: 1.0310, test_f1: 0.5754
 epoch: 52, train_loss: 0.7604, test_loss: 0.9156, test_f1: 0.5733
 epoch: 53, train_loss: 0.7604, test_loss: 0.9362, test_f1: 0.5370
 epoch: 54, train_loss: 0.7424, test_loss: 1.0239, test_f1: 0.5570
 epoch: 55, train_loss: 0.7517, test_loss: 1.0009, test_f1: 0.5755
 epoch: 56, train_loss: 0.7361, test_loss: 0.9506, test_f1: 0.5481
 epoch: 57, train_loss: 0.7275, test_loss: 0.9607, test_f1: 0.5663
 epoch: 58, train_loss: 0.7526, test_loss: 0.9510, test_f1: 0.5441
 epoch: 59, train_loss: 0.7325, test_loss: 1.0782, test_f1: 0.5535
 epoch: 60, train_loss: 0.7339, test_loss: 0.9520, test_f1: 0.5863
 epoch: 61, train_loss: 0.7387, test_loss: 1.0036, test_f1: 0.5551
 epoch: 62, train_loss: 0.7397, test_loss: 1.0113, test_f1: 0.5552
 epoch: 63, train_loss: 0.7221, test_loss: 1.0120, test_f1: 0.5729
 epoch: 64, train_loss: 0.7341, test_loss: 1.0029, test_f1: 0.6001
 epoch: 65, train_loss: 0.7262, test_loss: 0.9739, test_f1: 0.5844
 epoch: 66, train_loss: 0.7246, test_loss: 1.0067, test_f1: 0.5528
 epoch: 67, train_loss: 0.7103, test_loss: 0.9458, test_f1: 0.5817
 epoch: 68, train_loss: 0.7153, test_loss: 1.0409, test_f1: 0.5434
 epoch: 69, train_loss: 0.7261, test_loss: 0.9874, test_f1: 0.5481
 epoch: 70, train_loss: 0.7064, test_loss: 1.0267, test_f1: 0.5809
 epoch: 71, train_loss: 0.7322, test_loss: 0.9408, test_f1: 0.5734
 epoch: 72, train_loss: 0.7209, test_loss: 1.0042, test_f1: 0.5883
 epoch: 73, train_loss: 0.7216, test_loss: 0.9803, test_f1: 0.5980
 epoch: 74, train_loss: 0.7046, test_loss: 0.9670, test_f1: 0.6055
 epoch: 75, train_loss: 0.7004, test_loss: 1.0143, test_f1: 0.5679
 epoch: 76, train_loss: 0.6989, test_loss: 1.1123, test_f1: 0.5659
 epoch: 77, train_loss: 0.7062, test_loss: 1.0249, test_f1: 0.5961
 epoch: 78, train_loss: 0.6932, test_loss: 0.9722, test_f1: 0.5850
 epoch: 79, train_loss: 0.6985, test_loss: 1.0160, test_f1: 0.5799
 epoch: 80, train_loss: 0.7044, test_loss: 0.9911, test_f1: 0.5812
 epoch: 81, train_loss: 0.6941, test_loss: 1.0003, test_f1: 0.5680
 epoch: 82, train_loss: 0.6678, test_loss: 1.0101, test_f1: 0.5758
 epoch: 83, train_loss: 0.6899, test_loss: 1.1065, test_f1: 0.5544
 epoch: 84, train_loss: 0.7040, test_loss: 1.0036, test_f1: 0.5932
 epoch: 85, train_loss: 0.7004, test_loss: 1.0359, test_f1: 0.5828
 epoch: 86, train_loss: 0.6716, test_loss: 0.9947, test_f1: 0.6051
 epoch: 87, train_loss: 0.6897, test_loss: 1.1714, test_f1: 0.5570
 epoch: 88, train_loss: 0.6779, test_loss: 1.0508, test_f1: 0.5694
 epoch: 89, train_loss: 0.6765, test_loss: 1.0020, test_f1: 0.5853
 epoch: 90, train_loss: 0.6818, test_loss: 0.9737, test_f1: 0.5894
 epoch: 91, train_loss: 0.6775, test_loss: 1.0254, test_f1: 0.5540
 epoch: 92, train_loss: 0.6606, test_loss: 0.9406, test_f1: 0.5973
 epoch: 93, train_loss: 0.6729, test_loss: 0.9995, test_f1: 0.5674
 epoch: 94, train_loss: 0.6686, test_loss: 1.0311, test_f1: 0.5763
 epoch: 95, train_loss: 0.6490, test_loss: 0.9895, test_f1: 0.5970
 epoch: 96, train_loss: 0.6796, test_loss: 0.9742, test_f1: 0.6175
 epoch: 97, train_loss: 0.6818, test_loss: 1.0812, test_f1: 0.5779
 epoch: 98, train_loss: 0.6683, test_loss: 1.1110, test_f1: 0.5473
 epoch: 99, train_loss: 0.6561, test_loss: 1.0536, test_f1: 0.5898
##################ITERATION #7 ****************************************
 epoch: 0, train_loss: 1.3013, test_loss: 1.2636, test_f1: 0.2779
 epoch: 1, train_loss: 1.2013, test_loss: 1.1224, test_f1: 0.4422
 epoch: 2, train_loss: 1.1545, test_loss: 1.8141, test_f1: 0.3238
 epoch: 3, train_loss: 1.1207, test_loss: 1.0416, test_f1: 0.4967
 epoch: 4, train_loss: 1.0986, test_loss: 1.0353, test_f1: 0.4909
 epoch: 5, train_loss: 1.0649, test_loss: 1.0323, test_f1: 0.4915
 epoch: 6, train_loss: 1.0393, test_loss: 1.0426, test_f1: 0.4966
 epoch: 7, train_loss: 1.0298, test_loss: 0.9722, test_f1: 0.5206
 epoch: 8, train_loss: 0.9975, test_loss: 1.0225, test_f1: 0.4863
 epoch: 9, train_loss: 0.9679, test_loss: 0.9490, test_f1: 0.5339
 epoch: 10, train_loss: 0.9691, test_loss: 0.9242, test_f1: 0.4791
 epoch: 11, train_loss: 0.9568, test_loss: 0.9781, test_f1: 0.5199
 epoch: 12, train_loss: 0.9393, test_loss: 1.0145, test_f1: 0.5229
 epoch: 13, train_loss: 0.9340, test_loss: 0.9602, test_f1: 0.5355
 epoch: 14, train_loss: 0.9255, test_loss: 0.9479, test_f1: 0.5345
 epoch: 15, train_loss: 0.9361, test_loss: 0.9787, test_f1: 0.5332
 epoch: 16, train_loss: 0.9352, test_loss: 0.9990, test_f1: 0.5102
 epoch: 17, train_loss: 0.9220, test_loss: 1.0332, test_f1: 0.5403
 epoch: 18, train_loss: 0.9101, test_loss: 0.9564, test_f1: 0.5170
 epoch: 19, train_loss: 0.8902, test_loss: 0.9172, test_f1: 0.5289
 epoch: 20, train_loss: 0.9113, test_loss: 0.9666, test_f1: 0.5732
 epoch: 21, train_loss: 0.8849, test_loss: 0.9485, test_f1: 0.5555
 epoch: 22, train_loss: 0.9021, test_loss: 0.9703, test_f1: 0.5438
 epoch: 23, train_loss: 0.9163, test_loss: 0.9586, test_f1: 0.5567
 epoch: 24, train_loss: 0.8692, test_loss: 0.9467, test_f1: 0.5145
 epoch: 25, train_loss: 0.8680, test_loss: 0.9615, test_f1: 0.5139
 epoch: 26, train_loss: 0.8572, test_loss: 0.9582, test_f1: 0.5087
 epoch: 27, train_loss: 0.8627, test_loss: 0.9595, test_f1: 0.5404
 epoch: 28, train_loss: 0.8773, test_loss: 1.0241, test_f1: 0.5164
 epoch: 29, train_loss: 0.8548, test_loss: 1.1027, test_f1: 0.4955
 epoch: 30, train_loss: 0.8600, test_loss: 1.0037, test_f1: 0.5375
 epoch: 31, train_loss: 0.8393, test_loss: 1.0074, test_f1: 0.5182
 epoch: 32, train_loss: 0.8526, test_loss: 0.9561, test_f1: 0.5693
 epoch: 33, train_loss: 0.8451, test_loss: 0.9564, test_f1: 0.5336
 epoch: 34, train_loss: 0.8305, test_loss: 0.9172, test_f1: 0.5453
 epoch: 35, train_loss: 0.8262, test_loss: 0.9495, test_f1: 0.5555
 epoch: 36, train_loss: 0.8349, test_loss: 0.9957, test_f1: 0.5088
 epoch: 37, train_loss: 0.8097, test_loss: 0.9587, test_f1: 0.5521
 epoch: 38, train_loss: 0.8052, test_loss: 0.9586, test_f1: 0.5537
 epoch: 39, train_loss: 0.8235, test_loss: 1.0073, test_f1: 0.5518
 epoch: 40, train_loss: 0.8071, test_loss: 1.0210, test_f1: 0.5185
 epoch: 41, train_loss: 0.7986, test_loss: 1.0003, test_f1: 0.5350
 epoch: 42, train_loss: 0.8118, test_loss: 0.9884, test_f1: 0.5477
 epoch: 43, train_loss: 0.8182, test_loss: 0.9925, test_f1: 0.4980
 epoch: 44, train_loss: 0.8180, test_loss: 0.9543, test_f1: 0.5491
 epoch: 45, train_loss: 0.8094, test_loss: 0.9685, test_f1: 0.5571
 epoch: 46, train_loss: 0.7993, test_loss: 1.0684, test_f1: 0.5201
 epoch: 47, train_loss: 0.8031, test_loss: 0.9899, test_f1: 0.5520
 epoch: 48, train_loss: 0.7975, test_loss: 0.9905, test_f1: 0.5632
 epoch: 49, train_loss: 0.7746, test_loss: 1.0703, test_f1: 0.5133
 epoch: 50, train_loss: 0.7930, test_loss: 0.9519, test_f1: 0.5679
 epoch: 51, train_loss: 0.7711, test_loss: 0.9593, test_f1: 0.5684
 epoch: 52, train_loss: 0.7608, test_loss: 0.9681, test_f1: 0.5573
 epoch: 53, train_loss: 0.7446, test_loss: 1.0790, test_f1: 0.5298
 epoch: 54, train_loss: 0.7403, test_loss: 1.0188, test_f1: 0.5836
 epoch: 55, train_loss: 0.7352, test_loss: 0.9882, test_f1: 0.5859
 epoch: 56, train_loss: 0.7276, test_loss: 1.0777, test_f1: 0.5706
 epoch: 57, train_loss: 0.7381, test_loss: 1.0564, test_f1: 0.5599
 epoch: 58, train_loss: 0.7146, test_loss: 1.0780, test_f1: 0.5712
 epoch: 59, train_loss: 0.7167, test_loss: 1.1103, test_f1: 0.5460
 epoch: 60, train_loss: 0.7219, test_loss: 1.0292, test_f1: 0.5731
 epoch: 61, train_loss: 0.7251, test_loss: 1.0076, test_f1: 0.5557
 epoch: 62, train_loss: 0.7215, test_loss: 0.9988, test_f1: 0.5502
 epoch: 63, train_loss: 0.7244, test_loss: 1.0024, test_f1: 0.5722
 epoch: 64, train_loss: 0.7052, test_loss: 1.2566, test_f1: 0.5655
 epoch: 65, train_loss: 0.7110, test_loss: 1.1743, test_f1: 0.5521
 epoch: 66, train_loss: 0.7033, test_loss: 1.0319, test_f1: 0.5619
 epoch: 67, train_loss: 0.6922, test_loss: 1.0203, test_f1: 0.5712
 epoch: 68, train_loss: 0.7147, test_loss: 1.1718, test_f1: 0.5556
 epoch: 69, train_loss: 0.6820, test_loss: 1.1004, test_f1: 0.5760
 epoch: 70, train_loss: 0.6899, test_loss: 1.1333, test_f1: 0.5339
 epoch: 71, train_loss: 0.6932, test_loss: 1.0238, test_f1: 0.5926
 epoch: 72, train_loss: 0.6980, test_loss: 1.1847, test_f1: 0.5396
 epoch: 73, train_loss: 0.7025, test_loss: 1.0834, test_f1: 0.5811
 epoch: 74, train_loss: 0.6894, test_loss: 1.1044, test_f1: 0.5661
 epoch: 75, train_loss: 0.6822, test_loss: 1.1492, test_f1: 0.5735
 epoch: 76, train_loss: 0.6814, test_loss: 1.2702, test_f1: 0.5691
 epoch: 77, train_loss: 0.6792, test_loss: 1.1204, test_f1: 0.5887
 epoch: 78, train_loss: 0.7040, test_loss: 1.1596, test_f1: 0.5852
 epoch: 79, train_loss: 0.6833, test_loss: 1.0472, test_f1: 0.5810
 epoch: 80, train_loss: 0.6874, test_loss: 1.0868, test_f1: 0.5669
 epoch: 81, train_loss: 0.6645, test_loss: 1.0765, test_f1: 0.6027
 epoch: 82, train_loss: 0.6727, test_loss: 1.3023, test_f1: 0.5554
 epoch: 83, train_loss: 0.6731, test_loss: 1.3296, test_f1: 0.5763
 epoch: 84, train_loss: 0.6690, test_loss: 1.3097, test_f1: 0.5687
 epoch: 85, train_loss: 0.6867, test_loss: 1.0920, test_f1: 0.5850
 epoch: 86, train_loss: 0.6889, test_loss: 1.1675, test_f1: 0.6041
 epoch: 87, train_loss: 0.6743, test_loss: 1.1715, test_f1: 0.5670
 epoch: 88, train_loss: 0.6753, test_loss: 1.1155, test_f1: 0.5771
 epoch: 89, train_loss: 0.6486, test_loss: 1.1378, test_f1: 0.5888
 epoch: 90, train_loss: 0.6592, test_loss: 1.3068, test_f1: 0.5610
 epoch: 91, train_loss: 0.6719, test_loss: 1.1991, test_f1: 0.5857
 epoch: 92, train_loss: 0.6641, test_loss: 1.1430, test_f1: 0.5597
 epoch: 93, train_loss: 0.6510, test_loss: 1.3890, test_f1: 0.5581
 epoch: 94, train_loss: 0.6505, test_loss: 1.3385, test_f1: 0.5558
 epoch: 95, train_loss: 0.6401, test_loss: 1.5118, test_f1: 0.5781
 epoch: 96, train_loss: 0.6472, test_loss: 1.1960, test_f1: 0.5955
 epoch: 97, train_loss: 0.6601, test_loss: 1.2438, test_f1: 0.5691
 epoch: 98, train_loss: 0.6418, test_loss: 1.2301, test_f1: 0.5671
 epoch: 99, train_loss: 0.6402, test_loss: 1.2520, test_f1: 0.5666
##################ITERATION #8 ****************************************
 epoch: 0, train_loss: 1.3126, test_loss: 1.2395, test_f1: 0.3942
 epoch: 1, train_loss: 1.2161, test_loss: 1.1326, test_f1: 0.3709
 epoch: 2, train_loss: 1.1540, test_loss: 1.0850, test_f1: 0.3837
 epoch: 3, train_loss: 1.1054, test_loss: 1.1087, test_f1: 0.4905
 epoch: 4, train_loss: 1.0797, test_loss: 1.0416, test_f1: 0.4834
 epoch: 5, train_loss: 1.0829, test_loss: 0.9813, test_f1: 0.5122
 epoch: 6, train_loss: 1.0213, test_loss: 1.0969, test_f1: 0.4882
 epoch: 7, train_loss: 1.0179, test_loss: 1.0441, test_f1: 0.5077
 epoch: 8, train_loss: 0.9960, test_loss: 1.0237, test_f1: 0.5031
 epoch: 9, train_loss: 0.9914, test_loss: 1.0456, test_f1: 0.4772
 epoch: 10, train_loss: 0.9770, test_loss: 1.0383, test_f1: 0.5016
 epoch: 11, train_loss: 0.9613, test_loss: 1.0026, test_f1: 0.5317
 epoch: 12, train_loss: 0.9582, test_loss: 1.0471, test_f1: 0.5015
 epoch: 13, train_loss: 0.9458, test_loss: 1.0099, test_f1: 0.5087
 epoch: 14, train_loss: 0.9432, test_loss: 1.0999, test_f1: 0.4413
 epoch: 15, train_loss: 0.9375, test_loss: 1.0705, test_f1: 0.4767
 epoch: 16, train_loss: 0.9381, test_loss: 1.0135, test_f1: 0.4906
 epoch: 17, train_loss: 0.9302, test_loss: 1.0067, test_f1: 0.5028
 epoch: 18, train_loss: 0.9325, test_loss: 1.0304, test_f1: 0.4629
 epoch: 19, train_loss: 0.9096, test_loss: 0.9977, test_f1: 0.4878
 epoch: 20, train_loss: 0.9138, test_loss: 1.0515, test_f1: 0.4963
 epoch: 21, train_loss: 0.8929, test_loss: 1.0430, test_f1: 0.4976
 epoch: 22, train_loss: 0.9094, test_loss: 1.0061, test_f1: 0.4968
 epoch: 23, train_loss: 0.8929, test_loss: 1.0234, test_f1: 0.4964
 epoch: 24, train_loss: 0.9166, test_loss: 1.0710, test_f1: 0.4756
 epoch: 25, train_loss: 0.9025, test_loss: 1.0365, test_f1: 0.4955
 epoch: 26, train_loss: 0.8801, test_loss: 0.9607, test_f1: 0.5022
 epoch: 27, train_loss: 0.8785, test_loss: 1.0150, test_f1: 0.4995
 epoch: 28, train_loss: 0.8657, test_loss: 1.0616, test_f1: 0.4827
 epoch: 29, train_loss: 0.8666, test_loss: 1.2872, test_f1: 0.4845
 epoch: 30, train_loss: 0.8777, test_loss: 0.9755, test_f1: 0.4936
 epoch: 31, train_loss: 0.8653, test_loss: 1.0234, test_f1: 0.4974
 epoch: 32, train_loss: 0.8618, test_loss: 1.0458, test_f1: 0.4963
 epoch: 33, train_loss: 0.8450, test_loss: 1.0382, test_f1: 0.5015
 epoch: 34, train_loss: 0.8425, test_loss: 1.0121, test_f1: 0.4859
 epoch: 35, train_loss: 0.8451, test_loss: 1.0786, test_f1: 0.4713
 epoch: 36, train_loss: 0.8395, test_loss: 1.0912, test_f1: 0.4797
 epoch: 37, train_loss: 0.8525, test_loss: 1.2295, test_f1: 0.4910
 epoch: 38, train_loss: 0.8392, test_loss: 1.1686, test_f1: 0.4879
 epoch: 39, train_loss: 0.8391, test_loss: 1.0049, test_f1: 0.5109
 epoch: 40, train_loss: 0.8155, test_loss: 0.9901, test_f1: 0.5045
 epoch: 41, train_loss: 0.8180, test_loss: 1.0910, test_f1: 0.4925
 epoch: 42, train_loss: 0.8323, test_loss: 1.1547, test_f1: 0.4913
 epoch: 43, train_loss: 0.8308, test_loss: 1.1522, test_f1: 0.4970
 epoch: 44, train_loss: 0.8305, test_loss: 1.0286, test_f1: 0.5035
 epoch: 45, train_loss: 0.8205, test_loss: 0.9764, test_f1: 0.5421
 epoch: 46, train_loss: 0.8364, test_loss: 1.2263, test_f1: 0.4654
 epoch: 47, train_loss: 0.8111, test_loss: 1.0548, test_f1: 0.5233
 epoch: 48, train_loss: 0.8240, test_loss: 1.0803, test_f1: 0.4726
 epoch: 49, train_loss: 0.8544, test_loss: 1.0608, test_f1: 0.5109
 epoch: 50, train_loss: 0.8218, test_loss: 1.1354, test_f1: 0.4969
 epoch: 51, train_loss: 0.7949, test_loss: 1.0137, test_f1: 0.5199
 epoch: 52, train_loss: 0.7643, test_loss: 1.0395, test_f1: 0.5272
 epoch: 53, train_loss: 0.7718, test_loss: 1.0811, test_f1: 0.5064
 epoch: 54, train_loss: 0.7692, test_loss: 1.0854, test_f1: 0.5003
 epoch: 55, train_loss: 0.7494, test_loss: 1.0615, test_f1: 0.5135
 epoch: 56, train_loss: 0.7516, test_loss: 1.0620, test_f1: 0.5151
 epoch: 57, train_loss: 0.7661, test_loss: 1.1447, test_f1: 0.5252
 epoch: 58, train_loss: 0.7563, test_loss: 1.1318, test_f1: 0.5554
 epoch: 59, train_loss: 0.7495, test_loss: 1.1259, test_f1: 0.5167
 epoch: 60, train_loss: 0.7411, test_loss: 1.1523, test_f1: 0.5625
 epoch: 61, train_loss: 0.7493, test_loss: 1.1987, test_f1: 0.4956
 epoch: 62, train_loss: 0.7379, test_loss: 1.2279, test_f1: 0.5109
 epoch: 63, train_loss: 0.7446, test_loss: 1.1891, test_f1: 0.5196
 epoch: 64, train_loss: 0.7303, test_loss: 1.2137, test_f1: 0.5589
 epoch: 65, train_loss: 0.7414, test_loss: 1.1547, test_f1: 0.5519
 epoch: 66, train_loss: 0.7475, test_loss: 1.1637, test_f1: 0.5647
 epoch: 67, train_loss: 0.7478, test_loss: 1.0709, test_f1: 0.5605
 epoch: 68, train_loss: 0.7404, test_loss: 1.1634, test_f1: 0.5529
 epoch: 69, train_loss: 0.7304, test_loss: 1.1393, test_f1: 0.5528
 epoch: 70, train_loss: 0.7342, test_loss: 1.1896, test_f1: 0.5561
 epoch: 71, train_loss: 0.7231, test_loss: 1.2248, test_f1: 0.5415
 epoch: 72, train_loss: 0.7212, test_loss: 1.2321, test_f1: 0.5490
 epoch: 73, train_loss: 0.7389, test_loss: 1.3445, test_f1: 0.5118
 epoch: 74, train_loss: 0.7299, test_loss: 1.1587, test_f1: 0.5533
 epoch: 75, train_loss: 0.7094, test_loss: 1.3086, test_f1: 0.5340
 epoch: 76, train_loss: 0.7040, test_loss: 1.1682, test_f1: 0.5633
 epoch: 77, train_loss: 0.7250, test_loss: 1.1388, test_f1: 0.5666
 epoch: 78, train_loss: 0.7117, test_loss: 1.1840, test_f1: 0.5629
 epoch: 79, train_loss: 0.7244, test_loss: 1.2823, test_f1: 0.5516
 epoch: 80, train_loss: 0.7080, test_loss: 1.3342, test_f1: 0.5189
 epoch: 81, train_loss: 0.7100, test_loss: 1.2836, test_f1: 0.5616
 epoch: 82, train_loss: 0.7128, test_loss: 1.2899, test_f1: 0.5310
 epoch: 83, train_loss: 0.7088, test_loss: 1.3040, test_f1: 0.5480
 epoch: 84, train_loss: 0.7029, test_loss: 1.2798, test_f1: 0.5633
 epoch: 85, train_loss: 0.7140, test_loss: 1.2971, test_f1: 0.5254
 epoch: 86, train_loss: 0.6986, test_loss: 1.3555, test_f1: 0.5501
 epoch: 87, train_loss: 0.6972, test_loss: 1.3011, test_f1: 0.5551
 epoch: 88, train_loss: 0.6994, test_loss: 1.2290, test_f1: 0.5589
 epoch: 89, train_loss: 0.6930, test_loss: 1.2861, test_f1: 0.5527
 epoch: 90, train_loss: 0.7026, test_loss: 1.3263, test_f1: 0.5299
 epoch: 91, train_loss: 0.7087, test_loss: 1.3230, test_f1: 0.4916
 epoch: 92, train_loss: 0.6962, test_loss: 1.1749, test_f1: 0.5835
 epoch: 93, train_loss: 0.7065, test_loss: 1.2345, test_f1: 0.5306
 epoch: 94, train_loss: 0.7057, test_loss: 1.4118, test_f1: 0.5323
 epoch: 95, train_loss: 0.6924, test_loss: 1.5698, test_f1: 0.5236
 epoch: 96, train_loss: 0.6853, test_loss: 1.2660, test_f1: 0.5586
 epoch: 97, train_loss: 0.6851, test_loss: 1.3731, test_f1: 0.5580
 epoch: 98, train_loss: 0.6892, test_loss: 1.2621, test_f1: 0.5522
 epoch: 99, train_loss: 0.6863, test_loss: 1.4677, test_f1: 0.5135
##################ITERATION #9 ****************************************
 epoch: 0, train_loss: 1.3012, test_loss: 1.2178, test_f1: 0.3753
 epoch: 1, train_loss: 1.1993, test_loss: 1.1206, test_f1: 0.4149
 epoch: 2, train_loss: 1.1292, test_loss: 1.0501, test_f1: 0.4475
 epoch: 3, train_loss: 1.0931, test_loss: 1.2183, test_f1: 0.3885
 epoch: 4, train_loss: 1.0746, test_loss: 0.9799, test_f1: 0.4630
 epoch: 5, train_loss: 1.0454, test_loss: 0.9732, test_f1: 0.4695
 epoch: 6, train_loss: 1.0407, test_loss: 0.9378, test_f1: 0.4927
 epoch: 7, train_loss: 1.0261, test_loss: 0.9968, test_f1: 0.4600
 epoch: 8, train_loss: 1.0022, test_loss: 0.9574, test_f1: 0.5073
 epoch: 9, train_loss: 0.9927, test_loss: 0.9925, test_f1: 0.4777
 epoch: 10, train_loss: 0.9837, test_loss: 1.0152, test_f1: 0.4968
 epoch: 11, train_loss: 0.9755, test_loss: 0.9920, test_f1: 0.5061
 epoch: 12, train_loss: 0.9518, test_loss: 0.9508, test_f1: 0.5080
 epoch: 13, train_loss: 0.9567, test_loss: 0.9888, test_f1: 0.5013
 epoch: 14, train_loss: 0.9485, test_loss: 0.9705, test_f1: 0.5018
 epoch: 15, train_loss: 0.9337, test_loss: 0.9765, test_f1: 0.5189
 epoch: 16, train_loss: 0.9484, test_loss: 0.9504, test_f1: 0.4923
 epoch: 17, train_loss: 0.9211, test_loss: 0.9773, test_f1: 0.5082
 epoch: 18, train_loss: 0.9355, test_loss: 0.9580, test_f1: 0.5062
 epoch: 19, train_loss: 0.9289, test_loss: 1.0525, test_f1: 0.4775
 epoch: 20, train_loss: 0.9231, test_loss: 1.0042, test_f1: 0.5028
 epoch: 21, train_loss: 0.9120, test_loss: 0.9868, test_f1: 0.5118
 epoch: 22, train_loss: 0.8963, test_loss: 1.0645, test_f1: 0.5051
 epoch: 23, train_loss: 0.8893, test_loss: 0.9797, test_f1: 0.5193
 epoch: 24, train_loss: 0.9007, test_loss: 0.9446, test_f1: 0.5056
 epoch: 25, train_loss: 0.8787, test_loss: 0.9910, test_f1: 0.4715
 epoch: 26, train_loss: 0.9213, test_loss: 0.9179, test_f1: 0.5622
 epoch: 27, train_loss: 0.9344, test_loss: 0.9295, test_f1: 0.4956
 epoch: 28, train_loss: 0.8977, test_loss: 1.0012, test_f1: 0.4919
 epoch: 29, train_loss: 0.9054, test_loss: 1.0111, test_f1: 0.5144
 epoch: 30, train_loss: 0.8867, test_loss: 1.0030, test_f1: 0.5206
 epoch: 31, train_loss: 0.8679, test_loss: 1.0450, test_f1: 0.4881
 epoch: 32, train_loss: 0.8980, test_loss: 0.9646, test_f1: 0.5175
 epoch: 33, train_loss: 0.8849, test_loss: 1.0291, test_f1: 0.5192
 epoch: 34, train_loss: 0.8661, test_loss: 0.9840, test_f1: 0.5062
 epoch: 35, train_loss: 0.8968, test_loss: 0.9945, test_f1: 0.4895
 epoch: 36, train_loss: 0.8715, test_loss: 1.1127, test_f1: 0.4624
 epoch: 37, train_loss: 0.9078, test_loss: 1.0168, test_f1: 0.5104
 epoch: 38, train_loss: 0.8611, test_loss: 1.0323, test_f1: 0.5128
 epoch: 39, train_loss: 0.8724, test_loss: 0.9796, test_f1: 0.5292
 epoch: 40, train_loss: 0.8511, test_loss: 1.0081, test_f1: 0.4860
 epoch: 41, train_loss: 0.8507, test_loss: 1.0419, test_f1: 0.4889
 epoch: 42, train_loss: 0.8495, test_loss: 1.0907, test_f1: 0.5523
 epoch: 43, train_loss: 0.8560, test_loss: 1.0704, test_f1: 0.5199
 epoch: 44, train_loss: 0.8981, test_loss: 1.0004, test_f1: 0.5294
 epoch: 45, train_loss: 0.8587, test_loss: 1.1405, test_f1: 0.5330
 epoch: 46, train_loss: 0.8367, test_loss: 1.2518, test_f1: 0.5173
 epoch: 47, train_loss: 0.8285, test_loss: 1.2802, test_f1: 0.5073
 epoch: 48, train_loss: 0.8291, test_loss: 1.0646, test_f1: 0.5210
 epoch: 49, train_loss: 0.8210, test_loss: 1.1456, test_f1: 0.5278
 epoch: 50, train_loss: 0.8171, test_loss: 1.0174, test_f1: 0.5691
 epoch: 51, train_loss: 0.7995, test_loss: 1.0125, test_f1: 0.5713
 epoch: 52, train_loss: 0.7883, test_loss: 1.0740, test_f1: 0.5637
 epoch: 53, train_loss: 0.7776, test_loss: 1.0632, test_f1: 0.5472
 epoch: 54, train_loss: 0.7686, test_loss: 0.9899, test_f1: 0.5737
 epoch: 55, train_loss: 0.7764, test_loss: 1.0306, test_f1: 0.5509
 epoch: 56, train_loss: 0.7820, test_loss: 1.1756, test_f1: 0.5467
 epoch: 57, train_loss: 0.7769, test_loss: 1.1695, test_f1: 0.5567
 epoch: 58, train_loss: 0.7680, test_loss: 0.9684, test_f1: 0.5736
 epoch: 59, train_loss: 0.7684, test_loss: 1.2233, test_f1: 0.5411
 epoch: 60, train_loss: 0.7714, test_loss: 1.2093, test_f1: 0.5374
 epoch: 61, train_loss: 0.7587, test_loss: 1.0438, test_f1: 0.5814
 epoch: 62, train_loss: 0.7721, test_loss: 1.0041, test_f1: 0.5823
 epoch: 63, train_loss: 0.7558, test_loss: 1.0622, test_f1: 0.5825
 epoch: 64, train_loss: 0.7488, test_loss: 1.1364, test_f1: 0.5539
 epoch: 65, train_loss: 0.7607, test_loss: 1.0268, test_f1: 0.5600
 epoch: 66, train_loss: 0.7463, test_loss: 1.1928, test_f1: 0.5458
 epoch: 67, train_loss: 0.7389, test_loss: 1.2496, test_f1: 0.5508
 epoch: 68, train_loss: 0.7505, test_loss: 1.0596, test_f1: 0.5824
 epoch: 69, train_loss: 0.7409, test_loss: 1.0250, test_f1: 0.5928
 epoch: 70, train_loss: 0.7495, test_loss: 1.0525, test_f1: 0.5885
 epoch: 71, train_loss: 0.7404, test_loss: 1.0342, test_f1: 0.5594
 epoch: 72, train_loss: 0.7317, test_loss: 1.1122, test_f1: 0.5723
 epoch: 73, train_loss: 0.7444, test_loss: 1.0491, test_f1: 0.5871
 epoch: 74, train_loss: 0.7115, test_loss: 1.0782, test_f1: 0.5711
 epoch: 75, train_loss: 0.7215, test_loss: 1.0206, test_f1: 0.5648
 epoch: 76, train_loss: 0.7379, test_loss: 1.1037, test_f1: 0.5523
 epoch: 77, train_loss: 0.7327, test_loss: 1.0927, test_f1: 0.5455
 epoch: 78, train_loss: 0.7213, test_loss: 1.4686, test_f1: 0.5349
 epoch: 79, train_loss: 0.7418, test_loss: 0.9771, test_f1: 0.5775
 epoch: 80, train_loss: 0.7398, test_loss: 1.1936, test_f1: 0.5624
 epoch: 81, train_loss: 0.7274, test_loss: 1.1537, test_f1: 0.5541
 epoch: 82, train_loss: 0.7173, test_loss: 1.1268, test_f1: 0.5437
 epoch: 83, train_loss: 0.7108, test_loss: 1.1359, test_f1: 0.5736
 epoch: 84, train_loss: 0.7230, test_loss: 1.1375, test_f1: 0.5501
 epoch: 85, train_loss: 0.7302, test_loss: 1.0040, test_f1: 0.5882
 epoch: 86, train_loss: 0.7272, test_loss: 1.0410, test_f1: 0.5617
 epoch: 87, train_loss: 0.6920, test_loss: 1.0433, test_f1: 0.5807
 epoch: 88, train_loss: 0.7070, test_loss: 1.4258, test_f1: 0.5462
 epoch: 89, train_loss: 0.7120, test_loss: 1.0601, test_f1: 0.5830
 epoch: 90, train_loss: 0.7084, test_loss: 1.0875, test_f1: 0.5839
 epoch: 91, train_loss: 0.7039, test_loss: 1.0379, test_f1: 0.5780
 epoch: 92, train_loss: 0.6950, test_loss: 1.0294, test_f1: 0.5952
 epoch: 93, train_loss: 0.7027, test_loss: 1.0444, test_f1: 0.5949
 epoch: 94, train_loss: 0.6989, test_loss: 1.1571, test_f1: 0.5564
 epoch: 95, train_loss: 0.6927, test_loss: 1.0382, test_f1: 0.5548
 epoch: 96, train_loss: 0.6886, test_loss: 1.1927, test_f1: 0.5413
 epoch: 97, train_loss: 0.7004, test_loss: 1.1594, test_f1: 0.5728
 epoch: 98, train_loss: 0.6876, test_loss: 1.1003, test_f1: 0.5916
 epoch: 99, train_loss: 0.6700, test_loss: 1.1782, test_f1: 0.5595

Training completed in 747.10 seconds
Best F1: 0.6175 at epoch 96
Mean F1 across iterations: 0.5977  0.0103
========================FINAL RESULTS================================
FEGIN weighted F1: 0.6175  0.0103
python main.py --data ltspice_examples --representation component_component --model FEGIN --layers 5 --hiddens 32 --batch_size 64 --lr 0.01 --emb_size 128 --epochs 100 --save_appendix component_component_L5_H32_BS64_LR0.01_E128 --no_val
-----



STDERR:
  File "main.py", line 370, in <module>
    main()
  File "main.py", line 254, in main
    dataset = dataset_class(
  File "/home/philip/projects/ltspice_examples_code_repo/Circuit-Completion-Using-GNNs/component_classification_with_link_prediction_head/evaluation/FEGIN/kernel/circuit_datasets.py", line 15, in __init__
    self.data, self.slices = torch.load(self.processed_paths[0])
  File "/home/philip/.local/lib/python3.8/site-packages/torch/serialization.py", line 1040, in load
    warnings.warn(
  File "/usr/lib/python3.8/warnings.py", line 109, in _showwarnmsg
    sw(msg.message, msg.category, msg.filename, msg.lineno,
  File "main.py", line 47, in warn_with_traceback
    traceback.print_stack(file=log)
/home/philip/projects/ltspice_examples_code_repo/Circuit-Completion-Using-GNNs/component_classification_with_link_prediction_head/evaluation/FEGIN/kernel/circuit_datasets.py:15: FutureWarning: You are using `torch.load` with `weights_only=False` (the current default value), which uses the default pickle module implicitly. It is possible to construct malicious pickle data which will execute arbitrary code during unpickling (See https://github.com/pytorch/pytorch/blob/main/SECURITY.md#untrusted-models for more details). In a future release, the default value for `weights_only` will be flipped to `True`. This limits the functions that could be executed during unpickling. Arbitrary objects will no longer be allowed to be loaded via this mode unless they are explicitly allowlisted by the user via `torch.serialization.add_safe_globals`. We recommend you start setting `weights_only=True` for any use case where you don't have full control of the loaded file. Please open an issue on GitHub for any issues related to this experimental feature.
  self.data, self.slices = torch.load(self.processed_paths[0])
